ob1=OBI(cluster=1,init_unit_cpu=2);
ob1.force_stop;
ob1.clean_backup_dest;
ob1.reboot;
ob1.mysql alter system set resource_hard_limit= 800;
drop tenant if exists oracle;
drop resource pool if exists oblog_pool;
drop resource unit if exists oblog_box;
ob1.mysql create resource unit oblog_box max_cpu 2, memory_size='20G';
ob1.mysql create resource pool oblog_pool unit = 'oblog_box', unit_num = 1;
ob1.mysql create tenant oracle replica_num = 1, resource_pool_list=('oblog_pool') set ob_tcp_invited_nodes='%', ob_compatibility_mode='oracle';
ob1.mysql alter tenant oracle set variables autocommit='on';
ob1.mysql alter tenant oracle set variables nls_date_format='YYYY-MM-DD HH24:MI:SS';
ob1.mysql alter tenant oracle set variables nls_timestamp_format='YYYY-MM-DD HH24:MI:SS.FF';
ob1.mysql alter tenant oracle set variables nls_timestamp_tz_format='YYYY-MM-DD HH24:MI:SS.FF TZR TZD';
create user obtest IDENTIFIED BY "obtest";
grant all on *.* to obtest WITH GRANT OPTION;
grant dba to obtest;
alter session set current_schema = oblog_db;
ob1.check_until_timeout select count(*) as num from oceanbase.__all_virtual_archive_stat, 0, 60;
ob1.mysql alter system archivelog;
ob1.check_until_timeout select status from oceanbase.CDB_OB_ARCHIVELOG where tenant_id=$backup_tenant_id, DOING, 600;
ob1.oblog.gen_conf tb_white_list=oracle.*.* log_level=DEBUG sort_trans_participants=1 test_mode_force_fetch_archive=1 skip_ob_version_compat_check=1;
ob1.oblog.restart;
create table t0(c0 int, c1 int, c2 int, c3 int as(c0+c1+c2), c4 int as(c2+c1+c0), c5 int as(c0+c0+c0)) PARTITION BY hash(c5, c3) SUBPARTITION BY RANGE(c4) subpartition template (SUBPARTITION sp0 VALUES less than(100),SUBPARTITION sp1 VALUES less than(5000)) partitions 3;
ob1.oblog.next;
[R0] record_type:EDDL;[R0] db_name:oracle.OBLOG_DB;[R0] table_name:;[R0] column_count:1;[R0] column_name:ddl;[R0] ddl_stmt_str: create table t0(c0 int, c1 int, c2 int, c3 int as(c0+c1+c2), c4 int as(c2+c1+c0), c5 int as(c0+c0+c0)) PARTITION BY hash(c5, c3) SUBPARTITION BY RANGE(c4) subpartition template (SUBPARTITION sp0 VALUES less than(100),SUBPARTITION sp1 VALUES less than(5000)) partitions 3;[R0] ddl_stmt_len: 270;
alter table t0 enable row movement;
ob1.oblog.next;
[R0] record_type:EDDL;[R0] db_name:oracle.OBLOG_DB;[R0] table_name:;[R0] column_count:1;[R0] column_name:ddl;[R0] ddl_stmt_str: alter table t0 enable row movement;[R0] ddl_stmt_len: 34;
insert into t0(c0, c1, c2) values(1,2,3);
ob1.oblog.next;
[R0] BEGIN;[R0] org_cluster_id:1;[R1] record_type:INSERT;[R1] database_name:oracle.OBLOG_DB;[R1] table_name:T0;[R1] log_event:true;[R1] column_count:4;[R1] source_category:SRC_FULL_RECORDED;[R1] source_type:SRC_OCEANBASE_1_0;[R1] has_pk:true;[R1] pk_info:(0,1,2,3);[R1] pks:__pk_increment,C0,C1,C2;[R1] has_uk:false;[R1] uk_info:(null);[R1] uks:(null);[R1] [C1] column_name:__pk_increment;[R1] [C1] column_type:MYSQL_TYPE_LONGLONG;[R1] [C1] column_is_rowkey:true;[R1] [C1] column_is_signed:false;[R1] [C1] column_encoding:binary;[R1] [C1] column_is_not_null:true;[R1] [C1] column_value_new:[1](1);[R1] [C2] column_name:C0;[R1] [C2] column_type:MYSQL_TYPE_NEWDECIMAL;[R1] [C2] column_is_rowkey:false;[R1] [C2] column_is_signed:true;[R1] [C2] column_encoding:binary;[R1] [C2] column_is_not_null:false;[R1] [C2] column_value_new:[1](1);[R1] [C3] column_name:C1;[R1] [C3] column_type:MYSQL_TYPE_NEWDECIMAL;[R1] [C3] column_is_rowkey:false;[R1] [C3] column_is_signed:true;[R1] [C3] column_encoding:binary;[R1] [C3] column_is_not_null:false;[R1] [C3] column_value_new:[2](1);[R1] [C4] column_name:C2;[R1] [C4] column_type:MYSQL_TYPE_NEWDECIMAL;[R1] [C4] column_is_rowkey:false;[R1] [C4] column_is_signed:true;[R1] [C4] column_encoding:binary;[R1] [C4] column_is_not_null:false;[R1] [C4] column_value_new:[3](1);$[R2] COMMIT;
insert into t0(c0, c1, c2) values(4,5,6);
ob1.oblog.next;
[R0] BEGIN;[R0] org_cluster_id:1;[R1] record_type:INSERT;[R1] database_name:oracle.OBLOG_DB;[R1] table_name:T0;[R1] log_event:true;[R1] column_count:4;[R1] source_category:SRC_FULL_RECORDED;[R1] source_type:SRC_OCEANBASE_1_0;[R1] has_pk:true;[R1] pk_info:(0,1,2,3);[R1] pks:__pk_increment,C0,C1,C2;[R1] has_uk:false;[R1] uk_info:(null);[R1] uks:(null);[R1] [C1] column_name:__pk_increment;[R1] [C1] column_type:MYSQL_TYPE_LONGLONG;[R1] [C1] column_is_rowkey:true;[R1] [C1] column_is_signed:false;[R1] [C1] column_encoding:binary;[R1] [C1] column_is_not_null:true;[R1] [C1] column_value_new:[2](1);[R1] [C2] column_name:C0;[R1] [C2] column_type:MYSQL_TYPE_NEWDECIMAL;[R1] [C2] column_is_rowkey:false;[R1] [C2] column_is_signed:true;[R1] [C2] column_encoding:binary;[R1] [C2] column_is_not_null:false;[R1] [C2] column_value_new:[4](1);[R1] [C3] column_name:C1;[R1] [C3] column_type:MYSQL_TYPE_NEWDECIMAL;[R1] [C3] column_is_rowkey:false;[R1] [C3] column_is_signed:true;[R1] [C3] column_encoding:binary;[R1] [C3] column_is_not_null:false;[R1] [C3] column_value_new:[5](1);[R1] [C4] column_name:C2;[R1] [C4] column_type:MYSQL_TYPE_NEWDECIMAL;[R1] [C4] column_is_rowkey:false;[R1] [C4] column_is_signed:true;[R1] [C4] column_encoding:binary;[R1] [C4] column_is_not_null:false;[R1] [C4] column_value_new:[6](1);$[R2] COMMIT;
insert into t0(c0, c1, c2) values(7,8,9);
ob1.oblog.next;
[R0] BEGIN;[R0] org_cluster_id:1;[R1] record_type:INSERT;[R1] database_name:oracle.OBLOG_DB;[R1] table_name:T0;[R1] log_event:true;[R1] column_count:4;[R1] source_category:SRC_FULL_RECORDED;[R1] source_type:SRC_OCEANBASE_1_0;[R1] has_pk:true;[R1] pk_info:(0,1,2,3);[R1] pks:__pk_increment,C0,C1,C2;[R1] has_uk:false;[R1] uk_info:(null);[R1] uks:(null);[R1] [C1] column_name:__pk_increment;[R1] [C1] column_type:MYSQL_TYPE_LONGLONG;[R1] [C1] column_is_rowkey:true;[R1] [C1] column_is_signed:false;[R1] [C1] column_encoding:binary;[R1] [C1] column_is_not_null:true;[R1] [C1] column_value_new:[3](1);[R1] [C2] column_name:C0;[R1] [C2] column_type:MYSQL_TYPE_NEWDECIMAL;[R1] [C2] column_is_rowkey:false;[R1] [C2] column_is_signed:true;[R1] [C2] column_encoding:binary;[R1] [C2] column_is_not_null:false;[R1] [C2] column_value_new:[7](1);[R1] [C3] column_name:C1;[R1] [C3] column_type:MYSQL_TYPE_NEWDECIMAL;[R1] [C3] column_is_rowkey:false;[R1] [C3] column_is_signed:true;[R1] [C3] column_encoding:binary;[R1] [C3] column_is_not_null:false;[R1] [C3] column_value_new:[8](1);[R1] [C4] column_name:C2;[R1] [C4] column_type:MYSQL_TYPE_NEWDECIMAL;[R1] [C4] column_is_rowkey:false;[R1] [C4] column_is_signed:true;[R1] [C4] column_encoding:binary;[R1] [C4] column_is_not_null:false;[R1] [C4] column_value_new:[9](1);$[R2] COMMIT;
select c0, c1, c2, rowid from t0;
C0	C1	C2	ROWID
1	2	3	gAADDUMAAAAAAQ==
4	5	6	gAADDUMAAAAAAg==
7	8	9	gAADDUMAAAAAAw==
create table t1(c0 rowid, c1 urowid, c2 int) partition by hash(c2);
ob1.oblog.next;
[R0] record_type:EDDL;[R0] db_name:oracle.OBLOG_DB;[R0] table_name:;[R0] column_count:1;[R0] column_name:ddl;[R0] ddl_stmt_str: create table t1(c0 rowid, c1 urowid, c2 int) partition by hash(c2);[R0] ddl_stmt_len: 66;
insert into t1(c0, c1, c2) select rowid, rowid, c3 from t0;
ob1.oblog.next;
[R0] BEGIN;[R0] org_cluster_id:1;[R1] record_type:INSERT;[R1] database_name:oracle.OBLOG_DB;[R1] table_name:T1;[R1] log_event:true;[R1] column_count:4;[R1] source_category:SRC_FULL_RECORDED;[R1] source_type:SRC_OCEANBASE_1_0;[R1] has_pk:true;[R1] pk_info:(0,3);[R1] pks:__pk_increment,C2;[R1] has_uk:false;[R1] uk_info:(null);[R1] uks:(null);[R1] [C1] column_name:__pk_increment;[R1] [C1] column_type:MYSQL_TYPE_LONGLONG;[R1] [C1] column_is_rowkey:true;[R1] [C1] column_is_signed:false;[R1] [C1] column_encoding:binary;[R1] [C1] column_is_not_null:true;[R1] [C1] column_value_new:[1](1);[R1] [C2] column_name:C0;[R1] [C2] column_type:MYSQL_TYPE_OB_UROWID;[R1] [C2] column_is_rowkey:false;[R1] [C2] column_is_signed:true;[R1] [C2] column_encoding:binary;[R1] [C2] column_is_not_null:false;[R1] [C2] column_value_new:[gAADDUMAAAAAAQ==](16);[R1] [C3] column_name:C1;[R1] [C3] column_type:MYSQL_TYPE_OB_UROWID;[R1] [C3] column_is_rowkey:false;[R1] [C3] column_is_signed:true;[R1] [C3] column_encoding:binary;[R1] [C3] column_is_not_null:false;[R1] [C3] column_value_new:[gAADDUMAAAAAAQ==](16);[R1] [C4] column_name:C2;[R1] [C4] column_type:MYSQL_TYPE_NEWDECIMAL;[R1] [C4] column_is_rowkey:false;[R1] [C4] column_is_signed:true;[R1] [C4] column_encoding:binary;[R1] [C4] column_is_not_null:false;[R1] [C4] column_value_new:[6](1);$[R2] record_type:INSERT;[R2] database_name:oracle.OBLOG_DB;[R2] table_name:T1;[R2] log_event:true;[R2] column_count:4;[R2] source_category:SRC_FULL_RECORDED;[R2] source_type:SRC_OCEANBASE_1_0;[R2] has_pk:true;[R2] pk_info:(0,3);[R2] pks:__pk_increment,C2;[R2] has_uk:false;[R2] uk_info:(null);[R2] uks:(null);[R2] [C1] column_name:__pk_increment;[R2] [C1] column_type:MYSQL_TYPE_LONGLONG;[R2] [C1] column_is_rowkey:true;[R2] [C1] column_is_signed:false;[R2] [C1] column_encoding:binary;[R2] [C1] column_is_not_null:true;[R2] [C1] column_value_new:[2](1);[R2] [C2] column_name:C0;[R2] [C2] column_type:MYSQL_TYPE_OB_UROWID;[R2] [C2] column_is_rowkey:false;[R2] [C2] column_is_signed:true;[R2] [C2] column_encoding:binary;[R2] [C2] column_is_not_null:false;[R2] [C2] column_value_new:[gAADDUMAAAAAAg==](16);[R2] [C3] column_name:C1;[R2] [C3] column_type:MYSQL_TYPE_OB_UROWID;[R2] [C3] column_is_rowkey:false;[R2] [C3] column_is_signed:true;[R2] [C3] column_encoding:binary;[R2] [C3] column_is_not_null:false;[R2] [C3] column_value_new:[gAADDUMAAAAAAg==](16);[R2] [C4] column_name:C2;[R2] [C4] column_type:MYSQL_TYPE_NEWDECIMAL;[R2] [C4] column_is_rowkey:false;[R2] [C4] column_is_signed:true;[R2] [C4] column_encoding:binary;[R2] [C4] column_is_not_null:false;[R2] [C4] column_value_new:[15](2);$[R3] record_type:INSERT;[R3] database_name:oracle.OBLOG_DB;[R3] table_name:T1;[R3] log_event:true;[R3] column_count:4;[R3] source_category:SRC_FULL_RECORDED;[R3] source_type:SRC_OCEANBASE_1_0;[R3] has_pk:true;[R3] pk_info:(0,3);[R3] pks:__pk_increment,C2;[R3] has_uk:false;[R3] uk_info:(null);[R3] uks:(null);[R3] [C1] column_name:__pk_increment;[R3] [C1] column_type:MYSQL_TYPE_LONGLONG;[R3] [C1] column_is_rowkey:true;[R3] [C1] column_is_signed:false;[R3] [C1] column_encoding:binary;[R3] [C1] column_is_not_null:true;[R3] [C1] column_value_new:[3](1);[R3] [C2] column_name:C0;[R3] [C2] column_type:MYSQL_TYPE_OB_UROWID;[R3] [C2] column_is_rowkey:false;[R3] [C2] column_is_signed:true;[R3] [C2] column_encoding:binary;[R3] [C2] column_is_not_null:false;[R3] [C2] column_value_new:[gAADDUMAAAAAAw==](16);[R3] [C3] column_name:C1;[R3] [C3] column_type:MYSQL_TYPE_OB_UROWID;[R3] [C3] column_is_rowkey:false;[R3] [C3] column_is_signed:true;[R3] [C3] column_encoding:binary;[R3] [C3] column_is_not_null:false;[R3] [C3] column_value_new:[gAADDUMAAAAAAw==](16);[R3] [C4] column_name:C2;[R3] [C4] column_type:MYSQL_TYPE_NEWDECIMAL;[R3] [C4] column_is_rowkey:false;[R3] [C4] column_is_signed:true;[R3] [C4] column_encoding:binary;[R3] [C4] column_is_not_null:false;[R3] [C4] column_value_new:[24](2);$[R4] COMMIT;
insert into t1(c0, c1, c2) select rowid, rowid, c3 from t0 where c0 = 100;
insert into t1(c0, c1, c2) select rowid, rowid, c3 from t0 where c0 = 7;
ob1.oblog.next;
[R0] BEGIN;[R0] org_cluster_id:1;[R1] record_type:INSERT;[R1] database_name:oracle.OBLOG_DB;[R1] table_name:T1;[R1] log_event:true;[R1] column_count:4;[R1] source_category:SRC_FULL_RECORDED;[R1] source_type:SRC_OCEANBASE_1_0;[R1] has_pk:true;[R1] pk_info:(0,3);[R1] pks:__pk_increment,C2;[R1] has_uk:false;[R1] uk_info:(null);[R1] uks:(null);[R1] [C1] column_name:__pk_increment;[R1] [C1] column_type:MYSQL_TYPE_LONGLONG;[R1] [C1] column_is_rowkey:true;[R1] [C1] column_is_signed:false;[R1] [C1] column_encoding:binary;[R1] [C1] column_is_not_null:true;[R1] [C1] column_value_new:[4](1);[R1] [C2] column_name:C0;[R1] [C2] column_type:MYSQL_TYPE_OB_UROWID;[R1] [C2] column_is_rowkey:false;[R1] [C2] column_is_signed:true;[R1] [C2] column_encoding:binary;[R1] [C2] column_is_not_null:false;[R1] [C2] column_value_new:[gAADDUMAAAAAAw==](16);[R1] [C3] column_name:C1;[R1] [C3] column_type:MYSQL_TYPE_OB_UROWID;[R1] [C3] column_is_rowkey:false;[R1] [C3] column_is_signed:true;[R1] [C3] column_encoding:binary;[R1] [C3] column_is_not_null:false;[R1] [C3] column_value_new:[gAADDUMAAAAAAw==](16);[R1] [C4] column_name:C2;[R1] [C4] column_type:MYSQL_TYPE_NEWDECIMAL;[R1] [C4] column_is_rowkey:false;[R1] [C4] column_is_signed:true;[R1] [C4] column_encoding:binary;[R1] [C4] column_is_not_null:false;[R1] [C4] column_value_new:[24](2);$[R2] COMMIT;
select c0, c1, c2 from t1;
C0	C1	C2
gAADDUMAAAAAAQ==	gAADDUMAAAAAAQ==	6
gAADDUMAAAAAAg==	gAADDUMAAAAAAg==	15
gAADDUMAAAAAAw==	gAADDUMAAAAAAw==	24
gAADDUMAAAAAAw==	gAADDUMAAAAAAw==	24
update t1 set c2 = 999 where c2 = 6;
select c0, c1, c2 from t1 where c2 = 6;
C0	C1	C2
ob1.oblog.next;
[R0] BEGIN;[R0] org_cluster_id:1;[R1] record_type:DELETE;[R1] database_name:oracle.OBLOG_DB;[R1] table_name:T1;[R1] log_event:true;[R1] column_count:4;[R1] source_category:SRC_FULL_RECORDED;[R1] source_type:SRC_OCEANBASE_1_0;[R1] has_pk:true;[R1] pk_info:(0,3);[R1] pks:__pk_increment,C2;[R1] has_uk:false;[R1] uk_info:(null);[R1] uks:(null);[R1] [C1] column_name:__pk_increment;[R1] [C1] column_type:MYSQL_TYPE_LONGLONG;[R1] [C1] column_is_rowkey:true;[R1] [C1] column_is_signed:false;[R1] [C1] column_encoding:binary;[R1] [C1] column_is_not_null:true;[R1] [C1] column_value_old:[1](1);[R1] [C2] column_name:C0;[R1] [C2] column_type:MYSQL_TYPE_OB_UROWID;[R1] [C2] column_is_rowkey:false;[R1] [C2] column_is_signed:true;[R1] [C2] column_encoding:binary;[R1] [C2] column_is_not_null:false;[R1] [C2] column_value_old:[gAADDUMAAAAAAQ==](16);[R1] [C3] column_name:C1;[R1] [C3] column_type:MYSQL_TYPE_OB_UROWID;[R1] [C3] column_is_rowkey:false;[R1] [C3] column_is_signed:true;[R1] [C3] column_encoding:binary;[R1] [C3] column_is_not_null:false;[R1] [C3] column_value_old:[gAADDUMAAAAAAQ==](16);[R1] [C4] column_name:C2;[R1] [C4] column_type:MYSQL_TYPE_NEWDECIMAL;[R1] [C4] column_is_rowkey:false;[R1] [C4] column_is_signed:true;[R1] [C4] column_encoding:binary;[R1] [C4] column_is_not_null:false;[R1] [C4] column_value_old:[6](1);$[R2] record_type:INSERT;[R2] database_name:oracle.OBLOG_DB;[R2] table_name:T1;[R2] log_event:true;[R2] column_count:4;[R2] source_category:SRC_FULL_RECORDED;[R2] source_type:SRC_OCEANBASE_1_0;[R2] has_pk:true;[R2] pk_info:(0,3);[R2] pks:__pk_increment,C2;[R2] has_uk:false;[R2] uk_info:(null);[R2] uks:(null);[R2] [C1] column_name:__pk_increment;[R2] [C1] column_type:MYSQL_TYPE_LONGLONG;[R2] [C1] column_is_rowkey:true;[R2] [C1] column_is_signed:false;[R2] [C1] column_encoding:binary;[R2] [C1] column_is_not_null:true;[R2] [C1] column_value_new:[1](1);[R2] [C2] column_name:C0;[R2] [C2] column_type:MYSQL_TYPE_OB_UROWID;[R2] [C2] column_is_rowkey:false;[R2] [C2] column_is_signed:true;[R2] [C2] column_encoding:binary;[R2] [C2] column_is_not_null:false;[R2] [C2] column_value_new:[gAADDUMAAAAAAQ==](16);[R2] [C3] column_name:C1;[R2] [C3] column_type:MYSQL_TYPE_OB_UROWID;[R2] [C3] column_is_rowkey:false;[R2] [C3] column_is_signed:true;[R2] [C3] column_encoding:binary;[R2] [C3] column_is_not_null:false;[R2] [C3] column_value_new:[gAADDUMAAAAAAQ==](16);[R2] [C4] column_name:C2;[R2] [C4] column_type:MYSQL_TYPE_NEWDECIMAL;[R2] [C4] column_is_rowkey:false;[R2] [C4] column_is_signed:true;[R2] [C4] column_encoding:binary;[R2] [C4] column_is_not_null:false;[R2] [C4] column_value_new:[999](3);$[R3] COMMIT;
delete from t1 where c0 = (select rowid from t0 where c0 = 7);
ob1.oblog.next;
[R0] BEGIN;[R0] org_cluster_id:1;[R1] record_type:DELETE;[R1] database_name:oracle.OBLOG_DB;[R1] table_name:T1;[R1] log_event:true;[R1] column_count:4;[R1] source_category:SRC_FULL_RECORDED;[R1] source_type:SRC_OCEANBASE_1_0;[R1] has_pk:true;[R1] pk_info:(0,3);[R1] pks:__pk_increment,C2;[R1] has_uk:false;[R1] uk_info:(null);[R1] uks:(null);[R1] [C1] column_name:__pk_increment;[R1] [C1] column_type:MYSQL_TYPE_LONGLONG;[R1] [C1] column_is_rowkey:true;[R1] [C1] column_is_signed:false;[R1] [C1] column_encoding:binary;[R1] [C1] column_is_not_null:true;[R1] [C1] column_value_old:[3](1);[R1] [C2] column_name:C0;[R1] [C2] column_type:MYSQL_TYPE_OB_UROWID;[R1] [C2] column_is_rowkey:false;[R1] [C2] column_is_signed:true;[R1] [C2] column_encoding:binary;[R1] [C2] column_is_not_null:false;[R1] [C2] column_value_old:[gAADDUMAAAAAAw==](16);[R1] [C3] column_name:C1;[R1] [C3] column_type:MYSQL_TYPE_OB_UROWID;[R1] [C3] column_is_rowkey:false;[R1] [C3] column_is_signed:true;[R1] [C3] column_encoding:binary;[R1] [C3] column_is_not_null:false;[R1] [C3] column_value_old:[gAADDUMAAAAAAw==](16);[R1] [C4] column_name:C2;[R1] [C4] column_type:MYSQL_TYPE_NEWDECIMAL;[R1] [C4] column_is_rowkey:false;[R1] [C4] column_is_signed:true;[R1] [C4] column_encoding:binary;[R1] [C4] column_is_not_null:false;[R1] [C4] column_value_old:[24](2);$[R2] record_type:DELETE;[R2] database_name:oracle.OBLOG_DB;[R2] table_name:T1;[R2] log_event:true;[R2] column_count:4;[R2] source_category:SRC_FULL_RECORDED;[R2] source_type:SRC_OCEANBASE_1_0;[R2] has_pk:true;[R2] pk_info:(0,3);[R2] pks:__pk_increment,C2;[R2] has_uk:false;[R2] uk_info:(null);[R2] uks:(null);[R2] [C1] column_name:__pk_increment;[R2] [C1] column_type:MYSQL_TYPE_LONGLONG;[R2] [C1] column_is_rowkey:true;[R2] [C1] column_is_signed:false;[R2] [C1] column_encoding:binary;[R2] [C1] column_is_not_null:true;[R2] [C1] column_value_old:[4](1);[R2] [C2] column_name:C0;[R2] [C2] column_type:MYSQL_TYPE_OB_UROWID;[R2] [C2] column_is_rowkey:false;[R2] [C2] column_is_signed:true;[R2] [C2] column_encoding:binary;[R2] [C2] column_is_not_null:false;[R2] [C2] column_value_old:[gAADDUMAAAAAAw==](16);[R2] [C3] column_name:C1;[R2] [C3] column_type:MYSQL_TYPE_OB_UROWID;[R2] [C3] column_is_rowkey:false;[R2] [C3] column_is_signed:true;[R2] [C3] column_encoding:binary;[R2] [C3] column_is_not_null:false;[R2] [C3] column_value_old:[gAADDUMAAAAAAw==](16);[R2] [C4] column_name:C2;[R2] [C4] column_type:MYSQL_TYPE_NEWDECIMAL;[R2] [C4] column_is_rowkey:false;[R2] [C4] column_is_signed:true;[R2] [C4] column_encoding:binary;[R2] [C4] column_is_not_null:false;[R2] [C4] column_value_old:[24](2);$[R3] COMMIT;
select c0, c1, c2, rowid from t0 where rowid = (select c0 from t1 where c2 = 15);
C0	C1	C2	ROWID
4	5	6	gAADDUMAAAAAAg==
update t0 set c0 = 100 where rowid = (select c0 from t1 where c2 = 15);
ob1.oblog.next;
[R0] BEGIN;[R0] org_cluster_id:1;[R1] record_type:DELETE;[R1] database_name:oracle.OBLOG_DB;[R1] table_name:T0;[R1] log_event:true;[R1] column_count:4;[R1] source_category:SRC_FULL_RECORDED;[R1] source_type:SRC_OCEANBASE_1_0;[R1] has_pk:true;[R1] pk_info:(0,1,2,3);[R1] pks:__pk_increment,C0,C1,C2;[R1] has_uk:false;[R1] uk_info:(null);[R1] uks:(null);[R1] [C1] column_name:__pk_increment;[R1] [C1] column_type:MYSQL_TYPE_LONGLONG;[R1] [C1] column_is_rowkey:true;[R1] [C1] column_is_signed:false;[R1] [C1] column_encoding:binary;[R1] [C1] column_is_not_null:true;[R1] [C1] column_value_old:[2](1);[R1] [C2] column_name:C0;[R1] [C2] column_type:MYSQL_TYPE_NEWDECIMAL;[R1] [C2] column_is_rowkey:false;[R1] [C2] column_is_signed:true;[R1] [C2] column_encoding:binary;[R1] [C2] column_is_not_null:false;[R1] [C2] column_value_old:[4](1);[R1] [C3] column_name:C1;[R1] [C3] column_type:MYSQL_TYPE_NEWDECIMAL;[R1] [C3] column_is_rowkey:false;[R1] [C3] column_is_signed:true;[R1] [C3] column_encoding:binary;[R1] [C3] column_is_not_null:false;[R1] [C3] column_value_old:[5](1);[R1] [C4] column_name:C2;[R1] [C4] column_type:MYSQL_TYPE_NEWDECIMAL;[R1] [C4] column_is_rowkey:false;[R1] [C4] column_is_signed:true;[R1] [C4] column_encoding:binary;[R1] [C4] column_is_not_null:false;[R1] [C4] column_value_old:[6](1);$[R2] record_type:INSERT;[R2] database_name:oracle.OBLOG_DB;[R2] table_name:T0;[R2] log_event:true;[R2] column_count:4;[R2] source_category:SRC_FULL_RECORDED;[R2] source_type:SRC_OCEANBASE_1_0;[R2] has_pk:true;[R2] pk_info:(0,1,2,3);[R2] pks:__pk_increment,C0,C1,C2;[R2] has_uk:false;[R2] uk_info:(null);[R2] uks:(null);[R2] [C1] column_name:__pk_increment;[R2] [C1] column_type:MYSQL_TYPE_LONGLONG;[R2] [C1] column_is_rowkey:true;[R2] [C1] column_is_signed:false;[R2] [C1] column_encoding:binary;[R2] [C1] column_is_not_null:true;[R2] [C1] column_value_new:[1](1);[R2] [C2] column_name:C0;[R2] [C2] column_type:MYSQL_TYPE_NEWDECIMAL;[R2] [C2] column_is_rowkey:false;[R2] [C2] column_is_signed:true;[R2] [C2] column_encoding:binary;[R2] [C2] column_is_not_null:false;[R2] [C2] column_value_new:[100](3);[R2] [C3] column_name:C1;[R2] [C3] column_type:MYSQL_TYPE_NEWDECIMAL;[R2] [C3] column_is_rowkey:false;[R2] [C3] column_is_signed:true;[R2] [C3] column_encoding:binary;[R2] [C3] column_is_not_null:false;[R2] [C3] column_value_new:[5](1);[R2] [C4] column_name:C2;[R2] [C4] column_type:MYSQL_TYPE_NEWDECIMAL;[R2] [C4] column_is_rowkey:false;[R2] [C4] column_is_signed:true;[R2] [C4] column_encoding:binary;[R2] [C4] column_is_not_null:false;[R2] [C4] column_value_new:[6](1);$[R3] COMMIT;
create table t2(c1 int, c2 int as (c1+c1*3-c1+c1), c3 rowid) partition by range(c2) (partition p0 values less than(1000), partition p1 values less than(100000));
ob1.oblog.next;
[R0] record_type:EDDL;[R0] db_name:oracle.OBLOG_DB;[R0] table_name:;[R0] column_count:1;[R0] column_name:ddl;[R0] ddl_stmt_str: create table t2(c1 int, c2 int as (c1+c1*3-c1+c1), c3 rowid) partition by range(c2) (partition p0 values less than(1000), partition p1 values less than(100000));[R0] ddl_stmt_len: 160;
alter table t2 enable row movement;
ob1.oblog.next;
[R0] record_type:EDDL;[R0] db_name:oracle.OBLOG_DB;[R0] table_name:;[R0] column_count:1;[R0] column_name:ddl;[R0] ddl_stmt_str: alter table t2 enable row movement;[R0] ddl_stmt_len: 34;
insert into t2(c1, c3) select c2, c0 from t1;
ob1.oblog.next;
[R0] BEGIN;[R0] org_cluster_id:1;[R1] record_type:INSERT;[R1] database_name:oracle.OBLOG_DB;[R1] table_name:T2;[R1] log_event:true;[R1] column_count:3;[R1] source_category:SRC_FULL_RECORDED;[R1] source_type:SRC_OCEANBASE_1_0;[R1] has_pk:true;[R1] pk_info:(0,1);[R1] pks:__pk_increment,C1;[R1] has_uk:false;[R1] uk_info:(null);[R1] uks:(null);[R1] [C1] column_name:__pk_increment;[R1] [C1] column_type:MYSQL_TYPE_LONGLONG;[R1] [C1] column_is_rowkey:true;[R1] [C1] column_is_signed:false;[R1] [C1] column_encoding:binary;[R1] [C1] column_is_not_null:true;[R1] [C1] column_value_new:[1](1);[R1] [C2] column_name:C1;[R1] [C2] column_type:MYSQL_TYPE_NEWDECIMAL;[R1] [C2] column_is_rowkey:false;[R1] [C2] column_is_signed:true;[R1] [C2] column_encoding:binary;[R1] [C2] column_is_not_null:false;[R1] [C2] column_value_new:[999](3);[R1] [C3] column_name:C3;[R1] [C3] column_type:MYSQL_TYPE_OB_UROWID;[R1] [C3] column_is_rowkey:false;[R1] [C3] column_is_signed:true;[R1] [C3] column_encoding:binary;[R1] [C3] column_is_not_null:false;[R1] [C3] column_value_new:[gAADDUMAAAAAAQ==](16);$[R2] record_type:INSERT;[R2] database_name:oracle.OBLOG_DB;[R2] table_name:T2;[R2] log_event:true;[R2] column_count:3;[R2] source_category:SRC_FULL_RECORDED;[R2] source_type:SRC_OCEANBASE_1_0;[R2] has_pk:true;[R2] pk_info:(0,1);[R2] pks:__pk_increment,C1;[R2] has_uk:false;[R2] uk_info:(null);[R2] uks:(null);[R2] [C1] column_name:__pk_increment;[R2] [C1] column_type:MYSQL_TYPE_LONGLONG;[R2] [C1] column_is_rowkey:true;[R2] [C1] column_is_signed:false;[R2] [C1] column_encoding:binary;[R2] [C1] column_is_not_null:true;[R2] [C1] column_value_new:[1](1);[R2] [C2] column_name:C1;[R2] [C2] column_type:MYSQL_TYPE_NEWDECIMAL;[R2] [C2] column_is_rowkey:false;[R2] [C2] column_is_signed:true;[R2] [C2] column_encoding:binary;[R2] [C2] column_is_not_null:false;[R2] [C2] column_value_new:[15](2);[R2] [C3] column_name:C3;[R2] [C3] column_type:MYSQL_TYPE_OB_UROWID;[R2] [C3] column_is_rowkey:false;[R2] [C3] column_is_signed:true;[R2] [C3] column_encoding:binary;[R2] [C3] column_is_not_null:false;[R2] [C3] column_value_new:[gAADDUMAAAAAAg==](16);$[R3] COMMIT;
select c1, c3 from t2;
C1	C3
15	gAADDUMAAAAAAg==
999	gAADDUMAAAAAAQ==
update t2 set c1 = 100 where c3 = (select c0 from t1 where c2 = 999);
ob1.oblog.next;
[R0] BEGIN;[R0] org_cluster_id:1;[R1] record_type:DELETE;[R1] database_name:oracle.OBLOG_DB;[R1] table_name:T2;[R1] log_event:true;[R1] column_count:3;[R1] source_category:SRC_FULL_RECORDED;[R1] source_type:SRC_OCEANBASE_1_0;[R1] has_pk:true;[R1] pk_info:(0,1);[R1] pks:__pk_increment,C1;[R1] has_uk:false;[R1] uk_info:(null);[R1] uks:(null);[R1] [C1] column_name:__pk_increment;[R1] [C1] column_type:MYSQL_TYPE_LONGLONG;[R1] [C1] column_is_rowkey:true;[R1] [C1] column_is_signed:false;[R1] [C1] column_encoding:binary;[R1] [C1] column_is_not_null:true;[R1] [C1] column_value_old:[1](1);[R1] [C2] column_name:C1;[R1] [C2] column_type:MYSQL_TYPE_NEWDECIMAL;[R1] [C2] column_is_rowkey:false;[R1] [C2] column_is_signed:true;[R1] [C2] column_encoding:binary;[R1] [C2] column_is_not_null:false;[R1] [C2] column_value_old:[999](3);[R1] [C3] column_name:C3;[R1] [C3] column_type:MYSQL_TYPE_OB_UROWID;[R1] [C3] column_is_rowkey:false;[R1] [C3] column_is_signed:true;[R1] [C3] column_encoding:binary;[R1] [C3] column_is_not_null:false;[R1] [C3] column_value_old:[gAADDUMAAAAAAQ==](16);$[R2] record_type:INSERT;[R2] database_name:oracle.OBLOG_DB;[R2] table_name:T2;[R2] log_event:true;[R2] column_count:3;[R2] source_category:SRC_FULL_RECORDED;[R2] source_type:SRC_OCEANBASE_1_0;[R2] has_pk:true;[R2] pk_info:(0,1);[R2] pks:__pk_increment,C1;[R2] has_uk:false;[R2] uk_info:(null);[R2] uks:(null);[R2] [C1] column_name:__pk_increment;[R2] [C1] column_type:MYSQL_TYPE_LONGLONG;[R2] [C1] column_is_rowkey:true;[R2] [C1] column_is_signed:false;[R2] [C1] column_encoding:binary;[R2] [C1] column_is_not_null:true;[R2] [C1] column_value_new:[2](1);[R2] [C2] column_name:C1;[R2] [C2] column_type:MYSQL_TYPE_NEWDECIMAL;[R2] [C2] column_is_rowkey:false;[R2] [C2] column_is_signed:true;[R2] [C2] column_encoding:binary;[R2] [C2] column_is_not_null:false;[R2] [C2] column_value_new:[100](3);[R2] [C3] column_name:C3;[R2] [C3] column_type:MYSQL_TYPE_OB_UROWID;[R2] [C3] column_is_rowkey:false;[R2] [C3] column_is_signed:true;[R2] [C3] column_encoding:binary;[R2] [C3] column_is_not_null:false;[R2] [C3] column_value_new:[gAADDUMAAAAAAQ==](16);$[R3] COMMIT;
select c1, c3 from t2 where c3 = (select c0 from t1 where c2 = 999);
C1	C3
100	gAADDUMAAAAAAQ==
ob1.oblog.stop;
