purge recyclebin;
drop database IF EXISTS oblrp;
create database oblrp;
use oblrp;
set timestamp = 1600000000;
set ob_trx_timeout = 10000000000;
set ob_query_timeout = 10000000000;
SET SESSION group_concat_max_len = 100000000;
set ob_default_lob_inrow_threshold = 0;
result_format: 4
drop table tt1;
create table tt1(id int,c1 array(int), c2 array(varchar(256)), c3 array(tinyint), c4 array(bigint), c5 array(float), c6 array(double), c7 array(smallint));
insert into tt1 values(1,[-2147483648,0, 2147483647],['test'],[127,0,-128],[-9223372036854775808,9223372036854775807,775,808,2,0],[3.402, 0, 1.175],
[1.7976931348623157E+308, 2.2250738585072014E-308],[-32768,0,32767]);
insert into tt1 values(2,[-2147483648,0, 2147483647,4],['test'],[127,0,-128,6,77],[-9223372036854775808,9223372036854775807,775,808,2,0,1],[3.402, 0, 1.175,4],
[1.7976931348623157E+308,1.2,2.2250738585072014E-308],[-32768,0,32767,0]);
insert into tt1 values(3,null,null,null,null,null,null,null);
drop view vtt1;
create view vtt1 as select * from tt1;
drop table tt2;
create table tt2(id int primary key,c1 array(int unsigned), c2 array(varchar(256)), c3 array(tinyint unsigned), c4 array(bigint unsigned), c5 array(float), c6 array(double), c7 array(smallint unsigned))
PARTITION BY range COLUMNS(id)(
PARTITION p0 values less than(19),
PARTITION p1 values less than(25),
PARTITION p2 values less than(30)
);
insert into tt2 values(1,[2147483648,0, 2147483647],['test'],[127,0,128],[9223372036854775807,9223372036854775807,775,808,2,0],[3.402, 0, 1.175],
[1.7976931348623157E+308, 2.2250738585072014E-308],[32768,0,32767]);
insert into tt2 values(2,[2147483648,0, 2147483647,4],['test'],[127,0,128,6,77],[7,9223372036854775807,775,808,2,0,1],[3.402, 0, 1.175,4],
[1.7976931348623157E+308,1.2,2.2250738585072014E-308],[32768,0,32767,0]);
insert into tt2 values(3,null,null,null,null,null,null,null);
drop view vtt2;
create view vtt2 as select * from tt2;
select /*+ OPT_PARAM('enable_rich_vector_format', 'FALSE') */ cardinality(c2) a from tt2;
+------+
| a    |
+------+
|    1 |
|    1 |
| NULL |
+------+
select /*+ OPT_PARAM('rowsets_enabled', 'FALSE') */ cardinality(c2) a from tt2;
+------+
| a    |
+------+
|    1 |
|    1 |
| NULL |
+------+
select /*+ OPT_PARAM('enable_rich_vector_format', 'FALSE') */ cardinality(c2) a from vtt2;
+------+
| a    |
+------+
|    1 |
|    1 |
| NULL |
+------+
select /*+ OPT_PARAM('rowsets_enabled', 'FALSE') */ cardinality(c2) a from vtt2;
+------+
| a    |
+------+
|    1 |
|    1 |
| NULL |
+------+
select /*+ OPT_PARAM('enable_rich_vector_format', 'FALSE') */ cardinality(c2) a from vtt1;
+------+
| a    |
+------+
|    1 |
|    1 |
| NULL |
+------+
select /*+ OPT_PARAM('rowsets_enabled', 'FALSE') */ cardinality(c2) a from vtt1;
+------+
| a    |
+------+
|    1 |
|    1 |
| NULL |
+------+
select /*+ OPT_PARAM('enable_rich_vector_format', 'FALSE') */ cardinality(c2) a from tt1;
+------+
| a    |
+------+
|    1 |
|    1 |
| NULL |
+------+
select /*+ OPT_PARAM('rowsets_enabled', 'FALSE') */ cardinality(c2) a from tt1;
+------+
| a    |
+------+
|    1 |
|    1 |
| NULL |
+------+
select cardinality(c1),cardinality(c2),cardinality(c3),cardinality(c4),cardinality(c5) ,cardinality(c6) from tt2;
+-----------------+-----------------+-----------------+-----------------+-----------------+-----------------+
| cardinality(c1) | cardinality(c2) | cardinality(c3) | cardinality(c4) | cardinality(c5) | cardinality(c6) |
+-----------------+-----------------+-----------------+-----------------+-----------------+-----------------+
|               3 |               1 |               3 |               6 |               3 |               2 |
|               4 |               1 |               5 |               7 |               4 |               3 |
|            NULL |            NULL |            NULL |            NULL |            NULL |            NULL |
+-----------------+-----------------+-----------------+-----------------+-----------------+-----------------+
select /*+ OPT_PARAM('rowsets_enabled', 'FALSE') */ /*+ OPT_PARAM('rowsets_enabled', 'FALSE') */  cardinality(c2) a from tt1;
+------+
| a    |
+------+
|    1 |
|    1 |
| NULL |
+------+
select cardinality('[1]');
ERROR 22000: invalid obj type for type promotion: left_type=ARRAY right_type=VARCHAR
select cardinality(c1),cardinality(c2),cardinality(c3),cardinality(c5),cardinality(c6),cardinality(c7),cardinality(c4) from tt1;
+-----------------+-----------------+-----------------+-----------------+-----------------+-----------------+-----------------+
| cardinality(c1) | cardinality(c2) | cardinality(c3) | cardinality(c5) | cardinality(c6) | cardinality(c7) | cardinality(c4) |
+-----------------+-----------------+-----------------+-----------------+-----------------+-----------------+-----------------+
|               3 |               1 |               3 |               3 |               2 |               3 |               6 |
|               4 |               1 |               5 |               4 |               3 |               4 |               7 |
|            NULL |            NULL |            NULL |            NULL |            NULL |            NULL |            NULL |
+-----------------+-----------------+-----------------+-----------------+-----------------+-----------------+-----------------+
select cardinality([1]);
+------------------+
| cardinality([1]) |
+------------------+
|                1 |
+------------------+
select cardinality([]);
ERROR 42000: You have an error in your SQL syntax; check the manual that corresponds to your OceanBase version for the right syntax to use near '])' at line 1
select cardinality([null]);
+---------------------+
| cardinality([null]) |
+---------------------+
|                   1 |
+---------------------+
select cardinality([[[null],[null],[true,false]]]);
+---------------------------------------------+
| cardinality([[[null],[null],[true,false]]]) |
+---------------------------------------------+
|                                           4 |
+---------------------------------------------+
select cardinality([true,false]);
+---------------------------+
| cardinality([true,false]) |
+---------------------------+
|                         2 |
+---------------------------+
select cardinality([true,false,true,false,true,false]);
+-------------------------------------------------+
| cardinality([true,false,true,false,true,false]) |
+-------------------------------------------------+
|                                               6 |
+-------------------------------------------------+
select cardinality([1]);
+------------------+
| cardinality([1]) |
+------------------+
|                1 |
+------------------+
select cardinality([-2147483648,0, 2147483647,128,0,-127,-9223372036854775808,9223372036854775807,775,808,2,0,-32768,0,32767]);
+-------------------------------------------------------------------------------------------------------------------------+
| cardinality([-2147483648,0, 2147483647,128,0,-127,-9223372036854775808,9223372036854775807,775,808,2,0,-32768,0,32767]) |
+-------------------------------------------------------------------------------------------------------------------------+
|                                                                                                                      15 |
+-------------------------------------------------------------------------------------------------------------------------+
select cardinality([3,3.8]);
+----------------------+
| cardinality([3,3.8]) |
+----------------------+
|                    2 |
+----------------------+
select cardinality(array(-2147483648,0, 2147483647,128,0,-127,-9223372036854775808,9223372036854775807,775,808,2,0,-32768,0,32767));
+------------------------------------------------------------------------------------------------------------------------------+
| cardinality(array(-2147483648,0, 2147483647,128,0,-127,-9223372036854775808,9223372036854775807,775,808,2,0,-32768,0,32767)) |
+------------------------------------------------------------------------------------------------------------------------------+
|                                                                                                                           15 |
+------------------------------------------------------------------------------------------------------------------------------+
select cardinality([-3.402823466E+38, -1.175494351E-38,1.175494351E-38,3.402823466E+38,-1.7976931348623157E+308, 0,0,-2.2250738585072014E-308,2.2250738585072014E-308,1.7976931348623157E+308]);
+------------------------------------------------------------------------------------------------------------------------------------------------------------------------------------------+
| cardinality([-3.402823466E+38, -1.175494351E-38,1.175494351E-38,3.402823466E+38,-1.7976931348623157E+308, 0,0,-2.2250738585072014E-308,2.2250738585072014E-308,1.7976931348623157E+308]) |
+------------------------------------------------------------------------------------------------------------------------------------------------------------------------------------------+
|                                                                                                                                                                                       10 |
+------------------------------------------------------------------------------------------------------------------------------------------------------------------------------------------+
select cardinality([-2147483648,0, 2147483647,128,0,-127,-9223372036854775808,9223372036854775807,775,808,2,0,-32768,0,32767,-3.402823466E+38, -1.175494351E-38,1.175494351E-38,3.402823466E+38,-1.7976931348623157E+308, 0,0,-2.2250738585072014E-308,2.2250738585072014E-308,1.7976931348623157E+308]);
+-----------------------------------------------------------------------------------------------------------------------------------------------------------------------------------------------------------------------------------------------------------------+
| cardinality([-2147483648,0, 2147483647,128,0,-127,-9223372036854775808,9223372036854775807,775,808,2,0,-32768,0,32767,-3.402823466E+38, -1.175494351E-38,1.175494351E-38,3.402823466E+38,-1.7976931348623157E+308, 0,0,-2.2250738585072014E-308,2.2250738585072 |
+-----------------------------------------------------------------------------------------------------------------------------------------------------------------------------------------------------------------------------------------------------------------+
|                                                                                                                                                                                                                                                              25 |
+-----------------------------------------------------------------------------------------------------------------------------------------------------------------------------------------------------------------------------------------------------------------+
select cardinality(array([[-2147483648,0,2147483647,128,0,-127,-9223372036854775808,9223372036854775807,775,808,2,0,-32768,0,32767,-3.402823466E+38, -1.175494351E-38,1.175494351E-38,3.402823466E+38,-1.7976931348623157E+308, 0,0,-2.2250738585072014E-308,2.2250738585072014E-308,1.7976931348623157E+308],[2343]]));
+-----------------------------------------------------------------------------------------------------------------------------------------------------------------------------------------------------------------------------------------------------------------+
| cardinality(array([[-2147483648,0,2147483647,128,0,-127,-9223372036854775808,9223372036854775807,775,808,2,0,-32768,0,32767,-3.402823466E+38, -1.175494351E-38,1.175494351E-38,3.402823466E+38,-1.7976931348623157E+308, 0,0,-2.2250738585072014E-308,2.2250738 |
+-----------------------------------------------------------------------------------------------------------------------------------------------------------------------------------------------------------------------------------------------------------------+
|                                                                                                                                                                                                                                                              26 |
+-----------------------------------------------------------------------------------------------------------------------------------------------------------------------------------------------------------------------------------------------------------------+
select cardinality([-2147483648,0, 2147483647,128,0,-127,-9223372036854775808,9223372036854775807,775,808,2,0,-32768,0,32767,-3.402823466E+38, -1.175494351E-38,1.175494351E-38,3.402823466E+38,-1.7976931348623157E+308, 0,0,-2.2250738585072014E-308,2.2250738585072014E-308,1.7976931348623157E+308]);
+-----------------------------------------------------------------------------------------------------------------------------------------------------------------------------------------------------------------------------------------------------------------+
| cardinality([-2147483648,0, 2147483647,128,0,-127,-9223372036854775808,9223372036854775807,775,808,2,0,-32768,0,32767,-3.402823466E+38, -1.175494351E-38,1.175494351E-38,3.402823466E+38,-1.7976931348623157E+308, 0,0,-2.2250738585072014E-308,2.2250738585072 |
+-----------------------------------------------------------------------------------------------------------------------------------------------------------------------------------------------------------------------------------------------------------------+
|                                                                                                                                                                                                                                                              25 |
+-----------------------------------------------------------------------------------------------------------------------------------------------------------------------------------------------------------------------------------------------------------------+
select cardinality([1,true,false,null]);
+----------------------------------+
| cardinality([1,true,false,null]) |
+----------------------------------+
|                                4 |
+----------------------------------+
select cardinality([[1],[true,false,null]]);
+--------------------------------------+
| cardinality([[1],[true,false,null]]) |
+--------------------------------------+
|                                    4 |
+--------------------------------------+
select cardinality([['夏普定积分的计算']]);
+---------------------------------------------+
| cardinality([['夏普定积分的计算']])         |
+---------------------------------------------+
|                                           1 |
+---------------------------------------------+
select cardinality([[1],1]);
ERROR 22000: Invalid data type for the operation
select cardinality([1,'test']);
+-------------------------+
| cardinality([1,'test']) |
+-------------------------+
|                       2 |
+-------------------------+
select cardinality([[1,'test'],['test']]);
+------------------------------------+
| cardinality([[1,'test'],['test']]) |
+------------------------------------+
|                                  3 |
+------------------------------------+
select cardinality([[[[[[[1]]]]]]]);
ERROR 0A000: Not supported feature or function
select cardinality([[[[[[1]]]]]]);
+----------------------------+
| cardinality([[[[[[1]]]]]]) |
+----------------------------+
|                          1 |
+----------------------------+
select cardinality([[[[[[1],["test"]]]]]]);
+-------------------------------------+
| cardinality([[[[[[1],["test"]]]]]]) |
+-------------------------------------+
|                                   2 |
+-------------------------------------+
select cardinality([[[[[[1],[true,2,null]]]]]]);
+------------------------------------------+
| cardinality([[[[[[1],[true,2,null]]]]]]) |
+------------------------------------------+
|                                        4 |
+------------------------------------------+
select cardinality([[[[[[1],[2]]],[2]]]]);
ERROR 22000: array type mismatch found between definition and data
select cardinality([-9223372036854775809]);
+-------------------------------------+
| cardinality([-9223372036854775809]) |
+-------------------------------------+
|                                   1 |
+-------------------------------------+
select cardinality([9223372036854775809]);
+------------------------------------+
| cardinality([9223372036854775809]) |
+------------------------------------+
|                                  1 |
+------------------------------------+
select cardinality([18446744073709551618121000]);
+-------------------------------------------+
| cardinality([18446744073709551618121000]) |
+-------------------------------------------+
|                                         1 |
+-------------------------------------------+
select array(1.7976931348623157E+308,2,2.2250738585072014E-308);
+----------------------------------------------------------+
| array(1.7976931348623157E+308,2,2.2250738585072014E-308) |
+----------------------------------------------------------+
| [1.7976931348623157e308,2,2.2250738585072014e-308]       |
+----------------------------------------------------------+
select cardinality(["testz"]);
+------------------------+
| cardinality(["testz"]) |
+------------------------+
|                      1 |
+------------------------+
select cardinality(['xxxxxxxxxxxxxxxxxxxxxxxxxxxxxxxxxxxxxxxxxxxxxxxxxxxxxxxxxxxxxxxxxxxxxxxxxxxxxxxxxxxxxxxxxxxxxxxxxxxxxxxxxxxxxxxxxxxxxxxxxxxxxxxxxxxxxxxxxxxxxxxxxxxxxxxxxxxxxxxxxxxxxxxxxxxxxxxxxxxxxxxxxxxxxxxxxxxxxxxxxxxxxxxxxxxxxxxxxxxxxxxxxxxxxxxxxxxxxxxxxxxxxxxxxxxxxxxxxxxxxxxxxxxxxxxxxxxxxxxxxxxxxxxxxxxxxxxxxxxxxxxxxxxxxxxxxxxxxxxxxxxxxxxxxxxxxxxxxxxxxxxxxxxxxxxxxxxxxxxxxxxxxxxxxxxxxxxxxxxxxxxxxxxxxxxxxxxxxxxxxxxxxxxxxxxxxxxxxxxxxxxxxxxxxxxxxxxxxxxxxxxxxxxxxxxxxxxxxxxxxxxxxxxxxxxxxxxxxxxxxxxxxxxxxxxxxxxxxxxxxxxxxxxxxxxxxxxxxxxxxxxxxxxxxxxxxxxxxxxxxxxxxxxxxxxxxxxxxxxxxxxxxxxxxxxxxxxxxxxxxxxxxxxxxxxxxxxxxxxxxxxxxxxxxxxxxxxxxxxxxxxxxxxxxxxxxxxxxxxxxxxxxxxxxxxxxxxxxxxxxxxxxxxxxxxxxxxxxxxxxxxxxxxxxxxxxxxxxxxxxxxxxxxxxxxxxxxxxxxxxxxxxxxxxxxxxxxxxxxxxxxxxxxxxxxxxxxxxxxxxxxxxxxxxxxxxxxxxxxxxxxxxxxxxxxxxxxxxxxxxxxxxxxxxxxxxxxxxxxxxxxxxxxxxxxxxxxxxxxxxxxxxxxxxxxxxxxxxxxxxxxxxxxxxxxxxxxxxxxxxxxxxxxxxxxxxxxxxxxxxxxxxxxxxxxxxxxxxxxxxxxxxxxxxxxxxxxxxxxxxxxxxxxxxxxxxxxxxxxxxxxxxxxxxxxxxxxxxxxxxxxxxxxxxxxxxxxxxxxxxxxxxxxxxxxxxxxxxxxxxxxxxxxxxxxxxxxxxxxxxxxxxxxxxxxxxxxxxxxxxxxxxxxxxxxxxxxxxxxxxxxxxxxxxxxxxxxxxxxxxxxxxxxxxxxxxxxxxxxxxxxxxxxxxxxxxxxxxxxxxxxxxxxxxxxxxxxxxxxxxxxxxxxxxxxxxxxxxxxxxxxxxxxxxxxxxxxxxxxxxxxxxxxxxxxxxxxxxxxxxxxxxxxxxxxxxxxxxxxxxxxxxxxxxxxxxxxxxxxxxxxxxxxxxxxxxxxxxxxxxxxxxxxxxxxxxxxxxxxxxxxxxxxxxxxxxxxxxxxxxxxxxxxxxxxxxxxxxxxxxxxxxxxxxxxxxxxxxxxxxxxxxxxxxxxxxxxxxxxxxxxxxxxxxxxxxxxxxxxxxxxxxxxxxxxxxxxxxxxxxxxxxxxxxxxxxxxxxxxxxxxxxxxxxxxxxxxxxxxxxxxxxxxxxxxxxxxxxxxxxxxxxxxxxxxxxxxxxxxxxxxxxxxxxxxxxxxxxxxxxxxxxxxxxxxxxxxxxxxxxxxxxxxxxxxxxxxxxxxxxxxxxxxxxxxxxxxxxxxxxxxxxxxxxxxxxxxxxxxxxxxxxxxxxxxxxxxxxxxxxxxxxxxxxxxxxxxxxxxxxxxxxxxxxxxxxxxxxxxxxxxxxxxxxxxxxxxxxxxxxxxxxxxxxxxxxxxxxxxxxxxxxxxxxxxxxxxxxxxxxxxxxxxxxxxxxxxxxxxxxxxxxxxxxxxxxxxxxxxxxxxxxxxxxxxxxxxxxxxxxxxxxxxxxxxxxxxxxxxxxxxxxxxxxxxxxxxxxxxxxxxxxxxxxxxxxxxxxxxxxxxxxxxxxxxxxxxxxxxxxxxxxxxxxxxxxxxxxxxxxxxxxxxxxxxxxxxxxxxxxxxxxxxxxxxxxxxxxxxxxxxxxxxxxxxxxxxxxxxxxxxxxxxxxxxxxxxxxxxxxxxxxxxxxxxxxxxxxxxxxxxxxxxxxxxxxxxxxxxxxxxxxxxxxxxxxxxxxxxxxxxxxxxxxxxxxxxxxxxxxxxxxxxxxxxxxxxxxxxxxxxxxxxxxxxxxxxxxxxxxxxxxxxxxxxxxxxxxxxxxxxxxxxxxxxxxxxxxxxxxxxxxxxxxxxxxxxxxxxxxxxxxxxxxxxxxxxxxxxxxxxxxxxxxxxxxxxxxxxxxxxxxxxxxxxxxxxxxxxxxxxxxxxxxxxxxxxxxxxxxxxxxxxxxxxxxxxxxxxxxxxxxxxxxxxxxxxxxxxxxxxxxxxxxxxxxxxxxxxxxxxxxxxxxxxxxxxxxxxxxxxxxxxxxxxxxxxxxxxxxxxxxxxxxxxxxxxxxxxxxxxxxxxxxxxxxxxxxxxxxxxxxxxxxxxxxxxxxxxxxxxxxxxxxxxxxxxxxxxxxxxxxxxxxxxxxxxxxxxxxxxxxxxxxxxxxxxxxxxxxxxxxxxxxxxxxxxxxxxxxxxxxxxxxxxxxxxxxxxxxxxxxxxxxxxxxxxxxxxxxxxxxxxxxxxxxxxxxxxxxxxxxxxxxxxxxxxxxxxxxxxxxxxxxxxxxxxxxxxxxxxxxxxxxxxxxxxxxxxxxxxxxxxxxxxxxxxxxxxxxxxxxxxxxxxxxxxxxxxxx']);
+-----------------------------------------------------------------------------------------------------------------------------------------------------------------------------------------------------------------------------------------------------------------+
| cardinality(['xxxxxxxxxxxxxxxxxxxxxxxxxxxxxxxxxxxxxxxxxxxxxxxxxxxxxxxxxxxxxxxxxxxxxxxxxxxxxxxxxxxxxxxxxxxxxxxxxxxxxxxxxxxxxxxxxxxxxxxxxxxxxxxxxxxxxxxxxxxxxxxxxxxxxxxxxxxxxxxxxxxxxxxxxxxxxxxxxxxxxxxxxxxxxxxxxxxxxxxxxxxxxxxxxxxxxxxxxxxxxxxxxxxxxxxxxxxxxxxxx |
+-----------------------------------------------------------------------------------------------------------------------------------------------------------------------------------------------------------------------------------------------------------------+
|                                                                                                                                                                                                                                                               1 |
+-----------------------------------------------------------------------------------------------------------------------------------------------------------------------------------------------------------------------------------------------------------------+
select cardinality(array(repeat('x',262144)));
ERROR 0A000: array element type not supported
select cardinality(["testz",'1',"testset",'etst']);
+---------------------------------------------+
| cardinality(["testz",'1',"testset",'etst']) |
+---------------------------------------------+
|                                           4 |
+---------------------------------------------+
select cardinality(["testz",true,false]);
+-----------------------------------+
| cardinality(["testz",true,false]) |
+-----------------------------------+
|                                 3 |
+-----------------------------------+
select cardinality(["testz",null,null]);
+----------------------------------+
| cardinality(["testz",null,null]) |
+----------------------------------+
|                                3 |
+----------------------------------+
select cardinality(['testz']);
+------------------------+
| cardinality(['testz']) |
+------------------------+
|                      1 |
+------------------------+
select cardinality(['testz',['tet']]);
ERROR 22000: Invalid data type for the operation
select cardinality([1,['tet']]);
ERROR 22000: Invalid data type for the operation
select cardinality([[[[[['teste'],["test",null]]]]]]);
+------------------------------------------------+
| cardinality([[[[[['teste'],["test",null]]]]]]) |
+------------------------------------------------+
|                                              3 |
+------------------------------------------------+
bug 2024112500105252538   《[obmysql_array二期]不同层级含有null,cardinality没有计算各层级null个数》
select cardinality([[[[[['teste']],null]],null],null]);
+-------------------------------------------------+
| cardinality([[[[[['teste']],null]],null],null]) |
+-------------------------------------------------+
|                                               1 |
+-------------------------------------------------+
bug 2024112500105252538   《[obmysql_array二期]不同层级含有null,cardinality没有计算各层级null个数》
select cardinality([[[[[['teste',null],[null],null],null],null],null],null]);
+-----------------------------------------------------------------------+
| cardinality([[[[[['teste',null],[null],null],null],null],null],null]) |
+-----------------------------------------------------------------------+
|                                                                     3 |
+-----------------------------------------------------------------------+
select cardinality([[["test","WWWWWW"]]]);
+------------------------------------+
| cardinality([[["test","WWWWWW"]]]) |
+------------------------------------+
|                                  2 |
+------------------------------------+
select cardinality([[["test","WWWWWW"],['A','B'],['C','C']]]);
+--------------------------------------------------------+
| cardinality([[["test","WWWWWW"],['A','B'],['C','C']]]) |
+--------------------------------------------------------+
|                                                      6 |
+--------------------------------------------------------+
select cardinality(['2010-10-10']);
+-----------------------------+
| cardinality(['2010-10-10']) |
+-----------------------------+
|                           1 |
+-----------------------------+
select cardinality([["[test,WWWWWW]"]]);
+----------------------------------+
| cardinality([["[test,WWWWWW]"]]) |
+----------------------------------+
|                                1 |
+----------------------------------+
select cardinality([[null],null]);
+----------------------------+
| cardinality([[null],null]) |
+----------------------------+
|                          1 |
+----------------------------+
select cardinality([null]);
+---------------------+
| cardinality([null]) |
+---------------------+
|                   1 |
+---------------------+
select cardinality([[null,null]]);
+----------------------------+
| cardinality([[null,null]]) |
+----------------------------+
|                          2 |
+----------------------------+
drop table test;
create table test(a varchar(262144),a1 longtext);
insert into test values(repeat('x',262144),repeat('x',26214));
select cardinality(array(a)) from test;
+-----------------------+
| cardinality(array(a)) |
+-----------------------+
|                     1 |
+-----------------------+
drop table test;
create table test(a varchar(262144)[],a1 bigint[]);
insert into test values((SELECT CONCAT('[', GROUP_CONCAT(number ORDER BY number SEPARATOR ', '), ']') AS nums
FROM (
     SELECT FLOOR(1+RAND() * 1) AS number
    FROM TABLE(GENERATOR(100000))
) AS temp),(SELECT CONCAT('[', GROUP_CONCAT(number ORDER BY number SEPARATOR ', '), ']') AS nums
FROM (
     SELECT FLOOR(1+RAND() * 1) AS number
    FROM TABLE(GENERATOR(100000))
) AS temp));
select cardinality(a),cardinality(a1) from test;
select cardinality([1.7976931348623157E+309]);
ERROR 22007: Illegal double '1.7976931348623157E+309' value found during parsing
select cardinality([1.7976931348623157E+308]);
+----------------------------------------+
| cardinality([1.7976931348623157E+308]) |
+----------------------------------------+
|                                      1 |
+----------------------------------------+
select cardinality([1.2250738585072014E-309]);
+----------------------------------------+
| cardinality([1.2250738585072014E-309]) |
+----------------------------------------+
|                                      1 |
+----------------------------------------+
select cardinality([4.402823466E+38]);
+--------------------------------+
| cardinality([4.402823466E+38]) |
+--------------------------------+
|                              1 |
+--------------------------------+
select cardinality([-1.7976931348623157E+309,-3.402823466E+39]);
ERROR 22007: Illegal double '1.7976931348623157E+309' value found during parsing
select cardinality([-3.402823466E+39]);
+---------------------------------+
| cardinality([-3.402823466E+39]) |
+---------------------------------+
|                               1 |
+---------------------------------+
select cardinality([-2.2250738585072014E-309]);
+-----------------------------------------+
| cardinality([-2.2250738585072014E-309]) |
+-----------------------------------------+
|                                       1 |
+-----------------------------------------+
select cardinality([2.2250738585072014E-309]);
+----------------------------------------+
| cardinality([2.2250738585072014E-309]) |
+----------------------------------------+
|                                      1 |
+----------------------------------------+
select cardinality([2.2250738585072014E-309]);
+----------------------------------------+
| cardinality([2.2250738585072014E-309]) |
+----------------------------------------+
|                                      1 |
+----------------------------------------+
select cardinality(array(2.2250738585072014E-306));
+---------------------------------------------+
| cardinality(array(2.2250738585072014E-306)) |
+---------------------------------------------+
|                                           1 |
+---------------------------------------------+
select cardinality(array([2.2250738585072014E-306,-3.402823466E+38,-1.175494351E-38,0,3.402823466E+38,-1.7976931348623157E+308, -2.2250738585072014E-308,0,2.2250738585072014E-308,1.7976931348623157E+308]));
+--------------------------------------------------------------------------------------------------------------------------------------------------------------------------------------------------------+
| cardinality(array([2.2250738585072014E-306,-3.402823466E+38,-1.175494351E-38,0,3.402823466E+38,-1.7976931348623157E+308, -2.2250738585072014E-308,0,2.2250738585072014E-308,1.7976931348623157E+308])) |
+--------------------------------------------------------------------------------------------------------------------------------------------------------------------------------------------------------+
|                                                                                                                                                                                                     10 |
+--------------------------------------------------------------------------------------------------------------------------------------------------------------------------------------------------------+
select cardinality([2.2250738585072014E-309,"test1"]);
+------------------------------------------------+
| cardinality([2.2250738585072014E-309,"test1"]) |
+------------------------------------------------+
|                                              2 |
+------------------------------------------------+
select cardinality([1.0,null,true,false]);
+------------------------------------+
| cardinality([1.0,null,true,false]) |
+------------------------------------+
|                                  4 |
+------------------------------------+
select cardinality([[12],[34,7,8]]);
+------------------------------+
| cardinality([[12],[34,7,8]]) |
+------------------------------+
|                            4 |
+------------------------------+
select cardinality([[12],[34,7,8],['test']]);
+---------------------------------------+
| cardinality([[12],[34,7,8],['test']]) |
+---------------------------------------+
|                                     5 |
+---------------------------------------+
select cardinality([b'111']);
ERROR 0A000: array element type not supported
select cardinality(array(b'111'));
ERROR 0A000: array element type not supported
select cardinality([0b11]);
ERROR 0A000: array element type not supported
select cardinality(array(b'111',2));
ERROR 0A000: array element type not supported
select cardinality(array(b'111','test'));
ERROR 0A000: array element type not supported
select cardinality([x'0089']);
ERROR 0A000: array element type not supported
select cardinality([{}]);
ERROR 42000: You have an error in your SQL syntax; check the manual that corresponds to your OceanBase version for the right syntax to use near '}])' at line 1
select cardinality('[12]');
ERROR 22000: invalid obj type for type promotion: left_type=ARRAY right_type=VARCHAR
select cardinality('1');
ERROR 22000: invalid obj type for type promotion: left_type=ARRAY right_type=VARCHAR
select cardinality(null);
+-------------------+
| cardinality(null) |
+-------------------+
|              NULL |
+-------------------+
select cardinality(cast('[1]'as json));
ERROR 22000: invalid obj type for type promotion: left_type=ARRAY right_type=JSON
select cardinality(2);
ERROR 22000: invalid obj type for type promotion: left_type=ARRAY right_type=BIGINT
select cardinality(true);
ERROR 22000: invalid obj type for type promotion: left_type=ARRAY right_type=TINYINT
select cardinality(false);
ERROR 22000: invalid obj type for type promotion: left_type=ARRAY right_type=TINYINT
select cardinality(b'111');
ERROR 22000: invalid obj type for type promotion: left_type=ARRAY right_type=HEX_STRING
select cardinality(x'1110');
ERROR 22000: invalid obj type for type promotion: left_type=ARRAY right_type=HEX_STRING
select cardinality();
ERROR 42000: Incorrect parameter count in the call to native function 'cardinality'
select cardinality([1],[2]);
ERROR 42000: Incorrect parameter count in the call to native function 'cardinality'
drop table tt3;
create table tt3(id int primary key,f float, a varchar(100),d double,a1 int[],a2 varchar(50)[][][][][],a3 double[][]);
drop view vtt3;
create view vtt3 as select * from tt3;
insert into tt3 values(1,523E-2,'test',1.7976931348623157E+308,[1,-3,98],[[[[['test','test1'],['test1']]]]],[[1.7976931348623157E+308,1,2,3,4],[1.251,2.7976931348623157E+306]]);
insert into tt3 values(2,523E-2,'test',1.7976931348623157E+308,[1,-3,98],[[[[['test','test1'],['test1']]]]],[[1.7976931348623157E+308,1,2,3,4],[1.251,2.7976931348623157E+306]]);
insert into tt3 values(3,-654E+2,'test1',-1.7976931348623157E+308,[111,-300,980],[[[[['test3','test3'],['test5']]]]],[[-1.7976931348623157E+304,1,2,3,4.584],[-1.251,-2.7976931348623157E+306]]);
insert into tt3 values(4,-654E+2,'test1',-1.7976931348623157E+308,[111,-300,980],[[[[['test3','test3'],['test5']]]]],[[-1.7976931348623157E+304,1,2,3,4.584],[-1.251,-2.7976931348623157E+306]]);
insert into tt3 values(5,-654E+2,'test3',-1.7976931348623157E+308,[111,-300,980],[[[[['test3','test3'],['test5']]]]],[[-1.7976931348623157E+304,1,2,3,4.584],[-1.251,-2.7976931348623157E+306]]);
insert into tt3 values(8,null,null,null,null,null,null);
insert into tt3 values(7,-654E+2,'test3',-1.7976931348623157E+308,[111,-300,980],[[[[['test3','test3'],['test5']]]]],[[-1.7976931348623157E+304,1,2,3,4.584],[-1.251,-2.7976931348623157E+306]]);
insert into tt3 values(6,-654E+2,null,-1.7976931348623157E+308,[111,-300,980],null,null);
insert into tt3 values(9,null,null,-1.7976931348623157E+308,[111,-300,980],null,null);
insert into tt3 values(10,null,'test9',-1.7976931348623157E+308,[111,-300,980],null,null);
select cardinality(a2) from tt3;
+-----------------+
| cardinality(a2) |
+-----------------+
|               3 |
|               3 |
|               3 |
|               3 |
|               3 |
|            NULL |
|               3 |
|            NULL |
|            NULL |
|            NULL |
+-----------------+
select cardinality(a3) from tt3;
+-----------------+
| cardinality(a3) |
+-----------------+
|               7 |
|               7 |
|               7 |
|               7 |
|               7 |
|            NULL |
|               7 |
|            NULL |
|            NULL |
|            NULL |
+-----------------+
select cardinality(id) from tt3;
ERROR 22000: invalid obj type for type promotion: left_type=ARRAY right_type=INT
select cardinality(f) from tt3;
ERROR 22000: invalid obj type for type promotion: left_type=ARRAY right_type=FLOAT
select cardinality(a) from tt3;
ERROR 22000: invalid obj type for type promotion: left_type=ARRAY right_type=VARCHAR
select cardinality(d) from tt3;
ERROR 22000: invalid obj type for type promotion: left_type=ARRAY right_type=DOUBLE
drop table tt3;
create table tt3 (a char(20),b binary(50),c varbinary(50),a2 varchar(50));
insert into tt3 values('[1]','[1]','[1]','[1]');
select cardinality(a) from tt3;
ERROR 22000: invalid obj type for type promotion: left_type=ARRAY right_type=CHAR
select cardinality(b) from tt3;
ERROR 22000: invalid obj type for type promotion: left_type=ARRAY right_type=CHAR
select cardinality(c) from tt3;
ERROR 22000: invalid obj type for type promotion: left_type=ARRAY right_type=VARCHAR
select cardinality(a2) from tt3;
ERROR 22000: invalid obj type for type promotion: left_type=ARRAY right_type=VARCHAR
drop table tt3;
create table tt3 (a json,b text,c blob);
insert into tt3 values('[1]','[1]','[1]');
select cardinality(a) from tt3;
ERROR 22000: invalid obj type for type promotion: left_type=ARRAY right_type=JSON
select cardinality(b) from tt3;
ERROR 22000: invalid obj type for type promotion: left_type=ARRAY right_type=TEXT
select cardinality(c) from tt3;
ERROR 22000: invalid obj type for type promotion: left_type=ARRAY right_type=TEXT
drop table tt3;
create table tt3 (a float,a1 float unsigned,d double,d1 double);
insert into tt3 values(1,2,3,5);
select cardinality(a) from tt3;
ERROR 22000: invalid obj type for type promotion: left_type=ARRAY right_type=FLOAT
select cardinality(a1) from tt3;
ERROR 22000: invalid obj type for type promotion: left_type=ARRAY right_type=FLOAT UNSIGNED
select cardinality(d) from tt3;
ERROR 22000: invalid obj type for type promotion: left_type=ARRAY right_type=DOUBLE
select cardinality(d1) from tt3;
ERROR 22000: invalid obj type for type promotion: left_type=ARRAY right_type=DOUBLE
select cardinality([d1]) from tt3;
+-------------------+
| cardinality([d1]) |
+-------------------+
|                 1 |
+-------------------+
drop table tt3;
create table tt3 (a1 date,a2 datetime,a3 timestamp,a4 time,a5 year);
select cardinality(a1) from tt3;
ERROR 22000: invalid obj type for type promotion: left_type=ARRAY right_type=MYSQL_DATE
select cardinality(a2) from tt3;
ERROR 22000: invalid obj type for type promotion: left_type=ARRAY right_type=MYSQL_DATETIME
select cardinality(a3) from tt3;
ERROR 22000: invalid obj type for type promotion: left_type=ARRAY right_type=TIMESTAMP
select cardinality(a4) from tt3;
ERROR 22000: invalid obj type for type promotion: left_type=ARRAY right_type=TIME
select cardinality(a5) from tt3;
ERROR 22000: invalid obj type for type promotion: left_type=ARRAY right_type=YEAR
drop table tt3;
create table tt3 (a1 set('[1]'),a2 ENUM ('[1]'),a3 GEOMETRY,a4 RoaringBitmap,a5 bit(10));
select cardinality(a1) from tt3;
ERROR 22000: invalid obj type for type promotion: left_type=ARRAY right_type=SET
select cardinality(a2) from tt3;
ERROR 22000: invalid obj type for type promotion: left_type=ARRAY right_type=ENUM
select cardinality(a3) from tt3;
ERROR 22000: invalid obj type for type promotion: left_type=ARRAY right_type=GEOMETRY
select cardinality(a4) from tt3;
ERROR 22000: invalid obj type for type promotion: left_type=ARRAY right_type=ROARINGBITMAP
select cardinality(a5) from tt3;
ERROR 22000: invalid obj type for type promotion: left_type=ARRAY right_type=BIT
select cardinality(c1),cardinality(c2),cardinality(c3),cardinality(c5),cardinality(c6),cardinality(c7),cardinality(c4) from tt1;
+-----------------+-----------------+-----------------+-----------------+-----------------+-----------------+-----------------+
| cardinality(c1) | cardinality(c2) | cardinality(c3) | cardinality(c5) | cardinality(c6) | cardinality(c7) | cardinality(c4) |
+-----------------+-----------------+-----------------+-----------------+-----------------+-----------------+-----------------+
|               3 |               1 |               3 |               3 |               2 |               3 |               6 |
|               4 |               1 |               5 |               4 |               3 |               4 |               7 |
|            NULL |            NULL |            NULL |            NULL |            NULL |            NULL |            NULL |
+-----------------+-----------------+-----------------+-----------------+-----------------+-----------------+-----------------+
select cardinality(c1),cardinality(c2),cardinality(c3),cardinality(c5),cardinality(c6),cardinality(c7),cardinality(c4) from vtt1;
+-----------------+-----------------+-----------------+-----------------+-----------------+-----------------+-----------------+
| cardinality(c1) | cardinality(c2) | cardinality(c3) | cardinality(c5) | cardinality(c6) | cardinality(c7) | cardinality(c4) |
+-----------------+-----------------+-----------------+-----------------+-----------------+-----------------+-----------------+
|               3 |               1 |               3 |               3 |               2 |               3 |               6 |
|               4 |               1 |               5 |               4 |               3 |               4 |               7 |
|            NULL |            NULL |            NULL |            NULL |            NULL |            NULL |            NULL |
+-----------------+-----------------+-----------------+-----------------+-----------------+-----------------+-----------------+
select cardinality(c1),cardinality(c2),cardinality(c3),cardinality(c5),cardinality(c6),cardinality(c7),cardinality(c4) from tt1 where cardinality(c4)=6;
+-----------------+-----------------+-----------------+-----------------+-----------------+-----------------+-----------------+
| cardinality(c1) | cardinality(c2) | cardinality(c3) | cardinality(c5) | cardinality(c6) | cardinality(c7) | cardinality(c4) |
+-----------------+-----------------+-----------------+-----------------+-----------------+-----------------+-----------------+
|               3 |               1 |               3 |               3 |               2 |               3 |               6 |
+-----------------+-----------------+-----------------+-----------------+-----------------+-----------------+-----------------+
select cardinality(c1),cardinality(c2),cardinality(c3),cardinality(c5),cardinality(c6),cardinality(c7),cardinality(c4) from tt1 order by cardinality(c4);
+-----------------+-----------------+-----------------+-----------------+-----------------+-----------------+-----------------+
| cardinality(c1) | cardinality(c2) | cardinality(c3) | cardinality(c5) | cardinality(c6) | cardinality(c7) | cardinality(c4) |
+-----------------+-----------------+-----------------+-----------------+-----------------+-----------------+-----------------+
|            NULL |            NULL |            NULL |            NULL |            NULL |            NULL |            NULL |
|               3 |               1 |               3 |               3 |               2 |               3 |               6 |
|               4 |               1 |               5 |               4 |               3 |               4 |               7 |
+-----------------+-----------------+-----------------+-----------------+-----------------+-----------------+-----------------+
bug 2024110800105034260   《【obmysql_array二期】group by cardinality(),ob报4016》
select cardinality(c1),cardinality(c2),cardinality(c3),cardinality(c5),cardinality(c6),cardinality(c7),cardinality(c4) from tt1 group by cardinality(c4);
+-----------------+-----------------+-----------------+-----------------+-----------------+-----------------+-----------------+
| cardinality(c1) | cardinality(c2) | cardinality(c3) | cardinality(c5) | cardinality(c6) | cardinality(c7) | cardinality(c4) |
+-----------------+-----------------+-----------------+-----------------+-----------------+-----------------+-----------------+
|               3 |               1 |               3 |               3 |               2 |               3 |               6 |
|               4 |               1 |               5 |               4 |               3 |               4 |               7 |
|            NULL |            NULL |            NULL |            NULL |            NULL |            NULL |            NULL |
+-----------------+-----------------+-----------------+-----------------+-----------------+-----------------+-----------------+
bug 2024110800105034260   《【obmysql_array二期】group by cardinality(),ob报4016》
select * from tt1 group by cardinality(c4);
+------+------------------------------+----------+-------------------+----------------------------------------------------------+-------------------+------------------------------------------------------+--------------------+
| id   | c1                           | c2       | c3                | c4                                                       | c5                | c6                                                   | c7                 |
+------+------------------------------+----------+-------------------+----------------------------------------------------------+-------------------+------------------------------------------------------+--------------------+
|    1 | [-2147483648,0,2147483647]   | ["test"] | [127,0,-128]      | [-9223372036854775808,9223372036854775807,775,808,2,0]   | [3.402,0,1.175]   | [1.7976931348623157e308,2.2250738585072014e-308]     | [-32768,0,32767]   |
|    2 | [-2147483648,0,2147483647,4] | ["test"] | [127,0,-128,6,77] | [-9223372036854775808,9223372036854775807,775,808,2,0,1] | [3.402,0,1.175,4] | [1.7976931348623157e308,1.2,2.2250738585072014e-308] | [-32768,0,32767,0] |
|    3 | NULL                         | NULL     | NULL              | NULL                                                     | NULL              | NULL                                                 | NULL               |
+------+------------------------------+----------+-------------------+----------------------------------------------------------+-------------------+------------------------------------------------------+--------------------+
bug 2024110800105034260   《【obmysql_array二期】group by cardinality(),ob报4016》
select * from vtt1 group by cardinality(c4);
+------+------------------------------+----------+-------------------+----------------------------------------------------------+-------------------+------------------------------------------------------+--------------------+
| id   | c1                           | c2       | c3                | c4                                                       | c5                | c6                                                   | c7                 |
+------+------------------------------+----------+-------------------+----------------------------------------------------------+-------------------+------------------------------------------------------+--------------------+
|    1 | [-2147483648,0,2147483647]   | ["test"] | [127,0,-128]      | [-9223372036854775808,9223372036854775807,775,808,2,0]   | [3.402,0,1.175]   | [1.7976931348623157e308,2.2250738585072014e-308]     | [-32768,0,32767]   |
|    2 | [-2147483648,0,2147483647,4] | ["test"] | [127,0,-128,6,77] | [-9223372036854775808,9223372036854775807,775,808,2,0,1] | [3.402,0,1.175,4] | [1.7976931348623157e308,1.2,2.2250738585072014e-308] | [-32768,0,32767,0] |
|    3 | NULL                         | NULL     | NULL              | NULL                                                     | NULL              | NULL                                                 | NULL               |
+------+------------------------------+----------+-------------------+----------------------------------------------------------+-------------------+------------------------------------------------------+--------------------+
select *,cardinality(c4) from tt1 group by id having cardinality(c4)>12;
+------+------+------+------+------+------+------+------+-----------------+
| id   | c1   | c2   | c3   | c4   | c5   | c6   | c7   | cardinality(c4) |
+------+------+------+------+------+------+------+------+-----------------+
+------+------+------+------+------+------+------+------+-----------------+
select * from tt1 group by cardinality([1,23]);
+------+----------------------------+----------+--------------+--------------------------------------------------------+-----------------+--------------------------------------------------+------------------+
| id   | c1                         | c2       | c3           | c4                                                     | c5              | c6                                               | c7               |
+------+----------------------------+----------+--------------+--------------------------------------------------------+-----------------+--------------------------------------------------+------------------+
|    1 | [-2147483648,0,2147483647] | ["test"] | [127,0,-128] | [-9223372036854775808,9223372036854775807,775,808,2,0] | [3.402,0,1.175] | [1.7976931348623157e308,2.2250738585072014e-308] | [-32768,0,32767] |
+------+----------------------------+----------+--------------+--------------------------------------------------------+-----------------+--------------------------------------------------+------------------+
select cardinality(c1),cardinality(c2),cardinality(c3),cardinality(c5),cardinality(c6),cardinality(c7),cardinality(c4) from tt1 order by cardinality(c4) asc;
+-----------------+-----------------+-----------------+-----------------+-----------------+-----------------+-----------------+
| cardinality(c1) | cardinality(c2) | cardinality(c3) | cardinality(c5) | cardinality(c6) | cardinality(c7) | cardinality(c4) |
+-----------------+-----------------+-----------------+-----------------+-----------------+-----------------+-----------------+
|            NULL |            NULL |            NULL |            NULL |            NULL |            NULL |            NULL |
|               3 |               1 |               3 |               3 |               2 |               3 |               6 |
|               4 |               1 |               5 |               4 |               3 |               4 |               7 |
+-----------------+-----------------+-----------------+-----------------+-----------------+-----------------+-----------------+
select distinct cardinality(c1),cardinality(c3) from tt1;
+-----------------+-----------------+
| cardinality(c1) | cardinality(c3) |
+-----------------+-----------------+
|               3 |               3 |
|               4 |               5 |
|            NULL |            NULL |
+-----------------+-----------------+
select distinct cardinality([1,2,3,4]) from tt1;
+------------------------+
| cardinality([1,2,3,4]) |
+------------------------+
|                      4 |
+------------------------+
WITH Alice_Students AS (
    select cardinality(c1),cardinality(c2),cardinality(c3),cardinality(c5),cardinality(c6),cardinality(c7),cardinality(c4) from tt1
)
SELECT * FROM Alice_Students;
+-----------------+-----------------+-----------------+-----------------+-----------------+-----------------+-----------------+
| cardinality(c1) | cardinality(c2) | cardinality(c3) | cardinality(c5) | cardinality(c6) | cardinality(c7) | cardinality(c4) |
+-----------------+-----------------+-----------------+-----------------+-----------------+-----------------+-----------------+
|               3 |               1 |               3 |               3 |               2 |               3 |               6 |
|               4 |               1 |               5 |               4 |               3 |               4 |               7 |
|            NULL |            NULL |            NULL |            NULL |            NULL |            NULL |            NULL |
+-----------------+-----------------+-----------------+-----------------+-----------------+-----------------+-----------------+
WITH Alice_Students AS (
    select cardinality([1,2,3,4,5])
)
SELECT * FROM Alice_Students;
+--------------------------+
| cardinality([1,2,3,4,5]) |
+--------------------------+
|                        5 |
+--------------------------+
SELECT CASE cardinality([1,2,3,4,5]) WHEN cardinality([1,2,3,4,5])THEN cardinality([1,2,3,4,5]) WHEN cardinality([1,2,3,4,5,7,8]) THEN cardinality([1,2,3,4,5,7,8])  END;
+-------------------------------------------------------------------------------------------------------------------------------------------------------------------+
| CASE cardinality([1,2,3,4,5]) WHEN cardinality([1,2,3,4,5])THEN cardinality([1,2,3,4,5]) WHEN cardinality([1,2,3,4,5,7,8]) THEN cardinality([1,2,3,4,5,7,8])  END |
+-------------------------------------------------------------------------------------------------------------------------------------------------------------------+
|                                                                                                                                                                 5 |
+-------------------------------------------------------------------------------------------------------------------------------------------------------------------+
SELECT CASE cardinality([1,2,3,4,5,7,8]) WHEN cardinality([1,2,3,4,5])THEN cardinality([1,2,3,4,5]) WHEN cardinality([1,2,3,4,5,7,8]) THEN cardinality([1,2,3,4,5,7,8])  END;
+-----------------------------------------------------------------------------------------------------------------------------------------------------------------------+
| CASE cardinality([1,2,3,4,5,7,8]) WHEN cardinality([1,2,3,4,5])THEN cardinality([1,2,3,4,5]) WHEN cardinality([1,2,3,4,5,7,8]) THEN cardinality([1,2,3,4,5,7,8])  END |
+-----------------------------------------------------------------------------------------------------------------------------------------------------------------------+
|                                                                                                                                                                     7 |
+-----------------------------------------------------------------------------------------------------------------------------------------------------------------------+
SELECT CASE cardinality(c1) WHEN cardinality(c1)THEN cardinality(c1) WHEN cardinality(c2) THEN cardinality(c2)  END from tt1;
+--------------------------------------------------------------------------------------------------------------+
| CASE cardinality(c1) WHEN cardinality(c1)THEN cardinality(c1) WHEN cardinality(c2) THEN cardinality(c2)  END |
+--------------------------------------------------------------------------------------------------------------+
|                                                                                                            3 |
|                                                                                                            4 |
|                                                                                                         NULL |
+--------------------------------------------------------------------------------------------------------------+
SELECT CASE cardinality(c2) WHEN cardinality(c1)THEN cardinality(c1) WHEN cardinality(c2) THEN cardinality(c2)  END from tt1;
+--------------------------------------------------------------------------------------------------------------+
| CASE cardinality(c2) WHEN cardinality(c1)THEN cardinality(c1) WHEN cardinality(c2) THEN cardinality(c2)  END |
+--------------------------------------------------------------------------------------------------------------+
|                                                                                                            1 |
|                                                                                                            1 |
|                                                                                                         NULL |
+--------------------------------------------------------------------------------------------------------------+
select * from tt1 where cardinality(c5) =1;
+------+------+------+------+------+------+------+------+
| id   | c1   | c2   | c3   | c4   | c5   | c6   | c7   |
+------+------+------+------+------+------+------+------+
+------+------+------+------+------+------+------+------+
select * from tt1 where  cardinality(c5)='1';
+------+------+------+------+------+------+------+------+
| id   | c1   | c2   | c3   | c4   | c5   | c6   | c7   |
+------+------+------+------+------+------+------+------+
+------+------+------+------+------+------+------+------+
select * from tt1 where  cardinality(c5)=cardinality(c5);
+------+------------------------------+----------+-------------------+----------------------------------------------------------+-------------------+------------------------------------------------------+--------------------+
| id   | c1                           | c2       | c3                | c4                                                       | c5                | c6                                                   | c7                 |
+------+------------------------------+----------+-------------------+----------------------------------------------------------+-------------------+------------------------------------------------------+--------------------+
|    1 | [-2147483648,0,2147483647]   | ["test"] | [127,0,-128]      | [-9223372036854775808,9223372036854775807,775,808,2,0]   | [3.402,0,1.175]   | [1.7976931348623157e308,2.2250738585072014e-308]     | [-32768,0,32767]   |
|    2 | [-2147483648,0,2147483647,4] | ["test"] | [127,0,-128,6,77] | [-9223372036854775808,9223372036854775807,775,808,2,0,1] | [3.402,0,1.175,4] | [1.7976931348623157e308,1.2,2.2250738585072014e-308] | [-32768,0,32767,0] |
+------+------------------------------+----------+-------------------+----------------------------------------------------------+-------------------+------------------------------------------------------+--------------------+
select * from tt1 where  cardinality(c5)=cardinality(c5);
+------+------------------------------+----------+-------------------+----------------------------------------------------------+-------------------+------------------------------------------------------+--------------------+
| id   | c1                           | c2       | c3                | c4                                                       | c5                | c6                                                   | c7                 |
+------+------------------------------+----------+-------------------+----------------------------------------------------------+-------------------+------------------------------------------------------+--------------------+
|    1 | [-2147483648,0,2147483647]   | ["test"] | [127,0,-128]      | [-9223372036854775808,9223372036854775807,775,808,2,0]   | [3.402,0,1.175]   | [1.7976931348623157e308,2.2250738585072014e-308]     | [-32768,0,32767]   |
|    2 | [-2147483648,0,2147483647,4] | ["test"] | [127,0,-128,6,77] | [-9223372036854775808,9223372036854775807,775,808,2,0,1] | [3.402,0,1.175,4] | [1.7976931348623157e308,1.2,2.2250738585072014e-308] | [-32768,0,32767,0] |
+------+------------------------------+----------+-------------------+----------------------------------------------------------+-------------------+------------------------------------------------------+--------------------+
select * from tt1 where cardinality(c5)<'test';
+------+------+------+------+------+------+------+------+
| id   | c1   | c2   | c3   | c4   | c5   | c6   | c7   |
+------+------+------+------+------+------+------+------+
+------+------+------+------+------+------+------+------+
Warnings:
Warning	1292	Truncated incorrect DECIMAL value: 'test'
Warning	1292	Truncated incorrect DECIMAL value: 'test'
select * from tt1 where cardinality(c5)<=>id;
+------+------+------+------+------+------+------+------+
| id   | c1   | c2   | c3   | c4   | c5   | c6   | c7   |
+------+------+------+------+------+------+------+------+
+------+------+------+------+------+------+------+------+
select * from tt1 where cardinality(c5)!= cardinality([1,2,34,5,6]);
+------+------------------------------+----------+-------------------+----------------------------------------------------------+-------------------+------------------------------------------------------+--------------------+
| id   | c1                           | c2       | c3                | c4                                                       | c5                | c6                                                   | c7                 |
+------+------------------------------+----------+-------------------+----------------------------------------------------------+-------------------+------------------------------------------------------+--------------------+
|    1 | [-2147483648,0,2147483647]   | ["test"] | [127,0,-128]      | [-9223372036854775808,9223372036854775807,775,808,2,0]   | [3.402,0,1.175]   | [1.7976931348623157e308,2.2250738585072014e-308]     | [-32768,0,32767]   |
|    2 | [-2147483648,0,2147483647,4] | ["test"] | [127,0,-128,6,77] | [-9223372036854775808,9223372036854775807,775,808,2,0,1] | [3.402,0,1.175,4] | [1.7976931348623157e308,1.2,2.2250738585072014e-308] | [-32768,0,32767,0] |
+------+------------------------------+----------+-------------------+----------------------------------------------------------+-------------------+------------------------------------------------------+--------------------+
select * from tt1 where cardinality(c5) BETWEEN cardinality(c5) AND cardinality(c5);
+------+------------------------------+----------+-------------------+----------------------------------------------------------+-------------------+------------------------------------------------------+--------------------+
| id   | c1                           | c2       | c3                | c4                                                       | c5                | c6                                                   | c7                 |
+------+------------------------------+----------+-------------------+----------------------------------------------------------+-------------------+------------------------------------------------------+--------------------+
|    1 | [-2147483648,0,2147483647]   | ["test"] | [127,0,-128]      | [-9223372036854775808,9223372036854775807,775,808,2,0]   | [3.402,0,1.175]   | [1.7976931348623157e308,2.2250738585072014e-308]     | [-32768,0,32767]   |
|    2 | [-2147483648,0,2147483647,4] | ["test"] | [127,0,-128,6,77] | [-9223372036854775808,9223372036854775807,775,808,2,0,1] | [3.402,0,1.175,4] | [1.7976931348623157e308,1.2,2.2250738585072014e-308] | [-32768,0,32767,0] |
+------+------------------------------+----------+-------------------+----------------------------------------------------------+-------------------+------------------------------------------------------+--------------------+
select * from tt1 where cardinality(c5) not BETWEEN cardinality(c5) AND cardinality(c5);
+------+------+------+------+------+------+------+------+
| id   | c1   | c2   | c3   | c4   | c5   | c6   | c7   |
+------+------+------+------+------+------+------+------+
+------+------+------+------+------+------+------+------+
select * from tt1 where cardinality(c5) not in (cardinality(c5),cardinality([1,2,5,7])) ;
+------+------+------+------+------+------+------+------+
| id   | c1   | c2   | c3   | c4   | c5   | c6   | c7   |
+------+------+------+------+------+------+------+------+
+------+------+------+------+------+------+------+------+
select * from tt1 where cardinality(c5)  in (cardinality(c5),cardinality([1,2,5,7])) ;
+------+------------------------------+----------+-------------------+----------------------------------------------------------+-------------------+------------------------------------------------------+--------------------+
| id   | c1                           | c2       | c3                | c4                                                       | c5                | c6                                                   | c7                 |
+------+------------------------------+----------+-------------------+----------------------------------------------------------+-------------------+------------------------------------------------------+--------------------+
|    1 | [-2147483648,0,2147483647]   | ["test"] | [127,0,-128]      | [-9223372036854775808,9223372036854775807,775,808,2,0]   | [3.402,0,1.175]   | [1.7976931348623157e308,2.2250738585072014e-308]     | [-32768,0,32767]   |
|    2 | [-2147483648,0,2147483647,4] | ["test"] | [127,0,-128,6,77] | [-9223372036854775808,9223372036854775807,775,808,2,0,1] | [3.402,0,1.175,4] | [1.7976931348623157e308,1.2,2.2250738585072014e-308] | [-32768,0,32767,0] |
+------+------------------------------+----------+-------------------+----------------------------------------------------------+-------------------+------------------------------------------------------+--------------------+
select * from tt1 where cardinality(c5) like cardinality(c5);
+------+------------------------------+----------+-------------------+----------------------------------------------------------+-------------------+------------------------------------------------------+--------------------+
| id   | c1                           | c2       | c3                | c4                                                       | c5                | c6                                                   | c7                 |
+------+------------------------------+----------+-------------------+----------------------------------------------------------+-------------------+------------------------------------------------------+--------------------+
|    1 | [-2147483648,0,2147483647]   | ["test"] | [127,0,-128]      | [-9223372036854775808,9223372036854775807,775,808,2,0]   | [3.402,0,1.175]   | [1.7976931348623157e308,2.2250738585072014e-308]     | [-32768,0,32767]   |
|    2 | [-2147483648,0,2147483647,4] | ["test"] | [127,0,-128,6,77] | [-9223372036854775808,9223372036854775807,775,808,2,0,1] | [3.402,0,1.175,4] | [1.7976931348623157e308,1.2,2.2250738585072014e-308] | [-32768,0,32767,0] |
+------+------------------------------+----------+-------------------+----------------------------------------------------------+-------------------+------------------------------------------------------+--------------------+
select * from tt1 where cardinality(c5) not like cardinality(c5);
+------+------+------+------+------+------+------+------+
| id   | c1   | c2   | c3   | c4   | c5   | c6   | c7   |
+------+------+------+------+------+------+------+------+
+------+------+------+------+------+------+------+------+
select * from tt1 where cardinality(c5) is true;
+------+------------------------------+----------+-------------------+----------------------------------------------------------+-------------------+------------------------------------------------------+--------------------+
| id   | c1                           | c2       | c3                | c4                                                       | c5                | c6                                                   | c7                 |
+------+------------------------------+----------+-------------------+----------------------------------------------------------+-------------------+------------------------------------------------------+--------------------+
|    1 | [-2147483648,0,2147483647]   | ["test"] | [127,0,-128]      | [-9223372036854775808,9223372036854775807,775,808,2,0]   | [3.402,0,1.175]   | [1.7976931348623157e308,2.2250738585072014e-308]     | [-32768,0,32767]   |
|    2 | [-2147483648,0,2147483647,4] | ["test"] | [127,0,-128,6,77] | [-9223372036854775808,9223372036854775807,775,808,2,0,1] | [3.402,0,1.175,4] | [1.7976931348623157e308,1.2,2.2250738585072014e-308] | [-32768,0,32767,0] |
+------+------------------------------+----------+-------------------+----------------------------------------------------------+-------------------+------------------------------------------------------+--------------------+
select * from tt1 where cardinality([1,2])  is not true;
+------+------+------+------+------+------+------+------+
| id   | c1   | c2   | c3   | c4   | c5   | c6   | c7   |
+------+------+------+------+------+------+------+------+
+------+------+------+------+------+------+------+------+
select * from tt1 where cardinality([1])  is false;
+------+------+------+------+------+------+------+------+
| id   | c1   | c2   | c3   | c4   | c5   | c6   | c7   |
+------+------+------+------+------+------+------+------+
+------+------+------+------+------+------+------+------+
select * from tt1 where cardinality(c1)  is not false;
+------+------------------------------+----------+-------------------+----------------------------------------------------------+-------------------+------------------------------------------------------+--------------------+
| id   | c1                           | c2       | c3                | c4                                                       | c5                | c6                                                   | c7                 |
+------+------------------------------+----------+-------------------+----------------------------------------------------------+-------------------+------------------------------------------------------+--------------------+
|    1 | [-2147483648,0,2147483647]   | ["test"] | [127,0,-128]      | [-9223372036854775808,9223372036854775807,775,808,2,0]   | [3.402,0,1.175]   | [1.7976931348623157e308,2.2250738585072014e-308]     | [-32768,0,32767]   |
|    2 | [-2147483648,0,2147483647,4] | ["test"] | [127,0,-128,6,77] | [-9223372036854775808,9223372036854775807,775,808,2,0,1] | [3.402,0,1.175,4] | [1.7976931348623157e308,1.2,2.2250738585072014e-308] | [-32768,0,32767,0] |
|    3 | NULL                         | NULL     | NULL              | NULL                                                     | NULL              | NULL                                                 | NULL               |
+------+------------------------------+----------+-------------------+----------------------------------------------------------+-------------------+------------------------------------------------------+--------------------+
select * from tt1 where cardinality(c5)  is not null;
+------+------------------------------+----------+-------------------+----------------------------------------------------------+-------------------+------------------------------------------------------+--------------------+
| id   | c1                           | c2       | c3                | c4                                                       | c5                | c6                                                   | c7                 |
+------+------------------------------+----------+-------------------+----------------------------------------------------------+-------------------+------------------------------------------------------+--------------------+
|    1 | [-2147483648,0,2147483647]   | ["test"] | [127,0,-128]      | [-9223372036854775808,9223372036854775807,775,808,2,0]   | [3.402,0,1.175]   | [1.7976931348623157e308,2.2250738585072014e-308]     | [-32768,0,32767]   |
|    2 | [-2147483648,0,2147483647,4] | ["test"] | [127,0,-128,6,77] | [-9223372036854775808,9223372036854775807,775,808,2,0,1] | [3.402,0,1.175,4] | [1.7976931348623157e308,1.2,2.2250738585072014e-308] | [-32768,0,32767,0] |
+------+------------------------------+----------+-------------------+----------------------------------------------------------+-------------------+------------------------------------------------------+--------------------+
select * from tt1 where cardinality(c5)  is  null;
+------+------+------+------+------+------+------+------+
| id   | c1   | c2   | c3   | c4   | c5   | c6   | c7   |
+------+------+------+------+------+------+------+------+
|    3 | NULL | NULL | NULL | NULL | NULL | NULL | NULL |
+------+------+------+------+------+------+------+------+
select cast(cardinality(c5) as unsigned) from tt1;
+-----------------------------------+
| cast(cardinality(c5) as unsigned) |
+-----------------------------------+
|                                 3 |
|                                 4 |
|                              NULL |
+-----------------------------------+
select cast(cardinality(c5) as UNSIGNED) from tt1;
+-----------------------------------+
| cast(cardinality(c5) as UNSIGNED) |
+-----------------------------------+
|                                 3 |
|                                 4 |
|                              NULL |
+-----------------------------------+
select cast(cardinality(c5) as char(10)) from tt1;
+-----------------------------------+
| cast(cardinality(c5) as char(10)) |
+-----------------------------------+
| 3                                 |
| 4                                 |
| NULL                              |
+-----------------------------------+
select cast(cardinality(c5) as binary(10)) from tt1;
+-------------------------------------+
| cast(cardinality(c5) as binary(10)) |
+-------------------------------------+
| 3                                   |
| 4                                   |
| NULL                                |
+-------------------------------------+
select cast(cardinality(c5) as SIGNED) from tt1;
+---------------------------------+
| cast(cardinality(c5) as SIGNED) |
+---------------------------------+
|                               3 |
|                               4 |
|                            NULL |
+---------------------------------+
select cast(cardinality(c5) as date) from tt1;
+-------------------------------+
| cast(cardinality(c5) as date) |
+-------------------------------+
| NULL                          |
| NULL                          |
| NULL                          |
+-------------------------------+
select cast(cardinality(c5) as DATETIME) from tt1;
+-----------------------------------+
| cast(cardinality(c5) as DATETIME) |
+-----------------------------------+
| NULL                              |
| NULL                              |
| NULL                              |
+-----------------------------------+
select cast(cardinality(c5) as TIME) from tt1;
+-------------------------------+
| cast(cardinality(c5) as TIME) |
+-------------------------------+
| 00:00:03                      |
| 00:00:04                      |
| NULL                          |
+-------------------------------+
select cast(cardinality(c5) as FLOAT) from tt1;
+--------------------------------+
| cast(cardinality(c5) as FLOAT) |
+--------------------------------+
|                              3 |
|                              4 |
|                           NULL |
+--------------------------------+
select cast(cardinality(c5) as year) from tt1;
+-------------------------------+
| cast(cardinality(c5) as year) |
+-------------------------------+
|                          2003 |
|                          2004 |
|                          NULL |
+-------------------------------+
select cast(cardinality(c5) as DOUBLE) from tt1;
+---------------------------------+
| cast(cardinality(c5) as DOUBLE) |
+---------------------------------+
|                               3 |
|                               4 |
|                            NULL |
+---------------------------------+
select cast(cardinality(c5) as DECIMAL) from tt1;
+----------------------------------+
| cast(cardinality(c5) as DECIMAL) |
+----------------------------------+
|                                3 |
|                                4 |
|                             NULL |
+----------------------------------+
select cast(cardinality(c5) as NUMERIC) from tt1;
+----------------------------------+
| cast(cardinality(c5) as NUMERIC) |
+----------------------------------+
|                                3 |
|                                4 |
|                             NULL |
+----------------------------------+
select cast(cardinality(c5) as dec) from tt1;
+------------------------------+
| cast(cardinality(c5) as dec) |
+------------------------------+
|                            3 |
|                            4 |
|                         NULL |
+------------------------------+
select cast(cardinality(c5) as FIXED) from tt1;
+--------------------------------+
| cast(cardinality(c5) as FIXED) |
+--------------------------------+
|                              3 |
|                              4 |
|                           NULL |
+--------------------------------+
select cast(cardinality(c5) as  point) from tt1;
ERROR 22023: Invalid GIS data provided to function cast_as_point.
select cast(cardinality(c5) as  point) from tt1;
ERROR 22023: Invalid GIS data provided to function cast_as_point.
drop table tt3;
create table tt3(id int,a int[]);
insert into tt3 values(1,[1,2,3]);
insert into tt3 values(2,[5,6,7]);
insert into tt3 values(3,[5,6,7]);
drop table tt4;
create table tt4(id int,a int[]);
insert into tt4 values(1,[1,2,3]);
insert into tt4 values(2,[5,6,7]);
insert into tt4 values(3,[9]);
select t3.* from tt3 t3 inner join tt4 t4 on t3.id=cardinality(t4.a);
+------+---------+
| id   | a       |
+------+---------+
|    1 | [1,2,3] |
|    3 | [5,6,7] |
|    3 | [5,6,7] |
+------+---------+
select t3.* from tt3 t3 inner join tt4 t4 on cardinality(t3.a)=t4.id;
+------+---------+
| id   | a       |
+------+---------+
|    1 | [1,2,3] |
|    2 | [5,6,7] |
|    3 | [5,6,7] |
+------+---------+
select t3.* from tt3 t3 left join tt4 t4 on cardinality(t3.a)=cardinality(t4.a);
+------+---------+
| id   | a       |
+------+---------+
|    1 | [1,2,3] |
|    2 | [5,6,7] |
|    3 | [5,6,7] |
|    1 | [1,2,3] |
|    2 | [5,6,7] |
|    3 | [5,6,7] |
+------+---------+
select * from tt3 t3 right join tt4 t4 on t4.id!=cardinality(t3.a);
+------+---------+------+---------+
| id   | a       | id   | a       |
+------+---------+------+---------+
|    1 | [1,2,3] |    1 | [1,2,3] |
|    2 | [5,6,7] |    1 | [1,2,3] |
|    3 | [5,6,7] |    1 | [1,2,3] |
|    1 | [1,2,3] |    2 | [5,6,7] |
|    2 | [5,6,7] |    2 | [5,6,7] |
|    3 | [5,6,7] |    2 | [5,6,7] |
| NULL | NULL    |    3 | [9]     |
+------+---------+------+---------+
select * from tt3 t3 full join tt4 t4 on t3.id>cardinality([1,2,45,67]);
+------+---------+------+---------+
| id   | a       | id   | a       |
+------+---------+------+---------+
|    1 | [1,2,3] | NULL | NULL    |
|    2 | [5,6,7] | NULL | NULL    |
|    3 | [5,6,7] | NULL | NULL    |
| NULL | NULL    |    1 | [1,2,3] |
| NULL | NULL    |    2 | [5,6,7] |
| NULL | NULL    |    3 | [9]     |
+------+---------+------+---------+
select /*+enable_parallel_dml parallel(2) */ cardinality(c5) from tt1;
+-----------------+
| cardinality(c5) |
+-----------------+
|               3 |
|               4 |
|            NULL |
+-----------------+
select /*+enable_parallel_dml parallel(2) */ cardinality(c5) from vtt1;
+-----------------+
| cardinality(c5) |
+-----------------+
|               3 |
|               4 |
|            NULL |
+-----------------+
select /*+enable_parallel_dml parallel(2) */ cardinality(c5) from tt2;
+-----------------+
| cardinality(c5) |
+-----------------+
|               3 |
|               4 |
|            NULL |
+-----------------+
select /*+enable_parallel_dml parallel(2) */ cardinality(c5) from vtt2;
+-----------------+
| cardinality(c5) |
+-----------------+
|               3 |
|               4 |
|            NULL |
+-----------------+
select /*+read_consistency(weak) */ cardinality(c5) from tt1;
+-----------------+
| cardinality(c5) |
+-----------------+
|               3 |
|               4 |
|            NULL |
+-----------------+
select /*+read_consistency(weak) */ cardinality(c5) from vtt1;
+-----------------+
| cardinality(c5) |
+-----------------+
|               3 |
|               4 |
|            NULL |
+-----------------+
select /*+read_consistency(weak) */ cardinality(c5) from tt2;
+-----------------+
| cardinality(c5) |
+-----------------+
|               3 |
|               4 |
|            NULL |
+-----------------+
select /*+read_consistency(weak) */ cardinality(c5) from vtt2;
+-----------------+
| cardinality(c5) |
+-----------------+
|               3 |
|               4 |
|            NULL |
+-----------------+
drop table if exists t1;
Warnings:
Note	1051	Unknown table 'oblrp.t1'
create table t1(c1 int ,  c2 varchar(256)[]) partition by hash(c1);
insert into t1 values(1,'[1,1,1]');
insert into t1 values(2,null);
select cardinality(a1) from t1 a,t1 b,unnest([[a.c1]],[[b.c2]])a(a1,a2);
+-----------------+
| cardinality(a1) |
+-----------------+
|               1 |
|               1 |
|               1 |
|               1 |
+-----------------+
select rb_build(a1) from t1 a,t1 b,unnest([[a.c1]],[[b.c2]])a(a1,a2);
+--------------+
| rb_build(a1) |
+--------------+
|           |
|           |
|           |
|           |
+--------------+
select array_to_string(a1,'-') from t1 a,t1 b,unnest([[a.c1]],[[b.c2]])a(a1,a2);
+-------------------------+
| array_to_string(a1,'-') |
+-------------------------+
| 1                       |
| 2                       |
| 1                       |
| 2                       |
+-------------------------+
select array_agg(a1) from t1 a,t1 b,unnest([[a.c1]],[[b.c2]])a(a1,a2);
+-------------------+
| array_agg(a1)     |
+-------------------+
| [[1],[2],[1],[2]] |
+-------------------+
select array_overlaps(a2,a1) from t1 a,t1 b,unnest([[a.c1]],[b.c2])a(a1,a2);
+-----------------------+
| array_overlaps(a2,a1) |
+-----------------------+
|                     1 |
|                     0 |
|                  NULL |
|                  NULL |
+-----------------------+
select array_contains_all(a2,a1) from t1 a,t1 b,unnest([[a.c1]],[b.c2])a(a1,a2);
+---------------------------+
| array_contains_all(a2,a1) |
+---------------------------+
|                         1 |
|                         0 |
|                      NULL |
|                      NULL |
+---------------------------+
select * from (select cardinality(c1) from tt1);
+-----------------+
| cardinality(c1) |
+-----------------+
|               3 |
|               4 |
|            NULL |
+-----------------+
select * from ( select cardinality([1,2,3,4]) from tt1);
+------------------------+
| cardinality([1,2,3,4]) |
+------------------------+
|                      4 |
|                      4 |
|                      4 |
+------------------------+
select +cardinality(c1) from tt1;
+------------------+
| +cardinality(c1) |
+------------------+
|                3 |
|                4 |
|             NULL |
+------------------+
select +cardinality(c1) from vtt2;
+------------------+
| +cardinality(c1) |
+------------------+
|                3 |
|                4 |
|             NULL |
+------------------+
select -cardinality(c1) from tt1;
+------------------+
| -cardinality(c1) |
+------------------+
|               -3 |
|               -4 |
|             NULL |
+------------------+
select cardinality(c1)+cardinality(c1) from tt1;
+---------------------------------+
| cardinality(c1)+cardinality(c1) |
+---------------------------------+
|                               6 |
|                               8 |
|                            NULL |
+---------------------------------+
select cardinality(c1)+1 from tt1;
+-------------------+
| cardinality(c1)+1 |
+-------------------+
|                 4 |
|                 5 |
|              NULL |
+-------------------+
select cardinality(c1)+'test' from tt1;
+------------------------+
| cardinality(c1)+'test' |
+------------------------+
|                      3 |
|                      4 |
|                   NULL |
+------------------------+
Warnings:
Warning	1292	Truncated incorrect DOUBLE value: 'test'
select cardinality(c1)+null from tt1;
+----------------------+
| cardinality(c1)+null |
+----------------------+
|                 NULL |
|                 NULL |
|                 NULL |
+----------------------+
select cardinality(c1)+false from tt1;
+-----------------------+
| cardinality(c1)+false |
+-----------------------+
|                     3 |
|                     4 |
|                  NULL |
+-----------------------+
select cardinality(c1)+true from tt1;
+----------------------+
| cardinality(c1)+true |
+----------------------+
|                    4 |
|                    5 |
|                 NULL |
+----------------------+
select cardinality(c1)-cardinality(c1) from tt1;
+---------------------------------+
| cardinality(c1)-cardinality(c1) |
+---------------------------------+
|                               0 |
|                               0 |
|                            NULL |
+---------------------------------+
select cardinality(c1)-1 from tt1;
+-------------------+
| cardinality(c1)-1 |
+-------------------+
|                 2 |
|                 3 |
|              NULL |
+-------------------+
select cardinality(c1)-'test' from tt1;
+------------------------+
| cardinality(c1)-'test' |
+------------------------+
|                      3 |
|                      4 |
|                   NULL |
+------------------------+
Warnings:
Warning	1292	Truncated incorrect DOUBLE value: 'test'
select cardinality(c1)-null from tt1;
+----------------------+
| cardinality(c1)-null |
+----------------------+
|                 NULL |
|                 NULL |
|                 NULL |
+----------------------+
select cardinality(c1)-false from tt1;
+-----------------------+
| cardinality(c1)-false |
+-----------------------+
|                     3 |
|                     4 |
|                  NULL |
+-----------------------+
select cardinality(c1)-true from tt1;
+----------------------+
| cardinality(c1)-true |
+----------------------+
|                    2 |
|                    3 |
|                 NULL |
+----------------------+
select cardinality(c1)*cardinality(c1) from tt1;
+---------------------------------+
| cardinality(c1)*cardinality(c1) |
+---------------------------------+
|                               9 |
|                              16 |
|                            NULL |
+---------------------------------+
select cardinality(c1)*1 from tt1;
+-------------------+
| cardinality(c1)*1 |
+-------------------+
|                 3 |
|                 4 |
|              NULL |
+-------------------+
select cardinality(c1)*'test' from tt1;
+------------------------+
| cardinality(c1)*'test' |
+------------------------+
|                      0 |
|                      0 |
|                   NULL |
+------------------------+
Warnings:
Warning	1292	Truncated incorrect DOUBLE value: 'test'
select cardinality(c1)*null from tt1;
+----------------------+
| cardinality(c1)*null |
+----------------------+
|                 NULL |
|                 NULL |
|                 NULL |
+----------------------+
select cardinality(c1)*false from tt1;
+-----------------------+
| cardinality(c1)*false |
+-----------------------+
|                     0 |
|                     0 |
|                  NULL |
+-----------------------+
select cardinality(c1)*true from tt1;
+----------------------+
| cardinality(c1)*true |
+----------------------+
|                    3 |
|                    4 |
|                 NULL |
+----------------------+
select cardinality(c1)*cardinality(c1) from tt1;
+---------------------------------+
| cardinality(c1)*cardinality(c1) |
+---------------------------------+
|                               9 |
|                              16 |
|                            NULL |
+---------------------------------+
select cardinality(c1)*1 from tt1;
+-------------------+
| cardinality(c1)*1 |
+-------------------+
|                 3 |
|                 4 |
|              NULL |
+-------------------+
select cardinality(c1)*'test' from tt1;
+------------------------+
| cardinality(c1)*'test' |
+------------------------+
|                      0 |
|                      0 |
|                   NULL |
+------------------------+
Warnings:
Warning	1292	Truncated incorrect DOUBLE value: 'test'
select cardinality(c1)*false from tt1;
+-----------------------+
| cardinality(c1)*false |
+-----------------------+
|                     0 |
|                     0 |
|                  NULL |
+-----------------------+
select cardinality(c1)*true from tt1;
+----------------------+
| cardinality(c1)*true |
+----------------------+
|                    3 |
|                    4 |
|                 NULL |
+----------------------+
select cardinality(c1)/cardinality(c1) from tt1;
+---------------------------------+
| cardinality(c1)/cardinality(c1) |
+---------------------------------+
|                          1.0000 |
|                          1.0000 |
|                            NULL |
+---------------------------------+
select cardinality(c1)/1 from tt1;
+-------------------+
| cardinality(c1)/1 |
+-------------------+
|            3.0000 |
|            4.0000 |
|              NULL |
+-------------------+
select cardinality(c1)/'test' from tt1;
+------------------------+
| cardinality(c1)/'test' |
+------------------------+
|                   NULL |
|                   NULL |
|                   NULL |
+------------------------+
Warnings:
Warning	1292	Truncated incorrect DOUBLE value: 'test'
select cardinality(c1)/null from tt1;
+----------------------+
| cardinality(c1)/null |
+----------------------+
|                 NULL |
|                 NULL |
|                 NULL |
+----------------------+
select cardinality(c1)/false from tt1;
+-----------------------+
| cardinality(c1)/false |
+-----------------------+
|                  NULL |
|                  NULL |
|                  NULL |
+-----------------------+
select cardinality(c1)/true from tt1;
+----------------------+
| cardinality(c1)/true |
+----------------------+
|               3.0000 |
|               4.0000 |
|                 NULL |
+----------------------+
select cardinality(c1) div cardinality(c1) from tt1;
+-------------------------------------+
| cardinality(c1) div cardinality(c1) |
+-------------------------------------+
|                                   1 |
|                                   1 |
|                                NULL |
+-------------------------------------+
select cardinality(c1) div 1 from tt1;
+-----------------------+
| cardinality(c1) div 1 |
+-----------------------+
|                     3 |
|                     4 |
|                  NULL |
+-----------------------+
select cardinality(c1) div 'test' from tt1;
+----------------------------+
| cardinality(c1) div 'test' |
+----------------------------+
|                       NULL |
|                       NULL |
|                       NULL |
+----------------------------+
Warnings:
Warning	1292	Truncated incorrect DECIMAL value: 'test'
select cardinality(c1) div null from tt1;
+--------------------------+
| cardinality(c1) div null |
+--------------------------+
|                     NULL |
|                     NULL |
|                     NULL |
+--------------------------+
select cardinality(c1) div false from tt1;
+---------------------------+
| cardinality(c1) div false |
+---------------------------+
|                      NULL |
|                      NULL |
|                      NULL |
+---------------------------+
select cardinality(c1) div true from tt1;
+--------------------------+
| cardinality(c1) div true |
+--------------------------+
|                        3 |
|                        4 |
|                     NULL |
+--------------------------+
select cardinality(c1) % cardinality(c1) from tt1;
+-----------------------------------+
| cardinality(c1) % cardinality(c1) |
+-----------------------------------+
|                                 0 |
|                                 0 |
|                              NULL |
+-----------------------------------+
select cardinality(c1) % 1 from tt1;
+---------------------+
| cardinality(c1) % 1 |
+---------------------+
|                   0 |
|                   0 |
|                NULL |
+---------------------+
select cardinality(c1) % 'test' from tt1;
+--------------------------+
| cardinality(c1) % 'test' |
+--------------------------+
|                     NULL |
|                     NULL |
|                     NULL |
+--------------------------+
Warnings:
Warning	1292	Truncated incorrect DOUBLE value: 'test'
select cardinality(c1) % null from tt1;
+------------------------+
| cardinality(c1) % null |
+------------------------+
|                   NULL |
|                   NULL |
|                   NULL |
+------------------------+
select cardinality(c1) % false from tt1;
+-------------------------+
| cardinality(c1) % false |
+-------------------------+
|                    NULL |
|                    NULL |
|                    NULL |
+-------------------------+
select cardinality(c1) % true from tt1;
+------------------------+
| cardinality(c1) % true |
+------------------------+
|                      0 |
|                      0 |
|                   NULL |
+------------------------+
select cardinality(c1) mod cardinality(c1) from tt1;
+-------------------------------------+
| cardinality(c1) mod cardinality(c1) |
+-------------------------------------+
|                                   0 |
|                                   0 |
|                                NULL |
+-------------------------------------+
select cardinality(c1) mod 1 from tt1;
+-----------------------+
| cardinality(c1) mod 1 |
+-----------------------+
|                     0 |
|                     0 |
|                  NULL |
+-----------------------+
select cardinality(c1) mod 'test' from tt1;
+----------------------------+
| cardinality(c1) mod 'test' |
+----------------------------+
|                       NULL |
|                       NULL |
|                       NULL |
+----------------------------+
Warnings:
Warning	1292	Truncated incorrect DOUBLE value: 'test'
select cardinality(c1) mod null from tt1;
+--------------------------+
| cardinality(c1) mod null |
+--------------------------+
|                     NULL |
|                     NULL |
|                     NULL |
+--------------------------+
select cardinality(c1) mod false from tt1;
+---------------------------+
| cardinality(c1) mod false |
+---------------------------+
|                      NULL |
|                      NULL |
|                      NULL |
+---------------------------+
select cardinality(c1) mod true from tt1;
+--------------------------+
| cardinality(c1) mod true |
+--------------------------+
|                        0 |
|                        0 |
|                     NULL |
+--------------------------+
select cardinality(c1) & cardinality(c1) from tt1;
+-----------------------------------+
| cardinality(c1) & cardinality(c1) |
+-----------------------------------+
|                                 3 |
|                                 4 |
|                              NULL |
+-----------------------------------+
select cardinality(c1) & 1 from tt1;
+---------------------+
| cardinality(c1) & 1 |
+---------------------+
|                   1 |
|                   0 |
|                NULL |
+---------------------+
select cardinality(c1) & 'test' from tt1;
+--------------------------+
| cardinality(c1) & 'test' |
+--------------------------+
|                        0 |
|                        0 |
|                     NULL |
+--------------------------+
Warnings:
Warning	1292	Truncated incorrect INTEGER value: 'test'
select cardinality(c1) & null from tt1;
+------------------------+
| cardinality(c1) & null |
+------------------------+
|                   NULL |
|                   NULL |
|                   NULL |
+------------------------+
select cardinality(c1) & false from tt1;
+-------------------------+
| cardinality(c1) & false |
+-------------------------+
|                       0 |
|                       0 |
|                    NULL |
+-------------------------+
select cardinality(c1) & true from tt1;
+------------------------+
| cardinality(c1) & true |
+------------------------+
|                      1 |
|                      0 |
|                   NULL |
+------------------------+
select cardinality(c1) | cardinality(c1) from tt1;
+-----------------------------------+
| cardinality(c1) | cardinality(c1) |
+-----------------------------------+
|                                 3 |
|                                 4 |
|                              NULL |
+-----------------------------------+
select cardinality(c1) | 1 from tt1;
+---------------------+
| cardinality(c1) | 1 |
+---------------------+
|                   3 |
|                   5 |
|                NULL |
+---------------------+
select cardinality(c1) | 'test' from tt1;
+--------------------------+
| cardinality(c1) | 'test' |
+--------------------------+
|                        3 |
|                        4 |
|                     NULL |
+--------------------------+
Warnings:
Warning	1292	Truncated incorrect INTEGER value: 'test'
select cardinality(c1) | null from tt1;
+------------------------+
| cardinality(c1) | null |
+------------------------+
|                   NULL |
|                   NULL |
|                   NULL |
+------------------------+
select cardinality(c1) | false from tt1;
+-------------------------+
| cardinality(c1) | false |
+-------------------------+
|                       3 |
|                       4 |
|                    NULL |
+-------------------------+
select cardinality(c1) | true from tt1;
+------------------------+
| cardinality(c1) | true |
+------------------------+
|                      3 |
|                      5 |
|                   NULL |
+------------------------+
select ~cardinality(c1)from tt1;
+----------------------+
| ~cardinality(c1)     |
+----------------------+
| 18446744073709551612 |
| 18446744073709551611 |
|                 NULL |
+----------------------+
select cardinality(c1) ^ cardinality(c1) from tt1;
+-----------------------------------+
| cardinality(c1) ^ cardinality(c1) |
+-----------------------------------+
|                                 0 |
|                                 0 |
|                              NULL |
+-----------------------------------+
select cardinality(c1) ^ 1 from tt1;
+---------------------+
| cardinality(c1) ^ 1 |
+---------------------+
|                   2 |
|                   5 |
|                NULL |
+---------------------+
select cardinality(c1) ^ 'test' from tt1;
+--------------------------+
| cardinality(c1) ^ 'test' |
+--------------------------+
|                        3 |
|                        4 |
|                     NULL |
+--------------------------+
Warnings:
Warning	1292	Truncated incorrect INTEGER value: 'test'
select cardinality(c1) ^ null from tt1;
+------------------------+
| cardinality(c1) ^ null |
+------------------------+
|                   NULL |
|                   NULL |
|                   NULL |
+------------------------+
select cardinality(c1) ^ false from tt1;
+-------------------------+
| cardinality(c1) ^ false |
+-------------------------+
|                       3 |
|                       4 |
|                    NULL |
+-------------------------+
select cardinality(c1) ^ true from tt1;
+------------------------+
| cardinality(c1) ^ true |
+------------------------+
|                      2 |
|                      5 |
|                   NULL |
+------------------------+
select cardinality(c1) << cardinality(c1) from tt1;
+------------------------------------+
| cardinality(c1) << cardinality(c1) |
+------------------------------------+
|                                 24 |
|                                 64 |
|                               NULL |
+------------------------------------+
select cardinality(c1) << 1 from tt1;
+----------------------+
| cardinality(c1) << 1 |
+----------------------+
|                    6 |
|                    8 |
|                 NULL |
+----------------------+
select cardinality(c1) << 'test' from tt1;
+---------------------------+
| cardinality(c1) << 'test' |
+---------------------------+
|                         3 |
|                         4 |
|                      NULL |
+---------------------------+
Warnings:
Warning	1292	Truncated incorrect INTEGER value: 'test'
select cardinality(c1) << null from tt1;
+-------------------------+
| cardinality(c1) << null |
+-------------------------+
|                    NULL |
|                    NULL |
|                    NULL |
+-------------------------+
select cardinality(c1) << false from tt1;
+--------------------------+
| cardinality(c1) << false |
+--------------------------+
|                        3 |
|                        4 |
|                     NULL |
+--------------------------+
select cardinality(c1) << true from tt1;
+-------------------------+
| cardinality(c1) << true |
+-------------------------+
|                       6 |
|                       8 |
|                    NULL |
+-------------------------+
select cardinality(c1) >> cardinality(c1) from tt1;
+------------------------------------+
| cardinality(c1) >> cardinality(c1) |
+------------------------------------+
|                                  0 |
|                                  0 |
|                               NULL |
+------------------------------------+
select cardinality(c1) >> 1 from tt1;
+----------------------+
| cardinality(c1) >> 1 |
+----------------------+
|                    1 |
|                    2 |
|                 NULL |
+----------------------+
select cardinality(c1) >> 'test' from tt1;
+---------------------------+
| cardinality(c1) >> 'test' |
+---------------------------+
|                         3 |
|                         4 |
|                      NULL |
+---------------------------+
Warnings:
Warning	1292	Truncated incorrect INTEGER value: 'test'
select cardinality(c1) >> null from tt1;
+-------------------------+
| cardinality(c1) >> null |
+-------------------------+
|                    NULL |
|                    NULL |
|                    NULL |
+-------------------------+
select cardinality(c1) >> false from tt1;
+--------------------------+
| cardinality(c1) >> false |
+--------------------------+
|                        3 |
|                        4 |
|                     NULL |
+--------------------------+
select cardinality(c1) >> true from tt1;
+-------------------------+
| cardinality(c1) >> true |
+-------------------------+
|                       1 |
|                       2 |
|                    NULL |
+-------------------------+
select cardinality(c1) is true from tt1;
+-------------------------+
| cardinality(c1) is true |
+-------------------------+
|                       1 |
|                       1 |
|                       0 |
+-------------------------+
select cardinality(c1) in (cardinality(c1),cardinality([1,2,3,4,5,56,7,8,9,10])) from tt1;
+---------------------------------------------------------------------------+
| cardinality(c1) in (cardinality(c1),cardinality([1,2,3,4,5,56,7,8,9,10])) |
+---------------------------------------------------------------------------+
|                                                                         1 |
|                                                                         1 |
|                                                                      NULL |
+---------------------------------------------------------------------------+
select cardinality(c1) not in (cardinality([1,2,3,4,5,56,7,8,9,10])) from tt1;
+---------------------------------------------------------------+
| cardinality(c1) not in (cardinality([1,2,3,4,5,56,7,8,9,10])) |
+---------------------------------------------------------------+
|                                                             1 |
|                                                             1 |
|                                                          NULL |
+---------------------------------------------------------------+
select cardinality(c1) like (cardinality([1,2,3,4,5,56,7,8,9,10])) from tt1;
+-------------------------------------------------------------+
| cardinality(c1) like (cardinality([1,2,3,4,5,56,7,8,9,10])) |
+-------------------------------------------------------------+
|                                                           0 |
|                                                           0 |
|                                                        NULL |
+-------------------------------------------------------------+
select cardinality(c1) like 1 from tt1;
+------------------------+
| cardinality(c1) like 1 |
+------------------------+
|                      0 |
|                      0 |
|                   NULL |
+------------------------+
select  cardinality(c1) BETWEEN cardinality(c1) and cardinality(c1) from tt1;
+-------------------------------------------------------------+
| cardinality(c1) BETWEEN cardinality(c1) and cardinality(c1) |
+-------------------------------------------------------------+
|                                                           1 |
|                                                           1 |
|                                                        NULL |
+-------------------------------------------------------------+
select  cardinality(c1) is null from tt1;
+-------------------------+
| cardinality(c1) is null |
+-------------------------+
|                       0 |
|                       0 |
|                       1 |
+-------------------------+
select  cardinality(c1) is not null from tt1;
+-----------------------------+
| cardinality(c1) is not null |
+-----------------------------+
|                           1 |
|                           1 |
|                           0 |
+-----------------------------+
select  cardinality(c1) is false from tt1;
+--------------------------+
| cardinality(c1) is false |
+--------------------------+
|                        0 |
|                        0 |
|                        0 |
+--------------------------+
select not cardinality(c1) from tt1;
+---------------------+
| not cardinality(c1) |
+---------------------+
|                   0 |
|                   0 |
|                NULL |
+---------------------+
select  cardinality(c1) and cardinality(c1)  from tt1;
+-------------------------------------+
| cardinality(c1) and cardinality(c1) |
+-------------------------------------+
|                                   1 |
|                                   1 |
|                                NULL |
+-------------------------------------+
select  cardinality(c1) && cardinality(c1)  from tt1;
+------------------------------------+
| cardinality(c1) && cardinality(c1) |
+------------------------------------+
|                                  1 |
|                                  1 |
|                               NULL |
+------------------------------------+
select  cardinality(c1) or cardinality(c1)  from tt1;
+------------------------------------+
| cardinality(c1) or cardinality(c1) |
+------------------------------------+
|                                  1 |
|                                  1 |
|                               NULL |
+------------------------------------+
select  cardinality(c1) || cardinality(c1)  from tt1;
+------------------------------------+
| cardinality(c1) || cardinality(c1) |
+------------------------------------+
|                                  1 |
|                                  1 |
|                               NULL |
+------------------------------------+
select  cardinality(c1) || 1 from tt1;
+----------------------+
| cardinality(c1) || 1 |
+----------------------+
|                    1 |
|                    1 |
|                    1 |
+----------------------+
select  cardinality(c1) XOR cardinality(c1)  from tt1;
+-------------------------------------+
| cardinality(c1) XOR cardinality(c1) |
+-------------------------------------+
|                                   0 |
|                                   0 |
|                                NULL |
+-------------------------------------+
select  cardinality(c1) XOR 1 from tt1;
+-----------------------+
| cardinality(c1) XOR 1 |
+-----------------------+
|                     0 |
|                     0 |
|                  NULL |
+-----------------------+
select  'test' XOR cardinality(c1) from tt1;
+----------------------------+
| 'test' XOR cardinality(c1) |
+----------------------------+
|                          1 |
|                          1 |
|                       NULL |
+----------------------------+
Warnings:
Warning	1292	Truncated incorrect DOUBLE value: 'test'
SELECT BINARY cardinality(c1) = cardinality(c1) from tt1;
+------------------------------------------+
| BINARY cardinality(c1) = cardinality(c1) |
+------------------------------------------+
|                                        1 |
|                                        1 |
|                                     NULL |
+------------------------------------------+
select CONVERT(cardinality(c1) USING BINARY) from tt1;
+---------------------------------------+
| CONVERT(cardinality(c1) USING BINARY) |
+---------------------------------------+
| 3                                     |
| 4                                     |
| NULL                                  |
+---------------------------------------+
SELECT CASE cardinality(c1) WHEN cardinality(c1) THEN cardinality(c1) WHEN cardinality(c1) THEN cardinality(c1) END from tt1;
+--------------------------------------------------------------------------------------------------------------+
| CASE cardinality(c1) WHEN cardinality(c1) THEN cardinality(c1) WHEN cardinality(c1) THEN cardinality(c1) END |
+--------------------------------------------------------------------------------------------------------------+
|                                                                                                            3 |
|                                                                                                            4 |
|                                                                                                         NULL |
+--------------------------------------------------------------------------------------------------------------+
SELECT CASE  WHEN cardinality(c1) =cardinality(c1) THEN cardinality(c1) else  cardinality(c1) END from vtt1;
+--------------------------------------------------------------------------------------------+
| CASE  WHEN cardinality(c1) =cardinality(c1) THEN cardinality(c1) else  cardinality(c1) END |
+--------------------------------------------------------------------------------------------+
|                                                                                          3 |
|                                                                                          4 |
|                                                                                       NULL |
+--------------------------------------------------------------------------------------------+
SELECT CASE  WHEN cardinality([1]) =cardinality(c1) THEN cardinality(c1) else  cardinality(c1) END from vtt1;
+---------------------------------------------------------------------------------------------+
| CASE  WHEN cardinality([1]) =cardinality(c1) THEN cardinality(c1) else  cardinality(c1) END |
+---------------------------------------------------------------------------------------------+
|                                                                                           3 |
|                                                                                           4 |
|                                                                                        NULL |
+---------------------------------------------------------------------------------------------+
drop table tt3;
create table tt3(id int primary key,id1 int);
drop view vtt3;
create view vtt3 as select * from tt3;
insert into tt3 values(cardinality([1,2,34]),cardinality([1,2,34]));
replace into tt3 values(cardinality([1,2,34]),(select cardinality(c1) from tt1 where id=1));
replace into tt3 values(cardinality([1,2,34,98,9077]),(select cardinality(c1) from tt1 where id=1));
insert into tt3 values(cardinality([1,2,34]),cardinality([1,2,34])) ON DUPLICATE KEY UPDATE id=cardinality([1,2,34,1,2,3,4,5,6]);
insert /*+ OPT_PARAM('rowsets_enabled', 'FALSE') */ /*+ OPT_PARAM('rowsets_enabled', 'FALSE') */ into tt3 values(cardinality([1,2,33,34,4,5,7,3,4,54767,34]),cardinality([1,2,34])),(cardinality([1,2,33,34,4,5,7,3,4,54767]),cardinality([1,2,34]));
replace into tt3 values(cardinality([1,2,33,34,4,5,7,3,4,54767,34,1]),cardinality([1,2,34])),(cardinality([1,2,33,34,4,5,7,3,4,54767,52,45,78]),cardinality([1,2,34]));
replace into tt3 values(cardinality([1,2,33,34,4,5,7,3,4,54767,34,1]),cardinality([1,2,34,6])),(cardinality([1,2,33,34,4,5,7,3,4,54767,52,45,78]),cardinality([1,2,34,9,7]));
insert into tt3 values(cardinality([1]),cardinality([1,2,34])) ON DUPLICATE KEY UPDATE id=cardinality([1,2,34,1,2,3,4,5,6]);
insert into tt3 values(cardinality([1]),cardinality([1])) ,(cardinality([1,2,3]),cardinality([5]))ON DUPLICATE KEY UPDATE id=cardinality([1,3,4]);
update tt3 set id=cardinality([12,3,8,9,0,5]) limit 1;
update tt3 set id1=cardinality([12,3,8,9,0,5]);
delete from tt3;
insert into vtt3 values(cardinality([1,2,34]),cardinality([1,2,34]));
replace into vtt3 values(cardinality([1,2,34]),(select cardinality(c1) from tt1 where id=1));
replace into vtt3 values(cardinality([1,2,34,98,9077]),(select cardinality(c1) from tt1 where id=1));
insert into vtt3 values(cardinality([1,2,34]),cardinality([1,2,34])) ON DUPLICATE KEY UPDATE id=cardinality([1,2,34,1,2,3,4,5,6]);
insert into vtt3 values(cardinality([1,2,34,5]),cardinality([1,2,34])) ON DUPLICATE KEY UPDATE id=cardinality([1,2,34,1,2,3,4,5,6]);
replace into vtt3 values(cardinality([1,2,33,34,4,5,7,3,4,54767,34,1]),cardinality([1,2,34])),(cardinality([1,2,33,34,4,5,7,3,4,54767,52,45,78]),cardinality([1,2,34]));
replace into vtt3 values(cardinality([1,2,33,34,4,5,7,3,4,54767,34,1]),cardinality([1,2,34,6])),(cardinality([1,2,33,34,4,5,7,3,4,54767,52,45,78]),cardinality([1,2,34,9,7]));
insert into vtt3 values(cardinality([1]),cardinality([1,2,34])) ON DUPLICATE KEY UPDATE id=cardinality([1,2,34,1,2,3,4,5,6]);
insert into vtt3 values(cardinality([1]),cardinality([1])) ,(cardinality([1,2,3]),cardinality([5]))ON DUPLICATE KEY UPDATE id=cardinality([1,3,4]);
select * from vtt3;
+----+------+
| id | id1  |
+----+------+
|  3 |    3 |
|  4 |    3 |
|  5 |    3 |
|  9 |    3 |
| 12 |    4 |
| 13 |    5 |
+----+------+
update  /*+ OPT_PARAM('rowsets_enabled', 'FALSE') */ /*+ OPT_PARAM('rowsets_enabled', 'FALSE') */ vtt3 set id=cardinality([12,3,8,9,0,5]) limit 1;
update vtt3 set id1=cardinality([12,3,8,9,0,5]);
update  /*+ OPT_PARAM('rowsets_enabled', 'FALSE') */  tt3 set id=cardinality([12,3,8,9,0,5,78754]) limit 1;
select * from tt3;
+----+------+
| id | id1  |
+----+------+
|  5 |    6 |
|  6 |    6 |
|  7 |    6 |
|  9 |    6 |
| 12 |    6 |
| 13 |    6 |
+----+------+
drop table tt3;
create table tt3(id int);
drop view vtt3;
create view vtt3 as select * from tt3;
insert into tt3  select cardinality(c1) from tt2;
replace into tt3  select cardinality(c1) from tt2;
select * from tt3;
+------+
| id   |
+------+
|    3 |
|    4 |
| NULL |
|    3 |
|    4 |
| NULL |
+------+
insert /*+ direct(true,100,'inc') enable_parallel_dml parallel(2)*/ into tt3 select cardinality(c1) from tt2;
insert /*+ direct(true,100) enable_parallel_dml parallel(2) append*/ into tt3 select cardinality(c1) from tt2;
insert /*+ direct(true,100) enable_parallel_dml parallel(2) append*/ /*+ OPT_PARAM('enable_rich_vector_format', 'FALSE') */ into tt3 select cardinality(c1) from tt2;
insert /*+ direct(true,100) enable_parallel_dml parallel(2) append*/ /*+ OPT_PARAM('rowsets_enabled', 'FALSE') */ into tt3 select cardinality(c1) from tt2;
insert /*+ direct(true,100) enable_parallel_dml parallel(2) append*/ /*+ OPT_PARAM('rowsets_enabled', 'FALSE') */  /*+ OPT_PARAM('enable_rich_vector_format', 'FALSE') */into tt3 select cardinality(c1) from tt2;
replace /*+ direct(true,100,'inc') enable_parallel_dml parallel(2)*/ into tt3  select cardinality(c1) from tt2;
replace /*+ direct(true,100) enable_parallel_dml parallel(2) append*/ into tt3  select cardinality(c1) from tt2;
insert /*+ OPT_PARAM('rowsets_enabled', 'FALSE') */ /*+ OPT_PARAM('enable_rich_vector_format', 'FALSE') */ overwrite tt3 select cardinality(c1) from tt2;
select cardinality(array(1,2,3,4,5,6));
+---------------------------------+
| cardinality(array(1,2,3,4,5,6)) |
+---------------------------------+
|                               6 |
+---------------------------------+
select cardinality(array_agg(id)) from tt1;
+----------------------------+
| cardinality(array_agg(id)) |
+----------------------------+
|                          3 |
+----------------------------+
select array_agg(cardinality([1,2,3,4,5,6]));
+---------------------------------------+
| array_agg(cardinality([1,2,3,4,5,6])) |
+---------------------------------------+
| [6]                                   |
+---------------------------------------+
select [[[cardinality(array(1,2,3,4,5,6))]]];
+---------------------------------------+
| [[[cardinality(array(1,2,3,4,5,6))]]] |
+---------------------------------------+
| [[[6]]]                               |
+---------------------------------------+
select array(cardinality([1,2,3,4,5,6]));
+-----------------------------------+
| array(cardinality([1,2,3,4,5,6])) |
+-----------------------------------+
| [6]                               |
+-----------------------------------+
select cardinality( array_append([[1,2,3,4]],[1]));
+---------------------------------------------+
| cardinality( array_append([[1,2,3,4]],[1])) |
+---------------------------------------------+
|                                           5 |
+---------------------------------------------+
select array_append([1,2,3,4,'test'],cardinality([1]));
+-------------------------------------------------+
| array_append([1,2,3,4,'test'],cardinality([1])) |
+-------------------------------------------------+
| ["1","2","3","4","test","1"]                    |
+-------------------------------------------------+
select cardinality( array_distinct([[1,2,3,4,1]]));
+---------------------------------------------+
| cardinality( array_distinct([[1,2,3,4,1]])) |
+---------------------------------------------+
|                                           5 |
+---------------------------------------------+
select cardinality( array_map((x,y,z) -> (x is null and y is not null or z is not null), [[1]], [1],['abc']));
+--------------------------------------------------------------------------------------------------------+
| cardinality( array_map((x,y,z) -> (x is null and y is not null or z is not null), [[1]], [1],['abc'])) |
+--------------------------------------------------------------------------------------------------------+
|                                                                                                      1 |
+--------------------------------------------------------------------------------------------------------+
bug 2024120400105949234   《[obmysql_array二期]array_map 参数嵌套传递，ob报4016》
select array_map((x)->(cardinality(array_map((x)->(x),x))),[[[[1]]]]);
+----------------------------------------------------------------+
| array_map((x)->(cardinality(array_map((x)->(x),x))),[[[[1]]]]) |
+----------------------------------------------------------------+
| [1]                                                            |
+----------------------------------------------------------------+
bug 2024120400105949234   《[obmysql_array二期]array_map 参数嵌套传递，ob报4016》
select array_map((x)->((array_map((x)->(x),x))),[[1]]);
+-------------------------------------------------+
| array_map((x)->((array_map((x)->(x),x))),[[1]]) |
+-------------------------------------------------+
| [[1]]                                           |
+-------------------------------------------------+
select cardinality( array_remove([1,23], 1));
+---------------------------------------+
| cardinality( array_remove([1,23], 1)) |
+---------------------------------------+
|                                     1 |
+---------------------------------------+
select array_remove([1,2,4,5],cardinality([[1,2]]));
+----------------------------------------------+
| array_remove([1,2,4,5],cardinality([[1,2]])) |
+----------------------------------------------+
| [1,4,5]                                      |
+----------------------------------------------+
select cardinality(string_to_array('1and2and3and', 'and'));
+-----------------------------------------------------+
| cardinality(string_to_array('1and2and3and', 'and')) |
+-----------------------------------------------------+
|                                                   4 |
+-----------------------------------------------------+
select  cardinality(array_agg(["1","2","3",""]));
+------------------------------------------+
| cardinality(array_agg(["1","2","3",""])) |
+------------------------------------------+
|                                        4 |
+------------------------------------------+
select cardinality([[1,2], [3,4]] + [[1,2], [3,4]]);
+----------------------------------------------+
| cardinality([[1,2], [3,4]] + [[1,2], [3,4]]) |
+----------------------------------------------+
|                                            4 |
+----------------------------------------------+
select cardinality([["hello", "hi"], ["what", "is", "your", "name"]] = [["hello", "hi"], ["what", "is", "your", "name"]]);
ERROR 22000: invalid obj type for type promotion: left_type=ARRAY right_type=INT
select array_contains([1,2,3], cardinality([2]));
+-------------------------------------------+
| array_contains([1,2,3], cardinality([2])) |
+-------------------------------------------+
|                                         1 |
+-------------------------------------------+
select sum(cardinality(c1)) from tt1;
+----------------------+
| sum(cardinality(c1)) |
+----------------------+
|                    7 |
+----------------------+
select count(cardinality(c1)) from tt1;
+------------------------+
| count(cardinality(c1)) |
+------------------------+
|                      2 |
+------------------------+
select avg(cardinality(c1)) from tt1;
+----------------------+
| avg(cardinality(c1)) |
+----------------------+
|               3.5000 |
+----------------------+
select min(cardinality(c1)) from tt1;
+----------------------+
| min(cardinality(c1)) |
+----------------------+
|                    3 |
+----------------------+
select max(cardinality(c1)) from tt1;
+----------------------+
| max(cardinality(c1)) |
+----------------------+
|                    4 |
+----------------------+
select ABS(cardinality(c1)) from tt1;
+----------------------+
| ABS(cardinality(c1)) |
+----------------------+
|                    3 |
|                    4 |
|                 NULL |
+----------------------+
select GREATEST(cardinality([1,2]),cardinality([1,2,5]));
+---------------------------------------------------+
| GREATEST(cardinality([1,2]),cardinality([1,2,5])) |
+---------------------------------------------------+
|                                                 3 |
+---------------------------------------------------+
select IFNULL(cardinality([1,2]),cardinality([1,2,5]));
+-------------------------------------------------+
| IFNULL(cardinality([1,2]),cardinality([1,2,5])) |
+-------------------------------------------------+
|                                               2 |
+-------------------------------------------------+
drop table tt3;
create table tt3 as select cardinality([["testest","testetee",'ab1','1','4','2','a','b','c','d','r','e']]) as a;
desc tt3;
+-------+------------------+------+-----+---------+-------+
| Field | Type             | Null | Key | Default | Extra |
+-------+------------------+------+-----+---------+-------+
| a     | int(10) unsigned | YES  |     | NULL    |       |
+-------+------------------+------+-----+---------+-------+
show create table tt3;
Table	Create Table
tt3	CREATE TABLE `tt3` (
  `a` int(10) unsigned DEFAULT NULL
) ORGANIZATION INDEX DEFAULT CHARSET = utf8mb4 ROW_FORMAT = DYNAMIC COMPRESSION = 'zstd_1.3.8' REPLICA_NUM = 1 BLOCK_SIZE = 16384 USE_BLOOM_FILTER = FALSE ENABLE_MACRO_BLOCK_BLOOM_FILTER = FALSE TABLET_SIZE = 134217728 PCTFREE = 0 LOB_INROW_THRESHOLD=0
insert into tt3 values(cardinality([2343]));
replace into tt3 values(cardinality([2343,0]));
update tt3 set a=cardinality([[2343,0,4]]);
select * from tt3;
+------+
| a    |
+------+
|    3 |
|    3 |
|    3 |
+------+
delete from tt3;
drop table tt3;
create table tt3 as select cardinality(c1) as a1,cardinality(c2) as a2,cardinality(c3) as a3,cardinality(c4) as a4,cardinality(c5) as a5,cardinality(c6) as a6,cardinality(c7) as a7 from tt1;
desc tt3;
+-------+------------------+------+-----+---------+-------+
| Field | Type             | Null | Key | Default | Extra |
+-------+------------------+------+-----+---------+-------+
| a1    | int(10) unsigned | YES  |     | NULL    |       |
| a2    | int(10) unsigned | YES  |     | NULL    |       |
| a3    | int(10) unsigned | YES  |     | NULL    |       |
| a4    | int(10) unsigned | YES  |     | NULL    |       |
| a5    | int(10) unsigned | YES  |     | NULL    |       |
| a6    | int(10) unsigned | YES  |     | NULL    |       |
| a7    | int(10) unsigned | YES  |     | NULL    |       |
+-------+------------------+------+-----+---------+-------+
show create table tt3;
Table	Create Table
tt3	CREATE TABLE `tt3` (
  `a1` int(10) unsigned DEFAULT NULL,
  `a2` int(10) unsigned DEFAULT NULL,
  `a3` int(10) unsigned DEFAULT NULL,
  `a4` int(10) unsigned DEFAULT NULL,
  `a5` int(10) unsigned DEFAULT NULL,
  `a6` int(10) unsigned DEFAULT NULL,
  `a7` int(10) unsigned DEFAULT NULL
) ORGANIZATION INDEX DEFAULT CHARSET = utf8mb4 ROW_FORMAT = DYNAMIC COMPRESSION = 'zstd_1.3.8' REPLICA_NUM = 1 BLOCK_SIZE = 16384 USE_BLOOM_FILTER = FALSE ENABLE_MACRO_BLOCK_BLOOM_FILTER = FALSE TABLET_SIZE = 134217728 PCTFREE = 0 LOB_INROW_THRESHOLD=0
insert into tt3 values(1,2,3,4,5,6,7);
update tt3 set a7=cardinality([[2343,0,4]]);
select * from tt3;
+------+------+------+------+------+------+------+
| a1   | a2   | a3   | a4   | a5   | a6   | a7   |
+------+------+------+------+------+------+------+
|    3 |    1 |    3 |    6 |    3 |    2 |    3 |
|    4 |    1 |    5 |    7 |    4 |    3 |    3 |
| NULL | NULL | NULL | NULL | NULL | NULL |    3 |
|    1 |    2 |    3 |    4 |    5 |    6 |    3 |
+------+------+------+------+------+------+------+
delete from tt3;
drop view vtt3;
create view vtt3 as select cardinality(c1) as a1,cardinality(c2) as a2,cardinality(c3) as a3,cardinality(c4) as a4,cardinality(c5) as a5,cardinality(c6) as a6,cardinality(c7) as a7 from tt1;
select * from vtt3;
+------+------+------+------+------+------+------+
| a1   | a2   | a3   | a4   | a5   | a6   | a7   |
+------+------+------+------+------+------+------+
|    3 |    1 |    3 |    6 |    3 |    2 |    3 |
|    4 |    1 |    5 |    7 |    4 |    3 |    4 |
| NULL | NULL | NULL | NULL | NULL | NULL | NULL |
+------+------+------+------+------+------+------+
desc vtt3;
+-------+------------------+------+-----+---------+-------+
| Field | Type             | Null | Key | Default | Extra |
+-------+------------------+------+-----+---------+-------+
| a1    | int(10) unsigned | YES  |     | NULL    |       |
| a2    | int(10) unsigned | YES  |     | NULL    |       |
| a3    | int(10) unsigned | YES  |     | NULL    |       |
| a4    | int(10) unsigned | YES  |     | NULL    |       |
| a5    | int(10) unsigned | YES  |     | NULL    |       |
| a6    | int(10) unsigned | YES  |     | NULL    |       |
| a7    | int(10) unsigned | YES  |     | NULL    |       |
+-------+------------------+------+-----+---------+-------+
drop table tt3;
create table tt3(id int, r int as (cardinality([["testest","testetee",'ab1','1','4','2','a','b','c','d','r','e']])) STORED);
desc tt3;
+-------+---------+------+-----+-------------------------------------------------------------------------------------------+------------------+
| Field | Type    | Null | Key | Default                                                                                   | Extra            |
+-------+---------+------+-----+-------------------------------------------------------------------------------------------+------------------+
| id    | int(11) | YES  |     | NULL                                                                                      |                  |
| r     | int(11) | YES  |     | cardinality(array(array('testest','testetee','ab1','1','4','2','a','b','c','d','r','e'))) | STORED GENERATED |
+-------+---------+------+-----+-------------------------------------------------------------------------------------------+------------------+
insert into  tt3(id) values(1);
select * from tt3;
+------+------+
| id   | r    |
+------+------+
|    1 |   12 |
+------+------+
delete from tt3;
insert into  tt3(id) values(1);
truncate tt3;
select * from tt3;
+------+------+
| id   | r    |
+------+------+
+------+------+
drop table tt3;
create table tt3(id int, r int as (cardinality([["testest","testetee",'ab1','1','4','2','a','b','c','d','r','e']])) VIRTUAL);
desc tt3;
+-------+---------+------+-----+-------------------------------------------------------------------------------------------+-------------------+
| Field | Type    | Null | Key | Default                                                                                   | Extra             |
+-------+---------+------+-----+-------------------------------------------------------------------------------------------+-------------------+
| id    | int(11) | YES  |     | NULL                                                                                      |                   |
| r     | int(11) | YES  |     | cardinality(array(array('testest','testetee','ab1','1','4','2','a','b','c','d','r','e'))) | VIRTUAL GENERATED |
+-------+---------+------+-----+-------------------------------------------------------------------------------------------+-------------------+
insert into  tt3(id) values(1);
select * from tt3;
+------+------+
| id   | r    |
+------+------+
|    1 |   12 |
+------+------+
delete from tt3;
insert into  tt3(id) values(1);
truncate tt3;
select * from tt3;
+------+------+
| id   | r    |
+------+------+
+------+------+
drop table tt3;
create table tt3(id int);
ALTER TABLE tt3
ADD COLUMN r int AS (cardinality([["testest","testetee",'ab1','1','4','2','a','b','c','d','r','e']])) STORED;
desc tt3;
+-------+---------+------+-----+-------------------------------------------------------------------------------------------+------------------+
| Field | Type    | Null | Key | Default                                                                                   | Extra            |
+-------+---------+------+-----+-------------------------------------------------------------------------------------------+------------------+
| id    | int(11) | YES  |     | NULL                                                                                      |                  |
| r     | int(11) | YES  |     | cardinality(array(array('testest','testetee','ab1','1','4','2','a','b','c','d','r','e'))) | STORED GENERATED |
+-------+---------+------+-----+-------------------------------------------------------------------------------------------+------------------+
insert into  tt3(id) values(1);
select * from tt3;
+------+------+
| id   | r    |
+------+------+
|    1 |   12 |
+------+------+
delete from tt3;
insert into  tt3(id) values(1);
truncate tt3;
select * from tt3;
+------+------+
| id   | r    |
+------+------+
+------+------+
drop table tt3;
create table tt3(id int);
ALTER TABLE tt3
ADD COLUMN r int AS (cardinality([["testest","testetee",'ab1','1','4','2','a','b','c','d','r','e']])) VIRTUAL;
desc tt3;
+-------+---------+------+-----+-------------------------------------------------------------------------------------------+-------------------+
| Field | Type    | Null | Key | Default                                                                                   | Extra             |
+-------+---------+------+-----+-------------------------------------------------------------------------------------------+-------------------+
| id    | int(11) | YES  |     | NULL                                                                                      |                   |
| r     | int(11) | YES  |     | cardinality(array(array('testest','testetee','ab1','1','4','2','a','b','c','d','r','e'))) | VIRTUAL GENERATED |
+-------+---------+------+-----+-------------------------------------------------------------------------------------------+-------------------+
insert into  tt3(id) values(1);
select * from tt3;
+------+------+
| id   | r    |
+------+------+
|    1 |   12 |
+------+------+
delete from tt3;
insert into  tt3(id) values(1);
truncate tt3;
select * from tt3;
+------+------+
| id   | r    |
+------+------+
+------+------+
drop table tt2;
create table tt2(id int,a varchar(50),INDEX index_1((cardinality([["testest","testetee",'ab1','1','4','2','a','b','c','d','r','e']]))))PARTITION BY range COLUMNS(id)(
PARTITION p0 values less than(19),
PARTITION p1 values less than(25),
PARTITION p2 values less than(30)
);
show index from tt2;
Table	Non_unique	Key_name	Seq_in_index	Column_name	Collation	Cardinality	Sub_part	Packed	Null	Index_type	Comment	Index_comment	Visible	Expression
tt2	1	index_1	1	SYS_NC18$	A	NULL	NULL	NULL	YES	BTREE	available		YES	cardinality(array(array('testest','testetee','ab1','1','4','2','a','b','c','d','r','e')))
insert into tt2 values(1,'test');
insert into tt2 values(2,'test1');
insert into tt2 values(3,'test');
select * from tt2 where cardinality([["testest","testetee",'ab1','1','4','2','a','b','c','d','r','e']])=1;
+------+------+
| id   | a    |
+------+------+
+------+------+
select  /*+ index(tt2 index_1)*/  * from tt2 where cardinality([["testest","testetee",'ab1','1','4','2','a','b','c','d','r','e']])=1;
+------+------+
| id   | a    |
+------+------+
+------+------+
drop table tt2;
create table tt2(id int,a varchar(50),r int[]);
CREATE INDEX index_1 ON tt2 ((cardinality(r)));
insert into tt2 values(1,'test',[1,2,3,4,5]);
insert into tt2 values(2,'test2',[10,20,30,60,50,70]);
select  /*+ index(tt2 index_1)*/  * from tt2 where cardinality(r);
+------+-------+---------------------+
| id   | a     | r                   |
+------+-------+---------------------+
|    1 | test  | [1,2,3,4,5]         |
|    2 | test2 | [10,20,30,60,50,70] |
+------+-------+---------------------+
EXPLAIN select  /*+ index(tt2 index_1)*/  * from tt2 where cardinality(r);
Query Plan
=======================================================
|ID|OPERATOR       |NAME        |EST.ROWS|EST.TIME(us)|
-------------------------------------------------------
|0 |TABLE FULL SCAN|tt2(index_1)|1       |10          |
=======================================================
Outputs & filters:
-------------------------------------
  0 - output([tt2.id], [tt2.a], [tt2.r]), filter([cardinality(tt2.r)]), rowset=16
      access([tt2.__pk_increment], [tt2.r], [tt2.id], [tt2.a]), partitions(p0)
      is_index_back=true, is_global_index=false, filter_before_indexback[false], 
      range_key([tt2.SYS_NC19$], [tt2.__pk_increment]), range(MIN,MIN ; MAX,MAX)always true
drop table tt2;
create table tt2(id int,a varchar(50),r int[]);
insert into tt2 values(1,'test',[1,2,3,4,5]);
insert into tt2 values(2,'test2',[10,20,30,60,50,70]);
alter table tt2 add index index_1((cardinality(r)));
select  /*+ index(tt2 index_1)*/  * from tt2 where cardinality(r);
+------+-------+---------------------+
| id   | a     | r                   |
+------+-------+---------------------+
|    1 | test  | [1,2,3,4,5]         |
|    2 | test2 | [10,20,30,60,50,70] |
+------+-------+---------------------+
EXPLAIN select  /*+ index(tt2 index_1)*/  * from tt2 where cardinality(r);
Query Plan
=======================================================
|ID|OPERATOR       |NAME        |EST.ROWS|EST.TIME(us)|
-------------------------------------------------------
|0 |TABLE FULL SCAN|tt2(index_1)|1       |10          |
=======================================================
Outputs & filters:
-------------------------------------
  0 - output([tt2.id], [tt2.a], [tt2.r]), filter([cardinality(tt2.r)]), rowset=16
      access([tt2.__pk_increment], [tt2.r], [tt2.id], [tt2.a]), partitions(p0)
      is_index_back=true, is_global_index=false, filter_before_indexback[false], 
      range_key([tt2.SYS_NC19$], [tt2.__pk_increment]), range(MIN,MIN ; MAX,MAX)always true
########清空回收站，删除测试数据库，表等 ##########
drop database  IF EXISTS  oblrp;
purge recyclebin;
