purge recyclebin;
drop database IF EXISTS oblrp;
create database oblrp;
use oblrp;
set timestamp = 1600000000;
set ob_trx_timeout = 10000000000;
set ob_query_timeout = 10000000000;
SET SESSION group_concat_max_len = 100000000;
set ob_default_lob_inrow_threshold = 0;
result_format: 4
drop table tt1;
create table tt1(id int,c1 array(int), c2 array(varchar(256)), c3 array(tinyint), c4 array(bigint), c5 array(float), c6 array(double), c7 array(smallint));
insert into tt1 values(1,[-2147483648,0, 2147483647],['test'],[127,0,-128],[-9223372036854775808,9223372036854775807,775,808,2,0],[3.402, 0, 1.175],
[1.7976931348623157E+308, 2.2250738585072014E-308],[-32768,0,32767]);
insert into tt1 values(2,[-2147483648,0, 2147483647,4],['test'],[127,0,-128,6,77],[-9223372036854775808,9223372036854775807,775,808,2,0,1],[3.402, 0, 1.175,4],
[-1.7976931348623157E+30,1.2,2.2250738585072014E-308],[-32768,0,32767,0]);
insert into tt1 values(3,null,null,null,null,null,null,null);
drop view vtt1;
create view vtt1 as select * from tt1;
drop table tt2;
create table tt2(id int,c1 array(int unsigned), c2 array(varchar(256)), c3 array(tinyint unsigned), c4 array(bigint unsigned), c5 array(float), c6 array(double), c7 array(smallint unsigned))
PARTITION BY range COLUMNS(id)(
PARTITION p0 values less than(19),
PARTITION p1 values less than(25),
PARTITION p2 values less than(30)
);
insert into tt2 values(1,[2147483648,0, 2147483647],['test'],[52,0,5],[ 852,9223372036854775807,775,808,2,0],[3.402, 0, 1.175],
[1.7976931348623157E+308, 2.2250738585072014E-308],[88,0,32767]);
insert into tt2 values(2,[87666,0, 2147483647,4],['test'],[5,0,7,6,50],[1,100000,9223372036854775807,775,808,2,0,1],[3.402, 0, 1.175,4],
[1.7976931348623157E+308,1.2,2.2250738585072014E-308],[68,0,32767,0,1]);
insert into tt2 values(3,null,null,null,null,null,null,null);
drop view vtt2;
create view vtt2 as select * from tt2;
select /*+ OPT_PARAM('enable_rich_vector_format', 'FALSE') */ array_overlaps(c2,c2) a from tt2;
+------+
| a    |
+------+
|    1 |
|    1 |
| NULL |
+------+
select /*+ OPT_PARAM('rowsets_enabled', 'FALSE') */ array_overlaps(c2,c2) a from tt2;
+------+
| a    |
+------+
|    1 |
|    1 |
| NULL |
+------+
select /*+ OPT_PARAM('enable_rich_vector_format', 'FALSE') */ array_overlaps(c2,c2) a from vtt2;
+------+
| a    |
+------+
|    1 |
|    1 |
| NULL |
+------+
select /*+ OPT_PARAM('rowsets_enabled', 'FALSE') */ array_overlaps(c2,c2) a from vtt2;
+------+
| a    |
+------+
|    1 |
|    1 |
| NULL |
+------+
select /*+ OPT_PARAM('enable_rich_vector_format', 'FALSE') */ array_overlaps(c2,c2) a from vtt1;
+------+
| a    |
+------+
|    1 |
|    1 |
| NULL |
+------+
select /*+ OPT_PARAM('rowsets_enabled', 'FALSE') */ array_overlaps(c2,c2) a from vtt1;
+------+
| a    |
+------+
|    1 |
|    1 |
| NULL |
+------+
select /*+ OPT_PARAM('enable_rich_vector_format', 'FALSE') */ array_overlaps(c2,c2) a from tt1;
+------+
| a    |
+------+
|    1 |
|    1 |
| NULL |
+------+
select /*+ OPT_PARAM('rowsets_enabled', 'FALSE') */ array_overlaps(c2,c2) a from tt1;
+------+
| a    |
+------+
|    1 |
|    1 |
| NULL |
+------+
select /*+ OPT_PARAM('rowsets_enabled', 'FALSE') */ /*+ OPT_PARAM('enable_rich_vector_format', 'FALSE') */ array_overlaps(c2,c2) a from tt2;
+------+
| a    |
+------+
|    1 |
|    1 |
| NULL |
+------+
select array_overlaps([1],[1]);
+-------------------------+
| array_overlaps([1],[1]) |
+-------------------------+
|                       1 |
+-------------------------+
select array_overlaps([-1],[1]);
+--------------------------+
| array_overlaps([-1],[1]) |
+--------------------------+
|                        0 |
+--------------------------+
select array_overlaps([1,2,3,4,5],[6,7,8,9]);
+---------------------------------------+
| array_overlaps([1,2,3,4,5],[6,7,8,9]) |
+---------------------------------------+
|                                     0 |
+---------------------------------------+
select array_overlaps([1],[1.0,2]);
+-----------------------------+
| array_overlaps([1],[1.0,2]) |
+-----------------------------+
|                           1 |
+-----------------------------+
select array_overlaps([1],['test']);
+------------------------------+
| array_overlaps([1],['test']) |
+------------------------------+
|                            0 |
+------------------------------+
select array_overlaps([1,2],[null]);
+------------------------------+
| array_overlaps([1,2],[null]) |
+------------------------------+
|                            0 |
+------------------------------+
select array_overlaps([3],[true,false]);
+----------------------------------+
| array_overlaps([3],[true,false]) |
+----------------------------------+
|                                0 |
+----------------------------------+
select array_overlaps([3],[true,false]);
+----------------------------------+
| array_overlaps([3],[true,false]) |
+----------------------------------+
|                                0 |
+----------------------------------+
select array_overlaps([1],[true,false]);
+----------------------------------+
| array_overlaps([1],[true,false]) |
+----------------------------------+
|                                1 |
+----------------------------------+
select array_overlaps([1],[false]);
+-----------------------------+
| array_overlaps([1],[false]) |
+-----------------------------+
|                           0 |
+-----------------------------+
select array_overlaps([0],[false]);
+-----------------------------+
| array_overlaps([0],[false]) |
+-----------------------------+
|                           1 |
+-----------------------------+
select array_overlaps([1],[1.4]);
+---------------------------+
| array_overlaps([1],[1.4]) |
+---------------------------+
|                         0 |
+---------------------------+
select array_overlaps([1,2,3,4,5],[6,3,2,9]);
+---------------------------------------+
| array_overlaps([1,2,3,4,5],[6,3,2,9]) |
+---------------------------------------+
|                                     1 |
+---------------------------------------+
select array_overlaps([NULL],[null]);
+-------------------------------+
| array_overlaps([NULL],[null]) |
+-------------------------------+
|                             1 |
+-------------------------------+
select array_overlaps([2,3,4,5],[true,false,null,null,false,true]);
+-------------------------------------------------------------+
| array_overlaps([2,3,4,5],[true,false,null,null,false,true]) |
+-------------------------------------------------------------+
|                                                           0 |
+-------------------------------------------------------------+
select array_overlaps([2,3,4,5],[[2,4]]);
ERROR 22000: array type mismatch found between definition and data
select array_overlaps([2,3,4,5],[[2,4]]);
ERROR 22000: array type mismatch found between definition and data
select array_overlaps([-1,-3],[-1,-2]);
+---------------------------------+
| array_overlaps([-1,-3],[-1,-2]) |
+---------------------------------+
|                               1 |
+---------------------------------+
select array_overlaps(array(-1,-3),array(-1,-2));
+-------------------------------------------+
| array_overlaps(array(-1,-3),array(-1,-2)) |
+-------------------------------------------+
|                                         1 |
+-------------------------------------------+
select array_overlaps([['test'],null],[['test1'],null]);
+--------------------------------------------------+
| array_overlaps([['test'],null],[['test1'],null]) |
+--------------------------------------------------+
|                                                1 |
+--------------------------------------------------+
select array_overlaps([['test'],null],[['test1'],null]);
+--------------------------------------------------+
| array_overlaps([['test'],null],[['test1'],null]) |
+--------------------------------------------------+
|                                                1 |
+--------------------------------------------------+
select array_overlaps([-9223372036854775808],[1]);
+--------------------------------------------+
| array_overlaps([-9223372036854775808],[1]) |
+--------------------------------------------+
|                                          0 |
+--------------------------------------------+
select array_overlaps([-9223372036854775809],[0]);
+--------------------------------------------+
| array_overlaps([-9223372036854775809],[0]) |
+--------------------------------------------+
|                                          0 |
+--------------------------------------------+
select array_overlaps([-9223372036854775809,1],[-9223372036854775808]);
+-----------------------------------------------------------------+
| array_overlaps([-9223372036854775809,1],[-9223372036854775808]) |
+-----------------------------------------------------------------+
|                                                               1 |
+-----------------------------------------------------------------+
select array_overlaps([18446744073709551616],[1]);
+--------------------------------------------+
| array_overlaps([18446744073709551616],[1]) |
+--------------------------------------------+
|                                          0 |
+--------------------------------------------+
select array_overlaps([18446744073709551617],[1]);
+--------------------------------------------+
| array_overlaps([18446744073709551617],[1]) |
+--------------------------------------------+
|                                          0 |
+--------------------------------------------+
select array_overlaps([18446744073709551617],[9223372036854775807]);
+--------------------------------------------------------------+
| array_overlaps([18446744073709551617],[9223372036854775807]) |
+--------------------------------------------------------------+
|                                                            1 |
+--------------------------------------------------------------+
select array_overlaps([18446744073709551616,18446744073709551615,18446744073709551615],[9223372036854775807]);
+--------------------------------------------------------------------------------------------------------+
| array_overlaps([18446744073709551616,18446744073709551615,18446744073709551615],[9223372036854775807]) |
+--------------------------------------------------------------------------------------------------------+
|                                                                                                      1 |
+--------------------------------------------------------------------------------------------------------+
bug 2024111100105047559   《[obmysql_array二期]array参数中的元素 含有不同的数字型，ob和pg 返回值不一样》
select array_overlaps([18446744073709551616,184467440737095516155,18446744073709551615],[9223372036854775807]);
+---------------------------------------------------------------------------------------------------------+
| array_overlaps([18446744073709551616,184467440737095516155,18446744073709551615],[9223372036854775807]) |
+---------------------------------------------------------------------------------------------------------+
|                                                                                                       1 |
+---------------------------------------------------------------------------------------------------------+
select array_overlaps([1,1,21,1],[1,1,1 ,null ,true]);
+------------------------------------------------+
| array_overlaps([1,1,21,1],[1,1,1 ,null ,true]) |
+------------------------------------------------+
|                                              1 |
+------------------------------------------------+
select array_overlaps([9223372036854775807],[18446744073709551614,18446744073709551615,18446744073709551615]);
+--------------------------------------------------------------------------------------------------------+
| array_overlaps([9223372036854775807],[18446744073709551614,18446744073709551615,18446744073709551615]) |
+--------------------------------------------------------------------------------------------------------+
|                                                                                                      1 |
+--------------------------------------------------------------------------------------------------------+
select array_overlaps([2],[2.0 ,4]);
+------------------------------+
| array_overlaps([2],[2.0 ,4]) |
+------------------------------+
|                            1 |
+------------------------------+
select array_overlaps([true],[2,4]);
+------------------------------+
| array_overlaps([true],[2,4]) |
+------------------------------+
|                            0 |
+------------------------------+
select array_overlaps([true],[2,4,1,1]);
+----------------------------------+
| array_overlaps([true],[2,4,1,1]) |
+----------------------------------+
|                                1 |
+----------------------------------+
select array_overlaps([null],[2,4,1,1]);
+----------------------------------+
| array_overlaps([null],[2,4,1,1]) |
+----------------------------------+
|                                0 |
+----------------------------------+
select array_overlaps([null,1],[2,4,1,1,null]);
+-----------------------------------------+
| array_overlaps([null,1],[2,4,1,1,null]) |
+-----------------------------------------+
|                                       1 |
+-----------------------------------------+
select array_overlaps([-9223372036854775809],[18446744073709551616]);
+---------------------------------------------------------------+
| array_overlaps([-9223372036854775809],[18446744073709551616]) |
+---------------------------------------------------------------+
|                                                             0 |
+---------------------------------------------------------------+
select array_overlaps([-9223372036854775809],[-18446744073709551616]);
+----------------------------------------------------------------+
| array_overlaps([-9223372036854775809],[-18446744073709551616]) |
+----------------------------------------------------------------+
|                                                              1 |
+----------------------------------------------------------------+
select array_overlaps([[1,2]],[1,5]);
ERROR 22000: array type mismatch found between definition and data
select array_overlaps([[1,2]],[[[4,5,6,7]]]);
ERROR 22000: array type mismatch found between definition and data
select array_overlaps([[1.0,2.1]],[[1.0,2.1],[1]]);
+---------------------------------------------+
| array_overlaps([[1.0,2.1]],[[1.0,2.1],[1]]) |
+---------------------------------------------+
|                                           1 |
+---------------------------------------------+
select array_overlaps([[1,2]],[[2]]);
+-------------------------------+
| array_overlaps([[1,2]],[[2]]) |
+-------------------------------+
|                             0 |
+-------------------------------+
select array_overlaps([[1,2]],[[2],[1]]);
+-----------------------------------+
| array_overlaps([[1,2]],[[2],[1]]) |
+-----------------------------------+
|                                 0 |
+-----------------------------------+
select array_overlaps([[1,2]],[[2,1]]);
+---------------------------------+
| array_overlaps([[1,2]],[[2,1]]) |
+---------------------------------+
|                               0 |
+---------------------------------+
select array_overlaps([[1,2]],[[1,2]]);
+---------------------------------+
| array_overlaps([[1,2]],[[1,2]]) |
+---------------------------------+
|                               1 |
+---------------------------------+
select array_overlaps([[1,2]],[[1]]);
+-------------------------------+
| array_overlaps([[1,2]],[[1]]) |
+-------------------------------+
|                             0 |
+-------------------------------+
select array_overlaps([[1,2]],[[1,2,3]]);
+-----------------------------------+
| array_overlaps([[1,2]],[[1,2,3]]) |
+-----------------------------------+
|                                 0 |
+-----------------------------------+
select array_overlaps([[1,2,3]],[[1]]);
+---------------------------------+
| array_overlaps([[1,2,3]],[[1]]) |
+---------------------------------+
|                               0 |
+---------------------------------+
select array_overlaps([[1],[3]],[[1]]);
+---------------------------------+
| array_overlaps([[1],[3]],[[1]]) |
+---------------------------------+
|                               1 |
+---------------------------------+
select array_overlaps([[1],[3]],[[4]]);
+---------------------------------+
| array_overlaps([[1],[3]],[[4]]) |
+---------------------------------+
|                               0 |
+---------------------------------+
select array_overlaps([[1],[3]],[[4],[1]]);
+-------------------------------------+
| array_overlaps([[1],[3]],[[4],[1]]) |
+-------------------------------------+
|                                   1 |
+-------------------------------------+
select array_overlaps([[1],[3]],[[[1]]]);
ERROR 22000: array type mismatch found between definition and data
select array_overlaps([[[4,5]]],[[[1]]]);
+-----------------------------------+
| array_overlaps([[[4,5]]],[[[1]]]) |
+-----------------------------------+
|                                 0 |
+-----------------------------------+
select array_overlaps([[[4,5]]],[[[5,4]]]);
+-------------------------------------+
| array_overlaps([[[4,5]]],[[[5,4]]]) |
+-------------------------------------+
|                                   0 |
+-------------------------------------+
select array_overlaps([[[4,5]]],[[[4,5]]]);
+-------------------------------------+
| array_overlaps([[[4,5]]],[[[4,5]]]) |
+-------------------------------------+
|                                   1 |
+-------------------------------------+
select array_overlaps([[[[[4,5]]]]],[[[4,5]]]);
ERROR 22000: array type mismatch found between definition and data
select array_overlaps([[[[[[4,5]]]]]],[[[[[[4,5]]]]]]);
+-------------------------------------------------+
| array_overlaps([[[[[[4,5]]]]]],[[[[[[4,5]]]]]]) |
+-------------------------------------------------+
|                                               1 |
+-------------------------------------------------+
select array_overlaps([[[[[[4,5],[7]]]]]],[[[[[[4,5],[8]]]]]]);
+---------------------------------------------------------+
| array_overlaps([[[[[[4,5],[7]]]]]],[[[[[[4,5],[8]]]]]]) |
+---------------------------------------------------------+
|                                                       0 |
+---------------------------------------------------------+
drop table test;
create table test(a bigint[],a1 bigint[]);
insert into test values((SELECT CONCAT('[', GROUP_CONCAT(number ORDER BY number SEPARATOR ', '), ']') AS nums
FROM (
     SELECT FLOOR(1+RAND() * 10) AS number
    FROM TABLE(GENERATOR(10000))
) AS temp),(SELECT CONCAT('[', GROUP_CONCAT(number ORDER BY number SEPARATOR ', '), ']') AS nums
FROM (
     SELECT FLOOR(1+RAND() * 100) AS number
    FROM TABLE(GENERATOR(10000))
) AS temp));
select array_overlaps(a,a1) from test;
+----------------------+
| array_overlaps(a,a1) |
+----------------------+
|                    1 |
+----------------------+
select array_overlaps([2,3,4,5.0],[5]);
+---------------------------------+
| array_overlaps([2,3,4,5.0],[5]) |
+---------------------------------+
|                               1 |
+---------------------------------+
select array_overlaps([2,3,4,5.0],[5.00]);
+------------------------------------+
| array_overlaps([2,3,4,5.0],[5.00]) |
+------------------------------------+
|                                  1 |
+------------------------------------+
select array_overlaps([2,3,4,5.0],[5.00,6,0,-63]);
+--------------------------------------------+
| array_overlaps([2,3,4,5.0],[5.00,6,0,-63]) |
+--------------------------------------------+
|                                          1 |
+--------------------------------------------+
select array_overlaps([2,3,4,5.0],[5.001,6,0,-63]);
+---------------------------------------------+
| array_overlaps([2,3,4,5.0],[5.001,6,0,-63]) |
+---------------------------------------------+
|                                           0 |
+---------------------------------------------+
select array_overlaps([5.0,1000000.02],[5.001,6,0,-63]);
+--------------------------------------------------+
| array_overlaps([5.0,1000000.02],[5.001,6,0,-63]) |
+--------------------------------------------------+
|                                                0 |
+--------------------------------------------------+
select array_overlaps([-5.0,1000000.02],[1.3,-5.0,6,0,-63]);
+------------------------------------------------------+
| array_overlaps([-5.0,1000000.02],[1.3,-5.0,6,0,-63]) |
+------------------------------------------------------+
|                                                    1 |
+------------------------------------------------------+
select array_overlaps([-5.0,1000000.02],[true,false,null]);
+-----------------------------------------------------+
| array_overlaps([-5.0,1000000.02],[true,false,null]) |
+-----------------------------------------------------+
|                                                   0 |
+-----------------------------------------------------+
select array_overlaps([-5.0,1000000.02,-1],[true,false,null]);
+--------------------------------------------------------+
| array_overlaps([-5.0,1000000.02,-1],[true,false,null]) |
+--------------------------------------------------------+
|                                                      0 |
+--------------------------------------------------------+
select array_overlaps([-5.0,1000000.02,1.00],[true,false,null]);
+----------------------------------------------------------+
| array_overlaps([-5.0,1000000.02,1.00],[true,false,null]) |
+----------------------------------------------------------+
|                                                        1 |
+----------------------------------------------------------+
select array_overlaps([-5.0,1000000.02,2.00],[true,false,null]);
+----------------------------------------------------------+
| array_overlaps([-5.0,1000000.02,2.00],[true,false,null]) |
+----------------------------------------------------------+
|                                                        0 |
+----------------------------------------------------------+
select array_overlaps([-5.0,1000000.02,0.00],[true,false,null]);
+----------------------------------------------------------+
| array_overlaps([-5.0,1000000.02,0.00],[true,false,null]) |
+----------------------------------------------------------+
|                                                        1 |
+----------------------------------------------------------+
select array_overlaps([-5.0,1000000.02,null],[true,false,null,2.5]);
+--------------------------------------------------------------+
| array_overlaps([-5.0,1000000.02,null],[true,false,null,2.5]) |
+--------------------------------------------------------------+
|                                                            1 |
+--------------------------------------------------------------+
select array_overlaps([-5.0,1000000.02,null,true,false,null],[true,false,null]);
+--------------------------------------------------------------------------+
| array_overlaps([-5.0,1000000.02,null,true,false,null],[true,false,null]) |
+--------------------------------------------------------------------------+
|                                                                        1 |
+--------------------------------------------------------------------------+
select array_overlaps([-5.0,1000000.02,-0.00],[true,false,null]);
+-----------------------------------------------------------+
| array_overlaps([-5.0,1000000.02,-0.00],[true,false,null]) |
+-----------------------------------------------------------+
|                                                         1 |
+-----------------------------------------------------------+
select array_overlaps([--5.0,1000000.02,-0.00],[true,false,null]);
+------------------------------------------------------------+
| array_overlaps([--5.0,1000000.02,-0.00],[true,false,null]) |
+------------------------------------------------------------+
|                                                          1 |
+------------------------------------------------------------+
select array_overlaps([5.0],['test']);
+--------------------------------+
| array_overlaps([5.0],['test']) |
+--------------------------------+
|                              0 |
+--------------------------------+
select array_overlaps([-2.7976931348623157E+308],[1]);
ERROR 22007: Illegal double '2.7976931348623157E+308' value found during parsing
select array_overlaps([1.7976931348623197E+308],[1]);
ERROR 22007: Illegal double '1.7976931348623197E+308' value found during parsing
select array_overlaps([-2.7976931348623157E+308],[1]);
ERROR 22007: Illegal double '2.7976931348623157E+308' value found during parsing
select array_overlaps([1.7976931348623197E+308],[1]);
ERROR 22007: Illegal double '1.7976931348623197E+308' value found during parsing
select array_overlaps([1.7976931348623197E+308],[1]);
ERROR 22007: Illegal double '1.7976931348623197E+308' value found during parsing
select array_overlaps([[5.0]],[5.0]);
ERROR 22000: array type mismatch found between definition and data
select array_overlaps([[5.0]],[[5.0],[5.0]]);
+---------------------------------------+
| array_overlaps([[5.0]],[[5.0],[5.0]]) |
+---------------------------------------+
|                                     1 |
+---------------------------------------+
select array_overlaps([[5.0]],[[5.0,1.0],[5.0]]);
+-------------------------------------------+
| array_overlaps([[5.0]],[[5.0,1.0],[5.0]]) |
+-------------------------------------------+
|                                         1 |
+-------------------------------------------+
select array_overlaps([[5.0]],[[5.0,1.0],[5.0,1.0]]);
+-----------------------------------------------+
| array_overlaps([[5.0]],[[5.0,1.0],[5.0,1.0]]) |
+-----------------------------------------------+
|                                             0 |
+-----------------------------------------------+
select array_overlaps([[5.0]],[['test']]);
+------------------------------------+
| array_overlaps([[5.0]],[['test']]) |
+------------------------------------+
|                                  0 |
+------------------------------------+
select array_overlaps([[5.0]],[[null,false,true]]);
+---------------------------------------------+
| array_overlaps([[5.0]],[[null,false,true]]) |
+---------------------------------------------+
|                                           0 |
+---------------------------------------------+
select array_overlaps([[1.0]],[[null,false,true]]);
+---------------------------------------------+
| array_overlaps([[1.0]],[[null,false,true]]) |
+---------------------------------------------+
|                                           0 |
+---------------------------------------------+
select array_overlaps([[null,false,true]],[[null,false,true]]);
+---------------------------------------------------------+
| array_overlaps([[null,false,true]],[[null,false,true]]) |
+---------------------------------------------------------+
|                                                       1 |
+---------------------------------------------------------+
select array_overlaps([[[[5.6,7.8]]]],[[[[5.6,7.8]]]]);
+-------------------------------------------------+
| array_overlaps([[[[5.6,7.8]]]],[[[[5.6,7.8]]]]) |
+-------------------------------------------------+
|                                               1 |
+-------------------------------------------------+
select array_overlaps([[[[5.6,7.8],[5.6,7.8]]]],[[[[5.6,7.8]]]]);
+-----------------------------------------------------------+
| array_overlaps([[[[5.6,7.8],[5.6,7.8]]]],[[[[5.6,7.8]]]]) |
+-----------------------------------------------------------+
|                                                         0 |
+-----------------------------------------------------------+
bug 2024111100105047559   《[obmysql_array二期]array参数中的元素 含有不同的数字型，ob和pg 返回值不一样》
select array_overlaps([-1.7976931348623157E+308],[-1.7976931348623157E+308,1]);
+-------------------------------------------------------------------------+
| array_overlaps([-1.7976931348623157E+308],[-1.7976931348623157E+308,1]) |
+-------------------------------------------------------------------------+
|                                                                       1 |
+-------------------------------------------------------------------------+
bug 2024111100105047559   《[obmysql_array二期]array参数中的元素 含有不同的数字型，ob和pg 返回值不一样》
select array_overlaps([-9223372036854775808],[-1.7976931348623157E+308,1]);
+---------------------------------------------------------------------+
| array_overlaps([-9223372036854775808],[-1.7976931348623157E+308,1]) |
+---------------------------------------------------------------------+
|                                                                   0 |
+---------------------------------------------------------------------+
select array_overlaps([2.2250738585072014E-308],[2.2250738585072014E-308,1]);
+-----------------------------------------------------------------------+
| array_overlaps([2.2250738585072014E-308],[2.2250738585072014E-308,1]) |
+-----------------------------------------------------------------------+
|                                                                     1 |
+-----------------------------------------------------------------------+
bug 2024111100105047559   《[obmysql_array二期]array参数中的元素 含有不同的数字型，ob和pg 返回值不一样》
select array_overlaps([-1.7976931348623157E+308,18446744073709551615],[-1.7976931348623157E+308,1]);
+----------------------------------------------------------------------------------------------+
| array_overlaps([-1.7976931348623157E+308,18446744073709551615],[-1.7976931348623157E+308,1]) |
+----------------------------------------------------------------------------------------------+
|                                                                                            1 |
+----------------------------------------------------------------------------------------------+
select array_overlaps([-1.7976931348623157E+3,18446744073709551615],[-1.7976931348623157E+3,1]);
+------------------------------------------------------------------------------------------+
| array_overlaps([-1.7976931348623157E+3,18446744073709551615],[-1.7976931348623157E+3,1]) |
+------------------------------------------------------------------------------------------+
|                                                                                        1 |
+------------------------------------------------------------------------------------------+
select array_overlaps([-3.402823466E+38, -1.175494351E-38,-1.7976931348623157E+308, -2.2250738585072014E-308],[-3.402823466E+38, -1.175494351E-38,-1.7976931348623157E+308, -2.2250738585072014E-308]);
+-------------------------------------------------------------------------------------------------------------------------------------------------------------------------------------------------+
| array_overlaps([-3.402823466E+38, -1.175494351E-38,-1.7976931348623157E+308, -2.2250738585072014E-308],[-3.402823466E+38, -1.175494351E-38,-1.7976931348623157E+308, -2.2250738585072014E-308]) |
+-------------------------------------------------------------------------------------------------------------------------------------------------------------------------------------------------+
|                                                                                                                                                                                               1 |
+-------------------------------------------------------------------------------------------------------------------------------------------------------------------------------------------------+
bug 2024111100105047559   《[obmysql_array二期]array参数中的元素 含有不同的数字型，ob和pg 返回值不一样》
select array_overlaps([-3.402823466E+38,1],[-3.402823466E+38,9223372036854775808]);
+-----------------------------------------------------------------------------+
| array_overlaps([-3.402823466E+38,1],[-3.402823466E+38,9223372036854775808]) |
+-----------------------------------------------------------------------------+
|                                                                           1 |
+-----------------------------------------------------------------------------+
bug 2024111100105047559   《[obmysql_array二期]array参数中的元素 含有不同的数字型，ob和pg 返回值不一样》
select array_overlaps([-4.402823466E+38,9223372036854775808],[-4.402823466E+38,1]);
+-----------------------------------------------------------------------------+
| array_overlaps([-4.402823466E+38,9223372036854775808],[-4.402823466E+38,1]) |
+-----------------------------------------------------------------------------+
|                                                                           1 |
+-----------------------------------------------------------------------------+
select array_overlaps([-4.402823466E+38,-7.402826E+38],[-4.402823466E+38]);
+---------------------------------------------------------------------+
| array_overlaps([-4.402823466E+38,-7.402826E+38],[-4.402823466E+38]) |
+---------------------------------------------------------------------+
|                                                                   1 |
+---------------------------------------------------------------------+
select array_overlaps([-4.402823466E+38,-7.402826E+38],[-4.402823466E+38]);
+---------------------------------------------------------------------+
| array_overlaps([-4.402823466E+38,-7.402826E+38],[-4.402823466E+38]) |
+---------------------------------------------------------------------+
|                                                                   1 |
+---------------------------------------------------------------------+
bug 2024111100105047559   《[obmysql_array二期]array参数中的元素 含有不同的数字型，ob和pg 返回值不一样》
select array_overlaps([1,18446744073709551615],[18446744073709551613,18446744073709551614]);
+--------------------------------------------------------------------------------------+
| array_overlaps([1,18446744073709551615],[18446744073709551613,18446744073709551614]) |
+--------------------------------------------------------------------------------------+
|                                                                                    1 |
+--------------------------------------------------------------------------------------+
bug 2024111100105047559   《[obmysql_array二期]array参数中的元素 含有不同的数字型，ob和pg 返回值不一样》
select array_overlaps([[1,18446744073709551615],[-1]],[[1,18446744073709551614]]);
+----------------------------------------------------------------------------+
| array_overlaps([[1,18446744073709551615],[-1]],[[1,18446744073709551614]]) |
+----------------------------------------------------------------------------+
|                                                                          1 |
+----------------------------------------------------------------------------+
select array_overlaps(['[1]'],['[1]','test']);
+----------------------------------------+
| array_overlaps(['[1]'],['[1]','test']) |
+----------------------------------------+
|                                      1 |
+----------------------------------------+
select array_overlaps(['test','test1','test2'],['[1]','test']);
+---------------------------------------------------------+
| array_overlaps(['test','test1','test2'],['[1]','test']) |
+---------------------------------------------------------+
|                                                       1 |
+---------------------------------------------------------+
select array_overlaps(['TEST','test1','test2'],['[1]','test']);
+---------------------------------------------------------+
| array_overlaps(['TEST','test1','test2'],['[1]','test']) |
+---------------------------------------------------------+
|                                                       0 |
+---------------------------------------------------------+
select array_overlaps(['teswtestetstest',"testet"],['aaaa','testet']);
+----------------------------------------------------------------+
| array_overlaps(['teswtestetstest',"testet"],['aaaa','testet']) |
+----------------------------------------------------------------+
|                                                              1 |
+----------------------------------------------------------------+
select array_overlaps([[1,2,3,4,-5,60,70],['test']],[[1,4,1,2,3,'-5'],['test']]);
+---------------------------------------------------------------------------+
| array_overlaps([[1,2,3,4,-5,60,70],['test']],[[1,4,1,2,3,'-5'],['test']]) |
+---------------------------------------------------------------------------+
|                                                                         1 |
+---------------------------------------------------------------------------+
select array_overlaps([[[1,2,3,4,-5,60,70],['test']]],[[[1,4,1,2,3,'-5'],['test']]]);
+-------------------------------------------------------------------------------+
| array_overlaps([[[1,2,3,4,-5,60,70],['test']]],[[[1,4,1,2,3,'-5'],['test']]]) |
+-------------------------------------------------------------------------------+
|                                                                             0 |
+-------------------------------------------------------------------------------+
select array_overlaps(['teswtestetstest',"testet"],['aaaa','testet']);
+----------------------------------------------------------------+
| array_overlaps(['teswtestetstest',"testet"],['aaaa','testet']) |
+----------------------------------------------------------------+
|                                                              1 |
+----------------------------------------------------------------+
drop table test;
create table test(id int,a varchar(262144));
insert into test values(1,repeat('x',262144));
select array_overlaps(array(a),array(a)) from test;
+-----------------------------------+
| array_overlaps(array(a),array(a)) |
+-----------------------------------+
|                                 1 |
+-----------------------------------+
select array_overlaps(array(a),[3]) from test;
+------------------------------+
| array_overlaps(array(a),[3]) |
+------------------------------+
|                            0 |
+------------------------------+
select array_overlaps(array(a),['xxxxxxxx']) from test;
+---------------------------------------+
| array_overlaps(array(a),['xxxxxxxx']) |
+---------------------------------------+
|                                     0 |
+---------------------------------------+
bug 2024111400105109759   《【obmysql_array二期】array_overlaps 中null元素和字符元素，比较,ob 报1406》
select array_overlaps([null],['xxxxxxxx']);
+-------------------------------------+
| array_overlaps([null],['xxxxxxxx']) |
+-------------------------------------+
|                                   0 |
+-------------------------------------+
select array_overlaps([null],[1]);
+----------------------------+
| array_overlaps([null],[1]) |
+----------------------------+
|                          0 |
+----------------------------+
select array_overlaps([null],[1.655]);
+--------------------------------+
| array_overlaps([null],[1.655]) |
+--------------------------------+
|                              0 |
+--------------------------------+
select array_overlaps([null],[false,true]);
+-------------------------------------+
| array_overlaps([null],[false,true]) |
+-------------------------------------+
|                                   0 |
+-------------------------------------+
select array_overlaps([null,'test'],['xxxxxxxx']);
+--------------------------------------------+
| array_overlaps([null,'test'],['xxxxxxxx']) |
+--------------------------------------------+
|                                          0 |
+--------------------------------------------+
select array_overlaps([null,'test'],['test','3']);
+--------------------------------------------+
| array_overlaps([null,'test'],['test','3']) |
+--------------------------------------------+
|                                          1 |
+--------------------------------------------+
bug 2024111400105109759   《【obmysql_array二期】array_overlaps 中null元素和字符元素，比较,ob 报1406》
select array_overlaps([null,'test'],[null]);
+--------------------------------------+
| array_overlaps([null,'test'],[null]) |
+--------------------------------------+
|                                    1 |
+--------------------------------------+
select array_overlaps([['test],[test1']],['test1']);
ERROR 22000: array type mismatch found between definition and data
select array_overlaps([1],['1']);
+---------------------------+
| array_overlaps([1],['1']) |
+---------------------------+
|                         1 |
+---------------------------+
select array_overlaps(['1'],[1]);
+---------------------------+
| array_overlaps(['1'],[1]) |
+---------------------------+
|                         1 |
+---------------------------+
select array_overlaps([['1'],[0]],[[1],[3],[4],[5],[7],[9],[10],[11],[12],[13],[14]]);
+--------------------------------------------------------------------------------+
| array_overlaps([['1'],[0]],[[1],[3],[4],[5],[7],[9],[10],[11],[12],[13],[14]]) |
+--------------------------------------------------------------------------------+
|                                                                              1 |
+--------------------------------------------------------------------------------+
select array_overlaps(['test'],[true]);
+---------------------------------+
| array_overlaps(['test'],[true]) |
+---------------------------------+
|                               0 |
+---------------------------------+
select array_overlaps([false],[true]);
+--------------------------------+
| array_overlaps([false],[true]) |
+--------------------------------+
|                              0 |
+--------------------------------+
select array_overlaps([false],['test',null]);
+---------------------------------------+
| array_overlaps([false],['test',null]) |
+---------------------------------------+
|                                     0 |
+---------------------------------------+
bug 2024111400105109759   《【obmysql_array二期】array_overlaps 中null元素和字符元素，比较,ob 报1406》
select array_overlaps([[null]],[['test']]);
+-------------------------------------+
| array_overlaps([[null]],[['test']]) |
+-------------------------------------+
|                                   0 |
+-------------------------------------+
bug 2024111400105109759   《【obmysql_array二期】array_overlaps 中null元素和字符元素，比较,ob 报1406》
select array_overlaps([['test']],[[null]]);
+-------------------------------------+
| array_overlaps([['test']],[[null]]) |
+-------------------------------------+
|                                   0 |
+-------------------------------------+
select array_overlaps([['t']],[[null]]);
+----------------------------------+
| array_overlaps([['t']],[[null]]) |
+----------------------------------+
|                                0 |
+----------------------------------+
select array_overlaps([['t'],['asdfewrew']],[['b'],['c']]);
+-----------------------------------------------------+
| array_overlaps([['t'],['asdfewrew']],[['b'],['c']]) |
+-----------------------------------------------------+
|                                                   0 |
+-----------------------------------------------------+
select array_overlaps([['t'],['asdfewrew']],[['b'],['c'],['t']]);
+-----------------------------------------------------------+
| array_overlaps([['t'],['asdfewrew']],[['b'],['c'],['t']]) |
+-----------------------------------------------------------+
|                                                         1 |
+-----------------------------------------------------------+
select array_overlaps([[['t'],['asdfewrew']]],[[['b'],['c'],['t']]]);
+---------------------------------------------------------------+
| array_overlaps([[['t'],['asdfewrew']]],[[['b'],['c'],['t']]]) |
+---------------------------------------------------------------+
|                                                             0 |
+---------------------------------------------------------------+
select array_overlaps([[[[['t'],['asdfewrew']]]]],[[[[['b'],['c'],['t']]]]]);
+-----------------------------------------------------------------------+
| array_overlaps([[[[['t'],['asdfewrew']]]]],[[[[['b'],['c'],['t']]]]]) |
+-----------------------------------------------------------------------+
|                                                                     0 |
+-----------------------------------------------------------------------+
select array_overlaps([[[[[['t'],['asdfewrew']]]]]],[[[[[['t'],['asdfewrew']]]]]]);
+-----------------------------------------------------------------------------+
| array_overlaps([[[[[['t'],['asdfewrew']]]]]],[[[[[['t'],['asdfewrew']]]]]]) |
+-----------------------------------------------------------------------------+
|                                                                           1 |
+-----------------------------------------------------------------------------+
select array_overlaps([[[[['t'],['asdfewrew']]]]],[[[[['t1'],['asdfewrew']]]]]);
+--------------------------------------------------------------------------+
| array_overlaps([[[[['t'],['asdfewrew']]]]],[[[[['t1'],['asdfewrew']]]]]) |
+--------------------------------------------------------------------------+
|                                                                        0 |
+--------------------------------------------------------------------------+
select array_overlaps([[[[['t'],['asdfewrew']]]]],[[[[['t1'],['asdfewrew']]]]]);
+--------------------------------------------------------------------------+
| array_overlaps([[[[['t'],['asdfewrew']]]]],[[[[['t1'],['asdfewrew']]]]]) |
+--------------------------------------------------------------------------+
|                                                                        0 |
+--------------------------------------------------------------------------+
select array_overlaps(null,[1]);
+--------------------------+
| array_overlaps(null,[1]) |
+--------------------------+
|                     NULL |
+--------------------------+
select array_overlaps([b'111'],[1]);
ERROR 0A000: array element type not supported
select array_overlaps([1],[b'111']);
ERROR 0A000: array element type not supported
select array_overlaps([b'111'],[b'111']);
ERROR 0A000: array element type not supported
select array_overlaps(cast([1] as json),[1]);
ERROR 22000: Invalid data type for the operation
select array_overlaps(cast('{}' as json),[1]);
ERROR 22000: invalid obj type for type promotion: left_type=JSON right_type=ARRAY
select array_overlaps([1],cast([1] as json));
ERROR 22000: Invalid data type for the operation
select array_overlaps(id,[1]) from tt1;
ERROR 22000: invalid obj type for type promotion: left_type=INT right_type=ARRAY
select array_overlaps(1,[1]);
ERROR 22000: invalid obj type for type promotion: left_type=BIGINT right_type=ARRAY
select array_overlaps([x'01'],[1]);
ERROR 0A000: array element type not supported
select array_overlaps('test',[1]);
ERROR 22000: invalid obj type for type promotion: left_type=VARCHAR right_type=ARRAY
select array_overlaps(false,[1]);
ERROR 22000: invalid obj type for type promotion: left_type=TINYINT right_type=ARRAY
select array_overlaps(true,[1]);
ERROR 22000: invalid obj type for type promotion: left_type=TINYINT right_type=ARRAY
select array_overlaps([1],'test');
ERROR 22000: invalid obj type for type promotion: left_type=ARRAY right_type=VARCHAR
select array_overlaps(['1'],'[1]');
ERROR 22000: invalid obj type for type promotion: left_type=ARRAY right_type=VARCHAR
select array_overlaps([1],1);
ERROR 22000: invalid obj type for type promotion: left_type=ARRAY right_type=BIGINT
select array_overlaps(['test'],null);
+-------------------------------+
| array_overlaps(['test'],null) |
+-------------------------------+
|                          NULL |
+-------------------------------+
select array_overlaps([1],cast('[1]' as json));
ERROR 22000: invalid obj type for type promotion: left_type=ARRAY right_type=JSON
select array_overlaps([1],b'11');
ERROR 22000: invalid obj type for type promotion: left_type=ARRAY right_type=HEX_STRING
select array_overlaps([1],false);
ERROR 22000: invalid obj type for type promotion: left_type=ARRAY right_type=TINYINT
select array_overlaps([1],true);
ERROR 22000: invalid obj type for type promotion: left_type=ARRAY right_type=TINYINT
select array_overlaps([11],[x'11']);
ERROR 0A000: array element type not supported
select array_overlaps([11],[0x010101000000]);
ERROR 0A000: array element type not supported
select array_overlaps([11],[0x0000000001010000000000000000002E400000000000003440]);
ERROR 0A000: array element type not supported
select array_overlaps(c1,c1) from tt1;
+-----------------------+
| array_overlaps(c1,c1) |
+-----------------------+
|                     1 |
|                     1 |
|                  NULL |
+-----------------------+
select array_overlaps(c2,c2) from tt1;
+-----------------------+
| array_overlaps(c2,c2) |
+-----------------------+
|                     1 |
|                     1 |
|                  NULL |
+-----------------------+
select array_overlaps(c3,c3) from tt1;
+-----------------------+
| array_overlaps(c3,c3) |
+-----------------------+
|                     1 |
|                     1 |
|                  NULL |
+-----------------------+
select array_overlaps(c4,c4) from tt1;
+-----------------------+
| array_overlaps(c4,c4) |
+-----------------------+
|                     1 |
|                     1 |
|                  NULL |
+-----------------------+
select array_overlaps(c5,c5) from tt1;
+-----------------------+
| array_overlaps(c5,c5) |
+-----------------------+
|                     1 |
|                     1 |
|                  NULL |
+-----------------------+
select array_overlaps(c6,c6) from tt1;
+-----------------------+
| array_overlaps(c6,c6) |
+-----------------------+
|                     1 |
|                     1 |
|                  NULL |
+-----------------------+
select array_overlaps(c7,c7) from tt1;
+-----------------------+
| array_overlaps(c7,c7) |
+-----------------------+
|                     1 |
|                     1 |
|                  NULL |
+-----------------------+
select array_overlaps(c1,c2) from tt1;
+-----------------------+
| array_overlaps(c1,c2) |
+-----------------------+
|                     0 |
|                     0 |
|                  NULL |
+-----------------------+
select array_overlaps(c3,c2) from tt1;
+-----------------------+
| array_overlaps(c3,c2) |
+-----------------------+
|                     0 |
|                     0 |
|                  NULL |
+-----------------------+
select array_overlaps(c3,c4) from tt1;
+-----------------------+
| array_overlaps(c3,c4) |
+-----------------------+
|                     1 |
|                     1 |
|                  NULL |
+-----------------------+
select array_overlaps(c5,c6) from tt1;
+-----------------------+
| array_overlaps(c5,c6) |
+-----------------------+
|                     0 |
|                     0 |
|                  NULL |
+-----------------------+
select array_overlaps(c7,c1) from tt1;
+-----------------------+
| array_overlaps(c7,c1) |
+-----------------------+
|                     1 |
|                     1 |
|                  NULL |
+-----------------------+
select array_overlaps(c7,[4,6]) from tt1;
+--------------------------+
| array_overlaps(c7,[4,6]) |
+--------------------------+
|                        0 |
|                        0 |
|                     NULL |
+--------------------------+
select array_overlaps([46],c1) from vtt2;
+-------------------------+
| array_overlaps([46],c1) |
+-------------------------+
|                       0 |
|                       0 |
|                    NULL |
+-------------------------+
select array_overlaps([46],c1) from tt2;
+-------------------------+
| array_overlaps([46],c1) |
+-------------------------+
|                       0 |
|                       0 |
|                    NULL |
+-------------------------+
select *, array_overlaps(c7,c1) from vtt1;
+------+------------------------------+----------+-------------------+----------------------------------------------------------+-------------------+------------------------------------------------------+--------------------+-----------------------+
| id   | c1                           | c2       | c3                | c4                                                       | c5                | c6                                                   | c7                 | array_overlaps(c7,c1) |
+------+------------------------------+----------+-------------------+----------------------------------------------------------+-------------------+------------------------------------------------------+--------------------+-----------------------+
|    1 | [-2147483648,0,2147483647]   | ["test"] | [127,0,-128]      | [-9223372036854775808,9223372036854775807,775,808,2,0]   | [3.402,0,1.175]   | [1.7976931348623157e308,2.2250738585072014e-308]     | [-32768,0,32767]   |                     1 |
|    2 | [-2147483648,0,2147483647,4] | ["test"] | [127,0,-128,6,77] | [-9223372036854775808,9223372036854775807,775,808,2,0,1] | [3.402,0,1.175,4] | [-1.7976931348623158e30,1.2,2.2250738585072014e-308] | [-32768,0,32767,0] |                     1 |
|    3 | NULL                         | NULL     | NULL              | NULL                                                     | NULL              | NULL                                                 | NULL               |                  NULL |
+------+------------------------------+----------+-------------------+----------------------------------------------------------+-------------------+------------------------------------------------------+--------------------+-----------------------+
select *,array_overlaps(c7,c4) from vtt2;
+------+---------------------------+----------+--------------+----------------------------------------------+-------------------+------------------------------------------------------+------------------+-----------------------+
| id   | c1                        | c2       | c3           | c4                                           | c5                | c6                                                   | c7               | array_overlaps(c7,c4) |
+------+---------------------------+----------+--------------+----------------------------------------------+-------------------+------------------------------------------------------+------------------+-----------------------+
|    1 | [2147483648,0,2147483647] | ["test"] | [52,0,5]     | [852,9223372036854775807,775,808,2,0]        | [3.402,0,1.175]   | [1.7976931348623157e308,2.2250738585072014e-308]     | [88,0,32767]     |                     1 |
|    2 | [87666,0,2147483647,4]    | ["test"] | [5,0,7,6,50] | [1,100000,9223372036854775807,775,808,2,0,1] | [3.402,0,1.175,4] | [1.7976931348623157e308,1.2,2.2250738585072014e-308] | [68,0,32767,0,1] |                     1 |
|    3 | NULL                      | NULL     | NULL         | NULL                                         | NULL              | NULL                                                 | NULL             |                  NULL |
+------+---------------------------+----------+--------------+----------------------------------------------+-------------------+------------------------------------------------------+------------------+-----------------------+
select *,array_overlaps(c5,c4) from tt2;
+------+---------------------------+----------+--------------+----------------------------------------------+-------------------+------------------------------------------------------+------------------+-----------------------+
| id   | c1                        | c2       | c3           | c4                                           | c5                | c6                                                   | c7               | array_overlaps(c5,c4) |
+------+---------------------------+----------+--------------+----------------------------------------------+-------------------+------------------------------------------------------+------------------+-----------------------+
|    1 | [2147483648,0,2147483647] | ["test"] | [52,0,5]     | [852,9223372036854775807,775,808,2,0]        | [3.402,0,1.175]   | [1.7976931348623157e308,2.2250738585072014e-308]     | [88,0,32767]     |                     1 |
|    2 | [87666,0,2147483647,4]    | ["test"] | [5,0,7,6,50] | [1,100000,9223372036854775807,775,808,2,0,1] | [3.402,0,1.175,4] | [1.7976931348623157e308,1.2,2.2250738585072014e-308] | [68,0,32767,0,1] |                     1 |
|    3 | NULL                      | NULL     | NULL         | NULL                                         | NULL              | NULL                                                 | NULL             |                  NULL |
+------+---------------------------+----------+--------------+----------------------------------------------+-------------------+------------------------------------------------------+------------------+-----------------------+
select /*+enable_parallel_dml parallel(3) */ array_overlaps(c5,c4) from tt2;
+-----------------------+
| array_overlaps(c5,c4) |
+-----------------------+
|                     1 |
|                     1 |
|                  NULL |
+-----------------------+
select /*+enable_parallel_dml parallel(3) */ array_overlaps(c5,c4) from tt1;
+-----------------------+
| array_overlaps(c5,c4) |
+-----------------------+
|                     1 |
|                     1 |
|                  NULL |
+-----------------------+
select /*+enable_parallel_dml parallel(3) */ array_overlaps(c5,c4) from vtt2;
+-----------------------+
| array_overlaps(c5,c4) |
+-----------------------+
|                     1 |
|                     1 |
|                  NULL |
+-----------------------+
select /*+enable_parallel_dml parallel(3) */ array_overlaps(c5,c4) from vtt1;
+-----------------------+
| array_overlaps(c5,c4) |
+-----------------------+
|                     1 |
|                     1 |
|                  NULL |
+-----------------------+
select /*+read_consistency(weak) */ array_overlaps(c5,c4) from tt2;
+-----------------------+
| array_overlaps(c5,c4) |
+-----------------------+
|                     1 |
|                     1 |
|                  NULL |
+-----------------------+
select /*+read_consistency(weak) */ array_overlaps(c5,c4) from tt1;
+-----------------------+
| array_overlaps(c5,c4) |
+-----------------------+
|                     1 |
|                     1 |
|                  NULL |
+-----------------------+
select /*+read_consistency(weak) */ array_overlaps(c5,c4) ,c1,c4 from vtt2;
+-----------------------+---------------------------+----------------------------------------------+
| array_overlaps(c5,c4) | c1                        | c4                                           |
+-----------------------+---------------------------+----------------------------------------------+
|                     1 | [2147483648,0,2147483647] | [852,9223372036854775807,775,808,2,0]        |
|                     1 | [87666,0,2147483647,4]    | [1,100000,9223372036854775807,775,808,2,0,1] |
|                  NULL | NULL                      | NULL                                         |
+-----------------------+---------------------------+----------------------------------------------+
select /*+read_consistency(weak) */ array_overlaps(c5,c4) from vtt1;
+-----------------------+
| array_overlaps(c5,c4) |
+-----------------------+
|                     1 |
|                     1 |
|                  NULL |
+-----------------------+
select array_overlaps([1],[1],[1]);
ERROR 42000: Incorrect parameter count in the call to native function 'array_overlaps'
select array_overlaps([cast(1 as unsigned)],[cast(2 as unsigned)]);
+-------------------------------------------------------------+
| array_overlaps([cast(1 as unsigned)],[cast(2 as unsigned)]) |
+-------------------------------------------------------------+
|                                                           0 |
+-------------------------------------------------------------+
select array_overlaps([cast(1 as unsigned)],[cast(1 as unsigned)]);
+-------------------------------------------------------------+
| array_overlaps([cast(1 as unsigned)],[cast(1 as unsigned)]) |
+-------------------------------------------------------------+
|                                                           1 |
+-------------------------------------------------------------+
bug 2024110800105034260   《【obmysql_array二期】group by/having cardinality(),ob报4016》
select * ,array_overlaps(c1,c1) from tt1 group by array_overlaps(c1,c1);
+------+----------------------------+----------+--------------+--------------------------------------------------------+-----------------+--------------------------------------------------+------------------+-----------------------+
| id   | c1                         | c2       | c3           | c4                                                     | c5              | c6                                               | c7               | array_overlaps(c1,c1) |
+------+----------------------------+----------+--------------+--------------------------------------------------------+-----------------+--------------------------------------------------+------------------+-----------------------+
|    1 | [-2147483648,0,2147483647] | ["test"] | [127,0,-128] | [-9223372036854775808,9223372036854775807,775,808,2,0] | [3.402,0,1.175] | [1.7976931348623157e308,2.2250738585072014e-308] | [-32768,0,32767] |                     1 |
|    3 | NULL                       | NULL     | NULL         | NULL                                                   | NULL            | NULL                                             | NULL             |                  NULL |
+------+----------------------------+----------+--------------+--------------------------------------------------------+-----------------+--------------------------------------------------+------------------+-----------------------+
bug 2024110800105034260   《【obmysql_array二期】group by/having cardinality(),ob报4016》
select *  from tt1 group by array_overlaps(c1,c1);
+------+----------------------------+----------+--------------+--------------------------------------------------------+-----------------+--------------------------------------------------+------------------+
| id   | c1                         | c2       | c3           | c4                                                     | c5              | c6                                               | c7               |
+------+----------------------------+----------+--------------+--------------------------------------------------------+-----------------+--------------------------------------------------+------------------+
|    1 | [-2147483648,0,2147483647] | ["test"] | [127,0,-128] | [-9223372036854775808,9223372036854775807,775,808,2,0] | [3.402,0,1.175] | [1.7976931348623157e308,2.2250738585072014e-308] | [-32768,0,32767] |
|    3 | NULL                       | NULL     | NULL         | NULL                                                   | NULL            | NULL                                             | NULL             |
+------+----------------------------+----------+--------------+--------------------------------------------------------+-----------------+--------------------------------------------------+------------------+
bug 2024110800105034260   《【obmysql_array二期】group by/having cardinality(),ob报4016》
select * ,array_overlaps(c1,c1) from tt2 group by id having array_overlaps(c1,c1)>1;
+------+------+------+------+------+------+------+------+-----------------------+
| id   | c1   | c2   | c3   | c4   | c5   | c6   | c7   | array_overlaps(c1,c1) |
+------+------+------+------+------+------+------+------+-----------------------+
+------+------+------+------+------+------+------+------+-----------------------+
bug 2024110800105034260   《【obmysql_array二期】group by/having cardinality(),ob报4016》
select * ,array_overlaps(c1,c1) from vtt1 group by id having array_overlaps(c1,c1)>1;
+------+------+------+------+------+------+------+------+-----------------------+
| id   | c1   | c2   | c3   | c4   | c5   | c6   | c7   | array_overlaps(c1,c1) |
+------+------+------+------+------+------+------+------+-----------------------+
+------+------+------+------+------+------+------+------+-----------------------+
select * ,array_overlaps(c1,c1), c1 from tt1 order by array_overlaps(c1,c1);
+------+------------------------------+----------+-------------------+----------------------------------------------------------+-------------------+------------------------------------------------------+--------------------+-----------------------+------------------------------+
| id   | c1                           | c2       | c3                | c4                                                       | c5                | c6                                                   | c7                 | array_overlaps(c1,c1) | c1                           |
+------+------------------------------+----------+-------------------+----------------------------------------------------------+-------------------+------------------------------------------------------+--------------------+-----------------------+------------------------------+
|    3 | NULL                         | NULL     | NULL              | NULL                                                     | NULL              | NULL                                                 | NULL               |                  NULL | NULL                         |
|    1 | [-2147483648,0,2147483647]   | ["test"] | [127,0,-128]      | [-9223372036854775808,9223372036854775807,775,808,2,0]   | [3.402,0,1.175]   | [1.7976931348623157e308,2.2250738585072014e-308]     | [-32768,0,32767]   |                     1 | [-2147483648,0,2147483647]   |
|    2 | [-2147483648,0,2147483647,4] | ["test"] | [127,0,-128,6,77] | [-9223372036854775808,9223372036854775807,775,808,2,0,1] | [3.402,0,1.175,4] | [-1.7976931348623158e30,1.2,2.2250738585072014e-308] | [-32768,0,32767,0] |                     1 | [-2147483648,0,2147483647,4] |
+------+------------------------------+----------+-------------------+----------------------------------------------------------+-------------------+------------------------------------------------------+--------------------+-----------------------+------------------------------+
select * ,array_overlaps(c1,c1), c1,c2 from tt1 order by array_overlaps(c1,c1) desc ;
+------+------------------------------+----------+-------------------+----------------------------------------------------------+-------------------+------------------------------------------------------+--------------------+-----------------------+------------------------------+----------+
| id   | c1                           | c2       | c3                | c4                                                       | c5                | c6                                                   | c7                 | array_overlaps(c1,c1) | c1                           | c2       |
+------+------------------------------+----------+-------------------+----------------------------------------------------------+-------------------+------------------------------------------------------+--------------------+-----------------------+------------------------------+----------+
|    1 | [-2147483648,0,2147483647]   | ["test"] | [127,0,-128]      | [-9223372036854775808,9223372036854775807,775,808,2,0]   | [3.402,0,1.175]   | [1.7976931348623157e308,2.2250738585072014e-308]     | [-32768,0,32767]   |                     1 | [-2147483648,0,2147483647]   | ["test"] |
|    2 | [-2147483648,0,2147483647,4] | ["test"] | [127,0,-128,6,77] | [-9223372036854775808,9223372036854775807,775,808,2,0,1] | [3.402,0,1.175,4] | [-1.7976931348623158e30,1.2,2.2250738585072014e-308] | [-32768,0,32767,0] |                     1 | [-2147483648,0,2147483647,4] | ["test"] |
|    3 | NULL                         | NULL     | NULL              | NULL                                                     | NULL              | NULL                                                 | NULL               |                  NULL | NULL                         | NULL     |
+------+------------------------------+----------+-------------------+----------------------------------------------------------+-------------------+------------------------------------------------------+--------------------+-----------------------+------------------------------+----------+
select * ,array_overlaps(c2,c2), c1,c2 from tt1 order by array_overlaps(c2,c2) asc ;
+------+------------------------------+----------+-------------------+----------------------------------------------------------+-------------------+------------------------------------------------------+--------------------+-----------------------+------------------------------+----------+
| id   | c1                           | c2       | c3                | c4                                                       | c5                | c6                                                   | c7                 | array_overlaps(c2,c2) | c1                           | c2       |
+------+------------------------------+----------+-------------------+----------------------------------------------------------+-------------------+------------------------------------------------------+--------------------+-----------------------+------------------------------+----------+
|    3 | NULL                         | NULL     | NULL              | NULL                                                     | NULL              | NULL                                                 | NULL               |                  NULL | NULL                         | NULL     |
|    1 | [-2147483648,0,2147483647]   | ["test"] | [127,0,-128]      | [-9223372036854775808,9223372036854775807,775,808,2,0]   | [3.402,0,1.175]   | [1.7976931348623157e308,2.2250738585072014e-308]     | [-32768,0,32767]   |                     1 | [-2147483648,0,2147483647]   | ["test"] |
|    2 | [-2147483648,0,2147483647,4] | ["test"] | [127,0,-128,6,77] | [-9223372036854775808,9223372036854775807,775,808,2,0,1] | [3.402,0,1.175,4] | [-1.7976931348623158e30,1.2,2.2250738585072014e-308] | [-32768,0,32767,0] |                     1 | [-2147483648,0,2147483647,4] | ["test"] |
+------+------------------------------+----------+-------------------+----------------------------------------------------------+-------------------+------------------------------------------------------+--------------------+-----------------------+------------------------------+----------+
select * ,array_overlaps(c1,c1), c1 from vtt1 order by array_overlaps(c1,c1);
+------+------------------------------+----------+-------------------+----------------------------------------------------------+-------------------+------------------------------------------------------+--------------------+-----------------------+------------------------------+
| id   | c1                           | c2       | c3                | c4                                                       | c5                | c6                                                   | c7                 | array_overlaps(c1,c1) | c1                           |
+------+------------------------------+----------+-------------------+----------------------------------------------------------+-------------------+------------------------------------------------------+--------------------+-----------------------+------------------------------+
|    3 | NULL                         | NULL     | NULL              | NULL                                                     | NULL              | NULL                                                 | NULL               |                  NULL | NULL                         |
|    1 | [-2147483648,0,2147483647]   | ["test"] | [127,0,-128]      | [-9223372036854775808,9223372036854775807,775,808,2,0]   | [3.402,0,1.175]   | [1.7976931348623157e308,2.2250738585072014e-308]     | [-32768,0,32767]   |                     1 | [-2147483648,0,2147483647]   |
|    2 | [-2147483648,0,2147483647,4] | ["test"] | [127,0,-128,6,77] | [-9223372036854775808,9223372036854775807,775,808,2,0,1] | [3.402,0,1.175,4] | [-1.7976931348623158e30,1.2,2.2250738585072014e-308] | [-32768,0,32767,0] |                     1 | [-2147483648,0,2147483647,4] |
+------+------------------------------+----------+-------------------+----------------------------------------------------------+-------------------+------------------------------------------------------+--------------------+-----------------------+------------------------------+
select * ,array_overlaps(c1,c1), c1,c2 from vtt1 order by array_overlaps(c1,c1) desc ;
+------+------------------------------+----------+-------------------+----------------------------------------------------------+-------------------+------------------------------------------------------+--------------------+-----------------------+------------------------------+----------+
| id   | c1                           | c2       | c3                | c4                                                       | c5                | c6                                                   | c7                 | array_overlaps(c1,c1) | c1                           | c2       |
+------+------------------------------+----------+-------------------+----------------------------------------------------------+-------------------+------------------------------------------------------+--------------------+-----------------------+------------------------------+----------+
|    1 | [-2147483648,0,2147483647]   | ["test"] | [127,0,-128]      | [-9223372036854775808,9223372036854775807,775,808,2,0]   | [3.402,0,1.175]   | [1.7976931348623157e308,2.2250738585072014e-308]     | [-32768,0,32767]   |                     1 | [-2147483648,0,2147483647]   | ["test"] |
|    2 | [-2147483648,0,2147483647,4] | ["test"] | [127,0,-128,6,77] | [-9223372036854775808,9223372036854775807,775,808,2,0,1] | [3.402,0,1.175,4] | [-1.7976931348623158e30,1.2,2.2250738585072014e-308] | [-32768,0,32767,0] |                     1 | [-2147483648,0,2147483647,4] | ["test"] |
|    3 | NULL                         | NULL     | NULL              | NULL                                                     | NULL              | NULL                                                 | NULL               |                  NULL | NULL                         | NULL     |
+------+------------------------------+----------+-------------------+----------------------------------------------------------+-------------------+------------------------------------------------------+--------------------+-----------------------+------------------------------+----------+
select * ,array_overlaps(c2,c2), c1,c2 from vtt1 order by array_overlaps(c2,c2) asc ;
+------+------------------------------+----------+-------------------+----------------------------------------------------------+-------------------+------------------------------------------------------+--------------------+-----------------------+------------------------------+----------+
| id   | c1                           | c2       | c3                | c4                                                       | c5                | c6                                                   | c7                 | array_overlaps(c2,c2) | c1                           | c2       |
+------+------------------------------+----------+-------------------+----------------------------------------------------------+-------------------+------------------------------------------------------+--------------------+-----------------------+------------------------------+----------+
|    3 | NULL                         | NULL     | NULL              | NULL                                                     | NULL              | NULL                                                 | NULL               |                  NULL | NULL                         | NULL     |
|    1 | [-2147483648,0,2147483647]   | ["test"] | [127,0,-128]      | [-9223372036854775808,9223372036854775807,775,808,2,0]   | [3.402,0,1.175]   | [1.7976931348623157e308,2.2250738585072014e-308]     | [-32768,0,32767]   |                     1 | [-2147483648,0,2147483647]   | ["test"] |
|    2 | [-2147483648,0,2147483647,4] | ["test"] | [127,0,-128,6,77] | [-9223372036854775808,9223372036854775807,775,808,2,0,1] | [3.402,0,1.175,4] | [-1.7976931348623158e30,1.2,2.2250738585072014e-308] | [-32768,0,32767,0] |                     1 | [-2147483648,0,2147483647,4] | ["test"] |
+------+------------------------------+----------+-------------------+----------------------------------------------------------+-------------------+------------------------------------------------------+--------------------+-----------------------+------------------------------+----------+
select * ,array_overlaps(c1,c1), c1 from tt2 where id=1 order by array_overlaps(c1,c1);
+------+---------------------------+----------+----------+---------------------------------------+-----------------+--------------------------------------------------+--------------+-----------------------+---------------------------+
| id   | c1                        | c2       | c3       | c4                                    | c5              | c6                                               | c7           | array_overlaps(c1,c1) | c1                        |
+------+---------------------------+----------+----------+---------------------------------------+-----------------+--------------------------------------------------+--------------+-----------------------+---------------------------+
|    1 | [2147483648,0,2147483647] | ["test"] | [52,0,5] | [852,9223372036854775807,775,808,2,0] | [3.402,0,1.175] | [1.7976931348623157e308,2.2250738585072014e-308] | [88,0,32767] |                     1 | [2147483648,0,2147483647] |
+------+---------------------------+----------+----------+---------------------------------------+-----------------+--------------------------------------------------+--------------+-----------------------+---------------------------+
select * ,array_overlaps(c1,c1), c1,c2 from tt2 where id=1  order by array_overlaps(c1,c1) desc ;
+------+---------------------------+----------+----------+---------------------------------------+-----------------+--------------------------------------------------+--------------+-----------------------+---------------------------+----------+
| id   | c1                        | c2       | c3       | c4                                    | c5              | c6                                               | c7           | array_overlaps(c1,c1) | c1                        | c2       |
+------+---------------------------+----------+----------+---------------------------------------+-----------------+--------------------------------------------------+--------------+-----------------------+---------------------------+----------+
|    1 | [2147483648,0,2147483647] | ["test"] | [52,0,5] | [852,9223372036854775807,775,808,2,0] | [3.402,0,1.175] | [1.7976931348623157e308,2.2250738585072014e-308] | [88,0,32767] |                     1 | [2147483648,0,2147483647] | ["test"] |
+------+---------------------------+----------+----------+---------------------------------------+-----------------+--------------------------------------------------+--------------+-----------------------+---------------------------+----------+
select * ,array_overlaps(c2,c2), c1,c2 from tt2  where id=1  order by array_overlaps(c2,c2) asc ;
+------+---------------------------+----------+----------+---------------------------------------+-----------------+--------------------------------------------------+--------------+-----------------------+---------------------------+----------+
| id   | c1                        | c2       | c3       | c4                                    | c5              | c6                                               | c7           | array_overlaps(c2,c2) | c1                        | c2       |
+------+---------------------------+----------+----------+---------------------------------------+-----------------+--------------------------------------------------+--------------+-----------------------+---------------------------+----------+
|    1 | [2147483648,0,2147483647] | ["test"] | [52,0,5] | [852,9223372036854775807,775,808,2,0] | [3.402,0,1.175] | [1.7976931348623157e308,2.2250738585072014e-308] | [88,0,32767] |                     1 | [2147483648,0,2147483647] | ["test"] |
+------+---------------------------+----------+----------+---------------------------------------+-----------------+--------------------------------------------------+--------------+-----------------------+---------------------------+----------+
select * ,array_overlaps(c1,c1), c1 from vtt2 where id=1 order by array_overlaps(c1,c1);
+------+---------------------------+----------+----------+---------------------------------------+-----------------+--------------------------------------------------+--------------+-----------------------+---------------------------+
| id   | c1                        | c2       | c3       | c4                                    | c5              | c6                                               | c7           | array_overlaps(c1,c1) | c1                        |
+------+---------------------------+----------+----------+---------------------------------------+-----------------+--------------------------------------------------+--------------+-----------------------+---------------------------+
|    1 | [2147483648,0,2147483647] | ["test"] | [52,0,5] | [852,9223372036854775807,775,808,2,0] | [3.402,0,1.175] | [1.7976931348623157e308,2.2250738585072014e-308] | [88,0,32767] |                     1 | [2147483648,0,2147483647] |
+------+---------------------------+----------+----------+---------------------------------------+-----------------+--------------------------------------------------+--------------+-----------------------+---------------------------+
select * ,array_overlaps(c1,c1), c1,c2 from vtt2 where id=1  order by array_overlaps(c1,c1) desc ;
+------+---------------------------+----------+----------+---------------------------------------+-----------------+--------------------------------------------------+--------------+-----------------------+---------------------------+----------+
| id   | c1                        | c2       | c3       | c4                                    | c5              | c6                                               | c7           | array_overlaps(c1,c1) | c1                        | c2       |
+------+---------------------------+----------+----------+---------------------------------------+-----------------+--------------------------------------------------+--------------+-----------------------+---------------------------+----------+
|    1 | [2147483648,0,2147483647] | ["test"] | [52,0,5] | [852,9223372036854775807,775,808,2,0] | [3.402,0,1.175] | [1.7976931348623157e308,2.2250738585072014e-308] | [88,0,32767] |                     1 | [2147483648,0,2147483647] | ["test"] |
+------+---------------------------+----------+----------+---------------------------------------+-----------------+--------------------------------------------------+--------------+-----------------------+---------------------------+----------+
select * ,array_overlaps(c2,c2), c1,c2 from vtt2  where id=1  order by array_overlaps(c2,c2) asc ;
+------+---------------------------+----------+----------+---------------------------------------+-----------------+--------------------------------------------------+--------------+-----------------------+---------------------------+----------+
| id   | c1                        | c2       | c3       | c4                                    | c5              | c6                                               | c7           | array_overlaps(c2,c2) | c1                        | c2       |
+------+---------------------------+----------+----------+---------------------------------------+-----------------+--------------------------------------------------+--------------+-----------------------+---------------------------+----------+
|    1 | [2147483648,0,2147483647] | ["test"] | [52,0,5] | [852,9223372036854775807,775,808,2,0] | [3.402,0,1.175] | [1.7976931348623157e308,2.2250738585072014e-308] | [88,0,32767] |                     1 | [2147483648,0,2147483647] | ["test"] |
+------+---------------------------+----------+----------+---------------------------------------+-----------------+--------------------------------------------------+--------------+-----------------------+---------------------------+----------+
select  distinct array_overlaps(c1,c1) from tt1 limit 2;
+-----------------------+
| array_overlaps(c1,c1) |
+-----------------------+
|                     1 |
|                  NULL |
+-----------------------+
select  distinct array_overlaps(c1,c1) from tt2;
+-----------------------+
| array_overlaps(c1,c1) |
+-----------------------+
|                     1 |
|                  NULL |
+-----------------------+
select  distinct array_overlaps(c1,c1) from vtt1;
+-----------------------+
| array_overlaps(c1,c1) |
+-----------------------+
|                     1 |
|                  NULL |
+-----------------------+
select  distinct array_overlaps(c1,c1) from vtt2;
+-----------------------+
| array_overlaps(c1,c1) |
+-----------------------+
|                     1 |
|                  NULL |
+-----------------------+
select  distinct array_overlaps([1,2,4],[1,3,4,7]) from tt2;
+-----------------------------------+
| array_overlaps([1,2,4],[1,3,4,7]) |
+-----------------------------------+
|                                 1 |
+-----------------------------------+
select  distinct array_overlaps([1,1,1,1,1,1,1],[2,2,2,2,2,2,2]) from tt2;
+-------------------------------------------------+
| array_overlaps([1,1,1,1,1,1,1],[2,2,2,2,2,2,2]) |
+-------------------------------------------------+
|                                               0 |
+-------------------------------------------------+
select cast(array_overlaps(c1,c1) as unsigned) from tt1;
+-----------------------------------------+
| cast(array_overlaps(c1,c1) as unsigned) |
+-----------------------------------------+
|                                       1 |
|                                       1 |
|                                    NULL |
+-----------------------------------------+
select cast(array_overlaps(c2,c2) as UNSIGNED) from tt1;
+-----------------------------------------+
| cast(array_overlaps(c2,c2) as UNSIGNED) |
+-----------------------------------------+
|                                       1 |
|                                       1 |
|                                    NULL |
+-----------------------------------------+
select cast(array_overlaps(c1,c1) as SIGNED) from tt1;
+---------------------------------------+
| cast(array_overlaps(c1,c1) as SIGNED) |
+---------------------------------------+
|                                     1 |
|                                     1 |
|                                  NULL |
+---------------------------------------+
select cast(array_overlaps(c1,c1) as date) from tt1;
+-------------------------------------+
| cast(array_overlaps(c1,c1) as date) |
+-------------------------------------+
| NULL                                |
| NULL                                |
| NULL                                |
+-------------------------------------+
select cast(array_overlaps(c1,c1) as DATETIME) from tt1;
+-----------------------------------------+
| cast(array_overlaps(c1,c1) as DATETIME) |
+-----------------------------------------+
| NULL                                    |
| NULL                                    |
| NULL                                    |
+-----------------------------------------+
select cast(array_overlaps(c1,c1) as TIME) from vtt2;
+-------------------------------------+
| cast(array_overlaps(c1,c1) as TIME) |
+-------------------------------------+
| 00:00:01                            |
| 00:00:01                            |
| NULL                                |
+-------------------------------------+
select cast(array_overlaps(c1,c1) as FLOAT) from tt1;
+--------------------------------------+
| cast(array_overlaps(c1,c1) as FLOAT) |
+--------------------------------------+
|                                    1 |
|                                    1 |
|                                 NULL |
+--------------------------------------+
select cast(array_overlaps(c1,c1) as year) from tt1;
+-------------------------------------+
| cast(array_overlaps(c1,c1) as year) |
+-------------------------------------+
|                                2001 |
|                                2001 |
|                                NULL |
+-------------------------------------+
select cast(array_overlaps(c1,c1) as DOUBLE) from tt2;
+---------------------------------------+
| cast(array_overlaps(c1,c1) as DOUBLE) |
+---------------------------------------+
|                                     1 |
|                                     1 |
|                                  NULL |
+---------------------------------------+
select cast(array_overlaps(c1,c1) as DECIMAL) from tt1;
+----------------------------------------+
| cast(array_overlaps(c1,c1) as DECIMAL) |
+----------------------------------------+
|                                      1 |
|                                      1 |
|                                   NULL |
+----------------------------------------+
select cast(array_overlaps(c1,c1) as NUMERIC) from tt1;
+----------------------------------------+
| cast(array_overlaps(c1,c1) as NUMERIC) |
+----------------------------------------+
|                                      1 |
|                                      1 |
|                                   NULL |
+----------------------------------------+
select cast(array_overlaps(c1,c1) as dec) from tt1;
+------------------------------------+
| cast(array_overlaps(c1,c1) as dec) |
+------------------------------------+
|                                  1 |
|                                  1 |
|                               NULL |
+------------------------------------+
select cast(array_overlaps(c1,c1) as FIXED) from vtt1;
+--------------------------------------+
| cast(array_overlaps(c1,c1) as FIXED) |
+--------------------------------------+
|                                    1 |
|                                    1 |
|                                 NULL |
+--------------------------------------+
select cast(array_overlaps(c1,c1) as  point) from tt1;
ERROR 22023: Invalid GIS data provided to function cast_as_point.
select cast(array_overlaps(c1,c1) as  json) from tt1;
+--------------------------------------+
| cast(array_overlaps(c1,c1) as  json) |
+--------------------------------------+
| 1                                    |
| 1                                    |
| NULL                                 |
+--------------------------------------+
select cast(array_overlaps(c1,c1) as  roaringbitmap) from vtt1;
ERROR 22000: Invalid data type for the operation
select *,array_overlaps(c1 ,c5) from tt1 where array_overlaps(c1 ,c5) =1;
+------+------------------------------+----------+-------------------+----------------------------------------------------------+-------------------+------------------------------------------------------+--------------------+------------------------+
| id   | c1                           | c2       | c3                | c4                                                       | c5                | c6                                                   | c7                 | array_overlaps(c1 ,c5) |
+------+------------------------------+----------+-------------------+----------------------------------------------------------+-------------------+------------------------------------------------------+--------------------+------------------------+
|    1 | [-2147483648,0,2147483647]   | ["test"] | [127,0,-128]      | [-9223372036854775808,9223372036854775807,775,808,2,0]   | [3.402,0,1.175]   | [1.7976931348623157e308,2.2250738585072014e-308]     | [-32768,0,32767]   |                      1 |
|    2 | [-2147483648,0,2147483647,4] | ["test"] | [127,0,-128,6,77] | [-9223372036854775808,9223372036854775807,775,808,2,0,1] | [3.402,0,1.175,4] | [-1.7976931348623158e30,1.2,2.2250738585072014e-308] | [-32768,0,32767,0] |                      1 |
+------+------------------------------+----------+-------------------+----------------------------------------------------------+-------------------+------------------------------------------------------+--------------------+------------------------+
select * from tt1 where array_overlaps(c1 ,c5) =1;
+------+------------------------------+----------+-------------------+----------------------------------------------------------+-------------------+------------------------------------------------------+--------------------+
| id   | c1                           | c2       | c3                | c4                                                       | c5                | c6                                                   | c7                 |
+------+------------------------------+----------+-------------------+----------------------------------------------------------+-------------------+------------------------------------------------------+--------------------+
|    1 | [-2147483648,0,2147483647]   | ["test"] | [127,0,-128]      | [-9223372036854775808,9223372036854775807,775,808,2,0]   | [3.402,0,1.175]   | [1.7976931348623157e308,2.2250738585072014e-308]     | [-32768,0,32767]   |
|    2 | [-2147483648,0,2147483647,4] | ["test"] | [127,0,-128,6,77] | [-9223372036854775808,9223372036854775807,775,808,2,0,1] | [3.402,0,1.175,4] | [-1.7976931348623158e30,1.2,2.2250738585072014e-308] | [-32768,0,32767,0] |
+------+------------------------------+----------+-------------------+----------------------------------------------------------+-------------------+------------------------------------------------------+--------------------+
select * from tt1 where  array_overlaps(c1 ,c5)='1';
+------+------------------------------+----------+-------------------+----------------------------------------------------------+-------------------+------------------------------------------------------+--------------------+
| id   | c1                           | c2       | c3                | c4                                                       | c5                | c6                                                   | c7                 |
+------+------------------------------+----------+-------------------+----------------------------------------------------------+-------------------+------------------------------------------------------+--------------------+
|    1 | [-2147483648,0,2147483647]   | ["test"] | [127,0,-128]      | [-9223372036854775808,9223372036854775807,775,808,2,0]   | [3.402,0,1.175]   | [1.7976931348623157e308,2.2250738585072014e-308]     | [-32768,0,32767]   |
|    2 | [-2147483648,0,2147483647,4] | ["test"] | [127,0,-128,6,77] | [-9223372036854775808,9223372036854775807,775,808,2,0,1] | [3.402,0,1.175,4] | [-1.7976931348623158e30,1.2,2.2250738585072014e-308] | [-32768,0,32767,0] |
+------+------------------------------+----------+-------------------+----------------------------------------------------------+-------------------+------------------------------------------------------+--------------------+
select * from tt1 where  array_overlaps(c1 ,c5)=array_overlaps(c1 ,c5);
+------+------------------------------+----------+-------------------+----------------------------------------------------------+-------------------+------------------------------------------------------+--------------------+
| id   | c1                           | c2       | c3                | c4                                                       | c5                | c6                                                   | c7                 |
+------+------------------------------+----------+-------------------+----------------------------------------------------------+-------------------+------------------------------------------------------+--------------------+
|    1 | [-2147483648,0,2147483647]   | ["test"] | [127,0,-128]      | [-9223372036854775808,9223372036854775807,775,808,2,0]   | [3.402,0,1.175]   | [1.7976931348623157e308,2.2250738585072014e-308]     | [-32768,0,32767]   |
|    2 | [-2147483648,0,2147483647,4] | ["test"] | [127,0,-128,6,77] | [-9223372036854775808,9223372036854775807,775,808,2,0,1] | [3.402,0,1.175,4] | [-1.7976931348623158e30,1.2,2.2250738585072014e-308] | [-32768,0,32767,0] |
+------+------------------------------+----------+-------------------+----------------------------------------------------------+-------------------+------------------------------------------------------+--------------------+
select * from tt1 where  array_overlaps(c1 ,c5)=array_overlaps(c1 ,c5);
+------+------------------------------+----------+-------------------+----------------------------------------------------------+-------------------+------------------------------------------------------+--------------------+
| id   | c1                           | c2       | c3                | c4                                                       | c5                | c6                                                   | c7                 |
+------+------------------------------+----------+-------------------+----------------------------------------------------------+-------------------+------------------------------------------------------+--------------------+
|    1 | [-2147483648,0,2147483647]   | ["test"] | [127,0,-128]      | [-9223372036854775808,9223372036854775807,775,808,2,0]   | [3.402,0,1.175]   | [1.7976931348623157e308,2.2250738585072014e-308]     | [-32768,0,32767]   |
|    2 | [-2147483648,0,2147483647,4] | ["test"] | [127,0,-128,6,77] | [-9223372036854775808,9223372036854775807,775,808,2,0,1] | [3.402,0,1.175,4] | [-1.7976931348623158e30,1.2,2.2250738585072014e-308] | [-32768,0,32767,0] |
+------+------------------------------+----------+-------------------+----------------------------------------------------------+-------------------+------------------------------------------------------+--------------------+
select * from tt1 where array_overlaps(c1 ,c5)<'test';
+------+------+------+------+------+------+------+------+
| id   | c1   | c2   | c3   | c4   | c5   | c6   | c7   |
+------+------+------+------+------+------+------+------+
+------+------+------+------+------+------+------+------+
Warnings:
Warning	1292	Truncated incorrect DECIMAL value: 'test'
Warning	1292	Truncated incorrect DECIMAL value: 'test'
select * from tt1 where array_overlaps(c1 ,c5)<=>id;
+------+----------------------------+----------+--------------+--------------------------------------------------------+-----------------+--------------------------------------------------+------------------+
| id   | c1                         | c2       | c3           | c4                                                     | c5              | c6                                               | c7               |
+------+----------------------------+----------+--------------+--------------------------------------------------------+-----------------+--------------------------------------------------+------------------+
|    1 | [-2147483648,0,2147483647] | ["test"] | [127,0,-128] | [-9223372036854775808,9223372036854775807,775,808,2,0] | [3.402,0,1.175] | [1.7976931348623157e308,2.2250738585072014e-308] | [-32768,0,32767] |
+------+----------------------------+----------+--------------+--------------------------------------------------------+-----------------+--------------------------------------------------+------------------+
select * from tt1 where array_overlaps(c1 ,c5)!= cardinality([1,2,34,5,6]);
+------+------------------------------+----------+-------------------+----------------------------------------------------------+-------------------+------------------------------------------------------+--------------------+
| id   | c1                           | c2       | c3                | c4                                                       | c5                | c6                                                   | c7                 |
+------+------------------------------+----------+-------------------+----------------------------------------------------------+-------------------+------------------------------------------------------+--------------------+
|    1 | [-2147483648,0,2147483647]   | ["test"] | [127,0,-128]      | [-9223372036854775808,9223372036854775807,775,808,2,0]   | [3.402,0,1.175]   | [1.7976931348623157e308,2.2250738585072014e-308]     | [-32768,0,32767]   |
|    2 | [-2147483648,0,2147483647,4] | ["test"] | [127,0,-128,6,77] | [-9223372036854775808,9223372036854775807,775,808,2,0,1] | [3.402,0,1.175,4] | [-1.7976931348623158e30,1.2,2.2250738585072014e-308] | [-32768,0,32767,0] |
+------+------------------------------+----------+-------------------+----------------------------------------------------------+-------------------+------------------------------------------------------+--------------------+
select * from tt1 where array_overlaps(c1 ,c5) BETWEEN array_overlaps(c1 ,c5) AND array_overlaps(c1 ,c5);
+------+------------------------------+----------+-------------------+----------------------------------------------------------+-------------------+------------------------------------------------------+--------------------+
| id   | c1                           | c2       | c3                | c4                                                       | c5                | c6                                                   | c7                 |
+------+------------------------------+----------+-------------------+----------------------------------------------------------+-------------------+------------------------------------------------------+--------------------+
|    1 | [-2147483648,0,2147483647]   | ["test"] | [127,0,-128]      | [-9223372036854775808,9223372036854775807,775,808,2,0]   | [3.402,0,1.175]   | [1.7976931348623157e308,2.2250738585072014e-308]     | [-32768,0,32767]   |
|    2 | [-2147483648,0,2147483647,4] | ["test"] | [127,0,-128,6,77] | [-9223372036854775808,9223372036854775807,775,808,2,0,1] | [3.402,0,1.175,4] | [-1.7976931348623158e30,1.2,2.2250738585072014e-308] | [-32768,0,32767,0] |
+------+------------------------------+----------+-------------------+----------------------------------------------------------+-------------------+------------------------------------------------------+--------------------+
select * from tt1 where array_overlaps(c1 ,c5) not BETWEEN array_overlaps(c1 ,c5) AND array_overlaps(c1 ,c5);
+------+------+------+------+------+------+------+------+
| id   | c1   | c2   | c3   | c4   | c5   | c6   | c7   |
+------+------+------+------+------+------+------+------+
+------+------+------+------+------+------+------+------+
select * from tt1 where array_overlaps(c1 ,c5) not in (array_overlaps(c1 ,c5),cardinality([1,2,5,7])) ;
+------+------+------+------+------+------+------+------+
| id   | c1   | c2   | c3   | c4   | c5   | c6   | c7   |
+------+------+------+------+------+------+------+------+
+------+------+------+------+------+------+------+------+
select * from tt1 where array_overlaps(c1 ,c5)  in (array_overlaps(c1 ,c5),cardinality([1,2,5,7])) ;
+------+------------------------------+----------+-------------------+----------------------------------------------------------+-------------------+------------------------------------------------------+--------------------+
| id   | c1                           | c2       | c3                | c4                                                       | c5                | c6                                                   | c7                 |
+------+------------------------------+----------+-------------------+----------------------------------------------------------+-------------------+------------------------------------------------------+--------------------+
|    1 | [-2147483648,0,2147483647]   | ["test"] | [127,0,-128]      | [-9223372036854775808,9223372036854775807,775,808,2,0]   | [3.402,0,1.175]   | [1.7976931348623157e308,2.2250738585072014e-308]     | [-32768,0,32767]   |
|    2 | [-2147483648,0,2147483647,4] | ["test"] | [127,0,-128,6,77] | [-9223372036854775808,9223372036854775807,775,808,2,0,1] | [3.402,0,1.175,4] | [-1.7976931348623158e30,1.2,2.2250738585072014e-308] | [-32768,0,32767,0] |
+------+------------------------------+----------+-------------------+----------------------------------------------------------+-------------------+------------------------------------------------------+--------------------+
select * from tt1 where array_overlaps(c1 ,c5) like array_overlaps(c1 ,c5);
+------+------------------------------+----------+-------------------+----------------------------------------------------------+-------------------+------------------------------------------------------+--------------------+
| id   | c1                           | c2       | c3                | c4                                                       | c5                | c6                                                   | c7                 |
+------+------------------------------+----------+-------------------+----------------------------------------------------------+-------------------+------------------------------------------------------+--------------------+
|    1 | [-2147483648,0,2147483647]   | ["test"] | [127,0,-128]      | [-9223372036854775808,9223372036854775807,775,808,2,0]   | [3.402,0,1.175]   | [1.7976931348623157e308,2.2250738585072014e-308]     | [-32768,0,32767]   |
|    2 | [-2147483648,0,2147483647,4] | ["test"] | [127,0,-128,6,77] | [-9223372036854775808,9223372036854775807,775,808,2,0,1] | [3.402,0,1.175,4] | [-1.7976931348623158e30,1.2,2.2250738585072014e-308] | [-32768,0,32767,0] |
+------+------------------------------+----------+-------------------+----------------------------------------------------------+-------------------+------------------------------------------------------+--------------------+
select * from tt1 where array_overlaps(c1 ,c5) not like array_overlaps(c1 ,c5);
+------+------+------+------+------+------+------+------+
| id   | c1   | c2   | c3   | c4   | c5   | c6   | c7   |
+------+------+------+------+------+------+------+------+
+------+------+------+------+------+------+------+------+
select * from tt1 where array_overlaps(c1 ,c5) is true;
+------+------------------------------+----------+-------------------+----------------------------------------------------------+-------------------+------------------------------------------------------+--------------------+
| id   | c1                           | c2       | c3                | c4                                                       | c5                | c6                                                   | c7                 |
+------+------------------------------+----------+-------------------+----------------------------------------------------------+-------------------+------------------------------------------------------+--------------------+
|    1 | [-2147483648,0,2147483647]   | ["test"] | [127,0,-128]      | [-9223372036854775808,9223372036854775807,775,808,2,0]   | [3.402,0,1.175]   | [1.7976931348623157e308,2.2250738585072014e-308]     | [-32768,0,32767]   |
|    2 | [-2147483648,0,2147483647,4] | ["test"] | [127,0,-128,6,77] | [-9223372036854775808,9223372036854775807,775,808,2,0,1] | [3.402,0,1.175,4] | [-1.7976931348623158e30,1.2,2.2250738585072014e-308] | [-32768,0,32767,0] |
+------+------------------------------+----------+-------------------+----------------------------------------------------------+-------------------+------------------------------------------------------+--------------------+
select * from tt1 where array_overlaps([1,2],[0])  is not true;
+------+------------------------------+----------+-------------------+----------------------------------------------------------+-------------------+------------------------------------------------------+--------------------+
| id   | c1                           | c2       | c3                | c4                                                       | c5                | c6                                                   | c7                 |
+------+------------------------------+----------+-------------------+----------------------------------------------------------+-------------------+------------------------------------------------------+--------------------+
|    1 | [-2147483648,0,2147483647]   | ["test"] | [127,0,-128]      | [-9223372036854775808,9223372036854775807,775,808,2,0]   | [3.402,0,1.175]   | [1.7976931348623157e308,2.2250738585072014e-308]     | [-32768,0,32767]   |
|    2 | [-2147483648,0,2147483647,4] | ["test"] | [127,0,-128,6,77] | [-9223372036854775808,9223372036854775807,775,808,2,0,1] | [3.402,0,1.175,4] | [-1.7976931348623158e30,1.2,2.2250738585072014e-308] | [-32768,0,32767,0] |
|    3 | NULL                         | NULL     | NULL              | NULL                                                     | NULL              | NULL                                                 | NULL               |
+------+------------------------------+----------+-------------------+----------------------------------------------------------+-------------------+------------------------------------------------------+--------------------+
select * from tt1 where array_overlaps([1,2],[0])   is false;
+------+------------------------------+----------+-------------------+----------------------------------------------------------+-------------------+------------------------------------------------------+--------------------+
| id   | c1                           | c2       | c3                | c4                                                       | c5                | c6                                                   | c7                 |
+------+------------------------------+----------+-------------------+----------------------------------------------------------+-------------------+------------------------------------------------------+--------------------+
|    1 | [-2147483648,0,2147483647]   | ["test"] | [127,0,-128]      | [-9223372036854775808,9223372036854775807,775,808,2,0]   | [3.402,0,1.175]   | [1.7976931348623157e308,2.2250738585072014e-308]     | [-32768,0,32767]   |
|    2 | [-2147483648,0,2147483647,4] | ["test"] | [127,0,-128,6,77] | [-9223372036854775808,9223372036854775807,775,808,2,0,1] | [3.402,0,1.175,4] | [-1.7976931348623158e30,1.2,2.2250738585072014e-308] | [-32768,0,32767,0] |
|    3 | NULL                         | NULL     | NULL              | NULL                                                     | NULL              | NULL                                                 | NULL               |
+------+------------------------------+----------+-------------------+----------------------------------------------------------+-------------------+------------------------------------------------------+--------------------+
select * from tt1 where array_overlaps([1,2],[0])   is not false;
+------+------+------+------+------+------+------+------+
| id   | c1   | c2   | c3   | c4   | c5   | c6   | c7   |
+------+------+------+------+------+------+------+------+
+------+------+------+------+------+------+------+------+
select * from tt1 where array_overlaps(c1 ,c5)  is not null;
+------+------------------------------+----------+-------------------+----------------------------------------------------------+-------------------+------------------------------------------------------+--------------------+
| id   | c1                           | c2       | c3                | c4                                                       | c5                | c6                                                   | c7                 |
+------+------------------------------+----------+-------------------+----------------------------------------------------------+-------------------+------------------------------------------------------+--------------------+
|    1 | [-2147483648,0,2147483647]   | ["test"] | [127,0,-128]      | [-9223372036854775808,9223372036854775807,775,808,2,0]   | [3.402,0,1.175]   | [1.7976931348623157e308,2.2250738585072014e-308]     | [-32768,0,32767]   |
|    2 | [-2147483648,0,2147483647,4] | ["test"] | [127,0,-128,6,77] | [-9223372036854775808,9223372036854775807,775,808,2,0,1] | [3.402,0,1.175,4] | [-1.7976931348623158e30,1.2,2.2250738585072014e-308] | [-32768,0,32767,0] |
+------+------------------------------+----------+-------------------+----------------------------------------------------------+-------------------+------------------------------------------------------+--------------------+
select * from tt1 where array_overlaps(c1 ,c5)  is  null;
+------+------+------+------+------+------+------+------+
| id   | c1   | c2   | c3   | c4   | c5   | c6   | c7   |
+------+------+------+------+------+------+------+------+
|    3 | NULL | NULL | NULL | NULL | NULL | NULL | NULL |
+------+------+------+------+------+------+------+------+
drop table tt3;
create table tt3(id int,id1 INTEGER unsigned,id2 BOOL,id3 SMALLINT unsigned,id4 MEDIUMINT,id5 SERIAL,id6 BIGINT);
insert into tt3 values(1,2,3,4,5,6,7);
select array_overlaps(id,id) from tt3;
ERROR 22000: invalid obj type for type promotion: left_type=INT right_type=INT
select array_overlaps(id1,id1) from  tt3;
ERROR 22000: invalid obj type for type promotion: left_type=INT UNSIGNED right_type=INT UNSIGNED
select array_overlaps(id2,id2) from tt3;
ERROR 22000: invalid obj type for type promotion: left_type=TINYINT right_type=TINYINT
select array_overlaps(id3,id3) from tt3;
ERROR 22000: invalid obj type for type promotion: left_type=SMALLINT UNSIGNED right_type=SMALLINT UNSIGNED
select array_overlaps(id4,id4) from tt3;
ERROR 22000: invalid obj type for type promotion: left_type=MEDIUMINT right_type=MEDIUMINT
select array_overlaps(id5,id5) from tt3;
ERROR 22000: invalid obj type for type promotion: left_type=BIGINT UNSIGNED right_type=BIGINT UNSIGNED
select array_overlaps([1],id6) from tt3;
ERROR 22000: invalid obj type for type promotion: left_type=ARRAY right_type=BIGINT
drop table tt3;
create table tt3(id DECIMAL,id1 DECIMAL ZEROFILL,id2 NUMERIC,id3 FIXED unsigned,id4 FIXED,id5 NUMERIC unsigned);
insert into tt3 values(1,2,3,4,5,6);
select array_overlaps(id,id) from tt3;
ERROR 22000: invalid obj type for type promotion: left_type=DECIMAL right_type=DECIMAL
select array_overlaps(id1,id1) from tt3;
ERROR 22000: invalid obj type for type promotion: left_type=DECIMAL UNSIGNED right_type=DECIMAL UNSIGNED
select array_overlaps(id2,id2) from tt3;
ERROR 22000: invalid obj type for type promotion: left_type=DECIMAL right_type=DECIMAL
select array_overlaps([1,2,3],id3) from tt3;
ERROR 22000: invalid obj type for type promotion: left_type=ARRAY right_type=DECIMAL UNSIGNED
select array_overlaps([1,2,3,4],id4) from tt3;
ERROR 22000: invalid obj type for type promotion: left_type=ARRAY right_type=DECIMAL
select array_overlaps([1,2,3,4],id5) from tt3;
ERROR 22000: invalid obj type for type promotion: left_type=ARRAY right_type=DECIMAL UNSIGNED
drop table tt3;
create table tt3(id float,id1 float unsigned,id2 double,id3 double unsigned);
insert into tt3 values(1,2,3,4);
select array_overlaps(id,id) from tt3;
ERROR 22000: invalid obj type for type promotion: left_type=FLOAT right_type=FLOAT
select array_overlaps(id1,id1) from tt3;
ERROR 22000: invalid obj type for type promotion: left_type=FLOAT UNSIGNED right_type=FLOAT UNSIGNED
select array_overlaps(id2,id2) from tt3;
ERROR 22000: invalid obj type for type promotion: left_type=DOUBLE right_type=DOUBLE
select array_overlaps([1,2,3],id3) from tt3;
ERROR 22000: invalid obj type for type promotion: left_type=ARRAY right_type=DOUBLE UNSIGNED
drop table tt3;
create table tt3(id char(50),id1 varchar(50),id2 binary(50),id3 varbinary(50));
insert into tt3 values(1,2,3,4);
select array_overlaps(id,id) from tt3;
ERROR 22000: invalid obj type for type promotion: left_type=CHAR right_type=CHAR
select array_overlaps(id1,id1) from tt3;
ERROR 22000: invalid obj type for type promotion: left_type=VARCHAR right_type=VARCHAR
select array_overlaps(id2,id2) from tt3;
ERROR 22000: invalid obj type for type promotion: left_type=CHAR right_type=CHAR
select array_overlaps([1,2,3],id3) from tt3;
ERROR 22000: invalid obj type for type promotion: left_type=ARRAY right_type=VARCHAR
drop table tt3;
create table tt3(id date,id1 datetime,id2 timestamp,id3 time,id4 year);
insert into tt3 values('2010-1-1','2010-10-1 14:58:00','2010-10-1 14:58:00.9999','14:14:50','2010');
select array_overlaps(id,id) from tt3;
ERROR 22000: invalid obj type for type promotion: left_type=MYSQL_DATE right_type=MYSQL_DATE
select array_overlaps(id1,id1) from tt3;
ERROR 22000: invalid obj type for type promotion: left_type=MYSQL_DATETIME right_type=MYSQL_DATETIME
select array_overlaps(id2,id2) from tt3;
ERROR 22000: invalid obj type for type promotion: left_type=TIMESTAMP right_type=TIMESTAMP
select array_overlaps([1,2,3],id3) from tt3;
ERROR 22000: invalid obj type for type promotion: left_type=ARRAY right_type=TIME
select array_overlaps([1,2,3],id4) from tt3;
ERROR 22000: invalid obj type for type promotion: left_type=ARRAY right_type=YEAR
drop table tt3;
create table tt3(id TINYBLOB,id1 blob,id2 MEDIUMBLOB,id3 LONGBLOB);
insert into tt3 values(1,2,3,4);
select array_overlaps(id,id) from tt3;
ERROR 22000: invalid obj type for type promotion: left_type=TINYTEXT right_type=TINYTEXT
select array_overlaps(id1,id1) from tt3;
ERROR 22000: invalid obj type for type promotion: left_type=TEXT right_type=TEXT
select array_overlaps(id2,id2) from tt3;
ERROR 22000: invalid obj type for type promotion: left_type=MEDIUMTEXT right_type=MEDIUMTEXT
select array_overlaps([1,2,3],id3) from tt3;
ERROR 22000: invalid obj type for type promotion: left_type=ARRAY right_type=LONGTEXT
drop table tt3;
create table tt3(id TINYTEXT,id1 TEXT,id2 MEDIUMTEXT,id3 LONGTEXT);
insert into tt3 values('[1]','[2]','[3]','[4]');
select array_overlaps(id,id) from tt3;
ERROR 22000: invalid obj type for type promotion: left_type=TINYTEXT right_type=TINYTEXT
select array_overlaps(id1,id1) from tt3;
ERROR 22000: invalid obj type for type promotion: left_type=TEXT right_type=TEXT
select array_overlaps(id2,id2) from tt3;
ERROR 22000: invalid obj type for type promotion: left_type=MEDIUMTEXT right_type=MEDIUMTEXT
select array_overlaps([1,2,3],id3) from tt3;
ERROR 22000: invalid obj type for type promotion: left_type=ARRAY right_type=LONGTEXT
drop table tt3;
create table tt3(id SET('1','2'),id1 ENUM('1','2','3','4'),id2 JSON,id3 RoaringBitmap,id4 vector(2));
insert into tt3 values(1,2,'[1,2]',rb_from_string('1,2'),[2,3]);
select array_overlaps(id,id) from tt3;
ERROR 22000: invalid obj type for type promotion: left_type=SET right_type=SET
select array_overlaps(id1,id1) from tt3;
ERROR 22000: invalid obj type for type promotion: left_type=ENUM right_type=ENUM
select array_overlaps(id2,id2) from tt3;
ERROR 22000: invalid obj type for type promotion: left_type=JSON right_type=JSON
select array_overlaps([1,2,3],id3) from tt3;
ERROR 22000: invalid obj type for type promotion: left_type=ARRAY right_type=ROARINGBITMAP
select array_overlaps([1,2,3],id4) from tt3;
ERROR 22000: inconsistent dimension: expected 2 got 3
drop table tt3;
create table tt3(id int,a int[]);
insert into tt3 values(1,[1,2,3]);
insert into tt3 values(2,[5,6,7]);
insert into tt3 values(3,[5,6,7]);
drop table tt4;
create table tt4(id int,a int[]);
insert into tt4 values(1,[1,2,3]);
insert into tt4 values(2,[5,6,7]);
insert into tt4 values(3,[9]);
select t3.* from tt3 t3 inner join tt4 t4 on t3.id=array_overlaps(t4.a,t4.a);
+------+---------+
| id   | a       |
+------+---------+
|    1 | [1,2,3] |
|    1 | [1,2,3] |
|    1 | [1,2,3] |
+------+---------+
select t3.* from tt3 t3 inner join tt4 t4 on array_overlaps(t4.a,t4.a)=t4.id;
+------+---------+
| id   | a       |
+------+---------+
|    1 | [1,2,3] |
|    2 | [5,6,7] |
|    3 | [5,6,7] |
+------+---------+
select t3.* from tt3 t3 left join tt4 t4 on array_overlaps(t4.a,t4.a)=array_overlaps(t4.a,t4.a);
+------+---------+
| id   | a       |
+------+---------+
|    1 | [1,2,3] |
|    1 | [1,2,3] |
|    1 | [1,2,3] |
|    2 | [5,6,7] |
|    2 | [5,6,7] |
|    2 | [5,6,7] |
|    3 | [5,6,7] |
|    3 | [5,6,7] |
|    3 | [5,6,7] |
+------+---------+
select * from tt3 t3 right join tt4 t4 on t4.id!=array_overlaps(t4.a,t4.a);
+------+---------+------+---------+
| id   | a       | id   | a       |
+------+---------+------+---------+
| NULL | NULL    |    1 | [1,2,3] |
|    1 | [1,2,3] |    2 | [5,6,7] |
|    2 | [5,6,7] |    2 | [5,6,7] |
|    3 | [5,6,7] |    2 | [5,6,7] |
|    1 | [1,2,3] |    3 | [9]     |
|    2 | [5,6,7] |    3 | [9]     |
|    3 | [5,6,7] |    3 | [9]     |
+------+---------+------+---------+
select * from tt3 t3 full join tt4 t4 on t3.id>array_overlaps(t4.a,t4.a);
+------+---------+------+---------+
| id   | a       | id   | a       |
+------+---------+------+---------+
|    1 | [1,2,3] | NULL | NULL    |
|    2 | [5,6,7] |    1 | [1,2,3] |
|    2 | [5,6,7] |    2 | [5,6,7] |
|    2 | [5,6,7] |    3 | [9]     |
|    3 | [5,6,7] |    1 | [1,2,3] |
|    3 | [5,6,7] |    2 | [5,6,7] |
|    3 | [5,6,7] |    3 | [9]     |
+------+---------+------+---------+
select * from ( select array_overlaps(c1,c1) from tt1);
+-----------------------+
| array_overlaps(c1,c1) |
+-----------------------+
|                     1 |
|                     1 |
|                  NULL |
+-----------------------+
select * from ( select array_overlaps([1,2,3,4],[3]));
+-------------------------------+
| array_overlaps([1,2,3,4],[3]) |
+-------------------------------+
|                             1 |
+-------------------------------+
select * from tt1 where id >any(select array_overlaps([1,2,3,4],[3]));
+------+------------------------------+----------+-------------------+----------------------------------------------------------+-------------------+------------------------------------------------------+--------------------+
| id   | c1                           | c2       | c3                | c4                                                       | c5                | c6                                                   | c7                 |
+------+------------------------------+----------+-------------------+----------------------------------------------------------+-------------------+------------------------------------------------------+--------------------+
|    2 | [-2147483648,0,2147483647,4] | ["test"] | [127,0,-128,6,77] | [-9223372036854775808,9223372036854775807,775,808,2,0,1] | [3.402,0,1.175,4] | [-1.7976931348623158e30,1.2,2.2250738585072014e-308] | [-32768,0,32767,0] |
|    3 | NULL                         | NULL     | NULL              | NULL                                                     | NULL              | NULL                                                 | NULL               |
+------+------------------------------+----------+-------------------+----------------------------------------------------------+-------------------+------------------------------------------------------+--------------------+
select * from tt1 where c1 =any(select array_agg(1));
ERROR 22000: Invalid data type for the operation
select * from tt1 where c1 =some(select array_agg(1));
ERROR 22000: Invalid data type for the operation
select * from tt1 where c1 =all(select array_agg(1));
ERROR 22000: Invalid data type for the operation
select +array_overlaps(c1,c1)from tt1;
+------------------------+
| +array_overlaps(c1,c1) |
+------------------------+
|                      1 |
|                      1 |
|                   NULL |
+------------------------+
select +array_overlaps(c1,c1)from vtt2;
+------------------------+
| +array_overlaps(c1,c1) |
+------------------------+
|                      1 |
|                      1 |
|                   NULL |
+------------------------+
select -array_overlaps(c1,c1)from tt1;
+------------------------+
| -array_overlaps(c1,c1) |
+------------------------+
|                     -1 |
|                     -1 |
|                   NULL |
+------------------------+
select array_overlaps(c1,c1)+array_overlaps(c1,c1)from tt1;
+---------------------------------------------+
| array_overlaps(c1,c1)+array_overlaps(c1,c1) |
+---------------------------------------------+
|                                           2 |
|                                           2 |
|                                        NULL |
+---------------------------------------------+
select array_overlaps(c1,c1)+1 from tt1;
+-------------------------+
| array_overlaps(c1,c1)+1 |
+-------------------------+
|                       2 |
|                       2 |
|                    NULL |
+-------------------------+
select array_overlaps(c1,c1)+'test' from tt1;
+------------------------------+
| array_overlaps(c1,c1)+'test' |
+------------------------------+
|                            1 |
|                            1 |
|                         NULL |
+------------------------------+
Warnings:
Warning	1292	Truncated incorrect DOUBLE value: 'test'
select array_overlaps(c1,c1)+null from tt1;
+----------------------------+
| array_overlaps(c1,c1)+null |
+----------------------------+
|                       NULL |
|                       NULL |
|                       NULL |
+----------------------------+
select array_overlaps(c1,c1)+false from tt1;
+-----------------------------+
| array_overlaps(c1,c1)+false |
+-----------------------------+
|                           1 |
|                           1 |
|                        NULL |
+-----------------------------+
select array_overlaps(c1,c1)+true from tt1;
+----------------------------+
| array_overlaps(c1,c1)+true |
+----------------------------+
|                          2 |
|                          2 |
|                       NULL |
+----------------------------+
select array_overlaps(c1,c1)-array_overlaps(c1,c1)from tt1;
+---------------------------------------------+
| array_overlaps(c1,c1)-array_overlaps(c1,c1) |
+---------------------------------------------+
|                                           0 |
|                                           0 |
|                                        NULL |
+---------------------------------------------+
select array_overlaps(c1,c1)-1 from tt1;
+-------------------------+
| array_overlaps(c1,c1)-1 |
+-------------------------+
|                       0 |
|                       0 |
|                    NULL |
+-------------------------+
select array_overlaps(c1,c1)-'test' from tt1;
+------------------------------+
| array_overlaps(c1,c1)-'test' |
+------------------------------+
|                            1 |
|                            1 |
|                         NULL |
+------------------------------+
Warnings:
Warning	1292	Truncated incorrect DOUBLE value: 'test'
select array_overlaps(c1,c1)-null from tt1;
+----------------------------+
| array_overlaps(c1,c1)-null |
+----------------------------+
|                       NULL |
|                       NULL |
|                       NULL |
+----------------------------+
select array_overlaps(c1,c1)-false from tt1;
+-----------------------------+
| array_overlaps(c1,c1)-false |
+-----------------------------+
|                           1 |
|                           1 |
|                        NULL |
+-----------------------------+
select array_overlaps(c1,c1)-true from tt1;
+----------------------------+
| array_overlaps(c1,c1)-true |
+----------------------------+
|                          0 |
|                          0 |
|                       NULL |
+----------------------------+
select array_overlaps(c1,c1)*array_overlaps(c1,c1)from tt1;
+---------------------------------------------+
| array_overlaps(c1,c1)*array_overlaps(c1,c1) |
+---------------------------------------------+
|                                           1 |
|                                           1 |
|                                        NULL |
+---------------------------------------------+
select array_overlaps(c1,c1)*1 from tt1;
+-------------------------+
| array_overlaps(c1,c1)*1 |
+-------------------------+
|                       1 |
|                       1 |
|                    NULL |
+-------------------------+
select array_overlaps(c1,c1)*'test' from tt1;
+------------------------------+
| array_overlaps(c1,c1)*'test' |
+------------------------------+
|                            0 |
|                            0 |
|                         NULL |
+------------------------------+
Warnings:
Warning	1292	Truncated incorrect DOUBLE value: 'test'
select array_overlaps(c1,c1)*null from tt1;
+----------------------------+
| array_overlaps(c1,c1)*null |
+----------------------------+
|                       NULL |
|                       NULL |
|                       NULL |
+----------------------------+
select array_overlaps(c1,c1)*false from tt1;
+-----------------------------+
| array_overlaps(c1,c1)*false |
+-----------------------------+
|                           0 |
|                           0 |
|                        NULL |
+-----------------------------+
select array_overlaps(c1,c1)*true from tt1;
+----------------------------+
| array_overlaps(c1,c1)*true |
+----------------------------+
|                          1 |
|                          1 |
|                       NULL |
+----------------------------+
select array_overlaps(c1,c1)*array_overlaps(c1,c1) from tt1;
+---------------------------------------------+
| array_overlaps(c1,c1)*array_overlaps(c1,c1) |
+---------------------------------------------+
|                                           1 |
|                                           1 |
|                                        NULL |
+---------------------------------------------+
select array_overlaps(c1,c1)*1 from tt1;
+-------------------------+
| array_overlaps(c1,c1)*1 |
+-------------------------+
|                       1 |
|                       1 |
|                    NULL |
+-------------------------+
select array_overlaps(c1,c1)*'test' from tt1;
+------------------------------+
| array_overlaps(c1,c1)*'test' |
+------------------------------+
|                            0 |
|                            0 |
|                         NULL |
+------------------------------+
Warnings:
Warning	1292	Truncated incorrect DOUBLE value: 'test'
select array_overlaps(c1,c1)*false from tt1;
+-----------------------------+
| array_overlaps(c1,c1)*false |
+-----------------------------+
|                           0 |
|                           0 |
|                        NULL |
+-----------------------------+
select array_overlaps(c1,c1)*true from tt1;
+----------------------------+
| array_overlaps(c1,c1)*true |
+----------------------------+
|                          1 |
|                          1 |
|                       NULL |
+----------------------------+
select array_overlaps(c1,c1)/array_overlaps(c1,c1) from tt1;
+---------------------------------------------+
| array_overlaps(c1,c1)/array_overlaps(c1,c1) |
+---------------------------------------------+
|                                      1.0000 |
|                                      1.0000 |
|                                        NULL |
+---------------------------------------------+
select array_overlaps(c1,c1)/1 from tt1;
+-------------------------+
| array_overlaps(c1,c1)/1 |
+-------------------------+
|                  1.0000 |
|                  1.0000 |
|                    NULL |
+-------------------------+
select array_overlaps(c1,c1)/'test' from tt1;
+------------------------------+
| array_overlaps(c1,c1)/'test' |
+------------------------------+
|                         NULL |
|                         NULL |
|                         NULL |
+------------------------------+
Warnings:
Warning	1292	Truncated incorrect DOUBLE value: 'test'
select array_overlaps(c1,c1)/null from tt1;
+----------------------------+
| array_overlaps(c1,c1)/null |
+----------------------------+
|                       NULL |
|                       NULL |
|                       NULL |
+----------------------------+
select array_overlaps(c1,c1)/false from tt1;
+-----------------------------+
| array_overlaps(c1,c1)/false |
+-----------------------------+
|                        NULL |
|                        NULL |
|                        NULL |
+-----------------------------+
select array_overlaps(c1,c1)/true from tt1;
+----------------------------+
| array_overlaps(c1,c1)/true |
+----------------------------+
|                     1.0000 |
|                     1.0000 |
|                       NULL |
+----------------------------+
select array_overlaps(c1,c1) div array_overlaps(c1,c1) from tt1;
+-------------------------------------------------+
| array_overlaps(c1,c1) div array_overlaps(c1,c1) |
+-------------------------------------------------+
|                                               1 |
|                                               1 |
|                                            NULL |
+-------------------------------------------------+
select array_overlaps(c1,c1) div 1 from tt1;
+-----------------------------+
| array_overlaps(c1,c1) div 1 |
+-----------------------------+
|                           1 |
|                           1 |
|                        NULL |
+-----------------------------+
select array_overlaps(c1,c1) div 'test' from tt1;
+----------------------------------+
| array_overlaps(c1,c1) div 'test' |
+----------------------------------+
|                             NULL |
|                             NULL |
|                             NULL |
+----------------------------------+
Warnings:
Warning	1292	Truncated incorrect DECIMAL value: 'test'
select array_overlaps(c1,c1) div null from tt1;
+--------------------------------+
| array_overlaps(c1,c1) div null |
+--------------------------------+
|                           NULL |
|                           NULL |
|                           NULL |
+--------------------------------+
select array_overlaps(c1,c1) div false from tt1;
+---------------------------------+
| array_overlaps(c1,c1) div false |
+---------------------------------+
|                            NULL |
|                            NULL |
|                            NULL |
+---------------------------------+
select array_overlaps(c1,c1) div true from tt1;
+--------------------------------+
| array_overlaps(c1,c1) div true |
+--------------------------------+
|                              1 |
|                              1 |
|                           NULL |
+--------------------------------+
select array_overlaps(c1,c1) % array_overlaps(c1,c1) from tt1;
+-----------------------------------------------+
| array_overlaps(c1,c1) % array_overlaps(c1,c1) |
+-----------------------------------------------+
|                                             0 |
|                                             0 |
|                                          NULL |
+-----------------------------------------------+
select array_overlaps(c1,c1) % 1 from tt1;
+---------------------------+
| array_overlaps(c1,c1) % 1 |
+---------------------------+
|                         0 |
|                         0 |
|                      NULL |
+---------------------------+
select array_overlaps(c1,c1) % 'test' from tt1;
+--------------------------------+
| array_overlaps(c1,c1) % 'test' |
+--------------------------------+
|                           NULL |
|                           NULL |
|                           NULL |
+--------------------------------+
Warnings:
Warning	1292	Truncated incorrect DOUBLE value: 'test'
select array_overlaps(c1,c1) % null from tt1;
+------------------------------+
| array_overlaps(c1,c1) % null |
+------------------------------+
|                         NULL |
|                         NULL |
|                         NULL |
+------------------------------+
select array_overlaps(c1,c1) % false from tt1;
+-------------------------------+
| array_overlaps(c1,c1) % false |
+-------------------------------+
|                          NULL |
|                          NULL |
|                          NULL |
+-------------------------------+
select array_overlaps(c1,c1) % true from tt1;
+------------------------------+
| array_overlaps(c1,c1) % true |
+------------------------------+
|                            0 |
|                            0 |
|                         NULL |
+------------------------------+
select array_overlaps(c1,c1) mod array_overlaps(c1,c1) from tt1;
+-------------------------------------------------+
| array_overlaps(c1,c1) mod array_overlaps(c1,c1) |
+-------------------------------------------------+
|                                               0 |
|                                               0 |
|                                            NULL |
+-------------------------------------------------+
select array_overlaps(c1,c1) mod 1 from tt1;
+-----------------------------+
| array_overlaps(c1,c1) mod 1 |
+-----------------------------+
|                           0 |
|                           0 |
|                        NULL |
+-----------------------------+
select array_overlaps(c1,c1) mod 'test' from tt1;
+----------------------------------+
| array_overlaps(c1,c1) mod 'test' |
+----------------------------------+
|                             NULL |
|                             NULL |
|                             NULL |
+----------------------------------+
Warnings:
Warning	1292	Truncated incorrect DOUBLE value: 'test'
select array_overlaps(c1,c1) mod null from tt1;
+--------------------------------+
| array_overlaps(c1,c1) mod null |
+--------------------------------+
|                           NULL |
|                           NULL |
|                           NULL |
+--------------------------------+
select array_overlaps(c1,c1) mod false from tt1;
+---------------------------------+
| array_overlaps(c1,c1) mod false |
+---------------------------------+
|                            NULL |
|                            NULL |
|                            NULL |
+---------------------------------+
select array_overlaps(c1,c1) mod true from tt1;
+--------------------------------+
| array_overlaps(c1,c1) mod true |
+--------------------------------+
|                              0 |
|                              0 |
|                           NULL |
+--------------------------------+
select array_overlaps(c1,c1) & array_overlaps(c1,c1) from tt1;
+-----------------------------------------------+
| array_overlaps(c1,c1) & array_overlaps(c1,c1) |
+-----------------------------------------------+
|                                             1 |
|                                             1 |
|                                          NULL |
+-----------------------------------------------+
select array_overlaps(c1,c1) & 1 from tt1;
+---------------------------+
| array_overlaps(c1,c1) & 1 |
+---------------------------+
|                         1 |
|                         1 |
|                      NULL |
+---------------------------+
select array_overlaps(c1,c1) & 'test' from tt1;
+--------------------------------+
| array_overlaps(c1,c1) & 'test' |
+--------------------------------+
|                              0 |
|                              0 |
|                           NULL |
+--------------------------------+
Warnings:
Warning	1292	Truncated incorrect INTEGER value: 'test'
select array_overlaps(c1,c1) & null from tt1;
+------------------------------+
| array_overlaps(c1,c1) & null |
+------------------------------+
|                         NULL |
|                         NULL |
|                         NULL |
+------------------------------+
select array_overlaps(c1,c1) & false from tt1;
+-------------------------------+
| array_overlaps(c1,c1) & false |
+-------------------------------+
|                             0 |
|                             0 |
|                          NULL |
+-------------------------------+
select array_overlaps(c1,c1) & true from tt1;
+------------------------------+
| array_overlaps(c1,c1) & true |
+------------------------------+
|                            1 |
|                            1 |
|                         NULL |
+------------------------------+
select array_overlaps(c1,c1) | array_overlaps(c1,c1) from tt1;
+-----------------------------------------------+
| array_overlaps(c1,c1) | array_overlaps(c1,c1) |
+-----------------------------------------------+
|                                             1 |
|                                             1 |
|                                          NULL |
+-----------------------------------------------+
select array_overlaps(c1,c1) | 1 from tt1;
+---------------------------+
| array_overlaps(c1,c1) | 1 |
+---------------------------+
|                         1 |
|                         1 |
|                      NULL |
+---------------------------+
select array_overlaps(c1,c1) | 'test' from tt1;
+--------------------------------+
| array_overlaps(c1,c1) | 'test' |
+--------------------------------+
|                              1 |
|                              1 |
|                           NULL |
+--------------------------------+
Warnings:
Warning	1292	Truncated incorrect INTEGER value: 'test'
select array_overlaps(c1,c1) | null from tt1;
+------------------------------+
| array_overlaps(c1,c1) | null |
+------------------------------+
|                         NULL |
|                         NULL |
|                         NULL |
+------------------------------+
select array_overlaps(c1,c1) | false from tt1;
+-------------------------------+
| array_overlaps(c1,c1) | false |
+-------------------------------+
|                             1 |
|                             1 |
|                          NULL |
+-------------------------------+
select array_overlaps(c1,c1) | true from tt1;
+------------------------------+
| array_overlaps(c1,c1) | true |
+------------------------------+
|                            1 |
|                            1 |
|                         NULL |
+------------------------------+
select ~array_overlaps(c1,c1)from tt1;
+------------------------+
| ~array_overlaps(c1,c1) |
+------------------------+
|   18446744073709551614 |
|   18446744073709551614 |
|                   NULL |
+------------------------+
select array_overlaps(c1,c1) ^ array_overlaps(c1,c1) from tt1;
+-----------------------------------------------+
| array_overlaps(c1,c1) ^ array_overlaps(c1,c1) |
+-----------------------------------------------+
|                                             0 |
|                                             0 |
|                                          NULL |
+-----------------------------------------------+
select array_overlaps(c1,c1) ^ 1 from tt1;
+---------------------------+
| array_overlaps(c1,c1) ^ 1 |
+---------------------------+
|                         0 |
|                         0 |
|                      NULL |
+---------------------------+
select array_overlaps(c1,c1) ^ 'test' from tt1;
+--------------------------------+
| array_overlaps(c1,c1) ^ 'test' |
+--------------------------------+
|                              1 |
|                              1 |
|                           NULL |
+--------------------------------+
Warnings:
Warning	1292	Truncated incorrect INTEGER value: 'test'
select array_overlaps(c1,c1) ^ null from tt1;
+------------------------------+
| array_overlaps(c1,c1) ^ null |
+------------------------------+
|                         NULL |
|                         NULL |
|                         NULL |
+------------------------------+
select array_overlaps(c1,c1) ^ false from tt1;
+-------------------------------+
| array_overlaps(c1,c1) ^ false |
+-------------------------------+
|                             1 |
|                             1 |
|                          NULL |
+-------------------------------+
select array_overlaps(c1,c1) ^ true from tt1;
+------------------------------+
| array_overlaps(c1,c1) ^ true |
+------------------------------+
|                            0 |
|                            0 |
|                         NULL |
+------------------------------+
select array_overlaps(c1,c1) << array_overlaps(c1,c1) from tt1;
+------------------------------------------------+
| array_overlaps(c1,c1) << array_overlaps(c1,c1) |
+------------------------------------------------+
|                                              2 |
|                                              2 |
|                                           NULL |
+------------------------------------------------+
select array_overlaps(c1,c1) << 1 from tt1;
+----------------------------+
| array_overlaps(c1,c1) << 1 |
+----------------------------+
|                          2 |
|                          2 |
|                       NULL |
+----------------------------+
select array_overlaps(c1,c1) << 'test' from tt1;
+---------------------------------+
| array_overlaps(c1,c1) << 'test' |
+---------------------------------+
|                               1 |
|                               1 |
|                            NULL |
+---------------------------------+
Warnings:
Warning	1292	Truncated incorrect INTEGER value: 'test'
select array_overlaps(c1,c1) << null from tt1;
+-------------------------------+
| array_overlaps(c1,c1) << null |
+-------------------------------+
|                          NULL |
|                          NULL |
|                          NULL |
+-------------------------------+
select array_overlaps(c1,c1) << false from tt1;
+--------------------------------+
| array_overlaps(c1,c1) << false |
+--------------------------------+
|                              1 |
|                              1 |
|                           NULL |
+--------------------------------+
select array_overlaps(c1,c1) << true from tt1;
+-------------------------------+
| array_overlaps(c1,c1) << true |
+-------------------------------+
|                             2 |
|                             2 |
|                          NULL |
+-------------------------------+
select array_overlaps(c1,c1) >> array_overlaps(c1,c1) from tt1;
+------------------------------------------------+
| array_overlaps(c1,c1) >> array_overlaps(c1,c1) |
+------------------------------------------------+
|                                              0 |
|                                              0 |
|                                           NULL |
+------------------------------------------------+
select array_overlaps(c1,c1) >> 1 from tt1;
+----------------------------+
| array_overlaps(c1,c1) >> 1 |
+----------------------------+
|                          0 |
|                          0 |
|                       NULL |
+----------------------------+
select array_overlaps(c1,c1) >> 'test' from tt1;
+---------------------------------+
| array_overlaps(c1,c1) >> 'test' |
+---------------------------------+
|                               1 |
|                               1 |
|                            NULL |
+---------------------------------+
Warnings:
Warning	1292	Truncated incorrect INTEGER value: 'test'
select array_overlaps(c1,c1) >> null from tt1;
+-------------------------------+
| array_overlaps(c1,c1) >> null |
+-------------------------------+
|                          NULL |
|                          NULL |
|                          NULL |
+-------------------------------+
select array_overlaps(c1,c1) >> false from tt1;
+--------------------------------+
| array_overlaps(c1,c1) >> false |
+--------------------------------+
|                              1 |
|                              1 |
|                           NULL |
+--------------------------------+
select array_overlaps(c1,c1) >> true from tt1;
+-------------------------------+
| array_overlaps(c1,c1) >> true |
+-------------------------------+
|                             0 |
|                             0 |
|                          NULL |
+-------------------------------+
select array_overlaps(c1,c1) is true from tt1;
+-------------------------------+
| array_overlaps(c1,c1) is true |
+-------------------------------+
|                             1 |
|                             1 |
|                             0 |
+-------------------------------+
select array_overlaps(c1,c1) in (array_overlaps(c1,c1),cardinality([1,2,3,4,5,56,7,8,9,10])) from tt1;
+---------------------------------------------------------------------------------------+
| array_overlaps(c1,c1) in (array_overlaps(c1,c1),cardinality([1,2,3,4,5,56,7,8,9,10])) |
+---------------------------------------------------------------------------------------+
|                                                                                     1 |
|                                                                                     1 |
|                                                                                  NULL |
+---------------------------------------------------------------------------------------+
select array_overlaps(c1,c1) not in (cardinality([1,2,3,4,5,56,7,8,9,10])) from tt1;
+---------------------------------------------------------------------+
| array_overlaps(c1,c1) not in (cardinality([1,2,3,4,5,56,7,8,9,10])) |
+---------------------------------------------------------------------+
|                                                                   1 |
|                                                                   1 |
|                                                                NULL |
+---------------------------------------------------------------------+
select array_overlaps(c1,c1) like (cardinality([1,2,3,4,5,56,7,8,9,10])) from tt1;
+-------------------------------------------------------------------+
| array_overlaps(c1,c1) like (cardinality([1,2,3,4,5,56,7,8,9,10])) |
+-------------------------------------------------------------------+
|                                                                 0 |
|                                                                 0 |
|                                                              NULL |
+-------------------------------------------------------------------+
select array_overlaps(c1,c1) like 1 from tt1;
+------------------------------+
| array_overlaps(c1,c1) like 1 |
+------------------------------+
|                            1 |
|                            1 |
|                         NULL |
+------------------------------+
select  array_overlaps(c1,c1) BETWEEN array_overlaps(c1,c1) and array_overlaps(c1,c1) from tt1;
+-------------------------------------------------------------------------------+
| array_overlaps(c1,c1) BETWEEN array_overlaps(c1,c1) and array_overlaps(c1,c1) |
+-------------------------------------------------------------------------------+
|                                                                             1 |
|                                                                             1 |
|                                                                          NULL |
+-------------------------------------------------------------------------------+
select  array_overlaps(c1,c1) is null from tt1;
+-------------------------------+
| array_overlaps(c1,c1) is null |
+-------------------------------+
|                             0 |
|                             0 |
|                             1 |
+-------------------------------+
select  array_overlaps(c1,c1) is not null from tt1;
+-----------------------------------+
| array_overlaps(c1,c1) is not null |
+-----------------------------------+
|                                 1 |
|                                 1 |
|                                 0 |
+-----------------------------------+
select  array_overlaps(c1,c1) is false from tt1;
+--------------------------------+
| array_overlaps(c1,c1) is false |
+--------------------------------+
|                              0 |
|                              0 |
|                              0 |
+--------------------------------+
select not array_overlaps(c1,c1) from tt1;
+---------------------------+
| not array_overlaps(c1,c1) |
+---------------------------+
|                         0 |
|                         0 |
|                      NULL |
+---------------------------+
select  array_overlaps(c1,c1) and array_overlaps(c1,c1)  from tt1;
+-------------------------------------------------+
| array_overlaps(c1,c1) and array_overlaps(c1,c1) |
+-------------------------------------------------+
|                                               1 |
|                                               1 |
|                                            NULL |
+-------------------------------------------------+
select  array_overlaps(c1,c1) && array_overlaps(c1,c1)  from tt1;
+------------------------------------------------+
| array_overlaps(c1,c1) && array_overlaps(c1,c1) |
+------------------------------------------------+
|                                              1 |
|                                              1 |
|                                           NULL |
+------------------------------------------------+
select  array_overlaps(c1,c1) or array_overlaps(c1,c1)  from tt1;
+------------------------------------------------+
| array_overlaps(c1,c1) or array_overlaps(c1,c1) |
+------------------------------------------------+
|                                              1 |
|                                              1 |
|                                           NULL |
+------------------------------------------------+
select  array_overlaps(c1,c1) || array_overlaps(c1,c1)  from tt1;
+------------------------------------------------+
| array_overlaps(c1,c1) || array_overlaps(c1,c1) |
+------------------------------------------------+
|                                              1 |
|                                              1 |
|                                           NULL |
+------------------------------------------------+
select  array_overlaps(c1,c1) || 1 from tt1;
+----------------------------+
| array_overlaps(c1,c1) || 1 |
+----------------------------+
|                          1 |
|                          1 |
|                          1 |
+----------------------------+
select  array_overlaps(c1,c1) XOR array_overlaps(c1,c1)  from tt1;
+-------------------------------------------------+
| array_overlaps(c1,c1) XOR array_overlaps(c1,c1) |
+-------------------------------------------------+
|                                               0 |
|                                               0 |
|                                            NULL |
+-------------------------------------------------+
select  array_overlaps(c1,c1) XOR 1 from tt1;
+-----------------------------+
| array_overlaps(c1,c1) XOR 1 |
+-----------------------------+
|                           0 |
|                           0 |
|                        NULL |
+-----------------------------+
select  'test' XOR array_overlaps(c1,c1) from tt1;
+----------------------------------+
| 'test' XOR array_overlaps(c1,c1) |
+----------------------------------+
|                                1 |
|                                1 |
|                             NULL |
+----------------------------------+
Warnings:
Warning	1292	Truncated incorrect DOUBLE value: 'test'
SELECT BINARY array_overlaps(c1,c1) = array_overlaps(c1,c1) from tt1;
+------------------------------------------------------+
| BINARY array_overlaps(c1,c1) = array_overlaps(c1,c1) |
+------------------------------------------------------+
|                                                    1 |
|                                                    1 |
|                                                 NULL |
+------------------------------------------------------+
select CONVERT(array_overlaps(c1,c1) USING BINARY) from tt1;
+---------------------------------------------+
| CONVERT(array_overlaps(c1,c1) USING BINARY) |
+---------------------------------------------+
| 1                                           |
| 1                                           |
| NULL                                        |
+---------------------------------------------+
SELECT CASE array_overlaps(c1,c1) WHEN array_overlaps(c1,c1) THEN array_overlaps(c1,c1) WHEN array_overlaps(c1,c1) THEN array_overlaps(c1,c1) END from tt1;
+--------------------------------------------------------------------------------------------------------------------------------------------+
| CASE array_overlaps(c1,c1) WHEN array_overlaps(c1,c1) THEN array_overlaps(c1,c1) WHEN array_overlaps(c1,c1) THEN array_overlaps(c1,c1) END |
+--------------------------------------------------------------------------------------------------------------------------------------------+
|                                                                                                                                          1 |
|                                                                                                                                          1 |
|                                                                                                                                       NULL |
+--------------------------------------------------------------------------------------------------------------------------------------------+
SELECT CASE  WHEN array_overlaps(c1,c1) =array_overlaps(c1,c1) THEN array_overlaps(c1,c1) else  array_overlaps(c1,c1) END from vtt1;
+--------------------------------------------------------------------------------------------------------------------+
| CASE  WHEN array_overlaps(c1,c1) =array_overlaps(c1,c1) THEN array_overlaps(c1,c1) else  array_overlaps(c1,c1) END |
+--------------------------------------------------------------------------------------------------------------------+
|                                                                                                                  1 |
|                                                                                                                  1 |
|                                                                                                               NULL |
+--------------------------------------------------------------------------------------------------------------------+
SELECT CASE  WHEN cardinality([1]) =array_overlaps(c1,c1) THEN array_overlaps(c1,c1) else  array_overlaps(c1,c1)  END from vtt1;
+----------------------------------------------------------------------------------------------------------------+
| CASE  WHEN cardinality([1]) =array_overlaps(c1,c1) THEN array_overlaps(c1,c1) else  array_overlaps(c1,c1)  END |
+----------------------------------------------------------------------------------------------------------------+
|                                                                                                              1 |
|                                                                                                              1 |
|                                                                                                           NULL |
+----------------------------------------------------------------------------------------------------------------+
drop table tt3;
create table tt3(id int,b boolean,b1 bool,b2 tinyint);
drop view vtt3;
create view vtt3 as select * from tt3;
insert into tt3 values(array_overlaps([1,3],[3,4]),array_overlaps([1,3],[3,4]),array_overlaps([1,3],[2,4]),array_overlaps([1],[3,4]));
insert /*+ OPT_PARAM('rowsets_enabled', 'FALSE') */ /*+ OPT_PARAM('rowsets_enabled', 'FALSE') */ into tt3 values(array_overlaps([1,3],[3,4]),array_overlaps([1,3],[3,4]),array_overlaps([1,3],[2,4]),array_overlaps([1],[3,4]));
select * from tt3;
+------+------+------+------+
| id   | b    | b1   | b2   |
+------+------+------+------+
|    1 |    1 |    0 |    0 |
|    1 |    1 |    0 |    0 |
+------+------+------+------+
insert into tt3 values((select array_overlaps([1,3],[3,4])),
(select array_overlaps(c1,c3) from tt1 limit 1),(select array_overlaps(c1,[2,4]) from tt2 limit 1),(select array_overlaps([1],c7) from vtt1 limit 1));
replace into tt3 values((select array_overlaps([1,3],[3,4])),
(select array_overlaps(c1,c3) from tt1 limit 1),(select array_overlaps(c1,[2,4]) from tt2 limit 1),(select array_overlaps([1],c7) from vtt1 limit 1));
replace into tt3 values(array_overlaps([1,3],[3,4]),array_overlaps([1,3],[3,4]),array_overlaps([1,3],[2,4]),array_overlaps([1],[3,4]));
select * from tt3;
+------+------+------+------+
| id   | b    | b1   | b2   |
+------+------+------+------+
|    1 |    1 |    0 |    0 |
|    1 |    1 |    0 |    0 |
|    1 |    1 |    0 |    0 |
|    1 |    1 |    0 |    0 |
|    1 |    1 |    0 |    0 |
+------+------+------+------+
insert into tt3 values((select array_overlaps([1,3],[3,4])),
(select array_overlaps(c1,c3) from tt1 limit 1),(select array_overlaps(c1,[2,4]) from tt2 limit 1),(select array_overlaps([1],c7) from vtt1 limit 1)) ON DUPLICATE KEY UPDATE  id=array_overlaps([1],[1]);
insert into tt3 values(array_overlaps([1,3],[3,4]),array_overlaps([1,3],[3,4]),array_overlaps([1,3],[2,4]),array_overlaps([1],[3,4])) ON DUPLICATE KEY UPDATE  id=array_overlaps([1],[1]);
insert into tt3 values((select array_overlaps([1,3],[3,4])),
(select array_overlaps(c1,c3) from tt1 limit 1),(select array_overlaps(c1,[2,4]) from tt2 limit 1),(select array_overlaps([1],c7) from vtt1 limit 1)) ON DUPLICATE KEY UPDATE  id=array_overlaps([1],[1]);
update /*+ OPT_PARAM('rowsets_enabled', 'FALSE') */ /*+ OPT_PARAM('rowsets_enabled', 'FALSE') */ tt3 set id= array_overlaps([1,2,3,4,5,6,7,8,9,9,90],[-1,-2,-4,30,60]) ;
drop table tt3;
create table tt3(id int,b boolean,b1 bool,b2 tinyint);
drop view vtt3;
create view vtt3 as select * from tt3;
insert into tt3 values(array_overlaps([1,3],[3,4]),array_overlaps([1,3],[3,4]),array_overlaps([1,3],[2,4]),array_overlaps([1],[3,4])) ON DUPLICATE KEY UPDATE  id=array_overlaps([1],[1]);
insert /*+ enable_parallel_dml parallel(2) append*/ into tt3 values(array_overlaps([1,3],[3,4]),array_overlaps([1,3],[3,4]),array_overlaps([1,3],[2,4]),array_overlaps([1],[3,4])) ON DUPLICATE KEY UPDATE  id=array_overlaps([1],[2]),b=array_overlaps([1],[2]);
insert into tt3 values(array_overlaps([1,3],[3,4]),array_overlaps([1,3],[3,4]),array_overlaps([1,3],[2,4]),array_overlaps([1],[3,4])) ON DUPLICATE KEY UPDATE  id=array_overlaps([1],[2]),b=array_overlaps([1],[2]);
select * from tt3;
+------+------+------+------+
| id   | b    | b1   | b2   |
+------+------+------+------+
|    1 |    1 |    0 |    0 |
|    1 |    1 |    0 |    0 |
|    1 |    1 |    0 |    0 |
+------+------+------+------+
update tt3 set id= array_overlaps([1,2,3,4,5,6,7,8,9,9,90],[-1,-2,-4,3,6]) limit 1;
update vtt3 set id= array_overlaps([1,2,3,4,5,6,7,8,9,9,90],[-1,-2,-4]);
update /*+ enable_parallel_dml parallel(2) append*/ tt3 set id= (select array_overlaps([1,2,3,4,5,6,7,8,9,9,90],[-1,-2,-4,3,6]) limit 1);
update vtt3 set id= (select array_overlaps([1,2,3,4,5,6,7,8,9,9,90],[-1,-2,-4,10]));
select * from tt3;
+------+------+------+------+
| id   | b    | b1   | b2   |
+------+------+------+------+
|    0 |    1 |    0 |    0 |
|    0 |    1 |    0 |    0 |
|    0 |    1 |    0 |    0 |
+------+------+------+------+
delete  /*+ enable_parallel_dml parallel(2) append*/ from tt3;
drop table tt3;
create table tt3(id int);
drop view vtt3;
create view vtt3 as select * from tt3;
insert into tt3  select array_overlaps([1,2,3,4,5,6,7,8,9,9,90],[-1,-2,-4,9,10]);
replace into tt3  select array_overlaps([1,2,3,4,5,6,7,8,9,9,90],[-1,-2,-4,9,10]);
select * from tt3;
+------+
| id   |
+------+
|    1 |
|    1 |
+------+
insert /*+ direct(true,100,'inc') enable_parallel_dml parallel(2)*/ into tt3 select array_overlaps(c1,c1) from tt1;
insert /*+ direct(true,100) enable_parallel_dml parallel(2) append*/ into tt3 select array_overlaps(c1,c1) from tt1;
replace /*+ direct(true,100,'inc') enable_parallel_dml parallel(2)*/ into tt3 select array_overlaps(c1,c1) from tt1;
replace /*+ direct(true,100) enable_parallel_dml parallel(2) append*/ into tt3 select array_overlaps(c1,c1) from tt1;
insert into tt3 values(array_overlaps([1,2,3,4,5,6,7,8,9,9,90],[-1,-2,-4,9,10])),(array_overlaps([1,2,3,4,5,6,7,8,9,9,90],[-1,-2,-4,10]));
insert into tt3 values((select array_overlaps([1,2,3,4,5,6,7,8,9,9,90],[-1,-2,-4,9,10]))),((select array_overlaps(c4,c5) from tt1 limit 1));
replace into tt3 values(array_overlaps([1,2,3,4,5,6,7,8,9,9,90],[-1,-2,-4,9,10])),(array_overlaps([1,2,3,4,5,6,7,8,9,9,90],[-1,-2,-4,10]));
replace into tt3 values((select array_overlaps([1,2,3,4,5,6,7,8,9,9,90],[-1,-2,-4,9,10]))),((select array_overlaps(c4,c5) from tt1 limit 1));
insert overwrite tt3 select array_overlaps([1,2,3,4,5,6,7,8,9,9,90],[-1,-2,-4,9,10]);
insert into vtt3  select array_overlaps([1,2,3,4,5,6,7,8,9,9,90],[-1,-2,-4,9,10]);
replace into vtt3  select array_overlaps([1,2,3,4,5,6,7,8,9,9,90],[-1,-2,-4,9,10]);
insert into vtt3 values(array_overlaps([1,2,3,4,5,6,7,8,9,9,90],[-1,-2,-4,9,10])),(array_overlaps([1,2,3,4,5,6,7,8,9,9,90],[-1,-2,-4,10]));
insert into vtt3 values((select array_overlaps([1,2,3,4,5,6,7,8,9,9,90],[-1,-2,-4,9,10]))),((select array_overlaps(c4,c5) from tt1 limit 1));
replace into vtt3 values(array_overlaps([1,2,3,4,5,6,7,8,9,9,90],[-1,-2,-4,9,10])),(array_overlaps([1,2,3,4,5,6,7,8,9,9,90],[-1,-2,-4,10]));
replace into vtt3 values((select array_overlaps([1,2,3,4,5,6,7,8,9,9,90],[-1,-2,-4,9,10]))),((select array_overlaps(c4,c5) from tt1 limit 1));
select [array_overlaps([1,3],[3,4])];
+-------------------------------+
| [array_overlaps([1,3],[3,4])] |
+-------------------------------+
| [1]                           |
+-------------------------------+
select array_overlaps(array_agg(1),array_agg('test'));
+------------------------------------------------+
| array_overlaps(array_agg(1),array_agg('test')) |
+------------------------------------------------+
|                                              0 |
+------------------------------------------------+
select array_overlaps([[array_agg(1)]],[[array_agg('test')]]);
+--------------------------------------------------------+
| array_overlaps([[array_agg(1)]],[[array_agg('test')]]) |
+--------------------------------------------------------+
|                                                      0 |
+--------------------------------------------------------+
select array_overlaps(Array(1,2),array(2,3));
+---------------------------------------+
| array_overlaps(Array(1,2),array(2,3)) |
+---------------------------------------+
|                                     1 |
+---------------------------------------+
select array_overlaps(array_append(Array(1,2),3),array_append(Array(1,2),3));
+-----------------------------------------------------------------------+
| array_overlaps(array_append(Array(1,2),3),array_append(Array(1,2),3)) |
+-----------------------------------------------------------------------+
|                                                                     1 |
+-----------------------------------------------------------------------+
select array_append(Array(1,2),array_overlaps([1],[0]));
+--------------------------------------------------+
| array_append(Array(1,2),array_overlaps([1],[0])) |
+--------------------------------------------------+
| [1,2,0]                                          |
+--------------------------------------------------+
select array_overlaps( array_distinct(Array(1,2,2)),array_distinct(Array(1,2,2)));
+----------------------------------------------------------------------------+
| array_overlaps( array_distinct(Array(1,2,2)),array_distinct(Array(1,2,2))) |
+----------------------------------------------------------------------------+
|                                                                          1 |
+----------------------------------------------------------------------------+
select array_distinct( array_overlaps([1],[0]));
ERROR 22000: Invalid data type for the operation
select array_overlaps( array_map((x,y)->(x+y), array_map(x2->(x2+1),[1,2,3]),array_map(x1->(x1+2),[1,2,3])),array_map((x,y)->(x+y), array_map(x2->(x2+1),[1,2,3]),array_map(x1->(x1+2),[1,2,3])));
+--------------------------------------------------------------------------------------------------------------------------------------------------------------------------------------------+
| array_overlaps( array_map((x,y)->(x+y), array_map(x2->(x2+1),[1,2,3]),array_map(x1->(x1+2),[1,2,3])),array_map((x,y)->(x+y), array_map(x2->(x2+1),[1,2,3]),array_map(x1->(x1+2),[1,2,3]))) |
+--------------------------------------------------------------------------------------------------------------------------------------------------------------------------------------------+
|                                                                                                                                                                                          1 |
+--------------------------------------------------------------------------------------------------------------------------------------------------------------------------------------------+
select array_map((x)->(array_overlaps(x,x)),[[3]]);
+---------------------------------------------+
| array_map((x)->(array_overlaps(x,x)),[[3]]) |
+---------------------------------------------+
| [1]                                         |
+---------------------------------------------+
select array_map((x,y)->(array_overlaps(x,y)),[[3]],[[3]]);
+-----------------------------------------------------+
| array_map((x,y)->(array_overlaps(x,y)),[[3]],[[3]]) |
+-----------------------------------------------------+
| [1]                                                 |
+-----------------------------------------------------+
select array_overlaps(array_remove([1,2,3],3),array_remove([1,2,3],3));
+-----------------------------------------------------------------+
| array_overlaps(array_remove([1,2,3],3),array_remove([1,2,3],3)) |
+-----------------------------------------------------------------+
|                                                               1 |
+-----------------------------------------------------------------+
select array_remove([1,2,3],array_overlaps(array_remove([1,2,3],3),array_remove([1,2,3],3)));
+---------------------------------------------------------------------------------------+
| array_remove([1,2,3],array_overlaps(array_remove([1,2,3],3),array_remove([1,2,3],3))) |
+---------------------------------------------------------------------------------------+
| [2,3]                                                                                 |
+---------------------------------------------------------------------------------------+
select array_overlaps(string_to_array('1,2,3', ''),string_to_array('1,2,3', ''));
+---------------------------------------------------------------------------+
| array_overlaps(string_to_array('1,2,3', ''),string_to_array('1,2,3', '')) |
+---------------------------------------------------------------------------+
|                                                                         1 |
+---------------------------------------------------------------------------+
select array_overlaps(array_to_string([1,2,3] ,'-'),array_to_string([1,2,3] ,'-'));
ERROR 22000: invalid obj type for type promotion: left_type=LONGTEXT right_type=LONGTEXT
select array_overlaps(array_agg(1),array_agg(1));
+-------------------------------------------+
| array_overlaps(array_agg(1),array_agg(1)) |
+-------------------------------------------+
|                                         1 |
+-------------------------------------------+
select array_agg(array_overlaps([1],[1]));
+------------------------------------+
| array_agg(array_overlaps([1],[1])) |
+------------------------------------+
| [1]                                |
+------------------------------------+
select array_overlaps([1,4]+[1,3],[1,4]+[1,3]);
+-----------------------------------------+
| array_overlaps([1,4]+[1,3],[1,4]+[1,3]) |
+-----------------------------------------+
|                                       1 |
+-----------------------------------------+
select array_overlaps([1,4]-[1,3],[1,4]-[1,3]);
+-----------------------------------------+
| array_overlaps([1,4]-[1,3],[1,4]-[1,3]) |
+-----------------------------------------+
|                                       1 |
+-----------------------------------------+
select [[[[[array_overlaps([1,4]-[1,3],[1,4]-[1,3])]]]]];
+---------------------------------------------------+
| [[[[[array_overlaps([1,4]-[1,3],[1,4]-[1,3])]]]]] |
+---------------------------------------------------+
| [[[[[1]]]]]                                       |
+---------------------------------------------------+
select array_contains([1,2,3], array_overlaps([1],[1]));
+--------------------------------------------------+
| array_contains([1,2,3], array_overlaps([1],[1])) |
+--------------------------------------------------+
|                                                1 |
+--------------------------------------------------+
select array_overlaps(array_contains([1,2,3], array_overlaps([1],[1])),array_contains([1,2,3], array_overlaps([1],[1])));
ERROR 22000: invalid obj type for type promotion: left_type=INT right_type=INT
select array_overlaps([1],[1]) = ANY([1,2,3]);
+----------------------------------------+
| array_overlaps([1],[1]) = ANY([1,2,3]) |
+----------------------------------------+
|                                      1 |
+----------------------------------------+
select array_overlaps(c1,c1) = ANY(c1) from tt1;
+---------------------------------+
| array_overlaps(c1,c1) = ANY(c1) |
+---------------------------------+
|                               0 |
|                               0 |
|                            NULL |
+---------------------------------+
select sum(array_overlaps(c1,c1)) from tt1;
+----------------------------+
| sum(array_overlaps(c1,c1)) |
+----------------------------+
|                          2 |
+----------------------------+
select count(array_overlaps(c1,c1)) from tt1;
+------------------------------+
| count(array_overlaps(c1,c1)) |
+------------------------------+
|                            2 |
+------------------------------+
select max(array_overlaps(c1,c1)) from tt1;
+----------------------------+
| max(array_overlaps(c1,c1)) |
+----------------------------+
|                          1 |
+----------------------------+
select min(array_overlaps(c1,c1)) from tt1;
+----------------------------+
| min(array_overlaps(c1,c1)) |
+----------------------------+
|                          1 |
+----------------------------+
select avg(array_overlaps(c1,c1)) from tt1;
+----------------------------+
| avg(array_overlaps(c1,c1)) |
+----------------------------+
|                     1.0000 |
+----------------------------+
select ASCII(array_overlaps(c1,c1)) from tt1;
+------------------------------+
| ASCII(array_overlaps(c1,c1)) |
+------------------------------+
|                           49 |
|                           49 |
|                         NULL |
+------------------------------+
select ABS(array_overlaps(c1,c1)) from tt1;
+----------------------------+
| ABS(array_overlaps(c1,c1)) |
+----------------------------+
|                          1 |
|                          1 |
|                       NULL |
+----------------------------+
select INTERVAL(array_overlaps(c1,c1),array_overlaps(c1,c1)) from tt1;
+-------------------------------------------------------+
| INTERVAL(array_overlaps(c1,c1),array_overlaps(c1,c1)) |
+-------------------------------------------------------+
|                                                     1 |
|                                                     1 |
|                                                    -1 |
+-------------------------------------------------------+
select NULLIF(array_overlaps(c1,c1),array_overlaps(c1,c1)) from tt1;
+-----------------------------------------------------+
| NULLIF(array_overlaps(c1,c1),array_overlaps(c1,c1)) |
+-----------------------------------------------------+
|                                                NULL |
|                                                NULL |
|                                                NULL |
+-----------------------------------------------------+
drop table tt3;
create table tt3 as select array_overlaps([1,2,3,4,5,6,7,8,9,9,90],[-1,-2,-4,9,10]) as a;
desc tt3;
+-------+---------+------+-----+---------+-------+
| Field | Type    | Null | Key | Default | Extra |
+-------+---------+------+-----+---------+-------+
| a     | int(20) | YES  |     | NULL    |       |
+-------+---------+------+-----+---------+-------+
show create table tt3;
Table	Create Table
tt3	CREATE TABLE `tt3` (
  `a` int(20) DEFAULT NULL
) ORGANIZATION INDEX DEFAULT CHARSET = utf8mb4 ROW_FORMAT = DYNAMIC COMPRESSION = 'zstd_1.3.8' REPLICA_NUM = 1 BLOCK_SIZE = 16384 USE_BLOOM_FILTER = FALSE ENABLE_MACRO_BLOCK_BLOOM_FILTER = FALSE TABLET_SIZE = 134217728 PCTFREE = 0 LOB_INROW_THRESHOLD=0
insert into tt3 values(array_overlaps([1,2,3,4,5,6,7,8,9,9,90],[-1,-2,-4,9,10]));
delete from tt3;
drop table tt3;
create table tt3 as select array_overlaps(c1,c1) from tt1;
desc tt3;
+-----------------------+---------+------+-----+---------+-------+
| Field                 | Type    | Null | Key | Default | Extra |
+-----------------------+---------+------+-----+---------+-------+
| array_overlaps(c1,c1) | int(20) | YES  |     | NULL    |       |
+-----------------------+---------+------+-----+---------+-------+
show create table tt3;
Table	Create Table
tt3	CREATE TABLE `tt3` (
  `array_overlaps(c1,c1)` int(20) DEFAULT NULL
) ORGANIZATION INDEX DEFAULT CHARSET = utf8mb4 ROW_FORMAT = DYNAMIC COMPRESSION = 'zstd_1.3.8' REPLICA_NUM = 1 BLOCK_SIZE = 16384 USE_BLOOM_FILTER = FALSE ENABLE_MACRO_BLOCK_BLOOM_FILTER = FALSE TABLET_SIZE = 134217728 PCTFREE = 0 LOB_INROW_THRESHOLD=0
insert into tt3 values((select array_overlaps(c1,c1) from tt1 limit 1));
select * from tt3;
+-----------------------+
| array_overlaps(c1,c1) |
+-----------------------+
|                     1 |
|                     1 |
|                  NULL |
|                     1 |
+-----------------------+
delete from tt3;
drop view vtt3;
create view vtt3 as select array_overlaps(c1,c1) from tt1;
select * from vtt3;
+-----------------------+
| array_overlaps(c1,c1) |
+-----------------------+
|                     1 |
|                     1 |
|                  NULL |
+-----------------------+
desc vtt3;
+-----------------------+---------+------+-----+---------+-------+
| Field                 | Type    | Null | Key | Default | Extra |
+-----------------------+---------+------+-----+---------+-------+
| array_overlaps(c1,c1) | int(20) | YES  |     | NULL    |       |
+-----------------------+---------+------+-----+---------+-------+
drop table tt3;
create table tt3(id int, r int as (array_overlaps([1,2,3,4,5,6,7,8,9,9,90],[-1,-2,-4,9,10])) STORED);
desc tt3;
+-------+---------+------+-----+--------------------------------------------------------------------+------------------+
| Field | Type    | Null | Key | Default                                                            | Extra            |
+-------+---------+------+-----+--------------------------------------------------------------------+------------------+
| id    | int(11) | YES  |     | NULL                                                               |                  |
| r     | int(11) | YES  |     | array_overlaps(array(1,2,3,4,5,6,7,8,9,9,90),array(-1,-2,-4,9,10)) | STORED GENERATED |
+-------+---------+------+-----+--------------------------------------------------------------------+------------------+
insert into  tt3(id) values(1);
select * from tt3;
+------+------+
| id   | r    |
+------+------+
|    1 |    1 |
+------+------+
delete from tt3;
insert into  tt3(id) values(1);
truncate tt3;
select * from tt3;
+------+------+
| id   | r    |
+------+------+
+------+------+
drop table tt3;
create table tt3(id int, r int as (array_overlaps([1,2,3,4,5,6,7,8,9,9,90],[-1,-2,-4,9,10])) VIRTUAL);
desc tt3;
+-------+---------+------+-----+--------------------------------------------------------------------+-------------------+
| Field | Type    | Null | Key | Default                                                            | Extra             |
+-------+---------+------+-----+--------------------------------------------------------------------+-------------------+
| id    | int(11) | YES  |     | NULL                                                               |                   |
| r     | int(11) | YES  |     | array_overlaps(array(1,2,3,4,5,6,7,8,9,9,90),array(-1,-2,-4,9,10)) | VIRTUAL GENERATED |
+-------+---------+------+-----+--------------------------------------------------------------------+-------------------+
insert into  tt3(id) values(1);
select * from tt3;
+------+------+
| id   | r    |
+------+------+
|    1 |    1 |
+------+------+
delete from tt3;
insert into  tt3(id) values(1);
truncate tt3;
select * from tt3;
+------+------+
| id   | r    |
+------+------+
+------+------+
drop table tt3;
create table tt3(id int);
ALTER TABLE tt3
ADD COLUMN r int AS (array_overlaps([1,2,3,4,5,6,7,8,9,9,90],[-1,-2,-4,9,10])) STORED;
desc tt3;
+-------+---------+------+-----+--------------------------------------------------------------------+------------------+
| Field | Type    | Null | Key | Default                                                            | Extra            |
+-------+---------+------+-----+--------------------------------------------------------------------+------------------+
| id    | int(11) | YES  |     | NULL                                                               |                  |
| r     | int(11) | YES  |     | array_overlaps(array(1,2,3,4,5,6,7,8,9,9,90),array(-1,-2,-4,9,10)) | STORED GENERATED |
+-------+---------+------+-----+--------------------------------------------------------------------+------------------+
insert into  tt3(id) values(1);
select * from tt3;
+------+------+
| id   | r    |
+------+------+
|    1 |    1 |
+------+------+
delete from tt3;
insert into  tt3(id) values(1);
truncate tt3;
select * from tt3;
+------+------+
| id   | r    |
+------+------+
+------+------+
drop table tt3;
create table tt3(id int);
ALTER TABLE tt3
ADD COLUMN r int AS (array_overlaps([1,2,3,4,5,6,7,8,9,9,90],[-1,-2,-4,9,10])) VIRTUAL;
desc tt3;
+-------+---------+------+-----+--------------------------------------------------------------------+-------------------+
| Field | Type    | Null | Key | Default                                                            | Extra             |
+-------+---------+------+-----+--------------------------------------------------------------------+-------------------+
| id    | int(11) | YES  |     | NULL                                                               |                   |
| r     | int(11) | YES  |     | array_overlaps(array(1,2,3,4,5,6,7,8,9,9,90),array(-1,-2,-4,9,10)) | VIRTUAL GENERATED |
+-------+---------+------+-----+--------------------------------------------------------------------+-------------------+
insert into  tt3(id) values(1);
select * from tt3;
+------+------+
| id   | r    |
+------+------+
|    1 |    1 |
+------+------+
delete from tt3;
insert into  tt3(id) values(1);
truncate tt3;
select * from tt3;
+------+------+
| id   | r    |
+------+------+
+------+------+
drop table tt3;
create table tt3(id int,a varchar(50),ar array(int),INDEX index_1((array_overlaps(ar,[-1,-2,-4,9,10]))));
show index from tt3;
Table	Non_unique	Key_name	Seq_in_index	Column_name	Collation	Cardinality	Sub_part	Packed	Null	Index_type	Comment	Index_comment	Visible	Expression
tt3	1	index_1	1	SYS_NC19$	A	NULL	NULL	NULL	YES	BTREE	available		YES	array_overlaps(`ar`,array(-1,-2,-4,9,10))
insert into tt3 values(1,'test',[-1,2,330,50]);
insert into tt3 values(2,'test1',[840-2934,945,4512]);
insert into tt3 values(3,'test',[90,4581,932114]);
insert into tt3 values(5,'test',[9,4581,932114]);
select * from tt3 where array_overlaps(ar,[-1,-2,-4,9,10])=1;
+------+------+-----------------+
| id   | a    | ar              |
+------+------+-----------------+
|    1 | test | [-1,2,330,50]   |
|    5 | test | [9,4581,932114] |
+------+------+-----------------+
EXPLAIN select * from tt3 where array_overlaps(ar,[-1,-2,-4,9,10])=1;
Query Plan
===============================================
|ID|OPERATOR       |NAME|EST.ROWS|EST.TIME(us)|
-----------------------------------------------
|0 |TABLE FULL SCAN|tt3 |1       |3           |
===============================================
Outputs & filters:
-------------------------------------
  0 - output([tt3.id], [tt3.a], [tt3.ar]), filter([array_overlaps(cast(tt3.ar, ARRAY(19, 0)), array(-1, -2, -4, 9, 10)) = 1]), rowset=16
      access([tt3.ar], [tt3.id], [tt3.a]), partitions(p0)
      is_index_back=false, is_global_index=false, filter_before_indexback[false], 
      range_key([tt3.__pk_increment]), range(MIN ; MAX)always true
select  /*+ index(tt3 index_1)*/  * from tt3 where array_overlaps(ar,[-1,-2,-4,9,10]);
+------+------+-----------------+
| id   | a    | ar              |
+------+------+-----------------+
|    1 | test | [-1,2,330,50]   |
|    5 | test | [9,4581,932114] |
+------+------+-----------------+
drop table tt3;
create table tt3(id int,a varchar(50),r int[])PARTITION BY range COLUMNS(id)(
PARTITION p0 values less than(19),
PARTITION p1 values less than(25),
PARTITION p2 values less than(30)
) ;
CREATE INDEX index_1 ON tt3 ((array_overlaps([2,5,90],r)));
insert into tt3 values(1,'test',[-1,2,330,50]);
insert into tt3 values(2,'test1',[840-2934,945,4512]);
insert into tt3 values(3,'test',[90,4581,932114]);
insert into tt3 values(5,'test',[9,4581,932114]);
select * from tt3 where array_overlaps([2,5,90],r)=1;
+------+------+------------------+
| id   | a    | r                |
+------+------+------------------+
|    1 | test | [-1,2,330,50]    |
|    3 | test | [90,4581,932114] |
+------+------+------------------+
drop table tt2;
create table tt2(id int,a varchar(50),r int[]);
alter table tt2 add index index_1((array_overlaps([2,5,90],r)));
insert into tt2 values(1,'test',[-1,2,330,50]);
insert into tt2 values(2,'test1',[840-2934,945,4512]);
insert into tt2 values(3,'test',[90,4581,932114]);
insert into tt2 values(5,'test',[9,4581,932114]);
select * from tt2 where array_overlaps([2,5,90],r)=1;
+------+------+------------------+
| id   | a    | r                |
+------+------+------------------+
|    1 | test | [-1,2,330,50]    |
|    3 | test | [90,4581,932114] |
+------+------+------------------+
########清空回收站，删除测试数据库，表等 ##########
drop database  IF EXISTS  oblrp;
purge recyclebin;
