purge recyclebin;
drop database IF EXISTS oblrp;
create database oblrp;
use oblrp;
set timestamp = 1600000000;
set ob_trx_timeout = 10000000000;
set ob_query_timeout = 10000000000;
SET SESSION group_concat_max_len = 100000000;
set ob_default_lob_inrow_threshold = 0;
result_format: 4
drop table tt5;
create table tt5(id int primary key,id1 bigint, a varchar(100),d double,a1 array(float),a2 int[]);
insert into tt5 values(1,1,'test','1.2E-2',[1,525.12E-2],[1,2,3,4,5]);
insert into tt5 values(2,1,'test1','1.5E-2',[1,523.12E-2],[1,2,3,4,5]);
insert into tt5 values(3,1,'test2','1.5E-2',[1,523.12E-2],[1,2,3,4,5]);
insert into tt5 values(4,2,'test3','142143144.5E-7',[1,523.12E-2],[1,6,3,4,5]);
insert into tt5 values(5,2,'test4','142143144.5E-7',[1,523.12E-2],[1,2,3,4,5]);
insert into tt5 values(6,null,'test4','142143144.5E-7',[1,523.12E-2],[5,2,3,4,5]);
insert into tt5 values(7,null,'test5','142143144.5E-7',[1,523.12E-2],[1,2,3,4,5]);
insert into tt5 values(8,3,'test6','142143144.5E-7',[1,523.12E+2,1,6,9],[1,2,3,4,5]);
insert into tt5 values(9,3,'test6','142143144.5E-7',null,[1,2,3,4,5]);
insert into tt5 values(10,3,null,'142143144.5E-7',null,[1,2,3,4,6]);
drop PROCEDURE p_test01;
CREATE  PROCEDURE p_test01()
begin
declare  a int;
select array_agg(1);
end;
//
call p_test01();
+--------------+
| array_agg(1) |
+--------------+
| [1]          |
+--------------+
drop PROCEDURE p_test01;
CREATE  PROCEDURE p_test01()
begin
declare  a varchar(50);
select array_agg(1) into a;
end;
//
call p_test01();
ERROR 22000: Invalid data type for the operation
drop PROCEDURE p_test01;
CREATE  PROCEDURE p_test01()
begin
declare  a varchar(50);
select array_agg(distinct id1 order by id1 nulls last,a nulls first) from tt5;
end;
//
call p_test01();
+---------------------------------------------------------------+
| array_agg(distinct id1 order by id1 nulls last,a nulls first) |
+---------------------------------------------------------------+
| [1,2,3,NULL]                                                  |
+---------------------------------------------------------------+
drop table tt3;
drop PROCEDURE p_test01;
CREATE  PROCEDURE p_test01()
begin
create table tt3(id int, id1 int[],a array(varchar(50)));
insert  into tt3 values(1,[1,2,3],['test','test1','test2']);
select * from tt3;
end;
//
call p_test01();
+------+---------+--------------------------+
| id   | id1     | a                        |
+------+---------+--------------------------+
|    1 | [1,2,3] | ["test","test1","test2"] |
+------+---------+--------------------------+
drop PROCEDURE p_test01;
CREATE  PROCEDURE p_test01()
begin
if (select array_agg(1))=(select array_agg(1)) then
select array_agg(1);
end if;
end;
//
call p_test01();
+--------------+
| array_agg(1) |
+--------------+
| [1]          |
+--------------+
drop PROCEDURE p_test01;
CREATE  PROCEDURE p_test01()
begin
if (select array_agg(1))!=(select array_agg(1)) then
select 1;
end if;
end;
//
call p_test01();
drop PROCEDURE p_test01;
CREATE  PROCEDURE p_test01()
begin
declare a varchar(50);
DECLARE cur1 CURSOR FOR select array_agg(1) as a;
open cur1;
  FETCH cur1 INTO a;
  select a;
  CLOSE cur1;
end;
//
call p_test01();
ERROR 22000: Invalid data type for the operation
drop PROCEDURE p_test01;
CREATE  PROCEDURE p_test01()
begin
WHILE (select array_agg(1)) DO
       select 1;
     END WHILE;
end;
//
call p_test01();
ERROR 0A000: T_COLLECTION cast to T_TINYINT not supported
drop PROCEDURE p_test01;
CREATE  PROCEDURE p_test01(in i int, a varchar(50),d double)
begin
select array_agg(i);
select array_agg(a);
select array_agg(d);
end;
//
call p_test01(1,'test',5484E-2);
+--------------+
| array_agg(i) |
+--------------+
+--------------+
| array_agg(a) |
+--------------+
+--------------+
| array_agg(d) |
+--------------+
| [1]          |
| ["test"]     |
| [54.84]      |
+--------------+
+--------------+
+--------------+
drop function fun_test;
create function fun_test()
returns json
begin
declare r varbinary(50);
return  (select array_agg(1));
end;
//
select fun_test();
ERROR 0A000: T_COLLECTION cast to T_JSON not supported
drop function fun_test;
create function fun_test( i int)
returns json
begin
declare r json;
select array_agg(i) into r;
return  r;
end;
//
select fun_test(1);
ERROR 22000: Invalid data type for the operation
drop function fun_test;
create function fun_test( i int)
returns int
begin
declare r int;
set r=1;
insert  into tt3 values(1,(select array(i)),(select array('test')));
return  r;
end;
//
select fun_test(1);
+-------------+
| fun_test(1) |
+-------------+
|           1 |
+-------------+
select * from tt3;
+------+---------+--------------------------+
| id   | id1     | a                        |
+------+---------+--------------------------+
|    1 | [1,2,3] | ["test","test1","test2"] |
|    1 | [1]     | ["test"]                 |
+------+---------+--------------------------+
drop PROCEDURE p_test01;
CREATE  PROCEDURE p_test01()
begin
declare  a int;
select cardinality([[1,2,34],[445,845455]]);
select cardinality([[1,2,34],[445,845455]]) into a;
select a;
end;
//
call p_test01();
+--------------------------------------+
| cardinality([[1,2,34],[445,845455]]) |
+--------------------------------------+
+------+
| a    |
+------+
|                                    5 |
|    5 |
+--------------------------------------+
+------+
drop PROCEDURE p_test01;
CREATE  PROCEDURE p_test01(out i int)
begin
declare  a int;
select cardinality([[1,2,34],[445,845455]]) into i;
end;
//
call p_test01(@i);
select @i;
+------+
| @i   |
+------+
|    5 |
+------+
drop PROCEDURE p_test01;
CREATE  PROCEDURE p_test01(in i int)
begin
declare  a int;
select i;
end;
//
bug 2024121300106457444   《[obmysql_array二期]非array类型的array 表达式作为pl输入参数，ob报4006》
call p_test01(cardinality([[1,2,34],[445,845455]]));
ERROR HY000: The object is not initialized
bug 2024121300106457444   《[obmysql_array二期]非array类型的array 表达式作为pl输入参数，ob报4006》
call p_test01(array_overlaps([1,3],[3,4]));
ERROR HY000: The object is not initialized
bug 2024121300106457444   《[obmysql_array二期]非array类型的array 表达式作为pl输入参数，ob报4006》
call p_test01(array_contains_all([1,3],[3,4]));
ERROR HY000: The object is not initialized
drop PROCEDURE p_test01;
CREATE  PROCEDURE p_test01(in i longtext)
begin
select i;
end;
//
bug 2024121300106457444   《[obmysql_array二期]非array类型的array 表达式作为pl输入参数，ob报4006》
call p_test01(array_to_string([12,null,34],'-'));
ERROR HY000: The object is not initialized
drop PROCEDURE p_test01;
CREATE  PROCEDURE p_test01()
begin
declare a int;
DECLARE cur1 CURSOR FOR select cardinality([[1,2,34],[445,845455]]) as a;
open cur1;
  FETCH cur1 INTO a;
  select a;
  CLOSE cur1;
end;
//
call p_test01();
+------+
| a    |
+------+
|    5 |
+------+
drop PROCEDURE p_test01;
CREATE PROCEDURE p_test01()
   BEGIN
     CASE array(1)
       WHEN array(1) THEN SELECT 1;
       WHEN array(0) THEN SELECT 0;
       ELSE
         BEGIN
         END;
     END CASE;
   END //
bug 2024121300106457444   《[obmysql_array二期]array 表达式在存储过程/触发器中，ob报4006》
call p_test01();
ERROR HY000: The object is not initialized
drop PROCEDURE p_test01;
CREATE PROCEDURE p_test01()
   BEGIN
     CASE cardinality([1])
       WHEN cardinality([1]) THEN SELECT 1;
       WHEN cardinality([[1,2,34]]) THEN SELECT 0;
       ELSE
         BEGIN
         END;
     END CASE;
   END //
bug 2024121300106457444   《[obmysql_array二期]array 表达式在存储过程/触发器中，ob报4006》
call p_test01();
ERROR HY000: The object is not initialized
drop PROCEDURE p_test01;
CREATE PROCEDURE p_test01()
   BEGIN
      if cardinality([1])=cardinality([1]) then
        select cardinality([1]);
        end if;
   END //
bug 2024121300106457444   《[obmysql_array二期]array 表达式在存储过程/触发器中，ob报4006》
call p_test01();
ERROR HY000: The object is not initialized
drop PROCEDURE p_test01;
CREATE PROCEDURE p_test01()
   BEGIN
     CASE 1
       WHEN 1 THEN SELECT array(1);
       WHEN 0 THEN SELECT array(0);
       ELSE
         BEGIN
         END;
     END CASE;
   END //
call p_test01();
+----------+
| array(1) |
+----------+
| [1]      |
+----------+
drop PROCEDURE p_test01;
CREATE PROCEDURE p_test01()
   BEGIN
     CASE 1
       WHEN 1 THEN SELECT array(1);
       WHEN 0 THEN SELECT array(0);
       ELSE
         BEGIN
         END;
     END CASE;
   END //
call p_test01();
+----------+
| array(1) |
+----------+
| [1]      |
+----------+
drop PROCEDURE p_test01;
CREATE  PROCEDURE p_test01()
begin
WHILE array(1)!=array(1) DO
       select 1;
     END WHILE;
end;
//
bug 2024121300106457444   《[obmysql_array二期]array 表达式在存储过程/触发器中，ob报4006》
call p_test01();
ERROR HY000: The object is not initialized
drop PROCEDURE p_test01;
CREATE  PROCEDURE p_test01()
begin
WHILE cardinality([1,2,3])=cardinality([1]) DO
       select 1;
     END WHILE;
end;
//
bug 2024121300106457444   《[obmysql_array二期]array 表达式在存储过程/触发器中，ob报4006》
call p_test01();
ERROR HY000: The object is not initialized
drop PROCEDURE p_test01;
CREATE PROCEDURE p_test01()
   BEGIN
      if array_to_string([1,2],'a')=array_to_string([1,2],'a') then
        select array_to_string([1,2],'a');
        end if;
   END //
bug 2024121300106457444   《[obmysql_array二期]array 表达式在存储过程/触发器中，ob报4006》
call p_test01();
ERROR HY000: The object is not initialized
drop PROCEDURE p_test01;
CREATE PROCEDURE p_test01()
   BEGIN
      select rb_build([1,2]);
   END //
call p_test01();
+-----------------+
| rb_build([1,2]) |
+-----------------+
|            |
+-----------------+
drop PROCEDURE p_test01;
CREATE PROCEDURE p_test01()
   BEGIN
       declare r longtext;
       select array_to_string([1,2],'a');
       select array_to_string([1,2],'a') into r;
   END //
call p_test01();
+----------------------------+
| array_to_string([1,2],'a') |
+----------------------------+
| 1a2                        |
+----------------------------+
drop function fun_test;
create function fun_test()
returns int
begin
declare r int;
if cardinality([1])=cardinality([1]) then
     select cardinality([1]) into r;
        end if;
return  r;
end;
//
select fun_test();
ERROR HY000: The object is not initialized
drop function fun_test;
create function fun_test()
returns int
begin
declare i int;
set i=0;
WHILE cardinality([1,2,3])=cardinality([1]) DO
       select 1 into  i;
     END WHILE;
return i;
end;
//
select fun_test();
ERROR HY000: The object is not initialized
drop function fun_test;
create function fun_test()
returns int
begin
declare r int;
if array(1)=array(1) then
     set r=1;
        end if;
return  r;
end;
//
select fun_test();
ERROR HY000: The object is not initialized
drop function fun_test;
create function fun_test()
returns int
begin
declare r int;
select cardinality([[1,2,34],[445,845455]]) into r;
return r;
end;
//
select fun_test();
+------------+
| fun_test() |
+------------+
|          5 |
+------------+
drop function fun_test;
create function fun_test()
returns int
begin
declare r int;
select array_contains_all([1],[2]) into r;
return  array_contains_all([1],[2]);
end;
//
select fun_test();
ERROR HY000: The object is not initialized
drop function fun_test;
create function fun_test()
returns int
begin
declare r int;
select array_overlaps([1],[2]) into r;
return  array_overlaps([1],[2]);
end;
//
select fun_test();
ERROR HY000: The object is not initialized
drop function fun_test;
create function fun_test()
returns int
begin
declare r int;
select cardinality([[1,2,34],[445,845455]]) into r;
return  r;
end;
//
select fun_test();
+------------+
| fun_test() |
+------------+
|          5 |
+------------+
drop function fun_test;
create function fun_test()
returns longtext
begin
declare r longtext;
select array_to_string([1,2,3,4,null],'-','a') into r;
return  array_to_string([1,2,3,4,null],'-','a');
end;
//
select fun_test();
ERROR HY000: The object is not initialized
drop function fun_test;
create function fun_test(a int)
returns int
begin
declare r int;
select a into r;
return  a;
end;
//
select fun_test(cardinality([1,2,3,4]));
+----------------------------------+
| fun_test(cardinality([1,2,3,4])) |
+----------------------------------+
|                                4 |
+----------------------------------+
select fun_test(array_overlaps([1,2,3,4],[24,45,6,7]));
+-------------------------------------------------+
| fun_test(array_overlaps([1,2,3,4],[24,45,6,7])) |
+-------------------------------------------------+
|                                               0 |
+-------------------------------------------------+
select fun_test(array_contains_all([1,2,3,4],[24,45,6,7]));
+-----------------------------------------------------+
| fun_test(array_contains_all([1,2,3,4],[24,45,6,7])) |
+-----------------------------------------------------+
|                                                   0 |
+-----------------------------------------------------+
drop function fun_test;
create function fun_test(a longtext)
returns longtext
begin
declare r longtext;
select a into r;
return  a;
end;
//
select fun_test(array_to_string([1,2,3],'e'));
+----------------------------------------+
| fun_test(array_to_string([1,2,3],'e')) |
+----------------------------------------+
| 1e2e3                                  |
+----------------------------------------+
drop function fun_test;
create function fun_test()
returns longtext
BEGIN
  declare r longtext;
     if array_to_string([1,2,3],'e')=array_to_string([1,2,3],'e') then
      select array_to_string([1,2,3],'e') into  r;
    end if;
      return r;
   END //
select fun_test();
ERROR HY000: The object is not initialized
drop function fun_test;
create function fun_test()
returns int
   BEGIN
     CASE cardinality([1])
       WHEN cardinality([1]) THEN  return 1;
       WHEN cardinality([[1,2,34]]) THEN  return 0;
       ELSE
         BEGIN
         END;
           return 1;
     END CASE;
      return 1;
   END //
select fun_test();
ERROR HY000: The object is not initialized
drop table tt3;
create table tt3(id int,a longtext,a1 int[], r roaringbitmap);
drop function fun_test;
create function fun_test()
returns longtext
begin
declare r longtext;
declare i int;
declare i1 int;
declare i2 int;
select cardinality([[1,2,34]]) into i;
select array_to_string([[1,2,34]],'a') into r;
select array_overlaps([1,2,34],[1,2,34]) into i1;
select array_contains_all([1,2,34],[1,2,34]) into i2;
insert into tt3 values(cardinality([[1,2,34]]),array_to_string([[1,2,34]],'a'),(select array_agg(1)),rb_build([12,3]));
replace into tt3 values(array_overlaps([1,2,34],[1,2,34]),array_to_string([[1,2,34]],'a'),(select array_agg(1)),rb_build([12,3]));
replace into tt3 values(array_contains_all([1,2,34],[1,2,34]),array_to_string([[1,2,34]],'a'),(select array_agg(1)),rb_build([12,3]));
return r;
end;
//
select fun_test();
+------------+
| fun_test() |
+------------+
| 1a2a34     |
+------------+
DROP TABLE tt3;
CREATE TABLE tt3 (id int primary key, a array(varchar(20)), a1 int[]);
DROP TABLE tt4;
CREATE TABLE tt4 (id int , a array(varchar(20)), a1 int[]);
insert into tt4 values(1,[1,2,3,4,5],[12344,234]);
drop trigger tr_test;
CREATE  trigger tr_test before insert on tt4
for each row 
begin
insert  into tt3 values(1,(select array_agg('test')),(select array_agg(1)));
end;
//
insert  into tt4 values(1,(select array_agg('test')),(select array_agg(1)));
select * from tt3;
+----+----------+------+
| id | a        | a1   |
+----+----------+------+
|  1 | ["test"] | [1]  |
+----+----------+------+
drop trigger tr_test;
CREATE  trigger tr_test before insert on tt4
for each row 
BEGIN
   declare i int;
     CASE array(1)
       WHEN array(1) THEN set i=1;
       WHEN array(0) THEN set i=0;
       ELSE
         BEGIN
         END;
     END CASE;
     end;
//
bug 2024121300106457444   《[obmysql_array二期]array 表达式在存储过程/触发器中，ob报4006》
insert  into tt4 values(1,(select array_agg('test')),(select array_agg(1)));
ERROR HY000: The object is not initialized
select * from tt3;
+----+----------+------+
| id | a        | a1   |
+----+----------+------+
|  1 | ["test"] | [1]  |
+----+----------+------+
drop trigger tr_test;
CREATE  trigger tr_test before insert on tt4
for each row 
BEGIN
   declare i int;
    if cardinality([1]) is true then
    select cardinality([1]) into i;
    end if;
    end;
//
bug 2024121300106457444   《[obmysql_array二期]array 表达式在存储过程/触发器中，ob报4006》
insert  into tt4 values(1,(select array_agg('test')),(select array_agg(1)));
ERROR HY000: The object is not initialized
select * from tt3;
+----+----------+------+
| id | a        | a1   |
+----+----------+------+
|  1 | ["test"] | [1]  |
+----+----------+------+
drop table tt3;
create table tt3(id int,a longtext,a1 int[], r roaringbitmap);
drop trigger tr_test;
CREATE  trigger tr_test after insert on tt4
for each row 
BEGIN
declare r longtext;
declare i int;
declare i1 int;
declare i2 int;
select cardinality([[1,2,34]]) into i;
select array_to_string([[1,2,34]],'a') into r;
select array_overlaps([1,2,34],[1,2,34]) into i1;
select array_contains_all([1,2,34],[1,2,34]) into i2;
insert into tt3 values(cardinality([[1,2,34]]),array_to_string([[1,2,34]],'a'),(select array_agg(1)),rb_build([12,3]));
replace into tt3 values(array_overlaps([1,2,34],[1,2,34]),array_to_string([[1,2,34]],'a'),(select array_agg(1)),rb_build([12,3]));
replace into tt3 values(array_contains_all([1,2,34],[1,2,34]),array_to_string([[1,2,34]],'a'),(select array_agg(1)),rb_build([12,3]));
end;
//
insert  into tt4 values(1,(select array_agg('test')),(select array_agg(1)));
select * from tt3;
+------+--------+------+-------------+
| id   | a      | a1   | r           |
+------+--------+------+-------------+
|    3 | 1a2a34 | [1]  |        |
|    1 | 1a2a34 | [1]  |        |
|    1 | 1a2a34 | [1]  |        |
+------+--------+------+-------------+
drop trigger tr_test;
CREATE  trigger tr_test after update on tt4
for each row 
BEGIN
declare r longtext;
declare i int;
declare i1 int;
declare i2 int;
select cardinality([[1,2,34]]) into i;
select array_to_string([[1,2,34]],'a') into r;
select array_overlaps([1,2,34],[1,2,34]) into i1;
select array_contains_all([1,2,34],[1,2,34]) into i2;
insert into tt3 values(cardinality([[1,2,34]]),array_to_string([[1,2,34]],'a'),(select array_agg(1)),rb_build([12,3]));
replace into tt3 values(array_overlaps([1,2,34],[1,2,34]),array_to_string([[1,2,34]],'a'),(select array_agg(1)),rb_build([12,3]));
replace into tt3 values(array_contains_all([1,2,34],[1,2,34]),array_to_string([[1,2,34]],'a'),(select array_agg(1)),rb_build([12,3]));
end;
//
update tt4 set a=['test','test10'];
select * from tt3;
+------+--------+------+-------------+
| id   | a      | a1   | r           |
+------+--------+------+-------------+
|    3 | 1a2a34 | [1]  |        |
|    1 | 1a2a34 | [1]  |        |
|    1 | 1a2a34 | [1]  |        |
|    3 | 1a2a34 | [1]  |        |
|    1 | 1a2a34 | [1]  |        |
|    1 | 1a2a34 | [1]  |        |
|    3 | 1a2a34 | [1]  |        |
|    1 | 1a2a34 | [1]  |        |
|    1 | 1a2a34 | [1]  |        |
|    3 | 1a2a34 | [1]  |        |
|    1 | 1a2a34 | [1]  |        |
|    1 | 1a2a34 | [1]  |        |
+------+--------+------+-------------+
drop trigger tr_test;
CREATE  trigger tr_test before delete on tt4
for each row 
BEGIN
declare r longtext;
declare i int;
declare i1 int;
declare i2 int;
select cardinality([[1,2,34]]) into i;
select array_to_string([[1,2,34]],'a') into r;
select array_overlaps([1,2,34],[1,2,34]) into i1;
select array_contains_all([1,2,34],[1,2,34]) into i2;
insert into tt3 values(cardinality([[1,2,34]]),array_to_string([[1,2,34]],'a'),(select array_agg(1)),rb_build([12,3]));
replace into tt3 values(array_overlaps([1,2,34],[1,2,34]),array_to_string([[1,2,34]],'a'),(select array_agg(1)),rb_build([12,3]));
replace into tt3 values(array_contains_all([1,2,34],[1,2,34]),array_to_string([[1,2,34]],'a'),(select array_agg(1)),rb_build([12,3]));
end;
//
delete from tt4;
select * from tt3;
+------+--------+------+-------------+
| id   | a      | a1   | r           |
+------+--------+------+-------------+
|    3 | 1a2a34 | [1]  |        |
|    1 | 1a2a34 | [1]  |        |
|    1 | 1a2a34 | [1]  |        |
|    3 | 1a2a34 | [1]  |        |
|    1 | 1a2a34 | [1]  |        |
|    1 | 1a2a34 | [1]  |        |
|    3 | 1a2a34 | [1]  |        |
|    1 | 1a2a34 | [1]  |        |
|    1 | 1a2a34 | [1]  |        |
|    3 | 1a2a34 | [1]  |        |
|    1 | 1a2a34 | [1]  |        |
|    1 | 1a2a34 | [1]  |        |
|    3 | 1a2a34 | [1]  |        |
|    1 | 1a2a34 | [1]  |        |
|    1 | 1a2a34 | [1]  |        |
|    3 | 1a2a34 | [1]  |        |
|    1 | 1a2a34 | [1]  |        |
|    1 | 1a2a34 | [1]  |        |
|    3 | 1a2a34 | [1]  |        |
|    1 | 1a2a34 | [1]  |        |
|    1 | 1a2a34 | [1]  |        |
+------+--------+------+-------------+
select * from tt4;
+------+------+------+
| id   | a    | a1   |
+------+------+------+
+------+------+------+
drop table tt5;
create table tt5(id int primary key,v vector(2), a varchar(100),d double,a1 array(float),a2 int[])
PARTITION BY range COLUMNS(id)(
PARTITION p0 values less than(19),
PARTITION p1 values less than(25),
PARTITION p2 values less than(30)
);
drop view vtt5;
create view vtt5 as select * from tt5;
insert into tt5 values(1,[1,2],'test','1.2E-2',[1,525.12E-2],[1,2,3,4,5]);
insert into tt5 values(2,[1,2],'test1','1.5E-2',[1,523.12E-2],[1,2,3,4,5]);
insert into tt5 values(3,[1,2],'test2','1.5E-2',[1,523.12E-2],[1,2,3,4,5]);
insert into tt5 values(4,[3,4],'test3','142143144.5E-7',[1,523.12E-2],[1,6,3,4,5]);
insert into tt5 values(5,[6,7],'test4','142143144.5E-7',[1,523.12E-2],[1,2,3,4,5]);
insert into tt5 values(6,null,'test4','142143144.5E-7',[1,523.12E-2],[5,2,3,4,5]);
insert into tt5 values(7,null,'test5','142143144.5E-7',[1,523.12E-2],[1,2,3,4,5]);
insert into tt5 values(8,[6,7],'test6','142143144.5E-7',[1,523.12E+2,1,6,9],[1,2,3,4,5]);
insert into tt5 values(9,[6,7],'test6','142143144.5E-7',null,[1,2,3,4,5]);
insert into tt5 values(20,[6,7],null,'142143144.5E-7',null,[1,2,3,4,6]);
create materialized view mv1  as select  array_agg(id) from tt5;
select * from mv1;
+------------------------+
| array_agg(id)          |
+------------------------+
| [20,1,2,3,4,5,6,7,8,9] |
+------------------------+
DROP MATERIALIZED VIEW  mv1;
bug 2024121300106464051   《【obmysql_bitmap】roaringbitmap类型不支持创建物化视图》
create materialized view mv1  as select  rb_build(a2) from tt5;
ERROR 0A000: Not supported feature or function
DROP MATERIALIZED VIEW  mv1;
create materialized view mv1  as select  cardinality(a2) from tt5;
call DBMS_MVIEW.REFRESH('mv1','c');
DROP MATERIALIZED VIEW  mv1;
create materialized view mv1  as select  array_to_string(a2,'-')  a from tt5;
desc mv1;
+-------+----------+------+-----+---------+-------+
| Field | Type     | Null | Key | Default | Extra |
+-------+----------+------+-----+---------+-------+
| a     | longtext | YES  |     | NULL    |       |
+-------+----------+------+-----+---------+-------+
select a from mv1 order by a;
+-----------+
| a         |
+-----------+
| 1-2-3-4-5 |
| 1-2-3-4-5 |
| 1-2-3-4-5 |
| 1-2-3-4-5 |
| 1-2-3-4-5 |
| 1-2-3-4-5 |
| 1-2-3-4-5 |
| 1-2-3-4-6 |
| 1-6-3-4-5 |
| 5-2-3-4-5 |
+-----------+
insert into tt5 values(24,[6,7],null,'142143144.5E-7',null,[50,50]);
select * from mv1 order by a;
+-----------+
| a         |
+-----------+
| 1-2-3-4-5 |
| 1-2-3-4-5 |
| 1-2-3-4-5 |
| 1-2-3-4-5 |
| 1-2-3-4-5 |
| 1-2-3-4-5 |
| 1-2-3-4-5 |
| 1-2-3-4-6 |
| 1-6-3-4-5 |
| 5-2-3-4-5 |
+-----------+
call DBMS_MVIEW.REFRESH('mv1','c');
select * from mv1 order by a;
+-----------+
| a         |
+-----------+
| 1-2-3-4-5 |
| 1-2-3-4-5 |
| 1-2-3-4-5 |
| 1-2-3-4-5 |
| 1-2-3-4-5 |
| 1-2-3-4-5 |
| 1-2-3-4-5 |
| 1-2-3-4-6 |
| 1-6-3-4-5 |
| 5-2-3-4-5 |
| 50-50     |
+-----------+
DROP MATERIALIZED VIEW  mv1;
create materialized view mv1  as select  array_overlaps(a2,a2) from tt5;
call DBMS_MVIEW.REFRESH('mv1','c');
DROP MATERIALIZED VIEW  mv1;
create materialized view mv1  as select  array_contains_all(a2,a2) as a from tt5;
call DBMS_MVIEW.REFRESH('mv1','c');
DROP MATERIALIZED VIEW  mv1;
create materialized view mv1  as select 1 as b, array(id) as a from tt5;
call DBMS_MVIEW.REFRESH('mv1','c');
select array_agg(DISTINCT a) from mv1;
ERROR 22000: Invalid data type for the operation
DROP MATERIALIZED VIEW  mv1;
create materialized view mv1  as select  * from tt5;
desc mv1;
+-------+--------------+------+-----+---------+-------+
| Field | Type         | Null | Key | Default | Extra |
+-------+--------------+------+-----+---------+-------+
| id    | int(11)      | YES  |     | NULL    |       |
| v     | VECTOR(2)    | YES  |     | NULL    |       |
| a     | varchar(100) | YES  |     | NULL    |       |
| d     | double       | YES  |     | NULL    |       |
| a1    | ARRAY(FLOAT) | YES  |     | NULL    |       |
| a2    | ARRAY(INT)   | YES  |     | NULL    |       |
+-------+--------------+------+-----+---------+-------+
select array_agg(v) from mv1;
select array_agg(distinct v) from mv1;
select array_agg(v order by id) from mv1;
select cardinality(a1),cardinality(v) from mv1;
select rb_build(a2)  from mv1;
select array_to_string(a2,'1','a')  from mv1;
select array_overlaps(a2,a1)  from mv1;
select array_contains_all(a2,a1)  from mv1;
select array_agg( distinct v2.a order by v1.a,v2.d) from mv1 v1,mv1 v2 order by v1.id,v2.d;
insert into tt5 values(21,[6,7],null,'142143144.5E-7',null,[1,2,3,4,6]);
call DBMS_MVIEW.REFRESH('mv1','c');
drop table tt5;
create table tt5(id int primary key,v vector(2), a varchar(100),d double,a1 array(float),a2 int[])
partition by hash(id) partitions 4;
drop view vtt5;
create view vtt5 as select * from tt5;
create index index_1 on tt5(a) local;
insert into tt5 values(1,[1,2],'test','1.2E-2',[1,525.12E-2],[1,2,3,4,5]);
insert into tt5 values(2,[1,2],'test1','1.5E-2',[1,523.12E-2],[1,2,3,4,5]);
insert into tt5 values(3,[1,2],'test2','1.5E-2',[1,523.12E-2],[1,2,3,4,5]);
insert into tt5 values(4,[3,4],'test3','142143144.5E-7',[1,523.12E-2],[1,6,3,4,5]);
insert into tt5 values(5,[6,7],'test4','142143144.5E-7',[1,523.12E-2],[1,2,3,4,5]);
insert into tt5 values(6,null,'test4','142143144.5E-7',[1,523.12E-2],[5,2,3,4,5]);
insert into tt5 values(7,null,'test5','142143144.5E-7',[1,523.12E-2],[1,2,3,4,5]);
insert into tt5 values(8,[6,7],'test6','142143144.5E-7',[1,523.12E+2,1,6,9],[1,2,3,4,5]);
insert into tt5 values(9,[6,7],'test6','142143144.5E-7',null,[1,2,3,4,5]);
insert into tt5 values(20,[6,7],null,'142143144.5E-7',null,[1,2,3,4,6]);
select * from tt5 partition(p0);
+----+-------+-------+-------------+-----------------+-------------+
| id | v     | a     | d           | a1              | a2          |
+----+-------+-------+-------------+-----------------+-------------+
|  4 | [3,4] | test3 | 14.21431445 | [1,5.2312]      | [1,6,3,4,5] |
|  8 | [6,7] | test6 | 14.21431445 | [1,52312,1,6,9] | [1,2,3,4,5] |
| 20 | [6,7] | NULL  | 14.21431445 | NULL            | [1,2,3,4,6] |
+----+-------+-------+-------------+-----------------+-------------+
delete /*+enable_parallel_dml parallel(2) index(tt5 index_1) */ from tt5 partition(p0);
bug 2024103100104885714   《【宁波银行-专有云】4.2.1.6生产环境delete某一个分区却删除了3个分区的数据，导致丢数》
select * from tt5;
+----+-------+-------+-------------+------------+-------------+
| id | v     | a     | d           | a1         | a2          |
+----+-------+-------+-------------+------------+-------------+
|  1 | [1,2] | test  |       0.012 | [1,5.2512] | [1,2,3,4,5] |
|  5 | [6,7] | test4 | 14.21431445 | [1,5.2312] | [1,2,3,4,5] |
|  9 | [6,7] | test6 | 14.21431445 | NULL       | [1,2,3,4,5] |
|  2 | [1,2] | test1 |       0.015 | [1,5.2312] | [1,2,3,4,5] |
|  6 | NULL  | test4 | 14.21431445 | [1,5.2312] | [5,2,3,4,5] |
|  3 | [1,2] | test2 |       0.015 | [1,5.2312] | [1,2,3,4,5] |
|  7 | NULL  | test5 | 14.21431445 | [1,5.2312] | [1,2,3,4,5] |
+----+-------+-------+-------------+------------+-------------+
drop table tt3;
create table tt3(id bigint not null primary key,`force` int[],`where`array(varchar(50)));
insert into tt3 values(1,[1,2,3,4],['test']);
select * from tt3;
+----+-----------+----------+
| id | force     | where    |
+----+-----------+----------+
|  1 | [1,2,3,4] | ["test"] |
+----+-----------+----------+
select id,force,where from tt3;
ERROR 42000: You have an error in your SQL syntax; check the manual that corresponds to your OceanBase version for the right syntax to use near 'force,where from tt3' at line 1
select id,where from tt3;
ERROR 42000: You have an error in your SQL syntax; check the manual that corresponds to your OceanBase version for the right syntax to use near 'from tt3' at line 1
select * from tt3 where id=1;
+----+-----------+----------+
| id | force     | where    |
+----+-----------+----------+
|  1 | [1,2,3,4] | ["test"] |
+----+-----------+----------+
select * from tt3 where where=['test'];
ERROR 42000: You have an error in your SQL syntax; check the manual that corresponds to your OceanBase version for the right syntax to use near '=['test']' at line 1
drop table tt5;
create table tt5(id int primary key,v vector(2), a varchar(100),d double,a1 array(float),a2 int[])
PARTITION BY range COLUMNS(id)(
PARTITION p0 values less than(19),
PARTITION p1 values less than(25),
PARTITION p2 values less than(30)
);
drop view vtt5;
create view vtt5 as select * from tt5;
insert into tt5 values(1,[1,2],'test','1.2E-2',[1,525.12E-2],[1,2,3,4,5]);
insert into tt5 values(2,[1,2],'test1','1.5E-2',[1,523.12E-2],[1,2,3,4,5]);
insert into tt5 values(3,[1,2],'test2','1.5E-2',[1,523.12E-2],[1,2,3,4,5]);
insert into tt5 values(4,[3,4],'test3','142143144.5E-7',[1,523.12E-2],[1,6,3,4,5]);
insert into tt5 values(5,[6,7],'test4','142143144.5E-7',[1,523.12E-2],[1,2,3,4,5]);
insert into tt5 values(6,null,'test4','142143144.5E-7',[1,523.12E-2],[5,2,3,4,5]);
insert into tt5 values(7,null,'test5','142143144.5E-7',[1,523.12E-2],[1,2,3,4,5]);
insert into tt5 values(8,[6,7],'test6','142143144.5E-7',[1,523.12E+2,1,6,9],[1,2,3,4,5]);
insert into tt5 values(9,[6,7],'test6','142143144.5E-7',null,[1,2,3,4,5]);
insert into tt5 values(20,[6,7],null,'142143144.5E-7',null,[1,2,3,4,6]);
drop table tt6;
create table tt6(id int primary key,v vector(2), a varchar(100),d double,a1 array(float),a2 int[])
PARTITION BY range COLUMNS(id)(
PARTITION p0 values less than(19),
PARTITION p1 values less than(25),
PARTITION p2 values less than(30)
);
drop view vtt6;
create view vtt6 as select * from tt6;
insert into tt6 values(1,[1,2],'test','1.2E-2',[1,525.12E-2],[1,2,3,4,5]);
insert into tt6 values(2,[1,2],'test1','1.5E-2',[1,523.12E-2],[1,2,3,4,5]);
insert into tt6 values(3,[1,2],'test2','1.5E-2',[1,523.12E-2],[1,2,3,4,5]);
insert into tt6 values(4,[3,4],'test3','142143144.5E-7',[1,523.12E-2],[1,6,3,4,5]);
insert into tt6 values(5,[6,7],'test4','142143144.5E-7',[1,523.12E-2],[1,2,3,4,5]);
insert into tt6 values(6,null,'test4','142143144.5E-7',[1,523.12E-2],[5,2,3,4,5]);
insert into tt6 values(7,null,'test5','142143144.5E-7',[1,523.12E-2],[1,2,3,4,5]);
insert into tt6 values(8,[6,7],'test6','142143144.5E-7',[1,523.12E+2,1,6,9],[1,2,3,4,5]);
insert into tt6 values(9,[6,7],'test6','142143144.5E-7',null,[1,2,3,4,5]);
insert into tt6 values(20,[6,7],null,'142143144.5E-7',null,[1,2,3,4,6]);
select * from tt5 UNION ALL select * from tt6;
+----+-------+-------+-------------+-----------------+-------------+
| id | v     | a     | d           | a1              | a2          |
+----+-------+-------+-------------+-----------------+-------------+
|  1 | [1,2] | test  |       0.012 | [1,5.2512]      | [1,2,3,4,5] |
|  2 | [1,2] | test1 |       0.015 | [1,5.2312]      | [1,2,3,4,5] |
|  3 | [1,2] | test2 |       0.015 | [1,5.2312]      | [1,2,3,4,5] |
|  4 | [3,4] | test3 | 14.21431445 | [1,5.2312]      | [1,6,3,4,5] |
|  5 | [6,7] | test4 | 14.21431445 | [1,5.2312]      | [1,2,3,4,5] |
|  6 | NULL  | test4 | 14.21431445 | [1,5.2312]      | [5,2,3,4,5] |
|  7 | NULL  | test5 | 14.21431445 | [1,5.2312]      | [1,2,3,4,5] |
|  8 | [6,7] | test6 | 14.21431445 | [1,52312,1,6,9] | [1,2,3,4,5] |
|  9 | [6,7] | test6 | 14.21431445 | NULL            | [1,2,3,4,5] |
|  1 | [1,2] | test  |       0.012 | [1,5.2512]      | [1,2,3,4,5] |
|  2 | [1,2] | test1 |       0.015 | [1,5.2312]      | [1,2,3,4,5] |
|  3 | [1,2] | test2 |       0.015 | [1,5.2312]      | [1,2,3,4,5] |
|  4 | [3,4] | test3 | 14.21431445 | [1,5.2312]      | [1,6,3,4,5] |
|  5 | [6,7] | test4 | 14.21431445 | [1,5.2312]      | [1,2,3,4,5] |
|  6 | NULL  | test4 | 14.21431445 | [1,5.2312]      | [5,2,3,4,5] |
|  7 | NULL  | test5 | 14.21431445 | [1,5.2312]      | [1,2,3,4,5] |
|  8 | [6,7] | test6 | 14.21431445 | [1,52312,1,6,9] | [1,2,3,4,5] |
|  9 | [6,7] | test6 | 14.21431445 | NULL            | [1,2,3,4,5] |
| 20 | [6,7] | NULL  | 14.21431445 | NULL            | [1,2,3,4,6] |
| 20 | [6,7] | NULL  | 14.21431445 | NULL            | [1,2,3,4,6] |
+----+-------+-------+-------------+-----------------+-------------+
select a1,a2 from tt5 UNION ALL select a1 ,a2 from tt6;
+-----------------+-------------+
| a1              | a2          |
+-----------------+-------------+
| [1,5.2512]      | [1,2,3,4,5] |
| [1,5.2312]      | [1,2,3,4,5] |
| [1,5.2312]      | [1,2,3,4,5] |
| [1,5.2312]      | [1,6,3,4,5] |
| [1,5.2312]      | [1,2,3,4,5] |
| [1,5.2312]      | [5,2,3,4,5] |
| [1,5.2312]      | [1,2,3,4,5] |
| [1,52312,1,6,9] | [1,2,3,4,5] |
| NULL            | [1,2,3,4,5] |
| NULL            | [1,2,3,4,6] |
| [1,5.2512]      | [1,2,3,4,5] |
| [1,5.2312]      | [1,2,3,4,5] |
| [1,5.2312]      | [1,2,3,4,5] |
| [1,5.2312]      | [1,6,3,4,5] |
| [1,5.2312]      | [1,2,3,4,5] |
| [1,5.2312]      | [5,2,3,4,5] |
| [1,5.2312]      | [1,2,3,4,5] |
| [1,52312,1,6,9] | [1,2,3,4,5] |
| NULL            | [1,2,3,4,5] |
| NULL            | [1,2,3,4,6] |
+-----------------+-------------+
select * from tt5 UNION select * from tt6;
+----+-------+-------+-------------+-----------------+-------------+
| id | v     | a     | d           | a1              | a2          |
+----+-------+-------+-------------+-----------------+-------------+
|  1 | [1,2] | test  |       0.012 | [1,5.2512]      | [1,2,3,4,5] |
|  2 | [1,2] | test1 |       0.015 | [1,5.2312]      | [1,2,3,4,5] |
|  3 | [1,2] | test2 |       0.015 | [1,5.2312]      | [1,2,3,4,5] |
|  4 | [3,4] | test3 | 14.21431445 | [1,5.2312]      | [1,6,3,4,5] |
|  5 | [6,7] | test4 | 14.21431445 | [1,5.2312]      | [1,2,3,4,5] |
|  6 | NULL  | test4 | 14.21431445 | [1,5.2312]      | [5,2,3,4,5] |
|  7 | NULL  | test5 | 14.21431445 | [1,5.2312]      | [1,2,3,4,5] |
|  8 | [6,7] | test6 | 14.21431445 | [1,52312,1,6,9] | [1,2,3,4,5] |
|  9 | [6,7] | test6 | 14.21431445 | NULL            | [1,2,3,4,5] |
| 20 | [6,7] | NULL  | 14.21431445 | NULL            | [1,2,3,4,6] |
+----+-------+-------+-------------+-----------------+-------------+
bug 2024121600106491380   《【obmysql_array二期】分区表含有array类型，MINUS,UNION,INTERSECT 只返回array时，报5083，非分区表正常返回》
select a1 from tt5 UNION select a1 from tt6;
ERROR 22000: Invalid data type for the operation
bug 2024121600106491380   《【obmysql_array二期】分区表含有array类型，MINUS,UNION,INTERSECT 只返回array时，报5083，非分区表正常返回》
select a2,a1 from tt5 UNION select a2,a1 from tt6;
ERROR 22000: Invalid data type for the operation
select * from tt5 INTERSECT  select * from tt6;
+----+-------+-------+-------------+-----------------+-------------+
| id | v     | a     | d           | a1              | a2          |
+----+-------+-------+-------------+-----------------+-------------+
|  1 | [1,2] | test  |       0.012 | [1,5.2512]      | [1,2,3,4,5] |
|  2 | [1,2] | test1 |       0.015 | [1,5.2312]      | [1,2,3,4,5] |
|  3 | [1,2] | test2 |       0.015 | [1,5.2312]      | [1,2,3,4,5] |
|  4 | [3,4] | test3 | 14.21431445 | [1,5.2312]      | [1,6,3,4,5] |
|  5 | [6,7] | test4 | 14.21431445 | [1,5.2312]      | [1,2,3,4,5] |
|  6 | NULL  | test4 | 14.21431445 | [1,5.2312]      | [5,2,3,4,5] |
|  7 | NULL  | test5 | 14.21431445 | [1,5.2312]      | [1,2,3,4,5] |
|  8 | [6,7] | test6 | 14.21431445 | [1,52312,1,6,9] | [1,2,3,4,5] |
|  9 | [6,7] | test6 | 14.21431445 | NULL            | [1,2,3,4,5] |
| 20 | [6,7] | NULL  | 14.21431445 | NULL            | [1,2,3,4,6] |
+----+-------+-------+-------------+-----------------+-------------+
bug 2024121600106491380   《【obmysql_array二期】分区表含有array类型，MINUS,UNION,INTERSECT 只返回array时，报5083，非分区表正常返回》
select a1 from tt5 INTERSECT  select a1 from tt6;
ERROR 22000: Invalid data type for the operation
select * from tt5 MINUS   select * from tt6;
+----+------+------+------+------+------+
| id | v    | a    | d    | a1   | a2   |
+----+------+------+------+------+------+
+----+------+------+------+------+------+
select * from vtt5 MINUS   select * from vtt6;
+----+------+------+------+------+------+
| id | v    | a    | d    | a1   | a2   |
+----+------+------+------+------+------+
+----+------+------+------+------+------+
bug 2024121600106491380   《【obmysql_array二期】分区表含有array类型，MINUS,UNION,INTERSECT 只返回array时，报5083，非分区表正常返回》
select a1 from tt5 MINUS  select a1 from tt6;
ERROR 22000: Invalid data type for the operation
bug 2024121600106491380   《【obmysql_array二期】分区表含有array类型，MINUS,UNION,INTERSECT 只返回array时，报5083，非分区表正常返回》
select a1 from tt5 MINUS  select a1 from vtt6;
ERROR 22000: Invalid data type for the operation
select array_agg(id) a from tt5 UNION ALL  select array_agg(id)  a from tt6;
+------------------------+
| a                      |
+------------------------+
| [1,2,3,4,5,6,7,8,9,20] |
| [1,2,3,4,5,6,7,8,9,20] |
+------------------------+
select array_agg(id) a from tt5 MINUS   select array_agg(id)  a from tt6;
+------+
| a    |
+------+
+------+
select array_agg(id) a from tt5 UNION  select array_agg(id)  a from tt6;
+------------------------+
| a                      |
+------------------------+
| [1,2,3,4,5,6,7,8,9,20] |
+------------------------+
select array_agg(id) a from tt5 INTERSECT  select array_agg(id)  a from tt6;
+------------------------+
| a                      |
+------------------------+
| [1,2,3,4,5,6,7,8,9,20] |
+------------------------+
select rb_build(a2) a from tt5 UNION ALL  select rb_build(a2)  a from tt6;
+-------------------------+
| a                       |
+-------------------------+
|                 |
|                 |
|                 |
|                 |
|                 |
|                  |
|                 |
|                 |
|                 |
|                 |
|                 |
|                 |
|                 |
|                 |
|                 |
|                  |
|                 |
|                 |
|                 |
|                 |
+-------------------------+
select rb_build(a2) a from tt5 MINUS   select rb_build(a2)  a from tt6;
ERROR 22000: Invalid data type for the operation
select rb_build(a2) a from tt5 UNION  select rb_build(a2)  a from tt6;
ERROR 22000: Invalid data type for the operation
select rb_build(a2) a from tt5 INTERSECT  select rb_build(a2)  a from tt6;
ERROR 22000: Invalid data type for the operation
select rb_build(a2) a from tt5 UNION ALL  select rb_build(a2)  a from vtt6;
+-------------------------+
| a                       |
+-------------------------+
|                 |
|                 |
|                 |
|                 |
|                 |
|                  |
|                 |
|                 |
|                 |
|                 |
|                 |
|                 |
|                 |
|                 |
|                 |
|                  |
|                 |
|                 |
|                 |
|                 |
+-------------------------+
select rb_build(a2) a from tt5 MINUS   select rb_build(a2)  a from vtt6;
ERROR 22000: Invalid data type for the operation
select rb_build(a2) a from tt5 UNION  select rb_build(a2)  a from vtt6;
ERROR 22000: Invalid data type for the operation
select rb_build(a2) a from tt5 INTERSECT  select rb_build(a2)  a from vtt6;
ERROR 22000: Invalid data type for the operation
select cardinality(a2) a from tt5 UNION ALL  select cardinality(a2)  a from tt6;
+------+
| a    |
+------+
|    5 |
|    5 |
|    5 |
|    5 |
|    5 |
|    5 |
|    5 |
|    5 |
|    5 |
|    5 |
|    5 |
|    5 |
|    5 |
|    5 |
|    5 |
|    5 |
|    5 |
|    5 |
|    5 |
|    5 |
+------+
select cardinality(a2) a from tt5 MINUS   select cardinality(a2)  a from tt6;
+------+
| a    |
+------+
+------+
select cardinality(a2) a from tt5 UNION  select cardinality(a2)  a from tt6;
+------+
| a    |
+------+
|    5 |
+------+
select cardinality(a2) a from tt5 INTERSECT  select cardinality(a2)  a from tt6;
+------+
| a    |
+------+
|    5 |
+------+
select array_overlaps(a2,a2) a from tt5 UNION ALL  select array_overlaps(a2,a2)  a from tt6;
+------+
| a    |
+------+
|    1 |
|    1 |
|    1 |
|    1 |
|    1 |
|    1 |
|    1 |
|    1 |
|    1 |
|    1 |
|    1 |
|    1 |
|    1 |
|    1 |
|    1 |
|    1 |
|    1 |
|    1 |
|    1 |
|    1 |
+------+
select array_overlaps(a2,a2) a from tt5 MINUS   select array_overlaps(a2,a2)  a from tt6;
+------+
| a    |
+------+
+------+
select array_overlaps(a2,a2) a from tt5 UNION  select array_overlaps(a2,a2)  a from tt6;
+------+
| a    |
+------+
|    1 |
+------+
select array_overlaps(a2,a2) a from tt5 INTERSECT  select array_overlaps(a2,a2)  a from tt6;
+------+
| a    |
+------+
|    1 |
+------+
select array_contains_all(a2,a2) a from tt5 UNION ALL  select array_contains_all(a2,a2)  a from tt6;
+------+
| a    |
+------+
|    1 |
|    1 |
|    1 |
|    1 |
|    1 |
|    1 |
|    1 |
|    1 |
|    1 |
|    1 |
|    1 |
|    1 |
|    1 |
|    1 |
|    1 |
|    1 |
|    1 |
|    1 |
|    1 |
|    1 |
+------+
select array_contains_all(a2,a2) a from tt5 MINUS   select array_contains_all(a2,a2)  a from tt6;
+------+
| a    |
+------+
+------+
select array_contains_all(a2,a2) a from tt5 UNION  select array_contains_all(a2,a2)  a from tt6;
+------+
| a    |
+------+
|    1 |
+------+
select array_contains_all(a2,a2) a from tt5 INTERSECT  select array_contains_all(a2,a2)  a from tt6;
+------+
| a    |
+------+
|    1 |
+------+
select array_to_string(a2,'-') a from tt5 UNION ALL  select array_to_string(a2,'-')  a from tt6;
+-----------+
| a         |
+-----------+
| 1-2-3-4-5 |
| 1-2-3-4-5 |
| 1-2-3-4-5 |
| 1-6-3-4-5 |
| 1-2-3-4-5 |
| 5-2-3-4-5 |
| 1-2-3-4-5 |
| 1-2-3-4-5 |
| 1-2-3-4-5 |
| 1-2-3-4-6 |
| 1-2-3-4-5 |
| 1-2-3-4-5 |
| 1-2-3-4-5 |
| 1-6-3-4-5 |
| 1-2-3-4-5 |
| 5-2-3-4-5 |
| 1-2-3-4-5 |
| 1-2-3-4-5 |
| 1-2-3-4-5 |
| 1-2-3-4-6 |
+-----------+
select array_to_string(a2,'-') a from tt5 MINUS   select array_to_string(a2,'-')  a from tt6;
+------+
| a    |
+------+
+------+
select array_to_string(a2,'-') a from tt5 UNION  select array_to_string(a2,'-')  a from tt6;
+-----------+
| a         |
+-----------+
| 1-2-3-4-5 |
| 1-6-3-4-5 |
| 5-2-3-4-5 |
| 1-2-3-4-6 |
+-----------+
select array_to_string(a2,'-') a from tt5 INTERSECT  select array_to_string(a2,'-')  a from tt6;
+-----------+
| a         |
+-----------+
| 1-2-3-4-5 |
| 1-6-3-4-5 |
| 5-2-3-4-5 |
| 1-2-3-4-6 |
+-----------+
select array_to_string(a2,'-') a from tt5 UNION ALL  select array_to_string(a2,'-')  a from vtt6;
+-----------+
| a         |
+-----------+
| 1-2-3-4-5 |
| 1-2-3-4-5 |
| 1-2-3-4-5 |
| 1-6-3-4-5 |
| 1-2-3-4-5 |
| 5-2-3-4-5 |
| 1-2-3-4-5 |
| 1-2-3-4-5 |
| 1-2-3-4-5 |
| 1-2-3-4-6 |
| 1-2-3-4-5 |
| 1-2-3-4-5 |
| 1-2-3-4-5 |
| 1-6-3-4-5 |
| 1-2-3-4-5 |
| 5-2-3-4-5 |
| 1-2-3-4-5 |
| 1-2-3-4-5 |
| 1-2-3-4-5 |
| 1-2-3-4-6 |
+-----------+
select array_to_string(a2,'-') a from tt5 MINUS   select array_to_string(a2,'-')  a from vtt6;
+------+
| a    |
+------+
+------+
select array_to_string(a2,'-') a from tt5 UNION  select array_to_string(a2,'-')  a from vtt6;
+-----------+
| a         |
+-----------+
| 1-2-3-4-5 |
| 1-6-3-4-5 |
| 5-2-3-4-5 |
| 1-2-3-4-6 |
+-----------+
select array_to_string(a2,'-') a from tt5 INTERSECT  select array_to_string(a2,'-')  a from vtt6;
+-----------+
| a         |
+-----------+
| 1-2-3-4-5 |
| 1-6-3-4-5 |
| 5-2-3-4-5 |
| 1-2-3-4-6 |
+-----------+
########清空回收站，删除测试数据库，表等 ##########
drop database  IF EXISTS  oblrp;
purge recyclebin;
