purge recyclebin;
drop database IF EXISTS oblrp;
create database oblrp;
use oblrp;
set timestamp = 1600000000;
set ob_trx_timeout = 10000000000;
set ob_query_timeout = 10000000000;
SET SESSION group_concat_max_len = 100000000;
set ob_default_lob_inrow_threshold = 0;
result_format: 4
drop table tt1;
create table tt1(id int,c1 array(int), c2 array(varchar(256)), c3 tinyint[][], c4 array(bigint), c5 array(float), c6 array(double), c7 array(smallint));
insert into tt1 values(1,[-2147483648,0, 2147483647],['test'],[[127,0,-128],[8,9]],[-9223372036854775808,9223372036854775807,775,808,2,0],[3.402, 0, 1.175],
[1.7976931348623157E+308, 2.2250738585072014E-308],[-32768,0,32767]);
insert into tt1 values(2,[-2147483648,0, 2147483647,4],['test'],[[127,0,-128],[8,9]],[-9223372,9223372036854775807,775,808,2,0,1],[3.402, 0, 1.175,4],
[1.7976931348623157E+308,1.2,2.2250738585072014E-308],[-32768,0,32767,0]);
insert into tt1 values(3,[-2,0, 25,4],['test'],[[127,0,-128],[8,9,10]],[-922,9223372036854775807,775,808,2,0,1],[3.402, 0, 1.175,4],
[1.7976931348623157E+308,1.2,2.2250738585072014E-308],[-32768,0,32767,0]);
drop view vtt1;
create view vtt1 as select * from tt1;
select * from tt1 order by c1,c2;
ERROR 22000: Invalid data type for the operation
drop table tt2;
create table tt2(id int,c1 array(int unsigned), c2 array(varchar(256)), c3 array(tinyint unsigned), c4 array(bigint unsigned), c5 array(float), c6 array(double), c7 array(smallint unsigned))
PARTITION BY range COLUMNS(id)(
PARTITION p0 values less than(19),
PARTITION p1 values less than(25),
PARTITION p2 values less than(30)
);
insert into tt2 values(1,[2147483648,0, 2147483647],['test'],[52,0,5],[ 852,9223372036854775807,775,808,2,0],[3.402, 0, 1.175],
[1.7976931348623157E+308, 2.2250738585072014E-308],[88,0,32767]);
insert into tt2 values(2,[87666,0, 2147483647,4],['test'],[5,0,7,6,50],[1,100000,9223372036854775807,775,808,2,0,1],[3.402, 0, 1.175,4],
[1.7976931348623157E+308,1.2,2.2250738585072014E-308],[68,0,32767,0,1]);
drop view vtt2;
create view vtt2 as select * from tt2;
select /*+ OPT_PARAM('enable_rich_vector_format', 'FALSE') */ rb_build(c1) from tt2;
+---------------------+
| rb_build(c1)        |
+---------------------+
|     ˇˇˇ   Ä         |
|        rV ˇˇˇ    |
+---------------------+
select /*+ OPT_PARAM('rowsets_enabled', 'FALSE') */ rb_build(c1) from tt2;
+---------------------+
| rb_build(c1)        |
+---------------------+
|     ˇˇˇ   Ä         |
|        rV ˇˇˇ    |
+---------------------+
select /*+ OPT_PARAM('enable_rich_vector_format', 'FALSE') */ rb_build(c1) from vtt2;
+---------------------+
| rb_build(c1)        |
+---------------------+
|     ˇˇˇ   Ä         |
|        rV ˇˇˇ    |
+---------------------+
select /*+ OPT_PARAM('rowsets_enabled', 'FALSE') */ rb_build(c1) from vtt2;
+---------------------+
| rb_build(c1)        |
+---------------------+
|     ˇˇˇ   Ä         |
|        rV ˇˇˇ    |
+---------------------+
select /*+ OPT_PARAM('enable_rich_vector_format', 'FALSE') */ rb_build(c1) from vtt1;
+---------------------+
| rb_build(c1)        |
+---------------------+
|     ˇˇˇ   Ä         |
|        ˇˇˇ   Ä     |
|           ˛ˇˇˇ     |
+---------------------+
select /*+ OPT_PARAM('rowsets_enabled', 'FALSE') */ rb_build(c1) from vtt1;
+---------------------+
| rb_build(c1)        |
+---------------------+
|     ˇˇˇ   Ä         |
|        ˇˇˇ   Ä     |
|           ˛ˇˇˇ     |
+---------------------+
select /*+ OPT_PARAM('enable_rich_vector_format', 'FALSE') */ array_agg(c1) from tt1;
+-----------------------------------------------------------------------+
| array_agg(c1)                                                         |
+-----------------------------------------------------------------------+
| [[-2147483648,0,2147483647],[-2147483648,0,2147483647,4],[-2,0,25,4]] |
+-----------------------------------------------------------------------+
select /*+ OPT_PARAM('rowsets_enabled', 'FALSE') */ rb_build(c1) from tt1;
+---------------------+
| rb_build(c1)        |
+---------------------+
|     ˇˇˇ   Ä         |
|        ˇˇˇ   Ä     |
|           ˛ˇˇˇ     |
+---------------------+
select /*+ OPT_PARAM('rowsets_enabled', 'FALSE') */ /*+ OPT_PARAM('enable_rich_vector_format', 'FALSE') */  rb_build(c1) from tt1;
+---------------------+
| rb_build(c1)        |
+---------------------+
|     ˇˇˇ   Ä         |
|        ˇˇˇ   Ä     |
|           ˛ˇˇˇ     |
+---------------------+
select rb_build(c1),rb_build(c3),rb_build(c4),rb_build(c7)  from tt2;
+---------------------+-------------------------+-------------------------------------------------------------+---------------------+
| rb_build(c1)        | rb_build(c3)            | rb_build(c4)                                                | rb_build(c7)        |
+---------------------+-------------------------+-------------------------------------------------------------+---------------------+
|     ˇˇˇ   Ä         |        4            |                T      (            ˇˇˇˇˇˇˇ                |     ˇ  X         |
|        rV ˇˇˇ    |              2    |                       (            ˇˇˇˇˇˇˇ†Ü               |        ˇ  D     |
+---------------------+-------------------------+-------------------------------------------------------------+---------------------+
select rb_build(array(null));
ERROR 42000: Null value
select rb_build([0]);
+---------------+
| rb_build([0]) |
+---------------+
|             |
+---------------+
select rb_to_string(rb_build([4294967296]));
+--------------------------------------+
| rb_to_string(rb_build([4294967296])) |
+--------------------------------------+
| 4294967296                           |
+--------------------------------------+
select rb_to_string(rb_build([4294967295]));
+--------------------------------------+
| rb_to_string(rb_build([4294967295])) |
+--------------------------------------+
| 4294967295                           |
+--------------------------------------+
select rb_build([1,4294967295]);
+--------------------------+
| rb_build([1,4294967295]) |
+--------------------------+
|    ˇˇˇˇ                  |
+--------------------------+
bug 2024111100105047559   „Ää[obmysql_array‰∫åÊúü]arrayÂèÇÊï∞‰∏≠ÁöÑÂÖÉÁ¥†ÂêåÊó∂bigint ÊúâÁ¨¶Âè∑ÂÄºÂíåÊó†Á¨¶Âè∑ÂÄºÔºåobËøîÂõûÁöÑÊòØ‰ºöËΩ¨Êç¢ÊàêÊúâÁ¨¶Âè∑ÊúÄÂ§ßÂÄº„Äã
select rb_to_string(rb_build([18446744073709551615,1]));
+--------------------------------------------------+
| rb_to_string(rb_build([18446744073709551615,1])) |
+--------------------------------------------------+
| 1,9223372036854775807                            |
+--------------------------------------------------+
select rb_to_string(rb_build([1,2,3,4,5,6,7,8,9,11,12,13,14,15,16,17,18,19,20,21,22,23,25,24,26,27,28,29,30,31,32]));
+---------------------------------------------------------------------------------------------------------------+
| rb_to_string(rb_build([1,2,3,4,5,6,7,8,9,11,12,13,14,15,16,17,18,19,20,21,22,23,25,24,26,27,28,29,30,31,32])) |
+---------------------------------------------------------------------------------------------------------------+
| 1,2,3,4,5,6,7,8,9,11,12,13,14,15,16,17,18,19,20,21,22,23,24,25,26,27,28,29,30,31,32                           |
+---------------------------------------------------------------------------------------------------------------+
select rb_build([1,2,3,4,5,6,7,8,9,11,12,13,14,15,16,17,18,19,20,21,22,23,25,24,26,27,28,29,30,31,32]);
+---------------------------------------------------------------------------------------------------------------------------------+
| rb_build([1,2,3,4,5,6,7,8,9,11,12,13,14,15,16,17,18,19,20,21,22,23,25,24,26,27,28,29,30,31,32])                                 |
+---------------------------------------------------------------------------------------------------------------------------------+
|                         	                                                                       |
+---------------------------------------------------------------------------------------------------------------------------------+
select rb_build([[1,2,3,4,5,6,7,8,9,11,12,13,14,15,16,17,18,19,20,21,22,23,25,24,26,27,28,29,30,31,32]]);
+---------------------------------------------------------------------------------------------------------------------------------+
| rb_build([[1,2,3,4,5,6,7,8,9,11,12,13,14,15,16,17,18,19,20,21,22,23,25,24,26,27,28,29,30,31,32]])                               |
+---------------------------------------------------------------------------------------------------------------------------------+
|                         	                                                                       |
+---------------------------------------------------------------------------------------------------------------------------------+
select rb_to_string(rb_build([1,2,3,4,5,6,7,8,9,11,12,13,14,15,16,17,18,19,20,21,22,23,25,24,26,27,28,29,30,31,4294967296]));
+-----------------------------------------------------------------------------------------------------------------------+
| rb_to_string(rb_build([1,2,3,4,5,6,7,8,9,11,12,13,14,15,16,17,18,19,20,21,22,23,25,24,26,27,28,29,30,31,4294967296])) |
+-----------------------------------------------------------------------------------------------------------------------+
| 1,2,3,4,5,6,7,8,9,11,12,13,14,15,16,17,18,19,20,21,22,23,24,25,26,27,28,29,30,31,4294967296                           |
+-----------------------------------------------------------------------------------------------------------------------+
select rb_build([1,2,3,4,5,6,7,8,9,11,12,13,14,15,16,17,18,19,20,21,22,23,25,24,26,27,28,29,30,31,4294967296]);
+-------------------------------------------------------------------------------------------------------------------------------------------------------------------------------------------------------------------------------------------------------------+
| rb_build([1,2,3,4,5,6,7,8,9,11,12,13,14,15,16,17,18,19,20,21,22,23,25,24,26,27,28,29,30,31,4294967296])                                                                                                                                                     |
+-------------------------------------------------------------------------------------------------------------------------------------------------------------------------------------------------------------------------------------------------------------+
|                                                         	                                                                                                                                                                  |
+-------------------------------------------------------------------------------------------------------------------------------------------------------------------------------------------------------------------------------------------------------------+
select rb_to_string(rb_build([1,2,3,4,5,6,7,8,9,11,12,13,14,15,16,17,18,19,20,21,22,23,25,24,26,27,28,29,30,31,4294967296]));
+-----------------------------------------------------------------------------------------------------------------------+
| rb_to_string(rb_build([1,2,3,4,5,6,7,8,9,11,12,13,14,15,16,17,18,19,20,21,22,23,25,24,26,27,28,29,30,31,4294967296])) |
+-----------------------------------------------------------------------------------------------------------------------+
| 1,2,3,4,5,6,7,8,9,11,12,13,14,15,16,17,18,19,20,21,22,23,24,25,26,27,28,29,30,31,4294967296                           |
+-----------------------------------------------------------------------------------------------------------------------+
select rb_build([1,2,3,4,5,6,7,8,9,11,12,13,14,15,16,17,18,19,20,21,22,23,25,24,26,27,28,29,30,31,4294967296]);
+-------------------------------------------------------------------------------------------------------------------------------------------------------------------------------------------------------------------------------------------------------------+
| rb_build([1,2,3,4,5,6,7,8,9,11,12,13,14,15,16,17,18,19,20,21,22,23,25,24,26,27,28,29,30,31,4294967296])                                                                                                                                                     |
+-------------------------------------------------------------------------------------------------------------------------------------------------------------------------------------------------------------------------------------------------------------+
|                                                         	                                                                                                                                                                  |
+-------------------------------------------------------------------------------------------------------------------------------------------------------------------------------------------------------------------------------------------------------------+
select rb_build([null]);
ERROR 42000: Null value
select rb_build([[[1],null],null]);
+-----------------------------+
| rb_build([[[1],null],null]) |
+-----------------------------+
|                          |
+-----------------------------+
select rb_build([1,null]);
ERROR 42000: Null value
select rb_to_string(rb_build([[1]]));
+-------------------------------+
| rb_to_string(rb_build([[1]])) |
+-------------------------------+
| 1                             |
+-------------------------------+
select rb_to_string(rb_build([[1],[2]]));
+-----------------------------------+
| rb_to_string(rb_build([[1],[2]])) |
+-----------------------------------+
| 1,2                               |
+-----------------------------------+
select rb_to_string(rb_build([1,2,3,4,5,6,7,8,9,11,12,13,14,15,16,17,18,19,20,21,22,23,25,24,26,27,28,29,4294967298,30,31,4294967296]));
+----------------------------------------------------------------------------------------------------------------------------------+
| rb_to_string(rb_build([1,2,3,4,5,6,7,8,9,11,12,13,14,15,16,17,18,19,20,21,22,23,25,24,26,27,28,29,4294967298,30,31,4294967296])) |
+----------------------------------------------------------------------------------------------------------------------------------+
| 1,2,3,4,5,6,7,8,9,11,12,13,14,15,16,17,18,19,20,21,22,23,24,25,26,27,28,29,30,31,4294967296,4294967298                           |
+----------------------------------------------------------------------------------------------------------------------------------+
select rb_build([1,2,3,4,5,6,7,8,9,11,12,13,14,15,16,17,18,19,20,21,22,23,25,24,26,27,28,29,30,4294967298,31,4294967296]);
+---------------------------------------------------------------------------------------------------------------------------------------------------------------------------------------------------------------------------------------------------------------------+
| rb_build([1,2,3,4,5,6,7,8,9,11,12,13,14,15,16,17,18,19,20,21,22,23,25,24,26,27,28,29,30,4294967298,31,4294967296])                                                                                                                                                  |
+---------------------------------------------------------------------------------------------------------------------------------------------------------------------------------------------------------------------------------------------------------------------+
|                                                          	                                                                                                                                                                        |
+---------------------------------------------------------------------------------------------------------------------------------------------------------------------------------------------------------------------------------------------------------------------+
select rb_to_string(rb_build([1,2,3,4,5,6,7,8,9,11,12,13,14,15,16,17,18,19,20,21,22,23,25,24,26,27,28,29,4294967298,30,31,4294967296,34]));
+-------------------------------------------------------------------------------------------------------------------------------------+
| rb_to_string(rb_build([1,2,3,4,5,6,7,8,9,11,12,13,14,15,16,17,18,19,20,21,22,23,25,24,26,27,28,29,4294967298,30,31,4294967296,34])) |
+-------------------------------------------------------------------------------------------------------------------------------------+
| 1,2,3,4,5,6,7,8,9,11,12,13,14,15,16,17,18,19,20,21,22,23,24,25,26,27,28,29,30,31,34,4294967296,4294967298                           |
+-------------------------------------------------------------------------------------------------------------------------------------+
select rb_build([1,2,3,4,5,6,7,8,9,11,12,13,14,15,16,17,18,19,20,21,22,23,25,24,26,27,28,29,30,4294967298,31,4294967296,34]);
+-----------------------------------------------------------------------------------------------------------------------+
| rb_build([1,2,3,4,5,6,7,8,9,11,12,13,14,15,16,17,18,19,20,21,22,23,25,24,26,27,28,29,30,4294967298,31,4294967296,34]) |
+-----------------------------------------------------------------------------------------------------------------------+
|            :0                   	                      "    :0                |
+-----------------------------------------------------------------------------------------------------------------------+
select rb_to_string(rb_build([1,2,3,4,5,6,7,8,9,11,12,13,14,15,16,17,18,19,20,21,22,23,25,24,26,27,28,29,4294967294,30,31,4294967295,34]));
+-------------------------------------------------------------------------------------------------------------------------------------+
| rb_to_string(rb_build([1,2,3,4,5,6,7,8,9,11,12,13,14,15,16,17,18,19,20,21,22,23,25,24,26,27,28,29,4294967294,30,31,4294967295,34])) |
+-------------------------------------------------------------------------------------------------------------------------------------+
| 1,2,3,4,5,6,7,8,9,11,12,13,14,15,16,17,18,19,20,21,22,23,24,25,26,27,28,29,30,31,34,4294967294,4294967295                           |
+-------------------------------------------------------------------------------------------------------------------------------------+
select rb_build([1,2,3,4,5,6,7,8,9,11,12,13,14,15,16,17,18,19,20,21,22,23,25,24,26,27,28,29,30,4294967294,31,4294967293,34]);
+-----------------------------------------------------------------------------------------------------------------------+
| rb_build([1,2,3,4,5,6,7,8,9,11,12,13,14,15,16,17,18,19,20,21,22,23,25,24,26,27,28,29,30,4294967294,31,4294967293,34]) |
+-----------------------------------------------------------------------------------------------------------------------+
|            :0        ˇˇ    V           	                      " ˝ˇ˛ˇ                    |
+-----------------------------------------------------------------------------------------------------------------------+
select rb_to_string(rb_build([1,2,3,4,5,6,7,8,9,11,12,13,14,15,16,17,18,19,20,21,22,23,25,24,26,27,28,29,4294967294,30,31,4294967295,34]));
+-------------------------------------------------------------------------------------------------------------------------------------+
| rb_to_string(rb_build([1,2,3,4,5,6,7,8,9,11,12,13,14,15,16,17,18,19,20,21,22,23,25,24,26,27,28,29,4294967294,30,31,4294967295,34])) |
+-------------------------------------------------------------------------------------------------------------------------------------+
| 1,2,3,4,5,6,7,8,9,11,12,13,14,15,16,17,18,19,20,21,22,23,24,25,26,27,28,29,30,31,34,4294967294,4294967295                           |
+-------------------------------------------------------------------------------------------------------------------------------------+
bug 2024111100105047559   „Ää[obmysql_array‰∫åÊúü]arrayÂèÇÊï∞‰∏≠ÁöÑÂÖÉÁ¥† Âê´Êúâ‰∏çÂêåÁöÑÊï∞Â≠óÂûãÔºåobÂíåpg ËøîÂõûÂÄº‰∏ç‰∏ÄÊ†∑„Äã
select rb_to_string(rb_build([1,2,3,4,5,6,7,8,9,11,12,13,14,15,16,17,18,19,20,21,22,23,25,24,26,27,28,29,4294967294,30,31,4294967295,34,9223372036854775808,9223372036854775809]));
+-----------------------------------------------------------------------------------------------------------------------------------------------------------------------------+
| rb_to_string(rb_build([1,2,3,4,5,6,7,8,9,11,12,13,14,15,16,17,18,19,20,21,22,23,25,24,26,27,28,29,4294967294,30,31,4294967295,34,9223372036854775808,9223372036854775809])) |
+-----------------------------------------------------------------------------------------------------------------------------------------------------------------------------+
| 1,2,3,4,5,6,7,8,9,11,12,13,14,15,16,17,18,19,20,21,22,23,24,25,26,27,28,29,30,31,34,4294967294,4294967295,9223372036854775807                                               |
+-----------------------------------------------------------------------------------------------------------------------------------------------------------------------------+
select rb_to_string(rb_build([9223372036854775810,9223372036854775808,9223372036854775809]));
+---------------------------------------------------------------------------------------+
| rb_to_string(rb_build([9223372036854775810,9223372036854775808,9223372036854775809])) |
+---------------------------------------------------------------------------------------+
| 9223372036854775808,9223372036854775809,9223372036854775810                           |
+---------------------------------------------------------------------------------------+
select rb_to_string(rb_build([1,2,3,4,5,6,7,8,9,11,12,13,14,15,16,17,18,19,20,21,22,23,25,24,26,27,28,29,4294967294,30,31,4294967295,null]));
ERROR 42000: Null value
select rb_build([1,null]);
ERROR 42000: Null value
select rb_build([[1]]);
+-----------------+
| rb_build([[1]]) |
+-----------------+
|              |
+-----------------+
select rb_to_string(rb_build([[1]]));
+-------------------------------+
| rb_to_string(rb_build([[1]])) |
+-------------------------------+
| 1                             |
+-------------------------------+
select rb_to_string(rb_build([true,false]));
+--------------------------------------+
| rb_to_string(rb_build([true,false])) |
+--------------------------------------+
| 0,1                                  |
+--------------------------------------+
select rb_build([true,false,true,false]);
+-----------------------------------+
| rb_build([true,false,true,false]) |
+-----------------------------------+
|                               |
+-----------------------------------+
select rb_build([0,2]);
+-----------------+
| rb_build([0,2]) |
+-----------------+
|             |
+-----------------+
select rb_to_string(rb_build([0,0]));
+-------------------------------+
| rb_to_string(rb_build([0,0])) |
+-------------------------------+
| 0                             |
+-------------------------------+
select rb_build([0,2.0]);
ERROR 22000: Invalid data type for the operation
select rb_build(['test']);
ERROR 22000: Invalid data type for the operation
select rb_build(['Â∞èËµñ']);
ERROR 22000: Invalid data type for the operation
select rb_build([-1]);
+----------------+
| rb_build([-1]) |
+----------------+
| ˇˇˇˇ             |
+----------------+
select rb_to_string(rb_build([-1]));
+------------------------------+
| rb_to_string(rb_build([-1])) |
+------------------------------+
| 4294967295                   |
+------------------------------+
select rb_build([-1.7976931348623157E+308]);
ERROR 22000: Invalid data type for the operation
select rb_build([-9223372036854775808]);
ERROR HY000: Size overflow
select rb_build(array(-9223372036854775808));
ERROR HY000: Size overflow
select rb_build([-2147483648]);
+-------------------------+
| rb_build([-2147483648]) |
+-------------------------+
|    Ä                   |
+-------------------------+
select rb_build([-2147483649,11]);
ERROR HY000: Size overflow
select rb_to_string(rb_build([9223372036854775808]));
+-----------------------------------------------+
| rb_to_string(rb_build([9223372036854775808])) |
+-----------------------------------------------+
| 9223372036854775808                           |
+-----------------------------------------------+
bug 2024111100105047559   „Ää[obmysql_array‰∫åÊúü]arrayÂèÇÊï∞‰∏≠ÁöÑÂÖÉÁ¥† Âê´Êúâ‰∏çÂêåÁöÑÊï∞Â≠óÂûãÔºåobÂíåpg ËøîÂõûÂÄº‰∏ç‰∏ÄÊ†∑„Äã
select rb_to_string(rb_build([9223372036854775808,0]));
+-------------------------------------------------+
| rb_to_string(rb_build([9223372036854775808,0])) |
+-------------------------------------------------+
| 0,9223372036854775807                           |
+-------------------------------------------------+
select rb_to_string(rb_build([1.0,-9.1]));
ERROR 22000: Invalid data type for the operation
select rb_build(array(-9223372036854775808));
ERROR HY000: Size overflow
select rb_build(array(-2147483648));
+------------------------------+
| rb_build(array(-2147483648)) |
+------------------------------+
|    Ä                        |
+------------------------------+
select rb_to_string(rb_build([18446744073709551615,18446744073709551614]));
+---------------------------------------------------------------------+
| rb_to_string(rb_build([18446744073709551615,18446744073709551614])) |
+---------------------------------------------------------------------+
| 18446744073709551614,18446744073709551615                           |
+---------------------------------------------------------------------+
select rb_to_string(rb_build([18446744073709551616]));
+------------------------------------------------+
| rb_to_string(rb_build([18446744073709551616])) |
+------------------------------------------------+
| 9223372036854775807                            |
+------------------------------------------------+
select rb_to_string(rb_build([18446744073709551615,18446744073709551616]));
+---------------------------------------------------------------------+
| rb_to_string(rb_build([18446744073709551615,18446744073709551616])) |
+---------------------------------------------------------------------+
| 9223372036854775807                                                 |
+---------------------------------------------------------------------+
select rb_to_string(rb_build([18446744073709551615,-1]));
+---------------------------------------------------+
| rb_to_string(rb_build([18446744073709551615,-1])) |
+---------------------------------------------------+
| 4294967295,9223372036854775807                    |
+---------------------------------------------------+
select rb_to_string(rb_build([18446744073709551615,10]));
+---------------------------------------------------+
| rb_to_string(rb_build([18446744073709551615,10])) |
+---------------------------------------------------+
| 10,9223372036854775807                            |
+---------------------------------------------------+
drop table test;
create table test as select array(null) a;
select rb_build(a) from test;
ERROR 42000: Null value
select rb_build([1.7976931348623157E+308,2.2250738585072014E-308]);
ERROR 22000: Invalid data type for the operation
select rb_build([1,2,4,7,[23]]);
ERROR 22000: Invalid data type for the operation
select rb_build([1,2,4,7,'test']);
ERROR 22000: Invalid data type for the operation
drop table test;
create table test(a varchar(262144)[],a1 bigint[]);
insert into test values((SELECT CONCAT('[', GROUP_CONCAT(number ORDER BY number SEPARATOR ', '), ']') AS nums
FROM (
     SELECT FLOOR(1+RAND() * 1) AS number
    FROM TABLE(GENERATOR(100000))
) AS temp),(SELECT CONCAT('[', GROUP_CONCAT(number ORDER BY number SEPARATOR ', '), ']') AS nums
FROM (
     SELECT FLOOR(1+RAND() * 10000) AS number
    FROM TABLE(GENERATOR(10000))
) AS temp));
select rb_to_string(rb_build(a1)) from test;
select rb_build([[[[[[[1]]]]]]]);
ERROR 0A000: Not supported feature or function
select rb_build([[[[[[1]]]]]]);
+-------------------------+
| rb_build([[[[[[1]]]]]]) |
+-------------------------+
|                      |
+-------------------------+
select rb_build([[[[[[1,2,3,4,5],[5,6,7,8,9,10,11,12,13,14,15,16,17,18,19,20,21,22,23,24,25,26,27,28,29,30,31,32,33,35]]]]]]);
+------------------------------------------------------------------------------------------------------------------------+
| rb_build([[[[[[1,2,3,4,5],[5,6,7,8,9,10,11,12,13,14,15,16,17,18,19,20,21,22,23,24,25,26,27,28,29,30,31,32,33,35]]]]]]) |
+------------------------------------------------------------------------------------------------------------------------+
|            :0       !            	 
                        ! #                      |
+------------------------------------------------------------------------------------------------------------------------+
select rb_to_string(rb_build([[[[[[1,2,3,4,5],[5,6,7,8,9,10,11,12,13,14,15,16,17,18,19,20,21,22,23,24,25,26,27,28,29,30,31,32,33,35,-1]]]]]]));
+-----------------------------------------------------------------------------------------------------------------------------------------+
| rb_to_string(rb_build([[[[[[1,2,3,4,5],[5,6,7,8,9,10,11,12,13,14,15,16,17,18,19,20,21,22,23,24,25,26,27,28,29,30,31,32,33,35,-1]]]]]])) |
+-----------------------------------------------------------------------------------------------------------------------------------------+
| 1,2,3,4,5,6,7,8,9,10,11,12,13,14,15,16,17,18,19,20,21,22,23,24,25,26,27,28,29,30,31,32,33,35,4294967295                                 |
+-----------------------------------------------------------------------------------------------------------------------------------------+
select rb_build([[[[[[[1]]]]]]]);
ERROR 0A000: Not supported feature or function
select rb_build([b'11']);
ERROR 0A000: array element type not supported
select rb_build([0x010101000000]);
ERROR 0A000: array element type not supported
select rb_build(['[12]']);
ERROR 22000: Invalid data type for the operation
select rb_build(null);
+----------------+
| rb_build(null) |
+----------------+
| NULL           |
+----------------+
select rb_build(1);
ERROR 22000: invalid obj type for type promotion: left_type=ARRAY right_type=BIGINT
select rb_build('[23,3]');
ERROR 22000: invalid obj type for type promotion: left_type=ARRAY right_type=VARCHAR
select rb_build('');
ERROR 22000: invalid obj type for type promotion: left_type=ARRAY right_type=VARCHAR
select rb_build('teste');
ERROR 22000: invalid obj type for type promotion: left_type=ARRAY right_type=VARCHAR
select rb_build(cast('[1,2,3]' as json));
ERROR 22000: invalid obj type for type promotion: left_type=ARRAY right_type=JSON
select rb_build(rb_build([1,2]));
ERROR 22000: invalid obj type for type promotion: left_type=ARRAY right_type=ROARINGBITMAP
select rb_build(true);
ERROR 22000: invalid obj type for type promotion: left_type=ARRAY right_type=TINYINT
select rb_build(st_geomfromtext('MULTIPOINT (1 1, 2 2, 3 3)'));
ERROR 22000: invalid obj type for type promotion: left_type=ARRAY right_type=GEOMETRY
select rb_build(b'11');
ERROR 22000: invalid obj type for type promotion: left_type=ARRAY right_type=HEX_STRING
select rb_build(0x01010102);
ERROR 22000: invalid obj type for type promotion: left_type=ARRAY right_type=HEX_STRING
drop table tt3;
create table tt3(id int,id1 INTEGER unsigned,id2 BOOL,id3 SMALLINT unsigned,id4 MEDIUMINT,id5 SERIAL,id6 BIGINT);
insert into tt3 values(1,2,3,4,5,6,7);
select rb_build(id) from tt3;
ERROR 22000: invalid obj type for type promotion: left_type=ARRAY right_type=INT
select rb_build(id1) from tt3;
ERROR 22000: invalid obj type for type promotion: left_type=ARRAY right_type=INT UNSIGNED
select rb_build(id2) from tt3;
ERROR 22000: invalid obj type for type promotion: left_type=ARRAY right_type=TINYINT
select rb_build(id3) from tt3;
ERROR 22000: invalid obj type for type promotion: left_type=ARRAY right_type=SMALLINT UNSIGNED
select rb_build(id4) from tt3;
ERROR 22000: invalid obj type for type promotion: left_type=ARRAY right_type=MEDIUMINT
select rb_build(id5) from tt3;
ERROR 22000: invalid obj type for type promotion: left_type=ARRAY right_type=BIGINT UNSIGNED
select rb_build(id6) from tt3;
ERROR 22000: invalid obj type for type promotion: left_type=ARRAY right_type=BIGINT
drop table tt3;
create table tt3(id DECIMAL,id1 DECIMAL ZEROFILL,id2 NUMERIC,id3 FIXED unsigned,id4 FIXED,id5 NUMERIC unsigned);
insert into tt3 values(1,2,3,4,5,6);
select rb_build(id) from tt3;
ERROR 22000: invalid obj type for type promotion: left_type=ARRAY right_type=DECIMAL
select rb_build(id1) from tt3;
ERROR 22000: invalid obj type for type promotion: left_type=ARRAY right_type=DECIMAL UNSIGNED
select rb_build(id2) from tt3;
ERROR 22000: invalid obj type for type promotion: left_type=ARRAY right_type=DECIMAL
select rb_build(id3) from tt3;
ERROR 22000: invalid obj type for type promotion: left_type=ARRAY right_type=DECIMAL UNSIGNED
select rb_build(id4) from tt3;
ERROR 22000: invalid obj type for type promotion: left_type=ARRAY right_type=DECIMAL
select rb_build(id5) from tt3;
ERROR 22000: invalid obj type for type promotion: left_type=ARRAY right_type=DECIMAL UNSIGNED
drop table tt3;
create table tt3(id float,id1 float unsigned,id2 double,id3 double unsigned);
insert into tt3 values(1,2,3,4);
select rb_build(id) from tt3;
ERROR 22000: invalid obj type for type promotion: left_type=ARRAY right_type=FLOAT
select rb_build(id1) from tt3;
ERROR 22000: invalid obj type for type promotion: left_type=ARRAY right_type=FLOAT UNSIGNED
select rb_build(id2) from tt3;
ERROR 22000: invalid obj type for type promotion: left_type=ARRAY right_type=DOUBLE
select rb_build(id3) from tt3;
ERROR 22000: invalid obj type for type promotion: left_type=ARRAY right_type=DOUBLE UNSIGNED
select rb_build([id3]) from tt3;
ERROR 22000: Invalid data type for the operation
select array_agg(id3) from tt3;
+----------------+
| array_agg(id3) |
+----------------+
| [4]            |
+----------------+
drop table tt3;
create table tt3(id char(50),id1 varchar(50),id2 binary(50),id3 varbinary(50));
insert into tt3 values(1,2,3,4);
select rb_build(id) from tt3;
ERROR 22000: invalid obj type for type promotion: left_type=ARRAY right_type=CHAR
select rb_build(id1) from tt3;
ERROR 22000: invalid obj type for type promotion: left_type=ARRAY right_type=VARCHAR
select rb_build(id2) from tt3;
ERROR 22000: invalid obj type for type promotion: left_type=ARRAY right_type=CHAR
select rb_build(id3) from tt3;
ERROR 22000: invalid obj type for type promotion: left_type=ARRAY right_type=VARCHAR
select rb_build([id3]) from tt3;
ERROR 0A000: array element in binary type not supported
drop table tt3;
create table tt3(id date,id1 datetime,id2 timestamp,id3 time,id4 year);
insert into tt3 values('2010-1-1','2010-10-1 14:58:00','2010-10-1 14:58:00.9999','14:14:50','2010');
select rb_build(id) from tt3;
ERROR 22000: invalid obj type for type promotion: left_type=ARRAY right_type=MYSQL_DATE
select rb_build(id1) from tt3;
ERROR 22000: invalid obj type for type promotion: left_type=ARRAY right_type=MYSQL_DATETIME
select rb_build(id2) from tt3;
ERROR 22000: invalid obj type for type promotion: left_type=ARRAY right_type=TIMESTAMP
select rb_build(id3) from tt3;
ERROR 22000: invalid obj type for type promotion: left_type=ARRAY right_type=TIME
select rb_build([id3]) from tt3;
ERROR 0A000: array element type not supported
select array_agg(id) from tt3;
ERROR 0A000: array element type not supported
drop table tt3;
create table tt3(id TINYBLOB,id1 blob,id2 MEDIUMBLOB,id3 LONGBLOB);
insert into tt3 values(1,2,3,4);
select rb_build(id) from tt3;
ERROR 22000: invalid obj type for type promotion: left_type=ARRAY right_type=TINYTEXT
select rb_build(id1) from tt3;
ERROR 22000: invalid obj type for type promotion: left_type=ARRAY right_type=TEXT
select rb_build(id2) from tt3;
ERROR 22000: invalid obj type for type promotion: left_type=ARRAY right_type=MEDIUMTEXT
select rb_build(id3) from tt3;
ERROR 22000: invalid obj type for type promotion: left_type=ARRAY right_type=LONGTEXT
select rb_build([id3]) from tt3;
ERROR 0A000: array element type not supported
select array_agg(id) from tt3;
ERROR 0A000: array element type not supported
drop table tt3;
create table tt3(id TINYTEXT,id1 TEXT,id2 MEDIUMTEXT,id3 LONGTEXT);
insert into tt3 values('[1]','[2]','[3]','[4]');
select rb_build(id) from tt3;
ERROR 22000: invalid obj type for type promotion: left_type=ARRAY right_type=TINYTEXT
select rb_build(id1) from tt3;
ERROR 22000: invalid obj type for type promotion: left_type=ARRAY right_type=TEXT
select rb_build(id2) from tt3;
ERROR 22000: invalid obj type for type promotion: left_type=ARRAY right_type=MEDIUMTEXT
select rb_build(id3) from tt3;
ERROR 22000: invalid obj type for type promotion: left_type=ARRAY right_type=LONGTEXT
select rb_build([id3]) from tt3;
ERROR 0A000: array element type not supported
select array_agg(id) from tt3;
ERROR 0A000: array element type not supported
drop table tt3;
create table tt3(id SET('1','2'),id1 ENUM('1','2','3','4'),id2 JSON,id3 RoaringBitmap,id4 vector(2));
insert into tt3 values(1,2,'[1,2]',rb_from_string('1,2'),[2,3]);
select rb_build(id) from tt3;
ERROR 22000: invalid obj type for type promotion: left_type=ARRAY right_type=SET
select rb_build(id1) from tt3;
ERROR 22000: invalid obj type for type promotion: left_type=ARRAY right_type=ENUM
select rb_build(id2) from tt3;
ERROR 22000: invalid obj type for type promotion: left_type=ARRAY right_type=JSON
select rb_build(id3) from tt3;
ERROR 22000: invalid obj type for type promotion: left_type=ARRAY right_type=ROARINGBITMAP
select rb_build([[id4]]) from tt3;
ERROR 22000: Invalid data type for the operation
select rb_build(id4) from tt3;
ERROR 22000: Invalid data type for the operation
select array_agg(id4) from tt3;
+----------------+
| array_agg(id4) |
+----------------+
| [[2,3]]        |
+----------------+
drop table tt3;
create table tt3(id GEOMETRY,id1 POINT,id2 LINESTRING,id3 POLYGON,id4 MULTIPOINT,id5 MULTILINESTRING,id6 MULTIPOLYGON,id7 GEOMETRYCOLLECTION);
insert into tt3 values(ST_GeomFromText('POINT(1 -1)'),ST_GeomFromText('POINT(1 -1)'),ST_GeomFromText('LINESTRING(0 0, 10 10, 20 25, 50 60)')
,ST_GeomFromText('POLYGON((0 0,10 0,10 10,0 10,0 0),(5 5,7 5,7 7,5 7, 5 5))'),ST_GeomFromText('MULTIPOINT(0 0, 20 20, 60 60)'),
ST_GeomFromText('MULTILINESTRING((10 10, 20 20), (15 15, 30 15))'),ST_GeomFromText('MULTIPOLYGON(((0 0,10 0,10 10,0 10,0 0)),((5 5,7 5,7 7,5 7, 5 5)))'),
ST_GeomFromText('MULTIPOLYGON(((0 0,10 0,10 10,0 10,0 0)),((5 5,7 5,7 7,5 7, 5 5)))'));
select rb_build(id) from tt3;
ERROR 22000: invalid obj type for type promotion: left_type=ARRAY right_type=GEOMETRY
select rb_build(id1) from tt3;
ERROR 22000: invalid obj type for type promotion: left_type=ARRAY right_type=GEOMETRY
select rb_build(id2) from tt3;
ERROR 22000: invalid obj type for type promotion: left_type=ARRAY right_type=GEOMETRY
select rb_build(id3) from tt3;
ERROR 22000: invalid obj type for type promotion: left_type=ARRAY right_type=GEOMETRY
select rb_build([[id4]]) from tt3;
ERROR 0A000: array element type not supported
select rb_build(id4) from tt3;
ERROR 22000: invalid obj type for type promotion: left_type=ARRAY right_type=GEOMETRY
select rb_build(id5) from tt3;
ERROR 22000: invalid obj type for type promotion: left_type=ARRAY right_type=GEOMETRY
select rb_build(id6) from tt3;
ERROR 22000: invalid obj type for type promotion: left_type=ARRAY right_type=GEOMETRY
select rb_build(id7) from tt3;
ERROR 22000: invalid obj type for type promotion: left_type=ARRAY right_type=GEOMETRY
select array_agg(id7) from tt3;
ERROR 0A000: array element type not supported
select rb_build(c1),rb_build(c3) ,rb_build(c7),* from tt1;
+---------------------+-----------------------------+-----------------+------+------------------------------+----------+-------------------------+--------------------------------------------------------+-------------------+------------------------------------------------------+--------------------+
| rb_build(c1)        | rb_build(c3)                | rb_build(c7)    | id   | c1                           | c2       | c3                      | c4                                                     | c5                | c6                                                   | c7                 |
+---------------------+-----------------------------+-----------------+------+------------------------------+----------+-------------------------+--------------------------------------------------------+-------------------+------------------------------------------------------+--------------------+
|     ˇˇˇ   Ä         |        	   Äˇˇˇ            |     ˇ   Äˇˇ     |    1 | [-2147483648,0,2147483647]   | ["test"] | [[127,0,-128],[8,9]]    | [-9223372036854775808,9223372036854775807,775,808,2,0] | [3.402,0,1.175]   | [1.7976931348623157e308,2.2250738585072014e-308]     | [-32768,0,32767]   |
|        ˇˇˇ   Ä     |        	   Äˇˇˇ            |     ˇ   Äˇˇ     |    2 | [-2147483648,0,2147483647,4] | ["test"] | [[127,0,-128],[8,9]]    | [-9223372,9223372036854775807,775,808,2,0,1]           | [3.402,0,1.175,4] | [1.7976931348623157e308,1.2,2.2250738585072014e-308] | [-32768,0,32767,0] |
|           ˛ˇˇˇ     |        	   
   Äˇˇˇ        |     ˇ   Äˇˇ     |    3 | [-2,0,25,4]                  | ["test"] | [[127,0,-128],[8,9,10]] | [-922,9223372036854775807,775,808,2,0,1]               | [3.402,0,1.175,4] | [1.7976931348623157e308,1.2,2.2250738585072014e-308] | [-32768,0,32767,0] |
+---------------------+-----------------------------+-----------------+------+------------------------------+----------+-------------------------+--------------------------------------------------------+-------------------+------------------------------------------------------+--------------------+
select rb_build(c7)  from tt1;
+-----------------+
| rb_build(c7)    |
+-----------------+
|     ˇ   Äˇˇ     |
|     ˇ   Äˇˇ     |
|     ˇ   Äˇˇ     |
+-----------------+
select rb_build(c4)  from tt1;
ERROR HY000: Size overflow
select rb_build(c4)  from vtt2 where id=3;
+--------------+
| rb_build(c4) |
+--------------+
+--------------+
select rb_to_string(rb_build(c4))  from tt1 where id=3;
+----------------------------------------------+
| rb_to_string(rb_build(c4))                   |
+----------------------------------------------+
| 0,1,2,775,808,4294966374,9223372036854775807 |
+----------------------------------------------+
select rb_build(c2)  from tt1;
ERROR 22000: Invalid data type for the operation
select rb_build(c5)  from tt1;
ERROR 22000: Invalid data type for the operation
select rb_build(c6)  from tt1 where id=4;
ERROR 22000: Invalid data type for the operation
select /*+enable_parallel_dml parallel(4) */ rb_build(c1),rb_build(c3) ,rb_build(c7),* from vtt1;
+---------------------+-----------------------------+-----------------+------+------------------------------+----------+-------------------------+--------------------------------------------------------+-------------------+------------------------------------------------------+--------------------+
| rb_build(c1)        | rb_build(c3)                | rb_build(c7)    | id   | c1                           | c2       | c3                      | c4                                                     | c5                | c6                                                   | c7                 |
+---------------------+-----------------------------+-----------------+------+------------------------------+----------+-------------------------+--------------------------------------------------------+-------------------+------------------------------------------------------+--------------------+
|     ˇˇˇ   Ä         |        	   Äˇˇˇ            |     ˇ   Äˇˇ     |    1 | [-2147483648,0,2147483647]   | ["test"] | [[127,0,-128],[8,9]]    | [-9223372036854775808,9223372036854775807,775,808,2,0] | [3.402,0,1.175]   | [1.7976931348623157e308,2.2250738585072014e-308]     | [-32768,0,32767]   |
|        ˇˇˇ   Ä     |        	   Äˇˇˇ            |     ˇ   Äˇˇ     |    2 | [-2147483648,0,2147483647,4] | ["test"] | [[127,0,-128],[8,9]]    | [-9223372,9223372036854775807,775,808,2,0,1]           | [3.402,0,1.175,4] | [1.7976931348623157e308,1.2,2.2250738585072014e-308] | [-32768,0,32767,0] |
|           ˛ˇˇˇ     |        	   
   Äˇˇˇ        |     ˇ   Äˇˇ     |    3 | [-2,0,25,4]                  | ["test"] | [[127,0,-128],[8,9,10]] | [-922,9223372036854775807,775,808,2,0,1]               | [3.402,0,1.175,4] | [1.7976931348623157e308,1.2,2.2250738585072014e-308] | [-32768,0,32767,0] |
+---------------------+-----------------------------+-----------------+------+------------------------------+----------+-------------------------+--------------------------------------------------------+-------------------+------------------------------------------------------+--------------------+
select /*+enable_parallel_dml parallel(4) */ rb_build(c1),rb_build(c3) ,rb_build(c7),* from tt2;
+---------------------+-------------------------+---------------------+------+---------------------------+----------+--------------+----------------------------------------------+-------------------+------------------------------------------------------+------------------+
| rb_build(c1)        | rb_build(c3)            | rb_build(c7)        | id   | c1                        | c2       | c3           | c4                                           | c5                | c6                                                   | c7               |
+---------------------+-------------------------+---------------------+------+---------------------------+----------+--------------+----------------------------------------------+-------------------+------------------------------------------------------+------------------+
|     ˇˇˇ   Ä         |        4            |     ˇ  X         |    1 | [2147483648,0,2147483647] | ["test"] | [52,0,5]     | [852,9223372036854775807,775,808,2,0]        | [3.402,0,1.175]   | [1.7976931348623157e308,2.2250738585072014e-308]     | [88,0,32767]     |
|        rV ˇˇˇ    |              2    |        ˇ  D     |    2 | [87666,0,2147483647,4]    | ["test"] | [5,0,7,6,50] | [1,100000,9223372036854775807,775,808,2,0,1] | [3.402,0,1.175,4] | [1.7976931348623157e308,1.2,2.2250738585072014e-308] | [68,0,32767,0,1] |
+---------------------+-------------------------+---------------------+------+---------------------------+----------+--------------+----------------------------------------------+-------------------+------------------------------------------------------+------------------+
select rb_build([1,2,4,5,7,-3]) from tt1 order by rb_build([1,2,4,5,7,-3]);
+-----------------------------+
| rb_build([1,2,4,5,7,-3])    |
+-----------------------------+
|                ˝ˇˇˇ     |
|                ˝ˇˇˇ     |
|                ˝ˇˇˇ     |
+-----------------------------+
select rb_build(c1) from tt1 order by rb_build(c1);
ERROR 22000: Invalid data type for the operation
select rb_build(c1) from tt1 order by rb_build(c1) desc;
ERROR 22000: Invalid data type for the operation
select *,rb_build(c1) from tt1 order by rb_build(c1) desc;
ERROR 22000: Invalid data type for the operation
select rb_build(c1) from tt1 order by rb_build(c1) asc;
ERROR 22000: Invalid data type for the operation
select rb_build(c1) from tt1 group by rb_build(c1);
ERROR 22000: Invalid data type for the operation
select *, rb_build(c1) from tt1 group by rb_build(c1);
ERROR 22000: Invalid data type for the operation
select rb_build(c1),* from tt1 group by id having rb_build(c1)=rb_build(c1);
ERROR 22000: Invalid data type for the operation
select *,rb_build(c1) from tt1 group by id having rb_build(c1)>'test';
ERROR 22000: Invalid data type for the operation
select distinct rb_build(c1) from tt2;
ERROR 22000: Invalid data type for the operation
WITH Alice_Students AS (
    select rb_build(c1),rb_build(c3) from tt1
)
SELECT * FROM Alice_Students;
+---------------------+-----------------------------+
| rb_build(c1)        | rb_build(c3)                |
+---------------------+-----------------------------+
|     ˇˇˇ   Ä         |        	   Äˇˇˇ            |
|        ˇˇˇ   Ä     |        	   Äˇˇˇ            |
|           ˛ˇˇˇ     |        	   
   Äˇˇˇ        |
+---------------------+-----------------------------+
WITH Alice_Students AS (
    select rb_to_string(rb_build([[[[[[1,2,3,4,5],[5,6,7,8,9,10,11,12,13,14,15,16,17,18,19,20,21,22,23,24,25,26,27,28,29,30,31,32,33,35,-1]]]]]]))
)
SELECT * FROM Alice_Students;
+-----------------------------------------------------------------------------------------------------------------------------------------+
| rb_to_string(rb_build([[[[[[1,2,3,4,5],[5,6,7,8,9,10,11,12,13,14,15,16,17,18,19,20,21,22,23,24,25,26,27,28,29,30,31,32,33,35,-1]]]]]])) |
+-----------------------------------------------------------------------------------------------------------------------------------------+
| 1,2,3,4,5,6,7,8,9,10,11,12,13,14,15,16,17,18,19,20,21,22,23,24,25,26,27,28,29,30,31,32,33,35,4294967295                                 |
+-----------------------------------------------------------------------------------------------------------------------------------------+
SELECT CASE rb_build([1]) WHEN rb_build([1]) THEN 1 WHEN  rb_build([1,2]) THEN 2 END;
ERROR 22000: Invalid data type for the operation
SELECT CASE 1 WHEN 1 THEN rb_build([1]) WHEN 2 THEN rb_build([2]) END;
+----------------------------------------------------------------+
| CASE 1 WHEN 1 THEN rb_build([1]) WHEN 2 THEN rb_build([2]) END |
+----------------------------------------------------------------+
|                                                             |
+----------------------------------------------------------------+
SELECT CASE 2 WHEN 1 THEN rb_build([1]) WHEN 2 THEN rb_build([2]) END;
+----------------------------------------------------------------+
| CASE 2 WHEN 1 THEN rb_build([1]) WHEN 2 THEN rb_build([2]) END |
+----------------------------------------------------------------+
|                                                             |
+----------------------------------------------------------------+
SELECT CASE rb_build(c1) WHEN rb_build(c1) THEN 1 WHEN  rb_build(c3) THEN 2 END from tt1;
ERROR 22000: Invalid data type for the operation
SELECT CASE 1 WHEN 1 THEN rb_build(c1) WHEN 2 THEN rb_build(c3) END from tt1;
+--------------------------------------------------------------+
| CASE 1 WHEN 1 THEN rb_build(c1) WHEN 2 THEN rb_build(c3) END |
+--------------------------------------------------------------+
|     ˇˇˇ   Ä                                                  |
|        ˇˇˇ   Ä                                              |
|           ˛ˇˇˇ                                              |
+--------------------------------------------------------------+
SELECT CASE 2 WHEN 1 THEN rb_build(c1) WHEN 2 THEN rb_build(c3) END from tt2;
+--------------------------------------------------------------+
| CASE 2 WHEN 1 THEN rb_build(c1) WHEN 2 THEN rb_build(c3) END |
+--------------------------------------------------------------+
|        4                                                 |
|              2                                         |
+--------------------------------------------------------------+
select * from tt1 where rb_build(c7)=1;
ERROR 22000: Invalid data type for the operation
select * from tt1 where rb_build(c7)='1';
ERROR 22000: Invalid data type for the operation
select * from tt1 where rb_build(c7)=rb_build(c7);
ERROR 22000: Invalid data type for the operation
select * from tt1 where rb_build(c7)>rb_build(c7);
ERROR 22000: Invalid data type for the operation
select * from tt1 where rb_build(c7)<'test';
ERROR 22000: Invalid data type for the operation
select *,rb_build(c7) from tt1  group by id having rb_build(c7) ='test' ;
ERROR 22000: Invalid data type for the operation
select * from tt1 where rb_build(c7)<=>rb_build([1,2,3,4]);
ERROR 22000: Invalid data type for the operation
select * from tt1 where rb_build(c7)!= rb_from_string('1,2,3,4');
ERROR 22000: Invalid data type for the operation
select * from tt1 where rb_build(c7) BETWEEN rb_build(c7) AND rb_build(c7);
ERROR 22000: Invalid data type for the operation
select * from tt1 where rb_build(c7) not in(rb_build(c7));
ERROR 22000: Invalid data type for the operation
select * from tt1 where rb_build(c7) like(rb_build(c7));
+------+------------------------------+----------+-------------------------+--------------------------------------------------------+-------------------+------------------------------------------------------+--------------------+
| id   | c1                           | c2       | c3                      | c4                                                     | c5                | c6                                                   | c7                 |
+------+------------------------------+----------+-------------------------+--------------------------------------------------------+-------------------+------------------------------------------------------+--------------------+
|    1 | [-2147483648,0,2147483647]   | ["test"] | [[127,0,-128],[8,9]]    | [-9223372036854775808,9223372036854775807,775,808,2,0] | [3.402,0,1.175]   | [1.7976931348623157e308,2.2250738585072014e-308]     | [-32768,0,32767]   |
|    2 | [-2147483648,0,2147483647,4] | ["test"] | [[127,0,-128],[8,9]]    | [-9223372,9223372036854775807,775,808,2,0,1]           | [3.402,0,1.175,4] | [1.7976931348623157e308,1.2,2.2250738585072014e-308] | [-32768,0,32767,0] |
|    3 | [-2,0,25,4]                  | ["test"] | [[127,0,-128],[8,9,10]] | [-922,9223372036854775807,775,808,2,0,1]               | [3.402,0,1.175,4] | [1.7976931348623157e308,1.2,2.2250738585072014e-308] | [-32768,0,32767,0] |
+------+------------------------------+----------+-------------------------+--------------------------------------------------------+-------------------+------------------------------------------------------+--------------------+
select * from tt1 where rb_build(c7) not like(rb_build(c7));
+------+------+------+------+------+------+------+------+
| id   | c1   | c2   | c3   | c4   | c5   | c6   | c7   |
+------+------+------+------+------+------+------+------+
+------+------+------+------+------+------+------+------+
select  * from tt1 where rb_build(c7) like rb_build([1,2,3,4]);
+------+------+------+------+------+------+------+------+
| id   | c1   | c2   | c3   | c4   | c5   | c6   | c7   |
+------+------+------+------+------+------+------+------+
+------+------+------+------+------+------+------+------+
select  * from tt1 where rb_build([1,2,3,4]) like rb_build([1,2,3,4]);
+------+------------------------------+----------+-------------------------+--------------------------------------------------------+-------------------+------------------------------------------------------+--------------------+
| id   | c1                           | c2       | c3                      | c4                                                     | c5                | c6                                                   | c7                 |
+------+------------------------------+----------+-------------------------+--------------------------------------------------------+-------------------+------------------------------------------------------+--------------------+
|    1 | [-2147483648,0,2147483647]   | ["test"] | [[127,0,-128],[8,9]]    | [-9223372036854775808,9223372036854775807,775,808,2,0] | [3.402,0,1.175]   | [1.7976931348623157e308,2.2250738585072014e-308]     | [-32768,0,32767]   |
|    2 | [-2147483648,0,2147483647,4] | ["test"] | [[127,0,-128],[8,9]]    | [-9223372,9223372036854775807,775,808,2,0,1]           | [3.402,0,1.175,4] | [1.7976931348623157e308,1.2,2.2250738585072014e-308] | [-32768,0,32767,0] |
|    3 | [-2,0,25,4]                  | ["test"] | [[127,0,-128],[8,9,10]] | [-922,9223372036854775807,775,808,2,0,1]               | [3.402,0,1.175,4] | [1.7976931348623157e308,1.2,2.2250738585072014e-308] | [-32768,0,32767,0] |
+------+------------------------------+----------+-------------------------+--------------------------------------------------------+-------------------+------------------------------------------------------+--------------------+
select  * from tt1 where rb_build(c7) like '%test%';
+------+------+------+------+------+------+------+------+
| id   | c1   | c2   | c3   | c4   | c5   | c6   | c7   |
+------+------+------+------+------+------+------+------+
+------+------+------+------+------+------+------+------+
select * from tt1 where rb_build(c7) is true;
ERROR 22000: Invalid data type for the operation
select * from tt1 where rb_build(c7) is not false;
ERROR 22000: Invalid data type for the operation
select * from tt1 where rb_build(c7) is  false;
ERROR 22000: Invalid data type for the operation
select * from tt1 where rb_build(c7) is not null;
+------+------------------------------+----------+-------------------------+--------------------------------------------------------+-------------------+------------------------------------------------------+--------------------+
| id   | c1                           | c2       | c3                      | c4                                                     | c5                | c6                                                   | c7                 |
+------+------------------------------+----------+-------------------------+--------------------------------------------------------+-------------------+------------------------------------------------------+--------------------+
|    1 | [-2147483648,0,2147483647]   | ["test"] | [[127,0,-128],[8,9]]    | [-9223372036854775808,9223372036854775807,775,808,2,0] | [3.402,0,1.175]   | [1.7976931348623157e308,2.2250738585072014e-308]     | [-32768,0,32767]   |
|    2 | [-2147483648,0,2147483647,4] | ["test"] | [[127,0,-128],[8,9]]    | [-9223372,9223372036854775807,775,808,2,0,1]           | [3.402,0,1.175,4] | [1.7976931348623157e308,1.2,2.2250738585072014e-308] | [-32768,0,32767,0] |
|    3 | [-2,0,25,4]                  | ["test"] | [[127,0,-128],[8,9,10]] | [-922,9223372036854775807,775,808,2,0,1]               | [3.402,0,1.175,4] | [1.7976931348623157e308,1.2,2.2250738585072014e-308] | [-32768,0,32767,0] |
+------+------------------------------+----------+-------------------------+--------------------------------------------------------+-------------------+------------------------------------------------------+--------------------+
select * from tt1 where rb_build(c7) is  null;
+------+------+------+------+------+------+------+------+
| id   | c1   | c2   | c3   | c4   | c5   | c6   | c7   |
+------+------+------+------+------+------+------+------+
+------+------+------+------+------+------+------+------+
select cast(rb_build([1,2,4,4,7]) as binary);
+---------------------------------------+
| cast(rb_build([1,2,4,4,7]) as binary) |
+---------------------------------------+
|                                |
+---------------------------------------+
select cast(rb_build(c1) as binary) from tt1;
+------------------------------+
| cast(rb_build(c1) as binary) |
+------------------------------+
|     ˇˇˇ   Ä                  |
|        ˇˇˇ   Ä              |
|           ˛ˇˇˇ              |
+------------------------------+
select cast(rb_build([1,2,3,4,5,6,7,8,9,10,11,12,13,14,15,16,17,18,19,20,21,22,23,24,25,26,27,28,29,30,31,4294967295,1] ) as binary);
+-------------------------------------------------------------------------------------------------------------------------------------+
| cast(rb_build([1,2,3,4,5,6,7,8,9,10,11,12,13,14,15,16,17,18,19,20,21,22,23,24,25,26,27,28,29,30,31,4294967295,1] ) as binary)       |
+-------------------------------------------------------------------------------------------------------------------------------------+
|                          	   
                                                                  ˇˇˇˇ     |
+-------------------------------------------------------------------------------------------------------------------------------------+
select cast(rb_build([1,2,3,4,5,6,7,8,9,10,11,12,13,14,15,16,17,18,19,20,21,22,23,24,25,26,27,28,29,30,31,4294967296,4294967295]) as roaringbitmap);
+----------------------------------------------------------------------------------------------------------------------------------------------+
| cast(rb_build([1,2,3,4,5,6,7,8,9,10,11,12,13,14,15,16,17,18,19,20,21,22,23,24,25,26,27,28,29,30,31,4294967296,4294967295]) as roaringbitmap) |
+----------------------------------------------------------------------------------------------------------------------------------------------+
|            :0        ˇˇ     V           	 
                      ˇˇ   :0                                   |
+----------------------------------------------------------------------------------------------------------------------------------------------+
select cast(rb_build(c1) as char(1000)) from tt1;
+----------------------------------+
| cast(rb_build(c1) as char(1000)) |
+----------------------------------+
|     ˇˇˇ   Ä                      |
|        ˇˇˇ   Ä                  |
|           ˛ˇˇˇ                  |
+----------------------------------+
select cast(rb_build([1,2,3,4,5,6,7,8,9,10,11,12,13,14,15,16,17,18,19,20,21,22,23,24,25,26,27,28,29,30,31,4294967295,1] ) as UNSIGNED);
ERROR 22000: Invalid data type for the operation
select cast(rb_build([1,2,3,4,5,6,7,8,9,10,11,12,13,14,15,16,17,18,19,20,21,22,23,24,25,26,27,28,29,30,31,4294967295,1] ) as SIGNED);
ERROR 22000: Invalid data type for the operation
select cast(rb_build([1,2,3,4,5,6,7,8,9,10,11,12,13,14,15,16,17,18,19,20,21,22,23,24,25,26,27,28,29,30,31,4294967295,1] ) as date);
ERROR 22000: Invalid data type for the operation
select cast(rb_build([1,2,3,4,5,6,7,8,9,10,11,12,13,14,15,16,17,18,19,20,21,22,23,24,25,26,27,28,29,30,31,4294967295,1] ) as DATETIME);
ERROR 22000: Invalid data type for the operation
select cast(rb_build([1,2,3,4,5,6,7,8,9,10,11,12,13,14,15,16,17,18,19,20,21,22,23,24,25,26,27,28,29,30,31,4294967295,1] ) as TIME);
ERROR 22000: Invalid data type for the operation
select cast(rb_build([1,2,3,4,5,6,7,8,9,10,11,12,13,14,15,16,17,18,19,20,21,22,23,24,25,26,27,28,29,30,31,4294967295,1] ) as FLOAT);
ERROR 22000: Invalid data type for the operation
select cast(rb_build([1,2,3,4,5,6,7,8,9,10,11,12,13,14,15,16,17,18,19,20,21,22,23,24,25,26,27,28,29,30,31,4294967295,1] ) as year);
ERROR 22000: Invalid data type for the operation
select cast(rb_build([1,2,3,4,5,6,7,8,9,10,11,12,13,14,15,16,17,18,19,20,21,22,23,24,25,26,27,28,29,30,31,4294967295,1] ) as DOUBLE);
ERROR 22000: Invalid data type for the operation
select cast(rb_build([1,2,3,4,5,6,7,8,9,10,11,12,13,14,15,16,17,18,19,20,21,22,23,24,25,26,27,28,29,30,31,4294967295,1] ) as DECIMAL);
ERROR 22000: Invalid data type for the operation
select cast(rb_build([1,2,3,4,5,6,7,8,9,10,11,12,13,14,15,16,17,18,19,20,21,22,23,24,25,26,27,28,29,30,31,4294967295,1] ) as dec);
ERROR 22000: Invalid data type for the operation
select cast(rb_build([1,2,3,4,5,6,7,8,9,10,11,12,13,14,15,16,17,18,19,20,21,22,23,24,25,26,27,28,29,30,31,4294967295,1] ) as NUMERIC);
ERROR 22000: Invalid data type for the operation
select cast(rb_build([1,2,3,4,5,6,7,8,9,10,11,12,13,14,15,16,17,18,19,20,21,22,23,24,25,26,27,28,29,30,31,4294967295,1] ) as FIXED);
ERROR 22000: Invalid data type for the operation
select cast(rb_build([1,2,3,4,5,6,7,8,9,10,11,12,13,14,15,16,17,18,19,20,21,22,23,24,25,26,27,28,29,30,31,4294967295,1] ) as MULTIPOINT);
ERROR 22000: Invalid data type for the operation
select cast(rb_build([1,2,3,4,5,6,7,8,9,10,11,12,13,14,15,16,17,18,19,20,21,22,23,24,25,26,27,28,29,30,31,4294967295,1] ) as json);
ERROR 22000: Invalid data type for the operation
select cast(rb_build([1,2,3,4,5,6,7,8,9,10,11,12,13,14,15,16,17,18,19,20,21,22,23,24,25,26,27,28,29,30,31,4294967295,1] ) as POINT);
ERROR 22000: Invalid data type for the operation
select cast(rb_build([1,2,3,4,5,6,7,8,9,10,11,12,13,14,15,16,17,18,19,20,21,22,23,24,25,26,27,28,29,30,31,4294967295,1] ) as LINESTRING);
ERROR 22000: Invalid data type for the operation
select cast(rb_build([1,2,3,4,5,6,7,8,9,10,11,12,13,14,15,16,17,18,19,20,21,22,23,24,25,26,27,28,29,30,31,4294967295,1] ) as POLYGON);
ERROR 22000: Invalid data type for the operation
select cast(rb_build([1,2,3,4,5,6,7,8,9,10,11,12,13,14,15,16,17,18,19,20,21,22,23,24,25,26,27,28,29,30,31,4294967295,1] ) as MULTILINESTRING);
ERROR 22000: Invalid data type for the operation
select cast(rb_build([1,2,3,4,5,6,7,8,9,10,11,12,13,14,15,16,17,18,19,20,21,22,23,24,25,26,27,28,29,30,31,4294967295,1] ) as MULTIPOLYGON);
ERROR 22000: Invalid data type for the operation
select cast(rb_build([1,2,3,4,5,6,7,8,9,10,11,12,13,14,15,16,17,18,19,20,21,22,23,24,25,26,27,28,29,30,31,4294967295,1]) as GEOMETRYCOLLECTION);
ERROR 22000: Invalid data type for the operation
drop table tt3;
create table tt3(id int,r roaringbitmap);
insert into tt3 values(1,rb_from_string('1'));
insert into tt3 values(2,rb_from_string('2'));
insert into tt3 values(3,rb_from_string('2,7,8,9,0,73847'));
select t2.* from tt3 t2 inner join tt1 t1 on t2.r=rb_build([1]);
ERROR 22000: Invalid data type for the operation
select t2.* from tt3 t2 inner join tt1 t1 on rb_build([1])=t2.r;
ERROR 22000: Invalid data type for the operation
select t2.* from tt3 t2 inner join tt1 t1 on rb_build([1])=rb_build([1]);
ERROR 22000: Invalid data type for the operation
select * from tt3 t2 inner join tt1 t1 on t2.r!=rb_build([1]);
ERROR 22000: Invalid data type for the operation
select * from tt3 t2 inner join tt1 t1 on t2.r>rb_build([1]);
ERROR 22000: Invalid data type for the operation
select rb_build_agg(c3)>rb_build([1,2,3,4,5,6,7,8,9,10,11,12,13,14,15,16,17,18,19,20,21,22,23,24,25,26,27,28,29,30,31,4294967295,1]) from tt1;
ERROR 22000: Invalid data type for the operation
select rb_build(c3)!='test' from tt1;
ERROR 22000: Invalid data type for the operation
select rb_build([1,2,3,4,5,6,7,8,9,10,11,12,13,14,15,16,17,18,19,20,21,22,23,24,25,26,27,28,29,30,31,4294967295,1]) <'test';
ERROR 22000: Invalid data type for the operation
select rb_build([1,2,3,4,5,6,7,8,9,10,11,12,13,14,15,16,17,18,19,20,21,22,23,24,25,26,27,28,29,30,31,4294967295,1]) =1 ;
ERROR 22000: Invalid data type for the operation
select rb_build([1,2,3,4,5,6,7,8,9,10,11,12,13,14,15,16,17,18,19,20,21,22,23,24,25,26,27,28,29,30,31,4294967295,1]) <>1 ;
ERROR 22000: Invalid data type for the operation
select +rb_build(c3) from tt1;
+-----------------------------+
| +rb_build(c3)               |
+-----------------------------+
|        	   Äˇˇˇ            |
|        	   Äˇˇˇ            |
|        	   
   Äˇˇˇ        |
+-----------------------------+
select +rb_build(c3) from vtt1;
+-----------------------------+
| +rb_build(c3)               |
+-----------------------------+
|        	   Äˇˇˇ            |
|        	   Äˇˇˇ            |
|        	   
   Äˇˇˇ        |
+-----------------------------+
select -rb_build(c3) from tt1;
ERROR 22000: Invalid data type for the operation
select rb_build(c3)+rb_build(c3) from tt1;
ERROR 22000: Invalid data type for the operation
select rb_build(c3)+1 from tt1;
ERROR 22000: Invalid data type for the operation
select rb_build(c3)+'test' from tt1;
ERROR 22000: Invalid data type for the operation
select rb_build(c3)+null from tt1;
ERROR 22000: Invalid data type for the operation
select rb_build(c3)+false from tt1;
ERROR 22000: Invalid data type for the operation
select rb_build(c3)+true from tt1;
ERROR 22000: Invalid data type for the operation
select rb_build(c3)-rb_build(c3) from tt1;
ERROR 22000: Invalid data type for the operation
select rb_build(c3)-1 from tt1;
ERROR 22000: Invalid data type for the operation
select rb_build(c3)-'test' from tt1;
ERROR 22000: Invalid data type for the operation
select rb_build(c3)-null from tt1;
ERROR 22000: Invalid data type for the operation
select rb_build(c3)-false from tt1;
ERROR 22000: Invalid data type for the operation
select rb_build(c3)-true from tt1;
ERROR 22000: Invalid data type for the operation
select rb_build(c3)*rb_build(c3) from tt1;
ERROR 22000: Invalid data type for the operation
select rb_build(c3)*1 from tt1;
ERROR 22000: Invalid data type for the operation
select rb_build(c3)*'test' from tt1;
ERROR 22000: Invalid data type for the operation
select rb_build(c3)*null from tt1;
ERROR 22000: Invalid data type for the operation
select rb_build(c3)*false from tt1;
ERROR 22000: Invalid data type for the operation
select rb_build(c3)*true from tt1;
ERROR 22000: Invalid data type for the operation
select rb_build(c3)*rb_build(c3) from tt1;
ERROR 22000: Invalid data type for the operation
select rb_build(c3)*1 from tt1;
ERROR 22000: Invalid data type for the operation
select rb_build(c3)*'test' from tt1;
ERROR 22000: Invalid data type for the operation
select rb_build(c3)*null from tt1;
ERROR 22000: Invalid data type for the operation
select rb_build(c3)*false from tt1;
ERROR 22000: Invalid data type for the operation
select rb_build(c3)*true from tt1;
ERROR 22000: Invalid data type for the operation
select rb_build(c3)/rb_build(c3) from tt1;
ERROR 22000: Invalid data type for the operation
select rb_build(c3)/1 from tt1;
ERROR 22000: Invalid data type for the operation
select rb_build(c3)/'test' from tt1;
ERROR 22000: Invalid data type for the operation
select rb_build(c3)/null from tt1;
ERROR 22000: Invalid data type for the operation
select rb_build(c3)/false from tt1;
ERROR 22000: Invalid data type for the operation
select rb_build(c3)/true from tt1;
ERROR 22000: Invalid data type for the operation
select rb_build(c3) div rb_build(c3) from tt1;
ERROR 22000: Invalid data type for the operation
select rb_build(c3) div 1 from tt1;
ERROR 22000: Invalid data type for the operation
select rb_build(c3) div 'test' from tt1;
ERROR 22000: Invalid data type for the operation
select rb_build(c3) div null from tt1;
ERROR 22000: Invalid data type for the operation
select rb_build(c3) div false from tt1;
ERROR 22000: Invalid data type for the operation
select rb_build(c3) div true from tt1;
ERROR 22000: Invalid data type for the operation
select rb_build(c3) % rb_build(c3) from tt1;
ERROR 22000: Invalid data type for the operation
select rb_build(c3) % 1 from tt1;
ERROR 22000: Invalid data type for the operation
select rb_build(c3) % 'test' from tt1;
ERROR 22000: Invalid data type for the operation
select rb_build(c3) % null from tt1;
ERROR 22000: Invalid data type for the operation
select rb_build(c3) % false from tt1;
ERROR 22000: Invalid data type for the operation
select rb_build(c3) % true from tt1;
ERROR 22000: Invalid data type for the operation
select rb_build(c3) mod rb_build(c3) from tt1;
ERROR 22000: Invalid data type for the operation
select rb_build(c3) mod 1 from tt1;
ERROR 22000: Invalid data type for the operation
select rb_build(c3) mod 'test' from tt1;
ERROR 22000: Invalid data type for the operation
select rb_build(c3) mod null from tt1;
ERROR 22000: Invalid data type for the operation
select rb_build(c3) mod false from tt1;
ERROR 22000: Invalid data type for the operation
select rb_build(c3) mod true from tt1;
ERROR 22000: Invalid data type for the operation
select rb_build(c3) & rb_build(c3) from tt1;
ERROR 22000: Invalid data type for the operation
select rb_build(c3) & 1 from tt1;
ERROR 22000: Invalid data type for the operation
select rb_build(c3) & 'test' from tt1;
ERROR 22000: Invalid data type for the operation
select rb_build(c3) & null from tt1;
ERROR 22000: Invalid data type for the operation
select rb_build(c3) & false from tt1;
ERROR 22000: Invalid data type for the operation
select rb_build(c3) & true from tt1;
ERROR 22000: Invalid data type for the operation
select rb_build(c3) | rb_build(c3) from tt1;
ERROR 22000: Invalid data type for the operation
select rb_build(c3) | 1 from tt1;
ERROR 22000: Invalid data type for the operation
select rb_build(c3) | 'test' from tt1;
ERROR 22000: Invalid data type for the operation
select rb_build(c3) | null from tt1;
ERROR 22000: Invalid data type for the operation
select rb_build(c3) | false from tt1;
ERROR 22000: Invalid data type for the operation
select rb_build(c3) | true from tt1;
ERROR 22000: Invalid data type for the operation
select ~rb_build(c3)from tt1;
ERROR 22000: Invalid data type for the operation
select rb_build(c3) ^ rb_build(c3) from tt1;
ERROR 22000: Invalid data type for the operation
select rb_build(c3) ^ 1 from tt1;
ERROR 22000: Invalid data type for the operation
select rb_build(c3) ^ 'test' from tt1;
ERROR 22000: Invalid data type for the operation
select rb_build(c3) ^ null from tt1;
ERROR 22000: Invalid data type for the operation
select rb_build(c3) ^ false from tt1;
ERROR 22000: Invalid data type for the operation
select rb_build(c3) ^ true from tt1;
ERROR 22000: Invalid data type for the operation
select rb_build(c3) << rb_build_agg(1) from tt1;
ERROR 22000: Invalid data type for the operation
select rb_build(c3) << 1 from tt1;
ERROR 22000: Invalid data type for the operation
select rb_build(c3) << 'test' from tt1;
ERROR 22000: Invalid data type for the operation
select rb_build(c3) << null from tt1;
ERROR 22000: Invalid data type for the operation
select rb_build(c3) << false from tt1;
ERROR 22000: Invalid data type for the operation
select rb_build(c3) << true from tt1;
ERROR 22000: Invalid data type for the operation
select rb_build(c3) >> rb_build_agg(1) from tt1;
ERROR 22000: Invalid data type for the operation
select rb_build(c3) >> 1 from tt1;
ERROR 22000: Invalid data type for the operation
select rb_build(c3) >> 'test' from tt1;
ERROR 22000: Invalid data type for the operation
select rb_build(c3) >> null from tt1;
ERROR 22000: Invalid data type for the operation
select rb_build(c3) >> false from tt1;
ERROR 22000: Invalid data type for the operation
select rb_build(c3) >> true from tt1;
ERROR 22000: Invalid data type for the operation
select rb_build(c3) is true from tt1;
ERROR 22000: Invalid data type for the operation
select rb_build(c3) in (rb_build_agg(1)) from tt1;
ERROR 22000: Invalid data type for the operation
select rb_build(c3) not in (rb_build_agg(1)) from tt1;
ERROR 22000: Invalid data type for the operation
2024071200103692148
select rb_build(c3) like (rb_build_agg(1)) from tt1;
+-------------------------------------+
| rb_build(c3) like (rb_build_agg(1)) |
+-------------------------------------+
|                                   0 |
+-------------------------------------+
2024071200103692148
select rb_build(c3) like 1 from tt1;
+---------------------+
| rb_build(c3) like 1 |
+---------------------+
|                   0 |
|                   0 |
|                   0 |
+---------------------+
select  rb_build(c3) BETWEEN rb_build(c3) and rb_build(c3) from tt1;
ERROR 22000: Invalid data type for the operation
select  rb_build(c3) is null from tt1;
+----------------------+
| rb_build(c3) is null |
+----------------------+
|                    0 |
|                    0 |
|                    0 |
+----------------------+
select  rb_build(c3) is not null from tt1;
+--------------------------+
| rb_build(c3) is not null |
+--------------------------+
|                        1 |
|                        1 |
|                        1 |
+--------------------------+
select  rb_build(c3) is false from tt1;
ERROR 22000: Invalid data type for the operation
select not rb_build(c3) from tt1;
ERROR 22000: Invalid data type for the operation
select  rb_build(c3) and rb_build(c3)  from tt1;
ERROR 22000: Invalid data type for the operation
select  rb_build(c3) && rb_build(c3)  from tt1;
ERROR 22000: Invalid data type for the operation
select  rb_build(c3) or rb_build(c3)  from tt1;
ERROR 22000: Invalid data type for the operation
select  rb_build(c3) || rb_build(c3)  from tt1;
ERROR 22000: Invalid data type for the operation
select  rb_build(c3) || 1 from tt1;
ERROR 22000: Invalid data type for the operation
select  rb_build(c3) XOR rb_build(c3)  from tt1;
ERROR 22000: Invalid data type for the operation
select  rb_build(c3) XOR 1 from tt1;
ERROR 22000: Invalid data type for the operation
select  'test' XOR rb_build(c3) from tt1;
ERROR 22000: Invalid data type for the operation
SELECT BINARY rb_build(c3) = rb_build(c3) from tt1;
ERROR 22000: Invalid data type for the operation
select CONVERT(rb_build(c3) USING BINARY) from tt1;
+------------------------------------+
| CONVERT(rb_build(c3) USING BINARY) |
+------------------------------------+
|        	   Äˇˇˇ                   |
|        	   Äˇˇˇ                   |
|        	   
   Äˇˇˇ               |
+------------------------------------+
SELECT CASE rb_build(c3) WHEN rb_build(c3) THEN rb_build(c3) WHEN rb_build(c3) THEN rb_build(c3) END from tt1;
ERROR 22000: Invalid data type for the operation
SELECT CASE  WHEN rb_build(c3) =rb_build(c3) THEN rb_build(c3) else  rb_build(c3) END from vtt1;
ERROR 22000: Invalid data type for the operation
SELECT CASE 1 WHEN 1 THEN rb_build(c3) WHEN 2 THEN rb_build(c3) END from tt1;
+--------------------------------------------------------------+
| CASE 1 WHEN 1 THEN rb_build(c3) WHEN 2 THEN rb_build(c3) END |
+--------------------------------------------------------------+
|        	   Äˇˇˇ                                             |
|        	   Äˇˇˇ                                             |
|        	   
   Äˇˇˇ                                         |
+--------------------------------------------------------------+
select * from (select rb_build([1,2,3,4,5,6,7,8,9,10,11,12,13,14,15,16,17,18,19,20,21,22,23,24,25,26,27,28,29,30,31,4294967295,1]));
+-------------------------------------------------------------------------------------------------------------------------------------+
| rb_build([1,2,3,4,5,6,7,8,9,10,11,12,13,14,15,16,17,18,19,20,21,22,23,24,25,26,27,28,29,30,31,4294967295,1])                        |
+-------------------------------------------------------------------------------------------------------------------------------------+
|                          	   
                                                                  ˇˇˇˇ     |
+-------------------------------------------------------------------------------------------------------------------------------------+
select * from tt2 where exists(select rb_build(c1) from tt1);
+------+---------------------------+----------+--------------+----------------------------------------------+-------------------+------------------------------------------------------+------------------+
| id   | c1                        | c2       | c3           | c4                                           | c5                | c6                                                   | c7               |
+------+---------------------------+----------+--------------+----------------------------------------------+-------------------+------------------------------------------------------+------------------+
|    1 | [2147483648,0,2147483647] | ["test"] | [52,0,5]     | [852,9223372036854775807,775,808,2,0]        | [3.402,0,1.175]   | [1.7976931348623157e308,2.2250738585072014e-308]     | [88,0,32767]     |
|    2 | [87666,0,2147483647,4]    | ["test"] | [5,0,7,6,50] | [1,100000,9223372036854775807,775,808,2,0,1] | [3.402,0,1.175,4] | [1.7976931348623157e308,1.2,2.2250738585072014e-308] | [68,0,32767,0,1] |
+------+---------------------------+----------+--------------+----------------------------------------------+-------------------+------------------------------------------------------+------------------+
drop table tt3;
create table tt3(id int primary key,a0 roaringbitmap);
drop view vtt3;
create view vtt3 as select * from tt3;
insert into tt3 values(1,rb_build([1,2,3,4,5,6,7,8,9,10,11,12,13,14,15,16,17,18,19,20])),(2,(select rb_build(c1) from tt1 where id=1));
replace into tt3 values(1,rb_build([1,2,3,4,5,6,7,8,9,10,11,12,13,14,15,16,17,18,19,20,4]));
replace into tt3 values(2,rb_build([1,2,3,4,5,6,7,8,9,10,11,12,13,14,15,16,17,18,19,20,4])),(2,rb_build([1,2,3,4,5,6,7,8,9,10,11,12,13,14,15,16,17,18,19,20,4,5,9,684]));
insert into tt3 values(3,rb_build([1,23])) ON DUPLICATE KEY UPDATE  a0=rb_build([1,23,3]);
insert into tt3 values(3,rb_build([1,23])) ON DUPLICATE KEY UPDATE  a0=rb_build([1,23,4]);
truncate tt3;
insert into vtt3 values(1,rb_build([1,2,3,4,5,6,7,8,9,10,11,12,13,14,15,16,17,18,19,20])),(2,(select rb_build(c1) from tt1 where id=1));
replace into vtt3 values(1,rb_build([1,2,3,4,5,6,7,8,9,10,11,12,13,14,15,16,17,18,19,20,4]));
replace into vtt3 values(5,rb_build([1,2,3,4,5,6,7,8,9,10,11,12,13,14,15,16,17,18,19,20,4])),(2,rb_build([1,2,3,4,5,6,7,8,9,10,11,12,13,14,15,16,17,18,19,20,4,5,9,684]));
insert into vtt3 values(3,rb_build([1,23])) ON DUPLICATE KEY UPDATE  a0=rb_build([1,23,3]);
insert into vtt3 values(3,rb_build([1,23])) ON DUPLICATE KEY UPDATE  a0=rb_build([1,23,4]);
replace /*+ OPT_PARAM('rowsets_enabled', 'FALSE') */ into tt3 values(1,rb_build([1,2,3,4,5,6,7,8,9,10,11,12,13,14,15,16,17,18,19,20,4]));
INSERT /*+ OPT_PARAM('enable_rich_vector_format', 'FALSE') */ into vtt3 values(8,rb_build([1,2,3,4,5,6,7,8,9,10,11,12,13,14,15,16,17,18,19,20,4]));
update tt3 set a0=rb_build([1,-3]);
update /*+ OPT_PARAM('enable_rich_vector_format', 'FALSE') */  /*+ OPT_PARAM('rowsets_enabled', 'FALSE') */ vtt3 set a0=rb_build([1,5,8741]);
select * from vtt3;
+----+-----------------+
| id | a0              |
+----+-----------------+
|  1 |       %"   |
|  2 |       %"   |
|  3 |       %"   |
|  5 |       %"   |
|  8 |       %"   |
+----+-----------------+
drop table tt3;
create table tt3(id int,a roaringbitmap);
drop view vtt3;
create view vtt3 as select *from tt3;
insert into tt3 select 1, rb_build([1,2,3,4,5]);
replace into tt3 select 1, rb_build([1,2,3,4,5]);
bug 2024121300106458347   „Ää[obmysql_bitmap]ROARINGBITMAPÁ±ªÂûã ‰∏çÊîØÊåÅinsert overwriteÊìç‰Ωú„Äã
insert overwrite tt3 select 1, rb_build([1,2,3,4,5]);
ERROR 0A000: insert overwrite with direct-load does not support table has roaringbitmap column
insert  /*+ direct(true,100,'inc') enable_parallel_dml parallel(2)*/  into tt3 select 1, rb_build([1,2,3,4,5]);
replace  /*+ direct(true,100,'inc') enable_parallel_dml parallel(2)*/  into tt3 select 1, rb_build([1,2,3,4,5]);
insert  /*+ direct(true,100) enable_parallel_dml parallel(2) append*/  into tt3 select 1, rb_build([1,2,3,4,5]);
replace  /*+ direct(true,100) enable_parallel_dml parallel(2) append*/  into tt3 select 1, rb_build([1,2,3,4,5]);
insert  /*+ direct(true,100,'inc') enable_parallel_dml parallel(2)*/  into tt3 select 1, rb_build(c1) from tt1;
insert  /*+ direct(true,100,'inc') enable_parallel_dml parallel(2)*/  into tt3 select 1, rb_build(c1) from tt2;
select rb_to_string(rb_build(array(1,2,34)));
+---------------------------------------+
| rb_to_string(rb_build(array(1,2,34))) |
+---------------------------------------+
| 1,2,34                                |
+---------------------------------------+
select array(rb_build(array(1,2,34)));
ERROR 0A000: array element type not supported
select rb_to_string(rb_build(array_agg(1)));
+--------------------------------------+
| rb_to_string(rb_build(array_agg(1))) |
+--------------------------------------+
| 1                                    |
+--------------------------------------+
select array_agg(rb_build(array(1,2,34)));
ERROR 0A000: array element type not supported
select rb_to_string(rb_build(array_append([1,2,45],2)));
+--------------------------------------------------+
| rb_to_string(rb_build(array_append([1,2,45],2))) |
+--------------------------------------------------+
| 1,2,45                                           |
+--------------------------------------------------+
select array_append(rb_build(array(1,2,34)),2);
ERROR 22000: invalid obj type for type promotion: left_type=ARRAY right_type=ROARINGBITMAP
select rb_to_string(rb_build(array_map(x ->(length(x)), ['abc', 'efgaa'])));
+----------------------------------------------------------------------+
| rb_to_string(rb_build(array_map(x ->(length(x)), ['abc', 'efgaa']))) |
+----------------------------------------------------------------------+
| 3,5                                                                  |
+----------------------------------------------------------------------+
select array_map(x ->(rb_build(x)),[[1,2,3,4,5,6,7]]);
ERROR 0A000: array element type not supported
select array_map(x ->(x),rb_build([12,77]));
ERROR 22000: Invalid data type for the operation
select rb_to_string(rb_build(cardinality([1,2,3])));
ERROR 22000: invalid obj type for type promotion: left_type=ARRAY right_type=INT UNSIGNED
select cardinality(rb_build(array(1,2,34)));
ERROR 22000: invalid obj type for type promotion: left_type=ARRAY right_type=ROARINGBITMAP
select rb_to_string(rb_build(array_contains_all([1],[1])));
ERROR 22000: invalid obj type for type promotion: left_type=ARRAY right_type=INT
select array_contains_all(rb_build(array(1,2,34)),rb_build(array(1,2,34)));
ERROR 22000: invalid obj type for type promotion: left_type=ROARINGBITMAP right_type=ROARINGBITMAP
select rb_to_string(rb_build(array_overlaps([1],[1])));
ERROR 22000: invalid obj type for type promotion: left_type=ARRAY right_type=INT
select array_overlaps(rb_build(array(1,2,34)),rb_build(array(1,2,34)));
ERROR 22000: invalid obj type for type promotion: left_type=ROARINGBITMAP right_type=ROARINGBITMAP
select rb_to_string(rb_build([1,2]+[3,4]));
+-------------------------------------+
| rb_to_string(rb_build([1,2]+[3,4])) |
+-------------------------------------+
| 4,6                                 |
+-------------------------------------+
select rb_to_string(rb_build(string_to_array('1,2,3', '')));
ERROR 22000: Invalid data type for the operation
bug 2024121200106445029   „Ää[obmysql_array‰∫åÊúü]array_to_string ÂµåÂ•óÊï∞ÁªÑ‰∏≠ÁöÑnullÔºåË¢´ÊõøÊç¢ÂíåÊâìÂç∞‰∫ÜÂàÜÂâ≤Á¨¶„Äã
select rb_build([null ,[1],null]);
+----------------------------+
| rb_build([null ,[1],null]) |
+----------------------------+
|                         |
+----------------------------+
select rb_build(array_remove([1],1));
+-------------------------------+
| rb_build(array_remove([1],1)) |
+-------------------------------+
|                              |
+-------------------------------+
select sum(rb_build(c1)) from tt1;
ERROR HY000: Invalid argument
select count(rb_build(c1)) from tt1;
+---------------------+
| count(rb_build(c1)) |
+---------------------+
|                   3 |
+---------------------+
select avg(rb_build(c1)) from tt1;
ERROR HY000: Invalid argument
select min(rb_build(c1)) from tt1;
ERROR HY000: Invalid argument
select max(rb_build(c1)) from tt1;
ERROR HY000: Invalid argument
select ABS(rb_build(c1)) from tt1;
ERROR 22000: Invalid data type for the operation
select GREATEST(rb_build([1,2]),rb_build([1,2,5]));
ERROR HY000: Invalid argument
select IFNULL(rb_build([1,2]),rb_build([1,2,5]));
+-------------------------------------------+
| IFNULL(rb_build([1,2]),rb_build([1,2,5])) |
+-------------------------------------------+
|                                      |
+-------------------------------------------+
drop table tt3;
create table tt3 as select rb_build([[1,2,3,4,5,6,7,8,9,10,11,12,13,14,15,16,17,18,19,20,21,22,23,24,25,26,27,28,29,30,31,4294967296,4294967295]]) a;
desc tt3;
+-------+---------------+------+-----+---------+-------+
| Field | Type          | Null | Key | Default | Extra |
+-------+---------------+------+-----+---------+-------+
| a     | roaringbitmap | YES  |     | NULL    |       |
+-------+---------------+------+-----+---------+-------+
show create table tt3;
Table	Create Table
tt3	CREATE TABLE `tt3` (
  `a` roaringbitmap DEFAULT NULL
) ORGANIZATION INDEX DEFAULT CHARSET = utf8mb4 ROW_FORMAT = DYNAMIC COMPRESSION = 'zstd_1.3.8' REPLICA_NUM = 1 BLOCK_SIZE = 16384 USE_BLOOM_FILTER = FALSE ENABLE_MACRO_BLOCK_BLOOM_FILTER = FALSE TABLET_SIZE = 134217728 PCTFREE = 0 LOB_INROW_THRESHOLD=0
insert into tt3 values((select rb_build([1,2,3,4,5,6,7,8,9,10,11,12,13,14,15,16,17,18,19,20,21,22,23,24,25,26,27,28,29,30,31,4294967294,4294967295])));
select * from tt3;
+------------------------------------------------------------------------------------------------------------------------------+
| a                                                                                                                            |
+------------------------------------------------------------------------------------------------------------------------------+
|            :0        ˇˇ     V           	 
                      ˇˇ   :0                   |
|            :0        ˇˇ    V           	 
                      ˛ˇˇˇ                           |
+------------------------------------------------------------------------------------------------------------------------------+
drop table tt3;
create table tt3 as select rb_build(c1) a,rb_build(c3) b,rb_build(c7) c from tt1;
desc tt3;
+-------+---------------+------+-----+---------+-------+
| Field | Type          | Null | Key | Default | Extra |
+-------+---------------+------+-----+---------+-------+
| a     | roaringbitmap | YES  |     | NULL    |       |
| b     | roaringbitmap | YES  |     | NULL    |       |
| c     | roaringbitmap | YES  |     | NULL    |       |
+-------+---------------+------+-----+---------+-------+
show create table tt3;
Table	Create Table
tt3	CREATE TABLE `tt3` (
  `a` roaringbitmap DEFAULT NULL,
  `b` roaringbitmap DEFAULT NULL,
  `c` roaringbitmap DEFAULT NULL
) ORGANIZATION INDEX DEFAULT CHARSET = utf8mb4 ROW_FORMAT = DYNAMIC COMPRESSION = 'zstd_1.3.8' REPLICA_NUM = 1 BLOCK_SIZE = 16384 USE_BLOOM_FILTER = FALSE ENABLE_MACRO_BLOCK_BLOOM_FILTER = FALSE TABLET_SIZE = 134217728 PCTFREE = 0 LOB_INROW_THRESHOLD=0
insert into tt3 values(rb_build([1,2,34,4,5,6,7,8,9]),(select rb_build(c7) from tt1 where id=1),rb_build([1,2,34,4,5,6,7,8,9]));
update tt3 set a=rb_build([[1,2,4294967296,4294967295,9]]);
select * from tt3;
+---------------------------------------------+-----------------------------+-----------------------------------------+
| a                                           | b                           | c                                       |
+---------------------------------------------+-----------------------------+-----------------------------------------+
|               	       ˇˇˇˇ                |        	   Äˇˇˇ            |     ˇ   Äˇˇ                             |
|               	       ˇˇˇˇ                |        	   Äˇˇˇ            |     ˇ   Äˇˇ                             |
|               	       ˇˇˇˇ                |        	   
   Äˇˇˇ        |     ˇ   Äˇˇ                             |
|               	       ˇˇˇˇ                |     ˇ   Äˇˇ                 | 	                     	   "    |
+---------------------------------------------+-----------------------------+-----------------------------------------+
delete from tt3;
select rb_build([[1,2,4294967296,4294967295,9]]);
+---------------------------------------------+
| rb_build([[1,2,4294967296,4294967295,9]])   |
+---------------------------------------------+
|               	       ˇˇˇˇ                |
+---------------------------------------------+
drop view vtt4;
create view vtt4 as select rb_build([1,2,3,4]) a;
select * from vtt4;
+---------------------+
| a                   |
+---------------------+
|              |
+---------------------+
2024111200105070974   „Ää[obmysql_array‰∫åÊúü]rb_buildÊ≤°ÊúâÂü∫Á°ÄË°®ÂàõÂª∫ËßÜÂõæÊàêÂäüÂêéÔºådescÊü•Áúã‰∏ç‰∫ÜÊîπËßÜÂõæÁªìÊûÑ„Äã
desc vtt4;
ERROR 42S22: View 'oblrp.vtt4' references invalid table(s) or column(s) or function(s) or definer/invoker of view lack rights to use them
drop view vtt4;
create view vtt4 as select rb_build(c1)  from tt1;
select * from vtt4;
+---------------------+
| rb_build(c1)        |
+---------------------+
|     ˇˇˇ   Ä         |
|        ˇˇˇ   Ä     |
|           ˛ˇˇˇ     |
+---------------------+
desc vtt4;
+--------------+---------------+------+-----+---------+-------+
| Field        | Type          | Null | Key | Default | Extra |
+--------------+---------------+------+-----+---------+-------+
| rb_build(c1) | roaringbitmap | YES  |     | NULL    |       |
+--------------+---------------+------+-----+---------+-------+
drop table tt3;
create table tt3(id int, r roaringbitmap as (rb_build([1,2,6,7,8,9,4296967297])) STORED);
desc tt3;
+-------+---------------+------+-----+-----------------------------------------+------------------+
| Field | Type          | Null | Key | Default                                 | Extra            |
+-------+---------------+------+-----+-----------------------------------------+------------------+
| id    | int(11)       | YES  |     | NULL                                    |                  |
| r     | roaringbitmap | YES  |     | rb_build(array(1,2,6,7,8,9,4296967297)) | STORED GENERATED |
+-------+---------------+------+-----+-----------------------------------------+------------------+
insert into  tt3(id) values(1);
select * from tt3;
+------+-------------------------------------------------------------+
| id   | r                                                           |
+------+-------------------------------------------------------------+
|    1 |                                    	       ÅÑ       |
+------+-------------------------------------------------------------+
delete from tt3;
insert into  tt3(id) values(1);
truncate tt3;
select * from tt3;
+------+------+
| id   | r    |
+------+------+
+------+------+
drop table tt3;
create table tt3(id int, r roaringbitmap as (rb_build([1,2,6,7,8,9,4296967297])) VIRTUAL);
desc tt3;
+-------+---------------+------+-----+-----------------------------------------+-------------------+
| Field | Type          | Null | Key | Default                                 | Extra             |
+-------+---------------+------+-----+-----------------------------------------+-------------------+
| id    | int(11)       | YES  |     | NULL                                    |                   |
| r     | roaringbitmap | YES  |     | rb_build(array(1,2,6,7,8,9,4296967297)) | VIRTUAL GENERATED |
+-------+---------------+------+-----+-----------------------------------------+-------------------+
insert into  tt3(id) values(1);
select * from tt3;
+------+-------------------------------------------------------------+
| id   | r                                                           |
+------+-------------------------------------------------------------+
|    1 |                                    	       ÅÑ       |
+------+-------------------------------------------------------------+
drop table tt3;
create table tt3(id int);
insert into tt3 values(1);
ALTER TABLE tt3
ADD COLUMN r roaringbitmap AS (rb_build([1,2,6,7,8,9,4296967297])) STORED;
desc tt3;
+-------+---------------+------+-----+-----------------------------------------+------------------+
| Field | Type          | Null | Key | Default                                 | Extra            |
+-------+---------------+------+-----+-----------------------------------------+------------------+
| id    | int(11)       | YES  |     | NULL                                    |                  |
| r     | roaringbitmap | YES  |     | rb_build(array(1,2,6,7,8,9,4296967297)) | STORED GENERATED |
+-------+---------------+------+-----+-----------------------------------------+------------------+
insert into  tt3(id) values(1);
select * from tt3;
+------+-------------------------------------------------------------+
| id   | r                                                           |
+------+-------------------------------------------------------------+
|    1 |                                    	       ÅÑ       |
|    1 |                                    	       ÅÑ       |
+------+-------------------------------------------------------------+
delete from tt3;
insert into  tt3(id) values(1);
select * from tt3;
+------+-------------------------------------------------------------+
| id   | r                                                           |
+------+-------------------------------------------------------------+
|    1 |                                    	       ÅÑ       |
+------+-------------------------------------------------------------+
truncate tt3;
select * from tt3;
+------+------+
| id   | r    |
+------+------+
+------+------+
drop table tt3;
create table tt3(id int);
insert into tt3 values(1);
ALTER TABLE tt3
ADD COLUMN r roaringbitmap AS (rb_build([1,2,6,7,8,9,4296967297])) VIRTUAL;
desc tt3;
+-------+---------------+------+-----+-----------------------------------------+-------------------+
| Field | Type          | Null | Key | Default                                 | Extra             |
+-------+---------------+------+-----+-----------------------------------------+-------------------+
| id    | int(11)       | YES  |     | NULL                                    |                   |
| r     | roaringbitmap | YES  |     | rb_build(array(1,2,6,7,8,9,4296967297)) | VIRTUAL GENERATED |
+-------+---------------+------+-----+-----------------------------------------+-------------------+
insert into  tt3(id) values(1);
select * from tt3;
+------+-------------------------------------------------------------+
| id   | r                                                           |
+------+-------------------------------------------------------------+
|    1 |                                    	       ÅÑ       |
|    1 |                                    	       ÅÑ       |
+------+-------------------------------------------------------------+
delete from tt3;
insert into  tt3(id) values(1);
select * from tt3;
+------+-------------------------------------------------------------+
| id   | r                                                           |
+------+-------------------------------------------------------------+
|    1 |                                    	       ÅÑ       |
+------+-------------------------------------------------------------+
truncate tt3;
select * from tt3;
+------+------+
| id   | r    |
+------+------+
+------+------+
drop table tt3;
create table tt3(id int,a varchar(50),r roaringbitmap, INDEX index_1((rb_build([1,2]))));
ERROR 42000: The used storage engine can't index column 'SYS_NC19$'
drop table tt3;
create table tt3(id int,a varchar(50),r roaringbitmap);
CREATE INDEX index_1 ON tt3 ((rb_build([1,2])));
ERROR 42000: The used storage engine can't index column 'SYS_NC19$'
alter table tt3 add index index_1((rb_build([1,2])));
ERROR 42000: The used storage engine can't index column 'SYS_NC19$'
########Ê∏ÖÁ©∫ÂõûÊî∂Á´ôÔºåÂà†Èô§ÊµãËØïÊï∞ÊçÆÂ∫ìÔºåË°®Á≠â ##########
drop database  IF EXISTS  oblrp;
purge recyclebin;
