drop database if exists bit1;
create database bit1;
use bit1;
bit1- ddl;
bit-1-1		create
create table t1(id bit());
ERROR 42000: You have an error in your SQL syntax; check the manual that corresponds to your OceanBase version for the right syntax to use near '))' at line 1
create table t1(id bit(-1));
ERROR 42000: You have an error in your SQL syntax; check the manual that corresponds to your OceanBase version for the right syntax to use near '-1))' at line 1
create table t2(id bit(1));
create table t3(id bit(64));
create table t4(id bit(65));
ERROR 42000: Display width out of range for column 'id' (max = 64)
create table t5(id bit);
drop tables t3,t5;
drop table  t2;
create table t1(id bit(1));
alter table t1 add tid bit(64);
alter table t1 change id id bit(8);
desc t1;
Field	Type	Null	Key	Default	Extra
id	bit(8)	YES		NULL	
tid	bit(64)	YES		NULL	
alter table t1 change id id int;
desc t1;
Field	Type	Null	Key	Default	Extra
id	int(11)	YES		NULL	
tid	bit(64)	YES		NULL	
alter table t1 drop tid;
desc t1;
Field	Type	Null	Key	Default	Extra
id	int(11)	YES		NULL	
drop  table t1;
create table t1(id bit(8));
insert into t1 values(b'11111');
truncate table t1;
select bin(id) from t1;
bin(id)
drop table t1;
create table t1(id bit comment'用户id')comment='表的注释';
alter table t1 change column id id bit comment'测试id';
alter table t1 comment'修改后的注释';
alter table t1 modify column id bit comment'修改后的字段注释';
show full columns from t1;
Field	Type	Collation	Null	Key	Default	Extra	Privileges	Comment
id	bit(1)	NULL	YES		NULL		SELECT,INSERT,UPDATE,REFERENCES	修改后的字段注释
show create table t1;
Table	Create Table
t1	CREATE TABLE `t1` (
  `id` bit(1) DEFAULT NULL COMMENT '修改后的字段注释'
) ORGANIZATION INDEX DEFAULT CHARSET = utf8mb4 ROW_FORMAT = DYNAMIC COMPRESSION = 'zstd_1.3.8' REPLICA_NUM = 1 BLOCK_SIZE = 16384 USE_BLOOM_FILTER = FALSE ENABLE_MACRO_BLOCK_BLOOM_FILTER = FALSE TABLET_SIZE = 134217728 PCTFREE = 0 COMMENT = '修改后的注释'
drop table t1;
create table vt(id bit(8),sex bit);
create view v1 as (select * from vt);
desc v1;
Field	Type	Null	Key	Default	Extra
id	bit(8)	YES		NULL	
sex	bit(1)	YES		NULL	
create view v2(id) as (select id from vt);
desc v2;
Field	Type	Null	Key	Default	Extra
id	bit(8)	YES		NULL	
drop view v1,v2;
create table t3(id bit not null,unique index uniqueidx(id));
show index from t3;
Table	Non_unique	Key_name	Seq_in_index	Column_name	Collation	Cardinality	Sub_part	Packed	Null	Index_type	Comment	Index_comment	Visible	Expression
t3	0	uniqueidx	1	id	A	NULL	NULL	NULL		BTREE	available		YES	NULL
create table t4(id bit not null,sex bit not null,index Multildx(id,sex));
create table t1 (id bit(64));
alter table t1 add index xid(id);
alter table t1 add unique index uxid(id);
create index idx_t1 on t1(id);
create unique index u_xid on t1(id);
create table tt1(id bit(8),sex bit);
alter table tt1 add index zuheidx(id,sex);
drop tables tt1,t1,t3,t4;
NOT NULL
create table t1(id bit not null);
desc t1;
Field	Type	Null	Key	Default	Extra
id	bit(1)	NO		NULL	
PRIMARY KEY
create table t2(id bit(8) primary key);
desc t2;
Field	Type	Null	Key	Default	Extra
id	bit(8)	NO	PRI	NULL	
UNIQUE
create table t3(id bit(8),unique(id));
desc t3;
Field	Type	Null	Key	Default	Extra
id	bit(8)	YES	UNI	NULL	
FOREIGN KEY
create table t4(id bit(8) primary key,tid bit(8),constraint fk_tid foreign key(tid)references t2(id));
desc t4;
Field	Type	Null	Key	Default	Extra
id	bit(8)	NO	PRI	NULL	
tid	bit(8)	YES		NULL	
CHECK
drop tables t1,t2,t3,t4;
#hash
create  table part1(id bit(64)) partition by hash(id);
insert  into  part1  values(1),(3),(5);
delete  from  part1  where  id = 3;
update  part1 set id = b'111'  where id = 5;
select  hex(id)  from part1;
hex(id)
1
7
drop    table part1;
#key
create  table part1(id bit(64)) partition by key(id);
insert  into  part1  values(1),(3),(5);
delete  from  part1  where  id = 3;
update  part1 set id = b'111'  where id = 5;
select  hex(id)  from part1;
hex(id)
1
7
drop    tables part1;
#range
create  table part1(id bit(64)) partition by range(id)(partition p0 values less than maxvalue);
insert  into  part1  partition(p0)  values(1),(3),(5);
delete  from  part1  partition(p0)  where  id = 3;
update  part1 partition(p0) set  id = b'111'  where id = 5;
select  hex(id)  from  part1 partition(p0);
hex(id)
1
7
insert  into  part1  values(3);
delete  from  part1  where  id = 1;
update  part1 set id = b'111'  where id = 3;
select  hex(id)  from part1;
hex(id)
7
7
drop 	tables part1;
#list
create 	table part1(id bit(64)) partition by list(id)(partition p0 values in(1,2));
insert  into  part1  partition(p0)  values(1),(2);
delete  from  part1  partition(p0)  where  id = 1;
update  part1 partition(p0) set  id = b'111'  where id = 1;
select  hex(id)  from  part1 partition(p0);
hex(id)
2
insert  into  part1  values(1),(2);
delete  from  part1  where  id = 1;
update  part1 set id = b'111'  where id = 3;
select  hex(id)  from part1;
hex(id)
2
2
drop    tables part1;
create 	table part1(id bit(64)) partition by list columns(id) (partition p0 values in (1,2));
ERROR HY000: Field 'id' is of a not allowed type for this type of partitioning
drop database bit1;
