drop database if exists bit1;
create database bit1;
use bit1;
create table t1(a1 bit(8),b1 bit(8));
insert into t1 values(b'1111',b'10000000');
select bit_count(a1) from t1;
bit_count(a1)
4
select bit_length(a1) from t1;
bit_length(a1)
8
select bit_and(a1) from t1;
bit_and(a1)
15
select bit_or(a1) from t1;
bit_or(a1)
15
select bit_xor(a1) from t1;
bit_xor(a1)
15
drop table t1;
concat
create table t1(c1 bit(64),c2 int,c3 double,c4 date,c5 time,c6 char(20));
insert into  t1  values(b'11111',123,123.123,'20210630','173805','111');
select  concat(bin(c1),c2)   from t1;
concat(bin(c1),c2)
11111123
select  concat(bin(c1),c3)   from t1;
concat(bin(c1),c3)
11111123.123
select  concat(bin(c1),c4)   from t1;
concat(bin(c1),c4)
111112021-06-30
select  concat(bin(c1),c5)   from t1;
concat(bin(c1),c5)
1111117:38:05
select  concat(bin(c1),c6)   from t1;
concat(bin(c1),c6)
11111111
select  concat(c2,bin(c1))   from t1;
concat(c2,bin(c1))
12311111
select  concat(c3,bin(c1))   from t1;
concat(c3,bin(c1))
123.12311111
select  concat(c4,bin(c1))   from t1;
concat(c4,bin(c1))
2021-06-3011111
select  concat(c5,bin(c1))   from t1;
concat(c5,bin(c1))
17:38:0511111
select  concat(c6,bin(c1))   from t1;
concat(c6,bin(c1))
11111111
drop    table   t1;
length
create table t1(c1 bit(8),c2 bit(16));
insert into t1 values(b'11111111',64);
select length(c1) from t1;
length(c1)
1
select length(c2) from t1;
length(c2)
2
select length(c1+c2) from t1;
length(c1+c2)
3
select length(c1-c2) from t1;
length(c1-c2)
3
select length(c2-c1) from t1;
ERROR 22003: BIGINT UNSIGNED value is out of range in ''(64 - 255)''
drop 	table	t1;
ceil
create table t1(c1 bit(8),c2 bit(8));
insert into t1 values(b'11111111',16);
select ceil(c1) from t1;
ceil(c1)
255
select ceil(c2)	from t1;
ceil(c2)
16
select ceiling(c1) from t1;
ceiling(c1)
255
select ceiling(c2) from t1;
ceiling(c2)
16
drop	table   t1;
floor
create table t1(c1 bit(8),c2 bit(8));
insert into t1 values(b'11111111',64);
select floor(c1) from t1;
floor(c1)
255
select floor(c2) from t1;
floor(c2)
64
drop	table	t1;
round
create table t1(c1 bit(8),c2 bit(8));
insert into t1 values(b'11111111',64);
select round(c1) from t1;
round(c1)
255
select round(c2) from t1;
round(c2)
64
drop	table	t1;
abs
create table t1(c1 bit(8),c2 bit(8));
insert into t1 values(b'11111111',64);
select abs(c1) from t1;
abs(c1)
255
select abs(c2) from t1;
abs(c2)
64
select abs(-c1)	from t1;
abs(-c1)
255
select abs(-c2)	from t1;
abs(-c2)
64
drop	table	t1;
bin
create table t1(c1 bit(8),c2 bit(8));
insert into t1 values(b'11111111',64);
select bin(c1) from t1;
bin(c1)
11111111
select bin(c2) from t1;
bin(c2)
1000000
drop	table   t1;
char         
create table t1(c1 bit(8),c2 bit(8));
insert into t1 values(b'1111',b'1111');
update t1 set c2 = CHAR(123) where c1 = b'1111';
select bin(c1),bin(c2) from t1;
bin(c1)	bin(c2)
1111	1111011
drop	table	t1;
greatest
create table t1 (c1 bit(8),c2 bit(8),c3 bit(8));
insert into t1 values(b'1111',16,b'1110');
select greatest(c1,c2) from t1;
greatest(c1,c2)
16
select greatest(c1,c3) from t1;
greatest(c1,c3)
15
select greatest(c3,c2) from t1;
greatest(c3,c2)
16
drop table t1;
least
create table t1 (c1 bit(8),c2 bit(8),c3 bit(8));
insert into t1 values(b'1111',16,b'1110');
select least(c1,c2) from t1;
least(c1,c2)
15
select least(c1,c3) from t1;
least(c1,c3)
14
select least(c3,c2) from t1;
least(c3,c2)
14
drop table t1;
cast
select cast(b'1100100' as binary);
cast(b'1100100' as binary)
d
select cast(b'1100100' as char);
cast(b'1100100' as char)
d
select cast(b'1100100' as date);
cast(b'1100100' as date)
NULL
select cast(b'1100100' as datetime);
cast(b'1100100' as datetime)
NULL
select cast(b'1100100' as time);
cast(b'1100100' as time)
00:00:00
select cast(b'1100100' as decimal);
cast(b'1100100' as decimal)
100
select cast(b'1100100' as signed);
cast(b'1100100' as signed)
100
select cast(b'1100100' as unsigned);
cast(b'1100100' as unsigned)
100
Aggregation function
create table t1(c1 bit(16));
insert into t1 values(b'1110'),(20),(b'1010101'),(60),(b'10');
select sum(c1) from t1;
sum(c1)
181
select avg(c1) from t1;
avg(c1)
36.2000
select min(hex(c1)) from t1;
min(hex(c1))
14
select min(hex(c1)) from t1;
min(hex(c1))
14
select count(c1) from t1;
count(c1)
5
drop table t1;
no parameter
drop procedure if exists pro1;
create  table  t1(c1 bit(8));
create procedure pro1()
begin
declare  i  bit(8);
set    i = b'11111111';
insert into t1 values(i);
select bin(c1) from t1;
end//
call pro1();
bin(c1)
11111111
select bin(c1) from t1;
bin(c1)
11111111
drop table if exists t1;
drop procedure if exists pro1;
create  table  t1(c1 bit(8));
create procedure pro1()
begin
declare  i   int;
set    i  =  1;
while  i  <b'1111'
        do
insert into t1 values(b'101010');
set i=i+1; 
end  while;
select bin(c1) from t1;
end//
call pro1();
bin(c1)
101010
101010
101010
101010
101010
101010
101010
101010
101010
101010
101010
101010
101010
101010
select bin(c1) from t1;
bin(c1)
101010
101010
101010
101010
101010
101010
101010
101010
101010
101010
101010
101010
101010
101010
A parameter
drop table if exists t1;
drop procedure if exists pro1;
create table t1(c1 bit(64));
create procedure pro1(a bit(64))
begin
declare i int;
set i =1;
while i<a     
do
insert into t1 values(b'100010');
set i=i+1;
end while;
end//
call pro1(b'110');
select  bin(c1) from t1;
bin(c1)
100010
100010
100010
100010
100010
#function
drop table if exists t1;
drop function if exists func1;
create  table  t1(c1 bit(8));
create function  func1() returns int
begin
declare  i  bit(8);
set    i = b'11111111';
insert into t1 values(i);
return  1;
end//
select func1();
func1()
1
select hex(c1) from t1;
hex(c1)
FF
drop table if exists t1;
drop function if exists func1;
create  table  t1(c1 bit(8));
create function func1() returns int
begin
declare  i   int;
set    i  =  1;
while  i  <b'1111'
        do
insert into t1 values(b'101010');
set i=i+1; 
end  while;
return 1;
end//
select func1();
func1()
1
select hex(c1) from t1;
hex(c1)
2A
2A
2A
2A
2A
2A
2A
2A
2A
2A
2A
2A
2A
2A
drop table if exists t1;
drop function if exists func1;
create table t1(c1 bit(64));
create function func1(a bit(64)) returns int
begin
declare i int;
set i =1;
while i<a     
do
insert into t1 values(b'100010');
set i=i+1;
end while;
return 1;
end//
select func1(10);
func1(10)
1
select  hex(c1) from t1;
hex(c1)
22
22
22
22
22
22
22
22
22
drop database bit1;
