purge recyclebin;
#
# Start of 5.5 tests
#
SET NAMES latin1;
select hex('a'), hex('a ');
hex('a')	hex('a ')
61	6120
select hex(_utf16 0x44);
hex(_utf16 0x44)
0044
select hex(_utf16 0x3344);
hex(_utf16 0x3344)
3344
select hex(_utf16 0x113344);
hex(_utf16 0x113344)
00113344
DROP TABLE t1;
CREATE TABLE t1 (word VARCHAR(64), word2 CHAR(64)) CHARACTER SET utf16;
INSERT INTO t1 VALUES  (X'2004',X'2004');
SELECT hex(word) FROM t1 ORDER BY word;
hex(word)
2004
SELECT hex(word2) FROM t1 ORDER BY word2;
hex(word2)
2004
DELETE FROM t1;
INSERT INTO t1 VALUES (X'042000200020',X'042000200020'), (X'200400200020', X'200400200020');
SELECT hex(word) FROM t1 ORDER BY word;
hex(word)
042000200020
200400200020
SELECT hex(word2) FROM t1 ORDER BY word2;
hex(word2)
0420
2004
DROP TABLE t1;
SELECT hex(LPAD(_utf16 X'0420',10,_utf16 X'0421'));
hex(LPAD(_utf16 X'0420',10,_utf16 X'0421'))
0421042104210421042104210421042104210420
SELECT hex(LPAD(_utf16 X'0420',10,_utf16 X'04210422'));
hex(LPAD(_utf16 X'0420',10,_utf16 X'04210422'))
0421042204210422042104220421042204210420
SELECT hex(LPAD(_utf16 X'0420',10,_utf16 X'042104220423'));
hex(LPAD(_utf16 X'0420',10,_utf16 X'042104220423'))
0421042204230421042204230421042204230420
SELECT hex(LPAD(_utf16 X'0420042104220423042404250426042704280429042A042B',10,_utf16 X'042104220423'));
hex(LPAD(_utf16 X'0420042104220423042404250426042704280429042A042B',10,_utf16 X'042104220423'))
0420042104220423042404250426042704280429
SELECT hex(LPAD(_utf16 X'D800DC00', 10, _utf16 X'0421'));
hex(LPAD(_utf16 X'D800DC00', 10, _utf16 X'0421'))
042104210421042104210421042104210421D800DC00
SELECT hex(LPAD(_utf16 X'0421', 10, _utf16 X'D800DC00'));
hex(LPAD(_utf16 X'0421', 10, _utf16 X'D800DC00'))
D800DC00D800DC00D800DC00D800DC00D800DC00D800DC00D800DC00D800DC00D800DC000421
SELECT hex(RPAD(_utf16 X'0420',10,_utf16 X'0421'));
hex(RPAD(_utf16 X'0420',10,_utf16 X'0421'))
0420042104210421042104210421042104210421
SELECT hex(RPAD(_utf16 X'0420',10,_utf16 X'04210422'));
hex(RPAD(_utf16 X'0420',10,_utf16 X'04210422'))
0420042104220421042204210422042104220421
SELECT hex(RPAD(_utf16 X'0420',10,_utf16 X'042104220423'));
hex(RPAD(_utf16 X'0420',10,_utf16 X'042104220423'))
0420042104220423042104220423042104220423
SELECT hex(RPAD(_utf16 X'0420042104220423042404250426042704280429042A042B',10,_utf16 X'042104220423'));
hex(RPAD(_utf16 X'0420042104220423042404250426042704280429042A042B',10,_utf16 X'042104220423'))
0420042104220423042404250426042704280429
SELECT hex(RPAD(_utf16 X'D800DC00', 10, _utf16 X'0421'));
hex(RPAD(_utf16 X'D800DC00', 10, _utf16 X'0421'))
D800DC00042104210421042104210421042104210421
SELECT hex(RPAD(_utf16 X'0421', 10, _utf16 X'D800DC00'));
hex(RPAD(_utf16 X'0421', 10, _utf16 X'D800DC00'))
0421D800DC00D800DC00D800DC00D800DC00D800DC00D800DC00D800DC00D800DC00D800DC00
CREATE TABLE t1 SELECT 
LPAD(_utf16 X'0420',10,_utf16 X'0421') l,
RPAD(_utf16 X'0420',10,_utf16 X'0421') r;
ERROR HY000: Incorrect string value
create table t1 (f1 char(30));
insert into t1 values ("103000"), ("22720000"), ("3401200"), ("78000");
select lpad(f1, 12, "-o-/") from t1;
lpad(f1, 12, "-o-/")
-o-/-3401200
-o-/-o-78000
-o-/-o103000
-o-/22720000
drop table t1;
SET NAMES latin1;
select @@collation_connection;
@@collation_connection
latin1_swedish_ci
create table t1 as select repeat(' ',10) as a union select null;
alter table t1 add key(a);
show create table t1;
Table	Create Table
  KEY `a` (`a`) BLOCK_SIZE 16384 LOCAL
  `a` varchar(512) CHARACTER SET latin1 DEFAULT NULL,
) ORGANIZATION INDEX DEFAULT CHARSET = utf8mb4 ROW_FORMAT = DYNAMIC COMPRESSION = 'zstd_1.3.8' REPLICA_NUM = 1 BLOCK_SIZE = 16384 USE_BLOOM_FILTER = FALSE ENABLE_MACRO_BLOCK_BLOOM_FILTER = FALSE TABLET_SIZE = 134217728 PCTFREE = 0
t1	CREATE TABLE `t1` (
insert into t1 values ("a"),("abc"),("abcd"),("hello"),("test");
explain select * from t1 where a like 'abc%';
Query Plan
=================================================
|ID|OPERATOR        |NAME |EST.ROWS|EST.TIME(us)|
-------------------------------------------------
|0 |TABLE RANGE SCAN|t1(a)|2       |3           |
=================================================
Outputs & filters:
-------------------------------------
  0 - output([t1.a]), filter(nil), rowset=16
      access([t1.a]), partitions(p0)
      is_index_back=false, is_global_index=false, 
      range_key([t1.a], [t1.__pk_increment]), range(abc
      
      ,
      MIN ; abcÿÿÿÿÿÿÿÿÿÿÿÿÿÿÿÿÿÿÿÿÿÿÿÿÿÿÿÿÿÿÿÿÿÿÿÿÿÿÿÿÿÿÿÿÿÿÿÿÿÿÿÿÿÿÿÿÿÿÿÿÿÿÿÿÿÿÿÿÿÿÿÿÿÿÿÿÿÿÿÿÿÿÿÿÿÿÿÿÿÿÿÿÿÿÿÿ
      ÿÿÿÿÿÿÿÿÿÿÿÿÿÿÿÿÿÿÿÿÿÿÿÿÿÿÿÿÿÿÿÿÿÿÿÿÿÿÿÿÿÿÿÿÿÿÿÿÿÿÿÿÿÿÿÿÿÿÿÿÿÿÿÿÿÿÿÿÿÿÿÿÿÿÿÿÿÿÿÿÿÿÿÿÿÿÿÿÿÿÿÿÿÿÿÿÿÿÿÿ
      ?ÿÿÿÿÿÿÿÿÿÿÿÿÿÿÿÿÿÿÿÿÿÿÿÿÿÿÿÿÿÿÿÿÿÿÿÿÿÿÿÿÿÿÿÿÿÿÿÿÿÿÿÿÿÿÿÿÿÿÿÿÿÿÿÿÿÿÿÿÿÿÿÿÿÿÿÿÿÿÿÿÿÿÿÿÿÿÿÿÿÿÿÿÿÿÿÿÿÿÿÿ
      ÿÿÿÿÿÿÿÿÿÿÿÿÿÿÿÿÿÿÿÿÿÿÿÿÿÿÿÿÿÿÿÿÿÿÿÿÿÿÿÿÿÿÿÿÿÿÿÿÿÿÿÿÿÿÿÿÿÿÿÿÿÿÿÿÿÿÿÿÿÿÿÿÿÿÿÿÿÿÿÿÿÿÿÿÿÿÿÿÿÿÿÿÿÿÿÿÿÿÿÿ
      ?ÿÿÿÿÿÿÿÿÿÿÿÿÿÿÿÿÿÿÿÿÿÿÿÿÿÿÿÿÿÿÿÿÿÿÿÿÿÿÿÿÿÿÿÿÿÿÿÿÿÿÿÿÿÿÿÿÿÿÿÿÿÿÿÿÿÿÿÿÿÿÿÿÿÿÿÿÿÿÿÿÿÿÿÿÿÿÿÿÿÿÿÿÿÿÿÿÿÿÿÿ
      ÿÿÿÿÿÿÿÿÿÿÿ,MAX), 
      range_cond([(T_OP_LIKE, t1.a, 'abc%', '\\')])
explain select * from t1 where a like concat('abc','%');
Query Plan
=================================================
|ID|OPERATOR        |NAME |EST.ROWS|EST.TIME(us)|
-------------------------------------------------
|0 |TABLE RANGE SCAN|t1(a)|2       |3           |
=================================================
Outputs & filters:
-------------------------------------
  0 - output([t1.a]), filter(nil), rowset=16
      access([t1.a]), partitions(p0)
      is_index_back=false, is_global_index=false, 
      range_key([t1.a], [t1.__pk_increment]), range(abc
      
      ,
      MIN ; abcÿÿÿÿÿÿÿÿÿÿÿÿÿÿÿÿÿÿÿÿÿÿÿÿÿÿÿÿÿÿÿÿÿÿÿÿÿÿÿÿÿÿÿÿÿÿÿÿÿÿÿÿÿÿÿÿÿÿÿÿÿÿÿÿÿÿÿÿÿÿÿÿÿÿÿÿÿÿÿÿÿÿÿÿÿÿÿÿÿÿÿÿÿÿÿÿ
      ÿÿÿÿÿÿÿÿÿÿÿÿÿÿÿÿÿÿÿÿÿÿÿÿÿÿÿÿÿÿÿÿÿÿÿÿÿÿÿÿÿÿÿÿÿÿÿÿÿÿÿÿÿÿÿÿÿÿÿÿÿÿÿÿÿÿÿÿÿÿÿÿÿÿÿÿÿÿÿÿÿÿÿÿÿÿÿÿÿÿÿÿÿÿÿÿÿÿÿÿ
      ?ÿÿÿÿÿÿÿÿÿÿÿÿÿÿÿÿÿÿÿÿÿÿÿÿÿÿÿÿÿÿÿÿÿÿÿÿÿÿÿÿÿÿÿÿÿÿÿÿÿÿÿÿÿÿÿÿÿÿÿÿÿÿÿÿÿÿÿÿÿÿÿÿÿÿÿÿÿÿÿÿÿÿÿÿÿÿÿÿÿÿÿÿÿÿÿÿÿÿÿÿ
      ÿÿÿÿÿÿÿÿÿÿÿÿÿÿÿÿÿÿÿÿÿÿÿÿÿÿÿÿÿÿÿÿÿÿÿÿÿÿÿÿÿÿÿÿÿÿÿÿÿÿÿÿÿÿÿÿÿÿÿÿÿÿÿÿÿÿÿÿÿÿÿÿÿÿÿÿÿÿÿÿÿÿÿÿÿÿÿÿÿÿÿÿÿÿÿÿÿÿÿÿ
      ?ÿÿÿÿÿÿÿÿÿÿÿÿÿÿÿÿÿÿÿÿÿÿÿÿÿÿÿÿÿÿÿÿÿÿÿÿÿÿÿÿÿÿÿÿÿÿÿÿÿÿÿÿÿÿÿÿÿÿÿÿÿÿÿÿÿÿÿÿÿÿÿÿÿÿÿÿÿÿÿÿÿÿÿÿÿÿÿÿÿÿÿÿÿÿÿÿÿÿÿÿ
      ÿÿÿÿÿÿÿÿÿÿÿ,MAX), 
      range_cond([(T_OP_LIKE, t1.a, concat('abc', '%'), '\\')])
select * from t1 where a like "abc%";
a
abc
abcd
select * from t1 where a like concat("abc","%");
a
abc
abcd
select * from t1 where a like "ABC%";
a
abc
abcd
select * from t1 where a like "test%";
a
test
select * from t1 where a like "te_t";
a
test
select * from t1 where a like "%a%";
a
a
abc
abcd
select * from t1 where a like "%abcd%";
a
abcd
select * from t1 where a like "%abc\d%";
a
abcd
drop table t1;
select 'AA' like 'AA';
'AA' like 'AA'
1
select 'AA' like 'A%A';
'AA' like 'A%A'
1
select 'AA' like 'A%%A';
'AA' like 'A%%A'
1
select 'AA' like 'AA%';
'AA' like 'AA%'
1
select 'AA' like '%AA%';
'AA' like '%AA%'
1
select 'AA' like '%A';
'AA' like '%A'
1
select 'AA' like '%AA';
'AA' like '%AA'
1
select 'AA' like 'A%A%';
'AA' like 'A%A%'
1
select 'AA' like '_%_%';
'AA' like '_%_%'
1
select 'AA' like '%A%A';
'AA' like '%A%A'
1
select 'AAA'like 'A%A%A';
'AAA'like 'A%A%A'
1
select 'AZ' like 'AZ';
'AZ' like 'AZ'
1
select 'AZ' like 'A%Z';
'AZ' like 'A%Z'
1
select 'AZ' like 'A%%Z';
'AZ' like 'A%%Z'
1
select 'AZ' like 'AZ%';
'AZ' like 'AZ%'
1
select 'AZ' like '%AZ%';
'AZ' like '%AZ%'
1
select 'AZ' like '%Z';
'AZ' like '%Z'
1
select 'AZ' like '%AZ';
'AZ' like '%AZ'
1
select 'AZ' like 'A%Z%';
'AZ' like 'A%Z%'
1
select 'AZ' like '_%_%';
'AZ' like '_%_%'
1
select 'AZ' like '%A%Z';
'AZ' like '%A%Z'
1
select 'AZ' like 'A_';
'AZ' like 'A_'
1
select 'AZ' like '_Z';
'AZ' like '_Z'
1
select 'AMZ'like 'A%M%Z';
'AMZ'like 'A%M%Z'
1
SET NAMES utf8;
CREATE TABLE t1 (a VARCHAR(10) CHARACTER SET utf16);
INSERT INTO t1 VALUES ('Ñ„Ñ‹Ð²Ð°'),('Ð¤Ñ‹Ð²Ð°'),('Ñ„Ð«Ð²Ð°'),('Ñ„Ñ‹Ð’Ð°'),('Ñ„Ñ‹Ð²Ð'),('Ð¤Ð«Ð’Ð');
INSERT INTO t1 VALUES ('Ñ„Ñ‹Ð²Ð°Ð¿Ñ€Ð¾Ð»Ð´Ð¶'),('Ð¤Ñ‹Ð²Ð°Ð¿Ñ€Ð¾Ð»Ð´Ð¶'),('Ñ„Ð«Ð²Ð°Ð¿Ñ€Ð¾Ð»Ð´Ð¶'),('Ñ„Ñ‹Ð’Ð°Ð¿Ñ€Ð¾Ð»Ð´Ð¶');
INSERT INTO t1 VALUES ('Ñ„Ñ‹Ð²ÐÐ¿Ñ€Ð¾Ð»Ð´Ð¶'),('Ñ„Ñ‹Ð²Ð°ÐŸÑ€Ð¾Ð»Ð´Ð¶'),('Ñ„Ñ‹Ð²Ð°Ð¿Ð Ð¾Ð»Ð´Ð¶'),('Ñ„Ñ‹Ð²Ð°Ð¿Ñ€ÐžÐ»Ð´Ð¶');
INSERT INTO t1 VALUES ('Ñ„Ñ‹Ð²Ð°Ð¿Ñ€Ð¾Ð›Ð´Ð¶'),('Ñ„Ñ‹Ð²Ð°Ð¿Ñ€Ð¾Ð»Ð”Ð¶'),('Ñ„Ñ‹Ð²Ð°Ð¿Ñ€Ð¾Ð»Ð´Ð–'),('Ð¤Ð«Ð’ÐÐŸÐ ÐžÐ›Ð”Ð–');
SELECT * FROM t1 WHERE a LIKE '%Ñ„Ð«Ð²Ð°%' ORDER BY BINARY a;
a
Ð¤Ð«Ð’Ð
Ð¤Ð«Ð’ÐÐŸÐ ÐžÐ›Ð”Ð–
Ð¤Ñ‹Ð²Ð°
Ð¤Ñ‹Ð²Ð°Ð¿Ñ€Ð¾Ð»Ð´Ð¶
Ñ„Ð«Ð²Ð°
Ñ„Ð«Ð²Ð°Ð¿Ñ€Ð¾Ð»Ð´Ð¶
Ñ„Ñ‹Ð’Ð°
Ñ„Ñ‹Ð’Ð°Ð¿Ñ€Ð¾Ð»Ð´Ð¶
Ñ„Ñ‹Ð²Ð
Ñ„Ñ‹Ð²ÐÐ¿Ñ€Ð¾Ð»Ð´Ð¶
Ñ„Ñ‹Ð²Ð°
Ñ„Ñ‹Ð²Ð°ÐŸÑ€Ð¾Ð»Ð´Ð¶
Ñ„Ñ‹Ð²Ð°Ð¿Ð Ð¾Ð»Ð´Ð¶
Ñ„Ñ‹Ð²Ð°Ð¿Ñ€ÐžÐ»Ð´Ð¶
Ñ„Ñ‹Ð²Ð°Ð¿Ñ€Ð¾Ð›Ð´Ð¶
Ñ„Ñ‹Ð²Ð°Ð¿Ñ€Ð¾Ð»Ð”Ð¶
Ñ„Ñ‹Ð²Ð°Ð¿Ñ€Ð¾Ð»Ð´Ð–
Ñ„Ñ‹Ð²Ð°Ð¿Ñ€Ð¾Ð»Ð´Ð¶
SELECT * FROM t1 WHERE a LIKE '%Ñ„Ð«Ð²%' ORDER BY BINARY a;
a
Ð¤Ð«Ð’Ð
Ð¤Ð«Ð’ÐÐŸÐ ÐžÐ›Ð”Ð–
Ð¤Ñ‹Ð²Ð°
Ð¤Ñ‹Ð²Ð°Ð¿Ñ€Ð¾Ð»Ð´Ð¶
Ñ„Ð«Ð²Ð°
Ñ„Ð«Ð²Ð°Ð¿Ñ€Ð¾Ð»Ð´Ð¶
Ñ„Ñ‹Ð’Ð°
Ñ„Ñ‹Ð’Ð°Ð¿Ñ€Ð¾Ð»Ð´Ð¶
Ñ„Ñ‹Ð²Ð
Ñ„Ñ‹Ð²ÐÐ¿Ñ€Ð¾Ð»Ð´Ð¶
Ñ„Ñ‹Ð²Ð°
Ñ„Ñ‹Ð²Ð°ÐŸÑ€Ð¾Ð»Ð´Ð¶
Ñ„Ñ‹Ð²Ð°Ð¿Ð Ð¾Ð»Ð´Ð¶
Ñ„Ñ‹Ð²Ð°Ð¿Ñ€ÐžÐ»Ð´Ð¶
Ñ„Ñ‹Ð²Ð°Ð¿Ñ€Ð¾Ð›Ð´Ð¶
Ñ„Ñ‹Ð²Ð°Ð¿Ñ€Ð¾Ð»Ð”Ð¶
Ñ„Ñ‹Ð²Ð°Ð¿Ñ€Ð¾Ð»Ð´Ð–
Ñ„Ñ‹Ð²Ð°Ð¿Ñ€Ð¾Ð»Ð´Ð¶
SELECT * FROM t1 WHERE a LIKE 'Ñ„Ð«Ð²Ð°%' ORDER BY BINARY a;
a
Ð¤Ð«Ð’Ð
Ð¤Ð«Ð’ÐÐŸÐ ÐžÐ›Ð”Ð–
Ð¤Ñ‹Ð²Ð°
Ð¤Ñ‹Ð²Ð°Ð¿Ñ€Ð¾Ð»Ð´Ð¶
Ñ„Ð«Ð²Ð°
Ñ„Ð«Ð²Ð°Ð¿Ñ€Ð¾Ð»Ð´Ð¶
Ñ„Ñ‹Ð’Ð°
Ñ„Ñ‹Ð’Ð°Ð¿Ñ€Ð¾Ð»Ð´Ð¶
Ñ„Ñ‹Ð²Ð
Ñ„Ñ‹Ð²ÐÐ¿Ñ€Ð¾Ð»Ð´Ð¶
Ñ„Ñ‹Ð²Ð°
Ñ„Ñ‹Ð²Ð°ÐŸÑ€Ð¾Ð»Ð´Ð¶
Ñ„Ñ‹Ð²Ð°Ð¿Ð Ð¾Ð»Ð´Ð¶
Ñ„Ñ‹Ð²Ð°Ð¿Ñ€ÐžÐ»Ð´Ð¶
Ñ„Ñ‹Ð²Ð°Ð¿Ñ€Ð¾Ð›Ð´Ð¶
Ñ„Ñ‹Ð²Ð°Ð¿Ñ€Ð¾Ð»Ð”Ð¶
Ñ„Ñ‹Ð²Ð°Ð¿Ñ€Ð¾Ð»Ð´Ð–
Ñ„Ñ‹Ð²Ð°Ð¿Ñ€Ð¾Ð»Ð´Ð¶
SELECT * FROM t1 WHERE a LIKE 'Ñ„Ð«Ð²Ð°%' COLLATE utf16_bin ORDER BY BINARY a;
ERROR 42000: COLLATION 'utf16_bin' is not valid for CHARACTER SET 'utf8mb4'
DROP TABLE t1;
CREATE TABLE t1 (word varchar(64) NOT NULL, PRIMARY KEY (word))
CHARACTER SET utf16;
INSERT INTO t1 (word) VALUES ("cat");
SELECT * FROM t1 WHERE word LIKE "c%";
word
cat
SELECT * FROM t1 WHERE word LIKE "ca_";
word
cat
SELECT * FROM t1 WHERE word LIKE "cat";
word
cat
SELECT * FROM t1 WHERE word LIKE _utf16 x'00630025';
word
cat
SELECT * FROM t1 WHERE word LIKE _utf16 x'00630061005F';
word
cat
DROP TABLE t1;
select insert(_utf16 0x006100620063,10,2,_utf16 0x006400650066);
insert(_utf16 0x006100620063,10,2,_utf16 0x006400650066)
abc
select insert(_utf16 0x006100620063,1,2,_utf16 0x006400650066);
insert(_utf16 0x006100620063,1,2,_utf16 0x006400650066)
defc
SELECT hex(cast(0xAA as char character set utf16));
hex(cast(0xAA as char character set utf16))
00AA
SELECT hex(convert(0xAA using utf16));
hex(convert(0xAA using utf16))
00AA
CREATE TABLE t1 (a char(10) character set utf16);
INSERT INTO t1 VALUES (0x1),(0x11),(0x111),(0x1111),(0x11111);
SELECT HEX(a) FROM t1;
HEX(a)
0001
00011111
0011
0111
1111
DROP TABLE t1;
CREATE TABLE t1 (a varchar(10) character set utf16);
INSERT INTO t1 VALUES (0x1),(0x11),(0x111),(0x1111),(0x11111);
SELECT HEX(a) FROM t1;
HEX(a)
0001
00011111
0011
0111
1111
DROP TABLE t1;
CREATE TABLE t1 (a text character set utf16);
INSERT INTO t1 VALUES (0x1),(0x11),(0x111),(0x1111),(0x11111);
SELECT HEX(a) FROM t1;
HEX(a)
0001
00011111
0011
0111
1111
DROP TABLE t1;
CREATE TABLE t1 (a mediumtext character set utf16);
INSERT INTO t1 VALUES (0x1),(0x11),(0x111),(0x1111),(0x11111);
SELECT HEX(a) FROM t1;
HEX(a)
0001
00011111
0011
0111
1111
DROP TABLE t1;
CREATE TABLE t1 (a longtext character set utf16);
INSERT INTO t1 VALUES (0x1),(0x11),(0x111),(0x1111),(0x11111);
SELECT HEX(a) FROM t1;
HEX(a)
0001
00011111
0011
0111
1111
DROP TABLE t1;
create table t1 (s1 char character set utf16 collate utf16_czech_ci);
insert into t1 values ('0'),('1'),('2'),('a'),('b'),('c');
select s1 from t1 where s1 > 'a' order by s1;
s1
b
c
drop table t1;
create table t1(a char(1)) default charset utf16;
insert into t1 values ('a'),('b'),('c');
alter table t1 modify a char(5);
select a, hex(a) from t1;
a	hex(a)
a	0061
b	0062
c	0063
drop table t1;
set names latin1;
set @ivar= 1234;
set @str1 = 'select ?';
set @str2 = convert(@str1 using utf16);
prepare stmt1 from @str2;
ERROR 42000: You have an error in your SQL syntax; check the manual that corresponds to your OceanBase version for the right syntax to use near '' at line 1
set @str3 = convert(@str1 using utf8);
prepare stmt1 from @str3;
set names utf8;
create table t1 (a enum('x','y','z') character set utf16);
show create table t1;
Table	Create Table
  `a` enum('x','y','z') CHARACTER SET utf16 DEFAULT NULL
) ORGANIZATION INDEX DEFAULT CHARSET = utf8mb4 ROW_FORMAT = DYNAMIC COMPRESSION = 'zstd_1.3.8' REPLICA_NUM = 1 BLOCK_SIZE = 16384 USE_BLOOM_FILTER = FALSE ENABLE_MACRO_BLOCK_BLOOM_FILTER = FALSE TABLET_SIZE = 134217728 PCTFREE = 0
t1	CREATE TABLE `t1` (
insert into t1 values ('x');
insert into t1 values ('y');
insert into t1 values ('z');
select a, hex(a) from t1 order by a;
a	hex(a)
x	0078
y	0079
z	007A
alter table t1 change a a enum('x','y','z','d','e','Ã¤','Ã¶','Ã¼') character set utf16;
show create table t1;
Table	Create Table
  `a` enum('x','y','z','d','e','Ã¤','Ã¶','Ã¼') CHARACTER SET utf16 DEFAULT NULL
) ORGANIZATION INDEX DEFAULT CHARSET = utf8mb4 ROW_FORMAT = DYNAMIC COMPRESSION = 'zstd_1.3.8' REPLICA_NUM = 1 BLOCK_SIZE = 16384 USE_BLOOM_FILTER = FALSE ENABLE_MACRO_BLOCK_BLOOM_FILTER = FALSE TABLET_SIZE = 134217728 PCTFREE = 0
t1	CREATE TABLE `t1` (
insert into t1 values ('D');
insert into t1 values ('E ');
insert into t1 values ('Ã¤');
insert into t1 values ('Ã¶');
insert into t1 values ('Ã¼');
select a, hex(a) from t1 order by a;
a	hex(a)
d	0064
e	0065
x	0078
y	0079
z	007A
Ã¤	00E4
Ã¶	00F6
Ã¼	00FC
drop table t1;
create table t1 (a set ('x','y','z','Ã¤','Ã¶','Ã¼') character set utf16);
show create table t1;
Table	Create Table
  `a` set('x','y','z','Ã¤','Ã¶','Ã¼') CHARACTER SET utf16 DEFAULT NULL
) ORGANIZATION INDEX DEFAULT CHARSET = utf8mb4 ROW_FORMAT = DYNAMIC COMPRESSION = 'zstd_1.3.8' REPLICA_NUM = 1 BLOCK_SIZE = 16384 USE_BLOOM_FILTER = FALSE ENABLE_MACRO_BLOCK_BLOOM_FILTER = FALSE TABLET_SIZE = 134217728 PCTFREE = 0
t1	CREATE TABLE `t1` (
insert into t1 values ('x');
insert into t1 values ('y');
insert into t1 values ('z');
insert into t1 values ('x,y');
insert into t1 values ('x,y,z,Ã¤,Ã¶,Ã¼');
select a, hex(a) from t1 order by a;
a	hex(a)
x	0078
x,y	0078002C0079
x,y,z,Ã¤,Ã¶,Ã¼	0078002C0079002C007A002C00E4002C00F6002C00FC
y	0079
z	007A
drop table t1;
create table t1(a enum('a','b','c')) default character set utf16;
insert into t1 values('a'),('b'),('c');
alter table t1 add b char(1);
show warnings;
Level	Code	Message
select * from t1 order by a;
a	b
a	NULL
b	NULL
c	NULL
drop table t1;
SET NAMES latin1;
create table t1 select repeat('a',4000) a;
delete from t1;
insert into t1 values ('a'), ('a '), ('a\t');
select collation(a),hex(a) from t1 order by a;
collation(a)	hex(a)
latin1_swedish_ci	61
latin1_swedish_ci	6109
latin1_swedish_ci	6120
drop table t1;
select @@collation_connection;
@@collation_connection
latin1_swedish_ci
create table t1 ROW_FORMAT=DYNAMIC select repeat('a',50) as c1 ;
insert into t1 values('abcdef');
insert into t1 values('_bcdef');
insert into t1 values('a_cdef');
insert into t1 values('ab_def');
insert into t1 values('abc_ef');
insert into t1 values('abcd_f');
insert into t1 values('abcde_');
select c1 as c1u from t1 where c1 like 'ab\_def';
c1u
ab_def
select c1 as c2h from t1 where c1 like 'ab#_def' escape '#';
c2h
ab_def
drop table t1;
SET NAMES latin1;
create table t1 select repeat('a',4000) a;
delete from t1;
insert into t1 values ('a'), ('a '), ('a\t');
select collation(a),hex(a) from t1 order by a;
collation(a)	hex(a)
latin1_swedish_ci	61
latin1_swedish_ci	6109
latin1_swedish_ci	6120
drop table t1;
#
# Bug#55980 Character sets: supplementary character _bin ordering is wrong
#
CREATE TABLE t1 AS SELECT REPEAT('a',1) AS a LIMIT 0;
SHOW CREATE TABLE t1;
Table	Create Table
  `a` varchar(512) CHARACTER SET latin1 DEFAULT NULL
) ORGANIZATION INDEX DEFAULT CHARSET = utf8mb4 ROW_FORMAT = DYNAMIC COMPRESSION = 'zstd_1.3.8' REPLICA_NUM = 1 BLOCK_SIZE = 16384 USE_BLOOM_FILTER = FALSE ENABLE_MACRO_BLOCK_BLOOM_FILTER = FALSE TABLET_SIZE = 134217728 PCTFREE = 0
t1	CREATE TABLE `t1` (
INSERT INTO t1 VALUES (_utf8mb4 0xEFBE9D),(_utf8mb4 0xF0908E84);
ERROR HY000: Incorrect string value
INSERT INTO t1 VALUES (_utf8mb4 0xCE85),(_utf8mb4 0xF4808080);
ERROR HY000: Incorrect string value
SELECT HEX(a), HEX(CONVERT(a USING utf8mb4)) FROM t1 ORDER BY a;
HEX(a)	HEX(CONVERT(a USING utf8mb4))
ALTER TABLE t1 ADD KEY(a);
SELECT HEX(a), HEX(CONVERT(a USING utf8mb4)) FROM t1 ORDER BY a;
HEX(a)	HEX(CONVERT(a USING utf8mb4))
# Additional test for bug#37244 Character sets: short utf8_bin weight_string value
SELECT HEX(a), HEX(WEIGHT_STRING(a)) FROM t1 ORDER BY a;
HEX(a)	HEX(WEIGHT_STRING(a))
DROP TABLE IF EXISTS t1;
#
# BUG#16691598 - ORDER BY LOWER(COLUMN) PRODUCES 
#                OUT-OF-ORDER RESULTS
#
CREATE TABLE  t1 SELECT ('a a') as n;
INSERT INTO t1 VALUES('a b');
SELECT * FROM t1 ORDER BY LOWER(n) ASC;
n
a a
a b
SELECT * FROM t1 ORDER BY LOWER(n) DESC;
n
a a
a b
DROP TABLE t1;
select @@collation_connection;
@@collation_connection
latin1_swedish_ci
create table t1 ROW_FORMAT=DYNAMIC select repeat('a',50) as c1 ;
insert into t1 values('abcdef');
insert into t1 values('_bcdef');
insert into t1 values('a_cdef');
insert into t1 values('ab_def');
insert into t1 values('abc_ef');
insert into t1 values('abcd_f');
insert into t1 values('abcde_');
select c1 as c1u from t1 where c1 like 'ab\_def';
c1u
ab_def
select c1 as c2h from t1 where c1 like 'ab#_def' escape '#';
c2h
ab_def
drop table t1;
select hex(substr(_utf16 0x00e400e50068,1));
hex(substr(_utf16 0x00e400e50068,1))
00E400E50068
select hex(substr(_utf16 0x00e400e50068,2));
hex(substr(_utf16 0x00e400e50068,2))
00E50068
select hex(substr(_utf16 0x00e400e50068,3));
hex(substr(_utf16 0x00e400e50068,3))
0068
select hex(substr(_utf16 0x00e400e50068,-1));
hex(substr(_utf16 0x00e400e50068,-1))
0068
select hex(substr(_utf16 0x00e400e50068,-2));
hex(substr(_utf16 0x00e400e50068,-2))
00E50068
select hex(substr(_utf16 0x00e400e50068,-3));
hex(substr(_utf16 0x00e400e50068,-3))
00E400E50068
select hex(substr(_utf16 0x00e400e5D800DC00,1));
hex(substr(_utf16 0x00e400e5D800DC00,1))
00E400E5D800DC00
select hex(substr(_utf16 0x00e400e5D800DC00,2));
hex(substr(_utf16 0x00e400e5D800DC00,2))
00E5D800DC00
select hex(substr(_utf16 0x00e400e5D800DC00,3));
hex(substr(_utf16 0x00e400e5D800DC00,3))
D800DC00
select hex(substr(_utf16 0x00e400e5D800DC00,-1));
hex(substr(_utf16 0x00e400e5D800DC00,-1))
D800DC00
select hex(substr(_utf16 0x00e400e5D800DC00,-2));
hex(substr(_utf16 0x00e400e5D800DC00,-2))
00E5D800DC00
select hex(substr(_utf16 0x00e400e5D800DC00,-3));
hex(substr(_utf16 0x00e400e5D800DC00,-3))
00E400E5D800DC00
SET NAMES latin1;
create table t1(f1 varchar(5) CHARACTER SET utf16 COLLATE utf16_bin NOT NULL) engine=InnoDB;
insert into t1 values('a');
create index t1f1 on t1(f1);
select f1 from t1 where f1 like 'a%';
f1
a
drop table t1;
create table t1 (utext varchar(20) character set utf16);
insert into t1 values ("lily");
insert into t1 values ("river");
prepare stmt from 'select utext from t1 where utext like ?';
set @param1='%%';
execute stmt using @param1;
utext
lily
river
execute stmt using @param1;
utext
lily
river
select utext from t1 where utext like '%%';
utext
lily
river
drop table t1;
deallocate prepare stmt;
CREATE TABLE t1 (id int, s char(5) CHARACTER SET ucs2 COLLATE ucs2_unicode_ci);
ERROR 42000: Unknown character set: 'ucs2'
CREATE TABLE t1 (
status enum('active','passive') character set utf16 collate utf16_general_ci 
NOT NULL default 'passive'
);
ALTER TABLE t1 ADD a int NOT NULL AFTER status;
DROP TABLE t1;
End of 4.1 tests
CREATE TABLE t1 (a varchar(64) character set utf16, b decimal(10,3));
INSERT INTO t1 VALUES ("1.1", 0), ("2.1", 0);
update t1 set b=a;
SELECT *, hex(a) FROM t1;
a	b	hex(a)
1.1	1.100	0031002E0031
2.1	2.100	0032002E0031
DROP TABLE t1;
create table t1 (utext varchar(20) character set utf16);
insert into t1 values ("lily");
insert into t1 values ("river");
prepare stmt from 'select utext from t1 where utext like ?';
set @param1='%%';
execute stmt using @param1;
utext
lily
river
execute stmt using @param1;
utext
lily
river
select utext from t1 where utext like '%%';
utext
lily
river
drop table t1;
deallocate prepare stmt;
set names latin1;
select soundex(''),soundex('he'),soundex('hello all folks'),soundex('#3556 in bugdb');
soundex('')	soundex('he')	soundex('hello all folks')	soundex('#3556 in bugdb')
	H000	H4142	I51231
select hex(soundex('')),hex(soundex('he')),hex(soundex('hello all folks')),hex(soundex('#3556 in bugdb'));
hex(soundex(''))	hex(soundex('he'))	hex(soundex('hello all folks'))	hex(soundex('#3556 in bugdb'))
	48303030	4834313432	493531323331
select 'mood' sounds like 'mud';
'mood' sounds like 'mud'
1
select hex(soundex(_utf16 0x041004110412));
hex(soundex(_utf16 0x041004110412))

select hex(soundex(_utf16 0x00BF00C0));
hex(soundex(_utf16 0x00BF00C0))

set names latin1;
create table t1(a blob, b text charset utf16);
select data_type, character_octet_length, character_maximum_length
from information_schema.columns where table_name='t1';
drop table t1;
set names latin1;
select position('bb' in 'abba');
position('bb' in 'abba')
2
create table t1 (a varchar(10) character set utf16) engine=heap;
Warnings:
Warning	1286	Unknown storage engine 'heap'
insert into t1 values ('a'),('A'),('b'),('B');
select * from t1 where a='a' order by binary a;
a
A
a
select hex(min(binary a)),count(*) from t1 group by a;
hex(min(binary a))	count(*)
0041	2
0042	2
drop table t1;
select char_length('abcd'), octet_length('abcd');
char_length('abcd')	octet_length('abcd')
4	4
select char_length(_utf16 0xD800DC00), octet_length(_utf16 0xD800DC00);
char_length(_utf16 0xD800DC00)	octet_length(_utf16 0xD800DC00)
1	4
select char_length(_utf16 0xD87FDFFF), octet_length(_utf16 0xD87FDFFF);
char_length(_utf16 0xD87FDFFF)	octet_length(_utf16 0xD87FDFFF)
1	4
select left('abcd',2);
left('abcd',2)
ab
select hex(left(_utf16 0xD800DC00D87FDFFF, 1));
hex(left(_utf16 0xD800DC00D87FDFFF, 1))
D800DC00
select hex(right(_utf16 0xD800DC00D87FDFFF, 1));
hex(right(_utf16 0xD800DC00D87FDFFF, 1))
D87FDFFF
create table t1 (a varchar(10) character set utf16);
insert into t1 values (_utf16 0xD800);
ERROR HY000: Invalid utf16 character string: 'D800'
insert into t1 values (_utf16 0xDC00);
ERROR HY000: Invalid utf16 character string: 'DC00'
insert into t1 values (_utf16 0xD800D800);
ERROR HY000: Invalid utf16 character string: 'D800D8'
insert into t1 values (_utf16 0xD800E800);
ERROR HY000: Invalid utf16 character string: 'D800E8'
insert into t1 values (_utf16 0xD8000800);
ERROR HY000: Invalid utf16 character string: 'D80008'
insert into t1 values (_utf16 0xD800DC00);
insert into t1 values (_utf16 0xD800DCFF);
insert into t1 values (_utf16 0xDBFFDC00);
insert into t1 values (_utf16 0xDBFFDCFF);
select hex(a) from t1;
hex(a)
D800DC00
D800DCFF
DBFFDC00
DBFFDCFF
drop table t1;
SET sql_mode = '';
create table t1 (s1 varchar(50) character set ucs2);
ERROR 42000: Unknown character set: 'ucs2'
SET sql_mode = default;
create table t1 (a char(10)) character set utf16;
insert into t1 values ('a   ');
select hex(a) from t1;
hex(a)
0061
drop table t1;
select upper('abcd'), lower('ABCD');
upper('abcd')	lower('ABCD')
ABCD	abcd
create table t1 (a varchar(10) character set utf16);
insert into t1 values (123456);
select a, hex(a) from t1;
a	hex(a)
123456	003100320033003400350036
drop table t1;
select hex(soundex('a'));
hex(soundex('a'))
41303030
create table t1 (a enum ('a','b','c')) character set utf16;
insert into t1 values ('1');
ERROR 01000: Data truncated for column 'a' at row 1
select * from t1;
a
drop table t1;
set names latin1;
select hex(conv(convert('123' using utf16), -10, 16));
hex(conv(convert('123' using utf16), -10, 16))
3742
select hex(conv(convert('123' using utf16), 10, 16));
hex(conv(convert('123' using utf16), 10, 16))
3742
set names latin1;
select 1.1 + '1.2';
1.1 + '1.2'
2.3
select 1.1 + '1.2xxx';
1.1 + '1.2xxx'
2.3
Warnings:
Warning	1292	Truncated incorrect DOUBLE value: '1.2xxx'
select left('aaa','1');
left('aaa','1')
a
create table t1 (a int);
insert into t1 values ('-1234.1e2');
insert ignore into t1 values ('-1234.1e2xxxx');
insert into t1 values ('-1234.1e2    ');
select * from t1;
a
-123410
-123410
-123410
drop table t1;
create table t1 (a int);
insert into t1 values ('1 ');
insert ignore into t1 values ('1 x');
select * from t1;
a
1
1
drop table t1;
SET sql_mode = '';
create table t1 (a varchar(17000) character set utf16);
show create table t1;
Table	Create Table
  `a` varchar(17000) CHARACTER SET utf16 DEFAULT NULL
) ORGANIZATION INDEX DEFAULT CHARSET = utf8mb4 ROW_FORMAT = DYNAMIC COMPRESSION = 'zstd_1.3.8' REPLICA_NUM = 1 BLOCK_SIZE = 16384 USE_BLOOM_FILTER = FALSE ENABLE_MACRO_BLOCK_BLOOM_FILTER = FALSE TABLET_SIZE = 134217728 PCTFREE = 0
t1	CREATE TABLE `t1` (
drop table t1;
SET sql_mode = default;
create table t1 (a varchar(150) character set utf16 primary key);
show create table t1;
Table	Create Table
  PRIMARY KEY (`a`)
  `a` varchar(150) CHARACTER SET utf16 NOT NULL,
) ORGANIZATION INDEX DEFAULT CHARSET = utf8mb4 ROW_FORMAT = DYNAMIC COMPRESSION = 'zstd_1.3.8' REPLICA_NUM = 1 BLOCK_SIZE = 16384 USE_BLOOM_FILTER = FALSE ENABLE_MACRO_BLOCK_BLOOM_FILTER = FALSE TABLET_SIZE = 134217728 PCTFREE = 0
t1	CREATE TABLE `t1` (
drop table t1;
create table t1 (a varchar(334) character set utf16 primary key) ROW_FORMAT=COMPACT;
drop table t1;
create table t1 (a char(1) character set utf16);
insert into t1 values (0xD800DC00),(0xD800DCFF),(0xDB7FDC00),(0xDB7FDCFF);
insert into t1 values (0x00C0), (0x00FF),(0xE000), (0xFFFF);
drop table t1;
drop table if exists t1;
create table t1 as
select repeat(' ', 64) as s1, repeat(' ',64) as s2
union
select null, null;
show create table t1;
Table	Create Table
  `s1` varchar(512) CHARACTER SET latin1 DEFAULT NULL,
  `s2` varchar(512) CHARACTER SET latin1 DEFAULT NULL
) ORGANIZATION INDEX DEFAULT CHARSET = utf8mb4 ROW_FORMAT = DYNAMIC COMPRESSION = 'zstd_1.3.8' REPLICA_NUM = 1 BLOCK_SIZE = 16384 USE_BLOOM_FILTER = FALSE ENABLE_MACRO_BLOCK_BLOOM_FILTER = FALSE TABLET_SIZE = 134217728 PCTFREE = 0
t1	CREATE TABLE `t1` (
delete from t1;
insert into t1 values('aaa','aaa');
insert into t1 values('aaa|qqq','qqq');
insert into t1 values('gheis','^[^a-dXYZ]+$');
insert into t1 values('aab','^aa?b');
insert into t1 values('Baaan','^Ba*n');
insert into t1 values('aaa','qqq|aaa');
insert into t1 values('qqq','qqq|aaa');
insert into t1 values('bbb','qqq|aaa');
insert into t1 values('bbb','qqq');
insert into t1 values('aaa','aba');
insert into t1 values(null,'abc');
insert into t1 values('def',null);
insert into t1 values(null,null);
select HIGH_PRIORITY s1 regexp s2 from t1;
s1 regexp s2
0
0
0
1
1
1
1
1
1
1
NULL
NULL
NULL
SELECT 'ghi' REGEXP 'ghi[';
Got one of the listed errors
drop table t1;
set names latin1;
CREATE TABLE t1 AS SELECT repeat('a',20) AS s1 LIMIT 0;
SET timestamp=1216359724;
INSERT INTO t1 VALUES (current_date);
INSERT INTO t1 VALUES (current_time);
INSERT INTO t1 VALUES (current_timestamp);
SELECT s1, hex(s1) FROM t1;
s1	hex(s1)
13:42:04	31333A34323A3034
2008-07-18	323030382D30372D3138
2008-07-18 13:42:04	323030382D30372D31382031333A34323A3034
DROP TABLE t1;
SET timestamp=0;
SET NAMES latin1;
DROP TABLE t1;
CREATE TABLE t1 AS SELECT repeat('a',2) as s1 LIMIT 0;
INSERT INTO t1 VALUES ('ab'),('AE'),('ab'),('AE');
SELECT * FROM t1 ORDER BY s1;
s1
AE
AE
ab
ab
SET max_sort_length=4;
Warnings:
Warning	1235	This system variable now is mock not supported
SELECT * FROM t1 ORDER BY s1;
s1
AE
AE
ab
ab
DROP TABLE t1;
SET max_sort_length=DEFAULT;
Warnings:
Warning	1235	This system variable now is mock not supported
SET NAMES latin1;
#
# Bug#52520 Difference in tinytext utf column metadata
#
CREATE TABLE t1 (
s1 TINYTEXT CHARACTER SET utf16,
s2 TEXT CHARACTER SET utf16,
s3 MEDIUMTEXT CHARACTER SET utf16,
s4 LONGTEXT CHARACTER SET utf16
);
SET NAMES utf8, @@character_set_results=NULL;
SELECT *, HEX(s1) FROM t1;
Catalog	Database	Table	Table_alias	Column	Column_alias	Type	Length	Max length	Is_null	Flags	Decimals	Charsetnr
def	test	t1	t1	s1	s1	252	255	0	Y	16	0	54
def	test	t1	t1	s2	s2	252	65535	0	Y	16	0	54
def	test	t1	t1	s3	s3	252	16777215	0	Y	16	0	54
def	test	t1	t1	s4	s4	252	4294967295	0	Y	16	0	54
def					HEX(s1)	252	65535	0	Y	16	0	45
s1	s2	s3	s4	HEX(s1)
SET NAMES latin1;
SELECT *, HEX(s1) FROM t1;
Catalog	Database	Table	Table_alias	Column	Column_alias	Type	Length	Max length	Is_null	Flags	Decimals	Charsetnr
def	test	t1	t1	s1	s1	252	255	0	Y	16	0	8
def	test	t1	t1	s2	s2	252	65535	0	Y	16	0	8
def	test	t1	t1	s3	s3	252	16777215	0	Y	16	0	8
def	test	t1	t1	s4	s4	252	4294967295	0	Y	16	0	8
def					HEX(s1)	252	65535	0	Y	16	0	8
s1	s2	s3	s4	HEX(s1)
SET NAMES utf8;
SELECT *, HEX(s1) FROM t1;
Catalog	Database	Table	Table_alias	Column	Column_alias	Type	Length	Max length	Is_null	Flags	Decimals	Charsetnr
def	test	t1	t1	s1	s1	252	255	0	Y	16	0	45
def	test	t1	t1	s2	s2	252	65535	0	Y	16	0	45
def	test	t1	t1	s3	s3	252	16777215	0	Y	16	0	45
def	test	t1	t1	s4	s4	252	4294967295	0	Y	16	0	45
def					HEX(s1)	252	65535	0	Y	16	0	45
s1	s2	s3	s4	HEX(s1)
DROP TABLE T2;
CREATE TABLE t2 AS SELECT CONCAT(s1) FROM t1;
DROP TABLE t1, t2;
#
# Bug#11753363 (Bug#44793) Character sets: case clause, ucs2 or utf32, failure
#
SELECT CASE _latin1'a' WHEN _utf16'a' THEN 'A' END;
CASE _latin1'a' WHEN _utf16'a' THEN 'A' END
A
SELECT CASE _utf16'a' WHEN _latin1'a' THEN 'A' END;
CASE _utf16'a' WHEN _latin1'a' THEN 'A' END
A
CREATE TABLE t1 (s1 CHAR(5) CHARACTER SET utf16);
INSERT INTO t1 VALUES ('a');
SELECT CASE s1 WHEN 'a' THEN 'b' ELSE 'c' END FROM t1;
CASE s1 WHEN 'a' THEN 'b' ELSE 'c' END
b
DROP TABLE t1;
#
# Bug#12340997
# DATE_ADD/DATE_SUB WITH INTERVAL CRASHES IN GET_INTERVAL_VALUE()
#
SELECT space(date_add(101, INTERVAL CHAR('1' USING utf16) hour_second));
space(date_add(101, INTERVAL CHAR('1' USING utf16) hour_second))
NULL
#
# Bug#11750518 41090: ORDER BY TRUNCATES GROUP_CONCAT RESULT
#
SELECT id, CHAR_LENGTH(GROUP_CONCAT(body)) AS l
FROM (SELECT 'a' AS id, REPEAT('foo bar', 100) AS body
UNION ALL
SELECT 'a' AS id, REPEAT('bla bla', 100) AS body) t1
GROUP BY id
ORDER BY l DESC;
id	l
a	1024
Warnings:
Warning	1260	Row 2 was cut by GROUP_CONCAT()
#
# End of 5.5 tests
#
#
# Start of 5.6 tests
#
#
# WL#3664 WEIGHT_STRING
#
select @@collation_connection;
@@collation_connection
utf8mb4_general_ci
select hex(weight_string('a'));
hex(weight_string('a'))
0041
select hex(weight_string('A'));
hex(weight_string('A'))
0041
select hex(weight_string('abc'));
hex(weight_string('abc'))
004100420043
select hex(weight_string('abc' as char(2)));
hex(weight_string('abc' as char(2)))
00410042
select hex(weight_string('abc' as char(3)));
hex(weight_string('abc' as char(3)))
004100420043
select hex(weight_string('abc' as char(5)));
hex(weight_string('abc' as char(5)))
00410042004300200020
select @@collation_connection;
@@collation_connection
utf8mb4_general_ci
select hex(weight_string(cast(_latin1 0x80 as char)));
hex(weight_string(cast(_latin1 0x80 as char)))
20AC
select hex(weight_string(cast(_latin1 0x808080 as char)));
hex(weight_string(cast(_latin1 0x808080 as char)))
20AC20AC20AC
select hex(weight_string(cast(_latin1 0x808080 as char) as char(2)));
hex(weight_string(cast(_latin1 0x808080 as char) as char(2)))
20AC20AC
select hex(weight_string(cast(_latin1 0x808080 as char) as char(3)));
hex(weight_string(cast(_latin1 0x808080 as char) as char(3)))
20AC20AC20AC
select hex(weight_string(cast(_latin1 0x808080 as char) as char(5)));
hex(weight_string(cast(_latin1 0x808080 as char) as char(5)))
20AC20AC20AC00200020
select hex(weight_string(_utf16 0xD800DC00));
hex(weight_string(_utf16 0xD800DC00))
FFFD
select hex(weight_string(_utf16 0xD800DC01));
hex(weight_string(_utf16 0xD800DC01))
FFFD
select @@collation_connection;
@@collation_connection
utf8mb4_general_ci
select hex(weight_string('a'));
hex(weight_string('a'))
0041
select hex(weight_string('A'));
hex(weight_string('A'))
0041
select hex(weight_string('abc'));
hex(weight_string('abc'))
004100420043
select hex(weight_string('abc' as char(2)));
hex(weight_string('abc' as char(2)))
00410042
select hex(weight_string('abc' as char(3)));
hex(weight_string('abc' as char(3)))
004100420043
select hex(weight_string('abc' as char(5)));
hex(weight_string('abc' as char(5)))
00410042004300200020
select @@collation_connection;
@@collation_connection
utf8mb4_general_ci
select hex(weight_string(cast(_latin1 0x80 as char)));
hex(weight_string(cast(_latin1 0x80 as char)))
20AC
select hex(weight_string(cast(_latin1 0x808080 as char)));
hex(weight_string(cast(_latin1 0x808080 as char)))
20AC20AC20AC
select hex(weight_string(cast(_latin1 0x808080 as char) as char(2)));
hex(weight_string(cast(_latin1 0x808080 as char) as char(2)))
20AC20AC
select hex(weight_string(cast(_latin1 0x808080 as char) as char(3)));
hex(weight_string(cast(_latin1 0x808080 as char) as char(3)))
20AC20AC20AC
select hex(weight_string(cast(_latin1 0x808080 as char) as char(5)));
hex(weight_string(cast(_latin1 0x808080 as char) as char(5)))
20AC20AC20AC00200020
#
# End of 5.6 tests
#
