purge recyclebin;
DROP TABLE IF EXISTS t1;
#
# Start of 8.0 tests
#
#
# WL#9125: Add utf8mb4_0900_ai_ci
#
SET NAMES utf8mb4 COLLATE utf8mb4_0900_ai_ci;
SET @test_character_set= 'utf8mb4';
SET @test_collation= 'utf8mb4_0900_ai_ci';
SET @safe_character_set_server= @@character_set_server;
SET @safe_collation_server= @@collation_server;
SET @safe_character_set_client= @@character_set_client;
SET @safe_character_set_results= @@character_set_results;
SET character_set_server= @test_character_set;
SET collation_server= @test_collation;
DROP DATABASE d1;
CREATE DATABASE d1;
USE d1;
CREATE TABLE t1 (c CHAR(10), KEY(c));
SHOW FULL COLUMNS FROM t1;
Field	Type	Collation	Null	Key	Default	Extra	Privileges	Comment
c	char(10)	utf8mb4_0900_ai_ci	YES	MUL	NULL		SELECT,INSERT,UPDATE,REFERENCES	
INSERT INTO t1 VALUES ('aaa'),('aaaa'),('aaaaa');
SELECT c as want3results FROM t1 WHERE c LIKE 'aaa%';
want3results
aaa
aaaa
aaaaa
DROP TABLE t1;
CREATE TABLE t1 (c1 varchar(15), KEY c1 (c1(2)));
SHOW FULL COLUMNS FROM t1;
Field	Type	Collation	Null	Key	Default	Extra	Privileges	Comment
c1	varchar(15)	utf8mb4_0900_ai_ci	YES		NULL		SELECT,INSERT,UPDATE,REFERENCES	
INSERT INTO t1 VALUES ('location'),('loberge'),('lotre'),('boabab');
SELECT c1 as want3results from t1 where c1 like 'l%';
want3results
location
loberge
lotre
SELECT c1 as want3results from t1 where c1 like 'lo%';
want3results
location
loberge
lotre
SELECT c1 as want1result  from t1 where c1 like 'loc%';
want1result
location
SELECT c1 as want1result  from t1 where c1 like 'loca%';
want1result
location
SELECT c1 as want1result  from t1 where c1 like 'locat%';
want1result
location
SELECT c1 as want1result  from t1 where c1 like 'locati%';
want1result
location
SELECT c1 as want1result  from t1 where c1 like 'locatio%';
want1result
location
SELECT c1 as want1result  from t1 where c1 like 'location%';
want1result
location
DROP TABLE t1;
create table t1 (a set('a') not null);
insert ignore into t1 values (),();
Warnings:
Warning	1364	Field 'a' doesn't have a default value
Warning	1364	Field 'a' doesn't have a default value
select cast(a as char(1)) from t1;
cast(a as char(1))


select a sounds like a from t1;
a sounds like a
1
1
select 1 from t1 order by cast(a as char(1));
1
1
1
drop table t1;
set names utf8;
create table t1 (
name varchar(10),
level smallint unsigned);
show create table t1;
Table	Create Table
t1	CREATE TABLE `t1` (
  `name` varchar(10) COLLATE utf8mb4_0900_ai_ci DEFAULT NULL,
  `level` smallint(5) unsigned DEFAULT NULL
) ORGANIZATION INDEX DEFAULT CHARSET = utf8mb4 COLLATE = utf8mb4_0900_ai_ci ROW_FORMAT = DYNAMIC COMPRESSION = 'zstd_1.3.8' REPLICA_NUM = 1 BLOCK_SIZE = 16384 USE_BLOOM_FILTER = FALSE ENABLE_MACRO_BLOCK_BLOOM_FILTER = FALSE TABLET_SIZE = 134217728 PCTFREE = 0
insert into t1 values ('string',1);
select concat(name,space(level)), concat(name, repeat(' ',level)) from t1;
concat(name,space(level))	concat(name, repeat(' ',level))
string 	string 
drop table t1;
DROP DATABASE d1;
USE test;
SET character_set_server= @safe_character_set_server;
SET collation_server= @safe_collation_server;
SET character_set_client= @safe_character_set_client;
SET character_set_results= @safe_character_set_results;
SET NAMES utf8mb4 COLLATE utf8mb4_0900_ai_ci;
create table t1 select repeat('a',4000) a;
delete from t1;
insert into t1 values ('a'), ('a '), ('a\t');
select collation(a),hex(a) from t1 order by a;
collation(a)	hex(a)
utf8mb4_0900_ai_ci	61
utf8mb4_0900_ai_ci	6109
utf8mb4_0900_ai_ci	6120
drop table t1;
create table t1 engine=innodb select repeat('a',50) as c1;
alter table t1 add index(c1(5));
insert into t1 values ('abcdefg'),('abcde100'),('abcde110'),('abcde111');
select collation(c1) from t1 limit 1;
collation(c1)
utf8mb4_0900_ai_ci
select c1 from t1 where c1 like 'abcdef%' order by c1;
c1
abcdefg
select c1 from t1 where c1 like 'abcde1%' order by c1;
c1
abcde100
abcde110
abcde111
select c1 from t1 where c1 like 'abcde11%' order by c1;
c1
abcde110
abcde111
select c1 from t1 where c1 like 'abcde111%' order by c1;
c1
abcde111
drop table t1;
select @@collation_connection;
@@collation_connection
utf8mb4_0900_ai_ci
create table t1 ROW_FORMAT=DYNAMIC select repeat('a',50) as c1 ;
insert into t1 values('abcdef');
insert into t1 values('_bcdef');
insert into t1 values('a_cdef');
insert into t1 values('ab_def');
insert into t1 values('abc_ef');
insert into t1 values('abcd_f');
insert into t1 values('abcde_');
select c1 as c1u from t1 where c1 like 'ab\_def';
c1u
ab_def
select c1 as c2h from t1 where c1 like 'ab#_def' escape '#';
c2h
ab_def
drop table t1;
drop table if exists t1;
create table t1 select repeat('a',10) as c1;
delete from t1;
insert into t1 values (0x20),(0x21),(0x22),(0x23),(0x24),(0x25),(0x26),(0x27),(0x28),(0x29),(0x2A),(0x2B),(0x2C),(0x2D),(0x2E),(0x2F);
insert into t1 values (0x30),(0x31),(0x32),(0x33),(0x34),(0x35),(0x36),(0x37),(0x38),(0x39),(0x3A),(0x3B),(0x3C),(0x3D),(0x3E),(0x3F);
insert into t1 values (0x40),(0x41),(0x42),(0x43),(0x44),(0x45),(0x46),(0x47),(0x48),(0x49),(0x4A),(0x4B),(0x4C),(0x4D),(0x4E),(0x4F);
insert into t1 values (0x50),(0x51),(0x52),(0x53),(0x54),(0x55),(0x56),(0x57),(0x58),(0x59),(0x5A),(0x5B),(0x5C),(0x5D),(0x5E),(0x5F);
insert into t1 values (0x60),(0x61),(0x62),(0x63),(0x64),(0x65),(0x66),(0x67),(0x68),(0x69),(0x6A),(0x6B),(0x6C),(0x6D),(0x6E),(0x6F);
insert into t1 values (0x70),(0x71),(0x72),(0x73),(0x74),(0x75),(0x76),(0x77),(0x78),(0x79),(0x7A),(0x7B),(0x7C),(0x7D),(0x7E),(0x7F);
SELECT HEX(cx), cy
FROM (SELECT GROUP_CONCAT(c1 ORDER BY binary c1 SEPARATOR '') AS cx,
GROUP_CONCAT(HEX(c1) ORDER BY BINARY c1) AS cy
FROM t1
GROUP BY c1
) AS dt;
HEX(cx)	cy
4767	47,67
4666	46,66
4464	44,64
4565	45,65
33	33
34	34
35	35
36	36
37	37
38	38
39	39
4161	41,61
4363	43,63
4262	42,62
24	24
30	30
31	31
32	32
4F6F	4F,6F
4E6E	4E,6E
4D6D	4D,6D
4A6A	4A,6A
4C6C	4C,6C
4B6B	4B,6B
4868	48,68
4969	49,69
5878	58,78
5777	57,77
5676	56,76
5474	54,74
5575	55,75
5373	53,73
5070	50,70
5272	52,72
5171	51,71
5979	59,79
5A7A	5A,7A
60	60
5E	5E
3C	3C
3D	3D
3E	3E
7C	7C
2B	2B
7E	7E
2E	2E
21	21
3F	3F
20	20
5F	5F
2D	2D
3A	3A
3B	3B
2C	2C
23	23
25	25
2F	2F
5C	5C
26	26
40	40
2A	2A
29	29
5B	5B
5D	5D
7B	7B
7D	7D
28	28
22	22
27	27
7F	7F
drop table t1;
SET NAMES utf8mb4 COLLATE utf8mb4_0900_ai_ci;
SELECT HEX(CONVERT(_utf8mb4 0xF091AB9B41 USING utf16));
HEX(CONVERT(_utf8mb4 0xF091AB9B41 USING utf16))
D806DEDB0041
SELECT HEX(CONVERT(_utf16 0xF8FF USING utf8mb4));
HEX(CONVERT(_utf16 0xF8FF USING utf8mb4))
EFA3BF
SELECT HEX(CONVERT(_utf8mb4 0x8F USING ucs2));
ERROR HY000: Invalid utf8mb4 character string: '8F'
SELECT HEX(CONVERT(_utf8mb4 0xC230 USING ucs2));
ERROR HY000: Invalid utf8mb4 character string: 'C230'
SELECT HEX(CONVERT(_utf8mb4 0xE234F1 USING ucs2));
ERROR HY000: Invalid utf8mb4 character string: 'E234F1'
SELECT HEX(CONVERT(_utf8mb4 0xF4E25634 USING ucs2));
ERROR HY000: Invalid utf8mb4 character string: 'F4E256'
SELECT ASCII('ABC');
ASCII('ABC')
65
SELECT BIT_LENGTH('a');
BIT_LENGTH('a')
8
SELECT BIT_LENGTH('À');
BIT_LENGTH('À')
16
SELECT BIT_LENGTH('テ');
BIT_LENGTH('テ')
24
SELECT BIT_LENGTH('𝌆');
BIT_LENGTH('𝌆')
32
SELECT CHAR_LENGTH('𝌆テÀa');
CHAR_LENGTH('𝌆テÀa')
4
SELECT LENGTH('𝌆テÀa');
LENGTH('𝌆テÀa')
10
SELECT FIELD('a', '𝌆テÀa');
FIELD('a', '𝌆テÀa')
0
SELECT HEX('𝌆テÀa');
HEX('𝌆テÀa')
F09D8C86E38386C38061
SELECT INSERT('𝌆テÀa', 2, 2, 'テb');
INSERT('𝌆テÀa', 2, 2, 'テb')
𝌆テba
SELECT LOWER('𝌆テÀBcd');
LOWER('𝌆テÀBcd')
𝌆テàbcd
SELECT ORD('𝌆');
ORD('𝌆')
4036856966
SELECT UPPER('𝌆テàbCD');
UPPER('𝌆テàbCD')
𝌆テÀBCD
SELECT LOCATE(_utf8mb4 0xF091AB9B41, _utf8mb4 0xF091AB9B42F091AB9B41F091AB9B43);
LOCATE(_utf8mb4 0xF091AB9B41, _utf8mb4 0xF091AB9B42F091AB9B41F091AB9B43)
3
SELECT HEX(REVERSE(_utf8mb4 0xF091AB9B41F091AB9B42F091AB9B43));
HEX(REVERSE(_utf8mb4 0xF091AB9B41F091AB9B42F091AB9B43))
43F091AB9B42F091AB9B41F091AB9B
SELECT HEX(SUBSTRING(_utf8mb4 0xF091AB9B41F091AB9B42F091AB9B43, 1, 2));
HEX(SUBSTRING(_utf8mb4 0xF091AB9B41F091AB9B42F091AB9B43, 1, 2))
F091AB9B41
SELECT HEX(SUBSTRING(_utf8mb4 0xF091AB9B41F091AB9B42F091AB9B43, -3, 2));
HEX(SUBSTRING(_utf8mb4 0xF091AB9B41F091AB9B42F091AB9B43, -3, 2))
42F091AB9B
SELECT HEX(TRIM(_utf8mb4 0x2020F091AB9B4120F091AB9B4120202020));
HEX(TRIM(_utf8mb4 0x2020F091AB9B4120F091AB9B4120202020))
F091AB9B4120F091AB9B41
SELECT HEX(WEIGHT_STRING('aA'));
HEX(WEIGHT_STRING('aA'))
1C471C47
select @@collation_connection;
@@collation_connection
utf8mb4_0900_ai_ci
select hex(weight_string('a'));
hex(weight_string('a'))
1C47
select hex(weight_string('A'));
hex(weight_string('A'))
1C47
select hex(weight_string('abc'));
hex(weight_string('abc'))
1C471C601C7A
select hex(weight_string('abc' as char(2)));
hex(weight_string('abc' as char(2)))
1C471C60
select hex(weight_string('abc' as char(3)));
hex(weight_string('abc' as char(3)))
1C471C601C7A
select hex(weight_string('abc' as char(5)));
hex(weight_string('abc' as char(5)))
1C471C601C7A
select @@collation_connection;
@@collation_connection
utf8mb4_0900_ai_ci
select hex(weight_string(cast(_latin1 0x80 as char)));
hex(weight_string(cast(_latin1 0x80 as char)))
1C2A
select hex(weight_string(cast(_latin1 0x808080 as char)));
hex(weight_string(cast(_latin1 0x808080 as char)))
1C2A1C2A1C2A
select hex(weight_string(cast(_latin1 0x808080 as char) as char(2)));
hex(weight_string(cast(_latin1 0x808080 as char) as char(2)))
1C2A1C2A
select hex(weight_string(cast(_latin1 0x808080 as char) as char(3)));
hex(weight_string(cast(_latin1 0x808080 as char) as char(3)))
1C2A1C2A1C2A
select hex(weight_string(cast(_latin1 0x808080 as char) as char(5)));
hex(weight_string(cast(_latin1 0x808080 as char) as char(5)))
1C2A1C2A1C2A
SELECT 'a' = 'a ';
'a' = 'a '
0
SELECT 'a\0' < 'a';
'a\0' < 'a'
0
SELECT 'a\0' < 'a ';
'a\0' < 'a '
1
SELECT 'a\t' < 'a';
'a\t' < 'a'
0
SELECT 'a\t' < 'a ';
'a\t' < 'a '
1
SELECT 'a' LIKE 'a';
'a' LIKE 'a'
1
SELECT 'A' LIKE 'a';
'A' LIKE 'a'
1
SELECT _utf8mb4 0xD0B0D0B1D0B2 LIKE CONCAT(_utf8mb4'%',_utf8mb4 0xD0B1,_utf8mb4 '%');
_utf8mb4 0xD0B0D0B1D0B2 LIKE CONCAT(_utf8mb4'%',_utf8mb4 0xD0B1,_utf8mb4 '%')
1
SELECT is_ipv4(inet_ntoa('1'));
is_ipv4(inet_ntoa('1'))
1
SELECT is_ipv6(inet_ntoa('1'));
is_ipv6(inet_ntoa('1'))
0
SELECT HEX(inet6_aton(inet_ntoa('1')));
HEX(inet6_aton(inet_ntoa('1')))
00000001
SELECT inet6_ntoa(inet_ntoa('1'));
inet6_ntoa(inet_ntoa('1'))
NULL
#
# Bug#14040277 UNINITIALIZED VALUE REFERENCED IN STR_TO_IPV6
#
SELECT inet6_aton(soundex('a'));
inet6_aton(soundex('a'))
NULL
#
# Bug#19047425 UNINITIALISED VALUE IN STR_TO_IPV6
#
CREATE TABLE t1 (c VARCHAR(10) CHARACTER SET utf8mb4);
INSERT INTO t1 VALUES (_utf8mb4 0xF09090A7), (_utf8mb4 0xEA8B93), (_utf8mb4 0xC4BC), (_utf8mb4 0xC6AD), (_utf8mb4 0xF090918F), (_utf8mb4 0xEAAD8B);
SELECT HEX(ANY_VALUE(c)), COUNT(c) FROM t1 GROUP BY c COLLATE utf8mb4_0900_ai_ci;
HEX(ANY_VALUE(c))	COUNT(c)
C4BC	1
C6AD	1
EA8B93	1
EAAD8B	1
F09090A7	2
DROP TABLE t1;
CREATE TABLE t1 (a VARCHAR(10), b VARCHAR(10)) COLLATE utf8mb4_0900_ai_ci;
INSERT INTO t1 VALUES(_utf16 0xAC00, _utf16 0x326E), (_utf16 0xAD, _utf16 0xA0),
(_utf16 0xC6, _utf16 0x41), (_utf16 0xC6, _utf16 0xAA), (_utf16 0xA73A, _utf16 0xA738);
SELECT a = b FROM t1;
a = b
1
0
0
0
1
DROP TABLE t1;
SET NAMES utf8mb4;
CREATE TABLE t1 (c1 CHAR(10) CHARACTER SET utf8mb4);
insert into t1 values ('A'),('a');
insert into t1 values ('B'),('b');
insert into t1 values ('C'),('c');
insert into t1 values ('D'),('d');
insert into t1 values ('E'),('e');
insert into t1 values ('F'),('f');
insert into t1 values ('G'),('g');
insert into t1 values ('H'),('h');
insert into t1 values ('I'),('i');
insert into t1 values ('J'),('j');
insert into t1 values ('K'),('k');
insert into t1 values ('L'),('l');
insert into t1 values ('M'),('m');
insert into t1 values ('N'),('n');
insert into t1 values ('O'),('o');
insert into t1 values ('P'),('p');
insert into t1 values ('Q'),('q');
insert into t1 values ('R'),('r');
insert into t1 values ('S'),('s');
insert into t1 values ('T'),('t');
insert into t1 values ('U'),('u');
insert into t1 values ('V'),('v');
insert into t1 values ('W'),('w');
insert into t1 values ('X'),('x');
insert into t1 values ('Y'),('y');
insert into t1 values ('Z'),('z');
insert into t1 values ('AA'),('Aa'),('aa'),('aA');
insert into t1 values ('AE'),('Ae'),('ae'),('aE');
insert into t1 values ('CH'),('Ch'),('ch'),('cH');
insert into t1 values ('DZ'),('Dz'),('dz'),('dZ');
insert into t1 values ('DŽ'),('Dž'),('dž'),('dŽ');
insert into t1 values ('IJ'),('Ij'),('ij'),('iJ');
insert into t1 values ('LJ'),('Lj'),('lj'),('lJ');
insert into t1 values ('LL'),('Ll'),('ll'),('lL');
insert into t1 values ('NJ'),('Nj'),('nj'),('nJ');
insert into t1 values ('OE'),('Oe'),('oe'),('oE');
insert into t1 values ('SS'),('Ss'),('ss'),('sS');
insert into t1 values ('RR'),('Rr'),('rr'),('rR');
insert into t1 values ('CS'),('Cs'),('cs'),('cS');
insert into t1 values ('DZS'),('DZs'),('Dzs'),('DzS');
insert into t1 values ('dZS'),('dZs'),('dzs'),('dzS');
insert into t1 values ('GY'),('Gy'),('gy'),('gY');
insert into t1 values ('LY'),('Ly'),('ly'),('lY');
insert into t1 values ('NY'),('Ny'),('ny'),('nY');
insert into t1 values ('SZ'),('Sz'),('sz'),('sZ');
insert into t1 values ('TY'),('Ty'),('ty'),('tY');
insert into t1 values ('ZS'),('Zs'),('zs'),('zS');
insert into t1 values ('RR'),('Rr'),('rr'),('rR');
insert into t1 values ('ccs'),('Ccs'),('CCS'),('cCS');
insert into t1 values ('ddz'),('Ddz'),('DDZ'),('dDZ');
insert into t1 values ('ddzs'),('Ddzs'),('DDZS'),('dDZS');
insert into t1 values ('ggy'),('Ggy'),('GGY'),('gGY');
insert into t1 values ('lly'),('Lly'),('LLY'),('lLY');
insert into t1 values ('nny'),('Nny'),('NNY'),('nNY');
insert into t1 values ('ssz'),('Ssz'),('SSZ'),('sSZ');
insert into t1 values ('tty'),('Tty'),('TTY'),('tTY');
insert into t1 values ('zzs'),('Zzs'),('ZZS'),('zZS');
insert into t1 values ('UE'),('Ue'),('ue'),('uE');
SELECT GROUP_CONCAT(HEX(CONVERT(c1 USING utf16)) ORDER BY c1, HEX(c1) SEPARATOR ' ') FROM t1 GROUP BY c1 COLLATE utf8mb4_0900_ai_ci;
GROUP_CONCAT(HEX(CONVERT(c1 USING utf16)) ORDER BY c1, HEX(c1) SEPARATOR ' ')
004700470059 004700670079 006700470059 006700670079
004E004E0059 004E006E0079 006E004E0059 006E006E0079
005A005A0053 005A007A0073 007A005A0053 007A007A0073
0044005A0053 0044005A0073 0044007A0053 0044007A0073 0064005A0053 0064005A0073 0064007A0053 0064007A0073
00440044005A 00440064007A 00640044005A 00640064007A
0047 0067
0046 0066
0044 0064
0045 0065
0041 0061
0043 0063
0042 0062
004F 006F
004E 006E
004D 006D
004A 006A
004C 006C
004B 006B
0048 0068
0049 0069
0058 0078
0057 0077
0056 0076
0054 0074
0055 0075
0053 0073
0050 0070
0052 0072
0051 0071
0059 0079
005A 007A
005400540059 005400740079 007400540059 007400740079
004C004C0059 004C006C0079 006C004C0059 006C006C0079
00470059 00470079 00670059 00670079
0044005A 0044007A 0044017D 0044017E 0064005A 0064007A 0064017D 0064017E
00430053 00430073 00630053 00630073
00410041 00410061 00610041 00610061
00410045 00410065 00610045 00610065
00430048 00430068 00630048 00630068
004F0045 004F0065 006F0045 006F0065
004E0059 004E0079 006E0059 006E0079
004E004A 004E006A 006E004A 006E006A
004C004A 004C006A 006C004A 006C006A
004C004C 004C006C 006C004C 006C006C
004C0059 004C0079 006C0059 006C0079
0049004A 0049006A 0069004A 0069006A
00540059 00540079 00740059 00740079
00550045 00550065 00750045 00750065
0053005A 0053007A 0073005A 0073007A
00530053 00530073 00730053 00730073
00520052 00520052 00520072 00520072 00720052 00720052 00720072 00720072
005A0053 005A0073 007A0053 007A0073
00530053005A 00530073007A 00730053005A 00730073007A
004300430053 004300630073 006300430053 006300630073
00440044005A0053 00440064007A0073 00640044005A0053 00640064007A0073
SELECT GROUP_CONCAT(HEX(CONVERT(c1 USING utf16)) ORDER BY c1, HEX(c1) SEPARATOR ' ') FROM t1 GROUP BY c1 COLLATE utf8mb4_de_pb_0900_ai_ci;
GROUP_CONCAT(HEX(CONVERT(c1 USING utf16)) ORDER BY c1, HEX(c1) SEPARATOR ' ')
004700470059 004700670079 006700470059 006700670079
004E004E0059 004E006E0079 006E004E0059 006E006E0079
005A005A0053 005A007A0073 007A005A0053 007A007A0073
0044005A0053 0044005A0073 0044007A0053 0044007A0073 0064005A0053 0064005A0073 0064007A0053 0064007A0073
00440044005A 00440064007A 00640044005A 00640064007A
0047 0067
0046 0066
0044 0064
0045 0065
0041 0061
0043 0063
0042 0062
004F 006F
004E 006E
004D 006D
004A 006A
004C 006C
004B 006B
0048 0068
0049 0069
0058 0078
0057 0077
0056 0076
0054 0074
0055 0075
0053 0073
0050 0070
0052 0072
0051 0071
0059 0079
005A 007A
005400540059 005400740079 007400540059 007400740079
004C004C0059 004C006C0079 006C004C0059 006C006C0079
00470059 00470079 00670059 00670079
0044005A 0044007A 0044017D 0044017E 0064005A 0064007A 0064017D 0064017E
00430053 00430073 00630053 00630073
00410041 00410061 00610041 00610061
00410045 00410065 00610045 00610065
00430048 00430068 00630048 00630068
004F0045 004F0065 006F0045 006F0065
004E0059 004E0079 006E0059 006E0079
004E004A 004E006A 006E004A 006E006A
004C004A 004C006A 006C004A 006C006A
004C004C 004C006C 006C004C 006C006C
004C0059 004C0079 006C0059 006C0079
0049004A 0049006A 0069004A 0069006A
00540059 00540079 00740059 00740079
00550045 00550065 00750045 00750065
0053005A 0053007A 0073005A 0073007A
00530053 00530073 00730053 00730073
00520052 00520052 00520072 00520072 00720052 00720052 00720072 00720072
005A0053 005A0073 007A0053 007A0073
00530053005A 00530073007A 00730053005A 00730073007A
004300430053 004300630073 006300430053 006300630073
00440044005A0053 00440064007A0073 00640044005A0053 00640064007A0073
SELECT GROUP_CONCAT(HEX(CONVERT(c1 USING utf16)) ORDER BY c1, HEX(c1) SEPARATOR ' ') FROM t1 GROUP BY c1 COLLATE utf8mb4_is_0900_ai_ci;
GROUP_CONCAT(HEX(CONVERT(c1 USING utf16)) ORDER BY c1, HEX(c1) SEPARATOR ' ')
004700470059 004700670079 006700470059 006700670079
004E004E0059 004E006E0079 006E004E0059 006E006E0079
005A005A0053 005A007A0073 007A005A0053 007A007A0073
0044005A0053 0044005A0073 0044007A0053 0044007A0073 0064005A0053 0064005A0073 0064007A0053 0064007A0073
00440044005A 00440064007A 00640044005A 00640064007A
0047 0067
0046 0066
0044 0064
0045 0065
0041 0061
0043 0063
0042 0062
004F 006F
004E 006E
004D 006D
004A 006A
004C 006C
004B 006B
0048 0068
0049 0069
0058 0078
0057 0077
0056 0076
0054 0074
0055 0075
0053 0073
0050 0070
0052 0072
0051 0071
0059 0079
005A 007A
005400540059 005400740079 007400540059 007400740079
004C004C0059 004C006C0079 006C004C0059 006C006C0079
00470059 00470079 00670059 00670079
0044005A 0044007A 0044017D 0044017E 0064005A 0064007A 0064017D 0064017E
00430053 00430073 00630053 00630073
00410041 00410061 00610041 00610061
00410045 00410065 00610045 00610065
00430048 00430068 00630048 00630068
004F0045 004F0065 006F0045 006F0065
004E0059 004E0079 006E0059 006E0079
004E004A 004E006A 006E004A 006E006A
004C004A 004C006A 006C004A 006C006A
004C004C 004C006C 006C004C 006C006C
004C0059 004C0079 006C0059 006C0079
0049004A 0049006A 0069004A 0069006A
00540059 00540079 00740059 00740079
00550045 00550065 00750045 00750065
0053005A 0053007A 0073005A 0073007A
00530053 00530073 00730053 00730073
00520052 00520052 00520072 00520072 00720052 00720052 00720072 00720072
005A0053 005A0073 007A0053 007A0073
00530053005A 00530073007A 00730053005A 00730073007A
004300430053 004300630073 006300430053 006300630073
00440044005A0053 00440064007A0073 00640044005A0053 00640064007A0073
SELECT GROUP_CONCAT(HEX(CONVERT(c1 USING utf16)) ORDER BY c1, HEX(c1) SEPARATOR ' ') FROM t1 GROUP BY c1 COLLATE utf8mb4_lv_0900_ai_ci;
GROUP_CONCAT(HEX(CONVERT(c1 USING utf16)) ORDER BY c1, HEX(c1) SEPARATOR ' ')
004700470059 004700670079 006700470059 006700670079
004E004E0059 004E006E0079 006E004E0059 006E006E0079
005A005A0053 005A007A0073 007A005A0053 007A007A0073
0044005A0053 0044005A0073 0044007A0053 0044007A0073 0064005A0053 0064005A0073 0064007A0053 0064007A0073
0044017D 0044017E 0064017D 0064017E
00440044005A 00440064007A 00640044005A 00640064007A
0047 0067
0046 0066
0044 0064
0045 0065
0041 0061
0043 0063
0042 0062
004F 006F
004E 006E
004D 006D
004A 006A
004C 006C
004B 006B
0048 0068
0049 0069 0059 0079
0058 0078
0057 0077
0056 0076
0054 0074
0055 0075
0053 0073
0050 0070
0052 0072
0051 0071
005A 007A
005400540059 005400740079 007400540059 007400740079
004C004C0059 004C006C0079 006C004C0059 006C006C0079
00470059 00470079 00670059 00670079
0044005A 0044007A 0064005A 0064007A
00430053 00430073 00630053 00630073
00410041 00410061 00610041 00610061
00410045 00410065 00610045 00610065
00430048 00430068 00630048 00630068
004F0045 004F0065 006F0045 006F0065
004E004A 004E006A 006E004A 006E006A
004E0059 004E0079 006E0059 006E0079
004C004A 004C006A 006C004A 006C006A
004C004C 004C006C 006C004C 006C006C
004C0059 004C0079 006C0059 006C0079
0049004A 0049006A 0069004A 0069006A
00540059 00540079 00740059 00740079
00550045 00550065 00750045 00750065
0053005A 0053007A 0073005A 0073007A
00530053 00530073 00730053 00730073
00520052 00520052 00520072 00520072 00720052 00720052 00720072 00720072
005A0053 005A0073 007A0053 007A0073
00530053005A 00530073007A 00730053005A 00730073007A
004300430053 004300630073 006300430053 006300630073
00440044005A0053 00440064007A0073 00640044005A0053 00640064007A0073
SELECT GROUP_CONCAT(HEX(CONVERT(c1 USING utf16)) ORDER BY c1, HEX(c1) SEPARATOR ' ') FROM t1 GROUP BY c1 COLLATE utf8mb4_ro_0900_ai_ci;
GROUP_CONCAT(HEX(CONVERT(c1 USING utf16)) ORDER BY c1, HEX(c1) SEPARATOR ' ')
004700470059 004700670079 006700470059 006700670079
004E004E0059 004E006E0079 006E004E0059 006E006E0079
005A005A0053 005A007A0073 007A005A0053 007A007A0073
0044005A0053 0044005A0073 0044007A0053 0044007A0073 0064005A0053 0064005A0073 0064007A0053 0064007A0073
00440044005A 00440064007A 00640044005A 00640064007A
0047 0067
0046 0066
0044 0064
0045 0065
0041 0061
0043 0063
0042 0062
004F 006F
004E 006E
004D 006D
004A 006A
004C 006C
004B 006B
0048 0068
0049 0069
0058 0078
0057 0077
0056 0076
0054 0074
0055 0075
0053 0073
0050 0070
0052 0072
0051 0071
0059 0079
005A 007A
005400540059 005400740079 007400540059 007400740079
004C004C0059 004C006C0079 006C004C0059 006C006C0079
00470059 00470079 00670059 00670079
0044005A 0044007A 0044017D 0044017E 0064005A 0064007A 0064017D 0064017E
00430053 00430073 00630053 00630073
00410041 00410061 00610041 00610061
00410045 00410065 00610045 00610065
00430048 00430068 00630048 00630068
004F0045 004F0065 006F0045 006F0065
004E0059 004E0079 006E0059 006E0079
004E004A 004E006A 006E004A 006E006A
004C004A 004C006A 006C004A 006C006A
004C004C 004C006C 006C004C 006C006C
004C0059 004C0079 006C0059 006C0079
0049004A 0049006A 0069004A 0069006A
00540059 00540079 00740059 00740079
00550045 00550065 00750045 00750065
0053005A 0053007A 0073005A 0073007A
00530053 00530073 00730053 00730073
00520052 00520052 00520072 00520072 00720052 00720052 00720072 00720072
005A0053 005A0073 007A0053 007A0073
00530053005A 00530073007A 00730053005A 00730073007A
004300430053 004300630073 006300430053 006300630073
00440044005A0053 00440064007A0073 00640044005A0053 00640064007A0073
SELECT GROUP_CONCAT(HEX(CONVERT(c1 USING utf16)) ORDER BY c1, HEX(c1) SEPARATOR ' ') FROM t1 GROUP BY c1 COLLATE utf8mb4_sl_0900_ai_ci;
GROUP_CONCAT(HEX(CONVERT(c1 USING utf16)) ORDER BY c1, HEX(c1) SEPARATOR ' ')
004700470059 004700670079 006700470059 006700670079
004E004E0059 004E006E0079 006E004E0059 006E006E0079
005A005A0053 005A007A0073 007A005A0053 007A007A0073
0044017D 0044017E 0064017D 0064017E
0044005A0053 0044005A0073 0044007A0053 0044007A0073 0064005A0053 0064005A0073 0064007A0053 0064007A0073
00440044005A 00440064007A 00640044005A 00640064007A
0047 0067
0046 0066
0044 0064
0045 0065
0041 0061
0043 0063
0042 0062
004F 006F
004E 006E
004D 006D
004A 006A
004C 006C
004B 006B
0048 0068
0049 0069
0058 0078
0057 0077
0056 0076
0054 0074
0055 0075
0053 0073
0050 0070
0052 0072
0051 0071
0059 0079
005A 007A
005400540059 005400740079 007400540059 007400740079
004C004C0059 004C006C0079 006C004C0059 006C006C0079
00470059 00470079 00670059 00670079
0044005A 0044007A 0064005A 0064007A
00430053 00430073 00630053 00630073
00410041 00410061 00610041 00610061
00410045 00410065 00610045 00610065
00430048 00430068 00630048 00630068
004F0045 004F0065 006F0045 006F0065
004E0059 004E0079 006E0059 006E0079
004E004A 004E006A 006E004A 006E006A
004C004A 004C006A 006C004A 006C006A
004C004C 004C006C 006C004C 006C006C
004C0059 004C0079 006C0059 006C0079
0049004A 0049006A 0069004A 0069006A
00540059 00540079 00740059 00740079
00550045 00550065 00750045 00750065
0053005A 0053007A 0073005A 0073007A
00530053 00530073 00730053 00730073
00520052 00520052 00520072 00520072 00720052 00720052 00720072 00720072
005A0053 005A0073 007A0053 007A0073
00530053005A 00530073007A 00730053005A 00730073007A
004300430053 004300630073 006300430053 006300630073
00440044005A0053 00440064007A0073 00640044005A0053 00640064007A0073
SELECT GROUP_CONCAT(HEX(CONVERT(c1 USING utf16)) ORDER BY c1, HEX(c1) SEPARATOR ' ') FROM t1 GROUP BY c1 COLLATE utf8mb4_pl_0900_ai_ci;
GROUP_CONCAT(HEX(CONVERT(c1 USING utf16)) ORDER BY c1, HEX(c1) SEPARATOR ' ')
004700470059 004700670079 006700470059 006700670079
004E004E0059 004E006E0079 006E004E0059 006E006E0079
005A005A0053 005A007A0073 007A005A0053 007A007A0073
0044005A0053 0044005A0073 0044007A0053 0044007A0073 0064005A0053 0064005A0073 0064007A0053 0064007A0073
00440044005A 00440064007A 00640044005A 00640064007A
0047 0067
0046 0066
0044 0064
0045 0065
0041 0061
0043 0063
0042 0062
004F 006F
004E 006E
004D 006D
004A 006A
004C 006C
004B 006B
0048 0068
0049 0069
0058 0078
0057 0077
0056 0076
0054 0074
0055 0075
0053 0073
0050 0070
0052 0072
0051 0071
0059 0079
005A 007A
005400540059 005400740079 007400540059 007400740079
004C004C0059 004C006C0079 006C004C0059 006C006C0079
00470059 00470079 00670059 00670079
0044005A 0044007A 0044017D 0044017E 0064005A 0064007A 0064017D 0064017E
00430053 00430073 00630053 00630073
00410041 00410061 00610041 00610061
00410045 00410065 00610045 00610065
00430048 00430068 00630048 00630068
004F0045 004F0065 006F0045 006F0065
004E0059 004E0079 006E0059 006E0079
004E004A 004E006A 006E004A 006E006A
004C004A 004C006A 006C004A 006C006A
004C004C 004C006C 006C004C 006C006C
004C0059 004C0079 006C0059 006C0079
0049004A 0049006A 0069004A 0069006A
00540059 00540079 00740059 00740079
00550045 00550065 00750045 00750065
0053005A 0053007A 0073005A 0073007A
00530053 00530073 00730053 00730073
00520052 00520052 00520072 00520072 00720052 00720052 00720072 00720072
005A0053 005A0073 007A0053 007A0073
00530053005A 00530073007A 00730053005A 00730073007A
004300430053 004300630073 006300430053 006300630073
00440044005A0053 00440064007A0073 00640044005A0053 00640064007A0073
SELECT GROUP_CONCAT(HEX(CONVERT(c1 USING utf16)) ORDER BY c1, HEX(c1) SEPARATOR ' ') FROM t1 GROUP BY c1 COLLATE utf8mb4_et_0900_ai_ci;
GROUP_CONCAT(HEX(CONVERT(c1 USING utf16)) ORDER BY c1, HEX(c1) SEPARATOR ' ')
004700470059 004700670079 006700470059 006700670079
00530053005A 00530073007A 00730053005A 00730073007A
004E004E0059 004E006E0079 006E004E0059 006E006E0079
0044017D 0044017E 0064017D 0064017E
0044005A 0044007A 0064005A 0064007A
0044005A0053 0044005A0073 0044007A0053 0044007A0073 0064005A0053 0064005A0073 0064007A0053 0064007A0073
005A0053 005A0073 007A0053 007A0073
0047 0067
0046 0066
0044 0064
0045 0065
0041 0061
0043 0063
0042 0062
004F 006F
004E 006E
004D 006D
004A 006A
004C 006C
004B 006B
0048 0068
0049 0069
0058 0078
0057 0077
0056 0076
0054 0074
0055 0075
0053 0073
0050 0070
0052 0072
0051 0071
0059 0079
005400540059 005400740079 007400540059 007400740079
005A005A0053 005A007A0073 007A005A0053 007A007A0073
004C004C0059 004C006C0079 006C004C0059 006C006C0079
00470059 00470079 00670059 00670079
00430053 00430073 00630053 00630073
00410041 00410061 00610041 00610061
00410045 00410065 00610045 00610065
00430048 00430068 00630048 00630068
004F0045 004F0065 006F0045 006F0065
004E0059 004E0079 006E0059 006E0079
004E004A 004E006A 006E004A 006E006A
004C004A 004C006A 006C004A 006C006A
004C004C 004C006C 006C004C 006C006C
004C0059 004C0079 006C0059 006C0079
0049004A 0049006A 0069004A 0069006A
00540059 00540079 00740059 00740079
005A 007A
00550045 00550065 00750045 00750065
00530053 00530073 00730053 00730073
00440044005A0053 00440064007A0073 00640044005A0053 00640064007A0073
00520052 00520052 00520072 00520072 00720052 00720052 00720072 00720072
0053005A 0053007A 0073005A 0073007A
004300430053 004300630073 006300430053 006300630073
00440044005A 00440064007A 00640044005A 00640064007A
SELECT GROUP_CONCAT(HEX(CONVERT(c1 USING utf16)) ORDER BY c1, HEX(c1) SEPARATOR ' ') FROM t1 GROUP BY c1 COLLATE utf8mb4_es_0900_ai_ci;
GROUP_CONCAT(HEX(CONVERT(c1 USING utf16)) ORDER BY c1, HEX(c1) SEPARATOR ' ')
004700470059 004700670079 006700470059 006700670079
004E004E0059 004E006E0079 006E004E0059 006E006E0079
005A005A0053 005A007A0073 007A005A0053 007A007A0073
0044005A0053 0044005A0073 0044007A0053 0044007A0073 0064005A0053 0064005A0073 0064007A0053 0064007A0073
00440044005A 00440064007A 00640044005A 00640064007A
0047 0067
0046 0066
0044 0064
0045 0065
0041 0061
0043 0063
0042 0062
004F 006F
004E 006E
004D 006D
004A 006A
004C 006C
004B 006B
0048 0068
0049 0069
0058 0078
0057 0077
0056 0076
0054 0074
0055 0075
0053 0073
0050 0070
0052 0072
0051 0071
0059 0079
005A 007A
005400540059 005400740079 007400540059 007400740079
004C004C0059 004C006C0079 006C004C0059 006C006C0079
00470059 00470079 00670059 00670079
0044005A 0044007A 0044017D 0044017E 0064005A 0064007A 0064017D 0064017E
00430053 00430073 00630053 00630073
00410041 00410061 00610041 00610061
00410045 00410065 00610045 00610065
00430048 00430068 00630048 00630068
004F0045 004F0065 006F0045 006F0065
004E0059 004E0079 006E0059 006E0079
004E004A 004E006A 006E004A 006E006A
004C004A 004C006A 006C004A 006C006A
004C004C 004C006C 006C004C 006C006C
004C0059 004C0079 006C0059 006C0079
0049004A 0049006A 0069004A 0069006A
00540059 00540079 00740059 00740079
00550045 00550065 00750045 00750065
0053005A 0053007A 0073005A 0073007A
00530053 00530073 00730053 00730073
00520052 00520052 00520072 00520072 00720052 00720052 00720072 00720072
005A0053 005A0073 007A0053 007A0073
00530053005A 00530073007A 00730053005A 00730073007A
004300430053 004300630073 006300430053 006300630073
00440044005A0053 00440064007A0073 00640044005A0053 00640064007A0073
SELECT GROUP_CONCAT(HEX(CONVERT(c1 USING utf16)) ORDER BY c1, HEX(c1) SEPARATOR ' ') FROM t1 GROUP BY c1 COLLATE utf8mb4_sv_0900_ai_ci;
GROUP_CONCAT(HEX(CONVERT(c1 USING utf16)) ORDER BY c1, HEX(c1) SEPARATOR ' ')
004700470059 004700670079 006700470059 006700670079
004E004E0059 004E006E0079 006E004E0059 006E006E0079
005A005A0053 005A007A0073 007A005A0053 007A007A0073
0044005A0053 0044005A0073 0044007A0053 0044007A0073 0064005A0053 0064005A0073 0064007A0053 0064007A0073
00440044005A 00440064007A 00640044005A 00640064007A
0047 0067
0046 0066
0044 0064
0045 0065
0041 0061
0043 0063
0042 0062
004F 006F
004E 006E
004D 006D
004A 006A
004C 006C
004B 006B
0048 0068
0049 0069
0058 0078
0057 0077
0056 0076
0054 0074
0055 0075
0053 0073
0050 0070
0052 0072
0051 0071
0059 0079
005A 007A
005400540059 005400740079 007400540059 007400740079
004C004C0059 004C006C0079 006C004C0059 006C006C0079
00470059 00470079 00670059 00670079
0044005A 0044007A 0044017D 0044017E 0064005A 0064007A 0064017D 0064017E
00430053 00430073 00630053 00630073
00410041 00410061 00610041 00610061
00410045 00410065 00610045 00610065
00430048 00430068 00630048 00630068
004F0045 004F0065 006F0045 006F0065
004E0059 004E0079 006E0059 006E0079
004E004A 004E006A 006E004A 006E006A
004C004A 004C006A 006C004A 006C006A
004C004C 004C006C 006C004C 006C006C
004C0059 004C0079 006C0059 006C0079
0049004A 0049006A 0069004A 0069006A
00540059 00540079 00740059 00740079
00550045 00550065 00750045 00750065
0053005A 0053007A 0073005A 0073007A
00530053 00530073 00730053 00730073
00520052 00520052 00520072 00520072 00720052 00720052 00720072 00720072
005A0053 005A0073 007A0053 007A0073
00530053005A 00530073007A 00730053005A 00730073007A
004300430053 004300630073 006300430053 006300630073
00440044005A0053 00440064007A0073 00640044005A0053 00640064007A0073
SELECT GROUP_CONCAT(HEX(CONVERT(c1 USING utf16)) ORDER BY c1, HEX(c1) SEPARATOR ' ') FROM t1 GROUP BY c1 COLLATE utf8mb4_tr_0900_ai_ci;
GROUP_CONCAT(HEX(CONVERT(c1 USING utf16)) ORDER BY c1, HEX(c1) SEPARATOR ' ')
004700470059 004700670079 006700470059 006700670079
004E004E0059 004E006E0079 006E004E0059 006E006E0079
005A005A0053 005A007A0073 007A005A0053 007A007A0073
0044005A0053 0044005A0073 0044007A0053 0044007A0073 0064005A0053 0064005A0073 0064007A0053 0064007A0073
00440044005A 00440064007A 00640044005A 00640064007A
0047 0067
0046 0066
0044 0064
0045 0065
0041 0061
0043 0063
0042 0062
004F 006F
004E 006E
004D 006D
004A 006A
004C 006C
004B 006B
0048 0068
0069
0058 0078
0057 0077
0056 0076
0054 0074
0055 0075
0053 0073
0050 0070
0052 0072
0051 0071
0059 0079
005A 007A
005400540059 005400740079 007400540059 007400740079
004C004C0059 004C006C0079 006C004C0059 006C006C0079
00470059 00470079 00670059 00670079
0044005A 0044007A 0044017D 0044017E 0064005A 0064007A 0064017D 0064017E
00430053 00430073 00630053 00630073
00410041 00410061 00610041 00610061
00410045 00410065 00610045 00610065
00430048 00430068 00630048 00630068
004F0045 004F0065 006F0045 006F0065
004E0059 004E0079 006E0059 006E0079
004E004A 004E006A 006E004A 006E006A
004C004A 004C006A 006C004A 006C006A
004C004C 004C006C 006C004C 006C006C
004C0059 004C0079 006C0059 006C0079
0049
0069004A 0069006A
00540059 00540079 00740059 00740079
00550045 00550065 00750045 00750065
0053005A 0053007A 0073005A 0073007A
00530053 00530073 00730053 00730073
00520052 00520052 00520072 00520072 00720052 00720052 00720072 00720072
005A0053 005A0073 007A0053 007A0073
00530053005A 00530073007A 00730053005A 00730073007A
0049004A 0049006A
004300430053 004300630073 006300430053 006300630073
00440044005A0053 00440064007A0073 00640044005A0053 00640064007A0073
SELECT GROUP_CONCAT(HEX(CONVERT(c1 USING utf16)) ORDER BY c1, HEX(c1) SEPARATOR ' ') FROM t1 GROUP BY c1 COLLATE utf8mb4_cs_0900_ai_ci;
GROUP_CONCAT(HEX(CONVERT(c1 USING utf16)) ORDER BY c1, HEX(c1) SEPARATOR ' ')
004700470059 004700670079 006700470059 006700670079
004E004E0059 004E006E0079 006E004E0059 006E006E0079
005A005A0053 005A007A0073 007A005A0053 007A007A0073
0044017D 0044017E 0064017D 0064017E
0044005A0053 0044005A0073 0044007A0053 0044007A0073 0064005A0053 0064005A0073 0064007A0053 0064007A0073
00440044005A 00440064007A 00640044005A 00640064007A
0047 0067
0046 0066
0044 0064
0045 0065
0041 0061
0043 0063
0042 0062
004F 006F
004E 006E
004D 006D
004A 006A
004C 006C
004B 006B
0048 0068
0049 0069
0058 0078
0057 0077
0056 0076
0054 0074
0055 0075
0053 0073
0050 0070
0052 0072
0051 0071
0059 0079
005A 007A
005400540059 005400740079 007400540059 007400740079
004C004C0059 004C006C0079 006C004C0059 006C006C0079
00470059 00470079 00670059 00670079
0044005A 0044007A 0064005A 0064007A
00430053 00430073 00630053 00630073
00410041 00410061 00610041 00610061
00410045 00410065 00610045 00610065
004F0045 004F0065 006F0045 006F0065
004E0059 004E0079 006E0059 006E0079
004E004A 004E006A 006E004A 006E006A
004C004A 004C006A 006C004A 006C006A
004C004C 004C006C 006C004C 006C006C
004C0059 004C0079 006C0059 006C0079
00430048 00430068 00630048 00630068
0049004A 0049006A 0069004A 0069006A
00540059 00540079 00740059 00740079
00550045 00550065 00750045 00750065
0053005A 0053007A 0073005A 0073007A
00530053 00530073 00730053 00730073
00520052 00520052 00520072 00520072 00720052 00720052 00720072 00720072
005A0053 005A0073 007A0053 007A0073
00530053005A 00530073007A 00730053005A 00730073007A
004300430053 004300630073 006300430053 006300630073
00440044005A0053 00440064007A0073 00640044005A0053 00640064007A0073
SELECT GROUP_CONCAT(HEX(CONVERT(c1 USING utf16)) ORDER BY c1, HEX(c1) SEPARATOR ' ') FROM t1 GROUP BY c1 COLLATE utf8mb4_da_0900_ai_ci;
GROUP_CONCAT(HEX(CONVERT(c1 USING utf16)) ORDER BY c1, HEX(c1) SEPARATOR ' ')
004700470059 004700670079 006700470059 006700670079
004E004E0059 004E006E0079 006E004E0059 006E006E0079
005A005A0053 005A007A0073 007A005A0053 007A007A0073
0044005A0053 0044005A0073 0044007A0053 0044007A0073 0064005A0053 0064005A0073 0064007A0053 0064007A0073
00440044005A 00440064007A 00640044005A 00640064007A
0047 0067
0046 0066
0044 0064
0045 0065
0041 0061
0043 0063
0042 0062
004F 006F
004E 006E
004D 006D
004A 006A
004C 006C
004B 006B
0048 0068
0049 0069
0058 0078
0057 0077
0056 0076
0054 0074
0055 0075
0053 0073
0050 0070
0052 0072
0051 0071
0059 0079
005A 007A
005400540059 005400740079 007400540059 007400740079
004C004C0059 004C006C0079 006C004C0059 006C006C0079
00470059 00470079 00670059 00670079
0044005A 0044007A 0044017D 0044017E 0064005A 0064007A 0064017D 0064017E
00430053 00430073 00630053 00630073
00610041
00410045 00410065 00610045 00610065
00430048 00430068 00630048 00630068
004F0045 004F0065 006F0045 006F0065
004E0059 004E0079 006E0059 006E0079
004E004A 004E006A 006E004A 006E006A
004C004A 004C006A 006C004A 006C006A
004C004C 004C006C 006C004C 006C006C
004C0059 004C0079 006C0059 006C0079
0049004A 0049006A 0069004A 0069006A
00540059 00540079 00740059 00740079
00550045 00550065 00750045 00750065
0053005A 0053007A 0073005A 0073007A
00530053 00530073 00730053 00730073
00520052 00520052 00520072 00520072 00720052 00720052 00720072 00720072
00410041 00410061 00610061
005A0053 005A0073 007A0053 007A0073
00530053005A 00530073007A 00730053005A 00730073007A
004300430053 004300630073 006300430053 006300630073
00440044005A0053 00440064007A0073 00640044005A0053 00640064007A0073
SELECT GROUP_CONCAT(HEX(CONVERT(c1 USING utf16)) ORDER BY c1, HEX(c1) SEPARATOR ' ') FROM t1 GROUP BY c1 COLLATE utf8mb4_lt_0900_ai_ci;
GROUP_CONCAT(HEX(CONVERT(c1 USING utf16)) ORDER BY c1, HEX(c1) SEPARATOR ' ')
004700470059 004700670079 006700470059 006700670079
004E004E0059 004E006E0079 006E004E0059 006E006E0079
005A005A0053 005A007A0073 007A005A0053 007A007A0073
0044017D 0044017E 0064017D 0064017E
0044005A0053 0044005A0073 0044007A0053 0044007A0073 0064005A0053 0064005A0073 0064007A0053 0064007A0073
00440044005A 00440064007A 00640044005A 00640064007A
0047 0067
0046 0066
0044 0064
0045 0065
0041 0061
0043 0063
0042 0062
004F 006F
004E 006E
004D 006D
004A 006A
004C 006C
004B 006B
0048 0068
0049 0069 0059 0079
0058 0078
0057 0077
0056 0076
0054 0074
0055 0075
0053 0073
0050 0070
0052 0072
0051 0071
005A 007A
005400540059 005400740079 007400540059 007400740079
004C004C0059 004C006C0079 006C004C0059 006C006C0079
00470059 00470079 00670059 00670079
0044005A 0044007A 0064005A 0064007A
00430053 00430073 00630053 00630073
00410041 00410061 00610041 00610061
00410045 00410065 00610045 00610065
00430048 00430068 00630048 00630068
004F0045 004F0065 006F0045 006F0065
004E004A 004E006A 006E004A 006E006A
004E0059 004E0079 006E0059 006E0079
004C004A 004C006A 006C004A 006C006A
004C004C 004C006C 006C004C 006C006C
004C0059 004C0079 006C0059 006C0079
0049004A 0049006A 0069004A 0069006A
00540059 00540079 00740059 00740079
00550045 00550065 00750045 00750065
0053005A 0053007A 0073005A 0073007A
00530053 00530073 00730053 00730073
00520052 00520052 00520072 00520072 00720052 00720052 00720072 00720072
005A0053 005A0073 007A0053 007A0073
00530053005A 00530073007A 00730053005A 00730073007A
004300430053 004300630073 006300430053 006300630073
00440044005A0053 00440064007A0073 00640044005A0053 00640064007A0073
SELECT GROUP_CONCAT(HEX(CONVERT(c1 USING utf16)) ORDER BY c1, HEX(c1) SEPARATOR ' ') FROM t1 GROUP BY c1 COLLATE utf8mb4_sk_0900_ai_ci;
GROUP_CONCAT(HEX(CONVERT(c1 USING utf16)) ORDER BY c1, HEX(c1) SEPARATOR ' ')
004700470059 004700670079 006700470059 006700670079
004E004E0059 004E006E0079 006E004E0059 006E006E0079
005A005A0053 005A007A0073 007A005A0053 007A007A0073
0044017D 0044017E 0064017D 0064017E
0044005A0053 0044005A0073 0044007A0053 0044007A0073 0064005A0053 0064005A0073 0064007A0053 0064007A0073
00440044005A 00440064007A 00640044005A 00640064007A
0047 0067
0046 0066
0044 0064
0045 0065
0041 0061
0043 0063
0042 0062
004F 006F
004E 006E
004D 006D
004A 006A
004C 006C
004B 006B
0048 0068
0049 0069
0058 0078
0057 0077
0056 0076
0054 0074
0055 0075
0053 0073
0050 0070
0052 0072
0051 0071
0059 0079
005A 007A
005400540059 005400740079 007400540059 007400740079
004C004C0059 004C006C0079 006C004C0059 006C006C0079
00470059 00470079 00670059 00670079
0044005A 0044007A 0064005A 0064007A
00430053 00430073 00630053 00630073
00410041 00410061 00610041 00610061
00410045 00410065 00610045 00610065
004F0045 004F0065 006F0045 006F0065
004E0059 004E0079 006E0059 006E0079
004E004A 004E006A 006E004A 006E006A
004C004A 004C006A 006C004A 006C006A
004C004C 004C006C 006C004C 006C006C
004C0059 004C0079 006C0059 006C0079
00430048 00430068 00630048 00630068
0049004A 0049006A 0069004A 0069006A
00540059 00540079 00740059 00740079
00550045 00550065 00750045 00750065
0053005A 0053007A 0073005A 0073007A
00530053 00530073 00730053 00730073
00520052 00520052 00520072 00520072 00720052 00720052 00720072 00720072
005A0053 005A0073 007A0053 007A0073
00530053005A 00530073007A 00730053005A 00730073007A
004300430053 004300630073 006300430053 006300630073
00440044005A0053 00440064007A0073 00640044005A0053 00640064007A0073
SELECT GROUP_CONCAT(HEX(CONVERT(c1 USING utf16)) ORDER BY c1, HEX(c1) SEPARATOR ' ') FROM t1 GROUP BY c1 COLLATE utf8mb4_es_trad_0900_ai_ci;
GROUP_CONCAT(HEX(CONVERT(c1 USING utf16)) ORDER BY c1, HEX(c1) SEPARATOR ' ')
004700470059 004700670079 006700470059 006700670079
004E004E0059 004E006E0079 006E004E0059 006E006E0079
005A005A0053 005A007A0073 007A005A0053 007A007A0073
0044005A0053 0044005A0073 0044007A0053 0044007A0073 0064005A0053 0064005A0073 0064007A0053 0064007A0073
00440044005A 00440064007A 00640044005A 00640064007A
0047 0067
0046 0066
0044 0064
0045 0065
0041 0061
0043 0063
0042 0062
004F 006F
004E 006E
004D 006D
004A 006A
004C 006C
004B 006B
0048 0068
0049 0069
0058 0078
0057 0077
0056 0076
0054 0074
0055 0075
0053 0073
0050 0070
0052 0072
0051 0071
0059 0079
005A 007A
005400540059 005400740079 007400540059 007400740079
004C004C0059 004C006C0079 006C006C0079
006C004C0059
00470059 00470079 00670059 00670079
0044005A 0044007A 0044017D 0044017E 0064005A 0064007A 0064017D 0064017E
00430048 00430068 00630068
00430053 00430073 00630053 00630073
00410041 00410061 00610041 00610061
00410045 00410065 00610045 00610065
00630048
004F0045 004F0065 006F0045 006F0065
004E0059 004E0079 006E0059 006E0079
004E004A 004E006A 006E004A 006E006A
004C004A 004C006A 006C004A 006C006A
006C004C
004C0059 004C0079 006C0059 006C0079
004C004C 004C006C 006C006C
0049004A 0049006A 0069004A 0069006A
00540059 00540079 00740059 00740079
00550045 00550065 00750045 00750065
0053005A 0053007A 0073005A 0073007A
00530053 00530073 00730053 00730073
00520052 00520052 00520072 00520072 00720052 00720052 00720072 00720072
005A0053 005A0073 007A0053 007A0073
00530053005A 00530073007A 00730053005A 00730073007A
004300430053 004300630073 006300430053 006300630073
00440044005A0053 00440064007A0073 00640044005A0053 00640064007A0073
SELECT GROUP_CONCAT(HEX(CONVERT(c1 USING utf16)) ORDER BY c1, HEX(c1) SEPARATOR ' ') FROM t1 GROUP BY c1 COLLATE utf8mb4_la_0900_ai_ci;
GROUP_CONCAT(HEX(CONVERT(c1 USING utf16)) ORDER BY c1, HEX(c1) SEPARATOR ' ')
004700470059 004700670079 006700470059 006700670079
004E004E0059 004E006E0079 006E004E0059 006E006E0079
005A005A0053 005A007A0073 007A005A0053 007A007A0073
0044005A0053 0044005A0073 0044007A0053 0044007A0073 0064005A0053 0064005A0073 0064007A0053 0064007A0073
00440044005A 00440064007A 00640044005A 00640064007A
0047 0067
0046 0066
0044 0064
0045 0065
0041 0061
0043 0063
0042 0062
004F 006F
004E 006E
004D 006D
004C 006C
004B 006B
0048 0068
0049 0069 004A 006A
0058 0078
0057 0077
0055 0075 0056 0076
0054 0074
0053 0073
0050 0070
0052 0072
0051 0071
0059 0079
005A 007A
005400540059 005400740079 007400540059 007400740079
004C004C0059 004C006C0079 006C004C0059 006C006C0079
00470059 00470079 00670059 00670079
0044005A 0044007A 0044017D 0044017E 0064005A 0064007A 0064017D 0064017E
00430053 00430073 00630053 00630073
00410041 00410061 00610041 00610061
00410045 00410065 00610045 00610065
00430048 00430068 00630048 00630068
004F0045 004F0065 006F0045 006F0065
004E0059 004E0079 006E0059 006E0079
004E004A 004E006A 006E004A 006E006A
004C004C 004C006C 006C004C 006C006C
004C004A 004C006A 006C004A 006C006A
004C0059 004C0079 006C0059 006C0079
0049004A 0049006A 0069004A 0069006A
00550045 00550065 00750045 00750065
00540059 00540079 00740059 00740079
0053005A 0053007A 0073005A 0073007A
00530053 00530073 00730053 00730073
00520052 00520052 00520072 00520072 00720052 00720052 00720072 00720072
005A0053 005A0073 007A0053 007A0073
00530053005A 00530073007A 00730053005A 00730073007A
004300430053 004300630073 006300430053 006300630073
00440044005A0053 00440064007A0073 00640044005A0053 00640064007A0073
SELECT GROUP_CONCAT(HEX(CONVERT(c1 USING utf16)) ORDER BY c1, HEX(c1) SEPARATOR ' ') FROM t1 GROUP BY c1 COLLATE utf8mb4_eo_0900_ai_ci;
GROUP_CONCAT(HEX(CONVERT(c1 USING utf16)) ORDER BY c1, HEX(c1) SEPARATOR ' ')
004700470059 004700670079 006700470059 006700670079
004E004E0059 004E006E0079 006E004E0059 006E006E0079
005A005A0053 005A007A0073 007A005A0053 007A007A0073
0044005A0053 0044005A0073 0044007A0053 0044007A0073 0064005A0053 0064005A0073 0064007A0053 0064007A0073
00440044005A 00440064007A 00640044005A 00640064007A
0047 0067
0046 0066
0044 0064
0045 0065
0041 0061
0043 0063
0042 0062
004F 006F
004E 006E
004D 006D
004A 006A
004C 006C
004B 006B
0048 0068
0049 0069
0058 0078
0057 0077
0056 0076
0054 0074
0055 0075
0053 0073
0050 0070
0052 0072
0051 0071
0059 0079
005A 007A
005400540059 005400740079 007400540059 007400740079
004C004C0059 004C006C0079 006C004C0059 006C006C0079
00470059 00470079 00670059 00670079
0044005A 0044007A 0044017D 0044017E 0064005A 0064007A 0064017D 0064017E
00430053 00430073 00630053 00630073
00410041 00410061 00610041 00610061
00410045 00410065 00610045 00610065
00430048 00430068 00630048 00630068
004F0045 004F0065 006F0045 006F0065
004E0059 004E0079 006E0059 006E0079
004E004A 004E006A 006E004A 006E006A
004C004A 004C006A 006C004A 006C006A
004C004C 004C006C 006C004C 006C006C
004C0059 004C0079 006C0059 006C0079
0049004A 0049006A 0069004A 0069006A
00540059 00540079 00740059 00740079
00550045 00550065 00750045 00750065
0053005A 0053007A 0073005A 0073007A
00530053 00530073 00730053 00730073
00520052 00520052 00520072 00520072 00720052 00720052 00720072 00720072
005A0053 005A0073 007A0053 007A0073
00530053005A 00530073007A 00730053005A 00730073007A
004300430053 004300630073 006300430053 006300630073
00440044005A0053 00440064007A0073 00640044005A0053 00640064007A0073
SELECT GROUP_CONCAT(HEX(CONVERT(c1 USING utf16)) ORDER BY c1, HEX(c1) SEPARATOR ' ') FROM t1 GROUP BY c1 COLLATE utf8mb4_hu_0900_ai_ci;
GROUP_CONCAT(HEX(CONVERT(c1 USING utf16)) ORDER BY c1, HEX(c1) SEPARATOR ' ')
00640044005A0053
006700470059
004300430053 004300630073 006300630073
006E004E0059
007A005A0053
0064005A0053 0064005A0073
00640044005A
0044005A0073 0044007A0053 0064007A0053
0044005A0053 0044007A0073 0064007A0073
0047 0067
0046 0066
0044 0064
0045 0065
0041 0061
0043 0063
0042 0062
004F 006F
004E 006E
004D 006D
004A 006A
004C 006C
004B 006B
0048 0068
0049 0069
0058 0078
0057 0077
0056 0076
0054 0074
0055 0075
0053 0073
0050 0070
0052 0072
0051 0071
0059 0079
005A 007A
007400540059
004E004E0059 004E006E0079 006E006E0079
00440044005A 00440064007A 00640064007A
006C004C0059
00670059
0044005A 0044007A 0064007A
00470059 00470079 00670079
0044017D 0044017E 0064005A 0064017D 0064017E
00430053 00430073 00630073
00630053
00410041 00410061 00610041 00610061
00410045 00410065 00610045 00610065
00430048 00430068 00630048 00630068
004F0045 004F0065 006F0045 006F0065
006E0059
004E004A 004E006A 006E004A 006E006A
004E0059 004E0079 006E0079
004C004A 004C006A 006C004A 006C006A
004C004C 004C006C 006C004C 006C006C
006C0059
004C0059 004C0079 006C0079
0049004A 0049006A 0069004A 0069006A
00740059
00550045 00550065 00750045 00750065
00540059 00540079 00740079
0053005A 0053007A 0073007A
0073005A
00530053 00530073 00730053 00730073
00520052 00520052 00520072 00520072 00720052 00720052 00720072 00720072
00440044005A0053 00440064007A0073 00640064007A0073
007A0053
005A0053 005A0073 007A0073
005400540059 005400740079 007400740079
00730053005A
006300430053
005A005A0053 005A007A0073 007A007A0073
004C004C0059 004C006C0079 006C006C0079
00530053005A 00530073007A 00730073007A
004700470059 004700670079 006700670079
SELECT GROUP_CONCAT(HEX(CONVERT(c1 USING utf16)) ORDER BY c1, HEX(c1) SEPARATOR ' ') FROM t1 GROUP BY c1 COLLATE utf8mb4_hr_0900_ai_ci;
GROUP_CONCAT(HEX(CONVERT(c1 USING utf16)) ORDER BY c1, HEX(c1) SEPARATOR ' ')
004700470059 004700670079 006700470059 006700670079
004E004E0059 004E006E0079 006E004E0059 006E006E0079
005A005A0053 005A007A0073 007A005A0053 007A007A0073
0064017D
0044005A0053 0044005A0073 0044007A0053 0044007A0073 0064005A0053 0064005A0073 0064007A0053 0064007A0073
00440044005A 00440064007A 00640044005A 00640064007A
0047 0067
0046 0066
0044 0064
0045 0065
0041 0061
0043 0063
0042 0062
004F 006F
004E 006E
004D 006D
004A 006A
004C 006C
004B 006B
0048 0068
0049 0069
0058 0078
0057 0077
0056 0076
0054 0074
0055 0075
0053 0073
0050 0070
0052 0072
0051 0071
0059 0079
005A 007A
005400540059 005400740079 007400540059 007400740079
004C004C0059 004C006C0079 006C004C0059 006C006C0079
00470059 00470079 00670059 00670079
0044017D 0044017E 0064017E
0044005A 0044007A 0064005A 0064007A
00430053 00430073 00630053 00630073
00410041 00410061 00610041 00610061
00410045 00410065 00610045 00610065
00430048 00430068 00630048 00630068
004F0045 004F0065 006F0045 006F0065
004E0059 004E0079 006E0059 006E0079
006E004A
004E004A 004E006A 006E006A
006C004A
004C004C 004C006C 006C004C 006C006C
004C0059 004C0079 006C0059 006C0079
004C004A 004C006A 006C006A
0049004A 0049006A 0069004A 0069006A
00540059 00540079 00740059 00740079
00550045 00550065 00750045 00750065
0053005A 0053007A 0073005A 0073007A
00530053 00530073 00730053 00730073
00520052 00520052 00520072 00520072 00720052 00720052 00720072 00720072
005A0053 005A0073 007A0053 007A0073
00530053005A 00530073007A 00730053005A 00730073007A
004300430053 004300630073 006300430053 006300630073
00440044005A0053 00440064007A0073 00640044005A0053 00640064007A0073
SELECT GROUP_CONCAT(HEX(CONVERT(c1 USING utf16)) ORDER BY c1, HEX(c1) SEPARATOR ' ') FROM t1 GROUP BY c1 COLLATE utf8mb4_vi_0900_ai_ci;
GROUP_CONCAT(HEX(CONVERT(c1 USING utf16)) ORDER BY c1, HEX(c1) SEPARATOR ' ')
004700470059 004700670079 006700470059 006700670079
004E004E0059 004E006E0079 006E004E0059 006E006E0079
005A005A0053 005A007A0073 007A005A0053 007A007A0073
0044005A0053 0044005A0073 0044007A0053 0044007A0073 0064005A0053 0064005A0073 0064007A0053 0064007A0073
00440044005A 00440064007A 00640044005A 00640064007A
0047 0067
0046 0066
0044 0064
0045 0065
0041 0061
0043 0063
0042 0062
004F 006F
004E 006E
004D 006D
004A 006A
004C 006C
004B 006B
0048 0068
0049 0069
0058 0078
0057 0077
0056 0076
0054 0074
0055 0075
0053 0073
0050 0070
0052 0072
0051 0071
0059 0079
005A 007A
005400540059 005400740079 007400540059 007400740079
004C004C0059 004C006C0079 006C004C0059 006C006C0079
00470059 00470079 00670059 00670079
0044005A 0044007A 0044017D 0044017E 0064005A 0064007A 0064017D 0064017E
00430053 00430073 00630053 00630073
00410041 00410061 00610041 00610061
00410045 00410065 00610045 00610065
00430048 00430068 00630048 00630068
004F0045 004F0065 006F0045 006F0065
004E0059 004E0079 006E0059 006E0079
004E004A 004E006A 006E004A 006E006A
004C004A 004C006A 006C004A 006C006A
004C004C 004C006C 006C004C 006C006C
004C0059 004C0079 006C0059 006C0079
0049004A 0049006A 0069004A 0069006A
00540059 00540079 00740059 00740079
00550045 00550065 00750045 00750065
0053005A 0053007A 0073005A 0073007A
00530053 00530073 00730053 00730073
00520052 00520052 00520072 00520072 00720052 00720052 00720072 00720072
005A0053 005A0073 007A0053 007A0073
00530053005A 00530073007A 00730053005A 00730073007A
004300430053 004300630073 006300430053 006300630073
00440044005A0053 00440064007A0073 00640044005A0053 00640064007A0073
DROP TABLE t1;
CREATE TABLE t1 (a VARCHAR(1)) COLLATE utf8mb4_da_0900_ai_ci;
INSERT INTO t1 VALUES('a'), ('b'), ('c'), ('d'), ('e');
SELECT HEX(a), HEX(WEIGHT_STRING(a)) FROM t1 ORDER BY a;
HEX(a)	HEX(WEIGHT_STRING(a))
61	1C47
62	1C60
63	1C7A
64	1C8F
65	1CAA
TRUNCATE TABLE t1;
INSERT INTO t1 VALUES(_utf16 0x00C4), (_utf16 0x00C5), (_utf16 0x00C6), (_utf16 0x00D8), (_utf16 0x00D6);
SELECT HEX(a), HEX(WEIGHT_STRING(a)) FROM t1 ORDER BY a, BINARY a;
HEX(a)	HEX(WEIGHT_STRING(a))
C384	1F9854A5
C386	1F9854A5
C396	1F9854A6
C398	1F9854A6
C385	1F9854A7
DROP TABLE t1;
CREATE TABLE t1 (a VARCHAR(10), b VARCHAR(10)) COLLATE utf8mb4_da_0900_ai_ci;
INSERT INTO t1 VALUES(_utf16 0x015A, _utf16 0x00DF), (_utf16 0x0162, _utf16 0x00DE), (_utf16 0x01CF, _utf16 0x0132), (_utf16 0x01F8, _utf16 0x01CA), (_utf16 0x42, _utf16 0x1d2d);
SELECT HEX(CONVERT(a USING UTF16)) AS U16_a, HEX(CONVERT(b USING UTF16)) AS U16_b, a<b FROM t1;
U16_a	U16_b	a<b
015A	00DF	1
0162	00DE	1
01CF	0132	1
01F8	01CA	1
0042	1D2D	0
DROP TABLE t1;
CREATE TABLE t1(a VARCHAR(10), b VARCHAR(10)) COLLATE utf8mb4_hu_0900_ai_ci;
INSERT INTO t1 VALUES(_utf16 0x01c4, _utf16 0x01f1), (_utf16 0x01f1, _utf16 0x02a4), ('cukor', 'csak');
SELECT HEX(CONVERT(a USING UTF16)) AS U16_a, HEX(CONVERT(b USING UTF16)) AS U16_b, a<b FROM t1;
U16_a	U16_b	a<b
01C4	01F1	0
01F1	02A4	1
00630075006B006F0072	006300730061006B	1
DROP TABLE t1;
CREATE TABLE t1(a VARCHAR(10)) COLLATE utf8mb4_et_0900_ai_ci;
INSERT INTO t1 VALUES(_utf16 0x4F), (_utf16 0xD5), (_utf16 0x01A0), (_utf16 0x1EE0);
SELECT HEX(a), HEX(WEIGHT_STRING(a)) FROM t1 ORDER BY a, BINARY a;
HEX(a)	HEX(WEIGHT_STRING(a))
4F	1DDD
C6A0	1DDD
C395	1EFE54A5
E1BBA0	1EFE54A5
DROP TABLE t1;
CREATE TABLE t1(a VARCHAR(10), b VARCHAR(10)) COLLATE utf8mb4_et_0900_ai_ci;
INSERT INTO t1 VALUES(_utf16 0x4F, _utf16 0x1EE0), (_utf16 0x1EE0, _utf16 0x1EE7), (_utf16 0x55, _utf16 0x1E7A), (_utf16 0x1E7A, _utf16 0x1E7C), (_utf16 0x1E7A, _utf16 0x1E80), (_utf16 0x4F, _utf16 0x1ED6), (_utf16 0x1ED6, _utf16 0x1EE4);
SELECT HEX(CONVERT(a USING UTF16)) AS U16_a, HEX(CONVERT(b USING UTF16)) AS U16_b, a<b FROM t1;
U16_a	U16_b	a<b
004F	1EE0	1
1EE0	1EE7	0
0055	1E7A	0
1E7A	1E7C	1
1E7A	1E80	1
004F	1ED6	0
1ED6	1EE4	1
DROP TABLE t1;
CREATE TABLE t1(a VARCHAR(10), b VARCHAR(10)) COLLATE utf8mb4_cs_0900_ai_ci;
INSERT INTO t1 VALUES(_utf16 0x53, _utf16 0x1E66), (_utf16 0x53, _utf16 0x1E67), (_utf16 0x1E66, _utf16 0x1E9E);
SELECT HEX(CONVERT(a USING UTF16)) AS U16_a, HEX(CONVERT(b USING UTF16)) AS U16_b, a<b FROM t1;
U16_a	U16_b	a<b
0053	1E66	1
0053	1E67	1
1E66	1E9E	0
DROP TABLE t1;
CREATE TABLE t1(grp int, ch VARCHAR(10)) COLLATE utf8mb4_hr_0900_ai_ci;
INSERT INTO t1 VALUES(0, '\t'), (0, ' '), (0, _utf16 0x5F), (0, _utf16 0x02DC), (0, '$'), (0, _utf16 0x20A0), (0, _utf16 0x2180);
INSERT INTO t1 VALUES(1, 'a'), (1, _utf16 0xA723), (1, _utf16 0x02AD);
INSERT INTO t1 VALUES(2, _utf16 0x03B1), (2, _utf16 0x1FA9), (2, _utf16 0x03F7);
INSERT INTO t1 VALUES(3, _utf16 0x0430), (3, _utf16 0x046A), (3, _utf16 0x04C0);
INSERT INTO t1 VALUES(4, _utf16 0x2C30), (4, _utf16 0x10D0), (4, _utf16 0x0561), (4, _utf16 0x3041);
SELECT grp, HEX(CONVERT(ch USING utf16)) FROM t1 ORDER BY ch COLLATE utf8mb4_0900_ai_ci;
grp	HEX(CONVERT(ch USING utf16))
0	0009
0	0020
0	005F
0	02DC
0	2180
0	0024
0	20A0
1	0061
1	A723
1	02AD
2	03B1
2	1FA9
2	03F7
3	0430
3	046A
3	04C0
4	2C30
4	10D0
4	0561
4	3041
SELECT grp, HEX(CONVERT(ch USING utf16)) FROM t1 ORDER BY ch COLLATE utf8mb4_hr_0900_ai_ci;
grp	HEX(CONVERT(ch USING utf16))
0	0009
0	0020
0	005F
0	02DC
0	2180
0	0024
0	20A0
1	0061
1	A723
1	02AD
3	0430
3	046A
3	04C0
2	03B1
2	1FA9
2	03F7
4	2C30
4	10D0
4	0561
4	3041
DROP TABLE t1;
#
# Bug #25090543: DIFFERENCES BETWEEN ICU AND MYSQL FOR HUNGARIAN
#                CONTRACTIONS/LIGATURES
#
CREATE TABLE t1 (v VARCHAR(20) COLLATE utf8mb4_hu_0900_ai_ci);
INSERT INTO t1 VALUES ('dd'), ('a'), (_utf16 0x00E5), ('e'), ('d'), ('dz'),
('dzs'), ('ddz'), ('ddzs'), (_utf16 0x01F3), ('dza'), ('dzsa'),
('ddza'), ('ddzsa'), (_utf16 0x01F30061), ('dzu'), ('dzsu'),
('ddzu'), ('ddzsu'), (_utf16 0x01F30075), ('da'), ('dx'), ('dy'),
(_utf16 0x006400E5), (_utf16 0x00640394);
SELECT v, HEX(CONVERT(v USING utf16)) AS HEX, HEX(WEIGHT_STRING(v)) FROM t1 ORDER BY v, HEX(v);
v	HEX	HEX(WEIGHT_STRING(v))
a	0061	1C47
å	00E5	1C47
d	0064	1C8F
da	00640061	1C8F1C47
då	006400E5	1C8F1C47
dd	00640064	1C8F1C8F
dx	00640078	1C8F1EFF
dy	00640079	1C8F1F0B
ǳ	01F3	1C8F1F21
ǳa	01F30061	1C8F1F211C47
ǳu	01F30075	1C8F1F211EB5
dΔ	00640394	1C8F1FBD
dz	0064007A	1C8F54A5
dza	0064007A0061	1C8F54A51C47
ddz	00640064007A	1C8F54A51C8F54A5
ddza	00640064007A0061	1C8F54A51C8F54A51C47
ddzu	00640064007A0075	1C8F54A51C8F54A51EB5
dzu	0064007A0075	1C8F54A51EB5
dzs	0064007A0073	1C8F54A554A5
dzsa	0064007A00730061	1C8F54A554A51C47
ddzs	00640064007A0073	1C8F54A554A51C8F54A554A5
ddzsa	00640064007A00730061	1C8F54A554A51C8F54A554A51C47
ddzsu	00640064007A00730075	1C8F54A554A51C8F54A554A51EB5
dzsu	0064007A00730075	1C8F54A554A51EB5
e	0065	1CAA
SELECT v, HEX(CONVERT(v USING utf16)) AS HEX, HEX(WEIGHT_STRING(v)) FROM t1 ORDER BY 1, 2;
v	HEX	HEX(WEIGHT_STRING(v))
a	0061	1C47
å	00E5	1C47
d	0064	1C8F
da	00640061	1C8F1C47
då	006400E5	1C8F1C47
dd	00640064	1C8F1C8F
dx	00640078	1C8F1EFF
dy	00640079	1C8F1F0B
ǳ	01F3	1C8F1F21
ǳa	01F30061	1C8F1F211C47
ǳu	01F30075	1C8F1F211EB5
dΔ	00640394	1C8F1FBD
dz	0064007A	1C8F54A5
dza	0064007A0061	1C8F54A51C47
ddz	00640064007A	1C8F54A51C8F54A5
ddza	00640064007A0061	1C8F54A51C8F54A51C47
ddzu	00640064007A0075	1C8F54A51C8F54A51EB5
dzu	0064007A0075	1C8F54A51EB5
dzs	0064007A0073	1C8F54A554A5
dzsa	0064007A00730061	1C8F54A554A51C47
ddzs	00640064007A0073	1C8F54A554A51C8F54A554A5
ddzsa	00640064007A00730061	1C8F54A554A51C8F54A554A51C47
ddzsu	00640064007A00730075	1C8F54A554A51C8F54A554A51EB5
dzsu	0064007A00730075	1C8F54A554A51EB5
e	0065	1CAA
DROP TABLE t1;
CREATE TABLE t1 (a VARCHAR(10)) COLLATE utf8mb4_ru_0900_ai_ci;
INSERT INTO t1 VALUES(_utf16 0x0452), (_utf16 0x0453), (_utf16 0x0403),
(_utf16 0x0439), (_utf16 0x048B), (_utf16 0x048A), (_utf16 0x043B),
(_utf16 0x1D2B), (_utf16 0x045B), (_utf16 0x045C), (_utf16 0x040C);
SELECT HEX(CONVERT(a USING utf16)) AS codepoint FROM t1 ORDER BY a, HEX(a);
codepoint
0403
0453
0452
048A
048B
0439
040C
045C
043B
1D2B
045B
DROP TABLE t1;
CREATE TABLE t1 (
codepoint CHAR(1) CHARSET utf16 NOT NULL,
glyph CHAR(2) CHARSET utf8mb4 COLLATE utf8mb4_mn_cyrl_0900_ai_ci NOT NULL,
description VARCHAR(64) NOT NULL);
INSERT INTO t1 (codepoint, glyph, description) VALUES
(0x041E, 'О', 'CYRILLIC CAPITAL LETTER O'),
(0x04E8, 'Ө', 'CYRILLIC CAPITAL LETTER BARRED O'),
(0x041F, 'П', 'CYRILLIC CAPITAL LETTER PE '),
(0x043E, 'о', 'CYRILLIC SMALL LETTER O'),
(0x04E9, 'ө', 'CYRILLIC SMALL LETTER BARRED O'),
(0x043F, 'п', 'CYRILLIC SMALL LETTER PE'),
(0x0423, 'У', 'CYRILLIC CAPITAL LETTER U '),
(0x04AE, 'Ү', 'CYRILLIC CAPITAL LETTER STRAIGHT U '),
(0x0424, 'Ф', 'CYRILLIC CAPITAL LETTER EF '),
(0x0443, 'у', 'CYRILLIC SMALL LETTER U '),
(0x04AF, 'ү', 'CYRILLIC SMALL LETTER STRAIGHT U'),
(0x0444, 'ф', 'CYRILLIC SMALL LETTER EF');
SELECT HEX(codepoint), codepoint, glyph, description FROM t1 ORDER BY glyph, codepoint;
HEX(codepoint)	codepoint	glyph	description
041E	О	О	CYRILLIC CAPITAL LETTER O
043E	о	о	CYRILLIC SMALL LETTER O
04E8	Ө	Ө	CYRILLIC CAPITAL LETTER BARRED O
04E9	ө	ө	CYRILLIC SMALL LETTER BARRED O
041F	П	П	CYRILLIC CAPITAL LETTER PE 
043F	п	п	CYRILLIC SMALL LETTER PE
0423	У	У	CYRILLIC CAPITAL LETTER U 
0443	у	у	CYRILLIC SMALL LETTER U 
04AE	Ү	Ү	CYRILLIC CAPITAL LETTER STRAIGHT U 
04AF	ү	ү	CYRILLIC SMALL LETTER STRAIGHT U
0424	Ф	Ф	CYRILLIC CAPITAL LETTER EF 
0444	ф	ф	CYRILLIC SMALL LETTER EF
DROP TABLE t1;
#
# End of 8.0 tests
#
