purge recyclebin;
DROP TABLE IF EXISTS t1;
#
# Start of 5.5 tests
#
SET NAMES utf8mb4 COLLATE utf8mb4_0900_as_ci;
select hex('a'), hex('a ');
hex('a')	hex('a ')
61	6120
select 'a' = 'a', 'a' = 'a ', 'a ' = 'a';
'a' = 'a'	'a' = 'a '	'a ' = 'a'
1	0	0
select 'a\0' = 'a', 'a\0' < 'a', 'a\0' > 'a';
'a\0' = 'a'	'a\0' < 'a'	'a\0' > 'a'
1	0	0
select 'a' = 'a\0', 'a' < 'a\0', 'a' > 'a\0';
'a' = 'a\0'	'a' < 'a\0'	'a' > 'a\0'
1	0	0
select 'a\0' = 'a ', 'a\0' < 'a ', 'a\0' > 'a ';
'a\0' = 'a '	'a\0' < 'a '	'a\0' > 'a '
0	1	0
select 'a ' = 'a\0', 'a ' < 'a\0', 'a ' > 'a\0';
'a ' = 'a\0'	'a ' < 'a\0'	'a ' > 'a\0'
0	0	1
select 'a  a' > 'a', 'a  \0' < 'a';
'a  a' > 'a'	'a  \0' < 'a'
1	0
select binary 'a  a' > 'a', binary 'a  \0' > 'a', binary 'a\0' > 'a';
binary 'a  a' > 'a'	binary 'a  \0' > 'a'	binary 'a\0' > 'a'
1	1	1
select 'c' like '\_' as want0;
want0
0
create table t1 (c1 char(10) character set utf16 collate utf16_bin);
insert into t1 values ('A'),('a');
insert into t1 values ('B'),('b');
insert into t1 values ('C'),('c');
insert into t1 values ('D'),('d');
insert into t1 values ('E'),('e');
insert into t1 values ('F'),('f');
insert into t1 values ('G'),('g');
insert into t1 values ('H'),('h');
insert into t1 values ('I'),('i');
insert into t1 values ('J'),('j');
insert into t1 values ('K'),('k');
insert into t1 values ('L'),('l');
insert into t1 values ('M'),('m');
insert into t1 values ('N'),('n');
insert into t1 values ('O'),('o');
insert into t1 values ('P'),('p');
insert into t1 values ('Q'),('q');
insert into t1 values ('R'),('r');
insert into t1 values ('S'),('s');
insert into t1 values ('T'),('t');
insert into t1 values ('U'),('u');
insert into t1 values ('V'),('v');
insert into t1 values ('W'),('w');
insert into t1 values ('X'),('x');
insert into t1 values ('Y'),('y');
insert into t1 values ('Z'),('z');
insert into t1 values ('AA'),('Aa'),('aa'),('aA');
insert into t1 values ('AE'),('Ae'),('ae'),('aE');
insert into t1 values ('CH'),('Ch'),('ch'),('cH');
insert into t1 values ('DZ'),('Dz'),('dz'),('dZ');
insert into t1 values ('DŽ'),('Dž'),('dž'),('dŽ');
insert into t1 values ('IJ'),('Ij'),('ij'),('iJ');
insert into t1 values ('LJ'),('Lj'),('lj'),('lJ');
insert into t1 values ('LL'),('Ll'),('ll'),('lL');
insert into t1 values ('NJ'),('Nj'),('nj'),('nJ');
insert into t1 values ('OE'),('Oe'),('oe'),('oE');
insert into t1 values ('SS'),('Ss'),('ss'),('sS');
insert into t1 values ('RR'),('Rr'),('rr'),('rR');
select group_concat(c1 order by binary c1 separator '') from t1 group by c1 collate utf16_unicode_ci;
group_concat(c1 order by binary c1 separator '')
AAAaaAaa
AEAeaEae
Aa
Bb
CHChcHch
Cc
DZDzDŽDždZdzdŽdž
Dd
Ee
Ff
Gg
Hh
IJIjiJij
Ii
Jj
Kk
LJLjlJlj
LLLllLll
Ll
Mm
NJNjnJnj
Nn
OEOeoEoe
Oo
Pp
Qq
RRRrrRrr
Rr
SSSssSss
Ss
Tt
Uu
Vv
Ww
Xx
Yy
Zz
select group_concat(c1 order by binary c1 separator '') from t1 group by c1 collate utf16_icelandic_ci;
group_concat(c1 order by binary c1 separator '')
AAAaaAaa
AEAeaEae
Aa
Bb
CHChcHch
Cc
DZDzDŽDždZdzdŽdž
Dd
Ee
Ff
Gg
Hh
IJIjiJij
Ii
Jj
Kk
LJLjlJlj
LLLllLll
Ll
Mm
NJNjnJnj
Nn
OEOeoEoe
Oo
Pp
Qq
RRRrrRrr
Rr
SSSssSss
Ss
Tt
Uu
Vv
Ww
Xx
Yy
Zz
select group_concat(c1 order by binary c1 separator '') from t1 group by c1 collate utf16_latvian_ci;
group_concat(c1 order by binary c1 separator '')
AAAaaAaa
AEAeaEae
Aa
Bb
CHChcHch
Cc
DZDzdZdz
Dd
DŽDždŽdž
Ee
Ff
Gg
Hh
IJIjiJij
Ii
Jj
Kk
LJLjlJlj
LLLllLll
Ll
Mm
NJNjnJnj
Nn
OEOeoEoe
Oo
Pp
Qq
RRRrrRrr
Rr
SSSssSss
Ss
Tt
Uu
Vv
Ww
Xx
Yy
Zz
select group_concat(c1 order by binary c1 separator '') from t1 group by c1 collate utf16_romanian_ci;
group_concat(c1 order by binary c1 separator '')
AAAaaAaa
AEAeaEae
Aa
Bb
CHChcHch
Cc
DZDzDŽDždZdzdŽdž
Dd
Ee
Ff
Gg
Hh
IJIjiJij
Ii
Jj
Kk
LJLjlJlj
LLLllLll
Ll
Mm
NJNjnJnj
Nn
OEOeoEoe
Oo
Pp
Qq
RRRrrRrr
Rr
SSSssSss
Ss
Tt
Uu
Vv
Ww
Xx
Yy
Zz
select group_concat(c1 order by binary c1 separator '') from t1 group by c1 collate utf16_slovenian_ci;
group_concat(c1 order by binary c1 separator '')
AAAaaAaa
AEAeaEae
Aa
Bb
CHChcHch
Cc
DZDzdZdz
Dd
DŽDždŽdž
Ee
Ff
Gg
Hh
IJIjiJij
Ii
Jj
Kk
LJLjlJlj
LLLllLll
Ll
Mm
NJNjnJnj
Nn
OEOeoEoe
Oo
Pp
Qq
RRRrrRrr
Rr
SSSssSss
Ss
Tt
Uu
Vv
Ww
Xx
Yy
Zz
select group_concat(c1 order by binary c1 separator '') from t1 group by c1 collate utf16_polish_ci;
group_concat(c1 order by binary c1 separator '')
AAAaaAaa
AEAeaEae
Aa
Bb
CHChcHch
Cc
DZDzDŽDždZdzdŽdž
Dd
Ee
Ff
Gg
Hh
IJIjiJij
Ii
Jj
Kk
LJLjlJlj
LLLllLll
Ll
Mm
NJNjnJnj
Nn
OEOeoEoe
Oo
Pp
Qq
RRRrrRrr
Rr
SSSssSss
Ss
Tt
Uu
Vv
Ww
Xx
Yy
Zz
select group_concat(c1 order by binary c1 separator '') from t1 group by c1 collate utf16_estonian_ci;
group_concat(c1 order by binary c1 separator '')
AAAaaAaa
AEAeaEae
Aa
Bb
CHChcHch
Cc
DZDzdZdz
Dd
DŽDždŽdž
Ee
Ff
Gg
Hh
IJIjiJij
Ii
Jj
Kk
LJLjlJlj
LLLllLll
Ll
Mm
NJNjnJnj
Nn
OEOeoEoe
Oo
Pp
Qq
RRRrrRrr
Rr
SSSssSss
Ss
Tt
Uu
Vv
Ww
Xx
Yy
Zz
select group_concat(c1 order by binary c1 separator '') from t1 group by c1 collate utf16_spanish_ci;
group_concat(c1 order by binary c1 separator '')
AAAaaAaa
AEAeaEae
Aa
Bb
CHChcHch
Cc
DZDzDŽDždZdzdŽdž
Dd
Ee
Ff
Gg
Hh
IJIjiJij
Ii
Jj
Kk
LJLjlJlj
LLLllLll
Ll
Mm
NJNjnJnj
Nn
OEOeoEoe
Oo
Pp
Qq
RRRrrRrr
Rr
SSSssSss
Ss
Tt
Uu
Vv
Ww
Xx
Yy
Zz
select group_concat(c1 order by binary c1 separator '') from t1 group by c1 collate utf16_swedish_ci;
group_concat(c1 order by binary c1 separator '')
AAAaaAaa
AEAeaEae
Aa
Bb
CHChcHch
Cc
DZDzDŽDždZdzdŽdž
Dd
Ee
Ff
Gg
Hh
IJIjiJij
Ii
Jj
Kk
LJLjlJlj
LLLllLll
Ll
Mm
NJNjnJnj
Nn
OEOeoEoe
Oo
Pp
Qq
RRRrrRrr
Rr
SSSssSss
Ss
Tt
Uu
Vv
Ww
Xx
Yy
Zz
select group_concat(c1 order by binary c1 separator '') from t1 group by c1 collate utf16_turkish_ci;
group_concat(c1 order by binary c1 separator '')
AAAaaAaa
AEAeaEae
Aa
Bb
CHChcHch
Cc
DZDzDŽDždZdzdŽdž
Dd
Ee
Ff
Gg
Hh
I
IJIj
Jj
Kk
LJLjlJlj
LLLllLll
Ll
Mm
NJNjnJnj
Nn
OEOeoEoe
Oo
Pp
Qq
RRRrrRrr
Rr
SSSssSss
Ss
Tt
Uu
Vv
Ww
Xx
Yy
Zz
i
iJij
select group_concat(c1 order by binary c1 separator '') from t1 group by c1 collate utf16_czech_ci;
group_concat(c1 order by binary c1 separator '')
AAAaaAaa
AEAeaEae
Aa
Bb
CHChch
Cc
DZDzdZdz
Dd
DŽDždŽdž
Ee
Ff
Gg
Hh
IJIjiJij
Ii
Jj
Kk
LJLjlJlj
LLLllLll
Ll
Mm
NJNjnJnj
Nn
OEOeoEoe
Oo
Pp
Qq
RRRrrRrr
Rr
SSSssSss
Ss
Tt
Uu
Vv
Ww
Xx
Yy
Zz
cH
select group_concat(c1 order by binary c1 separator '') from t1 group by c1 collate utf16_danish_ci;
group_concat(c1 order by binary c1 separator '')
AAAaaa
AEAeaEae
Aa
Bb
CHChcHch
Cc
DZDzDŽDždZdzdŽdž
Dd
Ee
Ff
Gg
Hh
IJIjiJij
Ii
Jj
Kk
LJLjlJlj
LLLllLll
Ll
Mm
NJNjnJnj
Nn
OEOeoEoe
Oo
Pp
Qq
RRRrrRrr
Rr
SSSssSss
Ss
Tt
Uu
Vv
Ww
Xx
Yy
Zz
aA
select group_concat(c1 order by binary c1 separator '') from t1 group by c1 collate utf16_lithuanian_ci;
group_concat(c1 order by binary c1 separator '')
AAAaaAaa
AEAeaEae
Aa
Bb
CCHChcch
DZDzdZdz
Dd
DŽDždŽdž
Ee
Ff
Gg
Hh
IJIjiJij
IYiy
Jj
Kk
LJLjlJlj
LLLllLll
Ll
Mm
NJNjnJnj
Nn
OEOeoEoe
Oo
Pp
Qq
RRRrrRrr
Rr
SSSssSss
Ss
Tt
Uu
Vv
Ww
Xx
Zz
cH
select group_concat(c1 order by binary c1 separator '') from t1 group by c1 collate utf16_slovak_ci;
group_concat(c1 order by binary c1 separator '')
AAAaaAaa
AEAeaEae
Aa
Bb
CHChch
Cc
DZDzdZdz
Dd
DŽDždŽdž
Ee
Ff
Gg
Hh
IJIjiJij
Ii
Jj
Kk
LJLjlJlj
LLLllLll
Ll
Mm
NJNjnJnj
Nn
OEOeoEoe
Oo
Pp
Qq
RRRrrRrr
Rr
SSSssSss
Ss
Tt
Uu
Vv
Ww
Xx
Yy
Zz
cH
select group_concat(c1 order by binary c1 separator '') from t1 group by c1 collate utf16_spanish2_ci;
group_concat(c1 order by binary c1 separator '')
AAAaaAaa
AEAeaEae
Aa
Bb
CHChch
Cc
DZDzDŽDždZdzdŽdž
Dd
Ee
Ff
Gg
Hh
IJIjiJij
Ii
Jj
Kk
LJLjlJlj
LLLlll
Ll
Mm
NJNjnJnj
Nn
OEOeoEoe
Oo
Pp
Qq
RRRrrRrr
Rr
SSSssSss
Ss
Tt
Uu
Vv
Ww
Xx
Yy
Zz
cH
lL
select group_concat(c1 order by binary c1 separator '') from t1 group by c1 collate utf16_roman_ci;
group_concat(c1 order by binary c1 separator '')
AAAaaAaa
AEAeaEae
Aa
Bb
CHChcHch
Cc
DZDzDŽDždZdzdŽdž
Dd
Ee
Ff
Gg
Hh
IJIjiJij
IJij
Kk
LJLjlJlj
LLLllLll
Ll
Mm
NJNjnJnj
Nn
OEOeoEoe
Oo
Pp
Qq
RRRrrRrr
Rr
SSSssSss
Ss
Tt
UVuv
Ww
Xx
Yy
Zz
select group_concat(c1 order by binary c1 separator '') from t1 group by c1 collate utf16_esperanto_ci;
group_concat(c1 order by binary c1 separator '')
AAAaaAaa
AEAeaEae
Aa
Bb
CHChcHch
Cc
DZDzDŽDždZdzdŽdž
Dd
Ee
Ff
Gg
Hh
IJIjiJij
Ii
Jj
Kk
LJLjlJlj
LLLllLll
Ll
Mm
NJNjnJnj
Nn
OEOeoEoe
Oo
Pp
Qq
RRRrrRrr
Rr
SSSssSss
Ss
Tt
Uu
Vv
Ww
Xx
Yy
Zz
select group_concat(c1 order by binary c1 separator '') from t1 group by c1 collate utf16_hungarian_ci;
group_concat(c1 order by binary c1 separator '')
AAAaaAaa
AEAeaEae
Aa
Bb
CHChcHch
Cc
DZDzDŽDždZdzdŽdž
Dd
Ee
Ff
Gg
Hh
IJIjiJij
Ii
Jj
Kk
LJLjlJlj
LLLllLll
Ll
Mm
NJNjnJnj
Nn
OEOeoEoe
Oo
Pp
Qq
RRRrrRrr
Rr
SSSssSss
Ss
Tt
Uu
Vv
Ww
Xx
Yy
Zz
select group_concat(c1 order by binary c1 separator '') from t1 group by c1 collate utf16_croatian_ci;
group_concat(c1 order by binary c1 separator '')
AAAaaAaa
AEAeaEae
Aa
Bb
CHChcHch
Cc
DZDzdZdz
Dd
DŽDždŽdž
Ee
Ff
Gg
Hh
IJIjiJij
Ii
Jj
Kk
LJLjlJlj
LLLllLll
Ll
Mm
NJNjnJnj
Nn
OEOeoEoe
Oo
Pp
Qq
RRRrrRrr
Rr
SSSssSss
Ss
Tt
Uu
Vv
Ww
Xx
Yy
Zz
select group_concat(c1 order by binary c1 separator '') from t1 group by c1 collate utf16_german2_ci;
group_concat(c1 order by binary c1 separator '')
AAAaaAaa
AEAeaEae
Aa
Bb
CHChcHch
Cc
DZDzDŽDždZdzdŽdž
Dd
Ee
Ff
Gg
Hh
IJIjiJij
Ii
Jj
Kk
LJLjlJlj
LLLllLll
Ll
Mm
NJNjnJnj
Nn
OEOeoEoe
Oo
Pp
Qq
RRRrrRrr
Rr
SSSssSss
Ss
Tt
Uu
Vv
Ww
Xx
Yy
Zz
select group_concat(c1 order by binary c1 separator '') from t1 group by c1 collate utf16_unicode_520_ci;
group_concat(c1 order by binary c1 separator '')
AAAaaAaa
AEAeaEae
Aa
Bb
CHChcHch
Cc
DZDzDŽDždZdzdŽdž
Dd
Ee
Ff
Gg
Hh
IJIjiJij
Ii
Jj
Kk
LJLjlJlj
LLLllLll
Ll
Mm
NJNjnJnj
Nn
OEOeoEoe
Oo
Pp
Qq
RRRrrRrr
Rr
SSSssSss
Ss
Tt
Uu
Vv
Ww
Xx
Yy
Zz
select group_concat(c1 order by binary c1 separator '') from t1 group by c1 collate utf16_vietnamese_ci;
group_concat(c1 order by binary c1 separator '')
AAAaaAaa
AEAeaEae
Aa
Bb
CHChcHch
Cc
DZDzDŽDždZdzdŽdž
Dd
Ee
Ff
Gg
Hh
IJIjiJij
Ii
Jj
Kk
LJLjlJlj
LLLllLll
Ll
Mm
NJNjnJnj
Nn
OEOeoEoe
Oo
Pp
Qq
RRRrrRrr
Rr
SSSssSss
Ss
Tt
Uu
Vv
Ww
Xx
Yy
Zz
drop table t1;
SET NAMES utf8;
CREATE TABLE t1 (c varchar(150) CHARACTER SET utf16 COLLATE utf16_general_ci NOT NULL, INDEX (c));
INSERT INTO t1 VALUES (0x039C03C903B403B11F770308);
SELECT * FROM t1 WHERE c LIKE _utf16 0x039C0025 COLLATE utf16_general_ci;
c
Μωδαί̈
INSERT INTO t1 VALUES (0x039C03C903B4);
SELECT * FROM t1 WHERE c LIKE _utf16 0x039C0025
COLLATE utf16_general_ci ORDER BY c;
c
Μωδ
Μωδαί̈
DROP TABLE t1;
CREATE TABLE t1 (c varchar(150) CHARACTER SET utf16 COLLATE utf16_unicode_ci NOT NULL, INDEX (c));
INSERT INTO t1 VALUES (0x039C03C903B403B11F770308);
SELECT * FROM t1 WHERE c LIKE _utf16 0x039C0025 COLLATE utf16_unicode_ci;
c
Μωδαί̈
INSERT INTO t1 VALUES (0x039C03C903B4);
SELECT * FROM t1 WHERE c LIKE _utf16 0x039C0025
COLLATE utf16_unicode_ci ORDER BY c;
c
Μωδ
Μωδαί̈
DROP TABLE t1;
CREATE TABLE t1 (c varchar(150) CHARACTER SET utf16 COLLATE utf16_unicode_ci NOT NULL, INDEX (c));
INSERT INTO t1 VALUES (0x039C03C903B403B11F770308);
SELECT * FROM t1 WHERE c LIKE _utf16 0x039C0025 COLLATE utf16_unicode_ci;
c
Μωδαί̈
INSERT INTO t1 VALUES (0x039C03C903B4);
SELECT * FROM t1 WHERE c LIKE _utf16 0x039C0025
COLLATE utf16_unicode_ci ORDER BY c;
c
Μωδ
Μωδαί̈
DROP TABLE t1;
SET NAMES utf8;
SET @test_character_set='utf16';
SET @test_collation='utf16_swedish_ci';
SET @safe_character_set_server= @@character_set_server;
SET @safe_collation_server= @@collation_server;
SET @safe_character_set_client= @@character_set_client;
SET @safe_character_set_results= @@character_set_results;
SET character_set_server= @test_character_set;
SET collation_server= @test_collation;
DROP DATABASE d1;
CREATE DATABASE d1;
USE d1;
CREATE TABLE t1 (c CHAR(10), KEY(c));
SHOW FULL COLUMNS FROM t1;
Field	Type	Collation	Null	Key	Default	Extra	Privileges	Comment
c	char(10)	utf16_swedish_ci	YES	MUL	NULL		SELECT,INSERT,UPDATE,REFERENCES	
INSERT INTO t1 VALUES ('aaa'),('aaaa'),('aaaaa');
SELECT c as want3results FROM t1 WHERE c LIKE 'aaa%';
want3results
aaa
aaaa
aaaaa
DROP TABLE t1;
CREATE TABLE t1 (c1 varchar(15), KEY c1 (c1(2)));
SHOW FULL COLUMNS FROM t1;
Field	Type	Collation	Null	Key	Default	Extra	Privileges	Comment
c1	varchar(15)	utf16_swedish_ci	YES		NULL		SELECT,INSERT,UPDATE,REFERENCES	
INSERT INTO t1 VALUES ('location'),('loberge'),('lotre'),('boabab');
SELECT c1 as want3results from t1 where c1 like 'l%';
want3results
loberge
location
lotre
SELECT c1 as want3results from t1 where c1 like 'lo%';
want3results
loberge
location
lotre
SELECT c1 as want1result  from t1 where c1 like 'loc%';
want1result
location
SELECT c1 as want1result  from t1 where c1 like 'loca%';
want1result
location
SELECT c1 as want1result  from t1 where c1 like 'locat%';
want1result
location
SELECT c1 as want1result  from t1 where c1 like 'locati%';
want1result
location
SELECT c1 as want1result  from t1 where c1 like 'locatio%';
want1result
location
SELECT c1 as want1result  from t1 where c1 like 'location%';
want1result
location
DROP TABLE t1;
create table t1 (a set('a') not null);
insert ignore into t1 values (),();
Warnings:
Warning	1364	Field 'a' doesn't have a default value
Warning	1364	Field 'a' doesn't have a default value
select cast(a as char(1)) from t1;
cast(a as char(1))


select a sounds like a from t1;
a sounds like a
1
1
select 1 from t1 order by cast(a as char(1));
1
1
1
drop table t1;
set names utf8;
create table t1 (
name varchar(10),
level smallint unsigned);
show create table t1;
Table	Create Table
  `level` smallint(5) unsigned DEFAULT NULL
  `name` varchar(10) COLLATE utf16_swedish_ci DEFAULT NULL,
) ORGANIZATION INDEX DEFAULT CHARSET = utf16 COLLATE = utf16_swedish_ci ROW_FORMAT = DYNAMIC COMPRESSION = 'zstd_1.3.8' REPLICA_NUM = 1 BLOCK_SIZE = 16384 USE_BLOOM_FILTER = FALSE ENABLE_MACRO_BLOCK_BLOOM_FILTER = FALSE TABLET_SIZE = 134217728 PCTFREE = 0
t1	CREATE TABLE `t1` (
insert into t1 values ('string',1);
select concat(name,space(level)), concat(name, repeat(' ',level)) from t1;
concat(name,space(level))	concat(name, repeat(' ',level))
string 	string 
drop table t1;
DROP DATABASE d1;
USE test;
SET character_set_server= @safe_character_set_server;
SET collation_server= @safe_collation_server;
SET character_set_client= @safe_character_set_client;
SET character_set_results= @safe_character_set_results;
create table t1 select repeat('a',4000) a;
delete from t1;
insert into t1 values ('a'), ('a '), ('a\t');
select collation(a),hex(a) from t1 order by a;
collation(a)	hex(a)
utf8mb4_general_ci	61
utf8mb4_general_ci	6109
utf8mb4_general_ci	6120
drop table t1;
select @@collation_connection;
@@collation_connection
utf8mb4_general_ci
create table t1 ROW_FORMAT=DYNAMIC select repeat('a',50) as c1 ;
insert into t1 values('abcdef');
insert into t1 values('_bcdef');
insert into t1 values('a_cdef');
insert into t1 values('ab_def');
insert into t1 values('abc_ef');
insert into t1 values('abcd_f');
insert into t1 values('abcde_');
select c1 as c1u from t1 where c1 like 'ab\_def';
c1u
ab_def
select c1 as c2h from t1 where c1 like 'ab#_def' escape '#';
c2h
ab_def
drop table t1;
End of 4.1 tests
CREATE TABLE t1 (id int, a varchar(30) character set utf16);
INSERT INTO t1 VALUES (1, 0x01310069), (2, 0x01310131);
INSERT INTO t1 VALUES (3, 0x00690069), (4, 0x01300049);
INSERT INTO t1 VALUES (5, 0x01300130), (6, 0x00490049);
SELECT a, length(a) la, @l:=lower(a) l, length(@l) ll, @u:=upper(a) u, length(@u) lu
FROM t1 ORDER BY id;
a	la	l	ll	u	lu
II	4	ii	4	II	4
ii	4	ii	4	II	4
İI	4	ii	4	İI	4
İİ	4	ii	4	İİ	4
ıi	4	ıi	4	II	4
ıı	4	ıı	4	II	4
ALTER TABLE t1 MODIFY a VARCHAR(30) character set utf16 collate utf16_turkish_ci;
SELECT a, length(a) la, @l:=lower(a) l, length(@l) ll, @u:=upper(a) u, length(@u) lu
FROM t1 ORDER BY id;
a	la	l	ll	u	lu
II	4	ıı	4	II	4
ii	4	ii	4	İİ	4
İI	4	iı	4	İI	4
İİ	4	ii	4	İİ	4
ıi	4	ıi	4	Iİ	4
ıı	4	ıı	4	II	4
DROP TABLE t1;
drop table if exists t1;
create table t1 as
select repeat(' ', 64) as s1, repeat(' ',64) as s2
union
select null, null;
show create table t1;
Table	Create Table
  `s1` varchar(512) DEFAULT NULL,
  `s2` varchar(512) DEFAULT NULL
) ORGANIZATION INDEX DEFAULT CHARSET = utf8mb4 ROW_FORMAT = DYNAMIC COMPRESSION = 'zstd_1.3.8' REPLICA_NUM = 1 BLOCK_SIZE = 16384 USE_BLOOM_FILTER = FALSE ENABLE_MACRO_BLOCK_BLOOM_FILTER = FALSE TABLET_SIZE = 134217728 PCTFREE = 0
t1	CREATE TABLE `t1` (
delete from t1;
insert into t1 values('aaa','aaa');
insert into t1 values('aaa|qqq','qqq');
insert into t1 values('gheis','^[^a-dXYZ]+$');
insert into t1 values('aab','^aa?b');
insert into t1 values('Baaan','^Ba*n');
insert into t1 values('aaa','qqq|aaa');
insert into t1 values('qqq','qqq|aaa');
insert into t1 values('bbb','qqq|aaa');
insert into t1 values('bbb','qqq');
insert into t1 values('aaa','aba');
insert into t1 values(null,'abc');
insert into t1 values('def',null);
insert into t1 values(null,null);
select HIGH_PRIORITY s1 regexp s2 from t1;
s1 regexp s2
0
0
0
1
1
1
1
1
1
1
NULL
NULL
NULL
SELECT 'ghi' REGEXP 'ghi[';
Got one of the listed errors
drop table t1;
SELECT @@collation_connection;
@@collation_connection
utf8mb4_general_ci
#
# Bug#57737 Character sets: search fails with like, contraction, index
#
CREATE TABLE t1 AS SELECT REPEAT(' ', 10) AS s1 LIMIT 0;
INSERT INTO t1 VALUES ('c'),('ce'),('cé'),('ch');
SELECT * FROM t1 WHERE s1 LIKE 'c%';
s1
c
ce
ch
cé
ALTER TABLE t1 ADD KEY s1 (s1);
SELECT * FROM t1 WHERE s1 LIKE 'c%';
s1
c
ce
ch
cé
alter system set _enable_drop_and_add_index = true;
ALTER TABLE t1 DROP KEY s1, ADD KEY(s1(1));
alter system set _enable_drop_and_add_index = false;
SELECT * FROM t1 WHERE s1 LIKE 'ch';
s1
ch
DROP TABLE t1;
SELECT @@collation_connection;
@@collation_connection
utf8mb4_general_ci
#
# Bug#57737 Character sets: search fails with like, contraction, index
# Part#2 - ignorable characters
#
CREATE TABLE t1 AS SELECT REPEAT(' ', 10) AS s1 LIMIT 0;
INSERT INTO t1 VALUES ('a\0\0\0\0\0\t'),('a'),('b'),('c'),('d'),('e');
SELECT HEX(s1) FROM t1 WHERE s1 LIKE 'a%';
HEX(s1)
61
61000000000009
ALTER TABLE t1 ADD KEY s1 (s1);
SELECT HEX(s1) FROM t1 WHERE s1 LIKE 'a%';
HEX(s1)
61
61000000000009
DROP TABLE t1;
#
# End of 5.5 tests
#
#
# Start of 5.6 tests
#
#
# WL#3664 WEIGHT_STRING
#
select @@collation_connection;
@@collation_connection
utf8mb4_general_ci
select hex(weight_string('a'));
hex(weight_string('a'))
0041
select hex(weight_string('A'));
hex(weight_string('A'))
0041
select hex(weight_string('abc'));
hex(weight_string('abc'))
004100420043
select hex(weight_string('abc' as char(2)));
hex(weight_string('abc' as char(2)))
00410042
select hex(weight_string('abc' as char(3)));
hex(weight_string('abc' as char(3)))
004100420043
select hex(weight_string('abc' as char(5)));
hex(weight_string('abc' as char(5)))
00410042004300200020
select @@collation_connection;
@@collation_connection
utf8mb4_general_ci
select hex(weight_string(cast(_latin1 0x80 as char)));
hex(weight_string(cast(_latin1 0x80 as char)))
20AC
select hex(weight_string(cast(_latin1 0x808080 as char)));
hex(weight_string(cast(_latin1 0x808080 as char)))
20AC20AC20AC
select hex(weight_string(cast(_latin1 0x808080 as char) as char(2)));
hex(weight_string(cast(_latin1 0x808080 as char) as char(2)))
20AC20AC
select hex(weight_string(cast(_latin1 0x808080 as char) as char(3)));
hex(weight_string(cast(_latin1 0x808080 as char) as char(3)))
20AC20AC20AC
select hex(weight_string(cast(_latin1 0x808080 as char) as char(5)));
hex(weight_string(cast(_latin1 0x808080 as char) as char(5)))
20AC20AC20AC00200020
select hex(weight_string(_utf16 0xD800DC00 collate utf16_unicode_ci));
hex(weight_string(_utf16 0xD800DC00 collate utf16_unicode_ci))
FFFD
select hex(weight_string(_utf16 0xD800DC01 collate utf16_unicode_ci));
hex(weight_string(_utf16 0xD800DC01 collate utf16_unicode_ci))
FFFD
select @@collation_connection;
@@collation_connection
utf8mb4_general_ci
select collation(cast(_latin1 0xDF as char));
collation(cast(_latin1 0xDF as char))
utf8mb4_general_ci
select hex(weight_string('s'));
hex(weight_string('s'))
0053
select hex(weight_string(cast(_latin1 0xDF as char)));
hex(weight_string(cast(_latin1 0xDF as char)))
0053
select hex(weight_string(cast(_latin1 0xDF as char) as char(1)));
hex(weight_string(cast(_latin1 0xDF as char) as char(1)))
0053
select hex(weight_string('c'));
hex(weight_string('c'))
0043
select hex(weight_string('h'));
hex(weight_string('h'))
0048
select hex(weight_string('ch'));
hex(weight_string('ch'))
00430048
select hex(weight_string('i'));
hex(weight_string('i'))
0049
select hex(weight_string(cast(_latin1 0x6368DF as char)));
hex(weight_string(cast(_latin1 0x6368DF as char)))
004300480053
select hex(weight_string(cast(_latin1 0x6368DF as char) as char(1)));
hex(weight_string(cast(_latin1 0x6368DF as char) as char(1)))
0043
select hex(weight_string(cast(_latin1 0x6368DF as char) as char(2)));
hex(weight_string(cast(_latin1 0x6368DF as char) as char(2)))
00430048
select hex(weight_string(cast(_latin1 0x6368DF as char) as char(3)));
hex(weight_string(cast(_latin1 0x6368DF as char) as char(3)))
004300480053
select hex(weight_string(cast(_latin1 0x6368DF as char) as char(4)));
hex(weight_string(cast(_latin1 0x6368DF as char) as char(4)))
0043004800530020
select hex(weight_string(cast(_latin1 0xDF6368 as char)));
hex(weight_string(cast(_latin1 0xDF6368 as char)))
005300430048
select hex(weight_string(cast(_latin1 0xDF6368 as char) as char(1)));
hex(weight_string(cast(_latin1 0xDF6368 as char) as char(1)))
0053
select hex(weight_string(cast(_latin1 0xDF6368 as char) as char(2)));
hex(weight_string(cast(_latin1 0xDF6368 as char) as char(2)))
00530043
select hex(weight_string(cast(_latin1 0xDF6368 as char) as char(3)));
hex(weight_string(cast(_latin1 0xDF6368 as char) as char(3)))
005300430048
select hex(weight_string(cast(_latin1 0xDF6368 as char) as char(4)));
hex(weight_string(cast(_latin1 0xDF6368 as char) as char(4)))
0053004300480020
SET NAMES utf8;
"BEGIN ctype_german.inc"
drop table if exists t1;
create table t1 as select repeat(' ', 64) as s1;
select collation(s1) from t1;
collation(s1)
utf8mb4_general_ci
delete from t1;
INSERT INTO t1 VALUES ('ud'),('uf');
INSERT INTO t1 VALUES ('od'),('of');
INSERT INTO t1 VALUES ('e');
INSERT INTO t1 VALUES ('ad'),('af');
insert into t1 values ('a'),('ae'),(_latin1 0xE4);
insert into t1 values ('o'),('oe'),(_latin1 0xF6);
insert into t1 values ('s'),('ss'),(_latin1 0xDF);
insert into t1 values ('u'),('ue'),(_latin1 0xFC);
INSERT INTO t1 VALUES (_latin1 0xE6), (_latin1 0xC6);
INSERT INTO t1 VALUES (_latin1 0x9C), (_latin1 0x8C);
select s1, hex(s1) from t1 order by s1, binary s1;
s1	hex(s1)
a	61
ad	6164
ae	6165
af	6166
e	65
o	6F
od	6F64
oe	6F65
of	6F66
s	73
ss	7373
u	75
ud	7564
ue	7565
uf	7566
Æ	C386
ß	C39F
ä	C3A4
æ	C3A6
ö	C3B6
ü	C3BC
Œ	C592
œ	C593
select group_concat(s1 order by binary s1) from t1 group by s1;
group_concat(s1 order by binary s1)
a,ä
ad
ae
af
e
o,ö
od
oe
of
s,ß
ss
u,ü
ud
ue
uf
Æ,æ
Œ,œ
SELECT s1, hex(s1), hex(weight_string(s1)) FROM t1 ORDER BY s1, BINARY(s1);
s1	hex(s1)	hex(weight_string(s1))
a	61	0041
ad	6164	00410044
ae	6165	00410045
af	6166	00410046
e	65	0045
o	6F	004F
od	6F64	004F0044
oe	6F65	004F0045
of	6F66	004F0046
s	73	0053
ss	7373	00530053
u	75	0055
ud	7564	00550044
ue	7565	00550045
uf	7566	00550046
Æ	C386	00C6
ß	C39F	0053
ä	C3A4	0041
æ	C3A6	00C6
ö	C3B6	004F
ü	C3BC	0055
Œ	C592	0152
œ	C593	0152
SELECT s1, hex(s1) FROM t1 WHERE s1='ae' ORDER BY s1, BINARY(s1);
s1	hex(s1)
ae	6165
drop table t1;
"END ctype_german.inc"
#
# WL#2673 Unicode Collation Algorithm new version
#
SET NAMES utf8mb4;
DROP TABLE IF EXISTS t1;
#
# End of 5.6 tests
#
