ob1=OBI(cluster=1,proxy_num=0);
ob2=OBI(cluster=1:1,leaderob=ob1,proxy_num=0);
ob1.reboot;
ob2.reboot;
ob1.mysql alter system set resource_hard_limit=900;
ob1.mysql alter system set resource_soft_limit=800;
ob1.mysql CREATE RESOURCE UNIT unit_$case_index MAX_CPU $cpu, MAX_MEMORY $memory, MAX_IOPS $iops, MAX_DISK_SIZE $disk, MAX_SESSION_NUM 64, MIN_CPU=1, MIN_MEMORY=$min_memory, MIN_IOPS=128;
ob1.mysql CREATE RESOURCE POOL pool_$case_index UNIT = 'unit_$case_index', UNIT_NUM = $unit_num, ZONE_LIST = ($zone_list);
ob1.mysql CREATE TENANT tenant_$case_index RESOURCE_POOL_LIST = ('pool_$case_index'), locality=$locality;
ob1.mysql alter tenant tenant_$case_index set variables ob_tcp_invited_nodes='%';
create table t(c1 int primary key, c2 int, c3 int);
create table t1(c1 int primary key, c2 int, c3 int);
create tablegroup pg binding = true;
create tablegroup pg1 binding = true;
create table t2(c1 int primary key, c2 int, c3 int) tablegroup = 'pg1';
insert into t values (1,1,1);
select * from t;
c1	c2	c3
1	1	1
alter system set balancer_idle_time = '10s';
alter system set server_data_copy_out_concurrency = 30;
alter system set server_data_copy_in_concurrency = 30;
alter system set data_copy_concurrency = 60;
alter system set debug_sync_timeout = '1000s';
ob1.check_until_timeout select switchover_status from oceanbase.__all_virtual_cluster, TO STANDBY, 500;
ob2.mysql set global ob_query_timeout = 100000000;
ob2.mysql set ob_global_debug_sync = 'BLOCK_FREEZE_INFO_UPDATE wait_for signal';
update t set c2 = 2 where c1 = 1;
update t set c2 = 3 where c1 = 1;
begin;
insert into t values(2, 2, 2);
insert into t values(3, 3, 3);
insert into t values(4, 4, 4);
insert into t values(5, 5, 5);
insert into t values(6, 6, 6);
ob1.mysql alter system minor freeze tenant = sys;
ob1.mysql alter system minor freeze tenant = all_user;
ob1.mysql alter system minor freeze tenant = all_meta;
ob2.mysql alter system minor freeze tenant = sys;
ob2.mysql alter system minor freeze tenant = all_user;
ob2.mysql alter system minor freeze tenant = all_meta;
commit;
ob1.check_until_timeout select count(1) from __all_virtual_table_mgr where table_type=0 and is_active=0, 0, 300;
ob1.check_until_timeout select switchover_status from oceanbase.__all_virtual_cluster, TO STANDBY, 50;
select /*+ read_consistency(weak)*/* from t;
c1	c2	c3
1	3	1
2	2	2
3	3	3
4	4	4
5	5	5
6	6	6
ob1.force_stop;
ob2.force_stop;
ob2.start;
ob2.check_until_timeout select count(*) from oceanbase.__all_server where status = 'active', 2, 200;
ob2.check_until_timeout select count(*) from oceanbase.__all_virtual_core_meta_table, 2, 100;
ob2.mysql set ob_global_debug_sync = 'BEFORE_DO_MINOR_FREEZE wait_for signal';
ob2.check_until_timeout select count(*) from oceanbase.__all_server where start_service_time >0 , 2, 600;
ob2.mysql alter system set _mini_merge_concurrency = 16;
ob2.mysql alter system set _ob_minor_merge_schedule_interval = '3s';
set ob_query_timeout=1000000000;
ALTER SYSTEM ACTIVATE PHYSICAL STANDBY CLUSTER;
ob2.mysql alter system set _mini_merge_concurrency = 3;
ob2.mysql alter system set _ob_minor_merge_schedule_interval = '20s';
update t set c3 = 2 where c1 = 1;
update t set c3 = 4 where c1 = 1;
update t set c3 = 5 where c1 = 1;
update t set c3 = 6 where c1 = 1;
update t set c3 = 7 where c1 = 1;
update t set c3 = 8 where c1 = 1;
update t set c3 = 9 where c1 = 1;
update t set c3 = 10 where c1 = 1;
update t set c3 = 11 where c1 = 1;
update t set c3 = 12 where c1 = 1;
select * from t;
c1	c2	c3
1	1	12
ob2.check_until_timeout  select value from oceanbase.__all_zone where name='last_merged_version' and zone = '', 2, 600;
ob2.check_until_timeout select count(*) from oceanbase.__all_acquired_snapshot where snapshot_type = 2, 0, 300;
select * from t;
c1	c2	c3
1	1	12
ob2.mysql set ob_global_debug_sync = 'now signal signal';
ob2.check_until_timeout select count(*) from oceanbase.__all_virtual_table_mgr where table_id = $table_id and table_type = 7 and base_version >= $ft, 2, 100;
select * from t;
c1	c2	c3
1	1	12
