ob1=OBI(cluster=1:1:1,proxy_num=0);
ob2=OBI(cluster=1:1:1,leaderob=ob1,proxy_num=0);
ob3=OBI(cluster=1,leaderob=ob1,proxy_num=0);
ob1.reboot;
ob2.reboot;
ob3.reboot;
ob1.mysql alter system set resource_hard_limit=900;
ob1.mysql alter system set resource_soft_limit=800;
ob1.mysql CREATE RESOURCE UNIT unit_$case_index MAX_CPU $cpu, MAX_MEMORY $memory, MAX_IOPS $iops, MAX_DISK_SIZE $disk, MAX_SESSION_NUM 64, MIN_CPU=1, MIN_MEMORY=$min_memory, MIN_IOPS=128;
ob1.mysql CREATE RESOURCE POOL pool_$case_index UNIT = 'unit_$case_index', UNIT_NUM = $unit_num, ZONE_LIST = ($zone_list);
ob1.mysql CREATE TENANT tenant_$case_index RESOURCE_POOL_LIST = ('pool_$case_index'), locality=$locality;
ob1.mysql alter tenant tenant_$case_index set variables ob_tcp_invited_nodes='%';
create table t(c1 int primary key, c2 char(10), c3 int);
create table t1(c1 int primary key, c2 int, c3 int);
create tablegroup pg binding = true;
create tablegroup pg1 binding = true;
create table t2(c1 int primary key, c2 int, c3 int) tablegroup = 'pg1';
insert into t values (1,1,1);
select * from t;
c1	c2	c3
1	1	1
alter system set balancer_idle_time = '10s';
alter system set server_data_copy_out_concurrency = 30;
alter system set server_data_copy_in_concurrency = 30;
alter system set data_copy_concurrency = 60;
ob1.check_until_timeout select switchover_status from oceanbase.__all_virtual_cluster, TO STANDBY, 200;
ob1.check_until_timeout select synchronization_status from oceanbase.__all_virtual_standby_status where cluster_id=$cluster_id_ob2, OK, 200;
ob1.check_until_timeout select synchronization_status from oceanbase.__all_virtual_standby_status where cluster_id=$cluster_id_ob3, OK, 200;
ob1.mysql alter system modify cluster '$cluster_name' cluster_id $cluster_id_ob2 set redo_transport_options='SYNC';
ob1.mysql alter system modify cluster '$cluster_name' cluster_id $cluster_id_ob1 set redo_transport_options='SYNC';
ob1.check_until_timeout select count(*) from v\$ob_cluster where switchover_info = 'SYNCED STANDBY CLUSTERS: 2,3', 1, 360;
ob1.mysql ALTER SYSTEM SET STANDBY CLUSTER TO MAXIMIZE PROTECTION;
ob1.check_until_timeout select protection_level from oceanbase.__all_cluster where cluster_id = $cluster_id_ob2, MAXIMUM PROTECTION, 100;
alter system set debug_sync_timeout = '1000s';
ERROR HY000: protection level is not MAXIMUM PERFORMANCE, disconnect cluster is not allowed
ERROR HY000: protection level is not MAXIMUM PERFORMANCE, disconnect cluster is not allowed
ERROR HY000: primary cluster is still alive and in protection, disconnect cluster is not allowed
ob1.force_stop;
ob2.check_until_timeout select count(*) from oceanbase.__all_virtual_processlist, 5, 20;
ob2.mysql set ob_global_debug_sync = 'BEFORE_SET_CLUSTER_NAME_CONFIGURL wait_for set_cluster_name';
ERROR HY000: Timeout
ob2.z1.force_stop;
ob2.z2.obs0.check_until_timeout select count(*) from oceanbase.__all_server where status = 'inactive', 1, 360;
ob2.z1.nstart;
ob2.check_until_timeout select count(*) from oceanbase.__all_server where status = 'active' and start_service_time > 0,3, 200;
ob2.check_until_timeout select count(*) from (select count(*)c from oceanbase.__all_virtual_core_meta_table)s where s.c > 0, 1, 200;
ob2.mysql set ob_global_debug_sync = 'AFTER_SET_CLUSTER_NAME_CONFIGURL wait_for after_set_cluster_name';
ob2.mysql set ob_global_debug_sync = 'now signal set_cluster_name';
ERROR HY000: Timeout
ob2.z2.force_stop;
ob2.z3.obs0.check_until_timeout select count(*) from oceanbase.__all_server where status = 'inactive', 1, 360;
ob2.z2.nstart;
ob2.check_until_timeout select count(*) from oceanbase.__all_server where status = 'active' and start_service_time > 0,3, 200;
ob2.check_until_timeout select count(*) from (select count(*)c from oceanbase.__all_virtual_core_meta_table)s where s.c > 0, 1, 200;
ob2.mysql set ob_global_debug_sync = 'AFTER_REMOVE_OTHER_CLUSTER wait_for remove_other_cluster';
ob2.mysql set ob_global_debug_sync = 'now signal after_set_cluster_name';
ERROR HY000: Timeout
ob2.z3.force_stop;
ob2.z1.obs0.check_until_timeout select count(*) from oceanbase.__all_server where status = 'inactive', 1, 360;
ob2.z3.nstart;
ob2.check_until_timeout select count(*) from oceanbase.__all_server where status = 'active' and start_service_time > 0,3, 200;
ob2.check_until_timeout select count(*) from (select count(*)c from oceanbase.__all_virtual_core_meta_table)s where s.c > 0, 1, 200;
ob2.mysql set ob_global_debug_sync = 'AFTER_SET_ALL_CLUSTER_CLUSTER_NAME wait_for set_all_cluster';
ob2.mysql set ob_global_debug_sync = 'now signal remove_other_cluster';
ERROR HY000: Timeout
ob2.z1.force_stop;
ob2.z2.obs0.check_until_timeout select count(*) from oceanbase.__all_server where status = 'inactive', 1, 360;
ob2.z1.nstart;
ob2.check_until_timeout select count(*) from oceanbase.__all_server where status = 'active' and start_service_time > 0,3, 200;
ob2.check_until_timeout select count(*) from (select count(*)c from oceanbase.__all_virtual_core_meta_table)s where s.c > 0, 1, 200;
ob2.mysql set ob_global_debug_sync = 'AFTER_SET_ALL_ZONE_CLUSTER_NAME wait_for set_all_zone';
ob2.mysql set ob_global_debug_sync = 'now signal set_all_cluster';
ERROR HY000: Timeout
ob2.mysql_p select column_name, column_value from oceanbase.__all_core_table where table_name ='__all_cluster' and column_name = 'switchover_status';
column_name	column_value
switchover_status	10
ob2.mysql_p select switchover_status, switchover_info from oceanbase.__all_virtual_cluster;
switchover_status	switchover_info
DISCONNECT	
ob2.z2.force_stop;
ob2.z3.obs0.check_until_timeout select count(*) from oceanbase.__all_server where status = 'inactive', 1, 360;
ob2.z2.nstart;
ob2.check_until_timeout select count(*) from oceanbase.__all_server where status = 'active' and start_service_time > 0,3, 200;
ob2.check_until_timeout select count(*) from (select count(*)c from oceanbase.__all_virtual_core_meta_table)s where s.c > 0, 1, 200;
ob2.mysql set ob_global_debug_sync = 'SENDING_OBS_DISCONNECT_CLUSTER wait_for sending_obs_disconnect';
ob2.mysql set ob_global_debug_sync = 'now signal set_all_zone';
ERROR HY000: Timeout
ob2.z3.force_stop;
ob2.z1.obs0.check_until_timeout select count(*) from oceanbase.__all_server where status = 'inactive', 1, 360;
ob2.z3.nstart;
ob2.check_until_timeout select count(*) from oceanbase.__all_server where status = 'active' and start_service_time > 0,3, 200;
ob2.check_until_timeout select count(*) from (select count(*)c from oceanbase.__all_virtual_core_meta_table)s where s.c > 0, 1, 200;
ob2.mysql set ob_global_debug_sync = 'AFTER_OBS_DISCONNECT_CLUSTER wait_for after_obs_disconnect';
ob2.mysql set ob_global_debug_sync = 'now signal sending_obs_disconnect';
ERROR HY000: Timeout
ob2.z1.force_stop;
ob2.z2.obs0.check_until_timeout select count(*) from oceanbase.__all_server where status = 'inactive', 1, 360;
ob2.z1.nstart;
ob2.check_until_timeout select count(*) from oceanbase.__all_server where status = 'active' and start_service_time > 0,3, 200;
ob2.check_until_timeout select count(*) from (select count(*)c from oceanbase.__all_virtual_core_meta_table)s where s.c > 0, 1, 200;
ob2.mysql set ob_global_debug_sync = 'now signal after_obs_disconnect';
ob2.check_until_timeout select count(*) from oceanbase.__all_virtual_processlist, 2, 20;
ob1.nstart;
ob1.check_until_timeout select count(*) from (select count(*)c from oceanbase.__all_virtual_core_meta_table)s where s.c > 0, 1, 200;
ob1.mysql alter system set standby cluster to maximize performance;
ob1.mysql alter system remove cluster '$cluster_name' cluster_id = $cluster_id_ob2;
ob2.mysql_p select value from oceanbase.__all_sys_parameter where name = "cluster";
value
newcluster_name
ob2.mysql_p select value from oceanbase.__all_sys_parameter where name = "obconfig_url";
value
asdf
ob2.check_until_timeout select count(*) from oceanbase.__all_cluster where rs_list like "%\"ObRegion\":\"newcluster_name\"%" and cluster_id = $cluster_id_ob2, 1, 100;
ob2.check_until_timeout select count(*) from oceanbase.__all_cluster where rs_list like "%\"ObCluster\":\"newcluster_name\"%" and cluster_id = $cluster_id_ob2, 1, 200;
ob2.mysql_p select cluster_idx, cluster_name, cluster_status, redo_transport_options, protection_level from oceanbase.__all_cluster;
cluster_idx	cluster_name	cluster_status	redo_transport_options	protection_level
1	newcluster_name	1	SYNC NET_TIMEOUT = 30000000	MAXIMUM PROTECTION
ob2.mysql_p select column_name, column_value from oceanbase.__all_core_table where table_name ='__all_cluster' and column_name = 'cluster_status';
column_name	column_value
cluster_status	1
ob2.mysql_p select column_name, column_value from oceanbase.__all_core_table where table_name ='__all_cluster' and column_name = 'cluster_type';
column_name	column_value
cluster_type	2
ob2.mysql_p select column_name, column_value from oceanbase.__all_core_table where table_name ='__all_cluster' and column_name = 'switchover_status';
column_name	column_value
switchover_status	1
ob2.mysql_p select zone, name, value, info from oceanbase.__all_zone where name = 'cluster';
zone	name	value	info
	cluster	0	newcluster_name
ob2.mysql_p select switchover_status, switchover_info from oceanbase.__all_virtual_cluster;
switchover_status	switchover_info
NOT ALLOWED	
ob2.force_stop;
ob2.nstart;
ob2.check_until_timeout select count(*) from oceanbase.__all_server where with_rootserver=1 and zone='z1', 1, 200;
ob2.check_until_timeout select count(*) from oceanbase.__all_server where status = 'active' and start_service_time > 0,3, 300;
ob2.check_until_timeout select count(*) from (select count(*)c from oceanbase.__all_virtual_core_meta_table)s where s.c > 0, 1, 200;
ob2.mysql_p select value from oceanbase.__all_sys_parameter where name = "cluster";
value
newcluster_name
ob2.mysql_p select value from oceanbase.__all_sys_parameter where name = "obconfig_url";
value
asdf
ob2.check_until_timeout select count(*) from oceanbase.__all_cluster where rs_list like "%\"ObRegion\":\"newcluster_name\"%" and cluster_id = $cluster_id_ob2, 1, 100;
ob2.check_until_timeout select count(*) from oceanbase.__all_cluster where rs_list like "%\"ObCluster\":\"newcluster_name\"%" and cluster_id = $cluster_id_ob2, 1, 200;
ob2.mysql_p select cluster_idx, cluster_name, cluster_status, redo_transport_options, protection_level from oceanbase.__all_cluster;
cluster_idx	cluster_name	cluster_status	redo_transport_options	protection_level
1	newcluster_name	1	SYNC NET_TIMEOUT = 30000000	MAXIMUM PROTECTION
ob2.mysql_p select column_name, column_value from oceanbase.__all_core_table where table_name ='__all_cluster' and column_name = 'cluster_status';
column_name	column_value
cluster_status	1
ob2.mysql_p select column_name, column_value from oceanbase.__all_core_table where table_name ='__all_cluster' and column_name = 'cluster_type';
column_name	column_value
cluster_type	2
ob2.mysql_p select column_name, column_value from oceanbase.__all_core_table where table_name ='__all_cluster' and column_name = 'switchover_status';
column_name	column_value
switchover_status	1
ob2.mysql_p select zone, name, value, info from oceanbase.__all_zone where name = 'cluster';
zone	name	value	info
	cluster	0	newcluster_name
ob2.mysql_p select switchover_status, switchover_info from oceanbase.__all_virtual_cluster;
switchover_status	switchover_info
NOT ALLOWED	
set ob_query_timeout = 100000000;
alter system set _mini_merge_concurrency = 16;
alter system set _ob_minor_merge_schedule_interval = '3s';
alter system ACTIVATE PHYSICAL STANDBY CLUSTER;
alter system set _mini_merge_concurrency = 3;
alter system set _ob_minor_merge_schedule_interval = '20s';
ob2.check_until_timeout select count(*) from oceanbase.__all_cluster where rs_list like "%\"ObRegion\":\"newcluster_name\"%" and cluster_id = $cluster_id_ob2, 1, 200;
ob2.check_until_timeout select count(*) from oceanbase.__all_cluster where rs_list like "%\"ObCluster\":\"newcluster_name\"%" and cluster_id = $cluster_id_ob2, 1, 200;
update t set c2 = 'ob1' where c1 = 1;
commit;
update t set c2 = 'ob2' where c1 = 1;
commit;
select * from t;
c1	c2	c3
1	ob1	1
select * from t;
c1	c2	c3
1	ob2	1
ob4=OBI(cluster=1:1:1,leaderob=ob2,proxy_num=0);
ob4.set cname=newcluster_name;
ob4.set cid=4;
ob4.reboot;
alter system set balancer_idle_time = '10s';
alter system set server_data_copy_out_concurrency = 30;
alter system set server_data_copy_in_concurrency = 30;
alter system set data_copy_concurrency = 60;
ob2.check_until_timeout select switchover_status from oceanbase.__all_virtual_cluster, TO STANDBY, 200;
select /*+ read_consistency(weak)*/ * from t;
c1	c2	c3
1	ob2	1
ob5=OBI(cluster=1,leaderob=ob2,proxy_num=0);
ob5.set cname=newcluster_name;
ob5.set cid=5;
ob5.reboot;
alter system set balancer_idle_time = '10s';
alter system set server_data_copy_out_concurrency = 30;
alter system set server_data_copy_in_concurrency = 30;
alter system set data_copy_concurrency = 60;
ob2.check_until_timeout select switchover_status from oceanbase.__all_virtual_cluster, TO STANDBY, 200;
ob2.check_until_timeout select synchronization_status from oceanbase.__all_virtual_standby_status where cluster_id=5, OK, 200;
select /*+ read_consistency(weak)*/ * from t;
c1	c2	c3
1	ob2	1
ob6=OBI(cluster=1,leaderob=ob2,proxy_num=0);
ob6.set cname=newcluster_name;
ob6.set cid=6;
ob6.reboot;
alter system set balancer_idle_time = '10s';
alter system set server_data_copy_out_concurrency = 30;
alter system set server_data_copy_in_concurrency = 30;
alter system set data_copy_concurrency = 60;
ob2.check_until_timeout select switchover_status from oceanbase.__all_virtual_cluster, TO STANDBY, 200;
ob2.check_until_timeout select synchronization_status from oceanbase.__all_virtual_standby_status where cluster_id=6, OK, 200;
select /*+ read_consistency(weak)*/ * from t;
c1	c2	c3
1	ob2	1
set global  ob_query_timeout=30000000;
ob1.mysql alter system remove cluster '$cluster_name' cluster_id = $cluster_id_ob3;
ob3.mysql_p select value from oceanbase.__all_sys_parameter where name = "cluster";
value
newcluster_name_ob3
ob3.mysql_p select value from oceanbase.__all_sys_parameter where name = "obconfig_url";
value
asdf
ob3.check_until_timeout select count(*) from oceanbase.__all_cluster where rs_list like "%\"ObRegion\":\"newcluster_name_ob3\"%" and cluster_id = $cluster_id_ob3, 1, 200;
ob3.check_until_timeout select count(*) from oceanbase.__all_cluster where rs_list like "%\"ObCluster\":\"newcluster_name_ob3\"%" and cluster_id = $cluster_id_ob3, 1, 200;
ob3.mysql_p select cluster_idx, cluster_name, cluster_status, redo_transport_options, protection_level from oceanbase.__all_cluster;
cluster_idx	cluster_name	cluster_status	redo_transport_options	protection_level
2	newcluster_name_ob3	1	ASYNC NET_TIMEOUT = 30000000	MAXIMUM PERFORMANCE
ob3.mysql_p select column_name, column_value from oceanbase.__all_core_table where table_name ='__all_cluster' and column_name = 'cluster_status';
column_name	column_value
cluster_status	1
ob3.mysql_p select column_name, column_value from oceanbase.__all_core_table where table_name ='__all_cluster' and column_name = 'cluster_type';
column_name	column_value
cluster_type	2
ob3.mysql_p select column_name, column_value from oceanbase.__all_core_table where table_name ='__all_cluster' and column_name = 'switchover_status';
column_name	column_value
switchover_status	1
ob3.mysql_p select zone, name, value, info from oceanbase.__all_zone where name = 'cluster';
zone	name	value	info
	cluster	0	newcluster_name_ob3
set ob_query_timeout = 100000000;
alter system set _mini_merge_concurrency = 16;
alter system set _ob_minor_merge_schedule_interval = '3s';
alter system ACTIVATE PHYSICAL STANDBY CLUSTER;
alter system set _mini_merge_concurrency = 3;
alter system set _ob_minor_merge_schedule_interval = '20s';
ob3.check_until_timeout select count(*) from oceanbase.__all_cluster where rs_list like "%\"ObRegion\":\"newcluster_name_ob3\"%" and cluster_id = $cluster_id_ob3, 1, 200;
ob3.check_until_timeout select count(*) from oceanbase.__all_cluster where rs_list like "%\"ObCluster\":\"newcluster_name_ob3\"%" and cluster_id = $cluster_id_ob3, 1, 200;
update t set c2 = 'ob1_2' where c1 = 1;
commit;
update t set c2 = 'ob3_2' where c1 = 1;
commit;
select * from t;
c1	c2	c3
1	ob1_2	1
select * from t;
c1	c2	c3
1	ob3_2	1
select * from t;
c1	c2	c3
1	ob2	1
ob3.check_until_timeout  select value from oceanbase.__all_zone where name='last_merged_version' and zone = '', 2, 600;
