drop database IF EXISTS oblrp;
create database oblrp;
use oblrp;
set timestamp = 1600000000;
set ob_trx_timeout = 10000000000;
set ob_query_timeout = 10000000000;
ob_pl_subquery_2_3 存储过程表达式支持子查询
drop table t1;
create table t1( id int,name varchar(30),t date);
insert into t1 values(1,'test01','2020-10-10');
insert into t1 values(10,'test02','2020-10-11');
insert into t1 values(20,'test03','2020-10-12');
drop table t2;
create table t2( id int,name varchar(30));
insert into t2 values(1,'test01');
insert into t2 values(10,'test02');
insert into t2 values(20,'test03');
insert into t2 values(1,'test04');
insert into t2 values(20,'test03');
drop table t3;
create table t3( id int,name varchar(30));
insert into t3 values(1,'test01');
drop table t4;
create table t4( id int);
insert into t4 values(2);
ob_pl_subquery_2_3_1 参数输入in
DROP PROCEDURE p_test01;
CREATE  PROCEDURE p_test01(in a int)
begin
declare i int;
declare b int;
declare c int;
set c=a;
set i=1;
set @d=a;
select a into b;
while i <= a DO
insert into t1(id) values(a),(b),(c),(@d);
set i = i + 1;
end WHILE;
end;
//
CALL p_test01((select 10));
select * from t1 order by id;
id	name	t
1	test01	2020-10-10
10	NULL	NULL
10	NULL	NULL
10	NULL	NULL
10	NULL	NULL
10	NULL	NULL
10	NULL	NULL
10	NULL	NULL
10	NULL	NULL
10	NULL	NULL
10	NULL	NULL
10	NULL	NULL
10	NULL	NULL
10	NULL	NULL
10	NULL	NULL
10	NULL	NULL
10	NULL	NULL
10	NULL	NULL
10	NULL	NULL
10	NULL	NULL
10	NULL	NULL
10	NULL	NULL
10	test02	2020-10-11
10	NULL	NULL
10	NULL	NULL
10	NULL	NULL
10	NULL	NULL
10	NULL	NULL
10	NULL	NULL
10	NULL	NULL
10	NULL	NULL
10	NULL	NULL
10	NULL	NULL
10	NULL	NULL
10	NULL	NULL
10	NULL	NULL
10	NULL	NULL
10	NULL	NULL
10	NULL	NULL
10	NULL	NULL
10	NULL	NULL
10	NULL	NULL
20	test03	2020-10-12
CALL p_test01((select id from t3 where id in(select id from t2 where id=1)));
select * from t1 order by id;
id	name	t
1	NULL	NULL
1	NULL	NULL
1	NULL	NULL
1	NULL	NULL
1	test01	2020-10-10
10	NULL	NULL
10	NULL	NULL
10	NULL	NULL
10	NULL	NULL
10	NULL	NULL
10	NULL	NULL
10	NULL	NULL
10	NULL	NULL
10	NULL	NULL
10	NULL	NULL
10	NULL	NULL
10	NULL	NULL
10	NULL	NULL
10	NULL	NULL
10	NULL	NULL
10	NULL	NULL
10	NULL	NULL
10	NULL	NULL
10	NULL	NULL
10	NULL	NULL
10	NULL	NULL
10	NULL	NULL
10	NULL	NULL
10	NULL	NULL
10	NULL	NULL
10	NULL	NULL
10	NULL	NULL
10	NULL	NULL
10	NULL	NULL
10	NULL	NULL
10	NULL	NULL
10	NULL	NULL
10	NULL	NULL
10	NULL	NULL
10	NULL	NULL
10	NULL	NULL
10	NULL	NULL
10	NULL	NULL
10	NULL	NULL
10	NULL	NULL
10	test02	2020-10-11
20	test03	2020-10-12
CALL p_test01((select id from t1 where exists(select id from t2 where name='test01')));
ERROR 21000: Subquery returns more than 1 row
CALL p_test01((select id from t2 where id=10));
CALL p_test01((select id from t3));
CALL p_test01((select id from t3 order by id));
select * from t1 order by id;
id	name	t
1	NULL	NULL
1	NULL	NULL
1	NULL	NULL
1	NULL	NULL
1	NULL	NULL
1	NULL	NULL
1	NULL	NULL
1	NULL	NULL
1	test01	2020-10-10
1	NULL	NULL
1	NULL	NULL
1	NULL	NULL
1	NULL	NULL
10	NULL	NULL
10	NULL	NULL
10	NULL	NULL
10	NULL	NULL
10	NULL	NULL
10	NULL	NULL
10	NULL	NULL
10	NULL	NULL
10	NULL	NULL
10	NULL	NULL
10	NULL	NULL
10	NULL	NULL
10	NULL	NULL
10	NULL	NULL
10	NULL	NULL
10	NULL	NULL
10	NULL	NULL
10	NULL	NULL
10	NULL	NULL
10	NULL	NULL
10	NULL	NULL
10	NULL	NULL
10	NULL	NULL
10	NULL	NULL
10	NULL	NULL
10	NULL	NULL
10	NULL	NULL
10	NULL	NULL
10	NULL	NULL
10	NULL	NULL
10	NULL	NULL
10	NULL	NULL
10	NULL	NULL
10	NULL	NULL
10	NULL	NULL
10	NULL	NULL
10	NULL	NULL
10	NULL	NULL
10	NULL	NULL
10	NULL	NULL
10	NULL	NULL
10	NULL	NULL
10	NULL	NULL
10	NULL	NULL
10	NULL	NULL
10	NULL	NULL
10	NULL	NULL
10	NULL	NULL
10	NULL	NULL
10	NULL	NULL
10	NULL	NULL
10	NULL	NULL
10	NULL	NULL
10	NULL	NULL
10	NULL	NULL
10	NULL	NULL
10	NULL	NULL
10	NULL	NULL
10	NULL	NULL
10	NULL	NULL
10	NULL	NULL
10	NULL	NULL
10	NULL	NULL
10	NULL	NULL
10	NULL	NULL
10	NULL	NULL
10	NULL	NULL
10	NULL	NULL
10	NULL	NULL
10	NULL	NULL
10	NULL	NULL
10	NULL	NULL
10	NULL	NULL
10	NULL	NULL
10	NULL	NULL
10	NULL	NULL
10	NULL	NULL
10	NULL	NULL
10	NULL	NULL
10	NULL	NULL
10	test02	2020-10-11
20	test03	2020-10-12
CALL p_test01((select count(*) from t2 ));
select * from t1 order by id;
id	name	t
1	NULL	NULL
1	NULL	NULL
1	NULL	NULL
1	NULL	NULL
1	NULL	NULL
1	NULL	NULL
1	NULL	NULL
1	NULL	NULL
1	NULL	NULL
1	test01	2020-10-10
1	NULL	NULL
1	NULL	NULL
1	NULL	NULL
5	NULL	NULL
5	NULL	NULL
5	NULL	NULL
5	NULL	NULL
5	NULL	NULL
5	NULL	NULL
5	NULL	NULL
5	NULL	NULL
5	NULL	NULL
5	NULL	NULL
5	NULL	NULL
5	NULL	NULL
5	NULL	NULL
5	NULL	NULL
5	NULL	NULL
5	NULL	NULL
5	NULL	NULL
5	NULL	NULL
5	NULL	NULL
5	NULL	NULL
10	NULL	NULL
10	NULL	NULL
10	NULL	NULL
10	NULL	NULL
10	NULL	NULL
10	NULL	NULL
10	NULL	NULL
10	NULL	NULL
10	NULL	NULL
10	NULL	NULL
10	NULL	NULL
10	NULL	NULL
10	NULL	NULL
10	NULL	NULL
10	NULL	NULL
10	NULL	NULL
10	NULL	NULL
10	NULL	NULL
10	NULL	NULL
10	NULL	NULL
10	NULL	NULL
10	NULL	NULL
10	NULL	NULL
10	NULL	NULL
10	NULL	NULL
10	NULL	NULL
10	NULL	NULL
10	NULL	NULL
10	NULL	NULL
10	NULL	NULL
10	NULL	NULL
10	NULL	NULL
10	NULL	NULL
10	NULL	NULL
10	NULL	NULL
10	NULL	NULL
10	NULL	NULL
10	NULL	NULL
10	NULL	NULL
10	NULL	NULL
10	NULL	NULL
10	NULL	NULL
10	NULL	NULL
10	NULL	NULL
10	NULL	NULL
10	NULL	NULL
10	NULL	NULL
10	NULL	NULL
10	NULL	NULL
10	NULL	NULL
10	NULL	NULL
10	NULL	NULL
10	NULL	NULL
10	NULL	NULL
10	NULL	NULL
10	NULL	NULL
10	NULL	NULL
10	NULL	NULL
10	NULL	NULL
10	NULL	NULL
10	NULL	NULL
10	NULL	NULL
10	NULL	NULL
10	NULL	NULL
10	NULL	NULL
10	NULL	NULL
10	NULL	NULL
10	NULL	NULL
10	NULL	NULL
10	NULL	NULL
10	NULL	NULL
10	NULL	NULL
10	NULL	NULL
10	NULL	NULL
10	NULL	NULL
10	NULL	NULL
10	NULL	NULL
10	NULL	NULL
10	NULL	NULL
10	NULL	NULL
10	test02	2020-10-11
20	test03	2020-10-12
CALL p_test01((select sum(id) from t2 ));
select * from t1 order by id;
id	name	t
1	test01	2020-10-10
1	NULL	NULL
1	NULL	NULL
1	NULL	NULL
1	NULL	NULL
1	NULL	NULL
1	NULL	NULL
1	NULL	NULL
1	NULL	NULL
1	NULL	NULL
1	NULL	NULL
1	NULL	NULL
1	NULL	NULL
5	NULL	NULL
5	NULL	NULL
5	NULL	NULL
5	NULL	NULL
5	NULL	NULL
5	NULL	NULL
5	NULL	NULL
5	NULL	NULL
5	NULL	NULL
5	NULL	NULL
5	NULL	NULL
5	NULL	NULL
5	NULL	NULL
5	NULL	NULL
5	NULL	NULL
5	NULL	NULL
5	NULL	NULL
5	NULL	NULL
5	NULL	NULL
5	NULL	NULL
10	NULL	NULL
10	NULL	NULL
10	NULL	NULL
10	NULL	NULL
10	NULL	NULL
10	NULL	NULL
10	NULL	NULL
10	NULL	NULL
10	NULL	NULL
10	test02	2020-10-11
10	NULL	NULL
10	NULL	NULL
10	NULL	NULL
10	NULL	NULL
10	NULL	NULL
10	NULL	NULL
10	NULL	NULL
10	NULL	NULL
10	NULL	NULL
10	NULL	NULL
10	NULL	NULL
10	NULL	NULL
10	NULL	NULL
10	NULL	NULL
10	NULL	NULL
10	NULL	NULL
10	NULL	NULL
10	NULL	NULL
10	NULL	NULL
10	NULL	NULL
10	NULL	NULL
10	NULL	NULL
10	NULL	NULL
10	NULL	NULL
10	NULL	NULL
10	NULL	NULL
10	NULL	NULL
10	NULL	NULL
10	NULL	NULL
10	NULL	NULL
10	NULL	NULL
10	NULL	NULL
10	NULL	NULL
10	NULL	NULL
10	NULL	NULL
10	NULL	NULL
10	NULL	NULL
10	NULL	NULL
10	NULL	NULL
10	NULL	NULL
10	NULL	NULL
10	NULL	NULL
10	NULL	NULL
10	NULL	NULL
10	NULL	NULL
10	NULL	NULL
10	NULL	NULL
10	NULL	NULL
10	NULL	NULL
10	NULL	NULL
10	NULL	NULL
10	NULL	NULL
10	NULL	NULL
10	NULL	NULL
10	NULL	NULL
10	NULL	NULL
10	NULL	NULL
10	NULL	NULL
10	NULL	NULL
10	NULL	NULL
10	NULL	NULL
10	NULL	NULL
10	NULL	NULL
10	NULL	NULL
10	NULL	NULL
10	NULL	NULL
10	NULL	NULL
10	NULL	NULL
10	NULL	NULL
10	NULL	NULL
10	NULL	NULL
20	test03	2020-10-12
52	NULL	NULL
52	NULL	NULL
52	NULL	NULL
52	NULL	NULL
52	NULL	NULL
52	NULL	NULL
52	NULL	NULL
52	NULL	NULL
52	NULL	NULL
52	NULL	NULL
52	NULL	NULL
52	NULL	NULL
52	NULL	NULL
52	NULL	NULL
52	NULL	NULL
52	NULL	NULL
52	NULL	NULL
52	NULL	NULL
52	NULL	NULL
52	NULL	NULL
52	NULL	NULL
52	NULL	NULL
52	NULL	NULL
52	NULL	NULL
52	NULL	NULL
52	NULL	NULL
52	NULL	NULL
52	NULL	NULL
52	NULL	NULL
52	NULL	NULL
52	NULL	NULL
52	NULL	NULL
52	NULL	NULL
52	NULL	NULL
52	NULL	NULL
52	NULL	NULL
52	NULL	NULL
52	NULL	NULL
52	NULL	NULL
52	NULL	NULL
52	NULL	NULL
52	NULL	NULL
52	NULL	NULL
52	NULL	NULL
52	NULL	NULL
52	NULL	NULL
52	NULL	NULL
52	NULL	NULL
52	NULL	NULL
52	NULL	NULL
52	NULL	NULL
52	NULL	NULL
52	NULL	NULL
52	NULL	NULL
52	NULL	NULL
52	NULL	NULL
52	NULL	NULL
52	NULL	NULL
52	NULL	NULL
52	NULL	NULL
52	NULL	NULL
52	NULL	NULL
52	NULL	NULL
52	NULL	NULL
52	NULL	NULL
52	NULL	NULL
52	NULL	NULL
52	NULL	NULL
52	NULL	NULL
52	NULL	NULL
52	NULL	NULL
52	NULL	NULL
52	NULL	NULL
52	NULL	NULL
52	NULL	NULL
52	NULL	NULL
52	NULL	NULL
52	NULL	NULL
52	NULL	NULL
52	NULL	NULL
52	NULL	NULL
52	NULL	NULL
52	NULL	NULL
52	NULL	NULL
52	NULL	NULL
52	NULL	NULL
52	NULL	NULL
52	NULL	NULL
52	NULL	NULL
52	NULL	NULL
52	NULL	NULL
52	NULL	NULL
52	NULL	NULL
52	NULL	NULL
52	NULL	NULL
52	NULL	NULL
52	NULL	NULL
52	NULL	NULL
52	NULL	NULL
52	NULL	NULL
52	NULL	NULL
52	NULL	NULL
52	NULL	NULL
52	NULL	NULL
52	NULL	NULL
52	NULL	NULL
52	NULL	NULL
52	NULL	NULL
52	NULL	NULL
52	NULL	NULL
52	NULL	NULL
52	NULL	NULL
52	NULL	NULL
52	NULL	NULL
52	NULL	NULL
52	NULL	NULL
52	NULL	NULL
52	NULL	NULL
52	NULL	NULL
52	NULL	NULL
52	NULL	NULL
52	NULL	NULL
52	NULL	NULL
52	NULL	NULL
52	NULL	NULL
52	NULL	NULL
52	NULL	NULL
52	NULL	NULL
52	NULL	NULL
52	NULL	NULL
52	NULL	NULL
52	NULL	NULL
52	NULL	NULL
52	NULL	NULL
52	NULL	NULL
52	NULL	NULL
52	NULL	NULL
52	NULL	NULL
52	NULL	NULL
52	NULL	NULL
52	NULL	NULL
52	NULL	NULL
52	NULL	NULL
52	NULL	NULL
52	NULL	NULL
52	NULL	NULL
52	NULL	NULL
52	NULL	NULL
52	NULL	NULL
52	NULL	NULL
52	NULL	NULL
52	NULL	NULL
52	NULL	NULL
52	NULL	NULL
52	NULL	NULL
52	NULL	NULL
52	NULL	NULL
52	NULL	NULL
52	NULL	NULL
52	NULL	NULL
52	NULL	NULL
52	NULL	NULL
52	NULL	NULL
52	NULL	NULL
52	NULL	NULL
52	NULL	NULL
52	NULL	NULL
52	NULL	NULL
52	NULL	NULL
52	NULL	NULL
52	NULL	NULL
52	NULL	NULL
52	NULL	NULL
52	NULL	NULL
52	NULL	NULL
52	NULL	NULL
52	NULL	NULL
52	NULL	NULL
52	NULL	NULL
52	NULL	NULL
52	NULL	NULL
52	NULL	NULL
52	NULL	NULL
52	NULL	NULL
52	NULL	NULL
52	NULL	NULL
52	NULL	NULL
52	NULL	NULL
52	NULL	NULL
52	NULL	NULL
52	NULL	NULL
52	NULL	NULL
52	NULL	NULL
52	NULL	NULL
52	NULL	NULL
52	NULL	NULL
52	NULL	NULL
52	NULL	NULL
52	NULL	NULL
52	NULL	NULL
52	NULL	NULL
52	NULL	NULL
52	NULL	NULL
52	NULL	NULL
52	NULL	NULL
52	NULL	NULL
52	NULL	NULL
52	NULL	NULL
CALL p_test01((select avg(id) from t2 ));
CALL p_test01((select avg(id) from t2 group by id having avg(id)<1));
CALL p_test01((select avg(id) from t3 where id like '%1'));
select * from t1 order by id;
id	name	t
1	NULL	NULL
1	NULL	NULL
1	NULL	NULL
1	NULL	NULL
1	test01	2020-10-10
1	NULL	NULL
1	NULL	NULL
1	NULL	NULL
1	NULL	NULL
1	NULL	NULL
1	NULL	NULL
1	NULL	NULL
1	NULL	NULL
1	NULL	NULL
1	NULL	NULL
1	NULL	NULL
1	NULL	NULL
5	NULL	NULL
5	NULL	NULL
5	NULL	NULL
5	NULL	NULL
5	NULL	NULL
5	NULL	NULL
5	NULL	NULL
5	NULL	NULL
5	NULL	NULL
5	NULL	NULL
5	NULL	NULL
5	NULL	NULL
5	NULL	NULL
5	NULL	NULL
5	NULL	NULL
5	NULL	NULL
5	NULL	NULL
5	NULL	NULL
5	NULL	NULL
5	NULL	NULL
10	NULL	NULL
10	NULL	NULL
10	NULL	NULL
10	NULL	NULL
10	NULL	NULL
10	NULL	NULL
10	NULL	NULL
10	NULL	NULL
10	NULL	NULL
10	NULL	NULL
10	NULL	NULL
10	NULL	NULL
10	NULL	NULL
10	NULL	NULL
10	NULL	NULL
10	NULL	NULL
10	NULL	NULL
10	NULL	NULL
10	NULL	NULL
10	NULL	NULL
10	NULL	NULL
10	NULL	NULL
10	NULL	NULL
10	NULL	NULL
10	NULL	NULL
10	NULL	NULL
10	NULL	NULL
10	NULL	NULL
10	NULL	NULL
10	NULL	NULL
10	NULL	NULL
10	NULL	NULL
10	NULL	NULL
10	NULL	NULL
10	NULL	NULL
10	NULL	NULL
10	NULL	NULL
10	NULL	NULL
10	NULL	NULL
10	NULL	NULL
10	NULL	NULL
10	NULL	NULL
10	NULL	NULL
10	NULL	NULL
10	NULL	NULL
10	NULL	NULL
10	NULL	NULL
10	NULL	NULL
10	NULL	NULL
10	NULL	NULL
10	NULL	NULL
10	NULL	NULL
10	NULL	NULL
10	NULL	NULL
10	NULL	NULL
10	NULL	NULL
10	NULL	NULL
10	NULL	NULL
10	NULL	NULL
10	NULL	NULL
10	NULL	NULL
10	NULL	NULL
10	NULL	NULL
10	NULL	NULL
10	NULL	NULL
10	NULL	NULL
10	NULL	NULL
10	NULL	NULL
10	NULL	NULL
10	NULL	NULL
10	NULL	NULL
10	NULL	NULL
10	NULL	NULL
10	NULL	NULL
10	NULL	NULL
10	NULL	NULL
10	NULL	NULL
10	NULL	NULL
10	NULL	NULL
10	NULL	NULL
10	NULL	NULL
10	NULL	NULL
10	NULL	NULL
10	NULL	NULL
10	NULL	NULL
10	NULL	NULL
10	NULL	NULL
10	NULL	NULL
10	NULL	NULL
10	NULL	NULL
10	NULL	NULL
10	NULL	NULL
10	NULL	NULL
10	NULL	NULL
10	NULL	NULL
10	NULL	NULL
10	NULL	NULL
10	NULL	NULL
10	NULL	NULL
10	NULL	NULL
10	NULL	NULL
10	NULL	NULL
10	NULL	NULL
10	NULL	NULL
10	NULL	NULL
10	NULL	NULL
10	NULL	NULL
10	NULL	NULL
10	NULL	NULL
10	NULL	NULL
10	NULL	NULL
10	NULL	NULL
10	NULL	NULL
10	NULL	NULL
10	NULL	NULL
10	NULL	NULL
10	NULL	NULL
10	NULL	NULL
10	NULL	NULL
10	NULL	NULL
10	test02	2020-10-11
20	test03	2020-10-12
52	NULL	NULL
52	NULL	NULL
52	NULL	NULL
52	NULL	NULL
52	NULL	NULL
52	NULL	NULL
52	NULL	NULL
52	NULL	NULL
52	NULL	NULL
52	NULL	NULL
52	NULL	NULL
52	NULL	NULL
52	NULL	NULL
52	NULL	NULL
52	NULL	NULL
52	NULL	NULL
52	NULL	NULL
52	NULL	NULL
52	NULL	NULL
52	NULL	NULL
52	NULL	NULL
52	NULL	NULL
52	NULL	NULL
52	NULL	NULL
52	NULL	NULL
52	NULL	NULL
52	NULL	NULL
52	NULL	NULL
52	NULL	NULL
52	NULL	NULL
52	NULL	NULL
52	NULL	NULL
52	NULL	NULL
52	NULL	NULL
52	NULL	NULL
52	NULL	NULL
52	NULL	NULL
52	NULL	NULL
52	NULL	NULL
52	NULL	NULL
52	NULL	NULL
52	NULL	NULL
52	NULL	NULL
52	NULL	NULL
52	NULL	NULL
52	NULL	NULL
52	NULL	NULL
52	NULL	NULL
52	NULL	NULL
52	NULL	NULL
52	NULL	NULL
52	NULL	NULL
52	NULL	NULL
52	NULL	NULL
52	NULL	NULL
52	NULL	NULL
52	NULL	NULL
52	NULL	NULL
52	NULL	NULL
52	NULL	NULL
52	NULL	NULL
52	NULL	NULL
52	NULL	NULL
52	NULL	NULL
52	NULL	NULL
52	NULL	NULL
52	NULL	NULL
52	NULL	NULL
52	NULL	NULL
52	NULL	NULL
52	NULL	NULL
52	NULL	NULL
52	NULL	NULL
52	NULL	NULL
52	NULL	NULL
52	NULL	NULL
52	NULL	NULL
52	NULL	NULL
52	NULL	NULL
52	NULL	NULL
52	NULL	NULL
52	NULL	NULL
52	NULL	NULL
52	NULL	NULL
52	NULL	NULL
52	NULL	NULL
52	NULL	NULL
52	NULL	NULL
52	NULL	NULL
52	NULL	NULL
52	NULL	NULL
52	NULL	NULL
52	NULL	NULL
52	NULL	NULL
52	NULL	NULL
52	NULL	NULL
52	NULL	NULL
52	NULL	NULL
52	NULL	NULL
52	NULL	NULL
52	NULL	NULL
52	NULL	NULL
52	NULL	NULL
52	NULL	NULL
52	NULL	NULL
52	NULL	NULL
52	NULL	NULL
52	NULL	NULL
52	NULL	NULL
52	NULL	NULL
52	NULL	NULL
52	NULL	NULL
52	NULL	NULL
52	NULL	NULL
52	NULL	NULL
52	NULL	NULL
52	NULL	NULL
52	NULL	NULL
52	NULL	NULL
52	NULL	NULL
52	NULL	NULL
52	NULL	NULL
52	NULL	NULL
52	NULL	NULL
52	NULL	NULL
52	NULL	NULL
52	NULL	NULL
52	NULL	NULL
52	NULL	NULL
52	NULL	NULL
52	NULL	NULL
52	NULL	NULL
52	NULL	NULL
52	NULL	NULL
52	NULL	NULL
52	NULL	NULL
52	NULL	NULL
52	NULL	NULL
52	NULL	NULL
52	NULL	NULL
52	NULL	NULL
52	NULL	NULL
52	NULL	NULL
52	NULL	NULL
52	NULL	NULL
52	NULL	NULL
52	NULL	NULL
52	NULL	NULL
52	NULL	NULL
52	NULL	NULL
52	NULL	NULL
52	NULL	NULL
52	NULL	NULL
52	NULL	NULL
52	NULL	NULL
52	NULL	NULL
52	NULL	NULL
52	NULL	NULL
52	NULL	NULL
52	NULL	NULL
52	NULL	NULL
52	NULL	NULL
52	NULL	NULL
52	NULL	NULL
52	NULL	NULL
52	NULL	NULL
52	NULL	NULL
52	NULL	NULL
52	NULL	NULL
52	NULL	NULL
52	NULL	NULL
52	NULL	NULL
52	NULL	NULL
52	NULL	NULL
52	NULL	NULL
52	NULL	NULL
52	NULL	NULL
52	NULL	NULL
52	NULL	NULL
52	NULL	NULL
52	NULL	NULL
52	NULL	NULL
52	NULL	NULL
52	NULL	NULL
52	NULL	NULL
52	NULL	NULL
52	NULL	NULL
52	NULL	NULL
52	NULL	NULL
52	NULL	NULL
52	NULL	NULL
52	NULL	NULL
52	NULL	NULL
52	NULL	NULL
52	NULL	NULL
52	NULL	NULL
52	NULL	NULL
52	NULL	NULL
52	NULL	NULL
52	NULL	NULL
52	NULL	NULL
52	NULL	NULL
52	NULL	NULL
52	NULL	NULL
52	NULL	NULL
52	NULL	NULL
52	NULL	NULL
52	NULL	NULL
CALL p_test01((select name from t3));
ERROR HY000: Incorrect integer value
CALL p_test01((select * from (select id from t3)));
CALL p_test01((select * from (select id from t3) a));
CALL p_test01((select id from t3 where id=1 and name='xiaolai'));
CALL p_test01((select id from t3 where id=1 or name='xiaolai'));
CALL p_test01((select distinct t3.id from t3 left join t2 on t3.id=t2.id));
CALL p_test01((select t3.id from t3 where id in(1,2,3 )));
CALL p_test01((select abs(t3.id) from t3 where id in(select id from t2 where t3.id=t2.id )));
CALL p_test01((select LENGTH(name) from t2 where id=10));
select * from t1 order by id;
id	name	t
1	NULL	NULL
1	NULL	NULL
1	NULL	NULL
1	NULL	NULL
1	NULL	NULL
1	NULL	NULL
1	NULL	NULL
1	NULL	NULL
1	NULL	NULL
1	NULL	NULL
1	NULL	NULL
1	NULL	NULL
1	NULL	NULL
1	NULL	NULL
1	NULL	NULL
1	NULL	NULL
1	NULL	NULL
1	NULL	NULL
1	NULL	NULL
1	NULL	NULL
1	NULL	NULL
1	NULL	NULL
1	NULL	NULL
1	NULL	NULL
1	NULL	NULL
1	NULL	NULL
1	NULL	NULL
1	NULL	NULL
1	NULL	NULL
1	NULL	NULL
1	NULL	NULL
1	NULL	NULL
1	NULL	NULL
1	test01	2020-10-10
1	NULL	NULL
1	NULL	NULL
1	NULL	NULL
1	NULL	NULL
1	NULL	NULL
1	NULL	NULL
1	NULL	NULL
5	NULL	NULL
5	NULL	NULL
5	NULL	NULL
5	NULL	NULL
5	NULL	NULL
5	NULL	NULL
5	NULL	NULL
5	NULL	NULL
5	NULL	NULL
5	NULL	NULL
5	NULL	NULL
5	NULL	NULL
5	NULL	NULL
5	NULL	NULL
5	NULL	NULL
5	NULL	NULL
5	NULL	NULL
5	NULL	NULL
5	NULL	NULL
5	NULL	NULL
6	NULL	NULL
6	NULL	NULL
6	NULL	NULL
6	NULL	NULL
6	NULL	NULL
6	NULL	NULL
6	NULL	NULL
6	NULL	NULL
6	NULL	NULL
6	NULL	NULL
6	NULL	NULL
6	NULL	NULL
6	NULL	NULL
6	NULL	NULL
6	NULL	NULL
6	NULL	NULL
6	NULL	NULL
6	NULL	NULL
6	NULL	NULL
6	NULL	NULL
6	NULL	NULL
6	NULL	NULL
6	NULL	NULL
6	NULL	NULL
10	NULL	NULL
10	NULL	NULL
10	NULL	NULL
10	NULL	NULL
10	NULL	NULL
10	NULL	NULL
10	NULL	NULL
10	NULL	NULL
10	NULL	NULL
10	NULL	NULL
10	NULL	NULL
10	NULL	NULL
10	NULL	NULL
10	NULL	NULL
10	NULL	NULL
10	NULL	NULL
10	NULL	NULL
10	NULL	NULL
10	NULL	NULL
10	NULL	NULL
10	NULL	NULL
10	NULL	NULL
10	NULL	NULL
10	NULL	NULL
10	NULL	NULL
10	NULL	NULL
10	NULL	NULL
10	NULL	NULL
10	NULL	NULL
10	NULL	NULL
10	NULL	NULL
10	NULL	NULL
10	NULL	NULL
10	NULL	NULL
10	NULL	NULL
10	NULL	NULL
10	NULL	NULL
10	NULL	NULL
10	NULL	NULL
10	NULL	NULL
10	NULL	NULL
10	NULL	NULL
10	NULL	NULL
10	NULL	NULL
10	NULL	NULL
10	NULL	NULL
10	NULL	NULL
10	NULL	NULL
10	NULL	NULL
10	NULL	NULL
10	NULL	NULL
10	NULL	NULL
10	NULL	NULL
10	NULL	NULL
10	NULL	NULL
10	NULL	NULL
10	NULL	NULL
10	NULL	NULL
10	NULL	NULL
10	NULL	NULL
10	NULL	NULL
10	NULL	NULL
10	NULL	NULL
10	NULL	NULL
10	NULL	NULL
10	NULL	NULL
10	NULL	NULL
10	NULL	NULL
10	NULL	NULL
10	NULL	NULL
10	NULL	NULL
10	NULL	NULL
10	NULL	NULL
10	NULL	NULL
10	NULL	NULL
10	NULL	NULL
10	NULL	NULL
10	NULL	NULL
10	NULL	NULL
10	NULL	NULL
10	NULL	NULL
10	NULL	NULL
10	NULL	NULL
10	NULL	NULL
10	NULL	NULL
10	NULL	NULL
10	NULL	NULL
10	NULL	NULL
10	NULL	NULL
10	NULL	NULL
10	NULL	NULL
10	NULL	NULL
10	NULL	NULL
10	NULL	NULL
10	NULL	NULL
10	NULL	NULL
10	NULL	NULL
10	NULL	NULL
10	NULL	NULL
10	NULL	NULL
10	NULL	NULL
10	NULL	NULL
10	NULL	NULL
10	NULL	NULL
10	NULL	NULL
10	NULL	NULL
10	NULL	NULL
10	NULL	NULL
10	NULL	NULL
10	NULL	NULL
10	NULL	NULL
10	NULL	NULL
10	NULL	NULL
10	NULL	NULL
10	NULL	NULL
10	NULL	NULL
10	NULL	NULL
10	NULL	NULL
10	NULL	NULL
10	NULL	NULL
10	test02	2020-10-11
20	test03	2020-10-12
52	NULL	NULL
52	NULL	NULL
52	NULL	NULL
52	NULL	NULL
52	NULL	NULL
52	NULL	NULL
52	NULL	NULL
52	NULL	NULL
52	NULL	NULL
52	NULL	NULL
52	NULL	NULL
52	NULL	NULL
52	NULL	NULL
52	NULL	NULL
52	NULL	NULL
52	NULL	NULL
52	NULL	NULL
52	NULL	NULL
52	NULL	NULL
52	NULL	NULL
52	NULL	NULL
52	NULL	NULL
52	NULL	NULL
52	NULL	NULL
52	NULL	NULL
52	NULL	NULL
52	NULL	NULL
52	NULL	NULL
52	NULL	NULL
52	NULL	NULL
52	NULL	NULL
52	NULL	NULL
52	NULL	NULL
52	NULL	NULL
52	NULL	NULL
52	NULL	NULL
52	NULL	NULL
52	NULL	NULL
52	NULL	NULL
52	NULL	NULL
52	NULL	NULL
52	NULL	NULL
52	NULL	NULL
52	NULL	NULL
52	NULL	NULL
52	NULL	NULL
52	NULL	NULL
52	NULL	NULL
52	NULL	NULL
52	NULL	NULL
52	NULL	NULL
52	NULL	NULL
52	NULL	NULL
52	NULL	NULL
52	NULL	NULL
52	NULL	NULL
52	NULL	NULL
52	NULL	NULL
52	NULL	NULL
52	NULL	NULL
52	NULL	NULL
52	NULL	NULL
52	NULL	NULL
52	NULL	NULL
52	NULL	NULL
52	NULL	NULL
52	NULL	NULL
52	NULL	NULL
52	NULL	NULL
52	NULL	NULL
52	NULL	NULL
52	NULL	NULL
52	NULL	NULL
52	NULL	NULL
52	NULL	NULL
52	NULL	NULL
52	NULL	NULL
52	NULL	NULL
52	NULL	NULL
52	NULL	NULL
52	NULL	NULL
52	NULL	NULL
52	NULL	NULL
52	NULL	NULL
52	NULL	NULL
52	NULL	NULL
52	NULL	NULL
52	NULL	NULL
52	NULL	NULL
52	NULL	NULL
52	NULL	NULL
52	NULL	NULL
52	NULL	NULL
52	NULL	NULL
52	NULL	NULL
52	NULL	NULL
52	NULL	NULL
52	NULL	NULL
52	NULL	NULL
52	NULL	NULL
52	NULL	NULL
52	NULL	NULL
52	NULL	NULL
52	NULL	NULL
52	NULL	NULL
52	NULL	NULL
52	NULL	NULL
52	NULL	NULL
52	NULL	NULL
52	NULL	NULL
52	NULL	NULL
52	NULL	NULL
52	NULL	NULL
52	NULL	NULL
52	NULL	NULL
52	NULL	NULL
52	NULL	NULL
52	NULL	NULL
52	NULL	NULL
52	NULL	NULL
52	NULL	NULL
52	NULL	NULL
52	NULL	NULL
52	NULL	NULL
52	NULL	NULL
52	NULL	NULL
52	NULL	NULL
52	NULL	NULL
52	NULL	NULL
52	NULL	NULL
52	NULL	NULL
52	NULL	NULL
52	NULL	NULL
52	NULL	NULL
52	NULL	NULL
52	NULL	NULL
52	NULL	NULL
52	NULL	NULL
52	NULL	NULL
52	NULL	NULL
52	NULL	NULL
52	NULL	NULL
52	NULL	NULL
52	NULL	NULL
52	NULL	NULL
52	NULL	NULL
52	NULL	NULL
52	NULL	NULL
52	NULL	NULL
52	NULL	NULL
52	NULL	NULL
52	NULL	NULL
52	NULL	NULL
52	NULL	NULL
52	NULL	NULL
52	NULL	NULL
52	NULL	NULL
52	NULL	NULL
52	NULL	NULL
52	NULL	NULL
52	NULL	NULL
52	NULL	NULL
52	NULL	NULL
52	NULL	NULL
52	NULL	NULL
52	NULL	NULL
52	NULL	NULL
52	NULL	NULL
52	NULL	NULL
52	NULL	NULL
52	NULL	NULL
52	NULL	NULL
52	NULL	NULL
52	NULL	NULL
52	NULL	NULL
52	NULL	NULL
52	NULL	NULL
52	NULL	NULL
52	NULL	NULL
52	NULL	NULL
52	NULL	NULL
52	NULL	NULL
52	NULL	NULL
52	NULL	NULL
52	NULL	NULL
52	NULL	NULL
52	NULL	NULL
52	NULL	NULL
52	NULL	NULL
52	NULL	NULL
52	NULL	NULL
52	NULL	NULL
52	NULL	NULL
52	NULL	NULL
52	NULL	NULL
52	NULL	NULL
52	NULL	NULL
52	NULL	NULL
52	NULL	NULL
52	NULL	NULL
52	NULL	NULL
52	NULL	NULL
52	NULL	NULL
52	NULL	NULL
52	NULL	NULL
52	NULL	NULL
52	NULL	NULL
52	NULL	NULL
CALL p_test01((select * from t3));
ERROR 21000: Operand should contain 1 column(s)
CALL p_test01 ((select (case when id =10 then 10 else 5 end ) from t2));
ERROR 21000: Subquery returns more than 1 row
CALL p_test01 ((select (case when id =10 then 10 end) from t3));
CALL p_test01 ((select (case when id =1 then 5 end) from t3));
CALL p_test01 ((with temp as (select * from t3) select id from temp));
CALL p_test01 ((select id from t2 limit 1));
CALL p_test01 ((select * from t4));
CALL p_test01 ((select max(id) from t2));
CALL p_test01 ((select min(id) from t2));
select * from t1 order by id;
id	name	t
1	NULL	NULL
1	NULL	NULL
1	NULL	NULL
1	NULL	NULL
1	NULL	NULL
1	NULL	NULL
1	NULL	NULL
1	NULL	NULL
1	NULL	NULL
1	NULL	NULL
1	NULL	NULL
1	NULL	NULL
1	NULL	NULL
1	NULL	NULL
1	NULL	NULL
1	NULL	NULL
1	NULL	NULL
1	NULL	NULL
1	NULL	NULL
1	NULL	NULL
1	NULL	NULL
1	NULL	NULL
1	NULL	NULL
1	NULL	NULL
1	NULL	NULL
1	NULL	NULL
1	NULL	NULL
1	NULL	NULL
1	NULL	NULL
1	NULL	NULL
1	NULL	NULL
1	NULL	NULL
1	NULL	NULL
1	NULL	NULL
1	NULL	NULL
1	NULL	NULL
1	NULL	NULL
1	NULL	NULL
1	NULL	NULL
1	NULL	NULL
1	test01	2020-10-10
1	NULL	NULL
1	NULL	NULL
1	NULL	NULL
1	NULL	NULL
1	NULL	NULL
1	NULL	NULL
1	NULL	NULL
1	NULL	NULL
1	NULL	NULL
1	NULL	NULL
1	NULL	NULL
1	NULL	NULL
2	NULL	NULL
2	NULL	NULL
2	NULL	NULL
2	NULL	NULL
2	NULL	NULL
2	NULL	NULL
2	NULL	NULL
2	NULL	NULL
5	NULL	NULL
5	NULL	NULL
5	NULL	NULL
5	NULL	NULL
5	NULL	NULL
5	NULL	NULL
5	NULL	NULL
5	NULL	NULL
5	NULL	NULL
5	NULL	NULL
5	NULL	NULL
5	NULL	NULL
5	NULL	NULL
5	NULL	NULL
5	NULL	NULL
5	NULL	NULL
5	NULL	NULL
5	NULL	NULL
5	NULL	NULL
5	NULL	NULL
5	NULL	NULL
5	NULL	NULL
5	NULL	NULL
5	NULL	NULL
5	NULL	NULL
5	NULL	NULL
5	NULL	NULL
5	NULL	NULL
5	NULL	NULL
5	NULL	NULL
5	NULL	NULL
5	NULL	NULL
5	NULL	NULL
5	NULL	NULL
5	NULL	NULL
5	NULL	NULL
5	NULL	NULL
5	NULL	NULL
5	NULL	NULL
5	NULL	NULL
6	NULL	NULL
6	NULL	NULL
6	NULL	NULL
6	NULL	NULL
6	NULL	NULL
6	NULL	NULL
6	NULL	NULL
6	NULL	NULL
6	NULL	NULL
6	NULL	NULL
6	NULL	NULL
6	NULL	NULL
6	NULL	NULL
6	NULL	NULL
6	NULL	NULL
6	NULL	NULL
6	NULL	NULL
6	NULL	NULL
6	NULL	NULL
6	NULL	NULL
6	NULL	NULL
6	NULL	NULL
6	NULL	NULL
6	NULL	NULL
10	NULL	NULL
10	NULL	NULL
10	NULL	NULL
10	NULL	NULL
10	NULL	NULL
10	NULL	NULL
10	NULL	NULL
10	NULL	NULL
10	NULL	NULL
10	NULL	NULL
10	NULL	NULL
10	NULL	NULL
10	NULL	NULL
10	NULL	NULL
10	NULL	NULL
10	NULL	NULL
10	NULL	NULL
10	NULL	NULL
10	NULL	NULL
10	NULL	NULL
10	NULL	NULL
10	NULL	NULL
10	NULL	NULL
10	NULL	NULL
10	NULL	NULL
10	NULL	NULL
10	NULL	NULL
10	NULL	NULL
10	NULL	NULL
10	NULL	NULL
10	NULL	NULL
10	NULL	NULL
10	NULL	NULL
10	NULL	NULL
10	NULL	NULL
10	NULL	NULL
10	NULL	NULL
10	NULL	NULL
10	NULL	NULL
10	NULL	NULL
10	NULL	NULL
10	NULL	NULL
10	NULL	NULL
10	NULL	NULL
10	NULL	NULL
10	NULL	NULL
10	NULL	NULL
10	NULL	NULL
10	NULL	NULL
10	NULL	NULL
10	NULL	NULL
10	NULL	NULL
10	NULL	NULL
10	NULL	NULL
10	NULL	NULL
10	NULL	NULL
10	NULL	NULL
10	NULL	NULL
10	NULL	NULL
10	NULL	NULL
10	NULL	NULL
10	NULL	NULL
10	NULL	NULL
10	NULL	NULL
10	NULL	NULL
10	NULL	NULL
10	NULL	NULL
10	NULL	NULL
10	NULL	NULL
10	NULL	NULL
10	NULL	NULL
10	NULL	NULL
10	NULL	NULL
10	NULL	NULL
10	NULL	NULL
10	NULL	NULL
10	NULL	NULL
10	NULL	NULL
10	NULL	NULL
10	NULL	NULL
10	NULL	NULL
10	NULL	NULL
10	NULL	NULL
10	NULL	NULL
10	NULL	NULL
10	NULL	NULL
10	NULL	NULL
10	NULL	NULL
10	NULL	NULL
10	NULL	NULL
10	NULL	NULL
10	NULL	NULL
10	NULL	NULL
10	NULL	NULL
10	NULL	NULL
10	NULL	NULL
10	NULL	NULL
10	NULL	NULL
10	NULL	NULL
10	NULL	NULL
10	NULL	NULL
10	NULL	NULL
10	NULL	NULL
10	NULL	NULL
10	NULL	NULL
10	NULL	NULL
10	NULL	NULL
10	NULL	NULL
10	NULL	NULL
10	NULL	NULL
10	NULL	NULL
10	NULL	NULL
10	NULL	NULL
10	NULL	NULL
10	NULL	NULL
10	NULL	NULL
10	NULL	NULL
10	NULL	NULL
10	NULL	NULL
10	NULL	NULL
10	test02	2020-10-11
20	NULL	NULL
20	NULL	NULL
20	NULL	NULL
20	NULL	NULL
20	NULL	NULL
20	NULL	NULL
20	NULL	NULL
20	NULL	NULL
20	NULL	NULL
20	NULL	NULL
20	NULL	NULL
20	NULL	NULL
20	NULL	NULL
20	NULL	NULL
20	NULL	NULL
20	NULL	NULL
20	NULL	NULL
20	NULL	NULL
20	NULL	NULL
20	NULL	NULL
20	NULL	NULL
20	NULL	NULL
20	NULL	NULL
20	NULL	NULL
20	NULL	NULL
20	NULL	NULL
20	NULL	NULL
20	NULL	NULL
20	NULL	NULL
20	NULL	NULL
20	NULL	NULL
20	NULL	NULL
20	NULL	NULL
20	NULL	NULL
20	NULL	NULL
20	NULL	NULL
20	NULL	NULL
20	NULL	NULL
20	NULL	NULL
20	NULL	NULL
20	NULL	NULL
20	NULL	NULL
20	NULL	NULL
20	NULL	NULL
20	NULL	NULL
20	NULL	NULL
20	NULL	NULL
20	NULL	NULL
20	NULL	NULL
20	NULL	NULL
20	NULL	NULL
20	NULL	NULL
20	NULL	NULL
20	NULL	NULL
20	NULL	NULL
20	NULL	NULL
20	NULL	NULL
20	NULL	NULL
20	NULL	NULL
20	NULL	NULL
20	NULL	NULL
20	NULL	NULL
20	NULL	NULL
20	NULL	NULL
20	NULL	NULL
20	NULL	NULL
20	NULL	NULL
20	NULL	NULL
20	NULL	NULL
20	NULL	NULL
20	NULL	NULL
20	NULL	NULL
20	NULL	NULL
20	NULL	NULL
20	NULL	NULL
20	NULL	NULL
20	NULL	NULL
20	NULL	NULL
20	NULL	NULL
20	test03	2020-10-12
20	NULL	NULL
52	NULL	NULL
52	NULL	NULL
52	NULL	NULL
52	NULL	NULL
52	NULL	NULL
52	NULL	NULL
52	NULL	NULL
52	NULL	NULL
52	NULL	NULL
52	NULL	NULL
52	NULL	NULL
52	NULL	NULL
52	NULL	NULL
52	NULL	NULL
52	NULL	NULL
52	NULL	NULL
52	NULL	NULL
52	NULL	NULL
52	NULL	NULL
52	NULL	NULL
52	NULL	NULL
52	NULL	NULL
52	NULL	NULL
52	NULL	NULL
52	NULL	NULL
52	NULL	NULL
52	NULL	NULL
52	NULL	NULL
52	NULL	NULL
52	NULL	NULL
52	NULL	NULL
52	NULL	NULL
52	NULL	NULL
52	NULL	NULL
52	NULL	NULL
52	NULL	NULL
52	NULL	NULL
52	NULL	NULL
52	NULL	NULL
52	NULL	NULL
52	NULL	NULL
52	NULL	NULL
52	NULL	NULL
52	NULL	NULL
52	NULL	NULL
52	NULL	NULL
52	NULL	NULL
52	NULL	NULL
52	NULL	NULL
52	NULL	NULL
52	NULL	NULL
52	NULL	NULL
52	NULL	NULL
52	NULL	NULL
52	NULL	NULL
52	NULL	NULL
52	NULL	NULL
52	NULL	NULL
52	NULL	NULL
52	NULL	NULL
52	NULL	NULL
52	NULL	NULL
52	NULL	NULL
52	NULL	NULL
52	NULL	NULL
52	NULL	NULL
52	NULL	NULL
52	NULL	NULL
52	NULL	NULL
52	NULL	NULL
52	NULL	NULL
52	NULL	NULL
52	NULL	NULL
52	NULL	NULL
52	NULL	NULL
52	NULL	NULL
52	NULL	NULL
52	NULL	NULL
52	NULL	NULL
52	NULL	NULL
52	NULL	NULL
52	NULL	NULL
52	NULL	NULL
52	NULL	NULL
52	NULL	NULL
52	NULL	NULL
52	NULL	NULL
52	NULL	NULL
52	NULL	NULL
52	NULL	NULL
52	NULL	NULL
52	NULL	NULL
52	NULL	NULL
52	NULL	NULL
52	NULL	NULL
52	NULL	NULL
52	NULL	NULL
52	NULL	NULL
52	NULL	NULL
52	NULL	NULL
52	NULL	NULL
52	NULL	NULL
52	NULL	NULL
52	NULL	NULL
52	NULL	NULL
52	NULL	NULL
52	NULL	NULL
52	NULL	NULL
52	NULL	NULL
52	NULL	NULL
52	NULL	NULL
52	NULL	NULL
52	NULL	NULL
52	NULL	NULL
52	NULL	NULL
52	NULL	NULL
52	NULL	NULL
52	NULL	NULL
52	NULL	NULL
52	NULL	NULL
52	NULL	NULL
52	NULL	NULL
52	NULL	NULL
52	NULL	NULL
52	NULL	NULL
52	NULL	NULL
52	NULL	NULL
52	NULL	NULL
52	NULL	NULL
52	NULL	NULL
52	NULL	NULL
52	NULL	NULL
52	NULL	NULL
52	NULL	NULL
52	NULL	NULL
52	NULL	NULL
52	NULL	NULL
52	NULL	NULL
52	NULL	NULL
52	NULL	NULL
52	NULL	NULL
52	NULL	NULL
52	NULL	NULL
52	NULL	NULL
52	NULL	NULL
52	NULL	NULL
52	NULL	NULL
52	NULL	NULL
52	NULL	NULL
52	NULL	NULL
52	NULL	NULL
52	NULL	NULL
52	NULL	NULL
52	NULL	NULL
52	NULL	NULL
52	NULL	NULL
52	NULL	NULL
52	NULL	NULL
52	NULL	NULL
52	NULL	NULL
52	NULL	NULL
52	NULL	NULL
52	NULL	NULL
52	NULL	NULL
52	NULL	NULL
52	NULL	NULL
52	NULL	NULL
52	NULL	NULL
52	NULL	NULL
52	NULL	NULL
52	NULL	NULL
52	NULL	NULL
52	NULL	NULL
52	NULL	NULL
52	NULL	NULL
52	NULL	NULL
52	NULL	NULL
52	NULL	NULL
52	NULL	NULL
52	NULL	NULL
52	NULL	NULL
52	NULL	NULL
52	NULL	NULL
52	NULL	NULL
52	NULL	NULL
52	NULL	NULL
52	NULL	NULL
52	NULL	NULL
52	NULL	NULL
52	NULL	NULL
52	NULL	NULL
52	NULL	NULL
52	NULL	NULL
52	NULL	NULL
52	NULL	NULL
52	NULL	NULL
52	NULL	NULL
52	NULL	NULL
52	NULL	NULL
52	NULL	NULL
52	NULL	NULL
52	NULL	NULL
52	NULL	NULL
52	NULL	NULL
52	NULL	NULL
52	NULL	NULL
52	NULL	NULL
52	NULL	NULL
DROP PROCEDURE p_test01;
CREATE  PROCEDURE p_test01()
begin
declare i int;
set i=1;
while i<= (select id 
from t2) DO
update t1 set name = ((select name from t2 where id =10)) where t1.id =20;
set i = i + 1;
end WHILE;
end;
//
call p_test01();
ERROR 21000: Subquery returns more than 1 row
DROP PROCEDURE p_test01;
CREATE  PROCEDURE p_test01()
begin
declare i int;
set i=1;
while i<= (select id
from t3) DO
update t1 set name = ((select name from t2 where id =10)) where t1.id =20;
set i = i + 1;
end WHILE;
end;
//
call p_test01();
select * from t1 order by id;
id	name	t
1	NULL	NULL
1	NULL	NULL
1	NULL	NULL
1	NULL	NULL
1	NULL	NULL
1	NULL	NULL
1	NULL	NULL
1	NULL	NULL
1	NULL	NULL
1	NULL	NULL
1	NULL	NULL
1	NULL	NULL
1	NULL	NULL
1	NULL	NULL
1	NULL	NULL
1	NULL	NULL
1	NULL	NULL
1	NULL	NULL
1	NULL	NULL
1	NULL	NULL
1	NULL	NULL
1	NULL	NULL
1	NULL	NULL
1	NULL	NULL
1	NULL	NULL
1	NULL	NULL
1	NULL	NULL
1	NULL	NULL
1	NULL	NULL
1	NULL	NULL
1	NULL	NULL
1	NULL	NULL
1	NULL	NULL
1	NULL	NULL
1	NULL	NULL
1	NULL	NULL
1	NULL	NULL
1	NULL	NULL
1	NULL	NULL
1	NULL	NULL
1	test01	2020-10-10
1	NULL	NULL
1	NULL	NULL
1	NULL	NULL
1	NULL	NULL
1	NULL	NULL
1	NULL	NULL
1	NULL	NULL
1	NULL	NULL
1	NULL	NULL
1	NULL	NULL
1	NULL	NULL
1	NULL	NULL
2	NULL	NULL
2	NULL	NULL
2	NULL	NULL
2	NULL	NULL
2	NULL	NULL
2	NULL	NULL
2	NULL	NULL
2	NULL	NULL
5	NULL	NULL
5	NULL	NULL
5	NULL	NULL
5	NULL	NULL
5	NULL	NULL
5	NULL	NULL
5	NULL	NULL
5	NULL	NULL
5	NULL	NULL
5	NULL	NULL
5	NULL	NULL
5	NULL	NULL
5	NULL	NULL
5	NULL	NULL
5	NULL	NULL
5	NULL	NULL
5	NULL	NULL
5	NULL	NULL
5	NULL	NULL
5	NULL	NULL
5	NULL	NULL
5	NULL	NULL
5	NULL	NULL
5	NULL	NULL
5	NULL	NULL
5	NULL	NULL
5	NULL	NULL
5	NULL	NULL
5	NULL	NULL
5	NULL	NULL
5	NULL	NULL
5	NULL	NULL
5	NULL	NULL
5	NULL	NULL
5	NULL	NULL
5	NULL	NULL
5	NULL	NULL
5	NULL	NULL
5	NULL	NULL
5	NULL	NULL
6	NULL	NULL
6	NULL	NULL
6	NULL	NULL
6	NULL	NULL
6	NULL	NULL
6	NULL	NULL
6	NULL	NULL
6	NULL	NULL
6	NULL	NULL
6	NULL	NULL
6	NULL	NULL
6	NULL	NULL
6	NULL	NULL
6	NULL	NULL
6	NULL	NULL
6	NULL	NULL
6	NULL	NULL
6	NULL	NULL
6	NULL	NULL
6	NULL	NULL
6	NULL	NULL
6	NULL	NULL
6	NULL	NULL
6	NULL	NULL
10	NULL	NULL
10	NULL	NULL
10	NULL	NULL
10	NULL	NULL
10	NULL	NULL
10	NULL	NULL
10	NULL	NULL
10	NULL	NULL
10	NULL	NULL
10	NULL	NULL
10	NULL	NULL
10	NULL	NULL
10	NULL	NULL
10	NULL	NULL
10	NULL	NULL
10	NULL	NULL
10	NULL	NULL
10	NULL	NULL
10	NULL	NULL
10	NULL	NULL
10	NULL	NULL
10	NULL	NULL
10	NULL	NULL
10	NULL	NULL
10	NULL	NULL
10	NULL	NULL
10	NULL	NULL
10	NULL	NULL
10	NULL	NULL
10	NULL	NULL
10	NULL	NULL
10	NULL	NULL
10	NULL	NULL
10	NULL	NULL
10	NULL	NULL
10	NULL	NULL
10	NULL	NULL
10	NULL	NULL
10	NULL	NULL
10	NULL	NULL
10	NULL	NULL
10	NULL	NULL
10	NULL	NULL
10	NULL	NULL
10	NULL	NULL
10	NULL	NULL
10	NULL	NULL
10	NULL	NULL
10	NULL	NULL
10	NULL	NULL
10	NULL	NULL
10	NULL	NULL
10	NULL	NULL
10	NULL	NULL
10	NULL	NULL
10	NULL	NULL
10	NULL	NULL
10	NULL	NULL
10	NULL	NULL
10	NULL	NULL
10	NULL	NULL
10	NULL	NULL
10	NULL	NULL
10	NULL	NULL
10	NULL	NULL
10	NULL	NULL
10	NULL	NULL
10	NULL	NULL
10	NULL	NULL
10	NULL	NULL
10	NULL	NULL
10	NULL	NULL
10	NULL	NULL
10	NULL	NULL
10	NULL	NULL
10	NULL	NULL
10	NULL	NULL
10	NULL	NULL
10	NULL	NULL
10	NULL	NULL
10	NULL	NULL
10	NULL	NULL
10	NULL	NULL
10	NULL	NULL
10	NULL	NULL
10	NULL	NULL
10	NULL	NULL
10	NULL	NULL
10	NULL	NULL
10	NULL	NULL
10	NULL	NULL
10	NULL	NULL
10	NULL	NULL
10	NULL	NULL
10	NULL	NULL
10	NULL	NULL
10	NULL	NULL
10	NULL	NULL
10	NULL	NULL
10	NULL	NULL
10	NULL	NULL
10	NULL	NULL
10	NULL	NULL
10	NULL	NULL
10	NULL	NULL
10	NULL	NULL
10	NULL	NULL
10	NULL	NULL
10	NULL	NULL
10	NULL	NULL
10	NULL	NULL
10	NULL	NULL
10	NULL	NULL
10	NULL	NULL
10	NULL	NULL
10	NULL	NULL
10	NULL	NULL
10	NULL	NULL
10	NULL	NULL
10	NULL	NULL
10	test02	2020-10-11
20	test02	NULL
20	test02	NULL
20	test02	NULL
20	test02	NULL
20	test02	NULL
20	test02	NULL
20	test02	NULL
20	test02	NULL
20	test02	NULL
20	test02	NULL
20	test02	NULL
20	test02	NULL
20	test02	NULL
20	test02	NULL
20	test02	NULL
20	test02	NULL
20	test02	NULL
20	test02	NULL
20	test02	NULL
20	test02	NULL
20	test02	NULL
20	test02	NULL
20	test02	NULL
20	test02	NULL
20	test02	NULL
20	test02	NULL
20	test02	NULL
20	test02	NULL
20	test02	NULL
20	test02	NULL
20	test02	NULL
20	test02	NULL
20	test02	NULL
20	test02	NULL
20	test02	NULL
20	test02	NULL
20	test02	NULL
20	test02	NULL
20	test02	NULL
20	test02	NULL
20	test02	NULL
20	test02	NULL
20	test02	NULL
20	test02	NULL
20	test02	NULL
20	test02	NULL
20	test02	NULL
20	test02	NULL
20	test02	NULL
20	test02	NULL
20	test02	NULL
20	test02	NULL
20	test02	NULL
20	test02	NULL
20	test02	NULL
20	test02	NULL
20	test02	NULL
20	test02	NULL
20	test02	NULL
20	test02	NULL
20	test02	NULL
20	test02	NULL
20	test02	NULL
20	test02	NULL
20	test02	NULL
20	test02	NULL
20	test02	NULL
20	test02	NULL
20	test02	NULL
20	test02	NULL
20	test02	NULL
20	test02	NULL
20	test02	NULL
20	test02	NULL
20	test02	NULL
20	test02	NULL
20	test02	NULL
20	test02	NULL
20	test02	NULL
20	test02	2020-10-12
20	test02	NULL
52	NULL	NULL
52	NULL	NULL
52	NULL	NULL
52	NULL	NULL
52	NULL	NULL
52	NULL	NULL
52	NULL	NULL
52	NULL	NULL
52	NULL	NULL
52	NULL	NULL
52	NULL	NULL
52	NULL	NULL
52	NULL	NULL
52	NULL	NULL
52	NULL	NULL
52	NULL	NULL
52	NULL	NULL
52	NULL	NULL
52	NULL	NULL
52	NULL	NULL
52	NULL	NULL
52	NULL	NULL
52	NULL	NULL
52	NULL	NULL
52	NULL	NULL
52	NULL	NULL
52	NULL	NULL
52	NULL	NULL
52	NULL	NULL
52	NULL	NULL
52	NULL	NULL
52	NULL	NULL
52	NULL	NULL
52	NULL	NULL
52	NULL	NULL
52	NULL	NULL
52	NULL	NULL
52	NULL	NULL
52	NULL	NULL
52	NULL	NULL
52	NULL	NULL
52	NULL	NULL
52	NULL	NULL
52	NULL	NULL
52	NULL	NULL
52	NULL	NULL
52	NULL	NULL
52	NULL	NULL
52	NULL	NULL
52	NULL	NULL
52	NULL	NULL
52	NULL	NULL
52	NULL	NULL
52	NULL	NULL
52	NULL	NULL
52	NULL	NULL
52	NULL	NULL
52	NULL	NULL
52	NULL	NULL
52	NULL	NULL
52	NULL	NULL
52	NULL	NULL
52	NULL	NULL
52	NULL	NULL
52	NULL	NULL
52	NULL	NULL
52	NULL	NULL
52	NULL	NULL
52	NULL	NULL
52	NULL	NULL
52	NULL	NULL
52	NULL	NULL
52	NULL	NULL
52	NULL	NULL
52	NULL	NULL
52	NULL	NULL
52	NULL	NULL
52	NULL	NULL
52	NULL	NULL
52	NULL	NULL
52	NULL	NULL
52	NULL	NULL
52	NULL	NULL
52	NULL	NULL
52	NULL	NULL
52	NULL	NULL
52	NULL	NULL
52	NULL	NULL
52	NULL	NULL
52	NULL	NULL
52	NULL	NULL
52	NULL	NULL
52	NULL	NULL
52	NULL	NULL
52	NULL	NULL
52	NULL	NULL
52	NULL	NULL
52	NULL	NULL
52	NULL	NULL
52	NULL	NULL
52	NULL	NULL
52	NULL	NULL
52	NULL	NULL
52	NULL	NULL
52	NULL	NULL
52	NULL	NULL
52	NULL	NULL
52	NULL	NULL
52	NULL	NULL
52	NULL	NULL
52	NULL	NULL
52	NULL	NULL
52	NULL	NULL
52	NULL	NULL
52	NULL	NULL
52	NULL	NULL
52	NULL	NULL
52	NULL	NULL
52	NULL	NULL
52	NULL	NULL
52	NULL	NULL
52	NULL	NULL
52	NULL	NULL
52	NULL	NULL
52	NULL	NULL
52	NULL	NULL
52	NULL	NULL
52	NULL	NULL
52	NULL	NULL
52	NULL	NULL
52	NULL	NULL
52	NULL	NULL
52	NULL	NULL
52	NULL	NULL
52	NULL	NULL
52	NULL	NULL
52	NULL	NULL
52	NULL	NULL
52	NULL	NULL
52	NULL	NULL
52	NULL	NULL
52	NULL	NULL
52	NULL	NULL
52	NULL	NULL
52	NULL	NULL
52	NULL	NULL
52	NULL	NULL
52	NULL	NULL
52	NULL	NULL
52	NULL	NULL
52	NULL	NULL
52	NULL	NULL
52	NULL	NULL
52	NULL	NULL
52	NULL	NULL
52	NULL	NULL
52	NULL	NULL
52	NULL	NULL
52	NULL	NULL
52	NULL	NULL
52	NULL	NULL
52	NULL	NULL
52	NULL	NULL
52	NULL	NULL
52	NULL	NULL
52	NULL	NULL
52	NULL	NULL
52	NULL	NULL
52	NULL	NULL
52	NULL	NULL
52	NULL	NULL
52	NULL	NULL
52	NULL	NULL
52	NULL	NULL
52	NULL	NULL
52	NULL	NULL
52	NULL	NULL
52	NULL	NULL
52	NULL	NULL
52	NULL	NULL
52	NULL	NULL
52	NULL	NULL
52	NULL	NULL
52	NULL	NULL
52	NULL	NULL
52	NULL	NULL
52	NULL	NULL
52	NULL	NULL
52	NULL	NULL
52	NULL	NULL
52	NULL	NULL
52	NULL	NULL
52	NULL	NULL
52	NULL	NULL
52	NULL	NULL
52	NULL	NULL
52	NULL	NULL
52	NULL	NULL
52	NULL	NULL
52	NULL	NULL
52	NULL	NULL
52	NULL	NULL
52	NULL	NULL
52	NULL	NULL
52	NULL	NULL
52	NULL	NULL
52	NULL	NULL
52	NULL	NULL
DROP PROCEDURE p_test01;
CREATE  PROCEDURE p_test01()
begin
declare i int;
set i=1;
while i in (select id
from t3) DO
update t1 set name = ((select name from t2 where id =10)) where t1.id =20;
set i = i + 1;
end WHILE;
end;
//
call p_test01();
select * from t1 order by id;
id	name	t
1	NULL	NULL
1	NULL	NULL
1	NULL	NULL
1	NULL	NULL
1	NULL	NULL
1	NULL	NULL
1	NULL	NULL
1	NULL	NULL
1	NULL	NULL
1	NULL	NULL
1	NULL	NULL
1	NULL	NULL
1	NULL	NULL
1	NULL	NULL
1	NULL	NULL
1	NULL	NULL
1	NULL	NULL
1	NULL	NULL
1	NULL	NULL
1	NULL	NULL
1	NULL	NULL
1	NULL	NULL
1	NULL	NULL
1	NULL	NULL
1	NULL	NULL
1	NULL	NULL
1	NULL	NULL
1	NULL	NULL
1	NULL	NULL
1	NULL	NULL
1	NULL	NULL
1	NULL	NULL
1	NULL	NULL
1	NULL	NULL
1	NULL	NULL
1	NULL	NULL
1	NULL	NULL
1	NULL	NULL
1	NULL	NULL
1	NULL	NULL
1	test01	2020-10-10
1	NULL	NULL
1	NULL	NULL
1	NULL	NULL
1	NULL	NULL
1	NULL	NULL
1	NULL	NULL
1	NULL	NULL
1	NULL	NULL
1	NULL	NULL
1	NULL	NULL
1	NULL	NULL
1	NULL	NULL
2	NULL	NULL
2	NULL	NULL
2	NULL	NULL
2	NULL	NULL
2	NULL	NULL
2	NULL	NULL
2	NULL	NULL
2	NULL	NULL
5	NULL	NULL
5	NULL	NULL
5	NULL	NULL
5	NULL	NULL
5	NULL	NULL
5	NULL	NULL
5	NULL	NULL
5	NULL	NULL
5	NULL	NULL
5	NULL	NULL
5	NULL	NULL
5	NULL	NULL
5	NULL	NULL
5	NULL	NULL
5	NULL	NULL
5	NULL	NULL
5	NULL	NULL
5	NULL	NULL
5	NULL	NULL
5	NULL	NULL
5	NULL	NULL
5	NULL	NULL
5	NULL	NULL
5	NULL	NULL
5	NULL	NULL
5	NULL	NULL
5	NULL	NULL
5	NULL	NULL
5	NULL	NULL
5	NULL	NULL
5	NULL	NULL
5	NULL	NULL
5	NULL	NULL
5	NULL	NULL
5	NULL	NULL
5	NULL	NULL
5	NULL	NULL
5	NULL	NULL
5	NULL	NULL
5	NULL	NULL
6	NULL	NULL
6	NULL	NULL
6	NULL	NULL
6	NULL	NULL
6	NULL	NULL
6	NULL	NULL
6	NULL	NULL
6	NULL	NULL
6	NULL	NULL
6	NULL	NULL
6	NULL	NULL
6	NULL	NULL
6	NULL	NULL
6	NULL	NULL
6	NULL	NULL
6	NULL	NULL
6	NULL	NULL
6	NULL	NULL
6	NULL	NULL
6	NULL	NULL
6	NULL	NULL
6	NULL	NULL
6	NULL	NULL
6	NULL	NULL
10	NULL	NULL
10	NULL	NULL
10	NULL	NULL
10	NULL	NULL
10	NULL	NULL
10	NULL	NULL
10	NULL	NULL
10	NULL	NULL
10	NULL	NULL
10	NULL	NULL
10	NULL	NULL
10	NULL	NULL
10	NULL	NULL
10	NULL	NULL
10	NULL	NULL
10	NULL	NULL
10	NULL	NULL
10	NULL	NULL
10	NULL	NULL
10	NULL	NULL
10	NULL	NULL
10	NULL	NULL
10	NULL	NULL
10	NULL	NULL
10	NULL	NULL
10	NULL	NULL
10	NULL	NULL
10	NULL	NULL
10	NULL	NULL
10	NULL	NULL
10	NULL	NULL
10	NULL	NULL
10	NULL	NULL
10	NULL	NULL
10	NULL	NULL
10	NULL	NULL
10	NULL	NULL
10	NULL	NULL
10	NULL	NULL
10	NULL	NULL
10	NULL	NULL
10	NULL	NULL
10	NULL	NULL
10	NULL	NULL
10	NULL	NULL
10	NULL	NULL
10	NULL	NULL
10	NULL	NULL
10	NULL	NULL
10	NULL	NULL
10	NULL	NULL
10	NULL	NULL
10	NULL	NULL
10	NULL	NULL
10	NULL	NULL
10	NULL	NULL
10	NULL	NULL
10	NULL	NULL
10	NULL	NULL
10	NULL	NULL
10	NULL	NULL
10	NULL	NULL
10	NULL	NULL
10	NULL	NULL
10	NULL	NULL
10	NULL	NULL
10	NULL	NULL
10	NULL	NULL
10	NULL	NULL
10	NULL	NULL
10	NULL	NULL
10	NULL	NULL
10	NULL	NULL
10	NULL	NULL
10	NULL	NULL
10	NULL	NULL
10	NULL	NULL
10	NULL	NULL
10	NULL	NULL
10	NULL	NULL
10	NULL	NULL
10	NULL	NULL
10	NULL	NULL
10	NULL	NULL
10	NULL	NULL
10	NULL	NULL
10	NULL	NULL
10	NULL	NULL
10	NULL	NULL
10	NULL	NULL
10	NULL	NULL
10	NULL	NULL
10	NULL	NULL
10	NULL	NULL
10	NULL	NULL
10	NULL	NULL
10	NULL	NULL
10	NULL	NULL
10	NULL	NULL
10	NULL	NULL
10	NULL	NULL
10	NULL	NULL
10	NULL	NULL
10	NULL	NULL
10	NULL	NULL
10	NULL	NULL
10	NULL	NULL
10	NULL	NULL
10	NULL	NULL
10	NULL	NULL
10	NULL	NULL
10	NULL	NULL
10	NULL	NULL
10	NULL	NULL
10	NULL	NULL
10	NULL	NULL
10	NULL	NULL
10	NULL	NULL
10	NULL	NULL
10	NULL	NULL
10	test02	2020-10-11
20	test02	NULL
20	test02	NULL
20	test02	NULL
20	test02	NULL
20	test02	NULL
20	test02	NULL
20	test02	NULL
20	test02	NULL
20	test02	NULL
20	test02	NULL
20	test02	NULL
20	test02	NULL
20	test02	NULL
20	test02	NULL
20	test02	NULL
20	test02	NULL
20	test02	NULL
20	test02	NULL
20	test02	NULL
20	test02	NULL
20	test02	NULL
20	test02	NULL
20	test02	NULL
20	test02	NULL
20	test02	NULL
20	test02	NULL
20	test02	NULL
20	test02	NULL
20	test02	NULL
20	test02	NULL
20	test02	NULL
20	test02	NULL
20	test02	NULL
20	test02	NULL
20	test02	NULL
20	test02	NULL
20	test02	NULL
20	test02	NULL
20	test02	NULL
20	test02	NULL
20	test02	NULL
20	test02	NULL
20	test02	NULL
20	test02	NULL
20	test02	NULL
20	test02	NULL
20	test02	NULL
20	test02	NULL
20	test02	NULL
20	test02	NULL
20	test02	NULL
20	test02	NULL
20	test02	NULL
20	test02	NULL
20	test02	NULL
20	test02	NULL
20	test02	NULL
20	test02	NULL
20	test02	NULL
20	test02	NULL
20	test02	NULL
20	test02	NULL
20	test02	NULL
20	test02	NULL
20	test02	NULL
20	test02	NULL
20	test02	NULL
20	test02	NULL
20	test02	NULL
20	test02	NULL
20	test02	NULL
20	test02	NULL
20	test02	NULL
20	test02	NULL
20	test02	NULL
20	test02	NULL
20	test02	NULL
20	test02	NULL
20	test02	NULL
20	test02	2020-10-12
20	test02	NULL
52	NULL	NULL
52	NULL	NULL
52	NULL	NULL
52	NULL	NULL
52	NULL	NULL
52	NULL	NULL
52	NULL	NULL
52	NULL	NULL
52	NULL	NULL
52	NULL	NULL
52	NULL	NULL
52	NULL	NULL
52	NULL	NULL
52	NULL	NULL
52	NULL	NULL
52	NULL	NULL
52	NULL	NULL
52	NULL	NULL
52	NULL	NULL
52	NULL	NULL
52	NULL	NULL
52	NULL	NULL
52	NULL	NULL
52	NULL	NULL
52	NULL	NULL
52	NULL	NULL
52	NULL	NULL
52	NULL	NULL
52	NULL	NULL
52	NULL	NULL
52	NULL	NULL
52	NULL	NULL
52	NULL	NULL
52	NULL	NULL
52	NULL	NULL
52	NULL	NULL
52	NULL	NULL
52	NULL	NULL
52	NULL	NULL
52	NULL	NULL
52	NULL	NULL
52	NULL	NULL
52	NULL	NULL
52	NULL	NULL
52	NULL	NULL
52	NULL	NULL
52	NULL	NULL
52	NULL	NULL
52	NULL	NULL
52	NULL	NULL
52	NULL	NULL
52	NULL	NULL
52	NULL	NULL
52	NULL	NULL
52	NULL	NULL
52	NULL	NULL
52	NULL	NULL
52	NULL	NULL
52	NULL	NULL
52	NULL	NULL
52	NULL	NULL
52	NULL	NULL
52	NULL	NULL
52	NULL	NULL
52	NULL	NULL
52	NULL	NULL
52	NULL	NULL
52	NULL	NULL
52	NULL	NULL
52	NULL	NULL
52	NULL	NULL
52	NULL	NULL
52	NULL	NULL
52	NULL	NULL
52	NULL	NULL
52	NULL	NULL
52	NULL	NULL
52	NULL	NULL
52	NULL	NULL
52	NULL	NULL
52	NULL	NULL
52	NULL	NULL
52	NULL	NULL
52	NULL	NULL
52	NULL	NULL
52	NULL	NULL
52	NULL	NULL
52	NULL	NULL
52	NULL	NULL
52	NULL	NULL
52	NULL	NULL
52	NULL	NULL
52	NULL	NULL
52	NULL	NULL
52	NULL	NULL
52	NULL	NULL
52	NULL	NULL
52	NULL	NULL
52	NULL	NULL
52	NULL	NULL
52	NULL	NULL
52	NULL	NULL
52	NULL	NULL
52	NULL	NULL
52	NULL	NULL
52	NULL	NULL
52	NULL	NULL
52	NULL	NULL
52	NULL	NULL
52	NULL	NULL
52	NULL	NULL
52	NULL	NULL
52	NULL	NULL
52	NULL	NULL
52	NULL	NULL
52	NULL	NULL
52	NULL	NULL
52	NULL	NULL
52	NULL	NULL
52	NULL	NULL
52	NULL	NULL
52	NULL	NULL
52	NULL	NULL
52	NULL	NULL
52	NULL	NULL
52	NULL	NULL
52	NULL	NULL
52	NULL	NULL
52	NULL	NULL
52	NULL	NULL
52	NULL	NULL
52	NULL	NULL
52	NULL	NULL
52	NULL	NULL
52	NULL	NULL
52	NULL	NULL
52	NULL	NULL
52	NULL	NULL
52	NULL	NULL
52	NULL	NULL
52	NULL	NULL
52	NULL	NULL
52	NULL	NULL
52	NULL	NULL
52	NULL	NULL
52	NULL	NULL
52	NULL	NULL
52	NULL	NULL
52	NULL	NULL
52	NULL	NULL
52	NULL	NULL
52	NULL	NULL
52	NULL	NULL
52	NULL	NULL
52	NULL	NULL
52	NULL	NULL
52	NULL	NULL
52	NULL	NULL
52	NULL	NULL
52	NULL	NULL
52	NULL	NULL
52	NULL	NULL
52	NULL	NULL
52	NULL	NULL
52	NULL	NULL
52	NULL	NULL
52	NULL	NULL
52	NULL	NULL
52	NULL	NULL
52	NULL	NULL
52	NULL	NULL
52	NULL	NULL
52	NULL	NULL
52	NULL	NULL
52	NULL	NULL
52	NULL	NULL
52	NULL	NULL
52	NULL	NULL
52	NULL	NULL
52	NULL	NULL
52	NULL	NULL
52	NULL	NULL
52	NULL	NULL
52	NULL	NULL
52	NULL	NULL
52	NULL	NULL
52	NULL	NULL
52	NULL	NULL
52	NULL	NULL
52	NULL	NULL
52	NULL	NULL
52	NULL	NULL
52	NULL	NULL
52	NULL	NULL
52	NULL	NULL
52	NULL	NULL
52	NULL	NULL
52	NULL	NULL
52	NULL	NULL
52	NULL	NULL
52	NULL	NULL
52	NULL	NULL
52	NULL	NULL
52	NULL	NULL
52	NULL	NULL
52	NULL	NULL
52	NULL	NULL
52	NULL	NULL
call p_test01();
DROP PROCEDURE p_test01;
CREATE  PROCEDURE p_test01()
begin
declare i int;
set i=1;
while i = (select id from t2 where name='test02' ) DO
update t1 set name = ((select name from t2 where id =10)) where t1.id =20;
set i = i + 1;
end WHILE;
end;
//
call p_test01();
select * from t1 order by id;
id	name	t
1	NULL	NULL
1	NULL	NULL
1	NULL	NULL
1	NULL	NULL
1	NULL	NULL
1	NULL	NULL
1	NULL	NULL
1	NULL	NULL
1	NULL	NULL
1	NULL	NULL
1	NULL	NULL
1	NULL	NULL
1	NULL	NULL
1	NULL	NULL
1	NULL	NULL
1	NULL	NULL
1	NULL	NULL
1	NULL	NULL
1	NULL	NULL
1	NULL	NULL
1	NULL	NULL
1	NULL	NULL
1	NULL	NULL
1	NULL	NULL
1	NULL	NULL
1	NULL	NULL
1	NULL	NULL
1	NULL	NULL
1	NULL	NULL
1	NULL	NULL
1	NULL	NULL
1	NULL	NULL
1	NULL	NULL
1	NULL	NULL
1	NULL	NULL
1	NULL	NULL
1	NULL	NULL
1	NULL	NULL
1	NULL	NULL
1	NULL	NULL
1	test01	2020-10-10
1	NULL	NULL
1	NULL	NULL
1	NULL	NULL
1	NULL	NULL
1	NULL	NULL
1	NULL	NULL
1	NULL	NULL
1	NULL	NULL
1	NULL	NULL
1	NULL	NULL
1	NULL	NULL
1	NULL	NULL
2	NULL	NULL
2	NULL	NULL
2	NULL	NULL
2	NULL	NULL
2	NULL	NULL
2	NULL	NULL
2	NULL	NULL
2	NULL	NULL
5	NULL	NULL
5	NULL	NULL
5	NULL	NULL
5	NULL	NULL
5	NULL	NULL
5	NULL	NULL
5	NULL	NULL
5	NULL	NULL
5	NULL	NULL
5	NULL	NULL
5	NULL	NULL
5	NULL	NULL
5	NULL	NULL
5	NULL	NULL
5	NULL	NULL
5	NULL	NULL
5	NULL	NULL
5	NULL	NULL
5	NULL	NULL
5	NULL	NULL
5	NULL	NULL
5	NULL	NULL
5	NULL	NULL
5	NULL	NULL
5	NULL	NULL
5	NULL	NULL
5	NULL	NULL
5	NULL	NULL
5	NULL	NULL
5	NULL	NULL
5	NULL	NULL
5	NULL	NULL
5	NULL	NULL
5	NULL	NULL
5	NULL	NULL
5	NULL	NULL
5	NULL	NULL
5	NULL	NULL
5	NULL	NULL
5	NULL	NULL
6	NULL	NULL
6	NULL	NULL
6	NULL	NULL
6	NULL	NULL
6	NULL	NULL
6	NULL	NULL
6	NULL	NULL
6	NULL	NULL
6	NULL	NULL
6	NULL	NULL
6	NULL	NULL
6	NULL	NULL
6	NULL	NULL
6	NULL	NULL
6	NULL	NULL
6	NULL	NULL
6	NULL	NULL
6	NULL	NULL
6	NULL	NULL
6	NULL	NULL
6	NULL	NULL
6	NULL	NULL
6	NULL	NULL
6	NULL	NULL
10	NULL	NULL
10	NULL	NULL
10	NULL	NULL
10	NULL	NULL
10	NULL	NULL
10	NULL	NULL
10	NULL	NULL
10	NULL	NULL
10	NULL	NULL
10	NULL	NULL
10	NULL	NULL
10	NULL	NULL
10	NULL	NULL
10	NULL	NULL
10	NULL	NULL
10	NULL	NULL
10	NULL	NULL
10	NULL	NULL
10	NULL	NULL
10	NULL	NULL
10	NULL	NULL
10	NULL	NULL
10	NULL	NULL
10	NULL	NULL
10	NULL	NULL
10	NULL	NULL
10	NULL	NULL
10	NULL	NULL
10	NULL	NULL
10	NULL	NULL
10	NULL	NULL
10	NULL	NULL
10	NULL	NULL
10	NULL	NULL
10	NULL	NULL
10	NULL	NULL
10	NULL	NULL
10	NULL	NULL
10	NULL	NULL
10	NULL	NULL
10	NULL	NULL
10	NULL	NULL
10	NULL	NULL
10	NULL	NULL
10	NULL	NULL
10	NULL	NULL
10	NULL	NULL
10	NULL	NULL
10	NULL	NULL
10	NULL	NULL
10	NULL	NULL
10	NULL	NULL
10	NULL	NULL
10	NULL	NULL
10	NULL	NULL
10	NULL	NULL
10	NULL	NULL
10	NULL	NULL
10	NULL	NULL
10	NULL	NULL
10	NULL	NULL
10	NULL	NULL
10	NULL	NULL
10	NULL	NULL
10	NULL	NULL
10	NULL	NULL
10	NULL	NULL
10	NULL	NULL
10	NULL	NULL
10	NULL	NULL
10	NULL	NULL
10	NULL	NULL
10	NULL	NULL
10	NULL	NULL
10	NULL	NULL
10	NULL	NULL
10	NULL	NULL
10	NULL	NULL
10	NULL	NULL
10	NULL	NULL
10	NULL	NULL
10	NULL	NULL
10	NULL	NULL
10	NULL	NULL
10	NULL	NULL
10	NULL	NULL
10	NULL	NULL
10	NULL	NULL
10	NULL	NULL
10	NULL	NULL
10	NULL	NULL
10	NULL	NULL
10	NULL	NULL
10	NULL	NULL
10	NULL	NULL
10	NULL	NULL
10	NULL	NULL
10	NULL	NULL
10	NULL	NULL
10	NULL	NULL
10	NULL	NULL
10	NULL	NULL
10	NULL	NULL
10	NULL	NULL
10	NULL	NULL
10	NULL	NULL
10	NULL	NULL
10	NULL	NULL
10	NULL	NULL
10	NULL	NULL
10	NULL	NULL
10	NULL	NULL
10	NULL	NULL
10	NULL	NULL
10	NULL	NULL
10	NULL	NULL
10	NULL	NULL
10	NULL	NULL
10	NULL	NULL
10	NULL	NULL
10	test02	2020-10-11
20	test02	NULL
20	test02	NULL
20	test02	NULL
20	test02	NULL
20	test02	NULL
20	test02	NULL
20	test02	NULL
20	test02	NULL
20	test02	NULL
20	test02	NULL
20	test02	NULL
20	test02	NULL
20	test02	NULL
20	test02	NULL
20	test02	NULL
20	test02	NULL
20	test02	NULL
20	test02	NULL
20	test02	NULL
20	test02	NULL
20	test02	NULL
20	test02	NULL
20	test02	NULL
20	test02	NULL
20	test02	NULL
20	test02	NULL
20	test02	NULL
20	test02	NULL
20	test02	NULL
20	test02	NULL
20	test02	NULL
20	test02	NULL
20	test02	NULL
20	test02	NULL
20	test02	NULL
20	test02	NULL
20	test02	NULL
20	test02	NULL
20	test02	NULL
20	test02	NULL
20	test02	NULL
20	test02	NULL
20	test02	NULL
20	test02	NULL
20	test02	NULL
20	test02	NULL
20	test02	NULL
20	test02	NULL
20	test02	NULL
20	test02	NULL
20	test02	NULL
20	test02	NULL
20	test02	NULL
20	test02	NULL
20	test02	NULL
20	test02	NULL
20	test02	NULL
20	test02	NULL
20	test02	NULL
20	test02	NULL
20	test02	NULL
20	test02	NULL
20	test02	NULL
20	test02	NULL
20	test02	NULL
20	test02	NULL
20	test02	NULL
20	test02	NULL
20	test02	NULL
20	test02	NULL
20	test02	NULL
20	test02	NULL
20	test02	NULL
20	test02	NULL
20	test02	NULL
20	test02	NULL
20	test02	NULL
20	test02	NULL
20	test02	NULL
20	test02	2020-10-12
20	test02	NULL
52	NULL	NULL
52	NULL	NULL
52	NULL	NULL
52	NULL	NULL
52	NULL	NULL
52	NULL	NULL
52	NULL	NULL
52	NULL	NULL
52	NULL	NULL
52	NULL	NULL
52	NULL	NULL
52	NULL	NULL
52	NULL	NULL
52	NULL	NULL
52	NULL	NULL
52	NULL	NULL
52	NULL	NULL
52	NULL	NULL
52	NULL	NULL
52	NULL	NULL
52	NULL	NULL
52	NULL	NULL
52	NULL	NULL
52	NULL	NULL
52	NULL	NULL
52	NULL	NULL
52	NULL	NULL
52	NULL	NULL
52	NULL	NULL
52	NULL	NULL
52	NULL	NULL
52	NULL	NULL
52	NULL	NULL
52	NULL	NULL
52	NULL	NULL
52	NULL	NULL
52	NULL	NULL
52	NULL	NULL
52	NULL	NULL
52	NULL	NULL
52	NULL	NULL
52	NULL	NULL
52	NULL	NULL
52	NULL	NULL
52	NULL	NULL
52	NULL	NULL
52	NULL	NULL
52	NULL	NULL
52	NULL	NULL
52	NULL	NULL
52	NULL	NULL
52	NULL	NULL
52	NULL	NULL
52	NULL	NULL
52	NULL	NULL
52	NULL	NULL
52	NULL	NULL
52	NULL	NULL
52	NULL	NULL
52	NULL	NULL
52	NULL	NULL
52	NULL	NULL
52	NULL	NULL
52	NULL	NULL
52	NULL	NULL
52	NULL	NULL
52	NULL	NULL
52	NULL	NULL
52	NULL	NULL
52	NULL	NULL
52	NULL	NULL
52	NULL	NULL
52	NULL	NULL
52	NULL	NULL
52	NULL	NULL
52	NULL	NULL
52	NULL	NULL
52	NULL	NULL
52	NULL	NULL
52	NULL	NULL
52	NULL	NULL
52	NULL	NULL
52	NULL	NULL
52	NULL	NULL
52	NULL	NULL
52	NULL	NULL
52	NULL	NULL
52	NULL	NULL
52	NULL	NULL
52	NULL	NULL
52	NULL	NULL
52	NULL	NULL
52	NULL	NULL
52	NULL	NULL
52	NULL	NULL
52	NULL	NULL
52	NULL	NULL
52	NULL	NULL
52	NULL	NULL
52	NULL	NULL
52	NULL	NULL
52	NULL	NULL
52	NULL	NULL
52	NULL	NULL
52	NULL	NULL
52	NULL	NULL
52	NULL	NULL
52	NULL	NULL
52	NULL	NULL
52	NULL	NULL
52	NULL	NULL
52	NULL	NULL
52	NULL	NULL
52	NULL	NULL
52	NULL	NULL
52	NULL	NULL
52	NULL	NULL
52	NULL	NULL
52	NULL	NULL
52	NULL	NULL
52	NULL	NULL
52	NULL	NULL
52	NULL	NULL
52	NULL	NULL
52	NULL	NULL
52	NULL	NULL
52	NULL	NULL
52	NULL	NULL
52	NULL	NULL
52	NULL	NULL
52	NULL	NULL
52	NULL	NULL
52	NULL	NULL
52	NULL	NULL
52	NULL	NULL
52	NULL	NULL
52	NULL	NULL
52	NULL	NULL
52	NULL	NULL
52	NULL	NULL
52	NULL	NULL
52	NULL	NULL
52	NULL	NULL
52	NULL	NULL
52	NULL	NULL
52	NULL	NULL
52	NULL	NULL
52	NULL	NULL
52	NULL	NULL
52	NULL	NULL
52	NULL	NULL
52	NULL	NULL
52	NULL	NULL
52	NULL	NULL
52	NULL	NULL
52	NULL	NULL
52	NULL	NULL
52	NULL	NULL
52	NULL	NULL
52	NULL	NULL
52	NULL	NULL
52	NULL	NULL
52	NULL	NULL
52	NULL	NULL
52	NULL	NULL
52	NULL	NULL
52	NULL	NULL
52	NULL	NULL
52	NULL	NULL
52	NULL	NULL
52	NULL	NULL
52	NULL	NULL
52	NULL	NULL
52	NULL	NULL
52	NULL	NULL
52	NULL	NULL
52	NULL	NULL
52	NULL	NULL
52	NULL	NULL
52	NULL	NULL
52	NULL	NULL
52	NULL	NULL
52	NULL	NULL
52	NULL	NULL
52	NULL	NULL
52	NULL	NULL
52	NULL	NULL
52	NULL	NULL
52	NULL	NULL
52	NULL	NULL
52	NULL	NULL
52	NULL	NULL
52	NULL	NULL
52	NULL	NULL
52	NULL	NULL
52	NULL	NULL
52	NULL	NULL
52	NULL	NULL
52	NULL	NULL
52	NULL	NULL
52	NULL	NULL
52	NULL	NULL
52	NULL	NULL
52	NULL	NULL
52	NULL	NULL
52	NULL	NULL
52	NULL	NULL
52	NULL	NULL
DROP PROCEDURE p_test01;
CREATE  PROCEDURE p_test01()
begin
declare i int;
set i=1;
while i = (select 1) or i<(select 5) DO
update t1 set name = ((select name from t2 where id =10)) where t1.id =20;
set i = i + 1;
end WHILE;
end;
//
输出的信息数量ob和mysql不一样
call p_test01();
select * from t1 order by id;
id	name	t
1	NULL	NULL
1	NULL	NULL
1	NULL	NULL
1	NULL	NULL
1	NULL	NULL
1	NULL	NULL
1	NULL	NULL
1	NULL	NULL
1	NULL	NULL
1	NULL	NULL
1	NULL	NULL
1	NULL	NULL
1	NULL	NULL
1	NULL	NULL
1	NULL	NULL
1	NULL	NULL
1	NULL	NULL
1	NULL	NULL
1	NULL	NULL
1	NULL	NULL
1	NULL	NULL
1	NULL	NULL
1	NULL	NULL
1	NULL	NULL
1	NULL	NULL
1	NULL	NULL
1	NULL	NULL
1	NULL	NULL
1	NULL	NULL
1	NULL	NULL
1	NULL	NULL
1	NULL	NULL
1	NULL	NULL
1	NULL	NULL
1	NULL	NULL
1	NULL	NULL
1	NULL	NULL
1	NULL	NULL
1	NULL	NULL
1	NULL	NULL
1	test01	2020-10-10
1	NULL	NULL
1	NULL	NULL
1	NULL	NULL
1	NULL	NULL
1	NULL	NULL
1	NULL	NULL
1	NULL	NULL
1	NULL	NULL
1	NULL	NULL
1	NULL	NULL
1	NULL	NULL
1	NULL	NULL
2	NULL	NULL
2	NULL	NULL
2	NULL	NULL
2	NULL	NULL
2	NULL	NULL
2	NULL	NULL
2	NULL	NULL
2	NULL	NULL
5	NULL	NULL
5	NULL	NULL
5	NULL	NULL
5	NULL	NULL
5	NULL	NULL
5	NULL	NULL
5	NULL	NULL
5	NULL	NULL
5	NULL	NULL
5	NULL	NULL
5	NULL	NULL
5	NULL	NULL
5	NULL	NULL
5	NULL	NULL
5	NULL	NULL
5	NULL	NULL
5	NULL	NULL
5	NULL	NULL
5	NULL	NULL
5	NULL	NULL
5	NULL	NULL
5	NULL	NULL
5	NULL	NULL
5	NULL	NULL
5	NULL	NULL
5	NULL	NULL
5	NULL	NULL
5	NULL	NULL
5	NULL	NULL
5	NULL	NULL
5	NULL	NULL
5	NULL	NULL
5	NULL	NULL
5	NULL	NULL
5	NULL	NULL
5	NULL	NULL
5	NULL	NULL
5	NULL	NULL
5	NULL	NULL
5	NULL	NULL
6	NULL	NULL
6	NULL	NULL
6	NULL	NULL
6	NULL	NULL
6	NULL	NULL
6	NULL	NULL
6	NULL	NULL
6	NULL	NULL
6	NULL	NULL
6	NULL	NULL
6	NULL	NULL
6	NULL	NULL
6	NULL	NULL
6	NULL	NULL
6	NULL	NULL
6	NULL	NULL
6	NULL	NULL
6	NULL	NULL
6	NULL	NULL
6	NULL	NULL
6	NULL	NULL
6	NULL	NULL
6	NULL	NULL
6	NULL	NULL
10	NULL	NULL
10	NULL	NULL
10	NULL	NULL
10	NULL	NULL
10	NULL	NULL
10	NULL	NULL
10	NULL	NULL
10	NULL	NULL
10	NULL	NULL
10	NULL	NULL
10	NULL	NULL
10	NULL	NULL
10	NULL	NULL
10	NULL	NULL
10	NULL	NULL
10	NULL	NULL
10	NULL	NULL
10	NULL	NULL
10	NULL	NULL
10	NULL	NULL
10	NULL	NULL
10	NULL	NULL
10	NULL	NULL
10	NULL	NULL
10	NULL	NULL
10	NULL	NULL
10	NULL	NULL
10	NULL	NULL
10	NULL	NULL
10	NULL	NULL
10	NULL	NULL
10	NULL	NULL
10	NULL	NULL
10	NULL	NULL
10	NULL	NULL
10	NULL	NULL
10	NULL	NULL
10	NULL	NULL
10	NULL	NULL
10	NULL	NULL
10	NULL	NULL
10	NULL	NULL
10	NULL	NULL
10	NULL	NULL
10	NULL	NULL
10	NULL	NULL
10	NULL	NULL
10	NULL	NULL
10	NULL	NULL
10	NULL	NULL
10	NULL	NULL
10	NULL	NULL
10	NULL	NULL
10	NULL	NULL
10	NULL	NULL
10	NULL	NULL
10	NULL	NULL
10	NULL	NULL
10	NULL	NULL
10	NULL	NULL
10	NULL	NULL
10	NULL	NULL
10	NULL	NULL
10	NULL	NULL
10	NULL	NULL
10	NULL	NULL
10	NULL	NULL
10	NULL	NULL
10	NULL	NULL
10	NULL	NULL
10	NULL	NULL
10	NULL	NULL
10	NULL	NULL
10	NULL	NULL
10	NULL	NULL
10	NULL	NULL
10	NULL	NULL
10	NULL	NULL
10	NULL	NULL
10	NULL	NULL
10	NULL	NULL
10	NULL	NULL
10	NULL	NULL
10	NULL	NULL
10	NULL	NULL
10	NULL	NULL
10	NULL	NULL
10	NULL	NULL
10	NULL	NULL
10	NULL	NULL
10	NULL	NULL
10	NULL	NULL
10	NULL	NULL
10	NULL	NULL
10	NULL	NULL
10	NULL	NULL
10	NULL	NULL
10	NULL	NULL
10	NULL	NULL
10	NULL	NULL
10	NULL	NULL
10	NULL	NULL
10	NULL	NULL
10	NULL	NULL
10	NULL	NULL
10	NULL	NULL
10	NULL	NULL
10	NULL	NULL
10	NULL	NULL
10	NULL	NULL
10	NULL	NULL
10	NULL	NULL
10	NULL	NULL
10	NULL	NULL
10	NULL	NULL
10	NULL	NULL
10	NULL	NULL
10	NULL	NULL
10	NULL	NULL
10	NULL	NULL
10	test02	2020-10-11
20	test02	NULL
20	test02	NULL
20	test02	NULL
20	test02	NULL
20	test02	NULL
20	test02	NULL
20	test02	NULL
20	test02	NULL
20	test02	NULL
20	test02	NULL
20	test02	NULL
20	test02	NULL
20	test02	NULL
20	test02	NULL
20	test02	NULL
20	test02	NULL
20	test02	NULL
20	test02	NULL
20	test02	NULL
20	test02	NULL
20	test02	NULL
20	test02	NULL
20	test02	NULL
20	test02	NULL
20	test02	NULL
20	test02	NULL
20	test02	NULL
20	test02	NULL
20	test02	NULL
20	test02	NULL
20	test02	NULL
20	test02	NULL
20	test02	NULL
20	test02	NULL
20	test02	NULL
20	test02	NULL
20	test02	NULL
20	test02	NULL
20	test02	NULL
20	test02	NULL
20	test02	NULL
20	test02	NULL
20	test02	NULL
20	test02	NULL
20	test02	NULL
20	test02	NULL
20	test02	NULL
20	test02	NULL
20	test02	NULL
20	test02	NULL
20	test02	NULL
20	test02	NULL
20	test02	NULL
20	test02	NULL
20	test02	NULL
20	test02	NULL
20	test02	NULL
20	test02	NULL
20	test02	NULL
20	test02	NULL
20	test02	NULL
20	test02	NULL
20	test02	NULL
20	test02	NULL
20	test02	NULL
20	test02	NULL
20	test02	NULL
20	test02	NULL
20	test02	NULL
20	test02	NULL
20	test02	NULL
20	test02	NULL
20	test02	NULL
20	test02	NULL
20	test02	NULL
20	test02	NULL
20	test02	NULL
20	test02	NULL
20	test02	NULL
20	test02	2020-10-12
20	test02	NULL
52	NULL	NULL
52	NULL	NULL
52	NULL	NULL
52	NULL	NULL
52	NULL	NULL
52	NULL	NULL
52	NULL	NULL
52	NULL	NULL
52	NULL	NULL
52	NULL	NULL
52	NULL	NULL
52	NULL	NULL
52	NULL	NULL
52	NULL	NULL
52	NULL	NULL
52	NULL	NULL
52	NULL	NULL
52	NULL	NULL
52	NULL	NULL
52	NULL	NULL
52	NULL	NULL
52	NULL	NULL
52	NULL	NULL
52	NULL	NULL
52	NULL	NULL
52	NULL	NULL
52	NULL	NULL
52	NULL	NULL
52	NULL	NULL
52	NULL	NULL
52	NULL	NULL
52	NULL	NULL
52	NULL	NULL
52	NULL	NULL
52	NULL	NULL
52	NULL	NULL
52	NULL	NULL
52	NULL	NULL
52	NULL	NULL
52	NULL	NULL
52	NULL	NULL
52	NULL	NULL
52	NULL	NULL
52	NULL	NULL
52	NULL	NULL
52	NULL	NULL
52	NULL	NULL
52	NULL	NULL
52	NULL	NULL
52	NULL	NULL
52	NULL	NULL
52	NULL	NULL
52	NULL	NULL
52	NULL	NULL
52	NULL	NULL
52	NULL	NULL
52	NULL	NULL
52	NULL	NULL
52	NULL	NULL
52	NULL	NULL
52	NULL	NULL
52	NULL	NULL
52	NULL	NULL
52	NULL	NULL
52	NULL	NULL
52	NULL	NULL
52	NULL	NULL
52	NULL	NULL
52	NULL	NULL
52	NULL	NULL
52	NULL	NULL
52	NULL	NULL
52	NULL	NULL
52	NULL	NULL
52	NULL	NULL
52	NULL	NULL
52	NULL	NULL
52	NULL	NULL
52	NULL	NULL
52	NULL	NULL
52	NULL	NULL
52	NULL	NULL
52	NULL	NULL
52	NULL	NULL
52	NULL	NULL
52	NULL	NULL
52	NULL	NULL
52	NULL	NULL
52	NULL	NULL
52	NULL	NULL
52	NULL	NULL
52	NULL	NULL
52	NULL	NULL
52	NULL	NULL
52	NULL	NULL
52	NULL	NULL
52	NULL	NULL
52	NULL	NULL
52	NULL	NULL
52	NULL	NULL
52	NULL	NULL
52	NULL	NULL
52	NULL	NULL
52	NULL	NULL
52	NULL	NULL
52	NULL	NULL
52	NULL	NULL
52	NULL	NULL
52	NULL	NULL
52	NULL	NULL
52	NULL	NULL
52	NULL	NULL
52	NULL	NULL
52	NULL	NULL
52	NULL	NULL
52	NULL	NULL
52	NULL	NULL
52	NULL	NULL
52	NULL	NULL
52	NULL	NULL
52	NULL	NULL
52	NULL	NULL
52	NULL	NULL
52	NULL	NULL
52	NULL	NULL
52	NULL	NULL
52	NULL	NULL
52	NULL	NULL
52	NULL	NULL
52	NULL	NULL
52	NULL	NULL
52	NULL	NULL
52	NULL	NULL
52	NULL	NULL
52	NULL	NULL
52	NULL	NULL
52	NULL	NULL
52	NULL	NULL
52	NULL	NULL
52	NULL	NULL
52	NULL	NULL
52	NULL	NULL
52	NULL	NULL
52	NULL	NULL
52	NULL	NULL
52	NULL	NULL
52	NULL	NULL
52	NULL	NULL
52	NULL	NULL
52	NULL	NULL
52	NULL	NULL
52	NULL	NULL
52	NULL	NULL
52	NULL	NULL
52	NULL	NULL
52	NULL	NULL
52	NULL	NULL
52	NULL	NULL
52	NULL	NULL
52	NULL	NULL
52	NULL	NULL
52	NULL	NULL
52	NULL	NULL
52	NULL	NULL
52	NULL	NULL
52	NULL	NULL
52	NULL	NULL
52	NULL	NULL
52	NULL	NULL
52	NULL	NULL
52	NULL	NULL
52	NULL	NULL
52	NULL	NULL
52	NULL	NULL
52	NULL	NULL
52	NULL	NULL
52	NULL	NULL
52	NULL	NULL
52	NULL	NULL
52	NULL	NULL
52	NULL	NULL
52	NULL	NULL
52	NULL	NULL
52	NULL	NULL
52	NULL	NULL
52	NULL	NULL
52	NULL	NULL
52	NULL	NULL
52	NULL	NULL
52	NULL	NULL
52	NULL	NULL
52	NULL	NULL
52	NULL	NULL
52	NULL	NULL
52	NULL	NULL
52	NULL	NULL
52	NULL	NULL
52	NULL	NULL
52	NULL	NULL
52	NULL	NULL
52	NULL	NULL
52	NULL	NULL
52	NULL	NULL
52	NULL	NULL
52	NULL	NULL
52	NULL	NULL
52	NULL	NULL
52	NULL	NULL
drop table t1;
create table t1( id int,name varchar(30),t date);
insert into t1 values(1,'test01','2020-10-10');
insert into t1 values(10,'test02','2020-10-11');
insert into t1 values(20,'test03','2020-10-12');
drop table t2;
create table t2( id int,name varchar(30));
insert into t2 values(1,'test01');
insert into t2 values(10,'test02');
insert into t2 values(20,'test03');
insert into t2 values(1,'test04');
insert into t2 values(20,'test03');
drop table t3;
create table t3( id int,name varchar(30));
insert into t3 values(1,'test01');
DROP PROCEDURE p_test01;
CREATE  PROCEDURE p_test01()
begin
declare i int;
set i=1;
while (select 5 from (select * from t3) a)>=i DO
update t1 set name = ((select name from t2 where id =10)) where t1.id =20;
set i = i + 1;
end WHILE;
end;
//
输出的信息数量ob和mysql不一样
call p_test01();
select * from t1 order by id;
id	name	t
1	test01	2020-10-10
10	test02	2020-10-11
20	test02	2020-10-12
DROP PROCEDURE p_test01;
CREATE  PROCEDURE p_test01()
begin
declare i int;
declare c varchar(20);
set i=1;
set @b=(select id from t3);
set c=(select id from t3 where exists(select id from t2));
while i>=(select id from t3 where exists(select id from t2)) and i<=10 DO
select @b;
select (select 'xiaolai');
set i = i + (select 1);
end WHILE;
select c;
select (select date('2010-12-1'));
insert into t1 values((select 1),(select UPPER('test')),(select date('2011-11-1')));
update t1 set id=(select id from t3),name=(select name from t2 where id=10),t=(select date('2010-11-11'));
end;
//
call p_test01();
@b
(select 'xiaolai')
@b
(select 'xiaolai')
@b
(select 'xiaolai')
@b
(select 'xiaolai')
@b
(select 'xiaolai')
@b
(select 'xiaolai')
@b
(select 'xiaolai')
@b
(select 'xiaolai')
@b
(select 'xiaolai')
@b
(select 'xiaolai')
c
(select date('2010-12-1'))
1
xiaolai
1
xiaolai
1
xiaolai
1
xiaolai
1
xiaolai
1
xiaolai
1
xiaolai
1
xiaolai
1
xiaolai
1
xiaolai
1
2010-12-01
select * from t1 order by id;
id	name	t
1	test02	2010-11-11
1	test02	2010-11-11
1	test02	2010-11-11
1	test02	2010-11-11
DROP PROCEDURE p_test01;
CREATE  PROCEDURE p_test01()
begin
declare i int;
set i=1;
while i<= (with temp as (select * from t3) select id from temp) DO
update t1 set name = ((select name from t2 where id =10)) where t1.id =20;
set i = i + 1;
end WHILE;
end;
//
call p_test01();
if表达式
drop table t1;
create table t1( id int,name varchar(30),t date);
insert into t1 values(1,'test01','2020-10-10');
insert into t1 values(10,'test02','2020-10-11');
insert into t1 values(20,'test03','2020-10-12');
drop table t2;
create table t2( id int,name varchar(30),t date);
insert into t2 values(1,'test01','2020-10-10');
insert into t2 values(10,'test02','2020-10-20');
insert into t2 values(20,'test03','2021-03-04');
insert into t2 values(1,'test04','2015-04-15');
insert into t2 values(20,'test03',null);
drop table t3;
create table t3( id int,name varchar(30));
insert into t3 values(1,'test01');
DROP PROCEDURE p_test01;
CREATE  PROCEDURE p_test01(in a int)
begin
declare i int;
declare b int;
set i=10;
select a into b;
if i = a then
select b;
insert into t1 values(a,(select name from t3),(select date('2011-11-1')));
update t1 set id=a,name=(select 'test10'),t=(select t from t2 where t='2015-04-15') where id in(a);
elseif i >a then
select (b+1);
insert into t1 values((a+(select 1)),(select name from t3),(select date('2011-11-2')));
update t1 set id=a,name=(select 'test11'),t=(select t from t2 where t='2015-04-15') where id in(a);
else 
select (b+2);
insert into t1 values(a+2,(select name from t3),(select date('2011-11-3')));
update t1 set id=a,name=(select 'test12'),t=(select t from t2 where t='2015-04-15') where id in(a);
end if;
end;
//
CALL p_test01((select 10));
b
10
select * from t1 order by id;
id	name	t
1	test01	2020-10-10
10	test10	2015-04-15
10	test10	2015-04-15
20	test03	2020-10-12
CALL p_test01((select id from t3 where id in(select id from t2 where id=1)));
(b+1)
2
select * from t1 order by id;
id	name	t
1	test11	2015-04-15
2	test01	2011-11-02
10	test10	2015-04-15
10	test10	2015-04-15
20	test03	2020-10-12
CALL p_test01((select id from t1 where exists(select id from t2 where name='test01')));
ERROR 21000: Subquery returns more than 1 row
drop table t1;
create table t1( id int,name varchar(30),t date);
insert into t1 values(1,'test01','2020-10-10');
insert into t1 values(10,'test02','2020-10-11');
insert into t1 values(20,'test03','2020-10-12');
CALL p_test01((select id from t3 where exists(select id from t2 where name='test01')));
(b+1)
2
CALL p_test01((select id from t2 where id=10));
b
10
CALL p_test01((select id from t3));
(b+1)
2
输出的信息数量ob和mysql不一样
CALL p_test01((select id from t3 order by id));
(b+1)
2
select * from t1 order by id;
id	name	t
1	test11	2015-04-15
2	test01	2011-11-02
2	test01	2011-11-02
2	test01	2011-11-02
10	test10	2015-04-15
10	test10	2015-04-15
20	test03	2020-10-12
CALL p_test01((select count(*)*2 from t2 ));
b
10
select * from t1 order by id;
id	name	t
1	test11	2015-04-15
2	test01	2011-11-02
2	test01	2011-11-02
2	test01	2011-11-02
10	test10	2015-04-15
10	test10	2015-04-15
10	test10	2015-04-15
20	test03	2020-10-12
CALL p_test01((select sum(id)-48 from t2 ));
(b+1)
5
select * from t1 order by id;
id	name	t
1	test11	2015-04-15
2	test01	2011-11-02
2	test01	2011-11-02
2	test01	2011-11-02
5	test01	2011-11-02
10	test10	2015-04-15
10	test10	2015-04-15
10	test10	2015-04-15
20	test03	2020-10-12
CALL p_test01((select avg(id) from t2 ));
b
10
select * from t1 order by id;
id	name	t
1	test11	2015-04-15
2	test01	2011-11-02
2	test01	2011-11-02
2	test01	2011-11-02
5	test01	2011-11-02
10	test10	2015-04-15
10	test10	2015-04-15
10	test10	2015-04-15
10	test10	2015-04-15
20	test03	2020-10-12
CALL p_test01((select avg(id) from t2 group by id having avg(id)<1));
(b+2)
NULL
CALL p_test01((select avg(id) from t3 where id like '%1'));
(b+1)
2
select * from t1 order by id;
id	name	t
NULL	test01	2011-11-03
1	test11	2015-04-15
2	test01	2011-11-02
2	test01	2011-11-02
2	test01	2011-11-02
2	test01	2011-11-02
5	test01	2011-11-02
10	test10	2015-04-15
10	test10	2015-04-15
10	test10	2015-04-15
10	test10	2015-04-15
20	test03	2020-10-12
CALL p_test01((select name from t3));
ERROR HY000: Incorrect integer value
比较from子查询没有别名，ob不报错，mysql报错
CALL p_test01((select * from (select id from t3)));
(b+1)
2
drop table t1;
create table t1( id int,name varchar(30),t date);
insert into t1 values(1,'test01','2020-10-10');
insert into t1 values(10,'test02','2020-10-11');
insert into t1 values(20,'test03','2020-10-12');
CALL p_test01((select * from (select id from t3) a));
(b+1)
2
CALL p_test01((select id from t3 where id=1 and name='xiaolai'));
(b+2)
NULL
CALL p_test01((select id from t3 where id=1 or name='xiaolai'));
(b+1)
2
CALL p_test01((select distinct t3.id from t3 left join t2 on t3.id=t2.id));
(b+1)
2
输出的信息数量ob和mysql不一样
CALL p_test01((select t3.id from t3 where id in(1,2,3 )));
(b+1)
2
输出的信息数量ob和mysql不一样
CALL p_test01((select abs(t3.id) from t3 where id in(select id from t2 where t3.id=t2.id )));
(b+1)
2
CALL p_test01((select LENGTH(name) from t2 where id=10));
(b+1)
7
select * from t1 order by id;
id	name	t
NULL	test01	2011-11-03
1	test11	2015-04-15
2	test01	2011-11-02
2	test01	2011-11-02
2	test01	2011-11-02
2	test01	2011-11-02
2	test01	2011-11-02
7	test01	2011-11-02
10	test02	2020-10-11
20	test03	2020-10-12
CALL p_test01((select * from t3));
ERROR 21000: Operand should contain 1 column(s)
CALL p_test01 ((select (case when id =10 then 10 else 5 end ) from t2));
ERROR 21000: Subquery returns more than 1 row
CALL p_test01 ((select (case when id =10 then 10 end) from t3));
(b+2)
NULL
CALL p_test01 ((select (case when id =1 then 5 end) from t3));
(b+1)
6
CALL p_test01 ((with temp as (select * from t3) select id from temp));
(b+1)
2
select * from t1 order by id;
id	name	t
NULL	test01	2011-11-03
NULL	test01	2011-11-03
1	test11	2015-04-15
2	test01	2011-11-02
2	test01	2011-11-02
2	test01	2011-11-02
2	test01	2011-11-02
2	test01	2011-11-02
2	test01	2011-11-02
6	test01	2011-11-02
7	test01	2011-11-02
10	test02	2020-10-11
20	test03	2020-10-12
CALL p_test01 ((select id from t3 where id <=any(select id from t2)));
(b+1)
2
输出的信息数量ob和mysql不一样
CALL p_test01 ((select id from t3 where id >=some(select id from t2)));
(b+1)
2
CALL p_test01 ((select id from t3 where id <all(select id from t2 where id in(select id from t3))));
(b+2)
NULL
drop table t1;
create table t1( id int,name varchar(30),t date);
insert into t1 values(1,'test01','2020-10-10');
insert into t1 values(10,'test02','2020-10-11');
insert into t1 values(20,'test03','2020-10-12');
drop table t2;
create table t2( id int,name varchar(30),t date);
insert into t2 values(1,'test01','2020-10-10');
insert into t2 values(10,'test02','2020-10-20');
insert into t2 values(20,'test03','2021-03-04');
insert into t2 values(1,'test04','2015-04-15');
insert into t2 values(20,'test03',null);
drop table t3;
create table t3( id int,name varchar(30));
insert into t3 values(1,'test01');
DROP PROCEDURE p_test01;
CREATE  PROCEDURE p_test01()
begin
declare i int;
declare b int;
set i=(select 10);
select (select id from t3 ) into b;
if i = ((select 9)+(select 1)) or i= (select id from t3)  then
select b;
insert into t1 values((select 10),(select name from t3),(select date('2011-11-1')));
update t1 set id=(select 10),name=(select 'test10'),t=(select t from t2 where t='2015-04-15') where id in((select 10));
elseif i > (select 10) then
select (b+1);
insert into t1 values(((select 10)+(select 1)),(select name from t3),(select date('2011-11-2')));
update t1 set id=(select 20),name=(select 'test11'),t=(select t from t2 where t='2015-04-15') where id in(select(10));
else 
select (b+2);
insert into t1 values(((select 20)+2),(select name from t3),(select date('2011-11-3')));
update t1 set id=(select+20),name=(select 'test12'),t=(select t from t2 where t='2015-04-15') where id in((select 20));
end if;
end;
//
call p_test01();
b
1
select * from t1 order by id;
id	name	t
1	test01	2020-10-10
10	test10	2015-04-15
10	test10	2015-04-15
20	test03	2020-10-12
DROP PROCEDURE p_test01;
CREATE  PROCEDURE p_test01()
begin
declare i int;
declare b int;
set i=0;
select (select id from t3 ) into b;
if i = (select id from t3 where exists(select id from t2 where name='test01'))  then
select b;
insert into t1 values((select 10),(select name from t3),(select date('2011-11-1')));
update t1 set id=(select 10),name=(select 'test10'),t=(select t from t2 where t='2015-04-15') where id in((select 10));
elseif i > (select id from t3 where exists(select id from t2 where name='test01')) then
select (b+1);
insert into t1 values((select id from t3 where id in(select id from t2 where id=1)),(select name from t3),(select date('2011-11-2')));
update t1 set id=(select 20),name=(select 'test11'),t=(select t from t2 where t='2015-04-15') where id in((select id from t3 where id in(select id from t2 where id=1)));
else 
select (b+2);
insert into t1 values(((select 20)+2),(select name from t3),(select date('2011-11-3')));
update t1 set id=(select+20),name=(select 'test12'),t=(select t from t2 where t='2015-04-15') where id in(select id from t3 where exists(select id from t2 where name='test01'));
end if;
end;
//
call p_test01();
(b+2)
3
select * from t1 order by id;
id	name	t
10	test10	2015-04-15
10	test10	2015-04-15
20	test12	2015-04-15
20	test03	2020-10-12
22	test01	2011-11-03
DROP PROCEDURE p_test01;
CREATE  PROCEDURE p_test01()
begin
declare i int;
declare b int;
set i=0;
select (select id from t2 ) into b;
if i = 0  then
select b;
insert into t1 values((select 10),(select name from t3),(select date('2011-11-1')));
update t1 set id=(select 10),name=(select 'test10'),t=(select t from t2 where t='2015-04-15') where id in((select 10));
end if;
end;
//
call p_test01();
ERROR 21000: Subquery returns more than 1 row
DROP PROCEDURE p_test01;
CREATE  PROCEDURE p_test01()
begin
declare i int;
declare b int;
set i=0;
select ((select id from t3 order by id)) into b;
if i in ((select id from t3 order by id),(select 2)) then
select b;
insert into t1 values((select id from t3 order by id),(select name from t3),(select date('2011-11-1')));
update t1 set id=(select id from t3 order by id),name=(select 'test10'),t=(select t from t2 where t='2015-04-15') where id in((select id from t3 order by id));
end if;
end;
//
call p_test01();
select * from t1 order by id;
id	name	t
10	test10	2015-04-15
10	test10	2015-04-15
20	test12	2015-04-15
20	test03	2020-10-12
22	test01	2011-11-03
DROP PROCEDURE p_test01;
CREATE  PROCEDURE p_test01()
begin
declare i int;
set i=10;
select ((select count(*)*2 from t2)) into @b;
if exists ((select count(*)*2 from t2 )) or i>(select count(*)*2 from t2) then
select @b;
insert into t1 values(1,(select name from t3),(select date('2011-11-1')));
update t1 set id=(select id from t3 order by id),name=(select 'test10'),t=(select t from t2 where t='2015-04-15') where exists(select count(*)*2 from t2);
end if;
end;
//
call p_test01();
@b
10
select * from t1 order by id;
id	name	t
1	test10	2015-04-15
1	test10	2015-04-15
1	test10	2015-04-15
1	test10	2015-04-15
1	test10	2015-04-15
1	test10	2015-04-15
DROP PROCEDURE p_test01;
CREATE  PROCEDURE p_test01()
begin
declare i int;
set i=10;
select ((select count(*)*2 from t2)) into @b;
if i >= (select distinct t3.id from t3 left join t2 on t3.id=t2.id) then
select @b;
insert into t1 values((select distinct t3.id from t3 left join t2 on t3.id=t2.id),(select name from t3),(select date('2011-11-1')));
update t1 set id=(select distinct t3.id from t3 left join t2 on t3.id=t2.id),name=(select 'test10'),t=(select t from t2 where t='2015-04-15') where exists(select count(*)*2 from t2);
end if;
end;
//
call p_test01();
@b
10
select * from t1 order by id;
id	name	t
1	test10	2015-04-15
1	test10	2015-04-15
1	test10	2015-04-15
1	test10	2015-04-15
1	test10	2015-04-15
1	test10	2015-04-15
1	test10	2015-04-15
DROP PROCEDURE p_test01;
CREATE  PROCEDURE p_test01()
begin
declare i int;
set i=6;
select (select * from (select id from t3) a) into @b;
if i = (select * from (select id from t3) a) then
select @b;
insert into t1 values((select * from (select id from t3) a),(select name from t3),(select date('2011-11-1')));
update t1 set id=(select distinct t3.id from t3 left join t2 on t3.id=t2.id),name=(select 'test10'),t=(select t from t2 where t='2015-04-15') where id =(select * from (select id from t3) a);
end if;
end;
//
call p_test01();
select * from t1 order by id;
id	name	t
1	test10	2015-04-15
1	test10	2015-04-15
1	test10	2015-04-15
1	test10	2015-04-15
1	test10	2015-04-15
1	test10	2015-04-15
1	test10	2015-04-15
DROP PROCEDURE p_test01;
CREATE  PROCEDURE p_test01()
begin
declare i int;
set i=6;
select (select id from t3 where id <=any(select id from t2)) into @b;
if (select id from t3 where id <=any(select id from t2))<i then
select @b;
insert into t1 values((select id from t3 where id <=any(select id from t2)),(select name from t3),(select date('2011-11-1')));
update t1 set id=(select id from t3 where id <=any(select id from t2)),name=(select 'test10'),t=(select t from t2 where t='2015-04-15') where id =(select id from t3 where id <=any(select id from t2));
end if;
end;
//
输出的信息数量ob和mysql不一样 
call p_test01();
@b
1
select * from t1 order by id;
id	name	t
1	test10	2015-04-15
1	test10	2015-04-15
1	test10	2015-04-15
1	test10	2015-04-15
1	test10	2015-04-15
1	test10	2015-04-15
1	test10	2015-04-15
1	test10	2015-04-15
DROP PROCEDURE p_test01;
CREATE  PROCEDURE p_test01()
begin
declare i int;
set i=6;
select (select * from (select id from t3) a) into @b;
if i = (select * from (select id from t3) a) then
select @b;
insert into t1 values((select * from (select id from t3) a),(select name from t3),(select date('2011-11-1')));
update t1 set id=(select distinct t3.id from t3 left join t2 on t3.id=t2.id),name=(select 'test10'),t=(select t from t2 where t='2015-04-15') where id =(select * from (select id from t3) a);
end if;
end;
//
call p_test01();
select * from t1 order by id;
id	name	t
1	test10	2015-04-15
1	test10	2015-04-15
1	test10	2015-04-15
1	test10	2015-04-15
1	test10	2015-04-15
1	test10	2015-04-15
1	test10	2015-04-15
1	test10	2015-04-15
DROP PROCEDURE p_test01;
CREATE  PROCEDURE p_test01()
begin
declare i int;
set i=1;
if i=(select id from t3 group by id) then
insert into t1 values((select id from t3 group by id),(select name from t3),(select date('2011-11-1')));
update t1 set id=(select id from t3 group by id),name=(select 'test10'),t=(select t from t2 where t='2015-04-15') where id =(select id from t3 group by id);
end if;
end;
//
call p_test01();
select * from t1 order by id;
id	name	t
1	test10	2015-04-15
1	test10	2015-04-15
1	test10	2015-04-15
1	test10	2015-04-15
1	test10	2015-04-15
1	test10	2015-04-15
1	test10	2015-04-15
1	test10	2015-04-15
1	test10	2015-04-15
DROP PROCEDURE p_test01;
CREATE  PROCEDURE p_test01()
begin
declare i int;
set i=1;
if i<=(select id from t2 WHERE name ='test02'group by id,t) then
insert into t1 values((select id from t2 WHERE name ='test02'group by id,t),(select name from t3),(select date('2011-11-1')));
update t1 set id=(select id from t3 group by id),name=(select 'test10'),t=(select t from t2 where t='2015-04-15') where id =(select id from t3 group by id);
end if;
end;
//
call p_test01();
select * from t1 order by id;
id	name	t
1	test10	2015-04-15
1	test10	2015-04-15
1	test10	2015-04-15
1	test10	2015-04-15
1	test10	2015-04-15
1	test10	2015-04-15
1	test10	2015-04-15
1	test10	2015-04-15
1	test10	2015-04-15
10	test01	2011-11-01
create or replace view vt3 as select * from t3;
DROP PROCEDURE p_test01;
CREATE  PROCEDURE p_test01()
begin
declare i int;
set i=1;
if i<=(select id from vt3) then
insert into t1 values((select id from vt3),(select name from t3),(select date('2011-11-1')));
update t1 set id=(select id from vt3),name=(select 'test10'),t=(select t from t2 where t='2015-04-15') where id =(select id from vt3);
end if;
end;
//
--echo 输出的信息数量ob和mysql不一样 
call p_test01();
select * from t1 order by id;
id	name	t
1	test10	2015-04-15
1	test10	2015-04-15
1	test10	2015-04-15
1	test10	2015-04-15
1	test10	2015-04-15
1	test10	2015-04-15
1	test10	2015-04-15
1	test10	2015-04-15
1	test10	2015-04-15
1	test10	2015-04-15
10	test01	2011-11-01
DROP PROCEDURE p_test01;
CREATE  PROCEDURE p_test01(out a int)
begin
set a =(select LENGTH(name) from t2 where id=10);
insert into t1 values(a,(select name from t3),(select date('2011-11-1')));
update t1 set id=a,name=(select 'test10'),t=(select t from t2 where t='2015-04-15') where id =a;	 
end;
//
call p_test01(@a);
select @a;
@a
6
select * from t1 order by id;
id	name	t
1	test10	2015-04-15
1	test10	2015-04-15
1	test10	2015-04-15
1	test10	2015-04-15
1	test10	2015-04-15
1	test10	2015-04-15
1	test10	2015-04-15
1	test10	2015-04-15
1	test10	2015-04-15
1	test10	2015-04-15
6	test10	2015-04-15
10	test01	2011-11-01
DROP PROCEDURE p_test01;
CREATE  PROCEDURE p_test01(out b int)
begin
declare i int default (select 1);
select i;
select (select id from(select * from t2  where id=10) c ) into b;
select b;	
end;
//
call p_test01(@b);
i
b
1
10
select @b;
@b
10
DROP PROCEDURE p_test01;
create procedure p_test01()
begin
declare i int default (select 0 from (select *from t3 group by id) d);
repeat
insert into t1 values((select 1),(select 'test'),(select distinct t from t2 where t='2021-03-04'));
set i=i+(select 1);
until i>(select 5 from (select *from t3 group by id) e)
end repeat;
end;
//
call p_test01();
DROP PROCEDURE p_test01;
create procedure p_test01(in a int,out b int)
begin
declare i int default 0;
loop_label: loop
update t1 set id =a where id between (select 1) and (select 10 from (select* from t2)c);
set i=i+1;
if i>=lenth(concat((select name from t3),'l')) and exists(select * from t2 where id=10) then
set b=(select sum(id) from t2 where id>1 and name in((select "test03"),(select "test02")));
leave loop_label;
end if;
end loop;
end;//
call p_test01((select 6),@b);
ERROR 21000: Subquery returns more than 1 row
DROP PROCEDURE p_test01;
create procedure p_test01(in a int,out b int)
begin
declare i int default 0;
loop_label: loop
update t1 set id =a where id between (select 1) and (select 10 from (select* from t3)c);
set i=i+1;
if i>=length(concat((select name from t3),'l')) and exists(select * from t2 where id=10) then
set b=(select sum(id) from t2 where id>1 and name in((select "test03"),(select "test02")));
leave loop_label;
end if;
end loop;
end;//
call p_test01((select 6),@b);
SELECT @b;
@b
50
字符型
drop table t1;
create table t1( id int,name varchar(30),t date);
insert into t1 values(1,'test01','2020-10-10');
insert into t1 values(10,'test02','2020-10-11');
insert into t1 values(20,'test03','2020-10-12');
drop table t2;
create table t2( id int,name varchar(30),t date);
insert into t2 values(1,'test01','2020-10-10');
insert into t2 values(10,'test02','2020-10-20');
insert into t2 values(20,'test03','2021-03-04');
insert into t2 values(1,'test04','2015-04-15');
insert into t2 values(20,'test03',null);
drop table t3;
create table t3( id int,name varchar(30),t date);
insert into t3 values(1,'test01','2021-03-04');
DROP PROCEDURE p_test01;
CREATE  PROCEDURE p_test01(in a varchar(30))
begin
declare i int;
declare b varchar(30);
declare c varchar(30);
set c=a;
set i=1;
set @d=a;
select a into b;
while i <= (select 5) DO
if a=(select name from t3 where exists(select name from t2)) then
insert into t1(name) values(a);
else
update t1 set name =(a) where id =1;
end if;
set i = i + 1;
end WHILE;
select a;
end;
//
CALL p_test01((select 'test'));
a
test
select * from t1 order by id;
id	name	t
1	test	2020-10-10
10	test02	2020-10-11
20	test03	2020-10-12
CALL p_test01((select name from t3));
a
test01
select * from t1 order by id;
id	name	t
NULL	test01	NULL
NULL	test01	NULL
NULL	test01	NULL
NULL	test01	NULL
NULL	test01	NULL
1	test	2020-10-10
10	test02	2020-10-11
20	test03	2020-10-12
DROP PROCEDURE p_test01;
create procedure p_test01(out b varchar(30))
begin
declare i int default 0;
loop_label: loop
update t1 set name =(select distinct t3.name from t3 inner join t2 on t3.id=t2.id) where name in (select 'test01' from (select* from t3) c);
set i=i+1;
if (select 'test101l')>=concat((select name from t3),'l') and exists(select * from t2) then
set b=(select name from t2 where id>1 and name in((select "test02")));
leave loop_label;
end if;
end loop;
end;//
call p_test01(@b);
select * from t1 order by id;
id	name	t
NULL	test01	NULL
NULL	test01	NULL
NULL	test01	NULL
NULL	test01	NULL
NULL	test01	NULL
1	test	2020-10-10
10	test02	2020-10-11
20	test03	2020-10-12
DROP PROCEDURE p_test01;
create procedure p_test01()
begin
declare i varchar(30) default (select 'test' from (select *from t3 group by id) d);
repeat
insert into t1 values((select 1),(select 'test'),(select distinct t from t2 where t='2021-03-04'));
until i<=(select 'test' from (select *from t3 group by id) e)
end repeat;
end;
//
call p_test01();
日期
drop table t1;
create table t1( id int,name varchar(30),t date);
insert into t1 values(1,'test01','2020-10-10');
insert into t1 values(10,'test02','2020-10-11');
insert into t1 values(20,'test03','2020-10-12');
drop table t2;
create table t2( id int,name varchar(30),t date);
insert into t2 values(1,'test01','2020-10-10');
insert into t2 values(10,'test02','2020-10-20');
insert into t2 values(20,'test03','2021-03-04');
insert into t2 values(1,'test04','2015-04-15');
insert into t2 values(20,'test03',null);
drop table t3;
create table t3( id int,name varchar(30),t date);
insert into t3 values(1,'test01','2021-03-04');
DROP PROCEDURE p_test01;
CREATE  PROCEDURE p_test01()
begin
declare i int;
set i=(select(date('2010-10-05')));
select i;
end;
//
bug38172580
CALL p_test01();
i
20101005
DROP PROCEDURE p_test01;
CREATE  PROCEDURE p_test01(in a DATE)
begin
declare b varchar(30);
declare c varchar(30);
set c=a;
set @i=1;
select @i;
set @d=a;
select a into b;
while @i <= 5 DO
if a in (select t from t3 where exists(select name from t2)) then
insert into t1(t) values(a);
update t1 set t =(a) where id =1;
select (select t from t3 where exists(select name from t2));
elseif (select '2011-11-11')>a then
insert into t1(t) values(a);
update t1 set name =(a) where id =1;
select ((select date("2012-12-21") from t3));
else
insert into t1(t) values(a);
update t1 set t =(a) where id =1;
select @d;
end if;
set @i = @i + 1;
end WHILE;
select a;
end;
//
CALL p_test01((select t from t3 where exists(select name from t2)));
@i
(select t from t3 where exists(select name from t2))
(select t from t3 where exists(select name from t2))
(select t from t3 where exists(select name from t2))
(select t from t3 where exists(select name from t2))
(select t from t3 where exists(select name from t2))
a
1
2021-03-04
2021-03-04
2021-03-04
2021-03-04
2021-03-04
2021-03-04
DROP PROCEDURE p_test01;
CREATE  PROCEDURE p_test01(in a DATE)
begin
declare b varchar(30);
declare c varchar(30);
set c=a;
set @i=20101005;
select @i;
set @d=a;
select a into b;
while @i <= 20101010 DO
if a = (select (select date('2020-12-12'))) then
insert into t1(t) values(a);
update t1 set t =(a) where id =1;
select (select t from t3 where exists(select name from t2));
elseif (select '2011-11-11')>a then
insert into t1(t) values(a);
update t1 set name =(a) where id =1;
select ((select date("2012-12-21") from t3));
else
insert into t1(t) values(a);
update t1 set t =(a) where id =1;
select @d;
end if;
set @i = @i + 1;
end WHILE;
select a;
end;
//
call p_test01((select (select date('2020-12-12'))));
@i
(select t from t3 where exists(select name from t2))
(select t from t3 where exists(select name from t2))
(select t from t3 where exists(select name from t2))
(select t from t3 where exists(select name from t2))
(select t from t3 where exists(select name from t2))
(select t from t3 where exists(select name from t2))
a
20101005
2021-03-04
2021-03-04
2021-03-04
2021-03-04
2021-03-04
2021-03-04
2020-12-12
call p_test01((select (select date('2011-11-10'))));
@i
((select date("2012-12-21") from t3))
((select date("2012-12-21") from t3))
((select date("2012-12-21") from t3))
((select date("2012-12-21") from t3))
((select date("2012-12-21") from t3))
((select date("2012-12-21") from t3))
a
20101005
2012-12-21
2012-12-21
2012-12-21
2012-12-21
2012-12-21
2012-12-21
2011-11-10
call p_test01((select (select date('2011-11-12'))));
@i
@d
@d
@d
@d
@d
@d
a
20101005
2011-11-12
2011-11-12
2011-11-12
2011-11-12
2011-11-12
2011-11-12
2011-11-12
DROP PROCEDURE p_test01;
create procedure p_test01(out b varchar(30))
begin
declare i date default (select date('2021-03-04')) ;
declare c date;
declare d date;
loop_label: loop
update t1 set name =(select distinct t3.name from t3 inner join t2 on t3.id=t2.id) where name in (select 'test01' from (select* from t3) c);
if i > (with temp as (select * from t3) select t from temp) then
select (with temp as (select * from t3) select t from temp) into b;
select (with temp as (select * from t3) select t from temp);
leave loop_label;
end if;
set i= (select date('2021-03-05'));
select (select (select (select t from t3))),(select (select (select t from t3 where id=2))) into c ,d;
select c;
select d;
end loop;
end;//
call p_test01(@b);
c
d
(with temp as (select * from t3) select t from temp)
2021-03-04
NULL
2021-03-04
select @b;
@b
2021-03-04
select * from t1 order by id;
id	name	t
NULL	NULL	2011-11-12
NULL	NULL	2011-11-12
NULL	NULL	2011-11-12
NULL	NULL	2021-03-04
NULL	NULL	2021-03-04
NULL	NULL	2021-03-04
NULL	NULL	2021-03-04
NULL	NULL	2021-03-04
NULL	NULL	2020-12-12
NULL	NULL	2020-12-12
NULL	NULL	2020-12-12
NULL	NULL	2020-12-12
NULL	NULL	2020-12-12
NULL	NULL	2020-12-12
NULL	NULL	2011-11-10
NULL	NULL	2011-11-10
NULL	NULL	2011-11-10
NULL	NULL	2011-11-10
NULL	NULL	2011-11-10
NULL	NULL	2011-11-10
NULL	NULL	2011-11-12
NULL	NULL	2011-11-12
NULL	NULL	2011-11-12
1	2011-11-10	2011-11-12
10	test02	2020-10-11
20	test03	2020-10-12
DROP PROCEDURE p_test01;
create procedure p_test01()
begin
declare  i int default 0;
repeat 
select (select (case when t =(select date('2021-03-04')) then (select date('2021-03-04')) end) from t3);
until i<=5
end repeat;
end;
//
call p_test01();
(select (case when t =(select date('2021-03-04')) then (select date('2021-03-04')) end) from t3)
2021-03-04
ob_pl_subquery_1_4
drop table t1;
create table t1( id int,name varchar(30),t date) PARTITION BY RANGE(id) (PARTITION p1 VALUES less than(3), PARTITION p2 VALUES less than(10), PARTITION p3 VALUES less than(MAXVALUE));
insert into t1 values(1,'test01','2020-10-10');
insert into t1 values(10,'test02','2020-10-11');
insert into t1 values(20,'test03','2020-10-12');
drop table t2;
create table t2( id int,name varchar(30))PARTITION BY RANGE(id) (PARTITION p1 VALUES less than(3), PARTITION p2 VALUES less than(10), PARTITION p3 VALUES less than(MAXVALUE));
insert into t2 values(1,'test01');
insert into t2 values(10,'test02');
insert into t2 values(20,'test03');
insert into t2 values(1,'test04');
insert into t2 values(20,'test03');
drop table t3;
create table t3( id int,name varchar(30)) PARTITION BY RANGE(id) (PARTITION p1 VALUES less than(3), PARTITION p2 VALUES less than(5), PARTITION p3 VALUES less than(MAXVALUE));
insert into t3 values(1,'test01');
create or replace view vt3 as select * from t3;
DROP PROCEDURE p_test01;
CREATE  PROCEDURE p_test01(in a int,in b int,out c int,out d int)
begin
declare i int default (select id from t3);
declare aa int;
declare bb int;
select i;
select (select id from t3),a into c,d;
while i <=b and not exists(select * from t3 where id =2)DO
if a = (select(select 5)) or b=(select 6) then
insert into t1(id) values(a);
update t1 set id =(a) where id =1;
elseif a>(select(select 5)) and not exists(select * from t3 where id =2) then
insert into t1(id) values(a+1);
update t1 set id=(a+1) where id =1;
select c;
else
insert into t1(id) values(a+2);
update t1 set id =(a+2) where id =1;
select d;
end if;
set i = i + 1;
end WHILE;
end;
//
call p_test01(5,6,@c,@d);
i
1
call p_test01(6,7,@c,@d);
i
c
c
c
c
c
c
c
1
1
1
1
1
1
1
1
call p_test01(4,3,@c,@d);
i
d
d
d
1
4
4
4
call p_test01(4,6,@c,@d);
i
1
select @c,@d;
@c	@d
1	4
select * from t1 order by id;
id	name	t
4	NULL	NULL
4	NULL	NULL
4	NULL	NULL
4	NULL	NULL
4	NULL	NULL
4	NULL	NULL
5	NULL	NULL
5	NULL	NULL
5	test01	2020-10-10
5	NULL	NULL
5	NULL	NULL
5	NULL	NULL
5	NULL	NULL
6	NULL	NULL
6	NULL	NULL
6	NULL	NULL
7	NULL	NULL
7	NULL	NULL
7	NULL	NULL
7	NULL	NULL
7	NULL	NULL
7	NULL	NULL
7	NULL	NULL
10	test02	2020-10-11
20	test03	2020-10-12
drop table t1;
create table t1( id int,name varchar(30),t date)partition by hash(id) partitions 4;
insert into t1 values(1,'test01','2020-10-10');
insert into t1 values(10,'test02','2020-10-11');
insert into t1 values(20,'test03','2020-10-12');
drop table t2;
create table t2( id int,name varchar(30))partition by hash(id) partitions 4;
insert into t2 values(1,'test01');
insert into t2 values(10,'test02');
insert into t2 values(20,'test03');
insert into t2 values(1,'test04');
insert into t2 values(20,'test03');
drop table t3;
create table t3( id int,name varchar(30)) partition by hash(id) partitions 4;
insert into t3 values(1,'test01');
create or replace view  vt3 as select * from t3;
DROP PROCEDURE p_test01;
CREATE  PROCEDURE p_test01(in a int,in b int,out c int,out d int)
begin
declare i int default (select id from vt3);
declare aa int;
declare bb int;
select i;
select (select id from t3),a into c,d;
while i <=b and not exists(select * from vt3 where id =2)DO
if a = (select(select 5)) or b=(select 6) then
insert into t1(id) values(a);
update t1 set id =(a) where id =1;
elseif a>(select(select 5)) and not exists(select * from t3 where id =2) then
insert into t1(id) values(a+1);
update t1 set id=(a+1) where id =1;
select c;
else
insert into t1(id) values(a+2);
update t1 set id =(a+2) where id =1;
select d;
end if;
set i = i + 1;
end WHILE;
end;
//
call p_test01(5,6,@c,@d);
i
1
call p_test01(6,7,@c,@d);
i
c
c
c
c
c
c
c
1
1
1
1
1
1
1
1
call p_test01(4,3,@c,@d);
i
d
d
d
1
4
4
4
call p_test01(4,6,@c,@d);
i
1
select @c,@d;
@c	@d
1	4
select * from t1 order by id;
id	name	t
4	NULL	NULL
4	NULL	NULL
4	NULL	NULL
4	NULL	NULL
4	NULL	NULL
4	NULL	NULL
5	test01	2020-10-10
5	NULL	NULL
5	NULL	NULL
5	NULL	NULL
5	NULL	NULL
5	NULL	NULL
5	NULL	NULL
6	NULL	NULL
6	NULL	NULL
6	NULL	NULL
7	NULL	NULL
7	NULL	NULL
7	NULL	NULL
7	NULL	NULL
7	NULL	NULL
7	NULL	NULL
7	NULL	NULL
10	test02	2020-10-11
20	test03	2020-10-12
drop table t1;
create table t1( id int,name varchar(30),t date)partition by list (id)
(
partition part_1 values in ( 1, 3, 5, 7 ),
partition part_2 values in( 2, 4, 6, 8 ),
partition part_default values in(10,20,30,40,50)
);
insert into t1 values(1,'test01','2020-10-10');
insert into t1 values(10,'test02','2020-10-11');
insert into t1 values(20,'test03','2020-10-12');
drop table t2;
create table t2( id int,name varchar(30))partition by list (id)
(
partition part_1 values in ( 1, 3, 5, 7 ),
partition part_2 values in( 2, 4, 6, 8 ),
partition part_default values in(10,20,30,40,50)
);
insert into t2 values(1,'test01');
insert into t2 values(10,'test02');
insert into t2 values(20,'test03');
insert into t2 values(1,'test04');
insert into t2 values(20,'test03');
drop table t3;
create table t3( id int,name varchar(30)) partition by list (id)
(
partition part_1 values in( 1, 3, 5, 7 ),
partition part_2 values in( 2, 4, 6, 8 ),
partition part_default values in(10,20,30,40,50)
);
insert into t3 values(1,'test01');
create or replace view  vt3 as select * from t3;
DROP PROCEDURE p_test01;
CREATE  PROCEDURE p_test01(in a int,in b int,out c int,out d int)
begin
declare i int default (select id from vt3);
declare aa int;
declare bb int;
select i;
select (select id from t3),a into c,d;
while i <=b and not exists(select * from vt3 where id =2)DO
if a = (select(select 5)) or b=(select 6) then
insert into t1(id) values(a);
update t1 set id =(a) where id =1;
elseif a>(select(select 5)) and not exists(select * from t3 where id =2) then
insert into t1(id) values(a+1);
update t1 set id=(a+1) where id =1;
select c;
else
insert into t1(id) values(a+2);
update t1 set id =(a+2) where id =1;
select d;
end if;
set i = i + 1;
end WHILE;
end;
//
call p_test01(5,6,@c,@d);
i
1
call p_test01(6,7,@c,@d);
i
c
c
c
c
c
c
c
1
1
1
1
1
1
1
1
call p_test01(4,3,@c,@d);
i
d
d
d
1
4
4
4
call p_test01(4,6,@c,@d);
i
1
select @c,@d;
@c	@d
1	4
select * from t1 order by id;
id	name	t
4	NULL	NULL
4	NULL	NULL
4	NULL	NULL
4	NULL	NULL
4	NULL	NULL
4	NULL	NULL
5	NULL	NULL
5	NULL	NULL
5	NULL	NULL
5	test01	2020-10-10
5	NULL	NULL
5	NULL	NULL
5	NULL	NULL
6	NULL	NULL
6	NULL	NULL
6	NULL	NULL
7	NULL	NULL
7	NULL	NULL
7	NULL	NULL
7	NULL	NULL
7	NULL	NULL
7	NULL	NULL
7	NULL	NULL
10	test02	2020-10-11
20	test03	2020-10-12
DROP PROCEDURE p_test01;
CREATE  PROCEDURE p_test01()
begin
case 
when 1 in(select id from t3) 
then select 1;
end case;
end;
//
#bug38104565
call p_test01();
1
1
DROP PROCEDURE p_test01;
CREATE  PROCEDURE p_test01()
begin
create table nt3 as select * from t3;
end;
//
call p_test01();
select * from nt3;
id	name
1	test01
DROP PROCEDURE p_test01;
CREATE  PROCEDURE p_test01()
begin
create or replace view vt2 as select * from t2;
end;
//
call p_test01();
select * from vt2 order by 1,2;
id	name
1	test01
1	test04
10	test02
20	test03
20	test03
DROP PROCEDURE p_test01;
CREATE  PROCEDURE p_test01()
begin
INSERT INTO t2 SELECT * FROM t3;
end;
//
call p_test01();
select * from t2;
id	name
10	test02
20	test03
20	test03
1	test01
1	test04
1	test01
drop table t1;
create table t1( id int,name varchar(30),t date)PARTITION BY RANGE (id) SUBPARTITION BY HASH (id % 4) SUBPARTITIONS 2(
PARTITION p0 VALUES LESS THAN (3000000),
PARTITION p1 VALUES LESS THAN (6000000)
);
insert into t1 values(1,'test01','2020-10-10');
insert into t1 values(10,'test02','2020-10-11');
insert into t1 values(20,'test03','2020-10-12');
create or replace view vt1 as select * from t1;
drop table t2;
create table t2( id int,name varchar(30))PARTITION BY RANGE (id) SUBPARTITION BY HASH (id % 4) SUBPARTITIONS 2(
PARTITION p0 VALUES LESS THAN (3000000),
PARTITION p1 VALUES LESS THAN (6000000)
);
insert into t2 values(1,'test01');
insert into t2 values(10,'test02');
insert into t2 values(20,'test03');
insert into t2 values(1,'test04');
insert into t2 values(20,'test03');
create or replace view  vt2 as select * from t2;
drop table t3;
create table t3( id int,name varchar(30)) partition by hash(id) partitions 4;
insert into t3 values(1,'test01');
create or replace view  vt3 as select * from t3;
DROP PROCEDURE p_test01;
CREATE  PROCEDURE p_test01(in a int,in b int,out c int,out d int)
begin
declare i int default (select id from vt3);
declare aa int;
declare bb int;
select i;
select (select id from vt3),a into c,d;
while i <=b and not exists(select * from vt3 where id =2)DO
if a = (select(select 5)) or b=(select 6) then
insert into vt1(id) values(a);
update vt1 set id =(a) where id =1;
elseif a>(select(select 5)) and not exists(select * from t3 where id =2) then
insert into vt1(id) values(a+1);
update vt1 set id=(a+1) where id =1;
select c;
else
insert into vt1(id) values(a+2);
update vt1 set id =(a+2) where id =1;
select d;
end if;
set i = i + 1;
end WHILE;
end;
//
call p_test01(5,6,@c,@d);
i
1
call p_test01(6,7,@c,@d);
i
c
c
c
c
c
c
c
1
1
1
1
1
1
1
1
call p_test01(4,3,@c,@d);
i
d
d
d
1
4
4
4
call p_test01(4,6,@c,@d);
i
1
select @c,@d;
@c	@d
1	4
select * from vt1 order by id;
id	name	t
4	NULL	NULL
4	NULL	NULL
4	NULL	NULL
4	NULL	NULL
4	NULL	NULL
4	NULL	NULL
5	NULL	NULL
5	test01	2020-10-10
5	NULL	NULL
5	NULL	NULL
5	NULL	NULL
5	NULL	NULL
5	NULL	NULL
6	NULL	NULL
6	NULL	NULL
6	NULL	NULL
7	NULL	NULL
7	NULL	NULL
7	NULL	NULL
7	NULL	NULL
7	NULL	NULL
7	NULL	NULL
7	NULL	NULL
10	test02	2020-10-11
20	test03	2020-10-12
运算符表达式
drop table t1;
create table t1( id int,name varchar(30),t date);
insert into t1 values(1,'test01','2020-10-10');
insert into t1 values(10,'test02','2020-10-11');
insert into t1 values(20,'test03','2020-10-12');
drop table t2;
create table t2( id int,name varchar(30),t date);
insert into t2 values(1,'test01','2020-10-10');
insert into t2 values(10,'test02','2020-10-20');
insert into t2 values(20,'test03','2021-03-04');
insert into t2 values(1,'test04','2015-04-15');
insert into t2 values(20,'test03',null);
drop table t3;
create table t3( id int,name varchar(30),t date);
insert into t3 values(1,'test01','2021-03-04');
drop index ind03 on t3;
create index ind03 on t3(id);
算术运算符
DROP PROCEDURE p_test01;
CREATE  PROCEDURE p_test01()
begin
set @i=(select 1);
end;
//
call p_test01();
DROP PROCEDURE p_test01;
CREATE  PROCEDURE p_test01()
begin
set @i=((select 1)+(select 1));
end;
//
call p_test01();
DROP PROCEDURE p_test01;
CREATE  PROCEDURE p_test01()
begin
set @i=((select 2)>(select 1));
select (((select 2)>(select 1)));
end;
//
call p_test01();
(((select 2)>(select 1)))
1
DROP PROCEDURE p_test01;
CREATE  PROCEDURE p_test01()
begin
set @i=((select 2) and (select 0));
select (((select 2)and (select 1)));
end;
//
call p_test01();
(((select 2)and (select 1)))
1
DROP PROCEDURE p_test01;
CREATE  PROCEDURE p_test01()
begin
set @i=((select 2) div (select 0));
select (((select 2) div (select 1)));
end;
//
call p_test01();
(((select 2) div (select 1)))
2
DROP PROCEDURE p_test01;
CREATE  PROCEDURE p_test01()
begin
set @i=((select 2) - (select 0));
select (((select 2) - (select 1)));
end;
//
call p_test01();
(((select 2) - (select 1)))
1
DROP PROCEDURE p_test01;
CREATE  PROCEDURE p_test01()
begin
set @i=((select 2) * (select 0));
select (((select 2) * (select 1)));
end;
//
call p_test01();
(((select 2) * (select 1)))
2
DROP PROCEDURE p_test01;
CREATE  PROCEDURE p_test01()
begin
set @i=((select 2) / (select 0));
select (((select 2) / (select 1)));
end;
//
call p_test01();
(((select 2) / (select 1)))
2.0000
DROP PROCEDURE p_test01;
CREATE  PROCEDURE p_test01()
begin
set @i=((select 2) mod (select 0));
select (((select 2) mod (select 1)));
end;
//
call p_test01();
(((select 2) mod (select 1)))
0
位运算符
DROP PROCEDURE p_test01;
CREATE  PROCEDURE p_test01()
begin
set @i=((select 2) & (select 0));
select (((select 2) & (select 1)));
end;
//
call p_test01();
(((select 2) & (select 1)))
0
DROP PROCEDURE p_test01;
CREATE  PROCEDURE p_test01()
begin
set @i=((select 2) | (select 0));
select (((select 2) | (select 1)));
end;
//
call p_test01();
(((select 2) | (select 1)))
3
DROP PROCEDURE p_test01;
CREATE  PROCEDURE p_test01()
begin
set @i=((select 2) ^(select 0));
select (((select 2) ^ (select 1)));
end;
//
call p_test01();
(((select 2) ^ (select 1)))
3
DROP PROCEDURE p_test01;
CREATE  PROCEDURE p_test01()
begin
set @i=((select 2) >>(select 0));
select (((select 2) >> (select 1)));
end;
//
call p_test01();
(((select 2) >> (select 1)))
1
DROP PROCEDURE p_test01;
CREATE  PROCEDURE p_test01()
begin
set @i=((select 2) <<(select 0));
select (((select 2) << (select 1)));
end;
//
call p_test01();
(((select 2) << (select 1)))
4
比较运算符
DROP PROCEDURE p_test01;
CREATE  PROCEDURE p_test01()
begin
set @i=((select 2)<=>(select 0));
select (((select 2) <=> (select 1)));
end;
//
call p_test01();
(((select 2) <=> (select 1)))
0
DROP PROCEDURE p_test01;
CREATE  PROCEDURE p_test01()
begin
set @i=((select 2)=(select 0));
select ((select 2) = (select 1));
end;
//
call p_test01();
((select 2) = (select 1))
0
DROP PROCEDURE p_test01;
CREATE  PROCEDURE p_test01()
begin
set @i=((select 2)!=(select 0));
select ((select 2)!= (select 1));
end;
//
call p_test01();
((select 2)!= (select 1))
1
DROP PROCEDURE p_test01;
CREATE  PROCEDURE p_test01()
begin
set @i=((select 2)>=(select 0));
select (((select 2)>= (select 1)));
end;
//
call p_test01();
(((select 2)>= (select 1)))
1
DROP PROCEDURE p_test01;
CREATE  PROCEDURE p_test01()
begin
set @i=((select 2)<=(select 0));
select (((select 2)<=(select 1)));
end;
//
call p_test01();
(((select 2)<=(select 1)))
0
DROP PROCEDURE p_test01;
CREATE  PROCEDURE p_test01()
begin
set @i=((select 2)<(select 0));
select (((select 2)<(select 1)));
end;
//
call p_test01();
(((select 2)<(select 1)))
0
DROP PROCEDURE p_test01;
CREATE  PROCEDURE p_test01()
begin
set @i=(select 1 in(select 1));
select (select 1 in(select 1));
end;
//
call p_test01();
(select 1 in(select 1))
1
DROP PROCEDURE p_test01;
CREATE  PROCEDURE p_test01()
begin
set @i=(select 1 not between (select 1) and (select 2));
select (select 1 in(select 1));
end;
//
call p_test01();
(select 1 in(select 1))
1
DROP PROCEDURE p_test01;
CREATE  PROCEDURE p_test01()
begin
set @i=(select (SELECT 'ab%' LIKE 'abc%' ESCAPE 'c'));
select (select (SELECT 'ab%' LIKE 'abc%' ESCAPE 'c'));
end;
//
call p_test01();
(select (SELECT 'ab%' LIKE 'abc%' ESCAPE 'c'))
1
DROP PROCEDURE p_test01;
CREATE  PROCEDURE p_test01()
begin
if (select (SELECT 'ab%' LIKE 'abc%' ESCAPE 'c')) then
select (select (SELECT 'ab%' LIKE 'abc%' ESCAPE 'c'));
end if;
end;
//
call p_test01();
(select (SELECT 'ab%' LIKE 'abc%' ESCAPE 'c'))
1
DROP PROCEDURE p_test01;
CREATE  PROCEDURE p_test01()
begin
declare i int default ((select 2)>(select 0));
while ((select 2)>(select 0)) and i<=1 do
select (select (SELECT 'ab%' LIKE 'abc%' ESCAPE 'c'));
set i=i+1;
end while;
end;
//
call p_test01();
(select (SELECT 'ab%' LIKE 'abc%' ESCAPE 'c'))
1
DROP PROCEDURE p_test01;
CREATE  PROCEDURE p_test01()
begin
declare i int default (select 1 in(select 1));
repeat
select ((select 1 in(select 1)));
set i=i+1;
until i>(select 1 in(select 1)) end repeat;
end;
//
call p_test01();
((select 1 in(select 1)))
1
DROP PROCEDURE p_test01;
CREATE  PROCEDURE p_test01()
begin
declare i int default (select 1 in(select 1));
loop_lable:loop
select ((select 1 in(select 1)));
if i>2 then
leave loop_lable;
elseif i<=2 and ((select 2)!= (select 1))then 
set i=i+1;
end if;
end loop;
end;
//
call p_test01();
((select 1 in(select 1)))
((select 1 in(select 1)))
((select 1 in(select 1)))
1
1
1
逻辑运算符
DROP PROCEDURE p_test01;
CREATE  PROCEDURE p_test01()
begin
declare i int default (SELECT NOT NULL);
set @i=(SELECT NOT NULL);
if (SELECT NOT NULL) then
select (SELECT NOT NULL);
else
select (SELECT NOT NULL);
end if;
end;
//
call p_test01();
(SELECT NOT NULL)
NULL
DROP PROCEDURE p_test01;
CREATE  PROCEDURE p_test01()
begin
declare j int;
declare g int;
declare i int default (SELECT ! (1+1));
set @i=(SELECT ! (1+1));
if (SELECT ! (1+1)) then
select (SELECT ! (1+1));
else
select (SELECT ! (1+1));
end if;
select (SELECT ! (1+1)) into j;
set g=(SELECT ! (1+1));
end;
//
call p_test01();
(SELECT ! (1+1))
0
DROP PROCEDURE p_test01;
CREATE  PROCEDURE p_test01()
begin
declare j int;
declare g int;
declare i int default (SELECT 1 XOR 1 XOR 1);
set @i=(SELECT 1 XOR 1 XOR 1);
if (SELECT 1 XOR 1 XOR 1) then
if (select 0) then
select 1;
elseif (SELECT 1 XOR NULL) then
select 2;
end if;
else
select 3;
end if;
select (SELECT 1 XOR 1 XOR 1) into j;
set g=(SELECT 1 XOR 1 XOR 1);
end;
//
call p_test01();
DROP PROCEDURE p_test01;
CREATE  PROCEDURE p_test01()
begin
declare j datetime;
declare g datetime;
declare i datetime default (SELECT '2008-12-31 23:59:59' + INTERVAL 1 SECOND);
set @a=(SELECT '2008-12-31 23:59:59' + INTERVAL 1 SECOND);
if exists(SELECT '2008-12-31 23:59:59' + INTERVAL 1 SECOND) then
if (select 0) then
select 1;
elseif (SELECT '2008-12-31 23:59:59' + INTERVAL 1 SECOND) then
select 2;
else 
select 3;
end if;
else
select 4;
end if;
select (SELECT '2008-12-31 23:59:59' + INTERVAL 1 SECOND) into j;
set g=(SELECT '2008-12-31 23:59:59' + INTERVAL 1 SECOND);
end;
//
call p_test01();
2
2
DROP PROCEDURE p_test01;
CREATE  PROCEDURE p_test01()
begin
declare j int;
declare g int;
declare i int default ((select 'test') || (select 'test01'));
set @a=((select 'test') || (select 'test01'));
if ((select 'test') || (select 'test01')) then
if (select 0) then
select 1;
elseif ((select 'test') || (select 'test01')) then
select 2;
else 
select 3;
end if;
else
select 4;
end if;
select ((select 'test') || (select 'test01')) into j;
set g=((select 'test') || (select 'test01'));
end;
//
call p_test01();
4
4
Warnings:
Warning	1292	Truncated incorrect DOUBLE value: 'test'
Warning	1292	Truncated incorrect DOUBLE value: 'test01'
Warning	1292	Truncated incorrect DOUBLE value: 'test'
Warning	1292	Truncated incorrect DOUBLE value: 'test01'
函数表达式
drop table t1;
create table t1( id int,name varchar(30),t date);
insert into t1 values(1,'test01','2020-10-10');
insert into t1 values(10,'test02','2020-10-11');
insert into t1 values(20,'test03','2020-10-12');
drop table t2;
create table t2( id int,name varchar(30),t date);
insert into t2 values(1,'test01','2020-10-10');
insert into t2 values(10,'test02','2020-10-20');
insert into t2 values(20,'test03','2021-03-04');
insert into t2 values(1,'test04','2015-04-15');
insert into t2 values(20,'test03',null);
drop table t3;
create table t3( id int,name varchar(30),t date);
insert into t3 values(1,'test01','2021-03-04');
drop index ind03 on t3;
create index ind03 on t3(id);
DROP PROCEDURE p_test01;
CREATE  PROCEDURE p_test01()
begin
declare j int;
declare g int;
declare i int default (SELECT ADDDATE('2021-08-01', INTERVAL 31 DAY));
set @a=(SELECT ADDDATE('2021-08-01', INTERVAL 31 DAY));
if (SELECT ADDDATE('2021-08-01', INTERVAL 31 DAY)) then
if (select 0) then
select 1;
elseif (SELECT ADDDATE('2021-08-01', INTERVAL 31 DAY)) then
select 2;
else 
select 3;
end if;
else
select 4;
end if;
select (SELECT ADDDATE('2021-08-01', INTERVAL 31 DAY)) into j;
set g=(SELECT ADDDATE('2021-08-01', INTERVAL 31 DAY));
end;
//
#38172580
call p_test01();
ERROR 01000: Data truncated for argument
DROP PROCEDURE p_test01;
CREATE  PROCEDURE p_test01()
begin
declare j varchar(20);
declare g varchar(20);
declare i varchar(20) default (SELECT ADDDATE('2021-08-01', INTERVAL 31 DAY));
set @a=(SELECT ADDDATE('2021-08-01', INTERVAL 31 DAY));
if (SELECT ADDDATE('2021-08-01', INTERVAL 31 DAY)) then
if (select 0) then
select 1;
elseif (SELECT ADDDATE('2021-08-01', INTERVAL 31 DAY)) then
select 2;
else 
select 3;
end if;
else
select 4;
end if;
select (SELECT ADDDATE('2021-08-01', INTERVAL 31 DAY)) into j;
set g=(SELECT ADDDATE('2021-08-01', INTERVAL 31 DAY));
end;
//
#38150769
call p_test01();
2
2
DROP PROCEDURE p_test01;
CREATE  PROCEDURE p_test01()
begin
declare j date;
declare g date;
declare i date default (SELECT ADDDATE('2021-08-01', INTERVAL 31 DAY));
set @a=(SELECT ADDDATE('2021-08-01', INTERVAL 31 DAY));
if (SELECT ADDDATE('2021-08-01', INTERVAL 31 DAY)) then
if (select 0) then
select 1;
elseif (SELECT ADDDATE('2021-08-01', INTERVAL 31 DAY)) then
select 2;
else 
select 3;
end if;
else
select 4;
end if;
select (SELECT ADDDATE('2021-08-01', INTERVAL 31 DAY)) into j;
set g=(SELECT ADDDATE('2021-08-01', INTERVAL 31 DAY));
end;
//
#38150769
call p_test01();
2
2
DROP PROCEDURE p_test01;
CREATE  PROCEDURE p_test01()
begin
declare j date;
declare g date;
declare i date default (SELECT CURRENT_DATE());
set @a=(SELECT CURRENT_DATE());
if (SELECT CURRENT_DATE()) then
if (select 0) then
select 1;
elseif (SELECT CURRENT_DATE()) then
select 2;
else 
select 3;
end if;
else
select 4;
end if;
select (SELECT CURDATE()) into j;
set g=(SELECT CURDATE());
end;
//
call p_test01();
2
2
DROP PROCEDURE p_test01;
CREATE  PROCEDURE p_test01()
begin
declare j time;
declare g time;
declare i time default (SELECT CURRENT_TIME(6));
set @a=(SELECT CURRENT_TIME(6));
if (SELECT CURRENT_TIME(6)) then
if (select 0) then
select 1;
elseif (SELECT CURRENT_TIME(6)) then
select 2;
else 
select 3;
end if;
else
select 4;
end if;
select (SELECT CURRENT_TIME(6)) into j;
set g=(SELECT CURRENT_TIME(6));
end;
//
call p_test01();
2
2
DROP PROCEDURE p_test01;
CREATE  PROCEDURE p_test01()
begin
declare j int;
declare g int;
declare i int default (SELECT CURRENT_TIME(6));
set @a=(SELECT CURRENT_TIME(6));
select (SELECT CURRENT_TIME(6)) into j;
set g=(SELECT CURRENT_TIME(6));
end;
//
call p_test01();
DROP PROCEDURE p_test01;
CREATE  PROCEDURE p_test01()
begin
declare j timestamp;
declare g timestamp;
declare i timestamp default (SELECT CURRENT_TIMESTAMP(6));
set @a=(SELECT CURRENT_TIMESTAMP(6));
if (SELECT CURRENT_TIMESTAMP(6)) then
if (select 0) then
select 1;
elseif (SELECT CURRENT_TIMESTAMP(6)) then
select 2;
else 
select 3;
end if;
else
select 4;
end if;
select (SELECT CURRENT_TIMESTAMP(6)) into j;
set g=(SELECT CURRENT_TIMESTAMP(6));
end;
//
call p_test01();
2
2
DROP PROCEDURE p_test01;
CREATE  PROCEDURE p_test01()
begin
declare j date;
declare g date;
declare i date default (SELECT CURRENT_TIMESTAMP(6));
set @a=(SELECT CURRENT_TIMESTAMP(6));
select (SELECT CURRENT_TIMESTAMP(6)) into j;
set g=(SELECT CURRENT_TIMESTAMP(6));
end;
//
call p_test01();
DROP PROCEDURE p_test01;
CREATE  PROCEDURE p_test01()
begin
declare j timestamp;
declare g timestamp;
declare i timestamp default (SELECT DATE_ADD(NOW(), INTERVAL 5 DAY));
set @a=(SELECT DATE_ADD(NOW(), INTERVAL 5 DAY));
select (SELECT DATE_ADD(NOW(), INTERVAL 5 DAY)) into j;
set g=(SELECT DATE_ADD(NOW(), INTERVAL 5 DAY));
if (SELECT DATE_ADD(NOW(), INTERVAL 5 DAY)) then
if (select 0) then
select 1;
elseif (SELECT DATE_ADD(NOW(), INTERVAL 5 DAY)) then
select 2;
else 
select 3;
end if;
else
select 4;
end if;
end;
//
38175489
DROP PROCEDURE p_test01;
CREATE  PROCEDURE p_test01()
begin
declare j date;
declare g date;
declare i date default (SELECT DATE_ADD(NOW(), INTERVAL 5 DAY));
set @a=(SELECT DATE_ADD(NOW(), INTERVAL 5 DAY));
select (SELECT DATE_ADD(NOW(), INTERVAL 5 DAY)) into j;
set g=(SELECT DATE_ADD(NOW(), INTERVAL 5 DAY));
end;
//
call p_test01();
DROP PROCEDURE p_test01;
CREATE  PROCEDURE p_test01()
begin
declare j date;
declare g date;
declare i date default (SELECT CURRENT_TIMESTAMP(6));
set @a=(SELECT CURRENT_TIMESTAMP(6));
select (SELECT CURRENT_TIMESTAMP(6)) into j;
set g=(SELECT CURRENT_TIMESTAMP(6));
end;
//
call p_test01();
DROP PROCEDURE p_test01;
CREATE  PROCEDURE p_test01()
begin
declare j int;
declare g int;
declare i int default (SELECT DATEDIFF('2015-06-19','1994-12-17'));
set @a=(SELECT DATEDIFF('2015-06-19','1994-12-17'));
select (SELECT DATEDIFF('2015-06-19','1994-12-17')) into j;
set g=(SELECT DATEDIFF('2015-06-19','1994-12-17'));
if (SELECT DATEDIFF('2015-06-19','1994-12-17')) then
if (select 0) then
select 1;
elseif (SELECT DATEDIFF('2015-06-19','1994-12-17')) then
select 2;
else 
select 3;
end if;
else
select 4;
end if;
end;
//
38175489
DROP PROCEDURE p_test01;
CREATE  PROCEDURE p_test01()
begin
declare i int;
set i=0;
while (SELECT DATEDIFF('2015-06-19','1994-12-17')) and i<=5 do
select 1;
set i=i+1;
end while;
end;
//
call p_test01();
1
1
1
1
1
1
1
1
1
1
1
1
DROP PROCEDURE p_test01;
CREATE  PROCEDURE p_test01()
begin
declare i int;
set i=0;
REPEAT
select 1;
set i=i+1;
until (SELECT CURRENT_TIME(6)) or i>=5
end REPEAT;
end;
//
call p_test01();
1
1
DROP PROCEDURE p_test01;
CREATE  PROCEDURE p_test01()
begin
declare j time;
declare g time;
declare i time default (SELECT MAKETIME(12,15,30));
set @a=(SELECT MAKETIME(12,15,30));
select (SELECT MAKETIME(12,15,30)) into j;
set g=(SELECT MAKETIME(12,15,30));
if (SELECT MAKETIME(12,15,30)) then
if (select 0) then
select 1;
elseif (SELECT MAKETIME(12,15,30)) then
select 2;
else 
select 3;
end if;
else
select 4;
end if;
end;
//
38175489
DROP PROCEDURE p_test01;
CREATE  PROCEDURE p_test01()
begin
declare i int;
set i=0;
while (SELECT MAKETIME(12,15,30)) and i<=5 do
select 1;
set i=i+1;
end while;
end;
//
call p_test01();
1
1
1
1
1
1
1
1
1
1
1
1
DROP PROCEDURE p_test01;
CREATE  PROCEDURE p_test01()
begin
declare i int;
set i=0;
REPEAT
select 1;
set i=i+1;
until (SELECT MAKETIME(12,15,30)) or i>=5
end REPEAT;
end;
//
call p_test01();
1
1
DROP PROCEDURE p_test01;
CREATE  PROCEDURE p_test01()
begin
declare j int;
declare g int;
declare i int default (SELECT MAKETIME(12,15,30));
set @a=(SELECT CURRENT_TIMESTAMP(6));
select (SELECT CURRENT_TIMESTAMP(6)) into j;
set g=(SELECT CURRENT_TIMESTAMP(6));
end;
//
call p_test01();
ERROR 22003: Out of range value for column
DROP PROCEDURE p_test01;
CREATE  PROCEDURE p_test01()
begin
declare j time;
declare g time;
declare i time default (SELECT MONTH('2008-02-03'));
set @a=(SELECT MONTH('2008-02-03'));
select (SELECT MONTH('2008-02-03')) into j;
set g=(SELECT MONTH('2008-02-03'));
if (SELECT MONTH('2008-02-03')) then
if (select 0) then
select 1;
elseif (SELECT MONTH('2008-02-03')) then
select 2;
else 
select 3;
end if;
else
select 4;
end if;
end;
//
call p_test01();
2
2
DROP PROCEDURE p_test01;
CREATE  PROCEDURE p_test01()
begin
declare i int;
set i=0;
while (SELECT MONTH('2008-02-03')) and i<=5 do
select 1;
set i=i+1;
end while;
end;
//
call p_test01();
1
1
1
1
1
1
1
1
1
1
1
1
DROP PROCEDURE p_test01;
CREATE  PROCEDURE p_test01()
begin
declare i int;
set i=0;
REPEAT
select 1;
set i=i+1;
until (SELECT MONTH('2008-02-03')) or i>=5
end REPEAT;
end;
//
call p_test01();
1
1
DROP PROCEDURE p_test01;
CREATE  PROCEDURE p_test01()
begin
declare j int;
declare g int;
declare i int default (SELECT MONTH('2008-02-03'));
set @a=(SELECT MONTH('2008-02-03'));
select (SELECT MONTH('2008-02-03')) into j;
set g=(SELECT MONTH('2008-02-03'));
end;
//
call p_test01();
DROP PROCEDURE p_test01;
CREATE  PROCEDURE p_test01()
begin
declare j int;
declare g int;
declare i int default (SELECT ASCII('oceanbase'));
set @a=(SELECT ASCII('oceanbase'));
select (SELECT ASCII('oceanbase')) into j;
set g=(SELECT ASCII('oceanbase'));
if (SELECT ASCII('oceanbase')) then
if (select 0) then
select 1;
elseif (SELECT ASCII('oceanbase')) then
select 2;
else 
select 3;
end if;
else
select 4;
end if;
end;
//
call p_test01();
2
2
DROP PROCEDURE p_test01;
CREATE  PROCEDURE p_test01()
begin
declare i int;
set i=0;
while (SELECT ASCII('oceanbase')) and i<=5 do
select 1;
set i=i+1;
end while;
end;
//
call p_test01();
1
1
1
1
1
1
1
1
1
1
1
1
DROP PROCEDURE p_test01;
CREATE  PROCEDURE p_test01()
begin
declare i int;
set i=0;
REPEAT
select 1;
set i=i+1;
until (SELECT ASCII('oceanbase')) or i>=5
end REPEAT;
end;
//
call p_test01();
1
1
DROP PROCEDURE p_test01;
CREATE  PROCEDURE p_test01()
begin
declare j varchar(20);
declare g varchar(20);
declare i varchar(20) default (SELECT ASCII('oceanbase'));
set @a=(SELECT ASCII('oceanbase'));
select (SELECT ASCII('oceanbase')) into j;
set g=(SELECT ASCII('oceanbase'));
end;
//
call p_test01();
DROP PROCEDURE p_test01;
CREATE  PROCEDURE p_test01()
begin
declare j varchar(20);
declare g varchar(20);
declare i varchar(20) default (SELECT ELT(0, 'null1', NULL));
set @a=(SELECT ELT(0, 'null1', NULL));
select (SELECT ELT(0, 'null1', NULL)) into j;
set g=(SELECT ELT(0, 'null1', NULL));
if (SELECT ELT(0, 'null1', NULL)) then
if (select 0) then
select 1;
elseif (SELECT ELT(0, 'null1', NULL)) then
select 2;
else 
select 3;
end if;
else
select 4;
end if;
end;
//
call p_test01();
4
4
DROP PROCEDURE p_test01;
CREATE  PROCEDURE p_test01()
begin
declare i int;
set i=0;
while (SELECT ELT(0, 'null1', NULL)) and i<=5 do
select 1;
set i=i+1;
end while;
end;
//
call p_test01();
DROP PROCEDURE p_test01;
CREATE  PROCEDURE p_test01()
begin
declare i int;
set i=0;
REPEAT
select 1;
set i=i+1;
until (SELECT ELT(0, 'null1', NULL)) or i>=5
end REPEAT;
end;
//
call p_test01();
1
1
1
1
1
1
1
1
1
1
DROP PROCEDURE p_test01;
CREATE  PROCEDURE p_test01()
begin
declare j varchar(20);
declare g varchar(20);
declare i varchar(20) default (SELECT ELT(0, 'null1', NULL));
set @a=(SELECT ELT(0, 'null1', NULL));
select (SELECT ELT(0, 'null1', NULL)) into j;
set g=(SELECT ELT(0, 'null1', NULL));
end;
//
call p_test01();
DROP PROCEDURE p_test01;
CREATE  PROCEDURE p_test01()
begin
declare j int;
declare g int;
declare i int default (select FIELD(NULL, 'null1', NULL));
set @a=(select FIELD(NULL, 'null1', NULL));
select (select FIELD(NULL, 'null1', NULL)) into j;
set g=(select FIELD(NULL, 'null1', NULL));
if (select FIELD(NULL, 'null1', NULL)) then
if (select 0) then
select 1;
elseif (select FIELD(NULL, 'null1', NULL)) then
select 2;
else 
select 3;
end if;
else
select 4;
end if;
end;
//
call p_test01();
4
4
DROP PROCEDURE p_test01;
CREATE  PROCEDURE p_test01()
begin
declare i int;
set i=0;
while (select FIELD(NULL, 'null1', NULL)) and i<=5 do
select 1;
set i=i+1;
end while;
end;
//
call p_test01();
DROP PROCEDURE p_test01;
CREATE  PROCEDURE p_test01()
begin
declare i int;
set i=0;
REPEAT
select 1;
set i=i+1;
until (select FIELD(NULL, 'null1', NULL)) or i>=5
end REPEAT;
end;
//
call p_test01();
1
1
1
1
1
1
1
1
1
1
DROP PROCEDURE p_test01;
CREATE  PROCEDURE p_test01()
begin
declare j varchar(20);
declare g varchar(20);
declare i varchar(20) default (SELECT ELT(0, 'null1', NULL));
set @a=(SELECT ELT(0, 'null1', NULL));
select (SELECT ELT(0, 'null1', NULL)) into j;
set g=(SELECT ELT(0, 'null1', NULL));
end;
//
call p_test01();
DROP PROCEDURE p_test01;
CREATE  PROCEDURE p_test01()
begin
declare j varchar(20);
declare g varchar(20);
declare i varchar(20) default (SELECT ELT(0, 'null1', NULL));
set @a=(SELECT ELT(0, 'null1', NULL));
select (SELECT ELT(0, 'null1', NULL)) into j;
set g=(SELECT ELT(0, 'null1', NULL));
end;
//
call p_test01();
DROP PROCEDURE p_test01;
CREATE  PROCEDURE p_test01()
begin
declare j int;
declare g int;
declare i int default (SELECT CAST(1 AS UNSIGNED) - 2.0);
set @a=(SELECT CAST(1 AS UNSIGNED) - 2.0);
select (SELECT CAST(1 AS UNSIGNED) - 2.0) into j;
set g=(SELECT CAST(1 AS UNSIGNED) - 2.0);
if (select FIELD(NULL, 'null1', NULL)) then
if (select 0) then
select 1;
elseif (SELECT CAST(1 AS UNSIGNED) - 2.0) then
select 2;
else 
select 3;
end if;
else
select 4;
end if;
end;
//
call p_test01();
4
4
DROP PROCEDURE p_test01;
CREATE  PROCEDURE p_test01()
begin
declare i int;
set i=0;
while (SELECT CAST(1 AS UNSIGNED) - 2.0) and i<=5 do
select 1;
set i=i+1;
end while;
end;
//
call p_test01();
1
1
1
1
1
1
1
1
1
1
1
1
DROP PROCEDURE p_test01;
CREATE  PROCEDURE p_test01()
begin
declare i int;
set i=0;
REPEAT
select 1;
set i=i+1;
until (SELECT CAST((SELECT 1) AS UNSIGNED) - 2.0) or i>=5
end REPEAT;
end;
//
call p_test01();
1
1
DROP PROCEDURE p_test01;
CREATE  PROCEDURE p_test01()
begin
declare j varchar(20);
declare g varchar(20);
declare i varchar(20) default (SELECT CAST(1 AS UNSIGNED) - 2.0);
set @a=(SELECT CAST(1 AS UNSIGNED) - 2.0);
select @a;
select (SELECT CAST(1 AS UNSIGNED) - 2.0) into j;
set g=(SELECT CAST(1 AS UNSIGNED) - 2.0);
select g;
end;
//
call p_test01();
@a
g
-1.0
-1.0
DROP PROCEDURE p_test01;
CREATE  PROCEDURE p_test01()
begin
declare j int;
declare g int;
declare i int default (SELECT COS(PI()));
set @a=(SELECT COS(PI()));
select (SELECT COS(PI())) into j;
set g=(SELECT COS(PI()));
if (SELECT COS(PI())) then
if (select 0) then
select 1;
elseif (SELECT COS(PI())) then
select 2;
else 
select 3;
end if;
else
select 4;
end if;
end;
//
call p_test01();
2
2
DROP PROCEDURE p_test01;
CREATE  PROCEDURE p_test01()
begin
declare i int;
set i=0;
while (SELECT COS(PI())) and i<=5 do
select 1;
set i=i+1;
end while;
end;
//
call p_test01();
1
1
1
1
1
1
1
1
1
1
1
1
DROP PROCEDURE p_test01;
CREATE  PROCEDURE p_test01()
begin
declare i int;
set i=0;
REPEAT
select 1;
set i=i+1;
until (SELECT COS((SELECT PI()))) or i>=5
end REPEAT;
end;
//
call p_test01();
1
1
DROP PROCEDURE p_test01;
CREATE  PROCEDURE p_test01()
begin
declare j varchar(20);
declare g varchar(20);
declare i varchar(20) default (SELECT(SELECT COS(PI())));
set @a=(SELECT(COS((SELECT PI()))));
select @a;
select (SELECT COS(PI())) into j;
set g=(SELECT COS(PI()));
select g;
end;
//
call p_test01();
@a
g
-1
-1
DROP PROCEDURE p_test01;
CREATE  PROCEDURE p_test01()
begin
declare j int;
declare g int;
declare i int default (select (select GREATEST((select 2),(select 1))) from t3 where id =1 group by name);
set @a=(select (select GREATEST((select 2),(select 1))) from t3 where id =1 group by name);
select (select (select GREATEST((select 2),(select 1))) from t3 where id =1 group by name) into j;
set g=(select (select GREATEST((select 2),(select 1)))
from t3 where id =1 group by name);
if (select (select GREATEST((select 2),(select 1)))
from t3 where id =1 group by name) then
if (select 0) then
select 1;
elseif (select (select GREATEST((select 2),(select 1)))
from t3 where id =1 group by name) then
select 2;
else 
select 3;
end if;
else
select 4;
end if;
end;
//
call p_test01();
2
2
DROP PROCEDURE p_test01;
CREATE  PROCEDURE p_test01()
begin
declare i int;
set i=0;
while (select (select GREATEST((select 2),(select 1)))
from t3 where id =1 group by name) and i<=5 do
select 1;
set i=i+1;
end while;
end;
//
call p_test01();
1
1
1
1
1
1
1
1
1
1
1
1
DROP PROCEDURE p_test01;
CREATE  PROCEDURE p_test01()
begin
declare i int;
set i=0;
REPEAT
select 1;
set i=i+1;
until (select (select GREATEST((select 2),(select 1)))
from t3 where id =1 group by name) or i>=5
end REPEAT;
end;
//
call p_test01();
1
1
DROP PROCEDURE p_test01;
CREATE  PROCEDURE p_test01()
begin
declare j varchar(20);
declare g varchar(20);
declare i varchar(20) default (select (select GREATEST((select 2),(select 1)))
from t3 where id =1 group by name);
set @a=(select (select GREATEST((select 2),(select 1)))
from t3 where id =1 group by name);
select @a;
select (select (select GREATEST((select 2),(select 1)))
from t3 where id =1 group by name) into j;
set g=(select (select GREATEST((select 2),(select 1)))
from t3 where id =1 group by name);
select g;
end;
//
call p_test01();
@a
g
2
2
DROP PROCEDURE p_test01;
CREATE  PROCEDURE p_test01()
begin
declare j varchar(20);
declare g varchar(20);
declare i varchar(20) default (SELECT CASE (select (CONCAT((select 'A'),(select 'B'))))
WHEN (select CONCAT((select 'AB'),(select ''))) THEN (select 'A') 
WHEN 'B' THEN 'B' END);
set @a=(SELECT CASE (select (CONCAT((select 'A'),(select 'B'))))
WHEN (select CONCAT((select 'AB'),(select ''))) THEN (select 'A') 
WHEN 'B' THEN 'B' END);
select (SELECT CASE (select (CONCAT((select 'A'),(select 'B'))))
WHEN (select CONCAT((select 'AB'),(select ''))) THEN (select 'A') 
WHEN 'B' THEN 'B' END) into j;
set g=(SELECT CASE (select (CONCAT((select 'A'),(select 'B'))))
WHEN (select CONCAT((select 'AB'),(select ''))) THEN (select 'A') 
WHEN 'B' THEN 'B' END);
if (SELECT CASE (select (CONCAT((select 'A'),(select 'B'))))
WHEN (select CONCAT((select 'AB'),(select ''))) THEN (select 'A') 
WHEN 'B' THEN 'B' END) then
if (select 0) then
select 1;
elseif (SELECT CASE (select (CONCAT((select 'A'),(select 'B'))))
WHEN (select CONCAT((select 'AB'),(select ''))) THEN (select 'A') 
WHEN 'B' THEN 'B' END) then
select 2;
else 
select 3;
end if;
else
select 4;
end if;
end;
//
call p_test01();
4
4
DROP PROCEDURE p_test01;
CREATE  PROCEDURE p_test01()
begin
declare i int;
set i=0;
while (SELECT CASE (select (CONCAT((select 'A'),(select 'B'))))
WHEN (select CONCAT((select 'AB'),(select ''))) THEN (select 'A') 
WHEN 'B' THEN 'B' END) and i<=5 do
select 1;
set i=i+1;
end while;
end;
//
call p_test01();
Warnings:
Warning	1292	Truncated incorrect DOUBLE value: 'A'
DROP PROCEDURE p_test01;
CREATE  PROCEDURE p_test01()
begin
declare i int;
set i=0;
REPEAT
select 1;
set i=i+1;
until (SELECT CASE (select (CONCAT((select 'A'),(select 'B'))))
WHEN (select CONCAT((select 'AB'),(select ''))) THEN (select 'A') 
WHEN 'B' THEN 'B' END) or i>=5
end REPEAT;
end;
//
call p_test01();
1
1
1
1
1
1
1
1
1
1
Warnings:
Warning	1292	Truncated incorrect DOUBLE value: 'A'
DROP PROCEDURE p_test01;
CREATE  PROCEDURE p_test01()
begin
declare j varchar(20);
declare g varchar(20);
declare i varchar(20) default (SELECT CASE (select (CONCAT((select 'A'),(select 'B'))))
WHEN (select CONCAT((select 'AB'),(select ''))) THEN (select 'A') 
WHEN 'B' THEN 'B' END);
set @a=(SELECT CASE (select (CONCAT((select 'A'),(select 'B'))))
WHEN (select CONCAT((select 'AB'),(select ''))) THEN (select 'A') 
WHEN 'B' THEN 'B' END);
select @a;
select (SELECT CASE (select (CONCAT((select 'A'),(select 'B'))))
WHEN (select CONCAT((select 'AB'),(select ''))) THEN (select 'A') 
WHEN 'B' THEN 'B' END) into j;
set g=(SELECT CASE (select (CONCAT((select 'A'),(select 'B'))))
WHEN (select CONCAT((select 'AB'),(select ''))) THEN (select 'A') 
WHEN 'B' THEN 'B' END);
select g;
end;
//
call p_test01();
@a
g
A
A
DROP PROCEDURE p_test01;
CREATE  PROCEDURE p_test01()
begin
declare j varchar(20);
declare g varchar(20);
declare i varchar(20) default (SELECT CASE WHEN (SELECT 1)>0 THEN 'TRUE' ELSE 'FALSE' END);
set @a=(SELECT CASE WHEN (SELECT 1)>0 THEN 'TRUE' ELSE 'FALSE' END);
select (SELECT CASE WHEN (SELECT 1)>0 THEN 'TRUE' ELSE 'FALSE' END) into j;
set g=(SELECT CASE WHEN (SELECT 1)>0 THEN 'TRUE' ELSE 'FALSE' END);
if (SELECT CASE WHEN (SELECT 1)>0 THEN TRUE ELSE FALSE END) then
if (select 0) then
select 1;
elseif (SELECT CASE WHEN (SELECT 1)>0 THEN TRUE ELSE FALSE END) then
select 2;
else 
select 3;
end if;
else
select 4;
end if;
end;
//
call p_test01();
2
2
DROP PROCEDURE p_test01;
CREATE  PROCEDURE p_test01()
begin
declare j varchar(20);
declare g varchar(20);
declare i varchar(20) default (IF((1 IN (SELECT 1)), 1,2));
set @a=(IF((1 IN (SELECT 1)), 1,2));
select (IF((1 IN (SELECT 1)), 1,2)) into j;
set g=(IF((1 IN (SELECT 1)), 1,2));
if (IF((1 IN (SELECT 1)), 1,2)) then
if (select 0) then
select 1;
elseif (IF((1 IN (SELECT 1)), 1,2)) then
select 2;
else 
select 3;
end if;
else
select 4;
end if;
end;
//
call p_test01();
2
2
DROP PROCEDURE p_test01;
CREATE  PROCEDURE p_test01()
begin
declare i int;
set i=0;
while (IF((1 IN (SELECT 1)), 1,2)) and i<=5 do
select 1;
set i=i+1;
end while;
end;
//
call p_test01();
1
1
1
1
1
1
1
1
1
1
1
1
DROP PROCEDURE p_test01;
CREATE  PROCEDURE p_test01()
begin
declare i int;
set i=0;
REPEAT
select 1;
set i=i+1;
until (IF((1 IN (SELECT 1)), 1,2)) or i>=5
end REPEAT;
end;
//
call p_test01();
1
1
DROP PROCEDURE p_test01;
CREATE  PROCEDURE p_test01()
begin
declare j varchar(20);
declare g varchar(20);
declare i varchar(20) default (IF((1 IN (SELECT 1)),1,2));
set @a=(IF((1 IN (SELECT 1)), 1,2));
select @a;
select (IF((1 IN (SELECT 1)), 1,2))into j;
set g=(IF((1 IN (SELECT 1)), 1,2));
select g;
end;
//
call p_test01();
@a
g
1
1
DROP PROCEDURE p_test01;
CREATE  PROCEDURE p_test01()
begin
declare j varchar(20);
declare g varchar(20);
declare i varchar(20) default (select IFNULL((select 1), null));
set @a=(select IFNULL((select 1), null));
select (select IFNULL((select 1), null)) into j;
set g=(select IFNULL((select 1), null));
if (select IFNULL((select 1), null)) then
if (select 0) then
select 1;
elseif (select IFNULL((select 1), null)) then
select 2;
else 
select 3;
end if;
else
select 4;
end if;
end;
//
call p_test01();
2
2
DROP PROCEDURE p_test01;
CREATE  PROCEDURE p_test01()
begin
declare i int;
set i=0;
while (select IFNULL((select 1), null)) and i<=5 do
select 1;
set i=i+1;
end while;
end;
//
call p_test01();
1
1
1
1
1
1
1
1
1
1
1
1
DROP PROCEDURE p_test01;
CREATE  PROCEDURE p_test01()
begin
declare i int;
set i=0;
REPEAT
select 1;
set i=i+1;
until (select IFNULL((select NULL+1), null)) or i>=5
end REPEAT;
end;
//
call p_test01();
1
1
1
1
1
1
1
1
1
1
DROP PROCEDURE p_test01;
CREATE  PROCEDURE p_test01()
begin
declare j varchar(20);
declare g varchar(20);
declare i varchar(20) default ORA_DECODE((select 1),(select 1),(select 1));
set @a=(select ORA_DECODE((select 1),(select 1),(select 1)));
select (select ORA_DECODE((select 1),(select 1),(select 1))) into j;
set g=(select ORA_DECODE((select 1),(select 1),(select 1)));
if (select ORA_DECODE((select 1),(select 1),(select 1))) then
if (select 0) then
select 1;
elseif (select ORA_DECODE((select 1),(select 1),(select 1))) then
select 2;
else 
select 3;
end if;
else
select 4;
end if;
end;
//
call p_test01();
2
2
DROP PROCEDURE p_test01;
CREATE  PROCEDURE p_test01()
begin
declare i int;
set i=0;
while (select ORA_DECODE((select 1),(select 1),(select 1))) and i<=5 do
select 1;
set i=i+1;
end while;
end;
//
call p_test01();
1
1
1
1
1
1
1
1
1
1
1
1
DROP PROCEDURE p_test01;
CREATE  PROCEDURE p_test01()
begin
declare i int;
set i=0;
REPEAT
select 1;
set i=i+1;
until (select ORA_DECODE((select 1),(select 1),(select 1))) or i>=5
end REPEAT;
end;
//
call p_test01();
1
1
DROP PROCEDURE p_test01;
CREATE  PROCEDURE p_test01()
begin
declare j varchar(20);
declare g varchar(20);
declare i varchar(20) default (SELECT COALESCE(NULL,NULL,3,4,5));
set @a=(SELECT COALESCE(NULL,NULL,3,4,5));
select (SELECT COALESCE(NULL,NULL,3,4,5)) into j;
set g=(SELECT COALESCE(NULL,NULL,3,4,5));
if (SELECT COALESCE(NULL,NULL,3,4,5)) then
if (select 0) then
select 1;
elseif (SELECT COALESCE(NULL,NULL,3,4,5)) then
select 2;
else 
select 3;
end if;
else
select 4;
end if;
end;
//
call p_test01();
2
2
DROP PROCEDURE p_test01;
CREATE  PROCEDURE p_test01()
begin
declare j varchar(20);
declare g varchar(20);
declare i varchar(20) default (SELECT GROUP_CONCAT((select 1)) FROM t3 GROUP BY id);
set @a=(SELECT GROUP_CONCAT((select 1)) FROM t3 GROUP BY id);
select (SELECT GROUP_CONCAT((select 1)) FROM t3 GROUP BY id) into j;
set g=(SELECT GROUP_CONCAT((select 1)) FROM t3 GROUP BY id);
if (SELECT GROUP_CONCAT((select 1)) FROM t3 GROUP BY id) then
if (select 0) then
select 1;
elseif (SELECT GROUP_CONCAT((select 1)) FROM t3 GROUP BY id) then
select 2;
else 
select 3;
end if;
else
select 4;
end if;
end;
//
call p_test01();
2
2
DROP PROCEDURE p_test01;
CREATE  PROCEDURE p_test01()
begin
declare i int;
set i=0;
while (SELECT GROUP_CONCAT((select 1)) FROM t3 GROUP BY id) and i<=5 do
select 1;
set i=i+1;
end while;
end;
//
call p_test01();
1
1
1
1
1
1
1
1
1
1
1
1
DROP PROCEDURE p_test01;
CREATE  PROCEDURE p_test01()
begin
declare i int;
set i=0;
REPEAT
select 1;
set i=i+1;
until (SELECT GROUP_CONCAT((select 1)) FROM t3 GROUP BY id) or i>=5
end REPEAT;
end;
//
call p_test01();
1
1
DROP PROCEDURE p_test01;
CREATE  PROCEDURE p_test01()
begin
declare i int;
set i=0;
while ((select 'test') || (select 'test01')) and i<=5 do
select 1;
set i=i+1;
end while;
end;
//
call p_test01();
Warnings:
Warning	1292	Truncated incorrect DOUBLE value: 'test'
Warning	1292	Truncated incorrect DOUBLE value: 'test01'
DROP PROCEDURE p_test01;
CREATE  PROCEDURE p_test01()
begin
declare i int;
set i=0;
REPEAT
select 1;
set i=i+1;
until ((select 'test') || (select 'test01')) or i>=5
end REPEAT;
end;
//
call p_test01();
1
1
1
1
1
1
1
1
1
1
Warnings:
Warning	1292	Truncated incorrect DOUBLE value: 'test'
Warning	1292	Truncated incorrect DOUBLE value: 'test01'
hint
drop table t1;
create table t1( id int,name varchar(30),t date);
insert into t1 values(1,'test01','2020-10-10');
insert into t1 values(10,'test02','2020-10-11');
insert into t1 values(20,'test03','2020-10-12');
drop table t2;
create table t2( id int,name varchar(30),t date);
insert into t2 values(1,'test01','2020-10-10');
insert into t2 values(10,'test02','2020-10-20');
insert into t2 values(20,'test03','2021-03-04');
insert into t2 values(1,'test04','2015-04-15');
insert into t2 values(20,'test03',null);
drop table t3;
create table t3( id int,name varchar(30));
insert into t3 values(1,'test01');
drop index ind1 on t3;
create index ind1 on t3(id);
DROP PROCEDURE p_test01;
CREATE  PROCEDURE p_test01()
begin
declare j varchar(20);
declare g varchar(20);
declare i varchar(20) default (SELECT id FROM t3 FORCE INDEX (ind1));
set @a=(SELECT id FROM t3 FORCE INDEX (ind1));
select (SELECT id FROM t3 FORCE INDEX (ind1)) into j;
set g=(SELECT id FROM t3 FORCE INDEX (ind1));
if (SELECT id FROM t3 FORCE INDEX (ind1)) then
if (select 0) then
select 1;
elseif (SELECT id FROM t3 FORCE INDEX (ind1)) then
select 2;
else 
select 3;
end if;
else
select 4;
end if;
end;
//
call p_test01();
2
2
DROP PROCEDURE p_test01;
CREATE  PROCEDURE p_test01()
begin
declare i int;
set i=0;
while (SELECT id FROM t3 FORCE INDEX (ind1)) and i<=5 do
select 1;
set i=i+1;
end while;
end;
//
call p_test01();
1
1
1
1
1
1
1
1
1
1
1
1
DROP PROCEDURE p_test01;
CREATE  PROCEDURE p_test01()
begin
declare i int;
set i=0;
REPEAT
select 1;
set i=i+1;
until (SELECT id FROM t3 FORCE INDEX (ind1)) or i>=5
end REPEAT;
end;
//
call p_test01();
1
1
DROP PROCEDURE p_test01;
CREATE  PROCEDURE p_test01()
begin
declare j varchar(20);
declare g varchar(20);
declare i varchar(20) default (SELECT SQL_NO_CACHE id FROM t3);
set @a=(SELECT SQL_NO_CACHE id FROM t3);
select (SELECT SQL_NO_CACHE id FROM t3) into j;
set g=(SELECT SQL_NO_CACHE id FROM t3);
if (SELECT SQL_NO_CACHE id FROM t3) then
if (select 0) then
select 1;
elseif (SELECT SQL_NO_CACHE id FROM t3) then
select 2;
else 
select 3;
end if;
else
select 4;
end if;
end;
//
call p_test01();
2
2
DROP PROCEDURE p_test01;
CREATE  PROCEDURE p_test01()
begin
declare i int;
set i=0;
while (SELECT SQL_NO_CACHE id FROM t3) and i<=5 do
select 1;
set i=i+1;
end while;
end;
//
call p_test01();
1
1
1
1
1
1
1
1
1
1
1
1
DROP PROCEDURE p_test01;
CREATE  PROCEDURE p_test01()
begin
declare i int;
set i=0;
REPEAT
select 1;
set i=i+1;
until (SELECT SQL_NO_CACHE id FROM t3) or i>=5
end REPEAT;
end;
//
call p_test01();
1
1
DROP PROCEDURE p_test01;
CREATE  PROCEDURE p_test01()
begin
declare j varchar(20);
declare g varchar(20);
declare i varchar(20) default (SELECT SQL_CACHE id FROM t3);
set @a=(SELECT SQL_CACHE id FROM t3);
select (SELECT SQL_CACHE id FROM t3) into j;
set g=(SELECT SQL_CACHE id FROM t3);
if (SELECT SQL_CACHE id FROM t3) then
if (select 0) then
select 1;
elseif (SELECT SQL_CACHE id FROM t3) then
select 2;
else 
select 3;
end if;
else
select 4;
end if;
end;
//
call p_test01();
2
2
DROP PROCEDURE p_test01;
CREATE  PROCEDURE p_test01()
begin
declare i int;
set i=0;
while (SELECT SQL_CACHE id FROM t3) and i<=5 do
select 1;
set i=i+1;
end while;
end;
//
call p_test01();
1
1
1
1
1
1
1
1
1
1
1
1
DROP PROCEDURE p_test01;
CREATE  PROCEDURE p_test01()
begin
declare i int;
set i=0;
REPEAT
select 1;
set i=i+1;
until (SELECT SQL_CACHE id FROM t3) or i>=5
end REPEAT;
end;
//
call p_test01();
1
1
存储过程异常处理
drop table t1;
create table t1( id int primary key,name varchar(30),t date);
insert into t1 values(1,'test01','2020-10-10');
insert into t1 values(10,'test02','2020-10-11');
insert into t1 values(20,'test03','2020-10-12');
drop table t2;
create table t2( id int,name varchar(30),t date);
insert into t2 values(1,'test01','2020-10-10');
insert into t2 values(10,'test02','2020-10-20');
insert into t2 values(20,'test03','2021-03-04');
insert into t2 values(1,'test04','2015-04-15');
insert into t2 values(20,'test03',null);
drop table t3;
create table t3( id int,name varchar(30));
insert into t3 values(1,'test01');
DROP PROCEDURE p_test01;
CREATE  PROCEDURE p_test01()
begin
declare j int;
declare g int;
declare i int default (select avg(t2.id) from t2 left join t1 on t2.id=t2.id);
declare cond_test condition for sqlstate '42S02';
declare continue handler for cond_test
begin
set @a=(select avg(t2.id) from t2 left join t1 on t2.id=t2.id);
select (select avg(t2.id) from t2 left join t1 on t2.id=t2.id) into j;
set g=(select avg(t2.id) from t2 left join t1 on t2.id=t2.id);
if (select avg(t2.id) from t2 left join t1 on t2.id=t2.id) then
if (select 0) then
select 1;
elseif (select avg(t2.id) from t2 left join t1 on t2.id=t2.id) then
while (select avg(t2.id) from t2 left join t1 on t2.id=t2.id) and i<15 do
select 5;
set i=i+1;
end while;
else 
select 3;
end if;
else
select 4;
end if;
end;
drop table t6;
end;
//
call p_test01();
5
5
5
5
5
5
5
5
5
5
drop table t3;
drop table t2;
drop table t1;
drop table t4;
########清空回收站，删除测试数据库，表等 ##########
drop database  IF EXISTS  oblrp;
purge recyclebin;
