#Environmental cleaning
drop user longpy@'%';
create user longpy identified by 'longpy';
grant all on *.* to longpy WITH GRANT OPTION;
drop table if exists t1;
drop table if exists t2;
create table t1(deptno int,dname varchar(20),loc varchar(20));
create table t2(empno int primary key,ename varchar(10),job varchar(9),mgr int,hiredate date,sal int,comm int,deptno int);
insert into t1 values (10,'ACCOUNTING','NEW YORK');
insert into t1 values (20,'RESEARCH','DALLAS');
insert into t1 values (30,'SALES','CHICAGO');
insert into t1 values (40,'OPERATIONS','BOSTON');
insert into t2 values (7369,'SMITH','CLERK',7902,'1980-12-17',800,100,20);
insert into t2 values (7499,'ALLEN','SALESMAN',7698,'1981-2-20',1600,300,30);
insert into t2 values (7521,'WARD','SALESMAN',7698,'1981-2-22',1250,500,30);
insert into t2 values (7566,'JONES','MANAGER',7839,'1981-4-2',2975,358.69,20);
insert into t2 values (7654,'MARTIN','SALESMAN',7698,'1981-9-28',1150,1400,30);
insert into t2 values (7698,'BLAKE','MANAGER',7839,'1981-5-1',2850,-2100,30);
insert into t2 values (7782,'CLARK','MANAGER',7839,'1981-6-9',2550,744.9,10);
insert into t2 values (7788,'SCOTT','ANALYST',7566,'1987-4-13',3000,-200,20);
insert into t2 values (7839,'KING','PRESIDENT',NULL,'1981-11-17',4999,-196.7,10);
insert into t2 values (7844,'TURNER','SALESMAN',7698,'1981-9-8',1500,0,30);
insert into t2 values (7876,'ADAMS','CLERK',7788,'1987-5-13',1100,-99.9,20);
insert into t2 values (7900,'JAMES','CLERK',7698,'1981-12-3',950,-1808,30);
insert into t2 values (7902,'FORD','ANALYST',7566,'1981-12-3',3010,753.9,20);
insert into t2 values (7934,'MILLER','CLERK',7782,'1982-1-23',1300,729,10);
drop trigger if exists p1;//
Warnings:
Note	1360	Trigger does not exist
create trigger p1 before insert on t1 for each row 
begin
declare a int;
declare duplicatekey condition for sqlstate '23000';
declare continue handler for duplicatekey 
begin 
declare b int; 
set b=1; 
insert into t2 values (b,'MILLER','CLERK',7782,'1982-1-23',1300,729,10); 
end;
if new.deptno = 10 and exists(select * from t2 where deptno = 10 and sal > 3000 ) then
insert into t2 values (7934,'MILLER','CLERK',7782,'1982-1-23',1300,729,10);
elseif new.deptno = 20 and exists(select * from t2 where deptno = 20 and sal = 3000) then
insert into t2 values (7956,'SCOTT','ANALYST',7566,'1987-4-13',3000,-200,20);
elseif new.deptno = 30 and exists(select * from t2 where deptno = 30 and sal = 1600) then
insert into t2 values (7632,'ALLEN','SALESMAN',7698,'1981-2-20',1600,300,30);
else
insert into t2 values (7231,'KING','PRESIDENT',NULL,'1981-11-17',4999,-196.7,10);
end if;
end;
//
insert into t1 values (10,'RESEARCH','DALLAS');
insert into t1 values (10,'RESEARCH','DALLAS');
ERROR 23000: Duplicate entry '1' for key 'PRIMARY'
insert into t1 values (20,'RESEARCH','DALLAS');
insert into t1 values (30,'RESEARCH','DALLAS');
insert into t1 values (40,'RESEARCH','DALLAS');
select * from t1 order by 1,2,3;
deptno	dname	loc
10	ACCOUNTING	NEW YORK
10	RESEARCH	DALLAS
20	RESEARCH	DALLAS
20	RESEARCH	DALLAS
30	RESEARCH	DALLAS
30	SALES	CHICAGO
40	OPERATIONS	BOSTON
40	RESEARCH	DALLAS
select * from t2 order by 1,2,3,4;
empno	ename	job	mgr	hiredate	sal	comm	deptno
1	MILLER	CLERK	7782	1982-01-23	1300	729	10
7231	KING	PRESIDENT	NULL	1981-11-17	4999	-197	10
7369	SMITH	CLERK	7902	1980-12-17	800	100	20
7499	ALLEN	SALESMAN	7698	1981-02-20	1600	300	30
7521	WARD	SALESMAN	7698	1981-02-22	1250	500	30
7566	JONES	MANAGER	7839	1981-04-02	2975	359	20
7632	ALLEN	SALESMAN	7698	1981-02-20	1600	300	30
7654	MARTIN	SALESMAN	7698	1981-09-28	1150	1400	30
7698	BLAKE	MANAGER	7839	1981-05-01	2850	-2100	30
7782	CLARK	MANAGER	7839	1981-06-09	2550	745	10
7788	SCOTT	ANALYST	7566	1987-04-13	3000	-200	20
7839	KING	PRESIDENT	NULL	1981-11-17	4999	-197	10
7844	TURNER	SALESMAN	7698	1981-09-08	1500	0	30
7876	ADAMS	CLERK	7788	1987-05-13	1100	-100	20
7900	JAMES	CLERK	7698	1981-12-03	950	-1808	30
7902	FORD	ANALYST	7566	1981-12-03	3010	754	20
7934	MILLER	CLERK	7782	1982-01-23	1300	729	10
7956	SCOTT	ANALYST	7566	1987-04-13	3000	-200	20
drop table if exists t1;
drop table if exists t2;
create table t1(deptno int,dname varchar(20),loc varchar(20));
create table t2(empno int,ename varchar(10),job varchar(9),mgr int,hiredate date,sal int,comm int,deptno int);
insert into t1 values (10,'ACCOUNTING','NEW YORK');
insert into t1 values (20,'RESEARCH','DALLAS');
insert into t1 values (30,'SALES','CHICAGO');
insert into t1 values (40,'OPERATIONS','BOSTON');
insert into t2 values (7369,'SMITH','CLERK',7902,'1980-12-17',800,100,20);
insert into t2 values (7499,'ALLEN','SALESMAN',7698,'1981-2-20',1600,300,30);
insert into t2 values (7521,'WARD','SALESMAN',7698,'1981-2-22',1250,500,30);
insert into t2 values (7566,'JONES','MANAGER',7839,'1981-4-2',2975,358.69,20);
insert into t2 values (7654,'MARTIN','SALESMAN',7698,'1981-9-28',1150,1400,30);
insert into t2 values (7698,'BLAKE','MANAGER',7839,'1981-5-1',2850,-2100,30);
insert into t2 values (7782,'CLARK','MANAGER',7839,'1981-6-9',2550,744.9,10);
insert into t2 values (7788,'SCOTT','ANALYST',7566,'1987-4-13',3000,-200,20);
insert into t2 values (7839,'KING','PRESIDENT',NULL,'1981-11-17',4999,-196.7,10);
insert into t2 values (7844,'TURNER','SALESMAN',7698,'1981-9-8',1500,0,30);
insert into t2 values (7876,'ADAMS','CLERK',7788,'1987-5-13',1100,-99.9,20);
insert into t2 values (7900,'JAMES','CLERK',7698,'1981-12-3',950,-1808,30);
insert into t2 values (7902,'FORD','ANALYST',7566,'1981-12-3',3010,753.9,20);
insert into t2 values (7934,'MILLER','CLERK',7782,'1982-1-23',1300,729,10);
ob_pl_subquery_2_6
# insert触发器 before
drop trigger if exists p1;//
Warnings:
Note	1360	Trigger does not exist
create trigger p1 before insert on t1 for each row
begin
if new.loc = 'NEW YORK' and exists(select * from t1 where deptno = 10) then 
insert into t2 values (1,'MILLER','CLERK',7782,'1982-1-23',1300,729,10);
elseif new.loc = 'DALLAS' and exists(select * from t1 where deptno = 20) then
insert into t2 values (2,'MILLER','CLERK',7782,'1982-1-23',1300,729,10);
elseif new.loc = 'CHICAGO' and exists(select * from t1 where deptno = 30)then
insert into t2 values (3,'MILLER','CLERK',7782,'1982-1-23',1300,729,10);
else
insert into t2 values (7934,'MILLER','CLERK',7782,'1982-1-23',1300,729,10);
end if;
end;
//
select * from t1 order by 1,2,3;
deptno	dname	loc
10	ACCOUNTING	NEW YORK
20	RESEARCH	DALLAS
30	SALES	CHICAGO
40	OPERATIONS	BOSTON
select * from t2 order by 1,2,3;
empno	ename	job	mgr	hiredate	sal	comm	deptno
7369	SMITH	CLERK	7902	1980-12-17	800	100	20
7499	ALLEN	SALESMAN	7698	1981-02-20	1600	300	30
7521	WARD	SALESMAN	7698	1981-02-22	1250	500	30
7566	JONES	MANAGER	7839	1981-04-02	2975	359	20
7654	MARTIN	SALESMAN	7698	1981-09-28	1150	1400	30
7698	BLAKE	MANAGER	7839	1981-05-01	2850	-2100	30
7782	CLARK	MANAGER	7839	1981-06-09	2550	745	10
7788	SCOTT	ANALYST	7566	1987-04-13	3000	-200	20
7839	KING	PRESIDENT	NULL	1981-11-17	4999	-197	10
7844	TURNER	SALESMAN	7698	1981-09-08	1500	0	30
7876	ADAMS	CLERK	7788	1987-05-13	1100	-100	20
7900	JAMES	CLERK	7698	1981-12-03	950	-1808	30
7902	FORD	ANALYST	7566	1981-12-03	3010	754	20
7934	MILLER	CLERK	7782	1982-01-23	1300	729	10
insert into t1 values (40,'OPERATIONS','BOSTON');
select * from t2 order by 1,2,3;
empno	ename	job	mgr	hiredate	sal	comm	deptno
7369	SMITH	CLERK	7902	1980-12-17	800	100	20
7499	ALLEN	SALESMAN	7698	1981-02-20	1600	300	30
7521	WARD	SALESMAN	7698	1981-02-22	1250	500	30
7566	JONES	MANAGER	7839	1981-04-02	2975	359	20
7654	MARTIN	SALESMAN	7698	1981-09-28	1150	1400	30
7698	BLAKE	MANAGER	7839	1981-05-01	2850	-2100	30
7782	CLARK	MANAGER	7839	1981-06-09	2550	745	10
7788	SCOTT	ANALYST	7566	1987-04-13	3000	-200	20
7839	KING	PRESIDENT	NULL	1981-11-17	4999	-197	10
7844	TURNER	SALESMAN	7698	1981-09-08	1500	0	30
7876	ADAMS	CLERK	7788	1987-05-13	1100	-100	20
7900	JAMES	CLERK	7698	1981-12-03	950	-1808	30
7902	FORD	ANALYST	7566	1981-12-03	3010	754	20
7934	MILLER	CLERK	7782	1982-01-23	1300	729	10
7934	MILLER	CLERK	7782	1982-01-23	1300	729	10
insert into t1 values (30,'SALES','CHICAGO');
select * from t2 order by 1,2,3;
empno	ename	job	mgr	hiredate	sal	comm	deptno
3	MILLER	CLERK	7782	1982-01-23	1300	729	10
7369	SMITH	CLERK	7902	1980-12-17	800	100	20
7499	ALLEN	SALESMAN	7698	1981-02-20	1600	300	30
7521	WARD	SALESMAN	7698	1981-02-22	1250	500	30
7566	JONES	MANAGER	7839	1981-04-02	2975	359	20
7654	MARTIN	SALESMAN	7698	1981-09-28	1150	1400	30
7698	BLAKE	MANAGER	7839	1981-05-01	2850	-2100	30
7782	CLARK	MANAGER	7839	1981-06-09	2550	745	10
7788	SCOTT	ANALYST	7566	1987-04-13	3000	-200	20
7839	KING	PRESIDENT	NULL	1981-11-17	4999	-197	10
7844	TURNER	SALESMAN	7698	1981-09-08	1500	0	30
7876	ADAMS	CLERK	7788	1987-05-13	1100	-100	20
7900	JAMES	CLERK	7698	1981-12-03	950	-1808	30
7902	FORD	ANALYST	7566	1981-12-03	3010	754	20
7934	MILLER	CLERK	7782	1982-01-23	1300	729	10
7934	MILLER	CLERK	7782	1982-01-23	1300	729	10
insert into t1 values (10,'ACCOUNTING','NEW YORK');
select * from t2 order by 1,2,3;
empno	ename	job	mgr	hiredate	sal	comm	deptno
1	MILLER	CLERK	7782	1982-01-23	1300	729	10
3	MILLER	CLERK	7782	1982-01-23	1300	729	10
7369	SMITH	CLERK	7902	1980-12-17	800	100	20
7499	ALLEN	SALESMAN	7698	1981-02-20	1600	300	30
7521	WARD	SALESMAN	7698	1981-02-22	1250	500	30
7566	JONES	MANAGER	7839	1981-04-02	2975	359	20
7654	MARTIN	SALESMAN	7698	1981-09-28	1150	1400	30
7698	BLAKE	MANAGER	7839	1981-05-01	2850	-2100	30
7782	CLARK	MANAGER	7839	1981-06-09	2550	745	10
7788	SCOTT	ANALYST	7566	1987-04-13	3000	-200	20
7839	KING	PRESIDENT	NULL	1981-11-17	4999	-197	10
7844	TURNER	SALESMAN	7698	1981-09-08	1500	0	30
7876	ADAMS	CLERK	7788	1987-05-13	1100	-100	20
7900	JAMES	CLERK	7698	1981-12-03	950	-1808	30
7902	FORD	ANALYST	7566	1981-12-03	3010	754	20
7934	MILLER	CLERK	7782	1982-01-23	1300	729	10
7934	MILLER	CLERK	7782	1982-01-23	1300	729	10
insert into t1 values (20,'RESEARCH','DALLAS');
select * from t1 order by 1,2,3;
deptno	dname	loc
10	ACCOUNTING	NEW YORK
10	ACCOUNTING	NEW YORK
20	RESEARCH	DALLAS
20	RESEARCH	DALLAS
30	SALES	CHICAGO
30	SALES	CHICAGO
40	OPERATIONS	BOSTON
40	OPERATIONS	BOSTON
select * from t2 order by 1,2,3;
empno	ename	job	mgr	hiredate	sal	comm	deptno
1	MILLER	CLERK	7782	1982-01-23	1300	729	10
2	MILLER	CLERK	7782	1982-01-23	1300	729	10
3	MILLER	CLERK	7782	1982-01-23	1300	729	10
7369	SMITH	CLERK	7902	1980-12-17	800	100	20
7499	ALLEN	SALESMAN	7698	1981-02-20	1600	300	30
7521	WARD	SALESMAN	7698	1981-02-22	1250	500	30
7566	JONES	MANAGER	7839	1981-04-02	2975	359	20
7654	MARTIN	SALESMAN	7698	1981-09-28	1150	1400	30
7698	BLAKE	MANAGER	7839	1981-05-01	2850	-2100	30
7782	CLARK	MANAGER	7839	1981-06-09	2550	745	10
7788	SCOTT	ANALYST	7566	1987-04-13	3000	-200	20
7839	KING	PRESIDENT	NULL	1981-11-17	4999	-197	10
7844	TURNER	SALESMAN	7698	1981-09-08	1500	0	30
7876	ADAMS	CLERK	7788	1987-05-13	1100	-100	20
7900	JAMES	CLERK	7698	1981-12-03	950	-1808	30
7902	FORD	ANALYST	7566	1981-12-03	3010	754	20
7934	MILLER	CLERK	7782	1982-01-23	1300	729	10
7934	MILLER	CLERK	7782	1982-01-23	1300	729	10
drop trigger if exists p1;//
create trigger p1 before insert on t1 for each row
begin
if new.loc = 'NEW YORK' and exists(select * from t2 where deptno = 10) then 
insert into t2 values (1,'MILLER','CLERK',7782,'1982-1-23',1300,729,10);
elseif new.loc = 'DALLAS' and exists(select * from t2 where deptno = 20) then
insert into t2 values (2,'MILLER','CLERK',7782,'1982-1-23',1300,729,10);
elseif new.loc = 'CHICAGO' and exists(select * from t2 where deptno = 30)then
insert into t2 values (3,'MILLER','CLERK',7782,'1982-1-23',1300,729,10);
else
insert into t2 values (7934,'MILLER','CLERK',7782,'1982-1-23',1300,729,10);
end if;
end;
//
insert into t1 values (40,'OPERATIONS','BOSTON');
select * from t2 order by 1,2,3;
empno	ename	job	mgr	hiredate	sal	comm	deptno
1	MILLER	CLERK	7782	1982-01-23	1300	729	10
2	MILLER	CLERK	7782	1982-01-23	1300	729	10
3	MILLER	CLERK	7782	1982-01-23	1300	729	10
7369	SMITH	CLERK	7902	1980-12-17	800	100	20
7499	ALLEN	SALESMAN	7698	1981-02-20	1600	300	30
7521	WARD	SALESMAN	7698	1981-02-22	1250	500	30
7566	JONES	MANAGER	7839	1981-04-02	2975	359	20
7654	MARTIN	SALESMAN	7698	1981-09-28	1150	1400	30
7698	BLAKE	MANAGER	7839	1981-05-01	2850	-2100	30
7782	CLARK	MANAGER	7839	1981-06-09	2550	745	10
7788	SCOTT	ANALYST	7566	1987-04-13	3000	-200	20
7839	KING	PRESIDENT	NULL	1981-11-17	4999	-197	10
7844	TURNER	SALESMAN	7698	1981-09-08	1500	0	30
7876	ADAMS	CLERK	7788	1987-05-13	1100	-100	20
7900	JAMES	CLERK	7698	1981-12-03	950	-1808	30
7902	FORD	ANALYST	7566	1981-12-03	3010	754	20
7934	MILLER	CLERK	7782	1982-01-23	1300	729	10
7934	MILLER	CLERK	7782	1982-01-23	1300	729	10
7934	MILLER	CLERK	7782	1982-01-23	1300	729	10
insert into t1 values (30,'SALES','CHICAGO');
select * from t2 order by 1,2,3;
empno	ename	job	mgr	hiredate	sal	comm	deptno
1	MILLER	CLERK	7782	1982-01-23	1300	729	10
2	MILLER	CLERK	7782	1982-01-23	1300	729	10
3	MILLER	CLERK	7782	1982-01-23	1300	729	10
3	MILLER	CLERK	7782	1982-01-23	1300	729	10
7369	SMITH	CLERK	7902	1980-12-17	800	100	20
7499	ALLEN	SALESMAN	7698	1981-02-20	1600	300	30
7521	WARD	SALESMAN	7698	1981-02-22	1250	500	30
7566	JONES	MANAGER	7839	1981-04-02	2975	359	20
7654	MARTIN	SALESMAN	7698	1981-09-28	1150	1400	30
7698	BLAKE	MANAGER	7839	1981-05-01	2850	-2100	30
7782	CLARK	MANAGER	7839	1981-06-09	2550	745	10
7788	SCOTT	ANALYST	7566	1987-04-13	3000	-200	20
7839	KING	PRESIDENT	NULL	1981-11-17	4999	-197	10
7844	TURNER	SALESMAN	7698	1981-09-08	1500	0	30
7876	ADAMS	CLERK	7788	1987-05-13	1100	-100	20
7900	JAMES	CLERK	7698	1981-12-03	950	-1808	30
7902	FORD	ANALYST	7566	1981-12-03	3010	754	20
7934	MILLER	CLERK	7782	1982-01-23	1300	729	10
7934	MILLER	CLERK	7782	1982-01-23	1300	729	10
7934	MILLER	CLERK	7782	1982-01-23	1300	729	10
insert into t1 values (10,'ACCOUNTING','NEW YORK');
select * from t2 order by 1,2,3;
empno	ename	job	mgr	hiredate	sal	comm	deptno
1	MILLER	CLERK	7782	1982-01-23	1300	729	10
1	MILLER	CLERK	7782	1982-01-23	1300	729	10
2	MILLER	CLERK	7782	1982-01-23	1300	729	10
3	MILLER	CLERK	7782	1982-01-23	1300	729	10
3	MILLER	CLERK	7782	1982-01-23	1300	729	10
7369	SMITH	CLERK	7902	1980-12-17	800	100	20
7499	ALLEN	SALESMAN	7698	1981-02-20	1600	300	30
7521	WARD	SALESMAN	7698	1981-02-22	1250	500	30
7566	JONES	MANAGER	7839	1981-04-02	2975	359	20
7654	MARTIN	SALESMAN	7698	1981-09-28	1150	1400	30
7698	BLAKE	MANAGER	7839	1981-05-01	2850	-2100	30
7782	CLARK	MANAGER	7839	1981-06-09	2550	745	10
7788	SCOTT	ANALYST	7566	1987-04-13	3000	-200	20
7839	KING	PRESIDENT	NULL	1981-11-17	4999	-197	10
7844	TURNER	SALESMAN	7698	1981-09-08	1500	0	30
7876	ADAMS	CLERK	7788	1987-05-13	1100	-100	20
7900	JAMES	CLERK	7698	1981-12-03	950	-1808	30
7902	FORD	ANALYST	7566	1981-12-03	3010	754	20
7934	MILLER	CLERK	7782	1982-01-23	1300	729	10
7934	MILLER	CLERK	7782	1982-01-23	1300	729	10
7934	MILLER	CLERK	7782	1982-01-23	1300	729	10
insert into t1 values (20,'RESEARCH','DALLAS');
select * from t1 order by 1,2,3;
deptno	dname	loc
10	ACCOUNTING	NEW YORK
10	ACCOUNTING	NEW YORK
10	ACCOUNTING	NEW YORK
20	RESEARCH	DALLAS
20	RESEARCH	DALLAS
20	RESEARCH	DALLAS
30	SALES	CHICAGO
30	SALES	CHICAGO
30	SALES	CHICAGO
40	OPERATIONS	BOSTON
40	OPERATIONS	BOSTON
40	OPERATIONS	BOSTON
select * from t2 order by 1,2,3;
empno	ename	job	mgr	hiredate	sal	comm	deptno
1	MILLER	CLERK	7782	1982-01-23	1300	729	10
1	MILLER	CLERK	7782	1982-01-23	1300	729	10
2	MILLER	CLERK	7782	1982-01-23	1300	729	10
2	MILLER	CLERK	7782	1982-01-23	1300	729	10
3	MILLER	CLERK	7782	1982-01-23	1300	729	10
3	MILLER	CLERK	7782	1982-01-23	1300	729	10
7369	SMITH	CLERK	7902	1980-12-17	800	100	20
7499	ALLEN	SALESMAN	7698	1981-02-20	1600	300	30
7521	WARD	SALESMAN	7698	1981-02-22	1250	500	30
7566	JONES	MANAGER	7839	1981-04-02	2975	359	20
7654	MARTIN	SALESMAN	7698	1981-09-28	1150	1400	30
7698	BLAKE	MANAGER	7839	1981-05-01	2850	-2100	30
7782	CLARK	MANAGER	7839	1981-06-09	2550	745	10
7788	SCOTT	ANALYST	7566	1987-04-13	3000	-200	20
7839	KING	PRESIDENT	NULL	1981-11-17	4999	-197	10
7844	TURNER	SALESMAN	7698	1981-09-08	1500	0	30
7876	ADAMS	CLERK	7788	1987-05-13	1100	-100	20
7900	JAMES	CLERK	7698	1981-12-03	950	-1808	30
7902	FORD	ANALYST	7566	1981-12-03	3010	754	20
7934	MILLER	CLERK	7782	1982-01-23	1300	729	10
7934	MILLER	CLERK	7782	1982-01-23	1300	729	10
7934	MILLER	CLERK	7782	1982-01-23	1300	729	10
drop table if exists t1;
drop table if exists t2;
create table t1(deptno int,dname varchar(20),loc varchar(20));
create table t2(empno int,ename varchar(10),job varchar(9),mgr int,hiredate date,sal int,comm int,deptno int);
insert into t1 values (10,'ACCOUNTING','NEW YORK');
insert into t1 values (20,'RESEARCH','DALLAS');
insert into t1 values (30,'SALES','CHICAGO');
insert into t1 values (40,'OPERATIONS','BOSTON');
insert into t2 values (7369,'SMITH','CLERK',7902,'1980-12-17',800,100,20);
insert into t2 values (7499,'ALLEN','SALESMAN',7698,'1981-2-20',1600,300,30);
insert into t2 values (7521,'WARD','SALESMAN',7698,'1981-2-22',1250,500,30);
insert into t2 values (7566,'JONES','MANAGER',7839,'1981-4-2',2975,358.69,20);
insert into t2 values (7654,'MARTIN','SALESMAN',7698,'1981-9-28',1150,1400,30);
insert into t2 values (7698,'BLAKE','MANAGER',7839,'1981-5-1',2850,-2100,30);
insert into t2 values (7782,'CLARK','MANAGER',7839,'1981-6-9',2550,744.9,10);
insert into t2 values (7788,'SCOTT','ANALYST',7566,'1987-4-13',3000,-200,20);
insert into t2 values (7839,'KING','PRESIDENT',NULL,'1981-11-17',4999,-196.7,10);
insert into t2 values (7844,'TURNER','SALESMAN',7698,'1981-9-8',1500,0,30);
insert into t2 values (7876,'ADAMS','CLERK',7788,'1987-5-13',1100,-99.9,20);
insert into t2 values (7900,'JAMES','CLERK',7698,'1981-12-3',950,-1808,30);
insert into t2 values (7902,'FORD','ANALYST',7566,'1981-12-3',3010,753.9,20);
insert into t2 values (7934,'MILLER','CLERK',7782,'1982-1-23',1300,729,10);
# insert触发器 after
drop trigger if exists p1;//
Warnings:
Note	1360	Trigger does not exist
create trigger p1 after insert on t1 for each row
begin
if new.loc = 'NEW YORK' and exists(select * from t2 where deptno = 10) then 
update t2 set job = 'A' where deptno = 10;
elseif new.loc = 'DALLAS' and exists(select * from t2 where deptno = 20) then
update t2 set job = 'B' where deptno = 20;
elseif new.loc = 'CHICAGO' and exists(select * from t2 where deptno = 30)then
update t2 set job = 'C' where deptno = 30;
else
update t2 set job = 'D' where deptno = 40;
end if;
end;
//
insert into t1 values (40,'OPERATIONS','BOSTON');
select * from t2 order by 1,2,3;
empno	ename	job	mgr	hiredate	sal	comm	deptno
7369	SMITH	CLERK	7902	1980-12-17	800	100	20
7499	ALLEN	SALESMAN	7698	1981-02-20	1600	300	30
7521	WARD	SALESMAN	7698	1981-02-22	1250	500	30
7566	JONES	MANAGER	7839	1981-04-02	2975	359	20
7654	MARTIN	SALESMAN	7698	1981-09-28	1150	1400	30
7698	BLAKE	MANAGER	7839	1981-05-01	2850	-2100	30
7782	CLARK	MANAGER	7839	1981-06-09	2550	745	10
7788	SCOTT	ANALYST	7566	1987-04-13	3000	-200	20
7839	KING	PRESIDENT	NULL	1981-11-17	4999	-197	10
7844	TURNER	SALESMAN	7698	1981-09-08	1500	0	30
7876	ADAMS	CLERK	7788	1987-05-13	1100	-100	20
7900	JAMES	CLERK	7698	1981-12-03	950	-1808	30
7902	FORD	ANALYST	7566	1981-12-03	3010	754	20
7934	MILLER	CLERK	7782	1982-01-23	1300	729	10
insert into t1 values (30,'SALES','CHICAGO');
select * from t2 order by 1,2,3;
empno	ename	job	mgr	hiredate	sal	comm	deptno
7369	SMITH	CLERK	7902	1980-12-17	800	100	20
7499	ALLEN	C	7698	1981-02-20	1600	300	30
7521	WARD	C	7698	1981-02-22	1250	500	30
7566	JONES	MANAGER	7839	1981-04-02	2975	359	20
7654	MARTIN	C	7698	1981-09-28	1150	1400	30
7698	BLAKE	C	7839	1981-05-01	2850	-2100	30
7782	CLARK	MANAGER	7839	1981-06-09	2550	745	10
7788	SCOTT	ANALYST	7566	1987-04-13	3000	-200	20
7839	KING	PRESIDENT	NULL	1981-11-17	4999	-197	10
7844	TURNER	C	7698	1981-09-08	1500	0	30
7876	ADAMS	CLERK	7788	1987-05-13	1100	-100	20
7900	JAMES	C	7698	1981-12-03	950	-1808	30
7902	FORD	ANALYST	7566	1981-12-03	3010	754	20
7934	MILLER	CLERK	7782	1982-01-23	1300	729	10
insert into t1 values (10,'ACCOUNTING','NEW YORK');
select * from t2 order by 1,2,3;
empno	ename	job	mgr	hiredate	sal	comm	deptno
7369	SMITH	CLERK	7902	1980-12-17	800	100	20
7499	ALLEN	C	7698	1981-02-20	1600	300	30
7521	WARD	C	7698	1981-02-22	1250	500	30
7566	JONES	MANAGER	7839	1981-04-02	2975	359	20
7654	MARTIN	C	7698	1981-09-28	1150	1400	30
7698	BLAKE	C	7839	1981-05-01	2850	-2100	30
7782	CLARK	A	7839	1981-06-09	2550	745	10
7788	SCOTT	ANALYST	7566	1987-04-13	3000	-200	20
7839	KING	A	NULL	1981-11-17	4999	-197	10
7844	TURNER	C	7698	1981-09-08	1500	0	30
7876	ADAMS	CLERK	7788	1987-05-13	1100	-100	20
7900	JAMES	C	7698	1981-12-03	950	-1808	30
7902	FORD	ANALYST	7566	1981-12-03	3010	754	20
7934	MILLER	A	7782	1982-01-23	1300	729	10
insert into t1 values (20,'RESEARCH','DALLAS');
select * from t1 order by 1,2,3;
deptno	dname	loc
10	ACCOUNTING	NEW YORK
10	ACCOUNTING	NEW YORK
20	RESEARCH	DALLAS
20	RESEARCH	DALLAS
30	SALES	CHICAGO
30	SALES	CHICAGO
40	OPERATIONS	BOSTON
40	OPERATIONS	BOSTON
select * from t2 order by 1,2,3;
empno	ename	job	mgr	hiredate	sal	comm	deptno
7369	SMITH	B	7902	1980-12-17	800	100	20
7499	ALLEN	C	7698	1981-02-20	1600	300	30
7521	WARD	C	7698	1981-02-22	1250	500	30
7566	JONES	B	7839	1981-04-02	2975	359	20
7654	MARTIN	C	7698	1981-09-28	1150	1400	30
7698	BLAKE	C	7839	1981-05-01	2850	-2100	30
7782	CLARK	A	7839	1981-06-09	2550	745	10
7788	SCOTT	B	7566	1987-04-13	3000	-200	20
7839	KING	A	NULL	1981-11-17	4999	-197	10
7844	TURNER	C	7698	1981-09-08	1500	0	30
7876	ADAMS	B	7788	1987-05-13	1100	-100	20
7900	JAMES	C	7698	1981-12-03	950	-1808	30
7902	FORD	B	7566	1981-12-03	3010	754	20
7934	MILLER	A	7782	1982-01-23	1300	729	10
drop table if exists t1;
drop table if exists t2;
create table t1(deptno int,dname varchar(20),loc varchar(20));
create table t2(empno int,ename varchar(10),job varchar(9),mgr int,hiredate date,sal int,comm int,deptno int);
insert into t1 values (10,'ACCOUNTING','NEW YORK');
insert into t1 values (20,'RESEARCH','DALLAS');
insert into t1 values (30,'SALES','CHICAGO');
insert into t1 values (40,'OPERATIONS','BOSTON');
insert into t2 values (7369,'SMITH','CLERK',7902,'1980-12-17',800,100,20);
insert into t2 values (7499,'ALLEN','SALESMAN',7698,'1981-2-20',1600,300,30);
insert into t2 values (7521,'WARD','SALESMAN',7698,'1981-2-22',1250,500,30);
insert into t2 values (7566,'JONES','MANAGER',7839,'1981-4-2',2975,358.69,20);
insert into t2 values (7654,'MARTIN','SALESMAN',7698,'1981-9-28',1150,1400,30);
insert into t2 values (7698,'BLAKE','MANAGER',7839,'1981-5-1',2850,-2100,30);
insert into t2 values (7782,'CLARK','MANAGER',7839,'1981-6-9',2550,744.9,10);
insert into t2 values (7788,'SCOTT','ANALYST',7566,'1987-4-13',3000,-200,20);
insert into t2 values (7839,'KING','PRESIDENT',NULL,'1981-11-17',4999,-196.7,10);
insert into t2 values (7844,'TURNER','SALESMAN',7698,'1981-9-8',1500,0,30);
insert into t2 values (7876,'ADAMS','CLERK',7788,'1987-5-13',1100,-99.9,20);
insert into t2 values (7900,'JAMES','CLERK',7698,'1981-12-3',950,-1808,30);
insert into t2 values (7902,'FORD','ANALYST',7566,'1981-12-3',3010,753.9,20);
insert into t2 values (7934,'MILLER','CLERK',7782,'1982-1-23',1300,729,10);
# update触发器 before
drop trigger if exists p1;//
Warnings:
Note	1360	Trigger does not exist
create trigger p1 before update on t1 for each row
begin
if old.loc = 'NEW YORK' and exists(select * from t2 where deptno = 10) then 
set new.dname = 'A';
elseif old.loc = 'DALLAS' and exists(select * from t2 where deptno = 20) then
set new.dname = 'B';
elseif old.loc = 'CHICAGO' and exists(select * from t2 where deptno = 30)then
set new.dname = 'C';
else
set new.dname = 'D';
end if;
end;
//
update t1 set loc = 'NEW YORK' where dname = 'RESEARCH';
select * from t1 order by 1,2,3;
deptno	dname	loc
10	ACCOUNTING	NEW YORK
20	B	NEW YORK
30	SALES	CHICAGO
40	OPERATIONS	BOSTON
update t1 set loc = 'DALLAS' where dname = 'ACCOUNTING';
select * from t1 order by 1,2,3;
deptno	dname	loc
10	A	DALLAS
20	B	NEW YORK
30	SALES	CHICAGO
40	OPERATIONS	BOSTON
update t1 set loc = 'CHICAGO' where dname = 'SALES';
select * from t1 order by 1,2,3;
deptno	dname	loc
10	A	DALLAS
20	B	NEW YORK
30	C	CHICAGO
40	OPERATIONS	BOSTON
update t1 set loc = 'OPERATIONS' where dname = 'OPERATIONS';
select * from t1 order by 1,2,3;
deptno	dname	loc
10	A	DALLAS
20	B	NEW YORK
30	C	CHICAGO
40	D	OPERATIONS
select * from t2 order by 1,2,3;
empno	ename	job	mgr	hiredate	sal	comm	deptno
7369	SMITH	CLERK	7902	1980-12-17	800	100	20
7499	ALLEN	SALESMAN	7698	1981-02-20	1600	300	30
7521	WARD	SALESMAN	7698	1981-02-22	1250	500	30
7566	JONES	MANAGER	7839	1981-04-02	2975	359	20
7654	MARTIN	SALESMAN	7698	1981-09-28	1150	1400	30
7698	BLAKE	MANAGER	7839	1981-05-01	2850	-2100	30
7782	CLARK	MANAGER	7839	1981-06-09	2550	745	10
7788	SCOTT	ANALYST	7566	1987-04-13	3000	-200	20
7839	KING	PRESIDENT	NULL	1981-11-17	4999	-197	10
7844	TURNER	SALESMAN	7698	1981-09-08	1500	0	30
7876	ADAMS	CLERK	7788	1987-05-13	1100	-100	20
7900	JAMES	CLERK	7698	1981-12-03	950	-1808	30
7902	FORD	ANALYST	7566	1981-12-03	3010	754	20
7934	MILLER	CLERK	7782	1982-01-23	1300	729	10
drop table if exists t1;
drop table if exists t2;
create table t1(deptno int,dname varchar(20),loc varchar(20));
create table t2(empno int,ename varchar(10),job varchar(9),mgr int,hiredate date,sal int,comm int,deptno int);
insert into t1 values (10,'ACCOUNTING','NEW YORK');
insert into t1 values (20,'RESEARCH','DALLAS');
insert into t1 values (30,'SALES','CHICAGO');
insert into t1 values (40,'OPERATIONS','BOSTON');
insert into t2 values (7369,'SMITH','CLERK',7902,'1980-12-17',800,100,20);
insert into t2 values (7499,'ALLEN','SALESMAN',7698,'1981-2-20',1600,300,30);
insert into t2 values (7521,'WARD','SALESMAN',7698,'1981-2-22',1250,500,30);
insert into t2 values (7566,'JONES','MANAGER',7839,'1981-4-2',2975,358.69,20);
insert into t2 values (7654,'MARTIN','SALESMAN',7698,'1981-9-28',1150,1400,30);
insert into t2 values (7698,'BLAKE','MANAGER',7839,'1981-5-1',2850,-2100,30);
insert into t2 values (7782,'CLARK','MANAGER',7839,'1981-6-9',2550,744.9,10);
insert into t2 values (7788,'SCOTT','ANALYST',7566,'1987-4-13',3000,-200,20);
insert into t2 values (7839,'KING','PRESIDENT',NULL,'1981-11-17',4999,-196.7,10);
insert into t2 values (7844,'TURNER','SALESMAN',7698,'1981-9-8',1500,0,30);
insert into t2 values (7876,'ADAMS','CLERK',7788,'1987-5-13',1100,-99.9,20);
insert into t2 values (7900,'JAMES','CLERK',7698,'1981-12-3',950,-1808,30);
insert into t2 values (7902,'FORD','ANALYST',7566,'1981-12-3',3010,753.9,20);
insert into t2 values (7934,'MILLER','CLERK',7782,'1982-1-23',1300,729,10);
# update触发器 after
drop trigger if exists p1;//
Warnings:
Note	1360	Trigger does not exist
create trigger p1 after update on t1 for each row
begin
if old.loc = 'NEW YORK' and exists(select * from t2 where deptno = 10) then 
update t2 set job = 'A' where deptno = 10;
elseif old.loc = 'DALLAS' and exists(select * from t2 where deptno = 20) then
update t2 set job = 'B' where deptno = 20;
elseif old.loc = 'CHICAGO' and exists(select * from t2 where deptno = 30)then
update t2 set job = 'C' where deptno = 30;
else
update t2 set job = 'D' where deptno = 40;
end if;
end;
//
update t1 set dname = 'A' where loc = 'NEW YORK';
select * from t1 order by 1,2,3;
deptno	dname	loc
10	A	NEW YORK
20	RESEARCH	DALLAS
30	SALES	CHICAGO
40	OPERATIONS	BOSTON
select * from t2 order by 1,2,3;
empno	ename	job	mgr	hiredate	sal	comm	deptno
7369	SMITH	CLERK	7902	1980-12-17	800	100	20
7499	ALLEN	SALESMAN	7698	1981-02-20	1600	300	30
7521	WARD	SALESMAN	7698	1981-02-22	1250	500	30
7566	JONES	MANAGER	7839	1981-04-02	2975	359	20
7654	MARTIN	SALESMAN	7698	1981-09-28	1150	1400	30
7698	BLAKE	MANAGER	7839	1981-05-01	2850	-2100	30
7782	CLARK	A	7839	1981-06-09	2550	745	10
7788	SCOTT	ANALYST	7566	1987-04-13	3000	-200	20
7839	KING	A	NULL	1981-11-17	4999	-197	10
7844	TURNER	SALESMAN	7698	1981-09-08	1500	0	30
7876	ADAMS	CLERK	7788	1987-05-13	1100	-100	20
7900	JAMES	CLERK	7698	1981-12-03	950	-1808	30
7902	FORD	ANALYST	7566	1981-12-03	3010	754	20
7934	MILLER	A	7782	1982-01-23	1300	729	10
update t1 set dname = 'B' where loc = 'DALLAS';
select * from t2 order by 1,2,3;
empno	ename	job	mgr	hiredate	sal	comm	deptno
7369	SMITH	B	7902	1980-12-17	800	100	20
7499	ALLEN	SALESMAN	7698	1981-02-20	1600	300	30
7521	WARD	SALESMAN	7698	1981-02-22	1250	500	30
7566	JONES	B	7839	1981-04-02	2975	359	20
7654	MARTIN	SALESMAN	7698	1981-09-28	1150	1400	30
7698	BLAKE	MANAGER	7839	1981-05-01	2850	-2100	30
7782	CLARK	A	7839	1981-06-09	2550	745	10
7788	SCOTT	B	7566	1987-04-13	3000	-200	20
7839	KING	A	NULL	1981-11-17	4999	-197	10
7844	TURNER	SALESMAN	7698	1981-09-08	1500	0	30
7876	ADAMS	B	7788	1987-05-13	1100	-100	20
7900	JAMES	CLERK	7698	1981-12-03	950	-1808	30
7902	FORD	B	7566	1981-12-03	3010	754	20
7934	MILLER	A	7782	1982-01-23	1300	729	10
update t1 set dname = 'C' where loc = 'CHICAGO';
select * from t2 order by 1,2,3;
empno	ename	job	mgr	hiredate	sal	comm	deptno
7369	SMITH	B	7902	1980-12-17	800	100	20
7499	ALLEN	C	7698	1981-02-20	1600	300	30
7521	WARD	C	7698	1981-02-22	1250	500	30
7566	JONES	B	7839	1981-04-02	2975	359	20
7654	MARTIN	C	7698	1981-09-28	1150	1400	30
7698	BLAKE	C	7839	1981-05-01	2850	-2100	30
7782	CLARK	A	7839	1981-06-09	2550	745	10
7788	SCOTT	B	7566	1987-04-13	3000	-200	20
7839	KING	A	NULL	1981-11-17	4999	-197	10
7844	TURNER	C	7698	1981-09-08	1500	0	30
7876	ADAMS	B	7788	1987-05-13	1100	-100	20
7900	JAMES	C	7698	1981-12-03	950	-1808	30
7902	FORD	B	7566	1981-12-03	3010	754	20
7934	MILLER	A	7782	1982-01-23	1300	729	10
update t1 set dname = 'D' where loc = 'BOSTON';
select * from t1 order by 1,2,3;
deptno	dname	loc
10	A	NEW YORK
20	B	DALLAS
30	C	CHICAGO
40	D	BOSTON
select * from t2 order by 1,2,3;
empno	ename	job	mgr	hiredate	sal	comm	deptno
7369	SMITH	B	7902	1980-12-17	800	100	20
7499	ALLEN	C	7698	1981-02-20	1600	300	30
7521	WARD	C	7698	1981-02-22	1250	500	30
7566	JONES	B	7839	1981-04-02	2975	359	20
7654	MARTIN	C	7698	1981-09-28	1150	1400	30
7698	BLAKE	C	7839	1981-05-01	2850	-2100	30
7782	CLARK	A	7839	1981-06-09	2550	745	10
7788	SCOTT	B	7566	1987-04-13	3000	-200	20
7839	KING	A	NULL	1981-11-17	4999	-197	10
7844	TURNER	C	7698	1981-09-08	1500	0	30
7876	ADAMS	B	7788	1987-05-13	1100	-100	20
7900	JAMES	C	7698	1981-12-03	950	-1808	30
7902	FORD	B	7566	1981-12-03	3010	754	20
7934	MILLER	A	7782	1982-01-23	1300	729	10
drop table if exists t1;
drop table if exists t2;
create table t1(deptno int,dname varchar(20),loc varchar(20));
create table t2(empno int,ename varchar(10),job varchar(9),mgr int,hiredate date,sal int,comm int,deptno int);
insert into t1 values (10,'ACCOUNTING','NEW YORK');
insert into t1 values (20,'RESEARCH','DALLAS');
insert into t1 values (30,'SALES','CHICAGO');
insert into t1 values (40,'OPERATIONS','BOSTON');
insert into t2 values (7369,'SMITH','CLERK',7902,'1980-12-17',800,100,20);
insert into t2 values (7499,'ALLEN','SALESMAN',7698,'1981-2-20',1600,300,30);
insert into t2 values (7521,'WARD','SALESMAN',7698,'1981-2-22',1250,500,30);
insert into t2 values (7566,'JONES','MANAGER',7839,'1981-4-2',2975,358.69,20);
insert into t2 values (7654,'MARTIN','SALESMAN',7698,'1981-9-28',1150,1400,30);
insert into t2 values (7698,'BLAKE','MANAGER',7839,'1981-5-1',2850,-2100,30);
insert into t2 values (7782,'CLARK','MANAGER',7839,'1981-6-9',2550,744.9,10);
insert into t2 values (7788,'SCOTT','ANALYST',7566,'1987-4-13',3000,-200,20);
insert into t2 values (7839,'KING','PRESIDENT',NULL,'1981-11-17',4999,-196.7,10);
insert into t2 values (7844,'TURNER','SALESMAN',7698,'1981-9-8',1500,0,30);
insert into t2 values (7876,'ADAMS','CLERK',7788,'1987-5-13',1100,-99.9,20);
insert into t2 values (7900,'JAMES','CLERK',7698,'1981-12-3',950,-1808,30);
insert into t2 values (7902,'FORD','ANALYST',7566,'1981-12-3',3010,753.9,20);
insert into t2 values (7934,'MILLER','CLERK',7782,'1982-1-23',1300,729,10);
# delete 触发器 before
drop trigger if exists p1;//
Warnings:
Note	1360	Trigger does not exist
create trigger p1 before delete on t1 for each row
begin
if old.loc = 'NEW YORK' and exists(select * from t2 where deptno = 10) then 
delete from t2 where deptno = 10;
elseif old.loc = 'DALLAS' and exists(select * from t2 where deptno = 20) then
delete from t2 where deptno = 20;
elseif old.loc = 'CHICAGO' and exists(select * from t2 where deptno = 30)then
delete from t2 where deptno = 30;
else
delete from t2 where deptno = 40;
end if;
end;
//
delete from t1 where loc = 'DALLAS';
select * from t2 order by 1,2,3;
empno	ename	job	mgr	hiredate	sal	comm	deptno
7499	ALLEN	SALESMAN	7698	1981-02-20	1600	300	30
7521	WARD	SALESMAN	7698	1981-02-22	1250	500	30
7654	MARTIN	SALESMAN	7698	1981-09-28	1150	1400	30
7698	BLAKE	MANAGER	7839	1981-05-01	2850	-2100	30
7782	CLARK	MANAGER	7839	1981-06-09	2550	745	10
7839	KING	PRESIDENT	NULL	1981-11-17	4999	-197	10
7844	TURNER	SALESMAN	7698	1981-09-08	1500	0	30
7900	JAMES	CLERK	7698	1981-12-03	950	-1808	30
7934	MILLER	CLERK	7782	1982-01-23	1300	729	10
delete from t1 where loc = 'NEW YORK';
select * from t2 order by 1,2,3;
empno	ename	job	mgr	hiredate	sal	comm	deptno
7499	ALLEN	SALESMAN	7698	1981-02-20	1600	300	30
7521	WARD	SALESMAN	7698	1981-02-22	1250	500	30
7654	MARTIN	SALESMAN	7698	1981-09-28	1150	1400	30
7698	BLAKE	MANAGER	7839	1981-05-01	2850	-2100	30
7844	TURNER	SALESMAN	7698	1981-09-08	1500	0	30
7900	JAMES	CLERK	7698	1981-12-03	950	-1808	30
delete from t1 where loc = 'CHICAGO';
select * from t2 order by 1,2,3;
empno	ename	job	mgr	hiredate	sal	comm	deptno
delete from t1 where loc = 'BOSTON';
select * from t1 order by 1,2,3;
deptno	dname	loc
select * from t2 order by 1,2,3;
empno	ename	job	mgr	hiredate	sal	comm	deptno
drop table if exists t1;
drop table if exists t2;
create table t1(deptno int,dname varchar(20),loc varchar(20));
create table t2(empno int,ename varchar(10),job varchar(9),mgr int,hiredate date,sal int,comm int,deptno int);
insert into t1 values (10,'ACCOUNTING','NEW YORK');
insert into t1 values (20,'RESEARCH','DALLAS');
insert into t1 values (30,'SALES','CHICAGO');
insert into t1 values (40,'OPERATIONS','BOSTON');
insert into t2 values (7369,'SMITH','CLERK',7902,'1980-12-17',800,100,20);
insert into t2 values (7499,'ALLEN','SALESMAN',7698,'1981-2-20',1600,300,30);
insert into t2 values (7521,'WARD','SALESMAN',7698,'1981-2-22',1250,500,30);
insert into t2 values (7566,'JONES','MANAGER',7839,'1981-4-2',2975,358.69,20);
insert into t2 values (7654,'MARTIN','SALESMAN',7698,'1981-9-28',1150,1400,30);
insert into t2 values (7698,'BLAKE','MANAGER',7839,'1981-5-1',2850,-2100,30);
insert into t2 values (7782,'CLARK','MANAGER',7839,'1981-6-9',2550,744.9,10);
insert into t2 values (7788,'SCOTT','ANALYST',7566,'1987-4-13',3000,-200,20);
insert into t2 values (7839,'KING','PRESIDENT',NULL,'1981-11-17',4999,-196.7,10);
insert into t2 values (7844,'TURNER','SALESMAN',7698,'1981-9-8',1500,0,30);
insert into t2 values (7876,'ADAMS','CLERK',7788,'1987-5-13',1100,-99.9,20);
insert into t2 values (7900,'JAMES','CLERK',7698,'1981-12-3',950,-1808,30);
insert into t2 values (7902,'FORD','ANALYST',7566,'1981-12-3',3010,753.9,20);
insert into t2 values (7934,'MILLER','CLERK',7782,'1982-1-23',1300,729,10);
# delete 触发器 before
drop trigger if exists p1;//
Warnings:
Note	1360	Trigger does not exist
create trigger p1 after delete on t1 for each row
begin
if old.loc = 'NEW YORK' and exists(select * from t2 where deptno = 10) then 
insert into t2 values (7934,'KOBE','CLERK',7782,'1982-1-23',1300,729,10);
elseif old.loc = 'DALLAS' and exists(select * from t2 where deptno = 20) then
insert into t2 values (7902,'ADMS','ANALYST',7566,'1981-12-3',3010,753.9,20);
elseif old.loc = 'CHICAGO' and exists(select * from t2 where deptno = 30)then
insert into t2 values (7900,'JAMES','CLERK',7698,'1981-12-3',950,-1808,30);
else
insert into t2 values (7900,'ALLEN','CLERK',7698,'1981-12-3',950,-1808,40);
end if;
end;
//
delete from t1 where loc = 'DALLAS';
select * from t2 order by 1,2,3;
empno	ename	job	mgr	hiredate	sal	comm	deptno
7369	SMITH	CLERK	7902	1980-12-17	800	100	20
7499	ALLEN	SALESMAN	7698	1981-02-20	1600	300	30
7521	WARD	SALESMAN	7698	1981-02-22	1250	500	30
7566	JONES	MANAGER	7839	1981-04-02	2975	359	20
7654	MARTIN	SALESMAN	7698	1981-09-28	1150	1400	30
7698	BLAKE	MANAGER	7839	1981-05-01	2850	-2100	30
7782	CLARK	MANAGER	7839	1981-06-09	2550	745	10
7788	SCOTT	ANALYST	7566	1987-04-13	3000	-200	20
7839	KING	PRESIDENT	NULL	1981-11-17	4999	-197	10
7844	TURNER	SALESMAN	7698	1981-09-08	1500	0	30
7876	ADAMS	CLERK	7788	1987-05-13	1100	-100	20
7900	JAMES	CLERK	7698	1981-12-03	950	-1808	30
7902	ADMS	ANALYST	7566	1981-12-03	3010	754	20
7902	FORD	ANALYST	7566	1981-12-03	3010	754	20
7934	MILLER	CLERK	7782	1982-01-23	1300	729	10
delete from t1 where loc = 'NEW YORK';
select * from t2 order by 1,2,3;
empno	ename	job	mgr	hiredate	sal	comm	deptno
7369	SMITH	CLERK	7902	1980-12-17	800	100	20
7499	ALLEN	SALESMAN	7698	1981-02-20	1600	300	30
7521	WARD	SALESMAN	7698	1981-02-22	1250	500	30
7566	JONES	MANAGER	7839	1981-04-02	2975	359	20
7654	MARTIN	SALESMAN	7698	1981-09-28	1150	1400	30
7698	BLAKE	MANAGER	7839	1981-05-01	2850	-2100	30
7782	CLARK	MANAGER	7839	1981-06-09	2550	745	10
7788	SCOTT	ANALYST	7566	1987-04-13	3000	-200	20
7839	KING	PRESIDENT	NULL	1981-11-17	4999	-197	10
7844	TURNER	SALESMAN	7698	1981-09-08	1500	0	30
7876	ADAMS	CLERK	7788	1987-05-13	1100	-100	20
7900	JAMES	CLERK	7698	1981-12-03	950	-1808	30
7902	ADMS	ANALYST	7566	1981-12-03	3010	754	20
7902	FORD	ANALYST	7566	1981-12-03	3010	754	20
7934	KOBE	CLERK	7782	1982-01-23	1300	729	10
7934	MILLER	CLERK	7782	1982-01-23	1300	729	10
delete from t1 where loc = 'CHICAGO';
select * from t2 order by 1,2,3;
empno	ename	job	mgr	hiredate	sal	comm	deptno
7369	SMITH	CLERK	7902	1980-12-17	800	100	20
7499	ALLEN	SALESMAN	7698	1981-02-20	1600	300	30
7521	WARD	SALESMAN	7698	1981-02-22	1250	500	30
7566	JONES	MANAGER	7839	1981-04-02	2975	359	20
7654	MARTIN	SALESMAN	7698	1981-09-28	1150	1400	30
7698	BLAKE	MANAGER	7839	1981-05-01	2850	-2100	30
7782	CLARK	MANAGER	7839	1981-06-09	2550	745	10
7788	SCOTT	ANALYST	7566	1987-04-13	3000	-200	20
7839	KING	PRESIDENT	NULL	1981-11-17	4999	-197	10
7844	TURNER	SALESMAN	7698	1981-09-08	1500	0	30
7876	ADAMS	CLERK	7788	1987-05-13	1100	-100	20
7900	JAMES	CLERK	7698	1981-12-03	950	-1808	30
7900	JAMES	CLERK	7698	1981-12-03	950	-1808	30
7902	ADMS	ANALYST	7566	1981-12-03	3010	754	20
7902	FORD	ANALYST	7566	1981-12-03	3010	754	20
7934	KOBE	CLERK	7782	1982-01-23	1300	729	10
7934	MILLER	CLERK	7782	1982-01-23	1300	729	10
delete from t1 where loc = 'BOSTON';
select * from t2 order by 1,2,3;
empno	ename	job	mgr	hiredate	sal	comm	deptno
7369	SMITH	CLERK	7902	1980-12-17	800	100	20
7499	ALLEN	SALESMAN	7698	1981-02-20	1600	300	30
7521	WARD	SALESMAN	7698	1981-02-22	1250	500	30
7566	JONES	MANAGER	7839	1981-04-02	2975	359	20
7654	MARTIN	SALESMAN	7698	1981-09-28	1150	1400	30
7698	BLAKE	MANAGER	7839	1981-05-01	2850	-2100	30
7782	CLARK	MANAGER	7839	1981-06-09	2550	745	10
7788	SCOTT	ANALYST	7566	1987-04-13	3000	-200	20
7839	KING	PRESIDENT	NULL	1981-11-17	4999	-197	10
7844	TURNER	SALESMAN	7698	1981-09-08	1500	0	30
7876	ADAMS	CLERK	7788	1987-05-13	1100	-100	20
7900	ALLEN	CLERK	7698	1981-12-03	950	-1808	40
7900	JAMES	CLERK	7698	1981-12-03	950	-1808	30
7900	JAMES	CLERK	7698	1981-12-03	950	-1808	30
7902	ADMS	ANALYST	7566	1981-12-03	3010	754	20
7902	FORD	ANALYST	7566	1981-12-03	3010	754	20
7934	KOBE	CLERK	7782	1982-01-23	1300	729	10
7934	MILLER	CLERK	7782	1982-01-23	1300	729	10
drop table if exists t1;
drop table if exists t2;
create table t1(deptno int,dname varchar(20),loc varchar(20));
create table t2(empno int,ename varchar(10),job varchar(9),mgr int,hiredate date,sal int,comm int,deptno int);
insert into t1 values (10,'ACCOUNTING','NEW YORK');
insert into t1 values (20,'RESEARCH','DALLAS');
insert into t1 values (30,'SALES','CHICAGO');
insert into t1 values (40,'OPERATIONS','BOSTON');
insert into t2 values (7369,'SMITH','CLERK',7902,'1980-12-17',800,100,20);
insert into t2 values (7499,'ALLEN','SALESMAN',7698,'1981-2-20',1600,300,30);
insert into t2 values (7521,'WARD','SALESMAN',7698,'1981-2-22',1250,500,30);
insert into t2 values (7566,'JONES','MANAGER',7839,'1981-4-2',2975,358.69,20);
insert into t2 values (7654,'MARTIN','SALESMAN',7698,'1981-9-28',1150,1400,30);
insert into t2 values (7698,'BLAKE','MANAGER',7839,'1981-5-1',2850,-2100,30);
insert into t2 values (7782,'CLARK','MANAGER',7839,'1981-6-9',2550,744.9,10);
insert into t2 values (7788,'SCOTT','ANALYST',7566,'1987-4-13',3000,-200,20);
insert into t2 values (7839,'KING','PRESIDENT',NULL,'1981-11-17',4999,-196.7,10);
insert into t2 values (7844,'TURNER','SALESMAN',7698,'1981-9-8',1500,0,30);
insert into t2 values (7876,'ADAMS','CLERK',7788,'1987-5-13',1100,-99.9,20);
insert into t2 values (7900,'JAMES','CLERK',7698,'1981-12-3',950,-1808,30);
insert into t2 values (7902,'FORD','ANALYST',7566,'1981-12-3',3010,753.9,20);
insert into t2 values (7934,'MILLER','CLERK',7782,'1982-1-23',1300,729,10);
drop trigger if exists p1;//
Warnings:
Note	1360	Trigger does not exist
create trigger p1 after insert on t1 for each row
begin
case when new.deptno = 50 and exists(select * from t2 where sal > 3000) then
update t2 set  job = 'A' where sal > 4000;
when new.deptno = 60 and exists(select * from t2 where sal = 3000) then 
update t2 set job = 'B' where sal = 3000;
when new.deptno = 70 and exists(select * from t2 where sal < 3000) then 
update t2 set job = 'C' where sal < 3000;
else 
update t2 set job = 'B+' where sal between 3001 and 4001;
end case;
end;
//
insert into t1 values (50,'ACCOUNTING','NEW YORK');
select * from t2 order by 1,2,3;
empno	ename	job	mgr	hiredate	sal	comm	deptno
7369	SMITH	CLERK	7902	1980-12-17	800	100	20
7499	ALLEN	SALESMAN	7698	1981-02-20	1600	300	30
7521	WARD	SALESMAN	7698	1981-02-22	1250	500	30
7566	JONES	MANAGER	7839	1981-04-02	2975	359	20
7654	MARTIN	SALESMAN	7698	1981-09-28	1150	1400	30
7698	BLAKE	MANAGER	7839	1981-05-01	2850	-2100	30
7782	CLARK	MANAGER	7839	1981-06-09	2550	745	10
7788	SCOTT	ANALYST	7566	1987-04-13	3000	-200	20
7839	KING	A	NULL	1981-11-17	4999	-197	10
7844	TURNER	SALESMAN	7698	1981-09-08	1500	0	30
7876	ADAMS	CLERK	7788	1987-05-13	1100	-100	20
7900	JAMES	CLERK	7698	1981-12-03	950	-1808	30
7902	FORD	ANALYST	7566	1981-12-03	3010	754	20
7934	MILLER	CLERK	7782	1982-01-23	1300	729	10
insert into t1 values (60,'RESEARCH','DALLAS');
select * from t2 order by 1,2,3;
empno	ename	job	mgr	hiredate	sal	comm	deptno
7369	SMITH	CLERK	7902	1980-12-17	800	100	20
7499	ALLEN	SALESMAN	7698	1981-02-20	1600	300	30
7521	WARD	SALESMAN	7698	1981-02-22	1250	500	30
7566	JONES	MANAGER	7839	1981-04-02	2975	359	20
7654	MARTIN	SALESMAN	7698	1981-09-28	1150	1400	30
7698	BLAKE	MANAGER	7839	1981-05-01	2850	-2100	30
7782	CLARK	MANAGER	7839	1981-06-09	2550	745	10
7788	SCOTT	B	7566	1987-04-13	3000	-200	20
7839	KING	A	NULL	1981-11-17	4999	-197	10
7844	TURNER	SALESMAN	7698	1981-09-08	1500	0	30
7876	ADAMS	CLERK	7788	1987-05-13	1100	-100	20
7900	JAMES	CLERK	7698	1981-12-03	950	-1808	30
7902	FORD	ANALYST	7566	1981-12-03	3010	754	20
7934	MILLER	CLERK	7782	1982-01-23	1300	729	10
insert into t1 values (70,'SALES','CHICAGO');
select * from t2 order by 1,2,3;
empno	ename	job	mgr	hiredate	sal	comm	deptno
7369	SMITH	C	7902	1980-12-17	800	100	20
7499	ALLEN	C	7698	1981-02-20	1600	300	30
7521	WARD	C	7698	1981-02-22	1250	500	30
7566	JONES	C	7839	1981-04-02	2975	359	20
7654	MARTIN	C	7698	1981-09-28	1150	1400	30
7698	BLAKE	C	7839	1981-05-01	2850	-2100	30
7782	CLARK	C	7839	1981-06-09	2550	745	10
7788	SCOTT	B	7566	1987-04-13	3000	-200	20
7839	KING	A	NULL	1981-11-17	4999	-197	10
7844	TURNER	C	7698	1981-09-08	1500	0	30
7876	ADAMS	C	7788	1987-05-13	1100	-100	20
7900	JAMES	C	7698	1981-12-03	950	-1808	30
7902	FORD	ANALYST	7566	1981-12-03	3010	754	20
7934	MILLER	C	7782	1982-01-23	1300	729	10
insert into t1 values (80,'OPERATIONS','BOSTON');
select * from t2 order by 1,2,3;
empno	ename	job	mgr	hiredate	sal	comm	deptno
7369	SMITH	C	7902	1980-12-17	800	100	20
7499	ALLEN	C	7698	1981-02-20	1600	300	30
7521	WARD	C	7698	1981-02-22	1250	500	30
7566	JONES	C	7839	1981-04-02	2975	359	20
7654	MARTIN	C	7698	1981-09-28	1150	1400	30
7698	BLAKE	C	7839	1981-05-01	2850	-2100	30
7782	CLARK	C	7839	1981-06-09	2550	745	10
7788	SCOTT	B	7566	1987-04-13	3000	-200	20
7839	KING	A	NULL	1981-11-17	4999	-197	10
7844	TURNER	C	7698	1981-09-08	1500	0	30
7876	ADAMS	C	7788	1987-05-13	1100	-100	20
7900	JAMES	C	7698	1981-12-03	950	-1808	30
7902	FORD	B+	7566	1981-12-03	3010	754	20
7934	MILLER	C	7782	1982-01-23	1300	729	10
drop table if exists t1;
drop table if exists t2;
create table t1(deptno int,dname varchar(20),loc varchar(20));
create table t2(empno int,ename varchar(10),job varchar(9),mgr int,hiredate date,sal int,comm int,deptno int);
insert into t1 values (10,'ACCOUNTING','NEW YORK');
insert into t1 values (20,'RESEARCH','DALLAS');
insert into t1 values (30,'SALES','CHICAGO');
insert into t1 values (40,'OPERATIONS','BOSTON');
insert into t2 values (7369,'SMITH','CLERK',7902,'1980-12-17',800,100,20);
insert into t2 values (7499,'ALLEN','SALESMAN',7698,'1981-2-20',1600,300,30);
insert into t2 values (7521,'WARD','SALESMAN',7698,'1981-2-22',1250,500,30);
insert into t2 values (7566,'JONES','MANAGER',7839,'1981-4-2',2975,358.69,20);
insert into t2 values (7654,'MARTIN','SALESMAN',7698,'1981-9-28',1150,1400,30);
insert into t2 values (7698,'BLAKE','MANAGER',7839,'1981-5-1',2850,-2100,30);
insert into t2 values (7782,'CLARK','MANAGER',7839,'1981-6-9',2550,744.9,10);
insert into t2 values (7788,'SCOTT','ANALYST',7566,'1987-4-13',3000,-200,20);
insert into t2 values (7839,'KING','PRESIDENT',NULL,'1981-11-17',4999,-196.7,10);
insert into t2 values (7844,'TURNER','SALESMAN',7698,'1981-9-8',1500,0,30);
insert into t2 values (7876,'ADAMS','CLERK',7788,'1987-5-13',1100,-99.9,20);
insert into t2 values (7900,'JAMES','CLERK',7698,'1981-12-3',950,-1808,30);
insert into t2 values (7902,'FORD','ANALYST',7566,'1981-12-3',3010,753.9,20);
insert into t2 values (7934,'MILLER','CLERK',7782,'1982-1-23',1300,729,10);
drop trigger if exists p1;//
Warnings:
Note	1360	Trigger does not exist
create trigger p1 before insert on t1 for each row
begin
case when new.deptno = 50 and exists(select * from t2 where sal > 3000) then
update t2 set  job = 'A' where sal > 4000;
when new.deptno = 60 and exists(select * from t2 where sal = 3000) then 
update t2 set job = 'B' where sal = 3000;
when new.deptno = 70 and exists(select * from t2 where sal < 3000) then 
update t2 set job = 'C' where sal < 3000;
else 
update t2 set job = 'B+' where sal between 3001 and 4001;
end case;
end;
//
insert into t1 values (50,'ACCOUNTING','NEW YORK');
select * from t2 order by 1,2,3;
empno	ename	job	mgr	hiredate	sal	comm	deptno
7369	SMITH	CLERK	7902	1980-12-17	800	100	20
7499	ALLEN	SALESMAN	7698	1981-02-20	1600	300	30
7521	WARD	SALESMAN	7698	1981-02-22	1250	500	30
7566	JONES	MANAGER	7839	1981-04-02	2975	359	20
7654	MARTIN	SALESMAN	7698	1981-09-28	1150	1400	30
7698	BLAKE	MANAGER	7839	1981-05-01	2850	-2100	30
7782	CLARK	MANAGER	7839	1981-06-09	2550	745	10
7788	SCOTT	ANALYST	7566	1987-04-13	3000	-200	20
7839	KING	A	NULL	1981-11-17	4999	-197	10
7844	TURNER	SALESMAN	7698	1981-09-08	1500	0	30
7876	ADAMS	CLERK	7788	1987-05-13	1100	-100	20
7900	JAMES	CLERK	7698	1981-12-03	950	-1808	30
7902	FORD	ANALYST	7566	1981-12-03	3010	754	20
7934	MILLER	CLERK	7782	1982-01-23	1300	729	10
insert into t1 values (60,'RESEARCH','DALLAS');
select * from t2 order by 1,2,3;
empno	ename	job	mgr	hiredate	sal	comm	deptno
7369	SMITH	CLERK	7902	1980-12-17	800	100	20
7499	ALLEN	SALESMAN	7698	1981-02-20	1600	300	30
7521	WARD	SALESMAN	7698	1981-02-22	1250	500	30
7566	JONES	MANAGER	7839	1981-04-02	2975	359	20
7654	MARTIN	SALESMAN	7698	1981-09-28	1150	1400	30
7698	BLAKE	MANAGER	7839	1981-05-01	2850	-2100	30
7782	CLARK	MANAGER	7839	1981-06-09	2550	745	10
7788	SCOTT	B	7566	1987-04-13	3000	-200	20
7839	KING	A	NULL	1981-11-17	4999	-197	10
7844	TURNER	SALESMAN	7698	1981-09-08	1500	0	30
7876	ADAMS	CLERK	7788	1987-05-13	1100	-100	20
7900	JAMES	CLERK	7698	1981-12-03	950	-1808	30
7902	FORD	ANALYST	7566	1981-12-03	3010	754	20
7934	MILLER	CLERK	7782	1982-01-23	1300	729	10
insert into t1 values (70,'SALES','CHICAGO');
select * from t2 order by 1,2,3;
empno	ename	job	mgr	hiredate	sal	comm	deptno
7369	SMITH	C	7902	1980-12-17	800	100	20
7499	ALLEN	C	7698	1981-02-20	1600	300	30
7521	WARD	C	7698	1981-02-22	1250	500	30
7566	JONES	C	7839	1981-04-02	2975	359	20
7654	MARTIN	C	7698	1981-09-28	1150	1400	30
7698	BLAKE	C	7839	1981-05-01	2850	-2100	30
7782	CLARK	C	7839	1981-06-09	2550	745	10
7788	SCOTT	B	7566	1987-04-13	3000	-200	20
7839	KING	A	NULL	1981-11-17	4999	-197	10
7844	TURNER	C	7698	1981-09-08	1500	0	30
7876	ADAMS	C	7788	1987-05-13	1100	-100	20
7900	JAMES	C	7698	1981-12-03	950	-1808	30
7902	FORD	ANALYST	7566	1981-12-03	3010	754	20
7934	MILLER	C	7782	1982-01-23	1300	729	10
insert into t1 values (80,'OPERATIONS','BOSTON');
select * from t2 order by 1,2,3;
empno	ename	job	mgr	hiredate	sal	comm	deptno
7369	SMITH	C	7902	1980-12-17	800	100	20
7499	ALLEN	C	7698	1981-02-20	1600	300	30
7521	WARD	C	7698	1981-02-22	1250	500	30
7566	JONES	C	7839	1981-04-02	2975	359	20
7654	MARTIN	C	7698	1981-09-28	1150	1400	30
7698	BLAKE	C	7839	1981-05-01	2850	-2100	30
7782	CLARK	C	7839	1981-06-09	2550	745	10
7788	SCOTT	B	7566	1987-04-13	3000	-200	20
7839	KING	A	NULL	1981-11-17	4999	-197	10
7844	TURNER	C	7698	1981-09-08	1500	0	30
7876	ADAMS	C	7788	1987-05-13	1100	-100	20
7900	JAMES	C	7698	1981-12-03	950	-1808	30
7902	FORD	B+	7566	1981-12-03	3010	754	20
7934	MILLER	C	7782	1982-01-23	1300	729	10
drop table if exists t1;
drop table if exists t2;
create table t1(deptno int,dname varchar(20),loc varchar(20));
create table t2(empno int,ename varchar(10),job varchar(9),mgr int,hiredate date,sal int,comm int,deptno int);
insert into t1 values (10,'ACCOUNTING','NEW YORK');
insert into t1 values (20,'RESEARCH','DALLAS');
insert into t1 values (30,'SALES','CHICAGO');
insert into t1 values (40,'OPERATIONS','BOSTON');
insert into t2 values (7369,'SMITH','CLERK',7902,'1980-12-17',800,100,20);
insert into t2 values (7499,'ALLEN','SALESMAN',7698,'1981-2-20',1600,300,30);
insert into t2 values (7521,'WARD','SALESMAN',7698,'1981-2-22',1250,500,30);
insert into t2 values (7566,'JONES','MANAGER',7839,'1981-4-2',2975,358.69,20);
insert into t2 values (7654,'MARTIN','SALESMAN',7698,'1981-9-28',1150,1400,30);
insert into t2 values (7698,'BLAKE','MANAGER',7839,'1981-5-1',2850,-2100,30);
insert into t2 values (7782,'CLARK','MANAGER',7839,'1981-6-9',2550,744.9,10);
insert into t2 values (7788,'SCOTT','ANALYST',7566,'1987-4-13',3000,-200,20);
insert into t2 values (7839,'KING','PRESIDENT',NULL,'1981-11-17',4999,-196.7,10);
insert into t2 values (7844,'TURNER','SALESMAN',7698,'1981-9-8',1500,0,30);
insert into t2 values (7876,'ADAMS','CLERK',7788,'1987-5-13',1100,-99.9,20);
insert into t2 values (7900,'JAMES','CLERK',7698,'1981-12-3',950,-1808,30);
insert into t2 values (7902,'FORD','ANALYST',7566,'1981-12-3',3010,753.9,20);
insert into t2 values (7934,'MILLER','CLERK',7782,'1982-1-23',1300,729,10);
drop trigger if exists p1;//
Warnings:
Note	1360	Trigger does not exist
create trigger p1 after update on t1 for each row
begin
case when new.deptno = 50 and exists(select * from t2 where sal > 3000) then
update t2 set  job = 'A' where sal > 4000;
when new.deptno = 60 and exists(select * from t2 where sal = 3000) then 
update t2 set job = 'B' where sal = 3000;
when new.deptno = 70 and exists(select * from t2 where sal < 3000) then 
update t2 set job = 'C' where sal < 3000;
else 
update t2 set job = 'B+' where sal between 3001 and 4001;
end case;
end;
//
update t1 set deptno = 50 where loc = 'NEW YORK';
select * from t2 order by 1,2,3;
empno	ename	job	mgr	hiredate	sal	comm	deptno
7369	SMITH	CLERK	7902	1980-12-17	800	100	20
7499	ALLEN	SALESMAN	7698	1981-02-20	1600	300	30
7521	WARD	SALESMAN	7698	1981-02-22	1250	500	30
7566	JONES	MANAGER	7839	1981-04-02	2975	359	20
7654	MARTIN	SALESMAN	7698	1981-09-28	1150	1400	30
7698	BLAKE	MANAGER	7839	1981-05-01	2850	-2100	30
7782	CLARK	MANAGER	7839	1981-06-09	2550	745	10
7788	SCOTT	ANALYST	7566	1987-04-13	3000	-200	20
7839	KING	A	NULL	1981-11-17	4999	-197	10
7844	TURNER	SALESMAN	7698	1981-09-08	1500	0	30
7876	ADAMS	CLERK	7788	1987-05-13	1100	-100	20
7900	JAMES	CLERK	7698	1981-12-03	950	-1808	30
7902	FORD	ANALYST	7566	1981-12-03	3010	754	20
7934	MILLER	CLERK	7782	1982-01-23	1300	729	10
update t1 set deptno = 60 where loc = 'DALLAS';
select * from t2 order by 1,2,3;
empno	ename	job	mgr	hiredate	sal	comm	deptno
7369	SMITH	CLERK	7902	1980-12-17	800	100	20
7499	ALLEN	SALESMAN	7698	1981-02-20	1600	300	30
7521	WARD	SALESMAN	7698	1981-02-22	1250	500	30
7566	JONES	MANAGER	7839	1981-04-02	2975	359	20
7654	MARTIN	SALESMAN	7698	1981-09-28	1150	1400	30
7698	BLAKE	MANAGER	7839	1981-05-01	2850	-2100	30
7782	CLARK	MANAGER	7839	1981-06-09	2550	745	10
7788	SCOTT	B	7566	1987-04-13	3000	-200	20
7839	KING	A	NULL	1981-11-17	4999	-197	10
7844	TURNER	SALESMAN	7698	1981-09-08	1500	0	30
7876	ADAMS	CLERK	7788	1987-05-13	1100	-100	20
7900	JAMES	CLERK	7698	1981-12-03	950	-1808	30
7902	FORD	ANALYST	7566	1981-12-03	3010	754	20
7934	MILLER	CLERK	7782	1982-01-23	1300	729	10
update t1 set deptno = 70 where loc = 'CHICAGO';
select * from t2 order by 1,2,3;
empno	ename	job	mgr	hiredate	sal	comm	deptno
7369	SMITH	C	7902	1980-12-17	800	100	20
7499	ALLEN	C	7698	1981-02-20	1600	300	30
7521	WARD	C	7698	1981-02-22	1250	500	30
7566	JONES	C	7839	1981-04-02	2975	359	20
7654	MARTIN	C	7698	1981-09-28	1150	1400	30
7698	BLAKE	C	7839	1981-05-01	2850	-2100	30
7782	CLARK	C	7839	1981-06-09	2550	745	10
7788	SCOTT	B	7566	1987-04-13	3000	-200	20
7839	KING	A	NULL	1981-11-17	4999	-197	10
7844	TURNER	C	7698	1981-09-08	1500	0	30
7876	ADAMS	C	7788	1987-05-13	1100	-100	20
7900	JAMES	C	7698	1981-12-03	950	-1808	30
7902	FORD	ANALYST	7566	1981-12-03	3010	754	20
7934	MILLER	C	7782	1982-01-23	1300	729	10
update t1 set deptno = 80 where loc = 'BOSTON';
select * from t2 order by 1,2,3;
empno	ename	job	mgr	hiredate	sal	comm	deptno
7369	SMITH	C	7902	1980-12-17	800	100	20
7499	ALLEN	C	7698	1981-02-20	1600	300	30
7521	WARD	C	7698	1981-02-22	1250	500	30
7566	JONES	C	7839	1981-04-02	2975	359	20
7654	MARTIN	C	7698	1981-09-28	1150	1400	30
7698	BLAKE	C	7839	1981-05-01	2850	-2100	30
7782	CLARK	C	7839	1981-06-09	2550	745	10
7788	SCOTT	B	7566	1987-04-13	3000	-200	20
7839	KING	A	NULL	1981-11-17	4999	-197	10
7844	TURNER	C	7698	1981-09-08	1500	0	30
7876	ADAMS	C	7788	1987-05-13	1100	-100	20
7900	JAMES	C	7698	1981-12-03	950	-1808	30
7902	FORD	B+	7566	1981-12-03	3010	754	20
7934	MILLER	C	7782	1982-01-23	1300	729	10
drop table if exists t1;
drop table if exists t2;
create table t1(deptno int,dname varchar(20),loc varchar(20));
create table t2(empno int,ename varchar(10),job varchar(9),mgr int,hiredate date,sal int,comm int,deptno int);
insert into t1 values (10,'ACCOUNTING','NEW YORK');
insert into t1 values (20,'RESEARCH','DALLAS');
insert into t1 values (30,'SALES','CHICAGO');
insert into t1 values (40,'OPERATIONS','BOSTON');
insert into t2 values (7369,'SMITH','CLERK',7902,'1980-12-17',800,100,20);
insert into t2 values (7499,'ALLEN','SALESMAN',7698,'1981-2-20',1600,300,30);
insert into t2 values (7521,'WARD','SALESMAN',7698,'1981-2-22',1250,500,30);
insert into t2 values (7566,'JONES','MANAGER',7839,'1981-4-2',2975,358.69,20);
insert into t2 values (7654,'MARTIN','SALESMAN',7698,'1981-9-28',1150,1400,30);
insert into t2 values (7698,'BLAKE','MANAGER',7839,'1981-5-1',2850,-2100,30);
insert into t2 values (7782,'CLARK','MANAGER',7839,'1981-6-9',2550,744.9,10);
insert into t2 values (7788,'SCOTT','ANALYST',7566,'1987-4-13',3000,-200,20);
insert into t2 values (7839,'KING','PRESIDENT',NULL,'1981-11-17',4999,-196.7,10);
insert into t2 values (7844,'TURNER','SALESMAN',7698,'1981-9-8',1500,0,30);
insert into t2 values (7876,'ADAMS','CLERK',7788,'1987-5-13',1100,-99.9,20);
insert into t2 values (7900,'JAMES','CLERK',7698,'1981-12-3',950,-1808,30);
insert into t2 values (7902,'FORD','ANALYST',7566,'1981-12-3',3010,753.9,20);
insert into t2 values (7934,'MILLER','CLERK',7782,'1982-1-23',1300,729,10);
drop trigger if exists p1;//
Warnings:
Note	1360	Trigger does not exist
create trigger p1 before update on t1 for each row
begin
case when new.deptno = 50 and exists(select * from t2 where sal > 3000) then
update t2 set  job = 'A' where sal > 4000;
when new.deptno = 60 and exists(select * from t2 where sal = 3000) then 
update t2 set job = 'B' where sal = 3000;
when new.deptno = 70 and exists(select * from t2 where sal < 3000) then 
update t2 set job = 'C' where sal < 3000;
else 
update t2 set job = 'B+' where sal between 3001 and 4001;
end case;
end;
//
update t1 set deptno = 50 where loc = 'NEW YORK';
select * from t2 order by 1,2,3;
empno	ename	job	mgr	hiredate	sal	comm	deptno
7369	SMITH	CLERK	7902	1980-12-17	800	100	20
7499	ALLEN	SALESMAN	7698	1981-02-20	1600	300	30
7521	WARD	SALESMAN	7698	1981-02-22	1250	500	30
7566	JONES	MANAGER	7839	1981-04-02	2975	359	20
7654	MARTIN	SALESMAN	7698	1981-09-28	1150	1400	30
7698	BLAKE	MANAGER	7839	1981-05-01	2850	-2100	30
7782	CLARK	MANAGER	7839	1981-06-09	2550	745	10
7788	SCOTT	ANALYST	7566	1987-04-13	3000	-200	20
7839	KING	A	NULL	1981-11-17	4999	-197	10
7844	TURNER	SALESMAN	7698	1981-09-08	1500	0	30
7876	ADAMS	CLERK	7788	1987-05-13	1100	-100	20
7900	JAMES	CLERK	7698	1981-12-03	950	-1808	30
7902	FORD	ANALYST	7566	1981-12-03	3010	754	20
7934	MILLER	CLERK	7782	1982-01-23	1300	729	10
update t1 set deptno = 60 where loc = 'DALLAS';
select * from t2 order by 1,2,3;
empno	ename	job	mgr	hiredate	sal	comm	deptno
7369	SMITH	CLERK	7902	1980-12-17	800	100	20
7499	ALLEN	SALESMAN	7698	1981-02-20	1600	300	30
7521	WARD	SALESMAN	7698	1981-02-22	1250	500	30
7566	JONES	MANAGER	7839	1981-04-02	2975	359	20
7654	MARTIN	SALESMAN	7698	1981-09-28	1150	1400	30
7698	BLAKE	MANAGER	7839	1981-05-01	2850	-2100	30
7782	CLARK	MANAGER	7839	1981-06-09	2550	745	10
7788	SCOTT	B	7566	1987-04-13	3000	-200	20
7839	KING	A	NULL	1981-11-17	4999	-197	10
7844	TURNER	SALESMAN	7698	1981-09-08	1500	0	30
7876	ADAMS	CLERK	7788	1987-05-13	1100	-100	20
7900	JAMES	CLERK	7698	1981-12-03	950	-1808	30
7902	FORD	ANALYST	7566	1981-12-03	3010	754	20
7934	MILLER	CLERK	7782	1982-01-23	1300	729	10
update t1 set deptno = 70 where loc = 'CHICAGO';
select * from t2 order by 1,2,3;
empno	ename	job	mgr	hiredate	sal	comm	deptno
7369	SMITH	C	7902	1980-12-17	800	100	20
7499	ALLEN	C	7698	1981-02-20	1600	300	30
7521	WARD	C	7698	1981-02-22	1250	500	30
7566	JONES	C	7839	1981-04-02	2975	359	20
7654	MARTIN	C	7698	1981-09-28	1150	1400	30
7698	BLAKE	C	7839	1981-05-01	2850	-2100	30
7782	CLARK	C	7839	1981-06-09	2550	745	10
7788	SCOTT	B	7566	1987-04-13	3000	-200	20
7839	KING	A	NULL	1981-11-17	4999	-197	10
7844	TURNER	C	7698	1981-09-08	1500	0	30
7876	ADAMS	C	7788	1987-05-13	1100	-100	20
7900	JAMES	C	7698	1981-12-03	950	-1808	30
7902	FORD	ANALYST	7566	1981-12-03	3010	754	20
7934	MILLER	C	7782	1982-01-23	1300	729	10
update t1 set deptno = 80 where loc = 'BOSTON';
select * from t2 order by 1,2,3;
empno	ename	job	mgr	hiredate	sal	comm	deptno
7369	SMITH	C	7902	1980-12-17	800	100	20
7499	ALLEN	C	7698	1981-02-20	1600	300	30
7521	WARD	C	7698	1981-02-22	1250	500	30
7566	JONES	C	7839	1981-04-02	2975	359	20
7654	MARTIN	C	7698	1981-09-28	1150	1400	30
7698	BLAKE	C	7839	1981-05-01	2850	-2100	30
7782	CLARK	C	7839	1981-06-09	2550	745	10
7788	SCOTT	B	7566	1987-04-13	3000	-200	20
7839	KING	A	NULL	1981-11-17	4999	-197	10
7844	TURNER	C	7698	1981-09-08	1500	0	30
7876	ADAMS	C	7788	1987-05-13	1100	-100	20
7900	JAMES	C	7698	1981-12-03	950	-1808	30
7902	FORD	B+	7566	1981-12-03	3010	754	20
7934	MILLER	C	7782	1982-01-23	1300	729	10
drop table if exists t1;
drop table if exists t2;
create table t1(deptno int,dname varchar(20),loc varchar(20));
create table t2(empno int,ename varchar(10),job varchar(9),mgr int,hiredate date,sal int,comm int,deptno int);
insert into t1 values (10,'ACCOUNTING','NEW YORK');
insert into t1 values (20,'RESEARCH','DALLAS');
insert into t1 values (30,'SALES','CHICAGO');
insert into t1 values (40,'OPERATIONS','BOSTON');
insert into t2 values (7369,'SMITH','CLERK',7902,'1980-12-17',800,100,20);
insert into t2 values (7499,'ALLEN','SALESMAN',7698,'1981-2-20',1600,300,30);
insert into t2 values (7521,'WARD','SALESMAN',7698,'1981-2-22',1250,500,30);
insert into t2 values (7566,'JONES','MANAGER',7839,'1981-4-2',2975,358.69,20);
insert into t2 values (7654,'MARTIN','SALESMAN',7698,'1981-9-28',1150,1400,30);
insert into t2 values (7698,'BLAKE','MANAGER',7839,'1981-5-1',2850,-2100,30);
insert into t2 values (7782,'CLARK','MANAGER',7839,'1981-6-9',2550,744.9,10);
insert into t2 values (7788,'SCOTT','ANALYST',7566,'1987-4-13',3000,-200,20);
insert into t2 values (7839,'KING','PRESIDENT',NULL,'1981-11-17',4999,-196.7,10);
insert into t2 values (7844,'TURNER','SALESMAN',7698,'1981-9-8',1500,0,30);
insert into t2 values (7876,'ADAMS','CLERK',7788,'1987-5-13',1100,-99.9,20);
insert into t2 values (7900,'JAMES','CLERK',7698,'1981-12-3',950,-1808,30);
insert into t2 values (7902,'FORD','ANALYST',7566,'1981-12-3',3010,753.9,20);
insert into t2 values (7934,'MILLER','CLERK',7782,'1982-1-23',1300,729,10);
drop trigger if exists p1;//
Warnings:
Note	1360	Trigger does not exist
create trigger p1 after delete on t1 for each row
begin
case when old.deptno = 10 and exists(select * from t2 where sal > 3000) then
delete from t2 where sal > 4000;
when old.deptno = 20 and exists(select * from t2 where sal = 3000) then 
delete from t2 where sal = 3000;
when old.deptno = 30 and exists(select * from t2 where sal < 3000) then 
delete from t2 where sal < 3000;
else 
delete from t2 where sal between 3001 and 4001;
end case;
end;
//
delete from t1 where deptno = 10;
select * from t2 order by 1,2,3;
empno	ename	job	mgr	hiredate	sal	comm	deptno
7369	SMITH	CLERK	7902	1980-12-17	800	100	20
7499	ALLEN	SALESMAN	7698	1981-02-20	1600	300	30
7521	WARD	SALESMAN	7698	1981-02-22	1250	500	30
7566	JONES	MANAGER	7839	1981-04-02	2975	359	20
7654	MARTIN	SALESMAN	7698	1981-09-28	1150	1400	30
7698	BLAKE	MANAGER	7839	1981-05-01	2850	-2100	30
7782	CLARK	MANAGER	7839	1981-06-09	2550	745	10
7788	SCOTT	ANALYST	7566	1987-04-13	3000	-200	20
7844	TURNER	SALESMAN	7698	1981-09-08	1500	0	30
7876	ADAMS	CLERK	7788	1987-05-13	1100	-100	20
7900	JAMES	CLERK	7698	1981-12-03	950	-1808	30
7902	FORD	ANALYST	7566	1981-12-03	3010	754	20
7934	MILLER	CLERK	7782	1982-01-23	1300	729	10
delete from t1 where deptno = 20;
select * from t2 order by 1,2,3;
empno	ename	job	mgr	hiredate	sal	comm	deptno
7369	SMITH	CLERK	7902	1980-12-17	800	100	20
7499	ALLEN	SALESMAN	7698	1981-02-20	1600	300	30
7521	WARD	SALESMAN	7698	1981-02-22	1250	500	30
7566	JONES	MANAGER	7839	1981-04-02	2975	359	20
7654	MARTIN	SALESMAN	7698	1981-09-28	1150	1400	30
7698	BLAKE	MANAGER	7839	1981-05-01	2850	-2100	30
7782	CLARK	MANAGER	7839	1981-06-09	2550	745	10
7844	TURNER	SALESMAN	7698	1981-09-08	1500	0	30
7876	ADAMS	CLERK	7788	1987-05-13	1100	-100	20
7900	JAMES	CLERK	7698	1981-12-03	950	-1808	30
7902	FORD	ANALYST	7566	1981-12-03	3010	754	20
7934	MILLER	CLERK	7782	1982-01-23	1300	729	10
delete from t1 where deptno = 30;
select * from t2 order by 1,2,3;
empno	ename	job	mgr	hiredate	sal	comm	deptno
7902	FORD	ANALYST	7566	1981-12-03	3010	754	20
delete from t1 where deptno = 40;
select * from t2 order by 1,2,3;
empno	ename	job	mgr	hiredate	sal	comm	deptno
drop table if exists t1;
drop table if exists t2;
create table t1(deptno int,dname varchar(20),loc varchar(20));
create table t2(empno int,ename varchar(10),job varchar(9),mgr int,hiredate date,sal int,comm int,deptno int);
insert into t1 values (10,'ACCOUNTING','NEW YORK');
insert into t1 values (20,'RESEARCH','DALLAS');
insert into t1 values (30,'SALES','CHICAGO');
insert into t1 values (40,'OPERATIONS','BOSTON');
insert into t2 values (7369,'SMITH','CLERK',7902,'1980-12-17',800,100,20);
insert into t2 values (7499,'ALLEN','SALESMAN',7698,'1981-2-20',1600,300,30);
insert into t2 values (7521,'WARD','SALESMAN',7698,'1981-2-22',1250,500,30);
insert into t2 values (7566,'JONES','MANAGER',7839,'1981-4-2',2975,358.69,20);
insert into t2 values (7654,'MARTIN','SALESMAN',7698,'1981-9-28',1150,1400,30);
insert into t2 values (7698,'BLAKE','MANAGER',7839,'1981-5-1',2850,-2100,30);
insert into t2 values (7782,'CLARK','MANAGER',7839,'1981-6-9',2550,744.9,10);
insert into t2 values (7788,'SCOTT','ANALYST',7566,'1987-4-13',3000,-200,20);
insert into t2 values (7839,'KING','PRESIDENT',NULL,'1981-11-17',4999,-196.7,10);
insert into t2 values (7844,'TURNER','SALESMAN',7698,'1981-9-8',1500,0,30);
insert into t2 values (7876,'ADAMS','CLERK',7788,'1987-5-13',1100,-99.9,20);
insert into t2 values (7900,'JAMES','CLERK',7698,'1981-12-3',950,-1808,30);
insert into t2 values (7902,'FORD','ANALYST',7566,'1981-12-3',3010,753.9,20);
insert into t2 values (7934,'MILLER','CLERK',7782,'1982-1-23',1300,729,10);
drop trigger if exists p1;//
Warnings:
Note	1360	Trigger does not exist
create trigger p1 before delete on t1 for each row
begin
case when old.deptno = 10 and exists(select * from t2 where sal > 3000) then
delete from t2 where sal > 4000;
when old.deptno = 20 and exists(select * from t2 where sal = 3000) then 
delete from t2 where sal = 3000;
when old.deptno = 30 and exists(select * from t2 where sal < 3000) then 
delete from t2 where sal < 3000;
else 
delete from t2 where sal between 3001 and 4001;
end case;
end;
//
delete from t1 where deptno = 10;
select * from t2 order by 1,2,3;
empno	ename	job	mgr	hiredate	sal	comm	deptno
7369	SMITH	CLERK	7902	1980-12-17	800	100	20
7499	ALLEN	SALESMAN	7698	1981-02-20	1600	300	30
7521	WARD	SALESMAN	7698	1981-02-22	1250	500	30
7566	JONES	MANAGER	7839	1981-04-02	2975	359	20
7654	MARTIN	SALESMAN	7698	1981-09-28	1150	1400	30
7698	BLAKE	MANAGER	7839	1981-05-01	2850	-2100	30
7782	CLARK	MANAGER	7839	1981-06-09	2550	745	10
7788	SCOTT	ANALYST	7566	1987-04-13	3000	-200	20
7844	TURNER	SALESMAN	7698	1981-09-08	1500	0	30
7876	ADAMS	CLERK	7788	1987-05-13	1100	-100	20
7900	JAMES	CLERK	7698	1981-12-03	950	-1808	30
7902	FORD	ANALYST	7566	1981-12-03	3010	754	20
7934	MILLER	CLERK	7782	1982-01-23	1300	729	10
delete from t1 where deptno = 20;
select * from t2 order by 1,2,3;
empno	ename	job	mgr	hiredate	sal	comm	deptno
7369	SMITH	CLERK	7902	1980-12-17	800	100	20
7499	ALLEN	SALESMAN	7698	1981-02-20	1600	300	30
7521	WARD	SALESMAN	7698	1981-02-22	1250	500	30
7566	JONES	MANAGER	7839	1981-04-02	2975	359	20
7654	MARTIN	SALESMAN	7698	1981-09-28	1150	1400	30
7698	BLAKE	MANAGER	7839	1981-05-01	2850	-2100	30
7782	CLARK	MANAGER	7839	1981-06-09	2550	745	10
7844	TURNER	SALESMAN	7698	1981-09-08	1500	0	30
7876	ADAMS	CLERK	7788	1987-05-13	1100	-100	20
7900	JAMES	CLERK	7698	1981-12-03	950	-1808	30
7902	FORD	ANALYST	7566	1981-12-03	3010	754	20
7934	MILLER	CLERK	7782	1982-01-23	1300	729	10
delete from t1 where deptno = 30;
select * from t2 order by 1,2,3;
empno	ename	job	mgr	hiredate	sal	comm	deptno
7902	FORD	ANALYST	7566	1981-12-03	3010	754	20
delete from t1 where deptno = 40;
select * from t2 order by 1,2,3;
empno	ename	job	mgr	hiredate	sal	comm	deptno
drop table if exists t1;
drop table if exists t2;
create table t1(deptno int,dname varchar(20),loc varchar(20));
create table t2(empno int,ename varchar(10),job varchar(9),mgr int,hiredate date,sal int,comm int,deptno int);
insert into t1 values (10,'ACCOUNTING','NEW YORK');
insert into t1 values (20,'RESEARCH','DALLAS');
insert into t1 values (30,'SALES','CHICAGO');
insert into t1 values (40,'OPERATIONS','BOSTON');
insert into t2 values (7369,'SMITH','CLERK',7902,'1980-12-17',800,100,20);
insert into t2 values (7499,'ALLEN','SALESMAN',7698,'1981-2-20',1600,300,30);
insert into t2 values (7521,'WARD','SALESMAN',7698,'1981-2-22',1250,500,30);
insert into t2 values (7566,'JONES','MANAGER',7839,'1981-4-2',2975,358.69,20);
insert into t2 values (7654,'MARTIN','SALESMAN',7698,'1981-9-28',1150,1400,30);
insert into t2 values (7698,'BLAKE','MANAGER',7839,'1981-5-1',2850,-2100,30);
insert into t2 values (7782,'CLARK','MANAGER',7839,'1981-6-9',2550,744.9,10);
insert into t2 values (7788,'SCOTT','ANALYST',7566,'1987-4-13',3000,-200,20);
insert into t2 values (7839,'KING','PRESIDENT',NULL,'1981-11-17',4999,-196.7,10);
insert into t2 values (7844,'TURNER','SALESMAN',7698,'1981-9-8',1500,0,30);
insert into t2 values (7876,'ADAMS','CLERK',7788,'1987-5-13',1100,-99.9,20);
insert into t2 values (7900,'JAMES','CLERK',7698,'1981-12-3',950,-1808,30);
insert into t2 values (7902,'FORD','ANALYST',7566,'1981-12-3',3010,753.9,20);
insert into t2 values (7934,'MILLER','CLERK',7782,'1982-1-23',1300,729,10);
drop trigger if exists p1;//
Warnings:
Note	1360	Trigger does not exist
create trigger p1 before insert on t1 for each row 
begin
declare a int;
declare b varchar(50) character set utf8;
declare c varchar(50) character set utf8;
declare done int default 0;
declare msg varchar(50) character set utf8;
declare mc cursor for select p.ename,p.job,p.sal from t2 p  where p.sal > 3000 and exists(select * from t2 where empno = (select mgr from t2 where ename = 'FORD'));
declare continue handler for not found set done = 1;
set msg = '';
open mc;
while done != 1 do
fetch mc into b,c,a;
if done != 1 then
case 
when (length(c) = 6) and exists(select * from  t2 p where p.sal = a and p.ename = b) then
insert into t2(ename,sal,deptno,job) values(b,a,1,c);
when (length(c) = 7) and exists(select * from  t2 p where p.sal = a and p.ename = b ) then
insert into t2(ename,sal,deptno,job) values(b,a,2,c);
when (length(c) = 8) and exists(select * from  t2 p where p.sal = a and p.ename = b ) then
insert into t2(ename,sal,deptno,job) values(b,a,3,c);
else
insert into t2(ename,sal,deptno,job) values(b,a,4,c);
end case;
end if;
end while;
close mc;
end;
//
insert into t1 values (20,'RESEARCH','DALLAS');
select * from t1 order by 1,2,3;
deptno	dname	loc
10	ACCOUNTING	NEW YORK
20	RESEARCH	DALLAS
20	RESEARCH	DALLAS
30	SALES	CHICAGO
40	OPERATIONS	BOSTON
select * from t2 order by 1,2,3,4;
empno	ename	job	mgr	hiredate	sal	comm	deptno
NULL	FORD	ANALYST	NULL	NULL	3010	NULL	2
NULL	KING	PRESIDENT	NULL	NULL	4999	NULL	4
7369	SMITH	CLERK	7902	1980-12-17	800	100	20
7499	ALLEN	SALESMAN	7698	1981-02-20	1600	300	30
7521	WARD	SALESMAN	7698	1981-02-22	1250	500	30
7566	JONES	MANAGER	7839	1981-04-02	2975	359	20
7654	MARTIN	SALESMAN	7698	1981-09-28	1150	1400	30
7698	BLAKE	MANAGER	7839	1981-05-01	2850	-2100	30
7782	CLARK	MANAGER	7839	1981-06-09	2550	745	10
7788	SCOTT	ANALYST	7566	1987-04-13	3000	-200	20
7839	KING	PRESIDENT	NULL	1981-11-17	4999	-197	10
7844	TURNER	SALESMAN	7698	1981-09-08	1500	0	30
7876	ADAMS	CLERK	7788	1987-05-13	1100	-100	20
7900	JAMES	CLERK	7698	1981-12-03	950	-1808	30
7902	FORD	ANALYST	7566	1981-12-03	3010	754	20
7934	MILLER	CLERK	7782	1982-01-23	1300	729	10
insert into t1 values (20,'RESEARCH','DALLAS');
ERROR 21000: Subquery returns more than 1 row
drop table if exists t1;
drop table if exists t2;
create table t1(deptno int,dname varchar(20),loc varchar(20));
create table t2(empno int primary key,ename varchar(10),job varchar(9),mgr int,hiredate date,sal int,comm int,deptno int);
insert into t1 values (10,'ACCOUNTING','NEW YORK');
insert into t1 values (20,'RESEARCH','DALLAS');
insert into t1 values (30,'SALES','CHICAGO');
insert into t1 values (40,'OPERATIONS','BOSTON');
insert into t2 values (7369,'SMITH','CLERK',7902,'1980-12-17',800,100,20);
insert into t2 values (7499,'ALLEN','SALESMAN',7698,'1981-2-20',1600,300,30);
insert into t2 values (7521,'WARD','SALESMAN',7698,'1981-2-22',1250,500,30);
insert into t2 values (7566,'JONES','MANAGER',7839,'1981-4-2',2975,358.69,20);
insert into t2 values (7654,'MARTIN','SALESMAN',7698,'1981-9-28',1150,1400,30);
insert into t2 values (7698,'BLAKE','MANAGER',7839,'1981-5-1',2850,-2100,30);
insert into t2 values (7782,'CLARK','MANAGER',7839,'1981-6-9',2550,744.9,10);
insert into t2 values (7788,'SCOTT','ANALYST',7566,'1987-4-13',3000,-200,20);
insert into t2 values (7839,'KING','PRESIDENT',NULL,'1981-11-17',4999,-196.7,10);
insert into t2 values (7844,'TURNER','SALESMAN',7698,'1981-9-8',1500,0,30);
insert into t2 values (7876,'ADAMS','CLERK',7788,'1987-5-13',1100,-99.9,20);
insert into t2 values (7900,'JAMES','CLERK',7698,'1981-12-3',950,-1808,30);
insert into t2 values (7902,'FORD','ANALYST',7566,'1981-12-3',3010,753.9,20);
insert into t2 values (7934,'MILLER','CLERK',7782,'1982-1-23',1300,729,10);
drop trigger if exists p1;//
Warnings:
Note	1360	Trigger does not exist
create trigger p1 before insert on t1 for each row 
begin
declare a int;
declare duplicatekey condition for sqlstate '23000';
declare continue handler for duplicatekey 
begin 
declare b int; 
set b=1; 
insert into t2 values (b,'MILLER','CLERK',7782,'1982-1-23',1300,729,10); 
end;
if new.deptno = 10 and exists(select * from t2 where deptno = 10 and sal > 3000 ) then
insert into t2 values (7934,'MILLER','CLERK',7782,'1982-1-23',1300,729,10);
elseif new.deptno = 20 and exists(select * from t2 where deptno = 20 and sal = 3000) then
insert into t2 values (7839,'SCOTT','ANALYST',7566,'1987-4-13',3000,-200,20);
elseif new.deptno = 30 and exists(select * from t2 where deptno = 30 and sal = 1600) then
insert into t2 values (7529,'ALLEN','SALESMAN',7698,'1981-2-20',1600,300,30);
else
insert into t2 values (null,'KING','PRESIDENT',NULL,'1981-11-17',4999,-196.7,10);
end if;
end;
//
insert into t1 values (20,'RESEARCH','DALLAS');
select * from t1 order by 1,2,3;
deptno	dname	loc
10	ACCOUNTING	NEW YORK
20	RESEARCH	DALLAS
20	RESEARCH	DALLAS
30	SALES	CHICAGO
40	OPERATIONS	BOSTON
select * from t2 order by 1,2,3,4;
empno	ename	job	mgr	hiredate	sal	comm	deptno
1	MILLER	CLERK	7782	1982-01-23	1300	729	10
7369	SMITH	CLERK	7902	1980-12-17	800	100	20
7499	ALLEN	SALESMAN	7698	1981-02-20	1600	300	30
7521	WARD	SALESMAN	7698	1981-02-22	1250	500	30
7566	JONES	MANAGER	7839	1981-04-02	2975	359	20
7654	MARTIN	SALESMAN	7698	1981-09-28	1150	1400	30
7698	BLAKE	MANAGER	7839	1981-05-01	2850	-2100	30
7782	CLARK	MANAGER	7839	1981-06-09	2550	745	10
7788	SCOTT	ANALYST	7566	1987-04-13	3000	-200	20
7839	KING	PRESIDENT	NULL	1981-11-17	4999	-197	10
7844	TURNER	SALESMAN	7698	1981-09-08	1500	0	30
7876	ADAMS	CLERK	7788	1987-05-13	1100	-100	20
7900	JAMES	CLERK	7698	1981-12-03	950	-1808	30
7902	FORD	ANALYST	7566	1981-12-03	3010	754	20
7934	MILLER	CLERK	7782	1982-01-23	1300	729	10
insert into t1 values (10,'RESEARCH','DALLAS');
ERROR 23000: Duplicate entry '1' for key 'PRIMARY'
select * from t1 order by 1,2,3;
deptno	dname	loc
10	ACCOUNTING	NEW YORK
20	RESEARCH	DALLAS
20	RESEARCH	DALLAS
30	SALES	CHICAGO
40	OPERATIONS	BOSTON
select * from t2 order by 1,2,3,4;
empno	ename	job	mgr	hiredate	sal	comm	deptno
1	MILLER	CLERK	7782	1982-01-23	1300	729	10
7369	SMITH	CLERK	7902	1980-12-17	800	100	20
7499	ALLEN	SALESMAN	7698	1981-02-20	1600	300	30
7521	WARD	SALESMAN	7698	1981-02-22	1250	500	30
7566	JONES	MANAGER	7839	1981-04-02	2975	359	20
7654	MARTIN	SALESMAN	7698	1981-09-28	1150	1400	30
7698	BLAKE	MANAGER	7839	1981-05-01	2850	-2100	30
7782	CLARK	MANAGER	7839	1981-06-09	2550	745	10
7788	SCOTT	ANALYST	7566	1987-04-13	3000	-200	20
7839	KING	PRESIDENT	NULL	1981-11-17	4999	-197	10
7844	TURNER	SALESMAN	7698	1981-09-08	1500	0	30
7876	ADAMS	CLERK	7788	1987-05-13	1100	-100	20
7900	JAMES	CLERK	7698	1981-12-03	950	-1808	30
7902	FORD	ANALYST	7566	1981-12-03	3010	754	20
7934	MILLER	CLERK	7782	1982-01-23	1300	729	10
insert into t1 values (30,'RESEARCH','DALLAS');
select * from t1 order by 1,2,3;
deptno	dname	loc
10	ACCOUNTING	NEW YORK
20	RESEARCH	DALLAS
20	RESEARCH	DALLAS
30	RESEARCH	DALLAS
30	SALES	CHICAGO
40	OPERATIONS	BOSTON
select * from t2 order by 1,2,3,4;
empno	ename	job	mgr	hiredate	sal	comm	deptno
1	MILLER	CLERK	7782	1982-01-23	1300	729	10
7369	SMITH	CLERK	7902	1980-12-17	800	100	20
7499	ALLEN	SALESMAN	7698	1981-02-20	1600	300	30
7521	WARD	SALESMAN	7698	1981-02-22	1250	500	30
7529	ALLEN	SALESMAN	7698	1981-02-20	1600	300	30
7566	JONES	MANAGER	7839	1981-04-02	2975	359	20
7654	MARTIN	SALESMAN	7698	1981-09-28	1150	1400	30
7698	BLAKE	MANAGER	7839	1981-05-01	2850	-2100	30
7782	CLARK	MANAGER	7839	1981-06-09	2550	745	10
7788	SCOTT	ANALYST	7566	1987-04-13	3000	-200	20
7839	KING	PRESIDENT	NULL	1981-11-17	4999	-197	10
7844	TURNER	SALESMAN	7698	1981-09-08	1500	0	30
7876	ADAMS	CLERK	7788	1987-05-13	1100	-100	20
7900	JAMES	CLERK	7698	1981-12-03	950	-1808	30
7902	FORD	ANALYST	7566	1981-12-03	3010	754	20
7934	MILLER	CLERK	7782	1982-01-23	1300	729	10
insert into t1 values (40,'RESEARCH','DALLAS');
ERROR 23000: Duplicate entry '1' for key 'PRIMARY'
select * from t1 order by 1,2,3;
deptno	dname	loc
10	ACCOUNTING	NEW YORK
20	RESEARCH	DALLAS
20	RESEARCH	DALLAS
30	RESEARCH	DALLAS
30	SALES	CHICAGO
40	OPERATIONS	BOSTON
select * from t2 order by 1,2,3,4;
empno	ename	job	mgr	hiredate	sal	comm	deptno
1	MILLER	CLERK	7782	1982-01-23	1300	729	10
7369	SMITH	CLERK	7902	1980-12-17	800	100	20
7499	ALLEN	SALESMAN	7698	1981-02-20	1600	300	30
7521	WARD	SALESMAN	7698	1981-02-22	1250	500	30
7529	ALLEN	SALESMAN	7698	1981-02-20	1600	300	30
7566	JONES	MANAGER	7839	1981-04-02	2975	359	20
7654	MARTIN	SALESMAN	7698	1981-09-28	1150	1400	30
7698	BLAKE	MANAGER	7839	1981-05-01	2850	-2100	30
7782	CLARK	MANAGER	7839	1981-06-09	2550	745	10
7788	SCOTT	ANALYST	7566	1987-04-13	3000	-200	20
7839	KING	PRESIDENT	NULL	1981-11-17	4999	-197	10
7844	TURNER	SALESMAN	7698	1981-09-08	1500	0	30
7876	ADAMS	CLERK	7788	1987-05-13	1100	-100	20
7900	JAMES	CLERK	7698	1981-12-03	950	-1808	30
7902	FORD	ANALYST	7566	1981-12-03	3010	754	20
7934	MILLER	CLERK	7782	1982-01-23	1300	729	10
drop table if exists t1;
drop table if exists t2;
create table t1(deptno int,dname varchar(20),loc varchar(20));
create table t2(empno int primary key,ename varchar(10),job varchar(9),mgr int,hiredate date,sal int,comm int,deptno int);
insert into t1 values (10,'ACCOUNTING','NEW YORK');
insert into t1 values (20,'RESEARCH','DALLAS');
insert into t1 values (30,'SALES','CHICAGO');
insert into t1 values (40,'OPERATIONS','BOSTON');
insert into t2 values (7369,'SMITH','CLERK',7902,'1980-12-17',800,100,20);
insert into t2 values (7499,'ALLEN','SALESMAN',7698,'1981-2-20',1600,300,30);
insert into t2 values (7521,'WARD','SALESMAN',7698,'1981-2-22',1250,500,30);
insert into t2 values (7566,'JONES','MANAGER',7839,'1981-4-2',2975,358.69,20);
insert into t2 values (7654,'MARTIN','SALESMAN',7698,'1981-9-28',1150,1400,30);
insert into t2 values (7698,'BLAKE','MANAGER',7839,'1981-5-1',2850,-2100,30);
insert into t2 values (7782,'CLARK','MANAGER',7839,'1981-6-9',2550,744.9,10);
insert into t2 values (7788,'SCOTT','ANALYST',7566,'1987-4-13',3000,-200,20);
insert into t2 values (7839,'KING','PRESIDENT',NULL,'1981-11-17',4999,-196.7,10);
insert into t2 values (7844,'TURNER','SALESMAN',7698,'1981-9-8',1500,0,30);
insert into t2 values (7876,'ADAMS','CLERK',7788,'1987-5-13',1100,-99.9,20);
insert into t2 values (7900,'JAMES','CLERK',7698,'1981-12-3',950,-1808,30);
insert into t2 values (7902,'FORD','ANALYST',7566,'1981-12-3',3010,753.9,20);
insert into t2 values (7934,'MILLER','CLERK',7782,'1982-1-23',1300,729,10);
drop trigger if exists p1;//
Warnings:
Note	1360	Trigger does not exist
create trigger p1 before insert on t1 for each row 
begin
declare duplicatekey condition for sqlstate '23000';
declare continue handler for duplicatekey 
begin 
declare b int; 
select sal from t2 where job = 'CLERK' and sal < 1000 and comm > 0 into b;
if b > 500 and exists(select * from t2 where sal = b and deptno = new.deptno) then
insert into t2 values (1,'MILLER','CLERK',7782,'1982-1-23',b,729,10); 
elseif b = 500 and exists(select * from t2 where sal = b and deptno = new.deptno) then
insert into t2 values (2,'MILLER','CLERK',7782,'1982-1-23',b,729,10); 
else
insert into t2 values (3,'MILLER','CLERK',7782,'1982-1-23',b,729,10); 
end if;
end;
if new.deptno = 10 and exists(select * from t2 where deptno = 10 and sal > 3000 ) then
insert into t2 values (7934,'MILLER','CLERK',7782,'1982-1-23',1300,729,10);
elseif new.deptno = 20 and exists(select * from t2 where deptno = 20 and sal = 3000) then
insert into t2 values (7534,'SCOTT','ANALYST',7566,'1987-4-13',3000,-200,20);
elseif new.deptno = 30 and exists(select * from t2 where deptno = 30 and sal = 1600) then
insert into t2 values (7651,'ALLEN','SALESMAN',7698,'1981-2-20',1600,300,30);
else
insert into t2 values (8201,'KING','PRESIDENT',NULL,'1981-11-17',4999,-196.7,10);
end if;
end;
//
insert into t1 values (10,'ACCOUNTING','NEW YORK');
select * from t1 order by 1,2,3;
deptno	dname	loc
10	ACCOUNTING	NEW YORK
10	ACCOUNTING	NEW YORK
20	RESEARCH	DALLAS
30	SALES	CHICAGO
40	OPERATIONS	BOSTON
select * from t2 order by 1,2,3,4;
empno	ename	job	mgr	hiredate	sal	comm	deptno
3	MILLER	CLERK	7782	1982-01-23	800	729	10
7369	SMITH	CLERK	7902	1980-12-17	800	100	20
7499	ALLEN	SALESMAN	7698	1981-02-20	1600	300	30
7521	WARD	SALESMAN	7698	1981-02-22	1250	500	30
7566	JONES	MANAGER	7839	1981-04-02	2975	359	20
7654	MARTIN	SALESMAN	7698	1981-09-28	1150	1400	30
7698	BLAKE	MANAGER	7839	1981-05-01	2850	-2100	30
7782	CLARK	MANAGER	7839	1981-06-09	2550	745	10
7788	SCOTT	ANALYST	7566	1987-04-13	3000	-200	20
7839	KING	PRESIDENT	NULL	1981-11-17	4999	-197	10
7844	TURNER	SALESMAN	7698	1981-09-08	1500	0	30
7876	ADAMS	CLERK	7788	1987-05-13	1100	-100	20
7900	JAMES	CLERK	7698	1981-12-03	950	-1808	30
7902	FORD	ANALYST	7566	1981-12-03	3010	754	20
7934	MILLER	CLERK	7782	1982-01-23	1300	729	10
insert into t1 values (20,'RESEARCH','DALLAS');
select * from t1 order by 1,2,3;
deptno	dname	loc
10	ACCOUNTING	NEW YORK
10	ACCOUNTING	NEW YORK
20	RESEARCH	DALLAS
20	RESEARCH	DALLAS
30	SALES	CHICAGO
40	OPERATIONS	BOSTON
select * from t2 order by 1,2,3,4;
empno	ename	job	mgr	hiredate	sal	comm	deptno
3	MILLER	CLERK	7782	1982-01-23	800	729	10
7369	SMITH	CLERK	7902	1980-12-17	800	100	20
7499	ALLEN	SALESMAN	7698	1981-02-20	1600	300	30
7521	WARD	SALESMAN	7698	1981-02-22	1250	500	30
7534	SCOTT	ANALYST	7566	1987-04-13	3000	-200	20
7566	JONES	MANAGER	7839	1981-04-02	2975	359	20
7654	MARTIN	SALESMAN	7698	1981-09-28	1150	1400	30
7698	BLAKE	MANAGER	7839	1981-05-01	2850	-2100	30
7782	CLARK	MANAGER	7839	1981-06-09	2550	745	10
7788	SCOTT	ANALYST	7566	1987-04-13	3000	-200	20
7839	KING	PRESIDENT	NULL	1981-11-17	4999	-197	10
7844	TURNER	SALESMAN	7698	1981-09-08	1500	0	30
7876	ADAMS	CLERK	7788	1987-05-13	1100	-100	20
7900	JAMES	CLERK	7698	1981-12-03	950	-1808	30
7902	FORD	ANALYST	7566	1981-12-03	3010	754	20
7934	MILLER	CLERK	7782	1982-01-23	1300	729	10
insert into t1 values (30,'SALES','CHICAGO');
select * from t1 order by 1,2,3;
deptno	dname	loc
10	ACCOUNTING	NEW YORK
10	ACCOUNTING	NEW YORK
20	RESEARCH	DALLAS
20	RESEARCH	DALLAS
30	SALES	CHICAGO
30	SALES	CHICAGO
40	OPERATIONS	BOSTON
select * from t2 order by 1,2,3,4;
empno	ename	job	mgr	hiredate	sal	comm	deptno
3	MILLER	CLERK	7782	1982-01-23	800	729	10
7369	SMITH	CLERK	7902	1980-12-17	800	100	20
7499	ALLEN	SALESMAN	7698	1981-02-20	1600	300	30
7521	WARD	SALESMAN	7698	1981-02-22	1250	500	30
7534	SCOTT	ANALYST	7566	1987-04-13	3000	-200	20
7566	JONES	MANAGER	7839	1981-04-02	2975	359	20
7651	ALLEN	SALESMAN	7698	1981-02-20	1600	300	30
7654	MARTIN	SALESMAN	7698	1981-09-28	1150	1400	30
7698	BLAKE	MANAGER	7839	1981-05-01	2850	-2100	30
7782	CLARK	MANAGER	7839	1981-06-09	2550	745	10
7788	SCOTT	ANALYST	7566	1987-04-13	3000	-200	20
7839	KING	PRESIDENT	NULL	1981-11-17	4999	-197	10
7844	TURNER	SALESMAN	7698	1981-09-08	1500	0	30
7876	ADAMS	CLERK	7788	1987-05-13	1100	-100	20
7900	JAMES	CLERK	7698	1981-12-03	950	-1808	30
7902	FORD	ANALYST	7566	1981-12-03	3010	754	20
7934	MILLER	CLERK	7782	1982-01-23	1300	729	10
insert into t1 values (40,'OPERATIONS','BOSTON');
select * from t1 order by 1,2,3;
deptno	dname	loc
10	ACCOUNTING	NEW YORK
10	ACCOUNTING	NEW YORK
20	RESEARCH	DALLAS
20	RESEARCH	DALLAS
30	SALES	CHICAGO
30	SALES	CHICAGO
40	OPERATIONS	BOSTON
40	OPERATIONS	BOSTON
select * from t2 order by 1,2,3,4;
empno	ename	job	mgr	hiredate	sal	comm	deptno
3	MILLER	CLERK	7782	1982-01-23	800	729	10
7369	SMITH	CLERK	7902	1980-12-17	800	100	20
7499	ALLEN	SALESMAN	7698	1981-02-20	1600	300	30
7521	WARD	SALESMAN	7698	1981-02-22	1250	500	30
7534	SCOTT	ANALYST	7566	1987-04-13	3000	-200	20
7566	JONES	MANAGER	7839	1981-04-02	2975	359	20
7651	ALLEN	SALESMAN	7698	1981-02-20	1600	300	30
7654	MARTIN	SALESMAN	7698	1981-09-28	1150	1400	30
7698	BLAKE	MANAGER	7839	1981-05-01	2850	-2100	30
7782	CLARK	MANAGER	7839	1981-06-09	2550	745	10
7788	SCOTT	ANALYST	7566	1987-04-13	3000	-200	20
7839	KING	PRESIDENT	NULL	1981-11-17	4999	-197	10
7844	TURNER	SALESMAN	7698	1981-09-08	1500	0	30
7876	ADAMS	CLERK	7788	1987-05-13	1100	-100	20
7900	JAMES	CLERK	7698	1981-12-03	950	-1808	30
7902	FORD	ANALYST	7566	1981-12-03	3010	754	20
7934	MILLER	CLERK	7782	1982-01-23	1300	729	10
8201	KING	PRESIDENT	NULL	1981-11-17	4999	-197	10
drop table if exists t1;
drop table if exists t2;
# Clean up users
drop user longpy@'%' ;
