alter system set ob_vector_memory_limit_percentage = 30;
========== setup ==========
drop table if exists t1;
create table t1 (
id int primary key,
vec vector(3),
VECTOR INDEX idx1(vec) WITH (distance=l2, type=hnsw, lib=vsag, sync_mode=async)
) organization heap;
select id, vec from t1 order by l2_distance(vec, '[1.0, 1.0, 1.0]') approximate limit 3;
id	vec

========== 1. Basic INSERT and ANN query ==========
insert into t1 values (1, '[1.0, 1.0, 1.0]');
insert into t1 values (2, '[2.0, 2.0, 2.0]');
insert into t1 values (3, '[3.0, 3.0, 3.0]');
insert into t1 values (4, '[4.0, 4.0, 4.0]');
insert into t1 values (5, '[5.0, 5.0, 5.0]');
insert into t1 values (6, '[6.0, 6.0, 6.0]');
insert into t1 values (7, '[7.0, 7.0, 7.0]');
insert into t1 values (8, '[8.0, 8.0, 8.0]');
insert into t1 values (9, '[9.0, 9.0, 9.0]');
insert into t1 values (10, '[10.0, 10.0, 10.0]');
call dbms_index_manager.refresh();
explain basic select id, vec from t1 order by l2_distance(vec, '[1.0, 1.0, 1.0]') approximate limit 3;
Query Plan
===============================
|ID|OPERATOR         |NAME    |
-------------------------------
|0 |VECTOR INDEX SCAN|t1(idx1)|
===============================
Outputs & filters:
-------------------------------------
  0 - output([t1.id], [t1.vec]), filter(nil), rowset=16
      access([t1.__pk_increment], [t1.vec], [t1.id]), partitions(p0)
      is_index_back=true, is_global_index=false, 
      range_key([t1.__pk_increment], [t1.__type_0_0]), range(MIN,MIN ; MAX,MAX)always true
select id, vec from t1 order by l2_distance(vec, '[1.0, 1.0, 1.0]') approximate limit 3;
id	vec
1	[1,1,1]
2	[2,2,2]
3	[3,3,3]
select id, vec from t1 order by l2_distance(vec, '[5.0, 5.0, 5.0]') approximate limit 3;
id	vec
5	[5,5,5]
4	[4,4,4]
6	[6,6,6]

========== 2. INSERT more data and query ==========
insert into t1 values (11, '[1.5, 1.5, 1.5]');
insert into t1 values (12, '[5.5, 5.5, 5.5]');
call dbms_index_manager.refresh();
select id, vec from t1 order by l2_distance(vec, '[1.0, 1.0, 1.0]') approximate limit 3;
id	vec
1	[1,1,1]
11	[1.5,1.5,1.5]
2	[2,2,2]

========== 3. DELETE and verify removed from results ==========
delete from t1 where id = 1;
delete from t1 where id = 2;
call dbms_index_manager.refresh();
select id, vec from t1 order by l2_distance(vec, '[1.0, 1.0, 1.0]') approximate limit 3;
id	vec
11	[1.5,1.5,1.5]
3	[3,3,3]
4	[4,4,4]

========== 4. UPDATE vector column ==========
update t1 set vec = '[1.1, 1.1, 1.1]' where id = 3;
call dbms_index_manager.refresh();
select id, vec from t1 order by l2_distance(vec, '[1.0, 1.0, 1.0]') approximate limit 3;
id	vec
3	[1.1,1.1,1.1]
11	[1.5,1.5,1.5]
4	[4,4,4]

========== 5. Batch INSERT ==========
call dbms_index_manager.refresh();
select count(*) from t1;
count(*)
60
select id, vec from t1 order by l2_distance(vec, '[120.0, 120.0, 120.0]') approximate limit 3;
id	vec
120	[120,120,120]
119	[119,119,119]
121	[121,121,121]

========== 6. DELETE all and verify empty result ==========
delete from t1;
call dbms_index_manager.refresh();
select id, vec from t1 order by l2_distance(vec, '[1.0, 1.0, 1.0]') approximate limit 3;
id	vec
select count(*) from t1;
count(*)
0

========== cleanup ==========
drop table t1;
alter system set ob_vector_memory_limit_percentage = 0;
PURGE RECYCLEBIN;
