>>dml + null
drop table if exists t1;
create table t1 (a int primary key auto_increment, b varchar(20));
insert into t1 values(null,'1_null'),(null,'2_null'),(null,'3_null'),(null,'4_null');
insert into t1(b) values('5_no'),('6_no'),('7_no'),('8_no');
replace into t1 values(null,'9_null'),(null,'10_null'),(null,'11_null'),(null,'12_null');
replace into t1(b) values('13_no'),('14_no'),('15_no'),('16_no');
select * from t1;
a	b
1	1_null
2	2_null
3	3_null
4	4_null
5	5_no
6	6_no
7	7_no
8	8_no
9	9_null
10	10_null
11	11_null
12	12_null
13	13_no
14	14_no
15	15_no
16	16_no
update t1 set a=a+100 where a=10;
insert into t1 values(null,'17_insert');
select * from t1 where b='17_insert';
a	b
17	17_insert
delete from t1 where a=3;
insert into t1 values(null,'18_insert');
select * from t1 where b='18_insert';
a	b
18	18_insert
>>dml + 0
drop table if exists t1;
create table t1 (a int primary key auto_increment, b varchar(20));
insert into t1 values(0,'1_0'),(0,'2_0'),(0,'3_0'),(0,'4_0');
insert into t1(b) values('5_no'),('6_no'),('7_no'),('8_no');
replace into t1 values(0,'9_0'),(0,'10_0'),(0,'11_0'),(0,'12_0');
replace into t1(b) values('13_no'),('14_no'),('15_no'),('16_no');
select * from t1;
a	b
1	1_0
2	2_0
3	3_0
4	4_0
5	5_no
6	6_no
7	7_no
8	8_no
9	9_0
10	10_0
11	11_0
12	12_0
13	13_no
14	14_no
15	15_no
16	16_no
update t1 set a=a+100 where a=10;
insert into t1 values(0,'17_insert');
select * from t1 where b='17_insert';
a	b
17	17_insert
delete from t1 where a=3;
insert into t1 values(0,'18_insert');
select * from t1 where b='18_insert';
a	b
18	18_insert
>>update will not update auto_increment, may introduce duplicate key
insert into t1 values(110,'');
ERROR 23000: Duplicate entry '110' for key 'PRIMARY'
>> There can be duplidate value in auto_increment field when this field is not in primary key or unique index
drop table if exists t1;
create table t1 (a int auto_increment, b varchar(20));
insert into t1 values(1,1),(1,1);
select * from t1;
a	b
1	1
1	1
drop table if exists t1;
