ob1=OBI(cluster=1,init_unit_cpu=2);
ob1.reboot;
ob1.mysql alter system set resource_hard_limit= 800;
drop tenant if exists oracle;
drop resource pool if exists oblog_pool;
drop resource unit if exists oblog_box;
ob1.mysql create resource unit oblog_box max_cpu=2, memory_size='10G';
ob1.mysql create resource pool oblog_pool unit = 'oblog_box', unit_num = 1;
ob1.mysql create tenant oracle replica_num = 1, resource_pool_list=('oblog_pool') set ob_tcp_invited_nodes='%', ob_compatibility_mode='oracle';
create user obtest IDENTIFIED BY "obtest";
grant all on *.* to obtest WITH GRANT OPTION;
grant dba to obtest;
alter session set current_schema = oblog_db;
ob1.oblog.gen_conf tb_white_list=oracle.*.* log_level=DEBUG skip_ob_version_compat_check=1;
ob1.oblog.restart;
create table number_1(c0 int primary key, c1 number);
ob1.oblog.next;
[R0] record_type:EDDL;[R0] db_name:oracle.OBLOG_DB;[R0] table_name:;[R0] column_count:1;[R0] column_name:ddl;[R0] ddl_stmt_str: create table number_1(c0 int primary key, c1 number);[R0] ddl_stmt_len: 52;
desc number_1;
FIELD	TYPE	NULL	KEY	DEFAULT	EXTRA
C0	NUMBER(38)	NO	PRI	NULL	NULL
C1	NUMBER	YES	NULL	NULL	NULL
insert into number_1 values(1, 123456789123456789123456789123456789123456789);
select * from number_1 where C0=1;
C0	C1
1	123456789123456789123456789123456789123000000
ob1.oblog.next;
[R0] BEGIN;[R0] org_cluster_id:1;[R1] record_type:INSERT;[R1] database_name:oracle.OBLOG_DB;[R1] table_name:NUMBER_1;[R1] log_event:true;[R1] column_count:2;[R1] source_category:SRC_FULL_RECORDED;[R1] source_type:SRC_OCEANBASE_1_0;[R1] has_pk:true;[R1] pk_info:(0);[R1] pks:C0;[R1] has_uk:false;[R1] uk_info:(null);[R1] uks:(null);[R1] [C1] column_name:C0;[R1] [C1] column_type:MYSQL_TYPE_NEWDECIMAL;[R1] [C1] column_is_rowkey:true;[R1] [C1] column_is_signed:true;[R1] [C1] column_encoding:binary;[R1] [C1] column_is_not_null:true;[R1] [C1] column_value_new:[1](1);[R1] [C2] column_name:C1;[R1] [C2] column_type:MYSQL_TYPE_NEWDECIMAL;[R1] [C2] column_is_rowkey:false;[R1] [C2] column_is_signed:true;[R1] [C2] column_encoding:binary;[R1] [C2] column_is_not_null:false;[R1] [C2] column_value_new:[123456789123456789123456789123456789123000000](45);$[R2] COMMIT;
insert into number_1 values(2, -123456789123456789123456789123456789123456789);
select * from number_1 where C0=2;
C0	C1
2	-123456789123456789123456789123456789123000000
ob1.oblog.next;
[R0] BEGIN;[R0] org_cluster_id:1;[R1] record_type:INSERT;[R1] database_name:oracle.OBLOG_DB;[R1] table_name:NUMBER_1;[R1] log_event:true;[R1] column_count:2;[R1] source_category:SRC_FULL_RECORDED;[R1] source_type:SRC_OCEANBASE_1_0;[R1] has_pk:true;[R1] pk_info:(0);[R1] pks:C0;[R1] has_uk:false;[R1] uk_info:(null);[R1] uks:(null);[R1] [C1] column_name:C0;[R1] [C1] column_type:MYSQL_TYPE_NEWDECIMAL;[R1] [C1] column_is_rowkey:true;[R1] [C1] column_is_signed:true;[R1] [C1] column_encoding:binary;[R1] [C1] column_is_not_null:true;[R1] [C1] column_value_new:[2](1);[R1] [C2] column_name:C1;[R1] [C2] column_type:MYSQL_TYPE_NEWDECIMAL;[R1] [C2] column_is_rowkey:false;[R1] [C2] column_is_signed:true;[R1] [C2] column_encoding:binary;[R1] [C2] column_is_not_null:false;[R1] [C2] column_value_new:[-123456789123456789123456789123456789123000000](46);$[R2] COMMIT;
insert into number_1 values(3, 123456789123456789123456789123456789123556789);
select * from number_1 where C0=3;
C0	C1
3	123456789123456789123456789123456789124000000
ob1.oblog.next;
[R0] BEGIN;[R0] org_cluster_id:1;[R1] record_type:INSERT;[R1] database_name:oracle.OBLOG_DB;[R1] table_name:NUMBER_1;[R1] log_event:true;[R1] column_count:2;[R1] source_category:SRC_FULL_RECORDED;[R1] source_type:SRC_OCEANBASE_1_0;[R1] has_pk:true;[R1] pk_info:(0);[R1] pks:C0;[R1] has_uk:false;[R1] uk_info:(null);[R1] uks:(null);[R1] [C1] column_name:C0;[R1] [C1] column_type:MYSQL_TYPE_NEWDECIMAL;[R1] [C1] column_is_rowkey:true;[R1] [C1] column_is_signed:true;[R1] [C1] column_encoding:binary;[R1] [C1] column_is_not_null:true;[R1] [C1] column_value_new:[3](1);[R1] [C2] column_name:C1;[R1] [C2] column_type:MYSQL_TYPE_NEWDECIMAL;[R1] [C2] column_is_rowkey:false;[R1] [C2] column_is_signed:true;[R1] [C2] column_encoding:binary;[R1] [C2] column_is_not_null:false;[R1] [C2] column_value_new:[123456789123456789123456789123456789124000000](45);$[R2] COMMIT;
insert into number_1 values(4, -123456789123456789123456789123456789123556789);
select * from number_1 where C0=4;
C0	C1
4	-123456789123456789123456789123456789124000000
ob1.oblog.next;
[R0] BEGIN;[R0] org_cluster_id:1;[R1] record_type:INSERT;[R1] database_name:oracle.OBLOG_DB;[R1] table_name:NUMBER_1;[R1] log_event:true;[R1] column_count:2;[R1] source_category:SRC_FULL_RECORDED;[R1] source_type:SRC_OCEANBASE_1_0;[R1] has_pk:true;[R1] pk_info:(0);[R1] pks:C0;[R1] has_uk:false;[R1] uk_info:(null);[R1] uks:(null);[R1] [C1] column_name:C0;[R1] [C1] column_type:MYSQL_TYPE_NEWDECIMAL;[R1] [C1] column_is_rowkey:true;[R1] [C1] column_is_signed:true;[R1] [C1] column_encoding:binary;[R1] [C1] column_is_not_null:true;[R1] [C1] column_value_new:[4](1);[R1] [C2] column_name:C1;[R1] [C2] column_type:MYSQL_TYPE_NEWDECIMAL;[R1] [C2] column_is_rowkey:false;[R1] [C2] column_is_signed:true;[R1] [C2] column_encoding:binary;[R1] [C2] column_is_not_null:false;[R1] [C2] column_value_new:[-123456789123456789123456789123456789124000000](46);$[R2] COMMIT;
insert into number_1 values(5, 12345678912345678912345678912345678912345678);
select * from number_1 where C0=5;
C0	C1
5	12345678912345678912345678912345678912350000
ob1.oblog.next;
[R0] BEGIN;[R0] org_cluster_id:1;[R1] record_type:INSERT;[R1] database_name:oracle.OBLOG_DB;[R1] table_name:NUMBER_1;[R1] log_event:true;[R1] column_count:2;[R1] source_category:SRC_FULL_RECORDED;[R1] source_type:SRC_OCEANBASE_1_0;[R1] has_pk:true;[R1] pk_info:(0);[R1] pks:C0;[R1] has_uk:false;[R1] uk_info:(null);[R1] uks:(null);[R1] [C1] column_name:C0;[R1] [C1] column_type:MYSQL_TYPE_NEWDECIMAL;[R1] [C1] column_is_rowkey:true;[R1] [C1] column_is_signed:true;[R1] [C1] column_encoding:binary;[R1] [C1] column_is_not_null:true;[R1] [C1] column_value_new:[5](1);[R1] [C2] column_name:C1;[R1] [C2] column_type:MYSQL_TYPE_NEWDECIMAL;[R1] [C2] column_is_rowkey:false;[R1] [C2] column_is_signed:true;[R1] [C2] column_encoding:binary;[R1] [C2] column_is_not_null:false;[R1] [C2] column_value_new:[12345678912345678912345678912345678912350000](44);$[R2] COMMIT;
insert into number_1 values(6, -12345678912345678912345678912345678912345678);
select * from number_1 where C0=6;
C0	C1
6	-12345678912345678912345678912345678912350000
ob1.oblog.next;
[R0] BEGIN;[R0] org_cluster_id:1;[R1] record_type:INSERT;[R1] database_name:oracle.OBLOG_DB;[R1] table_name:NUMBER_1;[R1] log_event:true;[R1] column_count:2;[R1] source_category:SRC_FULL_RECORDED;[R1] source_type:SRC_OCEANBASE_1_0;[R1] has_pk:true;[R1] pk_info:(0);[R1] pks:C0;[R1] has_uk:false;[R1] uk_info:(null);[R1] uks:(null);[R1] [C1] column_name:C0;[R1] [C1] column_type:MYSQL_TYPE_NEWDECIMAL;[R1] [C1] column_is_rowkey:true;[R1] [C1] column_is_signed:true;[R1] [C1] column_encoding:binary;[R1] [C1] column_is_not_null:true;[R1] [C1] column_value_new:[6](1);[R1] [C2] column_name:C1;[R1] [C2] column_type:MYSQL_TYPE_NEWDECIMAL;[R1] [C2] column_is_rowkey:false;[R1] [C2] column_is_signed:true;[R1] [C2] column_encoding:binary;[R1] [C2] column_is_not_null:false;[R1] [C2] column_value_new:[-12345678912345678912345678912345678912350000](45);$[R2] COMMIT;
insert into number_1 values(7, 12345678912345678912345678912345678912344678);
select * from number_1 where C0=7;
C0	C1
7	12345678912345678912345678912345678912340000
ob1.oblog.next;
[R0] BEGIN;[R0] org_cluster_id:1;[R1] record_type:INSERT;[R1] database_name:oracle.OBLOG_DB;[R1] table_name:NUMBER_1;[R1] log_event:true;[R1] column_count:2;[R1] source_category:SRC_FULL_RECORDED;[R1] source_type:SRC_OCEANBASE_1_0;[R1] has_pk:true;[R1] pk_info:(0);[R1] pks:C0;[R1] has_uk:false;[R1] uk_info:(null);[R1] uks:(null);[R1] [C1] column_name:C0;[R1] [C1] column_type:MYSQL_TYPE_NEWDECIMAL;[R1] [C1] column_is_rowkey:true;[R1] [C1] column_is_signed:true;[R1] [C1] column_encoding:binary;[R1] [C1] column_is_not_null:true;[R1] [C1] column_value_new:[7](1);[R1] [C2] column_name:C1;[R1] [C2] column_type:MYSQL_TYPE_NEWDECIMAL;[R1] [C2] column_is_rowkey:false;[R1] [C2] column_is_signed:true;[R1] [C2] column_encoding:binary;[R1] [C2] column_is_not_null:false;[R1] [C2] column_value_new:[12345678912345678912345678912345678912340000](44);$[R2] COMMIT;
insert into number_1 values(8, -12345678912345678912345678912345678912344678);
select * from number_1 where C0=8;
C0	C1
8	-12345678912345678912345678912345678912340000
ob1.oblog.next;
[R0] BEGIN;[R0] org_cluster_id:1;[R1] record_type:INSERT;[R1] database_name:oracle.OBLOG_DB;[R1] table_name:NUMBER_1;[R1] log_event:true;[R1] column_count:2;[R1] source_category:SRC_FULL_RECORDED;[R1] source_type:SRC_OCEANBASE_1_0;[R1] has_pk:true;[R1] pk_info:(0);[R1] pks:C0;[R1] has_uk:false;[R1] uk_info:(null);[R1] uks:(null);[R1] [C1] column_name:C0;[R1] [C1] column_type:MYSQL_TYPE_NEWDECIMAL;[R1] [C1] column_is_rowkey:true;[R1] [C1] column_is_signed:true;[R1] [C1] column_encoding:binary;[R1] [C1] column_is_not_null:true;[R1] [C1] column_value_new:[8](1);[R1] [C2] column_name:C1;[R1] [C2] column_type:MYSQL_TYPE_NEWDECIMAL;[R1] [C2] column_is_rowkey:false;[R1] [C2] column_is_signed:true;[R1] [C2] column_encoding:binary;[R1] [C2] column_is_not_null:false;[R1] [C2] column_value_new:[-12345678912345678912345678912345678912340000](45);$[R2] COMMIT;
insert into number_1 values(9, 1234567.89);
select * from number_1 where C0=9;
C0	C1
9	1234567.89
ob1.oblog.next;
[R0] BEGIN;[R0] org_cluster_id:1;[R1] record_type:INSERT;[R1] database_name:oracle.OBLOG_DB;[R1] table_name:NUMBER_1;[R1] log_event:true;[R1] column_count:2;[R1] source_category:SRC_FULL_RECORDED;[R1] source_type:SRC_OCEANBASE_1_0;[R1] has_pk:true;[R1] pk_info:(0);[R1] pks:C0;[R1] has_uk:false;[R1] uk_info:(null);[R1] uks:(null);[R1] [C1] column_name:C0;[R1] [C1] column_type:MYSQL_TYPE_NEWDECIMAL;[R1] [C1] column_is_rowkey:true;[R1] [C1] column_is_signed:true;[R1] [C1] column_encoding:binary;[R1] [C1] column_is_not_null:true;[R1] [C1] column_value_new:[9](1);[R1] [C2] column_name:C1;[R1] [C2] column_type:MYSQL_TYPE_NEWDECIMAL;[R1] [C2] column_is_rowkey:false;[R1] [C2] column_is_signed:true;[R1] [C2] column_encoding:binary;[R1] [C2] column_is_not_null:false;[R1] [C2] column_value_new:[1234567.89](10);$[R2] COMMIT;
insert into number_1 values(10, 123456789.123456789);
select * from number_1 where C0=10;
C0	C1
10	123456789.123456789
ob1.oblog.next;
[R0] BEGIN;[R0] org_cluster_id:1;[R1] record_type:INSERT;[R1] database_name:oracle.OBLOG_DB;[R1] table_name:NUMBER_1;[R1] log_event:true;[R1] column_count:2;[R1] source_category:SRC_FULL_RECORDED;[R1] source_type:SRC_OCEANBASE_1_0;[R1] has_pk:true;[R1] pk_info:(0);[R1] pks:C0;[R1] has_uk:false;[R1] uk_info:(null);[R1] uks:(null);[R1] [C1] column_name:C0;[R1] [C1] column_type:MYSQL_TYPE_NEWDECIMAL;[R1] [C1] column_is_rowkey:true;[R1] [C1] column_is_signed:true;[R1] [C1] column_encoding:binary;[R1] [C1] column_is_not_null:true;[R1] [C1] column_value_new:[10](2);[R1] [C2] column_name:C1;[R1] [C2] column_type:MYSQL_TYPE_NEWDECIMAL;[R1] [C2] column_is_rowkey:false;[R1] [C2] column_is_signed:true;[R1] [C2] column_encoding:binary;[R1] [C2] column_is_not_null:false;[R1] [C2] column_value_new:[123456789.123456789](19);$[R2] COMMIT;
insert into number_1 values(11, 123456789.123456789123456789123456789123456789);
select * from number_1 where C0=11;
C0	C1
11	123456789.123456789123456789123456789123
ob1.oblog.next;
[R0] BEGIN;[R0] org_cluster_id:1;[R1] record_type:INSERT;[R1] database_name:oracle.OBLOG_DB;[R1] table_name:NUMBER_1;[R1] log_event:true;[R1] column_count:2;[R1] source_category:SRC_FULL_RECORDED;[R1] source_type:SRC_OCEANBASE_1_0;[R1] has_pk:true;[R1] pk_info:(0);[R1] pks:C0;[R1] has_uk:false;[R1] uk_info:(null);[R1] uks:(null);[R1] [C1] column_name:C0;[R1] [C1] column_type:MYSQL_TYPE_NEWDECIMAL;[R1] [C1] column_is_rowkey:true;[R1] [C1] column_is_signed:true;[R1] [C1] column_encoding:binary;[R1] [C1] column_is_not_null:true;[R1] [C1] column_value_new:[11](2);[R1] [C2] column_name:C1;[R1] [C2] column_type:MYSQL_TYPE_NEWDECIMAL;[R1] [C2] column_is_rowkey:false;[R1] [C2] column_is_signed:true;[R1] [C2] column_encoding:binary;[R1] [C2] column_is_not_null:false;[R1] [C2] column_value_new:[123456789.123456789123456789123456789123](40);$[R2] COMMIT;
insert into number_1 values(12, -123456789.123456789123456789123456789123456789);
select * from number_1 where C0=12;
C0	C1
12	-123456789.123456789123456789123456789123
ob1.oblog.next;
[R0] BEGIN;[R0] org_cluster_id:1;[R1] record_type:INSERT;[R1] database_name:oracle.OBLOG_DB;[R1] table_name:NUMBER_1;[R1] log_event:true;[R1] column_count:2;[R1] source_category:SRC_FULL_RECORDED;[R1] source_type:SRC_OCEANBASE_1_0;[R1] has_pk:true;[R1] pk_info:(0);[R1] pks:C0;[R1] has_uk:false;[R1] uk_info:(null);[R1] uks:(null);[R1] [C1] column_name:C0;[R1] [C1] column_type:MYSQL_TYPE_NEWDECIMAL;[R1] [C1] column_is_rowkey:true;[R1] [C1] column_is_signed:true;[R1] [C1] column_encoding:binary;[R1] [C1] column_is_not_null:true;[R1] [C1] column_value_new:[12](2);[R1] [C2] column_name:C1;[R1] [C2] column_type:MYSQL_TYPE_NEWDECIMAL;[R1] [C2] column_is_rowkey:false;[R1] [C2] column_is_signed:true;[R1] [C2] column_encoding:binary;[R1] [C2] column_is_not_null:false;[R1] [C2] column_value_new:[-123456789.123456789123456789123456789123](41);$[R2] COMMIT;
insert into number_1 values(13, 123456789.123456789123456789123456789123556789);
select * from number_1 where C0=13;
C0	C1
13	123456789.123456789123456789123456789124
ob1.oblog.next;
[R0] BEGIN;[R0] org_cluster_id:1;[R1] record_type:INSERT;[R1] database_name:oracle.OBLOG_DB;[R1] table_name:NUMBER_1;[R1] log_event:true;[R1] column_count:2;[R1] source_category:SRC_FULL_RECORDED;[R1] source_type:SRC_OCEANBASE_1_0;[R1] has_pk:true;[R1] pk_info:(0);[R1] pks:C0;[R1] has_uk:false;[R1] uk_info:(null);[R1] uks:(null);[R1] [C1] column_name:C0;[R1] [C1] column_type:MYSQL_TYPE_NEWDECIMAL;[R1] [C1] column_is_rowkey:true;[R1] [C1] column_is_signed:true;[R1] [C1] column_encoding:binary;[R1] [C1] column_is_not_null:true;[R1] [C1] column_value_new:[13](2);[R1] [C2] column_name:C1;[R1] [C2] column_type:MYSQL_TYPE_NEWDECIMAL;[R1] [C2] column_is_rowkey:false;[R1] [C2] column_is_signed:true;[R1] [C2] column_encoding:binary;[R1] [C2] column_is_not_null:false;[R1] [C2] column_value_new:[123456789.123456789123456789123456789124](40);$[R2] COMMIT;
insert into number_1 values(14, -123456789.123456789123456789123456789123556789);
select * from number_1 where C0=14;
C0	C1
14	-123456789.123456789123456789123456789124
ob1.oblog.next;
[R0] BEGIN;[R0] org_cluster_id:1;[R1] record_type:INSERT;[R1] database_name:oracle.OBLOG_DB;[R1] table_name:NUMBER_1;[R1] log_event:true;[R1] column_count:2;[R1] source_category:SRC_FULL_RECORDED;[R1] source_type:SRC_OCEANBASE_1_0;[R1] has_pk:true;[R1] pk_info:(0);[R1] pks:C0;[R1] has_uk:false;[R1] uk_info:(null);[R1] uks:(null);[R1] [C1] column_name:C0;[R1] [C1] column_type:MYSQL_TYPE_NEWDECIMAL;[R1] [C1] column_is_rowkey:true;[R1] [C1] column_is_signed:true;[R1] [C1] column_encoding:binary;[R1] [C1] column_is_not_null:true;[R1] [C1] column_value_new:[14](2);[R1] [C2] column_name:C1;[R1] [C2] column_type:MYSQL_TYPE_NEWDECIMAL;[R1] [C2] column_is_rowkey:false;[R1] [C2] column_is_signed:true;[R1] [C2] column_encoding:binary;[R1] [C2] column_is_not_null:false;[R1] [C2] column_value_new:[-123456789.123456789123456789123456789124](41);$[R2] COMMIT;
insert into number_1 values(15, 123456789.12345678912345678912345678912355678);
select * from number_1 where C0=15;
C0	C1
15	123456789.123456789123456789123456789124
ob1.oblog.next;
[R0] BEGIN;[R0] org_cluster_id:1;[R1] record_type:INSERT;[R1] database_name:oracle.OBLOG_DB;[R1] table_name:NUMBER_1;[R1] log_event:true;[R1] column_count:2;[R1] source_category:SRC_FULL_RECORDED;[R1] source_type:SRC_OCEANBASE_1_0;[R1] has_pk:true;[R1] pk_info:(0);[R1] pks:C0;[R1] has_uk:false;[R1] uk_info:(null);[R1] uks:(null);[R1] [C1] column_name:C0;[R1] [C1] column_type:MYSQL_TYPE_NEWDECIMAL;[R1] [C1] column_is_rowkey:true;[R1] [C1] column_is_signed:true;[R1] [C1] column_encoding:binary;[R1] [C1] column_is_not_null:true;[R1] [C1] column_value_new:[15](2);[R1] [C2] column_name:C1;[R1] [C2] column_type:MYSQL_TYPE_NEWDECIMAL;[R1] [C2] column_is_rowkey:false;[R1] [C2] column_is_signed:true;[R1] [C2] column_encoding:binary;[R1] [C2] column_is_not_null:false;[R1] [C2] column_value_new:[123456789.123456789123456789123456789124](40);$[R2] COMMIT;
insert into number_1 values(16, -123456789.12345678912345678912345678912355678);
select * from number_1 where C0=16;
C0	C1
16	-123456789.123456789123456789123456789124
ob1.oblog.next;
[R0] BEGIN;[R0] org_cluster_id:1;[R1] record_type:INSERT;[R1] database_name:oracle.OBLOG_DB;[R1] table_name:NUMBER_1;[R1] log_event:true;[R1] column_count:2;[R1] source_category:SRC_FULL_RECORDED;[R1] source_type:SRC_OCEANBASE_1_0;[R1] has_pk:true;[R1] pk_info:(0);[R1] pks:C0;[R1] has_uk:false;[R1] uk_info:(null);[R1] uks:(null);[R1] [C1] column_name:C0;[R1] [C1] column_type:MYSQL_TYPE_NEWDECIMAL;[R1] [C1] column_is_rowkey:true;[R1] [C1] column_is_signed:true;[R1] [C1] column_encoding:binary;[R1] [C1] column_is_not_null:true;[R1] [C1] column_value_new:[16](2);[R1] [C2] column_name:C1;[R1] [C2] column_type:MYSQL_TYPE_NEWDECIMAL;[R1] [C2] column_is_rowkey:false;[R1] [C2] column_is_signed:true;[R1] [C2] column_encoding:binary;[R1] [C2] column_is_not_null:false;[R1] [C2] column_value_new:[-123456789.123456789123456789123456789124](41);$[R2] COMMIT;
insert into number_1 values(17, 123456789.12345678912345678912345678912344678);
select * from number_1 where C0=17;
C0	C1
17	123456789.123456789123456789123456789123
ob1.oblog.next;
[R0] BEGIN;[R0] org_cluster_id:1;[R1] record_type:INSERT;[R1] database_name:oracle.OBLOG_DB;[R1] table_name:NUMBER_1;[R1] log_event:true;[R1] column_count:2;[R1] source_category:SRC_FULL_RECORDED;[R1] source_type:SRC_OCEANBASE_1_0;[R1] has_pk:true;[R1] pk_info:(0);[R1] pks:C0;[R1] has_uk:false;[R1] uk_info:(null);[R1] uks:(null);[R1] [C1] column_name:C0;[R1] [C1] column_type:MYSQL_TYPE_NEWDECIMAL;[R1] [C1] column_is_rowkey:true;[R1] [C1] column_is_signed:true;[R1] [C1] column_encoding:binary;[R1] [C1] column_is_not_null:true;[R1] [C1] column_value_new:[17](2);[R1] [C2] column_name:C1;[R1] [C2] column_type:MYSQL_TYPE_NEWDECIMAL;[R1] [C2] column_is_rowkey:false;[R1] [C2] column_is_signed:true;[R1] [C2] column_encoding:binary;[R1] [C2] column_is_not_null:false;[R1] [C2] column_value_new:[123456789.123456789123456789123456789123](40);$[R2] COMMIT;
insert into number_1 values(18, -123456789.12345678912345678912345678912344678);
select * from number_1 where C0=18;
C0	C1
18	-123456789.123456789123456789123456789123
ob1.oblog.next;
[R0] BEGIN;[R0] org_cluster_id:1;[R1] record_type:INSERT;[R1] database_name:oracle.OBLOG_DB;[R1] table_name:NUMBER_1;[R1] log_event:true;[R1] column_count:2;[R1] source_category:SRC_FULL_RECORDED;[R1] source_type:SRC_OCEANBASE_1_0;[R1] has_pk:true;[R1] pk_info:(0);[R1] pks:C0;[R1] has_uk:false;[R1] uk_info:(null);[R1] uks:(null);[R1] [C1] column_name:C0;[R1] [C1] column_type:MYSQL_TYPE_NEWDECIMAL;[R1] [C1] column_is_rowkey:true;[R1] [C1] column_is_signed:true;[R1] [C1] column_encoding:binary;[R1] [C1] column_is_not_null:true;[R1] [C1] column_value_new:[18](2);[R1] [C2] column_name:C1;[R1] [C2] column_type:MYSQL_TYPE_NEWDECIMAL;[R1] [C2] column_is_rowkey:false;[R1] [C2] column_is_signed:true;[R1] [C2] column_encoding:binary;[R1] [C2] column_is_not_null:false;[R1] [C2] column_value_new:[-123456789.123456789123456789123456789123](41);$[R2] COMMIT;
drop table number_1;
ob1.oblog.next;
[R0] record_type:EDDL;[R0] db_name:oracle.OBLOG_DB;[R0] table_name:;[R0] column_count:1;[R0] column_name:ddl;[R0] ddl_stmt_str: DROP TABLE "OBLOG_DB"."NUMBER_1";[R0] ddl_stmt_len: 32;
set @@sql_mode='PIPES_AS_CONCAT,STRICT_ALL_TABLES,PAD_CHAR_TO_FULL_LENGTH';
create table number_1 (c0 number default 12.34, c1 binary_double default 12.34d, c2 binary_float default 12.34f, c3 number default 12.34e0, c4 float(10) default 12.34, c5 float default 12.34e0, c6 varchar2(100 char) default '12.34', c7 char(100 char) default '12.34', constraint number_1_pk primary key(c0));
ob1.oblog.next;
[R0] record_type:EDDL;[R0] db_name:oracle.OBLOG_DB;[R0] table_name:;[R0] column_count:1;[R0] column_name:ddl;[R0] ddl_stmt_str: create table number_1 (c0 number default 12.34, c1 binary_double default 12.34d, c2 binary_float default 12.34f, c3 number default 12.34e0, c4 float(10) default 12.34, c5 float default 12.34e0, c6 varchar2(100 char) default '12.34', c7 char(100 char) default '12.34', constraint number_1_pk primary key(c0));[R0] ddl_stmt_len: 307;
desc number_1;
FIELD	TYPE	NULL	KEY	DEFAULT	EXTRA
C0	NUMBER	NO	PRI	12.34	NULL
C1	BINARY_DOUBLE	YES	NULL	12.34d	NULL
C2	BINARY_FLOAT	YES	NULL	12.34f	NULL
C3	NUMBER	YES	NULL	12.34e0	NULL
C4	FLOAT(10)	YES	NULL	12.34	NULL
C5	FLOAT(126)	YES	NULL	12.34e0	NULL
C6	VARCHAR2(100 CHAR)	YES	NULL	'12.34'	NULL
C7	CHAR(100 CHAR)	YES	NULL	'12.34'	NULL
insert into number_1 (c0, c6) values (19,'0');
ob1.oblog.next;
[R0] BEGIN;[R0] org_cluster_id:1;[R1] record_type:INSERT;[R1] database_name:oracle.OBLOG_DB;[R1] table_name:NUMBER_1;[R1] log_event:true;[R1] column_count:8;[R1] source_category:SRC_FULL_RECORDED;[R1] source_type:SRC_OCEANBASE_1_0;[R1] has_pk:true;[R1] pk_info:(0);[R1] pks:C0;[R1] has_uk:false;[R1] uk_info:(null);[R1] uks:(null);[R1] [C1] column_name:C0;[R1] [C1] column_type:MYSQL_TYPE_NEWDECIMAL;[R1] [C1] column_is_rowkey:true;[R1] [C1] column_is_signed:true;[R1] [C1] column_encoding:binary;[R1] [C1] column_is_not_null:true;[R1] [C1] column_value_new:[19](2);[R1] [C2] column_name:C1;[R1] [C2] column_type:MYSQL_TYPE_DOUBLE;[R1] [C2] column_is_rowkey:false;[R1] [C2] column_is_signed:true;[R1] [C2] column_encoding:binary;[R1] [C2] column_is_not_null:false;[R1] [C2] column_value_new:[1.234E+001](10);[R1] [C3] column_name:C2;[R1] [C3] column_type:MYSQL_TYPE_FLOAT;[R1] [C3] column_is_rowkey:false;[R1] [C3] column_is_signed:true;[R1] [C3] column_encoding:binary;[R1] [C3] column_is_not_null:false;[R1] [C3] column_value_new:[1.23400002E+001](15);[R1] [C4] column_name:C3;[R1] [C4] column_type:MYSQL_TYPE_NEWDECIMAL;[R1] [C4] column_is_rowkey:false;[R1] [C4] column_is_signed:true;[R1] [C4] column_encoding:binary;[R1] [C4] column_is_not_null:false;[R1] [C4] column_value_new:[12.34](5);[R1] [C5] column_name:C4;[R1] [C5] column_type:MYSQL_TYPE_OB_NUMBER_FLOAT;[R1] [C5] column_is_rowkey:false;[R1] [C5] column_is_signed:true;[R1] [C5] column_encoding:binary;[R1] [C5] column_is_not_null:false;[R1] [C5] column_value_new:[12.34](5);[R1] [C6] column_name:C5;[R1] [C6] column_type:MYSQL_TYPE_OB_NUMBER_FLOAT;[R1] [C6] column_is_rowkey:false;[R1] [C6] column_is_signed:true;[R1] [C6] column_encoding:binary;[R1] [C6] column_is_not_null:false;[R1] [C6] column_value_new:[12.34](5);[R1] [C7] column_name:C6;[R1] [C7] column_type:MYSQL_TYPE_VAR_STRING;[R1] [C7] column_is_rowkey:false;[R1] [C7] column_is_signed:true;[R1] [C7] column_encoding:utf8mb4;[R1] [C7] column_is_not_null:false;[R1] [C7] column_value_new:[0](1);[R1] [C8] column_name:C7;[R1] [C8] column_type:MYSQL_TYPE_STRING;[R1] [C8] column_is_rowkey:false;[R1] [C8] column_is_signed:true;[R1] [C8] column_encoding:utf8mb4;[R1] [C8] column_is_not_null:false;[R1] [C8] column_value_new:[12.34                                                                                               ](100);$[R2] COMMIT;
insert into number_1 (c0, c6) values (20,'0.0');
ob1.oblog.next;
[R0] BEGIN;[R0] org_cluster_id:1;[R1] record_type:INSERT;[R1] database_name:oracle.OBLOG_DB;[R1] table_name:NUMBER_1;[R1] log_event:true;[R1] column_count:8;[R1] source_category:SRC_FULL_RECORDED;[R1] source_type:SRC_OCEANBASE_1_0;[R1] has_pk:true;[R1] pk_info:(0);[R1] pks:C0;[R1] has_uk:false;[R1] uk_info:(null);[R1] uks:(null);[R1] [C1] column_name:C0;[R1] [C1] column_type:MYSQL_TYPE_NEWDECIMAL;[R1] [C1] column_is_rowkey:true;[R1] [C1] column_is_signed:true;[R1] [C1] column_encoding:binary;[R1] [C1] column_is_not_null:true;[R1] [C1] column_value_new:[20](2);[R1] [C2] column_name:C1;[R1] [C2] column_type:MYSQL_TYPE_DOUBLE;[R1] [C2] column_is_rowkey:false;[R1] [C2] column_is_signed:true;[R1] [C2] column_encoding:binary;[R1] [C2] column_is_not_null:false;[R1] [C2] column_value_new:[1.234E+001](10);[R1] [C3] column_name:C2;[R1] [C3] column_type:MYSQL_TYPE_FLOAT;[R1] [C3] column_is_rowkey:false;[R1] [C3] column_is_signed:true;[R1] [C3] column_encoding:binary;[R1] [C3] column_is_not_null:false;[R1] [C3] column_value_new:[1.23400002E+001](15);[R1] [C4] column_name:C3;[R1] [C4] column_type:MYSQL_TYPE_NEWDECIMAL;[R1] [C4] column_is_rowkey:false;[R1] [C4] column_is_signed:true;[R1] [C4] column_encoding:binary;[R1] [C4] column_is_not_null:false;[R1] [C4] column_value_new:[12.34](5);[R1] [C5] column_name:C4;[R1] [C5] column_type:MYSQL_TYPE_OB_NUMBER_FLOAT;[R1] [C5] column_is_rowkey:false;[R1] [C5] column_is_signed:true;[R1] [C5] column_encoding:binary;[R1] [C5] column_is_not_null:false;[R1] [C5] column_value_new:[12.34](5);[R1] [C6] column_name:C5;[R1] [C6] column_type:MYSQL_TYPE_OB_NUMBER_FLOAT;[R1] [C6] column_is_rowkey:false;[R1] [C6] column_is_signed:true;[R1] [C6] column_encoding:binary;[R1] [C6] column_is_not_null:false;[R1] [C6] column_value_new:[12.34](5);[R1] [C7] column_name:C6;[R1] [C7] column_type:MYSQL_TYPE_VAR_STRING;[R1] [C7] column_is_rowkey:false;[R1] [C7] column_is_signed:true;[R1] [C7] column_encoding:utf8mb4;[R1] [C7] column_is_not_null:false;[R1] [C7] column_value_new:[0.0](3);[R1] [C8] column_name:C7;[R1] [C8] column_type:MYSQL_TYPE_STRING;[R1] [C8] column_is_rowkey:false;[R1] [C8] column_is_signed:true;[R1] [C8] column_encoding:utf8mb4;[R1] [C8] column_is_not_null:false;[R1] [C8] column_value_new:[12.34                                                                                               ](100);$[R2] COMMIT;
insert into number_1 (c0, c6) values (21,'1');
ob1.oblog.next;
[R0] BEGIN;[R0] org_cluster_id:1;[R1] record_type:INSERT;[R1] database_name:oracle.OBLOG_DB;[R1] table_name:NUMBER_1;[R1] log_event:true;[R1] column_count:8;[R1] source_category:SRC_FULL_RECORDED;[R1] source_type:SRC_OCEANBASE_1_0;[R1] has_pk:true;[R1] pk_info:(0);[R1] pks:C0;[R1] has_uk:false;[R1] uk_info:(null);[R1] uks:(null);[R1] [C1] column_name:C0;[R1] [C1] column_type:MYSQL_TYPE_NEWDECIMAL;[R1] [C1] column_is_rowkey:true;[R1] [C1] column_is_signed:true;[R1] [C1] column_encoding:binary;[R1] [C1] column_is_not_null:true;[R1] [C1] column_value_new:[21](2);[R1] [C2] column_name:C1;[R1] [C2] column_type:MYSQL_TYPE_DOUBLE;[R1] [C2] column_is_rowkey:false;[R1] [C2] column_is_signed:true;[R1] [C2] column_encoding:binary;[R1] [C2] column_is_not_null:false;[R1] [C2] column_value_new:[1.234E+001](10);[R1] [C3] column_name:C2;[R1] [C3] column_type:MYSQL_TYPE_FLOAT;[R1] [C3] column_is_rowkey:false;[R1] [C3] column_is_signed:true;[R1] [C3] column_encoding:binary;[R1] [C3] column_is_not_null:false;[R1] [C3] column_value_new:[1.23400002E+001](15);[R1] [C4] column_name:C3;[R1] [C4] column_type:MYSQL_TYPE_NEWDECIMAL;[R1] [C4] column_is_rowkey:false;[R1] [C4] column_is_signed:true;[R1] [C4] column_encoding:binary;[R1] [C4] column_is_not_null:false;[R1] [C4] column_value_new:[12.34](5);[R1] [C5] column_name:C4;[R1] [C5] column_type:MYSQL_TYPE_OB_NUMBER_FLOAT;[R1] [C5] column_is_rowkey:false;[R1] [C5] column_is_signed:true;[R1] [C5] column_encoding:binary;[R1] [C5] column_is_not_null:false;[R1] [C5] column_value_new:[12.34](5);[R1] [C6] column_name:C5;[R1] [C6] column_type:MYSQL_TYPE_OB_NUMBER_FLOAT;[R1] [C6] column_is_rowkey:false;[R1] [C6] column_is_signed:true;[R1] [C6] column_encoding:binary;[R1] [C6] column_is_not_null:false;[R1] [C6] column_value_new:[12.34](5);[R1] [C7] column_name:C6;[R1] [C7] column_type:MYSQL_TYPE_VAR_STRING;[R1] [C7] column_is_rowkey:false;[R1] [C7] column_is_signed:true;[R1] [C7] column_encoding:utf8mb4;[R1] [C7] column_is_not_null:false;[R1] [C7] column_value_new:[1](1);[R1] [C8] column_name:C7;[R1] [C8] column_type:MYSQL_TYPE_STRING;[R1] [C8] column_is_rowkey:false;[R1] [C8] column_is_signed:true;[R1] [C8] column_encoding:utf8mb4;[R1] [C8] column_is_not_null:false;[R1] [C8] column_value_new:[12.34                                                                                               ](100);$[R2] COMMIT;
insert into number_1 (c0, c6) values (22,'12');
ob1.oblog.next;
[R0] BEGIN;[R0] org_cluster_id:1;[R1] record_type:INSERT;[R1] database_name:oracle.OBLOG_DB;[R1] table_name:NUMBER_1;[R1] log_event:true;[R1] column_count:8;[R1] source_category:SRC_FULL_RECORDED;[R1] source_type:SRC_OCEANBASE_1_0;[R1] has_pk:true;[R1] pk_info:(0);[R1] pks:C0;[R1] has_uk:false;[R1] uk_info:(null);[R1] uks:(null);[R1] [C1] column_name:C0;[R1] [C1] column_type:MYSQL_TYPE_NEWDECIMAL;[R1] [C1] column_is_rowkey:true;[R1] [C1] column_is_signed:true;[R1] [C1] column_encoding:binary;[R1] [C1] column_is_not_null:true;[R1] [C1] column_value_new:[22](2);[R1] [C2] column_name:C1;[R1] [C2] column_type:MYSQL_TYPE_DOUBLE;[R1] [C2] column_is_rowkey:false;[R1] [C2] column_is_signed:true;[R1] [C2] column_encoding:binary;[R1] [C2] column_is_not_null:false;[R1] [C2] column_value_new:[1.234E+001](10);[R1] [C3] column_name:C2;[R1] [C3] column_type:MYSQL_TYPE_FLOAT;[R1] [C3] column_is_rowkey:false;[R1] [C3] column_is_signed:true;[R1] [C3] column_encoding:binary;[R1] [C3] column_is_not_null:false;[R1] [C3] column_value_new:[1.23400002E+001](15);[R1] [C4] column_name:C3;[R1] [C4] column_type:MYSQL_TYPE_NEWDECIMAL;[R1] [C4] column_is_rowkey:false;[R1] [C4] column_is_signed:true;[R1] [C4] column_encoding:binary;[R1] [C4] column_is_not_null:false;[R1] [C4] column_value_new:[12.34](5);[R1] [C5] column_name:C4;[R1] [C5] column_type:MYSQL_TYPE_OB_NUMBER_FLOAT;[R1] [C5] column_is_rowkey:false;[R1] [C5] column_is_signed:true;[R1] [C5] column_encoding:binary;[R1] [C5] column_is_not_null:false;[R1] [C5] column_value_new:[12.34](5);[R1] [C6] column_name:C5;[R1] [C6] column_type:MYSQL_TYPE_OB_NUMBER_FLOAT;[R1] [C6] column_is_rowkey:false;[R1] [C6] column_is_signed:true;[R1] [C6] column_encoding:binary;[R1] [C6] column_is_not_null:false;[R1] [C6] column_value_new:[12.34](5);[R1] [C7] column_name:C6;[R1] [C7] column_type:MYSQL_TYPE_VAR_STRING;[R1] [C7] column_is_rowkey:false;[R1] [C7] column_is_signed:true;[R1] [C7] column_encoding:utf8mb4;[R1] [C7] column_is_not_null:false;[R1] [C7] column_value_new:[12](2);[R1] [C8] column_name:C7;[R1] [C8] column_type:MYSQL_TYPE_STRING;[R1] [C8] column_is_rowkey:false;[R1] [C8] column_is_signed:true;[R1] [C8] column_encoding:utf8mb4;[R1] [C8] column_is_not_null:false;[R1] [C8] column_value_new:[12.34                                                                                               ](100);$[R2] COMMIT;
insert into number_1 (c0, c6) values (23,'123');
ob1.oblog.next;
[R0] BEGIN;[R0] org_cluster_id:1;[R1] record_type:INSERT;[R1] database_name:oracle.OBLOG_DB;[R1] table_name:NUMBER_1;[R1] log_event:true;[R1] column_count:8;[R1] source_category:SRC_FULL_RECORDED;[R1] source_type:SRC_OCEANBASE_1_0;[R1] has_pk:true;[R1] pk_info:(0);[R1] pks:C0;[R1] has_uk:false;[R1] uk_info:(null);[R1] uks:(null);[R1] [C1] column_name:C0;[R1] [C1] column_type:MYSQL_TYPE_NEWDECIMAL;[R1] [C1] column_is_rowkey:true;[R1] [C1] column_is_signed:true;[R1] [C1] column_encoding:binary;[R1] [C1] column_is_not_null:true;[R1] [C1] column_value_new:[23](2);[R1] [C2] column_name:C1;[R1] [C2] column_type:MYSQL_TYPE_DOUBLE;[R1] [C2] column_is_rowkey:false;[R1] [C2] column_is_signed:true;[R1] [C2] column_encoding:binary;[R1] [C2] column_is_not_null:false;[R1] [C2] column_value_new:[1.234E+001](10);[R1] [C3] column_name:C2;[R1] [C3] column_type:MYSQL_TYPE_FLOAT;[R1] [C3] column_is_rowkey:false;[R1] [C3] column_is_signed:true;[R1] [C3] column_encoding:binary;[R1] [C3] column_is_not_null:false;[R1] [C3] column_value_new:[1.23400002E+001](15);[R1] [C4] column_name:C3;[R1] [C4] column_type:MYSQL_TYPE_NEWDECIMAL;[R1] [C4] column_is_rowkey:false;[R1] [C4] column_is_signed:true;[R1] [C4] column_encoding:binary;[R1] [C4] column_is_not_null:false;[R1] [C4] column_value_new:[12.34](5);[R1] [C5] column_name:C4;[R1] [C5] column_type:MYSQL_TYPE_OB_NUMBER_FLOAT;[R1] [C5] column_is_rowkey:false;[R1] [C5] column_is_signed:true;[R1] [C5] column_encoding:binary;[R1] [C5] column_is_not_null:false;[R1] [C5] column_value_new:[12.34](5);[R1] [C6] column_name:C5;[R1] [C6] column_type:MYSQL_TYPE_OB_NUMBER_FLOAT;[R1] [C6] column_is_rowkey:false;[R1] [C6] column_is_signed:true;[R1] [C6] column_encoding:binary;[R1] [C6] column_is_not_null:false;[R1] [C6] column_value_new:[12.34](5);[R1] [C7] column_name:C6;[R1] [C7] column_type:MYSQL_TYPE_VAR_STRING;[R1] [C7] column_is_rowkey:false;[R1] [C7] column_is_signed:true;[R1] [C7] column_encoding:utf8mb4;[R1] [C7] column_is_not_null:false;[R1] [C7] column_value_new:[123](3);[R1] [C8] column_name:C7;[R1] [C8] column_type:MYSQL_TYPE_STRING;[R1] [C8] column_is_rowkey:false;[R1] [C8] column_is_signed:true;[R1] [C8] column_encoding:utf8mb4;[R1] [C8] column_is_not_null:false;[R1] [C8] column_value_new:[12.34                                                                                               ](100);$[R2] COMMIT;
insert into number_1 (c0, c6) values (24,'1234');
ob1.oblog.next;
[R0] BEGIN;[R0] org_cluster_id:1;[R1] record_type:INSERT;[R1] database_name:oracle.OBLOG_DB;[R1] table_name:NUMBER_1;[R1] log_event:true;[R1] column_count:8;[R1] source_category:SRC_FULL_RECORDED;[R1] source_type:SRC_OCEANBASE_1_0;[R1] has_pk:true;[R1] pk_info:(0);[R1] pks:C0;[R1] has_uk:false;[R1] uk_info:(null);[R1] uks:(null);[R1] [C1] column_name:C0;[R1] [C1] column_type:MYSQL_TYPE_NEWDECIMAL;[R1] [C1] column_is_rowkey:true;[R1] [C1] column_is_signed:true;[R1] [C1] column_encoding:binary;[R1] [C1] column_is_not_null:true;[R1] [C1] column_value_new:[24](2);[R1] [C2] column_name:C1;[R1] [C2] column_type:MYSQL_TYPE_DOUBLE;[R1] [C2] column_is_rowkey:false;[R1] [C2] column_is_signed:true;[R1] [C2] column_encoding:binary;[R1] [C2] column_is_not_null:false;[R1] [C2] column_value_new:[1.234E+001](10);[R1] [C3] column_name:C2;[R1] [C3] column_type:MYSQL_TYPE_FLOAT;[R1] [C3] column_is_rowkey:false;[R1] [C3] column_is_signed:true;[R1] [C3] column_encoding:binary;[R1] [C3] column_is_not_null:false;[R1] [C3] column_value_new:[1.23400002E+001](15);[R1] [C4] column_name:C3;[R1] [C4] column_type:MYSQL_TYPE_NEWDECIMAL;[R1] [C4] column_is_rowkey:false;[R1] [C4] column_is_signed:true;[R1] [C4] column_encoding:binary;[R1] [C4] column_is_not_null:false;[R1] [C4] column_value_new:[12.34](5);[R1] [C5] column_name:C4;[R1] [C5] column_type:MYSQL_TYPE_OB_NUMBER_FLOAT;[R1] [C5] column_is_rowkey:false;[R1] [C5] column_is_signed:true;[R1] [C5] column_encoding:binary;[R1] [C5] column_is_not_null:false;[R1] [C5] column_value_new:[12.34](5);[R1] [C6] column_name:C5;[R1] [C6] column_type:MYSQL_TYPE_OB_NUMBER_FLOAT;[R1] [C6] column_is_rowkey:false;[R1] [C6] column_is_signed:true;[R1] [C6] column_encoding:binary;[R1] [C6] column_is_not_null:false;[R1] [C6] column_value_new:[12.34](5);[R1] [C7] column_name:C6;[R1] [C7] column_type:MYSQL_TYPE_VAR_STRING;[R1] [C7] column_is_rowkey:false;[R1] [C7] column_is_signed:true;[R1] [C7] column_encoding:utf8mb4;[R1] [C7] column_is_not_null:false;[R1] [C7] column_value_new:[1234](4);[R1] [C8] column_name:C7;[R1] [C8] column_type:MYSQL_TYPE_STRING;[R1] [C8] column_is_rowkey:false;[R1] [C8] column_is_signed:true;[R1] [C8] column_encoding:utf8mb4;[R1] [C8] column_is_not_null:false;[R1] [C8] column_value_new:[12.34                                                                                               ](100);$[R2] COMMIT;
insert into number_1 (c0, c6) values (25,'12345');
ob1.oblog.next;
[R0] BEGIN;[R0] org_cluster_id:1;[R1] record_type:INSERT;[R1] database_name:oracle.OBLOG_DB;[R1] table_name:NUMBER_1;[R1] log_event:true;[R1] column_count:8;[R1] source_category:SRC_FULL_RECORDED;[R1] source_type:SRC_OCEANBASE_1_0;[R1] has_pk:true;[R1] pk_info:(0);[R1] pks:C0;[R1] has_uk:false;[R1] uk_info:(null);[R1] uks:(null);[R1] [C1] column_name:C0;[R1] [C1] column_type:MYSQL_TYPE_NEWDECIMAL;[R1] [C1] column_is_rowkey:true;[R1] [C1] column_is_signed:true;[R1] [C1] column_encoding:binary;[R1] [C1] column_is_not_null:true;[R1] [C1] column_value_new:[25](2);[R1] [C2] column_name:C1;[R1] [C2] column_type:MYSQL_TYPE_DOUBLE;[R1] [C2] column_is_rowkey:false;[R1] [C2] column_is_signed:true;[R1] [C2] column_encoding:binary;[R1] [C2] column_is_not_null:false;[R1] [C2] column_value_new:[1.234E+001](10);[R1] [C3] column_name:C2;[R1] [C3] column_type:MYSQL_TYPE_FLOAT;[R1] [C3] column_is_rowkey:false;[R1] [C3] column_is_signed:true;[R1] [C3] column_encoding:binary;[R1] [C3] column_is_not_null:false;[R1] [C3] column_value_new:[1.23400002E+001](15);[R1] [C4] column_name:C3;[R1] [C4] column_type:MYSQL_TYPE_NEWDECIMAL;[R1] [C4] column_is_rowkey:false;[R1] [C4] column_is_signed:true;[R1] [C4] column_encoding:binary;[R1] [C4] column_is_not_null:false;[R1] [C4] column_value_new:[12.34](5);[R1] [C5] column_name:C4;[R1] [C5] column_type:MYSQL_TYPE_OB_NUMBER_FLOAT;[R1] [C5] column_is_rowkey:false;[R1] [C5] column_is_signed:true;[R1] [C5] column_encoding:binary;[R1] [C5] column_is_not_null:false;[R1] [C5] column_value_new:[12.34](5);[R1] [C6] column_name:C5;[R1] [C6] column_type:MYSQL_TYPE_OB_NUMBER_FLOAT;[R1] [C6] column_is_rowkey:false;[R1] [C6] column_is_signed:true;[R1] [C6] column_encoding:binary;[R1] [C6] column_is_not_null:false;[R1] [C6] column_value_new:[12.34](5);[R1] [C7] column_name:C6;[R1] [C7] column_type:MYSQL_TYPE_VAR_STRING;[R1] [C7] column_is_rowkey:false;[R1] [C7] column_is_signed:true;[R1] [C7] column_encoding:utf8mb4;[R1] [C7] column_is_not_null:false;[R1] [C7] column_value_new:[12345](5);[R1] [C8] column_name:C7;[R1] [C8] column_type:MYSQL_TYPE_STRING;[R1] [C8] column_is_rowkey:false;[R1] [C8] column_is_signed:true;[R1] [C8] column_encoding:utf8mb4;[R1] [C8] column_is_not_null:false;[R1] [C8] column_value_new:[12.34                                                                                               ](100);$[R2] COMMIT;
insert into number_1 (c0, c6) values (26,'123456');
ob1.oblog.next;
[R0] BEGIN;[R0] org_cluster_id:1;[R1] record_type:INSERT;[R1] database_name:oracle.OBLOG_DB;[R1] table_name:NUMBER_1;[R1] log_event:true;[R1] column_count:8;[R1] source_category:SRC_FULL_RECORDED;[R1] source_type:SRC_OCEANBASE_1_0;[R1] has_pk:true;[R1] pk_info:(0);[R1] pks:C0;[R1] has_uk:false;[R1] uk_info:(null);[R1] uks:(null);[R1] [C1] column_name:C0;[R1] [C1] column_type:MYSQL_TYPE_NEWDECIMAL;[R1] [C1] column_is_rowkey:true;[R1] [C1] column_is_signed:true;[R1] [C1] column_encoding:binary;[R1] [C1] column_is_not_null:true;[R1] [C1] column_value_new:[26](2);[R1] [C2] column_name:C1;[R1] [C2] column_type:MYSQL_TYPE_DOUBLE;[R1] [C2] column_is_rowkey:false;[R1] [C2] column_is_signed:true;[R1] [C2] column_encoding:binary;[R1] [C2] column_is_not_null:false;[R1] [C2] column_value_new:[1.234E+001](10);[R1] [C3] column_name:C2;[R1] [C3] column_type:MYSQL_TYPE_FLOAT;[R1] [C3] column_is_rowkey:false;[R1] [C3] column_is_signed:true;[R1] [C3] column_encoding:binary;[R1] [C3] column_is_not_null:false;[R1] [C3] column_value_new:[1.23400002E+001](15);[R1] [C4] column_name:C3;[R1] [C4] column_type:MYSQL_TYPE_NEWDECIMAL;[R1] [C4] column_is_rowkey:false;[R1] [C4] column_is_signed:true;[R1] [C4] column_encoding:binary;[R1] [C4] column_is_not_null:false;[R1] [C4] column_value_new:[12.34](5);[R1] [C5] column_name:C4;[R1] [C5] column_type:MYSQL_TYPE_OB_NUMBER_FLOAT;[R1] [C5] column_is_rowkey:false;[R1] [C5] column_is_signed:true;[R1] [C5] column_encoding:binary;[R1] [C5] column_is_not_null:false;[R1] [C5] column_value_new:[12.34](5);[R1] [C6] column_name:C5;[R1] [C6] column_type:MYSQL_TYPE_OB_NUMBER_FLOAT;[R1] [C6] column_is_rowkey:false;[R1] [C6] column_is_signed:true;[R1] [C6] column_encoding:binary;[R1] [C6] column_is_not_null:false;[R1] [C6] column_value_new:[12.34](5);[R1] [C7] column_name:C6;[R1] [C7] column_type:MYSQL_TYPE_VAR_STRING;[R1] [C7] column_is_rowkey:false;[R1] [C7] column_is_signed:true;[R1] [C7] column_encoding:utf8mb4;[R1] [C7] column_is_not_null:false;[R1] [C7] column_value_new:[123456](6);[R1] [C8] column_name:C7;[R1] [C8] column_type:MYSQL_TYPE_STRING;[R1] [C8] column_is_rowkey:false;[R1] [C8] column_is_signed:true;[R1] [C8] column_encoding:utf8mb4;[R1] [C8] column_is_not_null:false;[R1] [C8] column_value_new:[12.34                                                                                               ](100);$[R2] COMMIT;
insert into number_1 (c0, c6) values (27,'1234567');
ob1.oblog.next;
[R0] BEGIN;[R0] org_cluster_id:1;[R1] record_type:INSERT;[R1] database_name:oracle.OBLOG_DB;[R1] table_name:NUMBER_1;[R1] log_event:true;[R1] column_count:8;[R1] source_category:SRC_FULL_RECORDED;[R1] source_type:SRC_OCEANBASE_1_0;[R1] has_pk:true;[R1] pk_info:(0);[R1] pks:C0;[R1] has_uk:false;[R1] uk_info:(null);[R1] uks:(null);[R1] [C1] column_name:C0;[R1] [C1] column_type:MYSQL_TYPE_NEWDECIMAL;[R1] [C1] column_is_rowkey:true;[R1] [C1] column_is_signed:true;[R1] [C1] column_encoding:binary;[R1] [C1] column_is_not_null:true;[R1] [C1] column_value_new:[27](2);[R1] [C2] column_name:C1;[R1] [C2] column_type:MYSQL_TYPE_DOUBLE;[R1] [C2] column_is_rowkey:false;[R1] [C2] column_is_signed:true;[R1] [C2] column_encoding:binary;[R1] [C2] column_is_not_null:false;[R1] [C2] column_value_new:[1.234E+001](10);[R1] [C3] column_name:C2;[R1] [C3] column_type:MYSQL_TYPE_FLOAT;[R1] [C3] column_is_rowkey:false;[R1] [C3] column_is_signed:true;[R1] [C3] column_encoding:binary;[R1] [C3] column_is_not_null:false;[R1] [C3] column_value_new:[1.23400002E+001](15);[R1] [C4] column_name:C3;[R1] [C4] column_type:MYSQL_TYPE_NEWDECIMAL;[R1] [C4] column_is_rowkey:false;[R1] [C4] column_is_signed:true;[R1] [C4] column_encoding:binary;[R1] [C4] column_is_not_null:false;[R1] [C4] column_value_new:[12.34](5);[R1] [C5] column_name:C4;[R1] [C5] column_type:MYSQL_TYPE_OB_NUMBER_FLOAT;[R1] [C5] column_is_rowkey:false;[R1] [C5] column_is_signed:true;[R1] [C5] column_encoding:binary;[R1] [C5] column_is_not_null:false;[R1] [C5] column_value_new:[12.34](5);[R1] [C6] column_name:C5;[R1] [C6] column_type:MYSQL_TYPE_OB_NUMBER_FLOAT;[R1] [C6] column_is_rowkey:false;[R1] [C6] column_is_signed:true;[R1] [C6] column_encoding:binary;[R1] [C6] column_is_not_null:false;[R1] [C6] column_value_new:[12.34](5);[R1] [C7] column_name:C6;[R1] [C7] column_type:MYSQL_TYPE_VAR_STRING;[R1] [C7] column_is_rowkey:false;[R1] [C7] column_is_signed:true;[R1] [C7] column_encoding:utf8mb4;[R1] [C7] column_is_not_null:false;[R1] [C7] column_value_new:[1234567](7);[R1] [C8] column_name:C7;[R1] [C8] column_type:MYSQL_TYPE_STRING;[R1] [C8] column_is_rowkey:false;[R1] [C8] column_is_signed:true;[R1] [C8] column_encoding:utf8mb4;[R1] [C8] column_is_not_null:false;[R1] [C8] column_value_new:[12.34                                                                                               ](100);$[R2] COMMIT;
insert into number_1 (c0, c6) values (28,'12345678');
ob1.oblog.next;
[R0] BEGIN;[R0] org_cluster_id:1;[R1] record_type:INSERT;[R1] database_name:oracle.OBLOG_DB;[R1] table_name:NUMBER_1;[R1] log_event:true;[R1] column_count:8;[R1] source_category:SRC_FULL_RECORDED;[R1] source_type:SRC_OCEANBASE_1_0;[R1] has_pk:true;[R1] pk_info:(0);[R1] pks:C0;[R1] has_uk:false;[R1] uk_info:(null);[R1] uks:(null);[R1] [C1] column_name:C0;[R1] [C1] column_type:MYSQL_TYPE_NEWDECIMAL;[R1] [C1] column_is_rowkey:true;[R1] [C1] column_is_signed:true;[R1] [C1] column_encoding:binary;[R1] [C1] column_is_not_null:true;[R1] [C1] column_value_new:[28](2);[R1] [C2] column_name:C1;[R1] [C2] column_type:MYSQL_TYPE_DOUBLE;[R1] [C2] column_is_rowkey:false;[R1] [C2] column_is_signed:true;[R1] [C2] column_encoding:binary;[R1] [C2] column_is_not_null:false;[R1] [C2] column_value_new:[1.234E+001](10);[R1] [C3] column_name:C2;[R1] [C3] column_type:MYSQL_TYPE_FLOAT;[R1] [C3] column_is_rowkey:false;[R1] [C3] column_is_signed:true;[R1] [C3] column_encoding:binary;[R1] [C3] column_is_not_null:false;[R1] [C3] column_value_new:[1.23400002E+001](15);[R1] [C4] column_name:C3;[R1] [C4] column_type:MYSQL_TYPE_NEWDECIMAL;[R1] [C4] column_is_rowkey:false;[R1] [C4] column_is_signed:true;[R1] [C4] column_encoding:binary;[R1] [C4] column_is_not_null:false;[R1] [C4] column_value_new:[12.34](5);[R1] [C5] column_name:C4;[R1] [C5] column_type:MYSQL_TYPE_OB_NUMBER_FLOAT;[R1] [C5] column_is_rowkey:false;[R1] [C5] column_is_signed:true;[R1] [C5] column_encoding:binary;[R1] [C5] column_is_not_null:false;[R1] [C5] column_value_new:[12.34](5);[R1] [C6] column_name:C5;[R1] [C6] column_type:MYSQL_TYPE_OB_NUMBER_FLOAT;[R1] [C6] column_is_rowkey:false;[R1] [C6] column_is_signed:true;[R1] [C6] column_encoding:binary;[R1] [C6] column_is_not_null:false;[R1] [C6] column_value_new:[12.34](5);[R1] [C7] column_name:C6;[R1] [C7] column_type:MYSQL_TYPE_VAR_STRING;[R1] [C7] column_is_rowkey:false;[R1] [C7] column_is_signed:true;[R1] [C7] column_encoding:utf8mb4;[R1] [C7] column_is_not_null:false;[R1] [C7] column_value_new:[12345678](8);[R1] [C8] column_name:C7;[R1] [C8] column_type:MYSQL_TYPE_STRING;[R1] [C8] column_is_rowkey:false;[R1] [C8] column_is_signed:true;[R1] [C8] column_encoding:utf8mb4;[R1] [C8] column_is_not_null:false;[R1] [C8] column_value_new:[12.34                                                                                               ](100);$[R2] COMMIT;
insert into number_1 (c0, c6) values (29,'123456789');
ob1.oblog.next;
[R0] BEGIN;[R0] org_cluster_id:1;[R1] record_type:INSERT;[R1] database_name:oracle.OBLOG_DB;[R1] table_name:NUMBER_1;[R1] log_event:true;[R1] column_count:8;[R1] source_category:SRC_FULL_RECORDED;[R1] source_type:SRC_OCEANBASE_1_0;[R1] has_pk:true;[R1] pk_info:(0);[R1] pks:C0;[R1] has_uk:false;[R1] uk_info:(null);[R1] uks:(null);[R1] [C1] column_name:C0;[R1] [C1] column_type:MYSQL_TYPE_NEWDECIMAL;[R1] [C1] column_is_rowkey:true;[R1] [C1] column_is_signed:true;[R1] [C1] column_encoding:binary;[R1] [C1] column_is_not_null:true;[R1] [C1] column_value_new:[29](2);[R1] [C2] column_name:C1;[R1] [C2] column_type:MYSQL_TYPE_DOUBLE;[R1] [C2] column_is_rowkey:false;[R1] [C2] column_is_signed:true;[R1] [C2] column_encoding:binary;[R1] [C2] column_is_not_null:false;[R1] [C2] column_value_new:[1.234E+001](10);[R1] [C3] column_name:C2;[R1] [C3] column_type:MYSQL_TYPE_FLOAT;[R1] [C3] column_is_rowkey:false;[R1] [C3] column_is_signed:true;[R1] [C3] column_encoding:binary;[R1] [C3] column_is_not_null:false;[R1] [C3] column_value_new:[1.23400002E+001](15);[R1] [C4] column_name:C3;[R1] [C4] column_type:MYSQL_TYPE_NEWDECIMAL;[R1] [C4] column_is_rowkey:false;[R1] [C4] column_is_signed:true;[R1] [C4] column_encoding:binary;[R1] [C4] column_is_not_null:false;[R1] [C4] column_value_new:[12.34](5);[R1] [C5] column_name:C4;[R1] [C5] column_type:MYSQL_TYPE_OB_NUMBER_FLOAT;[R1] [C5] column_is_rowkey:false;[R1] [C5] column_is_signed:true;[R1] [C5] column_encoding:binary;[R1] [C5] column_is_not_null:false;[R1] [C5] column_value_new:[12.34](5);[R1] [C6] column_name:C5;[R1] [C6] column_type:MYSQL_TYPE_OB_NUMBER_FLOAT;[R1] [C6] column_is_rowkey:false;[R1] [C6] column_is_signed:true;[R1] [C6] column_encoding:binary;[R1] [C6] column_is_not_null:false;[R1] [C6] column_value_new:[12.34](5);[R1] [C7] column_name:C6;[R1] [C7] column_type:MYSQL_TYPE_VAR_STRING;[R1] [C7] column_is_rowkey:false;[R1] [C7] column_is_signed:true;[R1] [C7] column_encoding:utf8mb4;[R1] [C7] column_is_not_null:false;[R1] [C7] column_value_new:[123456789](9);[R1] [C8] column_name:C7;[R1] [C8] column_type:MYSQL_TYPE_STRING;[R1] [C8] column_is_rowkey:false;[R1] [C8] column_is_signed:true;[R1] [C8] column_encoding:utf8mb4;[R1] [C8] column_is_not_null:false;[R1] [C8] column_value_new:[12.34                                                                                               ](100);$[R2] COMMIT;
insert into number_1 (c0, c6) values (30,'1234567890');
ob1.oblog.next;
[R0] BEGIN;[R0] org_cluster_id:1;[R1] record_type:INSERT;[R1] database_name:oracle.OBLOG_DB;[R1] table_name:NUMBER_1;[R1] log_event:true;[R1] column_count:8;[R1] source_category:SRC_FULL_RECORDED;[R1] source_type:SRC_OCEANBASE_1_0;[R1] has_pk:true;[R1] pk_info:(0);[R1] pks:C0;[R1] has_uk:false;[R1] uk_info:(null);[R1] uks:(null);[R1] [C1] column_name:C0;[R1] [C1] column_type:MYSQL_TYPE_NEWDECIMAL;[R1] [C1] column_is_rowkey:true;[R1] [C1] column_is_signed:true;[R1] [C1] column_encoding:binary;[R1] [C1] column_is_not_null:true;[R1] [C1] column_value_new:[30](2);[R1] [C2] column_name:C1;[R1] [C2] column_type:MYSQL_TYPE_DOUBLE;[R1] [C2] column_is_rowkey:false;[R1] [C2] column_is_signed:true;[R1] [C2] column_encoding:binary;[R1] [C2] column_is_not_null:false;[R1] [C2] column_value_new:[1.234E+001](10);[R1] [C3] column_name:C2;[R1] [C3] column_type:MYSQL_TYPE_FLOAT;[R1] [C3] column_is_rowkey:false;[R1] [C3] column_is_signed:true;[R1] [C3] column_encoding:binary;[R1] [C3] column_is_not_null:false;[R1] [C3] column_value_new:[1.23400002E+001](15);[R1] [C4] column_name:C3;[R1] [C4] column_type:MYSQL_TYPE_NEWDECIMAL;[R1] [C4] column_is_rowkey:false;[R1] [C4] column_is_signed:true;[R1] [C4] column_encoding:binary;[R1] [C4] column_is_not_null:false;[R1] [C4] column_value_new:[12.34](5);[R1] [C5] column_name:C4;[R1] [C5] column_type:MYSQL_TYPE_OB_NUMBER_FLOAT;[R1] [C5] column_is_rowkey:false;[R1] [C5] column_is_signed:true;[R1] [C5] column_encoding:binary;[R1] [C5] column_is_not_null:false;[R1] [C5] column_value_new:[12.34](5);[R1] [C6] column_name:C5;[R1] [C6] column_type:MYSQL_TYPE_OB_NUMBER_FLOAT;[R1] [C6] column_is_rowkey:false;[R1] [C6] column_is_signed:true;[R1] [C6] column_encoding:binary;[R1] [C6] column_is_not_null:false;[R1] [C6] column_value_new:[12.34](5);[R1] [C7] column_name:C6;[R1] [C7] column_type:MYSQL_TYPE_VAR_STRING;[R1] [C7] column_is_rowkey:false;[R1] [C7] column_is_signed:true;[R1] [C7] column_encoding:utf8mb4;[R1] [C7] column_is_not_null:false;[R1] [C7] column_value_new:[1234567890](10);[R1] [C8] column_name:C7;[R1] [C8] column_type:MYSQL_TYPE_STRING;[R1] [C8] column_is_rowkey:false;[R1] [C8] column_is_signed:true;[R1] [C8] column_encoding:utf8mb4;[R1] [C8] column_is_not_null:false;[R1] [C8] column_value_new:[12.34                                                                                               ](100);$[R2] COMMIT;
insert into number_1 (c0, c6) values (31,'12345678901');
ob1.oblog.next;
[R0] BEGIN;[R0] org_cluster_id:1;[R1] record_type:INSERT;[R1] database_name:oracle.OBLOG_DB;[R1] table_name:NUMBER_1;[R1] log_event:true;[R1] column_count:8;[R1] source_category:SRC_FULL_RECORDED;[R1] source_type:SRC_OCEANBASE_1_0;[R1] has_pk:true;[R1] pk_info:(0);[R1] pks:C0;[R1] has_uk:false;[R1] uk_info:(null);[R1] uks:(null);[R1] [C1] column_name:C0;[R1] [C1] column_type:MYSQL_TYPE_NEWDECIMAL;[R1] [C1] column_is_rowkey:true;[R1] [C1] column_is_signed:true;[R1] [C1] column_encoding:binary;[R1] [C1] column_is_not_null:true;[R1] [C1] column_value_new:[31](2);[R1] [C2] column_name:C1;[R1] [C2] column_type:MYSQL_TYPE_DOUBLE;[R1] [C2] column_is_rowkey:false;[R1] [C2] column_is_signed:true;[R1] [C2] column_encoding:binary;[R1] [C2] column_is_not_null:false;[R1] [C2] column_value_new:[1.234E+001](10);[R1] [C3] column_name:C2;[R1] [C3] column_type:MYSQL_TYPE_FLOAT;[R1] [C3] column_is_rowkey:false;[R1] [C3] column_is_signed:true;[R1] [C3] column_encoding:binary;[R1] [C3] column_is_not_null:false;[R1] [C3] column_value_new:[1.23400002E+001](15);[R1] [C4] column_name:C3;[R1] [C4] column_type:MYSQL_TYPE_NEWDECIMAL;[R1] [C4] column_is_rowkey:false;[R1] [C4] column_is_signed:true;[R1] [C4] column_encoding:binary;[R1] [C4] column_is_not_null:false;[R1] [C4] column_value_new:[12.34](5);[R1] [C5] column_name:C4;[R1] [C5] column_type:MYSQL_TYPE_OB_NUMBER_FLOAT;[R1] [C5] column_is_rowkey:false;[R1] [C5] column_is_signed:true;[R1] [C5] column_encoding:binary;[R1] [C5] column_is_not_null:false;[R1] [C5] column_value_new:[12.34](5);[R1] [C6] column_name:C5;[R1] [C6] column_type:MYSQL_TYPE_OB_NUMBER_FLOAT;[R1] [C6] column_is_rowkey:false;[R1] [C6] column_is_signed:true;[R1] [C6] column_encoding:binary;[R1] [C6] column_is_not_null:false;[R1] [C6] column_value_new:[12.34](5);[R1] [C7] column_name:C6;[R1] [C7] column_type:MYSQL_TYPE_VAR_STRING;[R1] [C7] column_is_rowkey:false;[R1] [C7] column_is_signed:true;[R1] [C7] column_encoding:utf8mb4;[R1] [C7] column_is_not_null:false;[R1] [C7] column_value_new:[12345678901](11);[R1] [C8] column_name:C7;[R1] [C8] column_type:MYSQL_TYPE_STRING;[R1] [C8] column_is_rowkey:false;[R1] [C8] column_is_signed:true;[R1] [C8] column_encoding:utf8mb4;[R1] [C8] column_is_not_null:false;[R1] [C8] column_value_new:[12.34                                                                                               ](100);$[R2] COMMIT;
insert into number_1 (c0, c6) values (32,'123456789012');
ob1.oblog.next;
[R0] BEGIN;[R0] org_cluster_id:1;[R1] record_type:INSERT;[R1] database_name:oracle.OBLOG_DB;[R1] table_name:NUMBER_1;[R1] log_event:true;[R1] column_count:8;[R1] source_category:SRC_FULL_RECORDED;[R1] source_type:SRC_OCEANBASE_1_0;[R1] has_pk:true;[R1] pk_info:(0);[R1] pks:C0;[R1] has_uk:false;[R1] uk_info:(null);[R1] uks:(null);[R1] [C1] column_name:C0;[R1] [C1] column_type:MYSQL_TYPE_NEWDECIMAL;[R1] [C1] column_is_rowkey:true;[R1] [C1] column_is_signed:true;[R1] [C1] column_encoding:binary;[R1] [C1] column_is_not_null:true;[R1] [C1] column_value_new:[32](2);[R1] [C2] column_name:C1;[R1] [C2] column_type:MYSQL_TYPE_DOUBLE;[R1] [C2] column_is_rowkey:false;[R1] [C2] column_is_signed:true;[R1] [C2] column_encoding:binary;[R1] [C2] column_is_not_null:false;[R1] [C2] column_value_new:[1.234E+001](10);[R1] [C3] column_name:C2;[R1] [C3] column_type:MYSQL_TYPE_FLOAT;[R1] [C3] column_is_rowkey:false;[R1] [C3] column_is_signed:true;[R1] [C3] column_encoding:binary;[R1] [C3] column_is_not_null:false;[R1] [C3] column_value_new:[1.23400002E+001](15);[R1] [C4] column_name:C3;[R1] [C4] column_type:MYSQL_TYPE_NEWDECIMAL;[R1] [C4] column_is_rowkey:false;[R1] [C4] column_is_signed:true;[R1] [C4] column_encoding:binary;[R1] [C4] column_is_not_null:false;[R1] [C4] column_value_new:[12.34](5);[R1] [C5] column_name:C4;[R1] [C5] column_type:MYSQL_TYPE_OB_NUMBER_FLOAT;[R1] [C5] column_is_rowkey:false;[R1] [C5] column_is_signed:true;[R1] [C5] column_encoding:binary;[R1] [C5] column_is_not_null:false;[R1] [C5] column_value_new:[12.34](5);[R1] [C6] column_name:C5;[R1] [C6] column_type:MYSQL_TYPE_OB_NUMBER_FLOAT;[R1] [C6] column_is_rowkey:false;[R1] [C6] column_is_signed:true;[R1] [C6] column_encoding:binary;[R1] [C6] column_is_not_null:false;[R1] [C6] column_value_new:[12.34](5);[R1] [C7] column_name:C6;[R1] [C7] column_type:MYSQL_TYPE_VAR_STRING;[R1] [C7] column_is_rowkey:false;[R1] [C7] column_is_signed:true;[R1] [C7] column_encoding:utf8mb4;[R1] [C7] column_is_not_null:false;[R1] [C7] column_value_new:[123456789012](12);[R1] [C8] column_name:C7;[R1] [C8] column_type:MYSQL_TYPE_STRING;[R1] [C8] column_is_rowkey:false;[R1] [C8] column_is_signed:true;[R1] [C8] column_encoding:utf8mb4;[R1] [C8] column_is_not_null:false;[R1] [C8] column_value_new:[12.34                                                                                               ](100);$[R2] COMMIT;
insert into number_1 (c0, c6) values (33,'1234567890123');
ob1.oblog.next;
[R0] BEGIN;[R0] org_cluster_id:1;[R1] record_type:INSERT;[R1] database_name:oracle.OBLOG_DB;[R1] table_name:NUMBER_1;[R1] log_event:true;[R1] column_count:8;[R1] source_category:SRC_FULL_RECORDED;[R1] source_type:SRC_OCEANBASE_1_0;[R1] has_pk:true;[R1] pk_info:(0);[R1] pks:C0;[R1] has_uk:false;[R1] uk_info:(null);[R1] uks:(null);[R1] [C1] column_name:C0;[R1] [C1] column_type:MYSQL_TYPE_NEWDECIMAL;[R1] [C1] column_is_rowkey:true;[R1] [C1] column_is_signed:true;[R1] [C1] column_encoding:binary;[R1] [C1] column_is_not_null:true;[R1] [C1] column_value_new:[33](2);[R1] [C2] column_name:C1;[R1] [C2] column_type:MYSQL_TYPE_DOUBLE;[R1] [C2] column_is_rowkey:false;[R1] [C2] column_is_signed:true;[R1] [C2] column_encoding:binary;[R1] [C2] column_is_not_null:false;[R1] [C2] column_value_new:[1.234E+001](10);[R1] [C3] column_name:C2;[R1] [C3] column_type:MYSQL_TYPE_FLOAT;[R1] [C3] column_is_rowkey:false;[R1] [C3] column_is_signed:true;[R1] [C3] column_encoding:binary;[R1] [C3] column_is_not_null:false;[R1] [C3] column_value_new:[1.23400002E+001](15);[R1] [C4] column_name:C3;[R1] [C4] column_type:MYSQL_TYPE_NEWDECIMAL;[R1] [C4] column_is_rowkey:false;[R1] [C4] column_is_signed:true;[R1] [C4] column_encoding:binary;[R1] [C4] column_is_not_null:false;[R1] [C4] column_value_new:[12.34](5);[R1] [C5] column_name:C4;[R1] [C5] column_type:MYSQL_TYPE_OB_NUMBER_FLOAT;[R1] [C5] column_is_rowkey:false;[R1] [C5] column_is_signed:true;[R1] [C5] column_encoding:binary;[R1] [C5] column_is_not_null:false;[R1] [C5] column_value_new:[12.34](5);[R1] [C6] column_name:C5;[R1] [C6] column_type:MYSQL_TYPE_OB_NUMBER_FLOAT;[R1] [C6] column_is_rowkey:false;[R1] [C6] column_is_signed:true;[R1] [C6] column_encoding:binary;[R1] [C6] column_is_not_null:false;[R1] [C6] column_value_new:[12.34](5);[R1] [C7] column_name:C6;[R1] [C7] column_type:MYSQL_TYPE_VAR_STRING;[R1] [C7] column_is_rowkey:false;[R1] [C7] column_is_signed:true;[R1] [C7] column_encoding:utf8mb4;[R1] [C7] column_is_not_null:false;[R1] [C7] column_value_new:[1234567890123](13);[R1] [C8] column_name:C7;[R1] [C8] column_type:MYSQL_TYPE_STRING;[R1] [C8] column_is_rowkey:false;[R1] [C8] column_is_signed:true;[R1] [C8] column_encoding:utf8mb4;[R1] [C8] column_is_not_null:false;[R1] [C8] column_value_new:[12.34                                                                                               ](100);$[R2] COMMIT;
insert into number_1 (c0, c6) values (34,'12345678901234');
ob1.oblog.next;
[R0] BEGIN;[R0] org_cluster_id:1;[R1] record_type:INSERT;[R1] database_name:oracle.OBLOG_DB;[R1] table_name:NUMBER_1;[R1] log_event:true;[R1] column_count:8;[R1] source_category:SRC_FULL_RECORDED;[R1] source_type:SRC_OCEANBASE_1_0;[R1] has_pk:true;[R1] pk_info:(0);[R1] pks:C0;[R1] has_uk:false;[R1] uk_info:(null);[R1] uks:(null);[R1] [C1] column_name:C0;[R1] [C1] column_type:MYSQL_TYPE_NEWDECIMAL;[R1] [C1] column_is_rowkey:true;[R1] [C1] column_is_signed:true;[R1] [C1] column_encoding:binary;[R1] [C1] column_is_not_null:true;[R1] [C1] column_value_new:[34](2);[R1] [C2] column_name:C1;[R1] [C2] column_type:MYSQL_TYPE_DOUBLE;[R1] [C2] column_is_rowkey:false;[R1] [C2] column_is_signed:true;[R1] [C2] column_encoding:binary;[R1] [C2] column_is_not_null:false;[R1] [C2] column_value_new:[1.234E+001](10);[R1] [C3] column_name:C2;[R1] [C3] column_type:MYSQL_TYPE_FLOAT;[R1] [C3] column_is_rowkey:false;[R1] [C3] column_is_signed:true;[R1] [C3] column_encoding:binary;[R1] [C3] column_is_not_null:false;[R1] [C3] column_value_new:[1.23400002E+001](15);[R1] [C4] column_name:C3;[R1] [C4] column_type:MYSQL_TYPE_NEWDECIMAL;[R1] [C4] column_is_rowkey:false;[R1] [C4] column_is_signed:true;[R1] [C4] column_encoding:binary;[R1] [C4] column_is_not_null:false;[R1] [C4] column_value_new:[12.34](5);[R1] [C5] column_name:C4;[R1] [C5] column_type:MYSQL_TYPE_OB_NUMBER_FLOAT;[R1] [C5] column_is_rowkey:false;[R1] [C5] column_is_signed:true;[R1] [C5] column_encoding:binary;[R1] [C5] column_is_not_null:false;[R1] [C5] column_value_new:[12.34](5);[R1] [C6] column_name:C5;[R1] [C6] column_type:MYSQL_TYPE_OB_NUMBER_FLOAT;[R1] [C6] column_is_rowkey:false;[R1] [C6] column_is_signed:true;[R1] [C6] column_encoding:binary;[R1] [C6] column_is_not_null:false;[R1] [C6] column_value_new:[12.34](5);[R1] [C7] column_name:C6;[R1] [C7] column_type:MYSQL_TYPE_VAR_STRING;[R1] [C7] column_is_rowkey:false;[R1] [C7] column_is_signed:true;[R1] [C7] column_encoding:utf8mb4;[R1] [C7] column_is_not_null:false;[R1] [C7] column_value_new:[12345678901234](14);[R1] [C8] column_name:C7;[R1] [C8] column_type:MYSQL_TYPE_STRING;[R1] [C8] column_is_rowkey:false;[R1] [C8] column_is_signed:true;[R1] [C8] column_encoding:utf8mb4;[R1] [C8] column_is_not_null:false;[R1] [C8] column_value_new:[12.34                                                                                               ](100);$[R2] COMMIT;
insert into number_1 (c0, c6) values (35,'123456789012345');
ob1.oblog.next;
[R0] BEGIN;[R0] org_cluster_id:1;[R1] record_type:INSERT;[R1] database_name:oracle.OBLOG_DB;[R1] table_name:NUMBER_1;[R1] log_event:true;[R1] column_count:8;[R1] source_category:SRC_FULL_RECORDED;[R1] source_type:SRC_OCEANBASE_1_0;[R1] has_pk:true;[R1] pk_info:(0);[R1] pks:C0;[R1] has_uk:false;[R1] uk_info:(null);[R1] uks:(null);[R1] [C1] column_name:C0;[R1] [C1] column_type:MYSQL_TYPE_NEWDECIMAL;[R1] [C1] column_is_rowkey:true;[R1] [C1] column_is_signed:true;[R1] [C1] column_encoding:binary;[R1] [C1] column_is_not_null:true;[R1] [C1] column_value_new:[35](2);[R1] [C2] column_name:C1;[R1] [C2] column_type:MYSQL_TYPE_DOUBLE;[R1] [C2] column_is_rowkey:false;[R1] [C2] column_is_signed:true;[R1] [C2] column_encoding:binary;[R1] [C2] column_is_not_null:false;[R1] [C2] column_value_new:[1.234E+001](10);[R1] [C3] column_name:C2;[R1] [C3] column_type:MYSQL_TYPE_FLOAT;[R1] [C3] column_is_rowkey:false;[R1] [C3] column_is_signed:true;[R1] [C3] column_encoding:binary;[R1] [C3] column_is_not_null:false;[R1] [C3] column_value_new:[1.23400002E+001](15);[R1] [C4] column_name:C3;[R1] [C4] column_type:MYSQL_TYPE_NEWDECIMAL;[R1] [C4] column_is_rowkey:false;[R1] [C4] column_is_signed:true;[R1] [C4] column_encoding:binary;[R1] [C4] column_is_not_null:false;[R1] [C4] column_value_new:[12.34](5);[R1] [C5] column_name:C4;[R1] [C5] column_type:MYSQL_TYPE_OB_NUMBER_FLOAT;[R1] [C5] column_is_rowkey:false;[R1] [C5] column_is_signed:true;[R1] [C5] column_encoding:binary;[R1] [C5] column_is_not_null:false;[R1] [C5] column_value_new:[12.34](5);[R1] [C6] column_name:C5;[R1] [C6] column_type:MYSQL_TYPE_OB_NUMBER_FLOAT;[R1] [C6] column_is_rowkey:false;[R1] [C6] column_is_signed:true;[R1] [C6] column_encoding:binary;[R1] [C6] column_is_not_null:false;[R1] [C6] column_value_new:[12.34](5);[R1] [C7] column_name:C6;[R1] [C7] column_type:MYSQL_TYPE_VAR_STRING;[R1] [C7] column_is_rowkey:false;[R1] [C7] column_is_signed:true;[R1] [C7] column_encoding:utf8mb4;[R1] [C7] column_is_not_null:false;[R1] [C7] column_value_new:[123456789012345](15);[R1] [C8] column_name:C7;[R1] [C8] column_type:MYSQL_TYPE_STRING;[R1] [C8] column_is_rowkey:false;[R1] [C8] column_is_signed:true;[R1] [C8] column_encoding:utf8mb4;[R1] [C8] column_is_not_null:false;[R1] [C8] column_value_new:[12.34                                                                                               ](100);$[R2] COMMIT;
insert into number_1 (c0, c6) values (36,'1234567890123456');
ob1.oblog.next;
[R0] BEGIN;[R0] org_cluster_id:1;[R1] record_type:INSERT;[R1] database_name:oracle.OBLOG_DB;[R1] table_name:NUMBER_1;[R1] log_event:true;[R1] column_count:8;[R1] source_category:SRC_FULL_RECORDED;[R1] source_type:SRC_OCEANBASE_1_0;[R1] has_pk:true;[R1] pk_info:(0);[R1] pks:C0;[R1] has_uk:false;[R1] uk_info:(null);[R1] uks:(null);[R1] [C1] column_name:C0;[R1] [C1] column_type:MYSQL_TYPE_NEWDECIMAL;[R1] [C1] column_is_rowkey:true;[R1] [C1] column_is_signed:true;[R1] [C1] column_encoding:binary;[R1] [C1] column_is_not_null:true;[R1] [C1] column_value_new:[36](2);[R1] [C2] column_name:C1;[R1] [C2] column_type:MYSQL_TYPE_DOUBLE;[R1] [C2] column_is_rowkey:false;[R1] [C2] column_is_signed:true;[R1] [C2] column_encoding:binary;[R1] [C2] column_is_not_null:false;[R1] [C2] column_value_new:[1.234E+001](10);[R1] [C3] column_name:C2;[R1] [C3] column_type:MYSQL_TYPE_FLOAT;[R1] [C3] column_is_rowkey:false;[R1] [C3] column_is_signed:true;[R1] [C3] column_encoding:binary;[R1] [C3] column_is_not_null:false;[R1] [C3] column_value_new:[1.23400002E+001](15);[R1] [C4] column_name:C3;[R1] [C4] column_type:MYSQL_TYPE_NEWDECIMAL;[R1] [C4] column_is_rowkey:false;[R1] [C4] column_is_signed:true;[R1] [C4] column_encoding:binary;[R1] [C4] column_is_not_null:false;[R1] [C4] column_value_new:[12.34](5);[R1] [C5] column_name:C4;[R1] [C5] column_type:MYSQL_TYPE_OB_NUMBER_FLOAT;[R1] [C5] column_is_rowkey:false;[R1] [C5] column_is_signed:true;[R1] [C5] column_encoding:binary;[R1] [C5] column_is_not_null:false;[R1] [C5] column_value_new:[12.34](5);[R1] [C6] column_name:C5;[R1] [C6] column_type:MYSQL_TYPE_OB_NUMBER_FLOAT;[R1] [C6] column_is_rowkey:false;[R1] [C6] column_is_signed:true;[R1] [C6] column_encoding:binary;[R1] [C6] column_is_not_null:false;[R1] [C6] column_value_new:[12.34](5);[R1] [C7] column_name:C6;[R1] [C7] column_type:MYSQL_TYPE_VAR_STRING;[R1] [C7] column_is_rowkey:false;[R1] [C7] column_is_signed:true;[R1] [C7] column_encoding:utf8mb4;[R1] [C7] column_is_not_null:false;[R1] [C7] column_value_new:[1234567890123456](16);[R1] [C8] column_name:C7;[R1] [C8] column_type:MYSQL_TYPE_STRING;[R1] [C8] column_is_rowkey:false;[R1] [C8] column_is_signed:true;[R1] [C8] column_encoding:utf8mb4;[R1] [C8] column_is_not_null:false;[R1] [C8] column_value_new:[12.34                                                                                               ](100);$[R2] COMMIT;
insert into number_1 (c0, c6) values (37,'12345678901234567');
ob1.oblog.next;
[R0] BEGIN;[R0] org_cluster_id:1;[R1] record_type:INSERT;[R1] database_name:oracle.OBLOG_DB;[R1] table_name:NUMBER_1;[R1] log_event:true;[R1] column_count:8;[R1] source_category:SRC_FULL_RECORDED;[R1] source_type:SRC_OCEANBASE_1_0;[R1] has_pk:true;[R1] pk_info:(0);[R1] pks:C0;[R1] has_uk:false;[R1] uk_info:(null);[R1] uks:(null);[R1] [C1] column_name:C0;[R1] [C1] column_type:MYSQL_TYPE_NEWDECIMAL;[R1] [C1] column_is_rowkey:true;[R1] [C1] column_is_signed:true;[R1] [C1] column_encoding:binary;[R1] [C1] column_is_not_null:true;[R1] [C1] column_value_new:[37](2);[R1] [C2] column_name:C1;[R1] [C2] column_type:MYSQL_TYPE_DOUBLE;[R1] [C2] column_is_rowkey:false;[R1] [C2] column_is_signed:true;[R1] [C2] column_encoding:binary;[R1] [C2] column_is_not_null:false;[R1] [C2] column_value_new:[1.234E+001](10);[R1] [C3] column_name:C2;[R1] [C3] column_type:MYSQL_TYPE_FLOAT;[R1] [C3] column_is_rowkey:false;[R1] [C3] column_is_signed:true;[R1] [C3] column_encoding:binary;[R1] [C3] column_is_not_null:false;[R1] [C3] column_value_new:[1.23400002E+001](15);[R1] [C4] column_name:C3;[R1] [C4] column_type:MYSQL_TYPE_NEWDECIMAL;[R1] [C4] column_is_rowkey:false;[R1] [C4] column_is_signed:true;[R1] [C4] column_encoding:binary;[R1] [C4] column_is_not_null:false;[R1] [C4] column_value_new:[12.34](5);[R1] [C5] column_name:C4;[R1] [C5] column_type:MYSQL_TYPE_OB_NUMBER_FLOAT;[R1] [C5] column_is_rowkey:false;[R1] [C5] column_is_signed:true;[R1] [C5] column_encoding:binary;[R1] [C5] column_is_not_null:false;[R1] [C5] column_value_new:[12.34](5);[R1] [C6] column_name:C5;[R1] [C6] column_type:MYSQL_TYPE_OB_NUMBER_FLOAT;[R1] [C6] column_is_rowkey:false;[R1] [C6] column_is_signed:true;[R1] [C6] column_encoding:binary;[R1] [C6] column_is_not_null:false;[R1] [C6] column_value_new:[12.34](5);[R1] [C7] column_name:C6;[R1] [C7] column_type:MYSQL_TYPE_VAR_STRING;[R1] [C7] column_is_rowkey:false;[R1] [C7] column_is_signed:true;[R1] [C7] column_encoding:utf8mb4;[R1] [C7] column_is_not_null:false;[R1] [C7] column_value_new:[12345678901234567](17);[R1] [C8] column_name:C7;[R1] [C8] column_type:MYSQL_TYPE_STRING;[R1] [C8] column_is_rowkey:false;[R1] [C8] column_is_signed:true;[R1] [C8] column_encoding:utf8mb4;[R1] [C8] column_is_not_null:false;[R1] [C8] column_value_new:[12.34                                                                                               ](100);$[R2] COMMIT;
insert into number_1 (c0, c6) values (38,'123456789012345678');
ob1.oblog.next;
[R0] BEGIN;[R0] org_cluster_id:1;[R1] record_type:INSERT;[R1] database_name:oracle.OBLOG_DB;[R1] table_name:NUMBER_1;[R1] log_event:true;[R1] column_count:8;[R1] source_category:SRC_FULL_RECORDED;[R1] source_type:SRC_OCEANBASE_1_0;[R1] has_pk:true;[R1] pk_info:(0);[R1] pks:C0;[R1] has_uk:false;[R1] uk_info:(null);[R1] uks:(null);[R1] [C1] column_name:C0;[R1] [C1] column_type:MYSQL_TYPE_NEWDECIMAL;[R1] [C1] column_is_rowkey:true;[R1] [C1] column_is_signed:true;[R1] [C1] column_encoding:binary;[R1] [C1] column_is_not_null:true;[R1] [C1] column_value_new:[38](2);[R1] [C2] column_name:C1;[R1] [C2] column_type:MYSQL_TYPE_DOUBLE;[R1] [C2] column_is_rowkey:false;[R1] [C2] column_is_signed:true;[R1] [C2] column_encoding:binary;[R1] [C2] column_is_not_null:false;[R1] [C2] column_value_new:[1.234E+001](10);[R1] [C3] column_name:C2;[R1] [C3] column_type:MYSQL_TYPE_FLOAT;[R1] [C3] column_is_rowkey:false;[R1] [C3] column_is_signed:true;[R1] [C3] column_encoding:binary;[R1] [C3] column_is_not_null:false;[R1] [C3] column_value_new:[1.23400002E+001](15);[R1] [C4] column_name:C3;[R1] [C4] column_type:MYSQL_TYPE_NEWDECIMAL;[R1] [C4] column_is_rowkey:false;[R1] [C4] column_is_signed:true;[R1] [C4] column_encoding:binary;[R1] [C4] column_is_not_null:false;[R1] [C4] column_value_new:[12.34](5);[R1] [C5] column_name:C4;[R1] [C5] column_type:MYSQL_TYPE_OB_NUMBER_FLOAT;[R1] [C5] column_is_rowkey:false;[R1] [C5] column_is_signed:true;[R1] [C5] column_encoding:binary;[R1] [C5] column_is_not_null:false;[R1] [C5] column_value_new:[12.34](5);[R1] [C6] column_name:C5;[R1] [C6] column_type:MYSQL_TYPE_OB_NUMBER_FLOAT;[R1] [C6] column_is_rowkey:false;[R1] [C6] column_is_signed:true;[R1] [C6] column_encoding:binary;[R1] [C6] column_is_not_null:false;[R1] [C6] column_value_new:[12.34](5);[R1] [C7] column_name:C6;[R1] [C7] column_type:MYSQL_TYPE_VAR_STRING;[R1] [C7] column_is_rowkey:false;[R1] [C7] column_is_signed:true;[R1] [C7] column_encoding:utf8mb4;[R1] [C7] column_is_not_null:false;[R1] [C7] column_value_new:[123456789012345678](18);[R1] [C8] column_name:C7;[R1] [C8] column_type:MYSQL_TYPE_STRING;[R1] [C8] column_is_rowkey:false;[R1] [C8] column_is_signed:true;[R1] [C8] column_encoding:utf8mb4;[R1] [C8] column_is_not_null:false;[R1] [C8] column_value_new:[12.34                                                                                               ](100);$[R2] COMMIT;
insert into number_1 (c0, c6) values (39,'1234567890123456789');
ob1.oblog.next;
[R0] BEGIN;[R0] org_cluster_id:1;[R1] record_type:INSERT;[R1] database_name:oracle.OBLOG_DB;[R1] table_name:NUMBER_1;[R1] log_event:true;[R1] column_count:8;[R1] source_category:SRC_FULL_RECORDED;[R1] source_type:SRC_OCEANBASE_1_0;[R1] has_pk:true;[R1] pk_info:(0);[R1] pks:C0;[R1] has_uk:false;[R1] uk_info:(null);[R1] uks:(null);[R1] [C1] column_name:C0;[R1] [C1] column_type:MYSQL_TYPE_NEWDECIMAL;[R1] [C1] column_is_rowkey:true;[R1] [C1] column_is_signed:true;[R1] [C1] column_encoding:binary;[R1] [C1] column_is_not_null:true;[R1] [C1] column_value_new:[39](2);[R1] [C2] column_name:C1;[R1] [C2] column_type:MYSQL_TYPE_DOUBLE;[R1] [C2] column_is_rowkey:false;[R1] [C2] column_is_signed:true;[R1] [C2] column_encoding:binary;[R1] [C2] column_is_not_null:false;[R1] [C2] column_value_new:[1.234E+001](10);[R1] [C3] column_name:C2;[R1] [C3] column_type:MYSQL_TYPE_FLOAT;[R1] [C3] column_is_rowkey:false;[R1] [C3] column_is_signed:true;[R1] [C3] column_encoding:binary;[R1] [C3] column_is_not_null:false;[R1] [C3] column_value_new:[1.23400002E+001](15);[R1] [C4] column_name:C3;[R1] [C4] column_type:MYSQL_TYPE_NEWDECIMAL;[R1] [C4] column_is_rowkey:false;[R1] [C4] column_is_signed:true;[R1] [C4] column_encoding:binary;[R1] [C4] column_is_not_null:false;[R1] [C4] column_value_new:[12.34](5);[R1] [C5] column_name:C4;[R1] [C5] column_type:MYSQL_TYPE_OB_NUMBER_FLOAT;[R1] [C5] column_is_rowkey:false;[R1] [C5] column_is_signed:true;[R1] [C5] column_encoding:binary;[R1] [C5] column_is_not_null:false;[R1] [C5] column_value_new:[12.34](5);[R1] [C6] column_name:C5;[R1] [C6] column_type:MYSQL_TYPE_OB_NUMBER_FLOAT;[R1] [C6] column_is_rowkey:false;[R1] [C6] column_is_signed:true;[R1] [C6] column_encoding:binary;[R1] [C6] column_is_not_null:false;[R1] [C6] column_value_new:[12.34](5);[R1] [C7] column_name:C6;[R1] [C7] column_type:MYSQL_TYPE_VAR_STRING;[R1] [C7] column_is_rowkey:false;[R1] [C7] column_is_signed:true;[R1] [C7] column_encoding:utf8mb4;[R1] [C7] column_is_not_null:false;[R1] [C7] column_value_new:[1234567890123456789](19);[R1] [C8] column_name:C7;[R1] [C8] column_type:MYSQL_TYPE_STRING;[R1] [C8] column_is_rowkey:false;[R1] [C8] column_is_signed:true;[R1] [C8] column_encoding:utf8mb4;[R1] [C8] column_is_not_null:false;[R1] [C8] column_value_new:[12.34                                                                                               ](100);$[R2] COMMIT;
insert into number_1 (c0, c6) values (40,'12345678901234567890');
ob1.oblog.next;
[R0] BEGIN;[R0] org_cluster_id:1;[R1] record_type:INSERT;[R1] database_name:oracle.OBLOG_DB;[R1] table_name:NUMBER_1;[R1] log_event:true;[R1] column_count:8;[R1] source_category:SRC_FULL_RECORDED;[R1] source_type:SRC_OCEANBASE_1_0;[R1] has_pk:true;[R1] pk_info:(0);[R1] pks:C0;[R1] has_uk:false;[R1] uk_info:(null);[R1] uks:(null);[R1] [C1] column_name:C0;[R1] [C1] column_type:MYSQL_TYPE_NEWDECIMAL;[R1] [C1] column_is_rowkey:true;[R1] [C1] column_is_signed:true;[R1] [C1] column_encoding:binary;[R1] [C1] column_is_not_null:true;[R1] [C1] column_value_new:[40](2);[R1] [C2] column_name:C1;[R1] [C2] column_type:MYSQL_TYPE_DOUBLE;[R1] [C2] column_is_rowkey:false;[R1] [C2] column_is_signed:true;[R1] [C2] column_encoding:binary;[R1] [C2] column_is_not_null:false;[R1] [C2] column_value_new:[1.234E+001](10);[R1] [C3] column_name:C2;[R1] [C3] column_type:MYSQL_TYPE_FLOAT;[R1] [C3] column_is_rowkey:false;[R1] [C3] column_is_signed:true;[R1] [C3] column_encoding:binary;[R1] [C3] column_is_not_null:false;[R1] [C3] column_value_new:[1.23400002E+001](15);[R1] [C4] column_name:C3;[R1] [C4] column_type:MYSQL_TYPE_NEWDECIMAL;[R1] [C4] column_is_rowkey:false;[R1] [C4] column_is_signed:true;[R1] [C4] column_encoding:binary;[R1] [C4] column_is_not_null:false;[R1] [C4] column_value_new:[12.34](5);[R1] [C5] column_name:C4;[R1] [C5] column_type:MYSQL_TYPE_OB_NUMBER_FLOAT;[R1] [C5] column_is_rowkey:false;[R1] [C5] column_is_signed:true;[R1] [C5] column_encoding:binary;[R1] [C5] column_is_not_null:false;[R1] [C5] column_value_new:[12.34](5);[R1] [C6] column_name:C5;[R1] [C6] column_type:MYSQL_TYPE_OB_NUMBER_FLOAT;[R1] [C6] column_is_rowkey:false;[R1] [C6] column_is_signed:true;[R1] [C6] column_encoding:binary;[R1] [C6] column_is_not_null:false;[R1] [C6] column_value_new:[12.34](5);[R1] [C7] column_name:C6;[R1] [C7] column_type:MYSQL_TYPE_VAR_STRING;[R1] [C7] column_is_rowkey:false;[R1] [C7] column_is_signed:true;[R1] [C7] column_encoding:utf8mb4;[R1] [C7] column_is_not_null:false;[R1] [C7] column_value_new:[12345678901234567890](20);[R1] [C8] column_name:C7;[R1] [C8] column_type:MYSQL_TYPE_STRING;[R1] [C8] column_is_rowkey:false;[R1] [C8] column_is_signed:true;[R1] [C8] column_encoding:utf8mb4;[R1] [C8] column_is_not_null:false;[R1] [C8] column_value_new:[12.34                                                                                               ](100);$[R2] COMMIT;
insert into number_1 (c0, c6) values (41,'1234567890123456789.0');
ob1.oblog.next;
[R0] BEGIN;[R0] org_cluster_id:1;[R1] record_type:INSERT;[R1] database_name:oracle.OBLOG_DB;[R1] table_name:NUMBER_1;[R1] log_event:true;[R1] column_count:8;[R1] source_category:SRC_FULL_RECORDED;[R1] source_type:SRC_OCEANBASE_1_0;[R1] has_pk:true;[R1] pk_info:(0);[R1] pks:C0;[R1] has_uk:false;[R1] uk_info:(null);[R1] uks:(null);[R1] [C1] column_name:C0;[R1] [C1] column_type:MYSQL_TYPE_NEWDECIMAL;[R1] [C1] column_is_rowkey:true;[R1] [C1] column_is_signed:true;[R1] [C1] column_encoding:binary;[R1] [C1] column_is_not_null:true;[R1] [C1] column_value_new:[41](2);[R1] [C2] column_name:C1;[R1] [C2] column_type:MYSQL_TYPE_DOUBLE;[R1] [C2] column_is_rowkey:false;[R1] [C2] column_is_signed:true;[R1] [C2] column_encoding:binary;[R1] [C2] column_is_not_null:false;[R1] [C2] column_value_new:[1.234E+001](10);[R1] [C3] column_name:C2;[R1] [C3] column_type:MYSQL_TYPE_FLOAT;[R1] [C3] column_is_rowkey:false;[R1] [C3] column_is_signed:true;[R1] [C3] column_encoding:binary;[R1] [C3] column_is_not_null:false;[R1] [C3] column_value_new:[1.23400002E+001](15);[R1] [C4] column_name:C3;[R1] [C4] column_type:MYSQL_TYPE_NEWDECIMAL;[R1] [C4] column_is_rowkey:false;[R1] [C4] column_is_signed:true;[R1] [C4] column_encoding:binary;[R1] [C4] column_is_not_null:false;[R1] [C4] column_value_new:[12.34](5);[R1] [C5] column_name:C4;[R1] [C5] column_type:MYSQL_TYPE_OB_NUMBER_FLOAT;[R1] [C5] column_is_rowkey:false;[R1] [C5] column_is_signed:true;[R1] [C5] column_encoding:binary;[R1] [C5] column_is_not_null:false;[R1] [C5] column_value_new:[12.34](5);[R1] [C6] column_name:C5;[R1] [C6] column_type:MYSQL_TYPE_OB_NUMBER_FLOAT;[R1] [C6] column_is_rowkey:false;[R1] [C6] column_is_signed:true;[R1] [C6] column_encoding:binary;[R1] [C6] column_is_not_null:false;[R1] [C6] column_value_new:[12.34](5);[R1] [C7] column_name:C6;[R1] [C7] column_type:MYSQL_TYPE_VAR_STRING;[R1] [C7] column_is_rowkey:false;[R1] [C7] column_is_signed:true;[R1] [C7] column_encoding:utf8mb4;[R1] [C7] column_is_not_null:false;[R1] [C7] column_value_new:[1234567890123456789.0](21);[R1] [C8] column_name:C7;[R1] [C8] column_type:MYSQL_TYPE_STRING;[R1] [C8] column_is_rowkey:false;[R1] [C8] column_is_signed:true;[R1] [C8] column_encoding:utf8mb4;[R1] [C8] column_is_not_null:false;[R1] [C8] column_value_new:[12.34                                                                                               ](100);$[R2] COMMIT;
insert into number_1 (c0, c6) values (42,'123456789012345678.90');
ob1.oblog.next;
[R0] BEGIN;[R0] org_cluster_id:1;[R1] record_type:INSERT;[R1] database_name:oracle.OBLOG_DB;[R1] table_name:NUMBER_1;[R1] log_event:true;[R1] column_count:8;[R1] source_category:SRC_FULL_RECORDED;[R1] source_type:SRC_OCEANBASE_1_0;[R1] has_pk:true;[R1] pk_info:(0);[R1] pks:C0;[R1] has_uk:false;[R1] uk_info:(null);[R1] uks:(null);[R1] [C1] column_name:C0;[R1] [C1] column_type:MYSQL_TYPE_NEWDECIMAL;[R1] [C1] column_is_rowkey:true;[R1] [C1] column_is_signed:true;[R1] [C1] column_encoding:binary;[R1] [C1] column_is_not_null:true;[R1] [C1] column_value_new:[42](2);[R1] [C2] column_name:C1;[R1] [C2] column_type:MYSQL_TYPE_DOUBLE;[R1] [C2] column_is_rowkey:false;[R1] [C2] column_is_signed:true;[R1] [C2] column_encoding:binary;[R1] [C2] column_is_not_null:false;[R1] [C2] column_value_new:[1.234E+001](10);[R1] [C3] column_name:C2;[R1] [C3] column_type:MYSQL_TYPE_FLOAT;[R1] [C3] column_is_rowkey:false;[R1] [C3] column_is_signed:true;[R1] [C3] column_encoding:binary;[R1] [C3] column_is_not_null:false;[R1] [C3] column_value_new:[1.23400002E+001](15);[R1] [C4] column_name:C3;[R1] [C4] column_type:MYSQL_TYPE_NEWDECIMAL;[R1] [C4] column_is_rowkey:false;[R1] [C4] column_is_signed:true;[R1] [C4] column_encoding:binary;[R1] [C4] column_is_not_null:false;[R1] [C4] column_value_new:[12.34](5);[R1] [C5] column_name:C4;[R1] [C5] column_type:MYSQL_TYPE_OB_NUMBER_FLOAT;[R1] [C5] column_is_rowkey:false;[R1] [C5] column_is_signed:true;[R1] [C5] column_encoding:binary;[R1] [C5] column_is_not_null:false;[R1] [C5] column_value_new:[12.34](5);[R1] [C6] column_name:C5;[R1] [C6] column_type:MYSQL_TYPE_OB_NUMBER_FLOAT;[R1] [C6] column_is_rowkey:false;[R1] [C6] column_is_signed:true;[R1] [C6] column_encoding:binary;[R1] [C6] column_is_not_null:false;[R1] [C6] column_value_new:[12.34](5);[R1] [C7] column_name:C6;[R1] [C7] column_type:MYSQL_TYPE_VAR_STRING;[R1] [C7] column_is_rowkey:false;[R1] [C7] column_is_signed:true;[R1] [C7] column_encoding:utf8mb4;[R1] [C7] column_is_not_null:false;[R1] [C7] column_value_new:[123456789012345678.90](21);[R1] [C8] column_name:C7;[R1] [C8] column_type:MYSQL_TYPE_STRING;[R1] [C8] column_is_rowkey:false;[R1] [C8] column_is_signed:true;[R1] [C8] column_encoding:utf8mb4;[R1] [C8] column_is_not_null:false;[R1] [C8] column_value_new:[12.34                                                                                               ](100);$[R2] COMMIT;
insert into number_1 (c0, c6) values (43,'12345678901234567.890');
ob1.oblog.next;
[R0] BEGIN;[R0] org_cluster_id:1;[R1] record_type:INSERT;[R1] database_name:oracle.OBLOG_DB;[R1] table_name:NUMBER_1;[R1] log_event:true;[R1] column_count:8;[R1] source_category:SRC_FULL_RECORDED;[R1] source_type:SRC_OCEANBASE_1_0;[R1] has_pk:true;[R1] pk_info:(0);[R1] pks:C0;[R1] has_uk:false;[R1] uk_info:(null);[R1] uks:(null);[R1] [C1] column_name:C0;[R1] [C1] column_type:MYSQL_TYPE_NEWDECIMAL;[R1] [C1] column_is_rowkey:true;[R1] [C1] column_is_signed:true;[R1] [C1] column_encoding:binary;[R1] [C1] column_is_not_null:true;[R1] [C1] column_value_new:[43](2);[R1] [C2] column_name:C1;[R1] [C2] column_type:MYSQL_TYPE_DOUBLE;[R1] [C2] column_is_rowkey:false;[R1] [C2] column_is_signed:true;[R1] [C2] column_encoding:binary;[R1] [C2] column_is_not_null:false;[R1] [C2] column_value_new:[1.234E+001](10);[R1] [C3] column_name:C2;[R1] [C3] column_type:MYSQL_TYPE_FLOAT;[R1] [C3] column_is_rowkey:false;[R1] [C3] column_is_signed:true;[R1] [C3] column_encoding:binary;[R1] [C3] column_is_not_null:false;[R1] [C3] column_value_new:[1.23400002E+001](15);[R1] [C4] column_name:C3;[R1] [C4] column_type:MYSQL_TYPE_NEWDECIMAL;[R1] [C4] column_is_rowkey:false;[R1] [C4] column_is_signed:true;[R1] [C4] column_encoding:binary;[R1] [C4] column_is_not_null:false;[R1] [C4] column_value_new:[12.34](5);[R1] [C5] column_name:C4;[R1] [C5] column_type:MYSQL_TYPE_OB_NUMBER_FLOAT;[R1] [C5] column_is_rowkey:false;[R1] [C5] column_is_signed:true;[R1] [C5] column_encoding:binary;[R1] [C5] column_is_not_null:false;[R1] [C5] column_value_new:[12.34](5);[R1] [C6] column_name:C5;[R1] [C6] column_type:MYSQL_TYPE_OB_NUMBER_FLOAT;[R1] [C6] column_is_rowkey:false;[R1] [C6] column_is_signed:true;[R1] [C6] column_encoding:binary;[R1] [C6] column_is_not_null:false;[R1] [C6] column_value_new:[12.34](5);[R1] [C7] column_name:C6;[R1] [C7] column_type:MYSQL_TYPE_VAR_STRING;[R1] [C7] column_is_rowkey:false;[R1] [C7] column_is_signed:true;[R1] [C7] column_encoding:utf8mb4;[R1] [C7] column_is_not_null:false;[R1] [C7] column_value_new:[12345678901234567.890](21);[R1] [C8] column_name:C7;[R1] [C8] column_type:MYSQL_TYPE_STRING;[R1] [C8] column_is_rowkey:false;[R1] [C8] column_is_signed:true;[R1] [C8] column_encoding:utf8mb4;[R1] [C8] column_is_not_null:false;[R1] [C8] column_value_new:[12.34                                                                                               ](100);$[R2] COMMIT;
insert into number_1 (c0, c6) values (44,'1234567890123456.7890');
ob1.oblog.next;
[R0] BEGIN;[R0] org_cluster_id:1;[R1] record_type:INSERT;[R1] database_name:oracle.OBLOG_DB;[R1] table_name:NUMBER_1;[R1] log_event:true;[R1] column_count:8;[R1] source_category:SRC_FULL_RECORDED;[R1] source_type:SRC_OCEANBASE_1_0;[R1] has_pk:true;[R1] pk_info:(0);[R1] pks:C0;[R1] has_uk:false;[R1] uk_info:(null);[R1] uks:(null);[R1] [C1] column_name:C0;[R1] [C1] column_type:MYSQL_TYPE_NEWDECIMAL;[R1] [C1] column_is_rowkey:true;[R1] [C1] column_is_signed:true;[R1] [C1] column_encoding:binary;[R1] [C1] column_is_not_null:true;[R1] [C1] column_value_new:[44](2);[R1] [C2] column_name:C1;[R1] [C2] column_type:MYSQL_TYPE_DOUBLE;[R1] [C2] column_is_rowkey:false;[R1] [C2] column_is_signed:true;[R1] [C2] column_encoding:binary;[R1] [C2] column_is_not_null:false;[R1] [C2] column_value_new:[1.234E+001](10);[R1] [C3] column_name:C2;[R1] [C3] column_type:MYSQL_TYPE_FLOAT;[R1] [C3] column_is_rowkey:false;[R1] [C3] column_is_signed:true;[R1] [C3] column_encoding:binary;[R1] [C3] column_is_not_null:false;[R1] [C3] column_value_new:[1.23400002E+001](15);[R1] [C4] column_name:C3;[R1] [C4] column_type:MYSQL_TYPE_NEWDECIMAL;[R1] [C4] column_is_rowkey:false;[R1] [C4] column_is_signed:true;[R1] [C4] column_encoding:binary;[R1] [C4] column_is_not_null:false;[R1] [C4] column_value_new:[12.34](5);[R1] [C5] column_name:C4;[R1] [C5] column_type:MYSQL_TYPE_OB_NUMBER_FLOAT;[R1] [C5] column_is_rowkey:false;[R1] [C5] column_is_signed:true;[R1] [C5] column_encoding:binary;[R1] [C5] column_is_not_null:false;[R1] [C5] column_value_new:[12.34](5);[R1] [C6] column_name:C5;[R1] [C6] column_type:MYSQL_TYPE_OB_NUMBER_FLOAT;[R1] [C6] column_is_rowkey:false;[R1] [C6] column_is_signed:true;[R1] [C6] column_encoding:binary;[R1] [C6] column_is_not_null:false;[R1] [C6] column_value_new:[12.34](5);[R1] [C7] column_name:C6;[R1] [C7] column_type:MYSQL_TYPE_VAR_STRING;[R1] [C7] column_is_rowkey:false;[R1] [C7] column_is_signed:true;[R1] [C7] column_encoding:utf8mb4;[R1] [C7] column_is_not_null:false;[R1] [C7] column_value_new:[1234567890123456.7890](21);[R1] [C8] column_name:C7;[R1] [C8] column_type:MYSQL_TYPE_STRING;[R1] [C8] column_is_rowkey:false;[R1] [C8] column_is_signed:true;[R1] [C8] column_encoding:utf8mb4;[R1] [C8] column_is_not_null:false;[R1] [C8] column_value_new:[12.34                                                                                               ](100);$[R2] COMMIT;
insert into number_1 (c0, c6) values (45,'123456789012345.67890');
ob1.oblog.next;
[R0] BEGIN;[R0] org_cluster_id:1;[R1] record_type:INSERT;[R1] database_name:oracle.OBLOG_DB;[R1] table_name:NUMBER_1;[R1] log_event:true;[R1] column_count:8;[R1] source_category:SRC_FULL_RECORDED;[R1] source_type:SRC_OCEANBASE_1_0;[R1] has_pk:true;[R1] pk_info:(0);[R1] pks:C0;[R1] has_uk:false;[R1] uk_info:(null);[R1] uks:(null);[R1] [C1] column_name:C0;[R1] [C1] column_type:MYSQL_TYPE_NEWDECIMAL;[R1] [C1] column_is_rowkey:true;[R1] [C1] column_is_signed:true;[R1] [C1] column_encoding:binary;[R1] [C1] column_is_not_null:true;[R1] [C1] column_value_new:[45](2);[R1] [C2] column_name:C1;[R1] [C2] column_type:MYSQL_TYPE_DOUBLE;[R1] [C2] column_is_rowkey:false;[R1] [C2] column_is_signed:true;[R1] [C2] column_encoding:binary;[R1] [C2] column_is_not_null:false;[R1] [C2] column_value_new:[1.234E+001](10);[R1] [C3] column_name:C2;[R1] [C3] column_type:MYSQL_TYPE_FLOAT;[R1] [C3] column_is_rowkey:false;[R1] [C3] column_is_signed:true;[R1] [C3] column_encoding:binary;[R1] [C3] column_is_not_null:false;[R1] [C3] column_value_new:[1.23400002E+001](15);[R1] [C4] column_name:C3;[R1] [C4] column_type:MYSQL_TYPE_NEWDECIMAL;[R1] [C4] column_is_rowkey:false;[R1] [C4] column_is_signed:true;[R1] [C4] column_encoding:binary;[R1] [C4] column_is_not_null:false;[R1] [C4] column_value_new:[12.34](5);[R1] [C5] column_name:C4;[R1] [C5] column_type:MYSQL_TYPE_OB_NUMBER_FLOAT;[R1] [C5] column_is_rowkey:false;[R1] [C5] column_is_signed:true;[R1] [C5] column_encoding:binary;[R1] [C5] column_is_not_null:false;[R1] [C5] column_value_new:[12.34](5);[R1] [C6] column_name:C5;[R1] [C6] column_type:MYSQL_TYPE_OB_NUMBER_FLOAT;[R1] [C6] column_is_rowkey:false;[R1] [C6] column_is_signed:true;[R1] [C6] column_encoding:binary;[R1] [C6] column_is_not_null:false;[R1] [C6] column_value_new:[12.34](5);[R1] [C7] column_name:C6;[R1] [C7] column_type:MYSQL_TYPE_VAR_STRING;[R1] [C7] column_is_rowkey:false;[R1] [C7] column_is_signed:true;[R1] [C7] column_encoding:utf8mb4;[R1] [C7] column_is_not_null:false;[R1] [C7] column_value_new:[123456789012345.67890](21);[R1] [C8] column_name:C7;[R1] [C8] column_type:MYSQL_TYPE_STRING;[R1] [C8] column_is_rowkey:false;[R1] [C8] column_is_signed:true;[R1] [C8] column_encoding:utf8mb4;[R1] [C8] column_is_not_null:false;[R1] [C8] column_value_new:[12.34                                                                                               ](100);$[R2] COMMIT;
insert into number_1 (c0, c6) values (46,'12345678901234.567890');
ob1.oblog.next;
[R0] BEGIN;[R0] org_cluster_id:1;[R1] record_type:INSERT;[R1] database_name:oracle.OBLOG_DB;[R1] table_name:NUMBER_1;[R1] log_event:true;[R1] column_count:8;[R1] source_category:SRC_FULL_RECORDED;[R1] source_type:SRC_OCEANBASE_1_0;[R1] has_pk:true;[R1] pk_info:(0);[R1] pks:C0;[R1] has_uk:false;[R1] uk_info:(null);[R1] uks:(null);[R1] [C1] column_name:C0;[R1] [C1] column_type:MYSQL_TYPE_NEWDECIMAL;[R1] [C1] column_is_rowkey:true;[R1] [C1] column_is_signed:true;[R1] [C1] column_encoding:binary;[R1] [C1] column_is_not_null:true;[R1] [C1] column_value_new:[46](2);[R1] [C2] column_name:C1;[R1] [C2] column_type:MYSQL_TYPE_DOUBLE;[R1] [C2] column_is_rowkey:false;[R1] [C2] column_is_signed:true;[R1] [C2] column_encoding:binary;[R1] [C2] column_is_not_null:false;[R1] [C2] column_value_new:[1.234E+001](10);[R1] [C3] column_name:C2;[R1] [C3] column_type:MYSQL_TYPE_FLOAT;[R1] [C3] column_is_rowkey:false;[R1] [C3] column_is_signed:true;[R1] [C3] column_encoding:binary;[R1] [C3] column_is_not_null:false;[R1] [C3] column_value_new:[1.23400002E+001](15);[R1] [C4] column_name:C3;[R1] [C4] column_type:MYSQL_TYPE_NEWDECIMAL;[R1] [C4] column_is_rowkey:false;[R1] [C4] column_is_signed:true;[R1] [C4] column_encoding:binary;[R1] [C4] column_is_not_null:false;[R1] [C4] column_value_new:[12.34](5);[R1] [C5] column_name:C4;[R1] [C5] column_type:MYSQL_TYPE_OB_NUMBER_FLOAT;[R1] [C5] column_is_rowkey:false;[R1] [C5] column_is_signed:true;[R1] [C5] column_encoding:binary;[R1] [C5] column_is_not_null:false;[R1] [C5] column_value_new:[12.34](5);[R1] [C6] column_name:C5;[R1] [C6] column_type:MYSQL_TYPE_OB_NUMBER_FLOAT;[R1] [C6] column_is_rowkey:false;[R1] [C6] column_is_signed:true;[R1] [C6] column_encoding:binary;[R1] [C6] column_is_not_null:false;[R1] [C6] column_value_new:[12.34](5);[R1] [C7] column_name:C6;[R1] [C7] column_type:MYSQL_TYPE_VAR_STRING;[R1] [C7] column_is_rowkey:false;[R1] [C7] column_is_signed:true;[R1] [C7] column_encoding:utf8mb4;[R1] [C7] column_is_not_null:false;[R1] [C7] column_value_new:[12345678901234.567890](21);[R1] [C8] column_name:C7;[R1] [C8] column_type:MYSQL_TYPE_STRING;[R1] [C8] column_is_rowkey:false;[R1] [C8] column_is_signed:true;[R1] [C8] column_encoding:utf8mb4;[R1] [C8] column_is_not_null:false;[R1] [C8] column_value_new:[12.34                                                                                               ](100);$[R2] COMMIT;
insert into number_1 (c0, c6) values (47,'1234567890123.4567890');
ob1.oblog.next;
[R0] BEGIN;[R0] org_cluster_id:1;[R1] record_type:INSERT;[R1] database_name:oracle.OBLOG_DB;[R1] table_name:NUMBER_1;[R1] log_event:true;[R1] column_count:8;[R1] source_category:SRC_FULL_RECORDED;[R1] source_type:SRC_OCEANBASE_1_0;[R1] has_pk:true;[R1] pk_info:(0);[R1] pks:C0;[R1] has_uk:false;[R1] uk_info:(null);[R1] uks:(null);[R1] [C1] column_name:C0;[R1] [C1] column_type:MYSQL_TYPE_NEWDECIMAL;[R1] [C1] column_is_rowkey:true;[R1] [C1] column_is_signed:true;[R1] [C1] column_encoding:binary;[R1] [C1] column_is_not_null:true;[R1] [C1] column_value_new:[47](2);[R1] [C2] column_name:C1;[R1] [C2] column_type:MYSQL_TYPE_DOUBLE;[R1] [C2] column_is_rowkey:false;[R1] [C2] column_is_signed:true;[R1] [C2] column_encoding:binary;[R1] [C2] column_is_not_null:false;[R1] [C2] column_value_new:[1.234E+001](10);[R1] [C3] column_name:C2;[R1] [C3] column_type:MYSQL_TYPE_FLOAT;[R1] [C3] column_is_rowkey:false;[R1] [C3] column_is_signed:true;[R1] [C3] column_encoding:binary;[R1] [C3] column_is_not_null:false;[R1] [C3] column_value_new:[1.23400002E+001](15);[R1] [C4] column_name:C3;[R1] [C4] column_type:MYSQL_TYPE_NEWDECIMAL;[R1] [C4] column_is_rowkey:false;[R1] [C4] column_is_signed:true;[R1] [C4] column_encoding:binary;[R1] [C4] column_is_not_null:false;[R1] [C4] column_value_new:[12.34](5);[R1] [C5] column_name:C4;[R1] [C5] column_type:MYSQL_TYPE_OB_NUMBER_FLOAT;[R1] [C5] column_is_rowkey:false;[R1] [C5] column_is_signed:true;[R1] [C5] column_encoding:binary;[R1] [C5] column_is_not_null:false;[R1] [C5] column_value_new:[12.34](5);[R1] [C6] column_name:C5;[R1] [C6] column_type:MYSQL_TYPE_OB_NUMBER_FLOAT;[R1] [C6] column_is_rowkey:false;[R1] [C6] column_is_signed:true;[R1] [C6] column_encoding:binary;[R1] [C6] column_is_not_null:false;[R1] [C6] column_value_new:[12.34](5);[R1] [C7] column_name:C6;[R1] [C7] column_type:MYSQL_TYPE_VAR_STRING;[R1] [C7] column_is_rowkey:false;[R1] [C7] column_is_signed:true;[R1] [C7] column_encoding:utf8mb4;[R1] [C7] column_is_not_null:false;[R1] [C7] column_value_new:[1234567890123.4567890](21);[R1] [C8] column_name:C7;[R1] [C8] column_type:MYSQL_TYPE_STRING;[R1] [C8] column_is_rowkey:false;[R1] [C8] column_is_signed:true;[R1] [C8] column_encoding:utf8mb4;[R1] [C8] column_is_not_null:false;[R1] [C8] column_value_new:[12.34                                                                                               ](100);$[R2] COMMIT;
insert into number_1 (c0, c6) values (48,'123456789012.34567890');
ob1.oblog.next;
[R0] BEGIN;[R0] org_cluster_id:1;[R1] record_type:INSERT;[R1] database_name:oracle.OBLOG_DB;[R1] table_name:NUMBER_1;[R1] log_event:true;[R1] column_count:8;[R1] source_category:SRC_FULL_RECORDED;[R1] source_type:SRC_OCEANBASE_1_0;[R1] has_pk:true;[R1] pk_info:(0);[R1] pks:C0;[R1] has_uk:false;[R1] uk_info:(null);[R1] uks:(null);[R1] [C1] column_name:C0;[R1] [C1] column_type:MYSQL_TYPE_NEWDECIMAL;[R1] [C1] column_is_rowkey:true;[R1] [C1] column_is_signed:true;[R1] [C1] column_encoding:binary;[R1] [C1] column_is_not_null:true;[R1] [C1] column_value_new:[48](2);[R1] [C2] column_name:C1;[R1] [C2] column_type:MYSQL_TYPE_DOUBLE;[R1] [C2] column_is_rowkey:false;[R1] [C2] column_is_signed:true;[R1] [C2] column_encoding:binary;[R1] [C2] column_is_not_null:false;[R1] [C2] column_value_new:[1.234E+001](10);[R1] [C3] column_name:C2;[R1] [C3] column_type:MYSQL_TYPE_FLOAT;[R1] [C3] column_is_rowkey:false;[R1] [C3] column_is_signed:true;[R1] [C3] column_encoding:binary;[R1] [C3] column_is_not_null:false;[R1] [C3] column_value_new:[1.23400002E+001](15);[R1] [C4] column_name:C3;[R1] [C4] column_type:MYSQL_TYPE_NEWDECIMAL;[R1] [C4] column_is_rowkey:false;[R1] [C4] column_is_signed:true;[R1] [C4] column_encoding:binary;[R1] [C4] column_is_not_null:false;[R1] [C4] column_value_new:[12.34](5);[R1] [C5] column_name:C4;[R1] [C5] column_type:MYSQL_TYPE_OB_NUMBER_FLOAT;[R1] [C5] column_is_rowkey:false;[R1] [C5] column_is_signed:true;[R1] [C5] column_encoding:binary;[R1] [C5] column_is_not_null:false;[R1] [C5] column_value_new:[12.34](5);[R1] [C6] column_name:C5;[R1] [C6] column_type:MYSQL_TYPE_OB_NUMBER_FLOAT;[R1] [C6] column_is_rowkey:false;[R1] [C6] column_is_signed:true;[R1] [C6] column_encoding:binary;[R1] [C6] column_is_not_null:false;[R1] [C6] column_value_new:[12.34](5);[R1] [C7] column_name:C6;[R1] [C7] column_type:MYSQL_TYPE_VAR_STRING;[R1] [C7] column_is_rowkey:false;[R1] [C7] column_is_signed:true;[R1] [C7] column_encoding:utf8mb4;[R1] [C7] column_is_not_null:false;[R1] [C7] column_value_new:[123456789012.34567890](21);[R1] [C8] column_name:C7;[R1] [C8] column_type:MYSQL_TYPE_STRING;[R1] [C8] column_is_rowkey:false;[R1] [C8] column_is_signed:true;[R1] [C8] column_encoding:utf8mb4;[R1] [C8] column_is_not_null:false;[R1] [C8] column_value_new:[12.34                                                                                               ](100);$[R2] COMMIT;
insert into number_1 (c0, c6) values (49,'12345678901.234567890');
ob1.oblog.next;
[R0] BEGIN;[R0] org_cluster_id:1;[R1] record_type:INSERT;[R1] database_name:oracle.OBLOG_DB;[R1] table_name:NUMBER_1;[R1] log_event:true;[R1] column_count:8;[R1] source_category:SRC_FULL_RECORDED;[R1] source_type:SRC_OCEANBASE_1_0;[R1] has_pk:true;[R1] pk_info:(0);[R1] pks:C0;[R1] has_uk:false;[R1] uk_info:(null);[R1] uks:(null);[R1] [C1] column_name:C0;[R1] [C1] column_type:MYSQL_TYPE_NEWDECIMAL;[R1] [C1] column_is_rowkey:true;[R1] [C1] column_is_signed:true;[R1] [C1] column_encoding:binary;[R1] [C1] column_is_not_null:true;[R1] [C1] column_value_new:[49](2);[R1] [C2] column_name:C1;[R1] [C2] column_type:MYSQL_TYPE_DOUBLE;[R1] [C2] column_is_rowkey:false;[R1] [C2] column_is_signed:true;[R1] [C2] column_encoding:binary;[R1] [C2] column_is_not_null:false;[R1] [C2] column_value_new:[1.234E+001](10);[R1] [C3] column_name:C2;[R1] [C3] column_type:MYSQL_TYPE_FLOAT;[R1] [C3] column_is_rowkey:false;[R1] [C3] column_is_signed:true;[R1] [C3] column_encoding:binary;[R1] [C3] column_is_not_null:false;[R1] [C3] column_value_new:[1.23400002E+001](15);[R1] [C4] column_name:C3;[R1] [C4] column_type:MYSQL_TYPE_NEWDECIMAL;[R1] [C4] column_is_rowkey:false;[R1] [C4] column_is_signed:true;[R1] [C4] column_encoding:binary;[R1] [C4] column_is_not_null:false;[R1] [C4] column_value_new:[12.34](5);[R1] [C5] column_name:C4;[R1] [C5] column_type:MYSQL_TYPE_OB_NUMBER_FLOAT;[R1] [C5] column_is_rowkey:false;[R1] [C5] column_is_signed:true;[R1] [C5] column_encoding:binary;[R1] [C5] column_is_not_null:false;[R1] [C5] column_value_new:[12.34](5);[R1] [C6] column_name:C5;[R1] [C6] column_type:MYSQL_TYPE_OB_NUMBER_FLOAT;[R1] [C6] column_is_rowkey:false;[R1] [C6] column_is_signed:true;[R1] [C6] column_encoding:binary;[R1] [C6] column_is_not_null:false;[R1] [C6] column_value_new:[12.34](5);[R1] [C7] column_name:C6;[R1] [C7] column_type:MYSQL_TYPE_VAR_STRING;[R1] [C7] column_is_rowkey:false;[R1] [C7] column_is_signed:true;[R1] [C7] column_encoding:utf8mb4;[R1] [C7] column_is_not_null:false;[R1] [C7] column_value_new:[12345678901.234567890](21);[R1] [C8] column_name:C7;[R1] [C8] column_type:MYSQL_TYPE_STRING;[R1] [C8] column_is_rowkey:false;[R1] [C8] column_is_signed:true;[R1] [C8] column_encoding:utf8mb4;[R1] [C8] column_is_not_null:false;[R1] [C8] column_value_new:[12.34                                                                                               ](100);$[R2] COMMIT;
insert into number_1 (c0, c6) values (50,'1234567890.1234567890');
ob1.oblog.next;
[R0] BEGIN;[R0] org_cluster_id:1;[R1] record_type:INSERT;[R1] database_name:oracle.OBLOG_DB;[R1] table_name:NUMBER_1;[R1] log_event:true;[R1] column_count:8;[R1] source_category:SRC_FULL_RECORDED;[R1] source_type:SRC_OCEANBASE_1_0;[R1] has_pk:true;[R1] pk_info:(0);[R1] pks:C0;[R1] has_uk:false;[R1] uk_info:(null);[R1] uks:(null);[R1] [C1] column_name:C0;[R1] [C1] column_type:MYSQL_TYPE_NEWDECIMAL;[R1] [C1] column_is_rowkey:true;[R1] [C1] column_is_signed:true;[R1] [C1] column_encoding:binary;[R1] [C1] column_is_not_null:true;[R1] [C1] column_value_new:[50](2);[R1] [C2] column_name:C1;[R1] [C2] column_type:MYSQL_TYPE_DOUBLE;[R1] [C2] column_is_rowkey:false;[R1] [C2] column_is_signed:true;[R1] [C2] column_encoding:binary;[R1] [C2] column_is_not_null:false;[R1] [C2] column_value_new:[1.234E+001](10);[R1] [C3] column_name:C2;[R1] [C3] column_type:MYSQL_TYPE_FLOAT;[R1] [C3] column_is_rowkey:false;[R1] [C3] column_is_signed:true;[R1] [C3] column_encoding:binary;[R1] [C3] column_is_not_null:false;[R1] [C3] column_value_new:[1.23400002E+001](15);[R1] [C4] column_name:C3;[R1] [C4] column_type:MYSQL_TYPE_NEWDECIMAL;[R1] [C4] column_is_rowkey:false;[R1] [C4] column_is_signed:true;[R1] [C4] column_encoding:binary;[R1] [C4] column_is_not_null:false;[R1] [C4] column_value_new:[12.34](5);[R1] [C5] column_name:C4;[R1] [C5] column_type:MYSQL_TYPE_OB_NUMBER_FLOAT;[R1] [C5] column_is_rowkey:false;[R1] [C5] column_is_signed:true;[R1] [C5] column_encoding:binary;[R1] [C5] column_is_not_null:false;[R1] [C5] column_value_new:[12.34](5);[R1] [C6] column_name:C5;[R1] [C6] column_type:MYSQL_TYPE_OB_NUMBER_FLOAT;[R1] [C6] column_is_rowkey:false;[R1] [C6] column_is_signed:true;[R1] [C6] column_encoding:binary;[R1] [C6] column_is_not_null:false;[R1] [C6] column_value_new:[12.34](5);[R1] [C7] column_name:C6;[R1] [C7] column_type:MYSQL_TYPE_VAR_STRING;[R1] [C7] column_is_rowkey:false;[R1] [C7] column_is_signed:true;[R1] [C7] column_encoding:utf8mb4;[R1] [C7] column_is_not_null:false;[R1] [C7] column_value_new:[1234567890.1234567890](21);[R1] [C8] column_name:C7;[R1] [C8] column_type:MYSQL_TYPE_STRING;[R1] [C8] column_is_rowkey:false;[R1] [C8] column_is_signed:true;[R1] [C8] column_encoding:utf8mb4;[R1] [C8] column_is_not_null:false;[R1] [C8] column_value_new:[12.34                                                                                               ](100);$[R2] COMMIT;
insert into number_1 (c0, c6) values (51,'123456789.01234567890');
ob1.oblog.next;
[R0] BEGIN;[R0] org_cluster_id:1;[R1] record_type:INSERT;[R1] database_name:oracle.OBLOG_DB;[R1] table_name:NUMBER_1;[R1] log_event:true;[R1] column_count:8;[R1] source_category:SRC_FULL_RECORDED;[R1] source_type:SRC_OCEANBASE_1_0;[R1] has_pk:true;[R1] pk_info:(0);[R1] pks:C0;[R1] has_uk:false;[R1] uk_info:(null);[R1] uks:(null);[R1] [C1] column_name:C0;[R1] [C1] column_type:MYSQL_TYPE_NEWDECIMAL;[R1] [C1] column_is_rowkey:true;[R1] [C1] column_is_signed:true;[R1] [C1] column_encoding:binary;[R1] [C1] column_is_not_null:true;[R1] [C1] column_value_new:[51](2);[R1] [C2] column_name:C1;[R1] [C2] column_type:MYSQL_TYPE_DOUBLE;[R1] [C2] column_is_rowkey:false;[R1] [C2] column_is_signed:true;[R1] [C2] column_encoding:binary;[R1] [C2] column_is_not_null:false;[R1] [C2] column_value_new:[1.234E+001](10);[R1] [C3] column_name:C2;[R1] [C3] column_type:MYSQL_TYPE_FLOAT;[R1] [C3] column_is_rowkey:false;[R1] [C3] column_is_signed:true;[R1] [C3] column_encoding:binary;[R1] [C3] column_is_not_null:false;[R1] [C3] column_value_new:[1.23400002E+001](15);[R1] [C4] column_name:C3;[R1] [C4] column_type:MYSQL_TYPE_NEWDECIMAL;[R1] [C4] column_is_rowkey:false;[R1] [C4] column_is_signed:true;[R1] [C4] column_encoding:binary;[R1] [C4] column_is_not_null:false;[R1] [C4] column_value_new:[12.34](5);[R1] [C5] column_name:C4;[R1] [C5] column_type:MYSQL_TYPE_OB_NUMBER_FLOAT;[R1] [C5] column_is_rowkey:false;[R1] [C5] column_is_signed:true;[R1] [C5] column_encoding:binary;[R1] [C5] column_is_not_null:false;[R1] [C5] column_value_new:[12.34](5);[R1] [C6] column_name:C5;[R1] [C6] column_type:MYSQL_TYPE_OB_NUMBER_FLOAT;[R1] [C6] column_is_rowkey:false;[R1] [C6] column_is_signed:true;[R1] [C6] column_encoding:binary;[R1] [C6] column_is_not_null:false;[R1] [C6] column_value_new:[12.34](5);[R1] [C7] column_name:C6;[R1] [C7] column_type:MYSQL_TYPE_VAR_STRING;[R1] [C7] column_is_rowkey:false;[R1] [C7] column_is_signed:true;[R1] [C7] column_encoding:utf8mb4;[R1] [C7] column_is_not_null:false;[R1] [C7] column_value_new:[123456789.01234567890](21);[R1] [C8] column_name:C7;[R1] [C8] column_type:MYSQL_TYPE_STRING;[R1] [C8] column_is_rowkey:false;[R1] [C8] column_is_signed:true;[R1] [C8] column_encoding:utf8mb4;[R1] [C8] column_is_not_null:false;[R1] [C8] column_value_new:[12.34                                                                                               ](100);$[R2] COMMIT;
insert into number_1 (c0, c6) values (52,'12345678.901234567890');
ob1.oblog.next;
[R0] BEGIN;[R0] org_cluster_id:1;[R1] record_type:INSERT;[R1] database_name:oracle.OBLOG_DB;[R1] table_name:NUMBER_1;[R1] log_event:true;[R1] column_count:8;[R1] source_category:SRC_FULL_RECORDED;[R1] source_type:SRC_OCEANBASE_1_0;[R1] has_pk:true;[R1] pk_info:(0);[R1] pks:C0;[R1] has_uk:false;[R1] uk_info:(null);[R1] uks:(null);[R1] [C1] column_name:C0;[R1] [C1] column_type:MYSQL_TYPE_NEWDECIMAL;[R1] [C1] column_is_rowkey:true;[R1] [C1] column_is_signed:true;[R1] [C1] column_encoding:binary;[R1] [C1] column_is_not_null:true;[R1] [C1] column_value_new:[52](2);[R1] [C2] column_name:C1;[R1] [C2] column_type:MYSQL_TYPE_DOUBLE;[R1] [C2] column_is_rowkey:false;[R1] [C2] column_is_signed:true;[R1] [C2] column_encoding:binary;[R1] [C2] column_is_not_null:false;[R1] [C2] column_value_new:[1.234E+001](10);[R1] [C3] column_name:C2;[R1] [C3] column_type:MYSQL_TYPE_FLOAT;[R1] [C3] column_is_rowkey:false;[R1] [C3] column_is_signed:true;[R1] [C3] column_encoding:binary;[R1] [C3] column_is_not_null:false;[R1] [C3] column_value_new:[1.23400002E+001](15);[R1] [C4] column_name:C3;[R1] [C4] column_type:MYSQL_TYPE_NEWDECIMAL;[R1] [C4] column_is_rowkey:false;[R1] [C4] column_is_signed:true;[R1] [C4] column_encoding:binary;[R1] [C4] column_is_not_null:false;[R1] [C4] column_value_new:[12.34](5);[R1] [C5] column_name:C4;[R1] [C5] column_type:MYSQL_TYPE_OB_NUMBER_FLOAT;[R1] [C5] column_is_rowkey:false;[R1] [C5] column_is_signed:true;[R1] [C5] column_encoding:binary;[R1] [C5] column_is_not_null:false;[R1] [C5] column_value_new:[12.34](5);[R1] [C6] column_name:C5;[R1] [C6] column_type:MYSQL_TYPE_OB_NUMBER_FLOAT;[R1] [C6] column_is_rowkey:false;[R1] [C6] column_is_signed:true;[R1] [C6] column_encoding:binary;[R1] [C6] column_is_not_null:false;[R1] [C6] column_value_new:[12.34](5);[R1] [C7] column_name:C6;[R1] [C7] column_type:MYSQL_TYPE_VAR_STRING;[R1] [C7] column_is_rowkey:false;[R1] [C7] column_is_signed:true;[R1] [C7] column_encoding:utf8mb4;[R1] [C7] column_is_not_null:false;[R1] [C7] column_value_new:[12345678.901234567890](21);[R1] [C8] column_name:C7;[R1] [C8] column_type:MYSQL_TYPE_STRING;[R1] [C8] column_is_rowkey:false;[R1] [C8] column_is_signed:true;[R1] [C8] column_encoding:utf8mb4;[R1] [C8] column_is_not_null:false;[R1] [C8] column_value_new:[12.34                                                                                               ](100);$[R2] COMMIT;
insert into number_1 (c0, c6) values (53,'1234567.8901234567890');
ob1.oblog.next;
[R0] BEGIN;[R0] org_cluster_id:1;[R1] record_type:INSERT;[R1] database_name:oracle.OBLOG_DB;[R1] table_name:NUMBER_1;[R1] log_event:true;[R1] column_count:8;[R1] source_category:SRC_FULL_RECORDED;[R1] source_type:SRC_OCEANBASE_1_0;[R1] has_pk:true;[R1] pk_info:(0);[R1] pks:C0;[R1] has_uk:false;[R1] uk_info:(null);[R1] uks:(null);[R1] [C1] column_name:C0;[R1] [C1] column_type:MYSQL_TYPE_NEWDECIMAL;[R1] [C1] column_is_rowkey:true;[R1] [C1] column_is_signed:true;[R1] [C1] column_encoding:binary;[R1] [C1] column_is_not_null:true;[R1] [C1] column_value_new:[53](2);[R1] [C2] column_name:C1;[R1] [C2] column_type:MYSQL_TYPE_DOUBLE;[R1] [C2] column_is_rowkey:false;[R1] [C2] column_is_signed:true;[R1] [C2] column_encoding:binary;[R1] [C2] column_is_not_null:false;[R1] [C2] column_value_new:[1.234E+001](10);[R1] [C3] column_name:C2;[R1] [C3] column_type:MYSQL_TYPE_FLOAT;[R1] [C3] column_is_rowkey:false;[R1] [C3] column_is_signed:true;[R1] [C3] column_encoding:binary;[R1] [C3] column_is_not_null:false;[R1] [C3] column_value_new:[1.23400002E+001](15);[R1] [C4] column_name:C3;[R1] [C4] column_type:MYSQL_TYPE_NEWDECIMAL;[R1] [C4] column_is_rowkey:false;[R1] [C4] column_is_signed:true;[R1] [C4] column_encoding:binary;[R1] [C4] column_is_not_null:false;[R1] [C4] column_value_new:[12.34](5);[R1] [C5] column_name:C4;[R1] [C5] column_type:MYSQL_TYPE_OB_NUMBER_FLOAT;[R1] [C5] column_is_rowkey:false;[R1] [C5] column_is_signed:true;[R1] [C5] column_encoding:binary;[R1] [C5] column_is_not_null:false;[R1] [C5] column_value_new:[12.34](5);[R1] [C6] column_name:C5;[R1] [C6] column_type:MYSQL_TYPE_OB_NUMBER_FLOAT;[R1] [C6] column_is_rowkey:false;[R1] [C6] column_is_signed:true;[R1] [C6] column_encoding:binary;[R1] [C6] column_is_not_null:false;[R1] [C6] column_value_new:[12.34](5);[R1] [C7] column_name:C6;[R1] [C7] column_type:MYSQL_TYPE_VAR_STRING;[R1] [C7] column_is_rowkey:false;[R1] [C7] column_is_signed:true;[R1] [C7] column_encoding:utf8mb4;[R1] [C7] column_is_not_null:false;[R1] [C7] column_value_new:[1234567.8901234567890](21);[R1] [C8] column_name:C7;[R1] [C8] column_type:MYSQL_TYPE_STRING;[R1] [C8] column_is_rowkey:false;[R1] [C8] column_is_signed:true;[R1] [C8] column_encoding:utf8mb4;[R1] [C8] column_is_not_null:false;[R1] [C8] column_value_new:[12.34                                                                                               ](100);$[R2] COMMIT;
insert into number_1 (c0, c6) values (54,'123456.78901234567890');
ob1.oblog.next;
[R0] BEGIN;[R0] org_cluster_id:1;[R1] record_type:INSERT;[R1] database_name:oracle.OBLOG_DB;[R1] table_name:NUMBER_1;[R1] log_event:true;[R1] column_count:8;[R1] source_category:SRC_FULL_RECORDED;[R1] source_type:SRC_OCEANBASE_1_0;[R1] has_pk:true;[R1] pk_info:(0);[R1] pks:C0;[R1] has_uk:false;[R1] uk_info:(null);[R1] uks:(null);[R1] [C1] column_name:C0;[R1] [C1] column_type:MYSQL_TYPE_NEWDECIMAL;[R1] [C1] column_is_rowkey:true;[R1] [C1] column_is_signed:true;[R1] [C1] column_encoding:binary;[R1] [C1] column_is_not_null:true;[R1] [C1] column_value_new:[54](2);[R1] [C2] column_name:C1;[R1] [C2] column_type:MYSQL_TYPE_DOUBLE;[R1] [C2] column_is_rowkey:false;[R1] [C2] column_is_signed:true;[R1] [C2] column_encoding:binary;[R1] [C2] column_is_not_null:false;[R1] [C2] column_value_new:[1.234E+001](10);[R1] [C3] column_name:C2;[R1] [C3] column_type:MYSQL_TYPE_FLOAT;[R1] [C3] column_is_rowkey:false;[R1] [C3] column_is_signed:true;[R1] [C3] column_encoding:binary;[R1] [C3] column_is_not_null:false;[R1] [C3] column_value_new:[1.23400002E+001](15);[R1] [C4] column_name:C3;[R1] [C4] column_type:MYSQL_TYPE_NEWDECIMAL;[R1] [C4] column_is_rowkey:false;[R1] [C4] column_is_signed:true;[R1] [C4] column_encoding:binary;[R1] [C4] column_is_not_null:false;[R1] [C4] column_value_new:[12.34](5);[R1] [C5] column_name:C4;[R1] [C5] column_type:MYSQL_TYPE_OB_NUMBER_FLOAT;[R1] [C5] column_is_rowkey:false;[R1] [C5] column_is_signed:true;[R1] [C5] column_encoding:binary;[R1] [C5] column_is_not_null:false;[R1] [C5] column_value_new:[12.34](5);[R1] [C6] column_name:C5;[R1] [C6] column_type:MYSQL_TYPE_OB_NUMBER_FLOAT;[R1] [C6] column_is_rowkey:false;[R1] [C6] column_is_signed:true;[R1] [C6] column_encoding:binary;[R1] [C6] column_is_not_null:false;[R1] [C6] column_value_new:[12.34](5);[R1] [C7] column_name:C6;[R1] [C7] column_type:MYSQL_TYPE_VAR_STRING;[R1] [C7] column_is_rowkey:false;[R1] [C7] column_is_signed:true;[R1] [C7] column_encoding:utf8mb4;[R1] [C7] column_is_not_null:false;[R1] [C7] column_value_new:[123456.78901234567890](21);[R1] [C8] column_name:C7;[R1] [C8] column_type:MYSQL_TYPE_STRING;[R1] [C8] column_is_rowkey:false;[R1] [C8] column_is_signed:true;[R1] [C8] column_encoding:utf8mb4;[R1] [C8] column_is_not_null:false;[R1] [C8] column_value_new:[12.34                                                                                               ](100);$[R2] COMMIT;
insert into number_1 (c0, c6) values (55,'12345.678901234567890');
ob1.oblog.next;
[R0] BEGIN;[R0] org_cluster_id:1;[R1] record_type:INSERT;[R1] database_name:oracle.OBLOG_DB;[R1] table_name:NUMBER_1;[R1] log_event:true;[R1] column_count:8;[R1] source_category:SRC_FULL_RECORDED;[R1] source_type:SRC_OCEANBASE_1_0;[R1] has_pk:true;[R1] pk_info:(0);[R1] pks:C0;[R1] has_uk:false;[R1] uk_info:(null);[R1] uks:(null);[R1] [C1] column_name:C0;[R1] [C1] column_type:MYSQL_TYPE_NEWDECIMAL;[R1] [C1] column_is_rowkey:true;[R1] [C1] column_is_signed:true;[R1] [C1] column_encoding:binary;[R1] [C1] column_is_not_null:true;[R1] [C1] column_value_new:[55](2);[R1] [C2] column_name:C1;[R1] [C2] column_type:MYSQL_TYPE_DOUBLE;[R1] [C2] column_is_rowkey:false;[R1] [C2] column_is_signed:true;[R1] [C2] column_encoding:binary;[R1] [C2] column_is_not_null:false;[R1] [C2] column_value_new:[1.234E+001](10);[R1] [C3] column_name:C2;[R1] [C3] column_type:MYSQL_TYPE_FLOAT;[R1] [C3] column_is_rowkey:false;[R1] [C3] column_is_signed:true;[R1] [C3] column_encoding:binary;[R1] [C3] column_is_not_null:false;[R1] [C3] column_value_new:[1.23400002E+001](15);[R1] [C4] column_name:C3;[R1] [C4] column_type:MYSQL_TYPE_NEWDECIMAL;[R1] [C4] column_is_rowkey:false;[R1] [C4] column_is_signed:true;[R1] [C4] column_encoding:binary;[R1] [C4] column_is_not_null:false;[R1] [C4] column_value_new:[12.34](5);[R1] [C5] column_name:C4;[R1] [C5] column_type:MYSQL_TYPE_OB_NUMBER_FLOAT;[R1] [C5] column_is_rowkey:false;[R1] [C5] column_is_signed:true;[R1] [C5] column_encoding:binary;[R1] [C5] column_is_not_null:false;[R1] [C5] column_value_new:[12.34](5);[R1] [C6] column_name:C5;[R1] [C6] column_type:MYSQL_TYPE_OB_NUMBER_FLOAT;[R1] [C6] column_is_rowkey:false;[R1] [C6] column_is_signed:true;[R1] [C6] column_encoding:binary;[R1] [C6] column_is_not_null:false;[R1] [C6] column_value_new:[12.34](5);[R1] [C7] column_name:C6;[R1] [C7] column_type:MYSQL_TYPE_VAR_STRING;[R1] [C7] column_is_rowkey:false;[R1] [C7] column_is_signed:true;[R1] [C7] column_encoding:utf8mb4;[R1] [C7] column_is_not_null:false;[R1] [C7] column_value_new:[12345.678901234567890](21);[R1] [C8] column_name:C7;[R1] [C8] column_type:MYSQL_TYPE_STRING;[R1] [C8] column_is_rowkey:false;[R1] [C8] column_is_signed:true;[R1] [C8] column_encoding:utf8mb4;[R1] [C8] column_is_not_null:false;[R1] [C8] column_value_new:[12.34                                                                                               ](100);$[R2] COMMIT;
insert into number_1 (c0, c6) values (56,'1234.5678901234567890');
ob1.oblog.next;
[R0] BEGIN;[R0] org_cluster_id:1;[R1] record_type:INSERT;[R1] database_name:oracle.OBLOG_DB;[R1] table_name:NUMBER_1;[R1] log_event:true;[R1] column_count:8;[R1] source_category:SRC_FULL_RECORDED;[R1] source_type:SRC_OCEANBASE_1_0;[R1] has_pk:true;[R1] pk_info:(0);[R1] pks:C0;[R1] has_uk:false;[R1] uk_info:(null);[R1] uks:(null);[R1] [C1] column_name:C0;[R1] [C1] column_type:MYSQL_TYPE_NEWDECIMAL;[R1] [C1] column_is_rowkey:true;[R1] [C1] column_is_signed:true;[R1] [C1] column_encoding:binary;[R1] [C1] column_is_not_null:true;[R1] [C1] column_value_new:[56](2);[R1] [C2] column_name:C1;[R1] [C2] column_type:MYSQL_TYPE_DOUBLE;[R1] [C2] column_is_rowkey:false;[R1] [C2] column_is_signed:true;[R1] [C2] column_encoding:binary;[R1] [C2] column_is_not_null:false;[R1] [C2] column_value_new:[1.234E+001](10);[R1] [C3] column_name:C2;[R1] [C3] column_type:MYSQL_TYPE_FLOAT;[R1] [C3] column_is_rowkey:false;[R1] [C3] column_is_signed:true;[R1] [C3] column_encoding:binary;[R1] [C3] column_is_not_null:false;[R1] [C3] column_value_new:[1.23400002E+001](15);[R1] [C4] column_name:C3;[R1] [C4] column_type:MYSQL_TYPE_NEWDECIMAL;[R1] [C4] column_is_rowkey:false;[R1] [C4] column_is_signed:true;[R1] [C4] column_encoding:binary;[R1] [C4] column_is_not_null:false;[R1] [C4] column_value_new:[12.34](5);[R1] [C5] column_name:C4;[R1] [C5] column_type:MYSQL_TYPE_OB_NUMBER_FLOAT;[R1] [C5] column_is_rowkey:false;[R1] [C5] column_is_signed:true;[R1] [C5] column_encoding:binary;[R1] [C5] column_is_not_null:false;[R1] [C5] column_value_new:[12.34](5);[R1] [C6] column_name:C5;[R1] [C6] column_type:MYSQL_TYPE_OB_NUMBER_FLOAT;[R1] [C6] column_is_rowkey:false;[R1] [C6] column_is_signed:true;[R1] [C6] column_encoding:binary;[R1] [C6] column_is_not_null:false;[R1] [C6] column_value_new:[12.34](5);[R1] [C7] column_name:C6;[R1] [C7] column_type:MYSQL_TYPE_VAR_STRING;[R1] [C7] column_is_rowkey:false;[R1] [C7] column_is_signed:true;[R1] [C7] column_encoding:utf8mb4;[R1] [C7] column_is_not_null:false;[R1] [C7] column_value_new:[1234.5678901234567890](21);[R1] [C8] column_name:C7;[R1] [C8] column_type:MYSQL_TYPE_STRING;[R1] [C8] column_is_rowkey:false;[R1] [C8] column_is_signed:true;[R1] [C8] column_encoding:utf8mb4;[R1] [C8] column_is_not_null:false;[R1] [C8] column_value_new:[12.34                                                                                               ](100);$[R2] COMMIT;
insert into number_1 (c0, c6) values (57,'123.45678901234567890');
ob1.oblog.next;
[R0] BEGIN;[R0] org_cluster_id:1;[R1] record_type:INSERT;[R1] database_name:oracle.OBLOG_DB;[R1] table_name:NUMBER_1;[R1] log_event:true;[R1] column_count:8;[R1] source_category:SRC_FULL_RECORDED;[R1] source_type:SRC_OCEANBASE_1_0;[R1] has_pk:true;[R1] pk_info:(0);[R1] pks:C0;[R1] has_uk:false;[R1] uk_info:(null);[R1] uks:(null);[R1] [C1] column_name:C0;[R1] [C1] column_type:MYSQL_TYPE_NEWDECIMAL;[R1] [C1] column_is_rowkey:true;[R1] [C1] column_is_signed:true;[R1] [C1] column_encoding:binary;[R1] [C1] column_is_not_null:true;[R1] [C1] column_value_new:[57](2);[R1] [C2] column_name:C1;[R1] [C2] column_type:MYSQL_TYPE_DOUBLE;[R1] [C2] column_is_rowkey:false;[R1] [C2] column_is_signed:true;[R1] [C2] column_encoding:binary;[R1] [C2] column_is_not_null:false;[R1] [C2] column_value_new:[1.234E+001](10);[R1] [C3] column_name:C2;[R1] [C3] column_type:MYSQL_TYPE_FLOAT;[R1] [C3] column_is_rowkey:false;[R1] [C3] column_is_signed:true;[R1] [C3] column_encoding:binary;[R1] [C3] column_is_not_null:false;[R1] [C3] column_value_new:[1.23400002E+001](15);[R1] [C4] column_name:C3;[R1] [C4] column_type:MYSQL_TYPE_NEWDECIMAL;[R1] [C4] column_is_rowkey:false;[R1] [C4] column_is_signed:true;[R1] [C4] column_encoding:binary;[R1] [C4] column_is_not_null:false;[R1] [C4] column_value_new:[12.34](5);[R1] [C5] column_name:C4;[R1] [C5] column_type:MYSQL_TYPE_OB_NUMBER_FLOAT;[R1] [C5] column_is_rowkey:false;[R1] [C5] column_is_signed:true;[R1] [C5] column_encoding:binary;[R1] [C5] column_is_not_null:false;[R1] [C5] column_value_new:[12.34](5);[R1] [C6] column_name:C5;[R1] [C6] column_type:MYSQL_TYPE_OB_NUMBER_FLOAT;[R1] [C6] column_is_rowkey:false;[R1] [C6] column_is_signed:true;[R1] [C6] column_encoding:binary;[R1] [C6] column_is_not_null:false;[R1] [C6] column_value_new:[12.34](5);[R1] [C7] column_name:C6;[R1] [C7] column_type:MYSQL_TYPE_VAR_STRING;[R1] [C7] column_is_rowkey:false;[R1] [C7] column_is_signed:true;[R1] [C7] column_encoding:utf8mb4;[R1] [C7] column_is_not_null:false;[R1] [C7] column_value_new:[123.45678901234567890](21);[R1] [C8] column_name:C7;[R1] [C8] column_type:MYSQL_TYPE_STRING;[R1] [C8] column_is_rowkey:false;[R1] [C8] column_is_signed:true;[R1] [C8] column_encoding:utf8mb4;[R1] [C8] column_is_not_null:false;[R1] [C8] column_value_new:[12.34                                                                                               ](100);$[R2] COMMIT;
insert into number_1 (c0, c6) values (58,'12.345678901234567890');
ob1.oblog.next;
[R0] BEGIN;[R0] org_cluster_id:1;[R1] record_type:INSERT;[R1] database_name:oracle.OBLOG_DB;[R1] table_name:NUMBER_1;[R1] log_event:true;[R1] column_count:8;[R1] source_category:SRC_FULL_RECORDED;[R1] source_type:SRC_OCEANBASE_1_0;[R1] has_pk:true;[R1] pk_info:(0);[R1] pks:C0;[R1] has_uk:false;[R1] uk_info:(null);[R1] uks:(null);[R1] [C1] column_name:C0;[R1] [C1] column_type:MYSQL_TYPE_NEWDECIMAL;[R1] [C1] column_is_rowkey:true;[R1] [C1] column_is_signed:true;[R1] [C1] column_encoding:binary;[R1] [C1] column_is_not_null:true;[R1] [C1] column_value_new:[58](2);[R1] [C2] column_name:C1;[R1] [C2] column_type:MYSQL_TYPE_DOUBLE;[R1] [C2] column_is_rowkey:false;[R1] [C2] column_is_signed:true;[R1] [C2] column_encoding:binary;[R1] [C2] column_is_not_null:false;[R1] [C2] column_value_new:[1.234E+001](10);[R1] [C3] column_name:C2;[R1] [C3] column_type:MYSQL_TYPE_FLOAT;[R1] [C3] column_is_rowkey:false;[R1] [C3] column_is_signed:true;[R1] [C3] column_encoding:binary;[R1] [C3] column_is_not_null:false;[R1] [C3] column_value_new:[1.23400002E+001](15);[R1] [C4] column_name:C3;[R1] [C4] column_type:MYSQL_TYPE_NEWDECIMAL;[R1] [C4] column_is_rowkey:false;[R1] [C4] column_is_signed:true;[R1] [C4] column_encoding:binary;[R1] [C4] column_is_not_null:false;[R1] [C4] column_value_new:[12.34](5);[R1] [C5] column_name:C4;[R1] [C5] column_type:MYSQL_TYPE_OB_NUMBER_FLOAT;[R1] [C5] column_is_rowkey:false;[R1] [C5] column_is_signed:true;[R1] [C5] column_encoding:binary;[R1] [C5] column_is_not_null:false;[R1] [C5] column_value_new:[12.34](5);[R1] [C6] column_name:C5;[R1] [C6] column_type:MYSQL_TYPE_OB_NUMBER_FLOAT;[R1] [C6] column_is_rowkey:false;[R1] [C6] column_is_signed:true;[R1] [C6] column_encoding:binary;[R1] [C6] column_is_not_null:false;[R1] [C6] column_value_new:[12.34](5);[R1] [C7] column_name:C6;[R1] [C7] column_type:MYSQL_TYPE_VAR_STRING;[R1] [C7] column_is_rowkey:false;[R1] [C7] column_is_signed:true;[R1] [C7] column_encoding:utf8mb4;[R1] [C7] column_is_not_null:false;[R1] [C7] column_value_new:[12.345678901234567890](21);[R1] [C8] column_name:C7;[R1] [C8] column_type:MYSQL_TYPE_STRING;[R1] [C8] column_is_rowkey:false;[R1] [C8] column_is_signed:true;[R1] [C8] column_encoding:utf8mb4;[R1] [C8] column_is_not_null:false;[R1] [C8] column_value_new:[12.34                                                                                               ](100);$[R2] COMMIT;
insert into number_1 (c0, c6) values (59,'1.2345678901234567890');
ob1.oblog.next;
[R0] BEGIN;[R0] org_cluster_id:1;[R1] record_type:INSERT;[R1] database_name:oracle.OBLOG_DB;[R1] table_name:NUMBER_1;[R1] log_event:true;[R1] column_count:8;[R1] source_category:SRC_FULL_RECORDED;[R1] source_type:SRC_OCEANBASE_1_0;[R1] has_pk:true;[R1] pk_info:(0);[R1] pks:C0;[R1] has_uk:false;[R1] uk_info:(null);[R1] uks:(null);[R1] [C1] column_name:C0;[R1] [C1] column_type:MYSQL_TYPE_NEWDECIMAL;[R1] [C1] column_is_rowkey:true;[R1] [C1] column_is_signed:true;[R1] [C1] column_encoding:binary;[R1] [C1] column_is_not_null:true;[R1] [C1] column_value_new:[59](2);[R1] [C2] column_name:C1;[R1] [C2] column_type:MYSQL_TYPE_DOUBLE;[R1] [C2] column_is_rowkey:false;[R1] [C2] column_is_signed:true;[R1] [C2] column_encoding:binary;[R1] [C2] column_is_not_null:false;[R1] [C2] column_value_new:[1.234E+001](10);[R1] [C3] column_name:C2;[R1] [C3] column_type:MYSQL_TYPE_FLOAT;[R1] [C3] column_is_rowkey:false;[R1] [C3] column_is_signed:true;[R1] [C3] column_encoding:binary;[R1] [C3] column_is_not_null:false;[R1] [C3] column_value_new:[1.23400002E+001](15);[R1] [C4] column_name:C3;[R1] [C4] column_type:MYSQL_TYPE_NEWDECIMAL;[R1] [C4] column_is_rowkey:false;[R1] [C4] column_is_signed:true;[R1] [C4] column_encoding:binary;[R1] [C4] column_is_not_null:false;[R1] [C4] column_value_new:[12.34](5);[R1] [C5] column_name:C4;[R1] [C5] column_type:MYSQL_TYPE_OB_NUMBER_FLOAT;[R1] [C5] column_is_rowkey:false;[R1] [C5] column_is_signed:true;[R1] [C5] column_encoding:binary;[R1] [C5] column_is_not_null:false;[R1] [C5] column_value_new:[12.34](5);[R1] [C6] column_name:C5;[R1] [C6] column_type:MYSQL_TYPE_OB_NUMBER_FLOAT;[R1] [C6] column_is_rowkey:false;[R1] [C6] column_is_signed:true;[R1] [C6] column_encoding:binary;[R1] [C6] column_is_not_null:false;[R1] [C6] column_value_new:[12.34](5);[R1] [C7] column_name:C6;[R1] [C7] column_type:MYSQL_TYPE_VAR_STRING;[R1] [C7] column_is_rowkey:false;[R1] [C7] column_is_signed:true;[R1] [C7] column_encoding:utf8mb4;[R1] [C7] column_is_not_null:false;[R1] [C7] column_value_new:[1.2345678901234567890](21);[R1] [C8] column_name:C7;[R1] [C8] column_type:MYSQL_TYPE_STRING;[R1] [C8] column_is_rowkey:false;[R1] [C8] column_is_signed:true;[R1] [C8] column_encoding:utf8mb4;[R1] [C8] column_is_not_null:false;[R1] [C8] column_value_new:[12.34                                                                                               ](100);$[R2] COMMIT;
insert into number_1 (c0, c6) values (60,'0.1234567890123456789');
ob1.oblog.next;
[R0] BEGIN;[R0] org_cluster_id:1;[R1] record_type:INSERT;[R1] database_name:oracle.OBLOG_DB;[R1] table_name:NUMBER_1;[R1] log_event:true;[R1] column_count:8;[R1] source_category:SRC_FULL_RECORDED;[R1] source_type:SRC_OCEANBASE_1_0;[R1] has_pk:true;[R1] pk_info:(0);[R1] pks:C0;[R1] has_uk:false;[R1] uk_info:(null);[R1] uks:(null);[R1] [C1] column_name:C0;[R1] [C1] column_type:MYSQL_TYPE_NEWDECIMAL;[R1] [C1] column_is_rowkey:true;[R1] [C1] column_is_signed:true;[R1] [C1] column_encoding:binary;[R1] [C1] column_is_not_null:true;[R1] [C1] column_value_new:[60](2);[R1] [C2] column_name:C1;[R1] [C2] column_type:MYSQL_TYPE_DOUBLE;[R1] [C2] column_is_rowkey:false;[R1] [C2] column_is_signed:true;[R1] [C2] column_encoding:binary;[R1] [C2] column_is_not_null:false;[R1] [C2] column_value_new:[1.234E+001](10);[R1] [C3] column_name:C2;[R1] [C3] column_type:MYSQL_TYPE_FLOAT;[R1] [C3] column_is_rowkey:false;[R1] [C3] column_is_signed:true;[R1] [C3] column_encoding:binary;[R1] [C3] column_is_not_null:false;[R1] [C3] column_value_new:[1.23400002E+001](15);[R1] [C4] column_name:C3;[R1] [C4] column_type:MYSQL_TYPE_NEWDECIMAL;[R1] [C4] column_is_rowkey:false;[R1] [C4] column_is_signed:true;[R1] [C4] column_encoding:binary;[R1] [C4] column_is_not_null:false;[R1] [C4] column_value_new:[12.34](5);[R1] [C5] column_name:C4;[R1] [C5] column_type:MYSQL_TYPE_OB_NUMBER_FLOAT;[R1] [C5] column_is_rowkey:false;[R1] [C5] column_is_signed:true;[R1] [C5] column_encoding:binary;[R1] [C5] column_is_not_null:false;[R1] [C5] column_value_new:[12.34](5);[R1] [C6] column_name:C5;[R1] [C6] column_type:MYSQL_TYPE_OB_NUMBER_FLOAT;[R1] [C6] column_is_rowkey:false;[R1] [C6] column_is_signed:true;[R1] [C6] column_encoding:binary;[R1] [C6] column_is_not_null:false;[R1] [C6] column_value_new:[12.34](5);[R1] [C7] column_name:C6;[R1] [C7] column_type:MYSQL_TYPE_VAR_STRING;[R1] [C7] column_is_rowkey:false;[R1] [C7] column_is_signed:true;[R1] [C7] column_encoding:utf8mb4;[R1] [C7] column_is_not_null:false;[R1] [C7] column_value_new:[0.1234567890123456789](21);[R1] [C8] column_name:C7;[R1] [C8] column_type:MYSQL_TYPE_STRING;[R1] [C8] column_is_rowkey:false;[R1] [C8] column_is_signed:true;[R1] [C8] column_encoding:utf8mb4;[R1] [C8] column_is_not_null:false;[R1] [C8] column_value_new:[12.34                                                                                               ](100);$[R2] COMMIT;
insert into number_1 (c0, c6) values (61,'0.1234567890123456789');
ob1.oblog.next;
[R0] BEGIN;[R0] org_cluster_id:1;[R1] record_type:INSERT;[R1] database_name:oracle.OBLOG_DB;[R1] table_name:NUMBER_1;[R1] log_event:true;[R1] column_count:8;[R1] source_category:SRC_FULL_RECORDED;[R1] source_type:SRC_OCEANBASE_1_0;[R1] has_pk:true;[R1] pk_info:(0);[R1] pks:C0;[R1] has_uk:false;[R1] uk_info:(null);[R1] uks:(null);[R1] [C1] column_name:C0;[R1] [C1] column_type:MYSQL_TYPE_NEWDECIMAL;[R1] [C1] column_is_rowkey:true;[R1] [C1] column_is_signed:true;[R1] [C1] column_encoding:binary;[R1] [C1] column_is_not_null:true;[R1] [C1] column_value_new:[61](2);[R1] [C2] column_name:C1;[R1] [C2] column_type:MYSQL_TYPE_DOUBLE;[R1] [C2] column_is_rowkey:false;[R1] [C2] column_is_signed:true;[R1] [C2] column_encoding:binary;[R1] [C2] column_is_not_null:false;[R1] [C2] column_value_new:[1.234E+001](10);[R1] [C3] column_name:C2;[R1] [C3] column_type:MYSQL_TYPE_FLOAT;[R1] [C3] column_is_rowkey:false;[R1] [C3] column_is_signed:true;[R1] [C3] column_encoding:binary;[R1] [C3] column_is_not_null:false;[R1] [C3] column_value_new:[1.23400002E+001](15);[R1] [C4] column_name:C3;[R1] [C4] column_type:MYSQL_TYPE_NEWDECIMAL;[R1] [C4] column_is_rowkey:false;[R1] [C4] column_is_signed:true;[R1] [C4] column_encoding:binary;[R1] [C4] column_is_not_null:false;[R1] [C4] column_value_new:[12.34](5);[R1] [C5] column_name:C4;[R1] [C5] column_type:MYSQL_TYPE_OB_NUMBER_FLOAT;[R1] [C5] column_is_rowkey:false;[R1] [C5] column_is_signed:true;[R1] [C5] column_encoding:binary;[R1] [C5] column_is_not_null:false;[R1] [C5] column_value_new:[12.34](5);[R1] [C6] column_name:C5;[R1] [C6] column_type:MYSQL_TYPE_OB_NUMBER_FLOAT;[R1] [C6] column_is_rowkey:false;[R1] [C6] column_is_signed:true;[R1] [C6] column_encoding:binary;[R1] [C6] column_is_not_null:false;[R1] [C6] column_value_new:[12.34](5);[R1] [C7] column_name:C6;[R1] [C7] column_type:MYSQL_TYPE_VAR_STRING;[R1] [C7] column_is_rowkey:false;[R1] [C7] column_is_signed:true;[R1] [C7] column_encoding:utf8mb4;[R1] [C7] column_is_not_null:false;[R1] [C7] column_value_new:[0.1234567890123456789](21);[R1] [C8] column_name:C7;[R1] [C8] column_type:MYSQL_TYPE_STRING;[R1] [C8] column_is_rowkey:false;[R1] [C8] column_is_signed:true;[R1] [C8] column_encoding:utf8mb4;[R1] [C8] column_is_not_null:false;[R1] [C8] column_value_new:[12.34                                                                                               ](100);$[R2] COMMIT;
insert into number_1 (c0, c6) values (62,'0.123456789012345678');
ob1.oblog.next;
[R0] BEGIN;[R0] org_cluster_id:1;[R1] record_type:INSERT;[R1] database_name:oracle.OBLOG_DB;[R1] table_name:NUMBER_1;[R1] log_event:true;[R1] column_count:8;[R1] source_category:SRC_FULL_RECORDED;[R1] source_type:SRC_OCEANBASE_1_0;[R1] has_pk:true;[R1] pk_info:(0);[R1] pks:C0;[R1] has_uk:false;[R1] uk_info:(null);[R1] uks:(null);[R1] [C1] column_name:C0;[R1] [C1] column_type:MYSQL_TYPE_NEWDECIMAL;[R1] [C1] column_is_rowkey:true;[R1] [C1] column_is_signed:true;[R1] [C1] column_encoding:binary;[R1] [C1] column_is_not_null:true;[R1] [C1] column_value_new:[62](2);[R1] [C2] column_name:C1;[R1] [C2] column_type:MYSQL_TYPE_DOUBLE;[R1] [C2] column_is_rowkey:false;[R1] [C2] column_is_signed:true;[R1] [C2] column_encoding:binary;[R1] [C2] column_is_not_null:false;[R1] [C2] column_value_new:[1.234E+001](10);[R1] [C3] column_name:C2;[R1] [C3] column_type:MYSQL_TYPE_FLOAT;[R1] [C3] column_is_rowkey:false;[R1] [C3] column_is_signed:true;[R1] [C3] column_encoding:binary;[R1] [C3] column_is_not_null:false;[R1] [C3] column_value_new:[1.23400002E+001](15);[R1] [C4] column_name:C3;[R1] [C4] column_type:MYSQL_TYPE_NEWDECIMAL;[R1] [C4] column_is_rowkey:false;[R1] [C4] column_is_signed:true;[R1] [C4] column_encoding:binary;[R1] [C4] column_is_not_null:false;[R1] [C4] column_value_new:[12.34](5);[R1] [C5] column_name:C4;[R1] [C5] column_type:MYSQL_TYPE_OB_NUMBER_FLOAT;[R1] [C5] column_is_rowkey:false;[R1] [C5] column_is_signed:true;[R1] [C5] column_encoding:binary;[R1] [C5] column_is_not_null:false;[R1] [C5] column_value_new:[12.34](5);[R1] [C6] column_name:C5;[R1] [C6] column_type:MYSQL_TYPE_OB_NUMBER_FLOAT;[R1] [C6] column_is_rowkey:false;[R1] [C6] column_is_signed:true;[R1] [C6] column_encoding:binary;[R1] [C6] column_is_not_null:false;[R1] [C6] column_value_new:[12.34](5);[R1] [C7] column_name:C6;[R1] [C7] column_type:MYSQL_TYPE_VAR_STRING;[R1] [C7] column_is_rowkey:false;[R1] [C7] column_is_signed:true;[R1] [C7] column_encoding:utf8mb4;[R1] [C7] column_is_not_null:false;[R1] [C7] column_value_new:[0.123456789012345678](20);[R1] [C8] column_name:C7;[R1] [C8] column_type:MYSQL_TYPE_STRING;[R1] [C8] column_is_rowkey:false;[R1] [C8] column_is_signed:true;[R1] [C8] column_encoding:utf8mb4;[R1] [C8] column_is_not_null:false;[R1] [C8] column_value_new:[12.34                                                                                               ](100);$[R2] COMMIT;
insert into number_1 (c0, c6) values (63,'0.12345678901234567');
ob1.oblog.next;
[R0] BEGIN;[R0] org_cluster_id:1;[R1] record_type:INSERT;[R1] database_name:oracle.OBLOG_DB;[R1] table_name:NUMBER_1;[R1] log_event:true;[R1] column_count:8;[R1] source_category:SRC_FULL_RECORDED;[R1] source_type:SRC_OCEANBASE_1_0;[R1] has_pk:true;[R1] pk_info:(0);[R1] pks:C0;[R1] has_uk:false;[R1] uk_info:(null);[R1] uks:(null);[R1] [C1] column_name:C0;[R1] [C1] column_type:MYSQL_TYPE_NEWDECIMAL;[R1] [C1] column_is_rowkey:true;[R1] [C1] column_is_signed:true;[R1] [C1] column_encoding:binary;[R1] [C1] column_is_not_null:true;[R1] [C1] column_value_new:[63](2);[R1] [C2] column_name:C1;[R1] [C2] column_type:MYSQL_TYPE_DOUBLE;[R1] [C2] column_is_rowkey:false;[R1] [C2] column_is_signed:true;[R1] [C2] column_encoding:binary;[R1] [C2] column_is_not_null:false;[R1] [C2] column_value_new:[1.234E+001](10);[R1] [C3] column_name:C2;[R1] [C3] column_type:MYSQL_TYPE_FLOAT;[R1] [C3] column_is_rowkey:false;[R1] [C3] column_is_signed:true;[R1] [C3] column_encoding:binary;[R1] [C3] column_is_not_null:false;[R1] [C3] column_value_new:[1.23400002E+001](15);[R1] [C4] column_name:C3;[R1] [C4] column_type:MYSQL_TYPE_NEWDECIMAL;[R1] [C4] column_is_rowkey:false;[R1] [C4] column_is_signed:true;[R1] [C4] column_encoding:binary;[R1] [C4] column_is_not_null:false;[R1] [C4] column_value_new:[12.34](5);[R1] [C5] column_name:C4;[R1] [C5] column_type:MYSQL_TYPE_OB_NUMBER_FLOAT;[R1] [C5] column_is_rowkey:false;[R1] [C5] column_is_signed:true;[R1] [C5] column_encoding:binary;[R1] [C5] column_is_not_null:false;[R1] [C5] column_value_new:[12.34](5);[R1] [C6] column_name:C5;[R1] [C6] column_type:MYSQL_TYPE_OB_NUMBER_FLOAT;[R1] [C6] column_is_rowkey:false;[R1] [C6] column_is_signed:true;[R1] [C6] column_encoding:binary;[R1] [C6] column_is_not_null:false;[R1] [C6] column_value_new:[12.34](5);[R1] [C7] column_name:C6;[R1] [C7] column_type:MYSQL_TYPE_VAR_STRING;[R1] [C7] column_is_rowkey:false;[R1] [C7] column_is_signed:true;[R1] [C7] column_encoding:utf8mb4;[R1] [C7] column_is_not_null:false;[R1] [C7] column_value_new:[0.12345678901234567](19);[R1] [C8] column_name:C7;[R1] [C8] column_type:MYSQL_TYPE_STRING;[R1] [C8] column_is_rowkey:false;[R1] [C8] column_is_signed:true;[R1] [C8] column_encoding:utf8mb4;[R1] [C8] column_is_not_null:false;[R1] [C8] column_value_new:[12.34                                                                                               ](100);$[R2] COMMIT;
insert into number_1 (c0, c6) values (64,'0.1234567890123456');
ob1.oblog.next;
[R0] BEGIN;[R0] org_cluster_id:1;[R1] record_type:INSERT;[R1] database_name:oracle.OBLOG_DB;[R1] table_name:NUMBER_1;[R1] log_event:true;[R1] column_count:8;[R1] source_category:SRC_FULL_RECORDED;[R1] source_type:SRC_OCEANBASE_1_0;[R1] has_pk:true;[R1] pk_info:(0);[R1] pks:C0;[R1] has_uk:false;[R1] uk_info:(null);[R1] uks:(null);[R1] [C1] column_name:C0;[R1] [C1] column_type:MYSQL_TYPE_NEWDECIMAL;[R1] [C1] column_is_rowkey:true;[R1] [C1] column_is_signed:true;[R1] [C1] column_encoding:binary;[R1] [C1] column_is_not_null:true;[R1] [C1] column_value_new:[64](2);[R1] [C2] column_name:C1;[R1] [C2] column_type:MYSQL_TYPE_DOUBLE;[R1] [C2] column_is_rowkey:false;[R1] [C2] column_is_signed:true;[R1] [C2] column_encoding:binary;[R1] [C2] column_is_not_null:false;[R1] [C2] column_value_new:[1.234E+001](10);[R1] [C3] column_name:C2;[R1] [C3] column_type:MYSQL_TYPE_FLOAT;[R1] [C3] column_is_rowkey:false;[R1] [C3] column_is_signed:true;[R1] [C3] column_encoding:binary;[R1] [C3] column_is_not_null:false;[R1] [C3] column_value_new:[1.23400002E+001](15);[R1] [C4] column_name:C3;[R1] [C4] column_type:MYSQL_TYPE_NEWDECIMAL;[R1] [C4] column_is_rowkey:false;[R1] [C4] column_is_signed:true;[R1] [C4] column_encoding:binary;[R1] [C4] column_is_not_null:false;[R1] [C4] column_value_new:[12.34](5);[R1] [C5] column_name:C4;[R1] [C5] column_type:MYSQL_TYPE_OB_NUMBER_FLOAT;[R1] [C5] column_is_rowkey:false;[R1] [C5] column_is_signed:true;[R1] [C5] column_encoding:binary;[R1] [C5] column_is_not_null:false;[R1] [C5] column_value_new:[12.34](5);[R1] [C6] column_name:C5;[R1] [C6] column_type:MYSQL_TYPE_OB_NUMBER_FLOAT;[R1] [C6] column_is_rowkey:false;[R1] [C6] column_is_signed:true;[R1] [C6] column_encoding:binary;[R1] [C6] column_is_not_null:false;[R1] [C6] column_value_new:[12.34](5);[R1] [C7] column_name:C6;[R1] [C7] column_type:MYSQL_TYPE_VAR_STRING;[R1] [C7] column_is_rowkey:false;[R1] [C7] column_is_signed:true;[R1] [C7] column_encoding:utf8mb4;[R1] [C7] column_is_not_null:false;[R1] [C7] column_value_new:[0.1234567890123456](18);[R1] [C8] column_name:C7;[R1] [C8] column_type:MYSQL_TYPE_STRING;[R1] [C8] column_is_rowkey:false;[R1] [C8] column_is_signed:true;[R1] [C8] column_encoding:utf8mb4;[R1] [C8] column_is_not_null:false;[R1] [C8] column_value_new:[12.34                                                                                               ](100);$[R2] COMMIT;
insert into number_1 (c0, c6) values (65,'0.123456789012345');
ob1.oblog.next;
[R0] BEGIN;[R0] org_cluster_id:1;[R1] record_type:INSERT;[R1] database_name:oracle.OBLOG_DB;[R1] table_name:NUMBER_1;[R1] log_event:true;[R1] column_count:8;[R1] source_category:SRC_FULL_RECORDED;[R1] source_type:SRC_OCEANBASE_1_0;[R1] has_pk:true;[R1] pk_info:(0);[R1] pks:C0;[R1] has_uk:false;[R1] uk_info:(null);[R1] uks:(null);[R1] [C1] column_name:C0;[R1] [C1] column_type:MYSQL_TYPE_NEWDECIMAL;[R1] [C1] column_is_rowkey:true;[R1] [C1] column_is_signed:true;[R1] [C1] column_encoding:binary;[R1] [C1] column_is_not_null:true;[R1] [C1] column_value_new:[65](2);[R1] [C2] column_name:C1;[R1] [C2] column_type:MYSQL_TYPE_DOUBLE;[R1] [C2] column_is_rowkey:false;[R1] [C2] column_is_signed:true;[R1] [C2] column_encoding:binary;[R1] [C2] column_is_not_null:false;[R1] [C2] column_value_new:[1.234E+001](10);[R1] [C3] column_name:C2;[R1] [C3] column_type:MYSQL_TYPE_FLOAT;[R1] [C3] column_is_rowkey:false;[R1] [C3] column_is_signed:true;[R1] [C3] column_encoding:binary;[R1] [C3] column_is_not_null:false;[R1] [C3] column_value_new:[1.23400002E+001](15);[R1] [C4] column_name:C3;[R1] [C4] column_type:MYSQL_TYPE_NEWDECIMAL;[R1] [C4] column_is_rowkey:false;[R1] [C4] column_is_signed:true;[R1] [C4] column_encoding:binary;[R1] [C4] column_is_not_null:false;[R1] [C4] column_value_new:[12.34](5);[R1] [C5] column_name:C4;[R1] [C5] column_type:MYSQL_TYPE_OB_NUMBER_FLOAT;[R1] [C5] column_is_rowkey:false;[R1] [C5] column_is_signed:true;[R1] [C5] column_encoding:binary;[R1] [C5] column_is_not_null:false;[R1] [C5] column_value_new:[12.34](5);[R1] [C6] column_name:C5;[R1] [C6] column_type:MYSQL_TYPE_OB_NUMBER_FLOAT;[R1] [C6] column_is_rowkey:false;[R1] [C6] column_is_signed:true;[R1] [C6] column_encoding:binary;[R1] [C6] column_is_not_null:false;[R1] [C6] column_value_new:[12.34](5);[R1] [C7] column_name:C6;[R1] [C7] column_type:MYSQL_TYPE_VAR_STRING;[R1] [C7] column_is_rowkey:false;[R1] [C7] column_is_signed:true;[R1] [C7] column_encoding:utf8mb4;[R1] [C7] column_is_not_null:false;[R1] [C7] column_value_new:[0.123456789012345](17);[R1] [C8] column_name:C7;[R1] [C8] column_type:MYSQL_TYPE_STRING;[R1] [C8] column_is_rowkey:false;[R1] [C8] column_is_signed:true;[R1] [C8] column_encoding:utf8mb4;[R1] [C8] column_is_not_null:false;[R1] [C8] column_value_new:[12.34                                                                                               ](100);$[R2] COMMIT;
insert into number_1 (c0, c6) values (66,'0.12345678901234');
ob1.oblog.next;
[R0] BEGIN;[R0] org_cluster_id:1;[R1] record_type:INSERT;[R1] database_name:oracle.OBLOG_DB;[R1] table_name:NUMBER_1;[R1] log_event:true;[R1] column_count:8;[R1] source_category:SRC_FULL_RECORDED;[R1] source_type:SRC_OCEANBASE_1_0;[R1] has_pk:true;[R1] pk_info:(0);[R1] pks:C0;[R1] has_uk:false;[R1] uk_info:(null);[R1] uks:(null);[R1] [C1] column_name:C0;[R1] [C1] column_type:MYSQL_TYPE_NEWDECIMAL;[R1] [C1] column_is_rowkey:true;[R1] [C1] column_is_signed:true;[R1] [C1] column_encoding:binary;[R1] [C1] column_is_not_null:true;[R1] [C1] column_value_new:[66](2);[R1] [C2] column_name:C1;[R1] [C2] column_type:MYSQL_TYPE_DOUBLE;[R1] [C2] column_is_rowkey:false;[R1] [C2] column_is_signed:true;[R1] [C2] column_encoding:binary;[R1] [C2] column_is_not_null:false;[R1] [C2] column_value_new:[1.234E+001](10);[R1] [C3] column_name:C2;[R1] [C3] column_type:MYSQL_TYPE_FLOAT;[R1] [C3] column_is_rowkey:false;[R1] [C3] column_is_signed:true;[R1] [C3] column_encoding:binary;[R1] [C3] column_is_not_null:false;[R1] [C3] column_value_new:[1.23400002E+001](15);[R1] [C4] column_name:C3;[R1] [C4] column_type:MYSQL_TYPE_NEWDECIMAL;[R1] [C4] column_is_rowkey:false;[R1] [C4] column_is_signed:true;[R1] [C4] column_encoding:binary;[R1] [C4] column_is_not_null:false;[R1] [C4] column_value_new:[12.34](5);[R1] [C5] column_name:C4;[R1] [C5] column_type:MYSQL_TYPE_OB_NUMBER_FLOAT;[R1] [C5] column_is_rowkey:false;[R1] [C5] column_is_signed:true;[R1] [C5] column_encoding:binary;[R1] [C5] column_is_not_null:false;[R1] [C5] column_value_new:[12.34](5);[R1] [C6] column_name:C5;[R1] [C6] column_type:MYSQL_TYPE_OB_NUMBER_FLOAT;[R1] [C6] column_is_rowkey:false;[R1] [C6] column_is_signed:true;[R1] [C6] column_encoding:binary;[R1] [C6] column_is_not_null:false;[R1] [C6] column_value_new:[12.34](5);[R1] [C7] column_name:C6;[R1] [C7] column_type:MYSQL_TYPE_VAR_STRING;[R1] [C7] column_is_rowkey:false;[R1] [C7] column_is_signed:true;[R1] [C7] column_encoding:utf8mb4;[R1] [C7] column_is_not_null:false;[R1] [C7] column_value_new:[0.12345678901234](16);[R1] [C8] column_name:C7;[R1] [C8] column_type:MYSQL_TYPE_STRING;[R1] [C8] column_is_rowkey:false;[R1] [C8] column_is_signed:true;[R1] [C8] column_encoding:utf8mb4;[R1] [C8] column_is_not_null:false;[R1] [C8] column_value_new:[12.34                                                                                               ](100);$[R2] COMMIT;
insert into number_1 (c0, c6) values (67,'0.1234567890123');
ob1.oblog.next;
[R0] BEGIN;[R0] org_cluster_id:1;[R1] record_type:INSERT;[R1] database_name:oracle.OBLOG_DB;[R1] table_name:NUMBER_1;[R1] log_event:true;[R1] column_count:8;[R1] source_category:SRC_FULL_RECORDED;[R1] source_type:SRC_OCEANBASE_1_0;[R1] has_pk:true;[R1] pk_info:(0);[R1] pks:C0;[R1] has_uk:false;[R1] uk_info:(null);[R1] uks:(null);[R1] [C1] column_name:C0;[R1] [C1] column_type:MYSQL_TYPE_NEWDECIMAL;[R1] [C1] column_is_rowkey:true;[R1] [C1] column_is_signed:true;[R1] [C1] column_encoding:binary;[R1] [C1] column_is_not_null:true;[R1] [C1] column_value_new:[67](2);[R1] [C2] column_name:C1;[R1] [C2] column_type:MYSQL_TYPE_DOUBLE;[R1] [C2] column_is_rowkey:false;[R1] [C2] column_is_signed:true;[R1] [C2] column_encoding:binary;[R1] [C2] column_is_not_null:false;[R1] [C2] column_value_new:[1.234E+001](10);[R1] [C3] column_name:C2;[R1] [C3] column_type:MYSQL_TYPE_FLOAT;[R1] [C3] column_is_rowkey:false;[R1] [C3] column_is_signed:true;[R1] [C3] column_encoding:binary;[R1] [C3] column_is_not_null:false;[R1] [C3] column_value_new:[1.23400002E+001](15);[R1] [C4] column_name:C3;[R1] [C4] column_type:MYSQL_TYPE_NEWDECIMAL;[R1] [C4] column_is_rowkey:false;[R1] [C4] column_is_signed:true;[R1] [C4] column_encoding:binary;[R1] [C4] column_is_not_null:false;[R1] [C4] column_value_new:[12.34](5);[R1] [C5] column_name:C4;[R1] [C5] column_type:MYSQL_TYPE_OB_NUMBER_FLOAT;[R1] [C5] column_is_rowkey:false;[R1] [C5] column_is_signed:true;[R1] [C5] column_encoding:binary;[R1] [C5] column_is_not_null:false;[R1] [C5] column_value_new:[12.34](5);[R1] [C6] column_name:C5;[R1] [C6] column_type:MYSQL_TYPE_OB_NUMBER_FLOAT;[R1] [C6] column_is_rowkey:false;[R1] [C6] column_is_signed:true;[R1] [C6] column_encoding:binary;[R1] [C6] column_is_not_null:false;[R1] [C6] column_value_new:[12.34](5);[R1] [C7] column_name:C6;[R1] [C7] column_type:MYSQL_TYPE_VAR_STRING;[R1] [C7] column_is_rowkey:false;[R1] [C7] column_is_signed:true;[R1] [C7] column_encoding:utf8mb4;[R1] [C7] column_is_not_null:false;[R1] [C7] column_value_new:[0.1234567890123](15);[R1] [C8] column_name:C7;[R1] [C8] column_type:MYSQL_TYPE_STRING;[R1] [C8] column_is_rowkey:false;[R1] [C8] column_is_signed:true;[R1] [C8] column_encoding:utf8mb4;[R1] [C8] column_is_not_null:false;[R1] [C8] column_value_new:[12.34                                                                                               ](100);$[R2] COMMIT;
insert into number_1 (c0, c6) values (68,'0.123456789012');
ob1.oblog.next;
[R0] BEGIN;[R0] org_cluster_id:1;[R1] record_type:INSERT;[R1] database_name:oracle.OBLOG_DB;[R1] table_name:NUMBER_1;[R1] log_event:true;[R1] column_count:8;[R1] source_category:SRC_FULL_RECORDED;[R1] source_type:SRC_OCEANBASE_1_0;[R1] has_pk:true;[R1] pk_info:(0);[R1] pks:C0;[R1] has_uk:false;[R1] uk_info:(null);[R1] uks:(null);[R1] [C1] column_name:C0;[R1] [C1] column_type:MYSQL_TYPE_NEWDECIMAL;[R1] [C1] column_is_rowkey:true;[R1] [C1] column_is_signed:true;[R1] [C1] column_encoding:binary;[R1] [C1] column_is_not_null:true;[R1] [C1] column_value_new:[68](2);[R1] [C2] column_name:C1;[R1] [C2] column_type:MYSQL_TYPE_DOUBLE;[R1] [C2] column_is_rowkey:false;[R1] [C2] column_is_signed:true;[R1] [C2] column_encoding:binary;[R1] [C2] column_is_not_null:false;[R1] [C2] column_value_new:[1.234E+001](10);[R1] [C3] column_name:C2;[R1] [C3] column_type:MYSQL_TYPE_FLOAT;[R1] [C3] column_is_rowkey:false;[R1] [C3] column_is_signed:true;[R1] [C3] column_encoding:binary;[R1] [C3] column_is_not_null:false;[R1] [C3] column_value_new:[1.23400002E+001](15);[R1] [C4] column_name:C3;[R1] [C4] column_type:MYSQL_TYPE_NEWDECIMAL;[R1] [C4] column_is_rowkey:false;[R1] [C4] column_is_signed:true;[R1] [C4] column_encoding:binary;[R1] [C4] column_is_not_null:false;[R1] [C4] column_value_new:[12.34](5);[R1] [C5] column_name:C4;[R1] [C5] column_type:MYSQL_TYPE_OB_NUMBER_FLOAT;[R1] [C5] column_is_rowkey:false;[R1] [C5] column_is_signed:true;[R1] [C5] column_encoding:binary;[R1] [C5] column_is_not_null:false;[R1] [C5] column_value_new:[12.34](5);[R1] [C6] column_name:C5;[R1] [C6] column_type:MYSQL_TYPE_OB_NUMBER_FLOAT;[R1] [C6] column_is_rowkey:false;[R1] [C6] column_is_signed:true;[R1] [C6] column_encoding:binary;[R1] [C6] column_is_not_null:false;[R1] [C6] column_value_new:[12.34](5);[R1] [C7] column_name:C6;[R1] [C7] column_type:MYSQL_TYPE_VAR_STRING;[R1] [C7] column_is_rowkey:false;[R1] [C7] column_is_signed:true;[R1] [C7] column_encoding:utf8mb4;[R1] [C7] column_is_not_null:false;[R1] [C7] column_value_new:[0.123456789012](14);[R1] [C8] column_name:C7;[R1] [C8] column_type:MYSQL_TYPE_STRING;[R1] [C8] column_is_rowkey:false;[R1] [C8] column_is_signed:true;[R1] [C8] column_encoding:utf8mb4;[R1] [C8] column_is_not_null:false;[R1] [C8] column_value_new:[12.34                                                                                               ](100);$[R2] COMMIT;
insert into number_1 (c0, c6) values (69,'0.12345678901');
ob1.oblog.next;
[R0] BEGIN;[R0] org_cluster_id:1;[R1] record_type:INSERT;[R1] database_name:oracle.OBLOG_DB;[R1] table_name:NUMBER_1;[R1] log_event:true;[R1] column_count:8;[R1] source_category:SRC_FULL_RECORDED;[R1] source_type:SRC_OCEANBASE_1_0;[R1] has_pk:true;[R1] pk_info:(0);[R1] pks:C0;[R1] has_uk:false;[R1] uk_info:(null);[R1] uks:(null);[R1] [C1] column_name:C0;[R1] [C1] column_type:MYSQL_TYPE_NEWDECIMAL;[R1] [C1] column_is_rowkey:true;[R1] [C1] column_is_signed:true;[R1] [C1] column_encoding:binary;[R1] [C1] column_is_not_null:true;[R1] [C1] column_value_new:[69](2);[R1] [C2] column_name:C1;[R1] [C2] column_type:MYSQL_TYPE_DOUBLE;[R1] [C2] column_is_rowkey:false;[R1] [C2] column_is_signed:true;[R1] [C2] column_encoding:binary;[R1] [C2] column_is_not_null:false;[R1] [C2] column_value_new:[1.234E+001](10);[R1] [C3] column_name:C2;[R1] [C3] column_type:MYSQL_TYPE_FLOAT;[R1] [C3] column_is_rowkey:false;[R1] [C3] column_is_signed:true;[R1] [C3] column_encoding:binary;[R1] [C3] column_is_not_null:false;[R1] [C3] column_value_new:[1.23400002E+001](15);[R1] [C4] column_name:C3;[R1] [C4] column_type:MYSQL_TYPE_NEWDECIMAL;[R1] [C4] column_is_rowkey:false;[R1] [C4] column_is_signed:true;[R1] [C4] column_encoding:binary;[R1] [C4] column_is_not_null:false;[R1] [C4] column_value_new:[12.34](5);[R1] [C5] column_name:C4;[R1] [C5] column_type:MYSQL_TYPE_OB_NUMBER_FLOAT;[R1] [C5] column_is_rowkey:false;[R1] [C5] column_is_signed:true;[R1] [C5] column_encoding:binary;[R1] [C5] column_is_not_null:false;[R1] [C5] column_value_new:[12.34](5);[R1] [C6] column_name:C5;[R1] [C6] column_type:MYSQL_TYPE_OB_NUMBER_FLOAT;[R1] [C6] column_is_rowkey:false;[R1] [C6] column_is_signed:true;[R1] [C6] column_encoding:binary;[R1] [C6] column_is_not_null:false;[R1] [C6] column_value_new:[12.34](5);[R1] [C7] column_name:C6;[R1] [C7] column_type:MYSQL_TYPE_VAR_STRING;[R1] [C7] column_is_rowkey:false;[R1] [C7] column_is_signed:true;[R1] [C7] column_encoding:utf8mb4;[R1] [C7] column_is_not_null:false;[R1] [C7] column_value_new:[0.12345678901](13);[R1] [C8] column_name:C7;[R1] [C8] column_type:MYSQL_TYPE_STRING;[R1] [C8] column_is_rowkey:false;[R1] [C8] column_is_signed:true;[R1] [C8] column_encoding:utf8mb4;[R1] [C8] column_is_not_null:false;[R1] [C8] column_value_new:[12.34                                                                                               ](100);$[R2] COMMIT;
insert into number_1 (c0, c6) values (70,'0.1234567890');
ob1.oblog.next;
[R0] BEGIN;[R0] org_cluster_id:1;[R1] record_type:INSERT;[R1] database_name:oracle.OBLOG_DB;[R1] table_name:NUMBER_1;[R1] log_event:true;[R1] column_count:8;[R1] source_category:SRC_FULL_RECORDED;[R1] source_type:SRC_OCEANBASE_1_0;[R1] has_pk:true;[R1] pk_info:(0);[R1] pks:C0;[R1] has_uk:false;[R1] uk_info:(null);[R1] uks:(null);[R1] [C1] column_name:C0;[R1] [C1] column_type:MYSQL_TYPE_NEWDECIMAL;[R1] [C1] column_is_rowkey:true;[R1] [C1] column_is_signed:true;[R1] [C1] column_encoding:binary;[R1] [C1] column_is_not_null:true;[R1] [C1] column_value_new:[70](2);[R1] [C2] column_name:C1;[R1] [C2] column_type:MYSQL_TYPE_DOUBLE;[R1] [C2] column_is_rowkey:false;[R1] [C2] column_is_signed:true;[R1] [C2] column_encoding:binary;[R1] [C2] column_is_not_null:false;[R1] [C2] column_value_new:[1.234E+001](10);[R1] [C3] column_name:C2;[R1] [C3] column_type:MYSQL_TYPE_FLOAT;[R1] [C3] column_is_rowkey:false;[R1] [C3] column_is_signed:true;[R1] [C3] column_encoding:binary;[R1] [C3] column_is_not_null:false;[R1] [C3] column_value_new:[1.23400002E+001](15);[R1] [C4] column_name:C3;[R1] [C4] column_type:MYSQL_TYPE_NEWDECIMAL;[R1] [C4] column_is_rowkey:false;[R1] [C4] column_is_signed:true;[R1] [C4] column_encoding:binary;[R1] [C4] column_is_not_null:false;[R1] [C4] column_value_new:[12.34](5);[R1] [C5] column_name:C4;[R1] [C5] column_type:MYSQL_TYPE_OB_NUMBER_FLOAT;[R1] [C5] column_is_rowkey:false;[R1] [C5] column_is_signed:true;[R1] [C5] column_encoding:binary;[R1] [C5] column_is_not_null:false;[R1] [C5] column_value_new:[12.34](5);[R1] [C6] column_name:C5;[R1] [C6] column_type:MYSQL_TYPE_OB_NUMBER_FLOAT;[R1] [C6] column_is_rowkey:false;[R1] [C6] column_is_signed:true;[R1] [C6] column_encoding:binary;[R1] [C6] column_is_not_null:false;[R1] [C6] column_value_new:[12.34](5);[R1] [C7] column_name:C6;[R1] [C7] column_type:MYSQL_TYPE_VAR_STRING;[R1] [C7] column_is_rowkey:false;[R1] [C7] column_is_signed:true;[R1] [C7] column_encoding:utf8mb4;[R1] [C7] column_is_not_null:false;[R1] [C7] column_value_new:[0.1234567890](12);[R1] [C8] column_name:C7;[R1] [C8] column_type:MYSQL_TYPE_STRING;[R1] [C8] column_is_rowkey:false;[R1] [C8] column_is_signed:true;[R1] [C8] column_encoding:utf8mb4;[R1] [C8] column_is_not_null:false;[R1] [C8] column_value_new:[12.34                                                                                               ](100);$[R2] COMMIT;
insert into number_1 (c0, c6) values (71,'0.123456789');
ob1.oblog.next;
[R0] BEGIN;[R0] org_cluster_id:1;[R1] record_type:INSERT;[R1] database_name:oracle.OBLOG_DB;[R1] table_name:NUMBER_1;[R1] log_event:true;[R1] column_count:8;[R1] source_category:SRC_FULL_RECORDED;[R1] source_type:SRC_OCEANBASE_1_0;[R1] has_pk:true;[R1] pk_info:(0);[R1] pks:C0;[R1] has_uk:false;[R1] uk_info:(null);[R1] uks:(null);[R1] [C1] column_name:C0;[R1] [C1] column_type:MYSQL_TYPE_NEWDECIMAL;[R1] [C1] column_is_rowkey:true;[R1] [C1] column_is_signed:true;[R1] [C1] column_encoding:binary;[R1] [C1] column_is_not_null:true;[R1] [C1] column_value_new:[71](2);[R1] [C2] column_name:C1;[R1] [C2] column_type:MYSQL_TYPE_DOUBLE;[R1] [C2] column_is_rowkey:false;[R1] [C2] column_is_signed:true;[R1] [C2] column_encoding:binary;[R1] [C2] column_is_not_null:false;[R1] [C2] column_value_new:[1.234E+001](10);[R1] [C3] column_name:C2;[R1] [C3] column_type:MYSQL_TYPE_FLOAT;[R1] [C3] column_is_rowkey:false;[R1] [C3] column_is_signed:true;[R1] [C3] column_encoding:binary;[R1] [C3] column_is_not_null:false;[R1] [C3] column_value_new:[1.23400002E+001](15);[R1] [C4] column_name:C3;[R1] [C4] column_type:MYSQL_TYPE_NEWDECIMAL;[R1] [C4] column_is_rowkey:false;[R1] [C4] column_is_signed:true;[R1] [C4] column_encoding:binary;[R1] [C4] column_is_not_null:false;[R1] [C4] column_value_new:[12.34](5);[R1] [C5] column_name:C4;[R1] [C5] column_type:MYSQL_TYPE_OB_NUMBER_FLOAT;[R1] [C5] column_is_rowkey:false;[R1] [C5] column_is_signed:true;[R1] [C5] column_encoding:binary;[R1] [C5] column_is_not_null:false;[R1] [C5] column_value_new:[12.34](5);[R1] [C6] column_name:C5;[R1] [C6] column_type:MYSQL_TYPE_OB_NUMBER_FLOAT;[R1] [C6] column_is_rowkey:false;[R1] [C6] column_is_signed:true;[R1] [C6] column_encoding:binary;[R1] [C6] column_is_not_null:false;[R1] [C6] column_value_new:[12.34](5);[R1] [C7] column_name:C6;[R1] [C7] column_type:MYSQL_TYPE_VAR_STRING;[R1] [C7] column_is_rowkey:false;[R1] [C7] column_is_signed:true;[R1] [C7] column_encoding:utf8mb4;[R1] [C7] column_is_not_null:false;[R1] [C7] column_value_new:[0.123456789](11);[R1] [C8] column_name:C7;[R1] [C8] column_type:MYSQL_TYPE_STRING;[R1] [C8] column_is_rowkey:false;[R1] [C8] column_is_signed:true;[R1] [C8] column_encoding:utf8mb4;[R1] [C8] column_is_not_null:false;[R1] [C8] column_value_new:[12.34                                                                                               ](100);$[R2] COMMIT;
insert into number_1 (c0, c6) values (72,'0.12345678');
ob1.oblog.next;
[R0] BEGIN;[R0] org_cluster_id:1;[R1] record_type:INSERT;[R1] database_name:oracle.OBLOG_DB;[R1] table_name:NUMBER_1;[R1] log_event:true;[R1] column_count:8;[R1] source_category:SRC_FULL_RECORDED;[R1] source_type:SRC_OCEANBASE_1_0;[R1] has_pk:true;[R1] pk_info:(0);[R1] pks:C0;[R1] has_uk:false;[R1] uk_info:(null);[R1] uks:(null);[R1] [C1] column_name:C0;[R1] [C1] column_type:MYSQL_TYPE_NEWDECIMAL;[R1] [C1] column_is_rowkey:true;[R1] [C1] column_is_signed:true;[R1] [C1] column_encoding:binary;[R1] [C1] column_is_not_null:true;[R1] [C1] column_value_new:[72](2);[R1] [C2] column_name:C1;[R1] [C2] column_type:MYSQL_TYPE_DOUBLE;[R1] [C2] column_is_rowkey:false;[R1] [C2] column_is_signed:true;[R1] [C2] column_encoding:binary;[R1] [C2] column_is_not_null:false;[R1] [C2] column_value_new:[1.234E+001](10);[R1] [C3] column_name:C2;[R1] [C3] column_type:MYSQL_TYPE_FLOAT;[R1] [C3] column_is_rowkey:false;[R1] [C3] column_is_signed:true;[R1] [C3] column_encoding:binary;[R1] [C3] column_is_not_null:false;[R1] [C3] column_value_new:[1.23400002E+001](15);[R1] [C4] column_name:C3;[R1] [C4] column_type:MYSQL_TYPE_NEWDECIMAL;[R1] [C4] column_is_rowkey:false;[R1] [C4] column_is_signed:true;[R1] [C4] column_encoding:binary;[R1] [C4] column_is_not_null:false;[R1] [C4] column_value_new:[12.34](5);[R1] [C5] column_name:C4;[R1] [C5] column_type:MYSQL_TYPE_OB_NUMBER_FLOAT;[R1] [C5] column_is_rowkey:false;[R1] [C5] column_is_signed:true;[R1] [C5] column_encoding:binary;[R1] [C5] column_is_not_null:false;[R1] [C5] column_value_new:[12.34](5);[R1] [C6] column_name:C5;[R1] [C6] column_type:MYSQL_TYPE_OB_NUMBER_FLOAT;[R1] [C6] column_is_rowkey:false;[R1] [C6] column_is_signed:true;[R1] [C6] column_encoding:binary;[R1] [C6] column_is_not_null:false;[R1] [C6] column_value_new:[12.34](5);[R1] [C7] column_name:C6;[R1] [C7] column_type:MYSQL_TYPE_VAR_STRING;[R1] [C7] column_is_rowkey:false;[R1] [C7] column_is_signed:true;[R1] [C7] column_encoding:utf8mb4;[R1] [C7] column_is_not_null:false;[R1] [C7] column_value_new:[0.12345678](10);[R1] [C8] column_name:C7;[R1] [C8] column_type:MYSQL_TYPE_STRING;[R1] [C8] column_is_rowkey:false;[R1] [C8] column_is_signed:true;[R1] [C8] column_encoding:utf8mb4;[R1] [C8] column_is_not_null:false;[R1] [C8] column_value_new:[12.34                                                                                               ](100);$[R2] COMMIT;
insert into number_1 (c0, c6) values (73,'0.1234567');
ob1.oblog.next;
[R0] BEGIN;[R0] org_cluster_id:1;[R1] record_type:INSERT;[R1] database_name:oracle.OBLOG_DB;[R1] table_name:NUMBER_1;[R1] log_event:true;[R1] column_count:8;[R1] source_category:SRC_FULL_RECORDED;[R1] source_type:SRC_OCEANBASE_1_0;[R1] has_pk:true;[R1] pk_info:(0);[R1] pks:C0;[R1] has_uk:false;[R1] uk_info:(null);[R1] uks:(null);[R1] [C1] column_name:C0;[R1] [C1] column_type:MYSQL_TYPE_NEWDECIMAL;[R1] [C1] column_is_rowkey:true;[R1] [C1] column_is_signed:true;[R1] [C1] column_encoding:binary;[R1] [C1] column_is_not_null:true;[R1] [C1] column_value_new:[73](2);[R1] [C2] column_name:C1;[R1] [C2] column_type:MYSQL_TYPE_DOUBLE;[R1] [C2] column_is_rowkey:false;[R1] [C2] column_is_signed:true;[R1] [C2] column_encoding:binary;[R1] [C2] column_is_not_null:false;[R1] [C2] column_value_new:[1.234E+001](10);[R1] [C3] column_name:C2;[R1] [C3] column_type:MYSQL_TYPE_FLOAT;[R1] [C3] column_is_rowkey:false;[R1] [C3] column_is_signed:true;[R1] [C3] column_encoding:binary;[R1] [C3] column_is_not_null:false;[R1] [C3] column_value_new:[1.23400002E+001](15);[R1] [C4] column_name:C3;[R1] [C4] column_type:MYSQL_TYPE_NEWDECIMAL;[R1] [C4] column_is_rowkey:false;[R1] [C4] column_is_signed:true;[R1] [C4] column_encoding:binary;[R1] [C4] column_is_not_null:false;[R1] [C4] column_value_new:[12.34](5);[R1] [C5] column_name:C4;[R1] [C5] column_type:MYSQL_TYPE_OB_NUMBER_FLOAT;[R1] [C5] column_is_rowkey:false;[R1] [C5] column_is_signed:true;[R1] [C5] column_encoding:binary;[R1] [C5] column_is_not_null:false;[R1] [C5] column_value_new:[12.34](5);[R1] [C6] column_name:C5;[R1] [C6] column_type:MYSQL_TYPE_OB_NUMBER_FLOAT;[R1] [C6] column_is_rowkey:false;[R1] [C6] column_is_signed:true;[R1] [C6] column_encoding:binary;[R1] [C6] column_is_not_null:false;[R1] [C6] column_value_new:[12.34](5);[R1] [C7] column_name:C6;[R1] [C7] column_type:MYSQL_TYPE_VAR_STRING;[R1] [C7] column_is_rowkey:false;[R1] [C7] column_is_signed:true;[R1] [C7] column_encoding:utf8mb4;[R1] [C7] column_is_not_null:false;[R1] [C7] column_value_new:[0.1234567](9);[R1] [C8] column_name:C7;[R1] [C8] column_type:MYSQL_TYPE_STRING;[R1] [C8] column_is_rowkey:false;[R1] [C8] column_is_signed:true;[R1] [C8] column_encoding:utf8mb4;[R1] [C8] column_is_not_null:false;[R1] [C8] column_value_new:[12.34                                                                                               ](100);$[R2] COMMIT;
insert into number_1 (c0, c6) values (74,'0.123456');
ob1.oblog.next;
[R0] BEGIN;[R0] org_cluster_id:1;[R1] record_type:INSERT;[R1] database_name:oracle.OBLOG_DB;[R1] table_name:NUMBER_1;[R1] log_event:true;[R1] column_count:8;[R1] source_category:SRC_FULL_RECORDED;[R1] source_type:SRC_OCEANBASE_1_0;[R1] has_pk:true;[R1] pk_info:(0);[R1] pks:C0;[R1] has_uk:false;[R1] uk_info:(null);[R1] uks:(null);[R1] [C1] column_name:C0;[R1] [C1] column_type:MYSQL_TYPE_NEWDECIMAL;[R1] [C1] column_is_rowkey:true;[R1] [C1] column_is_signed:true;[R1] [C1] column_encoding:binary;[R1] [C1] column_is_not_null:true;[R1] [C1] column_value_new:[74](2);[R1] [C2] column_name:C1;[R1] [C2] column_type:MYSQL_TYPE_DOUBLE;[R1] [C2] column_is_rowkey:false;[R1] [C2] column_is_signed:true;[R1] [C2] column_encoding:binary;[R1] [C2] column_is_not_null:false;[R1] [C2] column_value_new:[1.234E+001](10);[R1] [C3] column_name:C2;[R1] [C3] column_type:MYSQL_TYPE_FLOAT;[R1] [C3] column_is_rowkey:false;[R1] [C3] column_is_signed:true;[R1] [C3] column_encoding:binary;[R1] [C3] column_is_not_null:false;[R1] [C3] column_value_new:[1.23400002E+001](15);[R1] [C4] column_name:C3;[R1] [C4] column_type:MYSQL_TYPE_NEWDECIMAL;[R1] [C4] column_is_rowkey:false;[R1] [C4] column_is_signed:true;[R1] [C4] column_encoding:binary;[R1] [C4] column_is_not_null:false;[R1] [C4] column_value_new:[12.34](5);[R1] [C5] column_name:C4;[R1] [C5] column_type:MYSQL_TYPE_OB_NUMBER_FLOAT;[R1] [C5] column_is_rowkey:false;[R1] [C5] column_is_signed:true;[R1] [C5] column_encoding:binary;[R1] [C5] column_is_not_null:false;[R1] [C5] column_value_new:[12.34](5);[R1] [C6] column_name:C5;[R1] [C6] column_type:MYSQL_TYPE_OB_NUMBER_FLOAT;[R1] [C6] column_is_rowkey:false;[R1] [C6] column_is_signed:true;[R1] [C6] column_encoding:binary;[R1] [C6] column_is_not_null:false;[R1] [C6] column_value_new:[12.34](5);[R1] [C7] column_name:C6;[R1] [C7] column_type:MYSQL_TYPE_VAR_STRING;[R1] [C7] column_is_rowkey:false;[R1] [C7] column_is_signed:true;[R1] [C7] column_encoding:utf8mb4;[R1] [C7] column_is_not_null:false;[R1] [C7] column_value_new:[0.123456](8);[R1] [C8] column_name:C7;[R1] [C8] column_type:MYSQL_TYPE_STRING;[R1] [C8] column_is_rowkey:false;[R1] [C8] column_is_signed:true;[R1] [C8] column_encoding:utf8mb4;[R1] [C8] column_is_not_null:false;[R1] [C8] column_value_new:[12.34                                                                                               ](100);$[R2] COMMIT;
insert into number_1 (c0, c6) values (75,'0.12345');
ob1.oblog.next;
[R0] BEGIN;[R0] org_cluster_id:1;[R1] record_type:INSERT;[R1] database_name:oracle.OBLOG_DB;[R1] table_name:NUMBER_1;[R1] log_event:true;[R1] column_count:8;[R1] source_category:SRC_FULL_RECORDED;[R1] source_type:SRC_OCEANBASE_1_0;[R1] has_pk:true;[R1] pk_info:(0);[R1] pks:C0;[R1] has_uk:false;[R1] uk_info:(null);[R1] uks:(null);[R1] [C1] column_name:C0;[R1] [C1] column_type:MYSQL_TYPE_NEWDECIMAL;[R1] [C1] column_is_rowkey:true;[R1] [C1] column_is_signed:true;[R1] [C1] column_encoding:binary;[R1] [C1] column_is_not_null:true;[R1] [C1] column_value_new:[75](2);[R1] [C2] column_name:C1;[R1] [C2] column_type:MYSQL_TYPE_DOUBLE;[R1] [C2] column_is_rowkey:false;[R1] [C2] column_is_signed:true;[R1] [C2] column_encoding:binary;[R1] [C2] column_is_not_null:false;[R1] [C2] column_value_new:[1.234E+001](10);[R1] [C3] column_name:C2;[R1] [C3] column_type:MYSQL_TYPE_FLOAT;[R1] [C3] column_is_rowkey:false;[R1] [C3] column_is_signed:true;[R1] [C3] column_encoding:binary;[R1] [C3] column_is_not_null:false;[R1] [C3] column_value_new:[1.23400002E+001](15);[R1] [C4] column_name:C3;[R1] [C4] column_type:MYSQL_TYPE_NEWDECIMAL;[R1] [C4] column_is_rowkey:false;[R1] [C4] column_is_signed:true;[R1] [C4] column_encoding:binary;[R1] [C4] column_is_not_null:false;[R1] [C4] column_value_new:[12.34](5);[R1] [C5] column_name:C4;[R1] [C5] column_type:MYSQL_TYPE_OB_NUMBER_FLOAT;[R1] [C5] column_is_rowkey:false;[R1] [C5] column_is_signed:true;[R1] [C5] column_encoding:binary;[R1] [C5] column_is_not_null:false;[R1] [C5] column_value_new:[12.34](5);[R1] [C6] column_name:C5;[R1] [C6] column_type:MYSQL_TYPE_OB_NUMBER_FLOAT;[R1] [C6] column_is_rowkey:false;[R1] [C6] column_is_signed:true;[R1] [C6] column_encoding:binary;[R1] [C6] column_is_not_null:false;[R1] [C6] column_value_new:[12.34](5);[R1] [C7] column_name:C6;[R1] [C7] column_type:MYSQL_TYPE_VAR_STRING;[R1] [C7] column_is_rowkey:false;[R1] [C7] column_is_signed:true;[R1] [C7] column_encoding:utf8mb4;[R1] [C7] column_is_not_null:false;[R1] [C7] column_value_new:[0.12345](7);[R1] [C8] column_name:C7;[R1] [C8] column_type:MYSQL_TYPE_STRING;[R1] [C8] column_is_rowkey:false;[R1] [C8] column_is_signed:true;[R1] [C8] column_encoding:utf8mb4;[R1] [C8] column_is_not_null:false;[R1] [C8] column_value_new:[12.34                                                                                               ](100);$[R2] COMMIT;
insert into number_1 (c0, c6) values (76,'0.1234');
ob1.oblog.next;
[R0] BEGIN;[R0] org_cluster_id:1;[R1] record_type:INSERT;[R1] database_name:oracle.OBLOG_DB;[R1] table_name:NUMBER_1;[R1] log_event:true;[R1] column_count:8;[R1] source_category:SRC_FULL_RECORDED;[R1] source_type:SRC_OCEANBASE_1_0;[R1] has_pk:true;[R1] pk_info:(0);[R1] pks:C0;[R1] has_uk:false;[R1] uk_info:(null);[R1] uks:(null);[R1] [C1] column_name:C0;[R1] [C1] column_type:MYSQL_TYPE_NEWDECIMAL;[R1] [C1] column_is_rowkey:true;[R1] [C1] column_is_signed:true;[R1] [C1] column_encoding:binary;[R1] [C1] column_is_not_null:true;[R1] [C1] column_value_new:[76](2);[R1] [C2] column_name:C1;[R1] [C2] column_type:MYSQL_TYPE_DOUBLE;[R1] [C2] column_is_rowkey:false;[R1] [C2] column_is_signed:true;[R1] [C2] column_encoding:binary;[R1] [C2] column_is_not_null:false;[R1] [C2] column_value_new:[1.234E+001](10);[R1] [C3] column_name:C2;[R1] [C3] column_type:MYSQL_TYPE_FLOAT;[R1] [C3] column_is_rowkey:false;[R1] [C3] column_is_signed:true;[R1] [C3] column_encoding:binary;[R1] [C3] column_is_not_null:false;[R1] [C3] column_value_new:[1.23400002E+001](15);[R1] [C4] column_name:C3;[R1] [C4] column_type:MYSQL_TYPE_NEWDECIMAL;[R1] [C4] column_is_rowkey:false;[R1] [C4] column_is_signed:true;[R1] [C4] column_encoding:binary;[R1] [C4] column_is_not_null:false;[R1] [C4] column_value_new:[12.34](5);[R1] [C5] column_name:C4;[R1] [C5] column_type:MYSQL_TYPE_OB_NUMBER_FLOAT;[R1] [C5] column_is_rowkey:false;[R1] [C5] column_is_signed:true;[R1] [C5] column_encoding:binary;[R1] [C5] column_is_not_null:false;[R1] [C5] column_value_new:[12.34](5);[R1] [C6] column_name:C5;[R1] [C6] column_type:MYSQL_TYPE_OB_NUMBER_FLOAT;[R1] [C6] column_is_rowkey:false;[R1] [C6] column_is_signed:true;[R1] [C6] column_encoding:binary;[R1] [C6] column_is_not_null:false;[R1] [C6] column_value_new:[12.34](5);[R1] [C7] column_name:C6;[R1] [C7] column_type:MYSQL_TYPE_VAR_STRING;[R1] [C7] column_is_rowkey:false;[R1] [C7] column_is_signed:true;[R1] [C7] column_encoding:utf8mb4;[R1] [C7] column_is_not_null:false;[R1] [C7] column_value_new:[0.1234](6);[R1] [C8] column_name:C7;[R1] [C8] column_type:MYSQL_TYPE_STRING;[R1] [C8] column_is_rowkey:false;[R1] [C8] column_is_signed:true;[R1] [C8] column_encoding:utf8mb4;[R1] [C8] column_is_not_null:false;[R1] [C8] column_value_new:[12.34                                                                                               ](100);$[R2] COMMIT;
insert into number_1 (c0, c6) values (77,'0.123');
ob1.oblog.next;
[R0] BEGIN;[R0] org_cluster_id:1;[R1] record_type:INSERT;[R1] database_name:oracle.OBLOG_DB;[R1] table_name:NUMBER_1;[R1] log_event:true;[R1] column_count:8;[R1] source_category:SRC_FULL_RECORDED;[R1] source_type:SRC_OCEANBASE_1_0;[R1] has_pk:true;[R1] pk_info:(0);[R1] pks:C0;[R1] has_uk:false;[R1] uk_info:(null);[R1] uks:(null);[R1] [C1] column_name:C0;[R1] [C1] column_type:MYSQL_TYPE_NEWDECIMAL;[R1] [C1] column_is_rowkey:true;[R1] [C1] column_is_signed:true;[R1] [C1] column_encoding:binary;[R1] [C1] column_is_not_null:true;[R1] [C1] column_value_new:[77](2);[R1] [C2] column_name:C1;[R1] [C2] column_type:MYSQL_TYPE_DOUBLE;[R1] [C2] column_is_rowkey:false;[R1] [C2] column_is_signed:true;[R1] [C2] column_encoding:binary;[R1] [C2] column_is_not_null:false;[R1] [C2] column_value_new:[1.234E+001](10);[R1] [C3] column_name:C2;[R1] [C3] column_type:MYSQL_TYPE_FLOAT;[R1] [C3] column_is_rowkey:false;[R1] [C3] column_is_signed:true;[R1] [C3] column_encoding:binary;[R1] [C3] column_is_not_null:false;[R1] [C3] column_value_new:[1.23400002E+001](15);[R1] [C4] column_name:C3;[R1] [C4] column_type:MYSQL_TYPE_NEWDECIMAL;[R1] [C4] column_is_rowkey:false;[R1] [C4] column_is_signed:true;[R1] [C4] column_encoding:binary;[R1] [C4] column_is_not_null:false;[R1] [C4] column_value_new:[12.34](5);[R1] [C5] column_name:C4;[R1] [C5] column_type:MYSQL_TYPE_OB_NUMBER_FLOAT;[R1] [C5] column_is_rowkey:false;[R1] [C5] column_is_signed:true;[R1] [C5] column_encoding:binary;[R1] [C5] column_is_not_null:false;[R1] [C5] column_value_new:[12.34](5);[R1] [C6] column_name:C5;[R1] [C6] column_type:MYSQL_TYPE_OB_NUMBER_FLOAT;[R1] [C6] column_is_rowkey:false;[R1] [C6] column_is_signed:true;[R1] [C6] column_encoding:binary;[R1] [C6] column_is_not_null:false;[R1] [C6] column_value_new:[12.34](5);[R1] [C7] column_name:C6;[R1] [C7] column_type:MYSQL_TYPE_VAR_STRING;[R1] [C7] column_is_rowkey:false;[R1] [C7] column_is_signed:true;[R1] [C7] column_encoding:utf8mb4;[R1] [C7] column_is_not_null:false;[R1] [C7] column_value_new:[0.123](5);[R1] [C8] column_name:C7;[R1] [C8] column_type:MYSQL_TYPE_STRING;[R1] [C8] column_is_rowkey:false;[R1] [C8] column_is_signed:true;[R1] [C8] column_encoding:utf8mb4;[R1] [C8] column_is_not_null:false;[R1] [C8] column_value_new:[12.34                                                                                               ](100);$[R2] COMMIT;
insert into number_1 (c0, c6) values (78,'0.12');
ob1.oblog.next;
[R0] BEGIN;[R0] org_cluster_id:1;[R1] record_type:INSERT;[R1] database_name:oracle.OBLOG_DB;[R1] table_name:NUMBER_1;[R1] log_event:true;[R1] column_count:8;[R1] source_category:SRC_FULL_RECORDED;[R1] source_type:SRC_OCEANBASE_1_0;[R1] has_pk:true;[R1] pk_info:(0);[R1] pks:C0;[R1] has_uk:false;[R1] uk_info:(null);[R1] uks:(null);[R1] [C1] column_name:C0;[R1] [C1] column_type:MYSQL_TYPE_NEWDECIMAL;[R1] [C1] column_is_rowkey:true;[R1] [C1] column_is_signed:true;[R1] [C1] column_encoding:binary;[R1] [C1] column_is_not_null:true;[R1] [C1] column_value_new:[78](2);[R1] [C2] column_name:C1;[R1] [C2] column_type:MYSQL_TYPE_DOUBLE;[R1] [C2] column_is_rowkey:false;[R1] [C2] column_is_signed:true;[R1] [C2] column_encoding:binary;[R1] [C2] column_is_not_null:false;[R1] [C2] column_value_new:[1.234E+001](10);[R1] [C3] column_name:C2;[R1] [C3] column_type:MYSQL_TYPE_FLOAT;[R1] [C3] column_is_rowkey:false;[R1] [C3] column_is_signed:true;[R1] [C3] column_encoding:binary;[R1] [C3] column_is_not_null:false;[R1] [C3] column_value_new:[1.23400002E+001](15);[R1] [C4] column_name:C3;[R1] [C4] column_type:MYSQL_TYPE_NEWDECIMAL;[R1] [C4] column_is_rowkey:false;[R1] [C4] column_is_signed:true;[R1] [C4] column_encoding:binary;[R1] [C4] column_is_not_null:false;[R1] [C4] column_value_new:[12.34](5);[R1] [C5] column_name:C4;[R1] [C5] column_type:MYSQL_TYPE_OB_NUMBER_FLOAT;[R1] [C5] column_is_rowkey:false;[R1] [C5] column_is_signed:true;[R1] [C5] column_encoding:binary;[R1] [C5] column_is_not_null:false;[R1] [C5] column_value_new:[12.34](5);[R1] [C6] column_name:C5;[R1] [C6] column_type:MYSQL_TYPE_OB_NUMBER_FLOAT;[R1] [C6] column_is_rowkey:false;[R1] [C6] column_is_signed:true;[R1] [C6] column_encoding:binary;[R1] [C6] column_is_not_null:false;[R1] [C6] column_value_new:[12.34](5);[R1] [C7] column_name:C6;[R1] [C7] column_type:MYSQL_TYPE_VAR_STRING;[R1] [C7] column_is_rowkey:false;[R1] [C7] column_is_signed:true;[R1] [C7] column_encoding:utf8mb4;[R1] [C7] column_is_not_null:false;[R1] [C7] column_value_new:[0.12](4);[R1] [C8] column_name:C7;[R1] [C8] column_type:MYSQL_TYPE_STRING;[R1] [C8] column_is_rowkey:false;[R1] [C8] column_is_signed:true;[R1] [C8] column_encoding:utf8mb4;[R1] [C8] column_is_not_null:false;[R1] [C8] column_value_new:[12.34                                                                                               ](100);$[R2] COMMIT;
insert into number_1 (c0, c6) values (79,'0.1');
ob1.oblog.next;
[R0] BEGIN;[R0] org_cluster_id:1;[R1] record_type:INSERT;[R1] database_name:oracle.OBLOG_DB;[R1] table_name:NUMBER_1;[R1] log_event:true;[R1] column_count:8;[R1] source_category:SRC_FULL_RECORDED;[R1] source_type:SRC_OCEANBASE_1_0;[R1] has_pk:true;[R1] pk_info:(0);[R1] pks:C0;[R1] has_uk:false;[R1] uk_info:(null);[R1] uks:(null);[R1] [C1] column_name:C0;[R1] [C1] column_type:MYSQL_TYPE_NEWDECIMAL;[R1] [C1] column_is_rowkey:true;[R1] [C1] column_is_signed:true;[R1] [C1] column_encoding:binary;[R1] [C1] column_is_not_null:true;[R1] [C1] column_value_new:[79](2);[R1] [C2] column_name:C1;[R1] [C2] column_type:MYSQL_TYPE_DOUBLE;[R1] [C2] column_is_rowkey:false;[R1] [C2] column_is_signed:true;[R1] [C2] column_encoding:binary;[R1] [C2] column_is_not_null:false;[R1] [C2] column_value_new:[1.234E+001](10);[R1] [C3] column_name:C2;[R1] [C3] column_type:MYSQL_TYPE_FLOAT;[R1] [C3] column_is_rowkey:false;[R1] [C3] column_is_signed:true;[R1] [C3] column_encoding:binary;[R1] [C3] column_is_not_null:false;[R1] [C3] column_value_new:[1.23400002E+001](15);[R1] [C4] column_name:C3;[R1] [C4] column_type:MYSQL_TYPE_NEWDECIMAL;[R1] [C4] column_is_rowkey:false;[R1] [C4] column_is_signed:true;[R1] [C4] column_encoding:binary;[R1] [C4] column_is_not_null:false;[R1] [C4] column_value_new:[12.34](5);[R1] [C5] column_name:C4;[R1] [C5] column_type:MYSQL_TYPE_OB_NUMBER_FLOAT;[R1] [C5] column_is_rowkey:false;[R1] [C5] column_is_signed:true;[R1] [C5] column_encoding:binary;[R1] [C5] column_is_not_null:false;[R1] [C5] column_value_new:[12.34](5);[R1] [C6] column_name:C5;[R1] [C6] column_type:MYSQL_TYPE_OB_NUMBER_FLOAT;[R1] [C6] column_is_rowkey:false;[R1] [C6] column_is_signed:true;[R1] [C6] column_encoding:binary;[R1] [C6] column_is_not_null:false;[R1] [C6] column_value_new:[12.34](5);[R1] [C7] column_name:C6;[R1] [C7] column_type:MYSQL_TYPE_VAR_STRING;[R1] [C7] column_is_rowkey:false;[R1] [C7] column_is_signed:true;[R1] [C7] column_encoding:utf8mb4;[R1] [C7] column_is_not_null:false;[R1] [C7] column_value_new:[0.1](3);[R1] [C8] column_name:C7;[R1] [C8] column_type:MYSQL_TYPE_STRING;[R1] [C8] column_is_rowkey:false;[R1] [C8] column_is_signed:true;[R1] [C8] column_encoding:utf8mb4;[R1] [C8] column_is_not_null:false;[R1] [C8] column_value_new:[12.34                                                                                               ](100);$[R2] COMMIT;
insert into number_1 (c0, c6) values (80,'1.23e30');
ob1.oblog.next;
[R0] BEGIN;[R0] org_cluster_id:1;[R1] record_type:INSERT;[R1] database_name:oracle.OBLOG_DB;[R1] table_name:NUMBER_1;[R1] log_event:true;[R1] column_count:8;[R1] source_category:SRC_FULL_RECORDED;[R1] source_type:SRC_OCEANBASE_1_0;[R1] has_pk:true;[R1] pk_info:(0);[R1] pks:C0;[R1] has_uk:false;[R1] uk_info:(null);[R1] uks:(null);[R1] [C1] column_name:C0;[R1] [C1] column_type:MYSQL_TYPE_NEWDECIMAL;[R1] [C1] column_is_rowkey:true;[R1] [C1] column_is_signed:true;[R1] [C1] column_encoding:binary;[R1] [C1] column_is_not_null:true;[R1] [C1] column_value_new:[80](2);[R1] [C2] column_name:C1;[R1] [C2] column_type:MYSQL_TYPE_DOUBLE;[R1] [C2] column_is_rowkey:false;[R1] [C2] column_is_signed:true;[R1] [C2] column_encoding:binary;[R1] [C2] column_is_not_null:false;[R1] [C2] column_value_new:[1.234E+001](10);[R1] [C3] column_name:C2;[R1] [C3] column_type:MYSQL_TYPE_FLOAT;[R1] [C3] column_is_rowkey:false;[R1] [C3] column_is_signed:true;[R1] [C3] column_encoding:binary;[R1] [C3] column_is_not_null:false;[R1] [C3] column_value_new:[1.23400002E+001](15);[R1] [C4] column_name:C3;[R1] [C4] column_type:MYSQL_TYPE_NEWDECIMAL;[R1] [C4] column_is_rowkey:false;[R1] [C4] column_is_signed:true;[R1] [C4] column_encoding:binary;[R1] [C4] column_is_not_null:false;[R1] [C4] column_value_new:[12.34](5);[R1] [C5] column_name:C4;[R1] [C5] column_type:MYSQL_TYPE_OB_NUMBER_FLOAT;[R1] [C5] column_is_rowkey:false;[R1] [C5] column_is_signed:true;[R1] [C5] column_encoding:binary;[R1] [C5] column_is_not_null:false;[R1] [C5] column_value_new:[12.34](5);[R1] [C6] column_name:C5;[R1] [C6] column_type:MYSQL_TYPE_OB_NUMBER_FLOAT;[R1] [C6] column_is_rowkey:false;[R1] [C6] column_is_signed:true;[R1] [C6] column_encoding:binary;[R1] [C6] column_is_not_null:false;[R1] [C6] column_value_new:[12.34](5);[R1] [C7] column_name:C6;[R1] [C7] column_type:MYSQL_TYPE_VAR_STRING;[R1] [C7] column_is_rowkey:false;[R1] [C7] column_is_signed:true;[R1] [C7] column_encoding:utf8mb4;[R1] [C7] column_is_not_null:false;[R1] [C7] column_value_new:[1.23e30](7);[R1] [C8] column_name:C7;[R1] [C8] column_type:MYSQL_TYPE_STRING;[R1] [C8] column_is_rowkey:false;[R1] [C8] column_is_signed:true;[R1] [C8] column_encoding:utf8mb4;[R1] [C8] column_is_not_null:false;[R1] [C8] column_value_new:[12.34                                                                                               ](100);$[R2] COMMIT;
insert into number_1 (c0, c6) values (81,'1.23e-30');
ob1.oblog.next;
[R0] BEGIN;[R0] org_cluster_id:1;[R1] record_type:INSERT;[R1] database_name:oracle.OBLOG_DB;[R1] table_name:NUMBER_1;[R1] log_event:true;[R1] column_count:8;[R1] source_category:SRC_FULL_RECORDED;[R1] source_type:SRC_OCEANBASE_1_0;[R1] has_pk:true;[R1] pk_info:(0);[R1] pks:C0;[R1] has_uk:false;[R1] uk_info:(null);[R1] uks:(null);[R1] [C1] column_name:C0;[R1] [C1] column_type:MYSQL_TYPE_NEWDECIMAL;[R1] [C1] column_is_rowkey:true;[R1] [C1] column_is_signed:true;[R1] [C1] column_encoding:binary;[R1] [C1] column_is_not_null:true;[R1] [C1] column_value_new:[81](2);[R1] [C2] column_name:C1;[R1] [C2] column_type:MYSQL_TYPE_DOUBLE;[R1] [C2] column_is_rowkey:false;[R1] [C2] column_is_signed:true;[R1] [C2] column_encoding:binary;[R1] [C2] column_is_not_null:false;[R1] [C2] column_value_new:[1.234E+001](10);[R1] [C3] column_name:C2;[R1] [C3] column_type:MYSQL_TYPE_FLOAT;[R1] [C3] column_is_rowkey:false;[R1] [C3] column_is_signed:true;[R1] [C3] column_encoding:binary;[R1] [C3] column_is_not_null:false;[R1] [C3] column_value_new:[1.23400002E+001](15);[R1] [C4] column_name:C3;[R1] [C4] column_type:MYSQL_TYPE_NEWDECIMAL;[R1] [C4] column_is_rowkey:false;[R1] [C4] column_is_signed:true;[R1] [C4] column_encoding:binary;[R1] [C4] column_is_not_null:false;[R1] [C4] column_value_new:[12.34](5);[R1] [C5] column_name:C4;[R1] [C5] column_type:MYSQL_TYPE_OB_NUMBER_FLOAT;[R1] [C5] column_is_rowkey:false;[R1] [C5] column_is_signed:true;[R1] [C5] column_encoding:binary;[R1] [C5] column_is_not_null:false;[R1] [C5] column_value_new:[12.34](5);[R1] [C6] column_name:C5;[R1] [C6] column_type:MYSQL_TYPE_OB_NUMBER_FLOAT;[R1] [C6] column_is_rowkey:false;[R1] [C6] column_is_signed:true;[R1] [C6] column_encoding:binary;[R1] [C6] column_is_not_null:false;[R1] [C6] column_value_new:[12.34](5);[R1] [C7] column_name:C6;[R1] [C7] column_type:MYSQL_TYPE_VAR_STRING;[R1] [C7] column_is_rowkey:false;[R1] [C7] column_is_signed:true;[R1] [C7] column_encoding:utf8mb4;[R1] [C7] column_is_not_null:false;[R1] [C7] column_value_new:[1.23e-30](8);[R1] [C8] column_name:C7;[R1] [C8] column_type:MYSQL_TYPE_STRING;[R1] [C8] column_is_rowkey:false;[R1] [C8] column_is_signed:true;[R1] [C8] column_encoding:utf8mb4;[R1] [C8] column_is_not_null:false;[R1] [C8] column_value_new:[12.34                                                                                               ](100);$[R2] COMMIT;
insert into number_1 (c0, c6) values (82,'1.23456789123456789123456789123456789123456789');
ob1.oblog.next;
[R0] BEGIN;[R0] org_cluster_id:1;[R1] record_type:INSERT;[R1] database_name:oracle.OBLOG_DB;[R1] table_name:NUMBER_1;[R1] log_event:true;[R1] column_count:8;[R1] source_category:SRC_FULL_RECORDED;[R1] source_type:SRC_OCEANBASE_1_0;[R1] has_pk:true;[R1] pk_info:(0);[R1] pks:C0;[R1] has_uk:false;[R1] uk_info:(null);[R1] uks:(null);[R1] [C1] column_name:C0;[R1] [C1] column_type:MYSQL_TYPE_NEWDECIMAL;[R1] [C1] column_is_rowkey:true;[R1] [C1] column_is_signed:true;[R1] [C1] column_encoding:binary;[R1] [C1] column_is_not_null:true;[R1] [C1] column_value_new:[82](2);[R1] [C2] column_name:C1;[R1] [C2] column_type:MYSQL_TYPE_DOUBLE;[R1] [C2] column_is_rowkey:false;[R1] [C2] column_is_signed:true;[R1] [C2] column_encoding:binary;[R1] [C2] column_is_not_null:false;[R1] [C2] column_value_new:[1.234E+001](10);[R1] [C3] column_name:C2;[R1] [C3] column_type:MYSQL_TYPE_FLOAT;[R1] [C3] column_is_rowkey:false;[R1] [C3] column_is_signed:true;[R1] [C3] column_encoding:binary;[R1] [C3] column_is_not_null:false;[R1] [C3] column_value_new:[1.23400002E+001](15);[R1] [C4] column_name:C3;[R1] [C4] column_type:MYSQL_TYPE_NEWDECIMAL;[R1] [C4] column_is_rowkey:false;[R1] [C4] column_is_signed:true;[R1] [C4] column_encoding:binary;[R1] [C4] column_is_not_null:false;[R1] [C4] column_value_new:[12.34](5);[R1] [C5] column_name:C4;[R1] [C5] column_type:MYSQL_TYPE_OB_NUMBER_FLOAT;[R1] [C5] column_is_rowkey:false;[R1] [C5] column_is_signed:true;[R1] [C5] column_encoding:binary;[R1] [C5] column_is_not_null:false;[R1] [C5] column_value_new:[12.34](5);[R1] [C6] column_name:C5;[R1] [C6] column_type:MYSQL_TYPE_OB_NUMBER_FLOAT;[R1] [C6] column_is_rowkey:false;[R1] [C6] column_is_signed:true;[R1] [C6] column_encoding:binary;[R1] [C6] column_is_not_null:false;[R1] [C6] column_value_new:[12.34](5);[R1] [C7] column_name:C6;[R1] [C7] column_type:MYSQL_TYPE_VAR_STRING;[R1] [C7] column_is_rowkey:false;[R1] [C7] column_is_signed:true;[R1] [C7] column_encoding:utf8mb4;[R1] [C7] column_is_not_null:false;[R1] [C7] column_value_new:[1.23456789123456789123456789123456789123456789](46);[R1] [C8] column_name:C7;[R1] [C8] column_type:MYSQL_TYPE_STRING;[R1] [C8] column_is_rowkey:false;[R1] [C8] column_is_signed:true;[R1] [C8] column_encoding:utf8mb4;[R1] [C8] column_is_not_null:false;[R1] [C8] column_value_new:[12.34                                                                                               ](100);$[R2] COMMIT;
insert into number_1 (c0, c6) values (19+100,'-0');
ob1.oblog.next;
[R0] BEGIN;[R0] org_cluster_id:1;[R1] record_type:INSERT;[R1] database_name:oracle.OBLOG_DB;[R1] table_name:NUMBER_1;[R1] log_event:true;[R1] column_count:8;[R1] source_category:SRC_FULL_RECORDED;[R1] source_type:SRC_OCEANBASE_1_0;[R1] has_pk:true;[R1] pk_info:(0);[R1] pks:C0;[R1] has_uk:false;[R1] uk_info:(null);[R1] uks:(null);[R1] [C1] column_name:C0;[R1] [C1] column_type:MYSQL_TYPE_NEWDECIMAL;[R1] [C1] column_is_rowkey:true;[R1] [C1] column_is_signed:true;[R1] [C1] column_encoding:binary;[R1] [C1] column_is_not_null:true;[R1] [C1] column_value_new:[119](3);[R1] [C2] column_name:C1;[R1] [C2] column_type:MYSQL_TYPE_DOUBLE;[R1] [C2] column_is_rowkey:false;[R1] [C2] column_is_signed:true;[R1] [C2] column_encoding:binary;[R1] [C2] column_is_not_null:false;[R1] [C2] column_value_new:[1.234E+001](10);[R1] [C3] column_name:C2;[R1] [C3] column_type:MYSQL_TYPE_FLOAT;[R1] [C3] column_is_rowkey:false;[R1] [C3] column_is_signed:true;[R1] [C3] column_encoding:binary;[R1] [C3] column_is_not_null:false;[R1] [C3] column_value_new:[1.23400002E+001](15);[R1] [C4] column_name:C3;[R1] [C4] column_type:MYSQL_TYPE_NEWDECIMAL;[R1] [C4] column_is_rowkey:false;[R1] [C4] column_is_signed:true;[R1] [C4] column_encoding:binary;[R1] [C4] column_is_not_null:false;[R1] [C4] column_value_new:[12.34](5);[R1] [C5] column_name:C4;[R1] [C5] column_type:MYSQL_TYPE_OB_NUMBER_FLOAT;[R1] [C5] column_is_rowkey:false;[R1] [C5] column_is_signed:true;[R1] [C5] column_encoding:binary;[R1] [C5] column_is_not_null:false;[R1] [C5] column_value_new:[12.34](5);[R1] [C6] column_name:C5;[R1] [C6] column_type:MYSQL_TYPE_OB_NUMBER_FLOAT;[R1] [C6] column_is_rowkey:false;[R1] [C6] column_is_signed:true;[R1] [C6] column_encoding:binary;[R1] [C6] column_is_not_null:false;[R1] [C6] column_value_new:[12.34](5);[R1] [C7] column_name:C6;[R1] [C7] column_type:MYSQL_TYPE_VAR_STRING;[R1] [C7] column_is_rowkey:false;[R1] [C7] column_is_signed:true;[R1] [C7] column_encoding:utf8mb4;[R1] [C7] column_is_not_null:false;[R1] [C7] column_value_new:[-0](2);[R1] [C8] column_name:C7;[R1] [C8] column_type:MYSQL_TYPE_STRING;[R1] [C8] column_is_rowkey:false;[R1] [C8] column_is_signed:true;[R1] [C8] column_encoding:utf8mb4;[R1] [C8] column_is_not_null:false;[R1] [C8] column_value_new:[12.34                                                                                               ](100);$[R2] COMMIT;
insert into number_1 (c0, c6) values (20+100,'-0.0');
ob1.oblog.next;
[R0] BEGIN;[R0] org_cluster_id:1;[R1] record_type:INSERT;[R1] database_name:oracle.OBLOG_DB;[R1] table_name:NUMBER_1;[R1] log_event:true;[R1] column_count:8;[R1] source_category:SRC_FULL_RECORDED;[R1] source_type:SRC_OCEANBASE_1_0;[R1] has_pk:true;[R1] pk_info:(0);[R1] pks:C0;[R1] has_uk:false;[R1] uk_info:(null);[R1] uks:(null);[R1] [C1] column_name:C0;[R1] [C1] column_type:MYSQL_TYPE_NEWDECIMAL;[R1] [C1] column_is_rowkey:true;[R1] [C1] column_is_signed:true;[R1] [C1] column_encoding:binary;[R1] [C1] column_is_not_null:true;[R1] [C1] column_value_new:[120](3);[R1] [C2] column_name:C1;[R1] [C2] column_type:MYSQL_TYPE_DOUBLE;[R1] [C2] column_is_rowkey:false;[R1] [C2] column_is_signed:true;[R1] [C2] column_encoding:binary;[R1] [C2] column_is_not_null:false;[R1] [C2] column_value_new:[1.234E+001](10);[R1] [C3] column_name:C2;[R1] [C3] column_type:MYSQL_TYPE_FLOAT;[R1] [C3] column_is_rowkey:false;[R1] [C3] column_is_signed:true;[R1] [C3] column_encoding:binary;[R1] [C3] column_is_not_null:false;[R1] [C3] column_value_new:[1.23400002E+001](15);[R1] [C4] column_name:C3;[R1] [C4] column_type:MYSQL_TYPE_NEWDECIMAL;[R1] [C4] column_is_rowkey:false;[R1] [C4] column_is_signed:true;[R1] [C4] column_encoding:binary;[R1] [C4] column_is_not_null:false;[R1] [C4] column_value_new:[12.34](5);[R1] [C5] column_name:C4;[R1] [C5] column_type:MYSQL_TYPE_OB_NUMBER_FLOAT;[R1] [C5] column_is_rowkey:false;[R1] [C5] column_is_signed:true;[R1] [C5] column_encoding:binary;[R1] [C5] column_is_not_null:false;[R1] [C5] column_value_new:[12.34](5);[R1] [C6] column_name:C5;[R1] [C6] column_type:MYSQL_TYPE_OB_NUMBER_FLOAT;[R1] [C6] column_is_rowkey:false;[R1] [C6] column_is_signed:true;[R1] [C6] column_encoding:binary;[R1] [C6] column_is_not_null:false;[R1] [C6] column_value_new:[12.34](5);[R1] [C7] column_name:C6;[R1] [C7] column_type:MYSQL_TYPE_VAR_STRING;[R1] [C7] column_is_rowkey:false;[R1] [C7] column_is_signed:true;[R1] [C7] column_encoding:utf8mb4;[R1] [C7] column_is_not_null:false;[R1] [C7] column_value_new:[-0.0](4);[R1] [C8] column_name:C7;[R1] [C8] column_type:MYSQL_TYPE_STRING;[R1] [C8] column_is_rowkey:false;[R1] [C8] column_is_signed:true;[R1] [C8] column_encoding:utf8mb4;[R1] [C8] column_is_not_null:false;[R1] [C8] column_value_new:[12.34                                                                                               ](100);$[R2] COMMIT;
insert into number_1 (c0, c6) values (21+100,'-1');
ob1.oblog.next;
[R0] BEGIN;[R0] org_cluster_id:1;[R1] record_type:INSERT;[R1] database_name:oracle.OBLOG_DB;[R1] table_name:NUMBER_1;[R1] log_event:true;[R1] column_count:8;[R1] source_category:SRC_FULL_RECORDED;[R1] source_type:SRC_OCEANBASE_1_0;[R1] has_pk:true;[R1] pk_info:(0);[R1] pks:C0;[R1] has_uk:false;[R1] uk_info:(null);[R1] uks:(null);[R1] [C1] column_name:C0;[R1] [C1] column_type:MYSQL_TYPE_NEWDECIMAL;[R1] [C1] column_is_rowkey:true;[R1] [C1] column_is_signed:true;[R1] [C1] column_encoding:binary;[R1] [C1] column_is_not_null:true;[R1] [C1] column_value_new:[121](3);[R1] [C2] column_name:C1;[R1] [C2] column_type:MYSQL_TYPE_DOUBLE;[R1] [C2] column_is_rowkey:false;[R1] [C2] column_is_signed:true;[R1] [C2] column_encoding:binary;[R1] [C2] column_is_not_null:false;[R1] [C2] column_value_new:[1.234E+001](10);[R1] [C3] column_name:C2;[R1] [C3] column_type:MYSQL_TYPE_FLOAT;[R1] [C3] column_is_rowkey:false;[R1] [C3] column_is_signed:true;[R1] [C3] column_encoding:binary;[R1] [C3] column_is_not_null:false;[R1] [C3] column_value_new:[1.23400002E+001](15);[R1] [C4] column_name:C3;[R1] [C4] column_type:MYSQL_TYPE_NEWDECIMAL;[R1] [C4] column_is_rowkey:false;[R1] [C4] column_is_signed:true;[R1] [C4] column_encoding:binary;[R1] [C4] column_is_not_null:false;[R1] [C4] column_value_new:[12.34](5);[R1] [C5] column_name:C4;[R1] [C5] column_type:MYSQL_TYPE_OB_NUMBER_FLOAT;[R1] [C5] column_is_rowkey:false;[R1] [C5] column_is_signed:true;[R1] [C5] column_encoding:binary;[R1] [C5] column_is_not_null:false;[R1] [C5] column_value_new:[12.34](5);[R1] [C6] column_name:C5;[R1] [C6] column_type:MYSQL_TYPE_OB_NUMBER_FLOAT;[R1] [C6] column_is_rowkey:false;[R1] [C6] column_is_signed:true;[R1] [C6] column_encoding:binary;[R1] [C6] column_is_not_null:false;[R1] [C6] column_value_new:[12.34](5);[R1] [C7] column_name:C6;[R1] [C7] column_type:MYSQL_TYPE_VAR_STRING;[R1] [C7] column_is_rowkey:false;[R1] [C7] column_is_signed:true;[R1] [C7] column_encoding:utf8mb4;[R1] [C7] column_is_not_null:false;[R1] [C7] column_value_new:[-1](2);[R1] [C8] column_name:C7;[R1] [C8] column_type:MYSQL_TYPE_STRING;[R1] [C8] column_is_rowkey:false;[R1] [C8] column_is_signed:true;[R1] [C8] column_encoding:utf8mb4;[R1] [C8] column_is_not_null:false;[R1] [C8] column_value_new:[12.34                                                                                               ](100);$[R2] COMMIT;
insert into number_1 (c0, c6) values (22+100,'-12');
ob1.oblog.next;
[R0] BEGIN;[R0] org_cluster_id:1;[R1] record_type:INSERT;[R1] database_name:oracle.OBLOG_DB;[R1] table_name:NUMBER_1;[R1] log_event:true;[R1] column_count:8;[R1] source_category:SRC_FULL_RECORDED;[R1] source_type:SRC_OCEANBASE_1_0;[R1] has_pk:true;[R1] pk_info:(0);[R1] pks:C0;[R1] has_uk:false;[R1] uk_info:(null);[R1] uks:(null);[R1] [C1] column_name:C0;[R1] [C1] column_type:MYSQL_TYPE_NEWDECIMAL;[R1] [C1] column_is_rowkey:true;[R1] [C1] column_is_signed:true;[R1] [C1] column_encoding:binary;[R1] [C1] column_is_not_null:true;[R1] [C1] column_value_new:[122](3);[R1] [C2] column_name:C1;[R1] [C2] column_type:MYSQL_TYPE_DOUBLE;[R1] [C2] column_is_rowkey:false;[R1] [C2] column_is_signed:true;[R1] [C2] column_encoding:binary;[R1] [C2] column_is_not_null:false;[R1] [C2] column_value_new:[1.234E+001](10);[R1] [C3] column_name:C2;[R1] [C3] column_type:MYSQL_TYPE_FLOAT;[R1] [C3] column_is_rowkey:false;[R1] [C3] column_is_signed:true;[R1] [C3] column_encoding:binary;[R1] [C3] column_is_not_null:false;[R1] [C3] column_value_new:[1.23400002E+001](15);[R1] [C4] column_name:C3;[R1] [C4] column_type:MYSQL_TYPE_NEWDECIMAL;[R1] [C4] column_is_rowkey:false;[R1] [C4] column_is_signed:true;[R1] [C4] column_encoding:binary;[R1] [C4] column_is_not_null:false;[R1] [C4] column_value_new:[12.34](5);[R1] [C5] column_name:C4;[R1] [C5] column_type:MYSQL_TYPE_OB_NUMBER_FLOAT;[R1] [C5] column_is_rowkey:false;[R1] [C5] column_is_signed:true;[R1] [C5] column_encoding:binary;[R1] [C5] column_is_not_null:false;[R1] [C5] column_value_new:[12.34](5);[R1] [C6] column_name:C5;[R1] [C6] column_type:MYSQL_TYPE_OB_NUMBER_FLOAT;[R1] [C6] column_is_rowkey:false;[R1] [C6] column_is_signed:true;[R1] [C6] column_encoding:binary;[R1] [C6] column_is_not_null:false;[R1] [C6] column_value_new:[12.34](5);[R1] [C7] column_name:C6;[R1] [C7] column_type:MYSQL_TYPE_VAR_STRING;[R1] [C7] column_is_rowkey:false;[R1] [C7] column_is_signed:true;[R1] [C7] column_encoding:utf8mb4;[R1] [C7] column_is_not_null:false;[R1] [C7] column_value_new:[-12](3);[R1] [C8] column_name:C7;[R1] [C8] column_type:MYSQL_TYPE_STRING;[R1] [C8] column_is_rowkey:false;[R1] [C8] column_is_signed:true;[R1] [C8] column_encoding:utf8mb4;[R1] [C8] column_is_not_null:false;[R1] [C8] column_value_new:[12.34                                                                                               ](100);$[R2] COMMIT;
insert into number_1 (c0, c6) values (23+100,'-123');
ob1.oblog.next;
[R0] BEGIN;[R0] org_cluster_id:1;[R1] record_type:INSERT;[R1] database_name:oracle.OBLOG_DB;[R1] table_name:NUMBER_1;[R1] log_event:true;[R1] column_count:8;[R1] source_category:SRC_FULL_RECORDED;[R1] source_type:SRC_OCEANBASE_1_0;[R1] has_pk:true;[R1] pk_info:(0);[R1] pks:C0;[R1] has_uk:false;[R1] uk_info:(null);[R1] uks:(null);[R1] [C1] column_name:C0;[R1] [C1] column_type:MYSQL_TYPE_NEWDECIMAL;[R1] [C1] column_is_rowkey:true;[R1] [C1] column_is_signed:true;[R1] [C1] column_encoding:binary;[R1] [C1] column_is_not_null:true;[R1] [C1] column_value_new:[123](3);[R1] [C2] column_name:C1;[R1] [C2] column_type:MYSQL_TYPE_DOUBLE;[R1] [C2] column_is_rowkey:false;[R1] [C2] column_is_signed:true;[R1] [C2] column_encoding:binary;[R1] [C2] column_is_not_null:false;[R1] [C2] column_value_new:[1.234E+001](10);[R1] [C3] column_name:C2;[R1] [C3] column_type:MYSQL_TYPE_FLOAT;[R1] [C3] column_is_rowkey:false;[R1] [C3] column_is_signed:true;[R1] [C3] column_encoding:binary;[R1] [C3] column_is_not_null:false;[R1] [C3] column_value_new:[1.23400002E+001](15);[R1] [C4] column_name:C3;[R1] [C4] column_type:MYSQL_TYPE_NEWDECIMAL;[R1] [C4] column_is_rowkey:false;[R1] [C4] column_is_signed:true;[R1] [C4] column_encoding:binary;[R1] [C4] column_is_not_null:false;[R1] [C4] column_value_new:[12.34](5);[R1] [C5] column_name:C4;[R1] [C5] column_type:MYSQL_TYPE_OB_NUMBER_FLOAT;[R1] [C5] column_is_rowkey:false;[R1] [C5] column_is_signed:true;[R1] [C5] column_encoding:binary;[R1] [C5] column_is_not_null:false;[R1] [C5] column_value_new:[12.34](5);[R1] [C6] column_name:C5;[R1] [C6] column_type:MYSQL_TYPE_OB_NUMBER_FLOAT;[R1] [C6] column_is_rowkey:false;[R1] [C6] column_is_signed:true;[R1] [C6] column_encoding:binary;[R1] [C6] column_is_not_null:false;[R1] [C6] column_value_new:[12.34](5);[R1] [C7] column_name:C6;[R1] [C7] column_type:MYSQL_TYPE_VAR_STRING;[R1] [C7] column_is_rowkey:false;[R1] [C7] column_is_signed:true;[R1] [C7] column_encoding:utf8mb4;[R1] [C7] column_is_not_null:false;[R1] [C7] column_value_new:[-123](4);[R1] [C8] column_name:C7;[R1] [C8] column_type:MYSQL_TYPE_STRING;[R1] [C8] column_is_rowkey:false;[R1] [C8] column_is_signed:true;[R1] [C8] column_encoding:utf8mb4;[R1] [C8] column_is_not_null:false;[R1] [C8] column_value_new:[12.34                                                                                               ](100);$[R2] COMMIT;
insert into number_1 (c0, c6) values (24+100,'-1234');
ob1.oblog.next;
[R0] BEGIN;[R0] org_cluster_id:1;[R1] record_type:INSERT;[R1] database_name:oracle.OBLOG_DB;[R1] table_name:NUMBER_1;[R1] log_event:true;[R1] column_count:8;[R1] source_category:SRC_FULL_RECORDED;[R1] source_type:SRC_OCEANBASE_1_0;[R1] has_pk:true;[R1] pk_info:(0);[R1] pks:C0;[R1] has_uk:false;[R1] uk_info:(null);[R1] uks:(null);[R1] [C1] column_name:C0;[R1] [C1] column_type:MYSQL_TYPE_NEWDECIMAL;[R1] [C1] column_is_rowkey:true;[R1] [C1] column_is_signed:true;[R1] [C1] column_encoding:binary;[R1] [C1] column_is_not_null:true;[R1] [C1] column_value_new:[124](3);[R1] [C2] column_name:C1;[R1] [C2] column_type:MYSQL_TYPE_DOUBLE;[R1] [C2] column_is_rowkey:false;[R1] [C2] column_is_signed:true;[R1] [C2] column_encoding:binary;[R1] [C2] column_is_not_null:false;[R1] [C2] column_value_new:[1.234E+001](10);[R1] [C3] column_name:C2;[R1] [C3] column_type:MYSQL_TYPE_FLOAT;[R1] [C3] column_is_rowkey:false;[R1] [C3] column_is_signed:true;[R1] [C3] column_encoding:binary;[R1] [C3] column_is_not_null:false;[R1] [C3] column_value_new:[1.23400002E+001](15);[R1] [C4] column_name:C3;[R1] [C4] column_type:MYSQL_TYPE_NEWDECIMAL;[R1] [C4] column_is_rowkey:false;[R1] [C4] column_is_signed:true;[R1] [C4] column_encoding:binary;[R1] [C4] column_is_not_null:false;[R1] [C4] column_value_new:[12.34](5);[R1] [C5] column_name:C4;[R1] [C5] column_type:MYSQL_TYPE_OB_NUMBER_FLOAT;[R1] [C5] column_is_rowkey:false;[R1] [C5] column_is_signed:true;[R1] [C5] column_encoding:binary;[R1] [C5] column_is_not_null:false;[R1] [C5] column_value_new:[12.34](5);[R1] [C6] column_name:C5;[R1] [C6] column_type:MYSQL_TYPE_OB_NUMBER_FLOAT;[R1] [C6] column_is_rowkey:false;[R1] [C6] column_is_signed:true;[R1] [C6] column_encoding:binary;[R1] [C6] column_is_not_null:false;[R1] [C6] column_value_new:[12.34](5);[R1] [C7] column_name:C6;[R1] [C7] column_type:MYSQL_TYPE_VAR_STRING;[R1] [C7] column_is_rowkey:false;[R1] [C7] column_is_signed:true;[R1] [C7] column_encoding:utf8mb4;[R1] [C7] column_is_not_null:false;[R1] [C7] column_value_new:[-1234](5);[R1] [C8] column_name:C7;[R1] [C8] column_type:MYSQL_TYPE_STRING;[R1] [C8] column_is_rowkey:false;[R1] [C8] column_is_signed:true;[R1] [C8] column_encoding:utf8mb4;[R1] [C8] column_is_not_null:false;[R1] [C8] column_value_new:[12.34                                                                                               ](100);$[R2] COMMIT;
insert into number_1 (c0, c6) values (25+100,'-12345');
ob1.oblog.next;
[R0] BEGIN;[R0] org_cluster_id:1;[R1] record_type:INSERT;[R1] database_name:oracle.OBLOG_DB;[R1] table_name:NUMBER_1;[R1] log_event:true;[R1] column_count:8;[R1] source_category:SRC_FULL_RECORDED;[R1] source_type:SRC_OCEANBASE_1_0;[R1] has_pk:true;[R1] pk_info:(0);[R1] pks:C0;[R1] has_uk:false;[R1] uk_info:(null);[R1] uks:(null);[R1] [C1] column_name:C0;[R1] [C1] column_type:MYSQL_TYPE_NEWDECIMAL;[R1] [C1] column_is_rowkey:true;[R1] [C1] column_is_signed:true;[R1] [C1] column_encoding:binary;[R1] [C1] column_is_not_null:true;[R1] [C1] column_value_new:[125](3);[R1] [C2] column_name:C1;[R1] [C2] column_type:MYSQL_TYPE_DOUBLE;[R1] [C2] column_is_rowkey:false;[R1] [C2] column_is_signed:true;[R1] [C2] column_encoding:binary;[R1] [C2] column_is_not_null:false;[R1] [C2] column_value_new:[1.234E+001](10);[R1] [C3] column_name:C2;[R1] [C3] column_type:MYSQL_TYPE_FLOAT;[R1] [C3] column_is_rowkey:false;[R1] [C3] column_is_signed:true;[R1] [C3] column_encoding:binary;[R1] [C3] column_is_not_null:false;[R1] [C3] column_value_new:[1.23400002E+001](15);[R1] [C4] column_name:C3;[R1] [C4] column_type:MYSQL_TYPE_NEWDECIMAL;[R1] [C4] column_is_rowkey:false;[R1] [C4] column_is_signed:true;[R1] [C4] column_encoding:binary;[R1] [C4] column_is_not_null:false;[R1] [C4] column_value_new:[12.34](5);[R1] [C5] column_name:C4;[R1] [C5] column_type:MYSQL_TYPE_OB_NUMBER_FLOAT;[R1] [C5] column_is_rowkey:false;[R1] [C5] column_is_signed:true;[R1] [C5] column_encoding:binary;[R1] [C5] column_is_not_null:false;[R1] [C5] column_value_new:[12.34](5);[R1] [C6] column_name:C5;[R1] [C6] column_type:MYSQL_TYPE_OB_NUMBER_FLOAT;[R1] [C6] column_is_rowkey:false;[R1] [C6] column_is_signed:true;[R1] [C6] column_encoding:binary;[R1] [C6] column_is_not_null:false;[R1] [C6] column_value_new:[12.34](5);[R1] [C7] column_name:C6;[R1] [C7] column_type:MYSQL_TYPE_VAR_STRING;[R1] [C7] column_is_rowkey:false;[R1] [C7] column_is_signed:true;[R1] [C7] column_encoding:utf8mb4;[R1] [C7] column_is_not_null:false;[R1] [C7] column_value_new:[-12345](6);[R1] [C8] column_name:C7;[R1] [C8] column_type:MYSQL_TYPE_STRING;[R1] [C8] column_is_rowkey:false;[R1] [C8] column_is_signed:true;[R1] [C8] column_encoding:utf8mb4;[R1] [C8] column_is_not_null:false;[R1] [C8] column_value_new:[12.34                                                                                               ](100);$[R2] COMMIT;
insert into number_1 (c0, c6) values (26+100,'-123456');
ob1.oblog.next;
[R0] BEGIN;[R0] org_cluster_id:1;[R1] record_type:INSERT;[R1] database_name:oracle.OBLOG_DB;[R1] table_name:NUMBER_1;[R1] log_event:true;[R1] column_count:8;[R1] source_category:SRC_FULL_RECORDED;[R1] source_type:SRC_OCEANBASE_1_0;[R1] has_pk:true;[R1] pk_info:(0);[R1] pks:C0;[R1] has_uk:false;[R1] uk_info:(null);[R1] uks:(null);[R1] [C1] column_name:C0;[R1] [C1] column_type:MYSQL_TYPE_NEWDECIMAL;[R1] [C1] column_is_rowkey:true;[R1] [C1] column_is_signed:true;[R1] [C1] column_encoding:binary;[R1] [C1] column_is_not_null:true;[R1] [C1] column_value_new:[126](3);[R1] [C2] column_name:C1;[R1] [C2] column_type:MYSQL_TYPE_DOUBLE;[R1] [C2] column_is_rowkey:false;[R1] [C2] column_is_signed:true;[R1] [C2] column_encoding:binary;[R1] [C2] column_is_not_null:false;[R1] [C2] column_value_new:[1.234E+001](10);[R1] [C3] column_name:C2;[R1] [C3] column_type:MYSQL_TYPE_FLOAT;[R1] [C3] column_is_rowkey:false;[R1] [C3] column_is_signed:true;[R1] [C3] column_encoding:binary;[R1] [C3] column_is_not_null:false;[R1] [C3] column_value_new:[1.23400002E+001](15);[R1] [C4] column_name:C3;[R1] [C4] column_type:MYSQL_TYPE_NEWDECIMAL;[R1] [C4] column_is_rowkey:false;[R1] [C4] column_is_signed:true;[R1] [C4] column_encoding:binary;[R1] [C4] column_is_not_null:false;[R1] [C4] column_value_new:[12.34](5);[R1] [C5] column_name:C4;[R1] [C5] column_type:MYSQL_TYPE_OB_NUMBER_FLOAT;[R1] [C5] column_is_rowkey:false;[R1] [C5] column_is_signed:true;[R1] [C5] column_encoding:binary;[R1] [C5] column_is_not_null:false;[R1] [C5] column_value_new:[12.34](5);[R1] [C6] column_name:C5;[R1] [C6] column_type:MYSQL_TYPE_OB_NUMBER_FLOAT;[R1] [C6] column_is_rowkey:false;[R1] [C6] column_is_signed:true;[R1] [C6] column_encoding:binary;[R1] [C6] column_is_not_null:false;[R1] [C6] column_value_new:[12.34](5);[R1] [C7] column_name:C6;[R1] [C7] column_type:MYSQL_TYPE_VAR_STRING;[R1] [C7] column_is_rowkey:false;[R1] [C7] column_is_signed:true;[R1] [C7] column_encoding:utf8mb4;[R1] [C7] column_is_not_null:false;[R1] [C7] column_value_new:[-123456](7);[R1] [C8] column_name:C7;[R1] [C8] column_type:MYSQL_TYPE_STRING;[R1] [C8] column_is_rowkey:false;[R1] [C8] column_is_signed:true;[R1] [C8] column_encoding:utf8mb4;[R1] [C8] column_is_not_null:false;[R1] [C8] column_value_new:[12.34                                                                                               ](100);$[R2] COMMIT;
insert into number_1 (c0, c6) values (27+100,'-1234567');
ob1.oblog.next;
[R0] BEGIN;[R0] org_cluster_id:1;[R1] record_type:INSERT;[R1] database_name:oracle.OBLOG_DB;[R1] table_name:NUMBER_1;[R1] log_event:true;[R1] column_count:8;[R1] source_category:SRC_FULL_RECORDED;[R1] source_type:SRC_OCEANBASE_1_0;[R1] has_pk:true;[R1] pk_info:(0);[R1] pks:C0;[R1] has_uk:false;[R1] uk_info:(null);[R1] uks:(null);[R1] [C1] column_name:C0;[R1] [C1] column_type:MYSQL_TYPE_NEWDECIMAL;[R1] [C1] column_is_rowkey:true;[R1] [C1] column_is_signed:true;[R1] [C1] column_encoding:binary;[R1] [C1] column_is_not_null:true;[R1] [C1] column_value_new:[127](3);[R1] [C2] column_name:C1;[R1] [C2] column_type:MYSQL_TYPE_DOUBLE;[R1] [C2] column_is_rowkey:false;[R1] [C2] column_is_signed:true;[R1] [C2] column_encoding:binary;[R1] [C2] column_is_not_null:false;[R1] [C2] column_value_new:[1.234E+001](10);[R1] [C3] column_name:C2;[R1] [C3] column_type:MYSQL_TYPE_FLOAT;[R1] [C3] column_is_rowkey:false;[R1] [C3] column_is_signed:true;[R1] [C3] column_encoding:binary;[R1] [C3] column_is_not_null:false;[R1] [C3] column_value_new:[1.23400002E+001](15);[R1] [C4] column_name:C3;[R1] [C4] column_type:MYSQL_TYPE_NEWDECIMAL;[R1] [C4] column_is_rowkey:false;[R1] [C4] column_is_signed:true;[R1] [C4] column_encoding:binary;[R1] [C4] column_is_not_null:false;[R1] [C4] column_value_new:[12.34](5);[R1] [C5] column_name:C4;[R1] [C5] column_type:MYSQL_TYPE_OB_NUMBER_FLOAT;[R1] [C5] column_is_rowkey:false;[R1] [C5] column_is_signed:true;[R1] [C5] column_encoding:binary;[R1] [C5] column_is_not_null:false;[R1] [C5] column_value_new:[12.34](5);[R1] [C6] column_name:C5;[R1] [C6] column_type:MYSQL_TYPE_OB_NUMBER_FLOAT;[R1] [C6] column_is_rowkey:false;[R1] [C6] column_is_signed:true;[R1] [C6] column_encoding:binary;[R1] [C6] column_is_not_null:false;[R1] [C6] column_value_new:[12.34](5);[R1] [C7] column_name:C6;[R1] [C7] column_type:MYSQL_TYPE_VAR_STRING;[R1] [C7] column_is_rowkey:false;[R1] [C7] column_is_signed:true;[R1] [C7] column_encoding:utf8mb4;[R1] [C7] column_is_not_null:false;[R1] [C7] column_value_new:[-1234567](8);[R1] [C8] column_name:C7;[R1] [C8] column_type:MYSQL_TYPE_STRING;[R1] [C8] column_is_rowkey:false;[R1] [C8] column_is_signed:true;[R1] [C8] column_encoding:utf8mb4;[R1] [C8] column_is_not_null:false;[R1] [C8] column_value_new:[12.34                                                                                               ](100);$[R2] COMMIT;
insert into number_1 (c0, c6) values (28+100,'-12345678');
ob1.oblog.next;
[R0] BEGIN;[R0] org_cluster_id:1;[R1] record_type:INSERT;[R1] database_name:oracle.OBLOG_DB;[R1] table_name:NUMBER_1;[R1] log_event:true;[R1] column_count:8;[R1] source_category:SRC_FULL_RECORDED;[R1] source_type:SRC_OCEANBASE_1_0;[R1] has_pk:true;[R1] pk_info:(0);[R1] pks:C0;[R1] has_uk:false;[R1] uk_info:(null);[R1] uks:(null);[R1] [C1] column_name:C0;[R1] [C1] column_type:MYSQL_TYPE_NEWDECIMAL;[R1] [C1] column_is_rowkey:true;[R1] [C1] column_is_signed:true;[R1] [C1] column_encoding:binary;[R1] [C1] column_is_not_null:true;[R1] [C1] column_value_new:[128](3);[R1] [C2] column_name:C1;[R1] [C2] column_type:MYSQL_TYPE_DOUBLE;[R1] [C2] column_is_rowkey:false;[R1] [C2] column_is_signed:true;[R1] [C2] column_encoding:binary;[R1] [C2] column_is_not_null:false;[R1] [C2] column_value_new:[1.234E+001](10);[R1] [C3] column_name:C2;[R1] [C3] column_type:MYSQL_TYPE_FLOAT;[R1] [C3] column_is_rowkey:false;[R1] [C3] column_is_signed:true;[R1] [C3] column_encoding:binary;[R1] [C3] column_is_not_null:false;[R1] [C3] column_value_new:[1.23400002E+001](15);[R1] [C4] column_name:C3;[R1] [C4] column_type:MYSQL_TYPE_NEWDECIMAL;[R1] [C4] column_is_rowkey:false;[R1] [C4] column_is_signed:true;[R1] [C4] column_encoding:binary;[R1] [C4] column_is_not_null:false;[R1] [C4] column_value_new:[12.34](5);[R1] [C5] column_name:C4;[R1] [C5] column_type:MYSQL_TYPE_OB_NUMBER_FLOAT;[R1] [C5] column_is_rowkey:false;[R1] [C5] column_is_signed:true;[R1] [C5] column_encoding:binary;[R1] [C5] column_is_not_null:false;[R1] [C5] column_value_new:[12.34](5);[R1] [C6] column_name:C5;[R1] [C6] column_type:MYSQL_TYPE_OB_NUMBER_FLOAT;[R1] [C6] column_is_rowkey:false;[R1] [C6] column_is_signed:true;[R1] [C6] column_encoding:binary;[R1] [C6] column_is_not_null:false;[R1] [C6] column_value_new:[12.34](5);[R1] [C7] column_name:C6;[R1] [C7] column_type:MYSQL_TYPE_VAR_STRING;[R1] [C7] column_is_rowkey:false;[R1] [C7] column_is_signed:true;[R1] [C7] column_encoding:utf8mb4;[R1] [C7] column_is_not_null:false;[R1] [C7] column_value_new:[-12345678](9);[R1] [C8] column_name:C7;[R1] [C8] column_type:MYSQL_TYPE_STRING;[R1] [C8] column_is_rowkey:false;[R1] [C8] column_is_signed:true;[R1] [C8] column_encoding:utf8mb4;[R1] [C8] column_is_not_null:false;[R1] [C8] column_value_new:[12.34                                                                                               ](100);$[R2] COMMIT;
insert into number_1 (c0, c6) values (29+100,'-123456789');
ob1.oblog.next;
[R0] BEGIN;[R0] org_cluster_id:1;[R1] record_type:INSERT;[R1] database_name:oracle.OBLOG_DB;[R1] table_name:NUMBER_1;[R1] log_event:true;[R1] column_count:8;[R1] source_category:SRC_FULL_RECORDED;[R1] source_type:SRC_OCEANBASE_1_0;[R1] has_pk:true;[R1] pk_info:(0);[R1] pks:C0;[R1] has_uk:false;[R1] uk_info:(null);[R1] uks:(null);[R1] [C1] column_name:C0;[R1] [C1] column_type:MYSQL_TYPE_NEWDECIMAL;[R1] [C1] column_is_rowkey:true;[R1] [C1] column_is_signed:true;[R1] [C1] column_encoding:binary;[R1] [C1] column_is_not_null:true;[R1] [C1] column_value_new:[129](3);[R1] [C2] column_name:C1;[R1] [C2] column_type:MYSQL_TYPE_DOUBLE;[R1] [C2] column_is_rowkey:false;[R1] [C2] column_is_signed:true;[R1] [C2] column_encoding:binary;[R1] [C2] column_is_not_null:false;[R1] [C2] column_value_new:[1.234E+001](10);[R1] [C3] column_name:C2;[R1] [C3] column_type:MYSQL_TYPE_FLOAT;[R1] [C3] column_is_rowkey:false;[R1] [C3] column_is_signed:true;[R1] [C3] column_encoding:binary;[R1] [C3] column_is_not_null:false;[R1] [C3] column_value_new:[1.23400002E+001](15);[R1] [C4] column_name:C3;[R1] [C4] column_type:MYSQL_TYPE_NEWDECIMAL;[R1] [C4] column_is_rowkey:false;[R1] [C4] column_is_signed:true;[R1] [C4] column_encoding:binary;[R1] [C4] column_is_not_null:false;[R1] [C4] column_value_new:[12.34](5);[R1] [C5] column_name:C4;[R1] [C5] column_type:MYSQL_TYPE_OB_NUMBER_FLOAT;[R1] [C5] column_is_rowkey:false;[R1] [C5] column_is_signed:true;[R1] [C5] column_encoding:binary;[R1] [C5] column_is_not_null:false;[R1] [C5] column_value_new:[12.34](5);[R1] [C6] column_name:C5;[R1] [C6] column_type:MYSQL_TYPE_OB_NUMBER_FLOAT;[R1] [C6] column_is_rowkey:false;[R1] [C6] column_is_signed:true;[R1] [C6] column_encoding:binary;[R1] [C6] column_is_not_null:false;[R1] [C6] column_value_new:[12.34](5);[R1] [C7] column_name:C6;[R1] [C7] column_type:MYSQL_TYPE_VAR_STRING;[R1] [C7] column_is_rowkey:false;[R1] [C7] column_is_signed:true;[R1] [C7] column_encoding:utf8mb4;[R1] [C7] column_is_not_null:false;[R1] [C7] column_value_new:[-123456789](10);[R1] [C8] column_name:C7;[R1] [C8] column_type:MYSQL_TYPE_STRING;[R1] [C8] column_is_rowkey:false;[R1] [C8] column_is_signed:true;[R1] [C8] column_encoding:utf8mb4;[R1] [C8] column_is_not_null:false;[R1] [C8] column_value_new:[12.34                                                                                               ](100);$[R2] COMMIT;
insert into number_1 (c0, c6) values (30+100,'-1234567890');
ob1.oblog.next;
[R0] BEGIN;[R0] org_cluster_id:1;[R1] record_type:INSERT;[R1] database_name:oracle.OBLOG_DB;[R1] table_name:NUMBER_1;[R1] log_event:true;[R1] column_count:8;[R1] source_category:SRC_FULL_RECORDED;[R1] source_type:SRC_OCEANBASE_1_0;[R1] has_pk:true;[R1] pk_info:(0);[R1] pks:C0;[R1] has_uk:false;[R1] uk_info:(null);[R1] uks:(null);[R1] [C1] column_name:C0;[R1] [C1] column_type:MYSQL_TYPE_NEWDECIMAL;[R1] [C1] column_is_rowkey:true;[R1] [C1] column_is_signed:true;[R1] [C1] column_encoding:binary;[R1] [C1] column_is_not_null:true;[R1] [C1] column_value_new:[130](3);[R1] [C2] column_name:C1;[R1] [C2] column_type:MYSQL_TYPE_DOUBLE;[R1] [C2] column_is_rowkey:false;[R1] [C2] column_is_signed:true;[R1] [C2] column_encoding:binary;[R1] [C2] column_is_not_null:false;[R1] [C2] column_value_new:[1.234E+001](10);[R1] [C3] column_name:C2;[R1] [C3] column_type:MYSQL_TYPE_FLOAT;[R1] [C3] column_is_rowkey:false;[R1] [C3] column_is_signed:true;[R1] [C3] column_encoding:binary;[R1] [C3] column_is_not_null:false;[R1] [C3] column_value_new:[1.23400002E+001](15);[R1] [C4] column_name:C3;[R1] [C4] column_type:MYSQL_TYPE_NEWDECIMAL;[R1] [C4] column_is_rowkey:false;[R1] [C4] column_is_signed:true;[R1] [C4] column_encoding:binary;[R1] [C4] column_is_not_null:false;[R1] [C4] column_value_new:[12.34](5);[R1] [C5] column_name:C4;[R1] [C5] column_type:MYSQL_TYPE_OB_NUMBER_FLOAT;[R1] [C5] column_is_rowkey:false;[R1] [C5] column_is_signed:true;[R1] [C5] column_encoding:binary;[R1] [C5] column_is_not_null:false;[R1] [C5] column_value_new:[12.34](5);[R1] [C6] column_name:C5;[R1] [C6] column_type:MYSQL_TYPE_OB_NUMBER_FLOAT;[R1] [C6] column_is_rowkey:false;[R1] [C6] column_is_signed:true;[R1] [C6] column_encoding:binary;[R1] [C6] column_is_not_null:false;[R1] [C6] column_value_new:[12.34](5);[R1] [C7] column_name:C6;[R1] [C7] column_type:MYSQL_TYPE_VAR_STRING;[R1] [C7] column_is_rowkey:false;[R1] [C7] column_is_signed:true;[R1] [C7] column_encoding:utf8mb4;[R1] [C7] column_is_not_null:false;[R1] [C7] column_value_new:[-1234567890](11);[R1] [C8] column_name:C7;[R1] [C8] column_type:MYSQL_TYPE_STRING;[R1] [C8] column_is_rowkey:false;[R1] [C8] column_is_signed:true;[R1] [C8] column_encoding:utf8mb4;[R1] [C8] column_is_not_null:false;[R1] [C8] column_value_new:[12.34                                                                                               ](100);$[R2] COMMIT;
insert into number_1 (c0, c6) values (31+100,'-12345678901');
ob1.oblog.next;
[R0] BEGIN;[R0] org_cluster_id:1;[R1] record_type:INSERT;[R1] database_name:oracle.OBLOG_DB;[R1] table_name:NUMBER_1;[R1] log_event:true;[R1] column_count:8;[R1] source_category:SRC_FULL_RECORDED;[R1] source_type:SRC_OCEANBASE_1_0;[R1] has_pk:true;[R1] pk_info:(0);[R1] pks:C0;[R1] has_uk:false;[R1] uk_info:(null);[R1] uks:(null);[R1] [C1] column_name:C0;[R1] [C1] column_type:MYSQL_TYPE_NEWDECIMAL;[R1] [C1] column_is_rowkey:true;[R1] [C1] column_is_signed:true;[R1] [C1] column_encoding:binary;[R1] [C1] column_is_not_null:true;[R1] [C1] column_value_new:[131](3);[R1] [C2] column_name:C1;[R1] [C2] column_type:MYSQL_TYPE_DOUBLE;[R1] [C2] column_is_rowkey:false;[R1] [C2] column_is_signed:true;[R1] [C2] column_encoding:binary;[R1] [C2] column_is_not_null:false;[R1] [C2] column_value_new:[1.234E+001](10);[R1] [C3] column_name:C2;[R1] [C3] column_type:MYSQL_TYPE_FLOAT;[R1] [C3] column_is_rowkey:false;[R1] [C3] column_is_signed:true;[R1] [C3] column_encoding:binary;[R1] [C3] column_is_not_null:false;[R1] [C3] column_value_new:[1.23400002E+001](15);[R1] [C4] column_name:C3;[R1] [C4] column_type:MYSQL_TYPE_NEWDECIMAL;[R1] [C4] column_is_rowkey:false;[R1] [C4] column_is_signed:true;[R1] [C4] column_encoding:binary;[R1] [C4] column_is_not_null:false;[R1] [C4] column_value_new:[12.34](5);[R1] [C5] column_name:C4;[R1] [C5] column_type:MYSQL_TYPE_OB_NUMBER_FLOAT;[R1] [C5] column_is_rowkey:false;[R1] [C5] column_is_signed:true;[R1] [C5] column_encoding:binary;[R1] [C5] column_is_not_null:false;[R1] [C5] column_value_new:[12.34](5);[R1] [C6] column_name:C5;[R1] [C6] column_type:MYSQL_TYPE_OB_NUMBER_FLOAT;[R1] [C6] column_is_rowkey:false;[R1] [C6] column_is_signed:true;[R1] [C6] column_encoding:binary;[R1] [C6] column_is_not_null:false;[R1] [C6] column_value_new:[12.34](5);[R1] [C7] column_name:C6;[R1] [C7] column_type:MYSQL_TYPE_VAR_STRING;[R1] [C7] column_is_rowkey:false;[R1] [C7] column_is_signed:true;[R1] [C7] column_encoding:utf8mb4;[R1] [C7] column_is_not_null:false;[R1] [C7] column_value_new:[-12345678901](12);[R1] [C8] column_name:C7;[R1] [C8] column_type:MYSQL_TYPE_STRING;[R1] [C8] column_is_rowkey:false;[R1] [C8] column_is_signed:true;[R1] [C8] column_encoding:utf8mb4;[R1] [C8] column_is_not_null:false;[R1] [C8] column_value_new:[12.34                                                                                               ](100);$[R2] COMMIT;
insert into number_1 (c0, c6) values (32+100,'-123456789012');
ob1.oblog.next;
[R0] BEGIN;[R0] org_cluster_id:1;[R1] record_type:INSERT;[R1] database_name:oracle.OBLOG_DB;[R1] table_name:NUMBER_1;[R1] log_event:true;[R1] column_count:8;[R1] source_category:SRC_FULL_RECORDED;[R1] source_type:SRC_OCEANBASE_1_0;[R1] has_pk:true;[R1] pk_info:(0);[R1] pks:C0;[R1] has_uk:false;[R1] uk_info:(null);[R1] uks:(null);[R1] [C1] column_name:C0;[R1] [C1] column_type:MYSQL_TYPE_NEWDECIMAL;[R1] [C1] column_is_rowkey:true;[R1] [C1] column_is_signed:true;[R1] [C1] column_encoding:binary;[R1] [C1] column_is_not_null:true;[R1] [C1] column_value_new:[132](3);[R1] [C2] column_name:C1;[R1] [C2] column_type:MYSQL_TYPE_DOUBLE;[R1] [C2] column_is_rowkey:false;[R1] [C2] column_is_signed:true;[R1] [C2] column_encoding:binary;[R1] [C2] column_is_not_null:false;[R1] [C2] column_value_new:[1.234E+001](10);[R1] [C3] column_name:C2;[R1] [C3] column_type:MYSQL_TYPE_FLOAT;[R1] [C3] column_is_rowkey:false;[R1] [C3] column_is_signed:true;[R1] [C3] column_encoding:binary;[R1] [C3] column_is_not_null:false;[R1] [C3] column_value_new:[1.23400002E+001](15);[R1] [C4] column_name:C3;[R1] [C4] column_type:MYSQL_TYPE_NEWDECIMAL;[R1] [C4] column_is_rowkey:false;[R1] [C4] column_is_signed:true;[R1] [C4] column_encoding:binary;[R1] [C4] column_is_not_null:false;[R1] [C4] column_value_new:[12.34](5);[R1] [C5] column_name:C4;[R1] [C5] column_type:MYSQL_TYPE_OB_NUMBER_FLOAT;[R1] [C5] column_is_rowkey:false;[R1] [C5] column_is_signed:true;[R1] [C5] column_encoding:binary;[R1] [C5] column_is_not_null:false;[R1] [C5] column_value_new:[12.34](5);[R1] [C6] column_name:C5;[R1] [C6] column_type:MYSQL_TYPE_OB_NUMBER_FLOAT;[R1] [C6] column_is_rowkey:false;[R1] [C6] column_is_signed:true;[R1] [C6] column_encoding:binary;[R1] [C6] column_is_not_null:false;[R1] [C6] column_value_new:[12.34](5);[R1] [C7] column_name:C6;[R1] [C7] column_type:MYSQL_TYPE_VAR_STRING;[R1] [C7] column_is_rowkey:false;[R1] [C7] column_is_signed:true;[R1] [C7] column_encoding:utf8mb4;[R1] [C7] column_is_not_null:false;[R1] [C7] column_value_new:[-123456789012](13);[R1] [C8] column_name:C7;[R1] [C8] column_type:MYSQL_TYPE_STRING;[R1] [C8] column_is_rowkey:false;[R1] [C8] column_is_signed:true;[R1] [C8] column_encoding:utf8mb4;[R1] [C8] column_is_not_null:false;[R1] [C8] column_value_new:[12.34                                                                                               ](100);$[R2] COMMIT;
insert into number_1 (c0, c6) values (33+100,'-1234567890123');
ob1.oblog.next;
[R0] BEGIN;[R0] org_cluster_id:1;[R1] record_type:INSERT;[R1] database_name:oracle.OBLOG_DB;[R1] table_name:NUMBER_1;[R1] log_event:true;[R1] column_count:8;[R1] source_category:SRC_FULL_RECORDED;[R1] source_type:SRC_OCEANBASE_1_0;[R1] has_pk:true;[R1] pk_info:(0);[R1] pks:C0;[R1] has_uk:false;[R1] uk_info:(null);[R1] uks:(null);[R1] [C1] column_name:C0;[R1] [C1] column_type:MYSQL_TYPE_NEWDECIMAL;[R1] [C1] column_is_rowkey:true;[R1] [C1] column_is_signed:true;[R1] [C1] column_encoding:binary;[R1] [C1] column_is_not_null:true;[R1] [C1] column_value_new:[133](3);[R1] [C2] column_name:C1;[R1] [C2] column_type:MYSQL_TYPE_DOUBLE;[R1] [C2] column_is_rowkey:false;[R1] [C2] column_is_signed:true;[R1] [C2] column_encoding:binary;[R1] [C2] column_is_not_null:false;[R1] [C2] column_value_new:[1.234E+001](10);[R1] [C3] column_name:C2;[R1] [C3] column_type:MYSQL_TYPE_FLOAT;[R1] [C3] column_is_rowkey:false;[R1] [C3] column_is_signed:true;[R1] [C3] column_encoding:binary;[R1] [C3] column_is_not_null:false;[R1] [C3] column_value_new:[1.23400002E+001](15);[R1] [C4] column_name:C3;[R1] [C4] column_type:MYSQL_TYPE_NEWDECIMAL;[R1] [C4] column_is_rowkey:false;[R1] [C4] column_is_signed:true;[R1] [C4] column_encoding:binary;[R1] [C4] column_is_not_null:false;[R1] [C4] column_value_new:[12.34](5);[R1] [C5] column_name:C4;[R1] [C5] column_type:MYSQL_TYPE_OB_NUMBER_FLOAT;[R1] [C5] column_is_rowkey:false;[R1] [C5] column_is_signed:true;[R1] [C5] column_encoding:binary;[R1] [C5] column_is_not_null:false;[R1] [C5] column_value_new:[12.34](5);[R1] [C6] column_name:C5;[R1] [C6] column_type:MYSQL_TYPE_OB_NUMBER_FLOAT;[R1] [C6] column_is_rowkey:false;[R1] [C6] column_is_signed:true;[R1] [C6] column_encoding:binary;[R1] [C6] column_is_not_null:false;[R1] [C6] column_value_new:[12.34](5);[R1] [C7] column_name:C6;[R1] [C7] column_type:MYSQL_TYPE_VAR_STRING;[R1] [C7] column_is_rowkey:false;[R1] [C7] column_is_signed:true;[R1] [C7] column_encoding:utf8mb4;[R1] [C7] column_is_not_null:false;[R1] [C7] column_value_new:[-1234567890123](14);[R1] [C8] column_name:C7;[R1] [C8] column_type:MYSQL_TYPE_STRING;[R1] [C8] column_is_rowkey:false;[R1] [C8] column_is_signed:true;[R1] [C8] column_encoding:utf8mb4;[R1] [C8] column_is_not_null:false;[R1] [C8] column_value_new:[12.34                                                                                               ](100);$[R2] COMMIT;
insert into number_1 (c0, c6) values (34+100,'-12345678901234');
ob1.oblog.next;
[R0] BEGIN;[R0] org_cluster_id:1;[R1] record_type:INSERT;[R1] database_name:oracle.OBLOG_DB;[R1] table_name:NUMBER_1;[R1] log_event:true;[R1] column_count:8;[R1] source_category:SRC_FULL_RECORDED;[R1] source_type:SRC_OCEANBASE_1_0;[R1] has_pk:true;[R1] pk_info:(0);[R1] pks:C0;[R1] has_uk:false;[R1] uk_info:(null);[R1] uks:(null);[R1] [C1] column_name:C0;[R1] [C1] column_type:MYSQL_TYPE_NEWDECIMAL;[R1] [C1] column_is_rowkey:true;[R1] [C1] column_is_signed:true;[R1] [C1] column_encoding:binary;[R1] [C1] column_is_not_null:true;[R1] [C1] column_value_new:[134](3);[R1] [C2] column_name:C1;[R1] [C2] column_type:MYSQL_TYPE_DOUBLE;[R1] [C2] column_is_rowkey:false;[R1] [C2] column_is_signed:true;[R1] [C2] column_encoding:binary;[R1] [C2] column_is_not_null:false;[R1] [C2] column_value_new:[1.234E+001](10);[R1] [C3] column_name:C2;[R1] [C3] column_type:MYSQL_TYPE_FLOAT;[R1] [C3] column_is_rowkey:false;[R1] [C3] column_is_signed:true;[R1] [C3] column_encoding:binary;[R1] [C3] column_is_not_null:false;[R1] [C3] column_value_new:[1.23400002E+001](15);[R1] [C4] column_name:C3;[R1] [C4] column_type:MYSQL_TYPE_NEWDECIMAL;[R1] [C4] column_is_rowkey:false;[R1] [C4] column_is_signed:true;[R1] [C4] column_encoding:binary;[R1] [C4] column_is_not_null:false;[R1] [C4] column_value_new:[12.34](5);[R1] [C5] column_name:C4;[R1] [C5] column_type:MYSQL_TYPE_OB_NUMBER_FLOAT;[R1] [C5] column_is_rowkey:false;[R1] [C5] column_is_signed:true;[R1] [C5] column_encoding:binary;[R1] [C5] column_is_not_null:false;[R1] [C5] column_value_new:[12.34](5);[R1] [C6] column_name:C5;[R1] [C6] column_type:MYSQL_TYPE_OB_NUMBER_FLOAT;[R1] [C6] column_is_rowkey:false;[R1] [C6] column_is_signed:true;[R1] [C6] column_encoding:binary;[R1] [C6] column_is_not_null:false;[R1] [C6] column_value_new:[12.34](5);[R1] [C7] column_name:C6;[R1] [C7] column_type:MYSQL_TYPE_VAR_STRING;[R1] [C7] column_is_rowkey:false;[R1] [C7] column_is_signed:true;[R1] [C7] column_encoding:utf8mb4;[R1] [C7] column_is_not_null:false;[R1] [C7] column_value_new:[-12345678901234](15);[R1] [C8] column_name:C7;[R1] [C8] column_type:MYSQL_TYPE_STRING;[R1] [C8] column_is_rowkey:false;[R1] [C8] column_is_signed:true;[R1] [C8] column_encoding:utf8mb4;[R1] [C8] column_is_not_null:false;[R1] [C8] column_value_new:[12.34                                                                                               ](100);$[R2] COMMIT;
insert into number_1 (c0, c6) values (35+100,'-123456789012345');
ob1.oblog.next;
[R0] BEGIN;[R0] org_cluster_id:1;[R1] record_type:INSERT;[R1] database_name:oracle.OBLOG_DB;[R1] table_name:NUMBER_1;[R1] log_event:true;[R1] column_count:8;[R1] source_category:SRC_FULL_RECORDED;[R1] source_type:SRC_OCEANBASE_1_0;[R1] has_pk:true;[R1] pk_info:(0);[R1] pks:C0;[R1] has_uk:false;[R1] uk_info:(null);[R1] uks:(null);[R1] [C1] column_name:C0;[R1] [C1] column_type:MYSQL_TYPE_NEWDECIMAL;[R1] [C1] column_is_rowkey:true;[R1] [C1] column_is_signed:true;[R1] [C1] column_encoding:binary;[R1] [C1] column_is_not_null:true;[R1] [C1] column_value_new:[135](3);[R1] [C2] column_name:C1;[R1] [C2] column_type:MYSQL_TYPE_DOUBLE;[R1] [C2] column_is_rowkey:false;[R1] [C2] column_is_signed:true;[R1] [C2] column_encoding:binary;[R1] [C2] column_is_not_null:false;[R1] [C2] column_value_new:[1.234E+001](10);[R1] [C3] column_name:C2;[R1] [C3] column_type:MYSQL_TYPE_FLOAT;[R1] [C3] column_is_rowkey:false;[R1] [C3] column_is_signed:true;[R1] [C3] column_encoding:binary;[R1] [C3] column_is_not_null:false;[R1] [C3] column_value_new:[1.23400002E+001](15);[R1] [C4] column_name:C3;[R1] [C4] column_type:MYSQL_TYPE_NEWDECIMAL;[R1] [C4] column_is_rowkey:false;[R1] [C4] column_is_signed:true;[R1] [C4] column_encoding:binary;[R1] [C4] column_is_not_null:false;[R1] [C4] column_value_new:[12.34](5);[R1] [C5] column_name:C4;[R1] [C5] column_type:MYSQL_TYPE_OB_NUMBER_FLOAT;[R1] [C5] column_is_rowkey:false;[R1] [C5] column_is_signed:true;[R1] [C5] column_encoding:binary;[R1] [C5] column_is_not_null:false;[R1] [C5] column_value_new:[12.34](5);[R1] [C6] column_name:C5;[R1] [C6] column_type:MYSQL_TYPE_OB_NUMBER_FLOAT;[R1] [C6] column_is_rowkey:false;[R1] [C6] column_is_signed:true;[R1] [C6] column_encoding:binary;[R1] [C6] column_is_not_null:false;[R1] [C6] column_value_new:[12.34](5);[R1] [C7] column_name:C6;[R1] [C7] column_type:MYSQL_TYPE_VAR_STRING;[R1] [C7] column_is_rowkey:false;[R1] [C7] column_is_signed:true;[R1] [C7] column_encoding:utf8mb4;[R1] [C7] column_is_not_null:false;[R1] [C7] column_value_new:[-123456789012345](16);[R1] [C8] column_name:C7;[R1] [C8] column_type:MYSQL_TYPE_STRING;[R1] [C8] column_is_rowkey:false;[R1] [C8] column_is_signed:true;[R1] [C8] column_encoding:utf8mb4;[R1] [C8] column_is_not_null:false;[R1] [C8] column_value_new:[12.34                                                                                               ](100);$[R2] COMMIT;
insert into number_1 (c0, c6) values (36+100,'-1234567890123456');
ob1.oblog.next;
[R0] BEGIN;[R0] org_cluster_id:1;[R1] record_type:INSERT;[R1] database_name:oracle.OBLOG_DB;[R1] table_name:NUMBER_1;[R1] log_event:true;[R1] column_count:8;[R1] source_category:SRC_FULL_RECORDED;[R1] source_type:SRC_OCEANBASE_1_0;[R1] has_pk:true;[R1] pk_info:(0);[R1] pks:C0;[R1] has_uk:false;[R1] uk_info:(null);[R1] uks:(null);[R1] [C1] column_name:C0;[R1] [C1] column_type:MYSQL_TYPE_NEWDECIMAL;[R1] [C1] column_is_rowkey:true;[R1] [C1] column_is_signed:true;[R1] [C1] column_encoding:binary;[R1] [C1] column_is_not_null:true;[R1] [C1] column_value_new:[136](3);[R1] [C2] column_name:C1;[R1] [C2] column_type:MYSQL_TYPE_DOUBLE;[R1] [C2] column_is_rowkey:false;[R1] [C2] column_is_signed:true;[R1] [C2] column_encoding:binary;[R1] [C2] column_is_not_null:false;[R1] [C2] column_value_new:[1.234E+001](10);[R1] [C3] column_name:C2;[R1] [C3] column_type:MYSQL_TYPE_FLOAT;[R1] [C3] column_is_rowkey:false;[R1] [C3] column_is_signed:true;[R1] [C3] column_encoding:binary;[R1] [C3] column_is_not_null:false;[R1] [C3] column_value_new:[1.23400002E+001](15);[R1] [C4] column_name:C3;[R1] [C4] column_type:MYSQL_TYPE_NEWDECIMAL;[R1] [C4] column_is_rowkey:false;[R1] [C4] column_is_signed:true;[R1] [C4] column_encoding:binary;[R1] [C4] column_is_not_null:false;[R1] [C4] column_value_new:[12.34](5);[R1] [C5] column_name:C4;[R1] [C5] column_type:MYSQL_TYPE_OB_NUMBER_FLOAT;[R1] [C5] column_is_rowkey:false;[R1] [C5] column_is_signed:true;[R1] [C5] column_encoding:binary;[R1] [C5] column_is_not_null:false;[R1] [C5] column_value_new:[12.34](5);[R1] [C6] column_name:C5;[R1] [C6] column_type:MYSQL_TYPE_OB_NUMBER_FLOAT;[R1] [C6] column_is_rowkey:false;[R1] [C6] column_is_signed:true;[R1] [C6] column_encoding:binary;[R1] [C6] column_is_not_null:false;[R1] [C6] column_value_new:[12.34](5);[R1] [C7] column_name:C6;[R1] [C7] column_type:MYSQL_TYPE_VAR_STRING;[R1] [C7] column_is_rowkey:false;[R1] [C7] column_is_signed:true;[R1] [C7] column_encoding:utf8mb4;[R1] [C7] column_is_not_null:false;[R1] [C7] column_value_new:[-1234567890123456](17);[R1] [C8] column_name:C7;[R1] [C8] column_type:MYSQL_TYPE_STRING;[R1] [C8] column_is_rowkey:false;[R1] [C8] column_is_signed:true;[R1] [C8] column_encoding:utf8mb4;[R1] [C8] column_is_not_null:false;[R1] [C8] column_value_new:[12.34                                                                                               ](100);$[R2] COMMIT;
insert into number_1 (c0, c6) values (37+100,'-12345678901234567');
ob1.oblog.next;
[R0] BEGIN;[R0] org_cluster_id:1;[R1] record_type:INSERT;[R1] database_name:oracle.OBLOG_DB;[R1] table_name:NUMBER_1;[R1] log_event:true;[R1] column_count:8;[R1] source_category:SRC_FULL_RECORDED;[R1] source_type:SRC_OCEANBASE_1_0;[R1] has_pk:true;[R1] pk_info:(0);[R1] pks:C0;[R1] has_uk:false;[R1] uk_info:(null);[R1] uks:(null);[R1] [C1] column_name:C0;[R1] [C1] column_type:MYSQL_TYPE_NEWDECIMAL;[R1] [C1] column_is_rowkey:true;[R1] [C1] column_is_signed:true;[R1] [C1] column_encoding:binary;[R1] [C1] column_is_not_null:true;[R1] [C1] column_value_new:[137](3);[R1] [C2] column_name:C1;[R1] [C2] column_type:MYSQL_TYPE_DOUBLE;[R1] [C2] column_is_rowkey:false;[R1] [C2] column_is_signed:true;[R1] [C2] column_encoding:binary;[R1] [C2] column_is_not_null:false;[R1] [C2] column_value_new:[1.234E+001](10);[R1] [C3] column_name:C2;[R1] [C3] column_type:MYSQL_TYPE_FLOAT;[R1] [C3] column_is_rowkey:false;[R1] [C3] column_is_signed:true;[R1] [C3] column_encoding:binary;[R1] [C3] column_is_not_null:false;[R1] [C3] column_value_new:[1.23400002E+001](15);[R1] [C4] column_name:C3;[R1] [C4] column_type:MYSQL_TYPE_NEWDECIMAL;[R1] [C4] column_is_rowkey:false;[R1] [C4] column_is_signed:true;[R1] [C4] column_encoding:binary;[R1] [C4] column_is_not_null:false;[R1] [C4] column_value_new:[12.34](5);[R1] [C5] column_name:C4;[R1] [C5] column_type:MYSQL_TYPE_OB_NUMBER_FLOAT;[R1] [C5] column_is_rowkey:false;[R1] [C5] column_is_signed:true;[R1] [C5] column_encoding:binary;[R1] [C5] column_is_not_null:false;[R1] [C5] column_value_new:[12.34](5);[R1] [C6] column_name:C5;[R1] [C6] column_type:MYSQL_TYPE_OB_NUMBER_FLOAT;[R1] [C6] column_is_rowkey:false;[R1] [C6] column_is_signed:true;[R1] [C6] column_encoding:binary;[R1] [C6] column_is_not_null:false;[R1] [C6] column_value_new:[12.34](5);[R1] [C7] column_name:C6;[R1] [C7] column_type:MYSQL_TYPE_VAR_STRING;[R1] [C7] column_is_rowkey:false;[R1] [C7] column_is_signed:true;[R1] [C7] column_encoding:utf8mb4;[R1] [C7] column_is_not_null:false;[R1] [C7] column_value_new:[-12345678901234567](18);[R1] [C8] column_name:C7;[R1] [C8] column_type:MYSQL_TYPE_STRING;[R1] [C8] column_is_rowkey:false;[R1] [C8] column_is_signed:true;[R1] [C8] column_encoding:utf8mb4;[R1] [C8] column_is_not_null:false;[R1] [C8] column_value_new:[12.34                                                                                               ](100);$[R2] COMMIT;
insert into number_1 (c0, c6) values (38+100,'-123456789012345678');
ob1.oblog.next;
[R0] BEGIN;[R0] org_cluster_id:1;[R1] record_type:INSERT;[R1] database_name:oracle.OBLOG_DB;[R1] table_name:NUMBER_1;[R1] log_event:true;[R1] column_count:8;[R1] source_category:SRC_FULL_RECORDED;[R1] source_type:SRC_OCEANBASE_1_0;[R1] has_pk:true;[R1] pk_info:(0);[R1] pks:C0;[R1] has_uk:false;[R1] uk_info:(null);[R1] uks:(null);[R1] [C1] column_name:C0;[R1] [C1] column_type:MYSQL_TYPE_NEWDECIMAL;[R1] [C1] column_is_rowkey:true;[R1] [C1] column_is_signed:true;[R1] [C1] column_encoding:binary;[R1] [C1] column_is_not_null:true;[R1] [C1] column_value_new:[138](3);[R1] [C2] column_name:C1;[R1] [C2] column_type:MYSQL_TYPE_DOUBLE;[R1] [C2] column_is_rowkey:false;[R1] [C2] column_is_signed:true;[R1] [C2] column_encoding:binary;[R1] [C2] column_is_not_null:false;[R1] [C2] column_value_new:[1.234E+001](10);[R1] [C3] column_name:C2;[R1] [C3] column_type:MYSQL_TYPE_FLOAT;[R1] [C3] column_is_rowkey:false;[R1] [C3] column_is_signed:true;[R1] [C3] column_encoding:binary;[R1] [C3] column_is_not_null:false;[R1] [C3] column_value_new:[1.23400002E+001](15);[R1] [C4] column_name:C3;[R1] [C4] column_type:MYSQL_TYPE_NEWDECIMAL;[R1] [C4] column_is_rowkey:false;[R1] [C4] column_is_signed:true;[R1] [C4] column_encoding:binary;[R1] [C4] column_is_not_null:false;[R1] [C4] column_value_new:[12.34](5);[R1] [C5] column_name:C4;[R1] [C5] column_type:MYSQL_TYPE_OB_NUMBER_FLOAT;[R1] [C5] column_is_rowkey:false;[R1] [C5] column_is_signed:true;[R1] [C5] column_encoding:binary;[R1] [C5] column_is_not_null:false;[R1] [C5] column_value_new:[12.34](5);[R1] [C6] column_name:C5;[R1] [C6] column_type:MYSQL_TYPE_OB_NUMBER_FLOAT;[R1] [C6] column_is_rowkey:false;[R1] [C6] column_is_signed:true;[R1] [C6] column_encoding:binary;[R1] [C6] column_is_not_null:false;[R1] [C6] column_value_new:[12.34](5);[R1] [C7] column_name:C6;[R1] [C7] column_type:MYSQL_TYPE_VAR_STRING;[R1] [C7] column_is_rowkey:false;[R1] [C7] column_is_signed:true;[R1] [C7] column_encoding:utf8mb4;[R1] [C7] column_is_not_null:false;[R1] [C7] column_value_new:[-123456789012345678](19);[R1] [C8] column_name:C7;[R1] [C8] column_type:MYSQL_TYPE_STRING;[R1] [C8] column_is_rowkey:false;[R1] [C8] column_is_signed:true;[R1] [C8] column_encoding:utf8mb4;[R1] [C8] column_is_not_null:false;[R1] [C8] column_value_new:[12.34                                                                                               ](100);$[R2] COMMIT;
insert into number_1 (c0, c6) values (39+100,'-1234567890123456789');
ob1.oblog.next;
[R0] BEGIN;[R0] org_cluster_id:1;[R1] record_type:INSERT;[R1] database_name:oracle.OBLOG_DB;[R1] table_name:NUMBER_1;[R1] log_event:true;[R1] column_count:8;[R1] source_category:SRC_FULL_RECORDED;[R1] source_type:SRC_OCEANBASE_1_0;[R1] has_pk:true;[R1] pk_info:(0);[R1] pks:C0;[R1] has_uk:false;[R1] uk_info:(null);[R1] uks:(null);[R1] [C1] column_name:C0;[R1] [C1] column_type:MYSQL_TYPE_NEWDECIMAL;[R1] [C1] column_is_rowkey:true;[R1] [C1] column_is_signed:true;[R1] [C1] column_encoding:binary;[R1] [C1] column_is_not_null:true;[R1] [C1] column_value_new:[139](3);[R1] [C2] column_name:C1;[R1] [C2] column_type:MYSQL_TYPE_DOUBLE;[R1] [C2] column_is_rowkey:false;[R1] [C2] column_is_signed:true;[R1] [C2] column_encoding:binary;[R1] [C2] column_is_not_null:false;[R1] [C2] column_value_new:[1.234E+001](10);[R1] [C3] column_name:C2;[R1] [C3] column_type:MYSQL_TYPE_FLOAT;[R1] [C3] column_is_rowkey:false;[R1] [C3] column_is_signed:true;[R1] [C3] column_encoding:binary;[R1] [C3] column_is_not_null:false;[R1] [C3] column_value_new:[1.23400002E+001](15);[R1] [C4] column_name:C3;[R1] [C4] column_type:MYSQL_TYPE_NEWDECIMAL;[R1] [C4] column_is_rowkey:false;[R1] [C4] column_is_signed:true;[R1] [C4] column_encoding:binary;[R1] [C4] column_is_not_null:false;[R1] [C4] column_value_new:[12.34](5);[R1] [C5] column_name:C4;[R1] [C5] column_type:MYSQL_TYPE_OB_NUMBER_FLOAT;[R1] [C5] column_is_rowkey:false;[R1] [C5] column_is_signed:true;[R1] [C5] column_encoding:binary;[R1] [C5] column_is_not_null:false;[R1] [C5] column_value_new:[12.34](5);[R1] [C6] column_name:C5;[R1] [C6] column_type:MYSQL_TYPE_OB_NUMBER_FLOAT;[R1] [C6] column_is_rowkey:false;[R1] [C6] column_is_signed:true;[R1] [C6] column_encoding:binary;[R1] [C6] column_is_not_null:false;[R1] [C6] column_value_new:[12.34](5);[R1] [C7] column_name:C6;[R1] [C7] column_type:MYSQL_TYPE_VAR_STRING;[R1] [C7] column_is_rowkey:false;[R1] [C7] column_is_signed:true;[R1] [C7] column_encoding:utf8mb4;[R1] [C7] column_is_not_null:false;[R1] [C7] column_value_new:[-1234567890123456789](20);[R1] [C8] column_name:C7;[R1] [C8] column_type:MYSQL_TYPE_STRING;[R1] [C8] column_is_rowkey:false;[R1] [C8] column_is_signed:true;[R1] [C8] column_encoding:utf8mb4;[R1] [C8] column_is_not_null:false;[R1] [C8] column_value_new:[12.34                                                                                               ](100);$[R2] COMMIT;
insert into number_1 (c0, c6) values (40+100,'-12345678901234567890');
ob1.oblog.next;
[R0] BEGIN;[R0] org_cluster_id:1;[R1] record_type:INSERT;[R1] database_name:oracle.OBLOG_DB;[R1] table_name:NUMBER_1;[R1] log_event:true;[R1] column_count:8;[R1] source_category:SRC_FULL_RECORDED;[R1] source_type:SRC_OCEANBASE_1_0;[R1] has_pk:true;[R1] pk_info:(0);[R1] pks:C0;[R1] has_uk:false;[R1] uk_info:(null);[R1] uks:(null);[R1] [C1] column_name:C0;[R1] [C1] column_type:MYSQL_TYPE_NEWDECIMAL;[R1] [C1] column_is_rowkey:true;[R1] [C1] column_is_signed:true;[R1] [C1] column_encoding:binary;[R1] [C1] column_is_not_null:true;[R1] [C1] column_value_new:[140](3);[R1] [C2] column_name:C1;[R1] [C2] column_type:MYSQL_TYPE_DOUBLE;[R1] [C2] column_is_rowkey:false;[R1] [C2] column_is_signed:true;[R1] [C2] column_encoding:binary;[R1] [C2] column_is_not_null:false;[R1] [C2] column_value_new:[1.234E+001](10);[R1] [C3] column_name:C2;[R1] [C3] column_type:MYSQL_TYPE_FLOAT;[R1] [C3] column_is_rowkey:false;[R1] [C3] column_is_signed:true;[R1] [C3] column_encoding:binary;[R1] [C3] column_is_not_null:false;[R1] [C3] column_value_new:[1.23400002E+001](15);[R1] [C4] column_name:C3;[R1] [C4] column_type:MYSQL_TYPE_NEWDECIMAL;[R1] [C4] column_is_rowkey:false;[R1] [C4] column_is_signed:true;[R1] [C4] column_encoding:binary;[R1] [C4] column_is_not_null:false;[R1] [C4] column_value_new:[12.34](5);[R1] [C5] column_name:C4;[R1] [C5] column_type:MYSQL_TYPE_OB_NUMBER_FLOAT;[R1] [C5] column_is_rowkey:false;[R1] [C5] column_is_signed:true;[R1] [C5] column_encoding:binary;[R1] [C5] column_is_not_null:false;[R1] [C5] column_value_new:[12.34](5);[R1] [C6] column_name:C5;[R1] [C6] column_type:MYSQL_TYPE_OB_NUMBER_FLOAT;[R1] [C6] column_is_rowkey:false;[R1] [C6] column_is_signed:true;[R1] [C6] column_encoding:binary;[R1] [C6] column_is_not_null:false;[R1] [C6] column_value_new:[12.34](5);[R1] [C7] column_name:C6;[R1] [C7] column_type:MYSQL_TYPE_VAR_STRING;[R1] [C7] column_is_rowkey:false;[R1] [C7] column_is_signed:true;[R1] [C7] column_encoding:utf8mb4;[R1] [C7] column_is_not_null:false;[R1] [C7] column_value_new:[-12345678901234567890](21);[R1] [C8] column_name:C7;[R1] [C8] column_type:MYSQL_TYPE_STRING;[R1] [C8] column_is_rowkey:false;[R1] [C8] column_is_signed:true;[R1] [C8] column_encoding:utf8mb4;[R1] [C8] column_is_not_null:false;[R1] [C8] column_value_new:[12.34                                                                                               ](100);$[R2] COMMIT;
insert into number_1 (c0, c6) values (41+100,'-1234567890123456789.0');
ob1.oblog.next;
[R0] BEGIN;[R0] org_cluster_id:1;[R1] record_type:INSERT;[R1] database_name:oracle.OBLOG_DB;[R1] table_name:NUMBER_1;[R1] log_event:true;[R1] column_count:8;[R1] source_category:SRC_FULL_RECORDED;[R1] source_type:SRC_OCEANBASE_1_0;[R1] has_pk:true;[R1] pk_info:(0);[R1] pks:C0;[R1] has_uk:false;[R1] uk_info:(null);[R1] uks:(null);[R1] [C1] column_name:C0;[R1] [C1] column_type:MYSQL_TYPE_NEWDECIMAL;[R1] [C1] column_is_rowkey:true;[R1] [C1] column_is_signed:true;[R1] [C1] column_encoding:binary;[R1] [C1] column_is_not_null:true;[R1] [C1] column_value_new:[141](3);[R1] [C2] column_name:C1;[R1] [C2] column_type:MYSQL_TYPE_DOUBLE;[R1] [C2] column_is_rowkey:false;[R1] [C2] column_is_signed:true;[R1] [C2] column_encoding:binary;[R1] [C2] column_is_not_null:false;[R1] [C2] column_value_new:[1.234E+001](10);[R1] [C3] column_name:C2;[R1] [C3] column_type:MYSQL_TYPE_FLOAT;[R1] [C3] column_is_rowkey:false;[R1] [C3] column_is_signed:true;[R1] [C3] column_encoding:binary;[R1] [C3] column_is_not_null:false;[R1] [C3] column_value_new:[1.23400002E+001](15);[R1] [C4] column_name:C3;[R1] [C4] column_type:MYSQL_TYPE_NEWDECIMAL;[R1] [C4] column_is_rowkey:false;[R1] [C4] column_is_signed:true;[R1] [C4] column_encoding:binary;[R1] [C4] column_is_not_null:false;[R1] [C4] column_value_new:[12.34](5);[R1] [C5] column_name:C4;[R1] [C5] column_type:MYSQL_TYPE_OB_NUMBER_FLOAT;[R1] [C5] column_is_rowkey:false;[R1] [C5] column_is_signed:true;[R1] [C5] column_encoding:binary;[R1] [C5] column_is_not_null:false;[R1] [C5] column_value_new:[12.34](5);[R1] [C6] column_name:C5;[R1] [C6] column_type:MYSQL_TYPE_OB_NUMBER_FLOAT;[R1] [C6] column_is_rowkey:false;[R1] [C6] column_is_signed:true;[R1] [C6] column_encoding:binary;[R1] [C6] column_is_not_null:false;[R1] [C6] column_value_new:[12.34](5);[R1] [C7] column_name:C6;[R1] [C7] column_type:MYSQL_TYPE_VAR_STRING;[R1] [C7] column_is_rowkey:false;[R1] [C7] column_is_signed:true;[R1] [C7] column_encoding:utf8mb4;[R1] [C7] column_is_not_null:false;[R1] [C7] column_value_new:[-1234567890123456789.0](22);[R1] [C8] column_name:C7;[R1] [C8] column_type:MYSQL_TYPE_STRING;[R1] [C8] column_is_rowkey:false;[R1] [C8] column_is_signed:true;[R1] [C8] column_encoding:utf8mb4;[R1] [C8] column_is_not_null:false;[R1] [C8] column_value_new:[12.34                                                                                               ](100);$[R2] COMMIT;
insert into number_1 (c0, c6) values (42+100,'-123456789012345678.90');
ob1.oblog.next;
[R0] BEGIN;[R0] org_cluster_id:1;[R1] record_type:INSERT;[R1] database_name:oracle.OBLOG_DB;[R1] table_name:NUMBER_1;[R1] log_event:true;[R1] column_count:8;[R1] source_category:SRC_FULL_RECORDED;[R1] source_type:SRC_OCEANBASE_1_0;[R1] has_pk:true;[R1] pk_info:(0);[R1] pks:C0;[R1] has_uk:false;[R1] uk_info:(null);[R1] uks:(null);[R1] [C1] column_name:C0;[R1] [C1] column_type:MYSQL_TYPE_NEWDECIMAL;[R1] [C1] column_is_rowkey:true;[R1] [C1] column_is_signed:true;[R1] [C1] column_encoding:binary;[R1] [C1] column_is_not_null:true;[R1] [C1] column_value_new:[142](3);[R1] [C2] column_name:C1;[R1] [C2] column_type:MYSQL_TYPE_DOUBLE;[R1] [C2] column_is_rowkey:false;[R1] [C2] column_is_signed:true;[R1] [C2] column_encoding:binary;[R1] [C2] column_is_not_null:false;[R1] [C2] column_value_new:[1.234E+001](10);[R1] [C3] column_name:C2;[R1] [C3] column_type:MYSQL_TYPE_FLOAT;[R1] [C3] column_is_rowkey:false;[R1] [C3] column_is_signed:true;[R1] [C3] column_encoding:binary;[R1] [C3] column_is_not_null:false;[R1] [C3] column_value_new:[1.23400002E+001](15);[R1] [C4] column_name:C3;[R1] [C4] column_type:MYSQL_TYPE_NEWDECIMAL;[R1] [C4] column_is_rowkey:false;[R1] [C4] column_is_signed:true;[R1] [C4] column_encoding:binary;[R1] [C4] column_is_not_null:false;[R1] [C4] column_value_new:[12.34](5);[R1] [C5] column_name:C4;[R1] [C5] column_type:MYSQL_TYPE_OB_NUMBER_FLOAT;[R1] [C5] column_is_rowkey:false;[R1] [C5] column_is_signed:true;[R1] [C5] column_encoding:binary;[R1] [C5] column_is_not_null:false;[R1] [C5] column_value_new:[12.34](5);[R1] [C6] column_name:C5;[R1] [C6] column_type:MYSQL_TYPE_OB_NUMBER_FLOAT;[R1] [C6] column_is_rowkey:false;[R1] [C6] column_is_signed:true;[R1] [C6] column_encoding:binary;[R1] [C6] column_is_not_null:false;[R1] [C6] column_value_new:[12.34](5);[R1] [C7] column_name:C6;[R1] [C7] column_type:MYSQL_TYPE_VAR_STRING;[R1] [C7] column_is_rowkey:false;[R1] [C7] column_is_signed:true;[R1] [C7] column_encoding:utf8mb4;[R1] [C7] column_is_not_null:false;[R1] [C7] column_value_new:[-123456789012345678.90](22);[R1] [C8] column_name:C7;[R1] [C8] column_type:MYSQL_TYPE_STRING;[R1] [C8] column_is_rowkey:false;[R1] [C8] column_is_signed:true;[R1] [C8] column_encoding:utf8mb4;[R1] [C8] column_is_not_null:false;[R1] [C8] column_value_new:[12.34                                                                                               ](100);$[R2] COMMIT;
insert into number_1 (c0, c6) values (43+100,'-12345678901234567.890');
ob1.oblog.next;
[R0] BEGIN;[R0] org_cluster_id:1;[R1] record_type:INSERT;[R1] database_name:oracle.OBLOG_DB;[R1] table_name:NUMBER_1;[R1] log_event:true;[R1] column_count:8;[R1] source_category:SRC_FULL_RECORDED;[R1] source_type:SRC_OCEANBASE_1_0;[R1] has_pk:true;[R1] pk_info:(0);[R1] pks:C0;[R1] has_uk:false;[R1] uk_info:(null);[R1] uks:(null);[R1] [C1] column_name:C0;[R1] [C1] column_type:MYSQL_TYPE_NEWDECIMAL;[R1] [C1] column_is_rowkey:true;[R1] [C1] column_is_signed:true;[R1] [C1] column_encoding:binary;[R1] [C1] column_is_not_null:true;[R1] [C1] column_value_new:[143](3);[R1] [C2] column_name:C1;[R1] [C2] column_type:MYSQL_TYPE_DOUBLE;[R1] [C2] column_is_rowkey:false;[R1] [C2] column_is_signed:true;[R1] [C2] column_encoding:binary;[R1] [C2] column_is_not_null:false;[R1] [C2] column_value_new:[1.234E+001](10);[R1] [C3] column_name:C2;[R1] [C3] column_type:MYSQL_TYPE_FLOAT;[R1] [C3] column_is_rowkey:false;[R1] [C3] column_is_signed:true;[R1] [C3] column_encoding:binary;[R1] [C3] column_is_not_null:false;[R1] [C3] column_value_new:[1.23400002E+001](15);[R1] [C4] column_name:C3;[R1] [C4] column_type:MYSQL_TYPE_NEWDECIMAL;[R1] [C4] column_is_rowkey:false;[R1] [C4] column_is_signed:true;[R1] [C4] column_encoding:binary;[R1] [C4] column_is_not_null:false;[R1] [C4] column_value_new:[12.34](5);[R1] [C5] column_name:C4;[R1] [C5] column_type:MYSQL_TYPE_OB_NUMBER_FLOAT;[R1] [C5] column_is_rowkey:false;[R1] [C5] column_is_signed:true;[R1] [C5] column_encoding:binary;[R1] [C5] column_is_not_null:false;[R1] [C5] column_value_new:[12.34](5);[R1] [C6] column_name:C5;[R1] [C6] column_type:MYSQL_TYPE_OB_NUMBER_FLOAT;[R1] [C6] column_is_rowkey:false;[R1] [C6] column_is_signed:true;[R1] [C6] column_encoding:binary;[R1] [C6] column_is_not_null:false;[R1] [C6] column_value_new:[12.34](5);[R1] [C7] column_name:C6;[R1] [C7] column_type:MYSQL_TYPE_VAR_STRING;[R1] [C7] column_is_rowkey:false;[R1] [C7] column_is_signed:true;[R1] [C7] column_encoding:utf8mb4;[R1] [C7] column_is_not_null:false;[R1] [C7] column_value_new:[-12345678901234567.890](22);[R1] [C8] column_name:C7;[R1] [C8] column_type:MYSQL_TYPE_STRING;[R1] [C8] column_is_rowkey:false;[R1] [C8] column_is_signed:true;[R1] [C8] column_encoding:utf8mb4;[R1] [C8] column_is_not_null:false;[R1] [C8] column_value_new:[12.34                                                                                               ](100);$[R2] COMMIT;
insert into number_1 (c0, c6) values (44+100,'-1234567890123456.7890');
ob1.oblog.next;
[R0] BEGIN;[R0] org_cluster_id:1;[R1] record_type:INSERT;[R1] database_name:oracle.OBLOG_DB;[R1] table_name:NUMBER_1;[R1] log_event:true;[R1] column_count:8;[R1] source_category:SRC_FULL_RECORDED;[R1] source_type:SRC_OCEANBASE_1_0;[R1] has_pk:true;[R1] pk_info:(0);[R1] pks:C0;[R1] has_uk:false;[R1] uk_info:(null);[R1] uks:(null);[R1] [C1] column_name:C0;[R1] [C1] column_type:MYSQL_TYPE_NEWDECIMAL;[R1] [C1] column_is_rowkey:true;[R1] [C1] column_is_signed:true;[R1] [C1] column_encoding:binary;[R1] [C1] column_is_not_null:true;[R1] [C1] column_value_new:[144](3);[R1] [C2] column_name:C1;[R1] [C2] column_type:MYSQL_TYPE_DOUBLE;[R1] [C2] column_is_rowkey:false;[R1] [C2] column_is_signed:true;[R1] [C2] column_encoding:binary;[R1] [C2] column_is_not_null:false;[R1] [C2] column_value_new:[1.234E+001](10);[R1] [C3] column_name:C2;[R1] [C3] column_type:MYSQL_TYPE_FLOAT;[R1] [C3] column_is_rowkey:false;[R1] [C3] column_is_signed:true;[R1] [C3] column_encoding:binary;[R1] [C3] column_is_not_null:false;[R1] [C3] column_value_new:[1.23400002E+001](15);[R1] [C4] column_name:C3;[R1] [C4] column_type:MYSQL_TYPE_NEWDECIMAL;[R1] [C4] column_is_rowkey:false;[R1] [C4] column_is_signed:true;[R1] [C4] column_encoding:binary;[R1] [C4] column_is_not_null:false;[R1] [C4] column_value_new:[12.34](5);[R1] [C5] column_name:C4;[R1] [C5] column_type:MYSQL_TYPE_OB_NUMBER_FLOAT;[R1] [C5] column_is_rowkey:false;[R1] [C5] column_is_signed:true;[R1] [C5] column_encoding:binary;[R1] [C5] column_is_not_null:false;[R1] [C5] column_value_new:[12.34](5);[R1] [C6] column_name:C5;[R1] [C6] column_type:MYSQL_TYPE_OB_NUMBER_FLOAT;[R1] [C6] column_is_rowkey:false;[R1] [C6] column_is_signed:true;[R1] [C6] column_encoding:binary;[R1] [C6] column_is_not_null:false;[R1] [C6] column_value_new:[12.34](5);[R1] [C7] column_name:C6;[R1] [C7] column_type:MYSQL_TYPE_VAR_STRING;[R1] [C7] column_is_rowkey:false;[R1] [C7] column_is_signed:true;[R1] [C7] column_encoding:utf8mb4;[R1] [C7] column_is_not_null:false;[R1] [C7] column_value_new:[-1234567890123456.7890](22);[R1] [C8] column_name:C7;[R1] [C8] column_type:MYSQL_TYPE_STRING;[R1] [C8] column_is_rowkey:false;[R1] [C8] column_is_signed:true;[R1] [C8] column_encoding:utf8mb4;[R1] [C8] column_is_not_null:false;[R1] [C8] column_value_new:[12.34                                                                                               ](100);$[R2] COMMIT;
insert into number_1 (c0, c6) values (45+100,'-123456789012345.67890');
ob1.oblog.next;
[R0] BEGIN;[R0] org_cluster_id:1;[R1] record_type:INSERT;[R1] database_name:oracle.OBLOG_DB;[R1] table_name:NUMBER_1;[R1] log_event:true;[R1] column_count:8;[R1] source_category:SRC_FULL_RECORDED;[R1] source_type:SRC_OCEANBASE_1_0;[R1] has_pk:true;[R1] pk_info:(0);[R1] pks:C0;[R1] has_uk:false;[R1] uk_info:(null);[R1] uks:(null);[R1] [C1] column_name:C0;[R1] [C1] column_type:MYSQL_TYPE_NEWDECIMAL;[R1] [C1] column_is_rowkey:true;[R1] [C1] column_is_signed:true;[R1] [C1] column_encoding:binary;[R1] [C1] column_is_not_null:true;[R1] [C1] column_value_new:[145](3);[R1] [C2] column_name:C1;[R1] [C2] column_type:MYSQL_TYPE_DOUBLE;[R1] [C2] column_is_rowkey:false;[R1] [C2] column_is_signed:true;[R1] [C2] column_encoding:binary;[R1] [C2] column_is_not_null:false;[R1] [C2] column_value_new:[1.234E+001](10);[R1] [C3] column_name:C2;[R1] [C3] column_type:MYSQL_TYPE_FLOAT;[R1] [C3] column_is_rowkey:false;[R1] [C3] column_is_signed:true;[R1] [C3] column_encoding:binary;[R1] [C3] column_is_not_null:false;[R1] [C3] column_value_new:[1.23400002E+001](15);[R1] [C4] column_name:C3;[R1] [C4] column_type:MYSQL_TYPE_NEWDECIMAL;[R1] [C4] column_is_rowkey:false;[R1] [C4] column_is_signed:true;[R1] [C4] column_encoding:binary;[R1] [C4] column_is_not_null:false;[R1] [C4] column_value_new:[12.34](5);[R1] [C5] column_name:C4;[R1] [C5] column_type:MYSQL_TYPE_OB_NUMBER_FLOAT;[R1] [C5] column_is_rowkey:false;[R1] [C5] column_is_signed:true;[R1] [C5] column_encoding:binary;[R1] [C5] column_is_not_null:false;[R1] [C5] column_value_new:[12.34](5);[R1] [C6] column_name:C5;[R1] [C6] column_type:MYSQL_TYPE_OB_NUMBER_FLOAT;[R1] [C6] column_is_rowkey:false;[R1] [C6] column_is_signed:true;[R1] [C6] column_encoding:binary;[R1] [C6] column_is_not_null:false;[R1] [C6] column_value_new:[12.34](5);[R1] [C7] column_name:C6;[R1] [C7] column_type:MYSQL_TYPE_VAR_STRING;[R1] [C7] column_is_rowkey:false;[R1] [C7] column_is_signed:true;[R1] [C7] column_encoding:utf8mb4;[R1] [C7] column_is_not_null:false;[R1] [C7] column_value_new:[-123456789012345.67890](22);[R1] [C8] column_name:C7;[R1] [C8] column_type:MYSQL_TYPE_STRING;[R1] [C8] column_is_rowkey:false;[R1] [C8] column_is_signed:true;[R1] [C8] column_encoding:utf8mb4;[R1] [C8] column_is_not_null:false;[R1] [C8] column_value_new:[12.34                                                                                               ](100);$[R2] COMMIT;
insert into number_1 (c0, c6) values (46+100,'-12345678901234.567890');
ob1.oblog.next;
[R0] BEGIN;[R0] org_cluster_id:1;[R1] record_type:INSERT;[R1] database_name:oracle.OBLOG_DB;[R1] table_name:NUMBER_1;[R1] log_event:true;[R1] column_count:8;[R1] source_category:SRC_FULL_RECORDED;[R1] source_type:SRC_OCEANBASE_1_0;[R1] has_pk:true;[R1] pk_info:(0);[R1] pks:C0;[R1] has_uk:false;[R1] uk_info:(null);[R1] uks:(null);[R1] [C1] column_name:C0;[R1] [C1] column_type:MYSQL_TYPE_NEWDECIMAL;[R1] [C1] column_is_rowkey:true;[R1] [C1] column_is_signed:true;[R1] [C1] column_encoding:binary;[R1] [C1] column_is_not_null:true;[R1] [C1] column_value_new:[146](3);[R1] [C2] column_name:C1;[R1] [C2] column_type:MYSQL_TYPE_DOUBLE;[R1] [C2] column_is_rowkey:false;[R1] [C2] column_is_signed:true;[R1] [C2] column_encoding:binary;[R1] [C2] column_is_not_null:false;[R1] [C2] column_value_new:[1.234E+001](10);[R1] [C3] column_name:C2;[R1] [C3] column_type:MYSQL_TYPE_FLOAT;[R1] [C3] column_is_rowkey:false;[R1] [C3] column_is_signed:true;[R1] [C3] column_encoding:binary;[R1] [C3] column_is_not_null:false;[R1] [C3] column_value_new:[1.23400002E+001](15);[R1] [C4] column_name:C3;[R1] [C4] column_type:MYSQL_TYPE_NEWDECIMAL;[R1] [C4] column_is_rowkey:false;[R1] [C4] column_is_signed:true;[R1] [C4] column_encoding:binary;[R1] [C4] column_is_not_null:false;[R1] [C4] column_value_new:[12.34](5);[R1] [C5] column_name:C4;[R1] [C5] column_type:MYSQL_TYPE_OB_NUMBER_FLOAT;[R1] [C5] column_is_rowkey:false;[R1] [C5] column_is_signed:true;[R1] [C5] column_encoding:binary;[R1] [C5] column_is_not_null:false;[R1] [C5] column_value_new:[12.34](5);[R1] [C6] column_name:C5;[R1] [C6] column_type:MYSQL_TYPE_OB_NUMBER_FLOAT;[R1] [C6] column_is_rowkey:false;[R1] [C6] column_is_signed:true;[R1] [C6] column_encoding:binary;[R1] [C6] column_is_not_null:false;[R1] [C6] column_value_new:[12.34](5);[R1] [C7] column_name:C6;[R1] [C7] column_type:MYSQL_TYPE_VAR_STRING;[R1] [C7] column_is_rowkey:false;[R1] [C7] column_is_signed:true;[R1] [C7] column_encoding:utf8mb4;[R1] [C7] column_is_not_null:false;[R1] [C7] column_value_new:[-12345678901234.567890](22);[R1] [C8] column_name:C7;[R1] [C8] column_type:MYSQL_TYPE_STRING;[R1] [C8] column_is_rowkey:false;[R1] [C8] column_is_signed:true;[R1] [C8] column_encoding:utf8mb4;[R1] [C8] column_is_not_null:false;[R1] [C8] column_value_new:[12.34                                                                                               ](100);$[R2] COMMIT;
insert into number_1 (c0, c6) values (47+100,'-1234567890123.4567890');
ob1.oblog.next;
[R0] BEGIN;[R0] org_cluster_id:1;[R1] record_type:INSERT;[R1] database_name:oracle.OBLOG_DB;[R1] table_name:NUMBER_1;[R1] log_event:true;[R1] column_count:8;[R1] source_category:SRC_FULL_RECORDED;[R1] source_type:SRC_OCEANBASE_1_0;[R1] has_pk:true;[R1] pk_info:(0);[R1] pks:C0;[R1] has_uk:false;[R1] uk_info:(null);[R1] uks:(null);[R1] [C1] column_name:C0;[R1] [C1] column_type:MYSQL_TYPE_NEWDECIMAL;[R1] [C1] column_is_rowkey:true;[R1] [C1] column_is_signed:true;[R1] [C1] column_encoding:binary;[R1] [C1] column_is_not_null:true;[R1] [C1] column_value_new:[147](3);[R1] [C2] column_name:C1;[R1] [C2] column_type:MYSQL_TYPE_DOUBLE;[R1] [C2] column_is_rowkey:false;[R1] [C2] column_is_signed:true;[R1] [C2] column_encoding:binary;[R1] [C2] column_is_not_null:false;[R1] [C2] column_value_new:[1.234E+001](10);[R1] [C3] column_name:C2;[R1] [C3] column_type:MYSQL_TYPE_FLOAT;[R1] [C3] column_is_rowkey:false;[R1] [C3] column_is_signed:true;[R1] [C3] column_encoding:binary;[R1] [C3] column_is_not_null:false;[R1] [C3] column_value_new:[1.23400002E+001](15);[R1] [C4] column_name:C3;[R1] [C4] column_type:MYSQL_TYPE_NEWDECIMAL;[R1] [C4] column_is_rowkey:false;[R1] [C4] column_is_signed:true;[R1] [C4] column_encoding:binary;[R1] [C4] column_is_not_null:false;[R1] [C4] column_value_new:[12.34](5);[R1] [C5] column_name:C4;[R1] [C5] column_type:MYSQL_TYPE_OB_NUMBER_FLOAT;[R1] [C5] column_is_rowkey:false;[R1] [C5] column_is_signed:true;[R1] [C5] column_encoding:binary;[R1] [C5] column_is_not_null:false;[R1] [C5] column_value_new:[12.34](5);[R1] [C6] column_name:C5;[R1] [C6] column_type:MYSQL_TYPE_OB_NUMBER_FLOAT;[R1] [C6] column_is_rowkey:false;[R1] [C6] column_is_signed:true;[R1] [C6] column_encoding:binary;[R1] [C6] column_is_not_null:false;[R1] [C6] column_value_new:[12.34](5);[R1] [C7] column_name:C6;[R1] [C7] column_type:MYSQL_TYPE_VAR_STRING;[R1] [C7] column_is_rowkey:false;[R1] [C7] column_is_signed:true;[R1] [C7] column_encoding:utf8mb4;[R1] [C7] column_is_not_null:false;[R1] [C7] column_value_new:[-1234567890123.4567890](22);[R1] [C8] column_name:C7;[R1] [C8] column_type:MYSQL_TYPE_STRING;[R1] [C8] column_is_rowkey:false;[R1] [C8] column_is_signed:true;[R1] [C8] column_encoding:utf8mb4;[R1] [C8] column_is_not_null:false;[R1] [C8] column_value_new:[12.34                                                                                               ](100);$[R2] COMMIT;
insert into number_1 (c0, c6) values (48+100,'-123456789012.34567890');
ob1.oblog.next;
[R0] BEGIN;[R0] org_cluster_id:1;[R1] record_type:INSERT;[R1] database_name:oracle.OBLOG_DB;[R1] table_name:NUMBER_1;[R1] log_event:true;[R1] column_count:8;[R1] source_category:SRC_FULL_RECORDED;[R1] source_type:SRC_OCEANBASE_1_0;[R1] has_pk:true;[R1] pk_info:(0);[R1] pks:C0;[R1] has_uk:false;[R1] uk_info:(null);[R1] uks:(null);[R1] [C1] column_name:C0;[R1] [C1] column_type:MYSQL_TYPE_NEWDECIMAL;[R1] [C1] column_is_rowkey:true;[R1] [C1] column_is_signed:true;[R1] [C1] column_encoding:binary;[R1] [C1] column_is_not_null:true;[R1] [C1] column_value_new:[148](3);[R1] [C2] column_name:C1;[R1] [C2] column_type:MYSQL_TYPE_DOUBLE;[R1] [C2] column_is_rowkey:false;[R1] [C2] column_is_signed:true;[R1] [C2] column_encoding:binary;[R1] [C2] column_is_not_null:false;[R1] [C2] column_value_new:[1.234E+001](10);[R1] [C3] column_name:C2;[R1] [C3] column_type:MYSQL_TYPE_FLOAT;[R1] [C3] column_is_rowkey:false;[R1] [C3] column_is_signed:true;[R1] [C3] column_encoding:binary;[R1] [C3] column_is_not_null:false;[R1] [C3] column_value_new:[1.23400002E+001](15);[R1] [C4] column_name:C3;[R1] [C4] column_type:MYSQL_TYPE_NEWDECIMAL;[R1] [C4] column_is_rowkey:false;[R1] [C4] column_is_signed:true;[R1] [C4] column_encoding:binary;[R1] [C4] column_is_not_null:false;[R1] [C4] column_value_new:[12.34](5);[R1] [C5] column_name:C4;[R1] [C5] column_type:MYSQL_TYPE_OB_NUMBER_FLOAT;[R1] [C5] column_is_rowkey:false;[R1] [C5] column_is_signed:true;[R1] [C5] column_encoding:binary;[R1] [C5] column_is_not_null:false;[R1] [C5] column_value_new:[12.34](5);[R1] [C6] column_name:C5;[R1] [C6] column_type:MYSQL_TYPE_OB_NUMBER_FLOAT;[R1] [C6] column_is_rowkey:false;[R1] [C6] column_is_signed:true;[R1] [C6] column_encoding:binary;[R1] [C6] column_is_not_null:false;[R1] [C6] column_value_new:[12.34](5);[R1] [C7] column_name:C6;[R1] [C7] column_type:MYSQL_TYPE_VAR_STRING;[R1] [C7] column_is_rowkey:false;[R1] [C7] column_is_signed:true;[R1] [C7] column_encoding:utf8mb4;[R1] [C7] column_is_not_null:false;[R1] [C7] column_value_new:[-123456789012.34567890](22);[R1] [C8] column_name:C7;[R1] [C8] column_type:MYSQL_TYPE_STRING;[R1] [C8] column_is_rowkey:false;[R1] [C8] column_is_signed:true;[R1] [C8] column_encoding:utf8mb4;[R1] [C8] column_is_not_null:false;[R1] [C8] column_value_new:[12.34                                                                                               ](100);$[R2] COMMIT;
insert into number_1 (c0, c6) values (49+100,'-12345678901.234567890');
ob1.oblog.next;
[R0] BEGIN;[R0] org_cluster_id:1;[R1] record_type:INSERT;[R1] database_name:oracle.OBLOG_DB;[R1] table_name:NUMBER_1;[R1] log_event:true;[R1] column_count:8;[R1] source_category:SRC_FULL_RECORDED;[R1] source_type:SRC_OCEANBASE_1_0;[R1] has_pk:true;[R1] pk_info:(0);[R1] pks:C0;[R1] has_uk:false;[R1] uk_info:(null);[R1] uks:(null);[R1] [C1] column_name:C0;[R1] [C1] column_type:MYSQL_TYPE_NEWDECIMAL;[R1] [C1] column_is_rowkey:true;[R1] [C1] column_is_signed:true;[R1] [C1] column_encoding:binary;[R1] [C1] column_is_not_null:true;[R1] [C1] column_value_new:[149](3);[R1] [C2] column_name:C1;[R1] [C2] column_type:MYSQL_TYPE_DOUBLE;[R1] [C2] column_is_rowkey:false;[R1] [C2] column_is_signed:true;[R1] [C2] column_encoding:binary;[R1] [C2] column_is_not_null:false;[R1] [C2] column_value_new:[1.234E+001](10);[R1] [C3] column_name:C2;[R1] [C3] column_type:MYSQL_TYPE_FLOAT;[R1] [C3] column_is_rowkey:false;[R1] [C3] column_is_signed:true;[R1] [C3] column_encoding:binary;[R1] [C3] column_is_not_null:false;[R1] [C3] column_value_new:[1.23400002E+001](15);[R1] [C4] column_name:C3;[R1] [C4] column_type:MYSQL_TYPE_NEWDECIMAL;[R1] [C4] column_is_rowkey:false;[R1] [C4] column_is_signed:true;[R1] [C4] column_encoding:binary;[R1] [C4] column_is_not_null:false;[R1] [C4] column_value_new:[12.34](5);[R1] [C5] column_name:C4;[R1] [C5] column_type:MYSQL_TYPE_OB_NUMBER_FLOAT;[R1] [C5] column_is_rowkey:false;[R1] [C5] column_is_signed:true;[R1] [C5] column_encoding:binary;[R1] [C5] column_is_not_null:false;[R1] [C5] column_value_new:[12.34](5);[R1] [C6] column_name:C5;[R1] [C6] column_type:MYSQL_TYPE_OB_NUMBER_FLOAT;[R1] [C6] column_is_rowkey:false;[R1] [C6] column_is_signed:true;[R1] [C6] column_encoding:binary;[R1] [C6] column_is_not_null:false;[R1] [C6] column_value_new:[12.34](5);[R1] [C7] column_name:C6;[R1] [C7] column_type:MYSQL_TYPE_VAR_STRING;[R1] [C7] column_is_rowkey:false;[R1] [C7] column_is_signed:true;[R1] [C7] column_encoding:utf8mb4;[R1] [C7] column_is_not_null:false;[R1] [C7] column_value_new:[-12345678901.234567890](22);[R1] [C8] column_name:C7;[R1] [C8] column_type:MYSQL_TYPE_STRING;[R1] [C8] column_is_rowkey:false;[R1] [C8] column_is_signed:true;[R1] [C8] column_encoding:utf8mb4;[R1] [C8] column_is_not_null:false;[R1] [C8] column_value_new:[12.34                                                                                               ](100);$[R2] COMMIT;
insert into number_1 (c0, c6) values (50+100,'-1234567890.1234567890');
ob1.oblog.next;
[R0] BEGIN;[R0] org_cluster_id:1;[R1] record_type:INSERT;[R1] database_name:oracle.OBLOG_DB;[R1] table_name:NUMBER_1;[R1] log_event:true;[R1] column_count:8;[R1] source_category:SRC_FULL_RECORDED;[R1] source_type:SRC_OCEANBASE_1_0;[R1] has_pk:true;[R1] pk_info:(0);[R1] pks:C0;[R1] has_uk:false;[R1] uk_info:(null);[R1] uks:(null);[R1] [C1] column_name:C0;[R1] [C1] column_type:MYSQL_TYPE_NEWDECIMAL;[R1] [C1] column_is_rowkey:true;[R1] [C1] column_is_signed:true;[R1] [C1] column_encoding:binary;[R1] [C1] column_is_not_null:true;[R1] [C1] column_value_new:[150](3);[R1] [C2] column_name:C1;[R1] [C2] column_type:MYSQL_TYPE_DOUBLE;[R1] [C2] column_is_rowkey:false;[R1] [C2] column_is_signed:true;[R1] [C2] column_encoding:binary;[R1] [C2] column_is_not_null:false;[R1] [C2] column_value_new:[1.234E+001](10);[R1] [C3] column_name:C2;[R1] [C3] column_type:MYSQL_TYPE_FLOAT;[R1] [C3] column_is_rowkey:false;[R1] [C3] column_is_signed:true;[R1] [C3] column_encoding:binary;[R1] [C3] column_is_not_null:false;[R1] [C3] column_value_new:[1.23400002E+001](15);[R1] [C4] column_name:C3;[R1] [C4] column_type:MYSQL_TYPE_NEWDECIMAL;[R1] [C4] column_is_rowkey:false;[R1] [C4] column_is_signed:true;[R1] [C4] column_encoding:binary;[R1] [C4] column_is_not_null:false;[R1] [C4] column_value_new:[12.34](5);[R1] [C5] column_name:C4;[R1] [C5] column_type:MYSQL_TYPE_OB_NUMBER_FLOAT;[R1] [C5] column_is_rowkey:false;[R1] [C5] column_is_signed:true;[R1] [C5] column_encoding:binary;[R1] [C5] column_is_not_null:false;[R1] [C5] column_value_new:[12.34](5);[R1] [C6] column_name:C5;[R1] [C6] column_type:MYSQL_TYPE_OB_NUMBER_FLOAT;[R1] [C6] column_is_rowkey:false;[R1] [C6] column_is_signed:true;[R1] [C6] column_encoding:binary;[R1] [C6] column_is_not_null:false;[R1] [C6] column_value_new:[12.34](5);[R1] [C7] column_name:C6;[R1] [C7] column_type:MYSQL_TYPE_VAR_STRING;[R1] [C7] column_is_rowkey:false;[R1] [C7] column_is_signed:true;[R1] [C7] column_encoding:utf8mb4;[R1] [C7] column_is_not_null:false;[R1] [C7] column_value_new:[-1234567890.1234567890](22);[R1] [C8] column_name:C7;[R1] [C8] column_type:MYSQL_TYPE_STRING;[R1] [C8] column_is_rowkey:false;[R1] [C8] column_is_signed:true;[R1] [C8] column_encoding:utf8mb4;[R1] [C8] column_is_not_null:false;[R1] [C8] column_value_new:[12.34                                                                                               ](100);$[R2] COMMIT;
insert into number_1 (c0, c6) values (51+100,'-123456789.01234567890');
ob1.oblog.next;
[R0] BEGIN;[R0] org_cluster_id:1;[R1] record_type:INSERT;[R1] database_name:oracle.OBLOG_DB;[R1] table_name:NUMBER_1;[R1] log_event:true;[R1] column_count:8;[R1] source_category:SRC_FULL_RECORDED;[R1] source_type:SRC_OCEANBASE_1_0;[R1] has_pk:true;[R1] pk_info:(0);[R1] pks:C0;[R1] has_uk:false;[R1] uk_info:(null);[R1] uks:(null);[R1] [C1] column_name:C0;[R1] [C1] column_type:MYSQL_TYPE_NEWDECIMAL;[R1] [C1] column_is_rowkey:true;[R1] [C1] column_is_signed:true;[R1] [C1] column_encoding:binary;[R1] [C1] column_is_not_null:true;[R1] [C1] column_value_new:[151](3);[R1] [C2] column_name:C1;[R1] [C2] column_type:MYSQL_TYPE_DOUBLE;[R1] [C2] column_is_rowkey:false;[R1] [C2] column_is_signed:true;[R1] [C2] column_encoding:binary;[R1] [C2] column_is_not_null:false;[R1] [C2] column_value_new:[1.234E+001](10);[R1] [C3] column_name:C2;[R1] [C3] column_type:MYSQL_TYPE_FLOAT;[R1] [C3] column_is_rowkey:false;[R1] [C3] column_is_signed:true;[R1] [C3] column_encoding:binary;[R1] [C3] column_is_not_null:false;[R1] [C3] column_value_new:[1.23400002E+001](15);[R1] [C4] column_name:C3;[R1] [C4] column_type:MYSQL_TYPE_NEWDECIMAL;[R1] [C4] column_is_rowkey:false;[R1] [C4] column_is_signed:true;[R1] [C4] column_encoding:binary;[R1] [C4] column_is_not_null:false;[R1] [C4] column_value_new:[12.34](5);[R1] [C5] column_name:C4;[R1] [C5] column_type:MYSQL_TYPE_OB_NUMBER_FLOAT;[R1] [C5] column_is_rowkey:false;[R1] [C5] column_is_signed:true;[R1] [C5] column_encoding:binary;[R1] [C5] column_is_not_null:false;[R1] [C5] column_value_new:[12.34](5);[R1] [C6] column_name:C5;[R1] [C6] column_type:MYSQL_TYPE_OB_NUMBER_FLOAT;[R1] [C6] column_is_rowkey:false;[R1] [C6] column_is_signed:true;[R1] [C6] column_encoding:binary;[R1] [C6] column_is_not_null:false;[R1] [C6] column_value_new:[12.34](5);[R1] [C7] column_name:C6;[R1] [C7] column_type:MYSQL_TYPE_VAR_STRING;[R1] [C7] column_is_rowkey:false;[R1] [C7] column_is_signed:true;[R1] [C7] column_encoding:utf8mb4;[R1] [C7] column_is_not_null:false;[R1] [C7] column_value_new:[-123456789.01234567890](22);[R1] [C8] column_name:C7;[R1] [C8] column_type:MYSQL_TYPE_STRING;[R1] [C8] column_is_rowkey:false;[R1] [C8] column_is_signed:true;[R1] [C8] column_encoding:utf8mb4;[R1] [C8] column_is_not_null:false;[R1] [C8] column_value_new:[12.34                                                                                               ](100);$[R2] COMMIT;
insert into number_1 (c0, c6) values (52+100,'-12345678.901234567890');
ob1.oblog.next;
[R0] BEGIN;[R0] org_cluster_id:1;[R1] record_type:INSERT;[R1] database_name:oracle.OBLOG_DB;[R1] table_name:NUMBER_1;[R1] log_event:true;[R1] column_count:8;[R1] source_category:SRC_FULL_RECORDED;[R1] source_type:SRC_OCEANBASE_1_0;[R1] has_pk:true;[R1] pk_info:(0);[R1] pks:C0;[R1] has_uk:false;[R1] uk_info:(null);[R1] uks:(null);[R1] [C1] column_name:C0;[R1] [C1] column_type:MYSQL_TYPE_NEWDECIMAL;[R1] [C1] column_is_rowkey:true;[R1] [C1] column_is_signed:true;[R1] [C1] column_encoding:binary;[R1] [C1] column_is_not_null:true;[R1] [C1] column_value_new:[152](3);[R1] [C2] column_name:C1;[R1] [C2] column_type:MYSQL_TYPE_DOUBLE;[R1] [C2] column_is_rowkey:false;[R1] [C2] column_is_signed:true;[R1] [C2] column_encoding:binary;[R1] [C2] column_is_not_null:false;[R1] [C2] column_value_new:[1.234E+001](10);[R1] [C3] column_name:C2;[R1] [C3] column_type:MYSQL_TYPE_FLOAT;[R1] [C3] column_is_rowkey:false;[R1] [C3] column_is_signed:true;[R1] [C3] column_encoding:binary;[R1] [C3] column_is_not_null:false;[R1] [C3] column_value_new:[1.23400002E+001](15);[R1] [C4] column_name:C3;[R1] [C4] column_type:MYSQL_TYPE_NEWDECIMAL;[R1] [C4] column_is_rowkey:false;[R1] [C4] column_is_signed:true;[R1] [C4] column_encoding:binary;[R1] [C4] column_is_not_null:false;[R1] [C4] column_value_new:[12.34](5);[R1] [C5] column_name:C4;[R1] [C5] column_type:MYSQL_TYPE_OB_NUMBER_FLOAT;[R1] [C5] column_is_rowkey:false;[R1] [C5] column_is_signed:true;[R1] [C5] column_encoding:binary;[R1] [C5] column_is_not_null:false;[R1] [C5] column_value_new:[12.34](5);[R1] [C6] column_name:C5;[R1] [C6] column_type:MYSQL_TYPE_OB_NUMBER_FLOAT;[R1] [C6] column_is_rowkey:false;[R1] [C6] column_is_signed:true;[R1] [C6] column_encoding:binary;[R1] [C6] column_is_not_null:false;[R1] [C6] column_value_new:[12.34](5);[R1] [C7] column_name:C6;[R1] [C7] column_type:MYSQL_TYPE_VAR_STRING;[R1] [C7] column_is_rowkey:false;[R1] [C7] column_is_signed:true;[R1] [C7] column_encoding:utf8mb4;[R1] [C7] column_is_not_null:false;[R1] [C7] column_value_new:[-12345678.901234567890](22);[R1] [C8] column_name:C7;[R1] [C8] column_type:MYSQL_TYPE_STRING;[R1] [C8] column_is_rowkey:false;[R1] [C8] column_is_signed:true;[R1] [C8] column_encoding:utf8mb4;[R1] [C8] column_is_not_null:false;[R1] [C8] column_value_new:[12.34                                                                                               ](100);$[R2] COMMIT;
insert into number_1 (c0, c6) values (53+100,'-1234567.8901234567890');
ob1.oblog.next;
[R0] BEGIN;[R0] org_cluster_id:1;[R1] record_type:INSERT;[R1] database_name:oracle.OBLOG_DB;[R1] table_name:NUMBER_1;[R1] log_event:true;[R1] column_count:8;[R1] source_category:SRC_FULL_RECORDED;[R1] source_type:SRC_OCEANBASE_1_0;[R1] has_pk:true;[R1] pk_info:(0);[R1] pks:C0;[R1] has_uk:false;[R1] uk_info:(null);[R1] uks:(null);[R1] [C1] column_name:C0;[R1] [C1] column_type:MYSQL_TYPE_NEWDECIMAL;[R1] [C1] column_is_rowkey:true;[R1] [C1] column_is_signed:true;[R1] [C1] column_encoding:binary;[R1] [C1] column_is_not_null:true;[R1] [C1] column_value_new:[153](3);[R1] [C2] column_name:C1;[R1] [C2] column_type:MYSQL_TYPE_DOUBLE;[R1] [C2] column_is_rowkey:false;[R1] [C2] column_is_signed:true;[R1] [C2] column_encoding:binary;[R1] [C2] column_is_not_null:false;[R1] [C2] column_value_new:[1.234E+001](10);[R1] [C3] column_name:C2;[R1] [C3] column_type:MYSQL_TYPE_FLOAT;[R1] [C3] column_is_rowkey:false;[R1] [C3] column_is_signed:true;[R1] [C3] column_encoding:binary;[R1] [C3] column_is_not_null:false;[R1] [C3] column_value_new:[1.23400002E+001](15);[R1] [C4] column_name:C3;[R1] [C4] column_type:MYSQL_TYPE_NEWDECIMAL;[R1] [C4] column_is_rowkey:false;[R1] [C4] column_is_signed:true;[R1] [C4] column_encoding:binary;[R1] [C4] column_is_not_null:false;[R1] [C4] column_value_new:[12.34](5);[R1] [C5] column_name:C4;[R1] [C5] column_type:MYSQL_TYPE_OB_NUMBER_FLOAT;[R1] [C5] column_is_rowkey:false;[R1] [C5] column_is_signed:true;[R1] [C5] column_encoding:binary;[R1] [C5] column_is_not_null:false;[R1] [C5] column_value_new:[12.34](5);[R1] [C6] column_name:C5;[R1] [C6] column_type:MYSQL_TYPE_OB_NUMBER_FLOAT;[R1] [C6] column_is_rowkey:false;[R1] [C6] column_is_signed:true;[R1] [C6] column_encoding:binary;[R1] [C6] column_is_not_null:false;[R1] [C6] column_value_new:[12.34](5);[R1] [C7] column_name:C6;[R1] [C7] column_type:MYSQL_TYPE_VAR_STRING;[R1] [C7] column_is_rowkey:false;[R1] [C7] column_is_signed:true;[R1] [C7] column_encoding:utf8mb4;[R1] [C7] column_is_not_null:false;[R1] [C7] column_value_new:[-1234567.8901234567890](22);[R1] [C8] column_name:C7;[R1] [C8] column_type:MYSQL_TYPE_STRING;[R1] [C8] column_is_rowkey:false;[R1] [C8] column_is_signed:true;[R1] [C8] column_encoding:utf8mb4;[R1] [C8] column_is_not_null:false;[R1] [C8] column_value_new:[12.34                                                                                               ](100);$[R2] COMMIT;
insert into number_1 (c0, c6) values (54+100,'-123456.78901234567890');
ob1.oblog.next;
[R0] BEGIN;[R0] org_cluster_id:1;[R1] record_type:INSERT;[R1] database_name:oracle.OBLOG_DB;[R1] table_name:NUMBER_1;[R1] log_event:true;[R1] column_count:8;[R1] source_category:SRC_FULL_RECORDED;[R1] source_type:SRC_OCEANBASE_1_0;[R1] has_pk:true;[R1] pk_info:(0);[R1] pks:C0;[R1] has_uk:false;[R1] uk_info:(null);[R1] uks:(null);[R1] [C1] column_name:C0;[R1] [C1] column_type:MYSQL_TYPE_NEWDECIMAL;[R1] [C1] column_is_rowkey:true;[R1] [C1] column_is_signed:true;[R1] [C1] column_encoding:binary;[R1] [C1] column_is_not_null:true;[R1] [C1] column_value_new:[154](3);[R1] [C2] column_name:C1;[R1] [C2] column_type:MYSQL_TYPE_DOUBLE;[R1] [C2] column_is_rowkey:false;[R1] [C2] column_is_signed:true;[R1] [C2] column_encoding:binary;[R1] [C2] column_is_not_null:false;[R1] [C2] column_value_new:[1.234E+001](10);[R1] [C3] column_name:C2;[R1] [C3] column_type:MYSQL_TYPE_FLOAT;[R1] [C3] column_is_rowkey:false;[R1] [C3] column_is_signed:true;[R1] [C3] column_encoding:binary;[R1] [C3] column_is_not_null:false;[R1] [C3] column_value_new:[1.23400002E+001](15);[R1] [C4] column_name:C3;[R1] [C4] column_type:MYSQL_TYPE_NEWDECIMAL;[R1] [C4] column_is_rowkey:false;[R1] [C4] column_is_signed:true;[R1] [C4] column_encoding:binary;[R1] [C4] column_is_not_null:false;[R1] [C4] column_value_new:[12.34](5);[R1] [C5] column_name:C4;[R1] [C5] column_type:MYSQL_TYPE_OB_NUMBER_FLOAT;[R1] [C5] column_is_rowkey:false;[R1] [C5] column_is_signed:true;[R1] [C5] column_encoding:binary;[R1] [C5] column_is_not_null:false;[R1] [C5] column_value_new:[12.34](5);[R1] [C6] column_name:C5;[R1] [C6] column_type:MYSQL_TYPE_OB_NUMBER_FLOAT;[R1] [C6] column_is_rowkey:false;[R1] [C6] column_is_signed:true;[R1] [C6] column_encoding:binary;[R1] [C6] column_is_not_null:false;[R1] [C6] column_value_new:[12.34](5);[R1] [C7] column_name:C6;[R1] [C7] column_type:MYSQL_TYPE_VAR_STRING;[R1] [C7] column_is_rowkey:false;[R1] [C7] column_is_signed:true;[R1] [C7] column_encoding:utf8mb4;[R1] [C7] column_is_not_null:false;[R1] [C7] column_value_new:[-123456.78901234567890](22);[R1] [C8] column_name:C7;[R1] [C8] column_type:MYSQL_TYPE_STRING;[R1] [C8] column_is_rowkey:false;[R1] [C8] column_is_signed:true;[R1] [C8] column_encoding:utf8mb4;[R1] [C8] column_is_not_null:false;[R1] [C8] column_value_new:[12.34                                                                                               ](100);$[R2] COMMIT;
insert into number_1 (c0, c6) values (55+100,'-12345.678901234567890');
ob1.oblog.next;
[R0] BEGIN;[R0] org_cluster_id:1;[R1] record_type:INSERT;[R1] database_name:oracle.OBLOG_DB;[R1] table_name:NUMBER_1;[R1] log_event:true;[R1] column_count:8;[R1] source_category:SRC_FULL_RECORDED;[R1] source_type:SRC_OCEANBASE_1_0;[R1] has_pk:true;[R1] pk_info:(0);[R1] pks:C0;[R1] has_uk:false;[R1] uk_info:(null);[R1] uks:(null);[R1] [C1] column_name:C0;[R1] [C1] column_type:MYSQL_TYPE_NEWDECIMAL;[R1] [C1] column_is_rowkey:true;[R1] [C1] column_is_signed:true;[R1] [C1] column_encoding:binary;[R1] [C1] column_is_not_null:true;[R1] [C1] column_value_new:[155](3);[R1] [C2] column_name:C1;[R1] [C2] column_type:MYSQL_TYPE_DOUBLE;[R1] [C2] column_is_rowkey:false;[R1] [C2] column_is_signed:true;[R1] [C2] column_encoding:binary;[R1] [C2] column_is_not_null:false;[R1] [C2] column_value_new:[1.234E+001](10);[R1] [C3] column_name:C2;[R1] [C3] column_type:MYSQL_TYPE_FLOAT;[R1] [C3] column_is_rowkey:false;[R1] [C3] column_is_signed:true;[R1] [C3] column_encoding:binary;[R1] [C3] column_is_not_null:false;[R1] [C3] column_value_new:[1.23400002E+001](15);[R1] [C4] column_name:C3;[R1] [C4] column_type:MYSQL_TYPE_NEWDECIMAL;[R1] [C4] column_is_rowkey:false;[R1] [C4] column_is_signed:true;[R1] [C4] column_encoding:binary;[R1] [C4] column_is_not_null:false;[R1] [C4] column_value_new:[12.34](5);[R1] [C5] column_name:C4;[R1] [C5] column_type:MYSQL_TYPE_OB_NUMBER_FLOAT;[R1] [C5] column_is_rowkey:false;[R1] [C5] column_is_signed:true;[R1] [C5] column_encoding:binary;[R1] [C5] column_is_not_null:false;[R1] [C5] column_value_new:[12.34](5);[R1] [C6] column_name:C5;[R1] [C6] column_type:MYSQL_TYPE_OB_NUMBER_FLOAT;[R1] [C6] column_is_rowkey:false;[R1] [C6] column_is_signed:true;[R1] [C6] column_encoding:binary;[R1] [C6] column_is_not_null:false;[R1] [C6] column_value_new:[12.34](5);[R1] [C7] column_name:C6;[R1] [C7] column_type:MYSQL_TYPE_VAR_STRING;[R1] [C7] column_is_rowkey:false;[R1] [C7] column_is_signed:true;[R1] [C7] column_encoding:utf8mb4;[R1] [C7] column_is_not_null:false;[R1] [C7] column_value_new:[-12345.678901234567890](22);[R1] [C8] column_name:C7;[R1] [C8] column_type:MYSQL_TYPE_STRING;[R1] [C8] column_is_rowkey:false;[R1] [C8] column_is_signed:true;[R1] [C8] column_encoding:utf8mb4;[R1] [C8] column_is_not_null:false;[R1] [C8] column_value_new:[12.34                                                                                               ](100);$[R2] COMMIT;
insert into number_1 (c0, c6) values (56+100,'-1234.5678901234567890');
ob1.oblog.next;
[R0] BEGIN;[R0] org_cluster_id:1;[R1] record_type:INSERT;[R1] database_name:oracle.OBLOG_DB;[R1] table_name:NUMBER_1;[R1] log_event:true;[R1] column_count:8;[R1] source_category:SRC_FULL_RECORDED;[R1] source_type:SRC_OCEANBASE_1_0;[R1] has_pk:true;[R1] pk_info:(0);[R1] pks:C0;[R1] has_uk:false;[R1] uk_info:(null);[R1] uks:(null);[R1] [C1] column_name:C0;[R1] [C1] column_type:MYSQL_TYPE_NEWDECIMAL;[R1] [C1] column_is_rowkey:true;[R1] [C1] column_is_signed:true;[R1] [C1] column_encoding:binary;[R1] [C1] column_is_not_null:true;[R1] [C1] column_value_new:[156](3);[R1] [C2] column_name:C1;[R1] [C2] column_type:MYSQL_TYPE_DOUBLE;[R1] [C2] column_is_rowkey:false;[R1] [C2] column_is_signed:true;[R1] [C2] column_encoding:binary;[R1] [C2] column_is_not_null:false;[R1] [C2] column_value_new:[1.234E+001](10);[R1] [C3] column_name:C2;[R1] [C3] column_type:MYSQL_TYPE_FLOAT;[R1] [C3] column_is_rowkey:false;[R1] [C3] column_is_signed:true;[R1] [C3] column_encoding:binary;[R1] [C3] column_is_not_null:false;[R1] [C3] column_value_new:[1.23400002E+001](15);[R1] [C4] column_name:C3;[R1] [C4] column_type:MYSQL_TYPE_NEWDECIMAL;[R1] [C4] column_is_rowkey:false;[R1] [C4] column_is_signed:true;[R1] [C4] column_encoding:binary;[R1] [C4] column_is_not_null:false;[R1] [C4] column_value_new:[12.34](5);[R1] [C5] column_name:C4;[R1] [C5] column_type:MYSQL_TYPE_OB_NUMBER_FLOAT;[R1] [C5] column_is_rowkey:false;[R1] [C5] column_is_signed:true;[R1] [C5] column_encoding:binary;[R1] [C5] column_is_not_null:false;[R1] [C5] column_value_new:[12.34](5);[R1] [C6] column_name:C5;[R1] [C6] column_type:MYSQL_TYPE_OB_NUMBER_FLOAT;[R1] [C6] column_is_rowkey:false;[R1] [C6] column_is_signed:true;[R1] [C6] column_encoding:binary;[R1] [C6] column_is_not_null:false;[R1] [C6] column_value_new:[12.34](5);[R1] [C7] column_name:C6;[R1] [C7] column_type:MYSQL_TYPE_VAR_STRING;[R1] [C7] column_is_rowkey:false;[R1] [C7] column_is_signed:true;[R1] [C7] column_encoding:utf8mb4;[R1] [C7] column_is_not_null:false;[R1] [C7] column_value_new:[-1234.5678901234567890](22);[R1] [C8] column_name:C7;[R1] [C8] column_type:MYSQL_TYPE_STRING;[R1] [C8] column_is_rowkey:false;[R1] [C8] column_is_signed:true;[R1] [C8] column_encoding:utf8mb4;[R1] [C8] column_is_not_null:false;[R1] [C8] column_value_new:[12.34                                                                                               ](100);$[R2] COMMIT;
insert into number_1 (c0, c6) values (57+100,'-123.45678901234567890');
ob1.oblog.next;
[R0] BEGIN;[R0] org_cluster_id:1;[R1] record_type:INSERT;[R1] database_name:oracle.OBLOG_DB;[R1] table_name:NUMBER_1;[R1] log_event:true;[R1] column_count:8;[R1] source_category:SRC_FULL_RECORDED;[R1] source_type:SRC_OCEANBASE_1_0;[R1] has_pk:true;[R1] pk_info:(0);[R1] pks:C0;[R1] has_uk:false;[R1] uk_info:(null);[R1] uks:(null);[R1] [C1] column_name:C0;[R1] [C1] column_type:MYSQL_TYPE_NEWDECIMAL;[R1] [C1] column_is_rowkey:true;[R1] [C1] column_is_signed:true;[R1] [C1] column_encoding:binary;[R1] [C1] column_is_not_null:true;[R1] [C1] column_value_new:[157](3);[R1] [C2] column_name:C1;[R1] [C2] column_type:MYSQL_TYPE_DOUBLE;[R1] [C2] column_is_rowkey:false;[R1] [C2] column_is_signed:true;[R1] [C2] column_encoding:binary;[R1] [C2] column_is_not_null:false;[R1] [C2] column_value_new:[1.234E+001](10);[R1] [C3] column_name:C2;[R1] [C3] column_type:MYSQL_TYPE_FLOAT;[R1] [C3] column_is_rowkey:false;[R1] [C3] column_is_signed:true;[R1] [C3] column_encoding:binary;[R1] [C3] column_is_not_null:false;[R1] [C3] column_value_new:[1.23400002E+001](15);[R1] [C4] column_name:C3;[R1] [C4] column_type:MYSQL_TYPE_NEWDECIMAL;[R1] [C4] column_is_rowkey:false;[R1] [C4] column_is_signed:true;[R1] [C4] column_encoding:binary;[R1] [C4] column_is_not_null:false;[R1] [C4] column_value_new:[12.34](5);[R1] [C5] column_name:C4;[R1] [C5] column_type:MYSQL_TYPE_OB_NUMBER_FLOAT;[R1] [C5] column_is_rowkey:false;[R1] [C5] column_is_signed:true;[R1] [C5] column_encoding:binary;[R1] [C5] column_is_not_null:false;[R1] [C5] column_value_new:[12.34](5);[R1] [C6] column_name:C5;[R1] [C6] column_type:MYSQL_TYPE_OB_NUMBER_FLOAT;[R1] [C6] column_is_rowkey:false;[R1] [C6] column_is_signed:true;[R1] [C6] column_encoding:binary;[R1] [C6] column_is_not_null:false;[R1] [C6] column_value_new:[12.34](5);[R1] [C7] column_name:C6;[R1] [C7] column_type:MYSQL_TYPE_VAR_STRING;[R1] [C7] column_is_rowkey:false;[R1] [C7] column_is_signed:true;[R1] [C7] column_encoding:utf8mb4;[R1] [C7] column_is_not_null:false;[R1] [C7] column_value_new:[-123.45678901234567890](22);[R1] [C8] column_name:C7;[R1] [C8] column_type:MYSQL_TYPE_STRING;[R1] [C8] column_is_rowkey:false;[R1] [C8] column_is_signed:true;[R1] [C8] column_encoding:utf8mb4;[R1] [C8] column_is_not_null:false;[R1] [C8] column_value_new:[12.34                                                                                               ](100);$[R2] COMMIT;
insert into number_1 (c0, c6) values (58+100,'-12.345678901234567890');
ob1.oblog.next;
[R0] BEGIN;[R0] org_cluster_id:1;[R1] record_type:INSERT;[R1] database_name:oracle.OBLOG_DB;[R1] table_name:NUMBER_1;[R1] log_event:true;[R1] column_count:8;[R1] source_category:SRC_FULL_RECORDED;[R1] source_type:SRC_OCEANBASE_1_0;[R1] has_pk:true;[R1] pk_info:(0);[R1] pks:C0;[R1] has_uk:false;[R1] uk_info:(null);[R1] uks:(null);[R1] [C1] column_name:C0;[R1] [C1] column_type:MYSQL_TYPE_NEWDECIMAL;[R1] [C1] column_is_rowkey:true;[R1] [C1] column_is_signed:true;[R1] [C1] column_encoding:binary;[R1] [C1] column_is_not_null:true;[R1] [C1] column_value_new:[158](3);[R1] [C2] column_name:C1;[R1] [C2] column_type:MYSQL_TYPE_DOUBLE;[R1] [C2] column_is_rowkey:false;[R1] [C2] column_is_signed:true;[R1] [C2] column_encoding:binary;[R1] [C2] column_is_not_null:false;[R1] [C2] column_value_new:[1.234E+001](10);[R1] [C3] column_name:C2;[R1] [C3] column_type:MYSQL_TYPE_FLOAT;[R1] [C3] column_is_rowkey:false;[R1] [C3] column_is_signed:true;[R1] [C3] column_encoding:binary;[R1] [C3] column_is_not_null:false;[R1] [C3] column_value_new:[1.23400002E+001](15);[R1] [C4] column_name:C3;[R1] [C4] column_type:MYSQL_TYPE_NEWDECIMAL;[R1] [C4] column_is_rowkey:false;[R1] [C4] column_is_signed:true;[R1] [C4] column_encoding:binary;[R1] [C4] column_is_not_null:false;[R1] [C4] column_value_new:[12.34](5);[R1] [C5] column_name:C4;[R1] [C5] column_type:MYSQL_TYPE_OB_NUMBER_FLOAT;[R1] [C5] column_is_rowkey:false;[R1] [C5] column_is_signed:true;[R1] [C5] column_encoding:binary;[R1] [C5] column_is_not_null:false;[R1] [C5] column_value_new:[12.34](5);[R1] [C6] column_name:C5;[R1] [C6] column_type:MYSQL_TYPE_OB_NUMBER_FLOAT;[R1] [C6] column_is_rowkey:false;[R1] [C6] column_is_signed:true;[R1] [C6] column_encoding:binary;[R1] [C6] column_is_not_null:false;[R1] [C6] column_value_new:[12.34](5);[R1] [C7] column_name:C6;[R1] [C7] column_type:MYSQL_TYPE_VAR_STRING;[R1] [C7] column_is_rowkey:false;[R1] [C7] column_is_signed:true;[R1] [C7] column_encoding:utf8mb4;[R1] [C7] column_is_not_null:false;[R1] [C7] column_value_new:[-12.345678901234567890](22);[R1] [C8] column_name:C7;[R1] [C8] column_type:MYSQL_TYPE_STRING;[R1] [C8] column_is_rowkey:false;[R1] [C8] column_is_signed:true;[R1] [C8] column_encoding:utf8mb4;[R1] [C8] column_is_not_null:false;[R1] [C8] column_value_new:[12.34                                                                                               ](100);$[R2] COMMIT;
insert into number_1 (c0, c6) values (59+100,'-1.2345678901234567890');
ob1.oblog.next;
[R0] BEGIN;[R0] org_cluster_id:1;[R1] record_type:INSERT;[R1] database_name:oracle.OBLOG_DB;[R1] table_name:NUMBER_1;[R1] log_event:true;[R1] column_count:8;[R1] source_category:SRC_FULL_RECORDED;[R1] source_type:SRC_OCEANBASE_1_0;[R1] has_pk:true;[R1] pk_info:(0);[R1] pks:C0;[R1] has_uk:false;[R1] uk_info:(null);[R1] uks:(null);[R1] [C1] column_name:C0;[R1] [C1] column_type:MYSQL_TYPE_NEWDECIMAL;[R1] [C1] column_is_rowkey:true;[R1] [C1] column_is_signed:true;[R1] [C1] column_encoding:binary;[R1] [C1] column_is_not_null:true;[R1] [C1] column_value_new:[159](3);[R1] [C2] column_name:C1;[R1] [C2] column_type:MYSQL_TYPE_DOUBLE;[R1] [C2] column_is_rowkey:false;[R1] [C2] column_is_signed:true;[R1] [C2] column_encoding:binary;[R1] [C2] column_is_not_null:false;[R1] [C2] column_value_new:[1.234E+001](10);[R1] [C3] column_name:C2;[R1] [C3] column_type:MYSQL_TYPE_FLOAT;[R1] [C3] column_is_rowkey:false;[R1] [C3] column_is_signed:true;[R1] [C3] column_encoding:binary;[R1] [C3] column_is_not_null:false;[R1] [C3] column_value_new:[1.23400002E+001](15);[R1] [C4] column_name:C3;[R1] [C4] column_type:MYSQL_TYPE_NEWDECIMAL;[R1] [C4] column_is_rowkey:false;[R1] [C4] column_is_signed:true;[R1] [C4] column_encoding:binary;[R1] [C4] column_is_not_null:false;[R1] [C4] column_value_new:[12.34](5);[R1] [C5] column_name:C4;[R1] [C5] column_type:MYSQL_TYPE_OB_NUMBER_FLOAT;[R1] [C5] column_is_rowkey:false;[R1] [C5] column_is_signed:true;[R1] [C5] column_encoding:binary;[R1] [C5] column_is_not_null:false;[R1] [C5] column_value_new:[12.34](5);[R1] [C6] column_name:C5;[R1] [C6] column_type:MYSQL_TYPE_OB_NUMBER_FLOAT;[R1] [C6] column_is_rowkey:false;[R1] [C6] column_is_signed:true;[R1] [C6] column_encoding:binary;[R1] [C6] column_is_not_null:false;[R1] [C6] column_value_new:[12.34](5);[R1] [C7] column_name:C6;[R1] [C7] column_type:MYSQL_TYPE_VAR_STRING;[R1] [C7] column_is_rowkey:false;[R1] [C7] column_is_signed:true;[R1] [C7] column_encoding:utf8mb4;[R1] [C7] column_is_not_null:false;[R1] [C7] column_value_new:[-1.2345678901234567890](22);[R1] [C8] column_name:C7;[R1] [C8] column_type:MYSQL_TYPE_STRING;[R1] [C8] column_is_rowkey:false;[R1] [C8] column_is_signed:true;[R1] [C8] column_encoding:utf8mb4;[R1] [C8] column_is_not_null:false;[R1] [C8] column_value_new:[12.34                                                                                               ](100);$[R2] COMMIT;
insert into number_1 (c0, c6) values (60+100,'-0.1234567890123456789');
ob1.oblog.next;
[R0] BEGIN;[R0] org_cluster_id:1;[R1] record_type:INSERT;[R1] database_name:oracle.OBLOG_DB;[R1] table_name:NUMBER_1;[R1] log_event:true;[R1] column_count:8;[R1] source_category:SRC_FULL_RECORDED;[R1] source_type:SRC_OCEANBASE_1_0;[R1] has_pk:true;[R1] pk_info:(0);[R1] pks:C0;[R1] has_uk:false;[R1] uk_info:(null);[R1] uks:(null);[R1] [C1] column_name:C0;[R1] [C1] column_type:MYSQL_TYPE_NEWDECIMAL;[R1] [C1] column_is_rowkey:true;[R1] [C1] column_is_signed:true;[R1] [C1] column_encoding:binary;[R1] [C1] column_is_not_null:true;[R1] [C1] column_value_new:[160](3);[R1] [C2] column_name:C1;[R1] [C2] column_type:MYSQL_TYPE_DOUBLE;[R1] [C2] column_is_rowkey:false;[R1] [C2] column_is_signed:true;[R1] [C2] column_encoding:binary;[R1] [C2] column_is_not_null:false;[R1] [C2] column_value_new:[1.234E+001](10);[R1] [C3] column_name:C2;[R1] [C3] column_type:MYSQL_TYPE_FLOAT;[R1] [C3] column_is_rowkey:false;[R1] [C3] column_is_signed:true;[R1] [C3] column_encoding:binary;[R1] [C3] column_is_not_null:false;[R1] [C3] column_value_new:[1.23400002E+001](15);[R1] [C4] column_name:C3;[R1] [C4] column_type:MYSQL_TYPE_NEWDECIMAL;[R1] [C4] column_is_rowkey:false;[R1] [C4] column_is_signed:true;[R1] [C4] column_encoding:binary;[R1] [C4] column_is_not_null:false;[R1] [C4] column_value_new:[12.34](5);[R1] [C5] column_name:C4;[R1] [C5] column_type:MYSQL_TYPE_OB_NUMBER_FLOAT;[R1] [C5] column_is_rowkey:false;[R1] [C5] column_is_signed:true;[R1] [C5] column_encoding:binary;[R1] [C5] column_is_not_null:false;[R1] [C5] column_value_new:[12.34](5);[R1] [C6] column_name:C5;[R1] [C6] column_type:MYSQL_TYPE_OB_NUMBER_FLOAT;[R1] [C6] column_is_rowkey:false;[R1] [C6] column_is_signed:true;[R1] [C6] column_encoding:binary;[R1] [C6] column_is_not_null:false;[R1] [C6] column_value_new:[12.34](5);[R1] [C7] column_name:C6;[R1] [C7] column_type:MYSQL_TYPE_VAR_STRING;[R1] [C7] column_is_rowkey:false;[R1] [C7] column_is_signed:true;[R1] [C7] column_encoding:utf8mb4;[R1] [C7] column_is_not_null:false;[R1] [C7] column_value_new:[-0.1234567890123456789](22);[R1] [C8] column_name:C7;[R1] [C8] column_type:MYSQL_TYPE_STRING;[R1] [C8] column_is_rowkey:false;[R1] [C8] column_is_signed:true;[R1] [C8] column_encoding:utf8mb4;[R1] [C8] column_is_not_null:false;[R1] [C8] column_value_new:[12.34                                                                                               ](100);$[R2] COMMIT;
insert into number_1 (c0, c6) values (61+100,'-0.1234567890123456789');
ob1.oblog.next;
[R0] BEGIN;[R0] org_cluster_id:1;[R1] record_type:INSERT;[R1] database_name:oracle.OBLOG_DB;[R1] table_name:NUMBER_1;[R1] log_event:true;[R1] column_count:8;[R1] source_category:SRC_FULL_RECORDED;[R1] source_type:SRC_OCEANBASE_1_0;[R1] has_pk:true;[R1] pk_info:(0);[R1] pks:C0;[R1] has_uk:false;[R1] uk_info:(null);[R1] uks:(null);[R1] [C1] column_name:C0;[R1] [C1] column_type:MYSQL_TYPE_NEWDECIMAL;[R1] [C1] column_is_rowkey:true;[R1] [C1] column_is_signed:true;[R1] [C1] column_encoding:binary;[R1] [C1] column_is_not_null:true;[R1] [C1] column_value_new:[161](3);[R1] [C2] column_name:C1;[R1] [C2] column_type:MYSQL_TYPE_DOUBLE;[R1] [C2] column_is_rowkey:false;[R1] [C2] column_is_signed:true;[R1] [C2] column_encoding:binary;[R1] [C2] column_is_not_null:false;[R1] [C2] column_value_new:[1.234E+001](10);[R1] [C3] column_name:C2;[R1] [C3] column_type:MYSQL_TYPE_FLOAT;[R1] [C3] column_is_rowkey:false;[R1] [C3] column_is_signed:true;[R1] [C3] column_encoding:binary;[R1] [C3] column_is_not_null:false;[R1] [C3] column_value_new:[1.23400002E+001](15);[R1] [C4] column_name:C3;[R1] [C4] column_type:MYSQL_TYPE_NEWDECIMAL;[R1] [C4] column_is_rowkey:false;[R1] [C4] column_is_signed:true;[R1] [C4] column_encoding:binary;[R1] [C4] column_is_not_null:false;[R1] [C4] column_value_new:[12.34](5);[R1] [C5] column_name:C4;[R1] [C5] column_type:MYSQL_TYPE_OB_NUMBER_FLOAT;[R1] [C5] column_is_rowkey:false;[R1] [C5] column_is_signed:true;[R1] [C5] column_encoding:binary;[R1] [C5] column_is_not_null:false;[R1] [C5] column_value_new:[12.34](5);[R1] [C6] column_name:C5;[R1] [C6] column_type:MYSQL_TYPE_OB_NUMBER_FLOAT;[R1] [C6] column_is_rowkey:false;[R1] [C6] column_is_signed:true;[R1] [C6] column_encoding:binary;[R1] [C6] column_is_not_null:false;[R1] [C6] column_value_new:[12.34](5);[R1] [C7] column_name:C6;[R1] [C7] column_type:MYSQL_TYPE_VAR_STRING;[R1] [C7] column_is_rowkey:false;[R1] [C7] column_is_signed:true;[R1] [C7] column_encoding:utf8mb4;[R1] [C7] column_is_not_null:false;[R1] [C7] column_value_new:[-0.1234567890123456789](22);[R1] [C8] column_name:C7;[R1] [C8] column_type:MYSQL_TYPE_STRING;[R1] [C8] column_is_rowkey:false;[R1] [C8] column_is_signed:true;[R1] [C8] column_encoding:utf8mb4;[R1] [C8] column_is_not_null:false;[R1] [C8] column_value_new:[12.34                                                                                               ](100);$[R2] COMMIT;
insert into number_1 (c0, c6) values (62+100,'-0.123456789012345678');
ob1.oblog.next;
[R0] BEGIN;[R0] org_cluster_id:1;[R1] record_type:INSERT;[R1] database_name:oracle.OBLOG_DB;[R1] table_name:NUMBER_1;[R1] log_event:true;[R1] column_count:8;[R1] source_category:SRC_FULL_RECORDED;[R1] source_type:SRC_OCEANBASE_1_0;[R1] has_pk:true;[R1] pk_info:(0);[R1] pks:C0;[R1] has_uk:false;[R1] uk_info:(null);[R1] uks:(null);[R1] [C1] column_name:C0;[R1] [C1] column_type:MYSQL_TYPE_NEWDECIMAL;[R1] [C1] column_is_rowkey:true;[R1] [C1] column_is_signed:true;[R1] [C1] column_encoding:binary;[R1] [C1] column_is_not_null:true;[R1] [C1] column_value_new:[162](3);[R1] [C2] column_name:C1;[R1] [C2] column_type:MYSQL_TYPE_DOUBLE;[R1] [C2] column_is_rowkey:false;[R1] [C2] column_is_signed:true;[R1] [C2] column_encoding:binary;[R1] [C2] column_is_not_null:false;[R1] [C2] column_value_new:[1.234E+001](10);[R1] [C3] column_name:C2;[R1] [C3] column_type:MYSQL_TYPE_FLOAT;[R1] [C3] column_is_rowkey:false;[R1] [C3] column_is_signed:true;[R1] [C3] column_encoding:binary;[R1] [C3] column_is_not_null:false;[R1] [C3] column_value_new:[1.23400002E+001](15);[R1] [C4] column_name:C3;[R1] [C4] column_type:MYSQL_TYPE_NEWDECIMAL;[R1] [C4] column_is_rowkey:false;[R1] [C4] column_is_signed:true;[R1] [C4] column_encoding:binary;[R1] [C4] column_is_not_null:false;[R1] [C4] column_value_new:[12.34](5);[R1] [C5] column_name:C4;[R1] [C5] column_type:MYSQL_TYPE_OB_NUMBER_FLOAT;[R1] [C5] column_is_rowkey:false;[R1] [C5] column_is_signed:true;[R1] [C5] column_encoding:binary;[R1] [C5] column_is_not_null:false;[R1] [C5] column_value_new:[12.34](5);[R1] [C6] column_name:C5;[R1] [C6] column_type:MYSQL_TYPE_OB_NUMBER_FLOAT;[R1] [C6] column_is_rowkey:false;[R1] [C6] column_is_signed:true;[R1] [C6] column_encoding:binary;[R1] [C6] column_is_not_null:false;[R1] [C6] column_value_new:[12.34](5);[R1] [C7] column_name:C6;[R1] [C7] column_type:MYSQL_TYPE_VAR_STRING;[R1] [C7] column_is_rowkey:false;[R1] [C7] column_is_signed:true;[R1] [C7] column_encoding:utf8mb4;[R1] [C7] column_is_not_null:false;[R1] [C7] column_value_new:[-0.123456789012345678](21);[R1] [C8] column_name:C7;[R1] [C8] column_type:MYSQL_TYPE_STRING;[R1] [C8] column_is_rowkey:false;[R1] [C8] column_is_signed:true;[R1] [C8] column_encoding:utf8mb4;[R1] [C8] column_is_not_null:false;[R1] [C8] column_value_new:[12.34                                                                                               ](100);$[R2] COMMIT;
insert into number_1 (c0, c6) values (63+100,'-0.12345678901234567');
ob1.oblog.next;
[R0] BEGIN;[R0] org_cluster_id:1;[R1] record_type:INSERT;[R1] database_name:oracle.OBLOG_DB;[R1] table_name:NUMBER_1;[R1] log_event:true;[R1] column_count:8;[R1] source_category:SRC_FULL_RECORDED;[R1] source_type:SRC_OCEANBASE_1_0;[R1] has_pk:true;[R1] pk_info:(0);[R1] pks:C0;[R1] has_uk:false;[R1] uk_info:(null);[R1] uks:(null);[R1] [C1] column_name:C0;[R1] [C1] column_type:MYSQL_TYPE_NEWDECIMAL;[R1] [C1] column_is_rowkey:true;[R1] [C1] column_is_signed:true;[R1] [C1] column_encoding:binary;[R1] [C1] column_is_not_null:true;[R1] [C1] column_value_new:[163](3);[R1] [C2] column_name:C1;[R1] [C2] column_type:MYSQL_TYPE_DOUBLE;[R1] [C2] column_is_rowkey:false;[R1] [C2] column_is_signed:true;[R1] [C2] column_encoding:binary;[R1] [C2] column_is_not_null:false;[R1] [C2] column_value_new:[1.234E+001](10);[R1] [C3] column_name:C2;[R1] [C3] column_type:MYSQL_TYPE_FLOAT;[R1] [C3] column_is_rowkey:false;[R1] [C3] column_is_signed:true;[R1] [C3] column_encoding:binary;[R1] [C3] column_is_not_null:false;[R1] [C3] column_value_new:[1.23400002E+001](15);[R1] [C4] column_name:C3;[R1] [C4] column_type:MYSQL_TYPE_NEWDECIMAL;[R1] [C4] column_is_rowkey:false;[R1] [C4] column_is_signed:true;[R1] [C4] column_encoding:binary;[R1] [C4] column_is_not_null:false;[R1] [C4] column_value_new:[12.34](5);[R1] [C5] column_name:C4;[R1] [C5] column_type:MYSQL_TYPE_OB_NUMBER_FLOAT;[R1] [C5] column_is_rowkey:false;[R1] [C5] column_is_signed:true;[R1] [C5] column_encoding:binary;[R1] [C5] column_is_not_null:false;[R1] [C5] column_value_new:[12.34](5);[R1] [C6] column_name:C5;[R1] [C6] column_type:MYSQL_TYPE_OB_NUMBER_FLOAT;[R1] [C6] column_is_rowkey:false;[R1] [C6] column_is_signed:true;[R1] [C6] column_encoding:binary;[R1] [C6] column_is_not_null:false;[R1] [C6] column_value_new:[12.34](5);[R1] [C7] column_name:C6;[R1] [C7] column_type:MYSQL_TYPE_VAR_STRING;[R1] [C7] column_is_rowkey:false;[R1] [C7] column_is_signed:true;[R1] [C7] column_encoding:utf8mb4;[R1] [C7] column_is_not_null:false;[R1] [C7] column_value_new:[-0.12345678901234567](20);[R1] [C8] column_name:C7;[R1] [C8] column_type:MYSQL_TYPE_STRING;[R1] [C8] column_is_rowkey:false;[R1] [C8] column_is_signed:true;[R1] [C8] column_encoding:utf8mb4;[R1] [C8] column_is_not_null:false;[R1] [C8] column_value_new:[12.34                                                                                               ](100);$[R2] COMMIT;
insert into number_1 (c0, c6) values (64+100,'-0.1234567890123456');
ob1.oblog.next;
[R0] BEGIN;[R0] org_cluster_id:1;[R1] record_type:INSERT;[R1] database_name:oracle.OBLOG_DB;[R1] table_name:NUMBER_1;[R1] log_event:true;[R1] column_count:8;[R1] source_category:SRC_FULL_RECORDED;[R1] source_type:SRC_OCEANBASE_1_0;[R1] has_pk:true;[R1] pk_info:(0);[R1] pks:C0;[R1] has_uk:false;[R1] uk_info:(null);[R1] uks:(null);[R1] [C1] column_name:C0;[R1] [C1] column_type:MYSQL_TYPE_NEWDECIMAL;[R1] [C1] column_is_rowkey:true;[R1] [C1] column_is_signed:true;[R1] [C1] column_encoding:binary;[R1] [C1] column_is_not_null:true;[R1] [C1] column_value_new:[164](3);[R1] [C2] column_name:C1;[R1] [C2] column_type:MYSQL_TYPE_DOUBLE;[R1] [C2] column_is_rowkey:false;[R1] [C2] column_is_signed:true;[R1] [C2] column_encoding:binary;[R1] [C2] column_is_not_null:false;[R1] [C2] column_value_new:[1.234E+001](10);[R1] [C3] column_name:C2;[R1] [C3] column_type:MYSQL_TYPE_FLOAT;[R1] [C3] column_is_rowkey:false;[R1] [C3] column_is_signed:true;[R1] [C3] column_encoding:binary;[R1] [C3] column_is_not_null:false;[R1] [C3] column_value_new:[1.23400002E+001](15);[R1] [C4] column_name:C3;[R1] [C4] column_type:MYSQL_TYPE_NEWDECIMAL;[R1] [C4] column_is_rowkey:false;[R1] [C4] column_is_signed:true;[R1] [C4] column_encoding:binary;[R1] [C4] column_is_not_null:false;[R1] [C4] column_value_new:[12.34](5);[R1] [C5] column_name:C4;[R1] [C5] column_type:MYSQL_TYPE_OB_NUMBER_FLOAT;[R1] [C5] column_is_rowkey:false;[R1] [C5] column_is_signed:true;[R1] [C5] column_encoding:binary;[R1] [C5] column_is_not_null:false;[R1] [C5] column_value_new:[12.34](5);[R1] [C6] column_name:C5;[R1] [C6] column_type:MYSQL_TYPE_OB_NUMBER_FLOAT;[R1] [C6] column_is_rowkey:false;[R1] [C6] column_is_signed:true;[R1] [C6] column_encoding:binary;[R1] [C6] column_is_not_null:false;[R1] [C6] column_value_new:[12.34](5);[R1] [C7] column_name:C6;[R1] [C7] column_type:MYSQL_TYPE_VAR_STRING;[R1] [C7] column_is_rowkey:false;[R1] [C7] column_is_signed:true;[R1] [C7] column_encoding:utf8mb4;[R1] [C7] column_is_not_null:false;[R1] [C7] column_value_new:[-0.1234567890123456](19);[R1] [C8] column_name:C7;[R1] [C8] column_type:MYSQL_TYPE_STRING;[R1] [C8] column_is_rowkey:false;[R1] [C8] column_is_signed:true;[R1] [C8] column_encoding:utf8mb4;[R1] [C8] column_is_not_null:false;[R1] [C8] column_value_new:[12.34                                                                                               ](100);$[R2] COMMIT;
insert into number_1 (c0, c6) values (65+100,'-0.123456789012345');
ob1.oblog.next;
[R0] BEGIN;[R0] org_cluster_id:1;[R1] record_type:INSERT;[R1] database_name:oracle.OBLOG_DB;[R1] table_name:NUMBER_1;[R1] log_event:true;[R1] column_count:8;[R1] source_category:SRC_FULL_RECORDED;[R1] source_type:SRC_OCEANBASE_1_0;[R1] has_pk:true;[R1] pk_info:(0);[R1] pks:C0;[R1] has_uk:false;[R1] uk_info:(null);[R1] uks:(null);[R1] [C1] column_name:C0;[R1] [C1] column_type:MYSQL_TYPE_NEWDECIMAL;[R1] [C1] column_is_rowkey:true;[R1] [C1] column_is_signed:true;[R1] [C1] column_encoding:binary;[R1] [C1] column_is_not_null:true;[R1] [C1] column_value_new:[165](3);[R1] [C2] column_name:C1;[R1] [C2] column_type:MYSQL_TYPE_DOUBLE;[R1] [C2] column_is_rowkey:false;[R1] [C2] column_is_signed:true;[R1] [C2] column_encoding:binary;[R1] [C2] column_is_not_null:false;[R1] [C2] column_value_new:[1.234E+001](10);[R1] [C3] column_name:C2;[R1] [C3] column_type:MYSQL_TYPE_FLOAT;[R1] [C3] column_is_rowkey:false;[R1] [C3] column_is_signed:true;[R1] [C3] column_encoding:binary;[R1] [C3] column_is_not_null:false;[R1] [C3] column_value_new:[1.23400002E+001](15);[R1] [C4] column_name:C3;[R1] [C4] column_type:MYSQL_TYPE_NEWDECIMAL;[R1] [C4] column_is_rowkey:false;[R1] [C4] column_is_signed:true;[R1] [C4] column_encoding:binary;[R1] [C4] column_is_not_null:false;[R1] [C4] column_value_new:[12.34](5);[R1] [C5] column_name:C4;[R1] [C5] column_type:MYSQL_TYPE_OB_NUMBER_FLOAT;[R1] [C5] column_is_rowkey:false;[R1] [C5] column_is_signed:true;[R1] [C5] column_encoding:binary;[R1] [C5] column_is_not_null:false;[R1] [C5] column_value_new:[12.34](5);[R1] [C6] column_name:C5;[R1] [C6] column_type:MYSQL_TYPE_OB_NUMBER_FLOAT;[R1] [C6] column_is_rowkey:false;[R1] [C6] column_is_signed:true;[R1] [C6] column_encoding:binary;[R1] [C6] column_is_not_null:false;[R1] [C6] column_value_new:[12.34](5);[R1] [C7] column_name:C6;[R1] [C7] column_type:MYSQL_TYPE_VAR_STRING;[R1] [C7] column_is_rowkey:false;[R1] [C7] column_is_signed:true;[R1] [C7] column_encoding:utf8mb4;[R1] [C7] column_is_not_null:false;[R1] [C7] column_value_new:[-0.123456789012345](18);[R1] [C8] column_name:C7;[R1] [C8] column_type:MYSQL_TYPE_STRING;[R1] [C8] column_is_rowkey:false;[R1] [C8] column_is_signed:true;[R1] [C8] column_encoding:utf8mb4;[R1] [C8] column_is_not_null:false;[R1] [C8] column_value_new:[12.34                                                                                               ](100);$[R2] COMMIT;
insert into number_1 (c0, c6) values (66+100,'-0.12345678901234');
ob1.oblog.next;
[R0] BEGIN;[R0] org_cluster_id:1;[R1] record_type:INSERT;[R1] database_name:oracle.OBLOG_DB;[R1] table_name:NUMBER_1;[R1] log_event:true;[R1] column_count:8;[R1] source_category:SRC_FULL_RECORDED;[R1] source_type:SRC_OCEANBASE_1_0;[R1] has_pk:true;[R1] pk_info:(0);[R1] pks:C0;[R1] has_uk:false;[R1] uk_info:(null);[R1] uks:(null);[R1] [C1] column_name:C0;[R1] [C1] column_type:MYSQL_TYPE_NEWDECIMAL;[R1] [C1] column_is_rowkey:true;[R1] [C1] column_is_signed:true;[R1] [C1] column_encoding:binary;[R1] [C1] column_is_not_null:true;[R1] [C1] column_value_new:[166](3);[R1] [C2] column_name:C1;[R1] [C2] column_type:MYSQL_TYPE_DOUBLE;[R1] [C2] column_is_rowkey:false;[R1] [C2] column_is_signed:true;[R1] [C2] column_encoding:binary;[R1] [C2] column_is_not_null:false;[R1] [C2] column_value_new:[1.234E+001](10);[R1] [C3] column_name:C2;[R1] [C3] column_type:MYSQL_TYPE_FLOAT;[R1] [C3] column_is_rowkey:false;[R1] [C3] column_is_signed:true;[R1] [C3] column_encoding:binary;[R1] [C3] column_is_not_null:false;[R1] [C3] column_value_new:[1.23400002E+001](15);[R1] [C4] column_name:C3;[R1] [C4] column_type:MYSQL_TYPE_NEWDECIMAL;[R1] [C4] column_is_rowkey:false;[R1] [C4] column_is_signed:true;[R1] [C4] column_encoding:binary;[R1] [C4] column_is_not_null:false;[R1] [C4] column_value_new:[12.34](5);[R1] [C5] column_name:C4;[R1] [C5] column_type:MYSQL_TYPE_OB_NUMBER_FLOAT;[R1] [C5] column_is_rowkey:false;[R1] [C5] column_is_signed:true;[R1] [C5] column_encoding:binary;[R1] [C5] column_is_not_null:false;[R1] [C5] column_value_new:[12.34](5);[R1] [C6] column_name:C5;[R1] [C6] column_type:MYSQL_TYPE_OB_NUMBER_FLOAT;[R1] [C6] column_is_rowkey:false;[R1] [C6] column_is_signed:true;[R1] [C6] column_encoding:binary;[R1] [C6] column_is_not_null:false;[R1] [C6] column_value_new:[12.34](5);[R1] [C7] column_name:C6;[R1] [C7] column_type:MYSQL_TYPE_VAR_STRING;[R1] [C7] column_is_rowkey:false;[R1] [C7] column_is_signed:true;[R1] [C7] column_encoding:utf8mb4;[R1] [C7] column_is_not_null:false;[R1] [C7] column_value_new:[-0.12345678901234](17);[R1] [C8] column_name:C7;[R1] [C8] column_type:MYSQL_TYPE_STRING;[R1] [C8] column_is_rowkey:false;[R1] [C8] column_is_signed:true;[R1] [C8] column_encoding:utf8mb4;[R1] [C8] column_is_not_null:false;[R1] [C8] column_value_new:[12.34                                                                                               ](100);$[R2] COMMIT;
insert into number_1 (c0, c6) values (67+100,'-0.1234567890123');
ob1.oblog.next;
[R0] BEGIN;[R0] org_cluster_id:1;[R1] record_type:INSERT;[R1] database_name:oracle.OBLOG_DB;[R1] table_name:NUMBER_1;[R1] log_event:true;[R1] column_count:8;[R1] source_category:SRC_FULL_RECORDED;[R1] source_type:SRC_OCEANBASE_1_0;[R1] has_pk:true;[R1] pk_info:(0);[R1] pks:C0;[R1] has_uk:false;[R1] uk_info:(null);[R1] uks:(null);[R1] [C1] column_name:C0;[R1] [C1] column_type:MYSQL_TYPE_NEWDECIMAL;[R1] [C1] column_is_rowkey:true;[R1] [C1] column_is_signed:true;[R1] [C1] column_encoding:binary;[R1] [C1] column_is_not_null:true;[R1] [C1] column_value_new:[167](3);[R1] [C2] column_name:C1;[R1] [C2] column_type:MYSQL_TYPE_DOUBLE;[R1] [C2] column_is_rowkey:false;[R1] [C2] column_is_signed:true;[R1] [C2] column_encoding:binary;[R1] [C2] column_is_not_null:false;[R1] [C2] column_value_new:[1.234E+001](10);[R1] [C3] column_name:C2;[R1] [C3] column_type:MYSQL_TYPE_FLOAT;[R1] [C3] column_is_rowkey:false;[R1] [C3] column_is_signed:true;[R1] [C3] column_encoding:binary;[R1] [C3] column_is_not_null:false;[R1] [C3] column_value_new:[1.23400002E+001](15);[R1] [C4] column_name:C3;[R1] [C4] column_type:MYSQL_TYPE_NEWDECIMAL;[R1] [C4] column_is_rowkey:false;[R1] [C4] column_is_signed:true;[R1] [C4] column_encoding:binary;[R1] [C4] column_is_not_null:false;[R1] [C4] column_value_new:[12.34](5);[R1] [C5] column_name:C4;[R1] [C5] column_type:MYSQL_TYPE_OB_NUMBER_FLOAT;[R1] [C5] column_is_rowkey:false;[R1] [C5] column_is_signed:true;[R1] [C5] column_encoding:binary;[R1] [C5] column_is_not_null:false;[R1] [C5] column_value_new:[12.34](5);[R1] [C6] column_name:C5;[R1] [C6] column_type:MYSQL_TYPE_OB_NUMBER_FLOAT;[R1] [C6] column_is_rowkey:false;[R1] [C6] column_is_signed:true;[R1] [C6] column_encoding:binary;[R1] [C6] column_is_not_null:false;[R1] [C6] column_value_new:[12.34](5);[R1] [C7] column_name:C6;[R1] [C7] column_type:MYSQL_TYPE_VAR_STRING;[R1] [C7] column_is_rowkey:false;[R1] [C7] column_is_signed:true;[R1] [C7] column_encoding:utf8mb4;[R1] [C7] column_is_not_null:false;[R1] [C7] column_value_new:[-0.1234567890123](16);[R1] [C8] column_name:C7;[R1] [C8] column_type:MYSQL_TYPE_STRING;[R1] [C8] column_is_rowkey:false;[R1] [C8] column_is_signed:true;[R1] [C8] column_encoding:utf8mb4;[R1] [C8] column_is_not_null:false;[R1] [C8] column_value_new:[12.34                                                                                               ](100);$[R2] COMMIT;
insert into number_1 (c0, c6) values (68+100,'-0.123456789012');
ob1.oblog.next;
[R0] BEGIN;[R0] org_cluster_id:1;[R1] record_type:INSERT;[R1] database_name:oracle.OBLOG_DB;[R1] table_name:NUMBER_1;[R1] log_event:true;[R1] column_count:8;[R1] source_category:SRC_FULL_RECORDED;[R1] source_type:SRC_OCEANBASE_1_0;[R1] has_pk:true;[R1] pk_info:(0);[R1] pks:C0;[R1] has_uk:false;[R1] uk_info:(null);[R1] uks:(null);[R1] [C1] column_name:C0;[R1] [C1] column_type:MYSQL_TYPE_NEWDECIMAL;[R1] [C1] column_is_rowkey:true;[R1] [C1] column_is_signed:true;[R1] [C1] column_encoding:binary;[R1] [C1] column_is_not_null:true;[R1] [C1] column_value_new:[168](3);[R1] [C2] column_name:C1;[R1] [C2] column_type:MYSQL_TYPE_DOUBLE;[R1] [C2] column_is_rowkey:false;[R1] [C2] column_is_signed:true;[R1] [C2] column_encoding:binary;[R1] [C2] column_is_not_null:false;[R1] [C2] column_value_new:[1.234E+001](10);[R1] [C3] column_name:C2;[R1] [C3] column_type:MYSQL_TYPE_FLOAT;[R1] [C3] column_is_rowkey:false;[R1] [C3] column_is_signed:true;[R1] [C3] column_encoding:binary;[R1] [C3] column_is_not_null:false;[R1] [C3] column_value_new:[1.23400002E+001](15);[R1] [C4] column_name:C3;[R1] [C4] column_type:MYSQL_TYPE_NEWDECIMAL;[R1] [C4] column_is_rowkey:false;[R1] [C4] column_is_signed:true;[R1] [C4] column_encoding:binary;[R1] [C4] column_is_not_null:false;[R1] [C4] column_value_new:[12.34](5);[R1] [C5] column_name:C4;[R1] [C5] column_type:MYSQL_TYPE_OB_NUMBER_FLOAT;[R1] [C5] column_is_rowkey:false;[R1] [C5] column_is_signed:true;[R1] [C5] column_encoding:binary;[R1] [C5] column_is_not_null:false;[R1] [C5] column_value_new:[12.34](5);[R1] [C6] column_name:C5;[R1] [C6] column_type:MYSQL_TYPE_OB_NUMBER_FLOAT;[R1] [C6] column_is_rowkey:false;[R1] [C6] column_is_signed:true;[R1] [C6] column_encoding:binary;[R1] [C6] column_is_not_null:false;[R1] [C6] column_value_new:[12.34](5);[R1] [C7] column_name:C6;[R1] [C7] column_type:MYSQL_TYPE_VAR_STRING;[R1] [C7] column_is_rowkey:false;[R1] [C7] column_is_signed:true;[R1] [C7] column_encoding:utf8mb4;[R1] [C7] column_is_not_null:false;[R1] [C7] column_value_new:[-0.123456789012](15);[R1] [C8] column_name:C7;[R1] [C8] column_type:MYSQL_TYPE_STRING;[R1] [C8] column_is_rowkey:false;[R1] [C8] column_is_signed:true;[R1] [C8] column_encoding:utf8mb4;[R1] [C8] column_is_not_null:false;[R1] [C8] column_value_new:[12.34                                                                                               ](100);$[R2] COMMIT;
insert into number_1 (c0, c6) values (69+100,'-0.12345678901');
ob1.oblog.next;
[R0] BEGIN;[R0] org_cluster_id:1;[R1] record_type:INSERT;[R1] database_name:oracle.OBLOG_DB;[R1] table_name:NUMBER_1;[R1] log_event:true;[R1] column_count:8;[R1] source_category:SRC_FULL_RECORDED;[R1] source_type:SRC_OCEANBASE_1_0;[R1] has_pk:true;[R1] pk_info:(0);[R1] pks:C0;[R1] has_uk:false;[R1] uk_info:(null);[R1] uks:(null);[R1] [C1] column_name:C0;[R1] [C1] column_type:MYSQL_TYPE_NEWDECIMAL;[R1] [C1] column_is_rowkey:true;[R1] [C1] column_is_signed:true;[R1] [C1] column_encoding:binary;[R1] [C1] column_is_not_null:true;[R1] [C1] column_value_new:[169](3);[R1] [C2] column_name:C1;[R1] [C2] column_type:MYSQL_TYPE_DOUBLE;[R1] [C2] column_is_rowkey:false;[R1] [C2] column_is_signed:true;[R1] [C2] column_encoding:binary;[R1] [C2] column_is_not_null:false;[R1] [C2] column_value_new:[1.234E+001](10);[R1] [C3] column_name:C2;[R1] [C3] column_type:MYSQL_TYPE_FLOAT;[R1] [C3] column_is_rowkey:false;[R1] [C3] column_is_signed:true;[R1] [C3] column_encoding:binary;[R1] [C3] column_is_not_null:false;[R1] [C3] column_value_new:[1.23400002E+001](15);[R1] [C4] column_name:C3;[R1] [C4] column_type:MYSQL_TYPE_NEWDECIMAL;[R1] [C4] column_is_rowkey:false;[R1] [C4] column_is_signed:true;[R1] [C4] column_encoding:binary;[R1] [C4] column_is_not_null:false;[R1] [C4] column_value_new:[12.34](5);[R1] [C5] column_name:C4;[R1] [C5] column_type:MYSQL_TYPE_OB_NUMBER_FLOAT;[R1] [C5] column_is_rowkey:false;[R1] [C5] column_is_signed:true;[R1] [C5] column_encoding:binary;[R1] [C5] column_is_not_null:false;[R1] [C5] column_value_new:[12.34](5);[R1] [C6] column_name:C5;[R1] [C6] column_type:MYSQL_TYPE_OB_NUMBER_FLOAT;[R1] [C6] column_is_rowkey:false;[R1] [C6] column_is_signed:true;[R1] [C6] column_encoding:binary;[R1] [C6] column_is_not_null:false;[R1] [C6] column_value_new:[12.34](5);[R1] [C7] column_name:C6;[R1] [C7] column_type:MYSQL_TYPE_VAR_STRING;[R1] [C7] column_is_rowkey:false;[R1] [C7] column_is_signed:true;[R1] [C7] column_encoding:utf8mb4;[R1] [C7] column_is_not_null:false;[R1] [C7] column_value_new:[-0.12345678901](14);[R1] [C8] column_name:C7;[R1] [C8] column_type:MYSQL_TYPE_STRING;[R1] [C8] column_is_rowkey:false;[R1] [C8] column_is_signed:true;[R1] [C8] column_encoding:utf8mb4;[R1] [C8] column_is_not_null:false;[R1] [C8] column_value_new:[12.34                                                                                               ](100);$[R2] COMMIT;
insert into number_1 (c0, c6) values (70+100,'-0.1234567890');
ob1.oblog.next;
[R0] BEGIN;[R0] org_cluster_id:1;[R1] record_type:INSERT;[R1] database_name:oracle.OBLOG_DB;[R1] table_name:NUMBER_1;[R1] log_event:true;[R1] column_count:8;[R1] source_category:SRC_FULL_RECORDED;[R1] source_type:SRC_OCEANBASE_1_0;[R1] has_pk:true;[R1] pk_info:(0);[R1] pks:C0;[R1] has_uk:false;[R1] uk_info:(null);[R1] uks:(null);[R1] [C1] column_name:C0;[R1] [C1] column_type:MYSQL_TYPE_NEWDECIMAL;[R1] [C1] column_is_rowkey:true;[R1] [C1] column_is_signed:true;[R1] [C1] column_encoding:binary;[R1] [C1] column_is_not_null:true;[R1] [C1] column_value_new:[170](3);[R1] [C2] column_name:C1;[R1] [C2] column_type:MYSQL_TYPE_DOUBLE;[R1] [C2] column_is_rowkey:false;[R1] [C2] column_is_signed:true;[R1] [C2] column_encoding:binary;[R1] [C2] column_is_not_null:false;[R1] [C2] column_value_new:[1.234E+001](10);[R1] [C3] column_name:C2;[R1] [C3] column_type:MYSQL_TYPE_FLOAT;[R1] [C3] column_is_rowkey:false;[R1] [C3] column_is_signed:true;[R1] [C3] column_encoding:binary;[R1] [C3] column_is_not_null:false;[R1] [C3] column_value_new:[1.23400002E+001](15);[R1] [C4] column_name:C3;[R1] [C4] column_type:MYSQL_TYPE_NEWDECIMAL;[R1] [C4] column_is_rowkey:false;[R1] [C4] column_is_signed:true;[R1] [C4] column_encoding:binary;[R1] [C4] column_is_not_null:false;[R1] [C4] column_value_new:[12.34](5);[R1] [C5] column_name:C4;[R1] [C5] column_type:MYSQL_TYPE_OB_NUMBER_FLOAT;[R1] [C5] column_is_rowkey:false;[R1] [C5] column_is_signed:true;[R1] [C5] column_encoding:binary;[R1] [C5] column_is_not_null:false;[R1] [C5] column_value_new:[12.34](5);[R1] [C6] column_name:C5;[R1] [C6] column_type:MYSQL_TYPE_OB_NUMBER_FLOAT;[R1] [C6] column_is_rowkey:false;[R1] [C6] column_is_signed:true;[R1] [C6] column_encoding:binary;[R1] [C6] column_is_not_null:false;[R1] [C6] column_value_new:[12.34](5);[R1] [C7] column_name:C6;[R1] [C7] column_type:MYSQL_TYPE_VAR_STRING;[R1] [C7] column_is_rowkey:false;[R1] [C7] column_is_signed:true;[R1] [C7] column_encoding:utf8mb4;[R1] [C7] column_is_not_null:false;[R1] [C7] column_value_new:[-0.1234567890](13);[R1] [C8] column_name:C7;[R1] [C8] column_type:MYSQL_TYPE_STRING;[R1] [C8] column_is_rowkey:false;[R1] [C8] column_is_signed:true;[R1] [C8] column_encoding:utf8mb4;[R1] [C8] column_is_not_null:false;[R1] [C8] column_value_new:[12.34                                                                                               ](100);$[R2] COMMIT;
insert into number_1 (c0, c6) values (71+100,'-0.123456789');
ob1.oblog.next;
[R0] BEGIN;[R0] org_cluster_id:1;[R1] record_type:INSERT;[R1] database_name:oracle.OBLOG_DB;[R1] table_name:NUMBER_1;[R1] log_event:true;[R1] column_count:8;[R1] source_category:SRC_FULL_RECORDED;[R1] source_type:SRC_OCEANBASE_1_0;[R1] has_pk:true;[R1] pk_info:(0);[R1] pks:C0;[R1] has_uk:false;[R1] uk_info:(null);[R1] uks:(null);[R1] [C1] column_name:C0;[R1] [C1] column_type:MYSQL_TYPE_NEWDECIMAL;[R1] [C1] column_is_rowkey:true;[R1] [C1] column_is_signed:true;[R1] [C1] column_encoding:binary;[R1] [C1] column_is_not_null:true;[R1] [C1] column_value_new:[171](3);[R1] [C2] column_name:C1;[R1] [C2] column_type:MYSQL_TYPE_DOUBLE;[R1] [C2] column_is_rowkey:false;[R1] [C2] column_is_signed:true;[R1] [C2] column_encoding:binary;[R1] [C2] column_is_not_null:false;[R1] [C2] column_value_new:[1.234E+001](10);[R1] [C3] column_name:C2;[R1] [C3] column_type:MYSQL_TYPE_FLOAT;[R1] [C3] column_is_rowkey:false;[R1] [C3] column_is_signed:true;[R1] [C3] column_encoding:binary;[R1] [C3] column_is_not_null:false;[R1] [C3] column_value_new:[1.23400002E+001](15);[R1] [C4] column_name:C3;[R1] [C4] column_type:MYSQL_TYPE_NEWDECIMAL;[R1] [C4] column_is_rowkey:false;[R1] [C4] column_is_signed:true;[R1] [C4] column_encoding:binary;[R1] [C4] column_is_not_null:false;[R1] [C4] column_value_new:[12.34](5);[R1] [C5] column_name:C4;[R1] [C5] column_type:MYSQL_TYPE_OB_NUMBER_FLOAT;[R1] [C5] column_is_rowkey:false;[R1] [C5] column_is_signed:true;[R1] [C5] column_encoding:binary;[R1] [C5] column_is_not_null:false;[R1] [C5] column_value_new:[12.34](5);[R1] [C6] column_name:C5;[R1] [C6] column_type:MYSQL_TYPE_OB_NUMBER_FLOAT;[R1] [C6] column_is_rowkey:false;[R1] [C6] column_is_signed:true;[R1] [C6] column_encoding:binary;[R1] [C6] column_is_not_null:false;[R1] [C6] column_value_new:[12.34](5);[R1] [C7] column_name:C6;[R1] [C7] column_type:MYSQL_TYPE_VAR_STRING;[R1] [C7] column_is_rowkey:false;[R1] [C7] column_is_signed:true;[R1] [C7] column_encoding:utf8mb4;[R1] [C7] column_is_not_null:false;[R1] [C7] column_value_new:[-0.123456789](12);[R1] [C8] column_name:C7;[R1] [C8] column_type:MYSQL_TYPE_STRING;[R1] [C8] column_is_rowkey:false;[R1] [C8] column_is_signed:true;[R1] [C8] column_encoding:utf8mb4;[R1] [C8] column_is_not_null:false;[R1] [C8] column_value_new:[12.34                                                                                               ](100);$[R2] COMMIT;
insert into number_1 (c0, c6) values (72+100,'-0.12345678');
ob1.oblog.next;
[R0] BEGIN;[R0] org_cluster_id:1;[R1] record_type:INSERT;[R1] database_name:oracle.OBLOG_DB;[R1] table_name:NUMBER_1;[R1] log_event:true;[R1] column_count:8;[R1] source_category:SRC_FULL_RECORDED;[R1] source_type:SRC_OCEANBASE_1_0;[R1] has_pk:true;[R1] pk_info:(0);[R1] pks:C0;[R1] has_uk:false;[R1] uk_info:(null);[R1] uks:(null);[R1] [C1] column_name:C0;[R1] [C1] column_type:MYSQL_TYPE_NEWDECIMAL;[R1] [C1] column_is_rowkey:true;[R1] [C1] column_is_signed:true;[R1] [C1] column_encoding:binary;[R1] [C1] column_is_not_null:true;[R1] [C1] column_value_new:[172](3);[R1] [C2] column_name:C1;[R1] [C2] column_type:MYSQL_TYPE_DOUBLE;[R1] [C2] column_is_rowkey:false;[R1] [C2] column_is_signed:true;[R1] [C2] column_encoding:binary;[R1] [C2] column_is_not_null:false;[R1] [C2] column_value_new:[1.234E+001](10);[R1] [C3] column_name:C2;[R1] [C3] column_type:MYSQL_TYPE_FLOAT;[R1] [C3] column_is_rowkey:false;[R1] [C3] column_is_signed:true;[R1] [C3] column_encoding:binary;[R1] [C3] column_is_not_null:false;[R1] [C3] column_value_new:[1.23400002E+001](15);[R1] [C4] column_name:C3;[R1] [C4] column_type:MYSQL_TYPE_NEWDECIMAL;[R1] [C4] column_is_rowkey:false;[R1] [C4] column_is_signed:true;[R1] [C4] column_encoding:binary;[R1] [C4] column_is_not_null:false;[R1] [C4] column_value_new:[12.34](5);[R1] [C5] column_name:C4;[R1] [C5] column_type:MYSQL_TYPE_OB_NUMBER_FLOAT;[R1] [C5] column_is_rowkey:false;[R1] [C5] column_is_signed:true;[R1] [C5] column_encoding:binary;[R1] [C5] column_is_not_null:false;[R1] [C5] column_value_new:[12.34](5);[R1] [C6] column_name:C5;[R1] [C6] column_type:MYSQL_TYPE_OB_NUMBER_FLOAT;[R1] [C6] column_is_rowkey:false;[R1] [C6] column_is_signed:true;[R1] [C6] column_encoding:binary;[R1] [C6] column_is_not_null:false;[R1] [C6] column_value_new:[12.34](5);[R1] [C7] column_name:C6;[R1] [C7] column_type:MYSQL_TYPE_VAR_STRING;[R1] [C7] column_is_rowkey:false;[R1] [C7] column_is_signed:true;[R1] [C7] column_encoding:utf8mb4;[R1] [C7] column_is_not_null:false;[R1] [C7] column_value_new:[-0.12345678](11);[R1] [C8] column_name:C7;[R1] [C8] column_type:MYSQL_TYPE_STRING;[R1] [C8] column_is_rowkey:false;[R1] [C8] column_is_signed:true;[R1] [C8] column_encoding:utf8mb4;[R1] [C8] column_is_not_null:false;[R1] [C8] column_value_new:[12.34                                                                                               ](100);$[R2] COMMIT;
insert into number_1 (c0, c6) values (73+100,'-0.1234567');
ob1.oblog.next;
[R0] BEGIN;[R0] org_cluster_id:1;[R1] record_type:INSERT;[R1] database_name:oracle.OBLOG_DB;[R1] table_name:NUMBER_1;[R1] log_event:true;[R1] column_count:8;[R1] source_category:SRC_FULL_RECORDED;[R1] source_type:SRC_OCEANBASE_1_0;[R1] has_pk:true;[R1] pk_info:(0);[R1] pks:C0;[R1] has_uk:false;[R1] uk_info:(null);[R1] uks:(null);[R1] [C1] column_name:C0;[R1] [C1] column_type:MYSQL_TYPE_NEWDECIMAL;[R1] [C1] column_is_rowkey:true;[R1] [C1] column_is_signed:true;[R1] [C1] column_encoding:binary;[R1] [C1] column_is_not_null:true;[R1] [C1] column_value_new:[173](3);[R1] [C2] column_name:C1;[R1] [C2] column_type:MYSQL_TYPE_DOUBLE;[R1] [C2] column_is_rowkey:false;[R1] [C2] column_is_signed:true;[R1] [C2] column_encoding:binary;[R1] [C2] column_is_not_null:false;[R1] [C2] column_value_new:[1.234E+001](10);[R1] [C3] column_name:C2;[R1] [C3] column_type:MYSQL_TYPE_FLOAT;[R1] [C3] column_is_rowkey:false;[R1] [C3] column_is_signed:true;[R1] [C3] column_encoding:binary;[R1] [C3] column_is_not_null:false;[R1] [C3] column_value_new:[1.23400002E+001](15);[R1] [C4] column_name:C3;[R1] [C4] column_type:MYSQL_TYPE_NEWDECIMAL;[R1] [C4] column_is_rowkey:false;[R1] [C4] column_is_signed:true;[R1] [C4] column_encoding:binary;[R1] [C4] column_is_not_null:false;[R1] [C4] column_value_new:[12.34](5);[R1] [C5] column_name:C4;[R1] [C5] column_type:MYSQL_TYPE_OB_NUMBER_FLOAT;[R1] [C5] column_is_rowkey:false;[R1] [C5] column_is_signed:true;[R1] [C5] column_encoding:binary;[R1] [C5] column_is_not_null:false;[R1] [C5] column_value_new:[12.34](5);[R1] [C6] column_name:C5;[R1] [C6] column_type:MYSQL_TYPE_OB_NUMBER_FLOAT;[R1] [C6] column_is_rowkey:false;[R1] [C6] column_is_signed:true;[R1] [C6] column_encoding:binary;[R1] [C6] column_is_not_null:false;[R1] [C6] column_value_new:[12.34](5);[R1] [C7] column_name:C6;[R1] [C7] column_type:MYSQL_TYPE_VAR_STRING;[R1] [C7] column_is_rowkey:false;[R1] [C7] column_is_signed:true;[R1] [C7] column_encoding:utf8mb4;[R1] [C7] column_is_not_null:false;[R1] [C7] column_value_new:[-0.1234567](10);[R1] [C8] column_name:C7;[R1] [C8] column_type:MYSQL_TYPE_STRING;[R1] [C8] column_is_rowkey:false;[R1] [C8] column_is_signed:true;[R1] [C8] column_encoding:utf8mb4;[R1] [C8] column_is_not_null:false;[R1] [C8] column_value_new:[12.34                                                                                               ](100);$[R2] COMMIT;
insert into number_1 (c0, c6) values (74+100,'-0.123456');
ob1.oblog.next;
[R0] BEGIN;[R0] org_cluster_id:1;[R1] record_type:INSERT;[R1] database_name:oracle.OBLOG_DB;[R1] table_name:NUMBER_1;[R1] log_event:true;[R1] column_count:8;[R1] source_category:SRC_FULL_RECORDED;[R1] source_type:SRC_OCEANBASE_1_0;[R1] has_pk:true;[R1] pk_info:(0);[R1] pks:C0;[R1] has_uk:false;[R1] uk_info:(null);[R1] uks:(null);[R1] [C1] column_name:C0;[R1] [C1] column_type:MYSQL_TYPE_NEWDECIMAL;[R1] [C1] column_is_rowkey:true;[R1] [C1] column_is_signed:true;[R1] [C1] column_encoding:binary;[R1] [C1] column_is_not_null:true;[R1] [C1] column_value_new:[174](3);[R1] [C2] column_name:C1;[R1] [C2] column_type:MYSQL_TYPE_DOUBLE;[R1] [C2] column_is_rowkey:false;[R1] [C2] column_is_signed:true;[R1] [C2] column_encoding:binary;[R1] [C2] column_is_not_null:false;[R1] [C2] column_value_new:[1.234E+001](10);[R1] [C3] column_name:C2;[R1] [C3] column_type:MYSQL_TYPE_FLOAT;[R1] [C3] column_is_rowkey:false;[R1] [C3] column_is_signed:true;[R1] [C3] column_encoding:binary;[R1] [C3] column_is_not_null:false;[R1] [C3] column_value_new:[1.23400002E+001](15);[R1] [C4] column_name:C3;[R1] [C4] column_type:MYSQL_TYPE_NEWDECIMAL;[R1] [C4] column_is_rowkey:false;[R1] [C4] column_is_signed:true;[R1] [C4] column_encoding:binary;[R1] [C4] column_is_not_null:false;[R1] [C4] column_value_new:[12.34](5);[R1] [C5] column_name:C4;[R1] [C5] column_type:MYSQL_TYPE_OB_NUMBER_FLOAT;[R1] [C5] column_is_rowkey:false;[R1] [C5] column_is_signed:true;[R1] [C5] column_encoding:binary;[R1] [C5] column_is_not_null:false;[R1] [C5] column_value_new:[12.34](5);[R1] [C6] column_name:C5;[R1] [C6] column_type:MYSQL_TYPE_OB_NUMBER_FLOAT;[R1] [C6] column_is_rowkey:false;[R1] [C6] column_is_signed:true;[R1] [C6] column_encoding:binary;[R1] [C6] column_is_not_null:false;[R1] [C6] column_value_new:[12.34](5);[R1] [C7] column_name:C6;[R1] [C7] column_type:MYSQL_TYPE_VAR_STRING;[R1] [C7] column_is_rowkey:false;[R1] [C7] column_is_signed:true;[R1] [C7] column_encoding:utf8mb4;[R1] [C7] column_is_not_null:false;[R1] [C7] column_value_new:[-0.123456](9);[R1] [C8] column_name:C7;[R1] [C8] column_type:MYSQL_TYPE_STRING;[R1] [C8] column_is_rowkey:false;[R1] [C8] column_is_signed:true;[R1] [C8] column_encoding:utf8mb4;[R1] [C8] column_is_not_null:false;[R1] [C8] column_value_new:[12.34                                                                                               ](100);$[R2] COMMIT;
insert into number_1 (c0, c6) values (75+100,'-0.12345');
ob1.oblog.next;
[R0] BEGIN;[R0] org_cluster_id:1;[R1] record_type:INSERT;[R1] database_name:oracle.OBLOG_DB;[R1] table_name:NUMBER_1;[R1] log_event:true;[R1] column_count:8;[R1] source_category:SRC_FULL_RECORDED;[R1] source_type:SRC_OCEANBASE_1_0;[R1] has_pk:true;[R1] pk_info:(0);[R1] pks:C0;[R1] has_uk:false;[R1] uk_info:(null);[R1] uks:(null);[R1] [C1] column_name:C0;[R1] [C1] column_type:MYSQL_TYPE_NEWDECIMAL;[R1] [C1] column_is_rowkey:true;[R1] [C1] column_is_signed:true;[R1] [C1] column_encoding:binary;[R1] [C1] column_is_not_null:true;[R1] [C1] column_value_new:[175](3);[R1] [C2] column_name:C1;[R1] [C2] column_type:MYSQL_TYPE_DOUBLE;[R1] [C2] column_is_rowkey:false;[R1] [C2] column_is_signed:true;[R1] [C2] column_encoding:binary;[R1] [C2] column_is_not_null:false;[R1] [C2] column_value_new:[1.234E+001](10);[R1] [C3] column_name:C2;[R1] [C3] column_type:MYSQL_TYPE_FLOAT;[R1] [C3] column_is_rowkey:false;[R1] [C3] column_is_signed:true;[R1] [C3] column_encoding:binary;[R1] [C3] column_is_not_null:false;[R1] [C3] column_value_new:[1.23400002E+001](15);[R1] [C4] column_name:C3;[R1] [C4] column_type:MYSQL_TYPE_NEWDECIMAL;[R1] [C4] column_is_rowkey:false;[R1] [C4] column_is_signed:true;[R1] [C4] column_encoding:binary;[R1] [C4] column_is_not_null:false;[R1] [C4] column_value_new:[12.34](5);[R1] [C5] column_name:C4;[R1] [C5] column_type:MYSQL_TYPE_OB_NUMBER_FLOAT;[R1] [C5] column_is_rowkey:false;[R1] [C5] column_is_signed:true;[R1] [C5] column_encoding:binary;[R1] [C5] column_is_not_null:false;[R1] [C5] column_value_new:[12.34](5);[R1] [C6] column_name:C5;[R1] [C6] column_type:MYSQL_TYPE_OB_NUMBER_FLOAT;[R1] [C6] column_is_rowkey:false;[R1] [C6] column_is_signed:true;[R1] [C6] column_encoding:binary;[R1] [C6] column_is_not_null:false;[R1] [C6] column_value_new:[12.34](5);[R1] [C7] column_name:C6;[R1] [C7] column_type:MYSQL_TYPE_VAR_STRING;[R1] [C7] column_is_rowkey:false;[R1] [C7] column_is_signed:true;[R1] [C7] column_encoding:utf8mb4;[R1] [C7] column_is_not_null:false;[R1] [C7] column_value_new:[-0.12345](8);[R1] [C8] column_name:C7;[R1] [C8] column_type:MYSQL_TYPE_STRING;[R1] [C8] column_is_rowkey:false;[R1] [C8] column_is_signed:true;[R1] [C8] column_encoding:utf8mb4;[R1] [C8] column_is_not_null:false;[R1] [C8] column_value_new:[12.34                                                                                               ](100);$[R2] COMMIT;
insert into number_1 (c0, c6) values (76+100,'-0.1234');
ob1.oblog.next;
[R0] BEGIN;[R0] org_cluster_id:1;[R1] record_type:INSERT;[R1] database_name:oracle.OBLOG_DB;[R1] table_name:NUMBER_1;[R1] log_event:true;[R1] column_count:8;[R1] source_category:SRC_FULL_RECORDED;[R1] source_type:SRC_OCEANBASE_1_0;[R1] has_pk:true;[R1] pk_info:(0);[R1] pks:C0;[R1] has_uk:false;[R1] uk_info:(null);[R1] uks:(null);[R1] [C1] column_name:C0;[R1] [C1] column_type:MYSQL_TYPE_NEWDECIMAL;[R1] [C1] column_is_rowkey:true;[R1] [C1] column_is_signed:true;[R1] [C1] column_encoding:binary;[R1] [C1] column_is_not_null:true;[R1] [C1] column_value_new:[176](3);[R1] [C2] column_name:C1;[R1] [C2] column_type:MYSQL_TYPE_DOUBLE;[R1] [C2] column_is_rowkey:false;[R1] [C2] column_is_signed:true;[R1] [C2] column_encoding:binary;[R1] [C2] column_is_not_null:false;[R1] [C2] column_value_new:[1.234E+001](10);[R1] [C3] column_name:C2;[R1] [C3] column_type:MYSQL_TYPE_FLOAT;[R1] [C3] column_is_rowkey:false;[R1] [C3] column_is_signed:true;[R1] [C3] column_encoding:binary;[R1] [C3] column_is_not_null:false;[R1] [C3] column_value_new:[1.23400002E+001](15);[R1] [C4] column_name:C3;[R1] [C4] column_type:MYSQL_TYPE_NEWDECIMAL;[R1] [C4] column_is_rowkey:false;[R1] [C4] column_is_signed:true;[R1] [C4] column_encoding:binary;[R1] [C4] column_is_not_null:false;[R1] [C4] column_value_new:[12.34](5);[R1] [C5] column_name:C4;[R1] [C5] column_type:MYSQL_TYPE_OB_NUMBER_FLOAT;[R1] [C5] column_is_rowkey:false;[R1] [C5] column_is_signed:true;[R1] [C5] column_encoding:binary;[R1] [C5] column_is_not_null:false;[R1] [C5] column_value_new:[12.34](5);[R1] [C6] column_name:C5;[R1] [C6] column_type:MYSQL_TYPE_OB_NUMBER_FLOAT;[R1] [C6] column_is_rowkey:false;[R1] [C6] column_is_signed:true;[R1] [C6] column_encoding:binary;[R1] [C6] column_is_not_null:false;[R1] [C6] column_value_new:[12.34](5);[R1] [C7] column_name:C6;[R1] [C7] column_type:MYSQL_TYPE_VAR_STRING;[R1] [C7] column_is_rowkey:false;[R1] [C7] column_is_signed:true;[R1] [C7] column_encoding:utf8mb4;[R1] [C7] column_is_not_null:false;[R1] [C7] column_value_new:[-0.1234](7);[R1] [C8] column_name:C7;[R1] [C8] column_type:MYSQL_TYPE_STRING;[R1] [C8] column_is_rowkey:false;[R1] [C8] column_is_signed:true;[R1] [C8] column_encoding:utf8mb4;[R1] [C8] column_is_not_null:false;[R1] [C8] column_value_new:[12.34                                                                                               ](100);$[R2] COMMIT;
insert into number_1 (c0, c6) values (77+100,'-0.123');
ob1.oblog.next;
[R0] BEGIN;[R0] org_cluster_id:1;[R1] record_type:INSERT;[R1] database_name:oracle.OBLOG_DB;[R1] table_name:NUMBER_1;[R1] log_event:true;[R1] column_count:8;[R1] source_category:SRC_FULL_RECORDED;[R1] source_type:SRC_OCEANBASE_1_0;[R1] has_pk:true;[R1] pk_info:(0);[R1] pks:C0;[R1] has_uk:false;[R1] uk_info:(null);[R1] uks:(null);[R1] [C1] column_name:C0;[R1] [C1] column_type:MYSQL_TYPE_NEWDECIMAL;[R1] [C1] column_is_rowkey:true;[R1] [C1] column_is_signed:true;[R1] [C1] column_encoding:binary;[R1] [C1] column_is_not_null:true;[R1] [C1] column_value_new:[177](3);[R1] [C2] column_name:C1;[R1] [C2] column_type:MYSQL_TYPE_DOUBLE;[R1] [C2] column_is_rowkey:false;[R1] [C2] column_is_signed:true;[R1] [C2] column_encoding:binary;[R1] [C2] column_is_not_null:false;[R1] [C2] column_value_new:[1.234E+001](10);[R1] [C3] column_name:C2;[R1] [C3] column_type:MYSQL_TYPE_FLOAT;[R1] [C3] column_is_rowkey:false;[R1] [C3] column_is_signed:true;[R1] [C3] column_encoding:binary;[R1] [C3] column_is_not_null:false;[R1] [C3] column_value_new:[1.23400002E+001](15);[R1] [C4] column_name:C3;[R1] [C4] column_type:MYSQL_TYPE_NEWDECIMAL;[R1] [C4] column_is_rowkey:false;[R1] [C4] column_is_signed:true;[R1] [C4] column_encoding:binary;[R1] [C4] column_is_not_null:false;[R1] [C4] column_value_new:[12.34](5);[R1] [C5] column_name:C4;[R1] [C5] column_type:MYSQL_TYPE_OB_NUMBER_FLOAT;[R1] [C5] column_is_rowkey:false;[R1] [C5] column_is_signed:true;[R1] [C5] column_encoding:binary;[R1] [C5] column_is_not_null:false;[R1] [C5] column_value_new:[12.34](5);[R1] [C6] column_name:C5;[R1] [C6] column_type:MYSQL_TYPE_OB_NUMBER_FLOAT;[R1] [C6] column_is_rowkey:false;[R1] [C6] column_is_signed:true;[R1] [C6] column_encoding:binary;[R1] [C6] column_is_not_null:false;[R1] [C6] column_value_new:[12.34](5);[R1] [C7] column_name:C6;[R1] [C7] column_type:MYSQL_TYPE_VAR_STRING;[R1] [C7] column_is_rowkey:false;[R1] [C7] column_is_signed:true;[R1] [C7] column_encoding:utf8mb4;[R1] [C7] column_is_not_null:false;[R1] [C7] column_value_new:[-0.123](6);[R1] [C8] column_name:C7;[R1] [C8] column_type:MYSQL_TYPE_STRING;[R1] [C8] column_is_rowkey:false;[R1] [C8] column_is_signed:true;[R1] [C8] column_encoding:utf8mb4;[R1] [C8] column_is_not_null:false;[R1] [C8] column_value_new:[12.34                                                                                               ](100);$[R2] COMMIT;
insert into number_1 (c0, c6) values (78+100,'-0.12');
ob1.oblog.next;
[R0] BEGIN;[R0] org_cluster_id:1;[R1] record_type:INSERT;[R1] database_name:oracle.OBLOG_DB;[R1] table_name:NUMBER_1;[R1] log_event:true;[R1] column_count:8;[R1] source_category:SRC_FULL_RECORDED;[R1] source_type:SRC_OCEANBASE_1_0;[R1] has_pk:true;[R1] pk_info:(0);[R1] pks:C0;[R1] has_uk:false;[R1] uk_info:(null);[R1] uks:(null);[R1] [C1] column_name:C0;[R1] [C1] column_type:MYSQL_TYPE_NEWDECIMAL;[R1] [C1] column_is_rowkey:true;[R1] [C1] column_is_signed:true;[R1] [C1] column_encoding:binary;[R1] [C1] column_is_not_null:true;[R1] [C1] column_value_new:[178](3);[R1] [C2] column_name:C1;[R1] [C2] column_type:MYSQL_TYPE_DOUBLE;[R1] [C2] column_is_rowkey:false;[R1] [C2] column_is_signed:true;[R1] [C2] column_encoding:binary;[R1] [C2] column_is_not_null:false;[R1] [C2] column_value_new:[1.234E+001](10);[R1] [C3] column_name:C2;[R1] [C3] column_type:MYSQL_TYPE_FLOAT;[R1] [C3] column_is_rowkey:false;[R1] [C3] column_is_signed:true;[R1] [C3] column_encoding:binary;[R1] [C3] column_is_not_null:false;[R1] [C3] column_value_new:[1.23400002E+001](15);[R1] [C4] column_name:C3;[R1] [C4] column_type:MYSQL_TYPE_NEWDECIMAL;[R1] [C4] column_is_rowkey:false;[R1] [C4] column_is_signed:true;[R1] [C4] column_encoding:binary;[R1] [C4] column_is_not_null:false;[R1] [C4] column_value_new:[12.34](5);[R1] [C5] column_name:C4;[R1] [C5] column_type:MYSQL_TYPE_OB_NUMBER_FLOAT;[R1] [C5] column_is_rowkey:false;[R1] [C5] column_is_signed:true;[R1] [C5] column_encoding:binary;[R1] [C5] column_is_not_null:false;[R1] [C5] column_value_new:[12.34](5);[R1] [C6] column_name:C5;[R1] [C6] column_type:MYSQL_TYPE_OB_NUMBER_FLOAT;[R1] [C6] column_is_rowkey:false;[R1] [C6] column_is_signed:true;[R1] [C6] column_encoding:binary;[R1] [C6] column_is_not_null:false;[R1] [C6] column_value_new:[12.34](5);[R1] [C7] column_name:C6;[R1] [C7] column_type:MYSQL_TYPE_VAR_STRING;[R1] [C7] column_is_rowkey:false;[R1] [C7] column_is_signed:true;[R1] [C7] column_encoding:utf8mb4;[R1] [C7] column_is_not_null:false;[R1] [C7] column_value_new:[-0.12](5);[R1] [C8] column_name:C7;[R1] [C8] column_type:MYSQL_TYPE_STRING;[R1] [C8] column_is_rowkey:false;[R1] [C8] column_is_signed:true;[R1] [C8] column_encoding:utf8mb4;[R1] [C8] column_is_not_null:false;[R1] [C8] column_value_new:[12.34                                                                                               ](100);$[R2] COMMIT;
insert into number_1 (c0, c6) values (79+100,'-0.1');
ob1.oblog.next;
[R0] BEGIN;[R0] org_cluster_id:1;[R1] record_type:INSERT;[R1] database_name:oracle.OBLOG_DB;[R1] table_name:NUMBER_1;[R1] log_event:true;[R1] column_count:8;[R1] source_category:SRC_FULL_RECORDED;[R1] source_type:SRC_OCEANBASE_1_0;[R1] has_pk:true;[R1] pk_info:(0);[R1] pks:C0;[R1] has_uk:false;[R1] uk_info:(null);[R1] uks:(null);[R1] [C1] column_name:C0;[R1] [C1] column_type:MYSQL_TYPE_NEWDECIMAL;[R1] [C1] column_is_rowkey:true;[R1] [C1] column_is_signed:true;[R1] [C1] column_encoding:binary;[R1] [C1] column_is_not_null:true;[R1] [C1] column_value_new:[179](3);[R1] [C2] column_name:C1;[R1] [C2] column_type:MYSQL_TYPE_DOUBLE;[R1] [C2] column_is_rowkey:false;[R1] [C2] column_is_signed:true;[R1] [C2] column_encoding:binary;[R1] [C2] column_is_not_null:false;[R1] [C2] column_value_new:[1.234E+001](10);[R1] [C3] column_name:C2;[R1] [C3] column_type:MYSQL_TYPE_FLOAT;[R1] [C3] column_is_rowkey:false;[R1] [C3] column_is_signed:true;[R1] [C3] column_encoding:binary;[R1] [C3] column_is_not_null:false;[R1] [C3] column_value_new:[1.23400002E+001](15);[R1] [C4] column_name:C3;[R1] [C4] column_type:MYSQL_TYPE_NEWDECIMAL;[R1] [C4] column_is_rowkey:false;[R1] [C4] column_is_signed:true;[R1] [C4] column_encoding:binary;[R1] [C4] column_is_not_null:false;[R1] [C4] column_value_new:[12.34](5);[R1] [C5] column_name:C4;[R1] [C5] column_type:MYSQL_TYPE_OB_NUMBER_FLOAT;[R1] [C5] column_is_rowkey:false;[R1] [C5] column_is_signed:true;[R1] [C5] column_encoding:binary;[R1] [C5] column_is_not_null:false;[R1] [C5] column_value_new:[12.34](5);[R1] [C6] column_name:C5;[R1] [C6] column_type:MYSQL_TYPE_OB_NUMBER_FLOAT;[R1] [C6] column_is_rowkey:false;[R1] [C6] column_is_signed:true;[R1] [C6] column_encoding:binary;[R1] [C6] column_is_not_null:false;[R1] [C6] column_value_new:[12.34](5);[R1] [C7] column_name:C6;[R1] [C7] column_type:MYSQL_TYPE_VAR_STRING;[R1] [C7] column_is_rowkey:false;[R1] [C7] column_is_signed:true;[R1] [C7] column_encoding:utf8mb4;[R1] [C7] column_is_not_null:false;[R1] [C7] column_value_new:[-0.1](4);[R1] [C8] column_name:C7;[R1] [C8] column_type:MYSQL_TYPE_STRING;[R1] [C8] column_is_rowkey:false;[R1] [C8] column_is_signed:true;[R1] [C8] column_encoding:utf8mb4;[R1] [C8] column_is_not_null:false;[R1] [C8] column_value_new:[12.34                                                                                               ](100);$[R2] COMMIT;
insert into number_1 (c0, c6) values (80+100,'1.23e30');
ob1.oblog.next;
[R0] BEGIN;[R0] org_cluster_id:1;[R1] record_type:INSERT;[R1] database_name:oracle.OBLOG_DB;[R1] table_name:NUMBER_1;[R1] log_event:true;[R1] column_count:8;[R1] source_category:SRC_FULL_RECORDED;[R1] source_type:SRC_OCEANBASE_1_0;[R1] has_pk:true;[R1] pk_info:(0);[R1] pks:C0;[R1] has_uk:false;[R1] uk_info:(null);[R1] uks:(null);[R1] [C1] column_name:C0;[R1] [C1] column_type:MYSQL_TYPE_NEWDECIMAL;[R1] [C1] column_is_rowkey:true;[R1] [C1] column_is_signed:true;[R1] [C1] column_encoding:binary;[R1] [C1] column_is_not_null:true;[R1] [C1] column_value_new:[180](3);[R1] [C2] column_name:C1;[R1] [C2] column_type:MYSQL_TYPE_DOUBLE;[R1] [C2] column_is_rowkey:false;[R1] [C2] column_is_signed:true;[R1] [C2] column_encoding:binary;[R1] [C2] column_is_not_null:false;[R1] [C2] column_value_new:[1.234E+001](10);[R1] [C3] column_name:C2;[R1] [C3] column_type:MYSQL_TYPE_FLOAT;[R1] [C3] column_is_rowkey:false;[R1] [C3] column_is_signed:true;[R1] [C3] column_encoding:binary;[R1] [C3] column_is_not_null:false;[R1] [C3] column_value_new:[1.23400002E+001](15);[R1] [C4] column_name:C3;[R1] [C4] column_type:MYSQL_TYPE_NEWDECIMAL;[R1] [C4] column_is_rowkey:false;[R1] [C4] column_is_signed:true;[R1] [C4] column_encoding:binary;[R1] [C4] column_is_not_null:false;[R1] [C4] column_value_new:[12.34](5);[R1] [C5] column_name:C4;[R1] [C5] column_type:MYSQL_TYPE_OB_NUMBER_FLOAT;[R1] [C5] column_is_rowkey:false;[R1] [C5] column_is_signed:true;[R1] [C5] column_encoding:binary;[R1] [C5] column_is_not_null:false;[R1] [C5] column_value_new:[12.34](5);[R1] [C6] column_name:C5;[R1] [C6] column_type:MYSQL_TYPE_OB_NUMBER_FLOAT;[R1] [C6] column_is_rowkey:false;[R1] [C6] column_is_signed:true;[R1] [C6] column_encoding:binary;[R1] [C6] column_is_not_null:false;[R1] [C6] column_value_new:[12.34](5);[R1] [C7] column_name:C6;[R1] [C7] column_type:MYSQL_TYPE_VAR_STRING;[R1] [C7] column_is_rowkey:false;[R1] [C7] column_is_signed:true;[R1] [C7] column_encoding:utf8mb4;[R1] [C7] column_is_not_null:false;[R1] [C7] column_value_new:[1.23e30](7);[R1] [C8] column_name:C7;[R1] [C8] column_type:MYSQL_TYPE_STRING;[R1] [C8] column_is_rowkey:false;[R1] [C8] column_is_signed:true;[R1] [C8] column_encoding:utf8mb4;[R1] [C8] column_is_not_null:false;[R1] [C8] column_value_new:[12.34                                                                                               ](100);$[R2] COMMIT;
insert into number_1 (c0, c6) values (81+100,'1.23e-30');
ob1.oblog.next;
[R0] BEGIN;[R0] org_cluster_id:1;[R1] record_type:INSERT;[R1] database_name:oracle.OBLOG_DB;[R1] table_name:NUMBER_1;[R1] log_event:true;[R1] column_count:8;[R1] source_category:SRC_FULL_RECORDED;[R1] source_type:SRC_OCEANBASE_1_0;[R1] has_pk:true;[R1] pk_info:(0);[R1] pks:C0;[R1] has_uk:false;[R1] uk_info:(null);[R1] uks:(null);[R1] [C1] column_name:C0;[R1] [C1] column_type:MYSQL_TYPE_NEWDECIMAL;[R1] [C1] column_is_rowkey:true;[R1] [C1] column_is_signed:true;[R1] [C1] column_encoding:binary;[R1] [C1] column_is_not_null:true;[R1] [C1] column_value_new:[181](3);[R1] [C2] column_name:C1;[R1] [C2] column_type:MYSQL_TYPE_DOUBLE;[R1] [C2] column_is_rowkey:false;[R1] [C2] column_is_signed:true;[R1] [C2] column_encoding:binary;[R1] [C2] column_is_not_null:false;[R1] [C2] column_value_new:[1.234E+001](10);[R1] [C3] column_name:C2;[R1] [C3] column_type:MYSQL_TYPE_FLOAT;[R1] [C3] column_is_rowkey:false;[R1] [C3] column_is_signed:true;[R1] [C3] column_encoding:binary;[R1] [C3] column_is_not_null:false;[R1] [C3] column_value_new:[1.23400002E+001](15);[R1] [C4] column_name:C3;[R1] [C4] column_type:MYSQL_TYPE_NEWDECIMAL;[R1] [C4] column_is_rowkey:false;[R1] [C4] column_is_signed:true;[R1] [C4] column_encoding:binary;[R1] [C4] column_is_not_null:false;[R1] [C4] column_value_new:[12.34](5);[R1] [C5] column_name:C4;[R1] [C5] column_type:MYSQL_TYPE_OB_NUMBER_FLOAT;[R1] [C5] column_is_rowkey:false;[R1] [C5] column_is_signed:true;[R1] [C5] column_encoding:binary;[R1] [C5] column_is_not_null:false;[R1] [C5] column_value_new:[12.34](5);[R1] [C6] column_name:C5;[R1] [C6] column_type:MYSQL_TYPE_OB_NUMBER_FLOAT;[R1] [C6] column_is_rowkey:false;[R1] [C6] column_is_signed:true;[R1] [C6] column_encoding:binary;[R1] [C6] column_is_not_null:false;[R1] [C6] column_value_new:[12.34](5);[R1] [C7] column_name:C6;[R1] [C7] column_type:MYSQL_TYPE_VAR_STRING;[R1] [C7] column_is_rowkey:false;[R1] [C7] column_is_signed:true;[R1] [C7] column_encoding:utf8mb4;[R1] [C7] column_is_not_null:false;[R1] [C7] column_value_new:[1.23e-30](8);[R1] [C8] column_name:C7;[R1] [C8] column_type:MYSQL_TYPE_STRING;[R1] [C8] column_is_rowkey:false;[R1] [C8] column_is_signed:true;[R1] [C8] column_encoding:utf8mb4;[R1] [C8] column_is_not_null:false;[R1] [C8] column_value_new:[12.34                                                                                               ](100);$[R2] COMMIT;
insert into number_1 (c0, c6) values (82+100,'1.23456789123456789123456789123456789123456789');
ob1.oblog.next;
[R0] BEGIN;[R0] org_cluster_id:1;[R1] record_type:INSERT;[R1] database_name:oracle.OBLOG_DB;[R1] table_name:NUMBER_1;[R1] log_event:true;[R1] column_count:8;[R1] source_category:SRC_FULL_RECORDED;[R1] source_type:SRC_OCEANBASE_1_0;[R1] has_pk:true;[R1] pk_info:(0);[R1] pks:C0;[R1] has_uk:false;[R1] uk_info:(null);[R1] uks:(null);[R1] [C1] column_name:C0;[R1] [C1] column_type:MYSQL_TYPE_NEWDECIMAL;[R1] [C1] column_is_rowkey:true;[R1] [C1] column_is_signed:true;[R1] [C1] column_encoding:binary;[R1] [C1] column_is_not_null:true;[R1] [C1] column_value_new:[182](3);[R1] [C2] column_name:C1;[R1] [C2] column_type:MYSQL_TYPE_DOUBLE;[R1] [C2] column_is_rowkey:false;[R1] [C2] column_is_signed:true;[R1] [C2] column_encoding:binary;[R1] [C2] column_is_not_null:false;[R1] [C2] column_value_new:[1.234E+001](10);[R1] [C3] column_name:C2;[R1] [C3] column_type:MYSQL_TYPE_FLOAT;[R1] [C3] column_is_rowkey:false;[R1] [C3] column_is_signed:true;[R1] [C3] column_encoding:binary;[R1] [C3] column_is_not_null:false;[R1] [C3] column_value_new:[1.23400002E+001](15);[R1] [C4] column_name:C3;[R1] [C4] column_type:MYSQL_TYPE_NEWDECIMAL;[R1] [C4] column_is_rowkey:false;[R1] [C4] column_is_signed:true;[R1] [C4] column_encoding:binary;[R1] [C4] column_is_not_null:false;[R1] [C4] column_value_new:[12.34](5);[R1] [C5] column_name:C4;[R1] [C5] column_type:MYSQL_TYPE_OB_NUMBER_FLOAT;[R1] [C5] column_is_rowkey:false;[R1] [C5] column_is_signed:true;[R1] [C5] column_encoding:binary;[R1] [C5] column_is_not_null:false;[R1] [C5] column_value_new:[12.34](5);[R1] [C6] column_name:C5;[R1] [C6] column_type:MYSQL_TYPE_OB_NUMBER_FLOAT;[R1] [C6] column_is_rowkey:false;[R1] [C6] column_is_signed:true;[R1] [C6] column_encoding:binary;[R1] [C6] column_is_not_null:false;[R1] [C6] column_value_new:[12.34](5);[R1] [C7] column_name:C6;[R1] [C7] column_type:MYSQL_TYPE_VAR_STRING;[R1] [C7] column_is_rowkey:false;[R1] [C7] column_is_signed:true;[R1] [C7] column_encoding:utf8mb4;[R1] [C7] column_is_not_null:false;[R1] [C7] column_value_new:[1.23456789123456789123456789123456789123456789](46);[R1] [C8] column_name:C7;[R1] [C8] column_type:MYSQL_TYPE_STRING;[R1] [C8] column_is_rowkey:false;[R1] [C8] column_is_signed:true;[R1] [C8] column_encoding:utf8mb4;[R1] [C8] column_is_not_null:false;[R1] [C8] column_value_new:[12.34                                                                                               ](100);$[R2] COMMIT;
update number_1 set c1=c6, c2=c6, c3=c6, c4=c6, c5=c6, c7=c6 where c0 = 19;
select c0, c6, c1, c2, c3, c4, c5, c7 from number_1 where c0 = 19;
C0	C6	C1	C2	C3	C4	C5	C7
19	0	0	0	0	0	0	0                                                                                                   
ob1.oblog.next;
[R0] BEGIN;[R0] org_cluster_id:1;[R1] record_type:UPDATE;[R1] database_name:oracle.OBLOG_DB;[R1] table_name:NUMBER_1;[R1] log_event:true;[R1] column_count:8;[R1] source_category:SRC_FULL_RECORDED;[R1] source_type:SRC_OCEANBASE_1_0;[R1] has_pk:true;[R1] pk_info:(0);[R1] pks:C0;[R1] has_uk:false;[R1] uk_info:(null);[R1] uks:(null);[R1] [C1] column_name:C0;[R1] [C1] column_type:MYSQL_TYPE_NEWDECIMAL;[R1] [C1] column_is_rowkey:true;[R1] [C1] column_is_signed:true;[R1] [C1] column_encoding:binary;[R1] [C1] column_is_not_null:true;[R1] [C1] column_value_new:[19](2);[R1] [C1] column_value_old:[19](2);[R1] [C2] column_name:C1;[R1] [C2] column_type:MYSQL_TYPE_DOUBLE;[R1] [C2] column_is_rowkey:false;[R1] [C2] column_is_signed:true;[R1] [C2] column_encoding:binary;[R1] [C2] column_is_not_null:false;[R1] [C2] column_value_new:[0](1);[R1] [C2] column_value_old:[1.234E+001](10);[R1] [C3] column_name:C2;[R1] [C3] column_type:MYSQL_TYPE_FLOAT;[R1] [C3] column_is_rowkey:false;[R1] [C3] column_is_signed:true;[R1] [C3] column_encoding:binary;[R1] [C3] column_is_not_null:false;[R1] [C3] column_value_new:[0](1);[R1] [C3] column_value_old:[1.23400002E+001](15);[R1] [C4] column_name:C3;[R1] [C4] column_type:MYSQL_TYPE_NEWDECIMAL;[R1] [C4] column_is_rowkey:false;[R1] [C4] column_is_signed:true;[R1] [C4] column_encoding:binary;[R1] [C4] column_is_not_null:false;[R1] [C4] column_value_new:[0](1);[R1] [C4] column_value_old:[12.34](5);[R1] [C5] column_name:C4;[R1] [C5] column_type:MYSQL_TYPE_OB_NUMBER_FLOAT;[R1] [C5] column_is_rowkey:false;[R1] [C5] column_is_signed:true;[R1] [C5] column_encoding:binary;[R1] [C5] column_is_not_null:false;[R1] [C5] column_value_new:[0](1);[R1] [C5] column_value_old:[12.34](5);[R1] [C6] column_name:C5;[R1] [C6] column_type:MYSQL_TYPE_OB_NUMBER_FLOAT;[R1] [C6] column_is_rowkey:false;[R1] [C6] column_is_signed:true;[R1] [C6] column_encoding:binary;[R1] [C6] column_is_not_null:false;[R1] [C6] column_value_new:[0](1);[R1] [C6] column_value_old:[12.34](5);[R1] [C7] column_name:C6;[R1] [C7] column_type:MYSQL_TYPE_VAR_STRING;[R1] [C7] column_is_rowkey:false;[R1] [C7] column_is_signed:true;[R1] [C7] column_encoding:utf8mb4;[R1] [C7] column_is_not_null:false;[R1] [C7] column_value_new:[0](1);[R1] [C7] column_value_old:[0](1);[R1] [C8] column_name:C7;[R1] [C8] column_type:MYSQL_TYPE_STRING;[R1] [C8] column_is_rowkey:false;[R1] [C8] column_is_signed:true;[R1] [C8] column_encoding:utf8mb4;[R1] [C8] column_is_not_null:false;[R1] [C8] column_value_new:[0                                                                                                   ](100);[R1] [C8] column_value_old:[12.34                                                                                               ](100);$[R2] COMMIT;
update number_1 set c1=c6, c2=c6, c3=c6, c4=c6, c5=c6, c7=c6 where c0 = 20;
select c0, c6, c1, c2, c3, c4, c5, c7 from number_1 where c0 = 20;
C0	C6	C1	C2	C3	C4	C5	C7
20	0.0	0	0	0	0	0	0.0                                                                                                 
ob1.oblog.next;
[R0] BEGIN;[R0] org_cluster_id:1;[R1] record_type:UPDATE;[R1] database_name:oracle.OBLOG_DB;[R1] table_name:NUMBER_1;[R1] log_event:true;[R1] column_count:8;[R1] source_category:SRC_FULL_RECORDED;[R1] source_type:SRC_OCEANBASE_1_0;[R1] has_pk:true;[R1] pk_info:(0);[R1] pks:C0;[R1] has_uk:false;[R1] uk_info:(null);[R1] uks:(null);[R1] [C1] column_name:C0;[R1] [C1] column_type:MYSQL_TYPE_NEWDECIMAL;[R1] [C1] column_is_rowkey:true;[R1] [C1] column_is_signed:true;[R1] [C1] column_encoding:binary;[R1] [C1] column_is_not_null:true;[R1] [C1] column_value_new:[20](2);[R1] [C1] column_value_old:[20](2);[R1] [C2] column_name:C1;[R1] [C2] column_type:MYSQL_TYPE_DOUBLE;[R1] [C2] column_is_rowkey:false;[R1] [C2] column_is_signed:true;[R1] [C2] column_encoding:binary;[R1] [C2] column_is_not_null:false;[R1] [C2] column_value_new:[0](1);[R1] [C2] column_value_old:[1.234E+001](10);[R1] [C3] column_name:C2;[R1] [C3] column_type:MYSQL_TYPE_FLOAT;[R1] [C3] column_is_rowkey:false;[R1] [C3] column_is_signed:true;[R1] [C3] column_encoding:binary;[R1] [C3] column_is_not_null:false;[R1] [C3] column_value_new:[0](1);[R1] [C3] column_value_old:[1.23400002E+001](15);[R1] [C4] column_name:C3;[R1] [C4] column_type:MYSQL_TYPE_NEWDECIMAL;[R1] [C4] column_is_rowkey:false;[R1] [C4] column_is_signed:true;[R1] [C4] column_encoding:binary;[R1] [C4] column_is_not_null:false;[R1] [C4] column_value_new:[0](1);[R1] [C4] column_value_old:[12.34](5);[R1] [C5] column_name:C4;[R1] [C5] column_type:MYSQL_TYPE_OB_NUMBER_FLOAT;[R1] [C5] column_is_rowkey:false;[R1] [C5] column_is_signed:true;[R1] [C5] column_encoding:binary;[R1] [C5] column_is_not_null:false;[R1] [C5] column_value_new:[0](1);[R1] [C5] column_value_old:[12.34](5);[R1] [C6] column_name:C5;[R1] [C6] column_type:MYSQL_TYPE_OB_NUMBER_FLOAT;[R1] [C6] column_is_rowkey:false;[R1] [C6] column_is_signed:true;[R1] [C6] column_encoding:binary;[R1] [C6] column_is_not_null:false;[R1] [C6] column_value_new:[0](1);[R1] [C6] column_value_old:[12.34](5);[R1] [C7] column_name:C6;[R1] [C7] column_type:MYSQL_TYPE_VAR_STRING;[R1] [C7] column_is_rowkey:false;[R1] [C7] column_is_signed:true;[R1] [C7] column_encoding:utf8mb4;[R1] [C7] column_is_not_null:false;[R1] [C7] column_value_new:[0.0](3);[R1] [C7] column_value_old:[0.0](3);[R1] [C8] column_name:C7;[R1] [C8] column_type:MYSQL_TYPE_STRING;[R1] [C8] column_is_rowkey:false;[R1] [C8] column_is_signed:true;[R1] [C8] column_encoding:utf8mb4;[R1] [C8] column_is_not_null:false;[R1] [C8] column_value_new:[0.0                                                                                                 ](100);[R1] [C8] column_value_old:[12.34                                                                                               ](100);$[R2] COMMIT;
update number_1 set c1=c6, c2=c6, c3=c6, c4=c6, c5=c6, c7=c6 where c0 = 21;
select c0, c6, c1, c2, c3, c4, c5, c7 from number_1 where c0 = 21;
C0	C6	C1	C2	C3	C4	C5	C7
21	1	1.0E+000	1.0E+000	1	1	1	1                                                                                                   
ob1.oblog.next;
[R0] BEGIN;[R0] org_cluster_id:1;[R1] record_type:UPDATE;[R1] database_name:oracle.OBLOG_DB;[R1] table_name:NUMBER_1;[R1] log_event:true;[R1] column_count:8;[R1] source_category:SRC_FULL_RECORDED;[R1] source_type:SRC_OCEANBASE_1_0;[R1] has_pk:true;[R1] pk_info:(0);[R1] pks:C0;[R1] has_uk:false;[R1] uk_info:(null);[R1] uks:(null);[R1] [C1] column_name:C0;[R1] [C1] column_type:MYSQL_TYPE_NEWDECIMAL;[R1] [C1] column_is_rowkey:true;[R1] [C1] column_is_signed:true;[R1] [C1] column_encoding:binary;[R1] [C1] column_is_not_null:true;[R1] [C1] column_value_new:[21](2);[R1] [C1] column_value_old:[21](2);[R1] [C2] column_name:C1;[R1] [C2] column_type:MYSQL_TYPE_DOUBLE;[R1] [C2] column_is_rowkey:false;[R1] [C2] column_is_signed:true;[R1] [C2] column_encoding:binary;[R1] [C2] column_is_not_null:false;[R1] [C2] column_value_new:[1.0E+000](8);[R1] [C2] column_value_old:[1.234E+001](10);[R1] [C3] column_name:C2;[R1] [C3] column_type:MYSQL_TYPE_FLOAT;[R1] [C3] column_is_rowkey:false;[R1] [C3] column_is_signed:true;[R1] [C3] column_encoding:binary;[R1] [C3] column_is_not_null:false;[R1] [C3] column_value_new:[1.0E+000](8);[R1] [C3] column_value_old:[1.23400002E+001](15);[R1] [C4] column_name:C3;[R1] [C4] column_type:MYSQL_TYPE_NEWDECIMAL;[R1] [C4] column_is_rowkey:false;[R1] [C4] column_is_signed:true;[R1] [C4] column_encoding:binary;[R1] [C4] column_is_not_null:false;[R1] [C4] column_value_new:[1](1);[R1] [C4] column_value_old:[12.34](5);[R1] [C5] column_name:C4;[R1] [C5] column_type:MYSQL_TYPE_OB_NUMBER_FLOAT;[R1] [C5] column_is_rowkey:false;[R1] [C5] column_is_signed:true;[R1] [C5] column_encoding:binary;[R1] [C5] column_is_not_null:false;[R1] [C5] column_value_new:[1](1);[R1] [C5] column_value_old:[12.34](5);[R1] [C6] column_name:C5;[R1] [C6] column_type:MYSQL_TYPE_OB_NUMBER_FLOAT;[R1] [C6] column_is_rowkey:false;[R1] [C6] column_is_signed:true;[R1] [C6] column_encoding:binary;[R1] [C6] column_is_not_null:false;[R1] [C6] column_value_new:[1](1);[R1] [C6] column_value_old:[12.34](5);[R1] [C7] column_name:C6;[R1] [C7] column_type:MYSQL_TYPE_VAR_STRING;[R1] [C7] column_is_rowkey:false;[R1] [C7] column_is_signed:true;[R1] [C7] column_encoding:utf8mb4;[R1] [C7] column_is_not_null:false;[R1] [C7] column_value_new:[1](1);[R1] [C7] column_value_old:[1](1);[R1] [C8] column_name:C7;[R1] [C8] column_type:MYSQL_TYPE_STRING;[R1] [C8] column_is_rowkey:false;[R1] [C8] column_is_signed:true;[R1] [C8] column_encoding:utf8mb4;[R1] [C8] column_is_not_null:false;[R1] [C8] column_value_new:[1                                                                                                   ](100);[R1] [C8] column_value_old:[12.34                                                                                               ](100);$[R2] COMMIT;
update number_1 set c1=c6, c2=c6, c3=c6, c4=c6, c5=c6, c7=c6 where c0 = 22;
select c0, c6, c1, c2, c3, c4, c5, c7 from number_1 where c0 = 22;
C0	C6	C1	C2	C3	C4	C5	C7
22	12	1.2E+001	1.2E+001	12	12	12	12                                                                                                  
ob1.oblog.next;
[R0] BEGIN;[R0] org_cluster_id:1;[R1] record_type:UPDATE;[R1] database_name:oracle.OBLOG_DB;[R1] table_name:NUMBER_1;[R1] log_event:true;[R1] column_count:8;[R1] source_category:SRC_FULL_RECORDED;[R1] source_type:SRC_OCEANBASE_1_0;[R1] has_pk:true;[R1] pk_info:(0);[R1] pks:C0;[R1] has_uk:false;[R1] uk_info:(null);[R1] uks:(null);[R1] [C1] column_name:C0;[R1] [C1] column_type:MYSQL_TYPE_NEWDECIMAL;[R1] [C1] column_is_rowkey:true;[R1] [C1] column_is_signed:true;[R1] [C1] column_encoding:binary;[R1] [C1] column_is_not_null:true;[R1] [C1] column_value_new:[22](2);[R1] [C1] column_value_old:[22](2);[R1] [C2] column_name:C1;[R1] [C2] column_type:MYSQL_TYPE_DOUBLE;[R1] [C2] column_is_rowkey:false;[R1] [C2] column_is_signed:true;[R1] [C2] column_encoding:binary;[R1] [C2] column_is_not_null:false;[R1] [C2] column_value_new:[1.2E+001](8);[R1] [C2] column_value_old:[1.234E+001](10);[R1] [C3] column_name:C2;[R1] [C3] column_type:MYSQL_TYPE_FLOAT;[R1] [C3] column_is_rowkey:false;[R1] [C3] column_is_signed:true;[R1] [C3] column_encoding:binary;[R1] [C3] column_is_not_null:false;[R1] [C3] column_value_new:[1.2E+001](8);[R1] [C3] column_value_old:[1.23400002E+001](15);[R1] [C4] column_name:C3;[R1] [C4] column_type:MYSQL_TYPE_NEWDECIMAL;[R1] [C4] column_is_rowkey:false;[R1] [C4] column_is_signed:true;[R1] [C4] column_encoding:binary;[R1] [C4] column_is_not_null:false;[R1] [C4] column_value_new:[12](2);[R1] [C4] column_value_old:[12.34](5);[R1] [C5] column_name:C4;[R1] [C5] column_type:MYSQL_TYPE_OB_NUMBER_FLOAT;[R1] [C5] column_is_rowkey:false;[R1] [C5] column_is_signed:true;[R1] [C5] column_encoding:binary;[R1] [C5] column_is_not_null:false;[R1] [C5] column_value_new:[12](2);[R1] [C5] column_value_old:[12.34](5);[R1] [C6] column_name:C5;[R1] [C6] column_type:MYSQL_TYPE_OB_NUMBER_FLOAT;[R1] [C6] column_is_rowkey:false;[R1] [C6] column_is_signed:true;[R1] [C6] column_encoding:binary;[R1] [C6] column_is_not_null:false;[R1] [C6] column_value_new:[12](2);[R1] [C6] column_value_old:[12.34](5);[R1] [C7] column_name:C6;[R1] [C7] column_type:MYSQL_TYPE_VAR_STRING;[R1] [C7] column_is_rowkey:false;[R1] [C7] column_is_signed:true;[R1] [C7] column_encoding:utf8mb4;[R1] [C7] column_is_not_null:false;[R1] [C7] column_value_new:[12](2);[R1] [C7] column_value_old:[12](2);[R1] [C8] column_name:C7;[R1] [C8] column_type:MYSQL_TYPE_STRING;[R1] [C8] column_is_rowkey:false;[R1] [C8] column_is_signed:true;[R1] [C8] column_encoding:utf8mb4;[R1] [C8] column_is_not_null:false;[R1] [C8] column_value_new:[12                                                                                                  ](100);[R1] [C8] column_value_old:[12.34                                                                                               ](100);$[R2] COMMIT;
update number_1 set c1=c6, c2=c6, c3=c6, c4=c6, c5=c6, c7=c6 where c0 = 23;
select c0, c6, c1, c2, c3, c4, c5, c7 from number_1 where c0 = 23;
C0	C6	C1	C2	C3	C4	C5	C7
23	123	1.23E+002	1.23E+002	123	123	123	123                                                                                                 
ob1.oblog.next;
[R0] BEGIN;[R0] org_cluster_id:1;[R1] record_type:UPDATE;[R1] database_name:oracle.OBLOG_DB;[R1] table_name:NUMBER_1;[R1] log_event:true;[R1] column_count:8;[R1] source_category:SRC_FULL_RECORDED;[R1] source_type:SRC_OCEANBASE_1_0;[R1] has_pk:true;[R1] pk_info:(0);[R1] pks:C0;[R1] has_uk:false;[R1] uk_info:(null);[R1] uks:(null);[R1] [C1] column_name:C0;[R1] [C1] column_type:MYSQL_TYPE_NEWDECIMAL;[R1] [C1] column_is_rowkey:true;[R1] [C1] column_is_signed:true;[R1] [C1] column_encoding:binary;[R1] [C1] column_is_not_null:true;[R1] [C1] column_value_new:[23](2);[R1] [C1] column_value_old:[23](2);[R1] [C2] column_name:C1;[R1] [C2] column_type:MYSQL_TYPE_DOUBLE;[R1] [C2] column_is_rowkey:false;[R1] [C2] column_is_signed:true;[R1] [C2] column_encoding:binary;[R1] [C2] column_is_not_null:false;[R1] [C2] column_value_new:[1.23E+002](9);[R1] [C2] column_value_old:[1.234E+001](10);[R1] [C3] column_name:C2;[R1] [C3] column_type:MYSQL_TYPE_FLOAT;[R1] [C3] column_is_rowkey:false;[R1] [C3] column_is_signed:true;[R1] [C3] column_encoding:binary;[R1] [C3] column_is_not_null:false;[R1] [C3] column_value_new:[1.23E+002](9);[R1] [C3] column_value_old:[1.23400002E+001](15);[R1] [C4] column_name:C3;[R1] [C4] column_type:MYSQL_TYPE_NEWDECIMAL;[R1] [C4] column_is_rowkey:false;[R1] [C4] column_is_signed:true;[R1] [C4] column_encoding:binary;[R1] [C4] column_is_not_null:false;[R1] [C4] column_value_new:[123](3);[R1] [C4] column_value_old:[12.34](5);[R1] [C5] column_name:C4;[R1] [C5] column_type:MYSQL_TYPE_OB_NUMBER_FLOAT;[R1] [C5] column_is_rowkey:false;[R1] [C5] column_is_signed:true;[R1] [C5] column_encoding:binary;[R1] [C5] column_is_not_null:false;[R1] [C5] column_value_new:[123](3);[R1] [C5] column_value_old:[12.34](5);[R1] [C6] column_name:C5;[R1] [C6] column_type:MYSQL_TYPE_OB_NUMBER_FLOAT;[R1] [C6] column_is_rowkey:false;[R1] [C6] column_is_signed:true;[R1] [C6] column_encoding:binary;[R1] [C6] column_is_not_null:false;[R1] [C6] column_value_new:[123](3);[R1] [C6] column_value_old:[12.34](5);[R1] [C7] column_name:C6;[R1] [C7] column_type:MYSQL_TYPE_VAR_STRING;[R1] [C7] column_is_rowkey:false;[R1] [C7] column_is_signed:true;[R1] [C7] column_encoding:utf8mb4;[R1] [C7] column_is_not_null:false;[R1] [C7] column_value_new:[123](3);[R1] [C7] column_value_old:[123](3);[R1] [C8] column_name:C7;[R1] [C8] column_type:MYSQL_TYPE_STRING;[R1] [C8] column_is_rowkey:false;[R1] [C8] column_is_signed:true;[R1] [C8] column_encoding:utf8mb4;[R1] [C8] column_is_not_null:false;[R1] [C8] column_value_new:[123                                                                                                 ](100);[R1] [C8] column_value_old:[12.34                                                                                               ](100);$[R2] COMMIT;
update number_1 set c1=c6, c2=c6, c3=c6, c4=c6, c5=c6, c7=c6 where c0 = 24;
select c0, c6, c1, c2, c3, c4, c5, c7 from number_1 where c0 = 24;
C0	C6	C1	C2	C3	C4	C5	C7
24	1234	1.234E+003	1.234E+003	1234	1234	1234	1234                                                                                                
ob1.oblog.next;
[R0] BEGIN;[R0] org_cluster_id:1;[R1] record_type:UPDATE;[R1] database_name:oracle.OBLOG_DB;[R1] table_name:NUMBER_1;[R1] log_event:true;[R1] column_count:8;[R1] source_category:SRC_FULL_RECORDED;[R1] source_type:SRC_OCEANBASE_1_0;[R1] has_pk:true;[R1] pk_info:(0);[R1] pks:C0;[R1] has_uk:false;[R1] uk_info:(null);[R1] uks:(null);[R1] [C1] column_name:C0;[R1] [C1] column_type:MYSQL_TYPE_NEWDECIMAL;[R1] [C1] column_is_rowkey:true;[R1] [C1] column_is_signed:true;[R1] [C1] column_encoding:binary;[R1] [C1] column_is_not_null:true;[R1] [C1] column_value_new:[24](2);[R1] [C1] column_value_old:[24](2);[R1] [C2] column_name:C1;[R1] [C2] column_type:MYSQL_TYPE_DOUBLE;[R1] [C2] column_is_rowkey:false;[R1] [C2] column_is_signed:true;[R1] [C2] column_encoding:binary;[R1] [C2] column_is_not_null:false;[R1] [C2] column_value_new:[1.234E+003](10);[R1] [C2] column_value_old:[1.234E+001](10);[R1] [C3] column_name:C2;[R1] [C3] column_type:MYSQL_TYPE_FLOAT;[R1] [C3] column_is_rowkey:false;[R1] [C3] column_is_signed:true;[R1] [C3] column_encoding:binary;[R1] [C3] column_is_not_null:false;[R1] [C3] column_value_new:[1.234E+003](10);[R1] [C3] column_value_old:[1.23400002E+001](15);[R1] [C4] column_name:C3;[R1] [C4] column_type:MYSQL_TYPE_NEWDECIMAL;[R1] [C4] column_is_rowkey:false;[R1] [C4] column_is_signed:true;[R1] [C4] column_encoding:binary;[R1] [C4] column_is_not_null:false;[R1] [C4] column_value_new:[1234](4);[R1] [C4] column_value_old:[12.34](5);[R1] [C5] column_name:C4;[R1] [C5] column_type:MYSQL_TYPE_OB_NUMBER_FLOAT;[R1] [C5] column_is_rowkey:false;[R1] [C5] column_is_signed:true;[R1] [C5] column_encoding:binary;[R1] [C5] column_is_not_null:false;[R1] [C5] column_value_new:[1234](4);[R1] [C5] column_value_old:[12.34](5);[R1] [C6] column_name:C5;[R1] [C6] column_type:MYSQL_TYPE_OB_NUMBER_FLOAT;[R1] [C6] column_is_rowkey:false;[R1] [C6] column_is_signed:true;[R1] [C6] column_encoding:binary;[R1] [C6] column_is_not_null:false;[R1] [C6] column_value_new:[1234](4);[R1] [C6] column_value_old:[12.34](5);[R1] [C7] column_name:C6;[R1] [C7] column_type:MYSQL_TYPE_VAR_STRING;[R1] [C7] column_is_rowkey:false;[R1] [C7] column_is_signed:true;[R1] [C7] column_encoding:utf8mb4;[R1] [C7] column_is_not_null:false;[R1] [C7] column_value_new:[1234](4);[R1] [C7] column_value_old:[1234](4);[R1] [C8] column_name:C7;[R1] [C8] column_type:MYSQL_TYPE_STRING;[R1] [C8] column_is_rowkey:false;[R1] [C8] column_is_signed:true;[R1] [C8] column_encoding:utf8mb4;[R1] [C8] column_is_not_null:false;[R1] [C8] column_value_new:[1234                                                                                                ](100);[R1] [C8] column_value_old:[12.34                                                                                               ](100);$[R2] COMMIT;
update number_1 set c1=c6, c2=c6, c3=c6, c4=c6, c5=c6, c7=c6 where c0 = 25;
select c0, c6, c1, c2, c3, c4, c5, c7 from number_1 where c0 = 25;
C0	C6	C1	C2	C3	C4	C5	C7
25	12345	1.2345E+004	1.2345E+004	12345	12350	12345	12345                                                                                               
ob1.oblog.next;
[R0] BEGIN;[R0] org_cluster_id:1;[R1] record_type:UPDATE;[R1] database_name:oracle.OBLOG_DB;[R1] table_name:NUMBER_1;[R1] log_event:true;[R1] column_count:8;[R1] source_category:SRC_FULL_RECORDED;[R1] source_type:SRC_OCEANBASE_1_0;[R1] has_pk:true;[R1] pk_info:(0);[R1] pks:C0;[R1] has_uk:false;[R1] uk_info:(null);[R1] uks:(null);[R1] [C1] column_name:C0;[R1] [C1] column_type:MYSQL_TYPE_NEWDECIMAL;[R1] [C1] column_is_rowkey:true;[R1] [C1] column_is_signed:true;[R1] [C1] column_encoding:binary;[R1] [C1] column_is_not_null:true;[R1] [C1] column_value_new:[25](2);[R1] [C1] column_value_old:[25](2);[R1] [C2] column_name:C1;[R1] [C2] column_type:MYSQL_TYPE_DOUBLE;[R1] [C2] column_is_rowkey:false;[R1] [C2] column_is_signed:true;[R1] [C2] column_encoding:binary;[R1] [C2] column_is_not_null:false;[R1] [C2] column_value_new:[1.2345E+004](11);[R1] [C2] column_value_old:[1.234E+001](10);[R1] [C3] column_name:C2;[R1] [C3] column_type:MYSQL_TYPE_FLOAT;[R1] [C3] column_is_rowkey:false;[R1] [C3] column_is_signed:true;[R1] [C3] column_encoding:binary;[R1] [C3] column_is_not_null:false;[R1] [C3] column_value_new:[1.2345E+004](11);[R1] [C3] column_value_old:[1.23400002E+001](15);[R1] [C4] column_name:C3;[R1] [C4] column_type:MYSQL_TYPE_NEWDECIMAL;[R1] [C4] column_is_rowkey:false;[R1] [C4] column_is_signed:true;[R1] [C4] column_encoding:binary;[R1] [C4] column_is_not_null:false;[R1] [C4] column_value_new:[12345](5);[R1] [C4] column_value_old:[12.34](5);[R1] [C5] column_name:C4;[R1] [C5] column_type:MYSQL_TYPE_OB_NUMBER_FLOAT;[R1] [C5] column_is_rowkey:false;[R1] [C5] column_is_signed:true;[R1] [C5] column_encoding:binary;[R1] [C5] column_is_not_null:false;[R1] [C5] column_value_new:[12350](5);[R1] [C5] column_value_old:[12.34](5);[R1] [C6] column_name:C5;[R1] [C6] column_type:MYSQL_TYPE_OB_NUMBER_FLOAT;[R1] [C6] column_is_rowkey:false;[R1] [C6] column_is_signed:true;[R1] [C6] column_encoding:binary;[R1] [C6] column_is_not_null:false;[R1] [C6] column_value_new:[12345](5);[R1] [C6] column_value_old:[12.34](5);[R1] [C7] column_name:C6;[R1] [C7] column_type:MYSQL_TYPE_VAR_STRING;[R1] [C7] column_is_rowkey:false;[R1] [C7] column_is_signed:true;[R1] [C7] column_encoding:utf8mb4;[R1] [C7] column_is_not_null:false;[R1] [C7] column_value_new:[12345](5);[R1] [C7] column_value_old:[12345](5);[R1] [C8] column_name:C7;[R1] [C8] column_type:MYSQL_TYPE_STRING;[R1] [C8] column_is_rowkey:false;[R1] [C8] column_is_signed:true;[R1] [C8] column_encoding:utf8mb4;[R1] [C8] column_is_not_null:false;[R1] [C8] column_value_new:[12345                                                                                               ](100);[R1] [C8] column_value_old:[12.34                                                                                               ](100);$[R2] COMMIT;
update number_1 set c1=c6, c2=c6, c3=c6, c4=c6, c5=c6, c7=c6 where c0 = 26;
select c0, c6, c1, c2, c3, c4, c5, c7 from number_1 where c0 = 26;
C0	C6	C1	C2	C3	C4	C5	C7
26	123456	1.23456E+005	1.23456E+005	123456	123500	123456	123456                                                                                              
ob1.oblog.next;
[R0] BEGIN;[R0] org_cluster_id:1;[R1] record_type:UPDATE;[R1] database_name:oracle.OBLOG_DB;[R1] table_name:NUMBER_1;[R1] log_event:true;[R1] column_count:8;[R1] source_category:SRC_FULL_RECORDED;[R1] source_type:SRC_OCEANBASE_1_0;[R1] has_pk:true;[R1] pk_info:(0);[R1] pks:C0;[R1] has_uk:false;[R1] uk_info:(null);[R1] uks:(null);[R1] [C1] column_name:C0;[R1] [C1] column_type:MYSQL_TYPE_NEWDECIMAL;[R1] [C1] column_is_rowkey:true;[R1] [C1] column_is_signed:true;[R1] [C1] column_encoding:binary;[R1] [C1] column_is_not_null:true;[R1] [C1] column_value_new:[26](2);[R1] [C1] column_value_old:[26](2);[R1] [C2] column_name:C1;[R1] [C2] column_type:MYSQL_TYPE_DOUBLE;[R1] [C2] column_is_rowkey:false;[R1] [C2] column_is_signed:true;[R1] [C2] column_encoding:binary;[R1] [C2] column_is_not_null:false;[R1] [C2] column_value_new:[1.23456E+005](12);[R1] [C2] column_value_old:[1.234E+001](10);[R1] [C3] column_name:C2;[R1] [C3] column_type:MYSQL_TYPE_FLOAT;[R1] [C3] column_is_rowkey:false;[R1] [C3] column_is_signed:true;[R1] [C3] column_encoding:binary;[R1] [C3] column_is_not_null:false;[R1] [C3] column_value_new:[1.23456E+005](12);[R1] [C3] column_value_old:[1.23400002E+001](15);[R1] [C4] column_name:C3;[R1] [C4] column_type:MYSQL_TYPE_NEWDECIMAL;[R1] [C4] column_is_rowkey:false;[R1] [C4] column_is_signed:true;[R1] [C4] column_encoding:binary;[R1] [C4] column_is_not_null:false;[R1] [C4] column_value_new:[123456](6);[R1] [C4] column_value_old:[12.34](5);[R1] [C5] column_name:C4;[R1] [C5] column_type:MYSQL_TYPE_OB_NUMBER_FLOAT;[R1] [C5] column_is_rowkey:false;[R1] [C5] column_is_signed:true;[R1] [C5] column_encoding:binary;[R1] [C5] column_is_not_null:false;[R1] [C5] column_value_new:[123500](6);[R1] [C5] column_value_old:[12.34](5);[R1] [C6] column_name:C5;[R1] [C6] column_type:MYSQL_TYPE_OB_NUMBER_FLOAT;[R1] [C6] column_is_rowkey:false;[R1] [C6] column_is_signed:true;[R1] [C6] column_encoding:binary;[R1] [C6] column_is_not_null:false;[R1] [C6] column_value_new:[123456](6);[R1] [C6] column_value_old:[12.34](5);[R1] [C7] column_name:C6;[R1] [C7] column_type:MYSQL_TYPE_VAR_STRING;[R1] [C7] column_is_rowkey:false;[R1] [C7] column_is_signed:true;[R1] [C7] column_encoding:utf8mb4;[R1] [C7] column_is_not_null:false;[R1] [C7] column_value_new:[123456](6);[R1] [C7] column_value_old:[123456](6);[R1] [C8] column_name:C7;[R1] [C8] column_type:MYSQL_TYPE_STRING;[R1] [C8] column_is_rowkey:false;[R1] [C8] column_is_signed:true;[R1] [C8] column_encoding:utf8mb4;[R1] [C8] column_is_not_null:false;[R1] [C8] column_value_new:[123456                                                                                              ](100);[R1] [C8] column_value_old:[12.34                                                                                               ](100);$[R2] COMMIT;
update number_1 set c1=c6, c2=c6, c3=c6, c4=c6, c5=c6, c7=c6 where c0 = 27;
select c0, c6, c1, c2, c3, c4, c5, c7 from number_1 where c0 = 27;
C0	C6	C1	C2	C3	C4	C5	C7
27	1234567	1.234567E+006	1.234567E+006	1234567	1235000	1234567	1234567                                                                                             
ob1.oblog.next;
[R0] BEGIN;[R0] org_cluster_id:1;[R1] record_type:UPDATE;[R1] database_name:oracle.OBLOG_DB;[R1] table_name:NUMBER_1;[R1] log_event:true;[R1] column_count:8;[R1] source_category:SRC_FULL_RECORDED;[R1] source_type:SRC_OCEANBASE_1_0;[R1] has_pk:true;[R1] pk_info:(0);[R1] pks:C0;[R1] has_uk:false;[R1] uk_info:(null);[R1] uks:(null);[R1] [C1] column_name:C0;[R1] [C1] column_type:MYSQL_TYPE_NEWDECIMAL;[R1] [C1] column_is_rowkey:true;[R1] [C1] column_is_signed:true;[R1] [C1] column_encoding:binary;[R1] [C1] column_is_not_null:true;[R1] [C1] column_value_new:[27](2);[R1] [C1] column_value_old:[27](2);[R1] [C2] column_name:C1;[R1] [C2] column_type:MYSQL_TYPE_DOUBLE;[R1] [C2] column_is_rowkey:false;[R1] [C2] column_is_signed:true;[R1] [C2] column_encoding:binary;[R1] [C2] column_is_not_null:false;[R1] [C2] column_value_new:[1.234567E+006](13);[R1] [C2] column_value_old:[1.234E+001](10);[R1] [C3] column_name:C2;[R1] [C3] column_type:MYSQL_TYPE_FLOAT;[R1] [C3] column_is_rowkey:false;[R1] [C3] column_is_signed:true;[R1] [C3] column_encoding:binary;[R1] [C3] column_is_not_null:false;[R1] [C3] column_value_new:[1.234567E+006](13);[R1] [C3] column_value_old:[1.23400002E+001](15);[R1] [C4] column_name:C3;[R1] [C4] column_type:MYSQL_TYPE_NEWDECIMAL;[R1] [C4] column_is_rowkey:false;[R1] [C4] column_is_signed:true;[R1] [C4] column_encoding:binary;[R1] [C4] column_is_not_null:false;[R1] [C4] column_value_new:[1234567](7);[R1] [C4] column_value_old:[12.34](5);[R1] [C5] column_name:C4;[R1] [C5] column_type:MYSQL_TYPE_OB_NUMBER_FLOAT;[R1] [C5] column_is_rowkey:false;[R1] [C5] column_is_signed:true;[R1] [C5] column_encoding:binary;[R1] [C5] column_is_not_null:false;[R1] [C5] column_value_new:[1235000](7);[R1] [C5] column_value_old:[12.34](5);[R1] [C6] column_name:C5;[R1] [C6] column_type:MYSQL_TYPE_OB_NUMBER_FLOAT;[R1] [C6] column_is_rowkey:false;[R1] [C6] column_is_signed:true;[R1] [C6] column_encoding:binary;[R1] [C6] column_is_not_null:false;[R1] [C6] column_value_new:[1234567](7);[R1] [C6] column_value_old:[12.34](5);[R1] [C7] column_name:C6;[R1] [C7] column_type:MYSQL_TYPE_VAR_STRING;[R1] [C7] column_is_rowkey:false;[R1] [C7] column_is_signed:true;[R1] [C7] column_encoding:utf8mb4;[R1] [C7] column_is_not_null:false;[R1] [C7] column_value_new:[1234567](7);[R1] [C7] column_value_old:[1234567](7);[R1] [C8] column_name:C7;[R1] [C8] column_type:MYSQL_TYPE_STRING;[R1] [C8] column_is_rowkey:false;[R1] [C8] column_is_signed:true;[R1] [C8] column_encoding:utf8mb4;[R1] [C8] column_is_not_null:false;[R1] [C8] column_value_new:[1234567                                                                                             ](100);[R1] [C8] column_value_old:[12.34                                                                                               ](100);$[R2] COMMIT;
update number_1 set c1=c6, c2=c6, c3=c6, c4=c6, c5=c6, c7=c6 where c0 = 28;
select c0, c6, c1, c2, c3, c4, c5, c7 from number_1 where c0 = 28;
C0	C6	C1	C2	C3	C4	C5	C7
28	12345678	1.2345678E+007	1.2345678E+007	12345678	12350000	12345678	12345678                                                                                            
ob1.oblog.next;
[R0] BEGIN;[R0] org_cluster_id:1;[R1] record_type:UPDATE;[R1] database_name:oracle.OBLOG_DB;[R1] table_name:NUMBER_1;[R1] log_event:true;[R1] column_count:8;[R1] source_category:SRC_FULL_RECORDED;[R1] source_type:SRC_OCEANBASE_1_0;[R1] has_pk:true;[R1] pk_info:(0);[R1] pks:C0;[R1] has_uk:false;[R1] uk_info:(null);[R1] uks:(null);[R1] [C1] column_name:C0;[R1] [C1] column_type:MYSQL_TYPE_NEWDECIMAL;[R1] [C1] column_is_rowkey:true;[R1] [C1] column_is_signed:true;[R1] [C1] column_encoding:binary;[R1] [C1] column_is_not_null:true;[R1] [C1] column_value_new:[28](2);[R1] [C1] column_value_old:[28](2);[R1] [C2] column_name:C1;[R1] [C2] column_type:MYSQL_TYPE_DOUBLE;[R1] [C2] column_is_rowkey:false;[R1] [C2] column_is_signed:true;[R1] [C2] column_encoding:binary;[R1] [C2] column_is_not_null:false;[R1] [C2] column_value_new:[1.2345678E+007](14);[R1] [C2] column_value_old:[1.234E+001](10);[R1] [C3] column_name:C2;[R1] [C3] column_type:MYSQL_TYPE_FLOAT;[R1] [C3] column_is_rowkey:false;[R1] [C3] column_is_signed:true;[R1] [C3] column_encoding:binary;[R1] [C3] column_is_not_null:false;[R1] [C3] column_value_new:[1.2345678E+007](14);[R1] [C3] column_value_old:[1.23400002E+001](15);[R1] [C4] column_name:C3;[R1] [C4] column_type:MYSQL_TYPE_NEWDECIMAL;[R1] [C4] column_is_rowkey:false;[R1] [C4] column_is_signed:true;[R1] [C4] column_encoding:binary;[R1] [C4] column_is_not_null:false;[R1] [C4] column_value_new:[12345678](8);[R1] [C4] column_value_old:[12.34](5);[R1] [C5] column_name:C4;[R1] [C5] column_type:MYSQL_TYPE_OB_NUMBER_FLOAT;[R1] [C5] column_is_rowkey:false;[R1] [C5] column_is_signed:true;[R1] [C5] column_encoding:binary;[R1] [C5] column_is_not_null:false;[R1] [C5] column_value_new:[12350000](8);[R1] [C5] column_value_old:[12.34](5);[R1] [C6] column_name:C5;[R1] [C6] column_type:MYSQL_TYPE_OB_NUMBER_FLOAT;[R1] [C6] column_is_rowkey:false;[R1] [C6] column_is_signed:true;[R1] [C6] column_encoding:binary;[R1] [C6] column_is_not_null:false;[R1] [C6] column_value_new:[12345678](8);[R1] [C6] column_value_old:[12.34](5);[R1] [C7] column_name:C6;[R1] [C7] column_type:MYSQL_TYPE_VAR_STRING;[R1] [C7] column_is_rowkey:false;[R1] [C7] column_is_signed:true;[R1] [C7] column_encoding:utf8mb4;[R1] [C7] column_is_not_null:false;[R1] [C7] column_value_new:[12345678](8);[R1] [C7] column_value_old:[12345678](8);[R1] [C8] column_name:C7;[R1] [C8] column_type:MYSQL_TYPE_STRING;[R1] [C8] column_is_rowkey:false;[R1] [C8] column_is_signed:true;[R1] [C8] column_encoding:utf8mb4;[R1] [C8] column_is_not_null:false;[R1] [C8] column_value_new:[12345678                                                                                            ](100);[R1] [C8] column_value_old:[12.34                                                                                               ](100);$[R2] COMMIT;
update number_1 set c1=c6, c2=c6, c3=c6, c4=c6, c5=c6, c7=c6 where c0 = 29;
select c0, c6, c1, c2, c3, c4, c5, c7 from number_1 where c0 = 29;
C0	C6	C1	C2	C3	C4	C5	C7
29	123456789	1.23456789E+008	1.23456792E+008	123456789	123500000	123456789	123456789                                                                                           
ob1.oblog.next;
[R0] BEGIN;[R0] org_cluster_id:1;[R1] record_type:UPDATE;[R1] database_name:oracle.OBLOG_DB;[R1] table_name:NUMBER_1;[R1] log_event:true;[R1] column_count:8;[R1] source_category:SRC_FULL_RECORDED;[R1] source_type:SRC_OCEANBASE_1_0;[R1] has_pk:true;[R1] pk_info:(0);[R1] pks:C0;[R1] has_uk:false;[R1] uk_info:(null);[R1] uks:(null);[R1] [C1] column_name:C0;[R1] [C1] column_type:MYSQL_TYPE_NEWDECIMAL;[R1] [C1] column_is_rowkey:true;[R1] [C1] column_is_signed:true;[R1] [C1] column_encoding:binary;[R1] [C1] column_is_not_null:true;[R1] [C1] column_value_new:[29](2);[R1] [C1] column_value_old:[29](2);[R1] [C2] column_name:C1;[R1] [C2] column_type:MYSQL_TYPE_DOUBLE;[R1] [C2] column_is_rowkey:false;[R1] [C2] column_is_signed:true;[R1] [C2] column_encoding:binary;[R1] [C2] column_is_not_null:false;[R1] [C2] column_value_new:[1.23456789E+008](15);[R1] [C2] column_value_old:[1.234E+001](10);[R1] [C3] column_name:C2;[R1] [C3] column_type:MYSQL_TYPE_FLOAT;[R1] [C3] column_is_rowkey:false;[R1] [C3] column_is_signed:true;[R1] [C3] column_encoding:binary;[R1] [C3] column_is_not_null:false;[R1] [C3] column_value_new:[1.23456792E+008](15);[R1] [C3] column_value_old:[1.23400002E+001](15);[R1] [C4] column_name:C3;[R1] [C4] column_type:MYSQL_TYPE_NEWDECIMAL;[R1] [C4] column_is_rowkey:false;[R1] [C4] column_is_signed:true;[R1] [C4] column_encoding:binary;[R1] [C4] column_is_not_null:false;[R1] [C4] column_value_new:[123456789](9);[R1] [C4] column_value_old:[12.34](5);[R1] [C5] column_name:C4;[R1] [C5] column_type:MYSQL_TYPE_OB_NUMBER_FLOAT;[R1] [C5] column_is_rowkey:false;[R1] [C5] column_is_signed:true;[R1] [C5] column_encoding:binary;[R1] [C5] column_is_not_null:false;[R1] [C5] column_value_new:[123500000](9);[R1] [C5] column_value_old:[12.34](5);[R1] [C6] column_name:C5;[R1] [C6] column_type:MYSQL_TYPE_OB_NUMBER_FLOAT;[R1] [C6] column_is_rowkey:false;[R1] [C6] column_is_signed:true;[R1] [C6] column_encoding:binary;[R1] [C6] column_is_not_null:false;[R1] [C6] column_value_new:[123456789](9);[R1] [C6] column_value_old:[12.34](5);[R1] [C7] column_name:C6;[R1] [C7] column_type:MYSQL_TYPE_VAR_STRING;[R1] [C7] column_is_rowkey:false;[R1] [C7] column_is_signed:true;[R1] [C7] column_encoding:utf8mb4;[R1] [C7] column_is_not_null:false;[R1] [C7] column_value_new:[123456789](9);[R1] [C7] column_value_old:[123456789](9);[R1] [C8] column_name:C7;[R1] [C8] column_type:MYSQL_TYPE_STRING;[R1] [C8] column_is_rowkey:false;[R1] [C8] column_is_signed:true;[R1] [C8] column_encoding:utf8mb4;[R1] [C8] column_is_not_null:false;[R1] [C8] column_value_new:[123456789                                                                                           ](100);[R1] [C8] column_value_old:[12.34                                                                                               ](100);$[R2] COMMIT;
update number_1 set c1=c6, c2=c6, c3=c6, c4=c6, c5=c6, c7=c6 where c0 = 30;
select c0, c6, c1, c2, c3, c4, c5, c7 from number_1 where c0 = 30;
C0	C6	C1	C2	C3	C4	C5	C7
30	1234567890	1.23456789E+009	1.23456794E+009	1234567890	1235000000	1234567890	1234567890                                                                                          
ob1.oblog.next;
[R0] BEGIN;[R0] org_cluster_id:1;[R1] record_type:UPDATE;[R1] database_name:oracle.OBLOG_DB;[R1] table_name:NUMBER_1;[R1] log_event:true;[R1] column_count:8;[R1] source_category:SRC_FULL_RECORDED;[R1] source_type:SRC_OCEANBASE_1_0;[R1] has_pk:true;[R1] pk_info:(0);[R1] pks:C0;[R1] has_uk:false;[R1] uk_info:(null);[R1] uks:(null);[R1] [C1] column_name:C0;[R1] [C1] column_type:MYSQL_TYPE_NEWDECIMAL;[R1] [C1] column_is_rowkey:true;[R1] [C1] column_is_signed:true;[R1] [C1] column_encoding:binary;[R1] [C1] column_is_not_null:true;[R1] [C1] column_value_new:[30](2);[R1] [C1] column_value_old:[30](2);[R1] [C2] column_name:C1;[R1] [C2] column_type:MYSQL_TYPE_DOUBLE;[R1] [C2] column_is_rowkey:false;[R1] [C2] column_is_signed:true;[R1] [C2] column_encoding:binary;[R1] [C2] column_is_not_null:false;[R1] [C2] column_value_new:[1.23456789E+009](15);[R1] [C2] column_value_old:[1.234E+001](10);[R1] [C3] column_name:C2;[R1] [C3] column_type:MYSQL_TYPE_FLOAT;[R1] [C3] column_is_rowkey:false;[R1] [C3] column_is_signed:true;[R1] [C3] column_encoding:binary;[R1] [C3] column_is_not_null:false;[R1] [C3] column_value_new:[1.23456794E+009](15);[R1] [C3] column_value_old:[1.23400002E+001](15);[R1] [C4] column_name:C3;[R1] [C4] column_type:MYSQL_TYPE_NEWDECIMAL;[R1] [C4] column_is_rowkey:false;[R1] [C4] column_is_signed:true;[R1] [C4] column_encoding:binary;[R1] [C4] column_is_not_null:false;[R1] [C4] column_value_new:[1234567890](10);[R1] [C4] column_value_old:[12.34](5);[R1] [C5] column_name:C4;[R1] [C5] column_type:MYSQL_TYPE_OB_NUMBER_FLOAT;[R1] [C5] column_is_rowkey:false;[R1] [C5] column_is_signed:true;[R1] [C5] column_encoding:binary;[R1] [C5] column_is_not_null:false;[R1] [C5] column_value_new:[1235000000](10);[R1] [C5] column_value_old:[12.34](5);[R1] [C6] column_name:C5;[R1] [C6] column_type:MYSQL_TYPE_OB_NUMBER_FLOAT;[R1] [C6] column_is_rowkey:false;[R1] [C6] column_is_signed:true;[R1] [C6] column_encoding:binary;[R1] [C6] column_is_not_null:false;[R1] [C6] column_value_new:[1234567890](10);[R1] [C6] column_value_old:[12.34](5);[R1] [C7] column_name:C6;[R1] [C7] column_type:MYSQL_TYPE_VAR_STRING;[R1] [C7] column_is_rowkey:false;[R1] [C7] column_is_signed:true;[R1] [C7] column_encoding:utf8mb4;[R1] [C7] column_is_not_null:false;[R1] [C7] column_value_new:[1234567890](10);[R1] [C7] column_value_old:[1234567890](10);[R1] [C8] column_name:C7;[R1] [C8] column_type:MYSQL_TYPE_STRING;[R1] [C8] column_is_rowkey:false;[R1] [C8] column_is_signed:true;[R1] [C8] column_encoding:utf8mb4;[R1] [C8] column_is_not_null:false;[R1] [C8] column_value_new:[1234567890                                                                                          ](100);[R1] [C8] column_value_old:[12.34                                                                                               ](100);$[R2] COMMIT;
update number_1 set c1=c6, c2=c6, c3=c6, c4=c6, c5=c6, c7=c6 where c0 = 31;
select c0, c6, c1, c2, c3, c4, c5, c7 from number_1 where c0 = 31;
C0	C6	C1	C2	C3	C4	C5	C7
31	12345678901	1.2345678901E+010	1.23456788E+010	12345678901	12350000000	12345678901	12345678901                                                                                         
ob1.oblog.next;
[R0] BEGIN;[R0] org_cluster_id:1;[R1] record_type:UPDATE;[R1] database_name:oracle.OBLOG_DB;[R1] table_name:NUMBER_1;[R1] log_event:true;[R1] column_count:8;[R1] source_category:SRC_FULL_RECORDED;[R1] source_type:SRC_OCEANBASE_1_0;[R1] has_pk:true;[R1] pk_info:(0);[R1] pks:C0;[R1] has_uk:false;[R1] uk_info:(null);[R1] uks:(null);[R1] [C1] column_name:C0;[R1] [C1] column_type:MYSQL_TYPE_NEWDECIMAL;[R1] [C1] column_is_rowkey:true;[R1] [C1] column_is_signed:true;[R1] [C1] column_encoding:binary;[R1] [C1] column_is_not_null:true;[R1] [C1] column_value_new:[31](2);[R1] [C1] column_value_old:[31](2);[R1] [C2] column_name:C1;[R1] [C2] column_type:MYSQL_TYPE_DOUBLE;[R1] [C2] column_is_rowkey:false;[R1] [C2] column_is_signed:true;[R1] [C2] column_encoding:binary;[R1] [C2] column_is_not_null:false;[R1] [C2] column_value_new:[1.2345678901E+010](17);[R1] [C2] column_value_old:[1.234E+001](10);[R1] [C3] column_name:C2;[R1] [C3] column_type:MYSQL_TYPE_FLOAT;[R1] [C3] column_is_rowkey:false;[R1] [C3] column_is_signed:true;[R1] [C3] column_encoding:binary;[R1] [C3] column_is_not_null:false;[R1] [C3] column_value_new:[1.23456788E+010](15);[R1] [C3] column_value_old:[1.23400002E+001](15);[R1] [C4] column_name:C3;[R1] [C4] column_type:MYSQL_TYPE_NEWDECIMAL;[R1] [C4] column_is_rowkey:false;[R1] [C4] column_is_signed:true;[R1] [C4] column_encoding:binary;[R1] [C4] column_is_not_null:false;[R1] [C4] column_value_new:[12345678901](11);[R1] [C4] column_value_old:[12.34](5);[R1] [C5] column_name:C4;[R1] [C5] column_type:MYSQL_TYPE_OB_NUMBER_FLOAT;[R1] [C5] column_is_rowkey:false;[R1] [C5] column_is_signed:true;[R1] [C5] column_encoding:binary;[R1] [C5] column_is_not_null:false;[R1] [C5] column_value_new:[12350000000](11);[R1] [C5] column_value_old:[12.34](5);[R1] [C6] column_name:C5;[R1] [C6] column_type:MYSQL_TYPE_OB_NUMBER_FLOAT;[R1] [C6] column_is_rowkey:false;[R1] [C6] column_is_signed:true;[R1] [C6] column_encoding:binary;[R1] [C6] column_is_not_null:false;[R1] [C6] column_value_new:[12345678901](11);[R1] [C6] column_value_old:[12.34](5);[R1] [C7] column_name:C6;[R1] [C7] column_type:MYSQL_TYPE_VAR_STRING;[R1] [C7] column_is_rowkey:false;[R1] [C7] column_is_signed:true;[R1] [C7] column_encoding:utf8mb4;[R1] [C7] column_is_not_null:false;[R1] [C7] column_value_new:[12345678901](11);[R1] [C7] column_value_old:[12345678901](11);[R1] [C8] column_name:C7;[R1] [C8] column_type:MYSQL_TYPE_STRING;[R1] [C8] column_is_rowkey:false;[R1] [C8] column_is_signed:true;[R1] [C8] column_encoding:utf8mb4;[R1] [C8] column_is_not_null:false;[R1] [C8] column_value_new:[12345678901                                                                                         ](100);[R1] [C8] column_value_old:[12.34                                                                                               ](100);$[R2] COMMIT;
update number_1 set c1=c6, c2=c6, c3=c6, c4=c6, c5=c6, c7=c6 where c0 = 32;
select c0, c6, c1, c2, c3, c4, c5, c7 from number_1 where c0 = 32;
C0	C6	C1	C2	C3	C4	C5	C7
32	123456789012	1.23456789012E+011	1.23456791E+011	123456789012	123500000000	123456789012	123456789012                                                                                        
ob1.oblog.next;
[R0] BEGIN;[R0] org_cluster_id:1;[R1] record_type:UPDATE;[R1] database_name:oracle.OBLOG_DB;[R1] table_name:NUMBER_1;[R1] log_event:true;[R1] column_count:8;[R1] source_category:SRC_FULL_RECORDED;[R1] source_type:SRC_OCEANBASE_1_0;[R1] has_pk:true;[R1] pk_info:(0);[R1] pks:C0;[R1] has_uk:false;[R1] uk_info:(null);[R1] uks:(null);[R1] [C1] column_name:C0;[R1] [C1] column_type:MYSQL_TYPE_NEWDECIMAL;[R1] [C1] column_is_rowkey:true;[R1] [C1] column_is_signed:true;[R1] [C1] column_encoding:binary;[R1] [C1] column_is_not_null:true;[R1] [C1] column_value_new:[32](2);[R1] [C1] column_value_old:[32](2);[R1] [C2] column_name:C1;[R1] [C2] column_type:MYSQL_TYPE_DOUBLE;[R1] [C2] column_is_rowkey:false;[R1] [C2] column_is_signed:true;[R1] [C2] column_encoding:binary;[R1] [C2] column_is_not_null:false;[R1] [C2] column_value_new:[1.23456789012E+011](18);[R1] [C2] column_value_old:[1.234E+001](10);[R1] [C3] column_name:C2;[R1] [C3] column_type:MYSQL_TYPE_FLOAT;[R1] [C3] column_is_rowkey:false;[R1] [C3] column_is_signed:true;[R1] [C3] column_encoding:binary;[R1] [C3] column_is_not_null:false;[R1] [C3] column_value_new:[1.23456791E+011](15);[R1] [C3] column_value_old:[1.23400002E+001](15);[R1] [C4] column_name:C3;[R1] [C4] column_type:MYSQL_TYPE_NEWDECIMAL;[R1] [C4] column_is_rowkey:false;[R1] [C4] column_is_signed:true;[R1] [C4] column_encoding:binary;[R1] [C4] column_is_not_null:false;[R1] [C4] column_value_new:[123456789012](12);[R1] [C4] column_value_old:[12.34](5);[R1] [C5] column_name:C4;[R1] [C5] column_type:MYSQL_TYPE_OB_NUMBER_FLOAT;[R1] [C5] column_is_rowkey:false;[R1] [C5] column_is_signed:true;[R1] [C5] column_encoding:binary;[R1] [C5] column_is_not_null:false;[R1] [C5] column_value_new:[123500000000](12);[R1] [C5] column_value_old:[12.34](5);[R1] [C6] column_name:C5;[R1] [C6] column_type:MYSQL_TYPE_OB_NUMBER_FLOAT;[R1] [C6] column_is_rowkey:false;[R1] [C6] column_is_signed:true;[R1] [C6] column_encoding:binary;[R1] [C6] column_is_not_null:false;[R1] [C6] column_value_new:[123456789012](12);[R1] [C6] column_value_old:[12.34](5);[R1] [C7] column_name:C6;[R1] [C7] column_type:MYSQL_TYPE_VAR_STRING;[R1] [C7] column_is_rowkey:false;[R1] [C7] column_is_signed:true;[R1] [C7] column_encoding:utf8mb4;[R1] [C7] column_is_not_null:false;[R1] [C7] column_value_new:[123456789012](12);[R1] [C7] column_value_old:[123456789012](12);[R1] [C8] column_name:C7;[R1] [C8] column_type:MYSQL_TYPE_STRING;[R1] [C8] column_is_rowkey:false;[R1] [C8] column_is_signed:true;[R1] [C8] column_encoding:utf8mb4;[R1] [C8] column_is_not_null:false;[R1] [C8] column_value_new:[123456789012                                                                                        ](100);[R1] [C8] column_value_old:[12.34                                                                                               ](100);$[R2] COMMIT;
update number_1 set c1=c6, c2=c6, c3=c6, c4=c6, c5=c6, c7=c6 where c0 = 33;
select c0, c6, c1, c2, c3, c4, c5, c7 from number_1 where c0 = 33;
C0	C6	C1	C2	C3	C4	C5	C7
33	1234567890123	1.234567890123E+012	1.23456795E+012	1234567890123	1235000000000	1234567890123	1234567890123                                                                                       
ob1.oblog.next;
[R0] BEGIN;[R0] org_cluster_id:1;[R1] record_type:UPDATE;[R1] database_name:oracle.OBLOG_DB;[R1] table_name:NUMBER_1;[R1] log_event:true;[R1] column_count:8;[R1] source_category:SRC_FULL_RECORDED;[R1] source_type:SRC_OCEANBASE_1_0;[R1] has_pk:true;[R1] pk_info:(0);[R1] pks:C0;[R1] has_uk:false;[R1] uk_info:(null);[R1] uks:(null);[R1] [C1] column_name:C0;[R1] [C1] column_type:MYSQL_TYPE_NEWDECIMAL;[R1] [C1] column_is_rowkey:true;[R1] [C1] column_is_signed:true;[R1] [C1] column_encoding:binary;[R1] [C1] column_is_not_null:true;[R1] [C1] column_value_new:[33](2);[R1] [C1] column_value_old:[33](2);[R1] [C2] column_name:C1;[R1] [C2] column_type:MYSQL_TYPE_DOUBLE;[R1] [C2] column_is_rowkey:false;[R1] [C2] column_is_signed:true;[R1] [C2] column_encoding:binary;[R1] [C2] column_is_not_null:false;[R1] [C2] column_value_new:[1.234567890123E+012](19);[R1] [C2] column_value_old:[1.234E+001](10);[R1] [C3] column_name:C2;[R1] [C3] column_type:MYSQL_TYPE_FLOAT;[R1] [C3] column_is_rowkey:false;[R1] [C3] column_is_signed:true;[R1] [C3] column_encoding:binary;[R1] [C3] column_is_not_null:false;[R1] [C3] column_value_new:[1.23456795E+012](15);[R1] [C3] column_value_old:[1.23400002E+001](15);[R1] [C4] column_name:C3;[R1] [C4] column_type:MYSQL_TYPE_NEWDECIMAL;[R1] [C4] column_is_rowkey:false;[R1] [C4] column_is_signed:true;[R1] [C4] column_encoding:binary;[R1] [C4] column_is_not_null:false;[R1] [C4] column_value_new:[1234567890123](13);[R1] [C4] column_value_old:[12.34](5);[R1] [C5] column_name:C4;[R1] [C5] column_type:MYSQL_TYPE_OB_NUMBER_FLOAT;[R1] [C5] column_is_rowkey:false;[R1] [C5] column_is_signed:true;[R1] [C5] column_encoding:binary;[R1] [C5] column_is_not_null:false;[R1] [C5] column_value_new:[1235000000000](13);[R1] [C5] column_value_old:[12.34](5);[R1] [C6] column_name:C5;[R1] [C6] column_type:MYSQL_TYPE_OB_NUMBER_FLOAT;[R1] [C6] column_is_rowkey:false;[R1] [C6] column_is_signed:true;[R1] [C6] column_encoding:binary;[R1] [C6] column_is_not_null:false;[R1] [C6] column_value_new:[1234567890123](13);[R1] [C6] column_value_old:[12.34](5);[R1] [C7] column_name:C6;[R1] [C7] column_type:MYSQL_TYPE_VAR_STRING;[R1] [C7] column_is_rowkey:false;[R1] [C7] column_is_signed:true;[R1] [C7] column_encoding:utf8mb4;[R1] [C7] column_is_not_null:false;[R1] [C7] column_value_new:[1234567890123](13);[R1] [C7] column_value_old:[1234567890123](13);[R1] [C8] column_name:C7;[R1] [C8] column_type:MYSQL_TYPE_STRING;[R1] [C8] column_is_rowkey:false;[R1] [C8] column_is_signed:true;[R1] [C8] column_encoding:utf8mb4;[R1] [C8] column_is_not_null:false;[R1] [C8] column_value_new:[1234567890123                                                                                       ](100);[R1] [C8] column_value_old:[12.34                                                                                               ](100);$[R2] COMMIT;
update number_1 set c1=c6, c2=c6, c3=c6, c4=c6, c5=c6, c7=c6 where c0 = 34;
select c0, c6, c1, c2, c3, c4, c5, c7 from number_1 where c0 = 34;
C0	C6	C1	C2	C3	C4	C5	C7
34	12345678901234	1.2345678901234E+013	1.2345679E+013	12345678901234	12350000000000	12345678901234	12345678901234                                                                                      
ob1.oblog.next;
[R0] BEGIN;[R0] org_cluster_id:1;[R1] record_type:UPDATE;[R1] database_name:oracle.OBLOG_DB;[R1] table_name:NUMBER_1;[R1] log_event:true;[R1] column_count:8;[R1] source_category:SRC_FULL_RECORDED;[R1] source_type:SRC_OCEANBASE_1_0;[R1] has_pk:true;[R1] pk_info:(0);[R1] pks:C0;[R1] has_uk:false;[R1] uk_info:(null);[R1] uks:(null);[R1] [C1] column_name:C0;[R1] [C1] column_type:MYSQL_TYPE_NEWDECIMAL;[R1] [C1] column_is_rowkey:true;[R1] [C1] column_is_signed:true;[R1] [C1] column_encoding:binary;[R1] [C1] column_is_not_null:true;[R1] [C1] column_value_new:[34](2);[R1] [C1] column_value_old:[34](2);[R1] [C2] column_name:C1;[R1] [C2] column_type:MYSQL_TYPE_DOUBLE;[R1] [C2] column_is_rowkey:false;[R1] [C2] column_is_signed:true;[R1] [C2] column_encoding:binary;[R1] [C2] column_is_not_null:false;[R1] [C2] column_value_new:[1.2345678901234E+013](20);[R1] [C2] column_value_old:[1.234E+001](10);[R1] [C3] column_name:C2;[R1] [C3] column_type:MYSQL_TYPE_FLOAT;[R1] [C3] column_is_rowkey:false;[R1] [C3] column_is_signed:true;[R1] [C3] column_encoding:binary;[R1] [C3] column_is_not_null:false;[R1] [C3] column_value_new:[1.2345679E+013](14);[R1] [C3] column_value_old:[1.23400002E+001](15);[R1] [C4] column_name:C3;[R1] [C4] column_type:MYSQL_TYPE_NEWDECIMAL;[R1] [C4] column_is_rowkey:false;[R1] [C4] column_is_signed:true;[R1] [C4] column_encoding:binary;[R1] [C4] column_is_not_null:false;[R1] [C4] column_value_new:[12345678901234](14);[R1] [C4] column_value_old:[12.34](5);[R1] [C5] column_name:C4;[R1] [C5] column_type:MYSQL_TYPE_OB_NUMBER_FLOAT;[R1] [C5] column_is_rowkey:false;[R1] [C5] column_is_signed:true;[R1] [C5] column_encoding:binary;[R1] [C5] column_is_not_null:false;[R1] [C5] column_value_new:[12350000000000](14);[R1] [C5] column_value_old:[12.34](5);[R1] [C6] column_name:C5;[R1] [C6] column_type:MYSQL_TYPE_OB_NUMBER_FLOAT;[R1] [C6] column_is_rowkey:false;[R1] [C6] column_is_signed:true;[R1] [C6] column_encoding:binary;[R1] [C6] column_is_not_null:false;[R1] [C6] column_value_new:[12345678901234](14);[R1] [C6] column_value_old:[12.34](5);[R1] [C7] column_name:C6;[R1] [C7] column_type:MYSQL_TYPE_VAR_STRING;[R1] [C7] column_is_rowkey:false;[R1] [C7] column_is_signed:true;[R1] [C7] column_encoding:utf8mb4;[R1] [C7] column_is_not_null:false;[R1] [C7] column_value_new:[12345678901234](14);[R1] [C7] column_value_old:[12345678901234](14);[R1] [C8] column_name:C7;[R1] [C8] column_type:MYSQL_TYPE_STRING;[R1] [C8] column_is_rowkey:false;[R1] [C8] column_is_signed:true;[R1] [C8] column_encoding:utf8mb4;[R1] [C8] column_is_not_null:false;[R1] [C8] column_value_new:[12345678901234                                                                                      ](100);[R1] [C8] column_value_old:[12.34                                                                                               ](100);$[R2] COMMIT;
update number_1 set c1=c6, c2=c6, c3=c6, c4=c6, c5=c6, c7=c6 where c0 = 35;
select c0, c6, c1, c2, c3, c4, c5, c7 from number_1 where c0 = 35;
C0	C6	C1	C2	C3	C4	C5	C7
35	123456789012345	1.23456789012345E+014	1.23456788E+014	123456789012345	123500000000000	123456789012345	123456789012345                                                                                     
ob1.oblog.next;
[R0] BEGIN;[R0] org_cluster_id:1;[R1] record_type:UPDATE;[R1] database_name:oracle.OBLOG_DB;[R1] table_name:NUMBER_1;[R1] log_event:true;[R1] column_count:8;[R1] source_category:SRC_FULL_RECORDED;[R1] source_type:SRC_OCEANBASE_1_0;[R1] has_pk:true;[R1] pk_info:(0);[R1] pks:C0;[R1] has_uk:false;[R1] uk_info:(null);[R1] uks:(null);[R1] [C1] column_name:C0;[R1] [C1] column_type:MYSQL_TYPE_NEWDECIMAL;[R1] [C1] column_is_rowkey:true;[R1] [C1] column_is_signed:true;[R1] [C1] column_encoding:binary;[R1] [C1] column_is_not_null:true;[R1] [C1] column_value_new:[35](2);[R1] [C1] column_value_old:[35](2);[R1] [C2] column_name:C1;[R1] [C2] column_type:MYSQL_TYPE_DOUBLE;[R1] [C2] column_is_rowkey:false;[R1] [C2] column_is_signed:true;[R1] [C2] column_encoding:binary;[R1] [C2] column_is_not_null:false;[R1] [C2] column_value_new:[1.23456789012345E+014](21);[R1] [C2] column_value_old:[1.234E+001](10);[R1] [C3] column_name:C2;[R1] [C3] column_type:MYSQL_TYPE_FLOAT;[R1] [C3] column_is_rowkey:false;[R1] [C3] column_is_signed:true;[R1] [C3] column_encoding:binary;[R1] [C3] column_is_not_null:false;[R1] [C3] column_value_new:[1.23456788E+014](15);[R1] [C3] column_value_old:[1.23400002E+001](15);[R1] [C4] column_name:C3;[R1] [C4] column_type:MYSQL_TYPE_NEWDECIMAL;[R1] [C4] column_is_rowkey:false;[R1] [C4] column_is_signed:true;[R1] [C4] column_encoding:binary;[R1] [C4] column_is_not_null:false;[R1] [C4] column_value_new:[123456789012345](15);[R1] [C4] column_value_old:[12.34](5);[R1] [C5] column_name:C4;[R1] [C5] column_type:MYSQL_TYPE_OB_NUMBER_FLOAT;[R1] [C5] column_is_rowkey:false;[R1] [C5] column_is_signed:true;[R1] [C5] column_encoding:binary;[R1] [C5] column_is_not_null:false;[R1] [C5] column_value_new:[123500000000000](15);[R1] [C5] column_value_old:[12.34](5);[R1] [C6] column_name:C5;[R1] [C6] column_type:MYSQL_TYPE_OB_NUMBER_FLOAT;[R1] [C6] column_is_rowkey:false;[R1] [C6] column_is_signed:true;[R1] [C6] column_encoding:binary;[R1] [C6] column_is_not_null:false;[R1] [C6] column_value_new:[123456789012345](15);[R1] [C6] column_value_old:[12.34](5);[R1] [C7] column_name:C6;[R1] [C7] column_type:MYSQL_TYPE_VAR_STRING;[R1] [C7] column_is_rowkey:false;[R1] [C7] column_is_signed:true;[R1] [C7] column_encoding:utf8mb4;[R1] [C7] column_is_not_null:false;[R1] [C7] column_value_new:[123456789012345](15);[R1] [C7] column_value_old:[123456789012345](15);[R1] [C8] column_name:C7;[R1] [C8] column_type:MYSQL_TYPE_STRING;[R1] [C8] column_is_rowkey:false;[R1] [C8] column_is_signed:true;[R1] [C8] column_encoding:utf8mb4;[R1] [C8] column_is_not_null:false;[R1] [C8] column_value_new:[123456789012345                                                                                     ](100);[R1] [C8] column_value_old:[12.34                                                                                               ](100);$[R2] COMMIT;
update number_1 set c1=c6, c2=c6, c3=c6, c4=c6, c5=c6, c7=c6 where c0 = 36;
select c0, c6, c1, c2, c3, c4, c5, c7 from number_1 where c0 = 36;
C0	C6	C1	C2	C3	C4	C5	C7
36	1234567890123456	1.234567890123456E+015	1.23456795E+015	1234567890123456	1235000000000000	1234567890123456	1234567890123456                                                                                    
ob1.oblog.next;
[R0] BEGIN;[R0] org_cluster_id:1;[R1] record_type:UPDATE;[R1] database_name:oracle.OBLOG_DB;[R1] table_name:NUMBER_1;[R1] log_event:true;[R1] column_count:8;[R1] source_category:SRC_FULL_RECORDED;[R1] source_type:SRC_OCEANBASE_1_0;[R1] has_pk:true;[R1] pk_info:(0);[R1] pks:C0;[R1] has_uk:false;[R1] uk_info:(null);[R1] uks:(null);[R1] [C1] column_name:C0;[R1] [C1] column_type:MYSQL_TYPE_NEWDECIMAL;[R1] [C1] column_is_rowkey:true;[R1] [C1] column_is_signed:true;[R1] [C1] column_encoding:binary;[R1] [C1] column_is_not_null:true;[R1] [C1] column_value_new:[36](2);[R1] [C1] column_value_old:[36](2);[R1] [C2] column_name:C1;[R1] [C2] column_type:MYSQL_TYPE_DOUBLE;[R1] [C2] column_is_rowkey:false;[R1] [C2] column_is_signed:true;[R1] [C2] column_encoding:binary;[R1] [C2] column_is_not_null:false;[R1] [C2] column_value_new:[1.234567890123456E+015](22);[R1] [C2] column_value_old:[1.234E+001](10);[R1] [C3] column_name:C2;[R1] [C3] column_type:MYSQL_TYPE_FLOAT;[R1] [C3] column_is_rowkey:false;[R1] [C3] column_is_signed:true;[R1] [C3] column_encoding:binary;[R1] [C3] column_is_not_null:false;[R1] [C3] column_value_new:[1.23456795E+015](15);[R1] [C3] column_value_old:[1.23400002E+001](15);[R1] [C4] column_name:C3;[R1] [C4] column_type:MYSQL_TYPE_NEWDECIMAL;[R1] [C4] column_is_rowkey:false;[R1] [C4] column_is_signed:true;[R1] [C4] column_encoding:binary;[R1] [C4] column_is_not_null:false;[R1] [C4] column_value_new:[1234567890123456](16);[R1] [C4] column_value_old:[12.34](5);[R1] [C5] column_name:C4;[R1] [C5] column_type:MYSQL_TYPE_OB_NUMBER_FLOAT;[R1] [C5] column_is_rowkey:false;[R1] [C5] column_is_signed:true;[R1] [C5] column_encoding:binary;[R1] [C5] column_is_not_null:false;[R1] [C5] column_value_new:[1235000000000000](16);[R1] [C5] column_value_old:[12.34](5);[R1] [C6] column_name:C5;[R1] [C6] column_type:MYSQL_TYPE_OB_NUMBER_FLOAT;[R1] [C6] column_is_rowkey:false;[R1] [C6] column_is_signed:true;[R1] [C6] column_encoding:binary;[R1] [C6] column_is_not_null:false;[R1] [C6] column_value_new:[1234567890123456](16);[R1] [C6] column_value_old:[12.34](5);[R1] [C7] column_name:C6;[R1] [C7] column_type:MYSQL_TYPE_VAR_STRING;[R1] [C7] column_is_rowkey:false;[R1] [C7] column_is_signed:true;[R1] [C7] column_encoding:utf8mb4;[R1] [C7] column_is_not_null:false;[R1] [C7] column_value_new:[1234567890123456](16);[R1] [C7] column_value_old:[1234567890123456](16);[R1] [C8] column_name:C7;[R1] [C8] column_type:MYSQL_TYPE_STRING;[R1] [C8] column_is_rowkey:false;[R1] [C8] column_is_signed:true;[R1] [C8] column_encoding:utf8mb4;[R1] [C8] column_is_not_null:false;[R1] [C8] column_value_new:[1234567890123456                                                                                    ](100);[R1] [C8] column_value_old:[12.34                                                                                               ](100);$[R2] COMMIT;
update number_1 set c1=c6, c2=c6, c3=c6, c4=c6, c5=c6, c7=c6 where c0 = 37;
select c0, c6, c1, c2, c3, c4, c5, c7 from number_1 where c0 = 37;
C0	C6	C1	C2	C3	C4	C5	C7
37	12345678901234567	1.2345678901234568E+016	1.23456784E+016	12345678901234567	12350000000000000	12345678901234567	12345678901234567                                                                                   
ob1.oblog.next;
[R0] BEGIN;[R0] org_cluster_id:1;[R1] record_type:UPDATE;[R1] database_name:oracle.OBLOG_DB;[R1] table_name:NUMBER_1;[R1] log_event:true;[R1] column_count:8;[R1] source_category:SRC_FULL_RECORDED;[R1] source_type:SRC_OCEANBASE_1_0;[R1] has_pk:true;[R1] pk_info:(0);[R1] pks:C0;[R1] has_uk:false;[R1] uk_info:(null);[R1] uks:(null);[R1] [C1] column_name:C0;[R1] [C1] column_type:MYSQL_TYPE_NEWDECIMAL;[R1] [C1] column_is_rowkey:true;[R1] [C1] column_is_signed:true;[R1] [C1] column_encoding:binary;[R1] [C1] column_is_not_null:true;[R1] [C1] column_value_new:[37](2);[R1] [C1] column_value_old:[37](2);[R1] [C2] column_name:C1;[R1] [C2] column_type:MYSQL_TYPE_DOUBLE;[R1] [C2] column_is_rowkey:false;[R1] [C2] column_is_signed:true;[R1] [C2] column_encoding:binary;[R1] [C2] column_is_not_null:false;[R1] [C2] column_value_new:[1.2345678901234568E+016](23);[R1] [C2] column_value_old:[1.234E+001](10);[R1] [C3] column_name:C2;[R1] [C3] column_type:MYSQL_TYPE_FLOAT;[R1] [C3] column_is_rowkey:false;[R1] [C3] column_is_signed:true;[R1] [C3] column_encoding:binary;[R1] [C3] column_is_not_null:false;[R1] [C3] column_value_new:[1.23456784E+016](15);[R1] [C3] column_value_old:[1.23400002E+001](15);[R1] [C4] column_name:C3;[R1] [C4] column_type:MYSQL_TYPE_NEWDECIMAL;[R1] [C4] column_is_rowkey:false;[R1] [C4] column_is_signed:true;[R1] [C4] column_encoding:binary;[R1] [C4] column_is_not_null:false;[R1] [C4] column_value_new:[12345678901234567](17);[R1] [C4] column_value_old:[12.34](5);[R1] [C5] column_name:C4;[R1] [C5] column_type:MYSQL_TYPE_OB_NUMBER_FLOAT;[R1] [C5] column_is_rowkey:false;[R1] [C5] column_is_signed:true;[R1] [C5] column_encoding:binary;[R1] [C5] column_is_not_null:false;[R1] [C5] column_value_new:[12350000000000000](17);[R1] [C5] column_value_old:[12.34](5);[R1] [C6] column_name:C5;[R1] [C6] column_type:MYSQL_TYPE_OB_NUMBER_FLOAT;[R1] [C6] column_is_rowkey:false;[R1] [C6] column_is_signed:true;[R1] [C6] column_encoding:binary;[R1] [C6] column_is_not_null:false;[R1] [C6] column_value_new:[12345678901234567](17);[R1] [C6] column_value_old:[12.34](5);[R1] [C7] column_name:C6;[R1] [C7] column_type:MYSQL_TYPE_VAR_STRING;[R1] [C7] column_is_rowkey:false;[R1] [C7] column_is_signed:true;[R1] [C7] column_encoding:utf8mb4;[R1] [C7] column_is_not_null:false;[R1] [C7] column_value_new:[12345678901234567](17);[R1] [C7] column_value_old:[12345678901234567](17);[R1] [C8] column_name:C7;[R1] [C8] column_type:MYSQL_TYPE_STRING;[R1] [C8] column_is_rowkey:false;[R1] [C8] column_is_signed:true;[R1] [C8] column_encoding:utf8mb4;[R1] [C8] column_is_not_null:false;[R1] [C8] column_value_new:[12345678901234567                                                                                   ](100);[R1] [C8] column_value_old:[12.34                                                                                               ](100);$[R2] COMMIT;
update number_1 set c1=c6, c2=c6, c3=c6, c4=c6, c5=c6, c7=c6 where c0 = 38;
select c0, c6, c1, c2, c3, c4, c5, c7 from number_1 where c0 = 38;
C0	C6	C1	C2	C3	C4	C5	C7
38	123456789012345678	1.2345678901234568E+017	1.23456791E+017	123456789012345678	123500000000000000	123456789012345678	123456789012345678                                                                                  
ob1.oblog.next;
[R0] BEGIN;[R0] org_cluster_id:1;[R1] record_type:UPDATE;[R1] database_name:oracle.OBLOG_DB;[R1] table_name:NUMBER_1;[R1] log_event:true;[R1] column_count:8;[R1] source_category:SRC_FULL_RECORDED;[R1] source_type:SRC_OCEANBASE_1_0;[R1] has_pk:true;[R1] pk_info:(0);[R1] pks:C0;[R1] has_uk:false;[R1] uk_info:(null);[R1] uks:(null);[R1] [C1] column_name:C0;[R1] [C1] column_type:MYSQL_TYPE_NEWDECIMAL;[R1] [C1] column_is_rowkey:true;[R1] [C1] column_is_signed:true;[R1] [C1] column_encoding:binary;[R1] [C1] column_is_not_null:true;[R1] [C1] column_value_new:[38](2);[R1] [C1] column_value_old:[38](2);[R1] [C2] column_name:C1;[R1] [C2] column_type:MYSQL_TYPE_DOUBLE;[R1] [C2] column_is_rowkey:false;[R1] [C2] column_is_signed:true;[R1] [C2] column_encoding:binary;[R1] [C2] column_is_not_null:false;[R1] [C2] column_value_new:[1.2345678901234568E+017](23);[R1] [C2] column_value_old:[1.234E+001](10);[R1] [C3] column_name:C2;[R1] [C3] column_type:MYSQL_TYPE_FLOAT;[R1] [C3] column_is_rowkey:false;[R1] [C3] column_is_signed:true;[R1] [C3] column_encoding:binary;[R1] [C3] column_is_not_null:false;[R1] [C3] column_value_new:[1.23456791E+017](15);[R1] [C3] column_value_old:[1.23400002E+001](15);[R1] [C4] column_name:C3;[R1] [C4] column_type:MYSQL_TYPE_NEWDECIMAL;[R1] [C4] column_is_rowkey:false;[R1] [C4] column_is_signed:true;[R1] [C4] column_encoding:binary;[R1] [C4] column_is_not_null:false;[R1] [C4] column_value_new:[123456789012345678](18);[R1] [C4] column_value_old:[12.34](5);[R1] [C5] column_name:C4;[R1] [C5] column_type:MYSQL_TYPE_OB_NUMBER_FLOAT;[R1] [C5] column_is_rowkey:false;[R1] [C5] column_is_signed:true;[R1] [C5] column_encoding:binary;[R1] [C5] column_is_not_null:false;[R1] [C5] column_value_new:[123500000000000000](18);[R1] [C5] column_value_old:[12.34](5);[R1] [C6] column_name:C5;[R1] [C6] column_type:MYSQL_TYPE_OB_NUMBER_FLOAT;[R1] [C6] column_is_rowkey:false;[R1] [C6] column_is_signed:true;[R1] [C6] column_encoding:binary;[R1] [C6] column_is_not_null:false;[R1] [C6] column_value_new:[123456789012345678](18);[R1] [C6] column_value_old:[12.34](5);[R1] [C7] column_name:C6;[R1] [C7] column_type:MYSQL_TYPE_VAR_STRING;[R1] [C7] column_is_rowkey:false;[R1] [C7] column_is_signed:true;[R1] [C7] column_encoding:utf8mb4;[R1] [C7] column_is_not_null:false;[R1] [C7] column_value_new:[123456789012345678](18);[R1] [C7] column_value_old:[123456789012345678](18);[R1] [C8] column_name:C7;[R1] [C8] column_type:MYSQL_TYPE_STRING;[R1] [C8] column_is_rowkey:false;[R1] [C8] column_is_signed:true;[R1] [C8] column_encoding:utf8mb4;[R1] [C8] column_is_not_null:false;[R1] [C8] column_value_new:[123456789012345678                                                                                  ](100);[R1] [C8] column_value_old:[12.34                                                                                               ](100);$[R2] COMMIT;
update number_1 set c1=c6, c2=c6, c3=c6, c4=c6, c5=c6, c7=c6 where c0 = 39;
select c0, c6, c1, c2, c3, c4, c5, c7 from number_1 where c0 = 39;
C0	C6	C1	C2	C3	C4	C5	C7
39	1234567890123456789	1.2345678901234568E+018	1.23456794E+018	1234567890123456789	1235000000000000000	1234567890123456789	1234567890123456789                                                                                 
ob1.oblog.next;
[R0] BEGIN;[R0] org_cluster_id:1;[R1] record_type:UPDATE;[R1] database_name:oracle.OBLOG_DB;[R1] table_name:NUMBER_1;[R1] log_event:true;[R1] column_count:8;[R1] source_category:SRC_FULL_RECORDED;[R1] source_type:SRC_OCEANBASE_1_0;[R1] has_pk:true;[R1] pk_info:(0);[R1] pks:C0;[R1] has_uk:false;[R1] uk_info:(null);[R1] uks:(null);[R1] [C1] column_name:C0;[R1] [C1] column_type:MYSQL_TYPE_NEWDECIMAL;[R1] [C1] column_is_rowkey:true;[R1] [C1] column_is_signed:true;[R1] [C1] column_encoding:binary;[R1] [C1] column_is_not_null:true;[R1] [C1] column_value_new:[39](2);[R1] [C1] column_value_old:[39](2);[R1] [C2] column_name:C1;[R1] [C2] column_type:MYSQL_TYPE_DOUBLE;[R1] [C2] column_is_rowkey:false;[R1] [C2] column_is_signed:true;[R1] [C2] column_encoding:binary;[R1] [C2] column_is_not_null:false;[R1] [C2] column_value_new:[1.2345678901234568E+018](23);[R1] [C2] column_value_old:[1.234E+001](10);[R1] [C3] column_name:C2;[R1] [C3] column_type:MYSQL_TYPE_FLOAT;[R1] [C3] column_is_rowkey:false;[R1] [C3] column_is_signed:true;[R1] [C3] column_encoding:binary;[R1] [C3] column_is_not_null:false;[R1] [C3] column_value_new:[1.23456794E+018](15);[R1] [C3] column_value_old:[1.23400002E+001](15);[R1] [C4] column_name:C3;[R1] [C4] column_type:MYSQL_TYPE_NEWDECIMAL;[R1] [C4] column_is_rowkey:false;[R1] [C4] column_is_signed:true;[R1] [C4] column_encoding:binary;[R1] [C4] column_is_not_null:false;[R1] [C4] column_value_new:[1234567890123456789](19);[R1] [C4] column_value_old:[12.34](5);[R1] [C5] column_name:C4;[R1] [C5] column_type:MYSQL_TYPE_OB_NUMBER_FLOAT;[R1] [C5] column_is_rowkey:false;[R1] [C5] column_is_signed:true;[R1] [C5] column_encoding:binary;[R1] [C5] column_is_not_null:false;[R1] [C5] column_value_new:[1235000000000000000](19);[R1] [C5] column_value_old:[12.34](5);[R1] [C6] column_name:C5;[R1] [C6] column_type:MYSQL_TYPE_OB_NUMBER_FLOAT;[R1] [C6] column_is_rowkey:false;[R1] [C6] column_is_signed:true;[R1] [C6] column_encoding:binary;[R1] [C6] column_is_not_null:false;[R1] [C6] column_value_new:[1234567890123456789](19);[R1] [C6] column_value_old:[12.34](5);[R1] [C7] column_name:C6;[R1] [C7] column_type:MYSQL_TYPE_VAR_STRING;[R1] [C7] column_is_rowkey:false;[R1] [C7] column_is_signed:true;[R1] [C7] column_encoding:utf8mb4;[R1] [C7] column_is_not_null:false;[R1] [C7] column_value_new:[1234567890123456789](19);[R1] [C7] column_value_old:[1234567890123456789](19);[R1] [C8] column_name:C7;[R1] [C8] column_type:MYSQL_TYPE_STRING;[R1] [C8] column_is_rowkey:false;[R1] [C8] column_is_signed:true;[R1] [C8] column_encoding:utf8mb4;[R1] [C8] column_is_not_null:false;[R1] [C8] column_value_new:[1234567890123456789                                                                                 ](100);[R1] [C8] column_value_old:[12.34                                                                                               ](100);$[R2] COMMIT;
update number_1 set c1=c6, c2=c6, c3=c6, c4=c6, c5=c6, c7=c6 where c0 = 40;
select c0, c6, c1, c2, c3, c4, c5, c7 from number_1 where c0 = 40;
C0	C6	C1	C2	C3	C4	C5	C7
40	12345678901234567890	1.2345678901234567E+019	1.23456794E+019	12345678901234567890	12350000000000000000	12345678901234567890	12345678901234567890                                                                                
ob1.oblog.next;
[R0] BEGIN;[R0] org_cluster_id:1;[R1] record_type:UPDATE;[R1] database_name:oracle.OBLOG_DB;[R1] table_name:NUMBER_1;[R1] log_event:true;[R1] column_count:8;[R1] source_category:SRC_FULL_RECORDED;[R1] source_type:SRC_OCEANBASE_1_0;[R1] has_pk:true;[R1] pk_info:(0);[R1] pks:C0;[R1] has_uk:false;[R1] uk_info:(null);[R1] uks:(null);[R1] [C1] column_name:C0;[R1] [C1] column_type:MYSQL_TYPE_NEWDECIMAL;[R1] [C1] column_is_rowkey:true;[R1] [C1] column_is_signed:true;[R1] [C1] column_encoding:binary;[R1] [C1] column_is_not_null:true;[R1] [C1] column_value_new:[40](2);[R1] [C1] column_value_old:[40](2);[R1] [C2] column_name:C1;[R1] [C2] column_type:MYSQL_TYPE_DOUBLE;[R1] [C2] column_is_rowkey:false;[R1] [C2] column_is_signed:true;[R1] [C2] column_encoding:binary;[R1] [C2] column_is_not_null:false;[R1] [C2] column_value_new:[1.2345678901234567E+019](23);[R1] [C2] column_value_old:[1.234E+001](10);[R1] [C3] column_name:C2;[R1] [C3] column_type:MYSQL_TYPE_FLOAT;[R1] [C3] column_is_rowkey:false;[R1] [C3] column_is_signed:true;[R1] [C3] column_encoding:binary;[R1] [C3] column_is_not_null:false;[R1] [C3] column_value_new:[1.23456794E+019](15);[R1] [C3] column_value_old:[1.23400002E+001](15);[R1] [C4] column_name:C3;[R1] [C4] column_type:MYSQL_TYPE_NEWDECIMAL;[R1] [C4] column_is_rowkey:false;[R1] [C4] column_is_signed:true;[R1] [C4] column_encoding:binary;[R1] [C4] column_is_not_null:false;[R1] [C4] column_value_new:[12345678901234567890](20);[R1] [C4] column_value_old:[12.34](5);[R1] [C5] column_name:C4;[R1] [C5] column_type:MYSQL_TYPE_OB_NUMBER_FLOAT;[R1] [C5] column_is_rowkey:false;[R1] [C5] column_is_signed:true;[R1] [C5] column_encoding:binary;[R1] [C5] column_is_not_null:false;[R1] [C5] column_value_new:[12350000000000000000](20);[R1] [C5] column_value_old:[12.34](5);[R1] [C6] column_name:C5;[R1] [C6] column_type:MYSQL_TYPE_OB_NUMBER_FLOAT;[R1] [C6] column_is_rowkey:false;[R1] [C6] column_is_signed:true;[R1] [C6] column_encoding:binary;[R1] [C6] column_is_not_null:false;[R1] [C6] column_value_new:[12345678901234567890](20);[R1] [C6] column_value_old:[12.34](5);[R1] [C7] column_name:C6;[R1] [C7] column_type:MYSQL_TYPE_VAR_STRING;[R1] [C7] column_is_rowkey:false;[R1] [C7] column_is_signed:true;[R1] [C7] column_encoding:utf8mb4;[R1] [C7] column_is_not_null:false;[R1] [C7] column_value_new:[12345678901234567890](20);[R1] [C7] column_value_old:[12345678901234567890](20);[R1] [C8] column_name:C7;[R1] [C8] column_type:MYSQL_TYPE_STRING;[R1] [C8] column_is_rowkey:false;[R1] [C8] column_is_signed:true;[R1] [C8] column_encoding:utf8mb4;[R1] [C8] column_is_not_null:false;[R1] [C8] column_value_new:[12345678901234567890                                                                                ](100);[R1] [C8] column_value_old:[12.34                                                                                               ](100);$[R2] COMMIT;
update number_1 set c1=c6, c2=c6, c3=c6, c4=c6, c5=c6, c7=c6 where c0 = 41;
select c0, c6, c1, c2, c3, c4, c5, c7 from number_1 where c0 = 41;
C0	C6	C1	C2	C3	C4	C5	C7
41	1234567890123456789.0	1.2345678901234568E+018	1.23456794E+018	1234567890123456789	1235000000000000000	1234567890123456789	1234567890123456789.0                                                                               
ob1.oblog.next;
[R0] BEGIN;[R0] org_cluster_id:1;[R1] record_type:UPDATE;[R1] database_name:oracle.OBLOG_DB;[R1] table_name:NUMBER_1;[R1] log_event:true;[R1] column_count:8;[R1] source_category:SRC_FULL_RECORDED;[R1] source_type:SRC_OCEANBASE_1_0;[R1] has_pk:true;[R1] pk_info:(0);[R1] pks:C0;[R1] has_uk:false;[R1] uk_info:(null);[R1] uks:(null);[R1] [C1] column_name:C0;[R1] [C1] column_type:MYSQL_TYPE_NEWDECIMAL;[R1] [C1] column_is_rowkey:true;[R1] [C1] column_is_signed:true;[R1] [C1] column_encoding:binary;[R1] [C1] column_is_not_null:true;[R1] [C1] column_value_new:[41](2);[R1] [C1] column_value_old:[41](2);[R1] [C2] column_name:C1;[R1] [C2] column_type:MYSQL_TYPE_DOUBLE;[R1] [C2] column_is_rowkey:false;[R1] [C2] column_is_signed:true;[R1] [C2] column_encoding:binary;[R1] [C2] column_is_not_null:false;[R1] [C2] column_value_new:[1.2345678901234568E+018](23);[R1] [C2] column_value_old:[1.234E+001](10);[R1] [C3] column_name:C2;[R1] [C3] column_type:MYSQL_TYPE_FLOAT;[R1] [C3] column_is_rowkey:false;[R1] [C3] column_is_signed:true;[R1] [C3] column_encoding:binary;[R1] [C3] column_is_not_null:false;[R1] [C3] column_value_new:[1.23456794E+018](15);[R1] [C3] column_value_old:[1.23400002E+001](15);[R1] [C4] column_name:C3;[R1] [C4] column_type:MYSQL_TYPE_NEWDECIMAL;[R1] [C4] column_is_rowkey:false;[R1] [C4] column_is_signed:true;[R1] [C4] column_encoding:binary;[R1] [C4] column_is_not_null:false;[R1] [C4] column_value_new:[1234567890123456789](19);[R1] [C4] column_value_old:[12.34](5);[R1] [C5] column_name:C4;[R1] [C5] column_type:MYSQL_TYPE_OB_NUMBER_FLOAT;[R1] [C5] column_is_rowkey:false;[R1] [C5] column_is_signed:true;[R1] [C5] column_encoding:binary;[R1] [C5] column_is_not_null:false;[R1] [C5] column_value_new:[1235000000000000000](19);[R1] [C5] column_value_old:[12.34](5);[R1] [C6] column_name:C5;[R1] [C6] column_type:MYSQL_TYPE_OB_NUMBER_FLOAT;[R1] [C6] column_is_rowkey:false;[R1] [C6] column_is_signed:true;[R1] [C6] column_encoding:binary;[R1] [C6] column_is_not_null:false;[R1] [C6] column_value_new:[1234567890123456789](19);[R1] [C6] column_value_old:[12.34](5);[R1] [C7] column_name:C6;[R1] [C7] column_type:MYSQL_TYPE_VAR_STRING;[R1] [C7] column_is_rowkey:false;[R1] [C7] column_is_signed:true;[R1] [C7] column_encoding:utf8mb4;[R1] [C7] column_is_not_null:false;[R1] [C7] column_value_new:[1234567890123456789.0](21);[R1] [C7] column_value_old:[1234567890123456789.0](21);[R1] [C8] column_name:C7;[R1] [C8] column_type:MYSQL_TYPE_STRING;[R1] [C8] column_is_rowkey:false;[R1] [C8] column_is_signed:true;[R1] [C8] column_encoding:utf8mb4;[R1] [C8] column_is_not_null:false;[R1] [C8] column_value_new:[1234567890123456789.0                                                                               ](100);[R1] [C8] column_value_old:[12.34                                                                                               ](100);$[R2] COMMIT;
update number_1 set c1=c6, c2=c6, c3=c6, c4=c6, c5=c6, c7=c6 where c0 = 42;
select c0, c6, c1, c2, c3, c4, c5, c7 from number_1 where c0 = 42;
C0	C6	C1	C2	C3	C4	C5	C7
42	123456789012345678.90	1.2345678901234568E+017	1.23456791E+017	123456789012345678.9	123500000000000000	123456789012345678.9	123456789012345678.90                                                                               
ob1.oblog.next;
[R0] BEGIN;[R0] org_cluster_id:1;[R1] record_type:UPDATE;[R1] database_name:oracle.OBLOG_DB;[R1] table_name:NUMBER_1;[R1] log_event:true;[R1] column_count:8;[R1] source_category:SRC_FULL_RECORDED;[R1] source_type:SRC_OCEANBASE_1_0;[R1] has_pk:true;[R1] pk_info:(0);[R1] pks:C0;[R1] has_uk:false;[R1] uk_info:(null);[R1] uks:(null);[R1] [C1] column_name:C0;[R1] [C1] column_type:MYSQL_TYPE_NEWDECIMAL;[R1] [C1] column_is_rowkey:true;[R1] [C1] column_is_signed:true;[R1] [C1] column_encoding:binary;[R1] [C1] column_is_not_null:true;[R1] [C1] column_value_new:[42](2);[R1] [C1] column_value_old:[42](2);[R1] [C2] column_name:C1;[R1] [C2] column_type:MYSQL_TYPE_DOUBLE;[R1] [C2] column_is_rowkey:false;[R1] [C2] column_is_signed:true;[R1] [C2] column_encoding:binary;[R1] [C2] column_is_not_null:false;[R1] [C2] column_value_new:[1.2345678901234568E+017](23);[R1] [C2] column_value_old:[1.234E+001](10);[R1] [C3] column_name:C2;[R1] [C3] column_type:MYSQL_TYPE_FLOAT;[R1] [C3] column_is_rowkey:false;[R1] [C3] column_is_signed:true;[R1] [C3] column_encoding:binary;[R1] [C3] column_is_not_null:false;[R1] [C3] column_value_new:[1.23456791E+017](15);[R1] [C3] column_value_old:[1.23400002E+001](15);[R1] [C4] column_name:C3;[R1] [C4] column_type:MYSQL_TYPE_NEWDECIMAL;[R1] [C4] column_is_rowkey:false;[R1] [C4] column_is_signed:true;[R1] [C4] column_encoding:binary;[R1] [C4] column_is_not_null:false;[R1] [C4] column_value_new:[123456789012345678.9](20);[R1] [C4] column_value_old:[12.34](5);[R1] [C5] column_name:C4;[R1] [C5] column_type:MYSQL_TYPE_OB_NUMBER_FLOAT;[R1] [C5] column_is_rowkey:false;[R1] [C5] column_is_signed:true;[R1] [C5] column_encoding:binary;[R1] [C5] column_is_not_null:false;[R1] [C5] column_value_new:[123500000000000000](18);[R1] [C5] column_value_old:[12.34](5);[R1] [C6] column_name:C5;[R1] [C6] column_type:MYSQL_TYPE_OB_NUMBER_FLOAT;[R1] [C6] column_is_rowkey:false;[R1] [C6] column_is_signed:true;[R1] [C6] column_encoding:binary;[R1] [C6] column_is_not_null:false;[R1] [C6] column_value_new:[123456789012345678.9](20);[R1] [C6] column_value_old:[12.34](5);[R1] [C7] column_name:C6;[R1] [C7] column_type:MYSQL_TYPE_VAR_STRING;[R1] [C7] column_is_rowkey:false;[R1] [C7] column_is_signed:true;[R1] [C7] column_encoding:utf8mb4;[R1] [C7] column_is_not_null:false;[R1] [C7] column_value_new:[123456789012345678.90](21);[R1] [C7] column_value_old:[123456789012345678.90](21);[R1] [C8] column_name:C7;[R1] [C8] column_type:MYSQL_TYPE_STRING;[R1] [C8] column_is_rowkey:false;[R1] [C8] column_is_signed:true;[R1] [C8] column_encoding:utf8mb4;[R1] [C8] column_is_not_null:false;[R1] [C8] column_value_new:[123456789012345678.90                                                                               ](100);[R1] [C8] column_value_old:[12.34                                                                                               ](100);$[R2] COMMIT;
update number_1 set c1=c6, c2=c6, c3=c6, c4=c6, c5=c6, c7=c6 where c0 = 43;
select c0, c6, c1, c2, c3, c4, c5, c7 from number_1 where c0 = 43;
C0	C6	C1	C2	C3	C4	C5	C7
43	12345678901234567.890	1.2345678901234568E+016	1.23456784E+016	12345678901234567.89	12350000000000000	12345678901234567.89	12345678901234567.890                                                                               
ob1.oblog.next;
[R0] BEGIN;[R0] org_cluster_id:1;[R1] record_type:UPDATE;[R1] database_name:oracle.OBLOG_DB;[R1] table_name:NUMBER_1;[R1] log_event:true;[R1] column_count:8;[R1] source_category:SRC_FULL_RECORDED;[R1] source_type:SRC_OCEANBASE_1_0;[R1] has_pk:true;[R1] pk_info:(0);[R1] pks:C0;[R1] has_uk:false;[R1] uk_info:(null);[R1] uks:(null);[R1] [C1] column_name:C0;[R1] [C1] column_type:MYSQL_TYPE_NEWDECIMAL;[R1] [C1] column_is_rowkey:true;[R1] [C1] column_is_signed:true;[R1] [C1] column_encoding:binary;[R1] [C1] column_is_not_null:true;[R1] [C1] column_value_new:[43](2);[R1] [C1] column_value_old:[43](2);[R1] [C2] column_name:C1;[R1] [C2] column_type:MYSQL_TYPE_DOUBLE;[R1] [C2] column_is_rowkey:false;[R1] [C2] column_is_signed:true;[R1] [C2] column_encoding:binary;[R1] [C2] column_is_not_null:false;[R1] [C2] column_value_new:[1.2345678901234568E+016](23);[R1] [C2] column_value_old:[1.234E+001](10);[R1] [C3] column_name:C2;[R1] [C3] column_type:MYSQL_TYPE_FLOAT;[R1] [C3] column_is_rowkey:false;[R1] [C3] column_is_signed:true;[R1] [C3] column_encoding:binary;[R1] [C3] column_is_not_null:false;[R1] [C3] column_value_new:[1.23456784E+016](15);[R1] [C3] column_value_old:[1.23400002E+001](15);[R1] [C4] column_name:C3;[R1] [C4] column_type:MYSQL_TYPE_NEWDECIMAL;[R1] [C4] column_is_rowkey:false;[R1] [C4] column_is_signed:true;[R1] [C4] column_encoding:binary;[R1] [C4] column_is_not_null:false;[R1] [C4] column_value_new:[12345678901234567.89](20);[R1] [C4] column_value_old:[12.34](5);[R1] [C5] column_name:C4;[R1] [C5] column_type:MYSQL_TYPE_OB_NUMBER_FLOAT;[R1] [C5] column_is_rowkey:false;[R1] [C5] column_is_signed:true;[R1] [C5] column_encoding:binary;[R1] [C5] column_is_not_null:false;[R1] [C5] column_value_new:[12350000000000000](17);[R1] [C5] column_value_old:[12.34](5);[R1] [C6] column_name:C5;[R1] [C6] column_type:MYSQL_TYPE_OB_NUMBER_FLOAT;[R1] [C6] column_is_rowkey:false;[R1] [C6] column_is_signed:true;[R1] [C6] column_encoding:binary;[R1] [C6] column_is_not_null:false;[R1] [C6] column_value_new:[12345678901234567.89](20);[R1] [C6] column_value_old:[12.34](5);[R1] [C7] column_name:C6;[R1] [C7] column_type:MYSQL_TYPE_VAR_STRING;[R1] [C7] column_is_rowkey:false;[R1] [C7] column_is_signed:true;[R1] [C7] column_encoding:utf8mb4;[R1] [C7] column_is_not_null:false;[R1] [C7] column_value_new:[12345678901234567.890](21);[R1] [C7] column_value_old:[12345678901234567.890](21);[R1] [C8] column_name:C7;[R1] [C8] column_type:MYSQL_TYPE_STRING;[R1] [C8] column_is_rowkey:false;[R1] [C8] column_is_signed:true;[R1] [C8] column_encoding:utf8mb4;[R1] [C8] column_is_not_null:false;[R1] [C8] column_value_new:[12345678901234567.890                                                                               ](100);[R1] [C8] column_value_old:[12.34                                                                                               ](100);$[R2] COMMIT;
update number_1 set c1=c6, c2=c6, c3=c6, c4=c6, c5=c6, c7=c6 where c0 = 44;
select c0, c6, c1, c2, c3, c4, c5, c7 from number_1 where c0 = 44;
C0	C6	C1	C2	C3	C4	C5	C7
44	1234567890123456.7890	1.2345678901234568E+015	1.23456795E+015	1234567890123456.789	1235000000000000	1234567890123456.789	1234567890123456.7890                                                                               
ob1.oblog.next;
[R0] BEGIN;[R0] org_cluster_id:1;[R1] record_type:UPDATE;[R1] database_name:oracle.OBLOG_DB;[R1] table_name:NUMBER_1;[R1] log_event:true;[R1] column_count:8;[R1] source_category:SRC_FULL_RECORDED;[R1] source_type:SRC_OCEANBASE_1_0;[R1] has_pk:true;[R1] pk_info:(0);[R1] pks:C0;[R1] has_uk:false;[R1] uk_info:(null);[R1] uks:(null);[R1] [C1] column_name:C0;[R1] [C1] column_type:MYSQL_TYPE_NEWDECIMAL;[R1] [C1] column_is_rowkey:true;[R1] [C1] column_is_signed:true;[R1] [C1] column_encoding:binary;[R1] [C1] column_is_not_null:true;[R1] [C1] column_value_new:[44](2);[R1] [C1] column_value_old:[44](2);[R1] [C2] column_name:C1;[R1] [C2] column_type:MYSQL_TYPE_DOUBLE;[R1] [C2] column_is_rowkey:false;[R1] [C2] column_is_signed:true;[R1] [C2] column_encoding:binary;[R1] [C2] column_is_not_null:false;[R1] [C2] column_value_new:[1.2345678901234568E+015](23);[R1] [C2] column_value_old:[1.234E+001](10);[R1] [C3] column_name:C2;[R1] [C3] column_type:MYSQL_TYPE_FLOAT;[R1] [C3] column_is_rowkey:false;[R1] [C3] column_is_signed:true;[R1] [C3] column_encoding:binary;[R1] [C3] column_is_not_null:false;[R1] [C3] column_value_new:[1.23456795E+015](15);[R1] [C3] column_value_old:[1.23400002E+001](15);[R1] [C4] column_name:C3;[R1] [C4] column_type:MYSQL_TYPE_NEWDECIMAL;[R1] [C4] column_is_rowkey:false;[R1] [C4] column_is_signed:true;[R1] [C4] column_encoding:binary;[R1] [C4] column_is_not_null:false;[R1] [C4] column_value_new:[1234567890123456.789](20);[R1] [C4] column_value_old:[12.34](5);[R1] [C5] column_name:C4;[R1] [C5] column_type:MYSQL_TYPE_OB_NUMBER_FLOAT;[R1] [C5] column_is_rowkey:false;[R1] [C5] column_is_signed:true;[R1] [C5] column_encoding:binary;[R1] [C5] column_is_not_null:false;[R1] [C5] column_value_new:[1235000000000000](16);[R1] [C5] column_value_old:[12.34](5);[R1] [C6] column_name:C5;[R1] [C6] column_type:MYSQL_TYPE_OB_NUMBER_FLOAT;[R1] [C6] column_is_rowkey:false;[R1] [C6] column_is_signed:true;[R1] [C6] column_encoding:binary;[R1] [C6] column_is_not_null:false;[R1] [C6] column_value_new:[1234567890123456.789](20);[R1] [C6] column_value_old:[12.34](5);[R1] [C7] column_name:C6;[R1] [C7] column_type:MYSQL_TYPE_VAR_STRING;[R1] [C7] column_is_rowkey:false;[R1] [C7] column_is_signed:true;[R1] [C7] column_encoding:utf8mb4;[R1] [C7] column_is_not_null:false;[R1] [C7] column_value_new:[1234567890123456.7890](21);[R1] [C7] column_value_old:[1234567890123456.7890](21);[R1] [C8] column_name:C7;[R1] [C8] column_type:MYSQL_TYPE_STRING;[R1] [C8] column_is_rowkey:false;[R1] [C8] column_is_signed:true;[R1] [C8] column_encoding:utf8mb4;[R1] [C8] column_is_not_null:false;[R1] [C8] column_value_new:[1234567890123456.7890                                                                               ](100);[R1] [C8] column_value_old:[12.34                                                                                               ](100);$[R2] COMMIT;
update number_1 set c1=c6, c2=c6, c3=c6, c4=c6, c5=c6, c7=c6 where c0 = 45;
select c0, c6, c1, c2, c3, c4, c5, c7 from number_1 where c0 = 45;
C0	C6	C1	C2	C3	C4	C5	C7
45	123456789012345.67890	1.2345678901234567E+014	1.23456788E+014	123456789012345.6789	123500000000000	123456789012345.6789	123456789012345.67890                                                                               
ob1.oblog.next;
[R0] BEGIN;[R0] org_cluster_id:1;[R1] record_type:UPDATE;[R1] database_name:oracle.OBLOG_DB;[R1] table_name:NUMBER_1;[R1] log_event:true;[R1] column_count:8;[R1] source_category:SRC_FULL_RECORDED;[R1] source_type:SRC_OCEANBASE_1_0;[R1] has_pk:true;[R1] pk_info:(0);[R1] pks:C0;[R1] has_uk:false;[R1] uk_info:(null);[R1] uks:(null);[R1] [C1] column_name:C0;[R1] [C1] column_type:MYSQL_TYPE_NEWDECIMAL;[R1] [C1] column_is_rowkey:true;[R1] [C1] column_is_signed:true;[R1] [C1] column_encoding:binary;[R1] [C1] column_is_not_null:true;[R1] [C1] column_value_new:[45](2);[R1] [C1] column_value_old:[45](2);[R1] [C2] column_name:C1;[R1] [C2] column_type:MYSQL_TYPE_DOUBLE;[R1] [C2] column_is_rowkey:false;[R1] [C2] column_is_signed:true;[R1] [C2] column_encoding:binary;[R1] [C2] column_is_not_null:false;[R1] [C2] column_value_new:[1.2345678901234567E+014](23);[R1] [C2] column_value_old:[1.234E+001](10);[R1] [C3] column_name:C2;[R1] [C3] column_type:MYSQL_TYPE_FLOAT;[R1] [C3] column_is_rowkey:false;[R1] [C3] column_is_signed:true;[R1] [C3] column_encoding:binary;[R1] [C3] column_is_not_null:false;[R1] [C3] column_value_new:[1.23456788E+014](15);[R1] [C3] column_value_old:[1.23400002E+001](15);[R1] [C4] column_name:C3;[R1] [C4] column_type:MYSQL_TYPE_NEWDECIMAL;[R1] [C4] column_is_rowkey:false;[R1] [C4] column_is_signed:true;[R1] [C4] column_encoding:binary;[R1] [C4] column_is_not_null:false;[R1] [C4] column_value_new:[123456789012345.6789](20);[R1] [C4] column_value_old:[12.34](5);[R1] [C5] column_name:C4;[R1] [C5] column_type:MYSQL_TYPE_OB_NUMBER_FLOAT;[R1] [C5] column_is_rowkey:false;[R1] [C5] column_is_signed:true;[R1] [C5] column_encoding:binary;[R1] [C5] column_is_not_null:false;[R1] [C5] column_value_new:[123500000000000](15);[R1] [C5] column_value_old:[12.34](5);[R1] [C6] column_name:C5;[R1] [C6] column_type:MYSQL_TYPE_OB_NUMBER_FLOAT;[R1] [C6] column_is_rowkey:false;[R1] [C6] column_is_signed:true;[R1] [C6] column_encoding:binary;[R1] [C6] column_is_not_null:false;[R1] [C6] column_value_new:[123456789012345.6789](20);[R1] [C6] column_value_old:[12.34](5);[R1] [C7] column_name:C6;[R1] [C7] column_type:MYSQL_TYPE_VAR_STRING;[R1] [C7] column_is_rowkey:false;[R1] [C7] column_is_signed:true;[R1] [C7] column_encoding:utf8mb4;[R1] [C7] column_is_not_null:false;[R1] [C7] column_value_new:[123456789012345.67890](21);[R1] [C7] column_value_old:[123456789012345.67890](21);[R1] [C8] column_name:C7;[R1] [C8] column_type:MYSQL_TYPE_STRING;[R1] [C8] column_is_rowkey:false;[R1] [C8] column_is_signed:true;[R1] [C8] column_encoding:utf8mb4;[R1] [C8] column_is_not_null:false;[R1] [C8] column_value_new:[123456789012345.67890                                                                               ](100);[R1] [C8] column_value_old:[12.34                                                                                               ](100);$[R2] COMMIT;
update number_1 set c1=c6, c2=c6, c3=c6, c4=c6, c5=c6, c7=c6 where c0 = 46;
select c0, c6, c1, c2, c3, c4, c5, c7 from number_1 where c0 = 46;
C0	C6	C1	C2	C3	C4	C5	C7
46	12345678901234.567890	1.2345678901234568E+013	1.2345679E+013	12345678901234.56789	12350000000000	12345678901234.56789	12345678901234.567890                                                                               
ob1.oblog.next;
[R0] BEGIN;[R0] org_cluster_id:1;[R1] record_type:UPDATE;[R1] database_name:oracle.OBLOG_DB;[R1] table_name:NUMBER_1;[R1] log_event:true;[R1] column_count:8;[R1] source_category:SRC_FULL_RECORDED;[R1] source_type:SRC_OCEANBASE_1_0;[R1] has_pk:true;[R1] pk_info:(0);[R1] pks:C0;[R1] has_uk:false;[R1] uk_info:(null);[R1] uks:(null);[R1] [C1] column_name:C0;[R1] [C1] column_type:MYSQL_TYPE_NEWDECIMAL;[R1] [C1] column_is_rowkey:true;[R1] [C1] column_is_signed:true;[R1] [C1] column_encoding:binary;[R1] [C1] column_is_not_null:true;[R1] [C1] column_value_new:[46](2);[R1] [C1] column_value_old:[46](2);[R1] [C2] column_name:C1;[R1] [C2] column_type:MYSQL_TYPE_DOUBLE;[R1] [C2] column_is_rowkey:false;[R1] [C2] column_is_signed:true;[R1] [C2] column_encoding:binary;[R1] [C2] column_is_not_null:false;[R1] [C2] column_value_new:[1.2345678901234568E+013](23);[R1] [C2] column_value_old:[1.234E+001](10);[R1] [C3] column_name:C2;[R1] [C3] column_type:MYSQL_TYPE_FLOAT;[R1] [C3] column_is_rowkey:false;[R1] [C3] column_is_signed:true;[R1] [C3] column_encoding:binary;[R1] [C3] column_is_not_null:false;[R1] [C3] column_value_new:[1.2345679E+013](14);[R1] [C3] column_value_old:[1.23400002E+001](15);[R1] [C4] column_name:C3;[R1] [C4] column_type:MYSQL_TYPE_NEWDECIMAL;[R1] [C4] column_is_rowkey:false;[R1] [C4] column_is_signed:true;[R1] [C4] column_encoding:binary;[R1] [C4] column_is_not_null:false;[R1] [C4] column_value_new:[12345678901234.56789](20);[R1] [C4] column_value_old:[12.34](5);[R1] [C5] column_name:C4;[R1] [C5] column_type:MYSQL_TYPE_OB_NUMBER_FLOAT;[R1] [C5] column_is_rowkey:false;[R1] [C5] column_is_signed:true;[R1] [C5] column_encoding:binary;[R1] [C5] column_is_not_null:false;[R1] [C5] column_value_new:[12350000000000](14);[R1] [C5] column_value_old:[12.34](5);[R1] [C6] column_name:C5;[R1] [C6] column_type:MYSQL_TYPE_OB_NUMBER_FLOAT;[R1] [C6] column_is_rowkey:false;[R1] [C6] column_is_signed:true;[R1] [C6] column_encoding:binary;[R1] [C6] column_is_not_null:false;[R1] [C6] column_value_new:[12345678901234.56789](20);[R1] [C6] column_value_old:[12.34](5);[R1] [C7] column_name:C6;[R1] [C7] column_type:MYSQL_TYPE_VAR_STRING;[R1] [C7] column_is_rowkey:false;[R1] [C7] column_is_signed:true;[R1] [C7] column_encoding:utf8mb4;[R1] [C7] column_is_not_null:false;[R1] [C7] column_value_new:[12345678901234.567890](21);[R1] [C7] column_value_old:[12345678901234.567890](21);[R1] [C8] column_name:C7;[R1] [C8] column_type:MYSQL_TYPE_STRING;[R1] [C8] column_is_rowkey:false;[R1] [C8] column_is_signed:true;[R1] [C8] column_encoding:utf8mb4;[R1] [C8] column_is_not_null:false;[R1] [C8] column_value_new:[12345678901234.567890                                                                               ](100);[R1] [C8] column_value_old:[12.34                                                                                               ](100);$[R2] COMMIT;
update number_1 set c1=c6, c2=c6, c3=c6, c4=c6, c5=c6, c7=c6 where c0 = 47;
select c0, c6, c1, c2, c3, c4, c5, c7 from number_1 where c0 = 47;
C0	C6	C1	C2	C3	C4	C5	C7
47	1234567890123.4567890	1.2345678901234568E+012	1.23456795E+012	1234567890123.456789	1235000000000	1234567890123.456789	1234567890123.4567890                                                                               
ob1.oblog.next;
[R0] BEGIN;[R0] org_cluster_id:1;[R1] record_type:UPDATE;[R1] database_name:oracle.OBLOG_DB;[R1] table_name:NUMBER_1;[R1] log_event:true;[R1] column_count:8;[R1] source_category:SRC_FULL_RECORDED;[R1] source_type:SRC_OCEANBASE_1_0;[R1] has_pk:true;[R1] pk_info:(0);[R1] pks:C0;[R1] has_uk:false;[R1] uk_info:(null);[R1] uks:(null);[R1] [C1] column_name:C0;[R1] [C1] column_type:MYSQL_TYPE_NEWDECIMAL;[R1] [C1] column_is_rowkey:true;[R1] [C1] column_is_signed:true;[R1] [C1] column_encoding:binary;[R1] [C1] column_is_not_null:true;[R1] [C1] column_value_new:[47](2);[R1] [C1] column_value_old:[47](2);[R1] [C2] column_name:C1;[R1] [C2] column_type:MYSQL_TYPE_DOUBLE;[R1] [C2] column_is_rowkey:false;[R1] [C2] column_is_signed:true;[R1] [C2] column_encoding:binary;[R1] [C2] column_is_not_null:false;[R1] [C2] column_value_new:[1.2345678901234568E+012](23);[R1] [C2] column_value_old:[1.234E+001](10);[R1] [C3] column_name:C2;[R1] [C3] column_type:MYSQL_TYPE_FLOAT;[R1] [C3] column_is_rowkey:false;[R1] [C3] column_is_signed:true;[R1] [C3] column_encoding:binary;[R1] [C3] column_is_not_null:false;[R1] [C3] column_value_new:[1.23456795E+012](15);[R1] [C3] column_value_old:[1.23400002E+001](15);[R1] [C4] column_name:C3;[R1] [C4] column_type:MYSQL_TYPE_NEWDECIMAL;[R1] [C4] column_is_rowkey:false;[R1] [C4] column_is_signed:true;[R1] [C4] column_encoding:binary;[R1] [C4] column_is_not_null:false;[R1] [C4] column_value_new:[1234567890123.456789](20);[R1] [C4] column_value_old:[12.34](5);[R1] [C5] column_name:C4;[R1] [C5] column_type:MYSQL_TYPE_OB_NUMBER_FLOAT;[R1] [C5] column_is_rowkey:false;[R1] [C5] column_is_signed:true;[R1] [C5] column_encoding:binary;[R1] [C5] column_is_not_null:false;[R1] [C5] column_value_new:[1235000000000](13);[R1] [C5] column_value_old:[12.34](5);[R1] [C6] column_name:C5;[R1] [C6] column_type:MYSQL_TYPE_OB_NUMBER_FLOAT;[R1] [C6] column_is_rowkey:false;[R1] [C6] column_is_signed:true;[R1] [C6] column_encoding:binary;[R1] [C6] column_is_not_null:false;[R1] [C6] column_value_new:[1234567890123.456789](20);[R1] [C6] column_value_old:[12.34](5);[R1] [C7] column_name:C6;[R1] [C7] column_type:MYSQL_TYPE_VAR_STRING;[R1] [C7] column_is_rowkey:false;[R1] [C7] column_is_signed:true;[R1] [C7] column_encoding:utf8mb4;[R1] [C7] column_is_not_null:false;[R1] [C7] column_value_new:[1234567890123.4567890](21);[R1] [C7] column_value_old:[1234567890123.4567890](21);[R1] [C8] column_name:C7;[R1] [C8] column_type:MYSQL_TYPE_STRING;[R1] [C8] column_is_rowkey:false;[R1] [C8] column_is_signed:true;[R1] [C8] column_encoding:utf8mb4;[R1] [C8] column_is_not_null:false;[R1] [C8] column_value_new:[1234567890123.4567890                                                                               ](100);[R1] [C8] column_value_old:[12.34                                                                                               ](100);$[R2] COMMIT;
update number_1 set c1=c6, c2=c6, c3=c6, c4=c6, c5=c6, c7=c6 where c0 = 48;
select c0, c6, c1, c2, c3, c4, c5, c7 from number_1 where c0 = 48;
C0	C6	C1	C2	C3	C4	C5	C7
48	123456789012.34567890	1.2345678901234567E+011	1.23456791E+011	123456789012.3456789	123500000000	123456789012.3456789	123456789012.34567890                                                                               
ob1.oblog.next;
[R0] BEGIN;[R0] org_cluster_id:1;[R1] record_type:UPDATE;[R1] database_name:oracle.OBLOG_DB;[R1] table_name:NUMBER_1;[R1] log_event:true;[R1] column_count:8;[R1] source_category:SRC_FULL_RECORDED;[R1] source_type:SRC_OCEANBASE_1_0;[R1] has_pk:true;[R1] pk_info:(0);[R1] pks:C0;[R1] has_uk:false;[R1] uk_info:(null);[R1] uks:(null);[R1] [C1] column_name:C0;[R1] [C1] column_type:MYSQL_TYPE_NEWDECIMAL;[R1] [C1] column_is_rowkey:true;[R1] [C1] column_is_signed:true;[R1] [C1] column_encoding:binary;[R1] [C1] column_is_not_null:true;[R1] [C1] column_value_new:[48](2);[R1] [C1] column_value_old:[48](2);[R1] [C2] column_name:C1;[R1] [C2] column_type:MYSQL_TYPE_DOUBLE;[R1] [C2] column_is_rowkey:false;[R1] [C2] column_is_signed:true;[R1] [C2] column_encoding:binary;[R1] [C2] column_is_not_null:false;[R1] [C2] column_value_new:[1.2345678901234567E+011](23);[R1] [C2] column_value_old:[1.234E+001](10);[R1] [C3] column_name:C2;[R1] [C3] column_type:MYSQL_TYPE_FLOAT;[R1] [C3] column_is_rowkey:false;[R1] [C3] column_is_signed:true;[R1] [C3] column_encoding:binary;[R1] [C3] column_is_not_null:false;[R1] [C3] column_value_new:[1.23456791E+011](15);[R1] [C3] column_value_old:[1.23400002E+001](15);[R1] [C4] column_name:C3;[R1] [C4] column_type:MYSQL_TYPE_NEWDECIMAL;[R1] [C4] column_is_rowkey:false;[R1] [C4] column_is_signed:true;[R1] [C4] column_encoding:binary;[R1] [C4] column_is_not_null:false;[R1] [C4] column_value_new:[123456789012.3456789](20);[R1] [C4] column_value_old:[12.34](5);[R1] [C5] column_name:C4;[R1] [C5] column_type:MYSQL_TYPE_OB_NUMBER_FLOAT;[R1] [C5] column_is_rowkey:false;[R1] [C5] column_is_signed:true;[R1] [C5] column_encoding:binary;[R1] [C5] column_is_not_null:false;[R1] [C5] column_value_new:[123500000000](12);[R1] [C5] column_value_old:[12.34](5);[R1] [C6] column_name:C5;[R1] [C6] column_type:MYSQL_TYPE_OB_NUMBER_FLOAT;[R1] [C6] column_is_rowkey:false;[R1] [C6] column_is_signed:true;[R1] [C6] column_encoding:binary;[R1] [C6] column_is_not_null:false;[R1] [C6] column_value_new:[123456789012.3456789](20);[R1] [C6] column_value_old:[12.34](5);[R1] [C7] column_name:C6;[R1] [C7] column_type:MYSQL_TYPE_VAR_STRING;[R1] [C7] column_is_rowkey:false;[R1] [C7] column_is_signed:true;[R1] [C7] column_encoding:utf8mb4;[R1] [C7] column_is_not_null:false;[R1] [C7] column_value_new:[123456789012.34567890](21);[R1] [C7] column_value_old:[123456789012.34567890](21);[R1] [C8] column_name:C7;[R1] [C8] column_type:MYSQL_TYPE_STRING;[R1] [C8] column_is_rowkey:false;[R1] [C8] column_is_signed:true;[R1] [C8] column_encoding:utf8mb4;[R1] [C8] column_is_not_null:false;[R1] [C8] column_value_new:[123456789012.34567890                                                                               ](100);[R1] [C8] column_value_old:[12.34                                                                                               ](100);$[R2] COMMIT;
update number_1 set c1=c6, c2=c6, c3=c6, c4=c6, c5=c6, c7=c6 where c0 = 49;
select c0, c6, c1, c2, c3, c4, c5, c7 from number_1 where c0 = 49;
C0	C6	C1	C2	C3	C4	C5	C7
49	12345678901.234567890	1.2345678901234568E+010	1.23456788E+010	12345678901.23456789	12350000000	12345678901.23456789	12345678901.234567890                                                                               
ob1.oblog.next;
[R0] BEGIN;[R0] org_cluster_id:1;[R1] record_type:UPDATE;[R1] database_name:oracle.OBLOG_DB;[R1] table_name:NUMBER_1;[R1] log_event:true;[R1] column_count:8;[R1] source_category:SRC_FULL_RECORDED;[R1] source_type:SRC_OCEANBASE_1_0;[R1] has_pk:true;[R1] pk_info:(0);[R1] pks:C0;[R1] has_uk:false;[R1] uk_info:(null);[R1] uks:(null);[R1] [C1] column_name:C0;[R1] [C1] column_type:MYSQL_TYPE_NEWDECIMAL;[R1] [C1] column_is_rowkey:true;[R1] [C1] column_is_signed:true;[R1] [C1] column_encoding:binary;[R1] [C1] column_is_not_null:true;[R1] [C1] column_value_new:[49](2);[R1] [C1] column_value_old:[49](2);[R1] [C2] column_name:C1;[R1] [C2] column_type:MYSQL_TYPE_DOUBLE;[R1] [C2] column_is_rowkey:false;[R1] [C2] column_is_signed:true;[R1] [C2] column_encoding:binary;[R1] [C2] column_is_not_null:false;[R1] [C2] column_value_new:[1.2345678901234568E+010](23);[R1] [C2] column_value_old:[1.234E+001](10);[R1] [C3] column_name:C2;[R1] [C3] column_type:MYSQL_TYPE_FLOAT;[R1] [C3] column_is_rowkey:false;[R1] [C3] column_is_signed:true;[R1] [C3] column_encoding:binary;[R1] [C3] column_is_not_null:false;[R1] [C3] column_value_new:[1.23456788E+010](15);[R1] [C3] column_value_old:[1.23400002E+001](15);[R1] [C4] column_name:C3;[R1] [C4] column_type:MYSQL_TYPE_NEWDECIMAL;[R1] [C4] column_is_rowkey:false;[R1] [C4] column_is_signed:true;[R1] [C4] column_encoding:binary;[R1] [C4] column_is_not_null:false;[R1] [C4] column_value_new:[12345678901.23456789](20);[R1] [C4] column_value_old:[12.34](5);[R1] [C5] column_name:C4;[R1] [C5] column_type:MYSQL_TYPE_OB_NUMBER_FLOAT;[R1] [C5] column_is_rowkey:false;[R1] [C5] column_is_signed:true;[R1] [C5] column_encoding:binary;[R1] [C5] column_is_not_null:false;[R1] [C5] column_value_new:[12350000000](11);[R1] [C5] column_value_old:[12.34](5);[R1] [C6] column_name:C5;[R1] [C6] column_type:MYSQL_TYPE_OB_NUMBER_FLOAT;[R1] [C6] column_is_rowkey:false;[R1] [C6] column_is_signed:true;[R1] [C6] column_encoding:binary;[R1] [C6] column_is_not_null:false;[R1] [C6] column_value_new:[12345678901.23456789](20);[R1] [C6] column_value_old:[12.34](5);[R1] [C7] column_name:C6;[R1] [C7] column_type:MYSQL_TYPE_VAR_STRING;[R1] [C7] column_is_rowkey:false;[R1] [C7] column_is_signed:true;[R1] [C7] column_encoding:utf8mb4;[R1] [C7] column_is_not_null:false;[R1] [C7] column_value_new:[12345678901.234567890](21);[R1] [C7] column_value_old:[12345678901.234567890](21);[R1] [C8] column_name:C7;[R1] [C8] column_type:MYSQL_TYPE_STRING;[R1] [C8] column_is_rowkey:false;[R1] [C8] column_is_signed:true;[R1] [C8] column_encoding:utf8mb4;[R1] [C8] column_is_not_null:false;[R1] [C8] column_value_new:[12345678901.234567890                                                                               ](100);[R1] [C8] column_value_old:[12.34                                                                                               ](100);$[R2] COMMIT;
update number_1 set c1=c6, c2=c6, c3=c6, c4=c6, c5=c6, c7=c6 where c0 = 50;
select c0, c6, c1, c2, c3, c4, c5, c7 from number_1 where c0 = 50;
C0	C6	C1	C2	C3	C4	C5	C7
50	1234567890.1234567890	1.2345678901234567E+009	1.23456794E+009	1234567890.123456789	1235000000	1234567890.123456789	1234567890.1234567890                                                                               
ob1.oblog.next;
[R0] BEGIN;[R0] org_cluster_id:1;[R1] record_type:UPDATE;[R1] database_name:oracle.OBLOG_DB;[R1] table_name:NUMBER_1;[R1] log_event:true;[R1] column_count:8;[R1] source_category:SRC_FULL_RECORDED;[R1] source_type:SRC_OCEANBASE_1_0;[R1] has_pk:true;[R1] pk_info:(0);[R1] pks:C0;[R1] has_uk:false;[R1] uk_info:(null);[R1] uks:(null);[R1] [C1] column_name:C0;[R1] [C1] column_type:MYSQL_TYPE_NEWDECIMAL;[R1] [C1] column_is_rowkey:true;[R1] [C1] column_is_signed:true;[R1] [C1] column_encoding:binary;[R1] [C1] column_is_not_null:true;[R1] [C1] column_value_new:[50](2);[R1] [C1] column_value_old:[50](2);[R1] [C2] column_name:C1;[R1] [C2] column_type:MYSQL_TYPE_DOUBLE;[R1] [C2] column_is_rowkey:false;[R1] [C2] column_is_signed:true;[R1] [C2] column_encoding:binary;[R1] [C2] column_is_not_null:false;[R1] [C2] column_value_new:[1.2345678901234567E+009](23);[R1] [C2] column_value_old:[1.234E+001](10);[R1] [C3] column_name:C2;[R1] [C3] column_type:MYSQL_TYPE_FLOAT;[R1] [C3] column_is_rowkey:false;[R1] [C3] column_is_signed:true;[R1] [C3] column_encoding:binary;[R1] [C3] column_is_not_null:false;[R1] [C3] column_value_new:[1.23456794E+009](15);[R1] [C3] column_value_old:[1.23400002E+001](15);[R1] [C4] column_name:C3;[R1] [C4] column_type:MYSQL_TYPE_NEWDECIMAL;[R1] [C4] column_is_rowkey:false;[R1] [C4] column_is_signed:true;[R1] [C4] column_encoding:binary;[R1] [C4] column_is_not_null:false;[R1] [C4] column_value_new:[1234567890.123456789](20);[R1] [C4] column_value_old:[12.34](5);[R1] [C5] column_name:C4;[R1] [C5] column_type:MYSQL_TYPE_OB_NUMBER_FLOAT;[R1] [C5] column_is_rowkey:false;[R1] [C5] column_is_signed:true;[R1] [C5] column_encoding:binary;[R1] [C5] column_is_not_null:false;[R1] [C5] column_value_new:[1235000000](10);[R1] [C5] column_value_old:[12.34](5);[R1] [C6] column_name:C5;[R1] [C6] column_type:MYSQL_TYPE_OB_NUMBER_FLOAT;[R1] [C6] column_is_rowkey:false;[R1] [C6] column_is_signed:true;[R1] [C6] column_encoding:binary;[R1] [C6] column_is_not_null:false;[R1] [C6] column_value_new:[1234567890.123456789](20);[R1] [C6] column_value_old:[12.34](5);[R1] [C7] column_name:C6;[R1] [C7] column_type:MYSQL_TYPE_VAR_STRING;[R1] [C7] column_is_rowkey:false;[R1] [C7] column_is_signed:true;[R1] [C7] column_encoding:utf8mb4;[R1] [C7] column_is_not_null:false;[R1] [C7] column_value_new:[1234567890.1234567890](21);[R1] [C7] column_value_old:[1234567890.1234567890](21);[R1] [C8] column_name:C7;[R1] [C8] column_type:MYSQL_TYPE_STRING;[R1] [C8] column_is_rowkey:false;[R1] [C8] column_is_signed:true;[R1] [C8] column_encoding:utf8mb4;[R1] [C8] column_is_not_null:false;[R1] [C8] column_value_new:[1234567890.1234567890                                                                               ](100);[R1] [C8] column_value_old:[12.34                                                                                               ](100);$[R2] COMMIT;
update number_1 set c1=c6, c2=c6, c3=c6, c4=c6, c5=c6, c7=c6 where c0 = 51;
select c0, c6, c1, c2, c3, c4, c5, c7 from number_1 where c0 = 51;
C0	C6	C1	C2	C3	C4	C5	C7
51	123456789.01234567890	1.2345678901234567E+008	1.23456792E+008	123456789.0123456789	123500000	123456789.0123456789	123456789.01234567890                                                                               
ob1.oblog.next;
[R0] BEGIN;[R0] org_cluster_id:1;[R1] record_type:UPDATE;[R1] database_name:oracle.OBLOG_DB;[R1] table_name:NUMBER_1;[R1] log_event:true;[R1] column_count:8;[R1] source_category:SRC_FULL_RECORDED;[R1] source_type:SRC_OCEANBASE_1_0;[R1] has_pk:true;[R1] pk_info:(0);[R1] pks:C0;[R1] has_uk:false;[R1] uk_info:(null);[R1] uks:(null);[R1] [C1] column_name:C0;[R1] [C1] column_type:MYSQL_TYPE_NEWDECIMAL;[R1] [C1] column_is_rowkey:true;[R1] [C1] column_is_signed:true;[R1] [C1] column_encoding:binary;[R1] [C1] column_is_not_null:true;[R1] [C1] column_value_new:[51](2);[R1] [C1] column_value_old:[51](2);[R1] [C2] column_name:C1;[R1] [C2] column_type:MYSQL_TYPE_DOUBLE;[R1] [C2] column_is_rowkey:false;[R1] [C2] column_is_signed:true;[R1] [C2] column_encoding:binary;[R1] [C2] column_is_not_null:false;[R1] [C2] column_value_new:[1.2345678901234567E+008](23);[R1] [C2] column_value_old:[1.234E+001](10);[R1] [C3] column_name:C2;[R1] [C3] column_type:MYSQL_TYPE_FLOAT;[R1] [C3] column_is_rowkey:false;[R1] [C3] column_is_signed:true;[R1] [C3] column_encoding:binary;[R1] [C3] column_is_not_null:false;[R1] [C3] column_value_new:[1.23456792E+008](15);[R1] [C3] column_value_old:[1.23400002E+001](15);[R1] [C4] column_name:C3;[R1] [C4] column_type:MYSQL_TYPE_NEWDECIMAL;[R1] [C4] column_is_rowkey:false;[R1] [C4] column_is_signed:true;[R1] [C4] column_encoding:binary;[R1] [C4] column_is_not_null:false;[R1] [C4] column_value_new:[123456789.0123456789](20);[R1] [C4] column_value_old:[12.34](5);[R1] [C5] column_name:C4;[R1] [C5] column_type:MYSQL_TYPE_OB_NUMBER_FLOAT;[R1] [C5] column_is_rowkey:false;[R1] [C5] column_is_signed:true;[R1] [C5] column_encoding:binary;[R1] [C5] column_is_not_null:false;[R1] [C5] column_value_new:[123500000](9);[R1] [C5] column_value_old:[12.34](5);[R1] [C6] column_name:C5;[R1] [C6] column_type:MYSQL_TYPE_OB_NUMBER_FLOAT;[R1] [C6] column_is_rowkey:false;[R1] [C6] column_is_signed:true;[R1] [C6] column_encoding:binary;[R1] [C6] column_is_not_null:false;[R1] [C6] column_value_new:[123456789.0123456789](20);[R1] [C6] column_value_old:[12.34](5);[R1] [C7] column_name:C6;[R1] [C7] column_type:MYSQL_TYPE_VAR_STRING;[R1] [C7] column_is_rowkey:false;[R1] [C7] column_is_signed:true;[R1] [C7] column_encoding:utf8mb4;[R1] [C7] column_is_not_null:false;[R1] [C7] column_value_new:[123456789.01234567890](21);[R1] [C7] column_value_old:[123456789.01234567890](21);[R1] [C8] column_name:C7;[R1] [C8] column_type:MYSQL_TYPE_STRING;[R1] [C8] column_is_rowkey:false;[R1] [C8] column_is_signed:true;[R1] [C8] column_encoding:utf8mb4;[R1] [C8] column_is_not_null:false;[R1] [C8] column_value_new:[123456789.01234567890                                                                               ](100);[R1] [C8] column_value_old:[12.34                                                                                               ](100);$[R2] COMMIT;
update number_1 set c1=c6, c2=c6, c3=c6, c4=c6, c5=c6, c7=c6 where c0 = 52;
select c0, c6, c1, c2, c3, c4, c5, c7 from number_1 where c0 = 52;
C0	C6	C1	C2	C3	C4	C5	C7
52	12345678.901234567890	1.2345678901234567E+007	1.2345679E+007	12345678.90123456789	12350000	12345678.90123456789	12345678.901234567890                                                                               
ob1.oblog.next;
[R0] BEGIN;[R0] org_cluster_id:1;[R1] record_type:UPDATE;[R1] database_name:oracle.OBLOG_DB;[R1] table_name:NUMBER_1;[R1] log_event:true;[R1] column_count:8;[R1] source_category:SRC_FULL_RECORDED;[R1] source_type:SRC_OCEANBASE_1_0;[R1] has_pk:true;[R1] pk_info:(0);[R1] pks:C0;[R1] has_uk:false;[R1] uk_info:(null);[R1] uks:(null);[R1] [C1] column_name:C0;[R1] [C1] column_type:MYSQL_TYPE_NEWDECIMAL;[R1] [C1] column_is_rowkey:true;[R1] [C1] column_is_signed:true;[R1] [C1] column_encoding:binary;[R1] [C1] column_is_not_null:true;[R1] [C1] column_value_new:[52](2);[R1] [C1] column_value_old:[52](2);[R1] [C2] column_name:C1;[R1] [C2] column_type:MYSQL_TYPE_DOUBLE;[R1] [C2] column_is_rowkey:false;[R1] [C2] column_is_signed:true;[R1] [C2] column_encoding:binary;[R1] [C2] column_is_not_null:false;[R1] [C2] column_value_new:[1.2345678901234567E+007](23);[R1] [C2] column_value_old:[1.234E+001](10);[R1] [C3] column_name:C2;[R1] [C3] column_type:MYSQL_TYPE_FLOAT;[R1] [C3] column_is_rowkey:false;[R1] [C3] column_is_signed:true;[R1] [C3] column_encoding:binary;[R1] [C3] column_is_not_null:false;[R1] [C3] column_value_new:[1.2345679E+007](14);[R1] [C3] column_value_old:[1.23400002E+001](15);[R1] [C4] column_name:C3;[R1] [C4] column_type:MYSQL_TYPE_NEWDECIMAL;[R1] [C4] column_is_rowkey:false;[R1] [C4] column_is_signed:true;[R1] [C4] column_encoding:binary;[R1] [C4] column_is_not_null:false;[R1] [C4] column_value_new:[12345678.90123456789](20);[R1] [C4] column_value_old:[12.34](5);[R1] [C5] column_name:C4;[R1] [C5] column_type:MYSQL_TYPE_OB_NUMBER_FLOAT;[R1] [C5] column_is_rowkey:false;[R1] [C5] column_is_signed:true;[R1] [C5] column_encoding:binary;[R1] [C5] column_is_not_null:false;[R1] [C5] column_value_new:[12350000](8);[R1] [C5] column_value_old:[12.34](5);[R1] [C6] column_name:C5;[R1] [C6] column_type:MYSQL_TYPE_OB_NUMBER_FLOAT;[R1] [C6] column_is_rowkey:false;[R1] [C6] column_is_signed:true;[R1] [C6] column_encoding:binary;[R1] [C6] column_is_not_null:false;[R1] [C6] column_value_new:[12345678.90123456789](20);[R1] [C6] column_value_old:[12.34](5);[R1] [C7] column_name:C6;[R1] [C7] column_type:MYSQL_TYPE_VAR_STRING;[R1] [C7] column_is_rowkey:false;[R1] [C7] column_is_signed:true;[R1] [C7] column_encoding:utf8mb4;[R1] [C7] column_is_not_null:false;[R1] [C7] column_value_new:[12345678.901234567890](21);[R1] [C7] column_value_old:[12345678.901234567890](21);[R1] [C8] column_name:C7;[R1] [C8] column_type:MYSQL_TYPE_STRING;[R1] [C8] column_is_rowkey:false;[R1] [C8] column_is_signed:true;[R1] [C8] column_encoding:utf8mb4;[R1] [C8] column_is_not_null:false;[R1] [C8] column_value_new:[12345678.901234567890                                                                               ](100);[R1] [C8] column_value_old:[12.34                                                                                               ](100);$[R2] COMMIT;
update number_1 set c1=c6, c2=c6, c3=c6, c4=c6, c5=c6, c7=c6 where c0 = 53;
select c0, c6, c1, c2, c3, c4, c5, c7 from number_1 where c0 = 53;
C0	C6	C1	C2	C3	C4	C5	C7
53	1234567.8901234567890	1.2345678901234567E+006	1.23456788E+006	1234567.890123456789	1235000	1234567.890123456789	1234567.8901234567890                                                                               
ob1.oblog.next;
[R0] BEGIN;[R0] org_cluster_id:1;[R1] record_type:UPDATE;[R1] database_name:oracle.OBLOG_DB;[R1] table_name:NUMBER_1;[R1] log_event:true;[R1] column_count:8;[R1] source_category:SRC_FULL_RECORDED;[R1] source_type:SRC_OCEANBASE_1_0;[R1] has_pk:true;[R1] pk_info:(0);[R1] pks:C0;[R1] has_uk:false;[R1] uk_info:(null);[R1] uks:(null);[R1] [C1] column_name:C0;[R1] [C1] column_type:MYSQL_TYPE_NEWDECIMAL;[R1] [C1] column_is_rowkey:true;[R1] [C1] column_is_signed:true;[R1] [C1] column_encoding:binary;[R1] [C1] column_is_not_null:true;[R1] [C1] column_value_new:[53](2);[R1] [C1] column_value_old:[53](2);[R1] [C2] column_name:C1;[R1] [C2] column_type:MYSQL_TYPE_DOUBLE;[R1] [C2] column_is_rowkey:false;[R1] [C2] column_is_signed:true;[R1] [C2] column_encoding:binary;[R1] [C2] column_is_not_null:false;[R1] [C2] column_value_new:[1.2345678901234567E+006](23);[R1] [C2] column_value_old:[1.234E+001](10);[R1] [C3] column_name:C2;[R1] [C3] column_type:MYSQL_TYPE_FLOAT;[R1] [C3] column_is_rowkey:false;[R1] [C3] column_is_signed:true;[R1] [C3] column_encoding:binary;[R1] [C3] column_is_not_null:false;[R1] [C3] column_value_new:[1.23456788E+006](15);[R1] [C3] column_value_old:[1.23400002E+001](15);[R1] [C4] column_name:C3;[R1] [C4] column_type:MYSQL_TYPE_NEWDECIMAL;[R1] [C4] column_is_rowkey:false;[R1] [C4] column_is_signed:true;[R1] [C4] column_encoding:binary;[R1] [C4] column_is_not_null:false;[R1] [C4] column_value_new:[1234567.890123456789](20);[R1] [C4] column_value_old:[12.34](5);[R1] [C5] column_name:C4;[R1] [C5] column_type:MYSQL_TYPE_OB_NUMBER_FLOAT;[R1] [C5] column_is_rowkey:false;[R1] [C5] column_is_signed:true;[R1] [C5] column_encoding:binary;[R1] [C5] column_is_not_null:false;[R1] [C5] column_value_new:[1235000](7);[R1] [C5] column_value_old:[12.34](5);[R1] [C6] column_name:C5;[R1] [C6] column_type:MYSQL_TYPE_OB_NUMBER_FLOAT;[R1] [C6] column_is_rowkey:false;[R1] [C6] column_is_signed:true;[R1] [C6] column_encoding:binary;[R1] [C6] column_is_not_null:false;[R1] [C6] column_value_new:[1234567.890123456789](20);[R1] [C6] column_value_old:[12.34](5);[R1] [C7] column_name:C6;[R1] [C7] column_type:MYSQL_TYPE_VAR_STRING;[R1] [C7] column_is_rowkey:false;[R1] [C7] column_is_signed:true;[R1] [C7] column_encoding:utf8mb4;[R1] [C7] column_is_not_null:false;[R1] [C7] column_value_new:[1234567.8901234567890](21);[R1] [C7] column_value_old:[1234567.8901234567890](21);[R1] [C8] column_name:C7;[R1] [C8] column_type:MYSQL_TYPE_STRING;[R1] [C8] column_is_rowkey:false;[R1] [C8] column_is_signed:true;[R1] [C8] column_encoding:utf8mb4;[R1] [C8] column_is_not_null:false;[R1] [C8] column_value_new:[1234567.8901234567890                                                                               ](100);[R1] [C8] column_value_old:[12.34                                                                                               ](100);$[R2] COMMIT;
update number_1 set c1=c6, c2=c6, c3=c6, c4=c6, c5=c6, c7=c6 where c0 = 54;
select c0, c6, c1, c2, c3, c4, c5, c7 from number_1 where c0 = 54;
C0	C6	C1	C2	C3	C4	C5	C7
54	123456.78901234567890	1.2345678901234567E+005	1.23456789E+005	123456.7890123456789	123500	123456.7890123456789	123456.78901234567890                                                                               
ob1.oblog.next;
[R0] BEGIN;[R0] org_cluster_id:1;[R1] record_type:UPDATE;[R1] database_name:oracle.OBLOG_DB;[R1] table_name:NUMBER_1;[R1] log_event:true;[R1] column_count:8;[R1] source_category:SRC_FULL_RECORDED;[R1] source_type:SRC_OCEANBASE_1_0;[R1] has_pk:true;[R1] pk_info:(0);[R1] pks:C0;[R1] has_uk:false;[R1] uk_info:(null);[R1] uks:(null);[R1] [C1] column_name:C0;[R1] [C1] column_type:MYSQL_TYPE_NEWDECIMAL;[R1] [C1] column_is_rowkey:true;[R1] [C1] column_is_signed:true;[R1] [C1] column_encoding:binary;[R1] [C1] column_is_not_null:true;[R1] [C1] column_value_new:[54](2);[R1] [C1] column_value_old:[54](2);[R1] [C2] column_name:C1;[R1] [C2] column_type:MYSQL_TYPE_DOUBLE;[R1] [C2] column_is_rowkey:false;[R1] [C2] column_is_signed:true;[R1] [C2] column_encoding:binary;[R1] [C2] column_is_not_null:false;[R1] [C2] column_value_new:[1.2345678901234567E+005](23);[R1] [C2] column_value_old:[1.234E+001](10);[R1] [C3] column_name:C2;[R1] [C3] column_type:MYSQL_TYPE_FLOAT;[R1] [C3] column_is_rowkey:false;[R1] [C3] column_is_signed:true;[R1] [C3] column_encoding:binary;[R1] [C3] column_is_not_null:false;[R1] [C3] column_value_new:[1.23456789E+005](15);[R1] [C3] column_value_old:[1.23400002E+001](15);[R1] [C4] column_name:C3;[R1] [C4] column_type:MYSQL_TYPE_NEWDECIMAL;[R1] [C4] column_is_rowkey:false;[R1] [C4] column_is_signed:true;[R1] [C4] column_encoding:binary;[R1] [C4] column_is_not_null:false;[R1] [C4] column_value_new:[123456.7890123456789](20);[R1] [C4] column_value_old:[12.34](5);[R1] [C5] column_name:C4;[R1] [C5] column_type:MYSQL_TYPE_OB_NUMBER_FLOAT;[R1] [C5] column_is_rowkey:false;[R1] [C5] column_is_signed:true;[R1] [C5] column_encoding:binary;[R1] [C5] column_is_not_null:false;[R1] [C5] column_value_new:[123500](6);[R1] [C5] column_value_old:[12.34](5);[R1] [C6] column_name:C5;[R1] [C6] column_type:MYSQL_TYPE_OB_NUMBER_FLOAT;[R1] [C6] column_is_rowkey:false;[R1] [C6] column_is_signed:true;[R1] [C6] column_encoding:binary;[R1] [C6] column_is_not_null:false;[R1] [C6] column_value_new:[123456.7890123456789](20);[R1] [C6] column_value_old:[12.34](5);[R1] [C7] column_name:C6;[R1] [C7] column_type:MYSQL_TYPE_VAR_STRING;[R1] [C7] column_is_rowkey:false;[R1] [C7] column_is_signed:true;[R1] [C7] column_encoding:utf8mb4;[R1] [C7] column_is_not_null:false;[R1] [C7] column_value_new:[123456.78901234567890](21);[R1] [C7] column_value_old:[123456.78901234567890](21);[R1] [C8] column_name:C7;[R1] [C8] column_type:MYSQL_TYPE_STRING;[R1] [C8] column_is_rowkey:false;[R1] [C8] column_is_signed:true;[R1] [C8] column_encoding:utf8mb4;[R1] [C8] column_is_not_null:false;[R1] [C8] column_value_new:[123456.78901234567890                                                                               ](100);[R1] [C8] column_value_old:[12.34                                                                                               ](100);$[R2] COMMIT;
update number_1 set c1=c6, c2=c6, c3=c6, c4=c6, c5=c6, c7=c6 where c0 = 55;
select c0, c6, c1, c2, c3, c4, c5, c7 from number_1 where c0 = 55;
C0	C6	C1	C2	C3	C4	C5	C7
55	12345.678901234567890	1.2345678901234567E+004	1.23456787E+004	12345.67890123456789	12350	12345.67890123456789	12345.678901234567890                                                                               
ob1.oblog.next;
[R0] BEGIN;[R0] org_cluster_id:1;[R1] record_type:UPDATE;[R1] database_name:oracle.OBLOG_DB;[R1] table_name:NUMBER_1;[R1] log_event:true;[R1] column_count:8;[R1] source_category:SRC_FULL_RECORDED;[R1] source_type:SRC_OCEANBASE_1_0;[R1] has_pk:true;[R1] pk_info:(0);[R1] pks:C0;[R1] has_uk:false;[R1] uk_info:(null);[R1] uks:(null);[R1] [C1] column_name:C0;[R1] [C1] column_type:MYSQL_TYPE_NEWDECIMAL;[R1] [C1] column_is_rowkey:true;[R1] [C1] column_is_signed:true;[R1] [C1] column_encoding:binary;[R1] [C1] column_is_not_null:true;[R1] [C1] column_value_new:[55](2);[R1] [C1] column_value_old:[55](2);[R1] [C2] column_name:C1;[R1] [C2] column_type:MYSQL_TYPE_DOUBLE;[R1] [C2] column_is_rowkey:false;[R1] [C2] column_is_signed:true;[R1] [C2] column_encoding:binary;[R1] [C2] column_is_not_null:false;[R1] [C2] column_value_new:[1.2345678901234567E+004](23);[R1] [C2] column_value_old:[1.234E+001](10);[R1] [C3] column_name:C2;[R1] [C3] column_type:MYSQL_TYPE_FLOAT;[R1] [C3] column_is_rowkey:false;[R1] [C3] column_is_signed:true;[R1] [C3] column_encoding:binary;[R1] [C3] column_is_not_null:false;[R1] [C3] column_value_new:[1.23456787E+004](15);[R1] [C3] column_value_old:[1.23400002E+001](15);[R1] [C4] column_name:C3;[R1] [C4] column_type:MYSQL_TYPE_NEWDECIMAL;[R1] [C4] column_is_rowkey:false;[R1] [C4] column_is_signed:true;[R1] [C4] column_encoding:binary;[R1] [C4] column_is_not_null:false;[R1] [C4] column_value_new:[12345.67890123456789](20);[R1] [C4] column_value_old:[12.34](5);[R1] [C5] column_name:C4;[R1] [C5] column_type:MYSQL_TYPE_OB_NUMBER_FLOAT;[R1] [C5] column_is_rowkey:false;[R1] [C5] column_is_signed:true;[R1] [C5] column_encoding:binary;[R1] [C5] column_is_not_null:false;[R1] [C5] column_value_new:[12350](5);[R1] [C5] column_value_old:[12.34](5);[R1] [C6] column_name:C5;[R1] [C6] column_type:MYSQL_TYPE_OB_NUMBER_FLOAT;[R1] [C6] column_is_rowkey:false;[R1] [C6] column_is_signed:true;[R1] [C6] column_encoding:binary;[R1] [C6] column_is_not_null:false;[R1] [C6] column_value_new:[12345.67890123456789](20);[R1] [C6] column_value_old:[12.34](5);[R1] [C7] column_name:C6;[R1] [C7] column_type:MYSQL_TYPE_VAR_STRING;[R1] [C7] column_is_rowkey:false;[R1] [C7] column_is_signed:true;[R1] [C7] column_encoding:utf8mb4;[R1] [C7] column_is_not_null:false;[R1] [C7] column_value_new:[12345.678901234567890](21);[R1] [C7] column_value_old:[12345.678901234567890](21);[R1] [C8] column_name:C7;[R1] [C8] column_type:MYSQL_TYPE_STRING;[R1] [C8] column_is_rowkey:false;[R1] [C8] column_is_signed:true;[R1] [C8] column_encoding:utf8mb4;[R1] [C8] column_is_not_null:false;[R1] [C8] column_value_new:[12345.678901234567890                                                                               ](100);[R1] [C8] column_value_old:[12.34                                                                                               ](100);$[R2] COMMIT;
update number_1 set c1=c6, c2=c6, c3=c6, c4=c6, c5=c6, c7=c6 where c0 = 56;
select c0, c6, c1, c2, c3, c4, c5, c7 from number_1 where c0 = 56;
C0	C6	C1	C2	C3	C4	C5	C7
56	1234.5678901234567890	1.2345678901234569E+003	1.23456787E+003	1234.567890123456789	1235	1234.567890123456789	1234.5678901234567890                                                                               
ob1.oblog.next;
[R0] BEGIN;[R0] org_cluster_id:1;[R1] record_type:UPDATE;[R1] database_name:oracle.OBLOG_DB;[R1] table_name:NUMBER_1;[R1] log_event:true;[R1] column_count:8;[R1] source_category:SRC_FULL_RECORDED;[R1] source_type:SRC_OCEANBASE_1_0;[R1] has_pk:true;[R1] pk_info:(0);[R1] pks:C0;[R1] has_uk:false;[R1] uk_info:(null);[R1] uks:(null);[R1] [C1] column_name:C0;[R1] [C1] column_type:MYSQL_TYPE_NEWDECIMAL;[R1] [C1] column_is_rowkey:true;[R1] [C1] column_is_signed:true;[R1] [C1] column_encoding:binary;[R1] [C1] column_is_not_null:true;[R1] [C1] column_value_new:[56](2);[R1] [C1] column_value_old:[56](2);[R1] [C2] column_name:C1;[R1] [C2] column_type:MYSQL_TYPE_DOUBLE;[R1] [C2] column_is_rowkey:false;[R1] [C2] column_is_signed:true;[R1] [C2] column_encoding:binary;[R1] [C2] column_is_not_null:false;[R1] [C2] column_value_new:[1.2345678901234569E+003](23);[R1] [C2] column_value_old:[1.234E+001](10);[R1] [C3] column_name:C2;[R1] [C3] column_type:MYSQL_TYPE_FLOAT;[R1] [C3] column_is_rowkey:false;[R1] [C3] column_is_signed:true;[R1] [C3] column_encoding:binary;[R1] [C3] column_is_not_null:false;[R1] [C3] column_value_new:[1.23456787E+003](15);[R1] [C3] column_value_old:[1.23400002E+001](15);[R1] [C4] column_name:C3;[R1] [C4] column_type:MYSQL_TYPE_NEWDECIMAL;[R1] [C4] column_is_rowkey:false;[R1] [C4] column_is_signed:true;[R1] [C4] column_encoding:binary;[R1] [C4] column_is_not_null:false;[R1] [C4] column_value_new:[1234.567890123456789](20);[R1] [C4] column_value_old:[12.34](5);[R1] [C5] column_name:C4;[R1] [C5] column_type:MYSQL_TYPE_OB_NUMBER_FLOAT;[R1] [C5] column_is_rowkey:false;[R1] [C5] column_is_signed:true;[R1] [C5] column_encoding:binary;[R1] [C5] column_is_not_null:false;[R1] [C5] column_value_new:[1235](4);[R1] [C5] column_value_old:[12.34](5);[R1] [C6] column_name:C5;[R1] [C6] column_type:MYSQL_TYPE_OB_NUMBER_FLOAT;[R1] [C6] column_is_rowkey:false;[R1] [C6] column_is_signed:true;[R1] [C6] column_encoding:binary;[R1] [C6] column_is_not_null:false;[R1] [C6] column_value_new:[1234.567890123456789](20);[R1] [C6] column_value_old:[12.34](5);[R1] [C7] column_name:C6;[R1] [C7] column_type:MYSQL_TYPE_VAR_STRING;[R1] [C7] column_is_rowkey:false;[R1] [C7] column_is_signed:true;[R1] [C7] column_encoding:utf8mb4;[R1] [C7] column_is_not_null:false;[R1] [C7] column_value_new:[1234.5678901234567890](21);[R1] [C7] column_value_old:[1234.5678901234567890](21);[R1] [C8] column_name:C7;[R1] [C8] column_type:MYSQL_TYPE_STRING;[R1] [C8] column_is_rowkey:false;[R1] [C8] column_is_signed:true;[R1] [C8] column_encoding:utf8mb4;[R1] [C8] column_is_not_null:false;[R1] [C8] column_value_new:[1234.5678901234567890                                                                               ](100);[R1] [C8] column_value_old:[12.34                                                                                               ](100);$[R2] COMMIT;
update number_1 set c1=c6, c2=c6, c3=c6, c4=c6, c5=c6, c7=c6 where c0 = 57;
select c0, c6, c1, c2, c3, c4, c5, c7 from number_1 where c0 = 57;
C0	C6	C1	C2	C3	C4	C5	C7
57	123.45678901234567890	1.2345678901234568E+002	1.23456787E+002	123.4567890123456789	123.5	123.4567890123456789	123.45678901234567890                                                                               
ob1.oblog.next;
[R0] BEGIN;[R0] org_cluster_id:1;[R1] record_type:UPDATE;[R1] database_name:oracle.OBLOG_DB;[R1] table_name:NUMBER_1;[R1] log_event:true;[R1] column_count:8;[R1] source_category:SRC_FULL_RECORDED;[R1] source_type:SRC_OCEANBASE_1_0;[R1] has_pk:true;[R1] pk_info:(0);[R1] pks:C0;[R1] has_uk:false;[R1] uk_info:(null);[R1] uks:(null);[R1] [C1] column_name:C0;[R1] [C1] column_type:MYSQL_TYPE_NEWDECIMAL;[R1] [C1] column_is_rowkey:true;[R1] [C1] column_is_signed:true;[R1] [C1] column_encoding:binary;[R1] [C1] column_is_not_null:true;[R1] [C1] column_value_new:[57](2);[R1] [C1] column_value_old:[57](2);[R1] [C2] column_name:C1;[R1] [C2] column_type:MYSQL_TYPE_DOUBLE;[R1] [C2] column_is_rowkey:false;[R1] [C2] column_is_signed:true;[R1] [C2] column_encoding:binary;[R1] [C2] column_is_not_null:false;[R1] [C2] column_value_new:[1.2345678901234568E+002](23);[R1] [C2] column_value_old:[1.234E+001](10);[R1] [C3] column_name:C2;[R1] [C3] column_type:MYSQL_TYPE_FLOAT;[R1] [C3] column_is_rowkey:false;[R1] [C3] column_is_signed:true;[R1] [C3] column_encoding:binary;[R1] [C3] column_is_not_null:false;[R1] [C3] column_value_new:[1.23456787E+002](15);[R1] [C3] column_value_old:[1.23400002E+001](15);[R1] [C4] column_name:C3;[R1] [C4] column_type:MYSQL_TYPE_NEWDECIMAL;[R1] [C4] column_is_rowkey:false;[R1] [C4] column_is_signed:true;[R1] [C4] column_encoding:binary;[R1] [C4] column_is_not_null:false;[R1] [C4] column_value_new:[123.4567890123456789](20);[R1] [C4] column_value_old:[12.34](5);[R1] [C5] column_name:C4;[R1] [C5] column_type:MYSQL_TYPE_OB_NUMBER_FLOAT;[R1] [C5] column_is_rowkey:false;[R1] [C5] column_is_signed:true;[R1] [C5] column_encoding:binary;[R1] [C5] column_is_not_null:false;[R1] [C5] column_value_new:[123.5](5);[R1] [C5] column_value_old:[12.34](5);[R1] [C6] column_name:C5;[R1] [C6] column_type:MYSQL_TYPE_OB_NUMBER_FLOAT;[R1] [C6] column_is_rowkey:false;[R1] [C6] column_is_signed:true;[R1] [C6] column_encoding:binary;[R1] [C6] column_is_not_null:false;[R1] [C6] column_value_new:[123.4567890123456789](20);[R1] [C6] column_value_old:[12.34](5);[R1] [C7] column_name:C6;[R1] [C7] column_type:MYSQL_TYPE_VAR_STRING;[R1] [C7] column_is_rowkey:false;[R1] [C7] column_is_signed:true;[R1] [C7] column_encoding:utf8mb4;[R1] [C7] column_is_not_null:false;[R1] [C7] column_value_new:[123.45678901234567890](21);[R1] [C7] column_value_old:[123.45678901234567890](21);[R1] [C8] column_name:C7;[R1] [C8] column_type:MYSQL_TYPE_STRING;[R1] [C8] column_is_rowkey:false;[R1] [C8] column_is_signed:true;[R1] [C8] column_encoding:utf8mb4;[R1] [C8] column_is_not_null:false;[R1] [C8] column_value_new:[123.45678901234567890                                                                               ](100);[R1] [C8] column_value_old:[12.34                                                                                               ](100);$[R2] COMMIT;
update number_1 set c1=c6, c2=c6, c3=c6, c4=c6, c5=c6, c7=c6 where c0 = 58;
select c0, c6, c1, c2, c3, c4, c5, c7 from number_1 where c0 = 58;
C0	C6	C1	C2	C3	C4	C5	C7
58	12.345678901234567890	1.2345678901234567E+001	1.23456793E+001	12.34567890123456789	12.35	12.34567890123456789	12.345678901234567890                                                                               
ob1.oblog.next;
[R0] BEGIN;[R0] org_cluster_id:1;[R1] record_type:UPDATE;[R1] database_name:oracle.OBLOG_DB;[R1] table_name:NUMBER_1;[R1] log_event:true;[R1] column_count:8;[R1] source_category:SRC_FULL_RECORDED;[R1] source_type:SRC_OCEANBASE_1_0;[R1] has_pk:true;[R1] pk_info:(0);[R1] pks:C0;[R1] has_uk:false;[R1] uk_info:(null);[R1] uks:(null);[R1] [C1] column_name:C0;[R1] [C1] column_type:MYSQL_TYPE_NEWDECIMAL;[R1] [C1] column_is_rowkey:true;[R1] [C1] column_is_signed:true;[R1] [C1] column_encoding:binary;[R1] [C1] column_is_not_null:true;[R1] [C1] column_value_new:[58](2);[R1] [C1] column_value_old:[58](2);[R1] [C2] column_name:C1;[R1] [C2] column_type:MYSQL_TYPE_DOUBLE;[R1] [C2] column_is_rowkey:false;[R1] [C2] column_is_signed:true;[R1] [C2] column_encoding:binary;[R1] [C2] column_is_not_null:false;[R1] [C2] column_value_new:[1.2345678901234567E+001](23);[R1] [C2] column_value_old:[1.234E+001](10);[R1] [C3] column_name:C2;[R1] [C3] column_type:MYSQL_TYPE_FLOAT;[R1] [C3] column_is_rowkey:false;[R1] [C3] column_is_signed:true;[R1] [C3] column_encoding:binary;[R1] [C3] column_is_not_null:false;[R1] [C3] column_value_new:[1.23456793E+001](15);[R1] [C3] column_value_old:[1.23400002E+001](15);[R1] [C4] column_name:C3;[R1] [C4] column_type:MYSQL_TYPE_NEWDECIMAL;[R1] [C4] column_is_rowkey:false;[R1] [C4] column_is_signed:true;[R1] [C4] column_encoding:binary;[R1] [C4] column_is_not_null:false;[R1] [C4] column_value_new:[12.34567890123456789](20);[R1] [C4] column_value_old:[12.34](5);[R1] [C5] column_name:C4;[R1] [C5] column_type:MYSQL_TYPE_OB_NUMBER_FLOAT;[R1] [C5] column_is_rowkey:false;[R1] [C5] column_is_signed:true;[R1] [C5] column_encoding:binary;[R1] [C5] column_is_not_null:false;[R1] [C5] column_value_new:[12.35](5);[R1] [C5] column_value_old:[12.34](5);[R1] [C6] column_name:C5;[R1] [C6] column_type:MYSQL_TYPE_OB_NUMBER_FLOAT;[R1] [C6] column_is_rowkey:false;[R1] [C6] column_is_signed:true;[R1] [C6] column_encoding:binary;[R1] [C6] column_is_not_null:false;[R1] [C6] column_value_new:[12.34567890123456789](20);[R1] [C6] column_value_old:[12.34](5);[R1] [C7] column_name:C6;[R1] [C7] column_type:MYSQL_TYPE_VAR_STRING;[R1] [C7] column_is_rowkey:false;[R1] [C7] column_is_signed:true;[R1] [C7] column_encoding:utf8mb4;[R1] [C7] column_is_not_null:false;[R1] [C7] column_value_new:[12.345678901234567890](21);[R1] [C7] column_value_old:[12.345678901234567890](21);[R1] [C8] column_name:C7;[R1] [C8] column_type:MYSQL_TYPE_STRING;[R1] [C8] column_is_rowkey:false;[R1] [C8] column_is_signed:true;[R1] [C8] column_encoding:utf8mb4;[R1] [C8] column_is_not_null:false;[R1] [C8] column_value_new:[12.345678901234567890                                                                               ](100);[R1] [C8] column_value_old:[12.34                                                                                               ](100);$[R2] COMMIT;
update number_1 set c1=c6, c2=c6, c3=c6, c4=c6, c5=c6, c7=c6 where c0 = 59;
select c0, c6, c1, c2, c3, c4, c5, c7 from number_1 where c0 = 59;
C0	C6	C1	C2	C3	C4	C5	C7
59	1.2345678901234567890	1.2345678901234567E+000	1.23456788E+000	1.234567890123456789	1.235	1.234567890123456789	1.2345678901234567890                                                                               
ob1.oblog.next;
[R0] BEGIN;[R0] org_cluster_id:1;[R1] record_type:UPDATE;[R1] database_name:oracle.OBLOG_DB;[R1] table_name:NUMBER_1;[R1] log_event:true;[R1] column_count:8;[R1] source_category:SRC_FULL_RECORDED;[R1] source_type:SRC_OCEANBASE_1_0;[R1] has_pk:true;[R1] pk_info:(0);[R1] pks:C0;[R1] has_uk:false;[R1] uk_info:(null);[R1] uks:(null);[R1] [C1] column_name:C0;[R1] [C1] column_type:MYSQL_TYPE_NEWDECIMAL;[R1] [C1] column_is_rowkey:true;[R1] [C1] column_is_signed:true;[R1] [C1] column_encoding:binary;[R1] [C1] column_is_not_null:true;[R1] [C1] column_value_new:[59](2);[R1] [C1] column_value_old:[59](2);[R1] [C2] column_name:C1;[R1] [C2] column_type:MYSQL_TYPE_DOUBLE;[R1] [C2] column_is_rowkey:false;[R1] [C2] column_is_signed:true;[R1] [C2] column_encoding:binary;[R1] [C2] column_is_not_null:false;[R1] [C2] column_value_new:[1.2345678901234567E+000](23);[R1] [C2] column_value_old:[1.234E+001](10);[R1] [C3] column_name:C2;[R1] [C3] column_type:MYSQL_TYPE_FLOAT;[R1] [C3] column_is_rowkey:false;[R1] [C3] column_is_signed:true;[R1] [C3] column_encoding:binary;[R1] [C3] column_is_not_null:false;[R1] [C3] column_value_new:[1.23456788E+000](15);[R1] [C3] column_value_old:[1.23400002E+001](15);[R1] [C4] column_name:C3;[R1] [C4] column_type:MYSQL_TYPE_NEWDECIMAL;[R1] [C4] column_is_rowkey:false;[R1] [C4] column_is_signed:true;[R1] [C4] column_encoding:binary;[R1] [C4] column_is_not_null:false;[R1] [C4] column_value_new:[1.234567890123456789](20);[R1] [C4] column_value_old:[12.34](5);[R1] [C5] column_name:C4;[R1] [C5] column_type:MYSQL_TYPE_OB_NUMBER_FLOAT;[R1] [C5] column_is_rowkey:false;[R1] [C5] column_is_signed:true;[R1] [C5] column_encoding:binary;[R1] [C5] column_is_not_null:false;[R1] [C5] column_value_new:[1.235](5);[R1] [C5] column_value_old:[12.34](5);[R1] [C6] column_name:C5;[R1] [C6] column_type:MYSQL_TYPE_OB_NUMBER_FLOAT;[R1] [C6] column_is_rowkey:false;[R1] [C6] column_is_signed:true;[R1] [C6] column_encoding:binary;[R1] [C6] column_is_not_null:false;[R1] [C6] column_value_new:[1.234567890123456789](20);[R1] [C6] column_value_old:[12.34](5);[R1] [C7] column_name:C6;[R1] [C7] column_type:MYSQL_TYPE_VAR_STRING;[R1] [C7] column_is_rowkey:false;[R1] [C7] column_is_signed:true;[R1] [C7] column_encoding:utf8mb4;[R1] [C7] column_is_not_null:false;[R1] [C7] column_value_new:[1.2345678901234567890](21);[R1] [C7] column_value_old:[1.2345678901234567890](21);[R1] [C8] column_name:C7;[R1] [C8] column_type:MYSQL_TYPE_STRING;[R1] [C8] column_is_rowkey:false;[R1] [C8] column_is_signed:true;[R1] [C8] column_encoding:utf8mb4;[R1] [C8] column_is_not_null:false;[R1] [C8] column_value_new:[1.2345678901234567890                                                                               ](100);[R1] [C8] column_value_old:[12.34                                                                                               ](100);$[R2] COMMIT;
update number_1 set c1=c6, c2=c6, c3=c6, c4=c6, c5=c6, c7=c6 where c0 = 60;
select c0, c6, c1, c2, c3, c4, c5, c7 from number_1 where c0 = 60;
C0	C6	C1	C2	C3	C4	C5	C7
60	0.1234567890123456789	1.2345678901234568E-001	1.23456791E-001	.1234567890123456789	.1235	.1234567890123456789	0.1234567890123456789                                                                               
ob1.oblog.next;
[R0] BEGIN;[R0] org_cluster_id:1;[R1] record_type:UPDATE;[R1] database_name:oracle.OBLOG_DB;[R1] table_name:NUMBER_1;[R1] log_event:true;[R1] column_count:8;[R1] source_category:SRC_FULL_RECORDED;[R1] source_type:SRC_OCEANBASE_1_0;[R1] has_pk:true;[R1] pk_info:(0);[R1] pks:C0;[R1] has_uk:false;[R1] uk_info:(null);[R1] uks:(null);[R1] [C1] column_name:C0;[R1] [C1] column_type:MYSQL_TYPE_NEWDECIMAL;[R1] [C1] column_is_rowkey:true;[R1] [C1] column_is_signed:true;[R1] [C1] column_encoding:binary;[R1] [C1] column_is_not_null:true;[R1] [C1] column_value_new:[60](2);[R1] [C1] column_value_old:[60](2);[R1] [C2] column_name:C1;[R1] [C2] column_type:MYSQL_TYPE_DOUBLE;[R1] [C2] column_is_rowkey:false;[R1] [C2] column_is_signed:true;[R1] [C2] column_encoding:binary;[R1] [C2] column_is_not_null:false;[R1] [C2] column_value_new:[1.2345678901234568E-001](23);[R1] [C2] column_value_old:[1.234E+001](10);[R1] [C3] column_name:C2;[R1] [C3] column_type:MYSQL_TYPE_FLOAT;[R1] [C3] column_is_rowkey:false;[R1] [C3] column_is_signed:true;[R1] [C3] column_encoding:binary;[R1] [C3] column_is_not_null:false;[R1] [C3] column_value_new:[1.23456791E-001](15);[R1] [C3] column_value_old:[1.23400002E+001](15);[R1] [C4] column_name:C3;[R1] [C4] column_type:MYSQL_TYPE_NEWDECIMAL;[R1] [C4] column_is_rowkey:false;[R1] [C4] column_is_signed:true;[R1] [C4] column_encoding:binary;[R1] [C4] column_is_not_null:false;[R1] [C4] column_value_new:[.1234567890123456789](20);[R1] [C4] column_value_old:[12.34](5);[R1] [C5] column_name:C4;[R1] [C5] column_type:MYSQL_TYPE_OB_NUMBER_FLOAT;[R1] [C5] column_is_rowkey:false;[R1] [C5] column_is_signed:true;[R1] [C5] column_encoding:binary;[R1] [C5] column_is_not_null:false;[R1] [C5] column_value_new:[.1235](5);[R1] [C5] column_value_old:[12.34](5);[R1] [C6] column_name:C5;[R1] [C6] column_type:MYSQL_TYPE_OB_NUMBER_FLOAT;[R1] [C6] column_is_rowkey:false;[R1] [C6] column_is_signed:true;[R1] [C6] column_encoding:binary;[R1] [C6] column_is_not_null:false;[R1] [C6] column_value_new:[.1234567890123456789](20);[R1] [C6] column_value_old:[12.34](5);[R1] [C7] column_name:C6;[R1] [C7] column_type:MYSQL_TYPE_VAR_STRING;[R1] [C7] column_is_rowkey:false;[R1] [C7] column_is_signed:true;[R1] [C7] column_encoding:utf8mb4;[R1] [C7] column_is_not_null:false;[R1] [C7] column_value_new:[0.1234567890123456789](21);[R1] [C7] column_value_old:[0.1234567890123456789](21);[R1] [C8] column_name:C7;[R1] [C8] column_type:MYSQL_TYPE_STRING;[R1] [C8] column_is_rowkey:false;[R1] [C8] column_is_signed:true;[R1] [C8] column_encoding:utf8mb4;[R1] [C8] column_is_not_null:false;[R1] [C8] column_value_new:[0.1234567890123456789                                                                               ](100);[R1] [C8] column_value_old:[12.34                                                                                               ](100);$[R2] COMMIT;
update number_1 set c1=c6, c2=c6, c3=c6, c4=c6, c5=c6, c7=c6 where c0 = 61;
select c0, c6, c1, c2, c3, c4, c5, c7 from number_1 where c0 = 61;
C0	C6	C1	C2	C3	C4	C5	C7
61	0.1234567890123456789	1.2345678901234568E-001	1.23456791E-001	.1234567890123456789	.1235	.1234567890123456789	0.1234567890123456789                                                                               
ob1.oblog.next;
[R0] BEGIN;[R0] org_cluster_id:1;[R1] record_type:UPDATE;[R1] database_name:oracle.OBLOG_DB;[R1] table_name:NUMBER_1;[R1] log_event:true;[R1] column_count:8;[R1] source_category:SRC_FULL_RECORDED;[R1] source_type:SRC_OCEANBASE_1_0;[R1] has_pk:true;[R1] pk_info:(0);[R1] pks:C0;[R1] has_uk:false;[R1] uk_info:(null);[R1] uks:(null);[R1] [C1] column_name:C0;[R1] [C1] column_type:MYSQL_TYPE_NEWDECIMAL;[R1] [C1] column_is_rowkey:true;[R1] [C1] column_is_signed:true;[R1] [C1] column_encoding:binary;[R1] [C1] column_is_not_null:true;[R1] [C1] column_value_new:[61](2);[R1] [C1] column_value_old:[61](2);[R1] [C2] column_name:C1;[R1] [C2] column_type:MYSQL_TYPE_DOUBLE;[R1] [C2] column_is_rowkey:false;[R1] [C2] column_is_signed:true;[R1] [C2] column_encoding:binary;[R1] [C2] column_is_not_null:false;[R1] [C2] column_value_new:[1.2345678901234568E-001](23);[R1] [C2] column_value_old:[1.234E+001](10);[R1] [C3] column_name:C2;[R1] [C3] column_type:MYSQL_TYPE_FLOAT;[R1] [C3] column_is_rowkey:false;[R1] [C3] column_is_signed:true;[R1] [C3] column_encoding:binary;[R1] [C3] column_is_not_null:false;[R1] [C3] column_value_new:[1.23456791E-001](15);[R1] [C3] column_value_old:[1.23400002E+001](15);[R1] [C4] column_name:C3;[R1] [C4] column_type:MYSQL_TYPE_NEWDECIMAL;[R1] [C4] column_is_rowkey:false;[R1] [C4] column_is_signed:true;[R1] [C4] column_encoding:binary;[R1] [C4] column_is_not_null:false;[R1] [C4] column_value_new:[.1234567890123456789](20);[R1] [C4] column_value_old:[12.34](5);[R1] [C5] column_name:C4;[R1] [C5] column_type:MYSQL_TYPE_OB_NUMBER_FLOAT;[R1] [C5] column_is_rowkey:false;[R1] [C5] column_is_signed:true;[R1] [C5] column_encoding:binary;[R1] [C5] column_is_not_null:false;[R1] [C5] column_value_new:[.1235](5);[R1] [C5] column_value_old:[12.34](5);[R1] [C6] column_name:C5;[R1] [C6] column_type:MYSQL_TYPE_OB_NUMBER_FLOAT;[R1] [C6] column_is_rowkey:false;[R1] [C6] column_is_signed:true;[R1] [C6] column_encoding:binary;[R1] [C6] column_is_not_null:false;[R1] [C6] column_value_new:[.1234567890123456789](20);[R1] [C6] column_value_old:[12.34](5);[R1] [C7] column_name:C6;[R1] [C7] column_type:MYSQL_TYPE_VAR_STRING;[R1] [C7] column_is_rowkey:false;[R1] [C7] column_is_signed:true;[R1] [C7] column_encoding:utf8mb4;[R1] [C7] column_is_not_null:false;[R1] [C7] column_value_new:[0.1234567890123456789](21);[R1] [C7] column_value_old:[0.1234567890123456789](21);[R1] [C8] column_name:C7;[R1] [C8] column_type:MYSQL_TYPE_STRING;[R1] [C8] column_is_rowkey:false;[R1] [C8] column_is_signed:true;[R1] [C8] column_encoding:utf8mb4;[R1] [C8] column_is_not_null:false;[R1] [C8] column_value_new:[0.1234567890123456789                                                                               ](100);[R1] [C8] column_value_old:[12.34                                                                                               ](100);$[R2] COMMIT;
update number_1 set c1=c6, c2=c6, c3=c6, c4=c6, c5=c6, c7=c6 where c0 = 62;
select c0, c6, c1, c2, c3, c4, c5, c7 from number_1 where c0 = 62;
C0	C6	C1	C2	C3	C4	C5	C7
62	0.123456789012345678	1.2345678901234568E-001	1.23456791E-001	.123456789012345678	.1235	.123456789012345678	0.123456789012345678                                                                                
ob1.oblog.next;
[R0] BEGIN;[R0] org_cluster_id:1;[R1] record_type:UPDATE;[R1] database_name:oracle.OBLOG_DB;[R1] table_name:NUMBER_1;[R1] log_event:true;[R1] column_count:8;[R1] source_category:SRC_FULL_RECORDED;[R1] source_type:SRC_OCEANBASE_1_0;[R1] has_pk:true;[R1] pk_info:(0);[R1] pks:C0;[R1] has_uk:false;[R1] uk_info:(null);[R1] uks:(null);[R1] [C1] column_name:C0;[R1] [C1] column_type:MYSQL_TYPE_NEWDECIMAL;[R1] [C1] column_is_rowkey:true;[R1] [C1] column_is_signed:true;[R1] [C1] column_encoding:binary;[R1] [C1] column_is_not_null:true;[R1] [C1] column_value_new:[62](2);[R1] [C1] column_value_old:[62](2);[R1] [C2] column_name:C1;[R1] [C2] column_type:MYSQL_TYPE_DOUBLE;[R1] [C2] column_is_rowkey:false;[R1] [C2] column_is_signed:true;[R1] [C2] column_encoding:binary;[R1] [C2] column_is_not_null:false;[R1] [C2] column_value_new:[1.2345678901234568E-001](23);[R1] [C2] column_value_old:[1.234E+001](10);[R1] [C3] column_name:C2;[R1] [C3] column_type:MYSQL_TYPE_FLOAT;[R1] [C3] column_is_rowkey:false;[R1] [C3] column_is_signed:true;[R1] [C3] column_encoding:binary;[R1] [C3] column_is_not_null:false;[R1] [C3] column_value_new:[1.23456791E-001](15);[R1] [C3] column_value_old:[1.23400002E+001](15);[R1] [C4] column_name:C3;[R1] [C4] column_type:MYSQL_TYPE_NEWDECIMAL;[R1] [C4] column_is_rowkey:false;[R1] [C4] column_is_signed:true;[R1] [C4] column_encoding:binary;[R1] [C4] column_is_not_null:false;[R1] [C4] column_value_new:[.123456789012345678](19);[R1] [C4] column_value_old:[12.34](5);[R1] [C5] column_name:C4;[R1] [C5] column_type:MYSQL_TYPE_OB_NUMBER_FLOAT;[R1] [C5] column_is_rowkey:false;[R1] [C5] column_is_signed:true;[R1] [C5] column_encoding:binary;[R1] [C5] column_is_not_null:false;[R1] [C5] column_value_new:[.1235](5);[R1] [C5] column_value_old:[12.34](5);[R1] [C6] column_name:C5;[R1] [C6] column_type:MYSQL_TYPE_OB_NUMBER_FLOAT;[R1] [C6] column_is_rowkey:false;[R1] [C6] column_is_signed:true;[R1] [C6] column_encoding:binary;[R1] [C6] column_is_not_null:false;[R1] [C6] column_value_new:[.123456789012345678](19);[R1] [C6] column_value_old:[12.34](5);[R1] [C7] column_name:C6;[R1] [C7] column_type:MYSQL_TYPE_VAR_STRING;[R1] [C7] column_is_rowkey:false;[R1] [C7] column_is_signed:true;[R1] [C7] column_encoding:utf8mb4;[R1] [C7] column_is_not_null:false;[R1] [C7] column_value_new:[0.123456789012345678](20);[R1] [C7] column_value_old:[0.123456789012345678](20);[R1] [C8] column_name:C7;[R1] [C8] column_type:MYSQL_TYPE_STRING;[R1] [C8] column_is_rowkey:false;[R1] [C8] column_is_signed:true;[R1] [C8] column_encoding:utf8mb4;[R1] [C8] column_is_not_null:false;[R1] [C8] column_value_new:[0.123456789012345678                                                                                ](100);[R1] [C8] column_value_old:[12.34                                                                                               ](100);$[R2] COMMIT;
update number_1 set c1=c6, c2=c6, c3=c6, c4=c6, c5=c6, c7=c6 where c0 = 63;
select c0, c6, c1, c2, c3, c4, c5, c7 from number_1 where c0 = 63;
C0	C6	C1	C2	C3	C4	C5	C7
63	0.12345678901234567	1.2345678901234566E-001	1.23456791E-001	.12345678901234567	.1235	.12345678901234567	0.12345678901234567                                                                                 
ob1.oblog.next;
[R0] BEGIN;[R0] org_cluster_id:1;[R1] record_type:UPDATE;[R1] database_name:oracle.OBLOG_DB;[R1] table_name:NUMBER_1;[R1] log_event:true;[R1] column_count:8;[R1] source_category:SRC_FULL_RECORDED;[R1] source_type:SRC_OCEANBASE_1_0;[R1] has_pk:true;[R1] pk_info:(0);[R1] pks:C0;[R1] has_uk:false;[R1] uk_info:(null);[R1] uks:(null);[R1] [C1] column_name:C0;[R1] [C1] column_type:MYSQL_TYPE_NEWDECIMAL;[R1] [C1] column_is_rowkey:true;[R1] [C1] column_is_signed:true;[R1] [C1] column_encoding:binary;[R1] [C1] column_is_not_null:true;[R1] [C1] column_value_new:[63](2);[R1] [C1] column_value_old:[63](2);[R1] [C2] column_name:C1;[R1] [C2] column_type:MYSQL_TYPE_DOUBLE;[R1] [C2] column_is_rowkey:false;[R1] [C2] column_is_signed:true;[R1] [C2] column_encoding:binary;[R1] [C2] column_is_not_null:false;[R1] [C2] column_value_new:[1.2345678901234566E-001](23);[R1] [C2] column_value_old:[1.234E+001](10);[R1] [C3] column_name:C2;[R1] [C3] column_type:MYSQL_TYPE_FLOAT;[R1] [C3] column_is_rowkey:false;[R1] [C3] column_is_signed:true;[R1] [C3] column_encoding:binary;[R1] [C3] column_is_not_null:false;[R1] [C3] column_value_new:[1.23456791E-001](15);[R1] [C3] column_value_old:[1.23400002E+001](15);[R1] [C4] column_name:C3;[R1] [C4] column_type:MYSQL_TYPE_NEWDECIMAL;[R1] [C4] column_is_rowkey:false;[R1] [C4] column_is_signed:true;[R1] [C4] column_encoding:binary;[R1] [C4] column_is_not_null:false;[R1] [C4] column_value_new:[.12345678901234567](18);[R1] [C4] column_value_old:[12.34](5);[R1] [C5] column_name:C4;[R1] [C5] column_type:MYSQL_TYPE_OB_NUMBER_FLOAT;[R1] [C5] column_is_rowkey:false;[R1] [C5] column_is_signed:true;[R1] [C5] column_encoding:binary;[R1] [C5] column_is_not_null:false;[R1] [C5] column_value_new:[.1235](5);[R1] [C5] column_value_old:[12.34](5);[R1] [C6] column_name:C5;[R1] [C6] column_type:MYSQL_TYPE_OB_NUMBER_FLOAT;[R1] [C6] column_is_rowkey:false;[R1] [C6] column_is_signed:true;[R1] [C6] column_encoding:binary;[R1] [C6] column_is_not_null:false;[R1] [C6] column_value_new:[.12345678901234567](18);[R1] [C6] column_value_old:[12.34](5);[R1] [C7] column_name:C6;[R1] [C7] column_type:MYSQL_TYPE_VAR_STRING;[R1] [C7] column_is_rowkey:false;[R1] [C7] column_is_signed:true;[R1] [C7] column_encoding:utf8mb4;[R1] [C7] column_is_not_null:false;[R1] [C7] column_value_new:[0.12345678901234567](19);[R1] [C7] column_value_old:[0.12345678901234567](19);[R1] [C8] column_name:C7;[R1] [C8] column_type:MYSQL_TYPE_STRING;[R1] [C8] column_is_rowkey:false;[R1] [C8] column_is_signed:true;[R1] [C8] column_encoding:utf8mb4;[R1] [C8] column_is_not_null:false;[R1] [C8] column_value_new:[0.12345678901234567                                                                                 ](100);[R1] [C8] column_value_old:[12.34                                                                                               ](100);$[R2] COMMIT;
update number_1 set c1=c6, c2=c6, c3=c6, c4=c6, c5=c6, c7=c6 where c0 = 64;
select c0, c6, c1, c2, c3, c4, c5, c7 from number_1 where c0 = 64;
C0	C6	C1	C2	C3	C4	C5	C7
64	0.1234567890123456	1.2345678901234559E-001	1.23456791E-001	.1234567890123456	.1235	.1234567890123456	0.1234567890123456                                                                                  
ob1.oblog.next;
[R0] BEGIN;[R0] org_cluster_id:1;[R1] record_type:UPDATE;[R1] database_name:oracle.OBLOG_DB;[R1] table_name:NUMBER_1;[R1] log_event:true;[R1] column_count:8;[R1] source_category:SRC_FULL_RECORDED;[R1] source_type:SRC_OCEANBASE_1_0;[R1] has_pk:true;[R1] pk_info:(0);[R1] pks:C0;[R1] has_uk:false;[R1] uk_info:(null);[R1] uks:(null);[R1] [C1] column_name:C0;[R1] [C1] column_type:MYSQL_TYPE_NEWDECIMAL;[R1] [C1] column_is_rowkey:true;[R1] [C1] column_is_signed:true;[R1] [C1] column_encoding:binary;[R1] [C1] column_is_not_null:true;[R1] [C1] column_value_new:[64](2);[R1] [C1] column_value_old:[64](2);[R1] [C2] column_name:C1;[R1] [C2] column_type:MYSQL_TYPE_DOUBLE;[R1] [C2] column_is_rowkey:false;[R1] [C2] column_is_signed:true;[R1] [C2] column_encoding:binary;[R1] [C2] column_is_not_null:false;[R1] [C2] column_value_new:[1.2345678901234559E-001](23);[R1] [C2] column_value_old:[1.234E+001](10);[R1] [C3] column_name:C2;[R1] [C3] column_type:MYSQL_TYPE_FLOAT;[R1] [C3] column_is_rowkey:false;[R1] [C3] column_is_signed:true;[R1] [C3] column_encoding:binary;[R1] [C3] column_is_not_null:false;[R1] [C3] column_value_new:[1.23456791E-001](15);[R1] [C3] column_value_old:[1.23400002E+001](15);[R1] [C4] column_name:C3;[R1] [C4] column_type:MYSQL_TYPE_NEWDECIMAL;[R1] [C4] column_is_rowkey:false;[R1] [C4] column_is_signed:true;[R1] [C4] column_encoding:binary;[R1] [C4] column_is_not_null:false;[R1] [C4] column_value_new:[.1234567890123456](17);[R1] [C4] column_value_old:[12.34](5);[R1] [C5] column_name:C4;[R1] [C5] column_type:MYSQL_TYPE_OB_NUMBER_FLOAT;[R1] [C5] column_is_rowkey:false;[R1] [C5] column_is_signed:true;[R1] [C5] column_encoding:binary;[R1] [C5] column_is_not_null:false;[R1] [C5] column_value_new:[.1235](5);[R1] [C5] column_value_old:[12.34](5);[R1] [C6] column_name:C5;[R1] [C6] column_type:MYSQL_TYPE_OB_NUMBER_FLOAT;[R1] [C6] column_is_rowkey:false;[R1] [C6] column_is_signed:true;[R1] [C6] column_encoding:binary;[R1] [C6] column_is_not_null:false;[R1] [C6] column_value_new:[.1234567890123456](17);[R1] [C6] column_value_old:[12.34](5);[R1] [C7] column_name:C6;[R1] [C7] column_type:MYSQL_TYPE_VAR_STRING;[R1] [C7] column_is_rowkey:false;[R1] [C7] column_is_signed:true;[R1] [C7] column_encoding:utf8mb4;[R1] [C7] column_is_not_null:false;[R1] [C7] column_value_new:[0.1234567890123456](18);[R1] [C7] column_value_old:[0.1234567890123456](18);[R1] [C8] column_name:C7;[R1] [C8] column_type:MYSQL_TYPE_STRING;[R1] [C8] column_is_rowkey:false;[R1] [C8] column_is_signed:true;[R1] [C8] column_encoding:utf8mb4;[R1] [C8] column_is_not_null:false;[R1] [C8] column_value_new:[0.1234567890123456                                                                                  ](100);[R1] [C8] column_value_old:[12.34                                                                                               ](100);$[R2] COMMIT;
update number_1 set c1=c6, c2=c6, c3=c6, c4=c6, c5=c6, c7=c6 where c0 = 65;
select c0, c6, c1, c2, c3, c4, c5, c7 from number_1 where c0 = 65;
C0	C6	C1	C2	C3	C4	C5	C7
65	0.123456789012345	1.23456789012345E-001	1.23456791E-001	.123456789012345	.1235	.123456789012345	0.123456789012345                                                                                   
ob1.oblog.next;
[R0] BEGIN;[R0] org_cluster_id:1;[R1] record_type:UPDATE;[R1] database_name:oracle.OBLOG_DB;[R1] table_name:NUMBER_1;[R1] log_event:true;[R1] column_count:8;[R1] source_category:SRC_FULL_RECORDED;[R1] source_type:SRC_OCEANBASE_1_0;[R1] has_pk:true;[R1] pk_info:(0);[R1] pks:C0;[R1] has_uk:false;[R1] uk_info:(null);[R1] uks:(null);[R1] [C1] column_name:C0;[R1] [C1] column_type:MYSQL_TYPE_NEWDECIMAL;[R1] [C1] column_is_rowkey:true;[R1] [C1] column_is_signed:true;[R1] [C1] column_encoding:binary;[R1] [C1] column_is_not_null:true;[R1] [C1] column_value_new:[65](2);[R1] [C1] column_value_old:[65](2);[R1] [C2] column_name:C1;[R1] [C2] column_type:MYSQL_TYPE_DOUBLE;[R1] [C2] column_is_rowkey:false;[R1] [C2] column_is_signed:true;[R1] [C2] column_encoding:binary;[R1] [C2] column_is_not_null:false;[R1] [C2] column_value_new:[1.23456789012345E-001](21);[R1] [C2] column_value_old:[1.234E+001](10);[R1] [C3] column_name:C2;[R1] [C3] column_type:MYSQL_TYPE_FLOAT;[R1] [C3] column_is_rowkey:false;[R1] [C3] column_is_signed:true;[R1] [C3] column_encoding:binary;[R1] [C3] column_is_not_null:false;[R1] [C3] column_value_new:[1.23456791E-001](15);[R1] [C3] column_value_old:[1.23400002E+001](15);[R1] [C4] column_name:C3;[R1] [C4] column_type:MYSQL_TYPE_NEWDECIMAL;[R1] [C4] column_is_rowkey:false;[R1] [C4] column_is_signed:true;[R1] [C4] column_encoding:binary;[R1] [C4] column_is_not_null:false;[R1] [C4] column_value_new:[.123456789012345](16);[R1] [C4] column_value_old:[12.34](5);[R1] [C5] column_name:C4;[R1] [C5] column_type:MYSQL_TYPE_OB_NUMBER_FLOAT;[R1] [C5] column_is_rowkey:false;[R1] [C5] column_is_signed:true;[R1] [C5] column_encoding:binary;[R1] [C5] column_is_not_null:false;[R1] [C5] column_value_new:[.1235](5);[R1] [C5] column_value_old:[12.34](5);[R1] [C6] column_name:C5;[R1] [C6] column_type:MYSQL_TYPE_OB_NUMBER_FLOAT;[R1] [C6] column_is_rowkey:false;[R1] [C6] column_is_signed:true;[R1] [C6] column_encoding:binary;[R1] [C6] column_is_not_null:false;[R1] [C6] column_value_new:[.123456789012345](16);[R1] [C6] column_value_old:[12.34](5);[R1] [C7] column_name:C6;[R1] [C7] column_type:MYSQL_TYPE_VAR_STRING;[R1] [C7] column_is_rowkey:false;[R1] [C7] column_is_signed:true;[R1] [C7] column_encoding:utf8mb4;[R1] [C7] column_is_not_null:false;[R1] [C7] column_value_new:[0.123456789012345](17);[R1] [C7] column_value_old:[0.123456789012345](17);[R1] [C8] column_name:C7;[R1] [C8] column_type:MYSQL_TYPE_STRING;[R1] [C8] column_is_rowkey:false;[R1] [C8] column_is_signed:true;[R1] [C8] column_encoding:utf8mb4;[R1] [C8] column_is_not_null:false;[R1] [C8] column_value_new:[0.123456789012345                                                                                   ](100);[R1] [C8] column_value_old:[12.34                                                                                               ](100);$[R2] COMMIT;
update number_1 set c1=c6, c2=c6, c3=c6, c4=c6, c5=c6, c7=c6 where c0 = 66;
select c0, c6, c1, c2, c3, c4, c5, c7 from number_1 where c0 = 66;
C0	C6	C1	C2	C3	C4	C5	C7
66	0.12345678901234	1.2345678901234E-001	1.23456791E-001	.12345678901234	.1235	.12345678901234	0.12345678901234                                                                                    
ob1.oblog.next;
[R0] BEGIN;[R0] org_cluster_id:1;[R1] record_type:UPDATE;[R1] database_name:oracle.OBLOG_DB;[R1] table_name:NUMBER_1;[R1] log_event:true;[R1] column_count:8;[R1] source_category:SRC_FULL_RECORDED;[R1] source_type:SRC_OCEANBASE_1_0;[R1] has_pk:true;[R1] pk_info:(0);[R1] pks:C0;[R1] has_uk:false;[R1] uk_info:(null);[R1] uks:(null);[R1] [C1] column_name:C0;[R1] [C1] column_type:MYSQL_TYPE_NEWDECIMAL;[R1] [C1] column_is_rowkey:true;[R1] [C1] column_is_signed:true;[R1] [C1] column_encoding:binary;[R1] [C1] column_is_not_null:true;[R1] [C1] column_value_new:[66](2);[R1] [C1] column_value_old:[66](2);[R1] [C2] column_name:C1;[R1] [C2] column_type:MYSQL_TYPE_DOUBLE;[R1] [C2] column_is_rowkey:false;[R1] [C2] column_is_signed:true;[R1] [C2] column_encoding:binary;[R1] [C2] column_is_not_null:false;[R1] [C2] column_value_new:[1.2345678901234E-001](20);[R1] [C2] column_value_old:[1.234E+001](10);[R1] [C3] column_name:C2;[R1] [C3] column_type:MYSQL_TYPE_FLOAT;[R1] [C3] column_is_rowkey:false;[R1] [C3] column_is_signed:true;[R1] [C3] column_encoding:binary;[R1] [C3] column_is_not_null:false;[R1] [C3] column_value_new:[1.23456791E-001](15);[R1] [C3] column_value_old:[1.23400002E+001](15);[R1] [C4] column_name:C3;[R1] [C4] column_type:MYSQL_TYPE_NEWDECIMAL;[R1] [C4] column_is_rowkey:false;[R1] [C4] column_is_signed:true;[R1] [C4] column_encoding:binary;[R1] [C4] column_is_not_null:false;[R1] [C4] column_value_new:[.12345678901234](15);[R1] [C4] column_value_old:[12.34](5);[R1] [C5] column_name:C4;[R1] [C5] column_type:MYSQL_TYPE_OB_NUMBER_FLOAT;[R1] [C5] column_is_rowkey:false;[R1] [C5] column_is_signed:true;[R1] [C5] column_encoding:binary;[R1] [C5] column_is_not_null:false;[R1] [C5] column_value_new:[.1235](5);[R1] [C5] column_value_old:[12.34](5);[R1] [C6] column_name:C5;[R1] [C6] column_type:MYSQL_TYPE_OB_NUMBER_FLOAT;[R1] [C6] column_is_rowkey:false;[R1] [C6] column_is_signed:true;[R1] [C6] column_encoding:binary;[R1] [C6] column_is_not_null:false;[R1] [C6] column_value_new:[.12345678901234](15);[R1] [C6] column_value_old:[12.34](5);[R1] [C7] column_name:C6;[R1] [C7] column_type:MYSQL_TYPE_VAR_STRING;[R1] [C7] column_is_rowkey:false;[R1] [C7] column_is_signed:true;[R1] [C7] column_encoding:utf8mb4;[R1] [C7] column_is_not_null:false;[R1] [C7] column_value_new:[0.12345678901234](16);[R1] [C7] column_value_old:[0.12345678901234](16);[R1] [C8] column_name:C7;[R1] [C8] column_type:MYSQL_TYPE_STRING;[R1] [C8] column_is_rowkey:false;[R1] [C8] column_is_signed:true;[R1] [C8] column_encoding:utf8mb4;[R1] [C8] column_is_not_null:false;[R1] [C8] column_value_new:[0.12345678901234                                                                                    ](100);[R1] [C8] column_value_old:[12.34                                                                                               ](100);$[R2] COMMIT;
update number_1 set c1=c6, c2=c6, c3=c6, c4=c6, c5=c6, c7=c6 where c0 = 67;
select c0, c6, c1, c2, c3, c4, c5, c7 from number_1 where c0 = 67;
C0	C6	C1	C2	C3	C4	C5	C7
67	0.1234567890123	1.2345678901230001E-001	1.23456791E-001	.1234567890123	.1235	.1234567890123	0.1234567890123                                                                                     
ob1.oblog.next;
[R0] BEGIN;[R0] org_cluster_id:1;[R1] record_type:UPDATE;[R1] database_name:oracle.OBLOG_DB;[R1] table_name:NUMBER_1;[R1] log_event:true;[R1] column_count:8;[R1] source_category:SRC_FULL_RECORDED;[R1] source_type:SRC_OCEANBASE_1_0;[R1] has_pk:true;[R1] pk_info:(0);[R1] pks:C0;[R1] has_uk:false;[R1] uk_info:(null);[R1] uks:(null);[R1] [C1] column_name:C0;[R1] [C1] column_type:MYSQL_TYPE_NEWDECIMAL;[R1] [C1] column_is_rowkey:true;[R1] [C1] column_is_signed:true;[R1] [C1] column_encoding:binary;[R1] [C1] column_is_not_null:true;[R1] [C1] column_value_new:[67](2);[R1] [C1] column_value_old:[67](2);[R1] [C2] column_name:C1;[R1] [C2] column_type:MYSQL_TYPE_DOUBLE;[R1] [C2] column_is_rowkey:false;[R1] [C2] column_is_signed:true;[R1] [C2] column_encoding:binary;[R1] [C2] column_is_not_null:false;[R1] [C2] column_value_new:[1.2345678901230001E-001](23);[R1] [C2] column_value_old:[1.234E+001](10);[R1] [C3] column_name:C2;[R1] [C3] column_type:MYSQL_TYPE_FLOAT;[R1] [C3] column_is_rowkey:false;[R1] [C3] column_is_signed:true;[R1] [C3] column_encoding:binary;[R1] [C3] column_is_not_null:false;[R1] [C3] column_value_new:[1.23456791E-001](15);[R1] [C3] column_value_old:[1.23400002E+001](15);[R1] [C4] column_name:C3;[R1] [C4] column_type:MYSQL_TYPE_NEWDECIMAL;[R1] [C4] column_is_rowkey:false;[R1] [C4] column_is_signed:true;[R1] [C4] column_encoding:binary;[R1] [C4] column_is_not_null:false;[R1] [C4] column_value_new:[.1234567890123](14);[R1] [C4] column_value_old:[12.34](5);[R1] [C5] column_name:C4;[R1] [C5] column_type:MYSQL_TYPE_OB_NUMBER_FLOAT;[R1] [C5] column_is_rowkey:false;[R1] [C5] column_is_signed:true;[R1] [C5] column_encoding:binary;[R1] [C5] column_is_not_null:false;[R1] [C5] column_value_new:[.1235](5);[R1] [C5] column_value_old:[12.34](5);[R1] [C6] column_name:C5;[R1] [C6] column_type:MYSQL_TYPE_OB_NUMBER_FLOAT;[R1] [C6] column_is_rowkey:false;[R1] [C6] column_is_signed:true;[R1] [C6] column_encoding:binary;[R1] [C6] column_is_not_null:false;[R1] [C6] column_value_new:[.1234567890123](14);[R1] [C6] column_value_old:[12.34](5);[R1] [C7] column_name:C6;[R1] [C7] column_type:MYSQL_TYPE_VAR_STRING;[R1] [C7] column_is_rowkey:false;[R1] [C7] column_is_signed:true;[R1] [C7] column_encoding:utf8mb4;[R1] [C7] column_is_not_null:false;[R1] [C7] column_value_new:[0.1234567890123](15);[R1] [C7] column_value_old:[0.1234567890123](15);[R1] [C8] column_name:C7;[R1] [C8] column_type:MYSQL_TYPE_STRING;[R1] [C8] column_is_rowkey:false;[R1] [C8] column_is_signed:true;[R1] [C8] column_encoding:utf8mb4;[R1] [C8] column_is_not_null:false;[R1] [C8] column_value_new:[0.1234567890123                                                                                     ](100);[R1] [C8] column_value_old:[12.34                                                                                               ](100);$[R2] COMMIT;
update number_1 set c1=c6, c2=c6, c3=c6, c4=c6, c5=c6, c7=c6 where c0 = 68;
select c0, c6, c1, c2, c3, c4, c5, c7 from number_1 where c0 = 68;
C0	C6	C1	C2	C3	C4	C5	C7
68	0.123456789012	1.23456789012E-001	1.23456791E-001	.123456789012	.1235	.123456789012	0.123456789012                                                                                      
ob1.oblog.next;
[R0] BEGIN;[R0] org_cluster_id:1;[R1] record_type:UPDATE;[R1] database_name:oracle.OBLOG_DB;[R1] table_name:NUMBER_1;[R1] log_event:true;[R1] column_count:8;[R1] source_category:SRC_FULL_RECORDED;[R1] source_type:SRC_OCEANBASE_1_0;[R1] has_pk:true;[R1] pk_info:(0);[R1] pks:C0;[R1] has_uk:false;[R1] uk_info:(null);[R1] uks:(null);[R1] [C1] column_name:C0;[R1] [C1] column_type:MYSQL_TYPE_NEWDECIMAL;[R1] [C1] column_is_rowkey:true;[R1] [C1] column_is_signed:true;[R1] [C1] column_encoding:binary;[R1] [C1] column_is_not_null:true;[R1] [C1] column_value_new:[68](2);[R1] [C1] column_value_old:[68](2);[R1] [C2] column_name:C1;[R1] [C2] column_type:MYSQL_TYPE_DOUBLE;[R1] [C2] column_is_rowkey:false;[R1] [C2] column_is_signed:true;[R1] [C2] column_encoding:binary;[R1] [C2] column_is_not_null:false;[R1] [C2] column_value_new:[1.23456789012E-001](18);[R1] [C2] column_value_old:[1.234E+001](10);[R1] [C3] column_name:C2;[R1] [C3] column_type:MYSQL_TYPE_FLOAT;[R1] [C3] column_is_rowkey:false;[R1] [C3] column_is_signed:true;[R1] [C3] column_encoding:binary;[R1] [C3] column_is_not_null:false;[R1] [C3] column_value_new:[1.23456791E-001](15);[R1] [C3] column_value_old:[1.23400002E+001](15);[R1] [C4] column_name:C3;[R1] [C4] column_type:MYSQL_TYPE_NEWDECIMAL;[R1] [C4] column_is_rowkey:false;[R1] [C4] column_is_signed:true;[R1] [C4] column_encoding:binary;[R1] [C4] column_is_not_null:false;[R1] [C4] column_value_new:[.123456789012](13);[R1] [C4] column_value_old:[12.34](5);[R1] [C5] column_name:C4;[R1] [C5] column_type:MYSQL_TYPE_OB_NUMBER_FLOAT;[R1] [C5] column_is_rowkey:false;[R1] [C5] column_is_signed:true;[R1] [C5] column_encoding:binary;[R1] [C5] column_is_not_null:false;[R1] [C5] column_value_new:[.1235](5);[R1] [C5] column_value_old:[12.34](5);[R1] [C6] column_name:C5;[R1] [C6] column_type:MYSQL_TYPE_OB_NUMBER_FLOAT;[R1] [C6] column_is_rowkey:false;[R1] [C6] column_is_signed:true;[R1] [C6] column_encoding:binary;[R1] [C6] column_is_not_null:false;[R1] [C6] column_value_new:[.123456789012](13);[R1] [C6] column_value_old:[12.34](5);[R1] [C7] column_name:C6;[R1] [C7] column_type:MYSQL_TYPE_VAR_STRING;[R1] [C7] column_is_rowkey:false;[R1] [C7] column_is_signed:true;[R1] [C7] column_encoding:utf8mb4;[R1] [C7] column_is_not_null:false;[R1] [C7] column_value_new:[0.123456789012](14);[R1] [C7] column_value_old:[0.123456789012](14);[R1] [C8] column_name:C7;[R1] [C8] column_type:MYSQL_TYPE_STRING;[R1] [C8] column_is_rowkey:false;[R1] [C8] column_is_signed:true;[R1] [C8] column_encoding:utf8mb4;[R1] [C8] column_is_not_null:false;[R1] [C8] column_value_new:[0.123456789012                                                                                      ](100);[R1] [C8] column_value_old:[12.34                                                                                               ](100);$[R2] COMMIT;
update number_1 set c1=c6, c2=c6, c3=c6, c4=c6, c5=c6, c7=c6 where c0 = 69;
select c0, c6, c1, c2, c3, c4, c5, c7 from number_1 where c0 = 69;
C0	C6	C1	C2	C3	C4	C5	C7
69	0.12345678901	1.2345678901E-001	1.23456791E-001	.12345678901	.1235	.12345678901	0.12345678901                                                                                       
ob1.oblog.next;
[R0] BEGIN;[R0] org_cluster_id:1;[R1] record_type:UPDATE;[R1] database_name:oracle.OBLOG_DB;[R1] table_name:NUMBER_1;[R1] log_event:true;[R1] column_count:8;[R1] source_category:SRC_FULL_RECORDED;[R1] source_type:SRC_OCEANBASE_1_0;[R1] has_pk:true;[R1] pk_info:(0);[R1] pks:C0;[R1] has_uk:false;[R1] uk_info:(null);[R1] uks:(null);[R1] [C1] column_name:C0;[R1] [C1] column_type:MYSQL_TYPE_NEWDECIMAL;[R1] [C1] column_is_rowkey:true;[R1] [C1] column_is_signed:true;[R1] [C1] column_encoding:binary;[R1] [C1] column_is_not_null:true;[R1] [C1] column_value_new:[69](2);[R1] [C1] column_value_old:[69](2);[R1] [C2] column_name:C1;[R1] [C2] column_type:MYSQL_TYPE_DOUBLE;[R1] [C2] column_is_rowkey:false;[R1] [C2] column_is_signed:true;[R1] [C2] column_encoding:binary;[R1] [C2] column_is_not_null:false;[R1] [C2] column_value_new:[1.2345678901E-001](17);[R1] [C2] column_value_old:[1.234E+001](10);[R1] [C3] column_name:C2;[R1] [C3] column_type:MYSQL_TYPE_FLOAT;[R1] [C3] column_is_rowkey:false;[R1] [C3] column_is_signed:true;[R1] [C3] column_encoding:binary;[R1] [C3] column_is_not_null:false;[R1] [C3] column_value_new:[1.23456791E-001](15);[R1] [C3] column_value_old:[1.23400002E+001](15);[R1] [C4] column_name:C3;[R1] [C4] column_type:MYSQL_TYPE_NEWDECIMAL;[R1] [C4] column_is_rowkey:false;[R1] [C4] column_is_signed:true;[R1] [C4] column_encoding:binary;[R1] [C4] column_is_not_null:false;[R1] [C4] column_value_new:[.12345678901](12);[R1] [C4] column_value_old:[12.34](5);[R1] [C5] column_name:C4;[R1] [C5] column_type:MYSQL_TYPE_OB_NUMBER_FLOAT;[R1] [C5] column_is_rowkey:false;[R1] [C5] column_is_signed:true;[R1] [C5] column_encoding:binary;[R1] [C5] column_is_not_null:false;[R1] [C5] column_value_new:[.1235](5);[R1] [C5] column_value_old:[12.34](5);[R1] [C6] column_name:C5;[R1] [C6] column_type:MYSQL_TYPE_OB_NUMBER_FLOAT;[R1] [C6] column_is_rowkey:false;[R1] [C6] column_is_signed:true;[R1] [C6] column_encoding:binary;[R1] [C6] column_is_not_null:false;[R1] [C6] column_value_new:[.12345678901](12);[R1] [C6] column_value_old:[12.34](5);[R1] [C7] column_name:C6;[R1] [C7] column_type:MYSQL_TYPE_VAR_STRING;[R1] [C7] column_is_rowkey:false;[R1] [C7] column_is_signed:true;[R1] [C7] column_encoding:utf8mb4;[R1] [C7] column_is_not_null:false;[R1] [C7] column_value_new:[0.12345678901](13);[R1] [C7] column_value_old:[0.12345678901](13);[R1] [C8] column_name:C7;[R1] [C8] column_type:MYSQL_TYPE_STRING;[R1] [C8] column_is_rowkey:false;[R1] [C8] column_is_signed:true;[R1] [C8] column_encoding:utf8mb4;[R1] [C8] column_is_not_null:false;[R1] [C8] column_value_new:[0.12345678901                                                                                       ](100);[R1] [C8] column_value_old:[12.34                                                                                               ](100);$[R2] COMMIT;
update number_1 set c1=c6, c2=c6, c3=c6, c4=c6, c5=c6, c7=c6 where c0 = 70;
select c0, c6, c1, c2, c3, c4, c5, c7 from number_1 where c0 = 70;
C0	C6	C1	C2	C3	C4	C5	C7
70	0.1234567890	1.23456789E-001	1.23456791E-001	.123456789	.1235	.123456789	0.1234567890                                                                                        
ob1.oblog.next;
[R0] BEGIN;[R0] org_cluster_id:1;[R1] record_type:UPDATE;[R1] database_name:oracle.OBLOG_DB;[R1] table_name:NUMBER_1;[R1] log_event:true;[R1] column_count:8;[R1] source_category:SRC_FULL_RECORDED;[R1] source_type:SRC_OCEANBASE_1_0;[R1] has_pk:true;[R1] pk_info:(0);[R1] pks:C0;[R1] has_uk:false;[R1] uk_info:(null);[R1] uks:(null);[R1] [C1] column_name:C0;[R1] [C1] column_type:MYSQL_TYPE_NEWDECIMAL;[R1] [C1] column_is_rowkey:true;[R1] [C1] column_is_signed:true;[R1] [C1] column_encoding:binary;[R1] [C1] column_is_not_null:true;[R1] [C1] column_value_new:[70](2);[R1] [C1] column_value_old:[70](2);[R1] [C2] column_name:C1;[R1] [C2] column_type:MYSQL_TYPE_DOUBLE;[R1] [C2] column_is_rowkey:false;[R1] [C2] column_is_signed:true;[R1] [C2] column_encoding:binary;[R1] [C2] column_is_not_null:false;[R1] [C2] column_value_new:[1.23456789E-001](15);[R1] [C2] column_value_old:[1.234E+001](10);[R1] [C3] column_name:C2;[R1] [C3] column_type:MYSQL_TYPE_FLOAT;[R1] [C3] column_is_rowkey:false;[R1] [C3] column_is_signed:true;[R1] [C3] column_encoding:binary;[R1] [C3] column_is_not_null:false;[R1] [C3] column_value_new:[1.23456791E-001](15);[R1] [C3] column_value_old:[1.23400002E+001](15);[R1] [C4] column_name:C3;[R1] [C4] column_type:MYSQL_TYPE_NEWDECIMAL;[R1] [C4] column_is_rowkey:false;[R1] [C4] column_is_signed:true;[R1] [C4] column_encoding:binary;[R1] [C4] column_is_not_null:false;[R1] [C4] column_value_new:[.123456789](10);[R1] [C4] column_value_old:[12.34](5);[R1] [C5] column_name:C4;[R1] [C5] column_type:MYSQL_TYPE_OB_NUMBER_FLOAT;[R1] [C5] column_is_rowkey:false;[R1] [C5] column_is_signed:true;[R1] [C5] column_encoding:binary;[R1] [C5] column_is_not_null:false;[R1] [C5] column_value_new:[.1235](5);[R1] [C5] column_value_old:[12.34](5);[R1] [C6] column_name:C5;[R1] [C6] column_type:MYSQL_TYPE_OB_NUMBER_FLOAT;[R1] [C6] column_is_rowkey:false;[R1] [C6] column_is_signed:true;[R1] [C6] column_encoding:binary;[R1] [C6] column_is_not_null:false;[R1] [C6] column_value_new:[.123456789](10);[R1] [C6] column_value_old:[12.34](5);[R1] [C7] column_name:C6;[R1] [C7] column_type:MYSQL_TYPE_VAR_STRING;[R1] [C7] column_is_rowkey:false;[R1] [C7] column_is_signed:true;[R1] [C7] column_encoding:utf8mb4;[R1] [C7] column_is_not_null:false;[R1] [C7] column_value_new:[0.1234567890](12);[R1] [C7] column_value_old:[0.1234567890](12);[R1] [C8] column_name:C7;[R1] [C8] column_type:MYSQL_TYPE_STRING;[R1] [C8] column_is_rowkey:false;[R1] [C8] column_is_signed:true;[R1] [C8] column_encoding:utf8mb4;[R1] [C8] column_is_not_null:false;[R1] [C8] column_value_new:[0.1234567890                                                                                        ](100);[R1] [C8] column_value_old:[12.34                                                                                               ](100);$[R2] COMMIT;
update number_1 set c1=c6, c2=c6, c3=c6, c4=c6, c5=c6, c7=c6 where c0 = 71;
select c0, c6, c1, c2, c3, c4, c5, c7 from number_1 where c0 = 71;
C0	C6	C1	C2	C3	C4	C5	C7
71	0.123456789	1.23456789E-001	1.23456791E-001	.123456789	.1235	.123456789	0.123456789                                                                                         
ob1.oblog.next;
[R0] BEGIN;[R0] org_cluster_id:1;[R1] record_type:UPDATE;[R1] database_name:oracle.OBLOG_DB;[R1] table_name:NUMBER_1;[R1] log_event:true;[R1] column_count:8;[R1] source_category:SRC_FULL_RECORDED;[R1] source_type:SRC_OCEANBASE_1_0;[R1] has_pk:true;[R1] pk_info:(0);[R1] pks:C0;[R1] has_uk:false;[R1] uk_info:(null);[R1] uks:(null);[R1] [C1] column_name:C0;[R1] [C1] column_type:MYSQL_TYPE_NEWDECIMAL;[R1] [C1] column_is_rowkey:true;[R1] [C1] column_is_signed:true;[R1] [C1] column_encoding:binary;[R1] [C1] column_is_not_null:true;[R1] [C1] column_value_new:[71](2);[R1] [C1] column_value_old:[71](2);[R1] [C2] column_name:C1;[R1] [C2] column_type:MYSQL_TYPE_DOUBLE;[R1] [C2] column_is_rowkey:false;[R1] [C2] column_is_signed:true;[R1] [C2] column_encoding:binary;[R1] [C2] column_is_not_null:false;[R1] [C2] column_value_new:[1.23456789E-001](15);[R1] [C2] column_value_old:[1.234E+001](10);[R1] [C3] column_name:C2;[R1] [C3] column_type:MYSQL_TYPE_FLOAT;[R1] [C3] column_is_rowkey:false;[R1] [C3] column_is_signed:true;[R1] [C3] column_encoding:binary;[R1] [C3] column_is_not_null:false;[R1] [C3] column_value_new:[1.23456791E-001](15);[R1] [C3] column_value_old:[1.23400002E+001](15);[R1] [C4] column_name:C3;[R1] [C4] column_type:MYSQL_TYPE_NEWDECIMAL;[R1] [C4] column_is_rowkey:false;[R1] [C4] column_is_signed:true;[R1] [C4] column_encoding:binary;[R1] [C4] column_is_not_null:false;[R1] [C4] column_value_new:[.123456789](10);[R1] [C4] column_value_old:[12.34](5);[R1] [C5] column_name:C4;[R1] [C5] column_type:MYSQL_TYPE_OB_NUMBER_FLOAT;[R1] [C5] column_is_rowkey:false;[R1] [C5] column_is_signed:true;[R1] [C5] column_encoding:binary;[R1] [C5] column_is_not_null:false;[R1] [C5] column_value_new:[.1235](5);[R1] [C5] column_value_old:[12.34](5);[R1] [C6] column_name:C5;[R1] [C6] column_type:MYSQL_TYPE_OB_NUMBER_FLOAT;[R1] [C6] column_is_rowkey:false;[R1] [C6] column_is_signed:true;[R1] [C6] column_encoding:binary;[R1] [C6] column_is_not_null:false;[R1] [C6] column_value_new:[.123456789](10);[R1] [C6] column_value_old:[12.34](5);[R1] [C7] column_name:C6;[R1] [C7] column_type:MYSQL_TYPE_VAR_STRING;[R1] [C7] column_is_rowkey:false;[R1] [C7] column_is_signed:true;[R1] [C7] column_encoding:utf8mb4;[R1] [C7] column_is_not_null:false;[R1] [C7] column_value_new:[0.123456789](11);[R1] [C7] column_value_old:[0.123456789](11);[R1] [C8] column_name:C7;[R1] [C8] column_type:MYSQL_TYPE_STRING;[R1] [C8] column_is_rowkey:false;[R1] [C8] column_is_signed:true;[R1] [C8] column_encoding:utf8mb4;[R1] [C8] column_is_not_null:false;[R1] [C8] column_value_new:[0.123456789                                                                                         ](100);[R1] [C8] column_value_old:[12.34                                                                                               ](100);$[R2] COMMIT;
update number_1 set c1=c6, c2=c6, c3=c6, c4=c6, c5=c6, c7=c6 where c0 = 72;
select c0, c6, c1, c2, c3, c4, c5, c7 from number_1 where c0 = 72;
C0	C6	C1	C2	C3	C4	C5	C7
72	0.12345678	1.2345678E-001	1.23456784E-001	.12345678	.1235	.12345678	0.12345678                                                                                          
ob1.oblog.next;
[R0] BEGIN;[R0] org_cluster_id:1;[R1] record_type:UPDATE;[R1] database_name:oracle.OBLOG_DB;[R1] table_name:NUMBER_1;[R1] log_event:true;[R1] column_count:8;[R1] source_category:SRC_FULL_RECORDED;[R1] source_type:SRC_OCEANBASE_1_0;[R1] has_pk:true;[R1] pk_info:(0);[R1] pks:C0;[R1] has_uk:false;[R1] uk_info:(null);[R1] uks:(null);[R1] [C1] column_name:C0;[R1] [C1] column_type:MYSQL_TYPE_NEWDECIMAL;[R1] [C1] column_is_rowkey:true;[R1] [C1] column_is_signed:true;[R1] [C1] column_encoding:binary;[R1] [C1] column_is_not_null:true;[R1] [C1] column_value_new:[72](2);[R1] [C1] column_value_old:[72](2);[R1] [C2] column_name:C1;[R1] [C2] column_type:MYSQL_TYPE_DOUBLE;[R1] [C2] column_is_rowkey:false;[R1] [C2] column_is_signed:true;[R1] [C2] column_encoding:binary;[R1] [C2] column_is_not_null:false;[R1] [C2] column_value_new:[1.2345678E-001](14);[R1] [C2] column_value_old:[1.234E+001](10);[R1] [C3] column_name:C2;[R1] [C3] column_type:MYSQL_TYPE_FLOAT;[R1] [C3] column_is_rowkey:false;[R1] [C3] column_is_signed:true;[R1] [C3] column_encoding:binary;[R1] [C3] column_is_not_null:false;[R1] [C3] column_value_new:[1.23456784E-001](15);[R1] [C3] column_value_old:[1.23400002E+001](15);[R1] [C4] column_name:C3;[R1] [C4] column_type:MYSQL_TYPE_NEWDECIMAL;[R1] [C4] column_is_rowkey:false;[R1] [C4] column_is_signed:true;[R1] [C4] column_encoding:binary;[R1] [C4] column_is_not_null:false;[R1] [C4] column_value_new:[.12345678](9);[R1] [C4] column_value_old:[12.34](5);[R1] [C5] column_name:C4;[R1] [C5] column_type:MYSQL_TYPE_OB_NUMBER_FLOAT;[R1] [C5] column_is_rowkey:false;[R1] [C5] column_is_signed:true;[R1] [C5] column_encoding:binary;[R1] [C5] column_is_not_null:false;[R1] [C5] column_value_new:[.1235](5);[R1] [C5] column_value_old:[12.34](5);[R1] [C6] column_name:C5;[R1] [C6] column_type:MYSQL_TYPE_OB_NUMBER_FLOAT;[R1] [C6] column_is_rowkey:false;[R1] [C6] column_is_signed:true;[R1] [C6] column_encoding:binary;[R1] [C6] column_is_not_null:false;[R1] [C6] column_value_new:[.12345678](9);[R1] [C6] column_value_old:[12.34](5);[R1] [C7] column_name:C6;[R1] [C7] column_type:MYSQL_TYPE_VAR_STRING;[R1] [C7] column_is_rowkey:false;[R1] [C7] column_is_signed:true;[R1] [C7] column_encoding:utf8mb4;[R1] [C7] column_is_not_null:false;[R1] [C7] column_value_new:[0.12345678](10);[R1] [C7] column_value_old:[0.12345678](10);[R1] [C8] column_name:C7;[R1] [C8] column_type:MYSQL_TYPE_STRING;[R1] [C8] column_is_rowkey:false;[R1] [C8] column_is_signed:true;[R1] [C8] column_encoding:utf8mb4;[R1] [C8] column_is_not_null:false;[R1] [C8] column_value_new:[0.12345678                                                                                          ](100);[R1] [C8] column_value_old:[12.34                                                                                               ](100);$[R2] COMMIT;
update number_1 set c1=c6, c2=c6, c3=c6, c4=c6, c5=c6, c7=c6 where c0 = 73;
select c0, c6, c1, c2, c3, c4, c5, c7 from number_1 where c0 = 73;
C0	C6	C1	C2	C3	C4	C5	C7
73	0.1234567	1.234567E-001	1.23456702E-001	.1234567	.1235	.1234567	0.1234567                                                                                           
ob1.oblog.next;
[R0] BEGIN;[R0] org_cluster_id:1;[R1] record_type:UPDATE;[R1] database_name:oracle.OBLOG_DB;[R1] table_name:NUMBER_1;[R1] log_event:true;[R1] column_count:8;[R1] source_category:SRC_FULL_RECORDED;[R1] source_type:SRC_OCEANBASE_1_0;[R1] has_pk:true;[R1] pk_info:(0);[R1] pks:C0;[R1] has_uk:false;[R1] uk_info:(null);[R1] uks:(null);[R1] [C1] column_name:C0;[R1] [C1] column_type:MYSQL_TYPE_NEWDECIMAL;[R1] [C1] column_is_rowkey:true;[R1] [C1] column_is_signed:true;[R1] [C1] column_encoding:binary;[R1] [C1] column_is_not_null:true;[R1] [C1] column_value_new:[73](2);[R1] [C1] column_value_old:[73](2);[R1] [C2] column_name:C1;[R1] [C2] column_type:MYSQL_TYPE_DOUBLE;[R1] [C2] column_is_rowkey:false;[R1] [C2] column_is_signed:true;[R1] [C2] column_encoding:binary;[R1] [C2] column_is_not_null:false;[R1] [C2] column_value_new:[1.234567E-001](13);[R1] [C2] column_value_old:[1.234E+001](10);[R1] [C3] column_name:C2;[R1] [C3] column_type:MYSQL_TYPE_FLOAT;[R1] [C3] column_is_rowkey:false;[R1] [C3] column_is_signed:true;[R1] [C3] column_encoding:binary;[R1] [C3] column_is_not_null:false;[R1] [C3] column_value_new:[1.23456702E-001](15);[R1] [C3] column_value_old:[1.23400002E+001](15);[R1] [C4] column_name:C3;[R1] [C4] column_type:MYSQL_TYPE_NEWDECIMAL;[R1] [C4] column_is_rowkey:false;[R1] [C4] column_is_signed:true;[R1] [C4] column_encoding:binary;[R1] [C4] column_is_not_null:false;[R1] [C4] column_value_new:[.1234567](8);[R1] [C4] column_value_old:[12.34](5);[R1] [C5] column_name:C4;[R1] [C5] column_type:MYSQL_TYPE_OB_NUMBER_FLOAT;[R1] [C5] column_is_rowkey:false;[R1] [C5] column_is_signed:true;[R1] [C5] column_encoding:binary;[R1] [C5] column_is_not_null:false;[R1] [C5] column_value_new:[.1235](5);[R1] [C5] column_value_old:[12.34](5);[R1] [C6] column_name:C5;[R1] [C6] column_type:MYSQL_TYPE_OB_NUMBER_FLOAT;[R1] [C6] column_is_rowkey:false;[R1] [C6] column_is_signed:true;[R1] [C6] column_encoding:binary;[R1] [C6] column_is_not_null:false;[R1] [C6] column_value_new:[.1234567](8);[R1] [C6] column_value_old:[12.34](5);[R1] [C7] column_name:C6;[R1] [C7] column_type:MYSQL_TYPE_VAR_STRING;[R1] [C7] column_is_rowkey:false;[R1] [C7] column_is_signed:true;[R1] [C7] column_encoding:utf8mb4;[R1] [C7] column_is_not_null:false;[R1] [C7] column_value_new:[0.1234567](9);[R1] [C7] column_value_old:[0.1234567](9);[R1] [C8] column_name:C7;[R1] [C8] column_type:MYSQL_TYPE_STRING;[R1] [C8] column_is_rowkey:false;[R1] [C8] column_is_signed:true;[R1] [C8] column_encoding:utf8mb4;[R1] [C8] column_is_not_null:false;[R1] [C8] column_value_new:[0.1234567                                                                                           ](100);[R1] [C8] column_value_old:[12.34                                                                                               ](100);$[R2] COMMIT;
update number_1 set c1=c6, c2=c6, c3=c6, c4=c6, c5=c6, c7=c6 where c0 = 74;
select c0, c6, c1, c2, c3, c4, c5, c7 from number_1 where c0 = 74;
C0	C6	C1	C2	C3	C4	C5	C7
74	0.123456	1.23456E-001	1.23456001E-001	.123456	.1235	.123456	0.123456                                                                                            
ob1.oblog.next;
[R0] BEGIN;[R0] org_cluster_id:1;[R1] record_type:UPDATE;[R1] database_name:oracle.OBLOG_DB;[R1] table_name:NUMBER_1;[R1] log_event:true;[R1] column_count:8;[R1] source_category:SRC_FULL_RECORDED;[R1] source_type:SRC_OCEANBASE_1_0;[R1] has_pk:true;[R1] pk_info:(0);[R1] pks:C0;[R1] has_uk:false;[R1] uk_info:(null);[R1] uks:(null);[R1] [C1] column_name:C0;[R1] [C1] column_type:MYSQL_TYPE_NEWDECIMAL;[R1] [C1] column_is_rowkey:true;[R1] [C1] column_is_signed:true;[R1] [C1] column_encoding:binary;[R1] [C1] column_is_not_null:true;[R1] [C1] column_value_new:[74](2);[R1] [C1] column_value_old:[74](2);[R1] [C2] column_name:C1;[R1] [C2] column_type:MYSQL_TYPE_DOUBLE;[R1] [C2] column_is_rowkey:false;[R1] [C2] column_is_signed:true;[R1] [C2] column_encoding:binary;[R1] [C2] column_is_not_null:false;[R1] [C2] column_value_new:[1.23456E-001](12);[R1] [C2] column_value_old:[1.234E+001](10);[R1] [C3] column_name:C2;[R1] [C3] column_type:MYSQL_TYPE_FLOAT;[R1] [C3] column_is_rowkey:false;[R1] [C3] column_is_signed:true;[R1] [C3] column_encoding:binary;[R1] [C3] column_is_not_null:false;[R1] [C3] column_value_new:[1.23456001E-001](15);[R1] [C3] column_value_old:[1.23400002E+001](15);[R1] [C4] column_name:C3;[R1] [C4] column_type:MYSQL_TYPE_NEWDECIMAL;[R1] [C4] column_is_rowkey:false;[R1] [C4] column_is_signed:true;[R1] [C4] column_encoding:binary;[R1] [C4] column_is_not_null:false;[R1] [C4] column_value_new:[.123456](7);[R1] [C4] column_value_old:[12.34](5);[R1] [C5] column_name:C4;[R1] [C5] column_type:MYSQL_TYPE_OB_NUMBER_FLOAT;[R1] [C5] column_is_rowkey:false;[R1] [C5] column_is_signed:true;[R1] [C5] column_encoding:binary;[R1] [C5] column_is_not_null:false;[R1] [C5] column_value_new:[.1235](5);[R1] [C5] column_value_old:[12.34](5);[R1] [C6] column_name:C5;[R1] [C6] column_type:MYSQL_TYPE_OB_NUMBER_FLOAT;[R1] [C6] column_is_rowkey:false;[R1] [C6] column_is_signed:true;[R1] [C6] column_encoding:binary;[R1] [C6] column_is_not_null:false;[R1] [C6] column_value_new:[.123456](7);[R1] [C6] column_value_old:[12.34](5);[R1] [C7] column_name:C6;[R1] [C7] column_type:MYSQL_TYPE_VAR_STRING;[R1] [C7] column_is_rowkey:false;[R1] [C7] column_is_signed:true;[R1] [C7] column_encoding:utf8mb4;[R1] [C7] column_is_not_null:false;[R1] [C7] column_value_new:[0.123456](8);[R1] [C7] column_value_old:[0.123456](8);[R1] [C8] column_name:C7;[R1] [C8] column_type:MYSQL_TYPE_STRING;[R1] [C8] column_is_rowkey:false;[R1] [C8] column_is_signed:true;[R1] [C8] column_encoding:utf8mb4;[R1] [C8] column_is_not_null:false;[R1] [C8] column_value_new:[0.123456                                                                                            ](100);[R1] [C8] column_value_old:[12.34                                                                                               ](100);$[R2] COMMIT;
update number_1 set c1=c6, c2=c6, c3=c6, c4=c6, c5=c6, c7=c6 where c0 = 75;
select c0, c6, c1, c2, c3, c4, c5, c7 from number_1 where c0 = 75;
C0	C6	C1	C2	C3	C4	C5	C7
75	0.12345	1.2345E-001	1.23450004E-001	.12345	.1235	.12345	0.12345                                                                                             
ob1.oblog.next;
[R0] BEGIN;[R0] org_cluster_id:1;[R1] record_type:UPDATE;[R1] database_name:oracle.OBLOG_DB;[R1] table_name:NUMBER_1;[R1] log_event:true;[R1] column_count:8;[R1] source_category:SRC_FULL_RECORDED;[R1] source_type:SRC_OCEANBASE_1_0;[R1] has_pk:true;[R1] pk_info:(0);[R1] pks:C0;[R1] has_uk:false;[R1] uk_info:(null);[R1] uks:(null);[R1] [C1] column_name:C0;[R1] [C1] column_type:MYSQL_TYPE_NEWDECIMAL;[R1] [C1] column_is_rowkey:true;[R1] [C1] column_is_signed:true;[R1] [C1] column_encoding:binary;[R1] [C1] column_is_not_null:true;[R1] [C1] column_value_new:[75](2);[R1] [C1] column_value_old:[75](2);[R1] [C2] column_name:C1;[R1] [C2] column_type:MYSQL_TYPE_DOUBLE;[R1] [C2] column_is_rowkey:false;[R1] [C2] column_is_signed:true;[R1] [C2] column_encoding:binary;[R1] [C2] column_is_not_null:false;[R1] [C2] column_value_new:[1.2345E-001](11);[R1] [C2] column_value_old:[1.234E+001](10);[R1] [C3] column_name:C2;[R1] [C3] column_type:MYSQL_TYPE_FLOAT;[R1] [C3] column_is_rowkey:false;[R1] [C3] column_is_signed:true;[R1] [C3] column_encoding:binary;[R1] [C3] column_is_not_null:false;[R1] [C3] column_value_new:[1.23450004E-001](15);[R1] [C3] column_value_old:[1.23400002E+001](15);[R1] [C4] column_name:C3;[R1] [C4] column_type:MYSQL_TYPE_NEWDECIMAL;[R1] [C4] column_is_rowkey:false;[R1] [C4] column_is_signed:true;[R1] [C4] column_encoding:binary;[R1] [C4] column_is_not_null:false;[R1] [C4] column_value_new:[.12345](6);[R1] [C4] column_value_old:[12.34](5);[R1] [C5] column_name:C4;[R1] [C5] column_type:MYSQL_TYPE_OB_NUMBER_FLOAT;[R1] [C5] column_is_rowkey:false;[R1] [C5] column_is_signed:true;[R1] [C5] column_encoding:binary;[R1] [C5] column_is_not_null:false;[R1] [C5] column_value_new:[.1235](5);[R1] [C5] column_value_old:[12.34](5);[R1] [C6] column_name:C5;[R1] [C6] column_type:MYSQL_TYPE_OB_NUMBER_FLOAT;[R1] [C6] column_is_rowkey:false;[R1] [C6] column_is_signed:true;[R1] [C6] column_encoding:binary;[R1] [C6] column_is_not_null:false;[R1] [C6] column_value_new:[.12345](6);[R1] [C6] column_value_old:[12.34](5);[R1] [C7] column_name:C6;[R1] [C7] column_type:MYSQL_TYPE_VAR_STRING;[R1] [C7] column_is_rowkey:false;[R1] [C7] column_is_signed:true;[R1] [C7] column_encoding:utf8mb4;[R1] [C7] column_is_not_null:false;[R1] [C7] column_value_new:[0.12345](7);[R1] [C7] column_value_old:[0.12345](7);[R1] [C8] column_name:C7;[R1] [C8] column_type:MYSQL_TYPE_STRING;[R1] [C8] column_is_rowkey:false;[R1] [C8] column_is_signed:true;[R1] [C8] column_encoding:utf8mb4;[R1] [C8] column_is_not_null:false;[R1] [C8] column_value_new:[0.12345                                                                                             ](100);[R1] [C8] column_value_old:[12.34                                                                                               ](100);$[R2] COMMIT;
update number_1 set c1=c6, c2=c6, c3=c6, c4=c6, c5=c6, c7=c6 where c0 = 76;
select c0, c6, c1, c2, c3, c4, c5, c7 from number_1 where c0 = 76;
C0	C6	C1	C2	C3	C4	C5	C7
76	0.1234	1.234E-001	1.23400003E-001	.1234	.1234	.1234	0.1234                                                                                              
ob1.oblog.next;
[R0] BEGIN;[R0] org_cluster_id:1;[R1] record_type:UPDATE;[R1] database_name:oracle.OBLOG_DB;[R1] table_name:NUMBER_1;[R1] log_event:true;[R1] column_count:8;[R1] source_category:SRC_FULL_RECORDED;[R1] source_type:SRC_OCEANBASE_1_0;[R1] has_pk:true;[R1] pk_info:(0);[R1] pks:C0;[R1] has_uk:false;[R1] uk_info:(null);[R1] uks:(null);[R1] [C1] column_name:C0;[R1] [C1] column_type:MYSQL_TYPE_NEWDECIMAL;[R1] [C1] column_is_rowkey:true;[R1] [C1] column_is_signed:true;[R1] [C1] column_encoding:binary;[R1] [C1] column_is_not_null:true;[R1] [C1] column_value_new:[76](2);[R1] [C1] column_value_old:[76](2);[R1] [C2] column_name:C1;[R1] [C2] column_type:MYSQL_TYPE_DOUBLE;[R1] [C2] column_is_rowkey:false;[R1] [C2] column_is_signed:true;[R1] [C2] column_encoding:binary;[R1] [C2] column_is_not_null:false;[R1] [C2] column_value_new:[1.234E-001](10);[R1] [C2] column_value_old:[1.234E+001](10);[R1] [C3] column_name:C2;[R1] [C3] column_type:MYSQL_TYPE_FLOAT;[R1] [C3] column_is_rowkey:false;[R1] [C3] column_is_signed:true;[R1] [C3] column_encoding:binary;[R1] [C3] column_is_not_null:false;[R1] [C3] column_value_new:[1.23400003E-001](15);[R1] [C3] column_value_old:[1.23400002E+001](15);[R1] [C4] column_name:C3;[R1] [C4] column_type:MYSQL_TYPE_NEWDECIMAL;[R1] [C4] column_is_rowkey:false;[R1] [C4] column_is_signed:true;[R1] [C4] column_encoding:binary;[R1] [C4] column_is_not_null:false;[R1] [C4] column_value_new:[.1234](5);[R1] [C4] column_value_old:[12.34](5);[R1] [C5] column_name:C4;[R1] [C5] column_type:MYSQL_TYPE_OB_NUMBER_FLOAT;[R1] [C5] column_is_rowkey:false;[R1] [C5] column_is_signed:true;[R1] [C5] column_encoding:binary;[R1] [C5] column_is_not_null:false;[R1] [C5] column_value_new:[.1234](5);[R1] [C5] column_value_old:[12.34](5);[R1] [C6] column_name:C5;[R1] [C6] column_type:MYSQL_TYPE_OB_NUMBER_FLOAT;[R1] [C6] column_is_rowkey:false;[R1] [C6] column_is_signed:true;[R1] [C6] column_encoding:binary;[R1] [C6] column_is_not_null:false;[R1] [C6] column_value_new:[.1234](5);[R1] [C6] column_value_old:[12.34](5);[R1] [C7] column_name:C6;[R1] [C7] column_type:MYSQL_TYPE_VAR_STRING;[R1] [C7] column_is_rowkey:false;[R1] [C7] column_is_signed:true;[R1] [C7] column_encoding:utf8mb4;[R1] [C7] column_is_not_null:false;[R1] [C7] column_value_new:[0.1234](6);[R1] [C7] column_value_old:[0.1234](6);[R1] [C8] column_name:C7;[R1] [C8] column_type:MYSQL_TYPE_STRING;[R1] [C8] column_is_rowkey:false;[R1] [C8] column_is_signed:true;[R1] [C8] column_encoding:utf8mb4;[R1] [C8] column_is_not_null:false;[R1] [C8] column_value_new:[0.1234                                                                                              ](100);[R1] [C8] column_value_old:[12.34                                                                                               ](100);$[R2] COMMIT;
update number_1 set c1=c6, c2=c6, c3=c6, c4=c6, c5=c6, c7=c6 where c0 = 77;
select c0, c6, c1, c2, c3, c4, c5, c7 from number_1 where c0 = 77;
C0	C6	C1	C2	C3	C4	C5	C7
77	0.123	1.23E-001	1.23000003E-001	.123	.123	.123	0.123                                                                                               
ob1.oblog.next;
[R0] BEGIN;[R0] org_cluster_id:1;[R1] record_type:UPDATE;[R1] database_name:oracle.OBLOG_DB;[R1] table_name:NUMBER_1;[R1] log_event:true;[R1] column_count:8;[R1] source_category:SRC_FULL_RECORDED;[R1] source_type:SRC_OCEANBASE_1_0;[R1] has_pk:true;[R1] pk_info:(0);[R1] pks:C0;[R1] has_uk:false;[R1] uk_info:(null);[R1] uks:(null);[R1] [C1] column_name:C0;[R1] [C1] column_type:MYSQL_TYPE_NEWDECIMAL;[R1] [C1] column_is_rowkey:true;[R1] [C1] column_is_signed:true;[R1] [C1] column_encoding:binary;[R1] [C1] column_is_not_null:true;[R1] [C1] column_value_new:[77](2);[R1] [C1] column_value_old:[77](2);[R1] [C2] column_name:C1;[R1] [C2] column_type:MYSQL_TYPE_DOUBLE;[R1] [C2] column_is_rowkey:false;[R1] [C2] column_is_signed:true;[R1] [C2] column_encoding:binary;[R1] [C2] column_is_not_null:false;[R1] [C2] column_value_new:[1.23E-001](9);[R1] [C2] column_value_old:[1.234E+001](10);[R1] [C3] column_name:C2;[R1] [C3] column_type:MYSQL_TYPE_FLOAT;[R1] [C3] column_is_rowkey:false;[R1] [C3] column_is_signed:true;[R1] [C3] column_encoding:binary;[R1] [C3] column_is_not_null:false;[R1] [C3] column_value_new:[1.23000003E-001](15);[R1] [C3] column_value_old:[1.23400002E+001](15);[R1] [C4] column_name:C3;[R1] [C4] column_type:MYSQL_TYPE_NEWDECIMAL;[R1] [C4] column_is_rowkey:false;[R1] [C4] column_is_signed:true;[R1] [C4] column_encoding:binary;[R1] [C4] column_is_not_null:false;[R1] [C4] column_value_new:[.123](4);[R1] [C4] column_value_old:[12.34](5);[R1] [C5] column_name:C4;[R1] [C5] column_type:MYSQL_TYPE_OB_NUMBER_FLOAT;[R1] [C5] column_is_rowkey:false;[R1] [C5] column_is_signed:true;[R1] [C5] column_encoding:binary;[R1] [C5] column_is_not_null:false;[R1] [C5] column_value_new:[.123](4);[R1] [C5] column_value_old:[12.34](5);[R1] [C6] column_name:C5;[R1] [C6] column_type:MYSQL_TYPE_OB_NUMBER_FLOAT;[R1] [C6] column_is_rowkey:false;[R1] [C6] column_is_signed:true;[R1] [C6] column_encoding:binary;[R1] [C6] column_is_not_null:false;[R1] [C6] column_value_new:[.123](4);[R1] [C6] column_value_old:[12.34](5);[R1] [C7] column_name:C6;[R1] [C7] column_type:MYSQL_TYPE_VAR_STRING;[R1] [C7] column_is_rowkey:false;[R1] [C7] column_is_signed:true;[R1] [C7] column_encoding:utf8mb4;[R1] [C7] column_is_not_null:false;[R1] [C7] column_value_new:[0.123](5);[R1] [C7] column_value_old:[0.123](5);[R1] [C8] column_name:C7;[R1] [C8] column_type:MYSQL_TYPE_STRING;[R1] [C8] column_is_rowkey:false;[R1] [C8] column_is_signed:true;[R1] [C8] column_encoding:utf8mb4;[R1] [C8] column_is_not_null:false;[R1] [C8] column_value_new:[0.123                                                                                               ](100);[R1] [C8] column_value_old:[12.34                                                                                               ](100);$[R2] COMMIT;
update number_1 set c1=c6, c2=c6, c3=c6, c4=c6, c5=c6, c7=c6 where c0 = 78;
select c0, c6, c1, c2, c3, c4, c5, c7 from number_1 where c0 = 78;
C0	C6	C1	C2	C3	C4	C5	C7
78	0.12	1.2E-001	1.19999997E-001	.12	.12	.12	0.12                                                                                                
ob1.oblog.next;
[R0] BEGIN;[R0] org_cluster_id:1;[R1] record_type:UPDATE;[R1] database_name:oracle.OBLOG_DB;[R1] table_name:NUMBER_1;[R1] log_event:true;[R1] column_count:8;[R1] source_category:SRC_FULL_RECORDED;[R1] source_type:SRC_OCEANBASE_1_0;[R1] has_pk:true;[R1] pk_info:(0);[R1] pks:C0;[R1] has_uk:false;[R1] uk_info:(null);[R1] uks:(null);[R1] [C1] column_name:C0;[R1] [C1] column_type:MYSQL_TYPE_NEWDECIMAL;[R1] [C1] column_is_rowkey:true;[R1] [C1] column_is_signed:true;[R1] [C1] column_encoding:binary;[R1] [C1] column_is_not_null:true;[R1] [C1] column_value_new:[78](2);[R1] [C1] column_value_old:[78](2);[R1] [C2] column_name:C1;[R1] [C2] column_type:MYSQL_TYPE_DOUBLE;[R1] [C2] column_is_rowkey:false;[R1] [C2] column_is_signed:true;[R1] [C2] column_encoding:binary;[R1] [C2] column_is_not_null:false;[R1] [C2] column_value_new:[1.2E-001](8);[R1] [C2] column_value_old:[1.234E+001](10);[R1] [C3] column_name:C2;[R1] [C3] column_type:MYSQL_TYPE_FLOAT;[R1] [C3] column_is_rowkey:false;[R1] [C3] column_is_signed:true;[R1] [C3] column_encoding:binary;[R1] [C3] column_is_not_null:false;[R1] [C3] column_value_new:[1.19999997E-001](15);[R1] [C3] column_value_old:[1.23400002E+001](15);[R1] [C4] column_name:C3;[R1] [C4] column_type:MYSQL_TYPE_NEWDECIMAL;[R1] [C4] column_is_rowkey:false;[R1] [C4] column_is_signed:true;[R1] [C4] column_encoding:binary;[R1] [C4] column_is_not_null:false;[R1] [C4] column_value_new:[.12](3);[R1] [C4] column_value_old:[12.34](5);[R1] [C5] column_name:C4;[R1] [C5] column_type:MYSQL_TYPE_OB_NUMBER_FLOAT;[R1] [C5] column_is_rowkey:false;[R1] [C5] column_is_signed:true;[R1] [C5] column_encoding:binary;[R1] [C5] column_is_not_null:false;[R1] [C5] column_value_new:[.12](3);[R1] [C5] column_value_old:[12.34](5);[R1] [C6] column_name:C5;[R1] [C6] column_type:MYSQL_TYPE_OB_NUMBER_FLOAT;[R1] [C6] column_is_rowkey:false;[R1] [C6] column_is_signed:true;[R1] [C6] column_encoding:binary;[R1] [C6] column_is_not_null:false;[R1] [C6] column_value_new:[.12](3);[R1] [C6] column_value_old:[12.34](5);[R1] [C7] column_name:C6;[R1] [C7] column_type:MYSQL_TYPE_VAR_STRING;[R1] [C7] column_is_rowkey:false;[R1] [C7] column_is_signed:true;[R1] [C7] column_encoding:utf8mb4;[R1] [C7] column_is_not_null:false;[R1] [C7] column_value_new:[0.12](4);[R1] [C7] column_value_old:[0.12](4);[R1] [C8] column_name:C7;[R1] [C8] column_type:MYSQL_TYPE_STRING;[R1] [C8] column_is_rowkey:false;[R1] [C8] column_is_signed:true;[R1] [C8] column_encoding:utf8mb4;[R1] [C8] column_is_not_null:false;[R1] [C8] column_value_new:[0.12                                                                                                ](100);[R1] [C8] column_value_old:[12.34                                                                                               ](100);$[R2] COMMIT;
update number_1 set c1=c6, c2=c6, c3=c6, c4=c6, c5=c6, c7=c6 where c0 = 79;
select c0, c6, c1, c2, c3, c4, c5, c7 from number_1 where c0 = 79;
C0	C6	C1	C2	C3	C4	C5	C7
79	0.1	1.0000000000000001E-001	1.00000001E-001	.1	.1	.1	0.1                                                                                                 
ob1.oblog.next;
[R0] BEGIN;[R0] org_cluster_id:1;[R1] record_type:UPDATE;[R1] database_name:oracle.OBLOG_DB;[R1] table_name:NUMBER_1;[R1] log_event:true;[R1] column_count:8;[R1] source_category:SRC_FULL_RECORDED;[R1] source_type:SRC_OCEANBASE_1_0;[R1] has_pk:true;[R1] pk_info:(0);[R1] pks:C0;[R1] has_uk:false;[R1] uk_info:(null);[R1] uks:(null);[R1] [C1] column_name:C0;[R1] [C1] column_type:MYSQL_TYPE_NEWDECIMAL;[R1] [C1] column_is_rowkey:true;[R1] [C1] column_is_signed:true;[R1] [C1] column_encoding:binary;[R1] [C1] column_is_not_null:true;[R1] [C1] column_value_new:[79](2);[R1] [C1] column_value_old:[79](2);[R1] [C2] column_name:C1;[R1] [C2] column_type:MYSQL_TYPE_DOUBLE;[R1] [C2] column_is_rowkey:false;[R1] [C2] column_is_signed:true;[R1] [C2] column_encoding:binary;[R1] [C2] column_is_not_null:false;[R1] [C2] column_value_new:[1.0000000000000001E-001](23);[R1] [C2] column_value_old:[1.234E+001](10);[R1] [C3] column_name:C2;[R1] [C3] column_type:MYSQL_TYPE_FLOAT;[R1] [C3] column_is_rowkey:false;[R1] [C3] column_is_signed:true;[R1] [C3] column_encoding:binary;[R1] [C3] column_is_not_null:false;[R1] [C3] column_value_new:[1.00000001E-001](15);[R1] [C3] column_value_old:[1.23400002E+001](15);[R1] [C4] column_name:C3;[R1] [C4] column_type:MYSQL_TYPE_NEWDECIMAL;[R1] [C4] column_is_rowkey:false;[R1] [C4] column_is_signed:true;[R1] [C4] column_encoding:binary;[R1] [C4] column_is_not_null:false;[R1] [C4] column_value_new:[.1](2);[R1] [C4] column_value_old:[12.34](5);[R1] [C5] column_name:C4;[R1] [C5] column_type:MYSQL_TYPE_OB_NUMBER_FLOAT;[R1] [C5] column_is_rowkey:false;[R1] [C5] column_is_signed:true;[R1] [C5] column_encoding:binary;[R1] [C5] column_is_not_null:false;[R1] [C5] column_value_new:[.1](2);[R1] [C5] column_value_old:[12.34](5);[R1] [C6] column_name:C5;[R1] [C6] column_type:MYSQL_TYPE_OB_NUMBER_FLOAT;[R1] [C6] column_is_rowkey:false;[R1] [C6] column_is_signed:true;[R1] [C6] column_encoding:binary;[R1] [C6] column_is_not_null:false;[R1] [C6] column_value_new:[.1](2);[R1] [C6] column_value_old:[12.34](5);[R1] [C7] column_name:C6;[R1] [C7] column_type:MYSQL_TYPE_VAR_STRING;[R1] [C7] column_is_rowkey:false;[R1] [C7] column_is_signed:true;[R1] [C7] column_encoding:utf8mb4;[R1] [C7] column_is_not_null:false;[R1] [C7] column_value_new:[0.1](3);[R1] [C7] column_value_old:[0.1](3);[R1] [C8] column_name:C7;[R1] [C8] column_type:MYSQL_TYPE_STRING;[R1] [C8] column_is_rowkey:false;[R1] [C8] column_is_signed:true;[R1] [C8] column_encoding:utf8mb4;[R1] [C8] column_is_not_null:false;[R1] [C8] column_value_new:[0.1                                                                                                 ](100);[R1] [C8] column_value_old:[12.34                                                                                               ](100);$[R2] COMMIT;
update number_1 set c1=c6, c2=c6, c3=c6, c4=c6, c5=c6, c7=c6 where c0 = 80;
select c0, c6, c1, c2, c3, c4, c5, c7 from number_1 where c0 = 80;
C0	C6	C1	C2	C3	C4	C5	C7
80	1.23e30	1.23E+030	1.22999997E+030	1230000000000000000000000000000	1230000000000000000000000000000	1230000000000000000000000000000	1.23e30                                                                                             
ob1.oblog.next;
[R0] BEGIN;[R0] org_cluster_id:1;[R1] record_type:UPDATE;[R1] database_name:oracle.OBLOG_DB;[R1] table_name:NUMBER_1;[R1] log_event:true;[R1] column_count:8;[R1] source_category:SRC_FULL_RECORDED;[R1] source_type:SRC_OCEANBASE_1_0;[R1] has_pk:true;[R1] pk_info:(0);[R1] pks:C0;[R1] has_uk:false;[R1] uk_info:(null);[R1] uks:(null);[R1] [C1] column_name:C0;[R1] [C1] column_type:MYSQL_TYPE_NEWDECIMAL;[R1] [C1] column_is_rowkey:true;[R1] [C1] column_is_signed:true;[R1] [C1] column_encoding:binary;[R1] [C1] column_is_not_null:true;[R1] [C1] column_value_new:[80](2);[R1] [C1] column_value_old:[80](2);[R1] [C2] column_name:C1;[R1] [C2] column_type:MYSQL_TYPE_DOUBLE;[R1] [C2] column_is_rowkey:false;[R1] [C2] column_is_signed:true;[R1] [C2] column_encoding:binary;[R1] [C2] column_is_not_null:false;[R1] [C2] column_value_new:[1.23E+030](9);[R1] [C2] column_value_old:[1.234E+001](10);[R1] [C3] column_name:C2;[R1] [C3] column_type:MYSQL_TYPE_FLOAT;[R1] [C3] column_is_rowkey:false;[R1] [C3] column_is_signed:true;[R1] [C3] column_encoding:binary;[R1] [C3] column_is_not_null:false;[R1] [C3] column_value_new:[1.22999997E+030](15);[R1] [C3] column_value_old:[1.23400002E+001](15);[R1] [C4] column_name:C3;[R1] [C4] column_type:MYSQL_TYPE_NEWDECIMAL;[R1] [C4] column_is_rowkey:false;[R1] [C4] column_is_signed:true;[R1] [C4] column_encoding:binary;[R1] [C4] column_is_not_null:false;[R1] [C4] column_value_new:[1230000000000000000000000000000](31);[R1] [C4] column_value_old:[12.34](5);[R1] [C5] column_name:C4;[R1] [C5] column_type:MYSQL_TYPE_OB_NUMBER_FLOAT;[R1] [C5] column_is_rowkey:false;[R1] [C5] column_is_signed:true;[R1] [C5] column_encoding:binary;[R1] [C5] column_is_not_null:false;[R1] [C5] column_value_new:[1230000000000000000000000000000](31);[R1] [C5] column_value_old:[12.34](5);[R1] [C6] column_name:C5;[R1] [C6] column_type:MYSQL_TYPE_OB_NUMBER_FLOAT;[R1] [C6] column_is_rowkey:false;[R1] [C6] column_is_signed:true;[R1] [C6] column_encoding:binary;[R1] [C6] column_is_not_null:false;[R1] [C6] column_value_new:[1230000000000000000000000000000](31);[R1] [C6] column_value_old:[12.34](5);[R1] [C7] column_name:C6;[R1] [C7] column_type:MYSQL_TYPE_VAR_STRING;[R1] [C7] column_is_rowkey:false;[R1] [C7] column_is_signed:true;[R1] [C7] column_encoding:utf8mb4;[R1] [C7] column_is_not_null:false;[R1] [C7] column_value_new:[1.23e30](7);[R1] [C7] column_value_old:[1.23e30](7);[R1] [C8] column_name:C7;[R1] [C8] column_type:MYSQL_TYPE_STRING;[R1] [C8] column_is_rowkey:false;[R1] [C8] column_is_signed:true;[R1] [C8] column_encoding:utf8mb4;[R1] [C8] column_is_not_null:false;[R1] [C8] column_value_new:[1.23e30                                                                                             ](100);[R1] [C8] column_value_old:[12.34                                                                                               ](100);$[R2] COMMIT;
update number_1 set c1=c6, c2=c6, c3=c6, c4=c6, c5=c6, c7=c6 where c0 = 81;
select c0, c6, c1, c2, c3, c4, c5, c7 from number_1 where c0 = 81;
C0	C6	C1	C2	C3	C4	C5	C7
81	1.23e-30	1.2300000000000001E-030	1.22999995E-030	.00000000000000000000000000000123	.00000000000000000000000000000123	.00000000000000000000000000000123	1.23e-30                                                                                            
ob1.oblog.next;
[R0] BEGIN;[R0] org_cluster_id:1;[R1] record_type:UPDATE;[R1] database_name:oracle.OBLOG_DB;[R1] table_name:NUMBER_1;[R1] log_event:true;[R1] column_count:8;[R1] source_category:SRC_FULL_RECORDED;[R1] source_type:SRC_OCEANBASE_1_0;[R1] has_pk:true;[R1] pk_info:(0);[R1] pks:C0;[R1] has_uk:false;[R1] uk_info:(null);[R1] uks:(null);[R1] [C1] column_name:C0;[R1] [C1] column_type:MYSQL_TYPE_NEWDECIMAL;[R1] [C1] column_is_rowkey:true;[R1] [C1] column_is_signed:true;[R1] [C1] column_encoding:binary;[R1] [C1] column_is_not_null:true;[R1] [C1] column_value_new:[81](2);[R1] [C1] column_value_old:[81](2);[R1] [C2] column_name:C1;[R1] [C2] column_type:MYSQL_TYPE_DOUBLE;[R1] [C2] column_is_rowkey:false;[R1] [C2] column_is_signed:true;[R1] [C2] column_encoding:binary;[R1] [C2] column_is_not_null:false;[R1] [C2] column_value_new:[1.2300000000000001E-030](23);[R1] [C2] column_value_old:[1.234E+001](10);[R1] [C3] column_name:C2;[R1] [C3] column_type:MYSQL_TYPE_FLOAT;[R1] [C3] column_is_rowkey:false;[R1] [C3] column_is_signed:true;[R1] [C3] column_encoding:binary;[R1] [C3] column_is_not_null:false;[R1] [C3] column_value_new:[1.22999995E-030](15);[R1] [C3] column_value_old:[1.23400002E+001](15);[R1] [C4] column_name:C3;[R1] [C4] column_type:MYSQL_TYPE_NEWDECIMAL;[R1] [C4] column_is_rowkey:false;[R1] [C4] column_is_signed:true;[R1] [C4] column_encoding:binary;[R1] [C4] column_is_not_null:false;[R1] [C4] column_value_new:[.00000000000000000000000000000123](33);[R1] [C4] column_value_old:[12.34](5);[R1] [C5] column_name:C4;[R1] [C5] column_type:MYSQL_TYPE_OB_NUMBER_FLOAT;[R1] [C5] column_is_rowkey:false;[R1] [C5] column_is_signed:true;[R1] [C5] column_encoding:binary;[R1] [C5] column_is_not_null:false;[R1] [C5] column_value_new:[.00000000000000000000000000000123](33);[R1] [C5] column_value_old:[12.34](5);[R1] [C6] column_name:C5;[R1] [C6] column_type:MYSQL_TYPE_OB_NUMBER_FLOAT;[R1] [C6] column_is_rowkey:false;[R1] [C6] column_is_signed:true;[R1] [C6] column_encoding:binary;[R1] [C6] column_is_not_null:false;[R1] [C6] column_value_new:[.00000000000000000000000000000123](33);[R1] [C6] column_value_old:[12.34](5);[R1] [C7] column_name:C6;[R1] [C7] column_type:MYSQL_TYPE_VAR_STRING;[R1] [C7] column_is_rowkey:false;[R1] [C7] column_is_signed:true;[R1] [C7] column_encoding:utf8mb4;[R1] [C7] column_is_not_null:false;[R1] [C7] column_value_new:[1.23e-30](8);[R1] [C7] column_value_old:[1.23e-30](8);[R1] [C8] column_name:C7;[R1] [C8] column_type:MYSQL_TYPE_STRING;[R1] [C8] column_is_rowkey:false;[R1] [C8] column_is_signed:true;[R1] [C8] column_encoding:utf8mb4;[R1] [C8] column_is_not_null:false;[R1] [C8] column_value_new:[1.23e-30                                                                                            ](100);[R1] [C8] column_value_old:[12.34                                                                                               ](100);$[R2] COMMIT;
update number_1 set c1=c6, c2=c6, c3=c6, c4=c6, c5=c6, c7=c6 where c0 = 82;
select c0, c6, c1, c2, c3, c4, c5, c7 from number_1 where c0 = 82;
C0	C6	C1	C2	C3	C4	C5	C7
82	1.23456789123456789123456789123456789123456789	1.2345678912345679E+000	1.23456788E+000	1.23456789123456789123456789123456789123	1.235	1.2345678912345678912345678912345678912	1.23456789123456789123456789123456789123456789                                                      
ob1.oblog.next;
[R0] BEGIN;[R0] org_cluster_id:1;[R1] record_type:UPDATE;[R1] database_name:oracle.OBLOG_DB;[R1] table_name:NUMBER_1;[R1] log_event:true;[R1] column_count:8;[R1] source_category:SRC_FULL_RECORDED;[R1] source_type:SRC_OCEANBASE_1_0;[R1] has_pk:true;[R1] pk_info:(0);[R1] pks:C0;[R1] has_uk:false;[R1] uk_info:(null);[R1] uks:(null);[R1] [C1] column_name:C0;[R1] [C1] column_type:MYSQL_TYPE_NEWDECIMAL;[R1] [C1] column_is_rowkey:true;[R1] [C1] column_is_signed:true;[R1] [C1] column_encoding:binary;[R1] [C1] column_is_not_null:true;[R1] [C1] column_value_new:[82](2);[R1] [C1] column_value_old:[82](2);[R1] [C2] column_name:C1;[R1] [C2] column_type:MYSQL_TYPE_DOUBLE;[R1] [C2] column_is_rowkey:false;[R1] [C2] column_is_signed:true;[R1] [C2] column_encoding:binary;[R1] [C2] column_is_not_null:false;[R1] [C2] column_value_new:[1.2345678912345679E+000](23);[R1] [C2] column_value_old:[1.234E+001](10);[R1] [C3] column_name:C2;[R1] [C3] column_type:MYSQL_TYPE_FLOAT;[R1] [C3] column_is_rowkey:false;[R1] [C3] column_is_signed:true;[R1] [C3] column_encoding:binary;[R1] [C3] column_is_not_null:false;[R1] [C3] column_value_new:[1.23456788E+000](15);[R1] [C3] column_value_old:[1.23400002E+001](15);[R1] [C4] column_name:C3;[R1] [C4] column_type:MYSQL_TYPE_NEWDECIMAL;[R1] [C4] column_is_rowkey:false;[R1] [C4] column_is_signed:true;[R1] [C4] column_encoding:binary;[R1] [C4] column_is_not_null:false;[R1] [C4] column_value_new:[1.23456789123456789123456789123456789123](40);[R1] [C4] column_value_old:[12.34](5);[R1] [C5] column_name:C4;[R1] [C5] column_type:MYSQL_TYPE_OB_NUMBER_FLOAT;[R1] [C5] column_is_rowkey:false;[R1] [C5] column_is_signed:true;[R1] [C5] column_encoding:binary;[R1] [C5] column_is_not_null:false;[R1] [C5] column_value_new:[1.235](5);[R1] [C5] column_value_old:[12.34](5);[R1] [C6] column_name:C5;[R1] [C6] column_type:MYSQL_TYPE_OB_NUMBER_FLOAT;[R1] [C6] column_is_rowkey:false;[R1] [C6] column_is_signed:true;[R1] [C6] column_encoding:binary;[R1] [C6] column_is_not_null:false;[R1] [C6] column_value_new:[1.2345678912345678912345678912345678912](39);[R1] [C6] column_value_old:[12.34](5);[R1] [C7] column_name:C6;[R1] [C7] column_type:MYSQL_TYPE_VAR_STRING;[R1] [C7] column_is_rowkey:false;[R1] [C7] column_is_signed:true;[R1] [C7] column_encoding:utf8mb4;[R1] [C7] column_is_not_null:false;[R1] [C7] column_value_new:[1.23456789123456789123456789123456789123456789](46);[R1] [C7] column_value_old:[1.23456789123456789123456789123456789123456789](46);[R1] [C8] column_name:C7;[R1] [C8] column_type:MYSQL_TYPE_STRING;[R1] [C8] column_is_rowkey:false;[R1] [C8] column_is_signed:true;[R1] [C8] column_encoding:utf8mb4;[R1] [C8] column_is_not_null:false;[R1] [C8] column_value_new:[1.23456789123456789123456789123456789123456789                                                      ](100);[R1] [C8] column_value_old:[12.34                                                                                               ](100);$[R2] COMMIT;
update number_1 set c1=c6, c2=c6, c3=c6, c4=c6, c5=c6, c7=c6 where c0 = 119;
select c0, c6, c1, c2, c3, c4, c5, c7 from number_1 where c0 = 119;
C0	C6	C1	C2	C3	C4	C5	C7
119	-0	0	0	0	0	0	-0                                                                                                  
ob1.oblog.next;
[R0] BEGIN;[R0] org_cluster_id:1;[R1] record_type:UPDATE;[R1] database_name:oracle.OBLOG_DB;[R1] table_name:NUMBER_1;[R1] log_event:true;[R1] column_count:8;[R1] source_category:SRC_FULL_RECORDED;[R1] source_type:SRC_OCEANBASE_1_0;[R1] has_pk:true;[R1] pk_info:(0);[R1] pks:C0;[R1] has_uk:false;[R1] uk_info:(null);[R1] uks:(null);[R1] [C1] column_name:C0;[R1] [C1] column_type:MYSQL_TYPE_NEWDECIMAL;[R1] [C1] column_is_rowkey:true;[R1] [C1] column_is_signed:true;[R1] [C1] column_encoding:binary;[R1] [C1] column_is_not_null:true;[R1] [C1] column_value_new:[119](3);[R1] [C1] column_value_old:[119](3);[R1] [C2] column_name:C1;[R1] [C2] column_type:MYSQL_TYPE_DOUBLE;[R1] [C2] column_is_rowkey:false;[R1] [C2] column_is_signed:true;[R1] [C2] column_encoding:binary;[R1] [C2] column_is_not_null:false;[R1] [C2] column_value_new:[0](1);[R1] [C2] column_value_old:[1.234E+001](10);[R1] [C3] column_name:C2;[R1] [C3] column_type:MYSQL_TYPE_FLOAT;[R1] [C3] column_is_rowkey:false;[R1] [C3] column_is_signed:true;[R1] [C3] column_encoding:binary;[R1] [C3] column_is_not_null:false;[R1] [C3] column_value_new:[0](1);[R1] [C3] column_value_old:[1.23400002E+001](15);[R1] [C4] column_name:C3;[R1] [C4] column_type:MYSQL_TYPE_NEWDECIMAL;[R1] [C4] column_is_rowkey:false;[R1] [C4] column_is_signed:true;[R1] [C4] column_encoding:binary;[R1] [C4] column_is_not_null:false;[R1] [C4] column_value_new:[0](1);[R1] [C4] column_value_old:[12.34](5);[R1] [C5] column_name:C4;[R1] [C5] column_type:MYSQL_TYPE_OB_NUMBER_FLOAT;[R1] [C5] column_is_rowkey:false;[R1] [C5] column_is_signed:true;[R1] [C5] column_encoding:binary;[R1] [C5] column_is_not_null:false;[R1] [C5] column_value_new:[0](1);[R1] [C5] column_value_old:[12.34](5);[R1] [C6] column_name:C5;[R1] [C6] column_type:MYSQL_TYPE_OB_NUMBER_FLOAT;[R1] [C6] column_is_rowkey:false;[R1] [C6] column_is_signed:true;[R1] [C6] column_encoding:binary;[R1] [C6] column_is_not_null:false;[R1] [C6] column_value_new:[0](1);[R1] [C6] column_value_old:[12.34](5);[R1] [C7] column_name:C6;[R1] [C7] column_type:MYSQL_TYPE_VAR_STRING;[R1] [C7] column_is_rowkey:false;[R1] [C7] column_is_signed:true;[R1] [C7] column_encoding:utf8mb4;[R1] [C7] column_is_not_null:false;[R1] [C7] column_value_new:[-0](2);[R1] [C7] column_value_old:[-0](2);[R1] [C8] column_name:C7;[R1] [C8] column_type:MYSQL_TYPE_STRING;[R1] [C8] column_is_rowkey:false;[R1] [C8] column_is_signed:true;[R1] [C8] column_encoding:utf8mb4;[R1] [C8] column_is_not_null:false;[R1] [C8] column_value_new:[-0                                                                                                  ](100);[R1] [C8] column_value_old:[12.34                                                                                               ](100);$[R2] COMMIT;
update number_1 set c1=c6, c2=c6, c3=c6, c4=c6, c5=c6, c7=c6 where c0 = 120;
select c0, c6, c1, c2, c3, c4, c5, c7 from number_1 where c0 = 120;
C0	C6	C1	C2	C3	C4	C5	C7
120	-0.0	0	0	0	0	0	-0.0                                                                                                
ob1.oblog.next;
[R0] BEGIN;[R0] org_cluster_id:1;[R1] record_type:UPDATE;[R1] database_name:oracle.OBLOG_DB;[R1] table_name:NUMBER_1;[R1] log_event:true;[R1] column_count:8;[R1] source_category:SRC_FULL_RECORDED;[R1] source_type:SRC_OCEANBASE_1_0;[R1] has_pk:true;[R1] pk_info:(0);[R1] pks:C0;[R1] has_uk:false;[R1] uk_info:(null);[R1] uks:(null);[R1] [C1] column_name:C0;[R1] [C1] column_type:MYSQL_TYPE_NEWDECIMAL;[R1] [C1] column_is_rowkey:true;[R1] [C1] column_is_signed:true;[R1] [C1] column_encoding:binary;[R1] [C1] column_is_not_null:true;[R1] [C1] column_value_new:[120](3);[R1] [C1] column_value_old:[120](3);[R1] [C2] column_name:C1;[R1] [C2] column_type:MYSQL_TYPE_DOUBLE;[R1] [C2] column_is_rowkey:false;[R1] [C2] column_is_signed:true;[R1] [C2] column_encoding:binary;[R1] [C2] column_is_not_null:false;[R1] [C2] column_value_new:[0](1);[R1] [C2] column_value_old:[1.234E+001](10);[R1] [C3] column_name:C2;[R1] [C3] column_type:MYSQL_TYPE_FLOAT;[R1] [C3] column_is_rowkey:false;[R1] [C3] column_is_signed:true;[R1] [C3] column_encoding:binary;[R1] [C3] column_is_not_null:false;[R1] [C3] column_value_new:[0](1);[R1] [C3] column_value_old:[1.23400002E+001](15);[R1] [C4] column_name:C3;[R1] [C4] column_type:MYSQL_TYPE_NEWDECIMAL;[R1] [C4] column_is_rowkey:false;[R1] [C4] column_is_signed:true;[R1] [C4] column_encoding:binary;[R1] [C4] column_is_not_null:false;[R1] [C4] column_value_new:[0](1);[R1] [C4] column_value_old:[12.34](5);[R1] [C5] column_name:C4;[R1] [C5] column_type:MYSQL_TYPE_OB_NUMBER_FLOAT;[R1] [C5] column_is_rowkey:false;[R1] [C5] column_is_signed:true;[R1] [C5] column_encoding:binary;[R1] [C5] column_is_not_null:false;[R1] [C5] column_value_new:[0](1);[R1] [C5] column_value_old:[12.34](5);[R1] [C6] column_name:C5;[R1] [C6] column_type:MYSQL_TYPE_OB_NUMBER_FLOAT;[R1] [C6] column_is_rowkey:false;[R1] [C6] column_is_signed:true;[R1] [C6] column_encoding:binary;[R1] [C6] column_is_not_null:false;[R1] [C6] column_value_new:[0](1);[R1] [C6] column_value_old:[12.34](5);[R1] [C7] column_name:C6;[R1] [C7] column_type:MYSQL_TYPE_VAR_STRING;[R1] [C7] column_is_rowkey:false;[R1] [C7] column_is_signed:true;[R1] [C7] column_encoding:utf8mb4;[R1] [C7] column_is_not_null:false;[R1] [C7] column_value_new:[-0.0](4);[R1] [C7] column_value_old:[-0.0](4);[R1] [C8] column_name:C7;[R1] [C8] column_type:MYSQL_TYPE_STRING;[R1] [C8] column_is_rowkey:false;[R1] [C8] column_is_signed:true;[R1] [C8] column_encoding:utf8mb4;[R1] [C8] column_is_not_null:false;[R1] [C8] column_value_new:[-0.0                                                                                                ](100);[R1] [C8] column_value_old:[12.34                                                                                               ](100);$[R2] COMMIT;
update number_1 set c1=c6, c2=c6, c3=c6, c4=c6, c5=c6, c7=c6 where c0 = 121;
select c0, c6, c1, c2, c3, c4, c5, c7 from number_1 where c0 = 121;
C0	C6	C1	C2	C3	C4	C5	C7
121	-1	-1.0E+000	-1.0E+000	-1	-1	-1	-1                                                                                                  
ob1.oblog.next;
[R0] BEGIN;[R0] org_cluster_id:1;[R1] record_type:UPDATE;[R1] database_name:oracle.OBLOG_DB;[R1] table_name:NUMBER_1;[R1] log_event:true;[R1] column_count:8;[R1] source_category:SRC_FULL_RECORDED;[R1] source_type:SRC_OCEANBASE_1_0;[R1] has_pk:true;[R1] pk_info:(0);[R1] pks:C0;[R1] has_uk:false;[R1] uk_info:(null);[R1] uks:(null);[R1] [C1] column_name:C0;[R1] [C1] column_type:MYSQL_TYPE_NEWDECIMAL;[R1] [C1] column_is_rowkey:true;[R1] [C1] column_is_signed:true;[R1] [C1] column_encoding:binary;[R1] [C1] column_is_not_null:true;[R1] [C1] column_value_new:[121](3);[R1] [C1] column_value_old:[121](3);[R1] [C2] column_name:C1;[R1] [C2] column_type:MYSQL_TYPE_DOUBLE;[R1] [C2] column_is_rowkey:false;[R1] [C2] column_is_signed:true;[R1] [C2] column_encoding:binary;[R1] [C2] column_is_not_null:false;[R1] [C2] column_value_new:[-1.0E+000](9);[R1] [C2] column_value_old:[1.234E+001](10);[R1] [C3] column_name:C2;[R1] [C3] column_type:MYSQL_TYPE_FLOAT;[R1] [C3] column_is_rowkey:false;[R1] [C3] column_is_signed:true;[R1] [C3] column_encoding:binary;[R1] [C3] column_is_not_null:false;[R1] [C3] column_value_new:[-1.0E+000](9);[R1] [C3] column_value_old:[1.23400002E+001](15);[R1] [C4] column_name:C3;[R1] [C4] column_type:MYSQL_TYPE_NEWDECIMAL;[R1] [C4] column_is_rowkey:false;[R1] [C4] column_is_signed:true;[R1] [C4] column_encoding:binary;[R1] [C4] column_is_not_null:false;[R1] [C4] column_value_new:[-1](2);[R1] [C4] column_value_old:[12.34](5);[R1] [C5] column_name:C4;[R1] [C5] column_type:MYSQL_TYPE_OB_NUMBER_FLOAT;[R1] [C5] column_is_rowkey:false;[R1] [C5] column_is_signed:true;[R1] [C5] column_encoding:binary;[R1] [C5] column_is_not_null:false;[R1] [C5] column_value_new:[-1](2);[R1] [C5] column_value_old:[12.34](5);[R1] [C6] column_name:C5;[R1] [C6] column_type:MYSQL_TYPE_OB_NUMBER_FLOAT;[R1] [C6] column_is_rowkey:false;[R1] [C6] column_is_signed:true;[R1] [C6] column_encoding:binary;[R1] [C6] column_is_not_null:false;[R1] [C6] column_value_new:[-1](2);[R1] [C6] column_value_old:[12.34](5);[R1] [C7] column_name:C6;[R1] [C7] column_type:MYSQL_TYPE_VAR_STRING;[R1] [C7] column_is_rowkey:false;[R1] [C7] column_is_signed:true;[R1] [C7] column_encoding:utf8mb4;[R1] [C7] column_is_not_null:false;[R1] [C7] column_value_new:[-1](2);[R1] [C7] column_value_old:[-1](2);[R1] [C8] column_name:C7;[R1] [C8] column_type:MYSQL_TYPE_STRING;[R1] [C8] column_is_rowkey:false;[R1] [C8] column_is_signed:true;[R1] [C8] column_encoding:utf8mb4;[R1] [C8] column_is_not_null:false;[R1] [C8] column_value_new:[-1                                                                                                  ](100);[R1] [C8] column_value_old:[12.34                                                                                               ](100);$[R2] COMMIT;
update number_1 set c1=c6, c2=c6, c3=c6, c4=c6, c5=c6, c7=c6 where c0 = 122;
select c0, c6, c1, c2, c3, c4, c5, c7 from number_1 where c0 = 122;
C0	C6	C1	C2	C3	C4	C5	C7
122	-12	-1.2E+001	-1.2E+001	-12	-12	-12	-12                                                                                                 
ob1.oblog.next;
[R0] BEGIN;[R0] org_cluster_id:1;[R1] record_type:UPDATE;[R1] database_name:oracle.OBLOG_DB;[R1] table_name:NUMBER_1;[R1] log_event:true;[R1] column_count:8;[R1] source_category:SRC_FULL_RECORDED;[R1] source_type:SRC_OCEANBASE_1_0;[R1] has_pk:true;[R1] pk_info:(0);[R1] pks:C0;[R1] has_uk:false;[R1] uk_info:(null);[R1] uks:(null);[R1] [C1] column_name:C0;[R1] [C1] column_type:MYSQL_TYPE_NEWDECIMAL;[R1] [C1] column_is_rowkey:true;[R1] [C1] column_is_signed:true;[R1] [C1] column_encoding:binary;[R1] [C1] column_is_not_null:true;[R1] [C1] column_value_new:[122](3);[R1] [C1] column_value_old:[122](3);[R1] [C2] column_name:C1;[R1] [C2] column_type:MYSQL_TYPE_DOUBLE;[R1] [C2] column_is_rowkey:false;[R1] [C2] column_is_signed:true;[R1] [C2] column_encoding:binary;[R1] [C2] column_is_not_null:false;[R1] [C2] column_value_new:[-1.2E+001](9);[R1] [C2] column_value_old:[1.234E+001](10);[R1] [C3] column_name:C2;[R1] [C3] column_type:MYSQL_TYPE_FLOAT;[R1] [C3] column_is_rowkey:false;[R1] [C3] column_is_signed:true;[R1] [C3] column_encoding:binary;[R1] [C3] column_is_not_null:false;[R1] [C3] column_value_new:[-1.2E+001](9);[R1] [C3] column_value_old:[1.23400002E+001](15);[R1] [C4] column_name:C3;[R1] [C4] column_type:MYSQL_TYPE_NEWDECIMAL;[R1] [C4] column_is_rowkey:false;[R1] [C4] column_is_signed:true;[R1] [C4] column_encoding:binary;[R1] [C4] column_is_not_null:false;[R1] [C4] column_value_new:[-12](3);[R1] [C4] column_value_old:[12.34](5);[R1] [C5] column_name:C4;[R1] [C5] column_type:MYSQL_TYPE_OB_NUMBER_FLOAT;[R1] [C5] column_is_rowkey:false;[R1] [C5] column_is_signed:true;[R1] [C5] column_encoding:binary;[R1] [C5] column_is_not_null:false;[R1] [C5] column_value_new:[-12](3);[R1] [C5] column_value_old:[12.34](5);[R1] [C6] column_name:C5;[R1] [C6] column_type:MYSQL_TYPE_OB_NUMBER_FLOAT;[R1] [C6] column_is_rowkey:false;[R1] [C6] column_is_signed:true;[R1] [C6] column_encoding:binary;[R1] [C6] column_is_not_null:false;[R1] [C6] column_value_new:[-12](3);[R1] [C6] column_value_old:[12.34](5);[R1] [C7] column_name:C6;[R1] [C7] column_type:MYSQL_TYPE_VAR_STRING;[R1] [C7] column_is_rowkey:false;[R1] [C7] column_is_signed:true;[R1] [C7] column_encoding:utf8mb4;[R1] [C7] column_is_not_null:false;[R1] [C7] column_value_new:[-12](3);[R1] [C7] column_value_old:[-12](3);[R1] [C8] column_name:C7;[R1] [C8] column_type:MYSQL_TYPE_STRING;[R1] [C8] column_is_rowkey:false;[R1] [C8] column_is_signed:true;[R1] [C8] column_encoding:utf8mb4;[R1] [C8] column_is_not_null:false;[R1] [C8] column_value_new:[-12                                                                                                 ](100);[R1] [C8] column_value_old:[12.34                                                                                               ](100);$[R2] COMMIT;
update number_1 set c1=c6, c2=c6, c3=c6, c4=c6, c5=c6, c7=c6 where c0 = 123;
select c0, c6, c1, c2, c3, c4, c5, c7 from number_1 where c0 = 123;
C0	C6	C1	C2	C3	C4	C5	C7
123	-123	-1.23E+002	-1.23E+002	-123	-123	-123	-123                                                                                                
ob1.oblog.next;
[R0] BEGIN;[R0] org_cluster_id:1;[R1] record_type:UPDATE;[R1] database_name:oracle.OBLOG_DB;[R1] table_name:NUMBER_1;[R1] log_event:true;[R1] column_count:8;[R1] source_category:SRC_FULL_RECORDED;[R1] source_type:SRC_OCEANBASE_1_0;[R1] has_pk:true;[R1] pk_info:(0);[R1] pks:C0;[R1] has_uk:false;[R1] uk_info:(null);[R1] uks:(null);[R1] [C1] column_name:C0;[R1] [C1] column_type:MYSQL_TYPE_NEWDECIMAL;[R1] [C1] column_is_rowkey:true;[R1] [C1] column_is_signed:true;[R1] [C1] column_encoding:binary;[R1] [C1] column_is_not_null:true;[R1] [C1] column_value_new:[123](3);[R1] [C1] column_value_old:[123](3);[R1] [C2] column_name:C1;[R1] [C2] column_type:MYSQL_TYPE_DOUBLE;[R1] [C2] column_is_rowkey:false;[R1] [C2] column_is_signed:true;[R1] [C2] column_encoding:binary;[R1] [C2] column_is_not_null:false;[R1] [C2] column_value_new:[-1.23E+002](10);[R1] [C2] column_value_old:[1.234E+001](10);[R1] [C3] column_name:C2;[R1] [C3] column_type:MYSQL_TYPE_FLOAT;[R1] [C3] column_is_rowkey:false;[R1] [C3] column_is_signed:true;[R1] [C3] column_encoding:binary;[R1] [C3] column_is_not_null:false;[R1] [C3] column_value_new:[-1.23E+002](10);[R1] [C3] column_value_old:[1.23400002E+001](15);[R1] [C4] column_name:C3;[R1] [C4] column_type:MYSQL_TYPE_NEWDECIMAL;[R1] [C4] column_is_rowkey:false;[R1] [C4] column_is_signed:true;[R1] [C4] column_encoding:binary;[R1] [C4] column_is_not_null:false;[R1] [C4] column_value_new:[-123](4);[R1] [C4] column_value_old:[12.34](5);[R1] [C5] column_name:C4;[R1] [C5] column_type:MYSQL_TYPE_OB_NUMBER_FLOAT;[R1] [C5] column_is_rowkey:false;[R1] [C5] column_is_signed:true;[R1] [C5] column_encoding:binary;[R1] [C5] column_is_not_null:false;[R1] [C5] column_value_new:[-123](4);[R1] [C5] column_value_old:[12.34](5);[R1] [C6] column_name:C5;[R1] [C6] column_type:MYSQL_TYPE_OB_NUMBER_FLOAT;[R1] [C6] column_is_rowkey:false;[R1] [C6] column_is_signed:true;[R1] [C6] column_encoding:binary;[R1] [C6] column_is_not_null:false;[R1] [C6] column_value_new:[-123](4);[R1] [C6] column_value_old:[12.34](5);[R1] [C7] column_name:C6;[R1] [C7] column_type:MYSQL_TYPE_VAR_STRING;[R1] [C7] column_is_rowkey:false;[R1] [C7] column_is_signed:true;[R1] [C7] column_encoding:utf8mb4;[R1] [C7] column_is_not_null:false;[R1] [C7] column_value_new:[-123](4);[R1] [C7] column_value_old:[-123](4);[R1] [C8] column_name:C7;[R1] [C8] column_type:MYSQL_TYPE_STRING;[R1] [C8] column_is_rowkey:false;[R1] [C8] column_is_signed:true;[R1] [C8] column_encoding:utf8mb4;[R1] [C8] column_is_not_null:false;[R1] [C8] column_value_new:[-123                                                                                                ](100);[R1] [C8] column_value_old:[12.34                                                                                               ](100);$[R2] COMMIT;
update number_1 set c1=c6, c2=c6, c3=c6, c4=c6, c5=c6, c7=c6 where c0 = 124;
select c0, c6, c1, c2, c3, c4, c5, c7 from number_1 where c0 = 124;
C0	C6	C1	C2	C3	C4	C5	C7
124	-1234	-1.234E+003	-1.234E+003	-1234	-1234	-1234	-1234                                                                                               
ob1.oblog.next;
[R0] BEGIN;[R0] org_cluster_id:1;[R1] record_type:UPDATE;[R1] database_name:oracle.OBLOG_DB;[R1] table_name:NUMBER_1;[R1] log_event:true;[R1] column_count:8;[R1] source_category:SRC_FULL_RECORDED;[R1] source_type:SRC_OCEANBASE_1_0;[R1] has_pk:true;[R1] pk_info:(0);[R1] pks:C0;[R1] has_uk:false;[R1] uk_info:(null);[R1] uks:(null);[R1] [C1] column_name:C0;[R1] [C1] column_type:MYSQL_TYPE_NEWDECIMAL;[R1] [C1] column_is_rowkey:true;[R1] [C1] column_is_signed:true;[R1] [C1] column_encoding:binary;[R1] [C1] column_is_not_null:true;[R1] [C1] column_value_new:[124](3);[R1] [C1] column_value_old:[124](3);[R1] [C2] column_name:C1;[R1] [C2] column_type:MYSQL_TYPE_DOUBLE;[R1] [C2] column_is_rowkey:false;[R1] [C2] column_is_signed:true;[R1] [C2] column_encoding:binary;[R1] [C2] column_is_not_null:false;[R1] [C2] column_value_new:[-1.234E+003](11);[R1] [C2] column_value_old:[1.234E+001](10);[R1] [C3] column_name:C2;[R1] [C3] column_type:MYSQL_TYPE_FLOAT;[R1] [C3] column_is_rowkey:false;[R1] [C3] column_is_signed:true;[R1] [C3] column_encoding:binary;[R1] [C3] column_is_not_null:false;[R1] [C3] column_value_new:[-1.234E+003](11);[R1] [C3] column_value_old:[1.23400002E+001](15);[R1] [C4] column_name:C3;[R1] [C4] column_type:MYSQL_TYPE_NEWDECIMAL;[R1] [C4] column_is_rowkey:false;[R1] [C4] column_is_signed:true;[R1] [C4] column_encoding:binary;[R1] [C4] column_is_not_null:false;[R1] [C4] column_value_new:[-1234](5);[R1] [C4] column_value_old:[12.34](5);[R1] [C5] column_name:C4;[R1] [C5] column_type:MYSQL_TYPE_OB_NUMBER_FLOAT;[R1] [C5] column_is_rowkey:false;[R1] [C5] column_is_signed:true;[R1] [C5] column_encoding:binary;[R1] [C5] column_is_not_null:false;[R1] [C5] column_value_new:[-1234](5);[R1] [C5] column_value_old:[12.34](5);[R1] [C6] column_name:C5;[R1] [C6] column_type:MYSQL_TYPE_OB_NUMBER_FLOAT;[R1] [C6] column_is_rowkey:false;[R1] [C6] column_is_signed:true;[R1] [C6] column_encoding:binary;[R1] [C6] column_is_not_null:false;[R1] [C6] column_value_new:[-1234](5);[R1] [C6] column_value_old:[12.34](5);[R1] [C7] column_name:C6;[R1] [C7] column_type:MYSQL_TYPE_VAR_STRING;[R1] [C7] column_is_rowkey:false;[R1] [C7] column_is_signed:true;[R1] [C7] column_encoding:utf8mb4;[R1] [C7] column_is_not_null:false;[R1] [C7] column_value_new:[-1234](5);[R1] [C7] column_value_old:[-1234](5);[R1] [C8] column_name:C7;[R1] [C8] column_type:MYSQL_TYPE_STRING;[R1] [C8] column_is_rowkey:false;[R1] [C8] column_is_signed:true;[R1] [C8] column_encoding:utf8mb4;[R1] [C8] column_is_not_null:false;[R1] [C8] column_value_new:[-1234                                                                                               ](100);[R1] [C8] column_value_old:[12.34                                                                                               ](100);$[R2] COMMIT;
update number_1 set c1=c6, c2=c6, c3=c6, c4=c6, c5=c6, c7=c6 where c0 = 125;
select c0, c6, c1, c2, c3, c4, c5, c7 from number_1 where c0 = 125;
C0	C6	C1	C2	C3	C4	C5	C7
125	-12345	-1.2345E+004	-1.2345E+004	-12345	-12350	-12345	-12345                                                                                              
ob1.oblog.next;
[R0] BEGIN;[R0] org_cluster_id:1;[R1] record_type:UPDATE;[R1] database_name:oracle.OBLOG_DB;[R1] table_name:NUMBER_1;[R1] log_event:true;[R1] column_count:8;[R1] source_category:SRC_FULL_RECORDED;[R1] source_type:SRC_OCEANBASE_1_0;[R1] has_pk:true;[R1] pk_info:(0);[R1] pks:C0;[R1] has_uk:false;[R1] uk_info:(null);[R1] uks:(null);[R1] [C1] column_name:C0;[R1] [C1] column_type:MYSQL_TYPE_NEWDECIMAL;[R1] [C1] column_is_rowkey:true;[R1] [C1] column_is_signed:true;[R1] [C1] column_encoding:binary;[R1] [C1] column_is_not_null:true;[R1] [C1] column_value_new:[125](3);[R1] [C1] column_value_old:[125](3);[R1] [C2] column_name:C1;[R1] [C2] column_type:MYSQL_TYPE_DOUBLE;[R1] [C2] column_is_rowkey:false;[R1] [C2] column_is_signed:true;[R1] [C2] column_encoding:binary;[R1] [C2] column_is_not_null:false;[R1] [C2] column_value_new:[-1.2345E+004](12);[R1] [C2] column_value_old:[1.234E+001](10);[R1] [C3] column_name:C2;[R1] [C3] column_type:MYSQL_TYPE_FLOAT;[R1] [C3] column_is_rowkey:false;[R1] [C3] column_is_signed:true;[R1] [C3] column_encoding:binary;[R1] [C3] column_is_not_null:false;[R1] [C3] column_value_new:[-1.2345E+004](12);[R1] [C3] column_value_old:[1.23400002E+001](15);[R1] [C4] column_name:C3;[R1] [C4] column_type:MYSQL_TYPE_NEWDECIMAL;[R1] [C4] column_is_rowkey:false;[R1] [C4] column_is_signed:true;[R1] [C4] column_encoding:binary;[R1] [C4] column_is_not_null:false;[R1] [C4] column_value_new:[-12345](6);[R1] [C4] column_value_old:[12.34](5);[R1] [C5] column_name:C4;[R1] [C5] column_type:MYSQL_TYPE_OB_NUMBER_FLOAT;[R1] [C5] column_is_rowkey:false;[R1] [C5] column_is_signed:true;[R1] [C5] column_encoding:binary;[R1] [C5] column_is_not_null:false;[R1] [C5] column_value_new:[-12350](6);[R1] [C5] column_value_old:[12.34](5);[R1] [C6] column_name:C5;[R1] [C6] column_type:MYSQL_TYPE_OB_NUMBER_FLOAT;[R1] [C6] column_is_rowkey:false;[R1] [C6] column_is_signed:true;[R1] [C6] column_encoding:binary;[R1] [C6] column_is_not_null:false;[R1] [C6] column_value_new:[-12345](6);[R1] [C6] column_value_old:[12.34](5);[R1] [C7] column_name:C6;[R1] [C7] column_type:MYSQL_TYPE_VAR_STRING;[R1] [C7] column_is_rowkey:false;[R1] [C7] column_is_signed:true;[R1] [C7] column_encoding:utf8mb4;[R1] [C7] column_is_not_null:false;[R1] [C7] column_value_new:[-12345](6);[R1] [C7] column_value_old:[-12345](6);[R1] [C8] column_name:C7;[R1] [C8] column_type:MYSQL_TYPE_STRING;[R1] [C8] column_is_rowkey:false;[R1] [C8] column_is_signed:true;[R1] [C8] column_encoding:utf8mb4;[R1] [C8] column_is_not_null:false;[R1] [C8] column_value_new:[-12345                                                                                              ](100);[R1] [C8] column_value_old:[12.34                                                                                               ](100);$[R2] COMMIT;
update number_1 set c1=c6, c2=c6, c3=c6, c4=c6, c5=c6, c7=c6 where c0 = 126;
select c0, c6, c1, c2, c3, c4, c5, c7 from number_1 where c0 = 126;
C0	C6	C1	C2	C3	C4	C5	C7
126	-123456	-1.23456E+005	-1.23456E+005	-123456	-123500	-123456	-123456                                                                                             
ob1.oblog.next;
[R0] BEGIN;[R0] org_cluster_id:1;[R1] record_type:UPDATE;[R1] database_name:oracle.OBLOG_DB;[R1] table_name:NUMBER_1;[R1] log_event:true;[R1] column_count:8;[R1] source_category:SRC_FULL_RECORDED;[R1] source_type:SRC_OCEANBASE_1_0;[R1] has_pk:true;[R1] pk_info:(0);[R1] pks:C0;[R1] has_uk:false;[R1] uk_info:(null);[R1] uks:(null);[R1] [C1] column_name:C0;[R1] [C1] column_type:MYSQL_TYPE_NEWDECIMAL;[R1] [C1] column_is_rowkey:true;[R1] [C1] column_is_signed:true;[R1] [C1] column_encoding:binary;[R1] [C1] column_is_not_null:true;[R1] [C1] column_value_new:[126](3);[R1] [C1] column_value_old:[126](3);[R1] [C2] column_name:C1;[R1] [C2] column_type:MYSQL_TYPE_DOUBLE;[R1] [C2] column_is_rowkey:false;[R1] [C2] column_is_signed:true;[R1] [C2] column_encoding:binary;[R1] [C2] column_is_not_null:false;[R1] [C2] column_value_new:[-1.23456E+005](13);[R1] [C2] column_value_old:[1.234E+001](10);[R1] [C3] column_name:C2;[R1] [C3] column_type:MYSQL_TYPE_FLOAT;[R1] [C3] column_is_rowkey:false;[R1] [C3] column_is_signed:true;[R1] [C3] column_encoding:binary;[R1] [C3] column_is_not_null:false;[R1] [C3] column_value_new:[-1.23456E+005](13);[R1] [C3] column_value_old:[1.23400002E+001](15);[R1] [C4] column_name:C3;[R1] [C4] column_type:MYSQL_TYPE_NEWDECIMAL;[R1] [C4] column_is_rowkey:false;[R1] [C4] column_is_signed:true;[R1] [C4] column_encoding:binary;[R1] [C4] column_is_not_null:false;[R1] [C4] column_value_new:[-123456](7);[R1] [C4] column_value_old:[12.34](5);[R1] [C5] column_name:C4;[R1] [C5] column_type:MYSQL_TYPE_OB_NUMBER_FLOAT;[R1] [C5] column_is_rowkey:false;[R1] [C5] column_is_signed:true;[R1] [C5] column_encoding:binary;[R1] [C5] column_is_not_null:false;[R1] [C5] column_value_new:[-123500](7);[R1] [C5] column_value_old:[12.34](5);[R1] [C6] column_name:C5;[R1] [C6] column_type:MYSQL_TYPE_OB_NUMBER_FLOAT;[R1] [C6] column_is_rowkey:false;[R1] [C6] column_is_signed:true;[R1] [C6] column_encoding:binary;[R1] [C6] column_is_not_null:false;[R1] [C6] column_value_new:[-123456](7);[R1] [C6] column_value_old:[12.34](5);[R1] [C7] column_name:C6;[R1] [C7] column_type:MYSQL_TYPE_VAR_STRING;[R1] [C7] column_is_rowkey:false;[R1] [C7] column_is_signed:true;[R1] [C7] column_encoding:utf8mb4;[R1] [C7] column_is_not_null:false;[R1] [C7] column_value_new:[-123456](7);[R1] [C7] column_value_old:[-123456](7);[R1] [C8] column_name:C7;[R1] [C8] column_type:MYSQL_TYPE_STRING;[R1] [C8] column_is_rowkey:false;[R1] [C8] column_is_signed:true;[R1] [C8] column_encoding:utf8mb4;[R1] [C8] column_is_not_null:false;[R1] [C8] column_value_new:[-123456                                                                                             ](100);[R1] [C8] column_value_old:[12.34                                                                                               ](100);$[R2] COMMIT;
update number_1 set c1=c6, c2=c6, c3=c6, c4=c6, c5=c6, c7=c6 where c0 = 127;
select c0, c6, c1, c2, c3, c4, c5, c7 from number_1 where c0 = 127;
C0	C6	C1	C2	C3	C4	C5	C7
127	-1234567	-1.234567E+006	-1.234567E+006	-1234567	-1235000	-1234567	-1234567                                                                                            
ob1.oblog.next;
[R0] BEGIN;[R0] org_cluster_id:1;[R1] record_type:UPDATE;[R1] database_name:oracle.OBLOG_DB;[R1] table_name:NUMBER_1;[R1] log_event:true;[R1] column_count:8;[R1] source_category:SRC_FULL_RECORDED;[R1] source_type:SRC_OCEANBASE_1_0;[R1] has_pk:true;[R1] pk_info:(0);[R1] pks:C0;[R1] has_uk:false;[R1] uk_info:(null);[R1] uks:(null);[R1] [C1] column_name:C0;[R1] [C1] column_type:MYSQL_TYPE_NEWDECIMAL;[R1] [C1] column_is_rowkey:true;[R1] [C1] column_is_signed:true;[R1] [C1] column_encoding:binary;[R1] [C1] column_is_not_null:true;[R1] [C1] column_value_new:[127](3);[R1] [C1] column_value_old:[127](3);[R1] [C2] column_name:C1;[R1] [C2] column_type:MYSQL_TYPE_DOUBLE;[R1] [C2] column_is_rowkey:false;[R1] [C2] column_is_signed:true;[R1] [C2] column_encoding:binary;[R1] [C2] column_is_not_null:false;[R1] [C2] column_value_new:[-1.234567E+006](14);[R1] [C2] column_value_old:[1.234E+001](10);[R1] [C3] column_name:C2;[R1] [C3] column_type:MYSQL_TYPE_FLOAT;[R1] [C3] column_is_rowkey:false;[R1] [C3] column_is_signed:true;[R1] [C3] column_encoding:binary;[R1] [C3] column_is_not_null:false;[R1] [C3] column_value_new:[-1.234567E+006](14);[R1] [C3] column_value_old:[1.23400002E+001](15);[R1] [C4] column_name:C3;[R1] [C4] column_type:MYSQL_TYPE_NEWDECIMAL;[R1] [C4] column_is_rowkey:false;[R1] [C4] column_is_signed:true;[R1] [C4] column_encoding:binary;[R1] [C4] column_is_not_null:false;[R1] [C4] column_value_new:[-1234567](8);[R1] [C4] column_value_old:[12.34](5);[R1] [C5] column_name:C4;[R1] [C5] column_type:MYSQL_TYPE_OB_NUMBER_FLOAT;[R1] [C5] column_is_rowkey:false;[R1] [C5] column_is_signed:true;[R1] [C5] column_encoding:binary;[R1] [C5] column_is_not_null:false;[R1] [C5] column_value_new:[-1235000](8);[R1] [C5] column_value_old:[12.34](5);[R1] [C6] column_name:C5;[R1] [C6] column_type:MYSQL_TYPE_OB_NUMBER_FLOAT;[R1] [C6] column_is_rowkey:false;[R1] [C6] column_is_signed:true;[R1] [C6] column_encoding:binary;[R1] [C6] column_is_not_null:false;[R1] [C6] column_value_new:[-1234567](8);[R1] [C6] column_value_old:[12.34](5);[R1] [C7] column_name:C6;[R1] [C7] column_type:MYSQL_TYPE_VAR_STRING;[R1] [C7] column_is_rowkey:false;[R1] [C7] column_is_signed:true;[R1] [C7] column_encoding:utf8mb4;[R1] [C7] column_is_not_null:false;[R1] [C7] column_value_new:[-1234567](8);[R1] [C7] column_value_old:[-1234567](8);[R1] [C8] column_name:C7;[R1] [C8] column_type:MYSQL_TYPE_STRING;[R1] [C8] column_is_rowkey:false;[R1] [C8] column_is_signed:true;[R1] [C8] column_encoding:utf8mb4;[R1] [C8] column_is_not_null:false;[R1] [C8] column_value_new:[-1234567                                                                                            ](100);[R1] [C8] column_value_old:[12.34                                                                                               ](100);$[R2] COMMIT;
update number_1 set c1=c6, c2=c6, c3=c6, c4=c6, c5=c6, c7=c6 where c0 = 128;
select c0, c6, c1, c2, c3, c4, c5, c7 from number_1 where c0 = 128;
C0	C6	C1	C2	C3	C4	C5	C7
128	-12345678	-1.2345678E+007	-1.2345678E+007	-12345678	-12350000	-12345678	-12345678                                                                                           
ob1.oblog.next;
[R0] BEGIN;[R0] org_cluster_id:1;[R1] record_type:UPDATE;[R1] database_name:oracle.OBLOG_DB;[R1] table_name:NUMBER_1;[R1] log_event:true;[R1] column_count:8;[R1] source_category:SRC_FULL_RECORDED;[R1] source_type:SRC_OCEANBASE_1_0;[R1] has_pk:true;[R1] pk_info:(0);[R1] pks:C0;[R1] has_uk:false;[R1] uk_info:(null);[R1] uks:(null);[R1] [C1] column_name:C0;[R1] [C1] column_type:MYSQL_TYPE_NEWDECIMAL;[R1] [C1] column_is_rowkey:true;[R1] [C1] column_is_signed:true;[R1] [C1] column_encoding:binary;[R1] [C1] column_is_not_null:true;[R1] [C1] column_value_new:[128](3);[R1] [C1] column_value_old:[128](3);[R1] [C2] column_name:C1;[R1] [C2] column_type:MYSQL_TYPE_DOUBLE;[R1] [C2] column_is_rowkey:false;[R1] [C2] column_is_signed:true;[R1] [C2] column_encoding:binary;[R1] [C2] column_is_not_null:false;[R1] [C2] column_value_new:[-1.2345678E+007](15);[R1] [C2] column_value_old:[1.234E+001](10);[R1] [C3] column_name:C2;[R1] [C3] column_type:MYSQL_TYPE_FLOAT;[R1] [C3] column_is_rowkey:false;[R1] [C3] column_is_signed:true;[R1] [C3] column_encoding:binary;[R1] [C3] column_is_not_null:false;[R1] [C3] column_value_new:[-1.2345678E+007](15);[R1] [C3] column_value_old:[1.23400002E+001](15);[R1] [C4] column_name:C3;[R1] [C4] column_type:MYSQL_TYPE_NEWDECIMAL;[R1] [C4] column_is_rowkey:false;[R1] [C4] column_is_signed:true;[R1] [C4] column_encoding:binary;[R1] [C4] column_is_not_null:false;[R1] [C4] column_value_new:[-12345678](9);[R1] [C4] column_value_old:[12.34](5);[R1] [C5] column_name:C4;[R1] [C5] column_type:MYSQL_TYPE_OB_NUMBER_FLOAT;[R1] [C5] column_is_rowkey:false;[R1] [C5] column_is_signed:true;[R1] [C5] column_encoding:binary;[R1] [C5] column_is_not_null:false;[R1] [C5] column_value_new:[-12350000](9);[R1] [C5] column_value_old:[12.34](5);[R1] [C6] column_name:C5;[R1] [C6] column_type:MYSQL_TYPE_OB_NUMBER_FLOAT;[R1] [C6] column_is_rowkey:false;[R1] [C6] column_is_signed:true;[R1] [C6] column_encoding:binary;[R1] [C6] column_is_not_null:false;[R1] [C6] column_value_new:[-12345678](9);[R1] [C6] column_value_old:[12.34](5);[R1] [C7] column_name:C6;[R1] [C7] column_type:MYSQL_TYPE_VAR_STRING;[R1] [C7] column_is_rowkey:false;[R1] [C7] column_is_signed:true;[R1] [C7] column_encoding:utf8mb4;[R1] [C7] column_is_not_null:false;[R1] [C7] column_value_new:[-12345678](9);[R1] [C7] column_value_old:[-12345678](9);[R1] [C8] column_name:C7;[R1] [C8] column_type:MYSQL_TYPE_STRING;[R1] [C8] column_is_rowkey:false;[R1] [C8] column_is_signed:true;[R1] [C8] column_encoding:utf8mb4;[R1] [C8] column_is_not_null:false;[R1] [C8] column_value_new:[-12345678                                                                                           ](100);[R1] [C8] column_value_old:[12.34                                                                                               ](100);$[R2] COMMIT;
update number_1 set c1=c6, c2=c6, c3=c6, c4=c6, c5=c6, c7=c6 where c0 = 129;
select c0, c6, c1, c2, c3, c4, c5, c7 from number_1 where c0 = 129;
C0	C6	C1	C2	C3	C4	C5	C7
129	-123456789	-1.23456789E+008	-1.23456792E+008	-123456789	-123500000	-123456789	-123456789                                                                                          
ob1.oblog.next;
[R0] BEGIN;[R0] org_cluster_id:1;[R1] record_type:UPDATE;[R1] database_name:oracle.OBLOG_DB;[R1] table_name:NUMBER_1;[R1] log_event:true;[R1] column_count:8;[R1] source_category:SRC_FULL_RECORDED;[R1] source_type:SRC_OCEANBASE_1_0;[R1] has_pk:true;[R1] pk_info:(0);[R1] pks:C0;[R1] has_uk:false;[R1] uk_info:(null);[R1] uks:(null);[R1] [C1] column_name:C0;[R1] [C1] column_type:MYSQL_TYPE_NEWDECIMAL;[R1] [C1] column_is_rowkey:true;[R1] [C1] column_is_signed:true;[R1] [C1] column_encoding:binary;[R1] [C1] column_is_not_null:true;[R1] [C1] column_value_new:[129](3);[R1] [C1] column_value_old:[129](3);[R1] [C2] column_name:C1;[R1] [C2] column_type:MYSQL_TYPE_DOUBLE;[R1] [C2] column_is_rowkey:false;[R1] [C2] column_is_signed:true;[R1] [C2] column_encoding:binary;[R1] [C2] column_is_not_null:false;[R1] [C2] column_value_new:[-1.23456789E+008](16);[R1] [C2] column_value_old:[1.234E+001](10);[R1] [C3] column_name:C2;[R1] [C3] column_type:MYSQL_TYPE_FLOAT;[R1] [C3] column_is_rowkey:false;[R1] [C3] column_is_signed:true;[R1] [C3] column_encoding:binary;[R1] [C3] column_is_not_null:false;[R1] [C3] column_value_new:[-1.23456792E+008](16);[R1] [C3] column_value_old:[1.23400002E+001](15);[R1] [C4] column_name:C3;[R1] [C4] column_type:MYSQL_TYPE_NEWDECIMAL;[R1] [C4] column_is_rowkey:false;[R1] [C4] column_is_signed:true;[R1] [C4] column_encoding:binary;[R1] [C4] column_is_not_null:false;[R1] [C4] column_value_new:[-123456789](10);[R1] [C4] column_value_old:[12.34](5);[R1] [C5] column_name:C4;[R1] [C5] column_type:MYSQL_TYPE_OB_NUMBER_FLOAT;[R1] [C5] column_is_rowkey:false;[R1] [C5] column_is_signed:true;[R1] [C5] column_encoding:binary;[R1] [C5] column_is_not_null:false;[R1] [C5] column_value_new:[-123500000](10);[R1] [C5] column_value_old:[12.34](5);[R1] [C6] column_name:C5;[R1] [C6] column_type:MYSQL_TYPE_OB_NUMBER_FLOAT;[R1] [C6] column_is_rowkey:false;[R1] [C6] column_is_signed:true;[R1] [C6] column_encoding:binary;[R1] [C6] column_is_not_null:false;[R1] [C6] column_value_new:[-123456789](10);[R1] [C6] column_value_old:[12.34](5);[R1] [C7] column_name:C6;[R1] [C7] column_type:MYSQL_TYPE_VAR_STRING;[R1] [C7] column_is_rowkey:false;[R1] [C7] column_is_signed:true;[R1] [C7] column_encoding:utf8mb4;[R1] [C7] column_is_not_null:false;[R1] [C7] column_value_new:[-123456789](10);[R1] [C7] column_value_old:[-123456789](10);[R1] [C8] column_name:C7;[R1] [C8] column_type:MYSQL_TYPE_STRING;[R1] [C8] column_is_rowkey:false;[R1] [C8] column_is_signed:true;[R1] [C8] column_encoding:utf8mb4;[R1] [C8] column_is_not_null:false;[R1] [C8] column_value_new:[-123456789                                                                                          ](100);[R1] [C8] column_value_old:[12.34                                                                                               ](100);$[R2] COMMIT;
update number_1 set c1=c6, c2=c6, c3=c6, c4=c6, c5=c6, c7=c6 where c0 = 130;
select c0, c6, c1, c2, c3, c4, c5, c7 from number_1 where c0 = 130;
C0	C6	C1	C2	C3	C4	C5	C7
130	-1234567890	-1.23456789E+009	-1.23456794E+009	-1234567890	-1235000000	-1234567890	-1234567890                                                                                         
ob1.oblog.next;
[R0] BEGIN;[R0] org_cluster_id:1;[R1] record_type:UPDATE;[R1] database_name:oracle.OBLOG_DB;[R1] table_name:NUMBER_1;[R1] log_event:true;[R1] column_count:8;[R1] source_category:SRC_FULL_RECORDED;[R1] source_type:SRC_OCEANBASE_1_0;[R1] has_pk:true;[R1] pk_info:(0);[R1] pks:C0;[R1] has_uk:false;[R1] uk_info:(null);[R1] uks:(null);[R1] [C1] column_name:C0;[R1] [C1] column_type:MYSQL_TYPE_NEWDECIMAL;[R1] [C1] column_is_rowkey:true;[R1] [C1] column_is_signed:true;[R1] [C1] column_encoding:binary;[R1] [C1] column_is_not_null:true;[R1] [C1] column_value_new:[130](3);[R1] [C1] column_value_old:[130](3);[R1] [C2] column_name:C1;[R1] [C2] column_type:MYSQL_TYPE_DOUBLE;[R1] [C2] column_is_rowkey:false;[R1] [C2] column_is_signed:true;[R1] [C2] column_encoding:binary;[R1] [C2] column_is_not_null:false;[R1] [C2] column_value_new:[-1.23456789E+009](16);[R1] [C2] column_value_old:[1.234E+001](10);[R1] [C3] column_name:C2;[R1] [C3] column_type:MYSQL_TYPE_FLOAT;[R1] [C3] column_is_rowkey:false;[R1] [C3] column_is_signed:true;[R1] [C3] column_encoding:binary;[R1] [C3] column_is_not_null:false;[R1] [C3] column_value_new:[-1.23456794E+009](16);[R1] [C3] column_value_old:[1.23400002E+001](15);[R1] [C4] column_name:C3;[R1] [C4] column_type:MYSQL_TYPE_NEWDECIMAL;[R1] [C4] column_is_rowkey:false;[R1] [C4] column_is_signed:true;[R1] [C4] column_encoding:binary;[R1] [C4] column_is_not_null:false;[R1] [C4] column_value_new:[-1234567890](11);[R1] [C4] column_value_old:[12.34](5);[R1] [C5] column_name:C4;[R1] [C5] column_type:MYSQL_TYPE_OB_NUMBER_FLOAT;[R1] [C5] column_is_rowkey:false;[R1] [C5] column_is_signed:true;[R1] [C5] column_encoding:binary;[R1] [C5] column_is_not_null:false;[R1] [C5] column_value_new:[-1235000000](11);[R1] [C5] column_value_old:[12.34](5);[R1] [C6] column_name:C5;[R1] [C6] column_type:MYSQL_TYPE_OB_NUMBER_FLOAT;[R1] [C6] column_is_rowkey:false;[R1] [C6] column_is_signed:true;[R1] [C6] column_encoding:binary;[R1] [C6] column_is_not_null:false;[R1] [C6] column_value_new:[-1234567890](11);[R1] [C6] column_value_old:[12.34](5);[R1] [C7] column_name:C6;[R1] [C7] column_type:MYSQL_TYPE_VAR_STRING;[R1] [C7] column_is_rowkey:false;[R1] [C7] column_is_signed:true;[R1] [C7] column_encoding:utf8mb4;[R1] [C7] column_is_not_null:false;[R1] [C7] column_value_new:[-1234567890](11);[R1] [C7] column_value_old:[-1234567890](11);[R1] [C8] column_name:C7;[R1] [C8] column_type:MYSQL_TYPE_STRING;[R1] [C8] column_is_rowkey:false;[R1] [C8] column_is_signed:true;[R1] [C8] column_encoding:utf8mb4;[R1] [C8] column_is_not_null:false;[R1] [C8] column_value_new:[-1234567890                                                                                         ](100);[R1] [C8] column_value_old:[12.34                                                                                               ](100);$[R2] COMMIT;
update number_1 set c1=c6, c2=c6, c3=c6, c4=c6, c5=c6, c7=c6 where c0 = 131;
select c0, c6, c1, c2, c3, c4, c5, c7 from number_1 where c0 = 131;
C0	C6	C1	C2	C3	C4	C5	C7
131	-12345678901	-1.2345678901E+010	-1.23456788E+010	-12345678901	-12350000000	-12345678901	-12345678901                                                                                        
ob1.oblog.next;
[R0] BEGIN;[R0] org_cluster_id:1;[R1] record_type:UPDATE;[R1] database_name:oracle.OBLOG_DB;[R1] table_name:NUMBER_1;[R1] log_event:true;[R1] column_count:8;[R1] source_category:SRC_FULL_RECORDED;[R1] source_type:SRC_OCEANBASE_1_0;[R1] has_pk:true;[R1] pk_info:(0);[R1] pks:C0;[R1] has_uk:false;[R1] uk_info:(null);[R1] uks:(null);[R1] [C1] column_name:C0;[R1] [C1] column_type:MYSQL_TYPE_NEWDECIMAL;[R1] [C1] column_is_rowkey:true;[R1] [C1] column_is_signed:true;[R1] [C1] column_encoding:binary;[R1] [C1] column_is_not_null:true;[R1] [C1] column_value_new:[131](3);[R1] [C1] column_value_old:[131](3);[R1] [C2] column_name:C1;[R1] [C2] column_type:MYSQL_TYPE_DOUBLE;[R1] [C2] column_is_rowkey:false;[R1] [C2] column_is_signed:true;[R1] [C2] column_encoding:binary;[R1] [C2] column_is_not_null:false;[R1] [C2] column_value_new:[-1.2345678901E+010](18);[R1] [C2] column_value_old:[1.234E+001](10);[R1] [C3] column_name:C2;[R1] [C3] column_type:MYSQL_TYPE_FLOAT;[R1] [C3] column_is_rowkey:false;[R1] [C3] column_is_signed:true;[R1] [C3] column_encoding:binary;[R1] [C3] column_is_not_null:false;[R1] [C3] column_value_new:[-1.23456788E+010](16);[R1] [C3] column_value_old:[1.23400002E+001](15);[R1] [C4] column_name:C3;[R1] [C4] column_type:MYSQL_TYPE_NEWDECIMAL;[R1] [C4] column_is_rowkey:false;[R1] [C4] column_is_signed:true;[R1] [C4] column_encoding:binary;[R1] [C4] column_is_not_null:false;[R1] [C4] column_value_new:[-12345678901](12);[R1] [C4] column_value_old:[12.34](5);[R1] [C5] column_name:C4;[R1] [C5] column_type:MYSQL_TYPE_OB_NUMBER_FLOAT;[R1] [C5] column_is_rowkey:false;[R1] [C5] column_is_signed:true;[R1] [C5] column_encoding:binary;[R1] [C5] column_is_not_null:false;[R1] [C5] column_value_new:[-12350000000](12);[R1] [C5] column_value_old:[12.34](5);[R1] [C6] column_name:C5;[R1] [C6] column_type:MYSQL_TYPE_OB_NUMBER_FLOAT;[R1] [C6] column_is_rowkey:false;[R1] [C6] column_is_signed:true;[R1] [C6] column_encoding:binary;[R1] [C6] column_is_not_null:false;[R1] [C6] column_value_new:[-12345678901](12);[R1] [C6] column_value_old:[12.34](5);[R1] [C7] column_name:C6;[R1] [C7] column_type:MYSQL_TYPE_VAR_STRING;[R1] [C7] column_is_rowkey:false;[R1] [C7] column_is_signed:true;[R1] [C7] column_encoding:utf8mb4;[R1] [C7] column_is_not_null:false;[R1] [C7] column_value_new:[-12345678901](12);[R1] [C7] column_value_old:[-12345678901](12);[R1] [C8] column_name:C7;[R1] [C8] column_type:MYSQL_TYPE_STRING;[R1] [C8] column_is_rowkey:false;[R1] [C8] column_is_signed:true;[R1] [C8] column_encoding:utf8mb4;[R1] [C8] column_is_not_null:false;[R1] [C8] column_value_new:[-12345678901                                                                                        ](100);[R1] [C8] column_value_old:[12.34                                                                                               ](100);$[R2] COMMIT;
update number_1 set c1=c6, c2=c6, c3=c6, c4=c6, c5=c6, c7=c6 where c0 = 132;
select c0, c6, c1, c2, c3, c4, c5, c7 from number_1 where c0 = 132;
C0	C6	C1	C2	C3	C4	C5	C7
132	-123456789012	-1.23456789012E+011	-1.23456791E+011	-123456789012	-123500000000	-123456789012	-123456789012                                                                                       
ob1.oblog.next;
[R0] BEGIN;[R0] org_cluster_id:1;[R1] record_type:UPDATE;[R1] database_name:oracle.OBLOG_DB;[R1] table_name:NUMBER_1;[R1] log_event:true;[R1] column_count:8;[R1] source_category:SRC_FULL_RECORDED;[R1] source_type:SRC_OCEANBASE_1_0;[R1] has_pk:true;[R1] pk_info:(0);[R1] pks:C0;[R1] has_uk:false;[R1] uk_info:(null);[R1] uks:(null);[R1] [C1] column_name:C0;[R1] [C1] column_type:MYSQL_TYPE_NEWDECIMAL;[R1] [C1] column_is_rowkey:true;[R1] [C1] column_is_signed:true;[R1] [C1] column_encoding:binary;[R1] [C1] column_is_not_null:true;[R1] [C1] column_value_new:[132](3);[R1] [C1] column_value_old:[132](3);[R1] [C2] column_name:C1;[R1] [C2] column_type:MYSQL_TYPE_DOUBLE;[R1] [C2] column_is_rowkey:false;[R1] [C2] column_is_signed:true;[R1] [C2] column_encoding:binary;[R1] [C2] column_is_not_null:false;[R1] [C2] column_value_new:[-1.23456789012E+011](19);[R1] [C2] column_value_old:[1.234E+001](10);[R1] [C3] column_name:C2;[R1] [C3] column_type:MYSQL_TYPE_FLOAT;[R1] [C3] column_is_rowkey:false;[R1] [C3] column_is_signed:true;[R1] [C3] column_encoding:binary;[R1] [C3] column_is_not_null:false;[R1] [C3] column_value_new:[-1.23456791E+011](16);[R1] [C3] column_value_old:[1.23400002E+001](15);[R1] [C4] column_name:C3;[R1] [C4] column_type:MYSQL_TYPE_NEWDECIMAL;[R1] [C4] column_is_rowkey:false;[R1] [C4] column_is_signed:true;[R1] [C4] column_encoding:binary;[R1] [C4] column_is_not_null:false;[R1] [C4] column_value_new:[-123456789012](13);[R1] [C4] column_value_old:[12.34](5);[R1] [C5] column_name:C4;[R1] [C5] column_type:MYSQL_TYPE_OB_NUMBER_FLOAT;[R1] [C5] column_is_rowkey:false;[R1] [C5] column_is_signed:true;[R1] [C5] column_encoding:binary;[R1] [C5] column_is_not_null:false;[R1] [C5] column_value_new:[-123500000000](13);[R1] [C5] column_value_old:[12.34](5);[R1] [C6] column_name:C5;[R1] [C6] column_type:MYSQL_TYPE_OB_NUMBER_FLOAT;[R1] [C6] column_is_rowkey:false;[R1] [C6] column_is_signed:true;[R1] [C6] column_encoding:binary;[R1] [C6] column_is_not_null:false;[R1] [C6] column_value_new:[-123456789012](13);[R1] [C6] column_value_old:[12.34](5);[R1] [C7] column_name:C6;[R1] [C7] column_type:MYSQL_TYPE_VAR_STRING;[R1] [C7] column_is_rowkey:false;[R1] [C7] column_is_signed:true;[R1] [C7] column_encoding:utf8mb4;[R1] [C7] column_is_not_null:false;[R1] [C7] column_value_new:[-123456789012](13);[R1] [C7] column_value_old:[-123456789012](13);[R1] [C8] column_name:C7;[R1] [C8] column_type:MYSQL_TYPE_STRING;[R1] [C8] column_is_rowkey:false;[R1] [C8] column_is_signed:true;[R1] [C8] column_encoding:utf8mb4;[R1] [C8] column_is_not_null:false;[R1] [C8] column_value_new:[-123456789012                                                                                       ](100);[R1] [C8] column_value_old:[12.34                                                                                               ](100);$[R2] COMMIT;
update number_1 set c1=c6, c2=c6, c3=c6, c4=c6, c5=c6, c7=c6 where c0 = 133;
select c0, c6, c1, c2, c3, c4, c5, c7 from number_1 where c0 = 133;
C0	C6	C1	C2	C3	C4	C5	C7
133	-1234567890123	-1.234567890123E+012	-1.23456795E+012	-1234567890123	-1235000000000	-1234567890123	-1234567890123                                                                                      
ob1.oblog.next;
[R0] BEGIN;[R0] org_cluster_id:1;[R1] record_type:UPDATE;[R1] database_name:oracle.OBLOG_DB;[R1] table_name:NUMBER_1;[R1] log_event:true;[R1] column_count:8;[R1] source_category:SRC_FULL_RECORDED;[R1] source_type:SRC_OCEANBASE_1_0;[R1] has_pk:true;[R1] pk_info:(0);[R1] pks:C0;[R1] has_uk:false;[R1] uk_info:(null);[R1] uks:(null);[R1] [C1] column_name:C0;[R1] [C1] column_type:MYSQL_TYPE_NEWDECIMAL;[R1] [C1] column_is_rowkey:true;[R1] [C1] column_is_signed:true;[R1] [C1] column_encoding:binary;[R1] [C1] column_is_not_null:true;[R1] [C1] column_value_new:[133](3);[R1] [C1] column_value_old:[133](3);[R1] [C2] column_name:C1;[R1] [C2] column_type:MYSQL_TYPE_DOUBLE;[R1] [C2] column_is_rowkey:false;[R1] [C2] column_is_signed:true;[R1] [C2] column_encoding:binary;[R1] [C2] column_is_not_null:false;[R1] [C2] column_value_new:[-1.234567890123E+012](20);[R1] [C2] column_value_old:[1.234E+001](10);[R1] [C3] column_name:C2;[R1] [C3] column_type:MYSQL_TYPE_FLOAT;[R1] [C3] column_is_rowkey:false;[R1] [C3] column_is_signed:true;[R1] [C3] column_encoding:binary;[R1] [C3] column_is_not_null:false;[R1] [C3] column_value_new:[-1.23456795E+012](16);[R1] [C3] column_value_old:[1.23400002E+001](15);[R1] [C4] column_name:C3;[R1] [C4] column_type:MYSQL_TYPE_NEWDECIMAL;[R1] [C4] column_is_rowkey:false;[R1] [C4] column_is_signed:true;[R1] [C4] column_encoding:binary;[R1] [C4] column_is_not_null:false;[R1] [C4] column_value_new:[-1234567890123](14);[R1] [C4] column_value_old:[12.34](5);[R1] [C5] column_name:C4;[R1] [C5] column_type:MYSQL_TYPE_OB_NUMBER_FLOAT;[R1] [C5] column_is_rowkey:false;[R1] [C5] column_is_signed:true;[R1] [C5] column_encoding:binary;[R1] [C5] column_is_not_null:false;[R1] [C5] column_value_new:[-1235000000000](14);[R1] [C5] column_value_old:[12.34](5);[R1] [C6] column_name:C5;[R1] [C6] column_type:MYSQL_TYPE_OB_NUMBER_FLOAT;[R1] [C6] column_is_rowkey:false;[R1] [C6] column_is_signed:true;[R1] [C6] column_encoding:binary;[R1] [C6] column_is_not_null:false;[R1] [C6] column_value_new:[-1234567890123](14);[R1] [C6] column_value_old:[12.34](5);[R1] [C7] column_name:C6;[R1] [C7] column_type:MYSQL_TYPE_VAR_STRING;[R1] [C7] column_is_rowkey:false;[R1] [C7] column_is_signed:true;[R1] [C7] column_encoding:utf8mb4;[R1] [C7] column_is_not_null:false;[R1] [C7] column_value_new:[-1234567890123](14);[R1] [C7] column_value_old:[-1234567890123](14);[R1] [C8] column_name:C7;[R1] [C8] column_type:MYSQL_TYPE_STRING;[R1] [C8] column_is_rowkey:false;[R1] [C8] column_is_signed:true;[R1] [C8] column_encoding:utf8mb4;[R1] [C8] column_is_not_null:false;[R1] [C8] column_value_new:[-1234567890123                                                                                      ](100);[R1] [C8] column_value_old:[12.34                                                                                               ](100);$[R2] COMMIT;
update number_1 set c1=c6, c2=c6, c3=c6, c4=c6, c5=c6, c7=c6 where c0 = 134;
select c0, c6, c1, c2, c3, c4, c5, c7 from number_1 where c0 = 134;
C0	C6	C1	C2	C3	C4	C5	C7
134	-12345678901234	-1.2345678901234E+013	-1.2345679E+013	-12345678901234	-12350000000000	-12345678901234	-12345678901234                                                                                     
ob1.oblog.next;
[R0] BEGIN;[R0] org_cluster_id:1;[R1] record_type:UPDATE;[R1] database_name:oracle.OBLOG_DB;[R1] table_name:NUMBER_1;[R1] log_event:true;[R1] column_count:8;[R1] source_category:SRC_FULL_RECORDED;[R1] source_type:SRC_OCEANBASE_1_0;[R1] has_pk:true;[R1] pk_info:(0);[R1] pks:C0;[R1] has_uk:false;[R1] uk_info:(null);[R1] uks:(null);[R1] [C1] column_name:C0;[R1] [C1] column_type:MYSQL_TYPE_NEWDECIMAL;[R1] [C1] column_is_rowkey:true;[R1] [C1] column_is_signed:true;[R1] [C1] column_encoding:binary;[R1] [C1] column_is_not_null:true;[R1] [C1] column_value_new:[134](3);[R1] [C1] column_value_old:[134](3);[R1] [C2] column_name:C1;[R1] [C2] column_type:MYSQL_TYPE_DOUBLE;[R1] [C2] column_is_rowkey:false;[R1] [C2] column_is_signed:true;[R1] [C2] column_encoding:binary;[R1] [C2] column_is_not_null:false;[R1] [C2] column_value_new:[-1.2345678901234E+013](21);[R1] [C2] column_value_old:[1.234E+001](10);[R1] [C3] column_name:C2;[R1] [C3] column_type:MYSQL_TYPE_FLOAT;[R1] [C3] column_is_rowkey:false;[R1] [C3] column_is_signed:true;[R1] [C3] column_encoding:binary;[R1] [C3] column_is_not_null:false;[R1] [C3] column_value_new:[-1.2345679E+013](15);[R1] [C3] column_value_old:[1.23400002E+001](15);[R1] [C4] column_name:C3;[R1] [C4] column_type:MYSQL_TYPE_NEWDECIMAL;[R1] [C4] column_is_rowkey:false;[R1] [C4] column_is_signed:true;[R1] [C4] column_encoding:binary;[R1] [C4] column_is_not_null:false;[R1] [C4] column_value_new:[-12345678901234](15);[R1] [C4] column_value_old:[12.34](5);[R1] [C5] column_name:C4;[R1] [C5] column_type:MYSQL_TYPE_OB_NUMBER_FLOAT;[R1] [C5] column_is_rowkey:false;[R1] [C5] column_is_signed:true;[R1] [C5] column_encoding:binary;[R1] [C5] column_is_not_null:false;[R1] [C5] column_value_new:[-12350000000000](15);[R1] [C5] column_value_old:[12.34](5);[R1] [C6] column_name:C5;[R1] [C6] column_type:MYSQL_TYPE_OB_NUMBER_FLOAT;[R1] [C6] column_is_rowkey:false;[R1] [C6] column_is_signed:true;[R1] [C6] column_encoding:binary;[R1] [C6] column_is_not_null:false;[R1] [C6] column_value_new:[-12345678901234](15);[R1] [C6] column_value_old:[12.34](5);[R1] [C7] column_name:C6;[R1] [C7] column_type:MYSQL_TYPE_VAR_STRING;[R1] [C7] column_is_rowkey:false;[R1] [C7] column_is_signed:true;[R1] [C7] column_encoding:utf8mb4;[R1] [C7] column_is_not_null:false;[R1] [C7] column_value_new:[-12345678901234](15);[R1] [C7] column_value_old:[-12345678901234](15);[R1] [C8] column_name:C7;[R1] [C8] column_type:MYSQL_TYPE_STRING;[R1] [C8] column_is_rowkey:false;[R1] [C8] column_is_signed:true;[R1] [C8] column_encoding:utf8mb4;[R1] [C8] column_is_not_null:false;[R1] [C8] column_value_new:[-12345678901234                                                                                     ](100);[R1] [C8] column_value_old:[12.34                                                                                               ](100);$[R2] COMMIT;
update number_1 set c1=c6, c2=c6, c3=c6, c4=c6, c5=c6, c7=c6 where c0 = 135;
select c0, c6, c1, c2, c3, c4, c5, c7 from number_1 where c0 = 135;
C0	C6	C1	C2	C3	C4	C5	C7
135	-123456789012345	-1.23456789012345E+014	-1.23456788E+014	-123456789012345	-123500000000000	-123456789012345	-123456789012345                                                                                    
ob1.oblog.next;
[R0] BEGIN;[R0] org_cluster_id:1;[R1] record_type:UPDATE;[R1] database_name:oracle.OBLOG_DB;[R1] table_name:NUMBER_1;[R1] log_event:true;[R1] column_count:8;[R1] source_category:SRC_FULL_RECORDED;[R1] source_type:SRC_OCEANBASE_1_0;[R1] has_pk:true;[R1] pk_info:(0);[R1] pks:C0;[R1] has_uk:false;[R1] uk_info:(null);[R1] uks:(null);[R1] [C1] column_name:C0;[R1] [C1] column_type:MYSQL_TYPE_NEWDECIMAL;[R1] [C1] column_is_rowkey:true;[R1] [C1] column_is_signed:true;[R1] [C1] column_encoding:binary;[R1] [C1] column_is_not_null:true;[R1] [C1] column_value_new:[135](3);[R1] [C1] column_value_old:[135](3);[R1] [C2] column_name:C1;[R1] [C2] column_type:MYSQL_TYPE_DOUBLE;[R1] [C2] column_is_rowkey:false;[R1] [C2] column_is_signed:true;[R1] [C2] column_encoding:binary;[R1] [C2] column_is_not_null:false;[R1] [C2] column_value_new:[-1.23456789012345E+014](22);[R1] [C2] column_value_old:[1.234E+001](10);[R1] [C3] column_name:C2;[R1] [C3] column_type:MYSQL_TYPE_FLOAT;[R1] [C3] column_is_rowkey:false;[R1] [C3] column_is_signed:true;[R1] [C3] column_encoding:binary;[R1] [C3] column_is_not_null:false;[R1] [C3] column_value_new:[-1.23456788E+014](16);[R1] [C3] column_value_old:[1.23400002E+001](15);[R1] [C4] column_name:C3;[R1] [C4] column_type:MYSQL_TYPE_NEWDECIMAL;[R1] [C4] column_is_rowkey:false;[R1] [C4] column_is_signed:true;[R1] [C4] column_encoding:binary;[R1] [C4] column_is_not_null:false;[R1] [C4] column_value_new:[-123456789012345](16);[R1] [C4] column_value_old:[12.34](5);[R1] [C5] column_name:C4;[R1] [C5] column_type:MYSQL_TYPE_OB_NUMBER_FLOAT;[R1] [C5] column_is_rowkey:false;[R1] [C5] column_is_signed:true;[R1] [C5] column_encoding:binary;[R1] [C5] column_is_not_null:false;[R1] [C5] column_value_new:[-123500000000000](16);[R1] [C5] column_value_old:[12.34](5);[R1] [C6] column_name:C5;[R1] [C6] column_type:MYSQL_TYPE_OB_NUMBER_FLOAT;[R1] [C6] column_is_rowkey:false;[R1] [C6] column_is_signed:true;[R1] [C6] column_encoding:binary;[R1] [C6] column_is_not_null:false;[R1] [C6] column_value_new:[-123456789012345](16);[R1] [C6] column_value_old:[12.34](5);[R1] [C7] column_name:C6;[R1] [C7] column_type:MYSQL_TYPE_VAR_STRING;[R1] [C7] column_is_rowkey:false;[R1] [C7] column_is_signed:true;[R1] [C7] column_encoding:utf8mb4;[R1] [C7] column_is_not_null:false;[R1] [C7] column_value_new:[-123456789012345](16);[R1] [C7] column_value_old:[-123456789012345](16);[R1] [C8] column_name:C7;[R1] [C8] column_type:MYSQL_TYPE_STRING;[R1] [C8] column_is_rowkey:false;[R1] [C8] column_is_signed:true;[R1] [C8] column_encoding:utf8mb4;[R1] [C8] column_is_not_null:false;[R1] [C8] column_value_new:[-123456789012345                                                                                    ](100);[R1] [C8] column_value_old:[12.34                                                                                               ](100);$[R2] COMMIT;
update number_1 set c1=c6, c2=c6, c3=c6, c4=c6, c5=c6, c7=c6 where c0 = 136;
select c0, c6, c1, c2, c3, c4, c5, c7 from number_1 where c0 = 136;
C0	C6	C1	C2	C3	C4	C5	C7
136	-1234567890123456	-1.234567890123456E+015	-1.23456795E+015	-1234567890123456	-1235000000000000	-1234567890123456	-1234567890123456                                                                                   
ob1.oblog.next;
[R0] BEGIN;[R0] org_cluster_id:1;[R1] record_type:UPDATE;[R1] database_name:oracle.OBLOG_DB;[R1] table_name:NUMBER_1;[R1] log_event:true;[R1] column_count:8;[R1] source_category:SRC_FULL_RECORDED;[R1] source_type:SRC_OCEANBASE_1_0;[R1] has_pk:true;[R1] pk_info:(0);[R1] pks:C0;[R1] has_uk:false;[R1] uk_info:(null);[R1] uks:(null);[R1] [C1] column_name:C0;[R1] [C1] column_type:MYSQL_TYPE_NEWDECIMAL;[R1] [C1] column_is_rowkey:true;[R1] [C1] column_is_signed:true;[R1] [C1] column_encoding:binary;[R1] [C1] column_is_not_null:true;[R1] [C1] column_value_new:[136](3);[R1] [C1] column_value_old:[136](3);[R1] [C2] column_name:C1;[R1] [C2] column_type:MYSQL_TYPE_DOUBLE;[R1] [C2] column_is_rowkey:false;[R1] [C2] column_is_signed:true;[R1] [C2] column_encoding:binary;[R1] [C2] column_is_not_null:false;[R1] [C2] column_value_new:[-1.234567890123456E+015](23);[R1] [C2] column_value_old:[1.234E+001](10);[R1] [C3] column_name:C2;[R1] [C3] column_type:MYSQL_TYPE_FLOAT;[R1] [C3] column_is_rowkey:false;[R1] [C3] column_is_signed:true;[R1] [C3] column_encoding:binary;[R1] [C3] column_is_not_null:false;[R1] [C3] column_value_new:[-1.23456795E+015](16);[R1] [C3] column_value_old:[1.23400002E+001](15);[R1] [C4] column_name:C3;[R1] [C4] column_type:MYSQL_TYPE_NEWDECIMAL;[R1] [C4] column_is_rowkey:false;[R1] [C4] column_is_signed:true;[R1] [C4] column_encoding:binary;[R1] [C4] column_is_not_null:false;[R1] [C4] column_value_new:[-1234567890123456](17);[R1] [C4] column_value_old:[12.34](5);[R1] [C5] column_name:C4;[R1] [C5] column_type:MYSQL_TYPE_OB_NUMBER_FLOAT;[R1] [C5] column_is_rowkey:false;[R1] [C5] column_is_signed:true;[R1] [C5] column_encoding:binary;[R1] [C5] column_is_not_null:false;[R1] [C5] column_value_new:[-1235000000000000](17);[R1] [C5] column_value_old:[12.34](5);[R1] [C6] column_name:C5;[R1] [C6] column_type:MYSQL_TYPE_OB_NUMBER_FLOAT;[R1] [C6] column_is_rowkey:false;[R1] [C6] column_is_signed:true;[R1] [C6] column_encoding:binary;[R1] [C6] column_is_not_null:false;[R1] [C6] column_value_new:[-1234567890123456](17);[R1] [C6] column_value_old:[12.34](5);[R1] [C7] column_name:C6;[R1] [C7] column_type:MYSQL_TYPE_VAR_STRING;[R1] [C7] column_is_rowkey:false;[R1] [C7] column_is_signed:true;[R1] [C7] column_encoding:utf8mb4;[R1] [C7] column_is_not_null:false;[R1] [C7] column_value_new:[-1234567890123456](17);[R1] [C7] column_value_old:[-1234567890123456](17);[R1] [C8] column_name:C7;[R1] [C8] column_type:MYSQL_TYPE_STRING;[R1] [C8] column_is_rowkey:false;[R1] [C8] column_is_signed:true;[R1] [C8] column_encoding:utf8mb4;[R1] [C8] column_is_not_null:false;[R1] [C8] column_value_new:[-1234567890123456                                                                                   ](100);[R1] [C8] column_value_old:[12.34                                                                                               ](100);$[R2] COMMIT;
update number_1 set c1=c6, c2=c6, c3=c6, c4=c6, c5=c6, c7=c6 where c0 = 137;
select c0, c6, c1, c2, c3, c4, c5, c7 from number_1 where c0 = 137;
C0	C6	C1	C2	C3	C4	C5	C7
137	-12345678901234567	-1.2345678901234568E+016	-1.23456784E+016	-12345678901234567	-12350000000000000	-12345678901234567	-12345678901234567                                                                                  
ob1.oblog.next;
[R0] BEGIN;[R0] org_cluster_id:1;[R1] record_type:UPDATE;[R1] database_name:oracle.OBLOG_DB;[R1] table_name:NUMBER_1;[R1] log_event:true;[R1] column_count:8;[R1] source_category:SRC_FULL_RECORDED;[R1] source_type:SRC_OCEANBASE_1_0;[R1] has_pk:true;[R1] pk_info:(0);[R1] pks:C0;[R1] has_uk:false;[R1] uk_info:(null);[R1] uks:(null);[R1] [C1] column_name:C0;[R1] [C1] column_type:MYSQL_TYPE_NEWDECIMAL;[R1] [C1] column_is_rowkey:true;[R1] [C1] column_is_signed:true;[R1] [C1] column_encoding:binary;[R1] [C1] column_is_not_null:true;[R1] [C1] column_value_new:[137](3);[R1] [C1] column_value_old:[137](3);[R1] [C2] column_name:C1;[R1] [C2] column_type:MYSQL_TYPE_DOUBLE;[R1] [C2] column_is_rowkey:false;[R1] [C2] column_is_signed:true;[R1] [C2] column_encoding:binary;[R1] [C2] column_is_not_null:false;[R1] [C2] column_value_new:[-1.2345678901234568E+016](24);[R1] [C2] column_value_old:[1.234E+001](10);[R1] [C3] column_name:C2;[R1] [C3] column_type:MYSQL_TYPE_FLOAT;[R1] [C3] column_is_rowkey:false;[R1] [C3] column_is_signed:true;[R1] [C3] column_encoding:binary;[R1] [C3] column_is_not_null:false;[R1] [C3] column_value_new:[-1.23456784E+016](16);[R1] [C3] column_value_old:[1.23400002E+001](15);[R1] [C4] column_name:C3;[R1] [C4] column_type:MYSQL_TYPE_NEWDECIMAL;[R1] [C4] column_is_rowkey:false;[R1] [C4] column_is_signed:true;[R1] [C4] column_encoding:binary;[R1] [C4] column_is_not_null:false;[R1] [C4] column_value_new:[-12345678901234567](18);[R1] [C4] column_value_old:[12.34](5);[R1] [C5] column_name:C4;[R1] [C5] column_type:MYSQL_TYPE_OB_NUMBER_FLOAT;[R1] [C5] column_is_rowkey:false;[R1] [C5] column_is_signed:true;[R1] [C5] column_encoding:binary;[R1] [C5] column_is_not_null:false;[R1] [C5] column_value_new:[-12350000000000000](18);[R1] [C5] column_value_old:[12.34](5);[R1] [C6] column_name:C5;[R1] [C6] column_type:MYSQL_TYPE_OB_NUMBER_FLOAT;[R1] [C6] column_is_rowkey:false;[R1] [C6] column_is_signed:true;[R1] [C6] column_encoding:binary;[R1] [C6] column_is_not_null:false;[R1] [C6] column_value_new:[-12345678901234567](18);[R1] [C6] column_value_old:[12.34](5);[R1] [C7] column_name:C6;[R1] [C7] column_type:MYSQL_TYPE_VAR_STRING;[R1] [C7] column_is_rowkey:false;[R1] [C7] column_is_signed:true;[R1] [C7] column_encoding:utf8mb4;[R1] [C7] column_is_not_null:false;[R1] [C7] column_value_new:[-12345678901234567](18);[R1] [C7] column_value_old:[-12345678901234567](18);[R1] [C8] column_name:C7;[R1] [C8] column_type:MYSQL_TYPE_STRING;[R1] [C8] column_is_rowkey:false;[R1] [C8] column_is_signed:true;[R1] [C8] column_encoding:utf8mb4;[R1] [C8] column_is_not_null:false;[R1] [C8] column_value_new:[-12345678901234567                                                                                  ](100);[R1] [C8] column_value_old:[12.34                                                                                               ](100);$[R2] COMMIT;
update number_1 set c1=c6, c2=c6, c3=c6, c4=c6, c5=c6, c7=c6 where c0 = 138;
select c0, c6, c1, c2, c3, c4, c5, c7 from number_1 where c0 = 138;
C0	C6	C1	C2	C3	C4	C5	C7
138	-123456789012345678	-1.2345678901234568E+017	-1.23456791E+017	-123456789012345678	-123500000000000000	-123456789012345678	-123456789012345678                                                                                 
ob1.oblog.next;
[R0] BEGIN;[R0] org_cluster_id:1;[R1] record_type:UPDATE;[R1] database_name:oracle.OBLOG_DB;[R1] table_name:NUMBER_1;[R1] log_event:true;[R1] column_count:8;[R1] source_category:SRC_FULL_RECORDED;[R1] source_type:SRC_OCEANBASE_1_0;[R1] has_pk:true;[R1] pk_info:(0);[R1] pks:C0;[R1] has_uk:false;[R1] uk_info:(null);[R1] uks:(null);[R1] [C1] column_name:C0;[R1] [C1] column_type:MYSQL_TYPE_NEWDECIMAL;[R1] [C1] column_is_rowkey:true;[R1] [C1] column_is_signed:true;[R1] [C1] column_encoding:binary;[R1] [C1] column_is_not_null:true;[R1] [C1] column_value_new:[138](3);[R1] [C1] column_value_old:[138](3);[R1] [C2] column_name:C1;[R1] [C2] column_type:MYSQL_TYPE_DOUBLE;[R1] [C2] column_is_rowkey:false;[R1] [C2] column_is_signed:true;[R1] [C2] column_encoding:binary;[R1] [C2] column_is_not_null:false;[R1] [C2] column_value_new:[-1.2345678901234568E+017](24);[R1] [C2] column_value_old:[1.234E+001](10);[R1] [C3] column_name:C2;[R1] [C3] column_type:MYSQL_TYPE_FLOAT;[R1] [C3] column_is_rowkey:false;[R1] [C3] column_is_signed:true;[R1] [C3] column_encoding:binary;[R1] [C3] column_is_not_null:false;[R1] [C3] column_value_new:[-1.23456791E+017](16);[R1] [C3] column_value_old:[1.23400002E+001](15);[R1] [C4] column_name:C3;[R1] [C4] column_type:MYSQL_TYPE_NEWDECIMAL;[R1] [C4] column_is_rowkey:false;[R1] [C4] column_is_signed:true;[R1] [C4] column_encoding:binary;[R1] [C4] column_is_not_null:false;[R1] [C4] column_value_new:[-123456789012345678](19);[R1] [C4] column_value_old:[12.34](5);[R1] [C5] column_name:C4;[R1] [C5] column_type:MYSQL_TYPE_OB_NUMBER_FLOAT;[R1] [C5] column_is_rowkey:false;[R1] [C5] column_is_signed:true;[R1] [C5] column_encoding:binary;[R1] [C5] column_is_not_null:false;[R1] [C5] column_value_new:[-123500000000000000](19);[R1] [C5] column_value_old:[12.34](5);[R1] [C6] column_name:C5;[R1] [C6] column_type:MYSQL_TYPE_OB_NUMBER_FLOAT;[R1] [C6] column_is_rowkey:false;[R1] [C6] column_is_signed:true;[R1] [C6] column_encoding:binary;[R1] [C6] column_is_not_null:false;[R1] [C6] column_value_new:[-123456789012345678](19);[R1] [C6] column_value_old:[12.34](5);[R1] [C7] column_name:C6;[R1] [C7] column_type:MYSQL_TYPE_VAR_STRING;[R1] [C7] column_is_rowkey:false;[R1] [C7] column_is_signed:true;[R1] [C7] column_encoding:utf8mb4;[R1] [C7] column_is_not_null:false;[R1] [C7] column_value_new:[-123456789012345678](19);[R1] [C7] column_value_old:[-123456789012345678](19);[R1] [C8] column_name:C7;[R1] [C8] column_type:MYSQL_TYPE_STRING;[R1] [C8] column_is_rowkey:false;[R1] [C8] column_is_signed:true;[R1] [C8] column_encoding:utf8mb4;[R1] [C8] column_is_not_null:false;[R1] [C8] column_value_new:[-123456789012345678                                                                                 ](100);[R1] [C8] column_value_old:[12.34                                                                                               ](100);$[R2] COMMIT;
update number_1 set c1=c6, c2=c6, c3=c6, c4=c6, c5=c6, c7=c6 where c0 = 139;
select c0, c6, c1, c2, c3, c4, c5, c7 from number_1 where c0 = 139;
C0	C6	C1	C2	C3	C4	C5	C7
139	-1234567890123456789	-1.2345678901234568E+018	-1.23456794E+018	-1234567890123456789	-1235000000000000000	-1234567890123456789	-1234567890123456789                                                                                
ob1.oblog.next;
[R0] BEGIN;[R0] org_cluster_id:1;[R1] record_type:UPDATE;[R1] database_name:oracle.OBLOG_DB;[R1] table_name:NUMBER_1;[R1] log_event:true;[R1] column_count:8;[R1] source_category:SRC_FULL_RECORDED;[R1] source_type:SRC_OCEANBASE_1_0;[R1] has_pk:true;[R1] pk_info:(0);[R1] pks:C0;[R1] has_uk:false;[R1] uk_info:(null);[R1] uks:(null);[R1] [C1] column_name:C0;[R1] [C1] column_type:MYSQL_TYPE_NEWDECIMAL;[R1] [C1] column_is_rowkey:true;[R1] [C1] column_is_signed:true;[R1] [C1] column_encoding:binary;[R1] [C1] column_is_not_null:true;[R1] [C1] column_value_new:[139](3);[R1] [C1] column_value_old:[139](3);[R1] [C2] column_name:C1;[R1] [C2] column_type:MYSQL_TYPE_DOUBLE;[R1] [C2] column_is_rowkey:false;[R1] [C2] column_is_signed:true;[R1] [C2] column_encoding:binary;[R1] [C2] column_is_not_null:false;[R1] [C2] column_value_new:[-1.2345678901234568E+018](24);[R1] [C2] column_value_old:[1.234E+001](10);[R1] [C3] column_name:C2;[R1] [C3] column_type:MYSQL_TYPE_FLOAT;[R1] [C3] column_is_rowkey:false;[R1] [C3] column_is_signed:true;[R1] [C3] column_encoding:binary;[R1] [C3] column_is_not_null:false;[R1] [C3] column_value_new:[-1.23456794E+018](16);[R1] [C3] column_value_old:[1.23400002E+001](15);[R1] [C4] column_name:C3;[R1] [C4] column_type:MYSQL_TYPE_NEWDECIMAL;[R1] [C4] column_is_rowkey:false;[R1] [C4] column_is_signed:true;[R1] [C4] column_encoding:binary;[R1] [C4] column_is_not_null:false;[R1] [C4] column_value_new:[-1234567890123456789](20);[R1] [C4] column_value_old:[12.34](5);[R1] [C5] column_name:C4;[R1] [C5] column_type:MYSQL_TYPE_OB_NUMBER_FLOAT;[R1] [C5] column_is_rowkey:false;[R1] [C5] column_is_signed:true;[R1] [C5] column_encoding:binary;[R1] [C5] column_is_not_null:false;[R1] [C5] column_value_new:[-1235000000000000000](20);[R1] [C5] column_value_old:[12.34](5);[R1] [C6] column_name:C5;[R1] [C6] column_type:MYSQL_TYPE_OB_NUMBER_FLOAT;[R1] [C6] column_is_rowkey:false;[R1] [C6] column_is_signed:true;[R1] [C6] column_encoding:binary;[R1] [C6] column_is_not_null:false;[R1] [C6] column_value_new:[-1234567890123456789](20);[R1] [C6] column_value_old:[12.34](5);[R1] [C7] column_name:C6;[R1] [C7] column_type:MYSQL_TYPE_VAR_STRING;[R1] [C7] column_is_rowkey:false;[R1] [C7] column_is_signed:true;[R1] [C7] column_encoding:utf8mb4;[R1] [C7] column_is_not_null:false;[R1] [C7] column_value_new:[-1234567890123456789](20);[R1] [C7] column_value_old:[-1234567890123456789](20);[R1] [C8] column_name:C7;[R1] [C8] column_type:MYSQL_TYPE_STRING;[R1] [C8] column_is_rowkey:false;[R1] [C8] column_is_signed:true;[R1] [C8] column_encoding:utf8mb4;[R1] [C8] column_is_not_null:false;[R1] [C8] column_value_new:[-1234567890123456789                                                                                ](100);[R1] [C8] column_value_old:[12.34                                                                                               ](100);$[R2] COMMIT;
update number_1 set c1=c6, c2=c6, c3=c6, c4=c6, c5=c6, c7=c6 where c0 = 140;
select c0, c6, c1, c2, c3, c4, c5, c7 from number_1 where c0 = 140;
C0	C6	C1	C2	C3	C4	C5	C7
140	-12345678901234567890	-1.2345678901234567E+019	-1.23456794E+019	-12345678901234567890	-12350000000000000000	-12345678901234567890	-12345678901234567890                                                                               
ob1.oblog.next;
[R0] BEGIN;[R0] org_cluster_id:1;[R1] record_type:UPDATE;[R1] database_name:oracle.OBLOG_DB;[R1] table_name:NUMBER_1;[R1] log_event:true;[R1] column_count:8;[R1] source_category:SRC_FULL_RECORDED;[R1] source_type:SRC_OCEANBASE_1_0;[R1] has_pk:true;[R1] pk_info:(0);[R1] pks:C0;[R1] has_uk:false;[R1] uk_info:(null);[R1] uks:(null);[R1] [C1] column_name:C0;[R1] [C1] column_type:MYSQL_TYPE_NEWDECIMAL;[R1] [C1] column_is_rowkey:true;[R1] [C1] column_is_signed:true;[R1] [C1] column_encoding:binary;[R1] [C1] column_is_not_null:true;[R1] [C1] column_value_new:[140](3);[R1] [C1] column_value_old:[140](3);[R1] [C2] column_name:C1;[R1] [C2] column_type:MYSQL_TYPE_DOUBLE;[R1] [C2] column_is_rowkey:false;[R1] [C2] column_is_signed:true;[R1] [C2] column_encoding:binary;[R1] [C2] column_is_not_null:false;[R1] [C2] column_value_new:[-1.2345678901234567E+019](24);[R1] [C2] column_value_old:[1.234E+001](10);[R1] [C3] column_name:C2;[R1] [C3] column_type:MYSQL_TYPE_FLOAT;[R1] [C3] column_is_rowkey:false;[R1] [C3] column_is_signed:true;[R1] [C3] column_encoding:binary;[R1] [C3] column_is_not_null:false;[R1] [C3] column_value_new:[-1.23456794E+019](16);[R1] [C3] column_value_old:[1.23400002E+001](15);[R1] [C4] column_name:C3;[R1] [C4] column_type:MYSQL_TYPE_NEWDECIMAL;[R1] [C4] column_is_rowkey:false;[R1] [C4] column_is_signed:true;[R1] [C4] column_encoding:binary;[R1] [C4] column_is_not_null:false;[R1] [C4] column_value_new:[-12345678901234567890](21);[R1] [C4] column_value_old:[12.34](5);[R1] [C5] column_name:C4;[R1] [C5] column_type:MYSQL_TYPE_OB_NUMBER_FLOAT;[R1] [C5] column_is_rowkey:false;[R1] [C5] column_is_signed:true;[R1] [C5] column_encoding:binary;[R1] [C5] column_is_not_null:false;[R1] [C5] column_value_new:[-12350000000000000000](21);[R1] [C5] column_value_old:[12.34](5);[R1] [C6] column_name:C5;[R1] [C6] column_type:MYSQL_TYPE_OB_NUMBER_FLOAT;[R1] [C6] column_is_rowkey:false;[R1] [C6] column_is_signed:true;[R1] [C6] column_encoding:binary;[R1] [C6] column_is_not_null:false;[R1] [C6] column_value_new:[-12345678901234567890](21);[R1] [C6] column_value_old:[12.34](5);[R1] [C7] column_name:C6;[R1] [C7] column_type:MYSQL_TYPE_VAR_STRING;[R1] [C7] column_is_rowkey:false;[R1] [C7] column_is_signed:true;[R1] [C7] column_encoding:utf8mb4;[R1] [C7] column_is_not_null:false;[R1] [C7] column_value_new:[-12345678901234567890](21);[R1] [C7] column_value_old:[-12345678901234567890](21);[R1] [C8] column_name:C7;[R1] [C8] column_type:MYSQL_TYPE_STRING;[R1] [C8] column_is_rowkey:false;[R1] [C8] column_is_signed:true;[R1] [C8] column_encoding:utf8mb4;[R1] [C8] column_is_not_null:false;[R1] [C8] column_value_new:[-12345678901234567890                                                                               ](100);[R1] [C8] column_value_old:[12.34                                                                                               ](100);$[R2] COMMIT;
update number_1 set c1=c6, c2=c6, c3=c6, c4=c6, c5=c6, c7=c6 where c0 = 141;
select c0, c6, c1, c2, c3, c4, c5, c7 from number_1 where c0 = 141;
C0	C6	C1	C2	C3	C4	C5	C7
141	-1234567890123456789.0	-1.2345678901234568E+018	-1.23456794E+018	-1234567890123456789	-1235000000000000000	-1234567890123456789	-1234567890123456789.0                                                                              
ob1.oblog.next;
[R0] BEGIN;[R0] org_cluster_id:1;[R1] record_type:UPDATE;[R1] database_name:oracle.OBLOG_DB;[R1] table_name:NUMBER_1;[R1] log_event:true;[R1] column_count:8;[R1] source_category:SRC_FULL_RECORDED;[R1] source_type:SRC_OCEANBASE_1_0;[R1] has_pk:true;[R1] pk_info:(0);[R1] pks:C0;[R1] has_uk:false;[R1] uk_info:(null);[R1] uks:(null);[R1] [C1] column_name:C0;[R1] [C1] column_type:MYSQL_TYPE_NEWDECIMAL;[R1] [C1] column_is_rowkey:true;[R1] [C1] column_is_signed:true;[R1] [C1] column_encoding:binary;[R1] [C1] column_is_not_null:true;[R1] [C1] column_value_new:[141](3);[R1] [C1] column_value_old:[141](3);[R1] [C2] column_name:C1;[R1] [C2] column_type:MYSQL_TYPE_DOUBLE;[R1] [C2] column_is_rowkey:false;[R1] [C2] column_is_signed:true;[R1] [C2] column_encoding:binary;[R1] [C2] column_is_not_null:false;[R1] [C2] column_value_new:[-1.2345678901234568E+018](24);[R1] [C2] column_value_old:[1.234E+001](10);[R1] [C3] column_name:C2;[R1] [C3] column_type:MYSQL_TYPE_FLOAT;[R1] [C3] column_is_rowkey:false;[R1] [C3] column_is_signed:true;[R1] [C3] column_encoding:binary;[R1] [C3] column_is_not_null:false;[R1] [C3] column_value_new:[-1.23456794E+018](16);[R1] [C3] column_value_old:[1.23400002E+001](15);[R1] [C4] column_name:C3;[R1] [C4] column_type:MYSQL_TYPE_NEWDECIMAL;[R1] [C4] column_is_rowkey:false;[R1] [C4] column_is_signed:true;[R1] [C4] column_encoding:binary;[R1] [C4] column_is_not_null:false;[R1] [C4] column_value_new:[-1234567890123456789](20);[R1] [C4] column_value_old:[12.34](5);[R1] [C5] column_name:C4;[R1] [C5] column_type:MYSQL_TYPE_OB_NUMBER_FLOAT;[R1] [C5] column_is_rowkey:false;[R1] [C5] column_is_signed:true;[R1] [C5] column_encoding:binary;[R1] [C5] column_is_not_null:false;[R1] [C5] column_value_new:[-1235000000000000000](20);[R1] [C5] column_value_old:[12.34](5);[R1] [C6] column_name:C5;[R1] [C6] column_type:MYSQL_TYPE_OB_NUMBER_FLOAT;[R1] [C6] column_is_rowkey:false;[R1] [C6] column_is_signed:true;[R1] [C6] column_encoding:binary;[R1] [C6] column_is_not_null:false;[R1] [C6] column_value_new:[-1234567890123456789](20);[R1] [C6] column_value_old:[12.34](5);[R1] [C7] column_name:C6;[R1] [C7] column_type:MYSQL_TYPE_VAR_STRING;[R1] [C7] column_is_rowkey:false;[R1] [C7] column_is_signed:true;[R1] [C7] column_encoding:utf8mb4;[R1] [C7] column_is_not_null:false;[R1] [C7] column_value_new:[-1234567890123456789.0](22);[R1] [C7] column_value_old:[-1234567890123456789.0](22);[R1] [C8] column_name:C7;[R1] [C8] column_type:MYSQL_TYPE_STRING;[R1] [C8] column_is_rowkey:false;[R1] [C8] column_is_signed:true;[R1] [C8] column_encoding:utf8mb4;[R1] [C8] column_is_not_null:false;[R1] [C8] column_value_new:[-1234567890123456789.0                                                                              ](100);[R1] [C8] column_value_old:[12.34                                                                                               ](100);$[R2] COMMIT;
update number_1 set c1=c6, c2=c6, c3=c6, c4=c6, c5=c6, c7=c6 where c0 = 142;
select c0, c6, c1, c2, c3, c4, c5, c7 from number_1 where c0 = 142;
C0	C6	C1	C2	C3	C4	C5	C7
142	-123456789012345678.90	-1.2345678901234568E+017	-1.23456791E+017	-123456789012345678.9	-123500000000000000	-123456789012345678.9	-123456789012345678.90                                                                              
ob1.oblog.next;
[R0] BEGIN;[R0] org_cluster_id:1;[R1] record_type:UPDATE;[R1] database_name:oracle.OBLOG_DB;[R1] table_name:NUMBER_1;[R1] log_event:true;[R1] column_count:8;[R1] source_category:SRC_FULL_RECORDED;[R1] source_type:SRC_OCEANBASE_1_0;[R1] has_pk:true;[R1] pk_info:(0);[R1] pks:C0;[R1] has_uk:false;[R1] uk_info:(null);[R1] uks:(null);[R1] [C1] column_name:C0;[R1] [C1] column_type:MYSQL_TYPE_NEWDECIMAL;[R1] [C1] column_is_rowkey:true;[R1] [C1] column_is_signed:true;[R1] [C1] column_encoding:binary;[R1] [C1] column_is_not_null:true;[R1] [C1] column_value_new:[142](3);[R1] [C1] column_value_old:[142](3);[R1] [C2] column_name:C1;[R1] [C2] column_type:MYSQL_TYPE_DOUBLE;[R1] [C2] column_is_rowkey:false;[R1] [C2] column_is_signed:true;[R1] [C2] column_encoding:binary;[R1] [C2] column_is_not_null:false;[R1] [C2] column_value_new:[-1.2345678901234568E+017](24);[R1] [C2] column_value_old:[1.234E+001](10);[R1] [C3] column_name:C2;[R1] [C3] column_type:MYSQL_TYPE_FLOAT;[R1] [C3] column_is_rowkey:false;[R1] [C3] column_is_signed:true;[R1] [C3] column_encoding:binary;[R1] [C3] column_is_not_null:false;[R1] [C3] column_value_new:[-1.23456791E+017](16);[R1] [C3] column_value_old:[1.23400002E+001](15);[R1] [C4] column_name:C3;[R1] [C4] column_type:MYSQL_TYPE_NEWDECIMAL;[R1] [C4] column_is_rowkey:false;[R1] [C4] column_is_signed:true;[R1] [C4] column_encoding:binary;[R1] [C4] column_is_not_null:false;[R1] [C4] column_value_new:[-123456789012345678.9](21);[R1] [C4] column_value_old:[12.34](5);[R1] [C5] column_name:C4;[R1] [C5] column_type:MYSQL_TYPE_OB_NUMBER_FLOAT;[R1] [C5] column_is_rowkey:false;[R1] [C5] column_is_signed:true;[R1] [C5] column_encoding:binary;[R1] [C5] column_is_not_null:false;[R1] [C5] column_value_new:[-123500000000000000](19);[R1] [C5] column_value_old:[12.34](5);[R1] [C6] column_name:C5;[R1] [C6] column_type:MYSQL_TYPE_OB_NUMBER_FLOAT;[R1] [C6] column_is_rowkey:false;[R1] [C6] column_is_signed:true;[R1] [C6] column_encoding:binary;[R1] [C6] column_is_not_null:false;[R1] [C6] column_value_new:[-123456789012345678.9](21);[R1] [C6] column_value_old:[12.34](5);[R1] [C7] column_name:C6;[R1] [C7] column_type:MYSQL_TYPE_VAR_STRING;[R1] [C7] column_is_rowkey:false;[R1] [C7] column_is_signed:true;[R1] [C7] column_encoding:utf8mb4;[R1] [C7] column_is_not_null:false;[R1] [C7] column_value_new:[-123456789012345678.90](22);[R1] [C7] column_value_old:[-123456789012345678.90](22);[R1] [C8] column_name:C7;[R1] [C8] column_type:MYSQL_TYPE_STRING;[R1] [C8] column_is_rowkey:false;[R1] [C8] column_is_signed:true;[R1] [C8] column_encoding:utf8mb4;[R1] [C8] column_is_not_null:false;[R1] [C8] column_value_new:[-123456789012345678.90                                                                              ](100);[R1] [C8] column_value_old:[12.34                                                                                               ](100);$[R2] COMMIT;
update number_1 set c1=c6, c2=c6, c3=c6, c4=c6, c5=c6, c7=c6 where c0 = 143;
select c0, c6, c1, c2, c3, c4, c5, c7 from number_1 where c0 = 143;
C0	C6	C1	C2	C3	C4	C5	C7
143	-12345678901234567.890	-1.2345678901234568E+016	-1.23456784E+016	-12345678901234567.89	-12350000000000000	-12345678901234567.89	-12345678901234567.890                                                                              
ob1.oblog.next;
[R0] BEGIN;[R0] org_cluster_id:1;[R1] record_type:UPDATE;[R1] database_name:oracle.OBLOG_DB;[R1] table_name:NUMBER_1;[R1] log_event:true;[R1] column_count:8;[R1] source_category:SRC_FULL_RECORDED;[R1] source_type:SRC_OCEANBASE_1_0;[R1] has_pk:true;[R1] pk_info:(0);[R1] pks:C0;[R1] has_uk:false;[R1] uk_info:(null);[R1] uks:(null);[R1] [C1] column_name:C0;[R1] [C1] column_type:MYSQL_TYPE_NEWDECIMAL;[R1] [C1] column_is_rowkey:true;[R1] [C1] column_is_signed:true;[R1] [C1] column_encoding:binary;[R1] [C1] column_is_not_null:true;[R1] [C1] column_value_new:[143](3);[R1] [C1] column_value_old:[143](3);[R1] [C2] column_name:C1;[R1] [C2] column_type:MYSQL_TYPE_DOUBLE;[R1] [C2] column_is_rowkey:false;[R1] [C2] column_is_signed:true;[R1] [C2] column_encoding:binary;[R1] [C2] column_is_not_null:false;[R1] [C2] column_value_new:[-1.2345678901234568E+016](24);[R1] [C2] column_value_old:[1.234E+001](10);[R1] [C3] column_name:C2;[R1] [C3] column_type:MYSQL_TYPE_FLOAT;[R1] [C3] column_is_rowkey:false;[R1] [C3] column_is_signed:true;[R1] [C3] column_encoding:binary;[R1] [C3] column_is_not_null:false;[R1] [C3] column_value_new:[-1.23456784E+016](16);[R1] [C3] column_value_old:[1.23400002E+001](15);[R1] [C4] column_name:C3;[R1] [C4] column_type:MYSQL_TYPE_NEWDECIMAL;[R1] [C4] column_is_rowkey:false;[R1] [C4] column_is_signed:true;[R1] [C4] column_encoding:binary;[R1] [C4] column_is_not_null:false;[R1] [C4] column_value_new:[-12345678901234567.89](21);[R1] [C4] column_value_old:[12.34](5);[R1] [C5] column_name:C4;[R1] [C5] column_type:MYSQL_TYPE_OB_NUMBER_FLOAT;[R1] [C5] column_is_rowkey:false;[R1] [C5] column_is_signed:true;[R1] [C5] column_encoding:binary;[R1] [C5] column_is_not_null:false;[R1] [C5] column_value_new:[-12350000000000000](18);[R1] [C5] column_value_old:[12.34](5);[R1] [C6] column_name:C5;[R1] [C6] column_type:MYSQL_TYPE_OB_NUMBER_FLOAT;[R1] [C6] column_is_rowkey:false;[R1] [C6] column_is_signed:true;[R1] [C6] column_encoding:binary;[R1] [C6] column_is_not_null:false;[R1] [C6] column_value_new:[-12345678901234567.89](21);[R1] [C6] column_value_old:[12.34](5);[R1] [C7] column_name:C6;[R1] [C7] column_type:MYSQL_TYPE_VAR_STRING;[R1] [C7] column_is_rowkey:false;[R1] [C7] column_is_signed:true;[R1] [C7] column_encoding:utf8mb4;[R1] [C7] column_is_not_null:false;[R1] [C7] column_value_new:[-12345678901234567.890](22);[R1] [C7] column_value_old:[-12345678901234567.890](22);[R1] [C8] column_name:C7;[R1] [C8] column_type:MYSQL_TYPE_STRING;[R1] [C8] column_is_rowkey:false;[R1] [C8] column_is_signed:true;[R1] [C8] column_encoding:utf8mb4;[R1] [C8] column_is_not_null:false;[R1] [C8] column_value_new:[-12345678901234567.890                                                                              ](100);[R1] [C8] column_value_old:[12.34                                                                                               ](100);$[R2] COMMIT;
update number_1 set c1=c6, c2=c6, c3=c6, c4=c6, c5=c6, c7=c6 where c0 = 144;
select c0, c6, c1, c2, c3, c4, c5, c7 from number_1 where c0 = 144;
C0	C6	C1	C2	C3	C4	C5	C7
144	-1234567890123456.7890	-1.2345678901234568E+015	-1.23456795E+015	-1234567890123456.789	-1235000000000000	-1234567890123456.789	-1234567890123456.7890                                                                              
ob1.oblog.next;
[R0] BEGIN;[R0] org_cluster_id:1;[R1] record_type:UPDATE;[R1] database_name:oracle.OBLOG_DB;[R1] table_name:NUMBER_1;[R1] log_event:true;[R1] column_count:8;[R1] source_category:SRC_FULL_RECORDED;[R1] source_type:SRC_OCEANBASE_1_0;[R1] has_pk:true;[R1] pk_info:(0);[R1] pks:C0;[R1] has_uk:false;[R1] uk_info:(null);[R1] uks:(null);[R1] [C1] column_name:C0;[R1] [C1] column_type:MYSQL_TYPE_NEWDECIMAL;[R1] [C1] column_is_rowkey:true;[R1] [C1] column_is_signed:true;[R1] [C1] column_encoding:binary;[R1] [C1] column_is_not_null:true;[R1] [C1] column_value_new:[144](3);[R1] [C1] column_value_old:[144](3);[R1] [C2] column_name:C1;[R1] [C2] column_type:MYSQL_TYPE_DOUBLE;[R1] [C2] column_is_rowkey:false;[R1] [C2] column_is_signed:true;[R1] [C2] column_encoding:binary;[R1] [C2] column_is_not_null:false;[R1] [C2] column_value_new:[-1.2345678901234568E+015](24);[R1] [C2] column_value_old:[1.234E+001](10);[R1] [C3] column_name:C2;[R1] [C3] column_type:MYSQL_TYPE_FLOAT;[R1] [C3] column_is_rowkey:false;[R1] [C3] column_is_signed:true;[R1] [C3] column_encoding:binary;[R1] [C3] column_is_not_null:false;[R1] [C3] column_value_new:[-1.23456795E+015](16);[R1] [C3] column_value_old:[1.23400002E+001](15);[R1] [C4] column_name:C3;[R1] [C4] column_type:MYSQL_TYPE_NEWDECIMAL;[R1] [C4] column_is_rowkey:false;[R1] [C4] column_is_signed:true;[R1] [C4] column_encoding:binary;[R1] [C4] column_is_not_null:false;[R1] [C4] column_value_new:[-1234567890123456.789](21);[R1] [C4] column_value_old:[12.34](5);[R1] [C5] column_name:C4;[R1] [C5] column_type:MYSQL_TYPE_OB_NUMBER_FLOAT;[R1] [C5] column_is_rowkey:false;[R1] [C5] column_is_signed:true;[R1] [C5] column_encoding:binary;[R1] [C5] column_is_not_null:false;[R1] [C5] column_value_new:[-1235000000000000](17);[R1] [C5] column_value_old:[12.34](5);[R1] [C6] column_name:C5;[R1] [C6] column_type:MYSQL_TYPE_OB_NUMBER_FLOAT;[R1] [C6] column_is_rowkey:false;[R1] [C6] column_is_signed:true;[R1] [C6] column_encoding:binary;[R1] [C6] column_is_not_null:false;[R1] [C6] column_value_new:[-1234567890123456.789](21);[R1] [C6] column_value_old:[12.34](5);[R1] [C7] column_name:C6;[R1] [C7] column_type:MYSQL_TYPE_VAR_STRING;[R1] [C7] column_is_rowkey:false;[R1] [C7] column_is_signed:true;[R1] [C7] column_encoding:utf8mb4;[R1] [C7] column_is_not_null:false;[R1] [C7] column_value_new:[-1234567890123456.7890](22);[R1] [C7] column_value_old:[-1234567890123456.7890](22);[R1] [C8] column_name:C7;[R1] [C8] column_type:MYSQL_TYPE_STRING;[R1] [C8] column_is_rowkey:false;[R1] [C8] column_is_signed:true;[R1] [C8] column_encoding:utf8mb4;[R1] [C8] column_is_not_null:false;[R1] [C8] column_value_new:[-1234567890123456.7890                                                                              ](100);[R1] [C8] column_value_old:[12.34                                                                                               ](100);$[R2] COMMIT;
update number_1 set c1=c6, c2=c6, c3=c6, c4=c6, c5=c6, c7=c6 where c0 = 145;
select c0, c6, c1, c2, c3, c4, c5, c7 from number_1 where c0 = 145;
C0	C6	C1	C2	C3	C4	C5	C7
145	-123456789012345.67890	-1.2345678901234567E+014	-1.23456788E+014	-123456789012345.6789	-123500000000000	-123456789012345.6789	-123456789012345.67890                                                                              
ob1.oblog.next;
[R0] BEGIN;[R0] org_cluster_id:1;[R1] record_type:UPDATE;[R1] database_name:oracle.OBLOG_DB;[R1] table_name:NUMBER_1;[R1] log_event:true;[R1] column_count:8;[R1] source_category:SRC_FULL_RECORDED;[R1] source_type:SRC_OCEANBASE_1_0;[R1] has_pk:true;[R1] pk_info:(0);[R1] pks:C0;[R1] has_uk:false;[R1] uk_info:(null);[R1] uks:(null);[R1] [C1] column_name:C0;[R1] [C1] column_type:MYSQL_TYPE_NEWDECIMAL;[R1] [C1] column_is_rowkey:true;[R1] [C1] column_is_signed:true;[R1] [C1] column_encoding:binary;[R1] [C1] column_is_not_null:true;[R1] [C1] column_value_new:[145](3);[R1] [C1] column_value_old:[145](3);[R1] [C2] column_name:C1;[R1] [C2] column_type:MYSQL_TYPE_DOUBLE;[R1] [C2] column_is_rowkey:false;[R1] [C2] column_is_signed:true;[R1] [C2] column_encoding:binary;[R1] [C2] column_is_not_null:false;[R1] [C2] column_value_new:[-1.2345678901234567E+014](24);[R1] [C2] column_value_old:[1.234E+001](10);[R1] [C3] column_name:C2;[R1] [C3] column_type:MYSQL_TYPE_FLOAT;[R1] [C3] column_is_rowkey:false;[R1] [C3] column_is_signed:true;[R1] [C3] column_encoding:binary;[R1] [C3] column_is_not_null:false;[R1] [C3] column_value_new:[-1.23456788E+014](16);[R1] [C3] column_value_old:[1.23400002E+001](15);[R1] [C4] column_name:C3;[R1] [C4] column_type:MYSQL_TYPE_NEWDECIMAL;[R1] [C4] column_is_rowkey:false;[R1] [C4] column_is_signed:true;[R1] [C4] column_encoding:binary;[R1] [C4] column_is_not_null:false;[R1] [C4] column_value_new:[-123456789012345.6789](21);[R1] [C4] column_value_old:[12.34](5);[R1] [C5] column_name:C4;[R1] [C5] column_type:MYSQL_TYPE_OB_NUMBER_FLOAT;[R1] [C5] column_is_rowkey:false;[R1] [C5] column_is_signed:true;[R1] [C5] column_encoding:binary;[R1] [C5] column_is_not_null:false;[R1] [C5] column_value_new:[-123500000000000](16);[R1] [C5] column_value_old:[12.34](5);[R1] [C6] column_name:C5;[R1] [C6] column_type:MYSQL_TYPE_OB_NUMBER_FLOAT;[R1] [C6] column_is_rowkey:false;[R1] [C6] column_is_signed:true;[R1] [C6] column_encoding:binary;[R1] [C6] column_is_not_null:false;[R1] [C6] column_value_new:[-123456789012345.6789](21);[R1] [C6] column_value_old:[12.34](5);[R1] [C7] column_name:C6;[R1] [C7] column_type:MYSQL_TYPE_VAR_STRING;[R1] [C7] column_is_rowkey:false;[R1] [C7] column_is_signed:true;[R1] [C7] column_encoding:utf8mb4;[R1] [C7] column_is_not_null:false;[R1] [C7] column_value_new:[-123456789012345.67890](22);[R1] [C7] column_value_old:[-123456789012345.67890](22);[R1] [C8] column_name:C7;[R1] [C8] column_type:MYSQL_TYPE_STRING;[R1] [C8] column_is_rowkey:false;[R1] [C8] column_is_signed:true;[R1] [C8] column_encoding:utf8mb4;[R1] [C8] column_is_not_null:false;[R1] [C8] column_value_new:[-123456789012345.67890                                                                              ](100);[R1] [C8] column_value_old:[12.34                                                                                               ](100);$[R2] COMMIT;
update number_1 set c1=c6, c2=c6, c3=c6, c4=c6, c5=c6, c7=c6 where c0 = 146;
select c0, c6, c1, c2, c3, c4, c5, c7 from number_1 where c0 = 146;
C0	C6	C1	C2	C3	C4	C5	C7
146	-12345678901234.567890	-1.2345678901234568E+013	-1.2345679E+013	-12345678901234.56789	-12350000000000	-12345678901234.56789	-12345678901234.567890                                                                              
ob1.oblog.next;
[R0] BEGIN;[R0] org_cluster_id:1;[R1] record_type:UPDATE;[R1] database_name:oracle.OBLOG_DB;[R1] table_name:NUMBER_1;[R1] log_event:true;[R1] column_count:8;[R1] source_category:SRC_FULL_RECORDED;[R1] source_type:SRC_OCEANBASE_1_0;[R1] has_pk:true;[R1] pk_info:(0);[R1] pks:C0;[R1] has_uk:false;[R1] uk_info:(null);[R1] uks:(null);[R1] [C1] column_name:C0;[R1] [C1] column_type:MYSQL_TYPE_NEWDECIMAL;[R1] [C1] column_is_rowkey:true;[R1] [C1] column_is_signed:true;[R1] [C1] column_encoding:binary;[R1] [C1] column_is_not_null:true;[R1] [C1] column_value_new:[146](3);[R1] [C1] column_value_old:[146](3);[R1] [C2] column_name:C1;[R1] [C2] column_type:MYSQL_TYPE_DOUBLE;[R1] [C2] column_is_rowkey:false;[R1] [C2] column_is_signed:true;[R1] [C2] column_encoding:binary;[R1] [C2] column_is_not_null:false;[R1] [C2] column_value_new:[-1.2345678901234568E+013](24);[R1] [C2] column_value_old:[1.234E+001](10);[R1] [C3] column_name:C2;[R1] [C3] column_type:MYSQL_TYPE_FLOAT;[R1] [C3] column_is_rowkey:false;[R1] [C3] column_is_signed:true;[R1] [C3] column_encoding:binary;[R1] [C3] column_is_not_null:false;[R1] [C3] column_value_new:[-1.2345679E+013](15);[R1] [C3] column_value_old:[1.23400002E+001](15);[R1] [C4] column_name:C3;[R1] [C4] column_type:MYSQL_TYPE_NEWDECIMAL;[R1] [C4] column_is_rowkey:false;[R1] [C4] column_is_signed:true;[R1] [C4] column_encoding:binary;[R1] [C4] column_is_not_null:false;[R1] [C4] column_value_new:[-12345678901234.56789](21);[R1] [C4] column_value_old:[12.34](5);[R1] [C5] column_name:C4;[R1] [C5] column_type:MYSQL_TYPE_OB_NUMBER_FLOAT;[R1] [C5] column_is_rowkey:false;[R1] [C5] column_is_signed:true;[R1] [C5] column_encoding:binary;[R1] [C5] column_is_not_null:false;[R1] [C5] column_value_new:[-12350000000000](15);[R1] [C5] column_value_old:[12.34](5);[R1] [C6] column_name:C5;[R1] [C6] column_type:MYSQL_TYPE_OB_NUMBER_FLOAT;[R1] [C6] column_is_rowkey:false;[R1] [C6] column_is_signed:true;[R1] [C6] column_encoding:binary;[R1] [C6] column_is_not_null:false;[R1] [C6] column_value_new:[-12345678901234.56789](21);[R1] [C6] column_value_old:[12.34](5);[R1] [C7] column_name:C6;[R1] [C7] column_type:MYSQL_TYPE_VAR_STRING;[R1] [C7] column_is_rowkey:false;[R1] [C7] column_is_signed:true;[R1] [C7] column_encoding:utf8mb4;[R1] [C7] column_is_not_null:false;[R1] [C7] column_value_new:[-12345678901234.567890](22);[R1] [C7] column_value_old:[-12345678901234.567890](22);[R1] [C8] column_name:C7;[R1] [C8] column_type:MYSQL_TYPE_STRING;[R1] [C8] column_is_rowkey:false;[R1] [C8] column_is_signed:true;[R1] [C8] column_encoding:utf8mb4;[R1] [C8] column_is_not_null:false;[R1] [C8] column_value_new:[-12345678901234.567890                                                                              ](100);[R1] [C8] column_value_old:[12.34                                                                                               ](100);$[R2] COMMIT;
update number_1 set c1=c6, c2=c6, c3=c6, c4=c6, c5=c6, c7=c6 where c0 = 147;
select c0, c6, c1, c2, c3, c4, c5, c7 from number_1 where c0 = 147;
C0	C6	C1	C2	C3	C4	C5	C7
147	-1234567890123.4567890	-1.2345678901234568E+012	-1.23456795E+012	-1234567890123.456789	-1235000000000	-1234567890123.456789	-1234567890123.4567890                                                                              
ob1.oblog.next;
[R0] BEGIN;[R0] org_cluster_id:1;[R1] record_type:UPDATE;[R1] database_name:oracle.OBLOG_DB;[R1] table_name:NUMBER_1;[R1] log_event:true;[R1] column_count:8;[R1] source_category:SRC_FULL_RECORDED;[R1] source_type:SRC_OCEANBASE_1_0;[R1] has_pk:true;[R1] pk_info:(0);[R1] pks:C0;[R1] has_uk:false;[R1] uk_info:(null);[R1] uks:(null);[R1] [C1] column_name:C0;[R1] [C1] column_type:MYSQL_TYPE_NEWDECIMAL;[R1] [C1] column_is_rowkey:true;[R1] [C1] column_is_signed:true;[R1] [C1] column_encoding:binary;[R1] [C1] column_is_not_null:true;[R1] [C1] column_value_new:[147](3);[R1] [C1] column_value_old:[147](3);[R1] [C2] column_name:C1;[R1] [C2] column_type:MYSQL_TYPE_DOUBLE;[R1] [C2] column_is_rowkey:false;[R1] [C2] column_is_signed:true;[R1] [C2] column_encoding:binary;[R1] [C2] column_is_not_null:false;[R1] [C2] column_value_new:[-1.2345678901234568E+012](24);[R1] [C2] column_value_old:[1.234E+001](10);[R1] [C3] column_name:C2;[R1] [C3] column_type:MYSQL_TYPE_FLOAT;[R1] [C3] column_is_rowkey:false;[R1] [C3] column_is_signed:true;[R1] [C3] column_encoding:binary;[R1] [C3] column_is_not_null:false;[R1] [C3] column_value_new:[-1.23456795E+012](16);[R1] [C3] column_value_old:[1.23400002E+001](15);[R1] [C4] column_name:C3;[R1] [C4] column_type:MYSQL_TYPE_NEWDECIMAL;[R1] [C4] column_is_rowkey:false;[R1] [C4] column_is_signed:true;[R1] [C4] column_encoding:binary;[R1] [C4] column_is_not_null:false;[R1] [C4] column_value_new:[-1234567890123.456789](21);[R1] [C4] column_value_old:[12.34](5);[R1] [C5] column_name:C4;[R1] [C5] column_type:MYSQL_TYPE_OB_NUMBER_FLOAT;[R1] [C5] column_is_rowkey:false;[R1] [C5] column_is_signed:true;[R1] [C5] column_encoding:binary;[R1] [C5] column_is_not_null:false;[R1] [C5] column_value_new:[-1235000000000](14);[R1] [C5] column_value_old:[12.34](5);[R1] [C6] column_name:C5;[R1] [C6] column_type:MYSQL_TYPE_OB_NUMBER_FLOAT;[R1] [C6] column_is_rowkey:false;[R1] [C6] column_is_signed:true;[R1] [C6] column_encoding:binary;[R1] [C6] column_is_not_null:false;[R1] [C6] column_value_new:[-1234567890123.456789](21);[R1] [C6] column_value_old:[12.34](5);[R1] [C7] column_name:C6;[R1] [C7] column_type:MYSQL_TYPE_VAR_STRING;[R1] [C7] column_is_rowkey:false;[R1] [C7] column_is_signed:true;[R1] [C7] column_encoding:utf8mb4;[R1] [C7] column_is_not_null:false;[R1] [C7] column_value_new:[-1234567890123.4567890](22);[R1] [C7] column_value_old:[-1234567890123.4567890](22);[R1] [C8] column_name:C7;[R1] [C8] column_type:MYSQL_TYPE_STRING;[R1] [C8] column_is_rowkey:false;[R1] [C8] column_is_signed:true;[R1] [C8] column_encoding:utf8mb4;[R1] [C8] column_is_not_null:false;[R1] [C8] column_value_new:[-1234567890123.4567890                                                                              ](100);[R1] [C8] column_value_old:[12.34                                                                                               ](100);$[R2] COMMIT;
update number_1 set c1=c6, c2=c6, c3=c6, c4=c6, c5=c6, c7=c6 where c0 = 148;
select c0, c6, c1, c2, c3, c4, c5, c7 from number_1 where c0 = 148;
C0	C6	C1	C2	C3	C4	C5	C7
148	-123456789012.34567890	-1.2345678901234567E+011	-1.23456791E+011	-123456789012.3456789	-123500000000	-123456789012.3456789	-123456789012.34567890                                                                              
ob1.oblog.next;
[R0] BEGIN;[R0] org_cluster_id:1;[R1] record_type:UPDATE;[R1] database_name:oracle.OBLOG_DB;[R1] table_name:NUMBER_1;[R1] log_event:true;[R1] column_count:8;[R1] source_category:SRC_FULL_RECORDED;[R1] source_type:SRC_OCEANBASE_1_0;[R1] has_pk:true;[R1] pk_info:(0);[R1] pks:C0;[R1] has_uk:false;[R1] uk_info:(null);[R1] uks:(null);[R1] [C1] column_name:C0;[R1] [C1] column_type:MYSQL_TYPE_NEWDECIMAL;[R1] [C1] column_is_rowkey:true;[R1] [C1] column_is_signed:true;[R1] [C1] column_encoding:binary;[R1] [C1] column_is_not_null:true;[R1] [C1] column_value_new:[148](3);[R1] [C1] column_value_old:[148](3);[R1] [C2] column_name:C1;[R1] [C2] column_type:MYSQL_TYPE_DOUBLE;[R1] [C2] column_is_rowkey:false;[R1] [C2] column_is_signed:true;[R1] [C2] column_encoding:binary;[R1] [C2] column_is_not_null:false;[R1] [C2] column_value_new:[-1.2345678901234567E+011](24);[R1] [C2] column_value_old:[1.234E+001](10);[R1] [C3] column_name:C2;[R1] [C3] column_type:MYSQL_TYPE_FLOAT;[R1] [C3] column_is_rowkey:false;[R1] [C3] column_is_signed:true;[R1] [C3] column_encoding:binary;[R1] [C3] column_is_not_null:false;[R1] [C3] column_value_new:[-1.23456791E+011](16);[R1] [C3] column_value_old:[1.23400002E+001](15);[R1] [C4] column_name:C3;[R1] [C4] column_type:MYSQL_TYPE_NEWDECIMAL;[R1] [C4] column_is_rowkey:false;[R1] [C4] column_is_signed:true;[R1] [C4] column_encoding:binary;[R1] [C4] column_is_not_null:false;[R1] [C4] column_value_new:[-123456789012.3456789](21);[R1] [C4] column_value_old:[12.34](5);[R1] [C5] column_name:C4;[R1] [C5] column_type:MYSQL_TYPE_OB_NUMBER_FLOAT;[R1] [C5] column_is_rowkey:false;[R1] [C5] column_is_signed:true;[R1] [C5] column_encoding:binary;[R1] [C5] column_is_not_null:false;[R1] [C5] column_value_new:[-123500000000](13);[R1] [C5] column_value_old:[12.34](5);[R1] [C6] column_name:C5;[R1] [C6] column_type:MYSQL_TYPE_OB_NUMBER_FLOAT;[R1] [C6] column_is_rowkey:false;[R1] [C6] column_is_signed:true;[R1] [C6] column_encoding:binary;[R1] [C6] column_is_not_null:false;[R1] [C6] column_value_new:[-123456789012.3456789](21);[R1] [C6] column_value_old:[12.34](5);[R1] [C7] column_name:C6;[R1] [C7] column_type:MYSQL_TYPE_VAR_STRING;[R1] [C7] column_is_rowkey:false;[R1] [C7] column_is_signed:true;[R1] [C7] column_encoding:utf8mb4;[R1] [C7] column_is_not_null:false;[R1] [C7] column_value_new:[-123456789012.34567890](22);[R1] [C7] column_value_old:[-123456789012.34567890](22);[R1] [C8] column_name:C7;[R1] [C8] column_type:MYSQL_TYPE_STRING;[R1] [C8] column_is_rowkey:false;[R1] [C8] column_is_signed:true;[R1] [C8] column_encoding:utf8mb4;[R1] [C8] column_is_not_null:false;[R1] [C8] column_value_new:[-123456789012.34567890                                                                              ](100);[R1] [C8] column_value_old:[12.34                                                                                               ](100);$[R2] COMMIT;
update number_1 set c1=c6, c2=c6, c3=c6, c4=c6, c5=c6, c7=c6 where c0 = 149;
select c0, c6, c1, c2, c3, c4, c5, c7 from number_1 where c0 = 149;
C0	C6	C1	C2	C3	C4	C5	C7
149	-12345678901.234567890	-1.2345678901234568E+010	-1.23456788E+010	-12345678901.23456789	-12350000000	-12345678901.23456789	-12345678901.234567890                                                                              
ob1.oblog.next;
[R0] BEGIN;[R0] org_cluster_id:1;[R1] record_type:UPDATE;[R1] database_name:oracle.OBLOG_DB;[R1] table_name:NUMBER_1;[R1] log_event:true;[R1] column_count:8;[R1] source_category:SRC_FULL_RECORDED;[R1] source_type:SRC_OCEANBASE_1_0;[R1] has_pk:true;[R1] pk_info:(0);[R1] pks:C0;[R1] has_uk:false;[R1] uk_info:(null);[R1] uks:(null);[R1] [C1] column_name:C0;[R1] [C1] column_type:MYSQL_TYPE_NEWDECIMAL;[R1] [C1] column_is_rowkey:true;[R1] [C1] column_is_signed:true;[R1] [C1] column_encoding:binary;[R1] [C1] column_is_not_null:true;[R1] [C1] column_value_new:[149](3);[R1] [C1] column_value_old:[149](3);[R1] [C2] column_name:C1;[R1] [C2] column_type:MYSQL_TYPE_DOUBLE;[R1] [C2] column_is_rowkey:false;[R1] [C2] column_is_signed:true;[R1] [C2] column_encoding:binary;[R1] [C2] column_is_not_null:false;[R1] [C2] column_value_new:[-1.2345678901234568E+010](24);[R1] [C2] column_value_old:[1.234E+001](10);[R1] [C3] column_name:C2;[R1] [C3] column_type:MYSQL_TYPE_FLOAT;[R1] [C3] column_is_rowkey:false;[R1] [C3] column_is_signed:true;[R1] [C3] column_encoding:binary;[R1] [C3] column_is_not_null:false;[R1] [C3] column_value_new:[-1.23456788E+010](16);[R1] [C3] column_value_old:[1.23400002E+001](15);[R1] [C4] column_name:C3;[R1] [C4] column_type:MYSQL_TYPE_NEWDECIMAL;[R1] [C4] column_is_rowkey:false;[R1] [C4] column_is_signed:true;[R1] [C4] column_encoding:binary;[R1] [C4] column_is_not_null:false;[R1] [C4] column_value_new:[-12345678901.23456789](21);[R1] [C4] column_value_old:[12.34](5);[R1] [C5] column_name:C4;[R1] [C5] column_type:MYSQL_TYPE_OB_NUMBER_FLOAT;[R1] [C5] column_is_rowkey:false;[R1] [C5] column_is_signed:true;[R1] [C5] column_encoding:binary;[R1] [C5] column_is_not_null:false;[R1] [C5] column_value_new:[-12350000000](12);[R1] [C5] column_value_old:[12.34](5);[R1] [C6] column_name:C5;[R1] [C6] column_type:MYSQL_TYPE_OB_NUMBER_FLOAT;[R1] [C6] column_is_rowkey:false;[R1] [C6] column_is_signed:true;[R1] [C6] column_encoding:binary;[R1] [C6] column_is_not_null:false;[R1] [C6] column_value_new:[-12345678901.23456789](21);[R1] [C6] column_value_old:[12.34](5);[R1] [C7] column_name:C6;[R1] [C7] column_type:MYSQL_TYPE_VAR_STRING;[R1] [C7] column_is_rowkey:false;[R1] [C7] column_is_signed:true;[R1] [C7] column_encoding:utf8mb4;[R1] [C7] column_is_not_null:false;[R1] [C7] column_value_new:[-12345678901.234567890](22);[R1] [C7] column_value_old:[-12345678901.234567890](22);[R1] [C8] column_name:C7;[R1] [C8] column_type:MYSQL_TYPE_STRING;[R1] [C8] column_is_rowkey:false;[R1] [C8] column_is_signed:true;[R1] [C8] column_encoding:utf8mb4;[R1] [C8] column_is_not_null:false;[R1] [C8] column_value_new:[-12345678901.234567890                                                                              ](100);[R1] [C8] column_value_old:[12.34                                                                                               ](100);$[R2] COMMIT;
update number_1 set c1=c6, c2=c6, c3=c6, c4=c6, c5=c6, c7=c6 where c0 = 150;
select c0, c6, c1, c2, c3, c4, c5, c7 from number_1 where c0 = 150;
C0	C6	C1	C2	C3	C4	C5	C7
150	-1234567890.1234567890	-1.2345678901234567E+009	-1.23456794E+009	-1234567890.123456789	-1235000000	-1234567890.123456789	-1234567890.1234567890                                                                              
ob1.oblog.next;
[R0] BEGIN;[R0] org_cluster_id:1;[R1] record_type:UPDATE;[R1] database_name:oracle.OBLOG_DB;[R1] table_name:NUMBER_1;[R1] log_event:true;[R1] column_count:8;[R1] source_category:SRC_FULL_RECORDED;[R1] source_type:SRC_OCEANBASE_1_0;[R1] has_pk:true;[R1] pk_info:(0);[R1] pks:C0;[R1] has_uk:false;[R1] uk_info:(null);[R1] uks:(null);[R1] [C1] column_name:C0;[R1] [C1] column_type:MYSQL_TYPE_NEWDECIMAL;[R1] [C1] column_is_rowkey:true;[R1] [C1] column_is_signed:true;[R1] [C1] column_encoding:binary;[R1] [C1] column_is_not_null:true;[R1] [C1] column_value_new:[150](3);[R1] [C1] column_value_old:[150](3);[R1] [C2] column_name:C1;[R1] [C2] column_type:MYSQL_TYPE_DOUBLE;[R1] [C2] column_is_rowkey:false;[R1] [C2] column_is_signed:true;[R1] [C2] column_encoding:binary;[R1] [C2] column_is_not_null:false;[R1] [C2] column_value_new:[-1.2345678901234567E+009](24);[R1] [C2] column_value_old:[1.234E+001](10);[R1] [C3] column_name:C2;[R1] [C3] column_type:MYSQL_TYPE_FLOAT;[R1] [C3] column_is_rowkey:false;[R1] [C3] column_is_signed:true;[R1] [C3] column_encoding:binary;[R1] [C3] column_is_not_null:false;[R1] [C3] column_value_new:[-1.23456794E+009](16);[R1] [C3] column_value_old:[1.23400002E+001](15);[R1] [C4] column_name:C3;[R1] [C4] column_type:MYSQL_TYPE_NEWDECIMAL;[R1] [C4] column_is_rowkey:false;[R1] [C4] column_is_signed:true;[R1] [C4] column_encoding:binary;[R1] [C4] column_is_not_null:false;[R1] [C4] column_value_new:[-1234567890.123456789](21);[R1] [C4] column_value_old:[12.34](5);[R1] [C5] column_name:C4;[R1] [C5] column_type:MYSQL_TYPE_OB_NUMBER_FLOAT;[R1] [C5] column_is_rowkey:false;[R1] [C5] column_is_signed:true;[R1] [C5] column_encoding:binary;[R1] [C5] column_is_not_null:false;[R1] [C5] column_value_new:[-1235000000](11);[R1] [C5] column_value_old:[12.34](5);[R1] [C6] column_name:C5;[R1] [C6] column_type:MYSQL_TYPE_OB_NUMBER_FLOAT;[R1] [C6] column_is_rowkey:false;[R1] [C6] column_is_signed:true;[R1] [C6] column_encoding:binary;[R1] [C6] column_is_not_null:false;[R1] [C6] column_value_new:[-1234567890.123456789](21);[R1] [C6] column_value_old:[12.34](5);[R1] [C7] column_name:C6;[R1] [C7] column_type:MYSQL_TYPE_VAR_STRING;[R1] [C7] column_is_rowkey:false;[R1] [C7] column_is_signed:true;[R1] [C7] column_encoding:utf8mb4;[R1] [C7] column_is_not_null:false;[R1] [C7] column_value_new:[-1234567890.1234567890](22);[R1] [C7] column_value_old:[-1234567890.1234567890](22);[R1] [C8] column_name:C7;[R1] [C8] column_type:MYSQL_TYPE_STRING;[R1] [C8] column_is_rowkey:false;[R1] [C8] column_is_signed:true;[R1] [C8] column_encoding:utf8mb4;[R1] [C8] column_is_not_null:false;[R1] [C8] column_value_new:[-1234567890.1234567890                                                                              ](100);[R1] [C8] column_value_old:[12.34                                                                                               ](100);$[R2] COMMIT;
update number_1 set c1=c6, c2=c6, c3=c6, c4=c6, c5=c6, c7=c6 where c0 = 151;
select c0, c6, c1, c2, c3, c4, c5, c7 from number_1 where c0 = 151;
C0	C6	C1	C2	C3	C4	C5	C7
151	-123456789.01234567890	-1.2345678901234567E+008	-1.23456792E+008	-123456789.0123456789	-123500000	-123456789.0123456789	-123456789.01234567890                                                                              
ob1.oblog.next;
[R0] BEGIN;[R0] org_cluster_id:1;[R1] record_type:UPDATE;[R1] database_name:oracle.OBLOG_DB;[R1] table_name:NUMBER_1;[R1] log_event:true;[R1] column_count:8;[R1] source_category:SRC_FULL_RECORDED;[R1] source_type:SRC_OCEANBASE_1_0;[R1] has_pk:true;[R1] pk_info:(0);[R1] pks:C0;[R1] has_uk:false;[R1] uk_info:(null);[R1] uks:(null);[R1] [C1] column_name:C0;[R1] [C1] column_type:MYSQL_TYPE_NEWDECIMAL;[R1] [C1] column_is_rowkey:true;[R1] [C1] column_is_signed:true;[R1] [C1] column_encoding:binary;[R1] [C1] column_is_not_null:true;[R1] [C1] column_value_new:[151](3);[R1] [C1] column_value_old:[151](3);[R1] [C2] column_name:C1;[R1] [C2] column_type:MYSQL_TYPE_DOUBLE;[R1] [C2] column_is_rowkey:false;[R1] [C2] column_is_signed:true;[R1] [C2] column_encoding:binary;[R1] [C2] column_is_not_null:false;[R1] [C2] column_value_new:[-1.2345678901234567E+008](24);[R1] [C2] column_value_old:[1.234E+001](10);[R1] [C3] column_name:C2;[R1] [C3] column_type:MYSQL_TYPE_FLOAT;[R1] [C3] column_is_rowkey:false;[R1] [C3] column_is_signed:true;[R1] [C3] column_encoding:binary;[R1] [C3] column_is_not_null:false;[R1] [C3] column_value_new:[-1.23456792E+008](16);[R1] [C3] column_value_old:[1.23400002E+001](15);[R1] [C4] column_name:C3;[R1] [C4] column_type:MYSQL_TYPE_NEWDECIMAL;[R1] [C4] column_is_rowkey:false;[R1] [C4] column_is_signed:true;[R1] [C4] column_encoding:binary;[R1] [C4] column_is_not_null:false;[R1] [C4] column_value_new:[-123456789.0123456789](21);[R1] [C4] column_value_old:[12.34](5);[R1] [C5] column_name:C4;[R1] [C5] column_type:MYSQL_TYPE_OB_NUMBER_FLOAT;[R1] [C5] column_is_rowkey:false;[R1] [C5] column_is_signed:true;[R1] [C5] column_encoding:binary;[R1] [C5] column_is_not_null:false;[R1] [C5] column_value_new:[-123500000](10);[R1] [C5] column_value_old:[12.34](5);[R1] [C6] column_name:C5;[R1] [C6] column_type:MYSQL_TYPE_OB_NUMBER_FLOAT;[R1] [C6] column_is_rowkey:false;[R1] [C6] column_is_signed:true;[R1] [C6] column_encoding:binary;[R1] [C6] column_is_not_null:false;[R1] [C6] column_value_new:[-123456789.0123456789](21);[R1] [C6] column_value_old:[12.34](5);[R1] [C7] column_name:C6;[R1] [C7] column_type:MYSQL_TYPE_VAR_STRING;[R1] [C7] column_is_rowkey:false;[R1] [C7] column_is_signed:true;[R1] [C7] column_encoding:utf8mb4;[R1] [C7] column_is_not_null:false;[R1] [C7] column_value_new:[-123456789.01234567890](22);[R1] [C7] column_value_old:[-123456789.01234567890](22);[R1] [C8] column_name:C7;[R1] [C8] column_type:MYSQL_TYPE_STRING;[R1] [C8] column_is_rowkey:false;[R1] [C8] column_is_signed:true;[R1] [C8] column_encoding:utf8mb4;[R1] [C8] column_is_not_null:false;[R1] [C8] column_value_new:[-123456789.01234567890                                                                              ](100);[R1] [C8] column_value_old:[12.34                                                                                               ](100);$[R2] COMMIT;
update number_1 set c1=c6, c2=c6, c3=c6, c4=c6, c5=c6, c7=c6 where c0 = 152;
select c0, c6, c1, c2, c3, c4, c5, c7 from number_1 where c0 = 152;
C0	C6	C1	C2	C3	C4	C5	C7
152	-12345678.901234567890	-1.2345678901234567E+007	-1.2345679E+007	-12345678.90123456789	-12350000	-12345678.90123456789	-12345678.901234567890                                                                              
ob1.oblog.next;
[R0] BEGIN;[R0] org_cluster_id:1;[R1] record_type:UPDATE;[R1] database_name:oracle.OBLOG_DB;[R1] table_name:NUMBER_1;[R1] log_event:true;[R1] column_count:8;[R1] source_category:SRC_FULL_RECORDED;[R1] source_type:SRC_OCEANBASE_1_0;[R1] has_pk:true;[R1] pk_info:(0);[R1] pks:C0;[R1] has_uk:false;[R1] uk_info:(null);[R1] uks:(null);[R1] [C1] column_name:C0;[R1] [C1] column_type:MYSQL_TYPE_NEWDECIMAL;[R1] [C1] column_is_rowkey:true;[R1] [C1] column_is_signed:true;[R1] [C1] column_encoding:binary;[R1] [C1] column_is_not_null:true;[R1] [C1] column_value_new:[152](3);[R1] [C1] column_value_old:[152](3);[R1] [C2] column_name:C1;[R1] [C2] column_type:MYSQL_TYPE_DOUBLE;[R1] [C2] column_is_rowkey:false;[R1] [C2] column_is_signed:true;[R1] [C2] column_encoding:binary;[R1] [C2] column_is_not_null:false;[R1] [C2] column_value_new:[-1.2345678901234567E+007](24);[R1] [C2] column_value_old:[1.234E+001](10);[R1] [C3] column_name:C2;[R1] [C3] column_type:MYSQL_TYPE_FLOAT;[R1] [C3] column_is_rowkey:false;[R1] [C3] column_is_signed:true;[R1] [C3] column_encoding:binary;[R1] [C3] column_is_not_null:false;[R1] [C3] column_value_new:[-1.2345679E+007](15);[R1] [C3] column_value_old:[1.23400002E+001](15);[R1] [C4] column_name:C3;[R1] [C4] column_type:MYSQL_TYPE_NEWDECIMAL;[R1] [C4] column_is_rowkey:false;[R1] [C4] column_is_signed:true;[R1] [C4] column_encoding:binary;[R1] [C4] column_is_not_null:false;[R1] [C4] column_value_new:[-12345678.90123456789](21);[R1] [C4] column_value_old:[12.34](5);[R1] [C5] column_name:C4;[R1] [C5] column_type:MYSQL_TYPE_OB_NUMBER_FLOAT;[R1] [C5] column_is_rowkey:false;[R1] [C5] column_is_signed:true;[R1] [C5] column_encoding:binary;[R1] [C5] column_is_not_null:false;[R1] [C5] column_value_new:[-12350000](9);[R1] [C5] column_value_old:[12.34](5);[R1] [C6] column_name:C5;[R1] [C6] column_type:MYSQL_TYPE_OB_NUMBER_FLOAT;[R1] [C6] column_is_rowkey:false;[R1] [C6] column_is_signed:true;[R1] [C6] column_encoding:binary;[R1] [C6] column_is_not_null:false;[R1] [C6] column_value_new:[-12345678.90123456789](21);[R1] [C6] column_value_old:[12.34](5);[R1] [C7] column_name:C6;[R1] [C7] column_type:MYSQL_TYPE_VAR_STRING;[R1] [C7] column_is_rowkey:false;[R1] [C7] column_is_signed:true;[R1] [C7] column_encoding:utf8mb4;[R1] [C7] column_is_not_null:false;[R1] [C7] column_value_new:[-12345678.901234567890](22);[R1] [C7] column_value_old:[-12345678.901234567890](22);[R1] [C8] column_name:C7;[R1] [C8] column_type:MYSQL_TYPE_STRING;[R1] [C8] column_is_rowkey:false;[R1] [C8] column_is_signed:true;[R1] [C8] column_encoding:utf8mb4;[R1] [C8] column_is_not_null:false;[R1] [C8] column_value_new:[-12345678.901234567890                                                                              ](100);[R1] [C8] column_value_old:[12.34                                                                                               ](100);$[R2] COMMIT;
update number_1 set c1=c6, c2=c6, c3=c6, c4=c6, c5=c6, c7=c6 where c0 = 153;
select c0, c6, c1, c2, c3, c4, c5, c7 from number_1 where c0 = 153;
C0	C6	C1	C2	C3	C4	C5	C7
153	-1234567.8901234567890	-1.2345678901234567E+006	-1.23456788E+006	-1234567.890123456789	-1235000	-1234567.890123456789	-1234567.8901234567890                                                                              
ob1.oblog.next;
[R0] BEGIN;[R0] org_cluster_id:1;[R1] record_type:UPDATE;[R1] database_name:oracle.OBLOG_DB;[R1] table_name:NUMBER_1;[R1] log_event:true;[R1] column_count:8;[R1] source_category:SRC_FULL_RECORDED;[R1] source_type:SRC_OCEANBASE_1_0;[R1] has_pk:true;[R1] pk_info:(0);[R1] pks:C0;[R1] has_uk:false;[R1] uk_info:(null);[R1] uks:(null);[R1] [C1] column_name:C0;[R1] [C1] column_type:MYSQL_TYPE_NEWDECIMAL;[R1] [C1] column_is_rowkey:true;[R1] [C1] column_is_signed:true;[R1] [C1] column_encoding:binary;[R1] [C1] column_is_not_null:true;[R1] [C1] column_value_new:[153](3);[R1] [C1] column_value_old:[153](3);[R1] [C2] column_name:C1;[R1] [C2] column_type:MYSQL_TYPE_DOUBLE;[R1] [C2] column_is_rowkey:false;[R1] [C2] column_is_signed:true;[R1] [C2] column_encoding:binary;[R1] [C2] column_is_not_null:false;[R1] [C2] column_value_new:[-1.2345678901234567E+006](24);[R1] [C2] column_value_old:[1.234E+001](10);[R1] [C3] column_name:C2;[R1] [C3] column_type:MYSQL_TYPE_FLOAT;[R1] [C3] column_is_rowkey:false;[R1] [C3] column_is_signed:true;[R1] [C3] column_encoding:binary;[R1] [C3] column_is_not_null:false;[R1] [C3] column_value_new:[-1.23456788E+006](16);[R1] [C3] column_value_old:[1.23400002E+001](15);[R1] [C4] column_name:C3;[R1] [C4] column_type:MYSQL_TYPE_NEWDECIMAL;[R1] [C4] column_is_rowkey:false;[R1] [C4] column_is_signed:true;[R1] [C4] column_encoding:binary;[R1] [C4] column_is_not_null:false;[R1] [C4] column_value_new:[-1234567.890123456789](21);[R1] [C4] column_value_old:[12.34](5);[R1] [C5] column_name:C4;[R1] [C5] column_type:MYSQL_TYPE_OB_NUMBER_FLOAT;[R1] [C5] column_is_rowkey:false;[R1] [C5] column_is_signed:true;[R1] [C5] column_encoding:binary;[R1] [C5] column_is_not_null:false;[R1] [C5] column_value_new:[-1235000](8);[R1] [C5] column_value_old:[12.34](5);[R1] [C6] column_name:C5;[R1] [C6] column_type:MYSQL_TYPE_OB_NUMBER_FLOAT;[R1] [C6] column_is_rowkey:false;[R1] [C6] column_is_signed:true;[R1] [C6] column_encoding:binary;[R1] [C6] column_is_not_null:false;[R1] [C6] column_value_new:[-1234567.890123456789](21);[R1] [C6] column_value_old:[12.34](5);[R1] [C7] column_name:C6;[R1] [C7] column_type:MYSQL_TYPE_VAR_STRING;[R1] [C7] column_is_rowkey:false;[R1] [C7] column_is_signed:true;[R1] [C7] column_encoding:utf8mb4;[R1] [C7] column_is_not_null:false;[R1] [C7] column_value_new:[-1234567.8901234567890](22);[R1] [C7] column_value_old:[-1234567.8901234567890](22);[R1] [C8] column_name:C7;[R1] [C8] column_type:MYSQL_TYPE_STRING;[R1] [C8] column_is_rowkey:false;[R1] [C8] column_is_signed:true;[R1] [C8] column_encoding:utf8mb4;[R1] [C8] column_is_not_null:false;[R1] [C8] column_value_new:[-1234567.8901234567890                                                                              ](100);[R1] [C8] column_value_old:[12.34                                                                                               ](100);$[R2] COMMIT;
update number_1 set c1=c6, c2=c6, c3=c6, c4=c6, c5=c6, c7=c6 where c0 = 154;
select c0, c6, c1, c2, c3, c4, c5, c7 from number_1 where c0 = 154;
C0	C6	C1	C2	C3	C4	C5	C7
154	-123456.78901234567890	-1.2345678901234567E+005	-1.23456789E+005	-123456.7890123456789	-123500	-123456.7890123456789	-123456.78901234567890                                                                              
ob1.oblog.next;
[R0] BEGIN;[R0] org_cluster_id:1;[R1] record_type:UPDATE;[R1] database_name:oracle.OBLOG_DB;[R1] table_name:NUMBER_1;[R1] log_event:true;[R1] column_count:8;[R1] source_category:SRC_FULL_RECORDED;[R1] source_type:SRC_OCEANBASE_1_0;[R1] has_pk:true;[R1] pk_info:(0);[R1] pks:C0;[R1] has_uk:false;[R1] uk_info:(null);[R1] uks:(null);[R1] [C1] column_name:C0;[R1] [C1] column_type:MYSQL_TYPE_NEWDECIMAL;[R1] [C1] column_is_rowkey:true;[R1] [C1] column_is_signed:true;[R1] [C1] column_encoding:binary;[R1] [C1] column_is_not_null:true;[R1] [C1] column_value_new:[154](3);[R1] [C1] column_value_old:[154](3);[R1] [C2] column_name:C1;[R1] [C2] column_type:MYSQL_TYPE_DOUBLE;[R1] [C2] column_is_rowkey:false;[R1] [C2] column_is_signed:true;[R1] [C2] column_encoding:binary;[R1] [C2] column_is_not_null:false;[R1] [C2] column_value_new:[-1.2345678901234567E+005](24);[R1] [C2] column_value_old:[1.234E+001](10);[R1] [C3] column_name:C2;[R1] [C3] column_type:MYSQL_TYPE_FLOAT;[R1] [C3] column_is_rowkey:false;[R1] [C3] column_is_signed:true;[R1] [C3] column_encoding:binary;[R1] [C3] column_is_not_null:false;[R1] [C3] column_value_new:[-1.23456789E+005](16);[R1] [C3] column_value_old:[1.23400002E+001](15);[R1] [C4] column_name:C3;[R1] [C4] column_type:MYSQL_TYPE_NEWDECIMAL;[R1] [C4] column_is_rowkey:false;[R1] [C4] column_is_signed:true;[R1] [C4] column_encoding:binary;[R1] [C4] column_is_not_null:false;[R1] [C4] column_value_new:[-123456.7890123456789](21);[R1] [C4] column_value_old:[12.34](5);[R1] [C5] column_name:C4;[R1] [C5] column_type:MYSQL_TYPE_OB_NUMBER_FLOAT;[R1] [C5] column_is_rowkey:false;[R1] [C5] column_is_signed:true;[R1] [C5] column_encoding:binary;[R1] [C5] column_is_not_null:false;[R1] [C5] column_value_new:[-123500](7);[R1] [C5] column_value_old:[12.34](5);[R1] [C6] column_name:C5;[R1] [C6] column_type:MYSQL_TYPE_OB_NUMBER_FLOAT;[R1] [C6] column_is_rowkey:false;[R1] [C6] column_is_signed:true;[R1] [C6] column_encoding:binary;[R1] [C6] column_is_not_null:false;[R1] [C6] column_value_new:[-123456.7890123456789](21);[R1] [C6] column_value_old:[12.34](5);[R1] [C7] column_name:C6;[R1] [C7] column_type:MYSQL_TYPE_VAR_STRING;[R1] [C7] column_is_rowkey:false;[R1] [C7] column_is_signed:true;[R1] [C7] column_encoding:utf8mb4;[R1] [C7] column_is_not_null:false;[R1] [C7] column_value_new:[-123456.78901234567890](22);[R1] [C7] column_value_old:[-123456.78901234567890](22);[R1] [C8] column_name:C7;[R1] [C8] column_type:MYSQL_TYPE_STRING;[R1] [C8] column_is_rowkey:false;[R1] [C8] column_is_signed:true;[R1] [C8] column_encoding:utf8mb4;[R1] [C8] column_is_not_null:false;[R1] [C8] column_value_new:[-123456.78901234567890                                                                              ](100);[R1] [C8] column_value_old:[12.34                                                                                               ](100);$[R2] COMMIT;
update number_1 set c1=c6, c2=c6, c3=c6, c4=c6, c5=c6, c7=c6 where c0 = 155;
select c0, c6, c1, c2, c3, c4, c5, c7 from number_1 where c0 = 155;
C0	C6	C1	C2	C3	C4	C5	C7
155	-12345.678901234567890	-1.2345678901234567E+004	-1.23456787E+004	-12345.67890123456789	-12350	-12345.67890123456789	-12345.678901234567890                                                                              
ob1.oblog.next;
[R0] BEGIN;[R0] org_cluster_id:1;[R1] record_type:UPDATE;[R1] database_name:oracle.OBLOG_DB;[R1] table_name:NUMBER_1;[R1] log_event:true;[R1] column_count:8;[R1] source_category:SRC_FULL_RECORDED;[R1] source_type:SRC_OCEANBASE_1_0;[R1] has_pk:true;[R1] pk_info:(0);[R1] pks:C0;[R1] has_uk:false;[R1] uk_info:(null);[R1] uks:(null);[R1] [C1] column_name:C0;[R1] [C1] column_type:MYSQL_TYPE_NEWDECIMAL;[R1] [C1] column_is_rowkey:true;[R1] [C1] column_is_signed:true;[R1] [C1] column_encoding:binary;[R1] [C1] column_is_not_null:true;[R1] [C1] column_value_new:[155](3);[R1] [C1] column_value_old:[155](3);[R1] [C2] column_name:C1;[R1] [C2] column_type:MYSQL_TYPE_DOUBLE;[R1] [C2] column_is_rowkey:false;[R1] [C2] column_is_signed:true;[R1] [C2] column_encoding:binary;[R1] [C2] column_is_not_null:false;[R1] [C2] column_value_new:[-1.2345678901234567E+004](24);[R1] [C2] column_value_old:[1.234E+001](10);[R1] [C3] column_name:C2;[R1] [C3] column_type:MYSQL_TYPE_FLOAT;[R1] [C3] column_is_rowkey:false;[R1] [C3] column_is_signed:true;[R1] [C3] column_encoding:binary;[R1] [C3] column_is_not_null:false;[R1] [C3] column_value_new:[-1.23456787E+004](16);[R1] [C3] column_value_old:[1.23400002E+001](15);[R1] [C4] column_name:C3;[R1] [C4] column_type:MYSQL_TYPE_NEWDECIMAL;[R1] [C4] column_is_rowkey:false;[R1] [C4] column_is_signed:true;[R1] [C4] column_encoding:binary;[R1] [C4] column_is_not_null:false;[R1] [C4] column_value_new:[-12345.67890123456789](21);[R1] [C4] column_value_old:[12.34](5);[R1] [C5] column_name:C4;[R1] [C5] column_type:MYSQL_TYPE_OB_NUMBER_FLOAT;[R1] [C5] column_is_rowkey:false;[R1] [C5] column_is_signed:true;[R1] [C5] column_encoding:binary;[R1] [C5] column_is_not_null:false;[R1] [C5] column_value_new:[-12350](6);[R1] [C5] column_value_old:[12.34](5);[R1] [C6] column_name:C5;[R1] [C6] column_type:MYSQL_TYPE_OB_NUMBER_FLOAT;[R1] [C6] column_is_rowkey:false;[R1] [C6] column_is_signed:true;[R1] [C6] column_encoding:binary;[R1] [C6] column_is_not_null:false;[R1] [C6] column_value_new:[-12345.67890123456789](21);[R1] [C6] column_value_old:[12.34](5);[R1] [C7] column_name:C6;[R1] [C7] column_type:MYSQL_TYPE_VAR_STRING;[R1] [C7] column_is_rowkey:false;[R1] [C7] column_is_signed:true;[R1] [C7] column_encoding:utf8mb4;[R1] [C7] column_is_not_null:false;[R1] [C7] column_value_new:[-12345.678901234567890](22);[R1] [C7] column_value_old:[-12345.678901234567890](22);[R1] [C8] column_name:C7;[R1] [C8] column_type:MYSQL_TYPE_STRING;[R1] [C8] column_is_rowkey:false;[R1] [C8] column_is_signed:true;[R1] [C8] column_encoding:utf8mb4;[R1] [C8] column_is_not_null:false;[R1] [C8] column_value_new:[-12345.678901234567890                                                                              ](100);[R1] [C8] column_value_old:[12.34                                                                                               ](100);$[R2] COMMIT;
update number_1 set c1=c6, c2=c6, c3=c6, c4=c6, c5=c6, c7=c6 where c0 = 156;
select c0, c6, c1, c2, c3, c4, c5, c7 from number_1 where c0 = 156;
C0	C6	C1	C2	C3	C4	C5	C7
156	-1234.5678901234567890	-1.2345678901234569E+003	-1.23456787E+003	-1234.567890123456789	-1235	-1234.567890123456789	-1234.5678901234567890                                                                              
ob1.oblog.next;
[R0] BEGIN;[R0] org_cluster_id:1;[R1] record_type:UPDATE;[R1] database_name:oracle.OBLOG_DB;[R1] table_name:NUMBER_1;[R1] log_event:true;[R1] column_count:8;[R1] source_category:SRC_FULL_RECORDED;[R1] source_type:SRC_OCEANBASE_1_0;[R1] has_pk:true;[R1] pk_info:(0);[R1] pks:C0;[R1] has_uk:false;[R1] uk_info:(null);[R1] uks:(null);[R1] [C1] column_name:C0;[R1] [C1] column_type:MYSQL_TYPE_NEWDECIMAL;[R1] [C1] column_is_rowkey:true;[R1] [C1] column_is_signed:true;[R1] [C1] column_encoding:binary;[R1] [C1] column_is_not_null:true;[R1] [C1] column_value_new:[156](3);[R1] [C1] column_value_old:[156](3);[R1] [C2] column_name:C1;[R1] [C2] column_type:MYSQL_TYPE_DOUBLE;[R1] [C2] column_is_rowkey:false;[R1] [C2] column_is_signed:true;[R1] [C2] column_encoding:binary;[R1] [C2] column_is_not_null:false;[R1] [C2] column_value_new:[-1.2345678901234569E+003](24);[R1] [C2] column_value_old:[1.234E+001](10);[R1] [C3] column_name:C2;[R1] [C3] column_type:MYSQL_TYPE_FLOAT;[R1] [C3] column_is_rowkey:false;[R1] [C3] column_is_signed:true;[R1] [C3] column_encoding:binary;[R1] [C3] column_is_not_null:false;[R1] [C3] column_value_new:[-1.23456787E+003](16);[R1] [C3] column_value_old:[1.23400002E+001](15);[R1] [C4] column_name:C3;[R1] [C4] column_type:MYSQL_TYPE_NEWDECIMAL;[R1] [C4] column_is_rowkey:false;[R1] [C4] column_is_signed:true;[R1] [C4] column_encoding:binary;[R1] [C4] column_is_not_null:false;[R1] [C4] column_value_new:[-1234.567890123456789](21);[R1] [C4] column_value_old:[12.34](5);[R1] [C5] column_name:C4;[R1] [C5] column_type:MYSQL_TYPE_OB_NUMBER_FLOAT;[R1] [C5] column_is_rowkey:false;[R1] [C5] column_is_signed:true;[R1] [C5] column_encoding:binary;[R1] [C5] column_is_not_null:false;[R1] [C5] column_value_new:[-1235](5);[R1] [C5] column_value_old:[12.34](5);[R1] [C6] column_name:C5;[R1] [C6] column_type:MYSQL_TYPE_OB_NUMBER_FLOAT;[R1] [C6] column_is_rowkey:false;[R1] [C6] column_is_signed:true;[R1] [C6] column_encoding:binary;[R1] [C6] column_is_not_null:false;[R1] [C6] column_value_new:[-1234.567890123456789](21);[R1] [C6] column_value_old:[12.34](5);[R1] [C7] column_name:C6;[R1] [C7] column_type:MYSQL_TYPE_VAR_STRING;[R1] [C7] column_is_rowkey:false;[R1] [C7] column_is_signed:true;[R1] [C7] column_encoding:utf8mb4;[R1] [C7] column_is_not_null:false;[R1] [C7] column_value_new:[-1234.5678901234567890](22);[R1] [C7] column_value_old:[-1234.5678901234567890](22);[R1] [C8] column_name:C7;[R1] [C8] column_type:MYSQL_TYPE_STRING;[R1] [C8] column_is_rowkey:false;[R1] [C8] column_is_signed:true;[R1] [C8] column_encoding:utf8mb4;[R1] [C8] column_is_not_null:false;[R1] [C8] column_value_new:[-1234.5678901234567890                                                                              ](100);[R1] [C8] column_value_old:[12.34                                                                                               ](100);$[R2] COMMIT;
update number_1 set c1=c6, c2=c6, c3=c6, c4=c6, c5=c6, c7=c6 where c0 = 157;
select c0, c6, c1, c2, c3, c4, c5, c7 from number_1 where c0 = 157;
C0	C6	C1	C2	C3	C4	C5	C7
157	-123.45678901234567890	-1.2345678901234568E+002	-1.23456787E+002	-123.4567890123456789	-123.5	-123.4567890123456789	-123.45678901234567890                                                                              
ob1.oblog.next;
[R0] BEGIN;[R0] org_cluster_id:1;[R1] record_type:UPDATE;[R1] database_name:oracle.OBLOG_DB;[R1] table_name:NUMBER_1;[R1] log_event:true;[R1] column_count:8;[R1] source_category:SRC_FULL_RECORDED;[R1] source_type:SRC_OCEANBASE_1_0;[R1] has_pk:true;[R1] pk_info:(0);[R1] pks:C0;[R1] has_uk:false;[R1] uk_info:(null);[R1] uks:(null);[R1] [C1] column_name:C0;[R1] [C1] column_type:MYSQL_TYPE_NEWDECIMAL;[R1] [C1] column_is_rowkey:true;[R1] [C1] column_is_signed:true;[R1] [C1] column_encoding:binary;[R1] [C1] column_is_not_null:true;[R1] [C1] column_value_new:[157](3);[R1] [C1] column_value_old:[157](3);[R1] [C2] column_name:C1;[R1] [C2] column_type:MYSQL_TYPE_DOUBLE;[R1] [C2] column_is_rowkey:false;[R1] [C2] column_is_signed:true;[R1] [C2] column_encoding:binary;[R1] [C2] column_is_not_null:false;[R1] [C2] column_value_new:[-1.2345678901234568E+002](24);[R1] [C2] column_value_old:[1.234E+001](10);[R1] [C3] column_name:C2;[R1] [C3] column_type:MYSQL_TYPE_FLOAT;[R1] [C3] column_is_rowkey:false;[R1] [C3] column_is_signed:true;[R1] [C3] column_encoding:binary;[R1] [C3] column_is_not_null:false;[R1] [C3] column_value_new:[-1.23456787E+002](16);[R1] [C3] column_value_old:[1.23400002E+001](15);[R1] [C4] column_name:C3;[R1] [C4] column_type:MYSQL_TYPE_NEWDECIMAL;[R1] [C4] column_is_rowkey:false;[R1] [C4] column_is_signed:true;[R1] [C4] column_encoding:binary;[R1] [C4] column_is_not_null:false;[R1] [C4] column_value_new:[-123.4567890123456789](21);[R1] [C4] column_value_old:[12.34](5);[R1] [C5] column_name:C4;[R1] [C5] column_type:MYSQL_TYPE_OB_NUMBER_FLOAT;[R1] [C5] column_is_rowkey:false;[R1] [C5] column_is_signed:true;[R1] [C5] column_encoding:binary;[R1] [C5] column_is_not_null:false;[R1] [C5] column_value_new:[-123.5](6);[R1] [C5] column_value_old:[12.34](5);[R1] [C6] column_name:C5;[R1] [C6] column_type:MYSQL_TYPE_OB_NUMBER_FLOAT;[R1] [C6] column_is_rowkey:false;[R1] [C6] column_is_signed:true;[R1] [C6] column_encoding:binary;[R1] [C6] column_is_not_null:false;[R1] [C6] column_value_new:[-123.4567890123456789](21);[R1] [C6] column_value_old:[12.34](5);[R1] [C7] column_name:C6;[R1] [C7] column_type:MYSQL_TYPE_VAR_STRING;[R1] [C7] column_is_rowkey:false;[R1] [C7] column_is_signed:true;[R1] [C7] column_encoding:utf8mb4;[R1] [C7] column_is_not_null:false;[R1] [C7] column_value_new:[-123.45678901234567890](22);[R1] [C7] column_value_old:[-123.45678901234567890](22);[R1] [C8] column_name:C7;[R1] [C8] column_type:MYSQL_TYPE_STRING;[R1] [C8] column_is_rowkey:false;[R1] [C8] column_is_signed:true;[R1] [C8] column_encoding:utf8mb4;[R1] [C8] column_is_not_null:false;[R1] [C8] column_value_new:[-123.45678901234567890                                                                              ](100);[R1] [C8] column_value_old:[12.34                                                                                               ](100);$[R2] COMMIT;
update number_1 set c1=c6, c2=c6, c3=c6, c4=c6, c5=c6, c7=c6 where c0 = 158;
select c0, c6, c1, c2, c3, c4, c5, c7 from number_1 where c0 = 158;
C0	C6	C1	C2	C3	C4	C5	C7
158	-12.345678901234567890	-1.2345678901234567E+001	-1.23456793E+001	-12.34567890123456789	-12.35	-12.34567890123456789	-12.345678901234567890                                                                              
ob1.oblog.next;
[R0] BEGIN;[R0] org_cluster_id:1;[R1] record_type:UPDATE;[R1] database_name:oracle.OBLOG_DB;[R1] table_name:NUMBER_1;[R1] log_event:true;[R1] column_count:8;[R1] source_category:SRC_FULL_RECORDED;[R1] source_type:SRC_OCEANBASE_1_0;[R1] has_pk:true;[R1] pk_info:(0);[R1] pks:C0;[R1] has_uk:false;[R1] uk_info:(null);[R1] uks:(null);[R1] [C1] column_name:C0;[R1] [C1] column_type:MYSQL_TYPE_NEWDECIMAL;[R1] [C1] column_is_rowkey:true;[R1] [C1] column_is_signed:true;[R1] [C1] column_encoding:binary;[R1] [C1] column_is_not_null:true;[R1] [C1] column_value_new:[158](3);[R1] [C1] column_value_old:[158](3);[R1] [C2] column_name:C1;[R1] [C2] column_type:MYSQL_TYPE_DOUBLE;[R1] [C2] column_is_rowkey:false;[R1] [C2] column_is_signed:true;[R1] [C2] column_encoding:binary;[R1] [C2] column_is_not_null:false;[R1] [C2] column_value_new:[-1.2345678901234567E+001](24);[R1] [C2] column_value_old:[1.234E+001](10);[R1] [C3] column_name:C2;[R1] [C3] column_type:MYSQL_TYPE_FLOAT;[R1] [C3] column_is_rowkey:false;[R1] [C3] column_is_signed:true;[R1] [C3] column_encoding:binary;[R1] [C3] column_is_not_null:false;[R1] [C3] column_value_new:[-1.23456793E+001](16);[R1] [C3] column_value_old:[1.23400002E+001](15);[R1] [C4] column_name:C3;[R1] [C4] column_type:MYSQL_TYPE_NEWDECIMAL;[R1] [C4] column_is_rowkey:false;[R1] [C4] column_is_signed:true;[R1] [C4] column_encoding:binary;[R1] [C4] column_is_not_null:false;[R1] [C4] column_value_new:[-12.34567890123456789](21);[R1] [C4] column_value_old:[12.34](5);[R1] [C5] column_name:C4;[R1] [C5] column_type:MYSQL_TYPE_OB_NUMBER_FLOAT;[R1] [C5] column_is_rowkey:false;[R1] [C5] column_is_signed:true;[R1] [C5] column_encoding:binary;[R1] [C5] column_is_not_null:false;[R1] [C5] column_value_new:[-12.35](6);[R1] [C5] column_value_old:[12.34](5);[R1] [C6] column_name:C5;[R1] [C6] column_type:MYSQL_TYPE_OB_NUMBER_FLOAT;[R1] [C6] column_is_rowkey:false;[R1] [C6] column_is_signed:true;[R1] [C6] column_encoding:binary;[R1] [C6] column_is_not_null:false;[R1] [C6] column_value_new:[-12.34567890123456789](21);[R1] [C6] column_value_old:[12.34](5);[R1] [C7] column_name:C6;[R1] [C7] column_type:MYSQL_TYPE_VAR_STRING;[R1] [C7] column_is_rowkey:false;[R1] [C7] column_is_signed:true;[R1] [C7] column_encoding:utf8mb4;[R1] [C7] column_is_not_null:false;[R1] [C7] column_value_new:[-12.345678901234567890](22);[R1] [C7] column_value_old:[-12.345678901234567890](22);[R1] [C8] column_name:C7;[R1] [C8] column_type:MYSQL_TYPE_STRING;[R1] [C8] column_is_rowkey:false;[R1] [C8] column_is_signed:true;[R1] [C8] column_encoding:utf8mb4;[R1] [C8] column_is_not_null:false;[R1] [C8] column_value_new:[-12.345678901234567890                                                                              ](100);[R1] [C8] column_value_old:[12.34                                                                                               ](100);$[R2] COMMIT;
update number_1 set c1=c6, c2=c6, c3=c6, c4=c6, c5=c6, c7=c6 where c0 = 159;
select c0, c6, c1, c2, c3, c4, c5, c7 from number_1 where c0 = 159;
C0	C6	C1	C2	C3	C4	C5	C7
159	-1.2345678901234567890	-1.2345678901234567E+000	-1.23456788E+000	-1.234567890123456789	-1.235	-1.234567890123456789	-1.2345678901234567890                                                                              
ob1.oblog.next;
[R0] BEGIN;[R0] org_cluster_id:1;[R1] record_type:UPDATE;[R1] database_name:oracle.OBLOG_DB;[R1] table_name:NUMBER_1;[R1] log_event:true;[R1] column_count:8;[R1] source_category:SRC_FULL_RECORDED;[R1] source_type:SRC_OCEANBASE_1_0;[R1] has_pk:true;[R1] pk_info:(0);[R1] pks:C0;[R1] has_uk:false;[R1] uk_info:(null);[R1] uks:(null);[R1] [C1] column_name:C0;[R1] [C1] column_type:MYSQL_TYPE_NEWDECIMAL;[R1] [C1] column_is_rowkey:true;[R1] [C1] column_is_signed:true;[R1] [C1] column_encoding:binary;[R1] [C1] column_is_not_null:true;[R1] [C1] column_value_new:[159](3);[R1] [C1] column_value_old:[159](3);[R1] [C2] column_name:C1;[R1] [C2] column_type:MYSQL_TYPE_DOUBLE;[R1] [C2] column_is_rowkey:false;[R1] [C2] column_is_signed:true;[R1] [C2] column_encoding:binary;[R1] [C2] column_is_not_null:false;[R1] [C2] column_value_new:[-1.2345678901234567E+000](24);[R1] [C2] column_value_old:[1.234E+001](10);[R1] [C3] column_name:C2;[R1] [C3] column_type:MYSQL_TYPE_FLOAT;[R1] [C3] column_is_rowkey:false;[R1] [C3] column_is_signed:true;[R1] [C3] column_encoding:binary;[R1] [C3] column_is_not_null:false;[R1] [C3] column_value_new:[-1.23456788E+000](16);[R1] [C3] column_value_old:[1.23400002E+001](15);[R1] [C4] column_name:C3;[R1] [C4] column_type:MYSQL_TYPE_NEWDECIMAL;[R1] [C4] column_is_rowkey:false;[R1] [C4] column_is_signed:true;[R1] [C4] column_encoding:binary;[R1] [C4] column_is_not_null:false;[R1] [C4] column_value_new:[-1.234567890123456789](21);[R1] [C4] column_value_old:[12.34](5);[R1] [C5] column_name:C4;[R1] [C5] column_type:MYSQL_TYPE_OB_NUMBER_FLOAT;[R1] [C5] column_is_rowkey:false;[R1] [C5] column_is_signed:true;[R1] [C5] column_encoding:binary;[R1] [C5] column_is_not_null:false;[R1] [C5] column_value_new:[-1.235](6);[R1] [C5] column_value_old:[12.34](5);[R1] [C6] column_name:C5;[R1] [C6] column_type:MYSQL_TYPE_OB_NUMBER_FLOAT;[R1] [C6] column_is_rowkey:false;[R1] [C6] column_is_signed:true;[R1] [C6] column_encoding:binary;[R1] [C6] column_is_not_null:false;[R1] [C6] column_value_new:[-1.234567890123456789](21);[R1] [C6] column_value_old:[12.34](5);[R1] [C7] column_name:C6;[R1] [C7] column_type:MYSQL_TYPE_VAR_STRING;[R1] [C7] column_is_rowkey:false;[R1] [C7] column_is_signed:true;[R1] [C7] column_encoding:utf8mb4;[R1] [C7] column_is_not_null:false;[R1] [C7] column_value_new:[-1.2345678901234567890](22);[R1] [C7] column_value_old:[-1.2345678901234567890](22);[R1] [C8] column_name:C7;[R1] [C8] column_type:MYSQL_TYPE_STRING;[R1] [C8] column_is_rowkey:false;[R1] [C8] column_is_signed:true;[R1] [C8] column_encoding:utf8mb4;[R1] [C8] column_is_not_null:false;[R1] [C8] column_value_new:[-1.2345678901234567890                                                                              ](100);[R1] [C8] column_value_old:[12.34                                                                                               ](100);$[R2] COMMIT;
update number_1 set c1=c6, c2=c6, c3=c6, c4=c6, c5=c6, c7=c6 where c0 = 160;
select c0, c6, c1, c2, c3, c4, c5, c7 from number_1 where c0 = 160;
C0	C6	C1	C2	C3	C4	C5	C7
160	-0.1234567890123456789	-1.2345678901234568E-001	-1.23456791E-001	-.1234567890123456789	-.1235	-.1234567890123456789	-0.1234567890123456789                                                                              
ob1.oblog.next;
[R0] BEGIN;[R0] org_cluster_id:1;[R1] record_type:UPDATE;[R1] database_name:oracle.OBLOG_DB;[R1] table_name:NUMBER_1;[R1] log_event:true;[R1] column_count:8;[R1] source_category:SRC_FULL_RECORDED;[R1] source_type:SRC_OCEANBASE_1_0;[R1] has_pk:true;[R1] pk_info:(0);[R1] pks:C0;[R1] has_uk:false;[R1] uk_info:(null);[R1] uks:(null);[R1] [C1] column_name:C0;[R1] [C1] column_type:MYSQL_TYPE_NEWDECIMAL;[R1] [C1] column_is_rowkey:true;[R1] [C1] column_is_signed:true;[R1] [C1] column_encoding:binary;[R1] [C1] column_is_not_null:true;[R1] [C1] column_value_new:[160](3);[R1] [C1] column_value_old:[160](3);[R1] [C2] column_name:C1;[R1] [C2] column_type:MYSQL_TYPE_DOUBLE;[R1] [C2] column_is_rowkey:false;[R1] [C2] column_is_signed:true;[R1] [C2] column_encoding:binary;[R1] [C2] column_is_not_null:false;[R1] [C2] column_value_new:[-1.2345678901234568E-001](24);[R1] [C2] column_value_old:[1.234E+001](10);[R1] [C3] column_name:C2;[R1] [C3] column_type:MYSQL_TYPE_FLOAT;[R1] [C3] column_is_rowkey:false;[R1] [C3] column_is_signed:true;[R1] [C3] column_encoding:binary;[R1] [C3] column_is_not_null:false;[R1] [C3] column_value_new:[-1.23456791E-001](16);[R1] [C3] column_value_old:[1.23400002E+001](15);[R1] [C4] column_name:C3;[R1] [C4] column_type:MYSQL_TYPE_NEWDECIMAL;[R1] [C4] column_is_rowkey:false;[R1] [C4] column_is_signed:true;[R1] [C4] column_encoding:binary;[R1] [C4] column_is_not_null:false;[R1] [C4] column_value_new:[-.1234567890123456789](21);[R1] [C4] column_value_old:[12.34](5);[R1] [C5] column_name:C4;[R1] [C5] column_type:MYSQL_TYPE_OB_NUMBER_FLOAT;[R1] [C5] column_is_rowkey:false;[R1] [C5] column_is_signed:true;[R1] [C5] column_encoding:binary;[R1] [C5] column_is_not_null:false;[R1] [C5] column_value_new:[-.1235](6);[R1] [C5] column_value_old:[12.34](5);[R1] [C6] column_name:C5;[R1] [C6] column_type:MYSQL_TYPE_OB_NUMBER_FLOAT;[R1] [C6] column_is_rowkey:false;[R1] [C6] column_is_signed:true;[R1] [C6] column_encoding:binary;[R1] [C6] column_is_not_null:false;[R1] [C6] column_value_new:[-.1234567890123456789](21);[R1] [C6] column_value_old:[12.34](5);[R1] [C7] column_name:C6;[R1] [C7] column_type:MYSQL_TYPE_VAR_STRING;[R1] [C7] column_is_rowkey:false;[R1] [C7] column_is_signed:true;[R1] [C7] column_encoding:utf8mb4;[R1] [C7] column_is_not_null:false;[R1] [C7] column_value_new:[-0.1234567890123456789](22);[R1] [C7] column_value_old:[-0.1234567890123456789](22);[R1] [C8] column_name:C7;[R1] [C8] column_type:MYSQL_TYPE_STRING;[R1] [C8] column_is_rowkey:false;[R1] [C8] column_is_signed:true;[R1] [C8] column_encoding:utf8mb4;[R1] [C8] column_is_not_null:false;[R1] [C8] column_value_new:[-0.1234567890123456789                                                                              ](100);[R1] [C8] column_value_old:[12.34                                                                                               ](100);$[R2] COMMIT;
update number_1 set c1=c6, c2=c6, c3=c6, c4=c6, c5=c6, c7=c6 where c0 = 161;
select c0, c6, c1, c2, c3, c4, c5, c7 from number_1 where c0 = 161;
C0	C6	C1	C2	C3	C4	C5	C7
161	-0.1234567890123456789	-1.2345678901234568E-001	-1.23456791E-001	-.1234567890123456789	-.1235	-.1234567890123456789	-0.1234567890123456789                                                                              
ob1.oblog.next;
[R0] BEGIN;[R0] org_cluster_id:1;[R1] record_type:UPDATE;[R1] database_name:oracle.OBLOG_DB;[R1] table_name:NUMBER_1;[R1] log_event:true;[R1] column_count:8;[R1] source_category:SRC_FULL_RECORDED;[R1] source_type:SRC_OCEANBASE_1_0;[R1] has_pk:true;[R1] pk_info:(0);[R1] pks:C0;[R1] has_uk:false;[R1] uk_info:(null);[R1] uks:(null);[R1] [C1] column_name:C0;[R1] [C1] column_type:MYSQL_TYPE_NEWDECIMAL;[R1] [C1] column_is_rowkey:true;[R1] [C1] column_is_signed:true;[R1] [C1] column_encoding:binary;[R1] [C1] column_is_not_null:true;[R1] [C1] column_value_new:[161](3);[R1] [C1] column_value_old:[161](3);[R1] [C2] column_name:C1;[R1] [C2] column_type:MYSQL_TYPE_DOUBLE;[R1] [C2] column_is_rowkey:false;[R1] [C2] column_is_signed:true;[R1] [C2] column_encoding:binary;[R1] [C2] column_is_not_null:false;[R1] [C2] column_value_new:[-1.2345678901234568E-001](24);[R1] [C2] column_value_old:[1.234E+001](10);[R1] [C3] column_name:C2;[R1] [C3] column_type:MYSQL_TYPE_FLOAT;[R1] [C3] column_is_rowkey:false;[R1] [C3] column_is_signed:true;[R1] [C3] column_encoding:binary;[R1] [C3] column_is_not_null:false;[R1] [C3] column_value_new:[-1.23456791E-001](16);[R1] [C3] column_value_old:[1.23400002E+001](15);[R1] [C4] column_name:C3;[R1] [C4] column_type:MYSQL_TYPE_NEWDECIMAL;[R1] [C4] column_is_rowkey:false;[R1] [C4] column_is_signed:true;[R1] [C4] column_encoding:binary;[R1] [C4] column_is_not_null:false;[R1] [C4] column_value_new:[-.1234567890123456789](21);[R1] [C4] column_value_old:[12.34](5);[R1] [C5] column_name:C4;[R1] [C5] column_type:MYSQL_TYPE_OB_NUMBER_FLOAT;[R1] [C5] column_is_rowkey:false;[R1] [C5] column_is_signed:true;[R1] [C5] column_encoding:binary;[R1] [C5] column_is_not_null:false;[R1] [C5] column_value_new:[-.1235](6);[R1] [C5] column_value_old:[12.34](5);[R1] [C6] column_name:C5;[R1] [C6] column_type:MYSQL_TYPE_OB_NUMBER_FLOAT;[R1] [C6] column_is_rowkey:false;[R1] [C6] column_is_signed:true;[R1] [C6] column_encoding:binary;[R1] [C6] column_is_not_null:false;[R1] [C6] column_value_new:[-.1234567890123456789](21);[R1] [C6] column_value_old:[12.34](5);[R1] [C7] column_name:C6;[R1] [C7] column_type:MYSQL_TYPE_VAR_STRING;[R1] [C7] column_is_rowkey:false;[R1] [C7] column_is_signed:true;[R1] [C7] column_encoding:utf8mb4;[R1] [C7] column_is_not_null:false;[R1] [C7] column_value_new:[-0.1234567890123456789](22);[R1] [C7] column_value_old:[-0.1234567890123456789](22);[R1] [C8] column_name:C7;[R1] [C8] column_type:MYSQL_TYPE_STRING;[R1] [C8] column_is_rowkey:false;[R1] [C8] column_is_signed:true;[R1] [C8] column_encoding:utf8mb4;[R1] [C8] column_is_not_null:false;[R1] [C8] column_value_new:[-0.1234567890123456789                                                                              ](100);[R1] [C8] column_value_old:[12.34                                                                                               ](100);$[R2] COMMIT;
update number_1 set c1=c6, c2=c6, c3=c6, c4=c6, c5=c6, c7=c6 where c0 = 162;
select c0, c6, c1, c2, c3, c4, c5, c7 from number_1 where c0 = 162;
C0	C6	C1	C2	C3	C4	C5	C7
162	-0.123456789012345678	-1.2345678901234568E-001	-1.23456791E-001	-.123456789012345678	-.1235	-.123456789012345678	-0.123456789012345678                                                                               
ob1.oblog.next;
[R0] BEGIN;[R0] org_cluster_id:1;[R1] record_type:UPDATE;[R1] database_name:oracle.OBLOG_DB;[R1] table_name:NUMBER_1;[R1] log_event:true;[R1] column_count:8;[R1] source_category:SRC_FULL_RECORDED;[R1] source_type:SRC_OCEANBASE_1_0;[R1] has_pk:true;[R1] pk_info:(0);[R1] pks:C0;[R1] has_uk:false;[R1] uk_info:(null);[R1] uks:(null);[R1] [C1] column_name:C0;[R1] [C1] column_type:MYSQL_TYPE_NEWDECIMAL;[R1] [C1] column_is_rowkey:true;[R1] [C1] column_is_signed:true;[R1] [C1] column_encoding:binary;[R1] [C1] column_is_not_null:true;[R1] [C1] column_value_new:[162](3);[R1] [C1] column_value_old:[162](3);[R1] [C2] column_name:C1;[R1] [C2] column_type:MYSQL_TYPE_DOUBLE;[R1] [C2] column_is_rowkey:false;[R1] [C2] column_is_signed:true;[R1] [C2] column_encoding:binary;[R1] [C2] column_is_not_null:false;[R1] [C2] column_value_new:[-1.2345678901234568E-001](24);[R1] [C2] column_value_old:[1.234E+001](10);[R1] [C3] column_name:C2;[R1] [C3] column_type:MYSQL_TYPE_FLOAT;[R1] [C3] column_is_rowkey:false;[R1] [C3] column_is_signed:true;[R1] [C3] column_encoding:binary;[R1] [C3] column_is_not_null:false;[R1] [C3] column_value_new:[-1.23456791E-001](16);[R1] [C3] column_value_old:[1.23400002E+001](15);[R1] [C4] column_name:C3;[R1] [C4] column_type:MYSQL_TYPE_NEWDECIMAL;[R1] [C4] column_is_rowkey:false;[R1] [C4] column_is_signed:true;[R1] [C4] column_encoding:binary;[R1] [C4] column_is_not_null:false;[R1] [C4] column_value_new:[-.123456789012345678](20);[R1] [C4] column_value_old:[12.34](5);[R1] [C5] column_name:C4;[R1] [C5] column_type:MYSQL_TYPE_OB_NUMBER_FLOAT;[R1] [C5] column_is_rowkey:false;[R1] [C5] column_is_signed:true;[R1] [C5] column_encoding:binary;[R1] [C5] column_is_not_null:false;[R1] [C5] column_value_new:[-.1235](6);[R1] [C5] column_value_old:[12.34](5);[R1] [C6] column_name:C5;[R1] [C6] column_type:MYSQL_TYPE_OB_NUMBER_FLOAT;[R1] [C6] column_is_rowkey:false;[R1] [C6] column_is_signed:true;[R1] [C6] column_encoding:binary;[R1] [C6] column_is_not_null:false;[R1] [C6] column_value_new:[-.123456789012345678](20);[R1] [C6] column_value_old:[12.34](5);[R1] [C7] column_name:C6;[R1] [C7] column_type:MYSQL_TYPE_VAR_STRING;[R1] [C7] column_is_rowkey:false;[R1] [C7] column_is_signed:true;[R1] [C7] column_encoding:utf8mb4;[R1] [C7] column_is_not_null:false;[R1] [C7] column_value_new:[-0.123456789012345678](21);[R1] [C7] column_value_old:[-0.123456789012345678](21);[R1] [C8] column_name:C7;[R1] [C8] column_type:MYSQL_TYPE_STRING;[R1] [C8] column_is_rowkey:false;[R1] [C8] column_is_signed:true;[R1] [C8] column_encoding:utf8mb4;[R1] [C8] column_is_not_null:false;[R1] [C8] column_value_new:[-0.123456789012345678                                                                               ](100);[R1] [C8] column_value_old:[12.34                                                                                               ](100);$[R2] COMMIT;
update number_1 set c1=c6, c2=c6, c3=c6, c4=c6, c5=c6, c7=c6 where c0 = 163;
select c0, c6, c1, c2, c3, c4, c5, c7 from number_1 where c0 = 163;
C0	C6	C1	C2	C3	C4	C5	C7
163	-0.12345678901234567	-1.2345678901234566E-001	-1.23456791E-001	-.12345678901234567	-.1235	-.12345678901234567	-0.12345678901234567                                                                                
ob1.oblog.next;
[R0] BEGIN;[R0] org_cluster_id:1;[R1] record_type:UPDATE;[R1] database_name:oracle.OBLOG_DB;[R1] table_name:NUMBER_1;[R1] log_event:true;[R1] column_count:8;[R1] source_category:SRC_FULL_RECORDED;[R1] source_type:SRC_OCEANBASE_1_0;[R1] has_pk:true;[R1] pk_info:(0);[R1] pks:C0;[R1] has_uk:false;[R1] uk_info:(null);[R1] uks:(null);[R1] [C1] column_name:C0;[R1] [C1] column_type:MYSQL_TYPE_NEWDECIMAL;[R1] [C1] column_is_rowkey:true;[R1] [C1] column_is_signed:true;[R1] [C1] column_encoding:binary;[R1] [C1] column_is_not_null:true;[R1] [C1] column_value_new:[163](3);[R1] [C1] column_value_old:[163](3);[R1] [C2] column_name:C1;[R1] [C2] column_type:MYSQL_TYPE_DOUBLE;[R1] [C2] column_is_rowkey:false;[R1] [C2] column_is_signed:true;[R1] [C2] column_encoding:binary;[R1] [C2] column_is_not_null:false;[R1] [C2] column_value_new:[-1.2345678901234566E-001](24);[R1] [C2] column_value_old:[1.234E+001](10);[R1] [C3] column_name:C2;[R1] [C3] column_type:MYSQL_TYPE_FLOAT;[R1] [C3] column_is_rowkey:false;[R1] [C3] column_is_signed:true;[R1] [C3] column_encoding:binary;[R1] [C3] column_is_not_null:false;[R1] [C3] column_value_new:[-1.23456791E-001](16);[R1] [C3] column_value_old:[1.23400002E+001](15);[R1] [C4] column_name:C3;[R1] [C4] column_type:MYSQL_TYPE_NEWDECIMAL;[R1] [C4] column_is_rowkey:false;[R1] [C4] column_is_signed:true;[R1] [C4] column_encoding:binary;[R1] [C4] column_is_not_null:false;[R1] [C4] column_value_new:[-.12345678901234567](19);[R1] [C4] column_value_old:[12.34](5);[R1] [C5] column_name:C4;[R1] [C5] column_type:MYSQL_TYPE_OB_NUMBER_FLOAT;[R1] [C5] column_is_rowkey:false;[R1] [C5] column_is_signed:true;[R1] [C5] column_encoding:binary;[R1] [C5] column_is_not_null:false;[R1] [C5] column_value_new:[-.1235](6);[R1] [C5] column_value_old:[12.34](5);[R1] [C6] column_name:C5;[R1] [C6] column_type:MYSQL_TYPE_OB_NUMBER_FLOAT;[R1] [C6] column_is_rowkey:false;[R1] [C6] column_is_signed:true;[R1] [C6] column_encoding:binary;[R1] [C6] column_is_not_null:false;[R1] [C6] column_value_new:[-.12345678901234567](19);[R1] [C6] column_value_old:[12.34](5);[R1] [C7] column_name:C6;[R1] [C7] column_type:MYSQL_TYPE_VAR_STRING;[R1] [C7] column_is_rowkey:false;[R1] [C7] column_is_signed:true;[R1] [C7] column_encoding:utf8mb4;[R1] [C7] column_is_not_null:false;[R1] [C7] column_value_new:[-0.12345678901234567](20);[R1] [C7] column_value_old:[-0.12345678901234567](20);[R1] [C8] column_name:C7;[R1] [C8] column_type:MYSQL_TYPE_STRING;[R1] [C8] column_is_rowkey:false;[R1] [C8] column_is_signed:true;[R1] [C8] column_encoding:utf8mb4;[R1] [C8] column_is_not_null:false;[R1] [C8] column_value_new:[-0.12345678901234567                                                                                ](100);[R1] [C8] column_value_old:[12.34                                                                                               ](100);$[R2] COMMIT;
update number_1 set c1=c6, c2=c6, c3=c6, c4=c6, c5=c6, c7=c6 where c0 = 164;
select c0, c6, c1, c2, c3, c4, c5, c7 from number_1 where c0 = 164;
C0	C6	C1	C2	C3	C4	C5	C7
164	-0.1234567890123456	-1.2345678901234559E-001	-1.23456791E-001	-.1234567890123456	-.1235	-.1234567890123456	-0.1234567890123456                                                                                 
ob1.oblog.next;
[R0] BEGIN;[R0] org_cluster_id:1;[R1] record_type:UPDATE;[R1] database_name:oracle.OBLOG_DB;[R1] table_name:NUMBER_1;[R1] log_event:true;[R1] column_count:8;[R1] source_category:SRC_FULL_RECORDED;[R1] source_type:SRC_OCEANBASE_1_0;[R1] has_pk:true;[R1] pk_info:(0);[R1] pks:C0;[R1] has_uk:false;[R1] uk_info:(null);[R1] uks:(null);[R1] [C1] column_name:C0;[R1] [C1] column_type:MYSQL_TYPE_NEWDECIMAL;[R1] [C1] column_is_rowkey:true;[R1] [C1] column_is_signed:true;[R1] [C1] column_encoding:binary;[R1] [C1] column_is_not_null:true;[R1] [C1] column_value_new:[164](3);[R1] [C1] column_value_old:[164](3);[R1] [C2] column_name:C1;[R1] [C2] column_type:MYSQL_TYPE_DOUBLE;[R1] [C2] column_is_rowkey:false;[R1] [C2] column_is_signed:true;[R1] [C2] column_encoding:binary;[R1] [C2] column_is_not_null:false;[R1] [C2] column_value_new:[-1.2345678901234559E-001](24);[R1] [C2] column_value_old:[1.234E+001](10);[R1] [C3] column_name:C2;[R1] [C3] column_type:MYSQL_TYPE_FLOAT;[R1] [C3] column_is_rowkey:false;[R1] [C3] column_is_signed:true;[R1] [C3] column_encoding:binary;[R1] [C3] column_is_not_null:false;[R1] [C3] column_value_new:[-1.23456791E-001](16);[R1] [C3] column_value_old:[1.23400002E+001](15);[R1] [C4] column_name:C3;[R1] [C4] column_type:MYSQL_TYPE_NEWDECIMAL;[R1] [C4] column_is_rowkey:false;[R1] [C4] column_is_signed:true;[R1] [C4] column_encoding:binary;[R1] [C4] column_is_not_null:false;[R1] [C4] column_value_new:[-.1234567890123456](18);[R1] [C4] column_value_old:[12.34](5);[R1] [C5] column_name:C4;[R1] [C5] column_type:MYSQL_TYPE_OB_NUMBER_FLOAT;[R1] [C5] column_is_rowkey:false;[R1] [C5] column_is_signed:true;[R1] [C5] column_encoding:binary;[R1] [C5] column_is_not_null:false;[R1] [C5] column_value_new:[-.1235](6);[R1] [C5] column_value_old:[12.34](5);[R1] [C6] column_name:C5;[R1] [C6] column_type:MYSQL_TYPE_OB_NUMBER_FLOAT;[R1] [C6] column_is_rowkey:false;[R1] [C6] column_is_signed:true;[R1] [C6] column_encoding:binary;[R1] [C6] column_is_not_null:false;[R1] [C6] column_value_new:[-.1234567890123456](18);[R1] [C6] column_value_old:[12.34](5);[R1] [C7] column_name:C6;[R1] [C7] column_type:MYSQL_TYPE_VAR_STRING;[R1] [C7] column_is_rowkey:false;[R1] [C7] column_is_signed:true;[R1] [C7] column_encoding:utf8mb4;[R1] [C7] column_is_not_null:false;[R1] [C7] column_value_new:[-0.1234567890123456](19);[R1] [C7] column_value_old:[-0.1234567890123456](19);[R1] [C8] column_name:C7;[R1] [C8] column_type:MYSQL_TYPE_STRING;[R1] [C8] column_is_rowkey:false;[R1] [C8] column_is_signed:true;[R1] [C8] column_encoding:utf8mb4;[R1] [C8] column_is_not_null:false;[R1] [C8] column_value_new:[-0.1234567890123456                                                                                 ](100);[R1] [C8] column_value_old:[12.34                                                                                               ](100);$[R2] COMMIT;
update number_1 set c1=c6, c2=c6, c3=c6, c4=c6, c5=c6, c7=c6 where c0 = 165;
select c0, c6, c1, c2, c3, c4, c5, c7 from number_1 where c0 = 165;
C0	C6	C1	C2	C3	C4	C5	C7
165	-0.123456789012345	-1.23456789012345E-001	-1.23456791E-001	-.123456789012345	-.1235	-.123456789012345	-0.123456789012345                                                                                  
ob1.oblog.next;
[R0] BEGIN;[R0] org_cluster_id:1;[R1] record_type:UPDATE;[R1] database_name:oracle.OBLOG_DB;[R1] table_name:NUMBER_1;[R1] log_event:true;[R1] column_count:8;[R1] source_category:SRC_FULL_RECORDED;[R1] source_type:SRC_OCEANBASE_1_0;[R1] has_pk:true;[R1] pk_info:(0);[R1] pks:C0;[R1] has_uk:false;[R1] uk_info:(null);[R1] uks:(null);[R1] [C1] column_name:C0;[R1] [C1] column_type:MYSQL_TYPE_NEWDECIMAL;[R1] [C1] column_is_rowkey:true;[R1] [C1] column_is_signed:true;[R1] [C1] column_encoding:binary;[R1] [C1] column_is_not_null:true;[R1] [C1] column_value_new:[165](3);[R1] [C1] column_value_old:[165](3);[R1] [C2] column_name:C1;[R1] [C2] column_type:MYSQL_TYPE_DOUBLE;[R1] [C2] column_is_rowkey:false;[R1] [C2] column_is_signed:true;[R1] [C2] column_encoding:binary;[R1] [C2] column_is_not_null:false;[R1] [C2] column_value_new:[-1.23456789012345E-001](22);[R1] [C2] column_value_old:[1.234E+001](10);[R1] [C3] column_name:C2;[R1] [C3] column_type:MYSQL_TYPE_FLOAT;[R1] [C3] column_is_rowkey:false;[R1] [C3] column_is_signed:true;[R1] [C3] column_encoding:binary;[R1] [C3] column_is_not_null:false;[R1] [C3] column_value_new:[-1.23456791E-001](16);[R1] [C3] column_value_old:[1.23400002E+001](15);[R1] [C4] column_name:C3;[R1] [C4] column_type:MYSQL_TYPE_NEWDECIMAL;[R1] [C4] column_is_rowkey:false;[R1] [C4] column_is_signed:true;[R1] [C4] column_encoding:binary;[R1] [C4] column_is_not_null:false;[R1] [C4] column_value_new:[-.123456789012345](17);[R1] [C4] column_value_old:[12.34](5);[R1] [C5] column_name:C4;[R1] [C5] column_type:MYSQL_TYPE_OB_NUMBER_FLOAT;[R1] [C5] column_is_rowkey:false;[R1] [C5] column_is_signed:true;[R1] [C5] column_encoding:binary;[R1] [C5] column_is_not_null:false;[R1] [C5] column_value_new:[-.1235](6);[R1] [C5] column_value_old:[12.34](5);[R1] [C6] column_name:C5;[R1] [C6] column_type:MYSQL_TYPE_OB_NUMBER_FLOAT;[R1] [C6] column_is_rowkey:false;[R1] [C6] column_is_signed:true;[R1] [C6] column_encoding:binary;[R1] [C6] column_is_not_null:false;[R1] [C6] column_value_new:[-.123456789012345](17);[R1] [C6] column_value_old:[12.34](5);[R1] [C7] column_name:C6;[R1] [C7] column_type:MYSQL_TYPE_VAR_STRING;[R1] [C7] column_is_rowkey:false;[R1] [C7] column_is_signed:true;[R1] [C7] column_encoding:utf8mb4;[R1] [C7] column_is_not_null:false;[R1] [C7] column_value_new:[-0.123456789012345](18);[R1] [C7] column_value_old:[-0.123456789012345](18);[R1] [C8] column_name:C7;[R1] [C8] column_type:MYSQL_TYPE_STRING;[R1] [C8] column_is_rowkey:false;[R1] [C8] column_is_signed:true;[R1] [C8] column_encoding:utf8mb4;[R1] [C8] column_is_not_null:false;[R1] [C8] column_value_new:[-0.123456789012345                                                                                  ](100);[R1] [C8] column_value_old:[12.34                                                                                               ](100);$[R2] COMMIT;
update number_1 set c1=c6, c2=c6, c3=c6, c4=c6, c5=c6, c7=c6 where c0 = 166;
select c0, c6, c1, c2, c3, c4, c5, c7 from number_1 where c0 = 166;
C0	C6	C1	C2	C3	C4	C5	C7
166	-0.12345678901234	-1.2345678901234E-001	-1.23456791E-001	-.12345678901234	-.1235	-.12345678901234	-0.12345678901234                                                                                   
ob1.oblog.next;
[R0] BEGIN;[R0] org_cluster_id:1;[R1] record_type:UPDATE;[R1] database_name:oracle.OBLOG_DB;[R1] table_name:NUMBER_1;[R1] log_event:true;[R1] column_count:8;[R1] source_category:SRC_FULL_RECORDED;[R1] source_type:SRC_OCEANBASE_1_0;[R1] has_pk:true;[R1] pk_info:(0);[R1] pks:C0;[R1] has_uk:false;[R1] uk_info:(null);[R1] uks:(null);[R1] [C1] column_name:C0;[R1] [C1] column_type:MYSQL_TYPE_NEWDECIMAL;[R1] [C1] column_is_rowkey:true;[R1] [C1] column_is_signed:true;[R1] [C1] column_encoding:binary;[R1] [C1] column_is_not_null:true;[R1] [C1] column_value_new:[166](3);[R1] [C1] column_value_old:[166](3);[R1] [C2] column_name:C1;[R1] [C2] column_type:MYSQL_TYPE_DOUBLE;[R1] [C2] column_is_rowkey:false;[R1] [C2] column_is_signed:true;[R1] [C2] column_encoding:binary;[R1] [C2] column_is_not_null:false;[R1] [C2] column_value_new:[-1.2345678901234E-001](21);[R1] [C2] column_value_old:[1.234E+001](10);[R1] [C3] column_name:C2;[R1] [C3] column_type:MYSQL_TYPE_FLOAT;[R1] [C3] column_is_rowkey:false;[R1] [C3] column_is_signed:true;[R1] [C3] column_encoding:binary;[R1] [C3] column_is_not_null:false;[R1] [C3] column_value_new:[-1.23456791E-001](16);[R1] [C3] column_value_old:[1.23400002E+001](15);[R1] [C4] column_name:C3;[R1] [C4] column_type:MYSQL_TYPE_NEWDECIMAL;[R1] [C4] column_is_rowkey:false;[R1] [C4] column_is_signed:true;[R1] [C4] column_encoding:binary;[R1] [C4] column_is_not_null:false;[R1] [C4] column_value_new:[-.12345678901234](16);[R1] [C4] column_value_old:[12.34](5);[R1] [C5] column_name:C4;[R1] [C5] column_type:MYSQL_TYPE_OB_NUMBER_FLOAT;[R1] [C5] column_is_rowkey:false;[R1] [C5] column_is_signed:true;[R1] [C5] column_encoding:binary;[R1] [C5] column_is_not_null:false;[R1] [C5] column_value_new:[-.1235](6);[R1] [C5] column_value_old:[12.34](5);[R1] [C6] column_name:C5;[R1] [C6] column_type:MYSQL_TYPE_OB_NUMBER_FLOAT;[R1] [C6] column_is_rowkey:false;[R1] [C6] column_is_signed:true;[R1] [C6] column_encoding:binary;[R1] [C6] column_is_not_null:false;[R1] [C6] column_value_new:[-.12345678901234](16);[R1] [C6] column_value_old:[12.34](5);[R1] [C7] column_name:C6;[R1] [C7] column_type:MYSQL_TYPE_VAR_STRING;[R1] [C7] column_is_rowkey:false;[R1] [C7] column_is_signed:true;[R1] [C7] column_encoding:utf8mb4;[R1] [C7] column_is_not_null:false;[R1] [C7] column_value_new:[-0.12345678901234](17);[R1] [C7] column_value_old:[-0.12345678901234](17);[R1] [C8] column_name:C7;[R1] [C8] column_type:MYSQL_TYPE_STRING;[R1] [C8] column_is_rowkey:false;[R1] [C8] column_is_signed:true;[R1] [C8] column_encoding:utf8mb4;[R1] [C8] column_is_not_null:false;[R1] [C8] column_value_new:[-0.12345678901234                                                                                   ](100);[R1] [C8] column_value_old:[12.34                                                                                               ](100);$[R2] COMMIT;
update number_1 set c1=c6, c2=c6, c3=c6, c4=c6, c5=c6, c7=c6 where c0 = 167;
select c0, c6, c1, c2, c3, c4, c5, c7 from number_1 where c0 = 167;
C0	C6	C1	C2	C3	C4	C5	C7
167	-0.1234567890123	-1.2345678901230001E-001	-1.23456791E-001	-.1234567890123	-.1235	-.1234567890123	-0.1234567890123                                                                                    
ob1.oblog.next;
[R0] BEGIN;[R0] org_cluster_id:1;[R1] record_type:UPDATE;[R1] database_name:oracle.OBLOG_DB;[R1] table_name:NUMBER_1;[R1] log_event:true;[R1] column_count:8;[R1] source_category:SRC_FULL_RECORDED;[R1] source_type:SRC_OCEANBASE_1_0;[R1] has_pk:true;[R1] pk_info:(0);[R1] pks:C0;[R1] has_uk:false;[R1] uk_info:(null);[R1] uks:(null);[R1] [C1] column_name:C0;[R1] [C1] column_type:MYSQL_TYPE_NEWDECIMAL;[R1] [C1] column_is_rowkey:true;[R1] [C1] column_is_signed:true;[R1] [C1] column_encoding:binary;[R1] [C1] column_is_not_null:true;[R1] [C1] column_value_new:[167](3);[R1] [C1] column_value_old:[167](3);[R1] [C2] column_name:C1;[R1] [C2] column_type:MYSQL_TYPE_DOUBLE;[R1] [C2] column_is_rowkey:false;[R1] [C2] column_is_signed:true;[R1] [C2] column_encoding:binary;[R1] [C2] column_is_not_null:false;[R1] [C2] column_value_new:[-1.2345678901230001E-001](24);[R1] [C2] column_value_old:[1.234E+001](10);[R1] [C3] column_name:C2;[R1] [C3] column_type:MYSQL_TYPE_FLOAT;[R1] [C3] column_is_rowkey:false;[R1] [C3] column_is_signed:true;[R1] [C3] column_encoding:binary;[R1] [C3] column_is_not_null:false;[R1] [C3] column_value_new:[-1.23456791E-001](16);[R1] [C3] column_value_old:[1.23400002E+001](15);[R1] [C4] column_name:C3;[R1] [C4] column_type:MYSQL_TYPE_NEWDECIMAL;[R1] [C4] column_is_rowkey:false;[R1] [C4] column_is_signed:true;[R1] [C4] column_encoding:binary;[R1] [C4] column_is_not_null:false;[R1] [C4] column_value_new:[-.1234567890123](15);[R1] [C4] column_value_old:[12.34](5);[R1] [C5] column_name:C4;[R1] [C5] column_type:MYSQL_TYPE_OB_NUMBER_FLOAT;[R1] [C5] column_is_rowkey:false;[R1] [C5] column_is_signed:true;[R1] [C5] column_encoding:binary;[R1] [C5] column_is_not_null:false;[R1] [C5] column_value_new:[-.1235](6);[R1] [C5] column_value_old:[12.34](5);[R1] [C6] column_name:C5;[R1] [C6] column_type:MYSQL_TYPE_OB_NUMBER_FLOAT;[R1] [C6] column_is_rowkey:false;[R1] [C6] column_is_signed:true;[R1] [C6] column_encoding:binary;[R1] [C6] column_is_not_null:false;[R1] [C6] column_value_new:[-.1234567890123](15);[R1] [C6] column_value_old:[12.34](5);[R1] [C7] column_name:C6;[R1] [C7] column_type:MYSQL_TYPE_VAR_STRING;[R1] [C7] column_is_rowkey:false;[R1] [C7] column_is_signed:true;[R1] [C7] column_encoding:utf8mb4;[R1] [C7] column_is_not_null:false;[R1] [C7] column_value_new:[-0.1234567890123](16);[R1] [C7] column_value_old:[-0.1234567890123](16);[R1] [C8] column_name:C7;[R1] [C8] column_type:MYSQL_TYPE_STRING;[R1] [C8] column_is_rowkey:false;[R1] [C8] column_is_signed:true;[R1] [C8] column_encoding:utf8mb4;[R1] [C8] column_is_not_null:false;[R1] [C8] column_value_new:[-0.1234567890123                                                                                    ](100);[R1] [C8] column_value_old:[12.34                                                                                               ](100);$[R2] COMMIT;
update number_1 set c1=c6, c2=c6, c3=c6, c4=c6, c5=c6, c7=c6 where c0 = 168;
select c0, c6, c1, c2, c3, c4, c5, c7 from number_1 where c0 = 168;
C0	C6	C1	C2	C3	C4	C5	C7
168	-0.123456789012	-1.23456789012E-001	-1.23456791E-001	-.123456789012	-.1235	-.123456789012	-0.123456789012                                                                                     
ob1.oblog.next;
[R0] BEGIN;[R0] org_cluster_id:1;[R1] record_type:UPDATE;[R1] database_name:oracle.OBLOG_DB;[R1] table_name:NUMBER_1;[R1] log_event:true;[R1] column_count:8;[R1] source_category:SRC_FULL_RECORDED;[R1] source_type:SRC_OCEANBASE_1_0;[R1] has_pk:true;[R1] pk_info:(0);[R1] pks:C0;[R1] has_uk:false;[R1] uk_info:(null);[R1] uks:(null);[R1] [C1] column_name:C0;[R1] [C1] column_type:MYSQL_TYPE_NEWDECIMAL;[R1] [C1] column_is_rowkey:true;[R1] [C1] column_is_signed:true;[R1] [C1] column_encoding:binary;[R1] [C1] column_is_not_null:true;[R1] [C1] column_value_new:[168](3);[R1] [C1] column_value_old:[168](3);[R1] [C2] column_name:C1;[R1] [C2] column_type:MYSQL_TYPE_DOUBLE;[R1] [C2] column_is_rowkey:false;[R1] [C2] column_is_signed:true;[R1] [C2] column_encoding:binary;[R1] [C2] column_is_not_null:false;[R1] [C2] column_value_new:[-1.23456789012E-001](19);[R1] [C2] column_value_old:[1.234E+001](10);[R1] [C3] column_name:C2;[R1] [C3] column_type:MYSQL_TYPE_FLOAT;[R1] [C3] column_is_rowkey:false;[R1] [C3] column_is_signed:true;[R1] [C3] column_encoding:binary;[R1] [C3] column_is_not_null:false;[R1] [C3] column_value_new:[-1.23456791E-001](16);[R1] [C3] column_value_old:[1.23400002E+001](15);[R1] [C4] column_name:C3;[R1] [C4] column_type:MYSQL_TYPE_NEWDECIMAL;[R1] [C4] column_is_rowkey:false;[R1] [C4] column_is_signed:true;[R1] [C4] column_encoding:binary;[R1] [C4] column_is_not_null:false;[R1] [C4] column_value_new:[-.123456789012](14);[R1] [C4] column_value_old:[12.34](5);[R1] [C5] column_name:C4;[R1] [C5] column_type:MYSQL_TYPE_OB_NUMBER_FLOAT;[R1] [C5] column_is_rowkey:false;[R1] [C5] column_is_signed:true;[R1] [C5] column_encoding:binary;[R1] [C5] column_is_not_null:false;[R1] [C5] column_value_new:[-.1235](6);[R1] [C5] column_value_old:[12.34](5);[R1] [C6] column_name:C5;[R1] [C6] column_type:MYSQL_TYPE_OB_NUMBER_FLOAT;[R1] [C6] column_is_rowkey:false;[R1] [C6] column_is_signed:true;[R1] [C6] column_encoding:binary;[R1] [C6] column_is_not_null:false;[R1] [C6] column_value_new:[-.123456789012](14);[R1] [C6] column_value_old:[12.34](5);[R1] [C7] column_name:C6;[R1] [C7] column_type:MYSQL_TYPE_VAR_STRING;[R1] [C7] column_is_rowkey:false;[R1] [C7] column_is_signed:true;[R1] [C7] column_encoding:utf8mb4;[R1] [C7] column_is_not_null:false;[R1] [C7] column_value_new:[-0.123456789012](15);[R1] [C7] column_value_old:[-0.123456789012](15);[R1] [C8] column_name:C7;[R1] [C8] column_type:MYSQL_TYPE_STRING;[R1] [C8] column_is_rowkey:false;[R1] [C8] column_is_signed:true;[R1] [C8] column_encoding:utf8mb4;[R1] [C8] column_is_not_null:false;[R1] [C8] column_value_new:[-0.123456789012                                                                                     ](100);[R1] [C8] column_value_old:[12.34                                                                                               ](100);$[R2] COMMIT;
update number_1 set c1=c6, c2=c6, c3=c6, c4=c6, c5=c6, c7=c6 where c0 = 169;
select c0, c6, c1, c2, c3, c4, c5, c7 from number_1 where c0 = 169;
C0	C6	C1	C2	C3	C4	C5	C7
169	-0.12345678901	-1.2345678901E-001	-1.23456791E-001	-.12345678901	-.1235	-.12345678901	-0.12345678901                                                                                      
ob1.oblog.next;
[R0] BEGIN;[R0] org_cluster_id:1;[R1] record_type:UPDATE;[R1] database_name:oracle.OBLOG_DB;[R1] table_name:NUMBER_1;[R1] log_event:true;[R1] column_count:8;[R1] source_category:SRC_FULL_RECORDED;[R1] source_type:SRC_OCEANBASE_1_0;[R1] has_pk:true;[R1] pk_info:(0);[R1] pks:C0;[R1] has_uk:false;[R1] uk_info:(null);[R1] uks:(null);[R1] [C1] column_name:C0;[R1] [C1] column_type:MYSQL_TYPE_NEWDECIMAL;[R1] [C1] column_is_rowkey:true;[R1] [C1] column_is_signed:true;[R1] [C1] column_encoding:binary;[R1] [C1] column_is_not_null:true;[R1] [C1] column_value_new:[169](3);[R1] [C1] column_value_old:[169](3);[R1] [C2] column_name:C1;[R1] [C2] column_type:MYSQL_TYPE_DOUBLE;[R1] [C2] column_is_rowkey:false;[R1] [C2] column_is_signed:true;[R1] [C2] column_encoding:binary;[R1] [C2] column_is_not_null:false;[R1] [C2] column_value_new:[-1.2345678901E-001](18);[R1] [C2] column_value_old:[1.234E+001](10);[R1] [C3] column_name:C2;[R1] [C3] column_type:MYSQL_TYPE_FLOAT;[R1] [C3] column_is_rowkey:false;[R1] [C3] column_is_signed:true;[R1] [C3] column_encoding:binary;[R1] [C3] column_is_not_null:false;[R1] [C3] column_value_new:[-1.23456791E-001](16);[R1] [C3] column_value_old:[1.23400002E+001](15);[R1] [C4] column_name:C3;[R1] [C4] column_type:MYSQL_TYPE_NEWDECIMAL;[R1] [C4] column_is_rowkey:false;[R1] [C4] column_is_signed:true;[R1] [C4] column_encoding:binary;[R1] [C4] column_is_not_null:false;[R1] [C4] column_value_new:[-.12345678901](13);[R1] [C4] column_value_old:[12.34](5);[R1] [C5] column_name:C4;[R1] [C5] column_type:MYSQL_TYPE_OB_NUMBER_FLOAT;[R1] [C5] column_is_rowkey:false;[R1] [C5] column_is_signed:true;[R1] [C5] column_encoding:binary;[R1] [C5] column_is_not_null:false;[R1] [C5] column_value_new:[-.1235](6);[R1] [C5] column_value_old:[12.34](5);[R1] [C6] column_name:C5;[R1] [C6] column_type:MYSQL_TYPE_OB_NUMBER_FLOAT;[R1] [C6] column_is_rowkey:false;[R1] [C6] column_is_signed:true;[R1] [C6] column_encoding:binary;[R1] [C6] column_is_not_null:false;[R1] [C6] column_value_new:[-.12345678901](13);[R1] [C6] column_value_old:[12.34](5);[R1] [C7] column_name:C6;[R1] [C7] column_type:MYSQL_TYPE_VAR_STRING;[R1] [C7] column_is_rowkey:false;[R1] [C7] column_is_signed:true;[R1] [C7] column_encoding:utf8mb4;[R1] [C7] column_is_not_null:false;[R1] [C7] column_value_new:[-0.12345678901](14);[R1] [C7] column_value_old:[-0.12345678901](14);[R1] [C8] column_name:C7;[R1] [C8] column_type:MYSQL_TYPE_STRING;[R1] [C8] column_is_rowkey:false;[R1] [C8] column_is_signed:true;[R1] [C8] column_encoding:utf8mb4;[R1] [C8] column_is_not_null:false;[R1] [C8] column_value_new:[-0.12345678901                                                                                      ](100);[R1] [C8] column_value_old:[12.34                                                                                               ](100);$[R2] COMMIT;
update number_1 set c1=c6, c2=c6, c3=c6, c4=c6, c5=c6, c7=c6 where c0 = 170;
select c0, c6, c1, c2, c3, c4, c5, c7 from number_1 where c0 = 170;
C0	C6	C1	C2	C3	C4	C5	C7
170	-0.1234567890	-1.23456789E-001	-1.23456791E-001	-.123456789	-.1235	-.123456789	-0.1234567890                                                                                       
ob1.oblog.next;
[R0] BEGIN;[R0] org_cluster_id:1;[R1] record_type:UPDATE;[R1] database_name:oracle.OBLOG_DB;[R1] table_name:NUMBER_1;[R1] log_event:true;[R1] column_count:8;[R1] source_category:SRC_FULL_RECORDED;[R1] source_type:SRC_OCEANBASE_1_0;[R1] has_pk:true;[R1] pk_info:(0);[R1] pks:C0;[R1] has_uk:false;[R1] uk_info:(null);[R1] uks:(null);[R1] [C1] column_name:C0;[R1] [C1] column_type:MYSQL_TYPE_NEWDECIMAL;[R1] [C1] column_is_rowkey:true;[R1] [C1] column_is_signed:true;[R1] [C1] column_encoding:binary;[R1] [C1] column_is_not_null:true;[R1] [C1] column_value_new:[170](3);[R1] [C1] column_value_old:[170](3);[R1] [C2] column_name:C1;[R1] [C2] column_type:MYSQL_TYPE_DOUBLE;[R1] [C2] column_is_rowkey:false;[R1] [C2] column_is_signed:true;[R1] [C2] column_encoding:binary;[R1] [C2] column_is_not_null:false;[R1] [C2] column_value_new:[-1.23456789E-001](16);[R1] [C2] column_value_old:[1.234E+001](10);[R1] [C3] column_name:C2;[R1] [C3] column_type:MYSQL_TYPE_FLOAT;[R1] [C3] column_is_rowkey:false;[R1] [C3] column_is_signed:true;[R1] [C3] column_encoding:binary;[R1] [C3] column_is_not_null:false;[R1] [C3] column_value_new:[-1.23456791E-001](16);[R1] [C3] column_value_old:[1.23400002E+001](15);[R1] [C4] column_name:C3;[R1] [C4] column_type:MYSQL_TYPE_NEWDECIMAL;[R1] [C4] column_is_rowkey:false;[R1] [C4] column_is_signed:true;[R1] [C4] column_encoding:binary;[R1] [C4] column_is_not_null:false;[R1] [C4] column_value_new:[-.123456789](11);[R1] [C4] column_value_old:[12.34](5);[R1] [C5] column_name:C4;[R1] [C5] column_type:MYSQL_TYPE_OB_NUMBER_FLOAT;[R1] [C5] column_is_rowkey:false;[R1] [C5] column_is_signed:true;[R1] [C5] column_encoding:binary;[R1] [C5] column_is_not_null:false;[R1] [C5] column_value_new:[-.1235](6);[R1] [C5] column_value_old:[12.34](5);[R1] [C6] column_name:C5;[R1] [C6] column_type:MYSQL_TYPE_OB_NUMBER_FLOAT;[R1] [C6] column_is_rowkey:false;[R1] [C6] column_is_signed:true;[R1] [C6] column_encoding:binary;[R1] [C6] column_is_not_null:false;[R1] [C6] column_value_new:[-.123456789](11);[R1] [C6] column_value_old:[12.34](5);[R1] [C7] column_name:C6;[R1] [C7] column_type:MYSQL_TYPE_VAR_STRING;[R1] [C7] column_is_rowkey:false;[R1] [C7] column_is_signed:true;[R1] [C7] column_encoding:utf8mb4;[R1] [C7] column_is_not_null:false;[R1] [C7] column_value_new:[-0.1234567890](13);[R1] [C7] column_value_old:[-0.1234567890](13);[R1] [C8] column_name:C7;[R1] [C8] column_type:MYSQL_TYPE_STRING;[R1] [C8] column_is_rowkey:false;[R1] [C8] column_is_signed:true;[R1] [C8] column_encoding:utf8mb4;[R1] [C8] column_is_not_null:false;[R1] [C8] column_value_new:[-0.1234567890                                                                                       ](100);[R1] [C8] column_value_old:[12.34                                                                                               ](100);$[R2] COMMIT;
update number_1 set c1=c6, c2=c6, c3=c6, c4=c6, c5=c6, c7=c6 where c0 = 171;
select c0, c6, c1, c2, c3, c4, c5, c7 from number_1 where c0 = 171;
C0	C6	C1	C2	C3	C4	C5	C7
171	-0.123456789	-1.23456789E-001	-1.23456791E-001	-.123456789	-.1235	-.123456789	-0.123456789                                                                                        
ob1.oblog.next;
[R0] BEGIN;[R0] org_cluster_id:1;[R1] record_type:UPDATE;[R1] database_name:oracle.OBLOG_DB;[R1] table_name:NUMBER_1;[R1] log_event:true;[R1] column_count:8;[R1] source_category:SRC_FULL_RECORDED;[R1] source_type:SRC_OCEANBASE_1_0;[R1] has_pk:true;[R1] pk_info:(0);[R1] pks:C0;[R1] has_uk:false;[R1] uk_info:(null);[R1] uks:(null);[R1] [C1] column_name:C0;[R1] [C1] column_type:MYSQL_TYPE_NEWDECIMAL;[R1] [C1] column_is_rowkey:true;[R1] [C1] column_is_signed:true;[R1] [C1] column_encoding:binary;[R1] [C1] column_is_not_null:true;[R1] [C1] column_value_new:[171](3);[R1] [C1] column_value_old:[171](3);[R1] [C2] column_name:C1;[R1] [C2] column_type:MYSQL_TYPE_DOUBLE;[R1] [C2] column_is_rowkey:false;[R1] [C2] column_is_signed:true;[R1] [C2] column_encoding:binary;[R1] [C2] column_is_not_null:false;[R1] [C2] column_value_new:[-1.23456789E-001](16);[R1] [C2] column_value_old:[1.234E+001](10);[R1] [C3] column_name:C2;[R1] [C3] column_type:MYSQL_TYPE_FLOAT;[R1] [C3] column_is_rowkey:false;[R1] [C3] column_is_signed:true;[R1] [C3] column_encoding:binary;[R1] [C3] column_is_not_null:false;[R1] [C3] column_value_new:[-1.23456791E-001](16);[R1] [C3] column_value_old:[1.23400002E+001](15);[R1] [C4] column_name:C3;[R1] [C4] column_type:MYSQL_TYPE_NEWDECIMAL;[R1] [C4] column_is_rowkey:false;[R1] [C4] column_is_signed:true;[R1] [C4] column_encoding:binary;[R1] [C4] column_is_not_null:false;[R1] [C4] column_value_new:[-.123456789](11);[R1] [C4] column_value_old:[12.34](5);[R1] [C5] column_name:C4;[R1] [C5] column_type:MYSQL_TYPE_OB_NUMBER_FLOAT;[R1] [C5] column_is_rowkey:false;[R1] [C5] column_is_signed:true;[R1] [C5] column_encoding:binary;[R1] [C5] column_is_not_null:false;[R1] [C5] column_value_new:[-.1235](6);[R1] [C5] column_value_old:[12.34](5);[R1] [C6] column_name:C5;[R1] [C6] column_type:MYSQL_TYPE_OB_NUMBER_FLOAT;[R1] [C6] column_is_rowkey:false;[R1] [C6] column_is_signed:true;[R1] [C6] column_encoding:binary;[R1] [C6] column_is_not_null:false;[R1] [C6] column_value_new:[-.123456789](11);[R1] [C6] column_value_old:[12.34](5);[R1] [C7] column_name:C6;[R1] [C7] column_type:MYSQL_TYPE_VAR_STRING;[R1] [C7] column_is_rowkey:false;[R1] [C7] column_is_signed:true;[R1] [C7] column_encoding:utf8mb4;[R1] [C7] column_is_not_null:false;[R1] [C7] column_value_new:[-0.123456789](12);[R1] [C7] column_value_old:[-0.123456789](12);[R1] [C8] column_name:C7;[R1] [C8] column_type:MYSQL_TYPE_STRING;[R1] [C8] column_is_rowkey:false;[R1] [C8] column_is_signed:true;[R1] [C8] column_encoding:utf8mb4;[R1] [C8] column_is_not_null:false;[R1] [C8] column_value_new:[-0.123456789                                                                                        ](100);[R1] [C8] column_value_old:[12.34                                                                                               ](100);$[R2] COMMIT;
update number_1 set c1=c6, c2=c6, c3=c6, c4=c6, c5=c6, c7=c6 where c0 = 172;
select c0, c6, c1, c2, c3, c4, c5, c7 from number_1 where c0 = 172;
C0	C6	C1	C2	C3	C4	C5	C7
172	-0.12345678	-1.2345678E-001	-1.23456784E-001	-.12345678	-.1235	-.12345678	-0.12345678                                                                                         
ob1.oblog.next;
[R0] BEGIN;[R0] org_cluster_id:1;[R1] record_type:UPDATE;[R1] database_name:oracle.OBLOG_DB;[R1] table_name:NUMBER_1;[R1] log_event:true;[R1] column_count:8;[R1] source_category:SRC_FULL_RECORDED;[R1] source_type:SRC_OCEANBASE_1_0;[R1] has_pk:true;[R1] pk_info:(0);[R1] pks:C0;[R1] has_uk:false;[R1] uk_info:(null);[R1] uks:(null);[R1] [C1] column_name:C0;[R1] [C1] column_type:MYSQL_TYPE_NEWDECIMAL;[R1] [C1] column_is_rowkey:true;[R1] [C1] column_is_signed:true;[R1] [C1] column_encoding:binary;[R1] [C1] column_is_not_null:true;[R1] [C1] column_value_new:[172](3);[R1] [C1] column_value_old:[172](3);[R1] [C2] column_name:C1;[R1] [C2] column_type:MYSQL_TYPE_DOUBLE;[R1] [C2] column_is_rowkey:false;[R1] [C2] column_is_signed:true;[R1] [C2] column_encoding:binary;[R1] [C2] column_is_not_null:false;[R1] [C2] column_value_new:[-1.2345678E-001](15);[R1] [C2] column_value_old:[1.234E+001](10);[R1] [C3] column_name:C2;[R1] [C3] column_type:MYSQL_TYPE_FLOAT;[R1] [C3] column_is_rowkey:false;[R1] [C3] column_is_signed:true;[R1] [C3] column_encoding:binary;[R1] [C3] column_is_not_null:false;[R1] [C3] column_value_new:[-1.23456784E-001](16);[R1] [C3] column_value_old:[1.23400002E+001](15);[R1] [C4] column_name:C3;[R1] [C4] column_type:MYSQL_TYPE_NEWDECIMAL;[R1] [C4] column_is_rowkey:false;[R1] [C4] column_is_signed:true;[R1] [C4] column_encoding:binary;[R1] [C4] column_is_not_null:false;[R1] [C4] column_value_new:[-.12345678](10);[R1] [C4] column_value_old:[12.34](5);[R1] [C5] column_name:C4;[R1] [C5] column_type:MYSQL_TYPE_OB_NUMBER_FLOAT;[R1] [C5] column_is_rowkey:false;[R1] [C5] column_is_signed:true;[R1] [C5] column_encoding:binary;[R1] [C5] column_is_not_null:false;[R1] [C5] column_value_new:[-.1235](6);[R1] [C5] column_value_old:[12.34](5);[R1] [C6] column_name:C5;[R1] [C6] column_type:MYSQL_TYPE_OB_NUMBER_FLOAT;[R1] [C6] column_is_rowkey:false;[R1] [C6] column_is_signed:true;[R1] [C6] column_encoding:binary;[R1] [C6] column_is_not_null:false;[R1] [C6] column_value_new:[-.12345678](10);[R1] [C6] column_value_old:[12.34](5);[R1] [C7] column_name:C6;[R1] [C7] column_type:MYSQL_TYPE_VAR_STRING;[R1] [C7] column_is_rowkey:false;[R1] [C7] column_is_signed:true;[R1] [C7] column_encoding:utf8mb4;[R1] [C7] column_is_not_null:false;[R1] [C7] column_value_new:[-0.12345678](11);[R1] [C7] column_value_old:[-0.12345678](11);[R1] [C8] column_name:C7;[R1] [C8] column_type:MYSQL_TYPE_STRING;[R1] [C8] column_is_rowkey:false;[R1] [C8] column_is_signed:true;[R1] [C8] column_encoding:utf8mb4;[R1] [C8] column_is_not_null:false;[R1] [C8] column_value_new:[-0.12345678                                                                                         ](100);[R1] [C8] column_value_old:[12.34                                                                                               ](100);$[R2] COMMIT;
update number_1 set c1=c6, c2=c6, c3=c6, c4=c6, c5=c6, c7=c6 where c0 = 173;
select c0, c6, c1, c2, c3, c4, c5, c7 from number_1 where c0 = 173;
C0	C6	C1	C2	C3	C4	C5	C7
173	-0.1234567	-1.234567E-001	-1.23456702E-001	-.1234567	-.1235	-.1234567	-0.1234567                                                                                          
ob1.oblog.next;
[R0] BEGIN;[R0] org_cluster_id:1;[R1] record_type:UPDATE;[R1] database_name:oracle.OBLOG_DB;[R1] table_name:NUMBER_1;[R1] log_event:true;[R1] column_count:8;[R1] source_category:SRC_FULL_RECORDED;[R1] source_type:SRC_OCEANBASE_1_0;[R1] has_pk:true;[R1] pk_info:(0);[R1] pks:C0;[R1] has_uk:false;[R1] uk_info:(null);[R1] uks:(null);[R1] [C1] column_name:C0;[R1] [C1] column_type:MYSQL_TYPE_NEWDECIMAL;[R1] [C1] column_is_rowkey:true;[R1] [C1] column_is_signed:true;[R1] [C1] column_encoding:binary;[R1] [C1] column_is_not_null:true;[R1] [C1] column_value_new:[173](3);[R1] [C1] column_value_old:[173](3);[R1] [C2] column_name:C1;[R1] [C2] column_type:MYSQL_TYPE_DOUBLE;[R1] [C2] column_is_rowkey:false;[R1] [C2] column_is_signed:true;[R1] [C2] column_encoding:binary;[R1] [C2] column_is_not_null:false;[R1] [C2] column_value_new:[-1.234567E-001](14);[R1] [C2] column_value_old:[1.234E+001](10);[R1] [C3] column_name:C2;[R1] [C3] column_type:MYSQL_TYPE_FLOAT;[R1] [C3] column_is_rowkey:false;[R1] [C3] column_is_signed:true;[R1] [C3] column_encoding:binary;[R1] [C3] column_is_not_null:false;[R1] [C3] column_value_new:[-1.23456702E-001](16);[R1] [C3] column_value_old:[1.23400002E+001](15);[R1] [C4] column_name:C3;[R1] [C4] column_type:MYSQL_TYPE_NEWDECIMAL;[R1] [C4] column_is_rowkey:false;[R1] [C4] column_is_signed:true;[R1] [C4] column_encoding:binary;[R1] [C4] column_is_not_null:false;[R1] [C4] column_value_new:[-.1234567](9);[R1] [C4] column_value_old:[12.34](5);[R1] [C5] column_name:C4;[R1] [C5] column_type:MYSQL_TYPE_OB_NUMBER_FLOAT;[R1] [C5] column_is_rowkey:false;[R1] [C5] column_is_signed:true;[R1] [C5] column_encoding:binary;[R1] [C5] column_is_not_null:false;[R1] [C5] column_value_new:[-.1235](6);[R1] [C5] column_value_old:[12.34](5);[R1] [C6] column_name:C5;[R1] [C6] column_type:MYSQL_TYPE_OB_NUMBER_FLOAT;[R1] [C6] column_is_rowkey:false;[R1] [C6] column_is_signed:true;[R1] [C6] column_encoding:binary;[R1] [C6] column_is_not_null:false;[R1] [C6] column_value_new:[-.1234567](9);[R1] [C6] column_value_old:[12.34](5);[R1] [C7] column_name:C6;[R1] [C7] column_type:MYSQL_TYPE_VAR_STRING;[R1] [C7] column_is_rowkey:false;[R1] [C7] column_is_signed:true;[R1] [C7] column_encoding:utf8mb4;[R1] [C7] column_is_not_null:false;[R1] [C7] column_value_new:[-0.1234567](10);[R1] [C7] column_value_old:[-0.1234567](10);[R1] [C8] column_name:C7;[R1] [C8] column_type:MYSQL_TYPE_STRING;[R1] [C8] column_is_rowkey:false;[R1] [C8] column_is_signed:true;[R1] [C8] column_encoding:utf8mb4;[R1] [C8] column_is_not_null:false;[R1] [C8] column_value_new:[-0.1234567                                                                                          ](100);[R1] [C8] column_value_old:[12.34                                                                                               ](100);$[R2] COMMIT;
update number_1 set c1=c6, c2=c6, c3=c6, c4=c6, c5=c6, c7=c6 where c0 = 174;
select c0, c6, c1, c2, c3, c4, c5, c7 from number_1 where c0 = 174;
C0	C6	C1	C2	C3	C4	C5	C7
174	-0.123456	-1.23456E-001	-1.23456001E-001	-.123456	-.1235	-.123456	-0.123456                                                                                           
ob1.oblog.next;
[R0] BEGIN;[R0] org_cluster_id:1;[R1] record_type:UPDATE;[R1] database_name:oracle.OBLOG_DB;[R1] table_name:NUMBER_1;[R1] log_event:true;[R1] column_count:8;[R1] source_category:SRC_FULL_RECORDED;[R1] source_type:SRC_OCEANBASE_1_0;[R1] has_pk:true;[R1] pk_info:(0);[R1] pks:C0;[R1] has_uk:false;[R1] uk_info:(null);[R1] uks:(null);[R1] [C1] column_name:C0;[R1] [C1] column_type:MYSQL_TYPE_NEWDECIMAL;[R1] [C1] column_is_rowkey:true;[R1] [C1] column_is_signed:true;[R1] [C1] column_encoding:binary;[R1] [C1] column_is_not_null:true;[R1] [C1] column_value_new:[174](3);[R1] [C1] column_value_old:[174](3);[R1] [C2] column_name:C1;[R1] [C2] column_type:MYSQL_TYPE_DOUBLE;[R1] [C2] column_is_rowkey:false;[R1] [C2] column_is_signed:true;[R1] [C2] column_encoding:binary;[R1] [C2] column_is_not_null:false;[R1] [C2] column_value_new:[-1.23456E-001](13);[R1] [C2] column_value_old:[1.234E+001](10);[R1] [C3] column_name:C2;[R1] [C3] column_type:MYSQL_TYPE_FLOAT;[R1] [C3] column_is_rowkey:false;[R1] [C3] column_is_signed:true;[R1] [C3] column_encoding:binary;[R1] [C3] column_is_not_null:false;[R1] [C3] column_value_new:[-1.23456001E-001](16);[R1] [C3] column_value_old:[1.23400002E+001](15);[R1] [C4] column_name:C3;[R1] [C4] column_type:MYSQL_TYPE_NEWDECIMAL;[R1] [C4] column_is_rowkey:false;[R1] [C4] column_is_signed:true;[R1] [C4] column_encoding:binary;[R1] [C4] column_is_not_null:false;[R1] [C4] column_value_new:[-.123456](8);[R1] [C4] column_value_old:[12.34](5);[R1] [C5] column_name:C4;[R1] [C5] column_type:MYSQL_TYPE_OB_NUMBER_FLOAT;[R1] [C5] column_is_rowkey:false;[R1] [C5] column_is_signed:true;[R1] [C5] column_encoding:binary;[R1] [C5] column_is_not_null:false;[R1] [C5] column_value_new:[-.1235](6);[R1] [C5] column_value_old:[12.34](5);[R1] [C6] column_name:C5;[R1] [C6] column_type:MYSQL_TYPE_OB_NUMBER_FLOAT;[R1] [C6] column_is_rowkey:false;[R1] [C6] column_is_signed:true;[R1] [C6] column_encoding:binary;[R1] [C6] column_is_not_null:false;[R1] [C6] column_value_new:[-.123456](8);[R1] [C6] column_value_old:[12.34](5);[R1] [C7] column_name:C6;[R1] [C7] column_type:MYSQL_TYPE_VAR_STRING;[R1] [C7] column_is_rowkey:false;[R1] [C7] column_is_signed:true;[R1] [C7] column_encoding:utf8mb4;[R1] [C7] column_is_not_null:false;[R1] [C7] column_value_new:[-0.123456](9);[R1] [C7] column_value_old:[-0.123456](9);[R1] [C8] column_name:C7;[R1] [C8] column_type:MYSQL_TYPE_STRING;[R1] [C8] column_is_rowkey:false;[R1] [C8] column_is_signed:true;[R1] [C8] column_encoding:utf8mb4;[R1] [C8] column_is_not_null:false;[R1] [C8] column_value_new:[-0.123456                                                                                           ](100);[R1] [C8] column_value_old:[12.34                                                                                               ](100);$[R2] COMMIT;
update number_1 set c1=c6, c2=c6, c3=c6, c4=c6, c5=c6, c7=c6 where c0 = 175;
select c0, c6, c1, c2, c3, c4, c5, c7 from number_1 where c0 = 175;
C0	C6	C1	C2	C3	C4	C5	C7
175	-0.12345	-1.2345E-001	-1.23450004E-001	-.12345	-.1235	-.12345	-0.12345                                                                                            
ob1.oblog.next;
[R0] BEGIN;[R0] org_cluster_id:1;[R1] record_type:UPDATE;[R1] database_name:oracle.OBLOG_DB;[R1] table_name:NUMBER_1;[R1] log_event:true;[R1] column_count:8;[R1] source_category:SRC_FULL_RECORDED;[R1] source_type:SRC_OCEANBASE_1_0;[R1] has_pk:true;[R1] pk_info:(0);[R1] pks:C0;[R1] has_uk:false;[R1] uk_info:(null);[R1] uks:(null);[R1] [C1] column_name:C0;[R1] [C1] column_type:MYSQL_TYPE_NEWDECIMAL;[R1] [C1] column_is_rowkey:true;[R1] [C1] column_is_signed:true;[R1] [C1] column_encoding:binary;[R1] [C1] column_is_not_null:true;[R1] [C1] column_value_new:[175](3);[R1] [C1] column_value_old:[175](3);[R1] [C2] column_name:C1;[R1] [C2] column_type:MYSQL_TYPE_DOUBLE;[R1] [C2] column_is_rowkey:false;[R1] [C2] column_is_signed:true;[R1] [C2] column_encoding:binary;[R1] [C2] column_is_not_null:false;[R1] [C2] column_value_new:[-1.2345E-001](12);[R1] [C2] column_value_old:[1.234E+001](10);[R1] [C3] column_name:C2;[R1] [C3] column_type:MYSQL_TYPE_FLOAT;[R1] [C3] column_is_rowkey:false;[R1] [C3] column_is_signed:true;[R1] [C3] column_encoding:binary;[R1] [C3] column_is_not_null:false;[R1] [C3] column_value_new:[-1.23450004E-001](16);[R1] [C3] column_value_old:[1.23400002E+001](15);[R1] [C4] column_name:C3;[R1] [C4] column_type:MYSQL_TYPE_NEWDECIMAL;[R1] [C4] column_is_rowkey:false;[R1] [C4] column_is_signed:true;[R1] [C4] column_encoding:binary;[R1] [C4] column_is_not_null:false;[R1] [C4] column_value_new:[-.12345](7);[R1] [C4] column_value_old:[12.34](5);[R1] [C5] column_name:C4;[R1] [C5] column_type:MYSQL_TYPE_OB_NUMBER_FLOAT;[R1] [C5] column_is_rowkey:false;[R1] [C5] column_is_signed:true;[R1] [C5] column_encoding:binary;[R1] [C5] column_is_not_null:false;[R1] [C5] column_value_new:[-.1235](6);[R1] [C5] column_value_old:[12.34](5);[R1] [C6] column_name:C5;[R1] [C6] column_type:MYSQL_TYPE_OB_NUMBER_FLOAT;[R1] [C6] column_is_rowkey:false;[R1] [C6] column_is_signed:true;[R1] [C6] column_encoding:binary;[R1] [C6] column_is_not_null:false;[R1] [C6] column_value_new:[-.12345](7);[R1] [C6] column_value_old:[12.34](5);[R1] [C7] column_name:C6;[R1] [C7] column_type:MYSQL_TYPE_VAR_STRING;[R1] [C7] column_is_rowkey:false;[R1] [C7] column_is_signed:true;[R1] [C7] column_encoding:utf8mb4;[R1] [C7] column_is_not_null:false;[R1] [C7] column_value_new:[-0.12345](8);[R1] [C7] column_value_old:[-0.12345](8);[R1] [C8] column_name:C7;[R1] [C8] column_type:MYSQL_TYPE_STRING;[R1] [C8] column_is_rowkey:false;[R1] [C8] column_is_signed:true;[R1] [C8] column_encoding:utf8mb4;[R1] [C8] column_is_not_null:false;[R1] [C8] column_value_new:[-0.12345                                                                                            ](100);[R1] [C8] column_value_old:[12.34                                                                                               ](100);$[R2] COMMIT;
update number_1 set c1=c6, c2=c6, c3=c6, c4=c6, c5=c6, c7=c6 where c0 = 176;
select c0, c6, c1, c2, c3, c4, c5, c7 from number_1 where c0 = 176;
C0	C6	C1	C2	C3	C4	C5	C7
176	-0.1234	-1.234E-001	-1.23400003E-001	-.1234	-.1234	-.1234	-0.1234                                                                                             
ob1.oblog.next;
[R0] BEGIN;[R0] org_cluster_id:1;[R1] record_type:UPDATE;[R1] database_name:oracle.OBLOG_DB;[R1] table_name:NUMBER_1;[R1] log_event:true;[R1] column_count:8;[R1] source_category:SRC_FULL_RECORDED;[R1] source_type:SRC_OCEANBASE_1_0;[R1] has_pk:true;[R1] pk_info:(0);[R1] pks:C0;[R1] has_uk:false;[R1] uk_info:(null);[R1] uks:(null);[R1] [C1] column_name:C0;[R1] [C1] column_type:MYSQL_TYPE_NEWDECIMAL;[R1] [C1] column_is_rowkey:true;[R1] [C1] column_is_signed:true;[R1] [C1] column_encoding:binary;[R1] [C1] column_is_not_null:true;[R1] [C1] column_value_new:[176](3);[R1] [C1] column_value_old:[176](3);[R1] [C2] column_name:C1;[R1] [C2] column_type:MYSQL_TYPE_DOUBLE;[R1] [C2] column_is_rowkey:false;[R1] [C2] column_is_signed:true;[R1] [C2] column_encoding:binary;[R1] [C2] column_is_not_null:false;[R1] [C2] column_value_new:[-1.234E-001](11);[R1] [C2] column_value_old:[1.234E+001](10);[R1] [C3] column_name:C2;[R1] [C3] column_type:MYSQL_TYPE_FLOAT;[R1] [C3] column_is_rowkey:false;[R1] [C3] column_is_signed:true;[R1] [C3] column_encoding:binary;[R1] [C3] column_is_not_null:false;[R1] [C3] column_value_new:[-1.23400003E-001](16);[R1] [C3] column_value_old:[1.23400002E+001](15);[R1] [C4] column_name:C3;[R1] [C4] column_type:MYSQL_TYPE_NEWDECIMAL;[R1] [C4] column_is_rowkey:false;[R1] [C4] column_is_signed:true;[R1] [C4] column_encoding:binary;[R1] [C4] column_is_not_null:false;[R1] [C4] column_value_new:[-.1234](6);[R1] [C4] column_value_old:[12.34](5);[R1] [C5] column_name:C4;[R1] [C5] column_type:MYSQL_TYPE_OB_NUMBER_FLOAT;[R1] [C5] column_is_rowkey:false;[R1] [C5] column_is_signed:true;[R1] [C5] column_encoding:binary;[R1] [C5] column_is_not_null:false;[R1] [C5] column_value_new:[-.1234](6);[R1] [C5] column_value_old:[12.34](5);[R1] [C6] column_name:C5;[R1] [C6] column_type:MYSQL_TYPE_OB_NUMBER_FLOAT;[R1] [C6] column_is_rowkey:false;[R1] [C6] column_is_signed:true;[R1] [C6] column_encoding:binary;[R1] [C6] column_is_not_null:false;[R1] [C6] column_value_new:[-.1234](6);[R1] [C6] column_value_old:[12.34](5);[R1] [C7] column_name:C6;[R1] [C7] column_type:MYSQL_TYPE_VAR_STRING;[R1] [C7] column_is_rowkey:false;[R1] [C7] column_is_signed:true;[R1] [C7] column_encoding:utf8mb4;[R1] [C7] column_is_not_null:false;[R1] [C7] column_value_new:[-0.1234](7);[R1] [C7] column_value_old:[-0.1234](7);[R1] [C8] column_name:C7;[R1] [C8] column_type:MYSQL_TYPE_STRING;[R1] [C8] column_is_rowkey:false;[R1] [C8] column_is_signed:true;[R1] [C8] column_encoding:utf8mb4;[R1] [C8] column_is_not_null:false;[R1] [C8] column_value_new:[-0.1234                                                                                             ](100);[R1] [C8] column_value_old:[12.34                                                                                               ](100);$[R2] COMMIT;
update number_1 set c1=c6, c2=c6, c3=c6, c4=c6, c5=c6, c7=c6 where c0 = 177;
select c0, c6, c1, c2, c3, c4, c5, c7 from number_1 where c0 = 177;
C0	C6	C1	C2	C3	C4	C5	C7
177	-0.123	-1.23E-001	-1.23000003E-001	-.123	-.123	-.123	-0.123                                                                                              
ob1.oblog.next;
[R0] BEGIN;[R0] org_cluster_id:1;[R1] record_type:UPDATE;[R1] database_name:oracle.OBLOG_DB;[R1] table_name:NUMBER_1;[R1] log_event:true;[R1] column_count:8;[R1] source_category:SRC_FULL_RECORDED;[R1] source_type:SRC_OCEANBASE_1_0;[R1] has_pk:true;[R1] pk_info:(0);[R1] pks:C0;[R1] has_uk:false;[R1] uk_info:(null);[R1] uks:(null);[R1] [C1] column_name:C0;[R1] [C1] column_type:MYSQL_TYPE_NEWDECIMAL;[R1] [C1] column_is_rowkey:true;[R1] [C1] column_is_signed:true;[R1] [C1] column_encoding:binary;[R1] [C1] column_is_not_null:true;[R1] [C1] column_value_new:[177](3);[R1] [C1] column_value_old:[177](3);[R1] [C2] column_name:C1;[R1] [C2] column_type:MYSQL_TYPE_DOUBLE;[R1] [C2] column_is_rowkey:false;[R1] [C2] column_is_signed:true;[R1] [C2] column_encoding:binary;[R1] [C2] column_is_not_null:false;[R1] [C2] column_value_new:[-1.23E-001](10);[R1] [C2] column_value_old:[1.234E+001](10);[R1] [C3] column_name:C2;[R1] [C3] column_type:MYSQL_TYPE_FLOAT;[R1] [C3] column_is_rowkey:false;[R1] [C3] column_is_signed:true;[R1] [C3] column_encoding:binary;[R1] [C3] column_is_not_null:false;[R1] [C3] column_value_new:[-1.23000003E-001](16);[R1] [C3] column_value_old:[1.23400002E+001](15);[R1] [C4] column_name:C3;[R1] [C4] column_type:MYSQL_TYPE_NEWDECIMAL;[R1] [C4] column_is_rowkey:false;[R1] [C4] column_is_signed:true;[R1] [C4] column_encoding:binary;[R1] [C4] column_is_not_null:false;[R1] [C4] column_value_new:[-.123](5);[R1] [C4] column_value_old:[12.34](5);[R1] [C5] column_name:C4;[R1] [C5] column_type:MYSQL_TYPE_OB_NUMBER_FLOAT;[R1] [C5] column_is_rowkey:false;[R1] [C5] column_is_signed:true;[R1] [C5] column_encoding:binary;[R1] [C5] column_is_not_null:false;[R1] [C5] column_value_new:[-.123](5);[R1] [C5] column_value_old:[12.34](5);[R1] [C6] column_name:C5;[R1] [C6] column_type:MYSQL_TYPE_OB_NUMBER_FLOAT;[R1] [C6] column_is_rowkey:false;[R1] [C6] column_is_signed:true;[R1] [C6] column_encoding:binary;[R1] [C6] column_is_not_null:false;[R1] [C6] column_value_new:[-.123](5);[R1] [C6] column_value_old:[12.34](5);[R1] [C7] column_name:C6;[R1] [C7] column_type:MYSQL_TYPE_VAR_STRING;[R1] [C7] column_is_rowkey:false;[R1] [C7] column_is_signed:true;[R1] [C7] column_encoding:utf8mb4;[R1] [C7] column_is_not_null:false;[R1] [C7] column_value_new:[-0.123](6);[R1] [C7] column_value_old:[-0.123](6);[R1] [C8] column_name:C7;[R1] [C8] column_type:MYSQL_TYPE_STRING;[R1] [C8] column_is_rowkey:false;[R1] [C8] column_is_signed:true;[R1] [C8] column_encoding:utf8mb4;[R1] [C8] column_is_not_null:false;[R1] [C8] column_value_new:[-0.123                                                                                              ](100);[R1] [C8] column_value_old:[12.34                                                                                               ](100);$[R2] COMMIT;
update number_1 set c1=c6, c2=c6, c3=c6, c4=c6, c5=c6, c7=c6 where c0 = 178;
select c0, c6, c1, c2, c3, c4, c5, c7 from number_1 where c0 = 178;
C0	C6	C1	C2	C3	C4	C5	C7
178	-0.12	-1.2E-001	-1.19999997E-001	-.12	-.12	-.12	-0.12                                                                                               
ob1.oblog.next;
[R0] BEGIN;[R0] org_cluster_id:1;[R1] record_type:UPDATE;[R1] database_name:oracle.OBLOG_DB;[R1] table_name:NUMBER_1;[R1] log_event:true;[R1] column_count:8;[R1] source_category:SRC_FULL_RECORDED;[R1] source_type:SRC_OCEANBASE_1_0;[R1] has_pk:true;[R1] pk_info:(0);[R1] pks:C0;[R1] has_uk:false;[R1] uk_info:(null);[R1] uks:(null);[R1] [C1] column_name:C0;[R1] [C1] column_type:MYSQL_TYPE_NEWDECIMAL;[R1] [C1] column_is_rowkey:true;[R1] [C1] column_is_signed:true;[R1] [C1] column_encoding:binary;[R1] [C1] column_is_not_null:true;[R1] [C1] column_value_new:[178](3);[R1] [C1] column_value_old:[178](3);[R1] [C2] column_name:C1;[R1] [C2] column_type:MYSQL_TYPE_DOUBLE;[R1] [C2] column_is_rowkey:false;[R1] [C2] column_is_signed:true;[R1] [C2] column_encoding:binary;[R1] [C2] column_is_not_null:false;[R1] [C2] column_value_new:[-1.2E-001](9);[R1] [C2] column_value_old:[1.234E+001](10);[R1] [C3] column_name:C2;[R1] [C3] column_type:MYSQL_TYPE_FLOAT;[R1] [C3] column_is_rowkey:false;[R1] [C3] column_is_signed:true;[R1] [C3] column_encoding:binary;[R1] [C3] column_is_not_null:false;[R1] [C3] column_value_new:[-1.19999997E-001](16);[R1] [C3] column_value_old:[1.23400002E+001](15);[R1] [C4] column_name:C3;[R1] [C4] column_type:MYSQL_TYPE_NEWDECIMAL;[R1] [C4] column_is_rowkey:false;[R1] [C4] column_is_signed:true;[R1] [C4] column_encoding:binary;[R1] [C4] column_is_not_null:false;[R1] [C4] column_value_new:[-.12](4);[R1] [C4] column_value_old:[12.34](5);[R1] [C5] column_name:C4;[R1] [C5] column_type:MYSQL_TYPE_OB_NUMBER_FLOAT;[R1] [C5] column_is_rowkey:false;[R1] [C5] column_is_signed:true;[R1] [C5] column_encoding:binary;[R1] [C5] column_is_not_null:false;[R1] [C5] column_value_new:[-.12](4);[R1] [C5] column_value_old:[12.34](5);[R1] [C6] column_name:C5;[R1] [C6] column_type:MYSQL_TYPE_OB_NUMBER_FLOAT;[R1] [C6] column_is_rowkey:false;[R1] [C6] column_is_signed:true;[R1] [C6] column_encoding:binary;[R1] [C6] column_is_not_null:false;[R1] [C6] column_value_new:[-.12](4);[R1] [C6] column_value_old:[12.34](5);[R1] [C7] column_name:C6;[R1] [C7] column_type:MYSQL_TYPE_VAR_STRING;[R1] [C7] column_is_rowkey:false;[R1] [C7] column_is_signed:true;[R1] [C7] column_encoding:utf8mb4;[R1] [C7] column_is_not_null:false;[R1] [C7] column_value_new:[-0.12](5);[R1] [C7] column_value_old:[-0.12](5);[R1] [C8] column_name:C7;[R1] [C8] column_type:MYSQL_TYPE_STRING;[R1] [C8] column_is_rowkey:false;[R1] [C8] column_is_signed:true;[R1] [C8] column_encoding:utf8mb4;[R1] [C8] column_is_not_null:false;[R1] [C8] column_value_new:[-0.12                                                                                               ](100);[R1] [C8] column_value_old:[12.34                                                                                               ](100);$[R2] COMMIT;
update number_1 set c1=c6, c2=c6, c3=c6, c4=c6, c5=c6, c7=c6 where c0 = 179;
select c0, c6, c1, c2, c3, c4, c5, c7 from number_1 where c0 = 179;
C0	C6	C1	C2	C3	C4	C5	C7
179	-0.1	-1.0000000000000001E-001	-1.00000001E-001	-.1	-.1	-.1	-0.1                                                                                                
ob1.oblog.next;
[R0] BEGIN;[R0] org_cluster_id:1;[R1] record_type:UPDATE;[R1] database_name:oracle.OBLOG_DB;[R1] table_name:NUMBER_1;[R1] log_event:true;[R1] column_count:8;[R1] source_category:SRC_FULL_RECORDED;[R1] source_type:SRC_OCEANBASE_1_0;[R1] has_pk:true;[R1] pk_info:(0);[R1] pks:C0;[R1] has_uk:false;[R1] uk_info:(null);[R1] uks:(null);[R1] [C1] column_name:C0;[R1] [C1] column_type:MYSQL_TYPE_NEWDECIMAL;[R1] [C1] column_is_rowkey:true;[R1] [C1] column_is_signed:true;[R1] [C1] column_encoding:binary;[R1] [C1] column_is_not_null:true;[R1] [C1] column_value_new:[179](3);[R1] [C1] column_value_old:[179](3);[R1] [C2] column_name:C1;[R1] [C2] column_type:MYSQL_TYPE_DOUBLE;[R1] [C2] column_is_rowkey:false;[R1] [C2] column_is_signed:true;[R1] [C2] column_encoding:binary;[R1] [C2] column_is_not_null:false;[R1] [C2] column_value_new:[-1.0000000000000001E-001](24);[R1] [C2] column_value_old:[1.234E+001](10);[R1] [C3] column_name:C2;[R1] [C3] column_type:MYSQL_TYPE_FLOAT;[R1] [C3] column_is_rowkey:false;[R1] [C3] column_is_signed:true;[R1] [C3] column_encoding:binary;[R1] [C3] column_is_not_null:false;[R1] [C3] column_value_new:[-1.00000001E-001](16);[R1] [C3] column_value_old:[1.23400002E+001](15);[R1] [C4] column_name:C3;[R1] [C4] column_type:MYSQL_TYPE_NEWDECIMAL;[R1] [C4] column_is_rowkey:false;[R1] [C4] column_is_signed:true;[R1] [C4] column_encoding:binary;[R1] [C4] column_is_not_null:false;[R1] [C4] column_value_new:[-.1](3);[R1] [C4] column_value_old:[12.34](5);[R1] [C5] column_name:C4;[R1] [C5] column_type:MYSQL_TYPE_OB_NUMBER_FLOAT;[R1] [C5] column_is_rowkey:false;[R1] [C5] column_is_signed:true;[R1] [C5] column_encoding:binary;[R1] [C5] column_is_not_null:false;[R1] [C5] column_value_new:[-.1](3);[R1] [C5] column_value_old:[12.34](5);[R1] [C6] column_name:C5;[R1] [C6] column_type:MYSQL_TYPE_OB_NUMBER_FLOAT;[R1] [C6] column_is_rowkey:false;[R1] [C6] column_is_signed:true;[R1] [C6] column_encoding:binary;[R1] [C6] column_is_not_null:false;[R1] [C6] column_value_new:[-.1](3);[R1] [C6] column_value_old:[12.34](5);[R1] [C7] column_name:C6;[R1] [C7] column_type:MYSQL_TYPE_VAR_STRING;[R1] [C7] column_is_rowkey:false;[R1] [C7] column_is_signed:true;[R1] [C7] column_encoding:utf8mb4;[R1] [C7] column_is_not_null:false;[R1] [C7] column_value_new:[-0.1](4);[R1] [C7] column_value_old:[-0.1](4);[R1] [C8] column_name:C7;[R1] [C8] column_type:MYSQL_TYPE_STRING;[R1] [C8] column_is_rowkey:false;[R1] [C8] column_is_signed:true;[R1] [C8] column_encoding:utf8mb4;[R1] [C8] column_is_not_null:false;[R1] [C8] column_value_new:[-0.1                                                                                                ](100);[R1] [C8] column_value_old:[12.34                                                                                               ](100);$[R2] COMMIT;
update number_1 set c1=c6, c2=c6, c3=c6, c4=c6, c5=c6, c7=c6 where c0 = 180;
select c0, c6, c1, c2, c3, c4, c5, c7 from number_1 where c0 = 180;
C0	C6	C1	C2	C3	C4	C5	C7
180	1.23e30	1.23E+030	1.22999997E+030	1230000000000000000000000000000	1230000000000000000000000000000	1230000000000000000000000000000	1.23e30                                                                                             
ob1.oblog.next;
[R0] BEGIN;[R0] org_cluster_id:1;[R1] record_type:UPDATE;[R1] database_name:oracle.OBLOG_DB;[R1] table_name:NUMBER_1;[R1] log_event:true;[R1] column_count:8;[R1] source_category:SRC_FULL_RECORDED;[R1] source_type:SRC_OCEANBASE_1_0;[R1] has_pk:true;[R1] pk_info:(0);[R1] pks:C0;[R1] has_uk:false;[R1] uk_info:(null);[R1] uks:(null);[R1] [C1] column_name:C0;[R1] [C1] column_type:MYSQL_TYPE_NEWDECIMAL;[R1] [C1] column_is_rowkey:true;[R1] [C1] column_is_signed:true;[R1] [C1] column_encoding:binary;[R1] [C1] column_is_not_null:true;[R1] [C1] column_value_new:[180](3);[R1] [C1] column_value_old:[180](3);[R1] [C2] column_name:C1;[R1] [C2] column_type:MYSQL_TYPE_DOUBLE;[R1] [C2] column_is_rowkey:false;[R1] [C2] column_is_signed:true;[R1] [C2] column_encoding:binary;[R1] [C2] column_is_not_null:false;[R1] [C2] column_value_new:[1.23E+030](9);[R1] [C2] column_value_old:[1.234E+001](10);[R1] [C3] column_name:C2;[R1] [C3] column_type:MYSQL_TYPE_FLOAT;[R1] [C3] column_is_rowkey:false;[R1] [C3] column_is_signed:true;[R1] [C3] column_encoding:binary;[R1] [C3] column_is_not_null:false;[R1] [C3] column_value_new:[1.22999997E+030](15);[R1] [C3] column_value_old:[1.23400002E+001](15);[R1] [C4] column_name:C3;[R1] [C4] column_type:MYSQL_TYPE_NEWDECIMAL;[R1] [C4] column_is_rowkey:false;[R1] [C4] column_is_signed:true;[R1] [C4] column_encoding:binary;[R1] [C4] column_is_not_null:false;[R1] [C4] column_value_new:[1230000000000000000000000000000](31);[R1] [C4] column_value_old:[12.34](5);[R1] [C5] column_name:C4;[R1] [C5] column_type:MYSQL_TYPE_OB_NUMBER_FLOAT;[R1] [C5] column_is_rowkey:false;[R1] [C5] column_is_signed:true;[R1] [C5] column_encoding:binary;[R1] [C5] column_is_not_null:false;[R1] [C5] column_value_new:[1230000000000000000000000000000](31);[R1] [C5] column_value_old:[12.34](5);[R1] [C6] column_name:C5;[R1] [C6] column_type:MYSQL_TYPE_OB_NUMBER_FLOAT;[R1] [C6] column_is_rowkey:false;[R1] [C6] column_is_signed:true;[R1] [C6] column_encoding:binary;[R1] [C6] column_is_not_null:false;[R1] [C6] column_value_new:[1230000000000000000000000000000](31);[R1] [C6] column_value_old:[12.34](5);[R1] [C7] column_name:C6;[R1] [C7] column_type:MYSQL_TYPE_VAR_STRING;[R1] [C7] column_is_rowkey:false;[R1] [C7] column_is_signed:true;[R1] [C7] column_encoding:utf8mb4;[R1] [C7] column_is_not_null:false;[R1] [C7] column_value_new:[1.23e30](7);[R1] [C7] column_value_old:[1.23e30](7);[R1] [C8] column_name:C7;[R1] [C8] column_type:MYSQL_TYPE_STRING;[R1] [C8] column_is_rowkey:false;[R1] [C8] column_is_signed:true;[R1] [C8] column_encoding:utf8mb4;[R1] [C8] column_is_not_null:false;[R1] [C8] column_value_new:[1.23e30                                                                                             ](100);[R1] [C8] column_value_old:[12.34                                                                                               ](100);$[R2] COMMIT;
update number_1 set c1=c6, c2=c6, c3=c6, c4=c6, c5=c6, c7=c6 where c0 = 181;
select c0, c6, c1, c2, c3, c4, c5, c7 from number_1 where c0 = 181;
C0	C6	C1	C2	C3	C4	C5	C7
181	1.23e-30	1.2300000000000001E-030	1.22999995E-030	.00000000000000000000000000000123	.00000000000000000000000000000123	.00000000000000000000000000000123	1.23e-30                                                                                            
ob1.oblog.next;
[R0] BEGIN;[R0] org_cluster_id:1;[R1] record_type:UPDATE;[R1] database_name:oracle.OBLOG_DB;[R1] table_name:NUMBER_1;[R1] log_event:true;[R1] column_count:8;[R1] source_category:SRC_FULL_RECORDED;[R1] source_type:SRC_OCEANBASE_1_0;[R1] has_pk:true;[R1] pk_info:(0);[R1] pks:C0;[R1] has_uk:false;[R1] uk_info:(null);[R1] uks:(null);[R1] [C1] column_name:C0;[R1] [C1] column_type:MYSQL_TYPE_NEWDECIMAL;[R1] [C1] column_is_rowkey:true;[R1] [C1] column_is_signed:true;[R1] [C1] column_encoding:binary;[R1] [C1] column_is_not_null:true;[R1] [C1] column_value_new:[181](3);[R1] [C1] column_value_old:[181](3);[R1] [C2] column_name:C1;[R1] [C2] column_type:MYSQL_TYPE_DOUBLE;[R1] [C2] column_is_rowkey:false;[R1] [C2] column_is_signed:true;[R1] [C2] column_encoding:binary;[R1] [C2] column_is_not_null:false;[R1] [C2] column_value_new:[1.2300000000000001E-030](23);[R1] [C2] column_value_old:[1.234E+001](10);[R1] [C3] column_name:C2;[R1] [C3] column_type:MYSQL_TYPE_FLOAT;[R1] [C3] column_is_rowkey:false;[R1] [C3] column_is_signed:true;[R1] [C3] column_encoding:binary;[R1] [C3] column_is_not_null:false;[R1] [C3] column_value_new:[1.22999995E-030](15);[R1] [C3] column_value_old:[1.23400002E+001](15);[R1] [C4] column_name:C3;[R1] [C4] column_type:MYSQL_TYPE_NEWDECIMAL;[R1] [C4] column_is_rowkey:false;[R1] [C4] column_is_signed:true;[R1] [C4] column_encoding:binary;[R1] [C4] column_is_not_null:false;[R1] [C4] column_value_new:[.00000000000000000000000000000123](33);[R1] [C4] column_value_old:[12.34](5);[R1] [C5] column_name:C4;[R1] [C5] column_type:MYSQL_TYPE_OB_NUMBER_FLOAT;[R1] [C5] column_is_rowkey:false;[R1] [C5] column_is_signed:true;[R1] [C5] column_encoding:binary;[R1] [C5] column_is_not_null:false;[R1] [C5] column_value_new:[.00000000000000000000000000000123](33);[R1] [C5] column_value_old:[12.34](5);[R1] [C6] column_name:C5;[R1] [C6] column_type:MYSQL_TYPE_OB_NUMBER_FLOAT;[R1] [C6] column_is_rowkey:false;[R1] [C6] column_is_signed:true;[R1] [C6] column_encoding:binary;[R1] [C6] column_is_not_null:false;[R1] [C6] column_value_new:[.00000000000000000000000000000123](33);[R1] [C6] column_value_old:[12.34](5);[R1] [C7] column_name:C6;[R1] [C7] column_type:MYSQL_TYPE_VAR_STRING;[R1] [C7] column_is_rowkey:false;[R1] [C7] column_is_signed:true;[R1] [C7] column_encoding:utf8mb4;[R1] [C7] column_is_not_null:false;[R1] [C7] column_value_new:[1.23e-30](8);[R1] [C7] column_value_old:[1.23e-30](8);[R1] [C8] column_name:C7;[R1] [C8] column_type:MYSQL_TYPE_STRING;[R1] [C8] column_is_rowkey:false;[R1] [C8] column_is_signed:true;[R1] [C8] column_encoding:utf8mb4;[R1] [C8] column_is_not_null:false;[R1] [C8] column_value_new:[1.23e-30                                                                                            ](100);[R1] [C8] column_value_old:[12.34                                                                                               ](100);$[R2] COMMIT;
update number_1 set c1=c6, c2=c6, c3=c6, c4=c6, c5=c6, c7=c6 where c0 = 182;
select c0, c6, c1, c2, c3, c4, c5, c7 from number_1 where c0 = 182;
C0	C6	C1	C2	C3	C4	C5	C7
182	1.23456789123456789123456789123456789123456789	1.2345678912345679E+000	1.23456788E+000	1.23456789123456789123456789123456789123	1.235	1.2345678912345678912345678912345678912	1.23456789123456789123456789123456789123456789                                                      
ob1.oblog.next;
[R0] BEGIN;[R0] org_cluster_id:1;[R1] record_type:UPDATE;[R1] database_name:oracle.OBLOG_DB;[R1] table_name:NUMBER_1;[R1] log_event:true;[R1] column_count:8;[R1] source_category:SRC_FULL_RECORDED;[R1] source_type:SRC_OCEANBASE_1_0;[R1] has_pk:true;[R1] pk_info:(0);[R1] pks:C0;[R1] has_uk:false;[R1] uk_info:(null);[R1] uks:(null);[R1] [C1] column_name:C0;[R1] [C1] column_type:MYSQL_TYPE_NEWDECIMAL;[R1] [C1] column_is_rowkey:true;[R1] [C1] column_is_signed:true;[R1] [C1] column_encoding:binary;[R1] [C1] column_is_not_null:true;[R1] [C1] column_value_new:[182](3);[R1] [C1] column_value_old:[182](3);[R1] [C2] column_name:C1;[R1] [C2] column_type:MYSQL_TYPE_DOUBLE;[R1] [C2] column_is_rowkey:false;[R1] [C2] column_is_signed:true;[R1] [C2] column_encoding:binary;[R1] [C2] column_is_not_null:false;[R1] [C2] column_value_new:[1.2345678912345679E+000](23);[R1] [C2] column_value_old:[1.234E+001](10);[R1] [C3] column_name:C2;[R1] [C3] column_type:MYSQL_TYPE_FLOAT;[R1] [C3] column_is_rowkey:false;[R1] [C3] column_is_signed:true;[R1] [C3] column_encoding:binary;[R1] [C3] column_is_not_null:false;[R1] [C3] column_value_new:[1.23456788E+000](15);[R1] [C3] column_value_old:[1.23400002E+001](15);[R1] [C4] column_name:C3;[R1] [C4] column_type:MYSQL_TYPE_NEWDECIMAL;[R1] [C4] column_is_rowkey:false;[R1] [C4] column_is_signed:true;[R1] [C4] column_encoding:binary;[R1] [C4] column_is_not_null:false;[R1] [C4] column_value_new:[1.23456789123456789123456789123456789123](40);[R1] [C4] column_value_old:[12.34](5);[R1] [C5] column_name:C4;[R1] [C5] column_type:MYSQL_TYPE_OB_NUMBER_FLOAT;[R1] [C5] column_is_rowkey:false;[R1] [C5] column_is_signed:true;[R1] [C5] column_encoding:binary;[R1] [C5] column_is_not_null:false;[R1] [C5] column_value_new:[1.235](5);[R1] [C5] column_value_old:[12.34](5);[R1] [C6] column_name:C5;[R1] [C6] column_type:MYSQL_TYPE_OB_NUMBER_FLOAT;[R1] [C6] column_is_rowkey:false;[R1] [C6] column_is_signed:true;[R1] [C6] column_encoding:binary;[R1] [C6] column_is_not_null:false;[R1] [C6] column_value_new:[1.2345678912345678912345678912345678912](39);[R1] [C6] column_value_old:[12.34](5);[R1] [C7] column_name:C6;[R1] [C7] column_type:MYSQL_TYPE_VAR_STRING;[R1] [C7] column_is_rowkey:false;[R1] [C7] column_is_signed:true;[R1] [C7] column_encoding:utf8mb4;[R1] [C7] column_is_not_null:false;[R1] [C7] column_value_new:[1.23456789123456789123456789123456789123456789](46);[R1] [C7] column_value_old:[1.23456789123456789123456789123456789123456789](46);[R1] [C8] column_name:C7;[R1] [C8] column_type:MYSQL_TYPE_STRING;[R1] [C8] column_is_rowkey:false;[R1] [C8] column_is_signed:true;[R1] [C8] column_encoding:utf8mb4;[R1] [C8] column_is_not_null:false;[R1] [C8] column_value_new:[1.23456789123456789123456789123456789123456789                                                      ](100);[R1] [C8] column_value_old:[12.34                                                                                               ](100);$[R2] COMMIT;
select c0, c6, c1, c2, c3, c4, c5, c7 from number_1;
C0	C6	C1	C2	C3	C4	C5	C7
19	0	0	0	0	0	0	0                                                                                                   
20	0.0	0	0	0	0	0	0.0                                                                                                 
21	1	1.0E+000	1.0E+000	1	1	1	1                                                                                                   
22	12	1.2E+001	1.2E+001	12	12	12	12                                                                                                  
23	123	1.23E+002	1.23E+002	123	123	123	123                                                                                                 
24	1234	1.234E+003	1.234E+003	1234	1234	1234	1234                                                                                                
25	12345	1.2345E+004	1.2345E+004	12345	12350	12345	12345                                                                                               
26	123456	1.23456E+005	1.23456E+005	123456	123500	123456	123456                                                                                              
27	1234567	1.234567E+006	1.234567E+006	1234567	1235000	1234567	1234567                                                                                             
28	12345678	1.2345678E+007	1.2345678E+007	12345678	12350000	12345678	12345678                                                                                            
29	123456789	1.23456789E+008	1.23456792E+008	123456789	123500000	123456789	123456789                                                                                           
30	1234567890	1.23456789E+009	1.23456794E+009	1234567890	1235000000	1234567890	1234567890                                                                                          
31	12345678901	1.2345678901E+010	1.23456788E+010	12345678901	12350000000	12345678901	12345678901                                                                                         
32	123456789012	1.23456789012E+011	1.23456791E+011	123456789012	123500000000	123456789012	123456789012                                                                                        
33	1234567890123	1.234567890123E+012	1.23456795E+012	1234567890123	1235000000000	1234567890123	1234567890123                                                                                       
34	12345678901234	1.2345678901234E+013	1.2345679E+013	12345678901234	12350000000000	12345678901234	12345678901234                                                                                      
35	123456789012345	1.23456789012345E+014	1.23456788E+014	123456789012345	123500000000000	123456789012345	123456789012345                                                                                     
36	1234567890123456	1.234567890123456E+015	1.23456795E+015	1234567890123456	1235000000000000	1234567890123456	1234567890123456                                                                                    
37	12345678901234567	1.2345678901234568E+016	1.23456784E+016	12345678901234567	12350000000000000	12345678901234567	12345678901234567                                                                                   
38	123456789012345678	1.2345678901234568E+017	1.23456791E+017	123456789012345678	123500000000000000	123456789012345678	123456789012345678                                                                                  
39	1234567890123456789	1.2345678901234568E+018	1.23456794E+018	1234567890123456789	1235000000000000000	1234567890123456789	1234567890123456789                                                                                 
40	12345678901234567890	1.2345678901234567E+019	1.23456794E+019	12345678901234567890	12350000000000000000	12345678901234567890	12345678901234567890                                                                                
41	1234567890123456789.0	1.2345678901234568E+018	1.23456794E+018	1234567890123456789	1235000000000000000	1234567890123456789	1234567890123456789.0                                                                               
42	123456789012345678.90	1.2345678901234568E+017	1.23456791E+017	123456789012345678.9	123500000000000000	123456789012345678.9	123456789012345678.90                                                                               
43	12345678901234567.890	1.2345678901234568E+016	1.23456784E+016	12345678901234567.89	12350000000000000	12345678901234567.89	12345678901234567.890                                                                               
44	1234567890123456.7890	1.2345678901234568E+015	1.23456795E+015	1234567890123456.789	1235000000000000	1234567890123456.789	1234567890123456.7890                                                                               
45	123456789012345.67890	1.2345678901234567E+014	1.23456788E+014	123456789012345.6789	123500000000000	123456789012345.6789	123456789012345.67890                                                                               
46	12345678901234.567890	1.2345678901234568E+013	1.2345679E+013	12345678901234.56789	12350000000000	12345678901234.56789	12345678901234.567890                                                                               
47	1234567890123.4567890	1.2345678901234568E+012	1.23456795E+012	1234567890123.456789	1235000000000	1234567890123.456789	1234567890123.4567890                                                                               
48	123456789012.34567890	1.2345678901234567E+011	1.23456791E+011	123456789012.3456789	123500000000	123456789012.3456789	123456789012.34567890                                                                               
49	12345678901.234567890	1.2345678901234568E+010	1.23456788E+010	12345678901.23456789	12350000000	12345678901.23456789	12345678901.234567890                                                                               
50	1234567890.1234567890	1.2345678901234567E+009	1.23456794E+009	1234567890.123456789	1235000000	1234567890.123456789	1234567890.1234567890                                                                               
51	123456789.01234567890	1.2345678901234567E+008	1.23456792E+008	123456789.0123456789	123500000	123456789.0123456789	123456789.01234567890                                                                               
52	12345678.901234567890	1.2345678901234567E+007	1.2345679E+007	12345678.90123456789	12350000	12345678.90123456789	12345678.901234567890                                                                               
53	1234567.8901234567890	1.2345678901234567E+006	1.23456788E+006	1234567.890123456789	1235000	1234567.890123456789	1234567.8901234567890                                                                               
54	123456.78901234567890	1.2345678901234567E+005	1.23456789E+005	123456.7890123456789	123500	123456.7890123456789	123456.78901234567890                                                                               
55	12345.678901234567890	1.2345678901234567E+004	1.23456787E+004	12345.67890123456789	12350	12345.67890123456789	12345.678901234567890                                                                               
56	1234.5678901234567890	1.2345678901234569E+003	1.23456787E+003	1234.567890123456789	1235	1234.567890123456789	1234.5678901234567890                                                                               
57	123.45678901234567890	1.2345678901234568E+002	1.23456787E+002	123.4567890123456789	123.5	123.4567890123456789	123.45678901234567890                                                                               
58	12.345678901234567890	1.2345678901234567E+001	1.23456793E+001	12.34567890123456789	12.35	12.34567890123456789	12.345678901234567890                                                                               
59	1.2345678901234567890	1.2345678901234567E+000	1.23456788E+000	1.234567890123456789	1.235	1.234567890123456789	1.2345678901234567890                                                                               
60	0.1234567890123456789	1.2345678901234568E-001	1.23456791E-001	.1234567890123456789	.1235	.1234567890123456789	0.1234567890123456789                                                                               
61	0.1234567890123456789	1.2345678901234568E-001	1.23456791E-001	.1234567890123456789	.1235	.1234567890123456789	0.1234567890123456789                                                                               
62	0.123456789012345678	1.2345678901234568E-001	1.23456791E-001	.123456789012345678	.1235	.123456789012345678	0.123456789012345678                                                                                
63	0.12345678901234567	1.2345678901234566E-001	1.23456791E-001	.12345678901234567	.1235	.12345678901234567	0.12345678901234567                                                                                 
64	0.1234567890123456	1.2345678901234559E-001	1.23456791E-001	.1234567890123456	.1235	.1234567890123456	0.1234567890123456                                                                                  
65	0.123456789012345	1.23456789012345E-001	1.23456791E-001	.123456789012345	.1235	.123456789012345	0.123456789012345                                                                                   
66	0.12345678901234	1.2345678901234E-001	1.23456791E-001	.12345678901234	.1235	.12345678901234	0.12345678901234                                                                                    
67	0.1234567890123	1.2345678901230001E-001	1.23456791E-001	.1234567890123	.1235	.1234567890123	0.1234567890123                                                                                     
68	0.123456789012	1.23456789012E-001	1.23456791E-001	.123456789012	.1235	.123456789012	0.123456789012                                                                                      
69	0.12345678901	1.2345678901E-001	1.23456791E-001	.12345678901	.1235	.12345678901	0.12345678901                                                                                       
70	0.1234567890	1.23456789E-001	1.23456791E-001	.123456789	.1235	.123456789	0.1234567890                                                                                        
71	0.123456789	1.23456789E-001	1.23456791E-001	.123456789	.1235	.123456789	0.123456789                                                                                         
72	0.12345678	1.2345678E-001	1.23456784E-001	.12345678	.1235	.12345678	0.12345678                                                                                          
73	0.1234567	1.234567E-001	1.23456702E-001	.1234567	.1235	.1234567	0.1234567                                                                                           
74	0.123456	1.23456E-001	1.23456001E-001	.123456	.1235	.123456	0.123456                                                                                            
75	0.12345	1.2345E-001	1.23450004E-001	.12345	.1235	.12345	0.12345                                                                                             
76	0.1234	1.234E-001	1.23400003E-001	.1234	.1234	.1234	0.1234                                                                                              
77	0.123	1.23E-001	1.23000003E-001	.123	.123	.123	0.123                                                                                               
78	0.12	1.2E-001	1.19999997E-001	.12	.12	.12	0.12                                                                                                
79	0.1	1.0000000000000001E-001	1.00000001E-001	.1	.1	.1	0.1                                                                                                 
80	1.23e30	1.23E+030	1.22999997E+030	1230000000000000000000000000000	1230000000000000000000000000000	1230000000000000000000000000000	1.23e30                                                                                             
81	1.23e-30	1.2300000000000001E-030	1.22999995E-030	.00000000000000000000000000000123	.00000000000000000000000000000123	.00000000000000000000000000000123	1.23e-30                                                                                            
82	1.23456789123456789123456789123456789123456789	1.2345678912345679E+000	1.23456788E+000	1.23456789123456789123456789123456789123	1.235	1.2345678912345678912345678912345678912	1.23456789123456789123456789123456789123456789                                                      
119	-0	0	0	0	0	0	-0                                                                                                  
120	-0.0	0	0	0	0	0	-0.0                                                                                                
121	-1	-1.0E+000	-1.0E+000	-1	-1	-1	-1                                                                                                  
122	-12	-1.2E+001	-1.2E+001	-12	-12	-12	-12                                                                                                 
123	-123	-1.23E+002	-1.23E+002	-123	-123	-123	-123                                                                                                
124	-1234	-1.234E+003	-1.234E+003	-1234	-1234	-1234	-1234                                                                                               
125	-12345	-1.2345E+004	-1.2345E+004	-12345	-12350	-12345	-12345                                                                                              
126	-123456	-1.23456E+005	-1.23456E+005	-123456	-123500	-123456	-123456                                                                                             
127	-1234567	-1.234567E+006	-1.234567E+006	-1234567	-1235000	-1234567	-1234567                                                                                            
128	-12345678	-1.2345678E+007	-1.2345678E+007	-12345678	-12350000	-12345678	-12345678                                                                                           
129	-123456789	-1.23456789E+008	-1.23456792E+008	-123456789	-123500000	-123456789	-123456789                                                                                          
130	-1234567890	-1.23456789E+009	-1.23456794E+009	-1234567890	-1235000000	-1234567890	-1234567890                                                                                         
131	-12345678901	-1.2345678901E+010	-1.23456788E+010	-12345678901	-12350000000	-12345678901	-12345678901                                                                                        
132	-123456789012	-1.23456789012E+011	-1.23456791E+011	-123456789012	-123500000000	-123456789012	-123456789012                                                                                       
133	-1234567890123	-1.234567890123E+012	-1.23456795E+012	-1234567890123	-1235000000000	-1234567890123	-1234567890123                                                                                      
134	-12345678901234	-1.2345678901234E+013	-1.2345679E+013	-12345678901234	-12350000000000	-12345678901234	-12345678901234                                                                                     
135	-123456789012345	-1.23456789012345E+014	-1.23456788E+014	-123456789012345	-123500000000000	-123456789012345	-123456789012345                                                                                    
136	-1234567890123456	-1.234567890123456E+015	-1.23456795E+015	-1234567890123456	-1235000000000000	-1234567890123456	-1234567890123456                                                                                   
137	-12345678901234567	-1.2345678901234568E+016	-1.23456784E+016	-12345678901234567	-12350000000000000	-12345678901234567	-12345678901234567                                                                                  
138	-123456789012345678	-1.2345678901234568E+017	-1.23456791E+017	-123456789012345678	-123500000000000000	-123456789012345678	-123456789012345678                                                                                 
139	-1234567890123456789	-1.2345678901234568E+018	-1.23456794E+018	-1234567890123456789	-1235000000000000000	-1234567890123456789	-1234567890123456789                                                                                
140	-12345678901234567890	-1.2345678901234567E+019	-1.23456794E+019	-12345678901234567890	-12350000000000000000	-12345678901234567890	-12345678901234567890                                                                               
141	-1234567890123456789.0	-1.2345678901234568E+018	-1.23456794E+018	-1234567890123456789	-1235000000000000000	-1234567890123456789	-1234567890123456789.0                                                                              
142	-123456789012345678.90	-1.2345678901234568E+017	-1.23456791E+017	-123456789012345678.9	-123500000000000000	-123456789012345678.9	-123456789012345678.90                                                                              
143	-12345678901234567.890	-1.2345678901234568E+016	-1.23456784E+016	-12345678901234567.89	-12350000000000000	-12345678901234567.89	-12345678901234567.890                                                                              
144	-1234567890123456.7890	-1.2345678901234568E+015	-1.23456795E+015	-1234567890123456.789	-1235000000000000	-1234567890123456.789	-1234567890123456.7890                                                                              
145	-123456789012345.67890	-1.2345678901234567E+014	-1.23456788E+014	-123456789012345.6789	-123500000000000	-123456789012345.6789	-123456789012345.67890                                                                              
146	-12345678901234.567890	-1.2345678901234568E+013	-1.2345679E+013	-12345678901234.56789	-12350000000000	-12345678901234.56789	-12345678901234.567890                                                                              
147	-1234567890123.4567890	-1.2345678901234568E+012	-1.23456795E+012	-1234567890123.456789	-1235000000000	-1234567890123.456789	-1234567890123.4567890                                                                              
148	-123456789012.34567890	-1.2345678901234567E+011	-1.23456791E+011	-123456789012.3456789	-123500000000	-123456789012.3456789	-123456789012.34567890                                                                              
149	-12345678901.234567890	-1.2345678901234568E+010	-1.23456788E+010	-12345678901.23456789	-12350000000	-12345678901.23456789	-12345678901.234567890                                                                              
150	-1234567890.1234567890	-1.2345678901234567E+009	-1.23456794E+009	-1234567890.123456789	-1235000000	-1234567890.123456789	-1234567890.1234567890                                                                              
151	-123456789.01234567890	-1.2345678901234567E+008	-1.23456792E+008	-123456789.0123456789	-123500000	-123456789.0123456789	-123456789.01234567890                                                                              
152	-12345678.901234567890	-1.2345678901234567E+007	-1.2345679E+007	-12345678.90123456789	-12350000	-12345678.90123456789	-12345678.901234567890                                                                              
153	-1234567.8901234567890	-1.2345678901234567E+006	-1.23456788E+006	-1234567.890123456789	-1235000	-1234567.890123456789	-1234567.8901234567890                                                                              
154	-123456.78901234567890	-1.2345678901234567E+005	-1.23456789E+005	-123456.7890123456789	-123500	-123456.7890123456789	-123456.78901234567890                                                                              
155	-12345.678901234567890	-1.2345678901234567E+004	-1.23456787E+004	-12345.67890123456789	-12350	-12345.67890123456789	-12345.678901234567890                                                                              
156	-1234.5678901234567890	-1.2345678901234569E+003	-1.23456787E+003	-1234.567890123456789	-1235	-1234.567890123456789	-1234.5678901234567890                                                                              
157	-123.45678901234567890	-1.2345678901234568E+002	-1.23456787E+002	-123.4567890123456789	-123.5	-123.4567890123456789	-123.45678901234567890                                                                              
158	-12.345678901234567890	-1.2345678901234567E+001	-1.23456793E+001	-12.34567890123456789	-12.35	-12.34567890123456789	-12.345678901234567890                                                                              
159	-1.2345678901234567890	-1.2345678901234567E+000	-1.23456788E+000	-1.234567890123456789	-1.235	-1.234567890123456789	-1.2345678901234567890                                                                              
160	-0.1234567890123456789	-1.2345678901234568E-001	-1.23456791E-001	-.1234567890123456789	-.1235	-.1234567890123456789	-0.1234567890123456789                                                                              
161	-0.1234567890123456789	-1.2345678901234568E-001	-1.23456791E-001	-.1234567890123456789	-.1235	-.1234567890123456789	-0.1234567890123456789                                                                              
162	-0.123456789012345678	-1.2345678901234568E-001	-1.23456791E-001	-.123456789012345678	-.1235	-.123456789012345678	-0.123456789012345678                                                                               
163	-0.12345678901234567	-1.2345678901234566E-001	-1.23456791E-001	-.12345678901234567	-.1235	-.12345678901234567	-0.12345678901234567                                                                                
164	-0.1234567890123456	-1.2345678901234559E-001	-1.23456791E-001	-.1234567890123456	-.1235	-.1234567890123456	-0.1234567890123456                                                                                 
165	-0.123456789012345	-1.23456789012345E-001	-1.23456791E-001	-.123456789012345	-.1235	-.123456789012345	-0.123456789012345                                                                                  
166	-0.12345678901234	-1.2345678901234E-001	-1.23456791E-001	-.12345678901234	-.1235	-.12345678901234	-0.12345678901234                                                                                   
167	-0.1234567890123	-1.2345678901230001E-001	-1.23456791E-001	-.1234567890123	-.1235	-.1234567890123	-0.1234567890123                                                                                    
168	-0.123456789012	-1.23456789012E-001	-1.23456791E-001	-.123456789012	-.1235	-.123456789012	-0.123456789012                                                                                     
169	-0.12345678901	-1.2345678901E-001	-1.23456791E-001	-.12345678901	-.1235	-.12345678901	-0.12345678901                                                                                      
170	-0.1234567890	-1.23456789E-001	-1.23456791E-001	-.123456789	-.1235	-.123456789	-0.1234567890                                                                                       
171	-0.123456789	-1.23456789E-001	-1.23456791E-001	-.123456789	-.1235	-.123456789	-0.123456789                                                                                        
172	-0.12345678	-1.2345678E-001	-1.23456784E-001	-.12345678	-.1235	-.12345678	-0.12345678                                                                                         
173	-0.1234567	-1.234567E-001	-1.23456702E-001	-.1234567	-.1235	-.1234567	-0.1234567                                                                                          
174	-0.123456	-1.23456E-001	-1.23456001E-001	-.123456	-.1235	-.123456	-0.123456                                                                                           
175	-0.12345	-1.2345E-001	-1.23450004E-001	-.12345	-.1235	-.12345	-0.12345                                                                                            
176	-0.1234	-1.234E-001	-1.23400003E-001	-.1234	-.1234	-.1234	-0.1234                                                                                             
177	-0.123	-1.23E-001	-1.23000003E-001	-.123	-.123	-.123	-0.123                                                                                              
178	-0.12	-1.2E-001	-1.19999997E-001	-.12	-.12	-.12	-0.12                                                                                               
179	-0.1	-1.0000000000000001E-001	-1.00000001E-001	-.1	-.1	-.1	-0.1                                                                                                
180	1.23e30	1.23E+030	1.22999997E+030	1230000000000000000000000000000	1230000000000000000000000000000	1230000000000000000000000000000	1.23e30                                                                                             
181	1.23e-30	1.2300000000000001E-030	1.22999995E-030	.00000000000000000000000000000123	.00000000000000000000000000000123	.00000000000000000000000000000123	1.23e-30                                                                                            
182	1.23456789123456789123456789123456789123456789	1.2345678912345679E+000	1.23456788E+000	1.23456789123456789123456789123456789123	1.235	1.2345678912345678912345678912345678912	1.23456789123456789123456789123456789123456789                                                      
create table TEST(nr number, "abc" number, "ABC" number);
ob1.oblog.next;
[R0] record_type:EDDL;[R0] db_name:oracle.OBLOG_DB;[R0] table_name:;[R0] column_count:1;[R0] column_name:ddl;[R0] ddl_stmt_str: create table TEST(nr number, "abc" number, "ABC" number);[R0] ddl_stmt_len: 56;
insert into TEST values (1, 2, 3);
ob1.oblog.next;
[R0] BEGIN;[R0] org_cluster_id:1;[R1] record_type:INSERT;[R1] database_name:oracle.OBLOG_DB;[R1] table_name:TEST;[R1] log_event:true;[R1] column_count:4;[R1] source_category:SRC_FULL_RECORDED;[R1] source_type:SRC_OCEANBASE_1_0;[R1] has_pk:true;[R1] pk_info:(0);[R1] pks:__pk_increment;[R1] has_uk:false;[R1] uk_info:(null);[R1] uks:(null);[R1] [C1] column_name:__pk_increment;[R1] [C1] column_type:MYSQL_TYPE_LONGLONG;[R1] [C1] column_is_rowkey:true;[R1] [C1] column_is_signed:false;[R1] [C1] column_encoding:binary;[R1] [C1] column_is_not_null:true;[R1] [C1] column_value_new:[1](1);[R1] [C2] column_name:NR;[R1] [C2] column_type:MYSQL_TYPE_NEWDECIMAL;[R1] [C2] column_is_rowkey:false;[R1] [C2] column_is_signed:true;[R1] [C2] column_encoding:binary;[R1] [C2] column_is_not_null:false;[R1] [C2] column_value_new:[1](1);[R1] [C3] column_name:abc;[R1] [C3] column_type:MYSQL_TYPE_NEWDECIMAL;[R1] [C3] column_is_rowkey:false;[R1] [C3] column_is_signed:true;[R1] [C3] column_encoding:binary;[R1] [C3] column_is_not_null:false;[R1] [C3] column_value_new:[2](1);[R1] [C4] column_name:ABC;[R1] [C4] column_type:MYSQL_TYPE_NEWDECIMAL;[R1] [C4] column_is_rowkey:false;[R1] [C4] column_is_signed:true;[R1] [C4] column_encoding:binary;[R1] [C4] column_is_not_null:false;[R1] [C4] column_value_new:[3](1);$[R2] COMMIT;
drop user oblog_db cascade;
ob1.oblog.next;
[R0] record_type:EDDL;[R0] db_name:oracle;[R0] table_name:;[R0] column_count:1;[R0] column_name:ddl;[R0] ddl_stmt_str: DROP USER "OBLOG_DB" CASCADE;[R0] ddl_stmt_len: 28;
ob1.oblog.stop;
