ob1=OBI(cluster=1,init_unit_cpu=2);
ob1.reboot;
ob1.mysql alter system set resource_hard_limit= 800;
drop tenant if exists oracle;
drop resource pool if exists oblog_pool;
drop resource unit if exists oblog_box;
ob1.mysql create resource unit oblog_box max_cpu 2, memory_size='20G';
ob1.mysql create resource pool oblog_pool unit = 'oblog_box', unit_num = 1;
ob1.mysql create tenant oracle replica_num = 1, resource_pool_list=('oblog_pool') set ob_tcp_invited_nodes='%', ob_compatibility_mode='oracle';
ob1.mysql alter tenant oracle set variables autocommit='on';
ob1.mysql alter tenant oracle set variables nls_date_format='YYYY-MM-DD HH24:MI:SS';
ob1.mysql alter tenant oracle set variables nls_timestamp_format='YYYY-MM-DD HH24:MI:SS.FF';
ob1.mysql alter tenant oracle set variables nls_timestamp_tz_format='YYYY-MM-DD HH24:MI:SS.FF TZR TZD';
create user obtest IDENTIFIED BY "obtest";
grant all on *.* to obtest WITH GRANT OPTION;
grant dba to obtest;
alter session set current_schema = oblog_db;
ob1.oblog.gen_conf tb_white_list=oracle.*.* log_level=DEBUG skip_ob_version_compat_check=1;
ob1.oblog.set_extra_argument -x;
ob1.oblog.restart;
create table t_simple(c0 int, c1 nvarchar2(10), c2 nchar(10));
ob1.oblog.next;
[R0] record_type:EDDL;[R0] db_name:oracle.OBLOG_DB;[R0] table_name:;[R0] column_count:1;[R0] column_name:ddl;[R0] ddl_stmt_str: create table t_simple(c0 int, c1 nvarchar2(10), c2 nchar(10));[R0] ddl_stmt_len: 61;
insert into t_simple values(1, 'a ', 'a ');
select lower(UTL_RAW.cast_to_raw(c1)), lower(UTL_RAW.cast_to_raw(c2)) from t_simple where c0=1;
LOWER(UTL_RAW.CAST_TO_RAW(C1))	LOWER(UTL_RAW.CAST_TO_RAW(C2))
00610020	0061002000200020002000200020002000200020
ob1.oblog.next;
[R0] BEGIN;[R0] org_cluster_id:1;[R1] record_type:INSERT;[R1] database_name:oracle.OBLOG_DB;[R1] table_name:T_SIMPLE;[R1] log_event:true;[R1] column_count:4;[R1] source_category:SRC_FULL_RECORDED;[R1] source_type:SRC_OCEANBASE_1_0;[R1] has_pk:true;[R1] pk_info:(0);[R1] pks:__pk_increment;[R1] has_uk:false;[R1] uk_info:(null);[R1] uks:(null);[R1] [C1] column_name:__pk_increment;[R1] [C1] column_type:MYSQL_TYPE_LONGLONG;[R1] [C1] column_is_rowkey:true;[R1] [C1] column_is_signed:false;[R1] [C1] column_encoding:binary;[R1] [C1] column_is_not_null:true;[R1] [C1] column_value_new:[1](1);[R1] [C2] column_name:C0;[R1] [C2] column_type:MYSQL_TYPE_NEWDECIMAL;[R1] [C2] column_is_rowkey:false;[R1] [C2] column_is_signed:true;[R1] [C2] column_encoding:binary;[R1] [C2] column_is_not_null:false;[R1] [C2] column_value_new:[1](1);[R1] [C3] column_name:C1;[R1] [C3] column_type:MYSQL_TYPE_OB_NVARCHAR2;[R1] [C3] column_is_rowkey:false;[R1] [C3] column_is_signed:true;[R1] [C3] column_encoding:utf16;[R1] [C3] column_is_not_null:false;[R1] [C3] column_value_new:[](4);[R1] [C3] column_value_new_hex:[00610020](8);[R1] [C4] column_name:C2;[R1] [C4] column_type:MYSQL_TYPE_OB_NCHAR;[R1] [C4] column_is_rowkey:false;[R1] [C4] column_is_signed:true;[R1] [C4] column_encoding:utf16;[R1] [C4] column_is_not_null:false;[R1] [C4] column_value_new:[](20);[R1] [C4] column_value_new_hex:[0061002000200020002000200020002000200020](40);$[R2] COMMIT;
insert into t_simple values(2, 'a         ', 'a  ');
select lower(UTL_RAW.cast_to_raw(c1)), lower(UTL_RAW.cast_to_raw(c2)) from t_simple where c0=2;
LOWER(UTL_RAW.CAST_TO_RAW(C1))	LOWER(UTL_RAW.CAST_TO_RAW(C2))
0061002000200020002000200020002000200020	0061002000200020002000200020002000200020
ob1.oblog.next;
[R0] BEGIN;[R0] org_cluster_id:1;[R1] record_type:INSERT;[R1] database_name:oracle.OBLOG_DB;[R1] table_name:T_SIMPLE;[R1] log_event:true;[R1] column_count:4;[R1] source_category:SRC_FULL_RECORDED;[R1] source_type:SRC_OCEANBASE_1_0;[R1] has_pk:true;[R1] pk_info:(0);[R1] pks:__pk_increment;[R1] has_uk:false;[R1] uk_info:(null);[R1] uks:(null);[R1] [C1] column_name:__pk_increment;[R1] [C1] column_type:MYSQL_TYPE_LONGLONG;[R1] [C1] column_is_rowkey:true;[R1] [C1] column_is_signed:false;[R1] [C1] column_encoding:binary;[R1] [C1] column_is_not_null:true;[R1] [C1] column_value_new:[2](1);[R1] [C2] column_name:C0;[R1] [C2] column_type:MYSQL_TYPE_NEWDECIMAL;[R1] [C2] column_is_rowkey:false;[R1] [C2] column_is_signed:true;[R1] [C2] column_encoding:binary;[R1] [C2] column_is_not_null:false;[R1] [C2] column_value_new:[2](1);[R1] [C3] column_name:C1;[R1] [C3] column_type:MYSQL_TYPE_OB_NVARCHAR2;[R1] [C3] column_is_rowkey:false;[R1] [C3] column_is_signed:true;[R1] [C3] column_encoding:utf16;[R1] [C3] column_is_not_null:false;[R1] [C3] column_value_new:[](20);[R1] [C3] column_value_new_hex:[0061002000200020002000200020002000200020](40);[R1] [C4] column_name:C2;[R1] [C4] column_type:MYSQL_TYPE_OB_NCHAR;[R1] [C4] column_is_rowkey:false;[R1] [C4] column_is_signed:true;[R1] [C4] column_encoding:utf16;[R1] [C4] column_is_not_null:false;[R1] [C4] column_value_new:[](20);[R1] [C4] column_value_new_hex:[0061002000200020002000200020002000200020](40);$[R2] COMMIT;
insert into t_simple values(3, '', '');
select lower(UTL_RAW.cast_to_raw(c1)), lower(UTL_RAW.cast_to_raw(c2)) from t_simple where c0=3;
LOWER(UTL_RAW.CAST_TO_RAW(C1))	LOWER(UTL_RAW.CAST_TO_RAW(C2))
NULL	NULL
ob1.oblog.next;
[R0] BEGIN;[R0] org_cluster_id:1;[R1] record_type:INSERT;[R1] database_name:oracle.OBLOG_DB;[R1] table_name:T_SIMPLE;[R1] log_event:true;[R1] column_count:4;[R1] source_category:SRC_FULL_RECORDED;[R1] source_type:SRC_OCEANBASE_1_0;[R1] has_pk:true;[R1] pk_info:(0);[R1] pks:__pk_increment;[R1] has_uk:false;[R1] uk_info:(null);[R1] uks:(null);[R1] [C1] column_name:__pk_increment;[R1] [C1] column_type:MYSQL_TYPE_LONGLONG;[R1] [C1] column_is_rowkey:true;[R1] [C1] column_is_signed:false;[R1] [C1] column_encoding:binary;[R1] [C1] column_is_not_null:true;[R1] [C1] column_value_new:[3](1);[R1] [C2] column_name:C0;[R1] [C2] column_type:MYSQL_TYPE_NEWDECIMAL;[R1] [C2] column_is_rowkey:false;[R1] [C2] column_is_signed:true;[R1] [C2] column_encoding:binary;[R1] [C2] column_is_not_null:false;[R1] [C2] column_value_new:[3](1);[R1] [C3] column_name:C1;[R1] [C3] column_type:MYSQL_TYPE_OB_NVARCHAR2;[R1] [C3] column_is_rowkey:false;[R1] [C3] column_is_signed:true;[R1] [C3] column_encoding:utf16;[R1] [C3] column_is_not_null:false;[R1] [C3] column_value_new:[NULL](0);[R1] [C3] column_value_new_hex:[](0);[R1] [C4] column_name:C2;[R1] [C4] column_type:MYSQL_TYPE_OB_NCHAR;[R1] [C4] column_is_rowkey:false;[R1] [C4] column_is_signed:true;[R1] [C4] column_encoding:utf16;[R1] [C4] column_is_not_null:false;[R1] [C4] column_value_new:[NULL](0);[R1] [C4] column_value_new_hex:[](0);$[R2] COMMIT;
insert into t_simple values(4, '', '');
select lower(UTL_RAW.cast_to_raw(c1)), lower(UTL_RAW.cast_to_raw(c2)) from t_simple where c0=4;
LOWER(UTL_RAW.CAST_TO_RAW(C1))	LOWER(UTL_RAW.CAST_TO_RAW(C2))
NULL	NULL
ob1.oblog.next;
[R0] BEGIN;[R0] org_cluster_id:1;[R1] record_type:INSERT;[R1] database_name:oracle.OBLOG_DB;[R1] table_name:T_SIMPLE;[R1] log_event:true;[R1] column_count:4;[R1] source_category:SRC_FULL_RECORDED;[R1] source_type:SRC_OCEANBASE_1_0;[R1] has_pk:true;[R1] pk_info:(0);[R1] pks:__pk_increment;[R1] has_uk:false;[R1] uk_info:(null);[R1] uks:(null);[R1] [C1] column_name:__pk_increment;[R1] [C1] column_type:MYSQL_TYPE_LONGLONG;[R1] [C1] column_is_rowkey:true;[R1] [C1] column_is_signed:false;[R1] [C1] column_encoding:binary;[R1] [C1] column_is_not_null:true;[R1] [C1] column_value_new:[4](1);[R1] [C2] column_name:C0;[R1] [C2] column_type:MYSQL_TYPE_NEWDECIMAL;[R1] [C2] column_is_rowkey:false;[R1] [C2] column_is_signed:true;[R1] [C2] column_encoding:binary;[R1] [C2] column_is_not_null:false;[R1] [C2] column_value_new:[4](1);[R1] [C3] column_name:C1;[R1] [C3] column_type:MYSQL_TYPE_OB_NVARCHAR2;[R1] [C3] column_is_rowkey:false;[R1] [C3] column_is_signed:true;[R1] [C3] column_encoding:utf16;[R1] [C3] column_is_not_null:false;[R1] [C3] column_value_new:[NULL](0);[R1] [C3] column_value_new_hex:[](0);[R1] [C4] column_name:C2;[R1] [C4] column_type:MYSQL_TYPE_OB_NCHAR;[R1] [C4] column_is_rowkey:false;[R1] [C4] column_is_signed:true;[R1] [C4] column_encoding:utf16;[R1] [C4] column_is_not_null:false;[R1] [C4] column_value_new:[NULL](0);[R1] [C4] column_value_new_hex:[](0);$[R2] COMMIT;
insert into t_simple values(5, 'a h j r', 'a  ');
select lower(UTL_RAW.cast_to_raw(c1)), lower(UTL_RAW.cast_to_raw(c2)) from t_simple where c0=5;
LOWER(UTL_RAW.CAST_TO_RAW(C1))	LOWER(UTL_RAW.CAST_TO_RAW(C2))
0061002000680020006a00200072	0061002000200020002000200020002000200020
ob1.oblog.next;
[R0] BEGIN;[R0] org_cluster_id:1;[R1] record_type:INSERT;[R1] database_name:oracle.OBLOG_DB;[R1] table_name:T_SIMPLE;[R1] log_event:true;[R1] column_count:4;[R1] source_category:SRC_FULL_RECORDED;[R1] source_type:SRC_OCEANBASE_1_0;[R1] has_pk:true;[R1] pk_info:(0);[R1] pks:__pk_increment;[R1] has_uk:false;[R1] uk_info:(null);[R1] uks:(null);[R1] [C1] column_name:__pk_increment;[R1] [C1] column_type:MYSQL_TYPE_LONGLONG;[R1] [C1] column_is_rowkey:true;[R1] [C1] column_is_signed:false;[R1] [C1] column_encoding:binary;[R1] [C1] column_is_not_null:true;[R1] [C1] column_value_new:[5](1);[R1] [C2] column_name:C0;[R1] [C2] column_type:MYSQL_TYPE_NEWDECIMAL;[R1] [C2] column_is_rowkey:false;[R1] [C2] column_is_signed:true;[R1] [C2] column_encoding:binary;[R1] [C2] column_is_not_null:false;[R1] [C2] column_value_new:[5](1);[R1] [C3] column_name:C1;[R1] [C3] column_type:MYSQL_TYPE_OB_NVARCHAR2;[R1] [C3] column_is_rowkey:false;[R1] [C3] column_is_signed:true;[R1] [C3] column_encoding:utf16;[R1] [C3] column_is_not_null:false;[R1] [C3] column_value_new:[](14);[R1] [C3] column_value_new_hex:[0061002000680020006a00200072](28);[R1] [C4] column_name:C2;[R1] [C4] column_type:MYSQL_TYPE_OB_NCHAR;[R1] [C4] column_is_rowkey:false;[R1] [C4] column_is_signed:true;[R1] [C4] column_encoding:utf16;[R1] [C4] column_is_not_null:false;[R1] [C4] column_value_new:[](20);[R1] [C4] column_value_new_hex:[0061002000200020002000200020002000200020](40);$[R2] COMMIT;
insert into t_simple(c0, c1) values(6, 'a '), (7, 'a '), (8, 'a ');
select lower(UTL_RAW.cast_to_raw(c1)), lower(UTL_RAW.cast_to_raw(c2)) from t_simple where c0>=6;
LOWER(UTL_RAW.CAST_TO_RAW(C1))	LOWER(UTL_RAW.CAST_TO_RAW(C2))
00610020	NULL
00610020	NULL
00610020	NULL
ob1.oblog.next;
[R0] BEGIN;[R0] org_cluster_id:1;[R1] record_type:INSERT;[R1] database_name:oracle.OBLOG_DB;[R1] table_name:T_SIMPLE;[R1] log_event:true;[R1] column_count:4;[R1] source_category:SRC_FULL_RECORDED;[R1] source_type:SRC_OCEANBASE_1_0;[R1] has_pk:true;[R1] pk_info:(0);[R1] pks:__pk_increment;[R1] has_uk:false;[R1] uk_info:(null);[R1] uks:(null);[R1] [C1] column_name:__pk_increment;[R1] [C1] column_type:MYSQL_TYPE_LONGLONG;[R1] [C1] column_is_rowkey:true;[R1] [C1] column_is_signed:false;[R1] [C1] column_encoding:binary;[R1] [C1] column_is_not_null:true;[R1] [C1] column_value_new:[6](1);[R1] [C2] column_name:C0;[R1] [C2] column_type:MYSQL_TYPE_NEWDECIMAL;[R1] [C2] column_is_rowkey:false;[R1] [C2] column_is_signed:true;[R1] [C2] column_encoding:binary;[R1] [C2] column_is_not_null:false;[R1] [C2] column_value_new:[6](1);[R1] [C3] column_name:C1;[R1] [C3] column_type:MYSQL_TYPE_OB_NVARCHAR2;[R1] [C3] column_is_rowkey:false;[R1] [C3] column_is_signed:true;[R1] [C3] column_encoding:utf16;[R1] [C3] column_is_not_null:false;[R1] [C3] column_value_new:[](4);[R1] [C3] column_value_new_hex:[00610020](8);[R1] [C4] column_name:C2;[R1] [C4] column_type:MYSQL_TYPE_OB_NCHAR;[R1] [C4] column_is_rowkey:false;[R1] [C4] column_is_signed:true;[R1] [C4] column_encoding:utf16;[R1] [C4] column_is_not_null:false;[R1] [C4] column_value_new:[NULL](0);[R1] [C4] column_value_new_hex:[](0);$[R2] record_type:INSERT;[R2] database_name:oracle.OBLOG_DB;[R2] table_name:T_SIMPLE;[R2] log_event:true;[R2] column_count:4;[R2] source_category:SRC_FULL_RECORDED;[R2] source_type:SRC_OCEANBASE_1_0;[R2] has_pk:true;[R2] pk_info:(0);[R2] pks:__pk_increment;[R2] has_uk:false;[R2] uk_info:(null);[R2] uks:(null);[R2] [C1] column_name:__pk_increment;[R2] [C1] column_type:MYSQL_TYPE_LONGLONG;[R2] [C1] column_is_rowkey:true;[R2] [C1] column_is_signed:false;[R2] [C1] column_encoding:binary;[R2] [C1] column_is_not_null:true;[R2] [C1] column_value_new:[7](1);[R2] [C2] column_name:C0;[R2] [C2] column_type:MYSQL_TYPE_NEWDECIMAL;[R2] [C2] column_is_rowkey:false;[R2] [C2] column_is_signed:true;[R2] [C2] column_encoding:binary;[R2] [C2] column_is_not_null:false;[R2] [C2] column_value_new:[7](1);[R2] [C3] column_name:C1;[R2] [C3] column_type:MYSQL_TYPE_OB_NVARCHAR2;[R2] [C3] column_is_rowkey:false;[R2] [C3] column_is_signed:true;[R2] [C3] column_encoding:utf16;[R2] [C3] column_is_not_null:false;[R2] [C3] column_value_new:[](4);[R2] [C3] column_value_new_hex:[00610020](8);[R2] [C4] column_name:C2;[R2] [C4] column_type:MYSQL_TYPE_OB_NCHAR;[R2] [C4] column_is_rowkey:false;[R2] [C4] column_is_signed:true;[R2] [C4] column_encoding:utf16;[R2] [C4] column_is_not_null:false;[R2] [C4] column_value_new:[NULL](0);[R2] [C4] column_value_new_hex:[](0);$[R3] record_type:INSERT;[R3] database_name:oracle.OBLOG_DB;[R3] table_name:T_SIMPLE;[R3] log_event:true;[R3] column_count:4;[R3] source_category:SRC_FULL_RECORDED;[R3] source_type:SRC_OCEANBASE_1_0;[R3] has_pk:true;[R3] pk_info:(0);[R3] pks:__pk_increment;[R3] has_uk:false;[R3] uk_info:(null);[R3] uks:(null);[R3] [C1] column_name:__pk_increment;[R3] [C1] column_type:MYSQL_TYPE_LONGLONG;[R3] [C1] column_is_rowkey:true;[R3] [C1] column_is_signed:false;[R3] [C1] column_encoding:binary;[R3] [C1] column_is_not_null:true;[R3] [C1] column_value_new:[8](1);[R3] [C2] column_name:C0;[R3] [C2] column_type:MYSQL_TYPE_NEWDECIMAL;[R3] [C2] column_is_rowkey:false;[R3] [C2] column_is_signed:true;[R3] [C2] column_encoding:binary;[R3] [C2] column_is_not_null:false;[R3] [C2] column_value_new:[8](1);[R3] [C3] column_name:C1;[R3] [C3] column_type:MYSQL_TYPE_OB_NVARCHAR2;[R3] [C3] column_is_rowkey:false;[R3] [C3] column_is_signed:true;[R3] [C3] column_encoding:utf16;[R3] [C3] column_is_not_null:false;[R3] [C3] column_value_new:[](4);[R3] [C3] column_value_new_hex:[00610020](8);[R3] [C4] column_name:C2;[R3] [C4] column_type:MYSQL_TYPE_OB_NCHAR;[R3] [C4] column_is_rowkey:false;[R3] [C4] column_is_signed:true;[R3] [C4] column_encoding:utf16;[R3] [C4] column_is_not_null:false;[R3] [C4] column_value_new:[NULL](0);[R3] [C4] column_value_new_hex:[](0);$[R4] COMMIT;
insert into t_simple values(9, 'ob oblog', 'a  ');
select lower(UTL_RAW.cast_to_raw(c1)), lower(UTL_RAW.cast_to_raw(c2)) from t_simple where c0=9;
LOWER(UTL_RAW.CAST_TO_RAW(C1))	LOWER(UTL_RAW.CAST_TO_RAW(C2))
006f00620020006f0062006c006f0067	0061002000200020002000200020002000200020
ob1.oblog.next;
[R0] BEGIN;[R0] org_cluster_id:1;[R1] record_type:INSERT;[R1] database_name:oracle.OBLOG_DB;[R1] table_name:T_SIMPLE;[R1] log_event:true;[R1] column_count:4;[R1] source_category:SRC_FULL_RECORDED;[R1] source_type:SRC_OCEANBASE_1_0;[R1] has_pk:true;[R1] pk_info:(0);[R1] pks:__pk_increment;[R1] has_uk:false;[R1] uk_info:(null);[R1] uks:(null);[R1] [C1] column_name:__pk_increment;[R1] [C1] column_type:MYSQL_TYPE_LONGLONG;[R1] [C1] column_is_rowkey:true;[R1] [C1] column_is_signed:false;[R1] [C1] column_encoding:binary;[R1] [C1] column_is_not_null:true;[R1] [C1] column_value_new:[9](1);[R1] [C2] column_name:C0;[R1] [C2] column_type:MYSQL_TYPE_NEWDECIMAL;[R1] [C2] column_is_rowkey:false;[R1] [C2] column_is_signed:true;[R1] [C2] column_encoding:binary;[R1] [C2] column_is_not_null:false;[R1] [C2] column_value_new:[9](1);[R1] [C3] column_name:C1;[R1] [C3] column_type:MYSQL_TYPE_OB_NVARCHAR2;[R1] [C3] column_is_rowkey:false;[R1] [C3] column_is_signed:true;[R1] [C3] column_encoding:utf16;[R1] [C3] column_is_not_null:false;[R1] [C3] column_value_new:[](16);[R1] [C3] column_value_new_hex:[006f00620020006f0062006c006f0067](32);[R1] [C4] column_name:C2;[R1] [C4] column_type:MYSQL_TYPE_OB_NCHAR;[R1] [C4] column_is_rowkey:false;[R1] [C4] column_is_signed:true;[R1] [C4] column_encoding:utf16;[R1] [C4] column_is_not_null:false;[R1] [C4] column_value_new:[](20);[R1] [C4] column_value_new_hex:[0061002000200020002000200020002000200020](40);$[R2] COMMIT;
delete from t_simple where c0 = 9;
ob1.oblog.next;
[R0] BEGIN;[R0] org_cluster_id:1;[R1] record_type:DELETE;[R1] database_name:oracle.OBLOG_DB;[R1] table_name:T_SIMPLE;[R1] log_event:true;[R1] column_count:4;[R1] source_category:SRC_FULL_RECORDED;[R1] source_type:SRC_OCEANBASE_1_0;[R1] has_pk:true;[R1] pk_info:(0);[R1] pks:__pk_increment;[R1] has_uk:false;[R1] uk_info:(null);[R1] uks:(null);[R1] [C1] column_name:__pk_increment;[R1] [C1] column_type:MYSQL_TYPE_LONGLONG;[R1] [C1] column_is_rowkey:true;[R1] [C1] column_is_signed:false;[R1] [C1] column_encoding:binary;[R1] [C1] column_is_not_null:true;[R1] [C1] column_value_old:[9](1);[R1] [C2] column_name:C0;[R1] [C2] column_type:MYSQL_TYPE_NEWDECIMAL;[R1] [C2] column_is_rowkey:false;[R1] [C2] column_is_signed:true;[R1] [C2] column_encoding:binary;[R1] [C2] column_is_not_null:false;[R1] [C2] column_value_old:[9](1);[R1] [C3] column_name:C1;[R1] [C3] column_type:MYSQL_TYPE_OB_NVARCHAR2;[R1] [C3] column_is_rowkey:false;[R1] [C3] column_is_signed:true;[R1] [C3] column_encoding:utf16;[R1] [C3] column_is_not_null:false;[R1] [C3] column_value_old:[](16);[R1] [C3] column_value_old_hex:[006f00620020006f0062006c006f0067](32);[R1] [C4] column_name:C2;[R1] [C4] column_type:MYSQL_TYPE_OB_NCHAR;[R1] [C4] column_is_rowkey:false;[R1] [C4] column_is_signed:true;[R1] [C4] column_encoding:utf16;[R1] [C4] column_is_not_null:false;[R1] [C4] column_value_old:[](20);[R1] [C4] column_value_old_hex:[0061002000200020002000200020002000200020](40);$[R2] COMMIT;
create table t_simple_nvarchar2_pk(c1 nvarchar2(10) primary key);
ob1.oblog.next;
[R0] record_type:EDDL;[R0] db_name:oracle.OBLOG_DB;[R0] table_name:;[R0] column_count:1;[R0] column_name:ddl;[R0] ddl_stmt_str: create table t_simple_nvarchar2_pk(c1 nvarchar2(10) primary key);[R0] ddl_stmt_len: 64;
insert into t_simple_nvarchar2_pk values('a');
select lower(UTL_RAW.cast_to_raw(c1)) from t_simple_nvarchar2_pk;
LOWER(UTL_RAW.CAST_TO_RAW(C1))
0061
ob1.oblog.next;
[R0] BEGIN;[R0] org_cluster_id:1;[R1] record_type:INSERT;[R1] database_name:oracle.OBLOG_DB;[R1] table_name:T_SIMPLE_NVARCHAR2_PK;[R1] log_event:true;[R1] column_count:1;[R1] source_category:SRC_FULL_RECORDED;[R1] source_type:SRC_OCEANBASE_1_0;[R1] has_pk:true;[R1] pk_info:(0);[R1] pks:C1;[R1] has_uk:false;[R1] uk_info:(null);[R1] uks:(null);[R1] [C1] column_name:C1;[R1] [C1] column_type:MYSQL_TYPE_OB_NVARCHAR2;[R1] [C1] column_is_rowkey:true;[R1] [C1] column_is_signed:true;[R1] [C1] column_encoding:utf16;[R1] [C1] column_is_not_null:true;[R1] [C1] column_value_new:[](2);[R1] [C1] column_value_new_hex:[0061](4);$[R2] COMMIT;
insert into t_simple_nvarchar2_pk values('a ');
select lower(UTL_RAW.cast_to_raw(c1)) from t_simple_nvarchar2_pk;
LOWER(UTL_RAW.CAST_TO_RAW(C1))
0061
00610020
ob1.oblog.next;
[R0] BEGIN;[R0] org_cluster_id:1;[R1] record_type:INSERT;[R1] database_name:oracle.OBLOG_DB;[R1] table_name:T_SIMPLE_NVARCHAR2_PK;[R1] log_event:true;[R1] column_count:1;[R1] source_category:SRC_FULL_RECORDED;[R1] source_type:SRC_OCEANBASE_1_0;[R1] has_pk:true;[R1] pk_info:(0);[R1] pks:C1;[R1] has_uk:false;[R1] uk_info:(null);[R1] uks:(null);[R1] [C1] column_name:C1;[R1] [C1] column_type:MYSQL_TYPE_OB_NVARCHAR2;[R1] [C1] column_is_rowkey:true;[R1] [C1] column_is_signed:true;[R1] [C1] column_encoding:utf16;[R1] [C1] column_is_not_null:true;[R1] [C1] column_value_new:[](4);[R1] [C1] column_value_new_hex:[00610020](8);$[R2] COMMIT;
insert into t_simple_nvarchar2_pk values('a  ');
select lower(UTL_RAW.cast_to_raw(c1)) from t_simple_nvarchar2_pk;
LOWER(UTL_RAW.CAST_TO_RAW(C1))
0061
00610020
006100200020
ob1.oblog.next;
[R0] BEGIN;[R0] org_cluster_id:1;[R1] record_type:INSERT;[R1] database_name:oracle.OBLOG_DB;[R1] table_name:T_SIMPLE_NVARCHAR2_PK;[R1] log_event:true;[R1] column_count:1;[R1] source_category:SRC_FULL_RECORDED;[R1] source_type:SRC_OCEANBASE_1_0;[R1] has_pk:true;[R1] pk_info:(0);[R1] pks:C1;[R1] has_uk:false;[R1] uk_info:(null);[R1] uks:(null);[R1] [C1] column_name:C1;[R1] [C1] column_type:MYSQL_TYPE_OB_NVARCHAR2;[R1] [C1] column_is_rowkey:true;[R1] [C1] column_is_signed:true;[R1] [C1] column_encoding:utf16;[R1] [C1] column_is_not_null:true;[R1] [C1] column_value_new:[](6);[R1] [C1] column_value_new_hex:[006100200020](12);$[R2] COMMIT;
update t_simple_nvarchar2_pk set C1='a    ' where C1='a  ';
select lower(UTL_RAW.cast_to_raw(c1)) from t_simple_nvarchar2_pk;
LOWER(UTL_RAW.CAST_TO_RAW(C1))
0061
00610020
00610020002000200020
ob1.oblog.next;
[R0] BEGIN;[R0] org_cluster_id:1;[R1] record_type:DELETE;[R1] database_name:oracle.OBLOG_DB;[R1] table_name:T_SIMPLE_NVARCHAR2_PK;[R1] log_event:true;[R1] column_count:1;[R1] source_category:SRC_FULL_RECORDED;[R1] source_type:SRC_OCEANBASE_1_0;[R1] has_pk:true;[R1] pk_info:(0);[R1] pks:C1;[R1] has_uk:false;[R1] uk_info:(null);[R1] uks:(null);[R1] [C1] column_name:C1;[R1] [C1] column_type:MYSQL_TYPE_OB_NVARCHAR2;[R1] [C1] column_is_rowkey:true;[R1] [C1] column_is_signed:true;[R1] [C1] column_encoding:utf16;[R1] [C1] column_is_not_null:true;[R1] [C1] column_value_old:[](6);[R1] [C1] column_value_old_hex:[006100200020](12);$[R2] record_type:INSERT;[R2] database_name:oracle.OBLOG_DB;[R2] table_name:T_SIMPLE_NVARCHAR2_PK;[R2] log_event:true;[R2] column_count:1;[R2] source_category:SRC_FULL_RECORDED;[R2] source_type:SRC_OCEANBASE_1_0;[R2] has_pk:true;[R2] pk_info:(0);[R2] pks:C1;[R2] has_uk:false;[R2] uk_info:(null);[R2] uks:(null);[R2] [C1] column_name:C1;[R2] [C1] column_type:MYSQL_TYPE_OB_NVARCHAR2;[R2] [C1] column_is_rowkey:true;[R2] [C1] column_is_signed:true;[R2] [C1] column_encoding:utf16;[R2] [C1] column_is_not_null:true;[R2] [C1] column_value_new:[](10);[R2] [C1] column_value_new_hex:[00610020002000200020](20);$[R3] COMMIT;
create table t_simple_nchar_pk(c1 nchar(10) primary key, c2 int);
ob1.oblog.next;
[R0] record_type:EDDL;[R0] db_name:oracle.OBLOG_DB;[R0] table_name:;[R0] column_count:1;[R0] column_name:ddl;[R0] ddl_stmt_str: create table t_simple_nchar_pk(c1 nchar(10) primary key, c2 int);[R0] ddl_stmt_len: 64;
alter session set current_schema = oblog_db;
insert into t_simple_nchar_pk values('a', 1);
select lower(UTL_RAW.cast_to_raw(c1)) from t_simple_nchar_pk;
LOWER(UTL_RAW.CAST_TO_RAW(C1))
0061002000200020002000200020002000200020
delete from t_simple_nchar_pk;
insert into t_simple_nchar_pk values('a ', 2);
select lower(UTL_RAW.cast_to_raw(c1)) from t_simple_nchar_pk;
LOWER(UTL_RAW.CAST_TO_RAW(C1))
0061002000200020002000200020002000200020
delete from t_simple_nchar_pk;
insert into t_simple_nchar_pk values('a  ', 3);
select lower(UTL_RAW.cast_to_raw(c1)) from t_simple_nchar_pk;
LOWER(UTL_RAW.CAST_TO_RAW(C1))
0061002000200020002000200020002000200020
delete from t_simple_nchar_pk;
insert into t_simple_nchar_pk values('a   ', 4);
select lower(UTL_RAW.cast_to_raw(c1)) from t_simple_nchar_pk;
LOWER(UTL_RAW.CAST_TO_RAW(C1))
0061002000200020002000200020002000200020
delete from t_simple_nchar_pk;
ob1.oblog.next;
[R0] BEGIN;[R0] org_cluster_id:1;[R1] record_type:INSERT;[R1] database_name:oracle.OBLOG_DB;[R1] table_name:T_SIMPLE_NCHAR_PK;[R1] log_event:true;[R1] column_count:2;[R1] source_category:SRC_FULL_RECORDED;[R1] source_type:SRC_OCEANBASE_1_0;[R1] has_pk:true;[R1] pk_info:(0);[R1] pks:C1;[R1] has_uk:false;[R1] uk_info:(null);[R1] uks:(null);[R1] [C1] column_name:C1;[R1] [C1] column_type:MYSQL_TYPE_OB_NCHAR;[R1] [C1] column_is_rowkey:true;[R1] [C1] column_is_signed:true;[R1] [C1] column_encoding:utf16;[R1] [C1] column_is_not_null:true;[R1] [C1] column_value_new:[](20);[R1] [C1] column_value_new_hex:[0061002000200020002000200020002000200020](40);[R1] [C2] column_name:C2;[R1] [C2] column_type:MYSQL_TYPE_NEWDECIMAL;[R1] [C2] column_is_rowkey:false;[R1] [C2] column_is_signed:true;[R1] [C2] column_encoding:binary;[R1] [C2] column_is_not_null:false;[R1] [C2] column_value_new:[1](1);$[R2] COMMIT;
ob1.oblog.next;
[R0] BEGIN;[R0] org_cluster_id:1;[R1] record_type:DELETE;[R1] database_name:oracle.OBLOG_DB;[R1] table_name:T_SIMPLE_NCHAR_PK;[R1] log_event:true;[R1] column_count:2;[R1] source_category:SRC_FULL_RECORDED;[R1] source_type:SRC_OCEANBASE_1_0;[R1] has_pk:true;[R1] pk_info:(0);[R1] pks:C1;[R1] has_uk:false;[R1] uk_info:(null);[R1] uks:(null);[R1] [C1] column_name:C1;[R1] [C1] column_type:MYSQL_TYPE_OB_NCHAR;[R1] [C1] column_is_rowkey:true;[R1] [C1] column_is_signed:true;[R1] [C1] column_encoding:utf16;[R1] [C1] column_is_not_null:true;[R1] [C1] column_value_old:[](20);[R1] [C1] column_value_old_hex:[0061002000200020002000200020002000200020](40);[R1] [C2] column_name:C2;[R1] [C2] column_type:MYSQL_TYPE_NEWDECIMAL;[R1] [C2] column_is_rowkey:false;[R1] [C2] column_is_signed:true;[R1] [C2] column_encoding:binary;[R1] [C2] column_is_not_null:false;[R1] [C2] column_value_old:[1](1);$[R2] COMMIT;
ob1.oblog.next;
[R0] BEGIN;[R0] org_cluster_id:1;[R1] record_type:INSERT;[R1] database_name:oracle.OBLOG_DB;[R1] table_name:T_SIMPLE_NCHAR_PK;[R1] log_event:true;[R1] column_count:2;[R1] source_category:SRC_FULL_RECORDED;[R1] source_type:SRC_OCEANBASE_1_0;[R1] has_pk:true;[R1] pk_info:(0);[R1] pks:C1;[R1] has_uk:false;[R1] uk_info:(null);[R1] uks:(null);[R1] [C1] column_name:C1;[R1] [C1] column_type:MYSQL_TYPE_OB_NCHAR;[R1] [C1] column_is_rowkey:true;[R1] [C1] column_is_signed:true;[R1] [C1] column_encoding:utf16;[R1] [C1] column_is_not_null:true;[R1] [C1] column_value_new:[](20);[R1] [C1] column_value_new_hex:[0061002000200020002000200020002000200020](40);[R1] [C2] column_name:C2;[R1] [C2] column_type:MYSQL_TYPE_NEWDECIMAL;[R1] [C2] column_is_rowkey:false;[R1] [C2] column_is_signed:true;[R1] [C2] column_encoding:binary;[R1] [C2] column_is_not_null:false;[R1] [C2] column_value_new:[2](1);$[R2] COMMIT;
ob1.oblog.next;
[R0] BEGIN;[R0] org_cluster_id:1;[R1] record_type:DELETE;[R1] database_name:oracle.OBLOG_DB;[R1] table_name:T_SIMPLE_NCHAR_PK;[R1] log_event:true;[R1] column_count:2;[R1] source_category:SRC_FULL_RECORDED;[R1] source_type:SRC_OCEANBASE_1_0;[R1] has_pk:true;[R1] pk_info:(0);[R1] pks:C1;[R1] has_uk:false;[R1] uk_info:(null);[R1] uks:(null);[R1] [C1] column_name:C1;[R1] [C1] column_type:MYSQL_TYPE_OB_NCHAR;[R1] [C1] column_is_rowkey:true;[R1] [C1] column_is_signed:true;[R1] [C1] column_encoding:utf16;[R1] [C1] column_is_not_null:true;[R1] [C1] column_value_old:[](20);[R1] [C1] column_value_old_hex:[0061002000200020002000200020002000200020](40);[R1] [C2] column_name:C2;[R1] [C2] column_type:MYSQL_TYPE_NEWDECIMAL;[R1] [C2] column_is_rowkey:false;[R1] [C2] column_is_signed:true;[R1] [C2] column_encoding:binary;[R1] [C2] column_is_not_null:false;[R1] [C2] column_value_old:[2](1);$[R2] COMMIT;
ob1.oblog.next;
[R0] BEGIN;[R0] org_cluster_id:1;[R1] record_type:INSERT;[R1] database_name:oracle.OBLOG_DB;[R1] table_name:T_SIMPLE_NCHAR_PK;[R1] log_event:true;[R1] column_count:2;[R1] source_category:SRC_FULL_RECORDED;[R1] source_type:SRC_OCEANBASE_1_0;[R1] has_pk:true;[R1] pk_info:(0);[R1] pks:C1;[R1] has_uk:false;[R1] uk_info:(null);[R1] uks:(null);[R1] [C1] column_name:C1;[R1] [C1] column_type:MYSQL_TYPE_OB_NCHAR;[R1] [C1] column_is_rowkey:true;[R1] [C1] column_is_signed:true;[R1] [C1] column_encoding:utf16;[R1] [C1] column_is_not_null:true;[R1] [C1] column_value_new:[](20);[R1] [C1] column_value_new_hex:[0061002000200020002000200020002000200020](40);[R1] [C2] column_name:C2;[R1] [C2] column_type:MYSQL_TYPE_NEWDECIMAL;[R1] [C2] column_is_rowkey:false;[R1] [C2] column_is_signed:true;[R1] [C2] column_encoding:binary;[R1] [C2] column_is_not_null:false;[R1] [C2] column_value_new:[3](1);$[R2] COMMIT;
ob1.oblog.next;
[R0] BEGIN;[R0] org_cluster_id:1;[R1] record_type:DELETE;[R1] database_name:oracle.OBLOG_DB;[R1] table_name:T_SIMPLE_NCHAR_PK;[R1] log_event:true;[R1] column_count:2;[R1] source_category:SRC_FULL_RECORDED;[R1] source_type:SRC_OCEANBASE_1_0;[R1] has_pk:true;[R1] pk_info:(0);[R1] pks:C1;[R1] has_uk:false;[R1] uk_info:(null);[R1] uks:(null);[R1] [C1] column_name:C1;[R1] [C1] column_type:MYSQL_TYPE_OB_NCHAR;[R1] [C1] column_is_rowkey:true;[R1] [C1] column_is_signed:true;[R1] [C1] column_encoding:utf16;[R1] [C1] column_is_not_null:true;[R1] [C1] column_value_old:[](20);[R1] [C1] column_value_old_hex:[0061002000200020002000200020002000200020](40);[R1] [C2] column_name:C2;[R1] [C2] column_type:MYSQL_TYPE_NEWDECIMAL;[R1] [C2] column_is_rowkey:false;[R1] [C2] column_is_signed:true;[R1] [C2] column_encoding:binary;[R1] [C2] column_is_not_null:false;[R1] [C2] column_value_old:[3](1);$[R2] COMMIT;
ob1.oblog.next;
[R0] BEGIN;[R0] org_cluster_id:1;[R1] record_type:INSERT;[R1] database_name:oracle.OBLOG_DB;[R1] table_name:T_SIMPLE_NCHAR_PK;[R1] log_event:true;[R1] column_count:2;[R1] source_category:SRC_FULL_RECORDED;[R1] source_type:SRC_OCEANBASE_1_0;[R1] has_pk:true;[R1] pk_info:(0);[R1] pks:C1;[R1] has_uk:false;[R1] uk_info:(null);[R1] uks:(null);[R1] [C1] column_name:C1;[R1] [C1] column_type:MYSQL_TYPE_OB_NCHAR;[R1] [C1] column_is_rowkey:true;[R1] [C1] column_is_signed:true;[R1] [C1] column_encoding:utf16;[R1] [C1] column_is_not_null:true;[R1] [C1] column_value_new:[](20);[R1] [C1] column_value_new_hex:[0061002000200020002000200020002000200020](40);[R1] [C2] column_name:C2;[R1] [C2] column_type:MYSQL_TYPE_NEWDECIMAL;[R1] [C2] column_is_rowkey:false;[R1] [C2] column_is_signed:true;[R1] [C2] column_encoding:binary;[R1] [C2] column_is_not_null:false;[R1] [C2] column_value_new:[4](1);$[R2] COMMIT;
ob1.oblog.next;
[R0] BEGIN;[R0] org_cluster_id:1;[R1] record_type:DELETE;[R1] database_name:oracle.OBLOG_DB;[R1] table_name:T_SIMPLE_NCHAR_PK;[R1] log_event:true;[R1] column_count:2;[R1] source_category:SRC_FULL_RECORDED;[R1] source_type:SRC_OCEANBASE_1_0;[R1] has_pk:true;[R1] pk_info:(0);[R1] pks:C1;[R1] has_uk:false;[R1] uk_info:(null);[R1] uks:(null);[R1] [C1] column_name:C1;[R1] [C1] column_type:MYSQL_TYPE_OB_NCHAR;[R1] [C1] column_is_rowkey:true;[R1] [C1] column_is_signed:true;[R1] [C1] column_encoding:utf16;[R1] [C1] column_is_not_null:true;[R1] [C1] column_value_old:[](20);[R1] [C1] column_value_old_hex:[0061002000200020002000200020002000200020](40);[R1] [C2] column_name:C2;[R1] [C2] column_type:MYSQL_TYPE_NEWDECIMAL;[R1] [C2] column_is_rowkey:false;[R1] [C2] column_is_signed:true;[R1] [C2] column_encoding:binary;[R1] [C2] column_is_not_null:false;[R1] [C2] column_value_old:[4](1);$[R2] COMMIT;
ob1.oblog.stop;
ob1.oblog.set_start_tstamp_usec $start_tstamp;
ob1.oblog.gen_conf tb_white_list=oracle.*.* log_level=DEBUG skip_ob_version_compat_check=1;
ob1.oblog.set_extra_argument -x;
ob1.oblog.restart;
ob1.oblog.next_dml;
[R0] BEGIN;[R0] org_cluster_id:1;[R1] record_type:INSERT;[R1] database_name:oracle.OBLOG_DB;[R1] table_name:T_SIMPLE_NCHAR_PK;[R1] log_event:true;[R1] column_count:2;[R1] source_category:SRC_FULL_RECORDED;[R1] source_type:SRC_OCEANBASE_1_0;[R1] has_pk:true;[R1] pk_info:(0);[R1] pks:C1;[R1] has_uk:false;[R1] uk_info:(null);[R1] uks:(null);[R1] [C1] column_name:C1;[R1] [C1] column_type:MYSQL_TYPE_OB_NCHAR;[R1] [C1] column_is_rowkey:true;[R1] [C1] column_is_signed:true;[R1] [C1] column_encoding:utf16;[R1] [C1] column_is_not_null:true;[R1] [C1] column_value_new:[](20);[R1] [C1] column_value_new_hex:[0061002000200020002000200020002000200020](40);[R1] [C2] column_name:C2;[R1] [C2] column_type:MYSQL_TYPE_NEWDECIMAL;[R1] [C2] column_is_rowkey:false;[R1] [C2] column_is_signed:true;[R1] [C2] column_encoding:binary;[R1] [C2] column_is_not_null:false;[R1] [C2] column_value_new:[1](1);$[R2] COMMIT;
ob1.oblog.next_dml;
[R0] BEGIN;[R0] org_cluster_id:1;[R1] record_type:DELETE;[R1] database_name:oracle.OBLOG_DB;[R1] table_name:T_SIMPLE_NCHAR_PK;[R1] log_event:true;[R1] column_count:2;[R1] source_category:SRC_FULL_RECORDED;[R1] source_type:SRC_OCEANBASE_1_0;[R1] has_pk:true;[R1] pk_info:(0);[R1] pks:C1;[R1] has_uk:false;[R1] uk_info:(null);[R1] uks:(null);[R1] [C1] column_name:C1;[R1] [C1] column_type:MYSQL_TYPE_OB_NCHAR;[R1] [C1] column_is_rowkey:true;[R1] [C1] column_is_signed:true;[R1] [C1] column_encoding:utf16;[R1] [C1] column_is_not_null:true;[R1] [C1] column_value_old:[](20);[R1] [C1] column_value_old_hex:[0061002000200020002000200020002000200020](40);[R1] [C2] column_name:C2;[R1] [C2] column_type:MYSQL_TYPE_NEWDECIMAL;[R1] [C2] column_is_rowkey:false;[R1] [C2] column_is_signed:true;[R1] [C2] column_encoding:binary;[R1] [C2] column_is_not_null:false;[R1] [C2] column_value_old:[1](1);$[R2] COMMIT;
ob1.oblog.next_dml;
[R0] BEGIN;[R0] org_cluster_id:1;[R1] record_type:INSERT;[R1] database_name:oracle.OBLOG_DB;[R1] table_name:T_SIMPLE_NCHAR_PK;[R1] log_event:true;[R1] column_count:2;[R1] source_category:SRC_FULL_RECORDED;[R1] source_type:SRC_OCEANBASE_1_0;[R1] has_pk:true;[R1] pk_info:(0);[R1] pks:C1;[R1] has_uk:false;[R1] uk_info:(null);[R1] uks:(null);[R1] [C1] column_name:C1;[R1] [C1] column_type:MYSQL_TYPE_OB_NCHAR;[R1] [C1] column_is_rowkey:true;[R1] [C1] column_is_signed:true;[R1] [C1] column_encoding:utf16;[R1] [C1] column_is_not_null:true;[R1] [C1] column_value_new:[](20);[R1] [C1] column_value_new_hex:[0061002000200020002000200020002000200020](40);[R1] [C2] column_name:C2;[R1] [C2] column_type:MYSQL_TYPE_NEWDECIMAL;[R1] [C2] column_is_rowkey:false;[R1] [C2] column_is_signed:true;[R1] [C2] column_encoding:binary;[R1] [C2] column_is_not_null:false;[R1] [C2] column_value_new:[2](1);$[R2] COMMIT;
ob1.oblog.next_dml;
[R0] BEGIN;[R0] org_cluster_id:1;[R1] record_type:DELETE;[R1] database_name:oracle.OBLOG_DB;[R1] table_name:T_SIMPLE_NCHAR_PK;[R1] log_event:true;[R1] column_count:2;[R1] source_category:SRC_FULL_RECORDED;[R1] source_type:SRC_OCEANBASE_1_0;[R1] has_pk:true;[R1] pk_info:(0);[R1] pks:C1;[R1] has_uk:false;[R1] uk_info:(null);[R1] uks:(null);[R1] [C1] column_name:C1;[R1] [C1] column_type:MYSQL_TYPE_OB_NCHAR;[R1] [C1] column_is_rowkey:true;[R1] [C1] column_is_signed:true;[R1] [C1] column_encoding:utf16;[R1] [C1] column_is_not_null:true;[R1] [C1] column_value_old:[](20);[R1] [C1] column_value_old_hex:[0061002000200020002000200020002000200020](40);[R1] [C2] column_name:C2;[R1] [C2] column_type:MYSQL_TYPE_NEWDECIMAL;[R1] [C2] column_is_rowkey:false;[R1] [C2] column_is_signed:true;[R1] [C2] column_encoding:binary;[R1] [C2] column_is_not_null:false;[R1] [C2] column_value_old:[2](1);$[R2] COMMIT;
ob1.oblog.next_dml;
[R0] BEGIN;[R0] org_cluster_id:1;[R1] record_type:INSERT;[R1] database_name:oracle.OBLOG_DB;[R1] table_name:T_SIMPLE_NCHAR_PK;[R1] log_event:true;[R1] column_count:2;[R1] source_category:SRC_FULL_RECORDED;[R1] source_type:SRC_OCEANBASE_1_0;[R1] has_pk:true;[R1] pk_info:(0);[R1] pks:C1;[R1] has_uk:false;[R1] uk_info:(null);[R1] uks:(null);[R1] [C1] column_name:C1;[R1] [C1] column_type:MYSQL_TYPE_OB_NCHAR;[R1] [C1] column_is_rowkey:true;[R1] [C1] column_is_signed:true;[R1] [C1] column_encoding:utf16;[R1] [C1] column_is_not_null:true;[R1] [C1] column_value_new:[](20);[R1] [C1] column_value_new_hex:[0061002000200020002000200020002000200020](40);[R1] [C2] column_name:C2;[R1] [C2] column_type:MYSQL_TYPE_NEWDECIMAL;[R1] [C2] column_is_rowkey:false;[R1] [C2] column_is_signed:true;[R1] [C2] column_encoding:binary;[R1] [C2] column_is_not_null:false;[R1] [C2] column_value_new:[3](1);$[R2] COMMIT;
ob1.oblog.next_dml;
[R0] BEGIN;[R0] org_cluster_id:1;[R1] record_type:DELETE;[R1] database_name:oracle.OBLOG_DB;[R1] table_name:T_SIMPLE_NCHAR_PK;[R1] log_event:true;[R1] column_count:2;[R1] source_category:SRC_FULL_RECORDED;[R1] source_type:SRC_OCEANBASE_1_0;[R1] has_pk:true;[R1] pk_info:(0);[R1] pks:C1;[R1] has_uk:false;[R1] uk_info:(null);[R1] uks:(null);[R1] [C1] column_name:C1;[R1] [C1] column_type:MYSQL_TYPE_OB_NCHAR;[R1] [C1] column_is_rowkey:true;[R1] [C1] column_is_signed:true;[R1] [C1] column_encoding:utf16;[R1] [C1] column_is_not_null:true;[R1] [C1] column_value_old:[](20);[R1] [C1] column_value_old_hex:[0061002000200020002000200020002000200020](40);[R1] [C2] column_name:C2;[R1] [C2] column_type:MYSQL_TYPE_NEWDECIMAL;[R1] [C2] column_is_rowkey:false;[R1] [C2] column_is_signed:true;[R1] [C2] column_encoding:binary;[R1] [C2] column_is_not_null:false;[R1] [C2] column_value_old:[3](1);$[R2] COMMIT;
ob1.oblog.next_dml;
[R0] BEGIN;[R0] org_cluster_id:1;[R1] record_type:INSERT;[R1] database_name:oracle.OBLOG_DB;[R1] table_name:T_SIMPLE_NCHAR_PK;[R1] log_event:true;[R1] column_count:2;[R1] source_category:SRC_FULL_RECORDED;[R1] source_type:SRC_OCEANBASE_1_0;[R1] has_pk:true;[R1] pk_info:(0);[R1] pks:C1;[R1] has_uk:false;[R1] uk_info:(null);[R1] uks:(null);[R1] [C1] column_name:C1;[R1] [C1] column_type:MYSQL_TYPE_OB_NCHAR;[R1] [C1] column_is_rowkey:true;[R1] [C1] column_is_signed:true;[R1] [C1] column_encoding:utf16;[R1] [C1] column_is_not_null:true;[R1] [C1] column_value_new:[](20);[R1] [C1] column_value_new_hex:[0061002000200020002000200020002000200020](40);[R1] [C2] column_name:C2;[R1] [C2] column_type:MYSQL_TYPE_NEWDECIMAL;[R1] [C2] column_is_rowkey:false;[R1] [C2] column_is_signed:true;[R1] [C2] column_encoding:binary;[R1] [C2] column_is_not_null:false;[R1] [C2] column_value_new:[4](1);$[R2] COMMIT;
ob1.oblog.next_dml;
[R0] BEGIN;[R0] org_cluster_id:1;[R1] record_type:DELETE;[R1] database_name:oracle.OBLOG_DB;[R1] table_name:T_SIMPLE_NCHAR_PK;[R1] log_event:true;[R1] column_count:2;[R1] source_category:SRC_FULL_RECORDED;[R1] source_type:SRC_OCEANBASE_1_0;[R1] has_pk:true;[R1] pk_info:(0);[R1] pks:C1;[R1] has_uk:false;[R1] uk_info:(null);[R1] uks:(null);[R1] [C1] column_name:C1;[R1] [C1] column_type:MYSQL_TYPE_OB_NCHAR;[R1] [C1] column_is_rowkey:true;[R1] [C1] column_is_signed:true;[R1] [C1] column_encoding:utf16;[R1] [C1] column_is_not_null:true;[R1] [C1] column_value_old:[](20);[R1] [C1] column_value_old_hex:[0061002000200020002000200020002000200020](40);[R1] [C2] column_name:C2;[R1] [C2] column_type:MYSQL_TYPE_NEWDECIMAL;[R1] [C2] column_is_rowkey:false;[R1] [C2] column_is_signed:true;[R1] [C2] column_encoding:binary;[R1] [C2] column_is_not_null:false;[R1] [C2] column_value_old:[4](1);$[R2] COMMIT;
create table padding_nchar(c0 int primary key, c1 int, c2 nchar(11));
ob1.oblog.next;
[R0] record_type:EDDL;[R0] db_name:oracle.OBLOG_DB;[R0] table_name:;[R0] column_count:1;[R0] column_name:ddl;[R0] ddl_stmt_str: create table padding_nchar(c0 int primary key, c1 int, c2 nchar(11));[R0] ddl_stmt_len: 68;
insert into padding_nchar values(1, 1, 'a');
ob1.oblog.next;
[R0] BEGIN;[R0] org_cluster_id:1;[R1] record_type:INSERT;[R1] database_name:oracle.OBLOG_DB;[R1] table_name:PADDING_NCHAR;[R1] log_event:true;[R1] column_count:3;[R1] source_category:SRC_FULL_RECORDED;[R1] source_type:SRC_OCEANBASE_1_0;[R1] has_pk:true;[R1] pk_info:(0);[R1] pks:C0;[R1] has_uk:false;[R1] uk_info:(null);[R1] uks:(null);[R1] [C1] column_name:C0;[R1] [C1] column_type:MYSQL_TYPE_NEWDECIMAL;[R1] [C1] column_is_rowkey:true;[R1] [C1] column_is_signed:true;[R1] [C1] column_encoding:binary;[R1] [C1] column_is_not_null:true;[R1] [C1] column_value_new:[1](1);[R1] [C2] column_name:C1;[R1] [C2] column_type:MYSQL_TYPE_NEWDECIMAL;[R1] [C2] column_is_rowkey:false;[R1] [C2] column_is_signed:true;[R1] [C2] column_encoding:binary;[R1] [C2] column_is_not_null:false;[R1] [C2] column_value_new:[1](1);[R1] [C3] column_name:C2;[R1] [C3] column_type:MYSQL_TYPE_OB_NCHAR;[R1] [C3] column_is_rowkey:false;[R1] [C3] column_is_signed:true;[R1] [C3] column_encoding:utf16;[R1] [C3] column_is_not_null:false;[R1] [C3] column_value_new:[](22);[R1] [C3] column_value_new_hex:[00610020002000200020002000200020002000200020](44);$[R2] COMMIT;
update padding_nchar set c1 = 10 where c0=1;
ob1.oblog.next;
[R0] BEGIN;[R0] org_cluster_id:1;[R1] record_type:UPDATE;[R1] database_name:oracle.OBLOG_DB;[R1] table_name:PADDING_NCHAR;[R1] log_event:true;[R1] column_count:3;[R1] source_category:SRC_FULL_RECORDED;[R1] source_type:SRC_OCEANBASE_1_0;[R1] has_pk:true;[R1] pk_info:(0);[R1] pks:C0;[R1] has_uk:false;[R1] uk_info:(null);[R1] uks:(null);[R1] [C1] column_name:C0;[R1] [C1] column_type:MYSQL_TYPE_NEWDECIMAL;[R1] [C1] column_is_rowkey:true;[R1] [C1] column_is_signed:true;[R1] [C1] column_encoding:binary;[R1] [C1] column_is_not_null:true;[R1] [C1] column_value_new:[1](1);[R1] [C1] column_value_old:[1](1);[R1] [C2] column_name:C1;[R1] [C2] column_type:MYSQL_TYPE_NEWDECIMAL;[R1] [C2] column_is_rowkey:false;[R1] [C2] column_is_signed:true;[R1] [C2] column_encoding:binary;[R1] [C2] column_is_not_null:false;[R1] [C2] column_value_new:[10](2);[R1] [C2] column_value_old:[1](1);[R1] [C3] column_name:C2;[R1] [C3] column_type:MYSQL_TYPE_OB_NCHAR;[R1] [C3] column_is_rowkey:false;[R1] [C3] column_is_signed:true;[R1] [C3] column_encoding:utf16;[R1] [C3] column_is_not_null:false;[R1] [C3] column_value_new:[](22);[R1] [C3] column_value_new_hex:[00610020002000200020002000200020002000200020](44);[R1] [C3] column_value_old:[](22);[R1] [C3] column_value_old_hex:[00610020002000200020002000200020002000200020](44);$[R2] COMMIT;
insert into padding_nchar values(2, 2, 'a ');
ob1.oblog.next;
[R0] BEGIN;[R0] org_cluster_id:1;[R1] record_type:INSERT;[R1] database_name:oracle.OBLOG_DB;[R1] table_name:PADDING_NCHAR;[R1] log_event:true;[R1] column_count:3;[R1] source_category:SRC_FULL_RECORDED;[R1] source_type:SRC_OCEANBASE_1_0;[R1] has_pk:true;[R1] pk_info:(0);[R1] pks:C0;[R1] has_uk:false;[R1] uk_info:(null);[R1] uks:(null);[R1] [C1] column_name:C0;[R1] [C1] column_type:MYSQL_TYPE_NEWDECIMAL;[R1] [C1] column_is_rowkey:true;[R1] [C1] column_is_signed:true;[R1] [C1] column_encoding:binary;[R1] [C1] column_is_not_null:true;[R1] [C1] column_value_new:[2](1);[R1] [C2] column_name:C1;[R1] [C2] column_type:MYSQL_TYPE_NEWDECIMAL;[R1] [C2] column_is_rowkey:false;[R1] [C2] column_is_signed:true;[R1] [C2] column_encoding:binary;[R1] [C2] column_is_not_null:false;[R1] [C2] column_value_new:[2](1);[R1] [C3] column_name:C2;[R1] [C3] column_type:MYSQL_TYPE_OB_NCHAR;[R1] [C3] column_is_rowkey:false;[R1] [C3] column_is_signed:true;[R1] [C3] column_encoding:utf16;[R1] [C3] column_is_not_null:false;[R1] [C3] column_value_new:[](22);[R1] [C3] column_value_new_hex:[00610020002000200020002000200020002000200020](44);$[R2] COMMIT;
delete from padding_nchar where c0=2;
ob1.oblog.next;
[R0] BEGIN;[R0] org_cluster_id:1;[R1] record_type:DELETE;[R1] database_name:oracle.OBLOG_DB;[R1] table_name:PADDING_NCHAR;[R1] log_event:true;[R1] column_count:3;[R1] source_category:SRC_FULL_RECORDED;[R1] source_type:SRC_OCEANBASE_1_0;[R1] has_pk:true;[R1] pk_info:(0);[R1] pks:C0;[R1] has_uk:false;[R1] uk_info:(null);[R1] uks:(null);[R1] [C1] column_name:C0;[R1] [C1] column_type:MYSQL_TYPE_NEWDECIMAL;[R1] [C1] column_is_rowkey:true;[R1] [C1] column_is_signed:true;[R1] [C1] column_encoding:binary;[R1] [C1] column_is_not_null:true;[R1] [C1] column_value_old:[2](1);[R1] [C2] column_name:C1;[R1] [C2] column_type:MYSQL_TYPE_NEWDECIMAL;[R1] [C2] column_is_rowkey:false;[R1] [C2] column_is_signed:true;[R1] [C2] column_encoding:binary;[R1] [C2] column_is_not_null:false;[R1] [C2] column_value_old:[2](1);[R1] [C3] column_name:C2;[R1] [C3] column_type:MYSQL_TYPE_OB_NCHAR;[R1] [C3] column_is_rowkey:false;[R1] [C3] column_is_signed:true;[R1] [C3] column_encoding:utf16;[R1] [C3] column_is_not_null:false;[R1] [C3] column_value_old:[](22);[R1] [C3] column_value_old_hex:[00610020002000200020002000200020002000200020](44);$[R2] COMMIT;
insert into padding_nchar values(3, 3, 'a  ');
ob1.oblog.next;
[R0] BEGIN;[R0] org_cluster_id:1;[R1] record_type:INSERT;[R1] database_name:oracle.OBLOG_DB;[R1] table_name:PADDING_NCHAR;[R1] log_event:true;[R1] column_count:3;[R1] source_category:SRC_FULL_RECORDED;[R1] source_type:SRC_OCEANBASE_1_0;[R1] has_pk:true;[R1] pk_info:(0);[R1] pks:C0;[R1] has_uk:false;[R1] uk_info:(null);[R1] uks:(null);[R1] [C1] column_name:C0;[R1] [C1] column_type:MYSQL_TYPE_NEWDECIMAL;[R1] [C1] column_is_rowkey:true;[R1] [C1] column_is_signed:true;[R1] [C1] column_encoding:binary;[R1] [C1] column_is_not_null:true;[R1] [C1] column_value_new:[3](1);[R1] [C2] column_name:C1;[R1] [C2] column_type:MYSQL_TYPE_NEWDECIMAL;[R1] [C2] column_is_rowkey:false;[R1] [C2] column_is_signed:true;[R1] [C2] column_encoding:binary;[R1] [C2] column_is_not_null:false;[R1] [C2] column_value_new:[3](1);[R1] [C3] column_name:C2;[R1] [C3] column_type:MYSQL_TYPE_OB_NCHAR;[R1] [C3] column_is_rowkey:false;[R1] [C3] column_is_signed:true;[R1] [C3] column_encoding:utf16;[R1] [C3] column_is_not_null:false;[R1] [C3] column_value_new:[](22);[R1] [C3] column_value_new_hex:[00610020002000200020002000200020002000200020](44);$[R2] COMMIT;
update padding_nchar set c2 = 'ab' where c0=3;
ob1.oblog.next;
[R0] BEGIN;[R0] org_cluster_id:1;[R1] record_type:UPDATE;[R1] database_name:oracle.OBLOG_DB;[R1] table_name:PADDING_NCHAR;[R1] log_event:true;[R1] column_count:3;[R1] source_category:SRC_FULL_RECORDED;[R1] source_type:SRC_OCEANBASE_1_0;[R1] has_pk:true;[R1] pk_info:(0);[R1] pks:C0;[R1] has_uk:false;[R1] uk_info:(null);[R1] uks:(null);[R1] [C1] column_name:C0;[R1] [C1] column_type:MYSQL_TYPE_NEWDECIMAL;[R1] [C1] column_is_rowkey:true;[R1] [C1] column_is_signed:true;[R1] [C1] column_encoding:binary;[R1] [C1] column_is_not_null:true;[R1] [C1] column_value_new:[3](1);[R1] [C1] column_value_old:[3](1);[R1] [C2] column_name:C1;[R1] [C2] column_type:MYSQL_TYPE_NEWDECIMAL;[R1] [C2] column_is_rowkey:false;[R1] [C2] column_is_signed:true;[R1] [C2] column_encoding:binary;[R1] [C2] column_is_not_null:false;[R1] [C2] column_value_new:[3](1);[R1] [C2] column_value_old:[3](1);[R1] [C3] column_name:C2;[R1] [C3] column_type:MYSQL_TYPE_OB_NCHAR;[R1] [C3] column_is_rowkey:false;[R1] [C3] column_is_signed:true;[R1] [C3] column_encoding:utf16;[R1] [C3] column_is_not_null:false;[R1] [C3] column_value_new:[](22);[R1] [C3] column_value_new_hex:[00610062002000200020002000200020002000200020](44);[R1] [C3] column_value_old:[](22);[R1] [C3] column_value_old_hex:[00610020002000200020002000200020002000200020](44);$[R2] COMMIT;
insert into padding_nchar values(4, 4, 'ab   ');
ob1.oblog.next;
[R0] BEGIN;[R0] org_cluster_id:1;[R1] record_type:INSERT;[R1] database_name:oracle.OBLOG_DB;[R1] table_name:PADDING_NCHAR;[R1] log_event:true;[R1] column_count:3;[R1] source_category:SRC_FULL_RECORDED;[R1] source_type:SRC_OCEANBASE_1_0;[R1] has_pk:true;[R1] pk_info:(0);[R1] pks:C0;[R1] has_uk:false;[R1] uk_info:(null);[R1] uks:(null);[R1] [C1] column_name:C0;[R1] [C1] column_type:MYSQL_TYPE_NEWDECIMAL;[R1] [C1] column_is_rowkey:true;[R1] [C1] column_is_signed:true;[R1] [C1] column_encoding:binary;[R1] [C1] column_is_not_null:true;[R1] [C1] column_value_new:[4](1);[R1] [C2] column_name:C1;[R1] [C2] column_type:MYSQL_TYPE_NEWDECIMAL;[R1] [C2] column_is_rowkey:false;[R1] [C2] column_is_signed:true;[R1] [C2] column_encoding:binary;[R1] [C2] column_is_not_null:false;[R1] [C2] column_value_new:[4](1);[R1] [C3] column_name:C2;[R1] [C3] column_type:MYSQL_TYPE_OB_NCHAR;[R1] [C3] column_is_rowkey:false;[R1] [C3] column_is_signed:true;[R1] [C3] column_encoding:utf16;[R1] [C3] column_is_not_null:false;[R1] [C3] column_value_new:[](22);[R1] [C3] column_value_new_hex:[00610062002000200020002000200020002000200020](44);$[R2] COMMIT;
update padding_nchar set c2 = 'abc' where c0=4;
ob1.oblog.next;
[R0] BEGIN;[R0] org_cluster_id:1;[R1] record_type:UPDATE;[R1] database_name:oracle.OBLOG_DB;[R1] table_name:PADDING_NCHAR;[R1] log_event:true;[R1] column_count:3;[R1] source_category:SRC_FULL_RECORDED;[R1] source_type:SRC_OCEANBASE_1_0;[R1] has_pk:true;[R1] pk_info:(0);[R1] pks:C0;[R1] has_uk:false;[R1] uk_info:(null);[R1] uks:(null);[R1] [C1] column_name:C0;[R1] [C1] column_type:MYSQL_TYPE_NEWDECIMAL;[R1] [C1] column_is_rowkey:true;[R1] [C1] column_is_signed:true;[R1] [C1] column_encoding:binary;[R1] [C1] column_is_not_null:true;[R1] [C1] column_value_new:[4](1);[R1] [C1] column_value_old:[4](1);[R1] [C2] column_name:C1;[R1] [C2] column_type:MYSQL_TYPE_NEWDECIMAL;[R1] [C2] column_is_rowkey:false;[R1] [C2] column_is_signed:true;[R1] [C2] column_encoding:binary;[R1] [C2] column_is_not_null:false;[R1] [C2] column_value_new:[4](1);[R1] [C2] column_value_old:[4](1);[R1] [C3] column_name:C2;[R1] [C3] column_type:MYSQL_TYPE_OB_NCHAR;[R1] [C3] column_is_rowkey:false;[R1] [C3] column_is_signed:true;[R1] [C3] column_encoding:utf16;[R1] [C3] column_is_not_null:false;[R1] [C3] column_value_new:[](22);[R1] [C3] column_value_new_hex:[00610062006300200020002000200020002000200020](44);[R1] [C3] column_value_old:[](22);[R1] [C3] column_value_old_hex:[00610062002000200020002000200020002000200020](44);$[R2] COMMIT;
insert into padding_nchar values(5, 5, 'abc    ');
ob1.oblog.next;
[R0] BEGIN;[R0] org_cluster_id:1;[R1] record_type:INSERT;[R1] database_name:oracle.OBLOG_DB;[R1] table_name:PADDING_NCHAR;[R1] log_event:true;[R1] column_count:3;[R1] source_category:SRC_FULL_RECORDED;[R1] source_type:SRC_OCEANBASE_1_0;[R1] has_pk:true;[R1] pk_info:(0);[R1] pks:C0;[R1] has_uk:false;[R1] uk_info:(null);[R1] uks:(null);[R1] [C1] column_name:C0;[R1] [C1] column_type:MYSQL_TYPE_NEWDECIMAL;[R1] [C1] column_is_rowkey:true;[R1] [C1] column_is_signed:true;[R1] [C1] column_encoding:binary;[R1] [C1] column_is_not_null:true;[R1] [C1] column_value_new:[5](1);[R1] [C2] column_name:C1;[R1] [C2] column_type:MYSQL_TYPE_NEWDECIMAL;[R1] [C2] column_is_rowkey:false;[R1] [C2] column_is_signed:true;[R1] [C2] column_encoding:binary;[R1] [C2] column_is_not_null:false;[R1] [C2] column_value_new:[5](1);[R1] [C3] column_name:C2;[R1] [C3] column_type:MYSQL_TYPE_OB_NCHAR;[R1] [C3] column_is_rowkey:false;[R1] [C3] column_is_signed:true;[R1] [C3] column_encoding:utf16;[R1] [C3] column_is_not_null:false;[R1] [C3] column_value_new:[](22);[R1] [C3] column_value_new_hex:[00610062006300200020002000200020002000200020](44);$[R2] COMMIT;
update padding_nchar set c2 = 'abcd' where c0=5;
ob1.oblog.next;
[R0] BEGIN;[R0] org_cluster_id:1;[R1] record_type:UPDATE;[R1] database_name:oracle.OBLOG_DB;[R1] table_name:PADDING_NCHAR;[R1] log_event:true;[R1] column_count:3;[R1] source_category:SRC_FULL_RECORDED;[R1] source_type:SRC_OCEANBASE_1_0;[R1] has_pk:true;[R1] pk_info:(0);[R1] pks:C0;[R1] has_uk:false;[R1] uk_info:(null);[R1] uks:(null);[R1] [C1] column_name:C0;[R1] [C1] column_type:MYSQL_TYPE_NEWDECIMAL;[R1] [C1] column_is_rowkey:true;[R1] [C1] column_is_signed:true;[R1] [C1] column_encoding:binary;[R1] [C1] column_is_not_null:true;[R1] [C1] column_value_new:[5](1);[R1] [C1] column_value_old:[5](1);[R1] [C2] column_name:C1;[R1] [C2] column_type:MYSQL_TYPE_NEWDECIMAL;[R1] [C2] column_is_rowkey:false;[R1] [C2] column_is_signed:true;[R1] [C2] column_encoding:binary;[R1] [C2] column_is_not_null:false;[R1] [C2] column_value_new:[5](1);[R1] [C2] column_value_old:[5](1);[R1] [C3] column_name:C2;[R1] [C3] column_type:MYSQL_TYPE_OB_NCHAR;[R1] [C3] column_is_rowkey:false;[R1] [C3] column_is_signed:true;[R1] [C3] column_encoding:utf16;[R1] [C3] column_is_not_null:false;[R1] [C3] column_value_new:[](22);[R1] [C3] column_value_new_hex:[00610062006300640020002000200020002000200020](44);[R1] [C3] column_value_old:[](22);[R1] [C3] column_value_old_hex:[00610062006300200020002000200020002000200020](44);$[R2] COMMIT;
insert into padding_nchar values(6, 6, '');
ob1.oblog.next;
[R0] BEGIN;[R0] org_cluster_id:1;[R1] record_type:INSERT;[R1] database_name:oracle.OBLOG_DB;[R1] table_name:PADDING_NCHAR;[R1] log_event:true;[R1] column_count:3;[R1] source_category:SRC_FULL_RECORDED;[R1] source_type:SRC_OCEANBASE_1_0;[R1] has_pk:true;[R1] pk_info:(0);[R1] pks:C0;[R1] has_uk:false;[R1] uk_info:(null);[R1] uks:(null);[R1] [C1] column_name:C0;[R1] [C1] column_type:MYSQL_TYPE_NEWDECIMAL;[R1] [C1] column_is_rowkey:true;[R1] [C1] column_is_signed:true;[R1] [C1] column_encoding:binary;[R1] [C1] column_is_not_null:true;[R1] [C1] column_value_new:[6](1);[R1] [C2] column_name:C1;[R1] [C2] column_type:MYSQL_TYPE_NEWDECIMAL;[R1] [C2] column_is_rowkey:false;[R1] [C2] column_is_signed:true;[R1] [C2] column_encoding:binary;[R1] [C2] column_is_not_null:false;[R1] [C2] column_value_new:[6](1);[R1] [C3] column_name:C2;[R1] [C3] column_type:MYSQL_TYPE_OB_NCHAR;[R1] [C3] column_is_rowkey:false;[R1] [C3] column_is_signed:true;[R1] [C3] column_encoding:utf16;[R1] [C3] column_is_not_null:false;[R1] [C3] column_value_new:[NULL](0);[R1] [C3] column_value_new_hex:[](0);$[R2] COMMIT;
select * from padding_nchar where c0=6;
C0	C1	C2
6	6	NULL
insert into padding_nchar values(7, 7, ' ');
ob1.oblog.next;
[R0] BEGIN;[R0] org_cluster_id:1;[R1] record_type:INSERT;[R1] database_name:oracle.OBLOG_DB;[R1] table_name:PADDING_NCHAR;[R1] log_event:true;[R1] column_count:3;[R1] source_category:SRC_FULL_RECORDED;[R1] source_type:SRC_OCEANBASE_1_0;[R1] has_pk:true;[R1] pk_info:(0);[R1] pks:C0;[R1] has_uk:false;[R1] uk_info:(null);[R1] uks:(null);[R1] [C1] column_name:C0;[R1] [C1] column_type:MYSQL_TYPE_NEWDECIMAL;[R1] [C1] column_is_rowkey:true;[R1] [C1] column_is_signed:true;[R1] [C1] column_encoding:binary;[R1] [C1] column_is_not_null:true;[R1] [C1] column_value_new:[7](1);[R1] [C2] column_name:C1;[R1] [C2] column_type:MYSQL_TYPE_NEWDECIMAL;[R1] [C2] column_is_rowkey:false;[R1] [C2] column_is_signed:true;[R1] [C2] column_encoding:binary;[R1] [C2] column_is_not_null:false;[R1] [C2] column_value_new:[7](1);[R1] [C3] column_name:C2;[R1] [C3] column_type:MYSQL_TYPE_OB_NCHAR;[R1] [C3] column_is_rowkey:false;[R1] [C3] column_is_signed:true;[R1] [C3] column_encoding:utf16;[R1] [C3] column_is_not_null:false;[R1] [C3] column_value_new:[](22);[R1] [C3] column_value_new_hex:[00200020002000200020002000200020002000200020](44);$[R2] COMMIT;
drop user oblog_db cascade;
ob1.oblog.next;
[R0] record_type:EDDL;[R0] db_name:oracle;[R0] table_name:;[R0] column_count:1;[R0] column_name:ddl;[R0] ddl_stmt_str: DROP USER "OBLOG_DB" CASCADE;[R0] ddl_stmt_len: 28;
ob1.oblog.stop;
