ob1=OBI(cluster=1,init_unit_cpu=2);
ob1.reboot;
ob1.mysql alter system set resource_hard_limit= 800;
drop tenant if exists oracle;
drop resource pool if exists oblog_pool;
drop resource unit if exists oblog_box;
ob1.mysql create resource unit oblog_box max_cpu 2, memory_size='20G';
ob1.mysql create resource pool oblog_pool unit = 'oblog_box', unit_num = 1;
ob1.mysql create tenant oracle replica_num = 1, resource_pool_list=('oblog_pool') set ob_tcp_invited_nodes='%', ob_compatibility_mode='oracle';
ob1.mysql alter tenant oracle set variables autocommit='on';
ob1.mysql alter tenant oracle set variables nls_date_format='YYYY-MM-DD HH24:MI:SS';
ob1.mysql alter tenant oracle set variables nls_timestamp_format='YYYY-MM-DD HH24:MI:SS.FF';
ob1.mysql alter tenant oracle set variables nls_timestamp_tz_format='YYYY-MM-DD HH24:MI:SS.FF TZR TZD';
create user obtest IDENTIFIED BY "obtest";
grant all on *.* to obtest WITH GRANT OPTION;
grant dba to obtest;
alter session set current_schema = oblog_db;
ob1.oblog.gen_conf tb_white_list=oracle.*.* log_level=DEBUG skip_ob_version_compat_check=1;
ob1.oblog.restart;
grant dba to ORAAUDITOR;
alter user ORAAUDITOR account unlock;
ob1.oblog.next;
[R0] record_type:EDDL;[R0] db_name:oracle;[R0] table_name:;[R0] column_count:1;[R0] column_name:ddl;[R0] ddl_stmt_str: ALTER USER "ORAAUDITOR" ACCOUNT UNLOCK;[R0] ddl_stmt_len: 38;
alter user ORAAUDITOR IDENTIFIED BY ORAAUDITOR;
ob1.oblog.next;
[R0] record_type:EDDL;[R0] db_name:oracle;[R0] table_name:;[R0] column_count:1;[R0] column_name:ddl;[R0] ddl_stmt_str: SET PASSWORD FOR "ORAAUDITOR" = '*9753e2cf9d2dcd5e13c052f581c310ac70c62723';[R0] ddl_stmt_len: 75;
alter session set current_schema = oblog_db;
alter system set audit_sys_operations = 'true';
alter system set audit_trail = 'DB,EXTENDED';
set @@recyclebin=OFF;
set @@ob_enable_plan_cache=OFF;
set @@ob_query_timeout=10 * @@ob_query_timeout;
select TENANT_ID, bitand(AUDIT_ID, 1099511627775) AUDIT_ID, AUDIT_TYPE, bitand(OWNER_ID, 1099511627775) OWNER_ID, OPERATION_TYPE, IN_SUCCESS, IN_FAILURE from sys.ALL_VIRTUAL_TENANT_SECURITY_AUDIT_REAL_AGENT;
TENANT_ID	AUDIT_ID	AUDIT_TYPE	OWNER_ID	OPERATION_TYPE	IN_SUCCESS	IN_FAILURE
create sequence s1;
ob1.oblog.next;
[R0] record_type:EDDL;[R0] db_name:oracle.OBLOG_DB;[R0] table_name:;[R0] column_count:1;[R0] column_name:ddl;[R0] ddl_stmt_str: create sequence s1;[R0] ddl_stmt_len: 18;
create table t1 (pk int primary key, a int);
ob1.oblog.next;
[R0] record_type:EDDL;[R0] db_name:oracle.OBLOG_DB;[R0] table_name:;[R0] column_count:1;[R0] column_name:ddl;[R0] ddl_stmt_str: create table t1 (pk int primary key, a int);[R0] ddl_stmt_len: 43;
insert into t1 values (s1.nextval, 1);
ob1.oblog.next;
[R0] BEGIN;[R0] org_cluster_id:1;[R1] record_type:INSERT;[R1] database_name:oracle.OBLOG_DB;[R1] table_name:T1;[R1] log_event:true;[R1] column_count:2;[R1] source_category:SRC_FULL_RECORDED;[R1] source_type:SRC_OCEANBASE_1_0;[R1] has_pk:true;[R1] pk_info:(0);[R1] pks:PK;[R1] has_uk:false;[R1] uk_info:(null);[R1] uks:(null);[R1] [C1] column_name:PK;[R1] [C1] column_type:MYSQL_TYPE_NEWDECIMAL;[R1] [C1] column_is_rowkey:true;[R1] [C1] column_is_signed:true;[R1] [C1] column_encoding:binary;[R1] [C1] column_is_not_null:true;[R1] [C1] column_value_new:[1](1);[R1] [C2] column_name:A;[R1] [C2] column_type:MYSQL_TYPE_NEWDECIMAL;[R1] [C2] column_is_rowkey:false;[R1] [C2] column_is_signed:true;[R1] [C2] column_encoding:binary;[R1] [C2] column_is_not_null:false;[R1] [C2] column_value_new:[1](1);$[R2] COMMIT;
audit all statements by ORAAUDITOR;
ob1.oblog.next;
[R0] record_type:EDDL;[R0] db_name:oracle;[R0] table_name:;[R0] column_count:1;[R0] column_name:ddl;[R0] ddl_stmt_str: AUDIT ALL STATEMENTS BY "ORAAUDITOR" BY ACCESS ;[R0] ddl_stmt_len: 47;
audit all statements by SYS WHENEVER SUCCESSFUL;
ob1.oblog.next;
[R0] record_type:EDDL;[R0] db_name:oracle;[R0] table_name:;[R0] column_count:1;[R0] column_name:ddl;[R0] ddl_stmt_str: AUDIT ALL STATEMENTS BY "SYS" BY ACCESS WHENEVER SUCCESSFUL ;[R0] ddl_stmt_len: 60;
audit all statements;
ob1.oblog.next;
[R0] record_type:EDDL;[R0] db_name:oracle;[R0] table_name:;[R0] column_count:1;[R0] column_name:ddl;[R0] ddl_stmt_str: AUDIT ALL STATEMENTS BY ACCESS ;[R0] ddl_stmt_len: 31;
audit all on t1;
ob1.oblog.next;
[R0] record_type:EDDL;[R0] db_name:oracle;[R0] table_name:;[R0] column_count:1;[R0] column_name:ddl;[R0] ddl_stmt_str: AUDIT ALTER ON "OBLOG_DB"."T1" BY ACCESS ;[R0] ddl_stmt_len: 41;
ob1.oblog.next;
[R0] record_type:EDDL;[R0] db_name:oracle;[R0] table_name:;[R0] column_count:1;[R0] column_name:ddl;[R0] ddl_stmt_str: AUDIT AUDIT ON "OBLOG_DB"."T1" BY ACCESS ;[R0] ddl_stmt_len: 41;
ob1.oblog.next;
[R0] record_type:EDDL;[R0] db_name:oracle;[R0] table_name:;[R0] column_count:1;[R0] column_name:ddl;[R0] ddl_stmt_str: AUDIT COMMENT ON "OBLOG_DB"."T1" BY ACCESS ;[R0] ddl_stmt_len: 43;
ob1.oblog.next;
[R0] record_type:EDDL;[R0] db_name:oracle;[R0] table_name:;[R0] column_count:1;[R0] column_name:ddl;[R0] ddl_stmt_str: AUDIT DELETE ON "OBLOG_DB"."T1" BY ACCESS ;[R0] ddl_stmt_len: 42;
ob1.oblog.next;
[R0] record_type:EDDL;[R0] db_name:oracle;[R0] table_name:;[R0] column_count:1;[R0] column_name:ddl;[R0] ddl_stmt_str: AUDIT GRANT ON "OBLOG_DB"."T1" BY ACCESS ;[R0] ddl_stmt_len: 41;
ob1.oblog.next;
[R0] record_type:EDDL;[R0] db_name:oracle;[R0] table_name:;[R0] column_count:1;[R0] column_name:ddl;[R0] ddl_stmt_str: AUDIT INDEX ON "OBLOG_DB"."T1" BY ACCESS ;[R0] ddl_stmt_len: 41;
ob1.oblog.next;
[R0] record_type:EDDL;[R0] db_name:oracle;[R0] table_name:;[R0] column_count:1;[R0] column_name:ddl;[R0] ddl_stmt_str: AUDIT INSERT ON "OBLOG_DB"."T1" BY ACCESS ;[R0] ddl_stmt_len: 42;
ob1.oblog.next;
[R0] record_type:EDDL;[R0] db_name:oracle;[R0] table_name:;[R0] column_count:1;[R0] column_name:ddl;[R0] ddl_stmt_str: AUDIT RENAME ON "OBLOG_DB"."T1" BY ACCESS ;[R0] ddl_stmt_len: 42;
ob1.oblog.next;
[R0] record_type:EDDL;[R0] db_name:oracle;[R0] table_name:;[R0] column_count:1;[R0] column_name:ddl;[R0] ddl_stmt_str: AUDIT SELECT ON "OBLOG_DB"."T1" BY ACCESS ;[R0] ddl_stmt_len: 42;
ob1.oblog.next;
[R0] record_type:EDDL;[R0] db_name:oracle;[R0] table_name:;[R0] column_count:1;[R0] column_name:ddl;[R0] ddl_stmt_str: AUDIT UPDATE ON "OBLOG_DB"."T1" BY ACCESS ;[R0] ddl_stmt_len: 42;
ob1.oblog.next;
[R0] record_type:EDDL;[R0] db_name:oracle;[R0] table_name:;[R0] column_count:1;[R0] column_name:ddl;[R0] ddl_stmt_str: AUDIT FLASHBACK ON "OBLOG_DB"."T1" BY ACCESS ;[R0] ddl_stmt_len: 45;
audit all on s1;
ob1.oblog.next;
[R0] record_type:EDDL;[R0] db_name:oracle;[R0] table_name:;[R0] column_count:1;[R0] column_name:ddl;[R0] ddl_stmt_str: AUDIT ALTER ON "OBLOG_DB"."S1" BY ACCESS ;[R0] ddl_stmt_len: 41;
ob1.oblog.next;
[R0] record_type:EDDL;[R0] db_name:oracle;[R0] table_name:;[R0] column_count:1;[R0] column_name:ddl;[R0] ddl_stmt_str: AUDIT AUDIT ON "OBLOG_DB"."S1" BY ACCESS ;[R0] ddl_stmt_len: 41;
ob1.oblog.next;
[R0] record_type:EDDL;[R0] db_name:oracle;[R0] table_name:;[R0] column_count:1;[R0] column_name:ddl;[R0] ddl_stmt_str: AUDIT GRANT ON "OBLOG_DB"."S1" BY ACCESS ;[R0] ddl_stmt_len: 41;
ob1.oblog.next;
[R0] record_type:EDDL;[R0] db_name:oracle;[R0] table_name:;[R0] column_count:1;[R0] column_name:ddl;[R0] ddl_stmt_str: AUDIT SELECT ON "OBLOG_DB"."S1" BY ACCESS ;[R0] ddl_stmt_len: 42;
audit all on default;
ob1.oblog.next;
[R0] record_type:EDDL;[R0] db_name:oracle;[R0] table_name:;[R0] column_count:1;[R0] column_name:ddl;[R0] ddl_stmt_str: AUDIT ALTER ON DEFAULT BY ACCESS ;[R0] ddl_stmt_len: 33;
ob1.oblog.next;
[R0] record_type:EDDL;[R0] db_name:oracle;[R0] table_name:;[R0] column_count:1;[R0] column_name:ddl;[R0] ddl_stmt_str: AUDIT AUDIT ON DEFAULT BY ACCESS ;[R0] ddl_stmt_len: 33;
ob1.oblog.next;
[R0] record_type:EDDL;[R0] db_name:oracle;[R0] table_name:;[R0] column_count:1;[R0] column_name:ddl;[R0] ddl_stmt_str: AUDIT COMMENT ON DEFAULT BY ACCESS ;[R0] ddl_stmt_len: 35;
ob1.oblog.next;
[R0] record_type:EDDL;[R0] db_name:oracle;[R0] table_name:;[R0] column_count:1;[R0] column_name:ddl;[R0] ddl_stmt_str: AUDIT DELETE ON DEFAULT BY ACCESS ;[R0] ddl_stmt_len: 34;
ob1.oblog.next;
[R0] record_type:EDDL;[R0] db_name:oracle;[R0] table_name:;[R0] column_count:1;[R0] column_name:ddl;[R0] ddl_stmt_str: AUDIT GRANT ON DEFAULT BY ACCESS ;[R0] ddl_stmt_len: 33;
ob1.oblog.next;
[R0] record_type:EDDL;[R0] db_name:oracle;[R0] table_name:;[R0] column_count:1;[R0] column_name:ddl;[R0] ddl_stmt_str: AUDIT INDEX ON DEFAULT BY ACCESS ;[R0] ddl_stmt_len: 33;
ob1.oblog.next;
[R0] record_type:EDDL;[R0] db_name:oracle;[R0] table_name:;[R0] column_count:1;[R0] column_name:ddl;[R0] ddl_stmt_str: AUDIT INSERT ON DEFAULT BY ACCESS ;[R0] ddl_stmt_len: 34;
ob1.oblog.next;
[R0] record_type:EDDL;[R0] db_name:oracle;[R0] table_name:;[R0] column_count:1;[R0] column_name:ddl;[R0] ddl_stmt_str: AUDIT RENAME ON DEFAULT BY ACCESS ;[R0] ddl_stmt_len: 34;
ob1.oblog.next;
[R0] record_type:EDDL;[R0] db_name:oracle;[R0] table_name:;[R0] column_count:1;[R0] column_name:ddl;[R0] ddl_stmt_str: AUDIT SELECT ON DEFAULT BY ACCESS ;[R0] ddl_stmt_len: 34;
ob1.oblog.next;
[R0] record_type:EDDL;[R0] db_name:oracle;[R0] table_name:;[R0] column_count:1;[R0] column_name:ddl;[R0] ddl_stmt_str: AUDIT UPDATE ON DEFAULT BY ACCESS ;[R0] ddl_stmt_len: 34;
ob1.oblog.next;
[R0] record_type:EDDL;[R0] db_name:oracle;[R0] table_name:;[R0] column_count:1;[R0] column_name:ddl;[R0] ddl_stmt_str: AUDIT EXECUTE ON DEFAULT BY ACCESS ;[R0] ddl_stmt_len: 35;
ob1.oblog.next;
[R0] record_type:EDDL;[R0] db_name:oracle;[R0] table_name:;[R0] column_count:1;[R0] column_name:ddl;[R0] ddl_stmt_str: AUDIT FLASHBACK ON DEFAULT BY ACCESS ;[R0] ddl_stmt_len: 37;
select TENANT_ID, bitand(AUDIT_ID, 1099511627775) AUDIT_ID, AUDIT_TYPE, bitand(OWNER_ID, 1099511627775) OWNER_ID, OPERATION_TYPE, IN_SUCCESS, IN_FAILURE from sys.ALL_VIRTUAL_TENANT_SECURITY_AUDIT_REAL_AGENT;
TENANT_ID	AUDIT_ID	AUDIT_TYPE	OWNER_ID	OPERATION_TYPE	IN_SUCCESS	IN_FAILURE
1006	500009	2	200005	1	3	3
1006	500010	2	200003	1	3	1
1006	500011	1	200010	1	3	3
1006	500012	4	500007	39	3	3
1006	500013	4	500007	40	3	3
1006	500014	4	500007	41	3	3
1006	500015	4	500007	42	3	3
1006	500016	4	500007	43	3	3
1006	500017	4	500007	44	3	3
1006	500018	4	500007	45	3	3
1006	500019	4	500007	47	3	3
1006	500020	4	500007	48	3	3
1006	500021	4	500007	49	3	3
1006	500022	4	500007	55	3	3
1006	500023	5	500006	39	3	3
1006	500024	5	500006	40	3	3
1006	500025	5	500006	43	3	3
1006	500026	5	500006	48	3	3
1006	500027	3	200010	39	3	3
1006	500028	3	200010	40	3	3
1006	500029	3	200010	41	3	3
1006	500030	3	200010	42	3	3
1006	500031	3	200010	43	3	3
1006	500032	3	200010	44	3	3
1006	500033	3	200010	45	3	3
1006	500034	3	200010	47	3	3
1006	500035	3	200010	48	3	3
1006	500036	3	200010	49	3	3
1006	500037	3	200010	51	3	3
1006	500038	3	200010	55	3	3
insert into t1 values (s1.nextval, 2);
ob1.oblog.next;
[R0] BEGIN;[R0] org_cluster_id:1;[R1] record_type:INSERT;[R1] database_name:oracle.OBLOG_DB;[R1] table_name:T1;[R1] log_event:true;[R1] column_count:2;[R1] source_category:SRC_FULL_RECORDED;[R1] source_type:SRC_OCEANBASE_1_0;[R1] has_pk:true;[R1] pk_info:(0);[R1] pks:PK;[R1] has_uk:false;[R1] uk_info:(null);[R1] uks:(null);[R1] [C1] column_name:PK;[R1] [C1] column_type:MYSQL_TYPE_NEWDECIMAL;[R1] [C1] column_is_rowkey:true;[R1] [C1] column_is_signed:true;[R1] [C1] column_encoding:binary;[R1] [C1] column_is_not_null:true;[R1] [C1] column_value_new:[2](1);[R1] [C2] column_name:A;[R1] [C2] column_type:MYSQL_TYPE_NEWDECIMAL;[R1] [C2] column_is_rowkey:false;[R1] [C2] column_is_signed:true;[R1] [C2] column_encoding:binary;[R1] [C2] column_is_not_null:false;[R1] [C2] column_value_new:[2](1);$[R2] COMMIT;
update t1 set a =3;
ob1.oblog.next;
[R0] BEGIN;[R0] org_cluster_id:1;[R1] record_type:UPDATE;[R1] database_name:oracle.OBLOG_DB;[R1] table_name:T1;[R1] log_event:true;[R1] column_count:2;[R1] source_category:SRC_FULL_RECORDED;[R1] source_type:SRC_OCEANBASE_1_0;[R1] has_pk:true;[R1] pk_info:(0);[R1] pks:PK;[R1] has_uk:false;[R1] uk_info:(null);[R1] uks:(null);[R1] [C1] column_name:PK;[R1] [C1] column_type:MYSQL_TYPE_NEWDECIMAL;[R1] [C1] column_is_rowkey:true;[R1] [C1] column_is_signed:true;[R1] [C1] column_encoding:binary;[R1] [C1] column_is_not_null:true;[R1] [C1] column_value_new:[1](1);[R1] [C1] column_value_old:[1](1);[R1] [C2] column_name:A;[R1] [C2] column_type:MYSQL_TYPE_NEWDECIMAL;[R1] [C2] column_is_rowkey:false;[R1] [C2] column_is_signed:true;[R1] [C2] column_encoding:binary;[R1] [C2] column_is_not_null:false;[R1] [C2] column_value_new:[3](1);[R1] [C2] column_value_old:[1](1);$[R2] record_type:UPDATE;[R2] database_name:oracle.OBLOG_DB;[R2] table_name:T1;[R2] log_event:true;[R2] column_count:2;[R2] source_category:SRC_FULL_RECORDED;[R2] source_type:SRC_OCEANBASE_1_0;[R2] has_pk:true;[R2] pk_info:(0);[R2] pks:PK;[R2] has_uk:false;[R2] uk_info:(null);[R2] uks:(null);[R2] [C1] column_name:PK;[R2] [C1] column_type:MYSQL_TYPE_NEWDECIMAL;[R2] [C1] column_is_rowkey:true;[R2] [C1] column_is_signed:true;[R2] [C1] column_encoding:binary;[R2] [C1] column_is_not_null:true;[R2] [C1] column_value_new:[2](1);[R2] [C1] column_value_old:[2](1);[R2] [C2] column_name:A;[R2] [C2] column_type:MYSQL_TYPE_NEWDECIMAL;[R2] [C2] column_is_rowkey:false;[R2] [C2] column_is_signed:true;[R2] [C2] column_encoding:binary;[R2] [C2] column_is_not_null:false;[R2] [C2] column_value_new:[3](1);[R2] [C2] column_value_old:[2](1);$[R3] COMMIT;
select * from t1;
PK	A
1	3
2	3
delete from t1 where a=3;
ob1.oblog.next;
[R0] BEGIN;[R0] org_cluster_id:1;[R1] record_type:DELETE;[R1] database_name:oracle.OBLOG_DB;[R1] table_name:T1;[R1] log_event:true;[R1] column_count:2;[R1] source_category:SRC_FULL_RECORDED;[R1] source_type:SRC_OCEANBASE_1_0;[R1] has_pk:true;[R1] pk_info:(0);[R1] pks:PK;[R1] has_uk:false;[R1] uk_info:(null);[R1] uks:(null);[R1] [C1] column_name:PK;[R1] [C1] column_type:MYSQL_TYPE_NEWDECIMAL;[R1] [C1] column_is_rowkey:true;[R1] [C1] column_is_signed:true;[R1] [C1] column_encoding:binary;[R1] [C1] column_is_not_null:true;[R1] [C1] column_value_old:[1](1);[R1] [C2] column_name:A;[R1] [C2] column_type:MYSQL_TYPE_NEWDECIMAL;[R1] [C2] column_is_rowkey:false;[R1] [C2] column_is_signed:true;[R1] [C2] column_encoding:binary;[R1] [C2] column_is_not_null:false;[R1] [C2] column_value_old:[3](1);$[R2] record_type:DELETE;[R2] database_name:oracle.OBLOG_DB;[R2] table_name:T1;[R2] log_event:true;[R2] column_count:2;[R2] source_category:SRC_FULL_RECORDED;[R2] source_type:SRC_OCEANBASE_1_0;[R2] has_pk:true;[R2] pk_info:(0);[R2] pks:PK;[R2] has_uk:false;[R2] uk_info:(null);[R2] uks:(null);[R2] [C1] column_name:PK;[R2] [C1] column_type:MYSQL_TYPE_NEWDECIMAL;[R2] [C1] column_is_rowkey:true;[R2] [C1] column_is_signed:true;[R2] [C1] column_encoding:binary;[R2] [C1] column_is_not_null:true;[R2] [C1] column_value_old:[2](1);[R2] [C2] column_name:A;[R2] [C2] column_type:MYSQL_TYPE_NEWDECIMAL;[R2] [C2] column_is_rowkey:false;[R2] [C2] column_is_signed:true;[R2] [C2] column_encoding:binary;[R2] [C2] column_is_not_null:false;[R2] [C2] column_value_old:[3](1);$[R3] COMMIT;
create table t2 (pk int primary key, a int);
ob1.oblog.next;
[R0] record_type:EDDL;[R0] db_name:oracle.OBLOG_DB;[R0] table_name:;[R0] column_count:1;[R0] column_name:ddl;[R0] ddl_stmt_str: create table t2 (pk int primary key, a int);[R0] ddl_stmt_len: 43;
insert into t2 values (s1.currval, 1);
ob1.oblog.next;
[R0] BEGIN;[R0] org_cluster_id:1;[R1] record_type:INSERT;[R1] database_name:oracle.OBLOG_DB;[R1] table_name:T2;[R1] log_event:true;[R1] column_count:2;[R1] source_category:SRC_FULL_RECORDED;[R1] source_type:SRC_OCEANBASE_1_0;[R1] has_pk:true;[R1] pk_info:(0);[R1] pks:PK;[R1] has_uk:false;[R1] uk_info:(null);[R1] uks:(null);[R1] [C1] column_name:PK;[R1] [C1] column_type:MYSQL_TYPE_NEWDECIMAL;[R1] [C1] column_is_rowkey:true;[R1] [C1] column_is_signed:true;[R1] [C1] column_encoding:binary;[R1] [C1] column_is_not_null:true;[R1] [C1] column_value_new:[2](1);[R1] [C2] column_name:A;[R1] [C2] column_type:MYSQL_TYPE_NEWDECIMAL;[R1] [C2] column_is_rowkey:false;[R1] [C2] column_is_signed:true;[R1] [C2] column_encoding:binary;[R1] [C2] column_is_not_null:false;[R1] [C2] column_value_new:[1](1);$[R2] COMMIT;
update t2 set a =3;
ob1.oblog.next;
[R0] BEGIN;[R0] org_cluster_id:1;[R1] record_type:UPDATE;[R1] database_name:oracle.OBLOG_DB;[R1] table_name:T2;[R1] log_event:true;[R1] column_count:2;[R1] source_category:SRC_FULL_RECORDED;[R1] source_type:SRC_OCEANBASE_1_0;[R1] has_pk:true;[R1] pk_info:(0);[R1] pks:PK;[R1] has_uk:false;[R1] uk_info:(null);[R1] uks:(null);[R1] [C1] column_name:PK;[R1] [C1] column_type:MYSQL_TYPE_NEWDECIMAL;[R1] [C1] column_is_rowkey:true;[R1] [C1] column_is_signed:true;[R1] [C1] column_encoding:binary;[R1] [C1] column_is_not_null:true;[R1] [C1] column_value_new:[2](1);[R1] [C1] column_value_old:[2](1);[R1] [C2] column_name:A;[R1] [C2] column_type:MYSQL_TYPE_NEWDECIMAL;[R1] [C2] column_is_rowkey:false;[R1] [C2] column_is_signed:true;[R1] [C2] column_encoding:binary;[R1] [C2] column_is_not_null:false;[R1] [C2] column_value_new:[3](1);[R1] [C2] column_value_old:[1](1);$[R2] COMMIT;
select * from t2;
PK	A
2	3
delete from t2 where a=3;
ob1.oblog.next;
[R0] BEGIN;[R0] org_cluster_id:1;[R1] record_type:DELETE;[R1] database_name:oracle.OBLOG_DB;[R1] table_name:T2;[R1] log_event:true;[R1] column_count:2;[R1] source_category:SRC_FULL_RECORDED;[R1] source_type:SRC_OCEANBASE_1_0;[R1] has_pk:true;[R1] pk_info:(0);[R1] pks:PK;[R1] has_uk:false;[R1] uk_info:(null);[R1] uks:(null);[R1] [C1] column_name:PK;[R1] [C1] column_type:MYSQL_TYPE_NEWDECIMAL;[R1] [C1] column_is_rowkey:true;[R1] [C1] column_is_signed:true;[R1] [C1] column_encoding:binary;[R1] [C1] column_is_not_null:true;[R1] [C1] column_value_old:[2](1);[R1] [C2] column_name:A;[R1] [C2] column_type:MYSQL_TYPE_NEWDECIMAL;[R1] [C2] column_is_rowkey:false;[R1] [C2] column_is_signed:true;[R1] [C2] column_encoding:binary;[R1] [C2] column_is_not_null:false;[R1] [C2] column_value_old:[3](1);$[R2] COMMIT;
drop table t2;
ob1.oblog.next;
[R0] record_type:EDDL;[R0] db_name:oracle.OBLOG_DB;[R0] table_name:;[R0] column_count:1;[R0] column_name:ddl;[R0] ddl_stmt_str: DROP TABLE "OBLOG_DB"."T2";[R0] ddl_stmt_len: 26;
noaudit all statements by ORAAUDITOR;
ob1.oblog.next;
[R0] record_type:EDDL;[R0] db_name:oracle;[R0] table_name:;[R0] column_count:1;[R0] column_name:ddl;[R0] ddl_stmt_str: NOAUDIT ALL STATEMENTS BY "ORAAUDITOR" ;[R0] ddl_stmt_len: 39;
noaudit all statements by SYS WHENEVER SUCCESSFUL;
ob1.oblog.next;
[R0] record_type:EDDL;[R0] db_name:oracle;[R0] table_name:;[R0] column_count:1;[R0] column_name:ddl;[R0] ddl_stmt_str: NOAUDIT ALL STATEMENTS BY "SYS" WHENEVER SUCCESSFUL ;[R0] ddl_stmt_len: 52;
noaudit all statements;
ob1.oblog.next;
[R0] record_type:EDDL;[R0] db_name:oracle;[R0] table_name:;[R0] column_count:1;[R0] column_name:ddl;[R0] ddl_stmt_str: NOAUDIT ALL STATEMENTS ;[R0] ddl_stmt_len: 23;
noaudit all on t1;
ob1.oblog.next;
[R0] record_type:EDDL;[R0] db_name:oracle;[R0] table_name:;[R0] column_count:1;[R0] column_name:ddl;[R0] ddl_stmt_str: NOAUDIT ALTER ON "OBLOG_DB"."T1" ;[R0] ddl_stmt_len: 33;
ob1.oblog.next;
[R0] record_type:EDDL;[R0] db_name:oracle;[R0] table_name:;[R0] column_count:1;[R0] column_name:ddl;[R0] ddl_stmt_str: NOAUDIT AUDIT ON "OBLOG_DB"."T1" ;[R0] ddl_stmt_len: 33;
ob1.oblog.next;
[R0] record_type:EDDL;[R0] db_name:oracle;[R0] table_name:;[R0] column_count:1;[R0] column_name:ddl;[R0] ddl_stmt_str: NOAUDIT COMMENT ON "OBLOG_DB"."T1" ;[R0] ddl_stmt_len: 35;
ob1.oblog.next;
[R0] record_type:EDDL;[R0] db_name:oracle;[R0] table_name:;[R0] column_count:1;[R0] column_name:ddl;[R0] ddl_stmt_str: NOAUDIT DELETE ON "OBLOG_DB"."T1" ;[R0] ddl_stmt_len: 34;
ob1.oblog.next;
[R0] record_type:EDDL;[R0] db_name:oracle;[R0] table_name:;[R0] column_count:1;[R0] column_name:ddl;[R0] ddl_stmt_str: NOAUDIT GRANT ON "OBLOG_DB"."T1" ;[R0] ddl_stmt_len: 33;
ob1.oblog.next;
[R0] record_type:EDDL;[R0] db_name:oracle;[R0] table_name:;[R0] column_count:1;[R0] column_name:ddl;[R0] ddl_stmt_str: NOAUDIT INDEX ON "OBLOG_DB"."T1" ;[R0] ddl_stmt_len: 33;
ob1.oblog.next;
[R0] record_type:EDDL;[R0] db_name:oracle;[R0] table_name:;[R0] column_count:1;[R0] column_name:ddl;[R0] ddl_stmt_str: NOAUDIT INSERT ON "OBLOG_DB"."T1" ;[R0] ddl_stmt_len: 34;
ob1.oblog.next;
[R0] record_type:EDDL;[R0] db_name:oracle;[R0] table_name:;[R0] column_count:1;[R0] column_name:ddl;[R0] ddl_stmt_str: NOAUDIT RENAME ON "OBLOG_DB"."T1" ;[R0] ddl_stmt_len: 34;
ob1.oblog.next;
[R0] record_type:EDDL;[R0] db_name:oracle;[R0] table_name:;[R0] column_count:1;[R0] column_name:ddl;[R0] ddl_stmt_str: NOAUDIT SELECT ON "OBLOG_DB"."T1" ;[R0] ddl_stmt_len: 34;
ob1.oblog.next;
[R0] record_type:EDDL;[R0] db_name:oracle;[R0] table_name:;[R0] column_count:1;[R0] column_name:ddl;[R0] ddl_stmt_str: NOAUDIT UPDATE ON "OBLOG_DB"."T1" ;[R0] ddl_stmt_len: 34;
ob1.oblog.next;
[R0] record_type:EDDL;[R0] db_name:oracle;[R0] table_name:;[R0] column_count:1;[R0] column_name:ddl;[R0] ddl_stmt_str: NOAUDIT FLASHBACK ON "OBLOG_DB"."T1" ;[R0] ddl_stmt_len: 37;
noaudit all on s1;
ob1.oblog.next;
[R0] record_type:EDDL;[R0] db_name:oracle;[R0] table_name:;[R0] column_count:1;[R0] column_name:ddl;[R0] ddl_stmt_str: NOAUDIT ALTER ON "OBLOG_DB"."S1" ;[R0] ddl_stmt_len: 33;
ob1.oblog.next;
[R0] record_type:EDDL;[R0] db_name:oracle;[R0] table_name:;[R0] column_count:1;[R0] column_name:ddl;[R0] ddl_stmt_str: NOAUDIT AUDIT ON "OBLOG_DB"."S1" ;[R0] ddl_stmt_len: 33;
ob1.oblog.next;
[R0] record_type:EDDL;[R0] db_name:oracle;[R0] table_name:;[R0] column_count:1;[R0] column_name:ddl;[R0] ddl_stmt_str: NOAUDIT GRANT ON "OBLOG_DB"."S1" ;[R0] ddl_stmt_len: 33;
ob1.oblog.next;
[R0] record_type:EDDL;[R0] db_name:oracle;[R0] table_name:;[R0] column_count:1;[R0] column_name:ddl;[R0] ddl_stmt_str: NOAUDIT SELECT ON "OBLOG_DB"."S1" ;[R0] ddl_stmt_len: 34;
noaudit all on default;
ob1.oblog.next;
[R0] record_type:EDDL;[R0] db_name:oracle;[R0] table_name:;[R0] column_count:1;[R0] column_name:ddl;[R0] ddl_stmt_str: NOAUDIT ALTER ON DEFAULT ;[R0] ddl_stmt_len: 25;
ob1.oblog.next;
[R0] record_type:EDDL;[R0] db_name:oracle;[R0] table_name:;[R0] column_count:1;[R0] column_name:ddl;[R0] ddl_stmt_str: NOAUDIT AUDIT ON DEFAULT ;[R0] ddl_stmt_len: 25;
ob1.oblog.next;
[R0] record_type:EDDL;[R0] db_name:oracle;[R0] table_name:;[R0] column_count:1;[R0] column_name:ddl;[R0] ddl_stmt_str: NOAUDIT COMMENT ON DEFAULT ;[R0] ddl_stmt_len: 27;
ob1.oblog.next;
[R0] record_type:EDDL;[R0] db_name:oracle;[R0] table_name:;[R0] column_count:1;[R0] column_name:ddl;[R0] ddl_stmt_str: NOAUDIT DELETE ON DEFAULT ;[R0] ddl_stmt_len: 26;
ob1.oblog.next;
[R0] record_type:EDDL;[R0] db_name:oracle;[R0] table_name:;[R0] column_count:1;[R0] column_name:ddl;[R0] ddl_stmt_str: NOAUDIT GRANT ON DEFAULT ;[R0] ddl_stmt_len: 25;
ob1.oblog.next;
[R0] record_type:EDDL;[R0] db_name:oracle;[R0] table_name:;[R0] column_count:1;[R0] column_name:ddl;[R0] ddl_stmt_str: NOAUDIT INDEX ON DEFAULT ;[R0] ddl_stmt_len: 25;
ob1.oblog.next;
[R0] record_type:EDDL;[R0] db_name:oracle;[R0] table_name:;[R0] column_count:1;[R0] column_name:ddl;[R0] ddl_stmt_str: NOAUDIT INSERT ON DEFAULT ;[R0] ddl_stmt_len: 26;
ob1.oblog.next;
[R0] record_type:EDDL;[R0] db_name:oracle;[R0] table_name:;[R0] column_count:1;[R0] column_name:ddl;[R0] ddl_stmt_str: NOAUDIT RENAME ON DEFAULT ;[R0] ddl_stmt_len: 26;
ob1.oblog.next;
[R0] record_type:EDDL;[R0] db_name:oracle;[R0] table_name:;[R0] column_count:1;[R0] column_name:ddl;[R0] ddl_stmt_str: NOAUDIT SELECT ON DEFAULT ;[R0] ddl_stmt_len: 26;
ob1.oblog.next;
[R0] record_type:EDDL;[R0] db_name:oracle;[R0] table_name:;[R0] column_count:1;[R0] column_name:ddl;[R0] ddl_stmt_str: NOAUDIT UPDATE ON DEFAULT ;[R0] ddl_stmt_len: 26;
ob1.oblog.next;
[R0] record_type:EDDL;[R0] db_name:oracle;[R0] table_name:;[R0] column_count:1;[R0] column_name:ddl;[R0] ddl_stmt_str: NOAUDIT EXECUTE ON DEFAULT ;[R0] ddl_stmt_len: 27;
ob1.oblog.next;
[R0] record_type:EDDL;[R0] db_name:oracle;[R0] table_name:;[R0] column_count:1;[R0] column_name:ddl;[R0] ddl_stmt_str: NOAUDIT FLASHBACK ON DEFAULT ;[R0] ddl_stmt_len: 29;
select TENANT_ID, bitand(AUDIT_ID, 1099511627775) AUDIT_ID, AUDIT_TYPE, bitand(OWNER_ID, 1099511627775) OWNER_ID, OPERATION_TYPE, IN_SUCCESS, IN_FAILURE from sys.ALL_VIRTUAL_TENANT_SECURITY_AUDIT_REAL_AGENT;
TENANT_ID	AUDIT_ID	AUDIT_TYPE	OWNER_ID	OPERATION_TYPE	IN_SUCCESS	IN_FAILURE
drop user oblog_db cascade;
ob1.oblog.next;
[R0] record_type:EDDL;[R0] db_name:oracle;[R0] table_name:;[R0] column_count:1;[R0] column_name:ddl;[R0] ddl_stmt_str: DROP USER "OBLOG_DB" CASCADE;[R0] ddl_stmt_len: 28;
ob1.oblog.stop;
