ob1=OBI(cluster=1);
ob1.reboot;
ob1.create_client;
ob1.mysql alter system set resource_hard_limit= 800;
drop tenant if exists oracle;
drop resource pool if exists oblog_pool;
drop resource unit if exists oblog_box;
ob1.mysql create resource unit oblog_box max_cpu 2, memory_size='20G';
ob1.mysql create resource pool oblog_pool unit = 'oblog_box', unit_num = 1;
ob1.mysql create tenant oracle replica_num = 1, resource_pool_list=('oblog_pool') set ob_tcp_invited_nodes='%', ob_compatibility_mode='oracle';
ob1.mysql alter tenant oracle set variables autocommit='on';
ob1.mysql alter tenant oracle set variables nls_date_format='YYYY-MM-DD HH24:MI:SS';
ob1.mysql alter tenant oracle set variables nls_timestamp_format='YYYY-MM-DD HH24:MI:SS.FF';
ob1.mysql alter tenant oracle set variables nls_timestamp_tz_format='YYYY-MM-DD HH24:MI:SS.FF TZR TZD';
create user obtest IDENTIFIED BY "obtest";
grant all on *.* to obtest WITH GRANT OPTION;
grant dba to obtest;
alter session set current_schema = oblog_db;
alter tenant oracle set variables max_allowed_packet=1073741824;
set global max_allowed_packet=1073741824;
ob1.oblog.set_extra_argument -m;
ob1.oblog.gen_conf tb_white_list=oracle.*.*  test_mode_on=1 test_mode_ignore_redo_count=10 sort_trans_participants=1 skip_ob_version_compat_check=1;
ob1.oblog.restart;
CREATE OR REPLACE FUNCTION construct_clob(start_str IN VARCHAR2, padding_1 IN VARCHAR2, pad_length IN INTEGER, padding_2 IN VARCHAR2, end_str IN VARCHAR2) RETURN CLOB IS BEGIN  RETURN (to_clob(start_str) || RPAD(to_clob(padding_1), pad_length, padding_2) || end_str); END;
ob1.oblog.next;
[R0] record_type:EDDL;[R0] db_name:oracle.OBLOG_DB;[R0] table_name:;[R0] column_count:1;[R0] column_name:ddl;[R0] ddl_stmt_str: CREATE OR REPLACE FUNCTION construct_clob(start_str IN VARCHAR2, padding_1 IN VARCHAR2, pad_length IN INTEGER, padding_2 IN VARCHAR2, end_str IN VARCHAR2) RETURN CLOB IS BEGIN  RETURN (to_clob(start_str) || RPAD(to_clob(padding_1), pad_length, padding_2) || end_str); END;[R0] ddl_stmt_len: 271;
CREATE OR REPLACE FUNCTION calc_md5_clob(input_data IN CLOB) RETURN VARCHAR2 IS BEGIN  RETURN LOWER(RAWTOHEX(DBMS_CRYPTO.HASH(input_data, DBMS_CRYPTO.HASH_MD5))); END;
ob1.oblog.next;
[R0] record_type:EDDL;[R0] db_name:oracle.OBLOG_DB;[R0] table_name:;[R0] column_count:1;[R0] column_name:ddl;[R0] ddl_stmt_str: CREATE OR REPLACE FUNCTION calc_md5_clob(input_data IN CLOB) RETURN VARCHAR2 IS BEGIN  RETURN LOWER(RAWTOHEX(DBMS_CRYPTO.HASH(input_data, DBMS_CRYPTO.HASH_MD5))); END;[R0] ddl_stmt_len: 166;
CREATE OR REPLACE FUNCTION calc_md5_blob(input_data IN BLOB) RETURN VARCHAR2 IS BEGIN  RETURN LOWER(RAWTOHEX(DBMS_CRYPTO.HASH(input_data, DBMS_CRYPTO.HASH_MD5))); END;
ob1.oblog.next;
[R0] record_type:EDDL;[R0] db_name:oracle.OBLOG_DB;[R0] table_name:;[R0] column_count:1;[R0] column_name:ddl;[R0] ddl_stmt_str: CREATE OR REPLACE FUNCTION calc_md5_blob(input_data IN BLOB) RETURN VARCHAR2 IS BEGIN  RETURN LOWER(RAWTOHEX(DBMS_CRYPTO.HASH(input_data, DBMS_CRYPTO.HASH_MD5))); END;[R0] ddl_stmt_len: 166;
create table xml_test(pk int primary key, c1 varchar(100), c2 clob, c3 blob, c4 xmltype, c5 xmltype);
ob1.oblog.next;
[R0] record_type:EDDL;[R0] db_name:oracle.OBLOG_DB;[R0] table_name:;[R0] column_count:1;[R0] column_name:ddl;[R0] ddl_stmt_str: create table xml_test(pk int primary key, c1 varchar(100), c2 clob, c3 blob, c4 xmltype, c5 xmltype);[R0] ddl_stmt_len: 100;
insert into xml_test values(1, 'v1', 'clob-v1', utl_raw.cast_to_raw('blob-v1'), xmltype('<z>v1</z>'), xmltype('<x>v1</x>'));
ob1.oblog.next;
[R0] BEGIN;[R0] org_cluster_id:1;[R1] record_type:INSERT;[R1] database_name:oracle.OBLOG_DB;[R1] table_name:XML_TEST;[R1] log_event:true;[R1] column_count:6;[R1] source_category:SRC_FULL_RECORDED;[R1] source_type:SRC_OCEANBASE_1_0;[R1] has_pk:true;[R1] pk_info:(0);[R1] pks:PK;[R1] has_uk:false;[R1] uk_info:(null);[R1] uks:(null);[R1] [C1] column_name:PK;[R1] [C1] column_type:MYSQL_TYPE_NEWDECIMAL;[R1] [C1] column_is_rowkey:true;[R1] [C1] column_is_signed:true;[R1] [C1] column_encoding:binary;[R1] [C1] column_is_not_null:true;[R1] [C1] column_value_new:[1](1);[R1] [C2] column_name:C1;[R1] [C2] column_type:MYSQL_TYPE_VAR_STRING;[R1] [C2] column_is_rowkey:false;[R1] [C2] column_is_signed:true;[R1] [C2] column_encoding:utf8mb4;[R1] [C2] column_is_not_null:false;[R1] [C2] column_value_new:[v1](2);[R1] [C3] column_name:C2;[R1] [C3] column_type:MYSQL_TYPE_LONG_BLOB;[R1] [C3] column_is_rowkey:false;[R1] [C3] column_is_signed:true;[R1] [C3] column_encoding:utf8mb4;[R1] [C3] column_is_not_null:false;[R1] [C3] column_value_new_md5:[f1a5dad447edc7f007cd3dec69eac41a](7);[R1] [C4] column_name:C3;[R1] [C4] column_type:MYSQL_TYPE_LONG_BLOB;[R1] [C4] column_is_rowkey:false;[R1] [C4] column_is_signed:true;[R1] [C4] column_encoding:binary;[R1] [C4] column_is_not_null:false;[R1] [C4] column_value_new_md5:[5c6c0eb1d95820bf86d2f0ad7e45b98a](7);[R1] [C5] column_name:C4;[R1] [C5] column_type:MYSQL_TYPE_ORA_XML;[R1] [C5] column_is_rowkey:false;[R1] [C5] column_is_signed:true;[R1] [C5] column_encoding:utf8mb4;[R1] [C5] column_is_not_null:false;[R1] [C5] column_value_new_md5:[4118951fb2b62fc159867ff04f17905d](9);[R1] [C6] column_name:C5;[R1] [C6] column_type:MYSQL_TYPE_ORA_XML;[R1] [C6] column_is_rowkey:false;[R1] [C6] column_is_signed:true;[R1] [C6] column_encoding:utf8mb4;[R1] [C6] column_is_not_null:false;[R1] [C6] column_value_new_md5:[b3014272c86e597f933a0abcd355add1](9);$[R2] COMMIT;
select pk, calc_md5_clob(c2), calc_md5_blob(c3), calc_md5_clob('<z>v1</z>') as c4, calc_md5_clob('<x>v1</x>') as c5 from xml_test where pk = 1;
PK	CALC_MD5_CLOB(C2)	CALC_MD5_BLOB(C3)	C4	C5
1	f1a5dad447edc7f007cd3dec69eac41a	5c6c0eb1d95820bf86d2f0ad7e45b98a	4118951fb2b62fc159867ff04f17905d	b3014272c86e597f933a0abcd355add1
insert into xml_test values(2, 'v2', RPAD(to_clob('v2'), 10000, 'v2'), utl_raw.cast_to_raw('blob-v2'), xmltype(construct_clob('<biglob>', 'v2', 30000, 'v2', '</biglob>')), xmltype(construct_clob('<bigloby>', 'v2', 30000, 'v2', '</bigloby>')));
ob1.oblog.next;
[R0] BEGIN;[R0] org_cluster_id:1;[R1] record_type:INSERT;[R1] database_name:oracle.OBLOG_DB;[R1] table_name:XML_TEST;[R1] log_event:true;[R1] column_count:6;[R1] source_category:SRC_FULL_RECORDED;[R1] source_type:SRC_OCEANBASE_1_0;[R1] has_pk:true;[R1] pk_info:(0);[R1] pks:PK;[R1] has_uk:false;[R1] uk_info:(null);[R1] uks:(null);[R1] [C1] column_name:PK;[R1] [C1] column_type:MYSQL_TYPE_NEWDECIMAL;[R1] [C1] column_is_rowkey:true;[R1] [C1] column_is_signed:true;[R1] [C1] column_encoding:binary;[R1] [C1] column_is_not_null:true;[R1] [C1] column_value_new:[2](1);[R1] [C2] column_name:C1;[R1] [C2] column_type:MYSQL_TYPE_VAR_STRING;[R1] [C2] column_is_rowkey:false;[R1] [C2] column_is_signed:true;[R1] [C2] column_encoding:utf8mb4;[R1] [C2] column_is_not_null:false;[R1] [C2] column_value_new:[v2](2);[R1] [C3] column_name:C2;[R1] [C3] column_type:MYSQL_TYPE_LONG_BLOB;[R1] [C3] column_is_rowkey:false;[R1] [C3] column_is_signed:true;[R1] [C3] column_encoding:utf8mb4;[R1] [C3] column_is_not_null:false;[R1] [C3] column_value_new_md5:[de26117ab08744fa1e8e97322b742d84](10000);[R1] [C4] column_name:C3;[R1] [C4] column_type:MYSQL_TYPE_LONG_BLOB;[R1] [C4] column_is_rowkey:false;[R1] [C4] column_is_signed:true;[R1] [C4] column_encoding:binary;[R1] [C4] column_is_not_null:false;[R1] [C4] column_value_new_md5:[05e6ba49adaabe8f8c62c74dee905f02](7);[R1] [C5] column_name:C4;[R1] [C5] column_type:MYSQL_TYPE_ORA_XML;[R1] [C5] column_is_rowkey:false;[R1] [C5] column_is_signed:true;[R1] [C5] column_encoding:utf8mb4;[R1] [C5] column_is_not_null:false;[R1] [C5] column_value_new_md5:[95cb82d0eec16523a55dbc41edd578a8](30017);[R1] [C6] column_name:C5;[R1] [C6] column_type:MYSQL_TYPE_ORA_XML;[R1] [C6] column_is_rowkey:false;[R1] [C6] column_is_signed:true;[R1] [C6] column_encoding:utf8mb4;[R1] [C6] column_is_not_null:false;[R1] [C6] column_value_new_md5:[7340d2eae0d13be6d7d92d5cdc79ef24](30019);$[R2] COMMIT;
select pk, calc_md5_clob(c2), calc_md5_blob(c3), calc_md5_clob(construct_clob('<biglob>', 'v2', 30000, 'v2', '</biglob>')) as c4, calc_md5_clob(construct_clob('<bigloby>', 'v2', 30000, 'v2', '</bigloby>')) as c5 from xml_test where pk = 2;
PK	CALC_MD5_CLOB(C2)	CALC_MD5_BLOB(C3)	C4	C5
2	de26117ab08744fa1e8e97322b742d84	05e6ba49adaabe8f8c62c74dee905f02	95cb82d0eec16523a55dbc41edd578a8	7340d2eae0d13be6d7d92d5cdc79ef24
alter table xml_test drop column c5;
ob1.oblog.next;
[R0] record_type:EDDL;[R0] db_name:oracle.OBLOG_DB;[R0] table_name:;[R0] column_count:1;[R0] column_name:ddl;[R0] ddl_stmt_str: alter table xml_test drop column c5;[R0] ddl_stmt_len: 35;
insert into xml_test values(3, 'v3', 'clob-v3', utl_raw.cast_to_raw('blob-v3'), xmltype('<z>v3</z>'));
ob1.oblog.next;
[R0] BEGIN;[R0] org_cluster_id:1;[R1] record_type:INSERT;[R1] database_name:oracle.OBLOG_DB;[R1] table_name:XML_TEST;[R1] log_event:true;[R1] column_count:5;[R1] source_category:SRC_FULL_RECORDED;[R1] source_type:SRC_OCEANBASE_1_0;[R1] has_pk:true;[R1] pk_info:(0);[R1] pks:PK;[R1] has_uk:false;[R1] uk_info:(null);[R1] uks:(null);[R1] [C1] column_name:PK;[R1] [C1] column_type:MYSQL_TYPE_NEWDECIMAL;[R1] [C1] column_is_rowkey:true;[R1] [C1] column_is_signed:true;[R1] [C1] column_encoding:binary;[R1] [C1] column_is_not_null:true;[R1] [C1] column_value_new:[3](1);[R1] [C2] column_name:C1;[R1] [C2] column_type:MYSQL_TYPE_VAR_STRING;[R1] [C2] column_is_rowkey:false;[R1] [C2] column_is_signed:true;[R1] [C2] column_encoding:utf8mb4;[R1] [C2] column_is_not_null:false;[R1] [C2] column_value_new:[v3](2);[R1] [C3] column_name:C2;[R1] [C3] column_type:MYSQL_TYPE_LONG_BLOB;[R1] [C3] column_is_rowkey:false;[R1] [C3] column_is_signed:true;[R1] [C3] column_encoding:utf8mb4;[R1] [C3] column_is_not_null:false;[R1] [C3] column_value_new_md5:[562a1927951a3ae9ef51a95b78c5e3c8](7);[R1] [C4] column_name:C3;[R1] [C4] column_type:MYSQL_TYPE_LONG_BLOB;[R1] [C4] column_is_rowkey:false;[R1] [C4] column_is_signed:true;[R1] [C4] column_encoding:binary;[R1] [C4] column_is_not_null:false;[R1] [C4] column_value_new_md5:[141244e1e6e5e848d4573abfd9a18b74](7);[R1] [C5] column_name:C4;[R1] [C5] column_type:MYSQL_TYPE_ORA_XML;[R1] [C5] column_is_rowkey:false;[R1] [C5] column_is_signed:true;[R1] [C5] column_encoding:utf8mb4;[R1] [C5] column_is_not_null:false;[R1] [C5] column_value_new_md5:[94a43cb1d21be57fda7c2d32a099905a](9);$[R2] COMMIT;
select pk, calc_md5_clob(c2), calc_md5_blob(c3), calc_md5_clob('<z>v3</z>') as c4 from xml_test where pk = 3;
PK	CALC_MD5_CLOB(C2)	CALC_MD5_BLOB(C3)	C4
3	562a1927951a3ae9ef51a95b78c5e3c8	141244e1e6e5e848d4573abfd9a18b74	94a43cb1d21be57fda7c2d32a099905a
insert into xml_test values(4, 'v4', RPAD(to_clob('v4'), 10000, 'v4'), utl_raw.cast_to_raw('blob-v4'), xmltype(construct_clob('<biglob>', 'v4', 20000, 'v4', '</biglob>')));
ob1.oblog.next;
[R0] BEGIN;[R0] org_cluster_id:1;[R1] record_type:INSERT;[R1] database_name:oracle.OBLOG_DB;[R1] table_name:XML_TEST;[R1] log_event:true;[R1] column_count:5;[R1] source_category:SRC_FULL_RECORDED;[R1] source_type:SRC_OCEANBASE_1_0;[R1] has_pk:true;[R1] pk_info:(0);[R1] pks:PK;[R1] has_uk:false;[R1] uk_info:(null);[R1] uks:(null);[R1] [C1] column_name:PK;[R1] [C1] column_type:MYSQL_TYPE_NEWDECIMAL;[R1] [C1] column_is_rowkey:true;[R1] [C1] column_is_signed:true;[R1] [C1] column_encoding:binary;[R1] [C1] column_is_not_null:true;[R1] [C1] column_value_new:[4](1);[R1] [C2] column_name:C1;[R1] [C2] column_type:MYSQL_TYPE_VAR_STRING;[R1] [C2] column_is_rowkey:false;[R1] [C2] column_is_signed:true;[R1] [C2] column_encoding:utf8mb4;[R1] [C2] column_is_not_null:false;[R1] [C2] column_value_new:[v4](2);[R1] [C3] column_name:C2;[R1] [C3] column_type:MYSQL_TYPE_LONG_BLOB;[R1] [C3] column_is_rowkey:false;[R1] [C3] column_is_signed:true;[R1] [C3] column_encoding:utf8mb4;[R1] [C3] column_is_not_null:false;[R1] [C3] column_value_new_md5:[18a954db9e95bf9e06f6587bc9c5dd43](10000);[R1] [C4] column_name:C3;[R1] [C4] column_type:MYSQL_TYPE_LONG_BLOB;[R1] [C4] column_is_rowkey:false;[R1] [C4] column_is_signed:true;[R1] [C4] column_encoding:binary;[R1] [C4] column_is_not_null:false;[R1] [C4] column_value_new_md5:[eaa72f9b957e8387e9661eff02a0d09a](7);[R1] [C5] column_name:C4;[R1] [C5] column_type:MYSQL_TYPE_ORA_XML;[R1] [C5] column_is_rowkey:false;[R1] [C5] column_is_signed:true;[R1] [C5] column_encoding:utf8mb4;[R1] [C5] column_is_not_null:false;[R1] [C5] column_value_new_md5:[630fc2c121314ffc44ffb7c49d4d7049](20017);$[R2] COMMIT;
select pk, calc_md5_clob(c2), calc_md5_blob(c3), calc_md5_clob(construct_clob('<biglob>', 'v4', 20000, 'v4', '</biglob>')) as c4 from xml_test where pk = 4;
PK	CALC_MD5_CLOB(C2)	CALC_MD5_BLOB(C3)	C4
4	18a954db9e95bf9e06f6587bc9c5dd43	eaa72f9b957e8387e9661eff02a0d09a	630fc2c121314ffc44ffb7c49d4d7049
update xml_test set c3 = utl_raw.cast_to_raw('blob-update-v1') where pk = 1;
ob1.oblog.next;
[R0] BEGIN;[R0] org_cluster_id:1;[R1] record_type:UPDATE;[R1] database_name:oracle.OBLOG_DB;[R1] table_name:XML_TEST;[R1] log_event:true;[R1] column_count:5;[R1] source_category:SRC_FULL_RECORDED;[R1] source_type:SRC_OCEANBASE_1_0;[R1] has_pk:true;[R1] pk_info:(0);[R1] pks:PK;[R1] has_uk:false;[R1] uk_info:(null);[R1] uks:(null);[R1] [C1] column_name:PK;[R1] [C1] column_type:MYSQL_TYPE_NEWDECIMAL;[R1] [C1] column_is_rowkey:true;[R1] [C1] column_is_signed:true;[R1] [C1] column_encoding:binary;[R1] [C1] column_is_not_null:true;[R1] [C1] column_value_new:[1](1);[R1] [C1] column_value_old:[1](1);[R1] [C2] column_name:C1;[R1] [C2] column_type:MYSQL_TYPE_VAR_STRING;[R1] [C2] column_is_rowkey:false;[R1] [C2] column_is_signed:true;[R1] [C2] column_encoding:utf8mb4;[R1] [C2] column_is_not_null:false;[R1] [C2] column_value_new:[v1](2);[R1] [C2] column_value_old:[v1](2);[R1] [C3] column_name:C2;[R1] [C3] column_type:MYSQL_TYPE_LONG_BLOB;[R1] [C3] column_is_rowkey:false;[R1] [C3] column_is_signed:true;[R1] [C3] column_encoding:utf8mb4;[R1] [C3] column_is_not_null:false;[R1] [C3] column_value_new_md5:[f1a5dad447edc7f007cd3dec69eac41a](7);[R1] [C3] column_value_old_md5:[f1a5dad447edc7f007cd3dec69eac41a](7);[R1] [C4] column_name:C3;[R1] [C4] column_type:MYSQL_TYPE_LONG_BLOB;[R1] [C4] column_is_rowkey:false;[R1] [C4] column_is_signed:true;[R1] [C4] column_encoding:binary;[R1] [C4] column_is_not_null:false;[R1] [C4] column_value_new_md5:[3aa00210c7ddab09e2af1eaa5b4b946e](14);[R1] [C4] column_value_old_md5:[5c6c0eb1d95820bf86d2f0ad7e45b98a](7);[R1] [C5] column_name:C4;[R1] [C5] column_type:MYSQL_TYPE_ORA_XML;[R1] [C5] column_is_rowkey:false;[R1] [C5] column_is_signed:true;[R1] [C5] column_encoding:utf8mb4;[R1] [C5] column_is_not_null:false;[R1] [C5] column_value_new_md5:[4118951fb2b62fc159867ff04f17905d](9);[R1] [C5] column_value_old_md5:[4118951fb2b62fc159867ff04f17905d](9);$[R2] COMMIT;
select pk, calc_md5_blob(c3) from xml_test where pk = 1;
PK	CALC_MD5_BLOB(C3)
1	3aa00210c7ddab09e2af1eaa5b4b946e
update xml_test set c4 = xmltype('<z>v3-v1</z>') where pk = 1;
ob1.oblog.next;
[R0] BEGIN;[R0] org_cluster_id:1;[R1] record_type:UPDATE;[R1] database_name:oracle.OBLOG_DB;[R1] table_name:XML_TEST;[R1] log_event:true;[R1] column_count:5;[R1] source_category:SRC_FULL_RECORDED;[R1] source_type:SRC_OCEANBASE_1_0;[R1] has_pk:true;[R1] pk_info:(0);[R1] pks:PK;[R1] has_uk:false;[R1] uk_info:(null);[R1] uks:(null);[R1] [C1] column_name:PK;[R1] [C1] column_type:MYSQL_TYPE_NEWDECIMAL;[R1] [C1] column_is_rowkey:true;[R1] [C1] column_is_signed:true;[R1] [C1] column_encoding:binary;[R1] [C1] column_is_not_null:true;[R1] [C1] column_value_new:[1](1);[R1] [C1] column_value_old:[1](1);[R1] [C2] column_name:C1;[R1] [C2] column_type:MYSQL_TYPE_VAR_STRING;[R1] [C2] column_is_rowkey:false;[R1] [C2] column_is_signed:true;[R1] [C2] column_encoding:utf8mb4;[R1] [C2] column_is_not_null:false;[R1] [C2] column_value_new:[v1](2);[R1] [C2] column_value_old:[v1](2);[R1] [C3] column_name:C2;[R1] [C3] column_type:MYSQL_TYPE_LONG_BLOB;[R1] [C3] column_is_rowkey:false;[R1] [C3] column_is_signed:true;[R1] [C3] column_encoding:utf8mb4;[R1] [C3] column_is_not_null:false;[R1] [C3] column_value_new_md5:[f1a5dad447edc7f007cd3dec69eac41a](7);[R1] [C3] column_value_old_md5:[f1a5dad447edc7f007cd3dec69eac41a](7);[R1] [C4] column_name:C3;[R1] [C4] column_type:MYSQL_TYPE_LONG_BLOB;[R1] [C4] column_is_rowkey:false;[R1] [C4] column_is_signed:true;[R1] [C4] column_encoding:binary;[R1] [C4] column_is_not_null:false;[R1] [C4] column_value_new_md5:[3aa00210c7ddab09e2af1eaa5b4b946e](14);[R1] [C4] column_value_old_md5:[3aa00210c7ddab09e2af1eaa5b4b946e](14);[R1] [C5] column_name:C4;[R1] [C5] column_type:MYSQL_TYPE_ORA_XML;[R1] [C5] column_is_rowkey:false;[R1] [C5] column_is_signed:true;[R1] [C5] column_encoding:utf8mb4;[R1] [C5] column_is_not_null:false;[R1] [C5] column_value_new_md5:[79249e50480ce17148121eca1c41d03c](12);[R1] [C5] column_value_old_md5:[4118951fb2b62fc159867ff04f17905d](9);$[R2] COMMIT;
select pk, calc_md5_clob('<z>v3-v1</z>') as c4 from xml_test where pk = 1;
PK	C4
1	79249e50480ce17148121eca1c41d03c
update xml_test set c4 = xmltype(construct_clob('<biglob-v1>', 'v2', 30000, 'v2', '</biglob-v1>')) where pk = 2;
ob1.oblog.next;
[R0] BEGIN;[R0] org_cluster_id:1;[R1] record_type:UPDATE;[R1] database_name:oracle.OBLOG_DB;[R1] table_name:XML_TEST;[R1] log_event:true;[R1] column_count:5;[R1] source_category:SRC_FULL_RECORDED;[R1] source_type:SRC_OCEANBASE_1_0;[R1] has_pk:true;[R1] pk_info:(0);[R1] pks:PK;[R1] has_uk:false;[R1] uk_info:(null);[R1] uks:(null);[R1] [C1] column_name:PK;[R1] [C1] column_type:MYSQL_TYPE_NEWDECIMAL;[R1] [C1] column_is_rowkey:true;[R1] [C1] column_is_signed:true;[R1] [C1] column_encoding:binary;[R1] [C1] column_is_not_null:true;[R1] [C1] column_value_new:[2](1);[R1] [C1] column_value_old:[2](1);[R1] [C2] column_name:C1;[R1] [C2] column_type:MYSQL_TYPE_VAR_STRING;[R1] [C2] column_is_rowkey:false;[R1] [C2] column_is_signed:true;[R1] [C2] column_encoding:utf8mb4;[R1] [C2] column_is_not_null:false;[R1] [C2] column_value_new:[v2](2);[R1] [C2] column_value_old:[v2](2);[R1] [C3] column_name:C2;[R1] [C3] column_type:MYSQL_TYPE_LONG_BLOB;[R1] [C3] column_is_rowkey:false;[R1] [C3] column_is_signed:true;[R1] [C3] column_encoding:utf8mb4;[R1] [C3] column_is_not_null:false;[R1] [C3] column_value_new_origin: PADDING;[R1] [C3] column_value_new_md5:[NULL](0);[R1] [C3] column_value_old_origin: PADDING;[R1] [C3] column_value_old_md5:[NULL](0);[R1] [C4] column_name:C3;[R1] [C4] column_type:MYSQL_TYPE_LONG_BLOB;[R1] [C4] column_is_rowkey:false;[R1] [C4] column_is_signed:true;[R1] [C4] column_encoding:binary;[R1] [C4] column_is_not_null:false;[R1] [C4] column_value_new_md5:[05e6ba49adaabe8f8c62c74dee905f02](7);[R1] [C4] column_value_old_md5:[05e6ba49adaabe8f8c62c74dee905f02](7);[R1] [C5] column_name:C4;[R1] [C5] column_type:MYSQL_TYPE_ORA_XML;[R1] [C5] column_is_rowkey:false;[R1] [C5] column_is_signed:true;[R1] [C5] column_encoding:utf8mb4;[R1] [C5] column_is_not_null:false;[R1] [C5] column_value_new_md5:[bbaabe99c02eef3bbf8abd63793443a8](30023);[R1] [C5] column_value_old_md5:[95cb82d0eec16523a55dbc41edd578a8](30017);$[R2] COMMIT;
select pk, calc_md5_clob(construct_clob('<biglob-v1>', 'v2', 30000, 'v2', '</biglob-v1>')) as c4 from xml_test where pk = 2;
PK	C4
2	bbaabe99c02eef3bbf8abd63793443a8
delete from xml_test;
ob1.oblog.next;
[R0] BEGIN;[R0] org_cluster_id:1;[R1] record_type:DELETE;[R1] database_name:oracle.OBLOG_DB;[R1] table_name:XML_TEST;[R1] log_event:true;[R1] column_count:5;[R1] source_category:SRC_FULL_RECORDED;[R1] source_type:SRC_OCEANBASE_1_0;[R1] has_pk:true;[R1] pk_info:(0);[R1] pks:PK;[R1] has_uk:false;[R1] uk_info:(null);[R1] uks:(null);[R1] [C1] column_name:PK;[R1] [C1] column_type:MYSQL_TYPE_NEWDECIMAL;[R1] [C1] column_is_rowkey:true;[R1] [C1] column_is_signed:true;[R1] [C1] column_encoding:binary;[R1] [C1] column_is_not_null:true;[R1] [C1] column_value_old:[1](1);[R1] [C2] column_name:C1;[R1] [C2] column_type:MYSQL_TYPE_VAR_STRING;[R1] [C2] column_is_rowkey:false;[R1] [C2] column_is_signed:true;[R1] [C2] column_encoding:utf8mb4;[R1] [C2] column_is_not_null:false;[R1] [C2] column_value_old:[v1](2);[R1] [C3] column_name:C2;[R1] [C3] column_type:MYSQL_TYPE_LONG_BLOB;[R1] [C3] column_is_rowkey:false;[R1] [C3] column_is_signed:true;[R1] [C3] column_encoding:utf8mb4;[R1] [C3] column_is_not_null:false;[R1] [C3] column_value_old_md5:[f1a5dad447edc7f007cd3dec69eac41a](7);[R1] [C4] column_name:C3;[R1] [C4] column_type:MYSQL_TYPE_LONG_BLOB;[R1] [C4] column_is_rowkey:false;[R1] [C4] column_is_signed:true;[R1] [C4] column_encoding:binary;[R1] [C4] column_is_not_null:false;[R1] [C4] column_value_old_md5:[3aa00210c7ddab09e2af1eaa5b4b946e](14);[R1] [C5] column_name:C4;[R1] [C5] column_type:MYSQL_TYPE_ORA_XML;[R1] [C5] column_is_rowkey:false;[R1] [C5] column_is_signed:true;[R1] [C5] column_encoding:utf8mb4;[R1] [C5] column_is_not_null:false;[R1] [C5] column_value_old_md5:[79249e50480ce17148121eca1c41d03c](12);$[R2] record_type:DELETE;[R2] database_name:oracle.OBLOG_DB;[R2] table_name:XML_TEST;[R2] log_event:true;[R2] column_count:5;[R2] source_category:SRC_FULL_RECORDED;[R2] source_type:SRC_OCEANBASE_1_0;[R2] has_pk:true;[R2] pk_info:(0);[R2] pks:PK;[R2] has_uk:false;[R2] uk_info:(null);[R2] uks:(null);[R2] [C1] column_name:PK;[R2] [C1] column_type:MYSQL_TYPE_NEWDECIMAL;[R2] [C1] column_is_rowkey:true;[R2] [C1] column_is_signed:true;[R2] [C1] column_encoding:binary;[R2] [C1] column_is_not_null:true;[R2] [C1] column_value_old:[2](1);[R2] [C2] column_name:C1;[R2] [C2] column_type:MYSQL_TYPE_VAR_STRING;[R2] [C2] column_is_rowkey:false;[R2] [C2] column_is_signed:true;[R2] [C2] column_encoding:utf8mb4;[R2] [C2] column_is_not_null:false;[R2] [C2] column_value_old:[v2](2);[R2] [C3] column_name:C2;[R2] [C3] column_type:MYSQL_TYPE_LONG_BLOB;[R2] [C3] column_is_rowkey:false;[R2] [C3] column_is_signed:true;[R2] [C3] column_encoding:utf8mb4;[R2] [C3] column_is_not_null:false;[R2] [C3] column_value_old_origin: PADDING;[R2] [C3] column_value_old_md5:[NULL](0);[R2] [C4] column_name:C3;[R2] [C4] column_type:MYSQL_TYPE_LONG_BLOB;[R2] [C4] column_is_rowkey:false;[R2] [C4] column_is_signed:true;[R2] [C4] column_encoding:binary;[R2] [C4] column_is_not_null:false;[R2] [C4] column_value_old_md5:[05e6ba49adaabe8f8c62c74dee905f02](7);[R2] [C5] column_name:C4;[R2] [C5] column_type:MYSQL_TYPE_ORA_XML;[R2] [C5] column_is_rowkey:false;[R2] [C5] column_is_signed:true;[R2] [C5] column_encoding:utf8mb4;[R2] [C5] column_is_not_null:false;[R2] [C5] column_value_old_origin: PADDING;[R2] [C5] column_value_old_md5:[NULL](0);$[R3] record_type:DELETE;[R3] database_name:oracle.OBLOG_DB;[R3] table_name:XML_TEST;[R3] log_event:true;[R3] column_count:5;[R3] source_category:SRC_FULL_RECORDED;[R3] source_type:SRC_OCEANBASE_1_0;[R3] has_pk:true;[R3] pk_info:(0);[R3] pks:PK;[R3] has_uk:false;[R3] uk_info:(null);[R3] uks:(null);[R3] [C1] column_name:PK;[R3] [C1] column_type:MYSQL_TYPE_NEWDECIMAL;[R3] [C1] column_is_rowkey:true;[R3] [C1] column_is_signed:true;[R3] [C1] column_encoding:binary;[R3] [C1] column_is_not_null:true;[R3] [C1] column_value_old:[3](1);[R3] [C2] column_name:C1;[R3] [C2] column_type:MYSQL_TYPE_VAR_STRING;[R3] [C2] column_is_rowkey:false;[R3] [C2] column_is_signed:true;[R3] [C2] column_encoding:utf8mb4;[R3] [C2] column_is_not_null:false;[R3] [C2] column_value_old:[v3](2);[R3] [C3] column_name:C2;[R3] [C3] column_type:MYSQL_TYPE_LONG_BLOB;[R3] [C3] column_is_rowkey:false;[R3] [C3] column_is_signed:true;[R3] [C3] column_encoding:utf8mb4;[R3] [C3] column_is_not_null:false;[R3] [C3] column_value_old_md5:[562a1927951a3ae9ef51a95b78c5e3c8](7);[R3] [C4] column_name:C3;[R3] [C4] column_type:MYSQL_TYPE_LONG_BLOB;[R3] [C4] column_is_rowkey:false;[R3] [C4] column_is_signed:true;[R3] [C4] column_encoding:binary;[R3] [C4] column_is_not_null:false;[R3] [C4] column_value_old_md5:[141244e1e6e5e848d4573abfd9a18b74](7);[R3] [C5] column_name:C4;[R3] [C5] column_type:MYSQL_TYPE_ORA_XML;[R3] [C5] column_is_rowkey:false;[R3] [C5] column_is_signed:true;[R3] [C5] column_encoding:utf8mb4;[R3] [C5] column_is_not_null:false;[R3] [C5] column_value_old_md5:[94a43cb1d21be57fda7c2d32a099905a](9);$[R4] record_type:DELETE;[R4] database_name:oracle.OBLOG_DB;[R4] table_name:XML_TEST;[R4] log_event:true;[R4] column_count:5;[R4] source_category:SRC_FULL_RECORDED;[R4] source_type:SRC_OCEANBASE_1_0;[R4] has_pk:true;[R4] pk_info:(0);[R4] pks:PK;[R4] has_uk:false;[R4] uk_info:(null);[R4] uks:(null);[R4] [C1] column_name:PK;[R4] [C1] column_type:MYSQL_TYPE_NEWDECIMAL;[R4] [C1] column_is_rowkey:true;[R4] [C1] column_is_signed:true;[R4] [C1] column_encoding:binary;[R4] [C1] column_is_not_null:true;[R4] [C1] column_value_old:[4](1);[R4] [C2] column_name:C1;[R4] [C2] column_type:MYSQL_TYPE_VAR_STRING;[R4] [C2] column_is_rowkey:false;[R4] [C2] column_is_signed:true;[R4] [C2] column_encoding:utf8mb4;[R4] [C2] column_is_not_null:false;[R4] [C2] column_value_old:[v4](2);[R4] [C3] column_name:C2;[R4] [C3] column_type:MYSQL_TYPE_LONG_BLOB;[R4] [C3] column_is_rowkey:false;[R4] [C3] column_is_signed:true;[R4] [C3] column_encoding:utf8mb4;[R4] [C3] column_is_not_null:false;[R4] [C3] column_value_old_origin: PADDING;[R4] [C3] column_value_old_md5:[NULL](0);[R4] [C4] column_name:C3;[R4] [C4] column_type:MYSQL_TYPE_LONG_BLOB;[R4] [C4] column_is_rowkey:false;[R4] [C4] column_is_signed:true;[R4] [C4] column_encoding:binary;[R4] [C4] column_is_not_null:false;[R4] [C4] column_value_old_md5:[eaa72f9b957e8387e9661eff02a0d09a](7);[R4] [C5] column_name:C4;[R4] [C5] column_type:MYSQL_TYPE_ORA_XML;[R4] [C5] column_is_rowkey:false;[R4] [C5] column_is_signed:true;[R4] [C5] column_encoding:utf8mb4;[R4] [C5] column_is_not_null:false;[R4] [C5] column_value_old_origin: PADDING;[R4] [C5] column_value_old_md5:[NULL](0);$[R5] COMMIT;
ob1.oblog.stop;
