drop table t1;
drop table t2;
drop table stu;
drop table stu1;
result_format: 4
create table t1(c1 int, c2 int, CONSTRAINT "T1OBPK1" PRIMARY KEY (c1)) partition by hash(c1) partitions 4;
create table t2(c1 int, c2 int, CONSTRAINT "T2OBPK1" PRIMARY KEY (c1));
create index gkey on t1(c2) global;
insert into t1 values(1, 2);
insert into t2 values(1, 4);
insert into t2 values(2, 5);
alter table t1 enable row movement;

explain merge into t1 using t2 on (t2.c1 = t1.c1) when matched then update set t1.c2 = 10 delete where t1.c2 = 10 when not matched then insert values(1, 100);
Query Plan
=========================================================
|ID|OPERATOR             |NAME    |EST.ROWS|EST.TIME(us)|
---------------------------------------------------------
|0 |DISTRIBUTED MERGE    |        |2       |5           |
|1 |└─MERGE OUTER JOIN   |        |2       |5           |
|2 |  ├─TABLE FULL SCAN  |T2      |2       |3           |
|3 |  └─SORT             |        |1       |3           |
|4 |    └─TABLE FULL SCAN|T1(GKEY)|1       |3           |
=========================================================
Outputs & filters:
-------------------------------------
  0 - output(nil), filter(nil)
      columns([{T1: ({T1: (T1.C1, T1.C2)}, {GKEY: (T1.C2, T1.C1)})}]), partitions(p1), 
      column_values([column_conv(NUMBER,PS:(-1,0),NOT NULL,1)], [column_conv(NUMBER,PS:(-1,0),NULL,100)]),
      update([T1.C2=column_conv(NUMBER,PS:(-1,0),NULL,10)]), 
      insert_conds(nil), update_conds(nil), delete_conds([column_conv(NUMBER,PS:(-1,0),NULL,10) = 10])
  1 - output([T1.C1], [T1.C2]), filter(nil), rowset=16
      equal_conds([T2.C1 = T1.C1]), other_conds(nil)
      merge_directions([ASC])
  2 - output([T2.C1]), filter(nil), rowset=16
      access([T2.C1]), partitions(p0)
      is_index_back=false, is_global_index=false, 
      range_key([T2.C1]), range(MIN ; MAX)always true
  3 - output([T1.C1], [T1.C2]), filter(nil), rowset=16
      sort_keys([T1.C1, ASC])
  4 - output([T1.C1], [T1.C2]), filter(nil), rowset=16
      access([T1.C1], [T1.C2]), partitions(p0)
      is_index_back=false, is_global_index=true, 
      range_key([T1.C2], [T1.C1]), range(MIN,MIN ; MAX,MAX)always true
merge into t1 using t2 on (t2.c1 = t1.c1) when matched then update set t1.c2 = 10 delete where t1.c2 = 10 when not matched then insert values(1, 100);
select * from t1;
+----+------+
| C1 | C2   |
+----+------+
|  1 |  100 |
+----+------+

select * from t1;
+----+------+
| C1 | C2   |
+----+------+
|  1 |  100 |
+----+------+

truncate table t1;
truncate table t2;
insert into t1 values(1, 2);
insert into t1 values(2, 3);
insert into t2 values(1, 2);
insert into t2 values(2, 5);
insert into t2 values(3, 3);

explain merge into t1 using t2 on (t1.c2 = t2.c2) when matched then update set t1.c1 = 10 delete where t1.c1 = 10 when not matched then insert values(2, 200);
Query Plan
=============================================================
|ID|OPERATOR                 |NAME    |EST.ROWS|EST.TIME(us)|
-------------------------------------------------------------
|0 |DISTRIBUTED MERGE        |        |3       |5           |
|1 |└─MERGE RIGHT OUTER JOIN |        |3       |5           |
|2 |  ├─TABLE FULL SCAN      |T1(GKEY)|2       |3           |
|3 |  └─SORT                 |        |3       |3           |
|4 |    └─TABLE FULL SCAN    |T2      |3       |3           |
=============================================================
Outputs & filters:
-------------------------------------
  0 - output(nil), filter(nil)
      columns([{T1: ({T1: (T1.C1, T1.C2)}, {GKEY: (T1.C2, T1.C1)})}]), partitions(p0), 
      column_values([column_conv(NUMBER,PS:(-1,0),NOT NULL,2)], [column_conv(NUMBER,PS:(-1,0),NULL,200)]),
      update([T1.C1=column_conv(NUMBER,PS:(-1,0),NOT NULL,10)]), 
      insert_conds(nil), update_conds(nil), delete_conds([column_conv(NUMBER,PS:(-1,0),NOT NULL,10) = 10])
  1 - output([T1.C1], [T1.C2]), filter(nil), rowset=16
      equal_conds([T1.C2 = T2.C2]), other_conds(nil)
      merge_directions([ASC])
  2 - output([T1.C1], [T1.C2]), filter(nil), rowset=16
      access([T1.C1], [T1.C2]), partitions(p0)
      is_index_back=false, is_global_index=true, 
      range_key([T1.C2], [T1.C1]), range(MIN,MIN ; MAX,MAX)always true
  3 - output([T2.C2]), filter(nil), rowset=16
      sort_keys([T2.C2, ASC])
  4 - output([T2.C2]), filter(nil), rowset=16
      access([T2.C2]), partitions(p0)
      is_index_back=false, is_global_index=false, 
      range_key([T2.C1]), range(MIN ; MAX)always true
merge into t1 using t2 on (t1.c2 = t2.c2) when matched then update set t1.c1 = 10 delete where t1.c1 = 10 when not matched then insert values(2, 200);
select * from t1;
+----+------+
| C1 | C2   |
+----+------+
|  2 |  200 |
+----+------+

truncate table t1;
truncate table t2;
insert into t1 values(1, 2);
insert into t1 values(2, 3);
insert into t2 values(1, 2);
insert into t2 values(2, 5);

explain merge into t1 using t2 on (t1.c2 = t2.c2) when matched then update set t1.c1 = 3 when not matched then insert values(3, 200);
Query Plan
=============================================================
|ID|OPERATOR                 |NAME    |EST.ROWS|EST.TIME(us)|
-------------------------------------------------------------
|0 |DISTRIBUTED MERGE        |        |2       |5           |
|1 |└─MERGE RIGHT OUTER JOIN |        |2       |5           |
|2 |  ├─TABLE FULL SCAN      |T1(GKEY)|2       |3           |
|3 |  └─SORT                 |        |2       |3           |
|4 |    └─TABLE FULL SCAN    |T2      |2       |3           |
=============================================================
Outputs & filters:
-------------------------------------
  0 - output(nil), filter(nil)
      columns([{T1: ({T1: (T1.C1, T1.C2)}, {GKEY: (T1.C2, T1.C1)})}]), partitions(p2), 
      column_values([column_conv(NUMBER,PS:(-1,0),NOT NULL,3)], [column_conv(NUMBER,PS:(-1,0),NULL,200)]),
      update([T1.C1=column_conv(NUMBER,PS:(-1,0),NOT NULL,3)]), 
      insert_conds(nil), update_conds(nil), delete_conds(nil)
  1 - output([T1.C1], [T1.C2]), filter(nil), rowset=16
      equal_conds([T1.C2 = T2.C2]), other_conds(nil)
      merge_directions([ASC])
  2 - output([T1.C1], [T1.C2]), filter(nil), rowset=16
      access([T1.C1], [T1.C2]), partitions(p0)
      is_index_back=false, is_global_index=true, 
      range_key([T1.C2], [T1.C1]), range(MIN,MIN ; MAX,MAX)always true
  3 - output([T2.C2]), filter(nil), rowset=16
      sort_keys([T2.C2, ASC])
  4 - output([T2.C2]), filter(nil), rowset=16
      access([T2.C2]), partitions(p0)
      is_index_back=false, is_global_index=false, 
      range_key([T2.C1]), range(MIN ; MAX)always true
merge into t1 using t2 on (t1.c2 = t2.c2) when matched then update set t1.c1 = 3 when not matched then insert values(3, 200);
ERROR 23000: unique constraint '3' for key 'T1OBPK1' violated
select * from t1;
+----+------+
| C1 | C2   |
+----+------+
|  1 |    2 |
|  2 |    3 |
+----+------+

truncate table t1;
truncate table t2;
insert into t1 values(1, 2);
insert into t1 values(2, 3);
insert into t2 values(1, 2);
insert into t2 values(2, 5);
insert into t2 values(3, 3);
explain merge into t1 using t2 on (t1.c2 = t2.c2) when matched then update set t1.c1 = t1.c1 + 10 when not matched then insert values(12, 200);
Query Plan
=============================================================
|ID|OPERATOR                 |NAME    |EST.ROWS|EST.TIME(us)|
-------------------------------------------------------------
|0 |DISTRIBUTED MERGE        |        |3       |5           |
|1 |└─MERGE RIGHT OUTER JOIN |        |3       |5           |
|2 |  ├─TABLE FULL SCAN      |T1(GKEY)|2       |3           |
|3 |  └─SORT                 |        |3       |3           |
|4 |    └─TABLE FULL SCAN    |T2      |3       |3           |
=============================================================
Outputs & filters:
-------------------------------------
  0 - output(nil), filter(nil)
      columns([{T1: ({T1: (T1.C1, T1.C2)}, {GKEY: (T1.C2, T1.C1)})}]), partitions(p2), 
      column_values([column_conv(NUMBER,PS:(-1,0),NOT NULL,12)], [column_conv(NUMBER,PS:(-1,0),NULL,200)]),
      update([T1.C1=column_conv(NUMBER,PS:(-1,0),NOT NULL,T1.C1 + 10)]), 
      insert_conds(nil), update_conds(nil), delete_conds(nil)
  1 - output([T1.C1], [T1.C2]), filter(nil), rowset=16
      equal_conds([T1.C2 = T2.C2]), other_conds(nil)
      merge_directions([ASC])
  2 - output([T1.C1], [T1.C2]), filter(nil), rowset=16
      access([T1.C1], [T1.C2]), partitions(p0)
      is_index_back=false, is_global_index=true, 
      range_key([T1.C2], [T1.C1]), range(MIN,MIN ; MAX,MAX)always true
  3 - output([T2.C2]), filter(nil), rowset=16
      sort_keys([T2.C2, ASC])
  4 - output([T2.C2]), filter(nil), rowset=16
      access([T2.C2]), partitions(p0)
      is_index_back=false, is_global_index=false, 
      range_key([T2.C1]), range(MIN ; MAX)always true
merge into t1 using t2 on (t1.c2 = t2.c2) when matched then update set t1.c1 = t1.c1 + 10 when not matched then insert values(12, 200);
ERROR 23000: unique constraint '12' for key 'T1OBPK1' violated
select * from t1;
+----+------+
| C1 | C2   |
+----+------+
|  1 |    2 |
|  2 |    3 |
+----+------+

truncate table t1;
truncate table t2;
insert into t1 values(1, 2);
insert into t2 values(1, 2);
insert into t2 values(2, 2);

explain merge into t1 using t2 on (t1.c2 = t2.c2) when matched then update set t1.c1 = t1.c1 + t2.c1 delete where t1.c1 = 2;
Query Plan
=========================================================
|ID|OPERATOR             |NAME    |EST.ROWS|EST.TIME(us)|
---------------------------------------------------------
|0 |DISTRIBUTED MERGE    |        |1       |5           |
|1 |└─MERGE JOIN         |        |1       |5           |
|2 |  ├─TABLE FULL SCAN  |T1(GKEY)|1       |3           |
|3 |  └─SORT             |        |2       |3           |
|4 |    └─TABLE FULL SCAN|T2      |2       |3           |
=========================================================
Outputs & filters:
-------------------------------------
  0 - output(nil), filter(nil)
      columns([{T1: ({T1: (T1.C1, T1.C2)}, {GKEY: (T1.C2, T1.C1)})}]),
      update([T1.C1=column_conv(NUMBER,PS:(-1,0),NOT NULL,T1.C1 + T2.C1)]), 
      insert_conds(nil), update_conds(nil), delete_conds([column_conv(NUMBER,PS:(-1,0),NOT NULL,T1.C1 + T2.C1) = 2])
  1 - output([T1.C1], [T1.C2], [T2.C1]), filter(nil), rowset=16
      equal_conds([T1.C2 = T2.C2]), other_conds(nil)
      merge_directions([ASC])
  2 - output([T1.C1], [T1.C2]), filter(nil), rowset=16
      access([T1.C1], [T1.C2]), partitions(p0)
      is_index_back=false, is_global_index=true, 
      range_key([T1.C2], [T1.C1]), range(MIN,MIN ; MAX,MAX)always true
  3 - output([T2.C2], [T2.C1]), filter(nil), rowset=16
      sort_keys([T2.C2, ASC])
  4 - output([T2.C1], [T2.C2]), filter(nil), rowset=16
      access([T2.C1], [T2.C2]), partitions(p0)
      is_index_back=false, is_global_index=false, 
      range_key([T2.C1]), range(MIN ; MAX)always true
merge into t1 using t2 on (t1.c2 = t2.c2) when matched then update set t1.c1 = t1.c1 + t2.c1 delete where t1.c1 = 2;
ERROR HY000: unable to get a stable set of rows in the source tables
select * from t1;
+----+------+
| C1 | C2   |
+----+------+
|  1 |    2 |
+----+------+

truncate table t1;
truncate table t2;
insert into t1 values(1, 2);
insert into t2 values(1, 2);
insert into t2 values(2, 2);

explain merge into t1 using t2 on (t1.c2 = t2.c2) when matched then update set t1.c1 = t1.c1 + t2.c1 delete where t1.c1 = 3;
Query Plan
=========================================================
|ID|OPERATOR             |NAME    |EST.ROWS|EST.TIME(us)|
---------------------------------------------------------
|0 |DISTRIBUTED MERGE    |        |1       |5           |
|1 |└─MERGE JOIN         |        |1       |5           |
|2 |  ├─TABLE FULL SCAN  |T1(GKEY)|1       |3           |
|3 |  └─SORT             |        |2       |3           |
|4 |    └─TABLE FULL SCAN|T2      |2       |3           |
=========================================================
Outputs & filters:
-------------------------------------
  0 - output(nil), filter(nil)
      columns([{T1: ({T1: (T1.C1, T1.C2)}, {GKEY: (T1.C2, T1.C1)})}]),
      update([T1.C1=column_conv(NUMBER,PS:(-1,0),NOT NULL,T1.C1 + T2.C1)]), 
      insert_conds(nil), update_conds(nil), delete_conds([column_conv(NUMBER,PS:(-1,0),NOT NULL,T1.C1 + T2.C1) = 3])
  1 - output([T1.C1], [T1.C2], [T2.C1]), filter(nil), rowset=16
      equal_conds([T1.C2 = T2.C2]), other_conds(nil)
      merge_directions([ASC])
  2 - output([T1.C1], [T1.C2]), filter(nil), rowset=16
      access([T1.C1], [T1.C2]), partitions(p0)
      is_index_back=false, is_global_index=true, 
      range_key([T1.C2], [T1.C1]), range(MIN,MIN ; MAX,MAX)always true
  3 - output([T2.C2], [T2.C1]), filter(nil), rowset=16
      sort_keys([T2.C2, ASC])
  4 - output([T2.C1], [T2.C2]), filter(nil), rowset=16
      access([T2.C1], [T2.C2]), partitions(p0)
      is_index_back=false, is_global_index=false, 
      range_key([T2.C1]), range(MIN ; MAX)always true
merge into t1 using t2 on (t1.c2 = t2.c2) when matched then update set t1.c1 = t1.c1 + t2.c1 delete where t1.c1 = 3;
ERROR HY000: specified row no longer exists
select * from t1;
+----+------+
| C1 | C2   |
+----+------+
|  1 |    2 |
+----+------+

truncate table t1;
truncate table t2;
insert into t1 values(1, 2);
insert into t1 values(2, 3);
insert into t1 values(3, 4);
insert into t2 values(1, 2);
insert into t2 values(2, 11);
insert into t2 values(3, 3);
insert into t2 values(4, 12);
insert into t2 values(5, 4);

explain merge into t1 using t2 on (t1.c2 = t2.c2) when matched then update set t1.c1 = t1.c1 + 100 when not matched then insert values(t2.c1 + 1, 100);
Query Plan
=============================================================
|ID|OPERATOR                 |NAME    |EST.ROWS|EST.TIME(us)|
-------------------------------------------------------------
|0 |DISTRIBUTED MERGE        |        |5       |6           |
|1 |└─MERGE RIGHT OUTER JOIN |        |5       |6           |
|2 |  ├─TABLE FULL SCAN      |T1(GKEY)|3       |3           |
|3 |  └─SORT                 |        |5       |4           |
|4 |    └─TABLE FULL SCAN    |T2      |5       |3           |
=============================================================
Outputs & filters:
-------------------------------------
  0 - output(nil), filter(nil)
      columns([{T1: ({T1: (T1.C1, T1.C2)}, {GKEY: (T1.C2, T1.C1)})}]), partitions(p[0-3]), 
      column_values([column_conv(NUMBER,PS:(-1,0),NOT NULL,T2.C1 + 1)], [column_conv(NUMBER,PS:(-1,0),NULL,100)]),
      update([T1.C1=column_conv(NUMBER,PS:(-1,0),NOT NULL,T1.C1 + 100)]), 
      insert_conds(nil), update_conds(nil), delete_conds(nil)
  1 - output([T1.C1], [T1.C2], [T2.C1]), filter(nil), rowset=16
      equal_conds([T1.C2 = T2.C2]), other_conds(nil)
      merge_directions([ASC])
  2 - output([T1.C1], [T1.C2]), filter(nil), rowset=16
      access([T1.C1], [T1.C2]), partitions(p0)
      is_index_back=false, is_global_index=true, 
      range_key([T1.C2], [T1.C1]), range(MIN,MIN ; MAX,MAX)always true
  3 - output([T2.C2], [T2.C1]), filter(nil), rowset=16
      sort_keys([T2.C2, ASC])
  4 - output([T2.C1], [T2.C2]), filter(nil), rowset=16
      access([T2.C1], [T2.C2]), partitions(p0)
      is_index_back=false, is_global_index=false, 
      range_key([T2.C1]), range(MIN ; MAX)always true

merge into t1 using t2 on (t1.c2 = t2.c2) when matched then update set t1.c1 = t1.c1 + 100 when not matched then insert values(t2.c1 + 1, 100);
select * from t1;
+-----+------+
| C1  | C2   |
+-----+------+
|   3 |  100 |
|   5 |  100 |
| 101 |    2 |
| 102 |    3 |
| 103 |    4 |
+-----+------+

truncate table t1;
truncate table t2;
insert into t1 values(1, 2);
insert into t2 values(1, 3);
insert into t2 values(2, 2);
explain merge into t1 using t2 on (t1.c2 = t2.c2) when matched then update set t1.c1 = 100 when not matched then insert values(100, 100);
Query Plan
=============================================================
|ID|OPERATOR                 |NAME    |EST.ROWS|EST.TIME(us)|
-------------------------------------------------------------
|0 |DISTRIBUTED MERGE        |        |2       |5           |
|1 |└─MERGE RIGHT OUTER JOIN |        |2       |5           |
|2 |  ├─TABLE FULL SCAN      |T1(GKEY)|1       |3           |
|3 |  └─SORT                 |        |2       |3           |
|4 |    └─TABLE FULL SCAN    |T2      |2       |3           |
=============================================================
Outputs & filters:
-------------------------------------
  0 - output(nil), filter(nil)
      columns([{T1: ({T1: (T1.C1, T1.C2)}, {GKEY: (T1.C2, T1.C1)})}]), partitions(p1), 
      column_values([column_conv(NUMBER,PS:(-1,0),NOT NULL,100)], [column_conv(NUMBER,PS:(-1,0),NULL,100)]),
      update([T1.C1=column_conv(NUMBER,PS:(-1,0),NOT NULL,100)]), 
      insert_conds(nil), update_conds(nil), delete_conds(nil)
  1 - output([T1.C1], [T1.C2]), filter(nil), rowset=16
      equal_conds([T1.C2 = T2.C2]), other_conds(nil)
      merge_directions([ASC])
  2 - output([T1.C1], [T1.C2]), filter(nil), rowset=16
      access([T1.C1], [T1.C2]), partitions(p0)
      is_index_back=false, is_global_index=true, 
      range_key([T1.C2], [T1.C1]), range(MIN,MIN ; MAX,MAX)always true
  3 - output([T2.C2]), filter(nil), rowset=16
      sort_keys([T2.C2, ASC])
  4 - output([T2.C2]), filter(nil), rowset=16
      access([T2.C2]), partitions(p0)
      is_index_back=false, is_global_index=false, 
      range_key([T2.C1]), range(MIN ; MAX)always true
merge into t1 using t2 on (t1.c2 = t2.c2) when matched then update set t1.c1 = 100 when not matched then insert values(100, 100);
ERROR 23000: unique constraint '100' for key 'T1OBPK1' violated

select * from t1;
+----+------+
| C1 | C2   |
+----+------+
|  1 |    2 |
+----+------+

truncate table t1;
truncate table t2;
insert into t1 values(1, 1);
insert into t1 values(2, 2);

insert into t2 values(1, 1);
insert into t2 values(2, 2);

merge into t1 using t2 on (t1.c2 = t2.c2) when matched then update set t1.c1 = t1.c1 + 1;

select * from t1;
+----+------+
| C1 | C2   |
+----+------+
|  2 |    1 |
|  3 |    2 |
+----+------+

create table stu(s1 number, s2 nvarchar2(64) not null, s3 integer default trunc(66.6666666,5), CONSTRAINT "STUOBPK1" PRIMARY KEY (s1), constraint stu_ch check( s2>1)) partition by hash(s1);
create index stu_index on stu(s3) global;
create table stu1(s1 number, s2 nvarchar2(128) not null, s3 integer default trunc(88.8888888,5), CONSTRAINT "STU1OBPK1" PRIMARY KEY (s1), constraint stu1_ch check(s1>1 and s2>1 and s3>1));
insert into stu values(1.111111, 1.111111, 11);
insert into stu1 values(1.111111, 1.111111, 11);
merge into stu a using stu1 b on (a.s1=b.s1) when matched then update set a.s2=1;
ERROR HY000: check constraint violated
merge into stu a using stu1 b on (1=2) when not matched then insert values(3, 1, 4);
ERROR HY000: check constraint violated

merge into stu a using stu1 b on (a.s1=b.s1) when matched then update set a.s2=4;
merge into stu a using stu1 b on (1=2) when not matched then insert values(3, 3, 4);

drop table stu;
drop table stu1;
create table stu(s1 number primary key, s2 nvarchar2(64) not null, s3 integer default trunc(66.6666666,5), constraint stu_ch check( s2>1));
create table stu1(s1 number primary key, s2 nvarchar2(128) not null, s3 integer default trunc(88.8888888,5), constraint stu1_ch check(s1>1 and s2>1 and s3>1));
insert into stu values(1.111111, 1.111111, 11);
insert into stu1 values(1.111111, 1.111111, 11);
merge into stu a using stu1 b on (a.s1=b.s1) when matched then update set a.s2=1;
ERROR HY000: check constraint violated
merge into stu a using stu1 b on (1=2) when not matched then insert values(3, 1, 4);
ERROR HY000: check constraint violated

merge into stu a using stu1 b on (a.s1=b.s1) when matched then update set a.s2=4;
merge into stu a using stu1 b on (1=2) when not matched then insert values(3, 3, 4);

drop table gindex_table;
drop table gindex_table2;
create table gindex_table(c1 number primary key, c2 number, c3 number) enable row movement partition by hash(c1) partitions 5;

create table gindex_table2(c1 number primary key, c2 number, c3 number) enable row movement partition by hash(c1) partitions 5;

create unique index gindex_table_idx on gindex_table(c2) global partition by hash(c2) partitions 4;
create index gindex_table2_idx on gindex_table2(c2) global partition by hash(c2) partitions 4;

merge into gindex_table t1 using gindex_table2 t2 on (t1.c2 = t2.c2) WHEN MATCHED THEN UPDATE SET t1.c3 = t2.c3 WHEN NOT MATCHED THEN insert (t1.c1,t1.c2,t1.c3) values(t2.c1,t2.c2,t2.c3);

## bug: 
drop table t1;
drop table t2;
drop sequence s1;

create table t1 (c1 int, c2 int);
create table t2 (c1 int, c2 int);
create sequence s1;

insert into t1 values (1, 0);
insert into t1 values (4, 0);
insert into t1 values (5, 0);
insert into t2 values (1, -1);
insert into t2 values (2, -1);
insert into t2 values (3, -1);
insert into t2 values (5, -1);

start transaction;
merge into t1 using t2 on (t1.c1 = t2.c1)
  when matched then update set t1.c2 = s1.nextval
  when not matched then insert values (s1.nextval, s1.currval);

select * from t1;
+------+------+
| C1   | C2   |
+------+------+
|    1 |    1 |
|    3 |    3 |
|    4 |    0 |
|    4 |    4 |
|    5 |    2 |
+------+------+
rollback;

start transaction;
merge into t1 using t2 on (t1.c1 = t2.c1)
  when matched then update set t1.c2 = -3
  when not matched then insert values (s1.nextval, -2);

select * from t1;
+------+------+
| C1   | C2   |
+------+------+
|    1 |   -3 |
|    4 |    0 |
|    5 |   -3 |
|    7 |   -2 |
|    8 |   -2 |
+------+------+
rollback;

create index idx_test_merge on t1 (c1) partition by hash(c1) partitions 4;
start transaction;
merge into t1 using t2 on (t1.c1 = t2.c1)
  when matched then update set t1.c2 = s1.nextval
  when not matched then insert values (s1.nextval, s1.currval);

select * from t1;
+------+------+
| C1   | C2   |
+------+------+
|    1 |    9 |
|    4 |    0 |
|    5 |   10 |
|   11 |   11 |
|   12 |   12 |
+------+------+
rollback;

start transaction;
merge into t1 using t2 on (t1.c1 = t2.c1)
  when matched then update set t1.c2 = -3
  when not matched then insert values (s1.nextval, -2);

select * from t1;
+------+------+
| C1   | C2   |
+------+------+
|    1 |   -3 |
|    4 |    0 |
|    5 |   -3 |
|   15 |   -2 |
|   16 |   -2 |
+------+------+
rollback;

## corner cases
merge into t1 using (select s1.nextval x1, s1.currval x2 from dual) v on (v.x1 = t1.c1)
  when matched then update set t1.c2 = v.x1;
ERROR HY000: sequence number not allowed here

merge into t1 using t2 on (t1.c1 = t2.c1) when not matched then insert (s1.nextval, c2) values (t2.c1, t2.c2);
ERROR 42S22: invalid identifier 'S1.NEXTVAL' in 'field list'

merge into t1 using t2 on (t1.c1 = t2.c1) when matched then update set s1.nextval = t2.c2;
ERROR 42S22: invalid identifier 'S1.NEXTVAL' in 'field list'

drop table t1;
drop table t2;
drop sequence s1;
