drop table stu;
drop table stu1;
create table stu(s1 number, s2 nvarchar2(6) unique, s3 nvarchar2(6) default null not null, s4 nvarchar2(6), constraint stu_pk primary key(s1)) partition by hash(s1) partitions 4;
create table stu1(s1 number, s2 nvarchar2(6), s3 nvarchar2(6) default null, s4 nvarchar2(6), constraint stu1_pk primary key(s1)) partition by hash(s1) partitions 4;
insert into stu1(s1,s2,s4) values(100,100,10);
merge into stu master using stu1 slave on (master.s4=slave.s4) when not matched then insert values(slave.s1,slave.s2,slave.s3,slave.s4);
ERROR 23000: cannot insert NULL into '(S3)'
merge into stu master using stu1 slave on (master.s4=slave.s4) when not matched then insert(master.s1, master.s3) values(slave.s1,default);
ERROR 23000: cannot insert NULL into '(S3)'
drop table stu;
drop table stu1;
create table stu(s1 number, s2 nvarchar2(6) unique, s3 nvarchar2(6) default null not null, s4 nvarchar2(6), constraint stu_pk primary key(s1));
create table stu1(s1 number, s2 nvarchar2(6), s3 nvarchar2(6) default null, s4 nvarchar2(6), constraint stu1_pk primary key(s1));
insert into stu1(s1,s2,s4) values(100,100,10);
merge into stu master using stu1 slave on (master.s4=slave.s4) when not matched then insert values(slave.s1,slave.s2,slave.s3,slave.s4);
ERROR 23000: cannot insert NULL into '(S3)'
merge into stu master using stu1 slave on (master.s4=slave.s4) when not matched then insert(master.s1, master.s3) values(slave.s1,default);
ERROR 23000: cannot insert NULL into '(S3)'
drop table t1;
drop table t2;
create table t1(s1 number, s2 nvarchar2(6), constraint t1_pk primary key(s1)) partition by hash(s1) partitions 4;
insert into t1 values(1,1);
create table t2(s1 number, s2 nvarchar2(6), constraint t2_pk primary key(s1)) partition by hash(s1) partitions 4;
insert into t2 values(100,1);
alter table t1 enable row movement;
merge into t1 master using t2 slave on (master.s2=slave.s2) when matched then update set master.s1=null;
ERROR 23000: cannot insert NULL into '(S1)'
drop table t1;
drop table t2;
create table t1(s1 number, s2 nvarchar2(6), constraint t1_pk primary key(s1));
insert into t1 values(1,1);
create table t2(s1 number, s2 nvarchar2(6), constraint t2_pk primary key(s1));
insert into t2 values(100,1);
merge into t1 master using t2 slave on (master.s2=slave.s2) when matched then update set master.s1=null;
ERROR 23000: cannot insert NULL into '(S1)'
drop table stu;
drop table stu1;
create table stu(s1 number, s2 nvarchar2(6) unique, s3 nvarchar2(6) default null not null, s4 nvarchar2(6), constraint stu_pk primary key(s1)) partition by hash(s1) partitions 4;
create table stu1(s1 number, s2 nvarchar2(6), s3 nvarchar2(6) default null, s4 nvarchar2(6), constraint stu1_pk primary key(s1)) partition by hash(s1) partitions 4;
insert into stu values(1,1,1,1);
insert into stu values(2,2,2,2);
insert into stu1(s1,s2,s4) values(100,100,1);
alter table stu enable row movement;
merge into stu master using stu1 slave on (master.s4=slave.s4) when matched then update set master.s1=slave.s1, master.s3=slave.s3;
ERROR 23000: cannot insert NULL into '(S3)'
merge into stu master using stu1 slave on (master.s4=slave.s4) when matched then update set master.s1=slave.s1, master.s3=null;
ERROR 23000: cannot insert NULL into '(S3)'
merge into stu master using stu1 slave on (master.s4=slave.s4) when matched then update set master.s1=slave.s1, master.s3=default;
ERROR 23000: cannot insert NULL into '(S3)'
drop table stu;
drop table stu1;
create table stu(s1 number, s2 nvarchar2(6) unique, s3 nvarchar2(6) default null not null, s4 nvarchar2(6), constraint stu_pk primary key(s1));
create table stu1(s1 number, s2 nvarchar2(6), s3 nvarchar2(6) default null, s4 nvarchar2(6), constraint stu1_pk primary key(s1));
insert into stu values(1,1,1,1);
insert into stu values(2,2,2,2);
insert into stu1(s1,s2,s4) values(100,100,1);
alter table stu enable row movement;
merge into stu master using stu1 slave on (master.s4=slave.s4) when matched then update set master.s1=slave.s1, master.s3=slave.s3;
ERROR 23000: cannot insert NULL into '(S3)'
merge into stu master using stu1 slave on (master.s4=slave.s4) when matched then update set master.s1=slave.s1, master.s3=null;
ERROR 23000: cannot insert NULL into '(S3)'
merge into stu master using stu1 slave on (master.s4=slave.s4) when matched then update set master.s1=slave.s1, master.s3=default;
ERROR 23000: cannot insert NULL into '(S3)'
drop table t1;
drop table t2;
drop table t3;
create table t1(s1 number, s2 nvarchar2(6), constraint t1_pk primary key(s1)) partition by hash(s1) partitions 4;
create table t2(s1 number, s2 nvarchar2(6), constraint t2_pk primary key(s1)) partition by hash(s1) partitions 4;
create table t3(s1 int, s2 int, primary key (s1)) partition by range(s1)
(
partition p0 values less than (10),
partition p1 values less than (20),
partition p2 values less than (100)
);
insert into t1 values (1,1);
insert into t2 values (101,1);
insert into t3 values (1, 1);
set autocommit = 0;
merge INTO t1 master USING t2 slave ON (master.s2=slave.s2) WHEN matched THEN UPDATE SET master.s1=slave.s1 delete where master.s1 > 50;
select * from t1;
S1	S2
rollback;
merge INTO t1 master USING t2 slave ON (master.s2=slave.s2) WHEN matched THEN UPDATE SET master.s1=slave.s1;
ERROR HY000: updating partition key column would cause a partition change
select * from t1;
S1	S2
1	1
rollback;
alter table t1 enable row movement;
merge INTO t1 master USING t2 slave ON (master.s2=slave.s2) WHEN matched THEN UPDATE SET master.s1=slave.s1;
select * from t1;
S1	S2
101	1
rollback;
alter table t3 enable row movement;
merge INTO t3 master USING t2 slave ON (master.s2=slave.s2) WHEN matched THEN UPDATE SET master.s1=slave.s1;
ERROR HY000: inserted partition key does not map to any partition
select * from t3;
S1	S2
1	1
rollback;
drop table test;
drop table test2;
CREATE TABLE test(f1 NUMBER,f2 binary_float,f3 nchar(10),f4 DATE);
INSERT INTO test VALUES(10,101,'aaa',TO_DATE('19700101','yyyymmdd'));
INSERT INTO test VALUES(11,111,'bbb',TO_DATE('19800101','yyyymmdd'));
INSERT INTO test VALUES(12,121,'ccc',TO_DATE('19900101','yyyymmdd'));
INSERT INTO test VALUES(13,131,'ddd',TO_DATE('20000101','yyyymmdd'));
INSERT INTO test VALUES(14,141,'eee',TO_DATE('20100101','yyyymmdd'));
INSERT INTO test VALUES(18,181,'iii',TO_DATE('20500101','yyyymmdd'));
INSERT INTO test VALUES(19,191,'jjj',TO_DATE('20600101','yyyymmdd'));
COMMIT;
CREATE TABLE test2(f1 NUMBER,f2 binary_float PRIMARY KEY,f3 nchar(10),f4 DATE);
DELETE FROM test2;
INSERT INTO test2 SELECT * FROM test;
COMMIT;
MERGE INTO test2 a USING test b
ON (a.f1=b.f1)
WHEN MATCHED THEN
UPDATE SET f2=a.f2+20, f3=rtrim(a.f3)||'_1', f4=a.f4+numtoyminterval(20,'year')
DELETE WHERE a.f2>=141;
COMMIT;
SELECT * FROM test2 ORDER BY 1;
F1	F2	F3	F4
10	1.21E+002	aaa_1     	1990-01-01 00:00:00
11	1.31E+002	bbb_1     	2000-01-01 00:00:00
drop table Z0CASE;
drop table Z1CASE;
CREATE TABLE Z0CASE (z0_test0 varchar2(100),z0_test1 NUMBER);
CREATE TABLE Z1CASE (z1_test0 varchar2(100),z1_test1 NUMBER);
MERGE INTO Z0CASE a USING (SELECT z1_test0 AS ZA, z1_test1 AS ZB FROM Z1CASE Z1) b ON (a.z0_test1=b.ZB)
WHEN matched THEN UPDATE SET a.z0_test0=1 WHERE rownum<2;
ERROR 0A000: internal error code, arguments: -4007, the behavior of rownum in merge stmt not supported
drop table Z0CASE;
drop table Z1CASE;
CREATE TABLE Z0CASE (z0_test0 varchar2(100),z0_test1 NUMBER ,z0_test2 binary_float)
PARTITION BY RANGE(z0_test2) (PARTITION p1 VALUES LESS than(3), PARTITION p2 VALUES LESS than(5), PARTITION p3 VALUES LESS than(MAXVALUE));
INSERT INTO Z0CASE VALUES ('ABCabc',0,1.1);
INSERT INTO Z0CASE VALUES ('123456',1,2.2);
INSERT INTO Z0CASE VALUES ('!@#$%^&*',2,3.333);
INSERT INTO Z0CASE VALUES ('中文字符123',3,4.4444);
INSERT INTO Z0CASE VALUES ('  ',4,5.5555);
INSERT INTO Z0CASE VALUES ('',5,66.666);
CREATE TABLE Z1CASE (z1_test0 varchar2(100),z1_test1 NUMBER ,z1_test2 binary_float);
INSERT INTO Z1CASE VALUES ('11111.1111',4,6.666);
INSERT INTO Z1CASE VALUES ('!@#$%^&*',3,7.777);
INSERT INTO Z1CASE VALUES ('abc中文 字符123',2,8.888);
INSERT INTO Z1CASE VALUES (' ',1,9.999);
MERGE INTO Z0CASE a USING Z1CASE b ON (a.z0_test1=b.z1_test1)
WHEN matched THEN UPDATE SET a.z0_test0=b.z1_test0
DELETE WHERE (z0_test0, z0_test1) IN (WITH myCTE(ZA1,ZB1) AS (SELECT z1_test0 AS ZA1, z1_test1+2 AS ZB1 FROM Z1CASE WHERE z1_test1>3 UNION ALL SELECT Z0.z0_test0, Z0.z0_test1 FROM Z0CASE Z0 INNER JOIN myCTE ON myCTE.ZB1=Z0.z0_test1 WHERE Z0.z0_test1 IS NOT NULL) SELECT * FROM myCTE);
COMMIT;
SELECT * FROM Z0CASE;
Z0_TEST0	Z0_TEST1	Z0_TEST2
ABCabc	0	1.10000002E+000
 	1	2.20000005E+000
abc中文 字符123	2	3.33299994E+000
!@#$%^&*	3	4.44439983E+000
11111.1111	4	5.55550003E+000
NULL	5	6.66660004E+001
set autocommit = 1;
drop table Z0CASE;
drop table Z1CASE;
drop table caicai;
drop table caicai1;
create table caicai(id number,name number,sex number);
create table  caicai1(id1 number,name1 number,sex1 number);
insert into caicai values(0.3,0.4,0.5);
insert into caicai1 values(0.8,0.10,0.12);
merge into caicai a using caicai1 b on(a.id=b.id1)
when not matched then insert values (5,6,8);
select * from caicai;
ID	NAME	SEX
.3	.4	.5
5	6	8
drop table caicai;
drop table caicai1;
drop table Z0CASE;
drop table Z1CASE;
CREATE TABLE Z0CASE (z0_test0 CHAR(100),z0_test1 VARCHAR2(100) ,z0_test2 NCHAR(100), z0_test3 NVARCHAR2(100),z0_test4 DATE,z0_test5 NUMBER,z0_test6 CLOB,z0_test7 BLOB);
CREATE TABLE Z1CASE (z1_test0 CHAR(100),z1_test1 VARCHAR2(100) ,z1_test2 NCHAR(100), z1_test3 NVARCHAR2(100),z1_test4 DATE,z1_test5 NUMBER,z1_test6 CLOB,z1_test7 BLOB);
MERGE INTO Z0CASE a USING (SELECT ZA ,ZB,ZC FROM (SELECT z1_test6 ZA,z1_test5 ZB,z1_test2 ZC FROM Z1CASE Z1 ) ) b
ON (a.z0_test5=b.ZB) when   matched then UPDATE SET z0_test0=(SELECT z1_test6 FROM (SELECT * FROM Z1CASE) WHERE z1_test5=5)
WHERE ZA <some (SELECT z0_test0 FROM  (SELECT * FROM z0case));
ERROR 22000: inconsistent datatypes
INSERT INTO Z0CASE VALUES
('ABC', 'ABC', 'ABC', 'ABC', CURRENT_TIMESTAMP, 1, 'ABC', 'ABC');
INSERT INTO Z1CASE VALUES
('ABC', 'ABC', 'ABC', 'ABC', CURRENT_TIMESTAMP, 1, 'ABC', 'ABC');
merge INTO z0case a USING z1case b ON (a.z0_test5=b.z1_test5) WHEN matched THEN
UPDATE SET z0_test0= (SELECT z0_test0 FROM z1case WHERE z1_test5=1);
drop table OrderItems;
drop table Orders;
drop table Products;
create table Products (
prod_id int primary key not null,
vend_id  char(10)  not null,
prod_name varchar(254),
price number(8,2),
prodesc varchar(100));
insert into Products values(1254,'VMM01','warmer',1199.33,'The city has been among the top-10');
select prodesc from Products;
PRODESC
The city has been among the top-10
create table Orders(
order_num int,
order_date date default sysdate,
cust_id varchar(10),
CONSTRAINT index_num UNIQUE (order_num));
insert into Orders values(110012345,to_date('2020-11-11 00:00:00','yyyy-mm-dd hh24:mi:ss'),'Kelly');
insert into Orders values(110012346,to_date('2020-12-12 12:12:12','yyyy-mm-dd hh24:mi:ss'),'Julie');
create table OrderItems(
order_num int  primary key REFERENCES Orders(order_num),
order_item int,
prod_id int,
foreign key(prod_id) REFERENCES Products(prod_id) ,
quantity int default 1,
item_price number(8,2));
insert into OrderItems values(110012345,998772,1254,100,399.33);
insert into OrderItems values(110012346,998772,1254,200,299.99);
explain merge into OrderItems c using Products e
on (c.prod_id=e.prod_id and e.prod_id=1254)
when matched then
update set c.item_price=e.price
when not matched then 
insert values(110012347,998772,1254,300,588.99);
Query Plan
=========================================================
|ID|OPERATOR                 |NAME|EST.ROWS|EST.TIME(us)|
---------------------------------------------------------
|0 |DISTRIBUTED MERGE        |    |1       |5           |
|1 |└─NESTED-LOOP OUTER JOIN |    |1       |5           |
|2 |  ├─TABLE FULL SCAN      |E   |1       |3           |
|3 |  └─MATERIAL             |    |1       |3           |
|4 |    └─TABLE FULL SCAN    |C   |1       |3           |
=========================================================
Outputs & filters:
-------------------------------------
  0 - output(nil), filter(nil)
      columns([{C: ({ORDERITEMS: (C.ORDER_NUM, C.ORDER_ITEM, C.PROD_ID, C.QUANTITY, C.ITEM_PRICE)})}]), partitions(p0), 
      column_values([column_conv(NUMBER,PS:(-1,0),NOT NULL,110012347)], [column_conv(NUMBER,PS:(-1,0),NULL,998772)], [column_conv(NUMBER,PS:(-1,0),NULL,
      1254)], [column_conv(NUMBER,PS:(-1,0),NULL,300)], [column_conv(DECIMAL_INT,PS:(8,2),NULL,588.99)]),
      update([C.ITEM_PRICE=column_conv(DECIMAL_INT,PS:(8,2),NULL,E.PRICE)]), 
      insert_conds(nil), update_conds(nil), delete_conds(nil)
  1 - output([C.ORDER_NUM], [C.ORDER_ITEM], [C.PROD_ID], [C.QUANTITY], [C.ITEM_PRICE], [E.PRICE]), filter(nil), rowset=16
      conds([E.PROD_ID = 1254]), nl_params_(nil), use_batch=false
  2 - output([E.PROD_ID], [E.PRICE]), filter(nil), rowset=16
      access([E.PROD_ID], [E.PRICE]), partitions(p0)
      is_index_back=false, is_global_index=false, 
      range_key([E.PROD_ID]), range(MIN ; MAX)always true
  3 - output([C.ORDER_NUM], [C.ORDER_ITEM], [C.PROD_ID], [C.QUANTITY], [C.ITEM_PRICE]), filter(nil), rowset=16
  4 - output([C.ORDER_NUM], [C.ORDER_ITEM], [C.PROD_ID], [C.QUANTITY], [C.ITEM_PRICE]), filter([C.PROD_ID = 1254]), rowset=16
      access([C.ORDER_NUM], [C.ORDER_ITEM], [C.PROD_ID], [C.QUANTITY], [C.ITEM_PRICE]), partitions(p0)
      is_index_back=false, is_global_index=false, filter_before_indexback[false], 
      range_key([C.ORDER_NUM]), range(MIN ; MAX)always true
merge into OrderItems c using Products e
on (c.prod_id=e.prod_id and e.prod_id=1254)
when matched then
update set c.item_price=e.price
when not matched then 
insert values(110012347,998772,1254,300,588.99);
select * from OrderItems;
ORDER_NUM	ORDER_ITEM	PROD_ID	QUANTITY	ITEM_PRICE
110012345	998772	1254	100	1199.33
110012346	998772	1254	200	1199.33
drop table t1;
CREATE TABLE t1 (
c0 VARCHAR2(1000),
c1 NUMBER(22, 6),
c2 NUMBER(22, 6),
c3 DATE
) partition by list(c3)
(partition "D20180731" values  (TO_DATE(' 2018-07-31 00:00:00', 'SYYYY-MM-DD HH24:MI:SS', 'NLS_CALENDAR=GREGORIAN')),
partition "D20180831" values  (TO_DATE(' 2018-08-31 00:00:00', 'SYYYY-MM-DD HH24:MI:SS', 'NLS_CALENDAR=GREGORIAN')),
partition "D20180930" values  (TO_DATE(' 2018-09-30 00:00:00', 'SYYYY-MM-DD HH24:MI:SS', 'NLS_CALENDAR=GREGORIAN')));
explain MERGE INTO t1 a1
USING (
SELECT b1.c0,
MAX(b1.c1) AS c1_max,
MAX(b1.c2) AS c2_max
FROM t1 b1
WHERE b1.c3 = DATE '2024-6-30'
    GROUP BY b1.c0
) a2
ON (a1.c3 = DATE '2024-6-30' AND a1.c0 = a2.c0)
WHEN MATCHED THEN
UPDATE SET
a1.c1 = a2.c1_max,
a1.c2 = a2.c2_max
WHERE a1.c3 = DATE '2024-6-30';
Query Plan
=======================================================
|ID|OPERATOR               |NAME|EST.ROWS|EST.TIME(us)|
-------------------------------------------------------
|0 |MERGE                  |    |1       |6           |
|1 |└─HASH JOIN            |    |1       |6           |
|2 |  ├─SUBPLAN SCAN       |A2  |1       |3           |
|3 |  │ └─HASH GROUP BY    |    |1       |3           |
|4 |  │   └─TABLE FULL SCAN|B1  |1       |3           |
|5 |  └─TABLE FULL SCAN    |A1  |1       |3           |
=======================================================
Outputs & filters:
-------------------------------------
  0 - output(nil), filter(nil)
      columns([{A1: ({T1: (A1.__pk_increment, A1.C0, A1.C1, A1.C2, A1.C3)})}]),
      update([A1.C1=column_conv(DECIMAL_INT,PS:(22,6),NULL,A2.C1_MAX)], [A1.C2=column_conv(DECIMAL_INT,PS:(22,6),NULL,A2.C2_MAX)]), 
      insert_conds(nil), update_conds(nil), delete_conds(nil)
  1 - output([A1.__pk_increment], [A1.C0], [A1.C1], [A1.C2], [A1.C3], [A2.C1_MAX], [A2.C2_MAX]), filter(nil), rowset=16
      equal_conds([A1.C0 = A2.C0]), other_conds(nil)
  2 - output([A2.C0], [A2.C1_MAX], [A2.C2_MAX]), filter(nil), rowset=16
      access([A2.C0], [A2.C1_MAX], [A2.C2_MAX])
  3 - output([B1.C0], [T_FUN_MAX(B1.C1)], [T_FUN_MAX(B1.C2)]), filter(nil), rowset=16
      group([B1.C0]), agg_func([T_FUN_MAX(B1.C1)], [T_FUN_MAX(B1.C2)])
  4 - output([B1.C0], [B1.C1], [B1.C2]), filter([B1.C3 = '2024-06-30 00:00:00']), rowset=16
      access([B1.C3], [B1.C0], [B1.C1], [B1.C2]), partitions(p0)
      is_index_back=false, is_global_index=false, filter_before_indexback[false], 
      range_key([B1.__pk_increment]), range(MIN ; MAX)always true
  5 - output([A1.__pk_increment], [A1.C3], [A1.C0], [A1.C1], [A1.C2]), filter([A1.C3 = '2024-06-30 00:00:00']), rowset=16
      access([A1.__pk_increment], [A1.C3], [A1.C0], [A1.C1], [A1.C2]), partitions(p0)
      is_index_back=false, is_global_index=false, filter_before_indexback[false], 
      range_key([A1.__pk_increment]), range(MIN ; MAX)always true
drop table t1;
drop table Z0CASE;
drop table Z1CASE;
