drop table t1;
drop table t2;
drop table t1_part;
drop table t2_part;
create table t1(a int, b int, c int, d int);
create table t1_part(a int, b int, c int, d int) partition by hash(a) partitions 4;
create table t2(a int, b int, c int, d int);
create table t2_part(a int, b int, c int, d int) partition by hash(b) partitions 4;
insert into t1 values (1,1,1,1),(2,2,2,2),(3,3,3,3),(4,4,4,4),(5,5,5,5);
insert into t1_part values (1,1,1,1),(2,2,2,2),(3,3,3,3),(4,4,4,4),(5,5,5,5);
insert into t2 values (2,2,2,2),(3,3,3,3),(4,4,4,4),(5,5,5,5),(6,6,6,6);
insert into t2_part values (2,2,2,2),(3,3,3,3),(4,4,4,4),(5,5,5,5),(6,6,6,6);
result_format: 4
##test subquery in update condition and insert condition
explain basic merge into t1 using t2 on (t1.a = t2.a) when matched then update set t1.b = 1 where exists(select 1 from t2 where t2.b = t1.b);
Query Plan
================================
|ID|OPERATOR             |NAME |
--------------------------------
|0 |MERGE                |     |
|1 |└─HASH SEMI JOIN     |     |
|2 |  ├─HASH JOIN        |     |
|3 |  │ ├─TABLE FULL SCAN|T2   |
|4 |  │ └─TABLE FULL SCAN|T1   |
|5 |  └─SUBPLAN SCAN     |VIEW1|
|6 |    └─TABLE FULL SCAN|T2   |
================================
Outputs & filters:
-------------------------------------
  0 - output(nil), filter(nil)
      columns([{T1: ({T1: (T1.__pk_increment, T1.A, T1.B, T1.C, T1.D)})}]),
      update([T1.B=column_conv(NUMBER,PS:(-1,0),NULL,1)]), 
      insert_conds(nil), update_conds(nil), delete_conds(nil)
  1 - output([T1.__pk_increment], [T1.A], [T1.B], [T1.C], [T1.D]), filter(nil), rowset=16
      equal_conds([VIEW1.T2.B = T1.B]), other_conds(nil)
  2 - output([T1.__pk_increment], [T1.A], [T1.B], [T1.C], [T1.D]), filter(nil), rowset=16
      equal_conds([T1.A = T2.A]), other_conds(nil)
  3 - output([T2.A]), filter(nil), rowset=16
      access([T2.A]), partitions(p0)
      is_index_back=false, is_global_index=false, 
      range_key([T2.__pk_increment]), range(MIN ; MAX)always true
  4 - output([T1.__pk_increment], [T1.A], [T1.B], [T1.C], [T1.D]), filter([T1.__pk_increment IS NOT NULL]), rowset=16
      access([T1.__pk_increment], [T1.A], [T1.B], [T1.C], [T1.D]), partitions(p0)
      is_index_back=false, is_global_index=false, filter_before_indexback[false], 
      range_key([T1.__pk_increment]), range(MIN ; MAX)always true
  5 - output([VIEW1.T2.B]), filter(nil), rowset=16
      access([VIEW1.T2.B])
  6 - output([T2.B]), filter(nil), rowset=16
      access([T2.B]), partitions(p0)
      is_index_back=false, is_global_index=false, 
      range_key([T2.__pk_increment]), range(MIN ; MAX)always true
merge into t1 using t2 on (t1.a = t2.a) when matched then update set t1.b = 1 where exists(select 1 from t2 where t2.b = t1.b);
select * from t1;
+------+------+------+------+
| A    | B    | C    | D    |
+------+------+------+------+
|    1 |    1 |    1 |    1 |
|    2 |    1 |    2 |    2 |
|    3 |    1 |    3 |    3 |
|    4 |    1 |    4 |    4 |
|    5 |    1 |    5 |    5 |
+------+------+------+------+

explain basic merge into t1 using t2 on (t1.a = t2.a) when not matched then insert (t1.a,t1.b,t1.c,t1.d) values (6,6,6,6) where 15 < (select sum(b) from t2);
Query Plan
===============================
|ID|OPERATOR             |NAME|
-------------------------------
|0 |MERGE                |    |
|1 |└─SUBPLAN FILTER     |    |
|2 |  ├─HASH OUTER JOIN  |    |
|3 |  │ ├─TABLE FULL SCAN|T2  |
|4 |  │ └─TABLE FULL SCAN|T1  |
|5 |  └─SCALAR GROUP BY  |    |
|6 |    └─TABLE FULL SCAN|T2  |
===============================
Outputs & filters:
-------------------------------------
  0 - output(nil), filter(nil)
      columns([{T1: ({T1: (T1.__pk_increment, T1.A, T1.B, T1.C, T1.D)})}]), partitions(p0), 
      column_values([T_HIDDEN_PK], [column_conv(NUMBER,PS:(-1,0),NULL,6)], [column_conv(NUMBER,PS:(-1,0),NULL,6)], [column_conv(NUMBER,PS:(-1,0),NULL,6)],
       [column_conv(NUMBER,PS:(-1,0),NULL,6)]), 
      insert_conds([T1.__pk_increment IS NULL AND 15 < :0]), update_conds(nil), delete_conds(nil)
  1 - output([T1.__pk_increment], [T1.A], [T1.B], [T1.C], [T1.D], [:0]), filter(nil), rowset=16
      exec_params_(nil), onetime_exprs_([subquery(1)(:0)]), init_plan_idxs_(nil), use_batch=false
  2 - output([T1.__pk_increment], [T1.A], [T1.B], [T1.C], [T1.D]), filter(nil), rowset=16
      equal_conds([T1.A = T2.A]), other_conds(nil)
  3 - output([T2.A]), filter(nil), rowset=16
      access([T2.A]), partitions(p0)
      is_index_back=false, is_global_index=false, 
      range_key([T2.__pk_increment]), range(MIN ; MAX)always true
  4 - output([T1.__pk_increment], [T1.A], [T1.B], [T1.C], [T1.D]), filter(nil), rowset=16
      access([T1.__pk_increment], [T1.A], [T1.B], [T1.C], [T1.D]), partitions(p0)
      is_index_back=false, is_global_index=false, 
      range_key([T1.__pk_increment]), range(MIN ; MAX)always true
  5 - output([T_FUN_SUM(T_FUN_SUM(T2.B))]), filter(nil), rowset=16
      group(nil), agg_func([T_FUN_SUM(T_FUN_SUM(T2.B))])
  6 - output([T_FUN_SUM(T2.B)]), filter(nil), rowset=16
      access([T2.B]), partitions(p0)
      is_index_back=false, is_global_index=false, 
      range_key([T2.__pk_increment]), range(MIN ; MAX)always true, 
      pushdown_aggregation([T_FUN_SUM(T2.B)])
merge into t1 using t2 on (t1.a = t2.a) when not matched then insert (t1.a,t1.b,t1.c,t1.d) values (6,6,6,6) where 15 < (select sum(b) from t2);
select * from t1;
+------+------+------+------+
| A    | B    | C    | D    |
+------+------+------+------+
|    1 |    1 |    1 |    1 |
|    2 |    1 |    2 |    2 |
|    3 |    1 |    3 |    3 |
|    4 |    1 |    4 |    4 |
|    5 |    1 |    5 |    5 |
|    6 |    6 |    6 |    6 |
+------+------+------+------+

explain basic merge into t1 using t2 on (t1.a = t2.a) when matched then update set t1.b = 1 where exists(select 1 from t2 where t2.b = t1.b) and t1.c = 2;
Query Plan
================================
|ID|OPERATOR             |NAME |
--------------------------------
|0 |MERGE                |     |
|1 |└─HASH SEMI JOIN     |     |
|2 |  ├─HASH JOIN        |     |
|3 |  │ ├─TABLE FULL SCAN|T1   |
|4 |  │ └─TABLE FULL SCAN|T2   |
|5 |  └─SUBPLAN SCAN     |VIEW1|
|6 |    └─TABLE FULL SCAN|T2   |
================================
Outputs & filters:
-------------------------------------
  0 - output(nil), filter(nil)
      columns([{T1: ({T1: (T1.__pk_increment, T1.A, T1.B, T1.C, T1.D)})}]),
      update([T1.B=column_conv(NUMBER,PS:(-1,0),NULL,1)]), 
      insert_conds(nil), update_conds(nil), delete_conds(nil)
  1 - output([T1.__pk_increment], [T1.A], [T1.B], [T1.C], [T1.D]), filter(nil), rowset=16
      equal_conds([VIEW1.T2.B = T1.B]), other_conds(nil)
  2 - output([T1.__pk_increment], [T1.A], [T1.B], [T1.C], [T1.D]), filter(nil), rowset=16
      equal_conds([T1.A = T2.A]), other_conds(nil)
  3 - output([T1.__pk_increment], [T1.A], [T1.B], [T1.C], [T1.D]), filter([T1.C = 2], [T1.__pk_increment IS NOT NULL]), rowset=16
      access([T1.__pk_increment], [T1.A], [T1.B], [T1.C], [T1.D]), partitions(p0)
      is_index_back=false, is_global_index=false, filter_before_indexback[false,false], 
      range_key([T1.__pk_increment]), range(MIN ; MAX)always true
  4 - output([T2.A]), filter(nil), rowset=16
      access([T2.A]), partitions(p0)
      is_index_back=false, is_global_index=false, 
      range_key([T2.__pk_increment]), range(MIN ; MAX)always true
  5 - output([VIEW1.T2.B]), filter(nil), rowset=16
      access([VIEW1.T2.B])
  6 - output([T2.B]), filter(nil), rowset=16
      access([T2.B]), partitions(p0)
      is_index_back=false, is_global_index=false, 
      range_key([T2.__pk_increment]), range(MIN ; MAX)always true
merge into t1 using t2 on (t1.a = t2.a) when matched then update set t1.b = 1 where exists(select 1 from t2 where t2.b = t1.b) and t1.c = 2;
select * from t1;
+------+------+------+------+
| A    | B    | C    | D    |
+------+------+------+------+
|    1 |    1 |    1 |    1 |
|    2 |    1 |    2 |    2 |
|    3 |    1 |    3 |    3 |
|    4 |    1 |    4 |    4 |
|    5 |    1 |    5 |    5 |
|    6 |    6 |    6 |    6 |
+------+------+------+------+

explain basic merge into t1 using t2 on (t1.a = t2.a) when not matched then insert (t1.a,t1.b,t1.c,t1.d) values (6,6,6,6) where 15 < (select sum(b) from t2) and 
t2.c = 1;
Query Plan
===============================
|ID|OPERATOR             |NAME|
-------------------------------
|0 |MERGE                |    |
|1 |└─SUBPLAN FILTER     |    |
|2 |  ├─HASH OUTER JOIN  |    |
|3 |  │ ├─TABLE FULL SCAN|T2  |
|4 |  │ └─TABLE FULL SCAN|T1  |
|5 |  └─SCALAR GROUP BY  |    |
|6 |    └─TABLE FULL SCAN|T2  |
===============================
Outputs & filters:
-------------------------------------
  0 - output(nil), filter(nil)
      columns([{T1: ({T1: (T1.__pk_increment, T1.A, T1.B, T1.C, T1.D)})}]), partitions(p0), 
      column_values([T_HIDDEN_PK], [column_conv(NUMBER,PS:(-1,0),NULL,6)], [column_conv(NUMBER,PS:(-1,0),NULL,6)], [column_conv(NUMBER,PS:(-1,0),NULL,6)],
       [column_conv(NUMBER,PS:(-1,0),NULL,6)]), 
      insert_conds([(T_OP_AND, T1.__pk_increment IS NULL, 15 < :0, T2.C = 1)]), update_conds(nil), delete_conds(nil)
  1 - output([T1.__pk_increment], [T1.A], [T1.B], [T1.C], [T1.D], [:0], [T2.C]), filter(nil), rowset=16
      exec_params_(nil), onetime_exprs_([subquery(1)(:0)]), init_plan_idxs_(nil), use_batch=false
  2 - output([T1.__pk_increment], [T1.A], [T1.B], [T1.C], [T1.D], [T2.C]), filter(nil), rowset=16
      equal_conds([T1.A = T2.A]), other_conds(nil)
  3 - output([T2.A], [T2.C]), filter(nil), rowset=16
      access([T2.A], [T2.C]), partitions(p0)
      is_index_back=false, is_global_index=false, 
      range_key([T2.__pk_increment]), range(MIN ; MAX)always true
  4 - output([T1.__pk_increment], [T1.A], [T1.B], [T1.C], [T1.D]), filter(nil), rowset=16
      access([T1.__pk_increment], [T1.A], [T1.B], [T1.C], [T1.D]), partitions(p0)
      is_index_back=false, is_global_index=false, 
      range_key([T1.__pk_increment]), range(MIN ; MAX)always true
  5 - output([T_FUN_SUM(T_FUN_SUM(T2.B))]), filter(nil), rowset=16
      group(nil), agg_func([T_FUN_SUM(T_FUN_SUM(T2.B))])
  6 - output([T_FUN_SUM(T2.B)]), filter(nil), rowset=16
      access([T2.B]), partitions(p0)
      is_index_back=false, is_global_index=false, 
      range_key([T2.__pk_increment]), range(MIN ; MAX)always true, 
      pushdown_aggregation([T_FUN_SUM(T2.B)])
merge into t1 using t2 on (t1.a = t2.a) when not matched then insert (t1.a,t1.b,t1.c,t1.d) values (6,6,6,6) where 15 < (select sum(b) from t2) and 
t2.c = 1;
select * from t1;
+------+------+------+------+
| A    | B    | C    | D    |
+------+------+------+------+
|    1 |    1 |    1 |    1 |
|    2 |    1 |    2 |    2 |
|    3 |    1 |    3 |    3 |
|    4 |    1 |    4 |    4 |
|    5 |    1 |    5 |    5 |
|    6 |    6 |    6 |    6 |
+------+------+------+------+

explain basic merge into t1 using t2 on (t1.a = t2.a) when matched then update set t1.b = 1 where exists(select 1 from t2);
Query Plan
===============================
|ID|OPERATOR             |NAME|
-------------------------------
|0 |MERGE                |    |
|1 |└─SUBPLAN FILTER     |    |
|2 |  ├─HASH JOIN        |    |
|3 |  │ ├─TABLE FULL SCAN|T2  |
|4 |  │ └─TABLE FULL SCAN|T1  |
|5 |  └─TABLE FULL SCAN  |T2  |
===============================
Outputs & filters:
-------------------------------------
  0 - output(nil), filter(nil)
      columns([{T1: ({T1: (T1.__pk_increment, T1.A, T1.B, T1.C, T1.D)})}]),
      update([T1.B=column_conv(NUMBER,PS:(-1,0),NULL,1)]), 
      insert_conds(nil), update_conds(nil), delete_conds(nil)
  1 - output([T1.__pk_increment], [T1.A], [T1.B], [T1.C], [T1.D]), filter(nil), rowset=16
      exec_params_(nil), onetime_exprs_([(T_OP_EXISTS, subquery(1))(:0)]), init_plan_idxs_(nil), use_batch=false
  2 - output([T1.__pk_increment], [T1.A], [T1.B], [T1.C], [T1.D]), filter(nil), startup_filter([:0]), rowset=16
      equal_conds([T1.A = T2.A]), other_conds(nil)
  3 - output([T2.A]), filter(nil), rowset=16
      access([T2.A]), partitions(p0)
      is_index_back=false, is_global_index=false, 
      range_key([T2.__pk_increment]), range(MIN ; MAX)always true
  4 - output([T1.__pk_increment], [T1.A], [T1.B], [T1.C], [T1.D]), filter([T1.__pk_increment IS NOT NULL]), rowset=16
      access([T1.__pk_increment], [T1.A], [T1.B], [T1.C], [T1.D]), partitions(p0)
      is_index_back=false, is_global_index=false, filter_before_indexback[false], 
      range_key([T1.__pk_increment]), range(MIN ; MAX)always true
  5 - output([1]), filter(nil), rowset=16
      access(nil), partitions(p0)
      limit(1), offset(nil), is_index_back=false, is_global_index=false, 
      range_key([T2.__pk_increment]), range(MIN ; MAX)always true
merge into t1 using t2 on (t1.a = t2.a) when matched then update set t1.b = 1 where exists(select 1 from t2);
select * from t1;
+------+------+------+------+
| A    | B    | C    | D    |
+------+------+------+------+
|    1 |    1 |    1 |    1 |
|    2 |    1 |    2 |    2 |
|    3 |    1 |    3 |    3 |
|    4 |    1 |    4 |    4 |
|    5 |    1 |    5 |    5 |
|    6 |    1 |    6 |    6 |
+------+------+------+------+

explain basic merge into t1 using t2 on (t1.a = t2.a) when not matched then insert (t1.a,t1.b,t1.c,t1.d) values (6,6,6,6) where exists(select 1 from t2);
Query Plan
===============================
|ID|OPERATOR             |NAME|
-------------------------------
|0 |MERGE                |    |
|1 |└─SUBPLAN FILTER     |    |
|2 |  ├─HASH OUTER JOIN  |    |
|3 |  │ ├─TABLE FULL SCAN|T2  |
|4 |  │ └─TABLE FULL SCAN|T1  |
|5 |  └─TABLE FULL SCAN  |T2  |
===============================
Outputs & filters:
-------------------------------------
  0 - output(nil), filter(nil)
      columns([{T1: ({T1: (T1.__pk_increment, T1.A, T1.B, T1.C, T1.D)})}]), partitions(p0), 
      column_values([T_HIDDEN_PK], [column_conv(NUMBER,PS:(-1,0),NULL,6)], [column_conv(NUMBER,PS:(-1,0),NULL,6)], [column_conv(NUMBER,PS:(-1,0),NULL,6)],
       [column_conv(NUMBER,PS:(-1,0),NULL,6)]), 
      insert_conds([T1.__pk_increment IS NULL AND :0]), update_conds(nil), delete_conds(nil)
  1 - output([T1.__pk_increment], [T1.A], [T1.B], [T1.C], [T1.D], [:0]), filter(nil), rowset=16
      exec_params_(nil), onetime_exprs_([(T_OP_EXISTS, subquery(1))(:0)]), init_plan_idxs_(nil), use_batch=false
  2 - output([T1.__pk_increment], [T1.A], [T1.B], [T1.C], [T1.D]), filter(nil), rowset=16
      equal_conds([T1.A = T2.A]), other_conds(nil)
  3 - output([T2.A]), filter(nil), rowset=16
      access([T2.A]), partitions(p0)
      is_index_back=false, is_global_index=false, 
      range_key([T2.__pk_increment]), range(MIN ; MAX)always true
  4 - output([T1.__pk_increment], [T1.A], [T1.B], [T1.C], [T1.D]), filter(nil), rowset=16
      access([T1.__pk_increment], [T1.A], [T1.B], [T1.C], [T1.D]), partitions(p0)
      is_index_back=false, is_global_index=false, 
      range_key([T1.__pk_increment]), range(MIN ; MAX)always true
  5 - output([1]), filter(nil), rowset=16
      access(nil), partitions(p0)
      limit(1), offset(nil), is_index_back=false, is_global_index=false, 
      range_key([T2.__pk_increment]), range(MIN ; MAX)always true
merge into t1 using t2 on (t1.a = t2.a) when not matched then insert (t1.a,t1.b,t1.c,t1.d) values (6,6,6,6) where exists(select 1 from t2);
select * from t1;
+------+------+------+------+
| A    | B    | C    | D    |
+------+------+------+------+
|    1 |    1 |    1 |    1 |
|    2 |    1 |    2 |    2 |
|    3 |    1 |    3 |    3 |
|    4 |    1 |    4 |    4 |
|    5 |    1 |    5 |    5 |
|    6 |    1 |    6 |    6 |
+------+------+------+------+

explain basic merge into t1 using t2 on (t1.a = t2.a) when matched then update set t1.b = 1 where exists (select 1 from t2 where t1.b = t2.b) when not matched then insert (t1.a,t1.b,t1.c,t1.d) values (6,6,6,6) where exists(select 1 from t2);
Query Plan
===============================
|ID|OPERATOR             |NAME|
-------------------------------
|0 |MERGE                |    |
|1 |└─SUBPLAN FILTER     |    |
|2 |  ├─HASH OUTER JOIN  |    |
|3 |  │ ├─TABLE FULL SCAN|T2  |
|4 |  │ └─TABLE FULL SCAN|T1  |
|5 |  ├─TABLE FULL SCAN  |T2  |
|6 |  └─TABLE FULL SCAN  |T2  |
===============================
Outputs & filters:
-------------------------------------
  0 - output(nil), filter(nil)
      columns([{T1: ({T1: (T1.__pk_increment, T1.A, T1.B, T1.C, T1.D)})}]), partitions(p0), 
      column_values([T_HIDDEN_PK], [column_conv(NUMBER,PS:(-1,0),NULL,6)], [column_conv(NUMBER,PS:(-1,0),NULL,6)], [column_conv(NUMBER,PS:(-1,0),NULL,6)],
       [column_conv(NUMBER,PS:(-1,0),NULL,6)]),
      update([T1.B=column_conv(NUMBER,PS:(-1,0),NULL,1)]), 
      insert_conds([T1.__pk_increment IS NULL AND :1]), update_conds([T1.__pk_increment IS NOT NULL AND (T_OP_EXISTS, subquery(1))]), delete_conds(nil)
  1 - output([T1.__pk_increment], [T1.A], [T1.B], [T1.C], [T1.D], [(T_OP_EXISTS, subquery(1))], [:1]), filter(nil), rowset=16
      exec_params_([T1.B(:0)]), onetime_exprs_([(T_OP_EXISTS, subquery(2))(:1)]), init_plan_idxs_(nil), use_batch=false
  2 - output([T1.__pk_increment], [T1.A], [T1.B], [T1.C], [T1.D]), filter(nil), rowset=16
      equal_conds([T1.A = T2.A]), other_conds(nil)
  3 - output([T2.A]), filter(nil), rowset=16
      access([T2.A]), partitions(p0)
      is_index_back=false, is_global_index=false, 
      range_key([T2.__pk_increment]), range(MIN ; MAX)always true
  4 - output([T1.__pk_increment], [T1.A], [T1.B], [T1.C], [T1.D]), filter(nil), rowset=16
      access([T1.__pk_increment], [T1.A], [T1.B], [T1.C], [T1.D]), partitions(p0)
      is_index_back=false, is_global_index=false, 
      range_key([T1.__pk_increment]), range(MIN ; MAX)always true
  5 - output([1]), filter([:0 = T2.B]), rowset=16
      access([T2.B]), partitions(p0)
      limit(1), offset(nil), is_index_back=false, is_global_index=false, filter_before_indexback[false], 
      range_key([T2.__pk_increment]), range(MIN ; MAX)always true
  6 - output([1]), filter(nil), rowset=16
      access(nil), partitions(p0)
      limit(1), offset(nil), is_index_back=false, is_global_index=false, 
      range_key([T2.__pk_increment]), range(MIN ; MAX)always true
merge into t1 using t2 on (t1.a = t2.a) when matched then update set t1.b = 1 where exists (select 1 from t2 where t1.b = t2.b) when not matched then insert (t1.a,t1.b,t1.c,t1.d) values (6,6,6,6) where exists(select 1 from t2);
select * from t1;
+------+------+------+------+
| A    | B    | C    | D    |
+------+------+------+------+
|    1 |    1 |    1 |    1 |
|    2 |    1 |    2 |    2 |
|    3 |    1 |    3 |    3 |
|    4 |    1 |    4 |    4 |
|    5 |    1 |    5 |    5 |
|    6 |    1 |    6 |    6 |
+------+------+------+------+

##test subquery in update assign the insert values
explain basic merge into t1 using t2 on (t1.a = t2.a) when matched then update set t1.b = (select sum(b) from t2) where t1.c = 2;
Query Plan
===============================
|ID|OPERATOR             |NAME|
-------------------------------
|0 |MERGE                |    |
|1 |└─SUBPLAN FILTER     |    |
|2 |  ├─HASH JOIN        |    |
|3 |  │ ├─TABLE FULL SCAN|T1  |
|4 |  │ └─TABLE FULL SCAN|T2  |
|5 |  └─SCALAR GROUP BY  |    |
|6 |    └─TABLE FULL SCAN|T2  |
===============================
Outputs & filters:
-------------------------------------
  0 - output(nil), filter(nil)
      columns([{T1: ({T1: (T1.__pk_increment, T1.A, T1.B, T1.C, T1.D)})}]),
      update([T1.B=CASE WHEN T1.__pk_increment IS NOT NULL THEN column_conv(NUMBER,PS:(-1,0),NULL,:0) ELSE cast(NULL, NUMBER(-1, 0)) END]), 
      insert_conds(nil), update_conds(nil), delete_conds(nil)
  1 - output([T1.__pk_increment], [T1.A], [T1.B], [T1.C], [T1.D], [:0]), filter(nil), rowset=16
      exec_params_(nil), onetime_exprs_([subquery(1)(:0)]), init_plan_idxs_(nil), use_batch=false
  2 - output([T1.__pk_increment], [T1.A], [T1.B], [T1.C], [T1.D]), filter(nil), rowset=16
      equal_conds([T1.A = T2.A]), other_conds(nil)
  3 - output([T1.__pk_increment], [T1.A], [T1.B], [T1.C], [T1.D]), filter([T1.C = 2]), rowset=16
      access([T1.__pk_increment], [T1.A], [T1.B], [T1.C], [T1.D]), partitions(p0)
      is_index_back=false, is_global_index=false, filter_before_indexback[false], 
      range_key([T1.__pk_increment]), range(MIN ; MAX)always true
  4 - output([T2.A]), filter(nil), rowset=16
      access([T2.A]), partitions(p0)
      is_index_back=false, is_global_index=false, 
      range_key([T2.__pk_increment]), range(MIN ; MAX)always true
  5 - output([T_FUN_SUM(T_FUN_SUM(T2.B))]), filter(nil), rowset=16
      group(nil), agg_func([T_FUN_SUM(T_FUN_SUM(T2.B))])
  6 - output([T_FUN_SUM(T2.B)]), filter(nil), rowset=16
      access([T2.B]), partitions(p0)
      is_index_back=false, is_global_index=false, 
      range_key([T2.__pk_increment]), range(MIN ; MAX)always true, 
      pushdown_aggregation([T_FUN_SUM(T2.B)])
merge into t1 using t2 on (t1.a = t2.a) when matched then update set t1.b = (select sum(b) from t2) where t1.c = 2;
select * from t1;
+------+------+------+------+
| A    | B    | C    | D    |
+------+------+------+------+
|    1 |    1 |    1 |    1 |
|    2 |   20 |    2 |    2 |
|    3 |    1 |    3 |    3 |
|    4 |    1 |    4 |    4 |
|    5 |    1 |    5 |    5 |
|    6 |    1 |    6 |    6 |
+------+------+------+------+

explain basic merge into t1 using t2 on (t1.a = t2.a) when matched then update set t1.b = (select sum(b) from t2 where t2.d = t1.d) where t1.c = 2;
Query Plan
===============================
|ID|OPERATOR             |NAME|
-------------------------------
|0 |MERGE                |    |
|1 |└─SUBPLAN FILTER     |    |
|2 |  ├─HASH JOIN        |    |
|3 |  │ ├─TABLE FULL SCAN|T1  |
|4 |  │ └─TABLE FULL SCAN|T2  |
|5 |  └─SCALAR GROUP BY  |    |
|6 |    └─TABLE FULL SCAN|T2  |
===============================
Outputs & filters:
-------------------------------------
  0 - output(nil), filter(nil)
      columns([{T1: ({T1: (T1.__pk_increment, T1.A, T1.B, T1.C, T1.D)})}]),
      update([T1.B=CASE WHEN T1.__pk_increment IS NOT NULL THEN column_conv(NUMBER,PS:(-1,0),NULL,subquery(1)) ELSE cast(NULL, NUMBER(-1, 0)) END]), 
      insert_conds(nil), update_conds(nil), delete_conds(nil)
  1 - output([T1.__pk_increment], [T1.A], [T1.B], [T1.C], [T1.D], [subquery(1)]), filter(nil), rowset=16
      exec_params_([T1.D(:0)]), onetime_exprs_(nil), init_plan_idxs_(nil), use_batch=false
  2 - output([T1.__pk_increment], [T1.A], [T1.B], [T1.C], [T1.D]), filter(nil), rowset=16
      equal_conds([T1.A = T2.A]), other_conds(nil)
  3 - output([T1.__pk_increment], [T1.A], [T1.B], [T1.C], [T1.D]), filter([T1.C = 2]), rowset=16
      access([T1.__pk_increment], [T1.A], [T1.B], [T1.C], [T1.D]), partitions(p0)
      is_index_back=false, is_global_index=false, filter_before_indexback[false], 
      range_key([T1.__pk_increment]), range(MIN ; MAX)always true
  4 - output([T2.A]), filter(nil), rowset=16
      access([T2.A]), partitions(p0)
      is_index_back=false, is_global_index=false, 
      range_key([T2.__pk_increment]), range(MIN ; MAX)always true
  5 - output([T_FUN_SUM(T_FUN_SUM(T2.B))]), filter(nil), rowset=16
      group(nil), agg_func([T_FUN_SUM(T_FUN_SUM(T2.B))])
  6 - output([T_FUN_SUM(T2.B)]), filter([T2.D = :0]), rowset=16
      access([T2.D], [T2.B]), partitions(p0)
      is_index_back=false, is_global_index=false, filter_before_indexback[false], 
      range_key([T2.__pk_increment]), range(MIN ; MAX)always true, 
      pushdown_aggregation([T_FUN_SUM(T2.B)])
merge into t1 using t2 on (t1.a = t2.a) when matched then update set t1.b = (select sum(b) from t2 where t2.d = t1.d) where t1.c = 2;
select * from t1;
+------+------+------+------+
| A    | B    | C    | D    |
+------+------+------+------+
|    1 |    1 |    1 |    1 |
|    2 |    2 |    2 |    2 |
|    3 |    1 |    3 |    3 |
|    4 |    1 |    4 |    4 |
|    5 |    1 |    5 |    5 |
|    6 |    1 |    6 |    6 |
+------+------+------+------+

explain basic merge into t1 using t2 on (t1.a = t2.a) when not matched then insert (t1.a,t1.b,t1.c,t1.d) values (6,6,6,(select sum(t2.d) from t2)) where t2.c = 1;
Query Plan
===============================
|ID|OPERATOR             |NAME|
-------------------------------
|0 |MERGE                |    |
|1 |└─SUBPLAN FILTER     |    |
|2 |  ├─HASH OUTER JOIN  |    |
|3 |  │ ├─TABLE FULL SCAN|T2  |
|4 |  │ └─TABLE FULL SCAN|T1  |
|5 |  └─SCALAR GROUP BY  |    |
|6 |    └─TABLE FULL SCAN|T2  |
===============================
Outputs & filters:
-------------------------------------
  0 - output(nil), filter(nil)
      columns([{T1: ({T1: (T1.__pk_increment, T1.A, T1.B, T1.C, T1.D)})}]), partitions(p0), 
      column_values([T_HIDDEN_PK], [column_conv(NUMBER,PS:(-1,0),NULL,6)], [column_conv(NUMBER,PS:(-1,0),NULL,6)], [column_conv(NUMBER,PS:(-1,0),NULL,6)],
       [column_conv(NUMBER,PS:(-1,0),NULL,CASE WHEN T2.C = 1 THEN :0 ELSE NULL END)]), 
      insert_conds([T2.C = 1]), update_conds(nil), delete_conds(nil)
  1 - output([T1.__pk_increment], [T1.A], [T1.B], [T1.C], [T1.D], [T2.C = 1], [:0]), filter(nil), rowset=16
      exec_params_(nil), onetime_exprs_([subquery(1)(:0)]), init_plan_idxs_(nil), use_batch=false
  2 - output([T1.__pk_increment], [T1.A], [T1.B], [T1.C], [T1.D], [T2.C]), filter(nil), rowset=16
      equal_conds([T1.A = T2.A]), other_conds(nil)
  3 - output([T2.A], [T2.C]), filter(nil), rowset=16
      access([T2.A], [T2.C]), partitions(p0)
      is_index_back=false, is_global_index=false, 
      range_key([T2.__pk_increment]), range(MIN ; MAX)always true
  4 - output([T1.__pk_increment], [T1.A], [T1.B], [T1.C], [T1.D]), filter(nil), rowset=16
      access([T1.__pk_increment], [T1.A], [T1.B], [T1.C], [T1.D]), partitions(p0)
      is_index_back=false, is_global_index=false, 
      range_key([T1.__pk_increment]), range(MIN ; MAX)always true
  5 - output([T_FUN_SUM(T_FUN_SUM(T2.D))]), filter(nil), rowset=16
      group(nil), agg_func([T_FUN_SUM(T_FUN_SUM(T2.D))])
  6 - output([T_FUN_SUM(T2.D)]), filter(nil), rowset=16
      access([T2.D]), partitions(p0)
      is_index_back=false, is_global_index=false, 
      range_key([T2.__pk_increment]), range(MIN ; MAX)always true, 
      pushdown_aggregation([T_FUN_SUM(T2.D)])
merge into t1 using t2 on (t1.a = t2.a) when not matched then insert (t1.a,t1.b,t1.c,t1.d) values (6,6,6,(select sum(t2.d) from t2)) where t2.c = 1;
select * from t1;
+------+------+------+------+
| A    | B    | C    | D    |
+------+------+------+------+
|    1 |    1 |    1 |    1 |
|    2 |    2 |    2 |    2 |
|    3 |    1 |    3 |    3 |
|    4 |    1 |    4 |    4 |
|    5 |    1 |    5 |    5 |
|    6 |    1 |    6 |    6 |
+------+------+------+------+

explain basic merge into t1 using t2 on (t1.a = t2.a) when matched then update set t1.b = (select sum(b) from t2 where t2.d = t1.d) where t1.c = 2 when not matched then insert (t1.a,t1.b,t1.c,t1.d) values (6,6,6,(select sum(t2.d) from t2)) where t2.c = 1;
Query Plan
=================================
|ID|OPERATOR               |NAME|
---------------------------------
|0 |MERGE                  |    |
|1 |└─SUBPLAN FILTER       |    |
|2 |  ├─SUBPLAN FILTER     |    |
|3 |  │ ├─HASH OUTER JOIN  |    |
|4 |  │ │ ├─TABLE FULL SCAN|T2  |
|5 |  │ │ └─TABLE FULL SCAN|T1  |
|6 |  │ └─SCALAR GROUP BY  |    |
|7 |  │   └─TABLE FULL SCAN|T2  |
|8 |  └─SCALAR GROUP BY    |    |
|9 |    └─TABLE FULL SCAN  |T2  |
=================================
Outputs & filters:
-------------------------------------
  0 - output(nil), filter(nil)
      columns([{T1: ({T1: (T1.__pk_increment, T1.A, T1.B, T1.C, T1.D)})}]), partitions(p0), 
      column_values([T_HIDDEN_PK], [column_conv(NUMBER,PS:(-1,0),NULL,6)], [column_conv(NUMBER,PS:(-1,0),NULL,6)], [column_conv(NUMBER,PS:(-1,0),NULL,6)],
       [column_conv(NUMBER,PS:(-1,0),NULL,CASE WHEN T2.C = 1 THEN :1 ELSE NULL END)]),
      update([T1.B=CASE WHEN T1.__pk_increment IS NOT NULL AND T1.C = 2 THEN column_conv(NUMBER,PS:(-1,0),NULL,subquery(1)) ELSE cast(NULL, NUMBER(-1, 0)) 
      END]), 
      insert_conds([T2.C = 1]), update_conds([T1.C = 2]), delete_conds(nil)
  1 - output([T1.__pk_increment], [T1.A], [T1.B], [T1.C], [T1.D], [T2.C = 1], [:1], [subquery(1)]), filter(nil), rowset=16
      exec_params_(nil), onetime_exprs_([subquery(1)(:1)]), init_plan_idxs_(nil), use_batch=false
  2 - output([T1.__pk_increment], [T1.A], [T1.B], [T1.C], [T1.D], [subquery(1)], [T2.C]), filter(nil), rowset=16
      exec_params_([T1.D(:0)]), onetime_exprs_(nil), init_plan_idxs_(nil), use_batch=false
  3 - output([T1.__pk_increment], [T1.A], [T1.B], [T1.C], [T1.D], [T2.C]), filter(nil), rowset=16
      equal_conds([T1.A = T2.A]), other_conds(nil)
  4 - output([T2.A], [T2.C]), filter(nil), rowset=16
      access([T2.A], [T2.C]), partitions(p0)
      is_index_back=false, is_global_index=false, 
      range_key([T2.__pk_increment]), range(MIN ; MAX)always true
  5 - output([T1.__pk_increment], [T1.A], [T1.B], [T1.C], [T1.D]), filter(nil), rowset=16
      access([T1.__pk_increment], [T1.A], [T1.B], [T1.C], [T1.D]), partitions(p0)
      is_index_back=false, is_global_index=false, 
      range_key([T1.__pk_increment]), range(MIN ; MAX)always true
  6 - output([T_FUN_SUM(T_FUN_SUM(T2.B))]), filter(nil), rowset=16
      group(nil), agg_func([T_FUN_SUM(T_FUN_SUM(T2.B))])
  7 - output([T_FUN_SUM(T2.B)]), filter([T2.D = :0]), rowset=16
      access([T2.D], [T2.B]), partitions(p0)
      is_index_back=false, is_global_index=false, filter_before_indexback[false], 
      range_key([T2.__pk_increment]), range(MIN ; MAX)always true, 
      pushdown_aggregation([T_FUN_SUM(T2.B)])
  8 - output([T_FUN_SUM(T_FUN_SUM(T2.D))]), filter(nil), rowset=16
      group(nil), agg_func([T_FUN_SUM(T_FUN_SUM(T2.D))])
  9 - output([T_FUN_SUM(T2.D)]), filter(nil), rowset=16
      access([T2.D]), partitions(p0)
      is_index_back=false, is_global_index=false, 
      range_key([T2.__pk_increment]), range(MIN ; MAX)always true, 
      pushdown_aggregation([T_FUN_SUM(T2.D)])
merge into t1 using t2 on (t1.a = t2.a) when matched then update set t1.b = (select sum(b) from t2 where t2.d = t1.d) where t1.c = 2 when not matched then insert (t1.a,t1.b,t1.c,t1.d) values (6,6,6,(select sum(t2.d) from t2)) where t2.c = 1;
select * from t1;
+------+------+------+------+
| A    | B    | C    | D    |
+------+------+------+------+
|    1 |    1 |    1 |    1 |
|    2 |    2 |    2 |    2 |
|    3 |    1 |    3 |    3 |
|    4 |    1 |    4 |    4 |
|    5 |    1 |    5 |    5 |
|    6 |    1 |    6 |    6 |
+------+------+------+------+

###test subquery in delete condition
explain basic merge into t1 using t2 on (t1.a = t2.a) when matched then update set t1.b = 1 where t1.c = 1 delete where exists(select 1 from t2 where t1.d = t2.d);
Query Plan
===============================
|ID|OPERATOR             |NAME|
-------------------------------
|0 |MERGE                |    |
|1 |└─SUBPLAN FILTER     |    |
|2 |  ├─HASH JOIN        |    |
|3 |  │ ├─TABLE FULL SCAN|T1  |
|4 |  │ └─TABLE FULL SCAN|T2  |
|5 |  └─TABLE FULL SCAN  |T2  |
===============================
Outputs & filters:
-------------------------------------
  0 - output(nil), filter(nil)
      columns([{T1: ({T1: (T1.__pk_increment, T1.A, T1.B, T1.C, T1.D)})}]),
      update([T1.B=column_conv(NUMBER,PS:(-1,0),NULL,1)]), 
      insert_conds(nil), update_conds(nil), delete_conds([T1.__pk_increment IS NOT NULL AND (T_OP_EXISTS, subquery(1))])
  1 - output([T1.__pk_increment], [T1.A], [T1.B], [T1.C], [T1.D], [(T_OP_EXISTS, subquery(1))]), filter(nil), rowset=16
      exec_params_([T1.D(:0)]), onetime_exprs_(nil), init_plan_idxs_(nil), use_batch=false
  2 - output([T1.__pk_increment], [T1.A], [T1.B], [T1.C], [T1.D]), filter(nil), rowset=16
      equal_conds([T1.A = T2.A]), other_conds(nil)
  3 - output([T1.__pk_increment], [T1.A], [T1.B], [T1.C], [T1.D]), filter([T1.C = 1]), rowset=16
      access([T1.__pk_increment], [T1.A], [T1.B], [T1.C], [T1.D]), partitions(p0)
      is_index_back=false, is_global_index=false, filter_before_indexback[false], 
      range_key([T1.__pk_increment]), range(MIN ; MAX)always true
  4 - output([T2.A]), filter(nil), rowset=16
      access([T2.A]), partitions(p0)
      is_index_back=false, is_global_index=false, 
      range_key([T2.__pk_increment]), range(MIN ; MAX)always true
  5 - output([1]), filter([:0 = T2.D]), rowset=16
      access([T2.D]), partitions(p0)
      limit(1), offset(nil), is_index_back=false, is_global_index=false, filter_before_indexback[false], 
      range_key([T2.__pk_increment]), range(MIN ; MAX)always true
merge into t1 using t2 on (t1.a = t2.a) when matched then update set t1.b = 1 where t1.c = 1 delete where exists(select 1 from t2 where t1.d = t2.d);
select * from t1;
+------+------+------+------+
| A    | B    | C    | D    |
+------+------+------+------+
|    1 |    1 |    1 |    1 |
|    2 |    2 |    2 |    2 |
|    3 |    1 |    3 |    3 |
|    4 |    1 |    4 |    4 |
|    5 |    1 |    5 |    5 |
|    6 |    1 |    6 |    6 |
+------+------+------+------+

explain basic merge into t1 using t2 on (t1.a = t2.a) when matched then update set t1.b = 1 where t1.c = 1 delete where exists(select 1 from t2 where t1.b = t2.b);
Query Plan
===============================
|ID|OPERATOR             |NAME|
-------------------------------
|0 |MERGE                |    |
|1 |└─SUBPLAN FILTER     |    |
|2 |  ├─HASH JOIN        |    |
|3 |  │ ├─TABLE FULL SCAN|T1  |
|4 |  │ └─TABLE FULL SCAN|T2  |
|5 |  └─TABLE FULL SCAN  |T2  |
===============================
Outputs & filters:
-------------------------------------
  0 - output(nil), filter(nil)
      columns([{T1: ({T1: (T1.__pk_increment, T1.A, T1.B, T1.C, T1.D)})}]),
      update([T1.B=column_conv(NUMBER,PS:(-1,0),NULL,1)]), 
      insert_conds(nil), update_conds(nil), delete_conds([T1.__pk_increment IS NOT NULL AND :0])
  1 - output([T1.__pk_increment], [T1.A], [T1.B], [T1.C], [T1.D], [:0]), filter(nil), rowset=16
      exec_params_(nil), onetime_exprs_([(T_OP_EXISTS, subquery(1))(:0)]), init_plan_idxs_(nil), use_batch=false
  2 - output([T1.__pk_increment], [T1.A], [T1.B], [T1.C], [T1.D]), filter(nil), rowset=16
      equal_conds([T1.A = T2.A]), other_conds(nil)
  3 - output([T1.__pk_increment], [T1.A], [T1.B], [T1.C], [T1.D]), filter([T1.C = 1]), rowset=16
      access([T1.__pk_increment], [T1.A], [T1.B], [T1.C], [T1.D]), partitions(p0)
      is_index_back=false, is_global_index=false, filter_before_indexback[false], 
      range_key([T1.__pk_increment]), range(MIN ; MAX)always true
  4 - output([T2.A]), filter(nil), rowset=16
      access([T2.A]), partitions(p0)
      is_index_back=false, is_global_index=false, 
      range_key([T2.__pk_increment]), range(MIN ; MAX)always true
  5 - output([1]), filter([column_conv(NUMBER,PS:(-1,0),NULL,1) = T2.B]), rowset=16
      access([T2.B]), partitions(p0)
      limit(1), offset(nil), is_index_back=false, is_global_index=false, filter_before_indexback[false], 
      range_key([T2.__pk_increment]), range(MIN ; MAX)always true
merge into t1 using t2 on (t1.a = t2.a) when matched then update set t1.b = 1 where t1.c = 1 delete where exists(select 1 from t2 where t1.b = t2.b);
select * from t1;
+------+------+------+------+
| A    | B    | C    | D    |
+------+------+------+------+
|    1 |    1 |    1 |    1 |
|    2 |    2 |    2 |    2 |
|    3 |    1 |    3 |    3 |
|    4 |    1 |    4 |    4 |
|    5 |    1 |    5 |    5 |
|    6 |    1 |    6 |    6 |
+------+------+------+------+

explain basic merge into t1 using t2 on (t1.a = t2.a) when matched then update set t1.b = t1.b+1 where t1.c = 1 delete where exists(select 1 from t2 where t1.b = t2.b);
Query Plan
===============================
|ID|OPERATOR             |NAME|
-------------------------------
|0 |MERGE                |    |
|1 |└─SUBPLAN FILTER     |    |
|2 |  ├─HASH JOIN        |    |
|3 |  │ ├─TABLE FULL SCAN|T1  |
|4 |  │ └─TABLE FULL SCAN|T2  |
|5 |  └─TABLE FULL SCAN  |T2  |
===============================
Outputs & filters:
-------------------------------------
  0 - output(nil), filter(nil)
      columns([{T1: ({T1: (T1.__pk_increment, T1.A, T1.B, T1.C, T1.D)})}]),
      update([T1.B=column_conv(NUMBER,PS:(-1,0),NULL,T1.B + 1)]), 
      insert_conds(nil), update_conds(nil), delete_conds([T1.__pk_increment IS NOT NULL AND (T_OP_EXISTS, subquery(1))])
  1 - output([T1.__pk_increment], [T1.A], [T1.B], [T1.C], [T1.D], [column_conv(NUMBER,PS:(-1,0),NULL,T1.B + 1)], [(T_OP_EXISTS, subquery(1))]), filter(nil), rowset=16
      exec_params_([column_conv(NUMBER,PS:(-1,0),NULL,T1.B + 1)(:0)]), onetime_exprs_(nil), init_plan_idxs_(nil), use_batch=false
  2 - output([T1.__pk_increment], [T1.A], [T1.B], [T1.C], [T1.D]), filter(nil), rowset=16
      equal_conds([T1.A = T2.A]), other_conds(nil)
  3 - output([T1.__pk_increment], [T1.A], [T1.B], [T1.C], [T1.D]), filter([T1.C = 1]), rowset=16
      access([T1.__pk_increment], [T1.A], [T1.B], [T1.C], [T1.D]), partitions(p0)
      is_index_back=false, is_global_index=false, filter_before_indexback[false], 
      range_key([T1.__pk_increment]), range(MIN ; MAX)always true
  4 - output([T2.A]), filter(nil), rowset=16
      access([T2.A]), partitions(p0)
      is_index_back=false, is_global_index=false, 
      range_key([T2.__pk_increment]), range(MIN ; MAX)always true
  5 - output([1]), filter([:0 = T2.B]), rowset=16
      access([T2.B]), partitions(p0)
      limit(1), offset(nil), is_index_back=false, is_global_index=false, filter_before_indexback[false], 
      range_key([T2.__pk_increment]), range(MIN ; MAX)always true
merge into t1 using t2 on (t1.a = t2.a) when matched then update set t1.b = t1.b+1 where t1.c = 1 delete where exists(select 1 from t2 where t1.b = t2.b);
select * from t1;
+------+------+------+------+
| A    | B    | C    | D    |
+------+------+------+------+
|    1 |    1 |    1 |    1 |
|    2 |    2 |    2 |    2 |
|    3 |    1 |    3 |    3 |
|    4 |    1 |    4 |    4 |
|    5 |    1 |    5 |    5 |
|    6 |    1 |    6 |    6 |
+------+------+------+------+

## test subquery in all places
explain basic merge into t1 using t2 on (t1.a = t2.a) when matched then update set t1.c = (select sum(b) from t2 where t1.b = t2.b) where exists(select 1 from t2 where t2.b = t1.b);
Query Plan
==================================
|ID|OPERATOR               |NAME |
----------------------------------
|0 |MERGE                  |     |
|1 |└─SUBPLAN FILTER       |     |
|2 |  ├─HASH SEMI JOIN     |     |
|3 |  │ ├─HASH JOIN        |     |
|4 |  │ │ ├─TABLE FULL SCAN|T2   |
|5 |  │ │ └─TABLE FULL SCAN|T1   |
|6 |  │ └─SUBPLAN SCAN     |VIEW1|
|7 |  │   └─TABLE FULL SCAN|T2   |
|8 |  └─SCALAR GROUP BY    |     |
|9 |    └─TABLE FULL SCAN  |T2   |
==================================
Outputs & filters:
-------------------------------------
  0 - output(nil), filter(nil)
      columns([{T1: ({T1: (T1.__pk_increment, T1.A, T1.B, T1.C, T1.D)})}]),
      update([T1.C=CASE WHEN T1.__pk_increment IS NOT NULL THEN column_conv(NUMBER,PS:(-1,0),NULL,subquery(1)) ELSE cast(NULL, NUMBER(-1, 0)) END]), 
      insert_conds(nil), update_conds(nil), delete_conds(nil)
  1 - output([T1.__pk_increment], [T1.A], [T1.B], [T1.C], [T1.D], [subquery(1)], [T1.__pk_increment IS NOT NULL]), filter(nil), rowset=16
      exec_params_([T1.B(:0)]), onetime_exprs_(nil), init_plan_idxs_(nil), use_batch=false
  2 - output([T1.__pk_increment], [T1.A], [T1.B], [T1.C], [T1.D], [T1.__pk_increment IS NOT NULL]), filter(nil), rowset=16
      equal_conds([VIEW1.T2.B = T1.B]), other_conds(nil)
  3 - output([T1.__pk_increment], [T1.A], [T1.B], [T1.C], [T1.D], [T1.__pk_increment IS NOT NULL]), filter(nil), rowset=16
      equal_conds([T1.A = T2.A]), other_conds(nil)
  4 - output([T2.A]), filter(nil), rowset=16
      access([T2.A]), partitions(p0)
      is_index_back=false, is_global_index=false, 
      range_key([T2.__pk_increment]), range(MIN ; MAX)always true
  5 - output([T1.__pk_increment], [T1.A], [T1.B], [T1.C], [T1.D], [T1.__pk_increment IS NOT NULL]), filter([T1.__pk_increment IS NOT NULL]), rowset=16
      access([T1.__pk_increment], [T1.A], [T1.B], [T1.C], [T1.D]), partitions(p0)
      is_index_back=false, is_global_index=false, filter_before_indexback[false], 
      range_key([T1.__pk_increment]), range(MIN ; MAX)always true
  6 - output([VIEW1.T2.B]), filter(nil), rowset=16
      access([VIEW1.T2.B])
  7 - output([T2.B]), filter(nil), rowset=16
      access([T2.B]), partitions(p0)
      is_index_back=false, is_global_index=false, 
      range_key([T2.__pk_increment]), range(MIN ; MAX)always true
  8 - output([T_FUN_SUM(T_FUN_SUM(T2.B))]), filter(nil), rowset=16
      group(nil), agg_func([T_FUN_SUM(T_FUN_SUM(T2.B))])
  9 - output([T_FUN_SUM(T2.B)]), filter([:0 = T2.B]), rowset=16
      access([T2.B]), partitions(p0)
      is_index_back=false, is_global_index=false, filter_before_indexback[false], 
      range_key([T2.__pk_increment]), range(MIN ; MAX)always true, 
      pushdown_aggregation([T_FUN_SUM(T2.B)])
merge into t1 using t2 on (t1.a = t2.a) when matched then update set t1.c = (select sum(b) from t2 where t1.b = t2.b) where exists(select 1 from t2 where t2.b = t1.b);
select * from t1;
+------+------+------+------+
| A    | B    | C    | D    |
+------+------+------+------+
|    1 |    1 |    1 |    1 |
|    2 |    2 |    2 |    2 |
|    3 |    1 |    3 |    3 |
|    4 |    1 |    4 |    4 |
|    5 |    1 |    5 |    5 |
|    6 |    1 |    6 |    6 |
+------+------+------+------+

explain basic merge into t1 using t2 on (t1.a = t2.a) when matched then update set t1.c = (select sum(b) from t2) where exists(select 1 from t2);
Query Plan
=================================
|ID|OPERATOR               |NAME|
---------------------------------
|0 |MERGE                  |    |
|1 |└─SUBPLAN FILTER       |    |
|2 |  ├─SUBPLAN FILTER     |    |
|3 |  │ ├─HASH JOIN        |    |
|4 |  │ │ ├─TABLE FULL SCAN|T2  |
|5 |  │ │ └─TABLE FULL SCAN|T1  |
|6 |  │ └─TABLE FULL SCAN  |T2  |
|7 |  └─SCALAR GROUP BY    |    |
|8 |    └─TABLE FULL SCAN  |T2  |
=================================
Outputs & filters:
-------------------------------------
  0 - output(nil), filter(nil)
      columns([{T1: ({T1: (T1.__pk_increment, T1.A, T1.B, T1.C, T1.D)})}]),
      update([T1.C=CASE WHEN T1.__pk_increment IS NOT NULL THEN column_conv(NUMBER,PS:(-1,0),NULL,:1) ELSE cast(NULL, NUMBER(-1, 0)) END]), 
      insert_conds(nil), update_conds(nil), delete_conds(nil)
  1 - output([T1.__pk_increment], [T1.A], [T1.B], [T1.C], [T1.D], [:1], [T1.__pk_increment IS NOT NULL]), filter(nil), rowset=16
      exec_params_(nil), onetime_exprs_([subquery(1)(:1)]), init_plan_idxs_(nil), use_batch=false
  2 - output([T1.__pk_increment], [T1.A], [T1.B], [T1.C], [T1.D], [T1.__pk_increment IS NOT NULL]), filter(nil), rowset=16
      exec_params_(nil), onetime_exprs_([(T_OP_EXISTS, subquery(1))(:0)]), init_plan_idxs_(nil), use_batch=false
  3 - output([T1.__pk_increment], [T1.A], [T1.B], [T1.C], [T1.D], [T1.__pk_increment IS NOT NULL]), filter(nil), startup_filter([:0]), rowset=16
      equal_conds([T1.A = T2.A]), other_conds(nil)
  4 - output([T2.A]), filter(nil), rowset=16
      access([T2.A]), partitions(p0)
      is_index_back=false, is_global_index=false, 
      range_key([T2.__pk_increment]), range(MIN ; MAX)always true
  5 - output([T1.__pk_increment], [T1.A], [T1.B], [T1.C], [T1.D], [T1.__pk_increment IS NOT NULL]), filter([T1.__pk_increment IS NOT NULL]), rowset=16
      access([T1.__pk_increment], [T1.A], [T1.B], [T1.C], [T1.D]), partitions(p0)
      is_index_back=false, is_global_index=false, filter_before_indexback[false], 
      range_key([T1.__pk_increment]), range(MIN ; MAX)always true
  6 - output([1]), filter(nil), rowset=16
      access(nil), partitions(p0)
      limit(1), offset(nil), is_index_back=false, is_global_index=false, 
      range_key([T2.__pk_increment]), range(MIN ; MAX)always true
  7 - output([T_FUN_SUM(T_FUN_SUM(T2.B))]), filter(nil), rowset=16
      group(nil), agg_func([T_FUN_SUM(T_FUN_SUM(T2.B))])
  8 - output([T_FUN_SUM(T2.B)]), filter(nil), rowset=16
      access([T2.B]), partitions(p0)
      is_index_back=false, is_global_index=false, 
      range_key([T2.__pk_increment]), range(MIN ; MAX)always true, 
      pushdown_aggregation([T_FUN_SUM(T2.B)])
merge into t1 using t2 on (t1.a = t2.a) when matched then update set t1.c = (select sum(b) from t2) where exists(select 1 from t2);
select * from t1;
+------+------+------+------+
| A    | B    | C    | D    |
+------+------+------+------+
|    1 |    1 |    1 |    1 |
|    2 |    2 |   20 |    2 |
|    3 |    1 |   20 |    3 |
|    4 |    1 |   20 |    4 |
|    5 |    1 |   20 |    5 |
|    6 |    1 |   20 |    6 |
+------+------+------+------+

explain basic merge into t1 using t2 on (t1.a = t2.a) when matched then update set t1.c = (select sum(b) from t2 where t1.b = t2.b) where exists(select 1 from t2 where t2.b = t1.b) delete where exists(select 1 from t2 where t2.b = t1.b);
Query Plan
====================================
|ID|OPERATOR                 |NAME |
------------------------------------
|0 |MERGE                    |     |
|1 |└─SUBPLAN FILTER         |     |
|2 |  ├─SUBPLAN FILTER       |     |
|3 |  │ ├─HASH SEMI JOIN     |     |
|4 |  │ │ ├─HASH JOIN        |     |
|5 |  │ │ │ ├─TABLE FULL SCAN|T2   |
|6 |  │ │ │ └─TABLE FULL SCAN|T1   |
|7 |  │ │ └─SUBPLAN SCAN     |VIEW1|
|8 |  │ │   └─TABLE FULL SCAN|T2   |
|9 |  │ └─SCALAR GROUP BY    |     |
|10|  │   └─TABLE FULL SCAN  |T2   |
|11|  └─TABLE FULL SCAN      |T2   |
====================================
Outputs & filters:
-------------------------------------
  0 - output(nil), filter(nil)
      columns([{T1: ({T1: (T1.__pk_increment, T1.A, T1.B, T1.C, T1.D)})}]),
      update([T1.C=CASE WHEN T1.__pk_increment IS NOT NULL THEN column_conv(NUMBER,PS:(-1,0),NULL,subquery(1)) ELSE cast(NULL, NUMBER(-1, 0)) END]), 
      insert_conds(nil), update_conds(nil), delete_conds([T1.__pk_increment IS NOT NULL AND (T_OP_EXISTS, subquery(1))])
  1 - output([T1.__pk_increment], [T1.A], [T1.B], [T1.C], [T1.D], [T1.__pk_increment IS NOT NULL], [(T_OP_EXISTS, subquery(1))], [subquery(1)]), filter(nil), rowset=16
      exec_params_([T1.B(:1)]), onetime_exprs_(nil), init_plan_idxs_(nil), use_batch=false
  2 - output([T1.__pk_increment], [T1.A], [T1.B], [T1.C], [T1.D], [T1.__pk_increment IS NOT NULL], [subquery(1)]), filter(nil), rowset=16
      exec_params_([T1.B(:0)]), onetime_exprs_(nil), init_plan_idxs_(nil), use_batch=false
  3 - output([T1.__pk_increment], [T1.A], [T1.B], [T1.C], [T1.D], [T1.__pk_increment IS NOT NULL]), filter(nil), rowset=16
      equal_conds([VIEW1.T2.B = T1.B]), other_conds(nil)
  4 - output([T1.__pk_increment], [T1.A], [T1.B], [T1.C], [T1.D], [T1.__pk_increment IS NOT NULL]), filter(nil), rowset=16
      equal_conds([T1.A = T2.A]), other_conds(nil)
  5 - output([T2.A]), filter(nil), rowset=16
      access([T2.A]), partitions(p0)
      is_index_back=false, is_global_index=false, 
      range_key([T2.__pk_increment]), range(MIN ; MAX)always true
  6 - output([T1.__pk_increment], [T1.A], [T1.B], [T1.C], [T1.D], [T1.__pk_increment IS NOT NULL]), filter([T1.__pk_increment IS NOT NULL]), rowset=16
      access([T1.__pk_increment], [T1.A], [T1.B], [T1.C], [T1.D]), partitions(p0)
      is_index_back=false, is_global_index=false, filter_before_indexback[false], 
      range_key([T1.__pk_increment]), range(MIN ; MAX)always true
  7 - output([VIEW1.T2.B]), filter(nil), rowset=16
      access([VIEW1.T2.B])
  8 - output([T2.B]), filter(nil), rowset=16
      access([T2.B]), partitions(p0)
      is_index_back=false, is_global_index=false, 
      range_key([T2.__pk_increment]), range(MIN ; MAX)always true
  9 - output([T_FUN_SUM(T_FUN_SUM(T2.B))]), filter(nil), rowset=16
      group(nil), agg_func([T_FUN_SUM(T_FUN_SUM(T2.B))])
 10 - output([T_FUN_SUM(T2.B)]), filter([:0 = T2.B]), rowset=16
      access([T2.B]), partitions(p0)
      is_index_back=false, is_global_index=false, filter_before_indexback[false], 
      range_key([T2.__pk_increment]), range(MIN ; MAX)always true, 
      pushdown_aggregation([T_FUN_SUM(T2.B)])
 11 - output([1]), filter([T2.B = :1]), rowset=16
      access([T2.B]), partitions(p0)
      limit(1), offset(nil), is_index_back=false, is_global_index=false, filter_before_indexback[false], 
      range_key([T2.__pk_increment]), range(MIN ; MAX)always true
merge into t1 using t2 on (t1.a = t2.a) when matched then update set t1.c = (select sum(b) from t2 where t1.b = t2.b) where exists(select 1 from t2 where t2.b = t1.b) delete where exists(select 1 from t2 where t2.b = t1.b);
select * from t1;
+------+------+------+------+
| A    | B    | C    | D    |
+------+------+------+------+
|    1 |    1 |    1 |    1 |
|    3 |    1 |   20 |    3 |
|    4 |    1 |   20 |    4 |
|    5 |    1 |   20 |    5 |
|    6 |    1 |   20 |    6 |
+------+------+------+------+

explain basic merge into t1 using t2 on (t1.a = t2.a) when matched then update set t1.c = (select sum(b) from t2) where exists(select 1 from t2) delete where exists(select 1 from t2);
Query Plan
===================================
|ID|OPERATOR                 |NAME|
-----------------------------------
|0 |MERGE                    |    |
|1 |└─SUBPLAN FILTER         |    |
|2 |  ├─SUBPLAN FILTER       |    |
|3 |  │ ├─SUBPLAN FILTER     |    |
|4 |  │ │ ├─HASH JOIN        |    |
|5 |  │ │ │ ├─TABLE FULL SCAN|T2  |
|6 |  │ │ │ └─TABLE FULL SCAN|T1  |
|7 |  │ │ └─TABLE FULL SCAN  |T2  |
|8 |  │ └─SCALAR GROUP BY    |    |
|9 |  │   └─TABLE FULL SCAN  |T2  |
|10|  └─TABLE FULL SCAN      |T2  |
===================================
Outputs & filters:
-------------------------------------
  0 - output(nil), filter(nil)
      columns([{T1: ({T1: (T1.__pk_increment, T1.A, T1.B, T1.C, T1.D)})}]),
      update([T1.C=CASE WHEN T1.__pk_increment IS NOT NULL THEN column_conv(NUMBER,PS:(-1,0),NULL,:1) ELSE cast(NULL, NUMBER(-1, 0)) END]), 
      insert_conds(nil), update_conds(nil), delete_conds([T1.__pk_increment IS NOT NULL AND :2])
  1 - output([T1.__pk_increment], [T1.A], [T1.B], [T1.C], [T1.D], [T1.__pk_increment IS NOT NULL], [:2], [:1]), filter(nil), rowset=16
      exec_params_(nil), onetime_exprs_([(T_OP_EXISTS, subquery(1))(:2)]), init_plan_idxs_(nil), use_batch=false
  2 - output([T1.__pk_increment], [T1.A], [T1.B], [T1.C], [T1.D], [T1.__pk_increment IS NOT NULL], [:1]), filter(nil), rowset=16
      exec_params_(nil), onetime_exprs_([subquery(1)(:1)]), init_plan_idxs_(nil), use_batch=false
  3 - output([T1.__pk_increment], [T1.A], [T1.B], [T1.C], [T1.D], [T1.__pk_increment IS NOT NULL]), filter(nil), rowset=16
      exec_params_(nil), onetime_exprs_([(T_OP_EXISTS, subquery(1))(:0)]), init_plan_idxs_(nil), use_batch=false
  4 - output([T1.__pk_increment], [T1.A], [T1.B], [T1.C], [T1.D], [T1.__pk_increment IS NOT NULL]), filter(nil), startup_filter([:0]), rowset=16
      equal_conds([T1.A = T2.A]), other_conds(nil)
  5 - output([T2.A]), filter(nil), rowset=16
      access([T2.A]), partitions(p0)
      is_index_back=false, is_global_index=false, 
      range_key([T2.__pk_increment]), range(MIN ; MAX)always true
  6 - output([T1.__pk_increment], [T1.A], [T1.B], [T1.C], [T1.D], [T1.__pk_increment IS NOT NULL]), filter([T1.__pk_increment IS NOT NULL]), rowset=16
      access([T1.__pk_increment], [T1.A], [T1.B], [T1.C], [T1.D]), partitions(p0)
      is_index_back=false, is_global_index=false, filter_before_indexback[false], 
      range_key([T1.__pk_increment]), range(MIN ; MAX)always true
  7 - output([1]), filter(nil), rowset=16
      access(nil), partitions(p0)
      limit(1), offset(nil), is_index_back=false, is_global_index=false, 
      range_key([T2.__pk_increment]), range(MIN ; MAX)always true
  8 - output([T_FUN_SUM(T_FUN_SUM(T2.B))]), filter(nil), rowset=16
      group(nil), agg_func([T_FUN_SUM(T_FUN_SUM(T2.B))])
  9 - output([T_FUN_SUM(T2.B)]), filter(nil), rowset=16
      access([T2.B]), partitions(p0)
      is_index_back=false, is_global_index=false, 
      range_key([T2.__pk_increment]), range(MIN ; MAX)always true, 
      pushdown_aggregation([T_FUN_SUM(T2.B)])
 10 - output([1]), filter(nil), rowset=16
      access(nil), partitions(p0)
      limit(1), offset(nil), is_index_back=false, is_global_index=false, 
      range_key([T2.__pk_increment]), range(MIN ; MAX)always true
merge into t1 using t2 on (t1.a = t2.a) when matched then update set t1.c = (select sum(b) from t2) where exists(select 1 from t2) delete where exists(select 1 from t2);
select * from t1;
+------+------+------+------+
| A    | B    | C    | D    |
+------+------+------+------+
|    1 |    1 |    1 |    1 |
+------+------+------+------+

explain basic merge into t1 using t2 on (t1.a = t2.a) when matched then update set t1.c = (select sum(b) from t2 where t2.b = t1.b) delete where exists(select 1 from t2 where t1.b = t2.b) when not matched then insert (t1.a,t1.b,t1.c,t1.d) values (7,7,7,(select sum(b) from t2));
Query Plan
========================================
|ID|OPERATOR                      |NAME|
----------------------------------------
|0 |MERGE                         |    |
|1 |└─SUBPLAN FILTER              |    |
|2 |  ├─SUBPLAN FILTER            |    |
|3 |  │ ├─SUBPLAN FILTER          |    |
|4 |  │ │ ├─HASH RIGHT OUTER JOIN |    |
|5 |  │ │ │ ├─TABLE FULL SCAN     |T1  |
|6 |  │ │ │ └─TABLE FULL SCAN     |T2  |
|7 |  │ │ └─SCALAR GROUP BY       |    |
|8 |  │ │   └─TABLE FULL SCAN     |T2  |
|9 |  │ └─SCALAR GROUP BY         |    |
|10|  │   └─TABLE FULL SCAN       |T2  |
|11|  └─TABLE FULL SCAN           |T2  |
========================================
Outputs & filters:
-------------------------------------
  0 - output(nil), filter(nil)
      columns([{T1: ({T1: (T1.__pk_increment, T1.A, T1.B, T1.C, T1.D)})}]), partitions(p0), 
      column_values([T_HIDDEN_PK], [column_conv(NUMBER,PS:(-1,0),NULL,7)], [column_conv(NUMBER,PS:(-1,0),NULL,7)], [column_conv(NUMBER,PS:(-1,0),NULL,7)],
       [column_conv(NUMBER,PS:(-1,0),NULL,CASE WHEN T1.__pk_increment IS NULL THEN :2 ELSE NULL END)]),
      update([T1.C=CASE WHEN T1.__pk_increment IS NOT NULL THEN column_conv(NUMBER,PS:(-1,0),NULL,subquery(1)) ELSE cast(NULL, NUMBER(-1, 0)) END]), 
      insert_conds(nil), update_conds(nil), delete_conds([T1.__pk_increment IS NOT NULL AND (T_OP_EXISTS, subquery(1))])
  1 - output([T1.__pk_increment], [T1.A], [T1.B], [T1.C], [T1.D], [(T_OP_EXISTS, subquery(1))], [:2], [subquery(1)]), filter(nil), rowset=16
      exec_params_([T1.B(:1)]), onetime_exprs_(nil), init_plan_idxs_(nil), use_batch=false
  2 - output([T1.__pk_increment], [T1.A], [T1.B], [T1.C], [T1.D], [:2], [subquery(1)]), filter(nil), rowset=16
      exec_params_(nil), onetime_exprs_([subquery(1)(:2)]), init_plan_idxs_(nil), use_batch=false
  3 - output([T1.__pk_increment], [T1.A], [T1.B], [T1.C], [T1.D], [subquery(1)]), filter(nil), rowset=16
      exec_params_([T1.B(:0)]), onetime_exprs_(nil), init_plan_idxs_(nil), use_batch=false
  4 - output([T1.__pk_increment], [T1.A], [T1.B], [T1.C], [T1.D]), filter(nil), rowset=16
      equal_conds([T1.A = T2.A]), other_conds(nil)
  5 - output([T1.__pk_increment], [T1.A], [T1.B], [T1.C], [T1.D]), filter(nil), rowset=16
      access([T1.__pk_increment], [T1.A], [T1.B], [T1.C], [T1.D]), partitions(p0)
      is_index_back=false, is_global_index=false, 
      range_key([T1.__pk_increment]), range(MIN ; MAX)always true
  6 - output([T2.A]), filter(nil), rowset=16
      access([T2.A]), partitions(p0)
      is_index_back=false, is_global_index=false, 
      range_key([T2.__pk_increment]), range(MIN ; MAX)always true
  7 - output([T_FUN_SUM(T_FUN_SUM(T2.B))]), filter(nil), rowset=16
      group(nil), agg_func([T_FUN_SUM(T_FUN_SUM(T2.B))])
  8 - output([T_FUN_SUM(T2.B)]), filter([T2.B = :0]), rowset=16
      access([T2.B]), partitions(p0)
      is_index_back=false, is_global_index=false, filter_before_indexback[false], 
      range_key([T2.__pk_increment]), range(MIN ; MAX)always true, 
      pushdown_aggregation([T_FUN_SUM(T2.B)])
  9 - output([T_FUN_SUM(T_FUN_SUM(T2.B))]), filter(nil), rowset=16
      group(nil), agg_func([T_FUN_SUM(T_FUN_SUM(T2.B))])
 10 - output([T_FUN_SUM(T2.B)]), filter(nil), rowset=16
      access([T2.B]), partitions(p0)
      is_index_back=false, is_global_index=false, 
      range_key([T2.__pk_increment]), range(MIN ; MAX)always true, 
      pushdown_aggregation([T_FUN_SUM(T2.B)])
 11 - output([1]), filter([:1 = T2.B]), rowset=16
      access([T2.B]), partitions(p0)
      limit(1), offset(nil), is_index_back=false, is_global_index=false, filter_before_indexback[false], 
      range_key([T2.__pk_increment]), range(MIN ; MAX)always true
merge into t1 using t2 on (t1.a = t2.a) when matched then update set t1.c = (select sum(b) from t2 where t2.b = t1.b) delete where exists(select 1 from t2 where t1.b = t2.b) when not matched then insert (t1.a,t1.b,t1.c,t1.d) values (7,7,7,(select sum(b) from t2));
select * from t1;
+------+------+------+------+
| A    | B    | C    | D    |
+------+------+------+------+
|    1 |    1 |    1 |    1 |
|    7 |    7 |    7 |   20 |
|    7 |    7 |    7 |   20 |
|    7 |    7 |    7 |   20 |
|    7 |    7 |    7 |   20 |
|    7 |    7 |    7 |   20 |
+------+------+------+------+
###test partitioned table
##test subquery in update condition and insert condition
explain basic merge/*+use_px*/ into t1_part using t2_part on (t1_part.a = t2_part.a) when matched then update set t1_part.b = 1 where exists(select 1 from t2_part where t2_part.b = t1_part.b);
Query Plan
=======================================================
|ID|OPERATOR                                 |NAME    |
-------------------------------------------------------
|0 |DISTRIBUTED MERGE                        |        |
|1 |└─PX COORDINATOR                         |        |
|2 |  └─EXCHANGE OUT DISTR                   |:EX10002|
|3 |    └─HASH SEMI JOIN                     |        |
|4 |      ├─EXCHANGE IN DISTR                |        |
|5 |      │ └─EXCHANGE OUT DISTR (PKEY)      |:EX10001|
|6 |      │   └─HASH JOIN                    |        |
|7 |      │     ├─EXCHANGE IN DISTR          |        |
|8 |      │     │ └─EXCHANGE OUT DISTR (PKEY)|:EX10000|
|9 |      │     │   └─PX PARTITION ITERATOR  |        |
|10|      │     │     └─TABLE FULL SCAN      |T2_PART |
|11|      │     └─PX PARTITION ITERATOR      |        |
|12|      │       └─TABLE FULL SCAN          |T1_PART |
|13|      └─SUBPLAN SCAN                     |VIEW1   |
|14|        └─PX PARTITION ITERATOR          |        |
|15|          └─TABLE FULL SCAN              |T2_PART |
=======================================================
Outputs & filters:
-------------------------------------
  0 - output(nil), filter(nil)
      columns([{T1_PART: ({T1_PART: (T1_PART.__pk_increment, T1_PART.A, T1_PART.B, T1_PART.C, T1_PART.D)})}]),
      update([T1_PART.B=column_conv(NUMBER,PS:(-1,0),NULL,1)]), 
      insert_conds(nil), update_conds(nil), delete_conds(nil)
  1 - output([T1_PART.__pk_increment], [T1_PART.A], [T1_PART.B], [T1_PART.C], [T1_PART.D]), filter(nil), rowset=16
  2 - output([T1_PART.__pk_increment], [T1_PART.A], [T1_PART.B], [T1_PART.C], [T1_PART.D]), filter(nil), rowset=16
      dop=1
  3 - output([T1_PART.__pk_increment], [T1_PART.A], [T1_PART.B], [T1_PART.C], [T1_PART.D]), filter(nil), rowset=16
      equal_conds([VIEW1.T2_PART.B = T1_PART.B]), other_conds(nil)
  4 - output([T1_PART.__pk_increment], [T1_PART.A], [T1_PART.B], [T1_PART.C], [T1_PART.D]), filter(nil), rowset=16
  5 - output([T1_PART.__pk_increment], [T1_PART.A], [T1_PART.B], [T1_PART.C], [T1_PART.D]), filter(nil), rowset=16
      (#keys=1, [T1_PART.B]), dop=1
  6 - output([T1_PART.__pk_increment], [T1_PART.A], [T1_PART.B], [T1_PART.C], [T1_PART.D]), filter(nil), rowset=16
      equal_conds([T1_PART.A = T2_PART.A]), other_conds(nil)
  7 - output([T2_PART.A]), filter(nil), rowset=16
  8 - output([T2_PART.A]), filter(nil), rowset=16
      (#keys=1, [T2_PART.A]), dop=1
  9 - output([T2_PART.A]), filter(nil), rowset=16
      force partition granule
 10 - output([T2_PART.A]), filter(nil), rowset=16
      access([T2_PART.A]), partitions(p[0-3])
      is_index_back=false, is_global_index=false, 
      range_key([T2_PART.__pk_increment]), range(MIN ; MAX)always true
 11 - output([T1_PART.__pk_increment], [T1_PART.A], [T1_PART.B], [T1_PART.C], [T1_PART.D]), filter(nil), rowset=16
      affinitize, force partition granule
 12 - output([T1_PART.__pk_increment], [T1_PART.A], [T1_PART.B], [T1_PART.C], [T1_PART.D]), filter([T1_PART.__pk_increment IS NOT NULL]), rowset=16
      access([T1_PART.__pk_increment], [T1_PART.A], [T1_PART.B], [T1_PART.C], [T1_PART.D]), partitions(p[0-3])
      is_index_back=false, is_global_index=false, filter_before_indexback[false], 
      range_key([T1_PART.__pk_increment]), range(MIN ; MAX)always true
 13 - output([VIEW1.T2_PART.B]), filter(nil), rowset=16
      access([VIEW1.T2_PART.B])
 14 - output([T2_PART.B]), filter(nil), rowset=16
      affinitize, force partition granule
 15 - output([T2_PART.B]), filter(nil), rowset=16
      access([T2_PART.B]), partitions(p[0-3])
      is_index_back=false, is_global_index=false, 
      range_key([T2_PART.__pk_increment]), range(MIN ; MAX)always true
merge/*+use_px*/ into t1_part using t2_part on (t1_part.a = t2_part.a) when matched then update set t1_part.b = 1 where exists(select 1 from t2_part where t2_part.b = t1_part.b);
select * from t1_part;
+------+------+------+------+
| A    | B    | C    | D    |
+------+------+------+------+
|    1 |    1 |    1 |    1 |
|    2 |    1 |    2 |    2 |
|    3 |    1 |    3 |    3 |
|    4 |    1 |    4 |    4 |
|    5 |    1 |    5 |    5 |
+------+------+------+------+

explain basic merge/*+use_px*/ into t1_part using t2_part on (t1_part.a = t2_part.a) when not matched then insert (t1_part.a,t1_part.b,t1_part.c,t1_part.d) values (6,6,6,6) where 15 < (select sum(b) from t2_part);
Query Plan
===================================================
|ID|OPERATOR                             |NAME    |
---------------------------------------------------
|0 |DISTRIBUTED MERGE                    |        |
|1 |└─SUBPLAN FILTER                     |        |
|2 |  ├─PX COORDINATOR                   |        |
|3 |  │ └─EXCHANGE OUT DISTR             |:EX10001|
|4 |  │   └─HASH OUTER JOIN              |        |
|5 |  │     ├─EXCHANGE IN DISTR          |        |
|6 |  │     │ └─EXCHANGE OUT DISTR (PKEY)|:EX10000|
|7 |  │     │   └─PX PARTITION ITERATOR  |        |
|8 |  │     │     └─TABLE FULL SCAN      |T2_PART |
|9 |  │     └─PX PARTITION ITERATOR      |        |
|10|  │       └─TABLE FULL SCAN          |T1_PART |
|11|  └─SCALAR GROUP BY                  |        |
|12|    └─PX COORDINATOR                 |        |
|13|      └─EXCHANGE OUT DISTR           |:EX20000|
|14|        └─MERGE GROUP BY             |        |
|15|          └─PX PARTITION ITERATOR    |        |
|16|            └─TABLE FULL SCAN        |T2_PART |
===================================================
Outputs & filters:
-------------------------------------
  0 - output(nil), filter(nil)
      columns([{T1_PART: ({T1_PART: (T1_PART.__pk_increment, T1_PART.A, T1_PART.B, T1_PART.C, T1_PART.D)})}]), partitions(p3), 
      column_values([T_HIDDEN_PK], [column_conv(NUMBER,PS:(-1,0),NULL,6)], [column_conv(NUMBER,PS:(-1,0),NULL,6)], [column_conv(NUMBER,PS:(-1,0),NULL,6)],
       [column_conv(NUMBER,PS:(-1,0),NULL,6)]), 
      insert_conds([T1_PART.__pk_increment IS NULL AND 15 < :0]), update_conds(nil), delete_conds(nil)
  1 - output([T1_PART.__pk_increment], [T1_PART.A], [T1_PART.B], [T1_PART.C], [T1_PART.D], [:0]), filter(nil), rowset=16
      exec_params_(nil), onetime_exprs_([subquery(1)(:0)]), init_plan_idxs_(nil), use_batch=false
  2 - output([T1_PART.__pk_increment], [T1_PART.A], [T1_PART.B], [T1_PART.C], [T1_PART.D]), filter(nil), rowset=16
  3 - output([T1_PART.__pk_increment], [T1_PART.A], [T1_PART.B], [T1_PART.C], [T1_PART.D]), filter(nil), rowset=16
      dop=1
  4 - output([T1_PART.__pk_increment], [T1_PART.A], [T1_PART.B], [T1_PART.C], [T1_PART.D]), filter(nil), rowset=16
      equal_conds([T1_PART.A = T2_PART.A]), other_conds(nil)
  5 - output([T2_PART.A]), filter(nil), rowset=16
  6 - output([T2_PART.A]), filter(nil), rowset=16
      (#keys=1, [T2_PART.A]), dop=1
  7 - output([T2_PART.A]), filter(nil), rowset=16
      force partition granule
  8 - output([T2_PART.A]), filter(nil), rowset=16
      access([T2_PART.A]), partitions(p[0-3])
      is_index_back=false, is_global_index=false, 
      range_key([T2_PART.__pk_increment]), range(MIN ; MAX)always true
  9 - output([T1_PART.__pk_increment], [T1_PART.A], [T1_PART.B], [T1_PART.C], [T1_PART.D]), filter(nil), rowset=16
      affinitize, force partition granule
 10 - output([T1_PART.__pk_increment], [T1_PART.A], [T1_PART.B], [T1_PART.C], [T1_PART.D]), filter(nil), rowset=16
      access([T1_PART.__pk_increment], [T1_PART.A], [T1_PART.B], [T1_PART.C], [T1_PART.D]), partitions(p[0-3])
      is_index_back=false, is_global_index=false, 
      range_key([T1_PART.__pk_increment]), range(MIN ; MAX)always true
 11 - output([T_FUN_SUM(T_FUN_SUM(T_FUN_SUM(T2_PART.B)))]), filter(nil), rowset=16
      group(nil), agg_func([T_FUN_SUM(T_FUN_SUM(T_FUN_SUM(T2_PART.B)))])
 12 - output([T_FUN_SUM(T_FUN_SUM(T2_PART.B))]), filter(nil), rowset=16
 13 - output([T_FUN_SUM(T_FUN_SUM(T2_PART.B))]), filter(nil), rowset=16
      dop=1
 14 - output([T_FUN_SUM(T_FUN_SUM(T2_PART.B))]), filter(nil), rowset=16
      group(nil), agg_func([T_FUN_SUM(T_FUN_SUM(T2_PART.B))])
 15 - output([T_FUN_SUM(T2_PART.B)]), filter(nil), rowset=16
      force partition granule
 16 - output([T_FUN_SUM(T2_PART.B)]), filter(nil), rowset=16
      access([T2_PART.B]), partitions(p[0-3])
      is_index_back=false, is_global_index=false, 
      range_key([T2_PART.__pk_increment]), range(MIN ; MAX)always true, 
      pushdown_aggregation([T_FUN_SUM(T2_PART.B)])
merge/*+use_px*/ into t1_part using t2_part on (t1_part.a = t2_part.a) when not matched then insert (t1_part.a,t1_part.b,t1_part.c,t1_part.d) values (6,6,6,6) where 15 < (select sum(b) from t2_part);
select * from t1_part;
+------+------+------+------+
| A    | B    | C    | D    |
+------+------+------+------+
|    1 |    1 |    1 |    1 |
|    2 |    1 |    2 |    2 |
|    3 |    1 |    3 |    3 |
|    4 |    1 |    4 |    4 |
|    5 |    1 |    5 |    5 |
|    6 |    6 |    6 |    6 |
+------+------+------+------+

explain basic merge/*+use_px*/ into t1_part using t2_part on (t1_part.a = t2_part.a) when matched then update set t1_part.b = 1 where exists(select 1 from t2_part where t2_part.b = t1_part.b) and t1_part.c = 2;
Query Plan
=======================================================
|ID|OPERATOR                                 |NAME    |
-------------------------------------------------------
|0 |DISTRIBUTED MERGE                        |        |
|1 |└─PX COORDINATOR                         |        |
|2 |  └─EXCHANGE OUT DISTR                   |:EX10002|
|3 |    └─HASH SEMI JOIN                     |        |
|4 |      ├─EXCHANGE IN DISTR                |        |
|5 |      │ └─EXCHANGE OUT DISTR (PKEY)      |:EX10001|
|6 |      │   └─HASH JOIN                    |        |
|7 |      │     ├─PX PARTITION ITERATOR      |        |
|8 |      │     │ └─TABLE FULL SCAN          |T1_PART |
|9 |      │     └─EXCHANGE IN DISTR          |        |
|10|      │       └─EXCHANGE OUT DISTR (PKEY)|:EX10000|
|11|      │         └─PX PARTITION ITERATOR  |        |
|12|      │           └─TABLE FULL SCAN      |T2_PART |
|13|      └─SUBPLAN SCAN                     |VIEW1   |
|14|        └─PX PARTITION ITERATOR          |        |
|15|          └─TABLE FULL SCAN              |T2_PART |
=======================================================
Outputs & filters:
-------------------------------------
  0 - output(nil), filter(nil)
      columns([{T1_PART: ({T1_PART: (T1_PART.__pk_increment, T1_PART.A, T1_PART.B, T1_PART.C, T1_PART.D)})}]),
      update([T1_PART.B=column_conv(NUMBER,PS:(-1,0),NULL,1)]), 
      insert_conds(nil), update_conds(nil), delete_conds(nil)
  1 - output([T1_PART.__pk_increment], [T1_PART.A], [T1_PART.B], [T1_PART.C], [T1_PART.D]), filter(nil), rowset=16
  2 - output([T1_PART.__pk_increment], [T1_PART.A], [T1_PART.B], [T1_PART.C], [T1_PART.D]), filter(nil), rowset=16
      dop=1
  3 - output([T1_PART.__pk_increment], [T1_PART.A], [T1_PART.B], [T1_PART.C], [T1_PART.D]), filter(nil), rowset=16
      equal_conds([VIEW1.T2_PART.B = T1_PART.B]), other_conds(nil)
  4 - output([T1_PART.__pk_increment], [T1_PART.A], [T1_PART.B], [T1_PART.C], [T1_PART.D]), filter(nil), rowset=16
  5 - output([T1_PART.__pk_increment], [T1_PART.A], [T1_PART.B], [T1_PART.C], [T1_PART.D]), filter(nil), rowset=16
      (#keys=1, [T1_PART.B]), dop=1
  6 - output([T1_PART.__pk_increment], [T1_PART.A], [T1_PART.B], [T1_PART.C], [T1_PART.D]), filter(nil), rowset=16
      equal_conds([T1_PART.A = T2_PART.A]), other_conds(nil)
  7 - output([T1_PART.__pk_increment], [T1_PART.A], [T1_PART.B], [T1_PART.C], [T1_PART.D]), filter(nil), rowset=16
      affinitize, force partition granule
  8 - output([T1_PART.__pk_increment], [T1_PART.A], [T1_PART.B], [T1_PART.C], [T1_PART.D]), filter([T1_PART.C = 2], [T1_PART.__pk_increment IS NOT NULL]), rowset=16
      access([T1_PART.__pk_increment], [T1_PART.A], [T1_PART.B], [T1_PART.C], [T1_PART.D]), partitions(p[0-3])
      is_index_back=false, is_global_index=false, filter_before_indexback[false,false], 
      range_key([T1_PART.__pk_increment]), range(MIN ; MAX)always true
  9 - output([T2_PART.A]), filter(nil), rowset=16
 10 - output([T2_PART.A]), filter(nil), rowset=16
      (#keys=1, [T2_PART.A]), dop=1
 11 - output([T2_PART.A]), filter(nil), rowset=16
      force partition granule
 12 - output([T2_PART.A]), filter(nil), rowset=16
      access([T2_PART.A]), partitions(p[0-3])
      is_index_back=false, is_global_index=false, 
      range_key([T2_PART.__pk_increment]), range(MIN ; MAX)always true
 13 - output([VIEW1.T2_PART.B]), filter(nil), rowset=16
      access([VIEW1.T2_PART.B])
 14 - output([T2_PART.B]), filter(nil), rowset=16
      affinitize, force partition granule
 15 - output([T2_PART.B]), filter(nil), rowset=16
      access([T2_PART.B]), partitions(p[0-3])
      is_index_back=false, is_global_index=false, 
      range_key([T2_PART.__pk_increment]), range(MIN ; MAX)always true
merge/*+use_px*/ into t1_part using t2_part on (t1_part.a = t2_part.a) when matched then update set t1_part.b = 1 where exists(select 1 from t2_part where t2_part.b = t1_part.b) and t1_part.c = 2;
select * from t1_part;
+------+------+------+------+
| A    | B    | C    | D    |
+------+------+------+------+
|    1 |    1 |    1 |    1 |
|    2 |    1 |    2 |    2 |
|    3 |    1 |    3 |    3 |
|    4 |    1 |    4 |    4 |
|    5 |    1 |    5 |    5 |
|    6 |    6 |    6 |    6 |
+------+------+------+------+

explain basic merge/*+use_px*/ into t1_part using t2_part on (t1_part.a = t2_part.a) when not matched then insert (t1_part.a,t1_part.b,t1_part.c,t1_part.d) values (6,6,6,6) where 15 < (select sum(b) from t2_part) and 
t2_part.c = 1;
Query Plan
===================================================
|ID|OPERATOR                             |NAME    |
---------------------------------------------------
|0 |DISTRIBUTED MERGE                    |        |
|1 |└─SUBPLAN FILTER                     |        |
|2 |  ├─PX COORDINATOR                   |        |
|3 |  │ └─EXCHANGE OUT DISTR             |:EX10001|
|4 |  │   └─HASH OUTER JOIN              |        |
|5 |  │     ├─EXCHANGE IN DISTR          |        |
|6 |  │     │ └─EXCHANGE OUT DISTR (PKEY)|:EX10000|
|7 |  │     │   └─PX PARTITION ITERATOR  |        |
|8 |  │     │     └─TABLE FULL SCAN      |T2_PART |
|9 |  │     └─PX PARTITION ITERATOR      |        |
|10|  │       └─TABLE FULL SCAN          |T1_PART |
|11|  └─SCALAR GROUP BY                  |        |
|12|    └─PX COORDINATOR                 |        |
|13|      └─EXCHANGE OUT DISTR           |:EX20000|
|14|        └─MERGE GROUP BY             |        |
|15|          └─PX PARTITION ITERATOR    |        |
|16|            └─TABLE FULL SCAN        |T2_PART |
===================================================
Outputs & filters:
-------------------------------------
  0 - output(nil), filter(nil)
      columns([{T1_PART: ({T1_PART: (T1_PART.__pk_increment, T1_PART.A, T1_PART.B, T1_PART.C, T1_PART.D)})}]), partitions(p3), 
      column_values([T_HIDDEN_PK], [column_conv(NUMBER,PS:(-1,0),NULL,6)], [column_conv(NUMBER,PS:(-1,0),NULL,6)], [column_conv(NUMBER,PS:(-1,0),NULL,6)],
       [column_conv(NUMBER,PS:(-1,0),NULL,6)]), 
      insert_conds([(T_OP_AND, T1_PART.__pk_increment IS NULL, 15 < :0, T2_PART.C = 1)]), update_conds(nil), delete_conds(nil)
  1 - output([T1_PART.__pk_increment], [T1_PART.A], [T1_PART.B], [T1_PART.C], [T1_PART.D], [:0], [T2_PART.C]), filter(nil), rowset=16
      exec_params_(nil), onetime_exprs_([subquery(1)(:0)]), init_plan_idxs_(nil), use_batch=false
  2 - output([T1_PART.__pk_increment], [T1_PART.A], [T1_PART.B], [T1_PART.C], [T1_PART.D], [T2_PART.C]), filter(nil), rowset=16
  3 - output([T1_PART.__pk_increment], [T1_PART.A], [T1_PART.B], [T1_PART.C], [T1_PART.D], [T2_PART.C]), filter(nil), rowset=16
      dop=1
  4 - output([T1_PART.__pk_increment], [T1_PART.A], [T1_PART.B], [T1_PART.C], [T1_PART.D], [T2_PART.C]), filter(nil), rowset=16
      equal_conds([T1_PART.A = T2_PART.A]), other_conds(nil)
  5 - output([T2_PART.A], [T2_PART.C]), filter(nil), rowset=16
  6 - output([T2_PART.A], [T2_PART.C]), filter(nil), rowset=16
      (#keys=1, [T2_PART.A]), dop=1
  7 - output([T2_PART.A], [T2_PART.C]), filter(nil), rowset=16
      force partition granule
  8 - output([T2_PART.A], [T2_PART.C]), filter(nil), rowset=16
      access([T2_PART.A], [T2_PART.C]), partitions(p[0-3])
      is_index_back=false, is_global_index=false, 
      range_key([T2_PART.__pk_increment]), range(MIN ; MAX)always true
  9 - output([T1_PART.__pk_increment], [T1_PART.A], [T1_PART.B], [T1_PART.C], [T1_PART.D]), filter(nil), rowset=16
      affinitize, force partition granule
 10 - output([T1_PART.__pk_increment], [T1_PART.A], [T1_PART.B], [T1_PART.C], [T1_PART.D]), filter(nil), rowset=16
      access([T1_PART.__pk_increment], [T1_PART.A], [T1_PART.B], [T1_PART.C], [T1_PART.D]), partitions(p[0-3])
      is_index_back=false, is_global_index=false, 
      range_key([T1_PART.__pk_increment]), range(MIN ; MAX)always true
 11 - output([T_FUN_SUM(T_FUN_SUM(T_FUN_SUM(T2_PART.B)))]), filter(nil), rowset=16
      group(nil), agg_func([T_FUN_SUM(T_FUN_SUM(T_FUN_SUM(T2_PART.B)))])
 12 - output([T_FUN_SUM(T_FUN_SUM(T2_PART.B))]), filter(nil), rowset=16
 13 - output([T_FUN_SUM(T_FUN_SUM(T2_PART.B))]), filter(nil), rowset=16
      dop=1
 14 - output([T_FUN_SUM(T_FUN_SUM(T2_PART.B))]), filter(nil), rowset=16
      group(nil), agg_func([T_FUN_SUM(T_FUN_SUM(T2_PART.B))])
 15 - output([T_FUN_SUM(T2_PART.B)]), filter(nil), rowset=16
      force partition granule
 16 - output([T_FUN_SUM(T2_PART.B)]), filter(nil), rowset=16
      access([T2_PART.B]), partitions(p[0-3])
      is_index_back=false, is_global_index=false, 
      range_key([T2_PART.__pk_increment]), range(MIN ; MAX)always true, 
      pushdown_aggregation([T_FUN_SUM(T2_PART.B)])
merge into/*+use_px*/ t1_part using t2_part on (t1_part.a = t2_part.a) when not matched then insert (t1_part.a,t1_part.b,t1_part.c,t1_part.d) values (6,6,6,6) where 15 < (select sum(b) from t2_part) and 
t2_part.c = 1;
select * from t1_part;
+------+------+------+------+
| A    | B    | C    | D    |
+------+------+------+------+
|    1 |    1 |    1 |    1 |
|    2 |    1 |    2 |    2 |
|    3 |    1 |    3 |    3 |
|    4 |    1 |    4 |    4 |
|    5 |    1 |    5 |    5 |
|    6 |    6 |    6 |    6 |
+------+------+------+------+

explain basic merge/*+use_px*/ into t1_part using t2_part on (t1_part.a = t2_part.a) when matched then update set t1_part.b = 1 where exists(select 1 from t2_part);
Query Plan
===================================================
|ID|OPERATOR                             |NAME    |
---------------------------------------------------
|0 |DISTRIBUTED MERGE                    |        |
|1 |└─SUBPLAN FILTER                     |        |
|2 |  ├─PX COORDINATOR                   |        |
|3 |  │ └─EXCHANGE OUT DISTR             |:EX10001|
|4 |  │   └─HASH JOIN                    |        |
|5 |  │     ├─EXCHANGE IN DISTR          |        |
|6 |  │     │ └─EXCHANGE OUT DISTR (PKEY)|:EX10000|
|7 |  │     │   └─PX PARTITION ITERATOR  |        |
|8 |  │     │     └─TABLE FULL SCAN      |T2_PART |
|9 |  │     └─PX PARTITION ITERATOR      |        |
|10|  │       └─TABLE FULL SCAN          |T1_PART |
|11|  └─LIMIT                            |        |
|12|    └─PX COORDINATOR                 |        |
|13|      └─EXCHANGE OUT DISTR           |:EX20000|
|14|        └─LIMIT                      |        |
|15|          └─PX PARTITION ITERATOR    |        |
|16|            └─TABLE FULL SCAN        |T2_PART |
===================================================
Outputs & filters:
-------------------------------------
  0 - output(nil), filter(nil)
      columns([{T1_PART: ({T1_PART: (T1_PART.__pk_increment, T1_PART.A, T1_PART.B, T1_PART.C, T1_PART.D)})}]),
      update([T1_PART.B=column_conv(NUMBER,PS:(-1,0),NULL,1)]), 
      insert_conds(nil), update_conds(nil), delete_conds(nil)
  1 - output([T1_PART.__pk_increment], [T1_PART.A], [T1_PART.B], [T1_PART.C], [T1_PART.D]), filter(nil), rowset=16
      exec_params_(nil), onetime_exprs_([(T_OP_EXISTS, subquery(1))(:0)]), init_plan_idxs_(nil), use_batch=false
  2 - output([T1_PART.__pk_increment], [T1_PART.A], [T1_PART.B], [T1_PART.C], [T1_PART.D]), filter(nil), startup_filter([:0]), rowset=16
  3 - output([T1_PART.__pk_increment], [T1_PART.A], [T1_PART.B], [T1_PART.C], [T1_PART.D]), filter(nil), rowset=16
      dop=1
  4 - output([T1_PART.__pk_increment], [T1_PART.A], [T1_PART.B], [T1_PART.C], [T1_PART.D]), filter(nil), rowset=16
      equal_conds([T1_PART.A = T2_PART.A]), other_conds(nil)
  5 - output([T2_PART.A]), filter(nil), rowset=16
  6 - output([T2_PART.A]), filter(nil), rowset=16
      (#keys=1, [T2_PART.A]), dop=1
  7 - output([T2_PART.A]), filter(nil), rowset=16
      force partition granule
  8 - output([T2_PART.A]), filter(nil), rowset=16
      access([T2_PART.A]), partitions(p[0-3])
      is_index_back=false, is_global_index=false, 
      range_key([T2_PART.__pk_increment]), range(MIN ; MAX)always true
  9 - output([T1_PART.__pk_increment], [T1_PART.A], [T1_PART.B], [T1_PART.C], [T1_PART.D]), filter(nil), rowset=16
      affinitize, force partition granule
 10 - output([T1_PART.__pk_increment], [T1_PART.A], [T1_PART.B], [T1_PART.C], [T1_PART.D]), filter([T1_PART.__pk_increment IS NOT NULL]), rowset=16
      access([T1_PART.__pk_increment], [T1_PART.A], [T1_PART.B], [T1_PART.C], [T1_PART.D]), partitions(p[0-3])
      is_index_back=false, is_global_index=false, filter_before_indexback[false], 
      range_key([T1_PART.__pk_increment]), range(MIN ; MAX)always true
 11 - output([1]), filter(nil), rowset=16
      limit(1), offset(nil)
 12 - output(nil), filter(nil), rowset=16
 13 - output(nil), filter(nil), rowset=16
      dop=1
 14 - output(nil), filter(nil), rowset=16
      limit(1), offset(nil)
 15 - output(nil), filter(nil), rowset=16
      force partition granule
 16 - output(nil), filter(nil), rowset=16
      access(nil), partitions(p[0-3])
      limit(1), offset(nil), is_index_back=false, is_global_index=false, 
      range_key([T2_PART.__pk_increment]), range(MIN ; MAX)always true
merge/*+use_px*/ into t1_part using t2_part on (t1_part.a = t2_part.a) when matched then update set t1_part.b = 1 where exists(select 1 from t2_part);
select * from t1_part;
+------+------+------+------+
| A    | B    | C    | D    |
+------+------+------+------+
|    1 |    1 |    1 |    1 |
|    2 |    1 |    2 |    2 |
|    3 |    1 |    3 |    3 |
|    4 |    1 |    4 |    4 |
|    5 |    1 |    5 |    5 |
|    6 |    1 |    6 |    6 |
+------+------+------+------+

explain basic merge/*+use_px*/ into t1_part using t2_part on (t1_part.a = t2_part.a) when not matched then insert (t1_part.a,t1_part.b,t1_part.c,t1_part.d) values (6,6,6,6) where exists(select 1 from t2_part);
Query Plan
===================================================
|ID|OPERATOR                             |NAME    |
---------------------------------------------------
|0 |DISTRIBUTED MERGE                    |        |
|1 |└─SUBPLAN FILTER                     |        |
|2 |  ├─PX COORDINATOR                   |        |
|3 |  │ └─EXCHANGE OUT DISTR             |:EX10001|
|4 |  │   └─HASH OUTER JOIN              |        |
|5 |  │     ├─EXCHANGE IN DISTR          |        |
|6 |  │     │ └─EXCHANGE OUT DISTR (PKEY)|:EX10000|
|7 |  │     │   └─PX PARTITION ITERATOR  |        |
|8 |  │     │     └─TABLE FULL SCAN      |T2_PART |
|9 |  │     └─PX PARTITION ITERATOR      |        |
|10|  │       └─TABLE FULL SCAN          |T1_PART |
|11|  └─LIMIT                            |        |
|12|    └─PX COORDINATOR                 |        |
|13|      └─EXCHANGE OUT DISTR           |:EX20000|
|14|        └─LIMIT                      |        |
|15|          └─PX PARTITION ITERATOR    |        |
|16|            └─TABLE FULL SCAN        |T2_PART |
===================================================
Outputs & filters:
-------------------------------------
  0 - output(nil), filter(nil)
      columns([{T1_PART: ({T1_PART: (T1_PART.__pk_increment, T1_PART.A, T1_PART.B, T1_PART.C, T1_PART.D)})}]), partitions(p3), 
      column_values([T_HIDDEN_PK], [column_conv(NUMBER,PS:(-1,0),NULL,6)], [column_conv(NUMBER,PS:(-1,0),NULL,6)], [column_conv(NUMBER,PS:(-1,0),NULL,6)],
       [column_conv(NUMBER,PS:(-1,0),NULL,6)]), 
      insert_conds([T1_PART.__pk_increment IS NULL AND :0]), update_conds(nil), delete_conds(nil)
  1 - output([T1_PART.__pk_increment], [T1_PART.A], [T1_PART.B], [T1_PART.C], [T1_PART.D], [:0]), filter(nil), rowset=16
      exec_params_(nil), onetime_exprs_([(T_OP_EXISTS, subquery(1))(:0)]), init_plan_idxs_(nil), use_batch=false
  2 - output([T1_PART.__pk_increment], [T1_PART.A], [T1_PART.B], [T1_PART.C], [T1_PART.D]), filter(nil), rowset=16
  3 - output([T1_PART.__pk_increment], [T1_PART.A], [T1_PART.B], [T1_PART.C], [T1_PART.D]), filter(nil), rowset=16
      dop=1
  4 - output([T1_PART.__pk_increment], [T1_PART.A], [T1_PART.B], [T1_PART.C], [T1_PART.D]), filter(nil), rowset=16
      equal_conds([T1_PART.A = T2_PART.A]), other_conds(nil)
  5 - output([T2_PART.A]), filter(nil), rowset=16
  6 - output([T2_PART.A]), filter(nil), rowset=16
      (#keys=1, [T2_PART.A]), dop=1
  7 - output([T2_PART.A]), filter(nil), rowset=16
      force partition granule
  8 - output([T2_PART.A]), filter(nil), rowset=16
      access([T2_PART.A]), partitions(p[0-3])
      is_index_back=false, is_global_index=false, 
      range_key([T2_PART.__pk_increment]), range(MIN ; MAX)always true
  9 - output([T1_PART.__pk_increment], [T1_PART.A], [T1_PART.B], [T1_PART.C], [T1_PART.D]), filter(nil), rowset=16
      affinitize, force partition granule
 10 - output([T1_PART.__pk_increment], [T1_PART.A], [T1_PART.B], [T1_PART.C], [T1_PART.D]), filter(nil), rowset=16
      access([T1_PART.__pk_increment], [T1_PART.A], [T1_PART.B], [T1_PART.C], [T1_PART.D]), partitions(p[0-3])
      is_index_back=false, is_global_index=false, 
      range_key([T1_PART.__pk_increment]), range(MIN ; MAX)always true
 11 - output([1]), filter(nil), rowset=16
      limit(1), offset(nil)
 12 - output(nil), filter(nil), rowset=16
 13 - output(nil), filter(nil), rowset=16
      dop=1
 14 - output(nil), filter(nil), rowset=16
      limit(1), offset(nil)
 15 - output(nil), filter(nil), rowset=16
      force partition granule
 16 - output(nil), filter(nil), rowset=16
      access(nil), partitions(p[0-3])
      limit(1), offset(nil), is_index_back=false, is_global_index=false, 
      range_key([T2_PART.__pk_increment]), range(MIN ; MAX)always true
merge/*+use_px*/ into t1_part using t2_part on (t1_part.a = t2_part.a) when not matched then insert (t1_part.a,t1_part.b,t1_part.c,t1_part.d) values (6,6,6,6) where exists(select 1 from t2_part);
select * from t1_part;
+------+------+------+------+
| A    | B    | C    | D    |
+------+------+------+------+
|    1 |    1 |    1 |    1 |
|    2 |    1 |    2 |    2 |
|    3 |    1 |    3 |    3 |
|    4 |    1 |    4 |    4 |
|    5 |    1 |    5 |    5 |
|    6 |    1 |    6 |    6 |
+------+------+------+------+

explain basic merge/*+use_px*/ into t1_part using t2_part on (t1_part.a = t2_part.a) when matched then update set t1_part.b = 1 where exists (select 1 from t2_part where t1_part.b = t2_part.b) when not matched then insert (t1_part.a,t1_part.b,t1_part.c,t1_part.d) values (6,6,6,6) where exists(select 1 from t2_part);
Query Plan
===================================================
|ID|OPERATOR                             |NAME    |
---------------------------------------------------
|0 |DISTRIBUTED MERGE                    |        |
|1 |└─SUBPLAN FILTER                     |        |
|2 |  ├─PX COORDINATOR                   |        |
|3 |  │ └─EXCHANGE OUT DISTR             |:EX10001|
|4 |  │   └─HASH OUTER JOIN              |        |
|5 |  │     ├─EXCHANGE IN DISTR          |        |
|6 |  │     │ └─EXCHANGE OUT DISTR (PKEY)|:EX10000|
|7 |  │     │   └─PX PARTITION ITERATOR  |        |
|8 |  │     │     └─TABLE FULL SCAN      |T2_PART |
|9 |  │     └─PX PARTITION ITERATOR      |        |
|10|  │       └─TABLE FULL SCAN          |T1_PART |
|11|  ├─LIMIT                            |        |
|12|  │ └─DISTRIBUTED TABLE FULL SCAN    |T2_PART |
|13|  └─LIMIT                            |        |
|14|    └─PX COORDINATOR                 |        |
|15|      └─EXCHANGE OUT DISTR           |:EX20000|
|16|        └─LIMIT                      |        |
|17|          └─PX PARTITION ITERATOR    |        |
|18|            └─TABLE FULL SCAN        |T2_PART |
===================================================
Outputs & filters:
-------------------------------------
  0 - output(nil), filter(nil)
      columns([{T1_PART: ({T1_PART: (T1_PART.__pk_increment, T1_PART.A, T1_PART.B, T1_PART.C, T1_PART.D)})}]), partitions(p3), 
      column_values([T_HIDDEN_PK], [column_conv(NUMBER,PS:(-1,0),NULL,6)], [column_conv(NUMBER,PS:(-1,0),NULL,6)], [column_conv(NUMBER,PS:(-1,0),NULL,6)],
       [column_conv(NUMBER,PS:(-1,0),NULL,6)]),
      update([T1_PART.B=column_conv(NUMBER,PS:(-1,0),NULL,1)]), 
      insert_conds([T1_PART.__pk_increment IS NULL AND :1]), update_conds([T1_PART.__pk_increment IS NOT NULL AND (T_OP_EXISTS, subquery(1))]), delete_conds(nil)
  1 - output([T1_PART.__pk_increment], [T1_PART.A], [T1_PART.B], [T1_PART.C], [T1_PART.D], [(T_OP_EXISTS, subquery(1))], [:1]), filter(nil), rowset=16
      exec_params_([T1_PART.B(:0)]), onetime_exprs_([(T_OP_EXISTS, subquery(2))(:1)]), init_plan_idxs_(nil), use_batch=false
  2 - output([T1_PART.__pk_increment], [T1_PART.A], [T1_PART.B], [T1_PART.C], [T1_PART.D]), filter(nil), rowset=16
  3 - output([T1_PART.__pk_increment], [T1_PART.A], [T1_PART.B], [T1_PART.C], [T1_PART.D]), filter(nil), rowset=16
      dop=1
  4 - output([T1_PART.__pk_increment], [T1_PART.A], [T1_PART.B], [T1_PART.C], [T1_PART.D]), filter(nil), rowset=16
      equal_conds([T1_PART.A = T2_PART.A]), other_conds(nil)
  5 - output([T2_PART.A]), filter(nil), rowset=16
  6 - output([T2_PART.A]), filter(nil), rowset=16
      (#keys=1, [T2_PART.A]), dop=1
  7 - output([T2_PART.A]), filter(nil), rowset=16
      force partition granule
  8 - output([T2_PART.A]), filter(nil), rowset=16
      access([T2_PART.A]), partitions(p[0-3])
      is_index_back=false, is_global_index=false, 
      range_key([T2_PART.__pk_increment]), range(MIN ; MAX)always true
  9 - output([T1_PART.__pk_increment], [T1_PART.A], [T1_PART.B], [T1_PART.C], [T1_PART.D]), filter(nil), rowset=16
      affinitize, force partition granule
 10 - output([T1_PART.__pk_increment], [T1_PART.A], [T1_PART.B], [T1_PART.C], [T1_PART.D]), filter(nil), rowset=16
      access([T1_PART.__pk_increment], [T1_PART.A], [T1_PART.B], [T1_PART.C], [T1_PART.D]), partitions(p[0-3])
      is_index_back=false, is_global_index=false, 
      range_key([T1_PART.__pk_increment]), range(MIN ; MAX)always true
 11 - output([1]), filter(nil), rowset=16
      limit(1), offset(nil)
 12 - output(nil), filter([:0 = T2_PART.B]), rowset=16
      access([T2_PART.B]), partitions(p[0-3])
      limit(1), offset(nil), is_index_back=false, is_global_index=false, filter_before_indexback[false], 
      range_key([T2_PART.__pk_increment]), range(MIN ; MAX)always true
 13 - output([1]), filter(nil), rowset=16
      limit(1), offset(nil)
 14 - output(nil), filter(nil), rowset=16
 15 - output(nil), filter(nil), rowset=16
      dop=1
 16 - output(nil), filter(nil), rowset=16
      limit(1), offset(nil)
 17 - output(nil), filter(nil), rowset=16
      force partition granule
 18 - output(nil), filter(nil), rowset=16
      access(nil), partitions(p[0-3])
      limit(1), offset(nil), is_index_back=false, is_global_index=false, 
      range_key([T2_PART.__pk_increment]), range(MIN ; MAX)always true
merge/*+use_px*/ into t1_part using t2_part on (t1_part.a = t2_part.a) when matched then update set t1_part.b = 1 where exists (select 1 from t2_part where t1_part.b = t2_part.b) when not matched then insert (t1_part.a,t1_part.b,t1_part.c,t1_part.d) values (6,6,6,6) where exists(select 1 from t2_part);
select * from t1_part;
+------+------+------+------+
| A    | B    | C    | D    |
+------+------+------+------+
|    1 |    1 |    1 |    1 |
|    2 |    1 |    2 |    2 |
|    3 |    1 |    3 |    3 |
|    4 |    1 |    4 |    4 |
|    5 |    1 |    5 |    5 |
|    6 |    1 |    6 |    6 |
+------+------+------+------+

###test subquery in update assign the insert values
explain basic merge/*+use_px*/ into t1_part using t2_part on (t1_part.a = t2_part.a) when matched then update set t1_part.b = (select sum(b) from t2_part) where t1_part.c = 2;
Query Plan
===================================================
|ID|OPERATOR                             |NAME    |
---------------------------------------------------
|0 |DISTRIBUTED MERGE                    |        |
|1 |└─SUBPLAN FILTER                     |        |
|2 |  ├─PX COORDINATOR                   |        |
|3 |  │ └─EXCHANGE OUT DISTR             |:EX10001|
|4 |  │   └─HASH JOIN                    |        |
|5 |  │     ├─PX PARTITION ITERATOR      |        |
|6 |  │     │ └─TABLE FULL SCAN          |T1_PART |
|7 |  │     └─EXCHANGE IN DISTR          |        |
|8 |  │       └─EXCHANGE OUT DISTR (PKEY)|:EX10000|
|9 |  │         └─PX PARTITION ITERATOR  |        |
|10|  │           └─TABLE FULL SCAN      |T2_PART |
|11|  └─SCALAR GROUP BY                  |        |
|12|    └─PX COORDINATOR                 |        |
|13|      └─EXCHANGE OUT DISTR           |:EX20000|
|14|        └─MERGE GROUP BY             |        |
|15|          └─PX PARTITION ITERATOR    |        |
|16|            └─TABLE FULL SCAN        |T2_PART |
===================================================
Outputs & filters:
-------------------------------------
  0 - output(nil), filter(nil)
      columns([{T1_PART: ({T1_PART: (T1_PART.__pk_increment, T1_PART.A, T1_PART.B, T1_PART.C, T1_PART.D)})}]),
      update([T1_PART.B=CASE WHEN T1_PART.__pk_increment IS NOT NULL THEN column_conv(NUMBER,PS:(-1,0),NULL,:0) ELSE cast(NULL, NUMBER(-1, 0)) END]), 
      insert_conds(nil), update_conds(nil), delete_conds(nil)
  1 - output([T1_PART.__pk_increment], [T1_PART.A], [T1_PART.B], [T1_PART.C], [T1_PART.D], [:0]), filter(nil), rowset=16
      exec_params_(nil), onetime_exprs_([subquery(1)(:0)]), init_plan_idxs_(nil), use_batch=false
  2 - output([T1_PART.__pk_increment], [T1_PART.A], [T1_PART.B], [T1_PART.C], [T1_PART.D]), filter(nil), rowset=16
  3 - output([T1_PART.__pk_increment], [T1_PART.A], [T1_PART.B], [T1_PART.C], [T1_PART.D]), filter(nil), rowset=16
      dop=1
  4 - output([T1_PART.__pk_increment], [T1_PART.A], [T1_PART.B], [T1_PART.C], [T1_PART.D]), filter(nil), rowset=16
      equal_conds([T1_PART.A = T2_PART.A]), other_conds(nil)
  5 - output([T1_PART.__pk_increment], [T1_PART.A], [T1_PART.B], [T1_PART.C], [T1_PART.D]), filter(nil), rowset=16
      affinitize, force partition granule
  6 - output([T1_PART.__pk_increment], [T1_PART.A], [T1_PART.B], [T1_PART.C], [T1_PART.D]), filter([T1_PART.C = 2]), rowset=16
      access([T1_PART.__pk_increment], [T1_PART.A], [T1_PART.B], [T1_PART.C], [T1_PART.D]), partitions(p[0-3])
      is_index_back=false, is_global_index=false, filter_before_indexback[false], 
      range_key([T1_PART.__pk_increment]), range(MIN ; MAX)always true
  7 - output([T2_PART.A]), filter(nil), rowset=16
  8 - output([T2_PART.A]), filter(nil), rowset=16
      (#keys=1, [T2_PART.A]), dop=1
  9 - output([T2_PART.A]), filter(nil), rowset=16
      force partition granule
 10 - output([T2_PART.A]), filter(nil), rowset=16
      access([T2_PART.A]), partitions(p[0-3])
      is_index_back=false, is_global_index=false, 
      range_key([T2_PART.__pk_increment]), range(MIN ; MAX)always true
 11 - output([T_FUN_SUM(T_FUN_SUM(T_FUN_SUM(T2_PART.B)))]), filter(nil), rowset=16
      group(nil), agg_func([T_FUN_SUM(T_FUN_SUM(T_FUN_SUM(T2_PART.B)))])
 12 - output([T_FUN_SUM(T_FUN_SUM(T2_PART.B))]), filter(nil), rowset=16
 13 - output([T_FUN_SUM(T_FUN_SUM(T2_PART.B))]), filter(nil), rowset=16
      dop=1
 14 - output([T_FUN_SUM(T_FUN_SUM(T2_PART.B))]), filter(nil), rowset=16
      group(nil), agg_func([T_FUN_SUM(T_FUN_SUM(T2_PART.B))])
 15 - output([T_FUN_SUM(T2_PART.B)]), filter(nil), rowset=16
      force partition granule
 16 - output([T_FUN_SUM(T2_PART.B)]), filter(nil), rowset=16
      access([T2_PART.B]), partitions(p[0-3])
      is_index_back=false, is_global_index=false, 
      range_key([T2_PART.__pk_increment]), range(MIN ; MAX)always true, 
      pushdown_aggregation([T_FUN_SUM(T2_PART.B)])
merge/*+use_px*/ into t1_part using t2_part on (t1_part.a = t2_part.a) when matched then update set t1_part.b = (select sum(b) from t2_part) where t1_part.c = 2;
select * from t1_part;
+------+------+------+------+
| A    | B    | C    | D    |
+------+------+------+------+
|    1 |    1 |    1 |    1 |
|    2 |   20 |    2 |    2 |
|    3 |    1 |    3 |    3 |
|    4 |    1 |    4 |    4 |
|    5 |    1 |    5 |    5 |
|    6 |    1 |    6 |    6 |
+------+------+------+------+

explain basic merge/*+use_px*/ into t1_part using t2_part on (t1_part.a = t2_part.a) when matched then update set t1_part.b = (select sum(b) from t2_part where t2_part.d = t1_part.d) where t1_part.c = 2;
Query Plan
===================================================
|ID|OPERATOR                             |NAME    |
---------------------------------------------------
|0 |DISTRIBUTED MERGE                    |        |
|1 |└─PX COORDINATOR                     |        |
|2 |  └─EXCHANGE OUT DISTR               |:EX10001|
|3 |    └─SUBPLAN FILTER                 |        |
|4 |      ├─HASH JOIN                    |        |
|5 |      │ ├─PX PARTITION ITERATOR      |        |
|6 |      │ │ └─TABLE FULL SCAN          |T1_PART |
|7 |      │ └─EXCHANGE IN DISTR          |        |
|8 |      │   └─EXCHANGE OUT DISTR (PKEY)|:EX10000|
|9 |      │     └─PX PARTITION ITERATOR  |        |
|10|      │       └─TABLE FULL SCAN      |T2_PART |
|11|      └─SCALAR GROUP BY              |        |
|12|        └─DISTRIBUTED TABLE FULL SCAN|T2_PART |
===================================================
Outputs & filters:
-------------------------------------
  0 - output(nil), filter(nil)
      columns([{T1_PART: ({T1_PART: (T1_PART.__pk_increment, T1_PART.A, T1_PART.B, T1_PART.C, T1_PART.D)})}]),
      update([T1_PART.B=CASE WHEN T1_PART.__pk_increment IS NOT NULL THEN column_conv(NUMBER,PS:(-1,0),NULL,subquery(1)) ELSE cast(NULL, NUMBER(-1, 0)) 
      END]), 
      insert_conds(nil), update_conds(nil), delete_conds(nil)
  1 - output([T1_PART.__pk_increment], [T1_PART.A], [T1_PART.B], [T1_PART.C], [T1_PART.D], [subquery(1)]), filter(nil), rowset=16
  2 - output([T1_PART.__pk_increment], [T1_PART.A], [T1_PART.B], [T1_PART.C], [T1_PART.D], [subquery(1)]), filter(nil), rowset=16
      dop=1
  3 - output([T1_PART.__pk_increment], [T1_PART.A], [T1_PART.B], [T1_PART.C], [T1_PART.D], [subquery(1)]), filter(nil), rowset=16
      exec_params_([T1_PART.D(:0)]), onetime_exprs_(nil), init_plan_idxs_(nil), use_batch=false
  4 - output([T1_PART.__pk_increment], [T1_PART.A], [T1_PART.B], [T1_PART.C], [T1_PART.D]), filter(nil), rowset=16
      equal_conds([T1_PART.A = T2_PART.A]), other_conds(nil)
  5 - output([T1_PART.__pk_increment], [T1_PART.A], [T1_PART.B], [T1_PART.C], [T1_PART.D]), filter(nil), rowset=16
      affinitize, force partition granule
  6 - output([T1_PART.__pk_increment], [T1_PART.A], [T1_PART.B], [T1_PART.C], [T1_PART.D]), filter([T1_PART.C = 2]), rowset=16
      access([T1_PART.__pk_increment], [T1_PART.A], [T1_PART.B], [T1_PART.C], [T1_PART.D]), partitions(p[0-3])
      is_index_back=false, is_global_index=false, filter_before_indexback[false], 
      range_key([T1_PART.__pk_increment]), range(MIN ; MAX)always true
  7 - output([T2_PART.A]), filter(nil), rowset=16
  8 - output([T2_PART.A]), filter(nil), rowset=16
      (#keys=1, [T2_PART.A]), dop=1
  9 - output([T2_PART.A]), filter(nil), rowset=16
      force partition granule
 10 - output([T2_PART.A]), filter(nil), rowset=16
      access([T2_PART.A]), partitions(p[0-3])
      is_index_back=false, is_global_index=false, 
      range_key([T2_PART.__pk_increment]), range(MIN ; MAX)always true
 11 - output([T_FUN_SUM(T_FUN_SUM(T2_PART.B))]), filter(nil), rowset=16
      group(nil), agg_func([T_FUN_SUM(T_FUN_SUM(T2_PART.B))])
 12 - output([T_FUN_SUM(T2_PART.B)]), filter([T2_PART.D = :0]), rowset=16
      access([T2_PART.B], [T2_PART.D]), partitions(p[0-3])
      is_index_back=false, is_global_index=false, filter_before_indexback[false], 
      range_key([T2_PART.__pk_increment]), range(MIN ; MAX)always true, 
      pushdown_aggregation([T_FUN_SUM(T2_PART.B)])
merge/*+use_px*/ into t1_part using t2_part on (t1_part.a = t2_part.a) when matched then update set t1_part.b = (select sum(b) from t2_part where t2_part.d = t1_part.d) where t1_part.c = 2;
select * from t1_part;
+------+------+------+------+
| A    | B    | C    | D    |
+------+------+------+------+
|    1 |    1 |    1 |    1 |
|    2 |    2 |    2 |    2 |
|    3 |    1 |    3 |    3 |
|    4 |    1 |    4 |    4 |
|    5 |    1 |    5 |    5 |
|    6 |    1 |    6 |    6 |
+------+------+------+------+

explain basic merge/*+use_px*/ into t1_part using t2_part on (t1_part.a = t2_part.a) when not matched then insert (t1_part.a,t1_part.b,t1_part.c,t1_part.d) values (6,6,6,(select sum(t2_part.d) from t2_part)) where t2_part.c = 1;
Query Plan
===================================================
|ID|OPERATOR                             |NAME    |
---------------------------------------------------
|0 |DISTRIBUTED MERGE                    |        |
|1 |└─SUBPLAN FILTER                     |        |
|2 |  ├─PX COORDINATOR                   |        |
|3 |  │ └─EXCHANGE OUT DISTR             |:EX10001|
|4 |  │   └─HASH OUTER JOIN              |        |
|5 |  │     ├─EXCHANGE IN DISTR          |        |
|6 |  │     │ └─EXCHANGE OUT DISTR (PKEY)|:EX10000|
|7 |  │     │   └─PX PARTITION ITERATOR  |        |
|8 |  │     │     └─TABLE FULL SCAN      |T2_PART |
|9 |  │     └─PX PARTITION ITERATOR      |        |
|10|  │       └─TABLE FULL SCAN          |T1_PART |
|11|  └─SCALAR GROUP BY                  |        |
|12|    └─PX COORDINATOR                 |        |
|13|      └─EXCHANGE OUT DISTR           |:EX20000|
|14|        └─MERGE GROUP BY             |        |
|15|          └─PX PARTITION ITERATOR    |        |
|16|            └─TABLE FULL SCAN        |T2_PART |
===================================================
Outputs & filters:
-------------------------------------
  0 - output(nil), filter(nil)
      columns([{T1_PART: ({T1_PART: (T1_PART.__pk_increment, T1_PART.A, T1_PART.B, T1_PART.C, T1_PART.D)})}]), partitions(p3), 
      column_values([T_HIDDEN_PK], [column_conv(NUMBER,PS:(-1,0),NULL,6)], [column_conv(NUMBER,PS:(-1,0),NULL,6)], [column_conv(NUMBER,PS:(-1,0),NULL,6)],
       [column_conv(NUMBER,PS:(-1,0),NULL,CASE WHEN T2_PART.C = 1 THEN :0 ELSE NULL END)]), 
      insert_conds([T2_PART.C = 1]), update_conds(nil), delete_conds(nil)
  1 - output([T1_PART.__pk_increment], [T1_PART.A], [T1_PART.B], [T1_PART.C], [T1_PART.D], [T2_PART.C = 1], [:0]), filter(nil), rowset=16
      exec_params_(nil), onetime_exprs_([subquery(1)(:0)]), init_plan_idxs_(nil), use_batch=false
  2 - output([T1_PART.__pk_increment], [T1_PART.A], [T1_PART.B], [T1_PART.C], [T1_PART.D], [T2_PART.C]), filter(nil), rowset=16
  3 - output([T1_PART.__pk_increment], [T1_PART.A], [T1_PART.B], [T1_PART.C], [T1_PART.D], [T2_PART.C]), filter(nil), rowset=16
      dop=1
  4 - output([T1_PART.__pk_increment], [T1_PART.A], [T1_PART.B], [T1_PART.C], [T1_PART.D], [T2_PART.C]), filter(nil), rowset=16
      equal_conds([T1_PART.A = T2_PART.A]), other_conds(nil)
  5 - output([T2_PART.A], [T2_PART.C]), filter(nil), rowset=16
  6 - output([T2_PART.A], [T2_PART.C]), filter(nil), rowset=16
      (#keys=1, [T2_PART.A]), dop=1
  7 - output([T2_PART.A], [T2_PART.C]), filter(nil), rowset=16
      force partition granule
  8 - output([T2_PART.A], [T2_PART.C]), filter(nil), rowset=16
      access([T2_PART.A], [T2_PART.C]), partitions(p[0-3])
      is_index_back=false, is_global_index=false, 
      range_key([T2_PART.__pk_increment]), range(MIN ; MAX)always true
  9 - output([T1_PART.__pk_increment], [T1_PART.A], [T1_PART.B], [T1_PART.C], [T1_PART.D]), filter(nil), rowset=16
      affinitize, force partition granule
 10 - output([T1_PART.__pk_increment], [T1_PART.A], [T1_PART.B], [T1_PART.C], [T1_PART.D]), filter(nil), rowset=16
      access([T1_PART.__pk_increment], [T1_PART.A], [T1_PART.B], [T1_PART.C], [T1_PART.D]), partitions(p[0-3])
      is_index_back=false, is_global_index=false, 
      range_key([T1_PART.__pk_increment]), range(MIN ; MAX)always true
 11 - output([T_FUN_SUM(T_FUN_SUM(T_FUN_SUM(T2_PART.D)))]), filter(nil), rowset=16
      group(nil), agg_func([T_FUN_SUM(T_FUN_SUM(T_FUN_SUM(T2_PART.D)))])
 12 - output([T_FUN_SUM(T_FUN_SUM(T2_PART.D))]), filter(nil), rowset=16
 13 - output([T_FUN_SUM(T_FUN_SUM(T2_PART.D))]), filter(nil), rowset=16
      dop=1
 14 - output([T_FUN_SUM(T_FUN_SUM(T2_PART.D))]), filter(nil), rowset=16
      group(nil), agg_func([T_FUN_SUM(T_FUN_SUM(T2_PART.D))])
 15 - output([T_FUN_SUM(T2_PART.D)]), filter(nil), rowset=16
      force partition granule
 16 - output([T_FUN_SUM(T2_PART.D)]), filter(nil), rowset=16
      access([T2_PART.D]), partitions(p[0-3])
      is_index_back=false, is_global_index=false, 
      range_key([T2_PART.__pk_increment]), range(MIN ; MAX)always true, 
      pushdown_aggregation([T_FUN_SUM(T2_PART.D)])
merge/*+use_px*/ into t1_part using t2_part on (t1_part.a = t2_part.a) when not matched then insert (t1_part.a,t1_part.b,t1_part.c,t1_part.d) values (6,6,6,(select sum(t2_part.d) from t2_part)) where t2_part.c = 1;
select * from t1_part;
+------+------+------+------+
| A    | B    | C    | D    |
+------+------+------+------+
|    1 |    1 |    1 |    1 |
|    2 |    2 |    2 |    2 |
|    3 |    1 |    3 |    3 |
|    4 |    1 |    4 |    4 |
|    5 |    1 |    5 |    5 |
|    6 |    1 |    6 |    6 |
+------+------+------+------+

explain basic merge/*+use_px*/ into t1_part using t2_part on (t1_part.a = t2_part.a) when matched then update set t1_part.b = (select sum(b) from t2_part where t2_part.d = t1_part.d) where t1_part.c = 2 when not matched then insert (t1_part.a,t1_part.b,t1_part.c,t1_part.d) values (6,6,6,(select sum(t2_part.d) from t2_part)) where t2_part.c = 1;
Query Plan
=====================================================
|ID|OPERATOR                               |NAME    |
-----------------------------------------------------
|0 |DISTRIBUTED MERGE                      |        |
|1 |└─SUBPLAN FILTER                       |        |
|2 |  ├─PX COORDINATOR                     |        |
|3 |  │ └─EXCHANGE OUT DISTR               |:EX10001|
|4 |  │   └─SUBPLAN FILTER                 |        |
|5 |  │     ├─HASH OUTER JOIN              |        |
|6 |  │     │ ├─EXCHANGE IN DISTR          |        |
|7 |  │     │ │ └─EXCHANGE OUT DISTR (PKEY)|:EX10000|
|8 |  │     │ │   └─PX PARTITION ITERATOR  |        |
|9 |  │     │ │     └─TABLE FULL SCAN      |T2_PART |
|10|  │     │ └─PX PARTITION ITERATOR      |        |
|11|  │     │   └─TABLE FULL SCAN          |T1_PART |
|12|  │     └─SCALAR GROUP BY              |        |
|13|  │       └─DISTRIBUTED TABLE FULL SCAN|T2_PART |
|14|  └─SCALAR GROUP BY                    |        |
|15|    └─PX COORDINATOR                   |        |
|16|      └─EXCHANGE OUT DISTR             |:EX20000|
|17|        └─MERGE GROUP BY               |        |
|18|          └─PX PARTITION ITERATOR      |        |
|19|            └─TABLE FULL SCAN          |T2_PART |
=====================================================
Outputs & filters:
-------------------------------------
  0 - output(nil), filter(nil)
      columns([{T1_PART: ({T1_PART: (T1_PART.__pk_increment, T1_PART.A, T1_PART.B, T1_PART.C, T1_PART.D)})}]), partitions(p3), 
      column_values([T_HIDDEN_PK], [column_conv(NUMBER,PS:(-1,0),NULL,6)], [column_conv(NUMBER,PS:(-1,0),NULL,6)], [column_conv(NUMBER,PS:(-1,0),NULL,6)],
       [column_conv(NUMBER,PS:(-1,0),NULL,CASE WHEN T2_PART.C = 1 THEN :1 ELSE NULL END)]),
      update([T1_PART.B=CASE WHEN T1_PART.__pk_increment IS NOT NULL AND T1_PART.C = 2 THEN column_conv(NUMBER,PS:(-1,0),NULL,subquery(1)) ELSE cast(NULL,
       NUMBER(-1, 0)) END]), 
      insert_conds([T2_PART.C = 1]), update_conds([T1_PART.C = 2]), delete_conds(nil)
  1 - output([T1_PART.__pk_increment], [T1_PART.A], [T1_PART.B], [T1_PART.C], [T1_PART.D], [T2_PART.C = 1], [:1], [subquery(1)]), filter(nil), rowset=16
      exec_params_(nil), onetime_exprs_([subquery(1)(:1)]), init_plan_idxs_(nil), use_batch=false
  2 - output([T1_PART.__pk_increment], [T1_PART.A], [T1_PART.B], [T1_PART.C], [T1_PART.D], [subquery(1)], [T2_PART.C]), filter(nil), rowset=16
  3 - output([T1_PART.__pk_increment], [T1_PART.A], [T1_PART.B], [T1_PART.C], [T1_PART.D], [subquery(1)], [T2_PART.C]), filter(nil), rowset=16
      dop=1
  4 - output([T1_PART.__pk_increment], [T1_PART.A], [T1_PART.B], [T1_PART.C], [T1_PART.D], [subquery(1)], [T2_PART.C]), filter(nil), rowset=16
      exec_params_([T1_PART.D(:0)]), onetime_exprs_(nil), init_plan_idxs_(nil), use_batch=false
  5 - output([T1_PART.__pk_increment], [T1_PART.A], [T1_PART.B], [T1_PART.C], [T1_PART.D], [T2_PART.C]), filter(nil), rowset=16
      equal_conds([T1_PART.A = T2_PART.A]), other_conds(nil)
  6 - output([T2_PART.A], [T2_PART.C]), filter(nil), rowset=16
  7 - output([T2_PART.A], [T2_PART.C]), filter(nil), rowset=16
      (#keys=1, [T2_PART.A]), dop=1
  8 - output([T2_PART.A], [T2_PART.C]), filter(nil), rowset=16
      force partition granule
  9 - output([T2_PART.A], [T2_PART.C]), filter(nil), rowset=16
      access([T2_PART.A], [T2_PART.C]), partitions(p[0-3])
      is_index_back=false, is_global_index=false, 
      range_key([T2_PART.__pk_increment]), range(MIN ; MAX)always true
 10 - output([T1_PART.__pk_increment], [T1_PART.A], [T1_PART.B], [T1_PART.C], [T1_PART.D]), filter(nil), rowset=16
      affinitize, force partition granule
 11 - output([T1_PART.__pk_increment], [T1_PART.A], [T1_PART.B], [T1_PART.C], [T1_PART.D]), filter(nil), rowset=16
      access([T1_PART.__pk_increment], [T1_PART.A], [T1_PART.B], [T1_PART.C], [T1_PART.D]), partitions(p[0-3])
      is_index_back=false, is_global_index=false, 
      range_key([T1_PART.__pk_increment]), range(MIN ; MAX)always true
 12 - output([T_FUN_SUM(T_FUN_SUM(T2_PART.B))]), filter(nil), rowset=16
      group(nil), agg_func([T_FUN_SUM(T_FUN_SUM(T2_PART.B))])
 13 - output([T_FUN_SUM(T2_PART.B)]), filter([T2_PART.D = :0]), rowset=16
      access([T2_PART.B], [T2_PART.D]), partitions(p[0-3])
      is_index_back=false, is_global_index=false, filter_before_indexback[false], 
      range_key([T2_PART.__pk_increment]), range(MIN ; MAX)always true, 
      pushdown_aggregation([T_FUN_SUM(T2_PART.B)])
 14 - output([T_FUN_SUM(T_FUN_SUM(T_FUN_SUM(T2_PART.D)))]), filter(nil), rowset=16
      group(nil), agg_func([T_FUN_SUM(T_FUN_SUM(T_FUN_SUM(T2_PART.D)))])
 15 - output([T_FUN_SUM(T_FUN_SUM(T2_PART.D))]), filter(nil), rowset=16
 16 - output([T_FUN_SUM(T_FUN_SUM(T2_PART.D))]), filter(nil), rowset=16
      dop=1
 17 - output([T_FUN_SUM(T_FUN_SUM(T2_PART.D))]), filter(nil), rowset=16
      group(nil), agg_func([T_FUN_SUM(T_FUN_SUM(T2_PART.D))])
 18 - output([T_FUN_SUM(T2_PART.D)]), filter(nil), rowset=16
      force partition granule
 19 - output([T_FUN_SUM(T2_PART.D)]), filter(nil), rowset=16
      access([T2_PART.D]), partitions(p[0-3])
      is_index_back=false, is_global_index=false, 
      range_key([T2_PART.__pk_increment]), range(MIN ; MAX)always true, 
      pushdown_aggregation([T_FUN_SUM(T2_PART.D)])
merge/*+use_px*/ into t1_part using t2_part on (t1_part.a = t2_part.a) when matched then update set t1_part.b = (select sum(b) from t2_part where t2_part.d = t1_part.d) where t1_part.c = 2 when not matched then insert (t1_part.a,t1_part.b,t1_part.c,t1_part.d) values (6,6,6,(select sum(t2_part.d) from t2_part)) where t2_part.c = 1;
select * from t1_part;
+------+------+------+------+
| A    | B    | C    | D    |
+------+------+------+------+
|    1 |    1 |    1 |    1 |
|    2 |    2 |    2 |    2 |
|    3 |    1 |    3 |    3 |
|    4 |    1 |    4 |    4 |
|    5 |    1 |    5 |    5 |
|    6 |    1 |    6 |    6 |
+------+------+------+------+

####test subquery in delete condition
explain basic merge/*+use_px*/ into t1_part using t2_part on (t1_part.a = t2_part.a) when matched then update set t1_part.b = 1 where t1_part.c = 1 delete where exists(select 1 from t2_part where t1_part.d = t2_part.d);
Query Plan
===================================================
|ID|OPERATOR                             |NAME    |
---------------------------------------------------
|0 |DISTRIBUTED MERGE                    |        |
|1 |└─PX COORDINATOR                     |        |
|2 |  └─EXCHANGE OUT DISTR               |:EX10001|
|3 |    └─SUBPLAN FILTER                 |        |
|4 |      ├─HASH JOIN                    |        |
|5 |      │ ├─PX PARTITION ITERATOR      |        |
|6 |      │ │ └─TABLE FULL SCAN          |T1_PART |
|7 |      │ └─EXCHANGE IN DISTR          |        |
|8 |      │   └─EXCHANGE OUT DISTR (PKEY)|:EX10000|
|9 |      │     └─PX PARTITION ITERATOR  |        |
|10|      │       └─TABLE FULL SCAN      |T2_PART |
|11|      └─LIMIT                        |        |
|12|        └─DISTRIBUTED TABLE FULL SCAN|T2_PART |
===================================================
Outputs & filters:
-------------------------------------
  0 - output(nil), filter(nil)
      columns([{T1_PART: ({T1_PART: (T1_PART.__pk_increment, T1_PART.A, T1_PART.B, T1_PART.C, T1_PART.D)})}]),
      update([T1_PART.B=column_conv(NUMBER,PS:(-1,0),NULL,1)]), 
      insert_conds(nil), update_conds(nil), delete_conds([T1_PART.__pk_increment IS NOT NULL AND (T_OP_EXISTS, subquery(1))])
  1 - output([T1_PART.__pk_increment], [T1_PART.A], [T1_PART.B], [T1_PART.C], [T1_PART.D], [(T_OP_EXISTS, subquery(1))]), filter(nil), rowset=16
  2 - output([T1_PART.__pk_increment], [T1_PART.A], [T1_PART.B], [T1_PART.C], [T1_PART.D], [(T_OP_EXISTS, subquery(1))]), filter(nil), rowset=16
      dop=1
  3 - output([T1_PART.__pk_increment], [T1_PART.A], [T1_PART.B], [T1_PART.C], [T1_PART.D], [(T_OP_EXISTS, subquery(1))]), filter(nil), rowset=16
      exec_params_([T1_PART.D(:0)]), onetime_exprs_(nil), init_plan_idxs_(nil), use_batch=false
  4 - output([T1_PART.__pk_increment], [T1_PART.A], [T1_PART.B], [T1_PART.C], [T1_PART.D]), filter(nil), rowset=16
      equal_conds([T1_PART.A = T2_PART.A]), other_conds(nil)
  5 - output([T1_PART.__pk_increment], [T1_PART.A], [T1_PART.B], [T1_PART.C], [T1_PART.D]), filter(nil), rowset=16
      affinitize, force partition granule
  6 - output([T1_PART.__pk_increment], [T1_PART.A], [T1_PART.B], [T1_PART.C], [T1_PART.D]), filter([T1_PART.C = 1]), rowset=16
      access([T1_PART.__pk_increment], [T1_PART.A], [T1_PART.B], [T1_PART.C], [T1_PART.D]), partitions(p[0-3])
      is_index_back=false, is_global_index=false, filter_before_indexback[false], 
      range_key([T1_PART.__pk_increment]), range(MIN ; MAX)always true
  7 - output([T2_PART.A]), filter(nil), rowset=16
  8 - output([T2_PART.A]), filter(nil), rowset=16
      (#keys=1, [T2_PART.A]), dop=1
  9 - output([T2_PART.A]), filter(nil), rowset=16
      force partition granule
 10 - output([T2_PART.A]), filter(nil), rowset=16
      access([T2_PART.A]), partitions(p[0-3])
      is_index_back=false, is_global_index=false, 
      range_key([T2_PART.__pk_increment]), range(MIN ; MAX)always true
 11 - output([1]), filter(nil), rowset=16
      limit(1), offset(nil)
 12 - output(nil), filter([:0 = T2_PART.D]), rowset=16
      access([T2_PART.D]), partitions(p[0-3])
      limit(1), offset(nil), is_index_back=false, is_global_index=false, filter_before_indexback[false], 
      range_key([T2_PART.__pk_increment]), range(MIN ; MAX)always true
merge/*+use_px*/ into t1_part using t2_part on (t1_part.a = t2_part.a) when matched then update set t1_part.b = 1 where t1_part.c = 1 delete where exists(select 1 from t2_part where t1_part.d = t2_part.d);
select * from t1_part;
+------+------+------+------+
| A    | B    | C    | D    |
+------+------+------+------+
|    1 |    1 |    1 |    1 |
|    2 |    2 |    2 |    2 |
|    3 |    1 |    3 |    3 |
|    4 |    1 |    4 |    4 |
|    5 |    1 |    5 |    5 |
|    6 |    1 |    6 |    6 |
+------+------+------+------+

explain basic merge/*+use_px*/ into t1_part using t2_part on (t1_part.a = t2_part.a) when matched then update set t1_part.b = 1 where t1_part.c = 1 delete where exists(select 1 from t2_part where t1_part.b = t2_part.b);
Query Plan
===================================================
|ID|OPERATOR                             |NAME    |
---------------------------------------------------
|0 |DISTRIBUTED MERGE                    |        |
|1 |└─SUBPLAN FILTER                     |        |
|2 |  ├─PX COORDINATOR                   |        |
|3 |  │ └─EXCHANGE OUT DISTR             |:EX10001|
|4 |  │   └─HASH JOIN                    |        |
|5 |  │     ├─PX PARTITION ITERATOR      |        |
|6 |  │     │ └─TABLE FULL SCAN          |T1_PART |
|7 |  │     └─EXCHANGE IN DISTR          |        |
|8 |  │       └─EXCHANGE OUT DISTR (PKEY)|:EX10000|
|9 |  │         └─PX PARTITION ITERATOR  |        |
|10|  │           └─TABLE FULL SCAN      |T2_PART |
|11|  └─TABLE FULL SCAN                  |T2_PART |
===================================================
Outputs & filters:
-------------------------------------
  0 - output(nil), filter(nil)
      columns([{T1_PART: ({T1_PART: (T1_PART.__pk_increment, T1_PART.A, T1_PART.B, T1_PART.C, T1_PART.D)})}]),
      update([T1_PART.B=column_conv(NUMBER,PS:(-1,0),NULL,1)]), 
      insert_conds(nil), update_conds(nil), delete_conds([T1_PART.__pk_increment IS NOT NULL AND :0])
  1 - output([T1_PART.__pk_increment], [T1_PART.A], [T1_PART.B], [T1_PART.C], [T1_PART.D], [:0]), filter(nil), rowset=16
      exec_params_(nil), onetime_exprs_([(T_OP_EXISTS, subquery(1))(:0)]), init_plan_idxs_(nil), use_batch=false
  2 - output([T1_PART.__pk_increment], [T1_PART.A], [T1_PART.B], [T1_PART.C], [T1_PART.D]), filter(nil), rowset=16
  3 - output([T1_PART.__pk_increment], [T1_PART.A], [T1_PART.B], [T1_PART.C], [T1_PART.D]), filter(nil), rowset=16
      dop=1
  4 - output([T1_PART.__pk_increment], [T1_PART.A], [T1_PART.B], [T1_PART.C], [T1_PART.D]), filter(nil), rowset=16
      equal_conds([T1_PART.A = T2_PART.A]), other_conds(nil)
  5 - output([T1_PART.__pk_increment], [T1_PART.A], [T1_PART.B], [T1_PART.C], [T1_PART.D]), filter(nil), rowset=16
      affinitize, force partition granule
  6 - output([T1_PART.__pk_increment], [T1_PART.A], [T1_PART.B], [T1_PART.C], [T1_PART.D]), filter([T1_PART.C = 1]), rowset=16
      access([T1_PART.__pk_increment], [T1_PART.A], [T1_PART.B], [T1_PART.C], [T1_PART.D]), partitions(p[0-3])
      is_index_back=false, is_global_index=false, filter_before_indexback[false], 
      range_key([T1_PART.__pk_increment]), range(MIN ; MAX)always true
  7 - output([T2_PART.A]), filter(nil), rowset=16
  8 - output([T2_PART.A]), filter(nil), rowset=16
      (#keys=1, [T2_PART.A]), dop=1
  9 - output([T2_PART.A]), filter(nil), rowset=16
      force partition granule
 10 - output([T2_PART.A]), filter(nil), rowset=16
      access([T2_PART.A]), partitions(p[0-3])
      is_index_back=false, is_global_index=false, 
      range_key([T2_PART.__pk_increment]), range(MIN ; MAX)always true
 11 - output([1]), filter([column_conv(NUMBER,PS:(-1,0),NULL,1) = T2_PART.B]), rowset=16
      access([T2_PART.B]), partitions(p1)
      limit(1), offset(nil), is_index_back=false, is_global_index=false, filter_before_indexback[false], 
      range_key([T2_PART.__pk_increment]), range(MIN ; MAX)always true
merge into/*+use_px*/ t1_part using t2_part on (t1_part.a = t2_part.a) when matched then update set t1_part.b = 1 where t1_part.c = 1 delete where exists(select 1 from t2_part where t1_part.b = t2_part.b);
select * from t1_part;
+------+------+------+------+
| A    | B    | C    | D    |
+------+------+------+------+
|    1 |    1 |    1 |    1 |
|    2 |    2 |    2 |    2 |
|    3 |    1 |    3 |    3 |
|    4 |    1 |    4 |    4 |
|    5 |    1 |    5 |    5 |
|    6 |    1 |    6 |    6 |
+------+------+------+------+

explain basic merge/*+use_px*/ into t1_part using t2_part on (t1_part.a = t2_part.a) when matched then update set t1_part.b = t1_part.b+1 where t1_part.c = 1 delete where exists(select 1 from t2_part where t1_part.b = t2_part.b);
Query Plan
===================================================
|ID|OPERATOR                             |NAME    |
---------------------------------------------------
|0 |DISTRIBUTED MERGE                    |        |
|1 |└─PX COORDINATOR                     |        |
|2 |  └─EXCHANGE OUT DISTR               |:EX10001|
|3 |    └─SUBPLAN FILTER                 |        |
|4 |      ├─HASH JOIN                    |        |
|5 |      │ ├─PX PARTITION ITERATOR      |        |
|6 |      │ │ └─TABLE FULL SCAN          |T1_PART |
|7 |      │ └─EXCHANGE IN DISTR          |        |
|8 |      │   └─EXCHANGE OUT DISTR (PKEY)|:EX10000|
|9 |      │     └─PX PARTITION ITERATOR  |        |
|10|      │       └─TABLE FULL SCAN      |T2_PART |
|11|      └─LIMIT                        |        |
|12|        └─DISTRIBUTED TABLE FULL SCAN|T2_PART |
===================================================
Outputs & filters:
-------------------------------------
  0 - output(nil), filter(nil)
      columns([{T1_PART: ({T1_PART: (T1_PART.__pk_increment, T1_PART.A, T1_PART.B, T1_PART.C, T1_PART.D)})}]),
      update([T1_PART.B=column_conv(NUMBER,PS:(-1,0),NULL,T1_PART.B + 1)]), 
      insert_conds(nil), update_conds(nil), delete_conds([T1_PART.__pk_increment IS NOT NULL AND (T_OP_EXISTS, subquery(1))])
  1 - output([T1_PART.__pk_increment], [T1_PART.A], [T1_PART.B], [T1_PART.C], [T1_PART.D], [column_conv(NUMBER,PS:(-1,0),NULL,T1_PART.B + 1)], [(T_OP_EXISTS,
       subquery(1))]), filter(nil), rowset=16
  2 - output([T1_PART.__pk_increment], [T1_PART.A], [T1_PART.B], [T1_PART.C], [T1_PART.D], [column_conv(NUMBER,PS:(-1,0),NULL,T1_PART.B + 1)], [(T_OP_EXISTS,
       subquery(1))]), filter(nil), rowset=16
      dop=1
  3 - output([T1_PART.__pk_increment], [T1_PART.A], [T1_PART.B], [T1_PART.C], [T1_PART.D], [column_conv(NUMBER,PS:(-1,0),NULL,T1_PART.B + 1)], [(T_OP_EXISTS,
       subquery(1))]), filter(nil), rowset=16
      exec_params_([column_conv(NUMBER,PS:(-1,0),NULL,T1_PART.B + 1)(:0)]), onetime_exprs_(nil), init_plan_idxs_(nil), use_batch=false
  4 - output([T1_PART.__pk_increment], [T1_PART.A], [T1_PART.B], [T1_PART.C], [T1_PART.D]), filter(nil), rowset=16
      equal_conds([T1_PART.A = T2_PART.A]), other_conds(nil)
  5 - output([T1_PART.__pk_increment], [T1_PART.A], [T1_PART.B], [T1_PART.C], [T1_PART.D]), filter(nil), rowset=16
      affinitize, force partition granule
  6 - output([T1_PART.__pk_increment], [T1_PART.A], [T1_PART.B], [T1_PART.C], [T1_PART.D]), filter([T1_PART.C = 1]), rowset=16
      access([T1_PART.__pk_increment], [T1_PART.A], [T1_PART.B], [T1_PART.C], [T1_PART.D]), partitions(p[0-3])
      is_index_back=false, is_global_index=false, filter_before_indexback[false], 
      range_key([T1_PART.__pk_increment]), range(MIN ; MAX)always true
  7 - output([T2_PART.A]), filter(nil), rowset=16
  8 - output([T2_PART.A]), filter(nil), rowset=16
      (#keys=1, [T2_PART.A]), dop=1
  9 - output([T2_PART.A]), filter(nil), rowset=16
      force partition granule
 10 - output([T2_PART.A]), filter(nil), rowset=16
      access([T2_PART.A]), partitions(p[0-3])
      is_index_back=false, is_global_index=false, 
      range_key([T2_PART.__pk_increment]), range(MIN ; MAX)always true
 11 - output([1]), filter(nil), rowset=16
      limit(1), offset(nil)
 12 - output(nil), filter([:0 = T2_PART.B]), rowset=16
      access([T2_PART.B]), partitions(p[0-3])
      limit(1), offset(nil), is_index_back=false, is_global_index=false, filter_before_indexback[false], 
      range_key([T2_PART.__pk_increment]), range(MIN ; MAX)always true
merge/*+use_px*/ into t1_part using t2_part on (t1_part.a = t2_part.a) when matched then update set t1_part.b = t1_part.b+1 where t1_part.c = 1 delete where exists(select 1 from t2_part where t1_part.b = t2_part.b);
select * from t1_part;
+------+------+------+------+
| A    | B    | C    | D    |
+------+------+------+------+
|    1 |    1 |    1 |    1 |
|    2 |    2 |    2 |    2 |
|    3 |    1 |    3 |    3 |
|    4 |    1 |    4 |    4 |
|    5 |    1 |    5 |    5 |
|    6 |    1 |    6 |    6 |
+------+------+------+------+

### test subquery in all places
explain basic merge/*+use_px*/ into t1_part using t2_part on (t1_part.a = t2_part.a) when matched then update set t1_part.c = (select sum(b) from t2_part where t1_part.b = t2_part.b) where exists(select 1 from t2_part where t2_part.b = t1_part.b);
Query Plan
=========================================================
|ID|OPERATOR                                   |NAME    |
---------------------------------------------------------
|0 |DISTRIBUTED MERGE                          |        |
|1 |└─PX COORDINATOR                           |        |
|2 |  └─EXCHANGE OUT DISTR                     |:EX10002|
|3 |    └─SUBPLAN FILTER                       |        |
|4 |      ├─HASH SEMI JOIN                     |        |
|5 |      │ ├─EXCHANGE IN DISTR                |        |
|6 |      │ │ └─EXCHANGE OUT DISTR (PKEY)      |:EX10001|
|7 |      │ │   └─HASH JOIN                    |        |
|8 |      │ │     ├─EXCHANGE IN DISTR          |        |
|9 |      │ │     │ └─EXCHANGE OUT DISTR (PKEY)|:EX10000|
|10|      │ │     │   └─PX PARTITION ITERATOR  |        |
|11|      │ │     │     └─TABLE FULL SCAN      |T2_PART |
|12|      │ │     └─PX PARTITION ITERATOR      |        |
|13|      │ │       └─TABLE FULL SCAN          |T1_PART |
|14|      │ └─SUBPLAN SCAN                     |VIEW1   |
|15|      │   └─PX PARTITION ITERATOR          |        |
|16|      │     └─TABLE FULL SCAN              |T2_PART |
|17|      └─SCALAR GROUP BY                    |        |
|18|        └─DISTRIBUTED TABLE FULL SCAN      |T2_PART |
=========================================================
Outputs & filters:
-------------------------------------
  0 - output(nil), filter(nil)
      columns([{T1_PART: ({T1_PART: (T1_PART.__pk_increment, T1_PART.A, T1_PART.B, T1_PART.C, T1_PART.D)})}]),
      update([T1_PART.C=CASE WHEN T1_PART.__pk_increment IS NOT NULL THEN column_conv(NUMBER,PS:(-1,0),NULL,subquery(1)) ELSE cast(NULL, NUMBER(-1, 0)) 
      END]), 
      insert_conds(nil), update_conds(nil), delete_conds(nil)
  1 - output([T1_PART.__pk_increment], [T1_PART.A], [T1_PART.B], [T1_PART.C], [T1_PART.D], [subquery(1)], [T1_PART.__pk_increment IS NOT NULL]), filter(nil), rowset=16
  2 - output([T1_PART.__pk_increment], [T1_PART.A], [T1_PART.B], [T1_PART.C], [T1_PART.D], [subquery(1)], [T1_PART.__pk_increment IS NOT NULL]), filter(nil), rowset=16
      dop=1
  3 - output([T1_PART.__pk_increment], [T1_PART.A], [T1_PART.B], [T1_PART.C], [T1_PART.D], [subquery(1)], [T1_PART.__pk_increment IS NOT NULL]), filter(nil), rowset=16
      exec_params_([T1_PART.B(:0)]), onetime_exprs_(nil), init_plan_idxs_(nil), use_batch=false
  4 - output([T1_PART.__pk_increment], [T1_PART.A], [T1_PART.B], [T1_PART.C], [T1_PART.D], [T1_PART.__pk_increment IS NOT NULL]), filter(nil), rowset=16
      equal_conds([VIEW1.T2_PART.B = T1_PART.B]), other_conds(nil)
  5 - output([T1_PART.__pk_increment], [T1_PART.A], [T1_PART.B], [T1_PART.C], [T1_PART.D], [T1_PART.__pk_increment IS NOT NULL]), filter(nil), rowset=16
  6 - output([T1_PART.__pk_increment], [T1_PART.A], [T1_PART.B], [T1_PART.C], [T1_PART.D], [T1_PART.__pk_increment IS NOT NULL]), filter(nil), rowset=16
      (#keys=1, [T1_PART.B]), dop=1
  7 - output([T1_PART.__pk_increment], [T1_PART.A], [T1_PART.B], [T1_PART.C], [T1_PART.D], [T1_PART.__pk_increment IS NOT NULL]), filter(nil), rowset=16
      equal_conds([T1_PART.A = T2_PART.A]), other_conds(nil)
  8 - output([T2_PART.A]), filter(nil), rowset=16
  9 - output([T2_PART.A]), filter(nil), rowset=16
      (#keys=1, [T2_PART.A]), dop=1
 10 - output([T2_PART.A]), filter(nil), rowset=16
      force partition granule
 11 - output([T2_PART.A]), filter(nil), rowset=16
      access([T2_PART.A]), partitions(p[0-3])
      is_index_back=false, is_global_index=false, 
      range_key([T2_PART.__pk_increment]), range(MIN ; MAX)always true
 12 - output([T1_PART.__pk_increment], [T1_PART.A], [T1_PART.B], [T1_PART.C], [T1_PART.D], [T1_PART.__pk_increment IS NOT NULL]), filter(nil), rowset=16
      affinitize, force partition granule
 13 - output([T1_PART.__pk_increment], [T1_PART.A], [T1_PART.B], [T1_PART.C], [T1_PART.D], [T1_PART.__pk_increment IS NOT NULL]), filter([T1_PART.__pk_increment 
      IS NOT NULL]), rowset=16
      access([T1_PART.__pk_increment], [T1_PART.A], [T1_PART.B], [T1_PART.C], [T1_PART.D]), partitions(p[0-3])
      is_index_back=false, is_global_index=false, filter_before_indexback[false], 
      range_key([T1_PART.__pk_increment]), range(MIN ; MAX)always true
 14 - output([VIEW1.T2_PART.B]), filter(nil), rowset=16
      access([VIEW1.T2_PART.B])
 15 - output([T2_PART.B]), filter(nil), rowset=16
      affinitize, force partition granule
 16 - output([T2_PART.B]), filter(nil), rowset=16
      access([T2_PART.B]), partitions(p[0-3])
      is_index_back=false, is_global_index=false, 
      range_key([T2_PART.__pk_increment]), range(MIN ; MAX)always true
 17 - output([T_FUN_SUM(T_FUN_SUM(T2_PART.B))]), filter(nil), rowset=16
      group(nil), agg_func([T_FUN_SUM(T_FUN_SUM(T2_PART.B))])
 18 - output([T_FUN_SUM(T2_PART.B)]), filter([:0 = T2_PART.B]), rowset=16
      access([T2_PART.B]), partitions(p[0-3])
      is_index_back=false, is_global_index=false, filter_before_indexback[false], 
      range_key([T2_PART.__pk_increment]), range(MIN ; MAX)always true, 
      pushdown_aggregation([T_FUN_SUM(T2_PART.B)])
merge/*+use_px*/ into t1_part using t2_part on (t1_part.a = t2_part.a) when matched then update set t1_part.c = (select sum(b) from t2_part where t1_part.b = t2_part.b) where exists(select 1 from t2_part where t2_part.b = t1_part.b);
select * from t1_part;
+------+------+------+------+
| A    | B    | C    | D    |
+------+------+------+------+
|    1 |    1 |    1 |    1 |
|    2 |    2 |    2 |    2 |
|    3 |    1 |    3 |    3 |
|    4 |    1 |    4 |    4 |
|    5 |    1 |    5 |    5 |
|    6 |    1 |    6 |    6 |
+------+------+------+------+

explain basic merge/*+use_px*/ into t1_part using t2_part on (t1_part.a = t2_part.a) when matched then update set t1_part.c = (select sum(b) from t2_part) where exists(select 1 from t2_part);
Query Plan
=====================================================
|ID|OPERATOR                               |NAME    |
-----------------------------------------------------
|0 |DISTRIBUTED MERGE                      |        |
|1 |└─SUBPLAN FILTER                       |        |
|2 |  ├─SUBPLAN FILTER                     |        |
|3 |  │ ├─PX COORDINATOR                   |        |
|4 |  │ │ └─EXCHANGE OUT DISTR             |:EX10001|
|5 |  │ │   └─HASH JOIN                    |        |
|6 |  │ │     ├─EXCHANGE IN DISTR          |        |
|7 |  │ │     │ └─EXCHANGE OUT DISTR (PKEY)|:EX10000|
|8 |  │ │     │   └─PX PARTITION ITERATOR  |        |
|9 |  │ │     │     └─TABLE FULL SCAN      |T2_PART |
|10|  │ │     └─PX PARTITION ITERATOR      |        |
|11|  │ │       └─TABLE FULL SCAN          |T1_PART |
|12|  │ └─LIMIT                            |        |
|13|  │   └─PX COORDINATOR                 |        |
|14|  │     └─EXCHANGE OUT DISTR           |:EX20000|
|15|  │       └─LIMIT                      |        |
|16|  │         └─PX PARTITION ITERATOR    |        |
|17|  │           └─TABLE FULL SCAN        |T2_PART |
|18|  └─SCALAR GROUP BY                    |        |
|19|    └─PX COORDINATOR                   |        |
|20|      └─EXCHANGE OUT DISTR             |:EX30000|
|21|        └─MERGE GROUP BY               |        |
|22|          └─PX PARTITION ITERATOR      |        |
|23|            └─TABLE FULL SCAN          |T2_PART |
=====================================================
Outputs & filters:
-------------------------------------
  0 - output(nil), filter(nil)
      columns([{T1_PART: ({T1_PART: (T1_PART.__pk_increment, T1_PART.A, T1_PART.B, T1_PART.C, T1_PART.D)})}]),
      update([T1_PART.C=CASE WHEN T1_PART.__pk_increment IS NOT NULL THEN column_conv(NUMBER,PS:(-1,0),NULL,:1) ELSE cast(NULL, NUMBER(-1, 0)) END]), 
      insert_conds(nil), update_conds(nil), delete_conds(nil)
  1 - output([T1_PART.__pk_increment], [T1_PART.A], [T1_PART.B], [T1_PART.C], [T1_PART.D], [:1], [T1_PART.__pk_increment IS NOT NULL]), filter(nil), rowset=16
      exec_params_(nil), onetime_exprs_([subquery(1)(:1)]), init_plan_idxs_(nil), use_batch=false
  2 - output([T1_PART.__pk_increment], [T1_PART.A], [T1_PART.B], [T1_PART.C], [T1_PART.D], [T1_PART.__pk_increment IS NOT NULL]), filter(nil), rowset=16
      exec_params_(nil), onetime_exprs_([(T_OP_EXISTS, subquery(1))(:0)]), init_plan_idxs_(nil), use_batch=false
  3 - output([T1_PART.__pk_increment], [T1_PART.A], [T1_PART.B], [T1_PART.C], [T1_PART.D], [T1_PART.__pk_increment IS NOT NULL]), filter(nil), startup_filter([:0]), rowset=16
  4 - output([T1_PART.__pk_increment], [T1_PART.A], [T1_PART.B], [T1_PART.C], [T1_PART.D], [T1_PART.__pk_increment IS NOT NULL]), filter(nil), rowset=16
      dop=1
  5 - output([T1_PART.__pk_increment], [T1_PART.A], [T1_PART.B], [T1_PART.C], [T1_PART.D], [T1_PART.__pk_increment IS NOT NULL]), filter(nil), rowset=16
      equal_conds([T1_PART.A = T2_PART.A]), other_conds(nil)
  6 - output([T2_PART.A]), filter(nil), rowset=16
  7 - output([T2_PART.A]), filter(nil), rowset=16
      (#keys=1, [T2_PART.A]), dop=1
  8 - output([T2_PART.A]), filter(nil), rowset=16
      force partition granule
  9 - output([T2_PART.A]), filter(nil), rowset=16
      access([T2_PART.A]), partitions(p[0-3])
      is_index_back=false, is_global_index=false, 
      range_key([T2_PART.__pk_increment]), range(MIN ; MAX)always true
 10 - output([T1_PART.__pk_increment], [T1_PART.A], [T1_PART.B], [T1_PART.C], [T1_PART.D], [T1_PART.__pk_increment IS NOT NULL]), filter(nil), rowset=16
      affinitize, force partition granule
 11 - output([T1_PART.__pk_increment], [T1_PART.A], [T1_PART.B], [T1_PART.C], [T1_PART.D], [T1_PART.__pk_increment IS NOT NULL]), filter([T1_PART.__pk_increment 
      IS NOT NULL]), rowset=16
      access([T1_PART.__pk_increment], [T1_PART.A], [T1_PART.B], [T1_PART.C], [T1_PART.D]), partitions(p[0-3])
      is_index_back=false, is_global_index=false, filter_before_indexback[false], 
      range_key([T1_PART.__pk_increment]), range(MIN ; MAX)always true
 12 - output([1]), filter(nil), rowset=16
      limit(1), offset(nil)
 13 - output(nil), filter(nil), rowset=16
 14 - output(nil), filter(nil), rowset=16
      dop=1
 15 - output(nil), filter(nil), rowset=16
      limit(1), offset(nil)
 16 - output(nil), filter(nil), rowset=16
      force partition granule
 17 - output(nil), filter(nil), rowset=16
      access(nil), partitions(p[0-3])
      limit(1), offset(nil), is_index_back=false, is_global_index=false, 
      range_key([T2_PART.__pk_increment]), range(MIN ; MAX)always true
 18 - output([T_FUN_SUM(T_FUN_SUM(T_FUN_SUM(T2_PART.B)))]), filter(nil), rowset=16
      group(nil), agg_func([T_FUN_SUM(T_FUN_SUM(T_FUN_SUM(T2_PART.B)))])
 19 - output([T_FUN_SUM(T_FUN_SUM(T2_PART.B))]), filter(nil), rowset=16
 20 - output([T_FUN_SUM(T_FUN_SUM(T2_PART.B))]), filter(nil), rowset=16
      dop=1
 21 - output([T_FUN_SUM(T_FUN_SUM(T2_PART.B))]), filter(nil), rowset=16
      group(nil), agg_func([T_FUN_SUM(T_FUN_SUM(T2_PART.B))])
 22 - output([T_FUN_SUM(T2_PART.B)]), filter(nil), rowset=16
      force partition granule
 23 - output([T_FUN_SUM(T2_PART.B)]), filter(nil), rowset=16
      access([T2_PART.B]), partitions(p[0-3])
      is_index_back=false, is_global_index=false, 
      range_key([T2_PART.__pk_increment]), range(MIN ; MAX)always true, 
      pushdown_aggregation([T_FUN_SUM(T2_PART.B)])
merge/*+use_px*/ into t1_part using t2_part on (t1_part.a = t2_part.a) when matched then update set t1_part.c = (select sum(b) from t2_part) where exists(select 1 from t2_part);
select * from t1_part;
+------+------+------+------+
| A    | B    | C    | D    |
+------+------+------+------+
|    1 |    1 |    1 |    1 |
|    2 |    2 |   20 |    2 |
|    3 |    1 |   20 |    3 |
|    4 |    1 |   20 |    4 |
|    5 |    1 |   20 |    5 |
|    6 |    1 |   20 |    6 |
+------+------+------+------+

explain basic merge/*+use_px*/ into t1_part using t2_part on (t1_part.a = t2_part.a) when matched then update set t1_part.c = (select sum(b) from t2_part where t1_part.b = t2_part.b) where exists(select 1 from t2_part where t2_part.b = t1_part.b) delete where exists(select 1 from t2_part where t2_part.b = t1_part.b);
Query Plan
===========================================================
|ID|OPERATOR                                     |NAME    |
-----------------------------------------------------------
|0 |DISTRIBUTED MERGE                            |        |
|1 |└─PX COORDINATOR                             |        |
|2 |  └─EXCHANGE OUT DISTR                       |:EX10002|
|3 |    └─SUBPLAN FILTER                         |        |
|4 |      ├─SUBPLAN FILTER                       |        |
|5 |      │ ├─HASH SEMI JOIN                     |        |
|6 |      │ │ ├─EXCHANGE IN DISTR                |        |
|7 |      │ │ │ └─EXCHANGE OUT DISTR (PKEY)      |:EX10001|
|8 |      │ │ │   └─HASH JOIN                    |        |
|9 |      │ │ │     ├─EXCHANGE IN DISTR          |        |
|10|      │ │ │     │ └─EXCHANGE OUT DISTR (PKEY)|:EX10000|
|11|      │ │ │     │   └─PX PARTITION ITERATOR  |        |
|12|      │ │ │     │     └─TABLE FULL SCAN      |T2_PART |
|13|      │ │ │     └─PX PARTITION ITERATOR      |        |
|14|      │ │ │       └─TABLE FULL SCAN          |T1_PART |
|15|      │ │ └─SUBPLAN SCAN                     |VIEW1   |
|16|      │ │   └─PX PARTITION ITERATOR          |        |
|17|      │ │     └─TABLE FULL SCAN              |T2_PART |
|18|      │ └─SCALAR GROUP BY                    |        |
|19|      │   └─DISTRIBUTED TABLE FULL SCAN      |T2_PART |
|20|      └─LIMIT                                |        |
|21|        └─DISTRIBUTED TABLE FULL SCAN        |T2_PART |
===========================================================
Outputs & filters:
-------------------------------------
  0 - output(nil), filter(nil)
      columns([{T1_PART: ({T1_PART: (T1_PART.__pk_increment, T1_PART.A, T1_PART.B, T1_PART.C, T1_PART.D)})}]),
      update([T1_PART.C=CASE WHEN T1_PART.__pk_increment IS NOT NULL THEN column_conv(NUMBER,PS:(-1,0),NULL,subquery(1)) ELSE cast(NULL, NUMBER(-1, 0)) 
      END]), 
      insert_conds(nil), update_conds(nil), delete_conds([T1_PART.__pk_increment IS NOT NULL AND (T_OP_EXISTS, subquery(1))])
  1 - output([T1_PART.__pk_increment], [T1_PART.A], [T1_PART.B], [T1_PART.C], [T1_PART.D], [T1_PART.__pk_increment IS NOT NULL], [(T_OP_EXISTS, subquery(1))],
       [subquery(1)]), filter(nil), rowset=16
  2 - output([T1_PART.__pk_increment], [T1_PART.A], [T1_PART.B], [T1_PART.C], [T1_PART.D], [T1_PART.__pk_increment IS NOT NULL], [(T_OP_EXISTS, subquery(1))],
       [subquery(1)]), filter(nil), rowset=16
      dop=1
  3 - output([T1_PART.__pk_increment], [T1_PART.A], [T1_PART.B], [T1_PART.C], [T1_PART.D], [T1_PART.__pk_increment IS NOT NULL], [(T_OP_EXISTS, subquery(1))],
       [subquery(1)]), filter(nil), rowset=16
      exec_params_([T1_PART.B(:1)]), onetime_exprs_(nil), init_plan_idxs_(nil), use_batch=false
  4 - output([T1_PART.__pk_increment], [T1_PART.A], [T1_PART.B], [T1_PART.C], [T1_PART.D], [T1_PART.__pk_increment IS NOT NULL], [subquery(1)]), filter(nil), rowset=16
      exec_params_([T1_PART.B(:0)]), onetime_exprs_(nil), init_plan_idxs_(nil), use_batch=false
  5 - output([T1_PART.__pk_increment], [T1_PART.A], [T1_PART.B], [T1_PART.C], [T1_PART.D], [T1_PART.__pk_increment IS NOT NULL]), filter(nil), rowset=16
      equal_conds([VIEW1.T2_PART.B = T1_PART.B]), other_conds(nil)
  6 - output([T1_PART.__pk_increment], [T1_PART.A], [T1_PART.B], [T1_PART.C], [T1_PART.D], [T1_PART.__pk_increment IS NOT NULL]), filter(nil), rowset=16
  7 - output([T1_PART.__pk_increment], [T1_PART.A], [T1_PART.B], [T1_PART.C], [T1_PART.D], [T1_PART.__pk_increment IS NOT NULL]), filter(nil), rowset=16
      (#keys=1, [T1_PART.B]), dop=1
  8 - output([T1_PART.__pk_increment], [T1_PART.A], [T1_PART.B], [T1_PART.C], [T1_PART.D], [T1_PART.__pk_increment IS NOT NULL]), filter(nil), rowset=16
      equal_conds([T1_PART.A = T2_PART.A]), other_conds(nil)
  9 - output([T2_PART.A]), filter(nil), rowset=16
 10 - output([T2_PART.A]), filter(nil), rowset=16
      (#keys=1, [T2_PART.A]), dop=1
 11 - output([T2_PART.A]), filter(nil), rowset=16
      force partition granule
 12 - output([T2_PART.A]), filter(nil), rowset=16
      access([T2_PART.A]), partitions(p[0-3])
      is_index_back=false, is_global_index=false, 
      range_key([T2_PART.__pk_increment]), range(MIN ; MAX)always true
 13 - output([T1_PART.__pk_increment], [T1_PART.A], [T1_PART.B], [T1_PART.C], [T1_PART.D], [T1_PART.__pk_increment IS NOT NULL]), filter(nil), rowset=16
      affinitize, force partition granule
 14 - output([T1_PART.__pk_increment], [T1_PART.A], [T1_PART.B], [T1_PART.C], [T1_PART.D], [T1_PART.__pk_increment IS NOT NULL]), filter([T1_PART.__pk_increment 
      IS NOT NULL]), rowset=16
      access([T1_PART.__pk_increment], [T1_PART.A], [T1_PART.B], [T1_PART.C], [T1_PART.D]), partitions(p[0-3])
      is_index_back=false, is_global_index=false, filter_before_indexback[false], 
      range_key([T1_PART.__pk_increment]), range(MIN ; MAX)always true
 15 - output([VIEW1.T2_PART.B]), filter(nil), rowset=16
      access([VIEW1.T2_PART.B])
 16 - output([T2_PART.B]), filter(nil), rowset=16
      affinitize, force partition granule
 17 - output([T2_PART.B]), filter(nil), rowset=16
      access([T2_PART.B]), partitions(p[0-3])
      is_index_back=false, is_global_index=false, 
      range_key([T2_PART.__pk_increment]), range(MIN ; MAX)always true
 18 - output([T_FUN_SUM(T_FUN_SUM(T2_PART.B))]), filter(nil), rowset=16
      group(nil), agg_func([T_FUN_SUM(T_FUN_SUM(T2_PART.B))])
 19 - output([T_FUN_SUM(T2_PART.B)]), filter([:0 = T2_PART.B]), rowset=16
      access([T2_PART.B]), partitions(p[0-3])
      is_index_back=false, is_global_index=false, filter_before_indexback[false], 
      range_key([T2_PART.__pk_increment]), range(MIN ; MAX)always true, 
      pushdown_aggregation([T_FUN_SUM(T2_PART.B)])
 20 - output([1]), filter(nil), rowset=16
      limit(1), offset(nil)
 21 - output(nil), filter([T2_PART.B = :1]), rowset=16
      access([T2_PART.B]), partitions(p[0-3])
      limit(1), offset(nil), is_index_back=false, is_global_index=false, filter_before_indexback[false], 
      range_key([T2_PART.__pk_increment]), range(MIN ; MAX)always true
merge/*+use_px*/ into t1_part using t2_part on (t1_part.a = t2_part.a) when matched then update set t1_part.c = (select sum(b) from t2_part where t1_part.b = t2_part.b) where exists(select 1 from t2_part where t2_part.b = t1_part.b) delete where exists(select 1 from t2_part where t2_part.b = t1_part.b);
select * from t1_part;
+------+------+------+------+
| A    | B    | C    | D    |
+------+------+------+------+
|    1 |    1 |    1 |    1 |
|    3 |    1 |   20 |    3 |
|    4 |    1 |   20 |    4 |
|    5 |    1 |   20 |    5 |
|    6 |    1 |   20 |    6 |
+------+------+------+------+

explain basic merge/*+use_px*/ into t1_part using t2_part on (t1_part.a = t2_part.a) when matched then update set t1_part.c = (select sum(b) from t2_part) where exists(select 1 from t2_part) delete where exists(select 1 from t2_part);
Query Plan
=======================================================
|ID|OPERATOR                                 |NAME    |
-------------------------------------------------------
|0 |DISTRIBUTED MERGE                        |        |
|1 |└─SUBPLAN FILTER                         |        |
|2 |  ├─SUBPLAN FILTER                       |        |
|3 |  │ ├─SUBPLAN FILTER                     |        |
|4 |  │ │ ├─PX COORDINATOR                   |        |
|5 |  │ │ │ └─EXCHANGE OUT DISTR             |:EX10001|
|6 |  │ │ │   └─HASH JOIN                    |        |
|7 |  │ │ │     ├─EXCHANGE IN DISTR          |        |
|8 |  │ │ │     │ └─EXCHANGE OUT DISTR (PKEY)|:EX10000|
|9 |  │ │ │     │   └─PX PARTITION ITERATOR  |        |
|10|  │ │ │     │     └─TABLE FULL SCAN      |T2_PART |
|11|  │ │ │     └─PX PARTITION ITERATOR      |        |
|12|  │ │ │       └─TABLE FULL SCAN          |T1_PART |
|13|  │ │ └─LIMIT                            |        |
|14|  │ │   └─PX COORDINATOR                 |        |
|15|  │ │     └─EXCHANGE OUT DISTR           |:EX20000|
|16|  │ │       └─LIMIT                      |        |
|17|  │ │         └─PX PARTITION ITERATOR    |        |
|18|  │ │           └─TABLE FULL SCAN        |T2_PART |
|19|  │ └─SCALAR GROUP BY                    |        |
|20|  │   └─PX COORDINATOR                   |        |
|21|  │     └─EXCHANGE OUT DISTR             |:EX30000|
|22|  │       └─MERGE GROUP BY               |        |
|23|  │         └─PX PARTITION ITERATOR      |        |
|24|  │           └─TABLE FULL SCAN          |T2_PART |
|25|  └─LIMIT                                |        |
|26|    └─PX COORDINATOR                     |        |
|27|      └─EXCHANGE OUT DISTR               |:EX40000|
|28|        └─LIMIT                          |        |
|29|          └─PX PARTITION ITERATOR        |        |
|30|            └─TABLE FULL SCAN            |T2_PART |
=======================================================
Outputs & filters:
-------------------------------------
  0 - output(nil), filter(nil)
      columns([{T1_PART: ({T1_PART: (T1_PART.__pk_increment, T1_PART.A, T1_PART.B, T1_PART.C, T1_PART.D)})}]),
      update([T1_PART.C=CASE WHEN T1_PART.__pk_increment IS NOT NULL THEN column_conv(NUMBER,PS:(-1,0),NULL,:1) ELSE cast(NULL, NUMBER(-1, 0)) END]), 
      insert_conds(nil), update_conds(nil), delete_conds([T1_PART.__pk_increment IS NOT NULL AND :2])
  1 - output([T1_PART.__pk_increment], [T1_PART.A], [T1_PART.B], [T1_PART.C], [T1_PART.D], [T1_PART.__pk_increment IS NOT NULL], [:2], [:1]), filter(nil), rowset=16
      exec_params_(nil), onetime_exprs_([(T_OP_EXISTS, subquery(1))(:2)]), init_plan_idxs_(nil), use_batch=false
  2 - output([T1_PART.__pk_increment], [T1_PART.A], [T1_PART.B], [T1_PART.C], [T1_PART.D], [T1_PART.__pk_increment IS NOT NULL], [:1]), filter(nil), rowset=16
      exec_params_(nil), onetime_exprs_([subquery(1)(:1)]), init_plan_idxs_(nil), use_batch=false
  3 - output([T1_PART.__pk_increment], [T1_PART.A], [T1_PART.B], [T1_PART.C], [T1_PART.D], [T1_PART.__pk_increment IS NOT NULL]), filter(nil), rowset=16
      exec_params_(nil), onetime_exprs_([(T_OP_EXISTS, subquery(1))(:0)]), init_plan_idxs_(nil), use_batch=false
  4 - output([T1_PART.__pk_increment], [T1_PART.A], [T1_PART.B], [T1_PART.C], [T1_PART.D], [T1_PART.__pk_increment IS NOT NULL]), filter(nil), startup_filter([:0]), rowset=16
  5 - output([T1_PART.__pk_increment], [T1_PART.A], [T1_PART.B], [T1_PART.C], [T1_PART.D], [T1_PART.__pk_increment IS NOT NULL]), filter(nil), rowset=16
      dop=1
  6 - output([T1_PART.__pk_increment], [T1_PART.A], [T1_PART.B], [T1_PART.C], [T1_PART.D], [T1_PART.__pk_increment IS NOT NULL]), filter(nil), rowset=16
      equal_conds([T1_PART.A = T2_PART.A]), other_conds(nil)
  7 - output([T2_PART.A]), filter(nil), rowset=16
  8 - output([T2_PART.A]), filter(nil), rowset=16
      (#keys=1, [T2_PART.A]), dop=1
  9 - output([T2_PART.A]), filter(nil), rowset=16
      force partition granule
 10 - output([T2_PART.A]), filter(nil), rowset=16
      access([T2_PART.A]), partitions(p[0-3])
      is_index_back=false, is_global_index=false, 
      range_key([T2_PART.__pk_increment]), range(MIN ; MAX)always true
 11 - output([T1_PART.__pk_increment], [T1_PART.A], [T1_PART.B], [T1_PART.C], [T1_PART.D], [T1_PART.__pk_increment IS NOT NULL]), filter(nil), rowset=16
      affinitize, force partition granule
 12 - output([T1_PART.__pk_increment], [T1_PART.A], [T1_PART.B], [T1_PART.C], [T1_PART.D], [T1_PART.__pk_increment IS NOT NULL]), filter([T1_PART.__pk_increment 
      IS NOT NULL]), rowset=16
      access([T1_PART.__pk_increment], [T1_PART.A], [T1_PART.B], [T1_PART.C], [T1_PART.D]), partitions(p[0-3])
      is_index_back=false, is_global_index=false, filter_before_indexback[false], 
      range_key([T1_PART.__pk_increment]), range(MIN ; MAX)always true
 13 - output([1]), filter(nil), rowset=16
      limit(1), offset(nil)
 14 - output(nil), filter(nil), rowset=16
 15 - output(nil), filter(nil), rowset=16
      dop=1
 16 - output(nil), filter(nil), rowset=16
      limit(1), offset(nil)
 17 - output(nil), filter(nil), rowset=16
      force partition granule
 18 - output(nil), filter(nil), rowset=16
      access(nil), partitions(p[0-3])
      limit(1), offset(nil), is_index_back=false, is_global_index=false, 
      range_key([T2_PART.__pk_increment]), range(MIN ; MAX)always true
 19 - output([T_FUN_SUM(T_FUN_SUM(T_FUN_SUM(T2_PART.B)))]), filter(nil), rowset=16
      group(nil), agg_func([T_FUN_SUM(T_FUN_SUM(T_FUN_SUM(T2_PART.B)))])
 20 - output([T_FUN_SUM(T_FUN_SUM(T2_PART.B))]), filter(nil), rowset=16
 21 - output([T_FUN_SUM(T_FUN_SUM(T2_PART.B))]), filter(nil), rowset=16
      dop=1
 22 - output([T_FUN_SUM(T_FUN_SUM(T2_PART.B))]), filter(nil), rowset=16
      group(nil), agg_func([T_FUN_SUM(T_FUN_SUM(T2_PART.B))])
 23 - output([T_FUN_SUM(T2_PART.B)]), filter(nil), rowset=16
      force partition granule
 24 - output([T_FUN_SUM(T2_PART.B)]), filter(nil), rowset=16
      access([T2_PART.B]), partitions(p[0-3])
      is_index_back=false, is_global_index=false, 
      range_key([T2_PART.__pk_increment]), range(MIN ; MAX)always true, 
      pushdown_aggregation([T_FUN_SUM(T2_PART.B)])
 25 - output([1]), filter(nil), rowset=16
      limit(1), offset(nil)
 26 - output(nil), filter(nil), rowset=16
 27 - output(nil), filter(nil), rowset=16
      dop=1
 28 - output(nil), filter(nil), rowset=16
      limit(1), offset(nil)
 29 - output(nil), filter(nil), rowset=16
      force partition granule
 30 - output(nil), filter(nil), rowset=16
      access(nil), partitions(p[0-3])
      limit(1), offset(nil), is_index_back=false, is_global_index=false, 
      range_key([T2_PART.__pk_increment]), range(MIN ; MAX)always true
merge/*+use_px*/ into t1_part using t2_part on (t1_part.a = t2_part.a) when matched then update set t1_part.c = (select sum(b) from t2_part) where exists(select 1 from t2_part) delete where exists(select 1 from t2_part);
select * from t1_part;
+------+------+------+------+
| A    | B    | C    | D    |
+------+------+------+------+
|    1 |    1 |    1 |    1 |
+------+------+------+------+

explain basic merge/*+use_px*/ into t1_part using t2_part on (t1_part.a = t2_part.a) when matched then update set t1_part.c = (select sum(b) from t2_part where t2_part.b = t1_part.b) delete where exists(select 1 from t2_part where t1_part.b = t2_part.b) when not matched then insert (t1_part.a,t1_part.b,t1_part.c,t1_part.d) values (7,7,7,(select sum(b) from t2_part));
Query Plan
=======================================================
|ID|OPERATOR                                 |NAME    |
-------------------------------------------------------
|0 |DISTRIBUTED MERGE                        |        |
|1 |└─SUBPLAN FILTER                         |        |
|2 |  ├─SUBPLAN FILTER                       |        |
|3 |  │ ├─PX COORDINATOR                     |        |
|4 |  │ │ └─EXCHANGE OUT DISTR               |:EX10001|
|5 |  │ │   └─SUBPLAN FILTER                 |        |
|6 |  │ │     ├─HASH RIGHT OUTER JOIN        |        |
|7 |  │ │     │ ├─PX PARTITION ITERATOR      |        |
|8 |  │ │     │ │ └─TABLE FULL SCAN          |T1_PART |
|9 |  │ │     │ └─EXCHANGE IN DISTR          |        |
|10|  │ │     │   └─EXCHANGE OUT DISTR (PKEY)|:EX10000|
|11|  │ │     │     └─PX PARTITION ITERATOR  |        |
|12|  │ │     │       └─TABLE FULL SCAN      |T2_PART |
|13|  │ │     └─SCALAR GROUP BY              |        |
|14|  │ │       └─DISTRIBUTED TABLE FULL SCAN|T2_PART |
|15|  │ └─SCALAR GROUP BY                    |        |
|16|  │   └─PX COORDINATOR                   |        |
|17|  │     └─EXCHANGE OUT DISTR             |:EX20000|
|18|  │       └─MERGE GROUP BY               |        |
|19|  │         └─PX PARTITION ITERATOR      |        |
|20|  │           └─TABLE FULL SCAN          |T2_PART |
|21|  └─LIMIT                                |        |
|22|    └─DISTRIBUTED TABLE FULL SCAN        |T2_PART |
=======================================================
Outputs & filters:
-------------------------------------
  0 - output(nil), filter(nil)
      columns([{T1_PART: ({T1_PART: (T1_PART.__pk_increment, T1_PART.A, T1_PART.B, T1_PART.C, T1_PART.D)})}]), partitions(p0), 
      column_values([T_HIDDEN_PK], [column_conv(NUMBER,PS:(-1,0),NULL,7)], [column_conv(NUMBER,PS:(-1,0),NULL,7)], [column_conv(NUMBER,PS:(-1,0),NULL,7)],
       [column_conv(NUMBER,PS:(-1,0),NULL,CASE WHEN T1_PART.__pk_increment IS NULL THEN :2 ELSE NULL END)]),
      update([T1_PART.C=CASE WHEN T1_PART.__pk_increment IS NOT NULL THEN column_conv(NUMBER,PS:(-1,0),NULL,subquery(1)) ELSE cast(NULL, NUMBER(-1, 0)) 
      END]), 
      insert_conds(nil), update_conds(nil), delete_conds([T1_PART.__pk_increment IS NOT NULL AND (T_OP_EXISTS, subquery(1))])
  1 - output([T1_PART.__pk_increment], [T1_PART.A], [T1_PART.B], [T1_PART.C], [T1_PART.D], [(T_OP_EXISTS, subquery(1))], [:2], [subquery(1)]), filter(nil), rowset=16
      exec_params_([T1_PART.B(:1)]), onetime_exprs_(nil), init_plan_idxs_(nil), use_batch=false
  2 - output([T1_PART.__pk_increment], [T1_PART.A], [T1_PART.B], [T1_PART.C], [T1_PART.D], [:2], [subquery(1)]), filter(nil), rowset=16
      exec_params_(nil), onetime_exprs_([subquery(1)(:2)]), init_plan_idxs_(nil), use_batch=false
  3 - output([T1_PART.__pk_increment], [T1_PART.A], [T1_PART.B], [T1_PART.C], [T1_PART.D], [subquery(1)]), filter(nil), rowset=16
  4 - output([T1_PART.__pk_increment], [T1_PART.A], [T1_PART.B], [T1_PART.C], [T1_PART.D], [subquery(1)]), filter(nil), rowset=16
      dop=1
  5 - output([T1_PART.__pk_increment], [T1_PART.A], [T1_PART.B], [T1_PART.C], [T1_PART.D], [subquery(1)]), filter(nil), rowset=16
      exec_params_([T1_PART.B(:0)]), onetime_exprs_(nil), init_plan_idxs_(nil), use_batch=false
  6 - output([T1_PART.__pk_increment], [T1_PART.A], [T1_PART.B], [T1_PART.C], [T1_PART.D]), filter(nil), rowset=16
      equal_conds([T1_PART.A = T2_PART.A]), other_conds(nil)
  7 - output([T1_PART.__pk_increment], [T1_PART.A], [T1_PART.B], [T1_PART.C], [T1_PART.D]), filter(nil), rowset=16
      affinitize, force partition granule
  8 - output([T1_PART.__pk_increment], [T1_PART.A], [T1_PART.B], [T1_PART.C], [T1_PART.D]), filter(nil), rowset=16
      access([T1_PART.__pk_increment], [T1_PART.A], [T1_PART.B], [T1_PART.C], [T1_PART.D]), partitions(p[0-3])
      is_index_back=false, is_global_index=false, 
      range_key([T1_PART.__pk_increment]), range(MIN ; MAX)always true
  9 - output([T2_PART.A]), filter(nil), rowset=16
 10 - output([T2_PART.A]), filter(nil), rowset=16
      (#keys=1, [T2_PART.A]), dop=1
 11 - output([T2_PART.A]), filter(nil), rowset=16
      force partition granule
 12 - output([T2_PART.A]), filter(nil), rowset=16
      access([T2_PART.A]), partitions(p[0-3])
      is_index_back=false, is_global_index=false, 
      range_key([T2_PART.__pk_increment]), range(MIN ; MAX)always true
 13 - output([T_FUN_SUM(T_FUN_SUM(T2_PART.B))]), filter(nil), rowset=16
      group(nil), agg_func([T_FUN_SUM(T_FUN_SUM(T2_PART.B))])
 14 - output([T_FUN_SUM(T2_PART.B)]), filter([T2_PART.B = :0]), rowset=16
      access([T2_PART.B]), partitions(p[0-3])
      is_index_back=false, is_global_index=false, filter_before_indexback[false], 
      range_key([T2_PART.__pk_increment]), range(MIN ; MAX)always true, 
      pushdown_aggregation([T_FUN_SUM(T2_PART.B)])
 15 - output([T_FUN_SUM(T_FUN_SUM(T_FUN_SUM(T2_PART.B)))]), filter(nil), rowset=16
      group(nil), agg_func([T_FUN_SUM(T_FUN_SUM(T_FUN_SUM(T2_PART.B)))])
 16 - output([T_FUN_SUM(T_FUN_SUM(T2_PART.B))]), filter(nil), rowset=16
 17 - output([T_FUN_SUM(T_FUN_SUM(T2_PART.B))]), filter(nil), rowset=16
      dop=1
 18 - output([T_FUN_SUM(T_FUN_SUM(T2_PART.B))]), filter(nil), rowset=16
      group(nil), agg_func([T_FUN_SUM(T_FUN_SUM(T2_PART.B))])
 19 - output([T_FUN_SUM(T2_PART.B)]), filter(nil), rowset=16
      force partition granule
 20 - output([T_FUN_SUM(T2_PART.B)]), filter(nil), rowset=16
      access([T2_PART.B]), partitions(p[0-3])
      is_index_back=false, is_global_index=false, 
      range_key([T2_PART.__pk_increment]), range(MIN ; MAX)always true, 
      pushdown_aggregation([T_FUN_SUM(T2_PART.B)])
 21 - output([1]), filter(nil), rowset=16
      limit(1), offset(nil)
 22 - output(nil), filter([:1 = T2_PART.B]), rowset=16
      access([T2_PART.B]), partitions(p[0-3])
      limit(1), offset(nil), is_index_back=false, is_global_index=false, filter_before_indexback[false], 
      range_key([T2_PART.__pk_increment]), range(MIN ; MAX)always true
merge/*+use_px*/ into t1_part using t2_part on (t1_part.a = t2_part.a) when matched then update set t1_part.c = (select sum(b) from t2_part where t2_part.b = t1_part.b) delete where exists(select 1 from t2_part where t1_part.b = t2_part.b) when not matched then insert (t1_part.a,t1_part.b,t1_part.c,t1_part.d) values (7,7,7,(select sum(b) from t2_part));
select * from t1_part;
+------+------+------+------+
| A    | B    | C    | D    |
+------+------+------+------+
|    1 |    1 |    1 |    1 |
|    7 |    7 |    7 |   20 |
|    7 |    7 |    7 |   20 |
|    7 |    7 |    7 |   20 |
|    7 |    7 |    7 |   20 |
|    7 |    7 |    7 |   20 |
+------+------+------+------+

DROP TABLE W1CASE;
DROP TABLE W0CASE;
CREATE TABLE W0CASE ( W0_TEST0 NUMBER PRIMARY KEY, W0_TEST1 NVARCHAR2(100), W0_TEST2 DATE, W0_TEST3 GENERATED ALWAYS AS (W0_TEST0 * 10));
CREATE TABLE W1CASE (W1_TEST0 NUMBER, W1_TEST1 RAW(100), W1_TEST2 AS (W1_TEST0 / 2) );
explain basic MERGE INTO W0CASE USING (SELECT W1_TEST0 FROM W1CASE ) ON (W0_TEST0=W1_TEST0) WHEN NOT MATCHED THEN INSERT (W0_TEST0) VALUES ((SELECT W1_TEST0 FROM W1CASE));
Query Plan
=====================================
|ID|OPERATOR                 |NAME  |
-------------------------------------
|0 |INSERT                   |      |
|1 |└─SUBPLAN SCAN           |VIEW1 |
|2 |  └─SUBPLAN FILTER       |      |
|3 |    ├─MERGE ANTI JOIN    |      |
|4 |    │ ├─SORT             |      |
|5 |    │ │ └─TABLE FULL SCAN|W1CASE|
|6 |    │ └─TABLE FULL SCAN  |W0CASE|
|7 |    └─TABLE FULL SCAN    |W1CASE|
=====================================
Outputs & filters:
-------------------------------------
  0 - output(nil), filter(nil)
      columns([{W0CASE: ({W0CASE: (W0CASE.W0_TEST0, W0CASE.W0_TEST1, W0CASE.W0_TEST2)})}]), partitions(p0), 
      column_values([column_conv(NUMBER,PS:(-1,-85),NOT NULL,VIEW1.subquery(0))], [column_conv(NVARCHAR2,utf16_bin,length:100,NULL,cast(NULL, NVARCHAR2(1048576 
      )))], [column_conv(DATE,PS:(19,0),NULL,cast(NULL, DATE(-1, -1)))])
  1 - output([VIEW1.subquery(0)]), filter(nil), rowset=16
      access([VIEW1.subquery(0)])
  2 - output([W1CASE.W1_TEST0], [:0]), filter(nil), rowset=16
      exec_params_(nil), onetime_exprs_([subquery(1)(:0)]), init_plan_idxs_(nil), use_batch=false
  3 - output([W1CASE.W1_TEST0]), filter(nil), rowset=16
      equal_conds([W0CASE.W0_TEST0 = W1CASE.W1_TEST0]), other_conds(nil)
      merge_directions([ASC])
  4 - output([W1CASE.W1_TEST0]), filter(nil), rowset=16
      sort_keys([W1CASE.W1_TEST0, ASC])
  5 - output([W1CASE.W1_TEST0]), filter(nil), rowset=16
      access([W1CASE.W1_TEST0]), partitions(p0)
      is_index_back=false, is_global_index=false, 
      range_key([W1CASE.__pk_increment]), range(MIN ; MAX)always true
  6 - output([W0CASE.W0_TEST0]), filter(nil), rowset=16
      access([W0CASE.W0_TEST0]), partitions(p0)
      is_index_back=false, is_global_index=false, 
      range_key([W0CASE.W0_TEST0]), range(MIN ; MAX)always true
  7 - output([W1CASE.W1_TEST0]), filter(nil), rowset=16
      access([W1CASE.W1_TEST0]), partitions(p0)
      is_index_back=false, is_global_index=false, 
      range_key([W1CASE.__pk_increment]), range(MIN ; MAX)always true
MERGE INTO W0CASE USING (SELECT W1_TEST0 FROM W1CASE ) ON (W0_TEST0=W1_TEST0) WHEN NOT MATCHED THEN INSERT (W0_TEST0) VALUES ((SELECT W1_TEST0 FROM W1CASE));

DROP TABLE W1CASE;
DROP TABLE W0CASE;
