drop table if exists sourceTable;
drop table if exists targetTable;
drop view if exists targetView;
result_format: 4
create table sourceTable(id int, sales int);
create table targetTable(id int, sales int);
create view targetView as select * from targetTable;

insert into targetTable values(1,1);
insert into targetTable values(2,2);
insert into targetTable values(3,3);

insert into sourceTable values(1,2);
insert into sourceTable values(2,4);
insert into sourceTable values(3,6);
insert into sourceTable values(4,8);

###################### test for update clause ###################
########## 1 target row vs 1 source row ########
merge into targetTable t1 using sourceTable t2 on (t1.id = t2.id) when matched then update set t1.sales = t2.sales when not matched then insert(t1.id, t1.sales) values(t2.id, t2.sales);
select * from sourceTable;
+------+-------+
| id   | sales |
+------+-------+
|    1 |     2 |
|    2 |     4 |
|    3 |     6 |
|    4 |     8 |
+------+-------+

######## 1(t) vs n(s) match #######
truncate table sourceTable;
truncate table targetTable;

insert into targetTable values(1,1);
insert into targetTable values(2,2);

insert into sourceTable values(1,2);
insert into sourceTable values(-1,-2);
insert into sourceTable values(2,4);
insert into sourceTable values(-2,-4);

merge into targetTable t1 using sourceTable t2 on (t1.id = abs(t2.id)) when matched then update set t1.sales = t2.sales when not matched then insert(t1.id, t1.sales) values(t2.id, t2.sales);
select * from targetTable;
+------+-------+
| id   | sales |
+------+-------+
|    1 |    -2 |
|    2 |    -4 |
+------+-------+

######## n(t) vs 1(s) match #######
truncate table sourceTable;
truncate table targetTable;

insert into sourceTable values(1,1);
insert into sourceTable values(2,2);

insert into targetTable values(1,2);
insert into targetTable values(-1,-2);
insert into targetTable values(2,4);
insert into targetTable values(-2,-4);
merge into targetTable t1 using sourceTable t2 on (t1.id = abs(t2.id)) when matched then update set t1.sales = t2.sales when not matched then insert(t1.id, t1.sales) values(t2.id, t2.sales);
select * from targetTable;
+------+-------+
| id   | sales |
+------+-------+
|    1 |     1 |
|   -1 |    -2 |
|    2 |     2 |
|   -2 |    -4 |
+------+-------+

######## n(t) vs n(s) match #######
merge into targetTable t1 using sourceTable t2 on (t1.id != t2.id) when matched then update set t1.sales = t2.sales when not matched then insert(t1.id, t1.sales) values(t2.id, t2.sales);

####### where condition #######
truncate table targetTable;
truncate table sourceTable;

insert into targetTable values(1,1);
insert into targetTable values(2,2);
insert into targetTable values(3,3);

insert into sourceTable values(1,2);
insert into sourceTable values(2,4);
insert into sourceTable values(3,6);
insert into sourceTable values(4,8);

merge into targetTable t1 using sourceTable t2 on (t1.id = t2.id) when matched then update set t1.sales = t2.sales where t2.id!= t1.id when not matched then insert(t1.id, t1.sales) values(t2.id, t2.sales);
select * from targetTable;
+------+-------+
| id   | sales |
+------+-------+
|    1 |     1 |
|    2 |     2 |
|    3 |     3 |
|    4 |     8 |
+------+-------+

##### update on clause related colunm #####
merge into targetTable t1 using sourceTable t2 on (t1.id = t2.id) when matched then update set t1.id = 1;
ERROR 42000: Can not update join column

##### update view use default value #####
merge into targetView t1 using sourceTable t2 on (t1.id = t2.id) when matched then update set t1.sales = default;
ERROR 0A000: DML operation with View/Virtual Table/Temporary Table not supported

###################### test for delete clause ###################
##### without delete condition #####
merge into targetTable t1 using sourceTable t2 on (t1.id = t2.id) when matched then update set t1.sales = t2.sales delete

##### delete condition out of update condition #####
truncate table targetTable;
ERROR 42000: You have an error in your SQL syntax; check the manual that corresponds to your OceanBase version for the right syntax to use near 'truncate table targetTable' at line 4
truncate table sourceTable;

insert into targetTable values(1,1);
insert into targetTable values(2,2);
insert into targetTable values(3,3);

insert into sourceTable values(1,2);
insert into sourceTable values(2,4);
insert into sourceTable values(3,6);
insert into sourceTable values(4,8);

merge into targetTable t1 using sourceTable t2 on (t1.id = t2.id) when matched then update set t1.sales = t2.sales where t1.id < 3 delete where t1.id < 5 when not matched then insert(t1.id, t1.sales) values(t2.id, t2.sales);
select * from targetTable;
+------+-------+
| id   | sales |
+------+-------+
|    3 |     3 |
|    4 |     8 |
|    3 |     3 |
+------+-------+

##### origin value or new value use in delete condition #####
truncate table targetTable;
truncate table sourceTable;

insert into targetTable values(1,1);
insert into targetTable values(2,2);
insert into targetTable values(3,3);

insert into sourceTable values(1,2);
insert into sourceTable values(2,4);
insert into sourceTable values(3,6);
insert into sourceTable values(4,8);

merge into targetTable t1 using sourceTable t2 on (t1.id = t2.id) when matched then update set t1.sales = t2.sales delete where t1.sales =2 when not matched then insert(t1.id, t1.sales) values(t2.id, t2.sales);
select * from targetTable;
+------+-------+
| id   | sales |
+------+-------+
|    2 |     4 |
|    3 |     6 |
|    4 |     8 |
+------+-------+

###################### test for insert clause ###################
##### insert condition ######
truncate table targetTable;
truncate table sourceTable;

insert into targetTable values(1,1);
insert into targetTable values(2,2);
insert into targetTable values(3,3);

insert into sourceTable values(1,2);
insert into sourceTable values(2,4);
insert into sourceTable values(3,6);
insert into sourceTable values(4,8);

merge into targetTable t1 using sourceTable t2 on (t1.id = t2.id) when not matched then insert(t1.id, t1.sales) values(t2.id, t2.sales) where t2.id > 0;
select * from targetTable;
+------+-------+
| id   | sales |
+------+-------+
|    1 |     1 |
|    2 |     2 |
|    3 |     3 |
|    4 |     8 |
+------+-------+
merge into targetTable t1 using sourceTable t2 on (t1.id = t2.id) when not matched then insert(t1.id, t1.sales) values(t2.id, t2.sales) where t1.id > 0;

##### insert view with default #####
merge into targetView t1 using sourceTable t2 on (t1.id = t2.id) when not matched then insert(t1.id, t1.sales) values(default, default);
ERROR 0A000: DML operation with View/Virtual Table/Temporary Table not supported
