drop table t1;
drop table t2;
drop table tp1;
drop table tp2;
create table t1(c1 int, c2 int, c3 int);
create table t2(c1 int, c2 int, c3 int);
create table tp1(c1 int, c2 int, c3 int) partition by hash(c1) partitions 2;
create table tp2(c1 int, c2 int, c3 int) partition by hash(c1) partitions 2;
create or replace view v1 as select * from tp1 order by 1;
create or replace view v2 as select * from tp1 where c1 = 3;
insert into t1 values (0,0,0);
insert into t1 values (1,1,1);
insert into t1 values (3,3,3);
insert into t1 values (4,4,4);
insert into t2 values (1,1,1);
insert into t2 values (2,2,2);
insert into t2 values (3,3,3);
insert into t2 values (4,4,4);
insert into t2 values (5,5,5);
insert into tp1 select * from t1;
insert into tp2 select * from t2;
result_format: 4
set autocommit = 0;

############################ test for insert ################################
explain basic
merge into t1 t1 using t2 t2 on (t1.c1 = t2.c1)
when not matched then insert values (t2.c1, t2.c2, t2.c3);
Query Plan
====================================
|ID|OPERATOR                 |NAME |
------------------------------------
|0 |INSERT                   |     |
|1 |└─SUBPLAN SCAN           |VIEW1|
|2 |  └─HASH RIGHT ANTI JOIN |     |
|3 |    ├─TABLE FULL SCAN    |T1   |
|4 |    └─TABLE FULL SCAN    |T2   |
====================================
Outputs & filters:
-------------------------------------
  0 - output(nil), filter(nil)
      columns([{T1: ({T1: (T1.__pk_increment, T1.C1, T1.C2, T1.C3)})}]), partitions(p0), 
      column_values([T_HIDDEN_PK], [column_conv(NUMBER,PS:(-1,0),NULL,VIEW1.T2.C1)], [column_conv(NUMBER,PS:(-1,0),NULL,VIEW1.T2.C2)], [column_conv(NUMBER,
      PS:(-1,0),NULL,VIEW1.T2.C3)])
  1 - output([VIEW1.T2.C1], [VIEW1.T2.C2], [VIEW1.T2.C3]), filter(nil), rowset=16
      access([VIEW1.T2.C1], [VIEW1.T2.C2], [VIEW1.T2.C3])
  2 - output([T2.C1], [T2.C2], [T2.C3]), filter(nil), rowset=16
      equal_conds([T1.C1 = T2.C1]), other_conds(nil)
  3 - output([T1.C1]), filter(nil), rowset=16
      access([T1.C1]), partitions(p0)
      is_index_back=false, is_global_index=false, 
      range_key([T1.__pk_increment]), range(MIN ; MAX)always true
  4 - output([T2.C1], [T2.C2], [T2.C3]), filter(nil), rowset=16
      access([T2.C1], [T2.C2], [T2.C3]), partitions(p0)
      is_index_back=false, is_global_index=false, 
      range_key([T2.__pk_increment]), range(MIN ; MAX)always true
merge into t1 t1 using t2 t2 on (t1.c1 = t2.c1)
when not matched then insert values (t2.c1, t2.c2, t2.c3);
select * from t1 order by 1;
+------+------+------+
| C1   | C2   | C3   |
+------+------+------+
|    0 |    0 |    0 |
|    1 |    1 |    1 |
|    2 |    2 |    2 |
|    3 |    3 |    3 |
|    4 |    4 |    4 |
|    5 |    5 |    5 |
+------+------+------+
rollback;

explain basic
merge into t1 t1 using tp2 t2 on (t1.c1 = t2.c1)
when not matched then insert values (t2.c1, t2.c2, t2.c3);
Query Plan
===================================================
|ID|OPERATOR                             |NAME    |
---------------------------------------------------
|0 |INSERT                               |        |
|1 |└─PX COORDINATOR                     |        |
|2 |  └─EXCHANGE OUT DISTR               |:EX10001|
|3 |    └─SUBPLAN SCAN                   |VIEW1   |
|4 |      └─HASH RIGHT ANTI JOIN         |        |
|5 |        ├─EXCHANGE IN DISTR          |        |
|6 |        │ └─EXCHANGE OUT DISTR (PKEY)|:EX10000|
|7 |        │   └─TABLE FULL SCAN        |T1      |
|8 |        └─PX PARTITION ITERATOR      |        |
|9 |          └─TABLE FULL SCAN          |T2      |
===================================================
Outputs & filters:
-------------------------------------
  0 - output(nil), filter(nil)
      columns([{T1: ({T1: (T1.__pk_increment, T1.C1, T1.C2, T1.C3)})}]), partitions(p0), 
      column_values([T_HIDDEN_PK], [column_conv(NUMBER,PS:(-1,0),NULL,VIEW1.T2.C1)], [column_conv(NUMBER,PS:(-1,0),NULL,VIEW1.T2.C2)], [column_conv(NUMBER,
      PS:(-1,0),NULL,VIEW1.T2.C3)])
  1 - output([VIEW1.T2.C1], [VIEW1.T2.C2], [VIEW1.T2.C3]), filter(nil), rowset=16
  2 - output([VIEW1.T2.C1], [VIEW1.T2.C2], [VIEW1.T2.C3]), filter(nil), rowset=16
      dop=1
  3 - output([VIEW1.T2.C1], [VIEW1.T2.C2], [VIEW1.T2.C3]), filter(nil), rowset=16
      access([VIEW1.T2.C1], [VIEW1.T2.C2], [VIEW1.T2.C3])
  4 - output([T2.C1], [T2.C2], [T2.C3]), filter(nil), rowset=16
      equal_conds([T1.C1 = T2.C1]), other_conds(nil)
  5 - output([T1.C1]), filter(nil), rowset=16
  6 - output([T1.C1]), filter(nil), rowset=16
      (#keys=1, [T1.C1]), is_single, dop=1
  7 - output([T1.C1]), filter(nil), rowset=16
      access([T1.C1]), partitions(p0)
      is_index_back=false, is_global_index=false, 
      range_key([T1.__pk_increment]), range(MIN ; MAX)always true
  8 - output([T2.C1], [T2.C2], [T2.C3]), filter(nil), rowset=16
      affinitize, force partition granule
  9 - output([T2.C1], [T2.C2], [T2.C3]), filter(nil), rowset=16
      access([T2.C1], [T2.C2], [T2.C3]), partitions(p[0-1])
      is_index_back=false, is_global_index=false, 
      range_key([T2.__pk_increment]), range(MIN ; MAX)always true
merge into t1 t1 using tp2 t2 on (t1.c1 = t2.c1)
when not matched then insert values (t2.c1, t2.c2, t2.c3);
select * from t1 order by 1;
+------+------+------+
| C1   | C2   | C3   |
+------+------+------+
|    0 |    0 |    0 |
|    1 |    1 |    1 |
|    2 |    2 |    2 |
|    3 |    3 |    3 |
|    4 |    4 |    4 |
|    5 |    5 |    5 |
+------+------+------+
rollback;

explain basic
merge into tp1 t1 using t2 t2 on (t1.c1 = t2.c1)
when not matched then insert values (t2.c1, t2.c2, t2.c3);
Query Plan
===================================================
|ID|OPERATOR                             |NAME    |
---------------------------------------------------
|0 |DISTRIBUTED INSERT                   |        |
|1 |└─PX COORDINATOR                     |        |
|2 |  └─EXCHANGE OUT DISTR               |:EX10001|
|3 |    └─SUBPLAN SCAN                   |VIEW1   |
|4 |      └─HASH RIGHT ANTI JOIN         |        |
|5 |        ├─PX PARTITION ITERATOR      |        |
|6 |        │ └─TABLE FULL SCAN          |T1      |
|7 |        └─EXCHANGE IN DISTR          |        |
|8 |          └─EXCHANGE OUT DISTR (PKEY)|:EX10000|
|9 |            └─TABLE FULL SCAN        |T2      |
===================================================
Outputs & filters:
-------------------------------------
  0 - output(nil), filter(nil)
      columns([{T1: ({TP1: (T1.__pk_increment, T1.C1, T1.C2, T1.C3)})}]), partitions(p[0-1]), 
      column_values([T_HIDDEN_PK], [column_conv(NUMBER,PS:(-1,0),NULL,VIEW1.T2.C1)], [column_conv(NUMBER,PS:(-1,0),NULL,VIEW1.T2.C2)], [column_conv(NUMBER,
      PS:(-1,0),NULL,VIEW1.T2.C3)])
  1 - output([VIEW1.T2.C1], [VIEW1.T2.C2], [VIEW1.T2.C3]), filter(nil), rowset=16
  2 - output([VIEW1.T2.C1], [VIEW1.T2.C2], [VIEW1.T2.C3]), filter(nil), rowset=16
      dop=1
  3 - output([VIEW1.T2.C1], [VIEW1.T2.C2], [VIEW1.T2.C3]), filter(nil), rowset=16
      access([VIEW1.T2.C1], [VIEW1.T2.C2], [VIEW1.T2.C3])
  4 - output([T2.C1], [T2.C2], [T2.C3]), filter(nil), rowset=16
      equal_conds([T1.C1 = T2.C1]), other_conds(nil)
  5 - output([T1.C1]), filter(nil), rowset=16
      affinitize, force partition granule
  6 - output([T1.C1]), filter(nil), rowset=16
      access([T1.C1]), partitions(p[0-1])
      is_index_back=false, is_global_index=false, 
      range_key([T1.__pk_increment]), range(MIN ; MAX)always true
  7 - output([T2.C1], [T2.C2], [T2.C3]), filter(nil), rowset=16
  8 - output([T2.C1], [T2.C2], [T2.C3]), filter(nil), rowset=16
      (#keys=1, [T2.C1]), is_single, dop=1
  9 - output([T2.C1], [T2.C2], [T2.C3]), filter(nil), rowset=16
      access([T2.C1], [T2.C2], [T2.C3]), partitions(p0)
      is_index_back=false, is_global_index=false, 
      range_key([T2.__pk_increment]), range(MIN ; MAX)always true
merge into tp1 t1 using t2 t2 on (t1.c1 = t2.c1)
when not matched then insert values (t2.c1, t2.c2, t2.c3);
select * from tp1 order by 1;
+------+------+------+
| C1   | C2   | C3   |
+------+------+------+
|    0 |    0 |    0 |
|    1 |    1 |    1 |
|    2 |    2 |    2 |
|    3 |    3 |    3 |
|    4 |    4 |    4 |
|    5 |    5 |    5 |
+------+------+------+
rollback;

explain basic
merge into tp1 t1 using tp2 t2 on (t1.c1 = t2.c1)
when not matched then insert values (t2.c1, t2.c2, t2.c3);
Query Plan
=============================================
|ID|OPERATOR                       |NAME    |
---------------------------------------------
|0 |PX COORDINATOR                 |        |
|1 |└─EXCHANGE OUT DISTR           |:EX10000|
|2 |  └─PX PARTITION ITERATOR      |        |
|3 |    └─INSERT                   |        |
|4 |      └─SUBPLAN SCAN           |VIEW1   |
|5 |        └─HASH RIGHT ANTI JOIN |        |
|6 |          ├─TABLE FULL SCAN    |T1      |
|7 |          └─TABLE FULL SCAN    |T2      |
=============================================
Outputs & filters:
-------------------------------------
  0 - output(nil), filter(nil), rowset=16
  1 - output(nil), filter(nil), rowset=16
      dop=1
  2 - output(nil), filter(nil), rowset=16
      partition wise, force partition granule
  3 - output(nil), filter(nil)
      columns([{T1: ({TP1: (T1.__pk_increment, T1.C1, T1.C2, T1.C3)})}]), partitions(p[0-1]), 
      column_values([T_HIDDEN_PK], [column_conv(NUMBER,PS:(-1,0),NULL,VIEW1.T2.C1)], [column_conv(NUMBER,PS:(-1,0),NULL,VIEW1.T2.C2)], [column_conv(NUMBER,
      PS:(-1,0),NULL,VIEW1.T2.C3)])
  4 - output([VIEW1.T2.C1], [VIEW1.T2.C2], [VIEW1.T2.C3]), filter(nil), rowset=16
      access([VIEW1.T2.C1], [VIEW1.T2.C2], [VIEW1.T2.C3])
  5 - output([T2.C1], [T2.C2], [T2.C3]), filter(nil), rowset=16
      equal_conds([T1.C1 = T2.C1]), other_conds(nil)
  6 - output([T1.C1]), filter(nil), rowset=16
      access([T1.C1]), partitions(p[0-1])
      is_index_back=false, is_global_index=false, 
      range_key([T1.__pk_increment]), range(MIN ; MAX)always true
  7 - output([T2.C1], [T2.C2], [T2.C3]), filter(nil), rowset=16
      access([T2.C1], [T2.C2], [T2.C3]), partitions(p[0-1])
      is_index_back=false, is_global_index=false, 
      range_key([T2.__pk_increment]), range(MIN ; MAX)always true
merge into tp1 t1 using tp2 t2 on (t1.c1 = t2.c1)
when not matched then insert values (t2.c1, t2.c2, t2.c3);
select * from tp1 order by 1;
+------+------+------+
| C1   | C2   | C3   |
+------+------+------+
|    0 |    0 |    0 |
|    1 |    1 |    1 |
|    2 |    2 |    2 |
|    3 |    3 |    3 |
|    4 |    4 |    4 |
|    5 |    5 |    5 |
+------+------+------+
rollback;

explain basic
merge into tp1 t1 using tp2 t2 on (t1.c1 = t2.c1)
when not matched then insert values (t2.c2, t2.c1, t2.c3);
Query Plan
=============================================
|ID|OPERATOR                       |NAME    |
---------------------------------------------
|0 |DISTRIBUTED INSERT             |        |
|1 |└─PX COORDINATOR               |        |
|2 |  └─EXCHANGE OUT DISTR         |:EX10000|
|3 |    └─SUBPLAN SCAN             |VIEW1   |
|4 |      └─PX PARTITION ITERATOR  |        |
|5 |        └─HASH RIGHT ANTI JOIN |        |
|6 |          ├─TABLE FULL SCAN    |T1      |
|7 |          └─TABLE FULL SCAN    |T2      |
=============================================
Outputs & filters:
-------------------------------------
  0 - output(nil), filter(nil)
      columns([{T1: ({TP1: (T1.__pk_increment, T1.C1, T1.C2, T1.C3)})}]), partitions(p[0-1]), 
      column_values([T_HIDDEN_PK], [column_conv(NUMBER,PS:(-1,0),NULL,VIEW1.T2.C2)], [column_conv(NUMBER,PS:(-1,0),NULL,VIEW1.T2.C1)], [column_conv(NUMBER,
      PS:(-1,0),NULL,VIEW1.T2.C3)])
  1 - output([VIEW1.T2.C2], [VIEW1.T2.C1], [VIEW1.T2.C3]), filter(nil), rowset=16
  2 - output([VIEW1.T2.C2], [VIEW1.T2.C1], [VIEW1.T2.C3]), filter(nil), rowset=16
      dop=1
  3 - output([VIEW1.T2.C2], [VIEW1.T2.C1], [VIEW1.T2.C3]), filter(nil), rowset=16
      access([VIEW1.T2.C2], [VIEW1.T2.C1], [VIEW1.T2.C3])
  4 - output([T2.C2], [T2.C1], [T2.C3]), filter(nil), rowset=16
      partition wise, force partition granule
  5 - output([T2.C2], [T2.C1], [T2.C3]), filter(nil), rowset=16
      equal_conds([T1.C1 = T2.C1]), other_conds(nil)
  6 - output([T1.C1]), filter(nil), rowset=16
      access([T1.C1]), partitions(p[0-1])
      is_index_back=false, is_global_index=false, 
      range_key([T1.__pk_increment]), range(MIN ; MAX)always true
  7 - output([T2.C1], [T2.C2], [T2.C3]), filter(nil), rowset=16
      access([T2.C1], [T2.C2], [T2.C3]), partitions(p[0-1])
      is_index_back=false, is_global_index=false, 
      range_key([T2.__pk_increment]), range(MIN ; MAX)always true
merge into tp1 t1 using tp2 t2 on (t1.c1 = t2.c1)
when not matched then insert values (t2.c2, t2.c1, t2.c3);
select * from tp1 order by 1;
+------+------+------+
| C1   | C2   | C3   |
+------+------+------+
|    0 |    0 |    0 |
|    1 |    1 |    1 |
|    2 |    2 |    2 |
|    3 |    3 |    3 |
|    4 |    4 |    4 |
|    5 |    5 |    5 |
+------+------+------+
rollback;

explain basic
merge into v1 t1 using tp2 t2 on (t1.c1 = t2.c1)
when not matched then insert values (t2.c1, t2.c2, t2.c3);
Query Plan
=============================================
|ID|OPERATOR                       |NAME    |
---------------------------------------------
|0 |PX COORDINATOR                 |        |
|1 |└─EXCHANGE OUT DISTR           |:EX10000|
|2 |  └─PX PARTITION ITERATOR      |        |
|3 |    └─INSERT                   |        |
|4 |      └─SUBPLAN SCAN           |VIEW1   |
|5 |        └─HASH RIGHT ANTI JOIN |        |
|6 |          ├─TABLE FULL SCAN    |TP1     |
|7 |          └─TABLE FULL SCAN    |T2      |
=============================================
Outputs & filters:
-------------------------------------
  0 - output(nil), filter(nil), rowset=16
  1 - output(nil), filter(nil), rowset=16
      dop=1
  2 - output(nil), filter(nil), rowset=16
      partition wise, force partition granule
  3 - output(nil), filter(nil)
      columns([{T1: ({TP1: (T1.TP1.__pk_increment, T1.C1, T1.C2, T1.C3)})}]), partitions(p[0-1]), 
      column_values([T_HIDDEN_PK], [column_conv(NUMBER,PS:(-1,0),NULL,VIEW1.T2.C1)], [column_conv(NUMBER,PS:(-1,0),NULL,VIEW1.T2.C2)], [column_conv(NUMBER,
      PS:(-1,0),NULL,VIEW1.T2.C3)])
  4 - output([VIEW1.T2.C1], [VIEW1.T2.C2], [VIEW1.T2.C3]), filter(nil), rowset=16
      access([VIEW1.T2.C1], [VIEW1.T2.C2], [VIEW1.T2.C3])
  5 - output([T2.C1], [T2.C2], [T2.C3]), filter(nil), rowset=16
      equal_conds([TP1.C1 = T2.C1]), other_conds(nil)
  6 - output([TP1.C1]), filter(nil), rowset=16
      access([TP1.C1]), partitions(p[0-1])
      is_index_back=false, is_global_index=false, 
      range_key([TP1.__pk_increment]), range(MIN ; MAX)always true
  7 - output([T2.C1], [T2.C2], [T2.C3]), filter(nil), rowset=16
      access([T2.C1], [T2.C2], [T2.C3]), partitions(p[0-1])
      is_index_back=false, is_global_index=false, 
      range_key([T2.__pk_increment]), range(MIN ; MAX)always true
merge into v1 t1 using tp2 t2 on (t1.c1 = t2.c1)
when not matched then insert values (t2.c1, t2.c2, t2.c3);
select * from tp1 order by 1;
+------+------+------+
| C1   | C2   | C3   |
+------+------+------+
|    0 |    0 |    0 |
|    1 |    1 |    1 |
|    2 |    2 |    2 |
|    3 |    3 |    3 |
|    4 |    4 |    4 |
|    5 |    5 |    5 |
+------+------+------+
rollback;

explain basic
merge into v2 t1 using tp2 t2 on (t1.c1 = t2.c1)
when not matched then insert values (t2.c1, t2.c2, t2.c3);
Query Plan
=============================================
|ID|OPERATOR                       |NAME    |
---------------------------------------------
|0 |DISTRIBUTED INSERT             |        |
|1 |└─SUBPLAN SCAN                 |VIEW1   |
|2 |  └─NESTED-LOOP ANTI JOIN      |        |
|3 |    ├─PX COORDINATOR           |        |
|4 |    │ └─EXCHANGE OUT DISTR     |:EX10000|
|5 |    │   └─PX PARTITION ITERATOR|        |
|6 |    │     └─TABLE FULL SCAN    |T2      |
|7 |    └─MATERIAL                 |        |
|8 |      └─SUBPLAN SCAN           |V2      |
|9 |        └─TABLE FULL SCAN      |TP1     |
=============================================
Outputs & filters:
-------------------------------------
  0 - output(nil), filter(nil)
      columns([{T1: ({TP1: (T1.TP1.__pk_increment, T1.C1, T1.C2, T1.C3)})}]), partitions(p[0-1]), 
      column_values([T_HIDDEN_PK], [column_conv(NUMBER,PS:(-1,0),NULL,VIEW1.T2.C1)], [column_conv(NUMBER,PS:(-1,0),NULL,VIEW1.T2.C2)], [column_conv(NUMBER,
      PS:(-1,0),NULL,VIEW1.T2.C3)])
  1 - output([VIEW1.T2.C1], [VIEW1.T2.C2], [VIEW1.T2.C3]), filter(nil), rowset=16
      access([VIEW1.T2.C1], [VIEW1.T2.C2], [VIEW1.T2.C3])
  2 - output([T2.C1], [T2.C2], [T2.C3]), filter(nil), rowset=16
      conds([3 = T2.C1]), nl_params_(nil), use_batch=false
  3 - output([T2.C1], [T2.C2], [T2.C3]), filter(nil), rowset=16
  4 - output([T2.C1], [T2.C2], [T2.C3]), filter(nil), rowset=16
      dop=1
  5 - output([T2.C1], [T2.C2], [T2.C3]), filter(nil), rowset=16
      force partition granule
  6 - output([T2.C1], [T2.C2], [T2.C3]), filter(nil), rowset=16
      access([T2.C1], [T2.C2], [T2.C3]), partitions(p[0-1])
      is_index_back=false, is_global_index=false, 
      range_key([T2.__pk_increment]), range(MIN ; MAX)always true
  7 - output(nil), filter(nil), rowset=16
  8 - output(nil), filter(nil), rowset=16
      access(nil)
  9 - output([1]), filter([TP1.C1 = 3]), rowset=16
      access([TP1.C1]), partitions(p0)
      limit(1), offset(nil), is_index_back=false, is_global_index=false, filter_before_indexback[false], 
      range_key([TP1.__pk_increment]), range(MIN ; MAX)always true
merge into v2 t1 using tp2 t2 on (t1.c1 = t2.c1)
when not matched then insert values (t2.c1, t2.c2, t2.c3);
select * from tp1 order by 1;
+------+------+------+
| C1   | C2   | C3   |
+------+------+------+
|    0 |    0 |    0 |
|    1 |    1 |    1 |
|    1 |    1 |    1 |
|    2 |    2 |    2 |
|    3 |    3 |    3 |
|    4 |    4 |    4 |
|    4 |    4 |    4 |
|    5 |    5 |    5 |
+------+------+------+
rollback;

explain basic
merge into tp1 t1 using (select * from tp2 where c1 = 3) t2 on (t1.c1 = t2.c1)
when not matched then insert values (t2.c1, t2.c2, t2.c3);
Query Plan
===============================================
|ID|OPERATOR                            |NAME |
-----------------------------------------------
|0 |INSERT                              |     |
|1 |└─SUBPLAN SCAN                      |VIEW1|
|2 |  └─NESTED-LOOP ANTI JOIN CARTESIAN |     |
|3 |    ├─TABLE FULL SCAN               |TP2  |
|4 |    └─MATERIAL                      |     |
|5 |      └─SUBPLAN SCAN                |VIEW2|
|6 |        └─TABLE FULL SCAN           |T1   |
===============================================
Outputs & filters:
-------------------------------------
  0 - output(nil), filter(nil)
      columns([{T1: ({TP1: (T1.__pk_increment, T1.C1, T1.C2, T1.C3)})}]), partitions(p0), 
      column_values([T_HIDDEN_PK], [column_conv(NUMBER,PS:(-1,0),NULL,VIEW1.T2.C1)], [column_conv(NUMBER,PS:(-1,0),NULL,VIEW1.T2.C2)], [column_conv(NUMBER,
      PS:(-1,0),NULL,VIEW1.T2.C3)])
  1 - output([VIEW1.T2.C1], [VIEW1.T2.C2], [VIEW1.T2.C3]), filter(nil), rowset=16
      access([VIEW1.T2.C1], [VIEW1.T2.C2], [VIEW1.T2.C3])
  2 - output([TP2.C1], [TP2.C2], [TP2.C3]), filter(nil), rowset=16
      conds(nil), nl_params_(nil), use_batch=false
  3 - output([TP2.C1], [TP2.C2], [TP2.C3]), filter([TP2.C1 = 3]), rowset=16
      access([TP2.C1], [TP2.C2], [TP2.C3]), partitions(p0)
      is_index_back=false, is_global_index=false, filter_before_indexback[false], 
      range_key([TP2.__pk_increment]), range(MIN ; MAX)always true
  4 - output(nil), filter(nil), rowset=16
  5 - output(nil), filter(nil), rowset=16
      access(nil)
  6 - output([1]), filter([T1.C1 = 3]), rowset=16
      access([T1.C1]), partitions(p0)
      limit(1), offset(nil), is_index_back=false, is_global_index=false, filter_before_indexback[false], 
      range_key([T1.__pk_increment]), range(MIN ; MAX)always true
merge into tp1 t1 using (select * from tp2 where c1 = 3) t2 on (t1.c1 = t2.c1)
when not matched then insert values (t2.c1, t2.c2, t2.c3);
select * from tp1 order by 1;
+------+------+------+
| C1   | C2   | C3   |
+------+------+------+
|    0 |    0 |    0 |
|    1 |    1 |    1 |
|    3 |    3 |    3 |
|    4 |    4 |    4 |
+------+------+------+
rollback;

explain basic
merge into v2 t1 using (select * from tp2 where c1 = 3) t2 on (t1.c1 = t2.c1)
when not matched then insert values (t2.c1, t2.c2, t2.c3);
Query Plan
=====================================
|ID|OPERATOR                  |NAME |
-------------------------------------
|0 |INSERT                    |     |
|1 |└─SUBPLAN SCAN            |VIEW1|
|2 |  └─NESTED-LOOP ANTI JOIN |     |
|3 |    ├─TABLE FULL SCAN     |TP2  |
|4 |    └─MATERIAL            |     |
|5 |      └─SUBPLAN SCAN      |V2   |
|6 |        └─TABLE FULL SCAN |TP1  |
=====================================
Outputs & filters:
-------------------------------------
  0 - output(nil), filter(nil)
      columns([{T1: ({TP1: (T1.TP1.__pk_increment, T1.C1, T1.C2, T1.C3)})}]), partitions(p0), 
      column_values([T_HIDDEN_PK], [column_conv(NUMBER,PS:(-1,0),NULL,VIEW1.T2.C1)], [column_conv(NUMBER,PS:(-1,0),NULL,VIEW1.T2.C2)], [column_conv(NUMBER,
      PS:(-1,0),NULL,VIEW1.T2.C3)])
  1 - output([VIEW1.T2.C1], [VIEW1.T2.C2], [VIEW1.T2.C3]), filter(nil), rowset=16
      access([VIEW1.T2.C1], [VIEW1.T2.C2], [VIEW1.T2.C3])
  2 - output([TP2.C1], [TP2.C2], [TP2.C3]), filter(nil), rowset=16
      conds([3 = 3]), nl_params_(nil), use_batch=false
  3 - output([TP2.C1], [TP2.C2], [TP2.C3]), filter([TP2.C1 = 3]), rowset=16
      access([TP2.C1], [TP2.C2], [TP2.C3]), partitions(p0)
      is_index_back=false, is_global_index=false, filter_before_indexback[false], 
      range_key([TP2.__pk_increment]), range(MIN ; MAX)always true
  4 - output(nil), filter(nil), rowset=16
  5 - output(nil), filter(nil), rowset=16
      access(nil)
  6 - output([1]), filter([TP1.C1 = 3]), rowset=16
      access([TP1.C1]), partitions(p0)
      limit(1), offset(nil), is_index_back=false, is_global_index=false, filter_before_indexback[false], 
      range_key([TP1.__pk_increment]), range(MIN ; MAX)always true
merge into v2 t1 using (select * from tp2 where c1 = 3) t2 on (t1.c1 = t2.c1)
when not matched then insert values (t2.c1, t2.c2, t2.c3);
select * from tp1 order by 1;
+------+------+------+
| C1   | C2   | C3   |
+------+------+------+
|    0 |    0 |    0 |
|    1 |    1 |    1 |
|    3 |    3 |    3 |
|    4 |    4 |    4 |
+------+------+------+
rollback;

explain basic
merge into v2 t1 using (select * from tp2 where c1 = 5) t2 on (t1.c1 = t2.c1)
when not matched then insert values (t2.c1, t2.c2, t2.c3);
Query Plan
===============================================
|ID|OPERATOR                            |NAME |
-----------------------------------------------
|0 |INSERT                              |     |
|1 |└─SUBPLAN SCAN                      |VIEW1|
|2 |  └─NESTED-LOOP ANTI JOIN CARTESIAN |     |
|3 |    ├─TABLE FULL SCAN               |TP2  |
|4 |    └─MATERIAL                      |     |
|5 |      └─SUBPLAN SCAN                |V2   |
|6 |        └─TABLE FULL SCAN           |TP1  |
===============================================
Outputs & filters:
-------------------------------------
  0 - output(nil), filter(nil)
      columns([{T1: ({TP1: (T1.TP1.__pk_increment, T1.C1, T1.C2, T1.C3)})}]), partitions(p0), 
      column_values([T_HIDDEN_PK], [column_conv(NUMBER,PS:(-1,0),NULL,VIEW1.T2.C1)], [column_conv(NUMBER,PS:(-1,0),NULL,VIEW1.T2.C2)], [column_conv(NUMBER,
      PS:(-1,0),NULL,VIEW1.T2.C3)])
  1 - output([VIEW1.T2.C1], [VIEW1.T2.C2], [VIEW1.T2.C3]), filter(nil), rowset=16
      access([VIEW1.T2.C1], [VIEW1.T2.C2], [VIEW1.T2.C3])
  2 - output([TP2.C1], [TP2.C2], [TP2.C3]), filter(nil), rowset=16
      conds(nil), nl_params_(nil), use_batch=false
  3 - output([TP2.C1], [TP2.C2], [TP2.C3]), filter([TP2.C1 = 5]), rowset=16
      access([TP2.C1], [TP2.C2], [TP2.C3]), partitions(p0)
      is_index_back=false, is_global_index=false, filter_before_indexback[false], 
      range_key([TP2.__pk_increment]), range(MIN ; MAX)always true
  4 - output(nil), filter(nil), startup_filter([0]), rowset=16
  5 - output(nil), filter(nil), rowset=16
      access(nil)
  6 - output([1]), filter(nil), rowset=16
      access(nil), partitions(p0)
      limit(1), offset(nil), is_index_back=false, is_global_index=false, 
      range_key([TP1.__pk_increment]), range(MIN ; MAX)always true
merge into v2 t1 using (select * from tp2 where c1 = 5) t2 on (t1.c1 = t2.c1)
when not matched then insert values (t2.c1, t2.c2, t2.c3);
select * from tp1 order by 1;
+------+------+------+
| C1   | C2   | C3   |
+------+------+------+
|    0 |    0 |    0 |
|    1 |    1 |    1 |
|    3 |    3 |    3 |
|    4 |    4 |    4 |
|    5 |    5 |    5 |
+------+------+------+
rollback;

explain basic
merge into t1 using (select 1 c1 from dual) t2 on (t1.c1 = t2.c1)
when not matched then insert values (t2.c1, 1, 1);
Query Plan
=============================================
|ID|OPERATOR                           |NAME|
---------------------------------------------
|0 |MERGE                              |    |
|1 |└─NESTED-LOOP OUTER JOIN CARTESIAN |    |
|2 |  ├─SUBPLAN SCAN                   |T2  |
|3 |  │ └─EXPRESSION                   |    |
|4 |  └─TABLE FULL SCAN                |T1  |
=============================================
Outputs & filters:
-------------------------------------
  0 - output(nil), filter(nil)
      columns([{T1: ({T1: (T1.__pk_increment, T1.C1, T1.C2, T1.C3)})}]), partitions(p0), 
      column_values([T_HIDDEN_PK], [column_conv(NUMBER,PS:(-1,0),NULL,T2.C1)], [column_conv(NUMBER,PS:(-1,0),NULL,1)], [column_conv(NUMBER,PS:(-1,0),NULL,
      1)]), 
      insert_conds(nil), update_conds(nil), delete_conds(nil)
  1 - output([T1.__pk_increment], [T1.C1], [T1.C2], [T1.C3], [T2.C1]), filter(nil), rowset=16
      conds(nil), nl_params_(nil), use_batch=false
  2 - output([T2.C1]), filter(nil), rowset=16
      access([T2.C1])
  3 - output([1]), filter(nil)
      values({1})
  4 - output([T1.__pk_increment], [T1.C1], [T1.C2], [T1.C3]), filter([T1.C1 = 1]), rowset=16
      access([T1.__pk_increment], [T1.C1], [T1.C2], [T1.C3]), partitions(p0)
      is_index_back=false, is_global_index=false, filter_before_indexback[false], 
      range_key([T1.__pk_increment]), range(MIN ; MAX)always true
merge into t1 using (select 1 c1 from dual) t2 on (t1.c1 = t2.c1)
when not matched then insert values (t2.c1, 1, 1);
select * from t1 order by 1;
+------+------+------+
| C1   | C2   | C3   |
+------+------+------+
|    0 |    0 |    0 |
|    1 |    1 |    1 |
|    3 |    3 |    3 |
|    4 |    4 |    4 |
+------+------+------+
rollback;

explain basic
merge into tp1 t1 using (select 1 c1 from dual) t2 on (t1.c1 = t2.c1)
when not matched then insert values (t2.c1, 1, 1);
Query Plan
=============================================
|ID|OPERATOR                           |NAME|
---------------------------------------------
|0 |MERGE                              |    |
|1 |└─NESTED-LOOP OUTER JOIN CARTESIAN |    |
|2 |  ├─SUBPLAN SCAN                   |T2  |
|3 |  │ └─EXPRESSION                   |    |
|4 |  └─TABLE FULL SCAN                |T1  |
=============================================
Outputs & filters:
-------------------------------------
  0 - output(nil), filter(nil)
      columns([{T1: ({TP1: (T1.__pk_increment, T1.C1, T1.C2, T1.C3)})}]), partitions(p1), 
      column_values([T_HIDDEN_PK], [column_conv(NUMBER,PS:(-1,0),NULL,T2.C1)], [column_conv(NUMBER,PS:(-1,0),NULL,1)], [column_conv(NUMBER,PS:(-1,0),NULL,
      1)]), 
      insert_conds(nil), update_conds(nil), delete_conds(nil)
  1 - output([T1.__pk_increment], [T1.C1], [T1.C2], [T1.C3], [T2.C1]), filter(nil), rowset=16
      conds(nil), nl_params_(nil), use_batch=false
  2 - output([T2.C1]), filter(nil), rowset=16
      access([T2.C1])
  3 - output([1]), filter(nil)
      values({1})
  4 - output([T1.__pk_increment], [T1.C1], [T1.C2], [T1.C3]), filter([T1.C1 = 1]), rowset=16
      access([T1.__pk_increment], [T1.C1], [T1.C2], [T1.C3]), partitions(p1)
      is_index_back=false, is_global_index=false, filter_before_indexback[false], 
      range_key([T1.__pk_increment]), range(MIN ; MAX)always true
merge into tp1 t1 using (select 1 c1 from dual) t2 on (t1.c1 = t2.c1)
when not matched then insert values (t2.c1, 1, 1);
select * from tp1 order by 1;
+------+------+------+
| C1   | C2   | C3   |
+------+------+------+
|    0 |    0 |    0 |
|    1 |    1 |    1 |
|    3 |    3 |    3 |
|    4 |    4 |    4 |
+------+------+------+
rollback;

############################ test for update ################################
explain basic
merge into t1 t1 using t2 t2 on (t1.c1 = t2.c1) when matched then update set t1.c2 = t2.c1 + 100;
Query Plan
=============================
|ID|OPERATOR           |NAME|
-----------------------------
|0 |MERGE              |    |
|1 |└─HASH JOIN        |    |
|2 |  ├─TABLE FULL SCAN|T2  |
|3 |  └─TABLE FULL SCAN|T1  |
=============================
Outputs & filters:
-------------------------------------
  0 - output(nil), filter(nil)
      columns([{T1: ({T1: (T1.__pk_increment, T1.C1, T1.C2, T1.C3)})}]),
      update([T1.C2=column_conv(NUMBER,PS:(-1,0),NULL,T2.C1 + 100)]), 
      insert_conds(nil), update_conds(nil), delete_conds(nil)
  1 - output([T1.__pk_increment], [T1.C1], [T1.C2], [T1.C3], [T2.C1]), filter(nil), rowset=16
      equal_conds([T1.C1 = T2.C1]), other_conds(nil)
  2 - output([T2.C1]), filter(nil), rowset=16
      access([T2.C1]), partitions(p0)
      is_index_back=false, is_global_index=false, 
      range_key([T2.__pk_increment]), range(MIN ; MAX)always true
  3 - output([T1.__pk_increment], [T1.C1], [T1.C2], [T1.C3]), filter(nil), rowset=16
      access([T1.__pk_increment], [T1.C1], [T1.C2], [T1.C3]), partitions(p0)
      is_index_back=false, is_global_index=false, 
      range_key([T1.__pk_increment]), range(MIN ; MAX)always true
merge into t1 t1 using t2 t2 on (t1.c1 = t2.c1) when matched then update set t1.c2 = t2.c1 + 100;
select * from t1 order by 1;
+------+------+------+
| C1   | C2   | C3   |
+------+------+------+
|    0 |    0 |    0 |
|    1 |  101 |    1 |
|    3 |  103 |    3 |
|    4 |  104 |    4 |
+------+------+------+
rollback;

explain basic
merge into t1 t1 using tp2 t2 on (t1.c1 = t2.c1) when matched then update set t1.c2 = t2.c1 + 100;
Query Plan
=================================================
|ID|OPERATOR                           |NAME    |
-------------------------------------------------
|0 |MERGE                              |        |
|1 |└─PX COORDINATOR                   |        |
|2 |  └─EXCHANGE OUT DISTR             |:EX10001|
|3 |    └─HASH JOIN                    |        |
|4 |      ├─PX PARTITION ITERATOR      |        |
|5 |      │ └─TABLE FULL SCAN          |T2      |
|6 |      └─EXCHANGE IN DISTR          |        |
|7 |        └─EXCHANGE OUT DISTR (PKEY)|:EX10000|
|8 |          └─TABLE FULL SCAN        |T1      |
=================================================
Outputs & filters:
-------------------------------------
  0 - output(nil), filter(nil)
      columns([{T1: ({T1: (T1.__pk_increment, T1.C1, T1.C2, T1.C3)})}]),
      update([T1.C2=column_conv(NUMBER,PS:(-1,0),NULL,T2.C1 + 100)]), 
      insert_conds(nil), update_conds(nil), delete_conds(nil)
  1 - output([T1.__pk_increment], [T1.C1], [T1.C2], [T1.C3], [T2.C1]), filter(nil), rowset=16
  2 - output([T1.__pk_increment], [T1.C1], [T1.C2], [T1.C3], [T2.C1]), filter(nil), rowset=16
      dop=1
  3 - output([T1.__pk_increment], [T1.C1], [T1.C2], [T1.C3], [T2.C1]), filter(nil), rowset=16
      equal_conds([T1.C1 = T2.C1]), other_conds(nil)
  4 - output([T2.C1]), filter(nil), rowset=16
      affinitize, force partition granule
  5 - output([T2.C1]), filter(nil), rowset=16
      access([T2.C1]), partitions(p[0-1])
      is_index_back=false, is_global_index=false, 
      range_key([T2.__pk_increment]), range(MIN ; MAX)always true
  6 - output([T1.__pk_increment], [T1.C1], [T1.C2], [T1.C3]), filter(nil), rowset=16
  7 - output([T1.__pk_increment], [T1.C1], [T1.C2], [T1.C3]), filter(nil), rowset=16
      (#keys=1, [T1.C1]), is_single, dop=1
  8 - output([T1.__pk_increment], [T1.C1], [T1.C2], [T1.C3]), filter(nil), rowset=16
      access([T1.__pk_increment], [T1.C1], [T1.C2], [T1.C3]), partitions(p0)
      is_index_back=false, is_global_index=false, 
      range_key([T1.__pk_increment]), range(MIN ; MAX)always true
merge into t1 t1 using tp2 t2 on (t1.c1 = t2.c1) when matched then update set t1.c2 = t2.c1 + 100;
select * from t1 order by 1;
+------+------+------+
| C1   | C2   | C3   |
+------+------+------+
|    0 |    0 |    0 |
|    1 |  101 |    1 |
|    3 |  103 |    3 |
|    4 |  104 |    4 |
+------+------+------+
rollback;

explain basic
merge into tp1 t1 using t2 t2 on (t1.c1 = t2.c1) when matched then update set t1.c2 = t2.c1 + 100;
Query Plan
=================================================
|ID|OPERATOR                           |NAME    |
-------------------------------------------------
|0 |DISTRIBUTED MERGE                  |        |
|1 |└─PX COORDINATOR                   |        |
|2 |  └─EXCHANGE OUT DISTR             |:EX10001|
|3 |    └─HASH JOIN                    |        |
|4 |      ├─EXCHANGE IN DISTR          |        |
|5 |      │ └─EXCHANGE OUT DISTR (PKEY)|:EX10000|
|6 |      │   └─TABLE FULL SCAN        |T2      |
|7 |      └─PX PARTITION ITERATOR      |        |
|8 |        └─TABLE FULL SCAN          |T1      |
=================================================
Outputs & filters:
-------------------------------------
  0 - output(nil), filter(nil)
      columns([{T1: ({TP1: (T1.__pk_increment, T1.C1, T1.C2, T1.C3)})}]),
      update([T1.C2=column_conv(NUMBER,PS:(-1,0),NULL,T2.C1 + 100)]), 
      insert_conds(nil), update_conds(nil), delete_conds(nil)
  1 - output([T1.__pk_increment], [T1.C1], [T1.C2], [T1.C3], [T2.C1]), filter(nil), rowset=16
  2 - output([T1.__pk_increment], [T1.C1], [T1.C2], [T1.C3], [T2.C1]), filter(nil), rowset=16
      dop=1
  3 - output([T1.__pk_increment], [T1.C1], [T1.C2], [T1.C3], [T2.C1]), filter(nil), rowset=16
      equal_conds([T1.C1 = T2.C1]), other_conds(nil)
  4 - output([T2.C1]), filter(nil), rowset=16
  5 - output([T2.C1]), filter(nil), rowset=16
      (#keys=1, [T2.C1]), is_single, dop=1
  6 - output([T2.C1]), filter(nil), rowset=16
      access([T2.C1]), partitions(p0)
      is_index_back=false, is_global_index=false, 
      range_key([T2.__pk_increment]), range(MIN ; MAX)always true
  7 - output([T1.__pk_increment], [T1.C1], [T1.C2], [T1.C3]), filter(nil), rowset=16
      affinitize, force partition granule
  8 - output([T1.__pk_increment], [T1.C1], [T1.C2], [T1.C3]), filter(nil), rowset=16
      access([T1.__pk_increment], [T1.C1], [T1.C2], [T1.C3]), partitions(p[0-1])
      is_index_back=false, is_global_index=false, 
      range_key([T1.__pk_increment]), range(MIN ; MAX)always true
merge into tp1 t1 using t2 t2 on (t1.c1 = t2.c1) when matched then update set t1.c2 = t2.c1 + 100;
select * from tp1 order by 1;
+------+------+------+
| C1   | C2   | C3   |
+------+------+------+
|    0 |    0 |    0 |
|    1 |  101 |    1 |
|    3 |  103 |    3 |
|    4 |  104 |    4 |
+------+------+------+
rollback;

explain basic
merge into tp1 t1 using tp2 t2 on (t1.c1 = t2.c1) when matched then update set t1.c2 = t2.c1 + 100;
Query Plan
=======================================
|ID|OPERATOR                 |NAME    |
---------------------------------------
|0 |PX COORDINATOR           |        |
|1 |└─EXCHANGE OUT DISTR     |:EX10000|
|2 |  └─PX PARTITION ITERATOR|        |
|3 |    └─MERGE              |        |
|4 |      └─HASH JOIN        |        |
|5 |        ├─TABLE FULL SCAN|T2      |
|6 |        └─TABLE FULL SCAN|T1      |
=======================================
Outputs & filters:
-------------------------------------
  0 - output(nil), filter(nil), rowset=16
  1 - output(nil), filter(nil), rowset=16
      dop=1
  2 - output(nil), filter(nil), rowset=16
      partition wise, force partition granule
  3 - output(nil), filter(nil)
      columns([{T1: ({TP1: (T1.__pk_increment, T1.C1, T1.C2, T1.C3)})}]),
      update([T1.C2=column_conv(NUMBER,PS:(-1,0),NULL,T2.C1 + 100)]), 
      insert_conds(nil), update_conds(nil), delete_conds(nil)
  4 - output([T1.__pk_increment], [T1.C1], [T1.C2], [T1.C3], [T2.C1]), filter(nil), rowset=16
      equal_conds([T1.C1 = T2.C1]), other_conds(nil)
  5 - output([T2.C1]), filter(nil), rowset=16
      access([T2.C1]), partitions(p[0-1])
      is_index_back=false, is_global_index=false, 
      range_key([T2.__pk_increment]), range(MIN ; MAX)always true
  6 - output([T1.__pk_increment], [T1.C1], [T1.C2], [T1.C3]), filter(nil), rowset=16
      access([T1.__pk_increment], [T1.C1], [T1.C2], [T1.C3]), partitions(p[0-1])
      is_index_back=false, is_global_index=false, 
      range_key([T1.__pk_increment]), range(MIN ; MAX)always true
merge into tp1 t1 using tp2 t2 on (t1.c1 = t2.c1) when matched then update set t1.c2 = t2.c1 + 100;
select * from tp1 order by 1;
+------+------+------+
| C1   | C2   | C3   |
+------+------+------+
|    0 |    0 |    0 |
|    1 |  101 |    1 |
|    3 |  103 |    3 |
|    4 |  104 |    4 |
+------+------+------+
rollback;

explain basic
merge into v1 t1 using tp2 t2 on (t1.c1 = t2.c1) when matched then update set t1.c2 = t2.c1 + 100;
Query Plan
========================================================
|ID|OPERATOR                                  |NAME    |
--------------------------------------------------------
|0 |DISTRIBUTED MERGE                         |        |
|1 |└─PX COORDINATOR                          |        |
|2 |  └─EXCHANGE OUT DISTR                    |:EX10002|
|3 |    └─HASH JOIN                           |        |
|4 |      ├─PX PARTITION ITERATOR             |        |
|5 |      │ └─TABLE FULL SCAN                 |T2      |
|6 |      └─EXCHANGE IN DISTR                 |        |
|7 |        └─EXCHANGE OUT DISTR (PKEY)       |:EX10001|
|8 |          └─SUBPLAN SCAN                  |V1      |
|9 |            └─EXCHANGE IN MERGE SORT DISTR|        |
|10|              └─EXCHANGE OUT DISTR        |:EX10000|
|11|                └─SORT                    |        |
|12|                  └─PX PARTITION ITERATOR |        |
|13|                    └─TABLE FULL SCAN     |TP1     |
========================================================
Outputs & filters:
-------------------------------------
  0 - output(nil), filter(nil)
      columns([{T1: ({TP1: (T1.TP1.__pk_increment, T1.C1, T1.C2, T1.C3)})}]),
      update([T1.C2=column_conv(NUMBER,PS:(-1,0),NULL,T2.C1 + 100)]), 
      insert_conds(nil), update_conds(nil), delete_conds(nil)
  1 - output([T1.TP1.__pk_increment], [T1.C1], [T1.C2], [T1.C3], [T2.C1]), filter(nil), rowset=16
  2 - output([T1.TP1.__pk_increment], [T1.C1], [T1.C2], [T1.C3], [T2.C1]), filter(nil), rowset=16
      dop=1
  3 - output([T1.TP1.__pk_increment], [T1.C1], [T1.C2], [T1.C3], [T2.C1]), filter(nil), rowset=16
      equal_conds([T1.C1 = T2.C1]), other_conds(nil)
  4 - output([T2.C1]), filter(nil), rowset=16
      affinitize, force partition granule
  5 - output([T2.C1]), filter(nil), rowset=16
      access([T2.C1]), partitions(p[0-1])
      is_index_back=false, is_global_index=false, 
      range_key([T2.__pk_increment]), range(MIN ; MAX)always true
  6 - output([T1.TP1.__pk_increment], [T1.C1], [T1.C2], [T1.C3]), filter(nil), rowset=16
  7 - output([T1.TP1.__pk_increment], [T1.C1], [T1.C2], [T1.C3]), filter(nil), rowset=16
      (#keys=1, [T1.C1]), is_single, dop=1
  8 - output([T1.C1], [T1.C2], [T1.C3], [T1.TP1.__pk_increment]), filter(nil), rowset=16
      access([T1.C1], [T1.C2], [T1.C3], [T1.TP1.__pk_increment])
  9 - output([TP1.C1], [TP1.C2], [TP1.C3], [TP1.__pk_increment]), filter(nil), rowset=16
      sort_keys([TP1.C1, ASC])
 10 - output([TP1.C1], [TP1.C2], [TP1.C3], [TP1.__pk_increment]), filter(nil), rowset=16
      dop=1
 11 - output([TP1.C1], [TP1.C2], [TP1.C3], [TP1.__pk_increment]), filter(nil), rowset=16
      sort_keys([TP1.C1, ASC])
 12 - output([TP1.__pk_increment], [TP1.C1], [TP1.C2], [TP1.C3]), filter(nil), rowset=16
      force partition granule
 13 - output([TP1.__pk_increment], [TP1.C1], [TP1.C2], [TP1.C3]), filter(nil), rowset=16
      access([TP1.__pk_increment], [TP1.C1], [TP1.C2], [TP1.C3]), partitions(p[0-1])
      is_index_back=false, is_global_index=false, 
      range_key([TP1.__pk_increment]), range(MIN ; MAX)always true
merge into v1 t1 using tp2 t2 on (t1.c1 = t2.c1) when matched then update set t1.c2 = t2.c1 + 100;
select * from tp1 order by 1;
+------+------+------+
| C1   | C2   | C3   |
+------+------+------+
|    0 |    0 |    0 |
|    1 |  101 |    1 |
|    3 |  103 |    3 |
|    4 |  104 |    4 |
+------+------+------+
rollback;

explain basic
merge into v2 t1 using tp2 t2 on (t1.c1 = t2.c1) when matched then update set t1.c2 = t2.c1 + 100;
Query Plan
=======================================
|ID|OPERATOR                     |NAME|
---------------------------------------
|0 |MERGE                        |    |
|1 |└─NESTED-LOOP JOIN CARTESIAN |    |
|2 |  ├─SUBPLAN SCAN             |V2  |
|3 |  │ └─TABLE FULL SCAN        |TP1 |
|4 |  └─MATERIAL                 |    |
|5 |    └─TABLE FULL SCAN        |T2  |
=======================================
Outputs & filters:
-------------------------------------
  0 - output(nil), filter(nil)
      columns([{T1: ({TP1: (T1.TP1.__pk_increment, T1.C1, T1.C2, T1.C3)})}]),
      update([T1.C2=column_conv(NUMBER,PS:(-1,0),NULL,T2.C1 + 100)]), 
      insert_conds(nil), update_conds(nil), delete_conds(nil)
  1 - output([T1.TP1.__pk_increment], [T1.C1], [T1.C2], [T1.C3], [T2.C1]), filter(nil), rowset=16
      conds(nil), nl_params_(nil), use_batch=false
  2 - output([T1.C1], [T1.C2], [T1.C3], [T1.TP1.__pk_increment]), filter(nil), rowset=16
      access([T1.C1], [T1.C2], [T1.C3], [T1.TP1.__pk_increment])
  3 - output([TP1.C1], [TP1.C2], [TP1.C3], [TP1.__pk_increment]), filter([TP1.C1 = 3]), rowset=16
      access([TP1.__pk_increment], [TP1.C1], [TP1.C2], [TP1.C3]), partitions(p0)
      is_index_back=false, is_global_index=false, filter_before_indexback[false], 
      range_key([TP1.__pk_increment]), range(MIN ; MAX)always true
  4 - output([T2.C1]), filter(nil), rowset=16
  5 - output([T2.C1]), filter([3 = T2.C1]), rowset=16
      access([T2.C1]), partitions(p0)
      is_index_back=false, is_global_index=false, filter_before_indexback[false], 
      range_key([T2.__pk_increment]), range(MIN ; MAX)always true
merge into v2 t1 using tp2 t2 on (t1.c1 = t2.c1) when matched then update set t1.c2 = t2.c1 + 100;
select * from tp1 order by 1;
+------+------+------+
| C1   | C2   | C3   |
+------+------+------+
|    0 |    0 |    0 |
|    1 |    1 |    1 |
|    3 |  103 |    3 |
|    4 |    4 |    4 |
+------+------+------+
rollback;

explain basic
merge into tp1 t1 using (select * from tp2 where c1 = 3) t2 on (t1.c1 = t2.c1) when matched then update set t1.c2 = t2.c1 + 100;
Query Plan
=======================================
|ID|OPERATOR                     |NAME|
---------------------------------------
|0 |MERGE                        |    |
|1 |└─NESTED-LOOP JOIN CARTESIAN |    |
|2 |  ├─TABLE FULL SCAN          |T1  |
|3 |  └─MATERIAL                 |    |
|4 |    └─SUBPLAN SCAN           |T2  |
|5 |      └─TABLE FULL SCAN      |TP2 |
=======================================
Outputs & filters:
-------------------------------------
  0 - output(nil), filter(nil)
      columns([{T1: ({TP1: (T1.__pk_increment, T1.C1, T1.C2, T1.C3)})}]),
      update([T1.C2=column_conv(NUMBER,PS:(-1,0),NULL,T2.C1 + 100)]), 
      insert_conds(nil), update_conds(nil), delete_conds(nil)
  1 - output([T1.__pk_increment], [T1.C1], [T1.C2], [T1.C3], [T2.C1]), filter(nil), rowset=16
      conds(nil), nl_params_(nil), use_batch=false
  2 - output([T1.__pk_increment], [T1.C1], [T1.C2], [T1.C3]), filter([T1.C1 = 3]), rowset=16
      access([T1.__pk_increment], [T1.C1], [T1.C2], [T1.C3]), partitions(p0)
      is_index_back=false, is_global_index=false, filter_before_indexback[false], 
      range_key([T1.__pk_increment]), range(MIN ; MAX)always true
  3 - output([T2.C1]), filter(nil), rowset=16
  4 - output([T2.C1]), filter(nil), rowset=16
      access([T2.C1])
  5 - output([TP2.C1]), filter([TP2.C1 = 3]), rowset=16
      access([TP2.C1]), partitions(p0)
      is_index_back=false, is_global_index=false, filter_before_indexback[false], 
      range_key([TP2.__pk_increment]), range(MIN ; MAX)always true
merge into tp1 t1 using (select * from tp2 where c1 = 3) t2 on (t1.c1 = t2.c1) when matched then update set t1.c2 = t2.c1 + 100;
select * from tp1 order by 1;
+------+------+------+
| C1   | C2   | C3   |
+------+------+------+
|    0 |    0 |    0 |
|    1 |    1 |    1 |
|    3 |  103 |    3 |
|    4 |    4 |    4 |
+------+------+------+
rollback;

explain basic
merge into v2 t1 using (select * from tp2 where c1 = 3) t2 on (t1.c1 = t2.c1) when matched then update set t1.c2 = t2.c1 + 100;
Query Plan
=======================================
|ID|OPERATOR                     |NAME|
---------------------------------------
|0 |MERGE                        |    |
|1 |└─NESTED-LOOP JOIN CARTESIAN |    |
|2 |  ├─SUBPLAN SCAN             |V2  |
|3 |  │ └─TABLE FULL SCAN        |TP1 |
|4 |  └─MATERIAL                 |    |
|5 |    └─SUBPLAN SCAN           |T2  |
|6 |      └─TABLE FULL SCAN      |TP2 |
=======================================
Outputs & filters:
-------------------------------------
  0 - output(nil), filter(nil)
      columns([{T1: ({TP1: (T1.TP1.__pk_increment, T1.C1, T1.C2, T1.C3)})}]),
      update([T1.C2=column_conv(NUMBER,PS:(-1,0),NULL,T2.C1 + 100)]), 
      insert_conds(nil), update_conds(nil), delete_conds(nil)
  1 - output([T1.TP1.__pk_increment], [T1.C1], [T1.C2], [T1.C3], [T2.C1]), filter(nil), rowset=16
      conds(nil), nl_params_(nil), use_batch=false
  2 - output([T1.C1], [T1.C2], [T1.C3], [T1.TP1.__pk_increment]), filter(nil), rowset=16
      access([T1.C1], [T1.C2], [T1.C3], [T1.TP1.__pk_increment])
  3 - output([TP1.C1], [TP1.C2], [TP1.C3], [TP1.__pk_increment]), filter([TP1.C1 = 3]), rowset=16
      access([TP1.__pk_increment], [TP1.C1], [TP1.C2], [TP1.C3]), partitions(p0)
      is_index_back=false, is_global_index=false, filter_before_indexback[false], 
      range_key([TP1.__pk_increment]), range(MIN ; MAX)always true
  4 - output([T2.C1]), filter(nil), rowset=16
  5 - output([T2.C1]), filter(nil), rowset=16
      access([T2.C1])
  6 - output([TP2.C1]), filter([TP2.C1 = 3]), rowset=16
      access([TP2.C1]), partitions(p0)
      is_index_back=false, is_global_index=false, filter_before_indexback[false], 
      range_key([TP2.__pk_increment]), range(MIN ; MAX)always true
merge into v2 t1 using (select * from tp2 where c1 = 3) t2 on (t1.c1 = t2.c1) when matched then update set t1.c2 = t2.c1 + 100;
select * from tp1 order by 1;
+------+------+------+
| C1   | C2   | C3   |
+------+------+------+
|    0 |    0 |    0 |
|    1 |    1 |    1 |
|    3 |  103 |    3 |
|    4 |    4 |    4 |
+------+------+------+
rollback;

explain basic
merge into v2 t1 using (select * from tp2 where c1 = 5) t2 on (t1.c1 = t2.c1) when matched then update set t1.c2 = t2.c1 + 100;
Query Plan
=======================================
|ID|OPERATOR                     |NAME|
---------------------------------------
|0 |MERGE                        |    |
|1 |└─NESTED-LOOP JOIN CARTESIAN |    |
|2 |  ├─SUBPLAN SCAN             |V2  |
|3 |  │ └─TABLE FULL SCAN        |TP1 |
|4 |  └─MATERIAL                 |    |
|5 |    └─SUBPLAN SCAN           |T2  |
|6 |      └─TABLE FULL SCAN      |TP2 |
=======================================
Outputs & filters:
-------------------------------------
  0 - output(nil), filter(nil)
      columns([{T1: ({TP1: (T1.TP1.__pk_increment, T1.C1, T1.C2, T1.C3)})}]),
      update([T1.C2=column_conv(NUMBER,PS:(-1,0),NULL,T2.C1 + 100)]), 
      insert_conds(nil), update_conds(nil), delete_conds(nil)
  1 - output([T1.TP1.__pk_increment], [T1.C1], [T1.C2], [T1.C3], [T2.C1]), filter(nil), startup_filter([0]), rowset=16
      conds(nil), nl_params_(nil), use_batch=false
  2 - output([T1.C1], [T1.C2], [T1.C3], [T1.TP1.__pk_increment]), filter(nil), rowset=16
      access([T1.C1], [T1.C2], [T1.C3], [T1.TP1.__pk_increment])
  3 - output([TP1.C1], [TP1.C2], [TP1.C3], [TP1.__pk_increment]), filter([TP1.C1 = 3]), rowset=16
      access([TP1.__pk_increment], [TP1.C1], [TP1.C2], [TP1.C3]), partitions(p0)
      is_index_back=false, is_global_index=false, filter_before_indexback[false], 
      range_key([TP1.__pk_increment]), range(MIN ; MAX)always true
  4 - output([T2.C1]), filter(nil), rowset=16
  5 - output([T2.C1]), filter(nil), rowset=16
      access([T2.C1])
  6 - output([TP2.C1]), filter(nil), rowset=16
      access([TP2.C1]), partitions(p0)
      is_index_back=false, is_global_index=false, 
      range_key([TP2.__pk_increment]), range(MIN ; MAX)always true
merge into v2 t1 using (select * from tp2 where c1 = 5) t2 on (t1.c1 = t2.c1) when matched then update set t1.c2 = t2.c1 + 100;
select * from tp1 order by 1;
+------+------+------+
| C1   | C2   | C3   |
+------+------+------+
|    0 |    0 |    0 |
|    1 |    1 |    1 |
|    3 |    3 |    3 |
|    4 |    4 |    4 |
+------+------+------+
rollback;

explain basic
merge into t1 using (select 1 c1 from dual) t2 on (t1.c1 = t2.c1) when matched then update set t1.c2 = t2.c1 + 100;
Query Plan
=======================================
|ID|OPERATOR                     |NAME|
---------------------------------------
|0 |MERGE                        |    |
|1 |└─NESTED-LOOP JOIN CARTESIAN |    |
|2 |  ├─SUBPLAN SCAN             |T2  |
|3 |  │ └─EXPRESSION             |    |
|4 |  └─TABLE FULL SCAN          |T1  |
=======================================
Outputs & filters:
-------------------------------------
  0 - output(nil), filter(nil)
      columns([{T1: ({T1: (T1.__pk_increment, T1.C1, T1.C2, T1.C3)})}]),
      update([T1.C2=column_conv(NUMBER,PS:(-1,0),NULL,T2.C1 + 100)]), 
      insert_conds(nil), update_conds(nil), delete_conds(nil)
  1 - output([T1.__pk_increment], [T1.C1], [T1.C2], [T1.C3], [T2.C1]), filter(nil), rowset=16
      conds(nil), nl_params_(nil), use_batch=false
  2 - output([T2.C1]), filter(nil), rowset=16
      access([T2.C1])
  3 - output([1]), filter(nil)
      values({1})
  4 - output([T1.__pk_increment], [T1.C1], [T1.C2], [T1.C3]), filter([T1.C1 = 1]), rowset=16
      access([T1.__pk_increment], [T1.C1], [T1.C2], [T1.C3]), partitions(p0)
      is_index_back=false, is_global_index=false, filter_before_indexback[false], 
      range_key([T1.__pk_increment]), range(MIN ; MAX)always true
merge into t1 using (select 1 c1 from dual) t2 on (t1.c1 = t2.c1) when matched then update set t1.c2 = t2.c1 + 100;
select * from t1 order by 1;
+------+------+------+
| C1   | C2   | C3   |
+------+------+------+
|    0 |    0 |    0 |
|    1 |  101 |    1 |
|    3 |    3 |    3 |
|    4 |    4 |    4 |
+------+------+------+
rollback;

explain basic
merge into tp1 t1 using (select 1 c1 from dual) t2 on (t1.c1 = t2.c1) when matched then update set t1.c2 = t2.c1 + 100;
Query Plan
=======================================
|ID|OPERATOR                     |NAME|
---------------------------------------
|0 |MERGE                        |    |
|1 |└─NESTED-LOOP JOIN CARTESIAN |    |
|2 |  ├─SUBPLAN SCAN             |T2  |
|3 |  │ └─EXPRESSION             |    |
|4 |  └─TABLE FULL SCAN          |T1  |
=======================================
Outputs & filters:
-------------------------------------
  0 - output(nil), filter(nil)
      columns([{T1: ({TP1: (T1.__pk_increment, T1.C1, T1.C2, T1.C3)})}]),
      update([T1.C2=column_conv(NUMBER,PS:(-1,0),NULL,T2.C1 + 100)]), 
      insert_conds(nil), update_conds(nil), delete_conds(nil)
  1 - output([T1.__pk_increment], [T1.C1], [T1.C2], [T1.C3], [T2.C1]), filter(nil), rowset=16
      conds(nil), nl_params_(nil), use_batch=false
  2 - output([T2.C1]), filter(nil), rowset=16
      access([T2.C1])
  3 - output([1]), filter(nil)
      values({1})
  4 - output([T1.__pk_increment], [T1.C1], [T1.C2], [T1.C3]), filter([T1.C1 = 1]), rowset=16
      access([T1.__pk_increment], [T1.C1], [T1.C2], [T1.C3]), partitions(p1)
      is_index_back=false, is_global_index=false, filter_before_indexback[false], 
      range_key([T1.__pk_increment]), range(MIN ; MAX)always true
merge into tp1 t1 using (select 1 c1 from dual) t2 on (t1.c1 = t2.c1) when matched then update set t1.c2 = t2.c1 + 100;
select * from tp1 order by 1;
+------+------+------+
| C1   | C2   | C3   |
+------+------+------+
|    0 |    0 |    0 |
|    1 |  101 |    1 |
|    3 |    3 |    3 |
|    4 |    4 |    4 |
+------+------+------+
rollback;

############################ test for update & insert ################################
explain basic
merge into t1 t1 using t2 t2 on (t1.c1 = t2.c1) when matched then update set t1.c2 = t2.c1 + 100
when not matched then insert values (t2.c1, t2.c2, t2.c3);
Query Plan
==================================
|ID|OPERATOR                |NAME|
----------------------------------
|0 |MERGE                   |    |
|1 |└─HASH RIGHT OUTER JOIN |    |
|2 |  ├─TABLE FULL SCAN     |T1  |
|3 |  └─TABLE FULL SCAN     |T2  |
==================================
Outputs & filters:
-------------------------------------
  0 - output(nil), filter(nil)
      columns([{T1: ({T1: (T1.__pk_increment, T1.C1, T1.C2, T1.C3)})}]), partitions(p0), 
      column_values([T_HIDDEN_PK], [column_conv(NUMBER,PS:(-1,0),NULL,T2.C1)], [column_conv(NUMBER,PS:(-1,0),NULL,T2.C2)], [column_conv(NUMBER,PS:(-1,0),
      NULL,T2.C3)]),
      update([T1.C2=column_conv(NUMBER,PS:(-1,0),NULL,T2.C1 + 100)]), 
      insert_conds(nil), update_conds(nil), delete_conds(nil)
  1 - output([T1.__pk_increment], [T1.C1], [T1.C2], [T1.C3], [T2.C1], [T2.C2], [T2.C3]), filter(nil), rowset=16
      equal_conds([T1.C1 = T2.C1]), other_conds(nil)
  2 - output([T1.__pk_increment], [T1.C1], [T1.C2], [T1.C3]), filter(nil), rowset=16
      access([T1.__pk_increment], [T1.C1], [T1.C2], [T1.C3]), partitions(p0)
      is_index_back=false, is_global_index=false, 
      range_key([T1.__pk_increment]), range(MIN ; MAX)always true
  3 - output([T2.C1], [T2.C2], [T2.C3]), filter(nil), rowset=16
      access([T2.C1], [T2.C2], [T2.C3]), partitions(p0)
      is_index_back=false, is_global_index=false, 
      range_key([T2.__pk_increment]), range(MIN ; MAX)always true
merge into t1 t1 using t2 t2 on (t1.c1 = t2.c1) when matched then update set t1.c2 = t2.c1 + 100
when not matched then insert values (t2.c1, t2.c2, t2.c3);
select * from t1 order by 1;
+------+------+------+
| C1   | C2   | C3   |
+------+------+------+
|    0 |    0 |    0 |
|    1 |  101 |    1 |
|    2 |    2 |    2 |
|    3 |  103 |    3 |
|    4 |  104 |    4 |
|    5 |    5 |    5 |
+------+------+------+
rollback;

explain basic
merge into t1 t1 using tp2 t2 on (t1.c1 = t2.c1) when matched then update set t1.c2 = t2.c1 + 100
when not matched then insert values (t2.c1, t2.c2, t2.c3);
Query Plan
=================================================
|ID|OPERATOR                           |NAME    |
-------------------------------------------------
|0 |MERGE                              |        |
|1 |└─PX COORDINATOR                   |        |
|2 |  └─EXCHANGE OUT DISTR             |:EX10001|
|3 |    └─HASH RIGHT OUTER JOIN        |        |
|4 |      ├─EXCHANGE IN DISTR          |        |
|5 |      │ └─EXCHANGE OUT DISTR (PKEY)|:EX10000|
|6 |      │   └─TABLE FULL SCAN        |T1      |
|7 |      └─PX PARTITION ITERATOR      |        |
|8 |        └─TABLE FULL SCAN          |T2      |
=================================================
Outputs & filters:
-------------------------------------
  0 - output(nil), filter(nil)
      columns([{T1: ({T1: (T1.__pk_increment, T1.C1, T1.C2, T1.C3)})}]), partitions(p0), 
      column_values([T_HIDDEN_PK], [column_conv(NUMBER,PS:(-1,0),NULL,T2.C1)], [column_conv(NUMBER,PS:(-1,0),NULL,T2.C2)], [column_conv(NUMBER,PS:(-1,0),
      NULL,T2.C3)]),
      update([T1.C2=column_conv(NUMBER,PS:(-1,0),NULL,T2.C1 + 100)]), 
      insert_conds(nil), update_conds(nil), delete_conds(nil)
  1 - output([T1.__pk_increment], [T1.C1], [T1.C2], [T1.C3], [T2.C1], [T2.C2], [T2.C3]), filter(nil), rowset=16
  2 - output([T1.__pk_increment], [T1.C1], [T1.C2], [T1.C3], [T2.C1], [T2.C2], [T2.C3]), filter(nil), rowset=16
      dop=1
  3 - output([T1.__pk_increment], [T1.C1], [T1.C2], [T1.C3], [T2.C1], [T2.C2], [T2.C3]), filter(nil), rowset=16
      equal_conds([T1.C1 = T2.C1]), other_conds(nil)
  4 - output([T1.__pk_increment], [T1.C1], [T1.C2], [T1.C3]), filter(nil), rowset=16
  5 - output([T1.__pk_increment], [T1.C1], [T1.C2], [T1.C3]), filter(nil), rowset=16
      (#keys=1, [T1.C1]), is_single, dop=1
  6 - output([T1.__pk_increment], [T1.C1], [T1.C2], [T1.C3]), filter(nil), rowset=16
      access([T1.__pk_increment], [T1.C1], [T1.C2], [T1.C3]), partitions(p0)
      is_index_back=false, is_global_index=false, 
      range_key([T1.__pk_increment]), range(MIN ; MAX)always true
  7 - output([T2.C1], [T2.C2], [T2.C3]), filter(nil), rowset=16
      affinitize, force partition granule
  8 - output([T2.C1], [T2.C2], [T2.C3]), filter(nil), rowset=16
      access([T2.C1], [T2.C2], [T2.C3]), partitions(p[0-1])
      is_index_back=false, is_global_index=false, 
      range_key([T2.__pk_increment]), range(MIN ; MAX)always true
merge into t1 t1 using tp2 t2 on (t1.c1 = t2.c1) when matched then update set t1.c2 = t2.c1 + 100
when not matched then insert values (t2.c1, t2.c2, t2.c3);
select * from t1 order by 1;
+------+------+------+
| C1   | C2   | C3   |
+------+------+------+
|    0 |    0 |    0 |
|    1 |  101 |    1 |
|    2 |    2 |    2 |
|    3 |  103 |    3 |
|    4 |  104 |    4 |
|    5 |    5 |    5 |
+------+------+------+
rollback;

explain basic
merge into tp1 t1 using t2 t2 on (t1.c1 = t2.c1) when matched then update set t1.c2 = t2.c1 + 100
when not matched then insert values (t2.c1, t2.c2, t2.c3);
Query Plan
=================================================
|ID|OPERATOR                           |NAME    |
-------------------------------------------------
|0 |DISTRIBUTED MERGE                  |        |
|1 |└─PX COORDINATOR                   |        |
|2 |  └─EXCHANGE OUT DISTR             |:EX10001|
|3 |    └─HASH RIGHT OUTER JOIN        |        |
|4 |      ├─PX PARTITION ITERATOR      |        |
|5 |      │ └─TABLE FULL SCAN          |T1      |
|6 |      └─EXCHANGE IN DISTR          |        |
|7 |        └─EXCHANGE OUT DISTR (PKEY)|:EX10000|
|8 |          └─TABLE FULL SCAN        |T2      |
=================================================
Outputs & filters:
-------------------------------------
  0 - output(nil), filter(nil)
      columns([{T1: ({TP1: (T1.__pk_increment, T1.C1, T1.C2, T1.C3)})}]), partitions(p[0-1]), 
      column_values([T_HIDDEN_PK], [column_conv(NUMBER,PS:(-1,0),NULL,T2.C1)], [column_conv(NUMBER,PS:(-1,0),NULL,T2.C2)], [column_conv(NUMBER,PS:(-1,0),
      NULL,T2.C3)]),
      update([T1.C2=column_conv(NUMBER,PS:(-1,0),NULL,T2.C1 + 100)]), 
      insert_conds(nil), update_conds(nil), delete_conds(nil)
  1 - output([T1.__pk_increment], [T1.C1], [T1.C2], [T1.C3], [T2.C1], [T2.C2], [T2.C3]), filter(nil), rowset=16
  2 - output([T1.__pk_increment], [T1.C1], [T1.C2], [T1.C3], [T2.C1], [T2.C2], [T2.C3]), filter(nil), rowset=16
      dop=1
  3 - output([T1.__pk_increment], [T1.C1], [T1.C2], [T1.C3], [T2.C1], [T2.C2], [T2.C3]), filter(nil), rowset=16
      equal_conds([T1.C1 = T2.C1]), other_conds(nil)
  4 - output([T1.__pk_increment], [T1.C1], [T1.C2], [T1.C3]), filter(nil), rowset=16
      affinitize, force partition granule
  5 - output([T1.__pk_increment], [T1.C1], [T1.C2], [T1.C3]), filter(nil), rowset=16
      access([T1.__pk_increment], [T1.C1], [T1.C2], [T1.C3]), partitions(p[0-1])
      is_index_back=false, is_global_index=false, 
      range_key([T1.__pk_increment]), range(MIN ; MAX)always true
  6 - output([T2.C1], [T2.C2], [T2.C3]), filter(nil), rowset=16
  7 - output([T2.C1], [T2.C2], [T2.C3]), filter(nil), rowset=16
      (#keys=1, [T2.C1]), is_single, dop=1
  8 - output([T2.C1], [T2.C2], [T2.C3]), filter(nil), rowset=16
      access([T2.C1], [T2.C2], [T2.C3]), partitions(p0)
      is_index_back=false, is_global_index=false, 
      range_key([T2.__pk_increment]), range(MIN ; MAX)always true
merge into tp1 t1 using t2 t2 on (t1.c1 = t2.c1) when matched then update set t1.c2 = t2.c1 + 100
when not matched then insert values (t2.c1, t2.c2, t2.c3);
select * from tp1 order by 1;
+------+------+------+
| C1   | C2   | C3   |
+------+------+------+
|    0 |    0 |    0 |
|    1 |  101 |    1 |
|    2 |    2 |    2 |
|    3 |  103 |    3 |
|    4 |  104 |    4 |
|    5 |    5 |    5 |
+------+------+------+
rollback;

explain basic
merge into tp1 t1 using tp2 t2 on (t1.c1 = t2.c1) when matched then update set t1.c2 = t2.c1 + 100
when not matched then insert values (t2.c1, t2.c2, t2.c3);
Query Plan
============================================
|ID|OPERATOR                      |NAME    |
--------------------------------------------
|0 |PX COORDINATOR                |        |
|1 |└─EXCHANGE OUT DISTR          |:EX10000|
|2 |  └─PX PARTITION ITERATOR     |        |
|3 |    └─MERGE                   |        |
|4 |      └─HASH RIGHT OUTER JOIN |        |
|5 |        ├─TABLE FULL SCAN     |T1      |
|6 |        └─TABLE FULL SCAN     |T2      |
============================================
Outputs & filters:
-------------------------------------
  0 - output(nil), filter(nil), rowset=16
  1 - output(nil), filter(nil), rowset=16
      dop=1
  2 - output(nil), filter(nil), rowset=16
      partition wise, force partition granule
  3 - output(nil), filter(nil)
      columns([{T1: ({TP1: (T1.__pk_increment, T1.C1, T1.C2, T1.C3)})}]), partitions(p[0-1]), 
      column_values([T_HIDDEN_PK], [column_conv(NUMBER,PS:(-1,0),NULL,T2.C1)], [column_conv(NUMBER,PS:(-1,0),NULL,T2.C2)], [column_conv(NUMBER,PS:(-1,0),
      NULL,T2.C3)]),
      update([T1.C2=column_conv(NUMBER,PS:(-1,0),NULL,T2.C1 + 100)]), 
      insert_conds(nil), update_conds(nil), delete_conds(nil)
  4 - output([T1.__pk_increment], [T1.C1], [T1.C2], [T1.C3], [T2.C1], [T2.C2], [T2.C3]), filter(nil), rowset=16
      equal_conds([T1.C1 = T2.C1]), other_conds(nil)
  5 - output([T1.__pk_increment], [T1.C1], [T1.C2], [T1.C3]), filter(nil), rowset=16
      access([T1.__pk_increment], [T1.C1], [T1.C2], [T1.C3]), partitions(p[0-1])
      is_index_back=false, is_global_index=false, 
      range_key([T1.__pk_increment]), range(MIN ; MAX)always true
  6 - output([T2.C1], [T2.C2], [T2.C3]), filter(nil), rowset=16
      access([T2.C1], [T2.C2], [T2.C3]), partitions(p[0-1])
      is_index_back=false, is_global_index=false, 
      range_key([T2.__pk_increment]), range(MIN ; MAX)always true
merge into tp1 t1 using tp2 t2 on (t1.c1 = t2.c1) when matched then update set t1.c2 = t2.c1 + 100
when not matched then insert values (t2.c1, t2.c2, t2.c3);
select * from tp1 order by 1;
+------+------+------+
| C1   | C2   | C3   |
+------+------+------+
|    0 |    0 |    0 |
|    1 |  101 |    1 |
|    2 |    2 |    2 |
|    3 |  103 |    3 |
|    4 |  104 |    4 |
|    5 |    5 |    5 |
+------+------+------+
rollback;

explain basic
merge into tp1 t1 using tp2 t2 on (t1.c1 = t2.c1) when matched then update set t1.c2 = t2.c1 + 100
when not matched then insert values (t2.c2, t2.c1, t2.c3);
Query Plan
============================================
|ID|OPERATOR                      |NAME    |
--------------------------------------------
|0 |DISTRIBUTED MERGE             |        |
|1 |└─PX COORDINATOR              |        |
|2 |  └─EXCHANGE OUT DISTR        |:EX10000|
|3 |    └─PX PARTITION ITERATOR   |        |
|4 |      └─HASH RIGHT OUTER JOIN |        |
|5 |        ├─TABLE FULL SCAN     |T1      |
|6 |        └─TABLE FULL SCAN     |T2      |
============================================
Outputs & filters:
-------------------------------------
  0 - output(nil), filter(nil)
      columns([{T1: ({TP1: (T1.__pk_increment, T1.C1, T1.C2, T1.C3)})}]), partitions(p[0-1]), 
      column_values([T_HIDDEN_PK], [column_conv(NUMBER,PS:(-1,0),NULL,T2.C2)], [column_conv(NUMBER,PS:(-1,0),NULL,T2.C1)], [column_conv(NUMBER,PS:(-1,0),
      NULL,T2.C3)]),
      update([T1.C2=column_conv(NUMBER,PS:(-1,0),NULL,T2.C1 + 100)]), 
      insert_conds(nil), update_conds(nil), delete_conds(nil)
  1 - output([T1.__pk_increment], [T1.C1], [T1.C2], [T1.C3], [T2.C1], [T2.C2], [T2.C3]), filter(nil), rowset=16
  2 - output([T1.__pk_increment], [T1.C1], [T1.C2], [T1.C3], [T2.C1], [T2.C2], [T2.C3]), filter(nil), rowset=16
      dop=1
  3 - output([T1.__pk_increment], [T1.C1], [T1.C2], [T1.C3], [T2.C1], [T2.C2], [T2.C3]), filter(nil), rowset=16
      partition wise, force partition granule
  4 - output([T1.__pk_increment], [T1.C1], [T1.C2], [T1.C3], [T2.C1], [T2.C2], [T2.C3]), filter(nil), rowset=16
      equal_conds([T1.C1 = T2.C1]), other_conds(nil)
  5 - output([T1.__pk_increment], [T1.C1], [T1.C2], [T1.C3]), filter(nil), rowset=16
      access([T1.__pk_increment], [T1.C1], [T1.C2], [T1.C3]), partitions(p[0-1])
      is_index_back=false, is_global_index=false, 
      range_key([T1.__pk_increment]), range(MIN ; MAX)always true
  6 - output([T2.C1], [T2.C2], [T2.C3]), filter(nil), rowset=16
      access([T2.C1], [T2.C2], [T2.C3]), partitions(p[0-1])
      is_index_back=false, is_global_index=false, 
      range_key([T2.__pk_increment]), range(MIN ; MAX)always true
merge into tp1 t1 using tp2 t2 on (t1.c1 = t2.c1) when matched then update set t1.c2 = t2.c1 + 100
when not matched then insert values (t2.c2, t2.c1, t2.c3);
select * from tp1 order by 1;
+------+------+------+
| C1   | C2   | C3   |
+------+------+------+
|    0 |    0 |    0 |
|    1 |  101 |    1 |
|    2 |    2 |    2 |
|    3 |  103 |    3 |
|    4 |  104 |    4 |
|    5 |    5 |    5 |
+------+------+------+
rollback;

explain basic
merge into v1 t1 using tp2 t2 on (t1.c1 = t2.c1) when matched then update set t1.c2 = t2.c1 + 100
when not matched then insert values (t2.c1, t2.c2, t2.c3);
Query Plan
========================================================
|ID|OPERATOR                                  |NAME    |
--------------------------------------------------------
|0 |DISTRIBUTED MERGE                         |        |
|1 |└─PX COORDINATOR                          |        |
|2 |  └─EXCHANGE OUT DISTR                    |:EX10002|
|3 |    └─HASH RIGHT OUTER JOIN               |        |
|4 |      ├─EXCHANGE IN DISTR                 |        |
|5 |      │ └─EXCHANGE OUT DISTR (PKEY)       |:EX10001|
|6 |      │   └─SUBPLAN SCAN                  |V1      |
|7 |      │     └─EXCHANGE IN MERGE SORT DISTR|        |
|8 |      │       └─EXCHANGE OUT DISTR        |:EX10000|
|9 |      │         └─SORT                    |        |
|10|      │           └─PX PARTITION ITERATOR |        |
|11|      │             └─TABLE FULL SCAN     |TP1     |
|12|      └─PX PARTITION ITERATOR             |        |
|13|        └─TABLE FULL SCAN                 |T2      |
========================================================
Outputs & filters:
-------------------------------------
  0 - output(nil), filter(nil)
      columns([{T1: ({TP1: (T1.TP1.__pk_increment, T1.C1, T1.C2, T1.C3)})}]), partitions(p[0-1]), 
      column_values([T_HIDDEN_PK], [column_conv(NUMBER,PS:(-1,0),NULL,T2.C1)], [column_conv(NUMBER,PS:(-1,0),NULL,T2.C2)], [column_conv(NUMBER,PS:(-1,0),
      NULL,T2.C3)]),
      update([T1.C2=column_conv(NUMBER,PS:(-1,0),NULL,T2.C1 + 100)]), 
      insert_conds(nil), update_conds(nil), delete_conds(nil)
  1 - output([T1.TP1.__pk_increment], [T1.C1], [T1.C2], [T1.C3], [T2.C1], [T2.C2], [T2.C3]), filter(nil), rowset=16
  2 - output([T1.TP1.__pk_increment], [T1.C1], [T1.C2], [T1.C3], [T2.C1], [T2.C2], [T2.C3]), filter(nil), rowset=16
      dop=1
  3 - output([T1.TP1.__pk_increment], [T1.C1], [T1.C2], [T1.C3], [T2.C1], [T2.C2], [T2.C3]), filter(nil), rowset=16
      equal_conds([T1.C1 = T2.C1]), other_conds(nil)
  4 - output([T1.TP1.__pk_increment], [T1.C1], [T1.C2], [T1.C3]), filter(nil), rowset=16
  5 - output([T1.TP1.__pk_increment], [T1.C1], [T1.C2], [T1.C3]), filter(nil), rowset=16
      (#keys=1, [T1.C1]), is_single, dop=1
  6 - output([T1.C1], [T1.C2], [T1.C3], [T1.TP1.__pk_increment]), filter(nil), rowset=16
      access([T1.C1], [T1.C2], [T1.C3], [T1.TP1.__pk_increment])
  7 - output([TP1.C1], [TP1.C2], [TP1.C3], [TP1.__pk_increment]), filter(nil), rowset=16
      sort_keys([TP1.C1, ASC])
  8 - output([TP1.C1], [TP1.C2], [TP1.C3], [TP1.__pk_increment]), filter(nil), rowset=16
      dop=1
  9 - output([TP1.C1], [TP1.C2], [TP1.C3], [TP1.__pk_increment]), filter(nil), rowset=16
      sort_keys([TP1.C1, ASC])
 10 - output([TP1.__pk_increment], [TP1.C1], [TP1.C2], [TP1.C3]), filter(nil), rowset=16
      force partition granule
 11 - output([TP1.__pk_increment], [TP1.C1], [TP1.C2], [TP1.C3]), filter(nil), rowset=16
      access([TP1.__pk_increment], [TP1.C1], [TP1.C2], [TP1.C3]), partitions(p[0-1])
      is_index_back=false, is_global_index=false, 
      range_key([TP1.__pk_increment]), range(MIN ; MAX)always true
 12 - output([T2.C1], [T2.C2], [T2.C3]), filter(nil), rowset=16
      affinitize, force partition granule
 13 - output([T2.C1], [T2.C2], [T2.C3]), filter(nil), rowset=16
      access([T2.C1], [T2.C2], [T2.C3]), partitions(p[0-1])
      is_index_back=false, is_global_index=false, 
      range_key([T2.__pk_increment]), range(MIN ; MAX)always true
merge into v1 t1 using tp2 t2 on (t1.c1 = t2.c1) when matched then update set t1.c2 = t2.c1 + 100
when not matched then insert values (t2.c1, t2.c2, t2.c3);
select * from tp1 order by 1;
+------+------+------+
| C1   | C2   | C3   |
+------+------+------+
|    0 |    0 |    0 |
|    1 |  101 |    1 |
|    2 |    2 |    2 |
|    3 |  103 |    3 |
|    4 |  104 |    4 |
|    5 |    5 |    5 |
+------+------+------+
rollback;

explain basic
merge into v2 t1 using tp2 t2 on (t1.c1 = t2.c1) when matched then update set t1.c2 = t2.c1 + 100
when not matched then insert values (t2.c1, t2.c2, t2.c3);
Query Plan
=================================================
|ID|OPERATOR                           |NAME    |
-------------------------------------------------
|0 |DISTRIBUTED MERGE                  |        |
|1 |└─PX COORDINATOR                   |        |
|2 |  └─EXCHANGE OUT DISTR             |:EX10001|
|3 |    └─HASH RIGHT OUTER JOIN        |        |
|4 |      ├─EXCHANGE IN DISTR          |        |
|5 |      │ └─EXCHANGE OUT DISTR (PKEY)|:EX10000|
|6 |      │   └─SUBPLAN SCAN           |V2      |
|7 |      │     └─TABLE FULL SCAN      |TP1     |
|8 |      └─PX PARTITION ITERATOR      |        |
|9 |        └─TABLE FULL SCAN          |T2      |
=================================================
Outputs & filters:
-------------------------------------
  0 - output(nil), filter(nil)
      columns([{T1: ({TP1: (T1.TP1.__pk_increment, T1.C1, T1.C2, T1.C3)})}]), partitions(p[0-1]), 
      column_values([T_HIDDEN_PK], [column_conv(NUMBER,PS:(-1,0),NULL,T2.C1)], [column_conv(NUMBER,PS:(-1,0),NULL,T2.C2)], [column_conv(NUMBER,PS:(-1,0),
      NULL,T2.C3)]),
      update([T1.C2=column_conv(NUMBER,PS:(-1,0),NULL,T2.C1 + 100)]), 
      insert_conds(nil), update_conds(nil), delete_conds(nil)
  1 - output([T1.TP1.__pk_increment], [T1.C1], [T1.C2], [T1.C3], [T2.C1], [T2.C2], [T2.C3]), filter(nil), rowset=16
  2 - output([T1.TP1.__pk_increment], [T1.C1], [T1.C2], [T1.C3], [T2.C1], [T2.C2], [T2.C3]), filter(nil), rowset=16
      dop=1
  3 - output([T1.TP1.__pk_increment], [T1.C1], [T1.C2], [T1.C3], [T2.C1], [T2.C2], [T2.C3]), filter(nil), rowset=16
      equal_conds([T1.C1 = T2.C1]), other_conds(nil)
  4 - output([T1.TP1.__pk_increment], [T1.C1], [T1.C2], [T1.C3]), filter(nil), rowset=16
  5 - output([T1.TP1.__pk_increment], [T1.C1], [T1.C2], [T1.C3]), filter(nil), rowset=16
      (#keys=1, [T1.C1]), is_single, dop=1
  6 - output([T1.C1], [T1.C2], [T1.C3], [T1.TP1.__pk_increment]), filter(nil), rowset=16
      access([T1.C1], [T1.C2], [T1.C3], [T1.TP1.__pk_increment])
  7 - output([TP1.C1], [TP1.C2], [TP1.C3], [TP1.__pk_increment]), filter([TP1.C1 = 3]), rowset=16
      access([TP1.__pk_increment], [TP1.C1], [TP1.C2], [TP1.C3]), partitions(p0)
      is_index_back=false, is_global_index=false, filter_before_indexback[false], 
      range_key([TP1.__pk_increment]), range(MIN ; MAX)always true
  8 - output([T2.C1], [T2.C2], [T2.C3]), filter(nil), rowset=16
      affinitize, force partition granule
  9 - output([T2.C1], [T2.C2], [T2.C3]), filter(nil), rowset=16
      access([T2.C1], [T2.C2], [T2.C3]), partitions(p[0-1])
      is_index_back=false, is_global_index=false, 
      range_key([T2.__pk_increment]), range(MIN ; MAX)always true
merge into v2 t1 using tp2 t2 on (t1.c1 = t2.c1) when matched then update set t1.c2 = t2.c1 + 100
when not matched then insert values (t2.c1, t2.c2, t2.c3);
select * from tp1 order by 1;
+------+------+------+
| C1   | C2   | C3   |
+------+------+------+
|    0 |    0 |    0 |
|    1 |    1 |    1 |
|    1 |    1 |    1 |
|    2 |    2 |    2 |
|    3 |  103 |    3 |
|    4 |    4 |    4 |
|    4 |    4 |    4 |
|    5 |    5 |    5 |
+------+------+------+
rollback;

explain basic
merge into tp1 t1 using (select * from tp2 where c1 = 1) t2 on (t1.c1 = t2.c1) when matched then update set t1.c2 = t2.c1 + 100
when not matched then insert values (t2.c1, t2.c2, t2.c3);
Query Plan
=============================================
|ID|OPERATOR                           |NAME|
---------------------------------------------
|0 |MERGE                              |    |
|1 |└─NESTED-LOOP OUTER JOIN CARTESIAN |    |
|2 |  ├─SUBPLAN SCAN                   |T2  |
|3 |  │ └─TABLE FULL SCAN              |TP2 |
|4 |  └─MATERIAL                       |    |
|5 |    └─TABLE FULL SCAN              |T1  |
=============================================
Outputs & filters:
-------------------------------------
  0 - output(nil), filter(nil)
      columns([{T1: ({TP1: (T1.__pk_increment, T1.C1, T1.C2, T1.C3)})}]), partitions(p1), 
      column_values([T_HIDDEN_PK], [column_conv(NUMBER,PS:(-1,0),NULL,T2.C1)], [column_conv(NUMBER,PS:(-1,0),NULL,T2.C2)], [column_conv(NUMBER,PS:(-1,0),
      NULL,T2.C3)]),
      update([T1.C2=column_conv(NUMBER,PS:(-1,0),NULL,T2.C1 + 100)]), 
      insert_conds(nil), update_conds(nil), delete_conds(nil)
  1 - output([T1.__pk_increment], [T1.C1], [T1.C2], [T1.C3], [T2.C1], [T2.C2], [T2.C3]), filter(nil), rowset=16
      conds(nil), nl_params_(nil), use_batch=false
  2 - output([T2.C1], [T2.C2], [T2.C3]), filter(nil), rowset=16
      access([T2.C1], [T2.C2], [T2.C3])
  3 - output([TP2.C1], [TP2.C2], [TP2.C3]), filter([TP2.C1 = 1]), rowset=16
      access([TP2.C1], [TP2.C2], [TP2.C3]), partitions(p1)
      is_index_back=false, is_global_index=false, filter_before_indexback[false], 
      range_key([TP2.__pk_increment]), range(MIN ; MAX)always true
  4 - output([T1.__pk_increment], [T1.C1], [T1.C2], [T1.C3]), filter(nil), rowset=16
  5 - output([T1.__pk_increment], [T1.C1], [T1.C2], [T1.C3]), filter([T1.C1 = 1]), rowset=16
      access([T1.__pk_increment], [T1.C1], [T1.C2], [T1.C3]), partitions(p1)
      is_index_back=false, is_global_index=false, filter_before_indexback[false], 
      range_key([T1.__pk_increment]), range(MIN ; MAX)always true
merge into tp1 t1 using (select * from tp2 where c1 = 1) t2 on (t1.c1 = t2.c1) when matched then update set t1.c2 = t2.c1 + 100
when not matched then insert values (t2.c1, t2.c2, t2.c3);
select * from tp1 order by 1;
+------+------+------+
| C1   | C2   | C3   |
+------+------+------+
|    0 |    0 |    0 |
|    1 |  101 |    1 |
|    3 |    3 |    3 |
|    4 |    4 |    4 |
+------+------+------+
rollback;

explain basic
merge into v2 t1 using (select * from tp2 where c1 = 1) t2 on (t1.c1 = t2.c1) when matched then update set t1.c2 = t2.c1 + 100
when not matched then insert values (t2.c1, t2.c2, t2.c3);
Query Plan
=============================================
|ID|OPERATOR                           |NAME|
---------------------------------------------
|0 |DISTRIBUTED MERGE                  |    |
|1 |└─NESTED-LOOP OUTER JOIN CARTESIAN |    |
|2 |  ├─SUBPLAN SCAN                   |T2  |
|3 |  │ └─TABLE FULL SCAN              |TP2 |
|4 |  └─MATERIAL                       |    |
|5 |    └─SUBPLAN SCAN                 |V2  |
|6 |      └─TABLE FULL SCAN            |TP1 |
=============================================
Outputs & filters:
-------------------------------------
  0 - output(nil), filter(nil)
      columns([{T1: ({TP1: (T1.TP1.__pk_increment, T1.C1, T1.C2, T1.C3)})}]), partitions(p1), 
      column_values([T_HIDDEN_PK], [column_conv(NUMBER,PS:(-1,0),NULL,T2.C1)], [column_conv(NUMBER,PS:(-1,0),NULL,T2.C2)], [column_conv(NUMBER,PS:(-1,0),
      NULL,T2.C3)]),
      update([T1.C2=column_conv(NUMBER,PS:(-1,0),NULL,T2.C1 + 100)]), 
      insert_conds(nil), update_conds(nil), delete_conds(nil)
  1 - output([T1.TP1.__pk_increment], [T1.C1], [T1.C2], [T1.C3], [T2.C1], [T2.C2], [T2.C3]), filter(nil), rowset=16
      conds(nil), nl_params_(nil), use_batch=false
  2 - output([T2.C1], [T2.C2], [T2.C3]), filter(nil), rowset=16
      access([T2.C1], [T2.C2], [T2.C3])
  3 - output([TP2.C1], [TP2.C2], [TP2.C3]), filter([TP2.C1 = 1]), rowset=16
      access([TP2.C1], [TP2.C2], [TP2.C3]), partitions(p1)
      is_index_back=false, is_global_index=false, filter_before_indexback[false], 
      range_key([TP2.__pk_increment]), range(MIN ; MAX)always true
  4 - output([T1.TP1.__pk_increment], [T1.C1], [T1.C2], [T1.C3]), filter(nil), rowset=16
  5 - output([T1.C1], [T1.C2], [T1.C3], [T1.TP1.__pk_increment]), filter(nil), rowset=16
      access([T1.C1], [T1.C2], [T1.C3], [T1.TP1.__pk_increment])
  6 - output([TP1.C1], [TP1.C2], [TP1.C3], [TP1.__pk_increment]), filter([TP1.C1 = 3], [TP1.C1 = 1]), rowset=16
      access([TP1.__pk_increment], [TP1.C1], [TP1.C2], [TP1.C3]), partitions(p0)
      is_index_back=false, is_global_index=false, filter_before_indexback[false,false], 
      range_key([TP1.__pk_increment]), range(MIN ; MAX)always true
merge into v2 t1 using (select * from tp2 where c1 = 1) t2 on (t1.c1 = t2.c1) when matched then update set t1.c2 = t2.c1 + 100
when not matched then insert values (t2.c1, t2.c2, t2.c3);
select * from tp1 order by 1;
+------+------+------+
| C1   | C2   | C3   |
+------+------+------+
|    0 |    0 |    0 |
|    1 |    1 |    1 |
|    1 |    1 |    1 |
|    3 |    3 |    3 |
|    4 |    4 |    4 |
+------+------+------+
rollback;

explain basic
merge into v2 t1 using (select * from tp2 where c1 = 2) t2 on (t1.c1 = t2.c1) when matched then update set t1.c2 = t2.c1 + 100
when not matched then insert values (t2.c1, t2.c2, t2.c3);
Query Plan
=============================================
|ID|OPERATOR                           |NAME|
---------------------------------------------
|0 |MERGE                              |    |
|1 |└─NESTED-LOOP OUTER JOIN CARTESIAN |    |
|2 |  ├─SUBPLAN SCAN                   |T2  |
|3 |  │ └─TABLE FULL SCAN              |TP2 |
|4 |  └─MATERIAL                       |    |
|5 |    └─SUBPLAN SCAN                 |V2  |
|6 |      └─TABLE FULL SCAN            |TP1 |
=============================================
Outputs & filters:
-------------------------------------
  0 - output(nil), filter(nil)
      columns([{T1: ({TP1: (T1.TP1.__pk_increment, T1.C1, T1.C2, T1.C3)})}]), partitions(p0), 
      column_values([T_HIDDEN_PK], [column_conv(NUMBER,PS:(-1,0),NULL,T2.C1)], [column_conv(NUMBER,PS:(-1,0),NULL,T2.C2)], [column_conv(NUMBER,PS:(-1,0),
      NULL,T2.C3)]),
      update([T1.C2=column_conv(NUMBER,PS:(-1,0),NULL,T2.C1 + 100)]), 
      insert_conds(nil), update_conds(nil), delete_conds(nil)
  1 - output([T1.TP1.__pk_increment], [T1.C1], [T1.C2], [T1.C3], [T2.C1], [T2.C2], [T2.C3]), filter(nil), rowset=16
      conds(nil), nl_params_(nil), use_batch=false
  2 - output([T2.C1], [T2.C2], [T2.C3]), filter(nil), rowset=16
      access([T2.C1], [T2.C2], [T2.C3])
  3 - output([TP2.C1], [TP2.C2], [TP2.C3]), filter([TP2.C1 = 2]), rowset=16
      access([TP2.C1], [TP2.C2], [TP2.C3]), partitions(p0)
      is_index_back=false, is_global_index=false, filter_before_indexback[false], 
      range_key([TP2.__pk_increment]), range(MIN ; MAX)always true
  4 - output([T1.TP1.__pk_increment], [T1.C1], [T1.C2], [T1.C3]), filter(nil), rowset=16
  5 - output([T1.C1], [T1.C2], [T1.C3], [T1.TP1.__pk_increment]), filter(nil), rowset=16
      access([T1.C1], [T1.C2], [T1.C3], [T1.TP1.__pk_increment])
  6 - output([TP1.C1], [TP1.C2], [TP1.C3], [TP1.__pk_increment]), filter([TP1.C1 = 3], [TP1.C1 = 2]), rowset=16
      access([TP1.__pk_increment], [TP1.C1], [TP1.C2], [TP1.C3]), partitions(p0)
      is_index_back=false, is_global_index=false, filter_before_indexback[false,false], 
      range_key([TP1.__pk_increment]), range(MIN ; MAX)always true
merge into v2 t1 using (select * from tp2 where c1 = 2) t2 on (t1.c1 = t2.c1) when matched then update set t1.c2 = t2.c1 + 100
when not matched then insert values (t2.c1, t2.c2, t2.c3);
select * from tp1 order by 1;
+------+------+------+
| C1   | C2   | C3   |
+------+------+------+
|    0 |    0 |    0 |
|    1 |    1 |    1 |
|    2 |    2 |    2 |
|    3 |    3 |    3 |
|    4 |    4 |    4 |
+------+------+------+
rollback;

explain basic
merge into t1 using (select 1 c1 from dual) t2 on (t1.c1 = t2.c1) when matched then update set t1.c2 = t2.c1 + 100
when not matched then insert values (t2.c1, 1, 1);
Query Plan
=============================================
|ID|OPERATOR                           |NAME|
---------------------------------------------
|0 |MERGE                              |    |
|1 |└─NESTED-LOOP OUTER JOIN CARTESIAN |    |
|2 |  ├─SUBPLAN SCAN                   |T2  |
|3 |  │ └─EXPRESSION                   |    |
|4 |  └─TABLE FULL SCAN                |T1  |
=============================================
Outputs & filters:
-------------------------------------
  0 - output(nil), filter(nil)
      columns([{T1: ({T1: (T1.__pk_increment, T1.C1, T1.C2, T1.C3)})}]), partitions(p0), 
      column_values([T_HIDDEN_PK], [column_conv(NUMBER,PS:(-1,0),NULL,T2.C1)], [column_conv(NUMBER,PS:(-1,0),NULL,1)], [column_conv(NUMBER,PS:(-1,0),NULL,
      1)]),
      update([T1.C2=column_conv(NUMBER,PS:(-1,0),NULL,T2.C1 + 100)]), 
      insert_conds(nil), update_conds(nil), delete_conds(nil)
  1 - output([T1.__pk_increment], [T1.C1], [T1.C2], [T1.C3], [T2.C1]), filter(nil), rowset=16
      conds(nil), nl_params_(nil), use_batch=false
  2 - output([T2.C1]), filter(nil), rowset=16
      access([T2.C1])
  3 - output([1]), filter(nil)
      values({1})
  4 - output([T1.__pk_increment], [T1.C1], [T1.C2], [T1.C3]), filter([T1.C1 = 1]), rowset=16
      access([T1.__pk_increment], [T1.C1], [T1.C2], [T1.C3]), partitions(p0)
      is_index_back=false, is_global_index=false, filter_before_indexback[false], 
      range_key([T1.__pk_increment]), range(MIN ; MAX)always true
merge into t1 using (select 1 c1 from dual) t2 on (t1.c1 = t2.c1) when matched then update set t1.c2 = t2.c1 + 100
when not matched then insert values (t2.c1, 1, 1);
select * from t1 order by 1;
+------+------+------+
| C1   | C2   | C3   |
+------+------+------+
|    0 |    0 |    0 |
|    1 |  101 |    1 |
|    3 |    3 |    3 |
|    4 |    4 |    4 |
+------+------+------+
rollback;

explain basic
merge into tp1 t1 using (select 1 c1 from dual) t2 on (t1.c1 = t2.c1) when matched then update set t1.c2 = t2.c1 + 100
when not matched then insert values (t2.c1, 1, 1);
Query Plan
=============================================
|ID|OPERATOR                           |NAME|
---------------------------------------------
|0 |MERGE                              |    |
|1 |└─NESTED-LOOP OUTER JOIN CARTESIAN |    |
|2 |  ├─SUBPLAN SCAN                   |T2  |
|3 |  │ └─EXPRESSION                   |    |
|4 |  └─TABLE FULL SCAN                |T1  |
=============================================
Outputs & filters:
-------------------------------------
  0 - output(nil), filter(nil)
      columns([{T1: ({TP1: (T1.__pk_increment, T1.C1, T1.C2, T1.C3)})}]), partitions(p1), 
      column_values([T_HIDDEN_PK], [column_conv(NUMBER,PS:(-1,0),NULL,T2.C1)], [column_conv(NUMBER,PS:(-1,0),NULL,1)], [column_conv(NUMBER,PS:(-1,0),NULL,
      1)]),
      update([T1.C2=column_conv(NUMBER,PS:(-1,0),NULL,T2.C1 + 100)]), 
      insert_conds(nil), update_conds(nil), delete_conds(nil)
  1 - output([T1.__pk_increment], [T1.C1], [T1.C2], [T1.C3], [T2.C1]), filter(nil), rowset=16
      conds(nil), nl_params_(nil), use_batch=false
  2 - output([T2.C1]), filter(nil), rowset=16
      access([T2.C1])
  3 - output([1]), filter(nil)
      values({1})
  4 - output([T1.__pk_increment], [T1.C1], [T1.C2], [T1.C3]), filter([T1.C1 = 1]), rowset=16
      access([T1.__pk_increment], [T1.C1], [T1.C2], [T1.C3]), partitions(p1)
      is_index_back=false, is_global_index=false, filter_before_indexback[false], 
      range_key([T1.__pk_increment]), range(MIN ; MAX)always true
merge into tp1 t1 using (select 1 c1 from dual) t2 on (t1.c1 = t2.c1) when matched then update set t1.c2 = t2.c1 + 100
when not matched then insert values (t2.c1, 1, 1);
select * from tp1 order by 1;
+------+------+------+
| C1   | C2   | C3   |
+------+------+------+
|    0 |    0 |    0 |
|    1 |  101 |    1 |
|    3 |    3 |    3 |
|    4 |    4 |    4 |
+------+------+------+
rollback;

############################ can not prune now ################################
explain basic
merge into tp1 t1 using (select 1 c1 from dual) t2 on (t1.c1 = t2.c1)
when not matched then insert values (1, 1, 1);
Query Plan
=============================================
|ID|OPERATOR                           |NAME|
---------------------------------------------
|0 |MERGE                              |    |
|1 |└─NESTED-LOOP OUTER JOIN CARTESIAN |    |
|2 |  ├─SUBPLAN SCAN                   |T2  |
|3 |  │ └─EXPRESSION                   |    |
|4 |  └─TABLE FULL SCAN                |T1  |
=============================================
Outputs & filters:
-------------------------------------
  0 - output(nil), filter(nil)
      columns([{T1: ({TP1: (T1.__pk_increment, T1.C1, T1.C2, T1.C3)})}]), partitions(p1), 
      column_values([T_HIDDEN_PK], [column_conv(NUMBER,PS:(-1,0),NULL,1)], [column_conv(NUMBER,PS:(-1,0),NULL,1)], [column_conv(NUMBER,PS:(-1,0),NULL,1)]),
       
      insert_conds(nil), update_conds(nil), delete_conds(nil)
  1 - output([T1.__pk_increment], [T1.C1], [T1.C2], [T1.C3]), filter(nil), rowset=16
      conds(nil), nl_params_(nil), use_batch=false
  2 - output(nil), filter(nil), rowset=16
      access(nil)
  3 - output([1]), filter(nil)
      values({1})
  4 - output([T1.__pk_increment], [T1.C1], [T1.C2], [T1.C3]), filter([T1.C1 = 1]), rowset=16
      access([T1.__pk_increment], [T1.C1], [T1.C2], [T1.C3]), partitions(p1)
      is_index_back=false, is_global_index=false, filter_before_indexback[false], 
      range_key([T1.__pk_increment]), range(MIN ; MAX)always true
merge into tp1 t1 using (select 1 c1 from dual) t2 on (t1.c1 = t2.c1)
when not matched then insert values (1, 1, 1);
select * from tp1 order by 1;
+------+------+------+
| C1   | C2   | C3   |
+------+------+------+
|    0 |    0 |    0 |
|    1 |    1 |    1 |
|    3 |    3 |    3 |
|    4 |    4 |    4 |
+------+------+------+
rollback;

############################ test constraint ################################
set autocommit = 1;
alter system flush plan cache global;
merge into tp1 t1 using (select 1 c1 from dual) t2 on (t1.c1 = 1) when matched then update set t1.c2 = t2.c1 + 100 when not matched then insert values (t2.c1, 1, 1);
merge into tp1 t1 using (select 1 c1 from dual) t2 on (t1.c1 = 2) when matched then update set t1.c2 = t2.c1 + 100 when not matched then insert values (t2.c1, 1, 1);
merge into tp1 t1 using (select 2 c1 from dual) t2 on (t1.c1 = 1) when matched then update set t1.c2 = t2.c1 + 100 when not matched then insert values (t2.c1, 1, 1);
merge into tp1 t1 using (select 2 c1 from dual) t2 on (t1.c1 = 2) when matched then update set t1.c2 = t2.c1 + 100 when not matched then insert values (t2.c1, 1, 1);
select sql_id, hit_count, type, query_sql from GV$OB_PLAN_CACHE_PLAN_STAT where statement like 'merge into tp1 t1 using (select ? c1 from dual) t2 on (t1.c1 = ?) when matched then update set t1.c2 = t2.c1 + ? when not matched then insert values (t2.c1, ?, ?)';
+----------------------------------+-----------+------+----------------------------------------------------------------------------------------------------------------------------------------------------------------------+
| SQL_ID                           | HIT_COUNT | TYPE | QUERY_SQL                                                                                                                                                            |
+----------------------------------+-----------+------+----------------------------------------------------------------------------------------------------------------------------------------------------------------------+
| F357FFB90EE6ED5D4733F119651438E1 |         1 |    1 | merge into tp1 t1 using (select 1 c1 from dual) t2 on (t1.c1 = 1) when matched then update set t1.c2 = t2.c1 + 100 when not matched then insert values (t2.c1, 1, 1) |
| F357FFB90EE6ED5D4733F119651438E1 |         1 |    1 | merge into tp1 t1 using (select 1 c1 from dual) t2 on (t1.c1 = 2) when matched then update set t1.c2 = t2.c1 + 100 when not matched then insert values (t2.c1, 1, 1) |
+----------------------------------+-----------+------+----------------------------------------------------------------------------------------------------------------------------------------------------------------------+

merge into tp1 t1 using (select 1 + 1 c1 from dual) t2 on (t1.c1 = 2) when matched then update set t1.c2 = t2.c1 + 100 when not matched then insert values (t2.c1, 1, 1);
merge into tp1 t1 using (select 1 + 2 c1 from dual) t2 on (t1.c1 = 2) when matched then update set t1.c2 = t2.c1 + 100 when not matched then insert values (t2.c1, 1, 1);
merge into tp1 t1 using (select 1 + 1 c1 from dual) t2 on (t1.c1 = 1) when matched then update set t1.c2 = t2.c1 + 100 when not matched then insert values (t2.c1, 1, 1);
merge into tp1 t1 using (select 1 + 2 c1 from dual) t2 on (t1.c1 = 3) when matched then update set t1.c2 = t2.c1 + 100 when not matched then insert values (t2.c1, 1, 1);
select sql_id, hit_count, type, query_sql from GV$OB_PLAN_CACHE_PLAN_STAT where statement like 'merge into tp1 t1 using (select ? + ? c1 from dual) t2 on (t1.c1 = ?) when matched then update set t1.c2 = t2.c1 + ? when not matched then insert values (t2.c1, ?, ?)';
+----------------------------------+-----------+------+--------------------------------------------------------------------------------------------------------------------------------------------------------------------------+
| SQL_ID                           | HIT_COUNT | TYPE | QUERY_SQL                                                                                                                                                                |
+----------------------------------+-----------+------+--------------------------------------------------------------------------------------------------------------------------------------------------------------------------+
| B8201BE32A70390B81534D82F3B9F081 |         1 |    1 | merge into tp1 t1 using (select 1 + 1 c1 from dual) t2 on (t1.c1 = 2) when matched then update set t1.c2 = t2.c1 + 100 when not matched then insert values (t2.c1, 1, 1) |
| B8201BE32A70390B81534D82F3B9F081 |         1 |    1 | merge into tp1 t1 using (select 1 + 2 c1 from dual) t2 on (t1.c1 = 2) when matched then update set t1.c2 = t2.c1 + 100 when not matched then insert values (t2.c1, 1, 1) |
+----------------------------------+-----------+------+--------------------------------------------------------------------------------------------------------------------------------------------------------------------------+

merge into tp1 t1 using (select * from tp2 where c1 in (1,1)) t2 on (t1.c1 = t2.c1) when not matched then insert values (t2.c1, t2.c2, t2.c3);
merge into tp1 t1 using (select * from tp2 where c1 in (3,3)) t2 on (t1.c1 = t2.c1) when not matched then insert values (t2.c1, t2.c2, t2.c3);
merge into tp1 t1 using (select * from tp2 where c1 in (1,2)) t2 on (t1.c1 = t2.c1) when not matched then insert values (t2.c1, t2.c2, t2.c3);
merge into tp1 t1 using (select * from tp2 where c1 in (4,5)) t2 on (t1.c1 = t2.c1) when not matched then insert values (t2.c1, t2.c2, t2.c3);
select sql_id, hit_count, type, query_sql from GV$OB_PLAN_CACHE_PLAN_STAT where statement like 'merge into tp1 t1 using (select * from tp2 where c1 in (?,?)) t2 on (t1.c1 = t2.c1) when not matched then insert values (t2.c1, t2.c2, t2.c3)';
+----------------------------------+-----------+------+-----------------------------------------------------------------------------------------------------------------------------------------------+
| SQL_ID                           | HIT_COUNT | TYPE | QUERY_SQL                                                                                                                                     |
+----------------------------------+-----------+------+-----------------------------------------------------------------------------------------------------------------------------------------------+
| A4D868DFCD6B5E9433872315EA671861 |         1 |    1 | merge into tp1 t1 using (select * from tp2 where c1 in (1,1)) t2 on (t1.c1 = t2.c1) when not matched then insert values (t2.c1, t2.c2, t2.c3) |
| A4D868DFCD6B5E9433872315EA671861 |         1 |    3 | merge into tp1 t1 using (select * from tp2 where c1 in (1,2)) t2 on (t1.c1 = t2.c1) when not matched then insert values (t2.c1, t2.c2, t2.c3) |
+----------------------------------+-----------+------+-----------------------------------------------------------------------------------------------------------------------------------------------+

drop table t1;
drop table t2;
drop table tp1;
drop table tp2;
drop view v1;
drop view v2;

CREATE TABLE E_MP_DAY_READ(
    METER_ID VARCHAR(10),
    DATA_DATE DATE,
    COL_TIME DATE,
    INPUT_TIME DATE,
    PAP_R VARCHAR(10),
    PAP_R1 VARCHAR(10),
    PAP_R2 VARCHAR(10),
    PAP_R3 VARCHAR(10),
    PAP_R4 VARCHAR(10),
    PAP_ACQ_TIME DATE,
    PAP_R_QUALITY VARCHAR(10),
    PAP_R_DIFF_VALUE VARCHAR(10),
    RAP_R VARCHAR(10),
    RAP_R1 VARCHAR(10),
    RAP_R2 VARCHAR(10),
    RAP_R3 VARCHAR(10),
    RAP_R4 VARCHAR(10),
    RAP_ACQ_TIME DATE,
    RAP_R_QUALITY VARCHAR(10),
    RAP_R_DIFF_VALUE VARCHAR(10)
)PARTITION BY RANGE(DATA_DATE) (
    PARTITION P1 VALUES LESS THAN (TO_DATE('2023-07-02','YYYY-MM-DD')),
    PARTITION P2 VALUES LESS THAN (TO_DATE('2023-07-03','YYYY-MM-DD')),
    PARTITION P3 VALUES LESS THAN (TO_DATE('2023-07-04','YYYY-MM-DD'))
);

explain basic
MERGE INTO E_MP_DAY_READ f USING (
  SELECT
    '1' AS METER_ID,
    TO_DATE('2023-07-01', 'YYYY-MM-DD') AS DATA_DATE,
    TO_DATE('2023-07-01', 'YYYY-MM-DD') AS COL_TIME,
    TO_DATE('2023-07-01', 'YYYY-MM-DD') AS INPUT_TIME,
    'A' AS PAP_R,
    'B' AS PAP_R1,
    'C' AS PAP_R2,
    'D' AS PAP_R3,
    'E' AS PAP_R4,
    TO_DATE('2023-07-01', 'YYYY-MM-DD') AS PAP_ACQ_TIME,
    'F' AS PAP_R_QUALITY,
    'G' AS PAP_R_DIFF_VALUE,
    'H' AS RAP_R,
    'I' AS RAP_R1,
    'J' AS RAP_R2,
    'K' AS RAP_R3,
    'L' AS RAP_R4,
    TO_DATE('2023-07-01', 'YYYY-MM-DD') AS RAP_ACQ_TIME,
    'M' AS RAP_R_QUALITY,
    'N' AS RAP_R_DIFF_VALUE
  FROM
    DUAL
) S ON (
  F.METER_ID = S.METER_ID
  AND F.DATA_DATE = S.DATA_DATE
)
WHEN NOT MATCHED THEN
INSERT
  (
    F.METER_ID,
    F.DATA_DATE,
    F.COL_TIME,
    F.INPUT_TIME,
    F.PAP_R,
    F.PAP_R1,
    F.PAP_R2,
    F.PAP_R3,
    F.PAP_R4,
    F.PAP_ACQ_TIME,
    F.PAP_R_QUALITY,
    F.PAP_R_DIFF_VALUE,
    F.RAP_R,
    F.RAP_R1,
    F.RAP_R2,
    F.RAP_R3,
    F.RAP_R4,
    F.RAP_ACQ_TIME,
    F.RAP_R_QUALITY,
    F.RAP_R_DIFF_VALUE
  )
  values
  (
    s.METER_ID,
    s.DATA_DATE,
    s.COL_TIME,
    s.INPUT_TIME,
    s.PAP_R,
    s.PAP_R1,
    s.PAP_R2,
    s.PAP_R3,
    s.PAP_R4,
    s.PAP_ACQ_TIME,
    s.PAP_R_QUALITY,
    s.PAP_R_DIFF_VALUE,
    s.RAP_R,
    s.RAP_R1,
    s.RAP_R2,
    s.RAP_R3,
    s.RAP_R4,
    s.RAP_ACQ_TIME,
    s.RAP_R_QUALITY,
    s.RAP_R_DIFF_VALUE
  )
  WHEN MATCHED THEN
UPDATE
SET
  F.COL_TIME = NVL(S.COL_TIME, F.COL_TIME),
  F.INPUT_TIME = NVL(S.INPUT_TIME, F.INPUT_TIME),
  F.PAP_R = NVL(S.PAP_R, F.PAP_R),
  F.PAP_R1 = NVL(S.PAP_R1, F.PAP_R1),
  F.PAP_R2 = NVL(S.PAP_R2, F.PAP_R2),
  F.PAP_R3 = NVL(S.PAP_R3, F.PAP_R3),
  F.PAP_R4 = NVL(S.PAP_R4, F.PAP_R4),
  F.PAP_ACQ_TIME = NVL(S.PAP_ACQ_TIME, F.PAP_ACQ_TIME),
  F.PAP_R_QUALITY = NVL(S.PAP_R_QUALITY, F.PAP_R_QUALITY),
  F.PAP_R_DIFF_VALUE = NVL(S.PAP_R_DIFF_VALUE, F.PAP_R_DIFF_VALUE),
  F.RAP_R = NVL(S.RAP_R, F.RAP_R),
  F.RAP_R1 = NVL(S.RAP_R1, F.RAP_R1),
  F.RAP_R2 = NVL(S.RAP_R2, F.RAP_R2),
  F.RAP_R3 = NVL(S.RAP_R3, F.RAP_R3),
  F.RAP_R4 = NVL(S.RAP_R4, F.RAP_R4),
  F.RAP_ACQ_TIME = NVL(S.RAP_ACQ_TIME, F.RAP_ACQ_TIME),
  F.RAP_R_QUALITY = NVL(S.RAP_R_QUALITY, F.RAP_R_QUALITY),
  F.RAP_R_DIFF_VALUE = NVL(S.RAP_R_DIFF_VALUE, F.RAP_R_DIFF_VALUE);
Query Plan
=============================================
|ID|OPERATOR                           |NAME|
---------------------------------------------
|0 |MERGE                              |    |
|1 |└─NESTED-LOOP OUTER JOIN CARTESIAN |    |
|2 |  ├─SUBPLAN SCAN                   |S   |
|3 |  │ └─EXPRESSION                   |    |
|4 |  └─TABLE FULL SCAN                |F   |
=============================================
Outputs & filters:
-------------------------------------
  0 - output(nil), filter(nil)
      columns([{F: ({E_MP_DAY_READ: (F.__pk_increment, F.METER_ID, F.DATA_DATE, F.COL_TIME, F.INPUT_TIME, F.PAP_R, F.PAP_R1, F.PAP_R2, F.PAP_R3, F.PAP_R4,
       F.PAP_ACQ_TIME, F.PAP_R_QUALITY, F.PAP_R_DIFF_VALUE, F.RAP_R, F.RAP_R1, F.RAP_R2, F.RAP_R3, F.RAP_R4, F.RAP_ACQ_TIME, F.RAP_R_QUALITY, F.RAP_R_DIFF_VALUE)})}]),
       partitions(p0), 
      column_values([T_HIDDEN_PK], [column_conv(VARCHAR2,utf8mb4_bin,length:10,NULL,cast(S.METER_ID, VARCHAR2(1048576 )))], [column_conv(DATE,PS:(19,0),
      NULL,S.DATA_DATE)], [column_conv(DATE,PS:(19,0),NULL,S.COL_TIME)], [column_conv(DATE,PS:(19,0),NULL,S.INPUT_TIME)], [column_conv(VARCHAR2,utf8mb4_bin,length:10,
      NULL,cast(S.PAP_R, VARCHAR2(1048576 )))], [column_conv(VARCHAR2,utf8mb4_bin,length:10,NULL,cast(S.PAP_R1, VARCHAR2(1048576 )))], [column_conv(VARCHAR2,utf8mb4_bin,
      length:10,NULL,cast(S.PAP_R2, VARCHAR2(1048576 )))], [column_conv(VARCHAR2,utf8mb4_bin,length:10,NULL,cast(S.PAP_R3, VARCHAR2(1048576 )))], [column_conv(VARCHAR2,
      utf8mb4_bin,length:10,NULL,cast(S.PAP_R4, VARCHAR2(1048576 )))], [column_conv(DATE,PS:(19,0),NULL,S.PAP_ACQ_TIME)], [column_conv(VARCHAR2,utf8mb4_bin,length:10,
      NULL,cast(S.PAP_R_QUALITY, VARCHAR2(1048576 )))], [column_conv(VARCHAR2,utf8mb4_bin,length:10,NULL,cast(S.PAP_R_DIFF_VALUE, VARCHAR2(1048576 )))], [column_conv(VARCHAR2,
      utf8mb4_bin,length:10,NULL,cast(S.RAP_R, VARCHAR2(1048576 )))], [column_conv(VARCHAR2,utf8mb4_bin,length:10,NULL,cast(S.RAP_R1, VARCHAR2(1048576 )))], [column_conv(VARCHAR2,
      utf8mb4_bin,length:10,NULL,cast(S.RAP_R2, VARCHAR2(1048576 )))], [column_conv(VARCHAR2,utf8mb4_bin,length:10,NULL,cast(S.RAP_R3, VARCHAR2(1048576 )))], 
      [column_conv(VARCHAR2,utf8mb4_bin,length:10,NULL,cast(S.RAP_R4, VARCHAR2(1048576 )))], [column_conv(DATE,PS:(19,0),NULL,S.RAP_ACQ_TIME)], [column_conv(VARCHAR2,
      utf8mb4_bin,length:10,NULL,cast(S.RAP_R_QUALITY, VARCHAR2(1048576 )))], [column_conv(VARCHAR2,utf8mb4_bin,length:10,NULL,cast(S.RAP_R_DIFF_VALUE, VARCHAR2(1048576 
      )))]),
      update([F.COL_TIME=column_conv(DATE,PS:(19,0),NULL,NVL(S.COL_TIME, F.COL_TIME))], [F.INPUT_TIME=column_conv(DATE,PS:(19,0),NULL,NVL(S.INPUT_TIME, 
      F.INPUT_TIME))], [F.PAP_R=column_conv(VARCHAR2,utf8mb4_bin,length:10,NULL,NVL(cast(S.PAP_R, VARCHAR2(1 BYTE)), F.PAP_R))], [F.PAP_R1=column_conv(VARCHAR2,
      utf8mb4_bin,length:10,NULL,NVL(cast(S.PAP_R1, VARCHAR2(1 BYTE)), F.PAP_R1))], [F.PAP_R2=column_conv(VARCHAR2,utf8mb4_bin,length:10,NULL,NVL(cast(S.PAP_R2,
       VARCHAR2(1 BYTE)), F.PAP_R2))], [F.PAP_R3=column_conv(VARCHAR2,utf8mb4_bin,length:10,NULL,NVL(cast(S.PAP_R3, VARCHAR2(1 BYTE)), F.PAP_R3))], [F.PAP_R4=column_conv(VARCHAR2,
      utf8mb4_bin,length:10,NULL,NVL(cast(S.PAP_R4, VARCHAR2(1 BYTE)), F.PAP_R4))], [F.PAP_ACQ_TIME=column_conv(DATE,PS:(19,0),NULL,NVL(S.PAP_ACQ_TIME, F.PAP_ACQ_TIME))],
       [F.PAP_R_QUALITY=column_conv(VARCHAR2,utf8mb4_bin,length:10,NULL,NVL(cast(S.PAP_R_QUALITY, VARCHAR2(1 BYTE)), F.PAP_R_QUALITY))], [F.PAP_R_DIFF_VALUE=column_conv(VARCHAR2,
      utf8mb4_bin,length:10,NULL,NVL(cast(S.PAP_R_DIFF_VALUE, VARCHAR2(1 BYTE)), F.PAP_R_DIFF_VALUE))], [F.RAP_R=column_conv(VARCHAR2,utf8mb4_bin,length:10,NULL,
      NVL(cast(S.RAP_R, VARCHAR2(1 BYTE)), F.RAP_R))], [F.RAP_R1=column_conv(VARCHAR2,utf8mb4_bin,length:10,NULL,NVL(cast(S.RAP_R1, VARCHAR2(1 BYTE)), F.RAP_R1))],
       [F.RAP_R2=column_conv(VARCHAR2,utf8mb4_bin,length:10,NULL,NVL(cast(S.RAP_R2, VARCHAR2(1 BYTE)), F.RAP_R2))], [F.RAP_R3=column_conv(VARCHAR2,utf8mb4_bin,
      length:10,NULL,NVL(cast(S.RAP_R3, VARCHAR2(1 BYTE)), F.RAP_R3))], [F.RAP_R4=column_conv(VARCHAR2,utf8mb4_bin,length:10,NULL,NVL(cast(S.RAP_R4, VARCHAR2(1 
      BYTE)), F.RAP_R4))], [F.RAP_ACQ_TIME=column_conv(DATE,PS:(19,0),NULL,NVL(S.RAP_ACQ_TIME, F.RAP_ACQ_TIME))], [F.RAP_R_QUALITY=column_conv(VARCHAR2,utf8mb4_bin,
      length:10,NULL,NVL(cast(S.RAP_R_QUALITY, VARCHAR2(1 BYTE)), F.RAP_R_QUALITY))], [F.RAP_R_DIFF_VALUE=column_conv(VARCHAR2,utf8mb4_bin,length:10,NULL,NVL(cast(S.RAP_R_DIFF_VALUE,
       VARCHAR2(1 BYTE)), F.RAP_R_DIFF_VALUE))]), 
      insert_conds(nil), update_conds(nil), delete_conds(nil)
  1 - output([F.__pk_increment], [F.METER_ID], [F.DATA_DATE], [F.COL_TIME], [F.INPUT_TIME], [F.PAP_R], [F.PAP_R1], [F.PAP_R2], [F.PAP_R3], [F.PAP_R4], [F.PAP_ACQ_TIME],
       [F.PAP_R_QUALITY], [F.PAP_R_DIFF_VALUE], [F.RAP_R], [F.RAP_R1], [F.RAP_R2], [F.RAP_R3], [F.RAP_R4], [F.RAP_ACQ_TIME], [F.RAP_R_QUALITY], [F.RAP_R_DIFF_VALUE],
       [S.COL_TIME], [S.INPUT_TIME], [S.PAP_R], [S.PAP_R1], [S.PAP_R2], [S.PAP_R3], [S.PAP_R4], [S.PAP_ACQ_TIME], [S.PAP_R_QUALITY], [S.PAP_R_DIFF_VALUE], [S.RAP_R],
       [S.RAP_R1], [S.RAP_R2], [S.RAP_R3], [S.RAP_R4], [S.RAP_ACQ_TIME], [S.RAP_R_QUALITY], [S.RAP_R_DIFF_VALUE], [S.METER_ID], [S.DATA_DATE]), filter(nil), rowset=16
      conds(nil), nl_params_(nil), use_batch=false
  2 - output([S.METER_ID], [S.DATA_DATE], [S.COL_TIME], [S.INPUT_TIME], [S.PAP_R], [S.PAP_R1], [S.PAP_R2], [S.PAP_R3], [S.PAP_R4], [S.PAP_ACQ_TIME], [S.PAP_R_QUALITY],
       [S.PAP_R_DIFF_VALUE], [S.RAP_R], [S.RAP_R1], [S.RAP_R2], [S.RAP_R3], [S.RAP_R4], [S.RAP_ACQ_TIME], [S.RAP_R_QUALITY], [S.RAP_R_DIFF_VALUE]), filter(nil), rowset=16
      access([S.METER_ID], [S.DATA_DATE], [S.COL_TIME], [S.INPUT_TIME], [S.PAP_R], [S.PAP_R1], [S.PAP_R2], [S.PAP_R3], [S.PAP_R4], [S.PAP_ACQ_TIME], [S.PAP_R_QUALITY],
       [S.PAP_R_DIFF_VALUE], [S.RAP_R], [S.RAP_R1], [S.RAP_R2], [S.RAP_R3], [S.RAP_R4], [S.RAP_ACQ_TIME], [S.RAP_R_QUALITY], [S.RAP_R_DIFF_VALUE])
  3 - output(['1'], [TO_DATE(cast('2023-07-01', VARCHAR2(1048576 )), cast('YYYY-MM-DD', VARCHAR2(1048576 )))], [TO_DATE(cast('2023-07-01', VARCHAR2(1048576 
      )), cast('YYYY-MM-DD', VARCHAR2(1048576 )))], [TO_DATE(cast('2023-07-01', VARCHAR2(1048576 )), cast('YYYY-MM-DD', VARCHAR2(1048576 )))], ['A'], ['B'], ['C'],
       ['D'], ['E'], [TO_DATE(cast('2023-07-01', VARCHAR2(1048576 )), cast('YYYY-MM-DD', VARCHAR2(1048576 )))], ['F'], ['G'], ['H'], ['I'], ['J'], ['K'], ['L'],
       [TO_DATE(cast('2023-07-01', VARCHAR2(1048576 )), cast('YYYY-MM-DD', VARCHAR2(1048576 )))], ['M'], ['N']), filter(nil)
      values({'1', TO_DATE(cast('2023-07-01', VARCHAR2(1048576 )), cast('YYYY-MM-DD', VARCHAR2(1048576 ))), TO_DATE(cast('2023-07-01', VARCHAR2(1048576 
      )), cast('YYYY-MM-DD', VARCHAR2(1048576 ))), TO_DATE(cast('2023-07-01', VARCHAR2(1048576 )), cast('YYYY-MM-DD', VARCHAR2(1048576 ))), 'A', 'B', 'C', 'D',
       'E', TO_DATE(cast('2023-07-01', VARCHAR2(1048576 )), cast('YYYY-MM-DD', VARCHAR2(1048576 ))), 'F', 'G', 'H', 'I', 'J', 'K', 'L', TO_DATE(cast('2023-07-01',
       VARCHAR2(1048576 )), cast('YYYY-MM-DD', VARCHAR2(1048576 ))), 'M', 'N'})
  4 - output([F.__pk_increment], [F.DATA_DATE], [F.METER_ID], [F.COL_TIME], [F.INPUT_TIME], [F.PAP_R], [F.PAP_R1], [F.PAP_R2], [F.PAP_R3], [F.PAP_R4], [F.PAP_ACQ_TIME],
       [F.PAP_R_QUALITY], [F.PAP_R_DIFF_VALUE], [F.RAP_R], [F.RAP_R1], [F.RAP_R2], [F.RAP_R3], [F.RAP_R4], [F.RAP_ACQ_TIME], [F.RAP_R_QUALITY], [F.RAP_R_DIFF_VALUE]), filter([F.METER_ID 
      = cast('1', VARCHAR2(1048576 ))], [F.DATA_DATE = TO_DATE(cast('2023-07-01', VARCHAR2(1048576 )), cast('YYYY-MM-DD', VARCHAR2(1048576 )))]), rowset=16
      access([F.__pk_increment], [F.DATA_DATE], [F.METER_ID], [F.COL_TIME], [F.INPUT_TIME], [F.PAP_R], [F.PAP_R1], [F.PAP_R2], [F.PAP_R3], [F.PAP_R4], [F.PAP_ACQ_TIME],
       [F.PAP_R_QUALITY], [F.PAP_R_DIFF_VALUE], [F.RAP_R], [F.RAP_R1], [F.RAP_R2], [F.RAP_R3], [F.RAP_R4], [F.RAP_ACQ_TIME], [F.RAP_R_QUALITY], [F.RAP_R_DIFF_VALUE]), partitions(p0)
      is_index_back=false, is_global_index=false, filter_before_indexback[false,false], 
      range_key([F.__pk_increment]), range(MIN ; MAX)always true

drop table E_MP_DAY_READ;
