drop database if exists mi_db;
create database mi_db;
use mi_db;
create table sourceTable(id int, sales int);
create table targetTable(id int, sales int);
create view targetView as select * from targetTable;
truncate table targetTable;
truncate table sourceTable;
insert into targetTable values(1,1),(2,2),(3,3);
insert into sourceTable values(1,2),(2,4),(3,6),(4,8);
merge into targetTable t1 using sourceTable t2 on (t1.id = t2.id) when matched then update set t1.sales = t2.sales;
select * from targetTable;
id	sales
1	2
2	4
3	6
merge into targetTable t1 using sourceTable t2 on (t1.id = t2.id) when matched then update set t1.sales = t2.sales * 2;
select * from targetTable;
id	sales
1	4
2	8
3	12
create table t1(c1 int primary key, c2 int);
create table t2(c1 int primary key, c2 int);
insert into t1 values(1,1),(2,2),(3,3);
insert into t2 values(1,2),(2,4),(3,6),(4,8);
merge into t1 using t2 on (t1.c2 * 2 = t2.c2) when matched then update set t1.c1 = t2.c1 * 10;
select * from t1;
c1	c2
10	1
20	2
30	3
drop table t1,t2;
create table t1(c1 int, c2 int, c3 int, primary key(c1, c2));
create table t2(c1 int, c2 int, c3 int, primary key(c1, c2));
insert into t1 values(1,1,1),(2,2,2),(3,3,3);
insert into t2 values(1,2,2),(2,4,4),(3,6,6),(4,8,8);
merge into t1 using t2 on (t1.c1 = t2.c1) when matched then update set t1.c2 = t2.c2;
select * from t1;
c1	c2	c3
1	2	1
2	4	2
3	6	3
drop table t1,t2;
create table t1(c1 int, c2 int, c3 int, unique key(c3, c2));
create table t2(c1 int, c2 int, c3 int, unique key(c3, c2));
insert into t1 values(1,1,1),(2,2,2),(3,3,3);
insert into t2 values(1,2,2),(2,4,4),(3,6,6),(4,8,8);
merge into t1 using t2 on (t1.c1 = t2.c1) when matched then update set t1.c2 = t2.c2;
select * from t1;
c1	c2	c3
1	2	1
2	4	2
3	6	3
drop table t1, t2;
create table t1(c1 int primary key, c2 int, c3 int);
create table t2(c1 int primary key, c2 int, c3 int);
insert into t1 values(1,1,1),(2,2,2),(3,3,3);
insert into t2 values(1,2,2),(2,4,4),(3,6,6),(4,8,8);
merge into t1 using t2 on (t1.c1 = t2.c1) when matched then update set t1.c2 = t1.c2 + t2.c2;
select * from t1;
c1	c2	c3
1	3	1
2	6	2
3	9	3
merge into t1 using t2 on (t1.c1 = t2.c1) when matched then update set t1.c2 = t2.c2 ,t1.c3=t2.c3;
select * from t1;
c1	c2	c3
1	2	2
2	4	4
3	6	6
merge into t1 using t2 on (t1.c1 = t2.c1) when matched then update set t1.c2 = abs(t2.c2 * -1) + 100;
select * from t1;
c1	c2	c3
1	102	2
2	104	4
3	106	6
drop table t1,t2;
create table t1(c1 int primary key, c2 int);
create table t2(c1 int primary key, c2 int);
insert into t1 values(1,1),(2,2),(3,3);
insert into t2 values(1,2),(2,4),(3,6),(4,8);
merge into t1 using t2 on (t1.c1 = t2.c1) when matched then update set t1.c2 = t2.c2 where t1.c1 = 2;
select * from t1;
c1	c2
1	1
2	4
3	3
merge into t1 using t2 on (t1.c1 = t2.c1) when matched then update set t1.c2 = t2.c2 where t1.c2 = 3;
select * from t1;
c1	c2
1	1
2	4
3	6
merge into t1 using t2 on (t1.c1 = t2.c1) when matched then update set t1.c2 = t2.c2 where t1.c1 > t2.c1;
select * from t1;
c1	c2
1	1
2	4
3	6
drop table t1,t2;
create table t1(c1 int primary key, c2 int);
create table t2(c1 int primary key, c2 int);
insert into t1 values(1,1),(-1,-1),(2,2),(-2,-2),(3,3),(-3,-3);
insert into t2 values(1,2),(2,4),(3,6),(4,8);
merge into t1 using t2 on (abs(t1.c1) = t2.c1) when matched then update set t1.c2 = t2.c2;
select * from t1;
c1	c2
-3	6
-2	4
-1	2
1	2
2	4
3	6
drop table t1,t2;
create table t1(c1 int primary key, c2 int);
create table t2(c1 int primary key, c2 int);
insert into t1 values(1,1),(2,2),(3,3);
insert into t2 values(1,2),(2,4),(3,6),(4,8);
merge into t1 using t2 on (t1.c1 = t2.c1) when matched then update set t1.c2 = t2.c2 delete where t1.c1 = 2;
select * from t1;
c1	c2
1	2
3	6
truncate table t1;
truncate table t2;
insert into t1 values(1,1),(2,2),(3,3);
insert into t2 values(1,2),(2,4),(3,6),(4,8);
merge into t1 using t2 on (t1.c1 = t2.c1) when matched then update set t1.c2 = t2.c2 delete where t2.c1 = 2;
select * from t1;
c1	c2
1	2
3	6
truncate table t1;
truncate table t2;
insert into t1 values(1,1),(2,2),(3,3);
insert into t2 values(1,2),(2,4),(3,6),(4,8);
merge into t1 using t2 on (t1.c1 = t2.c1) when matched then update set t1.c2 = t2.c2 delete where t1.c1 > 1;
select * from t1;
c1	c2
1	2
truncate table t1;
truncate table t2;
insert into t1 values(1,1),(2,2),(3,3);
insert into t2 values(1,2),(2,4),(3,6),(4,8);
merge into t1 using t2 on (t1.c1 = t2.c1) when matched then update set t1.c2 = t2.c2 delete where t2.c1 > 1;
select * from t1;
c1	c2
1	2
truncate table t1;
truncate table t2;
insert into t1 values(1,1),(2,2),(3,3);
insert into t2 values(1,2),(2,4),(3,6),(4,8);
merge into t1 using t2 on (t1.c1 = t2.c1) when matched then update set t1.c2 = t2.c2 delete where t1.c1 = t2.c1 ;
select * from t1;
c1	c2
truncate table t1;
truncate table t2;
insert into t1 values(1,1),(2,2),(3,3);
insert into t2 values(1,2),(2,4),(3,6),(4,8);
merge into t1 using t2 on (t1.c1 = t2.c1) when matched then update set t1.c2 = t2.c2 delete where t1.c1 + t2.c1 > 1;
select * from t1;
c1	c2
truncate table t1;
truncate table t2;
insert into t1 values(1,1),(2,2),(3,3);
insert into t2 values(1,2),(2,4),(3,6),(4,8);
merge into t1 using t2 on (t1.c1 = t2.c1) when matched then update set t1.c2 = t2.c2 delete where t1.c2 > 5;
select * from t1;
c1	c2
1	2
2	4
truncate table t1;
truncate table t2;
insert into t1 values(1,1),(2,2),(3,3);
insert into t2 values(1,2),(2,4),(3,6),(4,8);
merge into t1 using t2 on (t1.c1 = t2.c1) when matched then update set t1.c2 = t2.c2 delete where t1.c2 = 4;
select * from t1;
c1	c2
1	2
3	6
create table a1(c1 int auto_increment, c2 int);
create table a2(c1 int, c2 int);
insert into a1 values(1,1),(2,2),(3,3);
insert into a2 values(1,2),(2,4),(3,6),(4,8);
merge into a1 using a2 on (a1.c1 = a2.c1) when matched then update set a1.c2 = a2.c2;
select * from a1;
c1	c2
1	2
2	4
3	6
truncate table a1;
truncate table a2;
insert into a1 values(1,1),(2,2),(3,3);
insert into a2 values(1,2),(2,4),(3,6),(4,8);
merge into a1 using a2 on (2 * a1.c2 = a2.c2) when matched then update set a1.c1 =  2* a2.c2;
select * from a1;
c1	c2
4	1
8	2
12	3
drop table t1,t2;
create table t1(c1 int primary key, c2 int);
create table t2(c1 int primary key, c2 int);
insert into t1 values(1,1);
insert into t2 values(-1,-2),(1,2);
merge into t1 using t2 on (t1.c1 = t2.c1) when matched then update set t1.c1 = t2.c2;
ERROR 42000: Can not update join column
merge into t1 using t2 on (t1.c1 = t2.c1) when matched then update set t2.c2 = t2.c2 delete where t1.c1 + t2.c2 = 2;
ERROR HY000: Invalid ON UPDATE clause
merge into t1 using t2 on (t1.c1 = abs(-t2.c1)) when matched then update set t1.c1 = t2.c2;
ERROR 42000: Can not update join column
create table t3(c1 int primary key, c2 int) partition by hash(c1) partitions 5;
create table t4(c1 int primary key, c2 int) partition by hash(c1) partitions 5;
merge into t3 using t4 on (t3.c1 = t4.c1) when matched then update set t3.c2 = t4.c2;
ERROR 0A000: Distributed Merge into  not supported
