drop database if exists mi_db;
create database mi_db;
use mi_db;
create table sourceTable(id int, sales int);
create table targetTable(id int, sales int);
create view targetView as select * from targetTable;
truncate table targetTable;
truncate table sourceTable;
insert into targetTable values(1,1),(2,2),(3,3);
insert into sourceTable values(1,2),(2,4),(3,6),(4,8);
merge into targetTable t1 using sourceTable t2 on (t1.id = t2.id) when not matched then insert(t1.id, t1.sales) values(t2.id, t2.sales);
select * from targetTable;
id	sales
1	1
2	2
3	3
4	8
delete from targetTable where id = 4;
merge into targetTable t1 using sourceTable t2 on (t1.id = t2.id) when not matched then insert(t1.id, t1.sales) values(t2.id, 999);
select * from targetTable;
id	sales
1	1
2	2
3	3
4	999
delete from targetTable where id = 4;
merge into targetTable t1 using sourceTable t2 on (t1.id = t2.id) when not matched then insert(t1.id, t1.sales) values(4, 999);
select * from targetTable;
id	sales
1	1
2	2
3	3
4	999
delete from targetTable where id = 4;
merge into targetTable t1 using sourceTable t2 on (t1.id = t2.id) when not matched then insert(t1.id, t1.sales) values(t2.id, 100 + t2.sales);
select * from targetTable;
id	sales
1	1
2	2
3	3
4	108
truncate table targetTable;
truncate table sourceTable;
insert into targetTable values(1,1),(2,2),(3,3);
insert into sourceTable values(1,2),(2,4),(3,6),(4,8),(5,9);
merge into targetTable t1 using sourceTable t2 on (t1.id = t2.id) when not matched then insert(t1.id, t1.sales) values(t2.id, t2.sales) where t2.id > 1;
select * from targetTable;
id	sales
1	1
2	2
3	3
4	8
5	9
delete from targetTable where id = 4 or id = 5;
merge into targetTable t1 using sourceTable t2 on (t1.id = t2.id) when not matched then insert(t1.id, t1.sales) values(t2.id, t2.sales) where t2.id > 4;
select * from targetTable;
id	sales
1	1
2	2
3	3
5	9
delete from targetTable where id = 4 or id = 5;
merge into targetTable t1 using sourceTable t2 on (t1.id = t2.id) when not matched then insert(t1.id, t1.sales) values(t2.id, t2.sales) where t2.id * 2 =  t2.sales;
select * from targetTable;
id	sales
1	1
2	2
3	3
4	8
truncate table targetTable;
truncate table sourceTable;
insert into targetTable values(1,1),(2,2),(3,3);
insert into sourceTable values(-1,-1),(-2,-2);
merge into targetTable t1 using sourceTable t2 on (t1.id < t2.id) when not matched then insert(t1.id, t1.sales) values(t2.id, t2.sales);
select * from targetTable;
id	sales
1	1
2	2
3	3
-1	-1
-2	-2
merge into targetTable t1 using sourceTable t2 on (1 = 2) when not matched then insert(t1.id, t1.sales) values(t2.id, t2.sales);
select * from targetTable;
id	sales
1	1
2	2
3	3
-1	-1
-2	-2
-1	-1
-2	-2
create table a1(c1 int auto_increment, c2 int);
create table a2(c1 int, c2 int);
insert into a1 values(1,1),(2,2),(3,3);
insert into a2 values(1,2),(2,4),(3,6),(4,8);
merge into a1 using a2 on (a1.c1 = a2.c1) when not matched then insert (a2.c2)values(a2.c2);
select * from a1;
c1	c2
1	1
2	2
3	3
1000004	8
