alter system flush plan cache;
START TRANSACTION;
drop database if exists ol_db;
create database ol_db;
use ol_db;
select 1;
1
1
select ?;
ERROR 42000: You have an error in your SQL syntax; check the manual that corresponds to your OceanBase version for the right syntax to use near '?' at line 1
select 1+?;
ERROR 42000: You have an error in your SQL syntax; check the manual that corresponds to your OceanBase version for the right syntax to use near '?' at line 1
create table t1(c1 int primary key, c2 int, c3 int, key(c2), key(c3,c2));
create table t2(c1 int primary key, c2 int, c3 int, key(c2), key(c3,c2));
insert into t1 value(1, 2, 4), (2,2,3), (3,2,2), (4,2,1);
insert into t1 value(11, 3, 4), (12,3,3), (13,3,2), (14,3,1);
select  c2,c1 from t1 where c2 = ?;
ERROR 42000: You have an error in your SQL syntax; check the manual that corresponds to your OceanBase version for the right syntax to use near '?' at line 1
select  c2,c1 from t1 where c2 = 2;
c2	c1
2	1
2	2
2	3
2	4
select  c2,c1 from t1 where c2 = ?;
ERROR 42000: You have an error in your SQL syntax; check the manual that corresponds to your OceanBase version for the right syntax to use near '?' at line 1
select  c2,c1 from t1 where c2 = 2;
c2	c1
2	1
2	2
2	3
2	4
select  c2,c1 from t1 where c2 = 3;
c2	c1
3	11
3	12
3	13
3	14
select hit_count,if(outline_id = -1, -1, 1) as outline_id from oceanbase.V$OB_PLAN_CACHE_PLAN_STAT where statement = "select  c2,c1 from t1 where c2 = ?";
hit_count	outline_id
2	-1
## simply test ##
create outline olt_1 on select /*+max_concurrent(5)*/ c2,c1 from t1 where c2 = 2;
select tenant_id, name, hex(signature), substr(signature, 2, conv(hex(substr(signature, 1, 1)), 16,10)), outline_content,outline_target, sql_text, owner, hex(outline_params) from oceanbase.__all_virtual_outline;
tenant_id	name	hex(signature)	substr(signature, 2, conv(hex(substr(signature, 1, 1)), 16,10))	outline_content	outline_target	sql_text	owner	hex(outline_params)
1002	olt_1	2273656C656374202063322C63312066726F6D207431207768657265206332203D203F00	select  c2,c1 from t1 where c2 = ?			select /*+max_concurrent(5)*/ c2,c1 from t1 where c2 = 2	admin	010D01010A050000010005053F0002
create outline olt_2 on select /*+index(t1 c3)*/ c2 from t1 where c2 = ?;
ERROR HY000: invalid outline ,error info:sql text should have no ? when there is no concurrent limit
select /*+max_concurrent(5)*/ c2 from t1 where c2 = ?;
ERROR 42000: You have an error in your SQL syntax; check the manual that corresponds to your OceanBase version for the right syntax to use near '?' at line 1
create outline olt_1 on select /*+max_concurrent(5)*/ c2,c1 from t1 where c2 = ?;
ERROR HY000: Outline 'olt_1' already exists
create outline olt_2 on select /*+max_concurrent(5)*/ c2,c1 from t1 where c2 = ?;
ERROR HY000: Outline 'select /*+max_concurrent(5)*/ c2,c1 from t1 where c2 = ?' already exists
create outline olt_1 on select /*+max_concurrent(-1)*/ c2,c1 from t1 where c1 = 2 and c2 = ?;
ERROR HY000: invalid outline ,error info:sql text should have no ? when there is no concurrent limit
create outline olt_3 on select /*+max_concurrent(5)*/ c2 from t1 where c2 in (select /*+max_concurrent(6)*/ c2 from t2);
create outline olt_4 on select c2 from t1 where c2 in (select /*+max_concurrent(6)*/ c2 from t2);
create outline olt_5 on select c2 from t1 where c2 in (select /*+max_concurrent(6)*/ c2 from t2) union (select /*+max_concurrent(4)*/ c1 from t2);
create outline olt_6 on select c2 from t1 where c2 in (select /*+max_concurrent(6)*/ c2 from t2) union (select c1 from t2);
create outline olt_7 on select /*+max_concurrent(5)*/ c2 from t1 where c2 in (select /*+max_concurrent(6)*/ c2 from t2) union (select /*+max_concurrent(4)*/ c1 from t2);
create outline olt_8 on select /*+max_concurrent(5)*/ c2 from t1 where c2 in ((select /*+max_concurrent(6)*/ c2 from t2) union (select /*+max_concurrent(4)*/ c1 from t2));
create outline olt_9 on select /*+max_concurrent(5) index(t1 c3)*/ c2,   c1 from t1 where c2 = ?;
ERROR HY000: invalid outline ,error info:outline and sql concurrent limit can not be mixed
create outline olt_10 on select /*+index(t1 c3)*/ c2 from t1 where c2 in      (select /*+max_concurrent(6)*/ c2 from t2);
ERROR HY000: invalid outline ,error info:outline and sql concurrent limit can not be mixed
create outline olt_11 on select /*+max_concurrent(5)*/ c2 from t1 where c2    in (select /*+index(t2 c3)*/ c2 from t2) union (select c1 from t2);
ERROR HY000: invalid outline ,error info:outline and sql concurrent limit can not be mixed
select tenant_id, name, hex(signature), substr(signature, 2, conv(hex(substr(signature, 1, 1)), 16,10)), outline_content,outline_target, sql_text, owner, hex(outline_params) from oceanbase.__all_virtual_outline;
tenant_id	name	hex(signature)	substr(signature, 2, conv(hex(substr(signature, 1, 1)), 16,10))	outline_content	outline_target	sql_text	owner	hex(outline_params)
1002	olt_1	2273656C656374202063322C63312066726F6D207431207768657265206332203D203F00	select  c2,c1 from t1 where c2 = ?			select /*+max_concurrent(5)*/ c2,c1 from t1 where c2 = 2	admin	010D01010A050000010005053F0002
1002	olt_3	3373656C656374202063322066726F6D20743120776865726520633220696E202873656C656374202063322066726F6D2074322900	select  c2 from t1 where c2 in (select  c2 from t2)			select /*+max_concurrent(5)*/ c2 from t1 where c2 in (select /*+max_concurrent(6)*/ c2 from t2)	admin	010701010405000000
1002	olt_4	3273656C6563742063322066726F6D20743120776865726520633220696E202873656C656374202063322066726F6D2074322900	select c2 from t1 where c2 in (select  c2 from t2)			select c2 from t1 where c2 in (select /*+max_concurrent(6)*/ c2 from t2)	admin	010701010406000000
1002	olt_5	4D73656C6563742063322066726F6D20743120776865726520633220696E202873656C656374202063322066726F6D2074322920756E696F6E202873656C656374202063312066726F6D2074322900	select c2 from t1 where c2 in (select  c2 from t2) union (select  c1 from t2)	/*+ BEGIN_OUTLINE_DATA USE_MERGE(@"SEL$1" "SUBQUERY_TABLE"@"SEL$1") LEADING(@"SEL$1" "ol_db.t1"@"SEL$1" "SUBQUERY_TABLE"@"SEL$1") INDEX(@"SEL$1" "ol_db.t1"@"SEL$1" "c2") INDEX(@"SEL$2" "ol_db.t2"@"SEL$2" "c2") FULL(@"SEL$3" "ol_db.t2"@"SEL$3") END_OUTLINE_DATA*/		select c2 from t1 where c2 in (select /*+max_concurrent(6)*/ c2 from t2) union (select /*+max_concurrent(4)*/ c1 from t2)	admin	010100
1002	olt_6	4C73656C6563742063322066726F6D20743120776865726520633220696E202873656C656374202063322066726F6D2074322920756E696F6E202873656C6563742063312066726F6D2074322900	select c2 from t1 where c2 in (select  c2 from t2) union (select c1 from t2)			select c2 from t1 where c2 in (select /*+max_concurrent(6)*/ c2 from t2) union (select c1 from t2)	admin	010701010406000000
1002	olt_7	4E73656C656374202063322066726F6D20743120776865726520633220696E202873656C656374202063322066726F6D2074322920756E696F6E202873656C656374202063312066726F6D2074322900	select  c2 from t1 where c2 in (select  c2 from t2) union (select  c1 from t2)	/*+ BEGIN_OUTLINE_DATA USE_MERGE(@"SEL$1" "SUBQUERY_TABLE"@"SEL$1") LEADING(@"SEL$1" "ol_db.t1"@"SEL$1" "SUBQUERY_TABLE"@"SEL$1") INDEX(@"SEL$1" "ol_db.t1"@"SEL$1" "c2") INDEX(@"SEL$2" "ol_db.t2"@"SEL$2" "c2") FULL(@"SEL$3" "ol_db.t2"@"SEL$3") END_OUTLINE_DATA*/		select /*+max_concurrent(5)*/ c2 from t1 where c2 in (select /*+max_concurrent(6)*/ c2 from t2) union (select /*+max_concurrent(4)*/ c1 from t2)	admin	010100
1002	olt_8	5073656C656374202063322066726F6D20743120776865726520633220696E20282873656C656374202063322066726F6D2074322920756E696F6E202873656C656374202063312066726F6D207432292900	select  c2 from t1 where c2 in ((select  c2 from t2) union (select  c1 from t2))			select /*+max_concurrent(5)*/ c2 from t1 where c2 in ((select /*+max_concurrent(6)*/ c2 from t2) union (select /*+max_concurrent(4)*/ c1 from t2))	admin	010701010405000000
drop outline olt_1;
drop outline olt_3;
drop outline olt_4;
drop outline olt_5;
drop outline olt_6;
drop outline olt_7;
drop outline olt_8;
create outline olt_1 on select /*+max_concurrent(0)*/ c2,c1 from t1 where c1 = 2 and c2 = ?;
select  c2,c1 from t1 where c1 = 2 and c2 = "2";
ERROR HY000: SQL reach max concurrent num 0
select  c2,c1 from t1 where c1 = 2 and c2 = "1";
ERROR HY000: SQL reach max concurrent num 0
select  c2,c1 from t1 where c1 = 2 and c2 = 1;
ERROR HY000: SQL reach max concurrent num 0
select  c2,c1 from t1 where c1 = 2 and c2 = true;
ERROR HY000: SQL reach max concurrent num 0
select  c2,c1 from t1 where c1 = 1 and c2 = "2";
c2	c1
2	1
select  c2,c1 from t1 where c1 = 1 and c2 = "1";
c2	c1
select  c2,c1 from t1 where c1 = 1 and c2 = 1;
c2	c1
select  c2,c1 from t1 where c1 = 1 and c2 = true;
c2	c1
alter system flush plan cache;
drop outline olt_1;
create outline olt_1 on select /*+max_concurrent(1)*/ c2,c1 from t1 where c1 = 2 and c2 = ?;
select  c2,c1 from t1 where c1 = 2 and c2 = "2";
c2	c1
2	2
select statement, hit_count,if(outline_id = -1, -1, 1) as outline_id from oceanbase.V$OB_PLAN_CACHE_PLAN_STAT where statement like 'select  c2,c1 from t1 where c1 =%';
statement	hit_count	outline_id
select  c2,c1 from t1 where c1 = ? and c2 = ?	0	1
select  c2,c1 from t1 where c1 = 2 and c2 = 1;
c2	c1
select statement, hit_count,if(outline_id = -1, -1, 1) as outline_id from oceanbase.V$OB_PLAN_CACHE_PLAN_STAT where statement like 'select  c2,c1 from t1 where c1 =%';
statement	hit_count	outline_id
select  c2,c1 from t1 where c1 = ? and c2 = ?	0	1
select  c2,c1 from t1 where c1 = ? and c2 = ?	0	1
select  c2,c1 from t1 where c1 = 1 and c2 = "1";
c2	c1
select statement, hit_count,if(outline_id = -1, -1, 1) as outline_id from oceanbase.V$OB_PLAN_CACHE_PLAN_STAT where statement like 'select  c2,c1 from t1 where c1 =%';
statement	hit_count	outline_id
select  c2,c1 from t1 where c1 = ? and c2 = ?	0	1
select  c2,c1 from t1 where c1 = ? and c2 = ?	0	1
select  c2,c1 from t1 where c1 = ? and c2 = ?	0	1
select  c2,c1 from t1 where c1 = 2 and c2 = "3";
c2	c1
select statement, hit_count,if(outline_id = -1, -1, 1) as outline_id from oceanbase.V$OB_PLAN_CACHE_PLAN_STAT where statement like 'select  c2,c1 from t1 where c1 =%';
statement	hit_count	outline_id
select  c2,c1 from t1 where c1 = ? and c2 = ?	1	1
select  c2,c1 from t1 where c1 = ? and c2 = ?	0	1
select  c2,c1 from t1 where c1 = ? and c2 = ?	0	1
select  c2,c1 from t1 where c1 = 1 and c2 = "2";
c2	c1
2	1
select statement, hit_count,if(outline_id = -1, -1, 1) as outline_id from oceanbase.V$OB_PLAN_CACHE_PLAN_STAT where statement like 'select  c2,c1 from t1 where c1 =%';
statement	hit_count	outline_id
select  c2,c1 from t1 where c1 = ? and c2 = ?	1	1
select  c2,c1 from t1 where c1 = ? and c2 = ?	0	1
select  c2,c1 from t1 where c1 = ? and c2 = ?	1	1
alter system flush plan cache;
select statement, hit_count,if(outline_id = -1, -1, 1) as outline_id from oceanbase.V$OB_PLAN_CACHE_PLAN_STAT where statement like 'select  c2,c1 from t1 where c1 =%';
statement	hit_count	outline_id
create outline olt_2 on select /*+max_concurrent(1)*/ c2,c1 from t1 where c1 = 2 and c2 = ? and c3 = 1;
select  c2,c1 from t1 where c1 = 2 and c2 = "2" and c3 = 1;
c2	c1
select statement, hit_count,if(outline_id = -1, -1, 1) as outline_id from oceanbase.V$OB_PLAN_CACHE_PLAN_STAT where statement like 'select  c2,c1 from t1 where c1 =%';
statement	hit_count	outline_id
select  c2,c1 from t1 where c1 = ? and c2 = ? and c3 = ?	0	1
select  c2,c1 from t1 where c1 = 2 and c2 = 2 and c3 = 1;
c2	c1
select statement, hit_count,if(outline_id = -1, -1, 1) as outline_id from oceanbase.V$OB_PLAN_CACHE_PLAN_STAT where statement like 'select  c2,c1 from t1 where c1 =%';
statement	hit_count	outline_id
select  c2,c1 from t1 where c1 = ? and c2 = ? and c3 = ?	0	1
select  c2,c1 from t1 where c1 = ? and c2 = ? and c3 = ?	0	1
select  c2,c1 from t1 where c1 = 2 and c2 = "2" and c3 = 3;
c2	c1
2	2
select statement, hit_count,if(outline_id = -1, -1, 1) as outline_id from oceanbase.V$OB_PLAN_CACHE_PLAN_STAT where statement like 'select  c2,c1 from t1 where c1 =%';
statement	hit_count	outline_id
select  c2,c1 from t1 where c1 = ? and c2 = ? and c3 = ?	0	1
select  c2,c1 from t1 where c1 = ? and c2 = ? and c3 = ?	0	1
select  c2,c1 from t1 where c1 = ? and c2 = ? and c3 = ?	0	1
select  c2,c1 from t1 where c1 = 2 and c2 = 2 and c3 = 3;
c2	c1
2	2
select statement, hit_count,if(outline_id = -1, -1, 1) as outline_id from oceanbase.V$OB_PLAN_CACHE_PLAN_STAT where statement like 'select  c2,c1 from t1 where c1 =%';
statement	hit_count	outline_id
select  c2,c1 from t1 where c1 = ? and c2 = ? and c3 = ?	0	1
select  c2,c1 from t1 where c1 = ? and c2 = ? and c3 = ?	0	1
select  c2,c1 from t1 where c1 = ? and c2 = ? and c3 = ?	0	1
select  c2,c1 from t1 where c1 = ? and c2 = ? and c3 = ?	0	1
select  c2,c1 from t1 where c1 = 2 and c2 = "3" and c3 = 1;
c2	c1
select statement, hit_count,if(outline_id = -1, -1, 1) as outline_id from oceanbase.V$OB_PLAN_CACHE_PLAN_STAT where statement like 'select  c2,c1 from t1 where c1 =%';
statement	hit_count	outline_id
select  c2,c1 from t1 where c1 = ? and c2 = ? and c3 = ?	1	1
select  c2,c1 from t1 where c1 = ? and c2 = ? and c3 = ?	0	1
select  c2,c1 from t1 where c1 = ? and c2 = ? and c3 = ?	0	1
select  c2,c1 from t1 where c1 = ? and c2 = ? and c3 = ?	0	1
select tenant_id, name, hex(signature), substr(signature, 2, conv(hex(substr(signature, 1, 1)), 16,10)), outline_content,outline_target, sql_text, owner, hex(outline_params) from oceanbase.__all_virtual_outline;
tenant_id	name	hex(signature)	substr(signature, 2, conv(hex(substr(signature, 1, 1)), 16,10))	outline_content	outline_target	sql_text	owner	hex(outline_params)
1002	olt_1	2D73656C656374202063322C63312066726F6D207431207768657265206331203D203F20616E64206332203D203F00	select  c2,c1 from t1 where c1 = ? and c2 = ?			select /*+max_concurrent(1)*/ c2,c1 from t1 where c1 = 2 and c2 = ?	admin	010D01010A010000010005053F0002
1002	olt_2	3873656C656374202063322C63312066726F6D207431207768657265206331203D203F20616E64206332203D203F20616E64206333203D203F00	select  c2,c1 from t1 where c1 = ? and c2 = ? and c3 = ?			select /*+max_concurrent(1)*/ c2,c1 from t1 where c1 = 2 and c2 = ? and c3 = 1	admin	0113010110010000020005053F00020205053F0001
create or replace outline olt_2 on select /*+max_concurrent(3)*/ c2,c1 from t1 where c1 = 2 and c2 = ? and c3 = 1;
select tenant_id, name, hex(signature), substr(signature, 2, conv(hex(substr(signature, 1, 1)), 16,10)), outline_content,outline_target, sql_text, owner, hex(outline_params) from oceanbase.__all_virtual_outline;
tenant_id	name	hex(signature)	substr(signature, 2, conv(hex(substr(signature, 1, 1)), 16,10))	outline_content	outline_target	sql_text	owner	hex(outline_params)
1002	olt_1	2D73656C656374202063322C63312066726F6D207431207768657265206331203D203F20616E64206332203D203F00	select  c2,c1 from t1 where c1 = ? and c2 = ?			select /*+max_concurrent(1)*/ c2,c1 from t1 where c1 = 2 and c2 = ?	admin	010D01010A010000010005053F0002
1002	olt_2	3873656C656374202063322C63312066726F6D207431207768657265206331203D203F20616E64206332203D203F20616E64206333203D203F00	select  c2,c1 from t1 where c1 = ? and c2 = ? and c3 = ?			select /*+max_concurrent(3)*/ c2,c1 from t1 where c1 = 2 and c2 = ? and c3 = 1	admin	0113010110030000020005053F00020205053F0001
create or replace outline olt_2 on select /*+index(t1 c3)*/ c2,c1 from t1 where c1 = 2 and c2 = 2 and c3 = 1;
select tenant_id, name, hex(signature), substr(signature, 2, conv(hex(substr(signature, 1, 1)), 16,10)), outline_content,outline_target, sql_text, owner, hex(outline_params) from oceanbase.__all_virtual_outline;
tenant_id	name	hex(signature)	substr(signature, 2, conv(hex(substr(signature, 1, 1)), 16,10))	outline_content	outline_target	sql_text	owner	hex(outline_params)
1002	olt_1	2D73656C656374202063322C63312066726F6D207431207768657265206331203D203F20616E64206332203D203F00	select  c2,c1 from t1 where c1 = ? and c2 = ?			select /*+max_concurrent(1)*/ c2,c1 from t1 where c1 = 2 and c2 = ?	admin	010D01010A010000010005053F0002
1002	olt_2	3873656C656374202063322C63312066726F6D207431207768657265206331203D203F20616E64206332203D203F20616E64206333203D203F00	select  c2,c1 from t1 where c1 = ? and c2 = ? and c3 = ?	/*+ BEGIN_OUTLINE_DATA INDEX(@"SEL$1" "ol_db.t1"@"SEL$1" "c3") END_OUTLINE_DATA*/		select /*+index(t1 c3)*/ c2,c1 from t1 where c1 = 2 and c2 = 2 and c3 = 1	admin	010100
create or replace outline olt_2 on select /*+max_concurrent(4)*/ c2,c1 from t1 where c1 = 2 and c2 = ? and c3 = 1;
select tenant_id, name, hex(signature), substr(signature, 2, conv(hex(substr(signature, 1, 1)), 16,10)), outline_content,outline_target, sql_text, owner, hex(outline_params) from oceanbase.__all_virtual_outline;
tenant_id	name	hex(signature)	substr(signature, 2, conv(hex(substr(signature, 1, 1)), 16,10))	outline_content	outline_target	sql_text	owner	hex(outline_params)
1002	olt_1	2D73656C656374202063322C63312066726F6D207431207768657265206331203D203F20616E64206332203D203F00	select  c2,c1 from t1 where c1 = ? and c2 = ?			select /*+max_concurrent(1)*/ c2,c1 from t1 where c1 = 2 and c2 = ?	admin	010D01010A010000010005053F0002
1002	olt_2	3873656C656374202063322C63312066726F6D207431207768657265206331203D203F20616E64206332203D203F20616E64206333203D203F00	select  c2,c1 from t1 where c1 = ? and c2 = ? and c3 = ?			select /*+max_concurrent(4)*/ c2,c1 from t1 where c1 = 2 and c2 = ? and c3 = 1	admin	0113010110040000020005053F00020205053F0001
drop outline olt_1;
drop outline olt_2;
drop table t1;
drop table t2;
create table t1(c1 int, c2 int, c3 int, key(c2), key(c3,c2));
insert into t1 value(1, 2, 4), (2,2,3), (3,2,2), (4,2,1);
insert into t1 value(11, 3, 4), (12,3,3), (13,3,2), (14,3,1);
create outline ol_insert on insert /*+trace_log*/ into t1 value (1,2,4);
select a.tenant_id as tenant_id, a.name as name, hex(substr(a.signature, 1, 1)) as signatrue_len, substr(a.signature, 2, conv(hex(substr(a.signature, 1, 1)), 16,10)) as signature, a.outline_content as outline_content, a.outline_target as outline_target, a.sql_text as sql_text, a.owner as owner, hex(a.outline_params) as outline_params from oceanbase.__all_virtual_outline a, oceanbase.__all_virtual_database b where a.tenant_id = b.tenant_id and a.database_id = b.database_id and b.in_recyclebin = false and a.tenant_id = 1002 and b.database_name='ol_db';
tenant_id	name	signatrue_len	signature	outline_content	outline_target	sql_text	owner	outline_params
1002	ol_insert	1D	insert  into t1 value (?,?,?)	/*+ BEGIN_OUTLINE_DATA TRACE_LOG END_OUTLINE_DATA*/		insert /*+trace_log*/ into t1 value (1,2,4)	admin	010100
alter outline ol_insert add insert /*+max_concurrent(0)*/ into t1 value (1,?,?);
alter outline ol_insert add insert /*+max_concurrent(0)*/ into t1 value (?,1,1);
alter outline ol_insert add insert /*+max_concurrent(1)*/ into t1 value (?,1,2);
insert  into t1 value (1,2,2);
ERROR HY000: SQL reach max concurrent num 0
insert  into t1 value (2,1,1);
ERROR HY000: SQL reach max concurrent num 0
insert  into t1 value (2.0,1,1);
ERROR HY000: SQL reach max concurrent num 0
insert  into t1 value ('2',1,1);
ERROR HY000: SQL reach max concurrent num 0
insert  into t1 value (2,1,2);
alter outline ol_insert add insert /*+max_concurrent(0)*/ into t1 value (?,1,?);
insert  into t1 value (2,1,2);
ERROR HY000: SQL reach max concurrent num 0
insert  into t1 value (3,3,3);
drop outline ol_insert;
create outline ol_update on update /*+trace_log*/t1 set c1 = 4 where c3 =2;
alter outline ol_update add update /*+max_concurrent(0)*/t1 set c1 = 4 where c3 =?;
alter outline ol_update add update /*+max_concurrent(1)*/t1 set c1 = 3 where c3 =?;
select a.tenant_id as tenant_id, a.name as name, hex(substr(a.signature, 1, 1)) as signatrue_len, substr(a.signature, 2, conv(hex(substr(a.signature, 1, 1)), 16,10)) as signature, a.outline_content as outline_content, a.outline_target as outline_target, a.sql_text as sql_text, a.owner as owner, hex(a.outline_params) as outline_params from oceanbase.__all_virtual_outline a, oceanbase.__all_virtual_database b where a.tenant_id = b.tenant_id and a.database_id = b.database_id and b.in_recyclebin = false and a.tenant_id = 1002 and b.database_name='ol_db';
tenant_id	name	signatrue_len	signature	outline_content	outline_target	sql_text	owner	outline_params
1002	ol_update	20	update t1 set c1 = ? where c3 =?	/*+ BEGIN_OUTLINE_DATA FULL(@"UPD$1" "ol_db.t1"@"UPD$1") TRACE_LOG END_OUTLINE_DATA*/		update /*+trace_log*/t1 set c1 = 4 where c3 =2	admin	011902010A000000010005053F0004010A010000010005053F0003
update t1 set c1 = 4 where c3 =2;
ERROR HY000: SQL reach max concurrent num 0
update t1 set c1 = 4.0 where c3 =2;
update t1 set c1 = '4' where c3 =2;
update t1 set c1 = 3 where c3 =2;
drop outline ol_update;
create outline ol_delete on delete /*+max_concurrent(0)*/ from t1 where c3 =2 and c1 = 3 to delete /*+trace_log index(t1 c3)*/ from t1 where c3 =2 and c1 = 3;
alter outline ol_delete add delete /*+max_concurrent(0)*/ from t1 where c3 =? and c1 = 1 to delete /*+trace_log index(t1 c3)*/ from t1 where c3 =? and c1 = 1;
select a.tenant_id as tenant_id, a.name as name, hex(substr(a.signature, 1, 1)) as signatrue_len, substr(a.signature, 2, conv(hex(substr(a.signature, 1, 1)), 16,10)) as signature, a.outline_content as outline_content, a.outline_target as outline_target, a.sql_text as sql_text, a.owner as owner, hex(a.outline_params) as outline_params from oceanbase.__all_virtual_outline a, oceanbase.__all_virtual_database b where a.tenant_id = b.tenant_id and a.database_id = b.database_id and b.in_recyclebin = false and a.tenant_id = 1002 and b.database_name='ol_db';
tenant_id	name	signatrue_len	signature	outline_content	outline_target	sql_text	owner	outline_params
1002	ol_delete	41	delete /*+trace_log index(t1 c3)*/ from t1 where c3 =? and c1 = ?		delete /*+trace_log index(t1 c3)*/ from t1 where c3 =2 and c1 = 3	delete /*+max_concurrent(0)*/ from t1 where c3 =2 and c1 = 3	admin	011F020110000000020005053F00020105053F0003010A000000010105053F0001
delete  from t1 where c3 =2 and c1 = 3;
delete /*+trace_log index(t1 c3)*/ from t1 where c3 =2 and c1 = 4;
delete /*+trace_log index(t1 c3)*/ from t1 where c3 =2 and c1 = 1;
ERROR HY000: SQL reach max concurrent num 0
delete /*+trace_log index(t1 c3)*/ from t1 where c3 =2 and c1 = 2;
drop outline ol_delete;
drop database ol_db;
commit;
