delete            from t1;
delete            from t2;
delete            from t3;
delete            from ts1;
delete            from ts2;
delete            from tu1;
delete            from tu2;
delete            from td1;
delete            from tdd1;
delete            from td2;
delete            from td3;
delete            from td4;
insert into ts1 values(4,2),(5,2),(6,3);
select * from ts1;
c1	c2
4	2
5	2
6	3
insert into ts2 values(24,2),(25,2),(26,3);
select * from ts2;
c1	c2
24	2
25	2
26	3
delete       from ts2;
insert into ts1 select * from ts2;
select *   from ts1;
c1	c2
4	2
5	2
6	3
delete from ts1;
insert into ts1 select c1,c2 from ts1 union select c1,c2 from ts2;
select *    from ts1;
c1	c2
insert into ts1 values (212,  null);
select  * from ts1;
c1	c2
212	NULL
insert into ts1 values(213, null+null);
select   * from ts1;
c1	c2
212	NULL
213	NULL
insert into   ts1 values(241, 1+null);
select    * from ts1;
c1	c2
212	NULL
213	NULL
241	NULL
insert into    ts1 values(31, null+2);
select     * from ts1;
c1	c2
31	NULL
212	NULL
213	NULL
241	NULL
insert into tu1 values (4,3,'yyy'), (5,2,'hhhh'), (6,1,'lalala');
insert into tu2 values (4,3,'yyy'), (5,2,'hhhh'), (6,1,'lalala');
update tu1 set c2 = 2 where c1 = 2;
select * from tu1;
c1	c2	c3
4	3	yyy
5	2	hhhh
6	1	lalala
update tu1 t set t.c2 = 2 where c1 = 1;
select *  from tu1;
c1	c2	c3
4	3	yyy
5	2	hhhh
6	1	lalala
update tu1 set c2 = c2 + 101, c3 = 'test' where c1 = 1;
select *   from tu1;
c1	c2	c3
4	3	yyy
5	2	hhhh
6	1	lalala
update tu1 set c2 = c3 like '%h%' where c1 = 2;
select *    from tu1;
c1	c2	c3
4	3	yyy
5	2	hhhh
6	1	lalala
update tu1 set c2 = 11 where c2 = 1 and c3 = 'yyy';
select *     from tu1;
c1	c2	c3
4	3	yyy
5	2	hhhh
6	1	lalala
update tu1 set c2=c2+2 order by c1;
select  * from tu1;
c1	c2	c3
4	5	yyy
5	4	hhhh
6	3	lalala
update tu1 set c2=999 where c1=2 order by c2 asc limit 1;
select   * from t1 order by c1,c2;
c1	c2	c3
update tu1 set c2=101 where c1=3 order by c2 desc limit 2;
select    * from tu1;
c1	c2	c3
4	5	yyy
5	4	hhhh
6	3	lalala
update tu1 set c1=c1+11+c2 where c1=1 order by c2;
select     * from tu1;
c1	c2	c3
4	5	yyy
5	4	hhhh
6	3	lalala
update tu1 set c2 = (select distinct 2 from (select * from tu2) a);
select      * from tu1;
c1	c2	c3
4	2	yyy
5	2	hhhh
6	2	lalala
delete from td1 where c1 in (select max(c1) from t1 t2);
delete from td1 where c1 in (select min(c2) from (select max(c1) as c2 from td1 ) t2);
replace into td1 values (2,2),(3,4);
update td1 set c1 = 6 where c1 in (select max(c1) from td1);
replace into td1 values(1,1),(2,3),(3,3),(4,3);
delete from td1 where td1.c1 <> (select c2 from tdd1 where td1.c1 < tdd1.c1 limit 2);
DELETE FROM td1 WHERE td1.c1 > 11 ORDER BY td1.c1;
DELETE FROM td1 WHERE td1.c1 > 10 ORDER BY td1.c1 LIMIT 1;
DELETE FROM td1 ORDER BY c1 ASC, c2 ASC LIMIT 2;
DELETE FROM td1 WHERE c1 = 10 OR c2 = 21 ORDER BY c1 LIMIT 1;
insert into td2 values(4,0),(5,0),(6,1);
delete from td2;
select * from td2;
c1	c2
replace into td2  values(1,0),(2,0),(4,0);
delete from td2  where c1>2;
select * from  td2;
c1	c2
1	0
2	0
replace   into td2 values(12,0),(2,0),(3,0);
delete  from td2 where c1=2;
select *   from td2;
c1	c2
1	0
3	0
12	0
replace    into td2 values(12,0),(2,0),(3,0);
delete   from td2 where c1=2 or c1=2 or c1=3;
select *    from td2;
c1	c2
1	0
12	0
replace     into td2 values(12,1),(2,2),(3,3);
delete from td2 where c1<=12;
select *     from td2;
c1	c2
delete from td2 where 2>=c1;
select *       from td2;
c1	c2
replace      into td2 values(21,1),(2,2),(3,3);
delete from td2 where c1=1 or c1=3;
select *        from td2;
c1	c2
2	2
21	1
delete from td2 where c1=1 and c1=3;
select *         from td2;
c1	c2
2	2
21	1
replace into td2(c1,c2) values(11,1),(2,1),(3,1),(4,1);
delete from td2 where c1>=2 and c1<4;
select * from   td2;
c1	c2
4	1
11	1
21	1
replace  into td2(c1,c2) values(11,1),(2,2),(3,1),(4,2);
delete from td2 where c1>0 and c2>11;
delete from td2 where c1<5 and c2<21;
select * from    td2;
c1	c2
11	1
21	1
replace   into td2(c1,c2) values(1,11),(2,2),(3,1),(4,2);
delete from td2 where c1=0 or c1=11 or c1=2 or c2=1;
select *  from    td2;
c1	c2
1	11
4	2
replace into td2(c1,c2) values(11,NULL),(1,1),(2,1),(3,1),(4,1);
delete from td2 where c1 in (11,2,3,4);
select c1,c2 from td2;
c1	c2
1	1
replace  into td2(c1,c2) values(12,NULL),(1,1),(2,1),(3,1),(4,1);
delete from td2 where c1 in (NULL,2) or c1 in (2,3,4);
select c1,c2  from td2;
c1	c2
1	1
12	NULL
replace   into td2(c1,c2) values(122,NULL),(1,1),(2,1),(3,1),(4,1);
delete from td2 where c1 in (2) or c1 in (2) or c1 in (3,4);
select c1,c2   from td2;
c1	c2
1	1
12	NULL
122	NULL
replace    into td2(c1,c2) values(133,NULL),(1,1),(2,1),(3,1),(4,1);
delete from td2 where c1 in (NULL,1,2) and c1 in (1,2,3,4);
select c1,c2    from td2;
c1	c2
3	1
4	1
12	NULL
122	NULL
133	NULL
replace     into td2(c1,c2) values(15,NULL),(1,1),(2,1),(3,1),(4,1);
delete from td2 where c1 in (1,2,3,41) and c2 in (1,2,3,4);
select c1,c2     from td2;
c1	c2
4	1
12	NULL
15	NULL
122	NULL
133	NULL
replace into td3 values(1,1,1,0),(21,2,2,0),(3,3,3,0),(4,4,4,0),(5,4,4,0),(6,4,4,0),(7,4,6,0),(8,4,6,0),(9,4,6,0),(10,4,6,0),(11,4,6,0),(12,4,6,0), (13,4,6,0);
delete from td3 where p1 = 1;
select * from td3;
p1	p2	p3	p4
3	3	3	0
4	4	4	0
5	4	4	0
6	4	4	0
7	4	6	0
8	4	6	0
9	4	6	0
10	4	6	0
11	4	6	0
12	4	6	0
13	4	6	0
21	2	2	0
replace into   td3 values(1,1,1,0),(2,2,2,0),(3,3,3,0),(4,4,4,0),(5,4,4,0),(6,4,4,0),(7,4,6,0),(8,4,6,0),(9,4,6,0),(10,4,6,0),(11,4,6,0),(12,4,6,0), (13,4,6,0);
delete from td3 where p1>3 or p3 >=61;
select *  from td3;
p1	p2	p3	p4
1	1	1	0
2	2	2	0
3	3	3	0
delete from td3 where p1=1 and p3 =3;
select *   from td3;
p1	p2	p3	p4
1	1	1	0
2	2	2	0
3	3	3	0
delete from td3 where p1=1 and p2 =2 and p3=1;
select *    from td3;
p1	p2	p3	p4
1	1	1	0
2	2	2	0
3	3	3	0
replace into td3   values(1,1,1,0),(21,2,2,0),(3,3,3,0),(4,4,4,0),(5,4,4,0),(6,4,4,0),(7,4,6,0),(8,4,6,0),(9,4,6,0),(10,4,6,0),(11,4,6,0),(12,4,6,0), (13,4,6,0);
delete from td3 where p1 in (11,2,3,6,7,8,12,13,0);
select *     from td3;
p1	p2	p3	p4
1	1	1	0
4	4	4	0
5	4	4	0
9	4	6	0
10	4	6	0
21	2	2	0
replace   into td3   values(11,1,1,0),(2,2,2,0),(3,3,3,0),(4,4,4,0),(5,4,4,0),(6,4,4,0),(7,4,6,0),(8,4,6,0),(9,4,6,0),(10,4,6,0),(11,4,6,0),(12,4,6,0), (13,4,6,0);
delete from td3   where p1 in (13,2,3,6,7,8,12,13,0);
select *      from td3;
p1	p2	p3	p4
1	1	1	0
4	4	4	0
5	4	4	0
9	4	6	0
10	4	6	0
11	1	1	0
11	4	6	0
21	2	2	0
replace into td4(a,b,c,d) values(11,'1','2014-02-17',NULL),(2,'2','2014-02-17',NULL),(3,'3','2014-02-17',NULL);
delete from td4 where (a,b,c) in ((11,'1','2014-02-17'));
delete from td4 where (a,b,c) in ((21,'2','2014-02-17'),(3,'3','2014-02-17'));
select * from td4;
a	b	c	d
2	2	2014-02-17 00:00:00.000000	NULL
replace into  td4(a,b,c,d) values(11,'1','2014-02-17',NULL),(2,'2','2014-02-17',NULL),(3,'3','2014-02-17',NULL);
delete from td4 where (a,b,c) in ((11,'1','2014-02-17'),(2,'2','2014-02-17'),(3,'3','2014-02-17'));
select *  from td4;
a	b	c	d
replace into   td4(a,b,c,d) values(11,'1','2014-02-17',NULL),(2,'2','2014-02-17',NULL),(3,'3','2014-02-17',NULL);
delete from td4 where (a,b,c) in ((NULL,NULL,NULL),(11,'1','2014-02-17'),(2,'2','2014-02-17'),(4,'4','2014-02-17'));
select *   from td4;
a	b	c	d
3	3	2014-02-17 00:00:00.000000	NULL
replace into    td4(a,b,c,d) values(11,'1','2014-02-17',NULL),(2,'2','2014-02-17',2),(3,'3','2014-02-17',2);
delete from td4 where (a,b,c,d) in ((11,'1','2014-02-17',NULL),(2,'2','2014-02-17',2),(3,'3','2014-02-17',2));
select *    from td4;
a	b	c	d
11	1	2014-02-17 00:00:00.000000	NULL
replace into     td4(a,b,c,d) values(11,'1','2014-02-17',1),(2,'2','2014-02-17',1),(3,'3','2014-02-17',1);
delete from td4 where (a,b,c) in ((11,'1','2014-02-17'),(2,'2','2014-02-17'),(3,'3','2014-02-17')) and d in (2,2);
select *     from td4;
a	b	c	d
2	2	2014-02-17 00:00:00.000000	1
3	3	2014-02-17 00:00:00.000000	1
11	1	2014-02-17 00:00:00.000000	1
delete from  td4 where (a,b,c) in ((11,'1','2014-02-17'),(2,'2','2014-02-17'),(3,'3','2014-02-17')) and d in (1,2);
select *      from td4;
a	b	c	d
replace into      td4(a,b,c,d) values(11,'1','2014-02-17',1),(2,'2','2014-02-17',1),(3,'3','2014-02-17',1);
delete from td4 where (a,b,c) in ((11,'1','2014-02-17')) or (a,b,c) in ((2,'2','2014-02-17'),(3,'3','2014-02-17')) and d in (1);
select *        from td4;
a	b	c	d
replace into       td4(a,b,c,d) values(11,'1','2014-02-17',1),(2,'2','2014-02-17',1),(3,'3','2014-02-17',1);
delete from td4 where (a,b,c) in ((11,'1','2014-02-17'),(2,'2','2014-02-17')) and (a,b,c) in ((2,'2','2014-02-17'),(3,'3','2014-02-17')) and d>0;
select * from  td4;
a	b	c	d
3	3	2014-02-17 00:00:00.000000	1
11	1	2014-02-17 00:00:00.000000	1
replace  into td4(a,b,c,d) values(11,'1','2014-02-17',1),(2,'2','2014-02-17',1),(3,'3','2014-02-17',1);
delete from td4 where (a) in ((11),(2));
select * from   td4;
a	b	c	d
3	3	2014-02-17 00:00:00.000000	1
delete from td4 where (a,b) in ((31,'3'),(2,'2'));
select * from    td4;
a	b	c	d
3	3	2014-02-17 00:00:00.000000	1
replace   into td4(a,b,c,d) values(11,'1','2014-02-17',1),(2,'2','2014-02-17',1),(3,'3','2014-02-17',1);
delete from td4 where (b,c,a) in (('11','2014-02-17',1),('2','2014-02-17',2));
select * from     td4;
a	b	c	d
3	3	2014-02-17 00:00:00.000000	1
11	1	2014-02-17 00:00:00.000000	1
replace    into td4(a,b,c,d) values(11,'1','2014-02-17',1),(2,'2','2014-02-17',1),(3,'3','2014-02-17',1);
delete from td4 where (a,b,c) in ((11,'1','2014-02-17'),(2,'2','2014-02-17')) or (b,c) in (('2','2014-02-17'),('3','2014-02-17'));
select * from       td4;
a	b	c	d
replace     into td4(a,b,c,d) values(11,'1','2014-02-17',1),(2,'2','2014-02-17',1),(3,'3','2014-02-17',1);
delete from td4 where c='2014-02-17';
select *  from  td4;
a	b	c	d
replace      into td4(a,b,c,d) values(11,'1','2014-02-17',1),(2,'2','2014-02-17',1),(3,'3','2014-02-17',1);
delete from td4 where a=31;
select *  from   td4;
a	b	c	d
2	2	2014-02-17 00:00:00.000000	1
3	3	2014-02-17 00:00:00.000000	1
11	1	2014-02-17 00:00:00.000000	1
replace       into td4(a,b,c,d) values(11,'1','2014-02-17',1),(2,'2','2014-02-17',1),(3,'3','2014-02-17',1);
delete from td4 where a=1 and b = '2' and c = '2014-02-17' and d=1;
select *  from    td4;
a	b	c	d
2	2	2014-02-17 00:00:00.000000	1
3	3	2014-02-17 00:00:00.000000	1
11	1	2014-02-17 00:00:00.000000	1
delete from td4 where a in (select a from td4);
select *  from     td4;
a	b	c	d
delete from     t1;
delete from     t2;
delete from     t3;
insert into t1 value(44, 2, 4), (5,2,3), (6,2,2), (7,2,1);
insert into t1 value(111, 3, 4), (112,3,3), (113,3,2), (114,3,1), (115,4,1);
insert into t2 value(121, 4, 4), (122,4,3), (123,4,2), (124,4,1);
insert into t3 value(121, 4, 4), (122,4,3), (123,4,2), (124,4,1);
SELECT 12 + 46;
12 + 46
58
SELECT 12 + 46 FROM DUAL;
12 + 46
58
SELECT 12 + 45 FROM DUAL WHERE 10 > 6;
12 + 45
57
SELECT 12 + 45 FROM DUAL WHERE 10 > 6 LIMIT 10;
12 + 45
57
SELECT 12 + 45 FROM DUAL LIMIT 1;
12 + 45
57
SELECT 12 + 45 LIMIT 11;
12 + 45
57
select * from t1 group by c2 order by c2 limit 2, 2;
c1	c2	c3
115	4	1
select c1, c2 as c1 from t1 group by t1.c1;
c1	c1
111	3
112	3
113	3
114	3
115	4
44	2
5	2
6	2
7	2
select c1 as c1, c2 as c1 from t1 group by t1.c1;
c1	c1
111	3
112	3
113	3
114	3
115	4
44	2
5	2
6	2
7	2
select c1, c1 from t1 group by c1;
c1	c1
111	111
112	112
113	113
114	114
115	115
44	44
5	5
6	6
7	7
select 1 as c1, 2 as c2 from t1 group by c1 limit 1;
c1	c2
1	2
select c1 as c2, c2 as c1 from t1 group by c1;
c2	c1
111	3
112	3
113	3
114	3
115	4
44	2
5	2
6	2
7	2
select c1, c2 as c1 from t1 having t1.c1 > 3;
c1	c1
5	2
6	2
7	2
44	2
111	3
112	3
113	3
114	3
115	4
select c1, c2 + 1 as c1 from t1 having t1.c1 > 4;
c1	c1
5	3
6	3
7	3
44	3
111	4
112	4
113	4
114	4
115	5
select * from t1 left join t2 on t1.c1=t2.c1;
c1	c2	c3	c1	c2	c3
5	2	3	NULL	NULL	NULL
6	2	2	NULL	NULL	NULL
7	2	1	NULL	NULL	NULL
44	2	4	NULL	NULL	NULL
111	3	4	NULL	NULL	NULL
112	3	3	NULL	NULL	NULL
113	3	2	NULL	NULL	NULL
114	3	1	NULL	NULL	NULL
115	4	1	NULL	NULL	NULL
select * from t1 left join t2 on t1.c1=t2.c1 having not (t2.c1 <=> t1.c1);
c1	c2	c3	c1	c2	c3
5	2	3	NULL	NULL	NULL
6	2	2	NULL	NULL	NULL
7	2	1	NULL	NULL	NULL
44	2	4	NULL	NULL	NULL
111	3	4	NULL	NULL	NULL
112	3	3	NULL	NULL	NULL
113	3	2	NULL	NULL	NULL
114	3	1	NULL	NULL	NULL
115	4	1	NULL	NULL	NULL
select c1+1 AS c1 FROM t1 GROUP BY c1;
c1
112
113
114
115
116
45
6
7
8
select c2 as c1 from t1 group by c1;
c1
2
2
2
2
3
3
3
3
4
select c1+1 as c1 from t1 group by c1+1;
c1
112
113
114
115
116
45
6
7
8
select 'b' = 'b ', 'a' like 'a ';
'b' = 'b '	'a' like 'a '
1	0
select 'davidy' like 'david\_';
'davidy' like 'david\_'
0
select 'davidy' like 'david|_' escape '|';
'davidy' like 'david|_' escape '|'
0
select 'abcd' like 'abcd';
'abcd' like 'abcd'
1
select 'abcd' like binary 'abcd';
'abcd' like binary 'abcd'
1
select 11 like '1%';
11 like '1%'
1
select 'aavid_' like 'aavid|_' escape null;
'aavid_' like 'aavid|_' escape null
0
select * from t1 use key(idx);
c1	c2	c3
5	2	3
6	2	2
7	2	1
44	2	4
111	3	4
112	3	3
113	3	2
114	3	1
115	4	1
select * from t1 force index(idx);
c1	c2	c3
5	2	3
6	2	2
7	2	1
44	2	4
111	3	4
112	3	3
113	3	2
114	3	1
115	4	1
select * from t1 ignore key(idx);
c1	c2	c3
7	2	1
114	3	1
115	4	1
6	2	2
113	3	2
5	2	3
112	3	3
44	2	4
111	3	4
select * from t1 use key(a);
c1	c2	c3
5	2	3
6	2	2
7	2	1
44	2	4
111	3	4
112	3	3
113	3	2
114	3	1
115	4	1
select * from t1 force index(a);
c1	c2	c3
5	2	3
6	2	2
7	2	1
44	2	4
111	3	4
112	3	3
113	3	2
114	3	1
115	4	1
select * from t1 ignore key(a);
c1	c2	c3
7	2	1
114	3	1
115	4	1
6	2	2
113	3	2
5	2	3
112	3	3
44	2	4
111	3	4
select * from t1;
c1	c2	c3
5	2	3
6	2	2
7	2	1
44	2	4
111	3	4
112	3	3
113	3	2
114	3	1
115	4	1
select * from (t1);
c1	c2	c3
5	2	3
6	2	2
7	2	1
44	2	4
111	3	4
112	3	3
113	3	2
114	3	1
115	4	1
select * from (t1,t2);
c1	c2	c3	c1	c2	c3
5	2	3	121	4	4
5	2	3	122	4	3
5	2	3	123	4	2
5	2	3	124	4	1
6	2	2	121	4	4
6	2	2	122	4	3
6	2	2	123	4	2
6	2	2	124	4	1
7	2	1	121	4	4
7	2	1	122	4	3
7	2	1	123	4	2
7	2	1	124	4	1
44	2	4	121	4	4
44	2	4	122	4	3
44	2	4	123	4	2
44	2	4	124	4	1
111	3	4	121	4	4
111	3	4	122	4	3
111	3	4	123	4	2
111	3	4	124	4	1
112	3	3	121	4	4
112	3	3	122	4	3
112	3	3	123	4	2
112	3	3	124	4	1
113	3	2	121	4	4
113	3	2	122	4	3
113	3	2	123	4	2
113	3	2	124	4	1
114	3	1	121	4	4
114	3	1	122	4	3
114	3	1	123	4	2
114	3	1	124	4	1
115	4	1	121	4	4
115	4	1	122	4	3
115	4	1	123	4	2
115	4	1	124	4	1
select * from (t1,(t2));
c1	c2	c3	c1	c2	c3
5	2	3	121	4	4
5	2	3	122	4	3
5	2	3	123	4	2
5	2	3	124	4	1
6	2	2	121	4	4
6	2	2	122	4	3
6	2	2	123	4	2
6	2	2	124	4	1
7	2	1	121	4	4
7	2	1	122	4	3
7	2	1	123	4	2
7	2	1	124	4	1
44	2	4	121	4	4
44	2	4	122	4	3
44	2	4	123	4	2
44	2	4	124	4	1
111	3	4	121	4	4
111	3	4	122	4	3
111	3	4	123	4	2
111	3	4	124	4	1
112	3	3	121	4	4
112	3	3	122	4	3
112	3	3	123	4	2
112	3	3	124	4	1
113	3	2	121	4	4
113	3	2	122	4	3
113	3	2	123	4	2
113	3	2	124	4	1
114	3	1	121	4	4
114	3	1	122	4	3
114	3	1	123	4	2
114	3	1	124	4	1
115	4	1	121	4	4
115	4	1	122	4	3
115	4	1	123	4	2
115	4	1	124	4	1
select * from (t3,((t1,t2)));
c1	c2	c3	c1	c2	c3	c1	c2	c3
121	4	4	5	2	3	121	4	4
121	4	4	6	2	2	121	4	4
121	4	4	7	2	1	121	4	4
121	4	4	44	2	4	121	4	4
121	4	4	111	3	4	121	4	4
121	4	4	112	3	3	121	4	4
121	4	4	113	3	2	121	4	4
121	4	4	114	3	1	121	4	4
121	4	4	115	4	1	121	4	4
121	4	4	5	2	3	122	4	3
121	4	4	6	2	2	122	4	3
121	4	4	7	2	1	122	4	3
121	4	4	44	2	4	122	4	3
121	4	4	111	3	4	122	4	3
121	4	4	112	3	3	122	4	3
121	4	4	113	3	2	122	4	3
121	4	4	114	3	1	122	4	3
121	4	4	115	4	1	122	4	3
121	4	4	5	2	3	123	4	2
121	4	4	6	2	2	123	4	2
121	4	4	7	2	1	123	4	2
121	4	4	44	2	4	123	4	2
121	4	4	111	3	4	123	4	2
121	4	4	112	3	3	123	4	2
121	4	4	113	3	2	123	4	2
121	4	4	114	3	1	123	4	2
121	4	4	115	4	1	123	4	2
121	4	4	5	2	3	124	4	1
121	4	4	6	2	2	124	4	1
121	4	4	7	2	1	124	4	1
121	4	4	44	2	4	124	4	1
121	4	4	111	3	4	124	4	1
121	4	4	112	3	3	124	4	1
121	4	4	113	3	2	124	4	1
121	4	4	114	3	1	124	4	1
121	4	4	115	4	1	124	4	1
122	4	3	5	2	3	121	4	4
122	4	3	6	2	2	121	4	4
122	4	3	7	2	1	121	4	4
122	4	3	44	2	4	121	4	4
122	4	3	111	3	4	121	4	4
122	4	3	112	3	3	121	4	4
122	4	3	113	3	2	121	4	4
122	4	3	114	3	1	121	4	4
122	4	3	115	4	1	121	4	4
122	4	3	5	2	3	122	4	3
122	4	3	6	2	2	122	4	3
122	4	3	7	2	1	122	4	3
122	4	3	44	2	4	122	4	3
122	4	3	111	3	4	122	4	3
122	4	3	112	3	3	122	4	3
122	4	3	113	3	2	122	4	3
122	4	3	114	3	1	122	4	3
122	4	3	115	4	1	122	4	3
122	4	3	5	2	3	123	4	2
122	4	3	6	2	2	123	4	2
122	4	3	7	2	1	123	4	2
122	4	3	44	2	4	123	4	2
122	4	3	111	3	4	123	4	2
122	4	3	112	3	3	123	4	2
122	4	3	113	3	2	123	4	2
122	4	3	114	3	1	123	4	2
122	4	3	115	4	1	123	4	2
122	4	3	5	2	3	124	4	1
122	4	3	6	2	2	124	4	1
122	4	3	7	2	1	124	4	1
122	4	3	44	2	4	124	4	1
122	4	3	111	3	4	124	4	1
122	4	3	112	3	3	124	4	1
122	4	3	113	3	2	124	4	1
122	4	3	114	3	1	124	4	1
122	4	3	115	4	1	124	4	1
123	4	2	5	2	3	121	4	4
123	4	2	6	2	2	121	4	4
123	4	2	7	2	1	121	4	4
123	4	2	44	2	4	121	4	4
123	4	2	111	3	4	121	4	4
123	4	2	112	3	3	121	4	4
123	4	2	113	3	2	121	4	4
123	4	2	114	3	1	121	4	4
123	4	2	115	4	1	121	4	4
123	4	2	5	2	3	122	4	3
123	4	2	6	2	2	122	4	3
123	4	2	7	2	1	122	4	3
123	4	2	44	2	4	122	4	3
123	4	2	111	3	4	122	4	3
123	4	2	112	3	3	122	4	3
123	4	2	113	3	2	122	4	3
123	4	2	114	3	1	122	4	3
123	4	2	115	4	1	122	4	3
123	4	2	5	2	3	123	4	2
123	4	2	6	2	2	123	4	2
123	4	2	7	2	1	123	4	2
123	4	2	44	2	4	123	4	2
123	4	2	111	3	4	123	4	2
123	4	2	112	3	3	123	4	2
123	4	2	113	3	2	123	4	2
123	4	2	114	3	1	123	4	2
123	4	2	115	4	1	123	4	2
123	4	2	5	2	3	124	4	1
123	4	2	6	2	2	124	4	1
123	4	2	7	2	1	124	4	1
123	4	2	44	2	4	124	4	1
123	4	2	111	3	4	124	4	1
123	4	2	112	3	3	124	4	1
123	4	2	113	3	2	124	4	1
123	4	2	114	3	1	124	4	1
123	4	2	115	4	1	124	4	1
124	4	1	5	2	3	121	4	4
124	4	1	6	2	2	121	4	4
124	4	1	7	2	1	121	4	4
124	4	1	44	2	4	121	4	4
124	4	1	111	3	4	121	4	4
124	4	1	112	3	3	121	4	4
124	4	1	113	3	2	121	4	4
124	4	1	114	3	1	121	4	4
124	4	1	115	4	1	121	4	4
124	4	1	5	2	3	122	4	3
124	4	1	6	2	2	122	4	3
124	4	1	7	2	1	122	4	3
124	4	1	44	2	4	122	4	3
124	4	1	111	3	4	122	4	3
124	4	1	112	3	3	122	4	3
124	4	1	113	3	2	122	4	3
124	4	1	114	3	1	122	4	3
124	4	1	115	4	1	122	4	3
124	4	1	5	2	3	123	4	2
124	4	1	6	2	2	123	4	2
124	4	1	7	2	1	123	4	2
124	4	1	44	2	4	123	4	2
124	4	1	111	3	4	123	4	2
124	4	1	112	3	3	123	4	2
124	4	1	113	3	2	123	4	2
124	4	1	114	3	1	123	4	2
124	4	1	115	4	1	123	4	2
124	4	1	5	2	3	124	4	1
124	4	1	6	2	2	124	4	1
124	4	1	7	2	1	124	4	1
124	4	1	44	2	4	124	4	1
124	4	1	111	3	4	124	4	1
124	4	1	112	3	3	124	4	1
124	4	1	113	3	2	124	4	1
124	4	1	114	3	1	124	4	1
124	4	1	115	4	1	124	4	1
select * from t1 join t2 join t3;
c1	c2	c3	c1	c2	c3	c1	c2	c3
5	2	3	121	4	4	121	4	4
6	2	2	121	4	4	121	4	4
7	2	1	121	4	4	121	4	4
44	2	4	121	4	4	121	4	4
111	3	4	121	4	4	121	4	4
112	3	3	121	4	4	121	4	4
113	3	2	121	4	4	121	4	4
114	3	1	121	4	4	121	4	4
115	4	1	121	4	4	121	4	4
5	2	3	121	4	4	122	4	3
6	2	2	121	4	4	122	4	3
7	2	1	121	4	4	122	4	3
44	2	4	121	4	4	122	4	3
111	3	4	121	4	4	122	4	3
112	3	3	121	4	4	122	4	3
113	3	2	121	4	4	122	4	3
114	3	1	121	4	4	122	4	3
115	4	1	121	4	4	122	4	3
5	2	3	121	4	4	123	4	2
6	2	2	121	4	4	123	4	2
7	2	1	121	4	4	123	4	2
44	2	4	121	4	4	123	4	2
111	3	4	121	4	4	123	4	2
112	3	3	121	4	4	123	4	2
113	3	2	121	4	4	123	4	2
114	3	1	121	4	4	123	4	2
115	4	1	121	4	4	123	4	2
5	2	3	121	4	4	124	4	1
6	2	2	121	4	4	124	4	1
7	2	1	121	4	4	124	4	1
44	2	4	121	4	4	124	4	1
111	3	4	121	4	4	124	4	1
112	3	3	121	4	4	124	4	1
113	3	2	121	4	4	124	4	1
114	3	1	121	4	4	124	4	1
115	4	1	121	4	4	124	4	1
5	2	3	122	4	3	121	4	4
6	2	2	122	4	3	121	4	4
7	2	1	122	4	3	121	4	4
44	2	4	122	4	3	121	4	4
111	3	4	122	4	3	121	4	4
112	3	3	122	4	3	121	4	4
113	3	2	122	4	3	121	4	4
114	3	1	122	4	3	121	4	4
115	4	1	122	4	3	121	4	4
5	2	3	122	4	3	122	4	3
6	2	2	122	4	3	122	4	3
7	2	1	122	4	3	122	4	3
44	2	4	122	4	3	122	4	3
111	3	4	122	4	3	122	4	3
112	3	3	122	4	3	122	4	3
113	3	2	122	4	3	122	4	3
114	3	1	122	4	3	122	4	3
115	4	1	122	4	3	122	4	3
5	2	3	122	4	3	123	4	2
6	2	2	122	4	3	123	4	2
7	2	1	122	4	3	123	4	2
44	2	4	122	4	3	123	4	2
111	3	4	122	4	3	123	4	2
112	3	3	122	4	3	123	4	2
113	3	2	122	4	3	123	4	2
114	3	1	122	4	3	123	4	2
115	4	1	122	4	3	123	4	2
5	2	3	122	4	3	124	4	1
6	2	2	122	4	3	124	4	1
7	2	1	122	4	3	124	4	1
44	2	4	122	4	3	124	4	1
111	3	4	122	4	3	124	4	1
112	3	3	122	4	3	124	4	1
113	3	2	122	4	3	124	4	1
114	3	1	122	4	3	124	4	1
115	4	1	122	4	3	124	4	1
5	2	3	123	4	2	121	4	4
6	2	2	123	4	2	121	4	4
7	2	1	123	4	2	121	4	4
44	2	4	123	4	2	121	4	4
111	3	4	123	4	2	121	4	4
112	3	3	123	4	2	121	4	4
113	3	2	123	4	2	121	4	4
114	3	1	123	4	2	121	4	4
115	4	1	123	4	2	121	4	4
5	2	3	123	4	2	122	4	3
6	2	2	123	4	2	122	4	3
7	2	1	123	4	2	122	4	3
44	2	4	123	4	2	122	4	3
111	3	4	123	4	2	122	4	3
112	3	3	123	4	2	122	4	3
113	3	2	123	4	2	122	4	3
114	3	1	123	4	2	122	4	3
115	4	1	123	4	2	122	4	3
5	2	3	123	4	2	123	4	2
6	2	2	123	4	2	123	4	2
7	2	1	123	4	2	123	4	2
44	2	4	123	4	2	123	4	2
111	3	4	123	4	2	123	4	2
112	3	3	123	4	2	123	4	2
113	3	2	123	4	2	123	4	2
114	3	1	123	4	2	123	4	2
115	4	1	123	4	2	123	4	2
5	2	3	123	4	2	124	4	1
6	2	2	123	4	2	124	4	1
7	2	1	123	4	2	124	4	1
44	2	4	123	4	2	124	4	1
111	3	4	123	4	2	124	4	1
112	3	3	123	4	2	124	4	1
113	3	2	123	4	2	124	4	1
114	3	1	123	4	2	124	4	1
115	4	1	123	4	2	124	4	1
5	2	3	124	4	1	121	4	4
6	2	2	124	4	1	121	4	4
7	2	1	124	4	1	121	4	4
44	2	4	124	4	1	121	4	4
111	3	4	124	4	1	121	4	4
112	3	3	124	4	1	121	4	4
113	3	2	124	4	1	121	4	4
114	3	1	124	4	1	121	4	4
115	4	1	124	4	1	121	4	4
5	2	3	124	4	1	122	4	3
6	2	2	124	4	1	122	4	3
7	2	1	124	4	1	122	4	3
44	2	4	124	4	1	122	4	3
111	3	4	124	4	1	122	4	3
112	3	3	124	4	1	122	4	3
113	3	2	124	4	1	122	4	3
114	3	1	124	4	1	122	4	3
115	4	1	124	4	1	122	4	3
5	2	3	124	4	1	123	4	2
6	2	2	124	4	1	123	4	2
7	2	1	124	4	1	123	4	2
44	2	4	124	4	1	123	4	2
111	3	4	124	4	1	123	4	2
112	3	3	124	4	1	123	4	2
113	3	2	124	4	1	123	4	2
114	3	1	124	4	1	123	4	2
115	4	1	124	4	1	123	4	2
5	2	3	124	4	1	124	4	1
6	2	2	124	4	1	124	4	1
7	2	1	124	4	1	124	4	1
44	2	4	124	4	1	124	4	1
111	3	4	124	4	1	124	4	1
112	3	3	124	4	1	124	4	1
113	3	2	124	4	1	124	4	1
114	3	1	124	4	1	124	4	1
115	4	1	124	4	1	124	4	1
select * from (t1 join t2) join t3;
c1	c2	c3	c1	c2	c3	c1	c2	c3
5	2	3	121	4	4	121	4	4
6	2	2	121	4	4	121	4	4
7	2	1	121	4	4	121	4	4
44	2	4	121	4	4	121	4	4
111	3	4	121	4	4	121	4	4
112	3	3	121	4	4	121	4	4
113	3	2	121	4	4	121	4	4
114	3	1	121	4	4	121	4	4
115	4	1	121	4	4	121	4	4
5	2	3	121	4	4	122	4	3
6	2	2	121	4	4	122	4	3
7	2	1	121	4	4	122	4	3
44	2	4	121	4	4	122	4	3
111	3	4	121	4	4	122	4	3
112	3	3	121	4	4	122	4	3
113	3	2	121	4	4	122	4	3
114	3	1	121	4	4	122	4	3
115	4	1	121	4	4	122	4	3
5	2	3	121	4	4	123	4	2
6	2	2	121	4	4	123	4	2
7	2	1	121	4	4	123	4	2
44	2	4	121	4	4	123	4	2
111	3	4	121	4	4	123	4	2
112	3	3	121	4	4	123	4	2
113	3	2	121	4	4	123	4	2
114	3	1	121	4	4	123	4	2
115	4	1	121	4	4	123	4	2
5	2	3	121	4	4	124	4	1
6	2	2	121	4	4	124	4	1
7	2	1	121	4	4	124	4	1
44	2	4	121	4	4	124	4	1
111	3	4	121	4	4	124	4	1
112	3	3	121	4	4	124	4	1
113	3	2	121	4	4	124	4	1
114	3	1	121	4	4	124	4	1
115	4	1	121	4	4	124	4	1
5	2	3	122	4	3	121	4	4
6	2	2	122	4	3	121	4	4
7	2	1	122	4	3	121	4	4
44	2	4	122	4	3	121	4	4
111	3	4	122	4	3	121	4	4
112	3	3	122	4	3	121	4	4
113	3	2	122	4	3	121	4	4
114	3	1	122	4	3	121	4	4
115	4	1	122	4	3	121	4	4
5	2	3	122	4	3	122	4	3
6	2	2	122	4	3	122	4	3
7	2	1	122	4	3	122	4	3
44	2	4	122	4	3	122	4	3
111	3	4	122	4	3	122	4	3
112	3	3	122	4	3	122	4	3
113	3	2	122	4	3	122	4	3
114	3	1	122	4	3	122	4	3
115	4	1	122	4	3	122	4	3
5	2	3	122	4	3	123	4	2
6	2	2	122	4	3	123	4	2
7	2	1	122	4	3	123	4	2
44	2	4	122	4	3	123	4	2
111	3	4	122	4	3	123	4	2
112	3	3	122	4	3	123	4	2
113	3	2	122	4	3	123	4	2
114	3	1	122	4	3	123	4	2
115	4	1	122	4	3	123	4	2
5	2	3	122	4	3	124	4	1
6	2	2	122	4	3	124	4	1
7	2	1	122	4	3	124	4	1
44	2	4	122	4	3	124	4	1
111	3	4	122	4	3	124	4	1
112	3	3	122	4	3	124	4	1
113	3	2	122	4	3	124	4	1
114	3	1	122	4	3	124	4	1
115	4	1	122	4	3	124	4	1
5	2	3	123	4	2	121	4	4
6	2	2	123	4	2	121	4	4
7	2	1	123	4	2	121	4	4
44	2	4	123	4	2	121	4	4
111	3	4	123	4	2	121	4	4
112	3	3	123	4	2	121	4	4
113	3	2	123	4	2	121	4	4
114	3	1	123	4	2	121	4	4
115	4	1	123	4	2	121	4	4
5	2	3	123	4	2	122	4	3
6	2	2	123	4	2	122	4	3
7	2	1	123	4	2	122	4	3
44	2	4	123	4	2	122	4	3
111	3	4	123	4	2	122	4	3
112	3	3	123	4	2	122	4	3
113	3	2	123	4	2	122	4	3
114	3	1	123	4	2	122	4	3
115	4	1	123	4	2	122	4	3
5	2	3	123	4	2	123	4	2
6	2	2	123	4	2	123	4	2
7	2	1	123	4	2	123	4	2
44	2	4	123	4	2	123	4	2
111	3	4	123	4	2	123	4	2
112	3	3	123	4	2	123	4	2
113	3	2	123	4	2	123	4	2
114	3	1	123	4	2	123	4	2
115	4	1	123	4	2	123	4	2
5	2	3	123	4	2	124	4	1
6	2	2	123	4	2	124	4	1
7	2	1	123	4	2	124	4	1
44	2	4	123	4	2	124	4	1
111	3	4	123	4	2	124	4	1
112	3	3	123	4	2	124	4	1
113	3	2	123	4	2	124	4	1
114	3	1	123	4	2	124	4	1
115	4	1	123	4	2	124	4	1
5	2	3	124	4	1	121	4	4
6	2	2	124	4	1	121	4	4
7	2	1	124	4	1	121	4	4
44	2	4	124	4	1	121	4	4
111	3	4	124	4	1	121	4	4
112	3	3	124	4	1	121	4	4
113	3	2	124	4	1	121	4	4
114	3	1	124	4	1	121	4	4
115	4	1	124	4	1	121	4	4
5	2	3	124	4	1	122	4	3
6	2	2	124	4	1	122	4	3
7	2	1	124	4	1	122	4	3
44	2	4	124	4	1	122	4	3
111	3	4	124	4	1	122	4	3
112	3	3	124	4	1	122	4	3
113	3	2	124	4	1	122	4	3
114	3	1	124	4	1	122	4	3
115	4	1	124	4	1	122	4	3
5	2	3	124	4	1	123	4	2
6	2	2	124	4	1	123	4	2
7	2	1	124	4	1	123	4	2
44	2	4	124	4	1	123	4	2
111	3	4	124	4	1	123	4	2
112	3	3	124	4	1	123	4	2
113	3	2	124	4	1	123	4	2
114	3	1	124	4	1	123	4	2
115	4	1	124	4	1	123	4	2
5	2	3	124	4	1	124	4	1
6	2	2	124	4	1	124	4	1
7	2	1	124	4	1	124	4	1
44	2	4	124	4	1	124	4	1
111	3	4	124	4	1	124	4	1
112	3	3	124	4	1	124	4	1
113	3	2	124	4	1	124	4	1
114	3	1	124	4	1	124	4	1
115	4	1	124	4	1	124	4	1
select * from (t1 join t2) join (select * from t3) a;
c1	c2	c3	c1	c2	c3	c1	c2	c3
5	2	3	121	4	4	121	4	4
6	2	2	121	4	4	121	4	4
7	2	1	121	4	4	121	4	4
44	2	4	121	4	4	121	4	4
111	3	4	121	4	4	121	4	4
112	3	3	121	4	4	121	4	4
113	3	2	121	4	4	121	4	4
114	3	1	121	4	4	121	4	4
115	4	1	121	4	4	121	4	4
5	2	3	121	4	4	122	4	3
6	2	2	121	4	4	122	4	3
7	2	1	121	4	4	122	4	3
44	2	4	121	4	4	122	4	3
111	3	4	121	4	4	122	4	3
112	3	3	121	4	4	122	4	3
113	3	2	121	4	4	122	4	3
114	3	1	121	4	4	122	4	3
115	4	1	121	4	4	122	4	3
5	2	3	121	4	4	123	4	2
6	2	2	121	4	4	123	4	2
7	2	1	121	4	4	123	4	2
44	2	4	121	4	4	123	4	2
111	3	4	121	4	4	123	4	2
112	3	3	121	4	4	123	4	2
113	3	2	121	4	4	123	4	2
114	3	1	121	4	4	123	4	2
115	4	1	121	4	4	123	4	2
5	2	3	121	4	4	124	4	1
6	2	2	121	4	4	124	4	1
7	2	1	121	4	4	124	4	1
44	2	4	121	4	4	124	4	1
111	3	4	121	4	4	124	4	1
112	3	3	121	4	4	124	4	1
113	3	2	121	4	4	124	4	1
114	3	1	121	4	4	124	4	1
115	4	1	121	4	4	124	4	1
5	2	3	122	4	3	121	4	4
6	2	2	122	4	3	121	4	4
7	2	1	122	4	3	121	4	4
44	2	4	122	4	3	121	4	4
111	3	4	122	4	3	121	4	4
112	3	3	122	4	3	121	4	4
113	3	2	122	4	3	121	4	4
114	3	1	122	4	3	121	4	4
115	4	1	122	4	3	121	4	4
5	2	3	122	4	3	122	4	3
6	2	2	122	4	3	122	4	3
7	2	1	122	4	3	122	4	3
44	2	4	122	4	3	122	4	3
111	3	4	122	4	3	122	4	3
112	3	3	122	4	3	122	4	3
113	3	2	122	4	3	122	4	3
114	3	1	122	4	3	122	4	3
115	4	1	122	4	3	122	4	3
5	2	3	122	4	3	123	4	2
6	2	2	122	4	3	123	4	2
7	2	1	122	4	3	123	4	2
44	2	4	122	4	3	123	4	2
111	3	4	122	4	3	123	4	2
112	3	3	122	4	3	123	4	2
113	3	2	122	4	3	123	4	2
114	3	1	122	4	3	123	4	2
115	4	1	122	4	3	123	4	2
5	2	3	122	4	3	124	4	1
6	2	2	122	4	3	124	4	1
7	2	1	122	4	3	124	4	1
44	2	4	122	4	3	124	4	1
111	3	4	122	4	3	124	4	1
112	3	3	122	4	3	124	4	1
113	3	2	122	4	3	124	4	1
114	3	1	122	4	3	124	4	1
115	4	1	122	4	3	124	4	1
5	2	3	123	4	2	121	4	4
6	2	2	123	4	2	121	4	4
7	2	1	123	4	2	121	4	4
44	2	4	123	4	2	121	4	4
111	3	4	123	4	2	121	4	4
112	3	3	123	4	2	121	4	4
113	3	2	123	4	2	121	4	4
114	3	1	123	4	2	121	4	4
115	4	1	123	4	2	121	4	4
5	2	3	123	4	2	122	4	3
6	2	2	123	4	2	122	4	3
7	2	1	123	4	2	122	4	3
44	2	4	123	4	2	122	4	3
111	3	4	123	4	2	122	4	3
112	3	3	123	4	2	122	4	3
113	3	2	123	4	2	122	4	3
114	3	1	123	4	2	122	4	3
115	4	1	123	4	2	122	4	3
5	2	3	123	4	2	123	4	2
6	2	2	123	4	2	123	4	2
7	2	1	123	4	2	123	4	2
44	2	4	123	4	2	123	4	2
111	3	4	123	4	2	123	4	2
112	3	3	123	4	2	123	4	2
113	3	2	123	4	2	123	4	2
114	3	1	123	4	2	123	4	2
115	4	1	123	4	2	123	4	2
5	2	3	123	4	2	124	4	1
6	2	2	123	4	2	124	4	1
7	2	1	123	4	2	124	4	1
44	2	4	123	4	2	124	4	1
111	3	4	123	4	2	124	4	1
112	3	3	123	4	2	124	4	1
113	3	2	123	4	2	124	4	1
114	3	1	123	4	2	124	4	1
115	4	1	123	4	2	124	4	1
5	2	3	124	4	1	121	4	4
6	2	2	124	4	1	121	4	4
7	2	1	124	4	1	121	4	4
44	2	4	124	4	1	121	4	4
111	3	4	124	4	1	121	4	4
112	3	3	124	4	1	121	4	4
113	3	2	124	4	1	121	4	4
114	3	1	124	4	1	121	4	4
115	4	1	124	4	1	121	4	4
5	2	3	124	4	1	122	4	3
6	2	2	124	4	1	122	4	3
7	2	1	124	4	1	122	4	3
44	2	4	124	4	1	122	4	3
111	3	4	124	4	1	122	4	3
112	3	3	124	4	1	122	4	3
113	3	2	124	4	1	122	4	3
114	3	1	124	4	1	122	4	3
115	4	1	124	4	1	122	4	3
5	2	3	124	4	1	123	4	2
6	2	2	124	4	1	123	4	2
7	2	1	124	4	1	123	4	2
44	2	4	124	4	1	123	4	2
111	3	4	124	4	1	123	4	2
112	3	3	124	4	1	123	4	2
113	3	2	124	4	1	123	4	2
114	3	1	124	4	1	123	4	2
115	4	1	124	4	1	123	4	2
5	2	3	124	4	1	124	4	1
6	2	2	124	4	1	124	4	1
7	2	1	124	4	1	124	4	1
44	2	4	124	4	1	124	4	1
111	3	4	124	4	1	124	4	1
112	3	3	124	4	1	124	4	1
113	3	2	124	4	1	124	4	1
114	3	1	124	4	1	124	4	1
115	4	1	124	4	1	124	4	1
select * from ((t1 join t2) join (select * from t3) a);
c1	c2	c3	c1	c2	c3	c1	c2	c3
5	2	3	121	4	4	121	4	4
6	2	2	121	4	4	121	4	4
7	2	1	121	4	4	121	4	4
44	2	4	121	4	4	121	4	4
111	3	4	121	4	4	121	4	4
112	3	3	121	4	4	121	4	4
113	3	2	121	4	4	121	4	4
114	3	1	121	4	4	121	4	4
115	4	1	121	4	4	121	4	4
5	2	3	121	4	4	122	4	3
6	2	2	121	4	4	122	4	3
7	2	1	121	4	4	122	4	3
44	2	4	121	4	4	122	4	3
111	3	4	121	4	4	122	4	3
112	3	3	121	4	4	122	4	3
113	3	2	121	4	4	122	4	3
114	3	1	121	4	4	122	4	3
115	4	1	121	4	4	122	4	3
5	2	3	121	4	4	123	4	2
6	2	2	121	4	4	123	4	2
7	2	1	121	4	4	123	4	2
44	2	4	121	4	4	123	4	2
111	3	4	121	4	4	123	4	2
112	3	3	121	4	4	123	4	2
113	3	2	121	4	4	123	4	2
114	3	1	121	4	4	123	4	2
115	4	1	121	4	4	123	4	2
5	2	3	121	4	4	124	4	1
6	2	2	121	4	4	124	4	1
7	2	1	121	4	4	124	4	1
44	2	4	121	4	4	124	4	1
111	3	4	121	4	4	124	4	1
112	3	3	121	4	4	124	4	1
113	3	2	121	4	4	124	4	1
114	3	1	121	4	4	124	4	1
115	4	1	121	4	4	124	4	1
5	2	3	122	4	3	121	4	4
6	2	2	122	4	3	121	4	4
7	2	1	122	4	3	121	4	4
44	2	4	122	4	3	121	4	4
111	3	4	122	4	3	121	4	4
112	3	3	122	4	3	121	4	4
113	3	2	122	4	3	121	4	4
114	3	1	122	4	3	121	4	4
115	4	1	122	4	3	121	4	4
5	2	3	122	4	3	122	4	3
6	2	2	122	4	3	122	4	3
7	2	1	122	4	3	122	4	3
44	2	4	122	4	3	122	4	3
111	3	4	122	4	3	122	4	3
112	3	3	122	4	3	122	4	3
113	3	2	122	4	3	122	4	3
114	3	1	122	4	3	122	4	3
115	4	1	122	4	3	122	4	3
5	2	3	122	4	3	123	4	2
6	2	2	122	4	3	123	4	2
7	2	1	122	4	3	123	4	2
44	2	4	122	4	3	123	4	2
111	3	4	122	4	3	123	4	2
112	3	3	122	4	3	123	4	2
113	3	2	122	4	3	123	4	2
114	3	1	122	4	3	123	4	2
115	4	1	122	4	3	123	4	2
5	2	3	122	4	3	124	4	1
6	2	2	122	4	3	124	4	1
7	2	1	122	4	3	124	4	1
44	2	4	122	4	3	124	4	1
111	3	4	122	4	3	124	4	1
112	3	3	122	4	3	124	4	1
113	3	2	122	4	3	124	4	1
114	3	1	122	4	3	124	4	1
115	4	1	122	4	3	124	4	1
5	2	3	123	4	2	121	4	4
6	2	2	123	4	2	121	4	4
7	2	1	123	4	2	121	4	4
44	2	4	123	4	2	121	4	4
111	3	4	123	4	2	121	4	4
112	3	3	123	4	2	121	4	4
113	3	2	123	4	2	121	4	4
114	3	1	123	4	2	121	4	4
115	4	1	123	4	2	121	4	4
5	2	3	123	4	2	122	4	3
6	2	2	123	4	2	122	4	3
7	2	1	123	4	2	122	4	3
44	2	4	123	4	2	122	4	3
111	3	4	123	4	2	122	4	3
112	3	3	123	4	2	122	4	3
113	3	2	123	4	2	122	4	3
114	3	1	123	4	2	122	4	3
115	4	1	123	4	2	122	4	3
5	2	3	123	4	2	123	4	2
6	2	2	123	4	2	123	4	2
7	2	1	123	4	2	123	4	2
44	2	4	123	4	2	123	4	2
111	3	4	123	4	2	123	4	2
112	3	3	123	4	2	123	4	2
113	3	2	123	4	2	123	4	2
114	3	1	123	4	2	123	4	2
115	4	1	123	4	2	123	4	2
5	2	3	123	4	2	124	4	1
6	2	2	123	4	2	124	4	1
7	2	1	123	4	2	124	4	1
44	2	4	123	4	2	124	4	1
111	3	4	123	4	2	124	4	1
112	3	3	123	4	2	124	4	1
113	3	2	123	4	2	124	4	1
114	3	1	123	4	2	124	4	1
115	4	1	123	4	2	124	4	1
5	2	3	124	4	1	121	4	4
6	2	2	124	4	1	121	4	4
7	2	1	124	4	1	121	4	4
44	2	4	124	4	1	121	4	4
111	3	4	124	4	1	121	4	4
112	3	3	124	4	1	121	4	4
113	3	2	124	4	1	121	4	4
114	3	1	124	4	1	121	4	4
115	4	1	124	4	1	121	4	4
5	2	3	124	4	1	122	4	3
6	2	2	124	4	1	122	4	3
7	2	1	124	4	1	122	4	3
44	2	4	124	4	1	122	4	3
111	3	4	124	4	1	122	4	3
112	3	3	124	4	1	122	4	3
113	3	2	124	4	1	122	4	3
114	3	1	124	4	1	122	4	3
115	4	1	124	4	1	122	4	3
5	2	3	124	4	1	123	4	2
6	2	2	124	4	1	123	4	2
7	2	1	124	4	1	123	4	2
44	2	4	124	4	1	123	4	2
111	3	4	124	4	1	123	4	2
112	3	3	124	4	1	123	4	2
113	3	2	124	4	1	123	4	2
114	3	1	124	4	1	123	4	2
115	4	1	124	4	1	123	4	2
5	2	3	124	4	1	124	4	1
6	2	2	124	4	1	124	4	1
7	2	1	124	4	1	124	4	1
44	2	4	124	4	1	124	4	1
111	3	4	124	4	1	124	4	1
112	3	3	124	4	1	124	4	1
113	3	2	124	4	1	124	4	1
114	3	1	124	4	1	124	4	1
115	4	1	124	4	1	124	4	1
select * from t1 join t2 on (t1.c1=t2.c1) join t3 on (t1.c1=t2.c1);
c1	c2	c3	c1	c2	c3	c1	c2	c3
select * from t1 join t2 using (c1) join t3 using (c1);
c1	c2	c3	c2	c3	c2	c3
select * from t1 join t2 on (t1.c1=t2.c1);
c1	c2	c3	c1	c2	c3
(select count(*) from t1) UNION (select count(*) from t1);
count(*)
9
(select c1,c2 from t1 limit 3)  union all (select c1,c2 from t2 order by c1 limit 1) order by c1;
c1	c2
5	2
6	2
7	2
121	4
(select * from t1 order by c1 limit 2) union (select * from t2 order by c1 limit 3) limit 2;
c1	c2	c3
5	2	3
6	2	2
(select * from t1 order by c1 limit 2) union (select * from t2 order by c1 limit 3);
c1	c2	c3
5	2	3
6	2	2
121	4	4
122	4	3
123	4	2
(select * from t1 order by c1 limit 2) union all (select * from t2 order by c1 limit 3);
c1	c2	c3
5	2	3
6	2	2
121	4	4
122	4	3
123	4	2
(select * from t1 order by c1 limit 2) union distinct (select * from t2 order by c1 limit 3);
c1	c2	c3
5	2	3
6	2	2
121	4	4
122	4	3
123	4	2
select * from t1,t2,t3 where t1.c1=t2.c1 AND t2.c2=t3.c1 and t1.c2=t3.c2 order by t1.c1;
c1	c2	c3	c1	c2	c3	c1	c2	c3
select a.c1 from (select c1 from t1) as a having a.c1 = 1;
c1
select * from t1 where 'c' not like 'b' and ((c1 < 2 and false) or (c1 < 2 and c1 is not null)) ;
c1	c2	c3
select * from t1 where 'c' not like 'b' and ((false) or (c1 < 2 and c1 is not null));
c1	c2	c3
select * from t1 group by 3>(select count(*) from t2);
c1	c2	c3
5	2	3
select * from t1 order by 3>(select count(*) from t2);
c1	c2	c3
5	2	3
6	2	2
7	2	1
44	2	4
111	3	4
112	3	3
113	3	2
114	3	1
115	4	1
select (3>(select count(*) from t2)) from t1;
(3>(select count(*) from t2))
0
0
0
0
0
0
0
0
0
select * from t1 where 3>(select count(*) from t2);
c1	c2	c3
select (3>(select count(*) from t2)) from t1 union select c1 from t2;
(3>(select count(*) from t2))
0
121
122
123
124
select * from t1 group by 3>(select count(*) from t2) union select * from t2;
c1	c2	c3
5	2	3
121	4	4
122	4	3
123	4	2
124	4	1
select * from t1 order by 3>(select count(*) from t2) intersect select * from t2;
c1	c2	c3
select * from t1 where 3>(select count(*) from t2) union select * from t2;
c1	c2	c3
121	4	4
122	4	3
123	4	2
124	4	1
select min(2) from t1;
min(2)
2
select max(2) from t1;
max(2)
2
select sum(2) from t1;
sum(2)
18
select avg(2) from t1;
avg(2)
2.0000
select max(t3.c1) from t1 as t3, t1 t4 where t3.c1 = t4.c1;
max(t3.c1)
115
SELECT length('asdfgyyy');
length('asdfgyyy')
8
select found_rows();
found_rows()
1
select * from  t1  for update wait 2;
c1	c2	c3
5	2	3
6	2	2
7	2	1
44	2	4
111	3	4
112	3	3
113	3	2
114	3	1
115	4	1
select * from  t1  a  for update wait 2;
c1	c2	c3
5	2	3
6	2	2
7	2	1
44	2	4
111	3	4
112	3	3
113	3	2
114	3	1
115	4	1
select * from  t1  where c1 <101 for update wait 1;
c1	c2	c3
5	2	3
6	2	2
7	2	1
44	2	4
select * from  t1  where c1 <101  and c2 < 100 for update wait 1;
c1	c2	c3
5	2	3
6	2	2
7	2	1
44	2	4
select * from  t1  where c1 in (3,2,3,4,5,6) for update wait 1;
c1	c2	c3
5	2	3
6	2	2
select * from  t1  where (c1,c2) in ((2,2), (2,3),(3,4)) for update wait 1;
c1	c2	c3
select * from t1 t where t.c2 = 3 and t.c1 = 2 for update nowait;
c1	c2	c3
select abs(c1) , sum(c2) from t1 group by abs(c2) having sum(sign(c1)) > 1 for update;
abs(c1)	sum(c2)
111	12
5	8
set @@ob_enable_plan_cache = 1;
create outline  ol_0 on delete            from t1;
create outline  ol_1 on delete            from t2;
create outline  ol_2 on delete            from t3;
create outline  ol_3 on delete            from ts1;
create outline  ol_4 on delete            from ts2;
create outline  ol_5 on delete            from tu1;
create outline  ol_6 on delete            from tu2;
create outline  ol_7 on delete            from td1;
create outline  ol_8 on delete            from tdd1;
create outline  ol_9 on delete            from td2;
create outline  ol_10 on delete            from td3;
create outline  ol_11 on delete            from td4;
create outline  ol_12 on insert into ts1 values(1,1),(2,2),(3,3);
create outline  ol_13 on select * from ts1;
create outline  ol_14 on insert into ts2 values(21,1),(22,2),(23,3);
create outline  ol_15 on select * from ts2;
create outline  ol_16 on delete       from ts2;
create outline  ol_17 on insert into ts1 select * from ts2;
create outline  ol_18 on select *   from ts1;
create outline  ol_19 on delete from ts1;
create outline  ol_20 on insert into ts1 select c1,c2 from ts1 union select c1,c2 from ts2;
create outline  ol_21 on select *    from ts1;
create outline  ol_22 on insert into ts1 values (20,  null);
create outline  ol_23 on select  * from ts1;
create outline  ol_24 on insert into ts1 values(24, null+null);
create outline  ol_25 on select   * from ts1;
create outline  ol_26 on insert into   ts1 values(26, 1+null);
create outline  ol_27 on select    * from ts1;
create outline  ol_28 on insert into    ts1 values(30, null+1);
create outline  ol_29 on select     * from ts1;
create outline  ol_30 on insert into tu1 values (1,2,'yyy'), (2,2,'hhhh'), (3,1,'lalala');
create outline  ol_31 on insert into tu2 values (1,2,'yyy'), (2,2,'hhhh'), (3,1,'lalala');
create outline  ol_32 on update tu1 set c2 = 1 where c1 = 1;
create outline  ol_33 on select * from tu1;
create outline  ol_34 on update tu1 t set t.c2 = 1 where c1 = 1;
create outline  ol_35 on select *  from tu1;
create outline  ol_36 on update tu1 set c2 = c2 + 100, c3 = 'test' where c1 = 1;
create outline  ol_37 on select *   from tu1;
create outline  ol_38 on update tu1 set c2 = c3 like '%h%' where c1 = 1;
create outline  ol_39 on select *    from tu1;
create outline  ol_40 on update tu1 set c2 = 10 where c2 = 1 and c3 = 'yyy';
create outline  ol_41 on select *     from tu1;
create outline  ol_42 on update tu1 set c2=c2+1 order by c1;
create outline  ol_43 on select  * from tu1;
create outline  ol_44 on update tu1 set c2=99 where c1=2 order by c2 asc limit 1;
create outline  ol_45 on select   * from t1 order by c1,c2;
create outline  ol_46 on update tu1 set c2=100 where c1=3 order by c2 desc limit 2;
create outline  ol_47 on select    * from tu1;
create outline  ol_48 on update tu1 set c1=c1+10+c2 where c1=1 order by c2;
create outline  ol_49 on select     * from tu1;
create outline  ol_50 on update tu1 set c2 = (select distinct 1 from (select * from tu2) a);
create outline  ol_51 on select      * from tu1;
create outline  ol_52 on delete from td1 where c1 in (select max(c1) from t1 t2);
create outline  ol_53 on delete from td1 where c1 in (select min(c2) from (select max(c1) as c2 from td1 ) t2);
create outline  ol_54 on replace into td1 values (2,2),(3,3);
create outline  ol_55 on update td1 set c1 = 5 where c1 in (select max(c1) from td1);
create outline  ol_56 on replace into td1 values(1,1),(2,2),(3,3),(4,3);
create outline  ol_57 on delete from td1 where td1.c1 <> (select c2 from tdd1 where td1.c1 < tdd1.c1 limit 1);
create outline  ol_58 on DELETE FROM td1 WHERE td1.c1 > 1 ORDER BY td1.c1;
create outline  ol_59 on DELETE FROM td1 WHERE td1.c1 > 0 ORDER BY td1.c1 LIMIT 1;
create outline  ol_60 on DELETE FROM td1 ORDER BY c1 ASC, c2 ASC LIMIT 1;
create outline  ol_61 on DELETE FROM td1 WHERE c1 = 10 OR c2 = 20 ORDER BY c1 LIMIT 1;
create outline  ol_62 on insert into td2 values(1,0),(2,0),(3,0);
create outline  ol_63 on delete from td2;
create outline  ol_64 on select * from td2;
create outline  ol_65 on replace into td2  values(1,0),(2,0),(3,0);
create outline  ol_66 on delete from td2  where c1>1;
create outline  ol_67 on select * from  td2;
create outline  ol_68 on replace   into td2 values(1,0),(2,0),(3,0);
create outline  ol_69 on delete  from td2 where c1=1;
create outline  ol_70 on select *   from td2;
create outline  ol_71 on replace    into td2 values(1,0),(2,0),(3,0);
create outline  ol_72 on delete   from td2 where c1=1 or c1=2 or c1=3;
create outline  ol_73 on select *    from td2;
create outline  ol_74 on replace     into td2 values(1,1),(2,2),(3,3);
create outline  ol_75 on delete from td2 where c1<=1;
create outline  ol_76 on select *     from td2;
create outline  ol_77 on delete from td2 where 1>=c1;
create outline  ol_78 on select *       from td2;
create outline  ol_79 on replace      into td2 values(1,1),(2,2),(3,3);
create outline  ol_80 on delete from td2 where c1=1 or c1=2;
create outline  ol_81 on select *        from td2;
create outline  ol_82 on delete from td2 where c1=1 and c1=2;
create outline  ol_83 on select *         from td2;
create outline  ol_84 on replace into td2(c1,c2) values(1,1),(2,1),(3,1),(4,1);
create outline  ol_85 on delete from td2 where c1>=2 and c1<3;
create outline  ol_86 on select * from   td2;
create outline  ol_87 on replace  into td2(c1,c2) values(1,1),(2,2),(3,1),(4,2);
create outline  ol_88 on delete from td2 where c1>0 and c2>1;
create outline  ol_89 on delete from td2 where c1<5 and c2<2;
create outline  ol_90 on select * from    td2;
create outline  ol_91 on replace   into td2(c1,c2) values(1,1),(2,2),(3,1),(4,2);
create outline  ol_92 on delete from td2 where c1=0 or c1=1 or c1=2 or c2=1;
create outline  ol_93 on select *  from    td2;
create outline  ol_94 on replace into td2(c1,c2) values(10,NULL),(1,1),(2,1),(3,1),(4,1);
create outline  ol_95 on delete from td2 where c1 in (1,2,3,4);
create outline  ol_96 on select c1,c2 from td2;
create outline  ol_97 on replace  into td2(c1,c2) values(11,NULL),(1,1),(2,1),(3,1),(4,1);
create outline  ol_98 on delete from td2 where c1 in (NULL,1) or c1 in (2,3,4);
create outline  ol_99 on select c1,c2  from td2;
create outline  ol_100 on replace   into td2(c1,c2) values(12,NULL),(1,1),(2,1),(3,1),(4,1);
create outline  ol_101 on delete from td2 where c1 in (1) or c1 in (2) or c1 in (3,4);
create outline  ol_102 on select c1,c2   from td2;
create outline  ol_103 on replace    into td2(c1,c2) values(13,NULL),(1,1),(2,1),(3,1),(4,1);
create outline  ol_104 on delete from td2 where c1 in (NULL,1,3) and c1 in (1,2,3,4);
create outline  ol_105 on select c1,c2    from td2;
create outline  ol_106 on replace     into td2(c1,c2) values(14,NULL),(1,1),(2,1),(3,1),(4,1);
create outline  ol_107 on delete from td2 where c1 in (1,2,3,4) and c2 in (1,2,3,4);
create outline  ol_108 on select c1,c2     from td2;
create outline  ol_109 on replace into td3 values(1,1,1,0),(2,2,2,0),(3,3,3,0),(4,4,4,0),(5,4,4,0),(6,4,4,0),(7,4,6,0),(8,4,6,0),(9,4,6,0),(10,4,6,0),(11,4,6,0),(12,4,6,0), (13,4,6,0);
create outline  ol_110 on delete from td3 where p1 = 1;
create outline  ol_111 on select * from td3;
create outline  ol_112 on replace into   td3 values(1,1,1,0),(2,2,2,0),(3,3,3,0),(4,4,4,0),(5,4,4,0),(6,4,4,0),(7,4,6,0),(8,4,6,0),(9,4,6,0),(10,4,6,0),(11,4,6,0),(12,4,6,0), (13,4,6,0);
create outline  ol_113 on delete from td3 where p1>3 or p3 >=6;
create outline  ol_114 on select *  from td3;
create outline  ol_115 on delete from td3 where p1=1 and p3 =2;
create outline  ol_116 on select *   from td3;
create outline  ol_117 on delete from td3 where p1=1 and p2 =1 and p3=1;
create outline  ol_118 on select *    from td3;
create outline  ol_119 on replace into td3   values(1,1,1,0),(2,2,2,0),(3,3,3,0),(4,4,4,0),(5,4,4,0),(6,4,4,0),(7,4,6,0),(8,4,6,0),(9,4,6,0),(10,4,6,0),(11,4,6,0),(12,4,6,0), (13,4,6,0);
create outline  ol_120 on delete from td3 where p1 in (1,2,3,6,7,8,12,13,0);
create outline  ol_121 on select *     from td3;
create outline  ol_122 on replace   into td3   values(1,1,1,0),(2,2,2,0),(3,3,3,0),(4,4,4,0),(5,4,4,0),(6,4,4,0),(7,4,6,0),(8,4,6,0),(9,4,6,0),(10,4,6,0),(11,4,6,0),(12,4,6,0), (13,4,6,0);
create outline  ol_123 on delete from td3   where p1 in (1,2,3,6,7,8,12,13,0);
create outline  ol_124 on select *      from td3;
create outline  ol_125 on replace into td4(a,b,c,d) values(1,'1','2014-02-17',NULL),(2,'2','2014-02-17',NULL),(3,'3','2014-02-17',NULL);
create outline  ol_126 on delete from td4 where (a,b,c) in ((1,'1','2014-02-17'));
create outline  ol_127 on delete from td4 where (a,b,c) in ((2,'2','2014-02-17'),(3,'3','2014-02-17'));
create outline  ol_128 on select * from td4;
create outline  ol_129 on replace into  td4(a,b,c,d) values(1,'1','2014-02-17',NULL),(2,'2','2014-02-17',NULL),(3,'3','2014-02-17',NULL);
create outline  ol_130 on delete from td4 where (a,b,c) in ((1,'1','2014-02-17'),(2,'2','2014-02-17'),(3,'3','2014-02-17'));
create outline  ol_131 on select *  from td4;
create outline  ol_132 on replace into   td4(a,b,c,d) values(1,'1','2014-02-17',NULL),(2,'2','2014-02-17',NULL),(3,'3','2014-02-17',NULL);
create outline  ol_133 on delete from td4 where (a,b,c) in ((NULL,NULL,NULL),(1,'1','2014-02-17'),(2,'2','2014-02-17'),(4,'4','2014-02-17'));
create outline  ol_134 on select *   from td4;
create outline  ol_135 on replace into    td4(a,b,c,d) values(1,'1','2014-02-17',NULL),(2,'2','2014-02-17',2),(3,'3','2014-02-17',2);
create outline  ol_136 on delete from td4 where (a,b,c,d) in ((1,'1','2014-02-17',NULL),(2,'2','2014-02-17',2),(3,'3','2014-02-17',2));
create outline  ol_137 on select *    from td4;
create outline  ol_138 on replace into     td4(a,b,c,d) values(1,'1','2014-02-17',1),(2,'2','2014-02-17',1),(3,'3','2014-02-17',1);
create outline  ol_139 on delete from td4 where (a,b,c) in ((1,'1','2014-02-17'),(2,'2','2014-02-17'),(3,'3','2014-02-17')) and d in (2,2);
create outline  ol_140 on select *     from td4;
create outline  ol_141 on delete from  td4 where (a,b,c) in ((1,'1','2014-02-17'),(2,'2','2014-02-17'),(3,'3','2014-02-17')) and d in (1,2);
create outline  ol_142 on select *      from td4;
create outline  ol_143 on replace into      td4(a,b,c,d) values(1,'1','2014-02-17',1),(2,'2','2014-02-17',1),(3,'3','2014-02-17',1);
create outline  ol_144 on delete from td4 where (a,b,c) in ((1,'1','2014-02-17')) or (a,b,c) in ((2,'2','2014-02-17'),(3,'3','2014-02-17')) and d in (1);
create outline  ol_145 on select *        from td4;
create outline  ol_146 on replace into       td4(a,b,c,d) values(1,'1','2014-02-17',1),(2,'2','2014-02-17',1),(3,'3','2014-02-17',1);
create outline  ol_147 on delete from td4 where (a,b,c) in ((1,'1','2014-02-17'),(2,'2','2014-02-17')) and (a,b,c) in ((2,'2','2014-02-17'),(3,'3','2014-02-17')) and d>0;
create outline  ol_148 on select * from  td4;
create outline  ol_149 on replace  into td4(a,b,c,d) values(1,'1','2014-02-17',1),(2,'2','2014-02-17',1),(3,'3','2014-02-17',1);
create outline  ol_150 on delete from td4 where (a) in ((1),(2));
create outline  ol_151 on select * from   td4;
create outline  ol_152 on delete from td4 where (a,b) in ((3,'3'),(2,'2'));
create outline  ol_153 on select * from    td4;
create outline  ol_154 on replace   into td4(a,b,c,d) values(1,'1','2014-02-17',1),(2,'2','2014-02-17',1),(3,'3','2014-02-17',1);
create outline  ol_155 on delete from td4 where (b,c,a) in (('1','2014-02-17',1),('2','2014-02-17',2));
create outline  ol_156 on select * from     td4;
create outline  ol_157 on replace    into td4(a,b,c,d) values(1,'1','2014-02-17',1),(2,'2','2014-02-17',1),(3,'3','2014-02-17',1);
create outline  ol_158 on delete from td4 where (a,b,c) in ((1,'1','2014-02-17'),(2,'2','2014-02-17')) or (b,c) in (('2','2014-02-17'),('3','2014-02-17'));
create outline  ol_159 on select * from       td4;
create outline  ol_160 on replace     into td4(a,b,c,d) values(1,'1','2014-02-17',1),(2,'2','2014-02-17',1),(3,'3','2014-02-17',1);
create outline  ol_161 on delete from td4 where c='2014-01-17';
create outline  ol_162 on select *  from  td4;
create outline  ol_163 on replace      into td4(a,b,c,d) values(1,'1','2014-02-17',1),(2,'2','2014-02-17',1),(3,'3','2014-02-17',1);
create outline  ol_164 on delete from td4 where a=3;
create outline  ol_165 on select *  from   td4;
create outline  ol_166 on replace       into td4(a,b,c,d) values(1,'1','2014-02-17',1),(2,'2','2014-02-17',1),(3,'3','2014-02-17',1);
create outline  ol_167 on delete from td4 where a=1 and b = '1' and c = '2014-02-17' and d=1;
create outline  ol_168 on select *  from    td4;
create outline  ol_169 on delete from td4 where a in (select a from td4);
create outline  ol_170 on select *  from     td4;
create outline  ol_171 on delete from     t1;
create outline  ol_172 on delete from     t2;
create outline  ol_173 on delete from     t3;
create outline  ol_174 on insert into t1 value(1, 2, 4), (2,2,3), (3,2,2), (4,2,1);
create outline  ol_175 on insert into t1 value(11, 3, 4), (12,3,3), (13,3,2), (14,3,1), (15,4,1);
create outline  ol_176 on insert into t2 value(21, 4, 4), (22,4,3), (23,4,2), (24,4,1);
create outline  ol_177 on insert into t3 value(21, 4, 4), (22,4,3), (23,4,2), (24,4,1);
create outline  ol_178 on SELECT 12 + 45;
create outline  ol_179 on SELECT 12 + 45 FROM DUAL;
create outline  ol_180 on SELECT 12 + 45 FROM DUAL WHERE 10 > 5;
create outline  ol_181 on SELECT 12 + 45 FROM DUAL WHERE 10 > 5 LIMIT 10;
create outline  ol_182 on SELECT 12 + 45 FROM DUAL LIMIT 0;
create outline  ol_183 on SELECT 12 + 45 LIMIT 10;
create outline  ol_184 on select * from t1 group by c2 order by c2 limit 1, 2;
create outline  ol_185 on select c1, c2 as c1 from t1 group by t1.c1;
create outline  ol_186 on select c1 as c1, c2 as c1 from t1 group by t1.c1;
create outline  ol_187 on select c1, c1 from t1 group by c1;
create outline  ol_188 on select 1 as c1, 2 as c2 from t1 group by c1 limit 2;
Warnings:
Warning	1052	Column 'c1' in group statement is ambiguous
create outline  ol_189 on select c1 as c2, c2 as c1 from t1 group by c1;
Warnings:
Warning	1052	Column 'c1' in group statement is ambiguous
create outline  ol_190 on select c1, c2 as c1 from t1 having t1.c1 > 2;
create outline  ol_191 on select c1, c2 + 1 as c1 from t1 having t1.c1 > 2;
create outline  ol_192 on select * from t1 left join t2 on t1.c1=t2.c1 order by t1.c1,t1.c2,t2.c1,t2.c2;
create outline  ol_193 on select * from t1 left join t2 on t1.c1=t2.c1 having not (t2.c1 <=> t1.c1) order by t1.c1,t1.c2,t2.c1,t2.c2;
create outline  ol_194 on select c1+1 AS c1 FROM t1 GROUP BY c1;
Warnings:
Warning	1052	Column 'c1' in group statement is ambiguous
create outline  ol_195 on select c2 as c1 from t1 group by c1;
Warnings:
Warning	1052	Column 'c1' in group statement is ambiguous
create outline  ol_196 on select c1+1 as c1 from t1 group by c1+1;
Warnings:
Warning	1052	Column 'c1' in group statement is ambiguous
create outline  ol_197 on select 'a' = 'a ', 'a' like 'a ';
create outline  ol_198 on select 'david_' like 'david\_';
create outline  ol_199 on select 'david_' like 'david|_' escape '|';
create outline  ol_200 on select 'abc' like 'abc';
create outline  ol_201 on select 'abc' like binary 'abc';
create outline  ol_202 on select 10 like '1%';
create outline  ol_203 on select 'david_' like 'david|_' escape null;
create outline  ol_204 on select * from t1 use key(idx);
create outline  ol_205 on select * from t1 force index(idx);
create outline  ol_206 on select * from t1 ignore key(idx);
create outline  ol_207 on select * from t1 use key(a);
create outline  ol_208 on select * from t1 force index(a);
create outline  ol_209 on select * from t1 ignore key(a);
create outline  ol_210 on select * from t1;
create outline  ol_211 on select * from (t1);
create outline  ol_212 on select * from (t1,t2);
create outline  ol_213 on select * from (t1,(t2));
create outline  ol_214 on select * from (t3,((t1,t2)));
create outline  ol_215 on select * from t1 join t2 join t3;
create outline  ol_216 on select * from (t1 join t2) join t3;
create outline  ol_217 on select * from (t1 join t2) join (select * from t3) a;
create outline  ol_218 on select * from ((t1 join t2) join (select * from t3) a);
create outline  ol_219 on select * from t1 join t2 on (t1.c1=t2.c1) join t3 on (t1.c1=t2.c1);
create outline  ol_220 on select * from t1 join t2 using (c1) join t3 using (c1);
create outline  ol_221 on select * from t1 join t2 on (t1.c1=t2.c1);
create outline  ol_222 on (select count(*) from t1) UNION (select count(*) from t1);
create outline  ol_223 on (select c1,c2 from t1 limit 2)  union all (select c1,c2 from t2 order by c1 limit 1) order by c1;
create outline  ol_224 on (select * from t1 order by c1 limit 1) union (select * from t2 order by c1 limit 3) limit 2;
create outline  ol_225 on (select * from t1 order by c1 limit 1) union (select * from t2 order by c1 limit 3);
create outline  ol_226 on (select * from t1 order by c1 limit 1) union all (select * from t2 order by c1 limit 3);
create outline  ol_227 on (select * from t1 order by c1 limit 1) union distinct (select * from t2 order by c1 limit 3);
create outline  ol_228 on select * from t1,t2,t3 where t1.c1=t2.c1 AND t2.c2=t3.c1 and t1.c2=t3.c2 order by t1.c1;
create outline  ol_229 on select a.c1 from (select c1 from t1) as a having a.c1 = 1;
create outline  ol_230 on select * from t1 where 'a' not like 'b' and ((c1 < 2 and false) or (c1 < 2 and c1 is not null)) ;
create outline  ol_231 on select * from t1 where 'a' not like 'b' and ((false) or (c1 < 2 and c1 is not null));
create outline  ol_232 on select * from t1 group by 1>(select count(*) from t2);
create outline  ol_233 on select * from t1 order by 1>(select count(*) from t2);
create outline  ol_234 on select (1>(select count(*) from t2)) from t1;
create outline  ol_235 on select * from t1 where 1>(select count(*) from t2);
create outline  ol_236 on select (1>(select count(*) from t2)) from t1 union select c1 from t2;
create outline  ol_237 on select * from t1 group by 1>(select count(*) from t2) union select * from t2;
create outline  ol_238 on select * from t1 order by 1>(select count(*) from t2) intersect select * from t2;
create outline  ol_239 on select * from t1 where 1>(select count(*) from t2) union select * from t2;
create outline  ol_240 on select min(2) from t1;
create outline  ol_241 on select max(2) from t1;
create outline  ol_242 on select sum(2) from t1;
create outline  ol_243 on select avg(2) from t1;
create outline  ol_244 on select max(t3.c1) from t1 as t3, t1 t4 where t3.c1 = t4.c1;
create outline  ol_245 on SELECT length('asdfg');
create outline  ol_246 on select found_rows();
create outline  ol_247 on select * from  t1  for update wait 1;
create outline  ol_248 on select * from  t1  a  for update wait 1;
create outline  ol_249 on select * from  t1  where c1 <100 for update wait 1;
create outline  ol_250 on select * from  t1  where c1 <100  and c2 < 100 for update wait 1;
create outline  ol_251 on select * from  t1  where c1 in (1,2,3,4,5,6) for update wait 1;
create outline  ol_252 on select * from  t1  where (c1,c2) in ((1,2), (2,3),(3,4)) for update wait 1;
create outline  ol_253 on select * from t1 t where t.c2 = 1 and t.c1 = 2 for update nowait;
create outline  ol_254 on select abs(c1) , sum(c2) from t1 group by abs(c2) having sum(sign(c1)) > 0 for update;
count(*)
255
delete            from t1;
delete            from t2;
delete            from t3;
delete            from ts1;
delete            from ts2;
delete            from tu1;
delete            from tu2;
delete            from td1;
delete            from tdd1;
delete            from td2;
delete            from td3;
delete            from td4;
insert into ts1 values(4,2),(5,2),(6,3);
select * from ts1;
c1	c2
4	2
5	2
6	3
insert into ts2 values(24,2),(25,2),(26,3);
select * from ts2;
c1	c2
24	2
25	2
26	3
delete       from ts2;
insert into ts1 select * from ts2;
select *   from ts1;
c1	c2
4	2
5	2
6	3
delete from ts1;
insert into ts1 select c1,c2 from ts1 union select c1,c2 from ts2;
select *    from ts1;
c1	c2
insert into ts1 values (212,  null);
select  * from ts1;
c1	c2
212	NULL
insert into ts1 values(213, null+null);
select   * from ts1;
c1	c2
212	NULL
213	NULL
insert into   ts1 values(241, 1+null);
select    * from ts1;
c1	c2
212	NULL
213	NULL
241	NULL
insert into    ts1 values(31, null+2);
select     * from ts1;
c1	c2
31	NULL
212	NULL
213	NULL
241	NULL
insert into tu1 values (4,3,'yyy'), (5,2,'hhhh'), (6,1,'lalala');
insert into tu2 values (4,3,'yyy'), (5,2,'hhhh'), (6,1,'lalala');
update tu1 set c2 = 2 where c1 = 2;
select * from tu1;
c1	c2	c3
4	3	yyy
5	2	hhhh
6	1	lalala
update tu1 t set t.c2 = 2 where c1 = 1;
select *  from tu1;
c1	c2	c3
4	3	yyy
5	2	hhhh
6	1	lalala
update tu1 set c2 = c2 + 101, c3 = 'test' where c1 = 1;
select *   from tu1;
c1	c2	c3
4	3	yyy
5	2	hhhh
6	1	lalala
update tu1 set c2 = c3 like '%h%' where c1 = 2;
select *    from tu1;
c1	c2	c3
4	3	yyy
5	2	hhhh
6	1	lalala
update tu1 set c2 = 11 where c2 = 1 and c3 = 'yyy';
select *     from tu1;
c1	c2	c3
4	3	yyy
5	2	hhhh
6	1	lalala
update tu1 set c2=c2+2 order by c1;
select  * from tu1;
c1	c2	c3
4	5	yyy
5	4	hhhh
6	3	lalala
update tu1 set c2=999 where c1=2 order by c2 asc limit 1;
select   * from t1 order by c1,c2;
c1	c2	c3
update tu1 set c2=101 where c1=3 order by c2 desc limit 2;
select    * from tu1;
c1	c2	c3
4	5	yyy
5	4	hhhh
6	3	lalala
update tu1 set c1=c1+11+c2 where c1=1 order by c2;
select     * from tu1;
c1	c2	c3
4	5	yyy
5	4	hhhh
6	3	lalala
update tu1 set c2 = (select distinct 2 from (select * from tu2) a);
select      * from tu1;
c1	c2	c3
4	2	yyy
5	2	hhhh
6	2	lalala
delete from td1 where c1 in (select max(c1) from t1 t2);
delete from td1 where c1 in (select min(c2) from (select max(c1) as c2 from td1 ) t2);
replace into td1 values (2,2),(3,4);
update td1 set c1 = 6 where c1 in (select max(c1) from td1);
replace into td1 values(1,1),(2,3),(3,3),(4,3);
delete from td1 where td1.c1 <> (select c2 from tdd1 where td1.c1 < tdd1.c1 limit 2);
DELETE FROM td1 WHERE td1.c1 > 11 ORDER BY td1.c1;
DELETE FROM td1 WHERE td1.c1 > 10 ORDER BY td1.c1 LIMIT 1;
DELETE FROM td1 ORDER BY c1 ASC, c2 ASC LIMIT 2;
DELETE FROM td1 WHERE c1 = 10 OR c2 = 21 ORDER BY c1 LIMIT 1;
insert into td2 values(4,0),(5,0),(6,1);
delete from td2;
select * from td2;
c1	c2
replace into td2  values(1,0),(2,0),(4,0);
delete from td2  where c1>2;
select * from  td2;
c1	c2
1	0
2	0
replace   into td2 values(12,0),(2,0),(3,0);
delete  from td2 where c1=2;
select *   from td2;
c1	c2
1	0
3	0
12	0
replace    into td2 values(12,0),(2,0),(3,0);
delete   from td2 where c1=2 or c1=2 or c1=3;
select *    from td2;
c1	c2
1	0
12	0
replace     into td2 values(12,1),(2,2),(3,3);
delete from td2 where c1<=12;
select *     from td2;
c1	c2
delete from td2 where 2>=c1;
select *       from td2;
c1	c2
replace      into td2 values(21,1),(2,2),(3,3);
delete from td2 where c1=1 or c1=3;
select *        from td2;
c1	c2
2	2
21	1
delete from td2 where c1=1 and c1=3;
select *         from td2;
c1	c2
2	2
21	1
replace into td2(c1,c2) values(11,1),(2,1),(3,1),(4,1);
delete from td2 where c1>=2 and c1<4;
select * from   td2;
c1	c2
4	1
11	1
21	1
replace  into td2(c1,c2) values(11,1),(2,2),(3,1),(4,2);
delete from td2 where c1>0 and c2>11;
delete from td2 where c1<5 and c2<21;
select * from    td2;
c1	c2
11	1
21	1
replace   into td2(c1,c2) values(1,11),(2,2),(3,1),(4,2);
delete from td2 where c1=0 or c1=11 or c1=2 or c2=1;
select *  from    td2;
c1	c2
1	11
4	2
replace into td2(c1,c2) values(11,NULL),(1,1),(2,1),(3,1),(4,1);
delete from td2 where c1 in (11,2,3,4);
select c1,c2 from td2;
c1	c2
1	1
replace  into td2(c1,c2) values(12,NULL),(1,1),(2,1),(3,1),(4,1);
delete from td2 where c1 in (NULL,2) or c1 in (2,3,4);
select c1,c2  from td2;
c1	c2
1	1
12	NULL
replace   into td2(c1,c2) values(122,NULL),(1,1),(2,1),(3,1),(4,1);
delete from td2 where c1 in (2) or c1 in (2) or c1 in (3,4);
select c1,c2   from td2;
c1	c2
1	1
12	NULL
122	NULL
replace    into td2(c1,c2) values(133,NULL),(1,1),(2,1),(3,1),(4,1);
delete from td2 where c1 in (NULL,1,2) and c1 in (1,2,3,4);
select c1,c2    from td2;
c1	c2
3	1
4	1
12	NULL
122	NULL
133	NULL
replace     into td2(c1,c2) values(15,NULL),(1,1),(2,1),(3,1),(4,1);
delete from td2 where c1 in (1,2,3,41) and c2 in (1,2,3,4);
select c1,c2     from td2;
c1	c2
4	1
12	NULL
15	NULL
122	NULL
133	NULL
replace into td3 values(1,1,1,0),(21,2,2,0),(3,3,3,0),(4,4,4,0),(5,4,4,0),(6,4,4,0),(7,4,6,0),(8,4,6,0),(9,4,6,0),(10,4,6,0),(11,4,6,0),(12,4,6,0), (13,4,6,0);
delete from td3 where p1 = 1;
select * from td3;
p1	p2	p3	p4
3	3	3	0
4	4	4	0
5	4	4	0
6	4	4	0
7	4	6	0
8	4	6	0
9	4	6	0
10	4	6	0
11	4	6	0
12	4	6	0
13	4	6	0
21	2	2	0
replace into   td3 values(1,1,1,0),(2,2,2,0),(3,3,3,0),(4,4,4,0),(5,4,4,0),(6,4,4,0),(7,4,6,0),(8,4,6,0),(9,4,6,0),(10,4,6,0),(11,4,6,0),(12,4,6,0), (13,4,6,0);
delete from td3 where p1>3 or p3 >=61;
select *  from td3;
p1	p2	p3	p4
1	1	1	0
2	2	2	0
3	3	3	0
delete from td3 where p1=1 and p3 =3;
select *   from td3;
p1	p2	p3	p4
1	1	1	0
2	2	2	0
3	3	3	0
delete from td3 where p1=1 and p2 =2 and p3=1;
select *    from td3;
p1	p2	p3	p4
1	1	1	0
2	2	2	0
3	3	3	0
replace into td3   values(1,1,1,0),(21,2,2,0),(3,3,3,0),(4,4,4,0),(5,4,4,0),(6,4,4,0),(7,4,6,0),(8,4,6,0),(9,4,6,0),(10,4,6,0),(11,4,6,0),(12,4,6,0), (13,4,6,0);
delete from td3 where p1 in (11,2,3,6,7,8,12,13,0);
select *     from td3;
p1	p2	p3	p4
1	1	1	0
4	4	4	0
5	4	4	0
9	4	6	0
10	4	6	0
21	2	2	0
replace   into td3   values(11,1,1,0),(2,2,2,0),(3,3,3,0),(4,4,4,0),(5,4,4,0),(6,4,4,0),(7,4,6,0),(8,4,6,0),(9,4,6,0),(10,4,6,0),(11,4,6,0),(12,4,6,0), (13,4,6,0);
delete from td3   where p1 in (13,2,3,6,7,8,12,13,0);
select *      from td3;
p1	p2	p3	p4
1	1	1	0
4	4	4	0
5	4	4	0
9	4	6	0
10	4	6	0
11	1	1	0
11	4	6	0
21	2	2	0
replace into td4(a,b,c,d) values(11,'1','2014-02-17',NULL),(2,'2','2014-02-17',NULL),(3,'3','2014-02-17',NULL);
delete from td4 where (a,b,c) in ((11,'1','2014-02-17'));
delete from td4 where (a,b,c) in ((21,'2','2014-02-17'),(3,'3','2014-02-17'));
select * from td4;
a	b	c	d
2	2	2014-02-17 00:00:00.000000	NULL
replace into  td4(a,b,c,d) values(11,'1','2014-02-17',NULL),(2,'2','2014-02-17',NULL),(3,'3','2014-02-17',NULL);
delete from td4 where (a,b,c) in ((11,'1','2014-02-17'),(2,'2','2014-02-17'),(3,'3','2014-02-17'));
select *  from td4;
a	b	c	d
replace into   td4(a,b,c,d) values(11,'1','2014-02-17',NULL),(2,'2','2014-02-17',NULL),(3,'3','2014-02-17',NULL);
delete from td4 where (a,b,c) in ((NULL,NULL,NULL),(11,'1','2014-02-17'),(2,'2','2014-02-17'),(4,'4','2014-02-17'));
select *   from td4;
a	b	c	d
3	3	2014-02-17 00:00:00.000000	NULL
replace into    td4(a,b,c,d) values(11,'1','2014-02-17',NULL),(2,'2','2014-02-17',2),(3,'3','2014-02-17',2);
delete from td4 where (a,b,c,d) in ((11,'1','2014-02-17',NULL),(2,'2','2014-02-17',2),(3,'3','2014-02-17',2));
select *    from td4;
a	b	c	d
11	1	2014-02-17 00:00:00.000000	NULL
replace into     td4(a,b,c,d) values(11,'1','2014-02-17',1),(2,'2','2014-02-17',1),(3,'3','2014-02-17',1);
delete from td4 where (a,b,c) in ((11,'1','2014-02-17'),(2,'2','2014-02-17'),(3,'3','2014-02-17')) and d in (2,2);
select *     from td4;
a	b	c	d
2	2	2014-02-17 00:00:00.000000	1
3	3	2014-02-17 00:00:00.000000	1
11	1	2014-02-17 00:00:00.000000	1
delete from  td4 where (a,b,c) in ((11,'1','2014-02-17'),(2,'2','2014-02-17'),(3,'3','2014-02-17')) and d in (1,2);
select *      from td4;
a	b	c	d
replace into      td4(a,b,c,d) values(11,'1','2014-02-17',1),(2,'2','2014-02-17',1),(3,'3','2014-02-17',1);
delete from td4 where (a,b,c) in ((11,'1','2014-02-17')) or (a,b,c) in ((2,'2','2014-02-17'),(3,'3','2014-02-17')) and d in (1);
select *        from td4;
a	b	c	d
replace into       td4(a,b,c,d) values(11,'1','2014-02-17',1),(2,'2','2014-02-17',1),(3,'3','2014-02-17',1);
delete from td4 where (a,b,c) in ((11,'1','2014-02-17'),(2,'2','2014-02-17')) and (a,b,c) in ((2,'2','2014-02-17'),(3,'3','2014-02-17')) and d>0;
select * from  td4;
a	b	c	d
3	3	2014-02-17 00:00:00.000000	1
11	1	2014-02-17 00:00:00.000000	1
replace  into td4(a,b,c,d) values(11,'1','2014-02-17',1),(2,'2','2014-02-17',1),(3,'3','2014-02-17',1);
delete from td4 where (a) in ((11),(2));
select * from   td4;
a	b	c	d
3	3	2014-02-17 00:00:00.000000	1
delete from td4 where (a,b) in ((31,'3'),(2,'2'));
select * from    td4;
a	b	c	d
3	3	2014-02-17 00:00:00.000000	1
replace   into td4(a,b,c,d) values(11,'1','2014-02-17',1),(2,'2','2014-02-17',1),(3,'3','2014-02-17',1);
delete from td4 where (b,c,a) in (('11','2014-02-17',1),('2','2014-02-17',2));
select * from     td4;
a	b	c	d
3	3	2014-02-17 00:00:00.000000	1
11	1	2014-02-17 00:00:00.000000	1
replace    into td4(a,b,c,d) values(11,'1','2014-02-17',1),(2,'2','2014-02-17',1),(3,'3','2014-02-17',1);
delete from td4 where (a,b,c) in ((11,'1','2014-02-17'),(2,'2','2014-02-17')) or (b,c) in (('2','2014-02-17'),('3','2014-02-17'));
select * from       td4;
a	b	c	d
replace     into td4(a,b,c,d) values(11,'1','2014-02-17',1),(2,'2','2014-02-17',1),(3,'3','2014-02-17',1);
delete from td4 where c='2014-02-17';
select *  from  td4;
a	b	c	d
replace      into td4(a,b,c,d) values(11,'1','2014-02-17',1),(2,'2','2014-02-17',1),(3,'3','2014-02-17',1);
delete from td4 where a=31;
select *  from   td4;
a	b	c	d
2	2	2014-02-17 00:00:00.000000	1
3	3	2014-02-17 00:00:00.000000	1
11	1	2014-02-17 00:00:00.000000	1
replace       into td4(a,b,c,d) values(11,'1','2014-02-17',1),(2,'2','2014-02-17',1),(3,'3','2014-02-17',1);
delete from td4 where a=1 and b = '2' and c = '2014-02-17' and d=1;
select *  from    td4;
a	b	c	d
2	2	2014-02-17 00:00:00.000000	1
3	3	2014-02-17 00:00:00.000000	1
11	1	2014-02-17 00:00:00.000000	1
delete from td4 where a in (select a from td4);
select *  from     td4;
a	b	c	d
delete from     t1;
delete from     t2;
delete from     t3;
insert into t1 value(44, 2, 4), (5,2,3), (6,2,2), (7,2,1);
insert into t1 value(111, 3, 4), (112,3,3), (113,3,2), (114,3,1), (115,4,1);
insert into t2 value(121, 4, 4), (122,4,3), (123,4,2), (124,4,1);
insert into t3 value(121, 4, 4), (122,4,3), (123,4,2), (124,4,1);
SELECT 12 + 46;
12 + 46
58
SELECT 12 + 46 FROM DUAL;
12 + 46
58
SELECT 12 + 45 FROM DUAL WHERE 10 > 6;
12 + 45
57
SELECT 12 + 45 FROM DUAL WHERE 10 > 6 LIMIT 10;
12 + 45
57
SELECT 12 + 45 FROM DUAL LIMIT 1;
12 + 45
57
SELECT 12 + 45 LIMIT 11;
12 + 45
57
select * from t1 group by c2 order by c2 limit 2, 2;
c1	c2	c3
115	4	1
select c1, c2 as c1 from t1 group by t1.c1;
c1	c1
111	3
112	3
113	3
114	3
115	4
44	2
5	2
6	2
7	2
select c1 as c1, c2 as c1 from t1 group by t1.c1;
c1	c1
111	3
112	3
113	3
114	3
115	4
44	2
5	2
6	2
7	2
select c1, c1 from t1 group by c1;
c1	c1
111	111
112	112
113	113
114	114
115	115
44	44
5	5
6	6
7	7
select 1 as c1, 2 as c2 from t1 group by c1 limit 1;
c1	c2
1	2
select c1 as c2, c2 as c1 from t1 group by c1;
c2	c1
111	3
112	3
113	3
114	3
115	4
44	2
5	2
6	2
7	2
select c1, c2 as c1 from t1 having t1.c1 > 3;
c1	c1
5	2
6	2
7	2
44	2
111	3
112	3
113	3
114	3
115	4
select c1, c2 + 1 as c1 from t1 having t1.c1 > 4;
c1	c1
5	3
6	3
7	3
44	3
111	4
112	4
113	4
114	4
115	5
select * from t1 left join t2 on t1.c1=t2.c1;
c1	c2	c3	c1	c2	c3
5	2	3	NULL	NULL	NULL
6	2	2	NULL	NULL	NULL
7	2	1	NULL	NULL	NULL
44	2	4	NULL	NULL	NULL
111	3	4	NULL	NULL	NULL
112	3	3	NULL	NULL	NULL
113	3	2	NULL	NULL	NULL
114	3	1	NULL	NULL	NULL
115	4	1	NULL	NULL	NULL
select * from t1 left join t2 on t1.c1=t2.c1 having not (t2.c1 <=> t1.c1);
c1	c2	c3	c1	c2	c3
5	2	3	NULL	NULL	NULL
6	2	2	NULL	NULL	NULL
7	2	1	NULL	NULL	NULL
44	2	4	NULL	NULL	NULL
111	3	4	NULL	NULL	NULL
112	3	3	NULL	NULL	NULL
113	3	2	NULL	NULL	NULL
114	3	1	NULL	NULL	NULL
115	4	1	NULL	NULL	NULL
select c1+1 AS c1 FROM t1 GROUP BY c1;
c1
112
113
114
115
116
45
6
7
8
select c2 as c1 from t1 group by c1;
c1
2
2
2
2
3
3
3
3
4
select c1+1 as c1 from t1 group by c1+1;
c1
112
113
114
115
116
45
6
7
8
select 'b' = 'b ', 'a' like 'a ';
'b' = 'b '	'a' like 'a '
1	0
select 'davidy' like 'david\_';
'davidy' like 'david\_'
0
select 'davidy' like 'david|_' escape '|';
'davidy' like 'david|_' escape '|'
0
select 'abcd' like 'abcd';
'abcd' like 'abcd'
1
select 'abcd' like binary 'abcd';
'abcd' like binary 'abcd'
1
select 11 like '1%';
11 like '1%'
1
select 'aavid_' like 'aavid|_' escape null;
'aavid_' like 'aavid|_' escape null
0
select * from t1 use key(idx);
c1	c2	c3
5	2	3
6	2	2
7	2	1
44	2	4
111	3	4
112	3	3
113	3	2
114	3	1
115	4	1
select * from t1 force index(idx);
c1	c2	c3
5	2	3
6	2	2
7	2	1
44	2	4
111	3	4
112	3	3
113	3	2
114	3	1
115	4	1
select * from t1 ignore key(idx);
c1	c2	c3
7	2	1
114	3	1
115	4	1
6	2	2
113	3	2
5	2	3
112	3	3
44	2	4
111	3	4
select * from t1 use key(a);
c1	c2	c3
5	2	3
6	2	2
7	2	1
44	2	4
111	3	4
112	3	3
113	3	2
114	3	1
115	4	1
select * from t1 force index(a);
c1	c2	c3
5	2	3
6	2	2
7	2	1
44	2	4
111	3	4
112	3	3
113	3	2
114	3	1
115	4	1
select * from t1 ignore key(a);
c1	c2	c3
7	2	1
114	3	1
115	4	1
6	2	2
113	3	2
5	2	3
112	3	3
44	2	4
111	3	4
select * from t1;
c1	c2	c3
5	2	3
6	2	2
7	2	1
44	2	4
111	3	4
112	3	3
113	3	2
114	3	1
115	4	1
select * from (t1);
c1	c2	c3
5	2	3
6	2	2
7	2	1
44	2	4
111	3	4
112	3	3
113	3	2
114	3	1
115	4	1
select * from (t1,t2);
c1	c2	c3	c1	c2	c3
5	2	3	121	4	4
5	2	3	122	4	3
5	2	3	123	4	2
5	2	3	124	4	1
6	2	2	121	4	4
6	2	2	122	4	3
6	2	2	123	4	2
6	2	2	124	4	1
7	2	1	121	4	4
7	2	1	122	4	3
7	2	1	123	4	2
7	2	1	124	4	1
44	2	4	121	4	4
44	2	4	122	4	3
44	2	4	123	4	2
44	2	4	124	4	1
111	3	4	121	4	4
111	3	4	122	4	3
111	3	4	123	4	2
111	3	4	124	4	1
112	3	3	121	4	4
112	3	3	122	4	3
112	3	3	123	4	2
112	3	3	124	4	1
113	3	2	121	4	4
113	3	2	122	4	3
113	3	2	123	4	2
113	3	2	124	4	1
114	3	1	121	4	4
114	3	1	122	4	3
114	3	1	123	4	2
114	3	1	124	4	1
115	4	1	121	4	4
115	4	1	122	4	3
115	4	1	123	4	2
115	4	1	124	4	1
select * from (t1,(t2));
c1	c2	c3	c1	c2	c3
5	2	3	121	4	4
5	2	3	122	4	3
5	2	3	123	4	2
5	2	3	124	4	1
6	2	2	121	4	4
6	2	2	122	4	3
6	2	2	123	4	2
6	2	2	124	4	1
7	2	1	121	4	4
7	2	1	122	4	3
7	2	1	123	4	2
7	2	1	124	4	1
44	2	4	121	4	4
44	2	4	122	4	3
44	2	4	123	4	2
44	2	4	124	4	1
111	3	4	121	4	4
111	3	4	122	4	3
111	3	4	123	4	2
111	3	4	124	4	1
112	3	3	121	4	4
112	3	3	122	4	3
112	3	3	123	4	2
112	3	3	124	4	1
113	3	2	121	4	4
113	3	2	122	4	3
113	3	2	123	4	2
113	3	2	124	4	1
114	3	1	121	4	4
114	3	1	122	4	3
114	3	1	123	4	2
114	3	1	124	4	1
115	4	1	121	4	4
115	4	1	122	4	3
115	4	1	123	4	2
115	4	1	124	4	1
select * from (t3,((t1,t2)));
c1	c2	c3	c1	c2	c3	c1	c2	c3
121	4	4	5	2	3	121	4	4
121	4	4	6	2	2	121	4	4
121	4	4	7	2	1	121	4	4
121	4	4	44	2	4	121	4	4
121	4	4	111	3	4	121	4	4
121	4	4	112	3	3	121	4	4
121	4	4	113	3	2	121	4	4
121	4	4	114	3	1	121	4	4
121	4	4	115	4	1	121	4	4
121	4	4	5	2	3	122	4	3
121	4	4	6	2	2	122	4	3
121	4	4	7	2	1	122	4	3
121	4	4	44	2	4	122	4	3
121	4	4	111	3	4	122	4	3
121	4	4	112	3	3	122	4	3
121	4	4	113	3	2	122	4	3
121	4	4	114	3	1	122	4	3
121	4	4	115	4	1	122	4	3
121	4	4	5	2	3	123	4	2
121	4	4	6	2	2	123	4	2
121	4	4	7	2	1	123	4	2
121	4	4	44	2	4	123	4	2
121	4	4	111	3	4	123	4	2
121	4	4	112	3	3	123	4	2
121	4	4	113	3	2	123	4	2
121	4	4	114	3	1	123	4	2
121	4	4	115	4	1	123	4	2
121	4	4	5	2	3	124	4	1
121	4	4	6	2	2	124	4	1
121	4	4	7	2	1	124	4	1
121	4	4	44	2	4	124	4	1
121	4	4	111	3	4	124	4	1
121	4	4	112	3	3	124	4	1
121	4	4	113	3	2	124	4	1
121	4	4	114	3	1	124	4	1
121	4	4	115	4	1	124	4	1
122	4	3	5	2	3	121	4	4
122	4	3	6	2	2	121	4	4
122	4	3	7	2	1	121	4	4
122	4	3	44	2	4	121	4	4
122	4	3	111	3	4	121	4	4
122	4	3	112	3	3	121	4	4
122	4	3	113	3	2	121	4	4
122	4	3	114	3	1	121	4	4
122	4	3	115	4	1	121	4	4
122	4	3	5	2	3	122	4	3
122	4	3	6	2	2	122	4	3
122	4	3	7	2	1	122	4	3
122	4	3	44	2	4	122	4	3
122	4	3	111	3	4	122	4	3
122	4	3	112	3	3	122	4	3
122	4	3	113	3	2	122	4	3
122	4	3	114	3	1	122	4	3
122	4	3	115	4	1	122	4	3
122	4	3	5	2	3	123	4	2
122	4	3	6	2	2	123	4	2
122	4	3	7	2	1	123	4	2
122	4	3	44	2	4	123	4	2
122	4	3	111	3	4	123	4	2
122	4	3	112	3	3	123	4	2
122	4	3	113	3	2	123	4	2
122	4	3	114	3	1	123	4	2
122	4	3	115	4	1	123	4	2
122	4	3	5	2	3	124	4	1
122	4	3	6	2	2	124	4	1
122	4	3	7	2	1	124	4	1
122	4	3	44	2	4	124	4	1
122	4	3	111	3	4	124	4	1
122	4	3	112	3	3	124	4	1
122	4	3	113	3	2	124	4	1
122	4	3	114	3	1	124	4	1
122	4	3	115	4	1	124	4	1
123	4	2	5	2	3	121	4	4
123	4	2	6	2	2	121	4	4
123	4	2	7	2	1	121	4	4
123	4	2	44	2	4	121	4	4
123	4	2	111	3	4	121	4	4
123	4	2	112	3	3	121	4	4
123	4	2	113	3	2	121	4	4
123	4	2	114	3	1	121	4	4
123	4	2	115	4	1	121	4	4
123	4	2	5	2	3	122	4	3
123	4	2	6	2	2	122	4	3
123	4	2	7	2	1	122	4	3
123	4	2	44	2	4	122	4	3
123	4	2	111	3	4	122	4	3
123	4	2	112	3	3	122	4	3
123	4	2	113	3	2	122	4	3
123	4	2	114	3	1	122	4	3
123	4	2	115	4	1	122	4	3
123	4	2	5	2	3	123	4	2
123	4	2	6	2	2	123	4	2
123	4	2	7	2	1	123	4	2
123	4	2	44	2	4	123	4	2
123	4	2	111	3	4	123	4	2
123	4	2	112	3	3	123	4	2
123	4	2	113	3	2	123	4	2
123	4	2	114	3	1	123	4	2
123	4	2	115	4	1	123	4	2
123	4	2	5	2	3	124	4	1
123	4	2	6	2	2	124	4	1
123	4	2	7	2	1	124	4	1
123	4	2	44	2	4	124	4	1
123	4	2	111	3	4	124	4	1
123	4	2	112	3	3	124	4	1
123	4	2	113	3	2	124	4	1
123	4	2	114	3	1	124	4	1
123	4	2	115	4	1	124	4	1
124	4	1	5	2	3	121	4	4
124	4	1	6	2	2	121	4	4
124	4	1	7	2	1	121	4	4
124	4	1	44	2	4	121	4	4
124	4	1	111	3	4	121	4	4
124	4	1	112	3	3	121	4	4
124	4	1	113	3	2	121	4	4
124	4	1	114	3	1	121	4	4
124	4	1	115	4	1	121	4	4
124	4	1	5	2	3	122	4	3
124	4	1	6	2	2	122	4	3
124	4	1	7	2	1	122	4	3
124	4	1	44	2	4	122	4	3
124	4	1	111	3	4	122	4	3
124	4	1	112	3	3	122	4	3
124	4	1	113	3	2	122	4	3
124	4	1	114	3	1	122	4	3
124	4	1	115	4	1	122	4	3
124	4	1	5	2	3	123	4	2
124	4	1	6	2	2	123	4	2
124	4	1	7	2	1	123	4	2
124	4	1	44	2	4	123	4	2
124	4	1	111	3	4	123	4	2
124	4	1	112	3	3	123	4	2
124	4	1	113	3	2	123	4	2
124	4	1	114	3	1	123	4	2
124	4	1	115	4	1	123	4	2
124	4	1	5	2	3	124	4	1
124	4	1	6	2	2	124	4	1
124	4	1	7	2	1	124	4	1
124	4	1	44	2	4	124	4	1
124	4	1	111	3	4	124	4	1
124	4	1	112	3	3	124	4	1
124	4	1	113	3	2	124	4	1
124	4	1	114	3	1	124	4	1
124	4	1	115	4	1	124	4	1
select * from t1 join t2 join t3;
c1	c2	c3	c1	c2	c3	c1	c2	c3
5	2	3	121	4	4	121	4	4
6	2	2	121	4	4	121	4	4
7	2	1	121	4	4	121	4	4
44	2	4	121	4	4	121	4	4
111	3	4	121	4	4	121	4	4
112	3	3	121	4	4	121	4	4
113	3	2	121	4	4	121	4	4
114	3	1	121	4	4	121	4	4
115	4	1	121	4	4	121	4	4
5	2	3	121	4	4	122	4	3
6	2	2	121	4	4	122	4	3
7	2	1	121	4	4	122	4	3
44	2	4	121	4	4	122	4	3
111	3	4	121	4	4	122	4	3
112	3	3	121	4	4	122	4	3
113	3	2	121	4	4	122	4	3
114	3	1	121	4	4	122	4	3
115	4	1	121	4	4	122	4	3
5	2	3	121	4	4	123	4	2
6	2	2	121	4	4	123	4	2
7	2	1	121	4	4	123	4	2
44	2	4	121	4	4	123	4	2
111	3	4	121	4	4	123	4	2
112	3	3	121	4	4	123	4	2
113	3	2	121	4	4	123	4	2
114	3	1	121	4	4	123	4	2
115	4	1	121	4	4	123	4	2
5	2	3	121	4	4	124	4	1
6	2	2	121	4	4	124	4	1
7	2	1	121	4	4	124	4	1
44	2	4	121	4	4	124	4	1
111	3	4	121	4	4	124	4	1
112	3	3	121	4	4	124	4	1
113	3	2	121	4	4	124	4	1
114	3	1	121	4	4	124	4	1
115	4	1	121	4	4	124	4	1
5	2	3	122	4	3	121	4	4
6	2	2	122	4	3	121	4	4
7	2	1	122	4	3	121	4	4
44	2	4	122	4	3	121	4	4
111	3	4	122	4	3	121	4	4
112	3	3	122	4	3	121	4	4
113	3	2	122	4	3	121	4	4
114	3	1	122	4	3	121	4	4
115	4	1	122	4	3	121	4	4
5	2	3	122	4	3	122	4	3
6	2	2	122	4	3	122	4	3
7	2	1	122	4	3	122	4	3
44	2	4	122	4	3	122	4	3
111	3	4	122	4	3	122	4	3
112	3	3	122	4	3	122	4	3
113	3	2	122	4	3	122	4	3
114	3	1	122	4	3	122	4	3
115	4	1	122	4	3	122	4	3
5	2	3	122	4	3	123	4	2
6	2	2	122	4	3	123	4	2
7	2	1	122	4	3	123	4	2
44	2	4	122	4	3	123	4	2
111	3	4	122	4	3	123	4	2
112	3	3	122	4	3	123	4	2
113	3	2	122	4	3	123	4	2
114	3	1	122	4	3	123	4	2
115	4	1	122	4	3	123	4	2
5	2	3	122	4	3	124	4	1
6	2	2	122	4	3	124	4	1
7	2	1	122	4	3	124	4	1
44	2	4	122	4	3	124	4	1
111	3	4	122	4	3	124	4	1
112	3	3	122	4	3	124	4	1
113	3	2	122	4	3	124	4	1
114	3	1	122	4	3	124	4	1
115	4	1	122	4	3	124	4	1
5	2	3	123	4	2	121	4	4
6	2	2	123	4	2	121	4	4
7	2	1	123	4	2	121	4	4
44	2	4	123	4	2	121	4	4
111	3	4	123	4	2	121	4	4
112	3	3	123	4	2	121	4	4
113	3	2	123	4	2	121	4	4
114	3	1	123	4	2	121	4	4
115	4	1	123	4	2	121	4	4
5	2	3	123	4	2	122	4	3
6	2	2	123	4	2	122	4	3
7	2	1	123	4	2	122	4	3
44	2	4	123	4	2	122	4	3
111	3	4	123	4	2	122	4	3
112	3	3	123	4	2	122	4	3
113	3	2	123	4	2	122	4	3
114	3	1	123	4	2	122	4	3
115	4	1	123	4	2	122	4	3
5	2	3	123	4	2	123	4	2
6	2	2	123	4	2	123	4	2
7	2	1	123	4	2	123	4	2
44	2	4	123	4	2	123	4	2
111	3	4	123	4	2	123	4	2
112	3	3	123	4	2	123	4	2
113	3	2	123	4	2	123	4	2
114	3	1	123	4	2	123	4	2
115	4	1	123	4	2	123	4	2
5	2	3	123	4	2	124	4	1
6	2	2	123	4	2	124	4	1
7	2	1	123	4	2	124	4	1
44	2	4	123	4	2	124	4	1
111	3	4	123	4	2	124	4	1
112	3	3	123	4	2	124	4	1
113	3	2	123	4	2	124	4	1
114	3	1	123	4	2	124	4	1
115	4	1	123	4	2	124	4	1
5	2	3	124	4	1	121	4	4
6	2	2	124	4	1	121	4	4
7	2	1	124	4	1	121	4	4
44	2	4	124	4	1	121	4	4
111	3	4	124	4	1	121	4	4
112	3	3	124	4	1	121	4	4
113	3	2	124	4	1	121	4	4
114	3	1	124	4	1	121	4	4
115	4	1	124	4	1	121	4	4
5	2	3	124	4	1	122	4	3
6	2	2	124	4	1	122	4	3
7	2	1	124	4	1	122	4	3
44	2	4	124	4	1	122	4	3
111	3	4	124	4	1	122	4	3
112	3	3	124	4	1	122	4	3
113	3	2	124	4	1	122	4	3
114	3	1	124	4	1	122	4	3
115	4	1	124	4	1	122	4	3
5	2	3	124	4	1	123	4	2
6	2	2	124	4	1	123	4	2
7	2	1	124	4	1	123	4	2
44	2	4	124	4	1	123	4	2
111	3	4	124	4	1	123	4	2
112	3	3	124	4	1	123	4	2
113	3	2	124	4	1	123	4	2
114	3	1	124	4	1	123	4	2
115	4	1	124	4	1	123	4	2
5	2	3	124	4	1	124	4	1
6	2	2	124	4	1	124	4	1
7	2	1	124	4	1	124	4	1
44	2	4	124	4	1	124	4	1
111	3	4	124	4	1	124	4	1
112	3	3	124	4	1	124	4	1
113	3	2	124	4	1	124	4	1
114	3	1	124	4	1	124	4	1
115	4	1	124	4	1	124	4	1
select * from (t1 join t2) join t3;
c1	c2	c3	c1	c2	c3	c1	c2	c3
5	2	3	121	4	4	121	4	4
6	2	2	121	4	4	121	4	4
7	2	1	121	4	4	121	4	4
44	2	4	121	4	4	121	4	4
111	3	4	121	4	4	121	4	4
112	3	3	121	4	4	121	4	4
113	3	2	121	4	4	121	4	4
114	3	1	121	4	4	121	4	4
115	4	1	121	4	4	121	4	4
5	2	3	121	4	4	122	4	3
6	2	2	121	4	4	122	4	3
7	2	1	121	4	4	122	4	3
44	2	4	121	4	4	122	4	3
111	3	4	121	4	4	122	4	3
112	3	3	121	4	4	122	4	3
113	3	2	121	4	4	122	4	3
114	3	1	121	4	4	122	4	3
115	4	1	121	4	4	122	4	3
5	2	3	121	4	4	123	4	2
6	2	2	121	4	4	123	4	2
7	2	1	121	4	4	123	4	2
44	2	4	121	4	4	123	4	2
111	3	4	121	4	4	123	4	2
112	3	3	121	4	4	123	4	2
113	3	2	121	4	4	123	4	2
114	3	1	121	4	4	123	4	2
115	4	1	121	4	4	123	4	2
5	2	3	121	4	4	124	4	1
6	2	2	121	4	4	124	4	1
7	2	1	121	4	4	124	4	1
44	2	4	121	4	4	124	4	1
111	3	4	121	4	4	124	4	1
112	3	3	121	4	4	124	4	1
113	3	2	121	4	4	124	4	1
114	3	1	121	4	4	124	4	1
115	4	1	121	4	4	124	4	1
5	2	3	122	4	3	121	4	4
6	2	2	122	4	3	121	4	4
7	2	1	122	4	3	121	4	4
44	2	4	122	4	3	121	4	4
111	3	4	122	4	3	121	4	4
112	3	3	122	4	3	121	4	4
113	3	2	122	4	3	121	4	4
114	3	1	122	4	3	121	4	4
115	4	1	122	4	3	121	4	4
5	2	3	122	4	3	122	4	3
6	2	2	122	4	3	122	4	3
7	2	1	122	4	3	122	4	3
44	2	4	122	4	3	122	4	3
111	3	4	122	4	3	122	4	3
112	3	3	122	4	3	122	4	3
113	3	2	122	4	3	122	4	3
114	3	1	122	4	3	122	4	3
115	4	1	122	4	3	122	4	3
5	2	3	122	4	3	123	4	2
6	2	2	122	4	3	123	4	2
7	2	1	122	4	3	123	4	2
44	2	4	122	4	3	123	4	2
111	3	4	122	4	3	123	4	2
112	3	3	122	4	3	123	4	2
113	3	2	122	4	3	123	4	2
114	3	1	122	4	3	123	4	2
115	4	1	122	4	3	123	4	2
5	2	3	122	4	3	124	4	1
6	2	2	122	4	3	124	4	1
7	2	1	122	4	3	124	4	1
44	2	4	122	4	3	124	4	1
111	3	4	122	4	3	124	4	1
112	3	3	122	4	3	124	4	1
113	3	2	122	4	3	124	4	1
114	3	1	122	4	3	124	4	1
115	4	1	122	4	3	124	4	1
5	2	3	123	4	2	121	4	4
6	2	2	123	4	2	121	4	4
7	2	1	123	4	2	121	4	4
44	2	4	123	4	2	121	4	4
111	3	4	123	4	2	121	4	4
112	3	3	123	4	2	121	4	4
113	3	2	123	4	2	121	4	4
114	3	1	123	4	2	121	4	4
115	4	1	123	4	2	121	4	4
5	2	3	123	4	2	122	4	3
6	2	2	123	4	2	122	4	3
7	2	1	123	4	2	122	4	3
44	2	4	123	4	2	122	4	3
111	3	4	123	4	2	122	4	3
112	3	3	123	4	2	122	4	3
113	3	2	123	4	2	122	4	3
114	3	1	123	4	2	122	4	3
115	4	1	123	4	2	122	4	3
5	2	3	123	4	2	123	4	2
6	2	2	123	4	2	123	4	2
7	2	1	123	4	2	123	4	2
44	2	4	123	4	2	123	4	2
111	3	4	123	4	2	123	4	2
112	3	3	123	4	2	123	4	2
113	3	2	123	4	2	123	4	2
114	3	1	123	4	2	123	4	2
115	4	1	123	4	2	123	4	2
5	2	3	123	4	2	124	4	1
6	2	2	123	4	2	124	4	1
7	2	1	123	4	2	124	4	1
44	2	4	123	4	2	124	4	1
111	3	4	123	4	2	124	4	1
112	3	3	123	4	2	124	4	1
113	3	2	123	4	2	124	4	1
114	3	1	123	4	2	124	4	1
115	4	1	123	4	2	124	4	1
5	2	3	124	4	1	121	4	4
6	2	2	124	4	1	121	4	4
7	2	1	124	4	1	121	4	4
44	2	4	124	4	1	121	4	4
111	3	4	124	4	1	121	4	4
112	3	3	124	4	1	121	4	4
113	3	2	124	4	1	121	4	4
114	3	1	124	4	1	121	4	4
115	4	1	124	4	1	121	4	4
5	2	3	124	4	1	122	4	3
6	2	2	124	4	1	122	4	3
7	2	1	124	4	1	122	4	3
44	2	4	124	4	1	122	4	3
111	3	4	124	4	1	122	4	3
112	3	3	124	4	1	122	4	3
113	3	2	124	4	1	122	4	3
114	3	1	124	4	1	122	4	3
115	4	1	124	4	1	122	4	3
5	2	3	124	4	1	123	4	2
6	2	2	124	4	1	123	4	2
7	2	1	124	4	1	123	4	2
44	2	4	124	4	1	123	4	2
111	3	4	124	4	1	123	4	2
112	3	3	124	4	1	123	4	2
113	3	2	124	4	1	123	4	2
114	3	1	124	4	1	123	4	2
115	4	1	124	4	1	123	4	2
5	2	3	124	4	1	124	4	1
6	2	2	124	4	1	124	4	1
7	2	1	124	4	1	124	4	1
44	2	4	124	4	1	124	4	1
111	3	4	124	4	1	124	4	1
112	3	3	124	4	1	124	4	1
113	3	2	124	4	1	124	4	1
114	3	1	124	4	1	124	4	1
115	4	1	124	4	1	124	4	1
select * from (t1 join t2) join (select * from t3) a;
c1	c2	c3	c1	c2	c3	c1	c2	c3
5	2	3	121	4	4	121	4	4
6	2	2	121	4	4	121	4	4
7	2	1	121	4	4	121	4	4
44	2	4	121	4	4	121	4	4
111	3	4	121	4	4	121	4	4
112	3	3	121	4	4	121	4	4
113	3	2	121	4	4	121	4	4
114	3	1	121	4	4	121	4	4
115	4	1	121	4	4	121	4	4
5	2	3	121	4	4	122	4	3
6	2	2	121	4	4	122	4	3
7	2	1	121	4	4	122	4	3
44	2	4	121	4	4	122	4	3
111	3	4	121	4	4	122	4	3
112	3	3	121	4	4	122	4	3
113	3	2	121	4	4	122	4	3
114	3	1	121	4	4	122	4	3
115	4	1	121	4	4	122	4	3
5	2	3	121	4	4	123	4	2
6	2	2	121	4	4	123	4	2
7	2	1	121	4	4	123	4	2
44	2	4	121	4	4	123	4	2
111	3	4	121	4	4	123	4	2
112	3	3	121	4	4	123	4	2
113	3	2	121	4	4	123	4	2
114	3	1	121	4	4	123	4	2
115	4	1	121	4	4	123	4	2
5	2	3	121	4	4	124	4	1
6	2	2	121	4	4	124	4	1
7	2	1	121	4	4	124	4	1
44	2	4	121	4	4	124	4	1
111	3	4	121	4	4	124	4	1
112	3	3	121	4	4	124	4	1
113	3	2	121	4	4	124	4	1
114	3	1	121	4	4	124	4	1
115	4	1	121	4	4	124	4	1
5	2	3	122	4	3	121	4	4
6	2	2	122	4	3	121	4	4
7	2	1	122	4	3	121	4	4
44	2	4	122	4	3	121	4	4
111	3	4	122	4	3	121	4	4
112	3	3	122	4	3	121	4	4
113	3	2	122	4	3	121	4	4
114	3	1	122	4	3	121	4	4
115	4	1	122	4	3	121	4	4
5	2	3	122	4	3	122	4	3
6	2	2	122	4	3	122	4	3
7	2	1	122	4	3	122	4	3
44	2	4	122	4	3	122	4	3
111	3	4	122	4	3	122	4	3
112	3	3	122	4	3	122	4	3
113	3	2	122	4	3	122	4	3
114	3	1	122	4	3	122	4	3
115	4	1	122	4	3	122	4	3
5	2	3	122	4	3	123	4	2
6	2	2	122	4	3	123	4	2
7	2	1	122	4	3	123	4	2
44	2	4	122	4	3	123	4	2
111	3	4	122	4	3	123	4	2
112	3	3	122	4	3	123	4	2
113	3	2	122	4	3	123	4	2
114	3	1	122	4	3	123	4	2
115	4	1	122	4	3	123	4	2
5	2	3	122	4	3	124	4	1
6	2	2	122	4	3	124	4	1
7	2	1	122	4	3	124	4	1
44	2	4	122	4	3	124	4	1
111	3	4	122	4	3	124	4	1
112	3	3	122	4	3	124	4	1
113	3	2	122	4	3	124	4	1
114	3	1	122	4	3	124	4	1
115	4	1	122	4	3	124	4	1
5	2	3	123	4	2	121	4	4
6	2	2	123	4	2	121	4	4
7	2	1	123	4	2	121	4	4
44	2	4	123	4	2	121	4	4
111	3	4	123	4	2	121	4	4
112	3	3	123	4	2	121	4	4
113	3	2	123	4	2	121	4	4
114	3	1	123	4	2	121	4	4
115	4	1	123	4	2	121	4	4
5	2	3	123	4	2	122	4	3
6	2	2	123	4	2	122	4	3
7	2	1	123	4	2	122	4	3
44	2	4	123	4	2	122	4	3
111	3	4	123	4	2	122	4	3
112	3	3	123	4	2	122	4	3
113	3	2	123	4	2	122	4	3
114	3	1	123	4	2	122	4	3
115	4	1	123	4	2	122	4	3
5	2	3	123	4	2	123	4	2
6	2	2	123	4	2	123	4	2
7	2	1	123	4	2	123	4	2
44	2	4	123	4	2	123	4	2
111	3	4	123	4	2	123	4	2
112	3	3	123	4	2	123	4	2
113	3	2	123	4	2	123	4	2
114	3	1	123	4	2	123	4	2
115	4	1	123	4	2	123	4	2
5	2	3	123	4	2	124	4	1
6	2	2	123	4	2	124	4	1
7	2	1	123	4	2	124	4	1
44	2	4	123	4	2	124	4	1
111	3	4	123	4	2	124	4	1
112	3	3	123	4	2	124	4	1
113	3	2	123	4	2	124	4	1
114	3	1	123	4	2	124	4	1
115	4	1	123	4	2	124	4	1
5	2	3	124	4	1	121	4	4
6	2	2	124	4	1	121	4	4
7	2	1	124	4	1	121	4	4
44	2	4	124	4	1	121	4	4
111	3	4	124	4	1	121	4	4
112	3	3	124	4	1	121	4	4
113	3	2	124	4	1	121	4	4
114	3	1	124	4	1	121	4	4
115	4	1	124	4	1	121	4	4
5	2	3	124	4	1	122	4	3
6	2	2	124	4	1	122	4	3
7	2	1	124	4	1	122	4	3
44	2	4	124	4	1	122	4	3
111	3	4	124	4	1	122	4	3
112	3	3	124	4	1	122	4	3
113	3	2	124	4	1	122	4	3
114	3	1	124	4	1	122	4	3
115	4	1	124	4	1	122	4	3
5	2	3	124	4	1	123	4	2
6	2	2	124	4	1	123	4	2
7	2	1	124	4	1	123	4	2
44	2	4	124	4	1	123	4	2
111	3	4	124	4	1	123	4	2
112	3	3	124	4	1	123	4	2
113	3	2	124	4	1	123	4	2
114	3	1	124	4	1	123	4	2
115	4	1	124	4	1	123	4	2
5	2	3	124	4	1	124	4	1
6	2	2	124	4	1	124	4	1
7	2	1	124	4	1	124	4	1
44	2	4	124	4	1	124	4	1
111	3	4	124	4	1	124	4	1
112	3	3	124	4	1	124	4	1
113	3	2	124	4	1	124	4	1
114	3	1	124	4	1	124	4	1
115	4	1	124	4	1	124	4	1
select * from ((t1 join t2) join (select * from t3) a);
c1	c2	c3	c1	c2	c3	c1	c2	c3
5	2	3	121	4	4	121	4	4
6	2	2	121	4	4	121	4	4
7	2	1	121	4	4	121	4	4
44	2	4	121	4	4	121	4	4
111	3	4	121	4	4	121	4	4
112	3	3	121	4	4	121	4	4
113	3	2	121	4	4	121	4	4
114	3	1	121	4	4	121	4	4
115	4	1	121	4	4	121	4	4
5	2	3	121	4	4	122	4	3
6	2	2	121	4	4	122	4	3
7	2	1	121	4	4	122	4	3
44	2	4	121	4	4	122	4	3
111	3	4	121	4	4	122	4	3
112	3	3	121	4	4	122	4	3
113	3	2	121	4	4	122	4	3
114	3	1	121	4	4	122	4	3
115	4	1	121	4	4	122	4	3
5	2	3	121	4	4	123	4	2
6	2	2	121	4	4	123	4	2
7	2	1	121	4	4	123	4	2
44	2	4	121	4	4	123	4	2
111	3	4	121	4	4	123	4	2
112	3	3	121	4	4	123	4	2
113	3	2	121	4	4	123	4	2
114	3	1	121	4	4	123	4	2
115	4	1	121	4	4	123	4	2
5	2	3	121	4	4	124	4	1
6	2	2	121	4	4	124	4	1
7	2	1	121	4	4	124	4	1
44	2	4	121	4	4	124	4	1
111	3	4	121	4	4	124	4	1
112	3	3	121	4	4	124	4	1
113	3	2	121	4	4	124	4	1
114	3	1	121	4	4	124	4	1
115	4	1	121	4	4	124	4	1
5	2	3	122	4	3	121	4	4
6	2	2	122	4	3	121	4	4
7	2	1	122	4	3	121	4	4
44	2	4	122	4	3	121	4	4
111	3	4	122	4	3	121	4	4
112	3	3	122	4	3	121	4	4
113	3	2	122	4	3	121	4	4
114	3	1	122	4	3	121	4	4
115	4	1	122	4	3	121	4	4
5	2	3	122	4	3	122	4	3
6	2	2	122	4	3	122	4	3
7	2	1	122	4	3	122	4	3
44	2	4	122	4	3	122	4	3
111	3	4	122	4	3	122	4	3
112	3	3	122	4	3	122	4	3
113	3	2	122	4	3	122	4	3
114	3	1	122	4	3	122	4	3
115	4	1	122	4	3	122	4	3
5	2	3	122	4	3	123	4	2
6	2	2	122	4	3	123	4	2
7	2	1	122	4	3	123	4	2
44	2	4	122	4	3	123	4	2
111	3	4	122	4	3	123	4	2
112	3	3	122	4	3	123	4	2
113	3	2	122	4	3	123	4	2
114	3	1	122	4	3	123	4	2
115	4	1	122	4	3	123	4	2
5	2	3	122	4	3	124	4	1
6	2	2	122	4	3	124	4	1
7	2	1	122	4	3	124	4	1
44	2	4	122	4	3	124	4	1
111	3	4	122	4	3	124	4	1
112	3	3	122	4	3	124	4	1
113	3	2	122	4	3	124	4	1
114	3	1	122	4	3	124	4	1
115	4	1	122	4	3	124	4	1
5	2	3	123	4	2	121	4	4
6	2	2	123	4	2	121	4	4
7	2	1	123	4	2	121	4	4
44	2	4	123	4	2	121	4	4
111	3	4	123	4	2	121	4	4
112	3	3	123	4	2	121	4	4
113	3	2	123	4	2	121	4	4
114	3	1	123	4	2	121	4	4
115	4	1	123	4	2	121	4	4
5	2	3	123	4	2	122	4	3
6	2	2	123	4	2	122	4	3
7	2	1	123	4	2	122	4	3
44	2	4	123	4	2	122	4	3
111	3	4	123	4	2	122	4	3
112	3	3	123	4	2	122	4	3
113	3	2	123	4	2	122	4	3
114	3	1	123	4	2	122	4	3
115	4	1	123	4	2	122	4	3
5	2	3	123	4	2	123	4	2
6	2	2	123	4	2	123	4	2
7	2	1	123	4	2	123	4	2
44	2	4	123	4	2	123	4	2
111	3	4	123	4	2	123	4	2
112	3	3	123	4	2	123	4	2
113	3	2	123	4	2	123	4	2
114	3	1	123	4	2	123	4	2
115	4	1	123	4	2	123	4	2
5	2	3	123	4	2	124	4	1
6	2	2	123	4	2	124	4	1
7	2	1	123	4	2	124	4	1
44	2	4	123	4	2	124	4	1
111	3	4	123	4	2	124	4	1
112	3	3	123	4	2	124	4	1
113	3	2	123	4	2	124	4	1
114	3	1	123	4	2	124	4	1
115	4	1	123	4	2	124	4	1
5	2	3	124	4	1	121	4	4
6	2	2	124	4	1	121	4	4
7	2	1	124	4	1	121	4	4
44	2	4	124	4	1	121	4	4
111	3	4	124	4	1	121	4	4
112	3	3	124	4	1	121	4	4
113	3	2	124	4	1	121	4	4
114	3	1	124	4	1	121	4	4
115	4	1	124	4	1	121	4	4
5	2	3	124	4	1	122	4	3
6	2	2	124	4	1	122	4	3
7	2	1	124	4	1	122	4	3
44	2	4	124	4	1	122	4	3
111	3	4	124	4	1	122	4	3
112	3	3	124	4	1	122	4	3
113	3	2	124	4	1	122	4	3
114	3	1	124	4	1	122	4	3
115	4	1	124	4	1	122	4	3
5	2	3	124	4	1	123	4	2
6	2	2	124	4	1	123	4	2
7	2	1	124	4	1	123	4	2
44	2	4	124	4	1	123	4	2
111	3	4	124	4	1	123	4	2
112	3	3	124	4	1	123	4	2
113	3	2	124	4	1	123	4	2
114	3	1	124	4	1	123	4	2
115	4	1	124	4	1	123	4	2
5	2	3	124	4	1	124	4	1
6	2	2	124	4	1	124	4	1
7	2	1	124	4	1	124	4	1
44	2	4	124	4	1	124	4	1
111	3	4	124	4	1	124	4	1
112	3	3	124	4	1	124	4	1
113	3	2	124	4	1	124	4	1
114	3	1	124	4	1	124	4	1
115	4	1	124	4	1	124	4	1
select * from t1 join t2 on (t1.c1=t2.c1) join t3 on (t1.c1=t2.c1);
c1	c2	c3	c1	c2	c3	c1	c2	c3
select * from t1 join t2 using (c1) join t3 using (c1);
c1	c2	c3	c2	c3	c2	c3
select * from t1 join t2 on (t1.c1=t2.c1);
c1	c2	c3	c1	c2	c3
(select count(*) from t1) UNION (select count(*) from t1);
count(*)
9
(select c1,c2 from t1 limit 3)  union all (select c1,c2 from t2 order by c1 limit 1) order by c1;
c1	c2
5	2
6	2
7	2
121	4
(select * from t1 order by c1 limit 2) union (select * from t2 order by c1 limit 3) limit 2;
c1	c2	c3
5	2	3
6	2	2
(select * from t1 order by c1 limit 2) union (select * from t2 order by c1 limit 3);
c1	c2	c3
5	2	3
6	2	2
121	4	4
122	4	3
123	4	2
(select * from t1 order by c1 limit 2) union all (select * from t2 order by c1 limit 3);
c1	c2	c3
5	2	3
6	2	2
121	4	4
122	4	3
123	4	2
(select * from t1 order by c1 limit 2) union distinct (select * from t2 order by c1 limit 3);
c1	c2	c3
5	2	3
6	2	2
121	4	4
122	4	3
123	4	2
select * from t1,t2,t3 where t1.c1=t2.c1 AND t2.c2=t3.c1 and t1.c2=t3.c2 order by t1.c1;
c1	c2	c3	c1	c2	c3	c1	c2	c3
select a.c1 from (select c1 from t1) as a having a.c1 = 1;
c1
select * from t1 where 'c' not like 'b' and ((c1 < 2 and false) or (c1 < 2 and c1 is not null)) ;
c1	c2	c3
select * from t1 where 'c' not like 'b' and ((false) or (c1 < 2 and c1 is not null));
c1	c2	c3
select * from t1 group by 3>(select count(*) from t2);
c1	c2	c3
5	2	3
select * from t1 order by 3>(select count(*) from t2);
c1	c2	c3
5	2	3
6	2	2
7	2	1
44	2	4
111	3	4
112	3	3
113	3	2
114	3	1
115	4	1
select (3>(select count(*) from t2)) from t1;
(3>(select count(*) from t2))
0
0
0
0
0
0
0
0
0
select * from t1 where 3>(select count(*) from t2);
c1	c2	c3
select (3>(select count(*) from t2)) from t1 union select c1 from t2;
(3>(select count(*) from t2))
0
121
122
123
124
select * from t1 group by 3>(select count(*) from t2) union select * from t2;
c1	c2	c3
5	2	3
121	4	4
122	4	3
123	4	2
124	4	1
select * from t1 order by 3>(select count(*) from t2) intersect select * from t2;
c1	c2	c3
select * from t1 where 3>(select count(*) from t2) union select * from t2;
c1	c2	c3
121	4	4
122	4	3
123	4	2
124	4	1
select min(2) from t1;
min(2)
2
select max(2) from t1;
max(2)
2
select sum(2) from t1;
sum(2)
18
select avg(2) from t1;
avg(2)
2.0000
select max(t3.c1) from t1 as t3, t1 t4 where t3.c1 = t4.c1;
max(t3.c1)
115
SELECT length('asdfgyyy');
length('asdfgyyy')
8
select found_rows();
found_rows()
1
select * from  t1  for update wait 2;
c1	c2	c3
5	2	3
6	2	2
7	2	1
44	2	4
111	3	4
112	3	3
113	3	2
114	3	1
115	4	1
select * from  t1  a  for update wait 2;
c1	c2	c3
5	2	3
6	2	2
7	2	1
44	2	4
111	3	4
112	3	3
113	3	2
114	3	1
115	4	1
select * from  t1  where c1 <101 for update wait 1;
c1	c2	c3
5	2	3
6	2	2
7	2	1
44	2	4
select * from  t1  where c1 <101  and c2 < 100 for update wait 1;
c1	c2	c3
5	2	3
6	2	2
7	2	1
44	2	4
select * from  t1  where c1 in (3,2,3,4,5,6) for update wait 1;
c1	c2	c3
5	2	3
6	2	2
select * from  t1  where (c1,c2) in ((2,2), (2,3),(3,4)) for update wait 1;
c1	c2	c3
select * from t1 t where t.c2 = 3 and t.c1 = 2 for update nowait;
c1	c2	c3
select abs(c1) , sum(c2) from t1 group by abs(c2) having sum(sign(c1)) > 1 for update;
abs(c1)	sum(c2)
111	12
5	8
