drop database if exists tan_test;
create database tan_test;
use tan_test;
drop table if exists w0case;
drop table if exists w1case;
# obmysql-tan 通过性测试
create table w0case(w_test varchar(100));
insert into w0case values('100');
select round(tan(w_test),5) from w0case;
round(tan(w_test),5)
-0.58721
# obmysql-tan 参数数量
select tan() from w0case;
ERROR 42000: Incorrect parameter count in the call to native function 'tan'
select round(tan(12),5) from dual;
round(tan(12),5)
-0.63586
select tan(12,1) from dual;
ERROR 42000: Incorrect parameter count in the call to native function 'tan'
drop table w0case;
# obmysql-tan char类型
create table w0case(w_test char(200));
insert into w0case values('111');
insert into w0case values('a');
insert into w0case values('a11');
insert into w0case values('33.4456456142f');
insert into w0case values('-33.445645614245d');
select round(tan(w_test),5) from w0case where w_test = '111';
round(tan(w_test),5)
1.72035
select tan(w_test) from w0case where w_test = 'a';
tan(w_test)
0
select tan(w_test) from w0case where w_test = 'a11';
tan(w_test)
0
select tan(w_test) from w0case where w_test = '33.4456456142f';
tan(w_test)
-2.0238498391275206
select tan(w_test) from w0case where w_test = '-33.445645614245d';
tan(w_test)
2.0238498388981725
drop table w0case;
# obmysql-tan varchar type
create table w0case(w_test varchar(100));
insert into w0case values('111');
insert into w0case values('33.4456456142f');
insert into w0case values('-33.445645614245d');
select round(tan(w_test),5) from w0case where w_test = '111';
round(tan(w_test),5)
1.72035
select tan(w_test) from w0case where w_test = '33.4456456142f';
tan(w_test)
-2.0238498391275206
select tan(w_test) from w0case where w_test = '-33.445645614245d';
tan(w_test)
2.0238498388981725
# obmysql date/datetime/interval type
SELECT ROUND(tan('20200601'),5) FROM dual;
ROUND(tan('20200601'),5)
0.01619
SELECT tan('2020-06-01') FROM dual;
tan('2020-06-01')
-0.04410482299318282
Warnings:
Warning	1292	Truncated incorrect DOUBLE value: '2020-06-01'
select tan('2020:06:01') from  dual;
tan('2020:06:01')
-0.04410482299318282
Warnings:
Warning	1292	Truncated incorrect DOUBLE value: '2020:06:01'
select ROUND(tan('20191001030204'),5) from dual;
ROUND(tan('20191001030204'),5)
0.11178
select tan('2020-06-01 03:02:05') from dual;
tan('2020-06-01 03:02:05')
-0.04410482299318282
Warnings:
Warning	1292	Truncated incorrect DOUBLE value: '2020-06-01 03:02:05'
drop table w0case;
# obmysql number type
CREATE TABLE w0case(w_test decimal(38,10));
INSERT INTO w0case VALUES (222);
INSERT INTO w0case VALUES (33.4);
INSERT INTO w0case VALUES(335.11111);
SELECT ROUND(tan(W_TEST),5) FROM W0CASE WHERE W_TEST = 222;
ROUND(tan(W_TEST),5)
-1.75582
SELECT ROUND(tan(W_TEST),5) FROM W0CASE WHERE W_TEST = 33.4;
ROUND(tan(W_TEST),5)
-2.28033
SELECT ROUND(tan(W_TEST),5) FROM W0CASE WHERE W_TEST = 335.11111;
ROUND(tan(W_TEST),5)
-1.70090
SELECT ROUND(tan(-1.0e-130)) FROM dual;
ROUND(tan(-1.0e-130))
-0
SELECT tan(1.0e+126) FROM dual;
tan(1.0e+126)
0.2629242954946514
# mysql及ob在超越边界值是返回值为0
SELECT tan(-1.0e-131) FROM dual;
tan(-1.0e-131)
-1e-131
# mysql返回未0，ob返回为数值
SELECT tan(1.0e+125) FROM dual;
tan(1.0e+125)
-1.304492817419845
DROP TABLE W0CASE;
CREATE TABLE W0CASE(w_test varchar(100));
INSERT INTO W0CASE values('12h3');
DROP TABLE W0CASE;
# obmysql blob type
CREATE TABLE W0CASE(w_test blob);
INSERT INTO W0CASE VALUES ('123');
SELECT ROUND(tan(w_test)) FROM W0CASE;
ROUND(tan(w_test))
1
DROP TABLE W0CASE;
# obmysql 特殊符号，空格等
SELECT tan(1 23) FROM dual;
ERROR 42000: You have an error in your SQL syntax; check the manual that corresponds to your OceanBase version for the right syntax to use near '23) FROM dual' at line 1
SELECT tan(123%) FROM dual;
ERROR 42000: You have an error in your SQL syntax; check the manual that corresponds to your OceanBase version for the right syntax to use near ') FROM dual' at line 1
# obmysql 函数嵌套
SELECT ROUND(tan(45),5) FROM dual;
ROUND(tan(45),5)
1.61978
SELECT tan(tan(12)) FROM dual;
tan(tan(12))
-0.7381284594278902
SELECT tan(MOD(11,4)) FROM dual;
tan(MOD(11,4))
-0.1425465430742778
SELECT tan(POWER(3,2)) FROM  dual;
tan(POWER(3,2))
-0.45231565944180985
# obmysql 多级函数嵌套/被嵌套
SELECT ROUND(POWER(tan(15),2),5) FROM dual;
ROUND(POWER(tan(15),2),5)
0.73272
SELECT ROUND(tan(POWER(2,3)),5) FROM dual WHERE tan(POWER(2,3))>tan(POWER(2,4));
ROUND(tan(POWER(2,3)),5)
SELECT ROUND(POWER(ROUND(ATAN(ROUND(tan(45),5)),5),2),5) FROM dual;
ROUND(POWER(ROUND(ATAN(ROUND(tan(45),5)),5),2),5)
1.03571
SELECT tan(ROUND(POWER(ROUND(ATAN(ROUND(tan(45),5)),5),2),5)) FROM dual;
tan(ROUND(POWER(ROUND(ATAN(ROUND(tan(45),5)),5),2),5))
1.6869950953685093
SELECT ROUND(tan(POWER(2,3)),5) FROM dual WHERE tan(45) = tan(45);
ROUND(tan(POWER(2,3)),5)
-6.79971
SELECT tan(CAST('2019-05-20' AS DATE)) FROM dual;
tan(CAST('2019-05-20' AS DATE))
0.4075729259871724
SELECT tan(CAST('19.2' as decimal(10,2))) FROM dual;
tan(CAST('19.2' as decimal(10,2)))
0.3655318265062019
# obmysql 基础运算
SELECT tan(235-123) FROM dual;
tan(235-123)
-1.951876992743923
SELECT tan(12*12) FROM dual;
tan(12*12)
-0.5636492668365763
SELECT tan(12+12) FROM dual;
tan(12+12)
-2.1348966977217008
SELECT tan(12/12) FROM dual;
tan(12/12)
1.5574077246549023
SELECT tan(POWER(2,3)+POWER(2,2)) FROM dual;
tan(POWER(2,3)+POWER(2,2))
-0.6358599286615808
CREATE TABLE w0case(w_test decimal(38,10));
INSERT INTO w0case VALUES(0);
INSERT INTO w0case VALUES(1);
INSERT INTO w0case VALUES(2);
INSERT INTO w0case VALUES(3);
SELECT tan(w_test) FROM w0case WHERE w_test IS NULL;
tan(w_test)
SELECT tan(w_test) FROM w0case WHERE w_test IS NOT NULL;
tan(w_test)
0
1.5574077246549023
-2.185039863261519
-0.1425465430742778
SELECT tan(w_test) FROM w0case WHERE w_test IN (0,1,2,3,4);
tan(w_test)
0
1.5574077246549023
-2.185039863261519
-0.1425465430742778
SELECT tan(w_test) FROM w0case WHERE w_test NOT IN (4,5,6);
tan(w_test)
0
1.5574077246549023
-2.185039863261519
-0.1425465430742778
SELECT tan(w_test) FROM w0case WHERE w_test BETWEEN 0 AND 4;
tan(w_test)
0
1.5574077246549023
-2.185039863261519
-0.1425465430742778
SELECT tan(w_test) FROM w0case WHERE w_test NOT BETWEEN 4 AND 6;
tan(w_test)
0
1.5574077246549023
-2.185039863261519
-0.1425465430742778
DROP TABLE W0CASE;
# obmysql tan特殊值
SELECT TAN(0 * 3.14159265359/180) FROM dual;
TAN(0 * 3.14159265359/180)
0
SELECT TAN(45 * 3.14159265359/180) FROM dual;
TAN(45 * 3.14159265359/180)
1.0000000000001035
SELECT TAN(90 * 3.14159265359/180) FROM dual;
TAN(90 * 3.14159265359/180)
-9670099380792.184
SELECT TAN(180 * 3.14159265359/180) FROM dual;
TAN(180 * 3.14159265359/180)
0.00000000000020682310711021444
SELECT TAN(270 * 3.14159265359/180) FROM dual;
TAN(270 * 3.14159265359/180)
-3227987202133.868
SELECT TAN(360 * 3.14159265359/180) FROM dual;
TAN(360 * 3.14159265359/180)
0.0000000000004136462142204289
# obmysql 静态sql
# obmysql select operation
CREATE TABLE w0case(w_test0 decimal(38,10),w_test1 varchar(11));
# 空值查询
SELECT tan(W_TEST0) FROM W0CASE;
tan(W_TEST0)
INSERT INTO w0case VALUES(0,'a');
# 单值查询
SELECT tan(w_test0) FROM w0case;
tan(w_test0)
0
INSERT INTO w0case VALUES(1,'b');
INSERT INTO w0case VALUES(2,'c');
INSERT INTO w0case VALUES(3,'d');
INSERT INTO w0case VALUES(4,'e');
INSERT INTO w0case VALUES(5,'f');
INSERT INTO w0case VALUES(15,'15');
INSERT INTO w0case VALUES(15,'15f');
# 多值查询
SELECT tan(w_test0) FROM w0case;
tan(w_test0)
0
1.5574077246549023
-2.185039863261519
-0.1425465430742778
1.1578212823495775
-3.380515006246586
-0.8559934009085187
-0.8559934009085187
# group by having
SELECT tan(w_test0) FROM W0CASE GROUP BY w_test0;
tan(w_test0)
0
1.5574077246549023
-2.185039863261519
-0.1425465430742778
1.1578212823495775
-3.380515006246586
-0.8559934009085187
SELECT tan(w_test0),w_test1 FROM W0CASE GROUP BY w_test0,w_test1 HAVING w_test1 = 'c';
tan(w_test0)	w_test1
-2.185039863261519	c
SELECT tan(w_test0),w_test1 FROM W0CASE GROUP BY w_test0,w_test1 HAVING w_test1 IN ('a','b','c');
tan(w_test0)	w_test1
0	a
1.5574077246549023	b
-2.185039863261519	c
SELECT tan(w_test0),w_test1 FROM W0CASE GROUP BY w_test0,w_test1 HAVING w_test0 BETWEEN 0 AND 4;
tan(w_test0)	w_test1
0	a
1.5574077246549023	b
-2.185039863261519	c
-0.1425465430742778	d
1.1578212823495775	e
SELECT tan(w_test0),w_test1 FROM W0CASE GROUP BY w_test0,w_test1 HAVING tan(w_test0)>0;
tan(w_test0)	w_test1
1.5574077246549023	b
1.1578212823495775	e
SELECT tan(w_test0),tan(w_test1) FROM W0CASE GROUP BY w_test0,w_test1 HAVING tan(w_test0)>0 AND w_test1 NOT IN('a','b','c','d','e','f') ;
tan(w_test0)	tan(w_test1)
SELECT tan(w_test0),tan(w_test1) FROM W0CASE GROUP BY w_test0,w_test1 HAVING w_test1 NOT IN('a','b','c','d','e','f','15') ;
tan(w_test0)	tan(w_test1)
-0.8559934009085187	-0.8559934009085187
Warnings:
Warning	1292	Truncated incorrect DOUBLE value: '15f'
# order by 
SELECT tan(w_test0) FROM W0CASE ORDER BY w_test0;
tan(w_test0)
0
1.5574077246549023
-2.185039863261519
-0.1425465430742778
1.1578212823495775
-3.380515006246586
-0.8559934009085187
-0.8559934009085187
SELECT tan(w_test0) FROM W0CASE ORDER BY w_test0 DESC;
tan(w_test0)
-0.8559934009085187
-0.8559934009085187
-3.380515006246586
1.1578212823495775
-0.1425465430742778
-2.185039863261519
1.5574077246549023
0
SELECT tan(w_test0) FROM W0CASE ORDER BY w_test0 ASC;
tan(w_test0)
0
1.5574077246549023
-2.185039863261519
-0.1425465430742778
1.1578212823495775
-3.380515006246586
-0.8559934009085187
-0.8559934009085187
SELECT tan(w_test0),w_test1 FROM W0CASE ORDER BY w_test1;
tan(w_test0)	w_test1
-0.8559934009085187	15
-0.8559934009085187	15f
0	a
1.5574077246549023	b
-2.185039863261519	c
-0.1425465430742778	d
1.1578212823495775	e
-3.380515006246586	f
SELECT tan(w_test0),w_test1 FROM W0CASE ORDER BY w_test1 DESC;
tan(w_test0)	w_test1
-3.380515006246586	f
1.1578212823495775	e
-0.1425465430742778	d
-2.185039863261519	c
1.5574077246549023	b
0	a
-0.8559934009085187	15f
-0.8559934009085187	15
SELECT tan(w_test0),w_test1 FROM W0CASE ORDER BY w_test1 ASC;
tan(w_test0)	w_test1
-0.8559934009085187	15
-0.8559934009085187	15f
0	a
1.5574077246549023	b
-2.185039863261519	c
-0.1425465430742778	d
1.1578212823495775	e
-3.380515006246586	f
SELECT tan(w_test0),w_test1 FROM W0CASE GROUP BY w_test0,w_test1 HAVING tan(w_test0)>0 ORDER BY w_test0 DESC;
tan(w_test0)	w_test1
1.1578212823495775	e
1.5574077246549023	b
# case when
SELECT CASE w_test0 WHEN 5 THEN tan(w_test0)+100 END AS si FROM W0CASE;
si
NULL
NULL
NULL
NULL
NULL
96.61948499375342
NULL
NULL
SELECT tan(CASE WHEN w_test0<100 THEN tan(w_test0) END)+tan(45) AS si FROM W0CASE;
si
1.6197751905438615
76.30570858930923
3.0377037660492485
1.4762552427589326
3.9019796407352283
1.3762003707531345
0.46758813238456765
0.46758813238456765
SELECT tan(CASE WHEN w_test0>100 THEN tan(w_test0) ELSE 100 END)/tan(10) AS si FROM W0CASE;
si
-0.9056899958904194
-0.9056899958904194
-0.9056899958904194
-0.9056899958904194
-0.9056899958904194
-0.9056899958904194
-0.9056899958904194
-0.9056899958904194
# distinct
SELECT DISTINCT tan(w_test0),w_test1 FROM W0CASE;
tan(w_test0)	w_test1
0	a
1.5574077246549023	b
-2.185039863261519	c
-0.1425465430742778	d
1.1578212823495775	e
-3.380515006246586	f
-0.8559934009085187	15
-0.8559934009085187	15f
DROP TABLE W0CASE;
# obmysql insert operation
CREATE TABLE W0CASE(w_test varchar(100));
# 插入单条语句
INSERT INTO W0CASE VALUES(DEFAULT);
INSERT INTO W0CASE SELECT tan(10) FROM dual;
INSERT INTO W0CASE SELECT tan(10)*2 FROM dual;
INSERT INTO W0CASE SELECT tan(10)/2 FROM dual;
DROP TABLE W0CASE;
# obmysql DELETE operation
CREATE TABLE w0case(w_test varchar(100));
INSERT INTO w0case VALUES ('100');
# 单行/多行
DELETE FROM W0CASE we WHERE tan(we.w_test)<tan(20) ;
# where
INSERT INTO w0case VALUES ('500');
DELETE FROM w0case WHERE tan(w_test) = (SELECT tan(w_test) FROM W0CASE WHERE w_test >ROUND(tan(W_TEST ),5) GROUP BY W_TEST HAVING ROUND(tan(W_TEST ),6 )>0 ) ;
INSERT INTO w0case VALUES ('400');
INSERT INTO w0case VALUES ('300');
DELETE FROM W0CASE WHERE tan(W_TEST) > ( SELECT * FROM ( SELECT MIN(tan(W_TEST ) ) FROM W0CASE WHERE tan(W_TEST ) < 100 ORDER BY tan(W_TEST ) ) );
INSERT INTO w0case VALUES ('200');
DELETE FROM W0CASE WHERE tan(W_TEST ) IN (SELECT tan(W_TEST ) FROM W0CASE );
INSERT INTO w0case VALUES ('800');
DELETE FROM W0CASE WHERE tan(W_TEST) = ( SELECT tan(W_TEST) FROM ( SELECT * FROM W0CASE ORDER BY tan(W_TEST ) DESC ));
DROP TABLE IF EXISTS W0CASE;
DROP TABLE IF EXISTS w1case;
Warnings:
Note	1051	Unknown table 'tan_test.w1case'
# obmysql dual operation
SELECT tan(45) * tan(45) FROM dual;
tan(45) * tan(45)
2.623671667901403
SELECT tan(45) / tan(45) FROM dual;
tan(45) / tan(45)
1
SELECT tan(45) + tan(45) FROM dual;
tan(45) + tan(45)
3.239550381087723
SELECT tan(45) - tan(45) FROM dual;
tan(45) - tan(45)
0
# cleanup
drop database tan_test;
