ob1=OBI(cluster=1:1:1,proxy_num=0,init_unit_cpu=0,locality=HZ:HZ:HZ);
ob1.reboot;
ob1.mysql alter system set syslog_io_bandwidth_limit='3000M';
ob1.mysql alter system set _lcl_op_interval='100ms';
ob1.mysql create resource unit box1 max_cpu 20, min_cpu 10, memory_size '20G', log_disk_size '20G';
ob1.mysql create resource pool pool1 unit = 'box1', unit_num = 1;
ob1.mysql create tenant tt1 replica_num = 3, resource_pool_list=('pool1'), primary_zone='z1,z2;z3' set ob_tcp_invited_nodes='%', ob_compatibility_mode='oracle';
ob1.mysql alter tenant tt1 set variables nls_date_format='YYYY-MM-DD HH24:MI:SS';
ob1.mysql alter tenant tt1 set variables nls_timestamp_format='YYYY-MM-DD HH24:MI:SS.FF';
ob1.mysql alter tenant tt1 set variables nls_timestamp_tz_format='YYYY-MM-DD HH24:MI:SS.FF TZR TZD';
ob1.check_until_timeout select count(*) c from oceanbase.__all_server where start_service_time <= 0 or status = "inactive", 0, 120;
create table parent(c1 int, c2 int, constraint parent_pk primary key (c1));
create table child(c1 int, c2 int, constraint child_fk foreign key (c1) references parent (c1));
insert into parent values (1, 1);
insert into child values (1, 1);
ob1.mysql alter system switch replica leader ls = $ls_id1 server = '$z1_obs0_ip:$z1_obs0_port' tenant='tt1';
ob1.mysql alter system switch replica leader ls = $ls_id2 server = '$z2_obs0_ip:$z2_obs0_port' tenant='tt1';
ob1.check_until_timeout select count(*) from oceanbase.__all_virtual_log_stat where ls_id = $ls_id1 and tenant_id = $tenant_id and role = 'LEADER' and concat(svr_ip, ':', svr_port) like '%$z1_obs0_ip:$z1_obs0_port%', 1, 30;
ob1.check_until_timeout select count(*) from oceanbase.__all_virtual_log_stat where ls_id = $ls_id2 and tenant_id = $tenant_id and role = 'LEADER' and concat(svr_ip, ':', svr_port) like '%$z2_obs0_ip:$z2_obs0_port%', 1, 30;
begin;
select * from parent for update;
C1	C2
1	1
begin;
select * from child for update;
C1	C2
1	1
delete from parent where c1 = 1;
insert into child values(1, 2);
ERROR HY000: OBE-00060: deadlock detected while waiting for resource
rollback;
ERROR 23000: OBE-02292: integrity constraint violated - child record found
rollback;
select * from parent;
C1	C2
1	1
select * from child;
C1	C2
1	1
begin;
select * from parent for update;
C1	C2
1	1
begin;
select * from child for update;
C1	C2
1	1
insert into child values(1, 2);
delete from parent where c1 = 1;
ERROR HY000: OBE-00060: deadlock detected while waiting for resource
rollback;
ERROR 23000: OBE-02292: integrity constraint violated - child record found
rollback;
select * from parent;
C1	C2
1	1
select * from child;
C1	C2
1	1
drop table child;
drop table parent;
