purge recyclebin;
drop database IF EXISTS obljh;
create database obljh ;
use obljh;
set timestamp = 1600000000;
set ob_trx_timeout = 10000000000;
set ob_query_timeout = 10000000000;
set ob_default_lob_inrow_threshold = 0;
alter system set ob_vector_memory_limit_percentage =44;
select avg([]) ;
ERROR 42000: You have an error in your SQL syntax; check the manual that corresponds to your OceanBase version for the right syntax to use near '])' at line 1
select avg([ ]) ;
ERROR 42000: You have an error in your SQL syntax; check the manual that corresponds to your OceanBase version for the right syntax to use near '])' at line 1
drop table if exists t1;
Warnings:
Note	1051	Unknown table 'obljh.t1'
create table t1(c1 vector(1));
insert into t1 values([2]);
insert into t1 values([4]);
insert into t1 values([0]);
insert into t1 values([-100]);
select avg(c1) from t1;
avg(c1)
[-23.5]
select avg([2],[3],[4])AS res;
ERROR 42000: You have an error in your SQL syntax; check the manual that corresponds to your OceanBase version for the right syntax to use near ',[3],[4])AS res' at line 1
select avg([2,3,4], [1,2,3]);
ERROR 42000: You have an error in your SQL syntax; check the manual that corresponds to your OceanBase version for the right syntax to use near ', [1,2,3])' at line 1
select avg([2]);
ERROR 0A000: Not supported feature or function
select avg([-2.1224325435346564]);
ERROR 0A000: Not supported feature or function
select avg([2,2.1224325435346564]);
ERROR 0A000: Not supported feature or function
select avg([-2,2,2.1224325435346564]);
ERROR 0A000: Not supported feature or function
select avg([0,-2,2,2.1224325435346564]);
ERROR 0A000: Not supported feature or function
select avg([1,0,-2,2,2.1224325435346564]);
ERROR 0A000: Not supported feature or function
select avg([0,1,0,-2,2,2.1224325435346564]);
ERROR 0A000: Not supported feature or function
select avg([null,null,null,null,2.323344,0]);
ERROR 0A000: Not supported feature or function
select avg([null,null,null,null,null,null]);
ERROR 0A000: Not supported feature or function
select avg(null);
avg(null)
NULL
select avg([' ',-32323,4333.324344]);
ERROR 0A000: Not supported feature or function
select avg([2,' ',4333.324344]);
ERROR 0A000: Not supported feature or function
select avg([2,-32323,' ']);
ERROR 0A000: Not supported feature or function
select avg([' ',-32323,' ']);
ERROR 0A000: Not supported feature or function
select avg([' ',-32323,' ',' ',2.323344,0]);
ERROR 0A000: Not supported feature or function
select avg([' ',' ',' ',' ',2.323344,0]);
ERROR 0A000: Not supported feature or function
select avg([' ',' ',' ',' ',' ',' ']);
ERROR 0A000: Not supported feature or function
select avg(' ');
avg(' ')
0
select avg([" ",-32323,4333.324344]);
ERROR 0A000: Not supported feature or function
select avg([2," ",4333.324344]);
ERROR 0A000: Not supported feature or function
select avg([2,-32323," "]);
ERROR 0A000: Not supported feature or function
select avg([" ",-32323," ",-1,2.323344,0]);
ERROR 0A000: Not supported feature or function
select avg([" ",-32323," "," ",2.323344,0]);
ERROR 0A000: Not supported feature or function
select avg([" "," "," "," ",2.323344,0]);
ERROR 0A000: Not supported feature or function
select avg([" "," "," "," "," "," "]);
ERROR 0A000: Not supported feature or function
select avg(" ");
avg(" ")
0
#正常值，相当与1, false 相当于0
select avg([true,-32323,4333.324344]);
ERROR 0A000: Not supported feature or function
select avg([false,-32323,4333.324344]);
ERROR 0A000: Not supported feature or function
select avg([2,true,4333.324344]);
ERROR 0A000: Not supported feature or function
select avg([2,-32323,true]);
ERROR 0A000: Not supported feature or function
select avg([true,-32323,true]);
ERROR 0A000: Not supported feature or function
select avg([true,-32323,true,true,2.323344,0]);
ERROR 0A000: Not supported feature or function
select avg([true,true,true,true,2.323344,0]);
ERROR 0A000: Not supported feature or function
select avg([true,true,true,true,true,true]);
ERROR 0A000: Not supported feature or function
select avg([true]);
ERROR 0A000: Not supported feature or function
select avg([22222222222222222222222222222222222222222222222222222222222222222222222222222222222222222222222222222,-32323,4333.324344]);
ERROR 0A000: Not supported feature or function
select avg([1,-22222222222222222222222222222222222222222222222222222222222222222222222222222222222222222222222222222,3]);
ERROR 0A000: Not supported feature or function
select avg([1,2,-22222222222222222222222222222222222222222222222222222222222222222222222222222222222222222222222222222]);
ERROR 0A000: Not supported feature or function
select avg([-1,2.3233444444444444444444444444444444444444444444444444444444444444444444444444444444444444444444,0]);
ERROR 0A000: Not supported feature or function
select avg([a]) as res;
ERROR 42S22: Unknown column 'a' in 'field list'
select avg(['aaa']) as res;
ERROR 0A000: Not supported feature or function
select avg([1,2,3,'aaa','bbb','ccc']) as res;
ERROR 0A000: Not supported feature or function
select avg([1,2,3,'a','b','c']) as res;
ERROR 0A000: Not supported feature or function
select avg([4,'b',6]) as res;
ERROR 0A000: Not supported feature or function
select avg([1,'a']) as res;
ERROR 0A000: Not supported feature or function
select avg(["1010"]) as res;
ERROR 0A000: Not supported feature or function
select avg(["1010",2]) as res;
ERROR 0A000: Not supported feature or function
select avg(["1010","0111"]) as res;
ERROR 0A000: Not supported feature or function
select avg(["1010","0111","1011"]) as res;
ERROR 0A000: Not supported feature or function
select avg(["1100","0111","101010101"]) as res;
ERROR 0A000: Not supported feature or function
select avg(["1010",["0111","1011"]]) as res;
ERROR 22000: Invalid data type for the operation
select avg(10) as res;
res
10.0000
select avg('10') as res;
res
10
select avg([010]) as res;
ERROR 0A000: Not supported feature or function
select avg([01,02]) as res;
ERROR 0A000: Not supported feature or function
select avg([011,012]) as res;
ERROR 0A000: Not supported feature or function
select avg([011,2,3,012,3,4]) as res;
ERROR 0A000: Not supported feature or function
select avg([0o11,0o2,0o3]) as res;
ERROR 42S22: Unknown column '0o11' in 'field list'
select avg(["0o11","0o2","0o3"]) as res;
ERROR 0A000: Not supported feature or function
select avg(["011","02","03"]) as res;
ERROR 0A000: Not supported feature or function
select avg([0x10]) as res;
ERROR 0A000: array element type not supported
select avg(['0x10',0x20]) as res;
ERROR 0A000: array element type not supported
select avg([0x10,2]) as res;
ERROR 0A000: array element type not supported
select avg([1+2]) as res;
ERROR 0A000: Not supported feature or function
select avg([1*2]) as res;
ERROR 0A000: Not supported feature or function
select avg([1/2]) as res;
ERROR 0A000: Not supported feature or function
select avg(['1/2']) as res;
ERROR 0A000: Not supported feature or function
select avg([1%2]) as res;
ERROR 0A000: Not supported feature or function
select avg([1+2,3*4,5/6,7%8]) as res;
ERROR 0A000: Not supported feature or function
##CHAR
drop table if exists t1;
drop table if exists tt1;
drop table if exists tt2;
CREATE TABLE t1 (c1 int PRIMARY KEY, c2 char(30),c3 vector(3));
insert into t1 values(1,'[1,1,2]','[2,2,3]');
insert into t1 values(2,'[2,2,3]','[3,2,3]');
insert into t1 values(3,'[29,2,2]','[3,2,3]');
insert into t1 values(4,'[-1,-2,-2]','[3,2,3]');
select avg(c2) a from t1;
a
0
Warnings:
Warning	1292	Truncated incorrect DOUBLE value: '[1,1,2]'
Warning	1292	Truncated incorrect DOUBLE value: '[2,2,3]'
Warning	1292	Truncated incorrect DOUBLE value: '[29,2,2]'
Warning	1292	Truncated incorrect DOUBLE value: '[-1,-2,-2]'
select avg(c3) a from t1;
a
[2.75,2,3]
create table tt1 as select avg(c3) a from t1;
create table tt2 as select avg(c2) from t1;
ERROR 01000: Truncated incorrect DOUBLE value
##VARCAHR
drop table if exists t1;
drop table if exists tt1;
drop table if exists tt2;
CREATE TABLE t1 (c1 int PRIMARY KEY, c2 VARCHAR(30),c3 vector(3));
insert into t1 values(1,'[1,1,2]','[2,2,3]');
insert into t1 values(2,'[2,2,3]','[3,2,3]');
insert into t1 values(3,'[29,2,2]','[3,2,3]');
insert into t1 values(4,'[-1,-2,-2]','[3,2,3]');
select avg(c2) a from t1;
a
0
Warnings:
Warning	1292	Truncated incorrect DOUBLE value: '[1,1,2]'
Warning	1292	Truncated incorrect DOUBLE value: '[2,2,3]'
Warning	1292	Truncated incorrect DOUBLE value: '[29,2,2]'
Warning	1292	Truncated incorrect DOUBLE value: '[-1,-2,-2]'
select avg(c3) a from t1;
a
[2.75,2,3]
create table tt1 as select avg(c3) a from t1;
create table tt2 as select avg(c2) from t1;
ERROR 01000: Truncated incorrect DOUBLE value
##binary
drop table if exists t1;
drop table if exists tt1;
drop table if exists tt2;
CREATE TABLE t1 (c1 int PRIMARY KEY, c2 binary(32),c3 vector(3));
insert into t1 values(1,'[1,1,2]','[2,2,3]');
insert into t1 values(2,'[2,2,3]','[3,2,3]');
insert into t1 values(3,'[29,2,2]','[3,2,3]');
insert into t1 values(4,'[-1,-2,-2]','[3,2,3]');
select avg(c2) a from t1;
a
0
Warnings:
Warning	1292	Truncated incorrect DOUBLE value: '[1,1,2]'
Warning	1292	Truncated incorrect DOUBLE value: '[2,2,3]'
Warning	1292	Truncated incorrect DOUBLE value: '[29,2,2]'
Warning	1292	Truncated incorrect DOUBLE value: '[-1,-2,-2]'
select avg(c3) a from t1;
a
[2.75,2,3]
create table tt1 as select avg(c3) a from t1;
create table tt2 as select avg(c2) from t1;
ERROR 01000: Truncated incorrect DOUBLE value
##VARBINARY
drop table if exists t1;
drop table if exists tt1;
drop table if exists tt2;
CREATE TABLE t1 (c1 int PRIMARY KEY, c2 VARBINARY(32),c3 vector(3));
insert into t1 values(1,'[1,1,2]','[2,2,3]');
insert into t1 values(2,'[2,2,3]','[3,2,3]');
insert into t1 values(3,'[29,2,2]','[3,2,3]');
insert into t1 values(4,'[-1,-2,-2]','[3,2,3]');
select avg(c2) a from t1;
a
0
Warnings:
Warning	1292	Truncated incorrect DOUBLE value: '[1,1,2]'
Warning	1292	Truncated incorrect DOUBLE value: '[2,2,3]'
Warning	1292	Truncated incorrect DOUBLE value: '[29,2,2]'
Warning	1292	Truncated incorrect DOUBLE value: '[-1,-2,-2]'
select avg(c3) a from t1;
a
[2.75,2,3]
create table tt1 as select avg(c3) a from t1;
create table tt2 as select avg(c2) from t1;
ERROR 01000: Truncated incorrect DOUBLE value
##TINYBLOB
drop table if exists t1;
drop table if exists tt1;
drop table if exists tt2;
CREATE TABLE t1 (c1 int PRIMARY KEY, c2 TINYBLOB,c3 vector(3));
insert into t1 values(1,'[1,1,2]','[2,2,3]');
insert into t1 values(2,'[2,2,3]','[3,2,3]');
insert into t1 values(3,'[29,2,2]','[3,2,3]');
insert into t1 values(4,'[-1,-2,-2]','[3,2,3]');
select avg(c2) a from t1;
a
0
Warnings:
Warning	1292	Truncated incorrect DOUBLE value: '[1,1,2]'
Warning	1292	Truncated incorrect DOUBLE value: '[2,2,3]'
Warning	1292	Truncated incorrect DOUBLE value: '[29,2,2]'
Warning	1292	Truncated incorrect DOUBLE value: '[-1,-2,-2]'
select avg(c3) a from t1;
a
[2.75,2,3]
create table tt1 as select avg(c3) a from t1;
create table tt2 as select avg(c2) from t1;
ERROR 01000: Truncated incorrect DOUBLE value
##BLOB
drop table if exists t1;
drop table if exists tt1;
drop table if exists tt2;
CREATE TABLE t1 (c1 int PRIMARY KEY, c2 BLOB,c3 vector(3));
insert into t1 values(1,'[1,1,2]','[2,2,3]');
insert into t1 values(2,'[2,2,3]','[3,2,3]');
insert into t1 values(3,'[29,2,2]','[3,2,3]');
insert into t1 values(4,'[-1,-2,-2]','[3,2,3]');
select avg(c2) a from t1;
a
0
Warnings:
Warning	1292	Truncated incorrect DOUBLE value: '[1,1,2]'
Warning	1292	Truncated incorrect DOUBLE value: '[2,2,3]'
Warning	1292	Truncated incorrect DOUBLE value: '[29,2,2]'
Warning	1292	Truncated incorrect DOUBLE value: '[-1,-2,-2]'
select avg(c3) a from t1;
a
[2.75,2,3]
create table tt1 as select avg(c3) a from t1;
create table tt2 as select avg(c2) from t1;
ERROR 01000: Truncated incorrect DOUBLE value
##MEDIUMBLOB
drop table if exists t1;
drop table if exists tt1;
drop table if exists tt2;
CREATE TABLE t1 (c1 int PRIMARY KEY, c2 MEDIUMBLOB,c3 vector(3));
insert into t1 values(1,'[1,1,2]','[2,2,3]');
insert into t1 values(2,'[2,2,3]','[3,2,3]');
insert into t1 values(3,'[29,2,2]','[3,2,3]');
insert into t1 values(4,'[-1,-2,-2]','[3,2,3]');
select avg(c2) a from t1;
a
0
Warnings:
Warning	1292	Truncated incorrect DOUBLE value: '[1,1,2]'
Warning	1292	Truncated incorrect DOUBLE value: '[2,2,3]'
Warning	1292	Truncated incorrect DOUBLE value: '[29,2,2]'
Warning	1292	Truncated incorrect DOUBLE value: '[-1,-2,-2]'
select avg(c3) a from t1;
a
[2.75,2,3]
create table tt1 as select avg(c3) a from t1;
create table tt2 as select avg(c2) from t1;
ERROR 01000: Truncated incorrect DOUBLE value
##LONGBLOB
drop table if exists t1;
drop table if exists tt1;
drop table if exists tt2;
CREATE TABLE t1 (c1 int PRIMARY KEY, c2 LONGBLOB,c3 vector(3));
insert into t1 values(1,'[1,1,2]','[2,2,3]');
insert into t1 values(2,'[2,2,3]','[3,2,3]');
insert into t1 values(3,'[29,2,2]','[3,2,3]');
insert into t1 values(4,'[-1,-2,-2]','[3,2,3]');
select avg(c2) a from t1;
a
0
Warnings:
Warning	1292	Truncated incorrect DOUBLE value: '[1,1,2]'
Warning	1292	Truncated incorrect DOUBLE value: '[2,2,3]'
Warning	1292	Truncated incorrect DOUBLE value: '[29,2,2]'
Warning	1292	Truncated incorrect DOUBLE value: '[-1,-2,-2]'
select avg(c3) a from t1;
a
[2.75,2,3]
create table tt1 as select avg(c3) a from t1;
create table tt2 as select avg(c2) from t1;
ERROR 01000: Truncated incorrect DOUBLE value
##TINYTEXT
drop table if exists t1;
drop table if exists tt1;
drop table if exists tt2;
CREATE TABLE t1 (c1 int PRIMARY KEY, c2 TINYTEXT,c3 vector(3));
insert into t1 values(1,'[1,1,2]','[2,2,3]');
insert into t1 values(2,'[2,2,3]','[3,2,3]');
insert into t1 values(3,'[29,2,2]','[3,2,3]');
insert into t1 values(4,'[-1,-2,-2]','[3,2,3]');
select avg(c2) a from t1;
a
0
Warnings:
Warning	1292	Truncated incorrect DOUBLE value: '[1,1,2]'
Warning	1292	Truncated incorrect DOUBLE value: '[2,2,3]'
Warning	1292	Truncated incorrect DOUBLE value: '[29,2,2]'
Warning	1292	Truncated incorrect DOUBLE value: '[-1,-2,-2]'
select avg(c3) a from t1;
a
[2.75,2,3]
create table tt1 as select avg(c3) a from t1;
create table tt2 as select avg(c2) from t1;
ERROR 01000: Truncated incorrect DOUBLE value
##TEXT
drop table if exists t1;
drop table if exists tt1;
drop table if exists tt2;
CREATE TABLE t1 (c1 int PRIMARY KEY, c2 TEXT,c3 vector(3));
insert into t1 values(1,'[1,1,2]','[2,2,3]');
insert into t1 values(2,'[2,2,3]','[3,2,3]');
insert into t1 values(3,'[29,2,2]','[3,2,3]');
insert into t1 values(4,'[-1,-2,-2]','[3,2,3]');
select avg(c2) a from t1;
a
0
Warnings:
Warning	1292	Truncated incorrect DOUBLE value: '[1,1,2]'
Warning	1292	Truncated incorrect DOUBLE value: '[2,2,3]'
Warning	1292	Truncated incorrect DOUBLE value: '[29,2,2]'
Warning	1292	Truncated incorrect DOUBLE value: '[-1,-2,-2]'
select avg(c3) a from t1;
a
[2.75,2,3]
create table tt1 as select avg(c3) a from t1;
create table tt2 as select avg(c2) from t1;
ERROR 01000: Truncated incorrect DOUBLE value
##MEDIUMTEXT
drop table if exists t1;
drop table if exists tt1;
drop table if exists tt2;
CREATE TABLE t1 (c1 int PRIMARY KEY, c2 MEDIUMTEXT,c3 vector(3));
insert into t1 values(1,'[1,1,2]','[2,2,3]');
insert into t1 values(2,'[2,2,3]','[3,2,3]');
insert into t1 values(3,'[29,2,2]','[3,2,3]');
insert into t1 values(4,'[-1,-2,-2]','[3,2,3]');
select avg(c2) a from t1;
a
0
Warnings:
Warning	1292	Truncated incorrect DOUBLE value: '[1,1,2]'
Warning	1292	Truncated incorrect DOUBLE value: '[2,2,3]'
Warning	1292	Truncated incorrect DOUBLE value: '[29,2,2]'
Warning	1292	Truncated incorrect DOUBLE value: '[-1,-2,-2]'
select avg(c3) a from t1;
a
[2.75,2,3]
create table tt1 as select avg(c3) a from t1;
create table tt2 as select avg(c2) from t1;
ERROR 01000: Truncated incorrect DOUBLE value
##LONGTEXT
drop table if exists t1;
drop table if exists tt1;
drop table if exists tt2;
CREATE TABLE t1 (c1 int PRIMARY KEY, c2 LONGTEXT,c3 vector(3));
insert into t1 values(1,'[1,1,2]','[2,2,3]');
insert into t1 values(2,'[2,2,3]','[3,2,3]');
insert into t1 values(3,'[29,2,2]','[3,2,3]');
insert into t1 values(4,'[-1,-2,-2]','[3,2,3]');
select avg(c2) a from t1;
a
0
Warnings:
Warning	1292	Truncated incorrect DOUBLE value: '[1,1,2]'
Warning	1292	Truncated incorrect DOUBLE value: '[2,2,3]'
Warning	1292	Truncated incorrect DOUBLE value: '[29,2,2]'
Warning	1292	Truncated incorrect DOUBLE value: '[-1,-2,-2]'
select avg(c3) a from t1;
a
[2.75,2,3]
create table tt1 as select avg(c3) a from t1;
create table tt2 as select avg(c2) from t1;
ERROR 01000: Truncated incorrect DOUBLE value
select l2_distance([max(100),1,3],'[1,1,2]') from dual;
l2_distance([max(100),1,3],'[1,1,2]')
99.00505037623081
select l2_distance([count(100),1,3],'[1,1,2]') from dual;
l2_distance([count(100),1,3],'[1,1,2]')
1
select l2_distance([min(100),1,3],'[1,1,2]') from dual;
l2_distance([min(100),1,3],'[1,1,2]')
99.00505037623081
select l2_distance([sum(100),1,3],'[1,1,2]') from dual;
l2_distance([sum(100),1,3],'[1,1,2]')
99.00505037623081
select l2_distance([avg(100),1,3],'[1,1,2]') from dual;
l2_distance([avg(100),1,3],'[1,1,2]')
99.00505037623081
create table table_max as select l2_distance([max(100),1,3],'[1,1,2]') from dual;
create table table_count as select l2_distance([count(100),1,3],'[1,1,2]') from dual;
create table table_min as select l2_distance([min(100),1,3],'[1,1,2]') from dual;
create table table_sum as select l2_distance([sum(100),1,3],'[1,1,2]') from dual;
create table table_avg as select l2_distance([avg(100),1,3],'[1,1,2]') from dual;
##where子句
drop table if exists t1;
drop table if exists tt1;
drop table if exists tt2;
CREATE TABLE t1 (c1 int AUTO_INCREMENT primary key , c2 vector(3),c3 vector(3) ,c4 BLOB,
VECTOR INDEX vector_idx(c3) 
WITH (distance=l2, lib=vsag, type=hnsw, m=10, ef_construction=100, ef_search=40));
select * from t1 where avg(c2);
ERROR HY000: Invalid use of group function
##=,<,<=,>=,<>
drop table if exists t1;
drop table if exists tt1;
drop table if exists tt2;
CREATE TABLE t1 (c1 int primary key, c2 VARCHAR(30),c3 vector(3) ,c4 vector(2));
insert into t1 values(1,'[1,1,2]','[2,2,3]','[1,3]');
insert into t1 values(2,'[1,2,3]','[1,2,3]','[2,3]');
insert into t1 values(3,'[-1,2,2]','[-3,2,3]','[4,3]');
insert into t1 values(4,'[-1,-2,-2]','[-4,2,3]',null);
insert into t1 values(5,'[-1,-2,-2]',null,'[2,3]');
select avg(c3) = avg(c2) from t1  order by c1;
ERROR 22000: Invalid data type for the operation
select avg(c3) = avg(c3) from t1  order by c1;
avg(c3) = avg(c3)
1
select avg(c3) < avg(c3) from t1  order by c1;
ERROR 22000: Invalid data type for the operation
select avg(c3) > avg(c3) from t1  order by c1;
ERROR 22000: Invalid data type for the operation
select avg(c3) >= avg(c3) from t1  order by c1;
ERROR 22000: Invalid data type for the operation
select avg(c3) <= avg(c3) from t1  order by c1;
ERROR 22000: Invalid data type for the operation
select avg(c3) <> avg(c3) from t1  order by c1;
avg(c3) <> avg(c3)
0
##and/or
drop table if exists t1;
drop table if exists tt1;
drop table if exists tt2;
CREATE TABLE t1 (c1 int primary key, c2 VARCHAR(30),c3 vector(3) ,c4 vector(3),
VECTOR INDEX vector_idx(c3) 
WITH (distance=l2, lib=vsag, type=hnsw, m=10, ef_construction=100, ef_search=40),
VECTOR INDEX vector_idx1(c4) 
WITH (distance=l2, lib=vsag, type=hnsw, m=10, ef_construction=100, ef_search=40));
insert into t1 values(1,'[1,1,2]','[2,2,3]','[1,-1.5,3]');
insert into t1 values(2,'[1,2,3]','[1,2,3]','[2,1.5,3]');
insert into t1 values(3,'[-1,2,2]','[-3,2,3]','[4,-1,3]');
insert into t1 values(4,'[-1,-2,-2]','[-4,2,3]',null);
insert into t1 values(5,'[-1,-2,-2]',null,'[2,-2,3]');
select avg(c3),avg(c4) from t1 where l2_distance(c3,c3) =0 and l2_distance(c3,c4) is  null order by c1;
avg(c3)	avg(c4)
[-4,2,3]	NULL
select avg(c3)+avg(c4) from t1 where l2_distance(c3,c3) <=2 or l2_distance(c3,c2) >1 ;
avg(c3)+avg(c4)
[1.33333,1.66667,6]
##between and
drop table if exists t1;
drop table if exists tt1;
drop table if exists tt2;
CREATE TABLE t1 (c1 int primary key, c2 VARCHAR(30),c3 vector(3) ,c4 vector(2),
VECTOR INDEX vector_idx(c3) 
WITH (distance=l2, lib=vsag, type=hnsw, m=10, ef_construction=100, ef_search=40));
insert into t1 values(1,'[1,1,2]','[2,2,3]','[1,3]');
insert into t1 values(2,'[1,2,3]','[1,2,3]','[2,3]');
insert into t1 values(3,'[-1,2,2]','[-3,2,3]','[4,3]');
insert into t1 values(4,'[-1,-2,-2]','[-4,2,3]',null);
insert into t1 values(5,'[-1,-2,-2]',null,'[2,3]');
select  avg(c3),avg(c4) from t1 where 1 BETWEEN l2_distance(c3,c3)  and l2_distance(c3,'[1,2,3]') order by l2_distance(c3, [1,2,3])  limit 10;
avg(c3)	avg(c4)
[-1.66667,2,3]	[2.5,3]
select  avg(c3),avg(c4) from t1 where 1 BETWEEN l2_distance(c3,c3)  and l2_distance(c3,'[1,2,3]') order by l2_distance(c3, [1,2,3]) approximate limit 10;
avg(c3)	avg(c4)
[-1.66667,2,3]	[2.5,3]
select  l2_distance(avg(c3),'[1,2.2,3]') BETWEEN l2_distance(avg(c3),c3)  and l2_distance(avg(c3),'[1,2,3]') from t1 order by l2_distance(c3, [1,2,3])  limit 10;
l2_distance(avg(c3),'[1,2.2,3]') BETWEEN l2_distance(avg(c3),c3)  and l2_distance(avg(c3),'[1,2,3]')
0
select  l2_distance(avg(c4),'[1,3]') BETWEEN l2_distance(avg(c3),c3)  and l2_distance(avg(c3),'[1,2,3]') from t1 order by l2_distance(c3, [1,2,3]) approximate limit 10;
l2_distance(avg(c4),'[1,3]') BETWEEN l2_distance(avg(c3),c3)  and l2_distance(avg(c3),'[1,2,3]')
0
##like/not like
drop table if exists t1;
drop table if exists tt1;
drop table if exists tt2;
CREATE TABLE t1 (c1 int primary key, c2 VARCHAR(30),c3 vector(3) ,c4 vector(2),
VECTOR INDEX vector_idx(c3) 
WITH (distance=l2, lib=vsag, type=hnsw, m=10, ef_construction=100, ef_search=40));
insert into t1 values(1,'[1,1,2]','[2,2,3]','[1,3]');
insert into t1 values(2,'[1,0,3]','[1,0,3]','[2,3]');
insert into t1 values(3,'[-1,2,2]','[-3,2,3]','[4,3]');
insert into t1 values(4,'[-1,-2,-2]','[-4,2,3]',null);
insert into t1 values(5,'[-1,-3,-2]',null,'[2,3]');
select  avg(c3),avg(c4) from t1 where l2_distance(c3,c3) like '%0%' order by l2_distance(c3, [1,2,3])  limit 10;
avg(c3)	avg(c4)
[-1,1.5,3]	[2.33333,3]
select  avg(c3),avg(c4) from t1 where l2_distance(c3,c3) like l2_distance(c3,c2) order by l2_distance(c3, [1,2,3]) approximate limit 10;
avg(c3)	avg(c4)
[1,0,3]	[2,3]
select  * from t1 where l2_distance(c3,c3) not like '%1%' order by c1;
c1	c2	c3	c4
1	[1,1,2]	[2,2,3]	[1,3]
2	[1,0,3]	[1,0,3]	[2,3]
3	[-1,2,2]	[-3,2,3]	[4,3]
4	[-1,-2,-2]	[-4,2,3]	NULL
select  * from t1 where l2_distance(c3,c3) not like l2_distance(c3,c2) order by c1;
c1	c2	c3	c4
1	[1,1,2]	[2,2,3]	[1,3]
3	[-1,2,2]	[-3,2,3]	[4,3]
4	[-1,-2,-2]	[-4,2,3]	NULL
##exists,any,all,in(无关键字)
drop table if exists t1;
drop table if exists tt1;
drop table if exists tt2;
CREATE TABLE t1 (c1 int primary key, c2 VARCHAR(30),c3 vector(3) ,c4 vector(3),
VECTOR INDEX vector_idx(c3) 
WITH (distance=l2, lib=vsag, type=hnsw, m=10, ef_construction=100, ef_search=40));
insert into t1 values(1,'[1,1,2]','[2,2,3]','[1,3,2]');
insert into t1 values(2,'[1,0,3]','[1,0,3]','[2,3,2]');
insert into t1 values(3,'[-1,2,2]','[-3,2,3]','[4,3,3]');
insert into t1 values(4,'[-1,-2,-2]','[-4,2,3]',null);
insert into t1 values(5,'[-1,-3,-2]',null,'[2,3,1]');
SELECT avg(c3),avg(c4) from t1 where  EXISTS (SELECT l2_distance(c3,[1,null,1]) FROM t1) order by c1;
avg(c3)	avg(c4)
[-1,1.5,3]	[2.25,3,2]
SELECT avg(c3),avg(c4) from t1 where  EXISTS (SELECT c3 FROM t1) order by c1;
avg(c3)	avg(c4)
[-1,1.5,3]	[2.25,3,2]
SELECT avg(c3),avg(c4) from t1 where l2_distance(c3,c3) = any (SELECT l2_distance(c3,[1,-1,1]) FROM t1) order by c1;
avg(c3)	avg(c4)
NULL	NULL
SELECT avg(c3),avg(c4) from t1 where l2_distance(c3,c3) >= any (SELECT l2_distance(c3,[1,-1,1]) FROM t1) order by c1;
avg(c3)	avg(c4)
NULL	NULL
SELECT avg(c3),avg(c4) from t1 where l2_distance(c3,c3) <= any (SELECT l2_distance(c3,[1,-1,1]) FROM t1) order by c1;
avg(c3)	avg(c4)
[-1,1.5,3]	[2.33333,3,2.33333]
SELECT avg(c3),avg(c4) from t1 where l2_distance(c3,c3) <> any (SELECT l2_distance(c3,[1,-1,1]) FROM t1) order by c1;
avg(c3)	avg(c4)
[-1,1.5,3]	[2.33333,3,2.33333]
SELECT avg(c3),avg(c4) from t1 where l2_distance(c3,c3) != any (SELECT l2_distance(c3,[1,-1,1]) FROM t1) order by c1;
avg(c3)	avg(c4)
[-1,1.5,3]	[2.33333,3,2.33333]
SELECT avg(c3),avg(c4) from t1 where l2_distance(c3,c3) > any (SELECT l2_distance(c3,[1,-1,1]) FROM t1) order by c1;
avg(c3)	avg(c4)
NULL	NULL
SELECT avg(c3),avg(c4) from t1 where l2_distance(c3,c3) < any (SELECT l2_distance(c3,[1,-1,1]) FROM t1) order by c1;
avg(c3)	avg(c4)
[-1,1.5,3]	[2.33333,3,2.33333]
SELECT avg(c3),avg(c4) from t1 where l2_distance(c3,c3) in (l2_distance(c3,c3),l2_distance(c3,c4)) order by c1;
avg(c3)	avg(c4)
[-1,1.5,3]	[2.33333,3,2.33333]
SELECT avg(c3),avg(c4) from t1 where l2_distance(c3,c3) not in (l2_distance(c3,'[1,2,3]'),l2_distance(c4,'[1,2,3]')) order by c1;
avg(c3)	avg(c4)
[0,1.33333,3]	[2.33333,3,2.33333]
SELECT avg(c3),avg(c4) from t1 where l2_distance(c3,c3) not in (SELECT l2_distance(c3,'[1,2,3]')FROM t1) order by c1;
avg(c3)	avg(c4)
NULL	NULL
##exists,any,all,in(存在关键字APPROXIMATE|APPROX)
drop table if exists t1;
drop table if exists tt1;
drop table if exists tt2;
CREATE TABLE t1 (c1 int primary key, c2 VARCHAR(30),c3 vector(3) ,c4 vector(3),
VECTOR INDEX vector_idx(c3) 
WITH (distance=l2, lib=vsag, type=hnsw, m=10, ef_construction=100, ef_search=40));
insert into t1 values(1,'[1,1,2]','[2,2,3]','[1,3,2]');
insert into t1 values(2,'[1,0,3]','[1,0,3]','[2,3,2]');
insert into t1 values(3,'[-1,2,2]','[-3,2,3]','[4,3,3]');
insert into t1 values(4,'[-1,-2,-2]','[-4,2,3]',null);
insert into t1 values(5,'[-1,-3,-2]',null,'[2,3,1]');
SELECT avg(c3),avg(c4) from t1 where  EXISTS (SELECT l2_distance(c3,[1,1,1]) FROM t1 order by l2_distance(c3, [1,2,3])  limit 10 ) order by c1;
avg(c3)	avg(c4)
[-1,1.5,3]	[2.25,3,2]
SELECT avg(c3),avg(c4) from t1 where  EXISTS (SELECT l2_distance(c3,[1,1,1]) FROM t1 order by l2_distance(c3, [1,2,3]) approximate limit 10 ) order by c1;
avg(c3)	avg(c4)
[-1,1.5,3]	[2.25,3,2]
SELECT avg(c3),avg(c4) from t1 where  EXISTS (SELECT c3 FROM t1 order by l2_distance(c3, [1,2,3]) approximate limit 10 ) order by c1;
avg(c3)	avg(c4)
[-1,1.5,3]	[2.25,3,2]
SELECT avg(c3),avg(c4) from t1 where l2_distance(c3,c3) = any (SELECT l2_distance(c3,[1,-1,1]) FROM t1 order by l2_distance(c3, [1,2,3]) approximate limit 10) order by c1;
avg(c3)	avg(c4)
NULL	NULL
SELECT avg(c3),avg(c4) from t1 where l2_distance(c3,c3) >= any (SELECT l2_distance(c3,[1,-1,1]) FROM t1 order by l2_distance(c3, [1,2,3]) approximate limit 10 ) order by c1;
avg(c3)	avg(c4)
NULL	NULL
SELECT avg(c3),avg(c4) from t1 where l2_distance(c3,c3) <= any (SELECT l2_distance(c3,[1,-1,1]) FROM t1 order by l2_distance(c3, [1,2,3]) approximate limit 10 ) order by c1;
avg(c3)	avg(c4)
[-1,1.5,3]	[2.33333,3,2.33333]
SELECT avg(c3),avg(c4) from t1 where l2_distance(c3,c3) <> any (SELECT l2_distance(c3,[1,-1,1]) FROM t1 order by l2_distance(c3, [1,2,3]) approximate limit 10 ) order by c1;
avg(c3)	avg(c4)
[-1,1.5,3]	[2.33333,3,2.33333]
SELECT avg(c3),avg(c4) from t1 where l2_distance(c3,c3) != any (SELECT l2_distance(c3,[1,-1,1]) FROM t1 order by l2_distance(c3, [1,2,3]) approximate limit 10 ) order by c1;
avg(c3)	avg(c4)
[-1,1.5,3]	[2.33333,3,2.33333]
SELECT avg(c3),avg(c4) from t1 where l2_distance(c3,c3) > any (SELECT l2_distance(c3,[1,-1,1]) FROM t1 order by l2_distance(c3, [1,2,3]) approximate limit 10 ) order by c1;
avg(c3)	avg(c4)
NULL	NULL
SELECT avg(c3),avg(c4) from t1 where l2_distance(c3,c3) < any (SELECT l2_distance(c3,[1,-1,1]) FROM t1 order by l2_distance(c3, [1,2,3]) approximate limit 10 ) order by c1;
avg(c3)	avg(c4)
[-1,1.5,3]	[2.33333,3,2.33333]
##多表join
drop table if exists t1;
drop table if exists tt1;
drop table if exists tt2;
CREATE TABLE t1 (c1 int primary key, c2 vector(3),c3 vector(3) ,c4 vector(3));
insert into t1 values(1,'[1,1,2]','[2,2,3]','[1,3,2]');
insert into t1 values(2,'[1,0,3]','[1,0,3]','[2,3,2]');
insert into t1 values(3,'[-1,2,2]','[-3,2,3]','[4,3,3]');
insert into t1 values(4,'[-1,-2,-2]','[-4,2,3]',null);
insert into t1 values(5,'[-1,-3,-2]',null,'[2,3,1]');
drop table if exists t2;
Warnings:
Note	1051	Unknown table 'obljh.t2'
CREATE TABLE t2 (a1 int , a2 vector(3),a3 vector(3) ,a4 vector(3));
insert into t2 select c1,c2,c3,c4 from t1;
select avg(c3),avg(c4) from t1 union  select avg(a3),avg(a4) from t2;
avg(c3)	avg(c4)
[-1,1.5,3]	[2.25,3,2]
##结合聚合函数使用关键字
drop table if exists t1;
drop table if exists tt1;
drop table if exists tt2;
CREATE TABLE t1 (c1 int primary key, c2 vector(3),c3 vector(3) ,c4 vector(3),
VECTOR INDEX vector_idx(c3) 
WITH (distance=l2, lib=vsag, type=hnsw, m=10, ef_construction=100, ef_search=40));
insert into t1 values(1,'[1,1,2]','[2,2,3]','[1,3,2]');
insert into t1 values(2,'[1,0,3]','[1,0,3]','[2,3,2]');
insert into t1 values(3,'[-1,2,2]','[-3,2,3]','[4,3,3]');
insert into t1 values(4,'[-1,-2,-2]','[-4,2,3]',null);
insert into t1 values(5,'[-1,-3,-2]',null,'[2,3,1]');
select c1,c2,l2_distance(c3,c2),count(c2),avg(c3) from t1 order by l2_distance(c3, [1,2,3]) APPROX limit 10;
c1	c2	l2_distance(c3,c2)	count(c2)	avg(c3)
1	[1,1,2]	1.7320508075688772	5	[-1,1.5,3]
select c1,c2,l2_distance(c3,c2),avg(c2) from t1 order by l2_distance(c3, [1,2,3]) APPROX limit 10;
c1	c2	l2_distance(c3,c2)	avg(c2)
1	[1,1,2]	1.7320508075688772	[-0.2,-0.4,0.6]
select c1,c2,l2_distance(c3,c2),sum(c2),avg(c3) from t1 order by l2_distance(c3, [1,2,3]) APPROX limit 10;
c1	c2	l2_distance(c3,c2)	sum(c2)	avg(c3)
1	[1,1,2]	1.7320508075688772	[-1,-2,3]	[-1,1.5,3]
select  l2_distance(c2, c3),avg(c3) from t1 order by l2_distance(c3, [1,2,3]) APPROX limit 10;
l2_distance(c2, c3)	avg(c3)
1.7320508075688772	[-1,1.5,3]
select c1,c2,l2_distance(c3,c2),avg(c3) from t1 order by l2_distance(c3, [1,2,3]) APPROX limit 10;
c1	c2	l2_distance(c3,c2)	avg(c3)
1	[1,1,2]	1.7320508075688772	[-1,1.5,3]
drop table if exists t1;
drop table if exists tt1;
drop table if exists tt2;
CREATE TABLE t1 (c1 int primary key, c2 vector(3),c3 vector(3) ,c4 vector(3),
VECTOR INDEX vector_idx(c3) 
WITH (distance=l2, lib=vsag, type=hnsw, m=10, ef_construction=100, ef_search=40));
insert into t1 values(1,'[1,1,2]','[2,2,3]','[1,3,2]');
insert into t1 values(2,'[1,0,3]','[1,0,3]','[2,3,2]');
insert into t1 values(3,'[-1,2,2]','[-3,2,3]','[4,3,3]');
insert into t1 values(4,'[-1,-2,-2]','[-4,2,3]',null);
insert into t1 values(5,'[-1,-3,-2]',null,'[2,3,1]');
drop table if exists t2;
CREATE TABLE t2 (a1 int , a2 vector(3),a3 vector(3) ,a4 vector(3),
VECTOR INDEX vector_idx(a3) 
WITH (distance=l2, lib=vsag, type=hnsw, m=10, ef_construction=100, ef_search=40));
insert into t2 select c1,c2,c3,c4 from t1;
select avg(c3),avg(c4) from t1 a join t2 b on c3=a3 order by l2_distance(c3, [1,2,3]) approximate limit 10;
avg(c3)	avg(c4)
[-1,1.5,3]	[2.33333,3,2.33333]
select avg(c3),avg(c4) from t1 a join t2 b on c2=a2 order by l2_distance(c3, [1,2,3]) approximate limit 10;
avg(c3)	avg(c4)
[-1,1.5,3]	[2.25,3,2]
explain select avg(c3),avg(c4) from t1 a join t2 b on c2=a2 order by l2_distance(c3, [1,2,3]) approximate limit 10;
Query Plan
=====================================================
|ID|OPERATOR             |NAME|EST.ROWS|EST.TIME(us)|
-----------------------------------------------------
|0 |LIMIT                |    |1       |57          |
|1 |└─SCALAR GROUP BY    |    |1       |57          |
|2 |  └─HASH JOIN        |    |5       |57          |
|3 |    ├─TABLE FULL SCAN|b   |5       |3           |
|4 |    └─TABLE FULL SCAN|a   |5       |3           |
=====================================================
Outputs & filters:
-------------------------------------
  0 - output([cast(T_FUN_SUM(a.c3) / cast(T_FUN_COUNT(a.c3), FLOAT(-1, -1)), ARRAY(18, 0))], [cast(T_FUN_SUM(a.c4) / cast(T_FUN_COUNT(a.c4), FLOAT(-1, -1)),
       ARRAY(18, 0))]), filter(nil), rowset=16
      limit(10), offset(nil)
  1 - output([T_FUN_SUM(a.c3)], [T_FUN_COUNT(a.c3)], [T_FUN_SUM(a.c4)], [T_FUN_COUNT(a.c4)]), filter(nil), rowset=16
      group(nil), agg_func([T_FUN_SUM(a.c3)], [T_FUN_COUNT(a.c3)], [T_FUN_SUM(a.c4)], [T_FUN_COUNT(a.c4)])
  2 - output([a.c3], [a.c4]), filter(nil), rowset=16
      equal_conds([a.c2 = b.a2]), other_conds(nil)
  3 - output([b.a2]), filter(nil), rowset=16
      access([b.a2]), partitions(p0)
      is_index_back=false, is_global_index=false, 
      range_key([b.__pk_increment]), range(MIN ; MAX)always true
  4 - output([a.c3], [a.c2], [a.c4]), filter(nil), rowset=16
      access([a.c3], [a.c2], [a.c4]), partitions(p0)
      is_index_back=false, is_global_index=false, 
      range_key([a.c1]), range(MIN ; MAX)always true
select avg(c3),avg(c4) from t1 a join t2 b on c2+a3=a2+c2 order by c1;
avg(c3)	avg(c4)
[-1,1.5,3]	[2.25,3,2]
drop table if exists t1;
drop table if exists tt1;
drop table if exists tt2;
CREATE TABLE t1 (c1 int primary key, c2 vector(3),c3 vector(3) ,c4 vector(3),
VECTOR INDEX vector_idx(c3) 
WITH (distance=l2, lib=vsag, type=hnsw, m=10, ef_construction=100, ef_search=40));
insert into t1 values(1,'[1,1,2]','[2,2,3]','[1,3,2]');
insert into t1 values(2,'[1,0,3]','[1,0,3]','[2,3,2]');
insert into t1 values(3,'[-1,2,2]','[-3,2,3]','[4,3,3]');
insert into t1 values(4,'[-1,-2,-2]','[-4,2,3]',null);
insert into t1 values(5,'[-1,-3,-2]',null,'[2,3,1]');
select avg(c3),avg(c4) from t1 a  order by l2_distance(a.c3, [1,2,3]) approximate limit 10;
avg(c3)	avg(c4)
[-1,1.5,3]	[2.25,3,2]
select avg(c3),avg(c4) from t1 a  order by l2_distance(a.c3, [1,2,3])  limit 10;
avg(c3)	avg(c4)
[-1,1.5,3]	[2.25,3,2]
drop table if exists t1;
drop table if exists tt1;
drop table if exists tt2;
CREATE TABLE t1 (c1 int primary key, c2 vector(3),c3 vector(3) ,c4 vector(3),
VECTOR INDEX vector_idx(c3) 
WITH (distance=l2, lib=vsag, type=hnsw, m=10, ef_construction=100, ef_search=40));
insert into t1 values(1,'[1,1,2]','[2,2,3]','[1,3,2]');
insert into t1 values(2,'[1,0,3]','[1,0,3]','[2,3,2]');
insert into t1 values(3,'[-1,2,2]','[-3,2,3]','[4,3,3]');
insert into t1 values(4,'[-1,-2,-2]','[-4,2,3]',null);
select avg(c3),avg(c4) from t1 a  order by l2_distance(a.c3, [1,2,3]) approximate limit 1,1;
avg(c3)	avg(c4)
select avg(c3),avg(c4) from t1 a  order by l2_distance(a.c3, [1,2,3])  limit 1,1;
avg(c3)	avg(c4)
drop table if exists t1;
CREATE TABLE t1 (c1 int primary key, c2 vector(3),c3 vector(3) ,c4 vector(3),
VECTOR INDEX vector_idx(c3) 
WITH (distance=l2, lib=vsag, type=hnsw, m=10, ef_construction=100, ef_search=40));
insert into t1 values(1,'[1,1,2]','[2,2,3]','[1,3,2]');
insert into t1 values(2,'[1,0,3]','[1,0,3]','[2,3,2]');
insert into t1 values(3,'[-1,2,2]','[-3,2,3]','[4,3,3]');
insert into t1 values(4,'[-1,-2,-2]','[-4,2,3]',null);
insert into t1 values(5,'[-1,-3,-2]',null,'[2,3,1]');
drop table if exists t2;
CREATE TABLE t2 (a1 int , a2 vector(3),a3 vector(3) ,a4 vector(3),
VECTOR INDEX vector_idx(a3) 
WITH (distance=l2, lib=vsag, type=hnsw, m=10, ef_construction=100, ef_search=40));
insert into t2 select c1,c2,c3,c4 from t1;
select avg(c3),avg(c4) from t1 a  order by l2_distance(a.c3, [1,2,3]) approximate limit 10;
avg(c3)	avg(c4)
[-1,1.5,3]	[2.25,3,2]
select avg(c3),avg(c4) from t1 a  order by l2_distance(a.c3, [1,2,3])  limit 10;
avg(c3)	avg(c4)
[-1,1.5,3]	[2.25,3,2]
select avg(c3),avg(c4) from t1 a join t2 b on c2=a2 order by l2_distance(a.c3, [1,2,3]) approximate limit 10;
avg(c3)	avg(c4)
[-1,1.5,3]	[2.25,3,2]
select avg(c3),avg(c4) from t1 a join t2 b on c2=a2 order by l2_distance(a.c3, [1,2,3])  limit 10;
avg(c3)	avg(c4)
[-1,1.5,3]	[2.25,3,2]
select c1,c2,c3,c4,l2_distance(a3,c2),avg(c3),avg(c4) from t1 a join t2 b on c2=a2  order by l2_distance(a3,c2);
c1	c2	c3	c4	l2_distance(a3,c2)	avg(c3)	avg(c4)
1	[1,1,2]	[2,2,3]	[1,3,2]	1.7320508075688772	[-1,1.5,3]	[2.25,3,2]
select c1,c2,c3,c4,l2_distance(a3,c2),avg(c3),avg(c4) from t1 a join t2 b on l2_distance(c2,c3)=l2_distance(a3,a4)  order by l2_distance(a3,c2);
c1	c2	c3	c4	l2_distance(a3,c2)	avg(c3)	avg(c4)
1	[1,1,2]	[2,2,3]	[1,3,2]	1.7320508075688772	[-1,2,3]	[1,3,2]
select c1,c2,c3,c4,l2_distance(a3,c2),avg(c3),avg(c4) from t1 a inner join t2 b on l2_distance(c2,c3)=l2_distance(a3,a4)  order by l2_distance(a3,c2);
c1	c2	c3	c4	l2_distance(a3,c2)	avg(c3)	avg(c4)
1	[1,1,2]	[2,2,3]	[1,3,2]	1.7320508075688772	[-1,2,3]	[1,3,2]
select c1,c2,c3,c4,l2_distance(a3,c2),avg(c3),avg(c4) from t1 a right join t2 b on l2_distance(c2,c3)=l2_distance(a3,a4)  order by l2_distance(a3,c2);
c1	c2	c3	c4	l2_distance(a3,c2)	avg(c3)	avg(c4)
1	[1,1,2]	[2,2,3]	[1,3,2]	1.7320508075688772	[-1,2,3]	[1,3,2]
select c1,c2,c3,c4,l2_distance(a3,c2),avg(c3),avg(c4) from t1 a left join t2 b on l2_distance(c2,c3)=l2_distance(a3,a4)  order by l2_distance(a3,c2);
c1	c2	c3	c4	l2_distance(a3,c2)	avg(c3)	avg(c4)
1	[1,1,2]	[2,2,3]	[1,3,2]	1.7320508075688772	[-1,1.5,3]	[2.25,3,2]
select c1,c2,c3,c4,l2_distance(a3,c2),avg(c3),avg(c4) from t1 a cross  join t2 b on l2_distance(c2,c3)=l2_distance(a3,a4)  order by l2_distance(a3,c2);
c1	c2	c3	c4	l2_distance(a3,c2)	avg(c3)	avg(c4)
1	[1,1,2]	[2,2,3]	[1,3,2]	1.7320508075688772	[-1,2,3]	[1,3,2]
select c1,c2,c3,c4,l2_distance(a3,c2),avg(c3),avg(c4) from t1 a join t2 b on l2_distance(a4,c3)=l2_distance(a3,c2)  order by l2_distance(a3,c2);
c1	c2	c3	c4	l2_distance(a3,c2)	avg(c3)	avg(c4)
1	[1,1,2]	[2,2,3]	[1,3,2]	1.7320508075688772	[2,2,3]	[1,3,2]
select c1,c2,c3,c4,l2_distance(a3,c2),avg(c3),avg(c4) from t1 a inner join t2 b on l2_distance(a4,c3)=l2_distance(a3,c2)  order by l2_distance(a3,c2);
c1	c2	c3	c4	l2_distance(a3,c2)	avg(c3)	avg(c4)
1	[1,1,2]	[2,2,3]	[1,3,2]	1.7320508075688772	[2,2,3]	[1,3,2]
select c1,c2,c3,c4,l2_distance(a3,c2),avg(c3),avg(c4) from t1 a right join t2 b on l2_distance(a4,c3)=l2_distance(a3,c2)  order by l2_distance(a3,c2);
c1	c2	c3	c4	l2_distance(a3,c2)	avg(c3)	avg(c4)
1	[1,1,2]	[2,2,3]	[1,3,2]	1.7320508075688772	[2,2,3]	[1,3,2]
select c1,c2,c3,c4,l2_distance(a3,c2),avg(c3),avg(c4) from t1 a left join t2 b on l2_distance(a4,c3)=l2_distance(a3,c2)  order by l2_distance(a3,c2);
c1	c2	c3	c4	l2_distance(a3,c2)	avg(c3)	avg(c4)
1	[1,1,2]	[2,2,3]	[1,3,2]	1.7320508075688772	[-0.4,1.6,3]	[2,3,2]
select c1,c2,c3,c4,l2_distance(a3,c2),avg(c3),avg(c4) from t1 a cross  join t2 b on l2_distance(a4,c3)=l2_distance(a3,c2)  order by l2_distance(a3,c2);
c1	c2	c3	c4	l2_distance(a3,c2)	avg(c3)	avg(c4)
1	[1,1,2]	[2,2,3]	[1,3,2]	1.7320508075688772	[2,2,3]	[1,3,2]
##order by (存在关键字approximate)
drop table if exists t1;
drop table if exists t2;
CREATE TABLE t1 (c1 int primary key, c2 vector(3),c3 vector(3) ,c4 vector(3),
VECTOR INDEX vector_idx(c3) 
WITH (distance=l2, lib=vsag, type=hnsw, m=10, ef_construction=100, ef_search=40));
insert into t1 values(1,'[1,1,2]','[2,2,3]','[1,3,2]');
insert into t1 values(2,'[1,0,3]','[1,0,3]','[2,3,2]');
insert into t1 values(3,'[-1,2,2]','[-3,2,3]','[4,3,3]');
insert into t1 values(4,'[-1,-2,-2]','[-4,2,3]',null);
insert into t1 values(5,'[-1,-3,-2]',null,'[2,3,1]');
select * from t1 order by l2_distance(c4, [1,2,3]) approximate limit 10;
c1	c2	c3	c4
4	[-1,-2,-2]	[-4,2,3]	NULL
1	[1,1,2]	[2,2,3]	[1,3,2]
2	[1,0,3]	[1,0,3]	[2,3,2]
5	[-1,-3,-2]	NULL	[2,3,1]
3	[-1,2,2]	[-3,2,3]	[4,3,3]
select * from t1 order by l2_distance(avg(c4), [1,2,3]) approximate limit 10;
ERROR 0A000: Using vector index without column ref or vector const expr is not supported
select c1,c2,l2_distance(c3,c2),avg(c3),avg(c4) from t1 order by l2_distance(c3, c4) ;
c1	c2	l2_distance(c3,c2)	avg(c3)	avg(c4)
1	[1,1,2]	1.7320508075688772	[-1,1.5,3]	[2.25,3,2]
select c1,c2,l2_distance(c3,c2),avg(c3),avg(c4) from t1 order by l2_distance(c3, [1,2,3]) APPROX limit 10;
c1	c2	l2_distance(c3,c2)	avg(c3)	avg(c4)
1	[1,1,2]	1.7320508075688772	[-1,1.5,3]	[2.25,3,2]
select c1,c2,l2_distance(c3,c2),avg(c3),avg(c4) from t1 order by l2_distance(c3, c4) APPROX limit 10;
ERROR 0A000: Using vector index without const param is not supported
select c1,c2,l2_distance(c3,c2),avg(c3),avg(c4) from t1 order by l2_distance(c3, c4) ;
c1	c2	l2_distance(c3,c2)	avg(c3)	avg(c4)
1	[1,1,2]	1.7320508075688772	[-1,1.5,3]	[2.25,3,2]
drop table if exists t2;
CREATE TABLE t2 (a1 int , a2 vector(3),a3 vector(3) ,a4 vector(3));
insert into t2 select c1,c2,c3,c4 from t1;
select avg(c2+a3),avg(a2+c2) from t1 a join t2 b on c2+a3=a2+c2 order by c1;
avg(c2+a3)	avg(a2+c2)
[0.8,-0.4,3.6]	[0.8,-0.4,3.6]
##order by (无关键字approximate)
select c1,c2,l2_distance(c3,c2) from t1  order by l2_distance(avg(c3),[1,2,3]) asc;
c1	c2	l2_distance(c3,c2)
1	[1,1,2]	1.7320508075688772
select c1,c2,l2_distance(c3,c2) from t1  order by l2_distance(c3,c2) desc,l2_distance(avg(c3),c2) asc;
c1	c2	l2_distance(c3,c2)
1	[1,1,2]	1.7320508075688772
select c1,c2,l2_distance(c3,c2),avg(0) from t1  order by l2_distance([0,avg(0)],[0,1]) asc;
c1	c2	l2_distance(c3,c2)	avg(0)
1	[1,1,2]	1.7320508075688772	0.0000
select c1,c2,l2_distance(c3,c2),avg(c2+c3) from t1  order by l2_distance([0,avg(0)],[0,1]) asc;
c1	c2	l2_distance(c3,c2)	avg(c2+c3)
1	[1,1,2]	1.7320508075688772	[-1,1.75,4.25]
##group by /having
drop table if exists t1;
drop table if exists t2;
CREATE TABLE t1 (c1 int primary key, c2 VARCHAR(30),c3 vector(3) ,c4 vector(3),
VECTOR INDEX vector_idx(c3) 
WITH (distance=l2, lib=vsag, type=hnsw, m=10, ef_construction=100, ef_search=40));
insert into t1 values(1,'[1,1,2]','[2,2,3]','[1,3,2]');
insert into t1 values(2,'[1,0,3]','[1,0,3]','[2,3,2]');
insert into t1 values(3,'[-1,2,2]','[-3,2,3]','[4,3,3]');
insert into t1 values(4,'[-1,-2,-2]','[-4,2,3]',null);
insert into t1 values(5,'[-1,-3,-2]',null,'[2,3,1]');
select l2_distance(c3,c2) from t1  group by l2_distance(c3,[1,avg(c3),3]) order by c1;
ERROR HY000: Invalid use of group function
select l2_distance(c3,c2),avg(c3) from t1  group by l2_distance(c3,[1,2,3]) order by c1;
l2_distance(c3,c2)	avg(c3)
1.7320508075688772	[2,2,3]
0	[1,0,3]
2.23606797749979	[-3,2,3]
7.0710678118654755	[-4,2,3]
NULL	NULL
select l2_distance(c3,c2) from t1  group by l2_distance(c3,c4) having l2_distance(c3,[1,2,4]);
ERROR 42S22: Unknown column 'c3' in 'having clause'
select l2_distance(c3,c2) from t1  group by l2_distance(c3,c4) having l2_distance([1,2,3],[1,2,4]);
l2_distance(c3,c2)
1.7320508075688772
0
2.23606797749979
7.0710678118654755
##运算符(+-*支持 ，除不支持)
select avg([1]) * 1 from dual;
ERROR 0A000: Not supported feature or function
select avg([1]) + 2 from dual;
ERROR 0A000: Not supported feature or function
select avg([1]) / 3 from dual;
ERROR 0A000: Not supported feature or function
select avg([1]) - 3 from dual;
ERROR 0A000: Not supported feature or function
select avg([1]) + avg([1]) from dual;
ERROR 0A000: Not supported feature or function
select avg([1]) + avg([1]) from dual;
ERROR 0A000: Not supported feature or function
select avg([1]) / avg([1]) from dual;
ERROR 0A000: Not supported feature or function
select avg([1]) - avg([1]) from dual;
ERROR 0A000: Not supported feature or function
drop table if exists t1;
drop table if exists t2;
CREATE TABLE t1 (c1 int primary key, c2 vector(3),c3 vector(3) ,c4 vector(3),
VECTOR INDEX vector_idx(c3) 
WITH (distance=l2, lib=vsag, type=hnsw, m=10, ef_construction=100, ef_search=40));
insert into t1 values(1,'[1,1,2]','[2,2,3]','[1,3,2]');
insert into t1 values(2,'[1,0,3]','[1,0,3]','[2,3,2]');
insert into t1 values(3,'[-1,2,2]','[-3,2,3]','[4,3,3]');
select  avg(c4+c3+c2) a from t1;
a
[2.66667,5.33333,7.66667]
select  avg(c4+c3+c2) a from t1;
a
[2.66667,5.33333,7.66667]
select distinct avg(c4+c3+c2) from t1;
avg(c4+c3+c2)
[2.66667,5.33333,7.66667]
select distinct avg(c4+c3+c2+[1,1,1]) from t1;
avg(c4+c3+c2+[1,1,1])
[3.66667,6.33333,8.66667]
select  avg(distinct c4+c3+c2) from t1;
ERROR 0A000: vector aggregation with distinct is not supported
select  avg(distinct c4) from t1;
ERROR 0A000: vector aggregation with distinct is not supported
drop table if exists t1;
drop table if exists t2;
CREATE TABLE t1 (c1 int primary key, c2 VARCHAR(30),c3 vector(3) ,c4 vector(3),
VECTOR INDEX vector_idx(c3) 
WITH (distance=l2, lib=vsag, type=hnsw, m=10, ef_construction=100, ef_search=40));
insert into t1 values(1,'[1,1,2]','[2,2,3]','[1,3,2]');
insert into t1 values(2,'[1,0,3]','[1,0,3]','[2,3,2]');
insert into t1 values(3,'[-1,2,2]','[-3,2,3]','[4,3,3]');
insert into t1 values(4,'[-1,-2,-2]','[-4,2,3]',null);
insert into t1 values(5,'[-1,-3,-2]',null,'[2,3,1]');
select avg(c3) / 0 from t1;
avg(c3) / 0
NULL
select avg(c3) / 10 from t1 order by c1;
avg(c3) / 10
[-0.1,0.15,0.3]
select avg(c3) / 1.5 from t1;
ERROR 22000: Invalid data type for the operation
select avg(c3) * 10 from t1;
ERROR 22000: Invalid data type for the operation
select avg(c3) * 1.5 from t1;
ERROR 22000: Invalid data type for the operation
select avg(c3) - 10 from t1;
ERROR 22000: Invalid data type for the operation
select avg(c3) - 1.5 from t1;
ERROR 22000: Invalid data type for the operation
select avg(c3) + 10 from t1;
ERROR 22000: Invalid data type for the operation
select avg(c3) + 1.5 from t1;
ERROR 22000: Invalid data type for the operation
select avg(c3) / avg(c3) - avg(c3) from t1 order by c1;
ERROR 22000: Invalid data type for the operation
select avg(c3) % avg(c3) - avg(c3) from t1 order by c1;
ERROR 22000: Invalid data type for the operation
select avg(c3+c4*c2-c2+sum(c2)) from t1;
ERROR HY000: Invalid use of group function
select avg(c3) + avg(c4) + avg(c4) + avg(c4) + avg(c4) + avg(c4) + avg(c4) + avg(c4) + avg(c4) + avg(c4) + avg(c4) + avg(c4) from t1 order by c1;
avg(c3) + avg(c4) + avg(c4) + avg(c4) + avg(c4) + avg(c4) + avg(c4) + avg(c4) + avg(c4) + avg(c4) + avg(c4) + avg(c4)
[23.75,34.5,25]
select avg(c3) - avg(c4) - avg(c4) + avg(c4) - avg(c4) + avg(c4) - avg(c4) + avg(c4) - avg(c4) + avg(c4) + avg(c4) + avg(c4)  from t1 order by c1;
avg(c3) - avg(c4) - avg(c4) + avg(c4) - avg(c4) + avg(c4) - avg(c4) + avg(c4) - avg(c4) + avg(c4) + avg(c4) + avg(c4)
[1.25,4.5,5]
select avg(c3) + avg(c4) * avg(c4) + avg(c4) * avg(c4) + avg(c4) * avg(c4) + avg(c4) * avg(c4) + avg(c4) - avg(c4) * avg(c4)  from t1 order by c1;
avg(c3) + avg(c4) * avg(c4) + avg(c4) * avg(c4) + avg(c4) * avg(c4) + avg(c4) * avg(c4) + avg(c4) - avg(c4) * avg(c4)
[16.4375,31.5,17]
select avg(c3+c3) + avg(c4) + avg(c4) + avg(c4) + avg(c4) + avg(c4) + avg(c4) + avg(c4) + avg(c4) + avg(c4) + avg(c4) + avg(c4) from t1 order by c1;
avg(c3+c3) + avg(c4) + avg(c4) + avg(c4) + avg(c4) + avg(c4) + avg(c4) + avg(c4) + avg(c4) + avg(c4) + avg(c4) + avg(c4)
[22.75,36,28]
select avg(c3+c2) - avg(c4) - avg(c4) + avg(c4) - avg(c4) + avg(c4) - avg(c4) + avg(c4) - avg(c4) + avg(c4) + avg(c4) + avg(c4)  from t1 order by c1;
avg(c3+c2) - avg(c4) - avg(c4) + avg(c4) - avg(c4) + avg(c4) - avg(c4) + avg(c4) - avg(c4) + avg(c4) + avg(c4) + avg(c4)
[1.25,4.75,6.25]
select avg(c3+c4*c2) + avg(c4) * avg(c4) + avg(c4) * avg(c4) + avg(c4) * avg(c4) + avg(c4) * avg(c4) + avg(c4) - avg(c4) * avg(c4)  from t1 order by c1;
avg(c3+c4*c2) + avg(c4) * avg(c4) + avg(c4) * avg(c4) + avg(c4) * avg(c4) + avg(c4) * avg(c4) + avg(c4) - avg(c4) * avg(c4)
[17.1042,34.3333,22.3333]
##cast
drop table if exists t1;
drop table if exists t2;
CREATE TABLE t1 (c1 int primary key, c2 vector(3),c3 vector(3) ,c4 vector(3),
VECTOR INDEX vector_idx(c3) 
WITH (distance=l2, lib=vsag, type=hnsw, m=10, ef_construction=100, ef_search=40));
insert into t1 values(1,'[1,1,2]','[2,2,3]','[1,3,2]');
insert into t1 values(2,'[1,0,3]','[1,0,3]','[2,3,2]');
insert into t1 values(3,'[-1,2,2]','[-3,2,3]','[4,3,3]');
insert into t1 values(4,'[-1,-2,-2]','[-4,2,3]',null);
insert into t1 values(5,'[-1,-3,-2]',null,'[2,3,1]');
drop table if exists t2;
CREATE TABLE t2 (a1 int primary key, a2 vector(3),a3 vector(3) ,a4 vector(3));
insert into t2 select c1,c2,c3,c4 from t1;
select cast(avg(c2) as char(10)) from t1 order by c1 limit 1;
ERROR 22000: Invalid data type for the operation
##distinct
select distinct c2 from t1 order By c1;
ERROR 22000: Invalid data type for the operation
select distinct l2_distance(c2,c3) from t1 order By c1;
l2_distance(c2,c3)
1.7320508075688772
0
2.23606797749979
7.0710678118654755
NULL
SELECT avg(DISTINCT l2_distance(c2,c3)) FROM t1 order By c1;
avg(DISTINCT l2_distance(c2,c3))
2.7597966492335355
SELECT avg(DISTINCT l2_distance(c2,[1,1,2])) FROM t1 order By c1;
avg(DISTINCT l2_distance(c2,[1,1,2]))
3.0070892694014777
##with as
drop table if exists t1;
drop table if exists t2;
CREATE TABLE t1 (c1 int primary key, c2 vector(3),c3 vector(3) ,c4 vector(3),
VECTOR INDEX vector_idx(c3) 
WITH (distance=l2, lib=vsag, type=hnsw, m=10, ef_construction=100, ef_search=40));
insert into t1 values(1,'[1,1,2]','[2,2,3]','[1,3,2]');
insert into t1 values(2,'[1,0,3]','[1,0,3]','[2,3,2]');
insert into t1 values(3,'[-1,2,2]','[-3,2,3]','[4,3,3]');
insert into t1 values(4,'[-1,-2,-2]','[-4,2,3]',null);
insert into t1 values(5,'[-1,-3,-2]',null,'[2,3,1]');
CREATE TABLE t2 (a1 int , a2 vector(3),a3 vector(3) ,a4 vector(3));
insert into t2 select c1,c2,c3,c4 from t1;
with ct1 AS(
select avg(c2) from t1 order by c1)
select avg(c2) from t1 where c1 >2 order by c1 ;
avg(c2)
[-1,-1,-0.666667]
with ct1 as(
select avg(c2) from t1 order by c1)
select avg(c2) from t1 where c3 is not null order by c1 ;
avg(c2)
[0,0.25,1.25]
with ct1 as(
select l2_distance(c2,c3),avg(c2) from t1 order by c1)
select l2_distance(c2,c3),avg(c2) from t1 join t2 on l2_distance(c2,c3)=l2_distance(a3,a4) order by c1;
l2_distance(c2,c3)	avg(c2)
1.7320508075688772	[0,-0.5,0]
alter system set ob_vector_memory_limit_percentage =44;
drop table if exists t1;
drop table if exists t2;
CREATE TABLE t1 (c1 int primary key, c2 vector(3),c3 vector(3) ,c4 vector(3),
VECTOR INDEX vector_idx(c3) 
WITH (distance=l2, lib=vsag, type=hnsw, m=10, ef_construction=100, ef_search=40));
insert into t1 values(1,'[1,1,2]','[2,2,3]','[1,3,2]');
insert into t1 values(2,'[1,0,3]','[1,0,3]','[2,3,2]');
insert into t1 values(3,'[-1,2,2]','[-3,2,3]','[4,3,3]');
insert into t1 values(4,'[-1,-2,-2]','[-4,2,3]',null);
insert into t1 values(5,'[-1,-3,-2]',null,'[2,3,1]');
SELECT count(c1), CASE WHEN l2_distance(C2,[1,2,3]) > 1 THEN avg(c2) ELSE avg(c3) END AS A FROM T1 ;
count(c1)	A
5	[-0.2,-0.4,0.6]
SELECT count(c1), CASE WHEN l2_distance(C2,[1,2,3]) > 1 THEN sum(c2) ELSE sum(c3) END AS A FROM T1 ;
count(c1)	A
5	[-1,-2,3]
drop table if exists t2;
CREATE TABLE t2 (a1 int , a2 vector(3),a3 vector(3) ,a4 vector(3));
insert into t2 select c1,c2,c3,c4 from t1;
SELECT count(c1), CASE WHEN l2_distance(C2,[1,2,3]) > l2_distance([1,1,1],a3) THEN avg(c2) ELSE avg(c3) END AS A FROM T1,t2 ;
count(c1)	A
25	[-1,1.5,3]
SELECT count(*) FROM t1,t2 where l2_distance(t1.C2, t2.A2) < 0.5;
count(*)
5
SELECT C1, CASE WHEN l2_distance(C2,[1,2,3]) > 5 THEN 'High' ELSE 'Low' END AS A FROM T1,t2 ;
C1	A
1	Low
1	Low
1	Low
1	Low
1	Low
2	Low
2	Low
2	Low
2	Low
2	Low
3	Low
3	Low
3	Low
3	Low
3	Low
4	High
4	High
4	High
4	High
4	High
5	High
5	High
5	High
5	High
5	High
SELECT t1.C1, 
CASE 
WHEN l2_distance(t1.C2, t2.A2) > 10 THEN 'Far'
           WHEN l2_distance(t1.C3, t2.A3) BETWEEN 5 AND 10 THEN 'Medium'
           WHEN avg(t1.C3+t2.A3) <> [1,2,3] THEN 'true'
           ELSE 'Close'
       END AS distance_category,
avg(t1.C2) OVER (PARTITION BY t1.C1) AS avg_vector
FROM T1 t1
JOIN T2 t2 ON t1.C1 = t2.A1
WHERE l2_distance(t1.C2, t2.A2) < 0.5;
C1	distance_category	avg_vector
1	true	[1,1,2]
drop table if exists t1;
drop table if exists t2;
CREATE TABLE t1 (c1 int primary key, c2 vector(3),c3 vector(3) ,c4 vector(3),
VECTOR INDEX vector_idx(c3) 
WITH (distance=l2, lib=vsag, type=hnsw, m=10, ef_construction=100, ef_search=40));
insert into t1 values(1,'[1,1,2]','[2,2,3]','[1,3,2]');
insert into t1 values(2,'[1,0,3]','[1,0,3]','[2,3,2]');
insert into t1 values(3,'[-1,2,2]','[-3,2,3]','[4,3,3]');
insert into t1 values(4,'[-1,-2,-2]','[-4,2,3]',null);
insert into t1 values(5,'[-1,-3,-2]',null,'[2,3,1]');
insert into t1 values(6,'[1,1,2]','[2,2,3]','[1,3,2]');
insert into t1 values(7,'[1,0,3]','[1,0,3]','[2,3,2]');
insert into t1 values(8,'[-1,2,2]','[-3,2,3]','[4,3,3]');
insert into t1 values(9,'[-1,-2,-2]','[-4,2,3]',null);
insert into t1 values(10,'[-1,-3,-2]',null,'[2,3,1]');
CREATE TABLE t2 (c1 int , c2 vector(3),c3 vector(3) ,c4 vector(3));
insert into t2 select c1,c2,c3,c4 from t1;
CREATE VECTOR INDEX vector_idx  ON t2 (c3)  WITH (distance=l2, lib=vsag, type=hnsw, m=10, ef_construction=100, ef_search=40);
SELECT * FROM t1 JOIN t2 USING(c1)  order by l2_distance(t1.c3, t2.c3)  limit 10;
c1	c2	c3	c4	c2	c3	c4
5	[-1,-3,-2]	NULL	[2,3,1]	[-1,-3,-2]	NULL	[2,3,1]
10	[-1,-3,-2]	NULL	[2,3,1]	[-1,-3,-2]	NULL	[2,3,1]
1	[1,1,2]	[2,2,3]	[1,3,2]	[1,1,2]	[2,2,3]	[1,3,2]
2	[1,0,3]	[1,0,3]	[2,3,2]	[1,0,3]	[1,0,3]	[2,3,2]
3	[-1,2,2]	[-3,2,3]	[4,3,3]	[-1,2,2]	[-3,2,3]	[4,3,3]
4	[-1,-2,-2]	[-4,2,3]	NULL	[-1,-2,-2]	[-4,2,3]	NULL
6	[1,1,2]	[2,2,3]	[1,3,2]	[1,1,2]	[2,2,3]	[1,3,2]
7	[1,0,3]	[1,0,3]	[2,3,2]	[1,0,3]	[1,0,3]	[2,3,2]
8	[-1,2,2]	[-3,2,3]	[4,3,3]	[-1,2,2]	[-3,2,3]	[4,3,3]
9	[-1,-2,-2]	[-4,2,3]	NULL	[-1,-2,-2]	[-4,2,3]	NULL
SELECT avg(C2) OVER (PARTITION BY C1) FROM T1  order by l2_distance(t1.c3, [1,-1,3])  limit 10;
avg(C2) OVER (PARTITION BY C1)
[-1,-3,-2]
[-1,-3,-2]
[1,0,3]
[1,0,3]
[1,1,2]
[1,1,2]
[-1,2,2]
[-1,2,2]
[-1,-2,-2]
[-1,-2,-2]
SELECT sum(C2) OVER (PARTITION BY C1) FROM T1  order by l2_distance(t1.c3, [1,-1,3])  limit 10;
sum(C2) OVER (PARTITION BY C1)
[-1,-3,-2]
[-1,-3,-2]
[1,0,3]
[1,0,3]
[1,1,2]
[1,1,2]
[-1,2,2]
[-1,2,2]
[-1,-2,-2]
[-1,-2,-2]
SELECT count(C2) OVER (PARTITION BY C1) FROM T1  order by c1;
count(C2) OVER (PARTITION BY C1)
1
1
1
1
1
1
1
1
1
1
SELECT min(C2) OVER (PARTITION BY C1) FROM T1 order by c1 ;
ERROR HY000: Invalid argument
SELECT max(C2) OVER (PARTITION BY C1) FROM T1  order by c1;
ERROR HY000: Invalid argument
SELECT avg(a.C2) OVER (PARTITION BY a.C1) FROM T1 a,t2 b order by a.c1;
avg(a.C2) OVER (PARTITION BY a.C1)
[1,1,2]
[1,1,2]
[1,1,2]
[1,1,2]
[1,1,2]
[1,1,2]
[1,1,2]
[1,1,2]
[1,1,2]
[1,1,2]
[1,0,3]
[1,0,3]
[1,0,3]
[1,0,3]
[1,0,3]
[1,0,3]
[1,0,3]
[1,0,3]
[1,0,3]
[1,0,3]
[-1,2,2]
[-1,2,2]
[-1,2,2]
[-1,2,2]
[-1,2,2]
[-1,2,2]
[-1,2,2]
[-1,2,2]
[-1,2,2]
[-1,2,2]
[-1,-2,-2]
[-1,-2,-2]
[-1,-2,-2]
[-1,-2,-2]
[-1,-2,-2]
[-1,-2,-2]
[-1,-2,-2]
[-1,-2,-2]
[-1,-2,-2]
[-1,-2,-2]
[-1,-3,-2]
[-1,-3,-2]
[-1,-3,-2]
[-1,-3,-2]
[-1,-3,-2]
[-1,-3,-2]
[-1,-3,-2]
[-1,-3,-2]
[-1,-3,-2]
[-1,-3,-2]
[1,1,2]
[1,1,2]
[1,1,2]
[1,1,2]
[1,1,2]
[1,1,2]
[1,1,2]
[1,1,2]
[1,1,2]
[1,1,2]
[1,0,3]
[1,0,3]
[1,0,3]
[1,0,3]
[1,0,3]
[1,0,3]
[1,0,3]
[1,0,3]
[1,0,3]
[1,0,3]
[-1,2,2]
[-1,2,2]
[-1,2,2]
[-1,2,2]
[-1,2,2]
[-1,2,2]
[-1,2,2]
[-1,2,2]
[-1,2,2]
[-1,2,2]
[-1,-2,-2]
[-1,-2,-2]
[-1,-2,-2]
[-1,-2,-2]
[-1,-2,-2]
[-1,-2,-2]
[-1,-2,-2]
[-1,-2,-2]
[-1,-2,-2]
[-1,-2,-2]
[-1,-3,-2]
[-1,-3,-2]
[-1,-3,-2]
[-1,-3,-2]
[-1,-3,-2]
[-1,-3,-2]
[-1,-3,-2]
[-1,-3,-2]
[-1,-3,-2]
[-1,-3,-2]
SELECT sum(a.C2) OVER (PARTITION BY a.C1) FROM T1 a,t2 b order by a.c1;
sum(a.C2) OVER (PARTITION BY a.C1)
[10,10,20]
[10,10,20]
[10,10,20]
[10,10,20]
[10,10,20]
[10,10,20]
[10,10,20]
[10,10,20]
[10,10,20]
[10,10,20]
[10,0,30]
[10,0,30]
[10,0,30]
[10,0,30]
[10,0,30]
[10,0,30]
[10,0,30]
[10,0,30]
[10,0,30]
[10,0,30]
[-10,20,20]
[-10,20,20]
[-10,20,20]
[-10,20,20]
[-10,20,20]
[-10,20,20]
[-10,20,20]
[-10,20,20]
[-10,20,20]
[-10,20,20]
[-10,-20,-20]
[-10,-20,-20]
[-10,-20,-20]
[-10,-20,-20]
[-10,-20,-20]
[-10,-20,-20]
[-10,-20,-20]
[-10,-20,-20]
[-10,-20,-20]
[-10,-20,-20]
[-10,-30,-20]
[-10,-30,-20]
[-10,-30,-20]
[-10,-30,-20]
[-10,-30,-20]
[-10,-30,-20]
[-10,-30,-20]
[-10,-30,-20]
[-10,-30,-20]
[-10,-30,-20]
[10,10,20]
[10,10,20]
[10,10,20]
[10,10,20]
[10,10,20]
[10,10,20]
[10,10,20]
[10,10,20]
[10,10,20]
[10,10,20]
[10,0,30]
[10,0,30]
[10,0,30]
[10,0,30]
[10,0,30]
[10,0,30]
[10,0,30]
[10,0,30]
[10,0,30]
[10,0,30]
[-10,20,20]
[-10,20,20]
[-10,20,20]
[-10,20,20]
[-10,20,20]
[-10,20,20]
[-10,20,20]
[-10,20,20]
[-10,20,20]
[-10,20,20]
[-10,-20,-20]
[-10,-20,-20]
[-10,-20,-20]
[-10,-20,-20]
[-10,-20,-20]
[-10,-20,-20]
[-10,-20,-20]
[-10,-20,-20]
[-10,-20,-20]
[-10,-20,-20]
[-10,-30,-20]
[-10,-30,-20]
[-10,-30,-20]
[-10,-30,-20]
[-10,-30,-20]
[-10,-30,-20]
[-10,-30,-20]
[-10,-30,-20]
[-10,-30,-20]
[-10,-30,-20]
SELECT count(a.C2) OVER (PARTITION BY a.C1) FROM T1 a,t2 b order by a.c1;
count(a.C2) OVER (PARTITION BY a.C1)
10
10
10
10
10
10
10
10
10
10
10
10
10
10
10
10
10
10
10
10
10
10
10
10
10
10
10
10
10
10
10
10
10
10
10
10
10
10
10
10
10
10
10
10
10
10
10
10
10
10
10
10
10
10
10
10
10
10
10
10
10
10
10
10
10
10
10
10
10
10
10
10
10
10
10
10
10
10
10
10
10
10
10
10
10
10
10
10
10
10
10
10
10
10
10
10
10
10
10
10
SELECT min(a.C2) OVER (PARTITION BY a.C1) FROM T1 a,t2 b order by a.c1;
ERROR HY000: Invalid argument
SELECT max(a.C2) OVER (PARTITION BY a.C1) FROM T1 a,t2 b order by a.c1;
ERROR HY000: Invalid argument
drop table if exists t1;
drop table if exists t2;
CREATE TABLE t1 (c1 int primary key, c2 vector(3),c3 vector(3) ,c4 vector(3),
VECTOR INDEX vector_idx(c2) 
WITH (distance=l2, lib=vsag, type=hnsw, m=10, ef_construction=100, ef_search=40));
insert into t1 values(1,'[1,1,2]','[2,2,3]','[1,3,2]');
insert into t1 values(2,'[1,0,3]','[1,0,3]','[2,3,2]');
insert into t1 values(3,'[-1,2,2]','[-3,2,3]','[4,3,3]');
insert into t1 values(4,'[-1,-2,-2]','[-4,2,3]',null);
insert into t1 values(5,'[-1,-3,-2]',null,'[2,3,1]');
##limit
select avg(c2)  from t1  order by c1 limit 1;
avg(c2)
[-0.2,-0.4,0.6]
select avg(c2)  from t1  order by c1 limit 1,1;
avg(c2)
select sum(c2)  from t1  order by c1 limit 1,1;
sum(c2)
select avg(c2) +[1,2,999]   from t1  order by c1 limit 0,1;
avg(c2) +[1,2,999]
[0.8,1.6,999.6]
select avg(c2) + avg([1,2,3])   from t1  order by c1 limit 0,1;
ERROR 0A000: Not supported feature or function
select avg(c2) * avg(c3)   from t1  order by c1 limit 0,1;
avg(c2) * avg(c3)
[0.2,-0.6,1.8]
drop table if exists t1;
drop table if exists t2;
CREATE TABLE t1 (c1 int primary key, c2 vector(3),c3 vector(3) ,c4 vector(3),
VECTOR INDEX vector_idx(c2) 
WITH (distance=l2, lib=vsag, type=hnsw, m=10, ef_construction=100, ef_search=40));
insert into t1 values(1,'[1,1,2]','[2,2,3]','[1,3,2]');
insert into t1 values(2,'[1,0,3]','[1,0,3]','[2,3,2]');
insert into t1 values(3,'[-1,2,2]','[-3,2,3]','[4,3,3]');
insert into t1 values(4,'[-1,-2,-2]','[-4,2,3]',null);
insert into t1 values(5,'[-1,-3,-2]',null,'[2,3,1]');
set @a=(select avg(c2) from t1  limit 0,1);
ERROR 0A000: Variable value type not supported
##列别名
drop table if exists t1;
drop table if exists t2;
CREATE TABLE t1 (c1 int primary key, c2 vector(3),c3 vector(3) ,c4 vector(3));
insert into t1 values(1,'[1,1,2]','[2,2,3]','[1,3,2]');
insert into t1 values(2,'[1,0,3]','[1,0,3]','[2,3,2]');
insert into t1 values(3,'[-1,2,2]','[-3,2,3]','[4,3,3]');
insert into t1 values(4,'[-1,-2,-2]','[-4,2,3]',null);
insert into t1 values(5,'[-1,-3,-2]',null,'[2,3,1]');
select c1 a,avg(c3) a  from t1 order by c1;
a	a
1	[-1,1.5,3]
select c1 a,avg(c3) a,sum(c3) a  from t1 order by c1;
a	a	a
1	[-1,1.5,3]	[-4,6,12]
select avg(c3) a  from t1 order by c1;
a
[-1,1.5,3]
select avg(c3) a ,* from t1 order by c1;
a	c1	c2	c3	c4
[-1,1.5,3]	1	[1,1,2]	[2,2,3]	[1,3,2]
select avg(c3)  中文 ,* from t1 order by c1;
中文	c1	c2	c3	c4
[-1,1.5,3]	1	[1,1,2]	[2,2,3]	[1,3,2]
select avg(c3) + avg(c3) - avg(c3)  中文 ,avg(c3) + avg(c2) - avg(c3) 中文 from t1 order by c1;
中文	中文
[-1,1.5,3]	[-0.2,-0.4,0.6]
select c1 a,avg(c2) a  from t1 where l2_distance(c3,[1,2,3]) is not null order by c1;
a	a
1	[0,0.25,1.25]
## update
drop table if exists t1;
drop table if exists t2;
CREATE TABLE t1 (c1 int primary key, c2 vector(3),c3 vector(3) ,c4 vector(3),
VECTOR INDEX vector_idx(c2) 
WITH (distance=l2, lib=vsag, type=hnsw, m=10, ef_construction=100, ef_search=40));
insert into t1 values(1,'[1,1,2]','[2,2,3]','[1,3,2]');
insert into t1 values(2,'[1,0,3]','[1,0,3]','[2,3,2]');
insert into t1 values(3,'[-1,2,2]','[-3,2,3]','[4,3,3]');
insert into t1 values(4,'[-1,-2,-2]','[-4,2,3]',null);
insert into t1 values(5,'[-1,-3,-2]',null,'[2,3,1]');
update t1 set c1 = 10 where c1 =5;
update t1 set c2 = avg('[1,23,1]') where c1 =5;
ERROR HY000: Invalid use of group function
##where子句
drop table if exists t1;
drop table if exists t2;
CREATE TABLE t1 (c1 int primary key, c2 vector(3),c3 vector(3) ,c4 vector(3),
VECTOR INDEX vector_idx(c2) 
WITH (distance=l2, lib=vsag, type=hnsw, m=10, ef_construction=100, ef_search=40));
insert into t1 values(1,'[1,1,2]','[2,2,3]','[1,3,2]');
insert into t1 values(2,'[1,0,3]','[1,0,3]','[2,3,2]');
insert into t1 values(3,'[-1,2,2]','[-3,2,3]','[4,3,3]');
insert into t1 values(4,'[-1,-2,-2]','[-4,2,3]',null);
insert into t1 values(5,'[-1,-3,-2]',null,'[2,3,1]');
update t1 set c2 ='[1,2,3]' where c1 >l2_distance(avg(c2),'[1,2,2]');
ERROR HY000: Invalid use of group function
select * from t1 order by c1;
c1	c2	c3	c4
1	[1,1,2]	[2,2,3]	[1,3,2]
2	[1,0,3]	[1,0,3]	[2,3,2]
3	[-1,2,2]	[-3,2,3]	[4,3,3]
4	[-1,-2,-2]	[-4,2,3]	NULL
5	[-1,-3,-2]	NULL	[2,3,1]
update t1 set c2 =[2,2,3] where l2_distance(c3,c3) = any (SELECT l2_distance(avg(c3),c4) FROM t1) order by c1;
update t1 set c2 =[2,2,3] where l2_distance(c3,c3) = all (SELECT l2_distance(avg(c3),c4) FROM t1) order by c1;
update t1 set c2 =[2,2,3] where  exists (SELECT l2_distance(avg(c3),c4) FROM t1) order by c1;
update t1 set c2 =[2,2,3] where l2_distance(c3,c3) in  (SELECT l2_distance(avg(c3),c4) FROM t1) order by c1;
update t1 set c2 =[2,2,3] where l2_distance(c3,c3) not in  (SELECT l2_distance(avg(c3),c4) FROM t1) order by c1;
select * from t1 order by c1;
c1	c2	c3	c4
1	[2,2,3]	[2,2,3]	[1,3,2]
2	[2,2,3]	[1,0,3]	[2,3,2]
3	[2,2,3]	[-3,2,3]	[4,3,3]
4	[2,2,3]	[-4,2,3]	NULL
5	[2,2,3]	NULL	[2,3,1]
call dbms_vector.refresh_index('vector_idx','t1','c2',1,'FAST');
call dbms_vector.rebuild_index('vector_idx','t1');
## update join(子查询/多表更新)
drop table if exists t1;
drop table if exists t2;
CREATE TABLE t1 (c1 int primary key, c2 vector(3),c3 vector(3) ,c4 vector(3));
insert into t1 values(1,'[1,1,2]','[2,2,3]','[1,3,2]');
insert into t1 values(2,'[1,0,3]','[1,0,3]','[2,3,2]');
insert into t1 values(3,'[-1,2,2]','[-3,2,3]','[4,3,3]');
insert into t1 values(4,'[-1,-2,-2]','[-4,2,3]',null);
insert into t1 values(5,'[-1,-3,-2]',null,'[2,3,1]');
drop table if exists t2;
CREATE TABLE t2 (a1 int , a2 vector(3),a3 vector(3) ,a4 vector(3));
insert into t2 select c1,c2,c3,c4 from t1;
select avg(c2) from t1 union  select avg(a3) from t2;
avg(c2)
[-1,1.5,3]
[-0.2,-0.4,0.6]
select l2_distance(c2,c3) from t1 union  select l2_distance(a2,a3) from t2;
l2_distance(c2,c3)
1.7320508075688772
0
2.23606797749979
7.0710678118654755
NULL
CREATE VECTOR INDEX vector_idx_c2  ON t1 (c2)  WITH (distance=l2, lib=vsag, type=hnsw, m=10, ef_construction=100, ef_search=40);
update t1 set c2 =[1,2,4] where c1 in (select l2_distance(avg(a3),avg(c3)) from t1 inner join t2 on c2=a2);
update t1 join t2 on c2 =a2 set c2 =[1,2,4] where a3 is null;
update t1 set c1 = l2_distance([1,2,4],[1,3,5]) where c1 in (select l2_distance(avg(a3),avg(c3)) from t1 inner join t2 on c2=a2);
update t1 join t2 on c2 =a2 set c1 = l2_distance([1,2,4],[1,3,5]) where a3 is null;
call dbms_vector.refresh_index('vector_idx_c2','t1','c2',1,'FAST');
call dbms_vector.rebuild_index('vector_idx_c2','t1');
##insert/replace
drop table if exists t1;
drop table if exists t2;
CREATE TABLE t1 (c1 int primary key, c2 vector(3),c3 vector(3) ,c4 vector(3),
VECTOR INDEX vector_idx(c3) 
WITH (distance=l2, lib=vsag, type=hnsw, m=10, ef_construction=100, ef_search=40));
insert into t1(c1) values(l2_distance([1,2,3],[1,2,4]));
insert into t1(c1) values(l2_distance([1,2,3],[1,2,5]));
insert into t1(c1) values(l2_distance([1,2,3],[1,2,6]));
insert into t1(c1) values(l2_distance([1,2,3],[1,2,7]));
insert into t1(c1) values(l2_distance([1,2,3],[1,2,3]));
insert into t1(c1,c2,c3,c4) values(l2_distance([1,2,3],[1,2,8]),[1,1,2],[2,3,4],[2,3,4]);
insert into t1(c1,c2,c3,c4) values(l2_distance([1,2,3],[1,2,9]),[1,1,2],[2,3,4],null);
replace into t1(c1,c2,c3,c4) values(l2_distance([1,2,3],[1,2,100]),[-1,-3,-2],[2,3,1],[2,3,1]);
replace into t1(c1,c2,c3,c4) values(l2_distance([1,2,3],[1,2,100]),[-1,-3,-2],null,[2,3,1]);
replace into t1(c1,c2,c3,c4) values(-1,[-1,-3,-2],null,[2,3,1]);
replace into t1(c1,c2,c3,c4) values(l2_distance([1,2,3],[1,2,100]),[-1,-3,-2],null,[2,3,1]);
create table t2 like t1;
replace into t2 select c1,sum(c2) a,avg(c3) b,c4 from t1;
select avg(c2) from t2  order by c1 ;
avg(c2)
[0,-4,0]
drop table if exists t1;
drop table if exists t2;
CREATE TABLE t1 (c1 int AUTO_INCREMENT primary key , c2 vector(3),c3 vector(3) ,c4 BLOB,
VECTOR INDEX vector_idx(c3) 
WITH (distance=l2, lib=vsag, type=hnsw, m=10, ef_construction=100, ef_search=40));
insert into t1(c1) values(l2_distance([1.5+1,2.5-1,-1.5*2],[-1.5 % 1,1.5+0,1%1]));
insert into t1(c1) values(l2_distance([2.5+1,2.5-1,-1.5*2],[-1000.5 % 1,1.5+1,1%1]));
insert into t1(c1) values(l2_distance([1.5+1,2.5-1,-1.5*2],[-1.5 % 1,1.5+1,1%1])+l2_distance([1.5+1,2.5-1,-1.5*2],[-1.5 % 1,1.5+0,1%1]));
insert into t1(c1) values(l2_distance([1.5+1,2.5-1,-1.5*2],[-1.5 % 1,1.5+1,1%1])+l2_distance([1.5+1,2.5-1,-1.5*2],[-1.5 % 1,1.5+0,1%1])+l2_distance([1.5+1,2.5-1,-1.5*2],[-1.5 % 1,1.5+0,1%1])+l2_distance([1.5+1,2.5-1,-1.5*2],[-1.5 % 1,1.5+0,1%1])+l2_distance([1.5+1,2.5-1,-1.5*2],[-1.5 % 1,1.5+0,1%1])+l2_distance([1.5+1,2.5-1,-1.5*2],[-1.5 % 1,1.5+0,1%1])+l2_distance([1.5+1,2.5-1,-1.5*2],[-1.5 % 1,1.5+0,1%1]));
insert into t1(c1) values(l2_distance([1.5+1,2.5-1,-1.5*2],[-1.5 % 1,1.5+1,1%1])-l2_distance([1.5+1,2.5-1,-1.5*2],[-1.5 % 1,1.5+0,1%1])+l2_distance([1.5+1,2.5-1,-1.5*2],[-1.5 % 1,1.5+0,1%1])*l2_distance([1.5+1,2.5-1,-1.5*2],[-1.5 % 1,1.5+0,1%1])+l2_distance([1.5+1,2.5-1,-1.5*2],[-1.5 % 1,1.5+0,1%1])+l2_distance([1.5+1,2.5-1,-1.5*2],[-1.5 % 1,1.5+0,1%1])+l2_distance([1.5+1,2.5-1,-1.5*2],[-1.5 % 1,1.5+0,1%1]));
insert into t1(c2) select [2,3,4] from dual;
insert into t1(c3) select [3,3,4] from dual;
insert into t1(c3) select [l2_distance([1.5+1,2.5-1,-1.5*2],[-1.5 % 1,1.5+1,1%1]),l2_distance([1.5+1,2.5-1,-1.5*2],[-1.5 % 1,1.5+1,1%1]),l2_distance([1.5+1,2.5-1,-1.5*2],[-1.5 % 1,1.5+1,1%1])] from dual;
insert into t1(c4) select l2_distance([1.5+1,2.5-1,-1.5*2],[-1.5 % 1,1.5+1,1%1]) from dual;
select l2_distance(c3,[2,3,5]) from t1 order by c1 limit 6,2;
l2_distance(c3,[2,3,5])
1.4142135623730951
2.7967878349228767
select l2_distance(c3,[-2,3,-5]) from t1 order by c1 limit 6,2;
l2_distance(c3,[-2,3,-5])
10.295630140987
11.39610448600853
drop table if exists t1;
drop table if exists t2;
drop table if exists tt1;
CREATE TABLE t1 (c1 int AUTO_INCREMENT primary key , c2 vector(3),c3 vector(3) ,c4 BLOB,
VECTOR INDEX vector_idx(c3) 
WITH (distance=l2, lib=vsag, type=hnsw, m=10, ef_construction=100, ef_search=40));
drop table if exists t2;
Warnings:
Note	1051	Unknown table 'obljh.t2'
CREATE TABLE t2 (a1 int AUTO_INCREMENT primary key , a2 vector(3),a3 vector(3) ,a4 BLOB,
VECTOR INDEX vector_idx(a3) 
WITH (distance=l2, lib=vsag, type=hnsw, m=10, ef_construction=100, ef_search=40));
insert into t1(c1,c2) values(l2_distance([1.5+1,2.5-1,-1.5*2],[-1.5 % 1,1.5+0,1%1]),[l2_distance([-1.5+1,2.5-1,-1.5*2],[-1.5 % 1,1.5+1.5,1%1]),l2_distance([1.5+1,2.5-1,-1.5*2],[-1.5 % 1,1.5+1,1%1]),l2_distance([1.5+1,2.5-1,-1.5*2],[-1.5 % 1,1.5+1,1%1])]);
insert into t2(a1,a2) values(l2_distance([1.5+1,2.5-1,-1.5*2],[-1.5 % 1,1.5+0,1%1]),[l2_distance([-1.5+1,2.5-1,-1.5*2],[-1.5 % 1,1.5+1,1%1.5]),l2_distance([1.5+1,2.5-1,-1.5*2],[-1.5 % 1,1.5+1,1%1]),l2_distance([1.5+1,2.5-1,-1.5*2],[-1.5 % 1,1.5+1,1%1])]);
insert into t1(c2,c3) values([l2_distance([1.5+1,2.5-1,-1.5*2],[-1.5 % 1,1.5+1,1%1]),l2_distance([-1.5+1,2.5-1,-1.5*2],[-1.5 % 1,1.5+1.5,1%1]),l2_distance([1.5+1,2.5-1,-1.5*2],[-1.5 % 1,1.5+1,1%1])],[l2_distance([1.5+1,2.5-1,-1.5*2],[-1.5 % 1,1.5+1,1%1]),l2_distance([1.5+1,2.5-1,-1.5*2],[-1.5 % 1,1.5+1,1%1]),l2_distance([1.5+1,2.5-1,-1.5*2],[-1.5 % 1,1.5+1,1%1])]);
insert into t1(c3,c4) values([l2_distance([1.5+1,2.5-1,-1.5*2],[-1.5 % 1,1.5+1,1%1]),l2_distance([-1.5+1,2.5-1,-1.5*2],[-1.5 % 1,1.5+1.5,1%1]),l2_distance([1.5+1,2.5-1,-1.5*2],[-1.5 % 1,1.5+1,1%1])],l2_distance([1.5+1,2.5-1,-1.5*2],[-1.5 % 1,1.5+1,1%1]));
insert into t2(a3,a4) values([l2_distance([1.5+1,2.5-1,-1.5*2],[-1.5 % 1,1.5+1,1%1]),l2_distance([-1.5+1,2.5-1,-1.5*2],[-1.5 % 1,1.5+1.5,1%1]),l2_distance([1.5+1,2.5-1,-1.5*2],[-1.5 % 1,1.5+1,1%1])],l2_distance([1.5+1,2.5-1,-1.5*2],[-1.5 % 1,1.5+1,1%1]));
insert into t1(c1,c2,c3,c4) values(10,[l2_distance([1.5+1,2.5-1,-1.5*2],[-1.5 % 1,1.5+1,1%1]),l2_distance([-1.5+1,2.5-1,-1.5*2],[-1.5 % 1,1.5+1.5,1%1]),l2_distance([1.5+1,2.5-1,-1.5*2],[-1.5 % 1,1.5+1,1%1])],[l2_distance([1.5+1,2.5-1,-1.5*2],[-1.5 % 1,1.5+1,1%1]),l2_distance([-1.5+1,2.5-1,-1.5*2],[-1.5 % 1,1.5+1.5,1%1]),l2_distance([1.5+1,2.5-1,-1.5*2],[-1.5 % 1,1.5+1,1%1])],l2_distance([1.5+1,2.5-1,-1.5*2],[-1.5 % 1,1.5+1,1%1]));
select c1,c2,a1,a2,avg(c2-a3),avg(c3*c3) from t1,t2 where c4=a4;
c1	c2	a1	a2	avg(c2-a3)	avg(c3*c3)
6	NULL	5	NULL	[0,0,0]	[19,11.25,19]
##旁路导入
drop view if exists v1;
drop table if exists t1;
drop view if exists t1;
CREATE TABLE t1 (c1 int , c2 VARCHAR(30),c3 vector(3) ,c4 vector(3));
insert into t1(c1,c2,c3,c4) values(1,'[1,1,2]','[2,2,3]','[1,3,2]');
insert into t1(c1,c2,c3,c4) values(2,'[1,0,3]','[1,0,3]','[2,3,2]');
insert into t1(c1,c2,c3,c4) values(3,'[-1,2,2]','[-3,2,3]','[4,3,3]');
insert into t1(c1,c2,c3,c4) values(4,'[-1,-2,-2]','[-4,2,3]',null);
insert into t1(c1,c2,c3,c4) values(5,'[-1,-3,-2]',null,'[2,3,1]');
create view v1 as select * from t1;
insert /*+ direct(true,100) enable_parallel_dml parallel(2)*/ into t1 select c1,c2,c3,c4 from t1;
insert  into t1 select c1,c2,c3,c4 from t1;
insert /*+ direct(true,100) enable_parallel_dml parallel(2) append*/ into t1 select c1,c2,c3,c4 from t1;
insert /*+ direct(true,100) enable_parallel_dml parallel(2) append*/ into t1 select c1,c2,avg(c3),c4 from t1;
insert /*+ direct(true,100) enable_parallel_dml parallel(2) append*/ into t1 select c1,c2,avg(c3),avg(c3) from t1;
insert /*+ direct(true,100) enable_parallel_dml parallel(2) append*/ into t1 select c1,c2,avg(c3+c3),avg(c3) from v1;
drop table if exists t1;
create table t1(c1 int, c2 vector(3)) partition by hash(c1) partitions 20;
insert into t1 values(1,'[1,1,3]');
insert into t1 values(2,'[1,2,4]');
insert into t1 values(3,'[2,4,1]');
insert /*+ direct(true,100) enable_parallel_dml parallel(2) append*/ into t1 select c1,avg(c2) from t1;
insert /*+ direct(true,100) enable_parallel_dml parallel(2) append*/ into t1 select c1,avg(c2+[1,2,3]) from t1;
insert /*+ direct(true,100) enable_parallel_dml parallel(2) append*/ into t1 select c1,avg(c2)+avg(c2) from t1;
select count(l2_distance(c2,[1,2,3])) from t1 order by c1;
count(l2_distance(c2,[1,2,3]))
6
drop view if exists v1;
drop table if exists t1;
CREATE TABLE t1 (c1 int , c2 VARCHAR(30),c3 vector(3) ,c4 vector(3),
VECTOR INDEX vector_idx(c3) 
WITH (distance=l2, lib=vsag, type=hnsw, m=10, ef_construction=100, ef_search=40));
insert into t1(c1,c2,c3,c4) values(1,'[1,1,2]','[2,2,3]','[1,3,2]');
insert into t1(c1,c2,c3,c4) values(2,'[1,0,3]','[1,0,3]','[2,3,2]');
insert into t1(c1,c2,c3,c4) values(3,'[-1,2,2]','[-3,2,3]','[4,3,3]');
insert into t1(c1,c2,c3,c4) values(4,'[-1,-2,-2]','[-4,2,3]',null);
insert into t1(c1,c2,c3,c4) values(5,'[-1,-3,-2]',null,'[2,3,1]');
insert  into t1 select c1,c2,c3,c4 from t1;
drop view if exists v1;
drop table if exists t1;
CREATE TABLE t1 (c1 int , c2 VARCHAR(30),c3 vector(3) ,c4 vector(3),
VECTOR INDEX vector_idx(c3) 
WITH (distance=l2, lib=vsag, type=hnsw, m=10, ef_construction=100, ef_search=40));
insert into t1(c1,c2,c3,c4) values(1,'[1,1,2]','[2,2,3]','[1,3,2]');
insert into t1(c1,c2,c3,c4) values(2,'[1,0,3]','[1,0,3]','[2,3,2]');
insert into t1(c1,c2,c3,c4) values(3,'[-1,2,2]','[-3,2,3]','[4,3,3]');
insert into t1(c1,c2,c3,c4) values(4,'[-1,-2,-2]','[-4,2,3]',null);
insert into t1(c1,c2,c3,c4) values(5,'[-1,-3,-2]',null,'[2,3,1]');
create view v1 as select * from t1;
insert /*+ direct(true,100) enable_parallel_dml parallel(2)*/ into v1 select c1,c2,c3,c4 from t1;
insert  into t1 select c1,c2,c3,c4 from t1;
insert /*+ direct(true,100) enable_parallel_dml parallel(2) append*/ into t1 select c1,c2,c3,c4 from t1;
insert /*+ direct(true,100) enable_parallel_dml parallel(2) append*/ into t1 select c1,c2,c3,c4 from t1;
##delete
drop table if exists t1;
CREATE TABLE t1 (c1 int primary key, c2 vector(3),c3 vector(3) ,c4 vector(3));
insert into t1(c1,c2,c3,c4) values(1,'[1,1,2]','[2,2,3]','[1,3,2]');
insert into t1(c1,c2,c3,c4) values(2,'[1,0,3]','[1,0,3]','[2,3,2]');
insert into t1(c1,c2,c3,c4) values(3,'[-1,2,2]','[-3,2,3]','[4,3,3]');
insert into t1(c1,c2,c3,c4) values(4,'[-1,-2,-2]','[-4,2,3]',null);
insert into t1(c1,c2,c3,c4) values(5,'[-1,-3,-2]',null,'[2,3,1]');
drop table if exists t2;
CREATE TABLE t2 (a1 int primary key , a2 vector(3),a3 vector(3) ,a4 vector(3),
VECTOR INDEX vector_idx(a2) 
WITH (distance=l2, lib=vsag, type=hnsw, m=10, ef_construction=100, ef_search=40));
insert into t2 select c1,c2,c3,c4 from t1;
delete from t1 where c3 = avg(c2);
ERROR HY000: Invalid use of group function
select * from t1;
c1	c2	c3	c4
1	[1,1,2]	[2,2,3]	[1,3,2]
2	[1,0,3]	[1,0,3]	[2,3,2]
3	[-1,2,2]	[-3,2,3]	[4,3,3]
4	[-1,-2,-2]	[-4,2,3]	NULL
5	[-1,-3,-2]	NULL	[2,3,1]
########清空回收站，删除测试数据库，表等 ##########
drop database  IF EXISTS  obljh;
alter system set ob_vector_memory_limit_percentage =0;
