purge recyclebin;
drop database IF EXISTS obljh;
create database obljh ;
use obljh;
set timestamp = 1600000000;
set ob_trx_timeout = 10000000000;
set ob_query_timeout = 10000000000;
set ob_default_lob_inrow_threshold = 0;
alter system set ob_vector_memory_limit_percentage =44;
##create table as select 
drop table if exists t1;
create table t1 as select cosine_distance('','') from dual;
ERROR 42000: Null value
create table t1 as select cosine_distance(null,null) from dual;
create table t1 as select cosine_distance([null,[null]],[null,[null]]) from dual;
ERROR 22000: array type mismatch found between definition and data
create table t1 as select cosine_distance(1,1) from dual;
ERROR HY000: Invalid argument
drop table if exists t1;
create table t1 as select [1,1,2] a from dual;
drop table if exists t1;
create table t1 as select [1,1,2] a,[1,1,2] b from dual;
drop table if exists t1;
create table t1 as select cosine_distance([1,1,2],[1,12,2]) a,cosine_distance([1,1,2],[1,11,2]) b from dual;
select * from t1;
a	b
0.4314349472229465	0.41808562603735366
drop table if exists t1;
create table t1 as select cosine_distance([1,1,2],null) a,cosine_distance([1,1,2],[1,11,2]) b,cosine_distance([1,1,2],[1,1,211]) c,cosine_distance([1,1,2],[1,1,211]) d,cosine_distance([1,1,2],[1,1,211]) e,cosine_distance([1,1,2],[1,1,211]) f from dual;
select * from t1;
a	b	c	d	e	f
NULL	0.41808562603735366	0.1796521929097552	0.1796521929097552	0.1796521929097552	0.1796521929097552
drop table if exists t1;
create table t1 as select cosine_distance([1,0.01,2],null) a,cosine_distance([1,1.01,2],[1,11,2]) b,cosine_distance([1,1,2],[1,1,211]) c,cosine_distance([1,1,2],[1,2,1/0]) d,cosine_distance([1,1,2],[1,1,211]) e,cosine_distance([1,1,2],[1,1,211]) f from dual;
ERROR 42000: Null value
drop table if exists t1;
create table t1 as select cosine_distance([true],[false]) a,cosine_distance([true],[false]) b,cosine_distance([true],[false]) c,cosine_distance([true],[true+false]) d from dual;
select * from t1;
a	b	c	d
NULL	NULL	NULL	0
drop table if exists t1;
create table t1 as select l2_distance([9999999999999999],[999999999999999999999]),cosine_distance([-100],[+10000]) b,cosine_distance(null,[false]) c,cosine_distance([0.2],[8+8]) d  from dual;
ERROR 22003: Out of range value for column
drop table if exists t1;
create table t1 as select cosine_distance('[?,?,?,?,?????????????]','[?,?,?,?,?]') from dual;
ERROR 22032: Invalid JSON text.
create table t1 as select cosine_distance('101','101')a,cosine_distance('101','101')b,cosine_distance('101','101')c from dual;
ERROR HY000: Invalid argument
create table t1 as select cosine_distance('-147777777777777777777777777777777777777777777777777777777777777777777777777777777777777777777777777777777777777777770','-147777777777777777777777777777777777777777777777777777777777777777777777777777777777777777777777777777777777777777770'),cosine_distance('-147777777777777777777777777777777777777777777777777777777777777777777777777777777777777777777777777777777777777777770','-147777777777777777777777777777777777777777777777777777777777777777777777777777777777777777777777777777777777777777770') from dual;
ERROR 42000: Identifier name 'cosine_distance('-147777777777777777777777777777777777777777777777777777777777777777777777777777777777777777777777777777777777777777770','-14777777777777777777777777777777777777777777777777777777777777777777777777777777777777777777777777777777777777777777' is too long
create table t1 as select cosine_distance('1','0x48656C6C6F20576F726C64')a,cosine_distance('1','0x48656C6C6F20576F726C64')b,cosine_distance('1','0x48656C6C6F20576F726C64')c from dual;
ERROR HY000: Invalid argument
drop table if exists t1;
create table t1 as select cosine_distance([true],[false]) a,cosine_distance([true],[false]) b,cosine_distance([true],[false]) c,cosine_distance([true],[true+false]) d from dual union select cosine_distance([true],[false]) e,cosine_distance([true],[false]) f,cosine_distance([true],[false]) g,cosine_distance([true],[true+false]) h from dual;
drop table if exists t1;
CREATE TABLE t1 (c1 int primary key, c2 vector(3),c3 vector(3) ,c4 vector(3),
VECTOR INDEX vector_idx(c3) 
WITH (distance=l2, lib=vsag, type=hnsw, m=10, ef_construction=100, ef_search=40));
insert into t1(c1,c2,c3,c4) values(1,'[1,1,2]','[2,2,3]','[1,3,2]');
insert into t1(c1,c2,c3,c4) values(2,'[1,0,3]','[1,0,3]','[2,3,2]');
insert into t1(c1,c2,c3,c4) values(3,'[-1,2,2]','[-3,2,3]','[4,3,3]');
insert into t1(c1,c2,c3,c4) values(4,'[-1,-2,-2]','[-4,2,3]',null);
insert into t1(c1,c2,c3,c4) values(5,'[-1,-3,-2]',null,'[2,3,1]');
drop table if exists t2;
CREATE TABLE t2 (a1 int primary key , a2 vector(3),a3 vector(3) ,a4 vector(3),
VECTOR INDEX vector_idx(a3) 
WITH (distance=l2, lib=vsag, type=hnsw, m=10, ef_construction=100, ef_search=40));
insert into t2 select c1,c2,c3,c4 from t1 where c3 is not null and c4 is not null;
drop table if exists tt0;
drop table if exists tt1;
drop table if exists tt2;
create table tt0 as select c2+c3 from t1 ;
create table tt1 as select cosine_distance(c2,a3) a,cosine_distance(c4,a2) b,c1,a1,a3,c2 from t1 join t2 on c1=a1 ;
create table tt2 as select c2+c3+c4,a2+c3+c2 from t1 join t2 on c1=a1 ;
select cosine_distance(c2,a3) from tt1 ;
cosine_distance(c2,a3)
0.0098524570233256
0
0.07613022912568812
select count(*) from t1,t2,tt1;
count(*)
45
select cosine_distance(c2,a3),cosine_distance(c2,a3),cosine_distance(c2,a3),cosine_distance(c2,a3),cosine_distance(c2,a3),cosine_distance(c2,a3),(select cosine_distance(a4,a3) from t2 order by cosine_distance(a3, a3)  limit 1) from tt1 ;
cosine_distance(c2,a3)	cosine_distance(c2,a3)	cosine_distance(c2,a3)	cosine_distance(c2,a3)	cosine_distance(c2,a3)	cosine_distance(c2,a3)	(select cosine_distance(a4,a3) from t2 order by cosine_distance(a3, a3)  limit 1)
0.0098524570233256	0.0098524570233256	0.0098524570233256	0.0098524570233256	0.0098524570233256	0.0098524570233256	0.0925147870269698
0	0	0	0	0	0	0.0925147870269698
0.07613022912568812	0.07613022912568812	0.07613022912568812	0.07613022912568812	0.07613022912568812	0.07613022912568812	0.0925147870269698
drop view if exists v1;
drop table if exists t1;
drop materialized view if exists mv1;
CREATE TABLE t1 (c1 int primary key, c2 vector(3),c3 vector(3) ,c4 vector(3),
VECTOR INDEX vector_idx(c3) 
WITH (distance=l2, lib=vsag, type=hnsw, m=10, ef_construction=100, ef_search=40));
insert into t1(c1,c2,c3,c4) values(1,'[1,1,2]','[2,2,3]','[1,3,2]');
insert into t1(c1,c2,c3,c4) values(2,'[1,0,3]','[1,0,3]','[2,3,2]');
insert into t1(c1,c2,c3,c4) values(3,'[-1,2,2]','[-3,2,3]','[4,3,3]');
insert into t1(c1,c2,c3,c4) values(4,'[-1,-2,-2]','[-4,2,3]',null);
insert into t1(c1,c2,c3,c4) values(5,'[-1,-3,-2]',null,'[2,3,1]');
create materialized view mv1  parallel 2 refresh complete on demand  as select * from t1 ;
CREATE VECTOR INDEX vector_idx  ON mv1 (c2)  WITH (distance=l2, lib=vsag, type=hnsw, m=10, ef_construction=100, ef_search=40);
ERROR 0A000: create vector index on view table is not supported
drop view if exists v1;
drop table if exists t1;
drop materialized view if exists mv1;
CREATE TABLE t1 (c1 int primary key, c2 vector(3),c3 vector(3) ,c4 vector(3),
VECTOR INDEX vector_idx(c3) 
WITH (distance=l2, lib=vsag, type=hnsw, m=10, ef_construction=100, ef_search=40));
insert into t1(c1,c2,c3,c4) values(1,'[1,1,2]','[2,2,3]','[1,3,2]');
insert into t1(c1,c2,c3,c4) values(2,'[1,0,3]','[1,0,3]','[2,3,2]');
insert into t1(c1,c2,c3,c4) values(3,'[-1,2,2]','[-3,2,3]','[4,3,3]');
insert into t1(c1,c2,c3,c4) values(4,'[-1,-2,-2]','[-4,2,3]',null);
insert into t1(c1,c2,c3,c4) values(5,'[-1,-3,-2]',null,'[2,3,1]');
create  view v1 as select * from t1 ;
select cosine_distance(c3,c2) from v1  group by cosine_distance(c3,[1,2,3]) order by l2_distance(c3, [1,2,3]) APPROX limit 10;
cosine_distance(c3,c2)
NULL
0.0098524570233256
0
0.07613022912568812
1.3713906763541037
select cosine_distance(c3,c2) from v1  group by cosine_distance(c3,[1,2,3]) order by l2_distance(c3, [1,2,3]) APPROX limit 100000000;
cosine_distance(c3,c2)
NULL
0.0098524570233256
0
0.07613022912568812
1.3713906763541037
select  c4+c3+c2 from v1 order by cosine_distance(c3, [1,2,3])  limit 100000000;
c4+c3+c2
NULL
[4,6,7]
[4,3,8]
[0,7,8]
NULL
select  c4+c3+c2 from v1 order by cosine_distance(c3, [1,2,3])  limit 10;
c4+c3+c2
NULL
[4,6,7]
[4,3,8]
[0,7,8]
NULL
drop table if exists t1;
drop table if exists t2;
drop materialized view if exists mv1;
CREATE TABLE t1 (c1 int primary key, c2 varchar(30),c3 vector(3) ,c4 vector(3),
VECTOR INDEX vector_idx(c3) 
WITH (distance=l2, lib=vsag, type=hnsw, m=10, ef_construction=100, ef_search=40))PARTITION BY KEY(c1) PARTITIONS 4;
insert into t1(c1,c2,c3,c4) values(1,'[1,1,2]','[2,2,3]','[1,3,2]');
insert into t1(c1,c2,c3,c4) values(2,'[1,0,3]','[1,0,3]','[2,3,2]');
insert into t1(c1,c2,c3,c4) values(3,'[-1,2,2]','[-3,2,3]','[4,3,3]');
CREATE TABLE t2 (a1 int , a2 vector(3),a3 vector(3) ,a4 vector(3),
VECTOR INDEX vector_idx(a3) 
WITH (distance=l2, lib=vsag, type=hnsw, m=10, ef_construction=100, ef_search=40));
insert into t2 select c1,c2,c3,c4 from t1;
select * from t1,t2 where c3=a3 order by l2_distance(c3, [1,2,3]) APPROX limit 10;
c1	c2	c3	c4	a1	a2	a3	a4
1	[1,1,2]	[2,2,3]	[1,3,2]	1	[1,1,2]	[2,2,3]	[1,3,2]
2	[1,0,3]	[1,0,3]	[2,3,2]	2	[1,0,3]	[1,0,3]	[2,3,2]
3	[-1,2,2]	[-3,2,3]	[4,3,3]	3	[-1,2,2]	[-3,2,3]	[4,3,3]
create materialized view mv1   refresh complete on demand  as select * from t1,t2 where c3=a3 order by l2_distance(c3, [1,2,3]) APPROX limit 10;
drop view if exists v1;
drop table if exists t1;
drop materialized view if exists mv1;
CREATE TABLE t1 (c1 int primary key, c2 vector(3),c3 vector(3) ,c4 vector(3),
VECTOR INDEX vector_idx(c3) 
WITH (distance=l2, lib=vsag, type=hnsw, m=10, ef_construction=100, ef_search=40));
create materialized view mv1  parallel 2 refresh complete on demand  as select * from t1 ;
insert into t1(c1,c2,c3,c4) values(1,'[1,1,2]','[2,2,3]','[1,3,2]');
insert into t1(c1,c2,c3,c4) values(2,'[1,0,3]','[1,0,3]','[2,3,2]');
insert into t1(c1,c2,c3,c4) values(3,'[-1,2,2]','[-3,2,3]','[4,3,3]');
insert into t1(c1,c2,c3,c4) values(4,'[-1,-2,-2]','[-4,2,3]',null);
insert into t1(c1,c2,c3,c4) values(5,'[-1,-3,-2]',null,'[2,3,1]');
CALL DBMS_MVIEW.REFRESH('mv1','c');
select * from mv1 order by c1;
c1	c2	c3	c4
1	[1,1,2]	[2,2,3]	[1,3,2]
2	[1,0,3]	[1,0,3]	[2,3,2]
3	[-1,2,2]	[-3,2,3]	[4,3,3]
4	[-1,-2,-2]	[-4,2,3]	NULL
5	[-1,-3,-2]	NULL	[2,3,1]
create  view v1 as select * from mv1 ;
select count(*) from v1,mv1 ;
count(*)
25
select count(*) from v1,t1,mv1;
count(*)
125
select count(*) from v1,t1;
count(*)
25
select count(*) from v1,mv1;
count(*)
25
select count(*) from v1,mv1 where v1.c1=mv1.c1;
count(*)
5
select c1,c2,sum(c3),avg(c4),cosine_distance(c3,c2) from t1 a order by l2_distance(a.c3, [1,2,3]) APPROX limit 1;
c1	c2	sum(c3)	avg(c4)	cosine_distance(c3,c2)
1	[1,1,2]	[-4,6,12]	[2.25,3,2]	0.0098524570233256
select a.c1,a.c2,sum(a.c3),avg(a.c4),cosine_distance(a.c3,a.c2) from t1 a order by l2_distance(a.c3, [1,2,3]) APPROX limit 1000;
c1	c2	sum(a.c3)	avg(a.c4)	cosine_distance(a.c3,a.c2)
1	[1,1,2]	[-4,6,12]	[2.25,3,2]	0.0098524570233256
select c1,c2,c3,c4,cosine_distance(a3,c2) from t1 a inner join t2 b on cosine_distance(c2,c3)=cosine_distance(a3,a4)  order by cosine_distance(a3,c2);
c1	c2	c3	c4	cosine_distance(a3,c2)
select c1,c2,c3,c4,cosine_distance(a3,c2) from t1 a right join t2 b on cosine_distance(c2,c3)=cosine_distance(a3,a4)  order by cosine_distance(a3,c2);
c1	c2	c3	c4	cosine_distance(a3,c2)
NULL	NULL	NULL	NULL	NULL
NULL	NULL	NULL	NULL	NULL
NULL	NULL	NULL	NULL	NULL
select c1,c2,c3,c4,cosine_distance(a3,c2) from t1 a left join t2 b on cosine_distance(c2,c3)=cosine_distance(a3,a4)  order by cosine_distance(a3,c2);
c1	c2	c3	c4	cosine_distance(a3,c2)
1	[1,1,2]	[2,2,3]	[1,3,2]	NULL
2	[1,0,3]	[1,0,3]	[2,3,2]	NULL
3	[-1,2,2]	[-3,2,3]	[4,3,3]	NULL
4	[-1,-2,-2]	[-4,2,3]	NULL	NULL
5	[-1,-3,-2]	NULL	[2,3,1]	NULL
select c1,c2,c3,c4,cosine_distance(a3,c2) from t1 a cross  join t2 b on cosine_distance(c2,c3)=cosine_distance(a3,a4)  order by cosine_distance(a3,c2);
c1	c2	c3	c4	cosine_distance(a3,c2)
select c1,c2,c3,c4,cosine_distance(a3,c2) from t1 a join t2 b on cosine_distance(a4,c3)=cosine_distance(a3,c2)  order by cosine_distance(a3,c2);
c1	c2	c3	c4	cosine_distance(a3,c2)
select c1,c2,c3,c4,cosine_distance(a3,c2) from t1 a inner join t2 b on cosine_distance(a4,c3)=cosine_distance(a3,c2)  order by cosine_distance(a3,c2);
c1	c2	c3	c4	cosine_distance(a3,c2)
select c1,c2,c3,c4,cosine_distance(a3,c2) from t1 a right join t2 b on cosine_distance(a4,c3)=cosine_distance(a3,c2)  order by cosine_distance(a3,c2);
c1	c2	c3	c4	cosine_distance(a3,c2)
NULL	NULL	NULL	NULL	NULL
NULL	NULL	NULL	NULL	NULL
NULL	NULL	NULL	NULL	NULL
select c1,c2,c3,c4,cosine_distance(a3,c2) from t1 a left join t2 b on cosine_distance(a4,c3)=cosine_distance(a3,c2)  order by cosine_distance(a3,c2);
c1	c2	c3	c4	cosine_distance(a3,c2)
1	[1,1,2]	[2,2,3]	[1,3,2]	NULL
2	[1,0,3]	[1,0,3]	[2,3,2]	NULL
3	[-1,2,2]	[-3,2,3]	[4,3,3]	NULL
4	[-1,-2,-2]	[-4,2,3]	NULL	NULL
5	[-1,-3,-2]	NULL	[2,3,1]	NULL
select c1,c2,c3,c4,cosine_distance(a3,c2) from t1 a cross  join t2 b on cosine_distance(a4,c3)=cosine_distance(a3,c2)  order by cosine_distance(a3,c2);
c1	c2	c3	c4	cosine_distance(a3,c2)
drop table if exists t1;
drop table if exists tt1;
drop materialized view if exists mv1;
drop materialized view if exists mv2;
drop materialized view if exists mv3;
CREATE TABLE t1 (c1 int primary key, c2 vector(3),c3 vector(3) ,c4 vector(3),
VECTOR INDEX vector_idx(c3) 
WITH (distance=l2, lib=vsag, type=hnsw, m=10, ef_construction=100, ef_search=40));
insert into t1(c1,c2,c3,c4) values(1,'[1,1,2]','[2,2,3]','[1,3,2]');
insert into t1(c1,c2,c3,c4) values(2,'[1,0,3]','[1,0,3]','[2,3,2]');
insert into t1(c1,c2,c3,c4) values(3,'[-1,2,2]','[-3,2,3]','[4,3,3]');
insert into t1(c1,c2,c3,c4) values(4,'[-1,-2,-2]','[-4,2,3]',null);
insert into t1(c1,c2,c3,c4) values(5,'[-1,-3,-2]',null,'[2,3,1]');
create materialized view mv1  parallel 2 refresh complete on demand  as select c1,cosine_distance(c4,c3) from t1 order by c1;
create materialized view mv2  parallel 2 refresh complete on demand  as select c1,cosine_distance(c4,c3) from t1 limit 1;
create materialized view mv3  parallel 2 refresh complete on demand  as select c1,c2,c3,c4 from t1 limit 1;
CALL DBMS_MVIEW.REFRESH('mv1','c');
create table tt1 select cosine_distance(c2,c3) from mv3 order by c1;
drop table if exists t1;
drop view if exists v1;
drop materialized view if exists mv1;
CREATE TABLE t1 (c1 int primary key, c2 vector(3),c3 vector(3) ,c4 vector(3),
VECTOR INDEX vector_idx(c3) 
WITH (distance=l2, lib=vsag, type=hnsw, m=10, ef_construction=100, ef_search=40));
create materialized view mv1  refresh complete on demand  as select c1,c2,c3,c4 from t1 ;
create  view v1 as select c1,c2,c3,c4 from mv1 order by cosine_distance(c3, [1,2,3]) approximate limit 10;
insert into t1(c1,c2,c3,c4) values(1,'[1,1,2]','[2,2,3]','[1,3,2]');
insert into t1(c1,c2,c3,c4) values(2,'[1,0,3]','[1,0,3]','[2,3,2]');
insert into t1(c1,c2,c3,c4) values(3,'[-1,2,2]','[-3,2,3]','[4,3,3]');
insert into t1(c1,c2,c3,c4) values(4,'[-1,-2,-2]','[-4,2,3]',null);
insert into t1(c1,c2,c3,c4) values(5,'[-1,-3,-2]',null,'[2,3,1]');
CALL DBMS_MVIEW.REFRESH('mv1','c');
select * from mv1 order by cosine_distance(c3, [1,2,3])  limit 1;
c1	c2	c3	c4
5	[-1,-3,-2]	NULL	[2,3,1]
select * from mv1 order by cosine_distance(c3, [1,2,3])  limit 1,1;
c1	c2	c3	c4
1	[1,1,2]	[2,2,3]	[1,3,2]
select * from t1 order by cosine_distance(c3, [1,2,3]) approximate limit 1;
c1	c2	c3	c4
5	[-1,-3,-2]	NULL	[2,3,1]
select * from t1 order by cosine_distance(c3, [1,2,3]) approximate limit 1,1;
c1	c2	c3	c4
1	[1,1,2]	[2,2,3]	[1,3,2]
select * from t1 order by cosine_distance(c3, [1,2,3])  limit 1;
c1	c2	c3	c4
5	[-1,-3,-2]	NULL	[2,3,1]
drop table if exists t1;
drop view if exists v1;
drop materialized view if exists mv1;
CREATE TABLE t1 (c1 int primary key, c2 vector(3),c3 vector(3) ,c4 vector(3),
VECTOR INDEX vector_idx(c3) 
WITH (distance=l2, lib=vsag, type=hnsw, m=10, ef_construction=100, ef_search=40));
insert into t1(c1,c2,c3,c4) values(1,'[1,1,2]','[2,2,3]','[1,3,2]');
insert into t1(c1,c2,c3,c4) values(2,'[1,0,3]','[1,0,3]','[2,3,2]');
insert into t1(c1,c2,c3,c4) values(3,'[-1,2,2]','[-3,2,3]','[4,3,3]');
insert into t1(c1,c2,c3,c4) values(4,'[-1,-2,-2]','[-4,2,3]',null);
insert into t1(c1,c2,c3,c4) values(5,'[-1,-3,-2]',null,'[2,3,1]');
select * from t1 order by cosine_distance(c3, [1,2,3]);
c1	c2	c3	c4
5	[-1,-3,-2]	NULL	[2,3,1]
1	[1,1,2]	[2,2,3]	[1,3,2]
2	[1,0,3]	[1,0,3]	[2,3,2]
3	[-1,2,2]	[-3,2,3]	[4,3,3]
4	[-1,-2,-2]	[-4,2,3]	NULL
select * from t1 order by cosine_distance(c3, [1,2,3])  limit 1,1;
c1	c2	c3	c4
1	[1,1,2]	[2,2,3]	[1,3,2]
drop table if exists t1;
create table t1(c1 int primary key, c2 vector(3),c3 vector(3) , c4 vector(3),
VECTOR INDEX vector_idx(c4) 
WITH (distance=l2, lib=vsag, type=hnsw, m=10, ef_construction=100, ef_search=40)) partition by hash(c1) partitions 4;
replace into t1(c1, c2, c3) values(1,'[1,1,2]','[2,2,3]');
replace into t1(c1, c2, c3) values(2,'[1,-1,3]','[1,0,3]');
select * from t1 order by cosine_distance(c4, [1,2,3]);
c1	c2	c3	c4
1	[1,1,2]	[2,2,3]	NULL
2	[1,-1,3]	[1,0,3]	NULL
select * from t1 order by cosine_distance(c4, [1,2,3])  limit 1;
c1	c2	c3	c4
1	[1,1,2]	[2,2,3]	NULL
drop table if exists t1;
create table t1(c1 int primary key, c2 vector(3),c3 vector(3) , c4 vector(3),
VECTOR INDEX vector_idx(c4) 
WITH (distance=l2, lib=vsag, type=hnsw, m=10, ef_construction=100, ef_search=40)) partition by hash(c1) partitions 4;
replace into t1(c1, c2, c3) values(1,'[1,1,2]','[2,2,3]');
replace into t1(c1, c2, c3) values(2,'[1,-1,3]','[1,0,3]');
select * from t1 order by cosine_distance(c4, [1,2,3]);
c1	c2	c3	c4
1	[1,1,2]	[2,2,3]	NULL
2	[1,-1,3]	[1,0,3]	NULL
select * from t1 order by cosine_distance(c4, [1,2,3])  limit 1,1;
c1	c2	c3	c4
2	[1,-1,3]	[1,0,3]	NULL
drop view if exists v1;
create view v1 as select * from t1;
select * from v1;
c1	c2	c3	c4
1	[1,1,2]	[2,2,3]	NULL
2	[1,-1,3]	[1,0,3]	NULL
drop table if exists t1;
drop materialized view if exists mv1;
CREATE TABLE t1 (c1 int, c2 vector(3),c3 vector(3) ,c4 vector(3));
insert into t1 values(1,'[1,1,2]','[2,2,3]','[1,3,2]');
insert /*+ direct(true,100) enable_parallel_dml parallel(2) */ into t1 select * from t1;
create VECTOR index vector_idx1 on t1(c3) with (distance=l2, lib=vsag, type=hnsw, m=10, ef_construction=100, ef_search=40);
create materialized view mv1  refresh complete on demand  as select c1,c2,c3,c4 from t1 ;
create index idx1 on mv1 ((c2+c3));
ERROR 0A000: use functional index on materialized view not supported
create index idx1 on mv1 (c1);
drop table if exists t1;
drop materialized view if exists mv1;
CREATE TABLE t1 (c1 int primary key, c2 vector(3),c3 vector(3) ,c4 vector(3),
VECTOR INDEX vector_idx(c3) 
WITH (distance=l2, lib=vsag, type=hnsw, m=10, ef_construction=100, ef_search=40));
insert into t1(c1,c2,c3,c4) values(1,'[1,1,2]','[2,2,3]','[1,3,2]');
insert into t1(c1,c2,c3,c4) values(2,'[1,0,3]','[1,0,3]','[2,3,2]');
insert into t1(c1,c2,c3,c4) values(3,'[-1,2,2]','[-3,2,3]','[4,3,3]');
insert into t1(c1,c2,c3,c4) values(4,'[-1,-2,-2]','[-4,2,3]',null);
insert into t1(c1,c2,c3,c4) values(5,'[-1,-3,-2]',null,'[2,3,1]');
select cosine_distance(c4,c3),c1,* from t1 order by cosine_distance(c3, [1,2,3]) approximate limit 10;
cosine_distance(c4,c3)	c1	c1	c2	c3	c4
NULL	5	5	[-1,-3,-2]	NULL	[2,3,1]
0.0925147870269698	1	1	[1,1,2]	[2,2,3]	[1,3,2]
0.3864280089221037	2	2	[1,0,3]	[1,0,3]	[2,3,2]
0.8903091363809305	3	3	[-1,2,2]	[-3,2,3]	[4,3,3]
NULL	4	4	[-1,-2,-2]	[-4,2,3]	NULL
drop index vector_idx on t1;
select cosine_distance(c4,c3),c1,* from t1 order by cosine_distance(c3, [1,2,3]) approximate limit 10;
cosine_distance(c4,c3)	c1	c1	c2	c3	c4
NULL	5	5	[-1,-3,-2]	NULL	[2,3,1]
0.0925147870269698	1	1	[1,1,2]	[2,2,3]	[1,3,2]
0.3864280089221037	2	2	[1,0,3]	[1,0,3]	[2,3,2]
0.8903091363809305	3	3	[-1,2,2]	[-3,2,3]	[4,3,3]
NULL	4	4	[-1,-2,-2]	[-4,2,3]	NULL
create materialized view mv1  refresh complete on demand  as select c1,c2,c3,c4 from t1 ;
CREATE VECTOR INDEX vector_idx  ON mv1 (c2)  WITH (distance=l2, lib=vsag, type=hnsw, m=10, ef_construction=100, ef_search=40);
ERROR 0A000: create vector index on view table is not supported
select cosine_distance(c4,c3),c1,* from mv1 order by cosine_distance(c3, [1,2,3]) approximate limit 10;
cosine_distance(c4,c3)	c1	c1	c2	c3	c4
NULL	5	5	[-1,-3,-2]	NULL	[2,3,1]
0.0925147870269698	1	1	[1,1,2]	[2,2,3]	[1,3,2]
0.3864280089221037	2	2	[1,0,3]	[1,0,3]	[2,3,2]
0.8903091363809305	3	3	[-1,2,2]	[-3,2,3]	[4,3,3]
NULL	4	4	[-1,-2,-2]	[-4,2,3]	NULL
desc mv1;
Field	Type	Null	Key	Default	Extra
c1	int(11)	YES		NULL	
c2	VECTOR(3)	YES		NULL	
c3	VECTOR(3)	YES		NULL	
c4	VECTOR(3)	YES		NULL	
drop table if exists t1;
drop  view if exists v1;
CREATE TABLE t1 (c1 int primary key, c2 vector(3),c3 vector(3) ,c4 vector(3),
VECTOR INDEX vector_idx(c3) 
WITH (distance=l2, lib=vsag, type=hnsw, m=10, ef_construction=100, ef_search=40));
insert into t1(c1,c2,c3,c4) values(1,'[1,1,2]','[2,2,3]','[1,3,2]');
insert into t1(c1,c2,c3,c4) values(2,'[1,0,3]','[1,0,3]','[2,3,2]');
insert into t1(c1,c2,c3,c4) values(3,'[-1,2,2]','[-3,2,3]','[4,3,3]');
insert into t1(c1,c2,c3,c4) values(4,'[-1,-2,-2]','[-4,2,3]',null);
insert into t1(c1,c2,c3,c4) values(5,'[-1,-3,-2]',null,'[2,3,1]');
create view v1 as select * from t1;
CREATE VECTOR INDEX vector_idx  ON v1 (c2)  WITH (distance=l2, lib=vsag, type=hnsw, m=10, ef_construction=100, ef_search=40);
ERROR 0A000: create vector index on view table is not supported
select cosine_distance(c4,c3),c1,* from v1 order by cosine_distance(c3, [1,2,3]) approximate limit 10;
cosine_distance(c4,c3)	c1	c1	c2	c3	c4
NULL	5	5	[-1,-3,-2]	NULL	[2,3,1]
0.0925147870269698	1	1	[1,1,2]	[2,2,3]	[1,3,2]
0.3864280089221037	2	2	[1,0,3]	[1,0,3]	[2,3,2]
0.8903091363809305	3	3	[-1,2,2]	[-3,2,3]	[4,3,3]
NULL	4	4	[-1,-2,-2]	[-4,2,3]	NULL
select cosine_distance(c4,c3),c1,* from v1 order by cosine_distance(c3, avg(c3)) approximate limit 10;
ERROR 0A000: Using vector index without column ref or vector const expr is not supported
desc mv1;
Field	Type	Null	Key	Default	Extra
c1	int(11)	YES		NULL	
c2	VECTOR(3)	YES		NULL	
c3	VECTOR(3)	YES		NULL	
c4	VECTOR(3)	YES		NULL	
drop table if exists t1;
drop materialized view if exists mv1;
CREATE TABLE t1 (c1 int primary key, c2 vector(3),c3 vector(3) ,c4 vector(3),
VECTOR INDEX vector_idx(c3) 
WITH (distance=l2, lib=vsag, type=hnsw, m=10, ef_construction=100, ef_search=40));
insert into t1(c1,c2,c3,c4) values(1,'[1,1,2]','[2,2,3]','[1,3,2]');
insert into t1(c1,c2,c3,c4) values(2,'[1,0,3]','[1,0,3]','[2,3,2]');
insert into t1(c1,c2,c3,c4) values(3,'[-1,2,2]','[-3,2,3]','[4,3,3]');
insert into t1(c1,c2,c3,c4) values(4,'[-1,-2,-2]','[-4,2,3]',null);
insert into t1(c1,c2,c3,c4) values(5,'[-1,-3,-2]',null,'[2,3,1]');
create materialized view mv1 partition by hash(c1) partitions 10  refresh complete on demand  as select c1,c2,c3+c4 a from t1;
desc mv1;
Field	Type	Null	Key	Default	Extra
c1	int(11)	YES		NULL	
c2	VECTOR(3)	YES		NULL	
a	VECTOR(3)	YES		NULL	
select cosine_distance(c2,a),c1,* from mv1 order by c1;
cosine_distance(c2,a)	c1	c1	c2	a
0.04331079378507896	1	1	[1,1,2]	[3,5,5]
0.13196292009325816	2	2	[1,0,3]	[3,3,5]
0.11099911099866644	3	3	[-1,2,2]	[1,5,6]
NULL	4	4	[-1,-2,-2]	NULL
NULL	5	5	[-1,-3,-2]	NULL
insert into t1 values(6,'[-1,-3,-2]',null,'[2,3,1]');
CALL DBMS_MVIEW.REFRESH('mv1','c');
drop table if exists t1;
drop materialized view if exists mv1;
CREATE TABLE t1 (c1 int primary key, c2 vector(3),c3 vector(3) ,c4 vector(3),
VECTOR INDEX vector_idx(c3) 
WITH (distance=l2, lib=vsag, type=hnsw, m=10, ef_construction=100, ef_search=40));
insert into t1(c1,c2,c3,c4) values(1,'[1,1,2]','[2,2,3]','[1,3,2]');
insert into t1(c1,c2,c3,c4) values(2,'[1,0,3]','[1,0,3]','[2,3,2]');
insert into t1(c1,c2,c3,c4) values(3,'[-1,2,2]','[-3,2,3]','[4,3,3]');
insert into t1(c1,c2,c3,c4) values(4,'[-1,-2,-2]','[-4,2,3]',null);
insert into t1(c1,c2,c3,c4) values(5,'[-1,-3,-2]',null,'[2,3,1]');
create materialized view mv1  partition by list(c1) (PARTITION partition_1 VALUES in(1,2,3),PARTITION partition_2 VALUES in(4,5)) refresh complete on demand  as select c1,c2,c3,c4 from t1;
desc mv1;
Field	Type	Null	Key	Default	Extra
c1	int(11)	YES		NULL	
c2	VECTOR(3)	YES		NULL	
c3	VECTOR(3)	YES		NULL	
c4	VECTOR(3)	YES		NULL	
select cosine_distance(c4,c3),c1,* from mv1 order by c1;
cosine_distance(c4,c3)	c1	c1	c2	c3	c4
0.0925147870269698	1	1	[1,1,2]	[2,2,3]	[1,3,2]
0.3864280089221037	2	2	[1,0,3]	[1,0,3]	[2,3,2]
0.8903091363809305	3	3	[-1,2,2]	[-3,2,3]	[4,3,3]
NULL	4	4	[-1,-2,-2]	[-4,2,3]	NULL
NULL	5	5	[-1,-3,-2]	NULL	[2,3,1]
insert into t1 values(6,'[-1,-3,-2]',null,'[2,3,1]');
CALL DBMS_MVIEW.REFRESH('mv1','c');
ERROR HY000: Table has no partition for value
drop table if exists t1;
drop materialized view if exists mv1;
CREATE TABLE t1 (c1 int primary key, c2 vector(3),c3 vector(3) ,c4 vector(3),
VECTOR INDEX vector_idx(c3) 
WITH (distance=l2, lib=vsag, type=hnsw, m=10, ef_construction=100, ef_search=40));
insert into t1(c1,c2,c3,c4) values(1,'[1,1,2]','[2,2,3]','[1,3,2]');
insert into t1(c1,c2,c3,c4) values(2,'[1,0,3]','[1,0,3]','[2,3,2]');
insert into t1(c1,c2,c3,c4) values(3,'[-1,2,2]','[-3,2,3]','[4,3,3]');
insert into t1(c1,c2,c3,c4) values(4,'[-1,-2,-2]','[-4,2,3]',null);
insert into t1(c1,c2,c3,c4) values(5,'[-1,-3,-2]',null,'[2,3,1]');
create materialized view mv1 partition by range(c1) (PARTITION p1 VALUES LESS THAN (5), PARTITION p2 VALUES LESS THAN (10))  as select c1,c2,c3,c4 from t1;
desc mv1;
Field	Type	Null	Key	Default	Extra
c1	int(11)	YES		NULL	
c2	VECTOR(3)	YES		NULL	
c3	VECTOR(3)	YES		NULL	
c4	VECTOR(3)	YES		NULL	
insert into t1 values(6,'[-1,-3,-2]',null,'[2,3,1]');
insert into t1 values(8,'[-1,-3,-2]',null,'[2,3,1]');
insert into t1 values(10,'[-1,-3,-2]',null,'[2,3,1]');
CALL DBMS_MVIEW.REFRESH('mv1','c');
ERROR HY000: Table has no partition for value
TRUNCATE TABLE mv1;
ERROR 0A000: truncate materialized view is not supported
##create view
drop table if exists t1;
drop view if exists v1;
drop table if exists t2;
drop view if exists v2;
CREATE TABLE t1 (c1 int primary key, c2 vector(3),c3 vector(3) ,c4 vector(3),
VECTOR INDEX vector_idx(c3) 
WITH (distance=l2, lib=vsag, type=hnsw, m=10, ef_construction=100, ef_search=40));
create view v1 as select * from t1;
CREATE TABLE t2 (a1 int , a2 vector(3),a3 vector(3) ,a4 vector(3),
VECTOR INDEX vector_idx(a3) 
WITH (distance=l2, lib=vsag, type=hnsw, m=10, ef_construction=100, ef_search=40));
create view v2 as select * from t2;
insert into v1(c1,c2,c3,c4) values(1,'[1,1,2]','[2,2,3]','[1,3,2]');
insert into v1(c1,c2,c3,c4) values(2,'[1,0,3]','[1,0,3]','[2,3,2]');
insert into v1(c1,c2,c3,c4) values(3,'[-1,2,2]','[-3,2,3]','[4,3,3]');
insert into v1(c1,c2,c3,c4) values(4,'[-1,-2,-2]','[-4,2,3]',null);
insert into v1(c1,c2,c3,c4) values(5,'[-1,-3,-2]',null,'[2,3,1]');
insert into t2 select c1,c2,c3,c4 from t1;
select c1,c2,c3,c4,cosine_distance(a3,c2) from v1 a join v2 b on c2=a2  order by l2_distance(c3, [1,2,3]) approximate limit 10;
c1	c2	c3	c4	cosine_distance(a3,c2)
5	[-1,-3,-2]	NULL	[2,3,1]	NULL
1	[1,1,2]	[2,2,3]	[1,3,2]	0.0098524570233256
2	[1,0,3]	[1,0,3]	[2,3,2]	0
3	[-1,2,2]	[-3,2,3]	[4,3,3]	0.07613022912568812
4	[-1,-2,-2]	[-4,2,3]	NULL	1.3713906763541037
select c1,c2,c3,c4,cosine_distance(a3,c2) from v1 a join v2 b on cosine_distance(c2,c3)=cosine_distance(a3,a4)  order by l2_distance(c3, [1,2,3]) approximate limit 10;
c1	c2	c3	c4	cosine_distance(a3,c2)
select c1,c2,c3,c4,cosine_distance(a3,c2) from v1 a inner join v2 b on cosine_distance(c2,c3)=cosine_distance(a3,a4)  order by l2_distance(c3, [1,2,3]) approximate limit 10;
c1	c2	c3	c4	cosine_distance(a3,c2)
select c1,c2,c3,c4,cosine_distance(a3,c2) from v1 a right join t2 b on cosine_distance(c2,c3)=cosine_distance(a3,a4) order by l2_distance(c3, [1,2,3]) approximate limit 10;
c1	c2	c3	c4	cosine_distance(a3,c2)
NULL	NULL	NULL	NULL	NULL
NULL	NULL	NULL	NULL	NULL
NULL	NULL	NULL	NULL	NULL
NULL	NULL	NULL	NULL	NULL
NULL	NULL	NULL	NULL	NULL
select c1,c2,c3,c4,cosine_distance(a3,c2) from v1 a left join t2 b on cosine_distance(c2,c3)=cosine_distance(a3,a4)  order by l2_distance(c3, [1,2,3]) approximate limit 10;
c1	c2	c3	c4	cosine_distance(a3,c2)
5	[-1,-3,-2]	NULL	[2,3,1]	NULL
1	[1,1,2]	[2,2,3]	[1,3,2]	NULL
2	[1,0,3]	[1,0,3]	[2,3,2]	NULL
3	[-1,2,2]	[-3,2,3]	[4,3,3]	NULL
4	[-1,-2,-2]	[-4,2,3]	NULL	NULL
select c1,c2,c3,c4,cosine_distance(a3,c2) from v1 a cross  join t2 b on cosine_distance(c2,c3)=cosine_distance(a3,a4)  order by l2_distance(c3, [1,2,3]) approximate limit 10;
c1	c2	c3	c4	cosine_distance(a3,c2)
select c1,c2,c3,c4,cosine_distance(a3,c2) from v1 a join v2 b on cosine_distance(a4,c3)=cosine_distance(a3,c2)  order by cosine_distance(a3,c2);
c1	c2	c3	c4	cosine_distance(a3,c2)
select c1,c2,c3,c4,cosine_distance(a3,c2) from v1 a inner join v2 b on cosine_distance(a4,c3)=cosine_distance(a3,c2)  order by cosine_distance(a3,c2);
c1	c2	c3	c4	cosine_distance(a3,c2)
select c1,c2,c3,c4,cosine_distance(a3,c2) from v1 a right join t2 b on cosine_distance(a4,c3)=cosine_distance(a3,c2)  order by cosine_distance(a3,c2);
c1	c2	c3	c4	cosine_distance(a3,c2)
NULL	NULL	NULL	NULL	NULL
NULL	NULL	NULL	NULL	NULL
NULL	NULL	NULL	NULL	NULL
NULL	NULL	NULL	NULL	NULL
NULL	NULL	NULL	NULL	NULL
select c1,c2,c3,c4,cosine_distance(a3,c2) from v1 a left join t2 b on cosine_distance(a4,c3)=cosine_distance(a3,c2)  order by cosine_distance(a3,c2);
c1	c2	c3	c4	cosine_distance(a3,c2)
1	[1,1,2]	[2,2,3]	[1,3,2]	NULL
2	[1,0,3]	[1,0,3]	[2,3,2]	NULL
3	[-1,2,2]	[-3,2,3]	[4,3,3]	NULL
4	[-1,-2,-2]	[-4,2,3]	NULL	NULL
5	[-1,-3,-2]	NULL	[2,3,1]	NULL
select c1,c2,c3,c4,cosine_distance(a3,c2) from v1 a cross  join v2 b on cosine_distance(a4,c3)=cosine_distance(a3,c2)  order by cosine_distance(a3,c2);
c1	c2	c3	c4	cosine_distance(a3,c2)
select * from v1 a join v1 b  where a.c2=b.c2 order by l2_distance(a.c3, [1,2,3])  approximate limit 10;
c1	c2	c3	c4	c1	c2	c3	c4
5	[-1,-3,-2]	NULL	[2,3,1]	5	[-1,-3,-2]	NULL	[2,3,1]
1	[1,1,2]	[2,2,3]	[1,3,2]	1	[1,1,2]	[2,2,3]	[1,3,2]
2	[1,0,3]	[1,0,3]	[2,3,2]	2	[1,0,3]	[1,0,3]	[2,3,2]
3	[-1,2,2]	[-3,2,3]	[4,3,3]	3	[-1,2,2]	[-3,2,3]	[4,3,3]
4	[-1,-2,-2]	[-4,2,3]	NULL	4	[-1,-2,-2]	[-4,2,3]	NULL
select * from (select * from v1 order by c1) a join (select c1,c2,c3 from v1 order by c1) b  where cosine_distance(a.c3,b.c2)=cosine_distance(b.c3,a.c2) order by l2_distance(a.c3, [1,2,3]) approximate limit 1,1;
c1	c2	c3	c4	c1	c2	c3
2	[1,0,3]	[1,0,3]	[2,3,2]	2	[1,0,3]	[1,0,3]
select * from t1 order by l2_distance(c3, [1,2,3]) approximate limit 10;
c1	c2	c3	c4
1	[1,1,2]	[2,2,3]	[1,3,2]
2	[1,0,3]	[1,0,3]	[2,3,2]
3	[-1,2,2]	[-3,2,3]	[4,3,3]
4	[-1,-2,-2]	[-4,2,3]	NULL
select cosine_distance(c3,'[1,2.2,3]') ld_c3,cosine_distance(c4,'[1,1.3,1]') ld_c4 from v1 where cosine_distance(c3,c3) <=2 and cosine_distance(c3,c2) >1 ;
ld_c3	ld_c4
0.5468813827686472	NULL
select cosine_distance(c3,'[1,2.2,3]') ld_c3,cosine_distance(c4,'[1,1.3,-1]') ld_c4 from v1 where cosine_distance(c3,c3) =0 and cosine_distance(c3,c2) >0  and cosine_distance(c3,c2) >0 and cosine_distance(c3,c2) >0 and cosine_distance(c3,c2) >0 and cosine_distance(c3,c2) >0 and cosine_distance(c3,c2) >0 and cosine_distance(c3,c2) >0 
and cosine_distance(c3,c2) >0 and cosine_distance(c3,c2) >0 and cosine_distance(c3,c2) >0 and cosine_distance(c3,c2) >0 and cosine_distance(c3,c2) >0 and cosine_distance(c3,c2) >0 and cosine_distance(c3,c2) >0 and cosine_distance(c3,c2) >0 and cosine_distance(c3,c2) >0 and cosine_distance(c3,c2) >0 and cosine_distance(c3,c2) >0 and 
cosine_distance(c3,c2) >0 and cosine_distance(c3,c2) >0 and cosine_distance(c3,c2) >0 and cosine_distance(c3,c2) >0 and cosine_distance(c3,c2) >0 and cosine_distance(c3,c2) >0 and cosine_distance(c3,c2) >0 and cosine_distance(c3,c2) >0 and cosine_distance(c3,c2) >0 and cosine_distance(c3,c2) >0 and cosine_distance(c3,c2) >0 and 
cosine_distance(c3,c2) >0 and cosine_distance(c3,c2) >0 and cosine_distance(c3,c2) >0 and cosine_distance(c3,c2) >0 and cosine_distance(c3,c2) >0 and cosine_distance(c3,c2) >0 and cosine_distance(c3,c2) >0 and cosine_distance(c3,c2) >0 and cosine_distance(c3,c2) >0 and cosine_distance(c3,c2) >0 and cosine_distance(c3,c2) >0 and 
cosine_distance(c3,c2) >0 and cosine_distance(c3,c2) >0 and cosine_distance(c3,c2) >0 and cosine_distance(c3,c2) >0 and cosine_distance(c3,c2) >0 and cosine_distance(c3,c2) >0 and cosine_distance(c3,c2) >0 and cosine_distance(c3,c2) >0 and cosine_distance(c3,c2) >0 and cosine_distance(c3,c2) >0 and cosine_distance(c3,c2) >0 and 
cosine_distance(c3,c2) >0 and cosine_distance(c3,c2) >0 and cosine_distance(c3,c2) >0 and cosine_distance(c3,c2) >0 and cosine_distance(c3,c2) >0 and cosine_distance(c3,c2) >0 and cosine_distance(c3,c2) >0 and cosine_distance(c3,c2) >0 and cosine_distance(c3,c2) >0 and cosine_distance(c3,c2) >0 and cosine_distance(c3,c2) >0 and 
cosine_distance(c3,c2) >0 and cosine_distance(c3,c2) >0 order by c1;
ld_c3	ld_c4
0.030429685555537933	0.5965211389503339
0.42442085441816346	0.5625348750926129
0.5468813827686472	NULL
select cosine_distance(c3,'[1,2.2,3]') ld_c3,cosine_distance(c4,'[1,1.3,-1]') ld_c4 from v1 where cosine_distance(c3,'[1,2,3]') > 0 or cosine_distance(c3,c3) is null order by c1;
ld_c3	ld_c4
0.030429685555537933	0.5965211389503339
0.17911362509136197	0.5075898935704807
0.42442085441816346	0.5625348750926129
0.5468813827686472	NULL
NULL	0.31825984174173727
select cosine_distance(c3,'[1,2.2,3]') ld_c3,cosine_distance(c4,'[1,1.3,-1]') ld_c4 from v1 where cosine_distance(c3,'[1,2,3]') > 0 or cosine_distance(c3,c3) is null or cosine_distance(c3,c3) is null or cosine_distance(c3,c3) is null or cosine_distance(c3,c3) is null or cosine_distance(c3,c3) is null or cosine_distance(c3,c3) 
is null or cosine_distance(c3,c3) is null or cosine_distance(c3,c3) is null or cosine_distance(c3,c3) is null or cosine_distance(c3,c3) is null or cosine_distance(c3,c3) is null or cosine_distance(c3,c3) is null or cosine_distance(c3,c3) is null or cosine_distance(c3,c3) is null or cosine_distance(c3,c3) is null or 
cosine_distance(c3,c3) is null or cosine_distance(c3,c3) is null or cosine_distance(c3,c3) is null or cosine_distance(c3,c3) is null or cosine_distance(c3,c3) is null or cosine_distance(c3,c3) is null or cosine_distance(c3,c3) is null or cosine_distance(c3,c3) is null or cosine_distance(c3,c3) is null or cosine_distance(c3,c3) 
is null or cosine_distance(c3,c3) is null or cosine_distance(c3,c3) is null or cosine_distance(c3,c3) is null or cosine_distance(c3,c3) is null or cosine_distance(c3,c3) is null or cosine_distance(c3,c3) is null or cosine_distance(c3,c3) is null or cosine_distance(c3,c3) is null or cosine_distance(c3,c3) is null or 
cosine_distance(c3,c3) is null or cosine_distance(c3,c3) is null or cosine_distance(c3,c3) is null or cosine_distance(c3,c3) is null or cosine_distance(c3,c3) is null or cosine_distance(c3,c3) is null or cosine_distance(c3,c3) is null or cosine_distance(c3,c3) is null or cosine_distance(c3,c3) is null or cosine_distance(c3,c3)
is null order by c1;
ld_c3	ld_c4
0.030429685555537933	0.5965211389503339
0.17911362509136197	0.5075898935704807
0.42442085441816346	0.5625348750926129
0.5468813827686472	NULL
NULL	0.31825984174173727
select cosine_distance(c3,'[1,2.2,3]') ld_c3,cosine_distance(c4,'[1,1.3,-1]') ld_c4 from v1 where cosine_distance(c3,'[1,2,3]') > 0 or cosine_distance(c3,c3) is null  and c1 >3 order by c1;
ld_c3	ld_c4
0.030429685555537933	0.5965211389503339
0.17911362509136197	0.5075898935704807
0.42442085441816346	0.5625348750926129
0.5468813827686472	NULL
NULL	0.31825984174173727
select  * from v1 where 1 BETWEEN cosine_distance(c3,c3)  and cosine_distance(c3,'[1,2,3]') order by c1;
c1	c2	c3	c4
select  * from v1 where 1 BETWEEN cosine_distance(c3,c3)  and cosine_distance(c3,'[1,2,3]') order by l2_distance(c3, [1,2,3]) approximate limit 10;
c1	c2	c3	c4
select  cosine_distance(c3,'[1,2.2,3]') BETWEEN cosine_distance(c3,c3)  and cosine_distance(c3,'[1,2,3]') from v1 order by c1;
cosine_distance(c3,'[1,2.2,3]') BETWEEN cosine_distance(c3,c3)  and cosine_distance(c3,'[1,2,3]')
0
0
1
1
NULL
select  cosine_distance(c3,'[1,2.2,3]') BETWEEN cosine_distance(c3,c3)  and cosine_distance(c3,'[1,2,3]') from v1 where cosine_distance(c3,'[1,2.2,3]') BETWEEN cosine_distance(c3,c3)  and cosine_distance(c3,'[1,2,3]') >1;
cosine_distance(c3,'[1,2.2,3]') BETWEEN cosine_distance(c3,c3)  and cosine_distance(c3,'[1,2,3]')
select distinct cosine_distance(c2,c3), cosine_distance(c4,c3) from v1 order By c1;
cosine_distance(c2,c3)	cosine_distance(c4,c3)
0.0098524570233256	0.0925147870269698
0	0.3864280089221037
0.07613022912568812	0.8903091363809305
1.3713906763541037	NULL
NULL	NULL
select * from v1 join v2 on cosine_distance(c2,c3)=cosine_distance(a3,a4) order by c1;
c1	c2	c3	c4	a1	a2	a3	a4
drop table if exists t1;
drop view if exists v1;
CREATE TABLE t1 (c1 int primary key, c2 vector(3),c3 vector(3) ,c4 vector(3),
VECTOR INDEX vector_idx(c3) 
WITH (distance=l2, lib=vsag, type=hnsw, m=10, ef_construction=100, ef_search=40));
create view v1 as select * from t1;
insert into v1(c1,c2,c3,c4) values(1,'[1,1,2]','[2,2,3]','[1,3,2]');
insert into v1(c1,c2,c3,c4) values(2,'[1,0,3]','[1,0,3]','[2,3,2]');
insert into v1(c1,c2,c3,c4) values(3,'[-1,2,2]','[-3,2,3]','[4,3,3]');
insert into v1(c1,c2,c3,c4) values(4,'[-1,-2,-2]','[-4,2,3]',null);
insert into v1(c1,c2,c3,c4) values(5,'[-1,-3,-2]',null,'[2,3,1]');
insert into v1 values(1,'[1,1,2]','[2,2,3]','[1,3,2]');
ERROR 23000: Duplicate entry '1' for key 'PRIMARY'
INSERT IGNORE v1(c1) values (cosine_distance([1,20],[2,-1]));
INSERT IGNORE v1 values (5,[1,3,4],[0,1,1],[9,9,9]);
select cosine_distance(c4,c3) from v1 order by c1;
cosine_distance(c4,c3)
0.0925147870269698
0.3864280089221037
0.8903091363809305
NULL
NULL
select cosine_distance(c4,c3) from t1 order by c1;
cosine_distance(c4,c3)
0.0925147870269698
0.3864280089221037
0.8903091363809305
NULL
NULL
drop table if exists t1;
drop view if exists v1;
drop view if exists v2;
CREATE TABLE t1 (c1 int primary key, c2 vector(3),c3 vector(3) ,c4 vector(3),
VECTOR INDEX vector_idx(c3) 
WITH (distance=l2, lib=vsag, type=hnsw, m=10, ef_construction=100, ef_search=40));
create view v1 as select * from t1;
create view v2 as select [1,1,23],cosine_distance([1.23,23.6],[1.11,2.33]) from dual ;
INSERT into t1 values(1,'[1,1,2]','[2,2,3]','[1,3,2]');
INSERT into t1 values(1,'[1,1,2]','[2,2,3]','[1,3,2]') ON DUPLICATE KEY UPDATE c3='[2,2,4]';
INSERT into v1 values(1,'[1,1,2]','[2,2,3]','[1,3,2]') ON DUPLICATE KEY UPDATE c3='[2,2,4]';
select * from v2;
[1,1,23]	cosine_distance([1.23,23.6],[1.11,2.33])
[1,1,23]	0.07604977493925613
drop table if exists t1;
drop view if exists v1;
CREATE TABLE t1 (c1 int primary key, c2 vector(3),c3 vector(3) ,c4 vector(3),
VECTOR INDEX vector_idx(c3) 
WITH (distance=l2, lib=vsag, type=hnsw, m=10, ef_construction=100, ef_search=40));
create view v1 as select * from t1;
replace into v1 values(1,'[1,1,2]','[2,2,3]','[1,3,2]');
replace into v1 values(1,'[1,1,2]','[2,2,3]','[1,3,2]');
drop table if exists t1;
CREATE TABLE t1 (c1 int primary key, c2 vector(3),c3 vector(3) ,c4 vector(3),
VECTOR INDEX vector_idx(c3) 
WITH (distance=l2, lib=vsag, type=hnsw, m=10, ef_construction=100, ef_search=40));
insert into v1(c1,c2,c3,c4) values(1,'[1,1,2]','[2,2,3]','[1,3,2]');
insert into v1(c1,c2,c3,c4) values(2,'[1,0,3]','[1,0,3]','[2,3,2]');
insert into v1(c1,c2,c3,c4) values(3,'[-1,2,2]','[-3,2,3]','[4,3,3]');
insert into v1(c1,c2,c3,c4) values(4,'[-1,-2,-2]','[-4,2,3]',null);
insert into v1(c1,c2,c3,c4) values(5,'[-1,-3,-2]',null,'[2,3,1]');
create UNIQUE index index_01 on t1((cosine_distance([1,20],[2,-1])));
ERROR 23000: Duplicate entry '1.401990062035198' for key 'index_01'
drop view v1;
drop table if exists t1;
drop view if exists v1;
CREATE TABLE t1 (c1 int primary key, c2 vector(3),c3 vector(3) ,c4 vector(3),
VECTOR INDEX vector_idx(c3) 
WITH (distance=l2, lib=vsag, type=hnsw, m=10, ef_construction=100, ef_search=40));
create view v1 as select * from t1;
insert into v1(c1,c2,c3,c4) values(1,'[1,1,2]','[2,2,3]','[1,3,2]');
insert into v1(c1,c2,c3,c4) values(2,'[1,0,3]','[1,0,3]','[2,3,2]');
insert into v1(c1,c2,c3,c4) values(3,'[-1,2,2]','[-3,2,3]','[4,3,3]');
insert into v1(c1,c2,c3,c4) values(4,'[-1,-2,-2]','[-4,2,3]',null);
insert into v1(c1,c2,c3,c4) values(5,'[-1,-3,-2]',null,'[2,3,1]');
update v1 set c2=[1,1,1] where c3 is null;
update v1 set c2=[1,1,1]*[10,10,10] where c3 is null;
update v1 set c1=cosine_distance([1],[100])  where c3 is null;
update v1 set c1=cosine_distance([1],[101])  where c4 is null and c1>1;
ERROR 23000: Duplicate entry '0' for key 'PRIMARY'
select * from t1 order by c1;
c1	c2	c3	c4
0	[10,10,10]	NULL	[2,3,1]
1	[1,1,2]	[2,2,3]	[1,3,2]
2	[1,0,3]	[1,0,3]	[2,3,2]
3	[-1,2,2]	[-3,2,3]	[4,3,3]
4	[-1,-2,-2]	[-4,2,3]	NULL
select * from v1 order by c1;
c1	c2	c3	c4
0	[10,10,10]	NULL	[2,3,1]
1	[1,1,2]	[2,2,3]	[1,3,2]
2	[1,0,3]	[1,0,3]	[2,3,2]
3	[-1,2,2]	[-3,2,3]	[4,3,3]
4	[-1,-2,-2]	[-4,2,3]	NULL
select * from v1 order by cosine_distance([1],[c1]);
c1	c2	c3	c4
0	[10,10,10]	NULL	[2,3,1]
1	[1,1,2]	[2,2,3]	[1,3,2]
2	[1,0,3]	[1,0,3]	[2,3,2]
3	[-1,2,2]	[-3,2,3]	[4,3,3]
4	[-1,-2,-2]	[-4,2,3]	NULL
drop table if exists t1;
drop view if exists v1;
CREATE TABLE t1 (c1 int primary key, c2 vector(3),c3 vector(3) ,c4 vector(3),
VECTOR INDEX vector_idx(c3) 
WITH (distance=l2, lib=vsag, type=hnsw, m=10, ef_construction=100, ef_search=40));
create view v1 as select * from t1;
insert into v1(c1,c2,c3,c4) values(1,'[1,1,2]','[2,2,3]','[1,3,2]');
insert into v1(c1,c2,c3,c4) values(2,'[1,0,3]','[1,0,3]','[2,3,2]');
insert into v1(c1,c2,c3,c4) values(3,'[-1,2,2]','[-3,2,3]','[4,3,3]');
insert into v1(c1,c2,c3,c4) values(4,'[-1,-2,-2]','[-4,2,3]',null);
insert into v1(c1,c2,c3,c4) values(5,'[-1,-3,-2]',null,'[2,3,1]');
update v1 join t1 on v1.c2 =t1.c2 set t1.c2 =[1,2,4] where t1.c3 is null;
update v1 join t1 on v1.c1 =t1.c1 set t1.c2 =[1,2,4] where v1.c4 is null;
select * from t1 order by c1;
c1	c2	c3	c4
1	[1,1,2]	[2,2,3]	[1,3,2]
2	[1,0,3]	[1,0,3]	[2,3,2]
3	[-1,2,2]	[-3,2,3]	[4,3,3]
4	[1,2,4]	[-4,2,3]	NULL
5	[1,2,4]	NULL	[2,3,1]
select * from v1 order by c1;
c1	c2	c3	c4
1	[1,1,2]	[2,2,3]	[1,3,2]
2	[1,0,3]	[1,0,3]	[2,3,2]
3	[-1,2,2]	[-3,2,3]	[4,3,3]
4	[1,2,4]	[-4,2,3]	NULL
5	[1,2,4]	NULL	[2,3,1]
select * from v1 order by cosine_distance([1],[c1]);
c1	c2	c3	c4
1	[1,1,2]	[2,2,3]	[1,3,2]
2	[1,0,3]	[1,0,3]	[2,3,2]
3	[-1,2,2]	[-3,2,3]	[4,3,3]
4	[1,2,4]	[-4,2,3]	NULL
5	[1,2,4]	NULL	[2,3,1]
select count(*) from t1,v1 order by t1.c1;
count(*)
25
select count(*) from t1,v1 where t1.c2=v1.c3 order by t1.c1;
count(*)
1
drop table if exists t1;
drop view if exists v1;
CREATE TABLE t1 (c1 int primary key, c2 vector(3),c3 vector(3) ,c4 vector(3),
VECTOR INDEX vector_idx(c3) 
WITH (distance=l2, lib=vsag, type=hnsw, m=10, ef_construction=100, ef_search=40));
create view v1 as select * from t1;
insert into v1(c1,c2,c3,c4) values(1,'[1,1,2]','[2,2,3]','[1,3,2]');
insert into v1(c1,c2,c3,c4) values(2,'[1,0,3]','[1,0,3]','[2,3,2]');
insert into v1(c1,c2,c3,c4) values(3,'[-1,2,2]','[-3,2,3]','[4,3,3]');
insert into v1(c1,c2,c3,c4) values(4,'[-1,-2,-2]','[-4,2,3]',null);
insert into v1(c1,c2,c3,c4) values(5,'[-1,-3,-2]',null,'[2,3,1]');
delete from v1 where c1=1;
delete from v1 where c1=cosine_distance([1],[c1]);
drop table if exists t1;
drop view if exists v1;
CREATE TABLE t1 (c1 int primary key, c2 vector(3),c3 vector(3) ,c4 vector(3));
create view v1 as select * from t1;
insert into v1(c1,c2,c3,c4) values(1,'[1,1,2]','[2,2,3]','[1,3,2]');
insert into v1(c1,c2,c3,c4) values(2,'[1,0,3]','[1,0,3]','[2,3,2]');
insert into v1(c1,c2,c3,c4) values(3,'[-1,2,2]','[-3,2,3]','[4,3,3]');
insert into v1(c1,c2,c3,c4) values(4,'[-1,-2,-2]','[-4,2,3]',null);
insert into v1(c1,c2,c3,c4) values(5,'[-1,-3,-2]',null,'[2,3,1]');
CREATE VECTOR INDEX vector_idx_c2  ON v1 (c2)  WITH (distance=l2, lib=vsag, type=hnsw, m=10, ef_construction=10, ef_search=40);
ERROR 0A000: the vector index params ef_construction less than or equal to m value is not supported
drop table if exists t1;
drop view if exists v1;
CREATE TABLE t1 (c1 int , c2 VARCHAR(30),c3 vector(3) ,c4 vector(3))PARTITION BY KEY(c1) PARTITIONS 4;
insert into t1(c1,c2,c3,c4) values(1,'[1,1,2]','[2,2,3]','[1,3,2]');
insert into t1(c1,c2,c3,c4) values(2,'[1,0,3]','[1,0,3]','[2,3,2]');
insert into t1(c1,c2,c3,c4) values(3,'[-1,2,2]','[-3,2,3]','[4,3,3]');
insert into t1(c1,c2,c3,c4) values(4,'[-1,-2,-2]','[-4,2,3]',null);
insert into t1(c1,c2,c3,c4) values(5,'[-1,-3,-2]',null,'[2,3,1]');
create view v1 as select * from t1;
insert /*+ direct(true,100) enable_parallel_dml parallel(2)*/ into v1 select c1,c2,c3,c4 from t1;
insert  into t1 select c1,c2,c3,c4 from t1;
insert /*+ direct(true,100) enable_parallel_dml parallel(2) append*/ into t1 select c1,c2,c3,c4 from t1;
select cosine_distance(c3,c2) from v1  group by cosine_distance(c3,[1,2,3]) order by c1;
cosine_distance(c3,c2)
0.0098524570233256
0
0.07613022912568812
1.3713906763541037
NULL
select cosine_distance(c3,c2) from v1  group by cosine_distance(c3,[1,2,3]) order by cosine_distance(c3, [1,2,3]) APPROX limit 10,100;
cosine_distance(c3,c2)
select cosine_distance(c3,c2) from v1  group by cosine_distance(c3,[1,2,3]) order by cosine_distance(c3, [1,2,3]) APPROX limit 100000000;
cosine_distance(c3,c2)
NULL
0.0098524570233256
0
0.07613022912568812
1.3713906763541037
drop table if exists t1;
drop view if exists v1;
CREATE TABLE t1 (c1 int primary key, c2 VARCHAR(30),c3 vector(3) ,c4 vector(3),
VECTOR INDEX vector_idx(c3) 
WITH (distance=l2, lib=vsag, type=hnsw, m=10, ef_construction=100, ef_search=40)) partition by list columns (c1)(
PARTITION p0 VALUES in(10),
PARTITION p1 VALUES in(50)
);
create view v1 as select * from t1;
replace into v1 values(1,'[1,1,2]','[2,2,3]','[1,3,2]');
ERROR HY000: Table has no partition for value
replace into t1 values(1,'[1,1,2]','[2,2,3]','[1,3,2]');
ERROR HY000: Table has no partition for value
replace into v1 values(10,'[1,1,2]','[2,2,3]','[1,3,2]');
replace into v1 values(10,'[1,1,2]','[2,2,3]','[1,3,2]');
replace into t1 select c1,c2,c3,c4 from v1;
drop table if exists t1;
drop table if exists tt1;
drop view if exists v1;
CREATE TABLE t1 (c1 int primary key, c2 varchar(30),c3 vector(3) ,c4 vector(3),
VECTOR INDEX vector_idx(c3) 
WITH (distance=l2, lib=vsag, type=hnsw, m=10, ef_construction=100, ef_search=40))PARTITION BY KEY(c1) PARTITIONS 4;
insert into t1(c1,c2,c3,c4) values(1,'[1,1,2]','[2,2,3]','[1,3,2]');
insert into t1(c1,c2,c3,c4) values(2,'[1,0,3]','[1,0,3]','[2,3,2]');
insert into t1(c1,c2,c3,c4) values(3,'[-1,2,2]','[-3,2,3]','[4,3,3]');
insert into t1(c1,c2,c3,c4) values(4,'[-1,-2,-2]','[-4,2,3]',null);
insert into t1(c1,c2,c3,c4) values(5,'[-1,-3,-2]',null,'[2,3,1]');
create view v1 as  select * from t1 order by c1;
insert into v1(c1,c2,c3,c4) values(6,'[-1,-3,-2]',null,'[2,3,1]');
replace into v1 values(10,'[1,1,2]','[2,2,3]','[1,3,2]');
replace into v1 values(10,'[1,1,2]','[2,2,3]','[1,3,2]');
select * from v1 order by cosine_distance(c3, c4)  limit 10;
c1	c2	c3	c4
6	[-1,-3,-2]	NULL	[2,3,1]
5	[-1,-3,-2]	NULL	[2,3,1]
4	[-1,-2,-2]	[-4,2,3]	NULL
10	[1,1,2]	[2,2,3]	[1,3,2]
1	[1,1,2]	[2,2,3]	[1,3,2]
2	[1,0,3]	[1,0,3]	[2,3,2]
3	[-1,2,2]	[-3,2,3]	[4,3,3]
drop table if exists t1;
drop table if exists tt1;
drop view if exists v1;
CREATE TABLE t1 (c1 int primary key, c2 varchar(30),c3 vector(3) ,c4 vector(3),
VECTOR INDEX vector_idx(c3) 
WITH (distance=l2, lib=vsag, type=hnsw, m=10, ef_construction=100, ef_search=40))PARTITION BY KEY(c1) PARTITIONS 4;
insert into t1(c1,c2,c3,c4) values(1,'[1,1,2]','[2,2,3]','[1,3,2]');
insert into t1(c1,c2,c3,c4) values(2,'[1,0,3]','[1,0,3]','[2,3,2]');
insert into t1(c1,c2,c3,c4) values(3,'[-1,2,2]','[-3,2,3]','[4,3,3]');
insert into t1(c1,c2,c3,c4) values(4,'[-1,-2,-2]','[-4,2,3]',null);
insert into t1(c1,c2,c3,c4) values(5,'[-1,-3,-2]',null,'[2,3,1]');
create view v1 as  select * from t1;
insert into v1(c1,c2,c3,c4) values(1,'[1,2,3]','[1,3,3]','[2,1,2]') ON DUPLICATE KEY UPDATE c2='[1,null,3]';
drop table if exists t1;
drop table if exists tt1;
drop view if exists v1;
CREATE TABLE t1 (c1 int primary key, c2 vector(3),c3 vector(3) ,c4 vector(3),
VECTOR INDEX vector_idx(c3) 
WITH (distance=l2, lib=vsag, type=hnsw, m=10, ef_construction=100, ef_search=40))PARTITION BY KEY(c1) PARTITIONS 4;
insert into t1(c1,c2,c3,c4) values(1,'[1,1,2]','[2,2,3]','[1,3,2]');
insert into t1(c1,c2,c3,c4) values(2,'[1,0,3]','[1,0,3]','[2,3,2]');
insert into t1(c1,c2,c3,c4) values(3,'[-1,2,2]','[-3,2,3]','[4,3,3]');
insert into t1(c1,c2,c3,c4) values(4,'[-1,-2,-2]','[-4,2,3]',null);
insert into t1(c1,c2,c3,c4) values(5,'[-1,-3,-2]',null,'[2,3,1]');
create view v1 as  select * from t1;
update v1 set c1 = 10 where c1 =5;
update v1 set c2 = '[1,23,null]' where c1 =5;
update v1 set c2 = '[1,23,abs(null)]' where c1 =5;
update v1 set c2 =[cosine_distance('[1,3,2]','[1,1,2]'),cosine_distance('[1,2,2]','[1,1,11]'),cosine_distance('[1,1,2]','[1,1,2]')] where c3 is null;
update v1 set c1 = cosine_distance('[1,8,2]','[1,1,2]') where c3 = '[2,2,3]';
update v1 set c1 = cosine_distance('[1,10,2]','[1,1,2]'),c2 = '[1,1,1]',c3 = '[0,1,0]',c4 = '[0.1,1.2,100]' where c4 = '[2,3,2]';
ERROR 23000: Duplicate entry '0' for key 'PRIMARY'
update v1 set c2 ='[1,2,3]' where c1 >cosine_distance('[1,1,2]','[1,2,2]');
update v1 set c2 =[1,2,3] where c1 >cosine_distance('[1,1,2]','[1,2,2]');
update v1 set c2 =[2,2,3] where c1 <cosine_distance('[1,1,2]','[1,2,2]');
update v1 set c2 =[1,2,3] where c1 >=cosine_distance('[1,1,2]','[1,2,2]');
update v1 set c2 =[2,2,3] where c1 <=cosine_distance('[1,1,2]','[1,2,2]');
update v1 set c2 =[1,2,3] where c1 =cosine_distance('[1,1,2]','[1,2,2]');
update v1 set c2 =[2,2,3] where c1 <>cosine_distance('[1,1,2]','[1,2,2]');
update v1 set c2 =[1,2,3] where c1 > cosine_distance('[1,3,2]','[1,2,2]') and c1 > cosine_distance('[1,3,2]','[1,2,2]');
update v1 set c2 =[2,2,3] where c1 < cosine_distance('[1,1,2]','[1,2,2]') or c1 > cosine_distance('[1,3,2]','[1,2,2]') ;
##分区表后创建向量索引  导致hang
drop table if exists t1;
CREATE TABLE t1 (c1 int primary key, c2 VARCHAR(30),c3 vector(3) ,c4 vector(3),
VECTOR INDEX vector_idx_c3(c3) 
WITH (distance=l2, lib=vsag, type=hnsw, m=10, ef_construction=100, ef_search=40))
PARTITION BY RANGE(c1) (
PARTITION p0 VALUES less than(5),
PARTITION p1 VALUES less than(6),
PARTITION p2 VALUES less than(9),
PARTITION p5 VALUES less than (MAXVALUE));
insert into t1(c1,c2,c3,c4) values(1,'[1,1,2]','[2,2,3]','[1,3,2]');
insert into t1(c1,c2,c3,c4) values(3,'[1,0,3]','[1,0,3]','[2,3,2]');
insert into t1(c1,c2,c3,c4) values(4,'[-1,2,2]','[-3,2,3]','[4,3,3]');
insert into t1(c1,c2,c3,c4) values(7,'[-1,-2,-2]','[-4,2,3]',null);
insert into t1(c1,c2,c3,c4) values(8,'[-1,-3,-2]',null,'[2,3,1]');
CREATE VECTOR INDEX vector_idx_c4  ON t1 (c4)  WITH (distance=l2, lib=vsag, type=hnsw, m=10, ef_construction=100, ef_search=40);
##普通表后创建向量索引  
drop table if exists t1;
CREATE TABLE t1 (c1 int primary key, c2 VARCHAR(30),c3 vector(3) ,c4 vector(3),
VECTOR INDEX vector_idx_c3(c3) 
WITH (distance=l2, lib=vsag, type=hnsw, m=10, ef_construction=100, ef_search=40));
insert into t1(c1,c2,c3,c4) values(1,'[1,1,2]','[2,2,3]','[1,3,2]');
insert into t1(c1,c2,c3,c4) values(3,'[1,0,3]','[1,0,3]','[2,3,2]');
insert into t1(c1,c2,c3,c4) values(4,'[-1,2,2]','[-3,2,3]','[4,3,3]');
insert into t1(c1,c2,c3,c4) values(7,'[-1,-2,-2]','[-4,2,3]',null);
insert into t1(c1,c2,c3,c4) values(8,'[-1,-3,-2]',null,'[2,3,1]');
CREATE VECTOR INDEX vector_idx_c4  ON t1 (c4)  WITH (distance=l2, lib=vsag, type=hnsw, m=10, ef_construction=100, ef_search=40);
##普通表后创建普通索引 
drop table if exists t1;
CREATE TABLE t1 (c1 int primary key, c2 VARCHAR(30),c3 vector(3) ,c4 vector(3),
VECTOR INDEX vector_idx_c3(c3) 
WITH (distance=l2, lib=vsag, type=hnsw, m=10, ef_construction=100, ef_search=40));
insert into t1(c1,c2,c3,c4) values(1,'[1,1,2]','[2,2,3]','[1,3,2]');
insert into t1(c1,c2,c3,c4) values(3,'[1,0,3]','[1,0,3]','[2,3,2]');
insert into t1(c1,c2,c3,c4) values(4,'[-1,2,2]','[-3,2,3]','[4,3,3]');
insert into t1(c1,c2,c3,c4) values(7,'[-1,-2,-2]','[-4,2,3]',null);
insert into t1(c1,c2,c3,c4) values(8,'[-1,-3,-2]',null,'[2,3,1]');
CREATE  INDEX vector_idx_c3  ON t1 (c3) ;
ERROR 0A000: create index on vector or array column is not supported
CREATE  INDEX vector_idx_c1  ON t1 (c1) ;
drop table if exists t1;
CREATE TABLE t1 (c1 int primary key, c2 VARCHAR(30),c3 vector(3) ,c4 vector(3),
VECTOR INDEX vector_idx_c3(c3) 
WITH (distance=l2, lib=vsag, type=hnsw, m=10, ef_construction=100, ef_search=40))
PARTITION BY RANGE(c1) (
PARTITION p0 VALUES less than(5),
PARTITION p1 VALUES less than(6),
PARTITION p2 VALUES less than(9),
PARTITION p5 VALUES less than (MAXVALUE));
insert into t1(c1,c2,c3,c4) values(1,'[1,1,2]','[2,2,3]','[1,3,2]');
insert into t1(c1,c2,c3,c4) values(3,'[1,0,3]','[1,0,3]','[2,3,2]');
insert into t1(c1,c2,c3,c4) values(4,'[-1,2,2]','[-3,2,3]','[4,3,3]');
insert into t1(c1,c2,c3,c4) values(7,'[-1,-2,-2]','[-4,2,3]',null);
insert into t1(c1,c2,c3,c4) values(8,'[-1,-3,-2]',null,'[2,3,1]');
insert into t1(c1,c2,c3,c4) values(9,'[1,1,2]','[2,2,3]','[1,3,2]');
insert into t1(c1,c2,c3,c4) values(10,'[1,0,3]','[1,0,3]','[2,3,2]');
insert into t1(c1,c2,c3,c4) values(2,'[-1,2,2]','[-3,2,3]','[4,3,3]');
insert into t1(c1,c2,c3,c4) values(11,'[-1,-2,-2]','[-4,2,3]',null);
insert into t1(c1,c2,c3,c4) values(100,null,null,null);
replace into t1(c1,c2,c3,c4) values(11,'[-1,-2,-2]','[-4,2,3]',null);
replace into t1(c1,c2,c3,c4) values(11,'[-1,-1,-2]','[-4,2,3]',null);
select * from t1 PARTITION (p2) order by cosine_distance(c3, c2) approximate limit 10 ;
ERROR 0A000: Using vector index without const param is not supported
select * from t1 PARTITION (p5) order by cosine_distance(c3, [1,2,3]) approximate limit 10 ;
c1	c2	c3	c4
100	NULL	NULL	NULL
9	[1,1,2]	[2,2,3]	[1,3,2]
10	[1,0,3]	[1,0,3]	[2,3,2]
11	[-1,-1,-2]	[-4,2,3]	NULL
select * from t1 PARTITION (p2) order by cosine_distance(c3, [1,2,3]) approximate limit 10 ;
c1	c2	c3	c4
8	[-1,-3,-2]	NULL	[2,3,1]
7	[-1,-2,-2]	[-4,2,3]	NULL
select * from t1  PARTITION (p2) order by cosine_distance(c3, c2) approximate limit 10  ;
ERROR 0A000: Using vector index without const param is not supported
select cosine_distance(c3, c2) from t1 PARTITION (p2) union all select cosine_distance(c3, [1,2,3]) from t1 PARTITION (p5) ;
cosine_distance(c3, c2)
1.3713906763541037
NULL
0.027694414671753376
0.15484574527148343
0.5533374997130814
NULL
CREATE VECTOR INDEX vector_idx_c4  ON t1 (c4)  WITH (distance=l2, lib=vsag, type=hnsw, m=10, ef_construction=100, ef_search=40);
drop index vector_idx_c4 on t1;
drop table if exists t1;
CREATE TABLE t1 (c1 int primary key, c2 varchar(30),c3 vector(3) ,c4 vector(3),c5 double AS (cosine_distance([1],[1])) STORED,
VECTOR INDEX vector_idx(c3) 
WITH (distance=l2, lib=vsag, type=hnsw, m=10, ef_construction=100, ef_search=40));
insert into t1(c1,c2,c3,c4) values(1,'[1,1,2]','[2,2,3]','[1,3,2]');
insert into t1(c1,c2,c3,c4) values(2,'[1,0,3]','[1,0,3]','[2,3,2]');
insert into t1(c1,c2,c3,c4) values(3,'[-1,2,2]','[-3,2,3]','[4,3,3]');
drop table if exists t1;
CREATE TABLE t1 (c1 int primary key, c2 varchar(30),c3 vector(3) ,c4 vector(3),c5 vector(3) AS (c2+c3) STORED);
##查看表结构报错4016
drop table if exists t1;
CREATE TABLE t1 (c1 int primary key, c2 varchar(30),c3 vector(3) ,c4 vector(3),c5 vector(3) AS ([1,2,3]) STORED);
drop table if exists t1;
drop table if exists tt1;
CREATE TABLE t1 (c1 int primary key, c2 varchar(30),c3 vector(3) ,c4 vector(3),c5 double AS (cosine_distance([1],[1])) STORED,
VECTOR INDEX vector_idx(c3) 
WITH (distance=l2, lib=vsag, type=hnsw, m=10, ef_construction=100, ef_search=40))PARTITION BY KEY(c1) PARTITIONS 4;
insert into t1(c1,c2,c3,c4) values(1,'[1,1,2]','[2,2,3]','[1,3,2]');
insert into t1(c1,c2,c3,c4) values(2,'[1,0,3]','[1,0,3]','[2,3,2]');
insert into t1(c1,c2,c3,c4) values(3,'[-1,2,2]','[-3,2,3]','[4,3,3]');
insert into t1(c1,c2,c3,c4) values(4,'[-1,-2,-2]','[-4,2,3]',null);
insert into t1(c1,c2,c3,c4) values(5,'[-1,-3,-2]',null,'[2,3,1]');
CREATE TABLE tt1 LIKE t1;
insert INTO tt1(c1,c2,c3,c4) SELECT c1,c2,c3,c4  FROM t1;
replace INTO tt1(c1,c2,c3,c4) SELECT c1,c2,c3,c4  FROM t1;
select * from tt1 a ,t1 b order by cosine_distance(b.c3, [1,2,3])  limit 1,1;
c1	c2	c3	c4	c5	c1	c2	c3	c4	c5
1	[1,1,2]	[2,2,3]	[1,3,2]	0	5	[-1,-3,-2]	NULL	[2,3,1]	0
drop table if exists t1;
drop table if exists tt1;
drop table if exists tt2;
CREATE TABLE t1 (c1 int primary key, c2 varchar(30),c3 vector(3) ,c4 vector(3),
VECTOR INDEX vector_idx(c3) 
WITH (distance=l2, lib=vsag, type=hnsw, m=10, ef_construction=100, ef_search=40))PARTITION BY KEY(c1) PARTITIONS 4;
insert into t1(c1,c2,c3,c4) values(1,'[1,1,2]','[2,2,3]','[1,3,2]');
insert into t1(c1,c2,c3,c4) values(2,'[1,0,3]','[1,0,3]','[2,3,2]');
insert into t1(c1,c2,c3,c4) values(3,'[-1,2,2]','[-3,2,3]','[4,3,3]');
insert into t1(c1,c2,c3,c4) values(4,'[-1,-2,-2]','[-4,2,3]',null);
insert into t1(c1,c2,c3,c4) values(5,'[-1,-3,-2]',null,'[2,3,1]');
CREATE TABLE tt1 as select * from t1;
CREATE TABLE tt2 like t1;
replace INTO tt1(c1,c2,c3,c4) SELECT c1,c2,c3,c4  FROM t1;
replace INTO tt1(c1,c2,c3,c4) SELECT c1,c2,c3,c4  FROM t1;
replace INTO tt2(c1,c2,c3,c4) SELECT c1,c2,c3,c4  FROM t1;
replace INTO tt2(c1,c2,c3,c4) SELECT c1,c2,c3,c4  FROM t1;
drop table if exists t1;
drop table if exists tt1;
drop table if exists tt2;
CREATE TABLE t1 (c1 int primary key, c2 varchar(30),c3 vector(3) ,c4 vector(3),
VECTOR INDEX vector_idx(c3) 
WITH (distance=l2, lib=vsag, type=hnsw, m=10, ef_construction=100, ef_search=40))PARTITION BY KEY(c1) PARTITIONS 4;
CREATE TABLE tt1 like t1;
insert into t1(c1,c2,c3,c4) values(1,'[1,1,2]','[2,2,3]','[1,3,2]');
insert into t1(c1,c2,c3,c4) values(2,'[1,0,3]','[1,0,3]','[2,3,2]');
insert into t1(c1,c2,c3,c4) values(3,'[-1,2,2]','[-3,2,3]','[4,3,3]');
insert into t1(c1,c2,c3,c4) values(4,'[-1,-2,-2]','[-4,2,3]',null);
insert into t1(c1,c2,c3,c4) values(5,'[-1,-3,-2]',null,'[2,3,1]');
insert into tt1(c1,c2,c3,c4) values(1,'[1,1,2]','[2,2,3]','[1,3,2]');
insert into tt1(c1,c2,c3,c4) values(2,'[1,0,3]','[1,0,3]','[2,3,2]');
insert into tt1(c1,c2,c3,c4) values(3,'[-1,2,2]','[-3,2,3]','[4,3,3]');
insert into tt1(c1,c2,c3,c4) values(4,'[-1,-2,-2]','[-4,2,3]',null);
insert into tt1(c1,c2,c3,c4) values(5,'[-1,-3,-2]',null,'[2,3,1]');
CREATE TABLE tt2 as select * from t1;
select count(*) from t1 a,tt1 b order by cosine_distance(a.c3, [1,2,3]) approximate limit 10;
count(*)
25
select count(*) from t1 a,tt2 b order by cosine_distance(a.c3, [1,2,3]) approximate limit 10;
count(*)
25
select count(*) from tt1 a,tt2 b order by cosine_distance(a.c3, [1,2,3]) approximate limit 10;
count(*)
25
select count(*) from tt1 a ,tt2 b ,t1 c order by cosine_distance(a.c3, [1,2,3]) approximate limit 10;
count(*)
125
select count(*) from t1 a,tt1 b where cosine_distance(a.c2,b.c3)=cosine_distance(a.c3,b.c4) order by cosine_distance(a.c3, [1,2,3]) approximate limit 10;
count(*)
0
select count(*) from t1 a,tt2 b where cosine_distance(a.c2,b.c3)=cosine_distance(a.c3,b.c4) order by cosine_distance(a.c3, [1,2,3]) approximate limit 10;
count(*)
0
select count(*) from tt1 a,tt2 b where cosine_distance(a.c2,b.c3)=cosine_distance(a.c3,b.c4) order by cosine_distance(a.c3, [1,2,3]) approximate limit 10;
count(*)
0
select count(*) from tt1 a,tt2 b where cosine_distance(a.c2,[0.123,0.523,0.852])=cosine_distance(a.c3,[0.123,0.523,0.852]) order by cosine_distance(a.c3, [1,2,3]) approximate limit 10;
count(*)
5
drop table if exists t1;
drop table if exists tt1;
drop table if exists tt2;
CREATE TABLE t1 (c1 int primary key, c2 varchar(30),c3 vector(3) ,c4 vector(3),
VECTOR INDEX vector_idx(c3) 
WITH (distance=l2, lib=vsag, type=hnsw, m=10, ef_construction=100, ef_search=40))PARTITION BY KEY(c1) PARTITIONS 4;
insert into t1(c1,c2,c3,c4) values(1,'[1,1,2]','[2,2,3]','[1,3,2]');
insert into t1(c1,c2,c3,c4) values(2,'[1,0,3]','[1,0,3]','[2,3,2]');
insert into t1(c1,c2,c3,c4) values(3,'[-1,2,2]','[-3,2,3]','[4,3,3]');
insert into t1(c1,c2,c3,c4) values(4,'[-1,-2,-2]','[-4,2,3]',null);
insert into t1(c1,c2,c3,c4) values(5,'[-1,-3,-2]',null,'[2,3,1]');
CREATE TABLE tt1 like t1;
replace into tt1(c1,c2,c3,c4) values(1,'[1,1,2]','[2,2,3]','[1,3,2]');
CREATE VECTOR INDEX vector_idx_c1  ON tt1 (c3)  WITH (distance=l2, lib=vsag, type=hnsw, m=10, ef_construction=100, ef_search=40);
ERROR 0A000: create vector index on column has vector index is not supported
CREATE VECTOR INDEX vector_idx_c2  ON tt1 (c3)  WITH (distance=l2, lib=vsag, type=hnsw, m=10, ef_construction=100, ef_search=40);
ERROR 0A000: create vector index on column has vector index is not supported
CREATE VECTOR INDEX vector_idx_c3  ON tt1 (c3)  WITH (distance=l2, lib=vsag, type=hnsw, m=10, ef_construction=100, ef_search=40);
ERROR 0A000: create vector index on column has vector index is not supported
CREATE VECTOR INDEX vector_idx_c4  ON tt1 (c3)  WITH (distance=l2, lib=vsag, type=hnsw, m=10, ef_construction=100, ef_search=40);
ERROR 0A000: create vector index on column has vector index is not supported
CREATE VECTOR INDEX vector_idx_c5  ON tt1 (c3)  WITH (distance=l2, lib=vsag, type=hnsw, m=10, ef_construction=100, ef_search=40);
ERROR 0A000: create vector index on column has vector index is not supported
CREATE VECTOR INDEX 中文123  ON tt1 (c3)  WITH (distance=l2, lib=vsag, type=hnsw, m=10, ef_construction=100, ef_search=40);
ERROR 0A000: create vector index on column has vector index is not supported
select * from  tt1  order by cosine_distance(c3, [1,2,3])  limit 10;
c1	c2	c3	c4
1	[1,1,2]	[2,2,3]	[1,3,2]
select c2+c3 from tt1 order by cosine_distance(c3, [1,2,3])  limit 10;
c2+c3
[3,3,5]
select c2+c3 from tt1 order by cosine_distance(c3, [1,2,3])  limit 10;
c2+c3
[3,3,5]
select avg(c2+c3) from tt1 order by cosine_distance(c3, [1,2,3])  limit 10;
avg(c2+c3)
[3,3,5]
select avg(c2+c3) from tt1 order by cosine_distance(c3, [1,2,3])  limit 10;
avg(c2+c3)
[3,3,5]
select avg(c2+c3) from tt1 order by cosine_distance(avg(c3), [1,2,3])  limit 10;
avg(c2+c3)
[3,3,5]
drop table if exists t1;
CREATE TABLE t1 (c1 int primary key, c2 varchar(30),c3 vector(3) ,c4 vector(3),
VECTOR INDEX vector_idx(c3) 
WITH (distance=l2, lib=vsag, type=hnsw, m=10, ef_construction=100, ef_search=40))PARTITION BY KEY(c1) PARTITIONS 4;
CREATE INDEX idx1 ON t1(((cosine_distance([2,2,3], [1,2,3]))));
CREATE INDEX idx1 ON t1((c2+c3));
ERROR HY000: Functional index on a column is not supported. Consider using a regular index instead.
CREATE INDEX idx11 ON t1(c1);
drop table if exists t1;
drop table if exists tt1;
CREATE TABLE t1 (c1 int primary key, c2 varchar(30),c3 vector(3),c4 vector(3),
VECTOR INDEX vector_idx(c3) 
WITH (distance=l2, lib=vsag, type=hnsw, m=10, ef_construction=100, ef_search=40))PARTITION BY KEY(c1) PARTITIONS 4;
insert into t1(c1,c2,c3,c4) values(3,'[-1,2,2]','[-3,2,3]','[4,3,3]');
insert into t1(c1,c2,c3,c4) values(4,'[-1,-2,-2]','[-4,2,3]',null);
insert into t1(c1,c2,c3,c4) values(5,'[-1,-3,-2]',null,'[2,3,1]');
select cosine_distance([2,2,3], c2) from t1 order by cosine_distance(c3, [1,2,3]) approximate limit 10;
cosine_distance([2,2,3], c2)
1.9074852129730302
0.3532383332364454
1.9701425001453319
drop table if exists t1;
drop table if exists tt1;
CREATE TABLE t1 (c1 int primary key, c2 varchar(30) ,c3 vector(3),c4 vector(3),
VECTOR INDEX vector_idx(c3) 
WITH (distance=l2, lib=vsag, type=hnsw, m=10, ef_construction=100, ef_search=40))PARTITION BY KEY(c1) PARTITIONS 4;
ALTER TABLE t1  DROP PARTITION p1;
ERROR 0A000: Drop hash partition not supported
ALTER TABLE t1 ADD CONSTRAINT chk_c3_range CHECK (cosine_distance(c3, [1,2,3])>1.5);
drop table if exists t1;
CREATE TABLE t1 (c1 int primary key, c2 varchar(30),c3 vector(3) ,c4 vector(3))PARTITION BY KEY(c1) PARTITIONS 4;
drop table if exists t1;
drop table if exists tt1;
CREATE TABLE t1 (c1 int primary key, c2 varchar(30),c3 vector(3) ,c4 vector(3),c5 double AS (cosine_distance([1],[1])) STORED)PARTITION BY KEY(c5) PARTITIONS 4;
insert into t1(c1,c2,c3,c4) values(1,'[1,1,2]','[2,2,3]','[1,3,2]');
insert into t1(c1,c2,c3,c4) values(2,'[1,0,3]','[1,0,3]','[2,3,2]');
insert into t1(c1,c2,c3,c4) values(3,'[-1,2,2]','[-3,2,3]','[4,3,3]');
insert into t1(c1,c2,c3,c4) values(4,'[-1,-2,-2]','[-4,2,3]',null);
insert into t1(c1,c2,c3,c4) values(5,'[-1,-3,-2]',null,'[2,3,1]');
CREATE TABLE tt1 LIKE t1;
INSERT INTO tt1(c1,c2,c3,c4) SELECT c1,c2,c3,c4  FROM t1;
ALTER TABLE t1 DROP COLUMN c5;
ERROR HY000: Column 'c5' has a partitioning function dependency and cannot be dropped or renamed.
drop table if exists t1;
CREATE TABLE t1 (c1 int primary key, c2 varchar(30),c3 vector(3) ,c4 vector(3),c5 double AS (cosine_distance([1],[1])) STORED)PARTITION BY KEY(c5) PARTITIONS 4;
drop table if exists t1;
CREATE TABLE t1 (c1 int  primary key, c2 vector(3),c3 vector(3) ,c4 vector(3),check (c1 >cosine_distance('[1,1]','[3,10,10]')));
insert into t1(c1,c2,c3,c4) values(1,'[1,1,2]','[2,2,3]','[1,3,2]');
ERROR HY000: check constraint violated
drop table if exists t1;
CREATE TABLE t1 (c1 int  primary key, c2 vector(3),c3 vector(3) ,c4 vector(3),check (c2 != [1,1,1]));
insert into t1(c1,c2,c3,c4) values(1,'[1,1,1]','[2,2,3]','[1,3,2]');
ERROR HY000: check constraint violated
drop table if exists t1;
drop materialized view if exists mv1;
CREATE TABLE t1 (c1 int primary key, c2 vector(3),c3 vector(3) ,c4 vector(3),
VECTOR INDEX vector_idx(c3)
WITH (distance=l2, lib=vsag, type=hnsw, m=10, ef_construction=100, ef_search=40));
insert into t1 values(1,'[1,1,2]','[2,2,3]','[1,3,2]');
create materialized view mv1  parallel 2 refresh complete on demand  as select * from t1;
replace into t1 select * from mv1;
drop table if exists t1;
drop materialized view if exists mv1;
CREATE TABLE t1 (c1 int primary key, c2 vector(3),c3 vector(3) ,c4 vector(3));
insert into t1 values(1,'[1,1,2]','[2,2,3]','[1,3,2]');
create materialized view mv1  parallel 2 refresh complete on demand  as select * from t1 order by cosine_distance(c3, [1,2,3]) limit 10;
replace into t1 select * from mv1;
drop table if exists t1;
drop materialized view if exists mv1;
CREATE TABLE t1 (c1 int primary key, c2 vector(3),c3 vector(3) ,c4 vector(3),
VECTOR INDEX vector_idx(c3) 
WITH (distance=l2, lib=vsag, type=hnsw, m=10, ef_construction=100, ef_search=40));
insert into t1(c1,c2,c3,c4) values(1,'[1,1,2]','[2,2,3]','[1,3,2]');
insert into t1(c1,c2,c3,c4) values(2,'[1,0,3]','[1,0,3]','[2,3,2]');
insert into t1(c1,c2,c3,c4) values(3,'[-1,2,2]','[-3,2,3]','[4,3,3]');
insert into t1(c1,c2,c3,c4) values(4,'[-1,-2,-2]','[-4,2,3]',null);
insert into t1(c1,c2,c3,c4) values(5,'[-1,-3,-2]',null,'[2,3,1]');
create materialized view mv1  parallel 2 refresh complete on demand  as select * from t1 order by c1;
########清空回收站，删除测试数据库，表等 ##########
drop database  IF EXISTS  obljh;
alter system set ob_vector_memory_limit_percentage =0;
