purge recyclebin;
drop database IF EXISTS obljh;
create database obljh ;
use obljh;
set timestamp = 1600000000;
set ob_trx_timeout = 10000000000;
set ob_query_timeout = 10000000000;
set ob_default_lob_inrow_threshold = 0;
alter system set ob_vector_memory_limit_percentage =44;
##where子句
drop table if exists t1;
CREATE TABLE t1 (c1 int AUTO_INCREMENT primary key , c2 vector(3),c3 vector(3) ,c4 BLOB,
VECTOR INDEX vector_idx(c3) 
WITH (distance=inner_product, lib=vsag, type=hnsw, m=10, ef_construction=100, ef_search=40));
select * from t1 where inner_product(null,null);
c1	c2	c3	c4
select * from t1 where inner_product([1,1],[1,1]);
c1	c2	c3	c4
select * from t1 where inner_product(null,[1]);
c1	c2	c3	c4
##=,<,<=,>=,<>
drop table if exists t1;
CREATE TABLE t1 (c1 int primary key, c2 VARCHAR(30),c3 vector(3) ,c4 vector(2),
VECTOR INDEX vector_idx(c3) 
WITH (distance=inner_product, lib=vsag, type=hnsw, m=10, ef_construction=100, ef_search=40));
insert into t1 values(1,'[1,1,2]','[2,2,3]','[1,3]');
insert into t1 values(2,'[1,2,3]','[1,2,3]','[2,3]');
insert into t1 values(3,'[-1,2,2]','[-3,2,3]','[4,3]');
insert into t1 values(4,'[-1,-2,-2]','[-4,2,3]',null);
insert into t1 values(5,'[-1,-2,-2]',null,'[2,3]');
select inner_product(c3,'[1,2.2,3]') ld_c3,inner_product(c4,'[1,1.3]') ld_c4 from t1 where inner_product(c3,c3) =0  order by c1;
ld_c3	ld_c4
select inner_product(c3,'[1,2.2,3]') ld_c3,inner_product(c4,'[1,1.3]') ld_c4 from t1 where inner_product(c3,[1,2,3]) =0  order by c1;
ld_c3	ld_c4
select inner_product(c3,'[1,2.2,3]') ld_c3,inner_product(c4,'[1,1.3]') ld_c4 from t1 where inner_product(c3,c2) > 1  order by c1;
ld_c3	ld_c4
15.400000095367432	4.8999998569488525
14.400000095367432	5.8999998569488525
10.400000095367432	7.8999998569488525
select inner_product(c3,'[1,2.2,3]') ld_c3,inner_product(c4,'[1,1.3]') ld_c4 from t1 where inner_product(c3,[1,2,3]) > 1  order by c1;
ld_c3	ld_c4
15.400000095367432	4.8999998569488525
14.400000095367432	5.8999998569488525
10.400000095367432	7.8999998569488525
9.400000095367432	NULL
select inner_product(c3,'[1,2.2,3]') ld_c3,inner_product(c4,'[1,1.3]') ld_c4 from t1 where inner_product(c3,c2) < 1  order by c1;
ld_c3	ld_c4
9.400000095367432	NULL
select inner_product(c3,'[1,2.2,3]') ld_c3,inner_product(c4,'[1,1.3]') ld_c4 from t1 where inner_product(c3,[1,2,3]) < 1  order by c1;
ld_c3	ld_c4
select inner_product(c3,'[1,2.2,3]') ld_c3,inner_product(c4,'[1,1.3]') ld_c4 from t1 where inner_product(c3,c2) <= 0  order by c1;
ld_c3	ld_c4
9.400000095367432	NULL
select inner_product(c3,'[1,2.2,3]') ld_c3,inner_product(c4,'[1,1.3]') ld_c4 from t1 where inner_product(c3,[1,2,3]) <= 0  order by c1;
ld_c3	ld_c4
select inner_product(c3,'[1,2.2,3]') ld_c3,inner_product(c4,'[1,1.3]') ld_c4 from t1 where inner_product(c3,c2) >=1  order by c1;
ld_c3	ld_c4
15.400000095367432	4.8999998569488525
14.400000095367432	5.8999998569488525
10.400000095367432	7.8999998569488525
select inner_product(c3,'[1,2.2,3]') ld_c3,inner_product(c4,'[1,1.3]') ld_c4 from t1 where inner_product(c3,[1,2,3]) >=1  order by c1;
ld_c3	ld_c4
15.400000095367432	4.8999998569488525
14.400000095367432	5.8999998569488525
10.400000095367432	7.8999998569488525
9.400000095367432	NULL
select inner_product(c3,'[1,2.2,3]') ld_c3,inner_product(c4,'[1,1.3]') ld_c4 from t1 where inner_product(c3,c2) <>1  order by c1;
ld_c3	ld_c4
15.400000095367432	4.8999998569488525
14.400000095367432	5.8999998569488525
10.400000095367432	7.8999998569488525
9.400000095367432	NULL
select inner_product(c3,'[1,2.2,3]') ld_c3,inner_product(c4,'[1,1.3]') ld_c4 from t1 where inner_product(c3,[1,2,3])<>1  order by c1;
ld_c3	ld_c4
15.400000095367432	4.8999998569488525
14.400000095367432	5.8999998569488525
10.400000095367432	7.8999998569488525
9.400000095367432	NULL
select inner_product(c3,'[1,2.2,3]') ld_c3,inner_product(c4,'[1,1.3]') ld_c4 from t1 where inner_product(c3,c2) <>false  order by c1;
ld_c3	ld_c4
15.400000095367432	4.8999998569488525
14.400000095367432	5.8999998569488525
10.400000095367432	7.8999998569488525
9.400000095367432	NULL
select inner_product(c3,'[1,2.2,3]') ld_c3,inner_product(c4,'[1,1.3]') ld_c4 from t1 where inner_product(c3,[1,2,3])<>false  order by c1;
ld_c3	ld_c4
15.400000095367432	4.8999998569488525
14.400000095367432	5.8999998569488525
10.400000095367432	7.8999998569488525
9.400000095367432	NULL
select inner_product(c3,'[1,2.2,3]') ld_c3,inner_product(c4,'[1,1.3]') ld_c4 from t1 where inner_product(c3,c2) <>true  order by c1;
ld_c3	ld_c4
15.400000095367432	4.8999998569488525
14.400000095367432	5.8999998569488525
10.400000095367432	7.8999998569488525
9.400000095367432	NULL
select inner_product(c3,'[1,2.2,3]') ld_c3,inner_product(c4,'[1,1.3]') ld_c4 from t1 where inner_product(c3,[1,2,3]) <>true  order by c1;
ld_c3	ld_c4
15.400000095367432	4.8999998569488525
14.400000095367432	5.8999998569488525
10.400000095367432	7.8999998569488525
9.400000095367432	NULL
select inner_product(c3,'[1,2.2,3]') ld_c3,inner_product(c4,'[1,1.3]') ld_c4 from t1 where inner_product(c3,c3) =0  order by inner_product(c3, [1,2,3]) approximate limit 10;
ld_c3	ld_c4
select inner_product(c3,'[1,2.2,3]') ld_c3,inner_product(c4,'[1,1.3]') ld_c4 from t1 where inner_product(c3,[1,2,3]) =0  order by inner_product(c3, [1,2,3]) approximate limit 10;
ld_c3	ld_c4
select inner_product(c3,'[1,2.2,3]') ld_c3,inner_product(c4,'[1,1.3]') ld_c4 from t1 where inner_product(c3,c2) > 1  order by inner_product(c3, [1,2,3]) approximate limit 10;
ld_c3	ld_c4
10.400000095367432	7.8999998569488525
14.400000095367432	5.8999998569488525
15.400000095367432	4.8999998569488525
select inner_product(c3,'[1,2.2,3]') ld_c3,inner_product(c4,'[1,1.3]') ld_c4 from t1 where inner_product(c3,[1,2,3]) > 1  order by inner_product(c3, [1,2,3]) approximate limit 10;
ld_c3	ld_c4
9.400000095367432	NULL
10.400000095367432	7.8999998569488525
14.400000095367432	5.8999998569488525
15.400000095367432	4.8999998569488525
select inner_product(c3,'[1,2.2,3]') ld_c3,inner_product(c4,'[1,1.3]') ld_c4 from t1 where inner_product(c3,c2) < 1  order by inner_product(c3, [1,2,3]) approximate limit 10;
ld_c3	ld_c4
9.400000095367432	NULL
select inner_product(c3,'[1,2.2,3]') ld_c3,inner_product(c4,'[1,1.3]') ld_c4 from t1 where inner_product(c3,[1,2,3]) < 1  order by inner_product(c3, [1,2,3]) approximate limit 10;
ld_c3	ld_c4
select inner_product(c3,'[1,2.2,3]') ld_c3,inner_product(c4,'[1,1.3]') ld_c4 from t1 where inner_product(c3,c2) <= 0  order by inner_product(c3, [1,2,3]) approximate limit 10;
ld_c3	ld_c4
9.400000095367432	NULL
select inner_product(c3,'[1,2.2,3]') ld_c3,inner_product(c4,'[1,1.3]') ld_c4 from t1 where inner_product(c3,[1,2,3]) <= 0  order by inner_product(c3, [1,2,3]) approximate limit 10;
ld_c3	ld_c4
select inner_product(c3,'[1,2.2,3]') ld_c3,inner_product(c4,'[1,1.3]') ld_c4 from t1 where inner_product(c3,c2) >=1  order by inner_product(c3, [1,2,3]) approximate limit 10;
ld_c3	ld_c4
10.400000095367432	7.8999998569488525
14.400000095367432	5.8999998569488525
15.400000095367432	4.8999998569488525
select inner_product(c3,'[1,2.2,3]') ld_c3,inner_product(c4,'[1,1.3]') ld_c4 from t1 where inner_product(c3,[1,2,3]) >=1  order by inner_product(c3, [1,2,3]) approximate limit 10;
ld_c3	ld_c4
9.400000095367432	NULL
10.400000095367432	7.8999998569488525
14.400000095367432	5.8999998569488525
15.400000095367432	4.8999998569488525
select inner_product(c3,'[1,2.2,3]') ld_c3,inner_product(c4,'[1,1.3]') ld_c4 from t1 where inner_product(c3,c2) <>1  order by inner_product(c3, [1,2,3]) approximate limit 10;
ld_c3	ld_c4
9.400000095367432	NULL
10.400000095367432	7.8999998569488525
14.400000095367432	5.8999998569488525
15.400000095367432	4.8999998569488525
select inner_product(c3,'[1,2.2,3]') ld_c3,inner_product(c4,'[1,1.3]') ld_c4 from t1 where inner_product(c3,[1,2,3])<>1  order by inner_product(c3, [1,2,3]) approximate limit 10;
ld_c3	ld_c4
9.400000095367432	NULL
10.400000095367432	7.8999998569488525
14.400000095367432	5.8999998569488525
15.400000095367432	4.8999998569488525
select inner_product(c3,'[1,2.2,3]') ld_c3,inner_product(c4,'[1,1.3]') ld_c4 from t1 where inner_product(c3,c2) <>false  order by inner_product(c3, [1,2,3]) approximate limit 10;
ld_c3	ld_c4
9.400000095367432	NULL
10.400000095367432	7.8999998569488525
14.400000095367432	5.8999998569488525
15.400000095367432	4.8999998569488525
select inner_product(c3,'[1,2.2,3]') ld_c3,inner_product(c4,'[1,1.3]') ld_c4 from t1 where inner_product(c3,[1,2,3])<>false  order by inner_product(c3, [1,2,3]) approximate limit 10;
ld_c3	ld_c4
9.400000095367432	NULL
10.400000095367432	7.8999998569488525
14.400000095367432	5.8999998569488525
15.400000095367432	4.8999998569488525
select inner_product(c3,'[1,2.2,3]') ld_c3,inner_product(c4,'[1,1.3]') ld_c4 from t1 where inner_product(c3,c2) <>true  order by inner_product(c3, [1,2,3]) approximate limit 10;
ld_c3	ld_c4
9.400000095367432	NULL
10.400000095367432	7.8999998569488525
14.400000095367432	5.8999998569488525
15.400000095367432	4.8999998569488525
select inner_product(c3,'[1,2.2,3]') ld_c3,inner_product(c4,'[1,1.3]') ld_c4 from t1 where inner_product(c3,[1,2,3]) <>true  order by inner_product(c3, [1,2,3]) approximate limit 10;
ld_c3	ld_c4
9.400000095367432	NULL
10.400000095367432	7.8999998569488525
14.400000095367432	5.8999998569488525
15.400000095367432	4.8999998569488525
##and/or
drop table if exists t1;
CREATE TABLE t1 (c1 int primary key, c2 VARCHAR(30),c3 vector(3) ,c4 vector(3),
VECTOR INDEX vector_idx(c3) 
WITH (distance=inner_product, lib=vsag, type=hnsw, m=10, ef_construction=100, ef_search=40));
insert into t1 values(1,'[1,1,2]','[2,2,3]','[1,-1.5,3]');
insert into t1 values(2,'[1,2,3]','[1,2,3]','[2,1.5,3]');
insert into t1 values(3,'[-1,2,2]','[-3,2,3]','[4,-1,3]');
insert into t1 values(4,'[-1,-2,-2]','[-4,2,3]',null);
insert into t1 values(5,'[-1,-2,-2]',null,'[2,-2,3]');
select inner_product(c3,'[1,2.2,3]') ld_c3,inner_product(c4,'[1,1.3,-1]') ld_c4 from t1 where inner_product(c3,c3) =0 and inner_product(c3,c4) is null order by c1;
ld_c3	ld_c4
select inner_product(c3,'[1,2.2,3]') ld_c3,inner_product(c4,'[1,1.3,1]') ld_c4 from t1 where inner_product(c3,c3) <=2 and inner_product(c3,c2) >1 ;
ld_c3	ld_c4
select inner_product(c3,'[1,2.2,3]') ld_c3,inner_product(c4,'[1,1.3,-1]') ld_c4 from t1 where inner_product(c3,c3) =0 and inner_product(c3,c2) >0  and inner_product(c3,c2) >0 and inner_product(c3,c2) >0 and inner_product(c3,c2) >0 and inner_product(c3,c2) >0 and inner_product(c3,c2) >0 and inner_product(c3,c2) >0 
and inner_product(c3,c2) >0 and inner_product(c3,c2) >0 and inner_product(c3,c2) >0 and inner_product(c3,c2) >0 and inner_product(c3,c2) >0 and inner_product(c3,c2) >0 and inner_product(c3,c2) >0 and inner_product(c3,c2) >0 and inner_product(c3,c2) >0 and inner_product(c3,c2) >0 and inner_product(c3,c2) >0 and 
inner_product(c3,c2) >0 and inner_product(c3,c2) >0 and inner_product(c3,c2) >0 and inner_product(c3,c2) >0 and inner_product(c3,c2) >0 and inner_product(c3,c2) >0 and inner_product(c3,c2) >0 and inner_product(c3,c2) >0 and inner_product(c3,c2) >0 and inner_product(c3,c2) >0 and inner_product(c3,c2) >0 and 
inner_product(c3,c2) >0 and inner_product(c3,c2) >0 and inner_product(c3,c2) >0 and inner_product(c3,c2) >0 and inner_product(c3,c2) >0 and inner_product(c3,c2) >0 and inner_product(c3,c2) >0 and inner_product(c3,c2) >0 and inner_product(c3,c2) >0 and inner_product(c3,c2) >0 and inner_product(c3,c2) >0 and 
inner_product(c3,c2) >0 and inner_product(c3,c2) >0 and inner_product(c3,c2) >0 and inner_product(c3,c2) >0 and inner_product(c3,c2) >0 and inner_product(c3,c2) >0 and inner_product(c3,c2) >0 and inner_product(c3,c2) >0 and inner_product(c3,c2) >0 and inner_product(c3,c2) >0 and inner_product(c3,c2) >0 and 
inner_product(c3,c2) >0 and inner_product(c3,c2) >0 and inner_product(c3,c2) >0 and inner_product(c3,c2) >0 and inner_product(c3,c2) >0 and inner_product(c3,c2) >0 and inner_product(c3,c2) >0 and inner_product(c3,c2) >0 and inner_product(c3,c2) >0 and inner_product(c3,c2) >0 and inner_product(c3,c2) >0 and 
inner_product(c3,c2) >0 and inner_product(c3,c2) >0 order by c1;
ld_c3	ld_c4
select inner_product(c3,'[1,2.2,3]') ld_c3,inner_product(c4,'[1,1.3,1]') ld_c4 from t1 where inner_product(c3,'[1,2,3]') > 0 or inner_product(c3,c3) is null order by c1;
ld_c3	ld_c4
15.400000095367432	2.0500000715255737
14.400000095367432	6.949999928474426
10.400000095367432	5.700000047683716
9.400000095367432	NULL
NULL	2.4000000953674316
select inner_product(c3,'[1,2.2,3]') ld_c3,inner_product(c4,'[1,1.3,1]') ld_c4 from t1 where inner_product(c3,'[1,2,3]') > 0 or inner_product(c3,c3) is null or inner_product(c3,c3) is null or inner_product(c3,c3) is null or inner_product(c3,c3) is null or inner_product(c3,c3) is null or inner_product(c3,c3) 
is null or inner_product(c3,c3) is null or inner_product(c3,c3) is null or inner_product(c3,c3) is null or inner_product(c3,c3) is null or inner_product(c3,c3) is null or inner_product(c3,c3) is null or inner_product(c3,c3) is null or inner_product(c3,c3) is null or inner_product(c3,c3) is null or 
inner_product(c3,c3) is null or inner_product(c3,c3) is null or inner_product(c3,c3) is null or inner_product(c3,c3) is null or inner_product(c3,c3) is null or inner_product(c3,c3) is null or inner_product(c3,c3) is null or inner_product(c3,c3) is null or inner_product(c3,c3) is null or inner_product(c3,c3) 
is null or inner_product(c3,c3) is null or inner_product(c3,c3) is null or inner_product(c3,c3) is null or inner_product(c3,c3) is null or inner_product(c3,c3) is null or inner_product(c3,c3) is null or inner_product(c3,c3) is null or inner_product(c3,c3) is null or inner_product(c3,c3) is null or 
inner_product(c3,c3) is null or inner_product(c3,c3) is null or inner_product(c3,c3) is null or inner_product(c3,c3) is null or inner_product(c3,c3) is null or inner_product(c3,c3) is null or inner_product(c3,c3) is null or inner_product(c3,c3) is null or inner_product(c3,c3) is null or inner_product(c3,c3)
is null order by c1;
ld_c3	ld_c4
15.400000095367432	2.0500000715255737
14.400000095367432	6.949999928474426
10.400000095367432	5.700000047683716
9.400000095367432	NULL
NULL	2.4000000953674316
select inner_product(c3,'[1,2.2,3]') ld_c3,inner_product(c4,'[1,1.3,-1]') ld_c4 from t1 where inner_product(c3,'[1,2,3]') > 0 or inner_product(c3,c3) is null  and c1 >3 order by c1;
ld_c3	ld_c4
15.400000095367432	-3.9499999284744263
14.400000095367432	0.9499999284744263
10.400000095367432	-0.2999999523162842
9.400000095367432	NULL
NULL	-3.5999999046325684
##between and
drop table if exists t1;
CREATE TABLE t1 (c1 int primary key, c2 VARCHAR(30),c3 vector(3) ,c4 vector(2),
VECTOR INDEX vector_idx(c3) 
WITH (distance=inner_product, lib=vsag, type=hnsw, m=10, ef_construction=100, ef_search=40));
insert into t1 values(1,'[1,1,2]','[2,2,3]','[1,3]');
insert into t1 values(2,'[1,2,3]','[1,2,3]','[2,3]');
insert into t1 values(3,'[-1,2,2]','[-3,2,3]','[4,3]');
insert into t1 values(4,'[-1,-2,-2]','[-4,2,3]',null);
insert into t1 values(5,'[-1,-2,-2]',null,'[2,3]');
select  * from t1 where 1 BETWEEN inner_product(c3,c3)  and inner_product(c3,'[1,2,3]') order by inner_product(c3, [1,2,3])  limit 10;
c1	c2	c3	c4
select  * from t1 where 1 BETWEEN inner_product(c3,c3)  and inner_product(c3,'[1,2,3]') order by inner_product(c3, [1,2,3]) approximate limit 10;
c1	c2	c3	c4
select  inner_product(c3,'[1,2.2,3]') BETWEEN inner_product(c3,c3)  and inner_product(c3,'[1,2,3]') from t1 order by inner_product(c3, [1,2,3])  limit 10;
inner_product(c3,'[1,2.2,3]') BETWEEN inner_product(c3,c3)  and inner_product(c3,'[1,2,3]')
NULL
0
0
0
0
select  inner_product(c3,'[1,2.2,3]') BETWEEN inner_product(c3,c3)  and inner_product(c3,'[1,2,3]') from t1 order by inner_product(c3, [1,2,3]) approximate limit 10;
inner_product(c3,'[1,2.2,3]') BETWEEN inner_product(c3,c3)  and inner_product(c3,'[1,2,3]')
NULL
0
0
0
0
select  inner_product(c3,'[1,2.2,3]') BETWEEN inner_product(c3,c3)  and inner_product(c3,'[1,2,3]') from t1 where inner_product(c3,'[1,2.2,3]') BETWEEN inner_product(c3,c3)  and inner_product(c3,'[1,2,3]') >1;
inner_product(c3,'[1,2.2,3]') BETWEEN inner_product(c3,c3)  and inner_product(c3,'[1,2,3]')
##like/not like
drop table if exists t1;
CREATE TABLE t1 (c1 int primary key, c2 VARCHAR(30),c3 vector(3) ,c4 vector(2),
VECTOR INDEX vector_idx(c3) 
WITH (distance=inner_product, lib=vsag, type=hnsw, m=10, ef_construction=100, ef_search=40));
insert into t1 values(1,'[1,1,2]','[2,2,3]','[1,3]');
insert into t1 values(2,'[1,0,3]','[1,0,3]','[2,3]');
insert into t1 values(3,'[-1,2,2]','[-3,2,3]','[4,3]');
insert into t1 values(4,'[-1,-2,-2]','[-4,2,3]',null);
insert into t1 values(5,'[-1,-3,-2]',null,'[2,3]');
select  * from t1 where inner_product(c3,c3) like '%0%' order by inner_product(c3, [1,2,3])  limit 10;
c1	c2	c3	c4
2	[1,0,3]	[1,0,3]	[2,3]
select  * from t1 where inner_product(c3,c3) like inner_product(c3,c2) order by inner_product(c3, [1,2,3]) approximate limit 10;
c1	c2	c3	c4
2	[1,0,3]	[1,0,3]	[2,3]
select  * from t1 where inner_product(c3,c3) not like '%1%' order by c1;
c1	c2	c3	c4
3	[-1,2,2]	[-3,2,3]	[4,3]
4	[-1,-2,-2]	[-4,2,3]	NULL
select  * from t1 where inner_product(c3,c3) not like inner_product(c3,c2) order by c1;
c1	c2	c3	c4
1	[1,1,2]	[2,2,3]	[1,3]
3	[-1,2,2]	[-3,2,3]	[4,3]
4	[-1,-2,-2]	[-4,2,3]	NULL
##exists,any,all,in(无关键字)
drop table if exists t1;
CREATE TABLE t1 (c1 int primary key, c2 VARCHAR(30),c3 vector(3) ,c4 vector(3),
VECTOR INDEX vector_idx(c3) 
WITH (distance=inner_product, lib=vsag, type=hnsw, m=10, ef_construction=100, ef_search=40));
insert into t1 values(1,'[1,1,2]','[2,2,3]','[1,3,2]');
insert into t1 values(2,'[1,0,3]','[1,0,3]','[2,3,2]');
insert into t1 values(3,'[-1,2,2]','[-3,2,3]','[4,3,3]');
insert into t1 values(4,'[-1,-2,-2]','[-4,2,3]',null);
insert into t1 values(5,'[-1,-3,-2]',null,'[2,3,1]');
SELECT inner_product(c3,c4) from t1 where  EXISTS (SELECT inner_product(c3,[1,null,1]) FROM t1) order by c1;
inner_product(c3,c4)
14
8
3
NULL
NULL
SELECT c3 from t1 where  EXISTS (SELECT c3 FROM t1) order by c1;
c3
[2,2,3]
[1,0,3]
[-3,2,3]
[-4,2,3]
NULL
SELECT inner_product(c3,c4) from t1 where inner_product(c3,c3) = any (SELECT inner_product(c3,[1,-1,1]) FROM t1) order by c1;
inner_product(c3,c4)
SELECT inner_product(c3,c4) from t1 where inner_product(c3,c3) >= any (SELECT inner_product(c3,[1,-1,1]) FROM t1) order by c1;
inner_product(c3,c4)
14
8
3
NULL
SELECT inner_product(c3,c4) from t1 where inner_product(c3,c3) <= any (SELECT inner_product(c3,[1,-1,1]) FROM t1) order by c1;
inner_product(c3,c4)
SELECT inner_product(c3,c4) from t1 where inner_product(c3,c3) <> any (SELECT inner_product(c3,[1,-1,1]) FROM t1) order by c1;
inner_product(c3,c4)
14
8
3
NULL
SELECT inner_product(c3,c4) from t1 where inner_product(c3,c3) != any (SELECT inner_product(c3,[1,-1,1]) FROM t1) order by c1;
inner_product(c3,c4)
14
8
3
NULL
SELECT inner_product(c3,c4) from t1 where inner_product(c3,c3) > any (SELECT inner_product(c3,[1,-1,1]) FROM t1) order by c1;
inner_product(c3,c4)
14
8
3
NULL
SELECT inner_product(c3,c4) from t1 where inner_product(c3,c3) < any (SELECT inner_product(c3,[1,-1,1]) FROM t1) order by c1;
inner_product(c3,c4)
SELECT inner_product(c3,c4) from t1 where  EXISTS (SELECT inner_product(c3,c3) FROM t1) order by c1;
inner_product(c3,c4)
14
8
3
NULL
NULL
SELECT c3 from t1 where  EXISTS (SELECT c3 FROM t1) order by c1;
c3
[2,2,3]
[1,0,3]
[-3,2,3]
[-4,2,3]
NULL
SELECT inner_product(c3,c4) from t1 where inner_product(c3,c3) = any (SELECT inner_product(c3,c4) FROM t1) order by c1;
inner_product(c3,c4)
SELECT inner_product(c3,c4) from t1 where inner_product(c3,c3) >= any (SELECT inner_product(c3,c4) FROM t1) order by c1;
inner_product(c3,c4)
14
8
3
NULL
SELECT inner_product(c3,c4) from t1 where inner_product(c3,c3) <= any (SELECT inner_product(c3,c4) FROM t1) order by c1;
inner_product(c3,c4)
8
SELECT inner_product(c3,c4) from t1 where inner_product(c3,c3) <> any (SELECT inner_product(c3,c4) FROM t1) order by c1;
inner_product(c3,c4)
14
8
3
NULL
SELECT inner_product(c3,c4) from t1 where inner_product(c3,c3) != any (SELECT inner_product(c3,c4) FROM t1) order by c1;
inner_product(c3,c4)
14
8
3
NULL
SELECT inner_product(c3,c4) from t1 where inner_product(c3,c3) > any (SELECT inner_product(c3,c4) FROM t1) order by c1;
inner_product(c3,c4)
14
8
3
NULL
SELECT inner_product(c3,c4) from t1 where inner_product(c3,c3) < any (SELECT inner_product(c3,c4) FROM t1) order by c1;
inner_product(c3,c4)
8
SELECT inner_product(c3,c4) from t1 where inner_product(c3,c3) in (inner_product(c3,c3),inner_product(c3,c4)) order by c1;
inner_product(c3,c4)
14
8
3
NULL
SELECT inner_product(c3,'[1,2,3]') from t1 where inner_product(c3,c3) not in (inner_product(c3,'[1,2,3]'),inner_product(c4,'[1,2,3]')) order by c1;
inner_product(c3,'[1,2,3]')
15
10
SELECT inner_product(c3,'[1,2,3]') from t1 where inner_product(c3,c3) not in (SELECT inner_product(c3,'[1,2,3]')FROM t1) order by c1;
inner_product(c3,'[1,2,3]')
##exists,any,all,in(存在关键字APPROXIMATE|APPROX)
drop table if exists t1;
CREATE TABLE t1 (c1 int primary key, c2 VARCHAR(30),c3 vector(3) ,c4 vector(3),
VECTOR INDEX vector_idx(c3) 
WITH (distance=inner_product, lib=vsag, type=hnsw, m=10, ef_construction=100, ef_search=40));
insert into t1 values(1,'[1,1,2]','[2,2,3]','[1,3,2]');
insert into t1 values(2,'[1,0,3]','[1,0,3]','[2,3,2]');
insert into t1 values(3,'[-1,2,2]','[-3,2,3]','[4,3,3]');
insert into t1 values(4,'[-1,-2,-2]','[-4,2,3]',null);
insert into t1 values(5,'[-1,-3,-2]',null,'[2,3,1]');
SELECT inner_product(c3,c4) from t1 where  EXISTS (SELECT inner_product(c3,[1,1,1]) FROM t1 order by inner_product(c3, [1,2,3])  limit 10 ) order by c1;
inner_product(c3,c4)
14
8
3
NULL
NULL
SELECT inner_product(c3,c4) from t1 where  EXISTS (SELECT inner_product(c3,[1,1,1]) FROM t1 order by inner_product(c3, [1,2,3]) approximate limit 10 ) order by c1;
inner_product(c3,c4)
14
8
3
NULL
NULL
SELECT c3 from t1 where  EXISTS (SELECT c3 FROM t1 order by inner_product(c3, [1,2,3]) approximate limit 10 ) order by c1;
c3
[2,2,3]
[1,0,3]
[-3,2,3]
[-4,2,3]
NULL
SELECT inner_product(c3,c4) from t1 where inner_product(c3,c3) = any (SELECT inner_product(c3,[1,-1,1]) FROM t1 order by inner_product(c3, [1,2,3]) approximate limit 10) order by c1;
inner_product(c3,c4)
SELECT inner_product(c3,c4) from t1 where inner_product(c3,c3) >= any (SELECT inner_product(c3,[1,-1,1]) FROM t1 order by inner_product(c3, [1,2,3]) approximate limit 10 ) order by c1;
inner_product(c3,c4)
14
8
3
NULL
SELECT inner_product(c3,c4) from t1 where inner_product(c3,c3) <= any (SELECT inner_product(c3,[1,-1,1]) FROM t1 order by inner_product(c3, [1,2,3]) approximate limit 10 ) order by c1;
inner_product(c3,c4)
SELECT inner_product(c3,c4) from t1 where inner_product(c3,c3) <> any (SELECT inner_product(c3,[1,-1,1]) FROM t1 order by inner_product(c3, [1,2,3]) approximate limit 10 ) order by c1;
inner_product(c3,c4)
14
8
3
NULL
SELECT inner_product(c3,c4) from t1 where inner_product(c3,c3) != any (SELECT inner_product(c3,[1,-1,1]) FROM t1 order by inner_product(c3, [1,2,3]) approximate limit 10 ) order by c1;
inner_product(c3,c4)
14
8
3
NULL
SELECT inner_product(c3,c4) from t1 where inner_product(c3,c3) > any (SELECT inner_product(c3,[1,-1,1]) FROM t1 order by inner_product(c3, [1,2,3]) approximate limit 10 ) order by c1;
inner_product(c3,c4)
14
8
3
NULL
SELECT inner_product(c3,c4) from t1 where inner_product(c3,c3) < any (SELECT inner_product(c3,[1,-1,1]) FROM t1 order by inner_product(c3, [1,2,3]) approximate limit 10 ) order by c1;
inner_product(c3,c4)
SELECT inner_product(c3,c4) from t1 where inner_product(c3,c3) in (inner_product(c3,c3),inner_product(c3,c4)) order by inner_product(c3, [1,2,3]) approximate limit 10;
inner_product(c3,c4)
NULL
8
3
14
SELECT inner_product(c3,'[1,2,3]') from t1 where inner_product(c3,c3) not in (inner_product(c3,'[1,2,3]'),inner_product(c4,'[1,2,3]')) order by inner_product(c3, [1,2,3]) approximate limit 10;
inner_product(c3,'[1,2,3]')
10
15
SELECT inner_product(c3,'[1,2,3]') from t1 where inner_product(c3,c3) not in (SELECT inner_product(c3,'[1,2,3]')FROM t1 order by inner_product(c3, [1,2,3]) approximate limit 10 ) order by c1;
inner_product(c3,'[1,2,3]')
SELECT inner_product(c3,'[1,2,3]') from t1 where inner_product(c3,c3) not in (inner_product(c3,'[1,2,3]'),inner_product(c4,'[1,2,3]')) order by inner_product(c3, [1,2,3])  limit 10;
inner_product(c3,'[1,2,3]')
10
15
SELECT inner_product(c3,'[1,2,3]') from t1 where inner_product(c3,c3) not in (SELECT inner_product(c3,'[1,2,3]')FROM t1 where c3 is not null order by inner_product(c3, [1,2,3])  limit 10 ) order by c1;
inner_product(c3,'[1,2,3]')
15
10
9
SELECT inner_product(c3,'[1,2,3]') from t1 where inner_product(c3,c3) not in (SELECT inner_product(c3,'[1,2,3]')FROM t1 where c3 is not null order by inner_product(c3, [1,2,3]) approximate limit 10 ) order by c1;
inner_product(c3,'[1,2,3]')
15
10
9
##多表join
drop table if exists t1;
CREATE TABLE t1 (c1 int primary key, c2 vector(3),c3 vector(3) ,c4 vector(3));
insert into t1 values(1,'[1,1,2]','[2,2,3]','[1,3,2]');
insert into t1 values(2,'[1,0,3]','[1,0,3]','[2,3,2]');
insert into t1 values(3,'[-1,2,2]','[-3,2,3]','[4,3,3]');
insert into t1 values(4,'[-1,-2,-2]','[-4,2,3]',null);
insert into t1 values(5,'[-1,-3,-2]',null,'[2,3,1]');
drop table if exists t2;
CREATE TABLE t2 (a1 int , a2 vector(3),a3 vector(3) ,a4 vector(3));
insert into t2 select c1,c2,c3,c4 from t1;
select * from t1 union  select * from t2 order by c1;
c1	c2	c3	c4
1	[1,1,2]	[2,2,3]	[1,3,2]
2	[1,0,3]	[1,0,3]	[2,3,2]
3	[-1,2,2]	[-3,2,3]	[4,3,3]
4	[-1,-2,-2]	[-4,2,3]	NULL
5	[-1,-3,-2]	NULL	[2,3,1]
drop table if exists t1;
drop table if exists t2;
drop view if exists v1;
CREATE TABLE t1 (c1 int primary key, c2 vector(3),c3 vector(3) ,c4 vector(3),
VECTOR INDEX vector_idx(c3) 
WITH (distance=inner_product, lib=vsag, type=hnsw, m=10, ef_construction=100, ef_search=40));
insert into t1 values(4,'[-1,-2,-2]','[-4,2,3]',null);
insert into t1 values(5,'[-1,-3,-2]',null,'[2,3,1]');
CREATE TABLE t2 (a1 int primary key, a2 vector(3),a3 vector(3) ,a4 vector(3));
insert into t2 select c1,c2,c3,c4 from t1;
select c3,inner_product(c4,'[1,1.456,2.1]')  from t1,t2  order by inner_product(c3, [1,1,-1]) APPROX limit 10;
c3	inner_product(c4,'[1,1.456,2.1]')
NULL	8.467999935150146
NULL	8.467999935150146
[-4,2,3]	NULL
[-4,2,3]	NULL
create view v1 as select c3,inner_product(c4,'[1,1.456,2.1]')  from t1,t2  order by inner_product(c3, [1,1,-1]) APPROX limit 10;
select * from v1;
c3	inner_product(c4,'[1,1.456,2.1]')
NULL	8.467999935150146
NULL	8.467999935150146
[-4,2,3]	NULL
[-4,2,3]	NULL
select c3,inner_product(c4,'[1,1.456,2]')  from t1,t2  order by inner_product(c3, [1,1,-1]) APPROX limit 10;
c3	inner_product(c4,'[1,1.456,2]')
NULL	8.368000030517578
NULL	8.368000030517578
[-4,2,3]	NULL
[-4,2,3]	NULL
create table tt1 as select c3,inner_product(c4,'[1,1.456,2]')  from t1,t2  order by inner_product(c3, [1,1,-1]) APPROX limit 10;
select * from tt1;
c3	inner_product(c4,'[1,1.456,2]')
NULL	8.368000030517578
NULL	8.368000030517578
[-4,2,3]	NULL
[-4,2,3]	NULL
##结合聚合函数使用关键字
drop table if exists t1;
CREATE TABLE t1 (c1 int primary key, c2 vector(3),c3 vector(3) ,c4 vector(3),
VECTOR INDEX vector_idx(c3) 
WITH (distance=inner_product, lib=vsag, type=hnsw, m=10, ef_construction=100, ef_search=40));
insert into t1 values(1,'[1,1,2]','[2,2,3]','[1,3,2]');
insert into t1 values(2,'[1,0,3]','[1,0,3]','[2,3,2]');
insert into t1 values(3,'[-1,2,2]','[-3,2,3]','[4,3,3]');
insert into t1 values(4,'[-1,-2,-2]','[-4,2,3]',null);
insert into t1 values(5,'[-1,-3,-2]',null,'[2,3,1]');
select c1,c2,inner_product(c3,c2),count(c2) from t1 order by inner_product(c3, [1,2,3]) APPROX limit 10;
c1	c2	inner_product(c3,c2)	count(c2)
1	[1,1,2]	10	5
select c1,c2,inner_product(c3,c2),avg(c2) from t1 order by inner_product(c3, [1,2,3]) APPROX limit 10;
c1	c2	inner_product(c3,c2)	avg(c2)
1	[1,1,2]	10	[-0.2,-0.4,0.6]
select c1,c2,inner_product(c3,c2),sum(c2) from t1 order by inner_product(c3, [1,2,3]) APPROX limit 10;
c1	c2	inner_product(c3,c2)	sum(c2)
1	[1,1,2]	10	[-1,-2,3]
select  inner_product(c2, c3) from t1 order by inner_product(c3, [1,2,3]) APPROX limit 10;
inner_product(c2, c3)
NULL
-6
10
13
10
select c1,c2,inner_product(c3,c2) from t1 order by inner_product(c3, [1,2,3]) APPROX limit 10;
c1	c2	inner_product(c3,c2)
5	[-1,-3,-2]	NULL
4	[-1,-2,-2]	-6
2	[1,0,3]	10
3	[-1,2,2]	13
1	[1,1,2]	10
drop table if exists t1;
CREATE TABLE t1 (c1 int primary key, c2 vector(3),c3 vector(3) ,c4 vector(3),
VECTOR INDEX vector_idx(c3) 
WITH (distance=inner_product, lib=vsag, type=hnsw, m=10, ef_construction=100, ef_search=40));
insert into t1 values(1,'[1,1,2]','[2,2,3]','[1,3,2]');
insert into t1 values(2,'[1,0,3]','[1,0,3]','[2,3,2]');
insert into t1 values(3,'[-1,2,2]','[-3,2,3]','[4,3,3]');
insert into t1 values(4,'[-1,-2,-2]','[-4,2,3]',null);
insert into t1 values(5,'[-1,-3,-2]',null,'[2,3,1]');
drop table if exists t2;
CREATE TABLE t2 (a1 int , a2 vector(3),a3 vector(3) ,a4 vector(3),
VECTOR INDEX vector_idx(a3) 
WITH (distance=inner_product, lib=vsag, type=hnsw, m=10, ef_construction=100, ef_search=40));
insert into t2 select c1,c2,c3,c4 from t1;
select * from t1 a join t2 b on c3=a3 order by inner_product(c3, [1,2,3]) approximate limit 10;
c1	c2	c3	c4	a1	a2	a3	a4
4	[-1,-2,-2]	[-4,2,3]	NULL	4	[-1,-2,-2]	[-4,2,3]	NULL
2	[1,0,3]	[1,0,3]	[2,3,2]	2	[1,0,3]	[1,0,3]	[2,3,2]
3	[-1,2,2]	[-3,2,3]	[4,3,3]	3	[-1,2,2]	[-3,2,3]	[4,3,3]
1	[1,1,2]	[2,2,3]	[1,3,2]	1	[1,1,2]	[2,2,3]	[1,3,2]
select * from t1 a join t2 b on c2=a2 order by inner_product(c3, [1,2,3]) approximate limit 10;
c1	c2	c3	c4	a1	a2	a3	a4
5	[-1,-3,-2]	NULL	[2,3,1]	5	[-1,-3,-2]	NULL	[2,3,1]
4	[-1,-2,-2]	[-4,2,3]	NULL	4	[-1,-2,-2]	[-4,2,3]	NULL
2	[1,0,3]	[1,0,3]	[2,3,2]	2	[1,0,3]	[1,0,3]	[2,3,2]
3	[-1,2,2]	[-3,2,3]	[4,3,3]	3	[-1,2,2]	[-3,2,3]	[4,3,3]
1	[1,1,2]	[2,2,3]	[1,3,2]	1	[1,1,2]	[2,2,3]	[1,3,2]
select * from t1 a join t2 b on c2+a3=a2+c2 order by c1;
c1	c2	c3	c4	a1	a2	a3	a4
1	[1,1,2]	[2,2,3]	[1,3,2]	2	[1,0,3]	[1,0,3]	[2,3,2]
2	[1,0,3]	[1,0,3]	[2,3,2]	2	[1,0,3]	[1,0,3]	[2,3,2]
3	[-1,2,2]	[-3,2,3]	[4,3,3]	2	[1,0,3]	[1,0,3]	[2,3,2]
4	[-1,-2,-2]	[-4,2,3]	NULL	2	[1,0,3]	[1,0,3]	[2,3,2]
5	[-1,-3,-2]	NULL	[2,3,1]	2	[1,0,3]	[1,0,3]	[2,3,2]
drop table if exists t1;
CREATE TABLE t1 (c1 int primary key, c2 vector(3),c3 vector(3) ,c4 vector(3),
VECTOR INDEX vector_idx(c3) 
WITH (distance=inner_product, lib=vsag, type=hnsw, m=10, ef_construction=100, ef_search=40));
insert into t1 values(1,'[1,1,2]','[2,2,3]','[1,3,2]');
insert into t1 values(2,'[1,0,3]','[1,0,3]','[2,3,2]');
insert into t1 values(3,'[-1,2,2]','[-3,2,3]','[4,3,3]');
insert into t1 values(4,'[-1,-2,-2]','[-4,2,3]',null);
insert into t1 values(5,'[-1,-3,-2]',null,'[2,3,1]');
select * from t1 a  order by inner_product(a.c3, [1,2,3]) approximate limit 10;
c1	c2	c3	c4
5	[-1,-3,-2]	NULL	[2,3,1]
4	[-1,-2,-2]	[-4,2,3]	NULL
2	[1,0,3]	[1,0,3]	[2,3,2]
3	[-1,2,2]	[-3,2,3]	[4,3,3]
1	[1,1,2]	[2,2,3]	[1,3,2]
select * from t1 a  order by inner_product(a.c3, [1,2,3])  limit 10;
c1	c2	c3	c4
5	[-1,-3,-2]	NULL	[2,3,1]
4	[-1,-2,-2]	[-4,2,3]	NULL
2	[1,0,3]	[1,0,3]	[2,3,2]
3	[-1,2,2]	[-3,2,3]	[4,3,3]
1	[1,1,2]	[2,2,3]	[1,3,2]
select * from t1 a  order by inner_product(a.c3, [1,2,3]) approximate limit 1,1;
c1	c2	c3	c4
4	[-1,-2,-2]	[-4,2,3]	NULL
select * from t1 a  order by inner_product(a.c3, [1,2,3])  limit 1,1;
c1	c2	c3	c4
4	[-1,-2,-2]	[-4,2,3]	NULL
drop table if exists t1;
CREATE TABLE t1 (c1 int primary key, c2 vector(3),c3 vector(3) ,c4 vector(3),
VECTOR INDEX vector_idx(c3) 
WITH (distance=inner_product, lib=vsag, type=hnsw, m=10, ef_construction=100, ef_search=40));
insert into t1 values(1,'[1,1,2]','[2,2,3]','[1,3,2]');
insert into t1 values(2,'[1,0,3]','[1,0,3]','[2,3,2]');
insert into t1 values(3,'[-1,2,2]','[-3,2,3]','[4,3,3]');
insert into t1 values(4,'[-1,-2,-2]','[-4,2,3]',null);
insert into t1 values(5,'[-1,-3,-2]',null,'[2,3,1]');
drop table if exists t2;
CREATE TABLE t2 (a1 int , a2 vector(3),a3 vector(3) ,a4 vector(3),
VECTOR INDEX vector_idx(a3) 
WITH (distance=inner_product, lib=vsag, type=hnsw, m=10, ef_construction=100, ef_search=40));
insert into t2 select c1,c2,c3,c4 from t1;
select * from t1 a  order by inner_product(a.c3, [1,2,3]) approximate limit 10;
c1	c2	c3	c4
5	[-1,-3,-2]	NULL	[2,3,1]
4	[-1,-2,-2]	[-4,2,3]	NULL
2	[1,0,3]	[1,0,3]	[2,3,2]
3	[-1,2,2]	[-3,2,3]	[4,3,3]
1	[1,1,2]	[2,2,3]	[1,3,2]
select * from t1 a  order by inner_product(a.c3, [1,2,3])  limit 10;
c1	c2	c3	c4
5	[-1,-3,-2]	NULL	[2,3,1]
4	[-1,-2,-2]	[-4,2,3]	NULL
2	[1,0,3]	[1,0,3]	[2,3,2]
3	[-1,2,2]	[-3,2,3]	[4,3,3]
1	[1,1,2]	[2,2,3]	[1,3,2]
select * from t1 a join t2 b on c2=a2 order by inner_product(a.c3, [1,2,3]) approximate limit 10;
c1	c2	c3	c4	a1	a2	a3	a4
5	[-1,-3,-2]	NULL	[2,3,1]	5	[-1,-3,-2]	NULL	[2,3,1]
4	[-1,-2,-2]	[-4,2,3]	NULL	4	[-1,-2,-2]	[-4,2,3]	NULL
2	[1,0,3]	[1,0,3]	[2,3,2]	2	[1,0,3]	[1,0,3]	[2,3,2]
3	[-1,2,2]	[-3,2,3]	[4,3,3]	3	[-1,2,2]	[-3,2,3]	[4,3,3]
1	[1,1,2]	[2,2,3]	[1,3,2]	1	[1,1,2]	[2,2,3]	[1,3,2]
select * from t1 a join t2 b on c2=a2 order by inner_product(a.c3, [1,2,3])  limit 10;
c1	c2	c3	c4	a1	a2	a3	a4
5	[-1,-3,-2]	NULL	[2,3,1]	5	[-1,-3,-2]	NULL	[2,3,1]
4	[-1,-2,-2]	[-4,2,3]	NULL	4	[-1,-2,-2]	[-4,2,3]	NULL
2	[1,0,3]	[1,0,3]	[2,3,2]	2	[1,0,3]	[1,0,3]	[2,3,2]
3	[-1,2,2]	[-3,2,3]	[4,3,3]	3	[-1,2,2]	[-3,2,3]	[4,3,3]
1	[1,1,2]	[2,2,3]	[1,3,2]	1	[1,1,2]	[2,2,3]	[1,3,2]
select c1,c2,c3,c4,inner_product(a3,c2) from t1 a join t2 b on c2=a2  order by inner_product(a3,c2);
c1	c2	c3	c4	inner_product(a3,c2)
5	[-1,-3,-2]	NULL	[2,3,1]	NULL
4	[-1,-2,-2]	[-4,2,3]	NULL	-6
1	[1,1,2]	[2,2,3]	[1,3,2]	10
2	[1,0,3]	[1,0,3]	[2,3,2]	10
3	[-1,2,2]	[-3,2,3]	[4,3,3]	13
select c1,c2,c3,c4,inner_product(a3,c2) from t1 a join t2 b on inner_product(c2,c3)=inner_product(a3,a4)  order by inner_product(a3,c2);
c1	c2	c3	c4	inner_product(a3,c2)
select c1,c2,c3,c4,inner_product(a3,c2) from t1 a inner join t2 b on inner_product(c2,c3)=inner_product(a3,a4)  order by inner_product(a3,c2);
c1	c2	c3	c4	inner_product(a3,c2)
select c1,c2,c3,c4,inner_product(a3,c2) from t1 a right join t2 b on inner_product(c2,c3)=inner_product(a3,a4)  order by inner_product(a3,c2);
c1	c2	c3	c4	inner_product(a3,c2)
NULL	NULL	NULL	NULL	NULL
NULL	NULL	NULL	NULL	NULL
NULL	NULL	NULL	NULL	NULL
NULL	NULL	NULL	NULL	NULL
NULL	NULL	NULL	NULL	NULL
select c1,c2,c3,c4,inner_product(a3,c2) from t1 a left join t2 b on inner_product(c2,c3)=inner_product(a3,a4)  order by inner_product(a3,c2);
c1	c2	c3	c4	inner_product(a3,c2)
1	[1,1,2]	[2,2,3]	[1,3,2]	NULL
2	[1,0,3]	[1,0,3]	[2,3,2]	NULL
3	[-1,2,2]	[-3,2,3]	[4,3,3]	NULL
4	[-1,-2,-2]	[-4,2,3]	NULL	NULL
5	[-1,-3,-2]	NULL	[2,3,1]	NULL
select c1,c2,c3,c4,inner_product(a3,c2) from t1 a cross  join t2 b on inner_product(c2,c3)=inner_product(a3,a4)  order by inner_product(a3,c2);
c1	c2	c3	c4	inner_product(a3,c2)
select c1,c2,c3,c4,inner_product(a3,c2) from t1 a join t2 b on inner_product(a4,c3)=inner_product(a3,c2)  order by inner_product(a3,c2);
c1	c2	c3	c4	inner_product(a3,c2)
select c1,c2,c3,c4,inner_product(a3,c2) from t1 a inner join t2 b on inner_product(a4,c3)=inner_product(a3,c2)  order by inner_product(a3,c2);
c1	c2	c3	c4	inner_product(a3,c2)
select c1,c2,c3,c4,inner_product(a3,c2) from t1 a right join t2 b on inner_product(a4,c3)=inner_product(a3,c2)  order by inner_product(a3,c2);
c1	c2	c3	c4	inner_product(a3,c2)
NULL	NULL	NULL	NULL	NULL
NULL	NULL	NULL	NULL	NULL
NULL	NULL	NULL	NULL	NULL
NULL	NULL	NULL	NULL	NULL
NULL	NULL	NULL	NULL	NULL
select c1,c2,c3,c4,inner_product(a3,c2) from t1 a left join t2 b on inner_product(a4,c3)=inner_product(a3,c2)  order by inner_product(a3,c2);
c1	c2	c3	c4	inner_product(a3,c2)
1	[1,1,2]	[2,2,3]	[1,3,2]	NULL
2	[1,0,3]	[1,0,3]	[2,3,2]	NULL
3	[-1,2,2]	[-3,2,3]	[4,3,3]	NULL
4	[-1,-2,-2]	[-4,2,3]	NULL	NULL
5	[-1,-3,-2]	NULL	[2,3,1]	NULL
select c1,c2,c3,c4,inner_product(a3,c2) from t1 a cross  join t2 b on inner_product(a4,c3)=inner_product(a3,c2)  order by inner_product(a3,c2);
c1	c2	c3	c4	inner_product(a3,c2)
select inner_product(c2,c3) from t1  union all select inner_product(a2,a3) from t2 ;
inner_product(c2,c3)
10
10
13
-6
NULL
10
10
13
-6
NULL
select inner_product(c2,c3) from t1  union  select inner_product(a2,a3) from t2 ;
inner_product(c2,c3)
10
13
-6
NULL
##order by (存在关键字approximate)
drop table if exists t1;
CREATE TABLE t1 (c1 int primary key, c2 vector(3),c3 vector(3) ,c4 vector(3),
VECTOR INDEX vector_idx(c3) 
WITH (distance=inner_product, lib=vsag, type=hnsw, m=10, ef_construction=100, ef_search=40));
insert into t1 values(1,'[1,1,2]','[2,2,3]','[1,3,2]');
insert into t1 values(2,'[1,0,3]','[1,0,3]','[2,3,2]');
insert into t1 values(3,'[-1,2,2]','[-3,2,3]','[4,3,3]');
insert into t1 values(4,'[-1,-2,-2]','[-4,2,3]',null);
insert into t1 values(5,'[-1,-3,-2]',null,'[2,3,1]');
select c1,c2,inner_product(c3,c2) from t1 order by inner_product(c3, [1,2,3]) approximate limit 10;
c1	c2	inner_product(c3,c2)
5	[-1,-3,-2]	NULL
4	[-1,-2,-2]	-6
2	[1,0,3]	10
3	[-1,2,2]	13
1	[1,1,2]	10
select c1,c2,inner_product(c3,c2) from t1 order by inner_product(c3, c4) approximate limit 10;
ERROR 0A000: Using vector index without const param is not supported
explain select c1,c2,inner_product(c3,c2) from t1 order by inner_product(c3, c4) approximate limit 10;
ERROR 0A000: Using vector index without const param is not supported
select c1,c2,inner_product(c3,c2) from t1 order by inner_product(c3, c4) ;
c1	c2	inner_product(c3,c2)
4	[-1,-2,-2]	-6
5	[-1,-3,-2]	NULL
3	[-1,2,2]	13
2	[1,0,3]	10
1	[1,1,2]	10
select c1,c2,inner_product(c3,c2) from t1 order by inner_product(c3, [1,2,3]) APPROX limit 10;
c1	c2	inner_product(c3,c2)
5	[-1,-3,-2]	NULL
4	[-1,-2,-2]	-6
2	[1,0,3]	10
3	[-1,2,2]	13
1	[1,1,2]	10
select c1,c2,inner_product(c3,c2) from t1 order by inner_product(c3, c4) APPROX limit 10;
ERROR 0A000: Using vector index without const param is not supported
select c1,c2,inner_product(c3,c2) from t1 order by inner_product(c3, c4) ;
c1	c2	inner_product(c3,c2)
4	[-1,-2,-2]	-6
5	[-1,-3,-2]	NULL
3	[-1,2,2]	13
2	[1,0,3]	10
1	[1,1,2]	10
drop table if exists t2;
CREATE TABLE t2 (a1 int , a2 vector(3),a3 vector(3) ,a4 vector(3));
insert into t2 select c1,c2,c3,c4 from t1;
select * from t1 a join t2 b on c2+a3=a2+c2 order by c1;
c1	c2	c3	c4	a1	a2	a3	a4
1	[1,1,2]	[2,2,3]	[1,3,2]	2	[1,0,3]	[1,0,3]	[2,3,2]
2	[1,0,3]	[1,0,3]	[2,3,2]	2	[1,0,3]	[1,0,3]	[2,3,2]
3	[-1,2,2]	[-3,2,3]	[4,3,3]	2	[1,0,3]	[1,0,3]	[2,3,2]
4	[-1,-2,-2]	[-4,2,3]	NULL	2	[1,0,3]	[1,0,3]	[2,3,2]
5	[-1,-3,-2]	NULL	[2,3,1]	2	[1,0,3]	[1,0,3]	[2,3,2]
##order by (无关键字approximate)
select inner_product(c3,c2) from t1  order by c2 desc;
ERROR 22000: Invalid data type for the operation
select inner_product(c3,c2) from t1  order by c2 asc;
ERROR 22000: Invalid data type for the operation
select c1,c2,inner_product(c3,c2) from t1  order by inner_product(c3,c2) desc;
c1	c2	inner_product(c3,c2)
3	[-1,2,2]	13
1	[1,1,2]	10
2	[1,0,3]	10
4	[-1,-2,-2]	-6
5	[-1,-3,-2]	NULL
select c1,c2,c1,inner_product(c3,c2) from t1  order by inner_product(c3,'[1,2,3]'),inner_product(c3,'[1,2,3]') desc;
c1	c2	c1	inner_product(c3,c2)
5	[-1,-3,-2]	5	NULL
4	[-1,-2,-2]	4	-6
2	[1,0,3]	2	10
3	[-1,2,2]	3	13
1	[1,1,2]	1	10
select c1,c2,inner_product(c3,c2) from t1  order by inner_product(c3,c2) asc;
c1	c2	inner_product(c3,c2)
5	[-1,-3,-2]	NULL
4	[-1,-2,-2]	-6
1	[1,1,2]	10
2	[1,0,3]	10
3	[-1,2,2]	13
select c1,c2,inner_product(c3,c2) from t1  order by inner_product(c3,[1,2,3]) asc;
c1	c2	inner_product(c3,c2)
5	[-1,-3,-2]	NULL
4	[-1,-2,-2]	-6
2	[1,0,3]	10
3	[-1,2,2]	13
1	[1,1,2]	10
select c1,c2,inner_product(c3,c2) from t1  order by inner_product(c3,c2) desc,inner_product(c3,c2) asc;
c1	c2	inner_product(c3,c2)
3	[-1,2,2]	13
1	[1,1,2]	10
2	[1,0,3]	10
4	[-1,-2,-2]	-6
5	[-1,-3,-2]	NULL
select c1,c2,inner_product(c3,c2) from t1  order by inner_product([0],[0]) desc;
c1	c2	inner_product(c3,c2)
1	[1,1,2]	10
2	[1,0,3]	10
3	[-1,2,2]	13
4	[-1,-2,-2]	-6
5	[-1,-3,-2]	NULL
select c1,c2,inner_product(c3,c2) from t1  order by inner_product([0],[0]) asc;
c1	c2	inner_product(c3,c2)
1	[1,1,2]	10
2	[1,0,3]	10
3	[-1,2,2]	13
4	[-1,-2,-2]	-6
5	[-1,-3,-2]	NULL
select c1,c2,inner_product(c3,c2) from t1  order by inner_product(null,[1]) asc;
c1	c2	inner_product(c3,c2)
1	[1,1,2]	10
2	[1,0,3]	10
3	[-1,2,2]	13
4	[-1,-2,-2]	-6
5	[-1,-3,-2]	NULL
##group by /having
drop table if exists t1;
CREATE TABLE t1 (c1 int primary key, c2 VARCHAR(30),c3 vector(3) ,c4 vector(3),
VECTOR INDEX vector_idx(c3) 
WITH (distance=inner_product, lib=vsag, type=hnsw, m=10, ef_construction=100, ef_search=40));
insert into t1 values(1,'[1,1,2]','[2,2,3]','[1,3,2]');
insert into t1 values(2,'[1,0,3]','[1,0,3]','[2,3,2]');
insert into t1 values(3,'[-1,2,2]','[-3,2,3]','[4,3,3]');
insert into t1 values(4,'[-1,-2,-2]','[-4,2,3]',null);
insert into t1 values(5,'[-1,-3,-2]',null,'[2,3,1]');
select inner_product(c3,c2) from t1  group by inner_product(c3,[1,2,3]) order by c1;
inner_product(c3,c2)
10
10
-6
NULL
select inner_product(c3,c2) from t1  group by inner_product(c3,[1,2,3]) order by inner_product(c3, [1,2,3]) APPROX limit 10;
inner_product(c3,c2)
NULL
-6
10
10
select inner_product(c3,c2) from t1  group by inner_product(c3,[1,2,3]) order by inner_product(c3, [1,2,3]) APPROX limit 100000000;
inner_product(c3,c2)
NULL
-6
10
10
select inner_product(c3,c2) from t1  group by c2 ;
inner_product(c3,c2)
10
10
13
-6
NULL
select inner_product(c3,c2) from t1  group by inner_product(c3,c2) order by c1;
inner_product(c3,c2)
10
13
-6
NULL
select inner_product(c3,c2) from t1  group by inner_product(c3,[1,2,3]) order by c1;
inner_product(c3,c2)
10
10
-6
NULL
select inner_product(c3,c2) from t1  group by inner_product(c3,c2) order by inner_product(c3,c2);
inner_product(c3,c2)
NULL
-6
10
13
select inner_product(c3,c2) from t1  group by inner_product(c3,c4) having max(c1);
inner_product(c3,c2)
10
10
13
-6
select inner_product(c3,c2) from t1  group by inner_product(c3,c4) having min(c1);
inner_product(c3,c2)
10
10
13
-6
select inner_product(c3,c2) from t1  group by inner_product(c3,c4) having avg(c3);
ERROR 22000: Invalid data type for the operation
select inner_product(c3,c2) from t1  group by inner_product(c3,c4) having sum(c4);
ERROR 22000: Invalid data type for the operation
select inner_product(c3,c2) from t1  group by inner_product(c3,c4) having inner_product(c3,[1,2,3]);
ERROR 42S22: Unknown column 'c3' in 'having clause'
##运算符(+-*支持 ，除不支持)
drop table if exists t1;
CREATE TABLE t1 (c1 int primary key, c2 VARCHAR(30),c3 vector(3) ,c4 vector(3),
VECTOR INDEX vector_idx(c3) 
WITH (distance=inner_product, lib=vsag, type=hnsw, m=10, ef_construction=100, ef_search=40));
insert into t1 values(1,'[1,1,2]','[2,2,3]','[1,3,2]');
insert into t1 values(2,'[1,0,3]','[1,0,3]','[2,3,2]');
insert into t1 values(3,'[-1,2,2]','[-3,2,3]','[4,3,3]');
insert into t1 values(4,'[-1,-2,-2]','[-4,2,3]',null);
insert into t1 values(5,'[-1,-3,-2]',null,'[2,3,1]');
select inner_product(c3,[1,2,4]) + inner_product(c3,c2) - inner_product(c3,c2) from t1 order by c1;
inner_product(c3,[1,2,4]) + inner_product(c3,c2) - inner_product(c3,c2)
18
13
13
12
NULL
select inner_product(c3,c2) - inner_product(c3,c2) + inner_product(c3,c2) from t1 order by c1;
inner_product(c3,c2) - inner_product(c3,c2) + inner_product(c3,c2)
10
10
13
-6
NULL
select inner_product(c3,c2) * inner_product(c3,c2) + inner_product(c3,c2) from t1 order by c1;
inner_product(c3,c2) * inner_product(c3,c2) + inner_product(c3,c2)
110
110
182
30
NULL
select inner_product(c3,c2) / inner_product(c3,c2) - inner_product(c3,c2) from t1 order by c1;
inner_product(c3,c2) / inner_product(c3,c2) - inner_product(c3,c2)
-9
-9
-12
7
NULL
select inner_product(c3,c2) % inner_product(c3,c2) + inner_product(c3,c2) from t1 order by c1;
inner_product(c3,c2) % inner_product(c3,c2) + inner_product(c3,c2)
10
10
13
-6
NULL
select inner_product(c3,c2) + inner_product(c3,c2) from t1 where inner_product(c3,c2) + inner_product(c3,c2) order by c1;
inner_product(c3,c2) + inner_product(c3,c2)
20
20
26
-12
select inner_product(c3,c2) - inner_product(c3,c2) from t1 where inner_product(c3,c2) - inner_product(c3,c2) order by c1;
inner_product(c3,c2) - inner_product(c3,c2)
select inner_product(c3,c2) * inner_product(c3,c2) from t1 where inner_product(c3,c2) * inner_product(c3,c2) order by c1;
inner_product(c3,c2) * inner_product(c3,c2)
100
100
169
36
select inner_product(c3,c2) / inner_product(c3,c2) from t1 where inner_product(c3,c2) / inner_product(c3,c2) order by c1;
inner_product(c3,c2) / inner_product(c3,c2)
1
1
1
1
select inner_product(c3,c2) % inner_product(c3,c2) from t1 where inner_product(c3,c2) % inner_product(c3,c2) order by c1;
inner_product(c3,c2) % inner_product(c3,c2)
select inner_product(c3,c2) + inner_product(c3,c2) from t1 order by c1;
inner_product(c3,c2) + inner_product(c3,c2)
20
20
26
-12
NULL
select inner_product(c3,c2) - inner_product(c3,c2) from t1 order by c1;
inner_product(c3,c2) - inner_product(c3,c2)
0
0
0
0
NULL
select inner_product(c3,c2) * inner_product(c3,c2) from t1 order by c1;
inner_product(c3,c2) * inner_product(c3,c2)
100
100
169
36
NULL
select inner_product(c3,c2) / inner_product(c3,c2) from t1 order by c1;
inner_product(c3,c2) / inner_product(c3,c2)
1
1
1
1
NULL
select inner_product(c3,c2) % inner_product(c3,c2) from t1 order by c1;
inner_product(c3,c2) % inner_product(c3,c2)
0
0
0
-0
NULL
select inner_product(c3,c2) + inner_product(c3,c2) - inner_product(c3,c2) from t1 order by c1;
inner_product(c3,c2) + inner_product(c3,c2) - inner_product(c3,c2)
10
10
13
-6
NULL
select inner_product(c3,c2) - inner_product(c3,c2) + inner_product(c3,c2) from t1 order by c1;
inner_product(c3,c2) - inner_product(c3,c2) + inner_product(c3,c2)
10
10
13
-6
NULL
select inner_product(c3,c2) * inner_product(c3,c2) + inner_product(c3,c2) from t1 order by c1;
inner_product(c3,c2) * inner_product(c3,c2) + inner_product(c3,c2)
110
110
182
30
NULL
select inner_product(c3,c2) / inner_product(c3,c2) - inner_product(c3,c2) from t1 order by c1;
inner_product(c3,c2) / inner_product(c3,c2) - inner_product(c3,c2)
-9
-9
-12
7
NULL
select inner_product(c3,c2) % inner_product(c3,c2) + inner_product(c3,c2) from t1 order by c1;
inner_product(c3,c2) % inner_product(c3,c2) + inner_product(c3,c2)
10
10
13
-6
NULL
select inner_product(c3,c2) + inner_product(c3,c2) from t1 where inner_product(c3,c2) + inner_product(c3,c2) order by c1;
inner_product(c3,c2) + inner_product(c3,c2)
20
20
26
-12
select inner_product(c3,c2) - inner_product(c3,c2) from t1 where inner_product(c3,c2) - inner_product(c3,c2) order by c1;
inner_product(c3,c2) - inner_product(c3,c2)
select inner_product(c3,c2) * inner_product(c3,c2) from t1 where inner_product(c3,c2) * inner_product(c3,c2) order by c1;
inner_product(c3,c2) * inner_product(c3,c2)
100
100
169
36
select inner_product(c3,c2) / inner_product(c3,c2) from t1 where inner_product(c3,c2) / inner_product(c3,c2) order by c1;
inner_product(c3,c2) / inner_product(c3,c2)
1
1
1
1
select inner_product(c3,c2) % inner_product(c3,c2) from t1 where inner_product(c3,c2) % inner_product(c3,c2) order by c1;
inner_product(c3,c2) % inner_product(c3,c2)
##cast
drop table if exists t1;
CREATE TABLE t1 (c1 int primary key, c2 vector(3),c3 vector(3) ,c4 vector(3),
VECTOR INDEX vector_idx(c3) 
WITH (distance=inner_product, lib=vsag, type=hnsw, m=10, ef_construction=100, ef_search=40));
insert into t1 values(1,'[1,1,2]','[2,2,3]','[1,3,2]');
insert into t1 values(2,'[1,0,3]','[1,0,3]','[2,3,2]');
insert into t1 values(3,'[-1,2,2]','[-3,2,3]','[4,3,3]');
insert into t1 values(4,'[-1,-2,-2]','[-4,2,3]',null);
insert into t1 values(5,'[-1,-3,-2]',null,'[2,3,1]');
drop table if exists t2;
CREATE TABLE t2 (a1 int primary key, a2 vector(3),a3 vector(3) ,a4 vector(3));
insert into t2 select c1,c2,c3,c4 from t1;
select cast(c2 as char(10)) from t1 order by c1 limit 1;
ERROR 22000: Invalid data type for the operation
select cast(inner_product(c2,[1,2,3]) as char(1)) from t1 order by c1 limit 1;
cast(inner_product(c2,[1,2,3]) as char(1))
9
select cast(inner_product(c2,c3) as char(10)) from t1 order by c1 limit 1;
cast(inner_product(c2,c3) as char(10))
10
select cast(inner_product(c2,c3) as BINARY(1)) from t1 order by c1 limit 1;
cast(inner_product(c2,c3) as BINARY(1))
1
select cast(inner_product(c2,c3) as BINARY(10)) from t1 order by c1 limit 1;
cast(inner_product(c2,c3) as BINARY(10))
10        
select cast(inner_product(c2,c3) as vector(3)) from t1 order by c1 limit 1;
ERROR 42000: You have an error in your SQL syntax; check the manual that corresponds to your OceanBase version for the right syntax to use near 'vector(3)) from t1 order by c1 limit 1' at line 1
select cast(inner_product(c2,c3) as UNSIGNED) from t1 order by c1 limit 1;
cast(inner_product(c2,c3) as UNSIGNED)
10
select cast(inner_product(c2,c3) as SIGNED) from t1 order by c1 limit 1;
cast(inner_product(c2,c3) as SIGNED)
10
select cast(inner_product(c2,c3) as FLOAT) from t1 order by c1 limit 1;
cast(inner_product(c2,c3) as FLOAT)
10
select cast(inner_product(c2,c3) as double) from t1 order by c1 limit 1;
cast(inner_product(c2,c3) as double)
10
select cast(inner_product(c2,c3) as DECIMAL(10,2)) from t1 order by c1 limit 1;
cast(inner_product(c2,c3) as DECIMAL(10,2))
10.00
select cast(inner_product(c2,c3) as DEC(10,2)) from t1 order by c1 limit 1;
cast(inner_product(c2,c3) as DEC(10,2))
10.00
select cast(inner_product(c2,c3) as NUMERIC(10,2)) from t1 order by c1 limit 1;
cast(inner_product(c2,c3) as NUMERIC(10,2))
10.00
select cast(inner_product(c2,c3) as FIXED(10,2)) from t1 order by c1 limit 1;
cast(inner_product(c2,c3) as FIXED(10,2))
10.00
select cast(inner_product(c2,c3) as DATE) from t1 order by c1 limit 1;
cast(inner_product(c2,c3) as DATE)
NULL
select cast(inner_product(c2,c3) as DATETIME) from t1 order by c1 limit 1;
cast(inner_product(c2,c3) as DATETIME)
NULL
select cast(inner_product(c2,c3) as TIME) from t1 order by c1 limit 1;
cast(inner_product(c2,c3) as TIME)
00:00:10
select cast(inner_product(c2,c3) as YEAR) from t1 order by c1 limit 1;
cast(inner_product(c2,c3) as YEAR)
2010
select cast(inner_product(c2,c3) as YEAR),cast(inner_product(c2,c3) as YEAR) from t1 order by c1 limit 1;
cast(inner_product(c2,c3) as YEAR)	cast(inner_product(c2,c3) as YEAR)
2010	2010
drop table if exists tt1;
drop table if exists ttt1;
create table tt1 select cast(inner_product([1],[100]) as json) from dual;
create table ttt1 as select inner_product([1,1,2],[1,12,2]) a;
##distinct
select distinct c2 from t1 order By c1;
ERROR 22000: Invalid data type for the operation
select distinct inner_product(c2,c3), inner_product(c4,c3) from t1 order By c1;
inner_product(c2,c3)	inner_product(c4,c3)
10	14
10	8
13	3
-6	NULL
NULL	NULL
SELECT COUNT(DISTINCT inner_product(c2,c3), inner_product(c4,c3)) FROM t1 order By c1;
COUNT(DISTINCT inner_product(c2,c3), inner_product(c4,c3))
3
SELECT COUNT(DISTINCT inner_product(c2,[1,1,2]),inner_product(c4,c3)) FROM t1 order By c1;
COUNT(DISTINCT inner_product(c2,[1,1,2]),inner_product(c4,c3))
3
##with as
drop table if exists t1;
CREATE TABLE t1 (c1 int primary key, c2 vector(3),c3 vector(3) ,c4 vector(3),
VECTOR INDEX vector_idx(c3) 
WITH (distance=inner_product, lib=vsag, type=hnsw, m=10, ef_construction=100, ef_search=40));
insert into t1 values(1,'[1,1,2]','[2,2,3]','[1,3,2]');
insert into t1 values(2,'[1,0,3]','[1,0,3]','[2,3,2]');
insert into t1 values(3,'[-1,2,2]','[-3,2,3]','[4,3,3]');
insert into t1 values(4,'[-1,-2,-2]','[-4,2,3]',null);
insert into t1 values(5,'[-1,-3,-2]',null,'[2,3,1]');
drop table if exists t2;
CREATE TABLE t2 (a1 int , a2 vector(3),a3 vector(3) ,a4 vector(3));
insert into t2 select c1,c2,c3,c4 from t1;
select * from t1 join t2 on inner_product(c2,c3)=inner_product(a2,a3) order by c1;
c1	c2	c3	c4	a1	a2	a3	a4
1	[1,1,2]	[2,2,3]	[1,3,2]	1	[1,1,2]	[2,2,3]	[1,3,2]
1	[1,1,2]	[2,2,3]	[1,3,2]	2	[1,0,3]	[1,0,3]	[2,3,2]
2	[1,0,3]	[1,0,3]	[2,3,2]	1	[1,1,2]	[2,2,3]	[1,3,2]
2	[1,0,3]	[1,0,3]	[2,3,2]	2	[1,0,3]	[1,0,3]	[2,3,2]
3	[-1,2,2]	[-3,2,3]	[4,3,3]	3	[-1,2,2]	[-3,2,3]	[4,3,3]
4	[-1,-2,-2]	[-4,2,3]	NULL	4	[-1,-2,-2]	[-4,2,3]	NULL
with ct1 AS(
select c2 from t1 order by c1)
select c2 from t1 where c1 >2 order by c1 ;
c2
[-1,2,2]
[-1,-2,-2]
[-1,-3,-2]
with ct1 as(
select inner_product(c2,c3) from t1 order by c1)
select inner_product(c2,c3) from t1 where c3 is not null order by c1 ;
inner_product(c2,c3)
10
10
13
-6
with ct1 as(
select inner_product(c2,c3) from t1 order by c1)
select inner_product(c2,c3) from t1 join t2 on inner_product(c2,c3)=inner_product(a2,a3) order by c1;
inner_product(c2,c3)
10
10
10
10
13
-6
with ct1 as(
select inner_product(c2,[1,2,3]) from t1 order by c1)
select inner_product(c2,c3) from t1 join t2 on inner_product(c2,c3)=inner_product(a2,a3) order by c1;
inner_product(c2,c3)
10
10
10
10
13
-6
with CTE1 as(
select inner_product(c2,c3) a from t1 order by c1)
,CTE2 AS (
SELECT inner_product(a2,a3) b from t2 order by a1
)
select * from CTE1,CTE2  where a=b and a is not null order by b;
a	b
-6	-6
10	10
10	10
10	10
10	10
13	13
drop table if exists t1;
CREATE TABLE t1 (c1 int primary key, c2 vector(3),c3 vector(3) ,c4 vector(3),
VECTOR INDEX vector_idx(c3) 
WITH (distance=inner_product, lib=vsag, type=hnsw, m=10, ef_construction=100, ef_search=40));
insert into t1 values(1,'[1,1,2]','[2,2,3]','[1,3,2]');
insert into t1 values(2,'[1,0,3]','[1,0,3]','[2,3,2]');
insert into t1 values(3,'[-1,2,2]','[-3,2,3]','[4,3,3]');
insert into t1 values(4,'[-1,-2,-2]','[-4,2,3]',null);
insert into t1 values(5,'[-1,-3,-2]',null,'[2,3,1]');
drop table if exists t2;
CREATE TABLE t2 (a1 int , a2 vector(3),a3 vector(3) ,a4 vector(3));
insert into t2 select c1,c2,c3,c4 from t1;
SELECT count(c1), CASE WHEN inner_product(C2,[1,2,3]) > inner_product([1,1,1],a3) THEN 'High' ELSE 'Low' END AS A FROM T1,t2 ;
count(c1)	A
25	High
SELECT count(*) FROM t1,t2 where inner_product(t1.C2, t2.A2) < 0.5;
count(*)
12
SELECT count(c1), CASE WHEN inner_product(C2,[1,2,3]) > inner_product([1,1,1],a3) THEN 'High' ELSE 'Low' END AS A FROM T1,t2 ;
count(c1)	A
25	High
SELECT C1, CASE WHEN inner_product(C2,[1,2,3]) > 5 THEN 'High' ELSE 'Low' END AS A FROM T1,t2 limit 1;
C1	A
1	High
SELECT t1.C1, 
CASE 
WHEN inner_product(t1.C2, t2.A2) > 10 THEN 'Far'
           WHEN inner_product(t1.C3, t2.A3) BETWEEN 5 AND 10 THEN 'Medium'
           ELSE 'Close'
       END AS distance_category,
avg(t1.C2) OVER (PARTITION BY t1.C1) AS avg_vector
FROM T1 t1
JOIN T2 t2 ON t1.C1 = t2.A1
WHERE inner_product(t1.C2, t2.A2) > 0.5;
C1	distance_category	avg_vector
1	Close	[1,1,2]
2	Medium	[1,0,3]
3	Close	[-1,2,2]
4	Close	[-1,-2,-2]
5	Far	[-1,-3,-2]
drop table if exists t1;
CREATE TABLE t1 (c1 int primary key, c2 vector(3),c3 vector(3) ,c4 vector(3),
VECTOR INDEX vector_idx(c3) 
WITH (distance=inner_product, lib=vsag, type=hnsw, m=10, ef_construction=100, ef_search=40));
insert into t1 values(1,'[1,1,2]','[2,2,3]','[1,3,2]');
insert into t1 values(2,'[1,0,3]','[1,0,3]','[2,3,2]');
insert into t1 values(3,'[-1,2,2]','[-3,2,3]','[4,3,3]');
insert into t1 values(4,'[-1,-2,-2]','[-4,2,3]',null);
insert into t1 values(5,'[-1,-3,-2]',null,'[2,3,1]');
drop table if exists t2;
CREATE TABLE t2 (c1 int , c2 vector(3),c3 vector(3) ,c4 vector(3));
insert into t2 select c1,c2,c3,c4 from t1;
SELECT * FROM t1 JOIN t2 USING(c1);
c1	c2	c3	c4	c2	c3	c4
1	[1,1,2]	[2,2,3]	[1,3,2]	[1,1,2]	[2,2,3]	[1,3,2]
2	[1,0,3]	[1,0,3]	[2,3,2]	[1,0,3]	[1,0,3]	[2,3,2]
3	[-1,2,2]	[-3,2,3]	[4,3,3]	[-1,2,2]	[-3,2,3]	[4,3,3]
4	[-1,-2,-2]	[-4,2,3]	NULL	[-1,-2,-2]	[-4,2,3]	NULL
5	[-1,-3,-2]	NULL	[2,3,1]	[-1,-3,-2]	NULL	[2,3,1]
SELECT avg(inner_product(C2,c3)) OVER (PARTITION BY C1) FROM T1  order by c1;
avg(inner_product(C2,c3)) OVER (PARTITION BY C1)
10
10
13
-6
NULL
SELECT sum(inner_product(C2,c3)) OVER (PARTITION BY C1) FROM T1  order by c1;
sum(inner_product(C2,c3)) OVER (PARTITION BY C1)
10
10
13
-6
NULL
SELECT count(inner_product(C2,c3)) OVER (PARTITION BY C1) FROM T1  order by c1;
count(inner_product(C2,c3)) OVER (PARTITION BY C1)
1
1
1
1
0
1210
SELECT min(inner_product(C2,c3)) OVER (PARTITION BY C1) FROM T1 order by c1 ;
min(inner_product(C2,c3)) OVER (PARTITION BY C1)
10
10
13
-6
NULL
1210
SELECT max(inner_product(C2,c3)) OVER (PARTITION BY C1) FROM T1  order by c1;
max(inner_product(C2,c3)) OVER (PARTITION BY C1)
10
10
13
-6
NULL
drop table if exists t1;
CREATE TABLE t1 (c1 int primary key, c2 vector(3),c3 vector(3) ,c4 vector(3),
VECTOR INDEX vector_idx(c2) 
WITH (distance=inner_product, lib=vsag, type=hnsw, m=10, ef_construction=100, ef_search=40));
insert into t1 values(1,'[1,1,2]','[2,2,3]','[1,3,2]');
insert into t1 values(2,'[1,0,3]','[1,0,3]','[2,3,2]');
insert into t1 values(3,'[-1,2,2]','[-3,2,3]','[4,3,3]');
insert into t1 values(4,'[-1,-2,-2]','[-4,2,3]',null);
insert into t1 values(5,'[-1,-3,-2]',null,'[2,3,1]');
##limit
select inner_product(c3,c2)  from t1  order by c1 limit 1;
inner_product(c3,c2)
10
select inner_product(c3,c2)  from t1  order by c1 limit 1,1;
inner_product(c3,c2)
10
select *  from t1  order by c1 limit 1 offset inner_product([0],[0]);
ERROR 42000: You have an error in your SQL syntax; check the manual that corresponds to your OceanBase version for the right syntax to use near 'inner_product([0],[0])' at line 1
select *  from t1  order by c1 limit 1 offset [1];
ERROR 42000: You have an error in your SQL syntax; check the manual that corresponds to your OceanBase version for the right syntax to use near '[1]' at line 1
select inner_product(c3,c2)  from t1  order by c1 limit 1,inner_product([0],[0]);
ERROR 42000: You have an error in your SQL syntax; check the manual that corresponds to your OceanBase version for the right syntax to use near 'inner_product([0],[0])' at line 1
select inner_product(c3,c2) + inner_product(c3,c4) from t1  order by c1 limit inner_product(c3,'[1,2,4]');
ERROR 42000: You have an error in your SQL syntax; check the manual that corresponds to your OceanBase version for the right syntax to use near 'inner_product(c3,'[1,2,4]')' at line 1
select inner_product(c3,c2) + inner_product(c3,c4) from t1  order by c1 limit inner_product(c3,'[1,2,4]'),inner_product(c3,'[1,2,4]');
ERROR 42000: You have an error in your SQL syntax; check the manual that corresponds to your OceanBase version for the right syntax to use near 'inner_product(c3,'[1,2,4]'),inner_product(c3,'[1,2,4]')' at line 1
##列别名
drop table if exists t1;
CREATE TABLE t1 (c1 int primary key, c2 vector(3),c3 vector(3) ,c4 vector(3));
insert into t1 values(1,'[1,1,2]','[2,2,3]','[1,3,2]');
insert into t1 values(2,'[1,0,3]','[1,0,3]','[2,3,2]');
insert into t1 values(3,'[-1,2,2]','[-3,2,3]','[4,3,3]');
insert into t1 values(4,'[-1,-2,-2]','[-4,2,3]',null);
insert into t1 values(5,'[-1,-3,-2]',null,'[2,3,1]');
select c1 a,inner_product(c3,'[1,3,-5]') a  from t1 order by c1;
a	a
1	-7
2	-14
3	-12
4	-13
5	NULL
select c1 a,inner_product(c3,'[1,3,-5]') a,inner_product(c3,'[1,3,-5]') a  from t1 order by c1;
a	a	a
1	-7	-7
2	-14	-14
3	-12	-12
4	-13	-13
5	NULL	NULL
select inner_product('[-1.5,3.5,-2]',c2)  a  from t1 order by c1;
a
-2
-7.5
4.5
-1.5
-5
select inner_product('[-1.5,3.5,0]',c2)  a ,* from t1 order by c1;
a	c1	c2	c3	c4
2	1	[1,1,2]	[2,2,3]	[1,3,2]
-1.5	2	[1,0,3]	[1,0,3]	[2,3,2]
8.5	3	[-1,2,2]	[-3,2,3]	[4,3,3]
-5.5	4	[-1,-2,-2]	[-4,2,3]	NULL
-9	5	[-1,-3,-2]	NULL	[2,3,1]
select inner_product(c3,[-1.5,3.5,0])  中文 ,* from t1 order by c1;
中文	c1	c2	c3	c4
4	1	[1,1,2]	[2,2,3]	[1,3,2]
-1.5	2	[1,0,3]	[1,0,3]	[2,3,2]
11.5	3	[-1,2,2]	[-3,2,3]	[4,3,3]
13	4	[-1,-2,-2]	[-4,2,3]	NULL
NULL	5	[-1,-3,-2]	NULL	[2,3,1]
select inner_product(c3,'[-1.5,3.5,0]') + inner_product(c3,c2) - inner_product('[-1.5,3.5,0]',c2)  中文 ,inner_product(c3,c2) + inner_product(c3,'[-1.5,3.5,0]') - inner_product(c3,'[-1.5,3.5,0]') 中文 from t1 order by c1;
中文	中文
12	10
10	10
16	13
12.5	-6
NULL	NULL
select inner_product('[-1.5,3.5,0]',c2) + inner_product('[-1.5,3.5,0]',c2) - inner_product(c3,'[-1.5,3.5,0]')  a ,inner_product(c3,c2) + inner_product(c3,c2) - inner_product('[-1.5,3.5,0]',c2) b from t1 order by c1;
a	b
0	18
-1.5	21.5
5.5	17.5
-24	-6.5
NULL	NULL
select c1 a,inner_product(c3,c2) a  from t1 order by c1;
a	a
1	10
2	10
3	13
4	-6
5	NULL
select inner_product(c3,c2)  a  from t1 order by c1;
a
10
10
13
-6
NULL
select inner_product(c3,c2)  a ,* from t1 order by c1;
a	c1	c2	c3	c4
10	1	[1,1,2]	[2,2,3]	[1,3,2]
10	2	[1,0,3]	[1,0,3]	[2,3,2]
13	3	[-1,2,2]	[-3,2,3]	[4,3,3]
-6	4	[-1,-2,-2]	[-4,2,3]	NULL
NULL	5	[-1,-3,-2]	NULL	[2,3,1]
select inner_product(c3,c2)  中文 ,* from t1 order by c1;
中文	c1	c2	c3	c4
10	1	[1,1,2]	[2,2,3]	[1,3,2]
10	2	[1,0,3]	[1,0,3]	[2,3,2]
13	3	[-1,2,2]	[-3,2,3]	[4,3,3]
-6	4	[-1,-2,-2]	[-4,2,3]	NULL
NULL	5	[-1,-3,-2]	NULL	[2,3,1]
select inner_product(c3,c2) + inner_product(c3,c2) - inner_product(c3,c2)  中文 ,inner_product(c3,c2) + inner_product(c3,c2) - inner_product(c3,c2) 中文 from t1 order by c1;
中文	中文
10	10
10	10
13	13
-6	-6
NULL	NULL
select inner_product(c3,c2) + inner_product(c3,c2) - inner_product(c3,c2)  a ,inner_product(c3,c2) + inner_product(c3,c2) - inner_product(c3,c2) b from t1 order by c1;
a	b
10	10
10	10
13	13
-6	-6
NULL	NULL
select c1 a,inner_product(c3,[1,2,3]) a  from t1 order by c1;
a	a
1	15
2	10
3	10
4	9
5	NULL
select c1 a,inner_product(c3,[1,2,3]) a  from t1 where inner_product(c3,[1,2,3]) is not null order by c1;
a	a
1	15
2	10
3	10
4	9
select inner_product(c3,c2)  a  from t1 order by c1;
a
10
10
13
-6
NULL
select inner_product(c3,c2)  a ,* from t1 order by c1;
a	c1	c2	c3	c4
10	1	[1,1,2]	[2,2,3]	[1,3,2]
10	2	[1,0,3]	[1,0,3]	[2,3,2]
13	3	[-1,2,2]	[-3,2,3]	[4,3,3]
-6	4	[-1,-2,-2]	[-4,2,3]	NULL
NULL	5	[-1,-3,-2]	NULL	[2,3,1]
select inner_product(c3,c2)  中文 ,* from t1 order by c1;
中文	c1	c2	c3	c4
10	1	[1,1,2]	[2,2,3]	[1,3,2]
10	2	[1,0,3]	[1,0,3]	[2,3,2]
13	3	[-1,2,2]	[-3,2,3]	[4,3,3]
-6	4	[-1,-2,-2]	[-4,2,3]	NULL
NULL	5	[-1,-3,-2]	NULL	[2,3,1]
select inner_product(c3,c2) + inner_product(c3,c2) - inner_product(c3,c2)  中文 ,inner_product(c3,c2) + inner_product(c3,c2) - inner_product(c3,c2) 中文 from t1 order by c1;
中文	中文
10	10
10	10
13	13
-6	-6
NULL	NULL
select inner_product(c3,c2) + inner_product(c3,c2) - inner_product(c3,c2)  a ,inner_product(c3,c2) + inner_product(c3,c2) - inner_product(c3,c2) b from t1 order by c1;
a	b
10	10
10	10
13	13
-6	-6
NULL	NULL
## update
drop table if exists t1;
CREATE TABLE t1 (c1 int primary key, c2 vector(3),c3 vector(3) ,c4 vector(3),
VECTOR INDEX vector_idx(c2) 
WITH (distance=inner_product, lib=vsag, type=hnsw, m=10, ef_construction=100, ef_search=40));
insert into t1 values(1,'[1,1,2]','[2,2,3]','[1,3,2]');
insert into t1 values(2,'[1,0,3]','[1,0,3]','[2,3,2]');
insert into t1 values(3,'[-1,2,2]','[-3,2,3]','[4,3,3]');
insert into t1 values(4,'[-1,-2,-2]','[-4,2,3]',null);
insert into t1 values(5,'[-1,-3,-2]',null,'[2,3,1]');
update t1 set c1 = 10 where c1 =5;
update t1 set c2 = '[1,23,null]' where c1 =5;
update t1 set c2 = '[1,23,abs(null)]' where c1 =5;
update t1 set c2 =[inner_product('[1,3,2]','[1,1,2]'),inner_product('[1,2,2]','[1,1,11]'),inner_product('[1,1,2]','[1,1,2]')] where c3 is null;
update t1 set c1 = inner_product('[1,8,2]','[1,1,2]') where c3 = '[2,2,3]';
update t1 set c1 = inner_product('[1,10,2]','[1,1,2]'),c2 = '[1,1,1]',c3 = '[0,1,0]',c4 = '[0.1,1.2,100]' where c4 = '[2,3,2]';
select * from t1 order by c1;
c1	c2	c3	c4
3	[-1,2,2]	[-3,2,3]	[4,3,3]
4	[-1,-2,-2]	[-4,2,3]	NULL
10	[8,25,6]	NULL	[2,3,1]
13	[1,1,2]	[2,2,3]	[1,3,2]
15	[1,1,1]	[0,1,0]	[0.1,1.2,100]
##where子句
drop table if exists t1;
CREATE TABLE t1 (c1 int primary key, c2 vector(3),c3 vector(3) ,c4 vector(3),
VECTOR INDEX vector_idx(c2) 
WITH (distance=inner_product, lib=vsag, type=hnsw, m=10, ef_construction=100, ef_search=40));
insert into t1 values(1,'[1,1,2]','[2,2,3]','[1,3,2]');
insert into t1 values(2,'[1,0,3]','[1,0,3]','[2,3,2]');
insert into t1 values(3,'[-1,2,2]','[-3,2,3]','[4,3,3]');
insert into t1 values(4,'[-1,-2,-2]','[-4,2,3]',null);
insert into t1 values(5,'[-1,-3,-2]',null,'[2,3,1]');
update t1 set c2 ='[1,2,3]' where c1 >inner_product('[1,1,2]','[1,2,2]');
update t1 set c2 =[1,2,3] where c1 >inner_product('[1,1,2]','[1,2,2]');
update t1 set c2 =[2,2,3] where c1 <inner_product('[1,1,2]','[1,2,2]');
update t1 set c2 =[1,2,3] where c1 >=inner_product('[1,1,2]','[1,2,2]');
update t1 set c2 =[2,2,3] where c1 <=inner_product('[1,1,2]','[1,2,2]');
update t1 set c2 =[1,2,3] where c1 =inner_product('[1,1,2]','[1,2,2]');
update t1 set c2 =[2,2,3] where c1 <>inner_product('[1,1,2]','[1,2,2]');
select * from t1 order by c1;
c1	c2	c3	c4
1	[2,2,3]	[2,2,3]	[1,3,2]
2	[2,2,3]	[1,0,3]	[2,3,2]
3	[2,2,3]	[-3,2,3]	[4,3,3]
4	[2,2,3]	[-4,2,3]	NULL
5	[2,2,3]	NULL	[2,3,1]
update t1 set c2 =[1,2,3] where c1 > inner_product('[1,3,2]','[1,2,2]') and c1 > inner_product('[1,3,2]','[1,2,2]');
update t1 set c2 =[2,2,3] where c1 < inner_product('[1,1,2]','[1,2,2]') or c1 > inner_product('[1,3,2]','[1,2,2]') ;
update t1 set c2 =[1,2,3] where c1 BETWEEN inner_product(c3,c4)  and inner_product(c3,'[1,2,3]') >1;
update t1 set c2 =[2,2,3] where c3 like '%-4%' ;
ERROR 22000: Invalid data type for the operation
update t1 set c2 =[inner_product('[1,3,2]','[1,1,2]'),inner_product('[1,2,2]','[1,1,11]'),inner_product('[1,1,2]','[1,1,2]')] where c1 like '%5%' ;
update t1 set c2 =[inner_product('[1,3,2]','[1,1,2]'),inner_product('[1,2,2]','[1,1,11]'),inner_product('[1,1,2]','[1,1,2]')] where c1 not like '%5%' ;
update t1 set c2 =[2,2,3] where inner_product(c3,c3) = any (SELECT inner_product(c3,c4) FROM t1) order by c1;
update t1 set c2 =[2,2,3] where inner_product(c3,c3) = all (SELECT inner_product(c3,c4) FROM t1) order by c1;
update t1 set c2 =[2,2,3] where  exists (SELECT inner_product(c3,c4) FROM t1) order by c1;
update t1 set c2 =[2,2,3] where inner_product(c3,c3) in  (SELECT inner_product(c3,c4) FROM t1) order by c1;
update t1 set c2 =[2,2,3] where inner_product(c3,c3) not in  (SELECT inner_product(c3,c4) FROM t1) order by c1;
select * from t1 order by c1;
c1	c2	c3	c4
1	[2,2,3]	[2,2,3]	[1,3,2]
2	[2,2,3]	[1,0,3]	[2,3,2]
3	[2,2,3]	[-3,2,3]	[4,3,3]
4	[2,2,3]	[-4,2,3]	NULL
5	[2,2,3]	NULL	[2,3,1]
call dbms_vector.refresh_index('vector_idx','t1','c2',1,'FAST');
call dbms_vector.rebuild_index('vector_idx','t1');
## update join(子查询/多表更新)
drop table if exists t1;
CREATE TABLE t1 (c1 int primary key, c2 vector(3),c3 vector(3) ,c4 vector(3));
insert into t1 values(1,'[1,1,2]','[2,2,3]','[1,3,2]');
insert into t1 values(2,'[1,0,3]','[1,0,3]','[2,3,2]');
insert into t1 values(3,'[-1,2,2]','[-3,2,3]','[4,3,3]');
insert into t1 values(4,'[-1,-2,-2]','[-4,2,3]',null);
insert into t1 values(5,'[-1,-3,-2]',null,'[2,3,1]');
drop table if exists t2;
CREATE TABLE t2 (a1 int , a2 vector(3),a3 vector(3) ,a4 vector(3));
insert into t2 select c1,c2,c3,c4 from t1;
select * from t1 union  select * from t2;
c1	c2	c3	c4
1	[1,1,2]	[2,2,3]	[1,3,2]
2	[1,0,3]	[1,0,3]	[2,3,2]
3	[-1,2,2]	[-3,2,3]	[4,3,3]
4	[-1,-2,-2]	[-4,2,3]	NULL
5	[-1,-3,-2]	NULL	[2,3,1]
update t1 set c2 =[1,2,4] where c1 in (select inner_product(c3,c3) from t1 inner join t2 on c2=a2);
update t1 join t2 on c2 =a2 set c2 =[1,2,4] where a3 is null;
update t1 set c1 = inner_product([1,2,4],[1,3,5]) where c1 in (select inner_product(c3,c3) from t1 inner join t2 on c2=a2);
update t1 join t2 on c2 =a2 set c1 = inner_product([1,2,4],[1,3,5]) where a3 is null;
##update with limit + order by 
drop table if exists t1;
CREATE TABLE t1 (c1 int , c2 vector(3),c3 vector(3) ,c4 vector(3));
insert into t1 values(1,'[1,1,2]','[2,2,3]','[1,3,2]');
insert into t1 values(2,'[1,0,3]','[1,0,3]','[2,3,2]');
insert into t1 values(3,'[-1,2,2]','[-3,2,3]','[4,3,3]');
insert into t1 values(4,'[-1,-2,-2]','[-4,2,3]',null);
insert into t1 values(5,'[-1,-3,-2]',null,'[2,3,1]');
drop table if exists t2;
CREATE TABLE t2 (a1 int , a2 vector(3),a3 vector(3) ,a4 vector(3));
insert into t2 select c1,c2,c3,c4 from t1;
update t1 set c1 = inner_product([1,2,4],[1,3,5]) where c3 is null;
update t1 set c1 = inner_product([1,2,4],[1,3,5]) where c1> 1 order by c1 limit 1;
select * from t1 order by 1,2;
ERROR 22000: Invalid data type for the operation
update t1 join t2 on c2 =a2 set c1 = inner_product([-100,2,4],[1,3,5])  where a2 = [1,1,2];
update t1 join t2 on c2 =a2 set c1 = inner_product([null,1,4],[1,3,5])  where a2 = [1,1,2];
ERROR 42000: Null value
select * from t1 order by inner_product(c2,c3);
c1	c2	c3	c4
27	[-1,-3,-2]	NULL	[2,3,1]
4	[-1,-2,-2]	[-4,2,3]	NULL
-74	[1,1,2]	[2,2,3]	[1,3,2]
27	[1,0,3]	[1,0,3]	[2,3,2]
3	[-1,2,2]	[-3,2,3]	[4,3,3]
select * from t1 order by inner_product(c2,c3),inner_product(c3,c4),inner_product(c2,c4);
c1	c2	c3	c4
27	[-1,-3,-2]	NULL	[2,3,1]
4	[-1,-2,-2]	[-4,2,3]	NULL
27	[1,0,3]	[1,0,3]	[2,3,2]
-74	[1,1,2]	[2,2,3]	[1,3,2]
3	[-1,2,2]	[-3,2,3]	[4,3,3]
##with as update
drop table if exists t1;
CREATE TABLE t1 (c1 int primary key, c2 vector(3),c3 vector(3) ,c4 vector(3),
VECTOR INDEX vector_idx(c2) 
WITH (distance=inner_product, lib=vsag, type=hnsw, m=10, ef_construction=100, ef_search=40));
insert into t1 values(1,'[1,1,2]','[2,2,3]','[1,3,2]');
insert into t1 values(2,'[1,0,3]','[1,0,3]','[2,3,2]');
insert into t1 values(3,'[-1,2,2]','[-3,2,3]','[4,3,3]');
insert into t1 values(4,'[-1,-2,-2]','[-4,2,3]',null);
insert into t1 values(5,'[-1,-3,-2]',null,'[2,3,1]');
update t1 set c1 = 10 where c3 =[2,2,3];
drop table if exists t2;
CREATE TABLE t2 (a1 int primary key , a2 vector(3),a3 vector(3) ,a4 vector(3),
VECTOR INDEX vector_idx(a2) 
WITH (distance=inner_product, lib=vsag, type=hnsw, m=10, ef_construction=100, ef_search=40));
insert into t2 select c1,c2,c3,c4 from t1;
with cte as (select inner_product(c2,c3) from t1 order by c1 )
update t2 set a1 = inner_product([1,2,3],[2,2,3]) where a3 is null ;
select * from t2 order by a1;
a1	a2	a3	a4
2	[1,0,3]	[1,0,3]	[2,3,2]
3	[-1,2,2]	[-3,2,3]	[4,3,3]
4	[-1,-2,-2]	[-4,2,3]	NULL
10	[1,1,2]	[2,2,3]	[1,3,2]
15	[-1,-3,-2]	NULL	[2,3,1]
##insert/replace
drop table if exists t1;
CREATE TABLE t1 (c1 int primary key, c2 vector(3),c3 vector(3) ,c4 vector(3),
VECTOR INDEX vector_idx(c3) 
WITH (distance=inner_product, lib=vsag, type=hnsw, m=10, ef_construction=100, ef_search=40));
insert into t1(c1) values(inner_product([1,2,3],[1,2,4]));
insert into t1(c1) values(inner_product([1,2,3],[1,2,5]));
insert into t1(c1) values(inner_product([1,2,3],[1,2,6]));
insert into t1(c1) values(inner_product([1,2,3],[1,2,7]));
insert into t1(c1) values(inner_product([1,2,3],[1,2,3]));
insert into t1(c1,c2,c3,c4) values(inner_product([1,2,3],[1,2,8]),[1,1,2],[2,3,4],[2,3,4]);
insert into t1(c1,c2,c3,c4) values(inner_product([1,2,3],[1,2,9]),[1,1,2],[2,3,4],null);
replace into t1(c1,c2,c3,c4) values(inner_product([1,2,3],[1,2,100]),[-1,-3,-2],[2,3,1],[2,3,1]);
replace into t1(c1,c2,c3,c4) values(inner_product([1,2,3],[1,2,100]),[-1,-3,-2],null,[2,3,1]);
replace into t1(c1,c2,c3,c4) values(-1,[-1,-3,-2],null,[2,3,1]);
##导致core 已修复
replace into t1(c1,c2,c3,c4) values(inner_product([1,2,3],[1,2,100]),[-1,-3,-2],null,[2,3,1]);
select inner_product(c2,c3) from t1 where c3 is not null order by c1 ;
inner_product(c2,c3)
13
13
##插入不同的数据类型到vector
drop table if exists t1;
CREATE TABLE t1 (c1 int primary key, c2 vector(3),c3 vector(3) ,c4 vector(3),
VECTOR INDEX vector_idx(c3)
WITH (distance=inner_product, lib=vsag, type=hnsw, m=10, ef_construction=100, ef_search=40));
drop table if exists t2;
CREATE TABLE t2 (a1 int primary key, a2 VARCHAR(30), a3 VARCHAR(30), a4 VARCHAR(30));
insert into t2 values(1,'999','999','999');
insert into t2 values(2,'中文','@！#￥','中文123abc');
replace into t1 select a1,a2,a3,a4 from t2;
ERROR HY000: Invalid argument
insert into t1 select a1,a2,a3,a4 from t2;
ERROR HY000: Invalid argument
insert into t1 select a1,a2,a3,a4 from t2;
ERROR HY000: Invalid argument
drop table if exists t1;
CREATE TABLE t1 (c1 int primary key, c2 vector(3),c3 vector(3) ,c4 vector(3),c5 vector(3),c6 vector(3),
VECTOR INDEX vector_idx(c3)
WITH (distance=inner_product, lib=vsag, type=hnsw, m=10, ef_construction=100, ef_search=40));
drop table if exists t2;
CREATE TABLE t2 (c1 int PRIMARY KEY, c2 TINYBLOB,c3 BLOB,c4 MEDIUMBLOB,c5 LONGBLOB,c6 TEXT);
INSERT INTO t2 (c1, c2, c3, c4, c5, c6) VALUES (1, '2023-04-01', '12:34:56', '2023-04-01 12:34:56', '2023-04-01 12:34:56', 2023);
insert into t1 select c1,c2,c3,c4,c5,c6 from t2;
ERROR HY000: Invalid argument
replace into t1 select c1,c2,c3,c4,c5,c6 from t2;
ERROR HY000: Invalid argument
replace into t1 select c1,c2,c3,c4,c5,c6 from t2;
ERROR HY000: Invalid argument
drop table if exists t1;
CREATE TABLE t1 (c1 int AUTO_INCREMENT primary key , c2 vector(3),c3 vector(3) ,c4 BLOB,
VECTOR INDEX vector_idx(c3) 
WITH (distance=inner_product, lib=vsag, type=hnsw, m=10, ef_construction=100, ef_search=40));
insert into t1(c3) values(inner_product(null,null));
ERROR 0A000: type casting not supported
insert into t1(c4) values(inner_product(null,null));
insert into t1(c1) values(inner_product(null,null));
insert into t1(c3) values(inner_product([1,2,4],[1,2,4]));
ERROR 0A000: type casting not supported
insert into t1(c4) values(inner_product(null,null));
insert into t1(c3) values([inner_product([1.5,2.5,-1.5],[-1.5,1.5,0]),inner_product([1,2,-4],[1,-2,4]),inner_product([1,-2,4],[-1,2,4])]);
insert into t1(c3) values([inner_product([1.5,2.5,-1.5],[-1.5,1.5]),inner_product([1,2,-4],[1,-2,4]),inner_product([1,-2,4],[-1,2,4])]);
ERROR 22000: Invalid dimension for vector.
select inner_product(c3,c4) from t1;
inner_product(c3,c4)
NULL
NULL
NULL
NULL
drop table if exists t1;
CREATE TABLE t1 (c1 int AUTO_INCREMENT primary key , c2 vector(3),c3 vector(3) ,c4 BLOB,
VECTOR INDEX vector_idx(c3) 
WITH (distance=inner_product, lib=vsag, type=hnsw, m=10, ef_construction=100, ef_search=40));
insert into t1(c1) values(inner_product([1.5+1,2.5-1,-1.5*2],[-1.5 % 1,1.5+0,1%1]));
insert into t1(c1) values(inner_product([2.5+1,2.5-1,-1.5*2],[-1000.5 % 1,1.5+1,1%1]));
insert into t1(c1) values(inner_product([1.5+1,2.5-1,-1.5*2],[-1.5 % 1,1.5+1,1%1])+inner_product([1.5+1,2.5-1,-1.5*2],[-1.5 % 1,1.5+0,1%1]));
insert into t1(c1) values(inner_product([1.5+1,2.5-1,-1.5*2],[-1.5 % 1,1.5+1,1%1])+inner_product([1.5+1,2.5-1,-1.5*2],[-1.5 % 1,1.5+0,1%1])+inner_product([1.5+1,2.5-1,-1.5*2],[-1.5 % 1,1.5+0,1%1])+inner_product([1.5+1,2.5-1,-1.5*2],[-1.5 % 1,1.5+0,1%1])+inner_product([1.5+1,2.5-1,-1.5*2],[-1.5 % 1,1.5+0,1%1])+inner_product([1.5+1,2.5-1,-1.5*2],[-1.5 % 1,1.5+0,1%1])+inner_product([1.5+1,2.5-1,-1.5*2],[-1.5 % 1,1.5+0,1%1]));
insert into t1(c1) values(inner_product([1.5+1,2.5-1,-1.5*2],[-1.5 % 1,1.5+1,1%1])-inner_product([1.5+1,2.5-1,-1.5*2],[-1.5 % 1,1.5+0,1%1])+inner_product([1.5+1,2.5-1,-1.5*2],[-1.5 % 1,1.5+0,1%1])*inner_product([1.5+1,2.5-1,-1.5*2],[-1.5 % 1,1.5+0,1%1])+inner_product([1.5+1,2.5-1,-1.5*2],[-1.5 % 1,1.5+0,1%1])+inner_product([1.5+1,2.5-1,-1.5*2],[-1.5 % 1,1.5+0,1%1])+inner_product([1.5+1,2.5-1,-1.5*2],[-1.5 % 1,1.5+0,1%1]));
insert into t1(c2) select [2,3,4] from dual;
insert into t1(c3) select [3,3,4] from dual;
insert into t1(c3) select [inner_product([1.5+1,2.5-1,-1.5*2],[-1.5 % 1,1.5+1,1%1]),inner_product([1.5+1,2.5-1,-1.5*2],[-1.5 % 1,1.5+1,1%1]),inner_product([1.5+1,2.5-1,-1.5*2],[-1.5 % 1,1.5+1,1%1])] from dual;
insert into t1(c4) select inner_product([1.5+1,2.5-1,-1.5*2],[-1.5 % 1,1.5+1,1%1]) from dual;
select inner_product(c3,[2,3,5]) from t1 order by c1 limit 6,2;
inner_product(c3,[2,3,5])
35
25
select inner_product(c3,[-2,3,-5]) from t1 order by c1 limit 6,2;
inner_product(c3,[-2,3,-5])
-17
-10
drop table if exists t1;
CREATE TABLE t1 (c1 int AUTO_INCREMENT primary key , c2 vector(3),c3 vector(3) ,c4 BLOB,
VECTOR INDEX vector_idx(c3) 
WITH (distance=inner_product, lib=vsag, type=hnsw, m=10, ef_construction=100, ef_search=40));
drop table if exists t2;
CREATE TABLE t2 (a1 int AUTO_INCREMENT primary key , a2 vector(3),a3 vector(3) ,a4 BLOB,
VECTOR INDEX vector_idx(a3) 
WITH (distance=inner_product, lib=vsag, type=hnsw, m=10, ef_construction=100, ef_search=40));
insert into t1(c1,c2) values(inner_product([1.5+1,2.5-1,-1.5*2],[-1.5 % 1,1.5+0,1%1]),[inner_product([-1.5+1,2.5-1,-1.5*2],[-1.5 % 1,1.5+1.5,1%1]),inner_product([1.5+1,2.5-1,-1.5*2],[-1.5 % 1,1.5+1,1%1]),inner_product([1.5+1,2.5-1,-1.5*2],[-1.5 % 1,1.5+1,1%1])]);
insert into t2(a1,a2) values(inner_product([1.5+1,2.5-1,-1.5*2],[-1.5 % 1,1.5+0,1%1]),[inner_product([-1.5+1,2.5-1,-1.5*2],[-1.5 % 1,1.5+1,1%1.5]),inner_product([1.5+1,2.5-1,-1.5*2],[-1.5 % 1,1.5+1,1%1]),inner_product([1.5+1,2.5-1,-1.5*2],[-1.5 % 1,1.5+1,1%1])]);
insert into t1(c2,c3) values([inner_product([1.5+1,2.5-1,-1.5*2],[-1.5 % 1,1.5+1,1%1]),inner_product([-1.5+1,2.5-1,-1.5*2],[-1.5 % 1,1.5+1.5,1%1]),inner_product([1.5+1,2.5-1,-1.5*2],[-1.5 % 1,1.5+1,1%1])],[inner_product([1.5+1,2.5-1,-1.5*2],[-1.5 % 1,1.5+1,1%1]),inner_product([1.5+1,2.5-1,-1.5*2],[-1.5 % 1,1.5+1,1%1]),inner_product([1.5+1,2.5-1,-1.5*2],[-1.5 % 1,1.5+1,1%1])]);
insert into t1(c3,c4) values([inner_product([1.5+1,2.5-1,-1.5*2],[-1.5 % 1,1.5+1,1%1]),inner_product([-1.5+1,2.5-1,-1.5*2],[-1.5 % 1,1.5+1.5,1%1]),inner_product([1.5+1,2.5-1,-1.5*2],[-1.5 % 1,1.5+1,1%1])],inner_product([1.5+1,2.5-1,-1.5*2],[-1.5 % 1,1.5+1,1%1]));
insert into t2(a3,a4) values([inner_product([1.5+1,2.5-1,-1.5*2],[-1.5 % 1,1.5+1,1%1]),inner_product([-1.5+1,2.5-1,-1.5*2],[-1.5 % 1,1.5+1.5,1%1]),inner_product([1.5+1,2.5-1,-1.5*2],[-1.5 % 1,1.5+1,1%1])],inner_product([1.5+1,2.5-1,-1.5*2],[-1.5 % 1,1.5+1,1%1]));
insert into t1(c1,c2,c3,c4) values(10,[inner_product([1.5+1,2.5-1,-1.5*2],[-1.5 % 1,1.5+1,1%1]),inner_product([-1.5+1,2.5-1,-1.5*2],[-1.5 % 1,1.5+1.5,1%1]),inner_product([1.5+1,2.5-1,-1.5*2],[-1.5 % 1,1.5+1,1%1])],[inner_product([1.5+1,2.5-1,-1.5*2],[-1.5 % 1,1.5+1,1%1]),inner_product([-1.5+1,2.5-1,-1.5*2],[-1.5 % 1,1.5+1.5,1%1]),inner_product([1.5+1,2.5-1,-1.5*2],[-1.5 % 1,1.5+1,1%1])],inner_product([1.5+1,2.5-1,-1.5*2],[-1.5 % 1,1.5+1,1%1]));
select c1,c2,a1,a2,inner_product(c2,a3),inner_product(c3,c3) from t1,t2 where c4=a4;
c1	c2	a1	a2	inner_product(c2,a3)	inner_product(c3,c3)
3	NULL	2	NULL	NULL	35.0625
10	[2.5,4.75,2.5]	2	NULL	35.0625	35.0625
drop table if exists t1;
CREATE TABLE t1 (c1 int AUTO_INCREMENT primary key , c2 vector(3),c3 vector(3) ,c4 BLOB,
VECTOR INDEX vector_idx(c3) 
WITH (distance=inner_product, lib=vsag, type=hnsw, m=10, ef_construction=100, ef_search=40));
INSERT IGNORE t1(c1) values (inner_product([1,2],[2,-1]));
INSERT IGNORE t1(c1) values (inner_product([1,2],[2,-1]));
INSERT IGNORE t1(c2) values ([inner_product([1,2],[2,-1]),inner_product([-1,2],[2,-1]),inner_product([-1,2],[-2,-1])]);
INSERT IGNORE t1 values (10,[1,2,3],[2,-1,-1.5],inner_product([-1,2],[2,-1]));
select c1,c2,inner_product(c2,[2,3,-1.5]),inner_product(c2,c3) from t1 order by c1;
c1	c2	inner_product(c2,[2,3,-1.5])	inner_product(c2,c3)
1	NULL	NULL	NULL
2	NULL	NULL	NULL
3	[0,-4,0]	-12	NULL
10	[1,2,3]	3.5	-4.5
select c1,c2,inner_product(c2,[2,3,-1.5]),inner_product(c2,c3) from t1 order by inner_product(c2,[2,3,-1.5]);
c1	c2	inner_product(c2,[2,3,-1.5])	inner_product(c2,c3)
1	NULL	NULL	NULL
2	NULL	NULL	NULL
3	[0,-4,0]	-12	NULL
10	[1,2,3]	3.5	-4.5
select c1,c2,inner_product(c2,[2,3,-1.5]),inner_product(c2,c3) from t1 order by inner_product([1],[1]);
c1	c2	inner_product(c2,[2,3,-1.5])	inner_product(c2,c3)
1	NULL	NULL	NULL
2	NULL	NULL	NULL
3	[0,-4,0]	-12	NULL
10	[1,2,3]	3.5	-4.5
drop table if exists t1;
CREATE TABLE t1 (c1 int AUTO_INCREMENT primary key , c2 vector(3),c3 vector(3) ,c4 BLOB,
VECTOR INDEX vector_idx(c3) 
WITH (distance=inner_product, lib=vsag, type=hnsw, m=10, ef_construction=100, ef_search=40));
insert into t1(c1) values(inner_product([1],[3]))ON DUPLICATE KEY UPDATE c1='[1,1,3]';
insert into t1(c2,c3,c4) values([inner_product([1.5+1,2.5-1,-1.5*2],[-1.5 % 1,1.5+1,1%1]),inner_product([-1.5+1,2.5-1,-1.5*2],[-1.5 % 1,1.5+1.5,1%1]),inner_product([1.5+1,2.5-1,-1.5*2],[-1.5 % 1,1.5+1,1%1])],'[1,0,3]','[2,3,2]') ON DUPLICATE KEY UPDATE c2='[1,1,3]';
insert into t1(c2,c3,c4) values('[1,2,3]','[1,3,3]','[2,1,2]') ON DUPLICATE KEY UPDATE c2='[1,null,3]';
insert into t1(c2,c3,c4) values('[1,6,3]','[1,4,3]','[2,3,2]') ON DUPLICATE KEY UPDATE c2='[1,1,3]';
select * from t1 order by c1;
c1	c2	c3	c4
3	NULL	NULL	NULL
4	[2.5,4.75,2.5]	[1,0,3]	[2,3,2]
5	[1,2,3]	[1,3,3]	[2,1,2]
6	[1,6,3]	[1,4,3]	[2,3,2]
drop table if exists t1;
CREATE TABLE t1 (c1 int AUTO_INCREMENT primary key , c2 vector(3),c3 vector(3) ,c4 BLOB,
VECTOR INDEX vector_idx(c3) 
WITH (distance=inner_product, lib=vsag, type=hnsw, m=10, ef_construction=100, ef_search=40));
INSERT INTO T1 (C1,C2)VALUES (inner_product([1],[2]), [1,2,3]), (inner_product([2],[4]), [1,2,3]), (inner_product([3],[46]), [1,2,3]);
INSERT INTO T1 (C3,C4)VALUES ([1,2,3], inner_product([1],[2])),([2,3,-1],inner_product([2],[2])),([2.23,4.23,1.323],inner_product([3],[46]));
SELECT * FROM T1 order by c1,c4;
c1	c2	c3	c4
2	[1,2,3]	NULL	NULL
8	[1,2,3]	NULL	NULL
138	[1,2,3]	NULL	NULL
139	NULL	[1,2,3]	2
140	NULL	[2,3,-1]	4
141	NULL	[2.23,4.23,1.323]	138
drop table if exists t1;
CREATE TABLE t1 (c1 int primary key, c2 vector(3),c3 vector(3) ,c4 vector(3),
VECTOR INDEX vector_idx(c2) 
WITH (distance=inner_product, lib=vsag, type=hnsw, m=10, ef_construction=100, ef_search=40));
insert into t1 values(1,'[1,1,2]','[2,2,3]','[1,3,2]');
insert into t1 values(2,'[1,0,3]','[1,0,3]','[2,3,2]');
insert into t1 values(3,'[-1,2,2]','[-3,2,3]','[4,3,3]');
insert into t1 values(4,'[-1,-2,-2]','[-4,2,3]',null);
insert into t1 values(5,'[-1,-3,-2]',null,'[2,3,1]');
update t1 set c1 = 10 where c3 =[2,2,3];
drop table if exists t2;
CREATE TABLE t2 (a1 int primary key , a2 vector(3),a3 vector(3) ,a4 vector(3),
VECTOR INDEX vector_idx(a2) 
WITH (distance=inner_product, lib=vsag, type=hnsw, m=10, ef_construction=100, ef_search=40));
insert into t2 select c1,c2,c3,c4 from t1;
INSERT INTO t1 (c1, c2) VALUES (5,'[-1,-3,-2]') ON t2 (a1) DO UPDATE SET a2 = [2,3,1];
ERROR 42000: You have an error in your SQL syntax; check the manual that corresponds to your OceanBase version for the right syntax to use near 't2 (a1) DO UPDATE SET a2 = [2,3,1]' at line 1
drop table if exists t1;
CREATE TABLE t1 (c1 int primary key, c2 vector(3),c3 vector(3) ,c4 vector(3),
VECTOR INDEX vector_idx(c3) 
WITH (distance=inner_product, lib=vsag, type=hnsw, m=10, ef_construction=100, ef_search=40));
insert into t1(c1) values(inner_product([1,2,3],[1,2,4]));
replace into t1(c1,c2,c3,c4) values(inner_product([1,2,3],[1,2,100]),[-1,-3,-2],[2,3,1],[2,3,1]);
replace into t1(c1,c2,c3,c4) values(inner_product([1,2,3],[1,2,100]),[-1,-3,-2],null,[2,3,1]);
replace into t1(c1,c2,c3,c4) values(-1,[-1,-3,-2],null,[2,3,1]);
replace into t1(c1,c2,c3,c4) values(inner_product([1,2,3,1,1,1,1,1,1,1,2,3,1,1,1,1,1,1,1,2,3,1,1,1,1,1,1,1,2,3,1,1,1,1,1,1,1,2,3,1,1,1,1,1,1,1,2,3,1,1,1,1,1,1,1,2,3,1,1,1,1,1,1,1,2,3,1,1,1,1,1,1,1,2,3,1,1,1,1,1,1,1,2,3,1,1,1,1,1,1,1,2,3,1,1,1,1,1,1,1,2,3,1,1,1,1,1,1],[1,2,3,1,1,1,1,1,1,1,2,3,1,1,1,1,1,1,1,2,3,1,1,1,1,1,1,1,2,3,1,1,1,1,1,1,1,2,3,1,1,1,1,1,1,1,2,3,1,1,1,1,1,1,1,2,3,1,1,1,1,1,1,1,2,3,1,1,1,1,1,1,1,2,3,1,1,1,1,1,1,1,2,3,1,1,1,1,1,1,1,2,3,1,1,1,1,1,1,1,2,3,10.20,1,1,1,1,1]),[1,2,3],null,[2,3,1]);
replace into t1(c1,c2,c3,c4) values(inner_product([1,2,3],[1,2,100]),[-1,-3,-2],null,[2,3,1]);
##旁路导入
drop table if exists t1;
drop view if exists v1;
CREATE TABLE t1 (c1 int , c2 VARCHAR(30),c3 vector(3) ,c4 vector(3));
insert into t1(c1,c2,c3,c4) values(1,'[1,1,2]','[2,2,3]','[1,3,2]');
insert into t1(c1,c2,c3,c4) values(2,'[1,0,3]','[1,0,3]','[2,3,2]');
insert into t1(c1,c2,c3,c4) values(3,'[-1,2,2]','[-3,2,3]','[4,3,3]');
insert into t1(c1,c2,c3,c4) values(4,'[-1,-2,-2]','[-4,2,3]',null);
insert into t1(c1,c2,c3,c4) values(5,'[-1,-3,-2]',null,'[2,3,1]');
create view v1 as select * from t1;
insert /*+ direct(true,100) enable_parallel_dml parallel(2)*/ into v1(c1) select inner_product(c2,c3) from t1;
insert  into t1 select c1,c2,c3,c4 from t1;
insert /*+ direct(true,100) enable_parallel_dml parallel(2) append*/ into t1(c1) select inner_product(c2,c3) from t1;
insert /*+ direct(true,100) enable_parallel_dml parallel(2) append*/ into t1 select c1,c2,c3,c4 from t1;
insert /*+ enable_parallel_dml parallel(2) */ into t1(c1) select inner_product(c2,c3) from t1;
drop table if exists t1;
create table t1(c1 int, c2 vector(3)) partition by hash(c1);
insert into t1 values(1,'[1,1,3]');
insert into t1 values(2,'[1,2,4]');
insert into t1 values(3,'[2,4,1]');
insert /*+ direct(true,100) enable_parallel_dml parallel(2) append*/ into t1(c2) select sum(c2) from t1;
insert /*+ direct(true,100) enable_parallel_dml parallel(2) append*/ into t1(c2) select sum(c2) from t1;
insert /*+ direct(true,100) enable_parallel_dml parallel(2) append*/ into t1(c2) select sum(c2)+avg(c2) from t1;
insert /*+ direct(true,100) enable_parallel_dml parallel(2) append*/ into t1(c2) select sum(c2)+avg(c2) from t1;
select count(inner_product(c2,[1,2,3])) from t1 order by c1;
count(inner_product(c2,[1,2,3]))
7
select sum(inner_product(c2,[1,2,3])) from t1 order by c1;
sum(inner_product(c2,[1,2,3]))
800.7999992370605
select avg(inner_product(c2,[1,2,3])) from t1 order by c1;
avg(inner_product(c2,[1,2,3]))
114.39999989100865
select min(inner_product(c2,[1,2,3])) from t1 order by c1;
min(inner_product(c2,[1,2,3]))
12
select max(inner_product(c2,[1,2,3])) from t1 order by c1;
max(inner_product(c2,[1,2,3]))
431.1999969482422
select distinct inner_product(c2,[1,2,3]) from t1 order by c1;
inner_product(c2,[1,2,3])
42
84
201.60000228881836
431.1999969482422
12
17
13
drop table if exists t1;
drop view if exists v1;
CREATE TABLE t1 (c1 int , c2 VARCHAR(30),c3 vector(3) ,c4 vector(3),
VECTOR INDEX vector_idx(c3) 
WITH (distance=inner_product, lib=vsag, type=hnsw, m=10, ef_construction=100, ef_search=40));
insert into t1(c1,c2,c3,c4) values(1,'[1,1,2]','[2,2,3]','[1,3,2]');
insert into t1(c1,c2,c3,c4) values(2,'[1,0,3]','[1,0,3]','[2,3,2]');
insert into t1(c1,c2,c3,c4) values(3,'[-1,2,2]','[-3,2,3]','[4,3,3]');
insert into t1(c1,c2,c3,c4) values(4,'[-1,-2,-2]','[-4,2,3]',null);
insert into t1(c1,c2,c3,c4) values(5,'[-1,-3,-2]',null,'[2,3,1]');
insert  into t1 select c1,c2,c3,c4 from t1;
insert /*+ enable_parallel_dml parallel(2) */ into t1 select c1,c2,c3,c4 from t1;
drop table if exists t1;
CREATE TABLE t1 (c1 int , c2 VARCHAR(30),c3 vector(3) ,c4 vector(2000),
VECTOR INDEX vector_idx(c3) 
WITH (distance=inner_product, lib=vsag, type=hnsw, m=10, ef_construction=100, ef_search=40));
CREATE VECTOR INDEX vector_idx_c4  ON t1 (c4)  WITH (distance=inner_product, lib=vsag, type=hnsw, m=10, ef_construction=100, ef_search=40);
drop table if exists t1;
drop view if exists v1;
CREATE TABLE t1 (c1 int , c2 VARCHAR(30),c3 vector(3) ,c4 vector(3),
VECTOR INDEX vector_idx(c3) 
WITH (distance=inner_product, lib=vsag, type=hnsw, m=10, ef_construction=100, ef_search=40));
insert into t1(c1,c2,c3,c4) values(1,'[1,1,2]','[2,2,3]','[1,3,2]');
insert into t1(c1,c2,c3,c4) values(2,'[1,0,3]','[1,0,3]','[2,3,2]');
insert into t1(c1,c2,c3,c4) values(3,'[-1,2,2]','[-3,2,3]','[4,3,3]');
insert into t1(c1,c2,c3,c4) values(4,'[-1,-2,-2]','[-4,2,3]',null);
insert into t1(c1,c2,c3,c4) values(5,'[-1,-3,-2]',null,'[2,3,1]');
create view v1 as select * from t1;
insert /*+ direct(true,100) enable_parallel_dml parallel(2)*/ into v1 select c1,c2,c3,c4 from t1;
insert  into t1 select c1,c2,c3,c4 from t1;
insert /*+ direct(true,100) enable_parallel_dml parallel(2) append*/ into t1 select c1,c2,c3,c4 from t1;
insert /*+ direct(true,100) enable_parallel_dml parallel(2) append*/ into t1 select c1,c2,c3,c4 from t1;
drop table if exists t1;
CREATE TABLE t1 (c1 int primary key, c2 varchar(30),c3 vector(3) ,c4 vector(3),c5 vector(3) as (c2 * c3),
VECTOR INDEX vector_idx(c3)
WITH (distance=inner_product, lib=vsag, type=hnsw, m=10, ef_construction=100, ef_search=40))PARTITION BY KEY(c1) PARTITIONS 4;
insert into t1(c1,c2,c3,c4) values(1,'[1,1,2]','[2,2,3]','[1,3,2]');
insert into t1(c1,c2,c3,c4) values(2,'[1,0,3]','[1,0,3]','[2,3,2]');
insert into t1(c1,c2,c3,c4) values(3,'[-1,2,2]','[-3,2,3]','[4,3,3]');
insert into t1(c1,c2,c3,c4) values(4,'[-1,-2,-2]','[-4,2,3]',null);
insert into t1(c1,c2,c3,c4) values(5,'[-1,-3,-2]',null,'[2,3,1]');
drop table if exists t2;
CREATE TABLE t2 (a1 int primary key , a2 vector(3),a3 vector(3) ,a4 vector(3),a5 vector(3) as (a2 * a3),
VECTOR INDEX vector_idx(a2) 
WITH (distance=inner_product, lib=vsag, type=hnsw, m=10, ef_construction=100, ef_search=40));
replace into t2(a1,a2,a3,a4) select c1,c2,c3,c4 from t1;
drop view if exists v1;
create view v1 as select a2 from t1 a ,t2 b where a.c5=b.a5 order by inner_product(a2,[1,1,8]) approximate limit 1;
select * from v1;
a2
[-1,-2,-2]
drop view if exists v1;
create view v1 as select max(c2) from t1 a ,t2 b where a.c5=b.a5 order by inner_product(a2,[1,1,8]) approximate limit 1;
select * from v1;
max(c2)
[1,1,2]
drop view if exists v1;
create view v1 as select sum(c3)+avg(c5) from t1 a ,t2 b where a.c5=b.a5 order by inner_product(a2,[1,1,8]) approximate limit 1;
select * from v1;
sum(c3)+avg(c5)
[-1.5,6.5,15.75]
##delete
drop table if exists t1;
CREATE TABLE t1 (c1 int primary key, c2 vector(3),c3 vector(3) ,c4 vector(3));
insert into t1(c1,c2,c3,c4) values(1,'[1,1,2]','[2,2,3]','[1,3,2]');
insert into t1(c1,c2,c3,c4) values(2,'[1,0,3]','[1,0,3]','[2,3,2]');
insert into t1(c1,c2,c3,c4) values(3,'[-1,2,2]','[-3,2,3]','[4,3,3]');
insert into t1(c1,c2,c3,c4) values(4,'[-1,-2,-2]','[-4,2,3]',null);
insert into t1(c1,c2,c3,c4) values(5,'[-1,-3,-2]',null,'[2,3,1]');
drop table if exists t2;
CREATE TABLE t2 (a1 int primary key , a2 vector(3),a3 vector(3) ,a4 vector(3),
VECTOR INDEX vector_idx(a2) 
WITH (distance=inner_product, lib=vsag, type=hnsw, m=10, ef_construction=100, ef_search=40));
insert into t2 select c1,c2,c3,c4 from t1;
delete from t1 where c3 = [1,0,3];
delete from t1 where c1 =inner_product([-1],[4]);
delete from t1 where c1 =inner_product([-1],[2]) and c2 = [-1,2,2];
delete from t1 where c2 =[1,1,1]+[-2,-3,-3];
select * from t1;
c1	c2	c3	c4
1	[1,1,2]	[2,2,3]	[1,3,2]
3	[-1,2,2]	[-3,2,3]	[4,3,3]
5	[-1,-3,-2]	NULL	[2,3,1]
drop table if exists t1;
CREATE TABLE t1 (c1 int primary key, c2 vector(3),c3 vector(3) ,c4 vector(3));
insert into t1(c1,c2,c3,c4) values(1,'[1,1,2]','[2,2,3]','[1,3,2]');
insert into t1(c1,c2,c3,c4) values(2,'[1,0,3]','[1,0,3]','[2,3,2]');
insert into t1(c1,c2,c3,c4) values(3,'[-1,2,2]','[-3,2,3]','[4,3,3]');
insert into t1(c1,c2,c3,c4) values(4,'[-1,-2,-2]','[-4,2,3]',null);
insert into t1(c1,c2,c3,c4) values(5,'[-1,-3,-2]',null,'[2,3,1]');
drop table if exists t2;
CREATE TABLE t2 (a1 int primary key , a2 vector(3),a3 vector(3) ,a4 vector(3),
VECTOR INDEX vector_idx(a2) 
WITH (distance=inner_product, lib=vsag, type=hnsw, m=10, ef_construction=100, ef_search=40));
insert into t2 select c1,c2,c3,c4 from t1;
drop table if exists t1;
CREATE TABLE t1 (c1 int primary key, c2 vector(3),c3 vector(3) ,c4 vector(3));
insert into t1(c1,c2,c3,c4) values(1,'[1,1,2]','[2,2,3]','[1,3,2]');
insert into t1(c1,c2,c3,c4) values(2,'[1,0,3]','[1,0,3]','[2,3,2]');
insert into t1(c1,c2,c3,c4) values(3,'[-1,2,2]','[-3,2,3]','[4,3,3]');
insert into t1(c1,c2,c3,c4) values(4,'[-1,-2,-2]','[-4,2,3]',null);
insert into t1(c1,c2,c3,c4) values(5,'[-1,-3,-2]',null,'[2,3,1]');
drop table if exists t2;
CREATE TABLE t2 (a1 int primary key , a2 vector(3),a3 vector(3) ,a4 vector(3),
VECTOR INDEX vector_idx(a2) 
WITH (distance=inner_product, lib=vsag, type=hnsw, m=10, ef_construction=100, ef_search=40));
insert into t2 select c1,c2,c3,c4 from t1;
select * from t1 inner join t2 on c2+c3+c4=a2+a3+a4 order by c1,c2,c3;
c1	c2	c3	c4	a1	a2	a3	a4
1	[1,1,2]	[2,2,3]	[1,3,2]	1	[1,1,2]	[2,2,3]	[1,3,2]
2	[1,0,3]	[1,0,3]	[2,3,2]	2	[1,0,3]	[1,0,3]	[2,3,2]
3	[-1,2,2]	[-3,2,3]	[4,3,3]	3	[-1,2,2]	[-3,2,3]	[4,3,3]
DELETE t1 FROM t1 INNER JOIN  t2 ON c3=c2 where a1 =3 or c4 is null;
DELETE t1 FROM t1 INNER JOIN  t2 ON inner_product(c2,c3)=inner_product(a3,a2) where a1 =3 or c4 is null;
drop table if exists t1;
CREATE TABLE t1 (c1 int primary key, c2 vector(3),c3 vector(3) ,c4 vector(3));
insert into t1(c1,c2,c3,c4) values(1,'[1,1,2]','[2,2,3]','[1,3,2]');
insert into t1(c1,c2,c3,c4) values(2,'[1,0,3]','[1,0,3]','[2,3,2]');
insert into t1(c1,c2,c3,c4) values(3,'[-1,2,2]','[-3,2,3]','[4,3,3]');
insert into t1(c1,c2,c3,c4) values(4,'[-1,-2,-2]','[-4,2,3]',null);
insert into t1(c1,c2,c3,c4) values(5,'[-1,-3,-2]',null,'[2,3,1]');
drop table if exists t2;
CREATE TABLE t2 (a1 int primary key , a2 vector(3),a3 vector(3) ,a4 vector(3),
VECTOR INDEX vector_idx(a2) 
WITH (distance=inner_product, lib=vsag, type=hnsw, m=10, ef_construction=100, ef_search=40));
insert into t2 select c1,c2,c3,c4 from t1 where c3 is not null and c4 is not null;
DELETE FROM  t1 USING  t2 WHERE inner_product(c2,c3)=inner_product(a3,a4) AND c1 =1;
ERROR 42S02: Unknown table 't1' in MULTI DELETE
drop table if exists t1;
CREATE TABLE t1 (c1 int primary key, c2 vector(3),c3 vector(3) ,c4 vector(3));
insert into t1(c1,c2,c3,c4) values(1,'[1,1,2]','[2,2,3]','[1,3,2]');
insert into t1(c1,c2,c3,c4) values(2,'[1,0,3]','[1,0,3]','[2,3,2]');
insert into t1(c1,c2,c3,c4) values(3,'[-1,2,2]','[-3,2,3]','[4,3,3]');
insert into t1(c1,c2,c3,c4) values(4,'[-1,-2,-2]','[-4,2,3]',null);
insert into t1(c1,c2,c3,c4) values(5,'[-1,-3,-2]',null,'[2,3,1]');
delete from t1 where c1 > inner_product(c2,c3) order by c1 limit 1;
delete from t1 where c1 > inner_product(c2,c3) order by c2 limit 100;
ERROR 22000: Invalid data type for the operation
delete from t1 where c1 > 0 order by inner_product(c2,c3) limit 1;
select * from t1 order by c1;
c1	c2	c3	c4
1	[1,1,2]	[2,2,3]	[1,3,2]
2	[1,0,3]	[1,0,3]	[2,3,2]
3	[-1,2,2]	[-3,2,3]	[4,3,3]
drop table if exists t1;
CREATE TABLE t1 (c1 int primary key, c2 vector(3),c3 vector(3) ,c4 vector(3));
insert into t1(c1,c2,c3,c4) values(1,'[1,1,2]','[2,2,3]','[1,3,2]');
insert into t1(c1,c2,c3,c4) values(2,'[1,0,3]','[1,0,3]','[2,3,2]');
insert into t1(c1,c2,c3,c4) values(3,'[-1,2,2]','[-3,2,3]','[4,3,3]');
insert into t1(c1,c2,c3,c4) values(4,'[-1,-2,-2]','[-4,2,3]',null);
insert into t1(c1,c2,c3,c4) values(5,'[-1,-3,-2]',null,'[2,3,1]');
drop table if exists t2;
CREATE TABLE t2 (a1 int primary key , a2 vector(3),a3 vector(3) ,a4 vector(3),
VECTOR INDEX vector_idx(a2) 
WITH (distance=inner_product, lib=vsag, type=hnsw, m=64, ef_construction=100, ef_search=40));
drop tablegroup if exists t00;
create tablegroup t00 ;
ALTER TABLEGROUP t00 ADD t2;
drop tablegroup t00;
ERROR HY000: tablegroup is not empty
insert into t2 select c1,c2,c3,c4 from t1 where c3 is not null and c4 is not null;
ALTER TABLE t2 ADD CONSTRAINT fk_a1 FOREIGN KEY (a1) REFERENCES t1(c1) ;
delete from t1 where c2 =[1,1,2];
ERROR 23000: Cannot delete or update a parent row: a foreign key constraint fails
delete from t1 where c1 =inner_product([1],[3]);
ERROR 23000: Cannot delete or update a parent row: a foreign key constraint fails
insert into t1(c1,c2,c3,c4) values(6,'[1,1,2]','[2,2,3]','[1,3,2]');
update t1 set c1=10 where c4 is null;
drop table if exists t2;
drop table if exists t1;
CREATE TABLE t1 (c1 int primary key, c2 vector(3),c3 vector(3) ,c4 vector(3));
insert into t1(c1,c2,c3,c4) values(1,'[1,1,2]','[2,2,3]','[1,3,2]');
insert into t1(c1,c2,c3,c4) values(2,'[1,0,3]','[1,0,3]','[2,3,2]');
insert into t1(c1,c2,c3,c4) values(3,'[-1,2,2]','[-3,2,3]','[4,3,3]');
insert into t1(c1,c2,c3,c4) values(4,'[-1,-2,-2]','[-4,2,3]',null);
insert into t1(c1,c2,c3,c4) values(5,'[-1,-3,-2]',null,'[2,3,1]');
CREATE TABLE t2 (a1 int primary key , a2 vector(3),a3 vector(3) ,a4 vector(3),
VECTOR INDEX vector_idx(a2) 
WITH (distance=inner_product, lib=vsag, type=hnsw, m=10, ef_construction=100, ef_search=40));
insert into t2 select c1,c2,c3,c4 from t1 where c3 is not null and c4 is not null;
ALTER TABLE t2 ADD CONSTRAINT fk_a1 FOREIGN KEY (a1) REFERENCES t1(c1) ON DELETE CASCADE ON UPDATE CASCADE;
delete from t1 where c2 =[1,1,2];
delete from t1 where c1 =inner_product([1],[3]);
insert into t1(c1,c2,c3,c4) values(6,'[1,1,2]','[2,2,3]','[1,3,2]');
update t1 set c1=10 where c4 is null;
TRUNCATE TABLE t2;
drop table if exists t2;
drop table if exists t1;
########清空回收站，删除测试数据库，表等 ##########
drop database  IF EXISTS  obljh;
alter system set ob_vector_memory_limit_percentage =0;
