purge recyclebin;
drop database IF EXISTS obljh;
create database obljh ;
use obljh;
set timestamp = 1600000000;
set ob_trx_timeout = 10000000000;
set ob_query_timeout = 10000000000;
set ob_default_lob_inrow_threshold = 0;
alter system set ob_vector_memory_limit_percentage =44;
set ob_query_timeout  = 3216672000000000;
##create table as select 
drop table if exists t1;
create table t1 as select l2_distance('','') from dual;
ERROR 42000: Null value
create table t1 as select l2_distance(null,null) from dual;
create table t1 as select l2_distance([null,[null]],[null,[null]]) from dual;
ERROR 22000: array type mismatch found between definition and data
create table t1 as select l2_distance(1,1) from dual;
ERROR HY000: Invalid argument
drop table if exists t1;
create table t1 as select [1,1,2] a from dual;
create table t2 as select [1,1,2] a,[1,1,2] b from dual;
create table t3 as select l2_distance([1,1,2],[1,12,2]) a,l2_distance([1,1,2],[1,11,2]) b from dual;
select * from t1;
a
[1,1,2]
select * from t2;
a	b
[1,1,2]	[1,1,2]
select * from t3;
a	b
11	10
drop table if exists t1;
drop table if exists t2;
drop table if exists t3;
create table t1 as select l2_distance([1,1,2],null) a,l2_distance([1,1,2],[1,11,2]) b,l2_distance([1,1,2],[1,1,211]) c,l2_distance([1,1,2],[1,1,211]) d,l2_distance([1,1,2],[1,1,211]) e,l2_distance([1,1,2],[1,1,211]) f from dual;
select * from t1;
a	b	c	d	e	f
NULL	10	209	209	209	209
drop table if exists t1;
create table t1 as select l2_distance([1,0.01,2],null) a,l2_distance([1,1.01,2],[1,11,2]) b,l2_distance([1,1,2],[1,1,211]) c,l2_distance([1,1,2],[1,2,1/0]) d,l2_distance([1,1,2],[1,1,211]) e,l2_distance([1,1,2],[1,1,211]) f from dual;
ERROR 42000: Null value
drop table if exists t1;
create table t1 as select l2_distance([true],[false]) a,l2_distance([true],[false]) b,l2_distance([true],[false]) c,l2_distance([true],[true+false]) d from dual;
select * from t1;
a	b	c	d
1	1	1	0
drop table if exists t1;
create table t1 as select l2_distance([9999999999],[9999999999999999]),l2_distance([-100],[+10000]) b,l2_distance(null,[false]) c,l2_distance([0.2],[8+8]) d  from dual;
select * from t1;
l2_distance([9999999999],[9999999999999999])	b	c	d
9.999990608887808e15	10100	NULL	15.800000190734863
drop table if exists t1;
create table t1 as select l2_distance('[?,?,?,?,?????????????]','[?,?,?,?,?]') from dual;
ERROR 22032: Invalid JSON text.
create table t1 as select l2_distance('101','101')a,l2_distance('101','101')b,l2_distance('101','101')c from dual;
ERROR HY000: Invalid argument
create table t1 as select l2_distance('-147777777777777777777777777777777777777777777777777777777777777777777777777777777777777777777777777777777777777777770','-147777777777777777777777777777777777777777777777777777777777777777777777777777777777777777777777777777777777777777770'),l2_distance('-147777777777777777777777777777777777777777777777777777777777777777777777777777777777777777777777777777777777777777770','-147777777777777777777777777777777777777777777777777777777777777777777777777777777777777777777777777777777777777777770') from dual;
ERROR 42000: Identifier name 'l2_distance('-147777777777777777777777777777777777777777777777777777777777777777777777777777777777777777777777777777777777777777770','-147777777777777777777777777777777777777777777777777777777777777777777777777777777777777777777777777777777777777777770')' is too long
create table t1 as select l2_distance('1','0x48656C6C6F20576F726C64')a,l2_distance('1','0x48656C6C6F20576F726C64')b,l2_distance('1','0x48656C6C6F20576F726C64')c from dual;
ERROR HY000: Invalid argument
drop table if exists t1;
create table t1 as select l2_distance([true],[false]) a,l2_distance([true],[false]) b,l2_distance([true],[false]) c,l2_distance([true],[true+false]) d from dual union select l2_distance([true],[false]) e,l2_distance([true],[false]) f,l2_distance([true],[false]) g,l2_distance([true],[true+false]) h from dual;
drop table if exists t1;
drop table if exists tt1;
drop table if exists tt2;
CREATE TABLE t1 (c1 int primary key, c2 vector(3),c3 vector(3) ,c4 vector(3),
VECTOR INDEX vector_idx(c3) 
WITH (distance=l2, lib=vsag, type=hnsw, m=10, ef_construction=100, ef_search=40));
insert into t1(c1,c2,c3,c4) values(1,'[1,1,2]','[2,2,3]','[1,3,2]');
insert into t1(c1,c2,c3,c4) values(2,'[1,0,3]','[1,0,3]','[2,3,2]');
insert into t1(c1,c2,c3,c4) values(3,'[-1,2,2]','[-3,2,3]','[4,3,3]');
insert into t1(c1,c2,c3,c4) values(4,'[-1,-2,-2]','[-4,2,3]',null);
insert into t1(c1,c2,c3,c4) values(5,'[-1,-3,-2]',null,'[2,3,1]');
create  table tt1  as select count(*) cnt, count(c3) cnt_c3, sum(c3) sum_c3 from t1 ;
create  table tt2  as select count(*) cnt, count(c3) cnt_c3, avg(c3) avg_c3 from t1 ;
select * from tt1 order by cnt;
cnt	cnt_c3	sum_c3
5	4	[-4,6,12]
select * from tt2 order by cnt;
cnt	cnt_c3	avg_c3
5	4	[-1,1.5,3]
drop table if exists t1;
CREATE TABLE t1 (c1 int primary key, c2 vector(3),c3 vector(3) ,c4 vector(3),
VECTOR INDEX vector_idx(c3) 
WITH (distance=l2, lib=vsag, type=hnsw, m=10, ef_construction=100, ef_search=40));
insert into t1(c1,c2,c3,c4) values(1,'[1,1,2]','[2,2,3]','[1,3,2]');
insert into t1(c1,c2,c3,c4) values(2,'[1,0,3]','[1,0,3]','[2,3,2]');
insert into t1(c1,c2,c3,c4) values(3,'[-1,2,2]','[-3,2,3]','[4,3,3]');
insert into t1(c1,c2,c3,c4) values(4,'[-1,-2,-2]','[-4,2,3]',null);
insert into t1(c1,c2,c3,c4) values(5,'[-1,-3,-2]',null,'[2,3,1]');
drop table if exists t2;
CREATE TABLE t2 (a1 int primary key , a2 vector(3),a3 vector(3) ,a4 vector(3),
VECTOR INDEX vector_idx(a3) 
WITH (distance=l2, lib=vsag, type=hnsw, m=10, ef_construction=100, ef_search=40));
show index from t2;
Table	Non_unique	Key_name	Seq_in_index	Column_name	Collation	Cardinality	Sub_part	Packed	Null	Index_type	Comment	Index_comment	Visible	Expression
t2	0	PRIMARY	1	a1	A	NULL	NULL	NULL		BTREE	available		YES	NULL
t2	1	vector_idx	1	a3	A	NULL	NULL	NULL	YES	VECTOR	available		YES	NULL
show index from t1;
Table	Non_unique	Key_name	Seq_in_index	Column_name	Collation	Cardinality	Sub_part	Packed	Null	Index_type	Comment	Index_comment	Visible	Expression
t1	0	PRIMARY	1	c1	A	NULL	NULL	NULL		BTREE	available		YES	NULL
t1	1	vector_idx	1	c3	A	NULL	NULL	NULL	YES	VECTOR	available		YES	NULL
insert into t2 select c1,c2,c3,c4 from t1 where c3 is not null and c4 is not null;
drop table if exists tt0;
drop table if exists tt1;
drop table if exists tt2;
create table tt0 as select c2+c3 from t1 ;
create table tt1 as select l2_distance(c2,a3) a,l2_distance(c4,a2) b,c1,a1,a3,c2 from t1 join t2 on c1=a1 ;
create table tt2 as select c2+c3+c4,a2+c3+c2 from t1 join t2 on c1=a1 ;
select l2_distance(c2,a3) from tt1 ;
l2_distance(c2,a3)
1.7320508075688772
0
2.23606797749979
select count(*) from t1,t2,tt1;
count(*)
45
drop view if exists v1;
drop table if exists t1;
drop materialized view if exists mv1;
CREATE TABLE t1 (c1 int primary key, c2 vector(3),c3 vector(3) ,c4 vector(3),
VECTOR INDEX vector_idx(c3) 
WITH (distance=l2, lib=vsag, type=hnsw, m=10, ef_construction=100, ef_search=40));
insert into t1(c1,c2,c3,c4) values(1,'[1,1,2]','[2,2,3]','[1,3,2]');
insert into t1(c1,c2,c3,c4) values(2,'[1,0,3]','[1,0,3]','[2,3,2]');
insert into t1(c1,c2,c3,c4) values(3,'[-1,2,2]','[-3,2,3]','[4,3,3]');
insert into t1(c1,c2,c3,c4) values(4,'[-1,-2,-2]','[-4,2,3]',null);
insert into t1(c1,c2,c3,c4) values(5,'[-1,-3,-2]',null,'[2,3,1]');
create materialized view mv1  parallel 2 refresh complete on demand  as select * from t1 ;
CREATE VECTOR INDEX vector_idx  ON mv1 (c2)  WITH (distance=l2, lib=vsag, type=hnsw, m=10, ef_construction=10, ef_search=40);
ERROR 0A000: the vector index params ef_construction less than or equal to m value is not supported
drop view if exists v1;
drop table if exists t1;
drop materialized view mv1;
CREATE TABLE t1 (c1 int primary key, c2 vector(3),c3 vector(3) ,c4 vector(3),
VECTOR INDEX vector_idx(c3) 
WITH (distance=l2, lib=vsag, type=hnsw, m=10, ef_construction=100, ef_search=40));
insert into t1(c1,c2,c3,c4) values(1,'[1,1,2]','[2,2,3]','[1,3,2]');
insert into t1(c1,c2,c3,c4) values(2,'[1,0,3]','[1,0,3]','[2,3,2]');
insert into t1(c1,c2,c3,c4) values(3,'[-1,2,2]','[-3,2,3]','[4,3,3]');
insert into t1(c1,c2,c3,c4) values(4,'[-1,-2,-2]','[-4,2,3]',null);
insert into t1(c1,c2,c3,c4) values(5,'[-1,-3,-2]',null,'[2,3,1]');
create  view v1 as select * from t1 ;
select l2_distance(c3,c2) from v1  group by l2_distance(c3,[1,2,3]) order by l2_distance(c3, [1,2,3]) APPROX limit 10;
l2_distance(c3,c2)
NULL
1.7320508075688772
0
2.23606797749979
7.0710678118654755
select l2_distance(c3,c2) from v1  group by l2_distance(c3,[1,2,3]) order by l2_distance(c3, [1,2,3]) APPROX limit 100000000;
l2_distance(c3,c2)
NULL
1.7320508075688772
0
2.23606797749979
7.0710678118654755
select  c4+c3+c2 from v1 order by l2_distance(c3, [1,2,3])  limit 100000000;
c4+c3+c2
NULL
[4,6,7]
[4,3,8]
[0,7,8]
NULL
select  c4+c3+c2 from v1 order by l2_distance(c3, [1,2,3])  limit 10;
c4+c3+c2
NULL
[4,6,7]
[4,3,8]
[0,7,8]
NULL
drop table if exists t1;
drop view if exists v1;
drop table if exists t2;
drop materialized view if exists mv1;
CREATE TABLE t1 (c1 int primary key, c2 varchar(30),c3 vector(3) ,c4 vector(3),
VECTOR INDEX vector_idx(c3) 
WITH (distance=l2, lib=vsag, type=hnsw, m=10, ef_construction=100, ef_search=40))PARTITION BY KEY(c1) PARTITIONS 4;
insert into t1(c1,c2,c3,c4) values(1,'[1,1,2]','[2,2,3]','[1,3,2]');
insert into t1(c1,c2,c3,c4) values(2,'[1,0,3]','[1,0,3]','[2,3,2]');
insert into t1(c1,c2,c3,c4) values(3,'[-1,2,2]','[-3,2,3]','[4,3,3]');
CREATE TABLE t2 (a1 int , a2 vector(3),a3 vector(3) ,a4 vector(3),
VECTOR INDEX vector_idx(a3) 
WITH (distance=l2, lib=vsag, type=hnsw, m=10, ef_construction=100, ef_search=40));
insert into t2 select c1,c2,c3,c4 from t1;
select * from t1,t2 where c3=a3 order by l2_distance(c3, [1,2,3]) APPROX limit 10;
c1	c2	c3	c4	a1	a2	a3	a4
1	[1,1,2]	[2,2,3]	[1,3,2]	1	[1,1,2]	[2,2,3]	[1,3,2]
2	[1,0,3]	[1,0,3]	[2,3,2]	2	[1,0,3]	[1,0,3]	[2,3,2]
3	[-1,2,2]	[-3,2,3]	[4,3,3]	3	[-1,2,2]	[-3,2,3]	[4,3,3]
create materialized view mv1   refresh complete on demand  as select * from t1,t2 where c2=a2 order by l2_distance(c3, [1,2,3]) APPROX limit 10;
drop table if exists t1;
drop table if exists tt1;
drop view if exists v1;
drop materialized view if exists mv1;
CREATE TABLE t1 (c1 int primary key, c2 varchar(30),c3 vector(3) ,c4 vector(3),
VECTOR INDEX vector_idx(c3) 
WITH (distance=l2, lib=vsag, type=hnsw, m=10, ef_construction=100, ef_search=40));
insert into t1(c1,c2,c3,c4) values(1,'[1,1,2]','[2,2,3]','[1,3,2]');
insert into t1(c1,c2,c3,c4) values(2,'[1,0,3]','[1,0,3]','[2,3,2]');
insert into t1(c1,c2,c3,c4) values(3,'[-1,2,2]','[-3,2,3]','[4,3,3]');
insert into t1(c1,c2,c3,c4) values(4,'[-1,-2,-2]','[-4,2,3]',null);
insert into t1(c1,c2,c3,c4) values(5,'[-1,-3,-2]',null,'[2,3,1]');
select * from t1 order by l2_distance(c3, [1,2,3]) APPROX limit 10;
c1	c2	c3	c4
1	[1,1,2]	[2,2,3]	[1,3,2]
2	[1,0,3]	[1,0,3]	[2,3,2]
3	[-1,2,2]	[-3,2,3]	[4,3,3]
4	[-1,-2,-2]	[-4,2,3]	NULL
create view v1 as select * from t1 order by l2_distance(c3, [1,2,3]) APPROX limit 10;
show create table v1;
View	Create View	character_set_client	collation_connection
v1	CREATE VIEW `v1` AS select `obljh`.`t1`.`c1` AS `c1`,`obljh`.`t1`.`c2` AS `c2`,`obljh`.`t1`.`c3` AS `c3`,`obljh`.`t1`.`c4` AS `c4` from `obljh`.`t1` order by l2_distance(`obljh`.`t1`.`c3`,array(1,2,3)) approx  limit 10	utf8mb4	utf8mb4_general_ci
create table tt1 as select * from t1 order by l2_distance(c3, [1,2,3]) APPROX limit 10;
select * from tt1 order by l2_distance(c3, [1,2,3]) APPROX limit 10;
c1	c2	c3	c4
1	[1,1,2]	[2,2,3]	[1,3,2]
2	[1,0,3]	[1,0,3]	[2,3,2]
3	[-1,2,2]	[-3,2,3]	[4,3,3]
4	[-1,-2,-2]	[-4,2,3]	NULL
select * from tt1 order by l2_distance(c3, [1,2,3]) APPROX limit 0;
c1	c2	c3	c4
create materialized view mv1   refresh complete on demand  as select * from t1 order by l2_distance(c3, [1,2,3]) APPROX limit 1000;
select * from mv1 order by l2_distance(c3, [1,2,3]) APPROX limit 10;
c1	c2	c3	c4
1	[1,1,2]	[2,2,3]	[1,3,2]
2	[1,0,3]	[1,0,3]	[2,3,2]
3	[-1,2,2]	[-3,2,3]	[4,3,3]
4	[-1,-2,-2]	[-4,2,3]	NULL
select * from mv1 order by l2_distance(c3, [1,2,3]) APPROX limit 0;
c1	c2	c3	c4
drop view if exists v1;
drop table if exists t1;
drop table if exists t2;
drop materialized view if exists mv1;
CREATE TABLE t1 (c1 int primary key, c2 vector(3),c3 vector(3) ,c4 vector(3),
VECTOR INDEX vector_idx(c3) 
WITH (distance=l2, lib=vsag, type=hnsw, m=10, ef_construction=100, ef_search=40));
create materialized view mv1  parallel 2 refresh complete on demand  as select * from t1 ;
insert into t1(c1,c2,c3,c4) values(1,'[1,1,2]','[2,2,3]','[1,3,2]');
insert into t1(c1,c2,c3,c4) values(2,'[1,0,3]','[1,0,3]','[2,3,2]');
insert into t1(c1,c2,c3,c4) values(3,'[-1,2,2]','[-3,2,3]','[4,3,3]');
insert into t1(c1,c2,c3,c4) values(4,'[-1,-2,-2]','[-4,2,3]',null);
insert into t1(c1,c2,c3,c4) values(5,'[-1,-3,-2]',null,'[2,3,1]');
CALL DBMS_MVIEW.REFRESH('mv1','c');
select * from mv1 order by c1;
c1	c2	c3	c4
1	[1,1,2]	[2,2,3]	[1,3,2]
2	[1,0,3]	[1,0,3]	[2,3,2]
3	[-1,2,2]	[-3,2,3]	[4,3,3]
4	[-1,-2,-2]	[-4,2,3]	NULL
5	[-1,-3,-2]	NULL	[2,3,1]
create  view v1 as select * from mv1 ;
select count(*) from v1,mv1;
count(*)
25
select count(*) from v1,t1,mv1;
count(*)
125
select count(*) from v1,t1;
count(*)
25
select count(*) from v1,mv1;
count(*)
25
select count(*) from v1,mv1 where v1.c1=mv1.c1;
count(*)
5
select c1,c2,sum(c3),avg(c4),l2_distance(c3,c2) from t1 a order by l2_distance(a.c3, [1,2,3]) APPROX limit 1;
c1	c2	sum(c3)	avg(c4)	l2_distance(c3,c2)
1	[1,1,2]	[-4,6,12]	[2.25,3,2]	1.7320508075688772
CREATE TABLE t2 (a1 int , a2 vector(3),a3 vector(3) ,a4 vector(3),
VECTOR INDEX vector_idx(a3) 
WITH (distance=l2, lib=vsag, type=hnsw, m=10, ef_construction=100, ef_search=40));
insert into t2 select c1,c2,c3,c4 from t1;
select c1,c2,c3,c4,l2_distance(a3,c2) from t1 a inner join t2 b on l2_distance(c2,c3)=l2_distance(a3,a4)  order by l2_distance(a3,c2);
c1	c2	c3	c4	l2_distance(a3,c2)
1	[1,1,2]	[2,2,3]	[1,3,2]	1.7320508075688772
4	[-1,-2,-2]	[-4,2,3]	NULL	6.708203932499369
select c1,c2,c3,c4,l2_distance(a3,c2) from t1 a right join t2 b on l2_distance(c2,c3)=l2_distance(a3,a4)  order by l2_distance(a3,c2);
c1	c2	c3	c4	l2_distance(a3,c2)
NULL	NULL	NULL	NULL	NULL
NULL	NULL	NULL	NULL	NULL
NULL	NULL	NULL	NULL	NULL
1	[1,1,2]	[2,2,3]	[1,3,2]	1.7320508075688772
4	[-1,-2,-2]	[-4,2,3]	NULL	6.708203932499369
select c1,c2,c3,c4,l2_distance(a3,c2) from t1 a left join t2 b on l2_distance(c2,c3)=l2_distance(a3,a4)  order by l2_distance(a3,c2);
c1	c2	c3	c4	l2_distance(a3,c2)
2	[1,0,3]	[1,0,3]	[2,3,2]	NULL
3	[-1,2,2]	[-3,2,3]	[4,3,3]	NULL
5	[-1,-3,-2]	NULL	[2,3,1]	NULL
1	[1,1,2]	[2,2,3]	[1,3,2]	1.7320508075688772
4	[-1,-2,-2]	[-4,2,3]	NULL	6.708203932499369
select c1,c2,c3,c4,l2_distance(a3,c2) from t1 a cross  join t2 b on l2_distance(c2,c3)=l2_distance(a3,a4)  order by l2_distance(a3,c2);
c1	c2	c3	c4	l2_distance(a3,c2)
1	[1,1,2]	[2,2,3]	[1,3,2]	1.7320508075688772
4	[-1,-2,-2]	[-4,2,3]	NULL	6.708203932499369
select c1,c2,c3,c4,l2_distance(a3,c2) from t1 a join t2 b on l2_distance(a4,c3)=l2_distance(a3,c2)  order by l2_distance(a3,c2);
c1	c2	c3	c4	l2_distance(a3,c2)
1	[1,1,2]	[2,2,3]	[1,3,2]	1.4142135623730951
1	[1,1,2]	[2,2,3]	[1,3,2]	1.7320508075688772
select c1,c2,c3,c4,l2_distance(a3,c2) from t1 a inner join t2 b on l2_distance(a4,c3)=l2_distance(a3,c2)  order by l2_distance(a3,c2);
c1	c2	c3	c4	l2_distance(a3,c2)
1	[1,1,2]	[2,2,3]	[1,3,2]	1.4142135623730951
1	[1,1,2]	[2,2,3]	[1,3,2]	1.7320508075688772
select c1,c2,c3,c4,l2_distance(a3,c2) from t1 a right join t2 b on l2_distance(a4,c3)=l2_distance(a3,c2)  order by l2_distance(a3,c2);
c1	c2	c3	c4	l2_distance(a3,c2)
NULL	NULL	NULL	NULL	NULL
NULL	NULL	NULL	NULL	NULL
NULL	NULL	NULL	NULL	NULL
1	[1,1,2]	[2,2,3]	[1,3,2]	1.4142135623730951
1	[1,1,2]	[2,2,3]	[1,3,2]	1.7320508075688772
select c1,c2,c3,c4,l2_distance(a3,c2) from t1 a left join t2 b on l2_distance(a4,c3)=l2_distance(a3,c2)  order by l2_distance(a3,c2);
c1	c2	c3	c4	l2_distance(a3,c2)
2	[1,0,3]	[1,0,3]	[2,3,2]	NULL
3	[-1,2,2]	[-3,2,3]	[4,3,3]	NULL
4	[-1,-2,-2]	[-4,2,3]	NULL	NULL
5	[-1,-3,-2]	NULL	[2,3,1]	NULL
1	[1,1,2]	[2,2,3]	[1,3,2]	1.4142135623730951
1	[1,1,2]	[2,2,3]	[1,3,2]	1.7320508075688772
select c1,c2,c3,c4,l2_distance(a3,c2) from t1 a cross  join t2 b on l2_distance(a4,c3)=l2_distance(a3,c2)  order by l2_distance(a3,c2);
c1	c2	c3	c4	l2_distance(a3,c2)
1	[1,1,2]	[2,2,3]	[1,3,2]	1.4142135623730951
1	[1,1,2]	[2,2,3]	[1,3,2]	1.7320508075688772
drop table if exists t1;
drop view if exists v1;
drop view if exists v1;
drop view if exists v2;
drop materialized view if exists mv1;
drop materialized view if exists mv2;
CREATE TABLE t1 (c1 int primary key, c2 vector(3),c3 vector(3) ,c4 vector(3),
VECTOR INDEX vector_idx(c3) 
WITH (distance=l2, lib=vsag, type=hnsw, m=10, ef_construction=100, ef_search=40));
insert into t1(c1,c2,c3,c4) values(1,'[1,1,2]','[2,2,3]','[1,3,2]');
insert into t1(c1,c2,c3,c4) values(2,'[1,0,3]','[1,0,3]','[2,3,2]');
insert into t1(c1,c2,c3,c4) values(3,'[-1,2,2]','[-3,2,3]','[4,3,3]');
insert into t1(c1,c2,c3,c4) values(4,'[-1,-2,-2]','[-4,2,3]',null);
insert into t1(c1,c2,c3,c4) values(5,'[-1,-3,-2]',null,'[2,3,1]');
create materialized view mv1 refresh complete on demand  as select count(*) cnt, count(c3) cnt_c3, sum(c3) sum_c3 from t1 ;
create materialized view mv2 refresh complete on demand  as select * from t1 order by l2_distance(c3, [1,2,3]) APPROX limit 1000;
create  view v1  as select * from t1 ;
create  view v2  as select count(*) cnt, count(c3) cnt_c3, sum(c3) sum_c3 from t1 order by l2_distance(c3, [1,2,3]) APPROX limit 1000;
select * from mv1 order by cnt;
cnt	cnt_c3	sum_c3
5	4	[-4,6,12]
select * from v1  order by l2_distance(c3, [1,2,3]) APPROX limit 1000;
c1	c2	c3	c4
5	[-1,-3,-2]	NULL	[2,3,1]
1	[1,1,2]	[2,2,3]	[1,3,2]
2	[1,0,3]	[1,0,3]	[2,3,2]
3	[-1,2,2]	[-3,2,3]	[4,3,3]
4	[-1,-2,-2]	[-4,2,3]	NULL
select * from v2 order by cnt;
cnt	cnt_c3	sum_c3
5	4	[-4,6,12]
drop materialized view if exists mv1;
create materialized view mv1  parallel 2 refresh complete on demand  as select * from t1 ;
select * from v1,mv1 where v1.c2=mv1.c3;
c1	c2	c3	c4	c1	c2	c3	c4
2	[1,0,3]	[1,0,3]	[2,3,2]	2	[1,0,3]	[1,0,3]	[2,3,2]
drop table if exists t1;
drop table if exists tt1;
drop materialized view if exists mv1;
drop materialized view if exists mv2;
CREATE TABLE t1 (c1 int primary key, c2 vector(3),c3 vector(3) ,c4 vector(3),
VECTOR INDEX vector_idx(c3) 
WITH (distance=l2, lib=vsag, type=hnsw, m=10, ef_construction=100, ef_search=40));
insert into t1(c1,c2,c3,c4) values(1,'[1,1,2]','[2,2,3]','[1,3,2]');
insert into t1(c1,c2,c3,c4) values(2,'[1,0,3]','[1,0,3]','[2,3,2]');
insert into t1(c1,c2,c3,c4) values(3,'[-1,2,2]','[-3,2,3]','[4,3,3]');
insert into t1(c1,c2,c3,c4) values(4,'[-1,-2,-2]','[-4,2,3]',null);
insert into t1(c1,c2,c3,c4) values(5,'[-1,-3,-2]',null,'[2,3,1]');
create materialized view mv1  parallel 2 refresh complete on demand  as select c1,c2 a2 from t1 order by c1;
create materialized view mv2  parallel 2 refresh complete on demand  as select c1,c2 c2 from t1 order by c1 limit 1;
CALL DBMS_MVIEW.REFRESH('mv1','c');
CALL DBMS_MVIEW.REFRESH('mv2','c');
create table tt1 select l2_distance(c2,a2) a from mv1,mv2 order by mv2.c1;
select * from tt1 order by a;
a
0
1.4142135623730951
2.23606797749979
5.385164807134504
6
drop table if exists t1;
drop materialized view if exists mv1;
CREATE TABLE t1 (c1 int primary key, c2 vector(3),c3 vector(3) ,c4 vector(3),
VECTOR INDEX vector_idx(c3) 
WITH (distance=l2, lib=vsag, type=hnsw, m=10, ef_construction=100, ef_search=40));
insert into t1(c1,c2,c3,c4) values(1,'[1,1,2]','[2,2,3]','[1,3,2]');
insert into t1(c1,c2,c3,c4) values(2,'[1,0,3]','[1,0,3]','[2,3,2]');
insert into t1(c1,c2,c3,c4) values(3,'[-1,2,2]','[-3,2,3]','[4,3,3]');
insert into t1(c1,c2,c3,c4) values(4,'[-1,-2,-2]','[-4,2,3]',null);
insert into t1(c1,c2,c3,c4) values(5,'[-1,-3,-2]',null,'[2,3,1]');
create materialized view mv1(primary key(c2))  refresh complete on demand  as select c1,c2 from t1 ;
ERROR 42000: The used storage engine can't index column 'c2'
create materialized view mv1(primary key(c1))  refresh complete on demand  as select c1,c2 from t1 ;
desc mv1;
Field	Type	Null	Key	Default	Extra
c1	int(11)	NO	PRI	NULL	
c2	VECTOR(3)	YES		NULL	
alter table mv1 drop primary key;
ERROR 0A000: alter materialized view is not supported
create materialized view mv2(primary key(c1,c2))  refresh complete on demand  as select c1,c2,c3 from t1 ;
ERROR 42000: The used storage engine can't index column 'c2'
create materialized view mv2(primary key(a))  refresh complete on demand  as select c1,c2,c3,c4 a from t1 ;
ERROR 42000: The used storage engine can't index column 'a'
drop table if exists t1;
drop view if exists v1;
drop materialized view if exists mv1;
CREATE TABLE t1 (c1 int primary key, c2 vector(3),c3 vector(3) ,c4 vector(3),
VECTOR INDEX vector_idx(c3) 
WITH (distance=l2, lib=vsag, type=hnsw, m=10, ef_construction=100, ef_search=40));
create materialized view mv1  refresh complete on demand  as select c1,c2,c3,c4 from t1 ;
create  view v1 as select c1,c2,c3,c4 from mv1 order by l2_distance(c3, [1,2,3]) approximate limit 10;
insert into t1(c1,c2,c3,c4) values(1,'[1,1,2]','[2,2,3]','[1,3,2]');
insert into t1(c1,c2,c3,c4) values(2,'[1,0,3]','[1,0,3]','[2,3,2]');
insert into t1(c1,c2,c3,c4) values(3,'[-1,2,2]','[-3,2,3]','[4,3,3]');
insert into t1(c1,c2,c3,c4) values(4,'[-1,-2,-2]','[-4,2,3]',null);
insert into t1(c1,c2,c3,c4) values(5,'[-1,-3,-2]',null,'[2,3,1]');
CALL DBMS_MVIEW.REFRESH('mv1','c');
select * from mv1 order by l2_distance(c3, [1,2,3])  limit 1;
c1	c2	c3	c4
5	[-1,-3,-2]	NULL	[2,3,1]
select * from mv1 order by l2_distance(c3, [1,2,3])  limit 1,1;
c1	c2	c3	c4
1	[1,1,2]	[2,2,3]	[1,3,2]
select * from v1 order by l2_distance(c3, [1,2,3]) approximate limit 1;
c1	c2	c3	c4
5	[-1,-3,-2]	NULL	[2,3,1]
select * from v1 order by l2_distance(c3, [1,2,3]) approximate limit 1,1;
c1	c2	c3	c4
1	[1,1,2]	[2,2,3]	[1,3,2]
select * from v1 order by l2_distance(c3, [1,2,3])  limit 1;
c1	c2	c3	c4
5	[-1,-3,-2]	NULL	[2,3,1]
select * from v1 order by l2_distance(c3, [1,2,3])  limit 1,1;
c1	c2	c3	c4
1	[1,1,2]	[2,2,3]	[1,3,2]
select * from t1 order by l2_distance(c3, [1,2,3]) approximate limit 1;
c1	c2	c3	c4
1	[1,1,2]	[2,2,3]	[1,3,2]
select * from t1 order by l2_distance(c3, [1,2,3]) approximate limit 1,1;
c1	c2	c3	c4
2	[1,0,3]	[1,0,3]	[2,3,2]
select * from t1 order by l2_distance(c3, [1,2,3])  limit 1;
c1	c2	c3	c4
5	[-1,-3,-2]	NULL	[2,3,1]
drop table if exists t1;
drop view if exists v1;
drop materialized view if exists mv1;
CREATE TABLE t1 (c1 int primary key, c2 vector(3),c3 vector(3) ,c4 vector(3),
VECTOR INDEX vector_idx(c3) 
WITH (distance=l2, lib=vsag, type=hnsw, m=10, ef_construction=100, ef_search=40));
insert into t1(c1,c2,c3,c4) values(1,'[1,1,2]','[2,2,3]','[1,3,2]');
insert into t1(c1,c2,c3,c4) values(2,'[1,0,3]','[1,0,3]','[2,3,2]');
insert into t1(c1,c2,c3,c4) values(3,'[-1,2,2]','[-3,2,3]','[4,3,3]');
insert into t1(c1,c2,c3,c4) values(4,'[-1,-2,-2]','[-4,2,3]',null);
insert into t1(c1,c2,c3,c4) values(5,'[-1,-3,-2]',null,'[2,3,1]');
select * from t1 order by l2_distance(c3, [1,2,3]);
c1	c2	c3	c4
5	[-1,-3,-2]	NULL	[2,3,1]
1	[1,1,2]	[2,2,3]	[1,3,2]
2	[1,0,3]	[1,0,3]	[2,3,2]
3	[-1,2,2]	[-3,2,3]	[4,3,3]
4	[-1,-2,-2]	[-4,2,3]	NULL
select * from t1 order by l2_distance(c3, [1,2,3])  limit 1,1;
c1	c2	c3	c4
1	[1,1,2]	[2,2,3]	[1,3,2]
select * from t1 order by l2_distance(c3, [1,2,3]) approximate limit 1,1;
c1	c2	c3	c4
2	[1,0,3]	[1,0,3]	[2,3,2]
select * from t1 order by l2_distance(c3, [1,2,3]) approximate limit 10;
c1	c2	c3	c4
1	[1,1,2]	[2,2,3]	[1,3,2]
2	[1,0,3]	[1,0,3]	[2,3,2]
3	[-1,2,2]	[-3,2,3]	[4,3,3]
4	[-1,-2,-2]	[-4,2,3]	NULL
select * from t1 order by l2_distance(c3, [1,2,3]) approximate limit 1;
c1	c2	c3	c4
1	[1,1,2]	[2,2,3]	[1,3,2]
select * from t1 order by l2_distance(c3, [1,2,3]) approximate limit 10;
c1	c2	c3	c4
1	[1,1,2]	[2,2,3]	[1,3,2]
2	[1,0,3]	[1,0,3]	[2,3,2]
3	[-1,2,2]	[-3,2,3]	[4,3,3]
4	[-1,-2,-2]	[-4,2,3]	NULL
select * from t1 order by l2_distance(c3, [1,2,3]) approximate limit 1;
c1	c2	c3	c4
1	[1,1,2]	[2,2,3]	[1,3,2]
drop table if exists t1;
create table t1(c1 int primary key, c2 vector(3),c3 vector(3) , c4 vector(3),
VECTOR INDEX vector_idx(c4) 
WITH (distance=l2, lib=vsag, type=hnsw, m=10, ef_construction=100, ef_search=40)) partition by hash(c1) partitions 4;
replace into t1(c1, c2, c3) values(1,'[1,1,2]','[2,2,3]');
replace into t1(c1, c2, c3) values(2,'[1,-1,3]','[1,0,3]');
select * from t1 order by l2_distance(c4, [1,2,3]);
c1	c2	c3	c4
1	[1,1,2]	[2,2,3]	NULL
2	[1,-1,3]	[1,0,3]	NULL
select * from t1 order by l2_distance(c4, [1,2,3])  limit 1;
c1	c2	c3	c4
1	[1,1,2]	[2,2,3]	NULL
select * from t1 order by l2_distance(c4, [1,2,3])  limit 1,1;
c1	c2	c3	c4
2	[1,-1,3]	[1,0,3]	NULL
select * from t1 order by l2_distance(c4, [1,2,3]) approximate limit 1;
c1	c2	c3	c4
drop table if exists t1;
drop view if exists v1;
CREATE TABLE t1 (c1 int primary key, c2 vector(3),c3 vector(3) ,c4 vector(3),
VECTOR INDEX vector_idx(c3) 
WITH (distance=l2, lib=vsag, type=hnsw, m=10, ef_construction=100, ef_search=40));
insert into t1(c1,c2,c3,c4) values(1,'[1,1,2]','[2,2,3]','[1,3,2]');
insert into t1(c1,c2,c3,c4) values(2,'[1,0,3]','[1,0,3]','[2,3,2]');
insert into t1(c1,c2,c3,c4) values(3,'[-1,2,2]','[-3,2,3]','[4,3,3]');
insert into t1(c1,c2,c3,c4) values(4,'[-1,-2,-2]','[-4,2,3]',null);
select * from t1 order by l2_distance(c3, [1,2,3]);
c1	c2	c3	c4
1	[1,1,2]	[2,2,3]	[1,3,2]
2	[1,0,3]	[1,0,3]	[2,3,2]
3	[-1,2,2]	[-3,2,3]	[4,3,3]
4	[-1,-2,-2]	[-4,2,3]	NULL
select * from t1 order by l2_distance(c3, [1,2,3])  limit 1,1;
c1	c2	c3	c4
2	[1,0,3]	[1,0,3]	[2,3,2]
select * from t1 order by l2_distance(c3, [1,2,3]) approximate limit 1,1;
c1	c2	c3	c4
2	[1,0,3]	[1,0,3]	[2,3,2]
select * from t1 order by l2_distance(c3, [1,2,3]) approximate limit 10;
c1	c2	c3	c4
1	[1,1,2]	[2,2,3]	[1,3,2]
2	[1,0,3]	[1,0,3]	[2,3,2]
3	[-1,2,2]	[-3,2,3]	[4,3,3]
4	[-1,-2,-2]	[-4,2,3]	NULL
select * from t1 order by l2_distance(c3, [1,2,3]) approximate limit 1;
c1	c2	c3	c4
1	[1,1,2]	[2,2,3]	[1,3,2]
select * from t1 order by l2_distance(c3, [1,2,3]) approximate limit 10;
c1	c2	c3	c4
1	[1,1,2]	[2,2,3]	[1,3,2]
2	[1,0,3]	[1,0,3]	[2,3,2]
3	[-1,2,2]	[-3,2,3]	[4,3,3]
4	[-1,-2,-2]	[-4,2,3]	NULL
select * from t1 order by l2_distance(c3, [1,2,3]) approximate limit 1;
c1	c2	c3	c4
1	[1,1,2]	[2,2,3]	[1,3,2]
drop table if exists t1;
drop materialized view if exists mv1;
CREATE TABLE t1 (c1 int, c2 vector(3),c3 vector(3) ,c4 vector(3));
insert into t1 values(1,'[1,1,2]','[2,2,3]',null);
create materialized view mv1  refresh complete on demand  as select c1,c2,c3,c4 from t1 ;
insert /*+ direct(true,100,full) enable_parallel_dml parallel(100) */ into t1 select * from t1;
insert /*+ direct(true,100,full) enable_parallel_dml parallel(100) */ into t1 select * from t1;
insert /*+ direct(true,100,full) enable_parallel_dml parallel(100) */ into t1 select * from t1;
insert /*+ direct(true,100,full) enable_parallel_dml parallel(100) */ into t1 select * from t1;
create VECTOR index vector_idx1 on t1(c3) with (distance=l2, lib=vsag, type=hnsw, m=10, ef_construction=100, ef_search=40);
create VECTOR index vector_idx2 on t1(c4) with (distance=l2, lib=vsag, type=hnsw, m=10, ef_construction=100, ef_search=40);
show index from t1;
Table	Non_unique	Key_name	Seq_in_index	Column_name	Collation	Cardinality	Sub_part	Packed	Null	Index_type	Comment	Index_comment	Visible	Expression
t1	1	vector_idx1	1	c3	A	NULL	NULL	NULL	YES	VECTOR	available		YES	NULL
t1	1	vector_idx2	1	c4	A	NULL	NULL	NULL	YES	VECTOR	available		YES	NULL
select * from t1 order by l2_distance(c4, [1,2,3]) approximate limit 1,1;
c1	c2	c3	c4
truncate table t1;
drop table if exists t1;
drop table if exists tt1;
drop view if exists v1;
CREATE TABLE t1 (c1 INT PRIMARY KEY ,c2 vector(3),c3 vector(3), c4 vector(3),c5 vector(3) AS (c4*c3) STORED,
VECTOR INDEX vector_idx(c3) 
WITH (distance=l2, lib=vsag, type=hnsw, m=10, ef_construction=100, ef_search=40))PARTITION BY RANGE (c1)
SUBPARTITION BY HASH(c1)
SUBPARTITIONS 100 (
PARTITION p1 VALUES LESS THAN (30) (
SUBPARTITION s1,
SUBPARTITION s2
),
PARTITION p2 VALUES LESS THAN (40) (
SUBPARTITION s3,
SUBPARTITION s4
),
PARTITION p3 VALUES LESS THAN MAXVALUE (
SUBPARTITION s5,
SUBPARTITION s6
)
);
insert into t1(c1,c2,c3,c4) values(10,'[1,1,2]','[2,2,3]','[1,3,2]');
insert into t1(c1,c2,c3,c4) values(20,'[1,0,3]','[1,0,3]','[2,3,2]');
insert into t1(c1,c2,c3,c4) values(30,'[-1,2,2]','[-3,2,3]','[4,3,3]');
insert into t1(c1,c2,c3,c4) values(40,'[-1,-2,-2]','[-4,2,3]',null);
insert into t1(c1,c2,c3,c4) values(50,'[-1,-3,-2]',null,'[2,3,1]');
ALTER TABLE t1 MODIFY c1 INT AUTO_INCREMENT;
ALTER TABLE t1 MODIFY c3 vector(3) AUTO_INCREMENT;
ERROR 42000: Incorrect column specifier for column 'c3'
insert /*+ direct(true,100,full) enable_parallel_dml parallel(100) */ into t1(c2,c3,c4) select c2,c3,c4 from t1;
insert /*+ direct(true,100,full) enable_parallel_dml parallel(100) */ into t1(c2,c3,c4) select c2,c3,c4 from t1;
insert /*+ direct(true,100,full) enable_parallel_dml parallel(100) */ into t1(c2,c3,c4) select c2,c3,c4 from t1;
insert /*+ direct(true,100,full) enable_parallel_dml parallel(100) */ into t1(c2,c3,c4) select c2,c3,c4 from t1;
insert /*+ direct(true,100,full) enable_parallel_dml parallel(100) */ into t1(c2,c3,c4) select c2,c3,c4 from t1;
create index idx1 on t1 ((c2+c3));
ERROR HY000: Functional index on a column is not supported. Consider using a regular index instead.
create index idx2 on t1 (c1);
create index idx3 on t1 ((l2_distance(c3, [1,c1,3])));
ERROR HY000: Functional index 'idx3' cannot refer to an auto-increment column.
create index idx5 on t1 ((l2_distance(c3, [1,1,3])));
CREATE VECTOR INDEX vector_idx_c5  ON t1 (c5)  WITH (distance=l2, lib=vsag, type=hnsw, m=10, ef_construction=100, ef_search=40);
ERROR 0A000: Using generate column as vector index column is not supported
CREATE VECTOR INDEX vector_idx_c4  ON t1 (c4)  WITH (distance=l2, lib=vsag, type=hnsw, m=10, ef_construction=100, ef_search=40);
create table tt1 like t1;
replace into tt1(c1,c2,c3,c4) values(10,'[1,1,2]','[2,2,3]','[1,3,2]');
replace into tt1(c1,c2,c3,c4) values(20,'[1,0,3]','[1,0,3]','[2,3,2]');
replace into tt1(c1,c2,c3,c4) values(30,'[-1,2,2]','[-3,2,3]','[4,3,3]');
replace into tt1(c1,c2,c3,c4) values(40,'[-1,-2,-2]','[-4,2,3]',null);
replace into tt1(c1,c2,c3,c4) values(50,'[-1,-3,-2]',null,'[2,3,1]');
select count(*) from tt1,t1;
count(*)
800
select count(*) from tt1,t1 where tt1.c5=t1.c5 order by l2_distance(t1.c5, [1,2,3]) approximate limit 10;
count(*)
96
select count(*) from tt1,t1 where tt1.c1=t1.c1 order by l2_distance(t1.c5, [1,2,3])  limit 10;
count(*)
5
select count(*) from t1 PARTITION(p3) order by l2_distance(c5, [1,2,3]) approximate limit 10;
count(*)
157
drop table if exists t1;
CREATE TABLE t1 (c1 int , c2 VARCHAR(30),c3 vector(3) ,c4 vector(3),
VECTOR INDEX vector_idx(c3) 
WITH (distance=l2, lib=vsag, type=hnsw, m=10, ef_construction=100, ef_search=40));
insert into t1(c1,c2,c3,c4) values(1,'[1,1,2]','[2,2,3]','[1,3,2]');
insert into t1(c1,c2,c3,c4) values(2,'[1,0,3]','[1,0,3]','[2,3,2]');
insert into t1(c1,c2,c3,c4) values(3,'[-1,2,2]','[-3,2,3]','[4,3,3]');
insert into t1(c1,c2,c3,c4) values(4,'[-1,-2,-2]','[-4,2,3]',null);
insert into t1(c1,c2,c3,c4) values(5,'[-1,-3,-2]',null,'[2,3,1]');
insert /*+ enable_parallel_dml parallel(2) */ into t1 select c1,c2,c3,c4 from t1;
CREATE VECTOR INDEX vector_idx_c5  ON t1 (c4)  WITH (distance=l2, lib=vsag, type=hnsw, m=10, ef_construction=100, ef_search=40);
call dbms_vector.rebuild_index('vector_idx','t1');
call dbms_vector.rebuild_index('vector_idx','tt1');
drop table if exists t1;
CREATE TABLE t1 (c1 INT PRIMARY KEY,c2 vector(3),c3 vector(3), c4 vector(3),c5 vector(3) AS (c4*c3) STORED);
CREATE VECTOR INDEX vector_idx_c5  ON t1 (c5)  WITH (distance=l2, lib=vsag, type=hnsw, m=10, ef_construction=100, ef_search=40);
ERROR 0A000: Using generate column as vector index column is not supported
drop table if exists t1;
CREATE TABLE t1 (c1 INT PRIMARY KEY,c2 vector(3),c3 vector(3), c4 vector(3),c5 vector(2000) AS ([c3*c4]) STORED,
VECTOR INDEX vector_idx(c4) 
WITH (distance=l2, lib=vsag, type=hnsw, m=10, ef_construction=100, ef_search=40));
call dbms_vector.rebuild_index('vector_idx','t1');
drop table if exists t1;
drop materialized view if exists mv1;
CREATE TABLE t1 (c1 int primary key, c2 vector(3),c3 vector(3) ,c4 vector(3),
VECTOR INDEX vector_idx(c3) 
WITH (distance=l2, lib=vsag, type=hnsw, m=10, ef_construction=100, ef_search=40));
insert into t1(c1,c2,c3,c4) values(1,'[1,1,2]','[2,2,3]','[1,3,2]');
insert into t1(c1,c2,c3,c4) values(2,'[1,0,3]','[1,0,3]','[2,3,2]');
insert into t1(c1,c2,c3,c4) values(3,'[-1,2,2]','[-3,2,3]','[4,3,3]');
insert into t1(c1,c2,c3,c4) values(4,'[-1,-2,-2]','[-4,2,3]',null);
insert into t1(c1,c2,c3,c4) values(5,'[-1,-3,-2]',null,'[2,3,1]');
select l2_distance(c4,c3),c1,* from t1 order by l2_distance(c3, [1,2,3]) approximate limit 10;
l2_distance(c4,c3)	c1	c1	c2	c3	c4
1.7320508075688772	1	1	[1,1,2]	[2,2,3]	[1,3,2]
3.3166247903554	2	2	[1,0,3]	[1,0,3]	[2,3,2]
7.0710678118654755	3	3	[-1,2,2]	[-3,2,3]	[4,3,3]
NULL	4	4	[-1,-2,-2]	[-4,2,3]	NULL
drop index vector_idx on t1;
select l2_distance(c4,c3),c1,* from t1 order by l2_distance(c3, [1,2,3]) approximate limit 10;
l2_distance(c4,c3)	c1	c1	c2	c3	c4
NULL	5	5	[-1,-3,-2]	NULL	[2,3,1]
1.7320508075688772	1	1	[1,1,2]	[2,2,3]	[1,3,2]
3.3166247903554	2	2	[1,0,3]	[1,0,3]	[2,3,2]
7.0710678118654755	3	3	[-1,2,2]	[-3,2,3]	[4,3,3]
NULL	4	4	[-1,-2,-2]	[-4,2,3]	NULL
create materialized view mv1  refresh complete on demand  as select c1,c2,c3,c4 from t1 ;
CREATE VECTOR INDEX vector_idx  ON mv1 (c2)  WITH (distance=l2, lib=vsag, type=hnsw, m=10, ef_construction=100, ef_search=40);
ERROR 0A000: create vector index on view table is not supported
select l2_distance(c4,c3),c1,* from mv1 order by l2_distance(c3, [1,2,3]) approximate limit 10;
l2_distance(c4,c3)	c1	c1	c2	c3	c4
NULL	5	5	[-1,-3,-2]	NULL	[2,3,1]
1.7320508075688772	1	1	[1,1,2]	[2,2,3]	[1,3,2]
3.3166247903554	2	2	[1,0,3]	[1,0,3]	[2,3,2]
7.0710678118654755	3	3	[-1,2,2]	[-3,2,3]	[4,3,3]
NULL	4	4	[-1,-2,-2]	[-4,2,3]	NULL
desc mv1;
Field	Type	Null	Key	Default	Extra
c1	int(11)	YES		NULL	
c2	VECTOR(3)	YES		NULL	
c3	VECTOR(3)	YES		NULL	
c4	VECTOR(3)	YES		NULL	
drop table if exists t1;
drop  view if exists v1;
CREATE TABLE t1 (c1 int primary key, c2 vector(3),c3 vector(3) ,c4 vector(3),
VECTOR INDEX vector_idx(c3) 
WITH (distance=l2, lib=vsag, type=hnsw, m=10, ef_construction=100, ef_search=40));
insert into t1(c1,c2,c3,c4) values(1,'[1,1,2]','[2,2,3]','[1,3,2]');
insert into t1(c1,c2,c3,c4) values(2,'[1,0,3]','[1,0,3]','[2,3,2]');
insert into t1(c1,c2,c3,c4) values(3,'[-1,2,2]','[-3,2,3]','[4,3,3]');
insert into t1(c1,c2,c3,c4) values(4,'[-1,-2,-2]','[-4,2,3]',null);
insert into t1(c1,c2,c3,c4) values(5,'[-1,-3,-2]',null,'[2,3,1]');
create view v1 as select * from t1;
CREATE VECTOR INDEX vector_idx  ON v1 (c2)  WITH (distance=l2, lib=vsag, type=hnsw, m=10, ef_construction=100, ef_search=40);
ERROR 0A000: create vector index on view table is not supported
select l2_distance(c4,c3),c1,* from v1 order by l2_distance(c3, [1,2,3]) approximate limit 10;
l2_distance(c4,c3)	c1	c1	c2	c3	c4
NULL	5	5	[-1,-3,-2]	NULL	[2,3,1]
1.7320508075688772	1	1	[1,1,2]	[2,2,3]	[1,3,2]
3.3166247903554	2	2	[1,0,3]	[1,0,3]	[2,3,2]
7.0710678118654755	3	3	[-1,2,2]	[-3,2,3]	[4,3,3]
NULL	4	4	[-1,-2,-2]	[-4,2,3]	NULL
select l2_distance(c4,c3),c1,* from v1 order by l2_distance(c3, avg(c3)) approximate limit 10;
ERROR 0A000: Using vector index without column ref or vector const expr is not supported
select l2_distance(c4,c3),c1,* from v1 order by l2_distance(c3, sum(c3)) approximate limit 10;
ERROR 0A000: Using vector index without column ref or vector const expr is not supported
desc mv1;
Field	Type	Null	Key	Default	Extra
c1	int(11)	YES		NULL	
c2	VECTOR(3)	YES		NULL	
c3	VECTOR(3)	YES		NULL	
c4	VECTOR(3)	YES		NULL	
DROP MATERIALIZED VIEW LOG ON  t1;
drop table if exists t1;
drop table if exists tt1;
drop materialized view if exists mv1;
drop view if exists v1;
CREATE TABLE t1 (c1 int primary key, c2 vector(3),c3 vector(3) ,c4 vector(3),
VECTOR INDEX vector_idx(c3) 
WITH (distance=l2, lib=vsag, type=hnsw, m=10, ef_construction=100, ef_search=40))PARTITION BY hash(c1) PARTITIONS 4;
create materialized view log on t1 parallel 100 with sequence(c2,c3,c4);
insert into t1(c1,c2,c3,c4) values(1,'[1,1,2]','[2,2,3]','[1,3,2]');
insert into t1(c1,c2,c3,c4) values(2,'[1,0,3]','[1,0,3]','[2,3,2]');
insert into t1(c1,c2,c3,c4) values(3,'[-1,2,2]','[-3,2,3]','[4,3,3]');
insert into t1(c1,c2,c3,c4) values(4,'[-1,-2,-2]','[-4,2,3]',null);
insert into t1(c1,c2,c3,c4) values(5,'[-1,-3,-2]',null,'[2,3,1]');
select * from t1,mlog$_t1 where t1.c3=mlog$_t1.c3 order by l2_distance(t1.c3, [1,2,3]) approximate limit 10;
c1	c2	c3	c4	c1	c2	c3	c4	SEQUENCE$$	DMLTYPE$$	OLD_NEW$$
1	[1,1,2]	[2,2,3]	[1,3,2]	1	[1,1,2]	[2,2,3]	[1,3,2]	1	I	N
2	[1,0,3]	[1,0,3]	[2,3,2]	2	[1,0,3]	[1,0,3]	[2,3,2]	1	I	N
3	[-1,2,2]	[-3,2,3]	[4,3,3]	3	[-1,2,2]	[-3,2,3]	[4,3,3]	1	I	N
4	[-1,-2,-2]	[-4,2,3]	NULL	4	[-1,-2,-2]	[-4,2,3]	NULL	1	I	N
select * from t1,mlog$_t1 where t1.c1=mlog$_t1.c1 order by l2_distance(t1.c3, [1,2,3]) approximate limit 10;
c1	c2	c3	c4	c1	c2	c3	c4	SEQUENCE$$	DMLTYPE$$	OLD_NEW$$
1	[1,1,2]	[2,2,3]	[1,3,2]	1	[1,1,2]	[2,2,3]	[1,3,2]	1	I	N
2	[1,0,3]	[1,0,3]	[2,3,2]	2	[1,0,3]	[1,0,3]	[2,3,2]	1	I	N
3	[-1,2,2]	[-3,2,3]	[4,3,3]	3	[-1,2,2]	[-3,2,3]	[4,3,3]	1	I	N
4	[-1,-2,-2]	[-4,2,3]	NULL	4	[-1,-2,-2]	[-4,2,3]	NULL	1	I	N
insert into t1 select c1+100,c2,c3,c4 from mlog$_t1;
delete from t1 where c1>100;
DROP MATERIALIZED VIEW LOG ON  t1;
truncate table t1;
DROP MATERIALIZED VIEW LOG ON  t1;
drop table if exists t1;
drop table if exists tt1;
drop materialized view if exists mv1;
drop view if exists v1;
CREATE TABLE t1 (c1 int primary key, c2 vector(3),c3 vector(3) ,c4 vector(3),
VECTOR INDEX vector_idx(c3) 
WITH (distance=l2, lib=vsag, type=hnsw, m=10, ef_construction=100, ef_search=40))PARTITION BY hash(c1) PARTITIONS 100;
insert into t1(c1,c2,c3,c4) values(1,'[1,1,2]','[2,2,3]','[1,3,2]');
insert into t1(c1,c2,c3,c4) values(2,'[1,0,3]','[1,0,3]','[2,3,2]');
insert into t1(c1,c2,c3,c4) values(3,'[-1,2,2]','[-3,2,3]','[4,3,3]');
insert into t1(c1,c2,c3,c4) values(4,'[-1,-2,-2]','[-4,2,3]',null);
insert into t1(c1,c2,c3,c4) values(5,'[-1,-3,-2]',null,'[2,3,1]');
create table tt1 like t1;
replace into tt1 select * from t1;
drop table if exists t1;
drop materialized view if exists mv1;
CREATE TABLE t1 (c1 int primary key, c2 vector(3),c3 vector(3) ,c4 vector(3),
VECTOR INDEX vector_idx(c3) 
WITH (distance=l2, lib=vsag, type=hnsw, m=10, ef_construction=100, ef_search=40));
insert into t1(c1,c2,c3,c4) values(1,'[1,1,2]','[2,2,3]','[1,3,2]');
insert into t1(c1,c2,c3,c4) values(2,'[1,0,3]','[1,0,3]','[2,3,2]');
insert into t1(c1,c2,c3,c4) values(3,'[-1,2,2]','[-3,2,3]','[4,3,3]');
insert into t1(c1,c2,c3,c4) values(4,'[-1,-2,-2]','[-4,2,3]',null);
insert into t1(c1,c2,c3,c4) values(5,'[-1,-3,-2]',null,'[2,3,1]');
create materialized view mv1 partition by hash(c1) partitions 10  refresh complete on demand  as select c1,c2,c3+c4 a from t1;
desc mv1;
Field	Type	Null	Key	Default	Extra
c1	int(11)	YES		NULL	
c2	VECTOR(3)	YES		NULL	
a	VECTOR(3)	YES		NULL	
select l2_distance(c2,a),c1,* from mv1 order by c1;
l2_distance(c2,a)	c1	c1	c2	a
5.385164807134504	1	1	[1,1,2]	[3,5,5]
4.123105625617661	2	2	[1,0,3]	[3,3,5]
5.385164807134504	3	3	[-1,2,2]	[1,5,6]
NULL	4	4	[-1,-2,-2]	NULL
NULL	5	5	[-1,-3,-2]	NULL
insert into t1 values(6,'[-1,-3,-2]',null,'[2,3,1]');
update t1 set c1=100 where c4 is null;
delete from t1 where c1 = 1;
CALL DBMS_MVIEW.REFRESH('mv1','c');
select * from mv1 order by c1;
c1	c2	a
2	[1,0,3]	[3,3,5]
3	[-1,2,2]	[1,5,6]
5	[-1,-3,-2]	NULL
6	[-1,-3,-2]	NULL
100	[-1,-2,-2]	NULL
DROP MATERIALIZED VIEW LOG ON  t1;
drop table if exists t1;
drop materialized view if exists mv1;
CREATE TABLE t1 (c1 int primary key, c2 vector(3),c3 vector(3) ,c4 vector(3),
VECTOR INDEX vector_idx(c3) 
WITH (distance=l2, lib=vsag, type=hnsw, m=10, ef_construction=100, ef_search=40));
insert into t1(c1,c2,c3,c4) values(1,'[1,1,2]','[2,2,3]','[1,3,2]');
insert into t1(c1,c2,c3,c4) values(2,'[1,0,3]','[1,0,3]','[2,3,2]');
insert into t1(c1,c2,c3,c4) values(3,'[-1,2,2]','[-3,2,3]','[4,3,3]');
insert into t1(c1,c2,c3,c4) values(4,'[-1,-2,-2]','[-4,2,3]',null);
insert into t1(c1,c2,c3,c4) values(5,'[-1,-3,-2]',null,'[2,3,1]');
create materialized view mv1  partition by list(c1) (PARTITION partition_1 VALUES in(1,2,3),PARTITION partition_2 VALUES in(4,5)) refresh complete on demand  as select c1,c2,c3,c4 from t1;
desc mv1;
Field	Type	Null	Key	Default	Extra
c1	int(11)	YES		NULL	
c2	VECTOR(3)	YES		NULL	
c3	VECTOR(3)	YES		NULL	
c4	VECTOR(3)	YES		NULL	
select l2_distance(c4,c3),c1,* from mv1 order by c1;
l2_distance(c4,c3)	c1	c1	c2	c3	c4
1.7320508075688772	1	1	[1,1,2]	[2,2,3]	[1,3,2]
3.3166247903554	2	2	[1,0,3]	[1,0,3]	[2,3,2]
7.0710678118654755	3	3	[-1,2,2]	[-3,2,3]	[4,3,3]
NULL	4	4	[-1,-2,-2]	[-4,2,3]	NULL
NULL	5	5	[-1,-3,-2]	NULL	[2,3,1]
insert into t1 values(6,'[-1,-3,-2]',null,'[2,3,1]');
update t1 set c1=100 where c4 is null;
delete from t1 where c1 = 100 or c1 =6;
CALL DBMS_MVIEW.REFRESH('mv1','c');
select * from mv1 order by c1;
c1	c2	c3	c4
1	[1,1,2]	[2,2,3]	[1,3,2]
2	[1,0,3]	[1,0,3]	[2,3,2]
3	[-1,2,2]	[-3,2,3]	[4,3,3]
5	[-1,-3,-2]	NULL	[2,3,1]
drop table if exists t1;
drop materialized view if exists mv1;
CREATE TABLE t1 (c1 int primary key, c2 vector(3),c3 vector(3) ,c4 vector(3),
VECTOR INDEX vector_idx(c3) 
WITH (distance=l2, lib=vsag, type=hnsw, m=10, ef_construction=100, ef_search=40));
insert into t1(c1,c2,c3,c4) values(1,'[1,1,2]','[2,2,3]','[1,3,2]');
insert into t1(c1,c2,c3,c4) values(2,'[1,0,3]','[1,0,3]','[2,3,2]');
insert into t1(c1,c2,c3,c4) values(3,'[-1,2,2]','[-3,2,3]','[4,3,3]');
insert into t1(c1,c2,c3,c4) values(4,'[-1,-2,-2]','[-4,2,3]',null);
insert into t1(c1,c2,c3,c4) values(5,'[-1,-3,-2]',null,'[2,3,1]');
create materialized view mv1 partition by range(c1) (PARTITION p1 VALUES LESS THAN (5), PARTITION p2 VALUES LESS THAN (10))  as select c1,c2,c3,c4 from t1;
desc mv1;
Field	Type	Null	Key	Default	Extra
c1	int(11)	YES		NULL	
c2	VECTOR(3)	YES		NULL	
c3	VECTOR(3)	YES		NULL	
c4	VECTOR(3)	YES		NULL	
insert into t1 values(6,'[-1,-3,-2]',null,'[2,3,1]');
insert into t1 values(8,'[-1,-3,-2]',null,'[2,3,1]');
update t1 set c1=100 where c4 is null;
delete from t1 where c1 = 100 or c1 =6;
CALL DBMS_MVIEW.REFRESH('mv1','c');
TRUNCATE TABLE mv1;
ERROR 0A000: truncate materialized view is not supported
##create view
drop table if exists t1;
drop view if exists v1;
drop table if exists t2;
drop view if exists v2;
CREATE TABLE t1 (c1 int primary key, c2 vector(3),c3 vector(3) ,c4 vector(3),
VECTOR INDEX vector_idx(c3) 
WITH (distance=l2, lib=vsag, type=hnsw, m=10, ef_construction=100, ef_search=40));
create view v1 as select * from t1;
drop table if exists t2;
Warnings:
Note	1051	Unknown table 'obljh.t2'
CREATE TABLE t2 (a1 int , a2 vector(3),a3 vector(3) ,a4 vector(3),
VECTOR INDEX vector_idx(a3) 
WITH (distance=l2, lib=vsag, type=hnsw, m=10, ef_construction=100, ef_search=40));
create view v2 as select * from t2;
insert into v1(c1,c2,c3,c4) values(1,'[1,1,2]','[2,2,3]','[1,3,2]');
insert into v1(c1,c2,c3,c4) values(2,'[1,0,3]','[1,0,3]','[2,3,2]');
insert into v1(c1,c2,c3,c4) values(3,'[-1,2,2]','[-3,2,3]','[4,3,3]');
insert into v1(c1,c2,c3,c4) values(4,'[-1,-2,-2]','[-4,2,3]',null);
insert into v1(c1,c2,c3,c4) values(5,'[-1,-3,-2]',null,'[2,3,1]');
insert into t2 select c1,c2,c3,c4 from t1;
select c1,c2,c3,c4,l2_distance(a3,c2) from v1 a join v2 b on c2=a2  order by l2_distance(c3, [1,2,3]) approximate limit 10;
c1	c2	c3	c4	l2_distance(a3,c2)
5	[-1,-3,-2]	NULL	[2,3,1]	NULL
1	[1,1,2]	[2,2,3]	[1,3,2]	1.7320508075688772
2	[1,0,3]	[1,0,3]	[2,3,2]	0
3	[-1,2,2]	[-3,2,3]	[4,3,3]	2.23606797749979
4	[-1,-2,-2]	[-4,2,3]	NULL	7.0710678118654755
select c1,c2,c3,c4,l2_distance(a3,c2) from v1 a join v2 b on l2_distance(c2,c3)=l2_distance(a3,a4)  order by l2_distance(c3, [1,2,3]) approximate limit 10;
c1	c2	c3	c4	l2_distance(a3,c2)
1	[1,1,2]	[2,2,3]	[1,3,2]	1.7320508075688772
4	[-1,-2,-2]	[-4,2,3]	NULL	6.708203932499369
select c1,c2,c3,c4,l2_distance(a3,c2) from v1 a inner join v2 b on l2_distance(c2,c3)=l2_distance(a3,a4)  order by l2_distance(c3, [1,2,3]) approximate limit 10;
c1	c2	c3	c4	l2_distance(a3,c2)
1	[1,1,2]	[2,2,3]	[1,3,2]	1.7320508075688772
4	[-1,-2,-2]	[-4,2,3]	NULL	6.708203932499369
select c1,c2,c3,c4,l2_distance(a3,c2) from v1 a right join t2 b on l2_distance(c2,c3)=l2_distance(a3,a4) order by l2_distance(c3, [1,2,3]) approximate limit 10;
c1	c2	c3	c4	l2_distance(a3,c2)
NULL	NULL	NULL	NULL	NULL
NULL	NULL	NULL	NULL	NULL
NULL	NULL	NULL	NULL	NULL
1	[1,1,2]	[2,2,3]	[1,3,2]	1.7320508075688772
4	[-1,-2,-2]	[-4,2,3]	NULL	6.708203932499369
select c1,c2,c3,c4,l2_distance(a3,c2) from v1 a left join t2 b on l2_distance(c2,c3)=l2_distance(a3,a4)  order by l2_distance(c3, [1,2,3]) approximate limit 10;
c1	c2	c3	c4	l2_distance(a3,c2)
5	[-1,-3,-2]	NULL	[2,3,1]	NULL
1	[1,1,2]	[2,2,3]	[1,3,2]	1.7320508075688772
2	[1,0,3]	[1,0,3]	[2,3,2]	NULL
3	[-1,2,2]	[-3,2,3]	[4,3,3]	NULL
4	[-1,-2,-2]	[-4,2,3]	NULL	6.708203932499369
select c1,c2,c3,c4,l2_distance(a3,c2) from v1 a cross  join t2 b on l2_distance(c2,c3)=l2_distance(a3,a4)  order by l2_distance(c3, [1,2,3]) approximate limit 10;
c1	c2	c3	c4	l2_distance(a3,c2)
1	[1,1,2]	[2,2,3]	[1,3,2]	1.7320508075688772
4	[-1,-2,-2]	[-4,2,3]	NULL	6.708203932499369
select c1,c2,c3,c4,l2_distance(a3,c2) from v1 a join v2 b on l2_distance(a4,c3)=l2_distance(a3,c2)  order by l2_distance(a3,c2);
c1	c2	c3	c4	l2_distance(a3,c2)
1	[1,1,2]	[2,2,3]	[1,3,2]	1.4142135623730951
1	[1,1,2]	[2,2,3]	[1,3,2]	1.7320508075688772
select c1,c2,c3,c4,l2_distance(a3,c2) from v1 a inner join v2 b on l2_distance(a4,c3)=l2_distance(a3,c2)  order by l2_distance(a3,c2);
c1	c2	c3	c4	l2_distance(a3,c2)
1	[1,1,2]	[2,2,3]	[1,3,2]	1.4142135623730951
1	[1,1,2]	[2,2,3]	[1,3,2]	1.7320508075688772
select c1,c2,c3,c4,l2_distance(a3,c2) from v1 a right join t2 b on l2_distance(a4,c3)=l2_distance(a3,c2)  order by l2_distance(a3,c2);
c1	c2	c3	c4	l2_distance(a3,c2)
NULL	NULL	NULL	NULL	NULL
NULL	NULL	NULL	NULL	NULL
NULL	NULL	NULL	NULL	NULL
1	[1,1,2]	[2,2,3]	[1,3,2]	1.4142135623730951
1	[1,1,2]	[2,2,3]	[1,3,2]	1.7320508075688772
select c1,c2,c3,c4,l2_distance(a3,c2) from v1 a left join t2 b on l2_distance(a4,c3)=l2_distance(a3,c2)  order by l2_distance(a3,c2);
c1	c2	c3	c4	l2_distance(a3,c2)
2	[1,0,3]	[1,0,3]	[2,3,2]	NULL
3	[-1,2,2]	[-3,2,3]	[4,3,3]	NULL
4	[-1,-2,-2]	[-4,2,3]	NULL	NULL
5	[-1,-3,-2]	NULL	[2,3,1]	NULL
1	[1,1,2]	[2,2,3]	[1,3,2]	1.4142135623730951
1	[1,1,2]	[2,2,3]	[1,3,2]	1.7320508075688772
select c1,c2,c3,c4,l2_distance(a3,c2) from v1 a cross  join v2 b on l2_distance(a4,c3)=l2_distance(a3,c2)  order by l2_distance(a3,c2);
c1	c2	c3	c4	l2_distance(a3,c2)
1	[1,1,2]	[2,2,3]	[1,3,2]	1.4142135623730951
1	[1,1,2]	[2,2,3]	[1,3,2]	1.7320508075688772
select * from v1 a join v1 b  where a.c2=b.c2 order by l2_distance(a.c3, [1,2,3])  approximate limit 10;
c1	c2	c3	c4	c1	c2	c3	c4
5	[-1,-3,-2]	NULL	[2,3,1]	5	[-1,-3,-2]	NULL	[2,3,1]
1	[1,1,2]	[2,2,3]	[1,3,2]	1	[1,1,2]	[2,2,3]	[1,3,2]
2	[1,0,3]	[1,0,3]	[2,3,2]	2	[1,0,3]	[1,0,3]	[2,3,2]
3	[-1,2,2]	[-3,2,3]	[4,3,3]	3	[-1,2,2]	[-3,2,3]	[4,3,3]
4	[-1,-2,-2]	[-4,2,3]	NULL	4	[-1,-2,-2]	[-4,2,3]	NULL
select * from (select * from v1 order by c1) a join (select c1,c2,c3 from v1 order by c1) b  where l2_distance(a.c3,b.c2)=l2_distance(b.c3,a.c2) order by l2_distance(a.c3, [1,2,3]) approximate limit 1,1;
c1	c2	c3	c4	c1	c2	c3
2	[1,0,3]	[1,0,3]	[2,3,2]	2	[1,0,3]	[1,0,3]
select * from t1 order by l2_distance(c3, [1,2,3]) approximate limit 10;
c1	c2	c3	c4
1	[1,1,2]	[2,2,3]	[1,3,2]
2	[1,0,3]	[1,0,3]	[2,3,2]
3	[-1,2,2]	[-3,2,3]	[4,3,3]
4	[-1,-2,-2]	[-4,2,3]	NULL
select l2_distance(c3,'[1,2.2,3]') ld_c3,l2_distance(c4,'[1,1.3,1]') ld_c4 from v1 where l2_distance(c3,c3) <=2 and l2_distance(c3,c2) >1 ;
ld_c3	ld_c4
1.0198039120701041	1.9723083334318283
4.004996881281369	3.9862263059345535
5.003998403184546	NULL
select l2_distance(c3,'[1,2.2,3]') ld_c3,l2_distance(c4,'[1,1.3,-1]') ld_c4 from v1 where l2_distance(c3,c3) =0 and l2_distance(c3,c2) >0  and l2_distance(c3,c2) >0 and l2_distance(c3,c2) >0 and l2_distance(c3,c2) >0 and l2_distance(c3,c2) >0 and l2_distance(c3,c2) >0 and l2_distance(c3,c2) >0 
and l2_distance(c3,c2) >0 and l2_distance(c3,c2) >0 and l2_distance(c3,c2) >0 and l2_distance(c3,c2) >0 and l2_distance(c3,c2) >0 and l2_distance(c3,c2) >0 and l2_distance(c3,c2) >0 and l2_distance(c3,c2) >0 and l2_distance(c3,c2) >0 and l2_distance(c3,c2) >0 and l2_distance(c3,c2) >0 and 
l2_distance(c3,c2) >0 and l2_distance(c3,c2) >0 and l2_distance(c3,c2) >0 and l2_distance(c3,c2) >0 and l2_distance(c3,c2) >0 and l2_distance(c3,c2) >0 and l2_distance(c3,c2) >0 and l2_distance(c3,c2) >0 and l2_distance(c3,c2) >0 and l2_distance(c3,c2) >0 and l2_distance(c3,c2) >0 and 
l2_distance(c3,c2) >0 and l2_distance(c3,c2) >0 and l2_distance(c3,c2) >0 and l2_distance(c3,c2) >0 and l2_distance(c3,c2) >0 and l2_distance(c3,c2) >0 and l2_distance(c3,c2) >0 and l2_distance(c3,c2) >0 and l2_distance(c3,c2) >0 and l2_distance(c3,c2) >0 and l2_distance(c3,c2) >0 and 
l2_distance(c3,c2) >0 and l2_distance(c3,c2) >0 and l2_distance(c3,c2) >0 and l2_distance(c3,c2) >0 and l2_distance(c3,c2) >0 and l2_distance(c3,c2) >0 and l2_distance(c3,c2) >0 and l2_distance(c3,c2) >0 and l2_distance(c3,c2) >0 and l2_distance(c3,c2) >0 and l2_distance(c3,c2) >0 and 
l2_distance(c3,c2) >0 and l2_distance(c3,c2) >0 and l2_distance(c3,c2) >0 and l2_distance(c3,c2) >0 and l2_distance(c3,c2) >0 and l2_distance(c3,c2) >0 and l2_distance(c3,c2) >0 and l2_distance(c3,c2) >0 and l2_distance(c3,c2) >0 and l2_distance(c3,c2) >0 and l2_distance(c3,c2) >0 and 
l2_distance(c3,c2) >0 and l2_distance(c3,c2) >0 order by c1;
ld_c3	ld_c4
1.0198039120701041	3.4481879534220052
4.004996881281369	5.281098385953876
5.003998403184546	NULL
select l2_distance(c3,'[1,2.2,3]') ld_c3,l2_distance(c4,'[1,1.3,-1]') ld_c4 from v1 where l2_distance(c3,'[1,2,3]') > 0 or l2_distance(c3,c3) is null order by c1;
ld_c3	ld_c4
1.0198039120701041	3.4481879534220052
2.200000047683716	3.590264636781617
4.004996881281369	5.281098385953876
5.003998403184546	NULL
NULL	2.8089144098965773
select l2_distance(c3,'[1,2.2,3]') ld_c3,l2_distance(c4,'[1,1.3,-1]') ld_c4 from v1 where l2_distance(c3,'[1,2,3]') > 0 or l2_distance(c3,c3) is null or l2_distance(c3,c3) is null or l2_distance(c3,c3) is null or l2_distance(c3,c3) is null or l2_distance(c3,c3) is null or l2_distance(c3,c3) 
is null or l2_distance(c3,c3) is null or l2_distance(c3,c3) is null or l2_distance(c3,c3) is null or l2_distance(c3,c3) is null or l2_distance(c3,c3) is null or l2_distance(c3,c3) is null or l2_distance(c3,c3) is null or l2_distance(c3,c3) is null or l2_distance(c3,c3) is null or 
l2_distance(c3,c3) is null or l2_distance(c3,c3) is null or l2_distance(c3,c3) is null or l2_distance(c3,c3) is null or l2_distance(c3,c3) is null or l2_distance(c3,c3) is null or l2_distance(c3,c3) is null or l2_distance(c3,c3) is null or l2_distance(c3,c3) is null or l2_distance(c3,c3) 
is null or l2_distance(c3,c3) is null or l2_distance(c3,c3) is null or l2_distance(c3,c3) is null or l2_distance(c3,c3) is null or l2_distance(c3,c3) is null or l2_distance(c3,c3) is null or l2_distance(c3,c3) is null or l2_distance(c3,c3) is null or l2_distance(c3,c3) is null or 
l2_distance(c3,c3) is null or l2_distance(c3,c3) is null or l2_distance(c3,c3) is null or l2_distance(c3,c3) is null or l2_distance(c3,c3) is null or l2_distance(c3,c3) is null or l2_distance(c3,c3) is null or l2_distance(c3,c3) is null or l2_distance(c3,c3) is null or l2_distance(c3,c3)
is null order by c1;
ld_c3	ld_c4
1.0198039120701041	3.4481879534220052
2.200000047683716	3.590264636781617
4.004996881281369	5.281098385953876
5.003998403184546	NULL
NULL	2.8089144098965773
select l2_distance(c3,'[1,2.2,3]') ld_c3,l2_distance(c4,'[1,1.3,-1]') ld_c4 from v1 where l2_distance(c3,'[1,2,3]') > 0 or l2_distance(c3,c3) is null  and c1 >3 order by c1;
ld_c3	ld_c4
1.0198039120701041	3.4481879534220052
2.200000047683716	3.590264636781617
4.004996881281369	5.281098385953876
5.003998403184546	NULL
NULL	2.8089144098965773
select  * from v1 where 1 BETWEEN l2_distance(c3,c3)  and l2_distance(c3,'[1,2,3]') order by c1;
c1	c2	c3	c4
1	[1,1,2]	[2,2,3]	[1,3,2]
2	[1,0,3]	[1,0,3]	[2,3,2]
3	[-1,2,2]	[-3,2,3]	[4,3,3]
4	[-1,-2,-2]	[-4,2,3]	NULL
select  * from v1 where 1 BETWEEN l2_distance(c3,c3)  and l2_distance(c3,'[1,2,3]') order by l2_distance(c3, [1,2,3]) approximate limit 10;
c1	c2	c3	c4
1	[1,1,2]	[2,2,3]	[1,3,2]
2	[1,0,3]	[1,0,3]	[2,3,2]
3	[-1,2,2]	[-3,2,3]	[4,3,3]
4	[-1,-2,-2]	[-4,2,3]	NULL
select  l2_distance(c3,'[1,2.2,3]') BETWEEN l2_distance(c3,c3)  and l2_distance(c3,'[1,2,3]') from v1 order by c1;
l2_distance(c3,'[1,2.2,3]') BETWEEN l2_distance(c3,c3)  and l2_distance(c3,'[1,2,3]')
0
0
0
0
NULL
select  l2_distance(c3,'[1,2.2,3]') BETWEEN l2_distance(c3,c3)  and l2_distance(c3,'[1,2,3]') from v1 where l2_distance(c3,'[1,2.2,3]') BETWEEN l2_distance(c3,c3)  and l2_distance(c3,'[1,2,3]') >1;
l2_distance(c3,'[1,2.2,3]') BETWEEN l2_distance(c3,c3)  and l2_distance(c3,'[1,2,3]')
select distinct l2_distance(c2,c3), l2_distance(c4,c3) from v1 order By c1;
l2_distance(c2,c3)	l2_distance(c4,c3)
1.7320508075688772	1.7320508075688772
0	3.3166247903554
2.23606797749979	7.0710678118654755
7.0710678118654755	NULL
NULL	NULL
select * from v1 join v2 on l2_distance(c2,c3)=l2_distance(a3,a4) order by c1;
c1	c2	c3	c4	a1	a2	a3	a4
1	[1,1,2]	[2,2,3]	[1,3,2]	1	[1,1,2]	[2,2,3]	[1,3,2]
4	[-1,-2,-2]	[-4,2,3]	NULL	3	[-1,2,2]	[-3,2,3]	[4,3,3]
drop table if exists t1;
drop view if exists v1;
CREATE TABLE t1 (c1 int primary key, c2 vector(3),c3 vector(3) ,c4 vector(3),
VECTOR INDEX vector_idx(c3) 
WITH (distance=l2, lib=vsag, type=hnsw, m=10, ef_construction=100, ef_search=40));
create view v1 as select * from t1;
insert into v1(c1,c2,c3,c4) values(1,'[1,1,2]','[2,2,3]','[1,3,2]');
insert into v1(c1,c2,c3,c4) values(2,'[1,0,3]','[1,0,3]','[2,3,2]');
insert into v1(c1,c2,c3,c4) values(3,'[-1,2,2]','[-3,2,3]','[4,3,3]');
insert into v1(c1,c2,c3,c4) values(4,'[-1,-2,-2]','[-4,2,3]',null);
insert into v1(c1,c2,c3,c4) values(5,'[-1,-3,-2]',null,'[2,3,1]');
insert into v1 select l2_distance([1,20],[2,-1]),[1,1,1],[0,0,0],[0.123,5.123,1.123] from dual;
insert into v1 values(1,'[1,1,2]','[2,2,3]','[1,3,2]');
ERROR 23000: Duplicate entry '1' for key 'PRIMARY'
INSERT IGNORE v1(c1) values (l2_distance([1,20],[2,-1]));
INSERT IGNORE v1 values (5,[1,3,4],[0,1,1],[9,9,9]);
select l2_distance(c4,c3) from v1 order by c1;
l2_distance(c4,c3)
1.7320508075688772
3.3166247903554
7.0710678118654755
NULL
NULL
5.246083162123268
select l2_distance(c4,c3) from t1 order by c1;
l2_distance(c4,c3)
1.7320508075688772
3.3166247903554
7.0710678118654755
NULL
NULL
5.246083162123268
drop table if exists t1;
drop view if exists v1;
drop view if exists v2;
CREATE TABLE t1 (c1 int primary key, c2 vector(3),c3 vector(3) ,c4 vector(3),
VECTOR INDEX vector_idx(c3) 
WITH (distance=l2, lib=vsag, type=hnsw, m=10, ef_construction=100, ef_search=40));
create view v1 as select * from t1;
create view v2 as select [1,1,23],l2_distance([1.23,23.6],[1.11,2.33]) from dual ;
INSERT into t1 values(1,'[1,1,2]','[2,2,3]','[1,3,2]');
INSERT into t1 values(1,'[1,1,2]','[2,2,3]','[1,3,2]') ON DUPLICATE KEY UPDATE c3='[2,2,4]';
INSERT into v1 values(1,'[1,1,2]','[2,2,3]','[1,3,2]') ON DUPLICATE KEY UPDATE c3='[2,2,4]';
select * from v2;
[1,1,23]	l2_distance([1.23,23.6],[1.11,2.33])
[1,1,23]	21.270338960026265
drop table if exists t1;
drop view if exists v1;
CREATE TABLE t1 (c1 int primary key, c2 vector(3),c3 vector(3) ,c4 vector(3),
VECTOR INDEX vector_idx(c3) 
WITH (distance=l2, lib=vsag, type=hnsw, m=10, ef_construction=100, ef_search=40));
create view v1 as select * from t1;
replace into v1 values(1,'[1,1,2]','[2,2,3]','[1,3,2]');
replace into v1 values(1,'[1,1,2]','[2,2,3]','[1,3,2]');
drop table if exists t1;
CREATE TABLE t1 (c1 int primary key, c2 vector(3),c3 vector(3) ,c4 vector(3),
VECTOR INDEX vector_idx(c3) 
WITH (distance=l2, lib=vsag, type=hnsw, m=10, ef_construction=100, ef_search=40));
insert into v1(c1,c2,c3,c4) values(1,'[1,1,2]','[2,2,3]','[1,3,2]');
insert into v1(c1,c2,c3,c4) values(2,'[1,0,3]','[1,0,3]','[2,3,2]');
insert into v1(c1,c2,c3,c4) values(3,'[-1,2,2]','[-3,2,3]','[4,3,3]');
insert into v1(c1,c2,c3,c4) values(4,'[-1,-2,-2]','[-4,2,3]',null);
insert into v1(c1,c2,c3,c4) values(5,'[-1,-3,-2]',null,'[2,3,1]');
create UNIQUE index index_01 on t1(c1);
drop view v1;
drop table if exists t1;
drop view if exists v1;
CREATE TABLE t1 (c1 int primary key, c2 vector(3),c3 vector(3) ,c4 vector(3),
VECTOR INDEX vector_idx(c3) 
WITH (distance=l2, lib=vsag, type=hnsw, m=10, ef_construction=100, ef_search=40));
create view v1 as select * from t1;
insert into v1(c1,c2,c3,c4) values(1,'[1,1,2]','[2,2,3]','[1,3,2]');
insert into v1(c1,c2,c3,c4) values(2,'[1,0,3]','[1,0,3]','[2,3,2]');
insert into v1(c1,c2,c3,c4) values(3,'[-1,2,2]','[-3,2,3]','[4,3,3]');
insert into v1(c1,c2,c3,c4) values(4,'[-1,-2,-2]','[-4,2,3]',null);
insert into v1(c1,c2,c3,c4) values(5,'[-1,-3,-2]',null,'[2,3,1]');
update v1 set c2=[1,1,1] where c3 is null;
update v1 set c2=[1,1,1]*[10,10,10] where c3 is null;
update v1 set c1=l2_distance([1],[100])  where c3 is null;
update v1 set c1=l2_distance([1],[101])  where c4 is null and c1>1;
select * from t1 order by c1;
c1	c2	c3	c4
1	[1,1,2]	[2,2,3]	[1,3,2]
2	[1,0,3]	[1,0,3]	[2,3,2]
3	[-1,2,2]	[-3,2,3]	[4,3,3]
99	[10,10,10]	NULL	[2,3,1]
100	[-1,-2,-2]	[-4,2,3]	NULL
select * from v1 order by c1;
c1	c2	c3	c4
1	[1,1,2]	[2,2,3]	[1,3,2]
2	[1,0,3]	[1,0,3]	[2,3,2]
3	[-1,2,2]	[-3,2,3]	[4,3,3]
99	[10,10,10]	NULL	[2,3,1]
100	[-1,-2,-2]	[-4,2,3]	NULL
select * from v1 order by l2_distance([1],[c1]);
c1	c2	c3	c4
1	[1,1,2]	[2,2,3]	[1,3,2]
2	[1,0,3]	[1,0,3]	[2,3,2]
3	[-1,2,2]	[-3,2,3]	[4,3,3]
99	[10,10,10]	NULL	[2,3,1]
100	[-1,-2,-2]	[-4,2,3]	NULL
drop table if exists t1;
drop view if exists v1;
CREATE TABLE t1 (c1 int primary key, c2 vector(3),c3 vector(3) ,c4 vector(3),
VECTOR INDEX vector_idx(c3) 
WITH (distance=l2, lib=vsag, type=hnsw, m=10, ef_construction=100, ef_search=40));
create view v1 as select * from t1;
insert into v1(c1,c2,c3,c4) values(1,'[1,1,2]','[2,2,3]','[1,3,2]');
insert into v1(c1,c2,c3,c4) values(2,'[1,0,3]','[1,0,3]','[2,3,2]');
insert into v1(c1,c2,c3,c4) values(3,'[-1,2,2]','[-3,2,3]','[4,3,3]');
insert into v1(c1,c2,c3,c4) values(4,'[-1,-2,-2]','[-4,2,3]',null);
insert into v1(c1,c2,c3,c4) values(5,'[-1,-3,-2]',null,'[2,3,1]');
update v1 join t1 on v1.c2 =t1.c2 set t1.c2 =[1,2,4] where t1.c3 is null;
update v1 join t1 on v1.c1 =t1.c1 set t1.c2 =[1,2,4] where v1.c4 is null;
select * from t1 order by c1;
c1	c2	c3	c4
1	[1,1,2]	[2,2,3]	[1,3,2]
2	[1,0,3]	[1,0,3]	[2,3,2]
3	[-1,2,2]	[-3,2,3]	[4,3,3]
4	[1,2,4]	[-4,2,3]	NULL
5	[1,2,4]	NULL	[2,3,1]
select * from v1 order by c1;
c1	c2	c3	c4
1	[1,1,2]	[2,2,3]	[1,3,2]
2	[1,0,3]	[1,0,3]	[2,3,2]
3	[-1,2,2]	[-3,2,3]	[4,3,3]
4	[1,2,4]	[-4,2,3]	NULL
5	[1,2,4]	NULL	[2,3,1]
select * from v1 order by l2_distance([1],[c1]);
c1	c2	c3	c4
1	[1,1,2]	[2,2,3]	[1,3,2]
2	[1,0,3]	[1,0,3]	[2,3,2]
3	[-1,2,2]	[-3,2,3]	[4,3,3]
4	[1,2,4]	[-4,2,3]	NULL
5	[1,2,4]	NULL	[2,3,1]
select count(*) from t1,v1 order by t1.c1;
count(*)
25
select count(*) from t1,v1 where t1.c2=v1.c3 order by t1.c1;
count(*)
1
drop table if exists t1;
drop view if exists v1;
CREATE TABLE t1 (c1 int primary key, c2 vector(3),c3 vector(3) ,c4 vector(3),
VECTOR INDEX vector_idx(c3) 
WITH (distance=l2, lib=vsag, type=hnsw, m=10, ef_construction=100, ef_search=40));
create view v1 as select * from t1;
insert into v1(c1,c2,c3,c4) values(1,'[1,1,2]','[2,2,3]','[1,3,2]');
insert into v1(c1,c2,c3,c4) values(2,'[1,0,3]','[1,0,3]','[2,3,2]');
insert into v1(c1,c2,c3,c4) values(3,'[-1,2,2]','[-3,2,3]','[4,3,3]');
insert into v1(c1,c2,c3,c4) values(4,'[-1,-2,-2]','[-4,2,3]',null);
insert into v1(c1,c2,c3,c4) values(5,'[-1,-3,-2]',null,'[2,3,1]');
delete from v1 where c1=1;
delete from v1 where c1=l2_distance([1],[c1]);
drop table if exists t1;
drop view if exists v1;
CREATE TABLE t1 (c1 int primary key, c2 vector(3),c3 vector(3) ,c4 vector(3));
create view v1 as select * from t1;
insert into v1(c1,c2,c3,c4) values(1,'[1,1,2]','[2,2,3]','[1,3,2]');
insert into v1(c1,c2,c3,c4) values(2,'[1,0,3]','[1,0,3]','[2,3,2]');
insert into v1(c1,c2,c3,c4) values(3,'[-1,2,2]','[-3,2,3]','[4,3,3]');
insert into v1(c1,c2,c3,c4) values(4,'[-1,-2,-2]','[-4,2,3]',null);
insert into v1(c1,c2,c3,c4) values(5,'[-1,-3,-2]',null,'[2,3,1]');
CREATE VECTOR INDEX vector_idx_c2  ON v1 (c2)  WITH (distance=l2, lib=vsag, type=hnsw, m=10, ef_construction=10, ef_search=40);
ERROR 0A000: the vector index params ef_construction less than or equal to m value is not supported
########清空回收站，删除测试数据库，表等 ##########
drop database  IF EXISTS  obljh;
purge recyclebin;
