purge recyclebin;
drop database IF EXISTS obljh;
create database obljh ;
use obljh;
set timestamp = 1600000000;
set ob_trx_timeout = 10000000000;
set ob_query_timeout = 10000000000;
set ob_default_lob_inrow_threshold = 0;
alter system set ob_vector_memory_limit_percentage =44;
##where子句
drop table if exists t1;
CREATE TABLE t1 (c1 int AUTO_INCREMENT primary key , c2 vector(3),c3 vector(3) ,c4 BLOB,
VECTOR INDEX vector_idx(c3) 
WITH (distance=l2, lib=vsag, type=hnsw, m=10, ef_construction=100, ef_search=40));
select * from t1 where vector_norm(null);
c1	c2	c3	c4
select * from t1 where vector_norm([1,1]);
c1	c2	c3	c4
select * from t1 where vector_norm([1]);
c1	c2	c3	c4
##=,<,<=,>=,<>
drop table if exists t1;
CREATE TABLE t1 (c1 int primary key, c2 VARCHAR(30),c3 vector(3) ,c4 vector(2),
VECTOR INDEX vector_idx(c3) 
WITH (distance=l2, lib=vsag, type=hnsw, m=10, ef_construction=100, ef_search=40));
insert into t1 values(1,'[1,1,2]','[2,2,3]','[1,3]');
insert into t1 values(2,'[1,2,3]','[1,2,3]','[2,3]');
insert into t1 values(3,'[-1,2,2]','[-3,2,3]','[4,3]');
insert into t1 values(4,'[-1,-2,-2]','[-4,2,3]',null);
insert into t1 values(5,'[-1,-2,-2]',null,'[2,3]');
select vector_norm(c3) ld_c3,vector_norm(c4) ld_c4 from t1 where vector_norm(c3) =0  order by c1;
ld_c3	ld_c4
select vector_norm(c3) ld_c3,vector_norm(c4) ld_c4 from t1 where vector_norm(c3) =0  order by c1;
ld_c3	ld_c4
select vector_norm(c3) ld_c3,vector_norm(c4) ld_c4 from t1 where vector_norm(c2) > 1  order by c1;
ld_c3	ld_c4
4.123105625617661	3.1622776601683795
3.7416573867739413	3.605551275463989
4.69041575982343	5
5.385164807134504	NULL
NULL	3.605551275463989
select vector_norm(c3) ld_c3,vector_norm(c4) ld_c4 from t1 where vector_norm([1,2,3]) > 1  order by c1;
ld_c3	ld_c4
4.123105625617661	3.1622776601683795
3.7416573867739413	3.605551275463989
4.69041575982343	5
5.385164807134504	NULL
NULL	3.605551275463989
select vector_norm(c3) ld_c3,vector_norm(c4) ld_c4 from t1 where vector_norm(c2) < 1  order by c1;
ld_c3	ld_c4
select vector_norm(c3) ld_c3,vector_norm(c4) ld_c4 from t1 where vector_norm([1,2,3]) < 1  order by c1;
ld_c3	ld_c4
select vector_norm(c3) ld_c3,vector_norm(c4) ld_c4 from t1 where vector_norm(c2) <= 0  order by c1;
ld_c3	ld_c4
select vector_norm(c3) ld_c3,vector_norm(c4) ld_c4 from t1 where vector_norm([1,2,3]) <= 0  order by c1;
ld_c3	ld_c4
select vector_norm(c3) ld_c3,vector_norm(c4) ld_c4 from t1 where vector_norm(c2) >=1  order by c1;
ld_c3	ld_c4
4.123105625617661	3.1622776601683795
3.7416573867739413	3.605551275463989
4.69041575982343	5
5.385164807134504	NULL
NULL	3.605551275463989
select vector_norm(c3) ld_c3,vector_norm(c4) ld_c4 from t1 where vector_norm([1,2,3]) >=1  order by c1;
ld_c3	ld_c4
4.123105625617661	3.1622776601683795
3.7416573867739413	3.605551275463989
4.69041575982343	5
5.385164807134504	NULL
NULL	3.605551275463989
select vector_norm(c3) ld_c3,vector_norm(c4) ld_c4 from t1 where vector_norm(c2) <>1  order by c1;
ld_c3	ld_c4
4.123105625617661	3.1622776601683795
3.7416573867739413	3.605551275463989
4.69041575982343	5
5.385164807134504	NULL
NULL	3.605551275463989
select vector_norm(c3) ld_c3,vector_norm(c4) ld_c4 from t1 where vector_norm([1,2,3])<>1  order by c1;
ld_c3	ld_c4
4.123105625617661	3.1622776601683795
3.7416573867739413	3.605551275463989
4.69041575982343	5
5.385164807134504	NULL
NULL	3.605551275463989
select vector_norm(c3) ld_c3,vector_norm(c4) ld_c4 from t1 where vector_norm(c2) <>false  order by c1;
ld_c3	ld_c4
4.123105625617661	3.1622776601683795
3.7416573867739413	3.605551275463989
4.69041575982343	5
5.385164807134504	NULL
NULL	3.605551275463989
select vector_norm(c3) ld_c3,vector_norm(c4) ld_c4 from t1 where vector_norm([1,2,3])<>false  order by c1;
ld_c3	ld_c4
4.123105625617661	3.1622776601683795
3.7416573867739413	3.605551275463989
4.69041575982343	5
5.385164807134504	NULL
NULL	3.605551275463989
select vector_norm(c3) ld_c3,vector_norm(c4) ld_c4 from t1 where vector_norm(c2) <>true  order by c1;
ld_c3	ld_c4
4.123105625617661	3.1622776601683795
3.7416573867739413	3.605551275463989
4.69041575982343	5
5.385164807134504	NULL
NULL	3.605551275463989
select vector_norm(c3) ld_c3,vector_norm(c4) ld_c4 from t1 where vector_norm([1,2,3]) <>true  order by c1;
ld_c3	ld_c4
4.123105625617661	3.1622776601683795
3.7416573867739413	3.605551275463989
4.69041575982343	5
5.385164807134504	NULL
NULL	3.605551275463989
select vector_norm(c3) ld_c3,vector_norm(c4) ld_c4 from t1 where vector_norm(c3) =0  order by l2_distance(c3, [1,2,3]) approximate limit 10;
ld_c3	ld_c4
select vector_norm(c3) ld_c3,vector_norm(c4) ld_c4 from t1 where vector_norm(c3) =0  order by l2_distance(c3, [1,2,3]) approximate limit 10;
ld_c3	ld_c4
select vector_norm(c3) ld_c3,vector_norm(c4) ld_c4 from t1 where vector_norm(c2) > 1  order by l2_distance(c3, [1,2,3]) approximate limit 10;
ld_c3	ld_c4
3.7416573867739413	3.605551275463989
4.123105625617661	3.1622776601683795
4.69041575982343	5
5.385164807134504	NULL
select vector_norm(c3) ld_c3,vector_norm(c4) ld_c4 from t1 where vector_norm([1,2,3]) > 1  order by l2_distance(c3, [1,2,3]) approximate limit 10;
ld_c3	ld_c4
3.7416573867739413	3.605551275463989
4.123105625617661	3.1622776601683795
4.69041575982343	5
5.385164807134504	NULL
select vector_norm(c3) ld_c3,vector_norm(c4) ld_c4 from t1 where vector_norm(c2) < 1  order by l2_distance(c3, [1,2,3]) approximate limit 10;
ld_c3	ld_c4
select vector_norm(c3) ld_c3,vector_norm(c4) ld_c4 from t1 where vector_norm([1,2,3]) < 1  order by l2_distance(c3, [1,2,3]) approximate limit 10;
ld_c3	ld_c4
select vector_norm(c3) ld_c3,vector_norm(c4) ld_c4 from t1 where vector_norm(c2) <= 0  order by l2_distance(c3, [1,2,3]) approximate limit 10;
ld_c3	ld_c4
select vector_norm(c3) ld_c3,vector_norm(c4) ld_c4 from t1 where vector_norm([1,2,3]) <= 0  order by l2_distance(c3, [1,2,3]) approximate limit 10;
ld_c3	ld_c4
select vector_norm(c3) ld_c3,vector_norm(c4) ld_c4 from t1 where vector_norm(c2) >=1  order by l2_distance(c3, [1,2,3]) approximate limit 10;
ld_c3	ld_c4
3.7416573867739413	3.605551275463989
4.123105625617661	3.1622776601683795
4.69041575982343	5
5.385164807134504	NULL
select vector_norm(c3) ld_c3,vector_norm(c4) ld_c4 from t1 where vector_norm([1,2,3]) >=1  order by l2_distance(c3, [1,2,3]) approximate limit 10;
ld_c3	ld_c4
3.7416573867739413	3.605551275463989
4.123105625617661	3.1622776601683795
4.69041575982343	5
5.385164807134504	NULL
select vector_norm(c3) ld_c3,vector_norm(c4) ld_c4 from t1 where vector_norm(c2) <>1  order by l2_distance(c3, [1,2,3]) approximate limit 10;
ld_c3	ld_c4
3.7416573867739413	3.605551275463989
4.123105625617661	3.1622776601683795
4.69041575982343	5
5.385164807134504	NULL
select vector_norm(c3) ld_c3,vector_norm(c4) ld_c4 from t1 where vector_norm([1,2,3])<>1  order by l2_distance(c3, [1,2,3]) approximate limit 10;
ld_c3	ld_c4
3.7416573867739413	3.605551275463989
4.123105625617661	3.1622776601683795
4.69041575982343	5
5.385164807134504	NULL
select vector_norm(c3) ld_c3,vector_norm(c4) ld_c4 from t1 where vector_norm(c2) <>false  order by l2_distance(c3, [1,2,3]) approximate limit 10;
ld_c3	ld_c4
3.7416573867739413	3.605551275463989
4.123105625617661	3.1622776601683795
4.69041575982343	5
5.385164807134504	NULL
select vector_norm(c3) ld_c3,vector_norm(c4) ld_c4 from t1 where vector_norm([1,2,3])<>false  order by l2_distance(c3, [1,2,3]) approximate limit 10;
ld_c3	ld_c4
3.7416573867739413	3.605551275463989
4.123105625617661	3.1622776601683795
4.69041575982343	5
5.385164807134504	NULL
select vector_norm(c3) ld_c3,vector_norm(c4) ld_c4 from t1 where vector_norm(c2) <>true  order by l2_distance(c3, [1,2,3]) approximate limit 10;
ld_c3	ld_c4
3.7416573867739413	3.605551275463989
4.123105625617661	3.1622776601683795
4.69041575982343	5
5.385164807134504	NULL
select vector_norm(c3) ld_c3,vector_norm(c4) ld_c4 from t1 where vector_norm([1,2,3]) <>true  order by l2_distance(c3, [1,2,3]) approximate limit 10;
ld_c3	ld_c4
3.7416573867739413	3.605551275463989
4.123105625617661	3.1622776601683795
4.69041575982343	5
5.385164807134504	NULL
##and/or
drop table if exists t1;
CREATE TABLE t1 (c1 int primary key, c2 VARCHAR(30),c3 vector(3) ,c4 vector(3),
VECTOR INDEX vector_idx(c3) 
WITH (distance=l2, lib=vsag, type=hnsw, m=10, ef_construction=100, ef_search=40));
insert into t1 values(1,'[1,1,2]','[2,2,3]','[1,-1.5,3]');
insert into t1 values(2,'[1,2,3]','[1,2,3]','[2,1.5,3]');
insert into t1 values(3,'[-1,2,2]','[-3,2,3]','[4,-1,3]');
insert into t1 values(4,'[-1,-2,-2]','[-4,2,3]',null);
insert into t1 values(5,'[-1,-2,-2]',null,'[2,-2,3]');
select vector_norm(c3) ld_c3,vector_norm(c4) ld_c4 from t1 where vector_norm(c3) =0 and vector_norm(c4) is null order by c1;
ld_c3	ld_c4
select vector_norm(c3) ld_c3,vector_norm(c4) ld_c4 from t1 where vector_norm(c3) <=2 and vector_norm(c2) >1 ;
ld_c3	ld_c4
select vector_norm(c3) ld_c3,vector_norm(c4) ld_c4 from t1 where vector_norm('[1,2,3]') > 0 or vector_norm(c3) is null order by c1;
ld_c3	ld_c4
4.123105625617661	3.5
3.7416573867739413	3.905124837953327
4.69041575982343	5.0990195135927845
5.385164807134504	NULL
NULL	4.123105625617661
select vector_norm(c3) ld_c3,vector_norm(c4) ld_c4 from t1 where vector_norm('[1,2,3]') > 0 or vector_norm(c3) is null  and c1 >3 order by c1;
ld_c3	ld_c4
4.123105625617661	3.5
3.7416573867739413	3.905124837953327
4.69041575982343	5.0990195135927845
5.385164807134504	NULL
NULL	4.123105625617661
##between and
select  * from t1 where 1 BETWEEN vector_norm(c3)  and vector_norm('[1,2,3]') order by vector_norm(c3)  limit 10;
c1	c2	c3	c4
select  * from t1 where 1 BETWEEN vector_norm(c3)  and vector_norm('[1,2,3]') order by l2_distance(c3, [1,2,3]) approximate limit 10;
c1	c2	c3	c4
select  vector_norm(c3) BETWEEN vector_norm(c3)  and vector_norm(c3) from t1 order by vector_norm(c3)  limit 10;
vector_norm(c3) BETWEEN vector_norm(c3)  and vector_norm(c3)
NULL
1
1
1
1
select  vector_norm(c3) BETWEEN vector_norm(c3)  and vector_norm(c3) from t1 order by l2_distance(c3, [1,2,3]) approximate limit 10;
vector_norm(c3) BETWEEN vector_norm(c3)  and vector_norm(c3)
1
1
1
1
select  vector_norm(c3) BETWEEN vector_norm(c3)  and vector_norm(c3) from t1 where vector_norm(c3) BETWEEN vector_norm(c3)  and vector_norm(c3) >1;
vector_norm(c3) BETWEEN vector_norm(c3)  and vector_norm(c3)
##like/not like
drop table if exists t1;
CREATE TABLE t1 (c1 int primary key, c2 VARCHAR(30),c3 vector(3) ,c4 vector(2),
VECTOR INDEX vector_idx(c3) 
WITH (distance=l2, lib=vsag, type=hnsw, m=10, ef_construction=100, ef_search=40));
insert into t1 values(1,'[1,1,2]','[2,2,3]','[1,3]');
insert into t1 values(2,'[1,0,3]','[1,0,3]','[2,3]');
insert into t1 values(3,'[-1,2,2]','[-3,2,3]','[4,3]');
insert into t1 values(4,'[-1,-2,-2]','[-4,2,3]',null);
insert into t1 values(5,'[-1,-3,-2]',null,'[2,3]');
select  * from t1 where vector_norm(c3) like '%0%' order by vector_norm( [1,2,3])  limit 10;
c1	c2	c3	c4
1	[1,1,2]	[2,2,3]	[1,3]
2	[1,0,3]	[1,0,3]	[2,3]
3	[-1,2,2]	[-3,2,3]	[4,3]
4	[-1,-2,-2]	[-4,2,3]	NULL
select  * from t1 where vector_norm(c3) like vector_norm(c3) order by l2_distance(c3, [1,2,3]) approximate limit 10;
c1	c2	c3	c4
1	[1,1,2]	[2,2,3]	[1,3]
2	[1,0,3]	[1,0,3]	[2,3]
3	[-1,2,2]	[-3,2,3]	[4,3]
4	[-1,-2,-2]	[-4,2,3]	NULL
select  * from t1 where vector_norm(c3) not like '%1%' order by c1;
c1	c2	c3	c4
select  * from t1 where vector_norm(c3) not like vector_norm(c2) order by c1;
c1	c2	c3	c4
1	[1,1,2]	[2,2,3]	[1,3]
3	[-1,2,2]	[-3,2,3]	[4,3]
4	[-1,-2,-2]	[-4,2,3]	NULL
##exists,any,all,in(无关键字)
drop table if exists t1;
CREATE TABLE t1 (c1 int primary key, c2 VARCHAR(30),c3 vector(3) ,c4 vector(3),
VECTOR INDEX vector_idx(c3) 
WITH (distance=l2, lib=vsag, type=hnsw, m=10, ef_construction=100, ef_search=40));
insert into t1 values(1,'[1,1,2]','[2,2,3]','[1,3,2]');
insert into t1 values(2,'[1,0,3]','[1,0,3]','[2,3,2]');
insert into t1 values(3,'[-1,2,2]','[-3,2,3]','[4,3,3]');
insert into t1 values(4,'[-1,-2,-2]','[-4,2,3]',null);
insert into t1 values(5,'[-1,-3,-2]',null,'[2,3,1]');
SELECT vector_norm(c3) from t1 where  EXISTS (SELECT vector_norm([1,null,1]) FROM t1) order by c1;
vector_norm(c3)
4.123105625617661
3.1622776601683795
4.69041575982343
5.385164807134504
NULL
SELECT c3 from t1 where  EXISTS (SELECT c3 FROM t1) order by c1;
c3
[2,2,3]
[1,0,3]
[-3,2,3]
[-4,2,3]
NULL
SELECT vector_norm(c3) from t1 where vector_norm(c3) = any (SELECT vector_norm(c3) FROM t1) order by c1;
vector_norm(c3)
4.123105625617661
3.1622776601683795
4.69041575982343
5.385164807134504
SELECT vector_norm(c3) from t1 where vector_norm(c3) >= any (SELECT vector_norm(c3) FROM t1) order by c1;
vector_norm(c3)
4.123105625617661
3.1622776601683795
4.69041575982343
5.385164807134504
SELECT vector_norm(c3) from t1 where vector_norm(c3) <= any (SELECT vector_norm(c3) FROM t1) order by c1;
vector_norm(c3)
4.123105625617661
3.1622776601683795
4.69041575982343
5.385164807134504
SELECT vector_norm(c3) from t1 where vector_norm(c3) <> any (SELECT vector_norm(c3) FROM t1) order by c1;
vector_norm(c3)
4.123105625617661
3.1622776601683795
4.69041575982343
5.385164807134504
SELECT vector_norm(c3) from t1 where vector_norm(c3) != any (SELECT vector_norm(c3) FROM t1) order by c1;
vector_norm(c3)
4.123105625617661
3.1622776601683795
4.69041575982343
5.385164807134504
SELECT vector_norm(c3) from t1 where vector_norm(c3) > any (SELECT vector_norm(c3) FROM t1) order by c1;
vector_norm(c3)
4.123105625617661
4.69041575982343
5.385164807134504
SELECT vector_norm(c3) from t1 where vector_norm(c3) < any (SELECT vector_norm(c3) FROM t1) order by c1;
vector_norm(c3)
4.123105625617661
3.1622776601683795
4.69041575982343
SELECT vector_norm(c3) from t1 where  EXISTS (SELECT vector_norm(c3) FROM t1) order by c1;
vector_norm(c3)
4.123105625617661
3.1622776601683795
4.69041575982343
5.385164807134504
NULL
SELECT c3 from t1 where  EXISTS (SELECT c3 FROM t1) order by c1;
c3
[2,2,3]
[1,0,3]
[-3,2,3]
[-4,2,3]
NULL
SELECT vector_norm(c3) from t1 where vector_norm(c3) = any (SELECT vector_norm(c3) FROM t1) order by c1;
vector_norm(c3)
4.123105625617661
3.1622776601683795
4.69041575982343
5.385164807134504
SELECT vector_norm(c3) from t1 where vector_norm(c3) >= any (SELECT vector_norm(c3) FROM t1) order by c1;
vector_norm(c3)
4.123105625617661
3.1622776601683795
4.69041575982343
5.385164807134504
SELECT vector_norm(c3) from t1 where vector_norm(c3) <= any (SELECT vector_norm(c3) FROM t1) order by c1;
vector_norm(c3)
4.123105625617661
3.1622776601683795
4.69041575982343
5.385164807134504
SELECT vector_norm(c3) from t1 where vector_norm(c3) <> any (SELECT vector_norm(c3) FROM t1) order by c1;
vector_norm(c3)
4.123105625617661
3.1622776601683795
4.69041575982343
5.385164807134504
SELECT vector_norm(c3) from t1 where vector_norm(c3) != any (SELECT vector_norm(c3) FROM t1) order by c1;
vector_norm(c3)
4.123105625617661
3.1622776601683795
4.69041575982343
5.385164807134504
SELECT vector_norm(c3) from t1 where vector_norm(c3) > any (SELECT vector_norm(c3) FROM t1) order by c1;
vector_norm(c3)
4.123105625617661
4.69041575982343
5.385164807134504
SELECT vector_norm(c3) from t1 where vector_norm(c3) < any (SELECT vector_norm(c3) FROM t1) order by c1;
vector_norm(c3)
4.123105625617661
3.1622776601683795
4.69041575982343
SELECT vector_norm(c3) from t1 where vector_norm(c3) = all (SELECT vector_norm(c3) FROM t1) order by c1;
vector_norm(c3)
SELECT vector_norm(c3) from t1 where vector_norm(c3) >= all (SELECT vector_norm(c3) FROM t1) order by c1;
vector_norm(c3)
SELECT vector_norm(c3) from t1 where vector_norm(c3) <= all (SELECT vector_norm(c3) FROM t1) order by c1;
vector_norm(c3)
SELECT vector_norm(c3) from t1 where vector_norm(c3) <> all (SELECT vector_norm(c3) FROM t1) order by c1;
vector_norm(c3)
SELECT vector_norm(c3) from t1 where vector_norm(c3) != all (SELECT vector_norm(c3) FROM t1) order by c1;
vector_norm(c3)
SELECT vector_norm(c3) from t1 where vector_norm(c3) > all (SELECT vector_norm(c3) FROM t1) order by c1;
vector_norm(c3)
SELECT vector_norm(c3) from t1 where vector_norm(c3) < all (SELECT vector_norm(c3) FROM t1) order by c1;
vector_norm(c3)
SELECT vector_norm(c3) from t1 where vector_norm(c3) in (vector_norm(c3),vector_norm(c3)) order by c1;
vector_norm(c3)
4.123105625617661
3.1622776601683795
4.69041575982343
5.385164807134504
SELECT vector_norm(c3) from t1 where vector_norm(c3) not in (vector_norm(c3),vector_norm(c4)) order by c1;
vector_norm(c3)
SELECT vector_norm(c3) from t1 where vector_norm(c3) not in (SELECT vector_norm(c3)FROM t1) order by c1;
vector_norm(c3)
##exists,any,all,in(存在关键字APPROXIMATE|APPROX)
drop table if exists t1;
CREATE TABLE t1 (c1 int primary key, c2 VARCHAR(30),c3 vector(3) ,c4 vector(3),
VECTOR INDEX vector_idx(c3) 
WITH (distance=l2, lib=vsag, type=hnsw, m=10, ef_construction=100, ef_search=40));
insert into t1 values(1,'[1,1,2]','[2,2,3]','[1,3,2]');
insert into t1 values(2,'[1,0,3]','[1,0,3]','[2,3,2]');
insert into t1 values(3,'[-1,2,2]','[-3,2,3]','[4,3,3]');
insert into t1 values(4,'[-1,-2,-2]','[-4,2,3]',null);
insert into t1 values(5,'[-1,-3,-2]',null,'[2,3,1]');
SELECT vector_norm(c3) from t1 where  EXISTS (SELECT vector_norm([1,1,1]) FROM t1 order by vector_norm([1,2,3])  limit 10 ) order by c1;
vector_norm(c3)
4.123105625617661
3.1622776601683795
4.69041575982343
5.385164807134504
NULL
SELECT vector_norm(c3) from t1 where  EXISTS (SELECT vector_norm([1,1,1]) FROM t1 order by l2_distance(c3,[1,2,3]) approximate limit 10 ) order by c1;
vector_norm(c3)
4.123105625617661
3.1622776601683795
4.69041575982343
5.385164807134504
NULL
SELECT c3 from t1 where  EXISTS (SELECT c3 FROM t1 order by vector_norm(c3, [1,2,3]) approximate limit 10 ) order by c1;
ERROR 42000: Incorrect parameter count in the call to native function 'vector_norm'
SELECT vector_norm(c3) from t1 where vector_norm(c3) = any (SELECT vector_norm(c3) FROM t1 order by l2_distance(c3, [1,2,3]) approximate limit 10) order by c1;
vector_norm(c3)
4.123105625617661
3.1622776601683795
4.69041575982343
5.385164807134504
SELECT vector_norm(c3) from t1 where vector_norm(c3) >= any (SELECT vector_norm(c3) FROM t1 order by l2_distance(c3, [1,2,3]) approximate limit 10 ) order by c1;
vector_norm(c3)
4.123105625617661
3.1622776601683795
4.69041575982343
5.385164807134504
SELECT vector_norm(c3) from t1 where vector_norm(c3) <= any (SELECT vector_norm(c3) FROM t1 order by l2_distance(c3, [1,2,3]) approximate limit 10 ) order by c1;
vector_norm(c3)
4.123105625617661
3.1622776601683795
4.69041575982343
5.385164807134504
SELECT vector_norm(c3) from t1 where vector_norm(c3) <> any (SELECT vector_norm(c3) FROM t1 order by l2_distance(c3, [1,2,3]) approximate limit 10 ) order by c1;
vector_norm(c3)
4.123105625617661
3.1622776601683795
4.69041575982343
5.385164807134504
SELECT vector_norm(c3) from t1 where vector_norm(c3) != any (SELECT vector_norm(c3) FROM t1 order by l2_distance(c3, [1,2,3]) approximate limit 10 ) order by c1;
vector_norm(c3)
4.123105625617661
3.1622776601683795
4.69041575982343
5.385164807134504
SELECT vector_norm(c3) from t1 where vector_norm(c3) > any (SELECT vector_norm(c3) FROM t1 order by l2_distance(c3, [1,2,3]) approximate limit 10 ) order by c1;
vector_norm(c3)
4.123105625617661
4.69041575982343
5.385164807134504
SELECT vector_norm(c3) from t1 where vector_norm(c3) < any (SELECT vector_norm(c3) FROM t1 order by l2_distance(c3, [1,2,3]) approximate limit 10 ) order by c1;
vector_norm(c3)
4.123105625617661
3.1622776601683795
4.69041575982343
SELECT vector_norm(c3) from t1 where vector_norm(c3) in (vector_norm(c3),vector_norm(c3)) order by vector_norm(c3, [1,2,3]) approximate limit 10;
ERROR 42000: Incorrect parameter count in the call to native function 'vector_norm'
SELECT vector_norm(c3) from t1 where vector_norm(c3) not in (vector_norm(c3,'[1,2,3]'),vector_norm(c4,'[1,2,3]')) order by vector_norm(c3, [1,2,3]) approximate limit 10;
ERROR 42000: Incorrect parameter count in the call to native function 'vector_norm'
SELECT vector_norm(c3) from t1 where vector_norm(c3) not in (SELECT vector_norm(c3,'[1,2,3]')FROM t1 order by vector_norm(c3, [1,2,3]) approximate limit 10 ) order by c1;
ERROR 42000: Incorrect parameter count in the call to native function 'vector_norm'
SELECT vector_norm(c3) from t1 where vector_norm(c3) not in (vector_norm([1,2,3]),vector_norm([1,2,3])) order by vector_norm(c3)  limit 10;
vector_norm(c3)
3.1622776601683795
4.123105625617661
4.69041575982343
5.385164807134504
SELECT vector_norm(c3) from t1 where vector_norm(c3) not in (SELECT vector_norm([1,2,3])FROM t1 where c3 is not null order by vector_norm(c3)  limit 10 ) order by c1;
vector_norm(c3)
4.123105625617661
3.1622776601683795
4.69041575982343
5.385164807134504
SELECT vector_norm(c3) from t1 where vector_norm(c3) not in (SELECT vector_norm([1,2,3])FROM t1 where c3 is not null order by l2_distance(c3, [1,2,3]) approximate limit 10 ) order by c1;
vector_norm(c3)
4.123105625617661
3.1622776601683795
4.69041575982343
5.385164807134504
##多表join
drop table if exists t1;
CREATE TABLE t1 (c1 int primary key, c2 vector(3),c3 vector(3) ,c4 vector(3));
insert into t1 values(1,'[1,1,2]','[2,2,3]','[1,3,2]');
insert into t1 values(2,'[1,0,3]','[1,0,3]','[2,3,2]');
insert into t1 values(3,'[-1,2,2]','[-3,2,3]','[4,3,3]');
insert into t1 values(4,'[-1,-2,-2]','[-4,2,3]',null);
insert into t1 values(5,'[-1,-3,-2]',null,'[2,3,1]');
drop table if exists t2;
CREATE TABLE t2 (a1 int , a2 vector(3),a3 vector(3) ,a4 vector(3));
insert into t2 select c1,c2,c3,c4 from t1;
select vector_norm([1,2,3]) from t1 union  select vector_norm([1,2,3]) from t2;
vector_norm([1,2,3])
3.7416573867739413
##结合聚合函数使用关键字
drop table if exists t1;
CREATE TABLE t1 (c1 int primary key, c2 vector(3),c3 vector(3) ,c4 vector(3),
VECTOR INDEX vector_idx(c3) 
WITH (distance=l2, lib=vsag, type=hnsw, m=10, ef_construction=100, ef_search=40));
insert into t1 values(1,'[1,1,2]','[2,2,3]','[1,3,2]');
insert into t1 values(2,'[1,0,3]','[1,0,3]','[2,3,2]');
insert into t1 values(3,'[-1,2,2]','[-3,2,3]','[4,3,3]');
insert into t1 values(4,'[-1,-2,-2]','[-4,2,3]',null);
insert into t1 values(5,'[-1,-3,-2]',null,'[2,3,1]');
select c1,c2,vector_norm(c3),count(c2) from t1 order by l2_distance(c3, [1,2,3]) APPROX limit 10;
c1	c2	vector_norm(c3)	count(c2)
1	[1,1,2]	4.123105625617661	5
select c1,c2,vector_norm(c3),avg(c2) from t1 order by l2_distance(c3, [1,2,3]) APPROX limit 10;
c1	c2	vector_norm(c3)	avg(c2)
1	[1,1,2]	4.123105625617661	[-0.2,-0.4,0.6]
select c1,c2,vector_norm(c3),sum(c2) from t1 order by l2_distance(c3, [1,2,3]) APPROX limit 10;
c1	c2	vector_norm(c3)	sum(c2)
1	[1,1,2]	4.123105625617661	[-1,-2,3]
select  vector_norm(c2) from t1 order by l2_distance(c3, [1,2,3]) APPROX limit 10;
vector_norm(c2)
2.449489742783178
3.1622776601683795
3
3
select c1,c2,vector_norm(c3) from t1 order by l2_distance(c3, [1,2,3]) APPROX limit 10;
c1	c2	vector_norm(c3)
1	[1,1,2]	4.123105625617661
2	[1,0,3]	3.1622776601683795
3	[-1,2,2]	4.69041575982343
4	[-1,-2,-2]	5.385164807134504
drop table if exists t1;
CREATE TABLE t1 (c1 int primary key, c2 vector(3),c3 vector(3) ,c4 vector(3),
VECTOR INDEX vector_idx(c3) 
WITH (distance=l2, lib=vsag, type=hnsw, m=10, ef_construction=100, ef_search=40));
insert into t1 values(1,'[1,1,2]','[2,2,3]','[1,3,2]');
insert into t1 values(2,'[1,0,3]','[1,0,3]','[2,3,2]');
insert into t1 values(3,'[-1,2,2]','[-3,2,3]','[4,3,3]');
insert into t1 values(4,'[-1,-2,-2]','[-4,2,3]',null);
insert into t1 values(5,'[-1,-3,-2]',null,'[2,3,1]');
drop table if exists t2;
CREATE TABLE t2 (a1 int , a2 vector(3),a3 vector(3) ,a4 vector(3),
VECTOR INDEX vector_idx(a3) 
WITH (distance=l2, lib=vsag, type=hnsw, m=10, ef_construction=100, ef_search=40));
insert into t2 select c1,c2,c3,c4 from t1;
select * from t1 a join t2 b on vector_norm(c3+a2)=vector_norm(a3+c2) order by l2_distance(c3, [1,2,3]) approximate limit 10;
c1	c2	c3	c4	a1	a2	a3	a4
1	[1,1,2]	[2,2,3]	[1,3,2]	1	[1,1,2]	[2,2,3]	[1,3,2]
2	[1,0,3]	[1,0,3]	[2,3,2]	2	[1,0,3]	[1,0,3]	[2,3,2]
3	[-1,2,2]	[-3,2,3]	[4,3,3]	3	[-1,2,2]	[-3,2,3]	[4,3,3]
4	[-1,-2,-2]	[-4,2,3]	NULL	4	[-1,-2,-2]	[-4,2,3]	NULL
select * from t1 a join t2 b on vector_norm(c3+[1,10,-1000])=vector_norm(a3+[1,10,-1000]) order by l2_distance(c3, [1,100,-10000]) approximate limit 2;
c1	c2	c3	c4	a1	a2	a3	a4
1	[1,1,2]	[2,2,3]	[1,3,2]	4	[-1,-2,-2]	[-4,2,3]	NULL
1	[1,1,2]	[2,2,3]	[1,3,2]	1	[1,1,2]	[2,2,3]	[1,3,2]
select * from t1 a join t2 b on vector_norm(c3+[1,10,-1000])=vector_norm(a3+[1,10,-1000]) order by l2_distance(c3, [1,100,-10000])  limit 2;
c1	c2	c3	c4	a1	a2	a3	a4
1	[1,1,2]	[2,2,3]	[1,3,2]	4	[-1,-2,-2]	[-4,2,3]	NULL
1	[1,1,2]	[2,2,3]	[1,3,2]	1	[1,1,2]	[2,2,3]	[1,3,2]
select * from t1 a join t2 b on vector_norm(c3+a2)=vector_norm([1,1,1]) order by c1;
c1	c2	c3	c4	a1	a2	a3	a4
1	[1,1,2]	[2,2,3]	[1,3,2]	5	[-1,-3,-2]	NULL	[2,3,1]
drop table if exists t1;
CREATE TABLE t1 (c1 int primary key, c2 vector(3),c3 vector(3) ,c4 vector(3),
VECTOR INDEX vector_idx(c3) 
WITH (distance=l2, lib=vsag, type=hnsw, m=10, ef_construction=100, ef_search=40));
insert into t1 values(1,'[1,1,2]','[2,2,3]','[1,3,2]');
insert into t1 values(2,'[1,0,3]','[1,0,3]','[2,3,2]');
insert into t1 values(3,'[-1,2,2]','[-3,2,3]','[4,3,3]');
insert into t1 values(4,'[-1,-2,-2]','[-4,2,3]',null);
insert into t1 values(5,'[-1,-3,-2]',null,'[2,3,1]');
drop table if exists t2;
CREATE TABLE t2 (a1 int , a2 vector(3),a3 vector(3) ,a4 vector(3),
VECTOR INDEX vector_idx(a3) 
WITH (distance=l2, lib=vsag, type=hnsw, m=10, ef_construction=100, ef_search=40));
insert into t2 select c1,c2,c3,c4 from t1;
select * from t1 a  order by vector_norm(a.c3)  limit 10;
c1	c2	c3	c4
5	[-1,-3,-2]	NULL	[2,3,1]
2	[1,0,3]	[1,0,3]	[2,3,2]
1	[1,1,2]	[2,2,3]	[1,3,2]
3	[-1,2,2]	[-3,2,3]	[4,3,3]
4	[-1,-2,-2]	[-4,2,3]	NULL
select c1,c2,c3,vector_norm(a3) from t1 a join t2 b on c2=a2  order by vector_norm(a3);
c1	c2	c3	vector_norm(a3)
5	[-1,-3,-2]	NULL	NULL
2	[1,0,3]	[1,0,3]	3.1622776601683795
1	[1,1,2]	[2,2,3]	4.123105625617661
3	[-1,2,2]	[-3,2,3]	4.69041575982343
4	[-1,-2,-2]	[-4,2,3]	5.385164807134504
select c1,c2,c3,vector_norm(a3) from t1 a join t2 b on vector_norm(c3)=vector_norm(a3)  order by vector_norm(a3);
c1	c2	c3	vector_norm(a3)
2	[1,0,3]	[1,0,3]	3.1622776601683795
1	[1,1,2]	[2,2,3]	4.123105625617661
3	[-1,2,2]	[-3,2,3]	4.69041575982343
4	[-1,-2,-2]	[-4,2,3]	5.385164807134504
select c1,c2,c3,vector_norm(a3) from t1 a inner join t2 b on vector_norm(c3)=vector_norm(a3)  order by vector_norm(a3);
c1	c2	c3	vector_norm(a3)
2	[1,0,3]	[1,0,3]	3.1622776601683795
1	[1,1,2]	[2,2,3]	4.123105625617661
3	[-1,2,2]	[-3,2,3]	4.69041575982343
4	[-1,-2,-2]	[-4,2,3]	5.385164807134504
select c1,c2,c3,vector_norm(a3) from t1 a right join t2 b on vector_norm(c3)=vector_norm(a3)  order by vector_norm(a3);
c1	c2	c3	vector_norm(a3)
NULL	NULL	NULL	NULL
2	[1,0,3]	[1,0,3]	3.1622776601683795
1	[1,1,2]	[2,2,3]	4.123105625617661
3	[-1,2,2]	[-3,2,3]	4.69041575982343
4	[-1,-2,-2]	[-4,2,3]	5.385164807134504
select c1,c2,c3,vector_norm(a3) from t1 a left join t2 b on vector_norm(c3)=vector_norm(a3)  order by vector_norm(a3);
c1	c2	c3	vector_norm(a3)
5	[-1,-3,-2]	NULL	NULL
2	[1,0,3]	[1,0,3]	3.1622776601683795
1	[1,1,2]	[2,2,3]	4.123105625617661
3	[-1,2,2]	[-3,2,3]	4.69041575982343
4	[-1,-2,-2]	[-4,2,3]	5.385164807134504
select c1,c2,c3,vector_norm(a3) from t1 a cross  join t2 b on vector_norm(c3)=vector_norm(a3)  order by vector_norm(a3);
c1	c2	c3	vector_norm(a3)
2	[1,0,3]	[1,0,3]	3.1622776601683795
1	[1,1,2]	[2,2,3]	4.123105625617661
3	[-1,2,2]	[-3,2,3]	4.69041575982343
4	[-1,-2,-2]	[-4,2,3]	5.385164807134504
select c1,c2,c3,vector_norm(a3) from t1 a join t2 b on vector_norm(a4)=vector_norm(a3)  order by vector_norm(a3);
c1	c2	c3	vector_norm(a3)
select c1,c2,c3,vector_norm(a3) from t1 a inner join t2 b on vector_norm(a4)=vector_norm(a3)  order by vector_norm(a3);
c1	c2	c3	vector_norm(a3)
select c1,c2,c3,vector_norm(a3) from t1 a right join t2 b on vector_norm(a4)=vector_norm(a3)  order by vector_norm(a3);
c1	c2	c3	vector_norm(a3)
NULL	NULL	NULL	NULL
NULL	NULL	NULL	3.1622776601683795
NULL	NULL	NULL	4.123105625617661
NULL	NULL	NULL	4.69041575982343
NULL	NULL	NULL	5.385164807134504
select c1,c2,c3,vector_norm(a3) from t1 a left join t2 b on vector_norm(a4)=vector_norm(a3)  order by vector_norm(a3);
c1	c2	c3	vector_norm(a3)
1	[1,1,2]	[2,2,3]	NULL
2	[1,0,3]	[1,0,3]	NULL
3	[-1,2,2]	[-3,2,3]	NULL
4	[-1,-2,-2]	[-4,2,3]	NULL
5	[-1,-3,-2]	NULL	NULL
select c1,c2,c3,vector_norm(a3) from t1 a cross  join t2 b on vector_norm(a4)=vector_norm(a3)  order by vector_norm(a3);
c1	c2	c3	vector_norm(a3)
select vector_norm(c3) from t1  union all select vector_norm(a2) from t2 ;
vector_norm(c3)
4.123105625617661
3.1622776601683795
4.69041575982343
5.385164807134504
NULL
2.449489742783178
3.1622776601683795
3
3
3.7416573867739413
select vector_norm(c3) from t1  union  select vector_norm(a3) from t2 ;
vector_norm(c3)
4.123105625617661
3.1622776601683795
4.69041575982343
5.385164807134504
NULL
##order by 
drop table if exists t1;
CREATE TABLE t1 (c1 int primary key, c2 vector(3),c3 vector(3) ,c4 vector(3),
VECTOR INDEX vector_idx(c3) 
WITH (distance=l2, lib=vsag, type=hnsw, m=10, ef_construction=100, ef_search=40));
insert into t1 values(1,'[1,1,2]','[2,2,3]','[1,3,2]');
insert into t1 values(2,'[1,0,3]','[1,0,3]','[2,3,2]');
insert into t1 values(3,'[-1,2,2]','[-3,2,3]','[4,3,3]');
insert into t1 values(4,'[-1,-2,-2]','[-4,2,3]',null);
insert into t1 values(5,'[-1,-3,-2]',null,'[2,3,1]');
select c1,c2,vector_norm(c3) from t1 order by vector_norm(c3+[1,2,3])  limit 10;
c1	c2	vector_norm(c3)
5	[-1,-3,-2]	NULL
2	[1,0,3]	3.1622776601683795
3	[-1,2,2]	4.69041575982343
1	[1,1,2]	4.123105625617661
4	[-1,-2,-2]	5.385164807134504
select c1,c2,vector_norm(c3) from t1 order by vector_norm(c3+c2)  limit 10;
c1	c2	vector_norm(c3)
5	[-1,-3,-2]	NULL
4	[-1,-2,-2]	5.385164807134504
2	[1,0,3]	3.1622776601683795
1	[1,1,2]	4.123105625617661
3	[-1,2,2]	4.69041575982343
select c1,c2,vector_norm(c2),vector_norm(c3+c4) from t1 order by vector_norm(c3+c4) ;
c1	c2	vector_norm(c2)	vector_norm(c3+c4)
4	[-1,-2,-2]	3	NULL
5	[-1,-3,-2]	3.7416573867739413	NULL
2	[1,0,3]	3.1622776601683795	6.557438524302
1	[1,1,2]	2.449489742783178	7.681145747868608
3	[-1,2,2]	3	7.874007874011811
select c1,c2,vector_norm(c2) from t1 order by l2_distance(c3,[1,2,3]) APPROX limit 10;
c1	c2	vector_norm(c2)
1	[1,1,2]	2.449489742783178
2	[1,0,3]	3.1622776601683795
3	[-1,2,2]	3
4	[-1,-2,-2]	3
select c1,c2,vector_norm(c2) from t1 order by vector_norm(c3+c4) ;
c1	c2	vector_norm(c2)
4	[-1,-2,-2]	3
5	[-1,-3,-2]	3.7416573867739413
2	[1,0,3]	3.1622776601683795
1	[1,1,2]	2.449489742783178
3	[-1,2,2]	3
drop table if exists t2;
CREATE TABLE t2 (a1 int , a2 vector(3),a3 vector(3) ,a4 vector(3));
insert into t2 select c1,c2,c3,c4 from t1;
select * from t1 a join t2 b on vector_norm(c2+a3)=vector_norm(a2+c2) order by c1;
c1	c2	c3	c4	a1	a2	a3	a4
1	[1,1,2]	[2,2,3]	[1,3,2]	2	[1,0,3]	[1,0,3]	[2,3,2]
2	[1,0,3]	[1,0,3]	[2,3,2]	2	[1,0,3]	[1,0,3]	[2,3,2]
3	[-1,2,2]	[-3,2,3]	[4,3,3]	2	[1,0,3]	[1,0,3]	[2,3,2]
4	[-1,-2,-2]	[-4,2,3]	NULL	2	[1,0,3]	[1,0,3]	[2,3,2]
5	[-1,-3,-2]	NULL	[2,3,1]	2	[1,0,3]	[1,0,3]	[2,3,2]
##group by /having
drop table if exists t1;
CREATE TABLE t1 (c1 int primary key, c2 VARCHAR(30),c3 vector(3) ,c4 vector(3),
VECTOR INDEX vector_idx(c3) 
WITH (distance=l2, lib=vsag, type=hnsw, m=10, ef_construction=100, ef_search=40));
insert into t1 values(1,'[1,1,2]','[2,2,3]','[1,3,2]');
insert into t1 values(2,'[1,0,3]','[1,0,3]','[2,3,2]');
insert into t1 values(3,'[-1,2,2]','[-3,2,3]','[4,3,3]');
insert into t1 values(4,'[-1,-2,-2]','[-4,2,3]',null);
insert into t1 values(5,'[-1,-3,-2]',null,'[2,3,1]');
select vector_norm(c3) from t1  group by vector_norm(c3) order by c1;
vector_norm(c3)
4.123105625617661
3.1622776601683795
4.69041575982343
5.385164807134504
NULL
select vector_norm(c2) from t1  group by vector_norm([1,2,3]) order by l2_distance(c3, [1,2,3]) APPROX limit 10;
vector_norm(c2)
2.449489742783178
select vector_norm(c2) from t1  group by vector_norm([1,2,3]) order by l2_distance(c3, [1,2,3]) APPROX limit 1000000;
ERROR 0A000: Not supported feature or function
select vector_norm(c3) from t1  group by c2 ;
vector_norm(c3)
4.123105625617661
3.1622776601683795
4.69041575982343
5.385164807134504
NULL
select vector_norm(c3) from t1  group by vector_norm(c2) order by c1;
vector_norm(c3)
4.123105625617661
3.1622776601683795
4.69041575982343
NULL
select vector_norm(c3+c2) from t1  group by vector_norm([1,2,3]) order by c1;
vector_norm(c3+c2)
6.557438524302
select vector_norm(c3+c2) from t1  group by vector_norm(c2) order by vector_norm(c2);
vector_norm(c3+c2)
6.557438524302
7.54983443527075
6.324555320336759
NULL
select vector_norm(c3+c2) from t1  group by vector_norm(c3) having max(c1);
vector_norm(c3+c2)
6.557438524302
6.324555320336759
7.54983443527075
5.0990195135927845
NULL
select vector_norm(c3+c2) from t1  group by vector_norm(c3) having min(c1);
vector_norm(c3+c2)
6.557438524302
6.324555320336759
7.54983443527075
5.0990195135927845
NULL
select vector_norm(c3+c2) from t1  group by vector_norm(c3) having vector_norm(c3);
ERROR 42S22: Unknown column 'c3' in 'having clause'
select vector_norm(c3+c2) from t1  group by vector_norm(c3) having sum(c4);
ERROR 22000: Invalid data type for the operation
select vector_norm(c3+c2) from t1  group by vector_norm(c3) having vector_norm([1,2,3]);
vector_norm(c3+c2)
6.557438524302
6.324555320336759
7.54983443527075
5.0990195135927845
NULL
select vector_norm(c3+c2) from t1  group by vector_norm(c3) having vector_norm(null);
vector_norm(c3+c2)
##运算符(+-*支持 ，除不支持)
select vector_norm([1]+[1]) * 1 from dual;
vector_norm([1]+[1]) * 1
2
select [1] + vector_norm([1,1]+[1,1]) from dual;
ERROR 22000: Invalid data type for the operation
select vector_norm([1]+[1]) / 3 from dual;
vector_norm([1]+[1]) / 3
0.6666666666666666
select vector_norm([1]+[1]) - 3 from dual;
vector_norm([1]+[1]) - 3
-1
drop table if exists t1;
CREATE TABLE t1 (c1 int primary key, c2 vector(3),c3 vector(3) ,c4 vector(3),
VECTOR INDEX vector_idx(c3) 
WITH (distance=l2, lib=vsag, type=hnsw, m=10, ef_construction=100, ef_search=40));
insert into t1 values(1,'[1,1,2]','[2,2,3]','[1,3,2]');
insert into t1 values(2,'[1,0,3]','[1,0,3]','[2,3,2]');
insert into t1 values(3,'[-1,2,2]','[-3,2,3]','[4,3,3]');
select  vector_norm(c4)+vector_norm(c4)+vector_norm(c4) a from t1;
a
11.224972160321824
12.36931687685298
17.492855684535904
select  vector_norm(c4)*vector_norm(c4)+vector_norm(c4) a from t1;
a
17.74165738677394
21.12310562561766
39.8309518948453
select  vector_norm(c4)/vector_norm(c4)+vector_norm(c4) a from t1;
a
4.741657386773941
5.123105625617661
6.830951894845301
select distinct vector_norm(c4)/vector_norm(c4)+vector_norm(c4) from t1;
vector_norm(c4)/vector_norm(c4)+vector_norm(c4)
4.741657386773941
5.123105625617661
6.830951894845301
drop table if exists t1;
CREATE TABLE t1 (c1 int primary key, c2 VARCHAR(30),c3 vector(3) ,c4 vector(3),
VECTOR INDEX vector_idx(c3) 
WITH (distance=l2, lib=vsag, type=hnsw, m=10, ef_construction=100, ef_search=40));
insert into t1 values(1,'[1,1,2]','[2,2,3]','[1,3,2]');
insert into t1 values(2,'[1,0,3]','[1,0,3]','[2,3,2]');
insert into t1 values(3,'[-1,2,2]','[-3,2,3]','[4,3,3]');
insert into t1 values(4,'[-1,-2,-2]','[-4,2,3]',null);
insert into t1 values(5,'[-1,-3,-2]',null,'[2,3,1]');
select vector_norm(c4) / 0 from t1;
vector_norm(c4) / 0
NULL
NULL
NULL
NULL
NULL
select vector_norm(c4) / 10 from t1 order by c1;
vector_norm(c4) / 10
0.3741657386773941
0.41231056256176607
0.5830951894845301
NULL
0.3741657386773941
select vector_norm(c4) / 1.5 from t1;
vector_norm(c4) / 1.5
2.494438257849294
2.748737083745107
3.8873012632302006
NULL
2.494438257849294
select vector_norm(c4) * 10 from t1;
vector_norm(c4) * 10
37.416573867739416
41.23105625617661
58.309518948453004
NULL
37.416573867739416
select vector_norm(c4) * 1.5 from t1;
vector_norm(c4) * 1.5
5.612486080160912
6.18465843842649
8.746427842267952
NULL
5.612486080160912
select vector_norm(c4) - 10 from t1;
vector_norm(c4) - 10
-6.258342613226059
-5.876894374382339
-4.169048105154699
NULL
-6.258342613226059
select vector_norm(c4) - 1.5 from t1;
vector_norm(c4) - 1.5
2.2416573867739413
2.6231056256176606
4.330951894845301
NULL
2.2416573867739413
select vector_norm(c4) + 10 from t1;
vector_norm(c4) + 10
13.74165738677394
14.123105625617661
15.8309518948453
NULL
13.74165738677394
select vector_norm(c4) + 1.5 from t1;
vector_norm(c4) + 1.5
5.241657386773941
5.623105625617661
7.330951894845301
NULL
5.241657386773941
##cast
drop table if exists t1;
CREATE TABLE t1 (c1 int primary key, c2 vector(3),c3 vector(3) ,c4 vector(3),
VECTOR INDEX vector_idx(c3) 
WITH (distance=l2, lib=vsag, type=hnsw, m=10, ef_construction=100, ef_search=40));
insert into t1 values(1,'[1,1,2]','[2,2,3]','[1,3,2]');
insert into t1 values(2,'[1,0,3]','[1,0,3]','[2,3,2]');
insert into t1 values(3,'[-1,2,2]','[-3,2,3]','[4,3,3]');
insert into t1 values(4,'[-1,-2,-2]','[-4,2,3]',null);
insert into t1 values(5,'[-1,-3,-2]',null,'[2,3,1]');
drop table if exists t2;
CREATE TABLE t2 (a1 int primary key, a2 vector(3),a3 vector(3) ,a4 vector(3));
insert into t2 select c1,c2,c3,c4 from t1;
select cast(vector_norm(c2) as char(1)) from t1 order by c1 limit 1;
cast(vector_norm(c2) as char(1))
2
select cast(vector_norm(c2) as char(10)) from t1 order by c1 limit 1;
cast(vector_norm(c2) as char(10))
2.44948974
select cast(vector_norm(c2) as BINARY(1)) from t1 order by c1 limit 1;
cast(vector_norm(c2) as BINARY(1))
2
select cast(vector_norm(c2) as BINARY(10)) from t1 order by c1 limit 1;
cast(vector_norm(c2) as BINARY(10))
2.44948974
select cast(vector_norm(c2) as vector(3)) from t1 order by c1 limit 1;
ERROR 42000: You have an error in your SQL syntax; check the manual that corresponds to your OceanBase version for the right syntax to use near 'vector(3)) from t1 order by c1 limit 1' at line 1
select cast(vector_norm(c2) as UNSIGNED) from t1 order by c1 limit 1;
cast(vector_norm(c2) as UNSIGNED)
2
select cast(vector_norm(c2) as SIGNED) from t1 order by c1 limit 1;
cast(vector_norm(c2) as SIGNED)
2
select cast(vector_norm(c2) as FLOAT) from t1 order by c1 limit 1;
cast(vector_norm(c2) as FLOAT)
2.44949
select cast(vector_norm(c2) as double) from t1 order by c1 limit 1;
cast(vector_norm(c2) as double)
2.449489742783178
select cast(vector_norm(c2) as DECIMAL(10,2)) from t1 order by c1 limit 1;
cast(vector_norm(c2) as DECIMAL(10,2))
2.45
select cast(vector_norm(c2) as DEC(10,2)) from t1 order by c1 limit 1;
cast(vector_norm(c2) as DEC(10,2))
2.45
select cast(vector_norm(c2) as NUMERIC(10,2)) from t1 order by c1 limit 1;
cast(vector_norm(c2) as NUMERIC(10,2))
2.45
select cast(vector_norm(c2) as FIXED(10,2)) from t1 order by c1 limit 1;
cast(vector_norm(c2) as FIXED(10,2))
2.45
select cast(vector_norm(c2) as DATE) from t1 order by c1 limit 1;
cast(vector_norm(c2) as DATE)
NULL
select cast(vector_norm(c2) as DATETIME) from t1 order by c1 limit 1;
cast(vector_norm(c2) as DATETIME)
NULL
select cast(vector_norm(c2) as TIME) from t1 order by c1 limit 1;
cast(vector_norm(c2) as TIME)
00:00:02
select cast(vector_norm(c2) as YEAR) from t1 order by c1 limit 1;
cast(vector_norm(c2) as YEAR)
2002
select cast(vector_norm(c2) as YEAR),cast(vector_norm(c2) as YEAR) from t1 order by c1 limit 1;
cast(vector_norm(c2) as YEAR)	cast(vector_norm(c2) as YEAR)
2002	2002
drop table if exists tt1;
drop table if exists tt2;
drop table if exists ttt1;
create table tt1 select cast(vector_norm([1]) as json) from dual;
create table tt2 select cast(vector_norm([1]) as json) from dual;
create table ttt1 as select vector_norm([1,1,2]) a;
##distinct
select distinct c2 from t1 order By c1;
ERROR 22000: Invalid data type for the operation
select distinct vector_norm(c2), vector_norm(c4) from t1 order By c1;
vector_norm(c2)	vector_norm(c4)
2.449489742783178	3.7416573867739413
3.1622776601683795	4.123105625617661
3	5.830951894845301
3	NULL
3.7416573867739413	3.7416573867739413
SELECT COUNT(DISTINCT vector_norm(c2), vector_norm(c4)) FROM t1 order By c1;
COUNT(DISTINCT vector_norm(c2), vector_norm(c4))
4
SELECT COUNT(DISTINCT vector_norm([1,1,2]),vector_norm(c3)) FROM t1 order By c1;
COUNT(DISTINCT vector_norm([1,1,2]),vector_norm(c3))
4
##with as
drop table if exists t1;
CREATE TABLE t1 (c1 int primary key, c2 vector(3),c3 vector(3) ,c4 vector(3),
VECTOR INDEX vector_idx(c3) 
WITH (distance=l2, lib=vsag, type=hnsw, m=10, ef_construction=100, ef_search=40));
insert into t1 values(1,'[1,1,2]','[2,2,3]','[1,3,2]');
insert into t1 values(2,'[1,0,3]','[1,0,3]','[2,3,2]');
insert into t1 values(3,'[-1,2,2]','[-3,2,3]','[4,3,3]');
insert into t1 values(4,'[-1,-2,-2]','[-4,2,3]',null);
insert into t1 values(5,'[-1,-3,-2]',null,'[2,3,1]');
drop table if exists t2;
CREATE TABLE t2 (a1 int , a2 vector(3),a3 vector(3) ,a4 vector(3));
insert into t2 select c1,c2,c3,c4 from t1;
select * from t1 join t2 on vector_norm(c2)=vector_norm(a3) order by c1;
c1	c2	c3	c4	a1	a2	a3	a4
2	[1,0,3]	[1,0,3]	[2,3,2]	2	[1,0,3]	[1,0,3]	[2,3,2]
with ct1 as(
select vector_norm(c2) from t1 order by c1)
select vector_norm(c2) from t1 where c3 is not null order by c1 ;
vector_norm(c2)
2.449489742783178
3.1622776601683795
3
3
with ct1 as(
select vector_norm(c3) from t1 order by c1)
select vector_norm(c3) from t1 join t2 on vector_norm(c2)=vector_norm(a2) order by c1;
vector_norm(c3)
4.123105625617661
3.1622776601683795
4.69041575982343
4.69041575982343
5.385164807134504
5.385164807134504
NULL
with ct1 as(
select vector_norm([1,2,3]) from t1 order by c1)
select vector_norm(c3) from t1 join t2 on vector_norm(c2)=vector_norm(a2) order by c1;
vector_norm(c3)
4.123105625617661
3.1622776601683795
4.69041575982343
4.69041575982343
5.385164807134504
5.385164807134504
NULL
with CTE1 as(
select vector_norm(c2) a from t1 order by c1)
,CTE2 AS (
SELECT vector_norm(a2) b from t2 order by a1
)
select * from CTE1,CTE2  where a =3 and b=3  order by b;
a	b
3	3
3	3
3	3
3	3
drop table if exists t1;
CREATE TABLE t1 (c1 int primary key, c2 vector(3),c3 vector(3) ,c4 vector(3),
VECTOR INDEX vector_idx(c3) 
WITH (distance=l2, lib=vsag, type=hnsw, m=10, ef_construction=100, ef_search=40));
insert into t1 values(1,'[1,1,2]','[2,2,3]','[1,3,2]');
insert into t1 values(2,'[1,0,3]','[1,0,3]','[2,3,2]');
insert into t1 values(3,'[-1,2,2]','[-3,2,3]','[4,3,3]');
insert into t1 values(4,'[-1,-2,-2]','[-4,2,3]',null);
insert into t1 values(5,'[-1,-3,-2]',null,'[2,3,1]');
drop table if exists t2;
CREATE TABLE t2 (a1 int , a2 vector(3),a3 vector(3) ,a4 vector(3));
insert into t2 select c1,c2,c3,c4 from t1;
SELECT count(c1), CASE WHEN vector_norm(C2) > vector_norm([1,1,1]) THEN 'High' ELSE 'Low' END AS A FROM T1,t2 ;
count(c1)	A
25	High
SELECT count(*) FROM t1,t2 where vector_norm(t1.C2+t2.A2) > 0.5;
count(*)
25
SELECT t1.C1, 
CASE 
WHEN vector_norm(t1.C2+t2.A2) > 10 THEN 'Far'
           WHEN vector_norm(t1.C3+t2.A3) BETWEEN 5 AND 10 THEN 'Medium'
           ELSE 'Close'
       END AS distance_category,
avg(t1.C2) OVER (PARTITION BY t1.C1) AS avg_vector
FROM T1 t1
JOIN T2 t2 ON t1.C1 = t2.A1
WHERE vector_norm(t1.C2+t2.A2) <> 0.5;
C1	distance_category	avg_vector
1	Medium	[1,1,2]
2	Medium	[1,0,3]
3	Medium	[-1,2,2]
4	Close	[-1,-2,-2]
5	Close	[-1,-3,-2]
drop table if exists t1;
drop table if exists tt1;
CREATE TABLE t1 (c1 int primary key, c2 vector(3),c3 vector(3) ,c4 vector(3),
VECTOR INDEX vector_idx(c3) 
WITH (distance=l2, lib=vsag, type=hnsw, m=10, ef_construction=100, ef_search=40));
insert into t1 values(1,'[1,1,2]','[2,2,3]','[1,3,2]');
insert into t1 values(2,'[1,0,3]','[1,0,3]','[2,3,2]');
insert into t1 values(3,'[-1,2,2]','[-3,2,3]','[4,3,3]');
insert into t1 values(4,'[-1,-2,-2]','[-4,2,3]',null);
insert into t1 values(5,'[-1,-3,-2]',null,'[2,3,1]');
SELECT avg(t1.C2) OVER (PARTITION BY t1.C1) AS avg_vector FROM T1 ;
avg_vector
[1,1,2]
[1,0,3]
[-1,2,2]
[-1,-2,-2]
[-1,-3,-2]
create table tt1 as SELECT avg(t1.C2) OVER (PARTITION BY t1.C1) AS avg_vector FROM T1 ;
drop table if exists t1;
CREATE TABLE t1 (c1 int primary key, c2 vector(3),c3 vector(3) ,c4 vector(3),
VECTOR INDEX vector_idx(c3) 
WITH (distance=l2, lib=vsag, type=hnsw, m=10, ef_construction=100, ef_search=40));
insert into t1 values(1,'[1,1,2]','[2,2,3]','[1,3,2]');
insert into t1 values(2,'[1,0,3]','[1,0,3]','[2,3,2]');
insert into t1 values(3,'[-1,2,2]','[-3,2,3]','[4,3,3]');
insert into t1 values(4,'[-1,-2,-2]','[-4,2,3]',null);
insert into t1 values(5,'[-1,-3,-2]',null,'[2,3,1]');
drop table if exists t2;
CREATE TABLE t2 (c1 int , c2 vector(3),c3 vector(3) ,c4 vector(3));
insert into t2 select c1,c2,c3,c4 from t1;
SELECT * FROM t1 JOIN t2 USING(c1);
c1	c2	c3	c4	c2	c3	c4
1	[1,1,2]	[2,2,3]	[1,3,2]	[1,1,2]	[2,2,3]	[1,3,2]
2	[1,0,3]	[1,0,3]	[2,3,2]	[1,0,3]	[1,0,3]	[2,3,2]
3	[-1,2,2]	[-3,2,3]	[4,3,3]	[-1,2,2]	[-3,2,3]	[4,3,3]
4	[-1,-2,-2]	[-4,2,3]	NULL	[-1,-2,-2]	[-4,2,3]	NULL
5	[-1,-3,-2]	NULL	[2,3,1]	[-1,-3,-2]	NULL	[2,3,1]
SELECT avg(C2) OVER (PARTITION BY vector_norm(C2)) FROM T1  order by c1;
avg(C2) OVER (PARTITION BY vector_norm(C2))
[1,1,2]
[1,0,3]
[-1,0,0]
[-1,0,0]
[-1,-3,-2]
SELECT sum(C2) OVER (PARTITION BY vector_norm(C2)) FROM T1  order by c1;
sum(C2) OVER (PARTITION BY vector_norm(C2))
[1,1,2]
[1,0,3]
[-2,0,0]
[-2,0,0]
[-1,-3,-2]
SELECT count(C2) OVER (PARTITION BY vector_norm(C2)) FROM T1  order by c1;
count(C2) OVER (PARTITION BY vector_norm(C2))
1
1
2
2
1
SELECT min(C2) OVER (PARTITION BY vector_norm(C2)) FROM T1 order by c1 ;
ERROR HY000: Invalid argument
SELECT max(C2) OVER (PARTITION BY vector_norm(C2)) FROM T1  order by c1;
ERROR HY000: Invalid argument
SELECT avg(a.C2) OVER (PARTITION BY vector_norm(a.C3+b.c4)+vector_norm(a.C3+b.c4)) FROM T1 a,t2 b where a.c2=b.c2 order by a.c1;
avg(a.C2) OVER (PARTITION BY vector_norm(a.C3+b.c4)+vector_norm(a.C3+b.c4))
[1,1,2]
[1,0,3]
[-1,2,2]
[-1,-2.5,-2]
[-1,-2.5,-2]
SELECT sum(a.C2) OVER (PARTITION BY vector_norm(a.C3+b.c4)+vector_norm(a.C3+b.c4)) FROM T1 a,t2 b where a.c2=b.c2 order by a.c1;
sum(a.C2) OVER (PARTITION BY vector_norm(a.C3+b.c4)+vector_norm(a.C3+b.c4))
[1,1,2]
[1,0,3]
[-1,2,2]
[-2,-5,-4]
[-2,-5,-4]
SELECT count(a.C2) OVER (PARTITION BY vector_norm(a.C3+b.c4)+vector_norm(a.C3+b.c4)) FROM T1 a,t2 b where a.c2=b.c2 order by a.c1;
count(a.C2) OVER (PARTITION BY vector_norm(a.C3+b.c4)+vector_norm(a.C3+b.c4))
1
1
1
2
2
SELECT min(a.C2) OVER (PARTITION BY a.C1) FROM T1 a,t2 b order by a.c1;
ERROR HY000: Invalid argument
SELECT max(a.C2) OVER (PARTITION BY a.C1) FROM T1 a,t2 b order by a.c1;
ERROR HY000: Invalid argument
drop table if exists t1;
CREATE TABLE t1 (c1 int primary key, c2 vector(3),c3 vector(3) ,c4 vector(3),
VECTOR INDEX vector_idx(c2) 
WITH (distance=l2, lib=vsag, type=hnsw, m=10, ef_construction=100, ef_search=40));
insert into t1 values(1,'[1,1,2]','[2,2,3]','[1,3,2]');
insert into t1 values(2,'[1,0,3]','[1,0,3]','[2,3,2]');
insert into t1 values(3,'[-1,2,2]','[-3,2,3]','[4,3,3]');
insert into t1 values(4,'[-1,-2,-2]','[-4,2,3]',null);
insert into t1 values(5,'[-1,-3,-2]',null,'[2,3,1]');
##limit
select vector_norm(c2)  from t1  order by c1 limit vector_norm(C3);
ERROR 42000: You have an error in your SQL syntax; check the manual that corresponds to your OceanBase version for the right syntax to use near 'vector_norm(C3)' at line 1
select vector_norm(c3)  from (select c1,c2,c3,vector_norm(c3) from t1 ) a  order by c1 limit 1,1;
vector_norm(c3)
3.1622776601683795
select *  from t1  order by c1 limit 1 offset vector_norm([0]);
ERROR 42000: You have an error in your SQL syntax; check the manual that corresponds to your OceanBase version for the right syntax to use near 'vector_norm([0])' at line 1
select vector_norm(c3)  from t1  order by c1 limit 1,vector_norm([0],[0]);
ERROR 42000: You have an error in your SQL syntax; check the manual that corresponds to your OceanBase version for the right syntax to use near 'vector_norm([0],[0])' at line 1
select vector_norm(c3) + vector_norm(c3) from t1  order by c1 limit vector_norm('[1,2,4]');
ERROR 42000: You have an error in your SQL syntax; check the manual that corresponds to your OceanBase version for the right syntax to use near 'vector_norm('[1,2,4]')' at line 1
select vector_norm(c3) + vector_norm(c3) from t1  order by c1 limit vector_norm('[1,2,4]'),vector_norm('[1,2,4]');
ERROR 42000: You have an error in your SQL syntax; check the manual that corresponds to your OceanBase version for the right syntax to use near 'vector_norm('[1,2,4]'),vector_norm('[1,2,4]')' at line 1
##列别名
drop table if exists t1;
CREATE TABLE t1 (c1 int primary key, c2 vector(3),c3 vector(3) ,c4 vector(3));
insert into t1 values(1,'[1,1,2]','[2,2,3]','[1,3,2]');
insert into t1 values(2,'[1,0,3]','[1,0,3]','[2,3,2]');
insert into t1 values(3,'[-1,2,2]','[-3,2,3]','[4,3,3]');
insert into t1 values(4,'[-1,-2,-2]','[-4,2,3]',null);
insert into t1 values(5,'[-1,-3,-2]',null,'[2,3,1]');
select c1 a,vector_norm(c3) a  from t1 order by c1;
a	a
1	4.123105625617661
2	3.1622776601683795
3	4.69041575982343
4	5.385164807134504
5	NULL
select c1 a,vector_norm(c3) a,vector_norm(c3) a  from t1 order by c1;
a	a	a
1	4.123105625617661	4.123105625617661
2	3.1622776601683795	3.1622776601683795
3	4.69041575982343	4.69041575982343
4	5.385164807134504	5.385164807134504
5	NULL	NULL
select vector_norm(c2)  a  from t1 order by c1;
a
2.449489742783178
3.1622776601683795
3
3
3.7416573867739413
select vector_norm(c2)  a ,* from t1 order by c1;
a	c1	c2	c3	c4
2.449489742783178	1	[1,1,2]	[2,2,3]	[1,3,2]
3.1622776601683795	2	[1,0,3]	[1,0,3]	[2,3,2]
3	3	[-1,2,2]	[-3,2,3]	[4,3,3]
3	4	[-1,-2,-2]	[-4,2,3]	NULL
3.7416573867739413	5	[-1,-3,-2]	NULL	[2,3,1]
select vector_norm(c3)  中文 ,* from t1 order by c1;
中文	c1	c2	c3	c4
4.123105625617661	1	[1,1,2]	[2,2,3]	[1,3,2]
3.1622776601683795	2	[1,0,3]	[1,0,3]	[2,3,2]
4.69041575982343	3	[-1,2,2]	[-3,2,3]	[4,3,3]
5.385164807134504	4	[-1,-2,-2]	[-4,2,3]	NULL
NULL	5	[-1,-3,-2]	NULL	[2,3,1]
select vector_norm(c3) + vector_norm(c3) - vector_norm('[-1.5,3.5,0]')  中文 ,vector_norm(c3) + vector_norm(c3) - vector_norm(c3) 中文 from t1 order by c1;
中文	中文
4.438324698303367	4.123105625617661
2.5166687674048047	3.1622776601683795
5.572944966714905	4.69041575982343
6.962443061337053	5.385164807134504
NULL	NULL
select vector_norm('[-1.5,3.5,0]') + vector_norm(c2) - vector_norm(c3)  a ,vector_norm(c3) + vector_norm(c2) - vector_norm(c2) b from t1 order by c1;
a	b
2.1342706700974716	4.123105625617661
3.8078865529319548	3.1622776601683795
2.1174707931085246	4.69041575982343
1.4227217457974506	5.385164807134505
NULL	NULL
select c1 a,vector_norm(c3) a  from t1 where vector_norm(c3) is not null order by c1;
a	a
1	4.123105625617661
2	3.1622776601683795
3	4.69041575982343
4	5.385164807134504
## update
drop table if exists t1;
CREATE TABLE t1 (c1 int primary key, c2 vector(3),c3 vector(3) ,c4 vector(3),
VECTOR INDEX vector_idx(c2) 
WITH (distance=l2, lib=vsag, type=hnsw, m=10, ef_construction=100, ef_search=40));
insert into t1 values(1,'[1,1,2]','[2,2,3]','[1,3,2]');
insert into t1 values(2,'[1,0,3]','[1,0,3]','[2,3,2]');
insert into t1 values(3,'[-1,2,2]','[-3,2,3]','[4,3,3]');
insert into t1 values(4,'[-1,-2,-2]','[-4,2,3]',null);
insert into t1 values(5,'[-1,-3,-2]',null,'[2,3,1]');
update t1 set c1 = 10 where c1 =5;
update t1 set c2 = '[1,23,null]' where c1 =5;
update t1 set c2 = '[1,23,abs(null)]' where c1 =5;
update t1 set c2 =[vector_norm('[1,3,2]'),vector_norm('[1,2,2]'),vector_norm('[1,1,2]')] where c3 is null;
update t1 set c1 = vector_norm('[1,8,2]') where c3 = '[2,2,3]';
select * from t1 order by c1;
c1	c2	c3	c4
2	[1,0,3]	[1,0,3]	[2,3,2]
3	[-1,2,2]	[-3,2,3]	[4,3,3]
4	[-1,-2,-2]	[-4,2,3]	NULL
8	[1,1,2]	[2,2,3]	[1,3,2]
10	[3.74166,3,2.44949]	NULL	[2,3,1]
show create table t1;
Table	Create Table
t1	CREATE TABLE `t1` (
  `c1` int(11) NOT NULL,
  `c2` VECTOR(3) DEFAULT NULL,
  `c3` VECTOR(3) DEFAULT NULL,
  `c4` VECTOR(3) DEFAULT NULL,
  PRIMARY KEY (`c1`),
  VECTOR KEY `vector_idx` (`c2`) WITH (DISTANCE=L2, LIB=VSAG, TYPE=HNSW, M=10, EF_CONSTRUCTION=100, EF_SEARCH=40) BLOCK_SIZE 16384
) ORGANIZATION INDEX DEFAULT CHARSET = utf8mb4 ROW_FORMAT = DYNAMIC COMPRESSION = 'zstd_1.3.8' REPLICA_NUM = 1 BLOCK_SIZE = 16384 USE_BLOOM_FILTER = FALSE ENABLE_MACRO_BLOCK_BLOOM_FILTER = FALSE TABLET_SIZE = 134217728 PCTFREE = 0 LOB_INROW_THRESHOLD=0
truncate table t1;
CREATE VECTOR INDEX vector_idx_c4  ON t1 (c4)  WITH (distance=l2, lib=vsag, type=hnsw, m=10, ef_construction=100, ef_search=40);
insert into t1 values(1,'[1,1,2]','[2,2,3]','[1,3,2]');
insert into t1 values(2,'[1,0,3]','[1,0,3]','[2,3,2]');
insert into t1 values(3,'[-1,2,2]','[-3,2,3]','[4,3,3]');
insert into t1 values(4,'[-1,-2,-2]','[-4,2,3]',null);
insert into t1 values(5,'[-1,-3,-2]',null,'[2,3,1]');
call dbms_vector.rebuild_index('vector_idx','t1');
call dbms_vector.rebuild_index('vector_idx_c4','t1');
##where子句
drop table if exists t1;
CREATE TABLE t1 (c1 int primary key, c2 vector(3),c3 vector(3) ,c4 vector(3),
VECTOR INDEX vector_idx(c2) 
WITH (distance=l2, lib=vsag, type=hnsw, m=10, ef_construction=100, ef_search=40));
insert into t1 values(1,'[1,1,2]','[2,2,3]','[1,3,2]');
insert into t1 values(2,'[1,0,3]','[1,0,3]','[2,3,2]');
insert into t1 values(3,'[-1,2,2]','[-3,2,3]','[4,3,3]');
insert into t1 values(4,'[-1,-2,-2]','[-4,2,3]',null);
insert into t1 values(5,'[-1,-3,-2]',null,'[2,3,1]');
update t1 set c2 ='[1,2,3]' where c1 >vector_norm('[1,1,2]');
update t1 set c2 =[1,2,3] where c1 >vector_norm('[1,1,2]');
update t1 set c2 =[2,2,3] where c1 <vector_norm('[1,1,2]');
update t1 set c2 =[1,2,3] where c1 >=vector_norm('[1,1,2]');
update t1 set c2 =[2,2,3] where c1 <=vector_norm('[1,1,2]');
update t1 set c2 =[1,2,3] where c1 =vector_norm('[1,1,2]');
update t1 set c2 =[2,2,3] where c1 <>vector_norm('[1,1,2]');
select * from t1 order by c1;
c1	c2	c3	c4
1	[2,2,3]	[2,2,3]	[1,3,2]
2	[2,2,3]	[1,0,3]	[2,3,2]
3	[2,2,3]	[-3,2,3]	[4,3,3]
4	[2,2,3]	[-4,2,3]	NULL
5	[2,2,3]	NULL	[2,3,1]
update t1 set c2 =[1,2,3] where c1 > vector_norm('[1,3,2]') and c1 > vector_norm('[1,2,2]');
update t1 set c2 =[2,2,3] where c1 < vector_norm('[1,1,2]') or c1 > vector_norm('[1,2,2]') ;
update t1 set c2 =[1,2,3] where c1 BETWEEN vector_norm(c3)  and vector_norm(c3) >1;
update t1 set c2 =[vector_norm('[1,1,2]'),vector_norm('[1,1,11]'),vector_norm('[1,1,2]')] where c1 like '%5%' ;
update t1 set c2 =[vector_norm('[1,1,2]'),vector_norm('[1,2,2]'),vector_norm('[1,1,2]')] where c1 not like '%5%' ;
update t1 set c2 =[2,2,3] where vector_norm(c3) = any (SELECT vector_norm(c3) FROM t1) order by c1;
update t1 set c2 =[2,2,3] where vector_norm(c3) = all (SELECT vector_norm(c3) FROM t1) order by c1;
update t1 set c2 =[2,2,3] where  exists (SELECT vector_norm(c3) FROM t1) order by c1;
update t1 set c2 =[2,2,3] where vector_norm(c3) in  (SELECT vector_norm(c3) FROM t1) order by c1;
update t1 set c2 =[2,2,3] where vector_norm(c3) not in  (SELECT vector_norm(c3) FROM t1) order by c1;
select * from t1 order by c1;
c1	c2	c3	c4
1	[2,2,3]	[2,2,3]	[1,3,2]
2	[2,2,3]	[1,0,3]	[2,3,2]
3	[2,2,3]	[-3,2,3]	[4,3,3]
4	[2,2,3]	[-4,2,3]	NULL
5	[2,2,3]	NULL	[2,3,1]
call dbms_vector.refresh_index('vector_idx','t1','c2',1,'FAST');
call dbms_vector.rebuild_index('vector_idx','t1');
## update join(子查询/多表更新)
drop table if exists t1;
CREATE TABLE t1 (c1 int primary key, c2 vector(3),c3 vector(3) ,c4 vector(3));
insert into t1 values(1,'[1,1,2]','[2,2,3]','[1,3,2]');
insert into t1 values(2,'[1,0,3]','[1,0,3]','[2,3,2]');
insert into t1 values(3,'[-1,2,2]','[-3,2,3]','[4,3,3]');
insert into t1 values(4,'[-1,-2,-2]','[-4,2,3]',null);
insert into t1 values(5,'[-1,-3,-2]',null,'[2,3,1]');
drop table if exists t2;
CREATE TABLE t2 (a1 int , a2 vector(3),a3 vector(3) ,a4 vector(3));
insert into t2 select c1,c2,c3,c4 from t1;
select vector_norm(c2) from t1 union  select vector_norm(a3) from t2;
vector_norm(c2)
2.449489742783178
3.1622776601683795
3
3.7416573867739413
4.123105625617661
4.69041575982343
5.385164807134504
NULL
update t1 set c2 =[1,2,4] where c1 not  in (select vector_norm(c3) from t1 inner join t2 on c2=a2);
update t1 join t2 on c2 =a2 set c2 =[1,2,4] where a3 is null;
update t1 set c1 = vector_norm([1,2,4]) where c1 in (select vector_norm(c3) from t1 inner join t2 on c2=a2);
update t1 join t2 on c2 =a2 set c1 = vector_norm([1,3,5]) where a3 is null;
##update with limit + order by 
drop table if exists t1;
CREATE TABLE t1 (c1 int , c2 vector(3),c3 vector(3) ,c4 vector(3));
insert into t1 values(1,'[1,1,2]','[2,2,3]','[1,3,2]');
insert into t1 values(2,'[1,0,3]','[1,0,3]','[2,3,2]');
insert into t1 values(3,'[-1,2,2]','[-3,2,3]','[4,3,3]');
insert into t1 values(4,'[-1,-2,-2]','[-4,2,3]',null);
insert into t1 values(5,'[-1,-3,-2]',null,'[2,3,1]');
drop table if exists t2;
CREATE TABLE t2 (a1 int , a2 vector(3),a3 vector(3) ,a4 vector(3));
insert into t2 select c1,c2,c3,c4 from t1;
update t1 set c1 = vector_norm([1,2,4]) where c3 is null;
update t1 set c1 = vector_norm([1,3,5]) where c1> 1 order by c1 limit 1;
select * from t1 order by 1,2;
ERROR 22000: Invalid data type for the operation
update t1 join t2 on c2 =a2 set c1 = vector_norm([-100,2,4])  where a2 = [1,1,2];
update t1 join t2 on c2 =a2 set c1 = vector_norm([null,1,4])  where a2 = [1,1,2];
ERROR 42000: Null value
select * from t1 order by vector_norm(c2);
c1	c2	c3	c4
100	[1,1,2]	[2,2,3]	[1,3,2]
3	[-1,2,2]	[-3,2,3]	[4,3,3]
4	[-1,-2,-2]	[-4,2,3]	NULL
6	[1,0,3]	[1,0,3]	[2,3,2]
5	[-1,-3,-2]	NULL	[2,3,1]
select * from t1 order by vector_norm(c2),vector_norm(c3),vector_norm(c2);
c1	c2	c3	c4
100	[1,1,2]	[2,2,3]	[1,3,2]
3	[-1,2,2]	[-3,2,3]	[4,3,3]
4	[-1,-2,-2]	[-4,2,3]	NULL
6	[1,0,3]	[1,0,3]	[2,3,2]
5	[-1,-3,-2]	NULL	[2,3,1]
##with as update
drop table if exists t1;
CREATE TABLE t1 (c1 int primary key, c2 vector(3),c3 vector(3) ,c4 vector(3),
VECTOR INDEX vector_idx(c2) 
WITH (distance=l2, lib=vsag, type=hnsw, m=10, ef_construction=100, ef_search=40));
insert into t1 values(1,'[1,1,2]','[2,2,3]','[1,3,2]');
insert into t1 values(2,'[1,0,3]','[1,0,3]','[2,3,2]');
insert into t1 values(3,'[-1,2,2]','[-3,2,3]','[4,3,3]');
insert into t1 values(4,'[-1,-2,-2]','[-4,2,3]',null);
insert into t1 values(5,'[-1,-3,-2]',null,'[2,3,1]');
update t1 set c1 = 10 where c3 =[2,2,3];
drop table if exists t2;
CREATE TABLE t2 (a1 int primary key , a2 vector(3),a3 vector(3) ,a4 vector(3),
VECTOR INDEX vector_idx(a2) 
WITH (distance=l2, lib=vsag, type=hnsw, m=10, ef_construction=100, ef_search=40));
insert into t2 select c1,c2,c3,c4 from t1;
with cte as (select vector_norm([1000,1000,1000]) from t1 order by c1 )
update t2 set a1 = vector_norm([1000,1000,10000]) where a3 is null ;
select * from t2 order by a1;
a1	a2	a3	a4
2	[1,0,3]	[1,0,3]	[2,3,2]
3	[-1,2,2]	[-3,2,3]	[4,3,3]
4	[-1,-2,-2]	[-4,2,3]	NULL
10	[1,1,2]	[2,2,3]	[1,3,2]
10100	[-1,-3,-2]	NULL	[2,3,1]
##insert/replace
drop table if exists t1;
CREATE TABLE t1 (c1 int primary key, c2 vector(3),c3 vector(3) ,c4 vector(3),
VECTOR INDEX vector_idx(c3) 
WITH (distance=l2, lib=vsag, type=hnsw, m=10, ef_construction=100, ef_search=40));
insert into t1(c1) values(vector_norm([1,2,3]));
insert into t1(c1) values(vector_norm([1,2,5]));
insert into t1(c1) values(vector_norm([1,2,6]));
insert into t1(c1) values(vector_norm([1,2,7]));
insert into t1(c1) values(vector_norm([1,2,10]));
insert into t1(c1,c2,c3) values(vector_norm([1,2,8]),[1,1,2],[2,3,4]);
insert into t1(c1,c2,c3) values(vector_norm([1,2,9]),[2,3,4],null);
replace into t1(c1,c2,c3) values(vector_norm([1,2,100]),[2,3,1],[2,3,1]);
replace into t1(c1,c2,c3) values(vector_norm([1,2,100]),null,[2,3,1]);
replace into t1(c1,c2,c3) values(-1,[-1,-3,-2],[2,3,1]);
##导致core 已修复
replace into t1(c1,c2,c3) values(vector_norm([1,2,3]),null,[2,3,1]);
select vector_norm(c2) from t1 where c3 is not null order by c1 ;
vector_norm(c2)
3.7416573867739413
NULL
2.449489742783178
NULL
##插入不同的数据类型到vector
drop table if exists t1;
CREATE TABLE t1 (c1 int primary key, c2 vector(3),c3 vector(3) ,c4 vector(3),
VECTOR INDEX vector_idx(c3)
WITH (distance=l2, lib=vsag, type=hnsw, m=10, ef_construction=100, ef_search=40));
drop table if exists t2;
CREATE TABLE t2 (a1 int primary key, a2 VARCHAR(30), a3 VARCHAR(30), a4 VARCHAR(30));
insert into t2 values(1,'999','999','999');
insert into t2 values(2,'中文','@！#￥','中文123abc');
replace into t1 select a1,a2,a3,a4 from t2;
Got one of the listed errors
insert into t1 select a1,a2,a3,a4 from t2;
Got one of the listed errors
insert into t1 select a1,a2,a3,a4 from t2;
Got one of the listed errors
drop table if exists t1;
CREATE TABLE t1 (c1 int primary key, c2 vector(3),c3 vector(3) ,c4 vector(3),c5 vector(3),c6 vector(3),
VECTOR INDEX vector_idx(c3)
WITH (distance=l2, lib=vsag, type=hnsw, m=10, ef_construction=100, ef_search=40));
drop table if exists t2;
CREATE TABLE t2 (c1 int PRIMARY KEY, c2 TINYBLOB,c3 BLOB,c4 MEDIUMBLOB,c5 LONGBLOB,c6 TEXT);
INSERT INTO t2 (c1, c2, c3, c4, c5, c6) VALUES (1, '2023-04-01', '12:34:56', '2023-04-01 12:34:56', '2023-04-01 12:34:56', 2023);
insert into t1 select c1,c2,c3,c4,c5,c6 from t2;
Got one of the listed errors
replace into t1 select c1,c2,c3,c4,c5,c6 from t2;
Got one of the listed errors
replace into t1 select c1,c2,c3,c4,c5,c6 from t2;
Got one of the listed errors
drop table if exists t1;
CREATE TABLE t1 (c1 int primary key, c2 vector(3),c3 vector(3) ,c4 vector(3),
VECTOR INDEX vector_idx(c3) 
WITH (distance=l2, lib=vsag, type=hnsw, m=10, ef_construction=100, ef_search=40));
drop table if exists t2;
CREATE TABLE t2 (c1 int primary key, c2 VARCHAR(30), c3 VARCHAR(30), c4 VARCHAR(30));
insert into t2 values(1,'999','999','999');
insert into t2 values(2,'中文','@！#￥','中文123abc');
insert into t1 select c1,c2,c3,c4 from t2;
Got one of the listed errors
replace into t1 select c1,c2,c3,c4 from t2;
Got one of the listed errors
drop table if exists t2;
CREATE TABLE t2 (c1 int primary key, c2 DECIMAL(10,2), c3 FLOAT(10,2), c4 double);
insert into t2 values(1,11.21,22.1566,33.1235);
insert into t1 select c1,c2,c3,c4 from t2;
ERROR 22000: Invalid data type for the operation
insert into t1 values(1,2,2,3);
ERROR 0A000: type casting not supported
replace into t1 values(2,2,2,3);
ERROR 0A000: type casting not supported
drop table if exists t1;
CREATE TABLE t1 (c1 int primary key, c2 vector(3),c3 vector(3) ,c4 vector(3),c5 vector(3),c6 vector(3),
VECTOR INDEX vector_idx(c3) 
WITH (distance=l2, lib=vsag, type=hnsw, m=10, ef_construction=100, ef_search=40));
drop table if exists t2;
CREATE TABLE t2 (c1 int PRIMARY KEY, c2 DATE,c3 TIME,c4 DATETIME(6),c5 TIMESTAMP,c6 YEAR);
INSERT INTO t2 (c1, c2, c3, c4, c5, c6) VALUES (1, '2023-04-01', '12:34:56', '2023-04-01 12:34:56', '2023-04-01 12:34:56', 2023);
insert into t1 select c1,c2,c3,c4,c5,c6 from t2;
ERROR 22000: Invalid data type for the operation
insert into t1 select c1,c4,c5,c6 from t2;
ERROR 21S01: Column count doesn't match value count at row 1
insert into t1 values(1, '2023-04-01', '12:34:56', '2023-04-01 12:34:56', '2023-04-01 12:34:56', 2023);
Got one of the listed errors
drop table if exists t1;
CREATE TABLE t1 (c1 int primary key, c2 vector(3),c3 vector(3) ,c4 vector(3),c5 vector(3),c6 vector(3),
VECTOR INDEX vector_idx(c3) 
WITH (distance=l2, lib=vsag, type=hnsw, m=10, ef_construction=100, ef_search=40));
drop table if exists t2;
CREATE TABLE t2 (c1 int PRIMARY KEY, c2 TINYBLOB,c3 BLOB,c4 MEDIUMBLOB,c5 LONGBLOB,c6 TEXT);
INSERT INTO t2 (c1, c2, c3, c4, c5, c6) VALUES (1, '2023-04-01', '12:34:56', '2023-04-01 12:34:56', '2023-04-01 12:34:56', 2023);
insert into t1 select c1,c2,c3,c4,c5,c6 from t2;
Got one of the listed errors
replace into t1 select c1,c2,c3,c4,c5,c6 from t2;
Got one of the listed errors
insert into t1 values(1, '2023-04-01', '12:34:56', '2023-04-01 12:34:56', '2023-04-01 12:34:56', 2023);
Got one of the listed errors
drop table if exists t1;
CREATE TABLE t1 (c1 int primary key, c2 vector(3));
replace into t1(c1,c2) values(10,'[-1,-3,-2]');
replace into t1(c1,c2) values(10,'[-1,-3,-2]');
drop table if exists t1;
CREATE TABLE t1 (c1 int AUTO_INCREMENT primary key , c2 vector(3),c3 vector(3) ,c4 BLOB,
VECTOR INDEX vector_idx(c3) 
WITH (distance=l2, lib=vsag, type=hnsw, m=10, ef_construction=100, ef_search=40));
insert into t1(c3) values(vector_norm(null));
ERROR 0A000: type casting not supported
insert into t1(c4) values(vector_norm(null));
insert into t1(c1) values(vector_norm(null));
insert into t1(c4) values(vector_norm(null));
insert into t1(c3) values([vector_norm([1.5,2.5,-1.5]),vector_norm([1,2,-4]),vector_norm([1,-2,4])]);
insert into t1(c3) values([vector_norm([1.5,2.5,-1.5]),vector_norm([1,2,-4]),vector_norm([1,-2,4])]);
select vector_norm(c3) from t1 order by c1;
vector_norm(c3)
NULL
NULL
NULL
7.262919457513327
7.262919457513327
drop table if exists t1;
CREATE TABLE t1 (c1 int AUTO_INCREMENT primary key , c2 vector(3),c3 vector(3) ,c4 BLOB,
VECTOR INDEX vector_idx(c3) 
WITH (distance=l2, lib=vsag, type=hnsw, m=10, ef_construction=100, ef_search=40));
insert into t1(c1) values(vector_norm([1.5+1,2.5-1,-1.5*2]));
insert into t1(c1) values(vector_norm([-1000.5 % 1,1.5+1,1%1]));
insert into t1(c1) values(vector_norm([-1.5 % 1,1.5+1,1%1])+vector_norm([1.5+1,2.5-1,-1.5*2]));
insert into t1(c2) select [2,3,4] from dual;
insert into t1(c3) select [3,3,4] from dual;
insert into t1(c3) select [vector_norm([1.5+1,2.5-1,-1.5*2]),vector_norm([1.5+1,2.5-1,-1.5*2]),vector_norm([1.5+1,2.5-1,-1.5*2])] from dual;
insert into t1(c4) select vector_norm([1.5+1,2.5-1,-1.5*2]) from dual;
select vector_norm(c3) from t1 order by c1 limit 6,2;
vector_norm(c3)
NULL
drop table if exists t1;
CREATE TABLE t1 (c1 int AUTO_INCREMENT primary key , c2 vector(3),c3 vector(3) ,c4 BLOB,
VECTOR INDEX vector_idx(c3) 
WITH (distance=l2, lib=vsag, type=hnsw, m=10, ef_construction=100, ef_search=40));
drop table if exists t2;
CREATE TABLE t2 (a1 int AUTO_INCREMENT primary key , a2 vector(3),a3 vector(3) ,a4 BLOB,
VECTOR INDEX vector_idx(a3) 
WITH (distance=l2, lib=vsag, type=hnsw, m=10, ef_construction=100, ef_search=40));
insert into t1(c1,c2) values(vector_norm([1.5+1,2.5-1,-1.5*2]),[vector_norm([-1.5+1,2.5-1,-1.5*2]),vector_norm([1.5+1,2.5-1,-1.5*2]),vector_norm([1.5+1,2.5-1,-1.5*2])]);
insert into t2(a1,a2) values(vector_norm([1.5+1,2.5-1,-1.5*2]),[vector_norm([-1.5+1,2.5-1,-1.5*2]),vector_norm([1.5+1,2.5-1,-1.5*2]),vector_norm([1.5+1,2.5-1,-1.5*2])]);
select c1,c2,a1,a2,vector_norm(c2),vector_norm(c3) from t1,t2 where c4=a4;
c1	c2	a1	a2	vector_norm(c2)	vector_norm(c3)
drop table if exists t1;
CREATE TABLE t1 (c1 int AUTO_INCREMENT primary key , c2 vector(3),c3 vector(3) ,c4 BLOB,
VECTOR INDEX vector_idx(c3) 
WITH (distance=l2, lib=vsag, type=hnsw, m=10, ef_construction=100, ef_search=40));
INSERT IGNORE t1(c1) values (vector_norm([1,2]));
INSERT IGNORE t1(c1) values (vector_norm([1,2]));
INSERT IGNORE t1(c2) values ([vector_norm([1,2]),vector_norm([-1,2]),vector_norm([-1,2])]);
INSERT IGNORE t1 values (10,[1,2,3],[2,-1,-1.5],vector_norm([2,-1]));
select c1,c2,vector_norm(c2),vector_norm(c2) from t1 order by c1;
c1	c2	vector_norm(c2)	vector_norm(c2)
2	NULL	NULL	NULL
3	[2.23607,2.23607,2.23607]	3.872983346207417	3.872983346207417
10	[1,2,3]	3.7416573867739413	3.7416573867739413
select c1,c2,vector_norm(c2),vector_norm(c2) from t1 order by vector_norm(c2);
c1	c2	vector_norm(c2)	vector_norm(c2)
2	NULL	NULL	NULL
10	[1,2,3]	3.7416573867739413	3.7416573867739413
3	[2.23607,2.23607,2.23607]	3.872983346207417	3.872983346207417
select c1,c2,vector_norm(c2),vector_norm(c2) from t1 order by vector_norm([1]);
c1	c2	vector_norm(c2)	vector_norm(c2)
2	NULL	NULL	NULL
3	[2.23607,2.23607,2.23607]	3.872983346207417	3.872983346207417
10	[1,2,3]	3.7416573867739413	3.7416573867739413
show create table t1;
Table	Create Table
t1	CREATE TABLE `t1` (
  `c1` int(11) NOT NULL AUTO_INCREMENT,
  `c2` VECTOR(3) DEFAULT NULL,
  `c3` VECTOR(3) DEFAULT NULL,
  `c4` blob DEFAULT NULL,
  PRIMARY KEY (`c1`),
  VECTOR KEY `vector_idx` (`c3`) WITH (DISTANCE=L2, LIB=VSAG, TYPE=HNSW, M=10, EF_CONSTRUCTION=100, EF_SEARCH=40) BLOCK_SIZE 16384
) ORGANIZATION INDEX AUTO_INCREMENT = 11 AUTO_INCREMENT_MODE = 'ORDER' DEFAULT CHARSET = utf8mb4 ROW_FORMAT = DYNAMIC COMPRESSION = 'zstd_1.3.8' REPLICA_NUM = 1 BLOCK_SIZE = 16384 USE_BLOOM_FILTER = FALSE ENABLE_MACRO_BLOCK_BLOOM_FILTER = FALSE TABLET_SIZE = 134217728 PCTFREE = 0 LOB_INROW_THRESHOLD=0
drop table if exists t1;
CREATE TABLE t1 (c1 int AUTO_INCREMENT primary key , c2 vector(3),c3 vector(3) ,c4 BLOB,
VECTOR INDEX vector_idx(c3) 
WITH (distance=l2, lib=vsag, type=hnsw, m=10, ef_construction=100, ef_search=40));
insert into t1(c1) values(vector_norm([1]))ON DUPLICATE KEY UPDATE c1='[1,1,3]';
insert into t1(c2,c3) values([vector_norm([1.5+1,2.5-1,-1.5*2]),vector_norm([-1.5+1,2.5-1,-1.5*2]),vector_norm([1.5+1,2.5-1,-1.5*2])],'[1,0,3]') ON DUPLICATE KEY UPDATE c2='[1,1,3]';
insert into t1(c2,c3) values('[1,2,3]','[1,3,3]') ON DUPLICATE KEY UPDATE c2='[1,null,3]';
insert into t1(c2,c3) values('[1,6,3]','[1,4,3]') ON DUPLICATE KEY UPDATE c2='[1,1,3]';
select * from t1 order by c1;
c1	c2	c3	c4
1	NULL	NULL	NULL
2	[4.1833,3.39117,4.1833]	[1,0,3]	NULL
3	[1,2,3]	[1,3,3]	NULL
4	[1,6,3]	[1,4,3]	NULL
drop table if exists t1;
CREATE TABLE t1 (c1 int AUTO_INCREMENT primary key , c2 vector(3),c3 vector(3) ,c4 BLOB,
VECTOR INDEX vector_idx(c3) 
WITH (distance=l2, lib=vsag, type=hnsw, m=10, ef_construction=100, ef_search=40));
INSERT INTO T1 (C1,C2)VALUES (vector_norm([1]), [1,2,3]), (vector_norm([2]), [1,2,3]), (vector_norm([3]), [1,2,3]);
SELECT * FROM T1 order by c1,c4;
c1	c2	c3	c4
1	[1,2,3]	NULL	NULL
2	[1,2,3]	NULL	NULL
3	[1,2,3]	NULL	NULL
drop table if exists t1;
CREATE TABLE t1 (c1 int primary key, c2 vector(3),c3 vector(3) ,c4 vector(3),
VECTOR INDEX vector_idx(c2) 
WITH (distance=l2, lib=vsag, type=hnsw, m=10, ef_construction=100, ef_search=40));
insert into t1 values(1,'[1,1,2]','[2,2,3]','[1,3,2]');
insert into t1 values(2,'[1,0,3]','[1,0,3]','[2,3,2]');
insert into t1 values(3,'[-1,2,2]','[-3,2,3]','[4,3,3]');
insert into t1 values(4,'[-1,-2,-2]','[-4,2,3]',null);
insert into t1 values(5,'[-1,-3,-2]',null,'[2,3,1]');
update t1 set c1 = 10 where c3 =[2,2,3];
drop table if exists t2;
CREATE TABLE t2 (a1 int primary key , a2 vector(3),a3 vector(3) ,a4 vector(3),
VECTOR INDEX vector_idx(a2) 
WITH (distance=l2, lib=vsag, type=hnsw, m=10, ef_construction=100, ef_search=40));
insert into t2 select c1,c2,c3,c4 from t1;
INSERT INTO t1 (c1, c2) VALUES (5,'[-1,-3,-2]') ON t2 (a1) DO UPDATE SET a2 = [2,3,1];
ERROR 42000: You have an error in your SQL syntax; check the manual that corresponds to your OceanBase version for the right syntax to use near 't2 (a1) DO UPDATE SET a2 = [2,3,1]' at line 1
drop table if exists t1;
CREATE TABLE t1 (c1 int primary key, c2 vector(3),c3 vector(3) ,c4 vector(3),
VECTOR INDEX vector_idx(c3) 
WITH (distance=l2, lib=vsag, type=hnsw, m=10, ef_construction=100, ef_search=40));
insert into t1(c1) values(vector_norm([1,2,4]));
replace into t1(c1,c2,c3,c4) values(vector_norm([1,2,100]),[-1,-3,-2],[2,3,1],[2,3,1]);
replace into t1(c1,c2,c3,c4) values(vector_norm([1,2,1000]),[-1,-3,-2],null,[2,3,1]);
replace into t1(c1,c2,c3,c4) values(-1,[-1,-3,-2],null,[2,3,1]);
replace into t1(c1,c2,c3,c4) values(vector_norm([1,2,3,1,1,1,1,1,1,1,2,3,1,1,1,1,1,1,1,2,3,1,1,1,1,1,1,1,2,3,1,1,1,1,1,1,1,2,3,1,1,1,1,1,1,1,2,3,1,1,1,1,1,1,1,2,3,1,1,1,1,1,1,1,2,3,1,1,1,1,1,1,1,2,3,1,1,1,1,1,1,1,2,3,1,1,1,1,1,1,1,2,3,1,1,1,1,1,1,1,2,3,1,1,1,1,1,1]),[1,2,3],null,[2,3,1]);
replace into t1(c1,c2,c3,c4) values(vector_norm([1,2,100]),[-1,-3,-2],null,[2,3,1]);
select * from t1 order by c1;
c1	c2	c3	c4
-1	[-1,-3,-2]	NULL	[2,3,1]
5	NULL	NULL	NULL
15	[1,2,3]	NULL	[2,3,1]
100	[-1,-3,-2]	NULL	[2,3,1]
1000	[-1,-3,-2]	NULL	[2,3,1]
##旁路导入
drop table if exists t1;
drop view if exists v1;
CREATE TABLE t1 (c1 int , c2 VARCHAR(30),c3 vector(3) ,c4 vector(3));
insert into t1(c1,c2,c3,c4) values(1,'[1,1,2]','[2,2,3]','[1,3,2]');
insert into t1(c1,c2,c3,c4) values(2,'[1,0,3]','[1,0,3]','[2,3,2]');
insert into t1(c1,c2,c3,c4) values(3,'[-1,2,2]','[-3,2,3]','[4,3,3]');
insert into t1(c1,c2,c3,c4) values(4,'[-1,-2,-2]','[-4,2,3]',null);
insert into t1(c1,c2,c3,c4) values(5,'[-1,-3,-2]',null,'[2,3,1]');
create view v1 as select * from t1;
insert /*+ direct(true,100) enable_parallel_dml parallel(2)*/ into v1 select c1,c2,c3,c4 from t1;
insert  into t1 select c1,c2,c3,c4 from t1;
insert /*+ direct(true,100) enable_parallel_dml parallel(2) append*/ into t1 select c1,c2,c3,c4 from t1;
insert /*+ direct(true,100) enable_parallel_dml parallel(2) append*/ into t1 select c1,c2,c3,c4 from t1;
drop table if exists t1;
create table t1(c1 int, c2 vector(3)) partition by hash(c1);
insert into t1 values(1,'[1,1,3]');
insert into t1 values(2,'[1,2,4]');
insert into t1 values(3,'[2,4,1]');
insert /*+ direct(true,100) enable_parallel_dml parallel(2) append*/ into t1 select c1,c2 from t1;
insert /*+ direct(true,100) enable_parallel_dml parallel(2) append*/ into t1 select c1,c2 from t1;
insert /*+ direct(true,100) enable_parallel_dml parallel(2) append*/ into t1 select c1,c2+c2 from t1;
insert /*+ direct(true,100) enable_parallel_dml parallel(2) append*/ into t1 select c1,c2+c2 from t1;
insert /*+ direct(true,100) enable_parallel_dml parallel(2) append*/ into t1 select c1,c2+c2+c2 from t1;
select count(vector_norm(c2)) from t1 order by c1;
count(vector_norm(c2))
96
drop table if exists t1;
drop view if exists v1;
CREATE TABLE t1 (c1 int , c2 VARCHAR(30),c3 vector(3) ,c4 vector(3),
VECTOR INDEX vector_idx(c3) 
WITH (distance=l2, lib=vsag, type=hnsw, m=10, ef_construction=100, ef_search=40));
insert into t1(c1,c2,c3,c4) values(1,'[1,1,2]','[2,2,3]','[1,3,2]');
insert into t1(c1,c2,c3,c4) values(2,'[1,0,3]','[1,0,3]','[2,3,2]');
insert into t1(c1,c2,c3,c4) values(3,'[-1,2,2]','[-3,2,3]','[4,3,3]');
insert into t1(c1,c2,c3,c4) values(4,'[-1,-2,-2]','[-4,2,3]',null);
insert into t1(c1,c2,c3,c4) values(5,'[-1,-3,-2]',null,'[2,3,1]');
insert  into t1 select c1,c2,c3,c4 from t1;
insert /*+ enable_parallel_dml parallel(2) */ into t1 select c1,c2,c3,c4 from t1;
create VECTOR index vector_idx1 on t1(c4) with (distance=l2, lib=vsag, type=hnsw, m=10, ef_construction=100, ef_search=40);
drop table if exists t1;
drop view if exists v1;
CREATE TABLE t1 (c1 int , c2 VARCHAR(30),c3 vector(3) ,c4 vector(3),
VECTOR INDEX vector_idx(c3) 
WITH (distance=l2, lib=vsag, type=hnsw, m=10, ef_construction=100, ef_search=40));
insert into t1(c1,c2,c3,c4) values(1,'[1,1,2]','[2,2,3]','[1,3,2]');
insert into t1(c1,c2,c3,c4) values(2,'[1,0,3]','[1,0,3]','[2,3,2]');
insert into t1(c1,c2,c3,c4) values(3,'[-1,2,2]','[-3,2,3]','[4,3,3]');
insert into t1(c1,c2,c3,c4) values(4,'[-1,-2,-2]','[-4,2,3]',null);
insert into t1(c1,c2,c3,c4) values(5,'[-1,-3,-2]',null,'[2,3,1]');
create view v1 as select * from t1;
insert /*+ direct(true,100) enable_parallel_dml parallel(2)*/ into v1 select c1,c2,c3,c4 from t1;
insert  into t1 select c1,c2,c3,c4 from t1;
insert /*+ direct(true,100) enable_parallel_dml parallel(2) append*/ into t1 select c1,c2,c3,c4 from t1;
insert /*+ direct(true,100) enable_parallel_dml parallel(2) append*/ into t1 select c1,c2,c3,c4 from t1;
##delete
drop table if exists t1;
CREATE TABLE t1 (c1 int primary key, c2 vector(3),c3 vector(3) ,c4 vector(3));
insert into t1(c1,c2,c3,c4) values(1,'[1,1,2]','[2,2,3]','[1,3,2]');
insert into t1(c1,c2,c3,c4) values(2,'[1,0,3]','[1,0,3]','[2,3,2]');
insert into t1(c1,c2,c3,c4) values(3,'[-1,2,2]','[-3,2,3]','[4,3,3]');
insert into t1(c1,c2,c3,c4) values(4,'[-1,-2,-2]','[-4,2,3]',null);
insert into t1(c1,c2,c3,c4) values(5,'[-1,-3,-2]',null,'[2,3,1]');
drop table if exists t2;
CREATE TABLE t2 (a1 int primary key , a2 vector(3),a3 vector(3) ,a4 vector(3),
VECTOR INDEX vector_idx(a2) 
WITH (distance=l2, lib=vsag, type=hnsw, m=10, ef_construction=100, ef_search=40));
insert into t2 select c1,c2,c3,c4 from t1;
delete from t1 where c3 = [1,0,3];
delete from t1 where c1 =vector_norm([-1]);
delete from t1 where c1 =vector_norm([2]) and c2 = [-1,2,2];
delete from t1 where c2 =[1,1,1]+[-2,-3,-3];
select * from t1;
c1	c2	c3	c4
3	[-1,2,2]	[-3,2,3]	[4,3,3]
5	[-1,-3,-2]	NULL	[2,3,1]
drop table if exists t1;
CREATE TABLE t1 (c1 int primary key, c2 vector(3),c3 vector(3) ,c4 vector(3));
insert into t1(c1,c2,c3,c4) values(1,'[1,1,2]','[2,2,3]','[1,3,2]');
insert into t1(c1,c2,c3,c4) values(2,'[1,0,3]','[1,0,3]','[2,3,2]');
insert into t1(c1,c2,c3,c4) values(3,'[-1,2,2]','[-3,2,3]','[4,3,3]');
insert into t1(c1,c2,c3,c4) values(4,'[-1,-2,-2]','[-4,2,3]',null);
insert into t1(c1,c2,c3,c4) values(5,'[-1,-3,-2]',null,'[2,3,1]');
drop table if exists t2;
CREATE TABLE t2 (a1 int primary key , a2 vector(3),a3 vector(3) ,a4 vector(3),
VECTOR INDEX vector_idx(a2) 
WITH (distance=l2, lib=vsag, type=hnsw, m=10, ef_construction=100, ef_search=40));
insert into t2 select c1,c2,c3,c4 from t1;
select * from t1 inner join t2 on c2+c3+c4=a2+a3+a4 order by c1,c2,c3,c4;
c1	c2	c3	c4	a1	a2	a3	a4
1	[1,1,2]	[2,2,3]	[1,3,2]	1	[1,1,2]	[2,2,3]	[1,3,2]
2	[1,0,3]	[1,0,3]	[2,3,2]	2	[1,0,3]	[1,0,3]	[2,3,2]
3	[-1,2,2]	[-3,2,3]	[4,3,3]	3	[-1,2,2]	[-3,2,3]	[4,3,3]
DELETE t1 FROM t1 INNER JOIN  t2 ON c3=c2 where a1 =3 or c4 is null;
DELETE t1 FROM t1 INNER JOIN  t2 ON vector_norm(c2)=vector_norm(a3) where a1 =3 or c4 is null;
delete from t1;
delete from t2;
drop table if exists t1;
CREATE TABLE t1 (c1 int primary key, c2 vector(3),c3 vector(3) ,c4 vector(3));
insert into t1(c1,c2,c3,c4) values(1,'[1,1,2]','[2,2,3]','[1,3,2]');
insert into t1(c1,c2,c3,c4) values(2,'[1,0,3]','[1,0,3]','[2,3,2]');
insert into t1(c1,c2,c3,c4) values(3,'[-1,2,2]','[-3,2,3]','[4,3,3]');
insert into t1(c1,c2,c3,c4) values(4,'[-1,-2,-2]','[-4,2,3]',null);
insert into t1(c1,c2,c3,c4) values(5,'[-1,-3,-2]',null,'[2,3,1]');
drop table if exists t2;
CREATE TABLE t2 (a1 int primary key , a2 vector(3),a3 vector(3) ,a4 vector(3),
VECTOR INDEX vector_idx(a2) 
WITH (distance=l2, lib=vsag, type=hnsw, m=10, ef_construction=100, ef_search=40));
insert into t2 select c1,c2,c3,c4 from t1 where c3 is not null and c4 is not null;
DELETE FROM  t1 USING  t2 WHERE vector_norm(c3)=vector_norm(a3) AND c1 =1;
ERROR 42S02: Unknown table 't1' in MULTI DELETE
drop table if exists t1;
CREATE TABLE t1 (c1 int primary key, c2 vector(3),c3 vector(3) ,c4 vector(3));
insert into t1(c1,c2,c3,c4) values(1,'[1,1,2]','[2,2,3]','[1,3,2]');
insert into t1(c1,c2,c3,c4) values(2,'[1,0,3]','[1,0,3]','[2,3,2]');
insert into t1(c1,c2,c3,c4) values(3,'[-1,2,2]','[-3,2,3]','[4,3,3]');
insert into t1(c1,c2,c3,c4) values(4,'[-1,-2,-2]','[-4,2,3]',null);
insert into t1(c1,c2,c3,c4) values(5,'[-1,-3,-2]',null,'[2,3,1]');
delete from t1 where c1 > vector_norm(c2) order by c1 limit 1;
delete from t1 where c1 > vector_norm(c2) order by c2 limit 100;
ERROR 22000: Invalid data type for the operation
delete from t1 where c1 > 0 order by vector_norm(c2) limit 1;
select * from t1 order by c1;
c1	c2	c3	c4
2	[1,0,3]	[1,0,3]	[2,3,2]
3	[-1,2,2]	[-3,2,3]	[4,3,3]
5	[-1,-3,-2]	NULL	[2,3,1]
drop table if exists t1;
CREATE TABLE t1 (c1 int primary key, c2 vector(3),c3 vector(3) ,c4 vector(3));
insert into t1(c1,c2,c3,c4) values(1,'[1,1,2]','[2,2,3]','[1,3,2]');
insert into t1(c1,c2,c3,c4) values(2,'[1,0,3]','[1,0,3]','[2,3,2]');
insert into t1(c1,c2,c3,c4) values(3,'[-1,2,2]','[-3,2,3]','[4,3,3]');
insert into t1(c1,c2,c3,c4) values(4,'[-1,-2,-2]','[-4,2,3]',null);
insert into t1(c1,c2,c3,c4) values(5,'[-1,-3,-2]',null,'[2,3,1]');
drop table if exists t2;
CREATE TABLE t2 (a1 int primary key , a2 vector(3),a3 vector(3) ,a4 vector(3),
VECTOR INDEX vector_idx(a2) 
WITH (distance=l2, lib=vsag, type=hnsw, m=64, ef_construction=100, ef_search=40));
drop tablegroup if exists t00;
create tablegroup t00 ;
ALTER TABLEGROUP t00 ADD t2;
drop tablegroup t00;
ERROR HY000: tablegroup is not empty
insert into t2 select c1,c2,c3,c4 from t1 where c3 is not null and c4 is not null;
ALTER TABLE t2 ADD CONSTRAINT fk_a1 FOREIGN KEY (a1) REFERENCES t1(c1) ;
delete from t1 where c2 =[1,1,2];
ERROR 23000: Cannot delete or update a parent row: a foreign key constraint fails
delete from t1 where c1 =vector_norm([3]);
ERROR 23000: Cannot delete or update a parent row: a foreign key constraint fails
insert into t1(c1,c2,c3,c4) values(6,'[1,1,2]','[2,2,3]','[1,3,2]');
update t1 set c1=10 where c4 is null;
drop table if exists t2;
drop table if exists t1;
CREATE TABLE t1 (c1 int primary key, c2 vector(3),c3 vector(3) ,c4 vector(3));
insert into t1(c1,c2,c3,c4) values(1,'[1,1,2]','[2,2,3]','[1,3,2]');
insert into t1(c1,c2,c3,c4) values(2,'[1,0,3]','[1,0,3]','[2,3,2]');
insert into t1(c1,c2,c3,c4) values(3,'[-1,2,2]','[-3,2,3]','[4,3,3]');
insert into t1(c1,c2,c3,c4) values(4,'[-1,-2,-2]','[-4,2,3]',null);
insert into t1(c1,c2,c3,c4) values(5,'[-1,-3,-2]',null,'[2,3,1]');
CREATE TABLE t2 (a1 int primary key , a2 vector(3),a3 vector(3) ,a4 vector(3),
VECTOR INDEX vector_idx(a2) 
WITH (distance=l2, lib=vsag, type=hnsw, m=10, ef_construction=100, ef_search=40));
insert into t2 select c1,c2,c3,c4 from t1 where c3 is not null and c4 is not null;
ALTER TABLE t2 ADD CONSTRAINT fk_a1 FOREIGN KEY (a1) REFERENCES t1(c1) ON DELETE CASCADE ON UPDATE CASCADE;
delete from t1 where c2 =[1,1,2];
delete from t1 where c1 =vector_norm([1]);
insert into t1(c1,c2,c3,c4) values(6,'[1,1,2]','[2,2,3]','[1,3,2]');
update t1 set c1=10 where c4 is null;
TRUNCATE TABLE t2;
drop table if exists t2;
drop table if exists t1;
########清空回收站，删除测试数据库，表等 ##########
drop database  IF EXISTS  obljh;
purge recyclebin;
