drop table if exists child;
drop table if exists parent;
create table parent(c1 int primary key, c2 int);
create table child(c1 int primary key, c2 int, foreign key(c2) references parent(c1));
begin;
insert into parent values(1, 1);
insert into child values(1, 1);
commit;
commit;
select * from parent;
c1	c2
1	1
select * from child;
c1	c2
1	1
begin;
delete from child where c2 = 1;
begin;
delete from parent where c1 = 1;
rollback;
ERROR 23000: Cannot delete or update a parent row: a foreign key constraint fails
rollback;
select * from parent;
c1	c2
1	1
select * from child;
c1	c2
1	1
drop table child;
create table child(c1 int, c2 int, foreign key(c2) references parent(c1));
begin;
insert into child values(1, 1);
begin;
delete from parent where c1 = 1;
commit;
ERROR 23000: Cannot delete or update a parent row: a foreign key constraint fails
rollback;
select * from parent;
c1	c2
1	1
select * from child;
c1	c2
1	1
set session transaction isolation level repeatable read;
set session transaction isolation level repeatable read;
begin;
select * from parent;
c1	c2
1	1
begin;
select * from child;
c1	c2
1	1
delete from child where c2 = 1;
commit;
delete from parent where c1 = 1;
ERROR 25000: can't serialize access for this transaction
rollback;
select * from parent;
c1	c2
1	1
select * from child;
c1	c2
begin;
delete from parent where c1 = 1;
commit;
select * from parent;
c1	c2
select * from child;
c1	c2
drop table child;
drop table parent;
