drop table if exists child;
drop table if exists parent;
drop table if exists t1;
create table parent(c1 int primary key);
create table child(c1 int primary key, foreign key(c1) references parent(c1) on update cascade on delete cascade);
insert into parent values (1);
alter system set _enable_defensive_check = 1;
begin;
insert into child values (1);
begin;
delete from parent where c1 = 1;
commit;
commit;
select * from parent;
c1
select * from child;
c1
insert into parent values (1);
delete from child;
begin;
insert into child values (1);
alter system minor freeze tenant = sys;
alter system minor freeze tenant = all_user;
alter system minor freeze tenant = all_meta;
begin;
delete from parent where c1 = 1;
commit;
commit;
select * from parent;
c1
select * from child;
c1
insert into parent values (1);
delete from child;
begin;
insert into child values (1);
begin;
update parent set c1 = 2 where c1 = 1;
commit;
commit;
select * from parent;
c1
2
select * from child;
c1
2
delete from child;
begin;
insert into child values (2);
begin;
update parent set c1 = 1 where c1 = 2;
alter system minor freeze tenant = sys;
alter system minor freeze tenant = all_user;
alter system minor freeze tenant = all_meta;
commit;
commit;
select * from parent;
c1
1
select * from child;
c1
1
create table t1(a int primary key, b int, key t1_b(b), constraint foreign key (b) references t1 (a) on update CASCADE on delete CASCADE);
insert into t1 values (1, 1);
insert into t1 values (2, 1);
insert into t1 values (3, 1);
update t1 set a = 9 where a = 1;
ERROR 23000: Cannot delete or update a parent row: a foreign key constraint fails
select * from t1;
a	b
1	1
2	1
3	1
delete from t1 where a = 1;
select * from t1;
a	b
delete from child;
insert into child values (1);
begin;
delete from child where c1 = 1;
delete from parent where c1 = 1;
commit;
select * from parent;
c1
select * from child;
c1
insert into parent values (1);
drop table child;
create table child(c1 int primary key, foreign key(c1) references parent(c1));
insert into child values (1);
begin;
delete from child where c1 = 1;
delete from parent where c1 = 1;
commit;
select * from parent;
c1
select * from child;
c1
drop table child;
drop table parent;
drop table t1;
