drop table if exists child;
drop table if exists parent;
create table parent(c1 int primary key, c2 int);
create table child(c1 int primary key, c2 int, foreign key(c2) references parent(c1));
insert into parent values(1, 1);
insert into child values(1, 1);
begin;
select * from parent for update;
c1	c2
1	1
begin;
select * from child for update;
c1	c2
1	1
delete from parent where c1 = 1;
insert into child values(2, 1);
ERROR HY000: Deadlock
rollback;
ERROR 23000: Cannot delete or update a parent row: a foreign key constraint fails
rollback;
select * from parent;
c1	c2
1	1
select * from child;
c1	c2
1	1
begin;
select * from parent for update;
c1	c2
1	1
begin;
select * from child for update;
c1	c2
1	1
alter system minor freeze tenant = sys;
alter system minor freeze tenant = all_user;
alter system minor freeze tenant = all_meta;
delete from parent where c1 = 1;
alter system minor freeze tenant = sys;
alter system minor freeze tenant = all_user;
alter system minor freeze tenant = all_meta;
insert into child values(2, 1);
ERROR HY000: Deadlock
rollback;
ERROR 23000: Cannot delete or update a parent row: a foreign key constraint fails
rollback;
select * from parent;
c1	c2
1	1
select * from child;
c1	c2
1	1
drop table child;
create table child(c1 int, c2 int, foreign key(c2) references parent(c1));
insert into child values(1, 1);
begin;
select * from parent where c1 = 1 for update;
c1	c2
1	1
begin;
select * from child where c2 = 1 for update;
c1	c2
1	1
delete from parent where c1 = 1;
insert into child values(2, 1);
ERROR HY000: Deadlock
rollback;
ERROR 23000: Cannot delete or update a parent row: a foreign key constraint fails
rollback;
select * from parent;
c1	c2
1	1
select * from child;
c1	c2
1	1
begin;
select * from parent for update;
c1	c2
1	1
begin;
select * from child for update;
c1	c2
1	1
alter system minor freeze tenant = sys;
alter system minor freeze tenant = all_user;
alter system minor freeze tenant = all_meta;
delete from parent where c1 = 1;
alter system minor freeze tenant = sys;
alter system minor freeze tenant = all_user;
alter system minor freeze tenant = all_meta;
insert into child values(2, 1);
ERROR HY000: Deadlock
rollback;
ERROR 23000: Cannot delete or update a parent row: a foreign key constraint fails
rollback;
select * from parent;
c1	c2
1	1
select * from child;
c1	c2
1	1
drop table child;
drop table parent;
