drop database if exists jx_db;
create database jx_db;
use jx_db;
create table pri_tab1(c1 int primary key, c2 int);
insert into pri_tab1 values(1,1);
insert into pri_tab1 values(2,2);
create table fri_tab1(c1 int not null, c2 int not null, primary key(c1), foreign key(c2) references pri_tab1(c1));
insert into fri_tab1 values(1,1);
insert into fri_tab1 values(2,2);
select count(*) from oceanbase.__all_virtual_foreign_key_history where is_deleted = 0 and child_table_id in(select table_id from oceanbase.__all_virtual_table where table_name='fri_tab1' order by schema_version desc limit 1);
count(*)
1
select count(*) from oceanbase.__all_virtual_foreign_key_history where is_deleted = 0 and parent_table_id in(select table_id from oceanbase.__all_virtual_table where table_name='pri_tab1' order by schema_version desc limit 1);
count(*)
1
drop table pri_tab1;
ERROR HY000: Cannot drop table 'pri_tab1' referenced by a foreign key constraint 'fri_tab1_OBFK_1234' on table 'fri_tab1'
drop table fri_tab1;
update pri_tab1 set c2 = c2 * 10 where c1 = 2;
drop table pri_tab1;
create table p_tab1(c1 int primary key, c2 smallint unsigned unique key, c3 tinyint(16) unique key,
ca_val char(30) unique key, vc_val varchar(40) unique key, 
flt_val float(8, 6) unique key, dbl_val double(9, 7) unique key, dec_val decimal(10, 8) unique key, num_val number(11,9) unique key,
dt_val datetime(6) unique key, t_val time(6) unique key,
index(ca_val, flt_val),
unique key(dbl_val, t_val));
create table f_tab1(c1 smallint not null, c2 int not null, foreign key(c1) references p_tab1(c1));
ERROR HY000: Cannot add foreign key constraint
create table f_tab1(c1 int unsigned, c2 int not null, foreign key(c1) references p_tab1(c1));
ERROR HY000: Cannot add foreign key constraint
create table f_tab1(c2 smallint, c1 int not null, foreign key(c2) references p_tab1(c2));
ERROR HY000: Cannot add foreign key constraint
drop table if exists f_tab1;
Warnings:
Note	1051	Unknown table 'jx_db.f_tab1'
create table f_tab1(ca_val char(30), flt_val float(8, 6), foreign key(ca_val, flt_val) references p_tab1(ca_val, flt_val));
drop table if exists f_tab1;
create table f_tab1(c2 smallint signed, c1 int not null, foreign key(c2) references p_tab1(c2));
ERROR HY000: Cannot add foreign key constraint
create table f_tab_sgn(c3 tinyint signed, c2 int not null, foreign key(c3) references p_tab1(c3));
select count(*) from oceanbase.__all_virtual_foreign_key_history where is_deleted = 0 and parent_table_id in(select table_id from oceanbase.__all_virtual_table where table_name='f_tab_sgn' order by schema_version desc limit 1);
count(*)
0
create table f_tab1(c1 smallint not null, c2 int not null, foreign key(c2) references p_tab1(c2));
ERROR HY000: Cannot add foreign key constraint
create table f_tab1(c2 smallint, ca_val char(30), foreign key(c2, ca_val) references p_tab1(c2, ca_val));
ERROR HY000: Cannot add foreign key constraint
create table f_tab1(c1 int not null, c2 int not null, foreign key(c1,c2) references p_tab1(c1));
ERROR 42000: Incorrect foreign key definition: Key reference and table reference don't match
create table f_tab1(dbl_val double(9, 7), t_val time(4), foreign key(dbl_val) references p_tab1(dbl_val, t_val));
ERROR 42000: Incorrect foreign key definition: Key reference and table reference don't match
create table f_tab1(ca_val char(20), foreign key(ca_val) references p_tab1(ca_val));
ERROR HY000: Child column 'ca_val' data length cannot be less than parent column 'ca_val' data length
create table f_tab1(vc_val varchar(20), foreign key(vc_val) references p_tab1(vc_val));
ERROR HY000: Child column 'vc_val' data length cannot be less than parent column 'vc_val' data length
create table f_tab1_1(flt_val float(8, 5), foreign key(flt_val) references p_tab1(flt_val));
create table f_tab1_2(flt_val float(7, 6), foreign key(flt_val) references p_tab1(flt_val));
create table f_tab1_3(dbl_val double(9, 6), foreign key(dbl_val) references p_tab1(dbl_val));
create table f_tab1_4(dbl_val double(8, 7), foreign key(dbl_val) references p_tab1(dbl_val));
create table f_tab1_5(dec_val decimal(10, 7), foreign key(dec_val) references p_tab1(dec_val));
create table f_tab1_6(dec_val decimal(9, 8), foreign key(dec_val) references p_tab1(dec_val));
create table f_tab1_7(num_val number(11, 8), foreign key(num_val) references p_tab1(num_val));
create table f_tab1_8(num_val number(10, 9), foreign key(num_val) references p_tab1(num_val));
create table f_tab_tiny(c3 tinyint(10) not null, c2 varchar(10), foreign key(c3) references p_tab1(c3));
select count(*) from oceanbase.__all_virtual_foreign_key_history where is_deleted = 0 and parent_table_id in(select table_id from oceanbase.__all_virtual_table where table_name='f_tab_tiny' order by schema_version desc limit 1);
count(*)
0
create table f_tab_datetime(dt_val datetime(5), t_val time(6), foreign key(dt_val) references p_tab1(dt_val), foreign key(t_val) references p_tab1(t_val));
select count(*) from oceanbase.__all_virtual_foreign_key_history where is_deleted = 0 and parent_table_id in(select table_id from oceanbase.__all_virtual_table where table_name='f_tab_datetime' order by schema_version desc limit 1);
count(*)
0
create table f_tab_order(c1 int primary key, dbl_val double(9, 7), t_val time(6), 
foreign key (t_val, dbl_val) references p_tab1(t_val, dbl_val));
select count(*) from oceanbase.__all_virtual_foreign_key_history where is_deleted = 0 and child_table_id
in(select table_id from oceanbase.__all_virtual_table where table_name='f_tab_order' order by schema_version desc limit 1);
count(*)
1
create table p_tab2(c1 int primary key, c2 int unique key);
create table f_tab2(c1 int primary key, c2 int, 
foreign key(c2) references p_tab2(c1),
foreign key(c2) references p_tab2(c2));
create table f_tab22(c1 int primary key, c2 int, 
foreign key(c1) references p_tab2(c1),
foreign key(c2) references p_tab2(c1));
create table p_f1(c1 int not null primary key, c2 int not null unique key, c3 int unique key, unique key(c2, c3),
foreign key(c2) references p_f1(c1) on update RESTRICT on delete NO ACTION,
foreign key(c3) references p_f1(c2) on update RESTRICT on delete NO ACTION);
select count(*) from oceanbase.__all_virtual_foreign_key_history where is_deleted = 0 and child_table_id
in(select table_id from oceanbase.__all_virtual_table where table_name='p_f1' order by schema_version desc limit 1);
count(*)
2
create table p_f1(c1 int not null primary key, c2 int not null unique key, c3 int unique key, unique key(c2, c3),
foreign key(c2) references p_f1(c1) on update RESTRICT on delete NO ACTION,
foreign key(c3) references p_f1(c2) on update RESTRICT on delete NO ACTION,
foreign key(c2, c3) references p_f1(c1, c3) on update RESTRICT on delete NO ACTION);
ERROR HY000: Cannot add foreign key constraint
create table p_f2(c1 int not null primary key, c2 int not null unique key,
foreign key(c2) references p_f2(c1) on update RESTRICT on delete NO ACTION,
foreign key(c1) references p_f2(c2) on update RESTRICT on delete NO ACTION);
select count(*) from oceanbase.__all_virtual_foreign_key_history where is_deleted = 0 and child_table_id
in(select table_id from oceanbase.__all_virtual_table where table_name='p_f2' order by schema_version desc limit 1);
count(*)
2
CREATE TABLE `act_re_procdef` (`ID_` varchar(64) COLLATE utf8mb4_bin NOT NULL,
`REV_` int(11) DEFAULT NULL,
`CATEGORY_` varchar(255) COLLATE utf8mb4_bin DEFAULT NULL,
`NAME_` varchar(255) COLLATE utf8mb4_bin DEFAULT NULL,
`KEY_` varchar(255) COLLATE utf8mb4_bin NOT NULL,
`VERSION_` int(11) NOT NULL,
`DEPLOYMENT_ID_` varchar(64) COLLATE utf8mb4_bin DEFAULT NULL,
`RESOURCE_NAME_` varchar(4000) COLLATE utf8mb4_bin DEFAULT NULL,
`DGRM_RESOURCE_NAME_` varchar(4000) COLLATE utf8mb4_bin DEFAULT NULL,
`DESCRIPTION_` varchar(4000) COLLATE utf8mb4_bin DEFAULT NULL,
`HAS_START_FORM_KEY_` tinyint(4) DEFAULT NULL,
`HAS_GRAPHICAL_NOTATION_` tinyint(4) DEFAULT NULL,
`SUSPENSION_STATE_` int(11) DEFAULT NULL,
`TENANT_ID_` varchar(255) COLLATE utf8mb4_bin DEFAULT '',
PRIMARY KEY (`ID_`),
UNIQUE KEY `ACT_UNIQ_PROCDEF` (`KEY_`, `VERSION_`, `TENANT_ID_`));
CREATE TABLE `act_ru_execution`( `ID_` varchar(64) COLLATE utf8mb4_bin NOT NULL DEFAULT '', 
`REV_` int(11) DEFAULT NULL, 
`PROC_INST_ID_` varchar(64) COLLATE utf8mb4_bin DEFAULT NULL, 
`BUSINESS_KEY_` varchar(255) COLLATE utf8mb4_bin DEFAULT NULL, 
`PARENT_ID_` varchar(64) COLLATE utf8mb4_bin DEFAULT NULL, 
`PROC_DEF_ID_` varchar(64) COLLATE utf8mb4_bin DEFAULT NULL, 
`SUPER_EXEC_` varchar(64) COLLATE utf8mb4_bin DEFAULT NULL, 
`ACT_ID_` varchar(255) COLLATE utf8mb4_bin DEFAULT NULL, 
`IS_ACTIVE_` tinyint(4) DEFAULT NULL, 
`IS_CONCURRENT_` tinyint(4) DEFAULT NULL, 
`IS_SCOPE_` tinyint(4) DEFAULT NULL, 
`IS_EVENT_SCOPE_` tinyint(4) DEFAULT NULL, 
`SUSPENSION_STATE_` int(11) DEFAULT NULL, 
`CACHED_ENT_STATE_` int(11) DEFAULT NULL, 
`TENANT_ID_` varchar(255) COLLATE utf8mb4_bin DEFAULT '', 
`NAME_` varchar(255) COLLATE utf8mb4_bin DEFAULT NULL, 
`LOCK_TIME_` timestamp(3) NULL DEFAULT NULL, 
PRIMARY KEY (`ID_`), 
constraint cons_name_act_ru_execution_1 FOREIGN KEY (`SUPER_EXEC_`) REFERENCES `act_ru_execution`(`ID_`) , 
constraint cons_name_act_ru_execution_2 FOREIGN KEY (`PROC_INST_ID_`) REFERENCES `act_ru_execution`(`ID_`) ,
constraint cons_name_act_ru_execution_3 FOREIGN KEY (`PROC_DEF_ID_`) REFERENCES `act_re_procdef`(`ID_`), 
constraint cons_name_act_ru_execution_4 FOREIGN KEY (`PARENT_ID_`) REFERENCES `act_ru_execution`(`ID_`) , 
KEY `ACT_FK_EXE_PROCINST` (`PROC_INST_ID_`) BLOCK_SIZE 16384, 
KEY `ACT_FK_EXE_PARENT` (`PARENT_ID_`) BLOCK_SIZE 16384, 
KEY `ACT_FK_EXE_SUPER` (`SUPER_EXEC_`) BLOCK_SIZE 16384, 
KEY `ACT_FK_EXE_PROCDEF` (`PROC_DEF_ID_`) BLOCK_SIZE 16384);
drop table act_re_procdef;
ERROR HY000: Cannot drop table 'act_re_procdef' referenced by a foreign key constraint 'cons_name_act_ru_execution_3' on table 'act_ru_execution'
truncate table act_re_procdef;
ERROR 42000: Cannot truncate a table referenced in a foreign key constraint (`jx_db`.`act_ru_execution`, CONSTRAINT `cons_name_act_ru_execution_3` FOREIGN KEY (`PROC_DEF_ID_`) REFERENCES `jx_db`.`act_re_procdef` (`ID_`))
drop table act_ru_execution;
count(*)
0
drop table act_re_procdef;
count(*)
0
create table t_15610076(c1 int primary key, c2 int);
create table t_15610076_2(c1 int primary key, c2 int, constraint cons_name_t_15610076_2 foreign key(c1) references t_15610076(c1), foreign key(c2) references t_15610076_2(c1));
drop table t_15610076;
ERROR HY000: Cannot drop table 't_15610076' referenced by a foreign key constraint 'cons_name_t_15610076_2' on table 't_15610076_2'
truncate table t_15610076;
ERROR 42000: Cannot truncate a table referenced in a foreign key constraint (`jx_db`.`t_15610076_2`, CONSTRAINT `cons_name_t_15610076_2` FOREIGN KEY (`c1`) REFERENCES `jx_db`.`t_15610076` (`c1`))
drop table t_15610076_2;
count(*)
0
create table t_15610076_2(c1 int primary key, c2 int, constraint cons_name_t_15610076_2 foreign key(c1) references t_15610076(c1), foreign key(c2) references t_15610076_2(c1));
truncate table t_15610076;
ERROR 42000: Cannot truncate a table referenced in a foreign key constraint (`jx_db`.`t_15610076_2`, CONSTRAINT `cons_name_t_15610076_2` FOREIGN KEY (`c1`) REFERENCES `jx_db`.`t_15610076` (`c1`))
truncate table t_15610076_2;
count(*)
2
drop table t_15610076;
ERROR HY000: Cannot drop table 't_15610076' referenced by a foreign key constraint 'cons_name_t_15610076_2' on table 't_15610076_2'
count(*)
0
drop table t_15610076_2;
drop table t_15610076;
create table p_f3(c1 int primary key, c2 int, unique key ukc1 (c1), FOREIGN KEY (c1) REFERENCES p_f3(c1) on update CASCADE on delete CASCADE);
ERROR HY000: Cannot add foreign key constraint
create table p_f3(c1 int primary key, c2 int, unique key ukc1 (c1), unique key ukc2 (c2), FOREIGN KEY (c2) REFERENCES p_f3(c2) on update CASCADE on delete CASCADE);
ERROR HY000: Cannot add foreign key constraint
create table p_f3(c1 int , c2 int, c3 int, c4 int, primary key (c1, c2), FOREIGN KEY (c3, c1) REFERENCES p_f3(c2, c1) on update CASCADE on delete CASCADE);
ERROR HY000: Cannot add foreign key constraint
create table p_f3(c1 int , c2 int, unique key (c1, c2), FOREIGN KEY (c3, c1) REFERENCES p_f3(c2, c1) on update CASCADE on delete CASCADE);
ERROR HY000: Cannot add foreign key constraint
create table p_f3(c1 int primary key, c2 int unique key, c3 int, c4 int, FOREIGN KEY (c3, c4) REFERENCES p_f3(c2, c1) on update CASCADE on delete CASCADE);
ERROR HY000: Cannot add foreign key constraint
create table gen_p_1(c1 varchar(10) primary key, c10 varchar(64) generated always as (repeat('a', 6)) virtual, unique key(c10));
create table gen_p_2(c1 varchar(10) primary key, c10 varchar(64) generated always as (repeat('a', 6)) stored, unique key(c10));
create table gen_f_2(c1 varchar(10), c10 varchar(64), primary key(c1), foreign key(c10) references gen_p_2(c10) on update CASCADE on delete CASCADE);
select count(*) from oceanbase.__all_virtual_foreign_key_history where is_deleted = 0 and child_table_id in(select table_id from oceanbase.__all_virtual_table where table_name='gen_p_2' order by schema_version desc limit 1);
count(*)
0
select count(*) from oceanbase.__all_virtual_foreign_key_history where is_deleted = 0 and child_table_id in(select table_id from oceanbase.__all_virtual_table where table_name='gen_f_2' order by schema_version desc limit 1);
count(*)
1
create table gen_p_3(c1 varchar(10) primary key, c10 varchar(64), unique key(c10));
create table gen_f_3(c1 varchar(10), c10 varchar(64) generated always as (repeat('a', 6)) stored, primary key(c1), foreign key(c10) references gen_p_3(c10) on update CASCADE on delete CASCADE);
select count(*) from oceanbase.__all_virtual_foreign_key_history where is_deleted = 0 and child_table_id in(select table_id from oceanbase.__all_virtual_table where table_name='gen_p_3' order by schema_version desc limit 1);
count(*)
0
select count(*) from oceanbase.__all_virtual_foreign_key_history where is_deleted = 0 and child_table_id in(select table_id from oceanbase.__all_virtual_table where table_name='gen_f_3' order by schema_version desc limit 1);
count(*)
1
create table p_like(c1 int primary key, c2 int unique key);
create table f_like(c1 int primary key, c2 int, 
foreign key(c2) references p_like(c1),
foreign key(c2) references p_like(c2));
count(*)
0
count(*)
2
create table f_like_2 like f_like;
count(*)
0
count(*)
2
count(*)
0
create table non_user_p1(c1 int primary key, c2 int);
create view v1 as select * from non_user_p1;
create table non_user_f1(c1 int not null, c2 int not null, primary key(c1), foreign key(c2) references v1(c1));
ERROR HY000: Cannot add foreign key constraint
create table f_all_dummy(c1 bigint(20) not null primary key, foreign key(c1) references oceanbase.__all_dummy(`key`));
ERROR HY000: Cannot add foreign key constraint
create table part_p1(c1 int, c2 int, unique key(c2) local) partition by hash(c2);
create table part_f1(c1 int, c2 int, foreign key(c2) references part_p1(c2));
create table part_p2(c1 int, c2 int, unique key(c2) local);
create table part_f2(c1 int, c2 int, foreign key(c2) references part_p2(c2)) partition by hash(c2);
create table alter_t0(c1 int primary key, c2 int unique key, c3 int);
alter table alter_t0 add unique key uk_1(c3);
create table alter_t1(c1 int, c2 int unique key);
create table alter_t2(c1 int, c2 int unique key, c3 int, foreign key(c2) references alter_t0(c2), foreign key(c3) references alter_t0(c3));
alter table alter_t2 drop column c2;
ERROR HY000: 'c2': used in a foreign key constraint
alter table alter_t0 drop column c2;
ERROR HY000: 'c2': used in a foreign key constraint
alter table alter_t2 change column c2 c2 int unique key;
alter table alter_t0 change column c2 c2 int unique key;
alter table alter_t2 modify column c2 bigint unique key;
ERROR HY000: 'c2': used in a foreign key constraint
alter table alter_t0 modify column c2 bigint unique key;
ERROR HY000: 'c2': used in a foreign key constraint
alter table alter_t0 add key nk_1(c3, c2);
drop index nk_1 on alter_t0;
alter table alter_t0 add key nk_1(c3, c2);
alter table alter_t0 alter index nk_1 VISIBLE;
show index from alter_t0;
Table	Non_unique	Key_name	Seq_in_index	Column_name	Collation	Cardinality	Sub_part	Packed	Null	Index_type	Comment	Index_comment	Visible	Expression
alter_t0	0	PRIMARY	1	c1	A	NULL	NULL	NULL		BTREE	available		YES	NULL
alter_t0	0	c2	1	c2	A	NULL	NULL	NULL	YES	BTREE	available		YES	NULL
alter_t0	0	uk_1	1	c3	A	NULL	NULL	NULL	YES	BTREE	available		YES	NULL
alter_t0	0	c2_2	1	c2	A	NULL	NULL	NULL	YES	BTREE	available		YES	NULL
alter_t0	1	nk_1	1	c3	A	NULL	NULL	NULL	YES	BTREE	available		YES	NULL
alter_t0	1	nk_1	2	c2	A	NULL	NULL	NULL	YES	BTREE	available		YES	NULL
alter table alter_t0 alter index nk_1 INVISIBLE;
show index from alter_t0;
Table	Non_unique	Key_name	Seq_in_index	Column_name	Collation	Cardinality	Sub_part	Packed	Null	Index_type	Comment	Index_comment	Visible	Expression
alter_t0	0	PRIMARY	1	c1	A	NULL	NULL	NULL		BTREE	available		YES	NULL
alter_t0	0	c2	1	c2	A	NULL	NULL	NULL	YES	BTREE	available		YES	NULL
alter_t0	0	uk_1	1	c3	A	NULL	NULL	NULL	YES	BTREE	available		YES	NULL
alter_t0	0	c2_2	1	c2	A	NULL	NULL	NULL	YES	BTREE	available		YES	NULL
alter_t0	1	nk_1	1	c3	A	NULL	NULL	NULL	YES	BTREE	available		NO	NULL
alter_t0	1	nk_1	2	c2	A	NULL	NULL	NULL	YES	BTREE	available		NO	NULL
alter table alter_t2 add key nk_2(c3);
drop index nk_2 on alter_t2;
ERROR HY000: 'nk_2': used in a foreign key constraint
alter table alter_t0 alter index uk_1 VISIBLE;
alter table alter_t0 alter index uk_1 INVISIBLE;
alter table alter_t2 alter index nk_2 VISIBLE;
ERROR HY000: 'nk_2': used in a foreign key constraint
alter table alter_t2 alter index nk_2 INVISIBLE;
ERROR HY000: 'nk_2': used in a foreign key constraint
create table jx_t1(a int primary key, b int, c varchar(50), d int, unique key uk_1(b));
create table jx_t2(a int primary key, b int, c varchar(50), d int, foreign key(a) references jx_t1(b));
alter table jx_t1 change column b b bigint;
ERROR HY000: 'b': used in a foreign key constraint
alter table jx_t2 change column b b bigint;
drop table jx_t2, jx_t1;
create table jx_t3(c1 int, c2 int primary key, foreign key(c1) references jx_t3(c2));
alter table jx_t3 change c1 c1 bigint;
ERROR HY000: 'c1': used in a foreign key constraint
drop table jx_t3;
create table show_p1(c1 int primary key, c2 int unique key, c3 int, c4 int, unique key(c3, c4));
create table show_p2(c1 int primary key, c2 int, 
constraint cons_name_show_p2_1 foreign key(c2) references show_p1(c1),
constraint cons_name_show_p2_2 foreign key(c2) references show_p1(c1),
constraint cons_name_show_p2_3 foreign key(c2) references show_p1(c1));
show create table show_p1;
Table	Create Table
show_p1	CREATE TABLE `show_p1` (
  `c1` int(11) NOT NULL,
  `c2` int(11) DEFAULT NULL,
  `c3` int(11) DEFAULT NULL,
  `c4` int(11) DEFAULT NULL,
  PRIMARY KEY (`c1`),
  UNIQUE KEY `c2` (`c2`) BLOCK_SIZE 16384 LOCAL,
  UNIQUE KEY `c3` (`c3`, `c4`) BLOCK_SIZE 16384 LOCAL
) ORGANIZATION INDEX DEFAULT CHARSET = utf8mb4 COMPRESSION = 'lz4_1.0' REPLICA_NUM = NUM BLOCK_SIZE = SIZE USE_BLOOM_FILTER = FALSE ENABLE_MACRO_BLOCK_BLOOM_FILTER = FALSE TABLET_SIZE = SIZE PCTFREE = 10
show create table show_p2;
Table	Create Table
show_p2	CREATE TABLE `show_p2` (
  `c1` int(11) NOT NULL,
  `c2` int(11) DEFAULT NULL,
  PRIMARY KEY (`c1`),
  CONSTRAINT `cons_name_show_p2_3` FOREIGN KEY (`c2`) REFERENCES `jx_db`.`show_p1`(`c1`) ON UPDATE RESTRICT ON DELETE RESTRICT ,
  CONSTRAINT `cons_name_show_p2_2` FOREIGN KEY (`c2`) REFERENCES `jx_db`.`show_p1`(`c1`) ON UPDATE RESTRICT ON DELETE RESTRICT ,
  CONSTRAINT `cons_name_show_p2_1` FOREIGN KEY (`c2`) REFERENCES `jx_db`.`show_p1`(`c1`) ON UPDATE RESTRICT ON DELETE RESTRICT 
) ORGANIZATION INDEX DEFAULT CHARSET = utf8mb4 COMPRESSION = 'lz4_1.0' REPLICA_NUM = NUM BLOCK_SIZE = SIZE USE_BLOOM_FILTER = FALSE ENABLE_MACRO_BLOCK_BLOOM_FILTER = FALSE TABLET_SIZE = SIZE PCTFREE = 10
create table show_p3(c1 int primary key, c2 int, constraint cons_name_show_p3 foreign key(c2) references show_p2(c1));
show create table show_p3;
Table	Create Table
show_p3	CREATE TABLE `show_p3` (
  `c1` int(11) NOT NULL,
  `c2` int(11) DEFAULT NULL,
  PRIMARY KEY (`c1`),
  CONSTRAINT `cons_name_show_p3` FOREIGN KEY (`c2`) REFERENCES `jx_db`.`show_p2`(`c1`) ON UPDATE RESTRICT ON DELETE RESTRICT 
) ORGANIZATION INDEX DEFAULT CHARSET = utf8mb4 COMPRESSION = 'lz4_1.0' REPLICA_NUM = NUM BLOCK_SIZE = SIZE USE_BLOOM_FILTER = FALSE ENABLE_MACRO_BLOCK_BLOOM_FILTER = FALSE TABLET_SIZE = SIZE PCTFREE = 10
create table mult_p1(c1 int primary key, c2 int unique key);
create table mult_f1(c1 int primary key, c2 int, foreign key(c1, c2) references mult_p1(c1, c2));
ERROR HY000: Cannot add foreign key constraint
create table jx_t1(a int primary key, b int, unique key `i_b` (b));
create table jx_t2(a int, b int, foreign key (b) references jx_t1(a));
alter table jx_t1 drop index i_b;
create index i_b on jx_t1(b);
drop index i_b on jx_t1;
create index idx_2 on jx_t1(a);
create index idx_3 on jx_t1(a, b);
drop index idx_3 on jx_t1;
alter table jx_t1 add index idx_3(b, a);
alter table jx_t1 drop index idx_3;
drop table jx_t2, jx_t1;
create table jx_t1(a int primary key, b int, unique key `i_b` (b));
create table jx_t2(a int, b int, unique key `i_b` (b), foreign key (a) references jx_t1(a));
alter table jx_t2 drop index i_b;
create index i_b on jx_t2(b);
drop index i_b on jx_t2;
create index idx_2 on jx_t2(a);
drop index idx_2 on jx_t2;
ERROR HY000: 'idx_2': used in a foreign key constraint
alter table jx_t2 drop index idx_2;
ERROR HY000: 'idx_2': used in a foreign key constraint
create index idx_3 on jx_t2(a, b);
drop index idx_3 on jx_t2;
alter table jx_t2 add index idx_3(b, a);
alter table jx_t2 drop index idx_3;
drop table jx_t2, jx_t1;
create table jx_t1(a int primary key, b int, c varchar(50), d int, unique key uk_1(b), unique key uk_2(b, c));
create table jx_t2(a int primary key, b int, c varchar(50), d int, unique key uk_1(b),
foreign key (d) references jx_t2(b), #自引用外键
foreign key (a) references jx_t1(a),
foreign key (a, c) references jx_t1(b, c));
create table jx_t3(a int primary key, b int , c varchar(50), d int, foreign key (a) references jx_t2(a));
create table jx_t4(c1 int, c2 int primary key, index idx(c2), foreign key(c1) references jx_t4(c2));
create index idx_2 on jx_t2(a, b);
drop index idx_2 on jx_t2;
create index idx_2 on jx_t2(a, b);
alter table jx_t2 drop index idx_2;
create index idx_4 on jx_t2(c);
drop index idx_4 on jx_t2;
drop table jx_t3, jx_t2, jx_t1;
create table inline_p1(c1 int , c2 int, primary key(c1), unique key (c2));
create table inline_f1(c1 int , c2 int foreign key reference inline_p1(c1), primary key(c1), unique key (c2));
ERROR 42000: You have an error in your SQL syntax; check the manual that corresponds to your OceanBase version for the right syntax to use near 'foreign key reference inline_p1(c1), primary key(c1), unique key (c2))' at line 1
create table pri_tab2(c1 int primary key, c2 int);
insert into pri_tab2 values(1,1);
insert into pri_tab2 values(2,2);
create table fri_tab2(c1 int not null, c2 int not null, primary key(c1), foreign key(c2) references pri_tab2(c1));
truncate table fri_tab2;
insert into pri_tab2 values(3,3);
select count(*) from oceanbase.__all_virtual_foreign_key_history where is_deleted = 0 and child_table_id in(select table_id from oceanbase.__all_virtual_table where table_name='fri_tab2' order by schema_version desc limit 1);
count(*)
1
select count(*) from oceanbase.__all_virtual_foreign_key_history where is_deleted = 0 and parent_table_id in(select table_id from oceanbase.__all_virtual_table where table_name='pri_tab2' order by schema_version desc limit 1);
count(*)
1
delete from pri_tab2 where c1=1;
delete from pri_tab2 where c1=3;
update pri_tab2 set c1 = 3 where c2 = 2;
drop table pri_tab2;
ERROR HY000: Cannot drop table 'pri_tab2' referenced by a foreign key constraint 'fri_tab2_OBFK_1234' on table 'fri_tab2'
drop table fri_tab2;
drop table pri_tab2;
create table pri_tab3(c1 int primary key, c2 int);
insert into pri_tab3 values(1,1);
insert into pri_tab3 values(2,2);
create table fri_tab3(c1 int not null, c2 int not null, primary key(c1), constraint cons_name_fri_tab3 foreign key(c2) references pri_tab3(c1));
insert into fri_tab3 values(1,1);
insert into fri_tab3 values(2,2);
truncate table pri_tab3;
ERROR 42000: Cannot truncate a table referenced in a foreign key constraint (`jx_db`.`fri_tab3`, CONSTRAINT `cons_name_fri_tab3` FOREIGN KEY (`c2`) REFERENCES `jx_db`.`pri_tab3` (`c1`))
insert into pri_tab3 values(3,3);
select count(*) from oceanbase.__all_virtual_foreign_key_history where is_deleted = 0 and child_table_id in(select table_id from oceanbase.__all_virtual_table where table_name='fri_tab3' order by schema_version desc limit 1);
count(*)
1
select count(*) from oceanbase.__all_virtual_foreign_key_history where is_deleted = 0 and parent_table_id in(select table_id from oceanbase.__all_virtual_table where table_name='pri_tab3' order by schema_version desc limit 1);
count(*)
1
drop table pri_tab3;
ERROR HY000: Cannot drop table 'pri_tab3' referenced by a foreign key constraint 'cons_name_fri_tab3' on table 'fri_tab3'
drop table fri_tab3;
drop table pri_tab3;
create table p1(c1 int primary key, c2 int);
create table f1(c1 int not null, c2 int not null, primary key(c1), foreign key(c2) references p1(c1));
create table f2(c1 int not null, c2 int not null, primary key(c1), foreign key(c2) references f1(c1));
create table f3(c1 int not null, c2 int not null, primary key(c1), foreign key(c2) references f2(c1));
drop table p1,f1,f2;
ERROR HY000: Cannot drop table 'f2' referenced by a foreign key constraint 'f3_OBFK_1234' on table 'f3'
show tables;
Tables_in_jx_db
alter_t0
alter_t1
alter_t2
f1
f2
f3
f_like
f_like_2
f_tab1_1
f_tab1_2
f_tab1_3
f_tab1_4
f_tab1_5
f_tab1_6
f_tab1_7
f_tab1_8
f_tab2
f_tab22
f_tab_datetime
f_tab_order
f_tab_sgn
f_tab_tiny
gen_f_2
gen_f_3
gen_p_1
gen_p_2
gen_p_3
info
inline_p1
item
jx_t4
mult_p1
non_user_p1
p1
p_f1
p_f2
p_like
p_tab1
p_tab2
part_f1
part_f2
part_p1
part_p2
show_p1
show_p2
show_p3
v1
create table drop_t1(c1 int primary key, c2 int);
create table drop_t2(c1 int primary key, constraint cons_name_drop_t2 foreign key(c1) references drop_t1(c1));
create table drop_t3(c1 int primary key, constraint cons_name_drop_t3 foreign key(c1) references drop_t2(c1));
drop table drop_t2;
ERROR HY000: Cannot drop table 'drop_t2' referenced by a foreign key constraint 'cons_name_drop_t3' on table 'drop_t3'
truncate table drop_t2;
ERROR 42000: Cannot truncate a table referenced in a foreign key constraint (`jx_db`.`drop_t3`, CONSTRAINT `cons_name_drop_t3` FOREIGN KEY (`c1`) REFERENCES `jx_db`.`drop_t2` (`c1`))
show tables;
Tables_in_jx_db
alter_t0
alter_t1
alter_t2
drop_t1
drop_t2
drop_t3
f1
f2
f3
f_like
f_like_2
f_tab1_1
f_tab1_2
f_tab1_3
f_tab1_4
f_tab1_5
f_tab1_6
f_tab1_7
f_tab1_8
f_tab2
f_tab22
f_tab_datetime
f_tab_order
f_tab_sgn
f_tab_tiny
gen_f_2
gen_f_3
gen_p_1
gen_p_2
gen_p_3
info
inline_p1
item
jx_t4
mult_p1
non_user_p1
p1
p_f1
p_f2
p_like
p_tab1
p_tab2
part_f1
part_f2
part_p1
part_p2
show_p1
show_p2
show_p3
v1
drop database if exists jiuren;
create database jiuren;
use jiuren;
drop table if exists t2, t1;
Warnings:
Note	1051	Unknown table 'jiuren.t2'
Note	1051	Unknown table 'jiuren.t1'
create table t1(pk int, a int, b int, primary key (pk), unique key uk_a_b (b, a));
create table t2(pk int, a int, b int, primary key (pk), unique key uk_a_b (a, b), constraint cst_name foreign key fk_name (a, b) references t1 (b, a) on update CASCADE on delete NO ACTION);
show create table t2;
Table	Create Table
t2	CREATE TABLE `t2` (
  `pk` int(11) NOT NULL,
  `a` int(11) DEFAULT NULL,
  `b` int(11) DEFAULT NULL,
  PRIMARY KEY (`pk`),
  CONSTRAINT `cst_name` FOREIGN KEY (`a`, `b`) REFERENCES `jiuren`.`t1`(`b`, `a`) ON UPDATE CASCADE ON DELETE NO ACTION ,
  UNIQUE KEY `uk_a_b` (`a`, `b`) BLOCK_SIZE 16384 LOCAL
) ORGANIZATION INDEX DEFAULT CHARSET = utf8mb4 COMPRESSION = 'lz4_1.0' REPLICA_NUM = NUM BLOCK_SIZE = SIZE USE_BLOOM_FILTER = FALSE ENABLE_MACRO_BLOCK_BLOOM_FILTER = FALSE TABLET_SIZE = SIZE PCTFREE = 10
alter table t2 drop foreign key fk_name;
ERROR 42000: Can't DROP 'fk_name'; check that column/key exists
alter table t2 drop foreign key cst_name;
drop table if exists t2, t1;
create table t1(pk int, a int, b int, primary key (pk), unique key uk_a_b (b, a));
create table t2(pk int, a int, b int, primary key (pk), unique key uk_a_b (a, b), constraint cst_name foreign key (a, b) references t1 (b, a) on update RESTRICT);
show create table t2;
Table	Create Table
t2	CREATE TABLE `t2` (
  `pk` int(11) NOT NULL,
  `a` int(11) DEFAULT NULL,
  `b` int(11) DEFAULT NULL,
  PRIMARY KEY (`pk`),
  CONSTRAINT `cst_name` FOREIGN KEY (`a`, `b`) REFERENCES `jiuren`.`t1`(`b`, `a`) ON UPDATE RESTRICT ON DELETE RESTRICT ,
  UNIQUE KEY `uk_a_b` (`a`, `b`) BLOCK_SIZE 16384 LOCAL
) ORGANIZATION INDEX DEFAULT CHARSET = utf8mb4 COMPRESSION = 'lz4_1.0' REPLICA_NUM = NUM BLOCK_SIZE = SIZE USE_BLOOM_FILTER = FALSE ENABLE_MACRO_BLOCK_BLOOM_FILTER = FALSE TABLET_SIZE = SIZE PCTFREE = 10
alter table t2 drop foreign key cst_name;
drop table if exists t2, t1;
create table t1(pk int, a int, b int, primary key (pk), unique key uk_a_b (b, a));
create table t2(pk int, a int, b int, primary key (pk), unique key uk_a_b (a, b), constraint cst_name foreign key fk_name (a, b) references t1 (b, a) on update CASCADE);
show create table t2;
Table	Create Table
t2	CREATE TABLE `t2` (
  `pk` int(11) NOT NULL,
  `a` int(11) DEFAULT NULL,
  `b` int(11) DEFAULT NULL,
  PRIMARY KEY (`pk`),
  CONSTRAINT `cst_name` FOREIGN KEY (`a`, `b`) REFERENCES `jiuren`.`t1`(`b`, `a`) ON UPDATE CASCADE ON DELETE RESTRICT ,
  UNIQUE KEY `uk_a_b` (`a`, `b`) BLOCK_SIZE 16384 LOCAL
) ORGANIZATION INDEX DEFAULT CHARSET = utf8mb4 COMPRESSION = 'lz4_1.0' REPLICA_NUM = NUM BLOCK_SIZE = SIZE USE_BLOOM_FILTER = FALSE ENABLE_MACRO_BLOCK_BLOOM_FILTER = FALSE TABLET_SIZE = SIZE PCTFREE = 10
alter table t2 drop foreign key fk_name;
ERROR 42000: Can't DROP 'fk_name'; check that column/key exists
drop table if exists t2, t1;
create table t1(pk int, a int, b int, primary key (pk), unique key uk_a_b (b, a));
create table t2(pk int, a int, b int, primary key (pk), unique key uk_a_b (a, b), constraint cst_name foreign key (a, b) references t1 (b, a) on delete SET DEFAULT);
ERROR HY000: Cannot add foreign key constraint
drop table if exists t1;
create table t1(pk int, a int, b int, primary key (pk), unique key uk_a_b (b, a));
create table t2(pk int, a int, b int, primary key (pk), unique key uk_a_b (a, b), constraint fk_name foreign key (a, b) references t1 (b, a) on update CASCADE on delete CASCADE);
show create table t2;
Table	Create Table
t2	CREATE TABLE `t2` (
  `pk` int(11) NOT NULL,
  `a` int(11) DEFAULT NULL,
  `b` int(11) DEFAULT NULL,
  PRIMARY KEY (`pk`),
  CONSTRAINT `fk_name` FOREIGN KEY (`a`, `b`) REFERENCES `jiuren`.`t1`(`b`, `a`) ON UPDATE CASCADE ON DELETE CASCADE ,
  UNIQUE KEY `uk_a_b` (`a`, `b`) BLOCK_SIZE 16384 LOCAL
) ORGANIZATION INDEX DEFAULT CHARSET = utf8mb4 COMPRESSION = 'lz4_1.0' REPLICA_NUM = NUM BLOCK_SIZE = SIZE USE_BLOOM_FILTER = FALSE ENABLE_MACRO_BLOCK_BLOOM_FILTER = FALSE TABLET_SIZE = SIZE PCTFREE = 10
alter table t2 drop foreign key fk_name;
drop table if exists t2, t1;
create table t1(pk int, a int, b int, primary key (pk), unique key uk_a_b (b, a));
create table t2(pk int, a int, b int, primary key (pk), unique key uk_a_b (a, b), constraint fk_name foreign key (a, b) references t1 (b, a) on update CASCADE on delete CASCADE);
show create table t2;
Table	Create Table
t2	CREATE TABLE `t2` (
  `pk` int(11) NOT NULL,
  `a` int(11) DEFAULT NULL,
  `b` int(11) DEFAULT NULL,
  PRIMARY KEY (`pk`),
  CONSTRAINT `fk_name` FOREIGN KEY (`a`, `b`) REFERENCES `jiuren`.`t1`(`b`, `a`) ON UPDATE CASCADE ON DELETE CASCADE ,
  UNIQUE KEY `uk_a_b` (`a`, `b`) BLOCK_SIZE 16384 LOCAL
) ORGANIZATION INDEX DEFAULT CHARSET = utf8mb4 COMPRESSION = 'lz4_1.0' REPLICA_NUM = NUM BLOCK_SIZE = SIZE USE_BLOOM_FILTER = FALSE ENABLE_MACRO_BLOCK_BLOOM_FILTER = FALSE TABLET_SIZE = SIZE PCTFREE = 10
drop table if exists t2, t1;
drop database jiuren;
