set foreign_key_checks=on;
drop table if exists t1113, t1112, t1111, t111, t12, t11, t1;
insert into t1 values (10, 11, 12), (20, 21, 22), (30, 31, 32), (40, 41, 42), (50, 51, 52), (60, 61, 62), (70, 71, 72), (80, 81, 82);
insert into t11 values (10, 11, 12), (20, 21, 22), (30, 31, 32), (40, 41, 42), (50, 51, 52), (60, 61, 62);
insert into t12 values (10, 11, 12), (20, 21, 22), (30, 31, 32), (40, 41, 42), (50, 51, 52), (60, 61, 62);
insert into t111 values (10, 11, 12), (20, 21, 22), (30, 31, 32), (40, 41, 42);
insert into t1111 values (10, 11, 12), (20, 21, 22);
insert into t1112 values (10, 11, 12), (20, 21, 22);
insert into t1113 values (10, 11, 12), (20, 21, 22);
insert into t11 values (80, 82, 81), (90, 92, 91);
ERROR 23000: Cannot add or update a child row: a foreign key constraint fails
update t11 r11 set r11.a = r11.a * 10 where r11.pk = 20;
ERROR 23000: Cannot add or update a child row: a foreign key constraint fails
select * from t1 order by pk;
pk	a	b
10	11	12
20	21	22
30	31	32
40	41	42
50	51	52
60	61	62
70	71	72
80	81	82
select * from t11 order by pk;
pk	a	b
10	11	12
20	21	22
30	31	32
40	41	42
50	51	52
60	61	62
select * from t12 order by pk;
pk	a	b
10	11	12
20	21	22
30	31	32
40	41	42
50	51	52
60	61	62
select * from t111 order by pk;
pk	a	b
10	11	12
20	21	22
30	31	32
40	41	42
select * from t1111 order by pk;
pk	a	b
10	11	12
20	21	22
select * from t1112 order by pk;
pk	a	b
10	11	12
20	21	22
select * from t1113 order by pk;
pk	a	b
10	11	12
20	21	22
update t1 r1 set r1.a = 91, r1.b = 92 where r1.pk = 10;
select * from t1 order by pk;
pk	a	b
10	91	92
20	21	22
30	31	32
40	41	42
50	51	52
60	61	62
70	71	72
80	81	82
select * from t11 order by pk;
pk	a	b
10	91	92
20	21	22
30	31	32
40	41	42
50	51	52
60	61	62
select * from t12 order by pk;
pk	a	b
10	91	92
20	21	22
30	31	32
40	41	42
50	51	52
60	61	62
select * from t111 order by pk;
pk	a	b
10	91	92
20	21	22
30	31	32
40	41	42
select * from t1111 order by pk;
pk	a	b
10	91	92
20	21	22
select * from t1112 order by pk;
pk	a	b
10	91	92
20	21	22
select * from t1113 order by pk;
pk	a	b
10	91	92
20	21	22
update t11 r11 set r11.a = 81, r11.b = 82 where r11.pk = 20;
select * from t1 order by pk;
pk	a	b
10	91	92
20	21	22
30	31	32
40	41	42
50	51	52
60	61	62
70	71	72
80	81	82
select * from t11 order by pk;
pk	a	b
10	91	92
20	81	82
30	31	32
40	41	42
50	51	52
60	61	62
select * from t12 order by pk;
pk	a	b
10	91	92
20	21	22
30	31	32
40	41	42
50	51	52
60	61	62
select * from t111 order by pk;
pk	a	b
10	91	92
20	81	82
30	31	32
40	41	42
select * from t1111 order by pk;
pk	a	b
10	91	92
20	81	82
select * from t1112 order by pk;
pk	a	b
10	91	92
20	81	82
select * from t1113 order by pk;
pk	a	b
10	91	92
20	81	82
delete from t1 r1 where r1.pk = 10;
select * from t1 order by pk;
pk	a	b
20	21	22
30	31	32
40	41	42
50	51	52
60	61	62
70	71	72
80	81	82
select * from t11 order by pk;
pk	a	b
20	81	82
30	31	32
40	41	42
50	51	52
60	61	62
select * from t12 order by pk;
pk	a	b
20	21	22
30	31	32
40	41	42
50	51	52
60	61	62
select * from t111 order by pk;
pk	a	b
20	81	82
30	31	32
40	41	42
select * from t1111 order by pk;
pk	a	b
20	81	82
select * from t1112 order by pk;
pk	a	b
20	81	82
select * from t1113 order by pk;
pk	a	b
20	81	82
delete from t11 r11 where r11.pk = 20;
select * from t1 order by pk;
pk	a	b
20	21	22
30	31	32
40	41	42
50	51	52
60	61	62
70	71	72
80	81	82
select * from t11 order by pk;
pk	a	b
30	31	32
40	41	42
50	51	52
60	61	62
select * from t12 order by pk;
pk	a	b
20	21	22
30	31	32
40	41	42
50	51	52
60	61	62
select * from t111 order by pk;
pk	a	b
30	31	32
40	41	42
select * from t1111 order by pk;
pk	a	b
select * from t1112 order by pk;
pk	a	b
select * from t1113 order by pk;
pk	a	b
delete from t1;
insert into t1 values (10, 11, 12), (20, 21, 22), (30, 31, 32), (40, 41, 42), (50, 51, 52), (60, 61, 62);
insert into t11 values (10, 11, 12), (20, 21, 22), (30, 31, 32), (40, 41, 42), (50, 51, 52), (60, 61, 62);
insert into t12 values (10, 11, 12), (20, 21, 22), (30, 31, 32), (40, 41, 42), (50, 51, 52), (60, 61, 62);
insert into t111 values (10, 11, 12), (20, 21, 22), (30, 31, 32), (40, 41, 42), (50, 51, 52);
insert into t1111 values (10, 11, 12), (20, 21, 22), (30, 31, 32), (40, 41, 42);
insert into t1112 values (10, 11, 12), (20, 21, 22), (30, 31, 32), (40, 41, 42);
insert into t1113 values (10, 11, 12), (20, 21, 22), (30, 31, 32), (40, 41, 42);
insert into t1 values (10, 11, 12), (30, 31, 32), (50, 51, 52), (70, 71, 72), (90, 91, 92) on duplicate key update a = a * 9, b = b * 9;
select * from t1 order by pk;
pk	a	b
10	99	108
20	21	22
30	279	288
40	41	42
50	459	468
60	61	62
70	71	72
90	91	92
select * from t11 order by pk;
pk	a	b
10	99	108
20	21	22
30	279	288
40	41	42
50	459	468
60	61	62
select * from t12 order by pk;
pk	a	b
10	99	108
20	21	22
30	279	288
40	41	42
50	459	468
60	61	62
select * from t111 order by pk;
pk	a	b
10	99	108
20	21	22
30	279	288
40	41	42
50	459	468
select * from t1111 order by pk;
pk	a	b
10	99	108
20	21	22
30	279	288
40	41	42
select * from t1112 order by pk;
pk	a	b
10	99	108
20	21	22
30	279	288
40	41	42
select * from t1113 order by pk;
pk	a	b
10	99	108
20	21	22
30	279	288
40	41	42
replace into t1 values (20, 21, 22), (40, 41, 42), (60, 61, 62), (80, 81, 82), (100, 101, 102);
select * from t1 order by pk;
pk	a	b
10	99	108
20	21	22
30	279	288
40	41	42
50	459	468
60	61	62
70	71	72
80	81	82
90	91	92
100	101	102
select * from t11 order by pk;
pk	a	b
10	99	108
30	279	288
50	459	468
select * from t12 order by pk;
pk	a	b
10	99	108
30	279	288
50	459	468
select * from t111 order by pk;
pk	a	b
10	99	108
30	279	288
50	459	468
select * from t1111 order by pk;
pk	a	b
10	99	108
30	279	288
select * from t1112 order by pk;
pk	a	b
10	99	108
30	279	288
select * from t1113 order by pk;
pk	a	b
10	99	108
30	279	288
drop table if exists t1113, t1112, t1111, t111, t12, t11, t1;
create table t1(pk int, a int, b int, primary key (a), unique key uk_a_b (a, b))
partition by hash(a) partitions 3;
create table t11(pk int, a int, b int, primary key (a), unique key uk_a_b (a, b),
constraint foreign key (a, b) references t1 (a, b) on update CASCADE on delete CASCADE)
partition by hash(a) partitions 3;
create table t12(pk int, a int, b int, primary key (a), unique key uk_a_b (a, b),
constraint foreign key (a, b) references t1 (a, b) on update CASCADE on delete CASCADE)
partition by hash(a) partitions 3;
create table t111(pk int, a int, b int, primary key (a), unique key uk_a_b (a, b),
constraint foreign key (a, b) references t11 (a, b) on update CASCADE on delete CASCADE)
partition by hash(a) partitions 3;
create table t1111(pk int, a int, b int, primary key (a), unique key uk_a_b (a, b),
constraint foreign key (a, b) references t111 (a, b) on update CASCADE on delete CASCADE)
partition by hash(a) partitions 3;
create table t1112(pk int, a int, b int, primary key (a), unique key uk_a_b (a, b),
constraint foreign key (a, b) references t111 (a, b) on update CASCADE on delete CASCADE)
partition by hash(a) partitions 3;
create table t1113(pk int, a int, b int, primary key (a), unique key uk_a_b (a, b),
constraint foreign key (a, b) references t111 (a, b) on update CASCADE on delete CASCADE)
partition by hash(a) partitions 3;
insert into t1 values (10, 11, 12), (20, 21, 22), (30, 31, 32), (40, 41, 42), (50, 51, 52), (60, 61, 62), (70, 71, 72), (80, 81, 82);
insert into t11 values (10, 11, 12), (20, 21, 22), (30, 31, 32), (40, 41, 42), (50, 51, 52), (60, 61, 62), (70, 71, 72);
insert into t12 values (10, 11, 12), (20, 21, 22), (30, 31, 32), (40, 41, 42), (50, 51, 52), (60, 61, 62), (70, 71, 72);
insert into t111 values (10, 11, 12), (20, 21, 22), (30, 31, 32), (40, 41, 42), (50, 51, 52), (60, 61, 62);
insert into t1111 values (10, 11, 12), (20, 21, 22), (30, 31, 32), (40, 41, 42), (50, 51, 52);
insert into t1112 values (10, 11, 12), (20, 21, 22), (30, 31, 32), (40, 41, 42), (50, 51, 52);
insert into t1113 values (10, 11, 12), (20, 21, 22), (30, 31, 32), (40, 41, 42), (50, 51, 52);
insert into t11 values (80, 82, 81), (90, 92, 91);
ERROR 23000: Cannot add or update a child row: a foreign key constraint fails
update t11 set a = a * 10 where pk = 20;
ERROR 23000: Cannot add or update a child row: a foreign key constraint fails
select * from t1 order by pk;
pk	a	b
10	11	12
20	21	22
30	31	32
40	41	42
50	51	52
60	61	62
70	71	72
80	81	82
select * from t11 order by pk;
pk	a	b
10	11	12
20	21	22
30	31	32
40	41	42
50	51	52
60	61	62
70	71	72
select * from t12 order by pk;
pk	a	b
10	11	12
20	21	22
30	31	32
40	41	42
50	51	52
60	61	62
70	71	72
select * from t111 order by pk;
pk	a	b
10	11	12
20	21	22
30	31	32
40	41	42
50	51	52
60	61	62
select * from t1111 order by pk;
pk	a	b
10	11	12
20	21	22
30	31	32
40	41	42
50	51	52
select * from t1112 order by pk;
pk	a	b
10	11	12
20	21	22
30	31	32
40	41	42
50	51	52
select * from t1113 order by pk;
pk	a	b
10	11	12
20	21	22
30	31	32
40	41	42
50	51	52
update t1 set a = a * 10, b = b * 10 where pk < 40;
select * from t1 order by pk;
pk	a	b
10	110	120
20	210	220
30	310	320
40	41	42
50	51	52
60	61	62
70	71	72
80	81	82
select * from t11 order by pk;
pk	a	b
10	110	120
20	210	220
30	310	320
40	41	42
50	51	52
60	61	62
70	71	72
select * from t12 order by pk;
pk	a	b
10	110	120
20	210	220
30	310	320
40	41	42
50	51	52
60	61	62
70	71	72
select * from t111 order by pk;
pk	a	b
10	110	120
20	210	220
30	310	320
40	41	42
50	51	52
60	61	62
select * from t1111 order by pk;
pk	a	b
10	110	120
20	210	220
30	310	320
40	41	42
50	51	52
select * from t1112 order by pk;
pk	a	b
10	110	120
20	210	220
30	310	320
40	41	42
50	51	52
select * from t1113 order by pk;
pk	a	b
10	110	120
20	210	220
30	310	320
40	41	42
50	51	52
update t11 set a = 81, b = 82 where pk = 20;
select * from t1 order by pk;
pk	a	b
10	110	120
20	210	220
30	310	320
40	41	42
50	51	52
60	61	62
70	71	72
80	81	82
select * from t11 order by pk;
pk	a	b
10	110	120
20	81	82
30	310	320
40	41	42
50	51	52
60	61	62
70	71	72
select * from t12 order by pk;
pk	a	b
10	110	120
20	210	220
30	310	320
40	41	42
50	51	52
60	61	62
70	71	72
select * from t111 order by pk;
pk	a	b
10	110	120
20	81	82
30	310	320
40	41	42
50	51	52
60	61	62
select * from t1111 order by pk;
pk	a	b
10	110	120
20	81	82
30	310	320
40	41	42
50	51	52
select * from t1112 order by pk;
pk	a	b
10	110	120
20	81	82
30	310	320
40	41	42
50	51	52
select * from t1113 order by pk;
pk	a	b
10	110	120
20	81	82
30	310	320
40	41	42
50	51	52
delete from t1 where pk = 10;
select * from t1 order by pk;
pk	a	b
20	210	220
30	310	320
40	41	42
50	51	52
60	61	62
70	71	72
80	81	82
select * from t11 order by pk;
pk	a	b
20	81	82
30	310	320
40	41	42
50	51	52
60	61	62
70	71	72
select * from t12 order by pk;
pk	a	b
20	210	220
30	310	320
40	41	42
50	51	52
60	61	62
70	71	72
select * from t111 order by pk;
pk	a	b
20	81	82
30	310	320
40	41	42
50	51	52
60	61	62
select * from t1111 order by pk;
pk	a	b
20	81	82
30	310	320
40	41	42
50	51	52
select * from t1112 order by pk;
pk	a	b
20	81	82
30	310	320
40	41	42
50	51	52
select * from t1113 order by pk;
pk	a	b
20	81	82
30	310	320
40	41	42
50	51	52
delete from t11 where pk < 40;
select * from t1 order by pk;
pk	a	b
20	210	220
30	310	320
40	41	42
50	51	52
60	61	62
70	71	72
80	81	82
select * from t11 order by pk;
pk	a	b
40	41	42
50	51	52
60	61	62
70	71	72
select * from t12 order by pk;
pk	a	b
20	210	220
30	310	320
40	41	42
50	51	52
60	61	62
70	71	72
select * from t111 order by pk;
pk	a	b
40	41	42
50	51	52
60	61	62
select * from t1111 order by pk;
pk	a	b
40	41	42
50	51	52
select * from t1112 order by pk;
pk	a	b
40	41	42
50	51	52
select * from t1113 order by pk;
pk	a	b
40	41	42
50	51	52
delete from t1;
insert into t1 values (10, 11, 12), (20, 21, 22), (30, 31, 32), (40, 41, 42), (50, 51, 52), (60, 61, 62);
insert into t11 values (10, 11, 12), (20, 21, 22), (30, 31, 32), (40, 41, 42), (50, 51, 52), (60, 61, 62);
insert into t12 values (10, 11, 12), (20, 21, 22), (30, 31, 32), (40, 41, 42), (50, 51, 52), (60, 61, 62);
insert into t111 values (10, 11, 12), (20, 21, 22), (30, 31, 32), (40, 41, 42), (50, 51, 52);
insert into t1111 values (10, 11, 12), (20, 21, 22), (30, 31, 32), (40, 41, 42);
insert into t1112 values (10, 11, 12), (20, 21, 22), (30, 31, 32), (40, 41, 42);
insert into t1113 values (10, 11, 12), (20, 21, 22), (30, 31, 32), (40, 41, 42);
insert into t1 values (10, 11, 12), (30, 31, 32), (50, 51, 52), (70, 71, 72), (90, 91, 92) on duplicate key update a = a * 9, b = b * 9;
select * from t1 order by pk;
pk	a	b
10	99	108
20	21	22
30	279	288
40	41	42
50	459	468
60	61	62
70	71	72
90	91	92
select * from t11 order by pk;
pk	a	b
10	99	108
20	21	22
30	279	288
40	41	42
50	459	468
60	61	62
select * from t12 order by pk;
pk	a	b
10	99	108
20	21	22
30	279	288
40	41	42
50	459	468
60	61	62
select * from t111 order by pk;
pk	a	b
10	99	108
20	21	22
30	279	288
40	41	42
50	459	468
select * from t1111 order by pk;
pk	a	b
10	99	108
20	21	22
30	279	288
40	41	42
select * from t1112 order by pk;
pk	a	b
10	99	108
20	21	22
30	279	288
40	41	42
select * from t1113 order by pk;
pk	a	b
10	99	108
20	21	22
30	279	288
40	41	42
replace into t1 values (20, 21, 22), (40, 41, 42), (60, 61, 62), (80, 81, 82), (100, 101, 102);
select * from t1 order by pk;
pk	a	b
10	99	108
20	21	22
30	279	288
40	41	42
50	459	468
60	61	62
70	71	72
80	81	82
90	91	92
100	101	102
select * from t11 order by pk;
pk	a	b
10	99	108
30	279	288
50	459	468
select * from t12 order by pk;
pk	a	b
10	99	108
30	279	288
50	459	468
select * from t111 order by pk;
pk	a	b
10	99	108
30	279	288
50	459	468
select * from t1111 order by pk;
pk	a	b
10	99	108
30	279	288
select * from t1112 order by pk;
pk	a	b
10	99	108
30	279	288
select * from t1113 order by pk;
pk	a	b
10	99	108
30	279	288
set foreign_key_checks=on;
drop table if exists t1113, t1112, t1111, t111, t12, t11, t1;
create table t1(pk int, a int, b int, primary key (a), unique key uk_a_b (a, b) local)
partition by hash(a) partitions 3;
create table t11(pk int, a int, b int, primary key (a), unique key uk_a_b (a, b) local,
constraint foreign key (a, b) references t1 (a, b) on update CASCADE on delete CASCADE)
partition by hash(a) partitions 3;
create table t12(pk int, a int, b int, primary key (a), unique key uk_a_b (a, b) local,
constraint foreign key (a, b) references t1 (a, b) on update CASCADE on delete CASCADE)
partition by hash(a) partitions 3;
create table t111(pk int, a int, b int, primary key (a), unique key uk_a_b (a, b) local,
constraint foreign key (a, b) references t11 (a, b) on update CASCADE on delete CASCADE)
partition by hash(a) partitions 3;
create table t1111(pk int, a int, b int, primary key (a), unique key uk_a_b (a, b) local,
constraint foreign key (a, b) references t111 (a, b) on update CASCADE on delete CASCADE)
partition by hash(a) partitions 3;
create table t1112(pk int, a int, b int, primary key (a), unique key uk_a_b (a, b) local,
constraint foreign key (a, b) references t111 (a, b) on update CASCADE on delete CASCADE)
partition by hash(a) partitions 3;
create table t1113(pk int, a int, b int, primary key (a), unique key uk_a_b (a, b) local,
constraint foreign key (a, b) references t111 (a, b) on update CASCADE on delete CASCADE)
partition by hash(a) partitions 3;
insert into t1 values (10, 11, 12), (20, 21, 22), (30, 31, 32), (40, 41, 42), (50, 51, 52), (60, 61, 62), (70, 71, 72), (80, 81, 82);
insert into t11 values (10, 11, 12), (20, 21, 22), (30, 31, 32), (40, 41, 42), (50, 51, 52), (60, 61, 62), (70, 71, 72);
insert into t12 values (10, 11, 12), (20, 21, 22), (30, 31, 32), (40, 41, 42), (50, 51, 52), (60, 61, 62), (70, 71, 72);
insert into t111 values (10, 11, 12), (20, 21, 22), (30, 31, 32), (40, 41, 42), (50, 51, 52), (60, 61, 62);
insert into t1111 values (10, 11, 12), (20, 21, 22), (30, 31, 32), (40, 41, 42), (50, 51, 52);
insert into t1112 values (10, 11, 12), (20, 21, 22), (30, 31, 32), (40, 41, 42), (50, 51, 52);
insert into t1113 values (10, 11, 12), (20, 21, 22), (30, 31, 32), (40, 41, 42), (50, 51, 52);
insert into t11 values (80, 82, 81), (90, 92, 91);
ERROR 23000: Cannot add or update a child row: a foreign key constraint fails
update t11 set a = a * 10 where pk = 20;
ERROR 23000: Cannot add or update a child row: a foreign key constraint fails
select * from t1 order by pk;
pk	a	b
10	11	12
20	21	22
30	31	32
40	41	42
50	51	52
60	61	62
70	71	72
80	81	82
select * from t11 order by pk;
pk	a	b
10	11	12
20	21	22
30	31	32
40	41	42
50	51	52
60	61	62
70	71	72
select * from t12 order by pk;
pk	a	b
10	11	12
20	21	22
30	31	32
40	41	42
50	51	52
60	61	62
70	71	72
select * from t111 order by pk;
pk	a	b
10	11	12
20	21	22
30	31	32
40	41	42
50	51	52
60	61	62
select * from t1111 order by pk;
pk	a	b
10	11	12
20	21	22
30	31	32
40	41	42
50	51	52
select * from t1112 order by pk;
pk	a	b
10	11	12
20	21	22
30	31	32
40	41	42
50	51	52
select * from t1113 order by pk;
pk	a	b
10	11	12
20	21	22
30	31	32
40	41	42
50	51	52
update t1 set a = a * 10, b = b * 10 where pk < 40;
select * from t1 order by pk;
pk	a	b
10	110	120
20	210	220
30	310	320
40	41	42
50	51	52
60	61	62
70	71	72
80	81	82
select * from t11 order by pk;
pk	a	b
10	110	120
20	210	220
30	310	320
40	41	42
50	51	52
60	61	62
70	71	72
select * from t12 order by pk;
pk	a	b
10	110	120
20	210	220
30	310	320
40	41	42
50	51	52
60	61	62
70	71	72
select * from t111 order by pk;
pk	a	b
10	110	120
20	210	220
30	310	320
40	41	42
50	51	52
60	61	62
select * from t1111 order by pk;
pk	a	b
10	110	120
20	210	220
30	310	320
40	41	42
50	51	52
select * from t1112 order by pk;
pk	a	b
10	110	120
20	210	220
30	310	320
40	41	42
50	51	52
select * from t1113 order by pk;
pk	a	b
10	110	120
20	210	220
30	310	320
40	41	42
50	51	52
update t11 set a = 81, b = 82 where pk = 20;
select * from t1 order by pk;
pk	a	b
10	110	120
20	210	220
30	310	320
40	41	42
50	51	52
60	61	62
70	71	72
80	81	82
select * from t11 order by pk;
pk	a	b
10	110	120
20	81	82
30	310	320
40	41	42
50	51	52
60	61	62
70	71	72
select * from t12 order by pk;
pk	a	b
10	110	120
20	210	220
30	310	320
40	41	42
50	51	52
60	61	62
70	71	72
select * from t111 order by pk;
pk	a	b
10	110	120
20	81	82
30	310	320
40	41	42
50	51	52
60	61	62
select * from t1111 order by pk;
pk	a	b
10	110	120
20	81	82
30	310	320
40	41	42
50	51	52
select * from t1112 order by pk;
pk	a	b
10	110	120
20	81	82
30	310	320
40	41	42
50	51	52
select * from t1113 order by pk;
pk	a	b
10	110	120
20	81	82
30	310	320
40	41	42
50	51	52
delete from t1 where pk = 10;
select * from t1 order by pk;
pk	a	b
20	210	220
30	310	320
40	41	42
50	51	52
60	61	62
70	71	72
80	81	82
select * from t11 order by pk;
pk	a	b
20	81	82
30	310	320
40	41	42
50	51	52
60	61	62
70	71	72
select * from t12 order by pk;
pk	a	b
20	210	220
30	310	320
40	41	42
50	51	52
60	61	62
70	71	72
select * from t111 order by pk;
pk	a	b
20	81	82
30	310	320
40	41	42
50	51	52
60	61	62
select * from t1111 order by pk;
pk	a	b
20	81	82
30	310	320
40	41	42
50	51	52
select * from t1112 order by pk;
pk	a	b
20	81	82
30	310	320
40	41	42
50	51	52
select * from t1113 order by pk;
pk	a	b
20	81	82
30	310	320
40	41	42
50	51	52
delete from t11 where pk < 40;
select * from t1 order by pk;
pk	a	b
20	210	220
30	310	320
40	41	42
50	51	52
60	61	62
70	71	72
80	81	82
select * from t11 order by pk;
pk	a	b
40	41	42
50	51	52
60	61	62
70	71	72
select * from t12 order by pk;
pk	a	b
20	210	220
30	310	320
40	41	42
50	51	52
60	61	62
70	71	72
select * from t111 order by pk;
pk	a	b
40	41	42
50	51	52
60	61	62
select * from t1111 order by pk;
pk	a	b
40	41	42
50	51	52
select * from t1112 order by pk;
pk	a	b
40	41	42
50	51	52
select * from t1113 order by pk;
pk	a	b
40	41	42
50	51	52
delete from t1;
insert into t1 values (10, 11, 12), (20, 21, 22), (30, 31, 32), (40, 41, 42), (50, 51, 52), (60, 61, 62);
insert into t11 values (10, 11, 12), (20, 21, 22), (30, 31, 32), (40, 41, 42), (50, 51, 52), (60, 61, 62);
insert into t12 values (10, 11, 12), (20, 21, 22), (30, 31, 32), (40, 41, 42), (50, 51, 52), (60, 61, 62);
insert into t111 values (10, 11, 12), (20, 21, 22), (30, 31, 32), (40, 41, 42), (50, 51, 52);
insert into t1111 values (10, 11, 12), (20, 21, 22), (30, 31, 32), (40, 41, 42);
insert into t1112 values (10, 11, 12), (20, 21, 22), (30, 31, 32), (40, 41, 42);
insert into t1113 values (10, 11, 12), (20, 21, 22), (30, 31, 32), (40, 41, 42);
insert into t1 values (10, 11, 12), (30, 31, 32), (50, 51, 52), (70, 71, 72), (90, 91, 92) on duplicate key update a = a * 9, b = b * 9;
select * from t1 order by pk;
pk	a	b
10	99	108
20	21	22
30	279	288
40	41	42
50	459	468
60	61	62
70	71	72
90	91	92
select * from t11 order by pk;
pk	a	b
10	99	108
20	21	22
30	279	288
40	41	42
50	459	468
60	61	62
select * from t12 order by pk;
pk	a	b
10	99	108
20	21	22
30	279	288
40	41	42
50	459	468
60	61	62
select * from t111 order by pk;
pk	a	b
10	99	108
20	21	22
30	279	288
40	41	42
50	459	468
select * from t1111 order by pk;
pk	a	b
10	99	108
20	21	22
30	279	288
40	41	42
select * from t1112 order by pk;
pk	a	b
10	99	108
20	21	22
30	279	288
40	41	42
select * from t1113 order by pk;
pk	a	b
10	99	108
20	21	22
30	279	288
40	41	42
replace into t1 values (20, 21, 22), (40, 41, 42), (60, 61, 62), (80, 81, 82), (100, 101, 102);
select * from t1 order by pk;
pk	a	b
10	99	108
20	21	22
30	279	288
40	41	42
50	459	468
60	61	62
70	71	72
80	81	82
90	91	92
100	101	102
select * from t11 order by pk;
pk	a	b
10	99	108
30	279	288
50	459	468
select * from t12 order by pk;
pk	a	b
10	99	108
30	279	288
50	459	468
select * from t111 order by pk;
pk	a	b
10	99	108
30	279	288
50	459	468
select * from t1111 order by pk;
pk	a	b
10	99	108
30	279	288
select * from t1112 order by pk;
pk	a	b
10	99	108
30	279	288
select * from t1113 order by pk;
pk	a	b
10	99	108
30	279	288
drop table if exists t1113, t1112, t1111, t111, t12, t11, t1;
set foreign_key_checks=on;
drop table if exists t2, t3, t4;
create table t2(pk int, a int, b int, c int, d int, primary key (a), unique key uk_a_b (a, b),
constraint foreign key (c, d) references t2 (a, b) on update CASCADE on delete CASCADE);
create table t3(pk int, a int, b int, c int, d int, primary key (a), unique key uk_a_b (a, b),
constraint foreign key (c, d) references t3 (a, b) on update CASCADE on delete CASCADE)
partition by hash(a) partitions 7;
create table t4(pk int, a int, b int, c int, d int, primary key (a), unique key uk_a_b (a, b) local,
constraint foreign key (c, d) references t4 (a, b) on update CASCADE on delete CASCADE)
partition by hash(a) partitions 7;
# binlog_row_image是不常用的测试点，这里不保存原始设置，后面直接恢复为默认值FULL。
SET session binlog_row_image = 'MINIMAL';
insert into t2 values (10, 11, 12, 11, 12), (20, 21, 22, 21, 22);
insert into t2 values (30, 31, 32, 11, 12), (40, 41, 42, 21, 22);
select * from t2 order by pk;
pk	a	b	c	d
10	11	12	11	12
20	21	22	21	22
30	31	32	11	12
40	41	42	21	22
update t2 set a = a * 10, b = b * 10 where pk < 30;
ERROR 23000: Cannot delete or update a parent row: a foreign key constraint fails
select * from t2 order by pk;
pk	a	b	c	d
10	11	12	11	12
20	21	22	21	22
30	31	32	11	12
40	41	42	21	22
delete from t2 where pk < 20;
select * from t2 order by pk;
pk	a	b	c	d
20	21	22	21	22
40	41	42	21	22
insert into t3 values (10, 11, 12, 11, 12), (20, 21, 22, 21, 22);
insert into t3 values (30, 31, 32, 11, 12), (40, 41, 42, 21, 22);
select * from t3 order by pk;
pk	a	b	c	d
10	11	12	11	12
20	21	22	21	22
30	31	32	11	12
40	41	42	21	22
update t3 set a = a * 10, b = b * 10 where pk < 30;
ERROR 23000: Cannot delete or update a parent row: a foreign key constraint fails
select * from t3 order by pk;
pk	a	b	c	d
10	11	12	11	12
20	21	22	21	22
30	31	32	11	12
40	41	42	21	22
delete from t3 where pk < 20;
select * from t3 order by pk;
pk	a	b	c	d
20	21	22	21	22
40	41	42	21	22
insert into t4 values (10, 11, 12, 11, 12), (20, 21, 22, 21, 22);
insert into t4 values (30, 31, 32, 11, 12), (40, 41, 42, 21, 22);
select * from t4 order by pk;
pk	a	b	c	d
10	11	12	11	12
20	21	22	21	22
30	31	32	11	12
40	41	42	21	22
update t4 set a = a * 10, b = b * 10 where pk < 30;
ERROR 23000: Cannot delete or update a parent row: a foreign key constraint fails
select * from t4 order by pk;
pk	a	b	c	d
10	11	12	11	12
20	21	22	21	22
30	31	32	11	12
40	41	42	21	22
delete from t4 where pk < 20;
select * from t4 order by pk;
pk	a	b	c	d
20	21	22	21	22
40	41	42	21	22
SET session binlog_row_image = 'FULL';
drop table if exists t2, t3, t4;
set foreign_key_checks=on;
drop table if exists t2;
create table t2(pk int, a int, b int, c int, d int, primary key (a), unique key uk_a_b (a, b),
constraint foreign key (c, d) references t2 (a, b) on update NO ACTION on delete RESTRICT)
partition by hash(a) partitions 7;
insert into t2 values (10, 11, 12, 11, 12), (20, 21, 22, 21, 22);
insert into t2 values (30, 31, 32, 11, 12), (40, 41, 42, 21, 22);
select * from t2 order by pk;
pk	a	b	c	d
10	11	12	11	12
20	21	22	21	22
30	31	32	11	12
40	41	42	21	22
update t2 set a = a * 10, b = b * 10 where pk < 30;
ERROR 23000: Cannot delete or update a parent row: a foreign key constraint fails
select * from t2 order by pk;
pk	a	b	c	d
10	11	12	11	12
20	21	22	21	22
30	31	32	11	12
40	41	42	21	22
delete from t2 where pk < 20;
ERROR 23000: Cannot delete or update a parent row: a foreign key constraint fails
select * from t2 order by pk;
pk	a	b	c	d
10	11	12	11	12
20	21	22	21	22
30	31	32	11	12
40	41	42	21	22
drop table if exists t2;
drop table if exists t11;
drop table if exists t21;
drop table if exists t31;
drop table if exists t10;
drop table if exists t20;
drop table if exists t30;
create table t10 (`d1` date primary key);
create table t20 (dt2 datetime(2) primary key);
create table t30 (ts3 timestamp(3) primary key);
create table t11 (pk int primary key, d1 date, foreign key (d1) references t10 (`d1`));
create table t21 (pk int primary key, `dt2` datetime(2), foreign key (`dt2`) references t20 (dt2) on update cascade);
create table t31 (pk int primary key, ts3 timestamp(3), foreign key (ts3) references t30 (ts3) on delete cascade);
insert into t10 values ('2020-01-01');
insert into t20 values ('2020-01-01 12:34:56.123456');
insert into t30 values ('2020-01-01 12:34:56.123456');
insert into t11 values (1, '2020-01-01');
insert into t21 values (1, '2020-01-01 12:34:56.123456');
insert into t31 values (1, '2020-01-01 12:34:56.123456');
select * from t10;
d1
2020-01-01
select * from t20;
dt2
2020-01-01 12:34:56.12
select * from t30;
ts3
2020-01-01 12:34:56.123
select * from t11;
pk	d1
1	2020-01-01
select * from t21;
pk	dt2
1	2020-01-01 12:34:56.12
select * from t31;
pk	ts3
1	2020-01-01 12:34:56.123
insert into t11 values (1, '2020-01-22');
ERROR 23000: Duplicate entry '1' for key 'PRIMARY'
insert into t21 values (1, '2020-01-22 12:34:56.123456');
ERROR 23000: Duplicate entry '1' for key 'PRIMARY'
insert into t31 values (1, '2020-01-22 12:34:56.123456');
ERROR 23000: Duplicate entry '1' for key 'PRIMARY'
update t10 set `d1` = '2020-11-22';
ERROR 23000: Cannot delete or update a parent row: a foreign key constraint fails
update t20 set dt2 = '2020-11-22 12:34:56.654321';
update t30 set ts3 = '2020-11-22 12:34:56.654321';
ERROR 23000: Cannot delete or update a parent row: a foreign key constraint fails
select * from t10;
d1
2020-01-01
select * from t20;
dt2
2020-11-22 12:34:56.65
select * from t30;
ts3
2020-01-01 12:34:56.123
select * from t11;
pk	d1
1	2020-01-01
select * from t21;
pk	dt2
1	2020-11-22 12:34:56.65
select * from t31;
pk	ts3
1	2020-01-01 12:34:56.123
delete from t10;
ERROR 23000: Cannot delete or update a parent row: a foreign key constraint fails
delete from t20;
ERROR 23000: Cannot delete or update a parent row: a foreign key constraint fails
delete from t30;
delete from t11;
delete from t21;
delete from t10;
delete from t20;
select * from t10;
d1
select * from t20;
dt2
select * from t30;
ts3
select * from t11;
pk	d1
select * from t21;
pk	dt2
select * from t31;
pk	ts3
drop table if exists t11;
drop table if exists t21;
drop table if exists t31;
drop table if exists t10;
drop table if exists t20;
drop table if exists t30;
drop table if exists t1;
create table t1 (
a int not null,
b int,
primary key (a),
foreign key fk1 (b) references t1 (a) on update cascade on delete cascade
);
insert into t1 values (1, null);
insert into t1 values (11, 1);
select * from t1;
a	b
1	NULL
11	1
delete from t1 where a = 1;
select * from t1;
a	b
drop table if exists t1;
create table t1 (
a int not null,
b int,
c int,
primary key (a),
foreign key fk1 (b) references t1 (a) on update cascade on delete cascade,
foreign key fk2 (c) references t1 (a) on update cascade on delete cascade
);
insert into t1 values (1, null, null);
insert into t1 values (2, null, null);
insert into t1 values (3, 1, 2);
insert into t1 values (4, 4, 4);
select * from t1;
a	b	c
1	NULL	NULL
2	NULL	NULL
3	1	2
4	4	4
update t1 set a = a + 100 where a < 3;
ERROR 23000: Cannot delete or update a parent row: a foreign key constraint fails
update t1 set a = a + 100 where a = 4;
ERROR 23000: Cannot delete or update a parent row: a foreign key constraint fails
delete from t1 where a < 3;
delete from t1 where a = 4;
select * from t1;
a	b	c
drop table if exists t2;
drop table if exists t1;
create table t1 (
a int not null,
b int,
c int,
primary key (a)
);
create table t2 (
a int not null,
b int,
c int,
primary key (a),
foreign key fk1 (b) references t1 (a) on update cascade,
foreign key fk2 (c) references t1 (a) on update cascade
);
create index t2_b_c on t2 (b, c) global;
insert into t1 values (1, null, null);
insert into t1 values (2, null, null);
insert into t2 values (3, 1, 2);
update t1 set a = a + 100 where a < 3;
select * from t1;
a	b	c
101	NULL	NULL
102	NULL	NULL
select * from t2;
a	b	c
3	101	102
select * from t2 where a = 1;
a	b	c
select * from t2 where b = 1;
a	b	c
select * from t2 where a = 101;
a	b	c
select * from t2 where b = 101;
a	b	c
3	101	102
drop table if exists t2;
drop table if exists t1;
create table t1 (
a int not null,
b int,
c int,
primary key (a)
);
create table t2 (
a int not null,
b int,
c int,
primary key (a),
foreign key fk1 (b) references t1 (a) on update cascade,
foreign key fk2 (c) references t1 (a) on update cascade
);
create index t2_b_c on t2 (b, c) local;
insert into t1 values (1, null, null);
insert into t1 values (2, null, null);
insert into t2 values (3, 1, 2);
update t1 set a = a + 100 where a < 3;
select * from t1;
a	b	c
101	NULL	NULL
102	NULL	NULL
select * from t2;
a	b	c
3	101	102
select * from t2 where a = 1;
a	b	c
select * from t2 where b = 1;
a	b	c
select * from t2 where a = 101;
a	b	c
select * from t2 where b = 101;
a	b	c
3	101	102
drop table if exists t2;
drop table if exists t1;
drop table if exists t11;
drop table if exists t21;
drop table if exists t31;
drop table if exists t10;
drop table if exists t20;
drop table if exists t30;
create table t10 (`d1` date primary key);
create table t20 (dt2 datetime(2) primary key);
create table t30 (ts3 timestamp(3) primary key);
create table t11 (pk int primary key, d1 date, foreign key (d1) references t10 (`d1`));
create table t21 (pk int primary key, `dt2` datetime(2), foreign key (`dt2`) references t20 (dt2) on update cascade);
create table t31 (pk int primary key, ts3 timestamp(3), foreign key (ts3) references t30 (ts3) on delete cascade);
insert into t10 values ('2020-01-01');
insert into t20 values ('2020-01-01 12:34:56.123456');
insert into t30 values ('2020-01-01 12:34:56.123456');
insert into t11 values (1, '2020-01-01');
insert into t21 values (1, '2020-01-01 12:34:56.123456');
insert into t31 values (1, '2020-01-01 12:34:56.123456');
select * from t10;
d1
2020-01-01
select * from t20;
dt2
2020-01-01 12:34:56.12
select * from t30;
ts3
2020-01-01 12:34:56.123
select * from t11;
pk	d1
1	2020-01-01
select * from t21;
pk	dt2
1	2020-01-01 12:34:56.12
select * from t31;
pk	ts3
1	2020-01-01 12:34:56.123
insert into t11 values (1, '2020-01-22');
ERROR 23000: Duplicate entry '1' for key 'PRIMARY'
insert into t21 values (1, '2020-01-22 12:34:56.123456');
ERROR 23000: Duplicate entry '1' for key 'PRIMARY'
insert into t31 values (1, '2020-01-22 12:34:56.123456');
ERROR 23000: Duplicate entry '1' for key 'PRIMARY'
update t10 set `d1` = '2020-11-22';
ERROR 23000: Cannot delete or update a parent row: a foreign key constraint fails
update t20 set dt2 = '2020-11-22 12:34:56.654321';
update t30 set ts3 = '2020-11-22 12:34:56.654321';
ERROR 23000: Cannot delete or update a parent row: a foreign key constraint fails
select * from t10;
d1
2020-01-01
select * from t20;
dt2
2020-11-22 12:34:56.65
select * from t30;
ts3
2020-01-01 12:34:56.123
select * from t11;
pk	d1
1	2020-01-01
select * from t21;
pk	dt2
1	2020-11-22 12:34:56.65
select * from t31;
pk	ts3
1	2020-01-01 12:34:56.123
delete from t10;
ERROR 23000: Cannot delete or update a parent row: a foreign key constraint fails
delete from t20;
ERROR 23000: Cannot delete or update a parent row: a foreign key constraint fails
delete from t30;
delete from t11;
delete from t21;
delete from t10;
delete from t20;
select * from t10;
d1
select * from t20;
dt2
select * from t30;
ts3
select * from t11;
pk	d1
select * from t21;
pk	dt2
select * from t31;
pk	ts3
drop table if exists t11;
drop table if exists t21;
drop table if exists t31;
drop table if exists t10;
drop table if exists t20;
drop table if exists t30;
