drop table if exists t3;
drop table if exists t2;
drop table if exists t1;
drop table if exists t0;
result_format: 4
alter system set_tp tp_no = 302, error_code = 200, frequency = 1;
affected rows: 0

## 非分区表，查询主表，batch优化查询
create table t1 (c1 int primary key, c2 int);
affected rows: 0
create table t2 (c1 int primary key, c2 int, foreign key (c2) references t1(c1));
affected rows: 0
insert into t1 values (1,1),(2,2),(3,3);
affected rows: 3
info: Records: 3  Duplicates: 0  Warnings: 0

insert into t2 values (1,1),(2,1),(3,1),(4,2),(5,1),(6,1),(7,1),(8,1),(9,2),(10,1);
affected rows: 10
info: Records: 10  Duplicates: 0  Warnings: 0
select * from t2;
+----+------+
| c1 | c2   |
+----+------+
|  1 |    1 |
|  2 |    1 |
|  3 |    1 |
|  4 |    2 |
|  5 |    1 |
|  6 |    1 |
|  7 |    1 |
|  8 |    1 |
|  9 |    2 |
| 10 |    1 |
+----+------+
affected rows: 10
update t2 set c2 = c2 + 1;
affected rows: 10
info: Rows matched: 10  Changed: 10  Warnings: 0
select * from t2;
+----+------+
| c1 | c2   |
+----+------+
|  1 |    2 |
|  2 |    2 |
|  3 |    2 |
|  4 |    3 |
|  5 |    2 |
|  6 |    2 |
|  7 |    2 |
|  8 |    2 |
|  9 |    3 |
| 10 |    2 |
+----+------+
affected rows: 10

update t2 set c2 = c2 - 1;
affected rows: 10
info: Rows matched: 10  Changed: 10  Warnings: 0
select * from t2;
+----+------+
| c1 | c2   |
+----+------+
|  1 |    1 |
|  2 |    1 |
|  3 |    1 |
|  4 |    2 |
|  5 |    1 |
|  6 |    1 |
|  7 |    1 |
|  8 |    1 |
|  9 |    2 |
| 10 |    1 |
+----+------+
affected rows: 10

update t2 set c2 = c2 + 2;
ERROR 23000: Cannot add or update a child row: a foreign key constraint fails
delete from t2;
affected rows: 10

insert into t2 values (1,1),(2,1),(3,6),(4,1),(5,1);
ERROR 23000: Cannot add or update a child row: a foreign key constraint fails
select * from t2;
+----+------+
| c1 | c2   |
+----+------+
+----+------+
affected rows: 0

drop table t2;
affected rows: 0
drop table t1;
affected rows: 0

## 分区表场景下，查询主表，batch优化查询
create table t1 (c1 int primary key, c2 int) partition by hash(c1) partitions 4;
affected rows: 0
create table t2 (c1 int primary key, c2 int, foreign key (c2) references t1(c1));
affected rows: 0
insert into t1 values (1,1),(2,2),(3,3);
affected rows: 3
info: Records: 3  Duplicates: 0  Warnings: 0

insert into t2 values (1,1),(2,1),(3,1),(4,2),(5,1),(6,1),(7,1),(8,1),(9,2),(10,1);
affected rows: 10
info: Records: 10  Duplicates: 0  Warnings: 0
select * from t2;
+----+------+
| c1 | c2   |
+----+------+
|  1 |    1 |
|  2 |    1 |
|  3 |    1 |
|  4 |    2 |
|  5 |    1 |
|  6 |    1 |
|  7 |    1 |
|  8 |    1 |
|  9 |    2 |
| 10 |    1 |
+----+------+
affected rows: 10
update t2 set c2 = c2 + 1;
affected rows: 10
info: Rows matched: 10  Changed: 10  Warnings: 0
select * from t2;
+----+------+
| c1 | c2   |
+----+------+
|  1 |    2 |
|  2 |    2 |
|  3 |    2 |
|  4 |    3 |
|  5 |    2 |
|  6 |    2 |
|  7 |    2 |
|  8 |    2 |
|  9 |    3 |
| 10 |    2 |
+----+------+
affected rows: 10

update t2 set c2 = c2 - 1;
affected rows: 10
info: Rows matched: 10  Changed: 10  Warnings: 0
select * from t2;
+----+------+
| c1 | c2   |
+----+------+
|  1 |    1 |
|  2 |    1 |
|  3 |    1 |
|  4 |    2 |
|  5 |    1 |
|  6 |    1 |
|  7 |    1 |
|  8 |    1 |
|  9 |    2 |
| 10 |    1 |
+----+------+
affected rows: 10

update t2 set c2 = c2 + 2;
ERROR 23000: Cannot add or update a child row: a foreign key constraint fails
delete from t2;
affected rows: 10

insert into t2 values (1,1),(2,1),(3,6),(4,1),(5,1);
ERROR 23000: Cannot add or update a child row: a foreign key constraint fails
select * from t2;
+----+------+
| c1 | c2   |
+----+------+
+----+------+
affected rows: 0

drop table t2;
affected rows: 0
drop table t1;
affected rows: 0

## 非分区表，查询索引表，batch优化查询
create table t1 (c1 int unique, c2 int);
affected rows: 0
create table t2 (c1 int primary key, c2 int, foreign key (c2) references t1(c1));
affected rows: 0
insert into t1 values (1,1),(2,2),(3,3);
affected rows: 3
info: Records: 3  Duplicates: 0  Warnings: 0

insert into t2 values (1,1),(2,1),(3,1),(4,2),(5,1),(6,1),(7,1),(8,1),(9,2),(10,1);
affected rows: 10
info: Records: 10  Duplicates: 0  Warnings: 0
select * from t2;
+----+------+
| c1 | c2   |
+----+------+
|  1 |    1 |
|  2 |    1 |
|  3 |    1 |
|  4 |    2 |
|  5 |    1 |
|  6 |    1 |
|  7 |    1 |
|  8 |    1 |
|  9 |    2 |
| 10 |    1 |
+----+------+
affected rows: 10
update t2 set c2 = c2 + 1;
affected rows: 10
info: Rows matched: 10  Changed: 10  Warnings: 0
select * from t2;
+----+------+
| c1 | c2   |
+----+------+
|  1 |    2 |
|  2 |    2 |
|  3 |    2 |
|  4 |    3 |
|  5 |    2 |
|  6 |    2 |
|  7 |    2 |
|  8 |    2 |
|  9 |    3 |
| 10 |    2 |
+----+------+
affected rows: 10

update t2 set c2 = c2 - 1;
affected rows: 10
info: Rows matched: 10  Changed: 10  Warnings: 0
select * from t2;
+----+------+
| c1 | c2   |
+----+------+
|  1 |    1 |
|  2 |    1 |
|  3 |    1 |
|  4 |    2 |
|  5 |    1 |
|  6 |    1 |
|  7 |    1 |
|  8 |    1 |
|  9 |    2 |
| 10 |    1 |
+----+------+
affected rows: 10

update t2 set c2 = c2 + 2;
ERROR 23000: Cannot add or update a child row: a foreign key constraint fails
delete from t2;
affected rows: 10

insert into t2 values (1,1),(2,1),(3,6),(4,1),(5,1);
ERROR 23000: Cannot add or update a child row: a foreign key constraint fails
select * from t2;
+----+------+
| c1 | c2   |
+----+------+
+----+------+
affected rows: 0

drop table t2;
affected rows: 0
drop table t1;
affected rows: 0

## 分区表，查询索引表，batch优化查询
create table t1 (c1 int unique, c2 int) partition by hash(c1) partitions 4;
affected rows: 0
create table t2 (c1 int primary key, c2 int, foreign key (c2) references t1(c1));
affected rows: 0
insert into t1 values (1,1),(2,2),(3,3);
affected rows: 3
info: Records: 3  Duplicates: 0  Warnings: 0

insert into t2 values (1,1),(2,1),(3,1),(4,2),(5,1),(6,1),(7,1),(8,1),(9,2),(10,1);
affected rows: 10
info: Records: 10  Duplicates: 0  Warnings: 0
select * from t2;
+----+------+
| c1 | c2   |
+----+------+
|  1 |    1 |
|  2 |    1 |
|  3 |    1 |
|  4 |    2 |
|  5 |    1 |
|  6 |    1 |
|  7 |    1 |
|  8 |    1 |
|  9 |    2 |
| 10 |    1 |
+----+------+
affected rows: 10
update t2 set c2 = c2 + 1;
affected rows: 10
info: Rows matched: 10  Changed: 10  Warnings: 0
select * from t2;
+----+------+
| c1 | c2   |
+----+------+
|  1 |    2 |
|  2 |    2 |
|  3 |    2 |
|  4 |    3 |
|  5 |    2 |
|  6 |    2 |
|  7 |    2 |
|  8 |    2 |
|  9 |    3 |
| 10 |    2 |
+----+------+
affected rows: 10

update t2 set c2 = c2 - 1;
affected rows: 10
info: Rows matched: 10  Changed: 10  Warnings: 0
select * from t2;
+----+------+
| c1 | c2   |
+----+------+
|  1 |    1 |
|  2 |    1 |
|  3 |    1 |
|  4 |    2 |
|  5 |    1 |
|  6 |    1 |
|  7 |    1 |
|  8 |    1 |
|  9 |    2 |
| 10 |    1 |
+----+------+
affected rows: 10

update t2 set c2 = c2 + 2;
ERROR 23000: Cannot add or update a child row: a foreign key constraint fails
delete from t2;
affected rows: 10

insert into t2 values (1,1),(2,1),(3,6),(4,1),(5,1);
ERROR 23000: Cannot add or update a child row: a foreign key constraint fails
select * from t2;
+----+------+
| c1 | c2   |
+----+------+
+----+------+
affected rows: 0

drop table t2;
affected rows: 0
drop table t1;
affected rows: 0

## 子表上有多个外键参数，batch优化查询
create table t0 (c1 int primary key, c2 int);
affected rows: 0
create table t1 (c1 int unique, c2 int) partition by hash(c1) partitions 4;
affected rows: 0
create table t2 (c0 int, c1 int, c2 int, foreign key(c1) references t0(c1), foreign key(c2) references t1(c1));
affected rows: 0
insert into t0 values (1,1),(2,2),(3,3);
affected rows: 3
info: Records: 3  Duplicates: 0  Warnings: 0
insert into t1 values (1,1),(2,2),(3,3);
affected rows: 3
info: Records: 3  Duplicates: 0  Warnings: 0

select * from t0;
+----+------+
| c1 | c2   |
+----+------+
|  1 |    1 |
|  2 |    2 |
|  3 |    3 |
+----+------+
affected rows: 3
select * from t1;
+------+------+
| c1   | c2   |
+------+------+
|    1 |    1 |
|    2 |    2 |
|    3 |    3 |
+------+------+
affected rows: 3

insert into t2 values (1,1,1),(2,1,1),(3,1,1),(4,2,2),(5,1,1),(6,1,1),(7,1,1),(8,1,1),(9,2,2),(10,1,1);
affected rows: 10
info: Records: 10  Duplicates: 0  Warnings: 0
select * from t2;
+------+------+------+
| c0   | c1   | c2   |
+------+------+------+
|    1 |    1 |    1 |
|    2 |    1 |    1 |
|    3 |    1 |    1 |
|    4 |    2 |    2 |
|    5 |    1 |    1 |
|    6 |    1 |    1 |
|    7 |    1 |    1 |
|    8 |    1 |    1 |
|    9 |    2 |    2 |
|   10 |    1 |    1 |
+------+------+------+
affected rows: 10
update t2 set c1 = c1 +1 ,c2 = c2 + 1;
affected rows: 10
info: Rows matched: 10  Changed: 10  Warnings: 0
select * from t2;
+------+------+------+
| c0   | c1   | c2   |
+------+------+------+
|    1 |    2 |    2 |
|    2 |    2 |    2 |
|    3 |    2 |    2 |
|    4 |    3 |    3 |
|    5 |    2 |    2 |
|    6 |    2 |    2 |
|    7 |    2 |    2 |
|    8 |    2 |    2 |
|    9 |    3 |    3 |
|   10 |    2 |    2 |
+------+------+------+
affected rows: 10

update t2 set c1 = c1 - 1, c2 = c2 - 1;
affected rows: 10
info: Rows matched: 10  Changed: 10  Warnings: 0
select * from t2;
+------+------+------+
| c0   | c1   | c2   |
+------+------+------+
|    1 |    1 |    1 |
|    2 |    1 |    1 |
|    3 |    1 |    1 |
|    4 |    2 |    2 |
|    5 |    1 |    1 |
|    6 |    1 |    1 |
|    7 |    1 |    1 |
|    8 |    1 |    1 |
|    9 |    2 |    2 |
|   10 |    1 |    1 |
+------+------+------+
affected rows: 10

update t2 set c1 = c1 + 2, c2 = c2 + 2;
ERROR 23000: Cannot add or update a child row: a foreign key constraint fails
delete from t2;
affected rows: 10

insert into t2 values (1,1,1),(2,1,1),(3,6,6),(4,1,1),(5,1,1);
ERROR 23000: Cannot add or update a child row: a foreign key constraint fails
select * from t2;
+------+------+------+
| c0   | c1   | c2   |
+------+------+------+
+------+------+------+
affected rows: 0

drop table t2;
affected rows: 0
drop table t1;
affected rows: 0
drop table t0;
affected rows: 0

## 外键自引用，batch优化查询
create table t1 (c1 int primary key, c2 int, foreign key(c2) references t1(c1));
affected rows: 0

insert into t1 values (1,1),(2,1),(3,1),(4,1),(5,2),(6,1),(7,2),(8,1),(9,2),(10,2),(11,2);
affected rows: 11
info: Records: 11  Duplicates: 0  Warnings: 0
select * from t1;
+----+------+
| c1 | c2   |
+----+------+
|  1 |    1 |
|  2 |    1 |
|  3 |    1 |
|  4 |    1 |
|  5 |    2 |
|  6 |    1 |
|  7 |    2 |
|  8 |    1 |
|  9 |    2 |
| 10 |    2 |
| 11 |    2 |
+----+------+
affected rows: 11

update t1 set c2 = c2 + 1;
affected rows: 11
info: Rows matched: 11  Changed: 11  Warnings: 0
select * from t1;
+----+------+
| c1 | c2   |
+----+------+
|  1 |    2 |
|  2 |    2 |
|  3 |    2 |
|  4 |    2 |
|  5 |    3 |
|  6 |    2 |
|  7 |    3 |
|  8 |    2 |
|  9 |    3 |
| 10 |    3 |
| 11 |    3 |
+----+------+
affected rows: 11
update t1 set c2 = c2 + 10;
ERROR 23000: Cannot add or update a child row: a foreign key constraint fails
update t1 set c1 = c1 + 20 where c1 = 1;
affected rows: 1
info: Rows matched: 1  Changed: 1  Warnings: 0
select * from t1;
+----+------+
| c1 | c2   |
+----+------+
|  2 |    2 |
|  3 |    2 |
|  4 |    2 |
|  5 |    3 |
|  6 |    2 |
|  7 |    3 |
|  8 |    2 |
|  9 |    3 |
| 10 |    3 |
| 11 |    3 |
| 21 |    2 |
+----+------+
affected rows: 11
update t1 set c1 = c1 + 20 where c1 = 2;
ERROR 23000: Cannot delete or update a parent row: a foreign key constraint fails

drop table t1;
affected rows: 0

alter system set_tp tp_no = 302, error_code = 0, frequency = 1;
affected rows: 0
