drop table if exists t3;
drop table if exists t2;
drop table if exists t1;
create table t1 (c1 int primary key, c2 int);
create table t2 (c1 int primary key, c2 int, foreign key (c2) references t1(c1));
insert into t1 values (1,1),(2,2);
insert into t2 values (1,1);
insert into t2 values (3,3);
ERROR 23000: Cannot add or update a child row: a foreign key constraint fails
select * from t2;
c1	c2
1	1
update t2 set c2 = 2;
update t2 set c2 = 3;
ERROR 23000: Cannot add or update a child row: a foreign key constraint fails
select * from t2;
c1	c2
1	2
drop table t2;
drop table t1;
create table t1 (c1 int primary key, c2 int unique);
create table t2 (c1 int primary key, c2 int, foreign key (c2) references t1(c2));
insert into t1 values (1,1),(2,2);
insert into t2 values (1,1);
insert into t2 values (3,3);
ERROR 23000: Cannot add or update a child row: a foreign key constraint fails
select * from t2;
c1	c2
1	1
update t2 set c2 = 2;
update t2 set c2 = 3;
ERROR 23000: Cannot add or update a child row: a foreign key constraint fails
select * from t2;
c1	c2
1	2
drop table t2;
drop table t1;
create table t1 (c1 int primary key, c2 int, foreign key(c2) references t1(c1));
insert into t1 values (1,1),(2,2);
select * from t1;
c1	c2
1	1
2	2
update t1 set c2 = c2 + 2;
ERROR 23000: Cannot add or update a child row: a foreign key constraint fails
select * from t1;
c1	c2
1	1
2	2
drop table t1;
create table t1 (c1 int primary key, c2 int unique, c3 int, foreign key(c3) references t1(c2));
insert into t1 values (1,1,1),(2,2,2),(3,3,3);
select * from t1;
c1	c2	c3
1	1	1
2	2	2
3	3	3
update t1 set c3 = c3 + 5;
ERROR 23000: Cannot add or update a child row: a foreign key constraint fails
select * from t1;
c1	c2	c3
1	1	1
2	2	2
3	3	3
drop table t1;
create table t1 (c1 int primary key, c2 int unique);
create table t2 (c1 int primary key, c2 int, foreign key(c2) references t1 (c1));
insert into t2(c1) values (1),(2);
insert into t2 values (3,1);
ERROR 23000: Cannot add or update a child row: a foreign key constraint fails
select * from t2;
c1	c2
1	NULL
2	NULL
delete from t2;
insert into t1(c1) values (1);
insert into t2(c1) values (1);
drop table t2;
drop table t1;
create table t1 (c1 int primary key, c2 int unique);
create table t2 (c1 int primary key, c2 int, foreign key(c2) references t1 (c2));
insert into t2(c1) values (1),(2);
insert into t2 values (3,1);
ERROR 23000: Cannot add or update a child row: a foreign key constraint fails
select * from t2;
c1	c2
1	NULL
2	NULL
delete from t2;
insert into t1(c1) values (1);
insert into t2(c1) values (1);
drop table t2;
drop table t1;
create table t1 (c1 int, c2 int, primary key(c1, c2));
create table t2 (c1 int, c2 int, foreign key(c1,c2) references t1(c1,c2));
insert into t1 values (1,1),(2,2);
insert into t2(c1) values (1),(2);
insert into t2(c2) values (1),(2);
select * from t1;
c1	c2
1	1
2	2
select * from t2;
c1	c2
1	NULL
2	NULL
NULL	1
NULL	2
drop table t2;
drop table t1;
create table t1 (c1 int, c2 int, c3 int, primary key(c1,c2));
create table t2 (c1 int, c2 int, c0 int primary key, foreign key(c1, c2) references t1(c1,c2));
insert into t1 values (1,2,3),(4,5,6);
insert into t2 values (1,2,3);
insert into t2 values (1,3,4);
ERROR 23000: Cannot add or update a child row: a foreign key constraint fails
select * from t1;
c1	c2	c3
1	2	3
4	5	6
select * from t2;
c1	c2	c0
1	2	3
drop table t2;
drop table t1;
create table t1 (c1 int, c2 int, c3 int, primary key(c1,c2));
create table t2 (c1 int, c2 int, c0 int primary key, foreign key(c2, c1) references t1(c1,c2));
insert into t1 values (1,2,3),(4,5,6);
insert into t2 values (2,1,3);
insert into t2 values (3,1,4);
ERROR 23000: Cannot add or update a child row: a foreign key constraint fails
select * from t1;
c1	c2	c3
1	2	3
4	5	6
select * from t2;
c1	c2	c0
2	1	3
drop table t2;
drop table t1;
create table t1 (c1 int primary key, c2 int) partition by hash(c1) partitions 4;
create table t2 (c1 int primary key, c2 int, foreign key(c2) references t1(c1));
insert into t1 values (1,1),(2,2),(3,3),(4,4);
insert into t2 values (1,1);
insert into t2 values (2,2),(3,3);
insert into t2 values (6,6);
ERROR 23000: Cannot add or update a child row: a foreign key constraint fails
select * from t2;
c1	c2
1	1
2	2
3	3
update t2 set c2 = c2 + 1;
update t2 set c2 = c2 + 5;
ERROR 23000: Cannot add or update a child row: a foreign key constraint fails
select * from t2;
c1	c2
1	2
2	3
3	4
drop table t2;
drop table t1;
create table t1 (c1 int unique, c2 int) partition by hash(c1) partitions 4;
create table t2 (c1 int primary key, c2 int, foreign key(c2) references t1(c1));
insert into t1 values (1,1),(2,2),(3,3),(4,4);
insert into t2 values (1,1);
insert into t2 values (2,2),(3,3);
insert into t2 values (6,6);
ERROR 23000: Cannot add or update a child row: a foreign key constraint fails
select * from t2;
c1	c2
1	1
2	2
3	3
update t2 set c2 = c2 + 1;
update t2 set c2 = c2 + 5;
ERROR 23000: Cannot add or update a child row: a foreign key constraint fails
select * from t2;
c1	c2
1	2
2	3
3	4
drop table t2;
drop table t1;
create table t1 (c1 int, c2 int, c3 int, primary key (c1,c2)) partition by hash(c2) partitions 4;
create table t2 (c1 int, c2 int, c3 int, foreign key(c2, c1) references t1(c1,c2));
insert into t1 values (1,2,1);
insert into t2 values (1,2,1);
ERROR 23000: Cannot add or update a child row: a foreign key constraint fails
insert into t2 values (2,1,1);
select * from t2;
c1	c2	c3
2	1	1
select * from t1;
c1	c2	c3
1	2	1
delete from t2;
delete from t1;
insert into t1 values (1,1,1),(2,2,2),(3,3,3),(4,4,4),(5,5,5);
insert into t2 values (1,1,1),(6,6,2),(1,1,1),(2,2,2);
ERROR 23000: Cannot add or update a child row: a foreign key constraint fails
insert into t2 values (1,1,1),(4,4,4);
select * from t2;
c1	c2	c3
1	1	1
4	4	4
update t2 set c1 = c1 + 1;
ERROR 23000: Cannot add or update a child row: a foreign key constraint fails
update t2 set c1 = c1 + 1, c2 = c2 + 1 where c2 = 1;
select * from t2;
c1	c2	c3
2	2	1
4	4	4
drop table t2;
drop table t1;
create table t1 (c1 int, c2 int, c3 int, primary key (c1,c2)) partition by range(c2) (partition p1 values less than (2), partition p2 values less than (4), partition p3 values less than MAXVALUE);
create table t2 (c1 int, c2 int, c3 int, foreign key(c2, c1) references t1(c1,c2));
insert into t1 values (1,2,1);
insert into t2 values (1,2,1);
ERROR 23000: Cannot add or update a child row: a foreign key constraint fails
insert into t2 values (2,1,1);
select * from t2;
c1	c2	c3
2	1	1
select * from t1;
c1	c2	c3
1	2	1
delete from t2;
delete from t1;
insert into t1 values (1,1,1),(2,2,2),(3,3,3),(4,4,4),(5,5,5);
insert into t2 values (1,1,1),(6,6,2),(1,1,1),(2,2,2);
ERROR 23000: Cannot add or update a child row: a foreign key constraint fails
insert into t2 values (1,1,1),(4,4,4);
select * from t2;
c1	c2	c3
1	1	1
4	4	4
update t2 set c1 = c1 + 1;
ERROR 23000: Cannot add or update a child row: a foreign key constraint fails
update t2 set c1 = c1 + 1, c2 = c2 + 1 where c2 = 1;
select * from t2;
c1	c2	c3
2	2	1
4	4	4
drop table t2;
drop table t1;
create table t1 (c1 int, c2 int, c3 int, primary key (c1,c2)) partition by list(c2) (PARTITION p0 VALUES IN (1, 2),
PARTITION p1 VALUES IN (3,4),
PARTITION p2 VALUES IN (DEFAULT));
create table t2 (c1 int, c2 int, c3 int, foreign key(c2, c1) references t1(c1,c2));
insert into t1 values (1,2,1);
insert into t2 values (1,2,1);
ERROR 23000: Cannot add or update a child row: a foreign key constraint fails
insert into t2 values (2,1,1);
select * from t2;
c1	c2	c3
2	1	1
select * from t1;
c1	c2	c3
1	2	1
delete from t2;
delete from t1;
insert into t1 values (1,1,1),(2,2,2),(3,3,3),(4,4,4),(5,5,5);
insert into t2 values (1,1,1),(6,6,2),(1,1,1),(2,2,2);
ERROR 23000: Cannot add or update a child row: a foreign key constraint fails
insert into t2 values (1,1,1),(1,1,2),(4,4,4);
select * from t2;
c1	c2	c3
1	1	1
1	1	2
4	4	4
update t2 set c1 = c1 + 1;
ERROR 23000: Cannot add or update a child row: a foreign key constraint fails
update t2 set c1 = c1 + 1, c2 = c2 + 1 where c2 = 1;
select * from t2;
c1	c2	c3
2	2	1
2	2	2
4	4	4
drop table t2;
drop table t1;
create table t1 (c1 int, c2 int, c3 int, primary key (c1,c2))
partition by range(c1) subpartition by list (c2)
(partition p0 values less than (10)
(subpartition sp0 values in (0,2,4,6,8),
subpartition sp1 values in (1,3,5,7,9)),
partition p1 values less than (20)
(subpartition sp2 values in (10,12,14,16,18),
subpartition sp3 values in (11,13,15,17,19)));
create table t2 (c1 int, c2 int, c3 int, foreign key(c2, c1) references t1(c1,c2));
insert into t1 values (1,2,1);
insert into t2 values (1,2,1);
ERROR 23000: Cannot add or update a child row: a foreign key constraint fails
insert into t2 values (2,1,1);
select * from t2;
c1	c2	c3
2	1	1
select * from t1;
c1	c2	c3
1	2	1
delete from t2;
delete from t1;
insert into t1 values (1,1,1),(2,2,2),(3,3,3),(4,4,4),(5,5,5),(11,11,11),(12,12,12),(13,13,13);
select * from t1 order by c1;
c1	c2	c3
1	1	1
2	2	2
3	3	3
4	4	4
5	5	5
11	11	11
12	12	12
13	13	13
insert into t2 values (1,1,1),(6,6,2),(1,1,1),(2,2,2),(15,15,15);
ERROR 23000: Cannot add or update a child row: a foreign key constraint fails
insert into t2 values (1,1,1),(1,1,2),(4,4,4),(11,11,11);
select * from t2;
c1	c2	c3
1	1	1
1	1	2
4	4	4
11	11	11
update t2 set c1 = c1 + 1;
ERROR 23000: Cannot add or update a child row: a foreign key constraint fails
update t2 set c1 = c1 + 1, c2 = c2 + 1 where c2 = 1;
select * from t2;
c1	c2	c3
2	2	1
2	2	2
4	4	4
11	11	11
drop table t2;
drop table t1;
create table t1 (c1 int, c2 int, c3 int, unique key (c1,c2)) partition by list(c2) (PARTITION p0 VALUES IN (1, 2),
PARTITION p1 VALUES IN (3,4),
PARTITION p2 VALUES IN (DEFAULT));
create table t2 (c1 int, c2 int, c3 int, foreign key(c2, c1) references t1(c1,c2));
insert into t1 values (1,2,1);
insert into t2 values (1,2,1);
ERROR 23000: Cannot add or update a child row: a foreign key constraint fails
insert into t2 values (2,1,1);
select * from t2;
c1	c2	c3
2	1	1
select * from t1;
c1	c2	c3
1	2	1
delete from t2;
delete from t1;
insert into t1 values (1,1,1),(2,2,2),(3,3,3),(4,4,4),(5,5,5);
insert into t2 values (1,1,1),(6,6,2),(1,1,1),(2,2,2);
ERROR 23000: Cannot add or update a child row: a foreign key constraint fails
insert into t2 values (1,1,1),(1,1,2),(4,4,4);
select * from t2;
c1	c2	c3
1	1	1
1	1	2
4	4	4
update t2 set c1 = c1 + 1;
ERROR 23000: Cannot add or update a child row: a foreign key constraint fails
update t2 set c1 = c1 + 1, c2 = c2 + 1 where c2 = 1;
select * from t2;
c1	c2	c3
2	2	1
2	2	2
4	4	4
drop table t2;
drop table t1;
create table t1 (c1 int, c2 int) partition by list(c2) (PARTITION p0 VALUES IN (1, 2),
PARTITION p1 VALUES IN (3,4),
PARTITION p2 VALUES IN (DEFAULT));
create unique index uniq_ind on t1(c1) global;
create table t2 (c1 int primary key, c2 int, foreign key(c2) references t1(c1));
insert into t1 values (1,1),(2,2),(3,3),(4,4),(5,5),(6,6);
insert into t2 values (7,7);
ERROR 23000: Cannot add or update a child row: a foreign key constraint fails
insert into t2 values (1,1),(2,1),(3,2),(4,2),(5,9);
ERROR 23000: Cannot add or update a child row: a foreign key constraint fails
insert into t2 values (1,1),(2,1),(3,2),(4,2),(5,5);
select * from t2;
c1	c2
1	1
2	1
3	2
4	2
5	5
update t2 set c2 = c2 + 2;
ERROR 23000: Cannot add or update a child row: a foreign key constraint fails
update t2 set c2 = c2 + 1;
select * from t2;
c1	c2
1	2
2	2
3	3
4	3
5	6
drop table t2;
drop table t1;
create table t1 (c1 int, c2 int) partition by list(c2) (PARTITION p0 VALUES IN (1, 2),
PARTITION p1 VALUES IN (3,4),
PARTITION p2 VALUES IN (DEFAULT));
create unique index uniq_ind on t1(c1) global partition by hash(c1) partitions 4;
create table t2 (c1 int primary key, c2 int, foreign key(c2) references t1(c1));
insert into t1 values (1,1),(2,2),(3,3),(4,4),(5,5),(6,6);
insert into t2 values (7,7);
ERROR 23000: Cannot add or update a child row: a foreign key constraint fails
insert into t2 values (1,1),(2,1),(3,2),(4,2),(5,9);
ERROR 23000: Cannot add or update a child row: a foreign key constraint fails
insert into t2 values (1,1),(2,1),(3,2),(4,2),(5,5);
select * from t2;
c1	c2
1	1
2	1
3	2
4	2
5	5
update t2 set c2 = c2 + 2;
ERROR 23000: Cannot add or update a child row: a foreign key constraint fails
update t2 set c2 = c2 + 1;
select * from t2;
c1	c2
1	2
2	2
3	3
4	3
5	6
drop table t2;
drop table t1;
create table t0 (c1 int primary key, c2 int);
create table t1 (c1 int, c2 int, unique key(c1)) partition by hash(c1) partitions 4;
create table t2 (c1 int, c2 int, c3 int, foreign key (c2) references t0(c1), foreign key (c3) references t1(c1));
insert into t0 values (1,1),(2,2),(3,3),(4,4);
insert into t2 values (1,1,1);
ERROR 23000: Cannot add or update a child row: a foreign key constraint fails
insert into t1 values (1,1),(2,2),(3,3),(4,4),(5,5);
insert into t2 values (1,1,1);
insert into t2 values (2,2,2),(3,3,3),(5,5,5);
ERROR 23000: Cannot add or update a child row: a foreign key constraint fails
insert into t2 values (2,2,2),(3,3,3);
select * from t2;
c1	c2	c3
1	1	1
2	2	2
3	3	3
update t2 set c2 = c2 + 2;
ERROR 23000: Cannot add or update a child row: a foreign key constraint fails
update t2 set c2 = c2 + 1, c3 = c3 + 3;
ERROR 23000: Cannot add or update a child row: a foreign key constraint fails
update t2 set c2 = c2 + 1, c3 = c3 + 2;
drop table t2;
drop table t1;
drop table t0;
create table t0 (c1 int primary key, c2 int);
create table t1 (c1 int primary key, c2 int, foreign key(c2) references t0(c1));
create table t2 (c1 int primary key, c2 int, foreign key(c2) references t1(c1));
insert into t0 values (1,1),(2,2),(3,3),(4,4),(5,5);
insert into t1 values (1,1),(6,6);
ERROR 23000: Cannot add or update a child row: a foreign key constraint fails
insert into t1 values (1,1),(2,2),(3,3);
select * from t1;
c1	c2
1	1
2	2
3	3
update t1 set c1 = c1 + 3, c2 = c2 + 3 where c1 = 1;
select * from t1;
c1	c2
2	2
3	3
4	4
insert into t2 values (2,2),(3,3);
select * from t0;
c1	c2
1	1
2	2
3	3
4	4
5	5
select * from t1;
c1	c2
2	2
3	3
4	4
select * from t2;
c1	c2
2	2
3	3
update t1 set c1 = c1 + 3, c2 = c2 + 3 where c1 = 2;
ERROR 23000: Cannot delete or update a parent row: a foreign key constraint fails
delete from t1;
ERROR 23000: Cannot delete or update a parent row: a foreign key constraint fails
update t1 set c1 = c1 + 3, c2 = c2 + 3 where c1 = 4;
ERROR 23000: Cannot add or update a child row: a foreign key constraint fails
delete from t2;
update t1 set c1 = c1 + 3, c2 = c2 + 3 where c1 = 2;
select * from t1;
c1	c2
3	3
4	4
5	5
delete from t0;
ERROR 23000: Cannot delete or update a parent row: a foreign key constraint fails
delete from t1;
delete from t0;
select * from t1;
c1	c2
select * from t0;
c1	c2
drop table t2;
drop table t1;
drop table t0;
create table t1 (c1 int primary key, c2 int) partition by hash(c1) partitions 4;
create table t2 (c1 int, c2 int, foreign key(c2) references t1(c1)) partition by hash(c2) partitions 4;
insert into t1 values (1,1),(2,2),(3,3),(4,4),(5,5),(6,6),(7,7);
insert into t2 values (1,1),(2,1),(3,2),(4,8);
ERROR 23000: Cannot add or update a child row: a foreign key constraint fails
insert into t2 values (1,1),(2,1),(3,2),(4,4);
select * from t2;
c1	c2
4	4
1	1
2	1
3	2
update t2 set c2 = c2 + 1;
select * from t2;
c1	c2
4	5
1	2
2	2
3	3
update t2 set c2 = c2 + 3;
ERROR 23000: Cannot add or update a child row: a foreign key constraint fails
select * from t2;
c1	c2
4	5
1	2
2	2
3	3
drop table t2;
drop table t1;
create table t1 (c1 int primary key, c2 int) partition by hash(c1) partitions 4;
create table t2 (c1 int primary key, c2 int, foreign key (c2) references t1(c1));
insert into t1 values(1,1),(2,2),(3,3),(4,4),(5,5);
insert into t2 values(1,1),(2,2) on duplicate key update c2 = c2 + 1;
insert into t2 values(1,1),(2,2) on duplicate key update c2 = c2 + 1;
insert into t2 values(1,1),(2,2) on duplicate key update c2 = c2 + 1;
insert into t2 values(1,1),(2,2) on duplicate key update c2 = c2 + 1;
select * from t2 order by c1;
c1	c2
1	4
2	5
drop table t2;
drop table t1;
