set @@session.foreign_key_checks = on;
set @@session.recyclebin = off;
alter system set _enable_parallel_table_creation = true;
select value from __all_virtual_tenant_parameter_stat where name = '_enable_parallel_table_creation' limit 1;
value
True
use test;
drop table if exists A, B, C, D, E, F, G;
create table A(a int, a3 int, primary key (a, a3), a2 int, a4 int, foreign key (a2, a4) references A(a, A3));
drop table A;
create table A(a int, a2 int, a3 int, a4 int, a5 int, a6 int, a7 int, primary key(A, A2, A3), foreign key (a6) references A(a), foreign key(A4, a5) references A(a2, a));
create table B(b int, b2 int, b3 int, b4 int, unique key(b, b2), foreign key (b) references A(a), foreign key (b3, b4) references A(a, a2), foreign key (b3) references B(b));
create table C(c int, c2 int, c3 int, c4 int, c5 int, index Cindex (c, c2, c3), unique key(c3, c4, c5), foreign key (C3, c4) references C(c2, c));
create table D(d int, d2 int, d3 int, d4 int, foreign key(d3, D4) references C(C2, c), foreign key(d2, D3, d4) references C(C3, c2, c));
create table E(e int, e2 int, E3 int, E4 int, foreign key(E4, e3) references C(C4, c3), foreign key(E, e2, e3) references C(c3, C4, c5), index Eindex (e));
create table F(f int, f2 int, f3 int, f4 int, f5 int, unique index Findex (f, F2, F3), foreign key (f4) references F(f), foreign key (f5) references E(é));
create table G(g int, g2 int, g3 int, g4 int, foreign key (g, g2) references F(F, f2));
create table F1(f int, f2 int, f3 int, f4 int, foreign key(f3, f4) references C(c, c3));
ERROR HY000: Cannot add foreign key constraint
create table F2(f int, f2 int, f3 int, f4 int, foreign key(f3) references A(a2));
ERROR HY000: Cannot add foreign key constraint
create table F3(f int, f2 int, f3 int, f4 int, foreign key(f3) references B(b2));
ERROR HY000: Cannot add foreign key constraint
create table F4(f int, f2 int, f3 int, f4 int, foreign key(f3, f4) references C(c4, c5));
ERROR HY000: Cannot add foreign key constraint
create table F5(f int, f2 int, f3 int, f4 int, primary key(f, f2), foreign key(f3, f4) references F5(f, f3));
ERROR HY000: Cannot add foreign key constraint
create table F5(f int, f2 int, f3 int, f4 int, primary key(f, f2), foreign key(f3, f4) references F5(f, f));
ERROR HY000: Cannot add foreign key constraint
create table F6(f int, f2 int, f3 int, f4 int, f5 int, unique key(f, f2, f3), foreign key(f4, f5) references F6(f, f3));
ERROR HY000: Cannot add foreign key constraint
create table F7(f int, f2 int, f3 int, f4 int, f5 int, index Findex(f, f2, f3), foreign key(f3) references F7(f), foreign key(f4, f5) references F7(f, f3));
ERROR HY000: Cannot add foreign key constraint
create table F8(f int, f2 int, f3 int, f4 int, f5 int, foreign key(f3, f4) references E(e));
ERROR 42000: Incorrect foreign key definition: Key reference and table reference don't match
create table F9(f int, f2 int, f3 int, f4 int, f5 int, foreign key(f3, f4) references F(f, f2, f3));
ERROR 42000: Incorrect foreign key definition: Key reference and table reference don't match
drop table A, B, C, D, E, F, G;
create table A(a int, msg int);
create index Aindex on A(a);
create table B(a int, FOREIGN KEY(a) REFERENCES A(a) on update cascade on delete cascade);
insert into A values (2, 10), (3, 11), (3, 12), (NULL, 10), (NULL, 11);
insert into B values (2), (2), (2), (3), (3), (3), (NULL);
select * from B;
a
2
2
2
3
3
3
NULL
insert into B values (10);
ERROR 23000: Cannot add or update a child row: a foreign key constraint fails
update A set a = 4 where a = 2;
delete from A where a = 4;
select * from A;
a	msg
3	11
3	12
NULL	10
NULL	11
drop table A, B;
create table A(a int, msg int);
create index Aindex on A(a);
create table B(a int, FOREIGN KEY(a) REFERENCES A(a));
insert into A values (2, 10), (3, 11), (3, 12);
insert into B values (2), (2), (2), (3), (3), (3);
insert into B values (10);
ERROR 23000: Cannot add or update a child row: a foreign key constraint fails
select * from B;
a
2
2
2
3
3
3
update A set a = 4 where a = 2;
ERROR 23000: Cannot delete or update a parent row: a foreign key constraint fails
delete from A where a = 2;
ERROR 23000: Cannot delete or update a parent row: a foreign key constraint fails
drop table A, B;
create table A(b int, a2 int, a3 int, msg int);
create index Aindex on A(b, a2, a3);
create index Ai2 on A(msg);
create index Ai3 on A(a3, msg, a2);
create table B(a int, FOREIGN KEY(a) REFERENCES A(b));
create table C(a2 int, FOREIGN KEY(a2) REFERENCES A(a2));
ERROR HY000: Cannot add foreign key constraint
create table C(a2 int, a3 int, FOREIGN KEY(a2, a3) REFERENCES A(a2, a3));
ERROR HY000: Cannot add foreign key constraint
insert into A values (2, 100, 10, NULL), (3, 101, 11, NULL), (3, 101, 12, NULL);
insert into B values (2), (2), (2), (3), (3), (3);
insert into B values (10);
ERROR 23000: Cannot add or update a child row: a foreign key constraint fails
select * from B;
a
2
2
2
3
3
3
update A set b = 4 where b = 2;
ERROR 23000: Cannot delete or update a parent row: a foreign key constraint fails
delete from A where b = 2;
ERROR 23000: Cannot delete or update a parent row: a foreign key constraint fails
create table C(a2 int, b int, FOREIGN KEY(a2, b) REFERENCES A(a2, b));
insert into C values (100, 2), (101, 3), (101, 3), (100, 2);
select * from C;
a2	b
100	2
101	3
101	3
100	2
insert into C values (100, 100);
ERROR 23000: Cannot add or update a child row: a foreign key constraint fails
create table D(a2 int, b int, FOREIGN KEY(b, a2) REFERENCES A(b, a2));
insert into D values (100, 2), (101, 3), (101, 3), (100, 2);
select * from D;
a2	b
100	2
101	3
101	3
100	2
create table E(a3 int, a2 int, b int, FOREIGN KEY(b, a2, a3) REFERENCES A(b, a2, a3));
insert into E values (10, 100, 2), (11, 101, 3), (12, 101, 3), (10, 100, 2);
select * from E;
a3	a2	b
10	100	2
11	101	3
12	101	3
10	100	2
alter table A drop index Aindex;
ERROR HY000: Cannot drop index 'Aindex': needed in a foreign key constraint
alter table A drop index Ai2;
alter table A drop index Ai3;
drop table E;
alter table A drop index Aindex;
ERROR HY000: Cannot drop index 'Aindex': needed in a foreign key constraint
drop table D;
alter table A drop index Aindex;
ERROR HY000: Cannot drop index 'Aindex': needed in a foreign key constraint
drop table C;
alter table A drop index Aindex;
ERROR HY000: Cannot drop index 'Aindex': needed in a foreign key constraint
drop table B;
alter table A drop index Aindex;
drop table A;
create table A(a int, a2 int, a3 int, a4 int);
create index Aindex on A(a, a2, a3, a4);
alter table A add foreign key (a2) references A(a) on update cascade;
alter table A add foreign key (a3, a4) references A(a, a2) on update cascade;
insert into A values (1, NULL, NULL, NULL);
insert into A values (1, 1, NULL, NULL);
insert into A values (NULL, NULL, 1, 1);
select * from A;
a	a2	a3	a4
1	NULL	NULL	NULL
1	1	NULL	NULL
NULL	NULL	1	1
alter table A drop index Aindex;
ERROR HY000: Cannot drop index 'Aindex': needed in a foreign key constraint
drop table A;
create table A(pk1 int, pk2 int, a int, a2 int, primary key A(a, pk1, pk2), foreign key (a2) references A(a));
insert into A values (0, 0, 1, NULL);
insert into A values (0, 1, 1, NULL);
insert into A values (0, 0, 2, 1);
select * from A;
pk1	pk2	a	a2
0	0	1	NULL
0	1	1	NULL
0	0	2	1
drop table A;
create table A(a int, a2 int, a3 int, a4 int, index Aindex(a, a2, a3, a4), foreign key (a2) references A(a), foreign key (a4, a3) references A(a, a2));
create table B(a varchar(20), a2 int, a3 int, a4 int, index Bindex(a, a2, a3, a4), foreign key (a2) references B(a), foreign key (a4, a3) references B(a, a2));
ERROR HY000: Cannot add foreign key constraint
create table B(a int, a2 int, a3 int, a4 int, index Bindex(a, a2, a4), foreign key (a2) references B(a), foreign key (a3, a4) references B(a4, a2));
ERROR HY000: Cannot add foreign key constraint
create table B(a int, a2 int, a3 int, a4 int, index Bindex(a4, a2, a), foreign key (a2) references B(a), foreign key (a3, a4) references B(a, a2));
ERROR HY000: Cannot add foreign key constraint
insert into A values (1, NULL, NULL, NULL);
insert into A values (1, 1, NULL, NULL);
insert into A values (NULL, NULL, 1, 1);
select * from A;
a	a2	a3	a4
1	NULL	NULL	NULL
1	1	NULL	NULL
NULL	NULL	1	1
drop table A;
create table A(uk1 int, uk2 int, a int, unique key A(uk1, uk2), foreign key (a) references A(uk1));
insert into A values (1, 1, NULL), (1, 2, 1);
select * from A;
uk1	uk2	a
1	1	NULL
1	2	1
replace into A values (1, 1, 1);
ERROR 23000: Cannot delete or update a parent row: a foreign key constraint fails
update A set a = NULL;
select * from A;
uk1	uk2	a
1	1	NULL
1	2	NULL
drop table A;
create table A(c1 int, c2 int, c3 int, c4 int, c5 int, c6 int, unique key (c1, c2, c3, c4, c5), foreign key(c5, c4, c6) references A(c3, c1, c2));
insert into A values (1, 1, 1, NULL, NULL, NULL), (NULL, NULL, NULL, 1, 1, 1);
select * from A;
c1	c2	c3	c4	c5	c6
1	1	1	NULL	NULL	NULL
NULL	NULL	NULL	1	1	1
drop table A;
create table A(c1 int, c2 int, c3 int, c4 int, c5 int, c6 int, primary key (c1, c2, c3, c4, c5), foreign key(c5, c4, c6) references A(c3, c1, c2), foreign key(c6, c5) references A(c2, c1));
insert into A values (1, 1, 1, 1, 1, 1), (1, 2, 1, 1, 1, 1);
replace into A values (1, 2, 1, 1, 1, 3);
ERROR 23000: Cannot add or update a child row: a foreign key constraint fails
select * from A;
c1	c2	c3	c4	c5	c6
1	1	1	1	1	1
1	2	1	1	1	1
drop table A;
create table A(a varchar(20), a2 varchar(20));
create index Aindex on A(a2, a);
create table B(a varchar(20), foreign key (a) references A(a2));
insert into A values ('a', 'a2'), ('a3', 'a4'), ('a', 'a2'), ('a3', 'a4');
insert into B values ('a2'), ('a2'), ('a4'), ('a4');
select * from B;
a
a2
a2
a4
a4
select * from A;
a	a2
a	a2
a3	a4
a	a2
a3	a4
insert into B values ('');
ERROR 23000: Cannot add or update a child row: a foreign key constraint fails
drop table A, B;
create table A(a varchar(20), b int, c int, unique key(b, c), foreign key(a) references A(b));
ERROR HY000: Cannot add foreign key constraint
create table A(a varchar(20), b int, c varchar(20), unique key(b, c), foreign key(a) references A(b));
ERROR HY000: Cannot add foreign key constraint
create table A(a int, b float, c float, unique key(b, c), foreign key(a) references A(b));
ERROR HY000: Cannot add foreign key constraint
create table A(a int, b int, c int);
create index Aindex on A(a, b);
create table B(a varchar(20), foreign key(a) references A(a));
ERROR HY000: Cannot add foreign key constraint
create table B(a float, foreign key(a) references A(a));
ERROR HY000: Cannot add foreign key constraint
create table B(a int, foreign key(a) references A(a));
drop table A, B;
create table A(a int, a2 int);
create index Ai on A(a);
create unique index Aui on A(a);
create index Ai2 on A(a);
create table B(a int, foreign key (a) references A(a));
alter table A drop index Aui;
ERROR HY000: unique/primary keys in table referenced by enabled foreign keys
alter table A drop index Ai;
alter table A drop index Ai2;
insert into A values (1, 10), (2, 20);
insert into B values (1), (1), (2), (2);
select * from A;
a	a2
1	10
2	20
select * from B;
a
1
1
2
2
drop table A, B;
create table A(a int, a2 int, primary key (a, a2));
create unique index Aui on A(a2);
create table B(a2 int, foreign key (a2) references A(a2));
alter table A drop index Aui;
ERROR HY000: unique/primary keys in table referenced by enabled foreign keys
insert into A values (1, 10), (2, 11);
insert into B values (10), (10), (11), (11);
select * from A;
a	a2
1	10
2	11
select * from B;
a2
10
10
11
11
drop table A, B;
create table A(a int, a2 int, primary key (a));
create unique index Aui on A(a);
create table B(a int, foreign key (a) references A(a));
alter table A drop index Aui;
insert into A values (1, 10), (2, 11);
insert into B values (1), (1), (2), (2);
select * from A;
a	a2
1	10
2	11
select * from B;
a
1
1
2
2
drop table A, B;
create table A(a int, a2 int);
create index Aindex on A(a);
create table B(a int, foreign key (a) references A(a));
create unique index Aui on A(a);
insert into A values (1, 10), (2, 11);
insert into B values (1), (1), (2), (2);
select * from A;
a	a2
1	10
2	11
select * from B;
a
1
1
2
2
alter table A drop index Aui;
insert into B values (1), (1), (2), (2);
select * from B;
a
1
1
2
2
1
1
2
2
drop table A, B;
create table A(a int, a2 int, primary key(a, a2));
create table B(b int primary key, a int, foreign key (a) references A(a));
replace into A values(1, 1), (2, 2), (3, 3), (4, 4);
replace into A values(1, 5), (1, 6), (1, 7), (2, 5), (2, 6), (2, 7), (3, 5), (3, 6), (3, 7);
replace into B values(10, 1), (11, 2), (12, 4), (13, 1), (14, 2), (15, 1);
select * from A;
a	a2
1	1
1	5
1	6
1	7
2	2
2	5
2	6
2	7
3	3
3	5
3	6
3	7
4	4
select * from B;
b	a
10	1
11	2
12	4
13	1
14	2
15	1
replace into B values(12, 1);
select * from B;
b	a
10	1
11	2
12	1
13	1
14	2
15	1
replace into B values(16, 1), (17, 2), (18, 1), (19, 2);
select * from B;
b	a
10	1
11	2
12	1
13	1
14	2
15	1
16	1
17	2
18	1
19	2
update B set a = a + 1;
select * from B;
b	a
10	2
11	3
12	2
13	2
14	3
15	2
16	2
17	3
18	2
19	3
update A set a = 5, a2 = 5 where a = 2 and a2 = 2;
ERROR 23000: Cannot delete or update a parent row: a foreign key constraint fails
update A set a = 5, a2 = 5 where a = 1 and a2 = 1;
select * from A;
a	a2
1	5
1	6
1	7
2	2
2	5
2	6
2	7
3	3
3	5
3	6
3	7
4	4
5	5
delete from A;
ERROR 23000: Cannot delete or update a parent row: a foreign key constraint fails
delete from B where a <> 2;
delete from A where a <> 2;
select * from A;
a	a2
2	2
2	5
2	6
2	7
select * from B;
b	a
10	2
12	2
13	2
15	2
16	2
18	2
drop table A, B;
create table A(a int not null, a2 int not null, primary key(a, a2));
create table B(b int primary key, a int not null, foreign key(a) references A(a));
insert into A values(1, 1), (1, 2), (2, 1), (3, 1);
insert into B values(10, 1), (11, 3);
select * from B left join A on B.a = A.a order by A.a;
b	a	a	a2
10	1	1	1
10	1	1	2
11	3	3	1
select B.* from B join A on B.a = A.a order by B.b;
b	a
10	1
10	1
11	3
drop table A, B;
create table A(a int, index Aindex(a));
create table B(b int primary key, a int, foreign key(a) references A(a));
create table C(c int primary key, a int not null, foreign key(a) references A(a));
insert into A values(1), (1), (2), (3), (NULL);
insert into B values(10, 1), (11, 3);
insert into C values(10, 1), (11, 3);
select * from B left join A on B.a = A.a order by A.a, B.b;
b	a	a
10	1	1
10	1	1
11	3	3
select * from C left join A on C.a = A.a order by A.a, C.c;
c	a	a
10	1	1
10	1	1
11	3	3
select B.* from B join A on B.a = A.a order by B.b;
b	a
10	1
10	1
11	3
select C.* from C join A on C.a = A.a order by C.c;
c	a
10	1
10	1
11	3
drop table A, B, C;
drop table if exists t3;
drop table if exists t2;
drop table if exists t1;
create table t1(id int primary key,c1 int ,index index1(c1));
create table t2(id int primary key,c1 int);
alter table t2 add foreign key(c1) references t1(c1) on update cascade on delete cascade;
insert into t1 values(1,1),(2,1),(3,1),(4,1);
insert ignore into t2 values(1,1),(2,1);
select * from t1 order by id;
id	c1
1	1
2	1
3	1
4	1
select * from t2 order by id;
id	c1
1	1
2	1
insert ignore into t2 values(3,1),(1,1);
select * from t1 order by id;
id	c1
1	1
2	1
3	1
4	1
select * from t2 order by id;
id	c1
1	1
2	1
3	1
insert ignore into t2 values(4,1),(1,2);
ERROR 23000: Cannot add or update a child row: a foreign key constraint fails
insert ignore into t2 values(4,2),(5,1);
ERROR 23000: Cannot add or update a child row: a foreign key constraint fails
select * from t1 order by id;
id	c1
1	1
2	1
3	1
4	1
select * from t2 order by id;
id	c1
1	1
2	1
3	1
drop table if exists t3;
drop table if exists t2;
drop table if exists t1;
create table t1(id int primary key,c1 int ,index index1(c1));
create table t2(id int primary key,c1 int);
alter table t2 add foreign key(c1) references t1(c1) on update cascade on delete cascade;
insert into t1 values(1,1),(2,1),(3,1),(4,1);
insert into t2 values(1,1),(2,1);
select * from t1 order by id;
id	c1
1	1
2	1
3	1
4	1
select * from t2 order by id;
id	c1
1	1
2	1
UPDATE IGNORE t1 SET id = 2,c1 = 100 WHERE id = 1;
ERROR 23000: Cannot add or update a child row: a foreign key constraint fails
select * from t1 order by id;
id	c1
1	1
2	1
3	1
4	1
select * from t2 order by id;
id	c1
1	1
2	1
UPDATE IGNORE t1 SET id = 1,c1 = 100 WHERE id = 1;
select * from t1 order by id;
id	c1
1	100
2	1
3	1
4	1
select * from t2 order by id;
id	c1
1	100
2	100
UPDATE IGNORE t1 SET c1 = 100 WHERE id = 1;
select * from t1 order by id;
id	c1
1	100
2	1
3	1
4	1
select * from t2 order by id;
id	c1
1	100
2	100
UPDATE IGNORE t1 SET c1 = 200 WHERE id IN (1,2,3);
select * from t1 order by id;
id	c1
1	200
2	200
3	200
4	1
select * from t2 order by id;
id	c1
1	200
2	200
UPDATE IGNORE t1 SET c1 = 1 WHERE id IN (1,2,3);
select * from t1 order by id;
id	c1
1	1
2	1
3	1
4	1
select * from t2 order by id;
id	c1
1	1
2	1
UPDATE IGNORE t2 SET c1 = 1 WHERE id = 1;
UPDATE IGNORE t2 SET c1 = 200 WHERE id = 1;
ERROR 23000: Cannot add or update a child row: a foreign key constraint fails
drop table if exists t3;
drop table if exists t2;
drop table if exists t1;
create table t1(id int primary key,c1 int ,index index1(c1));
create table t2(id int primary key,c1 int, index index1(c1));
create table t3(id int primary key,c1 int);
alter table t2 add foreign key(c1) references t1(c1) on update cascade on delete cascade;
alter table t3 add foreign key(c1) references t2(c1) on update cascade on delete cascade;
insert into t1 values(1,1),(2,1),(3,1),(4,1);
insert into t2 values(1,1),(2,1);
insert into t3 values(1,1),(2,1);
UPDATE IGNORE t1 SET id = 2,c1 = 100 WHERE id = 1;
ERROR 23000: Cannot add or update a child row: a foreign key constraint fails
select * from t1 order by id;
id	c1
1	1
2	1
3	1
4	1
select * from t2 order by id;
id	c1
1	1
2	1
select * from t3 order by id;
id	c1
1	1
2	1
UPDATE IGNORE t2 SET id = 2,c1 = 100 WHERE id = 1;
ERROR 23000: Cannot add or update a child row: a foreign key constraint fails
select * from t1 order by id;
id	c1
1	1
2	1
3	1
4	1
select * from t2 order by id;
id	c1
1	1
2	1
select * from t3 order by id;
id	c1
1	1
2	1
UPDATE IGNORE t3 SET id = 2,c1 = 100 WHERE id = 1;
ERROR 23000: Cannot add or update a child row: a foreign key constraint fails
select * from t1 order by id;
id	c1
1	1
2	1
3	1
4	1
select * from t2 order by id;
id	c1
1	1
2	1
select * from t3 order by id;
id	c1
1	1
2	1
UPDATE IGNORE t2 SET c1 = 100 WHERE id = 1;
ERROR 23000: Cannot add or update a child row: a foreign key constraint fails
UPDATE IGNORE t3 SET c1 = 100 WHERE id = 1;
ERROR 23000: Cannot add or update a child row: a foreign key constraint fails
select * from t2 order by id;
id	c1
1	1
2	1
select * from t3 order by id;
id	c1
1	1
2	1
UPDATE IGNORE t1 SET c1 = 101 WHERE id = 1;
select * from t1 order by id;
id	c1
1	101
2	1
3	1
4	1
select * from t2 order by id;
id	c1
1	101
2	101
select * from t3 order by id;
id	c1
1	101
2	101
insert into t1 values(5,2),(6,2),(7,3),(8,3);
insert into t2 values(3,2),(4,3);
insert into t3 values(3,2),(4,3);
UPDATE IGNORE t1 SET id = 1, c1 = 102 WHERE c1 = 2;
ERROR 23000: Cannot add or update a child row: a foreign key constraint fails
select * from t1 order by id;
id	c1
1	101
2	1
3	1
4	1
5	2
6	2
7	3
8	3
select * from t2 order by id;
id	c1
1	101
2	101
3	2
4	3
select * from t3 order by id;
id	c1
1	101
2	101
3	2
4	3
UPDATE IGNORE t2 SET id = 1, c1 = 1 WHERE c1 = 2;
ERROR 23000: Cannot add or update a child row: a foreign key constraint fails
select * from t1 order by id;
id	c1
1	101
2	1
3	1
4	1
5	2
6	2
7	3
8	3
select * from t2 order by id;
id	c1
1	101
2	101
3	2
4	3
select * from t3 order by id;
id	c1
1	101
2	101
3	2
4	3
UPDATE IGNORE t1 SET c1 = 102 WHERE c1 = 2;
select * from t1 order by id;
id	c1
1	101
2	1
3	1
4	1
5	102
6	102
7	3
8	3
select * from t2 order by id;
id	c1
1	101
2	101
3	102
4	3
select * from t3 order by id;
id	c1
1	101
2	101
3	102
4	3
UPDATE IGNORE t2 SET id = 1, c1 = 1 WHERE c1 = 3;
ERROR 23000: Cannot add or update a child row: a foreign key constraint fails
select * from t1 order by id;
id	c1
1	101
2	1
3	1
4	1
5	102
6	102
7	3
8	3
select * from t2 order by id;
id	c1
1	101
2	101
3	102
4	3
select * from t3 order by id;
id	c1
1	101
2	101
3	102
4	3
UPDATE IGNORE t2 SET c1 = 1 WHERE c1 = 3;
select * from t1 order by id;
id	c1
1	101
2	1
3	1
4	1
5	102
6	102
7	3
8	3
select * from t2 order by id;
id	c1
1	101
2	101
3	102
4	1
select * from t3 order by id;
id	c1
1	101
2	101
3	102
4	1
drop table if exists t3;
drop table if exists t2;
drop table if exists t1;
create table t1(id int primary key,c1 int ,index index1(c1));
create table t2(id int primary key,c1 int);
alter table t2 add foreign key(c1) references t1(c1) on update cascade on delete cascade;
insert into t1 values(1,1),(2,1),(3,1),(4,1);
insert ignore into t2 values(1,1),(2,1);
select * from t1 order by id;
id	c1
1	1
2	1
3	1
4	1
select * from t2 order by id;
id	c1
1	1
2	1
delete ignore from t1 where id = 1;
select * from t1 order by id;
id	c1
2	1
3	1
4	1
select * from t2 order by id;
id	c1
insert ignore into t2 values(1,1),(2,1);
delete ignore from t1 where id IN (1,2,3,4);
select * from t1 order by id;
id	c1
select * from t2 order by id;
id	c1
insert into t1 values(1,1),(2,1),(3,2),(4,2);
insert ignore into t2 values(1,1),(2,2);
delete ignore from t1 where c1 = 1 or c1 = 2;
select * from t1 order by id;
id	c1
select * from t2 order by id;
id	c1
insert into t1 values(1,1),(2,1),(3,2),(4,2);
insert ignore into t2 values(1,1),(2,2);
delete ignore from t1 where c1 = 1 or c1 = 3;
select * from t1 order by id;
id	c1
3	2
4	2
select * from t2 order by id;
id	c1
2	2
drop table if exists t3;
drop table if exists t2;
drop table if exists t1;
create table t1(id int primary key,c1 int ,index index1(c1));
create table t2(id int primary key,c1 int, index index1(c1));
create table t3(id int primary key,c1 int);
alter table t2 add foreign key(c1) references t1(c1) on update cascade on delete cascade;
alter table t3 add foreign key(c1) references t2(c1) on update cascade on delete cascade;
insert into t1 values(1,1),(2,1),(3,1),(4,1),(5,2),(6,2),(7,3),(8,3);
insert into t2 values(1,1),(2,1),(3,2),(4,3);
insert into t3 values(1,1),(2,1),(3,2),(4,3);
delete ignore from t1 where id = 1;
select * from t1 order by id;
id	c1
2	1
3	1
4	1
5	2
6	2
7	3
8	3
select * from t2 order by id;
id	c1
3	2
4	3
select * from t3 order by id;
id	c1
3	2
4	3
delete ignore from t1 where id = 2;
select * from t1 order by id;
id	c1
3	1
4	1
5	2
6	2
7	3
8	3
select * from t2 order by id;
id	c1
3	2
4	3
select * from t3 order by id;
id	c1
3	2
4	3
delete ignore from t2 where c1 = 2;
select * from t1 order by id;
id	c1
3	1
4	1
5	2
6	2
7	3
8	3
select * from t2 order by id;
id	c1
4	3
select * from t3 order by id;
id	c1
4	3
delete ignore from t1 where c1 = 2;
select * from t1 order by id;
id	c1
3	1
4	1
7	3
8	3
select * from t2 order by id;
id	c1
4	3
select * from t3 order by id;
id	c1
4	3
delete ignore from t1 where c1 >= 1;
select * from t1 order by id;
id	c1
select * from t2 order by id;
id	c1
select * from t3 order by id;
id	c1
drop table if exists t3;
drop table if exists t2;
drop table if exists t1;
drop table if exists A, B, C;
create table A (a int, b int, c int, primary key(a), index idx_bc(b, c), index idx_b(b));
create table B (a int, b int, c int, primary key(a), index idx_bc(b, c), foreign key(b) references A(b));
create table C (a int, b int, c int, primary key(a), foreign key(b) references B(b));
alter table A drop index idx_b;
ERROR HY000: Cannot drop index 'idx_b': needed in a foreign key constraint
alter table A drop index idx_bc;
alter table B drop index idx_bc;
ERROR HY000: Cannot drop index 'idx_bc': needed in a foreign key constraint
drop table if exists A, B, C;
create table A(c1 int, c2 int, c3 int);
create index idx1 on A(c1, c2, c3);
create table B(c1 int, c2 int, foreign key(c1, c2) references A(c1, c2));
create index idx2 on A(c2, c1, c3);
create index idx3 on A(c1, c2, c3);
alter table A drop index idx1;
ERROR HY000: Cannot drop index 'idx1': needed in a foreign key constraint
alter table A drop index idx2;
alter table A drop index idx3;
drop table if exists A, B, C;
create table A(c1 int, c2 int, c3 int);
create index idx1 on A(c1, c2, c3);
create unique index idx2 on A(c1, c2);
create unique index idx3 on A(c1, c2, c3);
create table B(c1 int, c2 int, foreign key(c1, c2) references A(c1, c2));
alter table A drop index idx1;
alter table A drop index idx2;
ERROR HY000: unique/primary keys in table referenced by enabled foreign keys
alter table A drop index idx3;
drop table if exists A, B, C;
create table A(c1 int, c2 int, c3 int);
create index idx1 on A(c1, c2);
create index idx2 on A(c1, c2, c3);
create table B(c1 int, c2 int, foreign key(c1, c2) references A(c1, c2));
alter table A drop index idx1;
alter table A drop index idx2;
ERROR HY000: Cannot drop index 'idx2': needed in a foreign key constraint
drop table if exists A, B, C;
create table A (a int, b int, c int, index idx1(a, b, c));
create table B (a int, b int, c int, index idx2(a, b, c), foreign key(a, b) references A(a, b));
create table C (a int, b int, c int, foreign key(a, b) references B(a, b));
alter table A drop column a;
ERROR HY000: 'a': used in a foreign key constraint
alter table A drop column b;
ERROR HY000: 'b': used in a foreign key constraint
alter table A drop column c;
alter table B drop column a;
ERROR HY000: 'a': used in a foreign key constraint
alter table B drop column b;
ERROR HY000: 'b': used in a foreign key constraint
alter table B drop column c;
alter table A drop index idx1;
ERROR HY000: Cannot drop index 'idx1': needed in a foreign key constraint
alter table B drop index idx2;
ERROR HY000: 'idx2': used in a foreign key constraint
alter table A add column c int;
alter table B add column c int;
alter table A drop index idx1;
ERROR HY000: Cannot drop index 'idx1': needed in a foreign key constraint
alter table B drop index idx2;
ERROR HY000: 'idx2': used in a foreign key constraint
drop table if exists A, B, C;
create table A(c1 int,c2 int not null,c3 int,c4 int, primary key(c1, c2, c3));
create table B(c1 int not null,c2 int,c3 int,c4 int, CONSTRAINT fk1 foreign key(c1,c2) references A(c1,c2));
alter table A drop c1;
ERROR HY000: 'c1': used in a foreign key constraint
alter table A drop c2;
ERROR HY000: 'c2': used in a foreign key constraint
alter table B drop c1;
ERROR HY000: 'c1': used in a foreign key constraint
alter table B drop c2;
ERROR HY000: 'c2': used in a foreign key constraint
alter table A drop c3;
ERROR 0A000: drop rowkey column is not supported
alter table A drop c4;
alter table B drop c3;
alter table B drop c4;
alter table A drop primary key, add primary key(c1, c2);
ALTER TABLE A ADD COLUMN c4 int;
ALTER TABLE B ADD COLUMN c3 int;
ALTER TABLE B ADD COLUMN c4 int;
alter table A drop primary key, add primary key(c1, c2, c3);
drop table if exists A, B, C;
create table A(c1 int,c2 int not null,c3 int,c4 int);
create unique index i1 on A(c1,c2,c3);
create table B(c1 int not null,c2 int,c3 int,c4 int, CONSTRAINT fk1 foreign key(c1,c2) references A(c1,c2));
alter table A drop c1;
ERROR HY000: 'c1': used in a foreign key constraint
alter table A drop c2;
ERROR HY000: 'c2': used in a foreign key constraint
alter table B drop c1;
ERROR HY000: 'c1': used in a foreign key constraint
alter table B drop c2;
ERROR HY000: 'c2': used in a foreign key constraint
alter table A drop index i1;
ERROR HY000: unique/primary keys in table referenced by enabled foreign keys
alter table A drop c3;
alter table A drop c4;
alter table B drop c3;
alter table B drop c4;
alter table A drop index i1;
ERROR HY000: unique/primary keys in table referenced by enabled foreign keys
ALTER TABLE A ADD COLUMN c3 int;
ALTER TABLE A ADD COLUMN c4 int;
ALTER TABLE B ADD COLUMN c3 int;
ALTER TABLE B ADD COLUMN c4 int;
alter table A drop index i1;
ERROR HY000: unique/primary keys in table referenced by enabled foreign keys
drop table if exists A, B, C;
create table A (a int, b int, c int, index idx1(a, b, c));
create table B (a int, b int, c int, foreign key(a, b) references A(a, b));
alter table A add primary key(a, b);
alter table A drop index idx1;
ERROR HY000: Cannot drop index 'idx1': needed in a foreign key constraint
alter table A drop primary key;
ERROR HY000: unique/primary keys in table referenced by enabled foreign keys
drop table if exists A, B;
create table A (a int, b int, c int, index idx1(a, b, c));
create table B (a int, b int, c int, foreign key(a, b) references A(a, b));
alter table A rename column a to d;
alter table A rename column b to e;
alter table A rename column c to f;
alter table B rename column a to d;
alter table B rename column b to e;
alter table B rename column c to f;
drop table if exists A, B;
create table A (a int, b int, index idx_b(b));
create table B (a int, b int, foreign key(b) references A(b));
alter table A modify b double;
ERROR HY000: 'b': used in a foreign key constraint
alter table A modify b int unsigned;
ERROR HY000: 'b': used in a foreign key constraint
alter table B modify b double;
ERROR HY000: 'b': used in a foreign key constraint
alter table B modify b int unsigned;
ERROR HY000: 'b': used in a foreign key constraint
drop table if exists A, B;
create table A (a int, b int, primary key(a));
create table B (a int, b int, foreign key(b) references A(a));
alter table A modify a double;
ERROR HY000: 'a': used in a foreign key constraint
alter table A modify a int unsigned;
ERROR HY000: 'a': used in a foreign key constraint
alter table B modify b double;
ERROR HY000: 'b': used in a foreign key constraint
alter table B modify b int unsigned;
ERROR HY000: 'b': used in a foreign key constraint
drop table if exists A, B;
create table A (a int, b int, c int, primary key(a, b, c));
create table B (a int, b int, c int);
insert into A values(1,1,1), (2,2,2), (3,3,3), (4,4,4), (5,5,5), (6,6,6), (7,7,7), (8,8,8), (9,9,9), (10,10,10);
insert into B values(1,1,1), (2,2,2), (3,3,3), (4,4,4), (5,5,5), (6,6,6), (7,7,7), (8,8,8), (9,9,9), (10,10,10);
alter table B add foreign key(a) references A(a) on update cascade on delete cascade;
alter table B add foreign key(a, b) references A(a, b) on update cascade on delete cascade;
alter table B add foreign key(a, b, c) references A(a, b, c) on update cascade on delete cascade;
alter table A partition by range (a) (partition p0 values less than (5), partition p1 values less than (20));
select * from A order by a;
a	b	c
1	1	1
2	2	2
3	3	3
4	4	4
5	5	5
6	6	6
7	7	7
8	8	8
9	9	9
10	10	10
select * from A order by b;
a	b	c
1	1	1
2	2	2
3	3	3
4	4	4
5	5	5
6	6	6
7	7	7
8	8	8
9	9	9
10	10	10
alter table A partition by list (a) (partition p0 values in (1,2,3,4), partition p1 values in (5,6,7,8,9,10));
select * from A order by a;
a	b	c
1	1	1
2	2	2
3	3	3
4	4	4
5	5	5
6	6	6
7	7	7
8	8	8
9	9	9
10	10	10
select * from A order by b;
a	b	c
1	1	1
2	2	2
3	3	3
4	4	4
5	5	5
6	6	6
7	7	7
8	8	8
9	9	9
10	10	10
alter table A partition by hash (a) partitions 5;
select * from A order by a;
a	b	c
1	1	1
2	2	2
3	3	3
4	4	4
5	5	5
6	6	6
7	7	7
8	8	8
9	9	9
10	10	10
select * from A order by b;
a	b	c
1	1	1
2	2	2
3	3	3
4	4	4
5	5	5
6	6	6
7	7	7
8	8	8
9	9	9
10	10	10
alter table A partition by key (a) partitions 5;
update A set a = 11 where a = 1;
update A set b = 11 where b = 1;
select * from A order by a;
a	b	c
2	2	2
3	3	3
4	4	4
5	5	5
6	6	6
7	7	7
8	8	8
9	9	9
10	10	10
11	11	1
select * from A order by b;
a	b	c
2	2	2
3	3	3
4	4	4
5	5	5
6	6	6
7	7	7
8	8	8
9	9	9
10	10	10
11	11	1
alter table A partition by range (b) (partition p0 values less than (5), partition p1 values less than (20));
select * from A order by a;
a	b	c
2	2	2
3	3	3
4	4	4
5	5	5
6	6	6
7	7	7
8	8	8
9	9	9
10	10	10
11	11	1
select * from A order by b;
a	b	c
2	2	2
3	3	3
4	4	4
5	5	5
6	6	6
7	7	7
8	8	8
9	9	9
10	10	10
11	11	1
alter table A partition by list (b) (partition p0 values in (1,2,3,4), partition p1 values in (5,6,7,8,9,10,11,12,13));
select * from A order by a;
a	b	c
2	2	2
3	3	3
4	4	4
5	5	5
6	6	6
7	7	7
8	8	8
9	9	9
10	10	10
11	11	1
select * from A order by b;
a	b	c
2	2	2
3	3	3
4	4	4
5	5	5
6	6	6
7	7	7
8	8	8
9	9	9
10	10	10
11	11	1
alter table A partition by hash (b) partitions 5;
select * from A order by a;
a	b	c
2	2	2
3	3	3
4	4	4
5	5	5
6	6	6
7	7	7
8	8	8
9	9	9
10	10	10
11	11	1
select * from A order by b;
a	b	c
2	2	2
3	3	3
4	4	4
5	5	5
6	6	6
7	7	7
8	8	8
9	9	9
10	10	10
11	11	1
alter table A partition by key (b) partitions 5;
update A set a = 12 where a = 2;
update A set b = 12 where b = 2;
select * from A order by a;
a	b	c
3	3	3
4	4	4
5	5	5
6	6	6
7	7	7
8	8	8
9	9	9
10	10	10
11	11	1
12	12	2
select * from A order by b;
a	b	c
3	3	3
4	4	4
5	5	5
6	6	6
7	7	7
8	8	8
9	9	9
10	10	10
11	11	1
12	12	2
alter table A partition by range (c) (partition p0 values less than (5), partition p1 values less than (20));
select * from A order by a;
a	b	c
3	3	3
4	4	4
5	5	5
6	6	6
7	7	7
8	8	8
9	9	9
10	10	10
11	11	1
12	12	2
select * from A order by b;
a	b	c
3	3	3
4	4	4
5	5	5
6	6	6
7	7	7
8	8	8
9	9	9
10	10	10
11	11	1
12	12	2
alter table A partition by list (c) (partition p0 values in (1,2,3,4), partition p1 values in (5,6,7,8,9,10,11,12,13));
select * from A order by a;
a	b	c
3	3	3
4	4	4
5	5	5
6	6	6
7	7	7
8	8	8
9	9	9
10	10	10
11	11	1
12	12	2
select * from A order by b;
a	b	c
3	3	3
4	4	4
5	5	5
6	6	6
7	7	7
8	8	8
9	9	9
10	10	10
11	11	1
12	12	2
alter table A partition by hash (c) partitions 5;
select * from A order by a;
a	b	c
3	3	3
4	4	4
5	5	5
6	6	6
7	7	7
8	8	8
9	9	9
10	10	10
11	11	1
12	12	2
select * from A order by b;
a	b	c
3	3	3
4	4	4
5	5	5
6	6	6
7	7	7
8	8	8
9	9	9
10	10	10
11	11	1
12	12	2
alter table A partition by key (c) partitions 5;
update A set a = 13 where a = 3;
update A set b = 13 where b = 3;
select * from A order by a;
a	b	c
4	4	4
5	5	5
6	6	6
7	7	7
8	8	8
9	9	9
10	10	10
11	11	1
12	12	2
13	13	3
select * from A order by b;
a	b	c
4	4	4
5	5	5
6	6	6
7	7	7
8	8	8
9	9	9
10	10	10
11	11	1
12	12	2
13	13	3
drop table if exists A, B;
create table A (c1 string primary key, c2 string, index idx2(c2));
create table B (c1 string, foreign key (c1) references A(c2) on update cascade on delete cascade);
insert into A values ("pk", "xxx");
insert into B values ("xxx");
insert into B values ("xxx");
select * from A order by c1;
c1	c2
pk	xxx
select * from B order by c1;
c1
xxx
xxx
insert into B values ("error");
ERROR 23000: Cannot add or update a child row: a foreign key constraint fails
update B set c1 = "error" where c1 = "xxx";
ERROR 23000: Cannot add or update a child row: a foreign key constraint fails
insert into A values("pk", "insert up stmt") on duplicate key update c2 = values(c2);
select * from A order by c1;
c1	c2
pk	insert up stmt
select * from B order by c1;
c1
insert up stmt
insert up stmt
replace into A values("pk", "replace stmt");
select * from A order by c1;
c1	c2
pk	replace stmt
select * from B order by c1;
c1
insert into B values ("replace stmt");
select * from B order by c1;
c1
replace stmt
drop table if exists A, B;
create table A (c1 string, c2 string, c3 int, primary key(c1, c2));
create table B (c1 string, foreign key (c1) references A(c1) on update cascade on delete cascade);
insert into A values ("pk", "xxx", 0);
insert into B values ("pk");
insert into B values ("pk");
select * from A order by c1;
c1	c2	c3
pk	xxx	0
select * from B order by c1;
c1
pk
pk
insert into B values ("error");
ERROR 23000: Cannot add or update a child row: a foreign key constraint fails
update B set c1 = "error" where c1 = "pk";
ERROR 23000: Cannot add or update a child row: a foreign key constraint fails
insert into A values("pk", "xxx", 1) on duplicate key update c3 = values(c3);
select * from A order by c1;
c1	c2	c3
pk	xxx	1
select * from B order by c1;
c1
pk
pk
replace into A values("pk", "xxx", 2);
select * from A order by c1;
c1	c2	c3
pk	xxx	2
select * from B order by c1;
c1
insert into B values ("pk");
select * from B order by c1;
c1
pk
drop table if exists A, B, C;
use oceanbase;
alter system set _enable_parallel_table_creation = false;
select value from __all_virtual_tenant_parameter_stat where name = '_enable_parallel_table_creation' limit 1;
value
False
use test;
drop table if exists A, B, C, D, E, F, G;
create table A(a int, a3 int, primary key (a, a3), a2 int, a4 int, foreign key (a2, a4) references A(a, A3));
drop table A;
create table A(a int, a2 int, a3 int, a4 int, a5 int, a6 int, a7 int, primary key(A, A2, A3), foreign key (a6) references A(a), foreign key(A4, a5) references A(a2, a));
create table B(b int, b2 int, b3 int, b4 int, unique key(b, b2), foreign key (b) references A(a), foreign key (b3, b4) references A(a, a2), foreign key (b3) references B(b));
create table C(c int, c2 int, c3 int, c4 int, c5 int, index Cindex (c, c2, c3), unique key(c3, c4, c5), foreign key (C3, c4) references C(c2, c));
create table D(d int, d2 int, d3 int, d4 int, foreign key(d3, D4) references C(C2, c), foreign key(d2, D3, d4) references C(C3, c2, c));
create table E(e int, e2 int, E3 int, E4 int, foreign key(E4, e3) references C(C4, c3), foreign key(E, e2, e3) references C(c3, C4, c5), index Eindex (e));
create table F(f int, f2 int, f3 int, f4 int, f5 int, unique index Findex (f, F2, F3), foreign key (f4) references F(f), foreign key (f5) references E(é));
create table G(g int, g2 int, g3 int, g4 int, foreign key (g, g2) references F(F, f2));
create table F1(f int, f2 int, f3 int, f4 int, foreign key(f3, f4) references C(c, c3));
ERROR HY000: Cannot add foreign key constraint
create table F2(f int, f2 int, f3 int, f4 int, foreign key(f3) references A(a2));
ERROR HY000: Cannot add foreign key constraint
create table F3(f int, f2 int, f3 int, f4 int, foreign key(f3) references B(b2));
ERROR HY000: Cannot add foreign key constraint
create table F4(f int, f2 int, f3 int, f4 int, foreign key(f3, f4) references C(c4, c5));
ERROR HY000: Cannot add foreign key constraint
create table F5(f int, f2 int, f3 int, f4 int, primary key(f, f2), foreign key(f3, f4) references F5(f, f3));
ERROR HY000: Cannot add foreign key constraint
create table F5(f int, f2 int, f3 int, f4 int, primary key(f, f2), foreign key(f3, f4) references F5(f, f));
ERROR HY000: Cannot add foreign key constraint
create table F6(f int, f2 int, f3 int, f4 int, f5 int, unique key(f, f2, f3), foreign key(f4, f5) references F6(f, f3));
ERROR HY000: Cannot add foreign key constraint
create table F7(f int, f2 int, f3 int, f4 int, f5 int, index Findex(f, f2, f3), foreign key(f3) references F7(f), foreign key(f4, f5) references F7(f, f3));
ERROR HY000: Cannot add foreign key constraint
create table F8(f int, f2 int, f3 int, f4 int, f5 int, foreign key(f3, f4) references E(e));
ERROR 42000: Incorrect foreign key definition: Key reference and table reference don't match
create table F9(f int, f2 int, f3 int, f4 int, f5 int, foreign key(f3, f4) references F(f, f2, f3));
ERROR 42000: Incorrect foreign key definition: Key reference and table reference don't match
drop table A, B, C, D, E, F, G;
create table A(a int, msg int);
create index Aindex on A(a);
create table B(a int, FOREIGN KEY(a) REFERENCES A(a) on update cascade on delete cascade);
insert into A values (2, 10), (3, 11), (3, 12), (NULL, 10), (NULL, 11);
insert into B values (2), (2), (2), (3), (3), (3), (NULL);
select * from B;
a
2
2
2
3
3
3
NULL
insert into B values (10);
ERROR 23000: Cannot add or update a child row: a foreign key constraint fails
update A set a = 4 where a = 2;
delete from A where a = 4;
select * from A;
a	msg
3	11
3	12
NULL	10
NULL	11
drop table A, B;
create table A(a int, msg int);
create index Aindex on A(a);
create table B(a int, FOREIGN KEY(a) REFERENCES A(a));
insert into A values (2, 10), (3, 11), (3, 12);
insert into B values (2), (2), (2), (3), (3), (3);
insert into B values (10);
ERROR 23000: Cannot add or update a child row: a foreign key constraint fails
select * from B;
a
2
2
2
3
3
3
update A set a = 4 where a = 2;
ERROR 23000: Cannot delete or update a parent row: a foreign key constraint fails
delete from A where a = 2;
ERROR 23000: Cannot delete or update a parent row: a foreign key constraint fails
drop table A, B;
create table A(b int, a2 int, a3 int, msg int);
create index Aindex on A(b, a2, a3);
create index Ai2 on A(msg);
create index Ai3 on A(a3, msg, a2);
create table B(a int, FOREIGN KEY(a) REFERENCES A(b));
create table C(a2 int, FOREIGN KEY(a2) REFERENCES A(a2));
ERROR HY000: Cannot add foreign key constraint
create table C(a2 int, a3 int, FOREIGN KEY(a2, a3) REFERENCES A(a2, a3));
ERROR HY000: Cannot add foreign key constraint
insert into A values (2, 100, 10, NULL), (3, 101, 11, NULL), (3, 101, 12, NULL);
insert into B values (2), (2), (2), (3), (3), (3);
insert into B values (10);
ERROR 23000: Cannot add or update a child row: a foreign key constraint fails
select * from B;
a
2
2
2
3
3
3
update A set b = 4 where b = 2;
ERROR 23000: Cannot delete or update a parent row: a foreign key constraint fails
delete from A where b = 2;
ERROR 23000: Cannot delete or update a parent row: a foreign key constraint fails
create table C(a2 int, b int, FOREIGN KEY(a2, b) REFERENCES A(a2, b));
insert into C values (100, 2), (101, 3), (101, 3), (100, 2);
select * from C;
a2	b
100	2
101	3
101	3
100	2
insert into C values (100, 100);
ERROR 23000: Cannot add or update a child row: a foreign key constraint fails
create table D(a2 int, b int, FOREIGN KEY(b, a2) REFERENCES A(b, a2));
insert into D values (100, 2), (101, 3), (101, 3), (100, 2);
select * from D;
a2	b
100	2
101	3
101	3
100	2
create table E(a3 int, a2 int, b int, FOREIGN KEY(b, a2, a3) REFERENCES A(b, a2, a3));
insert into E values (10, 100, 2), (11, 101, 3), (12, 101, 3), (10, 100, 2);
select * from E;
a3	a2	b
10	100	2
11	101	3
12	101	3
10	100	2
alter table A drop index Aindex;
ERROR HY000: Cannot drop index 'Aindex': needed in a foreign key constraint
alter table A drop index Ai2;
alter table A drop index Ai3;
drop table E;
alter table A drop index Aindex;
ERROR HY000: Cannot drop index 'Aindex': needed in a foreign key constraint
drop table D;
alter table A drop index Aindex;
ERROR HY000: Cannot drop index 'Aindex': needed in a foreign key constraint
drop table C;
alter table A drop index Aindex;
ERROR HY000: Cannot drop index 'Aindex': needed in a foreign key constraint
drop table B;
alter table A drop index Aindex;
drop table A;
create table A(a int, a2 int, a3 int, a4 int);
create index Aindex on A(a, a2, a3, a4);
alter table A add foreign key (a2) references A(a) on update cascade;
alter table A add foreign key (a3, a4) references A(a, a2) on update cascade;
insert into A values (1, NULL, NULL, NULL);
insert into A values (1, 1, NULL, NULL);
insert into A values (NULL, NULL, 1, 1);
select * from A;
a	a2	a3	a4
1	NULL	NULL	NULL
1	1	NULL	NULL
NULL	NULL	1	1
alter table A drop index Aindex;
ERROR HY000: Cannot drop index 'Aindex': needed in a foreign key constraint
drop table A;
create table A(pk1 int, pk2 int, a int, a2 int, primary key A(a, pk1, pk2), foreign key (a2) references A(a));
insert into A values (0, 0, 1, NULL);
insert into A values (0, 1, 1, NULL);
insert into A values (0, 0, 2, 1);
select * from A;
pk1	pk2	a	a2
0	0	1	NULL
0	1	1	NULL
0	0	2	1
drop table A;
create table A(a int, a2 int, a3 int, a4 int, index Aindex(a, a2, a3, a4), foreign key (a2) references A(a), foreign key (a4, a3) references A(a, a2));
create table B(a varchar(20), a2 int, a3 int, a4 int, index Bindex(a, a2, a3, a4), foreign key (a2) references B(a), foreign key (a4, a3) references B(a, a2));
ERROR HY000: Cannot add foreign key constraint
create table B(a int, a2 int, a3 int, a4 int, index Bindex(a, a2, a4), foreign key (a2) references B(a), foreign key (a3, a4) references B(a4, a2));
ERROR HY000: Cannot add foreign key constraint
create table B(a int, a2 int, a3 int, a4 int, index Bindex(a4, a2, a), foreign key (a2) references B(a), foreign key (a3, a4) references B(a, a2));
ERROR HY000: Cannot add foreign key constraint
insert into A values (1, NULL, NULL, NULL);
insert into A values (1, 1, NULL, NULL);
insert into A values (NULL, NULL, 1, 1);
select * from A;
a	a2	a3	a4
1	NULL	NULL	NULL
1	1	NULL	NULL
NULL	NULL	1	1
drop table A;
create table A(uk1 int, uk2 int, a int, unique key A(uk1, uk2), foreign key (a) references A(uk1));
insert into A values (1, 1, NULL), (1, 2, 1);
select * from A;
uk1	uk2	a
1	1	NULL
1	2	1
replace into A values (1, 1, 1);
ERROR 23000: Cannot delete or update a parent row: a foreign key constraint fails
update A set a = NULL;
select * from A;
uk1	uk2	a
1	1	NULL
1	2	NULL
drop table A;
create table A(c1 int, c2 int, c3 int, c4 int, c5 int, c6 int, unique key (c1, c2, c3, c4, c5), foreign key(c5, c4, c6) references A(c3, c1, c2));
insert into A values (1, 1, 1, NULL, NULL, NULL), (NULL, NULL, NULL, 1, 1, 1);
select * from A;
c1	c2	c3	c4	c5	c6
1	1	1	NULL	NULL	NULL
NULL	NULL	NULL	1	1	1
drop table A;
create table A(c1 int, c2 int, c3 int, c4 int, c5 int, c6 int, primary key (c1, c2, c3, c4, c5), foreign key(c5, c4, c6) references A(c3, c1, c2), foreign key(c6, c5) references A(c2, c1));
insert into A values (1, 1, 1, 1, 1, 1), (1, 2, 1, 1, 1, 1);
replace into A values (1, 2, 1, 1, 1, 3);
ERROR 23000: Cannot add or update a child row: a foreign key constraint fails
select * from A;
c1	c2	c3	c4	c5	c6
1	1	1	1	1	1
1	2	1	1	1	1
drop table A;
create table A(a varchar(20), a2 varchar(20));
create index Aindex on A(a2, a);
create table B(a varchar(20), foreign key (a) references A(a2));
insert into A values ('a', 'a2'), ('a3', 'a4'), ('a', 'a2'), ('a3', 'a4');
insert into B values ('a2'), ('a2'), ('a4'), ('a4');
select * from B;
a
a2
a2
a4
a4
select * from A;
a	a2
a	a2
a3	a4
a	a2
a3	a4
insert into B values ('');
ERROR 23000: Cannot add or update a child row: a foreign key constraint fails
drop table A, B;
create table A(a varchar(20), b int, c int, unique key(b, c), foreign key(a) references A(b));
ERROR HY000: Cannot add foreign key constraint
create table A(a varchar(20), b int, c varchar(20), unique key(b, c), foreign key(a) references A(b));
ERROR HY000: Cannot add foreign key constraint
create table A(a int, b float, c float, unique key(b, c), foreign key(a) references A(b));
ERROR HY000: Cannot add foreign key constraint
create table A(a int, b int, c int);
create index Aindex on A(a, b);
create table B(a varchar(20), foreign key(a) references A(a));
ERROR HY000: Cannot add foreign key constraint
create table B(a float, foreign key(a) references A(a));
ERROR HY000: Cannot add foreign key constraint
create table B(a int, foreign key(a) references A(a));
drop table A, B;
create table A(a int, a2 int);
create index Ai on A(a);
create unique index Aui on A(a);
create index Ai2 on A(a);
create table B(a int, foreign key (a) references A(a));
alter table A drop index Aui;
ERROR HY000: unique/primary keys in table referenced by enabled foreign keys
alter table A drop index Ai;
alter table A drop index Ai2;
insert into A values (1, 10), (2, 20);
insert into B values (1), (1), (2), (2);
select * from A;
a	a2
1	10
2	20
select * from B;
a
1
1
2
2
drop table A, B;
create table A(a int, a2 int, primary key (a, a2));
create unique index Aui on A(a2);
create table B(a2 int, foreign key (a2) references A(a2));
alter table A drop index Aui;
ERROR HY000: unique/primary keys in table referenced by enabled foreign keys
insert into A values (1, 10), (2, 11);
insert into B values (10), (10), (11), (11);
select * from A;
a	a2
1	10
2	11
select * from B;
a2
10
10
11
11
drop table A, B;
create table A(a int, a2 int, primary key (a));
create unique index Aui on A(a);
create table B(a int, foreign key (a) references A(a));
alter table A drop index Aui;
insert into A values (1, 10), (2, 11);
insert into B values (1), (1), (2), (2);
select * from A;
a	a2
1	10
2	11
select * from B;
a
1
1
2
2
drop table A, B;
create table A(a int, a2 int);
create index Aindex on A(a);
create table B(a int, foreign key (a) references A(a));
create unique index Aui on A(a);
insert into A values (1, 10), (2, 11);
insert into B values (1), (1), (2), (2);
select * from A;
a	a2
1	10
2	11
select * from B;
a
1
1
2
2
alter table A drop index Aui;
insert into B values (1), (1), (2), (2);
select * from B;
a
1
1
2
2
1
1
2
2
drop table A, B;
create table A(a int, a2 int, primary key(a, a2));
create table B(b int primary key, a int, foreign key (a) references A(a));
replace into A values(1, 1), (2, 2), (3, 3), (4, 4);
replace into A values(1, 5), (1, 6), (1, 7), (2, 5), (2, 6), (2, 7), (3, 5), (3, 6), (3, 7);
replace into B values(10, 1), (11, 2), (12, 4), (13, 1), (14, 2), (15, 1);
select * from A;
a	a2
1	1
1	5
1	6
1	7
2	2
2	5
2	6
2	7
3	3
3	5
3	6
3	7
4	4
select * from B;
b	a
10	1
11	2
12	4
13	1
14	2
15	1
replace into B values(12, 1);
select * from B;
b	a
10	1
11	2
12	1
13	1
14	2
15	1
replace into B values(16, 1), (17, 2), (18, 1), (19, 2);
select * from B;
b	a
10	1
11	2
12	1
13	1
14	2
15	1
16	1
17	2
18	1
19	2
update B set a = a + 1;
select * from B;
b	a
10	2
11	3
12	2
13	2
14	3
15	2
16	2
17	3
18	2
19	3
update A set a = 5, a2 = 5 where a = 2 and a2 = 2;
ERROR 23000: Cannot delete or update a parent row: a foreign key constraint fails
update A set a = 5, a2 = 5 where a = 1 and a2 = 1;
select * from A;
a	a2
1	5
1	6
1	7
2	2
2	5
2	6
2	7
3	3
3	5
3	6
3	7
4	4
5	5
delete from A;
ERROR 23000: Cannot delete or update a parent row: a foreign key constraint fails
delete from B where a <> 2;
delete from A where a <> 2;
select * from A;
a	a2
2	2
2	5
2	6
2	7
select * from B;
b	a
10	2
12	2
13	2
15	2
16	2
18	2
drop table A, B;
create table A(a int not null, a2 int not null, primary key(a, a2));
create table B(b int primary key, a int not null, foreign key(a) references A(a));
insert into A values(1, 1), (1, 2), (2, 1), (3, 1);
insert into B values(10, 1), (11, 3);
select * from B left join A on B.a = A.a order by A.a;
b	a	a	a2
10	1	1	1
10	1	1	2
11	3	3	1
select B.* from B join A on B.a = A.a order by B.b;
b	a
10	1
10	1
11	3
drop table A, B;
create table A(a int, index Aindex(a));
create table B(b int primary key, a int, foreign key(a) references A(a));
create table C(c int primary key, a int not null, foreign key(a) references A(a));
insert into A values(1), (1), (2), (3), (NULL);
insert into B values(10, 1), (11, 3);
insert into C values(10, 1), (11, 3);
select * from B left join A on B.a = A.a order by A.a, B.b;
b	a	a
10	1	1
10	1	1
11	3	3
select * from C left join A on C.a = A.a order by A.a, C.c;
c	a	a
10	1	1
10	1	1
11	3	3
select B.* from B join A on B.a = A.a order by B.b;
b	a
10	1
10	1
11	3
select C.* from C join A on C.a = A.a order by C.c;
c	a
10	1
10	1
11	3
drop table A, B, C;
drop table if exists t3;
drop table if exists t2;
drop table if exists t1;
create table t1(id int primary key,c1 int ,index index1(c1));
create table t2(id int primary key,c1 int);
alter table t2 add foreign key(c1) references t1(c1) on update cascade on delete cascade;
insert into t1 values(1,1),(2,1),(3,1),(4,1);
insert ignore into t2 values(1,1),(2,1);
select * from t1 order by id;
id	c1
1	1
2	1
3	1
4	1
select * from t2 order by id;
id	c1
1	1
2	1
insert ignore into t2 values(3,1),(1,1);
select * from t1 order by id;
id	c1
1	1
2	1
3	1
4	1
select * from t2 order by id;
id	c1
1	1
2	1
3	1
insert ignore into t2 values(4,1),(1,2);
ERROR 23000: Cannot add or update a child row: a foreign key constraint fails
insert ignore into t2 values(4,2),(5,1);
ERROR 23000: Cannot add or update a child row: a foreign key constraint fails
select * from t1 order by id;
id	c1
1	1
2	1
3	1
4	1
select * from t2 order by id;
id	c1
1	1
2	1
3	1
drop table if exists t3;
drop table if exists t2;
drop table if exists t1;
create table t1(id int primary key,c1 int ,index index1(c1));
create table t2(id int primary key,c1 int);
alter table t2 add foreign key(c1) references t1(c1) on update cascade on delete cascade;
insert into t1 values(1,1),(2,1),(3,1),(4,1);
insert into t2 values(1,1),(2,1);
select * from t1 order by id;
id	c1
1	1
2	1
3	1
4	1
select * from t2 order by id;
id	c1
1	1
2	1
UPDATE IGNORE t1 SET id = 2,c1 = 100 WHERE id = 1;
ERROR 23000: Cannot add or update a child row: a foreign key constraint fails
select * from t1 order by id;
id	c1
1	1
2	1
3	1
4	1
select * from t2 order by id;
id	c1
1	1
2	1
UPDATE IGNORE t1 SET id = 1,c1 = 100 WHERE id = 1;
select * from t1 order by id;
id	c1
1	100
2	1
3	1
4	1
select * from t2 order by id;
id	c1
1	100
2	100
UPDATE IGNORE t1 SET c1 = 100 WHERE id = 1;
select * from t1 order by id;
id	c1
1	100
2	1
3	1
4	1
select * from t2 order by id;
id	c1
1	100
2	100
UPDATE IGNORE t1 SET c1 = 200 WHERE id IN (1,2,3);
select * from t1 order by id;
id	c1
1	200
2	200
3	200
4	1
select * from t2 order by id;
id	c1
1	200
2	200
UPDATE IGNORE t1 SET c1 = 1 WHERE id IN (1,2,3);
select * from t1 order by id;
id	c1
1	1
2	1
3	1
4	1
select * from t2 order by id;
id	c1
1	1
2	1
UPDATE IGNORE t2 SET c1 = 1 WHERE id = 1;
UPDATE IGNORE t2 SET c1 = 200 WHERE id = 1;
ERROR 23000: Cannot add or update a child row: a foreign key constraint fails
drop table if exists t3;
drop table if exists t2;
drop table if exists t1;
create table t1(id int primary key,c1 int ,index index1(c1));
create table t2(id int primary key,c1 int, index index1(c1));
create table t3(id int primary key,c1 int);
alter table t2 add foreign key(c1) references t1(c1) on update cascade on delete cascade;
alter table t3 add foreign key(c1) references t2(c1) on update cascade on delete cascade;
insert into t1 values(1,1),(2,1),(3,1),(4,1);
insert into t2 values(1,1),(2,1);
insert into t3 values(1,1),(2,1);
UPDATE IGNORE t1 SET id = 2,c1 = 100 WHERE id = 1;
ERROR 23000: Cannot add or update a child row: a foreign key constraint fails
select * from t1 order by id;
id	c1
1	1
2	1
3	1
4	1
select * from t2 order by id;
id	c1
1	1
2	1
select * from t3 order by id;
id	c1
1	1
2	1
UPDATE IGNORE t2 SET id = 2,c1 = 100 WHERE id = 1;
ERROR 23000: Cannot add or update a child row: a foreign key constraint fails
select * from t1 order by id;
id	c1
1	1
2	1
3	1
4	1
select * from t2 order by id;
id	c1
1	1
2	1
select * from t3 order by id;
id	c1
1	1
2	1
UPDATE IGNORE t3 SET id = 2,c1 = 100 WHERE id = 1;
ERROR 23000: Cannot add or update a child row: a foreign key constraint fails
select * from t1 order by id;
id	c1
1	1
2	1
3	1
4	1
select * from t2 order by id;
id	c1
1	1
2	1
select * from t3 order by id;
id	c1
1	1
2	1
UPDATE IGNORE t2 SET c1 = 100 WHERE id = 1;
ERROR 23000: Cannot add or update a child row: a foreign key constraint fails
UPDATE IGNORE t3 SET c1 = 100 WHERE id = 1;
ERROR 23000: Cannot add or update a child row: a foreign key constraint fails
select * from t2 order by id;
id	c1
1	1
2	1
select * from t3 order by id;
id	c1
1	1
2	1
UPDATE IGNORE t1 SET c1 = 101 WHERE id = 1;
select * from t1 order by id;
id	c1
1	101
2	1
3	1
4	1
select * from t2 order by id;
id	c1
1	101
2	101
select * from t3 order by id;
id	c1
1	101
2	101
insert into t1 values(5,2),(6,2),(7,3),(8,3);
insert into t2 values(3,2),(4,3);
insert into t3 values(3,2),(4,3);
UPDATE IGNORE t1 SET id = 1, c1 = 102 WHERE c1 = 2;
ERROR 23000: Cannot add or update a child row: a foreign key constraint fails
select * from t1 order by id;
id	c1
1	101
2	1
3	1
4	1
5	2
6	2
7	3
8	3
select * from t2 order by id;
id	c1
1	101
2	101
3	2
4	3
select * from t3 order by id;
id	c1
1	101
2	101
3	2
4	3
UPDATE IGNORE t2 SET id = 1, c1 = 1 WHERE c1 = 2;
ERROR 23000: Cannot add or update a child row: a foreign key constraint fails
select * from t1 order by id;
id	c1
1	101
2	1
3	1
4	1
5	2
6	2
7	3
8	3
select * from t2 order by id;
id	c1
1	101
2	101
3	2
4	3
select * from t3 order by id;
id	c1
1	101
2	101
3	2
4	3
UPDATE IGNORE t1 SET c1 = 102 WHERE c1 = 2;
select * from t1 order by id;
id	c1
1	101
2	1
3	1
4	1
5	102
6	102
7	3
8	3
select * from t2 order by id;
id	c1
1	101
2	101
3	102
4	3
select * from t3 order by id;
id	c1
1	101
2	101
3	102
4	3
UPDATE IGNORE t2 SET id = 1, c1 = 1 WHERE c1 = 3;
ERROR 23000: Cannot add or update a child row: a foreign key constraint fails
select * from t1 order by id;
id	c1
1	101
2	1
3	1
4	1
5	102
6	102
7	3
8	3
select * from t2 order by id;
id	c1
1	101
2	101
3	102
4	3
select * from t3 order by id;
id	c1
1	101
2	101
3	102
4	3
UPDATE IGNORE t2 SET c1 = 1 WHERE c1 = 3;
select * from t1 order by id;
id	c1
1	101
2	1
3	1
4	1
5	102
6	102
7	3
8	3
select * from t2 order by id;
id	c1
1	101
2	101
3	102
4	1
select * from t3 order by id;
id	c1
1	101
2	101
3	102
4	1
drop table if exists t3;
drop table if exists t2;
drop table if exists t1;
create table t1(id int primary key,c1 int ,index index1(c1));
create table t2(id int primary key,c1 int);
alter table t2 add foreign key(c1) references t1(c1) on update cascade on delete cascade;
insert into t1 values(1,1),(2,1),(3,1),(4,1);
insert ignore into t2 values(1,1),(2,1);
select * from t1 order by id;
id	c1
1	1
2	1
3	1
4	1
select * from t2 order by id;
id	c1
1	1
2	1
delete ignore from t1 where id = 1;
select * from t1 order by id;
id	c1
2	1
3	1
4	1
select * from t2 order by id;
id	c1
insert ignore into t2 values(1,1),(2,1);
delete ignore from t1 where id IN (1,2,3,4);
select * from t1 order by id;
id	c1
select * from t2 order by id;
id	c1
insert into t1 values(1,1),(2,1),(3,2),(4,2);
insert ignore into t2 values(1,1),(2,2);
delete ignore from t1 where c1 = 1 or c1 = 2;
select * from t1 order by id;
id	c1
select * from t2 order by id;
id	c1
insert into t1 values(1,1),(2,1),(3,2),(4,2);
insert ignore into t2 values(1,1),(2,2);
delete ignore from t1 where c1 = 1 or c1 = 3;
select * from t1 order by id;
id	c1
3	2
4	2
select * from t2 order by id;
id	c1
2	2
drop table if exists t3;
drop table if exists t2;
drop table if exists t1;
create table t1(id int primary key,c1 int ,index index1(c1));
create table t2(id int primary key,c1 int, index index1(c1));
create table t3(id int primary key,c1 int);
alter table t2 add foreign key(c1) references t1(c1) on update cascade on delete cascade;
alter table t3 add foreign key(c1) references t2(c1) on update cascade on delete cascade;
insert into t1 values(1,1),(2,1),(3,1),(4,1),(5,2),(6,2),(7,3),(8,3);
insert into t2 values(1,1),(2,1),(3,2),(4,3);
insert into t3 values(1,1),(2,1),(3,2),(4,3);
delete ignore from t1 where id = 1;
select * from t1 order by id;
id	c1
2	1
3	1
4	1
5	2
6	2
7	3
8	3
select * from t2 order by id;
id	c1
3	2
4	3
select * from t3 order by id;
id	c1
3	2
4	3
delete ignore from t1 where id = 2;
select * from t1 order by id;
id	c1
3	1
4	1
5	2
6	2
7	3
8	3
select * from t2 order by id;
id	c1
3	2
4	3
select * from t3 order by id;
id	c1
3	2
4	3
delete ignore from t2 where c1 = 2;
select * from t1 order by id;
id	c1
3	1
4	1
5	2
6	2
7	3
8	3
select * from t2 order by id;
id	c1
4	3
select * from t3 order by id;
id	c1
4	3
delete ignore from t1 where c1 = 2;
select * from t1 order by id;
id	c1
3	1
4	1
7	3
8	3
select * from t2 order by id;
id	c1
4	3
select * from t3 order by id;
id	c1
4	3
delete ignore from t1 where c1 >= 1;
select * from t1 order by id;
id	c1
select * from t2 order by id;
id	c1
select * from t3 order by id;
id	c1
drop table if exists t3;
drop table if exists t2;
drop table if exists t1;
drop table if exists A, B, C;
create table A (a int, b int, c int, primary key(a), index idx_bc(b, c), index idx_b(b));
create table B (a int, b int, c int, primary key(a), index idx_bc(b, c), foreign key(b) references A(b));
create table C (a int, b int, c int, primary key(a), foreign key(b) references B(b));
alter table A drop index idx_b;
ERROR HY000: Cannot drop index 'idx_b': needed in a foreign key constraint
alter table A drop index idx_bc;
alter table B drop index idx_bc;
ERROR HY000: Cannot drop index 'idx_bc': needed in a foreign key constraint
drop table if exists A, B, C;
create table A(c1 int, c2 int, c3 int);
create index idx1 on A(c1, c2, c3);
create table B(c1 int, c2 int, foreign key(c1, c2) references A(c1, c2));
create index idx2 on A(c2, c1, c3);
create index idx3 on A(c1, c2, c3);
alter table A drop index idx1;
ERROR HY000: Cannot drop index 'idx1': needed in a foreign key constraint
alter table A drop index idx2;
alter table A drop index idx3;
drop table if exists A, B, C;
create table A(c1 int, c2 int, c3 int);
create index idx1 on A(c1, c2, c3);
create unique index idx2 on A(c1, c2);
create unique index idx3 on A(c1, c2, c3);
create table B(c1 int, c2 int, foreign key(c1, c2) references A(c1, c2));
alter table A drop index idx1;
alter table A drop index idx2;
ERROR HY000: unique/primary keys in table referenced by enabled foreign keys
alter table A drop index idx3;
drop table if exists A, B, C;
create table A(c1 int, c2 int, c3 int);
create index idx1 on A(c1, c2);
create index idx2 on A(c1, c2, c3);
create table B(c1 int, c2 int, foreign key(c1, c2) references A(c1, c2));
alter table A drop index idx1;
alter table A drop index idx2;
ERROR HY000: Cannot drop index 'idx2': needed in a foreign key constraint
drop table if exists A, B, C;
create table A (a int, b int, c int, index idx1(a, b, c));
create table B (a int, b int, c int, index idx2(a, b, c), foreign key(a, b) references A(a, b));
create table C (a int, b int, c int, foreign key(a, b) references B(a, b));
alter table A drop column a;
ERROR HY000: 'a': used in a foreign key constraint
alter table A drop column b;
ERROR HY000: 'b': used in a foreign key constraint
alter table A drop column c;
alter table B drop column a;
ERROR HY000: 'a': used in a foreign key constraint
alter table B drop column b;
ERROR HY000: 'b': used in a foreign key constraint
alter table B drop column c;
alter table A drop index idx1;
ERROR HY000: Cannot drop index 'idx1': needed in a foreign key constraint
alter table B drop index idx2;
ERROR HY000: 'idx2': used in a foreign key constraint
alter table A add column c int;
alter table B add column c int;
alter table A drop index idx1;
ERROR HY000: Cannot drop index 'idx1': needed in a foreign key constraint
alter table B drop index idx2;
ERROR HY000: 'idx2': used in a foreign key constraint
drop table if exists A, B, C;
create table A(c1 int,c2 int not null,c3 int,c4 int, primary key(c1, c2, c3));
create table B(c1 int not null,c2 int,c3 int,c4 int, CONSTRAINT fk1 foreign key(c1,c2) references A(c1,c2));
alter table A drop c1;
ERROR HY000: 'c1': used in a foreign key constraint
alter table A drop c2;
ERROR HY000: 'c2': used in a foreign key constraint
alter table B drop c1;
ERROR HY000: 'c1': used in a foreign key constraint
alter table B drop c2;
ERROR HY000: 'c2': used in a foreign key constraint
alter table A drop c3;
ERROR 0A000: drop rowkey column is not supported
alter table A drop c4;
alter table B drop c3;
alter table B drop c4;
alter table A drop primary key, add primary key(c1, c2);
ALTER TABLE A ADD COLUMN c4 int;
ALTER TABLE B ADD COLUMN c3 int;
ALTER TABLE B ADD COLUMN c4 int;
alter table A drop primary key, add primary key(c1, c2, c3);
drop table if exists A, B, C;
create table A(c1 int,c2 int not null,c3 int,c4 int);
create unique index i1 on A(c1,c2,c3);
create table B(c1 int not null,c2 int,c3 int,c4 int, CONSTRAINT fk1 foreign key(c1,c2) references A(c1,c2));
alter table A drop c1;
ERROR HY000: 'c1': used in a foreign key constraint
alter table A drop c2;
ERROR HY000: 'c2': used in a foreign key constraint
alter table B drop c1;
ERROR HY000: 'c1': used in a foreign key constraint
alter table B drop c2;
ERROR HY000: 'c2': used in a foreign key constraint
alter table A drop index i1;
ERROR HY000: unique/primary keys in table referenced by enabled foreign keys
alter table A drop c3;
alter table A drop c4;
alter table B drop c3;
alter table B drop c4;
alter table A drop index i1;
ERROR HY000: unique/primary keys in table referenced by enabled foreign keys
ALTER TABLE A ADD COLUMN c3 int;
ALTER TABLE A ADD COLUMN c4 int;
ALTER TABLE B ADD COLUMN c3 int;
ALTER TABLE B ADD COLUMN c4 int;
alter table A drop index i1;
ERROR HY000: unique/primary keys in table referenced by enabled foreign keys
drop table if exists A, B, C;
create table A (a int, b int, c int, index idx1(a, b, c));
create table B (a int, b int, c int, foreign key(a, b) references A(a, b));
alter table A add primary key(a, b);
alter table A drop index idx1;
ERROR HY000: Cannot drop index 'idx1': needed in a foreign key constraint
alter table A drop primary key;
ERROR HY000: unique/primary keys in table referenced by enabled foreign keys
drop table if exists A, B;
create table A (a int, b int, c int, index idx1(a, b, c));
create table B (a int, b int, c int, foreign key(a, b) references A(a, b));
alter table A rename column a to d;
alter table A rename column b to e;
alter table A rename column c to f;
alter table B rename column a to d;
alter table B rename column b to e;
alter table B rename column c to f;
drop table if exists A, B;
create table A (a int, b int, index idx_b(b));
create table B (a int, b int, foreign key(b) references A(b));
alter table A modify b double;
ERROR HY000: 'b': used in a foreign key constraint
alter table A modify b int unsigned;
ERROR HY000: 'b': used in a foreign key constraint
alter table B modify b double;
ERROR HY000: 'b': used in a foreign key constraint
alter table B modify b int unsigned;
ERROR HY000: 'b': used in a foreign key constraint
drop table if exists A, B;
create table A (a int, b int, primary key(a));
create table B (a int, b int, foreign key(b) references A(a));
alter table A modify a double;
ERROR HY000: 'a': used in a foreign key constraint
alter table A modify a int unsigned;
ERROR HY000: 'a': used in a foreign key constraint
alter table B modify b double;
ERROR HY000: 'b': used in a foreign key constraint
alter table B modify b int unsigned;
ERROR HY000: 'b': used in a foreign key constraint
drop table if exists A, B;
create table A (a int, b int, c int, primary key(a, b, c));
create table B (a int, b int, c int);
insert into A values(1,1,1), (2,2,2), (3,3,3), (4,4,4), (5,5,5), (6,6,6), (7,7,7), (8,8,8), (9,9,9), (10,10,10);
insert into B values(1,1,1), (2,2,2), (3,3,3), (4,4,4), (5,5,5), (6,6,6), (7,7,7), (8,8,8), (9,9,9), (10,10,10);
alter table B add foreign key(a) references A(a) on update cascade on delete cascade;
alter table B add foreign key(a, b) references A(a, b) on update cascade on delete cascade;
alter table B add foreign key(a, b, c) references A(a, b, c) on update cascade on delete cascade;
alter table A partition by range (a) (partition p0 values less than (5), partition p1 values less than (20));
select * from A order by a;
a	b	c
1	1	1
2	2	2
3	3	3
4	4	4
5	5	5
6	6	6
7	7	7
8	8	8
9	9	9
10	10	10
select * from A order by b;
a	b	c
1	1	1
2	2	2
3	3	3
4	4	4
5	5	5
6	6	6
7	7	7
8	8	8
9	9	9
10	10	10
alter table A partition by list (a) (partition p0 values in (1,2,3,4), partition p1 values in (5,6,7,8,9,10));
select * from A order by a;
a	b	c
1	1	1
2	2	2
3	3	3
4	4	4
5	5	5
6	6	6
7	7	7
8	8	8
9	9	9
10	10	10
select * from A order by b;
a	b	c
1	1	1
2	2	2
3	3	3
4	4	4
5	5	5
6	6	6
7	7	7
8	8	8
9	9	9
10	10	10
alter table A partition by hash (a) partitions 5;
select * from A order by a;
a	b	c
1	1	1
2	2	2
3	3	3
4	4	4
5	5	5
6	6	6
7	7	7
8	8	8
9	9	9
10	10	10
select * from A order by b;
a	b	c
1	1	1
2	2	2
3	3	3
4	4	4
5	5	5
6	6	6
7	7	7
8	8	8
9	9	9
10	10	10
alter table A partition by key (a) partitions 5;
update A set a = 11 where a = 1;
update A set b = 11 where b = 1;
select * from A order by a;
a	b	c
2	2	2
3	3	3
4	4	4
5	5	5
6	6	6
7	7	7
8	8	8
9	9	9
10	10	10
11	11	1
select * from A order by b;
a	b	c
2	2	2
3	3	3
4	4	4
5	5	5
6	6	6
7	7	7
8	8	8
9	9	9
10	10	10
11	11	1
alter table A partition by range (b) (partition p0 values less than (5), partition p1 values less than (20));
select * from A order by a;
a	b	c
2	2	2
3	3	3
4	4	4
5	5	5
6	6	6
7	7	7
8	8	8
9	9	9
10	10	10
11	11	1
select * from A order by b;
a	b	c
2	2	2
3	3	3
4	4	4
5	5	5
6	6	6
7	7	7
8	8	8
9	9	9
10	10	10
11	11	1
alter table A partition by list (b) (partition p0 values in (1,2,3,4), partition p1 values in (5,6,7,8,9,10,11,12,13));
select * from A order by a;
a	b	c
2	2	2
3	3	3
4	4	4
5	5	5
6	6	6
7	7	7
8	8	8
9	9	9
10	10	10
11	11	1
select * from A order by b;
a	b	c
2	2	2
3	3	3
4	4	4
5	5	5
6	6	6
7	7	7
8	8	8
9	9	9
10	10	10
11	11	1
alter table A partition by hash (b) partitions 5;
select * from A order by a;
a	b	c
2	2	2
3	3	3
4	4	4
5	5	5
6	6	6
7	7	7
8	8	8
9	9	9
10	10	10
11	11	1
select * from A order by b;
a	b	c
2	2	2
3	3	3
4	4	4
5	5	5
6	6	6
7	7	7
8	8	8
9	9	9
10	10	10
11	11	1
alter table A partition by key (b) partitions 5;
update A set a = 12 where a = 2;
update A set b = 12 where b = 2;
select * from A order by a;
a	b	c
3	3	3
4	4	4
5	5	5
6	6	6
7	7	7
8	8	8
9	9	9
10	10	10
11	11	1
12	12	2
select * from A order by b;
a	b	c
3	3	3
4	4	4
5	5	5
6	6	6
7	7	7
8	8	8
9	9	9
10	10	10
11	11	1
12	12	2
alter table A partition by range (c) (partition p0 values less than (5), partition p1 values less than (20));
select * from A order by a;
a	b	c
3	3	3
4	4	4
5	5	5
6	6	6
7	7	7
8	8	8
9	9	9
10	10	10
11	11	1
12	12	2
select * from A order by b;
a	b	c
3	3	3
4	4	4
5	5	5
6	6	6
7	7	7
8	8	8
9	9	9
10	10	10
11	11	1
12	12	2
alter table A partition by list (c) (partition p0 values in (1,2,3,4), partition p1 values in (5,6,7,8,9,10,11,12,13));
select * from A order by a;
a	b	c
3	3	3
4	4	4
5	5	5
6	6	6
7	7	7
8	8	8
9	9	9
10	10	10
11	11	1
12	12	2
select * from A order by b;
a	b	c
3	3	3
4	4	4
5	5	5
6	6	6
7	7	7
8	8	8
9	9	9
10	10	10
11	11	1
12	12	2
alter table A partition by hash (c) partitions 5;
select * from A order by a;
a	b	c
3	3	3
4	4	4
5	5	5
6	6	6
7	7	7
8	8	8
9	9	9
10	10	10
11	11	1
12	12	2
select * from A order by b;
a	b	c
3	3	3
4	4	4
5	5	5
6	6	6
7	7	7
8	8	8
9	9	9
10	10	10
11	11	1
12	12	2
alter table A partition by key (c) partitions 5;
update A set a = 13 where a = 3;
update A set b = 13 where b = 3;
select * from A order by a;
a	b	c
4	4	4
5	5	5
6	6	6
7	7	7
8	8	8
9	9	9
10	10	10
11	11	1
12	12	2
13	13	3
select * from A order by b;
a	b	c
4	4	4
5	5	5
6	6	6
7	7	7
8	8	8
9	9	9
10	10	10
11	11	1
12	12	2
13	13	3
drop table if exists A, B;
create table A (c1 string primary key, c2 string, index idx2(c2));
create table B (c1 string, foreign key (c1) references A(c2) on update cascade on delete cascade);
insert into A values ("pk", "xxx");
insert into B values ("xxx");
insert into B values ("xxx");
select * from A order by c1;
c1	c2
pk	xxx
select * from B order by c1;
c1
xxx
xxx
insert into B values ("error");
ERROR 23000: Cannot add or update a child row: a foreign key constraint fails
update B set c1 = "error" where c1 = "xxx";
ERROR 23000: Cannot add or update a child row: a foreign key constraint fails
insert into A values("pk", "insert up stmt") on duplicate key update c2 = values(c2);
select * from A order by c1;
c1	c2
pk	insert up stmt
select * from B order by c1;
c1
insert up stmt
insert up stmt
replace into A values("pk", "replace stmt");
select * from A order by c1;
c1	c2
pk	replace stmt
select * from B order by c1;
c1
insert into B values ("replace stmt");
select * from B order by c1;
c1
replace stmt
drop table if exists A, B;
create table A (c1 string, c2 string, c3 int, primary key(c1, c2));
create table B (c1 string, foreign key (c1) references A(c1) on update cascade on delete cascade);
insert into A values ("pk", "xxx", 0);
insert into B values ("pk");
insert into B values ("pk");
select * from A order by c1;
c1	c2	c3
pk	xxx	0
select * from B order by c1;
c1
pk
pk
insert into B values ("error");
ERROR 23000: Cannot add or update a child row: a foreign key constraint fails
update B set c1 = "error" where c1 = "pk";
ERROR 23000: Cannot add or update a child row: a foreign key constraint fails
insert into A values("pk", "xxx", 1) on duplicate key update c3 = values(c3);
select * from A order by c1;
c1	c2	c3
pk	xxx	1
select * from B order by c1;
c1
pk
pk
replace into A values("pk", "xxx", 2);
select * from A order by c1;
c1	c2	c3
pk	xxx	2
select * from B order by c1;
c1
insert into B values ("pk");
select * from B order by c1;
c1
pk
drop table if exists A, B, C;
set @@session.recyclebin = off;
alter system set _enable_parallel_table_creation = 'True';
