drop table if exists t3;
drop table if exists t2;
drop table if exists t1;
create table t1(c1 int primary key, c2 int, foreign key(c2) references t1(c1));
insert into t1 values (1,1),(2,1),(3,1),(4,2);
select * from t1;
c1	c2
1	1
2	1
3	1
4	2
drop table t1;
create table t1 (c1 int primary key, c2 int);
create table t2 (c1 int primary key, c2 int, foreign key (c2) references t1(c1));
insert into t1 values (1,1), (2,2), (3,3);
insert into t2 values (2,2);
create trigger ins_trig2 after insert on t2 for each row 
insert into t1 values (new.c1 + 1,new.c2 +1);
select * from t1;
c1	c2
1	1
2	2
3	3
select * from t2;
c1	c2
2	2
insert into t2 values (3,3),(4,4);
select * from t1;
c1	c2
1	1
2	2
3	3
4	4
5	5
select * from t2;
c1	c2
2	2
3	3
4	4
drop table t2;
drop table t1;
create table t1 (c1 int primary key, c2 int);
create table t2 (c1 int primary key, c2 int, foreign key (c2) references t1(c1));
create trigger ins_trig2 after insert on t1 for each row 
insert into t2 values (new.c1, new.c2);
insert into t1 values (1,1),(2,2),(3,3);
select * from t1;
c1	c2
1	1
2	2
3	3
select * from t2;
c1	c2
1	1
2	2
3	3
drop table t2;
drop table t1;
create table t1 (c1 int primary key, c2 int, foreign key(c2) references t1(c1));
insert into t1 values (1,1),(2,1),(3,1);
delete from t1 where c1 = 3;
select * from t1;
c1	c2
1	1
2	1
delete from t1 where c1 = 1;
ERROR 23000: Cannot delete or update a parent row: a foreign key constraint fails
delete from t1 where c1 = 2;
select * from t1;
c1	c2
1	1
delete from t1 where c1 = 1;
select * from t1;
c1	c2
drop table t1;
create table t1 (c1 int primary key, c2 int, foreign key(c2) references t1(c1) on delete cascade);
insert into t1 values (1,1),(2,1),(3,1);
select * from t1;
c1	c2
1	1
2	1
3	1
delete from t1 where c2 = 1;
select * from t1;
c1	c2
drop table t1;
create table t1 (c1 int primary key, c2 int);
create table t2 (c1 int primary key, c2 int, foreign key (c2) references t1(c1));
insert into t1 values (1,1),(2,2),(3,3);
insert into t2 values (2,2),(3,3);
select * from t1;
c1	c2
1	1
2	2
3	3
select * from t2;
c1	c2
2	2
3	3
create trigger del_trig after delete on t1 for each row 
delete from t2 where c2 = old.c1;
delete from t1 where c1 = 1;
select * from t1;
c1	c2
2	2
3	3
select * from t2;
c1	c2
2	2
3	3
delete from t1 where c1 = 2;
ERROR 23000: Cannot delete or update a parent row: a foreign key constraint fails
select * from t1;
c1	c2
2	2
3	3
select * from t2;
c1	c2
2	2
3	3
drop table t2;
drop table t1;
create table t1 (c1 int primary key, c2 int);
create table t2 (c1 int primary key, c2 int, foreign key (c2) references t1(c1));
insert into t1 values (1,1),(2,2),(3,3);
insert into t2 values (2,2),(3,3);
select * from t1;
c1	c2
1	1
2	2
3	3
select * from t2;
c1	c2
2	2
3	3
create trigger del_trig after delete on t1 for each row 
delete from t2 where c2 = old.c1 + 1;
delete from t1 where c1 = 1;
select * from t1;
c1	c2
2	2
3	3
select * from t2;
c1	c2
3	3
delete from t1 where c1 = 2;
select * from t1;
c1	c2
3	3
select * from t2;
c1	c2
drop table t2;
drop table t1;
create table t1 (c1 int primary key, c2 int);
create table t2 (c1 int primary key, c2 int, foreign key (c2) references t1(c1));
insert into t1 values (1,1),(2,2),(3,3);
insert into t2 values (2,2),(3,3);
delete from t1,t2 using t1,t2 where t1.c1 = t2.c2;
select * from t1;
c1	c2
1	1
select * from t2;
c1	c2
drop table t2;
drop table t1;
create table t1 (c1 int primary key, c2 int);
create table t2 (c1 int primary key, c2 int, foreign key (c2) references t1(c1) on delete cascade);
insert into t1 values (1,1),(2,2),(3,3);
insert into t2 values (1,1),(2,1),(3,2);
delete from t1,t2 using t1,t2 where t1.c1 = t2.c2 and t1.c1 = 1;
select * from t1;
c1	c2
2	2
3	3
select * from t2;
c1	c2
3	2
drop table t2;
drop table t1;
create table t1(c1 int primary key, c2 int, foreign key(c2) references t1(c1) on delete cascade on update cascade);
insert into t1 values (1,1),(2,1),(3,1),(4,3);
select * from t1;
c1	c2
1	1
2	1
3	1
4	3
update t1 set c1 = 10, c2 = 4 where c1 = 11;
select * from t1;
c1	c2
1	1
2	1
3	1
4	3
drop table t1;
create table t1 (c1 int primary key, c2 int, foreign key (c2) references t1(c1) on update cascade on delete cascade);
insert into t1 values (1,1),(2,2),(3,3);
update t1 set c1 = 4, c2 = 4 where c1 = 1;
select * from t1;
c1	c2
2	2
3	3
4	4
update t1 set c1 = 5,c2 = 2 where c1 = 3;
select * from t1;
c1	c2
2	2
4	4
5	2
delete from t1;
select * from t1;
c1	c2
insert into t1 values (1,1),(3,3),(5,5);
update t1 set c1 = c1 + 1;
ERROR 23000: Cannot delete or update a parent row: a foreign key constraint fails
select * from t1;
c1	c2
1	1
3	3
5	5
update t1 set c1 = c1 + 1, c2 = c2 + 1;
select * from t1;
c1	c2
2	2
4	4
6	6
drop table t1;
create table t1 (c1 int primary key, c2 int, foreign key (c2) references t1(c1));
insert into t1 values (1,1),(2,2),(3,3);
select * from t1;
c1	c2
1	1
2	2
3	3
update t1 set c1 = 4, c2 = 4 where c1 = 1;
select * from t1;
c1	c2
2	2
3	3
4	4
drop table t1;
create table t1 (c1 int primary key, c2 int);
create table t2 (c1 int primary key, c2 int, foreign key(c2) references t1(c1) on update cascade);
insert into t1 values (1,1),(2,2),(3,3);
insert into t2 values (1,1), (2,2);
select * from t1;
c1	c2
1	1
2	2
3	3
select * from t2;
c1	c2
1	1
2	2
create trigger upd_trig after update on t1 for each row update t2 set t2.c2 = new.c1 where t2.c2 = old.c1;
update t1 set c1 = 4 where c1 = 1;
select * from t1;
c1	c2
2	2
3	3
4	1
select * from t2;
c1	c2
1	4
2	2
drop table t2;
drop table t1;
create table t1 (c1 int primary key, c2 int);
create table t2 (c1 int primary key, c2 int, foreign key(c2) references t1(c1) on update cascade);
insert into t1 values (1,1),(2,2),(3,3);
insert into t2 values (1,1), (2,2);
select * from t1;
c1	c2
1	1
2	2
3	3
select * from t2;
c1	c2
1	1
2	2
create trigger upd_trig after update on t1 for each row delete from t2 where t2.c2 = old.c1;
update t1 set c1 = 4 where c1 = 1;
select * from t1;
c1	c2
2	2
3	3
4	1
select * from t2;
c1	c2
1	4
2	2
drop table t2;
drop table t1;
create table t1 (c1 int primary key, c2 int);
create table t2 (c1 int primary key, c2 int, foreign key(c2) references t1(c1) on update cascade);
insert into t1 values (1,1),(2,2),(3,3);
insert into t2 values (1,1), (2,2);
select * from t1;
c1	c2
1	1
2	2
3	3
select * from t2;
c1	c2
1	1
2	2
create trigger upd_trig after update on t1 for each row delete from t2 where t2.c2 = new.c1;
update t1 set c1 = 4 where c1 = 1;
select * from t1;
c1	c2
2	2
3	3
4	1
select * from t2;
c1	c2
2	2
drop table t2;
drop table t1;
create table t1 (c1 int primary key, c2 int, foreign key(c2) references t1(c1) on delete cascade);
insert into t1 values (1,1),(2,2),(3,3);
select * from t1;
c1	c2
1	1
2	2
3	3
replace into t1 values (4,1),(1,2);
select * from t1;
c1	c2
1	2
2	2
3	3
delete from t1;
select * from t1;
c1	c2
drop table t1;
create table t1 (c1 int primary key, c2 int, foreign key(c2) references t1(c1) on delete cascade);
insert into t1 values (1,1),(2,1),(3,1);
replace into t1 values (4,4);
select * from t1;
c1	c2
1	1
2	1
3	1
4	4
replace into t1 values (1,1);
select * from t1;
c1	c2
1	1
4	4
drop table t1;
create table t1 (c1 int primary key, c2 int);
create table t2 (c1 int primary key, c2 int, foreign key (c2) references t1(c1) on delete cascade);
insert into t1 values (1,1),(2,2);
insert into t2 values (1,1),(2,1),(3,1),(4,2);
select * from t1;
c1	c2
1	1
2	2
select * from t2;
c1	c2
1	1
2	1
3	1
4	2
create trigger del_trig after delete on t1 for each row delete from t2 where t2.c2 = old.c1;
replace into t1 values (1,1),(2,1);
select * from t1;
c1	c2
1	1
2	1
select * from t2;
c1	c2
drop table t2;
drop table t1;
create table t1 (c1 int primary key, c2 int);
create table t2 (c1 int primary key, c2 int, foreign key (c2) references t1(c1));
insert into t1 values (1,1),(2,2);
insert into t2 values (1,1),(2,1),(3,1),(4,2);
select * from t1;
c1	c2
1	1
2	2
select * from t2;
c1	c2
1	1
2	1
3	1
4	2
replace into t1 values (1,1),(2,1);
ERROR 23000: Cannot delete or update a parent row: a foreign key constraint fails
select * from t1;
c1	c2
1	1
2	2
select * from t2;
c1	c2
1	1
2	1
3	1
4	2
drop table t2;
drop table t1;
create table t1 (c1 int primary key, c2 int);
create table t2 (c1 int primary key, c2 int, foreign key (c2) references t1(c1));
insert into t1 values (1,1),(2,2);
insert into t2 values (3,2), (4,2);
select * from t1;
c1	c2
1	1
2	2
select * from t2;
c1	c2
3	2
4	2
create trigger del_trig after delete on t1 for each row delete from t2 where t2.c2 = old.c1 + 1;
replace into t1 values (1,1),(2,1);
select * from t1;
c1	c2
1	1
2	1
select * from t2;
c1	c2
drop table t2;
drop table t1;
create table t1(c1 int primary key);
create table t2(c1 int primary key, c2 int, foreign key(c2) references t1(c1));
create index idx on t2(c2);
insert into t1 values(1);
insert into t2 values(1, 1);
insert into t2 values(1, 2) on duplicate key update c2 = 1;
select * from t1;
c1
1
select * from t2;
c1	c2
1	1
drop table t2;
drop table t1;
create table t1 (c1 int primary key, c2 int, foreign key (c2) references t1(c1));
insert into t1 values (1,1),(2,2);
select * from t1;
c1	c2
1	1
2	2
insert into t1 values (2,2) on duplicate key update c1 = c1 + 1;
ERROR 23000: Cannot delete or update a parent row: a foreign key constraint fails
select * from t1;
c1	c2
1	1
2	2
insert into t1 values (2,3) on duplicate key update c1 = c1 + 1, c2 = c2 + 1;
select * from t1;
c1	c2
1	1
3	3
drop table t1;
create table t1 (c1 int primary key, c2 int);
create table t2 (c1 int primary key, c2 int, foreign key (c2) references t1(c1) on update cascade);
insert into t1 values (1,1),(2,2);
insert into t2 values (1,1),(2,1),(3,2);
select * from t1;
c1	c2
1	1
2	2
select * from t2;
c1	c2
1	1
2	1
3	2
create trigger upd_trig after update on t1 for each row update t2 set t2.c2 = new.c1 where t2.c2 = old.c1;
insert into t1 values (2,2) on duplicate key update c1 = c1 + 1;
select * from t1;
c1	c2
1	1
3	2
select * from t2;
c1	c2
1	1
2	1
3	3
drop table t2;
drop table t1;
create table t1 (c1 int primary key, c2 int);
create table t2 (c1 int primary key, c2 int, foreign key (c2) references t1(c1));
insert into t1 values (1,1),(2,2);
insert into t2 values (3,2),(4,2);
select * from t1;
c1	c2
1	1
2	2
select * from t2;
c1	c2
3	2
4	2
create trigger upd_trig after update on t1 for each row update t2 set t2.c2 = new.c1 where t2.c2 = old.c1;
insert into t1 values (1,1), (2,2) on duplicate key update c1 = c1 + 2;
ERROR 23000: Cannot delete or update a parent row: a foreign key constraint fails
select * from t1;
c1	c2
1	1
2	2
select * from t2;
c1	c2
3	2
4	2
drop trigger upd_trig;
create trigger upd_trig after update on t1 for each row update t2 set t2.c2 = new.c1 where t2.c2 = old.c1 + 1;
insert into t1 values (1,1), (2,2) on duplicate key update c1 = c1 + 2;
select * from t1;
c1	c2
3	1
4	2
select * from t2;
c1	c2
3	4
4	4
drop table t2;
drop table t1;
create table t1 (c1 int, c2 int);
create table t2 (c1 int, c2 int);
create trigger upd_trig after update on t1 for each row SELECT MAX(c1) FROM t2  INTO @var;
insert into t1 values (1,1),(2,2),(3,3),(4,4),(5,5),(6,6),(7,7),(8,8);
insert into t2 values (1,1),(2,2),(3,3),(4,4),(5,5),(6,6),(7,7),(8,8);
update t1 set c2 = 1 where c2 < 4 order by c2 asc limit 1;
select * from t1;
c1	c2
1	1
2	2
3	3
4	4
5	5
6	6
7	7
8	8
update t1 set c2 = 1  where c2 < 4 order by c2 asc;
select * from t1;
c1	c2
1	1
2	1
3	1
4	4
5	5
6	6
7	7
8	8
drop table t1;
drop table t2;
create table t1 (c1 int primary key, c2 int, foreign key(c2) references t1(c1) on delete cascade);
create table t2 (c1 int primary key, c2 int, foreign key(c2) references t2(c1) on delete cascade);
create table t3 (c1 int primary key, c2 int, foreign key(c2) references t2(c1) on delete cascade);
insert into t1 values (1,1),(2,2),(3,3),(4,4);
insert into t2 values (1,1),(2,2),(3,3),(4,4);
insert into t3 values (1,1),(2,2),(3,3),(4,4);
delete from t1,t2 using t1,t2 where t1.c1 = t2.c2 and t1.c1 < 4;
select * from t1;
c1	c2
4	4
select * from t2;
c1	c2
4	4
select * from t3;
c1	c2
4	4
drop table t3;
drop table t2;
drop table t1;
create table t1 (c1 int primary key, c2 int, foreign key(c2) references t1(c1) on delete cascade);
create table t2 (c1 int primary key, c2 int);
create table t3 (c1 int primary key, c2 int);
create trigger del_trig after delete on t2 for each row insert into t3 values (old.c1, old.c2);
insert into t1 values (1,1),(2,2),(3,3),(4,4);
insert into t2 values (1,1),(2,2),(3,3),(4,4);
delete from t1,t2 using t1,t2 where t1.c1 = t2.c2 and t1.c1 < 4;
select * from t1;
c1	c2
4	4
select * from t2;
c1	c2
4	4
select * from t3;
c1	c2
1	1
2	2
3	3
drop table t3;
drop table t2;
drop table t1;
create table t1 (c1 int primary key, c2 int) partition by hash(c1) partitions 4;
create table t2 (c1 int primary key,c2 int, foreign key(c2) references t1(c1));
insert into t1 values (1,1),(2,2),(3,3);
insert into t2 values (1,1),(2,2),(3,3);
select * from t2;
c1	c2
1	1
2	2
3	3
replace into t2 values (1,1),(2,2),(4,4);
ERROR 23000: Cannot add or update a child row: a foreign key constraint fails
replace into t2 values (1,1),(2,2);
select * from t2;
c1	c2
1	1
2	2
3	3
insert into t2 values (1,1), (2,2) on duplicate key update c2 = c1 + 2;
ERROR 23000: Cannot add or update a child row: a foreign key constraint fails
insert into t2 values (1,1), (2,2) on duplicate key update c2 = 2;
select * from t2;
c1	c2
1	2
2	2
3	3
drop table t2;
drop table t1;
