drop table if exists t3;
drop table if exists t2;
drop table if exists t1;
create table t1 (c1 int primary key, c2 int);
create table t2 (c1 int primary key, c2 int, foreign key(c2) references t1(c1) on delete set null on update set null);
insert into t1 values (1,1),(2,2);
insert into t2 values (1,1),(2,2);
delete from t1 where c1 = 1;
select * from t1;
c1	c2
2	2
select * from t2;
c1	c2
1	NULL
2	2
update t1 set c1 = 3 where c1 = 2;
select * from t1;
c1	c2
3	2
select * from t2;
c1	c2
1	NULL
2	NULL
drop table t2;
drop table t1;
create table t1 (c1 int, c2 int, c3 int, primary key(c1, c2));
create table t2 (c1 int, c2 int, c3 int, foreign key(c1, c2) references t1(c1, c2) on delete set null on update set null);
insert into t1 values (1,1,1),(2,2,2),(3,3,3);
insert into t2 values (1,1,1),(2,2,2),(3,3,3);
delete from t1 where c1 = 1;
select * from t1;
c1	c2	c3
2	2	2
3	3	3
select * from t2;
c1	c2	c3
NULL	NULL	1
2	2	2
3	3	3
update t1 set c1 = c1 + 2;
select * from t1;
c1	c2	c3
4	2	2
5	3	3
select * from t2;
c1	c2	c3
NULL	NULL	1
NULL	NULL	2
NULL	NULL	3
drop table t2;
drop table t1;
create table t1 (c1 int, c2 int, c3 int, unique key(c1, c2));
create table t2 (c1 int, c2 int, c3 int, foreign key(c1, c2) references t1(c1,c2) on delete set null on update set null);
insert into t1 values (1,null,1),(2,2,2),(3,3,3);
insert into t2 values (1,null,1),(2,null,2),(3,3,3);
delete from t1 where c1 = 1;
select * from t1;
c1	c2	c3
2	2	2
3	3	3
select * from t2;
c1	c2	c3
1	NULL	1
2	NULL	2
3	3	3
update t1 set c1 = c1 + 2;
select * from t1;
c1	c2	c3
4	2	2
5	3	3
select * from t2;
c1	c2	c3
1	NULL	1
2	NULL	2
NULL	NULL	3
drop table t2;
drop table t1;
create table t1 (c1 varchar(20) primary key, c2 varchar(20));
create table t2 (c1 varchar(20) primary key, c2 varchar(20), foreign key(c2) references t1(c1) on delete set null on update set null);
insert into t1 values ('leo', 'leo'), ('rony', 'rony'), ('benzema', 'benzema');
insert into t2 values ('leo', 'leo'), ('rony', 'rony'), ('benzema', 'benzema');
delete from t1 where c1 = 'leo';
select * from t1;
c1	c2
benzema	benzema
rony	rony
select * from t2;
c1	c2
benzema	benzema
leo	NULL
rony	rony
update t1 set c1 = 'ronaldo' where c1 = 'rony';
select * from t1;
c1	c2
benzema	benzema
ronaldo	rony
select * from t2;
c1	c2
benzema	benzema
leo	NULL
rony	NULL
drop table t2;
drop table t1;
create table t1 (c1 varchar(20) unique key, c2 varchar(20));
create table t2 (c1 varchar(20), c2 varchar(20), foreign key(c2) references t1(c1) on delete set null on update set null);
insert into t1 values (null, 'leo'), ('rony', 'rony'), ('benzema', 'benzema');
insert into t2 values ('leo', null), ('rony', 'rony'), ('benzema', 'benzema');
delete from t1 where c2 = 'leo';
select * from t1;
c1	c2
rony	rony
benzema	benzema
select * from t2;
c1	c2
leo	NULL
rony	rony
benzema	benzema
update t1 set c1 = 'ronaldo' where c1 = 'rony';
select * from t1;
c1	c2
ronaldo	rony
benzema	benzema
select * from t2;
c1	c2
leo	NULL
rony	NULL
benzema	benzema
drop table t2;
drop table t1;
create table t1 (c1 int primary key, c2 int);
create table t2 (c1 int primary key, c2 int not null, foreign key(c2) references t1(c1) on delete set null on update set null);
ERROR HY000: Column 'c2' cannot be NOT NULL: needed in a foreign key constraint 't2_OBFK_1234' SET NULL
create table t2 (c1 int primary key, c2 int generated always as (c1 + 1) stored, foreign key(c2) references t1(c1) on delete set null on update set null);
ERROR HY000:  Cannot define foreign key with ON DELETE SET NULL clause on a generated column
create table t2 (c1 int primary key, c2 int generated always as (c1 + 1) virtual, foreign key(c2) references t1(c1) on delete set null on update set null);
ERROR HY000:  Cannot define foreign key with ON DELETE SET NULL clause on a generated column
create table t2 (c1 int primary key, c2 int, c3 int generated always as (c2 + 1) stored, foreign key(c2) references t1(c1) on delete set null on update set null);
ERROR HY000: Cannot add foreign key constraint
create table t2 (c1 int primary key, c2 int, c3 int generated always as (c2 + 1) virtual, foreign key(c2) references t1(c1) on delete set null on update set null);
insert into t1 values (1,1),(2,2),(3,3);
insert into t2(c1,c2) values (1,1),(2,2),(3,3);
delete from t1 where c1 = 1;
select * from t1;
c1	c2
2	2
3	3
select * from t2;
c1	c2	c3
1	NULL	NULL
2	2	3
3	3	4
update t1 set c1 = c1 + 2;
select * from t1;
c1	c2
4	2
5	3
select * from t2;
c1	c2	c3
1	NULL	NULL
2	NULL	NULL
3	NULL	NULL
drop table t2;
drop table t1;
create table t1(c1 int primary key, c2 int);
create table t2 (c1 int unique key, c2 int, foreign key(c1) references t1(c1) on delete set null on update set null);
create table t3 (c1 int unique key, c2 int, foreign key(c1) references t2(c1) on delete set null on update set null);
insert into t1 values (1,1),(2,2),(3,3);
insert into t2 values (1,1),(2,2),(3,3);
insert into t3 values (1,1),(2,2),(3,3);
delete from t1 where c1 = 1;
select * from t1;
c1	c2
2	2
3	3
select * from t2;
c1	c2
NULL	1
2	2
3	3
select * from t3;
c1	c2
NULL	1
2	2
3	3
update t1 set c1 = c1 + 2;
select * from t1;
c1	c2
4	2
5	3
select * from t2;
c1	c2
NULL	1
NULL	2
NULL	3
select * from t3;
c1	c2
NULL	1
NULL	2
NULL	3
delete from t1;
select * from t1;
c1	c2
select * from t2;
c1	c2
NULL	1
NULL	2
NULL	3
select * from t3;
c1	c2
NULL	1
NULL	2
NULL	3
drop table t3;
drop table t2;
drop table t1;
create table t1 (c1 int primary key, c2 int);
create table t2 (c1 int primary key, c2 int not null);
alter table t2 add constraint fk_cst foreign key(c2) references t1(c1) on delete set null on update set null;
ERROR HY000: Column 'c2' cannot be NOT NULL: needed in a foreign key constraint 'fk_cst' SET NULL
drop table t2;
create table t2 (c1 int primary key, c2 int, foreign key(c2) references t1(c1) on delete set null on update set null);
alter table t2 modify c2 int not null;
drop table t2;
create table t2 (c1 int primary key, c2 int generated always as (c1 + 1) stored);
alter table t2 add constraint fk_cst foreign key(c2) references t1(c1) on delete set null on update set null;
ERROR HY000:  Cannot define foreign key with ON DELETE SET NULL clause on a generated column
drop table t2;
create table t2 (c1 int primary key, c2 int generated always as (c1 + 1) virtual);
alter table t2 add constraint fk_cst foreign key(c2) references t1(c1) on delete set null on update set null;
ERROR HY000:  Cannot define foreign key with ON DELETE SET NULL clause on a generated column
drop table t2;
create table t2(c1 int primary key, c2 int, foreign key(c2) references t1(c1) on delete set null on update set null);
alter table t2 modify column c2 int generated always as (c1 + 1) stored;
ERROR HY000: 'Changing the STORED status' is not supported for generated columns.
drop table t2;
create table t2(c1 int primary key, c2 int, foreign key(c2) references t1(c1) on delete set null on update set null);
alter table t2 modify column c2 int generated always as (c1 + 1) virtual;
ERROR HY000: 'Changing the STORED status' is not supported for generated columns.
drop table t2;
create table t2 (c1 int primary key, c2 int, c3 int generated always as (c2 + 1) stored);
alter table t2 add constraint fk_cst foreign key(c2) references t1(c1) on delete set null on update set null;
ERROR HY000: Cannot add foreign key constraint
drop table t2;
create table t2(c1 int primary key, c2 int, foreign key(c2) references t1(c1) on delete set null on update set null);
alter table t2 add column c3 int generated always as (c2 + 1) stored;
