drop table if exists t1, t2;
create table t1(c1 float primary key);
create table t2(c1 float unsigned, foreign key(c1) references t1(c1));
insert into t1 values(2), (-2), (3);
insert into t2 values(2), (2), (3);
insert into t2 values(-1);
ERROR 22003: Out of range value for column 'c1' at row 1
select * from t1;
c1
-2
2
3
select * from t2;
c1
2
2
3
drop table t1, t2;
create table t1(c1 double primary key);
create table t2(c1 double unsigned, foreign key(c1) references t1(c1));
insert into t1 values(2), (-2), (3);
insert into t2 values(2), (2), (3);
insert into t2 values(-1);
ERROR 22003: Out of range value for column 'c1' at row 1
select * from t1;
c1
-2
2
3
select * from t2;
c1
2
2
3
drop table t1, t2;
create table t1(c1 float unsigned primary key);
create table t2(c1 float, foreign key(c1) references t1(c1));
insert into t1 values(-1);
ERROR 22003: Out of range value for column 'c1' at row 1
insert into t1 values(2), (3);
insert into t2 values(2), (2), (3);
insert into t2 values(-2);
ERROR 23000: Cannot add or update a child row: a foreign key constraint fails
select * from t1;
c1
2
3
select * from t2;
c1
2
2
3
drop table t1, t2;
create table t1(c1 double unsigned primary key);
create table t2(c1 double, foreign key(c1) references t1(c1));
insert into t1 values(-1);
ERROR 22003: Out of range value for column 'c1' at row 1
insert into t1 values(2), (3);
insert into t2 values(2), (2), (3);
insert into t2 values(-1);
ERROR 23000: Cannot add or update a child row: a foreign key constraint fails
select * from t1;
c1
2
3
select * from t2;
c1
2
2
3
drop table t1, t2;
create table t1(c1 float primary key);
create table t2(c1 float unsigned, foreign key(c1) references t1(c1) on update cascade on delete cascade);
insert into t1 values(2), (-2), (3);
insert into t2 values(2), (2), (3);
update t1 set t1.c1 = -5 where t1.c1 = 2;
ERROR 22003: Out of range value for column 'c1' at row 1
update t1 set t1.c1 = 1 where t1.c1 = 2;
select * from t1;
c1
-2
1
3
select * from t2;
c1
1
1
3
delete from t1 where t1.c1 = -2;
delete from t1 where t1.c1 = 1;
select * from t1;
c1
3
select * from t2;
c1
3
drop table t1, t2;
create table t1(c1 double primary key);
create table t2(c1 double unsigned, foreign key(c1) references t1(c1) on update cascade on delete cascade);
insert into t1 values(2), (-2), (3);
insert into t2 values(2), (2), (3);
update t1 set t1.c1 = -5 where t1.c1 = 2;
ERROR 22003: Out of range value for column 'c1' at row 1
update t1 set t1.c1 = 1 where t1.c1 = 2;
select * from t1;
c1
-2
1
3
select * from t2;
c1
1
1
3
delete from t1 where t1.c1 = -2;
delete from t1 where t1.c1 = 1;
select * from t1;
c1
3
select * from t2;
c1
3
drop table t1, t2;
create table t1(c1 float primary key);
create table t2(c1 float, foreign key(c1) references t1(c1));
alter table t1 modify column c1 float unsigned;
ERROR HY000: 'c1': used in a foreign key constraint
drop table t1, t2;
create table t1(c1 double primary key);
create table t2(c1 double, foreign key(c1) references t1(c1));
alter table t1 modify column c1 double unsigned;
ERROR HY000: 'c1': used in a foreign key constraint
drop table t1, t2;
create table t1(c1 float primary key);
create table t2(c1 double, foreign key(c1) references t1(c1));
ERROR HY000: Cannot add foreign key constraint
create table t2(c1 double unsigned, foreign key(c1) references t1(c1));
ERROR HY000: Cannot add foreign key constraint
drop table t1;
create table t1(c1 double primary key);
create table t2(c1 float, foreign key(c1) references t1(c1));
ERROR HY000: Cannot add foreign key constraint
create table t2(c1 float unsigned, foreign key(c1) references t1(c1));
ERROR HY000: Cannot add foreign key constraint
drop table t1;
