set ob_trx_timeout = 10000000000;
set ob_query_timeout = 10000000000;
drop database IF EXISTS nxa;
create database nxa  character set utf8;
use nxa;
set ob_enable_plan_cache=0;
set@@sql_mode='STRICT_ALL_TABLES,NO_ZERO_DATE,NO_ZERO_IN_DATE,ERROR_FOR_DIVISION_BY_ZERO ';
result_format: 4
drop table t1;
ERROR 42S02: Unknown table 'nxa.t1'
create table t1 (s1 int,s2 varchar(20),s3 varbinary(10),s4 blob(30),s5 set('1','2')) 
default charset=gbk collate=gbk_chinese_ci;
insert into t1 values (1,'李华',11,112545,3);
insert into t1 values (2,'李华',12,1124,1);
#运算
select weight_string(s1)+weight_string(s1) from t1;
+-------------------------------------+
| weight_string(s1)+weight_string(s1) |
+-------------------------------------+
|                                NULL |
|                                NULL |
+-------------------------------------+
select weight_string(s1)+weight_string(s2) from t1;
+-------------------------------------+
| weight_string(s1)+weight_string(s2) |
+-------------------------------------+
|                                NULL |
|                                NULL |
+-------------------------------------+
Warnings:
Warning	1292	Truncated incorrect DOUBLE value: '�M�6'
Warning	1292	Truncated incorrect DOUBLE value: '�M�6'
select weight_string(s3)+weight_string(s4) from t1;
+-------------------------------------+
| weight_string(s3)+weight_string(s4) |
+-------------------------------------+
|                                1136 |
|                              112556 |
+-------------------------------------+
select weight_string(s3)+s4 from t1;
+----------------------+
| weight_string(s3)+s4 |
+----------------------+
|                 1136 |
|               112556 |
+----------------------+
select weight_string(s3)+s1 from t1;
+----------------------+
| weight_string(s3)+s1 |
+----------------------+
|                   12 |
|                   14 |
+----------------------+
select weight_string(s3)+s5 from t1;
+----------------------+
| weight_string(s3)+s5 |
+----------------------+
|                   13 |
|                   14 |
+----------------------+
select weight_string(s3) from t1;
+-------------------+
| weight_string(s3) |
+-------------------+
| 11                |
| 12                |
+-------------------+
select weight_string(s5) from t1;
+-------------------+
| weight_string(s5) |
+-------------------+
| 1                 |
| 1,2               |
+-------------------+
select weight_string(s3)+weight_string(s5) from t1;
+-------------------------------------+
| weight_string(s3)+weight_string(s5) |
+-------------------------------------+
|                                  12 |
|                                  13 |
+-------------------------------------+
Warnings:
Warning	1292	Truncated incorrect DOUBLE value: '1,2'
select weight_string(s1+s3) from t1;
+----------------------+
| weight_string(s1+s3) |
+----------------------+
| NULL                 |
| NULL                 |
+----------------------+
select weight_string(s3+s4) from t1;
+----------------------+
| weight_string(s3+s4) |
+----------------------+
| NULL                 |
| NULL                 |
+----------------------+
select weight_string(s3+s3/s3-s3) from t1;
+----------------------------+
| weight_string(s3+s3/s3-s3) |
+----------------------------+
| NULL                       |
| NULL                       |
+----------------------------+
select weight_string(3+s1) from t1;
+---------------------+
| weight_string(3+s1) |
+---------------------+
| NULL                |
| NULL                |
+---------------------+
select weight_string(3+s3) from t1;
+---------------------+
| weight_string(3+s3) |
+---------------------+
| NULL                |
| NULL                |
+---------------------+
insert into t1(s3) values(11),(12),(11),(14);
#distinct
select distinct weight_string(s3) from t1;
+-------------------+
| weight_string(s3) |
+-------------------+
| 11                |
| 12                |
| 14                |
+-------------------+
select distinct weight_string(s1) from t1;
+-------------------+
| weight_string(s1) |
+-------------------+
| NULL              |
+-------------------+
select distinct hex(weight_string(s3)) from t1;
+------------------------+
| hex(weight_string(s3)) |
+------------------------+
| 3131                   |
| 3132                   |
| 3134                   |
+------------------------+
select distinct weight_string(s3) from t1;
+-------------------+
| weight_string(s3) |
+-------------------+
| 11                |
| 12                |
| 14                |
+-------------------+
#concat
select concat(weight_string(s3),weight_string(s4)) from t1;
+---------------------------------------------+
| concat(weight_string(s3),weight_string(s4)) |
+---------------------------------------------+
| 11112545                                    |
| 121124                                      |
| NULL                                        |
| NULL                                        |
| NULL                                        |
| NULL                                        |
+---------------------------------------------+
select concat(weight_string(s1),weight_string(s2)) from t1;
+---------------------------------------------+
| concat(weight_string(s1),weight_string(s2)) |
+---------------------------------------------+
| NULL                                        |
| NULL                                        |
| NULL                                        |
| NULL                                        |
| NULL                                        |
| NULL                                        |
+---------------------------------------------+
select concat(weight_string(s2),weight_string(s3)) from t1;
+---------------------------------------------+
| concat(weight_string(s2),weight_string(s3)) |
+---------------------------------------------+
| NULL                                        |
| NULL                                        |
| NULL                                        |
| NULL                                        |
| �M�611                                        |
| �M�612                                        |
+---------------------------------------------+
#select 
drop table t2;
ERROR 42S02: Unknown table 'nxa.t2'
create table t2 (s1 int,s2 char(20),s3 binary(10),s4 blob(30),s5 set('1','2'))
default charset=gbk collate=gbk_chinese_ci;
insert into t2 values (1,'李华',11,112545,3);
insert into t2 values (2,'西郊',12,1124,1);
insert into t2 values(11,'2',2,2,2);
insert into t2 values(4,'2',1,1,1);
insert into t2 values(4,'5',1,1,3);
select hex(weight_string(s1 as char(5))) from t2;
+-----------------------------------+
| hex(weight_string(s1 as char(5))) |
+-----------------------------------+
| NULL                              |
| NULL                              |
| NULL                              |
| NULL                              |
| NULL                              |
+-----------------------------------+
select hex(weight_string(s2 as char(5))) from t2;
+-----------------------------------+
| hex(weight_string(s2 as char(5))) |
+-----------------------------------+
| 3220202020                        |
| 3220202020                        |
| 3520202020                        |
| A64D9A36202020                    |
| C2B59EB7202020                    |
+-----------------------------------+
select hex(weight_string(s3 as char(5))) from t2;
+-----------------------------------+
| hex(weight_string(s3 as char(5))) |
+-----------------------------------+
| 3100000000                        |
| 3100000000                        |
| 3131000000                        |
| 3132000000                        |
| 3200000000                        |
+-----------------------------------+
select hex(weight_string(s4 as char(5))) from t2;
+-----------------------------------+
| hex(weight_string(s4 as char(5))) |
+-----------------------------------+
| 3100000000                        |
| 3100000000                        |
| 3131323400                        |
| 3131323534                        |
| 3200000000                        |
+-----------------------------------+
select hex(weight_string(s5 as char(5))) from t2;
+-----------------------------------+
| hex(weight_string(s5 as char(5))) |
+-----------------------------------+
| 3120202020                        |
| 3120202020                        |
| 312C322020                        |
| 312C322020                        |
| 3220202020                        |
+-----------------------------------+
#44823852 int类型在weight_string(s1 as binary(5))后mysql显示结果，ob为null
select hex(weight_string(s1 as binary(5))) from t2;
+-------------------------------------+
| hex(weight_string(s1 as binary(5))) |
+-------------------------------------+
| 3100000000                          |
| 3131000000                          |
| 3200000000                          |
| 3400000000                          |
| 3400000000                          |
+-------------------------------------+
select hex(weight_string(s2 as binary(5))) from t2;
+-------------------------------------+
| hex(weight_string(s2 as binary(5))) |
+-------------------------------------+
| 3200000000                          |
| 3200000000                          |
| 3500000000                          |
| C0EEBBAA00                          |
| CEF7BDBC00                          |
+-------------------------------------+
select hex(weight_string(s3 as binary(5))) from t2;
+-------------------------------------+
| hex(weight_string(s3 as binary(5))) |
+-------------------------------------+
| 3100000000                          |
| 3100000000                          |
| 3131000000                          |
| 3132000000                          |
| 3200000000                          |
+-------------------------------------+
select hex(weight_string(s4 as binary(5))) from t2;
+-------------------------------------+
| hex(weight_string(s4 as binary(5))) |
+-------------------------------------+
| 3100000000                          |
| 3100000000                          |
| 3131323400                          |
| 3131323534                          |
| 3200000000                          |
+-------------------------------------+
select hex(weight_string(s5 as binary(5))) from t2;
+-------------------------------------+
| hex(weight_string(s5 as binary(5))) |
+-------------------------------------+
| 3100000000                          |
| 3100000000                          |
| 312C320000                          |
| 312C320000                          |
| 3200000000                          |
+-------------------------------------+
#concat
#函数嵌套
drop table t1;
create table t1 (s1 int,s2 varchar(20),s3 binary(10),s4 blob(30),s5 set('1','2')) default charset=gbk collate=gbk_chinese_ci;
insert into t1 values (1,'李华',11,112545,3);
insert into t1 values (2,'李华',12,1124,1);
select weight_string(now()) ;
select weight_string(curdate());
select weight_string(curtime());
select weight_string(ascii(s1)) from t1 ;
+--------------------------+
| weight_string(ascii(s1)) |
+--------------------------+
| NULL                     |
| NULL                     |
+--------------------------+
select weight_string(instr(weight_string(s4),3)) from t1 ;
+-------------------------------------------+
| weight_string(instr(weight_string(s4),3)) |
+-------------------------------------------+
| NULL                                      |
| NULL                                      |
+-------------------------------------------+
select weight_string(length(s1)) from t1 ;
+---------------------------+
| weight_string(length(s1)) |
+---------------------------+
| NULL                      |
| NULL                      |
+---------------------------+
select weight_string(abs(s1)) from t1 ;
+------------------------+
| weight_string(abs(s1)) |
+------------------------+
| NULL                   |
| NULL                   |
+------------------------+
select weight_string(ceil(s1))from t1 ;
+-------------------------+
| weight_string(ceil(s1)) |
+-------------------------+
| NULL                    |
| NULL                    |
+-------------------------+
select weight_string(floor(s1)) from t1 ;
+--------------------------+
| weight_string(floor(s1)) |
+--------------------------+
| NULL                     |
| NULL                     |
+--------------------------+
select weight_string(sin(s1)) from t1 ;
+------------------------+
| weight_string(sin(s1)) |
+------------------------+
| NULL                   |
| NULL                   |
+------------------------+
select weight_string(cos(s1)) from t1 ;
+------------------------+
| weight_string(cos(s1)) |
+------------------------+
| NULL                   |
| NULL                   |
+------------------------+
select weight_string(sign(s1)) from t1 ;
+-------------------------+
| weight_string(sign(s1)) |
+-------------------------+
| NULL                    |
| NULL                    |
+-------------------------+
select weight_string(power(s1,3)) from t1 ;
+----------------------------+
| weight_string(power(s1,3)) |
+----------------------------+
| NULL                       |
| NULL                       |
+----------------------------+
select weight_string(mod(3,s1)) from t1 ;
+--------------------------+
| weight_string(mod(3,s1)) |
+--------------------------+
| NULL                     |
| NULL                     |
+--------------------------+
select weight_string(round(s1)) from t1 ;
+--------------------------+
| weight_string(round(s1)) |
+--------------------------+
| NULL                     |
| NULL                     |
+--------------------------+
select weight_string(sqrt(s1)) from t1 ;
+-------------------------+
| weight_string(sqrt(s1)) |
+-------------------------+
| NULL                    |
| NULL                    |
+-------------------------+
select weight_string(sum(s1)) from t1  ;
+------------------------+
| weight_string(sum(s1)) |
+------------------------+
| NULL                   |
+------------------------+
select weight_string(count(s1)) from t1  ;
+--------------------------+
| weight_string(count(s1)) |
+--------------------------+
| NULL                     |
+--------------------------+
select weight_string(max(s1)) from t1  ;
+------------------------+
| weight_string(max(s1)) |
+------------------------+
| NULL                   |
+------------------------+
select weight_string(min(s1)) from t1  ;
+------------------------+
| weight_string(min(s1)) |
+------------------------+
| NULL                   |
+------------------------+
select weight_string(avg(s1)) from t1  ;
+------------------------+
| weight_string(avg(s1)) |
+------------------------+
| NULL                   |
+------------------------+
select weight_string(ascii(s4)) from t1 ;
+--------------------------+
| weight_string(ascii(s4)) |
+--------------------------+
| NULL                     |
| NULL                     |
+--------------------------+
select weight_string(instr(weight_string(s4),3)) from t1 ;
+-------------------------------------------+
| weight_string(instr(weight_string(s4),3)) |
+-------------------------------------------+
| NULL                                      |
| NULL                                      |
+-------------------------------------------+
select weight_string(length(s4)) from t1 ;
+---------------------------+
| weight_string(length(s4)) |
+---------------------------+
| NULL                      |
| NULL                      |
+---------------------------+
select weight_string(abs(s4)) from t1 ;
+------------------------+
| weight_string(abs(s4)) |
+------------------------+
| NULL                   |
| NULL                   |
+------------------------+
select weight_string(ceil(s4))from t1 ;
+-------------------------+
| weight_string(ceil(s4)) |
+-------------------------+
| NULL                    |
| NULL                    |
+-------------------------+
select weight_string(floor(s4)) from t1 ;
+--------------------------+
| weight_string(floor(s4)) |
+--------------------------+
| NULL                     |
| NULL                     |
+--------------------------+
select weight_string(sin(s4)) from t1 ;
+------------------------+
| weight_string(sin(s4)) |
+------------------------+
| NULL                   |
| NULL                   |
+------------------------+
select weight_string(cos(s4)) from t1 ;
+------------------------+
| weight_string(cos(s4)) |
+------------------------+
| NULL                   |
| NULL                   |
+------------------------+
select weight_string(sign(s4)) from t1 ;
+-------------------------+
| weight_string(sign(s4)) |
+-------------------------+
| NULL                    |
| NULL                    |
+-------------------------+
select weight_string(power(s4,3)) from t1 ;
+----------------------------+
| weight_string(power(s4,3)) |
+----------------------------+
| NULL                       |
| NULL                       |
+----------------------------+
select weight_string(mod(3,s4)) from t1 ;
+--------------------------+
| weight_string(mod(3,s4)) |
+--------------------------+
| NULL                     |
| NULL                     |
+--------------------------+
select weight_string(round(s4)) from t1 ;
+--------------------------+
| weight_string(round(s4)) |
+--------------------------+
| NULL                     |
| NULL                     |
+--------------------------+
select weight_string(sqrt(s4)) from t1 ;
+-------------------------+
| weight_string(sqrt(s4)) |
+-------------------------+
| NULL                    |
| NULL                    |
+-------------------------+
select weight_string(sum(s4)) from t1  ;
+------------------------+
| weight_string(sum(s4)) |
+------------------------+
| NULL                   |
+------------------------+
select weight_string(count(s4)) from t1  ;
+--------------------------+
| weight_string(count(s4)) |
+--------------------------+
| NULL                     |
+--------------------------+
select weight_string(max(s4)) from t1  ;
+------------------------+
| weight_string(max(s4)) |
+------------------------+
| 112545                 |
+------------------------+
select weight_string(min(s4)) from t1  ;
+------------------------+
| weight_string(min(s4)) |
+------------------------+
| 1124                   |
+------------------------+
select weight_string(avg(s4)) from t1  ;
+------------------------+
| weight_string(avg(s4)) |
+------------------------+
| NULL                   |
+------------------------+
select (ascii(weight_string(s4))) from t1 ;
+----------------------------+
| (ascii(weight_string(s4))) |
+----------------------------+
|                         49 |
|                         49 |
+----------------------------+
select (instr(weight_string(s4),3)) from t1 ;
+------------------------------+
| (instr(weight_string(s4),3)) |
+------------------------------+
|                            0 |
|                            0 |
+------------------------------+
select (length(weight_string(s4))) from t1 ;
+-----------------------------+
| (length(weight_string(s4))) |
+-----------------------------+
|                           4 |
|                           6 |
+-----------------------------+
select (abs(weight_string(s4))) from t1 ;
+--------------------------+
| (abs(weight_string(s4))) |
+--------------------------+
|                     1124 |
|                   112545 |
+--------------------------+
select (ceil(weight_string(s4)))from t1 ;
+---------------------------+
| (ceil(weight_string(s4))) |
+---------------------------+
|                      1124 |
|                    112545 |
+---------------------------+
select (floor(weight_string(s4))) from t1 ;
+----------------------------+
| (floor(weight_string(s4))) |
+----------------------------+
|                       1124 |
|                     112545 |
+----------------------------+
select (sin(weight_string(s4))) from t1 ;
+--------------------------+
| (sin(weight_string(s4))) |
+--------------------------+
|       -0.636668273391427 |
|       0.5520141172465857 |
+--------------------------+
select (cos(weight_string(s4))) from t1 ;
+--------------------------+
| (cos(weight_string(s4))) |
+--------------------------+
|        0.771137801989229 |
|       0.8338347644230677 |
+--------------------------+
select (sign(weight_string(s4))) from t1 ;
+---------------------------+
| (sign(weight_string(s4))) |
+---------------------------+
|                         1 |
|                         1 |
+---------------------------+
select (power(weight_string(s4),3)) from t1 ;
+------------------------------+
| (power(weight_string(s4),3)) |
+------------------------------+
|                   1420034624 |
|         1.425537402278625e15 |
+------------------------------+
select (mod(3,weight_string(s4))) from t1 ;
+----------------------------+
| (mod(3,weight_string(s4))) |
+----------------------------+
|                          3 |
|                          3 |
+----------------------------+
select (round(weight_string(s4))) from t1 ;
+----------------------------+
| (round(weight_string(s4))) |
+----------------------------+
|                       1124 |
|                     112545 |
+----------------------------+
select (sqrt(weight_string(s4))) from t1 ;
+---------------------------+
| (sqrt(weight_string(s4))) |
+---------------------------+
|         33.52610922848042 |
|        335.47727195743084 |
+---------------------------+
select (sum(weight_string(s4))) from t1  ;
+--------------------------+
| (sum(weight_string(s4))) |
+--------------------------+
|                   113669 |
+--------------------------+
select (count(weight_string(s4))) from t1  ;
+----------------------------+
| (count(weight_string(s4))) |
+----------------------------+
|                          2 |
+----------------------------+
select (max(weight_string(s4))) from t1  ;
+--------------------------+
| (max(weight_string(s4))) |
+--------------------------+
| 112545                   |
+--------------------------+
select (min(weight_string(s4))) from t1  ;
+--------------------------+
| (min(weight_string(s4))) |
+--------------------------+
| 1124                     |
+--------------------------+
select (avg(weight_string(s4))) from t1  ;
+--------------------------+
| (avg(weight_string(s4))) |
+--------------------------+
|                  56834.5 |
+--------------------------+
#转换函数
#convert
drop table t1;
create table t1 (s1 int,s2 char(20),s3 binary(10),s4 blob(30),s5 set('1','2','19980526')) 
default charset=gbk collate=gbk_chinese_ci;
insert into t1 values (1,'李华',11,112545,4);
insert into t1 values (2,'西郊',12,1124,1);
insert into t1 values(11,'2',2,2,2);
insert into t1 values(4,'-2',1,1,1);
insert into t1 values(19980526,'19980526',19980526,19980526,1);
select convert(weight_string(s1),signed) from t1 ;
+-----------------------------------+
| convert(weight_string(s1),signed) |
+-----------------------------------+
|                              NULL |
|                              NULL |
|                              NULL |
|                              NULL |
|                              NULL |
+-----------------------------------+
select convert(weight_string(s2),signed) from t1 ;
+-----------------------------------+
| convert(weight_string(s2),signed) |
+-----------------------------------+
|                                 0 |
|                                 0 |
|                                 2 |
|                                -2 |
|                          19980526 |
+-----------------------------------+
Warnings:
Warning	1292	Truncated incorrect INTEGER value: '�M�6'
Warning	1292	Truncated incorrect INTEGER value: 'µ��'
select convert(weight_string(s3),signed) from t1 ;
+-----------------------------------+
| convert(weight_string(s3),signed) |
+-----------------------------------+
|                                 1 |
|                                 2 |
|                                11 |
|                                12 |
|                          19980526 |
+-----------------------------------+
Warnings:
Warning	1292	Truncated incorrect INTEGER value: '11'
Warning	1292	Truncated incorrect INTEGER value: '12'
Warning	1292	Truncated incorrect INTEGER value: '2'
Warning	1292	Truncated incorrect INTEGER value: '1'
Warning	1292	Truncated incorrect INTEGER value: '19980526'
select convert(weight_string(s4),signed) from t1 ;
+-----------------------------------+
| convert(weight_string(s4),signed) |
+-----------------------------------+
|                                 1 |
|                                 2 |
|                              1124 |
|                            112545 |
|                          19980526 |
+-----------------------------------+
select convert(weight_string(s5),signed) from t1 ;
+-----------------------------------+
| convert(weight_string(s5),signed) |
+-----------------------------------+
|                                 1 |
|                                 1 |
|                                 1 |
|                                 2 |
|                          19980526 |
+-----------------------------------+
select convert(weight_string(s1),unsigned) from t1 ;
+-------------------------------------+
| convert(weight_string(s1),unsigned) |
+-------------------------------------+
|                                NULL |
|                                NULL |
|                                NULL |
|                                NULL |
|                                NULL |
+-------------------------------------+
select convert(weight_string(s2),unsigned) from t1 ;
+-------------------------------------+
| convert(weight_string(s2),unsigned) |
+-------------------------------------+
|                                   0 |
|                                   0 |
|                                   2 |
|                            19980526 |
|                18446744073709551614 |
+-------------------------------------+
Warnings:
Warning	1292	Truncated incorrect INTEGER value: '�M�6'
Warning	1292	Truncated incorrect INTEGER value: 'µ��'
select convert(weight_string(s3),unsigned) from t1 ;
+-------------------------------------+
| convert(weight_string(s3),unsigned) |
+-------------------------------------+
|                                   1 |
|                                   2 |
|                                  11 |
|                                  12 |
|                            19980526 |
+-------------------------------------+
Warnings:
Warning	1292	Truncated incorrect INTEGER value: '11'
Warning	1292	Truncated incorrect INTEGER value: '12'
Warning	1292	Truncated incorrect INTEGER value: '2'
Warning	1292	Truncated incorrect INTEGER value: '1'
Warning	1292	Truncated incorrect INTEGER value: '19980526'
select convert(weight_string(s4),unsigned) from t1 ;
+-------------------------------------+
| convert(weight_string(s4),unsigned) |
+-------------------------------------+
|                                   1 |
|                                   2 |
|                                1124 |
|                              112545 |
|                            19980526 |
+-------------------------------------+
select convert(weight_string(s5),unsigned) from t1 ;
+-------------------------------------+
| convert(weight_string(s5),unsigned) |
+-------------------------------------+
|                                   1 |
|                                   1 |
|                                   1 |
|                                   2 |
|                            19980526 |
+-------------------------------------+
select convert(weight_string(s1),date) from t1 ;
+---------------------------------+
| convert(weight_string(s1),date) |
+---------------------------------+
| NULL                            |
| NULL                            |
| NULL                            |
| NULL                            |
| NULL                            |
+---------------------------------+
select convert(weight_string(s2),date) from t1 ;
+---------------------------------+
| convert(weight_string(s2),date) |
+---------------------------------+
| 1998-05-26                      |
| NULL                            |
| NULL                            |
| NULL                            |
| NULL                            |
+---------------------------------+
select convert(weight_string(s3),date) from t1 ;
+---------------------------------+
| convert(weight_string(s3),date) |
+---------------------------------+
| NULL                            |
| NULL                            |
| NULL                            |
| NULL                            |
| NULL                            |
+---------------------------------+
select convert(weight_string(s4),date) from t1 ;
+---------------------------------+
| convert(weight_string(s4),date) |
+---------------------------------+
| 1998-05-26                      |
| NULL                            |
| NULL                            |
| NULL                            |
| NULL                            |
+---------------------------------+
select convert(weight_string(s5),date) from t1 ;
+---------------------------------+
| convert(weight_string(s5),date) |
+---------------------------------+
| 1998-05-26                      |
| NULL                            |
| NULL                            |
| NULL                            |
| NULL                            |
+---------------------------------+
select convert(weight_string(s1),char) from t1 ;
+---------------------------------+
| convert(weight_string(s1),char) |
+---------------------------------+
| NULL                            |
| NULL                            |
| NULL                            |
| NULL                            |
| NULL                            |
+---------------------------------+
select convert(weight_string(s2),char) from t1 ;
+---------------------------------+
| convert(weight_string(s2),char) |
+---------------------------------+
| -2                              |
| 19980526                        |
| 2                               |
| �M�6                              |
| µ��                               |
+---------------------------------+
select convert(weight_string(s3),char) from t1 ;
+---------------------------------+
| convert(weight_string(s3),char) |
+---------------------------------+
| 1                               |
| 11                              |
| 12                              |
| 19980526                        |
| 2                               |
+---------------------------------+
select convert(weight_string(s4),char) from t1 ;
+---------------------------------+
| convert(weight_string(s4),char) |
+---------------------------------+
| 1                               |
| 1124                            |
| 112545                          |
| 19980526                        |
| 2                               |
+---------------------------------+
select convert(weight_string(s5),char) from t1 ;
+---------------------------------+
| convert(weight_string(s5),char) |
+---------------------------------+
| 1                               |
| 1                               |
| 1                               |
| 19980526                        |
| 2                               |
+---------------------------------+
select convert(weight_string(s1),binary) from t1 ;
+-----------------------------------+
| convert(weight_string(s1),binary) |
+-----------------------------------+
| NULL                              |
| NULL                              |
| NULL                              |
| NULL                              |
| NULL                              |
+-----------------------------------+
select convert(weight_string(s2),binary) from t1 ;
+-----------------------------------+
| convert(weight_string(s2),binary) |
+-----------------------------------+
| -2                                |
| 19980526                          |
| 2                                 |
| �M�6                                |
| µ��                                 |
+-----------------------------------+
select convert(weight_string(s3),binary) from t1 ;
+-----------------------------------+
| convert(weight_string(s3),binary) |
+-----------------------------------+
| 1                                 |
| 11                                |
| 12                                |
| 19980526                          |
| 2                                 |
+-----------------------------------+
select convert(weight_string(s4),binary) from t1 ;
+-----------------------------------+
| convert(weight_string(s4),binary) |
+-----------------------------------+
| 1                                 |
| 1124                              |
| 112545                            |
| 19980526                          |
| 2                                 |
+-----------------------------------+
select convert(weight_string(s5),binary) from t1 ;
+-----------------------------------+
| convert(weight_string(s5),binary) |
+-----------------------------------+
| 1                                 |
| 1                                 |
| 1                                 |
| 19980526                          |
| 2                                 |
+-----------------------------------+
#cast
drop table t1;
create table t1 (s1 int,s2 char(20),s3 binary(10),s4 blob(30),s5 set('1','2','19980526')) 
default charset=gbk collate=gbk_chinese_ci;
insert into t1 values (1,'李华',11,112545,4);
insert into t1 values (2,'西郊',12,1124,1);
insert into t1 values(11,'2',2,2,2);
insert into t1 values(4,'-2',1,1,1);
insert into t1 values(19980526,'19980526',19980526,19980526,1);
select cast(weight_string(s1) as char) from t1 ;
+---------------------------------+
| cast(weight_string(s1) as char) |
+---------------------------------+
| NULL                            |
| NULL                            |
| NULL                            |
| NULL                            |
| NULL                            |
+---------------------------------+
select cast(weight_string(s2) as char) from t1 ;
+---------------------------------+
| cast(weight_string(s2) as char) |
+---------------------------------+
| -2                              |
| 19980526                        |
| 2                               |
| �M�6                              |
| µ��                               |
+---------------------------------+
select cast(weight_string(s3) as char) from t1 ;
+---------------------------------+
| cast(weight_string(s3) as char) |
+---------------------------------+
| 1                               |
| 11                              |
| 12                              |
| 19980526                        |
| 2                               |
+---------------------------------+
select cast(weight_string(s4) as char) from t1 ;
+---------------------------------+
| cast(weight_string(s4) as char) |
+---------------------------------+
| 1                               |
| 1124                            |
| 112545                          |
| 19980526                        |
| 2                               |
+---------------------------------+
select cast(weight_string(s5) as char) from t1 ;
+---------------------------------+
| cast(weight_string(s5) as char) |
+---------------------------------+
| 1                               |
| 1                               |
| 1                               |
| 19980526                        |
| 2                               |
+---------------------------------+
select cast(weight_string(s1) as date) from t1 ;
+---------------------------------+
| cast(weight_string(s1) as date) |
+---------------------------------+
| NULL                            |
| NULL                            |
| NULL                            |
| NULL                            |
| NULL                            |
+---------------------------------+
select cast(weight_string(s2) as date) from t1 ;
+---------------------------------+
| cast(weight_string(s2) as date) |
+---------------------------------+
| 1998-05-26                      |
| NULL                            |
| NULL                            |
| NULL                            |
| NULL                            |
+---------------------------------+
select cast(weight_string(s3) as date) from t1 ;
+---------------------------------+
| cast(weight_string(s3) as date) |
+---------------------------------+
| NULL                            |
| NULL                            |
| NULL                            |
| NULL                            |
| NULL                            |
+---------------------------------+
select cast(weight_string(s4) as date) from t1 ;
+---------------------------------+
| cast(weight_string(s4) as date) |
+---------------------------------+
| 1998-05-26                      |
| NULL                            |
| NULL                            |
| NULL                            |
| NULL                            |
+---------------------------------+
select cast(weight_string(s5) as date) from t1 ;
+---------------------------------+
| cast(weight_string(s5) as date) |
+---------------------------------+
| 1998-05-26                      |
| NULL                            |
| NULL                            |
| NULL                            |
| NULL                            |
+---------------------------------+
select cast(weight_string(s1) as decimal(2,1)) from t1 ;
+-----------------------------------------+
| cast(weight_string(s1) as decimal(2,1)) |
+-----------------------------------------+
|                                    NULL |
|                                    NULL |
|                                    NULL |
|                                    NULL |
|                                    NULL |
+-----------------------------------------+
select cast(weight_string(s2) as decimal(2,1)) from t1 ;
+-----------------------------------------+
| cast(weight_string(s2) as decimal(2,1)) |
+-----------------------------------------+
|                                     0.0 |
|                                     0.0 |
|                                     2.0 |
|                                     9.9 |
|                                    -2.0 |
+-----------------------------------------+
Warnings:
Warning	1292	Truncated incorrect DECIMAL value: '�M�6'
Warning	1292	Truncated incorrect DECIMAL value: 'µ��'
select cast(weight_string(s3) as decimal(2,1)) from t1 ;
+-----------------------------------------+
| cast(weight_string(s3) as decimal(2,1)) |
+-----------------------------------------+
|                                     1.0 |
|                                     2.0 |
|                                     9.9 |
|                                     9.9 |
|                                     9.9 |
+-----------------------------------------+
Warnings:
Warning	1292	Truncated incorrect DECIMAL value: '11'
Warning	1292	Truncated incorrect DECIMAL value: '12'
Warning	1292	Truncated incorrect DECIMAL value: '2'
Warning	1292	Truncated incorrect DECIMAL value: '1'
Warning	1292	Truncated incorrect DECIMAL value: '19980526'
select cast(weight_string(s4) as decimal(2,1)) from t1 ;
+-----------------------------------------+
| cast(weight_string(s4) as decimal(2,1)) |
+-----------------------------------------+
|                                     1.0 |
|                                     2.0 |
|                                     9.9 |
|                                     9.9 |
|                                     9.9 |
+-----------------------------------------+
select cast(weight_string(s5) as decimal(2,1)) from t1 ;
+-----------------------------------------+
| cast(weight_string(s5) as decimal(2,1)) |
+-----------------------------------------+
|                                     1.0 |
|                                     1.0 |
|                                     1.0 |
|                                     2.0 |
|                                     9.9 |
+-----------------------------------------+
select cast(weight_string(s1) as signed) from t1 ;
+-----------------------------------+
| cast(weight_string(s1) as signed) |
+-----------------------------------+
|                              NULL |
|                              NULL |
|                              NULL |
|                              NULL |
|                              NULL |
+-----------------------------------+
select cast(weight_string(s2) as signed) from t1 ;
+-----------------------------------+
| cast(weight_string(s2) as signed) |
+-----------------------------------+
|                                 0 |
|                                 0 |
|                                 2 |
|                                -2 |
|                          19980526 |
+-----------------------------------+
Warnings:
Warning	1292	Truncated incorrect INTEGER value: '�M�6'
Warning	1292	Truncated incorrect INTEGER value: 'µ��'
select cast(weight_string(s3) as signed) from t1 ;
+-----------------------------------+
| cast(weight_string(s3) as signed) |
+-----------------------------------+
|                                 1 |
|                                 2 |
|                                11 |
|                                12 |
|                          19980526 |
+-----------------------------------+
Warnings:
Warning	1292	Truncated incorrect INTEGER value: '11'
Warning	1292	Truncated incorrect INTEGER value: '12'
Warning	1292	Truncated incorrect INTEGER value: '2'
Warning	1292	Truncated incorrect INTEGER value: '1'
Warning	1292	Truncated incorrect INTEGER value: '19980526'
select cast(weight_string(s4) as signed) from t1 ;
+-----------------------------------+
| cast(weight_string(s4) as signed) |
+-----------------------------------+
|                                 1 |
|                                 2 |
|                              1124 |
|                            112545 |
|                          19980526 |
+-----------------------------------+
select cast(weight_string(s5) as signed) from t1 ;
+-----------------------------------+
| cast(weight_string(s5) as signed) |
+-----------------------------------+
|                                 1 |
|                                 1 |
|                                 1 |
|                                 2 |
|                          19980526 |
+-----------------------------------+
#where子句
drop table t1;
create table t1 (s1 int,s2 varchar(20),s3 binary(10),s4 blob(30),s5 set('1','2')) default charset=gbk collate=gbk_chinese_ci;
insert into t1 values (1,'李华',11,112545,3);
insert into t1 values (2,'西郊',12,1124,1);
select * from t1 where weight_string(s3)=11;
+------+--------+------------+--------+------+
| s1   | s2     | s3         | s4     | s5   |
+------+--------+------------+--------+------+
|    1 | 李华   | 11         | 112545 | 1,2  |
+------+--------+------------+--------+------+
Warnings:
Warning	1292	Truncated incorrect DECIMAL value: '11'
Warning	1292	Truncated incorrect DECIMAL value: '12'
select * from t1 where weight_string(s1)=1;
+------+------+------+------+------+
| s1   | s2   | s3   | s4   | s5   |
+------+------+------+------+------+
+------+------+------+------+------+
select * from t1 where weight_string(s2)='李华';
+------+------+------+------+------+
| s1   | s2   | s3   | s4   | s5   |
+------+------+------+------+------+
+------+------+------+------+------+
select * from t1 where weight_string(s5)=1;
+------+--------+------------+--------+------+
| s1   | s2     | s3         | s4     | s5   |
+------+--------+------------+--------+------+
|    1 | 李华   | 11         | 112545 | 1,2  |
|    2 | 西郊   | 12         | 1124   | 1    |
+------+--------+------------+--------+------+
Warnings:
Warning	1292	Truncated incorrect DECIMAL value: '1,2'
select * from t1 where weight_string(s5)=0;
+------+------+------+------+------+
| s1   | s2   | s3   | s4   | s5   |
+------+------+------+------+------+
+------+------+------+------+------+
Warnings:
Warning	1292	Truncated incorrect DECIMAL value: '1,2'
select * from t1 where weight_string(s3)!=11;
+------+--------+------------+------+------+
| s1   | s2     | s3         | s4   | s5   |
+------+--------+------------+------+------+
|    2 | 西郊   | 12         | 1124 | 1    |
+------+--------+------------+------+------+
Warnings:
Warning	1292	Truncated incorrect DECIMAL value: '11'
Warning	1292	Truncated incorrect DECIMAL value: '12'
select * from t1 where weight_string(s3)>=11;
+------+--------+------------+--------+------+
| s1   | s2     | s3         | s4     | s5   |
+------+--------+------------+--------+------+
|    1 | 李华   | 11         | 112545 | 1,2  |
|    2 | 西郊   | 12         | 1124   | 1    |
+------+--------+------------+--------+------+
Warnings:
Warning	1292	Truncated incorrect DECIMAL value: '11'
Warning	1292	Truncated incorrect DECIMAL value: '12'
select * from t1 where weight_string(s3)<=11;
+------+--------+------------+--------+------+
| s1   | s2     | s3         | s4     | s5   |
+------+--------+------------+--------+------+
|    1 | 李华   | 11         | 112545 | 1,2  |
+------+--------+------------+--------+------+
Warnings:
Warning	1292	Truncated incorrect DECIMAL value: '11'
Warning	1292	Truncated incorrect DECIMAL value: '12'
select * from t1 where weight_string(s3)>11;
+------+--------+------------+------+------+
| s1   | s2     | s3         | s4   | s5   |
+------+--------+------------+------+------+
|    2 | 西郊   | 12         | 1124 | 1    |
+------+--------+------------+------+------+
Warnings:
Warning	1292	Truncated incorrect DECIMAL value: '11'
Warning	1292	Truncated incorrect DECIMAL value: '12'
select * from t1 where weight_string(s3)<11;
+------+------+------+------+------+
| s1   | s2   | s3   | s4   | s5   |
+------+------+------+------+------+
+------+------+------+------+------+
Warnings:
Warning	1292	Truncated incorrect DECIMAL value: '11'
Warning	1292	Truncated incorrect DECIMAL value: '12'
drop table t1;
create table t1 (s1 int,s2 varchar(20),s3 binary(10),s4 blob(30),s5 set('1','2')) 
default charset=gbk collate=gbk_chinese_ci;
insert into t1 values (1,'李华',11,112545,3);
insert into t1 values (2,'西郊',12,1124,1);
insert into t1(s1) values (0);
insert into t1(s3) values (1);
select * from t1;
+------+--------+------------+--------+------+
| s1   | s2     | s3         | s4     | s5   |
+------+--------+------------+--------+------+
|    0 | NULL   | NULL       | NULL   | NULL |
|    1 | 李华   | 11         | 112545 | 1,2  |
|    2 | 西郊   | 12         | 1124   | 1    |
| NULL | NULL   | 1          | NULL   | NULL |
+------+--------+------------+--------+------+
select * from t1 where s1=weight_string(s5);
+------+--------+------------+--------+------+
| s1   | s2     | s3         | s4     | s5   |
+------+--------+------------+--------+------+
|    1 | 李华   | 11         | 112545 | 1,2  |
+------+--------+------------+--------+------+
Warnings:
Warning	1292	Truncated incorrect DECIMAL value: '1,2'
select * from t1 where s1=weight_string(s3);
+------+------+------+------+------+
| s1   | s2   | s3   | s4   | s5   |
+------+------+------+------+------+
+------+------+------+------+------+
Warnings:
Warning	1292	Truncated incorrect DECIMAL value: '11'
Warning	1292	Truncated incorrect DECIMAL value: '12'
#between and
drop table t1;
create table t1 (s1 int,s2 varchar(20),s3 binary(10),s4 blob(30),s5 set('1','2')) default charset=gbk collate=gbk_chinese_ci;
insert into t1 values (1,'李华',11,112545,3);
insert into t1 values (2,'西郊',12,1124,1);
insert into t1(s1) values(50);
select * from t1 where weight_string(s3) between 1 and 11;
+------+--------+------------+--------+------+
| s1   | s2     | s3         | s4     | s5   |
+------+--------+------------+--------+------+
|    1 | 李华   | 11         | 112545 | 1,2  |
+------+--------+------------+--------+------+
Warnings:
Warning	1292	Truncated incorrect DECIMAL value: '11'
Warning	1292	Truncated incorrect DECIMAL value: '11'
Warning	1292	Truncated incorrect DECIMAL value: '12'
Warning	1292	Truncated incorrect DECIMAL value: '12'
select * from t1 where weight_string(s1) between 1 and 5;
+------+------+------+------+------+
| s1   | s2   | s3   | s4   | s5   |
+------+------+------+------+------+
+------+------+------+------+------+
select * from t1 where weight_string(s4) between 1124 and 1124;
+------+--------+------------+------+------+
| s1   | s2     | s3         | s4   | s5   |
+------+--------+------------+------+------+
|    2 | 西郊   | 12         | 1124 | 1    |
+------+--------+------------+------+------+
select * from t1 where s1 between weight_string(s3) and weight_string(s4);
+------+------+------+------+------+
| s1   | s2   | s3   | s4   | s5   |
+------+------+------+------+------+
+------+------+------+------+------+
Warnings:
Warning	1292	Truncated incorrect DECIMAL value: '11'
Warning	1292	Truncated incorrect DECIMAL value: '12'
select * from t1 where 112 between weight_string(s3) and weight_string(s4);
+------+--------+------------+--------+------+
| s1   | s2     | s3         | s4     | s5   |
+------+--------+------------+--------+------+
|    1 | 李华   | 11         | 112545 | 1,2  |
|    2 | 西郊   | 12         | 1124   | 1    |
+------+--------+------------+--------+------+
Warnings:
Warning	1292	Truncated incorrect DECIMAL value: '11'
Warning	1292	Truncated incorrect DECIMAL value: '12'
#in
drop table t1;
create table t1 (s1 int,s2 varchar(20),s3 binary(10),s4 blob(30),s5 set('1','2')) default charset=gbk collate=gbk_chinese_ci;
insert into t1 values (1,'李华',11,112545,3);
insert into t1 values (2,'西郊',12,1124,1);
insert into t1 values(11,'',2,2,2);
select * from t1 where weight_string(s3) in (11);
+------+--------+------------+--------+------+
| s1   | s2     | s3         | s4     | s5   |
+------+--------+------------+--------+------+
|    1 | 李华   | 11         | 112545 | 1,2  |
+------+--------+------------+--------+------+
Warnings:
Warning	1292	Truncated incorrect DECIMAL value: '11'
Warning	1292	Truncated incorrect DECIMAL value: '12'
Warning	1292	Truncated incorrect DECIMAL value: '2'
select * from t1 where weight_string(s1) in (1);
+------+------+------+------+------+
| s1   | s2   | s3   | s4   | s5   |
+------+------+------+------+------+
+------+------+------+------+------+
select weight_string(s3) from t1;
+-------------------+
| weight_string(s3) |
+-------------------+
| 11                |
| 12                |
| 2                 |
+-------------------+
select * from t1 where s1 in (weight_string(s3));
+------+------+------+------+------+
| s1   | s2   | s3   | s4   | s5   |
+------+------+------+------+------+
+------+------+------+------+------+
Warnings:
Warning	1292	Truncated incorrect DECIMAL value: '11'
Warning	1292	Truncated incorrect DECIMAL value: '12'
Warning	1292	Truncated incorrect DECIMAL value: '2'
select * from t1 where s1 in (weight_string(s1),2,3);
+------+--------+------------+------+------+
| s1   | s2     | s3         | s4   | s5   |
+------+--------+------------+------+------+
|    2 | 西郊   | 12         | 1124 | 1    |
+------+--------+------------+------+------+
select * from t1 where s1 in (weight_string(s3),2,3);
+------+--------+------------+------+------+
| s1   | s2     | s3         | s4   | s5   |
+------+--------+------------+------+------+
|    2 | 西郊   | 12         | 1124 | 1    |
+------+--------+------------+------+------+
Warnings:
Warning	1292	Truncated incorrect DECIMAL value: '11'
Warning	1292	Truncated incorrect DECIMAL value: '12'
Warning	1292	Truncated incorrect DECIMAL value: '2'
select * from t1 where s4 in (weight_string(s3));
+------+------+------+------+------+
| s1   | s2   | s3   | s4   | s5   |
+------+------+------+------+------+
+------+------+------+------+------+
select * from t1 where s4 in (weight_string(s1),2,3);
+------+------+------------+------+------+
| s1   | s2   | s3         | s4   | s5   |
+------+------+------------+------+------+
|   11 |      | 2          | 2    | 2    |
+------+------+------------+------+------+
select * from t1 where s4 in (weight_string(s3),2,3);
+------+------+------------+------+------+
| s1   | s2   | s3         | s4   | s5   |
+------+------+------------+------+------+
|   11 |      | 2          | 2    | 2    |
+------+------+------------+------+------+
select * from t1 where s1 not in (weight_string(s3));
+------+--------+------------+--------+------+
| s1   | s2     | s3         | s4     | s5   |
+------+--------+------------+--------+------+
|    1 | 李华   | 11         | 112545 | 1,2  |
|    2 | 西郊   | 12         | 1124   | 1    |
|   11 |        | 2          | 2      | 2    |
+------+--------+------------+--------+------+
Warnings:
Warning	1292	Truncated incorrect DECIMAL value: '11'
Warning	1292	Truncated incorrect DECIMAL value: '12'
Warning	1292	Truncated incorrect DECIMAL value: '2'
select * from t1 where s1 not in (weight_string(s1),2,3);
+------+------+------+------+------+
| s1   | s2   | s3   | s4   | s5   |
+------+------+------+------+------+
+------+------+------+------+------+
select * from t1 where s1 not in  (weight_string(s3),2,3);
+------+--------+------------+--------+------+
| s1   | s2     | s3         | s4     | s5   |
+------+--------+------------+--------+------+
|    1 | 李华   | 11         | 112545 | 1,2  |
|   11 |        | 2          | 2      | 2    |
+------+--------+------------+--------+------+
Warnings:
Warning	1292	Truncated incorrect DECIMAL value: '11'
Warning	1292	Truncated incorrect DECIMAL value: '12'
Warning	1292	Truncated incorrect DECIMAL value: '2'
select * from t1 where s4 not in (weight_string(s3));
+------+--------+------------+--------+------+
| s1   | s2     | s3         | s4     | s5   |
+------+--------+------------+--------+------+
|    1 | 李华   | 11         | 112545 | 1,2  |
|    2 | 西郊   | 12         | 1124   | 1    |
|   11 |        | 2          | 2      | 2    |
+------+--------+------------+--------+------+
select * from t1 where s4 not in (weight_string(s1),2,3);
+------+------+------+------+------+
| s1   | s2   | s3   | s4   | s5   |
+------+------+------+------+------+
+------+------+------+------+------+
select * from t1 where s4 not in  (weight_string(s3),2,3);
+------+--------+------------+--------+------+
| s1   | s2     | s3         | s4     | s5   |
+------+--------+------------+--------+------+
|    1 | 李华   | 11         | 112545 | 1,2  |
|    2 | 西郊   | 12         | 1124   | 1    |
+------+--------+------------+--------+------+
#and
drop table t1;
create table t1 (s1 int,s2 varchar(20),s3 binary(10),s4 blob(30),s5 set('1','2')) default charset=gbk collate=gbk_chinese_ci;
insert into t1 values (1,'李华',11,112545,3);
insert into t1 values (2,'西郊',12,1124,1);
insert into t1 values(11,'',2,2,2);
select * from t1 where weight_string(s3)=2 and weight_string(s4) =2;
+------+------+------------+------+------+
| s1   | s2   | s3         | s4   | s5   |
+------+------+------------+------+------+
|   11 |      | 2          | 2    | 2    |
+------+------+------------+------+------+
Warnings:
Warning	1292	Truncated incorrect DECIMAL value: '11'
Warning	1292	Truncated incorrect DECIMAL value: '12'
Warning	1292	Truncated incorrect DECIMAL value: '2'
select * from t1 where weight_string(s3)=2 and weight_string(s4) is null;
+------+------+------+------+------+
| s1   | s2   | s3   | s4   | s5   |
+------+------+------+------+------+
+------+------+------+------+------+
select * from t1 where weight_string(s3)=s1 and weight_string(s4) =s4;
+------+------+------+------+------+
| s1   | s2   | s3   | s4   | s5   |
+------+------+------+------+------+
+------+------+------+------+------+
Warnings:
Warning	1292	Truncated incorrect DECIMAL value: '11'
Warning	1292	Truncated incorrect DECIMAL value: '12'
Warning	1292	Truncated incorrect DECIMAL value: '2'
#or
drop table t1;
create table t1 (s1 int,s2 varchar(20),s3 binary(10),s4 blob(30),s5 set('1','2')) default charset=gbk collate=gbk_chinese_ci;
insert into t1 values (1,'李华',11,112545,3);
insert into t1 values (2,'西郊',12,1124,1);
insert into t1 values(11,'',2,2,2);
select * from t1 where weight_string(s3)=2 or weight_string(s4) =2;
+------+------+------------+------+------+
| s1   | s2   | s3         | s4   | s5   |
+------+------+------------+------+------+
|   11 |      | 2          | 2    | 2    |
+------+------+------------+------+------+
Warnings:
Warning	1292	Truncated incorrect DECIMAL value: '11'
Warning	1292	Truncated incorrect DECIMAL value: '12'
Warning	1292	Truncated incorrect DECIMAL value: '2'
select * from t1 where weight_string(s3)=2 or weight_string(s4) is null;
+------+------+------------+------+------+
| s1   | s2   | s3         | s4   | s5   |
+------+------+------------+------+------+
|   11 |      | 2          | 2    | 2    |
+------+------+------------+------+------+
Warnings:
Warning	1292	Truncated incorrect DECIMAL value: '11'
Warning	1292	Truncated incorrect DECIMAL value: '12'
Warning	1292	Truncated incorrect DECIMAL value: '2'
select * from t1 where weight_string(s2)=2 or weight_string(s4) =2;
+------+------+------------+------+------+
| s1   | s2   | s3         | s4   | s5   |
+------+------+------------+------+------+
|   11 |      | 2          | 2    | 2    |
+------+------+------------+------+------+
Warnings:
Warning	1292	Truncated incorrect DECIMAL value: '�M�6'
Warning	1292	Truncated incorrect DECIMAL value: 'µ��'
select * from t1 where weight_string(s3)=s1 or weight_string(s4) =s4;
+------+--------+------------+--------+------+
| s1   | s2     | s3         | s4     | s5   |
+------+--------+------------+--------+------+
|    1 | 李华   | 11         | 112545 | 1,2  |
|    2 | 西郊   | 12         | 1124   | 1    |
|   11 |        | 2          | 2      | 2    |
+------+--------+------------+--------+------+
Warnings:
Warning	1292	Truncated incorrect DECIMAL value: '11'
Warning	1292	Truncated incorrect DECIMAL value: '12'
Warning	1292	Truncated incorrect DECIMAL value: '2'
#is null
drop table t1;
create table t1 (s1 int,s2 char(20),s3 binary(10),s4 blob(30),s5 set('1','2')) default charset=gbk collate=gbk_chinese_ci;
insert into t1 values (1,'李华',11,112545,3);
insert into t1 values (2,'西郊',12,1124,1);
insert into t1 values(11,'',2,2,2);
select * from t1 where weight_string(s1) is null;
+------+--------+------------+--------+------+
| s1   | s2     | s3         | s4     | s5   |
+------+--------+------------+--------+------+
|    1 | 李华   | 11         | 112545 | 1,2  |
|    2 | 西郊   | 12         | 1124   | 1    |
|   11 |        | 2          | 2      | 2    |
+------+--------+------------+--------+------+
select * from t1 where weight_string(s2) is null;
+------+------+------+------+------+
| s1   | s2   | s3   | s4   | s5   |
+------+------+------+------+------+
+------+------+------+------+------+
select * from t1 where weight_string(s3) is null;
+------+------+------+------+------+
| s1   | s2   | s3   | s4   | s5   |
+------+------+------+------+------+
+------+------+------+------+------+
select * from t1 where weight_string(s4) is null;
+------+------+------+------+------+
| s1   | s2   | s3   | s4   | s5   |
+------+------+------+------+------+
+------+------+------+------+------+
select * from t1 where weight_string(s5) is null;
+------+------+------+------+------+
| s1   | s2   | s3   | s4   | s5   |
+------+------+------+------+------+
+------+------+------+------+------+
select * from t1 where weight_string(s1) is not null;
+------+------+------+------+------+
| s1   | s2   | s3   | s4   | s5   |
+------+------+------+------+------+
+------+------+------+------+------+
select * from t1 where weight_string(s2) is not null;
+------+--------+------------+--------+------+
| s1   | s2     | s3         | s4     | s5   |
+------+--------+------------+--------+------+
|    1 | 李华   | 11         | 112545 | 1,2  |
|    2 | 西郊   | 12         | 1124   | 1    |
|   11 |        | 2          | 2      | 2    |
+------+--------+------------+--------+------+
select * from t1 where weight_string(s3) is not null;
+------+--------+------------+--------+------+
| s1   | s2     | s3         | s4     | s5   |
+------+--------+------------+--------+------+
|    1 | 李华   | 11         | 112545 | 1,2  |
|    2 | 西郊   | 12         | 1124   | 1    |
|   11 |        | 2          | 2      | 2    |
+------+--------+------------+--------+------+
select * from t1 where weight_string(s4) is not null;
+------+--------+------------+--------+------+
| s1   | s2     | s3         | s4     | s5   |
+------+--------+------------+--------+------+
|    1 | 李华   | 11         | 112545 | 1,2  |
|    2 | 西郊   | 12         | 1124   | 1    |
|   11 |        | 2          | 2      | 2    |
+------+--------+------------+--------+------+
select * from t1 where weight_string(s5) is not null;
+------+--------+------------+--------+------+
| s1   | s2     | s3         | s4     | s5   |
+------+--------+------------+--------+------+
|    1 | 李华   | 11         | 112545 | 1,2  |
|    2 | 西郊   | 12         | 1124   | 1    |
|   11 |        | 2          | 2      | 2    |
+------+--------+------------+--------+------+
#函数运算
drop table t1;
create table t1 (s1 int,s2 char(20),s3 binary(10),s4 blob(30),s5 set('1','2')) default charset=gbk collate=gbk_chinese_ci;
insert into t1 values (1,'李华',11,112545,3);
insert into t1 values (2,'西郊',12,1124,1);
insert into t1 values(11,'2',2,2,2);
insert into t1 values(4,'2',1,1,1);
select * from t1 where weight_string(s1)+weight_string(s3) is null;
+------+--------+------------+--------+------+
| s1   | s2     | s3         | s4     | s5   |
+------+--------+------------+--------+------+
|    1 | 李华   | 11         | 112545 | 1,2  |
|    2 | 西郊   | 12         | 1124   | 1    |
|    4 | 2      | 1          | 1      | 1    |
|   11 | 2      | 2          | 2      | 2    |
+------+--------+------------+--------+------+
Warnings:
Warning	1292	Truncated incorrect DOUBLE value: '11'
Warning	1292	Truncated incorrect DOUBLE value: '12'
Warning	1292	Truncated incorrect DOUBLE value: '2'
Warning	1292	Truncated incorrect DOUBLE value: '1'
select * from t1 where weight_string(s1)+weight_string(s3) =5;
+------+------+------+------+------+
| s1   | s2   | s3   | s4   | s5   |
+------+------+------+------+------+
+------+------+------+------+------+
Warnings:
Warning	1292	Truncated incorrect DOUBLE value: '11'
Warning	1292	Truncated incorrect DOUBLE value: '12'
Warning	1292	Truncated incorrect DOUBLE value: '2'
Warning	1292	Truncated incorrect DOUBLE value: '1'
select * from t1 where weight_string(s2)+weight_string(s4) = 4;
+------+------+------------+------+------+
| s1   | s2   | s3         | s4   | s5   |
+------+------+------------+------+------+
|   11 | 2    | 2          | 2    | 2    |
+------+------+------------+------+------+
Warnings:
Warning	1292	Truncated incorrect DOUBLE value: '�M�6'
Warning	1292	Truncated incorrect DOUBLE value: 'µ��'
select * from t1 where weight_string(s3)+weight_string(s4) = 4;
+------+------+------------+------+------+
| s1   | s2   | s3         | s4   | s5   |
+------+------+------------+------+------+
|   11 | 2    | 2          | 2    | 2    |
+------+------+------------+------+------+
Warnings:
Warning	1292	Truncated incorrect DOUBLE value: '11'
Warning	1292	Truncated incorrect DOUBLE value: '12'
Warning	1292	Truncated incorrect DOUBLE value: '2'
Warning	1292	Truncated incorrect DOUBLE value: '1'
select * from t1 where s1=weight_string(s3)+weight_string(s4);
+------+------+------+------+------+
| s1   | s2   | s3   | s4   | s5   |
+------+------+------+------+------+
+------+------+------+------+------+
Warnings:
Warning	1292	Truncated incorrect DOUBLE value: '11'
Warning	1292	Truncated incorrect DOUBLE value: '12'
Warning	1292	Truncated incorrect DOUBLE value: '2'
Warning	1292	Truncated incorrect DOUBLE value: '1'
#like
drop table t1;
create table t1 (s1 int,s2 char(20),s3 binary(10),s4 blob(30),s5 set('1','2')) default charset=gbk collate=gbk_chinese_ci;
insert into t1 values (1,'李华',11,112545,3);
insert into t1 values (2,'西郊',12,1124,1);
insert into t1 values(11,'2',2,2,2);
insert into t1 values(4,'2',1,1,1);
select * from t1 where weight_string(s1) like '%u%';
+------+------+------+------+------+
| s1   | s2   | s3   | s4   | s5   |
+------+------+------+------+------+
+------+------+------+------+------+
select * from t1 where weight_string(s3) like '%2%';
+------+--------+------------+------+------+
| s1   | s2     | s3         | s4   | s5   |
+------+--------+------------+------+------+
|    2 | 西郊   | 12         | 1124 | 1    |
|   11 | 2      | 2          | 2    | 2    |
+------+--------+------------+------+------+
select * from t1 where weight_string(s2) like '%2%';
+------+------+------------+------+------+
| s1   | s2   | s3         | s4   | s5   |
+------+------+------------+------+------+
|    4 | 2    | 1          | 1    | 1    |
|   11 | 2    | 2          | 2    | 2    |
+------+------+------------+------+------+
select * from t1 where weight_string(s4) like '%2%';
+------+--------+------------+--------+------+
| s1   | s2     | s3         | s4     | s5   |
+------+--------+------------+--------+------+
|    1 | 李华   | 11         | 112545 | 1,2  |
|    2 | 西郊   | 12         | 1124   | 1    |
|   11 | 2      | 2          | 2      | 2    |
+------+--------+------------+--------+------+
select * from t1 where weight_string(s5) like '%2%';
+------+--------+------------+--------+------+
| s1   | s2     | s3         | s4     | s5   |
+------+--------+------------+--------+------+
|    1 | 李华   | 11         | 112545 | 1,2  |
|   11 | 2      | 2          | 2      | 2    |
+------+--------+------------+--------+------+
#exists
drop table t1;
create table t1 (s1 int,s2 char(20),s3 binary(10),s4 blob(30),s5 set('1','2')) default charset=gbk collate=gbk_chinese_ci;
insert into t1 values (1,'李华',11,112545,3);
insert into t1 values (2,'西郊',12,1124,1);
insert into t1 values(11,'2',2,2,2);
insert into t1 values(4,'2',1,1,1);
select * from t1 where exists (select weight_string(s1),weight_string(s3));
+------+--------+------------+--------+------+
| s1   | s2     | s3         | s4     | s5   |
+------+--------+------------+--------+------+
|    1 | 李华   | 11         | 112545 | 1,2  |
|    2 | 西郊   | 12         | 1124   | 1    |
|    4 | 2      | 1          | 1      | 1    |
|   11 | 2      | 2          | 2      | 2    |
+------+--------+------------+--------+------+
select * from t1 where exists (select weight_string(s1)  where weight_string(s1) is not null);
+------+------+------+------+------+
| s1   | s2   | s3   | s4   | s5   |
+------+------+------+------+------+
+------+------+------+------+------+
select * from t1 where exists (select weight_string(s1)  where weight_string(s3)=2);
+------+------+------------+------+------+
| s1   | s2   | s3         | s4   | s5   |
+------+------+------------+------+------+
|   11 | 2    | 2          | 2    | 2    |
+------+------+------------+------+------+
Warnings:
Warning	1292	Truncated incorrect DECIMAL value: '11'
Warning	1292	Truncated incorrect DECIMAL value: '12'
Warning	1292	Truncated incorrect DECIMAL value: '2'
Warning	1292	Truncated incorrect DECIMAL value: '1'
select * from t1 where exists (select weight_string(s2) from t1 limit 1,1);
+------+--------+------------+--------+------+
| s1   | s2     | s3         | s4     | s5   |
+------+--------+------------+--------+------+
|    1 | 李华   | 11         | 112545 | 1,2  |
|    2 | 西郊   | 12         | 1124   | 1    |
|    4 | 2      | 1          | 1      | 1    |
|   11 | 2      | 2          | 2      | 2    |
+------+--------+------------+--------+------+
#any
drop table t1;
create table t1 (s1 int,s2 char(20),s3 binary(10),s4 blob(30),s5 set('1','2')) default charset=gbk collate=gbk_chinese_ci;
insert into t1 values (1,'李华',11,112545,3);
insert into t1 values (2,'西郊',12,1124,1);
insert into t1 values(11,'2',2,2,2);
insert into t1 values(4,'2',1,1,1);
select * from t1 where weight_string(s4) >=any(select weight_string(s1) from t1) ;
+------+------+------+------+------+
| s1   | s2   | s3   | s4   | s5   |
+------+------+------+------+------+
+------+------+------+------+------+
select * from t1 where weight_string(s4) >=any(select weight_string(s2) from t1) ;
+------+------+------------+------+------+
| s1   | s2   | s3         | s4   | s5   |
+------+------+------------+------+------+
|   11 | 2    | 2          | 2    | 2    |
+------+------+------------+------+------+
select * from t1 where weight_string(s4) >=any(select weight_string(s3) from t1) ;
+------+--------+------------+--------+------+
| s1   | s2     | s3         | s4     | s5   |
+------+--------+------------+--------+------+
|    1 | 李华   | 11         | 112545 | 1,2  |
|    2 | 西郊   | 12         | 1124   | 1    |
|   11 | 2      | 2          | 2      | 2    |
+------+--------+------------+--------+------+
select * from t1 where weight_string(s4) >=any(select weight_string(s4) from t1) ;
+------+--------+------------+--------+------+
| s1   | s2     | s3         | s4     | s5   |
+------+--------+------------+--------+------+
|    1 | 李华   | 11         | 112545 | 1,2  |
|    2 | 西郊   | 12         | 1124   | 1    |
|    4 | 2      | 1          | 1      | 1    |
|   11 | 2      | 2          | 2      | 2    |
+------+--------+------------+--------+------+
select * from t1 where weight_string(s4) >=any(select weight_string(s5) from t1) ;
+------+--------+------------+--------+------+
| s1   | s2     | s3         | s4     | s5   |
+------+--------+------------+--------+------+
|    1 | 李华   | 11         | 112545 | 1,2  |
|    2 | 西郊   | 12         | 1124   | 1    |
|    4 | 2      | 1          | 1      | 1    |
|   11 | 2      | 2          | 2      | 2    |
+------+--------+------------+--------+------+
select * from t1 where weight_string(s2) >=any(select weight_string(s1) from t1) ;
+------+------+------+------+------+
| s1   | s2   | s3   | s4   | s5   |
+------+------+------+------+------+
+------+------+------+------+------+
select * from t1 where weight_string(s2) >=any(select weight_string(s2) from t1) ;
+------+--------+------------+--------+------+
| s1   | s2     | s3         | s4     | s5   |
+------+--------+------------+--------+------+
|    1 | 李华   | 11         | 112545 | 1,2  |
|    2 | 西郊   | 12         | 1124   | 1    |
|    4 | 2      | 1          | 1      | 1    |
|   11 | 2      | 2          | 2      | 2    |
+------+--------+------------+--------+------+
select * from t1 where weight_string(s2) >=any(select weight_string(s3) from t1) ;
+------+--------+------------+--------+------+
| s1   | s2     | s3         | s4     | s5   |
+------+--------+------------+--------+------+
|    1 | 李华   | 11         | 112545 | 1,2  |
|    2 | 西郊   | 12         | 1124   | 1    |
|    4 | 2      | 1          | 1      | 1    |
|   11 | 2      | 2          | 2      | 2    |
+------+--------+------------+--------+------+
select * from t1 where weight_string(s2) >=any(select weight_string(s4) from t1) ;
+------+--------+------------+--------+------+
| s1   | s2     | s3         | s4     | s5   |
+------+--------+------------+--------+------+
|    1 | 李华   | 11         | 112545 | 1,2  |
|    2 | 西郊   | 12         | 1124   | 1    |
|    4 | 2      | 1          | 1      | 1    |
|   11 | 2      | 2          | 2      | 2    |
+------+--------+------------+--------+------+
select * from t1 where weight_string(s2) >=any(select weight_string(s5) from t1) ;
+------+--------+------------+--------+------+
| s1   | s2     | s3         | s4     | s5   |
+------+--------+------------+--------+------+
|    1 | 李华   | 11         | 112545 | 1,2  |
|    2 | 西郊   | 12         | 1124   | 1    |
|    4 | 2      | 1          | 1      | 1    |
|   11 | 2      | 2          | 2      | 2    |
+------+--------+------------+--------+------+
#all
drop table t1;
create table t1 (s1 int,s2 char(20),s3 binary(10),s4 blob(30),s5 set('1','2')) default charset=gbk collate=gbk_chinese_ci;
insert into t1 values (1,'李华',11,112545,3);
insert into t1 values (2,'西郊',12,1124,1);
insert into t1 values(11,'2',2,2,2);
insert into t1 values(4,'2',1,1,1);
select * from t1 where weight_string(s4) >=all(select weight_string(s1) from t1) ;
+------+------+------+------+------+
| s1   | s2   | s3   | s4   | s5   |
+------+------+------+------+------+
+------+------+------+------+------+
select * from t1 where weight_string(s4) >=all(select weight_string(s2) from t1) ;
+------+------+------+------+------+
| s1   | s2   | s3   | s4   | s5   |
+------+------+------+------+------+
+------+------+------+------+------+
select * from t1 where weight_string(s4) >=all(select weight_string(s3) from t1) ;
+------+------+------+------+------+
| s1   | s2   | s3   | s4   | s5   |
+------+------+------+------+------+
+------+------+------+------+------+
select * from t1 where weight_string(s4) >=all(select weight_string(s4) from t1) ;
+------+------+------------+------+------+
| s1   | s2   | s3         | s4   | s5   |
+------+------+------------+------+------+
|   11 | 2    | 2          | 2    | 2    |
+------+------+------------+------+------+
select * from t1 where weight_string(s4) >=all(select weight_string(s5) from t1) ;
+------+------+------------+------+------+
| s1   | s2   | s3         | s4   | s5   |
+------+------+------------+------+------+
|   11 | 2    | 2          | 2    | 2    |
+------+------+------------+------+------+
select * from t1 where weight_string(s2) >=all(select weight_string(s1) from t1) ;
+------+------+------+------+------+
| s1   | s2   | s3   | s4   | s5   |
+------+------+------+------+------+
+------+------+------+------+------+
select * from t1 where weight_string(s2) >=all(select weight_string(s2) from t1) ;
+------+--------+------------+------+------+
| s1   | s2     | s3         | s4   | s5   |
+------+--------+------------+------+------+
|    2 | 西郊   | 12         | 1124 | 1    |
+------+--------+------------+------+------+
select * from t1 where weight_string(s2) >=all(select weight_string(s3) from t1) ;
+------+--------+------------+--------+------+
| s1   | s2     | s3         | s4     | s5   |
+------+--------+------------+--------+------+
|    1 | 李华   | 11         | 112545 | 1,2  |
|    2 | 西郊   | 12         | 1124   | 1    |
+------+--------+------------+--------+------+
select * from t1 where weight_string(s2) >=all(select weight_string(s4) from t1) ;
+------+--------+------------+--------+------+
| s1   | s2     | s3         | s4     | s5   |
+------+--------+------------+--------+------+
|    1 | 李华   | 11         | 112545 | 1,2  |
|    2 | 西郊   | 12         | 1124   | 1    |
|    4 | 2      | 1          | 1      | 1    |
|   11 | 2      | 2          | 2      | 2    |
+------+--------+------------+--------+------+
select * from t1 where weight_string(s2) >=all(select weight_string(s5) from t1) ;
+------+--------+------------+--------+------+
| s1   | s2     | s3         | s4     | s5   |
+------+--------+------------+--------+------+
|    1 | 李华   | 11         | 112545 | 1,2  |
|    2 | 西郊   | 12         | 1124   | 1    |
|    4 | 2      | 1          | 1      | 1    |
|   11 | 2      | 2          | 2      | 2    |
+------+--------+------------+--------+------+
#limit
drop table t1;
create table t1 (s1 int,s2 char(20),s3 binary(10),s4 blob(30),s5 set('1','2')) 
default charset=gbk collate=gbk_chinese_ci;
insert into t1 values (1,'李华',11,112545,3);
insert into t1 values (2,'西郊',12,1124,1);
insert into t1 values(11,'2',2,2,2);
insert into t1 values(4,'2',1,1,1);
select weight_string(s1 level  1 desc reverse) from t1 order by 1 limit 1,3;
+-----------------------------------------+
| weight_string(s1 level  1 desc reverse) |
+-----------------------------------------+
| NULL                                    |
| NULL                                    |
| NULL                                    |
+-----------------------------------------+
select weight_string(s2 level  1 desc reverse) from t1 order by 1 limit 1,3;
+-----------------------------------------+
| weight_string(s2 level  1 desc reverse) |
+-----------------------------------------+
| �e�Y                                      |
| �                                        |
| �                                        |
+-----------------------------------------+
select weight_string(s3 level  1 desc reverse) from t1 order by 1 limit 1,3;
+-----------------------------------------+
| weight_string(s3 level  1 desc reverse) |
+-----------------------------------------+
| ����������                                        |
| ����������                                        |
| ����������                                        |
+-----------------------------------------+
select weight_string(s4 level  1 desc reverse) from t1 order by 1 limit 1,3;
+-----------------------------------------+
| weight_string(s4 level  1 desc reverse) |
+-----------------------------------------+
| ����                                        |
| �                                        |
| �                                        |
+-----------------------------------------+
select weight_string(s5 level  1 desc reverse) from t1 order by 1 limit 1,3;
+-----------------------------------------+
| weight_string(s5 level  1 desc reverse) |
+-----------------------------------------+
| ���                                        |
| �                                        |
| �                                        |
+-----------------------------------------+
select weight_string(s1) from t1 order by 1 limit 1,3;
+-------------------+
| weight_string(s1) |
+-------------------+
| NULL              |
| NULL              |
| NULL              |
+-------------------+
select weight_string(s2) from t1 order by 1 limit 1,3;
+-------------------+
| weight_string(s2) |
+-------------------+
| 2                 |
| �M�6                |
| µ��                 |
+-------------------+
select weight_string(s3) from t1 order by 1 limit 1,3;
+-------------------+
| weight_string(s3) |
+-------------------+
| 11                |
| 12                |
| 2                 |
+-------------------+
select weight_string(s4) from t1 order by 1 limit 1,3;
+-------------------+
| weight_string(s4) |
+-------------------+
| 1124              |
| 112545            |
| 2                 |
+-------------------+
select weight_string(s5) from t1 order by 1 limit 1,3;
+-------------------+
| weight_string(s5) |
+-------------------+
| 1                 |
| 1,2               |
| 2                 |
+-------------------+
select distinct(weight_string(s1)) from t1 order by 1 limit 1,3;
+---------------------+
| (weight_string(s1)) |
+---------------------+
+---------------------+
select distinct(weight_string(s2)) from t1 order by 1 limit 1,3;
+---------------------+
| (weight_string(s2)) |
+---------------------+
| �M�6                  |
| µ��                   |
+---------------------+
select distinct(weight_string(s3)) from t1 order by 1 limit 1,3;
+---------------------+
| (weight_string(s3)) |
+---------------------+
| 11                  |
| 12                  |
| 2                   |
+---------------------+
select distinct(weight_string(s4)) from t1 order by 1 limit 1,3;
+---------------------+
| (weight_string(s4)) |
+---------------------+
| 1124                |
| 112545              |
| 2                   |
+---------------------+
select distinct(weight_string(s5)) from t1 order by 1 limit 1,3;
+---------------------+
| (weight_string(s5)) |
+---------------------+
| 1,2                 |
| 2                   |
+---------------------+
select weight_string(s1) from t1 order by weight_string(s1) limit 1,3;
+-------------------+
| weight_string(s1) |
+-------------------+
| NULL              |
| NULL              |
| NULL              |
+-------------------+
select weight_string(s2) from t1 order by weight_string(s2) limit 1,3;
+-------------------+
| weight_string(s2) |
+-------------------+
| 2                 |
| �M�6                |
| µ��                 |
+-------------------+
select weight_string(s3) from t1 order by weight_string(s3) limit 1,3;
+-------------------+
| weight_string(s3) |
+-------------------+
| 11                |
| 12                |
| 2                 |
+-------------------+
select weight_string(s4) from t1 order by weight_string(s4) limit 1,3;
+-------------------+
| weight_string(s4) |
+-------------------+
| 1124              |
| 112545            |
| 2                 |
+-------------------+
select weight_string(s5) from t1 order by weight_string(s5) limit 1,3;
+-------------------+
| weight_string(s5) |
+-------------------+
| 1                 |
| 1,2               |
| 2                 |
+-------------------+
select weight_string(s1) from t1 group by weight_string(s1) order by 1 limit 1,3;
+-------------------+
| weight_string(s1) |
+-------------------+
+-------------------+
select weight_string(s2) from t1 group by weight_string(s2) order by 1 limit 1,3;
+-------------------+
| weight_string(s2) |
+-------------------+
| �M�6                |
| µ��                 |
+-------------------+
select weight_string(s3) from t1 group by weight_string(s3) order by 1 limit 1,3;
+-------------------+
| weight_string(s3) |
+-------------------+
| 11                |
| 12                |
| 2                 |
+-------------------+
select weight_string(s4) from t1 group by weight_string(s4) order by 1 limit 1,3;
+-------------------+
| weight_string(s4) |
+-------------------+
| 1124              |
| 112545            |
| 2                 |
+-------------------+
select weight_string(s5) from t1 group by weight_string(s5) order by 1 limit 1,3;
+-------------------+
| weight_string(s5) |
+-------------------+
| 1,2               |
| 2                 |
+-------------------+
#order by
drop table t1;
create table t1 (s1 int,s2 char(20),s3 binary(10),s4 blob(30),s5 set('1','2')) 
default charset=gbk collate=gbk_chinese_ci;
insert into t1 values (1,'李华',11,112545,3);
insert into t1 values (2,'西郊',12,1124,1);
insert into t1 values(11,'2',2,2,2);
insert into t1 values(4,'2',1,1,1);
select weight_string(s1) from t1 order by weight_string(s1 level  1 desc reverse);
+-------------------+
| weight_string(s1) |
+-------------------+
| NULL              |
| NULL              |
| NULL              |
| NULL              |
+-------------------+
select weight_string(s2) from t1 order by weight_string(s2 level  1 desc reverse);
+-------------------+
| weight_string(s2) |
+-------------------+
| 2                 |
| 2                 |
| �M�6                |
| µ��                 |
+-------------------+
select weight_string(s3) from t1 order by weight_string(s3 level  1 desc reverse);
+-------------------+
| weight_string(s3) |
+-------------------+
| 1                 |
| 11                |
| 12                |
| 2                 |
+-------------------+
select weight_string(s4) from t1 order by weight_string(s4 level  1 desc reverse);
+-------------------+
| weight_string(s4) |
+-------------------+
| 1                 |
| 1124              |
| 112545            |
| 2                 |
+-------------------+
select weight_string(s5) from t1 order by weight_string(s5 level  1 desc reverse);
+-------------------+
| weight_string(s5) |
+-------------------+
| 1                 |
| 1                 |
| 1,2               |
| 2                 |
+-------------------+
select distinct(weight_string(s1)) from t1 order by weight_string(s1);
+---------------------+
| (weight_string(s1)) |
+---------------------+
| NULL                |
+---------------------+
select distinct(weight_string(s2)) from t1 order by weight_string(s2);
+---------------------+
| (weight_string(s2)) |
+---------------------+
| 2                   |
| �M�6                  |
| µ��                   |
+---------------------+
select distinct(weight_string(s3)) from t1 order by weight_string(s3);
+---------------------+
| (weight_string(s3)) |
+---------------------+
| 1                   |
| 11                  |
| 12                  |
| 2                   |
+---------------------+
select distinct(weight_string(s4)) from t1 order by weight_string(s4);
+---------------------+
| (weight_string(s4)) |
+---------------------+
| 1                   |
| 1124                |
| 112545              |
| 2                   |
+---------------------+
select distinct(weight_string(s5)) from t1 order by weight_string(s5);
+---------------------+
| (weight_string(s5)) |
+---------------------+
| 1                   |
| 1,2                 |
| 2                   |
+---------------------+
select * from t1 where s2=2 order by weight_string(s1);
+------+------+------------+------+------+
| s1   | s2   | s3         | s4   | s5   |
+------+------+------------+------+------+
|    4 | 2    | 1          | 1    | 1    |
|   11 | 2    | 2          | 2    | 2    |
+------+------+------------+------+------+
Warnings:
Warning	1292	Truncated incorrect DECIMAL value: '李华'
Warning	1292	Truncated incorrect DECIMAL value: '西郊'
select * from t1 where s2=2 order by weight_string(s2);
+------+------+------------+------+------+
| s1   | s2   | s3         | s4   | s5   |
+------+------+------------+------+------+
|    4 | 2    | 1          | 1    | 1    |
|   11 | 2    | 2          | 2    | 2    |
+------+------+------------+------+------+
Warnings:
Warning	1292	Truncated incorrect DECIMAL value: '李华'
Warning	1292	Truncated incorrect DECIMAL value: '西郊'
select * from t1 where s2=2 order by weight_string(s3);
+------+------+------------+------+------+
| s1   | s2   | s3         | s4   | s5   |
+------+------+------------+------+------+
|    4 | 2    | 1          | 1    | 1    |
|   11 | 2    | 2          | 2    | 2    |
+------+------+------------+------+------+
Warnings:
Warning	1292	Truncated incorrect DECIMAL value: '李华'
Warning	1292	Truncated incorrect DECIMAL value: '西郊'
select * from t1 where s2=2 order by weight_string(s4);
+------+------+------------+------+------+
| s1   | s2   | s3         | s4   | s5   |
+------+------+------------+------+------+
|    4 | 2    | 1          | 1    | 1    |
|   11 | 2    | 2          | 2    | 2    |
+------+------+------------+------+------+
Warnings:
Warning	1292	Truncated incorrect DECIMAL value: '李华'
Warning	1292	Truncated incorrect DECIMAL value: '西郊'
select * from t1 where s2=2 order by weight_string(s5);
+------+------+------------+------+------+
| s1   | s2   | s3         | s4   | s5   |
+------+------+------------+------+------+
|    4 | 2    | 1          | 1    | 1    |
|   11 | 2    | 2          | 2    | 2    |
+------+------+------------+------+------+
Warnings:
Warning	1292	Truncated incorrect DECIMAL value: '李华'
Warning	1292	Truncated incorrect DECIMAL value: '西郊'
select * from t1  group by s1 order by weight_string(s1);
+------+--------+------------+--------+------+
| s1   | s2     | s3         | s4     | s5   |
+------+--------+------------+--------+------+
|    1 | 李华   | 11         | 112545 | 1,2  |
|    2 | 西郊   | 12         | 1124   | 1    |
|    4 | 2      | 1          | 1      | 1    |
|   11 | 2      | 2          | 2      | 2    |
+------+--------+------------+--------+------+
select * from t1  group by s2 order by weight_string(s2);
+------+--------+------------+--------+------+
| s1   | s2     | s3         | s4     | s5   |
+------+--------+------------+--------+------+
|    1 | 李华   | 11         | 112545 | 1,2  |
|    2 | 西郊   | 12         | 1124   | 1    |
|   11 | 2      | 2          | 2      | 2    |
+------+--------+------------+--------+------+
select * from t1  group by s3 order by weight_string(s3);
+------+--------+------------+--------+------+
| s1   | s2     | s3         | s4     | s5   |
+------+--------+------------+--------+------+
|    1 | 李华   | 11         | 112545 | 1,2  |
|    2 | 西郊   | 12         | 1124   | 1    |
|    4 | 2      | 1          | 1      | 1    |
|   11 | 2      | 2          | 2      | 2    |
+------+--------+------------+--------+------+
select * from t1  group by s4 order by weight_string(s4);
+------+--------+------------+--------+------+
| s1   | s2     | s3         | s4     | s5   |
+------+--------+------------+--------+------+
|    1 | 李华   | 11         | 112545 | 1,2  |
|    2 | 西郊   | 12         | 1124   | 1    |
|    4 | 2      | 1          | 1      | 1    |
|   11 | 2      | 2          | 2      | 2    |
+------+--------+------------+--------+------+
select * from t1  group by s5 order by weight_string(s5);
+------+--------+------------+--------+------+
| s1   | s2     | s3         | s4     | s5   |
+------+--------+------------+--------+------+
|    1 | 李华   | 11         | 112545 | 1,2  |
|    2 | 西郊   | 12         | 1124   | 1    |
|   11 | 2      | 2          | 2      | 2    |
+------+--------+------------+--------+------+
select weight_string(s1) from t1  group by s1 having max(weight_string(s1))>3;
+-------------------+
| weight_string(s1) |
+-------------------+
+-------------------+
select weight_string(s2) from t1  group by s2 having max(weight_string(s2))>3;
+-------------------+
| weight_string(s2) |
+-------------------+
+-------------------+
Warnings:
Warning	1292	Truncated incorrect DECIMAL value: '�M�6'
Warning	1292	Truncated incorrect DECIMAL value: 'µ��'
select weight_string(s3) from t1  group by s3 having max(weight_string(s3))>3;
+-------------------+
| weight_string(s3) |
+-------------------+
| 11                |
| 12                |
+-------------------+
Warnings:
Warning	1292	Truncated incorrect DECIMAL value: '11'
Warning	1292	Truncated incorrect DECIMAL value: '12'
Warning	1292	Truncated incorrect DECIMAL value: '2'
Warning	1292	Truncated incorrect DECIMAL value: '1'
select weight_string(s4) from t1  group by s4 having max(weight_string(s4))>3;
+-------------------+
| weight_string(s4) |
+-------------------+
| 1124              |
| 112545            |
+-------------------+
select weight_string(s5) from t1  group by s5 having max(weight_string(s5))>3;
+-------------------+
| weight_string(s5) |
+-------------------+
+-------------------+
Warnings:
Warning	1292	Truncated incorrect DECIMAL value: '1,2'
#group by
drop table t1;
create table t1 (s1 int,s2 char(20),s3 binary(10),s4 blob(30),s5 set('1','2')) 
default charset=gbk collate=gbk_chinese_ci;
insert into t1 values (1,'李华',11,112545,3);
insert into t1 values (2,'西郊',12,1124,1);
insert into t1 values(11,'2',2,2,2);
insert into t1 values(4,'2',1,1,1);
insert into t1 values (1,'李华',11,112545,3);
select weight_string(s1) from t1 group by weight_string(s1 level  1 desc reverse);
+-------------------+
| weight_string(s1) |
+-------------------+
| NULL              |
+-------------------+
select weight_string(s2) from t1 group by weight_string(s2 level  1 desc reverse);
+-------------------+
| weight_string(s2) |
+-------------------+
| 2                 |
| �M�6                |
| µ��                 |
+-------------------+
select weight_string(s3) from t1 group by weight_string(s3 level  1 desc reverse);
+-------------------+
| weight_string(s3) |
+-------------------+
| 1                 |
| 11                |
| 12                |
| 2                 |
+-------------------+
select weight_string(s4) from t1 group by weight_string(s4 level  1 desc reverse);
+-------------------+
| weight_string(s4) |
+-------------------+
| 1                 |
| 1124              |
| 112545            |
| 2                 |
+-------------------+
select weight_string(s5) from t1 group by weight_string(s5 level  1 desc reverse);
+-------------------+
| weight_string(s5) |
+-------------------+
| 1                 |
| 1,2               |
| 2                 |
+-------------------+
select distinct(weight_string(s1)) from t1 group by weight_string(s1);
+---------------------+
| (weight_string(s1)) |
+---------------------+
| NULL                |
+---------------------+
select distinct(weight_string(s2)) from t1 group by weight_string(s2);
+---------------------+
| (weight_string(s2)) |
+---------------------+
| 2                   |
| �M�6                  |
| µ��                   |
+---------------------+
select distinct(weight_string(s3)) from t1 group by weight_string(s3);
+---------------------+
| (weight_string(s3)) |
+---------------------+
| 1                   |
| 11                  |
| 12                  |
| 2                   |
+---------------------+
select distinct(weight_string(s4)) from t1 group by weight_string(s4);
+---------------------+
| (weight_string(s4)) |
+---------------------+
| 1                   |
| 1124                |
| 112545              |
| 2                   |
+---------------------+
select distinct(weight_string(s5)) from t1 group by weight_string(s5);
+---------------------+
| (weight_string(s5)) |
+---------------------+
| 1                   |
| 1,2                 |
| 2                   |
+---------------------+
select weight_string(s1) from t1  group by weight_string(s1) having max(weight_string(s1))>3;
+-------------------+
| weight_string(s1) |
+-------------------+
+-------------------+
select weight_string(s2) from t1  group by weight_string(s2) having max(weight_string(s2))=2;
+-------------------+
| weight_string(s2) |
+-------------------+
| 2                 |
+-------------------+
Warnings:
Warning	1292	Truncated incorrect DECIMAL value: '�M�6'
Warning	1292	Truncated incorrect DECIMAL value: 'µ��'
Warning	1292	Truncated incorrect DECIMAL value: '�M�6'
select weight_string(s3) from t1  group by weight_string(s3) having max(weight_string(s3))>3;
+-------------------+
| weight_string(s3) |
+-------------------+
| 11                |
| 12                |
+-------------------+
Warnings:
Warning	1292	Truncated incorrect DECIMAL value: '11'
Warning	1292	Truncated incorrect DECIMAL value: '12'
Warning	1292	Truncated incorrect DECIMAL value: '2'
Warning	1292	Truncated incorrect DECIMAL value: '1'
Warning	1292	Truncated incorrect DECIMAL value: '11'
select weight_string(s4) from t1  group by weight_string(s4) having max(weight_string(s4))>3;
+-------------------+
| weight_string(s4) |
+-------------------+
| 1124              |
| 112545            |
+-------------------+
select weight_string(s5) from t1  group by weight_string(s5) having max(weight_string(s5))>1;
+-------------------+
| weight_string(s5) |
+-------------------+
| 2                 |
+-------------------+
Warnings:
Warning	1292	Truncated incorrect DECIMAL value: '1,2'
Warning	1292	Truncated incorrect DECIMAL value: '1,2'
#case when
drop table t1;
create table t1 (s1 int,s2 char(20),s3 binary(10),s4 blob(30),s5 set('1','2')) 
default charset=gbk collate=gbk_chinese_ci;
insert into t1 values (1,'李华',11,112545,3);
insert into t1 values (2,'西郊',12,1124,1);
insert into t1 values(11,'2',2,2,2);
insert into t1 values(4,'2',1,1,1);
insert into t1 values (1,'李华',11,112545,3);
select case when s3=11 then weight_string(s5) else 0 end from t1 order by s1;
+---------------------------------------------------+
| case when s3=11 then weight_string(s5) else 0 end |
+---------------------------------------------------+
| 0                                                 |
| 0                                                 |
| 0                                                 |
| 1,2                                               |
| 1,2                                               |
+---------------------------------------------------+
Warnings:
Warning	1292	Truncated incorrect DECIMAL value: '11'
Warning	1292	Truncated incorrect DECIMAL value: '11'
Warning	1292	Truncated incorrect DECIMAL value: '12'
Warning	1292	Truncated incorrect DECIMAL value: '1'
Warning	1292	Truncated incorrect DECIMAL value: '2'
select case when weight_string(s3)=1 then 9.99 else weight_string(s3) end from t1 order by s1;
+--------------------------------------------------------------------+
| case when weight_string(s3)=1 then 9.99 else weight_string(s3) end |
+--------------------------------------------------------------------+
| 11                                                                 |
| 11                                                                 |
| 12                                                                 |
| 2                                                                  |
| 9.99                                                               |
+--------------------------------------------------------------------+
Warnings:
Warning	1292	Truncated incorrect DECIMAL value: '11'
Warning	1292	Truncated incorrect DECIMAL value: '11'
Warning	1292	Truncated incorrect DECIMAL value: '12'
Warning	1292	Truncated incorrect DECIMAL value: '1'
Warning	1292	Truncated incorrect DECIMAL value: '2'
select case when weight_string(s3)=concat(weight_string(s3),weight_string(s3)) then 0.75 else weight_string(s3) end from t1 order by s1;
+--------------------------------------------------------------------------------------------------------------+
| case when weight_string(s3)=concat(weight_string(s3),weight_string(s3)) then 0.75 else weight_string(s3) end |
+--------------------------------------------------------------------------------------------------------------+
| 1                                                                                                            |
| 11                                                                                                           |
| 11                                                                                                           |
| 12                                                                                                           |
| 2                                                                                                            |
+--------------------------------------------------------------------------------------------------------------+
select (case weight_string(s3) when 11 then 0.29 when 1 then 9 else 0 end) from t1;
+---------------------------------------------------------------------+
| (case weight_string(s3) when 11 then 0.29 when 1 then 9 else 0 end) |
+---------------------------------------------------------------------+
|                                                                0.00 |
|                                                                0.00 |
|                                                                0.29 |
|                                                                0.29 |
|                                                                9.00 |
+---------------------------------------------------------------------+
Warnings:
Warning	1292	Truncated incorrect DECIMAL value: '11'
Warning	1292	Truncated incorrect DECIMAL value: '12'
Warning	1292	Truncated incorrect DECIMAL value: '2'
Warning	1292	Truncated incorrect DECIMAL value: '1'
Warning	1292	Truncated incorrect DECIMAL value: '11'
Warning	1292	Truncated incorrect DECIMAL value: '12'
Warning	1292	Truncated incorrect DECIMAL value: '2'
Warning	1292	Truncated incorrect DECIMAL value: '1'
select (case s4 when weight_string(s3) then 0.02 when 1 then 'a' else 0 end) from t1;
+-----------------------------------------------------------------------+
| (case s4 when weight_string(s3) then 0.02 when 1 then 'a' else 0 end) |
+-----------------------------------------------------------------------+
| 0                                                                     |
| 0                                                                     |
| 0                                                                     |
| 0                                                                     |
| a                                                                     |
+-----------------------------------------------------------------------+
select (case weight_string(s3) when 11 then 0.29 when 1 then 9 else 0 end) from t1 group by (case weight_string(s3) when 11 then 0.29 when 1 then 9 else 0 end) order by s1;
+---------------------------------------------------------------------+
| (case weight_string(s3) when 11 then 0.29 when 1 then 9 else 0 end) |
+---------------------------------------------------------------------+
|                                                                0.00 |
|                                                                0.29 |
|                                                                9.00 |
+---------------------------------------------------------------------+
Warnings:
Warning	1292	Truncated incorrect DECIMAL value: '11'
Warning	1292	Truncated incorrect DECIMAL value: '12'
Warning	1292	Truncated incorrect DECIMAL value: '2'
Warning	1292	Truncated incorrect DECIMAL value: '1'
Warning	1292	Truncated incorrect DECIMAL value: '11'
Warning	1292	Truncated incorrect DECIMAL value: '12'
Warning	1292	Truncated incorrect DECIMAL value: '2'
Warning	1292	Truncated incorrect DECIMAL value: '1'
#join
drop table t1;
create table t1 (s1 int,s2 char(20),s3 binary(10),s4 blob(30),s5 set('1','2')) 
default charset=gbk collate=gbk_chinese_ci;
insert into t1 values (1,'李华',11,112545,3);
insert into t1 values (2,'西郊',12,1124,1);
insert into t1 values(11,'2',2,2,2);
insert into t1 values(4,'2',1,1,1);
insert into t1 values (1,'李华',11,112545,3);
drop table t2;
create table t2 (s1 int,s2 char(20),s3 binary(10),s4 blob(30),s5 set('1','2')) 
default charset=gb18030 collate=gb18030_chinese_ci;
insert into t2 values (3,'李华',11,112545,3);
insert into t2 values (2,'外链',12,1136,2);
insert into t2 values(11,'2',2,2,2);
insert into t2 values(4,'2',1,1,1);
select weight_string(t1.s1),weight_string(t1.s2),weight_string(t1.s3)+weight_string(t2.s3),weight_string(t1.s5)
 from t1 join t2 on t1.s1=t2.s1 where weight_string(t1.s2)=2;
+----------------------+----------------------+-------------------------------------------+----------------------+
| weight_string(t1.s1) | weight_string(t1.s2) | weight_string(t1.s3)+weight_string(t2.s3) | weight_string(t1.s5) |
+----------------------+----------------------+-------------------------------------------+----------------------+
| NULL                 | 2                    |                                         2 | 1                    |
| NULL                 | 2                    |                                         4 | 2                    |
+----------------------+----------------------+-------------------------------------------+----------------------+
select weight_string(t1.s1),weight_string(t1.s2),weight_string(t1.s3)+weight_string(t2.s3),weight_string(t1.s5)
 from t1 left join t2 on t1.s1=t2.s1;
+----------------------+----------------------+-------------------------------------------+----------------------+
| weight_string(t1.s1) | weight_string(t1.s2) | weight_string(t1.s3)+weight_string(t2.s3) | weight_string(t1.s5) |
+----------------------+----------------------+-------------------------------------------+----------------------+
| NULL                 | 2                    |                                         2 | 1                    |
| NULL                 | 2                    |                                         4 | 2                    |
| NULL                 | �M�6                   |                                      NULL | 1,2                  |
| NULL                 | �M�6                   |                                      NULL | 1,2                  |
| NULL                 | µ��                    |                                        24 | 1                    |
+----------------------+----------------------+-------------------------------------------+----------------------+
select weight_string(t1.s1),weight_string(t1.s2),weight_string(t1.s3)+weight_string(t2.s3),weight_string(t1.s5)
 from t1 right join t2 on t1.s1=t2.s1;
+----------------------+----------------------+-------------------------------------------+----------------------+
| weight_string(t1.s1) | weight_string(t1.s2) | weight_string(t1.s3)+weight_string(t2.s3) | weight_string(t1.s5) |
+----------------------+----------------------+-------------------------------------------+----------------------+
| NULL                 | 2                    |                                         2 | 1                    |
| NULL                 | 2                    |                                         4 | 2                    |
| NULL                 | NULL                 |                                      NULL | NULL                 |
| NULL                 | µ��                    |                                        24 | 1                    |
+----------------------+----------------------+-------------------------------------------+----------------------+
select weight_string(t1.s1),weight_string(t1.s2),weight_string(t1.s3)+weight_string(t2.s3),weight_string(t1.s5)
 from t1 cross join t2 on t1.s1=t2.s1;
+----------------------+----------------------+-------------------------------------------+----------------------+
| weight_string(t1.s1) | weight_string(t1.s2) | weight_string(t1.s3)+weight_string(t2.s3) | weight_string(t1.s5) |
+----------------------+----------------------+-------------------------------------------+----------------------+
| NULL                 | 2                    |                                         2 | 1                    |
| NULL                 | 2                    |                                         4 | 2                    |
| NULL                 | µ��                    |                                        24 | 1                    |
+----------------------+----------------------+-------------------------------------------+----------------------+
#嵌套
drop table t1;
create table t1 (s1 int,s2 char(20),s3 binary(10),s4 blob(30),s5 set('1','2')) default charset=gbk collate=gbk_chinese_ci;
insert into t1 values (1,'李华',11,112545,3);
insert into t1 values (2,'西郊',12,1124,1);
insert into t1 values(11,'2',2,2,2);
insert into t1 values(4,'2',1,1,1);
select * from t1 where s1 in(select weight_string(s2)from t1 );
+------+--------+------------+------+------+
| s1   | s2     | s3         | s4   | s5   |
+------+--------+------------+------+------+
|    2 | 西郊   | 12         | 1124 | 1    |
+------+--------+------------+------+------+
Warnings:
Warning	1292	Truncated incorrect DECIMAL value: '�M�6'
Warning	1292	Truncated incorrect DECIMAL value: 'µ��'
select * from t1 where s1 in(select weight_string(s3)from t1 );
+------+--------+------------+--------+------+
| s1   | s2     | s3         | s4     | s5   |
+------+--------+------------+--------+------+
|    1 | 李华   | 11         | 112545 | 1,2  |
|    2 | 西郊   | 12         | 1124   | 1    |
|   11 | 2      | 2          | 2      | 2    |
+------+--------+------------+--------+------+
Warnings:
Warning	1292	Truncated incorrect DECIMAL value: '11'
Warning	1292	Truncated incorrect DECIMAL value: '12'
Warning	1292	Truncated incorrect DECIMAL value: '2'
Warning	1292	Truncated incorrect DECIMAL value: '1'
select * from t1 where s2 in(select weight_string(s3)from t1 );
+------+------+------+------+------+
| s1   | s2   | s3   | s4   | s5   |
+------+------+------+------+------+
+------+------+------+------+------+
select * from (select weight_string(s1)from t1 )bb;
+-------------------+
| weight_string(s1) |
+-------------------+
| NULL              |
| NULL              |
| NULL              |
| NULL              |
+-------------------+
select * from (select weight_string(s2)from t1 )bb;
+-------------------+
| weight_string(s2) |
+-------------------+
| 2                 |
| 2                 |
| �M�6                |
| µ��                 |
+-------------------+
select * from (select weight_string(s3)from t1 )bb;
+-------------------+
| weight_string(s3) |
+-------------------+
| 1                 |
| 11                |
| 12                |
| 2                 |
+-------------------+
select * from (select weight_string(s4)from t1 )bb;
+-------------------+
| weight_string(s4) |
+-------------------+
| 1                 |
| 1124              |
| 112545            |
| 2                 |
+-------------------+
select * from (select weight_string(s5)from t1 )bb;
+-------------------+
| weight_string(s5) |
+-------------------+
| 1                 |
| 1                 |
| 1,2               |
| 2                 |
+-------------------+
with a as (select weight_string(s2) b from t1) select weight_string(b) from a;
+------------------+
| weight_string(b) |
+------------------+
| 2                |
| 2                |
| �M�6               |
| µ��                |
+------------------+
#union
drop table t1;
create table t1 (s1 int,s2 char(20),s3 binary(10),s4 blob(30),s5 set('1','2')) default charset=gbk collate=gbk_chinese_ci;
insert into t1 values (1,'李华',11,112545,3);
insert into t1 values (2,'西郊',12,1124,1);
insert into t1 values(11,'2',2,2,2);
insert into t1 values(4,'2',1,1,1);
(select weight_string(s1) from t1 )union (select weight_string(s2) from t1);
+-------------------+
| weight_string(s1) |
+-------------------+
| 2                 |
| NULL              |
| �M�6                |
| µ��                 |
+-------------------+
(select weight_string(s2) from t1 )union (select s3 from t1);
+-------------------+
| weight_string(s2) |
+-------------------+
| 1                 |
| 11                |
| 12                |
| 2                 |
| 2                 |
| �M�6                |
| µ��                 |
+-------------------+
(select weight_string(s3) from t1 )union (select 13333 from t1);
+-------------------+
| weight_string(s3) |
+-------------------+
| 1                 |
| 11                |
| 12                |
| 13333             |
| 2                 |
+-------------------+
(select weight_string(s1) from t1 )union all (select weight_string(s2) from t1);
+-------------------+
| weight_string(s1) |
+-------------------+
| 2                 |
| 2                 |
| NULL              |
| NULL              |
| NULL              |
| NULL              |
| �M�6                |
| µ��                 |
+-------------------+
(select weight_string(s2) from t1 )union all (select s3 from t1);
+-------------------+
| weight_string(s2) |
+-------------------+
| 1                 |
| 11                |
| 12                |
| 2                 |
| 2                 |
| 2                 |
| �M�6                |
| µ��                 |
+-------------------+
(select weight_string(s3) from t1 )union all (select 13333 from t1);
+-------------------+
| weight_string(s3) |
+-------------------+
| 1                 |
| 11                |
| 12                |
| 13333             |
| 13333             |
| 13333             |
| 13333             |
| 2                 |
+-------------------+
#insert
drop table t1;
create table t1 (s1 int,s2 char(20),s3 binary(10),s4 blob(30),s5 set('1','2')) default charset=gbk collate=gbk_chinese_ci;
set @b =  cast('3' as binary);
insert into t1 values(weight_string(@b),weight_string(@b),weight_string(@b),weight_string(@b),weight_string(@b));
select * from t1;
+------+------+------------+------+------+
| s1   | s2   | s3         | s4   | s5   |
+------+------+------------+------+------+
|    3 | 3    | 3          | 3    | 1,2  |
+------+------+------------+------+------+
drop table t1;
create table t1 (s1 int,s2 varchar(20),s3 binary(10),s4 blob(30),s5 set('1','2')) default charset=gbk collate=gbk_chinese_ci;
insert into t1 values (1,'李华',11,112545,3);
insert into t1 values (2,'西郊',12,1124,1);
insert into t1 values(11,'2',2,2,2);
insert into t1 values(4,'2',1,1,1);
drop table t2;
create table t2 (s1 int,s2 varchar(20),s3 binary(10),s4 blob(30),s5 set('1','2')) 
default charset=gbk collate=gbk_chinese_ci;
insert into t2(s1,s2,s3,s4,s5) 
select weight_string(s1),weight_string(binary s2),weight_string(s3),weight_string(s4),weight_string(s5) from t1;
select * from t2;
+------+--------+------------+--------+------+
| s1   | s2     | s3         | s4     | s5   |
+------+--------+------------+--------+------+
| NULL | 2      | 1          | 1      | 1    |
| NULL | 2      | 2          | 2      | 2    |
| NULL | 李华   | 11         | 112545 | 1,2  |
| NULL | 西郊   | 12         | 1124   | 1    |
+------+--------+------------+--------+------+
#update
drop table t1;
create table t1 (s1 int,s2 char(20),s3 binary(10),s4 blob(30),s5 set('1','2')) 
default charset=gbk collate=gbk_chinese_ci;
insert into t1 values (1,5,11,112545,3);
insert into t1 values (2,'汉',12,1125,2);
set @b =  cast('3' as binary);
update t1 set s1=(weight_string(@b));
update t1 set s2=(weight_string(@b));
update t1 set s3=(weight_string(@b));
update t1 set s4=(weight_string(@b));
update t1 set s5=(weight_string(@b));
select * from t1;
+------+------+------------+------+------+
| s1   | s2   | s3         | s4   | s5   |
+------+------+------------+------+------+
|    3 | 3    | 3          | 3    | 1,2  |
|    3 | 3    | 3          | 3    | 1,2  |
+------+------+------------+------+------+
update t1 set s1=66 where weight_string(s2)=5;
select * from t1;
+------+------+------------+------+------+
| s1   | s2   | s3         | s4   | s5   |
+------+------+------------+------+------+
|    3 | 3    | 3          | 3    | 1,2  |
|    3 | 3    | 3          | 3    | 1,2  |
+------+------+------------+------+------+
update t1 set s1=77 where weight_string(s3)=11;
Warnings:
Warning	1292	Truncated incorrect DECIMAL value: '3'
Warning	1292	Truncated incorrect DECIMAL value: '3'
select * from t1;
+------+------+------------+------+------+
| s1   | s2   | s3         | s4   | s5   |
+------+------+------------+------+------+
|    3 | 3    | 3          | 3    | 1,2  |
|    3 | 3    | 3          | 3    | 1,2  |
+------+------+------------+------+------+
update t1 set s1=88 where weight_string(s4)=112545;
select * from t1;
+------+------+------------+------+------+
| s1   | s2   | s3         | s4   | s5   |
+------+------+------------+------+------+
|    3 | 3    | 3          | 3    | 1,2  |
|    3 | 3    | 3          | 3    | 1,2  |
+------+------+------------+------+------+
update t1 set s1=99 where weight_string(s5)=2;
Warnings:
Warning	1292	Truncated incorrect DECIMAL value: '1,2'
Warning	1292	Truncated incorrect DECIMAL value: '1,2'
select * from t1;
+------+------+------------+------+------+
| s1   | s2   | s3         | s4   | s5   |
+------+------+------------+------+------+
|    3 | 3    | 3          | 3    | 1,2  |
|    3 | 3    | 3          | 3    | 1,2  |
+------+------+------------+------+------+
drop table t1;
create table t1 (s1 int,s2 char(20),s3 binary(10),s4 blob(30),s5 set('1','2')) 
default charset=gbk collate=gbk_chinese_ci;
insert into t1 values (1,'李华',11,112545,3);
drop table t2;
create table t2 (s1 int,s2 char(20),s3 binary(10),s4 blob(30),s5 set('1','2')) 
default charset=gbk collate=gbk_chinese_ci;
insert into t2 values(4,'2',1,1,1);
update t2 set s1=(select weight_string(s1) from t1);
update t2 set s2=(select weight_string(binary s2) from t1);
update t2 set s3=(select weight_string(s3) from t1);
update t2 set s4=(select weight_string(s4) from t1);
update t2 set s5=(select weight_string(s5) from t1);
select * from t2;
+------+--------+------------+--------+------+
| s1   | s2     | s3         | s4     | s5   |
+------+--------+------------+--------+------+
| NULL | 李华   | 11         | 112545 | 1,2  |
+------+--------+------------+--------+------+
#delete 
drop table t1;
create table t1 (s1 int,s2 char(20),s3 binary(10),s4 blob(30),s5 set('1','2'))
default charset=gbk collate=gbk_chinese_ci;
insert into t1 values (1,'李华',11,112545,3);
insert into t1 values (2,'西郊',12,1124,1);
insert into t1 values(11,'2',2,2,2);
insert into t1 values(4,'2',1,1,1);
insert into t1 values(4,'5',1,1,3);
delete from t1 where weight_string(s2)=2;
Warnings:
Warning	1292	Truncated incorrect DECIMAL value: '�M�6'
Warning	1292	Truncated incorrect DECIMAL value: 'µ��'
select * from t1;
+------+--------+------------+--------+------+
| s1   | s2     | s3         | s4     | s5   |
+------+--------+------------+--------+------+
|    1 | 李华   | 11         | 112545 | 1,2  |
|    2 | 西郊   | 12         | 1124   | 1    |
|    4 | 5      | 1          | 1      | 1,2  |
+------+--------+------------+--------+------+
delete from t1 where weight_string(s3)=12;
Warnings:
Warning	1292	Truncated incorrect DECIMAL value: '11'
Warning	1292	Truncated incorrect DECIMAL value: '12'
Warning	1292	Truncated incorrect DECIMAL value: '1'
select * from t1;
+------+--------+------------+--------+------+
| s1   | s2     | s3         | s4     | s5   |
+------+--------+------------+--------+------+
|    1 | 李华   | 11         | 112545 | 1,2  |
|    4 | 5      | 1          | 1      | 1,2  |
+------+--------+------------+--------+------+
delete from t1 where weight_string(s4)=112545;
select * from t1;
+------+------+------------+------+------+
| s1   | s2   | s3         | s4   | s5   |
+------+------+------------+------+------+
|    4 | 5    | 1          | 1    | 1,2  |
+------+------+------------+------+------+
delete from t1 where weight_string(s5)=3;
Warnings:
Warning	1292	Truncated incorrect DECIMAL value: '1,2'
select * from t1;
+------+------+------------+------+------+
| s1   | s2   | s3         | s4   | s5   |
+------+------+------------+------+------+
|    4 | 5    | 1          | 1    | 1,2  |
+------+------+------------+------+------+
#嵌套delete
drop table t1;
create table t1 (s1 int,s2 char(20),s3 binary(10),s4 blob(30),s5 set('1','2'))
default charset=gbk collate=gbk_chinese_ci;
insert into t1 values (1,'李华',11,112545,3);
insert into t1 values (2,'西郊',12,1124,1);
insert into t1 values(11,'2',2,2,2);
insert into t1 values(4,'2',1,1,1);
insert into t1 values(4,'5',1,1,3);
drop table t2;
create table t2 (s1 int,s2 char(20),s3 binary(10),s4 blob(30),s5 set('1','2'))
default charset=gbk collate=gbk_chinese_ci;
insert into t2 values (1,'李华',11,112545,3);
insert into t2 values (2,'西郊',12,1124,1);
insert into t2 values(11,'2',2,2,2);
insert into t2 values(4,'2',1,1,1);
delete from t1 where s2=(select weight_string(s2) from t2 order by s1 limit 3,1);
select * from t1;
+------+--------+------------+--------+------+
| s1   | s2     | s3         | s4     | s5   |
+------+--------+------------+--------+------+
|    1 | 李华   | 11         | 112545 | 1,2  |
|    2 | 西郊   | 12         | 1124   | 1    |
|    4 | 5      | 1          | 1      | 1,2  |
+------+--------+------------+--------+------+
#repalce into
drop table t1;
create table t1 (s1 int,s2 char(20),s3 binary(10),s4 blob(30),s5 set('1','2')) default charset=gbk collate=gbk_chinese_ci;
set @b =  cast('3' as binary);
replace into t1 values(weight_string(@b),weight_string(@b),weight_string(@b),weight_string(@b),weight_string(@b));
select * from t1;
+------+------+------------+------+------+
| s1   | s2   | s3         | s4   | s5   |
+------+------+------------+------+------+
|    3 | 3    | 3          | 3    | 1,2  |
+------+------+------------+------+------+
drop table t1;
create table t1 (s1 int primary key,s2 char(20),s3 binary(10),s4 blob(30),s5 set('1','2')) 
default charset=gbk collate=gbk_chinese_ci;
insert into t1 values (1,'李华',11,112545,3);
replace into t1 values(1,weight_string(@b),weight_string(@b),weight_string(@b),weight_string(@b));
select * from t1;
+----+------+------------+------+------+
| s1 | s2   | s3         | s4   | s5   |
+----+------+------------+------+------+
|  1 | 3    | 3          | 3    | 1,2  |
+----+------+------------+------+------+
#create
drop table t2;
create table t2 (s1 int,s2 char(20),s3 binary(10),s4 blob(30),s5 set('1','2'))
default charset=gbk collate=gbk_chinese_ci;
insert into t2 values (1,'李华',11,112545,3);
insert into t2 values (2,'西郊',12,1124,1);
insert into t2 values(11,'2',2,2,2);
insert into t2 values(4,'2',1,1,1);
insert into t2 values(4,'5',1,1,3);
drop table t1;
create table t1 select weight_string(s1),weight_string(s2),weight_string(s3),weight_string(s4),weight_string(s5)from t2;
select * from t1;
+-------------------+-------------------+-------------------+-------------------+-------------------+
| weight_string(s1) | weight_string(s2) | weight_string(s3) | weight_string(s4) | weight_string(s5) |
+-------------------+-------------------+-------------------+-------------------+-------------------+
| NULL              | 2                 | 1                 | 1                 | 1                 |
| NULL              | 2                 | 2                 | 2                 | 2                 |
| NULL              | 5                 | 1                 | 1                 | 1,2               |
| NULL              | �M�6                | 11                | 112545            | 1,2               |
| NULL              | µ��                 | 12                | 1124              | 1                 |
+-------------------+-------------------+-------------------+-------------------+-------------------+
###清理环境
drop user yyl;
purge recyclebin;
