set ob_trx_timeout = 10000000000;
set ob_query_timeout = 10000000000;
drop database IF EXISTS nxa;
create database nxa  character set utf8;
use nxa;
set ob_enable_plan_cache=0;
set@@sql_mode='STRICT_ALL_TABLES,NO_ZERO_DATE,NO_ZERO_IN_DATE,ERROR_FOR_DIVISION_BY_ZERO ';
result_format: 4
#索引
drop procedure initData;
ERROR 42000: PROCEDURE nxa.initData does not exist
create procedure initData()
begin
declare ct int default 1;
while ct <= 20 DO
 insert into t1 (id,s1,s2) values (ct,ct,ct); 
 set ct = ct +1;
end while;
end;
/
#普通索引
drop table t1;
ERROR 42S02: Unknown table 'nxa.t1'
create table t1(id binary(20),s1 char(20), s2 blob);
call initData();
create index t1_id on t1(id);
create index t1_s1 on t1(s1);
select weight_string(id) from t1 where weight_string(s1)=15;
+-------------------+
| weight_string(id) |
+-------------------+
+-------------------+
Warnings:
Warning	1292	Truncated incorrect DECIMAL value: ''
Warning	1292	Truncated incorrect DECIMAL value: ''
Warning	1292	Truncated incorrect DECIMAL value: ''
Warning	1292	Truncated incorrect DECIMAL value: ''
Warning	1292	Truncated incorrect DECIMAL value: ''
Warning	1292	Truncated incorrect DECIMAL value: ''
Warning	1292	Truncated incorrect DECIMAL value: ''
Warning	1292	Truncated incorrect DECIMAL value: ''
Warning	1292	Truncated incorrect DECIMAL value: ''
Warning	1292	Truncated incorrect DECIMAL value: ''
Warning	1292	Truncated incorrect DECIMAL value: ''
Warning	1292	Truncated incorrect DECIMAL value: ''
Warning	1292	Truncated incorrect DECIMAL value: ''
Warning	1292	Truncated incorrect DECIMAL value: ''
Warning	1292	Truncated incorrect DECIMAL value: ''
Warning	1292	Truncated incorrect DECIMAL value: ''
Warning	1292	Truncated incorrect DECIMAL value: ''
Warning	1292	Truncated incorrect DECIMAL value: ''
Warning	1292	Truncated incorrect DECIMAL value: ''
Warning	1292	Truncated incorrect DECIMAL value: ''
#unique
drop table t1;
create table t1(id binary(20),s1 char(20), s2 blob);
call initData();
create unique index t1_id on t1(id);
create unique index t1_s1 on t1(s1);
select weight_string(id) from t1 where weight_string(s1)=15;
+-------------------+
| weight_string(id) |
+-------------------+
+-------------------+
Warnings:
Warning	1292	Truncated incorrect DECIMAL value: ''
Warning	1292	Truncated incorrect DECIMAL value: ''
Warning	1292	Truncated incorrect DECIMAL value: ''
Warning	1292	Truncated incorrect DECIMAL value: ''
Warning	1292	Truncated incorrect DECIMAL value: ''
Warning	1292	Truncated incorrect DECIMAL value: ''
Warning	1292	Truncated incorrect DECIMAL value: ''
Warning	1292	Truncated incorrect DECIMAL value: ''
Warning	1292	Truncated incorrect DECIMAL value: ''
Warning	1292	Truncated incorrect DECIMAL value: ''
Warning	1292	Truncated incorrect DECIMAL value: ''
Warning	1292	Truncated incorrect DECIMAL value: ''
Warning	1292	Truncated incorrect DECIMAL value: ''
Warning	1292	Truncated incorrect DECIMAL value: ''
Warning	1292	Truncated incorrect DECIMAL value: ''
Warning	1292	Truncated incorrect DECIMAL value: ''
Warning	1292	Truncated incorrect DECIMAL value: ''
Warning	1292	Truncated incorrect DECIMAL value: ''
Warning	1292	Truncated incorrect DECIMAL value: ''
Warning	1292	Truncated incorrect DECIMAL value: ''
#组合索引
drop table t1;
create table t1(id binary(20),s1 char(20), s2 binary(33),s3 blob);
call initData();
create  index t1_id on t1(id,s1,s2);
select weight_string(id) from t1 where weight_string(s1)=15;
+-------------------+
| weight_string(id) |
+-------------------+
+-------------------+
Warnings:
Warning	1292	Truncated incorrect DECIMAL value: ''
Warning	1292	Truncated incorrect DECIMAL value: ''
Warning	1292	Truncated incorrect DECIMAL value: ''
Warning	1292	Truncated incorrect DECIMAL value: ''
Warning	1292	Truncated incorrect DECIMAL value: ''
Warning	1292	Truncated incorrect DECIMAL value: ''
Warning	1292	Truncated incorrect DECIMAL value: ''
Warning	1292	Truncated incorrect DECIMAL value: ''
Warning	1292	Truncated incorrect DECIMAL value: ''
Warning	1292	Truncated incorrect DECIMAL value: ''
Warning	1292	Truncated incorrect DECIMAL value: ''
Warning	1292	Truncated incorrect DECIMAL value: ''
Warning	1292	Truncated incorrect DECIMAL value: ''
Warning	1292	Truncated incorrect DECIMAL value: ''
Warning	1292	Truncated incorrect DECIMAL value: ''
Warning	1292	Truncated incorrect DECIMAL value: ''
Warning	1292	Truncated incorrect DECIMAL value: ''
Warning	1292	Truncated incorrect DECIMAL value: ''
Warning	1292	Truncated incorrect DECIMAL value: ''
Warning	1292	Truncated incorrect DECIMAL value: ''
#约束
#虚拟列
drop table t1;
create table t1(id binary(20),s1 char(20), bao char(20) GENERATED ALWAYS AS (id) VIRTUAL);
insert into t1(id,s1) values (1,1),(5,1);
select weight_string(bao) from t1;
+------------------------------------------+
| weight_string(bao)                       |
+------------------------------------------+
|  1                                       |
|  5                                       |
+------------------------------------------+
drop table t1;
create table t1(id binary(20),s1 char(20), bao char(20) GENERATED ALWAYS AS (weight_string (id as char(6) level 1 )) VIRTUAL);
#存储列
drop table if exists t1;
create table t1(id binary(20),s1 char(20), bao char(20) GENERATED ALWAYS AS (id) STORED);
insert into t1(id,s1) values (1,1),(5,1);
select weight_string(bao) from t1;
+------------------------------------------+
| weight_string(bao)                       |
+------------------------------------------+
|  1                                       |
|  5                                       |
+------------------------------------------+
drop table t1;
create table t1(id binary(20),s1 char(20), bao char(20) GENERATED ALWAYS AS (weight_string (id as char(6) level 1 )) stored);
#unsigned zerofill
drop table if exists t1;
create table t1 (s1 int unsigned zerofill) 
default charset=gbk collate=gbk_chinese_ci;
insert into t1 values (1);
insert into t1 values (10);
insert into t1 values (100);
select weight_string(binary s1) from t1;
+--------------------------+
| weight_string(binary s1) |
+--------------------------+
| 0000000001               |
| 0000000010               |
| 0000000100               |
+--------------------------+
drop table t1;
create table t1 (s1 int unsigned zerofill) 
default charset=gbk collate=gbk_chinese_ci;
#44823852  binary ob可以插入，mysql截断
insert into t1 values (weight_string (11 as binary(3)));
ERROR 01000: Data truncated for column 's1' at row 1
insert into t1 values (weight_string (11 as char(3)));
insert into t1 values (weight_string (11 level 1));
insert into t1 values (weight_string (11 level 1 desc));
insert into t1 values (weight_string (19 level 1 desc reverse ));
select * from t1;
+------+
| s1   |
+------+
| NULL |
| NULL |
| NULL |
| NULL |
+------+
drop table t1;
create table t1 (s1 binary(100) ) 
default charset=gbk collate=gbk_chinese_ci;
#44823852 asbinary插入binary ob可以插入，mysql为null
insert into t1 values (weight_string (11 as binary(100)));
select * from t1;
+------------------------------------------------------------------------------------------------------+
| s1                                                                                                   |
+------------------------------------------------------------------------------------------------------+
| 11                                                                                                   |
+------------------------------------------------------------------------------------------------------+
#unique
drop table t1;
create table t1 (s1 binary(20) unique,s2 int) 
default charset=gbk collate=gbk_chinese_ci;
insert into t1(s1) values (weight_string (binary 11));
insert into t1(s1) values (weight_string (binary 11));
ERROR 23000: Duplicate entry '11' for key 's1'
#not null
drop table t1;
create table t1 (s1 binary(20) not null,s2 int) 
default charset=gbk collate=gbk_chinese_ci;
insert into t1(s1) values (weight_string (binary 11));
insert into t1(s1) values (weight_string (11));
ERROR 23000: Column 's1' cannot be null
#check
drop table t1;
create table t1 (s1 binary(20)  check( s1 >10) ,s2 int) 
default charset=gbk collate=gbk_chinese_ci;
insert into t1(s1) values (weight_string (binary 111011));
ERROR HY000: check constraint violated
select * from t1;
+------+------+
| s1   | s2   |
+------+------+
+------+------+
insert into t1(s1) values (weight_string (binary 15));
ERROR HY000: check constraint violated
insert into t1(s1) values (weight_string (binary 10));
ERROR HY000: check constraint violated
drop table t1;
create table t1 (s1 int  check(weight_string(binary s1) >10) ,s2 int) 
default charset=gbk collate=gbk_chinese_ci;
insert into t1(s1) values (11);
insert into t1(s1) values (10);
ERROR HY000: check constraint violated
select * from t1;
+------+------+
| s1   | s2   |
+------+------+
|   11 | NULL |
+------+------+
drop table t1;
create table t1 (s1 int  check(s1 <weight_string(binary 10)) ,s2 int) 
default charset=gbk collate=gbk_chinese_ci;
insert into t1(s1) values (9);
insert into t1(s1) values (11);
ERROR HY000: check constraint violated
select * from t1;
+------+------+
| s1   | s2   |
+------+------+
|    9 | NULL |
+------+------+
#default
drop table t1;
create table t1 (s1 int default 10 ,s2 binary(20) default 10 ) 
default charset=gbk collate=gbk_chinese_ci;
insert into t1(s1) values (weight_string (binary 15));
insert into t1(s2) values (weight_string (binary 15));
select weight_string(s1),weight_string(s2) from t1;
+-------------------+----------------------+
| weight_string(s1) | weight_string(s2)    |
+-------------------+----------------------+
| NULL              | 10                   |
| NULL              | 15                   |
+-------------------+----------------------+
select * from t1;
+------+----------------------+
| s1   | s2                   |
+------+----------------------+
|   10 | 15                   |
|   15 | 10                   |
+------+----------------------+
#外键
drop table t3;
ERROR 42S02: Unknown table 'nxa.t3'
drop table t1;
create table t1(id int primary key, s1 int, s2 int);
insert into t1 values(1,1,3),(5,1,0),(3,1,0),(9,1,0),(2,7,0);
create table t3(bid int ,s1 int, s2 int,foreign key (bid) references t1(id));
INSERT INTO t3 VALUES(3,1,3),(1,6,0),(1,6,0),(2,7,0);
insert into t1(id) values (weight_string (binary 15));
select * from t1;
+----+------+------+
| id | s1   | s2   |
+----+------+------+
|  1 |    1 |    3 |
|  2 |    7 |    0 |
|  3 |    1 |    0 |
|  5 |    1 |    0 |
|  9 |    1 |    0 |
| 15 | NULL | NULL |
+----+------+------+
select weight_string(id) from t1;
+-------------------+
| weight_string(id) |
+-------------------+
| NULL              |
| NULL              |
| NULL              |
| NULL              |
| NULL              |
| NULL              |
+-------------------+
insert into t3(bid) values (weight_string (binary 15));
select * from t1;
+----+------+------+
| id | s1   | s2   |
+----+------+------+
|  1 |    1 |    3 |
|  2 |    7 |    0 |
|  3 |    1 |    0 |
|  5 |    1 |    0 |
|  9 |    1 |    0 |
| 15 | NULL | NULL |
+----+------+------+
select weight_string(bid) from t3;
+--------------------+
| weight_string(bid) |
+--------------------+
| NULL               |
| NULL               |
| NULL               |
| NULL               |
| NULL               |
+--------------------+
insert into t3(bid) values (weight_string (binary 12));
ERROR 23000: Cannot add or update a child row: a foreign key constraint fails
drop table t3;
#视图
drop table t1;
create table t1 (s1 int,s2 char(20),s3 binary(10),s4 blob(30),s5 set('1','2','19980526')) 
default charset=gbk collate=gbk_chinese_ci;
insert into t1 values (1,'李华',11,112545,4);
insert into t1 values (2,'西郊',12,1124,1);
insert into t1 values(11,'2',2,2,2);
insert into t1 values(4,'-2',1,1,1);
insert into t1 values(19980526,'19980526',19980526,19980526,1);
drop view v1;
ERROR 42S02: Unknown table 'nxa.v1'
create view v1 as 
select *,weight_string(s3) dd from t1;
select * from v1;
+----------+----------+------------+----------+----------+------------+
| s1       | s2       | s3         | s4       | s5       | dd         |
+----------+----------+------------+----------+----------+------------+
|        1 | 李华     | 11         | 112545   | 19980526 | 11         |
|        2 | 西郊     | 12         | 1124     | 1        | 12         |
|        4 | -2       | 1          | 1        | 1        | 1          |
|       11 | 2        | 2          | 2        | 2        | 2          |
| 19980526 | 19980526 | 19980526   | 19980526 | 1        | 19980526   |
+----------+----------+------------+----------+----------+------------+
#select 
select hex(weight_string(dd)),hex(weight_string(s2)) from v1;
+------------------------+------------------------+
| hex(weight_string(dd)) | hex(weight_string(s2)) |
+------------------------+------------------------+
| 31000000000000000000   | 2D32                   |
| 31310000000000000000   | A64D9A36               |
| 31320000000000000000   | C2B59EB7               |
| 31393938303532360000   | 3139393830353236       |
| 32000000000000000000   | 32                     |
+------------------------+------------------------+
#insert
insert into v1 values (1,1,1,1,1,1);
ERROR HY000: Column 'dd' is not updatable
drop view v1;
create view v1 as 
select * from t1;
select * from v1;
+----------+----------+------------+----------+----------+
| s1       | s2       | s3         | s4       | s5       |
+----------+----------+------------+----------+----------+
|        1 | 李华     | 11         | 112545   | 19980526 |
|        2 | 西郊     | 12         | 1124     | 1        |
|        4 | -2       | 1          | 1        | 1        |
|       11 | 2        | 2          | 2        | 2        |
| 19980526 | 19980526 | 19980526   | 19980526 | 1        |
+----------+----------+------------+----------+----------+
insert into v1 values (1,1,1,weight_string(s3),1);
select * from v1;
+----------+----------+------------+------------+----------+
| s1       | s2       | s3         | s4         | s5       |
+----------+----------+------------+------------+----------+
|        1 | 1        | 1          | 1          | 1        |
|        1 | 李华     | 11         | 112545     | 19980526 |
|        2 | 西郊     | 12         | 1124       | 1        |
|        4 | -2       | 1          | 1          | 1        |
|       11 | 2        | 2          | 2          | 2        |
| 19980526 | 19980526 | 19980526   | 19980526   | 1        |
+----------+----------+------------+------------+----------+
select * from t1;
+----------+----------+------------+------------+----------+
| s1       | s2       | s3         | s4         | s5       |
+----------+----------+------------+------------+----------+
|        1 | 1        | 1          | 1          | 1        |
|        1 | 李华     | 11         | 112545     | 19980526 |
|        2 | 西郊     | 12         | 1124       | 1        |
|        4 | -2       | 1          | 1          | 1        |
|       11 | 2        | 2          | 2          | 2        |
| 19980526 | 19980526 | 19980526   | 19980526   | 1        |
+----------+----------+------------+------------+----------+
set @s = _utf8mb4 '11' collate  utf8mb4_general_ci ;
insert into v1 values (1,1,1,weight_string(@s),1);
select * from v1;
+----------+----------+------------+------------+----------+
| s1       | s2       | s3         | s4         | s5       |
+----------+----------+------------+------------+----------+
|        1 | 1        | 1          |  1 1       | 1        |
|        1 | 1        | 1          | 1          | 1        |
|        1 | 李华     | 11         | 112545     | 19980526 |
|        2 | 西郊     | 12         | 1124       | 1        |
|        4 | -2       | 1          | 1          | 1        |
|       11 | 2        | 2          | 2          | 2        |
| 19980526 | 19980526 | 19980526   | 19980526   | 1        |
+----------+----------+------------+------------+----------+
select * from t1;
+----------+----------+------------+------------+----------+
| s1       | s2       | s3         | s4         | s5       |
+----------+----------+------------+------------+----------+
|        1 | 1        | 1          |  1 1       | 1        |
|        1 | 1        | 1          | 1          | 1        |
|        1 | 李华     | 11         | 112545     | 19980526 |
|        2 | 西郊     | 12         | 1124       | 1        |
|        4 | -2       | 1          | 1          | 1        |
|       11 | 2        | 2          | 2          | 2        |
| 19980526 | 19980526 | 19980526   | 19980526   | 1        |
+----------+----------+------------+------------+----------+
#delete
drop table t1;
create table t1 (s1 int,s2 char(20),s3 binary(10),s4 blob(30),s5 set('1','2','19980526')) 
default charset=gbk collate=gbk_chinese_ci;
insert into t1 values (1,'李华',11,112545,4);
insert into t1 values (2,'西郊',12,1124,1);
insert into t1 values(11,'2',2,2,2);
insert into t1 values(4,'-2',1,1,1);
insert into t1 values(19980526,'19980526',19980526,19980526,1);
drop view v1;
create view v1 as
select *,weight_string(s3) dd from t1;
select * from v1;
+----------+----------+------------+----------+----------+------------+
| s1       | s2       | s3         | s4       | s5       | dd         |
+----------+----------+------------+----------+----------+------------+
|        1 | 李华     | 11         | 112545   | 19980526 | 11         |
|        2 | 西郊     | 12         | 1124     | 1        | 12         |
|        4 | -2       | 1          | 1        | 1        | 1          |
|       11 | 2        | 2          | 2        | 2        | 2          |
| 19980526 | 19980526 | 19980526   | 19980526 | 1        | 19980526   |
+----------+----------+------------+----------+----------+------------+
delete from v1 where weight_string(s4)=2;
select * from v1;
+----------+----------+------------+----------+----------+------------+
| s1       | s2       | s3         | s4       | s5       | dd         |
+----------+----------+------------+----------+----------+------------+
|        1 | 李华     | 11         | 112545   | 19980526 | 11         |
|        2 | 西郊     | 12         | 1124     | 1        | 12         |
|        4 | -2       | 1          | 1        | 1        | 1          |
| 19980526 | 19980526 | 19980526   | 19980526 | 1        | 19980526   |
+----------+----------+------------+----------+----------+------------+
select * from t1;
+----------+----------+------------+----------+----------+
| s1       | s2       | s3         | s4       | s5       |
+----------+----------+------------+----------+----------+
|        1 | 李华     | 11         | 112545   | 19980526 |
|        2 | 西郊     | 12         | 1124     | 1        |
|        4 | -2       | 1          | 1        | 1        |
| 19980526 | 19980526 | 19980526   | 19980526 | 1        |
+----------+----------+------------+----------+----------+
#update
drop table t1;
create table t1 (s1 int,s2 char(20),s3 binary(10),s4 blob(30),s5 set('1','2','19980526')) 
default charset=gbk collate=gbk_chinese_ci;
insert into t1 values (1,'李华',11,112545,4);
insert into t1 values (2,'西郊',12,1124,1);
insert into t1 values(11,'2',2,2,2);
insert into t1 values(4,'-2',1,1,1);
insert into t1 values(19980526,'19980526',19980526,19980526,1);
#多列
drop view v1;
create view v1 as
select *,weight_string(s3) dd from t1;
select * from v1;
+----------+----------+------------+----------+----------+------------+
| s1       | s2       | s3         | s4       | s5       | dd         |
+----------+----------+------------+----------+----------+------------+
|        1 | 李华     | 11         | 112545   | 19980526 | 11         |
|        2 | 西郊     | 12         | 1124     | 1        | 12         |
|        4 | -2       | 1          | 1        | 1        | 1          |
|       11 | 2        | 2          | 2        | 2        | 2          |
| 19980526 | 19980526 | 19980526   | 19980526 | 1        | 19980526   |
+----------+----------+------------+----------+----------+------------+
update v1 set s3= weight_string(s4);
select * from v1;
+----------+----------+------------+----------+----------+------------+
| s1       | s2       | s3         | s4       | s5       | dd         |
+----------+----------+------------+----------+----------+------------+
|        1 | 李华     | 112545     | 112545   | 19980526 | 112545     |
|        2 | 西郊     | 1124       | 1124     | 1        | 1124       |
|        4 | -2       | 1          | 1        | 1        | 1          |
|       11 | 2        | 2          | 2        | 2        | 2          |
| 19980526 | 19980526 | 19980526   | 19980526 | 1        | 19980526   |
+----------+----------+------------+----------+----------+------------+
select * from t1;
+----------+----------+------------+----------+----------+
| s1       | s2       | s3         | s4       | s5       |
+----------+----------+------------+----------+----------+
|        1 | 李华     | 112545     | 112545   | 19980526 |
|        2 | 西郊     | 1124       | 1124     | 1        |
|        4 | -2       | 1          | 1        | 1        |
|       11 | 2        | 2          | 2        | 2        |
| 19980526 | 19980526 | 19980526   | 19980526 | 1        |
+----------+----------+------------+----------+----------+
#单列
drop table t1;
create table t1 (s1 int,s2 char(20),s3 binary(10),s4 blob(30),s5 set('1','2','19980526')) 
default charset=gbk collate=gbk_chinese_ci;
insert into t1 values (1,'李华',11,112545,4);
insert into t1 values (2,'西郊',12,1124,1);
insert into t1 values(11,'2',2,2,2);
insert into t1 values(4,'-2',1,1,1);
insert into t1 values(19980526,'19980526',19980526,19980526,1);
drop view v1;
create view v1 as 
select *,weight_string(s3) dd from t1;
select * from v1;
+----------+----------+------------+----------+----------+------------+
| s1       | s2       | s3         | s4       | s5       | dd         |
+----------+----------+------------+----------+----------+------------+
|        1 | 李华     | 11         | 112545   | 19980526 | 11         |
|        2 | 西郊     | 12         | 1124     | 1        | 12         |
|        4 | -2       | 1          | 1        | 1        | 1          |
|       11 | 2        | 2          | 2        | 2        | 2          |
| 19980526 | 19980526 | 19980526   | 19980526 | 1        | 19980526   |
+----------+----------+------------+----------+----------+------------+
update v1 set s4= weight_string(s3) where  weight_string(s4)=1124 ;
select * from v1;
+----------+----------+------------+------------+----------+------------+
| s1       | s2       | s3         | s4         | s5       | dd         |
+----------+----------+------------+------------+----------+------------+
|        1 | 李华     | 11         | 112545     | 19980526 | 11         |
|        2 | 西郊     | 12         | 12         | 1        | 12         |
|        4 | -2       | 1          | 1          | 1        | 1          |
|       11 | 2        | 2          | 2          | 2        | 2          |
| 19980526 | 19980526 | 19980526   | 19980526   | 1        | 19980526   |
+----------+----------+------------+------------+----------+------------+
select * from t1;
+----------+----------+------------+------------+----------+
| s1       | s2       | s3         | s4         | s5       |
+----------+----------+------------+------------+----------+
|        1 | 李华     | 11         | 112545     | 19980526 |
|        2 | 西郊     | 12         | 12         | 1        |
|        4 | -2       | 1          | 1          | 1        |
|       11 | 2        | 2          | 2          | 2        |
| 19980526 | 19980526 | 19980526   | 19980526   | 1        |
+----------+----------+------------+------------+----------+
#分区
#range
drop table t1;
create table t1 (s1 int,s2 char(20),s3 binary(10),s4 blob(30))default charset=gbk collate=gbk_chinese_ci
  partition by range(s1)(
  partition p1 values less than(2) ,
  partition p2 values less than(10) ,
  partition p3 values less than(maxvalue)
);
insert into t1 values (1,'李华',11,112545);
insert into t1 values (2,'西郊',12,1124);
insert into t1 values(11,'2',2,2);
insert into t1 values(4,'-2',1,1);
insert into t1 values(19980526,'19980526',19980526,19980526);
insert into t1(s3) values(weight_string(binary 11));
select * from t1;
+----------+----------+------------+----------+
| s1       | s2       | s3         | s4       |
+----------+----------+------------+----------+
|        1 | 李华     | 11         | 112545   |
|        2 | 西郊     | 12         | 1124     |
|        4 | -2       | 1          | 1        |
|       11 | 2        | 2          | 2        |
|     NULL | NULL     | 11         | NULL     |
| 19980526 | 19980526 | 19980526   | 19980526 |
+----------+----------+------------+----------+
select weight_string(binary s1) from t1;
+--------------------------+
| weight_string(binary s1) |
+--------------------------+
| 1                        |
| 11                       |
| 19980526                 |
| 2                        |
| 4                        |
| NULL                     |
+--------------------------+
#list
drop table t1;
create table t1 (s1 int,s2 char(20),s3 binary(10),s4 blob(30))default charset=gbk collate=gbk_chinese_ci
  partition by list(s1)(
  partition p1 values in (1,2),
  partition p2 values in (4,11),
  partition p3 values in (3000)
);
insert into t1 values (1,'李华',11,112545);
insert into t1 values (2,'西郊',12,1124);
insert into t1 values(11,'2',2,2);
insert into t1 values(4,'-2',1,1);
insert into t1(s1,s3) values(weight_string(binary 4),weight_string(binary 4));
select * from t1;
+------+--------+------------+--------+
| s1   | s2     | s3         | s4     |
+------+--------+------------+--------+
|    1 | 李华   | 11         | 112545 |
|    2 | 西郊   | 12         | 1124   |
|    4 | -2     | 1          | 1      |
|    4 | NULL   | 4          | NULL   |
|   11 | 2      | 2          | 2      |
+------+--------+------------+--------+
select weight_string(binary s1) from t1;
+--------------------------+
| weight_string(binary s1) |
+--------------------------+
| 1                        |
| 11                       |
| 2                        |
| 4                        |
| 4                        |
+--------------------------+
#hash
drop table t1;
create table t1 (s1 int,s2 char(20),s3 binary(10),s4 blob(30))default charset=gbk collate=gbk_chinese_ci
partition by hash(s1)
partitions 4;
insert into t1 values (1,'李华',11,112545);
insert into t1 values (2,'西郊',12,1124);
insert into t1 values(11,'2',2,2);
insert into t1 values(4,'-2',1,1);
insert into t1(s1,s3) values(weight_string(binary 5),weight_string(binary 4));
select s3 from t1;
+------------+
| s3         |
+------------+
| 1          |
| 11         |
| 12         |
| 2          |
| 4          |
+------------+
select weight_string(binary s1) from t1;
+--------------------------+
| weight_string(binary s1) |
+--------------------------+
| 1                        |
| 11                       |
| 2                        |
| 4                        |
| 5                        |
+--------------------------+
###清理环境
drop user yyl;
purge recyclebin;
