set ob_trx_timeout = 10000000000;
set ob_query_timeout = 10000000000;
drop database IF EXISTS nxa;
create database nxa  character set utf8;
use nxa;
set ob_enable_plan_cache=0;
set@@sql_mode='STRICT_ALL_TABLES,NO_ZERO_DATE,NO_ZERO_IN_DATE,ERROR_FOR_DIVISION_BY_ZERO ';
result_format: 4
drop table t2;
ERROR 42S02: Unknown table 'nxa.t2'
create table t2 (s1 int,s2 char(20),s3 binary(10),s4 blob(30),s5 set('1','2'))
default charset=gbk collate=gbk_chinese_ci;
insert into t2 values (1,'李华',11,112545,3);
insert into t2 values (2,'西郊',12,1124,1);
insert into t2 values(11,'2',2,2,2);
insert into t2 values(4,'2',1,1,1);
insert into t2 values(4,'5',1,1,3);
#无参函数
set @dd = _gbk '0x007fff' collate  gbk_chinese_ci ;
drop function n_1;
ERROR 42000: FUNCTION nxa.n_1 does not exist
create function n_1() returns char(20) 
begin
  declare a char(20);
  set a=weight_string(@dd);
  select weight_string(s1) into @a from t2 limit 1;
  select weight_string(s2) into @b from t2 limit 1;
  select weight_string(s3) into @c from t2 limit 1;
  select weight_string(s4) into @d from t2 limit 1;
  select weight_string(s5) into @s from t2 limit 1;
  return concat(weight_string(binary 1 level 1 ),a);
end/
select n_1();
+-----------+
| n_1()     |
+-----------+
| 10X007FFF |
+-----------+
select @a;
+------+
| @a   |
+------+
| NULL |
+------+
select @b;
+------+
| @b   |
+------+
| �M�6   |
+------+
select @c;
+------------+
| @c         |
+------------+
| 11         |
+------------+
select @d;
+--------+
| @d     |
+--------+
| 112545 |
+--------+
select @s;
+------+
| @s   |
+------+
| 1,2  |
+------+
#有参
set @dd = _gbk '12' collate  gbk_chinese_ci ;
drop function n_1;
create function n_1(a int) returns int 
begin
  select weight_string(s3) into @a from t2 limit 1;
  return a;
end/
select @dd,n_1(weight_string(@dd)),weight_string(n_1(1)),weight_string(@a);
+------+-------------------------+-----------------------+-------------------+
| @dd  | n_1(weight_string(@dd)) | weight_string(n_1(1)) | weight_string(@a) |
+------+-------------------------+-----------------------+-------------------+
| 12   |                      12 | NULL                  | 11                |
+------+-------------------------+-----------------------+-------------------+
#case when
#45040820 case when 结果不稳定
set @dd = _gbk '12' collate  gbk_chinese_ci ;
set @ss = _gbk '1' collate  gbk_chinese_ci ;
drop table t2;
create table t2 (s1 int,s2 char(20),s3 binary(10),s4 blob(30),s5 set('1','2'))
default charset=gbk collate=gbk_chinese_ci;
insert into t2 values (1,'李华',11,112545,3);
insert into t2 values (2,'西郊',12,1124,1);
insert into t2 values(11,'2',2,2,2);
drop function n_1;
create function n_1(a int) 
returns int
begin
declare week int;
case a
when 2 then set week=weight_string(@dd);

else set week=weight_string(@ss);
end case;
return week;
end/
select n_1(s1) from t2;
############
set @dd = _gbk '12' collate  gbk_chinese_ci ;
set @ss = _gbk '1' collate  gbk_chinese_ci ;
drop table t2;
create table t2 (s1 int,s2 char(20),s3 binary(10),s4 blob(30),s5 set('1','2'))
default charset=gbk collate=gbk_chinese_ci;
insert into t2 values (1,'李华',11,112545,3);
insert into t2 values (2,'西郊',12,1124,1);
insert into t2 values(11,'2',2,2,2);
drop function n_1;
create function n_1(a int) 
returns int
begin
declare week int;
case weight_string(@dd)
when 12 then set week=a;

else set week=weight_string(@ss);
end case;
return week;
end/
select n_1(s1) from t2;
#if
drop table t1 ;
ERROR 42S02: Unknown table 'nxa.t1'
create table t1 (s2 int,s3 int);
insert into t1 values (1,132);
insert into t1 values (534534,132);
drop function n_1;
create function n_1(a char(20),b char(20))
returns int
begin
if a<weight_string(b) then 
set @aa=999;
else 
set @aa=111;
end if;
return 6;
end/
select n_1(s2,s3) from t1  ;
+------------+
| n_1(s2,s3) |
+------------+
|          6 |
|          6 |
+------------+
select @aa;
+------+
| @aa  |
+------+
|  111 |
+------+
#while循环
drop table t2;
create table t2(s1 binary,s2 int,s3 int);
drop function n_1;
create function n_1() returns int
begin
declare i binary default 0;
while i<5 do
set i=i+1;
  insert into t2 values(weight_string(i),0,i);
  end while ;
  return 0;
end/
select n_1() ;
+-------+
| n_1() |
+-------+
|     0 |
+-------+
select * from t2;
+------+------+------+
| s1   | s2   | s3   |
+------+------+------+
| 1    |    0 |    1 |
| 2    |    0 |    2 |
| 3    |    0 |    3 |
| 4    |    0 |    4 |
| 5    |    0 |    5 |
+------+------+------+
#########
drop table t2;
create table t2(s1 binary,s2 int,s3 int);
drop function n_1;
create function n_1() returns int
begin
declare i binary default 0;
while weight_string(i)<5 do
set i=weight_string(i)+1;
  insert into t2 values(weight_string(i),0,i);
  end while ;
  return weight_string(i);
end/
select n_1() ;
+-------+
| n_1() |
+-------+
|     5 |
+-------+
select * from t2;
+------+------+------+
| s1   | s2   | s3   |
+------+------+------+
| 1    |    0 |    1 |
| 2    |    0 |    2 |
| 3    |    0 |    3 |
| 4    |    0 |    4 |
| 5    |    0 |    5 |
+------+------+------+
#repeat
drop table t2;
create table t2(s1 binary,s2 int,s3 int);
drop function n_1;
create function n_1() returns int
begin
declare i binary default 0;
 repeat
 insert into t2 values(weight_string(i),0,i);
   set i = weight_string(i) +1;
until weight_string(i) >= 3
  end repeat;
  return weight_string(i);
end/
select n_1() ;
+-------+
| n_1() |
+-------+
|     3 |
+-------+
select * from t2;
+------+------+------+
| s1   | s2   | s3   |
+------+------+------+
| 0    |    0 |    0 |
| 1    |    0 |    1 |
| 2    |    0 |    2 |
+------+------+------+
#loop
set @dd = _gbk '4' collate  gbk_chinese_ci ;
drop table t2;
create table t2(s1 binary,s2 int,s3 int);
drop function n_1;
create function n_1() returns int
begin
declare i binary default 0;
 loop_label:loop
  insert into t2 values(weight_string(i),0,1);
   set i = i +1;
if i >= weight_string(@dd) then
   leave loop_label;
  end if;
  end loop;
  return 0;
end/
select n_1() ;
+-------+
| n_1() |
+-------+
|     0 |
+-------+
select * from t2;
+------+------+------+
| s1   | s2   | s3   |
+------+------+------+
| 0    |    0 |    1 |
| 1    |    0 |    1 |
| 2    |    0 |    1 |
| 3    |    0 |    1 |
+------+------+------+
#procedure
#in
set @dd = _gbk '12' collate  gbk_chinese_ci ;
set @aa = _gb18030 '6' collate  gb18030_chinese_ci ;
drop procedure prre;
ERROR 42000: PROCEDURE nxa.prre does not exist
create procedure prre(in a int,in b int)
begin
declare aa int;
  set @aa=9;
  set aa=9;
    if a >= b then
      set @aa =  weight_string(@dd);
      set aa=  weight_string(@dd);
    else
      set @aa = 0;
    end if;
select aa;
end/
call prre(weight_string(@hh),weight_string(@aa));
+------+
| aa   |
+------+
|    9 |
+------+
#out
set @dd = _gbk '12' collate  gbk_chinese_ci ;
drop procedure if exists p1;
create procedure p1(out ia int) 
BEGIN
	select weight_string(@dd) into ia ;
END/
call p1(@bb);
select @bb;
+------+
| @bb  |
+------+
|   12 |
+------+
#inout
set @dd = _gbk '12' collate  gbk_chinese_ci ;
drop procedure if exists p1;
create procedure p1(inout ia int,inout ib char(20)) 
BEGIN
	select weight_string(@dd) into ia ;
	select ib;
END/
set @hh = weight_string(@dd);
call p1(@qq,@hh);
+------+
| ib   |
+------+
| 12   |
+------+
select @qq;
+------+
| @qq  |
+------+
|   12 |
+------+
#trigger
#insert
drop table t1 ;
create table t1 (s2 char(20),s3 int);
insert into t1 values (1,2);
insert into t1 values (2,3);
drop trigger tr;
ERROR HY000: Trigger does not exist
create trigger tr before insert on t1 for each row
begin
if new.s2 is null then
set new.s2 = (select max(s2) from t1);
elseif new.s2 > 0 then
set new.s2 = abs(new.s2);
end if;
end/
insert into t1(s2) values(weight_string(binary 9));
select * from t1;
+------+------+
| s2   | s3   |
+------+------+
| 1    |    2 |
| 2    |    3 |
| 9    | NULL |
+------+------+
drop table t2 ;
create table t2 (s2 char(20),s3 binary);
insert into t2 values (1,2);
insert into t2 values (2,3);
drop table t1 ;
create table t1 (s2 char(20),s3 int);
insert into t1 values (1,2);
insert into t1 values (2,3);
drop trigger tr;
ERROR HY000: Trigger does not exist
create trigger tr before insert on t1 for each row
begin
if new.s2 is null then
set new.s2 = (select weight_string(s3) from t2 limit 1);
elseif new.s2 < 0 then
set new.s2 = abs(new.s2);
end if;
end/
insert into t1(s2) values(weight_string(1));
select * from t1;
+------+------+
| s2   | s3   |
+------+------+
| 1    |    2 |
| 2    |    3 |
| 2    | NULL |
+------+------+
drop table t1 ;
create table t1 (s2 char(20),s3 int);
insert into t1 values (1,2);
insert into t1 values (2,3);
drop trigger tr;
ERROR HY000: Trigger does not exist
create trigger tr before insert on t1 for each row
begin
if new.s2 is null then
set new.s2 = weight_string(binary 1) ;
elseif new.s2 < 0 then
set new.s2 = abs(new.s2);
end if;
end/
insert into t1(s2) values(weight_string(null));
select * from t1;
+------+------+
| s2   | s3   |
+------+------+
| 1    |    2 |
| 1    | NULL |
| 2    |    3 |
+------+------+
#update
drop table t1 ;
create table t1 (s2 char(20),s3 binary(10));
insert into t1 values (1,2);
insert into t1 values (2,3);
drop trigger tr;
ERROR HY000: Trigger does not exist
create trigger tr before update on t1 for each row
begin
if new.s2 =1 then
set new.s2 =  weight_string(old.s2 level 1) ;
elseif new.s2 < 0 then
set new.s2 = abs(new.s2);
end if;
end/
update t1 set s2=weight_string(binary 1) where s2=2;
select * from t1;
+------+------------+
| s2   | s3         |
+------+------------+
|  2   | 3          |
| 1    | 2          |
+------+------------+
#delete
drop table t1 ;
create table t1 (s2 char(20),s3 int);
insert into t1 values (1,2);
insert into t1 values (2,3);
drop trigger tr;
ERROR HY000: Trigger does not exist
create trigger tr before delete on t1 for each row
begin
set @aa= weight_string(old.s2 level 1 desc) ;

end/
delete from  t1  where s2=1;
select * from t1;
+------+------+
| s2   | s3   |
+------+------+
| 2    |    3 |
+------+------+
select @aa;
+------+
| @aa  |
+------+
| ��     |
+------+
#游标
set @dd = _gbk '0' collate  gbk_chinese_ci ;
drop table t2;
create table t2 (s1 int,s2 char(20),s3 binary(10),s4 blob(30),s5 set('1','2'))
default charset=gbk collate=gbk_chinese_ci;
insert into t2 values (1,'李华',11,112545,3);
insert into t2 values (2,'西郊',12,1124,1);
insert into t2 values(11,'2',2,2,2);
insert into t2 values(4,'2',1,1,1);
insert into t2 values(4,'5',1,1,3);
drop procedure processorders;
ERROR 42000: PROCEDURE nxa.processorders does not exist
create procedure processorders()
begin
declare aa int;
declare rc int;
declare i int default 1;
declare cur cursor for select weight_string(s4) from t2 ;
select count(*)  into rc from t2;
open cur;
 while i < rc do
fetch cur into aa;
set i = i + 1;
select aa;
end while;
close cur;

end/
call processorders();
+--------+
| aa     |
+--------+
+------+
| aa   |
+------+
+------+
| aa   |
+------+
+------+
| aa   |
+------+
| 112545 |
| 1124 |
|    2 |
|    1 |
+--------+
+------+
+------+
+------+
#动态sql
drop table t2;
create table t2 (s1 int,s2 char(20),s3 binary(10),s4 blob(30),s5 set('1','2'))
default charset=gbk collate=gbk_chinese_ci;
insert into t2 values (1,'李华',11,112545,3);
insert into t2 values (2,'西郊',12,1124,1);
insert into t2 values(11,'2',2,2,2);
insert into t2 values(4,'2',1,1,1);
insert into t2 values(4,'5',1,1,3);
drop procedure agm;
ERROR 42000: PROCEDURE nxa.agm does not exist
create procedure agm(in func char(20),in order_param varchar(10),in anchor int,in size int)
begin
	set @s = concat("select " ,func, "from t2 order by ",order_param," limit ",anchor,",",size);
	prepare stmt from @s;
	execute stmt;
	deallocate prepare stmt;
end/
call agm('weight_string(s1)','s1',1,5);
+-------------------+
| weight_string(s1) |
+-------------------+
| NULL              |
| NULL              |
| NULL              |
| NULL              |
+-------------------+
call agm('weight_string(s2)','s1',1,5);
+-------------------+
| weight_string(s2) |
+-------------------+
| 2                 |
| 2                 |
| 5                 |
| µ��                 |
+-------------------+
call agm('weight_string(s3)','s1',1,5);
+-------------------+
| weight_string(s3) |
+-------------------+
| 1                 |
| 1                 |
| 12                |
| 2                 |
+-------------------+
call agm('weight_string(s4)','s1',1,5);
+-------------------+
| weight_string(s4) |
+-------------------+
| 1                 |
| 1                 |
| 1124              |
| 2                 |
+-------------------+
call agm('weight_string(s5)','s1',1,5);
+-------------------+
| weight_string(s5) |
+-------------------+
| 1                 |
| 1                 |
| 1,2               |
| 2                 |
+-------------------+
###清理环境
drop user yyl;
purge recyclebin;
