drop database if exists db1;
create database db1;
use db1;
result_format: 4
alter system flush plan cache global;
affected rows: 0
alter system set _rowsets_enabled=false;
affected rows: 0
set autocommit = false;
affected rows: 0
alter system set ob_enable_batched_multi_statement=true;
affected rows: 0


drop table if exists t1;
affected rows: 0
Warnings:
Note	1051	Unknown table 'db1.t1'
#float、double、decimal
create table t1 (c1 float primary key,c2 double not null,c3 decimal(5,3),key index_c1_c2(c1,c2));
affected rows: 0
create index index_c3 on t1(c3);
affected rows: 0
insert into t1 values(1.111,1.111,1.111),(2.111,2.222,2.333),(3.111,3.222,3.333),(4.111,4.222,4.333),(5.111,5.222,5.333),(6.111,6.222,6.333),(7.1,7.2,7.3);
affected rows: 7
info: Records: 7  Duplicates: 0  Warnings: 0
insert into t1 values(11.111,11.111,11.111),(12.111,12.222,12.333),(13.111,13.222,13.333),(14.111,14.222,14.333),(15.111,15.222,15.333),(16.111,16.222,16.333),(17.1,17.2,17.3);
affected rows: 7
info: Records: 7  Duplicates: 0  Warnings: 0
commit;
affected rows: 0

alter system flush plan cache global;
affected rows: 0
#delete where条件精度不同 batch场景回退,where 条件后 +计算 batch场景回退。
delete from t1 where c1 = 1.111;delete from t1 where c1 = 2.111;delete from t1 where c1 = 3.111;//
affected rows: 0
affected rows: 0
affected rows: 0
delete from t1 where c1 = 4.111;delete from t1 where c1 = 5.111;delete from t1 where c1 = 7.1;//
affected rows: 0
affected rows: 0
affected rows: 0
delete from t1 where c1 = 10+1.111;delete from t1 where c1 = 11+1.111;delete from t1 where c1 = 12+1.111;//
affected rows: 0
affected rows: 0
affected rows: 0
select c1 from t1;
+--------+
| c1     |
+--------+
|  1.111 |
|  2.111 |
|  3.111 |
|  4.111 |
|  5.111 |
|  6.111 |
|    7.1 |
| 11.111 |
| 12.111 |
| 13.111 |
| 14.111 |
| 15.111 |
| 16.111 |
|   17.1 |
+--------+
affected rows: 14
select hit_count, is_batched_multi_stmt, statement, query_sql from oceanbase.GV$OB_PLAN_CACHE_PLAN_STAT where statement like 'delete from t1 where c1 = %' order by hit_count;
+-----------+-----------------------+-------------------------------+-----------------------------------------------------------------------------------------------------------+
| hit_count | is_batched_multi_stmt | statement                     | query_sql                                                                                                 |
+-----------+-----------------------+-------------------------------+-----------------------------------------------------------------------------------------------------------+
|         0 |                     0 | delete from t1 where c1 = ?;  | delete from t1 where c1 = ?;                                                                              |
|         0 |                     1 | delete from t1 where c1 = ?   | delete from t1 where c1 = 1.111;delete from t1 where c1 = 2.111;delete from t1 where c1 = 3.111;          |
|         0 |                     0 | delete from t1 where c1 = ?;  | delete from t1 where c1 = 7.1;                                                                            |
|         0 |                     1 | delete from t1 where c1 = ?+? | delete from t1 where c1 = 10+1.111;delete from t1 where c1 = 11+1.111;delete from t1 where c1 = 12+1.111; |
|         1 |                     0 | delete from t1 where c1 = ?;  | delete from t1 where c1 = ?;                                                                              |
|         1 |                     0 | delete from t1 where c1 = ?;  | delete from t1 where c1 = 4.111;                                                                          |
+-----------+-----------------------+-------------------------------+-----------------------------------------------------------------------------------------------------------+
affected rows: 6
rollback;
affected rows: 0

#double类型,where条件后精度不同回退
delete from t1 where c2 = 1.111;delete from t1 where c2 = 2.222;delete from t1 where c2 = 3.222;//
affected rows: 1
affected rows: 1
affected rows: 1
delete from t1 where c2 = 4.222;delete from t1 where c2 = 5.222;delete from t1 where c2 = 7.20000;//
affected rows: 1
affected rows: 1
affected rows: 1
delete from t1 where c2 = 10+1.111;delete from t1 where c2 = 11+1.222;delete from t1 where c2 = 12+1.222;//
affected rows: 1
affected rows: 1
affected rows: 1
select c2 from t1;
+--------+
| c2     |
+--------+
|  6.222 |
| 14.222 |
| 15.222 |
| 16.222 |
|   17.2 |
+--------+
affected rows: 5
select hit_count, is_batched_multi_stmt, statement, query_sql from oceanbase.GV$OB_PLAN_CACHE_PLAN_STAT where statement like 'delete from t1 where c2 = %' order by hit_count;
+-----------+-----------------------+-------------------------------+-----------------------------------------------------------------------------------------------------------+
| hit_count | is_batched_multi_stmt | statement                     | query_sql                                                                                                 |
+-----------+-----------------------+-------------------------------+-----------------------------------------------------------------------------------------------------------+
|         0 |                     0 | delete from t1 where c2 = ?;  | delete from t1 where c2 = ?;                                                                              |
|         0 |                     1 | delete from t1 where c2 = ?   | delete from t1 where c2 = 1.111;delete from t1 where c2 = 2.222;delete from t1 where c2 = 3.222;          |
|         0 |                     0 | delete from t1 where c2 = ?;  | delete from t1 where c2 = 7.20000;                                                                        |
|         0 |                     1 | delete from t1 where c2 = ?+? | delete from t1 where c2 = 10+1.111;delete from t1 where c2 = 11+1.222;delete from t1 where c2 = 12+1.222; |
|         1 |                     0 | delete from t1 where c2 = ?;  | delete from t1 where c2 = ?;                                                                              |
|         1 |                     0 | delete from t1 where c2 = ?;  | delete from t1 where c2 = 4.222;                                                                          |
+-----------+-----------------------+-------------------------------+-----------------------------------------------------------------------------------------------------------+
affected rows: 6
rollback;
affected rows: 0

#decimal,where条件后精度不同回退
delete from t1 where c3 = 1.111;delete from t1 where c3 = 2.333;delete from t1 where c3 = 3.333;//
affected rows: 1
affected rows: 1
affected rows: 1
delete from t1 where c3 = 5.333;delete from t1 where c3 = 6.333;delete from t1 where c3 = 7.30;//
affected rows: 1
affected rows: 1
affected rows: 1
delete from t1 where c3 = 13+1.333;delete from t1 where c3 = 14+1.333;delete from t1 where c3 = 15+1.333;//
affected rows: 1
affected rows: 1
affected rows: 1
select c3 from t1;
+--------+
| c3     |
+--------+
|  4.333 |
| 11.111 |
| 12.333 |
| 13.333 |
| 17.300 |
+--------+
affected rows: 5
select hit_count, is_batched_multi_stmt, statement, query_sql from oceanbase.GV$OB_PLAN_CACHE_PLAN_STAT where statement like 'delete from t1 where c3 = %' order by hit_count;
+-----------+-----------------------+-------------------------------+-----------------------------------------------------------------------------------------------------------+
| hit_count | is_batched_multi_stmt | statement                     | query_sql                                                                                                 |
+-----------+-----------------------+-------------------------------+-----------------------------------------------------------------------------------------------------------+
|         0 |                     0 | delete from t1 where c3 = ?;  | delete from t1 where c3 = ?;                                                                              |
|         0 |                     1 | delete from t1 where c3 = ?   | delete from t1 where c3 = 1.111;delete from t1 where c3 = 2.333;delete from t1 where c3 = 3.333;          |
|         0 |                     0 | delete from t1 where c3 = ?;  | delete from t1 where c3 = 7.30;                                                                           |
|         0 |                     1 | delete from t1 where c3 = ?+? | delete from t1 where c3 = 13+1.333;delete from t1 where c3 = 14+1.333;delete from t1 where c3 = 15+1.333; |
|         1 |                     0 | delete from t1 where c3 = ?;  | delete from t1 where c3 = ?;                                                                              |
|         1 |                     0 | delete from t1 where c3 = ?;  | delete from t1 where c3 = 5.333;                                                                          |
+-----------+-----------------------+-------------------------------+-----------------------------------------------------------------------------------------------------------+
affected rows: 6
rollback;
affected rows: 0

drop table t1;
affected rows: 0

#datetime、year、timestamp
create table t2 (c1 datetime not null,c2 year ,c3 timestamp not null,primary key(c1,c2))
partition by key(c1)
partitions 3;
affected rows: 0
insert into t2 values('2000-01-01','2000','2000-01-01'),('2001-01-01','2001','2001-01-01'),('2002-01-01','2002','2002-01-01'),('2003-01-01','2003','2003-01-01'),('2004-01-01','2004','2004-01-01'),('2005-01-01','2005','2005-01-01');
affected rows: 6
info: Records: 6  Duplicates: 0  Warnings: 0
commit;
affected rows: 0
insert into t2 values('2006-01-01','2006','2006-01-01'),('2007-01-01','2007','2007-01-01'),('2008-01-01','2008','2008-01-01'),('2009-01-01 10:10:00','2009','2009-01-01'),('2010-01-01','2010','2010-01-01 01:01:01'),('2011-01-01','2011','2011-01-01');
affected rows: 6
info: Records: 6  Duplicates: 0  Warnings: 0
commit;
affected rows: 0

delete from t2 where c1 = '2000-01-01';delete from t2 where c1 = '2001-01-01';delete from t2 where c1 = '2002-01-01';//
affected rows: 1
affected rows: 1
affected rows: 1
delete from t2 where c1 = '2006-01-01';delete from t2 where c1 = '2009-01-01 10:10:00';delete from t2 where c1 = '2010-01-01';//
affected rows: 1
affected rows: 1
affected rows: 1
select * from t2;
+---------------------+------+---------------------+
| c1                  | c2   | c3                  |
+---------------------+------+---------------------+
| 2005-01-01 00:00:00 | 2005 | 2005-01-01 00:00:00 |
| 2007-01-01 00:00:00 | 2007 | 2007-01-01 00:00:00 |
| 2011-01-01 00:00:00 | 2011 | 2011-01-01 00:00:00 |
| 2004-01-01 00:00:00 | 2004 | 2004-01-01 00:00:00 |
| 2003-01-01 00:00:00 | 2003 | 2003-01-01 00:00:00 |
| 2008-01-01 00:00:00 | 2008 | 2008-01-01 00:00:00 |
+---------------------+------+---------------------+
affected rows: 6
select hit_count, is_batched_multi_stmt, statement, query_sql from oceanbase.GV$OB_PLAN_CACHE_PLAN_STAT where statement like 'delete from t2 where c1 = %' order by hit_count;
+-----------+-----------------------+-----------------------------+-----------------------------------------------------------------------------------------------------------------------+
| hit_count | is_batched_multi_stmt | statement                   | query_sql                                                                                                             |
+-----------+-----------------------+-----------------------------+-----------------------------------------------------------------------------------------------------------------------+
|         1 |                     1 | delete from t2 where c1 = ? | delete from t2 where c1 = '2000-01-01';delete from t2 where c1 = '2001-01-01';delete from t2 where c1 = '2002-01-01'; |
+-----------+-----------------------+-----------------------------+-----------------------------------------------------------------------------------------------------------------------+
affected rows: 1
rollback;
affected rows: 0

drop table t2;
affected rows: 0


create table t3 (c1 datetime not null,c2 year,c3 timestamp not null,primary key(c1,c2),index index_c2(c2))
partition by hash(c2)
partitions 3;
affected rows: 0
insert into t3 values('2000-01-01','2000','2000-01-01'),('2001-01-01','2001','2001-01-01'),('2002-01-01','2002','2002-01-01'),('2003-01-01','2003','2003-01-01'),('2004-01-01','2004','2004-01-01'),('2005-01-01','2005','2005-01-01');
affected rows: 6
info: Records: 6  Duplicates: 0  Warnings: 0
commit;
affected rows: 0
insert into t3 values('2006-01-01','2006','2006-01-01'),('2007-01-01','2007','2007-01-01'),('2008-01-01','2008','2008-01-01'),('2009-01-01 10:10:00','2009','2009-01-01'),('2010-01-01','2010','2010-01-01 01:01:01'),('2011-01-01','2011','2011-01-01');
affected rows: 6
info: Records: 6  Duplicates: 0  Warnings: 0
commit;
affected rows: 0

alter system flush plan cache global;
affected rows: 0
delete from t3 where c2 = '2001';delete from t3 where c2 = '2002';delete from t3 where c2 = '2003';//
affected rows: 1
affected rows: 1
affected rows: 1
delete from t3 where c2 = '2001'+9;delete from t3 where c2 = '2002'+5;delete from t3 where c2 = '2003'+6;//
affected rows: 1
affected rows: 1
affected rows: 1
select * from t3;
+---------------------+------+---------------------+
| c1                  | c2   | c3                  |
+---------------------+------+---------------------+
| 2005-01-01 00:00:00 | 2005 | 2005-01-01 00:00:00 |
| 2008-01-01 00:00:00 | 2008 | 2008-01-01 00:00:00 |
| 2011-01-01 00:00:00 | 2011 | 2011-01-01 00:00:00 |
| 2000-01-01 00:00:00 | 2000 | 2000-01-01 00:00:00 |
| 2006-01-01 00:00:00 | 2006 | 2006-01-01 00:00:00 |
| 2004-01-01 00:00:00 | 2004 | 2004-01-01 00:00:00 |
+---------------------+------+---------------------+
affected rows: 6
select hit_count, is_batched_multi_stmt, statement, query_sql from oceanbase.GV$OB_PLAN_CACHE_PLAN_STAT where statement like 'delete from t3 where c2 = %' order by hit_count;
+-----------+-----------------------+-------------------------------+-----------------------------------------------------------------------------------------------------------+
| hit_count | is_batched_multi_stmt | statement                     | query_sql                                                                                                 |
+-----------+-----------------------+-------------------------------+-----------------------------------------------------------------------------------------------------------+
|         0 |                     1 | delete from t3 where c2 = ?   | delete from t3 where c2 = '2001';delete from t3 where c2 = '2002';delete from t3 where c2 = '2003';       |
|         0 |                     1 | delete from t3 where c2 = ?+? | delete from t3 where c2 = '2001'+9;delete from t3 where c2 = '2002'+5;delete from t3 where c2 = '2003'+6; |
+-----------+-----------------------+-------------------------------+-----------------------------------------------------------------------------------------------------------+
affected rows: 2
rollback;
affected rows: 0

alter system flush plan cache global;
affected rows: 0
delete from t3 where c2 = 2004;delete from t3 where c2 = 2005;delete from t3 where c2 = 2006;//
affected rows: 1
affected rows: 1
affected rows: 1
delete from t3 where c2 = '2001'+'7';delete from t3 where c2 = '2002'+'9';delete from t3 where c2 = '1999'+'1';//
affected rows: 1
affected rows: 1
affected rows: 1
select * from t3;
+---------------------+------+---------------------+
| c1                  | c2   | c3                  |
+---------------------+------+---------------------+
| 2002-01-01 00:00:00 | 2002 | 2002-01-01 00:00:00 |
| 2003-01-01 00:00:00 | 2003 | 2003-01-01 00:00:00 |
| 2009-01-01 10:10:00 | 2009 | 2009-01-01 00:00:00 |
| 2001-01-01 00:00:00 | 2001 | 2001-01-01 00:00:00 |
| 2007-01-01 00:00:00 | 2007 | 2007-01-01 00:00:00 |
| 2010-01-01 00:00:00 | 2010 | 2010-01-01 01:01:01 |
+---------------------+------+---------------------+
affected rows: 6
select hit_count, is_batched_multi_stmt, statement, query_sql from oceanbase.GV$OB_PLAN_CACHE_PLAN_STAT where statement like 'delete from t3 where c2 = %' order by hit_count;
+-----------+-----------------------+-------------------------------+-----------------------------------------------------------------------------------------------------------------+
| hit_count | is_batched_multi_stmt | statement                     | query_sql                                                                                                       |
+-----------+-----------------------+-------------------------------+-----------------------------------------------------------------------------------------------------------------+
|         0 |                     1 | delete from t3 where c2 = ?   | delete from t3 where c2 = 2004;delete from t3 where c2 = 2005;delete from t3 where c2 = 2006;                   |
|         0 |                     1 | delete from t3 where c2 = ?+? | delete from t3 where c2 = '2001'+'7';delete from t3 where c2 = '2002'+'9';delete from t3 where c2 = '1999'+'1'; |
+-----------+-----------------------+-------------------------------+-----------------------------------------------------------------------------------------------------------------+
affected rows: 2
rollback;
affected rows: 0
drop table t3;
affected rows: 0


create table t4 (c1 datetime not null,c2 year ,c3 timestamp not null,primary key(c3))
partition by key(c3)
partitions 3;
affected rows: 0
create index index_c3 on t4(c3);
affected rows: 0
insert into t4 values('2000-01-01','2000','2000-01-01'),('2001-01-01','2001','2001-01-01'),('2002-01-01','2002','2002-01-01'),('2003-01-01','2003','2003-01-01'),('2004-01-01','2004','2004-01-01'),('2005-01-01','2005','2005-01-01');
affected rows: 6
info: Records: 6  Duplicates: 0  Warnings: 0
commit;
affected rows: 0
insert into t4 values('2006-01-01','2006','2006-01-01'),('2007-01-01','2007','2007-01-01'),('2008-01-01','2008','2008-01-01'),('2009-01-01 10:10:00','2009','2009-01-01'),('2010-01-01','2010','2010-01-01 01:01:01'),('2011-01-01','2011','2011-01-01');
affected rows: 6
info: Records: 6  Duplicates: 0  Warnings: 0
commit;
affected rows: 0

delete from t4 where c1 = '2000-01-01';delete from t4 where c1 = '2001-01-01';delete from t4 where c1 = '2002-01-01';//
affected rows: 1
affected rows: 1
affected rows: 1
delete from t4 where c1 = '2006-01-01';delete from t4 where c1 = '2010-01-01 01:01:01';delete from t4 where c1 = '2010-01-01';//
affected rows: 1
affected rows: 0
affected rows: 1
select * from t4;
+---------------------+------+---------------------+
| c1                  | c2   | c3                  |
+---------------------+------+---------------------+
| 2003-01-01 00:00:00 | 2003 | 2003-01-01 00:00:00 |
| 2007-01-01 00:00:00 | 2007 | 2007-01-01 00:00:00 |
| 2011-01-01 00:00:00 | 2011 | 2011-01-01 00:00:00 |
| 2004-01-01 00:00:00 | 2004 | 2004-01-01 00:00:00 |
| 2009-01-01 10:10:00 | 2009 | 2009-01-01 00:00:00 |
| 2005-01-01 00:00:00 | 2005 | 2005-01-01 00:00:00 |
| 2008-01-01 00:00:00 | 2008 | 2008-01-01 00:00:00 |
+---------------------+------+---------------------+
affected rows: 7
select hit_count, is_batched_multi_stmt, statement, query_sql from oceanbase.GV$OB_PLAN_CACHE_PLAN_STAT where statement like 'delete from t4 where c1 = %' order by hit_count;
+-----------+-----------------------+-----------------------------+-----------------------------------------------------------------------------------------------------------------------+
| hit_count | is_batched_multi_stmt | statement                   | query_sql                                                                                                             |
+-----------+-----------------------+-----------------------------+-----------------------------------------------------------------------------------------------------------------------+
|         1 |                     1 | delete from t4 where c1 = ? | delete from t4 where c1 = '2000-01-01';delete from t4 where c1 = '2001-01-01';delete from t4 where c1 = '2002-01-01'; |
+-----------+-----------------------+-----------------------------+-----------------------------------------------------------------------------------------------------------------------+
affected rows: 1
rollback;
affected rows: 0

drop table t4;
affected rows: 0


alter system set _rowsets_enabled=true;
affected rows: 0
set autocommit = true;
affected rows: 0
alter system set ob_enable_batched_multi_statement=false;
affected rows: 0

