drop database if exists db1;
create database db1;
use db1;
result_format: 4
alter system flush plan cache global;
affected rows: 0

alter system set _rowsets_enabled=false;
affected rows: 0

set autocommit = false;
affected rows: 0
alter system set ob_enable_batched_multi_statement=true;
affected rows: 0

#primary key
drop table if exists t1;
affected rows: 0
Warnings:
Note	1051	Unknown table 'db1.t1'
create table t1(c1 int primary key,c2 varchar(30) not null);
affected rows: 0
insert into t1 values(2000,'NULL'),(2001,'AA'),(2002,'AA'),(2003,'CC'),(2004,'6A'),(2005,'端午'),(2006,'￥%…………'),(2007,'123'),(2008,'【AA】'),(2009,'ash#2'),(2010,'cc');
affected rows: 11
info: Records: 11  Duplicates: 0  Warnings: 0
commit;
affected rows: 0
drop table if exists t2;
affected rows: 0
Warnings:
Note	1051	Unknown table 'db1.t2'
create table t2(c1 year primary key,c2 double not null);
affected rows: 0
insert into t2 values(2001,1.1),(2002,2.11),(2003,3.111),(2005,5.11111),(2006,6.111111),(2007,7.1111111),(2008,8.11111111),(2009,9.111111111),(2010,10.1111111111),(2012,12.111111111111);
affected rows: 10
info: Records: 10  Duplicates: 0  Warnings: 0
commit;
affected rows: 0

#没有进行batch 优化
alter system flush plan cache global;
affected rows: 0
delete from t1 where c1 = 2000;delete from t1 where c1 = 2001;delete from t1 where c1 = 2002;//
affected rows: 1
affected rows: 1
affected rows: 1
delete from t2 where c1 = 2000+1+1;delete from t2 where c1 = 2001+1+1;delete from t2 where c1 = 2002+1+1;//
affected rows: 1
affected rows: 1
affected rows: 0
select * from t1;
+------+------------------+
| c1   | c2               |
+------+------------------+
| 2003 | CC               |
| 2004 | 6A               |
| 2005 | 端午             |
| 2006 | ￥%…………          |
| 2007 | 123              |
| 2008 | 【AA】           |
| 2009 | ash#2            |
| 2010 | cc               |
+------+------------------+
affected rows: 8
select * from t2;
+------+-----------------+
| c1   | c2              |
+------+-----------------+
| 2001 |             1.1 |
| 2005 |         5.11111 |
| 2006 |        6.111111 |
| 2007 |       7.1111111 |
| 2008 |      8.11111111 |
| 2009 |     9.111111111 |
| 2010 |   10.1111111111 |
| 2012 | 12.111111111111 |
+------+-----------------+
affected rows: 8
select hit_count, is_batched_multi_stmt, statement, query_sql from oceanbase.GV$OB_PLAN_CACHE_PLAN_STAT where statement like 'delete from t1 where c1 = %' order by hit_count;
+-----------+-----------------------+-----------------------------+-----------------------------------------------------------------------------------------------+
| hit_count | is_batched_multi_stmt | statement                   | query_sql                                                                                     |
+-----------+-----------------------+-----------------------------+-----------------------------------------------------------------------------------------------+
|         0 |                     1 | delete from t1 where c1 = ? | delete from t1 where c1 = 2000;delete from t1 where c1 = 2001;delete from t1 where c1 = 2002; |
+-----------+-----------------------+-----------------------------+-----------------------------------------------------------------------------------------------+
affected rows: 1
select hit_count, is_batched_multi_stmt, statement, query_sql from oceanbase.GV$OB_PLAN_CACHE_PLAN_STAT where statement like 'delete from t2 where c1 = %' order by hit_count;
+-----------+-----------------------+---------------------------------+-----------------------------------------------------------------------------------------------------------+
| hit_count | is_batched_multi_stmt | statement                       | query_sql                                                                                                 |
+-----------+-----------------------+---------------------------------+-----------------------------------------------------------------------------------------------------------+
|         0 |                     1 | delete from t2 where c1 = ?+?+? | delete from t2 where c1 = 2000+1+1;delete from t2 where c1 = 2001+1+1;delete from t2 where c1 = 2002+1+1; |
+-----------+-----------------------+---------------------------------+-----------------------------------------------------------------------------------------------------------+
affected rows: 1
rollback;
affected rows: 0

#delete join(没有batch 优化)
delete t1,t2 from t1,t2 where t1.c1 = t2.c1 and t1.c1 = 2005;delete t1,t2 from t1,t2 where t1.c1 = t2.c1 and t1.c1 = 2006;delete t1,t2 from t1,t2 where t1.c1 = t2.c1 and t1.c1 = 2007;//
affected rows: 2
affected rows: 2
affected rows: 2
select hit_count, is_batched_multi_stmt, statement, query_sql from oceanbase.GV$OB_PLAN_CACHE_PLAN_STAT where statement like 'delete t1,t2 from t1,t2 where t1.c1 = t2.c1 and t1.c1 = %' order by hit_count;
+-----------+-----------------------+------------------------------------------------------------+---------------------------------------------------------------+
| hit_count | is_batched_multi_stmt | statement                                                  | query_sql                                                     |
+-----------+-----------------------+------------------------------------------------------------+---------------------------------------------------------------+
|         2 |                     0 | delete t1,t2 from t1,t2 where t1.c1 = t2.c1 and t1.c1 = ?; | delete t1,t2 from t1,t2 where t1.c1 = t2.c1 and t1.c1 = 2005; |
+-----------+-----------------------+------------------------------------------------------------+---------------------------------------------------------------+
affected rows: 1
rollback;
affected rows: 0

drop table t1;
affected rows: 0


#unique key
create table t3(c1 int unique key,c2 varchar(30) not null) partition by hash(c1)
(partition p1,
partition p2,
partition p3
);
affected rows: 0
insert into t3 values(1,'NULL'),(2,'AA'),(3,'AA'),(4,'CC'),(6,'6A'),(7,'端午'),(8,'￥%…………'),(9,'123'),(10,'【AA】'),(11,'ash#2'),(12,'cc');
affected rows: 11
info: Records: 11  Duplicates: 0  Warnings: 0
commit;
affected rows: 0

create table t4(c1 int primary key auto_increment,c2 datetime not null);
affected rows: 0
insert into t4 values(1,'2022-01-01'),(2,'2022-01-02'),(3,'2022-01-03'),(4,'2022-01-04'),(5,'2022-01-05'),(6,'2022-01-06'),(7,'2022-01-07'),(8,'2022-01-08'),(9,'2022-01-09');
affected rows: 9
info: Records: 9  Duplicates: 0  Warnings: 0
commit;
affected rows: 0

#obs1模式报错


#没有进行batch优化
alter system flush plan cache global;
affected rows: 0
delete from t3 where c1 =(select 1+1+1);delete from t3 where c1 =(select 2+2+2);delete from t3 where c1 =(select 3+3+3);//
affected rows: 1
affected rows: 1
affected rows: 1
select * from t3 order by c1;
+------+------------------+
| c1   | c2               |
+------+------------------+
|    1 | NULL             |
|    2 | AA               |
|    4 | CC               |
|    7 | 端午             |
|    8 | ￥%…………          |
|   10 | 【AA】           |
|   11 | ash#2            |
|   12 | cc               |
+------+------------------+
affected rows: 8
select hit_count, is_batched_multi_stmt, statement, query_sql from oceanbase.GV$OB_PLAN_CACHE_PLAN_STAT where statement like 'delete from t3 where c1 =%'order by hit_count;
+-----------+-----------------------+------------------------------------------+------------------------------------------+
| hit_count | is_batched_multi_stmt | statement                                | query_sql                                |
+-----------+-----------------------+------------------------------------------+------------------------------------------+
|         2 |                     0 | delete from t3 where c1 =(select ?+?+?); | delete from t3 where c1 =(select 1+1+1); |
+-----------+-----------------------+------------------------------------------+------------------------------------------+
affected rows: 1
rollback;
affected rows: 0

#delete ..inner join..没有进行batch优化
delete t3,t4 from t3 inner join t4 on t3.c1 = t4.c1 where t3.c1 = 1;delete t3,t4 from t3 inner join t4 on t3.c1 = t4.c1 where t3.c1 = 2;delete t3,t4 from t3 inner join t4 on t3.c1 = t4.c1 where t3.c1 = 3;//
affected rows: 2
affected rows: 2
affected rows: 2
select * from t3 inner join t4 on t3.c1 = t4.c1 order by t3.c1;
+------+------------------+----+---------------------+
| c1   | c2               | c1 | c2                  |
+------+------------------+----+---------------------+
|    4 | CC               |  4 | 2022-01-04 00:00:00 |
|    6 | 6A               |  6 | 2022-01-06 00:00:00 |
|    7 | 端午             |  7 | 2022-01-07 00:00:00 |
|    8 | ￥%…………          |  8 | 2022-01-08 00:00:00 |
|    9 | 123              |  9 | 2022-01-09 00:00:00 |
+------+------------------+----+---------------------+
affected rows: 5
select hit_count, is_batched_multi_stmt, statement, query_sql from oceanbase.GV$OB_PLAN_CACHE_PLAN_STAT where statement like 'delete t3,t4 from t3 inner join t4 on t3.c1 = t4.c1 where t3.c1 = %' order by hit_count;
+-----------+-----------------------+----------------------------------------------------------------------+----------------------------------------------------------------------+
| hit_count | is_batched_multi_stmt | statement                                                            | query_sql                                                            |
+-----------+-----------------------+----------------------------------------------------------------------+----------------------------------------------------------------------+
|         2 |                     0 | delete t3,t4 from t3 inner join t4 on t3.c1 = t4.c1 where t3.c1 = ?; | delete t3,t4 from t3 inner join t4 on t3.c1 = t4.c1 where t3.c1 = 1; |
+-----------+-----------------------+----------------------------------------------------------------------+----------------------------------------------------------------------+
affected rows: 1
rollback;
affected rows: 0
drop table t3;
affected rows: 0
drop table t4;
affected rows: 0


#not null
create table t5(c1 int not null,c2 varchar(30));
affected rows: 0
insert into t5 values(1,'NULL'),(2,'AA'),(3,'AA'),(4,'CC'),(6,'6A'),(7,'端午'),(8,'￥%…………'),(9,'123'),(10,'【AA】'),(11,'ash#2'),(12,'cc');
affected rows: 11
info: Records: 11  Duplicates: 0  Warnings: 0
commit;
affected rows: 0

create table t6(c1 char(20) not null,c2 int not null);
affected rows: 0
insert into t6 values(1,1),(2,2),(3,3),(5,5),(6,6),(7,7),(8,8),(9,9),(10,10),(12,12);
affected rows: 10
info: Records: 10  Duplicates: 0  Warnings: 0
commit;
affected rows: 0

alter system flush plan cache global;
affected rows: 0
delete from t5 where c1 =1*2*2;delete from t5 where c1 =2*2*2;delete from t5 where c1 =3*2*1;//
affected rows: 1
affected rows: 1
affected rows: 1
select * from t5;
+----+----------+
| c1 | c2       |
+----+----------+
|  1 | NULL     |
|  2 | AA       |
|  3 | AA       |
|  7 | 端午     |
|  9 | 123      |
| 10 | 【AA】   |
| 11 | ash#2    |
| 12 | cc       |
+----+----------+
affected rows: 8
select hit_count, is_batched_multi_stmt, statement, query_sql from oceanbase.GV$OB_PLAN_CACHE_PLAN_STAT where statement like 'delete from t5 where c1 =%'order by hit_count;
+-----------+-----------------------+--------------------------------+-----------------------------------------------------------------------------------------------+
| hit_count | is_batched_multi_stmt | statement                      | query_sql                                                                                     |
+-----------+-----------------------+--------------------------------+-----------------------------------------------------------------------------------------------+
|         0 |                     1 | delete from t5 where c1 =?*?*? | delete from t5 where c1 =1*2*2;delete from t5 where c1 =2*2*2;delete from t5 where c1 =3*2*1; |
+-----------+-----------------------+--------------------------------+-----------------------------------------------------------------------------------------------+
affected rows: 1
rollback;
affected rows: 0

#delete 重复行   batch场景回退
alter system flush plan cache global;
affected rows: 0
delete from t5 where c1 =6;delete from t5 where c1 =7;delete from t5 where c1 =6;//
affected rows: 1
affected rows: 1
affected rows: 0
select * from t5;
+----+------------------+
| c1 | c2               |
+----+------------------+
|  1 | NULL             |
|  2 | AA               |
|  3 | AA               |
|  4 | CC               |
|  8 | ￥%…………          |
|  9 | 123              |
| 10 | 【AA】           |
| 11 | ash#2            |
| 12 | cc               |
+----+------------------+
affected rows: 9
select hit_count, is_batched_multi_stmt, statement, query_sql from oceanbase.GV$OB_PLAN_CACHE_PLAN_STAT where statement like 'delete from t5 where c1 =%'order by hit_count;
+-----------+-----------------------+-----------------------------+-----------------------------------------------------------------------------------+
| hit_count | is_batched_multi_stmt | statement                   | query_sql                                                                         |
+-----------+-----------------------+-----------------------------+-----------------------------------------------------------------------------------+
|         0 |                     1 | delete from t5 where c1 =?  | delete from t5 where c1 =6;delete from t5 where c1 =7;delete from t5 where c1 =6; |
|         2 |                     0 | delete from t5 where c1 =?; | delete from t5 where c1 =6;                                                       |
+-----------+-----------------------+-----------------------------+-----------------------------------------------------------------------------------+
affected rows: 2
rollback;
affected rows: 0

#delete ..left join...
alter system flush plan cache global;
affected rows: 0
delete t5,t6 from t5 left join t6 on t5.c1 = t6.c1 where t5.c1 = 1;delete t5,t6 from t5 left join t6 on t5.c1 = t6.c1 where t5.c1 = 2;delete t5,t6 from t5 left join t6 on t5.c1 = t6.c1 where t5.c1 = 3;//
affected rows: 2
affected rows: 2
affected rows: 2
select *  from t5 left join t6 on t5.c1 = t6.c1 order by t5.c1;
+----+------------------+----+----+
| c1 | c2               | c1 | c2 |
+----+------------------+----+----+
|  4 | CC               | NULL | NULL |
|  6 | 6A               | 6  |  6 |
|  7 | 端午             | 7  |  7 |
|  8 | ￥%…………          | 8  |  8 |
|  9 | 123              | 9  |  9 |
| 10 | 【AA】           | 10 | 10 |
| 11 | ash#2            | NULL | NULL |
| 12 | cc               | 12 | 12 |
+----+------------------+----+----+
affected rows: 8
select hit_count, is_batched_multi_stmt, statement, query_sql from oceanbase.GV$OB_PLAN_CACHE_PLAN_STAT where statement like 'delete t5,t6 from t5 left join t6 on t5.c1 = t6.c1 where t5.c1 = %'order by hit_count;
+-----------+-----------------------+---------------------------------------------------------------------+---------------------------------------------------------------------+
| hit_count | is_batched_multi_stmt | statement                                                           | query_sql                                                           |
+-----------+-----------------------+---------------------------------------------------------------------+---------------------------------------------------------------------+
|         2 |                     0 | delete t5,t6 from t5 left join t6 on t5.c1 = t6.c1 where t5.c1 = ?; | delete t5,t6 from t5 left join t6 on t5.c1 = t6.c1 where t5.c1 = 1; |
+-----------+-----------------------+---------------------------------------------------------------------+---------------------------------------------------------------------+
affected rows: 1
rollback;
affected rows: 0
drop table t5;
affected rows: 0
drop table t6;
affected rows: 0

alter system set _rowsets_enabled=true;
affected rows: 0
set autocommit = true;
affected rows: 0
alter system set ob_enable_batched_multi_statement=false;
affected rows: 0

