drop database if exists db1;
create database db1;
use db1;
result_format: 4
alter system flush plan cache global;
affected rows: 0

alter system set _rowsets_enabled=false;
affected rows: 0

set autocommit = false;
affected rows: 0
alter system set ob_enable_batched_multi_statement=true;
affected rows: 0

#key分区
drop table if exists t10,t11,t12;
affected rows: 0
Warnings:
Note	1051	Unknown table 'db1.t10'
Note	1051	Unknown table 'db1.t11'
Note	1051	Unknown table 'db1.t12'
create table t10(c1 year not null primary key , c2 datetime not null,index index_c1(c1))
partition by key(c1)
partitions 3;
affected rows: 0
insert into t10 values(2001,'2001-01-01'),(2002,'2002-02-02'),(2003,'2003-03-03'),(2004,'2004-04-04'),(2005,'2005-05-05'),(2006,'2006-06-06'),(2007,'2007-07-07'),(2008,'2008-08-08'),(2009,'2009-09-09'),(2010,'2010-10-10'),(2011,'2011-11-11'),(2012,'2012-12-12');
affected rows: 12
info: Records: 12  Duplicates: 0  Warnings: 0
commit;
affected rows: 0

create table t11(a1 varchar(20),a2 datetime not null);
affected rows: 0
insert into t11 values(2001,'2001-01-01'),(2002,'2002-02-02'),(2003,'2003-03-03'),(2004,'2004-04-04'),(2005,'2005-05-05'),(2006,'2006-06-06'),(2007,'2007-07-07'),(2008,'2008-08-08'),(2009,'2009-09-09'),(2010,'2010-10-10'),(2011,'2011-11-11'),(2012,'2012-12-12');
affected rows: 12
info: Records: 12  Duplicates: 0  Warnings: 0
commit;
affected rows: 0
create table t12(b1 int,b2 datetime not null);
affected rows: 0
insert into t12 values(2001,'2001-01-01'),(2002,'2002-02-02'),(2003,'2003-03-03'),(2004,'2004-04-04'),(2005,'2005-05-05'),(2006,'2006-06-06'),(2007,'2007-07-07'),(2008,'2008-08-08'),(2009,'2009-09-09'),(2010,'2010-10-10'),(2011,'2011-11-11'),(2012,'2012-12-12');
affected rows: 12
info: Records: 12  Duplicates: 0  Warnings: 0
commit;
affected rows: 0

alter system flush plan cache global;
affected rows: 0
delete from t10 where c1 = 5;delete from t10 where c1 = 6;delete from t10 where c1 = 8;//
affected rows: 1
affected rows: 1
affected rows: 1
select * from t10;
+------+---------------------+
| c1   | c2                  |
+------+---------------------+
| 2003 | 2003-03-03 00:00:00 |
| 2004 | 2004-04-04 00:00:00 |
| 2009 | 2009-09-09 00:00:00 |
| 2011 | 2011-11-11 00:00:00 |
| 2001 | 2001-01-01 00:00:00 |
| 2002 | 2002-02-02 00:00:00 |
| 2007 | 2007-07-07 00:00:00 |
| 2010 | 2010-10-10 00:00:00 |
| 2012 | 2012-12-12 00:00:00 |
+------+---------------------+
affected rows: 9
select hit_count, is_batched_multi_stmt, statement, query_sql from oceanbase.GV$OB_PLAN_CACHE_PLAN_STAT where statement like 'delete from t10 where c1 = %' order by hit_count;
+-----------+-----------------------+------------------------------+-----------------------------------------------------------------------------------------+
| hit_count | is_batched_multi_stmt | statement                    | query_sql                                                                               |
+-----------+-----------------------+------------------------------+-----------------------------------------------------------------------------------------+
|         0 |                     1 | delete from t10 where c1 = ? | delete from t10 where c1 = 5;delete from t10 where c1 = 6;delete from t10 where c1 = 8; |
+-----------+-----------------------+------------------------------+-----------------------------------------------------------------------------------------+
affected rows: 1
rollback;
affected rows: 0

delete from t10 partition(p0) where c1 = 5;delete from t10 partition(p0) where c1 = 6;delete from t10 partition(p0) where c1 = 8;//
affected rows: 0
affected rows: 0
affected rows: 1
select * from t10;
+------+---------------------+
| c1   | c2                  |
+------+---------------------+
| 2003 | 2003-03-03 00:00:00 |
| 2004 | 2004-04-04 00:00:00 |
| 2009 | 2009-09-09 00:00:00 |
| 2011 | 2011-11-11 00:00:00 |
| 2001 | 2001-01-01 00:00:00 |
| 2002 | 2002-02-02 00:00:00 |
| 2005 | 2005-05-05 00:00:00 |
| 2006 | 2006-06-06 00:00:00 |
| 2007 | 2007-07-07 00:00:00 |
| 2010 | 2010-10-10 00:00:00 |
| 2012 | 2012-12-12 00:00:00 |
+------+---------------------+
affected rows: 11
select hit_count, is_batched_multi_stmt, statement, query_sql from oceanbase.GV$OB_PLAN_CACHE_PLAN_STAT where statement like 'delete from t10 partition(p0) where c1 = %' order by hit_count;
+-----------+-----------------------+--------------------------------------------+-----------------------------------------------------------------------------------------------------------------------------------+
| hit_count | is_batched_multi_stmt | statement                                  | query_sql                                                                                                                         |
+-----------+-----------------------+--------------------------------------------+-----------------------------------------------------------------------------------------------------------------------------------+
|         0 |                     1 | delete from t10 partition(p0) where c1 = ? | delete from t10 partition(p0) where c1 = 5;delete from t10 partition(p0) where c1 = 6;delete from t10 partition(p0) where c1 = 8; |
+-----------+-----------------------+--------------------------------------------+-----------------------------------------------------------------------------------------------------------------------------------+
affected rows: 1
rollback;
affected rows: 0

#delete ...join...
delete a,b from t10 partition(p0) as a inner join t11 as b on a.c1 = b.a1 where a.c1 = 4;delete a,b from t10 partition(p0) as a inner join t11 as b on a.c1 = b.a1 where a.c1 = 5;delete a,b from t10 partition(p0) as a inner join t11 as b on a.c1 = b.a1 where a.c1 = 10;//
affected rows: 2
affected rows: 0
affected rows: 0
select * from t10 partition(p0);
+------+---------------------+
| c1   | c2                  |
+------+---------------------+
| 2003 | 2003-03-03 00:00:00 |
| 2008 | 2008-08-08 00:00:00 |
| 2009 | 2009-09-09 00:00:00 |
| 2011 | 2011-11-11 00:00:00 |
+------+---------------------+
affected rows: 4
select hit_count, is_batched_multi_stmt, statement, query_sql from oceanbase.GV$OB_PLAN_CACHE_PLAN_STAT where statement like 'delete a,b from t10 partition(p0) as a inner join t11 as b on a.c1 = b.a1 where a.c1 = %' order by hit_count;
+-----------+-----------------------+-------------------------------------------------------------------------------------------+-------------------------------------------------------------------------------------------+
| hit_count | is_batched_multi_stmt | statement                                                                                 | query_sql                                                                                 |
+-----------+-----------------------+-------------------------------------------------------------------------------------------+-------------------------------------------------------------------------------------------+
|         2 |                     0 | delete a,b from t10 partition(p0) as a inner join t11 as b on a.c1 = b.a1 where a.c1 = ?; | delete a,b from t10 partition(p0) as a inner join t11 as b on a.c1 = b.a1 where a.c1 = 4; |
+-----------+-----------------------+-------------------------------------------------------------------------------------------+-------------------------------------------------------------------------------------------+
affected rows: 1
rollback;
affected rows: 0

#delete ...join...
delete a,b,c from t10 partition(p0) as a inner join t11 as b on a.c1 = b.a1 inner join t12 as c on a.c1 = c.b1 where a.c1 = 4;delete a,b,c from t10 partition(p0) as a inner join t11 as b on a.c1 = b.a1 inner join t12 as c on a.c1 = c.b1 where a.c1 = 5;delete a,b,c from t10 partition(p0) as a inner join t11 as b on a.c1 = b.a1 inner join t12 as c on a.c1 = c.b1 where a.c1 = 10;//
affected rows: 3
affected rows: 0
affected rows: 0
select * from t10 partition(p0);
+------+---------------------+
| c1   | c2                  |
+------+---------------------+
| 2003 | 2003-03-03 00:00:00 |
| 2008 | 2008-08-08 00:00:00 |
| 2009 | 2009-09-09 00:00:00 |
| 2011 | 2011-11-11 00:00:00 |
+------+---------------------+
affected rows: 4
select hit_count, is_batched_multi_stmt, statement, query_sql from oceanbase.GV$OB_PLAN_CACHE_PLAN_STAT where statement like 'delete a,b,c from t10 partition(p0) as a inner join t11 as b on a.c1 = b.a1 inner join t12 as c on a.c1 = c.b1 where a.c1 = %' order by hit_count;
+-----------+-----------------------+--------------------------------------------------------------------------------------------------------------------------------+--------------------------------------------------------------------------------------------------------------------------------+
| hit_count | is_batched_multi_stmt | statement                                                                                                                      | query_sql                                                                                                                      |
+-----------+-----------------------+--------------------------------------------------------------------------------------------------------------------------------+--------------------------------------------------------------------------------------------------------------------------------+
|         2 |                     0 | delete a,b,c from t10 partition(p0) as a inner join t11 as b on a.c1 = b.a1 inner join t12 as c on a.c1 = c.b1 where a.c1 = ?; | delete a,b,c from t10 partition(p0) as a inner join t11 as b on a.c1 = b.a1 inner join t12 as c on a.c1 = c.b1 where a.c1 = 4; |
+-----------+-----------------------+--------------------------------------------------------------------------------------------------------------------------------+--------------------------------------------------------------------------------------------------------------------------------+
affected rows: 1
rollback;
affected rows: 0

drop table t10;
affected rows: 0
drop table t11;
affected rows: 0
drop table t12;
affected rows: 0


#list columns 分区
drop table if exists t13,t14,t15;
affected rows: 0
Warnings:
Note	1051	Unknown table 'db1.t13'
Note	1051	Unknown table 'db1.t14'
Note	1051	Unknown table 'db1.t15'
create table t13(c1 int not null default 7,c2 varchar(60))
partition by list columns(c1)
(
partition p0 values in(1,2,3),
partition p1 values in(4,5,6),
partition p2 values in(7,8,9),
partition p3 values in(10,11,12)
);
affected rows: 0
create index index_c1 on t13(c1);
affected rows: 0
insert into t13 values(1,'A'),(1,'A2'),(1,'A3'),(2,'B'),(2,'B2'),(3,'C'),(3,'C2'),(3,'C3'),(3,'C4'),(4,'D'),(5,'E'),(6,'F'),(7,'G'),(8,'H'),(9,'I'),(10,'J'),(11,'K'),(12,'L');
affected rows: 18
info: Records: 18  Duplicates: 0  Warnings: 0
commit;
affected rows: 0

create table t14(a1 int  not null,a2 decimal(10,5) not null);
affected rows: 0
insert into t14 values(1,1.1),(2,2.22),(3,4.44),(4,4.444),(5,5.23),(6,6.45),(7,7.456),(8,8.4563),(9,9.432),(10,10.134),(11,11.456),(12,12.121);
affected rows: 12
info: Records: 12  Duplicates: 0  Warnings: 0
commit;
affected rows: 0

create table t15(b1 int not null,b2 double not null);
affected rows: 0
insert into t15 values(1,1.1),(2,2.22),(3,4.44),(4,4.444),(5,5.23),(6,6.45),(7,7.456),(8,8.4563),(9,9.432),(10,10.134),(11,11.456),(12,12.121);
affected rows: 12
info: Records: 12  Duplicates: 0  Warnings: 0
commit;
affected rows: 0

#obs1模式下报错


#delete where +子查询
alter system flush plan cache global;
affected rows: 0
delete from t13 where c1 = (select a1 from t14 where a2 =2);delete from t13 where c1 = (select a1 from t14 where a2 =5);delete from t13 where c1 = (select a1 from t14 where a2 =8);delete from t13 where c1 = (select a1 from t14 where a2 =11);//
affected rows: 0
affected rows: 0
affected rows: 0
affected rows: 0
select * from t13;
+----+------+
| c1 | c2   |
+----+------+
|  1 | A    |
|  1 | A2   |
|  1 | A3   |
|  2 | B    |
|  2 | B2   |
|  3 | C    |
|  3 | C2   |
|  3 | C3   |
|  3 | C4   |
|  4 | D    |
|  5 | E    |
|  6 | F    |
|  7 | G    |
|  8 | H    |
|  9 | I    |
| 10 | J    |
| 11 | K    |
| 12 | L    |
+----+------+
affected rows: 18
select hit_count, is_batched_multi_stmt, statement, query_sql from oceanbase.GV$OB_PLAN_CACHE_PLAN_STAT where statement like 'delete from t13 where c1 = %' order by hit_count;
+-----------+-----------------------+--------------------------------------------------------------+--------------------------------------------------------------+
| hit_count | is_batched_multi_stmt | statement                                                    | query_sql                                                    |
+-----------+-----------------------+--------------------------------------------------------------+--------------------------------------------------------------+
|         3 |                     0 | delete from t13 where c1 = (select a1 from t14 where a2 =?); | delete from t13 where c1 = (select a1 from t14 where a2 =2); |
+-----------+-----------------------+--------------------------------------------------------------+--------------------------------------------------------------+
affected rows: 1
rollback;
affected rows: 0

#delete join
delete t13,t14 from t13 left join t14 on t13.c1 = t14.a1 where t13.c1 = 1;delete t13,t14 from t13 left join t14 on t13.c1 = t14.a1 where t13.c1 = 6;delete t13,t14 from t13 left join t14 on t13.c1 = t14.a1 where t13.c1 = 8;delete t13,t14 from t13 left join t14 on t13.c1 = t14.a1 where t13.c1 = 11;//
affected rows: 4
affected rows: 2
affected rows: 2
affected rows: 2
select * from t13;
+----+------+
| c1 | c2   |
+----+------+
|  2 | B    |
|  2 | B2   |
|  3 | C    |
|  3 | C2   |
|  3 | C3   |
|  3 | C4   |
|  4 | D    |
|  5 | E    |
|  7 | G    |
|  9 | I    |
| 10 | J    |
| 12 | L    |
+----+------+
affected rows: 12
select hit_count, is_batched_multi_stmt, statement, query_sql from oceanbase.GV$OB_PLAN_CACHE_PLAN_STAT where statement like 'delete t13,t14 from t13 left join t14 on t13.c1 = t14.a1 where t13.c1 = %' order by hit_count;
+-----------+-----------------------+----------------------------------------------------------------------------+----------------------------------------------------------------------------+
| hit_count | is_batched_multi_stmt | statement                                                                  | query_sql                                                                  |
+-----------+-----------------------+----------------------------------------------------------------------------+----------------------------------------------------------------------------+
|         3 |                     0 | delete t13,t14 from t13 left join t14 on t13.c1 = t14.a1 where t13.c1 = ?; | delete t13,t14 from t13 left join t14 on t13.c1 = t14.a1 where t13.c1 = 1; |
+-----------+-----------------------+----------------------------------------------------------------------------+----------------------------------------------------------------------------+
affected rows: 1
rollback;
affected rows: 0

delete t13,t14,t15 from t13 left join t14 on t13.c1 = t14.a1 left join t15 on t13.c1 = t15.b1 where t13.c1 = 1;delete t13,t14,t15 from t13 left join t14 on t13.c1 = t14.a1 left join t15 on t13.c1 = t15.b1 where t13.c1 = 6;delete t13,t14,t15 from t13 left join t14 on t13.c1 = t14.a1 left join t15 on t13.c1 = t15.b1 where t13.c1 = 8;delete t13,t14,t15 from t13 left join t14 on t13.c1 = t14.a1 left join t15 on t13.c1 = t15.b1 where t13.c1 = 11;//
affected rows: 5
affected rows: 3
affected rows: 3
affected rows: 3
select * from t13;
+----+------+
| c1 | c2   |
+----+------+
|  2 | B    |
|  2 | B2   |
|  3 | C    |
|  3 | C2   |
|  3 | C3   |
|  3 | C4   |
|  4 | D    |
|  5 | E    |
|  7 | G    |
|  9 | I    |
| 10 | J    |
| 12 | L    |
+----+------+
affected rows: 12
select hit_count, is_batched_multi_stmt, statement, query_sql from oceanbase.GV$OB_PLAN_CACHE_PLAN_STAT where statement like 'delete t13,t14,t15 from t13 left join t14 on t13.c1 = t14.a1 left join t15 on t13.c1 = t15.b1 where t13.c1 = %' order by hit_count;
+-----------+-----------------------+-----------------------------------------------------------------------------------------------------------------+-----------------------------------------------------------------------------------------------------------------+
| hit_count | is_batched_multi_stmt | statement                                                                                                       | query_sql                                                                                                       |
+-----------+-----------------------+-----------------------------------------------------------------------------------------------------------------+-----------------------------------------------------------------------------------------------------------------+
|         3 |                     0 | delete t13,t14,t15 from t13 left join t14 on t13.c1 = t14.a1 left join t15 on t13.c1 = t15.b1 where t13.c1 = ?; | delete t13,t14,t15 from t13 left join t14 on t13.c1 = t14.a1 left join t15 on t13.c1 = t15.b1 where t13.c1 = 1; |
+-----------+-----------------------+-----------------------------------------------------------------------------------------------------------------+-----------------------------------------------------------------------------------------------------------------+
affected rows: 1
rollback;
affected rows: 0

drop table t13;
affected rows: 0
drop table t14;
affected rows: 0
drop table t15;
affected rows: 0



#range columns
create table t16(c1 int not null,c2 int not null,primary key (c1,c2),key index_c1_c2(c1,c2)) partition by range columns(c1)
(
partition p1 values less than(5),
partition p2 values less than(10),
partition p3 values less than(maxvalue)
);
affected rows: 0
insert into t16 values(1,1),(3,3),(6,6),(9,9),(11,11),(17,17);
affected rows: 6
info: Records: 6  Duplicates: 0  Warnings: 0
commit;
affected rows: 0
insert into t16 values(4,1),(2,3),(5,6),(8,9),(12,5),(16,9);
affected rows: 6
info: Records: 6  Duplicates: 0  Warnings: 0
commit;
affected rows: 0

create table t17(a1 int,a2 int);
affected rows: 0
insert into t17 values(1,1),(2,5),(3,3),(6,6),(9,9),(11,11),(17,17),(4,1),(5,6),(8,9),(12,5),(16,9);
affected rows: 12
info: Records: 12  Duplicates: 0  Warnings: 0
commit;
affected rows: 0
create table t18(b1 int,b2 int);
affected rows: 0
insert into t18 values(1,1),(2,6),(3,3),(6,6),(9,9),(11,11),(15,15),(4,1),(5,6),(8,9),(12,5),(16,9);
affected rows: 12
info: Records: 12  Duplicates: 0  Warnings: 0
commit;
affected rows: 0

alter system flush plan cache global;
affected rows: 0
delete from t16 where c1 = 1;delete from t16 where c1 = 2;delete from t16 where c1 = 3;//
affected rows: 1
affected rows: 1
affected rows: 1
select * from t16;
+----+----+
| c1 | c2 |
+----+----+
|  4 |  1 |
|  5 |  6 |
|  6 |  6 |
|  8 |  9 |
|  9 |  9 |
| 11 | 11 |
| 12 |  5 |
| 16 |  9 |
| 17 | 17 |
+----+----+
affected rows: 9
select hit_count, is_batched_multi_stmt, statement, query_sql from oceanbase.GV$OB_PLAN_CACHE_PLAN_STAT where statement like 'delete from t16 where c1 = %' order by hit_count;
+-----------+-----------------------+------------------------------+-----------------------------------------------------------------------------------------+
| hit_count | is_batched_multi_stmt | statement                    | query_sql                                                                               |
+-----------+-----------------------+------------------------------+-----------------------------------------------------------------------------------------+
|         0 |                     1 | delete from t16 where c1 = ? | delete from t16 where c1 = 1;delete from t16 where c1 = 2;delete from t16 where c1 = 3; |
+-----------+-----------------------+------------------------------+-----------------------------------------------------------------------------------------+
affected rows: 1
rollback;
affected rows: 0

delete from t16 partition(p1) where c1 = 1;delete from t16 partition(p1) where c1 = 2;delete from t16 partition(p1) where c1 = 3;//
affected rows: 1
affected rows: 1
affected rows: 1
select * from t16;
+----+----+
| c1 | c2 |
+----+----+
|  4 |  1 |
|  5 |  6 |
|  6 |  6 |
|  8 |  9 |
|  9 |  9 |
| 11 | 11 |
| 12 |  5 |
| 16 |  9 |
| 17 | 17 |
+----+----+
affected rows: 9
select hit_count, is_batched_multi_stmt, statement, query_sql from oceanbase.GV$OB_PLAN_CACHE_PLAN_STAT where statement like 'delete from t16 partition(p1) where c1 = %' order by hit_count;
+-----------+-----------------------+--------------------------------------------+-----------------------------------------------------------------------------------------------------------------------------------+
| hit_count | is_batched_multi_stmt | statement                                  | query_sql                                                                                                                         |
+-----------+-----------------------+--------------------------------------------+-----------------------------------------------------------------------------------------------------------------------------------+
|         0 |                     1 | delete from t16 partition(p1) where c1 = ? | delete from t16 partition(p1) where c1 = 1;delete from t16 partition(p1) where c1 = 2;delete from t16 partition(p1) where c1 = 3; |
+-----------+-----------------------+--------------------------------------------+-----------------------------------------------------------------------------------------------------------------------------------+
affected rows: 1
rollback;
affected rows: 0

#delete where +子查询
alter system flush plan cache global;
affected rows: 0
delete from t16 where c1 = (select a1 from t17 where a1 =5);delete from t16 where c1 = (select a1 from t17 where a1 =1);delete from t16 where c1 = (select a1 from t17 where a1 =3);//
affected rows: 1
affected rows: 1
affected rows: 1
select * from t16;
+----+----+
| c1 | c2 |
+----+----+
|  2 |  3 |
|  4 |  1 |
|  6 |  6 |
|  8 |  9 |
|  9 |  9 |
| 11 | 11 |
| 12 |  5 |
| 16 |  9 |
| 17 | 17 |
+----+----+
affected rows: 9
select hit_count, is_batched_multi_stmt, statement, query_sql from oceanbase.GV$OB_PLAN_CACHE_PLAN_STAT where statement like 'delete from t16 where c1 = %' order by hit_count;
+-----------+-----------------------+--------------------------------------------------------------+--------------------------------------------------------------+
| hit_count | is_batched_multi_stmt | statement                                                    | query_sql                                                    |
+-----------+-----------------------+--------------------------------------------------------------+--------------------------------------------------------------+
|         2 |                     0 | delete from t16 where c1 = (select a1 from t17 where a1 =?); | delete from t16 where c1 = (select a1 from t17 where a1 =5); |
+-----------+-----------------------+--------------------------------------------------------------+--------------------------------------------------------------+
affected rows: 1
rollback;
affected rows: 0

#delete join
delete t16,t17 from t16 inner join t17 on t16.c1 = t17.a1 where t16.c1 = 1;delete t16,t17 from t16 inner join t17 on t16.c1 = t17.a1 where t16.c1 = 6;delete t16,t17 from t16 inner join t17 on t16.c1 = t17.a1 where t16.c1 = 11;//
affected rows: 2
affected rows: 2
affected rows: 2
select * from t16;
+----+----+
| c1 | c2 |
+----+----+
|  2 |  3 |
|  3 |  3 |
|  4 |  1 |
|  5 |  6 |
|  8 |  9 |
|  9 |  9 |
| 12 |  5 |
| 16 |  9 |
| 17 | 17 |
+----+----+
affected rows: 9
select hit_count, is_batched_multi_stmt, statement, query_sql from oceanbase.GV$OB_PLAN_CACHE_PLAN_STAT where statement like 'delete t16,t17 from t16 inner join t17 on t16.c1 = t17.a1 where t16.c1 = %' order by hit_count;
+-----------+-----------------------+-----------------------------------------------------------------------------+-----------------------------------------------------------------------------+
| hit_count | is_batched_multi_stmt | statement                                                                   | query_sql                                                                   |
+-----------+-----------------------+-----------------------------------------------------------------------------+-----------------------------------------------------------------------------+
|         2 |                     0 | delete t16,t17 from t16 inner join t17 on t16.c1 = t17.a1 where t16.c1 = ?; | delete t16,t17 from t16 inner join t17 on t16.c1 = t17.a1 where t16.c1 = 1; |
+-----------+-----------------------+-----------------------------------------------------------------------------+-----------------------------------------------------------------------------+
affected rows: 1
rollback;
affected rows: 0

delete t16,t17,t18 from t16 inner join t17 on t16.c1 = t17.a1 inner join t18 on t16.c1 = t18.b1 where t16.c1 = 1;delete t16,t17,t18 from t16 inner join t17 on t16.c1 = t17.a1 inner join t18 on t16.c1 = t18.b1 where t16.c1 = 6;delete t16,t17,t18 from t16 inner join t17 on t16.c1 = t17.a1 inner join t18 on t16.c1 = t18.b1 where t16.c1 = 11;//
affected rows: 3
affected rows: 3
affected rows: 3
select * from t16;
+----+----+
| c1 | c2 |
+----+----+
|  2 |  3 |
|  3 |  3 |
|  4 |  1 |
|  5 |  6 |
|  8 |  9 |
|  9 |  9 |
| 12 |  5 |
| 16 |  9 |
| 17 | 17 |
+----+----+
affected rows: 9
select hit_count, is_batched_multi_stmt, statement, query_sql from oceanbase.GV$OB_PLAN_CACHE_PLAN_STAT where statement like 'delete t16,t17,t18 from t16 inner join t17 on t16.c1 = t17.a1 inner join t18 on t16.c1 = t18.b1 where t16.c1 = %' order by hit_count;
+-----------+-----------------------+-------------------------------------------------------------------------------------------------------------------+-------------------------------------------------------------------------------------------------------------------+
| hit_count | is_batched_multi_stmt | statement                                                                                                         | query_sql                                                                                                         |
+-----------+-----------------------+-------------------------------------------------------------------------------------------------------------------+-------------------------------------------------------------------------------------------------------------------+
|         2 |                     0 | delete t16,t17,t18 from t16 inner join t17 on t16.c1 = t17.a1 inner join t18 on t16.c1 = t18.b1 where t16.c1 = ?; | delete t16,t17,t18 from t16 inner join t17 on t16.c1 = t17.a1 inner join t18 on t16.c1 = t18.b1 where t16.c1 = 1; |
+-----------+-----------------------+-------------------------------------------------------------------------------------------------------------------+-------------------------------------------------------------------------------------------------------------------+
affected rows: 1
rollback;
affected rows: 0

drop table t16;
affected rows: 0
drop table t17;
affected rows: 0
drop table t18;
affected rows: 0


alter system set _rowsets_enabled=true;
affected rows: 0
set autocommit = true;
affected rows: 0
alter system set ob_enable_batched_multi_statement=false;
affected rows: 0

