drop database if exists db1;
create database db1;
use db1;
result_format: 4
alter system flush plan cache global;
affected rows: 0
alter system set _rowsets_enabled=false;
affected rows: 0
set autocommit = false;
affected rows: 0
alter system set ob_enable_batched_multi_statement=true;
affected rows: 0


#varchar、char
create table t5(c1 varchar(60),c2 char(30));
affected rows: 0
insert into t5 values('张','1A'),('王@','bbb'),('李','adasd#%$'),('赵G','null'),('---','NNsa阿瑟东'),('@仰卧','453123'),('舆论￥%……','CC'),(' ','dfe'),('cccc','ddddd');
affected rows: 9
info: Records: 9  Duplicates: 0  Warnings: 0
commit;
affected rows: 0
select * from t5;
+------------------+---------------+
| c1               | c2            |
+------------------+---------------+
| 张               | 1A            |
| 王@              | bbb           |
| 李               | adasd#%$      |
| 赵G              | null          |
| ---              | NNsa阿瑟东    |
| @仰卧            | 453123        |
| 舆论￥%……        | CC            |
|                  | dfe           |
| cccc             | ddddd         |
+------------------+---------------+
affected rows: 9

delete from t5 where c1 = '张';delete from t5 where c1 = '王@';delete from t5 where c1 = '赵G';//
affected rows: 1
affected rows: 1
affected rows: 1
delete from t5 where c2 = 'adasd#%$';delete from t5 where c2 = 'NNsa阿瑟东';delete from t5 where c2 = 'CC';//
affected rows: 1
affected rows: 1
affected rows: 1
select * from t5;
+---------+--------+
| c1      | c2     |
+---------+--------+
| @仰卧   | 453123 |
|         | dfe    |
| cccc    | ddddd  |
+---------+--------+
affected rows: 3
select hit_count, is_batched_multi_stmt, statement, query_sql from oceanbase.GV$OB_PLAN_CACHE_PLAN_STAT where statement like 'delete from t5 where c1 = %' order by hit_count;
+-----------+-----------------------+-----------------------------+----------------------------------------------------------------------------------------------------+
| hit_count | is_batched_multi_stmt | statement                   | query_sql                                                                                          |
+-----------+-----------------------+-----------------------------+----------------------------------------------------------------------------------------------------+
|         0 |                     1 | delete from t5 where c1 = ? | delete from t5 where c1 = '张';delete from t5 where c1 = '王@';delete from t5 where c1 = '赵G';    |
+-----------+-----------------------+-----------------------------+----------------------------------------------------------------------------------------------------+
affected rows: 1
select hit_count, is_batched_multi_stmt, statement, query_sql from oceanbase.GV$OB_PLAN_CACHE_PLAN_STAT where statement like 'delete from t5 where c2 = %' order by hit_count;
+-----------+-----------------------+-----------------------------+----------------------------------------------------------------------------------------------------------------+
| hit_count | is_batched_multi_stmt | statement                   | query_sql                                                                                                      |
+-----------+-----------------------+-----------------------------+----------------------------------------------------------------------------------------------------------------+
|         0 |                     1 | delete from t5 where c2 = ? | delete from t5 where c2 = 'adasd#%$';delete from t5 where c2 = 'NNsa阿瑟东';delete from t5 where c2 = 'CC';    |
+-----------+-----------------------+-----------------------------+----------------------------------------------------------------------------------------------------------------+
affected rows: 1
rollback;
affected rows: 0

alter system flush plan cache global;
affected rows: 0
delete from t5 where c1 = '张';delete from t5 where c1 = ' ';delete from t5 where c1 = '赵G';//
affected rows: 1
affected rows: 1
affected rows: 1
delete from t5 where c2 = 'adasd#%$';delete from t5 where c2 = 'null';delete from t5 where c2 = 'CC';//
affected rows: 1
affected rows: 0
affected rows: 1
select * from t5;
+---------+---------------+
| c1      | c2            |
+---------+---------------+
| 王@     | bbb           |
| ---     | NNsa阿瑟东    |
| @仰卧   | 453123        |
| cccc    | ddddd         |
+---------+---------------+
affected rows: 4
select hit_count, is_batched_multi_stmt, statement, query_sql from oceanbase.GV$OB_PLAN_CACHE_PLAN_STAT where statement like 'delete from t5 where c1 = %' order by hit_count;
+-----------+-----------------------+-----------------------------+-------------------------------------------------------------------------------------------------+
| hit_count | is_batched_multi_stmt | statement                   | query_sql                                                                                       |
+-----------+-----------------------+-----------------------------+-------------------------------------------------------------------------------------------------+
|         0 |                     1 | delete from t5 where c1 = ? | delete from t5 where c1 = '张';delete from t5 where c1 = ' ';delete from t5 where c1 = '赵G';   |
+-----------+-----------------------+-----------------------------+-------------------------------------------------------------------------------------------------+
affected rows: 1
select hit_count, is_batched_multi_stmt, statement, query_sql from oceanbase.GV$OB_PLAN_CACHE_PLAN_STAT where statement like 'delete from t5 where c2 = %' order by hit_count;
+-----------+-----------------------+-----------------------------+-------------------------------------------------------------------------------------------------------+
| hit_count | is_batched_multi_stmt | statement                   | query_sql                                                                                             |
+-----------+-----------------------+-----------------------------+-------------------------------------------------------------------------------------------------------+
|         0 |                     1 | delete from t5 where c2 = ? | delete from t5 where c2 = 'adasd#%$';delete from t5 where c2 = 'null';delete from t5 where c2 = 'CC'; |
+-----------+-----------------------+-----------------------------+-------------------------------------------------------------------------------------------------------+
affected rows: 1
rollback;
affected rows: 0
drop table t5;
affected rows: 0


#varbinary,binary
#varbinary、binary
create table t6(c1 varbinary(30),c2 binary(30));
affected rows: 0
insert into t6 values('aaa','一一一');
affected rows: 1
insert into t6 values('bbb','二二二');
affected rows: 1
insert into t6 values('ccc','三三三');
affected rows: 1
insert into t6 values('abc/20','1000/66.6');
affected rows: 1
insert into t6 values('b/2','2000/128.8');
affected rows: 1
insert into t6 values('c/3','3000/256.6');
affected rows: 1
insert into t6 values(' ','ABC');
affected rows: 1
insert into t6 values(' a',null);
affected rows: 1
commit;
affected rows: 0
select * from t6;
+--------+--------------------------------+
| c1     | c2                             |
+--------+--------------------------------+
| aaa    | 一一一                         |
| bbb    | 二二二                         |
| ccc    | 三三三                         |
| abc/20 | 1000/66.6                      |
| b/2    | 2000/128.8                     |
| c/3    | 3000/256.6                     |
|        | ABC                            |
|  a     | NULL                           |
+--------+--------------------------------+
affected rows: 8

delete from t6 where c1 = 'aaa';delete from t6 where c1 = 'bbb';delete from t6 where c1 = 'ccc';//
affected rows: 1
affected rows: 1
affected rows: 1
delete from t6 where c2 = '1000/66.6';delete from t6 where c2 = '2000/128.8';delete from t6 where c2 = '3000/256.6';//
affected rows: 0
affected rows: 0
affected rows: 0
select * from t6;
+--------+--------------------------------+
| c1     | c2                             |
+--------+--------------------------------+
| abc/20 | 1000/66.6                      |
| b/2    | 2000/128.8                     |
| c/3    | 3000/256.6                     |
|        | ABC                            |
|  a     | NULL                           |
+--------+--------------------------------+
affected rows: 5
select hit_count, is_batched_multi_stmt, statement, query_sql from oceanbase.GV$OB_PLAN_CACHE_PLAN_STAT where statement like 'delete from t6 where c1 = %' order by hit_count;
+-----------+-----------------------+-----------------------------+--------------------------------------------------------------------------------------------------+
| hit_count | is_batched_multi_stmt | statement                   | query_sql                                                                                        |
+-----------+-----------------------+-----------------------------+--------------------------------------------------------------------------------------------------+
|         0 |                     1 | delete from t6 where c1 = ? | delete from t6 where c1 = 'aaa';delete from t6 where c1 = 'bbb';delete from t6 where c1 = 'ccc'; |
+-----------+-----------------------+-----------------------------+--------------------------------------------------------------------------------------------------+
affected rows: 1
select hit_count, is_batched_multi_stmt, statement, query_sql from oceanbase.GV$OB_PLAN_CACHE_PLAN_STAT where statement like 'delete from t6 where c2 = %' order by hit_count;
+-----------+-----------------------+-----------------------------+----------------------------------------------------------------------------------------------------------------------+
| hit_count | is_batched_multi_stmt | statement                   | query_sql                                                                                                            |
+-----------+-----------------------+-----------------------------+----------------------------------------------------------------------------------------------------------------------+
|         0 |                     1 | delete from t6 where c2 = ? | delete from t6 where c2 = '1000/66.6';delete from t6 where c2 = '2000/128.8';delete from t6 where c2 = '3000/256.6'; |
+-----------+-----------------------+-----------------------------+----------------------------------------------------------------------------------------------------------------------+
affected rows: 1
rollback;
affected rows: 0

alter system flush plan cache global;
affected rows: 0
delete from t6 where c1 = 'aaa';delete from t6 where c1 = 'bbb';delete from t6 where c1 = ' ';//
affected rows: 1
affected rows: 1
affected rows: 1
delete from t6 where c2 = '1000/66.6';delete from t6 where c2 = '2000/128.8';delete from t6 where c2 = 'null';//
affected rows: 0
affected rows: 0
affected rows: 0
select * from t6;
+--------+--------------------------------+
| c1     | c2                             |
+--------+--------------------------------+
| ccc    | 三三三                         |
| abc/20 | 1000/66.6                      |
| b/2    | 2000/128.8                     |
| c/3    | 3000/256.6                     |
|  a     | NULL                           |
+--------+--------------------------------+
affected rows: 5
select hit_count, is_batched_multi_stmt, statement, query_sql from oceanbase.GV$OB_PLAN_CACHE_PLAN_STAT where statement like 'delete from t6 where c1 = %' order by hit_count;
+-----------+-----------------------+-----------------------------+------------------------------------------------------------------------------------------------+
| hit_count | is_batched_multi_stmt | statement                   | query_sql                                                                                      |
+-----------+-----------------------+-----------------------------+------------------------------------------------------------------------------------------------+
|         0 |                     1 | delete from t6 where c1 = ? | delete from t6 where c1 = 'aaa';delete from t6 where c1 = 'bbb';delete from t6 where c1 = ' '; |
+-----------+-----------------------+-----------------------------+------------------------------------------------------------------------------------------------+
affected rows: 1
select hit_count, is_batched_multi_stmt, statement, query_sql from oceanbase.GV$OB_PLAN_CACHE_PLAN_STAT where statement like 'delete from t6 where c2 = %' order by hit_count;
+-----------+-----------------------+-----------------------------+----------------------------------------------------------------------------------------------------------------+
| hit_count | is_batched_multi_stmt | statement                   | query_sql                                                                                                      |
+-----------+-----------------------+-----------------------------+----------------------------------------------------------------------------------------------------------------+
|         0 |                     1 | delete from t6 where c2 = ? | delete from t6 where c2 = '1000/66.6';delete from t6 where c2 = '2000/128.8';delete from t6 where c2 = 'null'; |
+-----------+-----------------------+-----------------------------+----------------------------------------------------------------------------------------------------------------+
affected rows: 1
rollback;
affected rows: 0
drop table t6;
affected rows: 0


#enum、set 

#bit
create table t8(c1 bit(64),c2 bit(64));
affected rows: 0
insert into t8 values(10,10),(11,11),(12,12),(13,13),(14,14),(15,15),(16,16),(17,17),(18,18);
affected rows: 9
info: Records: 9  Duplicates: 0  Warnings: 0
commit;
affected rows: 0
select bin(c1),bin(c2) from t8;
+---------+---------+
| bin(c1) | bin(c2) |
+---------+---------+
| 1010    | 1010    |
| 1011    | 1011    |
| 1100    | 1100    |
| 1101    | 1101    |
| 1110    | 1110    |
| 1111    | 1111    |
| 10000   | 10000   |
| 10001   | 10001   |
| 10010   | 10010   |
+---------+---------+
affected rows: 9

delete from t8 where c1 = b'1101';delete from t8 where c1 = b'1110';delete from t8 where c1 = b'1111';//
affected rows: 1
affected rows: 1
affected rows: 1
select bin(c1),bin(c2) from t8;
+---------+---------+
| bin(c1) | bin(c2) |
+---------+---------+
| 1010    | 1010    |
| 1011    | 1011    |
| 1100    | 1100    |
| 10000   | 10000   |
| 10001   | 10001   |
| 10010   | 10010   |
+---------+---------+
affected rows: 6
select hit_count, is_batched_multi_stmt, statement, query_sql from oceanbase.GV$OB_PLAN_CACHE_PLAN_STAT where statement like 'delete from t8 where c1 = %' order by hit_count;
+-----------+-----------------------+-----------------------------+--------------------------------------------------------------------------------------------------------+
| hit_count | is_batched_multi_stmt | statement                   | query_sql                                                                                              |
+-----------+-----------------------+-----------------------------+--------------------------------------------------------------------------------------------------------+
|         0 |                     1 | delete from t8 where c1 = ? | delete from t8 where c1 = b'1101';delete from t8 where c1 = b'1110';delete from t8 where c1 = b'1111'; |
+-----------+-----------------------+-----------------------------+--------------------------------------------------------------------------------------------------------+
affected rows: 1
rollback;
affected rows: 0

alter system flush plan cache global;
affected rows: 0
delete from t8 where c1 = b'1101';delete from t8 where c1 = b'1110';delete from t8 where c1 = b'1111';//
affected rows: 1
affected rows: 1
affected rows: 1
select bin(c1),bin(c2) from t8;
+---------+---------+
| bin(c1) | bin(c2) |
+---------+---------+
| 1010    | 1010    |
| 1011    | 1011    |
| 1100    | 1100    |
| 10000   | 10000   |
| 10001   | 10001   |
| 10010   | 10010   |
+---------+---------+
affected rows: 6
select hit_count, is_batched_multi_stmt, statement, query_sql from oceanbase.GV$OB_PLAN_CACHE_PLAN_STAT where statement like 'delete from t8 where c1 = %' order by hit_count;
+-----------+-----------------------+-----------------------------+--------------------------------------------------------------------------------------------------------+
| hit_count | is_batched_multi_stmt | statement                   | query_sql                                                                                              |
+-----------+-----------------------+-----------------------------+--------------------------------------------------------------------------------------------------------+
|         0 |                     1 | delete from t8 where c1 = ? | delete from t8 where c1 = b'1101';delete from t8 where c1 = b'1110';delete from t8 where c1 = b'1111'; |
+-----------+-----------------------+-----------------------------+--------------------------------------------------------------------------------------------------------+
affected rows: 1
rollback;
affected rows: 0


alter system flush plan cache global;
affected rows: 0
delete from t8 where c1 = 16;delete from t8 where c1 = b'10001';delete from t8 where c1 = b'10010';//
affected rows: 1
affected rows: 1
affected rows: 1
select bin(c1),bin(c2) from t8;
+---------+---------+
| bin(c1) | bin(c2) |
+---------+---------+
| 1010    | 1010    |
| 1011    | 1011    |
| 1100    | 1100    |
| 1101    | 1101    |
| 1110    | 1110    |
| 1111    | 1111    |
+---------+---------+
affected rows: 6
select hit_count, is_batched_multi_stmt, statement, query_sql from oceanbase.GV$OB_PLAN_CACHE_PLAN_STAT where statement like 'delete from t8 where c1 = %' order by hit_count;
+-----------+-----------------------+------------------------------+-------------------------------------+
| hit_count | is_batched_multi_stmt | statement                    | query_sql                           |
+-----------+-----------------------+------------------------------+-------------------------------------+
|         0 |                     0 | delete from t8 where c1 = ?; | delete from t8 where c1 = ?;        |
|         0 |                     0 | delete from t8 where c1 = ?; | delete from t8 where c1 = 16;       |
|         1 |                     0 | delete from t8 where c1 = ?; | delete from t8 where c1 = ?;        |
|         1 |                     0 | delete from t8 where c1 = ?; | delete from t8 where c1 = b'10001'; |
+-----------+-----------------------+------------------------------+-------------------------------------+
affected rows: 4
rollback;
affected rows: 0

drop table t8;
affected rows: 0

alter system set _rowsets_enabled=true;
affected rows: 0
set autocommit = true;
affected rows: 0
alter system set ob_enable_batched_multi_statement=false;
affected rows: 0
