drop database if exists db1;
create database db1;
use db1;
result_format: 4
alter system flush plan cache global;
affected rows: 0
alter system set _rowsets_enabled=false;
affected rows: 0
set autocommit = false;
affected rows: 0
alter system set ob_enable_batched_multi_statement=true;
affected rows: 0

drop table if exists t1;
affected rows: 0
Warnings:
Note	1051	Unknown table 'db1.t1'
create table t1 (c1 timestamp not null,c2 timestamp unique key,index index_c1(c1));
affected rows: 0
insert into t1 values('2020-08-08','2020-09-09 09:09:00');
affected rows: 1
insert into t1 values('2020-10-10 10:10:00','2020-11-11');
affected rows: 1
insert into t1 values('2021-05-05 05:05:05','2021-06-06 06:06:00');
affected rows: 1
insert into t1 values('2021-07-07 07:07:07','2021-08-08 08:08:00');
affected rows: 1
insert into t1 values('2021-09-09 09:09:09','2021-10-10 10:10:00');
affected rows: 1
insert into t1 values(20220606,20200707);
affected rows: 1
commit;
affected rows: 0

delete from t1 where c1 = '2020-08-08';delete from t1 where c1 = '2020-10-10 10:10:00';delete from t1 where c1 = '2021-09-09 09:09:09';//
affected rows: 1
affected rows: 1
affected rows: 1
select hit_count, is_batched_multi_stmt, statement, query_sql from oceanbase.GV$OB_PLAN_CACHE_PLAN_STAT where statement like 'delete from t1 where c1 = %' order by hit_count;
+-----------+-----------------------+-----------------------------+-----------------------------------------------------------------------------------------------------------------------------------------+
| hit_count | is_batched_multi_stmt | statement                   | query_sql                                                                                                                               |
+-----------+-----------------------+-----------------------------+-----------------------------------------------------------------------------------------------------------------------------------------+
|         0 |                     1 | delete from t1 where c1 = ? | delete from t1 where c1 = '2020-08-08';delete from t1 where c1 = '2020-10-10 10:10:00';delete from t1 where c1 = '2021-09-09 09:09:09'; |
+-----------+-----------------------+-----------------------------+-----------------------------------------------------------------------------------------------------------------------------------------+
affected rows: 1
select * from t1;
+---------------------+---------------------+
| c1                  | c2                  |
+---------------------+---------------------+
| 2021-05-05 05:05:05 | 2021-06-06 06:06:00 |
| 2021-07-07 07:07:07 | 2021-08-08 08:08:00 |
| 2022-06-06 00:00:00 | 2020-07-07 00:00:00 |
+---------------------+---------------------+
affected rows: 3
rollback;
affected rows: 0

alter system flush plan cache global;
affected rows: 0
delete from t1 where c1 = 20220606;delete from t1 where c1 = 20200808;delete from t1 where c1 = 20201010101000;//
affected rows: 1
affected rows: 1
affected rows: 1
select hit_count, is_batched_multi_stmt, statement, query_sql from oceanbase.GV$OB_PLAN_CACHE_PLAN_STAT where statement like 'delete from t1 where c1 = %' order by hit_count;
+-----------+-----------------------+-----------------------------+-----------------------------------------------------------------------------------------------------------------+
| hit_count | is_batched_multi_stmt | statement                   | query_sql                                                                                                       |
+-----------+-----------------------+-----------------------------+-----------------------------------------------------------------------------------------------------------------+
|         0 |                     1 | delete from t1 where c1 = ? | delete from t1 where c1 = 20220606;delete from t1 where c1 = 20200808;delete from t1 where c1 = 20201010101000; |
+-----------+-----------------------+-----------------------------+-----------------------------------------------------------------------------------------------------------------+
affected rows: 1
select * from t1;
+---------------------+---------------------+
| c1                  | c2                  |
+---------------------+---------------------+
| 2021-05-05 05:05:05 | 2021-06-06 06:06:00 |
| 2021-07-07 07:07:07 | 2021-08-08 08:08:00 |
| 2021-09-09 09:09:09 | 2021-10-10 10:10:00 |
+---------------------+---------------------+
affected rows: 3
rollback;
affected rows: 0

alter system flush plan cache global;
affected rows: 0
delete from t1 where c1 = 20220606;delete from t1 where c1 = '2020-08-08';delete from t1 where c1 = 20201010;//
affected rows: 1
affected rows: 1
affected rows: 0
select hit_count, is_batched_multi_stmt, statement, query_sql from oceanbase.GV$OB_PLAN_CACHE_PLAN_STAT where statement like 'delete from t1 where c1 = %' order by hit_count;
+-----------+-----------------------+------------------------------+-----------------------------------------+
| hit_count | is_batched_multi_stmt | statement                    | query_sql                               |
+-----------+-----------------------+------------------------------+-----------------------------------------+
|         0 |                     0 | delete from t1 where c1 = ?; | delete from t1 where c1 = '2020-08-08'; |
|         1 |                     0 | delete from t1 where c1 = ?; | delete from t1 where c1 = 20220606;     |
+-----------+-----------------------+------------------------------+-----------------------------------------+
affected rows: 2
select * from t1;
+---------------------+---------------------+
| c1                  | c2                  |
+---------------------+---------------------+
| 2020-10-10 10:10:00 | 2020-11-11 00:00:00 |
| 2021-05-05 05:05:05 | 2021-06-06 06:06:00 |
| 2021-07-07 07:07:07 | 2021-08-08 08:08:00 |
| 2021-09-09 09:09:09 | 2021-10-10 10:10:00 |
+---------------------+---------------------+
affected rows: 4
rollback;
affected rows: 0

drop table t1;
affected rows: 0

drop table if exists t2;
affected rows: 0
Warnings:
Note	1051	Unknown table 'db1.t2'
create table t2 (c1 time(6) not null primary key,c2 time(4) not null unique key);
affected rows: 0
create index index_c1_C2 on t2(c1,c2);
affected rows: 0
insert into t2 values('123:59:59.5555555','222:22:22.2222222');
affected rows: 1
insert into t2 values('333:33:33.33333','555:55:55.234');
affected rows: 1
insert into t2 values('80:08:08.22222','80:08:08.2222');
affected rows: 1
insert into t2 values('90:09:09.66666','90:09:09.3333');
affected rows: 1
insert into t2 values('-90:09:09.666','-90:09:09.3333');
affected rows: 1
commit;
affected rows: 0

alter system flush plan cache global;
affected rows: 0
delete from t2 where c1 = '333:33:33.33333';delete from t2 where c1 = '80:08:08.22222';delete from t2 where c1 = '90:09:09.66666';//
affected rows: 1
affected rows: 1
affected rows: 1
select hit_count, is_batched_multi_stmt, statement, query_sql from oceanbase.GV$OB_PLAN_CACHE_PLAN_STAT where statement like 'delete from t2 where c1 = %' order by hit_count;
+-----------+-----------------------+-----------------------------+------------------------------------------------------------------------------------------------------------------------------------+
| hit_count | is_batched_multi_stmt | statement                   | query_sql                                                                                                                          |
+-----------+-----------------------+-----------------------------+------------------------------------------------------------------------------------------------------------------------------------+
|         0 |                     1 | delete from t2 where c1 = ? | delete from t2 where c1 = '333:33:33.33333';delete from t2 where c1 = '80:08:08.22222';delete from t2 where c1 = '90:09:09.66666'; |
+-----------+-----------------------+-----------------------------+------------------------------------------------------------------------------------------------------------------------------------+
affected rows: 1
select * from t2;
+------------------+----------------+
| c1               | c2             |
+------------------+----------------+
| -90:09:09.666000 | -90:09:09.3333 |
| 123:59:59.555556 | 222:22:22.2222 |
+------------------+----------------+
affected rows: 2
rollback;
affected rows: 0

#精度不同测试
alter system flush plan cache global;
affected rows: 0
delete from t2 where c1 = '123:59:59.5555555';delete from t2 where c1 = '80:08:08.22222';delete from t2 where c1 = '90:09:09.66666';//
affected rows: 1
affected rows: 1
affected rows: 1
select hit_count, is_batched_multi_stmt, statement, query_sql from oceanbase.GV$OB_PLAN_CACHE_PLAN_STAT where statement like 'delete from t2 where c1 = %' order by hit_count;
+-----------+-----------------------+-----------------------------+--------------------------------------------------------------------------------------------------------------------------------------+
| hit_count | is_batched_multi_stmt | statement                   | query_sql                                                                                                                            |
+-----------+-----------------------+-----------------------------+--------------------------------------------------------------------------------------------------------------------------------------+
|         0 |                     1 | delete from t2 where c1 = ? | delete from t2 where c1 = '123:59:59.5555555';delete from t2 where c1 = '80:08:08.22222';delete from t2 where c1 = '90:09:09.66666'; |
+-----------+-----------------------+-----------------------------+--------------------------------------------------------------------------------------------------------------------------------------+
affected rows: 1
select * from t2;
+------------------+----------------+
| c1               | c2             |
+------------------+----------------+
| -90:09:09.666000 | -90:09:09.3333 |
| 333:33:33.333330 | 555:55:55.2340 |
+------------------+----------------+
affected rows: 2
rollback;
affected rows: 0

#符号不同测试
alter system flush plan cache global;
affected rows: 0
delete from t2 where c1 = '123:59:59.5555555';delete from t2 where c1 = '80:08:08.22222';delete from t2 where c1 = '-90:09:09.666';//
affected rows: 1
affected rows: 1
affected rows: 1
select hit_count, is_batched_multi_stmt, statement, query_sql from oceanbase.GV$OB_PLAN_CACHE_PLAN_STAT where statement like 'delete from t2 where c1 = %' order by hit_count;
+-----------+-----------------------+-----------------------------+-------------------------------------------------------------------------------------------------------------------------------------+
| hit_count | is_batched_multi_stmt | statement                   | query_sql                                                                                                                           |
+-----------+-----------------------+-----------------------------+-------------------------------------------------------------------------------------------------------------------------------------+
|         0 |                     1 | delete from t2 where c1 = ? | delete from t2 where c1 = '123:59:59.5555555';delete from t2 where c1 = '80:08:08.22222';delete from t2 where c1 = '-90:09:09.666'; |
+-----------+-----------------------+-----------------------------+-------------------------------------------------------------------------------------------------------------------------------------+
affected rows: 1
select * from t2;
+------------------+----------------+
| c1               | c2             |
+------------------+----------------+
| 90:09:09.666660  | 90:09:09.3333  |
| 333:33:33.333330 | 555:55:55.2340 |
+------------------+----------------+
affected rows: 2
rollback;
affected rows: 0
drop table t2;
affected rows: 0

alter system set _rowsets_enabled=true;
affected rows: 0
set autocommit = true;
affected rows: 0
alter system set ob_enable_batched_multi_statement=false;
affected rows: 0

