drop database if exists db1;
create database db1;
use db1;
result_format: 4
alter system flush plan cache global;
affected rows: 0

alter system set _rowsets_enabled=false;
affected rows: 0

set autocommit = false;
affected rows: 0
alter system set ob_enable_batched_multi_statement=true;
affected rows: 0


#default
create table t7(c1 int default '2',c2 varchar(30));
affected rows: 0
insert into t7 values(1,'NULL'),(2,'AA'),(3,'AA'),(4,'CC'),(6,'6A'),(7,'端午'),(8,'￥%…………'),(9,'123'),(10,'【AA】'),(11,'ash#2'),(12,'cc');
affected rows: 11
info: Records: 11  Duplicates: 0  Warnings: 0
insert into t7(c2) values('123'),('abc');
affected rows: 2
info: Records: 2  Duplicates: 0  Warnings: 0
commit;
affected rows: 0
drop table if exists t2;
affected rows: 0
Warnings:
Note	1051	Unknown table 'db1.t2'
create table t8(c1 int,c2 int);
affected rows: 0
insert into t8 values(1,1),(2,2),(3,3),(5,5),(6,6),(7,7),(8,8),(9,9),(10,10),(12,12);
affected rows: 10
info: Records: 10  Duplicates: 0  Warnings: 0
commit;
affected rows: 0

alter system flush plan cache global;
affected rows: 0
delete from t7 where c1 =1;delete from t7 where c1 =2;delete from t7 where c1 =3;//
affected rows: 1
affected rows: 3
affected rows: 1
select * from t7;
+------+------------------+
| c1   | c2               |
+------+------------------+
|    4 | CC               |
|    6 | 6A               |
|    7 | 端午             |
|    8 | ￥%…………          |
|    9 | 123              |
|   10 | 【AA】           |
|   11 | ash#2            |
|   12 | cc               |
+------+------------------+
affected rows: 8
select hit_count, is_batched_multi_stmt, statement, query_sql from oceanbase.GV$OB_PLAN_CACHE_PLAN_STAT where statement like 'delete from t7 where c1 =%'order by hit_count;
+-----------+-----------------------+----------------------------+-----------------------------------------------------------------------------------+
| hit_count | is_batched_multi_stmt | statement                  | query_sql                                                                         |
+-----------+-----------------------+----------------------------+-----------------------------------------------------------------------------------+
|         0 |                     1 | delete from t7 where c1 =? | delete from t7 where c1 =1;delete from t7 where c1 =2;delete from t7 where c1 =3; |
+-----------+-----------------------+----------------------------+-----------------------------------------------------------------------------------+
affected rows: 1
rollback;
affected rows: 0

#delete ..right join...
alter system flush plan cache global;
affected rows: 0
delete t7,t8 from t7 right join t8 on t7.c1 = t8.c1 where t7.c1 = 1;delete t7,t8 from t7 right join t8 on t7.c1 = t8.c1 where t7.c1 = 2;delete t7,t8 from t7 right join t8 on t7.c1 = t8.c1 where t7.c1 = 3;//
affected rows: 2
affected rows: 4
affected rows: 2
delete t7,t8 from t7 right join t8 on t7.c1 = t8.c1;
affected rows: 13
select hit_count, is_batched_multi_stmt, statement, query_sql from oceanbase.GV$OB_PLAN_CACHE_PLAN_STAT where statement like 'delete t7,t8 from t7 right join t8 on t7.c1 = t8.c1 where t7.c1 = %'order by hit_count;
+-----------+-----------------------+----------------------------------------------------------------------+----------------------------------------------------------------------+
| hit_count | is_batched_multi_stmt | statement                                                            | query_sql                                                            |
+-----------+-----------------------+----------------------------------------------------------------------+----------------------------------------------------------------------+
|         2 |                     0 | delete t7,t8 from t7 right join t8 on t7.c1 = t8.c1 where t7.c1 = ?; | delete t7,t8 from t7 right join t8 on t7.c1 = t8.c1 where t7.c1 = 1; |
+-----------+-----------------------+----------------------------------------------------------------------+----------------------------------------------------------------------+
affected rows: 1
rollback;
affected rows: 0

#foreign key
CREATE TABLE t9 (
    building_no INT PRIMARY KEY AUTO_INCREMENT,
    building_name VARCHAR(255) NOT NULL,
    address VARCHAR(255) NOT NULL
);
affected rows: 0
CREATE TABLE t10 (
    room_no INT PRIMARY KEY AUTO_INCREMENT,
    room_name VARCHAR(255) NOT NULL,
    building_no INT NOT NULL,
    FOREIGN KEY (building_no)
        REFERENCES t9 (building_no)
        ON DELETE CASCADE
);
affected rows: 0
INSERT INTO t9(building_name,address)
VALUES('海南大厦','海口市国兴大道1234号'),
      ('万达水城','海口市大同路1200号'),('黄龙时代','天目山路'),('古荡新村','文三西路'),('古荡新村555','文三西路555');
affected rows: 5
info: Records: 5  Duplicates: 0  Warnings: 0
commit;
affected rows: 0
INSERT INTO t10(room_name,building_no)
VALUES('Amazon',1),
      ('War Room',1),
      ('Office of CEO',1),
      ('Marketing',2),
      ('Showroom',2),('aaa',3),('aaa',4),('aaa',5);
affected rows: 8
info: Records: 8  Duplicates: 0  Warnings: 0
commit;
affected rows: 0

alter system flush plan cache global;
affected rows: 0
delete from t9 where building_no = 1;delete from t9 where building_no = 2;delete from t9 where building_no = 3;//
affected rows: 1
affected rows: 1
affected rows: 1
select * from t9;
+-------------+-----------------+-----------------+
| building_no | building_name   | address         |
+-------------+-----------------+-----------------+
|           4 | 古荡新村        | 文三西路        |
|           5 | 古荡新村555     | 文三西路555     |
+-------------+-----------------+-----------------+
affected rows: 2
select hit_count, is_batched_multi_stmt, statement, query_sql from oceanbase.GV$OB_PLAN_CACHE_PLAN_STAT where statement like 'delete from t9 where building_no = %' order by hit_count;
+-----------+-----------------------+--------------------------------------+-----------------------------------------------------------------------------------------------------------------+
| hit_count | is_batched_multi_stmt | statement                            | query_sql                                                                                                       |
+-----------+-----------------------+--------------------------------------+-----------------------------------------------------------------------------------------------------------------+
|         0 |                     1 | delete from t9 where building_no = ? | delete from t9 where building_no = 1;delete from t9 where building_no = 2;delete from t9 where building_no = 3; |
+-----------+-----------------------+--------------------------------------+-----------------------------------------------------------------------------------------------------------------+
affected rows: 1
rollback;
affected rows: 0

#delete重复行
alter system flush plan cache global;
affected rows: 0
delete from t9 where building_no = 1;delete from t9 where building_no = 2;delete from t9 where building_no = 1;//
affected rows: 1
affected rows: 1
affected rows: 0
select * from t9;
+-------------+-----------------+-----------------+
| building_no | building_name   | address         |
+-------------+-----------------+-----------------+
|           3 | 黄龙时代        | 天目山路        |
|           4 | 古荡新村        | 文三西路        |
|           5 | 古荡新村555     | 文三西路555     |
+-------------+-----------------+-----------------+
affected rows: 3
select hit_count, is_batched_multi_stmt, statement, query_sql from oceanbase.GV$OB_PLAN_CACHE_PLAN_STAT where statement like 'delete from t9 where building_no = %'order by hit_count;
+-----------+-----------------------+---------------------------------------+-----------------------------------------------------------------------------------------------------------------+
| hit_count | is_batched_multi_stmt | statement                             | query_sql                                                                                                       |
+-----------+-----------------------+---------------------------------------+-----------------------------------------------------------------------------------------------------------------+
|         0 |                     1 | delete from t9 where building_no = ?  | delete from t9 where building_no = 1;delete from t9 where building_no = 2;delete from t9 where building_no = 1; |
|         2 |                     0 | delete from t9 where building_no = ?; | delete from t9 where building_no = 1;                                                                           |
+-----------+-----------------------+---------------------------------------+-----------------------------------------------------------------------------------------------------------------+
affected rows: 2
rollback;
affected rows: 0
alter system flush plan cache global;
affected rows: 0


delete  from t9,t10 using t9,t10 where t9.building_no=t10.building_no and t9.building_no=1;delete  from t9,t10 using t9,t10 where t9.building_no=t10.building_no and t9.building_no=2;delete  from t9,t10 using t9,t10 where t9.building_no=t10.building_no and t9.building_no=3;//
affected rows: 4
affected rows: 3
affected rows: 2
select * from t9,t10 where t9.building_no=t10.building_no;
+-------------+-----------------+-----------------+---------+-----------+-------------+
| building_no | building_name   | address         | room_no | room_name | building_no |
+-------------+-----------------+-----------------+---------+-----------+-------------+
|           4 | 古荡新村        | 文三西路        |       7 | aaa       |           4 |
|           5 | 古荡新村555     | 文三西路555     |       8 | aaa       |           5 |
+-------------+-----------------+-----------------+---------+-----------+-------------+
affected rows: 2
rollback;
affected rows: 0

drop table t10;
affected rows: 0
drop table t9;
affected rows: 0


alter system set _rowsets_enabled=true;
affected rows: 0
set autocommit = true;
affected rows: 0
alter system set ob_enable_batched_multi_statement=false;
affected rows: 0


