drop database if exists db1;
create database db1;
use db1;
result_format: 4
alter system flush plan cache global;
affected rows: 0

alter system set _rowsets_enabled=false;
affected rows: 0

set autocommit = false;
affected rows: 0
alter system set ob_enable_batched_multi_statement=true;
affected rows: 0

#index
create table t11(c1 int not null primary key auto_increment,c2 varchar(60))partition by range(c1)
(partition p1 values less than(5),
partition p2 values less than(10),
partition p3 values less than(maxvalue)
);
affected rows: 0
create index index_c1 on t11(c1);
affected rows: 0

insert into t11 values(1,null),(2,'AA'),(3,'CC'),(4,'DD'),(5,'杭州 '),(6,'LLLL'),(7,'QQQ'),(8,'BBB'),(9,'JJJ'),(10,'SSSSA'),(11,'SSSS###'),(12,'SSSSkkj');
affected rows: 12
info: Records: 12  Duplicates: 0  Warnings: 0
commit;
affected rows: 0

alter system flush plan cache global;
affected rows: 0
delete from t11 where c1 = 1+1+1;delete from t11 where c1 = 2+2+2;delete from t11 where c1 = 3+3+3;//
affected rows: 1
affected rows: 1
affected rows: 1
select * from t11 order by c1;
+----+---------+
| c1 | c2      |
+----+---------+
|  1 | NULL    |
|  2 | AA      |
|  4 | DD      |
|  5 | 杭州    |
|  7 | QQQ     |
|  8 | BBB     |
| 10 | SSSSA   |
| 11 | SSSS### |
| 12 | SSSSkkj |
+----+---------+
affected rows: 9
select hit_count, is_batched_multi_stmt, statement, query_sql from oceanbase.GV$OB_PLAN_CACHE_PLAN_STAT where statement like 'delete from t11 where c1 = %'order by hit_count;
+-----------+-----------------------+----------------------------------+-----------------------------------------------------------------------------------------------------+
| hit_count | is_batched_multi_stmt | statement                        | query_sql                                                                                           |
+-----------+-----------------------+----------------------------------+-----------------------------------------------------------------------------------------------------+
|         0 |                     1 | delete from t11 where c1 = ?+?+? | delete from t11 where c1 = 1+1+1;delete from t11 where c1 = 2+2+2;delete from t11 where c1 = 3+3+3; |
+-----------+-----------------------+----------------------------------+-----------------------------------------------------------------------------------------------------+
affected rows: 1
rollback;
affected rows: 0

create table t12 (a1 int primary key auto_increment,a2 varchar(60) not null) partition by list(a1)
(partition p0 values in(1,2,3),
partition p1 values in(4,5,6),
partition p2 values in(7,8,9),
partition p3 values in(10,11,12,13)
);
affected rows: 0

insert into t12(a2) values('AA'),('BB'),('正在'),('单独'),('方法'),('算数'),('##$$'),(';;l'),('3121/+651'),('mgsg《'),('asd123'),('王w@'),('ACD啊#￥');
affected rows: 13
info: Records: 13  Duplicates: 0  Warnings: 0
commit;
affected rows: 0
create unique index index_a1 on t12(a1);
affected rows: 0

alter system flush plan cache global;
affected rows: 0
delete from t12 where a1 = 1*2+1;delete from t12 where a1 = 2*2+1;delete from t12 where a1 = 3*2+1;//
affected rows: 1
affected rows: 1
affected rows: 1
select * from t12 order by a1;
+----+------------+
| a1 | a2         |
+----+------------+
|  1 | AA         |
|  2 | BB         |
|  4 | 单独       |
|  6 | 算数       |
|  8 | ;;l        |
|  9 | 3121/+651  |
| 10 | mgsg《     |
| 11 | asd123     |
| 12 | 王w@       |
| 13 | ACD啊#￥   |
+----+------------+
affected rows: 10
select hit_count, is_batched_multi_stmt, statement, query_sql from oceanbase.GV$OB_PLAN_CACHE_PLAN_STAT where statement like 'delete from t12 where a1 = %'order by hit_count;
+-----------+-----------------------+----------------------------------+-----------------------------------------------------------------------------------------------------+
| hit_count | is_batched_multi_stmt | statement                        | query_sql                                                                                           |
+-----------+-----------------------+----------------------------------+-----------------------------------------------------------------------------------------------------+
|         0 |                     1 | delete from t12 where a1 = ?*?+? | delete from t12 where a1 = 1*2+1;delete from t12 where a1 = 2*2+1;delete from t12 where a1 = 3*2+1; |
+-----------+-----------------------+----------------------------------+-----------------------------------------------------------------------------------------------------+
affected rows: 1
rollback;
affected rows: 0

create table t13(b1 int  auto_increment,b2 datetime not null) partition by hash(b1)
(partition p1,
partition p2,
partition p3
);
affected rows: 0
create index index_b1 on t13(b1,b2);
affected rows: 0
insert into t13(b2) values('2022-05-31'),('2022-06-01'),('2022-06-02'),('2022-06-03'),('2022-06-04'),('2022-06-05'),('2022-06-06'),('2022-06-07'),('2022-06-08'),('2022-06-09'),('2022-06-10'),('2022-06-11'),('2022-06-12'),('2022-06-13');
affected rows: 14
info: Records: 14  Duplicates: 0  Warnings: 0
commit;
affected rows: 0

alter system flush plan cache global;
affected rows: 0
delete from t13 where b1 = 4/2/2;delete from t13 where b1 = 6/3/1;delete from t13 where b1 = 9/3/1;//
affected rows: 1
affected rows: 1
affected rows: 1
select * from t13 order by b1;
+----+---------------------+
| b1 | b2                  |
+----+---------------------+
|  4 | 2022-06-03 00:00:00 |
|  5 | 2022-06-04 00:00:00 |
|  6 | 2022-06-05 00:00:00 |
|  7 | 2022-06-06 00:00:00 |
|  8 | 2022-06-07 00:00:00 |
|  9 | 2022-06-08 00:00:00 |
| 10 | 2022-06-09 00:00:00 |
| 11 | 2022-06-10 00:00:00 |
| 12 | 2022-06-11 00:00:00 |
| 13 | 2022-06-12 00:00:00 |
| 14 | 2022-06-13 00:00:00 |
+----+---------------------+
affected rows: 11
select hit_count, is_batched_multi_stmt, statement, query_sql from oceanbase.GV$OB_PLAN_CACHE_PLAN_STAT where statement like 'delete from t13 where b1 = %'order by hit_count;
+-----------+-----------------------+----------------------------------+-----------------------------------------------------------------------------------------------------+
| hit_count | is_batched_multi_stmt | statement                        | query_sql                                                                                           |
+-----------+-----------------------+----------------------------------+-----------------------------------------------------------------------------------------------------+
|         0 |                     1 | delete from t13 where b1 = ?/?/? | delete from t13 where b1 = 4/2/2;delete from t13 where b1 = 6/3/1;delete from t13 where b1 = 9/3/1; |
+-----------+-----------------------+----------------------------------+-----------------------------------------------------------------------------------------------------+
affected rows: 1
rollback;
affected rows: 0


#没有进行batch 优化
alter system flush plan cache global;
affected rows: 0
delete from t11 where c1 = (select max(a1)-1 from t12);delete from t11 where c1 = (select max(a1)-2 from t12);delete from t11 where c1 = (select max(a1)-3 from t12);//
affected rows: 1
affected rows: 1
affected rows: 1
select * from t11 order by c1;
+----+---------+
| c1 | c2      |
+----+---------+
|  1 | NULL    |
|  2 | AA      |
|  3 | CC      |
|  4 | DD      |
|  5 | 杭州    |
|  6 | LLLL    |
|  7 | QQQ     |
|  8 | BBB     |
|  9 | JJJ     |
+----+---------+
affected rows: 9
select hit_count, is_batched_multi_stmt, statement, query_sql from oceanbase.GV$OB_PLAN_CACHE_PLAN_STAT where statement like 'delete from t11 where c1 = %'order by hit_count;
+-----------+-----------------------+---------------------------------------------------------+---------------------------------------------------------+
| hit_count | is_batched_multi_stmt | statement                                               | query_sql                                               |
+-----------+-----------------------+---------------------------------------------------------+---------------------------------------------------------+
|         2 |                     0 | delete from t11 where c1 = (select max(a1)-? from t12); | delete from t11 where c1 = (select max(a1)-1 from t12); |
+-----------+-----------------------+---------------------------------------------------------+---------------------------------------------------------+
affected rows: 1
rollback;
affected rows: 0

#delete ..right join... 没有进行batch 优化
alter system flush plan cache global;
affected rows: 0
delete t11,t12 from t11 right join t12 on t11.c1 = t12.a1 where t11.c1 = 1;delete t11,t12 from t11 right join t12 on t11.c1 = t12.a1 where t11.c1 = 2;delete t11,t12 from t11 right join t12 on t11.c1 = t12.a1 where t11.c1 = 3;//
affected rows: 2
affected rows: 2
affected rows: 2
select * from t11 right join t12 on t11.c1 = t12.a1 order by t11.c1;
+----+---------+----+------------+
| c1 | c2      | a1 | a2         |
+----+---------+----+------------+
| NULL | NULL    | 13 | ACD啊#￥   |
|  4 | DD      |  4 | 单独       |
|  5 | 杭州    |  5 | 方法       |
|  6 | LLLL    |  6 | 算数       |
|  7 | QQQ     |  7 | ##$$       |
|  8 | BBB     |  8 | ;;l        |
|  9 | JJJ     |  9 | 3121/+651  |
| 10 | SSSSA   | 10 | mgsg《     |
| 11 | SSSS### | 11 | asd123     |
| 12 | SSSSkkj | 12 | 王w@       |
+----+---------+----+------------+
affected rows: 10
select hit_count, is_batched_multi_stmt, statement, query_sql from oceanbase.GV$OB_PLAN_CACHE_PLAN_STAT where statement like 'delete t11,t12 from t11 right join t12 on t11.c1 = t12.a1 where t11.c1 = %'order by hit_count;
+-----------+-----------------------+-----------------------------------------------------------------------------+-----------------------------------------------------------------------------+
| hit_count | is_batched_multi_stmt | statement                                                                   | query_sql                                                                   |
+-----------+-----------------------+-----------------------------------------------------------------------------+-----------------------------------------------------------------------------+
|         2 |                     0 | delete t11,t12 from t11 right join t12 on t11.c1 = t12.a1 where t11.c1 = ?; | delete t11,t12 from t11 right join t12 on t11.c1 = t12.a1 where t11.c1 = 1; |
+-----------+-----------------------+-----------------------------------------------------------------------------+-----------------------------------------------------------------------------+
affected rows: 1
rollback;
affected rows: 0

#3表 (没有进行batch 优化)
alter system flush plan cache global;
affected rows: 0
delete from t11,t12 using t11,t12,t13 where t11.c1 = t12.a1 and t11.c1 = t13.b1 and t12.a1 = 1;delete from t11,t12 using t11,t12,t13 where t11.c1 = t12.a1 and t11.c1 = t13.b1 and t12.a1 = 5;delete from t11,t12 using t11,t12,t13 where t11.c1 = t12.a1 and t11.c1 = t13.b1 and t12.a1 = 7;//
affected rows: 2
affected rows: 2
affected rows: 2
select * from t11,t12,t13 where t11.c1 = t12.a1 and t11.c1 = t13.b1 order by t11.c1;
+----+---------+----+-----------+----+---------------------+
| c1 | c2      | a1 | a2        | b1 | b2                  |
+----+---------+----+-----------+----+---------------------+
|  2 | AA      |  2 | BB        |  2 | 2022-06-01 00:00:00 |
|  3 | CC      |  3 | 正在      |  3 | 2022-06-02 00:00:00 |
|  4 | DD      |  4 | 单独      |  4 | 2022-06-03 00:00:00 |
|  6 | LLLL    |  6 | 算数      |  6 | 2022-06-05 00:00:00 |
|  8 | BBB     |  8 | ;;l       |  8 | 2022-06-07 00:00:00 |
|  9 | JJJ     |  9 | 3121/+651 |  9 | 2022-06-08 00:00:00 |
| 10 | SSSSA   | 10 | mgsg《    | 10 | 2022-06-09 00:00:00 |
| 11 | SSSS### | 11 | asd123    | 11 | 2022-06-10 00:00:00 |
| 12 | SSSSkkj | 12 | 王w@      | 12 | 2022-06-11 00:00:00 |
+----+---------+----+-----------+----+---------------------+
affected rows: 9
select hit_count, is_batched_multi_stmt, statement, query_sql from oceanbase.GV$OB_PLAN_CACHE_PLAN_STAT where statement like 'delete from t11,t12 using t11,t12,t13 where t11.c1 = %'order by hit_count;
+-----------+-----------------------+-------------------------------------------------------------------------------------------------+-------------------------------------------------------------------------------------------------+
| hit_count | is_batched_multi_stmt | statement                                                                                       | query_sql                                                                                       |
+-----------+-----------------------+-------------------------------------------------------------------------------------------------+-------------------------------------------------------------------------------------------------+
|         2 |                     0 | delete from t11,t12 using t11,t12,t13 where t11.c1 = t12.a1 and t11.c1 = t13.b1 and t12.a1 = ?; | delete from t11,t12 using t11,t12,t13 where t11.c1 = t12.a1 and t11.c1 = t13.b1 and t12.a1 = 1; |
+-----------+-----------------------+-------------------------------------------------------------------------------------------------+-------------------------------------------------------------------------------------------------+
affected rows: 1
rollback;
affected rows: 0

drop table t11;
affected rows: 0
drop table t12;
affected rows: 0
drop table t13;
affected rows: 0

alter system set _rowsets_enabled=true;
affected rows: 0
set autocommit = true;
affected rows: 0
alter system set ob_enable_batched_multi_statement=false;
affected rows: 0
