drop database if exists db1;
create database db1;
use db1;
result_format: 4
alter system flush plan cache global;
affected rows: 0
alter system set _rowsets_enabled=false;
affected rows: 0
set autocommit = false;
affected rows: 0
alter system set ob_enable_batched_multi_statement=true;
affected rows: 0

create table t1(c1 int primary key,c2 varchar(60));
affected rows: 0
insert into t1 values(1,null),(2,'AA'),(3,'CC'),(4,'DD'),(5,'杭州 '),(6,'LLLL'),(7,'QQQ'),(8,'BBB'),(9,'JJJ'),(10,'SSSSA'),(11,'SSSS###'),(12,'SSSSkkj');
affected rows: 12
info: Records: 12  Duplicates: 0  Warnings: 0
commit;
affected rows: 0
create view v_t1 as select * from t1;
affected rows: 0

#delete...order by...limit ?,?/limit ? 没有进行batch 优化
delete from v_t1 order by c1 limit 1;delete from v_t1 order by c1 limit 1;delete from v_t1 order by c1 limit 1;//
affected rows: 1
affected rows: 1
affected rows: 1
delete from v_t1 order by c1 limit 1;delete from v_t1 order by c1 limit 1;delete from v_t1 order by c1 limit 1;//
affected rows: 1
affected rows: 1
affected rows: 1
select * from v_t1;
+----+---------+
| c1 | c2      |
+----+---------+
|  7 | QQQ     |
|  8 | BBB     |
|  9 | JJJ     |
| 10 | SSSSA   |
| 11 | SSSS### |
| 12 | SSSSkkj |
+----+---------+
affected rows: 6
select hit_count, is_batched_multi_stmt, statement, query_sql from oceanbase.GV$OB_PLAN_CACHE_PLAN_STAT where statement like 'delete from v_t1 order by c1 limit %' order by hit_count;
+-----------+-----------------------+---------------------------------------+---------------------------------------+
| hit_count | is_batched_multi_stmt | statement                             | query_sql                             |
+-----------+-----------------------+---------------------------------------+---------------------------------------+
|         5 |                     0 | delete from v_t1 order by c1 limit ?; | delete from v_t1 order by c1 limit 1; |
+-----------+-----------------------+---------------------------------------+---------------------------------------+
affected rows: 1
rollback;
affected rows: 0

drop view v_t1;
affected rows: 0


#delete ..where
create table t2(c1 decimal(5,3) not null,c2 double);
affected rows: 0
insert into t2 values(10.222,1.123),(20.222,2.234),(30.333,3.456),(1.1234,5.2);
affected rows: 4
info: Records: 4  Duplicates: 0  Warnings: 0
Warnings:
Warning	1265	Data truncated for column 'c1' at row 4
commit;
affected rows: 0
create view v_t2 as select * from t2;
affected rows: 0

#where条件精度不同场景回退
delete from v_t2 where c1 = 10.222;delete from v_t2 where c1 = 20.222;delete from v_t2 where c1 = 30.333;//
affected rows: 1
affected rows: 1
affected rows: 1
delete from v_t2 where c1 = 10.222;delete from v_t2 where c1 = 1.1234;delete from v_t2 where c1 = 30.333;//
affected rows: 0
affected rows: 0
affected rows: 0
select * from v_t2;
+-------+------+
| c1    | c2   |
+-------+------+
| 1.123 |  5.2 |
+-------+------+
affected rows: 1
select hit_count, is_batched_multi_stmt, statement, query_sql from oceanbase.GV$OB_PLAN_CACHE_PLAN_STAT where statement like 'delete from v_t2 where c1 = %' order by hit_count;
+-----------+-----------------------+--------------------------------+-------------------------------------+
| hit_count | is_batched_multi_stmt | statement                      | query_sql                           |
+-----------+-----------------------+--------------------------------+-------------------------------------+
|         0 |                     0 | delete from v_t2 where c1 = ?; | delete from v_t2 where c1 = 1.1234; |
|         4 |                     0 | delete from v_t2 where c1 = ?; | delete from v_t2 where c1 = 10.222; |
+-----------+-----------------------+--------------------------------+-------------------------------------+
affected rows: 2
rollback;
affected rows: 0
drop view v_t2;
affected rows: 0

create table t3(c1 decimal(5,3) not null,c2 double);
affected rows: 0
insert into t3 values(10.222,1.123),(20.222,2.234),(30.333,3.456),(1.1234,5.2);
affected rows: 4
info: Records: 4  Duplicates: 0  Warnings: 0
Warnings:
Warning	1265	Data truncated for column 'c1' at row 4
commit;
affected rows: 0
create view v_t3 as select * from t3;
affected rows: 0


#delete ...where c1 = ?+?
alter system flush plan cache global;
affected rows: 0
delete from v_t3 where c2 = 1+0.123;delete from v_t3 where c2 = 2+0.234;delete from v_t3 where c2 = 3+0.456;//
affected rows: 1
affected rows: 1
affected rows: 1
delete from v_t3 where c2 = 1+0.123;delete from v_t3 where c2 = 5+0.2;delete from v_t3 where c2 = 3+0.456;//
affected rows: 0
affected rows: 1
affected rows: 0
select * from v_t3;
+----+------+
| c1 | c2   |
+----+------+
+----+------+
affected rows: 0
select hit_count, is_batched_multi_stmt, statement, query_sql from oceanbase.GV$OB_PLAN_CACHE_PLAN_STAT where statement like 'delete from v_t3 where c2 = %' order by hit_count;
+-----------+-----------------------+----------------------------------+--------------------------------------+
| hit_count | is_batched_multi_stmt | statement                        | query_sql                            |
+-----------+-----------------------+----------------------------------+--------------------------------------+
|         0 |                     0 | delete from v_t3 where c2 = ?+?; | delete from v_t3 where c2 = 5+0.2;   |
|         4 |                     0 | delete from v_t3 where c2 = ?+?; | delete from v_t3 where c2 = 1+0.123; |
+-----------+-----------------------+----------------------------------+--------------------------------------+
affected rows: 2
rollback;
affected rows: 0
drop view v_t3;
affected rows: 0

create table t4(c1 int not null default '8',c2 char(20));
affected rows: 0
insert into t4 values(1,null),(2,'AA'),(3,'CC'),(4,'DD'),(5,'杭州 '),(6,'LLLL'),(7,'QQQ'),(9,'JJJ'),(10,'SSSSA'),(11,'SSSS###'),(12,'SSSSkkj');
affected rows: 11
info: Records: 11  Duplicates: 0  Warnings: 0
insert into t4(c2) values('2020-02-02'),('2021');
affected rows: 2
info: Records: 2  Duplicates: 0  Warnings: 0
commit;
affected rows: 0
create view v_t4 as select * from t4;
affected rows: 0

#delete ...where c1 = ?*?*? or ?/?/? or ?%?%?
delete from v_t4 where c1 = 6-1-1;delete from v_t4 where c1 = 10-2-1;delete from v_t4 where c1 = 8-3-0;//
affected rows: 1
affected rows: 1
affected rows: 1
delete from v_t4 where c1 = 1*2*3;delete from v_t4 where c1 = 2*2*2;delete from v_t4 where c1 = 3*1*3;//
affected rows: 1
affected rows: 2
affected rows: 1
delete from v_t4 where c1 = 9/3/3;delete from v_t4 where c1 = 8/2/2;delete from v_t4 where c1 = 12/2/2;//
affected rows: 1
affected rows: 1
affected rows: 1
delete from v_t4 where c1 = 9%6%2;delete from v_t4 where c1 = 11%6%3;delete from v_t4 where c1 = 25%9%4;//
affected rows: 0
affected rows: 0
affected rows: 0
select * from v_t4;
+----+---------+
| c1 | c2      |
+----+---------+
| 10 | SSSSA   |
| 11 | SSSS### |
| 12 | SSSSkkj |
+----+---------+
affected rows: 3
select hit_count, is_batched_multi_stmt, statement, query_sql from oceanbase.GV$OB_PLAN_CACHE_PLAN_STAT where statement like 'delete from v_t4 where c1 = %' order by hit_count;
+-----------+-----------------------+------------------------------------+------------------------------------+
| hit_count | is_batched_multi_stmt | statement                          | query_sql                          |
+-----------+-----------------------+------------------------------------+------------------------------------+
|         2 |                     0 | delete from v_t4 where c1 = ?-?-?; | delete from v_t4 where c1 = 6-1-1; |
|         2 |                     0 | delete from v_t4 where c1 = ?*?*?; | delete from v_t4 where c1 = 1*2*3; |
|         2 |                     0 | delete from v_t4 where c1 = ?/?/?; | delete from v_t4 where c1 = 9/3/3; |
|         2 |                     0 | delete from v_t4 where c1 = ?%?%?; | delete from v_t4 where c1 = 9%6%2; |
+-----------+-----------------------+------------------------------------+------------------------------------+
affected rows: 4
rollback;
affected rows: 0
drop view v_t4;
affected rows: 0


create table t5(c1 int primary key auto_increment,c2 varchar(60))partition by hash(c1)
(partition p1,
partition p2,
partition p3
);
affected rows: 0
insert into t5 values(1,null),(2,'AA'),(3,'CC'),(4,'DD'),(5,'杭州 '),(6,'LLLL'),(7,'QQQ'),(8,'BBB'),(9,'JJJ'),(10,'SSSSA'),(11,'SSSS###'),(12,'SSSSkkj');
affected rows: 12
info: Records: 12  Duplicates: 0  Warnings: 0
commit;
affected rows: 0
create view v_t5 as select * from t5;
affected rows: 0

#delete ...where ..and....
delete from v_t5 where c1 = 4 and c2 = 'DD';delete from v_t5 where c1 = 2 and c2 = 'AA';delete from v_t5 where c1 = 3 and c2 = 'CC';//
affected rows: 1
affected rows: 1
affected rows: 1
select * from v_t5;
+----+---------+
| c1 | c2      |
+----+---------+
|  6 | LLLL    |
|  9 | JJJ     |
| 12 | SSSSkkj |
|  1 | NULL    |
|  7 | QQQ     |
| 10 | SSSSA   |
|  5 | 杭州    |
|  8 | BBB     |
| 11 | SSSS### |
+----+---------+
affected rows: 9
select hit_count, is_batched_multi_stmt, statement, query_sql from oceanbase.GV$OB_PLAN_CACHE_PLAN_STAT where statement like 'delete from v_t5 where c1 = % and c2 = %' order by hit_count;
+-----------+-----------------------+-------------------------------------------+----------------------------------------------+
| hit_count | is_batched_multi_stmt | statement                                 | query_sql                                    |
+-----------+-----------------------+-------------------------------------------+----------------------------------------------+
|         2 |                     0 | delete from v_t5 where c1 = ? and c2 = ?; | delete from v_t5 where c1 = 4 and c2 = 'DD'; |
+-----------+-----------------------+-------------------------------------------+----------------------------------------------+
affected rows: 1
rollback;
affected rows: 0

alter system flush plan cache global;
affected rows: 0
delete from v_t5 where c1 = 4 and c2 = 'DD';delete from v_t5 where c1 = 2 and c2 = 'AD';delete from v_t5 where c1 = 3 and c2 = 'CC';//
affected rows: 1
affected rows: 0
affected rows: 1
select * from v_t5;
+----+---------+
| c1 | c2      |
+----+---------+
|  6 | LLLL    |
|  9 | JJJ     |
| 12 | SSSSkkj |
|  1 | NULL    |
|  7 | QQQ     |
| 10 | SSSSA   |
|  2 | AA      |
|  5 | 杭州    |
|  8 | BBB     |
| 11 | SSSS### |
+----+---------+
affected rows: 10
select hit_count, is_batched_multi_stmt, statement, query_sql from oceanbase.GV$OB_PLAN_CACHE_PLAN_STAT where statement like 'delete from v_t5 where c1 = % and c2 = %' order by hit_count;
+-----------+-----------------------+-------------------------------------------+----------------------------------------------+
| hit_count | is_batched_multi_stmt | statement                                 | query_sql                                    |
+-----------+-----------------------+-------------------------------------------+----------------------------------------------+
|         2 |                     0 | delete from v_t5 where c1 = ? and c2 = ?; | delete from v_t5 where c1 = 4 and c2 = 'DD'; |
+-----------+-----------------------+-------------------------------------------+----------------------------------------------+
affected rows: 1
rollback;
affected rows: 0

#delete 重复行(batch场景回退)
alter system flush plan cache global;
affected rows: 0
delete from v_t5 where c1 = 1 or c1 = 3;delete from v_t5 where c1 = 2 or c1 = 3;delete from v_t5 where c1 = 7 or c1 = 9;//
affected rows: 2
affected rows: 1
affected rows: 2
select * from v_t5;
+----+---------+
| c1 | c2      |
+----+---------+
|  6 | LLLL    |
| 12 | SSSSkkj |
|  4 | DD      |
| 10 | SSSSA   |
|  5 | 杭州    |
|  8 | BBB     |
| 11 | SSSS### |
+----+---------+
affected rows: 7
select hit_count, is_batched_multi_stmt, statement, query_sql from oceanbase.GV$OB_PLAN_CACHE_PLAN_STAT where statement like 'delete from v_t5 where c1 = % or c1 = %' order by hit_count;
+-----------+-----------------------+------------------------------------------+------------------------------------------+
| hit_count | is_batched_multi_stmt | statement                                | query_sql                                |
+-----------+-----------------------+------------------------------------------+------------------------------------------+
|         2 |                     0 | delete from v_t5 where c1 = ? or c1 = ?; | delete from v_t5 where c1 = 1 or c1 = 3; |
+-----------+-----------------------+------------------------------------------+------------------------------------------+
affected rows: 1
rollback;
affected rows: 0
drop view v_t5;
affected rows: 0

create table t6(c1 float not null,c2 datetime not null);
affected rows: 0
insert into t6 values(2.222,'2022-06-09'),(3.333,'2022-07-09'),(5.555,'2022-08-08'),(6.678,'1998-09-09'),(7.221,'2000-10-10'),(8.666,'2001-01-01'),(9.678,'2002-02-02'),(10.001,'2010-10-10'),(11.645,'2016-06-06'),(12.111,'2018-08-08');
affected rows: 10
info: Records: 10  Duplicates: 0  Warnings: 0
commit;
affected rows: 0
create view v_t6 as select * from t6;
affected rows: 0

#delete...where...and...order by...limit  没有进行batch优化
delete from v_t6 where c1 > 3 and c1 < 5 order by c1 desc limit 1;delete from v_t6 where c1 > 6 and c1 < 8 order by c1 desc limit 1;delete from v_t6 where c1 > 10 and c1 < 12 order by c1 desc limit 1;//
affected rows: 1
affected rows: 1
affected rows: 1
select hit_count, is_batched_multi_stmt, statement, query_sql from oceanbase.GV$OB_PLAN_CACHE_PLAN_STAT where statement like 'delete from v_t6 where c1 > % and c1 < % order by c1 desc limit %' order by hit_count;
+-----------+-----------------------+--------------------------------------------------------------------+--------------------------------------------------------------------+
| hit_count | is_batched_multi_stmt | statement                                                          | query_sql                                                          |
+-----------+-----------------------+--------------------------------------------------------------------+--------------------------------------------------------------------+
|         2 |                     0 | delete from v_t6 where c1 > ? and c1 < ? order by c1 desc limit ?; | delete from v_t6 where c1 > 3 and c1 < 5 order by c1 desc limit 1; |
+-----------+-----------------------+--------------------------------------------------------------------+--------------------------------------------------------------------+
affected rows: 1
select * from v_t6;
+--------+---------------------+
| c1     | c2                  |
+--------+---------------------+
|  2.222 | 2022-06-09 00:00:00 |
|  5.555 | 2022-08-08 00:00:00 |
|  6.678 | 1998-09-09 00:00:00 |
|  8.666 | 2001-01-01 00:00:00 |
|  9.678 | 2002-02-02 00:00:00 |
| 10.001 | 2010-10-10 00:00:00 |
| 12.111 | 2018-08-08 00:00:00 |
+--------+---------------------+
affected rows: 7
rollback;
affected rows: 0
drop view v_t6;
affected rows: 0

alter system set _rowsets_enabled=true;
affected rows: 0
set autocommit = true;
affected rows: 0
alter system set ob_enable_batched_multi_statement=false;
affected rows: 0

