ob1=OBI(cluster=1:1:1,version=4_3_0_1,oblog_version=current,asvr_num=1);
ob1.proxy0.set extra_config=syslog_level=debug;
ob1.asvr0.set extra_config=$arb_extra_conf;
ob1.reboot;
ob1.mysql alter system set leak_mod_to_check='ModulePageAlloc';
ob1.mysql alter system set debug_sync_timeout = '1000s';
ob1.z1.obs0.sh cd $work_dir/; ls -l {etc,etc2,etc3}/observer.conf*.bin;
ob1.z2.obs0.sh cd $work_dir/; ls -l {etc,etc2,etc3}/observer.conf*.bin;
ob1.z3.obs0.sh cd $work_dir/; ls -l {etc,etc2,etc3}/observer.conf*.bin;
ob1.mysql alter tenant sys set primary_zone = "z1";
ob1.mysql create resource unit box1 max_cpu 2,memory_size 5368709120;
ob1.mysql create resource pool pool1 unit = 'box1', unit_num = 1;
ob1.mysql create tenant oracle replica_num = 1, resource_pool_list=('pool1') set ob_tcp_invited_nodes='%', ob_compatibility_mode='oracle';
ob1.mysql alter tenant oracle set variables autocommit='on';
create user obtest IDENTIFIED BY obtest;
grant all on *.* to obtest WITH GRANT OPTION;
grant dba to obtest;
ob1.check_until_timeout select count(*) from DBA_OB_ARBITRATION_SERVICE where arbitration_service = "$arb_svr_ip:$arb_svr_port", 1, 30;
ob1.mysql CREATE RESOURCE UNIT unit_1 MAX_CPU 1, MEMORY_SIZE='2G';
ob1.mysql CREATE RESOURCE POOL pool_1 UNIT = 'unit_1', UNIT_NUM = 1, zone_list = ('z1', 'z2');
ob1.mysql CREATE TENANT mysql RESOURCE_POOL_LIST = ('pool_1'),  locality='F@z1, F@z2', primary_zone='RANDOM', enable_arbitration_service=true set ob_tcp_invited_nodes='%';
ob1.check_until_timeout select count(*) from __all_virtual_log_stat where tenant_id=$mysql_tenant_id and arbitration_member not like "%$arb_svr_ip:$arb_svr_port%", 0, 30;
ob1.asvr0.force_stop;
ob1.asvr0.upgrade;
ob1.asvr0.nstart;
ob1.asvr0.force_stop;
ob1.asvr0.nstart;
create database oblog_db;
use oblog_db;
ob1.oblog.gen_conf tb_white_list=mysql.*.*;
ob1.oblog.restart;
drop table if exists oblog_test;
create table oblog_test (pk int primary key, c1 varchar(100));
set ob_org_cluster_id=1234;
replace into oblog_test values (1, 1), (2,2), (3,3);
ob1.oblog.next_dml;
[R0] BEGIN;[R0] org_cluster_id:1234;[R1] record_type:INSERT;[R1] database_name:mysql.oblog_db;[R1] table_name:oblog_test;[R1] log_event:true;[R1] column_count:2;[R1] source_category:SRC_FULL_RECORDED;[R1] source_type:SRC_OCEANBASE_1_0;[R1] has_pk:true;[R1] pk_info:(0);[R1] pks:pk;[R1] has_uk:false;[R1] uk_info:(null);[R1] uks:(null);[R1] [C1] column_name:pk;[R1] [C1] column_type:MYSQL_TYPE_LONG;[R1] [C1] column_is_rowkey:true;[R1] [C1] column_is_signed:true;[R1] [C1] column_encoding:binary;[R1] [C1] column_is_not_null:true;[R1] [C1] column_value_new:[1](1);[R1] [C2] column_name:c1;[R1] [C2] column_type:MYSQL_TYPE_VAR_STRING;[R1] [C2] column_is_rowkey:false;[R1] [C2] column_is_signed:true;[R1] [C2] column_encoding:utf8mb4;[R1] [C2] column_is_not_null:false;[R1] [C2] column_value_new:[1](1);$[R2] record_type:INSERT;[R2] database_name:mysql.oblog_db;[R2] table_name:oblog_test;[R2] log_event:true;[R2] column_count:2;[R2] source_category:SRC_FULL_RECORDED;[R2] source_type:SRC_OCEANBASE_1_0;[R2] has_pk:true;[R2] pk_info:(0);[R2] pks:pk;[R2] has_uk:false;[R2] uk_info:(null);[R2] uks:(null);[R2] [C1] column_name:pk;[R2] [C1] column_type:MYSQL_TYPE_LONG;[R2] [C1] column_is_rowkey:true;[R2] [C1] column_is_signed:true;[R2] [C1] column_encoding:binary;[R2] [C1] column_is_not_null:true;[R2] [C1] column_value_new:[2](1);[R2] [C2] column_name:c1;[R2] [C2] column_type:MYSQL_TYPE_VAR_STRING;[R2] [C2] column_is_rowkey:false;[R2] [C2] column_is_signed:true;[R2] [C2] column_encoding:utf8mb4;[R2] [C2] column_is_not_null:false;[R2] [C2] column_value_new:[2](1);$[R3] record_type:INSERT;[R3] database_name:mysql.oblog_db;[R3] table_name:oblog_test;[R3] log_event:true;[R3] column_count:2;[R3] source_category:SRC_FULL_RECORDED;[R3] source_type:SRC_OCEANBASE_1_0;[R3] has_pk:true;[R3] pk_info:(0);[R3] pks:pk;[R3] has_uk:false;[R3] uk_info:(null);[R3] uks:(null);[R3] [C1] column_name:pk;[R3] [C1] column_type:MYSQL_TYPE_LONG;[R3] [C1] column_is_rowkey:true;[R3] [C1] column_is_signed:true;[R3] [C1] column_encoding:binary;[R3] [C1] column_is_not_null:true;[R3] [C1] column_value_new:[3](1);[R3] [C2] column_name:c1;[R3] [C2] column_type:MYSQL_TYPE_VAR_STRING;[R3] [C2] column_is_rowkey:false;[R3] [C2] column_is_signed:true;[R3] [C2] column_encoding:utf8mb4;[R3] [C2] column_is_not_null:false;[R3] [C2] column_value_new:[3](1);$[R4] COMMIT;
ob1.mysql alter system set balancer_idle_time='10s';
ob1.mysql alter system set merger_check_interval='10s' tenant all;
ob1.mysql alter system set ob_compaction_schedule_interval='10s' tenant all;
ob1.mysql set global ob_sql_audit_percentage=80;
alter proxyconfig set server_state_refresh_interval='1s';
create database int2bigint;
create sequence int2bigint.s_mix cache 1000000 noorder;
create sequence int2bigint.s_finish cache 1000000 noorder;
create sequence int2bigint.s_finish_end cache 1000000 noorder;
create table int2bigint.t_foreign_depend (i_f_d int primary key);
create table int2bigint.t_mix (i_p int primary key, i_i int, i_g_d int, i_g_i_d int, i_f int, i_u int unsigned, i_c int, c char(20), c_g_d char(20), d decimal(10,2), d_i decimal(10,2), i_g int GENERATED ALWAYS AS (i_g_d+1) stored, i_g_i int GENERATED ALWAYS AS (i_g_i_d+1) stored, c_g char(40) GENERATED ALWAYS AS (concat(c_g_d,c_g_d)) virtual, foreign key (i_f) references int2bigint.t_foreign_depend(i_f_d), check (i_c<10000));
create table int2bigint.t_finish (i_p int primary key, i_i int, i_g_d int, i_g_i_d int, i_f int, i_u int unsigned, i_c int, c char(20), c_g_d char(20), d decimal(10,2), d_i decimal(10,2), i_g int GENERATED ALWAYS AS (i_g_d+1) stored, i_g_i int GENERATED ALWAYS AS (i_g_i_d+1) stored, c_g char(40) GENERATED ALWAYS AS (concat(c_g_d,c_g_d)) virtual, foreign key (i_f) references int2bigint.t_foreign_depend(i_f_d), check (i_c<10000));
insert into int2bigint.t_foreign_depend values (1);
create index idx_t_mix_i_i on int2bigint.t_mix(i_i);
create index idx_t_mix_d_i on int2bigint.t_mix(d_i);
create index idx_t_mix_i_g_i on int2bigint.t_mix(i_g_i);
create index idx_t_finish_i_i on int2bigint.t_finish(i_i);
create index idx_t_finish_d_i on int2bigint.t_finish(d_i);
create index idx_t_finish_i_g_i on int2bigint.t_finish(i_g_i);
insert into int2bigint.t_mix(i_p, i_i, i_g_d, i_f, i_u, i_c, c, c_g_d, d, d_i, i_g_i_d)
values (int2bigint.s_mix.nextval, int2bigint.s_mix.nextval, 1, 1, 1, 1, 'feidu', 'feidu', 11.11, 11.11, 1),
(int2bigint.s_mix.nextval, int2bigint.s_mix.nextval, 2, 1, 2, 2, 'feidu', 'feidu', 11.11, 11.11, 1),
(int2bigint.s_mix.nextval, int2bigint.s_mix.nextval, 3, 1, 3, 3, 'feidu', 'feidu', 11.11, 11.11, 1),
(int2bigint.s_mix.nextval, int2bigint.s_mix.nextval, 4, 1, 4, 4, 'feidu', 'feidu', 11.11, 11.11, 1),
(int2bigint.s_mix.nextval, int2bigint.s_mix.nextval, 5, 1, 5, 5, 'feidu', 'feidu', 11.11, 11.11, 1),
(int2bigint.s_mix.nextval, int2bigint.s_mix.nextval, 6, 1, 6, 6, 'feidu', 'feidu', 11.11, 11.11, 1),
(int2bigint.s_mix.nextval, int2bigint.s_mix.nextval, 7, 1, 7, 7, 'feidu', 'feidu', 11.11, 11.11, 1),
(int2bigint.s_mix.nextval, int2bigint.s_mix.nextval, 8, 1, 8, 8, 'feidu', 'feidu', 11.11, 11.11, 1),
(int2bigint.s_mix.nextval, int2bigint.s_mix.nextval, 9, 1, 9, 9, 'feidu', 'feidu', 11.11, 11.11, 1),
(int2bigint.s_mix.nextval, int2bigint.s_mix.nextval, 10, 1, 10, 10, 'feidu', 'feidu', 11.11, 11.11, 1);
insert into int2bigint.t_finish(i_p, i_i, i_g_d, i_f, i_u, i_c, c, c_g_d, d, d_i, i_g_i_d)
values (int2bigint.s_finish.nextval, int2bigint.s_finish.nextval, 1, 1, 1, 1, 'feidu', 'feidu', 11.11, 11.11, 1),
(int2bigint.s_finish.nextval, int2bigint.s_finish.nextval, 2, 1, 2, 2, 'feidu', 'feidu', 11.11, 11.11, 1),
(int2bigint.s_finish.nextval, int2bigint.s_finish.nextval, 3, 1, 3, 3, 'feidu', 'feidu', 11.11, 11.11, 1),
(int2bigint.s_finish.nextval, int2bigint.s_finish.nextval, 4, 1, 4, 4, 'feidu', 'feidu', 11.11, 11.11, 1),
(int2bigint.s_finish.nextval, int2bigint.s_finish.nextval, 5, 1, 5, 5, 'feidu', 'feidu', 11.11, 11.11, 1),
(int2bigint.s_finish.nextval, int2bigint.s_finish.nextval, 6, 1, 6, 6, 'feidu', 'feidu', 11.11, 11.11, 1),
(int2bigint.s_finish.nextval, int2bigint.s_finish.nextval, 7, 1, 7, 7, 'feidu', 'feidu', 11.11, 11.11, 1),
(int2bigint.s_finish.nextval, int2bigint.s_finish.nextval, 8, 1, 8, 8, 'feidu', 'feidu', 11.11, 11.11, 1),
(int2bigint.s_finish.nextval, int2bigint.s_finish.nextval, 9, 1, 9, 9, 'feidu', 'feidu', 11.11, 11.11, 1),
(int2bigint.s_finish.nextval, int2bigint.s_finish.nextval, 10, 1, 10, 10, 'feidu', 'feidu', 11.11, 11.11, 1);
create table t_oracle_int_float (a NUMBER(38) primary key);
insert into t_oracle_int_float(a) values (1);
use test;
create table t(c1 int, c2 int);
create table t_part(c1 int, c2 int) partition by hash(c1) partitions 8;
insert into t values(1, 1), (2, 2), (3, 3), (4, 4), (5, 5), (6, 6), (7, 7), (8, 8), (9, 9), (10, 10);
insert into t_part values(1, 1);
insert into t_part values(2, 2);
insert into t_part values(3, 3);
insert into t_part values(4, 4);
insert into t_part values(5, 5);
insert into t_part values(6, 6);
insert into t_part values(7, 7);
insert into t_part values(8, 8);
insert into t_part values(9, 9);
insert into t_part values(10, 10);
commit;
use test;
create table t_cg_0(c1 int, c2 int unique, c3 text);
create table t_cg_1(c1 int, c2 int unique, c3 text);
create table t_cg_2(c1 int, c2 int unique, c3 text);
create table t_cg_3(c1 int, c2 int unique, c3 text);
create index idx0 on t_cg_0(c1);
create index idx1 on t_cg_1(c1);
create index idx2 on t_cg_2(c1);
create index idx3 on t_cg_3(c1);
create database db1;
create tablegroup tg;
create table db1.tb_normal (pk int primary key,c1 varchar(1024) default '0', c2 timestamp(6) default now(6), c3 timestamp default now(), index i1(c2), index i2(c1)) tablegroup tg;
create table db1.tb_increment (pk int primary key auto_increment,c1 int, c2 datetime(6) DEFAULT CURRENT_TIMESTAMP(6) ON UPDATE CURRENT_TIMESTAMP(6), index i1(c2)) tablegroup tg;
create table db1.tb_bigtable (c1 varchar(65536),c2 varchar(65536),c3 varchar(65536),c4 varchar(65536), pk bigint primary key auto_increment) COMPRESSION = 'none' tablegroup tg;
create table db1.global_t6(a int, b int, c int, primary key(a)) partition by hash(a) partitions 2;
create index gkey on db1.global_t6(b) global;
insert into db1.global_t6 values(1, 5, 1), (2, 4, 2), (3, 3, 3), (4, 2, 4), (5, 1, 5);
create table db1.global_t7(a int, b int, c int, primary key(a));
insert into db1.global_t7 values(1, 5, 1), (2, 4, 2), (3, 3, 3), (4, 2, 4), (5, 1, 5);
create table test.tb_table_gencol(pk1 bigint, pk2 varchar(2048),c1 varchar(65536), c2 varchar(65536),ac1 bigint auto_increment,
ts timestamp(6) DEFAULT CURRENT_TIMESTAMP(6) ON UPDATE CURRENT_TIMESTAMP(6),  gmt_create timestamp(6) default now(6), gmt_modified timestamp(6) default now(6),
gen_c1 varchar(10) GENERATED ALWAYS AS (substr(c1,1,10)) virtual,
gen_c2 varchar(10) GENERATED ALWAYS AS (substr(c2,1,10)) stored,
primary key(pk1, pk2),index i1(ts));
create table test.tablegencol(c1 bigint primary key,user_id varchar(32) NOT NULL default '' comment 'Alipay User ID', address varchar(256) NOT NULL default '' comment 'address', index(user_id,address(255)));
create table test.table_hash(c1 int primary key, c2 int) partition by hash(c1) partitions 2;
create table test.table_range(c1 int primary key, c2 int) partition by range(c1) (partition p0 values less than (100), partition p1 values less than (200), partition p2 values less than MAXVALUE);
create table test.table_hash_range (c1 int primary key, c2 int) partition by hash(c1) subpartition by range(c1) subpartition template(SUBPARTITION c0 VALUES LESS THAN(1990), SUBPARTITION c1 VALUES LESS THAN (2000), SUBPARTITION c2 VALUES LESS THAN MAXVALUE) partitions 2;
create table test.table_range_hash (c1 int primary key, c2 int) partition by range(c1) subpartition by hash(c1) subpartitions 2 (PARTITION c0 VALUES LESS THAN (1980), PARTITION c1 VALUES LESS THAN (1990), PARTITION c2 VALUES LESS THAN (1995), PARTITION c3 VALUES LESS THAN (2000), PARTITION c4 VALUES LESS THAN MAXVALUE);
create tablegroup tg_old;
create table test.table_with_tg(c1 int primary key, c2 int) tablegroup tg_old;
create table test.t_parent(c1 int, c2 int, constraint t_parent_pk primary key(c1, c2));
create table test.t_child(c1 int, c2 int, constraint t_child_fk foreign key(c2, c1) references test.t_parent(c1, c2));
create table test.t_check_1(c1 int, c2 int, constraint cst1 check(c1 = c2));
create table test.t_check_2(c1 int, c2 int, constraint cst2 check(c2 = c1));
create table test.local_var(c1 timestamp, c2_local_var date as (c1), index i1 (c2_local_var));
insert into test.local_var(c1) values('2011-01-01 00:00:00');
create table test.t_begin_micro_index_clustered (a int, b text, index(a)) MICRO_INDEX_CLUSTERED = TRUE;
ERROR 42000: You have an error in your SQL syntax; check the manual that corresponds to your OceanBase version for the right syntax to use near 'MICRO_INDEX_CLUSTERED = TRUE' at line 1
create table test.t_begin_micro_index_clustered (a int, b text, index(a));
create index idx_a_twice on test.t_begin_micro_index_clustered(a);
show create table test.t_begin_micro_index_clustered;
Table	Create Table
t_begin_micro_index_clustered	CREATE TABLE `t_begin_micro_index_clustered` (
  `a` int(11) DEFAULT NULL,
  `b` text DEFAULT NULL,
  KEY `a` (`a`) BLOCK_SIZE 16384 LOCAL,
  KEY `idx_a_twice` (`a`) BLOCK_SIZE 16384 LOCAL
) DEFAULT CHARSET = utf8mb4 ROW_FORMAT = DYNAMIC COMPRESSION = 'zstd_1.3.8' REPLICA_NUM = 3 BLOCK_SIZE = 16384 USE_BLOOM_FILTER = FALSE TABLET_SIZE = 134217728 PCTFREE = 0
create user dblink_test IDENTIFIED BY 123;
grant all on *.* to dblink_test WITH GRANT OPTION;
grant dba to dblink_test;
create table dblink_t1(a number, b varchar2(60));
insert into dblink_t1 values (1, 'a'), (2, 'b'), (3, 'c');
commit;
create table t1(pk int primary key, c1 number, c2 date default Date '2012-01-02', c3 timestamp default Timestamp '2012-12-01 01:02:03.123456789', c4 timestamp with time zone default Timestamp '2012-12-01 01:02:03.123456789 +02:00');
insert into t1 (pk, c1) values(1,1),(2,2);
delete from t1 where pk=1;
select pk, c1, to_char(c2), to_char(c3), to_char(c4) from t1;
PK	C1	TO_CHAR(C2)	TO_CHAR(C3)	TO_CHAR(C4)
2	2	02-JAN-12	01-DEC-12 01.02.03.123457 AM	01-DEC-12 01.02.03.123457 AM +02:00
create table global_t1(a int, b int, c int, primary key(a)) partition by hash(a) partitions 2;
create index gkey on global_t1(b) global;
insert into global_t1 values(1, 1, 1), (2, 2, 2), (3, 3, 3), (4, 4, 4), (5, 5, 5);
create table global_t2(a int, b int, c int, primary key(a));
insert into global_t2 values(1, 5, 1), (2, 4, 2), (3, 3, 3), (4, 2, 4), (5, 1, 5);
create tablespace tp1;
create table t_parent(c1 int, c2 int, constraint t_parent_pk primary key(c1, c2));
create table t_child(c1 int, c2 int, constraint t_child_fk foreign key(c2, c1) references t_parent(c1, c2));
create table t_check_1(c1 int, c2 int, constraint cst1 check(c1 = c2));
create table t_check_2(c1 int, c2 int, constraint cst2 check(c2 = c1));
create table t_notnull_pk(c1 int primary key, c2 int, c3 int not null);
desc t_notnull_pk;
FIELD	TYPE	NULL	KEY	DEFAULT	EXTRA
C1	NUMBER(38)	NO	PRI	NULL	NULL
C2	NUMBER(38)	YES	NULL	NULL	NULL
C3	NUMBER(38)	NO	NULL	NULL	NULL
create table t_notnull_nopk(c2 int, c3 int not null) partition by hash(c2,c3) partitions 3;
select * from dblink_t1@oci_link;
A	B
1	a
2	b
3	c
use oblog_db;
set ob_org_cluster_id=1234;
replace into oblog_test values (1, 1), (2,2), (3,3);
ob1.oblog.next_dml;
[R0] BEGIN;[R0] org_cluster_id:1234;[R1] record_type:INSERT;[R1] database_name:mysql.test;[R1] table_name:t;[R1] log_event:true;[R1] column_count:3;[R1] source_category:SRC_FULL_RECORDED;[R1] source_type:SRC_OCEANBASE_1_0;[R1] has_pk:true;[R1] pk_info:(0);[R1] pks:__pk_increment;[R1] has_uk:false;[R1] uk_info:(null);[R1] uks:(null);[R1] [C1] column_name:__pk_increment;[R1] [C1] column_type:MYSQL_TYPE_LONGLONG;[R1] [C1] column_is_rowkey:true;[R1] [C1] column_is_signed:false;[R1] [C1] column_encoding:binary;[R1] [C1] column_is_not_null:true;[R1] [C1] column_value_new:[1](1);[R1] [C2] column_name:c1;[R1] [C2] column_type:MYSQL_TYPE_LONG;[R1] [C2] column_is_rowkey:false;[R1] [C2] column_is_signed:true;[R1] [C2] column_encoding:binary;[R1] [C2] column_is_not_null:false;[R1] [C2] column_value_new:[1](1);[R1] [C3] column_name:c2;[R1] [C3] column_type:MYSQL_TYPE_LONG;[R1] [C3] column_is_rowkey:false;[R1] [C3] column_is_signed:true;[R1] [C3] column_encoding:binary;[R1] [C3] column_is_not_null:false;[R1] [C3] column_value_new:[1](1);$[R2] record_type:INSERT;[R2] database_name:mysql.test;[R2] table_name:t;[R2] log_event:true;[R2] column_count:3;[R2] source_category:SRC_FULL_RECORDED;[R2] source_type:SRC_OCEANBASE_1_0;[R2] has_pk:true;[R2] pk_info:(0);[R2] pks:__pk_increment;[R2] has_uk:false;[R2] uk_info:(null);[R2] uks:(null);[R2] [C1] column_name:__pk_increment;[R2] [C1] column_type:MYSQL_TYPE_LONGLONG;[R2] [C1] column_is_rowkey:true;[R2] [C1] column_is_signed:false;[R2] [C1] column_encoding:binary;[R2] [C1] column_is_not_null:true;[R2] [C1] column_value_new:[2](1);[R2] [C2] column_name:c1;[R2] [C2] column_type:MYSQL_TYPE_LONG;[R2] [C2] column_is_rowkey:false;[R2] [C2] column_is_signed:true;[R2] [C2] column_encoding:binary;[R2] [C2] column_is_not_null:false;[R2] [C2] column_value_new:[2](1);[R2] [C3] column_name:c2;[R2] [C3] column_type:MYSQL_TYPE_LONG;[R2] [C3] column_is_rowkey:false;[R2] [C3] column_is_signed:true;[R2] [C3] column_encoding:binary;[R2] [C3] column_is_not_null:false;[R2] [C3] column_value_new:[2](1);$[R3] record_type:INSERT;[R3] database_name:mysql.test;[R3] table_name:t;[R3] log_event:true;[R3] column_count:3;[R3] source_category:SRC_FULL_RECORDED;[R3] source_type:SRC_OCEANBASE_1_0;[R3] has_pk:true;[R3] pk_info:(0);[R3] pks:__pk_increment;[R3] has_uk:false;[R3] uk_info:(null);[R3] uks:(null);[R3] [C1] column_name:__pk_increment;[R3] [C1] column_type:MYSQL_TYPE_LONGLONG;[R3] [C1] column_is_rowkey:true;[R3] [C1] column_is_signed:false;[R3] [C1] column_encoding:binary;[R3] [C1] column_is_not_null:true;[R3] [C1] column_value_new:[3](1);[R3] [C2] column_name:c1;[R3] [C2] column_type:MYSQL_TYPE_LONG;[R3] [C2] column_is_rowkey:false;[R3] [C2] column_is_signed:true;[R3] [C2] column_encoding:binary;[R3] [C2] column_is_not_null:false;[R3] [C2] column_value_new:[3](1);[R3] [C3] column_name:c2;[R3] [C3] column_type:MYSQL_TYPE_LONG;[R3] [C3] column_is_rowkey:false;[R3] [C3] column_is_signed:true;[R3] [C3] column_encoding:binary;[R3] [C3] column_is_not_null:false;[R3] [C3] column_value_new:[3](1);$[R4] record_type:INSERT;[R4] database_name:mysql.test;[R4] table_name:t;[R4] log_event:true;[R4] column_count:3;[R4] source_category:SRC_FULL_RECORDED;[R4] source_type:SRC_OCEANBASE_1_0;[R4] has_pk:true;[R4] pk_info:(0);[R4] pks:__pk_increment;[R4] has_uk:false;[R4] uk_info:(null);[R4] uks:(null);[R4] [C1] column_name:__pk_increment;[R4] [C1] column_type:MYSQL_TYPE_LONGLONG;[R4] [C1] column_is_rowkey:true;[R4] [C1] column_is_signed:false;[R4] [C1] column_encoding:binary;[R4] [C1] column_is_not_null:true;[R4] [C1] column_value_new:[4](1);[R4] [C2] column_name:c1;[R4] [C2] column_type:MYSQL_TYPE_LONG;[R4] [C2] column_is_rowkey:false;[R4] [C2] column_is_signed:true;[R4] [C2] column_encoding:binary;[R4] [C2] column_is_not_null:false;[R4] [C2] column_value_new:[4](1);[R4] [C3] column_name:c2;[R4] [C3] column_type:MYSQL_TYPE_LONG;[R4] [C3] column_is_rowkey:false;[R4] [C3] column_is_signed:true;[R4] [C3] column_encoding:binary;[R4] [C3] column_is_not_null:false;[R4] [C3] column_value_new:[4](1);$[R5] record_type:INSERT;[R5] database_name:mysql.test;[R5] table_name:t;[R5] log_event:true;[R5] column_count:3;[R5] source_category:SRC_FULL_RECORDED;[R5] source_type:SRC_OCEANBASE_1_0;[R5] has_pk:true;[R5] pk_info:(0);[R5] pks:__pk_increment;[R5] has_uk:false;[R5] uk_info:(null);[R5] uks:(null);[R5] [C1] column_name:__pk_increment;[R5] [C1] column_type:MYSQL_TYPE_LONGLONG;[R5] [C1] column_is_rowkey:true;[R5] [C1] column_is_signed:false;[R5] [C1] column_encoding:binary;[R5] [C1] column_is_not_null:true;[R5] [C1] column_value_new:[5](1);[R5] [C2] column_name:c1;[R5] [C2] column_type:MYSQL_TYPE_LONG;[R5] [C2] column_is_rowkey:false;[R5] [C2] column_is_signed:true;[R5] [C2] column_encoding:binary;[R5] [C2] column_is_not_null:false;[R5] [C2] column_value_new:[5](1);[R5] [C3] column_name:c2;[R5] [C3] column_type:MYSQL_TYPE_LONG;[R5] [C3] column_is_rowkey:false;[R5] [C3] column_is_signed:true;[R5] [C3] column_encoding:binary;[R5] [C3] column_is_not_null:false;[R5] [C3] column_value_new:[5](1);$[R6] record_type:INSERT;[R6] database_name:mysql.test;[R6] table_name:t;[R6] log_event:true;[R6] column_count:3;[R6] source_category:SRC_FULL_RECORDED;[R6] source_type:SRC_OCEANBASE_1_0;[R6] has_pk:true;[R6] pk_info:(0);[R6] pks:__pk_increment;[R6] has_uk:false;[R6] uk_info:(null);[R6] uks:(null);[R6] [C1] column_name:__pk_increment;[R6] [C1] column_type:MYSQL_TYPE_LONGLONG;[R6] [C1] column_is_rowkey:true;[R6] [C1] column_is_signed:false;[R6] [C1] column_encoding:binary;[R6] [C1] column_is_not_null:true;[R6] [C1] column_value_new:[6](1);[R6] [C2] column_name:c1;[R6] [C2] column_type:MYSQL_TYPE_LONG;[R6] [C2] column_is_rowkey:false;[R6] [C2] column_is_signed:true;[R6] [C2] column_encoding:binary;[R6] [C2] column_is_not_null:false;[R6] [C2] column_value_new:[6](1);[R6] [C3] column_name:c2;[R6] [C3] column_type:MYSQL_TYPE_LONG;[R6] [C3] column_is_rowkey:false;[R6] [C3] column_is_signed:true;[R6] [C3] column_encoding:binary;[R6] [C3] column_is_not_null:false;[R6] [C3] column_value_new:[6](1);$[R7] record_type:INSERT;[R7] database_name:mysql.test;[R7] table_name:t;[R7] log_event:true;[R7] column_count:3;[R7] source_category:SRC_FULL_RECORDED;[R7] source_type:SRC_OCEANBASE_1_0;[R7] has_pk:true;[R7] pk_info:(0);[R7] pks:__pk_increment;[R7] has_uk:false;[R7] uk_info:(null);[R7] uks:(null);[R7] [C1] column_name:__pk_increment;[R7] [C1] column_type:MYSQL_TYPE_LONGLONG;[R7] [C1] column_is_rowkey:true;[R7] [C1] column_is_signed:false;[R7] [C1] column_encoding:binary;[R7] [C1] column_is_not_null:true;[R7] [C1] column_value_new:[7](1);[R7] [C2] column_name:c1;[R7] [C2] column_type:MYSQL_TYPE_LONG;[R7] [C2] column_is_rowkey:false;[R7] [C2] column_is_signed:true;[R7] [C2] column_encoding:binary;[R7] [C2] column_is_not_null:false;[R7] [C2] column_value_new:[7](1);[R7] [C3] column_name:c2;[R7] [C3] column_type:MYSQL_TYPE_LONG;[R7] [C3] column_is_rowkey:false;[R7] [C3] column_is_signed:true;[R7] [C3] column_encoding:binary;[R7] [C3] column_is_not_null:false;[R7] [C3] column_value_new:[7](1);$[R8] record_type:INSERT;[R8] database_name:mysql.test;[R8] table_name:t;[R8] log_event:true;[R8] column_count:3;[R8] source_category:SRC_FULL_RECORDED;[R8] source_type:SRC_OCEANBASE_1_0;[R8] has_pk:true;[R8] pk_info:(0);[R8] pks:__pk_increment;[R8] has_uk:false;[R8] uk_info:(null);[R8] uks:(null);[R8] [C1] column_name:__pk_increment;[R8] [C1] column_type:MYSQL_TYPE_LONGLONG;[R8] [C1] column_is_rowkey:true;[R8] [C1] column_is_signed:false;[R8] [C1] column_encoding:binary;[R8] [C1] column_is_not_null:true;[R8] [C1] column_value_new:[8](1);[R8] [C2] column_name:c1;[R8] [C2] column_type:MYSQL_TYPE_LONG;[R8] [C2] column_is_rowkey:false;[R8] [C2] column_is_signed:true;[R8] [C2] column_encoding:binary;[R8] [C2] column_is_not_null:false;[R8] [C2] column_value_new:[8](1);[R8] [C3] column_name:c2;[R8] [C3] column_type:MYSQL_TYPE_LONG;[R8] [C3] column_is_rowkey:false;[R8] [C3] column_is_signed:true;[R8] [C3] column_encoding:binary;[R8] [C3] column_is_not_null:false;[R8] [C3] column_value_new:[8](1);$[R9] record_type:INSERT;[R9] database_name:mysql.test;[R9] table_name:t;[R9] log_event:true;[R9] column_count:3;[R9] source_category:SRC_FULL_RECORDED;[R9] source_type:SRC_OCEANBASE_1_0;[R9] has_pk:true;[R9] pk_info:(0);[R9] pks:__pk_increment;[R9] has_uk:false;[R9] uk_info:(null);[R9] uks:(null);[R9] [C1] column_name:__pk_increment;[R9] [C1] column_type:MYSQL_TYPE_LONGLONG;[R9] [C1] column_is_rowkey:true;[R9] [C1] column_is_signed:false;[R9] [C1] column_encoding:binary;[R9] [C1] column_is_not_null:true;[R9] [C1] column_value_new:[9](1);[R9] [C2] column_name:c1;[R9] [C2] column_type:MYSQL_TYPE_LONG;[R9] [C2] column_is_rowkey:false;[R9] [C2] column_is_signed:true;[R9] [C2] column_encoding:binary;[R9] [C2] column_is_not_null:false;[R9] [C2] column_value_new:[9](1);[R9] [C3] column_name:c2;[R9] [C3] column_type:MYSQL_TYPE_LONG;[R9] [C3] column_is_rowkey:false;[R9] [C3] column_is_signed:true;[R9] [C3] column_encoding:binary;[R9] [C3] column_is_not_null:false;[R9] [C3] column_value_new:[9](1);$[R10] record_type:INSERT;[R10] database_name:mysql.test;[R10] table_name:t;[R10] log_event:true;[R10] column_count:3;[R10] source_category:SRC_FULL_RECORDED;[R10] source_type:SRC_OCEANBASE_1_0;[R10] has_pk:true;[R10] pk_info:(0);[R10] pks:__pk_increment;[R10] has_uk:false;[R10] uk_info:(null);[R10] uks:(null);[R10] [C1] column_name:__pk_increment;[R10] [C1] column_type:MYSQL_TYPE_LONGLONG;[R10] [C1] column_is_rowkey:true;[R10] [C1] column_is_signed:false;[R10] [C1] column_encoding:binary;[R10] [C1] column_is_not_null:true;[R10] [C1] column_value_new:[10](2);[R10] [C2] column_name:c1;[R10] [C2] column_type:MYSQL_TYPE_LONG;[R10] [C2] column_is_rowkey:false;[R10] [C2] column_is_signed:true;[R10] [C2] column_encoding:binary;[R10] [C2] column_is_not_null:false;[R10] [C2] column_value_new:[10](2);[R10] [C3] column_name:c2;[R10] [C3] column_type:MYSQL_TYPE_LONG;[R10] [C3] column_is_rowkey:false;[R10] [C3] column_is_signed:true;[R10] [C3] column_encoding:binary;[R10] [C3] column_is_not_null:false;[R10] [C3] column_value_new:[10](2);$[R11] COMMIT;
set @@session.ob_query_timeout = 60000000;
alter system major freeze tenant=all;
set autocommit=0;
insert into db1.tb_normal(pk,c1) values(101,'101'),(102,'102'),(103,'103'),(104,'104');
update db1.tb_normal set c1=concat(c1,'_x') where pk > 100;
delete from db1.tb_normal where pk=104;
commit;
ob1.check_until_timeout  select count(1) as unsync_cnt from GV\$OB_LOG_STAT where in_sync = 'NO',0,600;
ob1.z2.obs0.force_stop;
ob1.check_until_timeout select count(*) from __all_virtual_log_stat where tenant_id=$mysql_tenant_id and degraded_list not like '%$z2_ip0:$z2_port0%', 0, 30;
ob1.check_until_timeout select count(*) from oceanbase.DBA_OB_SERVERS where zone = 'z2' and status='INACTIVE',1,60;
ob1.z2.obs0.nstart;
ob1.check_until_timeout select count(*) from oceanbase.__all_server where zone = 'z2' and (start_service_time <= 0 or status='INACTIVE'),0,120;
ob1.check_until_timeout select count(*) from __all_virtual_log_stat where degraded_list like '%$z2_ip0:$z2_port0%', 0, 120;
ob1.check_until_timeout select count(*) as cnt from oceanbase.__all_virtual_server_schema_info as a join oceanbase.__all_virtual_server_schema_info as b on a.tenant_id = b.tenant_id  where a.refreshed_schema_version != b.refreshed_schema_version, 0, 60;
ob1.upgrade_check_before;
ob1.upgrade_commond_for_server pre;
set @@session.ob_query_timeout = 60000000;
alter system stop zone 'z2';
ob1.check_until_timeout select status from DBA_OB_ZONES where zone='z2',INACTIVE,20;
ob1.check_until_timeout select count(1) as leader_count  from CDB_OB_LS_LOCATIONS where zone='z2' and role='leader',0,20;
ob1.z2.force_stop;
ob1.check_until_timeout select count(*) from oceanbase.DBA_OB_SERVERS where zone = 'z2' and (start_service_time is null and status='INACTIVE'),1,60;
ob1.z2.upgrade;
ob1.z2.nstart;
ob1.check_until_timeout select count(*) from oceanbase.__all_server where zone = 'z2' and (start_service_time is null  or status='INACTIVE'),0,300;
ob1.check_until_timeout  select count(1) as unsync_cnt from GV\$OB_LOG_STAT where in_sync = 'NO',0,600;
ob1.check_until_timeout select count(*) from oceanbase.__all_server a left join oceanbase.__all_virtual_server_schema_info b on a.svr_ip = b.svr_ip and a.svr_port = b.svr_port where b.svr_ip is null, 0, 120;
ob1.check_until_timeout select count(*) as cnt from oceanbase.__all_virtual_server_schema_info as a join oceanbase.__all_virtual_server_schema_info as b on a.tenant_id = b.tenant_id  where a.refreshed_schema_version != b.refreshed_schema_version or a.refreshed_schema_version % 8 != 0, 0, 180;
ob1.mysql alter system start zone 'z2';
use test;
select /*+ parallel(4)*/ * from t, t_part where t.c1 = t_part.c1;
c1	c2	c1	c2
1	1	1	1
10	10	10	10
2	2	2	2
3	3	3	3
4	4	4	4
5	5	5	5
6	6	6	6
7	7	7	7
8	8	8	8
9	9	9	9
use test;
select /*+ parallel(4)*/ * from t, t_part where t.c1 = t_part.c1;
c1	c2	c1	c2
1	1	1	1
10	10	10	10
2	2	2	2
3	3	3	3
4	4	4	4
5	5	5	5
6	6	6	6
7	7	7	7
8	8	8	8
9	9	9	9
ob1.mysql alter system stop server '$server1_ip:$server1_port';
ob1.check_until_timeout select count(*) from CDB_OB_LS_LOCATIONS where zone != 'z1' and role='leader' and tenant_id = (select tenant_id from __all_tenant where tenant_name='sys'),0,60;
set autocommit=0;
insert into db1.tb_normal(pk,c1) values(301,'301'),(302,'302'),(303,'303'),(304,'304');
update db1.tb_normal set c1=concat(c1,'_x') where pk > 100;
delete from db1.tb_normal where pk=304;
update db1.tb_increment set pk=pk+1 order by pk desc limit 1;
insert into db1.tb_increment(pk,c1) values (301,301),(302,302);
replace into db1.tb_increment(pk,c1) values (301,302);
delete from db1.tb_increment where pk=302;
commit;
set autocommit=1;
select pk,c1 from db1.tb_normal order by pk;
pk	c1
1	0
2	0
3	0
4	0
5	0
6	0
7	0
8	0
9	0
10	0
11	0
12	0
13	0
14	0
15	0
16	0
17	0
18	0
19	0
20	0
21	0
22	0
23	0
24	0
25	0
26	0
27	0
28	0
29	0
30	0
31	0
32	0
33	0
34	0
35	0
36	0
37	0
38	0
39	0
40	0
41	0
42	0
43	0
44	0
45	0
46	0
47	0
48	0
49	0
50	0
51	0
52	0
53	0
54	0
55	0
56	0
57	0
58	0
59	0
60	0
61	0
62	0
63	0
64	0
65	0
66	0
67	0
68	0
69	0
70	0
71	0
72	0
73	0
74	0
75	0
76	0
77	0
78	0
79	0
80	0
81	0
82	0
83	0
84	0
85	0
86	0
87	0
88	0
89	0
90	0
91	0
92	0
93	0
94	0
95	0
96	0
97	0
98	0
99	0
100	0
101	101_x_x
102	102_x_x
103	103_x_x
301	301_x
302	302_x
303	303_x
select pk,c1 from db1.tb_increment order by pk limit 1;
pk	c1
1	1
select a.pk,a.c1,b.c1 from db1.tb_normal a join db1.tb_increment b where a.pk=b.pk order by a.pk limit 2;
pk	c1	c1
1	0	1
2	0	2
show tables like 'tb_normal';
Tables_in_db1 (tb_normal)
tb_normal
show create table db1.tb_increment;
Table	Create Table
tb_increment	CREATE TABLE `tb_increment` (
  `pk` int(11) NOT NULL AUTO_INCREMENT,
  `c1` int(11) DEFAULT NULL,
  `c2` datetime(6) DEFAULT CURRENT_TIMESTAMP(6) ON UPDATE CURRENT_TIMESTAMP(6),
  PRIMARY KEY (`pk`),
  KEY `i1` (`c2`) BLOCK_SIZE 16384 LOCAL
) AUTO_INCREMENT = 303 AUTO_INCREMENT_MODE = 'ORDER' DEFAULT CHARSET = utf8mb4 ROW_FORMAT = DYNAMIC COMPRESSION = 'zstd_1.3.8' REPLICA_NUM = 3 BLOCK_SIZE = 16384 USE_BLOOM_FILTER = FALSE TABLET_SIZE = 134217728 PCTFREE = 0 TABLEGROUP = 'tg'
select /*+index(global_t6 primary)*/ * from global_t6;
a	b	c
2	4	2
4	2	4
1	5	1
3	3	3
5	1	5
insert into global_t6 values(10, 100, 10);
update global_t6 set b=7 where a=1;
select /*+index(global_t6 gkey)*/ a, b from global_t6;
a	b
5	1
4	2
3	3
2	4
1	7
10	100
update global_t6 set a=100 where b=2;
update global_t6 set b=19 where b=1;
select /*+index(global_t6 gkey)*/ a, b from global_t6;
a	b
100	2
3	3
2	4
1	7
5	19
10	100
update global_t6 set c=100 where b>=10;
select /*+index(global_t6 gkey)*/ a, b from global_t6;
a	b
100	2
3	3
2	4
1	7
5	19
10	100
delete from global_t6 where a=1;
select /*+index(global_t6 gkey)*/ a, b from global_t6;
a	b
100	2
3	3
2	4
5	19
10	100
delete from global_t6 where a=2 or a=3;
select /*+index(global_t6 gkey)*/ a, b from global_t6;
a	b
100	2
5	19
10	100
delete from global_t6 where b>=100;
select /*+index(global_t6 gkey)*/ a, b from global_t6;
a	b
100	2
5	19
delete from global_t6;
select /*+index(global_t6 primary)*/ * from global_t6;
a	b	c
insert into global_t6 values(1, 1, 1), (5, 6, 2), (4, 2, 1);
select /*+index(global_t6 primary)*/ * from global_t6;
a	b	c
4	2	1
1	1	1
5	6	2
delete from global_t6 where b < 7 and b >1;
select /*+index(global_t6 gkey)*/ a, b from global_t6;
a	b
1	1
select /*+index(global_t6 primary)*/ a, b, c from global_t6;
a	b	c
1	1	1
insert into global_t6 values(2, 2, 2), (3, 3, 3), (4, 4, 4) on duplicate key update b=b+1;
select /*+index(global_t6 gkey)*/ a, b from global_t6;
a	b
1	1
2	2
3	3
4	4
select /*+index(global_t6 primary)*/ a, b, c from global_t6;
a	b	c
2	2	2
4	4	4
1	1	1
3	3	3
insert into global_t6 values(2, 2, 2), (3, 3, 3), (4, 4, 4) on duplicate key update b=b+1;
select /*+index(global_t6 gkey)*/ a, b from global_t6;
a	b
1	1
2	3
3	4
4	5
select /*+index(global_t6 primary)*/ a, b, c from global_t6;
a	b	c
2	3	2
4	5	4
1	1	1
3	4	3
replace into global_t6 values(2, 2, 2), (3, 3, 3), (4, 4, 4);
select /*+index(global_t6 gkey)*/ a, b from global_t6;
a	b
1	1
2	2
3	3
4	4
select /*+index(global_t6 primary)*/ a, b, c from global_t6;
a	b	c
2	2	2
4	4	4
1	1	1
3	3	3
commit;
select * from global_t1 for update;
A	B	C
1	1	1
2	2	2
3	3	3
4	4	4
5	5	5
select * from global_t1, global_t2 where global_t1.a = global_t2.a for update;
A	B	C	A	B	C
1	1	1	1	5	1
2	2	2	2	4	2
3	3	3	3	3	3
4	4	4	4	2	4
5	5	5	5	1	5
commit;
insert into t1 (pk, c1) values(4,4);
update t1 set c1=0 where pk=2;
select pk, c1, to_char(c2), to_char(c3), to_char(c4) from t1;
PK	C1	TO_CHAR(C2)	TO_CHAR(C3)	TO_CHAR(C4)
2	0	02-JAN-12	01-DEC-12 01.02.03.123457 AM	01-DEC-12 01.02.03.123457 AM +02:00
4	4	02-JAN-12	01-DEC-12 01.02.03.123457 AM	01-DEC-12 01.02.03.123457 AM +02:00
ob1.z1.mysql_p show global variables like 'max_user_connections';
Variable_name	Value
max_user_connections	0
ob1.z1.mysql_p show variables like 'max_user_connections';
Variable_name	Value
max_user_connections	0
ob1.z1.mysql_p show create table oceanbase.__all_table;
Table	Create Table
__all_table	CREATE TABLE `__all_table` (\n  `gmt_create` timestamp(6) NULL DEFAULT CURRENT_TIMESTAMP(6),\n  `gmt_modified` timestamp(6) NULL DEFAULT CURRENT_TIMESTAMP(6) ON UPDATE CURRENT_TIMESTAMP(6),\n  `tenant_id` bigint(20) NOT NULL,\n  `table_id` bigint(20) NOT NULL,\n  `table_name` varchar(256) NOT NULL DEFAULT '',\n  `database_id` bigint(20) NOT NULL,\n  `table_type` bigint(20) NOT NULL,\n  `load_type` bigint(20) NOT NULL,\n  `def_type` bigint(20) NOT NULL,\n  `rowkey_column_num` bigint(20) NOT NULL,\n  `index_column_num` bigint(20) NOT NULL,\n  `max_used_column_id` bigint(20) NOT NULL,\n  `autoinc_column_id` bigint(20) NOT NULL,\n  `auto_increment` bigint(20) unsigned DEFAULT '1',\n  `read_only` bigint(20) NOT NULL,\n  `rowkey_split_pos` bigint(20) NOT NULL,\n  `compress_func_name` varchar(128) NOT NULL,\n  `expire_condition` varchar(4096) NOT NULL,\n  `is_use_bloomfilter` bigint(20) NOT NULL,\n  `comment` varchar(4096) NOT NULL DEFAULT '',\n  `block_size` bigint(20) NOT NULL,\n  `collation_type` bigint(20) NOT NULL,\n  `data_table_id` bigint(20) DEFAULT NULL,\n  `index_status` bigint(20) NOT NULL,\n  `tablegroup_id` bigint(20) NOT NULL,\n  `progressive_merge_num` bigint(20) NOT NULL,\n  `index_type` bigint(20) NOT NULL,\n  `part_level` bigint(20) NOT NULL,\n  `part_func_type` bigint(20) NOT NULL,\n  `part_func_expr` varchar(4096) NOT NULL,\n  `part_num` bigint(20) NOT NULL,\n  `sub_part_func_type` bigint(20) NOT NULL,\n  `sub_part_func_expr` varchar(4096) NOT NULL,\n  `sub_part_num` bigint(20) NOT NULL,\n  `schema_version` bigint(20) NOT NULL,\n  `view_definition` longtext NOT NULL,\n  `view_check_option` bigint(20) NOT NULL,\n  `view_is_updatable` bigint(20) NOT NULL,\n  `index_using_type` bigint(20) NOT NULL DEFAULT '0',\n  `parser_name` varchar(128) DEFAULT NULL,\n  `index_attributes_set` bigint(20) DEFAULT '0',\n  `tablet_size` bigint(20) NOT NULL DEFAULT '134217728',\n  `pctfree` bigint(20) NOT NULL DEFAULT '10',\n  `partition_status` bigint(20) DEFAULT '0',\n  `partition_schema_version` bigint(20) DEFAULT '0',\n  `session_id` bigint(20) DEFAULT '0',\n  `pk_comment` varchar(4096) NOT NULL DEFAULT '',\n  `sess_active_time` bigint(20) DEFAULT '0',\n  `row_store_type` varchar(128) DEFAULT 'encoding_row_store',\n  `store_format` varchar(128) DEFAULT '',\n  `duplicate_scope` bigint(20) DEFAULT '0',\n  `progressive_merge_round` bigint(20) DEFAULT '0',\n  `storage_format_version` bigint(20) DEFAULT '2',\n  `table_mode` bigint(20) NOT NULL DEFAULT '0',\n  `encryption` varchar(128) DEFAULT '',\n  `tablespace_id` bigint(20) NOT NULL DEFAULT '-1',\n  `sub_part_template_flags` bigint(20) NOT NULL DEFAULT '0',\n  `dop` bigint(20) NOT NULL DEFAULT '1',\n  `character_set_client` bigint(20) NOT NULL DEFAULT '0',\n  `collation_connection` bigint(20) NOT NULL DEFAULT '0',\n  `auto_part_size` bigint(20) NOT NULL DEFAULT '-1',\n  `auto_part` tinyint(4) NOT NULL DEFAULT '0',\n  `association_table_id` bigint(20) NOT NULL DEFAULT '-1',\n  `tablet_id` bigint(20) NOT NULL DEFAULT '0',\n  `max_dependency_version` bigint(20) NOT NULL DEFAULT '-1',\n  `define_user_id` bigint(20) NOT NULL DEFAULT '-1',\n  `transition_point` varchar(4096) DEFAULT NULL,\n  `b_transition_point` varchar(8192) DEFAULT NULL,\n  `interval_range` varchar(4096) DEFAULT NULL,\n  `b_interval_range` varchar(8192) DEFAULT NULL,\n  `object_status` bigint(20) NOT NULL DEFAULT '1',\n  `table_flags` bigint(20) NOT NULL DEFAULT '0',\n  `truncate_version` bigint(20) NOT NULL DEFAULT '-1',\n  `external_file_location` varbinary(1048576) DEFAULT NULL,\n  `external_file_location_access_info` varbinary(1048576) DEFAULT NULL,\n  `external_file_format` varbinary(1048576) DEFAULT NULL,\n  `external_file_pattern` varbinary(1048576) DEFAULT NULL,\n  `ttl_definition` varchar(262144) NOT NULL DEFAULT '',\n  `kv_attributes` varchar(262144) NOT NULL DEFAULT '',\n  `name_generated_type` bigint(20) NOT NULL DEFAULT '0',\n  `lob_inrow_threshold` bigint(20) NOT NULL DEFAULT '4096',\n  `max_used_column_group_id` bigint(20) NOT NULL DEFAULT '1000',\n  `column_store` bigint(20) NOT NULL DEFAULT '0',\n  `auto_increment_cache_size` bigint(20) NOT NULL DEFAULT '0',\n  PRIMARY KEY (`tenant_id`, `table_id`),\n  KEY `idx_data_table_id` (`data_table_id`) BLOCK_SIZE 16384 LOCAL,\n  KEY `idx_db_tb_name` (`database_id`, `table_name`) BLOCK_SIZE 16384 LOCAL,\n  KEY `idx_tb_name` (`table_name`) BLOCK_SIZE 16384 LOCAL\n) DEFAULT CHARSET = utf8mb4 ROW_FORMAT = DYNAMIC COMPRESSION = 'none' REPLICA_NUM = 3 BLOCK_SIZE = 16384 USE_BLOOM_FILTER = FALSE TABLET_SIZE = 134217728 PCTFREE = 10 TABLEGROUP = 'oceanbase'
ob1.z1.mysql show parameters like 'zone_merge_concurrency';
ob1.z2.mysql_p show global variables like 'max_user_connections';
Variable_name	Value
max_user_connections	0
ob1.z2.mysql_p show variables like 'max_user_connections';
Variable_name	Value
max_user_connections	0
ob1.z2.mysql_p show create table oceanbase.__all_table;
Table	Create Table
__all_table	CREATE TABLE `__all_table` (\n  `gmt_create` timestamp(6) NULL DEFAULT CURRENT_TIMESTAMP(6),\n  `gmt_modified` timestamp(6) NULL DEFAULT CURRENT_TIMESTAMP(6) ON UPDATE CURRENT_TIMESTAMP(6),\n  `tenant_id` bigint(20) NOT NULL,\n  `table_id` bigint(20) NOT NULL,\n  `table_name` varchar(256) NOT NULL DEFAULT '',\n  `database_id` bigint(20) NOT NULL,\n  `table_type` bigint(20) NOT NULL,\n  `load_type` bigint(20) NOT NULL,\n  `def_type` bigint(20) NOT NULL,\n  `rowkey_column_num` bigint(20) NOT NULL,\n  `index_column_num` bigint(20) NOT NULL,\n  `max_used_column_id` bigint(20) NOT NULL,\n  `autoinc_column_id` bigint(20) NOT NULL,\n  `auto_increment` bigint(20) unsigned DEFAULT '1',\n  `read_only` bigint(20) NOT NULL,\n  `rowkey_split_pos` bigint(20) NOT NULL,\n  `compress_func_name` varchar(128) NOT NULL,\n  `expire_condition` varchar(4096) NOT NULL,\n  `is_use_bloomfilter` bigint(20) NOT NULL,\n  `comment` varchar(4096) NOT NULL DEFAULT '',\n  `block_size` bigint(20) NOT NULL,\n  `collation_type` bigint(20) NOT NULL,\n  `data_table_id` bigint(20) DEFAULT NULL,\n  `index_status` bigint(20) NOT NULL,\n  `tablegroup_id` bigint(20) NOT NULL,\n  `progressive_merge_num` bigint(20) NOT NULL,\n  `index_type` bigint(20) NOT NULL,\n  `part_level` bigint(20) NOT NULL,\n  `part_func_type` bigint(20) NOT NULL,\n  `part_func_expr` varchar(4096) NOT NULL,\n  `part_num` bigint(20) NOT NULL,\n  `sub_part_func_type` bigint(20) NOT NULL,\n  `sub_part_func_expr` varchar(4096) NOT NULL,\n  `sub_part_num` bigint(20) NOT NULL,\n  `schema_version` bigint(20) NOT NULL,\n  `view_definition` longtext NOT NULL,\n  `view_check_option` bigint(20) NOT NULL,\n  `view_is_updatable` bigint(20) NOT NULL,\n  `index_using_type` bigint(20) NOT NULL DEFAULT '0',\n  `parser_name` varchar(128) DEFAULT NULL,\n  `index_attributes_set` bigint(20) DEFAULT '0',\n  `tablet_size` bigint(20) NOT NULL DEFAULT '134217728',\n  `pctfree` bigint(20) NOT NULL DEFAULT '10',\n  `partition_status` bigint(20) DEFAULT '0',\n  `partition_schema_version` bigint(20) DEFAULT '0',\n  `session_id` bigint(20) DEFAULT '0',\n  `pk_comment` varchar(4096) NOT NULL DEFAULT '',\n  `sess_active_time` bigint(20) DEFAULT '0',\n  `row_store_type` varchar(128) DEFAULT 'encoding_row_store',\n  `store_format` varchar(128) DEFAULT '',\n  `duplicate_scope` bigint(20) DEFAULT '0',\n  `progressive_merge_round` bigint(20) DEFAULT '0',\n  `storage_format_version` bigint(20) DEFAULT '2',\n  `table_mode` bigint(20) NOT NULL DEFAULT '0',\n  `encryption` varchar(128) DEFAULT '',\n  `tablespace_id` bigint(20) NOT NULL DEFAULT '-1',\n  `sub_part_template_flags` bigint(20) NOT NULL DEFAULT '0',\n  `dop` bigint(20) NOT NULL DEFAULT '1',\n  `character_set_client` bigint(20) NOT NULL DEFAULT '0',\n  `collation_connection` bigint(20) NOT NULL DEFAULT '0',\n  `auto_part_size` bigint(20) NOT NULL DEFAULT '-1',\n  `auto_part` tinyint(4) NOT NULL DEFAULT '0',\n  `association_table_id` bigint(20) NOT NULL DEFAULT '-1',\n  `tablet_id` bigint(20) NOT NULL DEFAULT '0',\n  `max_dependency_version` bigint(20) NOT NULL DEFAULT '-1',\n  `define_user_id` bigint(20) NOT NULL DEFAULT '-1',\n  `transition_point` varchar(4096) DEFAULT NULL,\n  `b_transition_point` varchar(8192) DEFAULT NULL,\n  `interval_range` varchar(4096) DEFAULT NULL,\n  `b_interval_range` varchar(8192) DEFAULT NULL,\n  `object_status` bigint(20) NOT NULL DEFAULT '1',\n  `table_flags` bigint(20) NOT NULL DEFAULT '0',\n  `truncate_version` bigint(20) NOT NULL DEFAULT '-1',\n  `external_file_location` varbinary(1048576) DEFAULT NULL,\n  `external_file_location_access_info` varbinary(1048576) DEFAULT NULL,\n  `external_file_format` varbinary(1048576) DEFAULT NULL,\n  `external_file_pattern` varbinary(1048576) DEFAULT NULL,\n  `ttl_definition` varchar(262144) NOT NULL DEFAULT '',\n  `kv_attributes` varchar(262144) NOT NULL DEFAULT '',\n  `name_generated_type` bigint(20) NOT NULL DEFAULT '0',\n  `lob_inrow_threshold` bigint(20) NOT NULL DEFAULT '4096',\n  `max_used_column_group_id` bigint(20) NOT NULL DEFAULT '1000',\n  `column_store` bigint(20) NOT NULL DEFAULT '0',\n  `auto_increment_cache_size` bigint(20) NOT NULL DEFAULT '0',\n  PRIMARY KEY (`tenant_id`, `table_id`),\n  KEY `idx_data_table_id` (`data_table_id`) BLOCK_SIZE 16384 LOCAL,\n  KEY `idx_db_tb_name` (`database_id`, `table_name`) BLOCK_SIZE 16384 LOCAL,\n  KEY `idx_tb_name` (`table_name`) BLOCK_SIZE 16384 LOCAL\n) DEFAULT CHARSET = utf8mb4 ROW_FORMAT = DYNAMIC COMPRESSION = 'none' REPLICA_NUM = 3 BLOCK_SIZE = 16384 USE_BLOOM_FILTER = FALSE TABLET_SIZE = 134217728 PCTFREE = 10 TABLEGROUP = 'oceanbase'
ob1.z2.mysql show parameters like 'zone_merge_concurrency';
ob1.mysql alter system minor freeze tenant = all;
set autocommit=0;
insert into db1.tb_normal(pk,c1) values(601,'601'),(602,'602'),(603,'603'),(604,'604');
update db1.tb_normal set c1=concat(c1,'_x') where pk > 100;
delete from db1.tb_normal where pk=604;
update db1.tb_increment set pk=pk+1 order by pk desc limit 1;
insert into db1.tb_increment(pk,c1) values (601,601),(602,602);
replace into db1.tb_increment(pk,c1) values (601,602);
delete from db1.tb_increment where pk=602;
commit;
set autocommit=1;
use oblog_db;
set ob_org_cluster_id=1234;
replace into oblog_test values (1, 1), (2,2), (3,3);
ob1.oblog.next_dml;
[R0] BEGIN;[R0] org_cluster_id:1234;[R1] record_type:INSERT;[R1] database_name:mysql.test;[R1] table_name:t_part;[R1] log_event:true;[R1] column_count:3;[R1] source_category:SRC_FULL_RECORDED;[R1] source_type:SRC_OCEANBASE_1_0;[R1] has_pk:true;[R1] pk_info:(0,1);[R1] pks:__pk_increment,c1;[R1] has_uk:false;[R1] uk_info:(null);[R1] uks:(null);[R1] [C1] column_name:__pk_increment;[R1] [C1] column_type:MYSQL_TYPE_LONGLONG;[R1] [C1] column_is_rowkey:true;[R1] [C1] column_is_signed:false;[R1] [C1] column_encoding:binary;[R1] [C1] column_is_not_null:true;[R1] [C1] column_value_new:[1](1);[R1] [C2] column_name:c1;[R1] [C2] column_type:MYSQL_TYPE_LONG;[R1] [C2] column_is_rowkey:false;[R1] [C2] column_is_signed:true;[R1] [C2] column_encoding:binary;[R1] [C2] column_is_not_null:false;[R1] [C2] column_value_new:[1](1);[R1] [C3] column_name:c2;[R1] [C3] column_type:MYSQL_TYPE_LONG;[R1] [C3] column_is_rowkey:false;[R1] [C3] column_is_signed:true;[R1] [C3] column_encoding:binary;[R1] [C3] column_is_not_null:false;[R1] [C3] column_value_new:[1](1);$[R2] COMMIT;
ob1.mysql alter system start server '$server1_ip:$server1_port';
ob1.z2.obs0.force_stop;
ob1.check_until_timeout select count(*) from __all_virtual_log_stat where tenant_id=$mysql_tenant_id and degraded_list not like '%$z2_ip0:$z2_port0%', 0, 30;
ob1.check_until_timeout select count(*) from oceanbase.DBA_OB_SERVERS where zone = 'z2' and status='INACTIVE',1,60;
ob1.z2.obs0.nstart;
ob1.check_until_timeout select count(*) from oceanbase.__all_server where zone = 'z2' and (start_service_time <= 0 or status='INACTIVE'),0,120;
ob1.check_until_timeout select count(*) from __all_virtual_log_stat where degraded_list like '%$z2_ip0:$z2_port0%', 0, 120;
ob1.check_until_timeout select count(*) as cnt from oceanbase.__all_virtual_server_schema_info as a join oceanbase.__all_virtual_server_schema_info as b on a.tenant_id = b.tenant_id  where a.refreshed_schema_version != b.refreshed_schema_version, 0, 60;
ob1.mysql alter system set server_permanent_offline_time = '20s';
ob1.z2.obs0.force_stop;
ob1.check_until_timeout select count(*) from __all_server where status = 'INACTIVE' and svr_ip = '$z2_ip0'and svr_port = $z2_port0, 1, 120;
ob1.check_until_timeout select count(*) from oceanbase.__all_virtual_ls_meta_table where role = 1 and member_list like '%$z2_ip0:$z2_port0%', 0, 120;
ob1.mysql alter system set server_permanent_offline_time = '3600s';
ob1.z2.obs0.nstart;
ob1.check_until_timeout select count(*) from oceanbase.__all_server where zone = 'z2' and (start_service_time <= 0 or status='INACTIVE'),0,120;
ob1.check_until_timeout select count(*) > 0 from oceanbase.__all_rootservice_event_history where event like '%finish_add%' and value6 like '%ret:0%',1,120;
ob1.check_until_timeout select count(*) from oceanbase.__all_virtual_ls_replica_task,0,120;
ob1.check_until_timeout select count(*) from oceanbase.__all_virtual_ls_meta_table where role = 1 and member_list not like '%$z2_ip0:$z2_port0%', 0, 120;
ob1.mysql ALTER SYSTEM SWITCHOVER TO STANDBY TENANT mysql;
ob1.mysql ALTER SYSTEM ACTIVATE STANDBY TENANT mysql;
ob1.z2.obs0.mysql ALTER SYSTEM SWITCHOVER TO STANDBY TENANT oracle;
ob1.z2.obs0.mysql ALTER SYSTEM ACTIVATE STANDBY TENANT oracle;
ob1.check_until_timeout  select count(1) as unsync_cnt from GV\$OB_LOG_STAT where in_sync = 'NO',0,600;
set @@session.ob_query_timeout = 60000000;
alter system stop zone 'z1';
ob1.check_until_timeout select status from DBA_OB_ZONES where zone='z1',INACTIVE,20;
ob1.check_until_timeout select count(1) as leader_count  from CDB_OB_LS_LOCATIONS where zone='z1' and role='leader',0,20;
ob1.z1.force_stop;
ob1.check_until_timeout select count(*) from oceanbase.DBA_OB_SERVERS where zone = 'z1' and (start_service_time is null and status='INACTIVE'),1,60;
ob1.z1.upgrade;
ob1.z1.nstart;
ob1.check_until_timeout select count(*) from oceanbase.__all_server where zone = 'z1' and (start_service_time is null or status='INACTIVE'),0,300;
ob1.check_until_timeout  select count(1) as unsync_cnt from GV\$OB_LOG_STAT where in_sync = 'NO',0,600;
ob1.check_until_timeout select count(*) from oceanbase.__all_server a left join oceanbase.__all_virtual_server_schema_info b on a.svr_ip = b.svr_ip and a.svr_port = b.svr_port where b.svr_ip is null, 0, 120;
ob1.check_until_timeout select count(*) as cnt from oceanbase.__all_virtual_server_schema_info as a join oceanbase.__all_virtual_server_schema_info as b on a.tenant_id = b.tenant_id  where a.refreshed_schema_version != b.refreshed_schema_version or a.refreshed_schema_version % 8 != 0, 0, 180;
ob1.mysql alter system start zone 'z1';
ob1.check_until_timeout select count(*) from CDB_OB_LS_LOCATIONS where zone != 'z1' and role='leader' and tenant_id = (select tenant_id from __all_tenant where tenant_name='sys'),0,60;
set autocommit=0;
set @@session.ob_query_timeout = 120000000;
insert into db1.tb_normal(pk,c1) values(401,'401'),(402,'402'),(403,'403'),(404,'404');
update db1.tb_normal set c1=concat(c1,'_x') where pk > 100;
delete from db1.tb_normal where pk=404;
update db1.tb_increment set pk=pk+1 order by pk desc limit 1;
insert into db1.tb_increment(pk,c1) values (401,401),(402,402);
replace into db1.tb_increment(pk,c1) values (401,402);
delete from db1.tb_increment where pk=402;
commit;
set autocommit=1;
select pk,c1 from db1.tb_normal order by pk;
pk	c1
1	0
2	0
3	0
4	0
5	0
6	0
7	0
8	0
9	0
10	0
11	0
12	0
13	0
14	0
15	0
16	0
17	0
18	0
19	0
20	0
21	0
22	0
23	0
24	0
25	0
26	0
27	0
28	0
29	0
30	0
31	0
32	0
33	0
34	0
35	0
36	0
37	0
38	0
39	0
40	0
41	0
42	0
43	0
44	0
45	0
46	0
47	0
48	0
49	0
50	0
51	0
52	0
53	0
54	0
55	0
56	0
57	0
58	0
59	0
60	0
61	0
62	0
63	0
64	0
65	0
66	0
67	0
68	0
69	0
70	0
71	0
72	0
73	0
74	0
75	0
76	0
77	0
78	0
79	0
80	0
81	0
82	0
83	0
84	0
85	0
86	0
87	0
88	0
89	0
90	0
91	0
92	0
93	0
94	0
95	0
96	0
97	0
98	0
99	0
100	0
101	101_x_x_x_x
102	102_x_x_x_x
103	103_x_x_x_x
301	301_x_x_x
302	302_x_x_x
303	303_x_x_x
401	401_x
402	402_x
403	403_x
601	601_x_x
602	602_x_x
603	603_x_x
select pk,c1 from db1.tb_increment order by pk limit 1;
pk	c1
1	1
select a.pk,a.c1,b.c1 from db1.tb_normal a join db1.tb_increment b where a.pk=b.pk order by a.pk limit 2;
pk	c1	c1
1	0	1
2	0	2
show tables like 'tb_normal';
Tables_in_db1 (tb_normal)
tb_normal
show create table db1.tb_increment;
Table	Create Table
tb_increment	CREATE TABLE `tb_increment` (
  `pk` int(11) NOT NULL AUTO_INCREMENT,
  `c1` int(11) DEFAULT NULL,
  `c2` datetime(6) DEFAULT CURRENT_TIMESTAMP(6) ON UPDATE CURRENT_TIMESTAMP(6),
  PRIMARY KEY (`pk`),
  KEY `i1` (`c2`) BLOCK_SIZE 16384 LOCAL
) AUTO_INCREMENT = 1000001 AUTO_INCREMENT_MODE = 'ORDER' DEFAULT CHARSET = utf8mb4 ROW_FORMAT = DYNAMIC COMPRESSION = 'zstd_1.3.8' REPLICA_NUM = 3 BLOCK_SIZE = 16384 USE_BLOOM_FILTER = FALSE TABLET_SIZE = 134217728 PCTFREE = 0 TABLEGROUP = 'tg'
select /*+index(global_t6 primary)*/ * from global_t6;
a	b	c
2	2	2
4	4	4
1	1	1
3	3	3
insert into global_t6 values(11, 100, 10);
update global_t6 set b=7 where a=1;
select /*+index(global_t6 gkey)*/ a, b from global_t6;
a	b
2	2
3	3
4	4
1	7
11	100
update global_t6 set a=100 where b=2;
update global_t6 set b=19 where b=1;
select /*+index(global_t6 gkey)*/ a, b from global_t6;
a	b
100	2
3	3
4	4
1	7
11	100
update global_t6 set c=100 where b>=10;
select /*+index(global_t6 gkey)*/ a, b from global_t6;
a	b
100	2
3	3
4	4
1	7
11	100
delete from global_t6 where a=1;
select /*+index(global_t6 gkey)*/ a, b from global_t6;
a	b
100	2
3	3
4	4
11	100
delete from global_t6 where a=2 or a=3;
select /*+index(global_t6 gkey)*/ a, b from global_t6;
a	b
100	2
4	4
11	100
delete from global_t6 where b>=100;
select /*+index(global_t6 gkey)*/ a, b from global_t6;
a	b
100	2
4	4
delete from global_t6;
select /*+index(global_t6 primary)*/ * from global_t6;
a	b	c
insert into global_t6 values(2, 1, 1), (6, 6, 2), (5, 2, 1);
select /*+index(global_t6 primary)*/ * from global_t6;
a	b	c
2	1	1
6	6	2
5	2	1
delete from global_t6 where b < 7 and b >1;
select /*+index(global_t6 gkey)*/ a, b from global_t6;
a	b
2	1
select /*+index(global_t6 primary)*/ a, b, c from global_t6;
a	b	c
2	1	1
insert into global_t6 values(20, 2, 2), (30, 3, 3), (40, 4, 4) on duplicate key update b=b+1;
select /*+index(global_t6 gkey)*/ a, b from global_t6;
a	b
2	1
20	2
30	3
40	4
select /*+index(global_t6 primary)*/ a, b, c from global_t6;
a	b	c
2	1	1
20	2	2
30	3	3
40	4	4
insert into global_t6 values(20, 2, 2), (30, 3, 3), (40, 4, 4) on duplicate key update b=b+1;
select /*+index(global_t6 gkey)*/ a, b from global_t6;
a	b
2	1
20	3
30	4
40	5
select /*+index(global_t6 primary)*/ a, b, c from global_t6;
a	b	c
2	1	1
20	3	2
30	4	3
40	5	4
replace into global_t6 values(20, 2, 2), (30, 3, 3), (40, 4, 4);
select /*+index(global_t6 gkey)*/ a, b from global_t6;
a	b
2	1
20	2
30	3
40	4
select /*+index(global_t6 primary)*/ a, b, c from global_t6;
a	b	c
2	1	1
20	2	2
30	3	3
40	4	4
commit;
select * from global_t1 for update;
A	B	C
1	1	1
2	2	2
3	3	3
4	4	4
5	5	5
select * from global_t1, global_t2 where global_t1.a = global_t2.a for update;
A	B	C	A	B	C
1	1	1	1	5	1
2	2	2	2	4	2
3	3	3	3	3	3
4	4	4	4	2	4
5	5	5	5	1	5
commit;
set autocommit=0;
insert into db1.tb_normal(pk,c1) values(501,'501'),(502,'502'),(503,'503'),(504,'504');
update db1.tb_normal set c1=concat(c1,'_x') where pk > 100;
delete from db1.tb_normal where pk=504;
update db1.tb_increment set pk=pk+1 order by pk desc limit 1;
insert into db1.tb_increment(pk,c1) values (501,501),(502,502);
replace into db1.tb_increment(pk,c1) values (501,502);
delete from db1.tb_increment where pk=502;
commit;
set autocommit=1;
select pk,c1 from db1.tb_normal order by pk;
pk	c1
1	0
2	0
3	0
4	0
5	0
6	0
7	0
8	0
9	0
10	0
11	0
12	0
13	0
14	0
15	0
16	0
17	0
18	0
19	0
20	0
21	0
22	0
23	0
24	0
25	0
26	0
27	0
28	0
29	0
30	0
31	0
32	0
33	0
34	0
35	0
36	0
37	0
38	0
39	0
40	0
41	0
42	0
43	0
44	0
45	0
46	0
47	0
48	0
49	0
50	0
51	0
52	0
53	0
54	0
55	0
56	0
57	0
58	0
59	0
60	0
61	0
62	0
63	0
64	0
65	0
66	0
67	0
68	0
69	0
70	0
71	0
72	0
73	0
74	0
75	0
76	0
77	0
78	0
79	0
80	0
81	0
82	0
83	0
84	0
85	0
86	0
87	0
88	0
89	0
90	0
91	0
92	0
93	0
94	0
95	0
96	0
97	0
98	0
99	0
100	0
101	101_x_x_x_x_x
102	102_x_x_x_x_x
103	103_x_x_x_x_x
301	301_x_x_x_x
302	302_x_x_x_x
303	303_x_x_x_x
401	401_x_x
402	402_x_x
403	403_x_x
501	501_x
502	502_x
503	503_x
601	601_x_x_x
602	602_x_x_x
603	603_x_x_x
select pk,c1 from db1.tb_increment order by pk limit 1;
pk	c1
1	1
select a.pk,a.c1,b.c1 from db1.tb_normal a join db1.tb_increment b where a.pk=b.pk order by a.pk limit 2;
pk	c1	c1
1	0	1
2	0	2
show tables like 'tb_normal';
Tables_in_db1 (tb_normal)
tb_normal
show create table db1.tb_increment;
Table	Create Table
tb_increment	CREATE TABLE `tb_increment` (
  `pk` int(11) NOT NULL AUTO_INCREMENT,
  `c1` int(11) DEFAULT NULL,
  `c2` datetime(6) DEFAULT CURRENT_TIMESTAMP(6) ON UPDATE CURRENT_TIMESTAMP(6),
  PRIMARY KEY (`pk`),
  KEY `i1` (`c2`) BLOCK_SIZE 16384 LOCAL
) AUTO_INCREMENT = 1000001 AUTO_INCREMENT_MODE = 'ORDER' DEFAULT CHARSET = utf8mb4 ROW_FORMAT = DYNAMIC COMPRESSION = 'zstd_1.3.8' REPLICA_NUM = 3 BLOCK_SIZE = 16384 USE_BLOOM_FILTER = FALSE TABLET_SIZE = 134217728 PCTFREE = 0 TABLEGROUP = 'tg'
ob1.mysql alter system minor freeze tenant = all;
set autocommit=0;
insert into db1.tb_normal(pk,c1) values(701,'701'),(702,'702'),(703,'703'),(704,'704');
update db1.tb_normal set c1=concat(c1,'_x') where pk > 100;
delete from db1.tb_normal where pk=704;
update db1.tb_increment set pk=pk+1 order by pk desc limit 1;
insert into db1.tb_increment(pk,c1) values (701,701),(702,702);
replace into db1.tb_increment(pk,c1) values (701,702);
delete from db1.tb_increment where pk=702;
commit;
set autocommit=1;
ob1.mysql ALTER SYSTEM SWITCHOVER TO STANDBY TENANT mysql;
ob1.mysql ALTER SYSTEM ACTIVATE STANDBY TENANT mysql;
ob1.z2.obs0.mysql ALTER SYSTEM SWITCHOVER TO STANDBY TENANT oracle;
ob1.z2.obs0.mysql ALTER SYSTEM ACTIVATE STANDBY TENANT oracle;
ALTER SYSTEM SET enable_ddl=true;
alter table int2bigint.t_mix change column c c char(40);
insert into int2bigint.t_mix(i_p, i_i, i_g_d, i_f, i_u, i_c, c, c_g_d, d, d_i, i_g_i_d) values (int2bigint.s_mix.nextval, int2bigint.s_mix.nextval, 11, 1, 11, 11, 'feidu', 'feidu', 11.11, 11.11, 1);
online
alter table int2bigint.t_mix change column d d decimal(18,2);
insert into int2bigint.t_mix(i_p, i_i, i_g_d, i_f, i_u, i_c, c, c_g_d, d, d_i, i_g_i_d) values (int2bigint.s_mix.nextval, int2bigint.s_mix.nextval, 11, 1, 11, 11, 'feidu', 'feidu', 11.11, 11.11, 1);
online
alter table int2bigint.t_mix change column d_i d_i decimal(18,2);
insert into int2bigint.t_mix(i_p, i_i, i_g_d, i_f, i_u, i_c, c, c_g_d, d, d_i, i_g_i_d) values (int2bigint.s_mix.nextval, int2bigint.s_mix.nextval, 11, 1, 11, 11, 'feidu', 'feidu', 11.11, 11.11, 1);
online
alter table int2bigint.t_mix change column c_g c_g char(80) GENERATED ALWAYS AS (concat(c_g_d, c_g_d)) virtual;
insert into int2bigint.t_mix(i_p, i_i, i_g_d, i_f, i_u, i_c, c, c_g_d, d, d_i, i_g_i_d) values (int2bigint.s_mix.nextval, int2bigint.s_mix.nextval, 11, 1, 11, 11, 'feidu', 'feidu', 11.11, 11.11, 1);
online
alter table int2bigint.t_mix change column i_g_d i_g_d bigint;
insert into int2bigint.t_mix(i_p, i_i, i_g_d, i_f, i_u, i_c, c, c_g_d, d, d_i, i_g_i_d) values (int2bigint.s_mix.nextval, int2bigint.s_mix.nextval, 11, 1, 11, 11, 'feidu', 'feidu', 11.11, 11.11, 1);
online
alter table int2bigint.t_mix change column i_g i_g bigint GENERATED ALWAYS AS (i_g_d+1) stored;
insert into int2bigint.t_mix(i_p, i_i, i_g_d, i_f, i_u, i_c, c, c_g_d, d, d_i, i_g_i_d) values (int2bigint.s_mix.nextval, int2bigint.s_mix.nextval, 11, 1, 11, 11, 'feidu', 'feidu', 11.11, 11.11, 1);
online
alter table int2bigint.t_mix change column i_u i_u smallint unsigned;
ERROR 0A000: Not supported feature or function
alter table int2bigint.t_mix change column i_i i_i bigint;
alter table int2bigint.t_mix change column c_g_d c_g_d char(40);
ERROR 0A000: Not supported feature or function
alter table int2bigint.t_mix change column i_p i_p bigint;
alter table int2bigint.t_mix change column i_c i_c bigint;
online
alter table int2bigint.t_mix change column i_g_i_d i_g_i_d bigint;
alter table int2bigint.t_mix change column i_f i_f bigint;
ERROR HY000: 'i_f': used in a foreign key constraint
alter table t_oracle_int_float modify a float;
ERROR 0A000: OBE-00600: internal error code, arguments: -4007, Not supported feature or function
ALTER SYSTEM SET enable_ddl=false;
ob1.z1.obs0.force_stop;
ob1.check_until_timeout select count(*) from __all_virtual_log_stat where tenant_id=$mysql_tenant_id and degraded_list not like '%$z1_ip0:$z1_port0%', 0, 30;
ob1.check_until_timeout select count(*) from oceanbase.DBA_OB_SERVERS where zone = 'z1' and status='INACTIVE',1,60;
ob1.z1.obs0.nstart;
ob1.check_until_timeout select count(*) from oceanbase.__all_server where zone = 'z1' and (start_service_time <= 0 or status='INACTIVE'),0,120;
ob1.check_until_timeout select count(*) from __all_virtual_log_stat where degraded_list like '%$z1_ip0:$z1_port0%', 0, 120;
ob1.check_until_timeout select count(*) as cnt from oceanbase.__all_virtual_server_schema_info as a join oceanbase.__all_virtual_server_schema_info as b on a.tenant_id = b.tenant_id  where a.refreshed_schema_version != b.refreshed_schema_version, 0, 60;
ob1.check_until_timeout  select count(1) as unsync_cnt from GV\$OB_LOG_STAT where in_sync = 'NO',0,600;
set @@session.ob_query_timeout = 60000000;
alter system stop zone 'z3';
ob1.check_until_timeout select status from DBA_OB_ZONES where zone='z3',INACTIVE,20;
ob1.check_until_timeout select count(1) as leader_count  from CDB_OB_LS_LOCATIONS where zone='z3' and role='leader',0,20;
ob1.z3.force_stop;
ob1.check_until_timeout select count(*) from oceanbase.DBA_OB_SERVERS where zone = 'z3' and (start_service_time is null and status='INACTIVE'),1,60;
ob1.z3.upgrade;
ob1.z3.nstart;
ob1.check_until_timeout select count(*) from oceanbase.__all_server where zone = 'z3' and (start_service_time <= 0 or status='INACTIVE'),0,120;
ob1.check_until_timeout  select count(1) as unsync_cnt from GV\$OB_LOG_STAT where in_sync = 'NO',0,600;
ob1.check_until_timeout select count(*) from oceanbase.__all_server a left join oceanbase.__all_virtual_server_schema_info b on a.svr_ip = b.svr_ip and a.svr_port = b.svr_port where b.svr_ip is null, 0, 120;
ob1.check_until_timeout select count(*) as cnt from oceanbase.__all_virtual_server_schema_info as a join oceanbase.__all_virtual_server_schema_info as b on a.tenant_id = b.tenant_id  where a.refreshed_schema_version != b.refreshed_schema_version or a.refreshed_schema_version % 8 != 0, 0, 180;
ob1.mysql alter system start zone 'z3';
ob1.mysql alter system minor freeze tenant = all;
set autocommit=0;
insert into db1.tb_normal(pk,c1) values(801,'801'),(802,'802'),(803,'803'),(804,'804');
update db1.tb_normal set c1=concat(c1,'_x') where pk > 100;
delete from db1.tb_normal where pk=804;
update db1.tb_increment set pk=pk+1 order by pk desc limit 1;
insert into db1.tb_increment(pk,c1) values (801,801),(802,802);
replace into db1.tb_increment(pk,c1) values (801,802);
delete from db1.tb_increment where pk=802;
commit;
set autocommit=1;
ALTER SYSTEM SET enable_ddl=true;
show create table test.t_begin_micro_index_clustered;
Table	Create Table
t_begin_micro_index_clustered	CREATE TABLE `t_begin_micro_index_clustered` (
  `a` int(11) DEFAULT NULL,
  `b` text DEFAULT NULL,
  KEY `a` (`a`) BLOCK_SIZE 16384 LOCAL,
  KEY `idx_a_twice` (`a`) BLOCK_SIZE 16384 LOCAL
) DEFAULT CHARSET = utf8mb4 ROW_FORMAT = DYNAMIC COMPRESSION = 'zstd_1.3.8' REPLICA_NUM = 3 BLOCK_SIZE = 16384 USE_BLOOM_FILTER = FALSE TABLET_SIZE = 134217728 PCTFREE = 0
create table test.t_mix_micro_index_clustered (a int, b text, index(a)) MICRO_INDEX_CLUSTERED = TRUE;
ERROR 0A000: tenant data version is less than 4.3.3, micro_index_clustered is not supported
create table test.t_mix_micro_index_clustered (a int, b text, index(a));
show create table test.t_mix_micro_index_clustered;
Table	Create Table
t_mix_micro_index_clustered	CREATE TABLE `t_mix_micro_index_clustered` (
  `a` int(11) DEFAULT NULL,
  `b` text DEFAULT NULL,
  KEY `a` (`a`) BLOCK_SIZE 16384 LOCAL
) DEFAULT CHARSET = utf8mb4 ROW_FORMAT = DYNAMIC COMPRESSION = 'zstd_1.3.8' REPLICA_NUM = 3 BLOCK_SIZE = 16384 USE_BLOOM_FILTER = FALSE TABLET_SIZE = 134217728 PCTFREE = 0
ALTER SYSTEM SET enable_ddl=false;
use oblog_db;
set ob_org_cluster_id=1234;
replace into oblog_test values (1, 1), (2,2), (3,3);
ob1.oblog.next_dml;
[R0] BEGIN;[R0] org_cluster_id:1234;[R1] record_type:INSERT;[R1] database_name:mysql.test;[R1] table_name:t_part;[R1] log_event:true;[R1] column_count:3;[R1] source_category:SRC_FULL_RECORDED;[R1] source_type:SRC_OCEANBASE_1_0;[R1] has_pk:true;[R1] pk_info:(0,1);[R1] pks:__pk_increment,c1;[R1] has_uk:false;[R1] uk_info:(null);[R1] uks:(null);[R1] [C1] column_name:__pk_increment;[R1] [C1] column_type:MYSQL_TYPE_LONGLONG;[R1] [C1] column_is_rowkey:true;[R1] [C1] column_is_signed:false;[R1] [C1] column_encoding:binary;[R1] [C1] column_is_not_null:true;[R1] [C1] column_value_new:[1](1);[R1] [C2] column_name:c1;[R1] [C2] column_type:MYSQL_TYPE_LONG;[R1] [C2] column_is_rowkey:false;[R1] [C2] column_is_signed:true;[R1] [C2] column_encoding:binary;[R1] [C2] column_is_not_null:false;[R1] [C2] column_value_new:[2](1);[R1] [C3] column_name:c2;[R1] [C3] column_type:MYSQL_TYPE_LONG;[R1] [C3] column_is_rowkey:false;[R1] [C3] column_is_signed:true;[R1] [C3] column_encoding:binary;[R1] [C3] column_is_not_null:false;[R1] [C3] column_value_new:[2](1);$[R2] COMMIT;
ob1.mysql ALTER SYSTEM SWITCHOVER TO STANDBY TENANT mysql;
ob1.mysql ALTER SYSTEM ACTIVATE STANDBY TENANT mysql;
ob1.z2.obs0.mysql ALTER SYSTEM SWITCHOVER TO STANDBY TENANT oracle;
ob1.z2.obs0.mysql ALTER SYSTEM ACTIVATE STANDBY TENANT oracle;
ob1.z1.obs0.mysql select * from mysql.proc;
ob1.z1.obs0.mysql select * from mysql.db;
ob1.z1.obs0.mysql select * from mysql.user;
ob1.z2.obs0.mysql select * from mysql.proc;
ob1.z2.obs0.mysql select * from mysql.db;
ob1.z2.obs0.mysql select * from mysql.user;
ob1.z3.obs0.mysql select * from mysql.proc;
ob1.z3.obs0.mysql select * from mysql.db;
ob1.z3.obs0.mysql select * from mysql.user;
ob1.upgrade_commond_for_server post;
set @@session.ob_query_timeout = 600000000;
alter system run job 'root_inspection';
set @@session.ob_query_timeout = 10000000;
ob1.check_until_timeout select count(*) from oceanbase.__all_virtual_upgrade_inspection where info != 'succeed',0,180;
ob1.mysql ALTER SYSTEM SWITCHOVER TO STANDBY TENANT mysql;
ob1.mysql ALTER SYSTEM ACTIVATE STANDBY TENANT mysql;
ob1.mysql ALTER SYSTEM SWITCHOVER TO STANDBY TENANT oracle;
ob1.mysql ALTER SYSTEM ACTIVATE STANDBY TENANT oracle;
ob1.mysql_p select tenant_id, max_ls_id from oceanbase.__all_virtual_tenant_info order by tenant_id;
tenant_id	max_ls_id
1002	1003
1004	1002
insert into db1.tb_normal (pk) values(200);
insert into db1.tb_increment (c1) values(200);
insert into db1.tb_bigtable (c1,c2,c3,c4) values(repeat('A',65536),repeat('B',65536),repeat('C',65536),repeat('D',65536));
insert into test.tb_table_gencol(pk1,pk2,c1,c2) values(200,'200',repeat('A',65536),repeat('B',65536));
insert into test.tablegencol(c1,USER_ID,ADDRESS) values(200, repeat('A',32),repeat('B',256));
insert into test.table_hash(c1, c2) values(200, 200);
insert into test.table_range(c1, c2) values(200, 200);
insert into test.table_hash_range(c1, c2) values(200, 200);
insert into test.table_range_hash(c1, c2) values(200, 200);
insert into db1.tb_normal (pk) values(201);
insert into db1.tb_increment (c1) values(201);
insert into db1.tb_bigtable (c1,c2,c3,c4) values(repeat('A',65536),repeat('B',65536),repeat('C',65536),repeat('D',65536));
insert into test.tb_table_gencol(pk1,pk2,c1,c2) values(201,'201',repeat('A',65536),repeat('B',65536));
insert into test.tablegencol(c1,USER_ID,ADDRESS) values(201, repeat('A',32),repeat('B',256));
insert into test.table_hash(c1, c2) values(201, 201);
insert into test.table_range(c1, c2) values(201, 201);
insert into test.table_hash_range(c1, c2) values(201, 201);
insert into test.table_range_hash(c1, c2) values(201, 201);
insert into db1.tb_normal (pk) values(202);
insert into db1.tb_increment (c1) values(202);
insert into db1.tb_bigtable (c1,c2,c3,c4) values(repeat('A',65536),repeat('B',65536),repeat('C',65536),repeat('D',65536));
insert into test.tb_table_gencol(pk1,pk2,c1,c2) values(202,'202',repeat('A',65536),repeat('B',65536));
insert into test.tablegencol(c1,USER_ID,ADDRESS) values(202, repeat('A',32),repeat('B',256));
insert into test.table_hash(c1, c2) values(202, 202);
insert into test.table_range(c1, c2) values(202, 202);
insert into test.table_hash_range(c1, c2) values(202, 202);
insert into test.table_range_hash(c1, c2) values(202, 202);
insert into db1.tb_normal (pk) values(203);
insert into db1.tb_increment (c1) values(203);
insert into db1.tb_bigtable (c1,c2,c3,c4) values(repeat('A',65536),repeat('B',65536),repeat('C',65536),repeat('D',65536));
insert into test.tb_table_gencol(pk1,pk2,c1,c2) values(203,'203',repeat('A',65536),repeat('B',65536));
insert into test.tablegencol(c1,USER_ID,ADDRESS) values(203, repeat('A',32),repeat('B',256));
insert into test.table_hash(c1, c2) values(203, 203);
insert into test.table_range(c1, c2) values(203, 203);
insert into test.table_hash_range(c1, c2) values(203, 203);
insert into test.table_range_hash(c1, c2) values(203, 203);
insert into db1.tb_normal (pk) values(204);
insert into db1.tb_increment (c1) values(204);
insert into db1.tb_bigtable (c1,c2,c3,c4) values(repeat('A',65536),repeat('B',65536),repeat('C',65536),repeat('D',65536));
insert into test.tb_table_gencol(pk1,pk2,c1,c2) values(204,'204',repeat('A',65536),repeat('B',65536));
insert into test.tablegencol(c1,USER_ID,ADDRESS) values(204, repeat('A',32),repeat('B',256));
insert into test.table_hash(c1, c2) values(204, 204);
insert into test.table_range(c1, c2) values(204, 204);
insert into test.table_hash_range(c1, c2) values(204, 204);
insert into test.table_range_hash(c1, c2) values(204, 204);
insert into db1.tb_normal (pk) values(205);
insert into db1.tb_increment (c1) values(205);
insert into db1.tb_bigtable (c1,c2,c3,c4) values(repeat('A',65536),repeat('B',65536),repeat('C',65536),repeat('D',65536));
insert into test.tb_table_gencol(pk1,pk2,c1,c2) values(205,'205',repeat('A',65536),repeat('B',65536));
insert into test.tablegencol(c1,USER_ID,ADDRESS) values(205, repeat('A',32),repeat('B',256));
insert into test.table_hash(c1, c2) values(205, 205);
insert into test.table_range(c1, c2) values(205, 205);
insert into test.table_hash_range(c1, c2) values(205, 205);
insert into test.table_range_hash(c1, c2) values(205, 205);
insert into db1.tb_normal (pk) values(206);
insert into db1.tb_increment (c1) values(206);
insert into db1.tb_bigtable (c1,c2,c3,c4) values(repeat('A',65536),repeat('B',65536),repeat('C',65536),repeat('D',65536));
insert into test.tb_table_gencol(pk1,pk2,c1,c2) values(206,'206',repeat('A',65536),repeat('B',65536));
insert into test.tablegencol(c1,USER_ID,ADDRESS) values(206, repeat('A',32),repeat('B',256));
insert into test.table_hash(c1, c2) values(206, 206);
insert into test.table_range(c1, c2) values(206, 206);
insert into test.table_hash_range(c1, c2) values(206, 206);
insert into test.table_range_hash(c1, c2) values(206, 206);
insert into db1.tb_normal (pk) values(207);
insert into db1.tb_increment (c1) values(207);
insert into db1.tb_bigtable (c1,c2,c3,c4) values(repeat('A',65536),repeat('B',65536),repeat('C',65536),repeat('D',65536));
insert into test.tb_table_gencol(pk1,pk2,c1,c2) values(207,'207',repeat('A',65536),repeat('B',65536));
insert into test.tablegencol(c1,USER_ID,ADDRESS) values(207, repeat('A',32),repeat('B',256));
insert into test.table_hash(c1, c2) values(207, 207);
insert into test.table_range(c1, c2) values(207, 207);
insert into test.table_hash_range(c1, c2) values(207, 207);
insert into test.table_range_hash(c1, c2) values(207, 207);
insert into db1.tb_normal (pk) values(208);
insert into db1.tb_increment (c1) values(208);
insert into db1.tb_bigtable (c1,c2,c3,c4) values(repeat('A',65536),repeat('B',65536),repeat('C',65536),repeat('D',65536));
insert into test.tb_table_gencol(pk1,pk2,c1,c2) values(208,'208',repeat('A',65536),repeat('B',65536));
insert into test.tablegencol(c1,USER_ID,ADDRESS) values(208, repeat('A',32),repeat('B',256));
insert into test.table_hash(c1, c2) values(208, 208);
insert into test.table_range(c1, c2) values(208, 208);
insert into test.table_hash_range(c1, c2) values(208, 208);
insert into test.table_range_hash(c1, c2) values(208, 208);
insert into db1.tb_normal (pk) values(209);
insert into db1.tb_increment (c1) values(209);
insert into db1.tb_bigtable (c1,c2,c3,c4) values(repeat('A',65536),repeat('B',65536),repeat('C',65536),repeat('D',65536));
insert into test.tb_table_gencol(pk1,pk2,c1,c2) values(209,'209',repeat('A',65536),repeat('B',65536));
insert into test.tablegencol(c1,USER_ID,ADDRESS) values(209, repeat('A',32),repeat('B',256));
insert into test.table_hash(c1, c2) values(209, 209);
insert into test.table_range(c1, c2) values(209, 209);
insert into test.table_hash_range(c1, c2) values(209, 209);
insert into test.table_range_hash(c1, c2) values(209, 209);
insert into db1.tb_normal (pk) values(210);
insert into db1.tb_increment (c1) values(210);
insert into db1.tb_bigtable (c1,c2,c3,c4) values(repeat('A',65536),repeat('B',65536),repeat('C',65536),repeat('D',65536));
insert into test.tb_table_gencol(pk1,pk2,c1,c2) values(210,'210',repeat('A',65536),repeat('B',65536));
insert into test.tablegencol(c1,USER_ID,ADDRESS) values(210, repeat('A',32),repeat('B',256));
insert into test.table_hash(c1, c2) values(210, 210);
insert into test.table_range(c1, c2) values(210, 210);
insert into test.table_hash_range(c1, c2) values(210, 210);
insert into test.table_range_hash(c1, c2) values(210, 210);
insert into db1.tb_normal (pk) values(211);
insert into db1.tb_increment (c1) values(211);
insert into db1.tb_bigtable (c1,c2,c3,c4) values(repeat('A',65536),repeat('B',65536),repeat('C',65536),repeat('D',65536));
insert into test.tb_table_gencol(pk1,pk2,c1,c2) values(211,'211',repeat('A',65536),repeat('B',65536));
insert into test.tablegencol(c1,USER_ID,ADDRESS) values(211, repeat('A',32),repeat('B',256));
insert into test.table_hash(c1, c2) values(211, 211);
insert into test.table_range(c1, c2) values(211, 211);
insert into test.table_hash_range(c1, c2) values(211, 211);
insert into test.table_range_hash(c1, c2) values(211, 211);
insert into db1.tb_normal (pk) values(212);
insert into db1.tb_increment (c1) values(212);
insert into db1.tb_bigtable (c1,c2,c3,c4) values(repeat('A',65536),repeat('B',65536),repeat('C',65536),repeat('D',65536));
insert into test.tb_table_gencol(pk1,pk2,c1,c2) values(212,'212',repeat('A',65536),repeat('B',65536));
insert into test.tablegencol(c1,USER_ID,ADDRESS) values(212, repeat('A',32),repeat('B',256));
insert into test.table_hash(c1, c2) values(212, 212);
insert into test.table_range(c1, c2) values(212, 212);
insert into test.table_hash_range(c1, c2) values(212, 212);
insert into test.table_range_hash(c1, c2) values(212, 212);
insert into db1.tb_normal (pk) values(213);
insert into db1.tb_increment (c1) values(213);
insert into db1.tb_bigtable (c1,c2,c3,c4) values(repeat('A',65536),repeat('B',65536),repeat('C',65536),repeat('D',65536));
insert into test.tb_table_gencol(pk1,pk2,c1,c2) values(213,'213',repeat('A',65536),repeat('B',65536));
insert into test.tablegencol(c1,USER_ID,ADDRESS) values(213, repeat('A',32),repeat('B',256));
insert into test.table_hash(c1, c2) values(213, 213);
insert into test.table_range(c1, c2) values(213, 213);
insert into test.table_hash_range(c1, c2) values(213, 213);
insert into test.table_range_hash(c1, c2) values(213, 213);
insert into db1.tb_normal (pk) values(214);
insert into db1.tb_increment (c1) values(214);
insert into db1.tb_bigtable (c1,c2,c3,c4) values(repeat('A',65536),repeat('B',65536),repeat('C',65536),repeat('D',65536));
insert into test.tb_table_gencol(pk1,pk2,c1,c2) values(214,'214',repeat('A',65536),repeat('B',65536));
insert into test.tablegencol(c1,USER_ID,ADDRESS) values(214, repeat('A',32),repeat('B',256));
insert into test.table_hash(c1, c2) values(214, 214);
insert into test.table_range(c1, c2) values(214, 214);
insert into test.table_hash_range(c1, c2) values(214, 214);
insert into test.table_range_hash(c1, c2) values(214, 214);
insert into db1.tb_normal (pk) values(215);
insert into db1.tb_increment (c1) values(215);
insert into db1.tb_bigtable (c1,c2,c3,c4) values(repeat('A',65536),repeat('B',65536),repeat('C',65536),repeat('D',65536));
insert into test.tb_table_gencol(pk1,pk2,c1,c2) values(215,'215',repeat('A',65536),repeat('B',65536));
insert into test.tablegencol(c1,USER_ID,ADDRESS) values(215, repeat('A',32),repeat('B',256));
insert into test.table_hash(c1, c2) values(215, 215);
insert into test.table_range(c1, c2) values(215, 215);
insert into test.table_hash_range(c1, c2) values(215, 215);
insert into test.table_range_hash(c1, c2) values(215, 215);
insert into db1.tb_normal (pk) values(216);
insert into db1.tb_increment (c1) values(216);
insert into db1.tb_bigtable (c1,c2,c3,c4) values(repeat('A',65536),repeat('B',65536),repeat('C',65536),repeat('D',65536));
insert into test.tb_table_gencol(pk1,pk2,c1,c2) values(216,'216',repeat('A',65536),repeat('B',65536));
insert into test.tablegencol(c1,USER_ID,ADDRESS) values(216, repeat('A',32),repeat('B',256));
insert into test.table_hash(c1, c2) values(216, 216);
insert into test.table_range(c1, c2) values(216, 216);
insert into test.table_hash_range(c1, c2) values(216, 216);
insert into test.table_range_hash(c1, c2) values(216, 216);
insert into db1.tb_normal (pk) values(217);
insert into db1.tb_increment (c1) values(217);
insert into db1.tb_bigtable (c1,c2,c3,c4) values(repeat('A',65536),repeat('B',65536),repeat('C',65536),repeat('D',65536));
insert into test.tb_table_gencol(pk1,pk2,c1,c2) values(217,'217',repeat('A',65536),repeat('B',65536));
insert into test.tablegencol(c1,USER_ID,ADDRESS) values(217, repeat('A',32),repeat('B',256));
insert into test.table_hash(c1, c2) values(217, 217);
insert into test.table_range(c1, c2) values(217, 217);
insert into test.table_hash_range(c1, c2) values(217, 217);
insert into test.table_range_hash(c1, c2) values(217, 217);
insert into db1.tb_normal (pk) values(218);
insert into db1.tb_increment (c1) values(218);
insert into db1.tb_bigtable (c1,c2,c3,c4) values(repeat('A',65536),repeat('B',65536),repeat('C',65536),repeat('D',65536));
insert into test.tb_table_gencol(pk1,pk2,c1,c2) values(218,'218',repeat('A',65536),repeat('B',65536));
insert into test.tablegencol(c1,USER_ID,ADDRESS) values(218, repeat('A',32),repeat('B',256));
insert into test.table_hash(c1, c2) values(218, 218);
insert into test.table_range(c1, c2) values(218, 218);
insert into test.table_hash_range(c1, c2) values(218, 218);
insert into test.table_range_hash(c1, c2) values(218, 218);
insert into db1.tb_normal (pk) values(219);
insert into db1.tb_increment (c1) values(219);
insert into db1.tb_bigtable (c1,c2,c3,c4) values(repeat('A',65536),repeat('B',65536),repeat('C',65536),repeat('D',65536));
insert into test.tb_table_gencol(pk1,pk2,c1,c2) values(219,'219',repeat('A',65536),repeat('B',65536));
insert into test.tablegencol(c1,USER_ID,ADDRESS) values(219, repeat('A',32),repeat('B',256));
insert into test.table_hash(c1, c2) values(219, 219);
insert into test.table_range(c1, c2) values(219, 219);
insert into test.table_hash_range(c1, c2) values(219, 219);
insert into test.table_range_hash(c1, c2) values(219, 219);
insert into db1.tb_normal (pk) values(220);
insert into db1.tb_increment (c1) values(220);
insert into db1.tb_bigtable (c1,c2,c3,c4) values(repeat('A',65536),repeat('B',65536),repeat('C',65536),repeat('D',65536));
insert into test.tb_table_gencol(pk1,pk2,c1,c2) values(220,'220',repeat('A',65536),repeat('B',65536));
insert into test.tablegencol(c1,USER_ID,ADDRESS) values(220, repeat('A',32),repeat('B',256));
insert into test.table_hash(c1, c2) values(220, 220);
insert into test.table_range(c1, c2) values(220, 220);
insert into test.table_hash_range(c1, c2) values(220, 220);
insert into test.table_range_hash(c1, c2) values(220, 220);
insert into db1.tb_normal (pk) values(221);
insert into db1.tb_increment (c1) values(221);
insert into db1.tb_bigtable (c1,c2,c3,c4) values(repeat('A',65536),repeat('B',65536),repeat('C',65536),repeat('D',65536));
insert into test.tb_table_gencol(pk1,pk2,c1,c2) values(221,'221',repeat('A',65536),repeat('B',65536));
insert into test.tablegencol(c1,USER_ID,ADDRESS) values(221, repeat('A',32),repeat('B',256));
insert into test.table_hash(c1, c2) values(221, 221);
insert into test.table_range(c1, c2) values(221, 221);
insert into test.table_hash_range(c1, c2) values(221, 221);
insert into test.table_range_hash(c1, c2) values(221, 221);
insert into db1.tb_normal (pk) values(222);
insert into db1.tb_increment (c1) values(222);
insert into db1.tb_bigtable (c1,c2,c3,c4) values(repeat('A',65536),repeat('B',65536),repeat('C',65536),repeat('D',65536));
insert into test.tb_table_gencol(pk1,pk2,c1,c2) values(222,'222',repeat('A',65536),repeat('B',65536));
insert into test.tablegencol(c1,USER_ID,ADDRESS) values(222, repeat('A',32),repeat('B',256));
insert into test.table_hash(c1, c2) values(222, 222);
insert into test.table_range(c1, c2) values(222, 222);
insert into test.table_hash_range(c1, c2) values(222, 222);
insert into test.table_range_hash(c1, c2) values(222, 222);
insert into db1.tb_normal (pk) values(223);
insert into db1.tb_increment (c1) values(223);
insert into db1.tb_bigtable (c1,c2,c3,c4) values(repeat('A',65536),repeat('B',65536),repeat('C',65536),repeat('D',65536));
insert into test.tb_table_gencol(pk1,pk2,c1,c2) values(223,'223',repeat('A',65536),repeat('B',65536));
insert into test.tablegencol(c1,USER_ID,ADDRESS) values(223, repeat('A',32),repeat('B',256));
insert into test.table_hash(c1, c2) values(223, 223);
insert into test.table_range(c1, c2) values(223, 223);
insert into test.table_hash_range(c1, c2) values(223, 223);
insert into test.table_range_hash(c1, c2) values(223, 223);
insert into db1.tb_normal (pk) values(224);
insert into db1.tb_increment (c1) values(224);
insert into db1.tb_bigtable (c1,c2,c3,c4) values(repeat('A',65536),repeat('B',65536),repeat('C',65536),repeat('D',65536));
insert into test.tb_table_gencol(pk1,pk2,c1,c2) values(224,'224',repeat('A',65536),repeat('B',65536));
insert into test.tablegencol(c1,USER_ID,ADDRESS) values(224, repeat('A',32),repeat('B',256));
insert into test.table_hash(c1, c2) values(224, 224);
insert into test.table_range(c1, c2) values(224, 224);
insert into test.table_hash_range(c1, c2) values(224, 224);
insert into test.table_range_hash(c1, c2) values(224, 224);
insert into db1.tb_normal (pk) values(225);
insert into db1.tb_increment (c1) values(225);
insert into db1.tb_bigtable (c1,c2,c3,c4) values(repeat('A',65536),repeat('B',65536),repeat('C',65536),repeat('D',65536));
insert into test.tb_table_gencol(pk1,pk2,c1,c2) values(225,'225',repeat('A',65536),repeat('B',65536));
insert into test.tablegencol(c1,USER_ID,ADDRESS) values(225, repeat('A',32),repeat('B',256));
insert into test.table_hash(c1, c2) values(225, 225);
insert into test.table_range(c1, c2) values(225, 225);
insert into test.table_hash_range(c1, c2) values(225, 225);
insert into test.table_range_hash(c1, c2) values(225, 225);
insert into db1.tb_normal (pk) values(226);
insert into db1.tb_increment (c1) values(226);
insert into db1.tb_bigtable (c1,c2,c3,c4) values(repeat('A',65536),repeat('B',65536),repeat('C',65536),repeat('D',65536));
insert into test.tb_table_gencol(pk1,pk2,c1,c2) values(226,'226',repeat('A',65536),repeat('B',65536));
insert into test.tablegencol(c1,USER_ID,ADDRESS) values(226, repeat('A',32),repeat('B',256));
insert into test.table_hash(c1, c2) values(226, 226);
insert into test.table_range(c1, c2) values(226, 226);
insert into test.table_hash_range(c1, c2) values(226, 226);
insert into test.table_range_hash(c1, c2) values(226, 226);
insert into db1.tb_normal (pk) values(227);
insert into db1.tb_increment (c1) values(227);
insert into db1.tb_bigtable (c1,c2,c3,c4) values(repeat('A',65536),repeat('B',65536),repeat('C',65536),repeat('D',65536));
insert into test.tb_table_gencol(pk1,pk2,c1,c2) values(227,'227',repeat('A',65536),repeat('B',65536));
insert into test.tablegencol(c1,USER_ID,ADDRESS) values(227, repeat('A',32),repeat('B',256));
insert into test.table_hash(c1, c2) values(227, 227);
insert into test.table_range(c1, c2) values(227, 227);
insert into test.table_hash_range(c1, c2) values(227, 227);
insert into test.table_range_hash(c1, c2) values(227, 227);
insert into db1.tb_normal (pk) values(228);
insert into db1.tb_increment (c1) values(228);
insert into db1.tb_bigtable (c1,c2,c3,c4) values(repeat('A',65536),repeat('B',65536),repeat('C',65536),repeat('D',65536));
insert into test.tb_table_gencol(pk1,pk2,c1,c2) values(228,'228',repeat('A',65536),repeat('B',65536));
insert into test.tablegencol(c1,USER_ID,ADDRESS) values(228, repeat('A',32),repeat('B',256));
insert into test.table_hash(c1, c2) values(228, 228);
insert into test.table_range(c1, c2) values(228, 228);
insert into test.table_hash_range(c1, c2) values(228, 228);
insert into test.table_range_hash(c1, c2) values(228, 228);
insert into db1.tb_normal (pk) values(229);
insert into db1.tb_increment (c1) values(229);
insert into db1.tb_bigtable (c1,c2,c3,c4) values(repeat('A',65536),repeat('B',65536),repeat('C',65536),repeat('D',65536));
insert into test.tb_table_gencol(pk1,pk2,c1,c2) values(229,'229',repeat('A',65536),repeat('B',65536));
insert into test.tablegencol(c1,USER_ID,ADDRESS) values(229, repeat('A',32),repeat('B',256));
insert into test.table_hash(c1, c2) values(229, 229);
insert into test.table_range(c1, c2) values(229, 229);
insert into test.table_hash_range(c1, c2) values(229, 229);
insert into test.table_range_hash(c1, c2) values(229, 229);
insert into db1.tb_normal (pk) values(230);
insert into db1.tb_increment (c1) values(230);
insert into db1.tb_bigtable (c1,c2,c3,c4) values(repeat('A',65536),repeat('B',65536),repeat('C',65536),repeat('D',65536));
insert into test.tb_table_gencol(pk1,pk2,c1,c2) values(230,'230',repeat('A',65536),repeat('B',65536));
insert into test.tablegencol(c1,USER_ID,ADDRESS) values(230, repeat('A',32),repeat('B',256));
insert into test.table_hash(c1, c2) values(230, 230);
insert into test.table_range(c1, c2) values(230, 230);
insert into test.table_hash_range(c1, c2) values(230, 230);
insert into test.table_range_hash(c1, c2) values(230, 230);
insert into db1.tb_normal (pk) values(231);
insert into db1.tb_increment (c1) values(231);
insert into db1.tb_bigtable (c1,c2,c3,c4) values(repeat('A',65536),repeat('B',65536),repeat('C',65536),repeat('D',65536));
insert into test.tb_table_gencol(pk1,pk2,c1,c2) values(231,'231',repeat('A',65536),repeat('B',65536));
insert into test.tablegencol(c1,USER_ID,ADDRESS) values(231, repeat('A',32),repeat('B',256));
insert into test.table_hash(c1, c2) values(231, 231);
insert into test.table_range(c1, c2) values(231, 231);
insert into test.table_hash_range(c1, c2) values(231, 231);
insert into test.table_range_hash(c1, c2) values(231, 231);
insert into db1.tb_normal (pk) values(232);
insert into db1.tb_increment (c1) values(232);
insert into db1.tb_bigtable (c1,c2,c3,c4) values(repeat('A',65536),repeat('B',65536),repeat('C',65536),repeat('D',65536));
insert into test.tb_table_gencol(pk1,pk2,c1,c2) values(232,'232',repeat('A',65536),repeat('B',65536));
insert into test.tablegencol(c1,USER_ID,ADDRESS) values(232, repeat('A',32),repeat('B',256));
insert into test.table_hash(c1, c2) values(232, 232);
insert into test.table_range(c1, c2) values(232, 232);
insert into test.table_hash_range(c1, c2) values(232, 232);
insert into test.table_range_hash(c1, c2) values(232, 232);
insert into db1.tb_normal (pk) values(233);
insert into db1.tb_increment (c1) values(233);
insert into db1.tb_bigtable (c1,c2,c3,c4) values(repeat('A',65536),repeat('B',65536),repeat('C',65536),repeat('D',65536));
insert into test.tb_table_gencol(pk1,pk2,c1,c2) values(233,'233',repeat('A',65536),repeat('B',65536));
insert into test.tablegencol(c1,USER_ID,ADDRESS) values(233, repeat('A',32),repeat('B',256));
insert into test.table_hash(c1, c2) values(233, 233);
insert into test.table_range(c1, c2) values(233, 233);
insert into test.table_hash_range(c1, c2) values(233, 233);
insert into test.table_range_hash(c1, c2) values(233, 233);
insert into db1.tb_normal (pk) values(234);
insert into db1.tb_increment (c1) values(234);
insert into db1.tb_bigtable (c1,c2,c3,c4) values(repeat('A',65536),repeat('B',65536),repeat('C',65536),repeat('D',65536));
insert into test.tb_table_gencol(pk1,pk2,c1,c2) values(234,'234',repeat('A',65536),repeat('B',65536));
insert into test.tablegencol(c1,USER_ID,ADDRESS) values(234, repeat('A',32),repeat('B',256));
insert into test.table_hash(c1, c2) values(234, 234);
insert into test.table_range(c1, c2) values(234, 234);
insert into test.table_hash_range(c1, c2) values(234, 234);
insert into test.table_range_hash(c1, c2) values(234, 234);
insert into db1.tb_normal (pk) values(235);
insert into db1.tb_increment (c1) values(235);
insert into db1.tb_bigtable (c1,c2,c3,c4) values(repeat('A',65536),repeat('B',65536),repeat('C',65536),repeat('D',65536));
insert into test.tb_table_gencol(pk1,pk2,c1,c2) values(235,'235',repeat('A',65536),repeat('B',65536));
insert into test.tablegencol(c1,USER_ID,ADDRESS) values(235, repeat('A',32),repeat('B',256));
insert into test.table_hash(c1, c2) values(235, 235);
insert into test.table_range(c1, c2) values(235, 235);
insert into test.table_hash_range(c1, c2) values(235, 235);
insert into test.table_range_hash(c1, c2) values(235, 235);
insert into db1.tb_normal (pk) values(236);
insert into db1.tb_increment (c1) values(236);
insert into db1.tb_bigtable (c1,c2,c3,c4) values(repeat('A',65536),repeat('B',65536),repeat('C',65536),repeat('D',65536));
insert into test.tb_table_gencol(pk1,pk2,c1,c2) values(236,'236',repeat('A',65536),repeat('B',65536));
insert into test.tablegencol(c1,USER_ID,ADDRESS) values(236, repeat('A',32),repeat('B',256));
insert into test.table_hash(c1, c2) values(236, 236);
insert into test.table_range(c1, c2) values(236, 236);
insert into test.table_hash_range(c1, c2) values(236, 236);
insert into test.table_range_hash(c1, c2) values(236, 236);
insert into db1.tb_normal (pk) values(237);
insert into db1.tb_increment (c1) values(237);
insert into db1.tb_bigtable (c1,c2,c3,c4) values(repeat('A',65536),repeat('B',65536),repeat('C',65536),repeat('D',65536));
insert into test.tb_table_gencol(pk1,pk2,c1,c2) values(237,'237',repeat('A',65536),repeat('B',65536));
insert into test.tablegencol(c1,USER_ID,ADDRESS) values(237, repeat('A',32),repeat('B',256));
insert into test.table_hash(c1, c2) values(237, 237);
insert into test.table_range(c1, c2) values(237, 237);
insert into test.table_hash_range(c1, c2) values(237, 237);
insert into test.table_range_hash(c1, c2) values(237, 237);
insert into db1.tb_normal (pk) values(238);
insert into db1.tb_increment (c1) values(238);
insert into db1.tb_bigtable (c1,c2,c3,c4) values(repeat('A',65536),repeat('B',65536),repeat('C',65536),repeat('D',65536));
insert into test.tb_table_gencol(pk1,pk2,c1,c2) values(238,'238',repeat('A',65536),repeat('B',65536));
insert into test.tablegencol(c1,USER_ID,ADDRESS) values(238, repeat('A',32),repeat('B',256));
insert into test.table_hash(c1, c2) values(238, 238);
insert into test.table_range(c1, c2) values(238, 238);
insert into test.table_hash_range(c1, c2) values(238, 238);
insert into test.table_range_hash(c1, c2) values(238, 238);
insert into db1.tb_normal (pk) values(239);
insert into db1.tb_increment (c1) values(239);
insert into db1.tb_bigtable (c1,c2,c3,c4) values(repeat('A',65536),repeat('B',65536),repeat('C',65536),repeat('D',65536));
insert into test.tb_table_gencol(pk1,pk2,c1,c2) values(239,'239',repeat('A',65536),repeat('B',65536));
insert into test.tablegencol(c1,USER_ID,ADDRESS) values(239, repeat('A',32),repeat('B',256));
insert into test.table_hash(c1, c2) values(239, 239);
insert into test.table_range(c1, c2) values(239, 239);
insert into test.table_hash_range(c1, c2) values(239, 239);
insert into test.table_range_hash(c1, c2) values(239, 239);
insert into db1.tb_normal (pk) values(240);
insert into db1.tb_increment (c1) values(240);
insert into db1.tb_bigtable (c1,c2,c3,c4) values(repeat('A',65536),repeat('B',65536),repeat('C',65536),repeat('D',65536));
insert into test.tb_table_gencol(pk1,pk2,c1,c2) values(240,'240',repeat('A',65536),repeat('B',65536));
insert into test.tablegencol(c1,USER_ID,ADDRESS) values(240, repeat('A',32),repeat('B',256));
insert into test.table_hash(c1, c2) values(240, 240);
insert into test.table_range(c1, c2) values(240, 240);
insert into test.table_hash_range(c1, c2) values(240, 240);
insert into test.table_range_hash(c1, c2) values(240, 240);
insert into db1.tb_normal (pk) values(241);
insert into db1.tb_increment (c1) values(241);
insert into db1.tb_bigtable (c1,c2,c3,c4) values(repeat('A',65536),repeat('B',65536),repeat('C',65536),repeat('D',65536));
insert into test.tb_table_gencol(pk1,pk2,c1,c2) values(241,'241',repeat('A',65536),repeat('B',65536));
insert into test.tablegencol(c1,USER_ID,ADDRESS) values(241, repeat('A',32),repeat('B',256));
insert into test.table_hash(c1, c2) values(241, 241);
insert into test.table_range(c1, c2) values(241, 241);
insert into test.table_hash_range(c1, c2) values(241, 241);
insert into test.table_range_hash(c1, c2) values(241, 241);
insert into db1.tb_normal (pk) values(242);
insert into db1.tb_increment (c1) values(242);
insert into db1.tb_bigtable (c1,c2,c3,c4) values(repeat('A',65536),repeat('B',65536),repeat('C',65536),repeat('D',65536));
insert into test.tb_table_gencol(pk1,pk2,c1,c2) values(242,'242',repeat('A',65536),repeat('B',65536));
insert into test.tablegencol(c1,USER_ID,ADDRESS) values(242, repeat('A',32),repeat('B',256));
insert into test.table_hash(c1, c2) values(242, 242);
insert into test.table_range(c1, c2) values(242, 242);
insert into test.table_hash_range(c1, c2) values(242, 242);
insert into test.table_range_hash(c1, c2) values(242, 242);
insert into db1.tb_normal (pk) values(243);
insert into db1.tb_increment (c1) values(243);
insert into db1.tb_bigtable (c1,c2,c3,c4) values(repeat('A',65536),repeat('B',65536),repeat('C',65536),repeat('D',65536));
insert into test.tb_table_gencol(pk1,pk2,c1,c2) values(243,'243',repeat('A',65536),repeat('B',65536));
insert into test.tablegencol(c1,USER_ID,ADDRESS) values(243, repeat('A',32),repeat('B',256));
insert into test.table_hash(c1, c2) values(243, 243);
insert into test.table_range(c1, c2) values(243, 243);
insert into test.table_hash_range(c1, c2) values(243, 243);
insert into test.table_range_hash(c1, c2) values(243, 243);
insert into db1.tb_normal (pk) values(244);
insert into db1.tb_increment (c1) values(244);
insert into db1.tb_bigtable (c1,c2,c3,c4) values(repeat('A',65536),repeat('B',65536),repeat('C',65536),repeat('D',65536));
insert into test.tb_table_gencol(pk1,pk2,c1,c2) values(244,'244',repeat('A',65536),repeat('B',65536));
insert into test.tablegencol(c1,USER_ID,ADDRESS) values(244, repeat('A',32),repeat('B',256));
insert into test.table_hash(c1, c2) values(244, 244);
insert into test.table_range(c1, c2) values(244, 244);
insert into test.table_hash_range(c1, c2) values(244, 244);
insert into test.table_range_hash(c1, c2) values(244, 244);
insert into db1.tb_normal (pk) values(245);
insert into db1.tb_increment (c1) values(245);
insert into db1.tb_bigtable (c1,c2,c3,c4) values(repeat('A',65536),repeat('B',65536),repeat('C',65536),repeat('D',65536));
insert into test.tb_table_gencol(pk1,pk2,c1,c2) values(245,'245',repeat('A',65536),repeat('B',65536));
insert into test.tablegencol(c1,USER_ID,ADDRESS) values(245, repeat('A',32),repeat('B',256));
insert into test.table_hash(c1, c2) values(245, 245);
insert into test.table_range(c1, c2) values(245, 245);
insert into test.table_hash_range(c1, c2) values(245, 245);
insert into test.table_range_hash(c1, c2) values(245, 245);
insert into db1.tb_normal (pk) values(246);
insert into db1.tb_increment (c1) values(246);
insert into db1.tb_bigtable (c1,c2,c3,c4) values(repeat('A',65536),repeat('B',65536),repeat('C',65536),repeat('D',65536));
insert into test.tb_table_gencol(pk1,pk2,c1,c2) values(246,'246',repeat('A',65536),repeat('B',65536));
insert into test.tablegencol(c1,USER_ID,ADDRESS) values(246, repeat('A',32),repeat('B',256));
insert into test.table_hash(c1, c2) values(246, 246);
insert into test.table_range(c1, c2) values(246, 246);
insert into test.table_hash_range(c1, c2) values(246, 246);
insert into test.table_range_hash(c1, c2) values(246, 246);
insert into db1.tb_normal (pk) values(247);
insert into db1.tb_increment (c1) values(247);
insert into db1.tb_bigtable (c1,c2,c3,c4) values(repeat('A',65536),repeat('B',65536),repeat('C',65536),repeat('D',65536));
insert into test.tb_table_gencol(pk1,pk2,c1,c2) values(247,'247',repeat('A',65536),repeat('B',65536));
insert into test.tablegencol(c1,USER_ID,ADDRESS) values(247, repeat('A',32),repeat('B',256));
insert into test.table_hash(c1, c2) values(247, 247);
insert into test.table_range(c1, c2) values(247, 247);
insert into test.table_hash_range(c1, c2) values(247, 247);
insert into test.table_range_hash(c1, c2) values(247, 247);
insert into db1.tb_normal (pk) values(248);
insert into db1.tb_increment (c1) values(248);
insert into db1.tb_bigtable (c1,c2,c3,c4) values(repeat('A',65536),repeat('B',65536),repeat('C',65536),repeat('D',65536));
insert into test.tb_table_gencol(pk1,pk2,c1,c2) values(248,'248',repeat('A',65536),repeat('B',65536));
insert into test.tablegencol(c1,USER_ID,ADDRESS) values(248, repeat('A',32),repeat('B',256));
insert into test.table_hash(c1, c2) values(248, 248);
insert into test.table_range(c1, c2) values(248, 248);
insert into test.table_hash_range(c1, c2) values(248, 248);
insert into test.table_range_hash(c1, c2) values(248, 248);
insert into db1.tb_normal (pk) values(249);
insert into db1.tb_increment (c1) values(249);
insert into db1.tb_bigtable (c1,c2,c3,c4) values(repeat('A',65536),repeat('B',65536),repeat('C',65536),repeat('D',65536));
insert into test.tb_table_gencol(pk1,pk2,c1,c2) values(249,'249',repeat('A',65536),repeat('B',65536));
insert into test.tablegencol(c1,USER_ID,ADDRESS) values(249, repeat('A',32),repeat('B',256));
insert into test.table_hash(c1, c2) values(249, 249);
insert into test.table_range(c1, c2) values(249, 249);
insert into test.table_hash_range(c1, c2) values(249, 249);
insert into test.table_range_hash(c1, c2) values(249, 249);
insert into db1.tb_normal (pk) values(250);
insert into db1.tb_increment (c1) values(250);
insert into db1.tb_bigtable (c1,c2,c3,c4) values(repeat('A',65536),repeat('B',65536),repeat('C',65536),repeat('D',65536));
insert into test.tb_table_gencol(pk1,pk2,c1,c2) values(250,'250',repeat('A',65536),repeat('B',65536));
insert into test.tablegencol(c1,USER_ID,ADDRESS) values(250, repeat('A',32),repeat('B',256));
insert into test.table_hash(c1, c2) values(250, 250);
insert into test.table_range(c1, c2) values(250, 250);
insert into test.table_hash_range(c1, c2) values(250, 250);
insert into test.table_range_hash(c1, c2) values(250, 250);
insert into db1.tb_normal (pk) values(251);
insert into db1.tb_increment (c1) values(251);
insert into db1.tb_bigtable (c1,c2,c3,c4) values(repeat('A',65536),repeat('B',65536),repeat('C',65536),repeat('D',65536));
insert into test.tb_table_gencol(pk1,pk2,c1,c2) values(251,'251',repeat('A',65536),repeat('B',65536));
insert into test.tablegencol(c1,USER_ID,ADDRESS) values(251, repeat('A',32),repeat('B',256));
insert into test.table_hash(c1, c2) values(251, 251);
insert into test.table_range(c1, c2) values(251, 251);
insert into test.table_hash_range(c1, c2) values(251, 251);
insert into test.table_range_hash(c1, c2) values(251, 251);
insert into db1.tb_normal (pk) values(252);
insert into db1.tb_increment (c1) values(252);
insert into db1.tb_bigtable (c1,c2,c3,c4) values(repeat('A',65536),repeat('B',65536),repeat('C',65536),repeat('D',65536));
insert into test.tb_table_gencol(pk1,pk2,c1,c2) values(252,'252',repeat('A',65536),repeat('B',65536));
insert into test.tablegencol(c1,USER_ID,ADDRESS) values(252, repeat('A',32),repeat('B',256));
insert into test.table_hash(c1, c2) values(252, 252);
insert into test.table_range(c1, c2) values(252, 252);
insert into test.table_hash_range(c1, c2) values(252, 252);
insert into test.table_range_hash(c1, c2) values(252, 252);
insert into db1.tb_normal (pk) values(253);
insert into db1.tb_increment (c1) values(253);
insert into db1.tb_bigtable (c1,c2,c3,c4) values(repeat('A',65536),repeat('B',65536),repeat('C',65536),repeat('D',65536));
insert into test.tb_table_gencol(pk1,pk2,c1,c2) values(253,'253',repeat('A',65536),repeat('B',65536));
insert into test.tablegencol(c1,USER_ID,ADDRESS) values(253, repeat('A',32),repeat('B',256));
insert into test.table_hash(c1, c2) values(253, 253);
insert into test.table_range(c1, c2) values(253, 253);
insert into test.table_hash_range(c1, c2) values(253, 253);
insert into test.table_range_hash(c1, c2) values(253, 253);
insert into db1.tb_normal (pk) values(254);
insert into db1.tb_increment (c1) values(254);
insert into db1.tb_bigtable (c1,c2,c3,c4) values(repeat('A',65536),repeat('B',65536),repeat('C',65536),repeat('D',65536));
insert into test.tb_table_gencol(pk1,pk2,c1,c2) values(254,'254',repeat('A',65536),repeat('B',65536));
insert into test.tablegencol(c1,USER_ID,ADDRESS) values(254, repeat('A',32),repeat('B',256));
insert into test.table_hash(c1, c2) values(254, 254);
insert into test.table_range(c1, c2) values(254, 254);
insert into test.table_hash_range(c1, c2) values(254, 254);
insert into test.table_range_hash(c1, c2) values(254, 254);
insert into db1.tb_normal (pk) values(255);
insert into db1.tb_increment (c1) values(255);
insert into db1.tb_bigtable (c1,c2,c3,c4) values(repeat('A',65536),repeat('B',65536),repeat('C',65536),repeat('D',65536));
insert into test.tb_table_gencol(pk1,pk2,c1,c2) values(255,'255',repeat('A',65536),repeat('B',65536));
insert into test.tablegencol(c1,USER_ID,ADDRESS) values(255, repeat('A',32),repeat('B',256));
insert into test.table_hash(c1, c2) values(255, 255);
insert into test.table_range(c1, c2) values(255, 255);
insert into test.table_hash_range(c1, c2) values(255, 255);
insert into test.table_range_hash(c1, c2) values(255, 255);
insert into db1.tb_normal (pk) values(256);
insert into db1.tb_increment (c1) values(256);
insert into db1.tb_bigtable (c1,c2,c3,c4) values(repeat('A',65536),repeat('B',65536),repeat('C',65536),repeat('D',65536));
insert into test.tb_table_gencol(pk1,pk2,c1,c2) values(256,'256',repeat('A',65536),repeat('B',65536));
insert into test.tablegencol(c1,USER_ID,ADDRESS) values(256, repeat('A',32),repeat('B',256));
insert into test.table_hash(c1, c2) values(256, 256);
insert into test.table_range(c1, c2) values(256, 256);
insert into test.table_hash_range(c1, c2) values(256, 256);
insert into test.table_range_hash(c1, c2) values(256, 256);
insert into db1.tb_normal (pk) values(257);
insert into db1.tb_increment (c1) values(257);
insert into db1.tb_bigtable (c1,c2,c3,c4) values(repeat('A',65536),repeat('B',65536),repeat('C',65536),repeat('D',65536));
insert into test.tb_table_gencol(pk1,pk2,c1,c2) values(257,'257',repeat('A',65536),repeat('B',65536));
insert into test.tablegencol(c1,USER_ID,ADDRESS) values(257, repeat('A',32),repeat('B',256));
insert into test.table_hash(c1, c2) values(257, 257);
insert into test.table_range(c1, c2) values(257, 257);
insert into test.table_hash_range(c1, c2) values(257, 257);
insert into test.table_range_hash(c1, c2) values(257, 257);
insert into db1.tb_normal (pk) values(258);
insert into db1.tb_increment (c1) values(258);
insert into db1.tb_bigtable (c1,c2,c3,c4) values(repeat('A',65536),repeat('B',65536),repeat('C',65536),repeat('D',65536));
insert into test.tb_table_gencol(pk1,pk2,c1,c2) values(258,'258',repeat('A',65536),repeat('B',65536));
insert into test.tablegencol(c1,USER_ID,ADDRESS) values(258, repeat('A',32),repeat('B',256));
insert into test.table_hash(c1, c2) values(258, 258);
insert into test.table_range(c1, c2) values(258, 258);
insert into test.table_hash_range(c1, c2) values(258, 258);
insert into test.table_range_hash(c1, c2) values(258, 258);
insert into db1.tb_normal (pk) values(259);
insert into db1.tb_increment (c1) values(259);
insert into db1.tb_bigtable (c1,c2,c3,c4) values(repeat('A',65536),repeat('B',65536),repeat('C',65536),repeat('D',65536));
insert into test.tb_table_gencol(pk1,pk2,c1,c2) values(259,'259',repeat('A',65536),repeat('B',65536));
insert into test.tablegencol(c1,USER_ID,ADDRESS) values(259, repeat('A',32),repeat('B',256));
insert into test.table_hash(c1, c2) values(259, 259);
insert into test.table_range(c1, c2) values(259, 259);
insert into test.table_hash_range(c1, c2) values(259, 259);
insert into test.table_range_hash(c1, c2) values(259, 259);
insert into db1.tb_normal (pk) values(260);
insert into db1.tb_increment (c1) values(260);
insert into db1.tb_bigtable (c1,c2,c3,c4) values(repeat('A',65536),repeat('B',65536),repeat('C',65536),repeat('D',65536));
insert into test.tb_table_gencol(pk1,pk2,c1,c2) values(260,'260',repeat('A',65536),repeat('B',65536));
insert into test.tablegencol(c1,USER_ID,ADDRESS) values(260, repeat('A',32),repeat('B',256));
insert into test.table_hash(c1, c2) values(260, 260);
insert into test.table_range(c1, c2) values(260, 260);
insert into test.table_hash_range(c1, c2) values(260, 260);
insert into test.table_range_hash(c1, c2) values(260, 260);
insert into db1.tb_normal (pk) values(261);
insert into db1.tb_increment (c1) values(261);
insert into db1.tb_bigtable (c1,c2,c3,c4) values(repeat('A',65536),repeat('B',65536),repeat('C',65536),repeat('D',65536));
insert into test.tb_table_gencol(pk1,pk2,c1,c2) values(261,'261',repeat('A',65536),repeat('B',65536));
insert into test.tablegencol(c1,USER_ID,ADDRESS) values(261, repeat('A',32),repeat('B',256));
insert into test.table_hash(c1, c2) values(261, 261);
insert into test.table_range(c1, c2) values(261, 261);
insert into test.table_hash_range(c1, c2) values(261, 261);
insert into test.table_range_hash(c1, c2) values(261, 261);
insert into db1.tb_normal (pk) values(262);
insert into db1.tb_increment (c1) values(262);
insert into db1.tb_bigtable (c1,c2,c3,c4) values(repeat('A',65536),repeat('B',65536),repeat('C',65536),repeat('D',65536));
insert into test.tb_table_gencol(pk1,pk2,c1,c2) values(262,'262',repeat('A',65536),repeat('B',65536));
insert into test.tablegencol(c1,USER_ID,ADDRESS) values(262, repeat('A',32),repeat('B',256));
insert into test.table_hash(c1, c2) values(262, 262);
insert into test.table_range(c1, c2) values(262, 262);
insert into test.table_hash_range(c1, c2) values(262, 262);
insert into test.table_range_hash(c1, c2) values(262, 262);
insert into db1.tb_normal (pk) values(263);
insert into db1.tb_increment (c1) values(263);
insert into db1.tb_bigtable (c1,c2,c3,c4) values(repeat('A',65536),repeat('B',65536),repeat('C',65536),repeat('D',65536));
insert into test.tb_table_gencol(pk1,pk2,c1,c2) values(263,'263',repeat('A',65536),repeat('B',65536));
insert into test.tablegencol(c1,USER_ID,ADDRESS) values(263, repeat('A',32),repeat('B',256));
insert into test.table_hash(c1, c2) values(263, 263);
insert into test.table_range(c1, c2) values(263, 263);
insert into test.table_hash_range(c1, c2) values(263, 263);
insert into test.table_range_hash(c1, c2) values(263, 263);
insert into db1.tb_normal (pk) values(264);
insert into db1.tb_increment (c1) values(264);
insert into db1.tb_bigtable (c1,c2,c3,c4) values(repeat('A',65536),repeat('B',65536),repeat('C',65536),repeat('D',65536));
insert into test.tb_table_gencol(pk1,pk2,c1,c2) values(264,'264',repeat('A',65536),repeat('B',65536));
insert into test.tablegencol(c1,USER_ID,ADDRESS) values(264, repeat('A',32),repeat('B',256));
insert into test.table_hash(c1, c2) values(264, 264);
insert into test.table_range(c1, c2) values(264, 264);
insert into test.table_hash_range(c1, c2) values(264, 264);
insert into test.table_range_hash(c1, c2) values(264, 264);
insert into db1.tb_normal (pk) values(265);
insert into db1.tb_increment (c1) values(265);
insert into db1.tb_bigtable (c1,c2,c3,c4) values(repeat('A',65536),repeat('B',65536),repeat('C',65536),repeat('D',65536));
insert into test.tb_table_gencol(pk1,pk2,c1,c2) values(265,'265',repeat('A',65536),repeat('B',65536));
insert into test.tablegencol(c1,USER_ID,ADDRESS) values(265, repeat('A',32),repeat('B',256));
insert into test.table_hash(c1, c2) values(265, 265);
insert into test.table_range(c1, c2) values(265, 265);
insert into test.table_hash_range(c1, c2) values(265, 265);
insert into test.table_range_hash(c1, c2) values(265, 265);
insert into db1.tb_normal (pk) values(266);
insert into db1.tb_increment (c1) values(266);
insert into db1.tb_bigtable (c1,c2,c3,c4) values(repeat('A',65536),repeat('B',65536),repeat('C',65536),repeat('D',65536));
insert into test.tb_table_gencol(pk1,pk2,c1,c2) values(266,'266',repeat('A',65536),repeat('B',65536));
insert into test.tablegencol(c1,USER_ID,ADDRESS) values(266, repeat('A',32),repeat('B',256));
insert into test.table_hash(c1, c2) values(266, 266);
insert into test.table_range(c1, c2) values(266, 266);
insert into test.table_hash_range(c1, c2) values(266, 266);
insert into test.table_range_hash(c1, c2) values(266, 266);
insert into db1.tb_normal (pk) values(267);
insert into db1.tb_increment (c1) values(267);
insert into db1.tb_bigtable (c1,c2,c3,c4) values(repeat('A',65536),repeat('B',65536),repeat('C',65536),repeat('D',65536));
insert into test.tb_table_gencol(pk1,pk2,c1,c2) values(267,'267',repeat('A',65536),repeat('B',65536));
insert into test.tablegencol(c1,USER_ID,ADDRESS) values(267, repeat('A',32),repeat('B',256));
insert into test.table_hash(c1, c2) values(267, 267);
insert into test.table_range(c1, c2) values(267, 267);
insert into test.table_hash_range(c1, c2) values(267, 267);
insert into test.table_range_hash(c1, c2) values(267, 267);
insert into db1.tb_normal (pk) values(268);
insert into db1.tb_increment (c1) values(268);
insert into db1.tb_bigtable (c1,c2,c3,c4) values(repeat('A',65536),repeat('B',65536),repeat('C',65536),repeat('D',65536));
insert into test.tb_table_gencol(pk1,pk2,c1,c2) values(268,'268',repeat('A',65536),repeat('B',65536));
insert into test.tablegencol(c1,USER_ID,ADDRESS) values(268, repeat('A',32),repeat('B',256));
insert into test.table_hash(c1, c2) values(268, 268);
insert into test.table_range(c1, c2) values(268, 268);
insert into test.table_hash_range(c1, c2) values(268, 268);
insert into test.table_range_hash(c1, c2) values(268, 268);
insert into db1.tb_normal (pk) values(269);
insert into db1.tb_increment (c1) values(269);
insert into db1.tb_bigtable (c1,c2,c3,c4) values(repeat('A',65536),repeat('B',65536),repeat('C',65536),repeat('D',65536));
insert into test.tb_table_gencol(pk1,pk2,c1,c2) values(269,'269',repeat('A',65536),repeat('B',65536));
insert into test.tablegencol(c1,USER_ID,ADDRESS) values(269, repeat('A',32),repeat('B',256));
insert into test.table_hash(c1, c2) values(269, 269);
insert into test.table_range(c1, c2) values(269, 269);
insert into test.table_hash_range(c1, c2) values(269, 269);
insert into test.table_range_hash(c1, c2) values(269, 269);
insert into db1.tb_normal (pk) values(270);
insert into db1.tb_increment (c1) values(270);
insert into db1.tb_bigtable (c1,c2,c3,c4) values(repeat('A',65536),repeat('B',65536),repeat('C',65536),repeat('D',65536));
insert into test.tb_table_gencol(pk1,pk2,c1,c2) values(270,'270',repeat('A',65536),repeat('B',65536));
insert into test.tablegencol(c1,USER_ID,ADDRESS) values(270, repeat('A',32),repeat('B',256));
insert into test.table_hash(c1, c2) values(270, 270);
insert into test.table_range(c1, c2) values(270, 270);
insert into test.table_hash_range(c1, c2) values(270, 270);
insert into test.table_range_hash(c1, c2) values(270, 270);
insert into db1.tb_normal (pk) values(271);
insert into db1.tb_increment (c1) values(271);
insert into db1.tb_bigtable (c1,c2,c3,c4) values(repeat('A',65536),repeat('B',65536),repeat('C',65536),repeat('D',65536));
insert into test.tb_table_gencol(pk1,pk2,c1,c2) values(271,'271',repeat('A',65536),repeat('B',65536));
insert into test.tablegencol(c1,USER_ID,ADDRESS) values(271, repeat('A',32),repeat('B',256));
insert into test.table_hash(c1, c2) values(271, 271);
insert into test.table_range(c1, c2) values(271, 271);
insert into test.table_hash_range(c1, c2) values(271, 271);
insert into test.table_range_hash(c1, c2) values(271, 271);
insert into db1.tb_normal (pk) values(272);
insert into db1.tb_increment (c1) values(272);
insert into db1.tb_bigtable (c1,c2,c3,c4) values(repeat('A',65536),repeat('B',65536),repeat('C',65536),repeat('D',65536));
insert into test.tb_table_gencol(pk1,pk2,c1,c2) values(272,'272',repeat('A',65536),repeat('B',65536));
insert into test.tablegencol(c1,USER_ID,ADDRESS) values(272, repeat('A',32),repeat('B',256));
insert into test.table_hash(c1, c2) values(272, 272);
insert into test.table_range(c1, c2) values(272, 272);
insert into test.table_hash_range(c1, c2) values(272, 272);
insert into test.table_range_hash(c1, c2) values(272, 272);
insert into db1.tb_normal (pk) values(273);
insert into db1.tb_increment (c1) values(273);
insert into db1.tb_bigtable (c1,c2,c3,c4) values(repeat('A',65536),repeat('B',65536),repeat('C',65536),repeat('D',65536));
insert into test.tb_table_gencol(pk1,pk2,c1,c2) values(273,'273',repeat('A',65536),repeat('B',65536));
insert into test.tablegencol(c1,USER_ID,ADDRESS) values(273, repeat('A',32),repeat('B',256));
insert into test.table_hash(c1, c2) values(273, 273);
insert into test.table_range(c1, c2) values(273, 273);
insert into test.table_hash_range(c1, c2) values(273, 273);
insert into test.table_range_hash(c1, c2) values(273, 273);
insert into db1.tb_normal (pk) values(274);
insert into db1.tb_increment (c1) values(274);
insert into db1.tb_bigtable (c1,c2,c3,c4) values(repeat('A',65536),repeat('B',65536),repeat('C',65536),repeat('D',65536));
insert into test.tb_table_gencol(pk1,pk2,c1,c2) values(274,'274',repeat('A',65536),repeat('B',65536));
insert into test.tablegencol(c1,USER_ID,ADDRESS) values(274, repeat('A',32),repeat('B',256));
insert into test.table_hash(c1, c2) values(274, 274);
insert into test.table_range(c1, c2) values(274, 274);
insert into test.table_hash_range(c1, c2) values(274, 274);
insert into test.table_range_hash(c1, c2) values(274, 274);
insert into db1.tb_normal (pk) values(275);
insert into db1.tb_increment (c1) values(275);
insert into db1.tb_bigtable (c1,c2,c3,c4) values(repeat('A',65536),repeat('B',65536),repeat('C',65536),repeat('D',65536));
insert into test.tb_table_gencol(pk1,pk2,c1,c2) values(275,'275',repeat('A',65536),repeat('B',65536));
insert into test.tablegencol(c1,USER_ID,ADDRESS) values(275, repeat('A',32),repeat('B',256));
insert into test.table_hash(c1, c2) values(275, 275);
insert into test.table_range(c1, c2) values(275, 275);
insert into test.table_hash_range(c1, c2) values(275, 275);
insert into test.table_range_hash(c1, c2) values(275, 275);
insert into db1.tb_normal (pk) values(276);
insert into db1.tb_increment (c1) values(276);
insert into db1.tb_bigtable (c1,c2,c3,c4) values(repeat('A',65536),repeat('B',65536),repeat('C',65536),repeat('D',65536));
insert into test.tb_table_gencol(pk1,pk2,c1,c2) values(276,'276',repeat('A',65536),repeat('B',65536));
insert into test.tablegencol(c1,USER_ID,ADDRESS) values(276, repeat('A',32),repeat('B',256));
insert into test.table_hash(c1, c2) values(276, 276);
insert into test.table_range(c1, c2) values(276, 276);
insert into test.table_hash_range(c1, c2) values(276, 276);
insert into test.table_range_hash(c1, c2) values(276, 276);
insert into db1.tb_normal (pk) values(277);
insert into db1.tb_increment (c1) values(277);
insert into db1.tb_bigtable (c1,c2,c3,c4) values(repeat('A',65536),repeat('B',65536),repeat('C',65536),repeat('D',65536));
insert into test.tb_table_gencol(pk1,pk2,c1,c2) values(277,'277',repeat('A',65536),repeat('B',65536));
insert into test.tablegencol(c1,USER_ID,ADDRESS) values(277, repeat('A',32),repeat('B',256));
insert into test.table_hash(c1, c2) values(277, 277);
insert into test.table_range(c1, c2) values(277, 277);
insert into test.table_hash_range(c1, c2) values(277, 277);
insert into test.table_range_hash(c1, c2) values(277, 277);
insert into db1.tb_normal (pk) values(278);
insert into db1.tb_increment (c1) values(278);
insert into db1.tb_bigtable (c1,c2,c3,c4) values(repeat('A',65536),repeat('B',65536),repeat('C',65536),repeat('D',65536));
insert into test.tb_table_gencol(pk1,pk2,c1,c2) values(278,'278',repeat('A',65536),repeat('B',65536));
insert into test.tablegencol(c1,USER_ID,ADDRESS) values(278, repeat('A',32),repeat('B',256));
insert into test.table_hash(c1, c2) values(278, 278);
insert into test.table_range(c1, c2) values(278, 278);
insert into test.table_hash_range(c1, c2) values(278, 278);
insert into test.table_range_hash(c1, c2) values(278, 278);
insert into db1.tb_normal (pk) values(279);
insert into db1.tb_increment (c1) values(279);
insert into db1.tb_bigtable (c1,c2,c3,c4) values(repeat('A',65536),repeat('B',65536),repeat('C',65536),repeat('D',65536));
insert into test.tb_table_gencol(pk1,pk2,c1,c2) values(279,'279',repeat('A',65536),repeat('B',65536));
insert into test.tablegencol(c1,USER_ID,ADDRESS) values(279, repeat('A',32),repeat('B',256));
insert into test.table_hash(c1, c2) values(279, 279);
insert into test.table_range(c1, c2) values(279, 279);
insert into test.table_hash_range(c1, c2) values(279, 279);
insert into test.table_range_hash(c1, c2) values(279, 279);
insert into db1.tb_normal (pk) values(280);
insert into db1.tb_increment (c1) values(280);
insert into db1.tb_bigtable (c1,c2,c3,c4) values(repeat('A',65536),repeat('B',65536),repeat('C',65536),repeat('D',65536));
insert into test.tb_table_gencol(pk1,pk2,c1,c2) values(280,'280',repeat('A',65536),repeat('B',65536));
insert into test.tablegencol(c1,USER_ID,ADDRESS) values(280, repeat('A',32),repeat('B',256));
insert into test.table_hash(c1, c2) values(280, 280);
insert into test.table_range(c1, c2) values(280, 280);
insert into test.table_hash_range(c1, c2) values(280, 280);
insert into test.table_range_hash(c1, c2) values(280, 280);
insert into db1.tb_normal (pk) values(281);
insert into db1.tb_increment (c1) values(281);
insert into db1.tb_bigtable (c1,c2,c3,c4) values(repeat('A',65536),repeat('B',65536),repeat('C',65536),repeat('D',65536));
insert into test.tb_table_gencol(pk1,pk2,c1,c2) values(281,'281',repeat('A',65536),repeat('B',65536));
insert into test.tablegencol(c1,USER_ID,ADDRESS) values(281, repeat('A',32),repeat('B',256));
insert into test.table_hash(c1, c2) values(281, 281);
insert into test.table_range(c1, c2) values(281, 281);
insert into test.table_hash_range(c1, c2) values(281, 281);
insert into test.table_range_hash(c1, c2) values(281, 281);
insert into db1.tb_normal (pk) values(282);
insert into db1.tb_increment (c1) values(282);
insert into db1.tb_bigtable (c1,c2,c3,c4) values(repeat('A',65536),repeat('B',65536),repeat('C',65536),repeat('D',65536));
insert into test.tb_table_gencol(pk1,pk2,c1,c2) values(282,'282',repeat('A',65536),repeat('B',65536));
insert into test.tablegencol(c1,USER_ID,ADDRESS) values(282, repeat('A',32),repeat('B',256));
insert into test.table_hash(c1, c2) values(282, 282);
insert into test.table_range(c1, c2) values(282, 282);
insert into test.table_hash_range(c1, c2) values(282, 282);
insert into test.table_range_hash(c1, c2) values(282, 282);
insert into db1.tb_normal (pk) values(283);
insert into db1.tb_increment (c1) values(283);
insert into db1.tb_bigtable (c1,c2,c3,c4) values(repeat('A',65536),repeat('B',65536),repeat('C',65536),repeat('D',65536));
insert into test.tb_table_gencol(pk1,pk2,c1,c2) values(283,'283',repeat('A',65536),repeat('B',65536));
insert into test.tablegencol(c1,USER_ID,ADDRESS) values(283, repeat('A',32),repeat('B',256));
insert into test.table_hash(c1, c2) values(283, 283);
insert into test.table_range(c1, c2) values(283, 283);
insert into test.table_hash_range(c1, c2) values(283, 283);
insert into test.table_range_hash(c1, c2) values(283, 283);
insert into db1.tb_normal (pk) values(284);
insert into db1.tb_increment (c1) values(284);
insert into db1.tb_bigtable (c1,c2,c3,c4) values(repeat('A',65536),repeat('B',65536),repeat('C',65536),repeat('D',65536));
insert into test.tb_table_gencol(pk1,pk2,c1,c2) values(284,'284',repeat('A',65536),repeat('B',65536));
insert into test.tablegencol(c1,USER_ID,ADDRESS) values(284, repeat('A',32),repeat('B',256));
insert into test.table_hash(c1, c2) values(284, 284);
insert into test.table_range(c1, c2) values(284, 284);
insert into test.table_hash_range(c1, c2) values(284, 284);
insert into test.table_range_hash(c1, c2) values(284, 284);
insert into db1.tb_normal (pk) values(285);
insert into db1.tb_increment (c1) values(285);
insert into db1.tb_bigtable (c1,c2,c3,c4) values(repeat('A',65536),repeat('B',65536),repeat('C',65536),repeat('D',65536));
insert into test.tb_table_gencol(pk1,pk2,c1,c2) values(285,'285',repeat('A',65536),repeat('B',65536));
insert into test.tablegencol(c1,USER_ID,ADDRESS) values(285, repeat('A',32),repeat('B',256));
insert into test.table_hash(c1, c2) values(285, 285);
insert into test.table_range(c1, c2) values(285, 285);
insert into test.table_hash_range(c1, c2) values(285, 285);
insert into test.table_range_hash(c1, c2) values(285, 285);
insert into db1.tb_normal (pk) values(286);
insert into db1.tb_increment (c1) values(286);
insert into db1.tb_bigtable (c1,c2,c3,c4) values(repeat('A',65536),repeat('B',65536),repeat('C',65536),repeat('D',65536));
insert into test.tb_table_gencol(pk1,pk2,c1,c2) values(286,'286',repeat('A',65536),repeat('B',65536));
insert into test.tablegencol(c1,USER_ID,ADDRESS) values(286, repeat('A',32),repeat('B',256));
insert into test.table_hash(c1, c2) values(286, 286);
insert into test.table_range(c1, c2) values(286, 286);
insert into test.table_hash_range(c1, c2) values(286, 286);
insert into test.table_range_hash(c1, c2) values(286, 286);
insert into db1.tb_normal (pk) values(287);
insert into db1.tb_increment (c1) values(287);
insert into db1.tb_bigtable (c1,c2,c3,c4) values(repeat('A',65536),repeat('B',65536),repeat('C',65536),repeat('D',65536));
insert into test.tb_table_gencol(pk1,pk2,c1,c2) values(287,'287',repeat('A',65536),repeat('B',65536));
insert into test.tablegencol(c1,USER_ID,ADDRESS) values(287, repeat('A',32),repeat('B',256));
insert into test.table_hash(c1, c2) values(287, 287);
insert into test.table_range(c1, c2) values(287, 287);
insert into test.table_hash_range(c1, c2) values(287, 287);
insert into test.table_range_hash(c1, c2) values(287, 287);
insert into db1.tb_normal (pk) values(288);
insert into db1.tb_increment (c1) values(288);
insert into db1.tb_bigtable (c1,c2,c3,c4) values(repeat('A',65536),repeat('B',65536),repeat('C',65536),repeat('D',65536));
insert into test.tb_table_gencol(pk1,pk2,c1,c2) values(288,'288',repeat('A',65536),repeat('B',65536));
insert into test.tablegencol(c1,USER_ID,ADDRESS) values(288, repeat('A',32),repeat('B',256));
insert into test.table_hash(c1, c2) values(288, 288);
insert into test.table_range(c1, c2) values(288, 288);
insert into test.table_hash_range(c1, c2) values(288, 288);
insert into test.table_range_hash(c1, c2) values(288, 288);
insert into db1.tb_normal (pk) values(289);
insert into db1.tb_increment (c1) values(289);
insert into db1.tb_bigtable (c1,c2,c3,c4) values(repeat('A',65536),repeat('B',65536),repeat('C',65536),repeat('D',65536));
insert into test.tb_table_gencol(pk1,pk2,c1,c2) values(289,'289',repeat('A',65536),repeat('B',65536));
insert into test.tablegencol(c1,USER_ID,ADDRESS) values(289, repeat('A',32),repeat('B',256));
insert into test.table_hash(c1, c2) values(289, 289);
insert into test.table_range(c1, c2) values(289, 289);
insert into test.table_hash_range(c1, c2) values(289, 289);
insert into test.table_range_hash(c1, c2) values(289, 289);
insert into db1.tb_normal (pk) values(290);
insert into db1.tb_increment (c1) values(290);
insert into db1.tb_bigtable (c1,c2,c3,c4) values(repeat('A',65536),repeat('B',65536),repeat('C',65536),repeat('D',65536));
insert into test.tb_table_gencol(pk1,pk2,c1,c2) values(290,'290',repeat('A',65536),repeat('B',65536));
insert into test.tablegencol(c1,USER_ID,ADDRESS) values(290, repeat('A',32),repeat('B',256));
insert into test.table_hash(c1, c2) values(290, 290);
insert into test.table_range(c1, c2) values(290, 290);
insert into test.table_hash_range(c1, c2) values(290, 290);
insert into test.table_range_hash(c1, c2) values(290, 290);
insert into db1.tb_normal (pk) values(291);
insert into db1.tb_increment (c1) values(291);
insert into db1.tb_bigtable (c1,c2,c3,c4) values(repeat('A',65536),repeat('B',65536),repeat('C',65536),repeat('D',65536));
insert into test.tb_table_gencol(pk1,pk2,c1,c2) values(291,'291',repeat('A',65536),repeat('B',65536));
insert into test.tablegencol(c1,USER_ID,ADDRESS) values(291, repeat('A',32),repeat('B',256));
insert into test.table_hash(c1, c2) values(291, 291);
insert into test.table_range(c1, c2) values(291, 291);
insert into test.table_hash_range(c1, c2) values(291, 291);
insert into test.table_range_hash(c1, c2) values(291, 291);
insert into db1.tb_normal (pk) values(292);
insert into db1.tb_increment (c1) values(292);
insert into db1.tb_bigtable (c1,c2,c3,c4) values(repeat('A',65536),repeat('B',65536),repeat('C',65536),repeat('D',65536));
insert into test.tb_table_gencol(pk1,pk2,c1,c2) values(292,'292',repeat('A',65536),repeat('B',65536));
insert into test.tablegencol(c1,USER_ID,ADDRESS) values(292, repeat('A',32),repeat('B',256));
insert into test.table_hash(c1, c2) values(292, 292);
insert into test.table_range(c1, c2) values(292, 292);
insert into test.table_hash_range(c1, c2) values(292, 292);
insert into test.table_range_hash(c1, c2) values(292, 292);
insert into db1.tb_normal (pk) values(293);
insert into db1.tb_increment (c1) values(293);
insert into db1.tb_bigtable (c1,c2,c3,c4) values(repeat('A',65536),repeat('B',65536),repeat('C',65536),repeat('D',65536));
insert into test.tb_table_gencol(pk1,pk2,c1,c2) values(293,'293',repeat('A',65536),repeat('B',65536));
insert into test.tablegencol(c1,USER_ID,ADDRESS) values(293, repeat('A',32),repeat('B',256));
insert into test.table_hash(c1, c2) values(293, 293);
insert into test.table_range(c1, c2) values(293, 293);
insert into test.table_hash_range(c1, c2) values(293, 293);
insert into test.table_range_hash(c1, c2) values(293, 293);
insert into db1.tb_normal (pk) values(294);
insert into db1.tb_increment (c1) values(294);
insert into db1.tb_bigtable (c1,c2,c3,c4) values(repeat('A',65536),repeat('B',65536),repeat('C',65536),repeat('D',65536));
insert into test.tb_table_gencol(pk1,pk2,c1,c2) values(294,'294',repeat('A',65536),repeat('B',65536));
insert into test.tablegencol(c1,USER_ID,ADDRESS) values(294, repeat('A',32),repeat('B',256));
insert into test.table_hash(c1, c2) values(294, 294);
insert into test.table_range(c1, c2) values(294, 294);
insert into test.table_hash_range(c1, c2) values(294, 294);
insert into test.table_range_hash(c1, c2) values(294, 294);
insert into db1.tb_normal (pk) values(295);
insert into db1.tb_increment (c1) values(295);
insert into db1.tb_bigtable (c1,c2,c3,c4) values(repeat('A',65536),repeat('B',65536),repeat('C',65536),repeat('D',65536));
insert into test.tb_table_gencol(pk1,pk2,c1,c2) values(295,'295',repeat('A',65536),repeat('B',65536));
insert into test.tablegencol(c1,USER_ID,ADDRESS) values(295, repeat('A',32),repeat('B',256));
insert into test.table_hash(c1, c2) values(295, 295);
insert into test.table_range(c1, c2) values(295, 295);
insert into test.table_hash_range(c1, c2) values(295, 295);
insert into test.table_range_hash(c1, c2) values(295, 295);
insert into db1.tb_normal (pk) values(296);
insert into db1.tb_increment (c1) values(296);
insert into db1.tb_bigtable (c1,c2,c3,c4) values(repeat('A',65536),repeat('B',65536),repeat('C',65536),repeat('D',65536));
insert into test.tb_table_gencol(pk1,pk2,c1,c2) values(296,'296',repeat('A',65536),repeat('B',65536));
insert into test.tablegencol(c1,USER_ID,ADDRESS) values(296, repeat('A',32),repeat('B',256));
insert into test.table_hash(c1, c2) values(296, 296);
insert into test.table_range(c1, c2) values(296, 296);
insert into test.table_hash_range(c1, c2) values(296, 296);
insert into test.table_range_hash(c1, c2) values(296, 296);
insert into db1.tb_normal (pk) values(297);
insert into db1.tb_increment (c1) values(297);
insert into db1.tb_bigtable (c1,c2,c3,c4) values(repeat('A',65536),repeat('B',65536),repeat('C',65536),repeat('D',65536));
insert into test.tb_table_gencol(pk1,pk2,c1,c2) values(297,'297',repeat('A',65536),repeat('B',65536));
insert into test.tablegencol(c1,USER_ID,ADDRESS) values(297, repeat('A',32),repeat('B',256));
insert into test.table_hash(c1, c2) values(297, 297);
insert into test.table_range(c1, c2) values(297, 297);
insert into test.table_hash_range(c1, c2) values(297, 297);
insert into test.table_range_hash(c1, c2) values(297, 297);
insert into db1.tb_normal (pk) values(298);
insert into db1.tb_increment (c1) values(298);
insert into db1.tb_bigtable (c1,c2,c3,c4) values(repeat('A',65536),repeat('B',65536),repeat('C',65536),repeat('D',65536));
insert into test.tb_table_gencol(pk1,pk2,c1,c2) values(298,'298',repeat('A',65536),repeat('B',65536));
insert into test.tablegencol(c1,USER_ID,ADDRESS) values(298, repeat('A',32),repeat('B',256));
insert into test.table_hash(c1, c2) values(298, 298);
insert into test.table_range(c1, c2) values(298, 298);
insert into test.table_hash_range(c1, c2) values(298, 298);
insert into test.table_range_hash(c1, c2) values(298, 298);
insert into db1.tb_normal (pk) values(299);
insert into db1.tb_increment (c1) values(299);
insert into db1.tb_bigtable (c1,c2,c3,c4) values(repeat('A',65536),repeat('B',65536),repeat('C',65536),repeat('D',65536));
insert into test.tb_table_gencol(pk1,pk2,c1,c2) values(299,'299',repeat('A',65536),repeat('B',65536));
insert into test.tablegencol(c1,USER_ID,ADDRESS) values(299, repeat('A',32),repeat('B',256));
insert into test.table_hash(c1, c2) values(299, 299);
insert into test.table_range(c1, c2) values(299, 299);
insert into test.table_hash_range(c1, c2) values(299, 299);
insert into test.table_range_hash(c1, c2) values(299, 299);
insert into db1.tb_normal (pk) values(300);
insert into db1.tb_increment (c1) values(300);
insert into db1.tb_bigtable (c1,c2,c3,c4) values(repeat('A',65536),repeat('B',65536),repeat('C',65536),repeat('D',65536));
insert into test.tb_table_gencol(pk1,pk2,c1,c2) values(300,'300',repeat('A',65536),repeat('B',65536));
insert into test.tablegencol(c1,USER_ID,ADDRESS) values(300, repeat('A',32),repeat('B',256));
insert into test.table_hash(c1, c2) values(300, 300);
insert into test.table_range(c1, c2) values(300, 300);
insert into test.table_hash_range(c1, c2) values(300, 300);
insert into test.table_range_hash(c1, c2) values(300, 300);
update db1.tb_normal set c1=1 where pk = 1;
update db1.tb_increment set c1 = 1 where pk = 1;
insert into db1.tb_bigtable (c1,c2,c3,c4) values(repeat('A',65536),repeat('B',65536),repeat('C',65536),repeat('D',65536));
replace into test.tb_table_gencol(pk1,pk2,c1,c2) values(1,'1',repeat('A',65536),repeat('B',65536));
replace into test.tablegencol(c1,USER_ID,ADDRESS) values(1, repeat('A',32),repeat('B',256));
replace into test.table_hash(c1, c2) values(1, 1);
replace into test.table_range(c1, c2) values(1, 1);
replace into test.table_hash_range(c1, c2) values(1, 1);
replace into test.table_range_hash(c1, c2) values(1, 1);
update db1.tb_normal set c1=2 where pk = 2;
update db1.tb_increment set c1 = 2 where pk = 2;
insert into db1.tb_bigtable (c1,c2,c3,c4) values(repeat('A',65536),repeat('B',65536),repeat('C',65536),repeat('D',65536));
replace into test.tb_table_gencol(pk1,pk2,c1,c2) values(2,'2',repeat('A',65536),repeat('B',65536));
replace into test.tablegencol(c1,USER_ID,ADDRESS) values(2, repeat('A',32),repeat('B',256));
replace into test.table_hash(c1, c2) values(2, 2);
replace into test.table_range(c1, c2) values(2, 2);
replace into test.table_hash_range(c1, c2) values(2, 2);
replace into test.table_range_hash(c1, c2) values(2, 2);
update db1.tb_normal set c1=3 where pk = 3;
update db1.tb_increment set c1 = 3 where pk = 3;
insert into db1.tb_bigtable (c1,c2,c3,c4) values(repeat('A',65536),repeat('B',65536),repeat('C',65536),repeat('D',65536));
replace into test.tb_table_gencol(pk1,pk2,c1,c2) values(3,'3',repeat('A',65536),repeat('B',65536));
replace into test.tablegencol(c1,USER_ID,ADDRESS) values(3, repeat('A',32),repeat('B',256));
replace into test.table_hash(c1, c2) values(3, 3);
replace into test.table_range(c1, c2) values(3, 3);
replace into test.table_hash_range(c1, c2) values(3, 3);
replace into test.table_range_hash(c1, c2) values(3, 3);
update db1.tb_normal set c1=4 where pk = 4;
update db1.tb_increment set c1 = 4 where pk = 4;
insert into db1.tb_bigtable (c1,c2,c3,c4) values(repeat('A',65536),repeat('B',65536),repeat('C',65536),repeat('D',65536));
replace into test.tb_table_gencol(pk1,pk2,c1,c2) values(4,'4',repeat('A',65536),repeat('B',65536));
replace into test.tablegencol(c1,USER_ID,ADDRESS) values(4, repeat('A',32),repeat('B',256));
replace into test.table_hash(c1, c2) values(4, 4);
replace into test.table_range(c1, c2) values(4, 4);
replace into test.table_hash_range(c1, c2) values(4, 4);
replace into test.table_range_hash(c1, c2) values(4, 4);
update db1.tb_normal set c1=5 where pk = 5;
update db1.tb_increment set c1 = 5 where pk = 5;
insert into db1.tb_bigtable (c1,c2,c3,c4) values(repeat('A',65536),repeat('B',65536),repeat('C',65536),repeat('D',65536));
replace into test.tb_table_gencol(pk1,pk2,c1,c2) values(5,'5',repeat('A',65536),repeat('B',65536));
replace into test.tablegencol(c1,USER_ID,ADDRESS) values(5, repeat('A',32),repeat('B',256));
replace into test.table_hash(c1, c2) values(5, 5);
replace into test.table_range(c1, c2) values(5, 5);
replace into test.table_hash_range(c1, c2) values(5, 5);
replace into test.table_range_hash(c1, c2) values(5, 5);
update db1.tb_normal set c1=6 where pk = 6;
update db1.tb_increment set c1 = 6 where pk = 6;
insert into db1.tb_bigtable (c1,c2,c3,c4) values(repeat('A',65536),repeat('B',65536),repeat('C',65536),repeat('D',65536));
replace into test.tb_table_gencol(pk1,pk2,c1,c2) values(6,'6',repeat('A',65536),repeat('B',65536));
replace into test.tablegencol(c1,USER_ID,ADDRESS) values(6, repeat('A',32),repeat('B',256));
replace into test.table_hash(c1, c2) values(6, 6);
replace into test.table_range(c1, c2) values(6, 6);
replace into test.table_hash_range(c1, c2) values(6, 6);
replace into test.table_range_hash(c1, c2) values(6, 6);
update db1.tb_normal set c1=7 where pk = 7;
update db1.tb_increment set c1 = 7 where pk = 7;
insert into db1.tb_bigtable (c1,c2,c3,c4) values(repeat('A',65536),repeat('B',65536),repeat('C',65536),repeat('D',65536));
replace into test.tb_table_gencol(pk1,pk2,c1,c2) values(7,'7',repeat('A',65536),repeat('B',65536));
replace into test.tablegencol(c1,USER_ID,ADDRESS) values(7, repeat('A',32),repeat('B',256));
replace into test.table_hash(c1, c2) values(7, 7);
replace into test.table_range(c1, c2) values(7, 7);
replace into test.table_hash_range(c1, c2) values(7, 7);
replace into test.table_range_hash(c1, c2) values(7, 7);
update db1.tb_normal set c1=8 where pk = 8;
update db1.tb_increment set c1 = 8 where pk = 8;
insert into db1.tb_bigtable (c1,c2,c3,c4) values(repeat('A',65536),repeat('B',65536),repeat('C',65536),repeat('D',65536));
replace into test.tb_table_gencol(pk1,pk2,c1,c2) values(8,'8',repeat('A',65536),repeat('B',65536));
replace into test.tablegencol(c1,USER_ID,ADDRESS) values(8, repeat('A',32),repeat('B',256));
replace into test.table_hash(c1, c2) values(8, 8);
replace into test.table_range(c1, c2) values(8, 8);
replace into test.table_hash_range(c1, c2) values(8, 8);
replace into test.table_range_hash(c1, c2) values(8, 8);
update db1.tb_normal set c1=9 where pk = 9;
update db1.tb_increment set c1 = 9 where pk = 9;
insert into db1.tb_bigtable (c1,c2,c3,c4) values(repeat('A',65536),repeat('B',65536),repeat('C',65536),repeat('D',65536));
replace into test.tb_table_gencol(pk1,pk2,c1,c2) values(9,'9',repeat('A',65536),repeat('B',65536));
replace into test.tablegencol(c1,USER_ID,ADDRESS) values(9, repeat('A',32),repeat('B',256));
replace into test.table_hash(c1, c2) values(9, 9);
replace into test.table_range(c1, c2) values(9, 9);
replace into test.table_hash_range(c1, c2) values(9, 9);
replace into test.table_range_hash(c1, c2) values(9, 9);
update db1.tb_normal set c1=10 where pk = 10;
update db1.tb_increment set c1 = 10 where pk = 10;
insert into db1.tb_bigtable (c1,c2,c3,c4) values(repeat('A',65536),repeat('B',65536),repeat('C',65536),repeat('D',65536));
replace into test.tb_table_gencol(pk1,pk2,c1,c2) values(10,'10',repeat('A',65536),repeat('B',65536));
replace into test.tablegencol(c1,USER_ID,ADDRESS) values(10, repeat('A',32),repeat('B',256));
replace into test.table_hash(c1, c2) values(10, 10);
replace into test.table_range(c1, c2) values(10, 10);
replace into test.table_hash_range(c1, c2) values(10, 10);
replace into test.table_range_hash(c1, c2) values(10, 10);
update db1.tb_normal set c1=11 where pk = 11;
update db1.tb_increment set c1 = 11 where pk = 11;
insert into db1.tb_bigtable (c1,c2,c3,c4) values(repeat('A',65536),repeat('B',65536),repeat('C',65536),repeat('D',65536));
replace into test.tb_table_gencol(pk1,pk2,c1,c2) values(11,'11',repeat('A',65536),repeat('B',65536));
replace into test.tablegencol(c1,USER_ID,ADDRESS) values(11, repeat('A',32),repeat('B',256));
replace into test.table_hash(c1, c2) values(11, 11);
replace into test.table_range(c1, c2) values(11, 11);
replace into test.table_hash_range(c1, c2) values(11, 11);
replace into test.table_range_hash(c1, c2) values(11, 11);
update db1.tb_normal set c1=12 where pk = 12;
update db1.tb_increment set c1 = 12 where pk = 12;
insert into db1.tb_bigtable (c1,c2,c3,c4) values(repeat('A',65536),repeat('B',65536),repeat('C',65536),repeat('D',65536));
replace into test.tb_table_gencol(pk1,pk2,c1,c2) values(12,'12',repeat('A',65536),repeat('B',65536));
replace into test.tablegencol(c1,USER_ID,ADDRESS) values(12, repeat('A',32),repeat('B',256));
replace into test.table_hash(c1, c2) values(12, 12);
replace into test.table_range(c1, c2) values(12, 12);
replace into test.table_hash_range(c1, c2) values(12, 12);
replace into test.table_range_hash(c1, c2) values(12, 12);
update db1.tb_normal set c1=13 where pk = 13;
update db1.tb_increment set c1 = 13 where pk = 13;
insert into db1.tb_bigtable (c1,c2,c3,c4) values(repeat('A',65536),repeat('B',65536),repeat('C',65536),repeat('D',65536));
replace into test.tb_table_gencol(pk1,pk2,c1,c2) values(13,'13',repeat('A',65536),repeat('B',65536));
replace into test.tablegencol(c1,USER_ID,ADDRESS) values(13, repeat('A',32),repeat('B',256));
replace into test.table_hash(c1, c2) values(13, 13);
replace into test.table_range(c1, c2) values(13, 13);
replace into test.table_hash_range(c1, c2) values(13, 13);
replace into test.table_range_hash(c1, c2) values(13, 13);
update db1.tb_normal set c1=14 where pk = 14;
update db1.tb_increment set c1 = 14 where pk = 14;
insert into db1.tb_bigtable (c1,c2,c3,c4) values(repeat('A',65536),repeat('B',65536),repeat('C',65536),repeat('D',65536));
replace into test.tb_table_gencol(pk1,pk2,c1,c2) values(14,'14',repeat('A',65536),repeat('B',65536));
replace into test.tablegencol(c1,USER_ID,ADDRESS) values(14, repeat('A',32),repeat('B',256));
replace into test.table_hash(c1, c2) values(14, 14);
replace into test.table_range(c1, c2) values(14, 14);
replace into test.table_hash_range(c1, c2) values(14, 14);
replace into test.table_range_hash(c1, c2) values(14, 14);
update db1.tb_normal set c1=15 where pk = 15;
update db1.tb_increment set c1 = 15 where pk = 15;
insert into db1.tb_bigtable (c1,c2,c3,c4) values(repeat('A',65536),repeat('B',65536),repeat('C',65536),repeat('D',65536));
replace into test.tb_table_gencol(pk1,pk2,c1,c2) values(15,'15',repeat('A',65536),repeat('B',65536));
replace into test.tablegencol(c1,USER_ID,ADDRESS) values(15, repeat('A',32),repeat('B',256));
replace into test.table_hash(c1, c2) values(15, 15);
replace into test.table_range(c1, c2) values(15, 15);
replace into test.table_hash_range(c1, c2) values(15, 15);
replace into test.table_range_hash(c1, c2) values(15, 15);
update db1.tb_normal set c1=16 where pk = 16;
update db1.tb_increment set c1 = 16 where pk = 16;
insert into db1.tb_bigtable (c1,c2,c3,c4) values(repeat('A',65536),repeat('B',65536),repeat('C',65536),repeat('D',65536));
replace into test.tb_table_gencol(pk1,pk2,c1,c2) values(16,'16',repeat('A',65536),repeat('B',65536));
replace into test.tablegencol(c1,USER_ID,ADDRESS) values(16, repeat('A',32),repeat('B',256));
replace into test.table_hash(c1, c2) values(16, 16);
replace into test.table_range(c1, c2) values(16, 16);
replace into test.table_hash_range(c1, c2) values(16, 16);
replace into test.table_range_hash(c1, c2) values(16, 16);
update db1.tb_normal set c1=17 where pk = 17;
update db1.tb_increment set c1 = 17 where pk = 17;
insert into db1.tb_bigtable (c1,c2,c3,c4) values(repeat('A',65536),repeat('B',65536),repeat('C',65536),repeat('D',65536));
replace into test.tb_table_gencol(pk1,pk2,c1,c2) values(17,'17',repeat('A',65536),repeat('B',65536));
replace into test.tablegencol(c1,USER_ID,ADDRESS) values(17, repeat('A',32),repeat('B',256));
replace into test.table_hash(c1, c2) values(17, 17);
replace into test.table_range(c1, c2) values(17, 17);
replace into test.table_hash_range(c1, c2) values(17, 17);
replace into test.table_range_hash(c1, c2) values(17, 17);
update db1.tb_normal set c1=18 where pk = 18;
update db1.tb_increment set c1 = 18 where pk = 18;
insert into db1.tb_bigtable (c1,c2,c3,c4) values(repeat('A',65536),repeat('B',65536),repeat('C',65536),repeat('D',65536));
replace into test.tb_table_gencol(pk1,pk2,c1,c2) values(18,'18',repeat('A',65536),repeat('B',65536));
replace into test.tablegencol(c1,USER_ID,ADDRESS) values(18, repeat('A',32),repeat('B',256));
replace into test.table_hash(c1, c2) values(18, 18);
replace into test.table_range(c1, c2) values(18, 18);
replace into test.table_hash_range(c1, c2) values(18, 18);
replace into test.table_range_hash(c1, c2) values(18, 18);
update db1.tb_normal set c1=19 where pk = 19;
update db1.tb_increment set c1 = 19 where pk = 19;
insert into db1.tb_bigtable (c1,c2,c3,c4) values(repeat('A',65536),repeat('B',65536),repeat('C',65536),repeat('D',65536));
replace into test.tb_table_gencol(pk1,pk2,c1,c2) values(19,'19',repeat('A',65536),repeat('B',65536));
replace into test.tablegencol(c1,USER_ID,ADDRESS) values(19, repeat('A',32),repeat('B',256));
replace into test.table_hash(c1, c2) values(19, 19);
replace into test.table_range(c1, c2) values(19, 19);
replace into test.table_hash_range(c1, c2) values(19, 19);
replace into test.table_range_hash(c1, c2) values(19, 19);
update db1.tb_normal set c1=20 where pk = 20;
update db1.tb_increment set c1 = 20 where pk = 20;
insert into db1.tb_bigtable (c1,c2,c3,c4) values(repeat('A',65536),repeat('B',65536),repeat('C',65536),repeat('D',65536));
replace into test.tb_table_gencol(pk1,pk2,c1,c2) values(20,'20',repeat('A',65536),repeat('B',65536));
replace into test.tablegencol(c1,USER_ID,ADDRESS) values(20, repeat('A',32),repeat('B',256));
replace into test.table_hash(c1, c2) values(20, 20);
replace into test.table_range(c1, c2) values(20, 20);
replace into test.table_hash_range(c1, c2) values(20, 20);
replace into test.table_range_hash(c1, c2) values(20, 20);
update db1.tb_normal set c1=21 where pk = 21;
update db1.tb_increment set c1 = 21 where pk = 21;
insert into db1.tb_bigtable (c1,c2,c3,c4) values(repeat('A',65536),repeat('B',65536),repeat('C',65536),repeat('D',65536));
replace into test.tb_table_gencol(pk1,pk2,c1,c2) values(21,'21',repeat('A',65536),repeat('B',65536));
replace into test.tablegencol(c1,USER_ID,ADDRESS) values(21, repeat('A',32),repeat('B',256));
replace into test.table_hash(c1, c2) values(21, 21);
replace into test.table_range(c1, c2) values(21, 21);
replace into test.table_hash_range(c1, c2) values(21, 21);
replace into test.table_range_hash(c1, c2) values(21, 21);
update db1.tb_normal set c1=22 where pk = 22;
update db1.tb_increment set c1 = 22 where pk = 22;
insert into db1.tb_bigtable (c1,c2,c3,c4) values(repeat('A',65536),repeat('B',65536),repeat('C',65536),repeat('D',65536));
replace into test.tb_table_gencol(pk1,pk2,c1,c2) values(22,'22',repeat('A',65536),repeat('B',65536));
replace into test.tablegencol(c1,USER_ID,ADDRESS) values(22, repeat('A',32),repeat('B',256));
replace into test.table_hash(c1, c2) values(22, 22);
replace into test.table_range(c1, c2) values(22, 22);
replace into test.table_hash_range(c1, c2) values(22, 22);
replace into test.table_range_hash(c1, c2) values(22, 22);
update db1.tb_normal set c1=23 where pk = 23;
update db1.tb_increment set c1 = 23 where pk = 23;
insert into db1.tb_bigtable (c1,c2,c3,c4) values(repeat('A',65536),repeat('B',65536),repeat('C',65536),repeat('D',65536));
replace into test.tb_table_gencol(pk1,pk2,c1,c2) values(23,'23',repeat('A',65536),repeat('B',65536));
replace into test.tablegencol(c1,USER_ID,ADDRESS) values(23, repeat('A',32),repeat('B',256));
replace into test.table_hash(c1, c2) values(23, 23);
replace into test.table_range(c1, c2) values(23, 23);
replace into test.table_hash_range(c1, c2) values(23, 23);
replace into test.table_range_hash(c1, c2) values(23, 23);
update db1.tb_normal set c1=24 where pk = 24;
update db1.tb_increment set c1 = 24 where pk = 24;
insert into db1.tb_bigtable (c1,c2,c3,c4) values(repeat('A',65536),repeat('B',65536),repeat('C',65536),repeat('D',65536));
replace into test.tb_table_gencol(pk1,pk2,c1,c2) values(24,'24',repeat('A',65536),repeat('B',65536));
replace into test.tablegencol(c1,USER_ID,ADDRESS) values(24, repeat('A',32),repeat('B',256));
replace into test.table_hash(c1, c2) values(24, 24);
replace into test.table_range(c1, c2) values(24, 24);
replace into test.table_hash_range(c1, c2) values(24, 24);
replace into test.table_range_hash(c1, c2) values(24, 24);
update db1.tb_normal set c1=25 where pk = 25;
update db1.tb_increment set c1 = 25 where pk = 25;
insert into db1.tb_bigtable (c1,c2,c3,c4) values(repeat('A',65536),repeat('B',65536),repeat('C',65536),repeat('D',65536));
replace into test.tb_table_gencol(pk1,pk2,c1,c2) values(25,'25',repeat('A',65536),repeat('B',65536));
replace into test.tablegencol(c1,USER_ID,ADDRESS) values(25, repeat('A',32),repeat('B',256));
replace into test.table_hash(c1, c2) values(25, 25);
replace into test.table_range(c1, c2) values(25, 25);
replace into test.table_hash_range(c1, c2) values(25, 25);
replace into test.table_range_hash(c1, c2) values(25, 25);
update db1.tb_normal set c1=26 where pk = 26;
update db1.tb_increment set c1 = 26 where pk = 26;
insert into db1.tb_bigtable (c1,c2,c3,c4) values(repeat('A',65536),repeat('B',65536),repeat('C',65536),repeat('D',65536));
replace into test.tb_table_gencol(pk1,pk2,c1,c2) values(26,'26',repeat('A',65536),repeat('B',65536));
replace into test.tablegencol(c1,USER_ID,ADDRESS) values(26, repeat('A',32),repeat('B',256));
replace into test.table_hash(c1, c2) values(26, 26);
replace into test.table_range(c1, c2) values(26, 26);
replace into test.table_hash_range(c1, c2) values(26, 26);
replace into test.table_range_hash(c1, c2) values(26, 26);
update db1.tb_normal set c1=27 where pk = 27;
update db1.tb_increment set c1 = 27 where pk = 27;
insert into db1.tb_bigtable (c1,c2,c3,c4) values(repeat('A',65536),repeat('B',65536),repeat('C',65536),repeat('D',65536));
replace into test.tb_table_gencol(pk1,pk2,c1,c2) values(27,'27',repeat('A',65536),repeat('B',65536));
replace into test.tablegencol(c1,USER_ID,ADDRESS) values(27, repeat('A',32),repeat('B',256));
replace into test.table_hash(c1, c2) values(27, 27);
replace into test.table_range(c1, c2) values(27, 27);
replace into test.table_hash_range(c1, c2) values(27, 27);
replace into test.table_range_hash(c1, c2) values(27, 27);
update db1.tb_normal set c1=28 where pk = 28;
update db1.tb_increment set c1 = 28 where pk = 28;
insert into db1.tb_bigtable (c1,c2,c3,c4) values(repeat('A',65536),repeat('B',65536),repeat('C',65536),repeat('D',65536));
replace into test.tb_table_gencol(pk1,pk2,c1,c2) values(28,'28',repeat('A',65536),repeat('B',65536));
replace into test.tablegencol(c1,USER_ID,ADDRESS) values(28, repeat('A',32),repeat('B',256));
replace into test.table_hash(c1, c2) values(28, 28);
replace into test.table_range(c1, c2) values(28, 28);
replace into test.table_hash_range(c1, c2) values(28, 28);
replace into test.table_range_hash(c1, c2) values(28, 28);
update db1.tb_normal set c1=29 where pk = 29;
update db1.tb_increment set c1 = 29 where pk = 29;
insert into db1.tb_bigtable (c1,c2,c3,c4) values(repeat('A',65536),repeat('B',65536),repeat('C',65536),repeat('D',65536));
replace into test.tb_table_gencol(pk1,pk2,c1,c2) values(29,'29',repeat('A',65536),repeat('B',65536));
replace into test.tablegencol(c1,USER_ID,ADDRESS) values(29, repeat('A',32),repeat('B',256));
replace into test.table_hash(c1, c2) values(29, 29);
replace into test.table_range(c1, c2) values(29, 29);
replace into test.table_hash_range(c1, c2) values(29, 29);
replace into test.table_range_hash(c1, c2) values(29, 29);
update db1.tb_normal set c1=30 where pk = 30;
update db1.tb_increment set c1 = 30 where pk = 30;
insert into db1.tb_bigtable (c1,c2,c3,c4) values(repeat('A',65536),repeat('B',65536),repeat('C',65536),repeat('D',65536));
replace into test.tb_table_gencol(pk1,pk2,c1,c2) values(30,'30',repeat('A',65536),repeat('B',65536));
replace into test.tablegencol(c1,USER_ID,ADDRESS) values(30, repeat('A',32),repeat('B',256));
replace into test.table_hash(c1, c2) values(30, 30);
replace into test.table_range(c1, c2) values(30, 30);
replace into test.table_hash_range(c1, c2) values(30, 30);
replace into test.table_range_hash(c1, c2) values(30, 30);
update db1.tb_normal set c1=31 where pk = 31;
update db1.tb_increment set c1 = 31 where pk = 31;
insert into db1.tb_bigtable (c1,c2,c3,c4) values(repeat('A',65536),repeat('B',65536),repeat('C',65536),repeat('D',65536));
replace into test.tb_table_gencol(pk1,pk2,c1,c2) values(31,'31',repeat('A',65536),repeat('B',65536));
replace into test.tablegencol(c1,USER_ID,ADDRESS) values(31, repeat('A',32),repeat('B',256));
replace into test.table_hash(c1, c2) values(31, 31);
replace into test.table_range(c1, c2) values(31, 31);
replace into test.table_hash_range(c1, c2) values(31, 31);
replace into test.table_range_hash(c1, c2) values(31, 31);
update db1.tb_normal set c1=32 where pk = 32;
update db1.tb_increment set c1 = 32 where pk = 32;
insert into db1.tb_bigtable (c1,c2,c3,c4) values(repeat('A',65536),repeat('B',65536),repeat('C',65536),repeat('D',65536));
replace into test.tb_table_gencol(pk1,pk2,c1,c2) values(32,'32',repeat('A',65536),repeat('B',65536));
replace into test.tablegencol(c1,USER_ID,ADDRESS) values(32, repeat('A',32),repeat('B',256));
replace into test.table_hash(c1, c2) values(32, 32);
replace into test.table_range(c1, c2) values(32, 32);
replace into test.table_hash_range(c1, c2) values(32, 32);
replace into test.table_range_hash(c1, c2) values(32, 32);
update db1.tb_normal set c1=33 where pk = 33;
update db1.tb_increment set c1 = 33 where pk = 33;
insert into db1.tb_bigtable (c1,c2,c3,c4) values(repeat('A',65536),repeat('B',65536),repeat('C',65536),repeat('D',65536));
replace into test.tb_table_gencol(pk1,pk2,c1,c2) values(33,'33',repeat('A',65536),repeat('B',65536));
replace into test.tablegencol(c1,USER_ID,ADDRESS) values(33, repeat('A',32),repeat('B',256));
replace into test.table_hash(c1, c2) values(33, 33);
replace into test.table_range(c1, c2) values(33, 33);
replace into test.table_hash_range(c1, c2) values(33, 33);
replace into test.table_range_hash(c1, c2) values(33, 33);
update db1.tb_normal set c1=34 where pk = 34;
update db1.tb_increment set c1 = 34 where pk = 34;
insert into db1.tb_bigtable (c1,c2,c3,c4) values(repeat('A',65536),repeat('B',65536),repeat('C',65536),repeat('D',65536));
replace into test.tb_table_gencol(pk1,pk2,c1,c2) values(34,'34',repeat('A',65536),repeat('B',65536));
replace into test.tablegencol(c1,USER_ID,ADDRESS) values(34, repeat('A',32),repeat('B',256));
replace into test.table_hash(c1, c2) values(34, 34);
replace into test.table_range(c1, c2) values(34, 34);
replace into test.table_hash_range(c1, c2) values(34, 34);
replace into test.table_range_hash(c1, c2) values(34, 34);
update db1.tb_normal set c1=35 where pk = 35;
update db1.tb_increment set c1 = 35 where pk = 35;
insert into db1.tb_bigtable (c1,c2,c3,c4) values(repeat('A',65536),repeat('B',65536),repeat('C',65536),repeat('D',65536));
replace into test.tb_table_gencol(pk1,pk2,c1,c2) values(35,'35',repeat('A',65536),repeat('B',65536));
replace into test.tablegencol(c1,USER_ID,ADDRESS) values(35, repeat('A',32),repeat('B',256));
replace into test.table_hash(c1, c2) values(35, 35);
replace into test.table_range(c1, c2) values(35, 35);
replace into test.table_hash_range(c1, c2) values(35, 35);
replace into test.table_range_hash(c1, c2) values(35, 35);
update db1.tb_normal set c1=36 where pk = 36;
update db1.tb_increment set c1 = 36 where pk = 36;
insert into db1.tb_bigtable (c1,c2,c3,c4) values(repeat('A',65536),repeat('B',65536),repeat('C',65536),repeat('D',65536));
replace into test.tb_table_gencol(pk1,pk2,c1,c2) values(36,'36',repeat('A',65536),repeat('B',65536));
replace into test.tablegencol(c1,USER_ID,ADDRESS) values(36, repeat('A',32),repeat('B',256));
replace into test.table_hash(c1, c2) values(36, 36);
replace into test.table_range(c1, c2) values(36, 36);
replace into test.table_hash_range(c1, c2) values(36, 36);
replace into test.table_range_hash(c1, c2) values(36, 36);
update db1.tb_normal set c1=37 where pk = 37;
update db1.tb_increment set c1 = 37 where pk = 37;
insert into db1.tb_bigtable (c1,c2,c3,c4) values(repeat('A',65536),repeat('B',65536),repeat('C',65536),repeat('D',65536));
replace into test.tb_table_gencol(pk1,pk2,c1,c2) values(37,'37',repeat('A',65536),repeat('B',65536));
replace into test.tablegencol(c1,USER_ID,ADDRESS) values(37, repeat('A',32),repeat('B',256));
replace into test.table_hash(c1, c2) values(37, 37);
replace into test.table_range(c1, c2) values(37, 37);
replace into test.table_hash_range(c1, c2) values(37, 37);
replace into test.table_range_hash(c1, c2) values(37, 37);
update db1.tb_normal set c1=38 where pk = 38;
update db1.tb_increment set c1 = 38 where pk = 38;
insert into db1.tb_bigtable (c1,c2,c3,c4) values(repeat('A',65536),repeat('B',65536),repeat('C',65536),repeat('D',65536));
replace into test.tb_table_gencol(pk1,pk2,c1,c2) values(38,'38',repeat('A',65536),repeat('B',65536));
replace into test.tablegencol(c1,USER_ID,ADDRESS) values(38, repeat('A',32),repeat('B',256));
replace into test.table_hash(c1, c2) values(38, 38);
replace into test.table_range(c1, c2) values(38, 38);
replace into test.table_hash_range(c1, c2) values(38, 38);
replace into test.table_range_hash(c1, c2) values(38, 38);
update db1.tb_normal set c1=39 where pk = 39;
update db1.tb_increment set c1 = 39 where pk = 39;
insert into db1.tb_bigtable (c1,c2,c3,c4) values(repeat('A',65536),repeat('B',65536),repeat('C',65536),repeat('D',65536));
replace into test.tb_table_gencol(pk1,pk2,c1,c2) values(39,'39',repeat('A',65536),repeat('B',65536));
replace into test.tablegencol(c1,USER_ID,ADDRESS) values(39, repeat('A',32),repeat('B',256));
replace into test.table_hash(c1, c2) values(39, 39);
replace into test.table_range(c1, c2) values(39, 39);
replace into test.table_hash_range(c1, c2) values(39, 39);
replace into test.table_range_hash(c1, c2) values(39, 39);
update db1.tb_normal set c1=40 where pk = 40;
update db1.tb_increment set c1 = 40 where pk = 40;
insert into db1.tb_bigtable (c1,c2,c3,c4) values(repeat('A',65536),repeat('B',65536),repeat('C',65536),repeat('D',65536));
replace into test.tb_table_gencol(pk1,pk2,c1,c2) values(40,'40',repeat('A',65536),repeat('B',65536));
replace into test.tablegencol(c1,USER_ID,ADDRESS) values(40, repeat('A',32),repeat('B',256));
replace into test.table_hash(c1, c2) values(40, 40);
replace into test.table_range(c1, c2) values(40, 40);
replace into test.table_hash_range(c1, c2) values(40, 40);
replace into test.table_range_hash(c1, c2) values(40, 40);
update db1.tb_normal set c1=41 where pk = 41;
update db1.tb_increment set c1 = 41 where pk = 41;
insert into db1.tb_bigtable (c1,c2,c3,c4) values(repeat('A',65536),repeat('B',65536),repeat('C',65536),repeat('D',65536));
replace into test.tb_table_gencol(pk1,pk2,c1,c2) values(41,'41',repeat('A',65536),repeat('B',65536));
replace into test.tablegencol(c1,USER_ID,ADDRESS) values(41, repeat('A',32),repeat('B',256));
replace into test.table_hash(c1, c2) values(41, 41);
replace into test.table_range(c1, c2) values(41, 41);
replace into test.table_hash_range(c1, c2) values(41, 41);
replace into test.table_range_hash(c1, c2) values(41, 41);
update db1.tb_normal set c1=42 where pk = 42;
update db1.tb_increment set c1 = 42 where pk = 42;
insert into db1.tb_bigtable (c1,c2,c3,c4) values(repeat('A',65536),repeat('B',65536),repeat('C',65536),repeat('D',65536));
replace into test.tb_table_gencol(pk1,pk2,c1,c2) values(42,'42',repeat('A',65536),repeat('B',65536));
replace into test.tablegencol(c1,USER_ID,ADDRESS) values(42, repeat('A',32),repeat('B',256));
replace into test.table_hash(c1, c2) values(42, 42);
replace into test.table_range(c1, c2) values(42, 42);
replace into test.table_hash_range(c1, c2) values(42, 42);
replace into test.table_range_hash(c1, c2) values(42, 42);
update db1.tb_normal set c1=43 where pk = 43;
update db1.tb_increment set c1 = 43 where pk = 43;
insert into db1.tb_bigtable (c1,c2,c3,c4) values(repeat('A',65536),repeat('B',65536),repeat('C',65536),repeat('D',65536));
replace into test.tb_table_gencol(pk1,pk2,c1,c2) values(43,'43',repeat('A',65536),repeat('B',65536));
replace into test.tablegencol(c1,USER_ID,ADDRESS) values(43, repeat('A',32),repeat('B',256));
replace into test.table_hash(c1, c2) values(43, 43);
replace into test.table_range(c1, c2) values(43, 43);
replace into test.table_hash_range(c1, c2) values(43, 43);
replace into test.table_range_hash(c1, c2) values(43, 43);
update db1.tb_normal set c1=44 where pk = 44;
update db1.tb_increment set c1 = 44 where pk = 44;
insert into db1.tb_bigtable (c1,c2,c3,c4) values(repeat('A',65536),repeat('B',65536),repeat('C',65536),repeat('D',65536));
replace into test.tb_table_gencol(pk1,pk2,c1,c2) values(44,'44',repeat('A',65536),repeat('B',65536));
replace into test.tablegencol(c1,USER_ID,ADDRESS) values(44, repeat('A',32),repeat('B',256));
replace into test.table_hash(c1, c2) values(44, 44);
replace into test.table_range(c1, c2) values(44, 44);
replace into test.table_hash_range(c1, c2) values(44, 44);
replace into test.table_range_hash(c1, c2) values(44, 44);
update db1.tb_normal set c1=45 where pk = 45;
update db1.tb_increment set c1 = 45 where pk = 45;
insert into db1.tb_bigtable (c1,c2,c3,c4) values(repeat('A',65536),repeat('B',65536),repeat('C',65536),repeat('D',65536));
replace into test.tb_table_gencol(pk1,pk2,c1,c2) values(45,'45',repeat('A',65536),repeat('B',65536));
replace into test.tablegencol(c1,USER_ID,ADDRESS) values(45, repeat('A',32),repeat('B',256));
replace into test.table_hash(c1, c2) values(45, 45);
replace into test.table_range(c1, c2) values(45, 45);
replace into test.table_hash_range(c1, c2) values(45, 45);
replace into test.table_range_hash(c1, c2) values(45, 45);
update db1.tb_normal set c1=46 where pk = 46;
update db1.tb_increment set c1 = 46 where pk = 46;
insert into db1.tb_bigtable (c1,c2,c3,c4) values(repeat('A',65536),repeat('B',65536),repeat('C',65536),repeat('D',65536));
replace into test.tb_table_gencol(pk1,pk2,c1,c2) values(46,'46',repeat('A',65536),repeat('B',65536));
replace into test.tablegencol(c1,USER_ID,ADDRESS) values(46, repeat('A',32),repeat('B',256));
replace into test.table_hash(c1, c2) values(46, 46);
replace into test.table_range(c1, c2) values(46, 46);
replace into test.table_hash_range(c1, c2) values(46, 46);
replace into test.table_range_hash(c1, c2) values(46, 46);
update db1.tb_normal set c1=47 where pk = 47;
update db1.tb_increment set c1 = 47 where pk = 47;
insert into db1.tb_bigtable (c1,c2,c3,c4) values(repeat('A',65536),repeat('B',65536),repeat('C',65536),repeat('D',65536));
replace into test.tb_table_gencol(pk1,pk2,c1,c2) values(47,'47',repeat('A',65536),repeat('B',65536));
replace into test.tablegencol(c1,USER_ID,ADDRESS) values(47, repeat('A',32),repeat('B',256));
replace into test.table_hash(c1, c2) values(47, 47);
replace into test.table_range(c1, c2) values(47, 47);
replace into test.table_hash_range(c1, c2) values(47, 47);
replace into test.table_range_hash(c1, c2) values(47, 47);
update db1.tb_normal set c1=48 where pk = 48;
update db1.tb_increment set c1 = 48 where pk = 48;
insert into db1.tb_bigtable (c1,c2,c3,c4) values(repeat('A',65536),repeat('B',65536),repeat('C',65536),repeat('D',65536));
replace into test.tb_table_gencol(pk1,pk2,c1,c2) values(48,'48',repeat('A',65536),repeat('B',65536));
replace into test.tablegencol(c1,USER_ID,ADDRESS) values(48, repeat('A',32),repeat('B',256));
replace into test.table_hash(c1, c2) values(48, 48);
replace into test.table_range(c1, c2) values(48, 48);
replace into test.table_hash_range(c1, c2) values(48, 48);
replace into test.table_range_hash(c1, c2) values(48, 48);
update db1.tb_normal set c1=49 where pk = 49;
update db1.tb_increment set c1 = 49 where pk = 49;
insert into db1.tb_bigtable (c1,c2,c3,c4) values(repeat('A',65536),repeat('B',65536),repeat('C',65536),repeat('D',65536));
replace into test.tb_table_gencol(pk1,pk2,c1,c2) values(49,'49',repeat('A',65536),repeat('B',65536));
replace into test.tablegencol(c1,USER_ID,ADDRESS) values(49, repeat('A',32),repeat('B',256));
replace into test.table_hash(c1, c2) values(49, 49);
replace into test.table_range(c1, c2) values(49, 49);
replace into test.table_hash_range(c1, c2) values(49, 49);
replace into test.table_range_hash(c1, c2) values(49, 49);
update db1.tb_normal set c1=50 where pk = 50;
update db1.tb_increment set c1 = 50 where pk = 50;
insert into db1.tb_bigtable (c1,c2,c3,c4) values(repeat('A',65536),repeat('B',65536),repeat('C',65536),repeat('D',65536));
replace into test.tb_table_gencol(pk1,pk2,c1,c2) values(50,'50',repeat('A',65536),repeat('B',65536));
replace into test.tablegencol(c1,USER_ID,ADDRESS) values(50, repeat('A',32),repeat('B',256));
replace into test.table_hash(c1, c2) values(50, 50);
replace into test.table_range(c1, c2) values(50, 50);
replace into test.table_hash_range(c1, c2) values(50, 50);
replace into test.table_range_hash(c1, c2) values(50, 50);
update db1.tb_normal set c1=51 where pk = 51;
update db1.tb_increment set c1 = 51 where pk = 51;
insert into db1.tb_bigtable (c1,c2,c3,c4) values(repeat('A',65536),repeat('B',65536),repeat('C',65536),repeat('D',65536));
replace into test.tb_table_gencol(pk1,pk2,c1,c2) values(51,'51',repeat('A',65536),repeat('B',65536));
replace into test.tablegencol(c1,USER_ID,ADDRESS) values(51, repeat('A',32),repeat('B',256));
replace into test.table_hash(c1, c2) values(51, 51);
replace into test.table_range(c1, c2) values(51, 51);
replace into test.table_hash_range(c1, c2) values(51, 51);
replace into test.table_range_hash(c1, c2) values(51, 51);
update db1.tb_normal set c1=52 where pk = 52;
update db1.tb_increment set c1 = 52 where pk = 52;
insert into db1.tb_bigtable (c1,c2,c3,c4) values(repeat('A',65536),repeat('B',65536),repeat('C',65536),repeat('D',65536));
replace into test.tb_table_gencol(pk1,pk2,c1,c2) values(52,'52',repeat('A',65536),repeat('B',65536));
replace into test.tablegencol(c1,USER_ID,ADDRESS) values(52, repeat('A',32),repeat('B',256));
replace into test.table_hash(c1, c2) values(52, 52);
replace into test.table_range(c1, c2) values(52, 52);
replace into test.table_hash_range(c1, c2) values(52, 52);
replace into test.table_range_hash(c1, c2) values(52, 52);
update db1.tb_normal set c1=53 where pk = 53;
update db1.tb_increment set c1 = 53 where pk = 53;
insert into db1.tb_bigtable (c1,c2,c3,c4) values(repeat('A',65536),repeat('B',65536),repeat('C',65536),repeat('D',65536));
replace into test.tb_table_gencol(pk1,pk2,c1,c2) values(53,'53',repeat('A',65536),repeat('B',65536));
replace into test.tablegencol(c1,USER_ID,ADDRESS) values(53, repeat('A',32),repeat('B',256));
replace into test.table_hash(c1, c2) values(53, 53);
replace into test.table_range(c1, c2) values(53, 53);
replace into test.table_hash_range(c1, c2) values(53, 53);
replace into test.table_range_hash(c1, c2) values(53, 53);
update db1.tb_normal set c1=54 where pk = 54;
update db1.tb_increment set c1 = 54 where pk = 54;
insert into db1.tb_bigtable (c1,c2,c3,c4) values(repeat('A',65536),repeat('B',65536),repeat('C',65536),repeat('D',65536));
replace into test.tb_table_gencol(pk1,pk2,c1,c2) values(54,'54',repeat('A',65536),repeat('B',65536));
replace into test.tablegencol(c1,USER_ID,ADDRESS) values(54, repeat('A',32),repeat('B',256));
replace into test.table_hash(c1, c2) values(54, 54);
replace into test.table_range(c1, c2) values(54, 54);
replace into test.table_hash_range(c1, c2) values(54, 54);
replace into test.table_range_hash(c1, c2) values(54, 54);
update db1.tb_normal set c1=55 where pk = 55;
update db1.tb_increment set c1 = 55 where pk = 55;
insert into db1.tb_bigtable (c1,c2,c3,c4) values(repeat('A',65536),repeat('B',65536),repeat('C',65536),repeat('D',65536));
replace into test.tb_table_gencol(pk1,pk2,c1,c2) values(55,'55',repeat('A',65536),repeat('B',65536));
replace into test.tablegencol(c1,USER_ID,ADDRESS) values(55, repeat('A',32),repeat('B',256));
replace into test.table_hash(c1, c2) values(55, 55);
replace into test.table_range(c1, c2) values(55, 55);
replace into test.table_hash_range(c1, c2) values(55, 55);
replace into test.table_range_hash(c1, c2) values(55, 55);
update db1.tb_normal set c1=56 where pk = 56;
update db1.tb_increment set c1 = 56 where pk = 56;
insert into db1.tb_bigtable (c1,c2,c3,c4) values(repeat('A',65536),repeat('B',65536),repeat('C',65536),repeat('D',65536));
replace into test.tb_table_gencol(pk1,pk2,c1,c2) values(56,'56',repeat('A',65536),repeat('B',65536));
replace into test.tablegencol(c1,USER_ID,ADDRESS) values(56, repeat('A',32),repeat('B',256));
replace into test.table_hash(c1, c2) values(56, 56);
replace into test.table_range(c1, c2) values(56, 56);
replace into test.table_hash_range(c1, c2) values(56, 56);
replace into test.table_range_hash(c1, c2) values(56, 56);
update db1.tb_normal set c1=57 where pk = 57;
update db1.tb_increment set c1 = 57 where pk = 57;
insert into db1.tb_bigtable (c1,c2,c3,c4) values(repeat('A',65536),repeat('B',65536),repeat('C',65536),repeat('D',65536));
replace into test.tb_table_gencol(pk1,pk2,c1,c2) values(57,'57',repeat('A',65536),repeat('B',65536));
replace into test.tablegencol(c1,USER_ID,ADDRESS) values(57, repeat('A',32),repeat('B',256));
replace into test.table_hash(c1, c2) values(57, 57);
replace into test.table_range(c1, c2) values(57, 57);
replace into test.table_hash_range(c1, c2) values(57, 57);
replace into test.table_range_hash(c1, c2) values(57, 57);
update db1.tb_normal set c1=58 where pk = 58;
update db1.tb_increment set c1 = 58 where pk = 58;
insert into db1.tb_bigtable (c1,c2,c3,c4) values(repeat('A',65536),repeat('B',65536),repeat('C',65536),repeat('D',65536));
replace into test.tb_table_gencol(pk1,pk2,c1,c2) values(58,'58',repeat('A',65536),repeat('B',65536));
replace into test.tablegencol(c1,USER_ID,ADDRESS) values(58, repeat('A',32),repeat('B',256));
replace into test.table_hash(c1, c2) values(58, 58);
replace into test.table_range(c1, c2) values(58, 58);
replace into test.table_hash_range(c1, c2) values(58, 58);
replace into test.table_range_hash(c1, c2) values(58, 58);
update db1.tb_normal set c1=59 where pk = 59;
update db1.tb_increment set c1 = 59 where pk = 59;
insert into db1.tb_bigtable (c1,c2,c3,c4) values(repeat('A',65536),repeat('B',65536),repeat('C',65536),repeat('D',65536));
replace into test.tb_table_gencol(pk1,pk2,c1,c2) values(59,'59',repeat('A',65536),repeat('B',65536));
replace into test.tablegencol(c1,USER_ID,ADDRESS) values(59, repeat('A',32),repeat('B',256));
replace into test.table_hash(c1, c2) values(59, 59);
replace into test.table_range(c1, c2) values(59, 59);
replace into test.table_hash_range(c1, c2) values(59, 59);
replace into test.table_range_hash(c1, c2) values(59, 59);
update db1.tb_normal set c1=60 where pk = 60;
update db1.tb_increment set c1 = 60 where pk = 60;
insert into db1.tb_bigtable (c1,c2,c3,c4) values(repeat('A',65536),repeat('B',65536),repeat('C',65536),repeat('D',65536));
replace into test.tb_table_gencol(pk1,pk2,c1,c2) values(60,'60',repeat('A',65536),repeat('B',65536));
replace into test.tablegencol(c1,USER_ID,ADDRESS) values(60, repeat('A',32),repeat('B',256));
replace into test.table_hash(c1, c2) values(60, 60);
replace into test.table_range(c1, c2) values(60, 60);
replace into test.table_hash_range(c1, c2) values(60, 60);
replace into test.table_range_hash(c1, c2) values(60, 60);
update db1.tb_normal set c1=61 where pk = 61;
update db1.tb_increment set c1 = 61 where pk = 61;
insert into db1.tb_bigtable (c1,c2,c3,c4) values(repeat('A',65536),repeat('B',65536),repeat('C',65536),repeat('D',65536));
replace into test.tb_table_gencol(pk1,pk2,c1,c2) values(61,'61',repeat('A',65536),repeat('B',65536));
replace into test.tablegencol(c1,USER_ID,ADDRESS) values(61, repeat('A',32),repeat('B',256));
replace into test.table_hash(c1, c2) values(61, 61);
replace into test.table_range(c1, c2) values(61, 61);
replace into test.table_hash_range(c1, c2) values(61, 61);
replace into test.table_range_hash(c1, c2) values(61, 61);
update db1.tb_normal set c1=62 where pk = 62;
update db1.tb_increment set c1 = 62 where pk = 62;
insert into db1.tb_bigtable (c1,c2,c3,c4) values(repeat('A',65536),repeat('B',65536),repeat('C',65536),repeat('D',65536));
replace into test.tb_table_gencol(pk1,pk2,c1,c2) values(62,'62',repeat('A',65536),repeat('B',65536));
replace into test.tablegencol(c1,USER_ID,ADDRESS) values(62, repeat('A',32),repeat('B',256));
replace into test.table_hash(c1, c2) values(62, 62);
replace into test.table_range(c1, c2) values(62, 62);
replace into test.table_hash_range(c1, c2) values(62, 62);
replace into test.table_range_hash(c1, c2) values(62, 62);
update db1.tb_normal set c1=63 where pk = 63;
update db1.tb_increment set c1 = 63 where pk = 63;
insert into db1.tb_bigtable (c1,c2,c3,c4) values(repeat('A',65536),repeat('B',65536),repeat('C',65536),repeat('D',65536));
replace into test.tb_table_gencol(pk1,pk2,c1,c2) values(63,'63',repeat('A',65536),repeat('B',65536));
replace into test.tablegencol(c1,USER_ID,ADDRESS) values(63, repeat('A',32),repeat('B',256));
replace into test.table_hash(c1, c2) values(63, 63);
replace into test.table_range(c1, c2) values(63, 63);
replace into test.table_hash_range(c1, c2) values(63, 63);
replace into test.table_range_hash(c1, c2) values(63, 63);
update db1.tb_normal set c1=64 where pk = 64;
update db1.tb_increment set c1 = 64 where pk = 64;
insert into db1.tb_bigtable (c1,c2,c3,c4) values(repeat('A',65536),repeat('B',65536),repeat('C',65536),repeat('D',65536));
replace into test.tb_table_gencol(pk1,pk2,c1,c2) values(64,'64',repeat('A',65536),repeat('B',65536));
replace into test.tablegencol(c1,USER_ID,ADDRESS) values(64, repeat('A',32),repeat('B',256));
replace into test.table_hash(c1, c2) values(64, 64);
replace into test.table_range(c1, c2) values(64, 64);
replace into test.table_hash_range(c1, c2) values(64, 64);
replace into test.table_range_hash(c1, c2) values(64, 64);
update db1.tb_normal set c1=65 where pk = 65;
update db1.tb_increment set c1 = 65 where pk = 65;
insert into db1.tb_bigtable (c1,c2,c3,c4) values(repeat('A',65536),repeat('B',65536),repeat('C',65536),repeat('D',65536));
replace into test.tb_table_gencol(pk1,pk2,c1,c2) values(65,'65',repeat('A',65536),repeat('B',65536));
replace into test.tablegencol(c1,USER_ID,ADDRESS) values(65, repeat('A',32),repeat('B',256));
replace into test.table_hash(c1, c2) values(65, 65);
replace into test.table_range(c1, c2) values(65, 65);
replace into test.table_hash_range(c1, c2) values(65, 65);
replace into test.table_range_hash(c1, c2) values(65, 65);
update db1.tb_normal set c1=66 where pk = 66;
update db1.tb_increment set c1 = 66 where pk = 66;
insert into db1.tb_bigtable (c1,c2,c3,c4) values(repeat('A',65536),repeat('B',65536),repeat('C',65536),repeat('D',65536));
replace into test.tb_table_gencol(pk1,pk2,c1,c2) values(66,'66',repeat('A',65536),repeat('B',65536));
replace into test.tablegencol(c1,USER_ID,ADDRESS) values(66, repeat('A',32),repeat('B',256));
replace into test.table_hash(c1, c2) values(66, 66);
replace into test.table_range(c1, c2) values(66, 66);
replace into test.table_hash_range(c1, c2) values(66, 66);
replace into test.table_range_hash(c1, c2) values(66, 66);
update db1.tb_normal set c1=67 where pk = 67;
update db1.tb_increment set c1 = 67 where pk = 67;
insert into db1.tb_bigtable (c1,c2,c3,c4) values(repeat('A',65536),repeat('B',65536),repeat('C',65536),repeat('D',65536));
replace into test.tb_table_gencol(pk1,pk2,c1,c2) values(67,'67',repeat('A',65536),repeat('B',65536));
replace into test.tablegencol(c1,USER_ID,ADDRESS) values(67, repeat('A',32),repeat('B',256));
replace into test.table_hash(c1, c2) values(67, 67);
replace into test.table_range(c1, c2) values(67, 67);
replace into test.table_hash_range(c1, c2) values(67, 67);
replace into test.table_range_hash(c1, c2) values(67, 67);
update db1.tb_normal set c1=68 where pk = 68;
update db1.tb_increment set c1 = 68 where pk = 68;
insert into db1.tb_bigtable (c1,c2,c3,c4) values(repeat('A',65536),repeat('B',65536),repeat('C',65536),repeat('D',65536));
replace into test.tb_table_gencol(pk1,pk2,c1,c2) values(68,'68',repeat('A',65536),repeat('B',65536));
replace into test.tablegencol(c1,USER_ID,ADDRESS) values(68, repeat('A',32),repeat('B',256));
replace into test.table_hash(c1, c2) values(68, 68);
replace into test.table_range(c1, c2) values(68, 68);
replace into test.table_hash_range(c1, c2) values(68, 68);
replace into test.table_range_hash(c1, c2) values(68, 68);
update db1.tb_normal set c1=69 where pk = 69;
update db1.tb_increment set c1 = 69 where pk = 69;
insert into db1.tb_bigtable (c1,c2,c3,c4) values(repeat('A',65536),repeat('B',65536),repeat('C',65536),repeat('D',65536));
replace into test.tb_table_gencol(pk1,pk2,c1,c2) values(69,'69',repeat('A',65536),repeat('B',65536));
replace into test.tablegencol(c1,USER_ID,ADDRESS) values(69, repeat('A',32),repeat('B',256));
replace into test.table_hash(c1, c2) values(69, 69);
replace into test.table_range(c1, c2) values(69, 69);
replace into test.table_hash_range(c1, c2) values(69, 69);
replace into test.table_range_hash(c1, c2) values(69, 69);
update db1.tb_normal set c1=70 where pk = 70;
update db1.tb_increment set c1 = 70 where pk = 70;
insert into db1.tb_bigtable (c1,c2,c3,c4) values(repeat('A',65536),repeat('B',65536),repeat('C',65536),repeat('D',65536));
replace into test.tb_table_gencol(pk1,pk2,c1,c2) values(70,'70',repeat('A',65536),repeat('B',65536));
replace into test.tablegencol(c1,USER_ID,ADDRESS) values(70, repeat('A',32),repeat('B',256));
replace into test.table_hash(c1, c2) values(70, 70);
replace into test.table_range(c1, c2) values(70, 70);
replace into test.table_hash_range(c1, c2) values(70, 70);
replace into test.table_range_hash(c1, c2) values(70, 70);
update db1.tb_normal set c1=71 where pk = 71;
update db1.tb_increment set c1 = 71 where pk = 71;
insert into db1.tb_bigtable (c1,c2,c3,c4) values(repeat('A',65536),repeat('B',65536),repeat('C',65536),repeat('D',65536));
replace into test.tb_table_gencol(pk1,pk2,c1,c2) values(71,'71',repeat('A',65536),repeat('B',65536));
replace into test.tablegencol(c1,USER_ID,ADDRESS) values(71, repeat('A',32),repeat('B',256));
replace into test.table_hash(c1, c2) values(71, 71);
replace into test.table_range(c1, c2) values(71, 71);
replace into test.table_hash_range(c1, c2) values(71, 71);
replace into test.table_range_hash(c1, c2) values(71, 71);
update db1.tb_normal set c1=72 where pk = 72;
update db1.tb_increment set c1 = 72 where pk = 72;
insert into db1.tb_bigtable (c1,c2,c3,c4) values(repeat('A',65536),repeat('B',65536),repeat('C',65536),repeat('D',65536));
replace into test.tb_table_gencol(pk1,pk2,c1,c2) values(72,'72',repeat('A',65536),repeat('B',65536));
replace into test.tablegencol(c1,USER_ID,ADDRESS) values(72, repeat('A',32),repeat('B',256));
replace into test.table_hash(c1, c2) values(72, 72);
replace into test.table_range(c1, c2) values(72, 72);
replace into test.table_hash_range(c1, c2) values(72, 72);
replace into test.table_range_hash(c1, c2) values(72, 72);
update db1.tb_normal set c1=73 where pk = 73;
update db1.tb_increment set c1 = 73 where pk = 73;
insert into db1.tb_bigtable (c1,c2,c3,c4) values(repeat('A',65536),repeat('B',65536),repeat('C',65536),repeat('D',65536));
replace into test.tb_table_gencol(pk1,pk2,c1,c2) values(73,'73',repeat('A',65536),repeat('B',65536));
replace into test.tablegencol(c1,USER_ID,ADDRESS) values(73, repeat('A',32),repeat('B',256));
replace into test.table_hash(c1, c2) values(73, 73);
replace into test.table_range(c1, c2) values(73, 73);
replace into test.table_hash_range(c1, c2) values(73, 73);
replace into test.table_range_hash(c1, c2) values(73, 73);
update db1.tb_normal set c1=74 where pk = 74;
update db1.tb_increment set c1 = 74 where pk = 74;
insert into db1.tb_bigtable (c1,c2,c3,c4) values(repeat('A',65536),repeat('B',65536),repeat('C',65536),repeat('D',65536));
replace into test.tb_table_gencol(pk1,pk2,c1,c2) values(74,'74',repeat('A',65536),repeat('B',65536));
replace into test.tablegencol(c1,USER_ID,ADDRESS) values(74, repeat('A',32),repeat('B',256));
replace into test.table_hash(c1, c2) values(74, 74);
replace into test.table_range(c1, c2) values(74, 74);
replace into test.table_hash_range(c1, c2) values(74, 74);
replace into test.table_range_hash(c1, c2) values(74, 74);
update db1.tb_normal set c1=75 where pk = 75;
update db1.tb_increment set c1 = 75 where pk = 75;
insert into db1.tb_bigtable (c1,c2,c3,c4) values(repeat('A',65536),repeat('B',65536),repeat('C',65536),repeat('D',65536));
replace into test.tb_table_gencol(pk1,pk2,c1,c2) values(75,'75',repeat('A',65536),repeat('B',65536));
replace into test.tablegencol(c1,USER_ID,ADDRESS) values(75, repeat('A',32),repeat('B',256));
replace into test.table_hash(c1, c2) values(75, 75);
replace into test.table_range(c1, c2) values(75, 75);
replace into test.table_hash_range(c1, c2) values(75, 75);
replace into test.table_range_hash(c1, c2) values(75, 75);
update db1.tb_normal set c1=76 where pk = 76;
update db1.tb_increment set c1 = 76 where pk = 76;
insert into db1.tb_bigtable (c1,c2,c3,c4) values(repeat('A',65536),repeat('B',65536),repeat('C',65536),repeat('D',65536));
replace into test.tb_table_gencol(pk1,pk2,c1,c2) values(76,'76',repeat('A',65536),repeat('B',65536));
replace into test.tablegencol(c1,USER_ID,ADDRESS) values(76, repeat('A',32),repeat('B',256));
replace into test.table_hash(c1, c2) values(76, 76);
replace into test.table_range(c1, c2) values(76, 76);
replace into test.table_hash_range(c1, c2) values(76, 76);
replace into test.table_range_hash(c1, c2) values(76, 76);
update db1.tb_normal set c1=77 where pk = 77;
update db1.tb_increment set c1 = 77 where pk = 77;
insert into db1.tb_bigtable (c1,c2,c3,c4) values(repeat('A',65536),repeat('B',65536),repeat('C',65536),repeat('D',65536));
replace into test.tb_table_gencol(pk1,pk2,c1,c2) values(77,'77',repeat('A',65536),repeat('B',65536));
replace into test.tablegencol(c1,USER_ID,ADDRESS) values(77, repeat('A',32),repeat('B',256));
replace into test.table_hash(c1, c2) values(77, 77);
replace into test.table_range(c1, c2) values(77, 77);
replace into test.table_hash_range(c1, c2) values(77, 77);
replace into test.table_range_hash(c1, c2) values(77, 77);
update db1.tb_normal set c1=78 where pk = 78;
update db1.tb_increment set c1 = 78 where pk = 78;
insert into db1.tb_bigtable (c1,c2,c3,c4) values(repeat('A',65536),repeat('B',65536),repeat('C',65536),repeat('D',65536));
replace into test.tb_table_gencol(pk1,pk2,c1,c2) values(78,'78',repeat('A',65536),repeat('B',65536));
replace into test.tablegencol(c1,USER_ID,ADDRESS) values(78, repeat('A',32),repeat('B',256));
replace into test.table_hash(c1, c2) values(78, 78);
replace into test.table_range(c1, c2) values(78, 78);
replace into test.table_hash_range(c1, c2) values(78, 78);
replace into test.table_range_hash(c1, c2) values(78, 78);
update db1.tb_normal set c1=79 where pk = 79;
update db1.tb_increment set c1 = 79 where pk = 79;
insert into db1.tb_bigtable (c1,c2,c3,c4) values(repeat('A',65536),repeat('B',65536),repeat('C',65536),repeat('D',65536));
replace into test.tb_table_gencol(pk1,pk2,c1,c2) values(79,'79',repeat('A',65536),repeat('B',65536));
replace into test.tablegencol(c1,USER_ID,ADDRESS) values(79, repeat('A',32),repeat('B',256));
replace into test.table_hash(c1, c2) values(79, 79);
replace into test.table_range(c1, c2) values(79, 79);
replace into test.table_hash_range(c1, c2) values(79, 79);
replace into test.table_range_hash(c1, c2) values(79, 79);
update db1.tb_normal set c1=80 where pk = 80;
update db1.tb_increment set c1 = 80 where pk = 80;
insert into db1.tb_bigtable (c1,c2,c3,c4) values(repeat('A',65536),repeat('B',65536),repeat('C',65536),repeat('D',65536));
replace into test.tb_table_gencol(pk1,pk2,c1,c2) values(80,'80',repeat('A',65536),repeat('B',65536));
replace into test.tablegencol(c1,USER_ID,ADDRESS) values(80, repeat('A',32),repeat('B',256));
replace into test.table_hash(c1, c2) values(80, 80);
replace into test.table_range(c1, c2) values(80, 80);
replace into test.table_hash_range(c1, c2) values(80, 80);
replace into test.table_range_hash(c1, c2) values(80, 80);
update db1.tb_normal set c1=81 where pk = 81;
update db1.tb_increment set c1 = 81 where pk = 81;
insert into db1.tb_bigtable (c1,c2,c3,c4) values(repeat('A',65536),repeat('B',65536),repeat('C',65536),repeat('D',65536));
replace into test.tb_table_gencol(pk1,pk2,c1,c2) values(81,'81',repeat('A',65536),repeat('B',65536));
replace into test.tablegencol(c1,USER_ID,ADDRESS) values(81, repeat('A',32),repeat('B',256));
replace into test.table_hash(c1, c2) values(81, 81);
replace into test.table_range(c1, c2) values(81, 81);
replace into test.table_hash_range(c1, c2) values(81, 81);
replace into test.table_range_hash(c1, c2) values(81, 81);
update db1.tb_normal set c1=82 where pk = 82;
update db1.tb_increment set c1 = 82 where pk = 82;
insert into db1.tb_bigtable (c1,c2,c3,c4) values(repeat('A',65536),repeat('B',65536),repeat('C',65536),repeat('D',65536));
replace into test.tb_table_gencol(pk1,pk2,c1,c2) values(82,'82',repeat('A',65536),repeat('B',65536));
replace into test.tablegencol(c1,USER_ID,ADDRESS) values(82, repeat('A',32),repeat('B',256));
replace into test.table_hash(c1, c2) values(82, 82);
replace into test.table_range(c1, c2) values(82, 82);
replace into test.table_hash_range(c1, c2) values(82, 82);
replace into test.table_range_hash(c1, c2) values(82, 82);
update db1.tb_normal set c1=83 where pk = 83;
update db1.tb_increment set c1 = 83 where pk = 83;
insert into db1.tb_bigtable (c1,c2,c3,c4) values(repeat('A',65536),repeat('B',65536),repeat('C',65536),repeat('D',65536));
replace into test.tb_table_gencol(pk1,pk2,c1,c2) values(83,'83',repeat('A',65536),repeat('B',65536));
replace into test.tablegencol(c1,USER_ID,ADDRESS) values(83, repeat('A',32),repeat('B',256));
replace into test.table_hash(c1, c2) values(83, 83);
replace into test.table_range(c1, c2) values(83, 83);
replace into test.table_hash_range(c1, c2) values(83, 83);
replace into test.table_range_hash(c1, c2) values(83, 83);
update db1.tb_normal set c1=84 where pk = 84;
update db1.tb_increment set c1 = 84 where pk = 84;
insert into db1.tb_bigtable (c1,c2,c3,c4) values(repeat('A',65536),repeat('B',65536),repeat('C',65536),repeat('D',65536));
replace into test.tb_table_gencol(pk1,pk2,c1,c2) values(84,'84',repeat('A',65536),repeat('B',65536));
replace into test.tablegencol(c1,USER_ID,ADDRESS) values(84, repeat('A',32),repeat('B',256));
replace into test.table_hash(c1, c2) values(84, 84);
replace into test.table_range(c1, c2) values(84, 84);
replace into test.table_hash_range(c1, c2) values(84, 84);
replace into test.table_range_hash(c1, c2) values(84, 84);
update db1.tb_normal set c1=85 where pk = 85;
update db1.tb_increment set c1 = 85 where pk = 85;
insert into db1.tb_bigtable (c1,c2,c3,c4) values(repeat('A',65536),repeat('B',65536),repeat('C',65536),repeat('D',65536));
replace into test.tb_table_gencol(pk1,pk2,c1,c2) values(85,'85',repeat('A',65536),repeat('B',65536));
replace into test.tablegencol(c1,USER_ID,ADDRESS) values(85, repeat('A',32),repeat('B',256));
replace into test.table_hash(c1, c2) values(85, 85);
replace into test.table_range(c1, c2) values(85, 85);
replace into test.table_hash_range(c1, c2) values(85, 85);
replace into test.table_range_hash(c1, c2) values(85, 85);
update db1.tb_normal set c1=86 where pk = 86;
update db1.tb_increment set c1 = 86 where pk = 86;
insert into db1.tb_bigtable (c1,c2,c3,c4) values(repeat('A',65536),repeat('B',65536),repeat('C',65536),repeat('D',65536));
replace into test.tb_table_gencol(pk1,pk2,c1,c2) values(86,'86',repeat('A',65536),repeat('B',65536));
replace into test.tablegencol(c1,USER_ID,ADDRESS) values(86, repeat('A',32),repeat('B',256));
replace into test.table_hash(c1, c2) values(86, 86);
replace into test.table_range(c1, c2) values(86, 86);
replace into test.table_hash_range(c1, c2) values(86, 86);
replace into test.table_range_hash(c1, c2) values(86, 86);
update db1.tb_normal set c1=87 where pk = 87;
update db1.tb_increment set c1 = 87 where pk = 87;
insert into db1.tb_bigtable (c1,c2,c3,c4) values(repeat('A',65536),repeat('B',65536),repeat('C',65536),repeat('D',65536));
replace into test.tb_table_gencol(pk1,pk2,c1,c2) values(87,'87',repeat('A',65536),repeat('B',65536));
replace into test.tablegencol(c1,USER_ID,ADDRESS) values(87, repeat('A',32),repeat('B',256));
replace into test.table_hash(c1, c2) values(87, 87);
replace into test.table_range(c1, c2) values(87, 87);
replace into test.table_hash_range(c1, c2) values(87, 87);
replace into test.table_range_hash(c1, c2) values(87, 87);
update db1.tb_normal set c1=88 where pk = 88;
update db1.tb_increment set c1 = 88 where pk = 88;
insert into db1.tb_bigtable (c1,c2,c3,c4) values(repeat('A',65536),repeat('B',65536),repeat('C',65536),repeat('D',65536));
replace into test.tb_table_gencol(pk1,pk2,c1,c2) values(88,'88',repeat('A',65536),repeat('B',65536));
replace into test.tablegencol(c1,USER_ID,ADDRESS) values(88, repeat('A',32),repeat('B',256));
replace into test.table_hash(c1, c2) values(88, 88);
replace into test.table_range(c1, c2) values(88, 88);
replace into test.table_hash_range(c1, c2) values(88, 88);
replace into test.table_range_hash(c1, c2) values(88, 88);
update db1.tb_normal set c1=89 where pk = 89;
update db1.tb_increment set c1 = 89 where pk = 89;
insert into db1.tb_bigtable (c1,c2,c3,c4) values(repeat('A',65536),repeat('B',65536),repeat('C',65536),repeat('D',65536));
replace into test.tb_table_gencol(pk1,pk2,c1,c2) values(89,'89',repeat('A',65536),repeat('B',65536));
replace into test.tablegencol(c1,USER_ID,ADDRESS) values(89, repeat('A',32),repeat('B',256));
replace into test.table_hash(c1, c2) values(89, 89);
replace into test.table_range(c1, c2) values(89, 89);
replace into test.table_hash_range(c1, c2) values(89, 89);
replace into test.table_range_hash(c1, c2) values(89, 89);
update db1.tb_normal set c1=90 where pk = 90;
update db1.tb_increment set c1 = 90 where pk = 90;
insert into db1.tb_bigtable (c1,c2,c3,c4) values(repeat('A',65536),repeat('B',65536),repeat('C',65536),repeat('D',65536));
replace into test.tb_table_gencol(pk1,pk2,c1,c2) values(90,'90',repeat('A',65536),repeat('B',65536));
replace into test.tablegencol(c1,USER_ID,ADDRESS) values(90, repeat('A',32),repeat('B',256));
replace into test.table_hash(c1, c2) values(90, 90);
replace into test.table_range(c1, c2) values(90, 90);
replace into test.table_hash_range(c1, c2) values(90, 90);
replace into test.table_range_hash(c1, c2) values(90, 90);
update db1.tb_normal set c1=91 where pk = 91;
update db1.tb_increment set c1 = 91 where pk = 91;
insert into db1.tb_bigtable (c1,c2,c3,c4) values(repeat('A',65536),repeat('B',65536),repeat('C',65536),repeat('D',65536));
replace into test.tb_table_gencol(pk1,pk2,c1,c2) values(91,'91',repeat('A',65536),repeat('B',65536));
replace into test.tablegencol(c1,USER_ID,ADDRESS) values(91, repeat('A',32),repeat('B',256));
replace into test.table_hash(c1, c2) values(91, 91);
replace into test.table_range(c1, c2) values(91, 91);
replace into test.table_hash_range(c1, c2) values(91, 91);
replace into test.table_range_hash(c1, c2) values(91, 91);
update db1.tb_normal set c1=92 where pk = 92;
update db1.tb_increment set c1 = 92 where pk = 92;
insert into db1.tb_bigtable (c1,c2,c3,c4) values(repeat('A',65536),repeat('B',65536),repeat('C',65536),repeat('D',65536));
replace into test.tb_table_gencol(pk1,pk2,c1,c2) values(92,'92',repeat('A',65536),repeat('B',65536));
replace into test.tablegencol(c1,USER_ID,ADDRESS) values(92, repeat('A',32),repeat('B',256));
replace into test.table_hash(c1, c2) values(92, 92);
replace into test.table_range(c1, c2) values(92, 92);
replace into test.table_hash_range(c1, c2) values(92, 92);
replace into test.table_range_hash(c1, c2) values(92, 92);
update db1.tb_normal set c1=93 where pk = 93;
update db1.tb_increment set c1 = 93 where pk = 93;
insert into db1.tb_bigtable (c1,c2,c3,c4) values(repeat('A',65536),repeat('B',65536),repeat('C',65536),repeat('D',65536));
replace into test.tb_table_gencol(pk1,pk2,c1,c2) values(93,'93',repeat('A',65536),repeat('B',65536));
replace into test.tablegencol(c1,USER_ID,ADDRESS) values(93, repeat('A',32),repeat('B',256));
replace into test.table_hash(c1, c2) values(93, 93);
replace into test.table_range(c1, c2) values(93, 93);
replace into test.table_hash_range(c1, c2) values(93, 93);
replace into test.table_range_hash(c1, c2) values(93, 93);
update db1.tb_normal set c1=94 where pk = 94;
update db1.tb_increment set c1 = 94 where pk = 94;
insert into db1.tb_bigtable (c1,c2,c3,c4) values(repeat('A',65536),repeat('B',65536),repeat('C',65536),repeat('D',65536));
replace into test.tb_table_gencol(pk1,pk2,c1,c2) values(94,'94',repeat('A',65536),repeat('B',65536));
replace into test.tablegencol(c1,USER_ID,ADDRESS) values(94, repeat('A',32),repeat('B',256));
replace into test.table_hash(c1, c2) values(94, 94);
replace into test.table_range(c1, c2) values(94, 94);
replace into test.table_hash_range(c1, c2) values(94, 94);
replace into test.table_range_hash(c1, c2) values(94, 94);
update db1.tb_normal set c1=95 where pk = 95;
update db1.tb_increment set c1 = 95 where pk = 95;
insert into db1.tb_bigtable (c1,c2,c3,c4) values(repeat('A',65536),repeat('B',65536),repeat('C',65536),repeat('D',65536));
replace into test.tb_table_gencol(pk1,pk2,c1,c2) values(95,'95',repeat('A',65536),repeat('B',65536));
replace into test.tablegencol(c1,USER_ID,ADDRESS) values(95, repeat('A',32),repeat('B',256));
replace into test.table_hash(c1, c2) values(95, 95);
replace into test.table_range(c1, c2) values(95, 95);
replace into test.table_hash_range(c1, c2) values(95, 95);
replace into test.table_range_hash(c1, c2) values(95, 95);
update db1.tb_normal set c1=96 where pk = 96;
update db1.tb_increment set c1 = 96 where pk = 96;
insert into db1.tb_bigtable (c1,c2,c3,c4) values(repeat('A',65536),repeat('B',65536),repeat('C',65536),repeat('D',65536));
replace into test.tb_table_gencol(pk1,pk2,c1,c2) values(96,'96',repeat('A',65536),repeat('B',65536));
replace into test.tablegencol(c1,USER_ID,ADDRESS) values(96, repeat('A',32),repeat('B',256));
replace into test.table_hash(c1, c2) values(96, 96);
replace into test.table_range(c1, c2) values(96, 96);
replace into test.table_hash_range(c1, c2) values(96, 96);
replace into test.table_range_hash(c1, c2) values(96, 96);
update db1.tb_normal set c1=97 where pk = 97;
update db1.tb_increment set c1 = 97 where pk = 97;
insert into db1.tb_bigtable (c1,c2,c3,c4) values(repeat('A',65536),repeat('B',65536),repeat('C',65536),repeat('D',65536));
replace into test.tb_table_gencol(pk1,pk2,c1,c2) values(97,'97',repeat('A',65536),repeat('B',65536));
replace into test.tablegencol(c1,USER_ID,ADDRESS) values(97, repeat('A',32),repeat('B',256));
replace into test.table_hash(c1, c2) values(97, 97);
replace into test.table_range(c1, c2) values(97, 97);
replace into test.table_hash_range(c1, c2) values(97, 97);
replace into test.table_range_hash(c1, c2) values(97, 97);
update db1.tb_normal set c1=98 where pk = 98;
update db1.tb_increment set c1 = 98 where pk = 98;
insert into db1.tb_bigtable (c1,c2,c3,c4) values(repeat('A',65536),repeat('B',65536),repeat('C',65536),repeat('D',65536));
replace into test.tb_table_gencol(pk1,pk2,c1,c2) values(98,'98',repeat('A',65536),repeat('B',65536));
replace into test.tablegencol(c1,USER_ID,ADDRESS) values(98, repeat('A',32),repeat('B',256));
replace into test.table_hash(c1, c2) values(98, 98);
replace into test.table_range(c1, c2) values(98, 98);
replace into test.table_hash_range(c1, c2) values(98, 98);
replace into test.table_range_hash(c1, c2) values(98, 98);
update db1.tb_normal set c1=99 where pk = 99;
update db1.tb_increment set c1 = 99 where pk = 99;
insert into db1.tb_bigtable (c1,c2,c3,c4) values(repeat('A',65536),repeat('B',65536),repeat('C',65536),repeat('D',65536));
replace into test.tb_table_gencol(pk1,pk2,c1,c2) values(99,'99',repeat('A',65536),repeat('B',65536));
replace into test.tablegencol(c1,USER_ID,ADDRESS) values(99, repeat('A',32),repeat('B',256));
replace into test.table_hash(c1, c2) values(99, 99);
replace into test.table_range(c1, c2) values(99, 99);
replace into test.table_hash_range(c1, c2) values(99, 99);
replace into test.table_range_hash(c1, c2) values(99, 99);
update db1.tb_normal set c1=100 where pk = 100;
update db1.tb_increment set c1 = 100 where pk = 100;
insert into db1.tb_bigtable (c1,c2,c3,c4) values(repeat('A',65536),repeat('B',65536),repeat('C',65536),repeat('D',65536));
replace into test.tb_table_gencol(pk1,pk2,c1,c2) values(100,'100',repeat('A',65536),repeat('B',65536));
replace into test.tablegencol(c1,USER_ID,ADDRESS) values(100, repeat('A',32),repeat('B',256));
replace into test.table_hash(c1, c2) values(100, 100);
replace into test.table_range(c1, c2) values(100, 100);
replace into test.table_hash_range(c1, c2) values(100, 100);
replace into test.table_range_hash(c1, c2) values(100, 100);
select pk1,pk2,gen_c1,gen_c2 from test.tb_table_gencol order by pk1,pk2 limit 10;
pk1	pk2	gen_c1	gen_c2
1	1	AAAAAAAAAA	BBBBBBBBBB
2	2	AAAAAAAAAA	BBBBBBBBBB
3	3	AAAAAAAAAA	BBBBBBBBBB
4	4	AAAAAAAAAA	BBBBBBBBBB
5	5	AAAAAAAAAA	BBBBBBBBBB
6	6	AAAAAAAAAA	BBBBBBBBBB
7	7	AAAAAAAAAA	BBBBBBBBBB
8	8	AAAAAAAAAA	BBBBBBBBBB
9	9	AAAAAAAAAA	BBBBBBBBBB
10	10	AAAAAAAAAA	BBBBBBBBBB
select * from test.table_hash where c1 = 1;
c1	c2
1	1
select * from test.table_range where c1 = 1;
c1	c2
1	1
select * from test.table_hash_range where c1 = 1;
c1	c2
1	1
select * from test.table_range_hash where c1 = 1;
c1	c2
1	1
select count(*) from test.table_hash;
count(*)
201
create table db1.t1_after(pk int primary key, c1 int);
create table t2_after(pk int primary key, c1 int);
use test;
alter table t_cg_0 add column group(all columns);
alter table t_cg_1 add column group(each column);
alter table t_cg_2 add column c4 int;
alter table t_cg_2 drop column c2;
alter table t_cg_2 add index idx2_1(c1) with column group(all columns, each column);
alter table t_cg_3 add column c4 int;
alter table t_cg_3 change column c4 c6 int;
drop table t_cg_0;
drop table t_cg_1;
drop table t_cg_2;
drop table t_cg_3;
create table int2bigint.t_finish_end (i_p int primary key, i_i int, i_g_d int, i_g_i_d int, i_f int, i_u int unsigned, i_c int, c char(20), c_g_d char(20), d decimal(10,2), d_i decimal(10,2), i_g int GENERATED ALWAYS AS (i_g_d+1) stored, i_g_i int GENERATED ALWAYS AS (i_g_i_d+1) stored, c_g char(40) GENERATED ALWAYS AS (concat(c_g_d,c_g_d)) virtual, foreign key (i_f) references int2bigint.t_foreign_depend(i_f_d), check (i_c<10000));
create index idx_t_finish_end_i_i on int2bigint.t_finish_end(i_i);
create index idx_t_finish_end_d_i on int2bigint.t_finish_end(d_i);
create index idx_t_finish_end_i_g_i on int2bigint.t_finish_end(i_g_i);
insert into int2bigint.t_finish_end(i_p, i_i, i_g_d, i_f, i_u, i_c, c, c_g_d, d, d_i, i_g_i_d)
values (int2bigint.s_finish_end.nextval, int2bigint.s_finish_end.nextval, 1, 1, 1, 1, 'feidu', 'feidu', 11.11, 11.11, 1),
(int2bigint.s_finish_end.nextval, int2bigint.s_finish_end.nextval, 2, 1, 2, 2, 'feidu', 'feidu', 11.11, 11.11, 1),
(int2bigint.s_finish_end.nextval, int2bigint.s_finish_end.nextval, 3, 1, 3, 3, 'feidu', 'feidu', 11.11, 11.11, 1),
(int2bigint.s_finish_end.nextval, int2bigint.s_finish_end.nextval, 4, 1, 4, 4, 'feidu', 'feidu', 11.11, 11.11, 1),
(int2bigint.s_finish_end.nextval, int2bigint.s_finish_end.nextval, 5, 1, 5, 5, 'feidu', 'feidu', 11.11, 11.11, 1),
(int2bigint.s_finish_end.nextval, int2bigint.s_finish_end.nextval, 6, 1, 6, 6, 'feidu', 'feidu', 11.11, 11.11, 1),
(int2bigint.s_finish_end.nextval, int2bigint.s_finish_end.nextval, 7, 1, 7, 7, 'feidu', 'feidu', 11.11, 11.11, 1),
(int2bigint.s_finish_end.nextval, int2bigint.s_finish_end.nextval, 8, 1, 8, 8, 'feidu', 'feidu', 11.11, 11.11, 1),
(int2bigint.s_finish_end.nextval, int2bigint.s_finish_end.nextval, 9, 1, 9, 9, 'feidu', 'feidu', 11.11, 11.11, 1),
(int2bigint.s_finish_end.nextval, int2bigint.s_finish_end.nextval, 10, 1, 10, 10, 'feidu', 'feidu', 11.11, 11.11, 1);
alter table int2bigint.t_finish_end change column i_p i_p bigint;
insert into int2bigint.t_finish_end(i_p, i_i, i_g_d, i_f, i_u, i_c, c, c_g_d, d, d_i, i_g_i_d) values (int2bigint.s_finish_end.nextval, int2bigint.s_finish_end.nextval, 1, 1, 1, 1, 'feidu', 'feidu', 11.11, 11.11, 1);
alter table int2bigint.t_finish_end change column i_i i_i bigint;
insert into int2bigint.t_finish_end(i_p, i_i, i_g_d, i_f, i_u, i_c, c, c_g_d, d, d_i, i_g_i_d) values (int2bigint.s_finish_end.nextval, int2bigint.s_finish_end.nextval, 1, 1, 1, 1, 'feidu', 'feidu', 11.11, 11.11, 1);
alter table int2bigint.t_finish_end change column i_g_d i_g_d bigint;
insert into int2bigint.t_finish_end(i_p, i_i, i_g_d, i_f, i_u, i_c, c, c_g_d, d, d_i, i_g_i_d) values (int2bigint.s_finish_end.nextval, int2bigint.s_finish_end.nextval, 1, 1, 1, 1, 'feidu', 'feidu', 11.11, 11.11, 1);
alter table int2bigint.t_finish_end change column i_c i_c bigint;
insert into int2bigint.t_finish_end(i_p, i_i, i_g_d, i_f, i_u, i_c, c, c_g_d, d, d_i, i_g_i_d) values (int2bigint.s_finish_end.nextval, int2bigint.s_finish_end.nextval, 1, 1, 1, 1, 'feidu', 'feidu', 11.11, 11.11, 1);
alter table int2bigint.t_finish_end change column c c char(40);
insert into int2bigint.t_finish_end(i_p, i_i, i_g_d, i_f, i_u, i_c, c, c_g_d, d, d_i, i_g_i_d) values (int2bigint.s_finish_end.nextval, int2bigint.s_finish_end.nextval, 1, 1, 1, 1, 'feidu', 'feidu', 11.11, 11.11, 1);
alter table int2bigint.t_finish_end change column d d decimal(18,2);
insert into int2bigint.t_finish_end(i_p, i_i, i_g_d, i_f, i_u, i_c, c, c_g_d, d, d_i, i_g_i_d) values (int2bigint.s_finish_end.nextval, int2bigint.s_finish_end.nextval, 1, 1, 1, 1, 'feidu', 'feidu', 11.11, 11.11, 1);
alter table int2bigint.t_finish_end change column d_i d_i decimal(18,2);
insert into int2bigint.t_finish_end(i_p, i_i, i_g_d, i_f, i_u, i_c, c, c_g_d, d, d_i, i_g_i_d) values (int2bigint.s_finish_end.nextval, int2bigint.s_finish_end.nextval, 1, 1, 1, 1, 'feidu', 'feidu', 11.11, 11.11, 1);
alter table int2bigint.t_finish_end change column i_g i_g bigint GENERATED ALWAYS AS (i_g_d+1) stored;
insert into int2bigint.t_finish_end(i_p, i_i, i_g_d, i_f, i_u, i_c, c, c_g_d, d, d_i, i_g_i_d) values (int2bigint.s_finish_end.nextval, int2bigint.s_finish_end.nextval, 1, 1, 1, 1, 'feidu', 'feidu', 11.11, 11.11, 1);
alter table int2bigint.t_finish_end change column c_g c_g char(80) GENERATED ALWAYS AS (concat(c_g_d, c_g_d)) virtual;
insert into int2bigint.t_finish_end(i_p, i_i, i_g_d, i_f, i_u, i_c, c, c_g_d, d, d_i, i_g_i_d) values (int2bigint.s_finish_end.nextval, int2bigint.s_finish_end.nextval, 1, 1, 1, 1, 'feidu', 'feidu', 11.11, 11.11, 1);
online
alter table int2bigint.t_finish_end change column i_u i_u bigint;
insert into int2bigint.t_finish_end(i_p, i_i, i_g_d, i_f, i_u, i_c, c, c_g_d, d, d_i, i_g_i_d) values (int2bigint.s_finish_end.nextval, int2bigint.s_finish_end.nextval, 1, 1, 1, 1, 'feidu', 'feidu', 11.11, 11.11, 1);
offline
alter table int2bigint.t_finish_end change column c_g_d c_g_d char(40);
insert into int2bigint.t_finish_end(i_p, i_i, i_g_d, i_f, i_u, i_c, c, c_g_d, d, d_i, i_g_i_d) values (int2bigint.s_finish_end.nextval, int2bigint.s_finish_end.nextval, 1, 1, 1, 1, 'feidu', 'feidu', 11.11, 11.11, 1);
offline
alter table int2bigint.t_finish_end change column i_g_i_d i_g_i_d bigint;
online
alter table int2bigint.t_finish_end change column i_f i_f bigint;
ERROR HY000: 'i_f': used in a foreign key constraint
insert into int2bigint.t_finish_end(i_p, i_i, i_g_d, i_f, i_u, i_c, c, c_g_d, d, d_i, i_g_i_d) values (int2bigint.s_finish_end.nextval, int2bigint.s_finish_end.nextval, 1, 1, 1, 1, 'feidu', 'feidu', 11.11, 11.11, 1);
alter table int2bigint.t_finish change column i_p i_p bigint;
insert into int2bigint.t_finish(i_p, i_i, i_g_d, i_f, i_u, i_c, c, c_g_d, d, d_i, i_g_i_d) values (int2bigint.s_finish.nextval, int2bigint.s_finish.nextval, 1, 1, 1, 1, 'feidu', 'feidu', 11.11, 11.11, 1);
alter table int2bigint.t_finish change column i_i i_i bigint;
insert into int2bigint.t_finish(i_p, i_i, i_g_d, i_f, i_u, i_c, c, c_g_d, d, d_i, i_g_i_d) values (int2bigint.s_finish.nextval, int2bigint.s_finish.nextval, 1, 1, 1, 1, 'feidu', 'feidu', 11.11, 11.11, 1);
alter table int2bigint.t_finish change column i_g_d i_g_d bigint;
insert into int2bigint.t_finish(i_p, i_i, i_g_d, i_f, i_u, i_c, c, c_g_d, d, d_i, i_g_i_d) values (int2bigint.s_finish.nextval, int2bigint.s_finish.nextval, 1, 1, 1, 1, 'feidu', 'feidu', 11.11, 11.11, 1);
alter table int2bigint.t_finish change column i_c i_c bigint;
insert into int2bigint.t_finish(i_p, i_i, i_g_d, i_f, i_u, i_c, c, c_g_d, d, d_i, i_g_i_d) values (int2bigint.s_finish.nextval, int2bigint.s_finish.nextval, 1, 1, 1, 1, 'feidu', 'feidu', 11.11, 11.11, 1);
alter table int2bigint.t_finish change column c c char(40);
insert into int2bigint.t_finish(i_p, i_i, i_g_d, i_f, i_u, i_c, c, c_g_d, d, d_i, i_g_i_d) values (int2bigint.s_finish.nextval, int2bigint.s_finish.nextval, 1, 1, 1, 1, 'feidu', 'feidu', 11.11, 11.11, 1);
alter table int2bigint.t_finish change column i_g i_g bigint GENERATED ALWAYS AS (i_g_d+1) stored;
insert into int2bigint.t_finish(i_p, i_i, i_g_d, i_f, i_u, i_c, c, c_g_d, d, d_i, i_g_i_d) values (int2bigint.s_finish.nextval, int2bigint.s_finish.nextval, 1, 1, 1, 1, 'feidu', 'feidu', 11.11, 11.11, 1);
alter table int2bigint.t_finish change column c_g c_g char(80) GENERATED ALWAYS AS (concat(c_g_d, c_g_d)) virtual;
insert into int2bigint.t_finish(i_p, i_i, i_g_d, i_f, i_u, i_c, c, c_g_d, d, d_i, i_g_i_d) values (int2bigint.s_finish.nextval, int2bigint.s_finish.nextval, 1, 1, 1, 1, 'feidu', 'feidu', 11.11, 11.11, 1);
online
alter table int2bigint.t_finish change column i_u i_u bigint;
insert into int2bigint.t_finish(i_p, i_i, i_g_d, i_f, i_u, i_c, c, c_g_d, d, d_i, i_g_i_d) values (int2bigint.s_finish.nextval, int2bigint.s_finish.nextval, 1, 1, 1, 1, 'feidu', 'feidu', 11.11, 11.11, 1);
offline
alter table int2bigint.t_finish change column d d decimal(18,2);
insert into int2bigint.t_finish(i_p, i_i, i_g_d, i_f, i_u, i_c, c, c_g_d, d, d_i, i_g_i_d) values (int2bigint.s_finish.nextval, int2bigint.s_finish.nextval, 1, 1, 1, 1, 'feidu', 'feidu', 11.11, 11.11, 1);
online
alter table int2bigint.t_finish change column d_i d_i decimal(18,2);
insert into int2bigint.t_finish(i_p, i_i, i_g_d, i_f, i_u, i_c, c, c_g_d, d, d_i, i_g_i_d) values (int2bigint.s_finish.nextval, int2bigint.s_finish.nextval, 1, 1, 1, 1, 'feidu', 'feidu', 11.11, 11.11, 1);
online
alter table int2bigint.t_finish change column c_g_d c_g_d char(40);
insert into int2bigint.t_finish(i_p, i_i, i_g_d, i_f, i_u, i_c, c, c_g_d, d, d_i, i_g_i_d) values (int2bigint.s_finish.nextval, int2bigint.s_finish.nextval, 1, 1, 1, 1, 'feidu', 'feidu', 11.11, 11.11, 1);
offline
alter table int2bigint.t_finish change column i_g_i_d i_g_i_d bigint;
online
alter table int2bigint.t_finish change column i_f i_f bigint;
ERROR HY000: 'i_f': used in a foreign key constraint
create table t_oracle_int_float_end (a NUMBER(38) primary key);
insert into t_oracle_int_float_end(a) values (1);
alter table t_oracle_int_float_end modify a float;
insert into t_oracle_int_float_end(a) values (1.2);
online
alter table t_oracle_int_float modify a float;
insert into t_oracle_int_float(a) values (1.2);
online
show create table test.t_begin_micro_index_clustered;
Table	Create Table
t_begin_micro_index_clustered	CREATE TABLE `t_begin_micro_index_clustered` (
  `a` int(11) DEFAULT NULL,
  `b` text DEFAULT NULL,
  KEY `a` (`a`) BLOCK_SIZE 16384 LOCAL,
  KEY `idx_a_twice` (`a`) BLOCK_SIZE 16384 LOCAL
) DEFAULT CHARSET = utf8mb4 ROW_FORMAT = DYNAMIC COMPRESSION = 'zstd_1.3.8' REPLICA_NUM = 3 BLOCK_SIZE = 16384 USE_BLOOM_FILTER = FALSE TABLET_SIZE = 134217728 PCTFREE = 0
show create table test.t_mix_micro_index_clustered;
Table	Create Table
t_mix_micro_index_clustered	CREATE TABLE `t_mix_micro_index_clustered` (
  `a` int(11) DEFAULT NULL,
  `b` text DEFAULT NULL,
  KEY `a` (`a`) BLOCK_SIZE 16384 LOCAL
) DEFAULT CHARSET = utf8mb4 ROW_FORMAT = DYNAMIC COMPRESSION = 'zstd_1.3.8' REPLICA_NUM = 3 BLOCK_SIZE = 16384 USE_BLOOM_FILTER = FALSE TABLET_SIZE = 134217728 PCTFREE = 0
create table test.t_finish_micro_index_clustered (a int, b text, index(a)) MICRO_INDEX_CLUSTERED = TRUE;
create index idx_a_twice on test.t_finish_micro_index_clustered(a);
show create table test.t_finish_micro_index_clustered;
Table	Create Table
t_finish_micro_index_clustered	CREATE TABLE `t_finish_micro_index_clustered` (
  `a` int(11) DEFAULT NULL,
  `b` text DEFAULT NULL,
  KEY `a` (`a`) BLOCK_SIZE 16384 LOCAL,
  KEY `idx_a_twice` (`a`) BLOCK_SIZE 16384 LOCAL
) DEFAULT CHARSET = utf8mb4 ROW_FORMAT = DYNAMIC COMPRESSION = 'zstd_1.3.8' REPLICA_NUM = 3 BLOCK_SIZE = 16384 USE_BLOOM_FILTER = FALSE TABLET_SIZE = 134217728 PCTFREE = 0
set @@session.ob_query_timeout = 120000000;
ob1.mysql alter system set merger_check_interval='10s' tenant sys;
ob1.mysql alter system set merger_check_interval='10s' tenant all_user;
ob1.mysql alter system set merger_check_interval='10s' tenant all_meta;
ob1.mysql alter system set ob_compaction_schedule_interval='10s' tenant sys;
ob1.mysql alter system set ob_compaction_schedule_interval='10s' tenant all_user;
ob1.mysql alter system set ob_compaction_schedule_interval='10s' tenant all_meta;
alter system major freeze tenant sys;
alter system major freeze tenant all_user;
alter system major freeze tenant all_meta;
use oblog_db;
set ob_org_cluster_id=1234;
replace into oblog_test values (1, 1), (2,2), (3,3);
ob1.oblog.next_dml;
[R0] BEGIN;[R0] org_cluster_id:1234;[R1] record_type:INSERT;[R1] database_name:mysql.test;[R1] table_name:t_part;[R1] log_event:true;[R1] column_count:3;[R1] source_category:SRC_FULL_RECORDED;[R1] source_type:SRC_OCEANBASE_1_0;[R1] has_pk:true;[R1] pk_info:(0,1);[R1] pks:__pk_increment,c1;[R1] has_uk:false;[R1] uk_info:(null);[R1] uks:(null);[R1] [C1] column_name:__pk_increment;[R1] [C1] column_type:MYSQL_TYPE_LONGLONG;[R1] [C1] column_is_rowkey:true;[R1] [C1] column_is_signed:false;[R1] [C1] column_encoding:binary;[R1] [C1] column_is_not_null:true;[R1] [C1] column_value_new:[1](1);[R1] [C2] column_name:c1;[R1] [C2] column_type:MYSQL_TYPE_LONG;[R1] [C2] column_is_rowkey:false;[R1] [C2] column_is_signed:true;[R1] [C2] column_encoding:binary;[R1] [C2] column_is_not_null:false;[R1] [C2] column_value_new:[3](1);[R1] [C3] column_name:c2;[R1] [C3] column_type:MYSQL_TYPE_LONG;[R1] [C3] column_is_rowkey:false;[R1] [C3] column_is_signed:true;[R1] [C3] column_encoding:binary;[R1] [C3] column_is_not_null:false;[R1] [C3] column_value_new:[3](1);$[R2] COMMIT;
use oblog_db;
ob1.oblog.exist;
set ob_org_cluster_id=1234;
replace into oblog_test values (1, 1), (2,2), (3,3);
ob1.oblog.next_dml;
[R0] BEGIN;[R0] org_cluster_id:1234;[R1] record_type:INSERT;[R1] database_name:mysql.test;[R1] table_name:t_part;[R1] log_event:true;[R1] column_count:3;[R1] source_category:SRC_FULL_RECORDED;[R1] source_type:SRC_OCEANBASE_1_0;[R1] has_pk:true;[R1] pk_info:(0,1);[R1] pks:__pk_increment,c1;[R1] has_uk:false;[R1] uk_info:(null);[R1] uks:(null);[R1] [C1] column_name:__pk_increment;[R1] [C1] column_type:MYSQL_TYPE_LONGLONG;[R1] [C1] column_is_rowkey:true;[R1] [C1] column_is_signed:false;[R1] [C1] column_encoding:binary;[R1] [C1] column_is_not_null:true;[R1] [C1] column_value_new:[1](1);[R1] [C2] column_name:c1;[R1] [C2] column_type:MYSQL_TYPE_LONG;[R1] [C2] column_is_rowkey:false;[R1] [C2] column_is_signed:true;[R1] [C2] column_encoding:binary;[R1] [C2] column_is_not_null:false;[R1] [C2] column_value_new:[4](1);[R1] [C3] column_name:c2;[R1] [C3] column_type:MYSQL_TYPE_LONG;[R1] [C3] column_is_rowkey:false;[R1] [C3] column_is_signed:true;[R1] [C3] column_encoding:binary;[R1] [C3] column_is_not_null:false;[R1] [C3] column_value_new:[4](1);$[R2] COMMIT;
ob1.oblog.stop;
ob1.oblog.set_start_tstamp $start_tstamp_before_upgrade;
ob1.oblog.gen_conf tb_white_list=mysql.*.*;
ob1.oblog.restart;
ob1.oblog.next_dml;
[R0] BEGIN;[R0] org_cluster_id:1234;[R1] record_type:INSERT;[R1] database_name:mysql.oblog_db;[R1] table_name:oblog_test;[R1] log_event:true;[R1] column_count:2;[R1] source_category:SRC_FULL_RECORDED;[R1] source_type:SRC_OCEANBASE_1_0;[R1] has_pk:true;[R1] pk_info:(0);[R1] pks:pk;[R1] has_uk:false;[R1] uk_info:(null);[R1] uks:(null);[R1] [C1] column_name:pk;[R1] [C1] column_type:MYSQL_TYPE_LONG;[R1] [C1] column_is_rowkey:true;[R1] [C1] column_is_signed:true;[R1] [C1] column_encoding:binary;[R1] [C1] column_is_not_null:true;[R1] [C1] column_value_new:[1](1);[R1] [C2] column_name:c1;[R1] [C2] column_type:MYSQL_TYPE_VAR_STRING;[R1] [C2] column_is_rowkey:false;[R1] [C2] column_is_signed:true;[R1] [C2] column_encoding:utf8mb4;[R1] [C2] column_is_not_null:false;[R1] [C2] column_value_new:[1](1);$[R2] record_type:INSERT;[R2] database_name:mysql.oblog_db;[R2] table_name:oblog_test;[R2] log_event:true;[R2] column_count:2;[R2] source_category:SRC_FULL_RECORDED;[R2] source_type:SRC_OCEANBASE_1_0;[R2] has_pk:true;[R2] pk_info:(0);[R2] pks:pk;[R2] has_uk:false;[R2] uk_info:(null);[R2] uks:(null);[R2] [C1] column_name:pk;[R2] [C1] column_type:MYSQL_TYPE_LONG;[R2] [C1] column_is_rowkey:true;[R2] [C1] column_is_signed:true;[R2] [C1] column_encoding:binary;[R2] [C1] column_is_not_null:true;[R2] [C1] column_value_new:[2](1);[R2] [C2] column_name:c1;[R2] [C2] column_type:MYSQL_TYPE_VAR_STRING;[R2] [C2] column_is_rowkey:false;[R2] [C2] column_is_signed:true;[R2] [C2] column_encoding:utf8mb4;[R2] [C2] column_is_not_null:false;[R2] [C2] column_value_new:[2](1);$[R3] record_type:INSERT;[R3] database_name:mysql.oblog_db;[R3] table_name:oblog_test;[R3] log_event:true;[R3] column_count:2;[R3] source_category:SRC_FULL_RECORDED;[R3] source_type:SRC_OCEANBASE_1_0;[R3] has_pk:true;[R3] pk_info:(0);[R3] pks:pk;[R3] has_uk:false;[R3] uk_info:(null);[R3] uks:(null);[R3] [C1] column_name:pk;[R3] [C1] column_type:MYSQL_TYPE_LONG;[R3] [C1] column_is_rowkey:true;[R3] [C1] column_is_signed:true;[R3] [C1] column_encoding:binary;[R3] [C1] column_is_not_null:true;[R3] [C1] column_value_new:[3](1);[R3] [C2] column_name:c1;[R3] [C2] column_type:MYSQL_TYPE_VAR_STRING;[R3] [C2] column_is_rowkey:false;[R3] [C2] column_is_signed:true;[R3] [C2] column_encoding:utf8mb4;[R3] [C2] column_is_not_null:false;[R3] [C2] column_value_new:[3](1);$[R4] COMMIT;
ob1.oblog.next_dml;
[R0] BEGIN;[R0] org_cluster_id:1234;[R1] record_type:INSERT;[R1] database_name:mysql.test;[R1] table_name:t;[R1] log_event:true;[R1] column_count:3;[R1] source_category:SRC_FULL_RECORDED;[R1] source_type:SRC_OCEANBASE_1_0;[R1] has_pk:true;[R1] pk_info:(0);[R1] pks:__pk_increment;[R1] has_uk:false;[R1] uk_info:(null);[R1] uks:(null);[R1] [C1] column_name:__pk_increment;[R1] [C1] column_type:MYSQL_TYPE_LONGLONG;[R1] [C1] column_is_rowkey:true;[R1] [C1] column_is_signed:false;[R1] [C1] column_encoding:binary;[R1] [C1] column_is_not_null:true;[R1] [C1] column_value_new:[1](1);[R1] [C2] column_name:c1;[R1] [C2] column_type:MYSQL_TYPE_LONG;[R1] [C2] column_is_rowkey:false;[R1] [C2] column_is_signed:true;[R1] [C2] column_encoding:binary;[R1] [C2] column_is_not_null:false;[R1] [C2] column_value_new:[1](1);[R1] [C3] column_name:c2;[R1] [C3] column_type:MYSQL_TYPE_LONG;[R1] [C3] column_is_rowkey:false;[R1] [C3] column_is_signed:true;[R1] [C3] column_encoding:binary;[R1] [C3] column_is_not_null:false;[R1] [C3] column_value_new:[1](1);$[R2] record_type:INSERT;[R2] database_name:mysql.test;[R2] table_name:t;[R2] log_event:true;[R2] column_count:3;[R2] source_category:SRC_FULL_RECORDED;[R2] source_type:SRC_OCEANBASE_1_0;[R2] has_pk:true;[R2] pk_info:(0);[R2] pks:__pk_increment;[R2] has_uk:false;[R2] uk_info:(null);[R2] uks:(null);[R2] [C1] column_name:__pk_increment;[R2] [C1] column_type:MYSQL_TYPE_LONGLONG;[R2] [C1] column_is_rowkey:true;[R2] [C1] column_is_signed:false;[R2] [C1] column_encoding:binary;[R2] [C1] column_is_not_null:true;[R2] [C1] column_value_new:[2](1);[R2] [C2] column_name:c1;[R2] [C2] column_type:MYSQL_TYPE_LONG;[R2] [C2] column_is_rowkey:false;[R2] [C2] column_is_signed:true;[R2] [C2] column_encoding:binary;[R2] [C2] column_is_not_null:false;[R2] [C2] column_value_new:[2](1);[R2] [C3] column_name:c2;[R2] [C3] column_type:MYSQL_TYPE_LONG;[R2] [C3] column_is_rowkey:false;[R2] [C3] column_is_signed:true;[R2] [C3] column_encoding:binary;[R2] [C3] column_is_not_null:false;[R2] [C3] column_value_new:[2](1);$[R3] record_type:INSERT;[R3] database_name:mysql.test;[R3] table_name:t;[R3] log_event:true;[R3] column_count:3;[R3] source_category:SRC_FULL_RECORDED;[R3] source_type:SRC_OCEANBASE_1_0;[R3] has_pk:true;[R3] pk_info:(0);[R3] pks:__pk_increment;[R3] has_uk:false;[R3] uk_info:(null);[R3] uks:(null);[R3] [C1] column_name:__pk_increment;[R3] [C1] column_type:MYSQL_TYPE_LONGLONG;[R3] [C1] column_is_rowkey:true;[R3] [C1] column_is_signed:false;[R3] [C1] column_encoding:binary;[R3] [C1] column_is_not_null:true;[R3] [C1] column_value_new:[3](1);[R3] [C2] column_name:c1;[R3] [C2] column_type:MYSQL_TYPE_LONG;[R3] [C2] column_is_rowkey:false;[R3] [C2] column_is_signed:true;[R3] [C2] column_encoding:binary;[R3] [C2] column_is_not_null:false;[R3] [C2] column_value_new:[3](1);[R3] [C3] column_name:c2;[R3] [C3] column_type:MYSQL_TYPE_LONG;[R3] [C3] column_is_rowkey:false;[R3] [C3] column_is_signed:true;[R3] [C3] column_encoding:binary;[R3] [C3] column_is_not_null:false;[R3] [C3] column_value_new:[3](1);$[R4] record_type:INSERT;[R4] database_name:mysql.test;[R4] table_name:t;[R4] log_event:true;[R4] column_count:3;[R4] source_category:SRC_FULL_RECORDED;[R4] source_type:SRC_OCEANBASE_1_0;[R4] has_pk:true;[R4] pk_info:(0);[R4] pks:__pk_increment;[R4] has_uk:false;[R4] uk_info:(null);[R4] uks:(null);[R4] [C1] column_name:__pk_increment;[R4] [C1] column_type:MYSQL_TYPE_LONGLONG;[R4] [C1] column_is_rowkey:true;[R4] [C1] column_is_signed:false;[R4] [C1] column_encoding:binary;[R4] [C1] column_is_not_null:true;[R4] [C1] column_value_new:[4](1);[R4] [C2] column_name:c1;[R4] [C2] column_type:MYSQL_TYPE_LONG;[R4] [C2] column_is_rowkey:false;[R4] [C2] column_is_signed:true;[R4] [C2] column_encoding:binary;[R4] [C2] column_is_not_null:false;[R4] [C2] column_value_new:[4](1);[R4] [C3] column_name:c2;[R4] [C3] column_type:MYSQL_TYPE_LONG;[R4] [C3] column_is_rowkey:false;[R4] [C3] column_is_signed:true;[R4] [C3] column_encoding:binary;[R4] [C3] column_is_not_null:false;[R4] [C3] column_value_new:[4](1);$[R5] record_type:INSERT;[R5] database_name:mysql.test;[R5] table_name:t;[R5] log_event:true;[R5] column_count:3;[R5] source_category:SRC_FULL_RECORDED;[R5] source_type:SRC_OCEANBASE_1_0;[R5] has_pk:true;[R5] pk_info:(0);[R5] pks:__pk_increment;[R5] has_uk:false;[R5] uk_info:(null);[R5] uks:(null);[R5] [C1] column_name:__pk_increment;[R5] [C1] column_type:MYSQL_TYPE_LONGLONG;[R5] [C1] column_is_rowkey:true;[R5] [C1] column_is_signed:false;[R5] [C1] column_encoding:binary;[R5] [C1] column_is_not_null:true;[R5] [C1] column_value_new:[5](1);[R5] [C2] column_name:c1;[R5] [C2] column_type:MYSQL_TYPE_LONG;[R5] [C2] column_is_rowkey:false;[R5] [C2] column_is_signed:true;[R5] [C2] column_encoding:binary;[R5] [C2] column_is_not_null:false;[R5] [C2] column_value_new:[5](1);[R5] [C3] column_name:c2;[R5] [C3] column_type:MYSQL_TYPE_LONG;[R5] [C3] column_is_rowkey:false;[R5] [C3] column_is_signed:true;[R5] [C3] column_encoding:binary;[R5] [C3] column_is_not_null:false;[R5] [C3] column_value_new:[5](1);$[R6] record_type:INSERT;[R6] database_name:mysql.test;[R6] table_name:t;[R6] log_event:true;[R6] column_count:3;[R6] source_category:SRC_FULL_RECORDED;[R6] source_type:SRC_OCEANBASE_1_0;[R6] has_pk:true;[R6] pk_info:(0);[R6] pks:__pk_increment;[R6] has_uk:false;[R6] uk_info:(null);[R6] uks:(null);[R6] [C1] column_name:__pk_increment;[R6] [C1] column_type:MYSQL_TYPE_LONGLONG;[R6] [C1] column_is_rowkey:true;[R6] [C1] column_is_signed:false;[R6] [C1] column_encoding:binary;[R6] [C1] column_is_not_null:true;[R6] [C1] column_value_new:[6](1);[R6] [C2] column_name:c1;[R6] [C2] column_type:MYSQL_TYPE_LONG;[R6] [C2] column_is_rowkey:false;[R6] [C2] column_is_signed:true;[R6] [C2] column_encoding:binary;[R6] [C2] column_is_not_null:false;[R6] [C2] column_value_new:[6](1);[R6] [C3] column_name:c2;[R6] [C3] column_type:MYSQL_TYPE_LONG;[R6] [C3] column_is_rowkey:false;[R6] [C3] column_is_signed:true;[R6] [C3] column_encoding:binary;[R6] [C3] column_is_not_null:false;[R6] [C3] column_value_new:[6](1);$[R7] record_type:INSERT;[R7] database_name:mysql.test;[R7] table_name:t;[R7] log_event:true;[R7] column_count:3;[R7] source_category:SRC_FULL_RECORDED;[R7] source_type:SRC_OCEANBASE_1_0;[R7] has_pk:true;[R7] pk_info:(0);[R7] pks:__pk_increment;[R7] has_uk:false;[R7] uk_info:(null);[R7] uks:(null);[R7] [C1] column_name:__pk_increment;[R7] [C1] column_type:MYSQL_TYPE_LONGLONG;[R7] [C1] column_is_rowkey:true;[R7] [C1] column_is_signed:false;[R7] [C1] column_encoding:binary;[R7] [C1] column_is_not_null:true;[R7] [C1] column_value_new:[7](1);[R7] [C2] column_name:c1;[R7] [C2] column_type:MYSQL_TYPE_LONG;[R7] [C2] column_is_rowkey:false;[R7] [C2] column_is_signed:true;[R7] [C2] column_encoding:binary;[R7] [C2] column_is_not_null:false;[R7] [C2] column_value_new:[7](1);[R7] [C3] column_name:c2;[R7] [C3] column_type:MYSQL_TYPE_LONG;[R7] [C3] column_is_rowkey:false;[R7] [C3] column_is_signed:true;[R7] [C3] column_encoding:binary;[R7] [C3] column_is_not_null:false;[R7] [C3] column_value_new:[7](1);$[R8] record_type:INSERT;[R8] database_name:mysql.test;[R8] table_name:t;[R8] log_event:true;[R8] column_count:3;[R8] source_category:SRC_FULL_RECORDED;[R8] source_type:SRC_OCEANBASE_1_0;[R8] has_pk:true;[R8] pk_info:(0);[R8] pks:__pk_increment;[R8] has_uk:false;[R8] uk_info:(null);[R8] uks:(null);[R8] [C1] column_name:__pk_increment;[R8] [C1] column_type:MYSQL_TYPE_LONGLONG;[R8] [C1] column_is_rowkey:true;[R8] [C1] column_is_signed:false;[R8] [C1] column_encoding:binary;[R8] [C1] column_is_not_null:true;[R8] [C1] column_value_new:[8](1);[R8] [C2] column_name:c1;[R8] [C2] column_type:MYSQL_TYPE_LONG;[R8] [C2] column_is_rowkey:false;[R8] [C2] column_is_signed:true;[R8] [C2] column_encoding:binary;[R8] [C2] column_is_not_null:false;[R8] [C2] column_value_new:[8](1);[R8] [C3] column_name:c2;[R8] [C3] column_type:MYSQL_TYPE_LONG;[R8] [C3] column_is_rowkey:false;[R8] [C3] column_is_signed:true;[R8] [C3] column_encoding:binary;[R8] [C3] column_is_not_null:false;[R8] [C3] column_value_new:[8](1);$[R9] record_type:INSERT;[R9] database_name:mysql.test;[R9] table_name:t;[R9] log_event:true;[R9] column_count:3;[R9] source_category:SRC_FULL_RECORDED;[R9] source_type:SRC_OCEANBASE_1_0;[R9] has_pk:true;[R9] pk_info:(0);[R9] pks:__pk_increment;[R9] has_uk:false;[R9] uk_info:(null);[R9] uks:(null);[R9] [C1] column_name:__pk_increment;[R9] [C1] column_type:MYSQL_TYPE_LONGLONG;[R9] [C1] column_is_rowkey:true;[R9] [C1] column_is_signed:false;[R9] [C1] column_encoding:binary;[R9] [C1] column_is_not_null:true;[R9] [C1] column_value_new:[9](1);[R9] [C2] column_name:c1;[R9] [C2] column_type:MYSQL_TYPE_LONG;[R9] [C2] column_is_rowkey:false;[R9] [C2] column_is_signed:true;[R9] [C2] column_encoding:binary;[R9] [C2] column_is_not_null:false;[R9] [C2] column_value_new:[9](1);[R9] [C3] column_name:c2;[R9] [C3] column_type:MYSQL_TYPE_LONG;[R9] [C3] column_is_rowkey:false;[R9] [C3] column_is_signed:true;[R9] [C3] column_encoding:binary;[R9] [C3] column_is_not_null:false;[R9] [C3] column_value_new:[9](1);$[R10] record_type:INSERT;[R10] database_name:mysql.test;[R10] table_name:t;[R10] log_event:true;[R10] column_count:3;[R10] source_category:SRC_FULL_RECORDED;[R10] source_type:SRC_OCEANBASE_1_0;[R10] has_pk:true;[R10] pk_info:(0);[R10] pks:__pk_increment;[R10] has_uk:false;[R10] uk_info:(null);[R10] uks:(null);[R10] [C1] column_name:__pk_increment;[R10] [C1] column_type:MYSQL_TYPE_LONGLONG;[R10] [C1] column_is_rowkey:true;[R10] [C1] column_is_signed:false;[R10] [C1] column_encoding:binary;[R10] [C1] column_is_not_null:true;[R10] [C1] column_value_new:[10](2);[R10] [C2] column_name:c1;[R10] [C2] column_type:MYSQL_TYPE_LONG;[R10] [C2] column_is_rowkey:false;[R10] [C2] column_is_signed:true;[R10] [C2] column_encoding:binary;[R10] [C2] column_is_not_null:false;[R10] [C2] column_value_new:[10](2);[R10] [C3] column_name:c2;[R10] [C3] column_type:MYSQL_TYPE_LONG;[R10] [C3] column_is_rowkey:false;[R10] [C3] column_is_signed:true;[R10] [C3] column_encoding:binary;[R10] [C3] column_is_not_null:false;[R10] [C3] column_value_new:[10](2);$[R11] COMMIT;
ob1.oblog.next_dml;
[R0] BEGIN;[R0] org_cluster_id:1234;[R1] record_type:INSERT;[R1] database_name:mysql.test;[R1] table_name:t_part;[R1] log_event:true;[R1] column_count:3;[R1] source_category:SRC_FULL_RECORDED;[R1] source_type:SRC_OCEANBASE_1_0;[R1] has_pk:true;[R1] pk_info:(0,1);[R1] pks:__pk_increment,c1;[R1] has_uk:false;[R1] uk_info:(null);[R1] uks:(null);[R1] [C1] column_name:__pk_increment;[R1] [C1] column_type:MYSQL_TYPE_LONGLONG;[R1] [C1] column_is_rowkey:true;[R1] [C1] column_is_signed:false;[R1] [C1] column_encoding:binary;[R1] [C1] column_is_not_null:true;[R1] [C1] column_value_new:[1](1);[R1] [C2] column_name:c1;[R1] [C2] column_type:MYSQL_TYPE_LONG;[R1] [C2] column_is_rowkey:false;[R1] [C2] column_is_signed:true;[R1] [C2] column_encoding:binary;[R1] [C2] column_is_not_null:false;[R1] [C2] column_value_new:[1](1);[R1] [C3] column_name:c2;[R1] [C3] column_type:MYSQL_TYPE_LONG;[R1] [C3] column_is_rowkey:false;[R1] [C3] column_is_signed:true;[R1] [C3] column_encoding:binary;[R1] [C3] column_is_not_null:false;[R1] [C3] column_value_new:[1](1);$[R2] COMMIT;
ob1.oblog.next_dml;
[R0] BEGIN;[R0] org_cluster_id:1234;[R1] record_type:INSERT;[R1] database_name:mysql.test;[R1] table_name:t_part;[R1] log_event:true;[R1] column_count:3;[R1] source_category:SRC_FULL_RECORDED;[R1] source_type:SRC_OCEANBASE_1_0;[R1] has_pk:true;[R1] pk_info:(0,1);[R1] pks:__pk_increment,c1;[R1] has_uk:false;[R1] uk_info:(null);[R1] uks:(null);[R1] [C1] column_name:__pk_increment;[R1] [C1] column_type:MYSQL_TYPE_LONGLONG;[R1] [C1] column_is_rowkey:true;[R1] [C1] column_is_signed:false;[R1] [C1] column_encoding:binary;[R1] [C1] column_is_not_null:true;[R1] [C1] column_value_new:[1](1);[R1] [C2] column_name:c1;[R1] [C2] column_type:MYSQL_TYPE_LONG;[R1] [C2] column_is_rowkey:false;[R1] [C2] column_is_signed:true;[R1] [C2] column_encoding:binary;[R1] [C2] column_is_not_null:false;[R1] [C2] column_value_new:[2](1);[R1] [C3] column_name:c2;[R1] [C3] column_type:MYSQL_TYPE_LONG;[R1] [C3] column_is_rowkey:false;[R1] [C3] column_is_signed:true;[R1] [C3] column_encoding:binary;[R1] [C3] column_is_not_null:false;[R1] [C3] column_value_new:[2](1);$[R2] COMMIT;
ob1.oblog.next_dml;
[R0] BEGIN;[R0] org_cluster_id:1234;[R1] record_type:INSERT;[R1] database_name:mysql.test;[R1] table_name:t_part;[R1] log_event:true;[R1] column_count:3;[R1] source_category:SRC_FULL_RECORDED;[R1] source_type:SRC_OCEANBASE_1_0;[R1] has_pk:true;[R1] pk_info:(0,1);[R1] pks:__pk_increment,c1;[R1] has_uk:false;[R1] uk_info:(null);[R1] uks:(null);[R1] [C1] column_name:__pk_increment;[R1] [C1] column_type:MYSQL_TYPE_LONGLONG;[R1] [C1] column_is_rowkey:true;[R1] [C1] column_is_signed:false;[R1] [C1] column_encoding:binary;[R1] [C1] column_is_not_null:true;[R1] [C1] column_value_new:[1](1);[R1] [C2] column_name:c1;[R1] [C2] column_type:MYSQL_TYPE_LONG;[R1] [C2] column_is_rowkey:false;[R1] [C2] column_is_signed:true;[R1] [C2] column_encoding:binary;[R1] [C2] column_is_not_null:false;[R1] [C2] column_value_new:[3](1);[R1] [C3] column_name:c2;[R1] [C3] column_type:MYSQL_TYPE_LONG;[R1] [C3] column_is_rowkey:false;[R1] [C3] column_is_signed:true;[R1] [C3] column_encoding:binary;[R1] [C3] column_is_not_null:false;[R1] [C3] column_value_new:[3](1);$[R2] COMMIT;
ob1.oblog.next_dml;
[R0] BEGIN;[R0] org_cluster_id:1234;[R1] record_type:INSERT;[R1] database_name:mysql.test;[R1] table_name:t_part;[R1] log_event:true;[R1] column_count:3;[R1] source_category:SRC_FULL_RECORDED;[R1] source_type:SRC_OCEANBASE_1_0;[R1] has_pk:true;[R1] pk_info:(0,1);[R1] pks:__pk_increment,c1;[R1] has_uk:false;[R1] uk_info:(null);[R1] uks:(null);[R1] [C1] column_name:__pk_increment;[R1] [C1] column_type:MYSQL_TYPE_LONGLONG;[R1] [C1] column_is_rowkey:true;[R1] [C1] column_is_signed:false;[R1] [C1] column_encoding:binary;[R1] [C1] column_is_not_null:true;[R1] [C1] column_value_new:[1](1);[R1] [C2] column_name:c1;[R1] [C2] column_type:MYSQL_TYPE_LONG;[R1] [C2] column_is_rowkey:false;[R1] [C2] column_is_signed:true;[R1] [C2] column_encoding:binary;[R1] [C2] column_is_not_null:false;[R1] [C2] column_value_new:[4](1);[R1] [C3] column_name:c2;[R1] [C3] column_type:MYSQL_TYPE_LONG;[R1] [C3] column_is_rowkey:false;[R1] [C3] column_is_signed:true;[R1] [C3] column_encoding:binary;[R1] [C3] column_is_not_null:false;[R1] [C3] column_value_new:[4](1);$[R2] COMMIT;
ob1.oblog.stop;
ob1.oblog.set_start_tstamp $start_tstamp_before_upgrade;
ob1.oblog.gen_conf tb_white_list=*.*.* skip_ob_version_compat_check=1;
ob1.oblog.restart;
ob1.oblog.stop;
drop table if exists oblog_test;
select * from test.local_var;
c1	c2_local_var
2011-01-01 00:00:00	2011-01-01
set @@session.time_zone='-8:00';
select * from test.local_var;
c1	c2_local_var
2010-12-31 08:00:00	2011-01-01
Warnings:
Warning	5540	System variable 'time_zone' is different from the old value solidified for 'c2_local_var'(old value:'+08:00').
set @@session.time_zone='+8:00';
select * from test.local_var;
c1	c2_local_var
2011-01-01 00:00:00	2011-01-01
select column_name,cur_default_value_v2,local_session_vars from oceanbase.__all_column where column_name='C2_LOCAL_VAR';
column_name	cur_default_value_v2	local_session_vars
c2_local_var	`c1`	030189808080000F0A053FFF808080020186808080000905053FFF2D018D808080001016032DFF062B30383A303000
c2_local_var	NULL	NULL
alter table test.local_var add column C2_LOCAL_VAR_3 time as (cast (c1 as time));
select column_name,cur_default_value_v2,local_session_vars from oceanbase.__all_column where column_name='C2_LOCAL_VAR_3';
column_name	cur_default_value_v2	local_session_vars
C2_LOCAL_VAR_3	cast(`c1` as time(0))	030189808080000F0A053FFF808080020186808080000905053FFF2D018D808080001016032DFF062B30383A303000
alter table test.local_var modify c1 date;
select column_name,cur_default_value_v2,local_session_vars from oceanbase.__all_column where column_name='C2_LOCAL_VAR';
column_name	cur_default_value_v2	local_session_vars
c2_local_var	`c1`	00
c2_local_var	NULL	NULL
alter table test.local_var modify c1 timestamp;
select column_name,cur_default_value_v2,local_session_vars from oceanbase.__all_column where column_name='C2_LOCAL_VAR';
column_name	cur_default_value_v2	local_session_vars
c2_local_var	`c1`	030189808080000F0A053FFF808080020186808080000905053FFF2D018D808080001016032DFF062B30383A303000
c2_local_var	NULL	NULL
create table test.local_var_2(c1 timestamp, c2_local_var_2 date as (cast(c1 as date)), index i1 (c2_local_var_2));
select column_name,cur_default_value_v2,local_session_vars from oceanbase.__all_column where column_name='C2_LOCAL_VAR_2';
column_name	cur_default_value_v2	local_session_vars
c2_local_var_2	cast(`c1` as date)	030189808080000F0A053FFF808080020186808080000905053FFF2D018D808080001016032DFF062B30383A303000
c2_local_var_2	NULL	NULL
