ob1=OBI(cluster=1:1:1,version=4_1_0_0,oblog_version=current);
ob1.proxy0.set extra_config=syslog_level=debug;
ob1.asvr0.set extra_config=$arb_extra_conf;
ob1.reboot;
ob1.mysql alter system set leak_mod_to_check='ModulePageAlloc';
ob1.mysql alter system set debug_sync_timeout = '1000s';
ob1.z1.obs0.sh cd $work_dir/; ls -l {etc,etc2,etc3}/observer.conf*.bin;
ob1.z2.obs0.sh cd $work_dir/; ls -l {etc,etc2,etc3}/observer.conf*.bin;
ob1.z3.obs0.sh cd $work_dir/; ls -l {etc,etc2,etc3}/observer.conf*.bin;
ob1.mysql alter tenant sys set primary_zone = "z1";
ob1.mysql create resource unit box1 max_cpu 2,memory_size 5368709120;
ob1.mysql create resource pool pool1 unit = 'box1', unit_num = 1;
ob1.mysql create tenant oracle replica_num = 1, resource_pool_list=('pool1') set ob_tcp_invited_nodes='%', ob_compatibility_mode='oracle';
ob1.mysql alter tenant oracle set variables autocommit='on';
ob1.mysql alter tenant oracle set primary_zone = 'z1';
create user obtest IDENTIFIED BY obtest;
grant all on *.* to obtest WITH GRANT OPTION;
grant dba to obtest;
ob1.mysql CREATE RESOURCE UNIT unit_1 MAX_CPU 1, MEMORY_SIZE='2G';
ob1.mysql CREATE RESOURCE POOL pool_1 UNIT = 'unit_1', UNIT_NUM = 1, zone_list = ('z1', 'z2', 'z3');
ob1.mysql CREATE TENANT mysql RESOURCE_POOL_LIST = ('pool_1'),  locality='F@z1, F@z2, F@z3', primary_zone='RANDOM' set ob_tcp_invited_nodes='%';
ob1.mysql alter system set balancer_idle_time='10s';
ob1.mysql alter system set merger_check_interval='10s' tenant all;
ob1.mysql alter system set ob_compaction_schedule_interval='10s' tenant all;
ob1.mysql set global ob_sql_audit_percentage=80;
alter proxyconfig set server_state_refresh_interval='1s';
create database db1;
create tablegroup tg;
create table db1.tb_normal (pk int primary key,c1 varchar(1024) default '0', c2 timestamp(6) default now(6), c3 timestamp default now(), index i1(c2), index i2(c1)) tablegroup tg;
create table db1.tb_increment (pk int primary key auto_increment,c1 int, c2 datetime(6) DEFAULT CURRENT_TIMESTAMP(6) ON UPDATE CURRENT_TIMESTAMP(6), index i1(c2)) tablegroup tg;
create table db1.tb_bigtable (c1 varchar(65536),c2 varchar(65536),c3 varchar(65536),c4 varchar(65536), pk bigint primary key auto_increment) COMPRESSION = 'none' tablegroup tg;
create table db1.global_t6(a int, b int, c int, primary key(a)) partition by hash(a) partitions 2;
create index gkey on db1.global_t6(b) global;
insert into db1.global_t6 values(1, 5, 1), (2, 4, 2), (3, 3, 3), (4, 2, 4), (5, 1, 5);
create table db1.global_t7(a int, b int, c int, primary key(a));
insert into db1.global_t7 values(1, 5, 1), (2, 4, 2), (3, 3, 3), (4, 2, 4), (5, 1, 5);
create table test.tb_table_gencol(pk1 bigint, pk2 varchar(2048),c1 varchar(65536), c2 varchar(65536),ac1 bigint auto_increment,
ts timestamp(6) DEFAULT CURRENT_TIMESTAMP(6) ON UPDATE CURRENT_TIMESTAMP(6),  gmt_create timestamp(6) default now(6), gmt_modified timestamp(6) default now(6),
gen_c1 varchar(10) GENERATED ALWAYS AS (substr(c1,1,10)) virtual,
gen_c2 varchar(10) GENERATED ALWAYS AS (substr(c2,1,10)) stored,
primary key(pk1, pk2),index i1(ts));
create table test.tablegencol(c1 bigint primary key,user_id varchar(32) NOT NULL default '' comment 'Alipay User ID', address varchar(256) NOT NULL default '' comment 'address', index(user_id,address(255)));
create table test.table_hash(c1 int primary key, c2 int) partition by hash(c1) partitions 2;
create table test.table_range(c1 int primary key, c2 int) partition by range(c1) (partition p0 values less than (100), partition p1 values less than (200), partition p2 values less than MAXVALUE);
create table test.table_hash_range (c1 int primary key, c2 int) partition by hash(c1) subpartition by range(c1) subpartition template(SUBPARTITION c0 VALUES LESS THAN(1990), SUBPARTITION c1 VALUES LESS THAN (2000), SUBPARTITION c2 VALUES LESS THAN MAXVALUE) partitions 2;
create table test.table_range_hash (c1 int primary key, c2 int) partition by range(c1) subpartition by hash(c1) subpartitions 2 (PARTITION c0 VALUES LESS THAN (1980), PARTITION c1 VALUES LESS THAN (1990), PARTITION c2 VALUES LESS THAN (1995), PARTITION c3 VALUES LESS THAN (2000), PARTITION c4 VALUES LESS THAN MAXVALUE);
create tablegroup tg_old;
create tablegroup tg_part_old partition by hash partitions 2;
create table test.table_with_tg(c1 int primary key, c2 int) tablegroup tg_old;
create table test.t_parent(c1 int, c2 int, constraint t_parent_pk primary key(c1, c2));
create table test.t_child(c1 int, c2 int, constraint t_child_fk foreign key(c2, c1) references test.t_parent(c1, c2));
create table test.t_check_1(c1 int, c2 int, constraint cst1 check(c1 = c2));
create table test.t_check_2(c1 int, c2 int, constraint cst2 check(c2 = c1));
create user dblink_test IDENTIFIED BY 123;
grant all on *.* to dblink_test WITH GRANT OPTION;
grant dba to dblink_test;
create table dblink_t1(a number, b varchar2(60));
insert into dblink_t1 values (1, 'a'), (2, 'b'), (3, 'c');
commit;
create table t1(pk int primary key, c1 number, c2 date default Date '2012-01-02', c3 timestamp default Timestamp '2012-12-01 01:02:03.123456789', c4 timestamp with time zone default Timestamp '2012-12-01 01:02:03.123456789 +02:00');
insert into t1 (pk, c1) values(1,1),(2,2);
delete from t1 where pk=1;
select pk, c1, to_char(c2), to_char(c3), to_char(c4) from t1;
PK	C1	TO_CHAR(C2)	TO_CHAR(C3)	TO_CHAR(C4)
2	2	02-JAN-12	01-DEC-12 01.02.03.123457 AM	01-DEC-12 01.02.03.123457 AM +02:00
create table global_t1(a int, b int, c int, primary key(a)) partition by hash(a) partitions 2;
create index gkey on global_t1(b) global;
insert into global_t1 values(1, 1, 1), (2, 2, 2), (3, 3, 3), (4, 4, 4), (5, 5, 5);
create table global_t2(a int, b int, c int, primary key(a));
insert into global_t2 values(1, 5, 1), (2, 4, 2), (3, 3, 3), (4, 2, 4), (5, 1, 5);
create tablespace tp1;
create table t_parent(c1 int, c2 int, constraint t_parent_pk primary key(c1, c2));
create table t_child(c1 int, c2 int, constraint t_child_fk foreign key(c2, c1) references t_parent(c1, c2));
create table t_check_1(c1 int, c2 int, constraint cst1 check(c1 = c2));
create table t_check_2(c1 int, c2 int, constraint cst2 check(c2 = c1));
create table t_notnull_pk(c1 int primary key, c2 int, c3 int not null);
desc t_notnull_pk;
FIELD	TYPE	NULL	KEY	DEFAULT	EXTRA
C1	NUMBER(38)	NO	PRI	NULL	NULL
C2	NUMBER(38)	YES	NULL	NULL	NULL
C3	NUMBER(38)	NO	NULL	NULL	NULL
create table t_notnull_nopk(c2 int, c3 int not null) partition by hash(c2,c3) partitions 3;
select * from dblink_t1@oci_link;
A	B
1	a
2	b
3	c
set @@session.ob_query_timeout = 60000000;
alter system major freeze tenant=all;
set autocommit=0;
insert into db1.tb_normal(pk,c1) values(101,'101'),(102,'102'),(103,'103'),(104,'104');
update db1.tb_normal set c1=concat(c1,'_x') where pk > 100;
delete from db1.tb_normal where pk=104;
commit;
ob1.check_until_timeout  select count(1) as unsync_cnt from GV\$OB_LOG_STAT where in_sync = 'NO',0,600;
ob1.z2.obs0.force_stop;
ob1.check_until_timeout select count(*) from oceanbase.DBA_OB_SERVERS where zone = 'z2' and status='INACTIVE',1,60;
ob1.z2.obs0.nstart;
ob1.check_until_timeout select count(*) from oceanbase.__all_server where zone = 'z2' and (start_service_time <= 0 or status='INACTIVE'),0,120;
ob1.check_until_timeout select count(*) as cnt from oceanbase.__all_virtual_server_schema_info as a join oceanbase.__all_virtual_server_schema_info as b on a.tenant_id = b.tenant_id  where a.refreshed_schema_version != b.refreshed_schema_version, 0, 60;
ob1.upgrade_check_before;
ob1.upgrade_commond_for_server pre;
set @@session.ob_query_timeout = 60000000;
alter system stop zone 'z2';
ob1.check_until_timeout select status from DBA_OB_ZONES where zone='z2',INACTIVE,20;
ob1.check_until_timeout select count(1) as leader_count  from CDB_OB_LS_LOCATIONS where zone='z2' and role='leader',0,20;
ob1.z2.force_stop;
ob1.check_until_timeout select count(*) from oceanbase.DBA_OB_SERVERS where zone = 'z2' and status='INACTIVE',1,60;
ob1.z2.upgrade;
ob1.z2.nstart;
ob1.check_until_timeout select count(*) from oceanbase.__all_server where zone = 'z2' and (start_service_time is null  or status='INACTIVE'),0,300;
ob1.check_until_timeout  select count(1) as unsync_cnt from GV\$OB_LOG_STAT where in_sync = 'NO',0,600;
ob1.check_until_timeout select count(*) from oceanbase.__all_server a left join oceanbase.__all_virtual_server_schema_info b on a.svr_ip = b.svr_ip and a.svr_port = b.svr_port where b.svr_ip is null, 0, 120;
ob1.check_until_timeout select count(*) as cnt from oceanbase.__all_virtual_server_schema_info as a join oceanbase.__all_virtual_server_schema_info as b on a.tenant_id = b.tenant_id  where a.refreshed_schema_version != b.refreshed_schema_version or a.refreshed_schema_version % 8 != 0, 0, 180;
ob1.mysql alter system start zone 'z2';
ob1.mysql alter system stop server '$server1_ip:$server1_port';
ob1.check_until_timeout select count(*) from CDB_OB_LS_LOCATIONS where zone != 'z1' and role='leader' and tenant_id = (select tenant_id from __all_tenant where tenant_name='sys'),0,60;
set autocommit=0;
insert into db1.tb_normal(pk,c1) values(301,'301'),(302,'302'),(303,'303'),(304,'304');
update db1.tb_normal set c1=concat(c1,'_x') where pk > 100;
delete from db1.tb_normal where pk=304;
update db1.tb_increment set pk=pk+1 order by pk desc limit 1;
insert into db1.tb_increment(pk,c1) values (301,301),(302,302);
replace into db1.tb_increment(pk,c1) values (301,302);
delete from db1.tb_increment where pk=302;
commit;
set autocommit=1;
select pk,c1 from db1.tb_normal order by pk;
pk	c1
1	0
2	0
3	0
4	0
5	0
6	0
7	0
8	0
9	0
10	0
11	0
12	0
13	0
14	0
15	0
16	0
17	0
18	0
19	0
20	0
21	0
22	0
23	0
24	0
25	0
26	0
27	0
28	0
29	0
30	0
31	0
32	0
33	0
34	0
35	0
36	0
37	0
38	0
39	0
40	0
41	0
42	0
43	0
44	0
45	0
46	0
47	0
48	0
49	0
50	0
51	0
52	0
53	0
54	0
55	0
56	0
57	0
58	0
59	0
60	0
61	0
62	0
63	0
64	0
65	0
66	0
67	0
68	0
69	0
70	0
71	0
72	0
73	0
74	0
75	0
76	0
77	0
78	0
79	0
80	0
81	0
82	0
83	0
84	0
85	0
86	0
87	0
88	0
89	0
90	0
91	0
92	0
93	0
94	0
95	0
96	0
97	0
98	0
99	0
100	0
101	101_x_x
102	102_x_x
103	103_x_x
301	301_x
302	302_x
303	303_x
select pk,c1 from db1.tb_increment order by pk limit 1;
pk	c1
1	1
select a.pk,a.c1,b.c1 from db1.tb_normal a join db1.tb_increment b where a.pk=b.pk order by a.pk limit 2;
pk	c1	c1
1	0	1
2	0	2
show tables like 'tb_normal';
Tables_in_db1 (tb_normal)
tb_normal
show create table db1.tb_increment;
Table	Create Table
tb_increment	CREATE TABLE `tb_increment` (
  `pk` int(11) NOT NULL AUTO_INCREMENT,
  `c1` int(11) DEFAULT NULL,
  `c2` datetime(6) DEFAULT CURRENT_TIMESTAMP(6) ON UPDATE CURRENT_TIMESTAMP(6),
  PRIMARY KEY (`pk`),
  KEY `i1` (`c2`) BLOCK_SIZE 16384 LOCAL
) AUTO_INCREMENT = 303 AUTO_INCREMENT_MODE = 'ORDER' DEFAULT CHARSET = utf8mb4 ROW_FORMAT = DYNAMIC COMPRESSION = 'zstd_1.3.8' REPLICA_NUM = 3 BLOCK_SIZE = 16384 USE_BLOOM_FILTER = FALSE TABLET_SIZE = 134217728 PCTFREE = 0 TABLEGROUP = 'tg'
select /*+index(global_t6 primary)*/ * from global_t6;
a	b	c
2	4	2
4	2	4
1	5	1
3	3	3
5	1	5
insert into global_t6 values(10, 100, 10);
update global_t6 set b=7 where a=1;
select /*+index(global_t6 gkey)*/ a, b from global_t6;
a	b
5	1
4	2
3	3
2	4
1	7
10	100
update global_t6 set a=100 where b=2;
update global_t6 set b=19 where b=1;
select /*+index(global_t6 gkey)*/ a, b from global_t6;
a	b
100	2
3	3
2	4
1	7
5	19
10	100
update global_t6 set c=100 where b>=10;
select /*+index(global_t6 gkey)*/ a, b from global_t6;
a	b
100	2
3	3
2	4
1	7
5	19
10	100
delete from global_t6 where a=1;
select /*+index(global_t6 gkey)*/ a, b from global_t6;
a	b
100	2
3	3
2	4
5	19
10	100
delete from global_t6 where a=2 or a=3;
select /*+index(global_t6 gkey)*/ a, b from global_t6;
a	b
100	2
5	19
10	100
delete from global_t6 where b>=100;
select /*+index(global_t6 gkey)*/ a, b from global_t6;
a	b
100	2
5	19
delete from global_t6;
select /*+index(global_t6 primary)*/ * from global_t6;
a	b	c
insert into global_t6 values(1, 1, 1), (5, 6, 2), (4, 2, 1);
select /*+index(global_t6 primary)*/ * from global_t6;
a	b	c
4	2	1
1	1	1
5	6	2
delete from global_t6 where b < 7 and b >1;
select /*+index(global_t6 gkey)*/ a, b from global_t6;
a	b
1	1
select /*+index(global_t6 primary)*/ a, b, c from global_t6;
a	b	c
1	1	1
insert into global_t6 values(2, 2, 2), (3, 3, 3), (4, 4, 4) on duplicate key update b=b+1;
select /*+index(global_t6 gkey)*/ a, b from global_t6;
a	b
1	1
2	2
3	3
4	4
select /*+index(global_t6 primary)*/ a, b, c from global_t6;
a	b	c
2	2	2
4	4	4
1	1	1
3	3	3
insert into global_t6 values(2, 2, 2), (3, 3, 3), (4, 4, 4) on duplicate key update b=b+1;
select /*+index(global_t6 gkey)*/ a, b from global_t6;
a	b
1	1
2	3
3	4
4	5
select /*+index(global_t6 primary)*/ a, b, c from global_t6;
a	b	c
2	3	2
4	5	4
1	1	1
3	4	3
replace into global_t6 values(2, 2, 2), (3, 3, 3), (4, 4, 4);
select /*+index(global_t6 gkey)*/ a, b from global_t6;
a	b
1	1
2	2
3	3
4	4
select /*+index(global_t6 primary)*/ a, b, c from global_t6;
a	b	c
2	2	2
4	4	4
1	1	1
3	3	3
commit;
select * from global_t1 for update;
A	B	C
1	1	1
2	2	2
3	3	3
4	4	4
5	5	5
select * from global_t1, global_t2 where global_t1.a = global_t2.a for update;
A	B	C	A	B	C
1	1	1	1	5	1
2	2	2	2	4	2
3	3	3	3	3	3
4	4	4	4	2	4
5	5	5	5	1	5
commit;
insert into t1 (pk, c1) values(4,4);
update t1 set c1=0 where pk=2;
select pk, c1, to_char(c2), to_char(c3), to_char(c4) from t1;
PK	C1	TO_CHAR(C2)	TO_CHAR(C3)	TO_CHAR(C4)
2	0	02-JAN-12	01-DEC-12 01.02.03.123457 AM	01-DEC-12 01.02.03.123457 AM +02:00
4	4	02-JAN-12	01-DEC-12 01.02.03.123457 AM	01-DEC-12 01.02.03.123457 AM +02:00
ob1.z1.mysql_p show global variables like 'max_user_connections';
Variable_name	Value
max_user_connections	0
ob1.z1.mysql_p show variables like 'max_user_connections';
Variable_name	Value
max_user_connections	0
ob1.z1.mysql_p show create table oceanbase.__all_table;
Table	Create Table
__all_table	CREATE TABLE `__all_table` (\n  `gmt_create` timestamp(6) NULL DEFAULT CURRENT_TIMESTAMP(6),\n  `gmt_modified` timestamp(6) NULL DEFAULT CURRENT_TIMESTAMP(6) ON UPDATE CURRENT_TIMESTAMP(6),\n  `tenant_id` bigint(20) NOT NULL,\n  `table_id` bigint(20) NOT NULL,\n  `table_name` varchar(256) NOT NULL DEFAULT '',\n  `database_id` bigint(20) NOT NULL,\n  `table_type` bigint(20) NOT NULL,\n  `load_type` bigint(20) NOT NULL,\n  `def_type` bigint(20) NOT NULL,\n  `rowkey_column_num` bigint(20) NOT NULL,\n  `index_column_num` bigint(20) NOT NULL,\n  `max_used_column_id` bigint(20) NOT NULL,\n  `autoinc_column_id` bigint(20) NOT NULL,\n  `auto_increment` bigint(20) unsigned DEFAULT '1',\n  `read_only` bigint(20) NOT NULL,\n  `rowkey_split_pos` bigint(20) NOT NULL,\n  `compress_func_name` varchar(128) NOT NULL,\n  `expire_condition` varchar(4096) NOT NULL,\n  `is_use_bloomfilter` bigint(20) NOT NULL,\n  `comment` varchar(4096) NOT NULL DEFAULT '',\n  `block_size` bigint(20) NOT NULL,\n  `collation_type` bigint(20) NOT NULL,\n  `data_table_id` bigint(20) DEFAULT NULL,\n  `index_status` bigint(20) NOT NULL,\n  `tablegroup_id` bigint(20) NOT NULL,\n  `progressive_merge_num` bigint(20) NOT NULL,\n  `index_type` bigint(20) NOT NULL,\n  `part_level` bigint(20) NOT NULL,\n  `part_func_type` bigint(20) NOT NULL,\n  `part_func_expr` varchar(4096) NOT NULL,\n  `part_num` bigint(20) NOT NULL,\n  `sub_part_func_type` bigint(20) NOT NULL,\n  `sub_part_func_expr` varchar(4096) NOT NULL,\n  `sub_part_num` bigint(20) NOT NULL,\n  `schema_version` bigint(20) NOT NULL,\n  `view_definition` longtext NOT NULL,\n  `view_check_option` bigint(20) NOT NULL,\n  `view_is_updatable` bigint(20) NOT NULL,\n  `index_using_type` bigint(20) NOT NULL DEFAULT '0',\n  `parser_name` varchar(128) DEFAULT NULL,\n  `index_attributes_set` bigint(20) DEFAULT '0',\n  `tablet_size` bigint(20) NOT NULL DEFAULT '134217728',\n  `pctfree` bigint(20) NOT NULL DEFAULT '10',\n  `partition_status` bigint(20) DEFAULT '0',\n  `partition_schema_version` bigint(20) DEFAULT '0',\n  `session_id` bigint(20) DEFAULT '0',\n  `pk_comment` varchar(4096) NOT NULL DEFAULT '',\n  `sess_active_time` bigint(20) DEFAULT '0',\n  `row_store_type` varchar(128) DEFAULT 'encoding_row_store',\n  `store_format` varchar(128) DEFAULT '',\n  `duplicate_scope` bigint(20) DEFAULT '0',\n  `progressive_merge_round` bigint(20) DEFAULT '0',\n  `storage_format_version` bigint(20) DEFAULT '2',\n  `table_mode` bigint(20) NOT NULL DEFAULT '0',\n  `encryption` varchar(128) DEFAULT '',\n  `tablespace_id` bigint(20) NOT NULL DEFAULT '-1',\n  `sub_part_template_flags` bigint(20) NOT NULL DEFAULT '0',\n  `dop` bigint(20) NOT NULL DEFAULT '1',\n  `character_set_client` bigint(20) NOT NULL DEFAULT '0',\n  `collation_connection` bigint(20) NOT NULL DEFAULT '0',\n  `auto_part_size` bigint(20) NOT NULL DEFAULT '-1',\n  `auto_part` tinyint(4) NOT NULL DEFAULT '0',\n  `association_table_id` bigint(20) NOT NULL DEFAULT '-1',\n  `tablet_id` bigint(20) NOT NULL DEFAULT '0',\n  `max_dependency_version` bigint(20) NOT NULL DEFAULT '-1',\n  `define_user_id` bigint(20) NOT NULL DEFAULT '-1',\n  `transition_point` varchar(4096) DEFAULT NULL,\n  `b_transition_point` varchar(8192) DEFAULT NULL,\n  `interval_range` varchar(4096) DEFAULT NULL,\n  `b_interval_range` varchar(8192) DEFAULT NULL,\n  `object_status` bigint(20) NOT NULL DEFAULT '1',\n  `table_flags` bigint(20) NOT NULL DEFAULT '0',\n  `truncate_version` bigint(20) NOT NULL DEFAULT '-1',\n  PRIMARY KEY (`tenant_id`, `table_id`),\n  KEY `idx_data_table_id` (`data_table_id`) BLOCK_SIZE 16384 LOCAL,\n  KEY `idx_db_tb_name` (`database_id`, `table_name`) BLOCK_SIZE 16384 LOCAL,\n  KEY `idx_tb_name` (`table_name`) BLOCK_SIZE 16384 LOCAL\n) DEFAULT CHARSET = utf8mb4 ROW_FORMAT = DYNAMIC COMPRESSION = 'none' REPLICA_NUM = 3 BLOCK_SIZE = 16384 USE_BLOOM_FILTER = FALSE TABLET_SIZE = 134217728 PCTFREE = 10 TABLEGROUP = 'oceanbase'
ob1.z1.mysql show parameters like 'zone_merge_concurrency';
ob1.z2.mysql_p show global variables like 'max_user_connections';
Variable_name	Value
max_user_connections	0
ob1.z2.mysql_p show variables like 'max_user_connections';
Variable_name	Value
max_user_connections	0
ob1.z2.mysql_p show create table oceanbase.__all_table;
Table	Create Table
__all_table	CREATE TABLE `__all_table` (\n  `gmt_create` timestamp(6) NULL DEFAULT CURRENT_TIMESTAMP(6),\n  `gmt_modified` timestamp(6) NULL DEFAULT CURRENT_TIMESTAMP(6) ON UPDATE CURRENT_TIMESTAMP(6),\n  `tenant_id` bigint(20) NOT NULL,\n  `table_id` bigint(20) NOT NULL,\n  `table_name` varchar(256) NOT NULL DEFAULT '',\n  `database_id` bigint(20) NOT NULL,\n  `table_type` bigint(20) NOT NULL,\n  `load_type` bigint(20) NOT NULL,\n  `def_type` bigint(20) NOT NULL,\n  `rowkey_column_num` bigint(20) NOT NULL,\n  `index_column_num` bigint(20) NOT NULL,\n  `max_used_column_id` bigint(20) NOT NULL,\n  `autoinc_column_id` bigint(20) NOT NULL,\n  `auto_increment` bigint(20) unsigned DEFAULT '1',\n  `read_only` bigint(20) NOT NULL,\n  `rowkey_split_pos` bigint(20) NOT NULL,\n  `compress_func_name` varchar(128) NOT NULL,\n  `expire_condition` varchar(4096) NOT NULL,\n  `is_use_bloomfilter` bigint(20) NOT NULL,\n  `comment` varchar(4096) NOT NULL DEFAULT '',\n  `block_size` bigint(20) NOT NULL,\n  `collation_type` bigint(20) NOT NULL,\n  `data_table_id` bigint(20) DEFAULT NULL,\n  `index_status` bigint(20) NOT NULL,\n  `tablegroup_id` bigint(20) NOT NULL,\n  `progressive_merge_num` bigint(20) NOT NULL,\n  `index_type` bigint(20) NOT NULL,\n  `part_level` bigint(20) NOT NULL,\n  `part_func_type` bigint(20) NOT NULL,\n  `part_func_expr` varchar(4096) NOT NULL,\n  `part_num` bigint(20) NOT NULL,\n  `sub_part_func_type` bigint(20) NOT NULL,\n  `sub_part_func_expr` varchar(4096) NOT NULL,\n  `sub_part_num` bigint(20) NOT NULL,\n  `schema_version` bigint(20) NOT NULL,\n  `view_definition` longtext NOT NULL,\n  `view_check_option` bigint(20) NOT NULL,\n  `view_is_updatable` bigint(20) NOT NULL,\n  `index_using_type` bigint(20) NOT NULL DEFAULT '0',\n  `parser_name` varchar(128) DEFAULT NULL,\n  `index_attributes_set` bigint(20) DEFAULT '0',\n  `tablet_size` bigint(20) NOT NULL DEFAULT '134217728',\n  `pctfree` bigint(20) NOT NULL DEFAULT '10',\n  `partition_status` bigint(20) DEFAULT '0',\n  `partition_schema_version` bigint(20) DEFAULT '0',\n  `session_id` bigint(20) DEFAULT '0',\n  `pk_comment` varchar(4096) NOT NULL DEFAULT '',\n  `sess_active_time` bigint(20) DEFAULT '0',\n  `row_store_type` varchar(128) DEFAULT 'encoding_row_store',\n  `store_format` varchar(128) DEFAULT '',\n  `duplicate_scope` bigint(20) DEFAULT '0',\n  `progressive_merge_round` bigint(20) DEFAULT '0',\n  `storage_format_version` bigint(20) DEFAULT '2',\n  `table_mode` bigint(20) NOT NULL DEFAULT '0',\n  `encryption` varchar(128) DEFAULT '',\n  `tablespace_id` bigint(20) NOT NULL DEFAULT '-1',\n  `sub_part_template_flags` bigint(20) NOT NULL DEFAULT '0',\n  `dop` bigint(20) NOT NULL DEFAULT '1',\n  `character_set_client` bigint(20) NOT NULL DEFAULT '0',\n  `collation_connection` bigint(20) NOT NULL DEFAULT '0',\n  `auto_part_size` bigint(20) NOT NULL DEFAULT '-1',\n  `auto_part` tinyint(4) NOT NULL DEFAULT '0',\n  `association_table_id` bigint(20) NOT NULL DEFAULT '-1',\n  `tablet_id` bigint(20) NOT NULL DEFAULT '0',\n  `max_dependency_version` bigint(20) NOT NULL DEFAULT '-1',\n  `define_user_id` bigint(20) NOT NULL DEFAULT '-1',\n  `transition_point` varchar(4096) DEFAULT NULL,\n  `b_transition_point` varchar(8192) DEFAULT NULL,\n  `interval_range` varchar(4096) DEFAULT NULL,\n  `b_interval_range` varchar(8192) DEFAULT NULL,\n  `object_status` bigint(20) NOT NULL DEFAULT '1',\n  `table_flags` bigint(20) NOT NULL DEFAULT '0',\n  `truncate_version` bigint(20) NOT NULL DEFAULT '-1',\n  PRIMARY KEY (`tenant_id`, `table_id`),\n  KEY `idx_data_table_id` (`data_table_id`) BLOCK_SIZE 16384 LOCAL,\n  KEY `idx_db_tb_name` (`database_id`, `table_name`) BLOCK_SIZE 16384 LOCAL,\n  KEY `idx_tb_name` (`table_name`) BLOCK_SIZE 16384 LOCAL\n) DEFAULT CHARSET = utf8mb4 ROW_FORMAT = DYNAMIC COMPRESSION = 'none' REPLICA_NUM = 3 BLOCK_SIZE = 16384 USE_BLOOM_FILTER = FALSE TABLET_SIZE = 134217728 PCTFREE = 10 TABLEGROUP = 'oceanbase'
ob1.z2.mysql show parameters like 'zone_merge_concurrency';
ob1.mysql alter system minor freeze tenant = all;
set autocommit=0;
insert into db1.tb_normal(pk,c1) values(601,'601'),(602,'602'),(603,'603'),(604,'604');
update db1.tb_normal set c1=concat(c1,'_x') where pk > 100;
delete from db1.tb_normal where pk=604;
update db1.tb_increment set pk=pk+1 order by pk desc limit 1;
insert into db1.tb_increment(pk,c1) values (601,601),(602,602);
replace into db1.tb_increment(pk,c1) values (601,602);
delete from db1.tb_increment where pk=602;
commit;
set autocommit=1;
ob1.mysql alter system start server '$server1_ip:$server1_port';
ob1.z2.obs0.force_stop;
ob1.check_until_timeout select count(*) from oceanbase.DBA_OB_SERVERS where zone = 'z2' and status='INACTIVE',1,60;
ob1.z2.obs0.nstart;
ob1.check_until_timeout select count(*) from oceanbase.__all_server where zone = 'z2' and (start_service_time <= 0 or status='INACTIVE'),0,120;
ob1.check_until_timeout select count(*) as cnt from oceanbase.__all_virtual_server_schema_info as a join oceanbase.__all_virtual_server_schema_info as b on a.tenant_id = b.tenant_id  where a.refreshed_schema_version != b.refreshed_schema_version, 0, 60;
ob1.mysql alter system set server_permanent_offline_time = '20s';
ob1.z2.obs0.force_stop;
ob1.z2.obs0.nstart;
ob1.check_until_timeout select count(*) from oceanbase.__all_server where zone = 'z2' and (start_service_time <= 0 or status='INACTIVE'),0,120;
ob1.check_until_timeout select count(*) > 0 from oceanbase.__all_rootservice_event_history where event like '%finish_add%' and value6 like '%ret:0;%',1,120;
