ob1=OBI(cluster=2:2:3,proxy_num=0);
ob1.z1.obs0.set extra_config=$extra_conf;
ob1.z2.obs0.set extra_config=$extra_conf;
ob1.z3.obs0.set extra_config=$extra_conf;
ob1.z1.obs1.set status=disable;
ob1.z2.obs1.set status=disable;
ob1.z3.obs1.set status=disable;
ob1.z3.obs2.set status=disable;
===============================================================
====================     bootstrap   ==========================
===============================================================
test case for bootstrap begin
ob1.reboot;
ob1.mysql alter tenant sys set primary_zone = 'z3;z2;z1';
ob1.mysql alter system set enable_rebalance='false';
ob1.check_until_timeout select role from __all_ls_meta_table where tenant_id=1 and ls_id=1 and zone='z3', 1, 600;
test case for bootstrap finish
===============================================================
====================     add server   =========================
===============================================================
test case for add server begin
SELECT COUNT(*) as server_count FROM DBA_OB_SERVERS WHERE STATUS = "ACTIVE";
server_count
3
SELECT COUNT(*) as server_count FROM GV$OB_SERVERS;
server_count
3
ob1.z1.obs1.set extra_config=$extra_conf;
ob1.z2.obs1.set extra_config=$extra_conf;
ob1.z3.obs1.set extra_config=$extra_conf;
ob1.z1.obs1.set status=enable;
ob1.z2.obs1.set status=enable;
ob1.z3.obs1.set status=enable;
ob1.z1.obs1.start;
ob1.z2.obs1.start;
ob1.z3.obs1.start;
ob1.check_until_timeout select count(*) as cnt from oceanbase.__all_virtual_server_schema_info as a join oceanbase.__all_virtual_server_schema_info as b on a.tenant_id = b.tenant_id  where (a.refreshed_schema_version != b.refreshed_schema_version or a.refreshed_schema_version % 8 != 0) and a.tenant_id = 1, 0, 120;
ob1.z1.obs1.check_log_until_success -c "weak read service thread start";
ob1.z2.obs1.check_log_until_success -c "weak read service thread start";
ob1.z3.obs1.check_log_until_success -c "weak read service thread start";
ob1.z1.obs1.add;
ob1.z2.obs1.add;
ob1.z3.obs1.add;
ob1.check_until_timeout SELECT COUNT(*) c FROM DBA_OB_SERVERS WHERE START_SERVICE_TIME > 0, 6, 200;
set @@session.ob_query_timeout = 100000000000;
SELECT COUNT(*) as server_count FROM DBA_OB_SERVERS WHERE STATUS = "ACTIVE";
server_count
6
ob1.check_until_timeout SELECT COUNT(*) as server_count FROM GV\$OB_SERVERS, 6, 8;
ob1.check_until_timeout select IF(count(*) = $tenant_cnt * $server_cnt, 1, 0) as done from oceanbase.__all_virtual_server_schema_info, 1, 120;
ob1.check_until_timeout select count(*) as cnt from oceanbase.__all_virtual_server_schema_info as a join oceanbase.__all_virtual_server_schema_info as b on a.tenant_id = b.tenant_id  where (a.refreshed_schema_version != b.refreshed_schema_version or a.refreshed_schema_version % 8 != 0) and a.tenant_id <= $mysql_tenant_id, 0, 60;
test case for add server finish
===============================================================
==================     create tenant   ========================
===============================================================
test case for create tenant begin
set @@session.ob_query_timeout = 1000000000;
CREATE RESOURCE UNIT unit_1 MAX_CPU 2, MEMORY_SIZE='3G';
CREATE RESOURCE POOL pool_1 UNIT = 'unit_1', UNIT_NUM = 1;
CREATE TENANT mysql RESOURCE_POOL_LIST = ('pool_1'), primary_zone='z1', locality='F@z1, F@z3' set ob_tcp_invited_nodes='%';
ob1.check_until_timeout select count(*) as cnt from oceanbase.__all_virtual_server_schema_info as a join oceanbase.__all_virtual_server_schema_info as b on a.tenant_id = b.tenant_id  where a.refreshed_schema_version != b.refreshed_schema_version, 0, 60;
ob_connect(conn_mysql_meta, ob1.z1.obs0, root@META$1002, , test, , USE_MYSQL_CONNECTOR)
ERROR 0A000: login meta tenant not supported
alter system run job "root_inspection";
alter system upgrade virtual schema;
test case for create tenant finish
===============================================================
===========     dml/select under sys tenant   =================
===============================================================
test case for dml and select under sys tenant begin
create table t1_no_pk (c1 int);
ob1.check_until_timeout select count(*) as cnt from oceanbase.__all_virtual_server_schema_info as a join oceanbase.__all_virtual_server_schema_info as b on a.tenant_id = b.tenant_id  where a.refreshed_schema_version != b.refreshed_schema_version, 0, 60;
insert into t1_no_pk values (1), (2), (3);
select * from t1_no_pk order by c1 asc;
c1
1
2
3
update t1_no_pk set c1=c1+10;
select * from t1_no_pk order by c1 asc;
c1
11
12
13
create table t1_pk (c1 int primary key);
ob1.check_until_timeout select count(*) as cnt from oceanbase.__all_virtual_server_schema_info as a join oceanbase.__all_virtual_server_schema_info as b on a.tenant_id = b.tenant_id  where a.refreshed_schema_version != b.refreshed_schema_version, 0, 60;
insert into t1_pk values (1), (2), (3);
select * from t1_pk order by c1 asc;
c1
1
2
3
update t1_pk set c1=c1+10;
select * from t1_pk order by c1 asc;
c1
11
12
13
create table t1_part (c1 int primary key) partition by hash(c1) partitions 4;
ob1.check_until_timeout select count(*) as cnt from oceanbase.__all_virtual_server_schema_info as a join oceanbase.__all_virtual_server_schema_info as b on a.tenant_id = b.tenant_id  where a.refreshed_schema_version != b.refreshed_schema_version, 0, 60;
insert into t1_part values (1), (2), (3), (4);
select * from t1_part order by c1 asc;
c1
1
2
3
4
update t1_part set c1=c1+10;
select * from t1_part order by c1 asc;
c1
11
12
13
14
test case for dml and select under sys tenant finish
===============================================================
==========     dml/select under mysql tenant   ================
===============================================================
test case for dml and select under mysql tenant begin
create table t1_no_pk (c1 int);
ob1.check_until_timeout select count(*) as cnt from oceanbase.__all_virtual_server_schema_info as a join oceanbase.__all_virtual_server_schema_info as b on a.tenant_id = b.tenant_id  where a.refreshed_schema_version != b.refreshed_schema_version, 0, 60;
insert into t1_no_pk values (1), (2), (3);
select * from t1_no_pk order by c1 asc;
c1
1
2
3
update t1_no_pk set c1=c1+10;
select * from t1_no_pk order by c1 asc;
c1
11
12
13
create table t1_pk (c1 int primary key);
ob1.check_until_timeout select count(*) as cnt from oceanbase.__all_virtual_server_schema_info as a join oceanbase.__all_virtual_server_schema_info as b on a.tenant_id = b.tenant_id  where a.refreshed_schema_version != b.refreshed_schema_version, 0, 60;
insert into t1_pk values (1), (2), (3);
select * from t1_pk order by c1 asc;
c1
1
2
3
update t1_pk set c1=c1+10;
select * from t1_pk order by c1 asc;
c1
11
12
13
create table t1_part (c1 int primary key) partition by hash(c1) partitions 4;
ob1.check_until_timeout select count(*) as cnt from oceanbase.__all_virtual_server_schema_info as a join oceanbase.__all_virtual_server_schema_info as b on a.tenant_id = b.tenant_id  where a.refreshed_schema_version != b.refreshed_schema_version, 0, 60;
insert into t1_part values (1), (2), (3), (4);
select * from t1_part order by c1 asc;
c1
1
2
3
4
update t1_part set c1=c1+10;
select * from t1_part order by c1 asc;
c1
11
12
13
14
create table like_t1_part like t1_part;
ob1.check_until_timeout select count(*) as cnt from oceanbase.__all_virtual_server_schema_info as a join oceanbase.__all_virtual_server_schema_info as b on a.tenant_id = b.tenant_id  where a.refreshed_schema_version != b.refreshed_schema_version, 0, 60;
insert into like_t1_part values (1), (2), (3), (4);
select * from like_t1_part order by c1 asc;
c1
1
2
3
4
update like_t1_part set c1=c1+10;
select * from like_t1_part order by c1 asc;
c1
11
12
13
14
test case for dml and select under mysql tenant finish
===============================================================
==========     dml/select under mysql tenant   ================
===============================================================
test dml and select under mysql tenant after minor freeze begin
set @@session.ob_query_timeout = 100000000000;
alter system minor freeze tenant mysql;
insert into t1_no_pk values (1001), (1002), (1003);
select * from t1_no_pk order by c1 asc;
c1
11
12
13
1001
1002
1003
update t1_no_pk set c1=c1+10;
select * from t1_no_pk order by c1 asc;
c1
21
22
23
1011
1012
1013
insert into t1_pk values (1011), (1012), (1013);
select * from t1_pk order by c1 asc;
c1
11
12
13
1011
1012
1013
update t1_pk set c1=c1+10;
select * from t1_pk order by c1 asc;
c1
21
22
23
1021
1022
1023
create table t1_part_1 (c1 int primary key) partition by hash(c1) partitions 4;
ob1.check_until_timeout select count(*) as cnt from oceanbase.__all_virtual_server_schema_info as a join oceanbase.__all_virtual_server_schema_info as b on a.tenant_id = b.tenant_id  where a.refreshed_schema_version != b.refreshed_schema_version, 0, 60;
insert into t1_part_1 values (1), (2), (3), (4);
select * from t1_part_1 order by c1 asc;
c1
1
2
3
4
update t1_part_1 set c1=c1+10;
select * from t1_part_1 order by c1 asc;
c1
11
12
13
14
test dml and select under mysql tenant after minor freeze finish
===============================================================
=================     checkpoint slog   =======================
===============================================================
test checkpoint slog begin
test checkpoint slog finish
===============================================================
=================     ls auto create    =======================
===============================================================
test ls auto create by alter primary_zone begin
ob1.mysql alter system set debug_sync_timeout = '1000s';
ob1.mysql set ob_global_debug_sync = 'BEFORE_CREATE_USER_LS wait_for signal';
ob1.mysql ALTER TENANT mysql set primary_zone='z1, z3';
ob1.check_until_timeout select count(*) from oceanbase.__all_virtual_ls where tenant_id = $mysql_tenant_id and status = 'CREATING', 1, 30;
ob1.mysql_p select ls_id, ls_group_id, status from  oceanbase.__all_virtual_ls where tenant_id = $mysql_tenant_id;
ls_id	ls_group_id	status
1	0	NORMAL
1001	1001	NORMAL
1002	1001	CREATING
ob1.mysql set ob_global_debug_sync = 'now signal signal';
test ls auto create by alter primary_zone finish
===============================================================
============     create index before restart   ================
===============================================================
test create index before restart begin
create table test_create_index(c1 int, c2 int);
insert into test_create_index values(1,1);
create index i1 on test_create_index(c2);
test create index before restart finish
===============================================================
============     alter schema before restart   ================
===============================================================
test alter schema before restart begin
create table t_no_pk(a int, b int);
insert into t_no_pk values(1, 1), (2, 2);
alter table t_no_pk add x varchar(10) after a;
insert into t_no_pk values(3, 'hehe', 3);
alter table t_no_pk add y int;
insert into t_no_pk values(4, '666', 4, 4), (5, '888', 5, 5);
select * from t_no_pk;
a	x	b	y
1	NULL	1	NULL
2	NULL	2	NULL
3	hehe	3	NULL
4	666	4	4
5	888	5	5
drop table t_no_pk;
test alter schema before restart finish
===============================================================
=================     restart cluster    ======================
===============================================================
test restart cluster begin
ob1.force_stop;
ob1.nstart;
ob1.check_until_timeout select count(*) as cnt from oceanbase.__all_server where start_service_time <= $stop_tstamp_usec, 0 ,180;
ob1.check_until_timeout select count(*) from oceanbase.__all_server a left join oceanbase.__all_virtual_server_schema_info b on a.svr_ip = b.svr_ip and a.svr_port = b.svr_port where b.svr_ip is null, 0, 120;
ob1.check_until_timeout select count(*) as cnt from oceanbase.__all_virtual_server_schema_info as a join oceanbase.__all_virtual_server_schema_info as b on a.tenant_id = b.tenant_id  where a.refreshed_schema_version != b.refreshed_schema_version or a.refreshed_schema_version % 8 != 0, 0, 180;
ob1.check_until_timeout select count(*) from __all_virtual_memory_info where mod_name like '%OB_MOD_DO_NOT_USE_ME%' and hold != 0, 0, 10;
test restart cluster finish
===============================================================
==============     switch replica leader    ===================
===============================================================
test switch mysql replica leader begin
count(*)
0
ob1.check_until_timeout select count(*) from __all_virtual_ls_meta_table where tenant_id = '$mysql_tenant_id' and svr_ip = '$follower1_svr_ip' and svr_port='$follower1_svr_port' and ls_id = $ls_id and role = 1, 1, 6;
count(*)
1
ob1.check_until_timeout select count(*) from __all_virtual_ls_meta_table where tenant_id = '$mysql_tenant_id' and svr_ip = '$leader_svr_ip' and svr_port='$leader_svr_port' and ls_id = $ls_id and role = 1, 1, 6;
count(*)
1
create table if not exists t_for_switch (c1 int);
ob1.check_until_timeout select count(*) as cnt from oceanbase.__all_virtual_server_schema_info as a join oceanbase.__all_virtual_server_schema_info as b on a.tenant_id = b.tenant_id  where a.refreshed_schema_version != b.refreshed_schema_version, 0, 60;
begin;
insert into t_for_switch values (1);
ob1.check_until_timeout select count(*) from __all_virtual_ls_meta_table where tenant_id = '$mysql_tenant_id' and svr_ip = '$follower1_svr_ip' and svr_port='$follower1_svr_port' and ls_id = $ls_id and role = 1, 1, 6;
count(*)
1
commit;
select * from t_for_switch order by c1 asc;
c1
1
ob1.check_until_timeout select count(*) from __all_virtual_ls_meta_table where tenant_id = '$mysql_tenant_id' and svr_ip = '$leader_svr_ip' and svr_port='$leader_svr_port' and ls_id = $ls_id and role = 1, 1, 6;
count(*)
1
begin;
insert into t_for_switch values (2);
ob1.check_until_timeout select count(*) from __all_virtual_ls_meta_table where tenant_id = '$mysql_tenant_id' and svr_ip = '$follower1_svr_ip' and svr_port='$follower1_svr_port' and ls_id = $ls_id and role = 1, 1, 6;
count(*)
1
insert into t_for_switch values (3);
commit;
select * from t_for_switch order by c1 asc;
c1
1
2
3
ob1.check_until_timeout select count(*) from __all_virtual_ls_meta_table where tenant_id = '$mysql_tenant_id' and svr_ip = '$leader_svr_ip' and svr_port='$leader_svr_port' and ls_id = $ls_id and role = 1, 1, 6;
count(*)
1
set recyclebin = off;
DROP TABLE IF EXISTS t_for_switch;
test switch mysql replica leader finish
===============================================================
==================     migrate unit    ========================
===============================================================
test migrate unit begin
ob1.mysql alter system set debug_sync_timeout = '1000s';
ob1.mysql alter system switch replica leader ls = 1 server = '$sys_ls_obs_z1' tenant = 'sys';
ob1.check_until_timeout select count(*) = 1 from oceanbase.DBA_OB_LS_LOCATIONS where role = 'LEADER' and zone = 'z1', 1, 60;
ob1.mysql set ob_global_debug_sync = 'BEFORE_SEND_DRTASK_RPC wait_for signal';
ob1.check_until_timeout SELECT COUNT(*) = 1 FROM oceanbase.__all_rootservice_job WHERE unit_id = $unit_id AND job_type = "MIGRATE_UNIT" AND job_status = "INPROGRESS", 1, 20;
ob1.check_until_timeout SELECT COUNT(*) > 0 FROM oceanbase.__all_virtual_ls_replica_task, 1, 20;
ob1.mysql alter system switch replica leader ls = 1 server = '$sys_ls_obs_z2' tenant = 'sys';
ob1.check_until_timeout select count(*) = 1 from oceanbase.DBA_OB_LS_LOCATIONS where role = 'LEADER' and zone = 'z2', 1, 60;
ob1.mysql set ob_global_debug_sync = 'now signal signal';
ob1.check_until_timeout SELECT COUNT(*) = 1 FROM oceanbase.DBA_OB_UNITS WHERE UNIT_ID = $unit_id AND MIGRATE_FROM_SVR_IP IS NULL, 1, 400;
ob1.check_until_timeout SELECT COUNT(*) = 1 FROM oceanbase.GV\$OB_UNITS WHERE UNIT_ID = $unit_id AND SVR_IP = '$z3_dst_ip0' AND SVR_PORT = $z3_dst_port0 AND TENANT_ID = $mysql_tenant_id - 1, 1, 20;
ob1.check_until_timeout SELECT COUNT(*) = 1 FROM oceanbase.GV\$OB_UNITS WHERE UNIT_ID = $unit_id AND SVR_IP = '$z3_dst_ip0' AND SVR_PORT = $z3_dst_port0 AND TENANT_ID = $mysql_tenant_id, 1, 20;
ob1.check_until_timeout SELECT COUNT(*) = $ls_count FROM oceanbase.__all_virtual_ls_meta_table WHERE tenant_id = $mysql_tenant_id AND role = 1 AND member_list LIKE '%$z3_dst0%' AND member_list NOT LIKE '%$z3_dst1%', 1, 20;
ob1.check_until_timeout SELECT COUNT(*) = 1 FROM oceanbase.__all_rootservice_job WHERE unit_id = $unit_id AND job_type = "MIGRATE_UNIT" AND job_status = "SUCCESS", 1, 20;
ob1.check_until_timeout SELECT COUNT(*) AS cnt FROM oceanbase.DBA_OB_UNITS WHERE UNIT_ID = $unit_id AND TENANT_ID = $mysql_tenant_id AND SVR_IP LIKE '%$z3_dst_ip0%' AND SVR_PORT LIKE '%$z3_dst_port0%', 1, 20;
ob1.check_until_timeout SELECT COUNT(*) from oceanbase.GV\$OB_UNITS WHERE UNIT_ID = $unit_id and tenant_id = $mysql_tenant_id, 1, 100;
ob1.check_until_timeout SELECT COUNT(*) from oceanbase.GV\$OB_UNITS WHERE UNIT_ID = $unit_id and tenant_id = $mysql_tenant_id - 1, 1, 100;
test migrate unit finish
===============================================================
============       test dup logstream      ====================
===============================================================
test duplicate logstream begin
=================================================================
add server in zone3
=================================================================
SELECT COUNT(*) as server_count FROM DBA_OB_SERVERS WHERE STATUS = "ACTIVE";
server_count
6
SELECT COUNT(*) as server_count FROM GV$OB_SERVERS;
server_count
6
ob1.z3.obs2.set extra_config=$extra_conf;
ob1.z3.obs2.set status=enable;
ob1.z3.obs2.start;
ob1.check_until_timeout select count(*) as cnt from oceanbase.__all_virtual_server_schema_info as a join oceanbase.__all_virtual_server_schema_info as b on a.tenant_id = b.tenant_id  where (a.refreshed_schema_version != b.refreshed_schema_version or a.refreshed_schema_version % 8 != 0) and a.tenant_id = 1, 0, 120;
ob1.z3.obs2.check_log_until_success -c "weak read service thread start";
ob1.z3.obs2.add;
ob1.check_until_timeout SELECT COUNT(*) c FROM DBA_OB_SERVERS WHERE START_SERVICE_TIME > 0, 7, 200;
set @@session.ob_query_timeout = 100000000000;
SELECT COUNT(*) as server_count FROM DBA_OB_SERVERS WHERE STATUS = "ACTIVE";
server_count
7
ob1.check_until_timeout SELECT COUNT(*) as server_count FROM GV\$OB_SERVERS, 7, 8;
ob1.check_until_timeout select IF(count(*) = $tenant_cnt * $server_cnt, 1, 0) as done from oceanbase.__all_virtual_server_schema_info, 1, 120;
ob1.check_until_timeout select count(*) as cnt from oceanbase.__all_virtual_server_schema_info as a join oceanbase.__all_virtual_server_schema_info as b on a.tenant_id = b.tenant_id  where (a.refreshed_schema_version != b.refreshed_schema_version or a.refreshed_schema_version % 8 != 0) and a.tenant_id <= $mysql_tenant_id, 0, 60;
=================================================================
alter unit_num from 1 to 2
=================================================================
select zone, count(*) as cnt from DBA_OB_UNITS where tenant_id = 1002 and status = 'ACTIVE' group by zone order by zone;
zone	cnt
z1	1
z2	1
z3	1
select zone, count(*) as cnt from DBA_OB_UNITS where tenant_id = 1002 - 1 and status = 'ACTIVE' group by zone order by zone;
zone	cnt
select zone, count(*) as cnt from GV$OB_UNITS where tenant_id = 1002 and zone in ('z1', 'z2', 'z3') and status = 'NORMAL' group by zone order by zone;
zone	cnt
z1	1
z2	1
z3	1
select zone, count(*) as cnt from GV$OB_UNITS where tenant_id = 1002 - 1 and zone in ('z1', 'z2', 'z3') and status = 'NORMAL' group by zone order by zone;
zone	cnt
z1	1
z2	1
z3	1
ALTER RESOURCE TENANT mysql UNIT_NUM = 2;
ob1.check_until_timeout select count(*) from oceanbase.__all_virtual_ls_status where tenant_id = $mysql_tenant_id and status = 'NORMAL', 5, 50;
select zone, count(*) as cnt from DBA_OB_UNITS where tenant_id = 1002 and status = 'ACTIVE' group by zone order by zone;
zone	cnt
z1	2
z2	2
z3	2
select zone, count(*) as cnt from DBA_OB_UNITS where tenant_id = 1002 - 1 and status = 'ACTIVE' group by zone order by zone;
zone	cnt
select zone, count(*) as cnt from GV$OB_UNITS where tenant_id = 1002 and zone in ('z1', 'z2', 'z3') and status = 'NORMAL' group by zone order by zone;
zone	cnt
z1	2
z2	2
z3	2
select zone, count(*) as cnt from GV$OB_UNITS where tenant_id = 1002 - 1 and zone in ('z1', 'z2', 'z3') and status = 'NORMAL' group by zone order by zone;
zone	cnt
z1	2
z2	2
z3	2
=================================================================
create/alter duplicate table under sys/meta tenant
=================================================================
create table sys_dup_t1(c1 int) duplicate_scope = 'cluster';
ERROR 0A000: create duplicate table under sys or meta tenant not supported
alter table oceanbase.__all_tablegroup duplicate_scope = 'cluster';
ERROR 0A000: not user tenant, alter table duplicate scope not supported
alter system change tenant tenant_id = 1001;
create table sys_dup_t1(c1 int) duplicate_scope = 'cluster';
ERROR 0A000: tenant changed, statement not supported
alter table oceanbase.__all_tablegroup duplicate_scope = 'cluster';
ERROR 0A000: not user tenant, alter table duplicate scope not supported
=================================================================
create/alter duplicate table dup_t1 and dup_pt1 and dup_from_t1
=================================================================
create tablegroup tg1;
create table table_in_tg(c1 int) tablegroup = 'tg1';
create table table_with_tg(c1 int) duplicate_scope = 'cluster', tablegroup = 'tg1';
ERROR 0A000: duplicated table in tablegroup not supported
create table dup_t1(c1 int) duplicate_scope = 'cluster';
insert into dup_t1 value (1), (2), (3), (4), (5);
select * from dup_t1 order by c1 asc;
c1
1
2
3
4
5
alter tablegroup tg1 add table dup_t1;
ERROR 0A000: duplicate table in tablegroup not supported
alter table dup_t1 set tablegroup = 'tg1';
ERROR 0A000: changing duplicate_scope of table in tablegroup is not supported
alter table dup_t1 set duplicate_scope = 'none';
alter table dup_t1 set duplicate_scope = 'cluster';
alter table table_in_tg set duplicate_scope = 'cluster';
ERROR 0A000: changing duplicate_scope of table in tablegroup is not supported
alter table oceanbase.__all_tablegroup duplicate_scope = 'cluster';
ERROR 42000: Access denied for user 'root'@'%' to database 'oceanbase'
create table dup_pt1(c1 int) duplicate_scope = 'CLUSTER' partition by hash(c1) partitions 4;
insert into dup_pt1 value (1), (2), (3), (4), (5);
select * from dup_pt1 order by c1 asc;
c1
1
2
3
4
5
create table dup_from_t1 like dup_t1;
insert into dup_from_t1 value (1), (2), (3), (4), (5);
select * from dup_from_t1 order by c1 asc;
c1
1
2
3
4
5
create table normal_t1(c1 int);
create table normal_t2(c1 int);
create table normal_t3(c1 int);
create table normal_t4(c1 int);
create table normal_t5(c1 int);
=================================================================
check duplicate log stream
=================================================================
ob1.check_until_timeout select count(*) as dup_ls_cnt from oceanbase.CDB_OB_LS where flag like '%duplicate%', 1, 20;
ob1.check_until_timeout select count(*) from oceanbase.__all_virtual_table where table_name = "dup_t1" and duplicate_scope = 1, 1, 10;
ob1.check_until_timeout select count(*) from oceanbase.__all_virtual_table where table_name = "dup_pt1" and duplicate_scope = 1, 1, 10;
ob1.check_until_timeout select count(*) from oceanbase.__all_virtual_table where table_name = "dup_from_t1" and duplicate_scope = 1, 1, 10;
ob1.check_until_timeout select ls_id from oceanbase.CDB_OB_TABLE_LOCATIONS where table_name = "dup_t1" and role = "LEADER" and duplicate_scope = "CLUSTER", $dup_ls_id, 1;
ob1.check_until_timeout select ls_id from oceanbase.CDB_OB_TABLE_LOCATIONS where table_name = "dup_pt1" and role = "LEADER" and duplicate_scope = "CLUSTER", $dup_ls_id, 1;
ob1.check_until_timeout select ls_id from oceanbase.CDB_OB_TABLE_LOCATIONS where table_name = "dup_from_t1" and role = "LEADER" and duplicate_scope = "CLUSTER", $dup_ls_id, 1;
ob1.check_until_timeout select count(*) as cnt from oceanbase.CDB_OB_TABLE_LOCATIONS where table_name like "%normal_t%" and role = "LEADER" and ls_id = $dup_ls_id, 0, 1;
ob1.check_until_timeout select count(*) as cnt from oceanbase.CDB_OB_LS_LOCATIONS where tenant_id = $mysql_tenant_id and ls_id = $dup_ls_id and role = "LEADER" and (member_list like "%$z1_dst0%" or member_list like "%$z1_dst1%"), 1, 10;
ob1.check_until_timeout select count(*) as cnt from oceanbase.CDB_OB_LS_LOCATIONS where tenant_id = $mysql_tenant_id and ls_id = $dup_ls_id and role = "LEADER" and (member_list like "%$z3_dst0%" or member_list like "%$z3_dst1%" or member_list like "%$z3_dst2%"), 1, 10;
ob1.check_until_timeout select count(*) as cnt from oceanbase.CDB_OB_LS_LOCATIONS where tenant_id = $mysql_tenant_id and ls_id = $dup_ls_id and role = "LEADER" and (learner_list like "%$z1_dst0%" or learner_list like "%$z1_dst1%"), 1, 10;
ob1.check_until_timeout select count(*) as cnt from oceanbase.CDB_OB_LS_LOCATIONS where tenant_id = $mysql_tenant_id and ls_id = $dup_ls_id and role = "LEADER" and (learner_list like "%$z3_dst0%" or learner_list like "%$z3_dst1%" or learner_list like "%$z3_dst2%"), 1, 10;
ob1.check_until_timeout select count(*) as cnt from oceanbase.__all_virtual_log_stat where tenant_id = $mysql_tenant_id and ls_id = $dup_ls_id, 4, 10;
=================================================================
test create index table
=================================================================
create index dup_t1_idx1 on dup_t1(c1) global;
create index dup_t1_idx2 on dup_t1(c1) local;
create index normal_t1_idx1 on normal_t1(c1) global;
create index normal_t1_idx2 on normal_t1(c1) local;
ob1.check_until_timeout select count(*) from oceanbase.CDB_OB_TABLE_LOCATIONS where index_name like "%dup_t1_idx1%" and duplicate_scope = "CLUSTER" and role like "%leader%", 1, 10;
ob1.check_until_timeout select count(*) from oceanbase.CDB_OB_TABLE_LOCATIONS where index_name like "%dup_t1_idx2%" and duplicate_scope = "CLUSTER" and role like "%leader%", 1, 10;
ob1.check_until_timeout select count(*) from oceanbase.CDB_OB_TABLE_LOCATIONS where index_name like "%normal_t1_idx1%" and duplicate_scope = "NONE" and role like "%leader%", 1, 10;
ob1.check_until_timeout select count(*) from oceanbase.CDB_OB_TABLE_LOCATIONS where index_name like "%normal_t1_idx2%" and duplicate_scope = "NONE" and role like "%leader%", 1, 10;
ob1.check_until_timeout select count(*) from oceanbase.__all_virtual_table where table_name like "%dup_t1_idx1%" and duplicate_scope = 1, 1, 10;
ob1.check_until_timeout select count(*) from oceanbase.__all_virtual_table where table_name like "%dup_t1_idx2%" and duplicate_scope = 1, 1, 10;
ob1.check_until_timeout select count(*) from oceanbase.__all_virtual_table where table_name like "%normal_t1_idx1%" and duplicate_scope = 0, 1, 10;
ob1.check_until_timeout select count(*) from oceanbase.__all_virtual_table where table_name like "%normal_t1_idx2%" and duplicate_scope = 0, 1, 10;
=================================================================
test duplicate log stream is readable
=================================================================
ob1.check_until_timeout select count(distinct svr_ip, svr_port) as cnt from oceanbase.__all_virtual_dup_ls_tablets, 4, 10;
ob1.check_until_timeout select count(*) as cnt from oceanbase.__all_virtual_dup_ls_tablets where attribute != "READABLE", 0, 10;
test duplicate logstream finish
===============================================================
=================     alter locality    =======================
===============================================================
test alter locality begin
ob1.mysql alter system set debug_sync_timeout = '1000s';
ob1.mysql alter system set debug_sync_timeout = '1000s';
ob1.mysql set ob_global_debug_sync = 'BEFORE_SEND_DRTASK_RPC wait_for signal_1';
ALTER TENANT mysql LOCALITY = 'F@z1,F@z2,F@z3';
ob1.check_until_timeout SELECT COUNT(*) = 1 FROM oceanbase.__all_rootservice_job WHERE tenant_id = $mysql_tenant_id AND job_type = "ALTER_TENANT_LOCALITY" AND sql_text LIKE "%F@z1,F@z2,F@z3%" AND extra_info like "%FULL{1}@z1, FULL{1}@z3%" AND job_status = "INPROGRESS", 1, 20;
ob1.check_until_timeout SELECT COUNT(*) > 0 FROM oceanbase.__all_virtual_ls_replica_task, 1, 20;
ob1.mysql set ob_global_debug_sync = 'now signal signal_1';
ob1.check_until_timeout SELECT COUNT(*) as cnt FROM oceanbase.DBA_OB_TENANTS WHERE tenant_id = $mysql_tenant_id AND previous_locality is NULL, 1 ,500;
ob1.check_until_timeout SELECT COUNT(*) as cnt FROM oceanbase.DBA_OB_TENANTS WHERE tenant_id = $mysql_tenant_id - 1 AND previous_locality is NULL, 1 ,500;
ob1.check_until_timeout SELECT COUNT(*) as cnt FROM oceanbase.__all_tenant WHERE tenant_id = $mysql_tenant_id AND primary_zone = (SELECT primary_zone FROM oceanbase.__all_tenant WHERE tenant_id = $mysql_tenant_id - 1), 1 ,50;
ob1.check_until_timeout SELECT COUNT(*) as cnt FROM oceanbase.__all_tenant WHERE tenant_id = $mysql_tenant_id AND zone_list = (SELECT zone_list FROM oceanbase.__all_tenant WHERE tenant_id = $mysql_tenant_id - 1), 1 ,50;
ob1.check_until_timeout SELECT COUNT(*) as cnt FROM oceanbase.__all_rootservice_job WHERE tenant_id = $mysql_tenant_id AND job_type = "ALTER_TENANT_LOCALITY" AND sql_text LIKE "%F@z1,F@z2,F@z3%" AND extra_info like "%FULL{1}@z1, FULL{1}@z3%" AND job_status = "SUCCESS", 1, 20;
ob1.check_until_timeout SELECT COUNT(*) as cnt FROM oceanbase.CDB_OB_LS_LOCATIONS WHERE tenant_id = $mysql_tenant_id - 1 AND role = "LEADER" AND (member_list LIKE "%$z2_dst0%" OR member_list LIKE "%$z2_dst1%"), 1, 20;
ob1.check_until_timeout SELECT COUNT(*) as cnt FROM oceanbase.CDB_OB_LS_LOCATIONS WHERE tenant_id = $mysql_tenant_id AND role = "LEADER" AND (member_list LIKE "%$z2_dst0%" OR member_list LIKE "%$z2_dst1%"), $ls_cnt_to_check, 20;
ob1.check_until_timeout SELECT COUNT(*) as cnt FROM oceanbase.CDB_OB_LS_LOCATIONS WHERE tenant_id = $mysql_tenant_id AND role = "LEADER" AND ls_id = $dup_ls_id AND (learner_list like "%$z2_dst0%" OR learner_list like "%$z2_dst1%"), 1, 120;
alter tenant mysql locality = 'F@z1,R@z2,F@z3';
ob1.check_until_timeout select count(*) as cnt from oceanbase.DBA_OB_TENANTS WHERE tenant_id = $mysql_tenant_id and previous_locality is NULL and locality like "%FULL{1}@z1, READONLY{1}@z2, FULL{1}@z3%", 1, 120;
ob1.check_until_timeout select count(*) as check_members_list from oceanbase.__all_virtual_log_stat where tenant_id = $mysql_meta_tenant_id and role like "%LEADER%" and (paxos_member_list like "%$z1_dst0%" or paxos_member_list like "%$z1_dst1%") and (paxos_member_list not like "%$z2_dst0%" and paxos_member_list not like "%$z2_dst1%") and (paxos_member_list like "%$z3_dst0%" or paxos_member_list like "%$z3_dst1%" or paxos_member_list like "%$z3_dst2%") and paxos_replica_num = 2 and (learner_list not like "%$z1_dst0%" and learner_list not like "%$z1_dst1%") and (learner_list like "%$z2_dst0%" or learner_list like "%$z2_dst1%") and (learner_list not like "%$z3_dst0%" and learner_list not like "%$z3_dst1%" and learner_list not like "%$z3_dst2%"), 1, 5;
ob1.check_until_timeout select count(*) as check_members_list from oceanbase.CDB_OB_LS_LOCATIONS where tenant_id = $mysql_meta_tenant_id and role like "%LEADER%" and (member_list like "%$z1_dst0%" or member_list like "%$z1_dst1%") and (member_list not like "%$z2_dst0%" and member_list not like "%$z2_dst1%") and (member_list like "%$z3_dst0%" or member_list like "%$z3_dst1%" or member_list like "%$z3_dst2%") and (learner_list not like "%$z1_dst0%" and learner_list not like "%$z1_dst1%") and (learner_list like "%$z2_dst0%" or learner_list like "%$z2_dst1%") and (learner_list not like "%$z3_dst0%" and learner_list not like "%$z3_dst1%" and learner_list not like "%$z3_dst2%"), 1, 5;
ob1.check_until_timeout select count(*) as check_members_list from oceanbase.__all_virtual_log_stat where tenant_id = $mysql_tenant_id and ls_id != $dup_ls_id and role like "%LEADER%" and (paxos_member_list like "%$z1_dst0%" or paxos_member_list like "%$z1_dst1%") and (paxos_member_list not like "%$z2_dst0%" and paxos_member_list not like "%$z2_dst1%") and (paxos_member_list like "%$z3_dst0%" or paxos_member_list like "%$z3_dst1%" or paxos_member_list like "%$z3_dst2%") and paxos_replica_num = 2 and (learner_list not like "%$z1_dst0%" and learner_list not like "%$z1_dst1%") and (learner_list like "%$z2_dst0%" or learner_list like "%$z2_dst1%") and (learner_list not like "%$z3_dst0%" and learner_list not like "%$z3_dst1%" and learner_list not like "%$z3_dst2%"), $user_ls_cnt, 5;
ob1.check_until_timeout select count(*) as check_members_list from oceanbase.CDB_OB_LS_LOCATIONS where tenant_id = $mysql_tenant_id and ls_id != $dup_ls_id and role like "%LEADER%" and (member_list like "%$z1_dst0%" or member_list like "%$z1_dst1%") and (member_list not like "%$z2_dst0%" and member_list not like "%$z2_dst1%") and (member_list like "%$z3_dst0%" or member_list like "%$z3_dst1%" or member_list like "%$z3_dst2%") and (learner_list not like "%$z1_dst0%" and learner_list not like "%$z1_dst1%") and (learner_list like "%$z2_dst0%" or learner_list like "%$z2_dst1%") and (learner_list not like "%$z3_dst0%" and learner_list not like "%$z3_dst1%" and learner_list not like "%$z3_dst2%"), $user_ls_cnt, 5;
ob1.check_until_timeout select count(*) as check_members_list from oceanbase.__all_virtual_log_stat where tenant_id = $mysql_tenant_id and ls_id = $dup_ls_id and role like "%LEADER%" and (paxos_member_list like "%$z1_dst0%" or paxos_member_list like "%$z1_dst1%") and (paxos_member_list not like "%$z2_dst0%" and paxos_member_list not like "%$z2_dst1%") and (paxos_member_list like "%$z3_dst0%" or paxos_member_list like "%$z3_dst1%" or paxos_member_list like "%$z3_dst2%") and paxos_replica_num = 2 and (learner_list like "%$z1_dst0%" or learner_list like "%$z1_dst1%") and (learner_list like "%$z2_dst0%" and learner_list like "%$z2_dst1%") and (learner_list like "%$z3_dst0%" or learner_list like "%$z3_dst1%" or learner_list like "%$z3_dst2%"), 1, 5;
ob1.check_until_timeout SELECT COUNT(*) as check_members_list from oceanbase.CDB_OB_LS_LOCATIONS WHERE tenant_id = $mysql_tenant_id AND role like "%LEADER%" AND ls_id = $dup_ls_id AND (learner_list like "%$z2_dst0%" and learner_list like "%$z2_dst1%"), 1, 120;
alter tenant mysql locality = 'F@z1,F@z3';
ob1.check_until_timeout select count(*) as cnt from oceanbase.DBA_OB_TENANTS WHERE tenant_id = $mysql_tenant_id and previous_locality is NULL and locality like "%FULL{1}@z1, FULL{1}@z3%", 1, 120;
ob1.check_until_timeout select count(*) as check_members_list from oceanbase.__all_virtual_log_stat where tenant_id = $mysql_meta_tenant_id and role like "%LEADER%" and (paxos_member_list like "%$z1_dst0%" or paxos_member_list like "%$z1_dst1%") and (paxos_member_list not like "%$z2_dst0%" and paxos_member_list not like "%$z2_dst1%") and (paxos_member_list like "%$z3_dst0%" or paxos_member_list like "%$z3_dst1%" or paxos_member_list like "%$z3_dst2%") and paxos_replica_num = 2 and learner_list = "", 1, 5;
ob1.check_until_timeout select count(*) as check_members_list from oceanbase.CDB_OB_LS_LOCATIONS where tenant_id = $mysql_meta_tenant_id and role like "%LEADER%" and (member_list like "%$z1_dst0%" or member_list like "%$z1_dst1%") and (member_list not like "%$z2_dst0%" and member_list not like "%$z2_dst1%") and (member_list like "%$z3_dst0%" or member_list like "%$z3_dst1%" or member_list like "%$z3_dst2%") and learner_list = "", 1, 5;
ob1.check_until_timeout select count(*) as check_members_list from oceanbase.__all_virtual_log_stat where tenant_id = $mysql_tenant_id and ls_id != $dup_ls_id and role like "%LEADER%" and (paxos_member_list like "%$z1_dst0%" or paxos_member_list like "%$z1_dst1%") and (paxos_member_list not like "%$z2_dst0%" and paxos_member_list not like "%$z2_dst1%") and (paxos_member_list like "%$z3_dst0%" or paxos_member_list like "%$z3_dst1%" or paxos_member_list like "%$z3_dst2%") and paxos_replica_num = 2 and learner_list = "", $user_ls_cnt, 5;
ob1.check_until_timeout select count(*) as check_members_list from oceanbase.CDB_OB_LS_LOCATIONS where tenant_id = $mysql_tenant_id and ls_id != $dup_ls_id and role like "%LEADER%" and (member_list like "%$z1_dst0%" or member_list like "%$z1_dst1%") and (member_list not like "%$z2_dst0%" and member_list not like "%$z2_dst1%") and (member_list like "%$z3_dst0%" or member_list like "%$z3_dst1%" or member_list like "%$z3_dst2%") and learner_list = "", $user_ls_cnt, 5;
ob1.check_until_timeout select count(*) as check_members_list from oceanbase.__all_virtual_log_stat where tenant_id = $mysql_tenant_id and ls_id = $dup_ls_id and role like "%LEADER%" and (paxos_member_list like "%$z1_dst0%" or paxos_member_list like "%$z1_dst1%") and (paxos_member_list not like "%$z2_dst0%" and paxos_member_list not like "%$z2_dst1%") and (paxos_member_list like "%$z3_dst0%" or paxos_member_list like "%$z3_dst1%" or paxos_member_list like "%$z3_dst2%") and paxos_replica_num = 2 and (learner_list like "%$z1_dst0%" or learner_list like "%$z1_dst1%") and (learner_list not like "%$z2_dst0%" and learner_list not like "%$z2_dst1%") and (learner_list like "%$z3_dst0%" or learner_list like "%$z3_dst1%" or learner_list like "%$z3_dst2%"), 1, 5;
ob1.check_until_timeout select count(*) as check_members_list from oceanbase.CDB_OB_LS_LOCATIONS where tenant_id = $mysql_tenant_id and ls_id = $dup_ls_id and role like "%LEADER%" and (member_list like "%$z1_dst0%" or member_list like "%$z1_dst1%") and (member_list not like "%$z2_dst0%" and member_list not like "%$z2_dst1%") and (member_list like "%$z3_dst0%" or member_list like "%$z3_dst1%" or member_list like "%$z3_dst2%") and (learner_list like "%$z1_dst0%" or learner_list like "%$z1_dst1%") and (learner_list not like "%$z2_dst0%" and learner_list not like "%$z2_dst1%") and (learner_list like "%$z3_dst0%" or learner_list like "%$z3_dst1%" or learner_list like "%$z3_dst2%"), 1, 5;
alter tenant mysql locality = 'F@z1,R@z2,F@z3';
ob1.check_until_timeout select count(*) as cnt from oceanbase.DBA_OB_TENANTS WHERE tenant_id = $mysql_tenant_id and previous_locality is NULL and locality like "%FULL{1}@z1, READONLY{1}@z2, FULL{1}@z3%", 1, 120;
ob1.check_until_timeout select count(*) as check_members_list from oceanbase.__all_virtual_log_stat where tenant_id = $mysql_meta_tenant_id and role like "%LEADER%" and (paxos_member_list like "%$z1_dst0%" or paxos_member_list like "%$z1_dst1%") and (paxos_member_list not like "%$z2_dst0%" and paxos_member_list not like "%$z2_dst1%") and (paxos_member_list like "%$z3_dst0%" or paxos_member_list like "%$z3_dst1%" or paxos_member_list like "%$z3_dst2%") and paxos_replica_num = 2 and (learner_list not like "%$z1_dst0%" and learner_list not like "%$z1_dst1%") and (learner_list like "%$z2_dst0%" or learner_list like "%$z2_dst1%") and (learner_list not like "%$z3_dst0%" and learner_list not like "%$z3_dst1%" and learner_list not like "%$z3_dst2%"), 1, 5;
ob1.check_until_timeout select count(*) as check_members_list from oceanbase.CDB_OB_LS_LOCATIONS where tenant_id = $mysql_meta_tenant_id and role like "%LEADER%" and (member_list like "%$z1_dst0%" or member_list like "%$z1_dst1%") and (member_list not like "%$z2_dst0%" and member_list not like "%$z2_dst1%") and (member_list like "%$z3_dst0%" or member_list like "%$z3_dst1%" or member_list like "%$z3_dst2%") and (learner_list not like "%$z1_dst0%" and learner_list not like "%$z1_dst1%") and (learner_list like "%$z2_dst0%" or learner_list like "%$z2_dst1%") and (learner_list not like "%$z3_dst0%" and learner_list not like "%$z3_dst1%" and learner_list not like "%$z3_dst2%"), 1, 5;
ob1.check_until_timeout select count(*) as check_members_list from oceanbase.__all_virtual_log_stat where tenant_id = $mysql_tenant_id and ls_id != $dup_ls_id and role like "%LEADER%" and (paxos_member_list like "%$z1_dst0%" or paxos_member_list like "%$z1_dst1%") and (paxos_member_list not like "%$z2_dst0%" and paxos_member_list not like "%$z2_dst1%") and (paxos_member_list like "%$z3_dst0%" or paxos_member_list like "%$z3_dst1%" or paxos_member_list like "%$z3_dst2%") and paxos_replica_num = 2 and (learner_list not like "%$z1_dst0%" and learner_list not like "%$z1_dst1%") and (learner_list like "%$z2_dst0%" or learner_list like "%$z2_dst1%") and (learner_list not like "%$z3_dst0%" and learner_list not like "%$z3_dst1%" and learner_list not like "%$z3_dst2%"), $user_ls_cnt, 5;
ob1.check_until_timeout select count(*) as check_members_list from oceanbase.CDB_OB_LS_LOCATIONS where tenant_id = $mysql_tenant_id and ls_id != $dup_ls_id and role like "%LEADER%" and (member_list like "%$z1_dst0%" or member_list like "%$z1_dst1%") and (member_list not like "%$z2_dst0%" and member_list not like "%$z2_dst1%") and (member_list like "%$z3_dst0%" or member_list like "%$z3_dst1%" or member_list like "%$z3_dst2%") and (learner_list not like "%$z1_dst0%" and learner_list not like "%$z1_dst1%") and (learner_list like "%$z2_dst0%" or learner_list like "%$z2_dst1%") and (learner_list not like "%$z3_dst0%" and learner_list not like "%$z3_dst1%" and learner_list not like "%$z3_dst2%"), $user_ls_cnt, 5;
ob1.check_until_timeout select count(*) as check_members_list from oceanbase.__all_virtual_log_stat where tenant_id = $mysql_tenant_id and ls_id = $dup_ls_id and role like "%LEADER%" and (paxos_member_list like "%$z1_dst0%" or paxos_member_list like "%$z1_dst1%") and (paxos_member_list not like "%$z2_dst0%" and paxos_member_list not like "%$z2_dst1%") and (paxos_member_list like "%$z3_dst0%" or paxos_member_list like "%$z3_dst1%" or paxos_member_list like "%$z3_dst2%") and paxos_replica_num = 2 and (learner_list like "%$z1_dst0%" or learner_list like "%$z1_dst1%") and (learner_list like "%$z2_dst0%" and learner_list like "%$z2_dst1%") and (learner_list like "%$z3_dst0%" or learner_list like "%$z3_dst1%" or learner_list like "%$z3_dst2%"), 1, 5;
ob1.check_until_timeout SELECT COUNT(*) as check_members_list from oceanbase.CDB_OB_LS_LOCATIONS WHERE tenant_id = $mysql_tenant_id AND role like "%LEADER%" AND ls_id = $dup_ls_id AND (learner_list like "%$z2_dst0%" and learner_list like "%$z2_dst1%"), 1, 120;
alter tenant mysql locality = 'F@z1,F@z2,F@z3';
ob1.check_until_timeout select count(*) as cnt from oceanbase.DBA_OB_TENANTS WHERE tenant_id = $mysql_tenant_id and previous_locality is NULL and locality like "%FULL{1}@z1, FULL{1}@z2, FULL{1}@z3%", 1, 120;
ob1.check_until_timeout select count(*) as check_members_list from oceanbase.__all_virtual_log_stat where tenant_id = $mysql_meta_tenant_id and role like "%LEADER%" and (paxos_member_list like "%$z1_dst0%" or paxos_member_list like "%$z1_dst1%") and (paxos_member_list like "%$z2_dst0%" or paxos_member_list like "%$z2_dst1%") and (paxos_member_list like "%$z3_dst0%" or paxos_member_list like "%$z3_dst1%" or paxos_member_list like "%$z3_dst2%") and paxos_replica_num = 3 and learner_list = "", 1, 5;
ob1.check_until_timeout select count(*) as check_members_list from oceanbase.CDB_OB_LS_LOCATIONS where tenant_id = $mysql_meta_tenant_id and role like "%LEADER%" and (member_list like "%$z1_dst0%" or member_list like "%$z1_dst1%") and (member_list like "%$z2_dst0%" or member_list like "%$z2_dst1%") and (member_list like "%$z3_dst0%" or member_list like "%$z3_dst1%" or member_list like "%$z3_dst2%") and learner_list = "", 1, 5;
ob1.check_until_timeout select count(*) as check_members_list from oceanbase.__all_virtual_log_stat where tenant_id = $mysql_tenant_id and ls_id != $dup_ls_id and role like "%LEADER%" and (paxos_member_list like "%$z1_dst0%" or paxos_member_list like "%$z1_dst1%") and (paxos_member_list like "%$z2_dst0%" or paxos_member_list like "%$z2_dst1%") and (paxos_member_list like "%$z3_dst0%" or paxos_member_list like "%$z3_dst1%" or paxos_member_list like "%$z3_dst2%") and paxos_replica_num = 3 and learner_list = "", $user_ls_cnt, 5;
ob1.check_until_timeout select count(*) as check_members_list from oceanbase.CDB_OB_LS_LOCATIONS where tenant_id = $mysql_tenant_id and ls_id != $dup_ls_id and role like "%LEADER%" and (member_list like "%$z1_dst0%" or member_list like "%$z1_dst1%") and (member_list like "%$z2_dst0%" or member_list like "%$z2_dst1%") and (member_list like "%$z3_dst0%" or member_list like "%$z3_dst1%" or member_list like "%$z3_dst2%") and learner_list = "", $user_ls_cnt, 5;
ob1.check_until_timeout select count(*) as check_members_list from oceanbase.__all_virtual_log_stat where tenant_id = $mysql_tenant_id and ls_id = $dup_ls_id and role like "%LEADER%" and (paxos_member_list like "%$z1_dst0%" or paxos_member_list like "%$z1_dst1%") and (paxos_member_list like "%$z2_dst0%" or paxos_member_list like "%$z2_dst1%") and (paxos_member_list like "%$z3_dst0%" or paxos_member_list like "%$z3_dst1%" or paxos_member_list like "%$z3_dst2%") and paxos_replica_num = 3 and (learner_list like "%$z1_dst0%" or learner_list like "%$z1_dst1%") and (learner_list like "%$z2_dst0%" or learner_list like "%$z2_dst1%") and (learner_list like "%$z3_dst0%" or learner_list like "%$z3_dst1%" or learner_list like "%$z3_dst2%"), 1, 5;
ob1.check_until_timeout SELECT COUNT(*) as check_members_list from oceanbase.CDB_OB_LS_LOCATIONS WHERE tenant_id = $mysql_tenant_id AND role like "%LEADER%" AND ls_id = $dup_ls_id AND (member_list like "%$z1_dst0%" or member_list like "%$z1_dst1%") and (member_list like "%$z2_dst0%" or member_list like "%$z2_dst1%") and (member_list like "%$z3_dst0%" or member_list like "%$z3_dst1%" or member_list like "%$z3_dst2%") AND (learner_list like "%$z1_dst0%" or learner_list like "%$z1_dst1%") AND (learner_list like "%$z2_dst0%" or learner_list like "%$z2_dst1%") AND (learner_list like "%$z3_dst0%" or learner_list like "%$z3_dst1%" or learner_list like "%$z3_dst2%"), 1, 120;
ob1.mysql set ob_global_debug_sync = 'BEFORE_SEND_DRTASK_RPC wait_for signal_2';
ALTER TENANT mysql LOCALITY = 'F@z1,F@z2';
ob1.check_until_timeout SELECT COUNT(*) = 1 FROM oceanbase.__all_rootservice_job WHERE tenant_id = $mysql_tenant_id AND job_type = "ALTER_TENANT_LOCALITY" AND sql_text LIKE "%F@z1,F@z2%" AND extra_info like "%FULL{1}@z1, FULL{1}@z2, FULL{1}@z3%" AND job_status = "INPROGRESS", 1, 20;
ob1.mysql set ob_global_debug_sync = 'now signal signal_2';
ob1.check_until_timeout SELECT COUNT(*) as cnt FROM oceanbase.__all_rootservice_job WHERE tenant_id = $mysql_tenant_id AND job_type = "ALTER_TENANT_LOCALITY" AND sql_text LIKE "%F@z1,F@z2%" AND extra_info like "%FULL{1}@z1, FULL{1}@z2, FULL{1}@z3%" AND job_status = "INPROGRESS", 1, 20;
ob1.check_until_timeout SELECT COUNT(*) as cnt FROM oceanbase.__all_tenant WHERE tenant_id = $mysql_tenant_id AND previous_locality = '', 1 ,500;
ob1.check_until_timeout SELECT COUNT(*) as cnt FROM oceanbase.__all_tenant WHERE tenant_id = $mysql_tenant_id - 1 AND previous_locality = '', 1 ,500;
ob1.check_until_timeout SELECT COUNT(*) as cnt FROM oceanbase.__all_tenant WHERE tenant_id = $mysql_tenant_id AND primary_zone = (SELECT primary_zone FROM oceanbase.__all_tenant WHERE tenant_id = $mysql_tenant_id - 1), 1 ,50;
ob1.check_until_timeout SELECT COUNT(*) as cnt FROM oceanbase.__all_tenant WHERE tenant_id = $mysql_tenant_id AND zone_list = (SELECT zone_list FROM oceanbase.__all_tenant WHERE tenant_id = $mysql_tenant_id - 1), 1 ,50;
ob1.check_until_timeout SELECT COUNT(*) as cnt FROM oceanbase.__all_rootservice_job WHERE tenant_id = $mysql_tenant_id AND job_type = "ALTER_TENANT_LOCALITY" AND sql_text LIKE "%F@z1,F@z2%" AND extra_info like "%FULL{1}@z1, FULL{1}@z2, FULL{1}@z3%" AND job_status = "SUCCESS", 1, 300;
ob1.check_until_timeout SELECT COUNT(*) as cnt FROM oceanbase.__all_virtual_ls_meta_table WHERE tenant_id = $mysql_tenant_id - 1 AND role = 1 AND (member_list LIKE "%$z3_dst0%" OR member_list LIKE "%$z3_dst1%" OR member_list LIKE "%$z3_dst2%"), 0, 20;
ob1.check_until_timeout SELECT COUNT(*) as cnt FROM oceanbase.__all_virtual_ls_meta_table WHERE tenant_id = $mysql_tenant_id AND role = 1 AND (member_list LIKE "%$z3_dst0%" OR member_list LIKE "%$z3_dst1%" OR member_list LIKE "%$z3_dst2%"), 0, 20;
ob1.check_until_timeout select count(*) as check_members_list from oceanbase.__all_virtual_log_stat where tenant_id = $mysql_tenant_id and ls_id = $dup_ls_id and role like "%LEADER%" and (paxos_member_list like "%$z1_dst0%" or paxos_member_list like "%$z1_dst1%") and (paxos_member_list like "%$z2_dst0%" or paxos_member_list like "%$z2_dst1%") and (paxos_member_list not like "%$z3_dst0%" and paxos_member_list not like "%$z3_dst1%" and paxos_member_list not like "%$z3_dst2%") and paxos_replica_num = 2 and (learner_list like "%$z1_dst0%" or learner_list like "%$z1_dst1%") and (learner_list like "%$z2_dst0%" or learner_list like "%$z2_dst1%") and (learner_list not like "%$z3_dst0%" and learner_list not like "%$z3_dst1%" and learner_list not like "%$z3_dst2%"), 1, 5;
ob1.check_until_timeout SELECT COUNT(*) as check_members_list from oceanbase.CDB_OB_LS_LOCATIONS WHERE tenant_id = $mysql_tenant_id AND role like "%LEADER%" AND ls_id = $dup_ls_id AND (member_list like "%$z1_dst0%" or member_list like "%$z1_dst1%") and (member_list like "%$z2_dst0%" or member_list like "%$z2_dst1%") and (member_list not like "%$z3_dst0%" and member_list not like "%$z3_dst1%" and member_list not like "%$z3_dst2%") AND (learner_list like "%$z1_dst0%" or learner_list like "%$z1_dst1%") AND (learner_list like "%$z2_dst0%" or learner_list like "%$z2_dst1%") AND (learner_list not like "%$z3_dst0%" and learner_list not like "%$z3_dst1%" and learner_list not like "%$z3_dst2%"), 1, 120;
test alter locality finish
===============================================================
==============     alter resource pool    =====================
===============================================================
test alter resource pool begin
ob1.mysql alter system set _transfer_start_trans_timeout = '10s';
ob1.mysql alter system set _transfer_start_rpc_timeout = '10s';
ob1.mysql alter system set ls_gc_delay_time='0s' tenant=sys;
ob1.mysql alter system set ls_gc_delay_time='0s' tenant=all_user;
ob1.mysql alter system set ls_gc_delay_time='0s' tenant=all_meta;
select zone, count(*) as cnt from DBA_OB_UNITS where tenant_id = 1002 group by zone order by zone;
zone	cnt
z1	2
z2	2
z3	2
select zone, count(*) as cnt from DBA_OB_UNITS where tenant_id = 1002 - 1 group by zone order by zone;
zone	cnt
select zone, count(*) as cnt from GV$OB_UNITS where tenant_id = 1002 and zone in ('z1', 'z3') group by zone order by zone;
zone	cnt
z1	2
z3	2
select zone, count(*) as cnt from GV$OB_UNITS where tenant_id = 1002 - 1 and zone in ('z1', 'z3') group by zone order by zone;
zone	cnt
z1	2
z3	2
ALTER RESOURCE POOL pool_1 ZONE_LIST = ('z1', 'z2');
select zone, count(*) as cnt from DBA_OB_UNITS where tenant_id = 1002 group by zone  order by zone;
zone	cnt
z1	2
z2	2
select zone, count(*) as cnt from DBA_OB_UNITS where tenant_id = 1002 - 1 group by zone order by zone;
zone	cnt
select zone, count(*) as cnt from GV$OB_UNITS where tenant_id = 1002 and zone in ('z1', 'z2') group by zone order by zone;
zone	cnt
z1	2
z2	2
select zone, count(*) as cnt from GV$OB_UNITS where tenant_id = 1002 - 1 and zone in ('z1', 'z2') group by zone order by zone;
zone	cnt
z1	2
z2	2
ALTER RESOURCE TENANT mysql UNIT_NUM = 2;
ob1.check_until_timeout select count(*) from oceanbase.__all_virtual_ls_status where tenant_id = $mysql_tenant_id and status = 'NORMAL', 4, 50;
select zone, count(*) as cnt from DBA_OB_UNITS where tenant_id = 1002 group by zone order by zone;
zone	cnt
z1	2
z2	2
select zone, count(*) as cnt from DBA_OB_UNITS where tenant_id = 1002 - 1 group by zone order by zone;
zone	cnt
select zone, count(*) as cnt from GV$OB_UNITS where tenant_id = 1002 and zone in ('z1', 'z2') group by zone order by zone;
zone	cnt
z1	2
z2	2
select zone, count(*) as cnt from GV$OB_UNITS where tenant_id = 1002 - 1 and zone in ('z1', 'z2') group by zone order by zone;
zone	cnt
z1	2
z2	2
ob1.check_until_timeout select count(*) as cnt from DBA_OB_UNITS where tenant_id = $mysql_tenant_id and status = 'ACTIVE', 4, 100;
ob1.check_until_timeout select count(*) as cnt from DBA_OB_UNITS where tenant_id = $mysql_tenant_id and status != 'ACTIVE', 0, 1000;
ob1.check_until_timeout select count(*) from oceanbase.__all_virtual_balance_job where tenant_id = $mysql_tenant_id, 0, 120;
ob1.check_until_timeout select count(*) from oceanbase.DBA_OB_LS where status != 'NORMAL', 0, 100;
ALTER RESOURCE TENANT mysql UNIT_NUM = 1 DELETE UNIT_GROUP = (1002);
ob1.check_until_timeout select count(*) from oceanbase.__all_virtual_ls_status where tenant_id = $mysql_tenant_id and status = 'NORMAL', 3, 100;
ob1.check_until_timeout select count(*) as cnt from DBA_OB_UNITS where tenant_id = $mysql_tenant_id and status = 'ACTIVE', 2, 100;
ob1.check_until_timeout select count(*) as cnt from DBA_OB_UNITS where tenant_id = $mysql_tenant_id and status != 'ACTIVE', 0, 1000;
ob1.check_until_timeout select count(*) from oceanbase.__all_virtual_balance_job where tenant_id = $mysql_tenant_id, 0, 120;
ob1.check_until_timeout select count(*) from oceanbase.DBA_OB_LS where status != 'NORMAL', 0, 100;
ob1.check_until_timeout select count(*) from oceanbase.__all_virtual_unit where tenant_id in ($mysql_tenant_id, $mysql_tenant_id - 1), 4, 300;
ALTER RESOURCE TENANT mysql UNIT_NUM = 2;
ob1.check_until_timeout select count(*) from oceanbase.__all_virtual_ls_status where tenant_id = $mysql_tenant_id and status = 'NORMAL', 4, 50;
select zone, count(*) as cnt from DBA_OB_UNITS where tenant_id = 1002 group by zone order by zone;
zone	cnt
z1	2
z2	2
select zone, count(*) as cnt from DBA_OB_UNITS where tenant_id = 1002 - 1 group by zone order by zone;
zone	cnt
select zone, count(*) as cnt from GV$OB_UNITS where tenant_id = 1002 and zone in ('z1', 'z2') group by zone order by zone;
zone	cnt
z1	2
z2	2
select zone, count(*) as cnt from GV$OB_UNITS where tenant_id = 1002 - 1 and zone in ('z1', 'z2') group by zone order by zone;
zone	cnt
z1	2
z2	2
ob1.check_until_timeout select count(*) as cnt from DBA_OB_UNITS where tenant_id = $mysql_tenant_id and status = 'ACTIVE', 4, 100;
ob1.check_until_timeout select count(*) as cnt from DBA_OB_UNITS where tenant_id = $mysql_tenant_id and status != 'ACTIVE', 0, 1000;
ob1.check_until_timeout select count(*) from oceanbase.__all_virtual_balance_job where tenant_id = $mysql_tenant_id, 0, 120;
ob1.check_until_timeout select count(*) from oceanbase.__all_virtual_ls_status where tenant_id = $mysql_tenant_id and status != 'NORMAL', 0, 100;
ALTER RESOURCE POOL pool_1 ZONE_LIST = ('z1', 'z3', 'z2');
test alter resource pool finish
===============================================================
===============     permanent offline    ======================
===============================================================
test permanent offline begin
ob1.mysql alter system set server_permanent_offline_time = '20s';
ob1.check_until_timeout select count(*) as cnt from oceanbase.__all_virtual_server_schema_info as a join oceanbase.__all_virtual_server_schema_info as b on a.tenant_id = b.tenant_id  where (a.refreshed_schema_version != b.refreshed_schema_version or a.refreshed_schema_version % 8 != 0) and a.tenant_id = 1, 0, 120;
ob1.check_until_timeout SELECT COUNT(*) c FROM DBA_OB_SERVERS WHERE START_SERVICE_TIME > 0, 7, 200;
SELECT COUNT(*) as server_count FROM DBA_OB_SERVERS WHERE STATUS = "ACTIVE";
server_count
7
test permanent offline finish
===============================================================
=================     change tenant    ========================
===============================================================
test change tenant begin
select effective_tenant_id();
effective_tenant_id()
1
alter system change tenant tenant_id = 1001;
select effective_tenant_id();
effective_tenant_id()
1001
select count(*) > 0 from oceanbase.__all_ls_meta_table where tenant_id = 1002;
count(*) > 0
1
alter system change tenant tenant_id = 1002;
select effective_tenant_id();
effective_tenant_id()
1002
alter system change tenant tenant_id = 1003;
ERROR HY000: Unknown tenant
select effective_tenant_id();
effective_tenant_id()
1002
alter system change tenant tenant_id = 1;
select effective_tenant_id();
effective_tenant_id()
1
alter system change tenant META$1002;
select effective_tenant_id();
effective_tenant_id()
1001
select count(*) > 0 from oceanbase.__all_ls_meta_table where tenant_id = 1002;
count(*) > 0
1
alter system change tenant mysql;
select effective_tenant_id();
effective_tenant_id()
1002
alter system change tenant META_TENANT;
ERROR HY000: invalid tenant name specified in connection string
select effective_tenant_id();
effective_tenant_id()
1002
alter system change tenant sys;
select effective_tenant_id();
effective_tenant_id()
1
select effective_tenant_id();
effective_tenant_id()
1
alter system change tenant tenant_id = 1001;
select effective_tenant_id();
effective_tenant_id()
1001
select count(*) > 0 from oceanbase.__all_ls_meta_table where tenant_id = 1002;
count(*) > 0
1
alter system change tenant tenant_id = 1002;
select effective_tenant_id();
effective_tenant_id()
1002
alter system change tenant tenant_id = 1003;
ERROR HY000: Unknown tenant
select effective_tenant_id();
effective_tenant_id()
1002
alter system change tenant tenant_id = 1;
select effective_tenant_id();
effective_tenant_id()
1
alter system change tenant META$1002;
select effective_tenant_id();
effective_tenant_id()
1001
select count(*) > 0 from oceanbase.__all_ls_meta_table where tenant_id = 1002;
count(*) > 0
1
alter system change tenant mysql;
select effective_tenant_id();
effective_tenant_id()
1002
alter system change tenant META_TENANT;
ERROR HY000: invalid tenant name specified in connection string
select effective_tenant_id();
effective_tenant_id()
1002
alter system change tenant sys;
select effective_tenant_id();
effective_tenant_id()
1
test change tenant finish
===============================================================
=================     minor freeze    =========================
===============================================================
test minor freeze begin
create table test_uncommitted_ctx (a int);
begin;
insert into test_uncommitted_ctx value(1);
set @@session.ob_query_timeout = 10000000000;
alter system minor freeze tenant mysql;
ob1.z1.obs1.check_log_until_success -c "succeed to release head data memtable";
ob1.z2.obs1.check_log_until_success -c "succeed to release head data memtable";
insert into t1_no_pk values (2001), (2002), (2003);
select * from t1_no_pk order by c1 asc;
c1
21
22
23
1011
1012
1013
2001
2002
2003
update t1_no_pk set c1=c1+10;
select * from t1_no_pk order by c1 asc;
c1
31
32
33
1021
1022
1023
2011
2012
2013
insert into t1_pk values (2011), (2012), (2013);
select * from t1_pk order by c1 asc;
c1
21
22
23
1021
1022
1023
2011
2012
2013
update t1_pk set c1=c1+10;
select * from t1_pk order by c1 asc;
c1
31
32
33
1031
1032
1033
2021
2022
2023
create table t1_part_2 (c1 int primary key) partition by hash(c1) partitions 4;
ob1.check_until_timeout select count(*) as cnt from oceanbase.__all_virtual_server_schema_info as a join oceanbase.__all_virtual_server_schema_info as b on a.tenant_id = b.tenant_id  where a.refreshed_schema_version != b.refreshed_schema_version, 0, 60;
insert into t1_part_2 values (1), (2), (3), (4);
select * from t1_part_2 order by c1 asc;
c1
1
2
3
4
update t1_part_2 set c1=c1+10;
select * from t1_part_2 order by c1 asc;
c1
11
12
13
14
test minor freeze finish
===============================================================
============     distributed transaction    ===================
===============================================================
test distributed_transaction begin
create table test_dist_tx (test_dist_tx int primary key);
alter system change tenant mysql;
begin;
insert into test.test_dist_tx values(1);
ERROR 42000: Access denied for user 'root'@'%' to database 'test'
insert into __all_dummy values(1);
commit;
select * from test.test_dist_tx;
ERROR 42000: Access denied for user 'root'@'%' to database 'test'
select * from __all_dummy;
key
1
alter system change tenant sys;
test distributed_transaction finish
===============================================================
====    test __all_tablet_to_table_history & drop table    ====
===============================================================
test __all_tablet_to_table_history & drop table begin
drop table t1_no_pk;
drop table t1_pk;
drop table t1_part;
ob1.mysql_p select count(*) from oceanbase.__all_virtual_tablet_to_table_history where tenant_id = 1 and tablet_id in ($sys_tablet_id_list_str) order by schema_version, tablet_id;
count(*)
12
drop table t1_no_pk;
drop table t1_pk;
drop table t1_part;
ob1.mysql_p select count(*) from oceanbase.__all_virtual_tablet_to_table_history where tenant_id = $mysql_tenant_id and tablet_id in ($mysql_tablet_id_list_str) order by schema_version, tablet_id;
count(*)
12
test __all_tablet_to_table_history & drop table finish
===============================================================
===========    test views    ===========
===============================================================
test views begin
================== 1. SYS tenant views ==================
1.1 check views schema
desc oceanbase.DBA_OB_TENANTS;
Field	Type	Null	Key	Default	Extra
TENANT_ID	bigint(20)	NO		NULL	
TENANT_NAME	varchar(128)	NO		NULL	
TENANT_TYPE	varchar(4)	NO			
CREATE_TIME	timestamp(6)	YES			
MODIFY_TIME	timestamp(6)	YES			
PRIMARY_ZONE	varchar(8192)	YES		NULL	
LOCALITY	varchar(4096)	NO			
PREVIOUS_LOCALITY	varchar(4096)	NO			
COMPATIBILITY_MODE	varchar(6)	NO			
STATUS	varchar(64)	NO			
IN_RECYCLEBIN	varchar(3)	NO			
LOCKED	varchar(3)	NO		NULL	
TENANT_ROLE	varchar(100)	NO		NULL	
SWITCHOVER_STATUS	varchar(100)	NO		NULL	
SWITCHOVER_EPOCH	bigint(20)	NO		NULL	
SYNC_SCN	bigint(20) unsigned	NO		NULL	
REPLAYABLE_SCN	bigint(20) unsigned	NO		NULL	
READABLE_SCN	bigint(20) unsigned	NO		NULL	
RECOVERY_UNTIL_SCN	bigint(20) unsigned	NO			
LOG_MODE	varchar(100)	NO			
ARBITRATION_SERVICE_STATUS	varchar(64)	NO			
UNIT_NUM	bigint(20)	NO			
COMPATIBLE	varchar(65536)	NO			
MAX_LS_ID	bigint(20)	NO			
RESTORE_DATA_MODE	varchar(128)	NO			
desc oceanbase.DBA_OB_UNITS;
Field	Type	Null	Key	Default	Extra
UNIT_ID	bigint(20)	NO		NULL	
TENANT_ID	bigint(20)	NO		NULL	
STATUS	varchar(128)	NO			
RESOURCE_POOL_ID	bigint(20)	NO		NULL	
UNIT_GROUP_ID	bigint(20)	NO		NULL	
CREATE_TIME	timestamp(6)	YES			
MODIFY_TIME	timestamp(6)	YES			
ZONE	varchar(128)	NO		NULL	
SVR_IP	varchar(46)	NO		NULL	
SVR_PORT	bigint(20)	NO		NULL	
MIGRATE_FROM_SVR_IP	varchar(46)	NO		NULL	
MIGRATE_FROM_SVR_PORT	bigint(20)	NO		NULL	
MANUAL_MIGRATE	varchar(3)	NO		NULL	
UNIT_CONFIG_ID	bigint(20)	NO		NULL	
MAX_CPU	double	NO		NULL	
MIN_CPU	double	NO		NULL	
MEMORY_SIZE	bigint(20)	NO		NULL	
LOG_DISK_SIZE	bigint(20)	NO		NULL	
DATA_DISK_SIZE	bigint(20)	NO			
MAX_IOPS	bigint(20)	NO		NULL	
MIN_IOPS	bigint(20)	NO		NULL	
IOPS_WEIGHT	bigint(20)	NO		NULL	
MAX_NET_BANDWIDTH	bigint(20)	NO			
NET_BANDWIDTH_WEIGHT	bigint(20)	NO			
desc oceanbase.DBA_OB_UNIT_CONFIGS;
Field	Type	Null	Key	Default	Extra
UNIT_CONFIG_ID	bigint(20)	NO		NULL	
NAME	varchar(128)	NO		NULL	
CREATE_TIME	timestamp(6)	YES			
MODIFY_TIME	timestamp(6)	YES			
MAX_CPU	double	NO		NULL	
MIN_CPU	double	NO		NULL	
MEMORY_SIZE	bigint(20)	NO		NULL	
LOG_DISK_SIZE	bigint(20)	NO		NULL	
DATA_DISK_SIZE	bigint(20)	NO			
MAX_IOPS	bigint(20)	NO		NULL	
MIN_IOPS	bigint(20)	NO		NULL	
IOPS_WEIGHT	bigint(20)	NO		NULL	
MAX_NET_BANDWIDTH	bigint(20)	NO			
NET_BANDWIDTH_WEIGHT	bigint(20)	NO			
desc oceanbase.DBA_OB_RESOURCE_POOLS;
Field	Type	Null	Key	Default	Extra
RESOURCE_POOL_ID	bigint(20)	NO		NULL	
NAME	varchar(128)	NO		NULL	
TENANT_ID	bigint(20)	NO		NULL	
CREATE_TIME	timestamp(6)	YES			
MODIFY_TIME	timestamp(6)	YES			
UNIT_COUNT	bigint(20)	NO		NULL	
UNIT_CONFIG_ID	bigint(20)	NO		NULL	
ZONE_LIST	varchar(8192)	NO		NULL	
REPLICA_TYPE	varchar(4)	NO			
desc oceanbase.DBA_OB_SERVERS;
Field	Type	Null	Key	Default	Extra
SVR_IP	varchar(46)	NO		NULL	
SVR_PORT	bigint(20)	NO		NULL	
ID	bigint(20)	NO		NULL	
ZONE	varchar(128)	NO		NULL	
SQL_PORT	bigint(20)	NO		NULL	
WITH_ROOTSERVER	varchar(3)	NO		NULL	
STATUS	varchar(64)	NO		NULL	
START_SERVICE_TIME	timestamp(6)	NO		NULL	
STOP_TIME	timestamp(6)	NO			
BLOCK_MIGRATE_IN_TIME	timestamp(6)	NO		NULL	
CREATE_TIME	timestamp(6)	YES			
MODIFY_TIME	timestamp(6)	YES			
BUILD_VERSION	varchar(256)	NO		NULL	
LAST_OFFLINE_TIME	timestamp(6)	NO			
desc oceanbase.DBA_OB_ZONES;
Field	Type	Null	Key	Default	Extra
ZONE	varchar(128)	NO			
CREATE_TIME	timestamp(6)	NO			
MODIFY_TIME	timestamp(6)	NO			
STATUS	varchar(4096)	NO			
IDC	varchar(4096)	NO			
REGION	varchar(4096)	NO			
TYPE	varchar(4096)	NO			
desc oceanbase.DBA_OB_ROOTSERVICE_EVENT_HISTORY;
Field	Type	Null	Key	Default	Extra
TIMESTAMP	timestamp(6)	NO			
MODULE	varchar(64)	NO		NULL	
EVENT	varchar(64)	NO		NULL	
NAME1	varchar(256)	YES			
VALUE1	varchar(512)	YES			
NAME2	varchar(256)	YES			
VALUE2	varchar(512)	YES			
NAME3	varchar(256)	YES			
VALUE3	varchar(512)	YES			
NAME4	varchar(256)	YES			
VALUE4	varchar(512)	YES			
NAME5	varchar(256)	YES			
VALUE5	varchar(512)	YES			
NAME6	varchar(256)	YES			
VALUE6	varchar(512)	YES			
EXTRA_INFO	varchar(512)	YES			
RS_SVR_IP	varchar(46)	YES			
RS_SVR_PORT	bigint(20)	YES			
desc oceanbase.DBA_OB_TENANT_JOBS;
Field	Type	Null	Key	Default	Extra
JOB_ID	bigint(20)	NO		NULL	
JOB_TYPE	varchar(128)	NO		NULL	
JOB_STATUS	varchar(128)	NO		NULL	
RESULT_CODE	bigint(20)	YES		NULL	
PROGRESS	bigint(20)	NO			
START_TIME	timestamp(6)	YES			
MODIFY_TIME	timestamp(6)	YES			
TENANT_ID	bigint(20)	YES		NULL	
SQL_TEXT	longtext	YES		NULL	
EXTRA_INFO	varchar(4096)	YES		NULL	
RS_SVR_IP	varchar(46)	NO		NULL	
RS_SVR_PORT	bigint(20)	NO		NULL	
desc oceanbase.DBA_OB_UNIT_JOBS;
Field	Type	Null	Key	Default	Extra
JOB_ID	bigint(20)	NO		NULL	
JOB_TYPE	varchar(128)	NO		NULL	
JOB_STATUS	varchar(128)	NO		NULL	
RESULT_CODE	bigint(20)	YES		NULL	
PROGRESS	bigint(20)	NO			
START_TIME	timestamp(6)	YES			
MODIFY_TIME	timestamp(6)	YES			
TENANT_ID	bigint(20)	YES		NULL	
UNIT_ID	bigint(20)	YES		NULL	
SQL_TEXT	longtext	YES		NULL	
EXTRA_INFO	varchar(4096)	YES		NULL	
RS_SVR_IP	varchar(46)	NO		NULL	
RS_SVR_PORT	bigint(20)	NO		NULL	
desc oceanbase.DBA_OB_SERVER_JOBS;
Field	Type	Null	Key	Default	Extra
JOB_ID	bigint(20)	NO		NULL	
JOB_TYPE	varchar(128)	NO		NULL	
JOB_STATUS	varchar(128)	NO		NULL	
RESULT_CODE	bigint(20)	YES		NULL	
PROGRESS	bigint(20)	NO			
START_TIME	timestamp(6)	YES			
MODIFY_TIME	timestamp(6)	YES			
SVR_IP	varchar(46)	YES		NULL	
SVR_PORT	bigint(20)	YES		NULL	
SQL_TEXT	longtext	YES		NULL	
EXTRA_INFO	varchar(4096)	YES		NULL	
RS_SVR_IP	varchar(46)	NO		NULL	
RS_SVR_PORT	bigint(20)	NO		NULL	
1.2 only accessed by SYS tenant, user tenant can not access
desc oceanbase.DBA_OB_TENANTS;
Field	Type	Null	Key	Default	Extra
TENANT_ID	bigint(20)	NO		NULL	
TENANT_NAME	varchar(128)	NO		NULL	
TENANT_TYPE	varchar(4)	NO			
CREATE_TIME	timestamp(6)	YES			
MODIFY_TIME	timestamp(6)	YES			
PRIMARY_ZONE	varchar(8192)	YES		NULL	
LOCALITY	varchar(4096)	NO			
PREVIOUS_LOCALITY	varchar(4096)	NO			
COMPATIBILITY_MODE	varchar(6)	NO			
STATUS	varchar(64)	NO			
IN_RECYCLEBIN	varchar(3)	NO			
LOCKED	varchar(3)	NO		NULL	
TENANT_ROLE	varchar(100)	NO		NULL	
SWITCHOVER_STATUS	varchar(100)	NO		NULL	
SWITCHOVER_EPOCH	bigint(20)	NO		NULL	
SYNC_SCN	bigint(20) unsigned	NO		NULL	
REPLAYABLE_SCN	bigint(20) unsigned	NO		NULL	
READABLE_SCN	bigint(20) unsigned	NO		NULL	
RECOVERY_UNTIL_SCN	bigint(20) unsigned	NO			
LOG_MODE	varchar(100)	NO			
ARBITRATION_SERVICE_STATUS	varchar(64)	NO			
UNIT_NUM	bigint(20)	NO			
COMPATIBLE	varchar(65536)	NO			
MAX_LS_ID	bigint(20)	NO			
RESTORE_DATA_MODE	varchar(128)	NO			
desc oceanbase.DBA_OB_UNITS;
ERROR 42S02: Table 'oceanbase.dba_ob_units' doesn't exist
desc oceanbase.DBA_OB_UNIT_CONFIGS;
ERROR 42S02: Table 'oceanbase.dba_ob_unit_configs' doesn't exist
desc oceanbase.DBA_OB_RESOURCE_POOLS;
ERROR 42S02: Table 'oceanbase.dba_ob_resource_pools' doesn't exist
desc oceanbase.DBA_OB_SERVERS;
ERROR 42S02: Table 'oceanbase.dba_ob_servers' doesn't exist
desc oceanbase.DBA_OB_ZONES;
ERROR 42S02: Table 'oceanbase.dba_ob_zones' doesn't exist
desc oceanbase.DBA_OB_ROOTSERVICE_EVENT_HISTORY;
ERROR 42S02: Table 'oceanbase.dba_ob_rootservice_event_history' doesn't exist
desc oceanbase.DBA_OB_TENANT_JOBS;
ERROR 42S02: Table 'oceanbase.dba_ob_tenant_jobs' doesn't exist
desc oceanbase.DBA_OB_UNIT_JOBS;
ERROR 42S02: Table 'oceanbase.dba_ob_unit_jobs' doesn't exist
desc oceanbase.DBA_OB_SERVER_JOBS;
ERROR 42S02: Table 'oceanbase.dba_ob_server_jobs' doesn't exist
1.3 verify all views
SELECT TENANT_ID, TENANT_NAME, TENANT_TYPE, PRIMARY_ZONE, LOCALITY, PREVIOUS_LOCALITY, COMPATIBILITY_MODE, STATUS, IN_RECYCLEBIN, LOCKED FROM DBA_OB_TENANTS;
TENANT_ID	TENANT_NAME	TENANT_TYPE	PRIMARY_ZONE	LOCALITY	PREVIOUS_LOCALITY	COMPATIBILITY_MODE	STATUS	IN_RECYCLEBIN	LOCKED
1	sys	SYS	z3;z2;z1	FULL{1}@z1, FULL{1}@z2, FULL{1}@z3	NULL	MYSQL	NORMAL	NO	NO
1001	META$1002	META	z1;z2	FULL{1}@z1, FULL{1}@z2	NULL	MYSQL	NORMAL	NO	NO
1002	mysql	USER	z1;z2	FULL{1}@z1, FULL{1}@z2	NULL	MYSQL	NORMAL	NO	NO
SELECT UNIT_ID, TENANT_ID, STATUS, RESOURCE_POOL_ID, UNIT_GROUP_ID, ZONE, MIGRATE_FROM_SVR_IP, MIGRATE_FROM_SVR_PORT, MANUAL_MIGRATE, UNIT_CONFIG_ID FROM DBA_OB_UNITS;
UNIT_ID	TENANT_ID	STATUS	RESOURCE_POOL_ID	UNIT_GROUP_ID	ZONE	MIGRATE_FROM_SVR_IP	MIGRATE_FROM_SVR_PORT	MANUAL_MIGRATE	UNIT_CONFIG_ID
1	1	ACTIVE	1	1	z1	NULL	NULL	NULL	1
2	1	ACTIVE	1	1	z2	NULL	NULL	NULL	1
3	1	ACTIVE	1	1	z3	NULL	NULL	NULL	1
1001	1002	ACTIVE	1001	1001	z1	NULL	NULL	NULL	1001
1002	1002	ACTIVE	1001	1001	z2	NULL	NULL	NULL	1001
1007	1002	ACTIVE	1001	1003	z1	NULL	NULL	NULL	1001
1008	1002	ACTIVE	1001	1003	z2	NULL	NULL	NULL	1001
1009	1002	ACTIVE	1001	1001	z3	NULL	NULL	NULL	1001
1010	1002	ACTIVE	1001	1003	z3	NULL	NULL	NULL	1001
select distinct(U.MAX_CPU = C.MAX_CPU) from DBA_OB_UNIT_CONFIGS C, DBA_OB_UNITS U where C.UNIT_CONFIG_ID = U.UNIT_CONFIG_ID;
(U.MAX_CPU = C.MAX_CPU)
1
select distinct(U.MIN_CPU = C.MIN_CPU) from DBA_OB_UNIT_CONFIGS C, DBA_OB_UNITS U where C.UNIT_CONFIG_ID = U.UNIT_CONFIG_ID;
(U.MIN_CPU = C.MIN_CPU)
1
select distinct(U.MEMORY_SIZE = C.MEMORY_SIZE) from DBA_OB_UNIT_CONFIGS C, DBA_OB_UNITS U where C.UNIT_CONFIG_ID = U.UNIT_CONFIG_ID;
(U.MEMORY_SIZE = C.MEMORY_SIZE)
1
select distinct(U.LOG_DISK_SIZE = C.LOG_DISK_SIZE) from DBA_OB_UNIT_CONFIGS C, DBA_OB_UNITS U where C.UNIT_CONFIG_ID = U.UNIT_CONFIG_ID;
(U.LOG_DISK_SIZE = C.LOG_DISK_SIZE)
1
select distinct(U.MAX_IOPS = C.MAX_IOPS) from DBA_OB_UNIT_CONFIGS C, DBA_OB_UNITS U where C.UNIT_CONFIG_ID = U.UNIT_CONFIG_ID;
(U.MAX_IOPS = C.MAX_IOPS)
1
select distinct(U.MIN_IOPS = C.MIN_IOPS) from DBA_OB_UNIT_CONFIGS C, DBA_OB_UNITS U where C.UNIT_CONFIG_ID = U.UNIT_CONFIG_ID;
(U.MIN_IOPS = C.MIN_IOPS)
1
select distinct(U.IOPS_WEIGHT = C.IOPS_WEIGHT) from DBA_OB_UNIT_CONFIGS C, DBA_OB_UNITS U where C.UNIT_CONFIG_ID = U.UNIT_CONFIG_ID;
(U.IOPS_WEIGHT = C.IOPS_WEIGHT)
1
SELECT UNIT_CONFIG_ID, NAME, MAX_CPU, MIN_CPU, MEMORY_SIZE, LOG_DISK_SIZE, MAX_IOPS, MIN_IOPS, IOPS_WEIGHT FROM DBA_OB_UNIT_CONFIGS WHERE UNIT_CONFIG_ID > 1;
UNIT_CONFIG_ID	NAME	MAX_CPU	MIN_CPU	MEMORY_SIZE	LOG_DISK_SIZE	MAX_IOPS	MIN_IOPS	IOPS_WEIGHT
1001	unit_1	2	2	3221225472	3221225472	9223372036854775807	9223372036854775807	2
SELECT RESOURCE_POOL_ID, NAME, TENANT_ID, UNIT_COUNT, UNIT_CONFIG_ID, ZONE_LIST, REPLICA_TYPE FROM DBA_OB_RESOURCE_POOLS;
RESOURCE_POOL_ID	NAME	TENANT_ID	UNIT_COUNT	UNIT_CONFIG_ID	ZONE_LIST	REPLICA_TYPE
1	sys_pool	1	1	1	z1;z2;z3	FULL
1001	pool_1	1002	2	1001	z1;z2;z3	FULL
SELECT count(*) FROM DBA_OB_SERVERS WHERE (SVR_IP, SVR_PORT, ID, ZONE, SQL_PORT, STATUS, START_SERVICE_TIME, BUILD_VERSION, CREATE_TIME, MODIFY_TIME) in (SELECT SVR_IP, SVR_PORT, ID, ZONE, SQL_PORT, STATUS, usec_to_time(START_SERVICE_TIME), BUILD_VERSION, GMT_CREATE AS CREATE_TIME, GMT_MODIFIED AS MODIFY_TIME  FROM __all_server);
count(*)
7
SELECT STOP_TIME FROM DBA_OB_SERVERS;
STOP_TIME
NULL
NULL
NULL
NULL
NULL
NULL
NULL
SELECT view_row_cnt = table_row_cnt
FROM
(SELECT count(*) as view_row_cnt FROM DBA_OB_ROOTSERVICE_EVENT_HISTORY WHERE (`TIMESTAMP`, MODULE, EVENT, NAME1, VALUE1, NAME2, VALUE2, NAME3, VALUE3, NAME4, VALUE4, NAME5, VALUE5, NAME6, EXTRA_INFO, RS_SVR_IP, RS_SVR_PORT) in (select gmt_create, MODULE, EVENT, NAME1, VALUE1, NAME2, VALUE2, NAME3, VALUE3, NAME4, VALUE4, NAME5, VALUE5, NAME6, EXTRA_INFO, RS_SVR_IP, RS_SVR_PORT from __all_rootservice_event_history)) as V,
(SELECT count(*) as table_row_cnt FROM __all_rootservice_event_history) as T;
view_row_cnt = table_row_cnt
1
SELECT view_row_cnt = table_row_cnt
FROM
(SELECT count(*) as view_row_cnt FROM DBA_OB_SERVER_EVENT_HISTORY WHERE (`TIMESTAMP`, SVR_IP, SVR_PORT, MODULE, EVENT, NAME1, VALUE1, NAME2, VALUE2, NAME3, VALUE3, NAME4, VALUE4, NAME5, VALUE5, NAME6, EXTRA_INFO) in (select gmt_create, SVR_IP, SVR_PORT, MODULE, EVENT, NAME1, VALUE1, NAME2, VALUE2, NAME3, VALUE3, NAME4, VALUE4, NAME5, VALUE5, NAME6, EXTRA_INFO from __all_server_event_history)) as V,
(SELECT count(*) as table_row_cnt FROM __all_server_event_history) as T;
view_row_cnt = table_row_cnt
1
insert into __all_rootservice_job (job_id, job_type, job_status, result_code, progress, tenant_id, unit_id, svr_ip, svr_port, sql_text, extra_info, rs_svr_ip, rs_svr_port) values
(10000, 'ALTER_TENANT_LOCALITY', 'INPROGRESS', 0, 0, 1, 0, '', 0, 'sql_text', 'extra_info', '127.0.0.1', 1000),
(20000, 'MIGRATE_UNIT', 'INPROGRESS', 0, 0, -1, 1001,  '', 0, 'sql_text', 'extra_info', '127.0.0.1', 1000),
(30000, 'MIGRATE_UNIT', 'FAILED', 4002, 0, 1002, 1003,  '', 0, 'sql_text', 'extra_info', '127.0.0.1', 1000),
(40000, 'DELETE_SERVER', 'SUCCESS', 0, 100, -1, 0, '192.168.1.1', 2000,  'sql_text', 'extra_info', '127.0.0.1', 1000);
SELECT JOB_ID, JOB_TYPE, JOB_STATUS, RESULT_CODE, PROGRESS, TENANT_ID, SQL_TEXT, EXTRA_INFO, RS_SVR_IP, RS_SVR_PORT FROM DBA_OB_TENANT_JOBS WHERE JOB_ID >= 10000;
JOB_ID	JOB_TYPE	JOB_STATUS	RESULT_CODE	PROGRESS	TENANT_ID	SQL_TEXT	EXTRA_INFO	RS_SVR_IP	RS_SVR_PORT
10000	ALTER_TENANT_LOCALITY	INPROGRESS	0	0	1	sql_text	extra_info	127.0.0.1	1000
SELECT JOB_ID, JOB_TYPE, JOB_STATUS, RESULT_CODE, PROGRESS, TENANT_ID, UNIT_ID, SQL_TEXT, EXTRA_INFO, RS_SVR_IP, RS_SVR_PORT FROM DBA_OB_UNIT_JOBS WHERE JOB_ID >= 10000;
JOB_ID	JOB_TYPE	JOB_STATUS	RESULT_CODE	PROGRESS	TENANT_ID	UNIT_ID	SQL_TEXT	EXTRA_INFO	RS_SVR_IP	RS_SVR_PORT
20000	MIGRATE_UNIT	INPROGRESS	0	0	NULL	1001	sql_text	extra_info	127.0.0.1	1000
30000	MIGRATE_UNIT	FAILED	4002	0	1002	1003	sql_text	extra_info	127.0.0.1	1000
SELECT JOB_ID, JOB_TYPE, JOB_STATUS, RESULT_CODE, PROGRESS, SVR_IP, SVR_PORT, SQL_TEXT, EXTRA_INFO, RS_SVR_IP, RS_SVR_PORT FROM DBA_OB_SERVER_JOBS WHERE JOB_ID >= 10000;
JOB_ID	JOB_TYPE	JOB_STATUS	RESULT_CODE	PROGRESS	SVR_IP	SVR_PORT	SQL_TEXT	EXTRA_INFO	RS_SVR_IP	RS_SVR_PORT
40000	DELETE_SERVER	SUCCESS	0	100	192.168.1.1	2000	sql_text	extra_info	127.0.0.1	1000
ALTER TENANT mysql lock;
SELECT TENANT_ID, TENANT_NAME, LOCKED FROM DBA_OB_TENANTS WHERE TENANT_NAME = 'mysql';
TENANT_ID	TENANT_NAME	LOCKED
1002	mysql	YES
ALTER TENANT mysql unlock;
SELECT TENANT_ID, TENANT_NAME, LOCKED FROM DBA_OB_TENANTS WHERE TENANT_NAME = 'mysql';
TENANT_ID	TENANT_NAME	LOCKED
1002	mysql	NO
================== 2. Tenant space views ==================
------- DBA_OB_LS / CDB_OB_LS
------- mysql tenant
desc oceanbase.DBA_OB_LS;
Field	Type	Null	Key	Default	Extra
LS_ID	bigint(20)	NO		NULL	
STATUS	varchar(100)	NO		NULL	
PRIMARY_ZONE	longtext	YES		NULL	
UNIT_GROUP_ID	bigint(20)	NO		NULL	
LS_GROUP_ID	bigint(20)	NO		NULL	
CREATE_SCN	bigint(20) unsigned	NO		NULL	
DROP_SCN	bigint(20) unsigned	NO			
SYNC_SCN	bigint(20) unsigned	NO			
READABLE_SCN	bigint(20) unsigned	NO			
FLAG	varchar(2048)	NO			
desc oceanbase.CDB_OB_LS;
ERROR 42S02: Table 'oceanbase.cdb_ob_ls' doesn't exist
------- sys tenant
desc oceanbase.DBA_OB_LS;
Field	Type	Null	Key	Default	Extra
LS_ID	bigint(20)	NO		NULL	
STATUS	varchar(100)	NO		NULL	
PRIMARY_ZONE	longtext	YES		NULL	
UNIT_GROUP_ID	bigint(20)	NO		NULL	
LS_GROUP_ID	bigint(20)	NO		NULL	
CREATE_SCN	bigint(20) unsigned	NO		NULL	
DROP_SCN	bigint(20) unsigned	NO			
SYNC_SCN	bigint(20) unsigned	NO			
READABLE_SCN	bigint(20) unsigned	NO			
FLAG	varchar(2048)	NO			
desc oceanbase.CDB_OB_LS;
Field	Type	Null	Key	Default	Extra
TENANT_ID	bigint(20)	NO		NULL	
LS_ID	bigint(20)	NO		NULL	
STATUS	varchar(100)	NO		NULL	
PRIMARY_ZONE	longtext	YES		NULL	
UNIT_GROUP_ID	bigint(20)	NO		NULL	
LS_GROUP_ID	bigint(20)	NO		NULL	
CREATE_SCN	bigint(20) unsigned	NO		NULL	
DROP_SCN	bigint(20) unsigned	NO			
SYNC_SCN	bigint(20) unsigned	NO			
READABLE_SCN	bigint(20) unsigned	NO			
FLAG	varchar(2048)	NO			
select ls_id, status, primary_zone, unit_group_id, ls_group_id, create_scn, drop_scn from oceanbase.DBA_OB_LS where ls_id = 1;
ls_id	status	primary_zone	unit_group_id	ls_group_id	create_scn	drop_scn
1	NORMAL	z3;z2;z1	0	0	NULL	NULL
select ls_id, status, primary_zone, unit_group_id, ls_group_id, drop_scn from oceanbase.DBA_OB_LS where ls_id != 1;
ls_id	status	primary_zone	unit_group_id	ls_group_id	drop_scn
test views end
=================================================================
===========    test manage server and zone ==========
=================================================================
test 'manage server and zone' begin
ob1.mysql alter system switch replica leader ls = 1 server = '$sys_ls_obs_z3' tenant = 'sys';
ob1.check_until_timeout select count(*) from DBA_OB_LS_LOCATIONS where zone='z3' and role='LEADER', 1, 30;
======== alter system isolate server
ob1.check_until_timeout select count(*) from DBA_OB_SERVERS where svr_ip = '$z3_svr_ip' and svr_port = '$z3_svr_port' and stop_time is not null, 1, 30;
ob1.check_until_timeout select count(*) from DBA_OB_LS_LOCATIONS where zone='z3' and role='LEADER', 0, 30;
=======  alter system start server
ob1.check_until_timeout select count(*) from DBA_OB_SERVERS where svr_ip = '$z3_svr_ip' and svr_port = '$z3_svr_port' and stop_time is null, 1, 30;
=======  alter system stop zone 'z1'
alter system stop zone 'z1';
ERROR HY000: Tenant(1001) LS(1) has no enough valid paxos member after stop zone, stop zone not allowed
=======  alter system stop zone 'z3'
alter system stop zone 'z3';
ob1.check_until_timeout select count(*) from DBA_OB_ZONES where status = 'INACTIVE' and zone = 'z3', 1, 30;
ob1.check_until_timeout select count(*) from CDB_OB_LS_LOCATIONS where zone='z3' and role='LEADER', 0, 30;
alter system start zone 'z3';
ob1.check_until_timeout select count(*) from DBA_OB_ZONES where status = 'ACTIVE' and zone = 'z3', 1, 30;
ob1.check_until_timeout select count(*) from DBA_OB_LS_LOCATIONS where zone='z3' and role='LEADER', 1, 30;
ob1.check_until_timeout select count(*) from __all_virtual_core_meta_table where zone = 'z3' and role = 1, 1, 60;
test 'manage server and zone' finish
=================================================================
===========    test io usage view  ==========
=================================================================
test 'test io usage view' begin
count(*) >= 4
1
count(*) >= 2
1
count(*) >= 2
1
RESULT
1
test 'test io usage view' finish
===============================================================
========================= clear ===============================
===============================================================
clear begin
set recyclebin = 'OFF';
drop tenant mysql;
drop resource pool pool_1;
drop tenant if exists oracle_tenant1 force;
drop resource pool if exists oracle_pool1;
drop resource unit if exists oracle_unit1;
clear end
