purge recyclebin;
drop database IF EXISTS obljh;
create database obljh ;
use obljh;
set timestamp = 1600000000;
set ob_trx_timeout = 10000000000;
set ob_query_timeout = 10000000000;
alter system set ob_vector_memory_limit_percentage =44;
drop table if exists t1;
create table t1 (c1 int primary key, c2 sparsevector,c3 sparsevector,c4 sparsevector,VECTOR INDEX vector_idx(c2) WITH (distance=inner_product));
insert into t1(c1,c2,c3,c4) values(1,'{1:1.3,1:2.6}','{1:1.3,1:2.6}','{1:1.3,1:2.6}');
ALTER TABLE t1 add c6 sparsevector NOT NULL;
ERROR 22004: Invalid use of NULL value
select * from t1 ORDER BY negative_inner_product(c2, map(1,2,3,4)) APPROXIMATE limit 5;
ERROR 22000: Invalid data type for the operation
select * from t1 ORDER BY negative_inner_product(c2, '{0:0,0:null}') APPROXIMATE limit 5;
ERROR 42000: Null value
drop table if exists t1;
create table t1 (c1 int primary key, c2 sparsevector,c3 sparsevector,c4 map(int,float),c5 sparsevector as (c4), VECTOR INDEX idx2(c2) WITH (distance=inner_product));
insert into t1(c1,c2,c3,c4) values(1,'{1:1.3,1:2.6}','{1:1.3,1:2.6}',map(1,2,3,4,5,7000000));
insert into t1(c1,c2,c3,c4) values(2,null,'{1:1.3,1:2.6}',null);
select * from t1 where  c4 is null  order by negative_inner_product(c2, '{0:1.3,1:2.6}') approximate  limit 1;
c1	c2	c3	c4	c5
select * from t1 where  c4 is not null  order by negative_inner_product(c2, '{0:1.3,1:2.6}') approximate  limit 1;
c1	c2	c3	c4	c5
1	{1:2.6}	{1:2.6}	{1:2,3:4,5:7000000}	{1:2,3:4,5:7000000}
drop table if exists t1;
create table t1 (c1 int primary key, c2 sparsevector,c3 sparsevector,c4 sparsevector);
insert into t1(c1,c2,c3,c4) values(1,'{1:1.3,1:2.6}','{1:1.3,1:2.6}','{1:1.3,1:2.6}');
ALTER TABLE t1 ALTER c2 SET DEFAULT  0;
ERROR 42000: BLOB, TEXT, GEOMETRY or JSON column 'c2' can't have a default value
ALTER TABLE t1 ALTER c2 SET DEFAULT 'sparsevector';
ERROR 42000: BLOB, TEXT, GEOMETRY or JSON column 'c2' can't have a default value
ALTER TABLE t1 ALTER c2 SET DEFAULT '{1:9.9}';
ERROR 42000: BLOB, TEXT, GEOMETRY or JSON column 'c2' can't have a default value
insert into t1(c1) values(2);
select * from t1 order by c1;
c1	c2	c3	c4
1	{1:2.6}	{1:2.6}	{1:2.6}
2	NULL	NULL	NULL
drop table if exists t1;
create table t1 (c1 int primary key, c2 sparsevector,c3 sparsevector,c4 sparsevector, VECTOR INDEX idx2(c2) WITH (distance=inner_product));
ALTER TABLE t1 ADD COLUMN c5 VARCHAR(255) AS (inner_product(c2,c3)) STORED;
ERROR 0A000: Run this DDL operation on table with sparse vector index not supported
ALTER TABLE t1 ADD COLUMN c6 VARCHAR(255) AS (inner_product(c2,map(1,2,3,4,0,1))) STORED;
ERROR 0A000: Run this DDL operation on table with sparse vector index not supported
insert into t1(c1,c2,c3,c4) values(1,'{1:1.3,1:2.6}','{1:1.3,1:2.6}','{1:1.3,1:2.6}');
insert into t1(c1,c2,c3,c4) values(2,'{}','{1:false}','{1:1.3,1:2.6}');
insert into t1(c1,c2,c3,c4) values(3,'{2:3,1:2}','{}','{1:1.3,1:2.6}');
insert into t1(c1,c2,c3,c4) values(4,null,null,null);
select * from t1 order by c1;
c1	c2	c3	c4
1	{1:2.6}	{1:2.6}	{1:2.6}
2	{}	{1:0}	{1:2.6}
3	{1:2,2:3}	{}	{1:2.6}
4	NULL	NULL	NULL
select inner_product(c2,c3) from t1 order by c1;
inner_product(c2,c3)
6.7599992752075195
0
0
NULL
select inner_product(c2,c3) from t1 order by c1;
inner_product(c2,c3)
6.7599992752075195
0
0
NULL
drop table if exists t1;
create table t1 (c1 int primary key, c2 sparsevector not null,c3 sparsevector,c4 varchar(30),c5 sparsevector GENERATED ALWAYS as (c4) VIRTUAL, VECTOR INDEX idx2(c2) WITH (distance=inner_product));
insert into t1(c1,c2,c3,c4) values(2,'{}','{2:3}','{1:1.3,100:-2.6}');
insert into t1(c1,c2,c3,c4) values(3,'{1:2}','{}','{1:1.3,10000:-2.6}');
insert into t1(c1,c2,c3,c4) values(16,'{1:3}','{2:1}','{1:1.3,10000:3.6}');
insert into t1(c1,c2,c3,c4) values(10,'{2:3}','{10000000:1}','{1:1.3,10000:2.8}');
select * from t1 order by c1;
c1	c2	c3	c4	c5
2	{}	{2:3}	{1:1.3,100:-2.6}	{1:1.3,100:-2.6}
3	{1:2}	{}	{1:1.3,10000:-2.6}	{1:1.3,10000:-2.6}
10	{2:3}	{10000000:1}	{1:1.3,10000:2.8}	{1:1.3,10000:2.8}
16	{1:3}	{2:1}	{1:1.3,10000:3.6}	{1:1.3,10000:3.6}
drop table if exists t1;
create table t1 (c1 int primary key, c2 sparsevector,c3 sparsevector,c4 sparsevector, VECTOR INDEX idx2(c2) WITH (distance=inner_product));
insert into t1(c1,c2,c3,c4) values(1,'{1:1.3,1:2.6}','{1:1.3,1:2.6}','{1:1.3,1:2.6}');
insert into t1(c1,c2,c3,c4) values(2,'{}','{1:false}','{1:1.3,1:2.6}');
insert into t1(c1,c2,c3,c4) values(3,'{2:3,1:2}','{}','{1:1.3,1:2.6}');
insert into t1(c1,c2,c3,c4) values(4,null,null,null);
select * from t1 order by c1;
c1	c2	c3	c4
1	{1:2.6}	{1:2.6}	{1:2.6}
2	{}	{1:0}	{1:2.6}
3	{1:2,2:3}	{}	{1:2.6}
4	NULL	NULL	NULL
select inner_product(c2,c3) from t1 order by c1;
inner_product(c2,c3)
6.7599992752075195
0
0
NULL
select inner_product(c2,c3) from t1 order by c1;
inner_product(c2,c3)
6.7599992752075195
0
0
NULL
drop table if exists t1;
create table t1 (c1 int primary key, c2 sparsevector,c3 sparsevector,c4 sparsevector);
insert into t1(c1,c2,c3,c4) values(1,'{1:1.3,1:2.6}','{1:1.3,1:2.6}','{1:1.3,1:2.6}');
insert into t1(c1,c2,c3,c4) values(2,'{}','{1:false}','{1:1.3,1:2.6}');
insert into t1(c1,c2,c3,c4) values(3,'{2:3,1:2}','{}','{1:1.3,1:2.6}');
insert into t1(c1,c2,c3,c4) values(4,null,null,null);
ALTER TABLE t1 DROP COLUMN c2,DROP COLUMN c3,DROP COLUMN c4;
drop table if exists t1;
create table t1 (c1 int primary key, c2 sparsevector,c3 sparsevector,c4 sparsevector,VECTOR INDEX vector_idx(c2) WITH (distance=inner_product),VECTOR INDEX vector_idx1(c3) WITH (distance=inner_product),VECTOR INDEX vector_idx2(c4) WITH (distance=inner_product));
ALTER TABLE t1 DROP COLUMN c2,DROP COLUMN c3,DROP COLUMN c4;
ERROR 0A000: Run this DDL operation on table with sparse vector index not supported
drop table if exists t1;
create table t1 (c1 int primary key, c2 sparsevector,c3 sparsevector,c4 sparsevector);
insert into t1(c1,c2,c3,c4) values(1,'{1:1.3,1:2.6}','{1:1.3,1:2.6}','{1:1.3,1:2.6}');
insert into t1(c1,c2,c3,c4) values(2,'{}','{1:false}','{1:1.3,1:2.6}');
insert into t1(c1,c2,c3,c4) values(3,'{2:3,1:2}','{}','{1:1.3,1:2.6}');
insert into t1(c1,c2,c3,c4) values(4,null,null,null);
truncate table t1;
select * from t1 order by c1;
c1	c2	c3	c4
drop table if exists t1;
create table t1 (c1 int primary key, c2 sparsevector,c3 sparsevector,c4 sparsevector,VECTOR INDEX vector_idx(c2) WITH (distance=inner_product),VECTOR INDEX vector_idx1(c3) WITH (distance=inner_product),VECTOR INDEX vector_idx2(c4) WITH (distance=inner_product));
insert into t1(c1,c2,c3,c4) values(1,'{1:1.3,1:2.6}','{1:1.3,1:2.6}','{1:1.3,1:2.6}');
insert into t1(c1,c2,c3,c4) values(2,'{}','{1:false}','{1:1.3,1:2.6}');
insert into t1(c1,c2,c3,c4) values(3,'{2:3,1:2}','{}','{1:1.3,1:2.6}');
insert into t1(c1,c2,c3,c4) values(4,null,null,null);
truncate table t1;
select * from t1 order by c1;
c1	c2	c3	c4
##设置binary
drop table if exists  t1;
create table t1 (c1 int primary key,c2 sparsevector,c3 sparsevector,c4 varchar(20),VECTOR INDEX vector_idx(c2) WITH (distance=inner_product))default character set binary;
insert into t1(c1,c2,c3,c4) values(1,'{1:1.3,1:2.6}','{1:1.3,1:2.6}','{1:1.3,1:2.6}');
insert into t1(c1,c2,c3,c4) values(2,'{}','{1:false}','{1:1.3,1:2.6}');
insert into t1(c1,c2,c3,c4) values(3,'{2:3,1:2}','{}','{1:1.3,1:2.6}');
insert into t1(c1,c2,c3,c4) values(4,null,null,null);
update /*+ ENABLE_PARALLEL_DML parallel(256) */t1 set c2=map(1,2,3,4,5,6) where c1=1;
delete from t1 where c2='{}' ;
select c1,c2,c3,c4 from t1 order by c1;
c1	c2	c3	c4
1	{1:2,3:4,5:6}	{1:2.6}	{1:1.3,1:2.6}
3	{1:2,2:3}	{}	{1:1.3,1:2.6}
4	NULL	NULL	NULL
desc t1 ;
Field	Type	Null	Key	Default	Extra
c1	int(11)	NO	PRI	NULL	
c2	SPARSEVECTOR	YES		NULL	
c3	SPARSEVECTOR	YES		NULL	
c4	varbinary(20)	YES		NULL	
ALTER TABLE t1 CONVERT TO CHARACTER SET gbk;
ERROR 0A000: Run this DDL operation on table with sparse vector index not supported
select c1,c2,c3,c4 from t1 order by c1;
c1	c2	c3	c4
1	{1:2,3:4,5:6}	{1:2.6}	{1:1.3,1:2.6}
3	{1:2,2:3}	{}	{1:1.3,1:2.6}
4	NULL	NULL	NULL
##设置utf8mb4
drop table if exists  t1;
create table t1 (c1 int primary key,c2 sparsevector,c3 sparsevector,c4 varchar(20), vector index idx1(c2) with (distance=inner_product))default character set utf8mb4;
insert into t1(c1,c2,c3,c4) values(1,'{1:1.3,1:2.6}','{1:1.3,1:2.6}','{1:1.3,1:2.6}');
insert into t1(c1,c2,c3,c4) values(2,'{}','{1:false}','{1:1.3,1:2.6}');
insert into t1(c1,c2,c3,c4) values(3,'{2:3,1:2}','{}','{1:1.3,1:2.6}');
insert into t1(c1,c2,c3,c4) values(4,null,null,null);
update /*+ ENABLE_PARALLEL_DML parallel(256) */t1 set c2='{1:2}' where c1=1;
delete from t1 where c2='{}' ;
select c1,c2,c3,c4 from t1 order by c1;
c1	c2	c3	c4
1	{1:2}	{1:2.6}	{1:1.3,1:2.6}
3	{1:2,2:3}	{}	{1:1.3,1:2.6}
4	NULL	NULL	NULL
desc t1 ;
Field	Type	Null	Key	Default	Extra
c1	int(11)	NO	PRI	NULL	
c2	SPARSEVECTOR	YES		NULL	
c3	SPARSEVECTOR	YES		NULL	
c4	varchar(20)	YES		NULL	
ALTER TABLE t1 CONVERT TO CHARACTER SET gbk;
ERROR 0A000: Run this DDL operation on table with sparse vector index not supported
select c1,c2,c3,c4 from t1 order by c1;
c1	c2	c3	c4
1	{1:2}	{1:2.6}	{1:1.3,1:2.6}
3	{1:2,2:3}	{}	{1:1.3,1:2.6}
4	NULL	NULL	NULL
drop table if exists  t1;
create table t1 (c1 int primary key,c2 sparsevector comment '注释c2',c3 sparsevector comment '注释c3',c4 varchar(20) comment '注释c4', vector index idx1(c2) with (distance=inner_product))default character set utf8mb4;
insert into t1(c1,c2,c3,c4) values(1,'{1:1.3,1:2.6}','{1:1.3,1:2.6}','{1:1.3,1:2.6}');
insert into t1(c1,c2,c3,c4) values(2,'{}','{1:false}','{1:1.3,1:2.6}');
insert into t1(c1,c2,c3,c4) values(3,'{2:3,1:2}','{}','{1:1.3,1:2.6}');
insert into t1(c1,c2,c3,c4) values(4,null,null,null);
update /*+ ENABLE_PARALLEL_DML parallel(256) */t1 set c2='{2:3}' where c1=1;
delete from t1 where c2='{}' ;
select c1,c2,c3,c4 from t1 order by c1;
c1	c2	c3	c4
1	{2:3}	{1:2.6}	{1:1.3,1:2.6}
3	{1:2,2:3}	{}	{1:1.3,1:2.6}
4	NULL	NULL	NULL
desc t1 ;
Field	Type	Null	Key	Default	Extra
c1	int(11)	NO	PRI	NULL	
c2	SPARSEVECTOR	YES		NULL	
c3	SPARSEVECTOR	YES		NULL	
c4	varchar(20)	YES		NULL	
ALTER TABLE t1 CONVERT TO CHARACTER SET gbk;
ERROR 0A000: Run this DDL operation on table with sparse vector index not supported
select c1,c2,c3,c4 from t1 order by c1;
c1	c2	c3	c4
1	{2:3}	{1:2.6}	{1:1.3,1:2.6}
3	{1:2,2:3}	{}	{1:1.3,1:2.6}
4	NULL	NULL	NULL
##设置gbk
drop table if exists  t1;
create table t1 (c1 int primary key,c2 sparsevector comment '注释c2',c3 sparsevector comment '注释c3',c4 varchar(20) comment '注释c4', vector index idx1(c2) with (distance=inner_product))default character set gbk;
insert into t1(c1,c2,c3,c4) values(1,'{1:1.3,1:2.6}','{1:1.3,1:2.6}','{1:1.3,1:2.6}');
insert into t1(c1,c2,c3,c4) values(2,'{}','{1:false}','{1:1.3,1:2.6}');
insert into t1(c1,c2,c3,c4) values(3,'{2:3,1:2}','{}','{1:1.3,1:2.6}');
insert into t1(c1,c2,c3,c4) values(4,null,null,null);
update /*+ ENABLE_PARALLEL_DML parallel(256) */t1 set c2='{2:4}' where c1=1;
delete from t1 where c2='{}' ;
select c1,c2,c3,c4 from t1 order by c1;
c1	c2	c3	c4
1	{2:4}	{1:2.6}	{1:1.3,1:2.6}
3	{1:2,2:3}	{}	{1:1.3,1:2.6}
4	NULL	NULL	NULL
desc t1 ;
Field	Type	Null	Key	Default	Extra
c1	int(11)	NO	PRI	NULL	
c2	SPARSEVECTOR	YES		NULL	
c3	SPARSEVECTOR	YES		NULL	
c4	varchar(20)	YES		NULL	
ALTER TABLE t1 CONVERT TO CHARACTER SET utf8mb4;
ERROR 0A000: Run this DDL operation on table with sparse vector index not supported
select c1,c2,c3,c4 from t1 order by c1;
c1	c2	c3	c4
1	{2:4}	{1:2.6}	{1:1.3,1:2.6}
3	{1:2,2:3}	{}	{1:1.3,1:2.6}
4	NULL	NULL	NULL
drop table if exists t1;
create table t1 (c1 int primary key, c2 sparsevector,c3 sparsevector,c4 sparsevector, vector index idx1(c2) with (distance=inner_product), vector index idx2(c3) with (distance=inner_product), vector index idx3(c4) with (distance=inner_product));
drop table t1 ;
drop table if exists t1;
create table t1 (c1 int primary key, c2 sparsevector,c3 sparsevector,c4 sparsevector, vector index idx1(c2) with (distance=inner_product), vector index idx2(c3) with (distance=inner_product), vector index idx3(c4) with (distance=inner_product));
insert into t1(c1,c2,c3,c4) values(1,'{1:1.3,1:2.6}','{1:1.3,1:2.6}','{1:1.3,1:2.6}');
insert into t1(c1,c2,c3,c4) values(2,'{}','{1:false}','{1:1.3,1:2.6}');
insert into t1(c1,c2,c3,c4) values(3,'{2:3,1:2}','{}','{1:1.3,1:2.6}');
insert into t1(c1,c2,c3,c4) values(4,null,null,null);
replace into t1(c1,c2,c3,c4) values(3,'{2:3,1:2}','{}','{1:1.3,1:2.6}');
select * from t1 where c2='{}' and c1 >1 order by negative_inner_product(c2,'{1:2,2:20000}')  APPROXIMATE limit 1 for update;
c1	c2	c3	c4
2	{}	{1:0}	{1:2.6}
select * from t1 where c2='{}' and c1 >1 order by negative_inner_product(c2,'{1:2,2:20000}')  APPROXIMATE limit 1;
c1	c2	c3	c4
2	{}	{1:0}	{1:2.6}
select * from t1 where c2='{NULL:NULL,1:2,1:2}'  order by negative_inner_product(c2,'{1:2,2:20000}')  APPROXIMATE limit 1;
ERROR 42000: Null value
select * from t1 where c2='{1:2,1:2,1:2,1:2,1:2,1:2,1:2,1:2,1:2,1:2,1:2,1:2,1:2,1:2,1:2,1:2,1:2,1:2,1:2,1:2,1:2,1:2,1:2,1:2,1:2,1:2,1:2,1:2,1:2,1:2,1:2,1:2,1:1000000000000000000,1:2}' order by negative_inner_product(c2,'{1:2,2:20000}')  APPROXIMATE limit 1;
c1	c2	c3	c4
drop table t1 ;
drop table if exists t1;
create table t1 (c1 int primary key, c2 sparsevector,c3 sparsevector,c4 sparsevector, vector index idx1(c2) with (distance=inner_product), vector index idx2(c3) with (distance=inner_product), vector index idx3(c4) with (distance=inner_product))PARTITION BY range COLUMNS(c1)(
PARTITION p0 values less than(1),
PARTITION p1 values less than(2),
PARTITION p2 values less than(10)
);
insert into t1(c1,c2,c3,c4) values(1,'{1:1.3,1:2.6}','{1:1.3,1:2.6}','{1:1.3,1:2.6}');
insert into t1(c1,c2,c3,c4) values(2,'{}','{1:false}','{1:1.3,1:2.6}');
insert into t1(c1,c2,c3,c4) values(3,'{1:2,1:2}','{}','{1:1.3,1:2.6}');
replace into t1(c1,c2,c3,c4) values(3,'{1:4,1:2}','{}','{1:1.3,1:2.6}');
ALTER TABLE t1 MODIFY PARTITION BY HASH(c1) PARTITIONS 4;
ERROR 42000: You have an error in your SQL syntax; check the manual that corresponds to your OceanBase version for the right syntax to use near 'BY HASH(c1) PARTITIONS 4' at line 1
ALTER TABLE t1 PARTITION BY KEY(c1) PARTITIONS 10;
ERROR 0A000: Run this DDL operation on table with sparse vector index not supported
drop table if exists t1;
create table t1 (c1 int primary key, c2 sparsevector,c3 sparsevector,c4 sparsevector, vector index idx1(c2) with (distance=inner_product), vector index idx2(c3) with (distance=inner_product), vector index idx3(c4) with (distance=inner_product))PARTITION BY range COLUMNS(c1)(
PARTITION p0 values less than(1),
PARTITION p1 values less than(2),
PARTITION p2 values less than(10)
);
insert into t1(c1,c2,c3,c4) values(1,'{1:1.3,1:2.6}','{1:1.3,1:2.6}','{1:1.3,1:2.6}');
insert into t1(c1,c2,c3,c4) values(2,'{}','{2:false}','{1:1.3,1:2.6}');
insert into t1(c1,c2,c3,c4) values(3,'{1:2,1:2}','{}','{1:1.3,1:2.6}');
replace into t1(c1,c2,c3,c4) values(3,'{3:423,1:2}','{}','{1:1.3,1:2.6}');
ALTER TABLE t1 MODIFY PARTITION BY HASH(c1) PARTITIONS 4;
ERROR 42000: You have an error in your SQL syntax; check the manual that corresponds to your OceanBase version for the right syntax to use near 'BY HASH(c1) PARTITIONS 4' at line 1
ALTER TABLE t1 PARTITION BY KEY(c1) PARTITIONS 10;
ERROR 0A000: Run this DDL operation on table with sparse vector index not supported
replace into t1(c1,c2,c3,c4) values(3,'{3:423,1:2}','{}','{1:1.3,1:2.6}');
replace into t1(c1,c2,c3,c4) values(4,'{3:423,1:2}','{}','{1:1.3,1:2.6}');
insert into t1(c1,c2,c3,c4) values(10,'{3:423,1:2}','{}','{1:1.3,1:2.6}');
ERROR HY000: Table has no partition for value
select * from t1 order by negative_inner_product(c2,'{1:2,2:20000}')  APPROXIMATE limit 1;
c1	c2	c3	c4
1	{1:2.6}	{1:2.6}	{1:2.6}
drop table if exists t1;
create table t1 (c1 int primary key, c2 sparsevector,c3 sparsevector,c4 sparsevector, vector index idx1(c2) with (distance=inner_product), vector index idx2(c3) with (distance=inner_product), vector index idx3(c4) with (distance=inner_product));
ALTER TABLE t1 PARTITION BY HASH(c1) partitions 4;
ERROR 0A000: Run this DDL operation on table with sparse vector index not supported
insert into t1(c1,c2,c3,c4) values(1,'{1:1.3,1:2.6}','{1:1.3,1:2.6}','{1:1.3,1:2.6}');
insert into t1(c1,c2,c3,c4) values(2,'{}','{2:false}','{1:1.3,1:2.6}');
insert into t1(c1,c2,c3,c4) values(3,'{1:4,1:2}','{}','{1:1.3,1:2.6}');
replace into t1(c1,c2,c3,c4) values(3,'{2:3,1:2}','{}','{1:1.3,1:2.6}');
replace into t1(c1,c2,c3,c4) values(10,null,null,null);
drop table if exists t1;
CREATE TABLE t1(c1 INT, c2 sparsevector)
PARTITION BY RANGE(c1)
SUBPARTITION BY RANGE(c1)
(PARTITION p0 VALUES LESS THAN(100)
(SUBPARTITION sp0 VALUES LESS THAN(2020),
SUBPARTITION sp1 VALUES LESS THAN(2021)
),
PARTITION p1 VALUES LESS THAN(200)
(SUBPARTITION sp2 VALUES LESS THAN(2020),
SUBPARTITION sp3 VALUES LESS THAN(2021),
SUBPARTITION sp4 VALUES LESS THAN(2022)
)
);
insert into t1(c1,c2) values(1,'{1:1.3,1:2.6}');
ALTER TABLE t1 MODIFY PARTITION p1
ADD SUBPARTITION
(SUBPARTITION sp5 VALUES LESS THAN(2023),
SUBPARTITION sp6 VALUES LESS THAN(2024));
drop table if exists t1;
CREATE TABLE t1(c1 INT primary key, c2 sparsevector not null, vector index idx1(c2) with (distance=inner_product))
PARTITION BY RANGE(c1)
SUBPARTITION BY RANGE(c1)
(PARTITION p0 VALUES LESS THAN(100)
(SUBPARTITION sp0 VALUES LESS THAN(2020),
SUBPARTITION sp1 VALUES LESS THAN(2021)
),
PARTITION p1 VALUES LESS THAN(200)
(SUBPARTITION sp2 VALUES LESS THAN(2020),
SUBPARTITION sp3 VALUES LESS THAN(2021),
SUBPARTITION sp4 VALUES LESS THAN(2022)
)
);
insert into t1(c1,c2) values(1,'{1:1.3,1:2.6}');
insert into t1(c1,c2) values(10,'{1:1.3,1:2.6,1.2:10}');
ALTER TABLE t1 MODIFY PARTITION p1
ADD SUBPARTITION
(SUBPARTITION sp5 VALUES LESS THAN(2023),
SUBPARTITION sp6 VALUES LESS THAN(2024));
insert into t1(c1,c2) values(2,'{1:1.3,1:2.6}');
insert into t1(c1,c2) values(3,'{}');
insert into t1(c1,c2) values(4,'{1:1.3,1:2.6,1.2:10}');
select * from t1 SUBPARTITION order by negative_inner_product(c2,'{1:2,2:20000}')  APPROXIMATE limit 1;
c1	c2
10	{1:10}
select * from t1 SUBPARTITION where c2 is not null order by negative_inner_product(c2,'{1:2,2:20000}')  APPROXIMATE limit 1;
c1	c2
10	{1:10}
drop table if exists t1;
CREATE TABLE t1(c1 INT primary key, c2 sparsevector, vector index idx1(c2) with (distance=inner_product))
PARTITION BY RANGE(c1)
SUBPARTITION BY RANGE(c1)
(PARTITION p0 VALUES LESS THAN(100)
(SUBPARTITION sp0 VALUES LESS THAN(2020),
SUBPARTITION sp1 VALUES LESS THAN(2021)
),
PARTITION p1 VALUES LESS THAN(200)
(SUBPARTITION sp2 VALUES LESS THAN(2020),
SUBPARTITION sp3 VALUES LESS THAN(2021),
SUBPARTITION sp4 VALUES LESS THAN(2022)
)
);
insert into t1(c1,c2) values(1,'{1:1.3,1:2.6}');
insert into t1(c1,c2) values(10,'{1:1.3,1:2.6,1.2:10}');
ALTER TABLE t1 MODIFY PARTITION p1
ADD SUBPARTITION
(SUBPARTITION sp5 VALUES LESS THAN(2023),
SUBPARTITION sp6 VALUES LESS THAN(2024));
ALTER TABLE t1 DROP PARTITION sp6;
ERROR HY000: Error in list of partitions to DROP
ALTER TABLE t1 DROP PARTITION p0;
ALTER TABLE t1 DROP PARTITION p1;
ERROR HY000: Cannot remove all partitions, use DROP TABLE instead
insert into t1(c1,c2) values(2,'{1:1.3,1:2.6}');
insert into t1(c1,c2) values(3,null);
insert into t1(c1,c2) values(4,'{1:1.3,1:2.6,1.2:10}');
select * from t1 SUBPARTITION order by negative_inner_product(c2,'{1:2,2:20000}')  APPROXIMATE limit 1;
c1	c2
4	{1:10}
select * from t1 SUBPARTITION where c2 is not null order by negative_inner_product(c2,'{1:2,2:20000}')  APPROXIMATE limit 1;
c1	c2
4	{1:10}
drop table t1;
drop table if exists t1;
CREATE TABLE t1(c1 INT primary key, c2 sparsevector, vector index idx1(c2) with (distance=inner_product))
PARTITION BY RANGE(c1)
SUBPARTITION BY RANGE(c1)
(PARTITION p0 VALUES LESS THAN(100)
(SUBPARTITION sp0 VALUES LESS THAN(2020),
SUBPARTITION sp1 VALUES LESS THAN(2021)
),
PARTITION p1 VALUES LESS THAN(200)
(SUBPARTITION sp2 VALUES LESS THAN(2020),
SUBPARTITION sp3 VALUES LESS THAN(2021),
SUBPARTITION sp4 VALUES LESS THAN(2022)
)
);
insert into t1(c1,c2) values(1,'{1:1.3,1:2.6}');
ALTER TABLE t1 MODIFY PARTITION p1
ADD SUBPARTITION
(SUBPARTITION sp5 VALUES LESS THAN(2023),
SUBPARTITION sp6 VALUES LESS THAN(2024));
insert into t1(c1,c2) values(2,'{1:1.3,1:2.6}');
create index idx2 on t1(c1) global;
insert into t1(c1,c2) values(3,null);
insert into t1(c1,c2) values(4,'{1:1.3,1:2.6,1.2:10}');
select /*+ index(t1 idx2)*/c2 from t1 where c1>1  order by negative_inner_product(c2,'{1:2,2:20000}')  APPROXIMATE limit 1;
c2
{1:10}
select /*+ index(t1 idx2)*/c2 from t1 where c2='{1:1.3,1:2.6,1:2.6}'  order by negative_inner_product(c2,'{1:2,2:20000}')  APPROXIMATE limit 1;
c2
{1:2.6}
ALTER TABLE t1 TRUNCATE PARTITION p0;
ALTER TABLE t1 TRUNCATE PARTITION p1;
ALTER TABLE t1 TRUNCATE SUBPARTITION sp6;
insert into t1(c1,c2) values(4,'{1:1.3,1:2.6,1.2:10}');
select /*+ index(t1 idx2)*/c2 from t1 where c2='{1:1.3,1:2.6,1:2.6}'  order by negative_inner_product(c2,'{1:2,2:20000}')  APPROXIMATE limit 1;
c2
drop table if exists t1;
create table t1 (c1 int , c2 sparsevector,c3 sparsevector,c4 sparsevector);
insert into t1(c1,c2,c3,c4) values(1,'{1:1.3,1:2.6}','{1:1.3,1:2.6}','{1:1.3,1:2.6}');
insert into t1(c1,c2,c3,c4) values(2,'{}','{1:2}','{1:1.3,1:2.6}');
insert into t1(c1,c2,c3,c4) values(3,'{2:3}','{}','{1:1.3,1:2.6}');
ALTER TABLE t1 ADD COLUMN c5 int AS (inner_product(c2,c3)) STORED;
alter table t1 partition by hash(c5) partitions 20;
drop table if exists t1;
create table t1 (c1 int , c2 sparsevector,c3 sparsevector,c4 sparsevector);
insert into t1(c1,c2,c3,c4) values(1,'{1:1.3,1:2.6}','{1:1.3,1:2.6}','{1:1.3,1:2.6}');
insert into t1(c1,c2,c3,c4) values(2,'{}','{1:false}','{1:1.3,1:2.6}');
ALTER TABLE t1 ADD COLUMN c5 int AS (inner_product(c2,c3)) STORED;
select * from t1 order by c1;
c1	c2	c3	c4	c5
1	{1:2.6}	{1:2.6}	{1:2.6}	7
2	{}	{1:0}	{1:2.6}	0
alter table t1 partition by hash(c5) partitions 20;
insert into t1(c1,c2,c3,c4) values(3,'{2:3,1:2}','{}','{1:1.3,1:2.6}');
insert into t1(c1,c2,c3,c4) values(4,null,null,null);
select /*+ index(t1 idx1)*/c2 from t1 where c2='{1:1.3,1:2.6,1:2.6}'  order by negative_inner_product(c2,'{1:2,2:20000}')  APPROXIMATE limit 1;
c2
{1:2.6}
select inner_product(c2,c3) from t1 order by c1;
inner_product(c2,c3)
6.7599992752075195
0
0
NULL
select inner_product(c2,c3) from t1 order by c1;
inner_product(c2,c3)
6.7599992752075195
0
0
NULL
drop table if exists t1;
create table t1 (c1 int , c2 sparsevector,c3 sparsevector,c4 sparsevector,vector index idx1(c2) with (distance=inner_product), vector index idx2(c3) with (distance=inner_product), vector index idx3(c4) with (distance=inner_product));
insert into t1(c1,c2,c3,c4) values(1,'{1:1.3,1:2.6}','{1:1.3,1:2.6}','{1:1.3,1:2.6}');
insert into t1(c1,c2,c3,c4) values(2,'{}','{1:false}','{1:1.3,1:2.6}');
ALTER TABLE t1 ADD COLUMN c5 int AS (inner_product(c2,c3)) STORED;
ERROR 0A000: Run this DDL operation on table with sparse vector index not supported
select * from t1 order by c1;
c1	c2	c3	c4
1	{1:2.6}	{1:2.6}	{1:2.6}
2	{}	{1:0}	{1:2.6}
alter table t1 partition by hash(c5) partitions 20;
ERROR 42S22: Unknown column 'c5' in 'partition function'
insert into t1(c1,c2,c3,c4) values(3,'{2:3,1:2}','{}','{1:1.3,1:2.6}');
insert into t1(c1,c2,c3,c4) values(4,null,null,null);
select /*+ index(t1 idx1)*/c2 from t1 where c2='{1:1.3,1:2.6,1:2.6}'  order by negative_inner_product(c2,'{1:2,2:20000}')  APPROXIMATE limit 1;
c2
{1:2.6}
select inner_product(c2,c3) from t1 order by c1;
inner_product(c2,c3)
6.7599992752075195
0
0
NULL
select inner_product(c2,c3) from t1 order by c1;
inner_product(c2,c3)
6.7599992752075195
0
0
NULL
drop table if exists t1;
create table t1 (c1 int , c2 sparsevector,c3 sparsevector,c4 sparsevector,c5 int AS (inner_product(c2,c3)) STORED,vector index idx1(c2) with (distance=inner_product), vector index idx2(c3) with (distance=inner_product), vector index idx3(c4) with (distance=inner_product));
insert into t1(c1,c2,c3,c4) values(1,'{1:1.3,1:2.6}','{1:1.3,1:2.6}','{1:1.3,1:2.6}');
insert into t1(c1,c2,c3,c4) values(2,'{}','{1:false}','{1:1.3,1:2.6}');
select * from t1 order by c1;
c1	c2	c3	c4	c5
1	{1:2.6}	{1:2.6}	{1:2.6}	7
2	{}	{1:0}	{1:2.6}	0
alter table t1 partition by hash(c5) partitions 20;
ERROR 0A000: Run this DDL operation on table with sparse vector index not supported
drop table if exists t1;
create table t1 (c1 int primary key, c2 sparsevector,c3 sparsevector,c4 sparsevector);
insert into t1(c1,c2,c3,c4) values(1,'{1:1.3,1:2.6}','{1:1.3,1:2.6}','{1:1.3,1:2.6}');
insert into t1(c1,c2,c3,c4) values(2,'{}','{1:false}','{1:1.3,1:2.6}');
insert into t1(c1,c2,c3,c4) values(3,'{2:3,1:2}','{}','{1:1.3,1:2.6}');
insert into t1(c1,c2,c3,c4) values(4,null,null,null);
ALTER TABLE t1 ADD COLUMN c5 sparsevector AS (map(1,2,3,4,0,1000000000000,1000,'a')) STORED;
ERROR 01000: Truncated incorrect DOUBLE value
ALTER TABLE t1 ADD COLUMN c5 sparsevector AS (map(1,2,3,4,0,1000000000000,1000,100)) STORED;
select * from t1 order by c1;
c1	c2	c3	c4	c5
1	{1:2.6}	{1:2.6}	{1:2.6}	{0:1000000000000,1:2,3:4,1000:100}
2	{}	{1:0}	{1:2.6}	{0:1000000000000,1:2,3:4,1000:100}
3	{1:2,2:3}	{}	{1:2.6}	{0:1000000000000,1:2,3:4,1000:100}
4	NULL	NULL	NULL	{0:1000000000000,1:2,3:4,1000:100}
drop table if exists t1;
create table t1 (c1 int primary key, c2 sparsevector,c3 sparsevector,c4 sparsevector, vector index idx1(c2) with (distance=inner_product));
insert into t1(c1,c2,c3,c4) values(1,'{1:1.3,1:2.6}','{1:1.3,1:2.6}','{1:1.3,1:2.6}');
insert into t1(c1,c2,c3,c4) values(2,'{}','{1:false}','{1:1.3,1:2.6}');
insert into t1(c1,c2,c3,c4) values(3,'{2:3,1:2}','{}','{1:1.3,1:2.6}');
insert into t1(c1,c2,c3,c4) values(4,null,null,null);
select * from t1 order by negative_inner_product(c2,'{1:2,2:20000}')  APPROXIMATE limit 1;
c1	c2	c3	c4
3	{1:2,2:3}	{}	{1:2.6}
select negative_inner_product(c2,cast('{null}' as char(20))) from t1;
ERROR 22032: Invalid JSON text.
select negative_inner_product(c2,cast('{2:3}' as char(20))) from t1 order by c1;
negative_inner_product(c2,cast('{2:3}' as char(20)))
0
0
-9
NULL
drop table if exists t1;
create table t1 (c1 int primary key, c2 sparsevector);
insert into t1(c1,c2) values(1,map(1,2));
drop table if exists t1;
create table t1 (c1 int primary key, c2 sparsevector,c3 sparsevector,c4 sparsevector);
ALTER TABLE t1 ADD COLUMN c5 sparsevector AS ('{0:2,1:1}') STORED;
insert into t1(c1,c2,c3,c4) values(1,'{1:1.3,1:2.6}','{1:1.3,1:2.6}','{1:1.3,1:2.6}');
insert into t1(c1,c2,c3,c4) values(2,'{}','{1:false}','{1:1.3,1:2.6}');
insert into t1(c1,c2,c3,c4) values(3,'{2:3,1:2}','{}','{1:1.3,1:2.6}');
insert into t1(c1,c2,c3,c4) values(4,null,null,null);
select * from t1 order by c1;
c1	c2	c3	c4	c5
1	{1:2.6}	{1:2.6}	{1:2.6}	{0:2,1:1}
2	{}	{1:0}	{1:2.6}	{0:2,1:1}
3	{1:2,2:3}	{}	{1:2.6}	{0:2,1:1}
4	NULL	NULL	NULL	{0:2,1:1}
select inner_product(c2,c3) from t1 order by c1;
inner_product(c2,c3)
6.7599992752075195
0
0
NULL
select inner_product(c2,c3) from t1 order by c1;
inner_product(c2,c3)
6.7599992752075195
0
0
NULL
drop table if exists t1;
create table t1 (c1 int primary key, c2 sparsevector,c3 sparsevector,c4 sparsevector);
insert into t1(c1,c2,c3,c4) values(1,'{1:1.3,1:2.6}','{1:1.3,1:2.6}','{1:1.3,1:2.6}');
insert into t1(c1,c2,c3,c4) values(2,'{}','{1:false}','{1:1.3,1:2.6}');
insert into t1(c1,c2,c3,c4) values(3,'{2:3,1:2}','{}','{1:1.3,1:2.6}');
insert into t1(c1,c2,c3,c4) values(4,null,null,null);
ALTER TABLE t1 ADD COLUMN c5 sparsevector AS (c3) STORED;
select * from t1 order by c1;
c1	c2	c3	c4	c5
1	{1:2.6}	{1:2.6}	{1:2.6}	{1:2.6}
2	{}	{1:0}	{1:2.6}	{1:0}
3	{1:2,2:3}	{}	{1:2.6}	{}
4	NULL	NULL	NULL	NULL
select inner_product(c2,c3) from t1 order by c1;
inner_product(c2,c3)
6.7599992752075195
0
0
NULL
select inner_product(c2,c3) from t1 order by c1;
inner_product(c2,c3)
6.7599992752075195
0
0
NULL
drop table if exists t1;
create table t1 (c1 int primary key, c2 sparsevector,c3 sparsevector,c4 sparsevector);
ALTER TABLE t1 ADD COLUMN c5 json AS ('{}') STORED;
insert into t1(c1,c2,c3,c4) values(1,'{1:1.3,1:2.6}','{1:1.3,1:2.6}','{1:1.3,1:2.6}');
insert into t1(c1,c2,c3,c4) values(2,'{}','{1:false}','{1:1.3,1:2.6}');
insert into t1(c1,c2,c3,c4) values(3,'{2:3,1:2}','{}','{1:1.3,1:2.6}');
insert into t1(c1,c2,c3,c4) values(4,null,null,null);
select * from t1 order by c1;
c1	c2	c3	c4	c5
1	{1:2.6}	{1:2.6}	{1:2.6}	{}
2	{}	{1:0}	{1:2.6}	{}
3	{1:2,2:3}	{}	{1:2.6}	{}
4	NULL	NULL	NULL	{}
select inner_product(c2,c3) from t1 order by c1;
inner_product(c2,c3)
6.7599992752075195
0
0
NULL
select inner_product(c2,c3) from t1 order by c1;
inner_product(c2,c3)
6.7599992752075195
0
0
NULL
drop table if exists t1;
create table t1 (c1 int primary key, c2 sparsevector,c3 sparsevector,c4 sparsevector);
insert into t1(c1,c2,c3,c4) values(1,'{1:1.3,1:2.6}','{1:1.3,1:2.6}','{1:1.3,1:2.6}');
insert into t1(c1,c2,c3,c4) values(2,'{}','{1:false}','{1:1.3,1:2.6}');
insert into t1(c1,c2,c3,c4) values(3,'{2:3,1:2}','{}','{1:1.3,1:2.6}');
insert into t1(c1,c2,c3,c4) values(4,null,null,null);
ALTER TABLE t1 ADD COLUMN c5 json AS ('{c1:1}') STORED;
select * from t1 order by c1;
c1	c2	c3	c4	c5
1	{1:2.6}	{1:2.6}	{1:2.6}	{"c1": 1}
2	{}	{1:0}	{1:2.6}	{"c1": 1}
3	{1:2,2:3}	{}	{1:2.6}	{"c1": 1}
4	NULL	NULL	NULL	{"c1": 1}
select inner_product(c2,c3) from t1 order by c1;
inner_product(c2,c3)
6.7599992752075195
0
0
NULL
select inner_product(c2,c3) from t1 order by c1;
inner_product(c2,c3)
6.7599992752075195
0
0
NULL
drop table if exists t1;
create table t1 (c1 int primary key, c2 sparsevector,c3 sparsevector,c4 sparsevector);
insert into t1(c1,c2,c3,c4) values(1,'{1:1.3,1:2.6}','{1:1.3,1:2.6}','{1:1.3,1:2.6}');
ALTER TABLE t1 MODIFY c2 vector(3)  not NULL;
ERROR HY000: Invalid argument
select * from t1 order by c1;
c1	c2	c3	c4
1	{1:2.6}	{1:2.6}	{1:2.6}
drop table if exists t1;
create table t1 (c1 int primary key, c2 sparsevector,c3 sparsevector,c4 sparsevector);
ALTER TABLE t1 MODIFY c2 vector(3)  not NULL;
insert into t1(c1,c2,c3,c4) values(1,'[1,2,3]','{1:1.3,1:2.6}','{1:1.3,1:2.6}');
insert into t1(c1,c2,c3,c4) values(2,'[1,2,3]','{1:1.3,1:2.6}','{1:1.3,1:2.6}');
replace into t1(c1,c2,c3,c4) values(2,'[1,2,3]','{1:1.3,1:2.6}','{1:1.3,1:2.6}');
select * from t1 order by c1;
c1	c2	c3	c4
1	[1,2,3]	{1:2.6}	{1:2.6}
2	[1,2,3]	{1:2.6}	{1:2.6}
drop table if exists t1;
create table t1 (c1 int primary key, c2 sparsevector,c3 sparsevector,c4 sparsevector,c5 sparsevector as (c4));
alter table t1 drop c5, add c6 varchar(20) default 'a';
drop table if exists t1;
create table t1 (c1 int primary key, c2 sparsevector,c3 sparsevector);
alter table t1 add c5 sparsevector;
insert into t1(c1,c2,c3,c5) values(1,'{1:1.3,1:2.6}','{1:1.3,1:2.6}','{1:1.3,1:2.6}');
select * from t1 for update;
c1	c2	c3	c5
1	{1:2.6}	{1:2.6}	{1:2.6}
drop table if exists t1;
create table t1 (c1 int primary key, c2 sparsevector,c3 sparsevector, vector index idx1(c2) with (distance=inner_product));
drop table if exists t1;
create table t1 (c1 int primary key, c2 sparsevector,c3 sparsevector);
ALTER TABLE t1 DROP COLUMN c2,add c4 sparsevector;
drop table if exists t1;
create table t1 (c1 int primary key, c2 sparsevector,c3 sparsevector, vector index idx1(c2) with (distance=inner_product));
insert into t1(c1,c2,c3) values(1,'{1:1.3,1:2.6}','{1:1.3,1:2.6}');
drop table if exists t1;
create table t1 (c1 int primary key, c2 sparsevector,c3 sparsevector);
CREATE vector INDEX idx1 ON t1 (c3);
ERROR 0A000: build sparse vector index afterward is not supported
drop table if exists t1;
create table t1 (c1 int primary key, c2 sparsevector,c3 sparsevector);
CREATE vector INDEX idx1 ON t1 (c3) with (distance=inner_product);
ERROR 0A000: build sparse vector index afterward is not supported
drop table if exists t1;
create table t1 (c1 int primary key, c2 sparsevector,c3 sparsevector,c4 sparsevector as (c2));
CREATE vector INDEX idx1 ON t1 (c2) with (distance=inner_product);
ERROR 0A000: build sparse vector index afterward is not supported
CREATE vector INDEX idx1 ON t1 (c3) with (distance=inner_product);
ERROR 0A000: build sparse vector index afterward is not supported
CREATE vector INDEX idx1 ON t1 (c4) with (distance=inner_product);
ERROR 0A000: build sparse vector index afterward is not supported
CREATE vector INDEX idx1 ON t1 (c2) with (distance=l2);
ERROR 0A000: build sparse vector index afterward is not supported
CREATE  INDEX idx1 ON t1 (c2);
ERROR 0A000: create index on vector or array column is not supported
drop table if exists t1;
create table t1(id int, c1 tinyint, c2 sparsevector);
insert into t1 values(1, 1, '{1:1.3,1:2.6}');
insert into t1 values(2, 0, '{1:1.3,1:2.6}');
insert into t1 values(3, 0, '{1:1.3,1:2.6}');
alter table t1 add column (c3 int GENERATED ALWAYS AS (inner_product(c2,'{1:2}'))  VIRTUAL);
alter table t1 add column (c4 int GENERATED ALWAYS AS (inner_product(c2,'{1:2}'))  STORED);
desc t1;
Field	Type	Null	Key	Default	Extra
id	int(11)	YES		NULL	
c1	tinyint(4)	YES		NULL	
c2	SPARSEVECTOR	YES		NULL	
c3	int(11)	YES		inner_product(`c2`,'{1:2}')	VIRTUAL GENERATED
c4	int(11)	YES		inner_product(`c2`,'{1:2}')	STORED GENERATED
select * from t1 order by c1;
id	c1	c2	c3	c4
2	0	{1:2.6}	5	5
3	0	{1:2.6}	5	5
1	1	{1:2.6}	5	5
alter table t1 partition by hash(c3) partitions 20;
alter table t1 partition by hash(c4) partitions 20;
drop table if exists t1;
create table t1 (c1 int primary key, c2 sparsevector,c3 sparsevector,c4 sparsevector as (c2), vector index idx1(c2) with (distance=inner_product));
drop table if exists t2;
Warnings:
Note	1051	Unknown table 'obljh.t2'
create table t2 (a1 int primary key, a2 sparsevector,a3 vector(3),a4 sparsevector as (a2), vector index idx1(a3) with (distance=l2, type=ivf_flat));
ALTER TABLE t1 ADD CONSTRAINT fk_c1 FOREIGN KEY (c1) REFERENCES t2(a1);
ALTER TABLE t2 ADD CONSTRAINT fk_c1 FOREIGN KEY (a1) REFERENCES t1(c1);
ERROR 23000: Can't write; duplicate key in table 't2'
insert into t2(a1,a2,a3) values(1,'{1:1.3,1:2.6}',[1.5,1.3,5.5]);
insert into t2(a1,a2,a3) values(2,'{}',[2,3,4]);
insert into t2(a1,a2,a3) values(3,'{1:1.3,1:2.6}',[1,2,3]);
insert into t2(a1,a2,a3) values(4,null,null);
insert into t1(c1,c2,c3) values(1,'{1:1.3,1:2.6}','{1:1.3,1:2.6}');
insert into t1(c1,c2,c3) values(2,'{1:1.3,1:2.6}','{1:1.3,1:2.6}');
insert into t1(c1,c2,c3) values(3,'{}','{1:1.3,1:2.6}');
insert into t1(c1,c2,c3) values(4,null,null);
update t1 set c2=(select '{1:1}') where c2='{1:1.3,1:2.6}';
select * from t1,t2 where c2=a2 ;
c1	c2	c3	c4	a1	a2	a3	a4
3	{}	{1:2.6}	{}	2	{}	[2,3,4]	{}
select * from t1,t2 where c2 ='{}' and a4 ='{}' order by l2_distance(a3, [0.712338,0.603321,0.133444]) approximate limit 100;
c1	c2	c3	c4	a1	a2	a3	a4
3	{}	{1:2.6}	{}	2	{}	[2,3,4]	{}
########清空回收站，删除测试数据库，表等 ##########
drop database  IF EXISTS  obljh;
purge recyclebin;
