purge recyclebin;
drop database IF EXISTS obljh;
create database obljh ;
use obljh;
set timestamp = 1600000000;
set ob_trx_timeout = 10000000000;
set ob_query_timeout = 10000000000;
alter system set ob_vector_memory_limit_percentage =44;
drop table if exists t2;
create table t2 (a1 int primary key, a2 sparsevector not null,a3 varchar(30),a4 sparsevector,VECTOR INDEX vector_idx(a2) WITH (distance=inner_product));
insert into t2(a1,a2,a3,a4) values(1,'{1:1.3,1:2.6}','{1:1.3,1:2.6}','{1:1.3,1:2.6}');
insert into t2(a1,a2,a3,a4) values(2,'{1:1.3,1:2.6}','{1:1.3,1:2.6}',map(1,1));
ALTER TABLE t2 add a6 sparsevector  ;
ALTER TABLE t2 add a7 int not null;
ALTER TABLE t2 add a8 vector(16000) ;
insert into t2(a1,a2,a3,a4,a7) values(3,'{1:1.3,1:2.6}','{1:1.3,1:2.6}','{1:1.3,1:2.6}',10);
insert into t2(a1,a2) values(4,'{1:1.3,1:2.6}');
ERROR HY000: Field 'a7' doesn't have a default value
select * from t2 order by a1;
a1	a2	a3	a4	a6	a7	a8
1	{1:2.6}	{1:1.3,1:2.6}	{1:2.6}	NULL	0	NULL
2	{1:2.6}	{1:1.3,1:2.6}	{1:1}	NULL	0	NULL
3	{1:2.6}	{1:1.3,1:2.6}	{1:2.6}	NULL	10	NULL
drop table if exists t2;
create table t2 (a1 int primary key, a2 sparsevector not null ,a3 varchar(30),a4 sparsevector,VECTOR INDEX vector_idx(a2) WITH (distance=inner_product));
ALTER TABLE t2 add a6 sparsevector  ;
ALTER TABLE t2 add a7 int not null;
ALTER TABLE t2 add a8 vector(16000) ;
insert into t2(a1,a2,a3,a4,a7) values(3,'{1:1.3,1:2.6}','{1:1.3,1:2.6}','{1:1.3,1:2.6}',10);
select * from t2 order by a1;
a1	a2	a3	a4	a6	a7	a8
3	{1:2.6}	{1:1.3,1:2.6}	{1:2.6}	NULL	10	NULL
create vector index idx1 on t2(a8) with (distance=l2, type=hnsw);
ERROR 0A000: vec index dim larger than 4096 is not supported
drop table if exists t2;
create table t2 (a1 int primary key, a2 sparsevector not null,a3 varchar(30),a4 sparsevector,VECTOR INDEX vector_idx(a2) WITH (distance=inner_product));
insert into t2(a1,a2,a3,a4) values(1,'{1:1.3,1:2.6}','{1:1.3,1:2.6}','{1:1.3,1:2.6}');
insert into t2(a1,a2,a3,a4) values(2,'{1:1.3,1:2.6}','{1:1.3,1:2.6}',map(1,1));
ALTER TABLE t2 ADD COLUMN a5 VARCHAR(255) AS (CONCAT(a3, ' ', a3)) VIRTUAL;
insert into t2(a1,a2,a3,a4) values(3,'{1:1.3,1:2.6}','{1:1.3,1:2.6}','{1:1.3,1:2.6}');
insert into t2(a1,a2) values(4,'{1:1.3,1:2.6}');
select * from t2 order by a1;
a1	a2	a3	a4	a5
1	{1:2.6}	{1:1.3,1:2.6}	{1:2.6}	{1:1.3,1:2.6} {1:1.3,1:2.6}
2	{1:2.6}	{1:1.3,1:2.6}	{1:1}	{1:1.3,1:2.6} {1:1.3,1:2.6}
3	{1:2.6}	{1:1.3,1:2.6}	{1:2.6}	{1:1.3,1:2.6} {1:1.3,1:2.6}
4	{1:2.6}	NULL	NULL	NULL
drop table if exists t2;
create table t2 (a1 int primary key, a2 sparsevector not null ,a3 varchar(30),a4 sparsevector,VECTOR INDEX vector_idx(a2) WITH (distance=inner_product));
ALTER TABLE t2 add a6 sparsevector  as (map(2,3)) ;
ALTER TABLE t2 add a7 int  as(negative_inner_product(a4,a2)) not null ;
insert into t2(a1,a2,a3,a4) values(3,'{1:1.3,1:2.6}','{1:1.3,1:2.6}','{1:1.3,1:2.6}');
select * from t2 order by a1;
a1	a2	a3	a4	a6	a7
3	{1:2.6}	{1:1.3,1:2.6}	{1:2.6}	{2:3}	-7
drop table if exists t2;
create table t2 (a1 int primary key, a2 sparsevector not null,a3 varchar(30),a4 sparsevector,a5 int as (negative_inner_product(a4,a2)),VECTOR INDEX vector_idx(a2) WITH (distance=inner_product));
insert into t2(a1,a2,a3,a4) values(1,'{1:1.3,1:2.6}','{1:1.3,1:2.6}','{1:1.3,1:2.6}');
insert into t2(a1,a2,a3,a4) values(2,'{1:1.3,1:2.6}','{1:1.3,1:2.6}',map(1,1));
ALTER TABLE t2 DROP COLUMN a5;
insert into t2(a1,a2,a3,a4) values(3,'{1:1.3,1:2.6}','{1:1.3,1:2.6}','{1:1.3,1:2.6}');
drop table if exists t2;
create table t2 (a1 int primary key, a2 sparsevector not null,a3 varchar(30),a4 sparsevector,a5 int as (negative_inner_product(a4,a2)),VECTOR INDEX vector_idx(a2) WITH (distance=inner_product));
ALTER TABLE t2 DROP a5  ;
ALTER TABLE t2 DROP a2  ;
Got one of the listed errors
insert into t2(a1,a2,a3,a4) values(3,'{1:1.3,1:2.6}','{1:1.3,1:2.6}','{1:1.3,1:2.6}');
select * from t2 order by a1;
a1	a2	a3	a4
3	{1:2.6}	{1:1.3,1:2.6}	{1:2.6}
drop table if exists t2;
create table t2 (a1 int primary key, a2 sparsevector not null,a3 varchar(30),a4 sparsevector,a5 int as (negative_inner_product(a4,a2)),VECTOR INDEX vector_idx(a2) WITH (distance=inner_product));
ALTER TABLE t2 MODIFY a3 sparsevector NOT NULL;
Got one of the listed errors
ALTER TABLE t2 MODIFY a3 vector(3) NOT NULL;
Got one of the listed errors
ALTER TABLE t2 MODIFY a2 vector(3) NOT NULL;
ERROR 22004: Invalid use of NULL value
ALTER TABLE t2 MODIFY a2 sparsevector NOT NULL;
ERROR 22004: Invalid use of NULL value
ALTER TABLE t2 MODIFY a2 int NOT NULL;
Got one of the listed errors
insert into t2(a1,a2,a3,a4) values(3,'{1:1.3,1:2.6}','{1:1.3,1:2.6}','{1:1.3,1:2.6}');
drop table if exists t2;
create table t2 (a1 int primary key, a2 sparsevector not null,a3 varchar(30),a4 sparsevector,a5 int as (negative_inner_product(a4,a2)),VECTOR INDEX vector_idx(a2) WITH (distance=inner_product));
ALTER TABLE t2 MODIFY a3 sparsevector  NULL;
Got one of the listed errors
ALTER TABLE t2 MODIFY a3 vector(3)  NULL;
Got one of the listed errors
ALTER TABLE t2 MODIFY a2 vector(3)  NULL;
Got one of the listed errors
ALTER TABLE t2 MODIFY a2 sparsevector  NULL;
ALTER TABLE t2 MODIFY a2 int  NULL;
Got one of the listed errors
insert into t2(a1,a2,a3,a4) values(3,'{1:1.3,1:2.6}','{1:1.3,1:2.6}','{1:1.3,1:2.6}');
drop table if exists t2;
create table t2 (a1 int primary key, a2 sparsevector not null,a3 varchar(30),a4 sparsevector,a5 int as (negative_inner_product(a4,a2)),VECTOR INDEX vector_idx(a2) WITH (distance=inner_product));
ALTER TABLE t2 ALTER a2 SET DEFAULT '{}';
ERROR 42000: BLOB, TEXT, GEOMETRY or JSON column 'a2' can't have a default value
ALTER TABLE t2 ALTER a1 SET DEFAULT 0;
ALTER TABLE t2 ALTER a3 SET DEFAULT '{}';
ALTER TABLE t2 ALTER a4 SET DEFAULT '{}';
ERROR 42000: BLOB, TEXT, GEOMETRY or JSON column 'a4' can't have a default value
ALTER TABLE t2 ALTER a5 SET DEFAULT 0;
ERROR HY000: 'Changing the STORED status' is not supported for generated columns.
insert into t2(a1,a2,a3,a4) values(3,'{1:1.3,1:2.6}','{1:1.3,1:2.6}','{1:1.3,1:2.6}');
drop table if exists t2;
create table t2 (a1 int primary key, a2 sparsevector not null,a3 varchar(30) DEFAULT '{}',a4 sparsevector,a5 int as (negative_inner_product(a4,a2)),VECTOR INDEX vector_idx(a2) WITH (distance=inner_product));
ALTER TABLE t2 ALTER a2 DROP DEFAULT;
ALTER TABLE t2 ALTER a1 DROP DEFAULT;
ALTER TABLE t2 ALTER a3 DROP DEFAULT;
ALTER TABLE t2 ALTER a4 DROP DEFAULT;
ALTER TABLE t2 ALTER a5 DROP DEFAULT;
ERROR HY000: 'Changing the STORED status' is not supported for generated columns.
insert into t2(a1,a2,a3,a4) values(3,'{1:1.3,1:2.6}','{1:1.3,1:2.6}','{1:1.3,1:2.6}');
drop table if exists t2;
create table t2 (a1 int primary key AUTO_INCREMENT , a2 sparsevector not null,a3 varchar(30) DEFAULT '{}',a4 sparsevector,a5 int as (negative_inner_product(a4,a2)),VECTOR INDEX vector_idx(a2) WITH (distance=inner_product));
ALTER TABLE t2 AUTO_INCREMENT = 1000;
ALTER TABLE t2 AUTO_INCREMENT = 1000;
insert into t2(a1,a2,a3,a4) values(3,'{1:1.3,1:2.6}','{1:1.3,1:2.6}','{1:1.3,1:2.6}');
drop table if exists t2;
create table t2 (a1 int primary key AUTO_INCREMENT , a2 sparsevector not null,a3 varchar(30) DEFAULT '{}',a4 sparsevector,a5 int as (negative_inner_product(a4,a2)),VECTOR INDEX vector_idx(a2) WITH (distance=inner_product));
ALTER TABLE t2 CHANGE COLUMN a2 c2 DATE;
Got one of the listed errors
ALTER TABLE t2 CHANGE COLUMN a2 c2 sparsevector;
insert into t2(a1,c2,a3,a4) values(3,'{1:1.3,1:2.6}','{1:1.3,1:2.6}','{1:1.3,1:2.6}');
ALTER TABLE t2 CHANGE COLUMN c2 中文ings123 sparsevector;
insert into t2(a1,中文ings123,a3,a4) values(4,'{1:1.3,1:2.6}','{1:1.3,1:2.6}','{1:1.3,1:2.6}');
drop table if exists t2;
create table t2 (a1 int primary key AUTO_INCREMENT , a2 sparsevector not null,a3 varchar(30) DEFAULT '{}',a4 sparsevector,a5 int as (negative_inner_product(a4,a2)),VECTOR INDEX vector_idx(a2) WITH (distance=inner_product));
ALTER TABLE t2 MODIFY a3 varchar(300);
ALTER TABLE t2 MODIFY a3 varchar(30);
Got one of the listed errors
ALTER TABLE t2 MODIFY a3 varchar(3000);
ALTER TABLE t2 MODIFY a1 int(64);
ALTER TABLE t2 MODIFY a1 int(10);
insert into t2(a1,a2,a3,a4) values(3,'{1:1.3,1:2.6}','{1:1.3,1:2.6}','{1:1.3,1:2.6}');
drop table if exists t2;
create table t2 (a1 int primary key AUTO_INCREMENT , a2 sparsevector not null,a3 varchar(30) DEFAULT '{}',a4 sparsevector,a5 int as (negative_inner_product(a4,a2)),VECTOR INDEX vector_idx(a2) WITH (distance=inner_product));
ALTER TABLE t2 MODIFY COLUMN a2 sparsevector null,ADD a8 int as (negative_inner_product(a4,a2)), DROP COLUMN a3;
Got one of the listed errors
ALTER TABLE t2 MODIFY COLUMN a2 sparsevector,ADD a8 int as (negative_inner_product(a4,a2)), DROP COLUMN a3;
Got one of the listed errors
ALTER TABLE t2 MODIFY COLUMN a3 int,ADD a8 int , DROP COLUMN a3;
Got one of the listed errors
drop table if exists t2;
create table t2 (a1 int primary key AUTO_INCREMENT , a2 sparsevector not null,a3 varchar(30) DEFAULT '{}',a4 sparsevector,a5 int as (negative_inner_product(a4,a2)),VECTOR INDEX vector_idx(a2) WITH (distance=inner_product));
CREATE INDEX a5_index ON t2 (a5) global;
CREATE INDEX a4_index ON t2 (a4) global;
ERROR 0A000: create index on vector or array column is not supported
CREATE VECTOR INDEX vector_idx  ON t2 (a2)  WITH (distance=l2, lib=vsag, type=hnsw, m=10, ef_construction=100, ef_search=40);
ERROR 0A000: build sparse vector index afterward is not supported
CREATE INDEX a3_index ON t2 (a3) global;
CREATE INDEX a1_index ON t2 (a1) global;
CREATE FULLTEXT INDEX idx_fulltext_name ON t2 (a3);
CREATE INDEX idx_department_salary ON t2 (a5,a3,a1);
insert into t2(a1,a2,a3,a4) values(3,'{1:1.3,1:2.6}','{1:1.3,1:2.6}','{1:1.3,1:2.6}');
select a1,a2,a3,a4 from t2 where a5<1 order by negative_inner_product(a2,'{1:2}')  APPROXIMATE limit 100;
a1	a2	a3	a4
3	{1:2.6}	{1:1.3,1:2.6}	{1:2.6}
drop table if exists t2;
create table t2 (a1 int primary key AUTO_INCREMENT , a2 sparsevector not null,a3 varchar(30) DEFAULT '{}',a4 sparsevector,a5 int as (negative_inner_product(a4,a2)), fulltext index ft_idx(a3),VECTOR INDEX vector_idx(a2) WITH (distance=inner_product));
insert into t2(a1,a2,a3,a4) values(3,'{1:1.3,1:2.6}','{1:1.3,1:2.6}','{1:1.3,1:2.6}');
DROP INDEX ft_idx ON t2;
DROP INDEX vector_idx ON t2;
CREATE fulltext INDEX ft_idx ON t2 (a3);
drop table if exists t2;
create table t2 (a1 int primary key AUTO_INCREMENT , a2 sparsevector not null,a3 varchar(30) DEFAULT '{}',a4 sparsevector,a5 int as (negative_inner_product(a4,a2)), fulltext index ft_idx(a3),VECTOR INDEX vector_idx(a2) WITH (distance=inner_product));
insert into t2(a1,a2,a3,a4) values(3,'{1:1.3,1:2.6}','{1:1.3,1:2.6}','{1:1.3,1:2.6}');
ALTER TABLE t2  ADD INDEX index1 (a3), DROP INDEX ft_idx;
ERROR HY000: Dropping and adding indexes at the same time is a high-risk operation, which is not supported
ALTER TABLE t2  ADD INDEX index1 (a3), DROP INDEX vector_idx;
ERROR HY000: Dropping and adding indexes at the same time is a high-risk operation, which is not supported
ALTER TABLE t2  ADD INDEX index1 (a3), add INDEX idx(a3);
ALTER TABLE t2  drop INDEX index1, drop INDEX idx,drop INDEX vector_idx,drop primary key;
ERROR 0A000: Multiple complex DDLs about primary in single stmt not supported
ALTER TABLE t2  drop primary key;
Got one of the listed errors
ALTER TABLE t2  drop INDEX index1, drop INDEX idx,drop INDEX vector_idx;
drop table if exists t1;
create table t1 (c1 int  AUTO_INCREMENT , c2 sparsevector not null,c3 varchar(30) DEFAULT '{}' primary key,c4 sparsevector,a5 int as (negative_inner_product(c2,c4)), fulltext index ft_idx(c3),VECTOR INDEX vector_idx(c2) WITH (distance=inner_product),VECTOR INDEX vector_idx2(c4) WITH (distance=inner_product));
insert into t1(c1,c2,c3,c4) values(3,'{1:1.3,1:2.6}','{1:1.3,1:2.6}','{1:1.3,1:2.6}');
insert into t1(c1,c2,c3,c4) values(4,'{1:1.3,3:2.6}','{1:1.3,2:2.6}','{1:1.3,1:2.6}');
insert into t1(c1,c2,c3,c4) values(5,'{1:1.3,5:2.6}','{1:1.3,3:2.6}',null);
drop table if exists t2;
create table t2 (a1 int  AUTO_INCREMENT , a2 sparsevector not null,a3 varchar(30) DEFAULT '{}' primary key,a4 sparsevector,a5 int as (negative_inner_product(a4,a2)), fulltext index ft_idx(a3),VECTOR INDEX vector_idx(a2) WITH (distance=inner_product),VECTOR INDEX vector_idx2(a4) WITH (distance=inner_product));
insert into t2(a1,a2,a3,a4) values(3,'{1:1.3,1:2.6}','{1:1.3,1:2.6}','{1:1.3,1:2.6}');
insert into t2(a1,a2,a3,a4) values(4,'{1:1.3,6:2.6}','{1:1.3,2:2.6}','{1:1.3,1:2.6}');
insert into t2(a1,a2,a3,a4) values(5,'{1:1.3,7:2.6}','{1:1.3,3:2.6}',null);
ALTER TABLE t1 ADD CONSTRAINT fk_c1 FOREIGN KEY (c2) REFERENCES t2(a2);
ERROR HY000: Cannot add foreign key constraint
ALTER TABLE t1 ADD CONSTRAINT fk_c1 FOREIGN KEY (c3) REFERENCES t2(a3);
select /*+ index(t1 vector_idx)*/* from t1 where  c3 ='{1:1.3,1:2.6}' order by negative_inner_product(c2, '{0:1.3,1:2.6}') approximate  limit 10;
c1	c2	c3	c4	a5
3	{1:2.6}	{1:1.3,1:2.6}	{1:2.6}	-7
select /*+ index(t1 vector_idx)*/* from t1,t2  where  c3 = a3 order by negative_inner_product(c2, '{0:1.3,1:2.6}') approximate  limit 10;
c1	c2	c3	c4	a5	a1	a2	a3	a4	a5
3	{1:2.6}	{1:1.3,1:2.6}	{1:2.6}	-7	3	{1:2.6}	{1:1.3,1:2.6}	{1:2.6}	-7
4	{1:1.3,3:2.6}	{1:1.3,2:2.6}	{1:2.6}	-3	4	{1:1.3,6:2.6}	{1:1.3,2:2.6}	{1:2.6}	-3
select /*+ index(t1 vector_idx)*/* from t1,t2  where  c3 <> a3 order by negative_inner_product(c2, '{0:1.3,1:2.6}') approximate  limit 10;
c1	c2	c3	c4	a5	a1	a2	a3	a4	a5
3	{1:2.6}	{1:1.3,1:2.6}	{1:2.6}	-7	4	{1:1.3,6:2.6}	{1:1.3,2:2.6}	{1:2.6}	-3
3	{1:2.6}	{1:1.3,1:2.6}	{1:2.6}	-7	5	{1:1.3,7:2.6}	{1:1.3,3:2.6}	NULL	NULL
4	{1:1.3,3:2.6}	{1:1.3,2:2.6}	{1:2.6}	-3	3	{1:2.6}	{1:1.3,1:2.6}	{1:2.6}	-7
4	{1:1.3,3:2.6}	{1:1.3,2:2.6}	{1:2.6}	-3	5	{1:1.3,7:2.6}	{1:1.3,3:2.6}	NULL	NULL
select /*+ index(t1 vector_idx)*/* from t1,t2  where  c2 = a2 order by negative_inner_product(c2, '{0:1.3,1:2.6}') approximate  limit 10;
c1	c2	c3	c4	a5	a1	a2	a3	a4	a5
3	{1:2.6}	{1:1.3,1:2.6}	{1:2.6}	-7	3	{1:2.6}	{1:1.3,1:2.6}	{1:2.6}	-7
select /*+ index(t1 vector_idx)*/* from t1,t2  where  c3 <> a3 order by negative_inner_product(c2, '{0:1.3,1:2.6}') approximate  limit 10;
c1	c2	c3	c4	a5	a1	a2	a3	a4	a5
3	{1:2.6}	{1:1.3,1:2.6}	{1:2.6}	-7	4	{1:1.3,6:2.6}	{1:1.3,2:2.6}	{1:2.6}	-3
3	{1:2.6}	{1:1.3,1:2.6}	{1:2.6}	-7	5	{1:1.3,7:2.6}	{1:1.3,3:2.6}	NULL	NULL
4	{1:1.3,3:2.6}	{1:1.3,2:2.6}	{1:2.6}	-3	3	{1:2.6}	{1:1.3,1:2.6}	{1:2.6}	-7
4	{1:1.3,3:2.6}	{1:1.3,2:2.6}	{1:2.6}	-3	5	{1:1.3,7:2.6}	{1:1.3,3:2.6}	NULL	NULL
ALTER TABLE t1 ADD CONSTRAINT chk_c2_c4 CHECK (c2=c4);
ERROR HY000: check constraint violated
ALTER TABLE t1 ADD CONSTRAINT chk_c2_c4 CHECK (c2=map(1,2,3,4));
ERROR HY000: check constraint violated
ALTER TABLE t1 ADD CONSTRAINT chk_a5 CHECK (a5 is true);
ERROR HY000: check constraint violated
ALTER TABLE t1 ADD CONSTRAINT chk_a5 CHECK (a5 is null or not null);
select /*+ index(t1 vector_idx)*/* from t1 where  a5 > 1 order by negative_inner_product(c2, '{0:1.3,1:2.6}') approximate  limit 10;
c1	c2	c3	c4	a5
select /*+ index(t1 vector_idx)*/* from t1 where  a5 < 1 order by negative_inner_product(c2, '{0:1.3,1:2.6}') approximate  limit 10;
c1	c2	c3	c4	a5
3	{1:2.6}	{1:1.3,1:2.6}	{1:2.6}	-7
4	{1:1.3,3:2.6}	{1:1.3,2:2.6}	{1:2.6}	-3
select /*+ index(t1 vector_idx)*/* from t1,t2  where  c3 = a3 order by negative_inner_product(c2, '{0:1.3,1:2.6}') approximate  limit 10;
c1	c2	c3	c4	a5	a1	a2	a3	a4	a5
3	{1:2.6}	{1:1.3,1:2.6}	{1:2.6}	-7	3	{1:2.6}	{1:1.3,1:2.6}	{1:2.6}	-7
4	{1:1.3,3:2.6}	{1:1.3,2:2.6}	{1:2.6}	-3	4	{1:1.3,6:2.6}	{1:1.3,2:2.6}	{1:2.6}	-3
select /*+ index(t1 vector_idx)*/* from t1,t2  where  c3 <> a3 order by negative_inner_product(c2, '{0:1.3,1:2.6}') approximate  limit 10;
c1	c2	c3	c4	a5	a1	a2	a3	a4	a5
3	{1:2.6}	{1:1.3,1:2.6}	{1:2.6}	-7	4	{1:1.3,6:2.6}	{1:1.3,2:2.6}	{1:2.6}	-3
3	{1:2.6}	{1:1.3,1:2.6}	{1:2.6}	-7	5	{1:1.3,7:2.6}	{1:1.3,3:2.6}	NULL	NULL
4	{1:1.3,3:2.6}	{1:1.3,2:2.6}	{1:2.6}	-3	3	{1:2.6}	{1:1.3,1:2.6}	{1:2.6}	-7
4	{1:1.3,3:2.6}	{1:1.3,2:2.6}	{1:2.6}	-3	5	{1:1.3,7:2.6}	{1:1.3,3:2.6}	NULL	NULL
select /*+ index(t1 vector_idx)*/* from t1,t2  where  c2 = a2 order by negative_inner_product(c2, '{0:1.3,1:2.6}') approximate  limit 10;
c1	c2	c3	c4	a5	a1	a2	a3	a4	a5
3	{1:2.6}	{1:1.3,1:2.6}	{1:2.6}	-7	3	{1:2.6}	{1:1.3,1:2.6}	{1:2.6}	-7
select /*+ index(t1 vector_idx)*/* from t1,t2  where  c3 <> a3 order by negative_inner_product(c2, '{0:1.3,1:2.6}') approximate  limit 10;
c1	c2	c3	c4	a5	a1	a2	a3	a4	a5
3	{1:2.6}	{1:1.3,1:2.6}	{1:2.6}	-7	4	{1:1.3,6:2.6}	{1:1.3,2:2.6}	{1:2.6}	-3
3	{1:2.6}	{1:1.3,1:2.6}	{1:2.6}	-7	5	{1:1.3,7:2.6}	{1:1.3,3:2.6}	NULL	NULL
4	{1:1.3,3:2.6}	{1:1.3,2:2.6}	{1:2.6}	-3	3	{1:2.6}	{1:1.3,1:2.6}	{1:2.6}	-7
4	{1:1.3,3:2.6}	{1:1.3,2:2.6}	{1:2.6}	-3	5	{1:1.3,7:2.6}	{1:1.3,3:2.6}	NULL	NULL
insert into t2(a1,a2,a3,a4) values(5,'{1:1.3,7:2.6}','{1:1.3,6:2.6}',null);
update t1 set a5 =1 where c1=5;
ERROR HY000: The value specified for generated column 'a5' in table 't1' is not allowed
update t1 set c2 ='{1:1.3,10:2.6}' where c1=5;
select /*+ index(t1 vector_idx)*/* from t1 where  a5 < 1 order by negative_inner_product(c2, '{0:1.3,1:2.6}') approximate  limit 10;
c1	c2	c3	c4	a5
3	{1:2.6}	{1:1.3,1:2.6}	{1:2.6}	-7
4	{1:1.3,3:2.6}	{1:1.3,2:2.6}	{1:2.6}	-3
ALTER TABLE t1 MODIFY c4 sparsevector NOT NULL;
ERROR 22004: Invalid use of NULL value
ALTER TABLE t1 MODIFY c3 varchar(30) NOT NULL;
ALTER TABLE t1 MODIFY a5 int NOT NULL;
ERROR HY000: 'Changing the STORED status' is not supported for generated columns.
ALTER TABLE t1 MODIFY c1 int NOT NULL;
insert into t2(a1,a2,a3,a4) values(3,'{1:1.3,1:2.6}','{1:1.3,9:2.6}','{1:1.3,1:2.6}');
insert into t2(a1,a2,a3,a4) values(4,'{1:1.3,6:2.6}','{1:1.3,10:2.6}','{1:1.3,1:2.6}');
insert into t2(a1,a2,a3,a4) values(5,'{1:1.3,7:2.6}','{1:1.3,11:2.6}',null);
select /*+ index(t1 vector_idx)*/* from t1 where  a5 > 1 order by negative_inner_product(c2, '{0:1.3,1:2.6}') approximate  limit 10;
c1	c2	c3	c4	a5
ALTER TABLE t1 DROP FOREIGN KEY fk_c1;
ALTER TABLE t1 DROP CONSTRAINT chk_a5;
ALTER TABLE t1 MODIFY c1 int NULL;
show create table t1;
Table	Create Table
t1	CREATE TABLE `t1` (
  `c1` int(11) DEFAULT NULL,
  `c2` SPARSEVECTOR NOT NULL,
  `c3` varchar(30) NOT NULL,
  `c4` SPARSEVECTOR DEFAULT NULL,
  `a5` int(11) GENERATED ALWAYS AS (negative_inner_product(`c2`,`c4`)) VIRTUAL,
  PRIMARY KEY (`c3`),
  FULLTEXT KEY `ft_idx` (`c3`) WITH PARSER space PARSER_PROPERTIES=(min_token_size=3,max_token_size=84) BLOCK_SIZE 16384,
  VECTOR KEY `vector_idx` (`c2`,  WITH (DISTANCE=INNER_PRODUCT) BLOCK_SIZE 16384,
  VECTOR KEY `vector_idx2` (`c4`,  WITH (DISTANCE=INNER_PRODUCT) BLOCK_SIZE 16384
) ORGANIZATION INDEX DEFAULT CHARSET = utf8mb4 ROW_FORMAT = DYNAMIC COMPRESSION = 'zstd_1.3.8' REPLICA_NUM = 1 BLOCK_SIZE = 16384 USE_BLOOM_FILTER = FALSE ENABLE_MACRO_BLOCK_BLOOM_FILTER = FALSE TABLET_SIZE = 134217728 PCTFREE = 0
drop table if exists t1;
create table t1 (c1 int  AUTO_INCREMENT , c2 sparsevector not null,c3 varchar(30) DEFAULT '{}' primary key,c4 sparsevector,a5 int as (negative_inner_product(c2,c4)), fulltext index ft_idx(c3),VECTOR INDEX vector_idx(c2) WITH (distance=inner_product),VECTOR INDEX vector_idx2(c4) WITH (distance=inner_product));
insert into t1(c1,c2,c3,c4) values(3,'{1:1.3,1:2.6}','{1:1.3,1:2.6}','{1:1.3,1:2.6}');
insert into t1(c1,c2,c3,c4) values(4,'{1:1.3,3:2.6}','{1:1.3,2:2.6}','{1:1.3,1:2.6}');
insert into t1(c1,c2,c3,c4) values(5,'{1:1.3,5:2.6}','{1:1.3,3:2.6}',null);
RENAME TABLE t1 TO t11;
RENAME TABLE t11 TO t1;
RENAME TABLE t1 TO t111111111111111111111111111111111111111111111;
select /*+ index(t111111111111111111111111111111111111111111111 vector_idx)*/* from t111111111111111111111111111111111111111111111 where  a5 < 1 order by negative_inner_product(c2, '{0:1.3,1:2.6,0:false}') approximate  limit 10;
c1	c2	c3	c4	a5
3	{1:2.6}	{1:1.3,1:2.6}	{1:2.6}	-7
4	{1:1.3,3:2.6}	{1:1.3,2:2.6}	{1:2.6}	-3
RENAME TABLE t111111111111111111111111111111111111111111111 TO 中文ing123;
select /*+ index(中文ing123 vector_idx)*/* from 中文ing123 where  a5 < 1 order by negative_inner_product(c2, '{0:1.3,1:2.6,0:false}') approximate  limit 10;
c1	c2	c3	c4	a5
3	{1:2.6}	{1:1.3,1:2.6}	{1:2.6}	-7
4	{1:1.3,3:2.6}	{1:1.3,2:2.6}	{1:2.6}	-3
ALTER TABLE 中文ing123 ROW_FORMAT = DYNAMIC;
ALTER TABLE 中文ing123 ROW_FORMAT = COMPACT;
RENAME TABLE 中文ing123 TO t1;
ALTER TABLE t1 ROW_FORMAT = REDUNDANT;
ALTER TABLE t1 ROW_FORMAT = COMPRESSED;
select /*+ index(中文ing123 vector_idx)*/* from t1 where  a5 < 1 order by negative_inner_product(c2, '{0:1.3,1:2.6,0:false}') approximate  limit 10;
c1	c2	c3	c4	a5
3	{1:2.6}	{1:1.3,1:2.6}	{1:2.6}	-7
4	{1:1.3,3:2.6}	{1:1.3,2:2.6}	{1:2.6}	-3
drop table if exists t1;
create table t1 (c1 int  AUTO_INCREMENT , c2 sparsevector not null,c3 varchar(30) DEFAULT '{}' primary key,c4 sparsevector,a5 int as (negative_inner_product(c2,c4)), fulltext index ft_idx(c3),VECTOR INDEX vector_idx(c2) WITH (distance=inner_product),VECTOR INDEX vector_idx2(c4) WITH (distance=inner_product));
insert into t1(c1,c2,c3,c4) values(3,'{1:1.3,1:2.6}','{1:1.3,1:2.6}','{1:1.3,1:2.6}');
ALTER TABLE t1 COMPRESSION = 'NONE' ;
insert into t1(c1,c2,c3,c4) values(4,'{1:1.3,3:2.6}','{1:1.3,2:2.6}','{1:1.3,1:2.6}');
insert into t1(c1,c2,c3,c4) values(5,'{1:1.3,5:2.6}','{1:1.3,3:2.6}',null);
select /*+ index(t1 vector_idx)*/* from t1 where  a5 < 1 order by negative_inner_product(c2, '{0:1.3,1:2.6,0:false}') approximate  limit 10;
c1	c2	c3	c4	a5
3	{1:2.6}	{1:1.3,1:2.6}	{1:2.6}	-7
4	{1:1.3,3:2.6}	{1:1.3,2:2.6}	{1:2.6}	-3
drop table if exists t1;
create table t1 (c1 int  AUTO_INCREMENT , c2 sparsevector not null,c3 varchar(30) DEFAULT '{}' primary key,c4 sparsevector,a5 int as (negative_inner_product(c2,c4)), fulltext index ft_idx(c3),VECTOR INDEX vector_idx(c2) WITH (distance=inner_product),VECTOR INDEX vector_idx2(c4) WITH (distance=inner_product));
insert into t1(c1,c2,c3,c4) values(3,'{1:1.3,1:2.6}','{1:1.3,1:2.6}','{1:1.3,1:2.6}');
ALTER TABLE t1 COMPRESSION = 'ZLIB' ;
ERROR HY000: Incorrect arguments to ZLIB
insert into t1(c1,c2,c3,c4) values(4,'{1:1.3,3:2.6}','{1:1.3,2:2.6}','{1:1.3,1:2.6}');
insert into t1(c1,c2,c3,c4) values(5,'{1:1.3,5:2.6}','{1:1.3,3:2.6}',null);
select /*+ index(t1 vector_idx)*/* from t1 where  a5 < 1 order by negative_inner_product(c2, '{0:1.3,1:2.6,0:false}') approximate  limit 10;
c1	c2	c3	c4	a5
3	{1:2.6}	{1:1.3,1:2.6}	{1:2.6}	-7
4	{1:1.3,3:2.6}	{1:1.3,2:2.6}	{1:2.6}	-3
drop table if exists t1;
create table t1 (c1 int  AUTO_INCREMENT , c2 sparsevector not null,c3 varchar(30) DEFAULT '{}' primary key,c4 sparsevector,a5 int as (negative_inner_product(c2,c4)), fulltext index ft_idx(c3),VECTOR INDEX vector_idx(c2) WITH (distance=inner_product),VECTOR INDEX vector_idx2(c4) WITH (distance=inner_product));
insert into t1(c1,c2,c3,c4) values(3,'{1:1.3,1:2.6}','{1:1.3,1:2.6}','{1:1.3,1:2.6}');
ALTER TABLE t1 COMPRESSION = 'LZ4' ;
ERROR HY000: Incorrect arguments to LZ4
insert into t1(c1,c2,c3,c4) values(4,'{1:1.3,3:2.6}','{1:1.3,2:2.6}','{1:1.3,1:2.6}');
insert into t1(c1,c2,c3,c4) values(5,'{1:1.3,5:2.6}','{1:1.3,3:2.6}',null);
select /*+ index(t1 vector_idx)*/* from t1 where  a5 < 1 order by negative_inner_product(c2, '{0:1.3,1:2.6,0:false}') approximate  limit 10;
c1	c2	c3	c4	a5
3	{1:2.6}	{1:1.3,1:2.6}	{1:2.6}	-7
4	{1:1.3,3:2.6}	{1:1.3,2:2.6}	{1:2.6}	-3
drop table if exists t1;
create table t1 (c1 int  AUTO_INCREMENT , c2 sparsevector not null,c3 varchar(30) DEFAULT '{}' primary key,c4 sparsevector,a5 int as (negative_inner_product(c2,c4)), fulltext index ft_idx(c3),VECTOR INDEX vector_idx(c2) WITH (distance=inner_product),VECTOR INDEX vector_idx2(c4) WITH (distance=inner_product));
insert into t1(c1,c2,c3,c4) values(3,'{1:1.3,1:2.6}','{1:1.3,1:2.6}','{1:1.3,1:2.6}');
ALTER TABLE t1 COMPRESSION = 'PAGE' ;
ERROR HY000: Incorrect arguments to PAGE
insert into t1(c1,c2,c3,c4) values(4,'{1:1.3,3:2.6}','{1:1.3,2:2.6}','{1:1.3,1:2.6}');
insert into t1(c1,c2,c3,c4) values(5,'{1:1.3,5:2.6}','{1:1.3,3:2.6}',null);
select /*+ index(t1 vector_idx)*/* from t1 where  a5 < 1 order by negative_inner_product(c2, '{0:1.3,1:2.6,0:false}') approximate  limit 10;
c1	c2	c3	c4	a5
3	{1:2.6}	{1:1.3,1:2.6}	{1:2.6}	-7
4	{1:1.3,3:2.6}	{1:1.3,2:2.6}	{1:2.6}	-3
drop table if exists t1;
create table t1 (c1 int  AUTO_INCREMENT , c2 sparsevector not null,c3 varchar(30) DEFAULT '{}' primary key,c4 sparsevector,a5 int as (negative_inner_product(c2,c4)), fulltext index ft_idx(c3),VECTOR INDEX vector_idx(c2) WITH (distance=inner_product),VECTOR INDEX vector_idx2(c4) WITH (distance=inner_product));
insert into t1(c1,c2,c3,c4) values(3,'{1:1.3,1:2.6}','{1:1.3,1:2.6}','{1:1.3,1:2.6}');
insert into t1(c1,c2,c3,c4) values(4,'{1:1.3,3:2.6}','{1:1.3,2:2.6}','{1:1.3,1:2.6}');
insert into t1(c1,c2,c3,c4) values(5,'{1:1.3,5:2.6}','{1:1.3,3:2.6}',null);
select /*+ index(t1 vector_idx)*/* from t1 where  a5 < 1 order by negative_inner_product(c2, '{0:1.3,1:2.6,0:false}') approximate  limit 10;
c1	c2	c3	c4	a5
3	{1:2.6}	{1:1.3,1:2.6}	{1:2.6}	-7
4	{1:1.3,3:2.6}	{1:1.3,2:2.6}	{1:2.6}	-3
OPTIMIZE TABLE t1;
select /*+ index(t1 vector_idx)*/* from t1 where  a5 < 1 order by negative_inner_product(c2, '{0:1.3,1:2.6,0:false}') approximate  limit 10;
c1	c2	c3	c4	a5
3	{1:2.6}	{1:1.3,1:2.6}	{1:2.6}	-7
4	{1:1.3,3:2.6}	{1:1.3,2:2.6}	{1:2.6}	-3
OPTIMIZE TABLE t2;
drop table if exists t1;
create table t1 (c1 int primary key AUTO_INCREMENT , c2 sparsevector not null,c3 varchar(30) DEFAULT '{}' ,c4 sparsevector,a5 int as (negative_inner_product(c2,c4)), fulltext index ft_idx(c3),VECTOR INDEX vector_idx(c2) WITH (distance=inner_product),VECTOR INDEX vector_idx2(c4) WITH (distance=inner_product))PARTITION BY hash(c1) PARTITIONS 4;
insert into t1(c1,c2,c3,c4) values(3,'{1:1.3,1:2.6}','{1:1.3,1:2.6}','{1:1.3,1:2.6}');
insert into t1(c1,c2,c3,c4) values(4,'{1:1.3,3:2.6}','{1:1.3,2:2.6}','{1:1.3,1:2.6}');
insert into t1(c1,c2,c3,c4) values(5,'{1:1.3,5:2.6}','{1:1.3,3:2.6}',null);
alter table t1 add partition (partition p1 values less than (20));
ERROR 0A000: Add hash partition not supported
drop table if exists t1;
create table t1 (c1 int primary key AUTO_INCREMENT , c2 sparsevector not null,c3 varchar(30) DEFAULT '{}' ,c4 sparsevector,a5 int as (negative_inner_product(c2,c4)), fulltext index ft_idx(c3),VECTOR INDEX vector_idx(c2) WITH (distance=inner_product),VECTOR INDEX vector_idx2(c4) WITH (distance=inner_product));
insert into t1(c1,c2,c3,c4) values(3,'{1:1.3,1:2.6}','{1:1.3,1:2.6}','{1:1.3,1:2.6}');
insert into t1(c1,c2,c3,c4) values(4,'{1:1.3,3:2.6}','{1:1.3,2:2.6}','{1:1.3,1:2.6}');
insert into t1(c1,c2,c3,c4) values(5,'{1:1.3,5:2.6}','{1:1.3,3:2.6}',null);
ALTER TABLE t1 PARTITION BY RANGE (c1) (PARTITION p2020 VALUES LESS THAN (2021),PARTITION p2021 VALUES LESS THAN (2022), PARTITION p2022 VALUES LESS THAN MAXVALUE);
Got one of the listed errors
drop table if exists  t1;
create table t1(c1 int primary key,c2 sparsevector,c3 vector(3),c4 varchar(200), vector index idx1(c2) with (distance=inner_product),vector index idx2(c3) with (distance=l2, type=hnsw))partition by list columns (c1)(
PARTITION p0 VALUES in(1),
PARTITION p2 VALUES in(2),
PARTITION p3 VALUES in(3),
PARTITION p4 VALUES in(4),
PARTITION p5 VALUES in(5)
);
insert into t1(c1,c2,c3,c4) values(1,'{0:1.3,1:2.6}',[1,2,4],'{}');
insert into t1(c1,c2,c3,c4) values(2,'{}',[1,2,4],null);
insert into t1(c1,c2,c3,c4) values(3,'{1.123:2.123,3.123:4.123,10:2}',[1,2,4],'{1.123:2.123,3.123:4.123,10:3}');
insert into t1(c1,c2,c3,c4) values(4,'{1.123:-2}',[1,2,4],'{1.123:-1}');
drop view if exists  v1;
Warnings:
Note	1051	Unknown table 'obljh.v1'
create view v1 as select * from t1 ;
insert into v1 values(5,map(1,2,3,4,5,6),[1,2,4],'{1.123:-1}');
replace into v1 values(5,map(1,2,3,4,5,6),[1,2,4],'{1.123:-1}');
select inner_product(c2,c4) from v1 order by negative_inner_product(c2, '{1:2,3:4,5:6}') APPROXIMATE limit 100;
inner_product(c2,c4)
-2
27.506258964538574
0
NULL
2
########清空回收站，删除测试数据库，表等 ##########
drop database  IF EXISTS  obljh;
purge recyclebin;
