purge recyclebin;
drop database IF EXISTS obljh;
create database obljh ;
use obljh;
set timestamp = 1600000000;
set ob_trx_timeout = 10000000000;
set ob_query_timeout = 10000000000;
alter system set ob_vector_memory_limit_percentage =44;
##字符集测试
##设置binary
drop table if exists  t1;
create table t1 (c1 int primary key,c2 sparsevector,c3 sparsevector,c4 varchar(20), vector index idx1(c2) with (distance=inner_product))default character set binary;
insert into t1(c1,c2,c3,c4) values(1,'{1:1.3,1:2.6}','{1:1.3,1:2.6}','{1:1.3,1:2.6}');
insert into t1(c1,c2,c3,c4) values(2,'{}','{1:false}','{1:1.3,1:2.6}');
insert into t1(c1,c2,c3,c4) values(3,'{2:3,1:2}','{}','{1:1.3,1:2.6}');
insert into t1(c1,c2,c3,c4) values(4,null,null,null);
update /*+ ENABLE_PARALLEL_DML parallel(256) */t1 set c2='{2:3}' where c1=1;
delete from t1 where c2='{}' ;
select c1,c2,c3,c4 from t1 order by c1;
c1	c2	c3	c4
1	{2:3}	{1:2.6}	{1:1.3,1:2.6}
3	{1:2,2:3}	{}	{1:1.3,1:2.6}
4	NULL	NULL	NULL
desc t1 ;
Field	Type	Null	Key	Default	Extra
c1	int(11)	NO	PRI	NULL	
c2	SPARSEVECTOR	YES		NULL	
c3	SPARSEVECTOR	YES		NULL	
c4	varbinary(20)	YES		NULL	
##设置utf8mb4
drop table if exists  t1;
create table t1 (c1 int primary key,c2 sparsevector,c3 sparsevector,c4 varchar(20), vector index idx1(c2) with (distance=inner_product))default character set utf8mb4;
insert into t1(c1,c2,c3,c4) values(1,'{1:1.3,1:2.6}','{1:1.3,1:2.6}','{1:1.3,1:2.6}');
insert into t1(c1,c2,c3,c4) values(2,'{}','{1:false}','{1:1.3,1:2.6}');
insert into t1(c1,c2,c3,c4) values(3,'{2:3,1:2}','{}','{1:1.3,1:2.6}');
insert into t1(c1,c2,c3,c4) values(4,null,null,null);
update /*+ ENABLE_PARALLEL_DML parallel(256) */t1 set c2=map(1,2,3,4,4,6) where c1=1;
delete from t1 where c2='{}' ;
select c1,c2,c3,c4 from t1 order by c1;
c1	c2	c3	c4
1	{1:2,3:4,4:6}	{1:2.6}	{1:1.3,1:2.6}
3	{1:2,2:3}	{}	{1:1.3,1:2.6}
4	NULL	NULL	NULL
desc t1 ;
Field	Type	Null	Key	Default	Extra
c1	int(11)	NO	PRI	NULL	
c2	SPARSEVECTOR	YES		NULL	
c3	SPARSEVECTOR	YES		NULL	
c4	varchar(20)	YES		NULL	
##设置gbk
drop table if exists  t1;
create table t1 (c1 int primary key,c2 sparsevector comment '注释c2',c3 sparsevector comment '注释c3',c4 varchar(20) comment '注释c4', vector index idx1(c2) with (distance=inner_product))default character set gbk;
insert into t1(c1,c2,c3,c4) values(1,'{1:1.3,1:2.6}','{1:1.3,1:2.6}','{1:1.3,1:2.6}');
insert into t1(c1,c2,c3,c4) values(2,'{}','{1:false}','{1:1.3,1:2.6}');
insert into t1(c1,c2,c3,c4) values(3,'{2:3,1:2}','{}','{1:1.3,1:2.6}');
insert into t1(c1,c2,c3,c4) values(4,null,null,null);
update /*+ ENABLE_PARALLEL_DML parallel(256) */t1 set c2=map(1,2,3,4,4,6) where c1=1;
delete from t1 where c2='{}' ;
select c1,c2,c3,c4 from t1 order by c1;
c1	c2	c3	c4
1	{1:2,3:4,4:6}	{1:2.6}	{1:1.3,1:2.6}
3	{1:2,2:3}	{}	{1:1.3,1:2.6}
4	NULL	NULL	NULL
desc t1 ;
Field	Type	Null	Key	Default	Extra
c1	int(11)	NO	PRI	NULL	
c2	SPARSEVECTOR	YES		NULL	
c3	SPARSEVECTOR	YES		NULL	
c4	varchar(20)	YES		NULL	
##设置gb18030
drop table if exists  t1;
create table t1 (c1 int primary key,c2 sparsevector,c3 sparsevector,c4 varchar(20), vector index idx1(c2) with (distance=inner_product))default character set gb18030;
insert into t1(c1,c2,c3,c4) values(1,'{1:1.3,1:2.6}','{1:1.3,1:2.6}','{1:1.3,1:2.6}');
insert into t1(c1,c2,c3,c4) values(2,'{}','{1:false}','{1:1.3,1:2.6}');
insert into t1(c1,c2,c3,c4) values(3,'{2:3,1:2}','{}','{1:1.3,1:2.6}');
insert into t1(c1,c2,c3,c4) values(4,null,null,null);
update /*+ ENABLE_PARALLEL_DML parallel(256) */t1 set c2=map(1,2,3,4,4,6) where c1=1;
delete from t1 where c2='{}' ;
select c1,c2,c3,c4 from t1 order by c1;
c1	c2	c3	c4
1	{1:2,3:4,4:6}	{1:2.6}	{1:1.3,1:2.6}
3	{1:2,2:3}	{}	{1:1.3,1:2.6}
4	NULL	NULL	NULL
desc t1 ;
Field	Type	Null	Key	Default	Extra
c1	int(11)	NO	PRI	NULL	
c2	SPARSEVECTOR	YES		NULL	
c3	SPARSEVECTOR	YES		NULL	
c4	varchar(20)	YES		NULL	
drop table if exists  t1;
create table t1 (c1 int  primary key,c2 sparsevector);
insert into t1(c1,c2) values(1,'{null:null}');
ERROR 42000: Null value
insert into t1(c1,c2) values(2,'{1:null}');
ERROR 42000: Null value
insert into t1(c1,c2) values(3,'{null:1}');
ERROR 42000: Null value
select * from t1 order by c1;
c1	c2
drop table if exists  t1;
create table t1 (c1 int primary key, c2 sparsevector);
insert into t1(c1,c2) values(1,'{1:1.3,1:2.6,1.2:3.2}');
select * from t1;
c1	c2
1	{1:3.2}
drop table if exists  t1;
create table t1 (c1 int primary key, c2 sparsevector,c3 varchar(30),c4 sparsevector,VECTOR INDEX vector_idx(c2) WITH (distance=inner_product));
insert into t1(c1,c2,c3,c4) values(1,'{1:1.3,1:2.6}','{1:1.3,1:2.6}','{1:1.3,1:2.6}');
insert into t1(c1,c2,c3,c4) values(2,'{1:1.3,1:2.6}','{1:1.3,1:2.6}',map(null,null));
ERROR 42000: Null value
select * from t1 order by c1;
c1	c2	c3	c4
1	{1:2.6}	{1:1.3,1:2.6}	{1:2.6}
drop table if exists  t1;
create table t1 (c1 int primary key, c2 sparsevector,c3 varchar(30),c4 sparsevector,VECTOR INDEX vector_idx(c2) WITH (distance=inner_product));
insert into t1(c1,c2,c3,c4) values(1,'{1:1.3,1:2.6}','{1:1.3,1:2.6}','{1:1.3,1:2.6}');
insert into t1(c1,c2,c3,c4) values(2,'{1:1.3,1:2.6}','{1:1.3,1:2.6}',map('100',1));
insert into t1(c1,c2,c3,c4) values(3,'{1:1.3,1:2.6}','{1:1.3,1:2.6}',map(110*4,1/10));
select * from t1 order by c1;
c1	c2	c3	c4
1	{1:2.6}	{1:1.3,1:2.6}	{1:2.6}
2	{1:2.6}	{1:1.3,1:2.6}	{100:1}
3	{1:2.6}	{1:1.3,1:2.6}	{440:0.1}
drop table if exists  t1;
create table t1 (c1 int primary key, c2 sparsevector,c3 sparsevector, VECTOR INDEX vector_idx(c3) WITH (distance=inner_product));
insert into t1(c1,c2,c3) values(1,'{1:1.3,1:2.6}','{1:1.3,1:2.6}');
select * from t1 order by negative_inner_product(c3, null) approx limit 2;
ERROR 42000: Null value
select * from t1 order by negative_inner_product(c3, '{0:0}') approx limit 2;
c1	c2	c3
drop table if exists  t1;
create table t1 (c1 int primary key, c2 sparsevector,c3 sparsevector, VECTOR INDEX vector_idx(c3) WITH (distance=inner_product));
insert into t1(c1,c2,c3) values(1,null,null);
select * from t1 a,t1 b where a.c3=b.c3;
c1	c2	c3	c1	c2	c3
select * from t1 order by negative_inner_product(c3, '{1:2}') approx limit 2;
c1	c2	c3
drop table if exists  t1;
create table t1 (c1 int primary key, c2 vector(3),vector index idx1(c2) with (distance=l2, type=hnsw));
insert into t1(c1,c2) values(1,[1,2,3]);
select * from t1 order by l2_distance(c2, null) approx limit 2;
ERROR HY000: Invalid argument
select * from t1 order by l2_distance(c2, [0,0,0]) approx limit 2;
c1	c2
1	[1,2,3]
drop table if exists  t1;
create table t1 (c1 int primary key,c2 sparsevector,c3 sparsevector,c4 varchar(20));
insert into t1(c1,c2,c3,c4) values(1,'{1:1.3,1:2.6}','{1:1.3,1:2.6}','{1:1.3,1:2.6}');
insert into t1(c1,c2,c3,c4) values(2,'{}','{1:false}','{1:1.3,1:2.6}');
insert into t1(c1,c2,c3,c4) values(4,map(false,true,0.1,-2000),'{1:false}','{1:1.3,1:2.6}');
insert into t1(c1,c2,c3,c4) values(5,map(vector_norm([1,2,3]),vector_norm([1,2,3])),'{1:false}','{1:1.3,1:2.6}');
insert into t1(c1,c2,c3,c4) values(7,map(vector_norm([1,2,3]),vector_norm([0,100000000000])),'{1:false}','{1:1.3,1:2.6}');
drop table if exists  t1;
create table t1 (c1 int primary key,c2 sparsevector,c3 sparsevector,c4 varchar(20),VECTOR INDEX vector_idx(c2) WITH (distance=inner_product));
insert into t1(c1,c2,c3,c4) values(1,'{1:1.3,1:2.6}','{1:1.3,1:2.6}','{1:1.3,1:2.6}');
insert into t1(c1,c2,c3,c4) values(2,'{}','{1:false}','{1:1.3,1:2.6}');
insert into t1(c1,c2,c3,c4) values(5,map(false,true,0.1,-2000),'{1:false}','{1:1.3,1:2.6}');
drop table if exists  t1;
create table t1 (c1 int primary key,c2 sparsevector not null,c3 sparsevector,c4 varchar(20),VECTOR INDEX vector_idx(c2) WITH (distance=inner_product));
insert into t1(c1,c2,c3,c4) values(5,map(false,true,0.1,-2000),'{1:false}','{1:1.3,1:2.6}');
insert into t1(c1,c2,c3,c4) values(5,map(0,0,0,1),'{1:false}','{1:1.3,1:2.6}');
ERROR 23000: Duplicate entry '5' for key 'PRIMARY'
insert into t1(c1,c2,c3,c4) values(6,map(0,0,0,1),'{1:false}','{1:1.3,1:2.6}');
insert into t1(c1,c2,c3,c4) values(7,map(0,0,0,1),'{1:false}','{1:1.3,1:2.6}');
drop table if exists  t1;
create table t1 (c1 int  primary key,c2 sparsevector,c3 sparsevector,c4 varchar(200));
insert into t1(c1,c2,c3,c4) values(1,'{0:1.3,1:2.6}','{2:1.3,1:2.6}','{}');
insert into t1(c1,c2,c3,c4) values(2,'{}','{2:1.3,1:2.6}','{1.123:2.123,3.123:4.123,10:2}');
insert into t1(c1,c2,c3,c4) values(3,'{1.123:2.123,3.123:4.123,10:2}','{2:1.3,1:2.6}','{1.123:2.123,3.123:4.123,10:2}');
insert into t1(c1,c2,c3,c4) values(4,'{1.123:-1}','{4:1.3,1:2.6}','{1.123:-1}');
insert into t1(c1,c2,c3,c4) values(5,'{false:-1}','{2:1.3,1:2.6}','{1.123:-1}');
ERROR HY000: Incorrect integer value for column 'c2' at row 1
insert into t1(c1,c2,c3,c4) values(5,'{-1:-1}','{2:1.3,1:2.6}','{1.123:-1}');
ERROR 22003: Out of range value for column 'c2' at row 1
insert into t1(c1,c2,c3,c4) values(6,'{0:-1}','{3:1.3,1:2.6}','{1.123:-1}');
insert into t1(c1,c2,c3,c4) values(7,'{3.1415926:-1}','{4:1.3,1:2.6}','{1.123:-1}');
insert into t1(c1,c2,c3,c4) values(8,'{4294967295:-1}','{1:1.3,1:2.6}','{1.123:-1}');
insert into t1(c1,c2,c3,c4) values(8,'{4294967296:-1}','{3:1.3,1:2.6}','{1.123:-1}');
ERROR 22003: Out of range value for column 'c2' at row 1
insert into t1(c1,c2,c3,c4) values(9,'{4294967295:3.402823466E+38}','{5:1.3,1:2.6}','{4294967295:0}');
insert into t1(c1,c2,c3,c4) values(10,'{4294967295:3.402823466E+38}','{3:1.3,1:2.6}','{4294967295:1}');
insert into t1(c1,c2,c3,c4) values(100,null,null,null);
select inner_product(c2,c4) from t1 order by c1;
inner_product(c2,c4)
0
0
25.506258964538574
1
0
0
0
0
3.4028234663852886e38
NULL
select /*+log_level(DEBUG) no_rewrite */c1,inner_product(c2,c4) from t1 order by c1;
c1	inner_product(c2,c4)
1	0
2	0
3	25.506258964538574
4	1
6	0
7	0
8	0
9	0
10	3.4028234663852886e38
100	NULL
select /*+ ENABLE_PARALLEL_DML parallel(256) */c1,inner_product(c2,c4) from t1 order by c1;
c1	inner_product(c2,c4)
1	0
2	0
3	25.506258964538574
4	1
6	0
7	0
8	0
9	0
10	3.4028234663852886e38
100	NULL
select /*+ OPT_PARAM('rowsets_enabled', 'FALSE') */c1,inner_product(c2,c4) from t1 order by c1;
c1	inner_product(c2,c4)
1	0
2	0
3	25.506258964538574
4	1
6	0
7	0
8	0
9	0
10	3.4028234663852886e38
100	NULL
select /*+ OPT_PARAM('enable_rich_vector_format', 'FALSE') */c1,inner_product(c2,c4) from t1 order by c1;
c1	inner_product(c2,c4)
1	0
2	0
3	25.506258964538574
4	1
6	0
7	0
8	0
9	0
10	3.4028234663852886e38
100	NULL
select inner_product(c2,c4) from t1 where c2='{4294967295:3.402823466E+38}' order by c1;
inner_product(c2,c4)
0
3.4028234663852886e38
select /*+log_level(DEBUG) no_rewrite */inner_product(c2,c4) from t1 where c2='{4294967295:3.402823466E+38}' order by c1;
inner_product(c2,c4)
0
3.4028234663852886e38
select /*+ ENABLE_PARALLEL_DML parallel(256) */inner_product(c2,c4) from t1 where c2='{4294967295:3.402823466E+38}' order by c1;
inner_product(c2,c4)
0
3.4028234663852886e38
select /*+ OPT_PARAM('rowsets_enabled', 'FALSE') */inner_product(c2,c4) from t1 where c2='{4294967295:3.402823466E+38}' order by c1;
inner_product(c2,c4)
0
3.4028234663852886e38
select /*+ OPT_PARAM('enable_rich_vector_format', 'FALSE') */inner_product(c2,c4) from t1 where c2='{4294967295:3.402823466E+38}' order by c1;
inner_product(c2,c4)
0
3.4028234663852886e38
select /*+ OPT_PARAM('enable_rich_vector_format', 'FALSE') */inner_product(c2,c4)+inner_product(c2,c4) from t1 where c2='{4294967295:3.402823466E+38}' order by c1;
inner_product(c2,c4)+inner_product(c2,c4)
0
6.805646932770577e38
drop table if exists  t1;
create table t1 (c1 int  primary key,c2 sparsevector,c3 sparsevector,c4 varchar(200));
insert into t1(c1,c2,c3,c4) values(5,'{false:false}','{4:1.3,1:2.6}','{1.123:-1}');
ERROR HY000: Incorrect integer value for column 'c2' at row 1
insert into t1(c1,c2,c3,c4) values(1,'{[1]:1.2}','{2:1.3,1:2.6}','{}');
ERROR 22032: Invalid JSON text.
insert into t1(c1,c2,c3,c4) values(5,'{-1:-1}','{2:1.3,1:2.6}','{1.123:-1}');
ERROR 22003: Out of range value for column 'c2' at row 1
insert into t1(c1,c2,c3,c4) values(8,'{4294967296:0}','{2:1.3,1:2.6}','{1.123:-1}');
ERROR 22003: Out of range value for column 'c2' at row 1
insert into t1(c1,c2,c3,c4) values(1,'{0:1.3,1:2.6}','{2:1.3,1:2.6}','{}');
insert into t1(c1,c2,c3,c4) values(2,'{}','{2:1.3,1:2.6}','{1:-1}');
insert into t1(c1,c2,c3,c4) values(3,'{1.123:2.123,3.123:4.123,10:4}','{1:1.3,1:2.6}','{1.123:2.123,3.123:4.123,10:2}');
insert into t1(c1,c2,c3,c4) values(4,'{1.123:1}','{1:1.3,1:2.6}','{1.123:1}');
insert into t1(c1,c2,c3,c4) values(6,'{0:-1}','{5:1.3,1:2.6}','{1.123:-1}');
insert into t1(c1,c2,c3,c4) values(7,'{3.1415926:-3.402823466E+38}','{2:1.3,1:2.6}','{1.123:-1}');
insert into t1(c1,c2,c3,c4) values(8,'{4294967295: -1.175494351E-38}','{5:1.3,1:2.6}','{1.123:-1}');
insert into t1(c1,c2,c3,c4) values(9,'{4294967295:3.402823466E+38}','{3:1.3,1:2.6}','{4294967295:0}');
insert into t1(c1,c2,c3,c4) values(10,'{4294967295:3.402823466E+38}','{4:1.3,1:2.6}','{4294967295:1}');
insert into t1(c1,c2,c3,c4) values(100,null,null,null);
select inner_product(c2,c4) from t1 order by c1;
inner_product(c2,c4)
0
0
29.506258964538574
1
0
0
0
0
3.4028234663852886e38
NULL
select /*+log_level(DEBUG) no_rewrite */c1,inner_product(c2,c4) from t1 order by c1;
c1	inner_product(c2,c4)
1	0
2	0
3	29.506258964538574
4	1
6	0
7	0
8	0
9	0
10	3.4028234663852886e38
100	NULL
select /*+ ENABLE_PARALLEL_DML parallel(256) */c1,inner_product(c2,c4) from t1 order by c1;
c1	inner_product(c2,c4)
1	0
2	0
3	29.506258964538574
4	1
6	0
7	0
8	0
9	0
10	3.4028234663852886e38
100	NULL
select /*+ OPT_PARAM('rowsets_enabled', 'FALSE') */c1,inner_product(c2,c4) from t1 order by c1;
c1	inner_product(c2,c4)
1	0
2	0
3	29.506258964538574
4	1
6	0
7	0
8	0
9	0
10	3.4028234663852886e38
100	NULL
select /*+ OPT_PARAM('enable_rich_vector_format', 'FALSE') */c1,inner_product(c2,c4) from t1 order by c1;
c1	inner_product(c2,c4)
1	0
2	0
3	29.506258964538574
4	1
6	0
7	0
8	0
9	0
10	3.4028234663852886e38
100	NULL
select inner_product(c2,c4) from t1 where c2='{4294967295:3.402823466E+38}' order by c1;
inner_product(c2,c4)
0
3.4028234663852886e38
select /*+log_level(DEBUG) no_rewrite */inner_product(c2,c4) from t1 where c2='{4294967295:3.402823466E+38}' order by c1;
inner_product(c2,c4)
0
3.4028234663852886e38
select /*+ ENABLE_PARALLEL_DML parallel(256) */inner_product(c2,c4) from t1 where c2='{4294967295:3.402823466E+38}' order by c1;
inner_product(c2,c4)
0
3.4028234663852886e38
select /*+ OPT_PARAM('rowsets_enabled', 'FALSE') */inner_product(c2,c4) from t1 where c2='{4294967295:3.402823466E+38}' order by c1;
inner_product(c2,c4)
0
3.4028234663852886e38
select /*+ OPT_PARAM('enable_rich_vector_format', 'FALSE') */inner_product(c2,c4) from t1 where c2='{4294967295:3.402823466E+38}' order by c1;
inner_product(c2,c4)
0
3.4028234663852886e38
select /*+ OPT_PARAM('enable_rich_vector_format', 'FALSE') */inner_product(c2,c4)+inner_product(c2,c4) from t1 where c2='{4294967295:3.402823466E+38}' order by c1;
inner_product(c2,c4)+inner_product(c2,c4)
0
6.805646932770577e38
drop table if exists  t1;
create table t1 (c1 int  primary key,c2 sparsevector,c3 sparsevector,c4 varchar(200));
insert into t1(c1,c2,c3,c4) values(4,'{1.123:1}','{2:1.3,1:2.6}','{1:1}');
select inner_product(c2,c4) from t1 order by c1;
inner_product(c2,c4)
1
select * from t1;
c1	c2	c3	c4
4	{1:1}	{1:2.6,2:1.3}	{1:1}
drop table if exists  t1;
create table t1 (c1 int  primary key,c2 sparsevector,c3 sparsevector,c4 varchar(200));
insert into t1(c1,c2,c3,c4) values(4,'{1.123:1}','{2:1.3,1:2.6}','{1.2:1}');
select inner_product(c2,c4) from t1 order by c1;
inner_product(c2,c4)
1
select * from t1;
c1	c2	c3	c4
4	{1:1}	{1:2.6,2:1.3}	{1.2:1}
drop table if exists  t1;
create table t1 (c1 int,c2 sparsevector,c3 sparsevector,c4 sparsevector, VECTOR INDEX vector_idx(c3) WITH (distance=inner_product));
alter table t1 modify column c3 vector(3);
ERROR 0A000: Run this DDL operation on table with sparse vector index not supported
insert into t1 values(1,null,null,null);
insert into t1 values(1,null,'{}',null);
alter table t1 modify column c3 GEOMETRY;
ERROR 0A000: Run this DDL operation on table with sparse vector index not supported
alter table t1 modify column c3 json;
ERROR 0A000: Run this DDL operation on table with sparse vector index not supported
alter table t1 modify column c3 blob;
ERROR 0A000: Run this DDL operation on table with sparse vector index not supported
alter table t1 modify column c3 varchar(255);
ERROR 0A000: Run this DDL operation on table with sparse vector index not supported
alter table t1 modify column c3 TEXT;
ERROR 0A000: Run this DDL operation on table with sparse vector index not supported
alter table t1 modify column c3 BOOL;
ERROR 0A000: Run this DDL operation on table with sparse vector index not supported
alter table t1 modify column c3 BOOLEAN;
ERROR 0A000: Run this DDL operation on table with sparse vector index not supported
alter table t1 modify column c3 TINYINT;
ERROR 0A000: Run this DDL operation on table with sparse vector index not supported
alter table t1 modify column c3 SMALLINT;
ERROR 0A000: Run this DDL operation on table with sparse vector index not supported
alter table t1 modify column c3 NUMERIC;
ERROR 0A000: Run this DDL operation on table with sparse vector index not supported
alter table t1 modify column c3 FLOAT;
ERROR 0A000: Run this DDL operation on table with sparse vector index not supported
alter table t1 modify column c3 BIT;
ERROR 0A000: Run this DDL operation on table with sparse vector index not supported
alter table t1 modify column c3 DATETIME;
ERROR 0A000: Run this DDL operation on table with sparse vector index not supported
alter table t1 modify column c3 DATE;
ERROR 0A000: Run this DDL operation on table with sparse vector index not supported
alter table t1 modify column c3 VARCHAR(20);
ERROR 0A000: Run this DDL operation on table with sparse vector index not supported
alter table t1 modify column c3 map(int,float);
ERROR 0A000: Run this DDL operation on table with sparse vector index not supported
drop table if exists  t1;
create table t1 (c1 int,c2 sparsevector,c3 sparsevector,c4 sparsevector);
alter table t1 modify column c3 vector(3);
insert into t1(c1,c2,c3,c4) values(1,'{1:1.3,1:2.6}','[1,2,3]','{1:1.3,1:2.6}');
insert into t1(c1,c2,c3,c4) values(2,'{}','[1,2,3]','{1:1.3,1:2.6}');
insert into t1(c1,c2,c3,c4) values(3,'{2:3,1:2}','[1,2,3]','{1:1.3,1:2.6}');
insert into t1(c1,c2,c3,c4) values(4,null,null,null);
create vector index idx1 on t1(c3) with (distance=l2, type=hnsw);
replace into t1(c1,c2,c3,c4) values(1,'{1:1.3,1:2.6}','[1,2,3]','{1:1.3,1:2.6}');
insert into t1(c1,c2,c3,c4) values(2,'{}','[1,2,3]','{1:1.3,1:2.6}');
insert into t1(c1,c2,c3,c4) values(3,'{2:3,1:2}','[1,2,3]','{1:1.3,1:2.6}');
insert into t1(c1,c2,c3,c4) values(4,null,null,null);
drop table if exists  t1;
create table t1 (c1 int,c2 sparsevector,c3 sparsevector,c4 sparsevector);
insert into t1(c1,c2,c3,c4) values(1,'{1:1.3,1:2.6}','{1:1.3,1:2.6}','{1:1.3,1:2.6}');
insert into t1(c1,c2,c3,c4) values(2,'{}','{1:false}','{1:1.3,1:2.6}');
insert into t1(c1,c2,c3,c4) values(3,'{2:3,1:2}','{}','{1:1.3,1:2.6}');
insert into t1(c1,c2,c3,c4) values(4,null,null,null);
drop table if exists  t1;
create table t1 (c1 int,c2 sparsevector,c3 sparsevector,c4 sparsevector, VECTOR INDEX vector_idx(c3) WITH (distance=inner_product));
insert into t1(c1,c2,c3,c4) values(1,'{1:1.3,1:2.6}','{1:1.3,1:2.6}','{1:1.3,1:2.6}');
insert into t1(c1,c2,c3,c4) values(2,'{}','{1:false}','{1:1.3,1:2.6}');
insert into t1(c1,c2,c3,c4) values(3,'{2:3,1:2}','{}','{1:1.3,1:2.6}');
insert into t1(c1,c2,c3,c4) values(4,null,null,null);
SELECT c1, CAST(c3 AS SIGNED) AS int_value FROM t1 order by c1;
ERROR 22000: Invalid data type for the operation
SELECT c1, CAST(c3 AS char(20)) AS int_value FROM t1 order by c1;
ERROR 22000: Invalid data type for the operation
SELECT c1, CAST(c3 AS DATE(20)) AS int_value FROM t1 order by c1;
ERROR 22000: Invalid data type for the operation
SELECT c1, CAST(c3 AS JSON) AS int_value FROM t1 order by c1;
ERROR 22000: Invalid data type for the operation
SELECT c1, CAST(c3 AS VARCHAR(10)) AS int_value FROM t1 order by c1;
ERROR 42000: You have an error in your SQL syntax; check the manual that corresponds to your OceanBase version for the right syntax to use near 'VARCHAR(10)) AS int_value FROM t1 order by c1' at line 1
SELECT c1, CAST(c3 AS INT) AS int_value FROM t1 order by c1;
ERROR 42000: You have an error in your SQL syntax; check the manual that corresponds to your OceanBase version for the right syntax to use near 'INT) AS int_value FROM t1 order by c1' at line 1
SELECT c1, inner_product(c2,CAST('{}' as char(20))) AS int_value FROM t1 order by c1;
c1	int_value
1	0
2	0
3	0
4	NULL
SELECT c1, inner_product(c2,CAST('{}' as BINARY(20))) AS int_value FROM t1 order by c1;
c1	int_value
1	0
2	0
3	0
4	NULL
SELECT c1, inner_product(c2,CAST('{}' as DATE(20))) AS int_value FROM t1 order by c1;
ERROR HY000: Invalid argument
SELECT c1, inner_product(c2,CAST('{1:2}' as JSON)) AS int_value FROM t1 order by c1;
ERROR HY000: Invalid argument
SELECT c1, inner_product(c2,CAST('{}' as VARCHAR(10))) AS int_value FROM t1 order by c1;
ERROR 42000: You have an error in your SQL syntax; check the manual that corresponds to your OceanBase version for the right syntax to use near 'VARCHAR(10))) AS int_value FROM t1 order by c1' at line 1
SELECT c1, inner_product(c2,CAST('{}' as INT)) AS int_value FROM t1 order by c1;
ERROR 42000: You have an error in your SQL syntax; check the manual that corresponds to your OceanBase version for the right syntax to use near 'INT)) AS int_value FROM t1 order by c1' at line 1
drop table if exists  t1;
create table t1 (c1 int,c2 sparsevector,c3 sparsevector,c4 sparsevector);
insert into t1(c1,c2,c3,c4) values(1,'{1:1.3,2:2.6}','{2:100,100:1000}','{1:1.3,1:2.6}');
alter table t1 modify column c3 map(varchar(3), array(array(varchar(20))));
ERROR 22000: array type mismatch found between definition and data
drop table if exists  t1;
create table t1 (c1 int,c2 sparsevector,c3 sparsevector,c4 sparsevector);
insert into t1(c1,c2,c3,c4) values(1,'{1:1.3,2:2.6}','{2:100,100:1000}','{1:1.3,1:2.6}');
select inner_product(c2,map(1,2)) from t1;
ERROR 22000: Invalid data type for the operation
drop table if exists  t1;
create table t1 (c1 int,c2 sparsevector,c3 sparsevector,c4 sparsevector);
insert into t1(c1,c2,c3,c4) values(1,'{1:1.3,2:2.6}','{2:100,100:1000}','{1:1.3,1:2.6}');
alter table t1 modify column c3 map(int, float);
select inner_product(c2,c3) from t1;
ERROR 22000: Invalid data type for the operation
select inner_product('{1:2}',map(1,2));
ERROR 22000: Invalid data type for the operation
drop table if exists  t1;
create table t1 (c1 int,c2 sparsevector,c3 sparsevector,c4 sparsevector);
insert into t1(c1,c2,c3,c4) values(1,'{1:1.3,1:2.6}','{1:1.3,1:2.6}','{1:1.3,1:2.6}');
insert into t1(c1,c2,c3,c4) values(2,'{}','{1:false}','{1:1.3,1:2.6}');
insert into t1(c1,c2,c3,c4) values(3,'{2:3,1:2}','{}','{1:1.3,1:2.6}');
insert into t1(c1,c2,c3,c4) values(4,null,null,null);
select inner_product(c2,'{qaeds:2}')  from t1;
ERROR HY000: Incorrect integer value
select inner_product(c2,'{中文:2}')  from t1;
ERROR HY000: Incorrect integer value
select inner_product(c2,'{中文123:2}')  from t1;
ERROR HY000: Incorrect integer value
select inner_product(c2,'{@:2}')  from t1;
ERROR 22032: Invalid JSON text.
select inner_product(c2,'{1:asde}')  from t1;
ERROR 22032: Invalid JSON text.
select inner_product(c2,'{1:中文}')  from t1;
ERROR 22032: Invalid JSON text.
select inner_product(c2,'{1:中文123}')  from t1;
ERROR 22032: Invalid JSON text.
select inner_product(c2,'{1:！@#￥}')  from t1;
ERROR 22032: Invalid JSON text.
select c2+c3 from t1 order by c1;
ERROR 22000: Invalid data type for the operation
select c2/c3 from t1 order by c1;
ERROR 22000: Invalid data type for the operation
select c2*c3 from t1 order by c1;
ERROR 22000: Invalid data type for the operation
select c2-c3 from t1 order by c1;
ERROR 22000: Invalid data type for the operation
select c3/0 from t1 order by c1;
ERROR HY000: Invalid argument
drop table if exists  t1;
create table t1 (c1 int , c2 sparsevector,c3 sparsevector,c4 sparsevector,vector index idx1(c3) with (distance=inner_product));
insert into t1(c1,c2,c3,c4) values(1,'{1:1.3,1:2.6}','{1:1.3,1:2.6}','{1:1.3,1:2.6}');
insert into t1(c1,c2,c3,c4) values(2,'{}','{1:false}','{1:1.3,1:2.6}');
insert into t1(c1,c2,c3,c4) values(3,'{2:3,1:2}','{}','{1:1.3,1:2.6}');
insert into t1(c1,c2,c3,c4) values(4,null,null,null);
drop table if exists  t2;
create table t2 (c1 int , c2 sparsevector,c3 sparsevector,c4 sparsevector,vector index idx1(c3) with (distance=inner_product));
insert into t2(c1,c2,c3,c4) values(6,'{1:1.3,1:2.6}','{1:1.3,1:2.6}','{1:1.3,1:2.6}');
insert into t2(c1,c2,c3,c4) values(7,'{}','{1:false}','{1:1.3,1:2.6}');
insert into t2(c1,c2,c3,c4) values(8,'{2:3,1:2}','{}','{1:1.3,1:2.6}');
insert into t2(c1,c2,c3,c4) values(9,null,null,null);
insert /*+ direct(true,100) enable_parallel_dml parallel(2) append*/ into t2 select c1,c2,c3,c4 from t1 order by negative_inner_product(c3,'{1:2}')  APPROXIMATE limit 100;
select c1,c2,c3,c4 from t2 order by negative_inner_product(c3,'{1:2}')  APPROXIMATE limit 100;
c1	c2	c3	c4
6	{1:2.6}	{1:2.6}	{1:2.6}
1	{1:2.6}	{1:2.6}	{1:2.6}
2	{}	{1:0}	{1:2.6}
7	{}	{1:0}	{1:2.6}
drop table if exists  t1;
create table t1 (c1 int,c2 sparsevector,c3 sparsevector not null,c4 sparsevector as (c2), vector index idx1(c2) with (distance=inner_product));
insert into t1(c1,c2,c3) values(1,'{1:1.3,1:2.6}','{1:1.3,1:2.6}');
insert into t1(c1,c2,c3) values(2,'{2:2}','{1:false}');
insert into t1(c1,c2,c3) values(3,'{2:3,1:2}','{}');
insert into t1(c1,c2,c3) values(4,'{1:true}','{}');
insert /*+ direct(true,100) enable_parallel_dml parallel(2) append*/into t1(c1,c2,c3) select c1,c2,c3 from t1 order by negative_inner_product(c2,c4)  limit 1;
insert /*+ direct(true,100) enable_parallel_dml parallel(2) append*/into t1(c1,c2,c3) select c1,c2,c3 from t1 order by negative_inner_product(c2,'{1:2}')  limit 1;
insert /*+ direct(true,100,'inc') enable_parallel_dml parallel(2)*/ into t1(c1,c2,c3) select c1,c2,c3 from t1 order by negative_inner_product(c2,'{2:1,2:true}')  APPROXIMATE limit 100;
insert /*+ direct(true,100,'inc') enable_parallel_dml parallel(2)*/ into t1(c1,c2,c3) select c1,c2,c3 from t1 ;
insert /*+ direct(true,100) enable_parallel_dml parallel(2) append*/into t1(c1,c2,c3) select c1,c2,c3 from t1 ;
select c1,c2,c3,c4 from t1 order by negative_inner_product(c2,'{2:1,2:true}')  APPROXIMATE limit 1;
c1	c2	c3	c4
3	{1:2,2:3}	{}	{1:2,2:3}
drop table if exists  t1;
create table t1 (c1 int,c2 sparsevector,c3 sparsevector,c4 sparsevector as (c2), vector index idx1(c2) with (distance=inner_product));
insert into t1(c1,c2,c3) values(1,'{1:1.3,1:2.6}','{1:1.3,1:2.6}');
insert into t1(c1,c2,c3) values(2,'{}','{1:false}');
insert into t1(c1,c2,c3) values(3,'{2:3,1:2}','{}');
insert into t1(c1,c2,c3) values(4,null,null);
insert /*+ direct(true,100,'inc') enable_parallel_dml parallel(2)*/ into t1(c1,c2,c3) select 10,map(1,2),map(2,3) from t1 ;
insert /*+ direct(true,100,'inc') enable_parallel_dml parallel(2)*/ into t1(c1,c2,c3) select 10,map(1,200),map(2,2) from t1 ;
drop table if exists  t1;
create table t1 (c1 int,c2 sparsevector,c3 sparsevector,c4 sparsevector , vector index idx1(c2) with (distance=inner_product));
insert into t1(c1,c2,c3) values(1,'{1:1.3,1:2.6}','{}');
insert into t1(c1,c2,c3) values(2,null,'{}');
insert /*+ direct(true,100,'inc') enable_parallel_dml parallel(2)*/ into t1(c1,c2,c3,c4) select 10,map(1,2),map(2,3),map(2,3) from t1 ;
insert /*+ direct(true,100,'inc') enable_parallel_dml parallel(2)*/ into t1(c1,c2,c3,c4) select 10,map(1,200),map(true,false),map(2,3) from t1 ;
insert /*+ direct(true,100,'inc') enable_parallel_dml parallel(2)*/ into t1(c1,c2,c3,c4) select 10,map(1,200),map(true,false),map(2,1) from t1 ;
insert /*+ direct(true,100,'inc') enable_parallel_dml parallel(2)*/ into t1(c1,c2,c3,c4) select 10,map(1,200),map(-1,false),map(2,3) from t1 ;
ERROR 22003: Out of range value for column
insert /*+ direct(true,100,'inc') enable_parallel_dml parallel(2)*/ into t1(c1,c2,c3,c4) select 10,map(1,200),map(false,-100),map(2,3) from t1 ;
drop table if exists  t1;
create table t1(c1 int primary key,c2 sparsevector,c3 vector(3),c4 varchar(200), vector index idx1(c2) with (distance=inner_product),vector index idx2(c3) with (distance=l2, type=hnsw)) partition by list columns (c1)(
PARTITION p0 VALUES in(1),
PARTITION p1 VALUES in(2),
PARTITION p2 VALUES in(3),
PARTITION p3 VALUES in(4),
PARTITION p4 VALUES in(5),
PARTITION p5 VALUES in(6),
PARTITION p6 VALUES in(7)
);
insert into t1(c1,c2,c3,c4) values(1,'{0:1.3,1:2.6}',[1,2,4],'{}');
insert into t1(c1,c2,c3,c4) values(2,'{}',[1,2,4],null);
insert into t1(c1,c2,c3,c4) values(3,'{1.123:2.123,3.123:4.123,10:2}',[1,2,4],'{1.123:2.123,3.123:4.123,10:3}');
insert into t1(c1,c2,c3,c4) values(4,'{1.123:-2}',[1,2,4],'{1.123:-1}');
select inner_product(c2,c4) from t1 order by c1;
inner_product(c2,c4)
0
NULL
27.506258964538574
2
select c1,c2,c3,c4 from t1 where c3 is not null order by negative_inner_product(c2, '{0:1.3,1:2.6}') approximate limit 100;
c1	c2	c3	c4
1	{0:1.3,1:2.6}	[1,2,4]	{}
3	{1:2.123,3:4.123,10:2}	[1,2,4]	{1.123:2.123,3.123:4.123,10:3}
4	{1:-2}	[1,2,4]	{1.123:-1}
select /*+ index(t1 idx1)*/* from t1 where  c3 =[1,2,4] and c4 is null order by l2_distance(c3, [0.712338,0.603321,0.133444]) APPROXIMATE limit 100;
c1	c2	c3	c4
2	{}	[1,2,4]	NULL
select /*+ index(t1 idx2)*/* from t1 where  c3 =[1,2,4] and c4 is null order by negative_inner_product(c2, '{0:1.3,1:2.6}') approximate  limit 1;
c1	c2	c3	c4
select /*+ index(t1 idx1)*/* from t1 where  c3 =[1,2,4] and c4 is null order by negative_inner_product(c2, '{0:1.3,1:2.6}') approximate  limit 1;
c1	c2	c3	c4
drop materialized view if exists mv1;
create materialized view mv1  parallel 10 refresh complete on demand  as select c1,c2,c3,c4 from t1 ;
replace into t1(c1,c2,c3,c4) values(6,'{0:1.3,1:2.6}',[1,2,4],'{}');
replace into t1(c1,c2,c3,c4) values(7,'{}',[1,2,4],null);
replace into t1(c1,c2,c3,c4) values(7,'{1.123:2.123,3.123:4.123,10:1}',[1,2,4],'{1.123:2.123,3.123:4.123,10:2}');
CALL DBMS_MVIEW.REFRESH('mv1');
create index idx3 on mv1(c1) global;
create index idx4 on t1(c1) global;
select /*+index(t1 vector_idx) */c1,c2,c3,c4 from t1 where c3 =c3 order by negative_inner_product(c2,c4)   limit 1;
c1	c2	c3	c4
2	{}	[1,2,4]	NULL
drop table if exists  t1;
create table t1(c1 int primary key,c2 sparsevector,c3 vector(3),c4 varchar(200), vector index idx1(c2) with (distance=inner_product),vector index idx2(c3) with (distance=l2, type=hnsw)) partition by list columns (c1)(
PARTITION p0 VALUES in(1),
PARTITION p1 VALUES in(2),
PARTITION p2 VALUES in(3),
PARTITION p3 VALUES in(4),
PARTITION p4 VALUES in(5),
PARTITION p5 VALUES in(6),
PARTITION p6 VALUES in(7)
);
insert into t1(c1,c2,c3,c4) values(1,'{0:1.3,1:2.6}',[1,3,4],'{}');
insert into t1(c1,c2,c3,c4) values(2,'{}',[1,67,4],null);
insert into t1(c1,c2,c3,c4) values(3,'{1.123:2.123,3.123:4.123,10:2}',[1,5,4],'{1.123:2.123,3.123:4.123,10:3}');
insert into t1(c1,c2,c3,c4) values(4,'{1.123:-2}',[1,1,4],'{1.123:-1}');
ALTER TABLE t1 TRUNCATE PARTITION p0;
call dbms_vector.rebuild_index('idx2','t1','c2');
ERROR HY000: Invalid argument
drop view if exists  v1;
create view v1 as select * from t1;
INSERT into v1 values(7,'{2:true,1:2,0:0,1:100,0:-1,9:99}','[1,4,43]','{1.123:-1}') ON DUPLICATE KEY UPDATE c2='{}',c4='{1:2}';
ALTER TABLE t1 PARTITION BY hash(c1) PARTITIONS 10;
ERROR 0A000: Run this DDL operation on table with sparse vector index not supported
select inner_product(c2,c4) from v1 order by c1;
inner_product(c2,c4)
NULL
27.506258964538574
2
-100
select /*+log_level(DEBUG) no_rewrite */inner_product(c2,c4) from v1 order by c1;
inner_product(c2,c4)
NULL
27.506258964538574
2
-100
select /*+ ENABLE_PARALLEL_DML parallel(256) */inner_product(c2,c4) from v1 order by c1;
inner_product(c2,c4)
NULL
27.506258964538574
2
-100
select /*+ OPT_PARAM('rowsets_enabled', 'FALSE') */inner_product(c2,c4) from v1 order by c1;
inner_product(c2,c4)
NULL
27.506258964538574
2
-100
select /*+ OPT_PARAM('enable_rich_vector_format', 'FALSE') */inner_product(c2,c4) from v1 order by c1;
inner_product(c2,c4)
NULL
27.506258964538574
2
-100
select * from t1 PARTITION(p2) order by negative_inner_product(c2, '{1:2,2:2000}') APPROXIMATE limit 100;
c1	c2	c3	c4
3	{1:2.123,3:4.123,10:2}	[1,5,4]	{1.123:2.123,3.123:4.123,10:3}
select * from t1 PARTITION(p2) order by negative_inner_product(c3, [0.712338,0.603321,0.133444]) APPROXIMATE limit 100;
c1	c2	c3	c4
3	{1:2.123,3:4.123,10:2}	[1,5,4]	{1.123:2.123,3.123:4.123,10:3}
select * from t1 PARTITION(p2) order by negative_inner_product(c3, c3) APPROXIMATE limit 100;
ERROR 0A000: Using vector index without const param is not supported
select * from t1 PARTITION(p2) order by negative_inner_product(c3, '{}') APPROXIMATE limit 100;
ERROR HY000: Invalid argument
select inner_product(c2,c4) from t1 order by l2_distance(c3, [0.712338,0.603321,0.133444]) APPROXIMATE limit 100;
inner_product(c2,c4)
2
27.506258964538574
-100
NULL
select /*+read_consistency(weak) */inner_product(c2,c4) from t1 order by l2_distance(c3, [0.712338,0.603321,0.133444]) APPROXIMATE limit 100;
inner_product(c2,c4)
2
27.506258964538574
-100
NULL
select /*+log_level(DEBUG) no_rewrite */inner_product(c2,c4) from t1 order by l2_distance(c3, [0.712338,0.603321,0.133444]) APPROXIMATE limit 100;
inner_product(c2,c4)
2
27.506258964538574
-100
NULL
select /*+ ENABLE_PARALLEL_DML parallel(256) */inner_product(c2,c4) from t1 order by l2_distance(c3, [0.712338,0.603321,0.133444]) APPROXIMATE limit 100;
inner_product(c2,c4)
2
27.506258964538574
-100
NULL
select /*+ OPT_PARAM('rowsets_enabled', 'FALSE') */inner_product(c2,c4) from t1 order by l2_distance(c3, [0.712338,0.603321,0.133444]) APPROXIMATE limit 100;
inner_product(c2,c4)
2
27.506258964538574
-100
NULL
select /*+ OPT_PARAM('enable_rich_vector_format', 'FALSE') */inner_product(c2,c4) from t1 order by l2_distance(c3, [0.712338,0.603321,0.133444]) APPROXIMATE limit 100;
inner_product(c2,c4)
2
27.506258964538574
-100
NULL
drop table if exists  t1;
create table t1(c1 int primary key,c2 sparsevector,c3 vector(3),c4 varchar(200), vector index idx1(c2) with (distance=inner_product),vector index idx2(c3) with (distance=l2, type=hnsw));
insert into t1(c1,c2,c3,c4) values(1,'{0:1.3,1:2.6}',[1,2,4],'{}');
insert into t1(c1,c2,c3,c4) values(2,'{}',[1,2,4],null);
insert into t1(c1,c2,c3,c4) values(3,'{1.123:2.123,3.123:4.123,10:2}',[1,2,4],'{1.123:2.123,3.123:4.123,10:3}');
insert into t1(c1,c2,c3,c4) values(4,'{1.123:-2}',[1,2,4],'{1.123:-1}');
ALTER TABLE t1 PARTITION BY hash(c1) PARTITIONS 10;
ERROR 0A000: Run this DDL operation on table with sparse vector index not supported
drop view if exists  v1;
create view v1 as select * from t1;
replace into v1(c1,c2,c3,c4) values(5,'{2:true,1:2,0:0,1:100,0:-1,9:99}',[1,2,43],'{1.123:-1}');
replace into v1(c1,c2,c3,c4) values(6,null,null,null);
insert into v1(c1,c2,c3,c4) values(6,null,null,null);
ERROR 23000: Duplicate entry '6' for key 'PRIMARY'
drop table if exists  t1;
create table t1(c1 int primary key,c2 sparsevector,c3 vector(3),c4 varchar(200), vector index idx1(c2) with (distance=inner_product),vector index idx2(c3) with (distance=l2, type=hnsw));
insert into t1(c1,c2,c3,c4) values(1,'{0:1.3,1:2.6}',[1,2,4],'{}');
insert into t1(c1,c2,c3,c4) values(2,'{}',[1,2,4],null);
insert into t1(c1,c2,c3,c4) values(3,'{1.123:2.123,3.123:4.123,10:2}',[1,2,4],'{1.123:2.123,3.123:4.123,10:3}');
insert into t1(c1,c2,c3,c4) values(4,'{1.123:-2}',[1,2,4],'{1.123:-1}');
ALTER TABLE t1 PARTITION BY hash(c1) PARTITIONS 10;
ERROR 0A000: Run this DDL operation on table with sparse vector index not supported
select inner_product(c2,c4) from t1 order by l2_distance(c3, [0.712338,0.603321,0.133444]) APPROXIMATE limit 100;
inner_product(c2,c4)
0
NULL
27.506258964538574
2
select inner_product(c2,c4) from t1 order by negative_inner_product(c2, '{1:2,3:4,5:6}') APPROXIMATE limit 100;
inner_product(c2,c4)
27.506258964538574
0
2
select /*+read_consistency(weak) */inner_product(c2,c4) from t1 order by negative_inner_product(c2, '{1:2,3:4,5:6}') APPROXIMATE limit 100;
inner_product(c2,c4)
27.506258964538574
0
2
select /*+log_level(DEBUG) no_rewrite */inner_product(c2,c4) from t1 order by negative_inner_product(c2, '{1:2,3:4,5:6}') APPROXIMATE limit 100;
inner_product(c2,c4)
27.506258964538574
0
2
select /*+ ENABLE_PARALLEL_DML parallel(256) */inner_product(c2,c4) from t1 order by negative_inner_product(c2, '{1:2,3:4,5:6}') APPROXIMATE limit 100;
inner_product(c2,c4)
27.506258964538574
0
2
select /*+ OPT_PARAM('rowsets_enabled', 'FALSE') */inner_product(c2,c4) from t1 order by negative_inner_product(c2, '{1:2,3:4,5:6}') APPROXIMATE limit 100;
inner_product(c2,c4)
27.506258964538574
0
2
select /*+ OPT_PARAM('enable_rich_vector_format', 'FALSE') */inner_product(c2,c4) from t1 order by negative_inner_product(c2, '{1:2,3:4,5:6}') APPROXIMATE limit 100;
inner_product(c2,c4)
27.506258964538574
0
2
update t1 set c2='{2:3}' where c1 =1;
update /*+ ENABLE_PARALLEL_DML parallel(256) */t1 set c2='{4:3,1000:2}' where c1 =1;
truncate t1;
CREATE VECTOR INDEX vec_idx1 ON t1(c3) WITH (distance=inner_product);
ERROR 0A000: create vector index on column has vector index is not supported
CREATE VECTOR INDEX vec_idx1 ON t1(c2) WITH (distance=inner_product);
ERROR 0A000: build sparse vector index afterward is not supported
drop table if exists  t1;
create table t1 (c1 int primary key,c2 sparsevector comment '注释c2',c3 sparsevector comment '注释c3',c4 varchar(200) comment '注释c4', vector index idx1(c2) with (distance=inner_product), vector index idx2(c3) with (distance=inner_product));
insert into t1(c1,c2,c3,c4) values(1,'{1:1.3,1:2.6}','{1:1.3,1:2.6}','{1:1.3,1:2.6}');
insert into t1(c1,c2,c3,c4) values(2,'{}','{1:false}','{1:1.3,1:2.6}');
insert into t1(c1,c2,c3,c4) values(3,'{2:3,1:2}','{}','{1:1.3,1:2.6}');
insert into t1(c1,c2,c3,c4) values(4,null,null,null);
select inner_product(c4,c2) from t1 order by c1;
inner_product(c4,c2)
6.7599992752075195
0
5.199999809265137
NULL
select /*+log_level(DEBUG) no_rewrite */inner_product(c4,c2) from t1 order by c1;
inner_product(c4,c2)
6.7599992752075195
0
5.199999809265137
NULL
select /*+ ENABLE_PARALLEL_DML parallel(256) */inner_product(c4,c2) from t1 order by c1;
inner_product(c4,c2)
6.7599992752075195
0
5.199999809265137
NULL
select /*+ OPT_PARAM('rowsets_enabled', 'FALSE') */inner_product(c4,c2) from t1 order by c1;
inner_product(c4,c2)
6.7599992752075195
0
5.199999809265137
NULL
select /*+ OPT_PARAM('enable_rich_vector_format', 'FALSE') */inner_product(c4,c2) from t1 order by c1;
inner_product(c4,c2)
6.7599992752075195
0
5.199999809265137
NULL
select inner_product(c2,c4) from t1 order by c1;
inner_product(c2,c4)
6.7599992752075195
0
5.199999809265137
NULL
select /*+log_level(DEBUG) no_rewrite */c1,inner_product(c2,c4) from t1 order by c1;
c1	inner_product(c2,c4)
1	6.7599992752075195
2	0
3	5.199999809265137
4	NULL
select /*+ ENABLE_PARALLEL_DML parallel(256) */c1,inner_product(c2,c4) from t1 order by c1;
c1	inner_product(c2,c4)
1	6.7599992752075195
2	0
3	5.199999809265137
4	NULL
select /*+ OPT_PARAM('rowsets_enabled', 'FALSE') */c1,inner_product(c2,c4) from t1 order by c1;
c1	inner_product(c2,c4)
1	6.7599992752075195
2	0
3	5.199999809265137
4	NULL
select /*+ OPT_PARAM('enable_rich_vector_format', 'FALSE') */c1,inner_product(c2,c4) from t1 order by c1;
c1	inner_product(c2,c4)
1	6.7599992752075195
2	0
3	5.199999809265137
4	NULL
drop table if exists  tt1;
Warnings:
Note	1051	Unknown table 'obljh.tt1'
create table tt1 like t1;
replace into tt1 select /*+ OPT_PARAM('enable_rich_vector_format', 'FALSE') */* from t1 order by c1;
select inner_product(tt1.c2,t1.c2) from tt1,t1 where inner_product(tt1.c2,t1.c4)=inner_product(tt1.c2,t1.c3) order by negative_inner_product(t1.c2,'{1:2,2:20000}')  APPROXIMATE limit 1;
inner_product(tt1.c2,t1.c2)
6.7599992752075195
select /*+read_consistency(weak) */inner_product(tt1.c2,t1.c2) from tt1,t1 where inner_product(tt1.c2,t1.c4)=inner_product(tt1.c2,t1.c3) order by negative_inner_product(t1.c2,'{1:2,2:20000}')  APPROXIMATE limit 1;
inner_product(tt1.c2,t1.c2)
6.7599992752075195
select /*+log_level(DEBUG) no_rewrite */inner_product(tt1.c2,t1.c2) from tt1,t1 where inner_product(tt1.c2,t1.c4)=inner_product(tt1.c2,t1.c3) order by negative_inner_product(t1.c2,'{1:2,2:20000}')  APPROXIMATE limit 1;
inner_product(tt1.c2,t1.c2)
6.7599992752075195
select /*+ ENABLE_PARALLEL_DML parallel(256) */inner_product(tt1.c2,t1.c2) from tt1,t1 where inner_product(tt1.c2,t1.c4)=inner_product(tt1.c2,t1.c3) order by negative_inner_product(t1.c2,'{1:2,2:20000}')  APPROXIMATE limit 1;
inner_product(tt1.c2,t1.c2)
6.7599992752075195
select /*+ OPT_PARAM('rowsets_enabled', 'FALSE') */inner_product(tt1.c2,t1.c2)  from tt1,t1 where inner_product(tt1.c2,t1.c4)=inner_product(tt1.c2,t1.c3) order by negative_inner_product(t1.c2,'{1:2,2:20000}')  APPROXIMATE limit 1;
inner_product(tt1.c2,t1.c2)
6.7599992752075195
select /*+ OPT_PARAM('enable_rich_vector_format', 'FALSE') */inner_product(tt1.c2,t1.c2) from tt1,t1 where inner_product(tt1.c2,t1.c4)=inner_product(tt1.c2,t1.c3) order by negative_inner_product(t1.c2,'{1:2,2:20000}')  APPROXIMATE limit 1;
inner_product(tt1.c2,t1.c2)
6.7599992752075195
select /*+log_level(DEBUG) no_rewrite */t1.* from t1 t1 join tt1 tt1 on inner_product(tt1.c2,t1.c3)=inner_product(tt1.c2,t1.c3) union select /*+log_level(DEBUG) no_rewrite */t1.* from t1 t1 join tt1 tt1 on inner_product(tt1.c2,t1.c3)=inner_product(tt1.c2,t1.c3) ;
c1	c2	c3	c4
1	{1:2.6}	{1:2.6}	{1:1.3,1:2.6}
2	{}	{1:0}	{1:1.3,1:2.6}
3	{1:2,2:3}	{}	{1:1.3,1:2.6}
select /*+ OPT_PARAM('rowsets_enabled', 'FALSE') */t1.* from t1 t1 join tt1 tt1 on inner_product(tt1.c2,t1.c4)=inner_product(tt1.c2,t1.c4) union select /*+ OPT_PARAM('rowsets_enabled', 'FALSE') */t1.* from t1 t1 join tt1 tt1 on inner_product(tt1.c2,t1.c4)=inner_product(tt1.c2,t1.c4) ;
c1	c2	c3	c4
1	{1:2.6}	{1:2.6}	{1:1.3,1:2.6}
2	{}	{1:0}	{1:1.3,1:2.6}
3	{1:2,2:3}	{}	{1:1.3,1:2.6}
select /*+ OPT_PARAM('enable_rich_vector_format', 'FALSE') */t1.* from t1 t1 join tt1 tt1 on inner_product(tt1.c2,t1.c4)=inner_product(tt1.c2,t1.c4) union select /*+ OPT_PARAM('enable_rich_vector_format', 'FALSE') */t1.* from t1 t1 join tt1 tt1 on inner_product(tt1.c2,t1.c4)=inner_product(tt1.c2,t1.c4);
c1	c2	c3	c4
1	{1:2.6}	{1:2.6}	{1:1.3,1:2.6}
2	{}	{1:0}	{1:1.3,1:2.6}
3	{1:2,2:3}	{}	{1:1.3,1:2.6}
select /*+ ENABLE_PARALLEL_DML parallel(256) */t1.* from t1 t1 join tt1 tt1 on inner_product(tt1.c2,t1.c4)=inner_product(tt1.c2,t1.c4) union select /*+ ENABLE_PARALLEL_DML parallel(256) */t1.* from t1 t1 join tt1 tt1 on inner_product(tt1.c2,t1.c4)=inner_product(tt1.c2,t1.c4);
ERROR 22000: Invalid data type for the operation
select /*+log_level(DEBUG) no_rewrite */t1.* from t1 t1 join tt1 tt1 on inner_product(tt1.c2,t1.c2)=inner_product(tt1.c2,t1.c2) union select /*+log_level(DEBUG) no_rewrite */t1.* from t1 t1 join tt1 tt1 on inner_product(tt1.c2,t1.c4)=inner_product(tt1.c2,t1.c4);
c1	c2	c3	c4
1	{1:2.6}	{1:2.6}	{1:1.3,1:2.6}
2	{}	{1:0}	{1:1.3,1:2.6}
3	{1:2,2:3}	{}	{1:1.3,1:2.6}
select /*+ OPT_PARAM('rowsets_enabled', 'FALSE') */t1.* from t1 t1 join tt1 tt1 on inner_product(tt1.c2,t1.c2)=inner_product(tt1.c2,t1.c2) union select /*+ OPT_PARAM('rowsets_enabled', 'FALSE') */t1.* from t1 t1 join tt1 tt1 on inner_product(tt1.c2,t1.c4)=inner_product(tt1.c2,t1.c4);
c1	c2	c3	c4
1	{1:2.6}	{1:2.6}	{1:1.3,1:2.6}
2	{}	{1:0}	{1:1.3,1:2.6}
3	{1:2,2:3}	{}	{1:1.3,1:2.6}
select /*+ OPT_PARAM('enable_rich_vector_format', 'FALSE') */t1.* from t1 t1 join tt1 tt1 on inner_product(tt1.c2,t1.c2)=inner_product(tt1.c2,t1.c2) union select /*+ OPT_PARAM('enable_rich_vector_format', 'FALSE') */t1.* from t1 t1 join tt1 tt1 on inner_product(tt1.c2,t1.c3)=inner_product(tt1.c2,t1.c3);
c1	c2	c3	c4
1	{1:2.6}	{1:2.6}	{1:1.3,1:2.6}
2	{}	{1:0}	{1:1.3,1:2.6}
3	{1:2,2:3}	{}	{1:1.3,1:2.6}
########清空回收站，删除测试数据库，表等 ##########
drop database  IF EXISTS  obljh;
purge recyclebin;
