alter system ob_vector_memory_limit_percentage=30;
select sleep(5);
sleep(5)
0


"=========================================== delete standard ==========================================="
drop table if exists t;
drop table if exists t1;
create table t(c1 int, c2 vector(3), c3 vector(4), primary key(c1), vector index idx1(c2) with (distance=cosine, type=hnsw)) partition by range(c1) (partition p0 values less than (100),partition p1 values less than (1000),partition p2 values less than (10000),partition p3 values less than (100000),partition p4 values less than (1000000));
select * from t order by cosine_distance(c2, '[397583, 541347, -65783.73]') approx limit 3;
c1	c2	c3
4	[397583,541347,-65783.7]	[-747523,-438597,-690027,-97203.1]
10002	[343429,439714,0.979698]	[-72930.4,-0.609663,-0.471619,0.998431]
109	[0.218711,465897,-44697.2]	[-96395.5,0.670629,-78181.5,0.329958]
select * from t order by cosine_distance(c2, '[397583, 541347, -65783.73]') limit 3;
c1	c2	c3
4	[397583,541347,-65783.7]	[-747523,-438597,-690027,-97203.1]
10002	[343429,439714,0.979698]	[-72930.4,-0.609663,-0.471619,0.998431]
109	[0.218711,465897,-44697.2]	[-96395.5,0.670629,-78181.5,0.329958]
delete from t order by cosine_distance(c2, '[397583, 541347, -65783.73]') limit 3;
select * from t order by cosine_distance(c2, '[397583, 541347, -65783.73]') approx limit 3;
c1	c2	c3
5	[0.179629,430819,-65217.3]	[-724966,219967,-739239,-0.571165]
100003	[0.722868,263971,0.217136]	[166625,0.26823,0.052328,0.534109]
100009	[-0.352528,298886,0.320923]	[-907820,274839,-952298,-8038.5]
select * from t order by cosine_distance(c2, '[397583, 541347, -65783.73]') limit 3;
c1	c2	c3
5	[0.179629,430819,-65217.3]	[-724966,219967,-739239,-0.571165]
100003	[0.722868,263971,0.217136]	[166625,0.26823,0.052328,0.534109]
100009	[-0.352528,298886,0.320923]	[-907820,274839,-952298,-8038.5]
create table t1(a1 int, a2 vector(3));
insert into t1 select c1,c2 from t where c1<100;
delete t from t join t1 on t.c1=t1.a1 where c1<100;
select * from t1;
a1	a2
1	[42226.9,31946.8,233055]
2	[-823198,-0.217028,93069.8]
3	[-32020.6,75127.9,0.77094]
5	[0.179629,430819,-65217.3]
6	[-0.253108,-0.613931,-874511]
7	[-319792,0.376752,14152]
8	[-970769,-13483,254267]
9	[-0.884688,98861.2,-535325]
10	[0.578781,-0.058835,-746529]
select * from t;
c1	c2	c3
101	[-22158.2,0.512567,-5659]	[50244.1,-6531.87,-0.508316,-228316]
102	[-0.486493,-0.944789,439948]	[-656128,0.841715,4706.49,-56339]
103	[-57512,445269,-19096.8]	[-0.939627,-0.833651,0.139458,-75281.8]
104	[157360,-83220,24803]	[-125725,-650260,-17108.7,832224]
105	[473641,-0.149836,355051]	[-858328,-0.545063,0.303736,-62990.1]
106	[-77417.7,65883.3,0.681227]	[-0.285769,270614,-16362.1,-130630]
107	[757225,-66493.4,-213406]	[-0.111738,0.688164,-603596,-764143]
108	[25381.3,-36646.2,-81309.8]	[-355875,-277764,21811,0.052467]
110	[-0.201769,-0.220271,0.150037]	[-455053,-96612.3,-583978,-0.615918]
1001	[57811.3,-0.214074,0.115481]	[-0.776308,-794251,-0.972245,448946]
1002	[-0.871165,0.502377,-92192.8]	[0.601641,0.536642,-69678.3,-154154]
1003	[645362,-226965,526258]	[-126709,-772253,-4315.65,0.055967]
1004	[34691,-0.247566,-0.868466]	[-0.899574,877090,-577067,-87680.9]
1005	[0.478095,-7136.01,126378]	[0.779142,244780,0.875969,-13970.2]
1006	[0.239433,-605871,61395.8]	[25435.7,0.185164,426302,-547177]
1007	[-51915.9,508281,116383]	[-0.609978,-0.636346,-0.142706,-92326.7]
1008	[367605,51923.8,807613]	[-0.890944,-0.107754,31463,200530]
1009	[-719458,81915.1,-0.207763]	[0.376095,904052,932008,-776846]
1010	[762802,-0.970555,252311]	[0.534972,-0.752701,-6701.45,-76545]
10001	[-43769.2,44633.6,57298]	[1949.23,303041,72542.6,-301216]
10003	[0.450559,-403340,727544]	[996579,470552,-46358,-68583.3]
10004	[-43597,-56812.9,-0.976134]	[-35436.3,-0.658155,0.164836,65891.6]
10005	[-0.546647,0.085977,-432903]	[580521,509194,10281,488413]
10006	[-0.618333,-0.402319,94610.1]	[968018,-52954.6,0.156552,-81220.9]
10007	[-88010.2,0.511376,82124.7]	[70797.9,-0.37462,11044,36229.6]
10008	[-98503,408683,186061]	[-13081,761953,90037.4,-76073.7]
10009	[-426621,216651,0.50529]	[-33180.2,-0.600476,0.160138,-0.453023]
10010	[512149,-0.632866,0.328226]	[23706.8,-0.168282,24591.1,32158.5]
100001	[966457,54472.6,72794.2]	[0.597617,-18206,-0.378432,406036]
100002	[26778.7,-29305,0.019109]	[-958337,0.256426,-704725,296150]
100003	[0.722868,263971,0.217136]	[166625,0.26823,0.052328,0.534109]
100004	[0.649972,-0.323987,571442]	[-16366,57795.1,-72511.8,-242474]
100005	[-0.934345,-49343.8,0.913269]	[76492.8,-242207,-0.214888,-0.784362]
100006	[-77282.2,-38667,88183.8]	[-14085.5,962186,0.049489,-206037]
100007	[0.673657,-2357.65,66711.1]	[6650.41,119421,875021,284071]
100008	[-14366.4,22842.5,279158]	[360894,-135705,36872.5,-0.445259]
100009	[-0.352528,298886,0.320923]	[-907820,274839,-952298,-8038.5]
100010	[-800085,-906594,-0.381223]	[658934,0.257607,-91720.5,0.883427]
select * from t left join t1 on t.c1%2=0 order by cosine_distance(c2, '[397583, 541347, -65783.73]') approx limit 3;
c1	c2	c3	a1	a2
100003	[0.722868,263971,0.217136]	[166625,0.26823,0.052328,0.534109]	NULL	NULL
100009	[-0.352528,298886,0.320923]	[-907820,274839,-952298,-8038.5]	NULL	NULL
103	[-57512,445269,-19096.8]	[-0.939627,-0.833651,0.139458,-75281.8]	NULL	NULL
select * from t right join t1 on t.c1%2=0 order by cosine_distance(c2, '[397583, 541347, -65783.73]') approx limit 3;
c1	c2	c3	a1	a2
10010	[512149,-0.632866,0.328226]	[23706.8,-0.168282,24591.1,32158.5]	3	[-32020.6,75127.9,0.77094]
10010	[512149,-0.632866,0.328226]	[23706.8,-0.168282,24591.1,32158.5]	1	[42226.9,31946.8,233055]
10010	[512149,-0.632866,0.328226]	[23706.8,-0.168282,24591.1,32158.5]	2	[-823198,-0.217028,93069.8]
select * from t inner join t1 on t.c1%2=0 order by cosine_distance(c2, '[397583, 541347, -65783.73]') approx limit 3;
c1	c2	c3	a1	a2
10010	[512149,-0.632866,0.328226]	[23706.8,-0.168282,24591.1,32158.5]	3	[-32020.6,75127.9,0.77094]
10010	[512149,-0.632866,0.328226]	[23706.8,-0.168282,24591.1,32158.5]	1	[42226.9,31946.8,233055]
10010	[512149,-0.632866,0.328226]	[23706.8,-0.168282,24591.1,32158.5]	2	[-823198,-0.217028,93069.8]
select * from t full join t1 on t.c1%2=0 order by cosine_distance(c2, '[397583, 541347, -65783.73]') approx limit 3;
c1	c2	c3	a1	a2
100003	[0.722868,263971,0.217136]	[166625,0.26823,0.052328,0.534109]	NULL	NULL
100009	[-0.352528,298886,0.320923]	[-907820,274839,-952298,-8038.5]	NULL	NULL
103	[-57512,445269,-19096.8]	[-0.939627,-0.833651,0.139458,-75281.8]	NULL	NULL
drop table if exists t;
drop table if exists t1;
create table t(c1 int, c2 vector(3), c3 vector(4), primary key(c1), vector index idx1(c2) with (distance=cosine, type=hnsw)) partition by range(c1) (partition p0 values less than (100),partition p1 values less than (1000),partition p2 values less than (10000),partition p3 values less than (100000),partition p4 values less than (1000000));
create table t1(a1 int, a2 vector(3));
insert into t1 select c1,c2 from t where c1<100;
delete t,t1 from t,t1 where t.c1=t1.a1;
select * from t order by cosine_distance(c2, '[-823198, -0.217028, 93069.8]') approx limit 3;
c1	c2	c3
1009	[-719458,81915.1,-0.207763]	[0.376095,904052,932008,-776846]
101	[-22158.2,0.512567,-5659]	[50244.1,-6531.87,-0.508316,-228316]
10009	[-426621,216651,0.50529]	[-33180.2,-0.600476,0.160138,-0.453023]
delete from t;
insert into t1 select c1,c2 from t where c1<100;
delete from t,t1 using t,t1 where t.c1=t1.a1;
select * from t order by cosine_distance(c2, '[-823198, -0.217028, 93069.8]') approx limit 3;
c1	c2	c3
1009	[-719458,81915.1,-0.207763]	[0.376095,904052,932008,-776846]
101	[-22158.2,0.512567,-5659]	[50244.1,-6531.87,-0.508316,-228316]
10009	[-426621,216651,0.50529]	[-33180.2,-0.600476,0.160138,-0.453023]
alter system set ob_vector_memory_limit_percentage =0;
