alter system ob_vector_memory_limit_percentage=30;
select sleep(5);
sleep(5)
0


"=========================================== partition insert ==========================================="
drop table if exists t;
create table t(c1 int, c2 vector(3), c3 vector(4), primary key(c1), vector index idx1(c2) with (distance=cosine, type=hnsw)) partition by range(c1) (partition p0 values less than (100),partition p1 values less than (1000),partition p2 values less than (10000),partition p5 values less than (1000000));
insert into t values (1, '[1,2,null]', '[1,2,3,4]');
ERROR 42000: Null value
insert into t(c1,c2,c3) values(1, '[42226.92, 31946.81, 233055]', '[89901, -32357.13, -684691, -497660]'), (2, '[-823198, -0.217028, 93069.8]', '[-80656.59, 276444, -29188.05, 251778]'), (3, '[-32020.59, 75127.92, 0.77094]', '[180226, -0.297448, -0.750788, -67573.91]');
insert into t(c1,c2,c3) values(101, '[-22158.19, 0.512567, -5659]', '[50244.14, -6531.867, -0.508316, -228316]');
insert into t(c1,c2,c3) values(102, '[-0.486493, -0.944789, 439948]', '[-656128, 0.841715, 4706.487, -56339]');
insert into t(c1,c2,c3) values(103, '[-57512, 445269, -19096.84]', '[-0.939627, -0.833651, 0.139458, -75281.79]');
insert into t(c1,c2,c3) values(1, '[1, 1, 1]', '[89901, -32357.13, -684691, -497660]'), (4, '[397583, 541347, -65783.73]', '[-747523, -438597, -690027, -97203.09]');
ERROR 23000: Duplicate entry '1' for key 'PRIMARY'
insert ignore into t(c1,c2,c3) values(1, '[1, 1, 1]', '[89901, -32357.13, -684691, -497660]'), (4, '[397583, 541347, -65783.73]', '[-747523, -438597, -690027, -97203.09]');
select c1,c2 from t partition(p0) order by cosine_distance(c2, '[397583, 541347, -65783.73]') approx limit 1;
c1	c2
4	[397583,541347,-65783.7]
insert into t(c1,c2,c3) values(1, '[42226.92, 31946.81, 233055]', '[89901, -32357.13, -684691, -497660]'), (1, '[42226.92, 31946.81, 233055]', '[89901, -32357.13, -684691, -497660]') on duplicate key update c1 = 100;
the same result
select * from (select /*+ parallel(10) */ c1,c2 from t order by cosine_distance(c2, '[42226.92, 31946.81, 233055]') approx limit 2) order by c1;
c1	c2
1	[42226.9,31946.8,233055]
100	[42226.9,31946.8,233055]
select * from (select /*+ parallel(10) index(t idx1) */ c1,c2 from t order by cosine_distance(c2, '[42226.92, 31946.81, 233055]') approx limit 2) order by c1;
c1	c2
1	[42226.9,31946.8,233055]
100	[42226.9,31946.8,233055]
select * from (select /*+ parallel(10) index(t idx1) */ c1,c2 from t order by cosine_distance(c2, '[42226.92, 31946.81, 233055]') limit 2) order by c1;
c1	c2
1	[42226.9,31946.8,233055]
100	[42226.9,31946.8,233055]
insert /*+ parallel(2) index(t idx1) */ t partition(p0,p1,p2) (c1,c2,c3) values(5, '[0.179629, 430819, -65217.32]', '[-724966, 219967, -739239, -0.571165]'),(104, '[157360, -83220.03, 24802.96]', '[-125725, -650260, -17108.74, 832224]'),(1001, '[57811.27, -0.214074, 0.115481]', '[-0.776308, -794251, -0.972245, 448946]');
select * from t order by cosine_distance(c2, '[57811.3,-0.214074,0.115481]') approx limit 1;
c1	c2	c3
1001	[57811.3,-0.214074,0.115481]	[-0.776308,-794251,-0.972245,448946]


"=========================================== replace into partition ==========================================="
drop table if exists t;
drop table if exists t1;
create table t(c1 int, c2 vector(3), c3 vector(4), primary key(c1), vector index idx1(c2) with (distance=cosine, type=hnsw)) partition by range(c1) (partition p0 values less than (100),partition p1 values less than (1000),partition p2 values less than (10000),partition p3 values less than (100000),partition p4 values less than (1000000));
select c1,c2 from t order by cosine_distance(c2, '[42226.92, 31946.81, 233055]') limit 1;
c1	c2
117	[0.676613,20832,97703.3]
select c1,c2 from t order by cosine_distance(c2, '[42226.92, 31946.81, 233055]') approx limit 1;
c1	c2
117	[0.676613,20832,97703.3]
replace into t partition(p0,p1) (c1,c2,c3) values (1,'[1,1,1]','[1,1,1,1]'), (2,'[2,2,2]','[2,2,2,2]');
select c1,c2 from t order by cosine_distance(c2,'[1,1,1]') limit 1;
c1	c2
1	[1,1,1]
select c1,c2 from t order by cosine_distance(c2,'[1,1,1]') approx limit 1;
c1	c2
1	[1,1,1]


"=========================================== insert into select ==========================================="
drop table if exists t;
drop table if exists t1;
create table t(c1 int, c2 vector(3), c3 vector(4), primary key(c1), vector index idx1(c2) with (distance=cosine, type=hnsw)) partition by range(c1) (partition p0 values less than (100),partition p1 values less than (1000),partition p2 values less than (10000),partition p3 values less than (100000),partition p4 values less than (1000000));
create table t1(c1 int, c2 vector(3), c3 vector(4), primary key(c1), vector index idx1(c2) with (distance=cosine, type=hnsw)) partition by range(c1) (partition p0 values less than (100),partition p1 values less than (1000),partition p2 values less than (10000),partition p3 values less than (100000),partition p4 values less than (1000000));
insert /*+ direct(true, 0, 'inc') enable_parallel_dml(3)*/ into t1 select * from t partition(p0) order by cosine_distance(c2, '[0.179629, 430819, -65217.32]') approx limit 50;
ERROR 0A000: direct-load does not support table has generated column
insert /*+ direct(false, 0, 'inc') enable_parallel_dml(4)*/ into t1 select * from t partition(p1) order by cosine_distance(c2, '[0.179629, 430819, -65217.32]') approx limit 50;
ERROR 0A000: direct-load does not support table has generated column
insert /*+ direct(true, 0, 'full') enable_parallel_dml(5)*/ into t1 select * from t partition(p2) order by cosine_distance(c2, '[0.179629, 430819, -65217.32]') approx limit 50;
ERROR 0A000: direct-load does not support table has generated column
insert /*+ direct(false, 0, 'full') enable_parallel_dml(6)*/ into t1 select * from t partition(p3) order by cosine_distance(c2, '[0.179629, 430819, -65217.32]') approx limit 50;
ERROR 0A000: direct-load does not support table has generated column
select t1.c1 from t,t1 where t.c3=t1.c3 order by cosine_distance(t1.c2, '[0.179629, 430819, -65217.32]') approx limit 1;
c1


"=========================================== insert into view ==========================================="
drop table if exists t;
drop view if exists v;
create table t(c1 int, c2 vector(3), c3 vector(4), primary key(c1), vector index idx1(c2) with (distance=cosine, type=hnsw)) partition by range(c1) (partition p0 values less than (100),partition p1 values less than (1000),partition p2 values less than (10000),partition p3 values less than (100000),partition p4 values less than (1000000));
create view v (a1,a2) as select c1,c2 from t partition(p0,p1) where c1<=105 order by cosine_distance(c2, '[0.179629, 430819, -65217.32]') approx limit 20;
select c1,a2 from t,v where t.c1=v.a1 and v.a1<5 order by cosine_distance(c2, '[-823198, -0.217028, 93069.8]') approx limit 3;
c1	a2
2	[-823198,-0.217028,93069.8]
select c1,a2 from t,v where t.c1=v.a1 and v.a1<5 order by cosine_distance(c2, '[-823198, -0.217028, 93069.8]') limit 3;
c1	a2
2	[-823198,-0.217028,93069.8]
3	[-32020.6,75127.9,0.77094]
1	[42226.9,31946.8,233055]
drop table if exists t;
drop view if exists v;
drop view if exists v1;
create table t(c1 int, c2 vector(3), c3 vector(4), primary key(c1), vector index idx1(c2) with (distance=cosine, type=hnsw)) partition by range(c1) (partition p0 values less than (100),partition p1 values less than (1000),partition p2 values less than (10000),partition p3 values less than (100000),partition p4 values less than (1000000));
create view v (a1,a2) as select c1,c2 from t partition(p0,p1) where c1<=105 order by cosine_distance(c2, '[0.179629, 430819, -65217.32]') approx limit 20;
select count(*) from v;
count(*)
15
select count(*) from v;
count(*)
20
select a1,a2 from v order by cosine_distance(a2, '[-394438, 781465, 0.472924]') approx limit 5;
a1	a2
3	[-32020.6,75127.9,0.77094]
12	[-64656.9,79241,0.271415]
103	[-57512,445269,-19096.8]
18	[-0.892018,929517,0.57756]
5	[0.179629,430819,-65217.3]
select a1,a2 from v order by cosine_distance(a2, '[-394438, 781465, 0.472924]') limit 5;
a1	a2
3	[-32020.6,75127.9,0.77094]
12	[-64656.9,79241,0.271415]
103	[-57512,445269,-19096.8]
18	[-0.892018,929517,0.57756]
5	[0.179629,430819,-65217.3]
create or replace view v1(b1,b2) as select a1,a2 from v where a1<10 order by cosine_distance(a2, '[-394438, 781465, 0.472924]') approx limit 5;
select a1,b2 from v,v1 where v.a1 < 5 order by cosine_distance(v1.b2, '[-394438, 781465, 0.472924]') approx limit 3;
a1	b2
3	[-32020.6,75127.9,0.77094]
4	[-32020.6,75127.9,0.77094]
1	[-32020.6,75127.9,0.77094]
select a1,b2 from v,v1 where v.a1 < 5 order by cosine_distance(v1.b2, '[-394438, 781465, 0.472924]') limit 3;
a1	b2
3	[-32020.6,75127.9,0.77094]
4	[-32020.6,75127.9,0.77094]
1	[-32020.6,75127.9,0.77094]
create or replace view v(a1,a2) as select c1,c2 from t partition(p0) where c1<=105 and c1 >3 order by cosine_distance(c2, '[0.179629, 430819, -65217.32]') approx limit 20;
select a1,b2 from v,v1 where v.a1 < 5 order by cosine_distance(v1.b2, '[-394438, 781465, 0.472924]') approx limit 3;
a1	b2
4	[0.179629,430819,-65217.3]
4	[397583,541347,-65783.7]
4	[-319792,0.376752,14152]
select a1,b2 from v,v1 where v.a1 < 5 order by cosine_distance(v1.b2, '[-394438, 781465, 0.472924]') limit 3;
a1	b2
4	[0.179629,430819,-65217.3]
4	[397583,541347,-65783.7]
4	[-319792,0.376752,14152]
select a1,b2 from v,v1 where v.a1 < 5 order by cosine_distance(v1.b2, '[-394438, 781465, 0.472924]') limit 3;
a1	b2
4	[0.179629,430819,-65217.3]
4	[397583,541347,-65783.7]
4	[-319792,0.376752,14152]
insert into v values(21, '[-476077, -63863.82, 473126]'),(22, '[172696, -0.046571, 971238]');
ERROR HY000: The target table v of the INSERT is not insertable-into
drop view v;
select * from v1;
ERROR 42S22: View 'test.v1' references invalid table(s) or column(s) or function(s) or definer/invoker of view lack rights to use them
select c1,c3 from t order by cosine_distance(c2, '[-394438, 781465, 0.472924]') approx limit 5;
c1	c3
10016	[296227,-0.739927,0.323529,-0.224513]
3	[180226,-0.297448,-0.750788,-67573.9]
12	[20008.8,-663860,-33966.9,30381.5]
10011	[-8066.67,-0.421681,4939.42,23771]
100017	[-0.414822,-0.002811,0.321273,0.109519]
create or replace view v as select * from t partition(p0,p1);
insert into v values(21, '[-476077, -63863.82, 473126]', '[-186400, -74139.99, -63125.27, -22276]'),(22, '[172696, -0.046571, 971238]', '[20035.01, -0.11337, -432392, 0.882487]');
insert into v values(23, '[23389, 94538.78, 0.245033]', '[60120.85, 42704.43, 94749.91, -72265.24]'),(24, '[761505, 527095, 0.470469]', '[-0.120121, 82357.93, 736274, -0.529643]');
insert into v values(1021, '[-0.711658, 0.038812, -0.177803]', '[0.858901, -288450, 62793, -112038]'),(1022, '[0.520793, -532198, -41530.01]', '[35456.37, -790227, -750567, -0.258291]');
ERROR HY000: Found a row not matching the given partition set
insert into v values(121, '[230583, -0.156316, -40102.92]', '[-0.746097, -874750, -0.638492, 0.901151]'),(122, '[-51580.19, -65763.83, 0.704592]', '[0.348707, 18658.62, -55227.87, 63109.41]');
select c1,c2 from t where c1<100 order by cosine_distance(c2, '[-476077, -63863.82, 473126]') approx limit 2;
c1	c2
21	[-476077,-63863.8,473126]
16	[-92458.8,0.114535,68286.7]
select c1,c2 from t where c1<100 order by cosine_distance(c2, '[-476077, -63863.82, 473126]') limit 2;
c1	c2
21	[-476077,-63863.8,473126]
16	[-92458.8,0.114535,68286.7]
select c1,c2 from t partition(p0) order by cosine_distance(c2, '[-476077, -63863.82, 473126]') approx limit 2;
c1	c2
21	[-476077,-63863.8,473126]
16	[-92458.8,0.114535,68286.7]
select c1,c2 from t partition(p0) order by cosine_distance(c2, '[-476077, -63863.82, 473126]') limit 2;
c1	c2
21	[-476077,-63863.8,473126]
16	[-92458.8,0.114535,68286.7]


"=========================================== insert into view ==========================================="
drop table if exists t;
drop materialized view if exists mv;
drop materialized view if exists mv1;
create table t(c1 int, c2 vector(3), c3 vector(4), primary key(c1), vector index idx1(c2) with (distance=cosine, type=hnsw)) partition by range(c1) (partition p0 values less than (100),partition p1 values less than (1000),partition p2 values less than (10000),partition p3 values less than (100000),partition p4 values less than (1000000));
create materialized view mv (a1,a2,primary key(a1)) partition by range(a1) (partition p0 values less than (100), partition p1 values less than (1000), partition p2 values less than (maxvalue)) with column group(each column) refresh complete on demand as select c1,c2 from t order by cosine_distance(c2, '[397583, 541347, -65783.73]') approx limit 100;
create materialized view mv1 (a1,a2,primary key(a2)) partition by range(a1) (partition p0 values less than (100), partition p1 values less than (1000), partition p2 values less than (maxvalue)) with column group(each column) refresh complete on demand as select c1,c2 from t order by cosine_distance(c2, '[397583, 541347, -65783.73]') approx limit 100;
ERROR 42000: The used storage engine can't index column 'a2'
select count(*) from mv;
count(*)
50
select count(*) from mv;
count(*)
50
select a1,a2 from mv join t on c1=a1 and c1<10 order by cosine_distance(c2, '[397583, 541347, -65783.73]') approx limit 3;
a1	a2
4	[397583,541347,-65783.7]
5	[0.179629,430819,-65217.3]
select a1,a2 from mv join t on c1=a1 and c1<10 order by cosine_distance(c2, '[397583, 541347, -65783.73]') limit 3;
a1	a2
4	[397583,541347,-65783.7]
5	[0.179629,430819,-65217.3]
3	[-32020.6,75127.9,0.77094]


"=========================================== insert overwrite ==========================================="
drop table if exists t;
drop table if exists t1;
create table t(c1 int, c2 vector(3), c3 vector(4), primary key(c1), vector index idx1(c2) with (distance=cosine, type=hnsw)) partition by range(c1) (partition p0 values less than (100),partition p1 values less than (1000),partition p2 values less than (10000),partition p3 values less than (100000),partition p4 values less than (1000000));
create table t1(c1 int, c2 vector(3), c3 vector(4), primary key(c1), vector index idx1(c2) with (distance=cosine, type=hnsw)) partition by range(c1) (partition p0 values less than (100),partition p1 values less than (1000),partition p2 values less than (10000),partition p3 values less than (100000),partition p4 values less than (1000000));
insert into t1 select * from t where t.c1<1000 order by cosine_distance(t.c2,'[-476077, -63863.82, 473126]') limit 30;
delete from t;
insert /*+parallel(10)*/ overwrite t1 partition(p0,p2) select * from t where c1 % 2=0 order by cosine_distance(c2, '[-476077, -63863.82, 473126]') limit 30;
ERROR 0A000: insert overwrite with direct-load does not support table has generated column


"=========================================== load data with inc ==========================================="
drop table if exists t;
drop table if exists t1;
create table t(c1 int, c2 vector(3), c3 vector(4), primary key(c1), vector index idx1(c2) with (distance=cosine, type=hnsw)) partition by range(c1) (partition p0 values less than (100),partition p1 values less than (1000),partition p2 values less than (10000),partition p3 values less than (100000),partition p4 values less than (1000000));
select * into outfile '/data/1/test.file1' from t;
create table t1 like t;
load data /*+ direct(true, 100, 'inc') parallel(10)*/ infile '/data/1/test.file1' into table t1;
ERROR 0A000: Not supported feature or function
select count(*) from t join t1 on t.c1=t1.c1 order by cosine_distance(t1.c2, '[-43769.22, 44633.55, 57298]') approx limit 3;
count(*)
0
select count(*) from t join t1 on t.c1=t1.c1 order by cosine_distance(t1.c2, '[-43769.22, 44633.55, 57298]') limit 3;
count(*)
0


"=========================================== load data with full ==========================================="
drop table if exists t;
drop table if exists t1;
create table t(c1 int, c2 vector(3), c3 vector(4), primary key(c1), vector index idx1(c2) with (distance=cosine, type=hnsw)) partition by range(c1) (partition p0 values less than (100),partition p1 values less than (1000),partition p2 values less than (10000),partition p3 values less than (100000),partition p4 values less than (1000000));
select * into outfile '/data/1/test.file1' from t;
create table t1 like t;
load data /*+ direct(true, 100, 'full') parallel(10)*/ infile '/data/1/test.file1' into table t1;
ERROR 0A000: Not supported feature or function
select count(*) from t join t1 on t.c1=t1.c1 order by cosine_distance(t1.c2, '[-43769.22, 44633.55, 57298]') approx limit 3;
count(*)
0
select count(*) from t join t1 on t.c1=t1.c1 order by cosine_distance(t1.c2, '[-43769.22, 44633.55, 57298]') limit 3;
count(*)
0
