alter system ob_vector_memory_limit_percentage=30;
select sleep(5);
sleep(5)
0
set ob_query_timeout=30000000;


"=========================================== with child select ==========================================="
drop table if exists t;
drop table if exists t1;
drop table if exists t2;
create table t(c1 int, c2 vector(3), c3 vector(4), primary key(c1), vector index idx1(c2) with (distance=cosine, type=hnsw)) partition by range(c1) (partition p0 values less than (100),partition p1 values less than (1000),partition p2 values less than (10000),partition p3 values less than (100000),partition p4 values less than (1000000));
create table t1(c1 int, c2 vector(3), c3 vector(4), primary key(c1), vector index idx1(c2) with (distance=cosine, type=hnsw)) partition by range(c1) (partition p0 values less than (100),partition p1 values less than (1000),partition p2 values less than (10000),partition p3 values less than (100000),partition p4 values less than (1000000));
insert into t1(c1,c2,c3) values(1, '[77125.02, -80265.99, -262583]', '[0.811744, -1581, -967148, -0.935191]');
insert into t1(c1,c2,c3) values(2, '[-64656.9, 79241, 0.271415]', '[20008.81, -663860, -33966.93, 30381.51]');
insert into t1(c1,c2,c3) values(3, '[-69127.82, -0.623606, -394638]', '[-0.355252, 754669, 192053, -447867]');
insert into t1(c1,c2,c3) values(4, '[-59031.19, 33294, 0.615055]', '[274783, -0.707152, -77278.36, -10037]');
insert into t1(c1,c2,c3) values(5, '[965953, 83764, -971667]', '[17127.8, 0.010879, 111400, -573896]');
insert into t1(c1,c2,c3) values(6, '[-92458.83, 0.114535, 68286.7]', '[-80259.65, 36706.27, -981281, 847266]');
insert into t1(c1,c2,c3) values(7, '[-61253.07, 0.520645, 0.663066]', '[-0.111598, 573641, -0.760578, 71516.87]');
insert into t1(c1,c2,c3) values(8, '[-0.892018, 929517, 0.57756]', '[57297.17, 33523.38, 0.819768, -0.348583]');
insert into t1(c1,c2,c3) values(9, '[-0.582307, 0.926861, -70780.13]', '[0.051316, -0.316709, -781528, -0.959348]');
insert into t1(c1,c2,c3) values(0, '[-0.277237, -304120, 0.637868]', '[137017, 0.78021, -41681.94, -6168.722]');
create table t2(c1 double, c2 vector(3), c3 vector(4),vector index idx1(c2) with (distance=cosine, type=hnsw));
insert into t2(c1,c2,c3) select cosine_distance(t.c2,t1.c2),t1.c2,t.c3+t1.c3 from t join t1 on t.c1=t1.c1 where t.c1%2=0 and t1.c1%2=0 order by cosine_distance(t1.c2, '[-0.253108, -0.613931, -874511]') approx limit 10;
select * from t2;
c1	c2	c3
1.0134334726523218	[-0.892018,929517,0.57756]	[57297.1,33524.3,-279891,-69331.1]
select * from t2 order by cosine_distance(c2, '[-0.253108, -0.613931, -874511]') approx limit 1;
c1	c2	c3
1.0134334726523218	[-0.892018,929517,0.57756]	[57297.1,33524.3,-279891,-69331.1]
delete from t2 where c2 ='[-0.892018,929517,0.57756]';
select t.c1,t2.c2 from t join t2 where t.c2=t2.c2;
c1	c2
select t1.c1,t2.c2 from t1 join t2 where t1.c2=t2.c2;
c1	c2


"=========================================== insert with child select ==========================================="
drop table if exists t;
drop table if exists t1;
drop table if exists t2;
create table t(c1 int, c2 vector(3), c3 vector(4), primary key(c1), vector index idx1(c2) with (distance=cosine, type=hnsw)) partition by range(c1) (partition p0 values less than (100),partition p1 values less than (1000),partition p2 values less than (10000),partition p3 values less than (100000),partition p4 values less than (1000000));
create table t1(c1 int, c2 vector(3), c3 vector(4), primary key(c1), vector index idx1(c2) with (distance=cosine, type=hnsw)) partition by range(c1) (partition p0 values less than (100),partition p1 values less than (1000),partition p2 values less than (10000),partition p3 values less than (100000),partition p4 values less than (1000000));
insert into t1(c1,c2,c3) values(1, '[77125.02, -80265.99, -262583]', '[0.811744, -1581, -967148, -0.935191]');
insert into t1(c1,c2,c3) values(2, '[-64656.9, 79241, 0.271415]', '[20008.81, -663860, -33966.93, 30381.51]');
insert into t1(c1,c2,c3) values(3, '[-69127.82, -0.623606, -394638]', '[-0.355252, 754669, 192053, -447867]');
insert into t1(c1,c2,c3) values(4, '[-59031.19, 33294, 0.615055]', '[274783, -0.707152, -77278.36, -10037]');
insert into t1(c1,c2,c3) values(5, '[965953, 83764, -971667]', '[17127.8, 0.010879, 111400, -573896]');
insert into t1(c1,c2,c3) values(6, '[-92458.83, 0.114535, 68286.7]', '[-80259.65, 36706.27, -981281, 847266]');
insert into t1(c1,c2,c3) values(7, '[-61253.07, 0.520645, 0.663066]', '[-0.111598, 573641, -0.760578, 71516.87]');
insert into t1(c1,c2,c3) values(8, '[-0.892018, 929517, 0.57756]', '[57297.17, 33523.38, 0.819768, -0.348583]');
insert into t1(c1,c2,c3) values(9, '[-0.582307, 0.926861, -70780.13]', '[0.051316, -0.316709, -781528, -0.959348]');
insert into t1(c1,c2,c3) values(0, '[-0.277237, -304120, 0.637868]', '[137017, 0.78021, -41681.94, -6168.722]');
create table t2(c1 double, c2 vector(3),vector index idx1(c2) with (distance=cosine, type=hnsw));
insert into t2(c1,c2) values(101, (select t.c2 + t1.c2 from t join t1 on t.c1=t1.c1 where t.c1<5 order by cosine_distance(t1.c2, '[77125.02, -80265.99, -262583]') approx limit 1));
insert into t2(c1,c2) values(101, (select t.c2 + t1.c2 from t join t1 on t.c1=t1.c1 where t.c1<5 order by cosine_distance(t1.c2, '[-64656.9, 79241, 0.271415]') approx limit 1));
insert into t2(c1,c2) values(101, (select t.c2 + t1.c2 from t join t1 on t.c1=t1.c1 where t.c1<5 order by cosine_distance(t1.c2, '[-59031.19, 33294, 0.615055]') approx limit 1));
select * from t2 order by cosine_distance(c2, '[-59031.19, 33294, 0.615055]') approx limit 2;
c1	c2
101	[-887855,79240.8,93070.1]
101	[338552,574641,-65783.1]


"=========================================== update with child select ==========================================="
drop table if exists t;
drop table if exists t1;
drop table if exists t2;
create table t(c1 int, c2 vector(3), c3 vector(4), primary key(c1), vector index idx1(c2) with (distance=cosine, type=hnsw)) partition by range(c1) (partition p0 values less than (100),partition p1 values less than (1000),partition p2 values less than (10000),partition p3 values less than (100000),partition p4 values less than (1000000));
create table t1(c1 int, c2 vector(3), c3 vector(4), primary key(c1), vector index idx1(c2) with (distance=cosine, type=hnsw)) partition by range(c1) (partition p0 values less than (100),partition p1 values less than (1000),partition p2 values less than (10000),partition p3 values less than (100000),partition p4 values less than (1000000));
insert into t1(c1,c2,c3) values(1, '[77125.02, -80265.99, -262583]', '[0.811744, -1581, -967148, -0.935191]');
insert into t1(c1,c2,c3) values(2, '[-64656.9, 79241, 0.271415]', '[20008.81, -663860, -33966.93, 30381.51]');
insert into t1(c1,c2,c3) values(3, '[-69127.82, -0.623606, -394638]', '[-0.355252, 754669, 192053, -447867]');
insert into t1(c1,c2,c3) values(4, '[-59031.19, 33294, 0.615055]', '[274783, -0.707152, -77278.36, -10037]');
insert into t1(c1,c2,c3) values(5, '[965953, 83764, -971667]', '[17127.8, 0.010879, 111400, -573896]');
insert into t1(c1,c2,c3) values(6, '[-92458.83, 0.114535, 68286.7]', '[-80259.65, 36706.27, -981281, 847266]');
insert into t1(c1,c2,c3) values(7, '[-61253.07, 0.520645, 0.663066]', '[-0.111598, 573641, -0.760578, 71516.87]');
insert into t1(c1,c2,c3) values(8, '[-0.892018, 929517, 0.57756]', '[57297.17, 33523.38, 0.819768, -0.348583]');
insert into t1(c1,c2,c3) values(9, '[-0.582307, 0.926861, -70780.13]', '[0.051316, -0.316709, -781528, -0.959348]');
insert into t1(c1,c2,c3) values(10, '[-0.277237, -304120, 0.637868]', '[137017, 0.78021, -41681.94, -6168.722]');
select * from t1 where t1.c1 not in (select c1 from t order by cosine_distance(t.c2, '[0.179629, 430819, -65217.32]') approx limit 3);
c1	c2	c3
1	[77125,-80266,-262583]	[0.811744,-1581,-967148,-0.935191]
2	[-64656.9,79241,0.271415]	[20008.8,-663860,-33966.9,30381.5]
3	[-69127.8,-0.623606,-394638]	[-0.355252,754669,192053,-447867]
4	[-59031.2,33294,0.615055]	[274783,-0.707152,-77278.4,-10037]
6	[-92458.8,0.114535,68286.7]	[-80259.6,36706.3,-981281,847266]
7	[-61253.1,0.520645,0.663066]	[-0.111598,573641,-0.760578,71516.9]
8	[-0.892018,929517,0.57756]	[57297.2,33523.4,0.819768,-0.348583]
9	[-0.582307,0.926861,-70780.1]	[0.051316,-0.316709,-781528,-0.959348]
10	[-0.277237,-304120,0.637868]	[137017,0.78021,-41681.9,-6168.72]
update t1 set t1.c2=t1.c2 - (select t.c2 from t order by cosine_distance(t.c2, '[0.179629, 430819, -65217.32]') approx limit 1) where t1.c1 not in (select c1 from t order by cosine_distance(t.c2, '[0.179629, 430819, -65217.32]') approx limit 3);
select * from t1 order by cosine_distance(c2, '[965953, 83764, -971667]') approx limit 1;
c1	c2	c3
5	[965953,83764,-971667]	[17127.8,0.010879,111400,-573896]


"=========================================== update with case ==========================================="
drop table if exists t1;
create table t1(c1 int, c2 vector(3), c3 vector(4), primary key(c1), vector index idx1(c2) with (distance=cosine, type=hnsw)) partition by range(c1) (partition p0 values less than (100),partition p1 values less than (1000),partition p2 values less than (10000),partition p3 values less than (100000),partition p4 values less than (1000000));
insert into t1(c1,c2,c3) values(1, '[77125.02, -80265.99, -262583]', '[0.811744, -1581, -967148, -0.935191]');
insert into t1(c1,c2,c3) values(2, '[-64656.9, 79241, 0.271415]', '[20008.81, -663860, -33966.93, 30381.51]');
insert into t1(c1,c2,c3) values(3, '[-69127.82, -0.623606, -394638]', '[-0.355252, 754669, 192053, -447867]');
insert into t1(c1,c2,c3) values(4, '[-59031.19, 33294, 0.615055]', '[274783, -0.707152, -77278.36, -10037]');
insert into t1(c1,c2,c3) values(5, '[965953, 83764, -971667]', '[17127.8, 0.010879, 111400, -573896]');
insert into t1(c1,c2,c3) values(6, '[-92458.83, 0.114535, 68286.7]', '[-80259.65, 36706.27, -981281, 847266]');
insert into t1(c1,c2,c3) values(7, '[-61253.07, 0.520645, 0.663066]', '[-0.111598, 573641, -0.760578, 71516.87]');
insert into t1(c1,c2,c3) values(8, '[-0.892018, 929517, 0.57756]', '[57297.17, 33523.38, 0.819768, -0.348583]');
insert into t1(c1,c2,c3) values(9, '[-0.582307, 0.926861, -70780.13]', '[0.051316, -0.316709, -781528, -0.959348]');
insert into t1(c1,c2,c3) values(10, '[-0.277237, -304120, 0.637868]', '[137017, 0.78021, -41681.94, -6168.722]');
update t1 set c2= case
when cosine_distance(c2, '[-69127.82, -0.623606, -394638]') < 1 then '[0,0,0]'
    when cosine_distance(c2, '[-69127.82, -0.623606, -394638]') >=1 then '[1,1,1]'
    end
where c1%2=0;
select *, cosine_distance(c2,'[1,1,1]') from t1 order by cosine_distance(c2,'[1,1,1]') limit 5;
c1	c2	c3	cosine_distance(c2,'[1,1,1]')
4	[0,0,0]	[274783,-0.707152,-77278.4,-10037]	NULL
2	[0,0,0]	[20008.8,-663860,-33966.9,30381.5]	NULL
10	[1,1,1]	[137017,0.78021,-41681.9,-6168.72]	0
8	[1,1,1]	[57297.2,33523.4,0.819768,-0.348583]	0
6	[1,1,1]	[-80259.6,36706.3,-981281,847266]	0
select *, cosine_distance(c2,'[1,1,1]') from t1 order by cosine_distance(c2,'[1,1,1]') limit 10;
c1	c2	c3	cosine_distance(c2,'[1,1,1]')
4	[0,0,0]	[274783,-0.707152,-77278.4,-10037]	NULL
2	[0,0,0]	[20008.8,-663860,-33966.9,30381.5]	NULL
10	[1,1,1]	[137017,0.78021,-41681.9,-6168.72]	0
6	[1,1,1]	[-80259.6,36706.3,-981281,847266]	0
8	[1,1,1]	[57297.2,33523.4,0.819768,-0.348583]	0
5	[965953,83764,-971667]	[17127.8,0.010879,111400,-573896]	0.9671718309233255
1	[77125,-80266,-262583]	[0.811744,-1581,-967148,-0.935191]	1.5379179765963942
7	[-61253.1,0.520645,0.663066]	[-0.111598,573641,-0.760578,71516.9]	1.5773391167083888
9	[-0.582307,0.926861,-70780.1]	[0.051316,-0.316709,-781528,-0.959348]	1.5773474512889747
3	[-69127.8,-0.623606,-394638]	[-0.355252,754669,192053,-447867]	1.6683086697729914
select *, cosine_distance(c2,'[1,1,1]') from t1 order by cosine_distance(c2,'[1,1,1]') approx limit 5;
c1	c2	c3	cosine_distance(c2,'[1,1,1]')
2	[0,0,0]	[20008.8,-663860,-33966.9,30381.5]	NULL
6	[1,1,1]	[-80259.6,36706.3,-981281,847266]	0
8	[1,1,1]	[57297.2,33523.4,0.819768,-0.348583]	0
10	[1,1,1]	[137017,0.78021,-41681.9,-6168.72]	0
1	[77125,-80266,-262583]	[0.811744,-1581,-967148,-0.935191]	1.5379179765963942
select *, cosine_distance(c2,'[1,1,1]') from t1 order by cosine_distance(c2,'[1,1,1]') approx limit 10;
c1	c2	c3	cosine_distance(c2,'[1,1,1]')
2	[0,0,0]	[20008.8,-663860,-33966.9,30381.5]	NULL
4	[0,0,0]	[274783,-0.707152,-77278.4,-10037]	NULL
6	[1,1,1]	[-80259.6,36706.3,-981281,847266]	0
10	[1,1,1]	[137017,0.78021,-41681.9,-6168.72]	0
8	[1,1,1]	[57297.2,33523.4,0.819768,-0.348583]	0
5	[965953,83764,-971667]	[17127.8,0.010879,111400,-573896]	0.9671718309233255
1	[77125,-80266,-262583]	[0.811744,-1581,-967148,-0.935191]	1.5379179765963942
7	[-61253.1,0.520645,0.663066]	[-0.111598,573641,-0.760578,71516.9]	1.5773391167083888
9	[-0.582307,0.926861,-70780.1]	[0.051316,-0.316709,-781528,-0.959348]	1.5773474512889747
3	[-69127.8,-0.623606,-394638]	[-0.355252,754669,192053,-447867]	1.6683086697729914


"=========================================== delete with child select ==========================================="
drop table if exists t;
drop table if exists t1;
create table t(c1 int, c2 vector(3), c3 vector(4), primary key(c1), vector index idx1(c2) with (distance=cosine, type=hnsw)) partition by range(c1) (partition p0 values less than (100),partition p1 values less than (1000),partition p2 values less than (10000),partition p3 values less than (100000),partition p4 values less than (1000000));
create table t1(c1 int, c2 vector(3), c3 vector(4), primary key(c1), vector index idx1(c2) with (distance=cosine, type=hnsw)) partition by range(c1) (partition p0 values less than (100),partition p1 values less than (1000),partition p2 values less than (10000),partition p3 values less than (100000),partition p4 values less than (1000000));
insert into t1(c1,c2,c3) values(1, '[77125.02, -80265.99, -262583]', '[0.811744, -1581, -967148, -0.935191]');
insert into t1(c1,c2,c3) values(2, '[-64656.9, 79241, 0.271415]', '[20008.81, -663860, -33966.93, 30381.51]');
insert into t1(c1,c2,c3) values(3, '[-69127.82, -0.623606, -394638]', '[-0.355252, 754669, 192053, -447867]');
insert into t1(c1,c2,c3) values(4, '[-59031.19, 33294, 0.615055]', '[274783, -0.707152, -77278.36, -10037]');
insert into t1(c1,c2,c3) values(5, '[965953, 83764, -971667]', '[17127.8, 0.010879, 111400, -573896]');
insert into t1(c1,c2,c3) values(6, '[-92458.83, 0.114535, 68286.7]', '[-80259.65, 36706.27, -981281, 847266]');
insert into t1(c1,c2,c3) values(7, '[-61253.07, 0.520645, 0.663066]', '[-0.111598, 573641, -0.760578, 71516.87]');
insert into t1(c1,c2,c3) values(8, '[-0.892018, 929517, 0.57756]', '[57297.17, 33523.38, 0.819768, -0.348583]');
insert into t1(c1,c2,c3) values(9, '[-0.582307, 0.926861, -70780.13]', '[0.051316, -0.316709, -781528, -0.959348]');
insert into t1(c1,c2,c3) values(10, '[-0.277237, -304120, 0.637868]', '[137017, 0.78021, -41681.94, -6168.722]');
delete from t where c1 in (select t1.c1 from t1 join t on t1.c1=t.c1 where t1.c1<9 order by cosine_distance(t1.c2, '[965953, 83764, -971667]') approx limit 5);
select * from t;
c1	c2	c3
4	[397583,541347,-65783.7]	[-747523,-438597,-690027,-97203.1]
6	[-0.253108,-0.613931,-874511]	[0.608538,926121,393602,-0.155942]
7	[-319792,0.376752,14152]	[547577,-0.999079,0.390207,-0.140902]
9	[-0.884688,98861.2,-535325]	[-0.022933,-862237,-0.156035,-706071]
10	[0.578781,-0.058835,-746529]	[304414,73030.7,-0.462573,604848]
101	[-22158.2,0.512567,-5659]	[50244.1,-6531.87,-0.508316,-228316]
102	[-0.486493,-0.944789,439948]	[-656128,0.841715,4706.49,-56339]
103	[-57512,445269,-19096.8]	[-0.939627,-0.833651,0.139458,-75281.8]
104	[157360,-83220,24803]	[-125725,-650260,-17108.7,832224]
105	[473641,-0.149836,355051]	[-858328,-0.545063,0.303736,-62990.1]
106	[-77417.7,65883.3,0.681227]	[-0.285769,270614,-16362.1,-130630]
107	[757225,-66493.4,-213406]	[-0.111738,0.688164,-603596,-764143]
108	[25381.3,-36646.2,-81309.8]	[-355875,-277764,21811,0.052467]
109	[0.218711,465897,-44697.2]	[-96395.5,0.670629,-78181.5,0.329958]
110	[-0.201769,-0.220271,0.150037]	[-455053,-96612.3,-583978,-0.615918]
1001	[57811.3,-0.214074,0.115481]	[-0.776308,-794251,-0.972245,448946]
1002	[-0.871165,0.502377,-92192.8]	[0.601641,0.536642,-69678.3,-154154]
1003	[645362,-226965,526258]	[-126709,-772253,-4315.65,0.055967]
1004	[34691,-0.247566,-0.868466]	[-0.899574,877090,-577067,-87680.9]
1005	[0.478095,-7136.01,126378]	[0.779142,244780,0.875969,-13970.2]
1006	[0.239433,-605871,61395.8]	[25435.7,0.185164,426302,-547177]
1007	[-51915.9,508281,116383]	[-0.609978,-0.636346,-0.142706,-92326.7]
1008	[367605,51923.8,807613]	[-0.890944,-0.107754,31463,200530]
1009	[-719458,81915.1,-0.207763]	[0.376095,904052,932008,-776846]
1010	[762802,-0.970555,252311]	[0.534972,-0.752701,-6701.45,-76545]
10001	[-43769.2,44633.6,57298]	[1949.23,303041,72542.6,-301216]
10002	[343429,439714,0.979698]	[-72930.4,-0.609663,-0.471619,0.998431]
10003	[0.450559,-403340,727544]	[996579,470552,-46358,-68583.3]
10004	[-43597,-56812.9,-0.976134]	[-35436.3,-0.658155,0.164836,65891.6]
10005	[-0.546647,0.085977,-432903]	[580521,509194,10281,488413]
10006	[-0.618333,-0.402319,94610.1]	[968018,-52954.6,0.156552,-81220.9]
10007	[-88010.2,0.511376,82124.7]	[70797.9,-0.37462,11044,36229.6]
10008	[-98503,408683,186061]	[-13081,761953,90037.4,-76073.7]
10009	[-426621,216651,0.50529]	[-33180.2,-0.600476,0.160138,-0.453023]
10010	[512149,-0.632866,0.328226]	[23706.8,-0.168282,24591.1,32158.5]
100001	[966457,54472.6,72794.2]	[0.597617,-18206,-0.378432,406036]
100002	[26778.7,-29305,0.019109]	[-958337,0.256426,-704725,296150]
100003	[0.722868,263971,0.217136]	[166625,0.26823,0.052328,0.534109]
100004	[0.649972,-0.323987,571442]	[-16366,57795.1,-72511.8,-242474]
100005	[-0.934345,-49343.8,0.913269]	[76492.8,-242207,-0.214888,-0.784362]
100006	[-77282.2,-38667,88183.8]	[-14085.5,962186,0.049489,-206037]
100007	[0.673657,-2357.65,66711.1]	[6650.41,119421,875021,284071]
100008	[-14366.4,22842.5,279158]	[360894,-135705,36872.5,-0.445259]
100009	[-0.352528,298886,0.320923]	[-907820,274839,-952298,-8038.5]
100010	[-800085,-906594,-0.381223]	[658934,0.257607,-91720.5,0.883427]
select * from t order by cosine_distance(c2, '[397583, 541347, -65783.73]') approx limit 10;
c1	c2	c3
4	[397583,541347,-65783.7]	[-747523,-438597,-690027,-97203.1]
10002	[343429,439714,0.979698]	[-72930.4,-0.609663,-0.471619,0.998431]
109	[0.218711,465897,-44697.2]	[-96395.5,0.670629,-78181.5,0.329958]
100003	[0.722868,263971,0.217136]	[166625,0.26823,0.052328,0.534109]
100009	[-0.352528,298886,0.320923]	[-907820,274839,-952298,-8038.5]
103	[-57512,445269,-19096.8]	[-0.939627,-0.833651,0.139458,-75281.8]
1007	[-51915.9,508281,116383]	[-0.609978,-0.636346,-0.142706,-92326.7]
100001	[966457,54472.6,72794.2]	[0.597617,-18206,-0.378432,406036]
10010	[512149,-0.632866,0.328226]	[23706.8,-0.168282,24591.1,32158.5]
1001	[57811.3,-0.214074,0.115481]	[-0.776308,-794251,-0.972245,448946]


"=========================================== dml with transaction ==========================================="
drop table if exists t;
drop table if exists t1;
create table t(c1 int, c2 vector(3), c3 vector(4), primary key(c1), vector index idx1(c2) with (distance=cosine, type=hnsw)) partition by range(c1) (partition p0 values less than (100),partition p1 values less than (1000),partition p2 values less than (10000),partition p3 values less than (100000),partition p4 values less than (1000000));
create table t1(c1 int, c2 vector(3), c3 vector(4), primary key(c1), vector index idx1(c2) with (distance=cosine, type=hnsw)) partition by range(c1) (partition p0 values less than (100),partition p1 values less than (1000),partition p2 values less than (10000),partition p3 values less than (100000),partition p4 values less than (1000000));
insert into t1(c1,c2,c3) values(1, '[77125.02, -80265.99, -262583]', '[0.811744, -1581, -967148, -0.935191]');
insert into t1(c1,c2,c3) values(2, '[-64656.9, 79241, 0.271415]', '[20008.81, -663860, -33966.93, 30381.51]');
insert into t1(c1,c2,c3) values(3, '[-69127.82, -0.623606, -394638]', '[-0.355252, 754669, 192053, -447867]');
insert into t1(c1,c2,c3) values(4, '[-59031.19, 33294, 0.615055]', '[274783, -0.707152, -77278.36, -10037]');
insert into t1(c1,c2,c3) values(5, '[965953, 83764, -971667]', '[17127.8, 0.010879, 111400, -573896]');
insert into t1(c1,c2,c3) values(6, '[-92458.83, 0.114535, 68286.7]', '[-80259.65, 36706.27, -981281, 847266]');
insert into t1(c1,c2,c3) values(7, '[-61253.07, 0.520645, 0.663066]', '[-0.111598, 573641, -0.760578, 71516.87]');
insert into t1(c1,c2,c3) values(8, '[-0.892018, 929517, 0.57756]', '[57297.17, 33523.38, 0.819768, -0.348583]');
insert into t1(c1,c2,c3) values(9, '[-0.582307, 0.926861, -70780.13]', '[0.051316, -0.316709, -781528, -0.959348]');
insert into t1(c1,c2,c3) values(10, '[-0.277237, -304120, 0.637868]', '[137017, 0.78021, -41681.94, -6168.722]');
start transaction;
delete from t where c1 in (select t1.c1 from t1 join t on t1.c1=t.c1 where t1.c1<9 order by cosine_distance(t1.c2, '[965953, 83764, -971667]') approx limit 5);
update t1 set c2= case
when cosine_distance(c2, '[-69127.82, -0.623606, -394638]') < 1 then '[0,0,0]'
        when cosine_distance(c2, '[-69127.82, -0.623606, -394638]') >=1 then '[1,1,1]'
        end
where c1%2=0;
insert into t(c1,c2,c3) select * from t1 where c1<4 order by cosine_distance(c2, '[-0.277237, -304120, 0.637868]') approx limit 1;
insert into t(c1,c2,c3) values (101, (select c2 from t1 where c1>8 order by cosine_distance(c2, '[-0.277237, -304120, 0.637868]') approx limit 1), '[1,1,1,1]') on duplicate key update c1 = 100;
select * from t;
c1	c2	c3
1	[77125,-80266,-262583]	[0.811744,-1581,-967148,-0.935191]
4	[397583,541347,-65783.7]	[-747523,-438597,-690027,-97203.1]
6	[-0.253108,-0.613931,-874511]	[0.608538,926121,393602,-0.155942]
7	[-319792,0.376752,14152]	[547577,-0.999079,0.390207,-0.140902]
9	[-0.884688,98861.2,-535325]	[-0.022933,-862237,-0.156035,-706071]
10	[0.578781,-0.058835,-746529]	[304414,73030.7,-0.462573,604848]
100	[-22158.2,0.512567,-5659]	[50244.1,-6531.87,-0.508316,-228316]
102	[-0.486493,-0.944789,439948]	[-656128,0.841715,4706.49,-56339]
103	[-57512,445269,-19096.8]	[-0.939627,-0.833651,0.139458,-75281.8]
104	[157360,-83220,24803]	[-125725,-650260,-17108.7,832224]
105	[473641,-0.149836,355051]	[-858328,-0.545063,0.303736,-62990.1]
106	[-77417.7,65883.3,0.681227]	[-0.285769,270614,-16362.1,-130630]
107	[757225,-66493.4,-213406]	[-0.111738,0.688164,-603596,-764143]
108	[25381.3,-36646.2,-81309.8]	[-355875,-277764,21811,0.052467]
109	[0.218711,465897,-44697.2]	[-96395.5,0.670629,-78181.5,0.329958]
110	[-0.201769,-0.220271,0.150037]	[-455053,-96612.3,-583978,-0.615918]
1001	[57811.3,-0.214074,0.115481]	[-0.776308,-794251,-0.972245,448946]
1002	[-0.871165,0.502377,-92192.8]	[0.601641,0.536642,-69678.3,-154154]
1003	[645362,-226965,526258]	[-126709,-772253,-4315.65,0.055967]
1004	[34691,-0.247566,-0.868466]	[-0.899574,877090,-577067,-87680.9]
1005	[0.478095,-7136.01,126378]	[0.779142,244780,0.875969,-13970.2]
1006	[0.239433,-605871,61395.8]	[25435.7,0.185164,426302,-547177]
1007	[-51915.9,508281,116383]	[-0.609978,-0.636346,-0.142706,-92326.7]
1008	[367605,51923.8,807613]	[-0.890944,-0.107754,31463,200530]
1009	[-719458,81915.1,-0.207763]	[0.376095,904052,932008,-776846]
1010	[762802,-0.970555,252311]	[0.534972,-0.752701,-6701.45,-76545]
10001	[-43769.2,44633.6,57298]	[1949.23,303041,72542.6,-301216]
10002	[343429,439714,0.979698]	[-72930.4,-0.609663,-0.471619,0.998431]
10003	[0.450559,-403340,727544]	[996579,470552,-46358,-68583.3]
10004	[-43597,-56812.9,-0.976134]	[-35436.3,-0.658155,0.164836,65891.6]
10005	[-0.546647,0.085977,-432903]	[580521,509194,10281,488413]
10006	[-0.618333,-0.402319,94610.1]	[968018,-52954.6,0.156552,-81220.9]
10007	[-88010.2,0.511376,82124.7]	[70797.9,-0.37462,11044,36229.6]
10008	[-98503,408683,186061]	[-13081,761953,90037.4,-76073.7]
10009	[-426621,216651,0.50529]	[-33180.2,-0.600476,0.160138,-0.453023]
10010	[512149,-0.632866,0.328226]	[23706.8,-0.168282,24591.1,32158.5]
100001	[966457,54472.6,72794.2]	[0.597617,-18206,-0.378432,406036]
100002	[26778.7,-29305,0.019109]	[-958337,0.256426,-704725,296150]
100003	[0.722868,263971,0.217136]	[166625,0.26823,0.052328,0.534109]
100004	[0.649972,-0.323987,571442]	[-16366,57795.1,-72511.8,-242474]
100005	[-0.934345,-49343.8,0.913269]	[76492.8,-242207,-0.214888,-0.784362]
100006	[-77282.2,-38667,88183.8]	[-14085.5,962186,0.049489,-206037]
100007	[0.673657,-2357.65,66711.1]	[6650.41,119421,875021,284071]
100008	[-14366.4,22842.5,279158]	[360894,-135705,36872.5,-0.445259]
100009	[-0.352528,298886,0.320923]	[-907820,274839,-952298,-8038.5]
100010	[-800085,-906594,-0.381223]	[658934,0.257607,-91720.5,0.883427]
select * from t order by cosine_distance(c2, '[-0.277237, -304120, 0.637868]') approx limit 1;
c1	c2	c3
100005	[-0.934345,-49343.8,0.913269]	[76492.8,-242207,-0.214888,-0.784362]
select * from t order by cosine_distance(c2, '[-0.277237, -304120, 0.637868]') limit 1;
c1	c2	c3
100005	[-0.934345,-49343.8,0.913269]	[76492.8,-242207,-0.214888,-0.784362]
commit;
select * from t;
c1	c2	c3
1	[77125,-80266,-262583]	[0.811744,-1581,-967148,-0.935191]
4	[397583,541347,-65783.7]	[-747523,-438597,-690027,-97203.1]
6	[-0.253108,-0.613931,-874511]	[0.608538,926121,393602,-0.155942]
7	[-319792,0.376752,14152]	[547577,-0.999079,0.390207,-0.140902]
9	[-0.884688,98861.2,-535325]	[-0.022933,-862237,-0.156035,-706071]
10	[0.578781,-0.058835,-746529]	[304414,73030.7,-0.462573,604848]
100	[-22158.2,0.512567,-5659]	[50244.1,-6531.87,-0.508316,-228316]
102	[-0.486493,-0.944789,439948]	[-656128,0.841715,4706.49,-56339]
103	[-57512,445269,-19096.8]	[-0.939627,-0.833651,0.139458,-75281.8]
104	[157360,-83220,24803]	[-125725,-650260,-17108.7,832224]
105	[473641,-0.149836,355051]	[-858328,-0.545063,0.303736,-62990.1]
106	[-77417.7,65883.3,0.681227]	[-0.285769,270614,-16362.1,-130630]
107	[757225,-66493.4,-213406]	[-0.111738,0.688164,-603596,-764143]
108	[25381.3,-36646.2,-81309.8]	[-355875,-277764,21811,0.052467]
109	[0.218711,465897,-44697.2]	[-96395.5,0.670629,-78181.5,0.329958]
110	[-0.201769,-0.220271,0.150037]	[-455053,-96612.3,-583978,-0.615918]
1001	[57811.3,-0.214074,0.115481]	[-0.776308,-794251,-0.972245,448946]
1002	[-0.871165,0.502377,-92192.8]	[0.601641,0.536642,-69678.3,-154154]
1003	[645362,-226965,526258]	[-126709,-772253,-4315.65,0.055967]
1004	[34691,-0.247566,-0.868466]	[-0.899574,877090,-577067,-87680.9]
1005	[0.478095,-7136.01,126378]	[0.779142,244780,0.875969,-13970.2]
1006	[0.239433,-605871,61395.8]	[25435.7,0.185164,426302,-547177]
1007	[-51915.9,508281,116383]	[-0.609978,-0.636346,-0.142706,-92326.7]
1008	[367605,51923.8,807613]	[-0.890944,-0.107754,31463,200530]
1009	[-719458,81915.1,-0.207763]	[0.376095,904052,932008,-776846]
1010	[762802,-0.970555,252311]	[0.534972,-0.752701,-6701.45,-76545]
10001	[-43769.2,44633.6,57298]	[1949.23,303041,72542.6,-301216]
10002	[343429,439714,0.979698]	[-72930.4,-0.609663,-0.471619,0.998431]
10003	[0.450559,-403340,727544]	[996579,470552,-46358,-68583.3]
10004	[-43597,-56812.9,-0.976134]	[-35436.3,-0.658155,0.164836,65891.6]
10005	[-0.546647,0.085977,-432903]	[580521,509194,10281,488413]
10006	[-0.618333,-0.402319,94610.1]	[968018,-52954.6,0.156552,-81220.9]
10007	[-88010.2,0.511376,82124.7]	[70797.9,-0.37462,11044,36229.6]
10008	[-98503,408683,186061]	[-13081,761953,90037.4,-76073.7]
10009	[-426621,216651,0.50529]	[-33180.2,-0.600476,0.160138,-0.453023]
10010	[512149,-0.632866,0.328226]	[23706.8,-0.168282,24591.1,32158.5]
100001	[966457,54472.6,72794.2]	[0.597617,-18206,-0.378432,406036]
100002	[26778.7,-29305,0.019109]	[-958337,0.256426,-704725,296150]
100003	[0.722868,263971,0.217136]	[166625,0.26823,0.052328,0.534109]
100004	[0.649972,-0.323987,571442]	[-16366,57795.1,-72511.8,-242474]
100005	[-0.934345,-49343.8,0.913269]	[76492.8,-242207,-0.214888,-0.784362]
100006	[-77282.2,-38667,88183.8]	[-14085.5,962186,0.049489,-206037]
100007	[0.673657,-2357.65,66711.1]	[6650.41,119421,875021,284071]
100008	[-14366.4,22842.5,279158]	[360894,-135705,36872.5,-0.445259]
100009	[-0.352528,298886,0.320923]	[-907820,274839,-952298,-8038.5]
100010	[-800085,-906594,-0.381223]	[658934,0.257607,-91720.5,0.883427]
select * from t order by cosine_distance(c2, '[-0.277237, -304120, 0.637868]') approx limit 1;
c1	c2	c3
100005	[-0.934345,-49343.8,0.913269]	[76492.8,-242207,-0.214888,-0.784362]
select * from t order by cosine_distance(c2, '[-0.277237, -304120, 0.637868]') limit 1;
c1	c2	c3
100005	[-0.934345,-49343.8,0.913269]	[76492.8,-242207,-0.214888,-0.784362]


"=========================================== dml with procedure ==========================================="
drop table if exists t;
drop table if exists t1;
drop procedure if exists mytest;
create table t(c1 int, c2 vector(3), c3 vector(4), primary key(c1), vector index idx1(c2) with (distance=cosine, type=hnsw)) partition by range(c1) (partition p0 values less than (100),partition p1 values less than (1000),partition p2 values less than (10000),partition p3 values less than (100000),partition p4 values less than (1000000));
create table t1(c1 int, c2 vector(3), c3 vector(4), primary key(c1), vector index idx1(c2) with (distance=cosine, type=hnsw)) partition by range(c1) (partition p0 values less than (100),partition p1 values less than (1000),partition p2 values less than (10000),partition p3 values less than (100000),partition p4 values less than (1000000));
insert into t1(c1,c2,c3) values(1, '[77125.02, -80265.99, -262583]', '[0.811744, -1581, -967148, -0.935191]');
insert into t1(c1,c2,c3) values(2, '[-64656.9, 79241, 0.271415]', '[20008.81, -663860, -33966.93, 30381.51]');
insert into t1(c1,c2,c3) values(3, '[-69127.82, -0.623606, -394638]', '[-0.355252, 754669, 192053, -447867]');
insert into t1(c1,c2,c3) values(4, '[-59031.19, 33294, 0.615055]', '[274783, -0.707152, -77278.36, -10037]');
insert into t1(c1,c2,c3) values(5, '[965953, 83764, -971667]', '[17127.8, 0.010879, 111400, -573896]');
insert into t1(c1,c2,c3) values(6, '[-92458.83, 0.114535, 68286.7]', '[-80259.65, 36706.27, -981281, 847266]');
insert into t1(c1,c2,c3) values(7, '[-61253.07, 0.520645, 0.663066]', '[-0.111598, 573641, -0.760578, 71516.87]');
insert into t1(c1,c2,c3) values(8, '[-0.892018, 929517, 0.57756]', '[57297.17, 33523.38, 0.819768, -0.348583]');
insert into t1(c1,c2,c3) values(9, '[-0.582307, 0.926861, -70780.13]', '[0.051316, -0.316709, -781528, -0.959348]');
insert into t1(c1,c2,c3) values(10, '[-0.277237, -304120, 0.637868]', '[137017, 0.78021, -41681.94, -6168.722]');
create procedure mytest(in id int)
begin
declare t_vec double;
declare t1_vec double;
select cosine_distance(c2,'[-0.884688, 98861.24, -535325]') into t_vec from t where c1<id order by cosine_distance(c2,'[-0.884688, 98861.24, -535325]') approx limit 1;
select cosine_distance(c2,'[-0.582307, 0.926861, -70780.13]') into t1_vec from t1 where c1<id order by cosine_distance(c2,'[-0.582307, 0.926861, -70780.13]') approx limit 1;
if t_vec + t1_vec < 1 then
update t1 set c3='[1,1,1,1]' where c1<id order by cosine_distance(c2,'[-0.582307, 0.926861, -70780.13]') limit 1;
else
insert into t1 values((select count(*) + 1 from t1), '[0,0,0]', '[0,0,0,0]');
end if;
end //
set @vec_1 = 10;
set @vec_2 = 8;
call mytest(@vec_1);
select * from t1;
c1	c2	c3
1	[77125,-80266,-262583]	[0.811744,-1581,-967148,-0.935191]
2	[-64656.9,79241,0.271415]	[20008.8,-663860,-33966.9,30381.5]
3	[-69127.8,-0.623606,-394638]	[-0.355252,754669,192053,-447867]
4	[-59031.2,33294,0.615055]	[274783,-0.707152,-77278.4,-10037]
5	[965953,83764,-971667]	[17127.8,0.010879,111400,-573896]
6	[-92458.8,0.114535,68286.7]	[-80259.6,36706.3,-981281,847266]
7	[-61253.1,0.520645,0.663066]	[-0.111598,573641,-0.760578,71516.9]
8	[-0.892018,929517,0.57756]	[57297.2,33523.4,0.819768,-0.348583]
9	[-0.582307,0.926861,-70780.1]	[1,1,1,1]
10	[-0.277237,-304120,0.637868]	[137017,0.78021,-41681.9,-6168.72]
select * from t1 order by cosine_distance(c2, '[-0.582307, 0.926861, -70780.13]') approx limit 1;
c1	c2	c3
9	[-0.582307,0.926861,-70780.1]	[1,1,1,1]
select * from t1 order by cosine_distance(c2, '[-0.582307, 0.926861, -70780.13]') limit 1;
c1	c2	c3
9	[-0.582307,0.926861,-70780.1]	[1,1,1,1]
call mytest(@vec_2);
select * from t1;
c1	c2	c3
1	[77125,-80266,-262583]	[0.811744,-1581,-967148,-0.935191]
2	[-64656.9,79241,0.271415]	[20008.8,-663860,-33966.9,30381.5]
3	[-69127.8,-0.623606,-394638]	[1,1,1,1]
4	[-59031.2,33294,0.615055]	[274783,-0.707152,-77278.4,-10037]
5	[965953,83764,-971667]	[17127.8,0.010879,111400,-573896]
6	[-92458.8,0.114535,68286.7]	[-80259.6,36706.3,-981281,847266]
7	[-61253.1,0.520645,0.663066]	[-0.111598,573641,-0.760578,71516.9]
8	[-0.892018,929517,0.57756]	[57297.2,33523.4,0.819768,-0.348583]
9	[-0.582307,0.926861,-70780.1]	[1,1,1,1]
10	[-0.277237,-304120,0.637868]	[137017,0.78021,-41681.9,-6168.72]
select *,cosine_distance(c2, '[0,0,0]') from t1 order by cosine_distance(c2, '[0,0,0]') approx limit 1;
c1	c2	c3	cosine_distance(c2, '[0,0,0]')
4	[-59031.2,33294,0.615055]	[274783,-0.707152,-77278.4,-10037]	NULL
select * from t1 order by cosine_distance(c2, '[0,0,0]') limit 1;
c1	c2	c3
1	[77125,-80266,-262583]	[0.811744,-1581,-967148,-0.935191]


"=========================================== query range ==========================================="
drop table if exists t;
drop table if exists t1;
create table t1(c1 int, c2 vector(3), c3 vector(4), primary key(c1), vector index idx1(c2) with (distance=cosine, type=hnsw)) partition by range(c1) (partition p0 values less than (100),partition p1 values less than (1000),partition p2 values less than (10000),partition p3 values less than (100000),partition p4 values less than (1000000));
insert into t1(c1,c2,c3) values(1, '[77125.02, -80265.99, -262583]', '[0.811744, -1581, -967148, -0.935191]');
insert into t1(c1,c2,c3) values(2, '[-64656.9, 79241, 0.271415]', '[20008.81, -663860, -33966.93, 30381.51]');
insert into t1(c1,c2,c3) values(3, '[-69127.82, -0.623606, -394638]', '[-0.355252, 754669, 192053, -447867]');
insert into t1(c1,c2,c3) values(4, '[-59031.19, 33294, 0.615055]', '[274783, -0.707152, -77278.36, -10037]');
insert into t1(c1,c2,c3) values(5, '[965953, 83764, -971667]', '[17127.8, 0.010879, 111400, -573896]');
insert into t1(c1,c2,c3) values(6, '[-92458.83, 0.114535, 68286.7]', '[-80259.65, 36706.27, -981281, 847266]');
insert into t1(c1,c2,c3) values(7, '[-61253.07, 0.520645, 0.663066]', '[-0.111598, 573641, -0.760578, 71516.87]');
insert into t1(c1,c2,c3) values(8, '[-0.892018, 929517, 0.57756]', '[57297.17, 33523.38, 0.819768, -0.348583]');
insert into t1(c1,c2,c3) values(9, '[-0.582307, 0.926861, -70780.13]', '[0.051316, -0.316709, -781528, -0.959348]');
insert into t1(c1,c2,c3) values(10, '[-0.277237, -304120, 0.637868]', '[137017, 0.78021, -41681.94, -6168.722]');
select * from t1 where cosine_distance(c2, '[0,0,0]') is null order by cosine_distance(c2, '[0,0,0]') approx limit 3;
c1	c2	c3
1	[77125,-80266,-262583]	[0.811744,-1581,-967148,-0.935191]
2	[-64656.9,79241,0.271415]	[20008.8,-663860,-33966.9,30381.5]
3	[-69127.8,-0.623606,-394638]	[-0.355252,754669,192053,-447867]
select * from t1 where cosine_distance(c2, '[-0.892018, 929517, 0.57756]') is null order by cosine_distance(c2, '[-0.892018, 929517, 0.57756]') approx limit 3;
c1	c2	c3
select * from t1 where cosine_distance(c2, '[-0.892018, 929517, 0.57756]') is null order by cosine_distance(c2, '[0,0,0]') approx limit 3;
c1	c2	c3
select * from t1 where cosine_distance(c2, '[0,0,0]') is null order by cosine_distance(c2, '[-0.892018, 929517, 0.57756]') approx limit 3;
c1	c2	c3
8	[-0.892018,929517,0.57756]	[57297.2,33523.4,0.819768,-0.348583]
2	[-64656.9,79241,0.271415]	[20008.8,-663860,-33966.9,30381.5]
4	[-59031.2,33294,0.615055]	[274783,-0.707152,-77278.4,-10037]
select * from t1 where cosine_distance(c2, '[0,0,0]') is not null order by cosine_distance(c2, '[0,0,0]') approx limit 3;
c1	c2	c3
select * from t1 where cosine_distance(c2, '[-0.892018, 929517, 0.57756]') is not null order by cosine_distance(c2, '[-0.892018, 929517, 0.57756]') approx limit 3;
c1	c2	c3
8	[-0.892018,929517,0.57756]	[57297.2,33523.4,0.819768,-0.348583]
2	[-64656.9,79241,0.271415]	[20008.8,-663860,-33966.9,30381.5]
4	[-59031.2,33294,0.615055]	[274783,-0.707152,-77278.4,-10037]
select * from t1 where cosine_distance(c2, '[-0.892018, 929517, 0.57756]') is not null order by cosine_distance(c2, '[0,0,0]') approx limit 3;
c1	c2	c3
1	[77125,-80266,-262583]	[0.811744,-1581,-967148,-0.935191]
2	[-64656.9,79241,0.271415]	[20008.8,-663860,-33966.9,30381.5]
3	[-69127.8,-0.623606,-394638]	[-0.355252,754669,192053,-447867]
select * from t1 where cosine_distance(c2, '[0,0,0]') is not null order by cosine_distance(c2, '[-0.892018, 929517, 0.57756]') approx limit 3;
c1	c2	c3
select * from t1 where (select c2 from t1 where c1=5) in ('[965953, 83764, -971667]') order by cosine_distance(c2, '[-0.892018, 929517, 0.57756]') approx limit 3;
c1	c2	c3
8	[-0.892018,929517,0.57756]	[57297.2,33523.4,0.819768,-0.348583]
2	[-64656.9,79241,0.271415]	[20008.8,-663860,-33966.9,30381.5]
4	[-59031.2,33294,0.615055]	[274783,-0.707152,-77278.4,-10037]


"=========================================== AAR cases ==========================================="
drop table if exists t;
drop table if exists t1;
create table t1(c1 int, c2 vector(3), c3 vector(4), primary key(c1), vector index idx1(c2) with (distance=cosine, type=hnsw)) partition by range(c1) (partition p0 values less than (100),partition p1 values less than (1000),partition p2 values less than (10000),partition p3 values less than (100000),partition p4 values less than (1000000));
insert into t1(c1,c2,c3) values(1, '[77125.02, -80265.99, -262583]', '[0.811744, -1581, -967148, -0.935191]');
insert into t1(c1,c2,c3) values(2, '[-64656.9, 79241, 0.271415]', '[20008.81, -663860, -33966.93, 30381.51]');
insert into t1(c1,c2,c3) values(3, '[-69127.82, -0.623606, -394638]', '[-0.355252, 754669, 192053, -447867]');
insert into t1(c1,c2,c3) values(4, '[-59031.19, 33294, 0.615055]', '[274783, -0.707152, -77278.36, -10037]');
insert into t1(c1,c2,c3) values(5, '[965953, 83764, -971667]', '[17127.8, 0.010879, 111400, -573896]');
insert into t1(c1,c2,c3) values(6, '[-92458.83, 0.114535, 68286.7]', '[-80259.65, 36706.27, -981281, 847266]');
insert into t1(c1,c2,c3) values(7, '[-61253.07, 0.520645, 0.663066]', '[-0.111598, 573641, -0.760578, 71516.87]');
insert into t1(c1,c2,c3) values(8, '[-0.892018, 929517, 0.57756]', '[57297.17, 33523.38, 0.819768, -0.348583]');
insert into t1(c1,c2,c3) values(9, '[-0.582307, 0.926861, -70780.13]', '[0.051316, -0.316709, -781528, -0.959348]');
insert into t1(c1,c2,c3) values(10, '[-0.277237, -304120, 0.637868]', '[137017, 0.78021, -41681.94, -6168.722]');
create table t as select c1, count(*) over(partition by c2) from t1;
ERROR 22000: Invalid data type for the operation
drop table if exists t;
drop view if exists v;
drop materialized view if exists mv;
create table t(c1 int, c2 vector(3), c3 vector(4), primary key(c1), vector index idx1(c2) with (distance=cosine, type=hnsw)) partition by range(c1) (partition p0 values less than (100),partition p1 values less than (1000),partition p2 values less than (10000),partition p3 values less than (100000),partition p4 values less than (1000000));
create view v (a1,a2) as select c1,c2 from t partition(p0,p1) where c1<=105 order by cosine_distance(c2, '[0.179629, 430819, -65217.32]') approx limit 20;
create vector index idx2 on v(a2) with(distance=cosine,type=hnsw);
ERROR 0A000: create vector index on view table is not supported
create materialized view mv (b1,b2,primary key(b1)) partition by range(b1) (partition p0 values less than (100), partition p1 values less than (1000), partition p2 values less than (maxvalue)) with column group(each column) refresh complete on demand as select c1,c2 from t partition(p0,p1) where c1<=105 order by cosine_distance(c2, '[0.179629, 430819, -65217.32]') approx limit 100;
create vector index idx2 on mv(b2) with(distance=cosine,type=hnsw);
ERROR 0A000: create vector index on view table is not supported
replace into v values(1,'[0,0,0]','[1,1,1,1]');
ERROR HY000: The target table v of the INSERT is not insertable-into
create or replace view v as select * from t;
replace into v values(1,'[0,0,0]','[1,1,1,1]');
select * from v;
c1	c2	c3
1	[0,0,0]	[1,1,1,1]
2	[-823198,-0.217028,93069.8]	[-80656.6,276444,-29188.1,251778]
3	[-32020.6,75127.9,0.77094]	[180226,-0.297448,-0.750788,-67573.9]
4	[397583,541347,-65783.7]	[-747523,-438597,-690027,-97203.1]
5	[0.179629,430819,-65217.3]	[-724966,219967,-739239,-0.571165]
6	[-0.253108,-0.613931,-874511]	[0.608538,926121,393602,-0.155942]
7	[-319792,0.376752,14152]	[547577,-0.999079,0.390207,-0.140902]
8	[-970769,-13483,254267]	[-0.117113,0.932178,-279892,-69330.7]
9	[-0.884688,98861.2,-535325]	[-0.022933,-862237,-0.156035,-706071]
10	[0.578781,-0.058835,-746529]	[304414,73030.7,-0.462573,604848]
101	[-22158.2,0.512567,-5659]	[50244.1,-6531.87,-0.508316,-228316]
102	[-0.486493,-0.944789,439948]	[-656128,0.841715,4706.49,-56339]
103	[-57512,445269,-19096.8]	[-0.939627,-0.833651,0.139458,-75281.8]
104	[157360,-83220,24803]	[-125725,-650260,-17108.7,832224]
105	[473641,-0.149836,355051]	[-858328,-0.545063,0.303736,-62990.1]
106	[-77417.7,65883.3,0.681227]	[-0.285769,270614,-16362.1,-130630]
107	[757225,-66493.4,-213406]	[-0.111738,0.688164,-603596,-764143]
108	[25381.3,-36646.2,-81309.8]	[-355875,-277764,21811,0.052467]
109	[0.218711,465897,-44697.2]	[-96395.5,0.670629,-78181.5,0.329958]
110	[-0.201769,-0.220271,0.150037]	[-455053,-96612.3,-583978,-0.615918]
1001	[57811.3,-0.214074,0.115481]	[-0.776308,-794251,-0.972245,448946]
1002	[-0.871165,0.502377,-92192.8]	[0.601641,0.536642,-69678.3,-154154]
1003	[645362,-226965,526258]	[-126709,-772253,-4315.65,0.055967]
1004	[34691,-0.247566,-0.868466]	[-0.899574,877090,-577067,-87680.9]
1005	[0.478095,-7136.01,126378]	[0.779142,244780,0.875969,-13970.2]
1006	[0.239433,-605871,61395.8]	[25435.7,0.185164,426302,-547177]
1007	[-51915.9,508281,116383]	[-0.609978,-0.636346,-0.142706,-92326.7]
1008	[367605,51923.8,807613]	[-0.890944,-0.107754,31463,200530]
1009	[-719458,81915.1,-0.207763]	[0.376095,904052,932008,-776846]
1010	[762802,-0.970555,252311]	[0.534972,-0.752701,-6701.45,-76545]
10001	[-43769.2,44633.6,57298]	[1949.23,303041,72542.6,-301216]
10002	[343429,439714,0.979698]	[-72930.4,-0.609663,-0.471619,0.998431]
10003	[0.450559,-403340,727544]	[996579,470552,-46358,-68583.3]
10004	[-43597,-56812.9,-0.976134]	[-35436.3,-0.658155,0.164836,65891.6]
10005	[-0.546647,0.085977,-432903]	[580521,509194,10281,488413]
10006	[-0.618333,-0.402319,94610.1]	[968018,-52954.6,0.156552,-81220.9]
10007	[-88010.2,0.511376,82124.7]	[70797.9,-0.37462,11044,36229.6]
10008	[-98503,408683,186061]	[-13081,761953,90037.4,-76073.7]
10009	[-426621,216651,0.50529]	[-33180.2,-0.600476,0.160138,-0.453023]
10010	[512149,-0.632866,0.328226]	[23706.8,-0.168282,24591.1,32158.5]
100001	[966457,54472.6,72794.2]	[0.597617,-18206,-0.378432,406036]
100002	[26778.7,-29305,0.019109]	[-958337,0.256426,-704725,296150]
100003	[0.722868,263971,0.217136]	[166625,0.26823,0.052328,0.534109]
100004	[0.649972,-0.323987,571442]	[-16366,57795.1,-72511.8,-242474]
100005	[-0.934345,-49343.8,0.913269]	[76492.8,-242207,-0.214888,-0.784362]
100006	[-77282.2,-38667,88183.8]	[-14085.5,962186,0.049489,-206037]
100007	[0.673657,-2357.65,66711.1]	[6650.41,119421,875021,284071]
100008	[-14366.4,22842.5,279158]	[360894,-135705,36872.5,-0.445259]
100009	[-0.352528,298886,0.320923]	[-907820,274839,-952298,-8038.5]
100010	[-800085,-906594,-0.381223]	[658934,0.257607,-91720.5,0.883427]
select * from t;
c1	c2	c3
1	[0,0,0]	[1,1,1,1]
2	[-823198,-0.217028,93069.8]	[-80656.6,276444,-29188.1,251778]
3	[-32020.6,75127.9,0.77094]	[180226,-0.297448,-0.750788,-67573.9]
4	[397583,541347,-65783.7]	[-747523,-438597,-690027,-97203.1]
5	[0.179629,430819,-65217.3]	[-724966,219967,-739239,-0.571165]
6	[-0.253108,-0.613931,-874511]	[0.608538,926121,393602,-0.155942]
7	[-319792,0.376752,14152]	[547577,-0.999079,0.390207,-0.140902]
8	[-970769,-13483,254267]	[-0.117113,0.932178,-279892,-69330.7]
9	[-0.884688,98861.2,-535325]	[-0.022933,-862237,-0.156035,-706071]
10	[0.578781,-0.058835,-746529]	[304414,73030.7,-0.462573,604848]
101	[-22158.2,0.512567,-5659]	[50244.1,-6531.87,-0.508316,-228316]
102	[-0.486493,-0.944789,439948]	[-656128,0.841715,4706.49,-56339]
103	[-57512,445269,-19096.8]	[-0.939627,-0.833651,0.139458,-75281.8]
104	[157360,-83220,24803]	[-125725,-650260,-17108.7,832224]
105	[473641,-0.149836,355051]	[-858328,-0.545063,0.303736,-62990.1]
106	[-77417.7,65883.3,0.681227]	[-0.285769,270614,-16362.1,-130630]
107	[757225,-66493.4,-213406]	[-0.111738,0.688164,-603596,-764143]
108	[25381.3,-36646.2,-81309.8]	[-355875,-277764,21811,0.052467]
109	[0.218711,465897,-44697.2]	[-96395.5,0.670629,-78181.5,0.329958]
110	[-0.201769,-0.220271,0.150037]	[-455053,-96612.3,-583978,-0.615918]
1001	[57811.3,-0.214074,0.115481]	[-0.776308,-794251,-0.972245,448946]
1002	[-0.871165,0.502377,-92192.8]	[0.601641,0.536642,-69678.3,-154154]
1003	[645362,-226965,526258]	[-126709,-772253,-4315.65,0.055967]
1004	[34691,-0.247566,-0.868466]	[-0.899574,877090,-577067,-87680.9]
1005	[0.478095,-7136.01,126378]	[0.779142,244780,0.875969,-13970.2]
1006	[0.239433,-605871,61395.8]	[25435.7,0.185164,426302,-547177]
1007	[-51915.9,508281,116383]	[-0.609978,-0.636346,-0.142706,-92326.7]
1008	[367605,51923.8,807613]	[-0.890944,-0.107754,31463,200530]
1009	[-719458,81915.1,-0.207763]	[0.376095,904052,932008,-776846]
1010	[762802,-0.970555,252311]	[0.534972,-0.752701,-6701.45,-76545]
10001	[-43769.2,44633.6,57298]	[1949.23,303041,72542.6,-301216]
10002	[343429,439714,0.979698]	[-72930.4,-0.609663,-0.471619,0.998431]
10003	[0.450559,-403340,727544]	[996579,470552,-46358,-68583.3]
10004	[-43597,-56812.9,-0.976134]	[-35436.3,-0.658155,0.164836,65891.6]
10005	[-0.546647,0.085977,-432903]	[580521,509194,10281,488413]
10006	[-0.618333,-0.402319,94610.1]	[968018,-52954.6,0.156552,-81220.9]
10007	[-88010.2,0.511376,82124.7]	[70797.9,-0.37462,11044,36229.6]
10008	[-98503,408683,186061]	[-13081,761953,90037.4,-76073.7]
10009	[-426621,216651,0.50529]	[-33180.2,-0.600476,0.160138,-0.453023]
10010	[512149,-0.632866,0.328226]	[23706.8,-0.168282,24591.1,32158.5]
100001	[966457,54472.6,72794.2]	[0.597617,-18206,-0.378432,406036]
100002	[26778.7,-29305,0.019109]	[-958337,0.256426,-704725,296150]
100003	[0.722868,263971,0.217136]	[166625,0.26823,0.052328,0.534109]
100004	[0.649972,-0.323987,571442]	[-16366,57795.1,-72511.8,-242474]
100005	[-0.934345,-49343.8,0.913269]	[76492.8,-242207,-0.214888,-0.784362]
100006	[-77282.2,-38667,88183.8]	[-14085.5,962186,0.049489,-206037]
100007	[0.673657,-2357.65,66711.1]	[6650.41,119421,875021,284071]
100008	[-14366.4,22842.5,279158]	[360894,-135705,36872.5,-0.445259]
100009	[-0.352528,298886,0.320923]	[-907820,274839,-952298,-8038.5]
100010	[-800085,-906594,-0.381223]	[658934,0.257607,-91720.5,0.883427]
select * from t order by cosine_distance(c2,'[0,0,0]') approx limit 1;
c1	c2	c3
5	[0.179629,430819,-65217.3]	[-724966,219967,-739239,-0.571165]
drop table if exists t1;
create table t1(c1 int, c2 vector(3), c3 vector(4), primary key(c1), vector index idx1(c2) with (distance=cosine, type=hnsw)) partition by range(c1) (partition p0 values less than (100),partition p1 values less than (1000),partition p2 values less than (10000),partition p3 values less than (100000),partition p4 values less than (1000000));
insert into t1(c1,c2,c3) values(1, '[77125.02, -80265.99, -262583]', '[0.811744, -1581, -967148, -0.935191]');
insert into t1(c1,c2,c3) values(2, '[-64656.9, 79241, 0.271415]', '[20008.81, -663860, -33966.93, 30381.51]');
insert into t1(c1,c2,c3) values(3, '[-69127.82, -0.623606, -394638]', '[-0.355252, 754669, 192053, -447867]');
insert into t1(c1,c2,c3) values(4, '[-59031.19, 33294, 0.615055]', '[274783, -0.707152, -77278.36, -10037]');
insert into t1(c1,c2,c3) values(5, '[965953, 83764, -971667]', '[17127.8, 0.010879, 111400, -573896]');
insert into t1(c1,c2,c3) values(6, '[-92458.83, 0.114535, 68286.7]', '[-80259.65, 36706.27, -981281, 847266]');
insert into t1(c1,c2,c3) values(7, '[-61253.07, 0.520645, 0.663066]', '[-0.111598, 573641, -0.760578, 71516.87]');
insert into t1(c1,c2,c3) values(8, '[-0.892018, 929517, 0.57756]', '[57297.17, 33523.38, 0.819768, -0.348583]');
insert into t1(c1,c2,c3) values(9, '[-0.582307, 0.926861, -70780.13]', '[0.051316, -0.316709, -781528, -0.959348]');
insert into t1(c1,c2,c3) values(10, '[-0.277237, -304120, 0.637868]', '[137017, 0.78021, -41681.94, -6168.722]');
select * from t1 where exists(select * from t1 order by cosine_distance(c2, '[-59031.19, 33294, 0.615055]') approx limit 3) order by cosine_distance(c2, '[-59031.19, 33294, 0.615055]') approx limit 1;
c1	c2	c3
4	[-59031.2,33294,0.615055]	[274783,-0.707152,-77278.4,-10037]
drop table if exists t1;
create table t1(c1 int, c2 vector(3), c3 vector(4), primary key(c1), vector index idx1(c2) with (distance=cosine, type=hnsw)) partition by range(c1) (partition p0 values less than (100),partition p1 values less than (1000),partition p2 values less than (10000),partition p3 values less than (100000),partition p4 values less than (1000000));
insert into t1(c1,c2,c3) values(1, '[77125.02, -80265.99, -262583]', '[0.811744, -1581, -967148, -0.935191]');
insert into t1(c1,c2,c3) values(2, '[-64656.9, 79241, 0.271415]', '[20008.81, -663860, -33966.93, 30381.51]');
insert into t1(c1,c2,c3) values(3, '[-69127.82, -0.623606, -394638]', '[-0.355252, 754669, 192053, -447867]');
insert into t1(c1,c2,c3) values(4, '[-59031.19, 33294, 0.615055]', '[274783, -0.707152, -77278.36, -10037]');
insert into t1(c1,c2,c3) values(5, '[965953, 83764, -971667]', '[17127.8, 0.010879, 111400, -573896]');
insert into t1(c1,c2,c3) values(6, '[-92458.83, 0.114535, 68286.7]', '[-80259.65, 36706.27, -981281, 847266]');
insert into t1(c1,c2,c3) values(7, '[-61253.07, 0.520645, 0.663066]', '[-0.111598, 573641, -0.760578, 71516.87]');
insert into t1(c1,c2,c3) values(8, '[-0.892018, 929517, 0.57756]', '[57297.17, 33523.38, 0.819768, -0.348583]');
insert into t1(c1,c2,c3) values(9, '[-0.582307, 0.926861, -70780.13]', '[0.051316, -0.316709, -781528, -0.959348]');
insert into t1(c1,c2,c3) values(10, '[-0.277237, -304120, 0.637868]', '[137017, 0.78021, -41681.94, -6168.722]');
select * from t order by cosine_distance(c2,c3) approx limit 3;
ERROR 0A000: Using vector index without const param is not supported
drop table if exists t1;
drop materialized view if exists mv;
create table t1(c1 int, c2 vector(3), c3 vector(4), primary key(c1), vector index idx1(c2) with (distance=cosine, type=hnsw)) partition by range(c1) (partition p0 values less than (100),partition p1 values less than (1000),partition p2 values less than (10000),partition p3 values less than (100000),partition p4 values less than (1000000));
insert into t1(c1,c2,c3) values(1, '[77125.02, -80265.99, -262583]', '[0.811744, -1581, -967148, -0.935191]');
insert into t1(c1,c2,c3) values(2, '[-64656.9, 79241, 0.271415]', '[20008.81, -663860, -33966.93, 30381.51]');
insert into t1(c1,c2,c3) values(3, '[-69127.82, -0.623606, -394638]', '[-0.355252, 754669, 192053, -447867]');
insert into t1(c1,c2,c3) values(4, '[-59031.19, 33294, 0.615055]', '[274783, -0.707152, -77278.36, -10037]');
insert into t1(c1,c2,c3) values(5, '[965953, 83764, -971667]', '[17127.8, 0.010879, 111400, -573896]');
insert into t1(c1,c2,c3) values(6, '[-92458.83, 0.114535, 68286.7]', '[-80259.65, 36706.27, -981281, 847266]');
insert into t1(c1,c2,c3) values(7, '[-61253.07, 0.520645, 0.663066]', '[-0.111598, 573641, -0.760578, 71516.87]');
insert into t1(c1,c2,c3) values(8, '[-0.892018, 929517, 0.57756]', '[57297.17, 33523.38, 0.819768, -0.348583]');
insert into t1(c1,c2,c3) values(9, '[-0.582307, 0.926861, -70780.13]', '[0.051316, -0.316709, -781528, -0.959348]');
insert into t1(c1,c2,c3) values(10, '[-0.277237, -304120, 0.637868]', '[137017, 0.78021, -41681.94, -6168.722]');
create materialized view mv (b1,b2,primary key(b2)) partition by range(b1) (partition p0 values less than (100), partition p1 values less than (1000), partition p2 values less than (maxvalue)) with column group(each column) refresh complete on demand as select c1,c2 from t partition(p0,p1) where c1<=105 order by cosine_distance(c2, '[0.179629, 430819, -65217.32]') approx limit 100;
ERROR 42000: The used storage engine can't index column 'b2'


"=========================================== column group with create table as select issue ==========================================="
row
drop table if exists t;
drop table if exists t1;
drop table if exists t2;
drop table if exists t3;
alter system set default_table_store_format='compound';
create table t(c1 int, c2 vector(3), c3 vector(4), primary key(c1), vector index idx1(c2) with (distance=cosine, type=hnsw)) partition by range(c1) (partition p0 values less than (100),partition p1 values less than (1000),partition p2 values less than (10000),partition p3 values less than (100000),partition p4 values less than (1000000));
insert into t(c1,c2,c3) values(1, '[77125.02, -80265.99, -262583]', '[0.811744, -1581, -967148, -0.935191]');
insert into t(c1,c2,c3) values(2, '[-64656.9, 79241, 0.271415]', '[20008.81, -663860, -33966.93, 30381.51]');
insert into t(c1,c2,c3) values(3, '[-69127.82, -0.623606, -394638]', '[-0.355252, 754669, 192053, -447867]');
insert into t(c1,c2,c3) values(4, '[-59031.19, 33294, 0.615055]', '[274783, -0.707152, -77278.36, -10037]');
insert into t(c1,c2,c3) values(5, '[965953, 83764, -971667]', '[17127.8, 0.010879, 111400, -573896]');
insert into t(c1,c2,c3) values(6, '[-92458.83, 0.114535, 68286.7]', '[-80259.65, 36706.27, -981281, 847266]');
insert into t(c1,c2,c3) values(7, '[-61253.07, 0.520645, 0.663066]', '[-0.111598, 573641, -0.760578, 71516.87]');
insert into t(c1,c2,c3) values(8, '[-0.892018, 929517, 0.57756]', '[57297.17, 33523.38, 0.819768, -0.348583]');
insert into t(c1,c2,c3) values(9, '[-0.582307, 0.926861, -70780.13]', '[0.051316, -0.316709, -781528, -0.959348]');
insert into t(c1,c2,c3) values(10, '[-0.277237, -304120, 0.637868]', '[137017, 0.78021, -41681.94, -6168.722]');
create table t2 as select c1,cosine_distance(c2, "[1,1,1]"), avg(c3) from t;
create table t3 as select c1,cosine_distance(c2, [1,1,1]), avg(c3) from t;
drop table if exists t;
drop table if exists t1;
drop table if exists t2;
drop table if exists t3;
alter system set default_table_store_format='column';
create table t(c1 int, c2 vector(3), c3 vector(4), primary key(c1), vector index idx1(c2) with (distance=cosine, type=hnsw)) partition by range(c1) (partition p0 values less than (100),partition p1 values less than (1000),partition p2 values less than (10000),partition p3 values less than (100000),partition p4 values less than (1000000));
insert into t(c1,c2,c3) values(1, '[77125.02, -80265.99, -262583]', '[0.811744, -1581, -967148, -0.935191]');
insert into t(c1,c2,c3) values(2, '[-64656.9, 79241, 0.271415]', '[20008.81, -663860, -33966.93, 30381.51]');
insert into t(c1,c2,c3) values(3, '[-69127.82, -0.623606, -394638]', '[-0.355252, 754669, 192053, -447867]');
insert into t(c1,c2,c3) values(4, '[-59031.19, 33294, 0.615055]', '[274783, -0.707152, -77278.36, -10037]');
insert into t(c1,c2,c3) values(5, '[965953, 83764, -971667]', '[17127.8, 0.010879, 111400, -573896]');
insert into t(c1,c2,c3) values(6, '[-92458.83, 0.114535, 68286.7]', '[-80259.65, 36706.27, -981281, 847266]');
insert into t(c1,c2,c3) values(7, '[-61253.07, 0.520645, 0.663066]', '[-0.111598, 573641, -0.760578, 71516.87]');
insert into t(c1,c2,c3) values(8, '[-0.892018, 929517, 0.57756]', '[57297.17, 33523.38, 0.819768, -0.348583]');
insert into t(c1,c2,c3) values(9, '[-0.582307, 0.926861, -70780.13]', '[0.051316, -0.316709, -781528, -0.959348]');
insert into t(c1,c2,c3) values(10, '[-0.277237, -304120, 0.637868]', '[137017, 0.78021, -41681.94, -6168.722]');
create table t2 as select c1,cosine_distance(c2, "[1,1,1]"), avg(c3) from t;
create table t3 as select c1,cosine_distance(c2, [1,1,1]), avg(c3) from t;
drop table if exists t;
drop table if exists t1;
drop table if exists t2;
drop table if exists t3;
alter system set default_table_store_format='row';
create table t(c1 int, c2 vector(3), c3 vector(4), primary key(c1), vector index idx1(c2) with (distance=cosine, type=hnsw)) partition by range(c1) (partition p0 values less than (100),partition p1 values less than (1000),partition p2 values less than (10000),partition p3 values less than (100000),partition p4 values less than (1000000));
insert into t(c1,c2,c3) values(1, '[77125.02, -80265.99, -262583]', '[0.811744, -1581, -967148, -0.935191]');
insert into t(c1,c2,c3) values(2, '[-64656.9, 79241, 0.271415]', '[20008.81, -663860, -33966.93, 30381.51]');
insert into t(c1,c2,c3) values(3, '[-69127.82, -0.623606, -394638]', '[-0.355252, 754669, 192053, -447867]');
insert into t(c1,c2,c3) values(4, '[-59031.19, 33294, 0.615055]', '[274783, -0.707152, -77278.36, -10037]');
insert into t(c1,c2,c3) values(5, '[965953, 83764, -971667]', '[17127.8, 0.010879, 111400, -573896]');
insert into t(c1,c2,c3) values(6, '[-92458.83, 0.114535, 68286.7]', '[-80259.65, 36706.27, -981281, 847266]');
insert into t(c1,c2,c3) values(7, '[-61253.07, 0.520645, 0.663066]', '[-0.111598, 573641, -0.760578, 71516.87]');
insert into t(c1,c2,c3) values(8, '[-0.892018, 929517, 0.57756]', '[57297.17, 33523.38, 0.819768, -0.348583]');
insert into t(c1,c2,c3) values(9, '[-0.582307, 0.926861, -70780.13]', '[0.051316, -0.316709, -781528, -0.959348]');
insert into t(c1,c2,c3) values(10, '[-0.277237, -304120, 0.637868]', '[137017, 0.78021, -41681.94, -6168.722]');
create table t1 as select c1,cosine_distance(c2, '[1,1,1]'), avg(c3) from t;
create table t2 as select c1,cosine_distance(c2, "[1,1,1]"), avg(c3) from t;
create table t3 as select c1,cosine_distance(c2, [1,1,1]), avg(c3) from t;
alter system set default_table_store_format='row';


"=========================================== customer ticket ==========================================="
drop table if exists asia_knowledge;
CREATE TABLE asia_knowledge ( `id` VARCHAR(4096) NOT NULL, `text` LONGTEXT DEFAULT NULL, `embeddings` VECTOR (1024) DEFAULT NULL, `metadata` json DEFAULT NULL, PRIMARY KEY (`id`), VECTOR KEY `vidx` (`embeddings`) WITH (DISTANCE = L2, M = 16, EF_CONSTRUCTION = 256, LIB = VSAG, TYPE = HNSW, EF_SEARCH = 64));
DELETE FROM asia_knowledge WHERE metadata->'$.url'='/Users/hanmingxuan/PycharmProjects/pcreditagents/asia/frontend/components/files/敦煌ip文案生成师/敦煌知识库.txt';
DELETE FROM `asia_knowledge` WHERE `id`='default-app-id--ffd1bd213a42b6f2967ecf783d131f507ada227e2d097b5c9857a1627db27570' LIMIT 1;
