drop table if exists t1;
drop table if exists t1;
create table t1 (nr int, a tinyblob, b text, c mediumblob, d longtext) with column group (all columns, each column);
insert into t1 values(1, 'a', 'b', repeat('c', 100000), repeat('d', 1000000));
insert into t1 values(2, 'aa', 'bb', repeat('c', 200000), repeat('d', 2000000));
insert into t1 values(3, 'aaa', 'bbb', repeat('c', 300000), repeat('d', 3000000));
insert into t1 values(10, 'aaa', 'bbb', repeat('c', 300000), repeat('d', 5000000));
insert into t1 values(4, null, null, null, null);
insert into t1 values(5, '', '', '', '');
select nr, a, b, length(c), length(d) from t1 order by nr asc;
nr	a	b	length(c)	length(d)
1	a	b	100000	1000000
2	aa	bb	200000	2000000
3	aaa	bbb	300000	3000000
4	NULL	NULL	NULL	NULL
5			0	0
10	aaa	bbb	300000	5000000
delete from t1 where a is null;
update t1 set c = 'updatemedium', d = 'updatelong' where b = 'bbb';
select nr, a, b, length(c), length(d) from t1 order by nr asc;
nr	a	b	length(c)	length(d)
1	a	b	100000	1000000
2	aa	bb	200000	2000000
3	aaa	bbb	12	10
5			0	0
10	aaa	bbb	12	10
alter system major freeze tenant = sys;
alter system major freeze tenant = all_user;
alter system major freeze tenant = all_meta;
insert /*+ query_timeout(10000000000) */ into t1 values(6, 'aaa', 'bbb', repeat('c', 300000), repeat('d', 6000000));
insert /*+ query_timeout(10000000000) */ into t1 values(7, 'aaa', 'bbb', repeat('c', 300000), repeat('d', 9000000));
select crc32(nr), crc32(a), crc32(b), crc32(c), crc32(d) from t1 order by nr;
crc32(nr)	crc32(a)	crc32(b)	crc32(c)	crc32(d)
2212294583	3904355907	1908338681	436501714	2192396453
450215437	126491095	3048086446	846713831	1356973397
1842515611	4027020077	1080413965	741297065	2711342577
2226203566	0	0	0	0
498629140	4027020077	1080413965	2293788493	4048987924
1790921346	4027020077	1080413965	2293788493	974950925
2707236321	4027020077	1080413965	741297065	2711342577
alter table t1 add primary key(nr);
select crc32(nr), crc32(a), crc32(b), crc32(c), crc32(d) from t1 order by nr;
crc32(nr)	crc32(a)	crc32(b)	crc32(c)	crc32(d)
2212294583	3904355907	1908338681	436501714	2192396453
450215437	126491095	3048086446	846713831	1356973397
1842515611	4027020077	1080413965	741297065	2711342577
2226203566	0	0	0	0
498629140	4027020077	1080413965	2293788493	4048987924
1790921346	4027020077	1080413965	2293788493	974950925
2707236321	4027020077	1080413965	741297065	2711342577
