drop table if exists t1;
drop table if exists t1;
create table t1 (nr int, a tinyblob, b text, c mediumblob, d longtext) partition by hash(nr) partitions 4;
insert into t1 values(1, 'a', 'b', repeat('c', 100000), repeat('d', 1000000));
insert into t1 values(2, 'aa', 'bb', repeat('c', 200000), repeat('d', 2000000));
insert into t1 values(3, 'aaa', 'bbb', repeat('c', 300000), repeat('d', 3000000));
insert into t1 values(10, 'aaa', 'bbb', repeat('c', 300000), repeat('d', 5000000));
insert into t1 values(4, null, null, null, null);
insert into t1 values(5, '', '', '', '');
select nr, a, b, length(c), length(d) from t1 order by nr asc;
nr	a	b	length(c)	length(d)
1	a	b	100000	1000000
2	aa	bb	200000	2000000
3	aaa	bbb	300000	3000000
4	NULL	NULL	NULL	NULL
5			0	0
10	aaa	bbb	300000	5000000
delete from t1 where a is null;
update t1 set c = 'updatemedium', d = 'updatelong' where b = 'bbb';
select nr, a, b, length(c), length(d) from t1 order by nr asc;
nr	a	b	length(c)	length(d)
1	a	b	100000	1000000
2	aa	bb	200000	2000000
3	aaa	bbb	12	10
5			0	0
10	aaa	bbb	12	10
alter system major freeze tenant = sys;
alter system major freeze tenant = all_user;
alter system major freeze tenant = all_meta;
insert into t1 values(6, 'aaa', 'bbb', repeat('c', 300000), repeat('d', 6000000));
insert into t1 values(7, 'aaa', 'bbb', repeat('c', 300000), repeat('d', 9000000));
select crc32(nr), crc32(a), crc32(b), crc32(c), crc32(d) from t1 order by nr;
crc32(nr)	crc32(a)	crc32(b)	crc32(c)	crc32(d)
2212294583	3904355907	1908338681	436501714	2192396453
450215437	126491095	3048086446	846713831	1356973397
1842515611	4027020077	1080413965	741297065	2711342577
2226203566	0	0	0	0
498629140	4027020077	1080413965	2293788493	4048987924
1790921346	4027020077	1080413965	2293788493	974950925
2707236321	4027020077	1080413965	741297065	2711342577
alter table t1 modify column d mediumtext;
show create table t1;
Table	Create Table
t1	CREATE TABLE `t1` (
  `nr` int(11) DEFAULT NULL,
  `a` tinyblob DEFAULT NULL,
  `b` text DEFAULT NULL,
  `c` mediumblob DEFAULT NULL,
  `d` mediumtext DEFAULT NULL
) ORGANIZATION INDEX DEFAULT CHARSET = utf8mb4 ROW_FORMAT = DYNAMIC COMPRESSION = 'zstd_1.3.8' REPLICA_NUM = replica_num BLOCK_SIZE = 16384 USE_BLOOM_FILTER = FALSE ENABLE_MACRO_BLOCK_BLOOM_FILTER = FALSE TABLET_SIZE = 134217728 PCTFREE = 0
 partition by hash(nr)
(partition `p0`,
partition `p1`,
partition `p2`,
partition `p3`)
select crc32(nr), crc32(a), crc32(b), crc32(c), crc32(d) from t1 order by nr;
crc32(nr)	crc32(a)	crc32(b)	crc32(c)	crc32(d)
2212294583	3904355907	1908338681	436501714	2192396453
450215437	126491095	3048086446	846713831	1356973397
1842515611	4027020077	1080413965	741297065	2711342577
2226203566	0	0	0	0
498629140	4027020077	1080413965	2293788493	4048987924
1790921346	4027020077	1080413965	2293788493	974950925
2707236321	4027020077	1080413965	741297065	2711342577
drop table if exists tab;
CREATE TABLE tab(c1 int NOT NULL PRIMARY KEY,c2 POINT NOT NULL, c3 LINESTRING NOT NULL,c4 POLYGON NOT NULL,c5 GEOMETRY NOT NULL);
INSERT INTO tab(c1,c2,c3,c4,c5) VALUES(2,ST_GeomFromText('POINT(20 20)'),ST_GeomFromText('LINESTRING(20 20,30 30,40 40)'), ST_GeomFromText('POLYGON((40 50,40 70,50 100,70 100,80 80,70 50,40 50))'), ST_GeomFromText('POLYGON((40 50,40 70,50 100,70 100,80 80,70 50,40 50))'));
CREATE INDEX index2 ON tab(c2) COMMENT 'Check index level merge MERGE_THRESHOLD=-1';
ALTER TABLE tab MODIFY COLUMN c5 Geometry;
