purge recyclebin;
CREATE DATABASE IF NOT EXISTS naaj_test;
USE naaj_test;
SET sql_mode='STRICT_ALL_TABLES,NO_ZERO_IN_DATE,NO_AUTO_VALUE_ON_ZERO';
#设置超时等待时间
SET wait_timeout=30000000;
SET ob_trx_timeout = 30000000;
SET ob_query_timeout = 30000000;
#########################创建事务、触发器、存储过程、自定义函数，修改引用列为自增列，然后再执行########
#####事务#####
DROP TABLE IF EXISTS t1;
CREATE TABLE t1(c0 FLOAT(5,0),
c1 INT,
c2 VARCHAR(10))
PARTITION BY RANGE(c1)
(PARTITION p1 VALUES LESS THAN(15),
PARTITION p2 VALUES LESS THAN(25),
PARTITION p3 VALUES LESS THAN(35)
);
INSERT INTO t1 VALUES(1,0,'A'),(2,2,'B'),(3,4,'C'),(4,8,'D'),(5,16,'E'),(6,18,'F'),(7,20,'G');
SET @@AUTOCOMMIT=0;
BEGIN;
ALTER TABLE t1 MODIFY c1 INT PRIMARY KEY AUTO_INCREMENT;
ROLLBACK;
SHOW CREATE TABLE t1;
Table	Create Table
t1	CREATE TABLE `t1` (
  `c0` float(5,0) DEFAULT NULL,
  `c1` int(11) NOT NULL AUTO_INCREMENT,
  `c2` varchar(10) DEFAULT NULL,
  PRIMARY KEY (`c1`)
) ORGANIZATION INDEX AUTO_INCREMENT = 21 AUTO_INCREMENT_MODE = 'ORDER' DEFAULT CHARSET = utf8mb4 ROW_FORMAT = DYNAMIC COMPRESSION = 'zstd_1.3.8' REPLICA_NUM = 1 BLOCK_SIZE = 16384 USE_BLOOM_FILTER = FALSE ENABLE_MACRO_BLOCK_BLOOM_FILTER = FALSE TABLET_SIZE = 134217728 PCTFREE = 0
 partition by range(c1)
(partition `p1` values less than (15),
partition `p2` values less than (25),
partition `p3` values less than (35))
INSERT INTO t1 VALUES(8,NULL,'G'),(9,NULL,'H'),(10,-50,'I'),(11,28,'G'),(12,NULL,'K'),(13,NULL,'L');
SELECT * FROM t1 ORDER BY 1;
c0	c1	c2
1	0	A
2	2	B
3	4	C
4	8	D
5	16	E
6	18	F
7	20	G
8	21	G
9	22	H
10	-50	I
11	28	G
12	29	K
13	30	L
ROLLBACK;
SELECT * FROM t1 ORDER BY 1;
c0	c1	c2
1	0	A
2	2	B
3	4	C
4	8	D
5	16	E
6	18	F
7	20	G
INSERT INTO t1(c0,c2) VALUES(14,'M'),(15,'N');
SELECT * FROM t1 ORDER BY 1;
c0	c1	c2
1	0	A
2	2	B
3	4	C
4	8	D
5	16	E
6	18	F
7	20	G
14	31	M
15	32	N
ROLLBACK;
SELECT * FROM t1 ORDER BY 1;
c0	c1	c2
1	0	A
2	2	B
3	4	C
4	8	D
5	16	E
6	18	F
7	20	G
COMMIT;
DROP TABLE IF EXISTS t1;
CREATE TABLE t1(c0 FLOAT(5,0),
c1 INT,
c2 VARCHAR(10))
PARTITION BY RANGE(c1)
(PARTITION p1 VALUES LESS THAN(15),
PARTITION p2 VALUES LESS THAN(25),
PARTITION p3 VALUES LESS THAN(35)
);
INSERT INTO t1 VALUES(1,0,'A'),(2,2,'B'),(3,4,'C'),(4,8,'D'),(5,16,'E'),(6,18,'F'),(7,20,'G');
BEGIN;
INSERT INTO t1 VALUES(8,21,'H');
SAVEPOINT s1;
ALTER TABLE t1 MODIFY c1 INT PRIMARY KEY AUTO_INCREMENT;
SAVEPOINT s2;
INSERT INTO t1(c0) VALUES(9),(10),(11);
ROLLBACK TO s1;
ERROR 42000: savepoint does not exist
ROLLBACK TO s2;
SELECT * FROM t1 ORDER BY 1;
c0	c1	c2
1	0	A
2	2	B
3	4	C
4	8	D
5	16	E
6	18	F
7	20	G
8	21	H
SHOW CREATE TABLE t1;
Table	Create Table
t1	CREATE TABLE `t1` (
  `c0` float(5,0) DEFAULT NULL,
  `c1` int(11) NOT NULL AUTO_INCREMENT,
  `c2` varchar(10) DEFAULT NULL,
  PRIMARY KEY (`c1`)
) ORGANIZATION INDEX AUTO_INCREMENT = 25 AUTO_INCREMENT_MODE = 'ORDER' DEFAULT CHARSET = utf8mb4 ROW_FORMAT = DYNAMIC COMPRESSION = 'zstd_1.3.8' REPLICA_NUM = 1 BLOCK_SIZE = 16384 USE_BLOOM_FILTER = FALSE ENABLE_MACRO_BLOCK_BLOOM_FILTER = FALSE TABLET_SIZE = 134217728 PCTFREE = 0
 partition by range(c1)
(partition `p1` values less than (15),
partition `p2` values less than (25),
partition `p3` values less than (35))
COMMIT;
BEGIN;
SAVEPOINT s1;
INSERT INTO t1 VALUES(9,NULL,'H'),(10,NULL,'I'),(11,28,'J'),(12,-50,'K'),(13,NULL,'L'),(14,NULL,'M');
SAVEPOINT s2;
INSERT INTO t1(c0) VALUES(15),(16);
ROLLBACK TO s1;
SELECT * FROM t1 ORDER BY 1;
c0	c1	c2
1	0	A
2	2	B
3	4	C
4	8	D
5	16	E
6	18	F
7	20	G
8	21	H
ROLLBACK TO s2;
ERROR 42000: savepoint does not exist
COMMIT;
INSERT INTO t1(c0) VALUES(15),(16);
DROP TABLE IF EXISTS t1;
CREATE TABLE t1(c0 FLOAT(5,0),
c1 INT,
c2 VARCHAR(10))
PARTITION BY RANGE(c1)
(PARTITION p1 VALUES LESS THAN(15),
PARTITION p2 VALUES LESS THAN(25),
PARTITION p3 VALUES LESS THAN(35)
);
INSERT INTO t1 VALUES(1,0,'A'),(2,2,'B'),(3,4,'C'),(4,8,'D'),(5,16,'E'),(6,18,'F'),(7,20,'G');
ALTER TABLE t1 MODIFY c1 INT PRIMARY KEY AUTO_INCREMENT;
SHOW CREATE TABLE t1;
Table	Create Table
t1	CREATE TABLE `t1` (
  `c0` float(5,0) DEFAULT NULL,
  `c1` int(11) NOT NULL AUTO_INCREMENT,
  `c2` varchar(10) DEFAULT NULL,
  PRIMARY KEY (`c1`)
) ORGANIZATION INDEX AUTO_INCREMENT = 21 AUTO_INCREMENT_MODE = 'ORDER' DEFAULT CHARSET = utf8mb4 ROW_FORMAT = DYNAMIC COMPRESSION = 'zstd_1.3.8' REPLICA_NUM = 1 BLOCK_SIZE = 16384 USE_BLOOM_FILTER = FALSE ENABLE_MACRO_BLOCK_BLOOM_FILTER = FALSE TABLET_SIZE = 134217728 PCTFREE = 0
 partition by range(c1)
(partition `p1` values less than (15),
partition `p2` values less than (25),
partition `p3` values less than (35))
BEGIN;
SAVEPOINT s1;
INSERT INTO t1 VALUES(9,NULL,'H'),(10,NULL,'I'),(11,28,'J'),(12,-50,'K'),(13,NULL,'L'),(14,NULL,'M');
SAVEPOINT s2;
INSERT INTO t1(c0) VALUES(15),(16);
ROLLBACK TO s2;
SELECT * FROM t1 ORDER BY 1;
c0	c1	c2
1	0	A
2	2	B
3	4	C
4	8	D
5	16	E
6	18	F
7	20	G
9	21	H
10	22	I
11	28	J
12	-50	K
13	29	L
14	30	M
COMMIT;
ROLLBACK TO s1;
ERROR 42000: savepoint does not exist
SET @@AUTOCOMMIT=1;
#####触发器#####
DROP TABLE IF EXISTS t1;
CREATE TABLE t1(c0 INT(5),
c1 INT,
c2 VARCHAR(10));
INSERT INTO t1 VALUES(1,0,'A'),(2,2,'B'),(3,4,'C'),(4,8,'D'),(5,16,'E'),(6,18,'F'),(7,20,'G');
DROP TABLE IF EXISTS t2;
CREATE TABLE t2(c0 INT(5),
c1 INT);
INSERT INTO t2 VALUES(1,0),(2,2),(3,4),(4,8),(5,16),(6,18),(7,20);
DROP TRIGGER IF EXISTS trg_insert;
CREATE TRIGGER trg_insert AFTER INSERT ON t2
FOR EACH ROW
BEGIN
DECLARE c INT;
SELECT MAX(c0) INTO c FROM t1;
IF NEW.c0 = c THEN
INSERT INTO t1(c0,c2) VALUES(NEW.c1,'TEST1'),(NEW.c1-NEW.c0,'TEST2');
ELSE
INSERT INTO t1 VALUES(NEW.c0,NULL,'AA'),(NEW.c0+1,NULL,'BB'),(NEW.c0+2,-50,'CC'),(NEW.c0+3,30,'DD'),(NEW.c0+4,NULL,'EE'),(NEW.c0+5,NULL,'FF');
END IF;
END;
//
ALTER TABLE t2 MODIFY c0 INT AUTO_INCREMENT;
SHOW CREATE TABLE t2;
Table	Create Table
t2	CREATE TABLE `t2` (
  `c0` int(11) NOT NULL AUTO_INCREMENT,
  `c1` int(11) DEFAULT NULL
) ORGANIZATION INDEX AUTO_INCREMENT = 8 AUTO_INCREMENT_MODE = 'ORDER' DEFAULT CHARSET = utf8mb4 ROW_FORMAT = DYNAMIC COMPRESSION = 'zstd_1.3.8' REPLICA_NUM = 1 BLOCK_SIZE = 16384 USE_BLOOM_FILTER = FALSE ENABLE_MACRO_BLOCK_BLOOM_FILTER = FALSE TABLET_SIZE = 134217728 PCTFREE = 0
ALTER TABLE t1 MODIFY c1 INT AUTO_INCREMENT;
SHOW CREATE TABLE t1;
Table	Create Table
t1	CREATE TABLE `t1` (
  `c0` int(5) DEFAULT NULL,
  `c1` int(11) NOT NULL AUTO_INCREMENT,
  `c2` varchar(10) DEFAULT NULL
) ORGANIZATION INDEX AUTO_INCREMENT = 21 AUTO_INCREMENT_MODE = 'ORDER' DEFAULT CHARSET = utf8mb4 ROW_FORMAT = DYNAMIC COMPRESSION = 'zstd_1.3.8' REPLICA_NUM = 1 BLOCK_SIZE = 16384 USE_BLOOM_FILTER = FALSE ENABLE_MACRO_BLOCK_BLOOM_FILTER = FALSE TABLET_SIZE = 134217728 PCTFREE = 0
INSERT INTO t2 VALUES(NULL,1),(NULL,3),(-50,21),(7,22),(NULL,17),(NULL,25);
SELECT * FROM t2 ORDER BY 1;
c0	c1
-50	21
1	0
2	2
3	4
4	8
5	16
6	18
7	20
7	22
8	1
9	3
10	17
11	25
SELECT * FROM t1 ORDER BY 1;
c0	c1	c2
-50	39	AA
-49	40	BB
-48	-50	CC
-47	30	DD
-46	41	EE
-45	42	FF
1	0	A
2	2	B
3	4	C
4	8	D
5	16	E
6	18	F
7	45	AA
7	20	G
8	21	AA
8	46	BB
9	33	AA
9	22	BB
9	-50	CC
10	-50	CC
10	30	DD
10	51	AA
10	34	BB
11	47	EE
11	30	DD
11	52	BB
11	57	AA
11	-50	CC
12	48	FF
12	-50	CC
12	30	DD
12	58	BB
12	31	EE
13	35	EE
13	32	FF
13	-50	CC
13	30	DD
14	53	EE
14	30	DD
14	36	FF
15	59	EE
15	54	FF
16	60	FF
DROP TABLE IF EXISTS t1;
CREATE TABLE t1(c0 INT(5),
c1 INT,
c2 VARCHAR(10));
INSERT INTO t1 VALUES(1,0,'A'),(2,2,'B'),(3,4,'C'),(4,8,'D'),(5,16,'E'),(6,18,'F'),(7,20,'G');
DROP TABLE IF EXISTS t2;
CREATE TABLE t2(c0 INT(5),
c1 INT);
INSERT INTO t2 VALUES(1,0),(2,2),(3,4),(4,8),(5,16),(6,18),(7,20);
DROP TRIGGER IF EXISTS trg_update;
CREATE TRIGGER trg_update BEFORE UPDATE ON t2
FOR EACH ROW
BEGIN
DECLARE c INT;
SELECT COUNT(c0) INTO c FROM t1;
IF c >= 20 THEN
UPDATE t1 SET c1=NEW.c0 WHERE c0=NEW.c0;
ELSE
INSERT INTO t1 VALUES(NEW.c0,NULL,'AA'),(NEW.c0+1,NULL,'BB'),(NEW.c0+2,-50,'CC'),(NEW.c0+3,30,'DD'),(NEW.c0+4,NULL,'EE'),(NEW.c0+5,NULL,'FF');
END IF;
END;
//
ALTER TABLE t2 MODIFY c0 INT AUTO_INCREMENT;
SHOW CREATE TABLE t2;
Table	Create Table
t2	CREATE TABLE `t2` (
  `c0` int(11) NOT NULL AUTO_INCREMENT,
  `c1` int(11) DEFAULT NULL
) ORGANIZATION INDEX AUTO_INCREMENT = 8 AUTO_INCREMENT_MODE = 'ORDER' DEFAULT CHARSET = utf8mb4 ROW_FORMAT = DYNAMIC COMPRESSION = 'zstd_1.3.8' REPLICA_NUM = 1 BLOCK_SIZE = 16384 USE_BLOOM_FILTER = FALSE ENABLE_MACRO_BLOCK_BLOOM_FILTER = FALSE TABLET_SIZE = 134217728 PCTFREE = 0
ALTER TABLE t1 MODIFY c1 INT AUTO_INCREMENT;
SHOW CREATE TABLE t1;
Table	Create Table
t1	CREATE TABLE `t1` (
  `c0` int(5) DEFAULT NULL,
  `c1` int(11) NOT NULL AUTO_INCREMENT,
  `c2` varchar(10) DEFAULT NULL
) ORGANIZATION INDEX AUTO_INCREMENT = 21 AUTO_INCREMENT_MODE = 'ORDER' DEFAULT CHARSET = utf8mb4 ROW_FORMAT = DYNAMIC COMPRESSION = 'zstd_1.3.8' REPLICA_NUM = 1 BLOCK_SIZE = 16384 USE_BLOOM_FILTER = FALSE ENABLE_MACRO_BLOCK_BLOOM_FILTER = FALSE TABLET_SIZE = 134217728 PCTFREE = 0
INSERT INTO t2(c1) VALUES(8),(9),(10);
SELECT * FROM t2 ORDER BY 1,2;
c0	c1
1	0
2	2
3	4
4	8
5	16
6	18
7	20
8	8
9	9
10	10
SELECT * FROM t1 ORDER BY 1,2;
c0	c1	c2
1	0	A
2	2	B
3	4	C
4	8	D
5	16	E
6	18	F
7	20	G
UPDATE t2 SET c0=25 WHERE c1>15;
SELECT * FROM t2 ORDER BY 1,2;
c0	c1
1	0
2	2
3	4
4	8
8	8
9	9
10	10
25	16
25	18
25	20
SELECT * FROM t1 ORDER BY 1,2,3;
c0	c1	c2
1	0	A
2	2	B
3	4	C
4	8	D
5	16	E
6	18	F
7	20	G
25	21	AA
25	33	AA
25	39	AA
26	22	BB
26	34	BB
26	40	BB
27	-50	CC
27	-50	CC
27	-50	CC
28	30	DD
28	30	DD
28	30	DD
29	31	EE
29	35	EE
29	41	EE
30	32	FF
30	36	FF
30	42	FF
DROP TABLE IF EXISTS t1;
CREATE TABLE t1(c0 INT(5),
c1 INT,
c2 VARCHAR(10));
INSERT INTO t1 VALUES(1,0,'A'),(2,2,'B'),(3,4,'C'),(4,8,'D'),(5,16,'E'),(6,18,'F'),(7,20,'G');
DROP TABLE IF EXISTS t2;
CREATE TABLE t2(c0 INT(5),
c1 INT);
INSERT INTO t2 VALUES(1,0),(2,2),(3,4),(4,8),(5,16),(6,18),(7,20);
DROP TRIGGER IF EXISTS trg_delete;
CREATE TRIGGER trg_delete AFTER DELETE ON t2
FOR EACH ROW
BEGIN
DECLARE c INT;
SELECT COUNT(c0) INTO c FROM t1;
IF c >= 15 THEN
INSERT INTO t1(c0,c2) VALUES(OLD.c0+10,'TEST1'),(OLD.c0+20,'TEST2');
ELSE
INSERT INTO t1 VALUES(OLD.c0,NULL,'AA'),(OLD.c0+1,NULL,'BB'),(OLD.c0+2,-50,'CC'),(OLD.c0+2,30,'DD'),(OLD.c0+3,NULL,'EE'),(OLD.c0+4,NULL,'FF');
END IF;
END;
//
ALTER TABLE t2 MODIFY c0 INT AUTO_INCREMENT;
SHOW CREATE TABLE t2;
Table	Create Table
t2	CREATE TABLE `t2` (
  `c0` int(11) NOT NULL AUTO_INCREMENT,
  `c1` int(11) DEFAULT NULL
) ORGANIZATION INDEX AUTO_INCREMENT = 8 AUTO_INCREMENT_MODE = 'ORDER' DEFAULT CHARSET = utf8mb4 ROW_FORMAT = DYNAMIC COMPRESSION = 'zstd_1.3.8' REPLICA_NUM = 1 BLOCK_SIZE = 16384 USE_BLOOM_FILTER = FALSE ENABLE_MACRO_BLOCK_BLOOM_FILTER = FALSE TABLET_SIZE = 134217728 PCTFREE = 0
ALTER TABLE t1 MODIFY c1 INT AUTO_INCREMENT;
SHOW CREATE TABLE t1;
Table	Create Table
t1	CREATE TABLE `t1` (
  `c0` int(5) DEFAULT NULL,
  `c1` int(11) NOT NULL AUTO_INCREMENT,
  `c2` varchar(10) DEFAULT NULL
) ORGANIZATION INDEX AUTO_INCREMENT = 21 AUTO_INCREMENT_MODE = 'ORDER' DEFAULT CHARSET = utf8mb4 ROW_FORMAT = DYNAMIC COMPRESSION = 'zstd_1.3.8' REPLICA_NUM = 1 BLOCK_SIZE = 16384 USE_BLOOM_FILTER = FALSE ENABLE_MACRO_BLOCK_BLOOM_FILTER = FALSE TABLET_SIZE = 134217728 PCTFREE = 0
INSERT INTO t2(c1) VALUES(8),(9),(10);
SELECT * FROM t2 ORDER BY 1,2;
c0	c1
1	0
2	2
3	4
4	8
5	16
6	18
7	20
8	8
9	9
10	10
SELECT * FROM t1 ORDER BY 1,2,3;
c0	c1	c2
1	0	A
2	2	B
3	4	C
4	8	D
5	16	E
6	18	F
7	20	G
UPDATE t2 SET c0=25 WHERE c1>15;
SELECT * FROM t2 ORDER BY 1,2;
c0	c1
1	0
2	2
3	4
4	8
8	8
9	9
10	10
25	16
25	18
25	20
SELECT * FROM t1 ORDER BY 1,2,3;
c0	c1	c2
1	0	A
2	2	B
3	4	C
4	8	D
5	16	E
6	18	F
7	20	G
DELETE FROM t2 WHERE c0>10;
SELECT * FROM t2 ORDER BY 1,2;
c0	c1
1	0
2	2
3	4
4	8
8	8
9	9
10	10
SELECT * FROM t1 ORDER BY 1,2,3;
c0	c1	c2
1	0	A
2	2	B
3	4	C
4	8	D
5	16	E
6	18	F
7	20	G
25	21	AA
25	33	AA
26	22	BB
26	34	BB
27	-50	CC
27	-50	CC
27	30	DD
27	30	DD
28	31	EE
28	35	EE
29	32	FF
29	36	FF
35	39	TEST1
45	40	TEST2
DROP TRIGGER IF EXISTS trg_delete;
DROP TRIGGER IF EXISTS trg_ddl;
CREATE TRIGGER trg_ddl AFTER INSERT ON t2
FOR EACH ROW
BEGIN
ALTER TABLE t1 CHANGE c1 c1 INT PRIMARY KEY AUTO_INCREMENT;
END;
//
ERROR HY000: Explicit or implicit commit is not allowed in stored function or trigger.
CREATE TRIGGER trg_ddl AFTER UPDATE ON t2
FOR EACH ROW
BEGIN
ALTER TABLE t1 CHANGE c1 c1 INT PRIMARY KEY AUTO_INCREMENT;
END;
//
ERROR HY000: Explicit or implicit commit is not allowed in stored function or trigger.
CREATE TRIGGER trg_ddl AFTER DELETE ON t2
FOR EACH ROW
BEGIN
ALTER TABLE t1 CHANGE c1 c1 INT PRIMARY KEY AUTO_INCREMENT;
END;
//
ERROR HY000: Explicit or implicit commit is not allowed in stored function or trigger.
#####存储过程#####
DROP TABLE IF EXISTS t1;
CREATE TABLE t1(c0 INT(5),
c1 INT,
c2 VARCHAR(10));
INSERT INTO t1 VALUES(1,0,'A'),(2,2,'B'),(3,4,'C'),(4,8,'D'),(5,16,'E'),(6,18,'F'),(7,20,'G');
DROP TABLE IF EXISTS t2;
CREATE TABLE t2(c0 INT(5),
c1 INT);
INSERT INTO t2 VALUES(1,0),(2,2),(3,4),(4,8),(5,16),(6,18),(7,20);
DROP PROCEDURE IF EXISTS p1;
CREATE PROCEDURE p1(IN d INT)
BEGIN
IF d > 10 THEN
INSERT INTO t1(c0,c2) VALUES(d+100,'test1'),(d+200,'test2'),(d+300,'test3');
INSERT INTO t2(c1) VALUES(d+50),(d+60),(d+70);
ELSEIF d > 5 THEN
INSERT INTO t1 VALUES(d*2,NULL,'AA'),(d*3,NULL,'BB'),(d*4,-100,'CC'),(d*5,50,'DD'),(d*6,NULL,'EE'),(d*7,NULL,'FF');
INSERT INTO t2 VALUES(NULL,100),(NULL,101),(-100,102),(50,103),(NULL,104),(NULL,105);
ELSE
INSERT INTO t1(c0) SELECT c1 FROM t2 WHERE c0 < 5;
INSERT INTO t2(c1) SELECT c1 FROM t1 WHERE c0 < 5;
END IF;
END;
//
ALTER TABLE t2 MODIFY c0 INT PRIMARY KEY AUTO_INCREMENT;
SHOW CREATE TABLE t2;
Table	Create Table
t2	CREATE TABLE `t2` (
  `c0` int(11) NOT NULL AUTO_INCREMENT,
  `c1` int(11) DEFAULT NULL,
  PRIMARY KEY (`c0`)
) ORGANIZATION INDEX AUTO_INCREMENT = 8 AUTO_INCREMENT_MODE = 'ORDER' DEFAULT CHARSET = utf8mb4 ROW_FORMAT = DYNAMIC COMPRESSION = 'zstd_1.3.8' REPLICA_NUM = 1 BLOCK_SIZE = 16384 USE_BLOOM_FILTER = FALSE ENABLE_MACRO_BLOCK_BLOOM_FILTER = FALSE TABLET_SIZE = 134217728 PCTFREE = 0
ALTER TABLE t1 MODIFY c1 INT PRIMARY KEY AUTO_INCREMENT;
SHOW CREATE TABLE t1;
Table	Create Table
t1	CREATE TABLE `t1` (
  `c0` int(5) DEFAULT NULL,
  `c1` int(11) NOT NULL AUTO_INCREMENT,
  `c2` varchar(10) DEFAULT NULL,
  PRIMARY KEY (`c1`)
) ORGANIZATION INDEX AUTO_INCREMENT = 21 AUTO_INCREMENT_MODE = 'ORDER' DEFAULT CHARSET = utf8mb4 ROW_FORMAT = DYNAMIC COMPRESSION = 'zstd_1.3.8' REPLICA_NUM = 1 BLOCK_SIZE = 16384 USE_BLOOM_FILTER = FALSE ENABLE_MACRO_BLOCK_BLOOM_FILTER = FALSE TABLET_SIZE = 134217728 PCTFREE = 0
CALL p1(20);
SELECT * FROM t1 ORDER BY 1,2,3;
c0	c1	c2
1	0	A
2	2	B
3	4	C
4	8	D
5	16	E
6	18	F
7	20	G
120	21	test1
220	22	test2
320	23	test3
SELECT * FROM t2 ORDER BY 1,2;
c0	c1
1	0
2	2
3	4
4	8
5	16
6	18
7	20
8	70
9	80
10	90
CALL p1(6);
SELECT * FROM t1 ORDER BY 1,2,3;
c0	c1	c2
1	0	A
2	2	B
3	4	C
4	8	D
5	16	E
6	18	F
7	20	G
12	24	AA
18	25	BB
24	-100	CC
30	50	DD
36	51	EE
42	52	FF
120	21	test1
220	22	test2
320	23	test3
SELECT * FROM t2 ORDER BY 1,2;
c0	c1
-100	102
1	0
2	2
3	4
4	8
5	16
6	18
7	20
8	70
9	80
10	90
11	100
12	101
50	103
51	104
52	105
CALL p1(0);
SELECT * FROM t1 ORDER BY 1,2,3;
c0	c1	c2
0	54	NULL
1	0	A
2	2	B
2	55	NULL
3	4	C
4	8	D
4	56	NULL
5	16	E
6	18	F
7	20	G
8	57	NULL
12	24	AA
18	25	BB
24	-100	CC
30	50	DD
36	51	EE
42	52	FF
102	53	NULL
120	21	test1
220	22	test2
320	23	test3
SELECT * FROM t2 ORDER BY 1,2;
c0	c1
-100	102
1	0
2	2
3	4
4	8
5	16
6	18
7	20
8	70
9	80
10	90
11	100
12	101
50	103
51	104
52	105
53	0
54	2
55	4
56	8
57	54
58	55
59	56
DROP PROCEDURE IF EXISTS p1;
DROP TABLE IF EXISTS t1;
CREATE TABLE t1(c0 INT(5),
c1 INT,
c2 VARCHAR(10));
INSERT INTO t1 VALUES(1,0,'A'),(2,2,'B'),(3,4,'C'),(4,8,'D'),(5,16,'E'),(6,18,'F'),(7,20,'G');
DROP TABLE IF EXISTS t2;
CREATE TABLE t2(c0 INT(5),
c1 INT);
INSERT INTO t2 VALUES(1,0),(2,2),(3,4),(4,8),(5,16),(6,18),(7,20);
DROP PROCEDURE IF EXISTS p2;
CREATE PROCEDURE p2(IN d INT)
BEGIN
whl:WHILE d <= 5 DO
INSERT INTO t1(c0,c2) VALUES(d+100,'test1'),(d+200,'test2'),(d+300,'test3');
INSERT INTO t2(c1) VALUES(d+50),(d+60),(d+70);
INSERT INTO t1 VALUES(d*2,NULL,'AA'),(d*3,NULL,'BB'),(d*4,-100-d,'CC'),(d*5,50*d,'DD'),(d*6,NULL,'EE'),(d*7,NULL,'FF');
INSERT INTO t2 VALUES(NULL,100),(NULL,101),(-100-d,102),(50*d,103),(NULL,104),(NULL,105);
SET d = d + 1;
END WHILE;
END;
//
ALTER TABLE t2 MODIFY c0 INT PRIMARY KEY AUTO_INCREMENT;
SHOW CREATE TABLE t2;
Table	Create Table
t2	CREATE TABLE `t2` (
  `c0` int(11) NOT NULL AUTO_INCREMENT,
  `c1` int(11) DEFAULT NULL,
  PRIMARY KEY (`c0`)
) ORGANIZATION INDEX AUTO_INCREMENT = 8 AUTO_INCREMENT_MODE = 'ORDER' DEFAULT CHARSET = utf8mb4 ROW_FORMAT = DYNAMIC COMPRESSION = 'zstd_1.3.8' REPLICA_NUM = 1 BLOCK_SIZE = 16384 USE_BLOOM_FILTER = FALSE ENABLE_MACRO_BLOCK_BLOOM_FILTER = FALSE TABLET_SIZE = 134217728 PCTFREE = 0
ALTER TABLE t1 MODIFY c1 INT PRIMARY KEY AUTO_INCREMENT;
SHOW CREATE TABLE t1;
Table	Create Table
t1	CREATE TABLE `t1` (
  `c0` int(5) DEFAULT NULL,
  `c1` int(11) NOT NULL AUTO_INCREMENT,
  `c2` varchar(10) DEFAULT NULL,
  PRIMARY KEY (`c1`)
) ORGANIZATION INDEX AUTO_INCREMENT = 21 AUTO_INCREMENT_MODE = 'ORDER' DEFAULT CHARSET = utf8mb4 ROW_FORMAT = DYNAMIC COMPRESSION = 'zstd_1.3.8' REPLICA_NUM = 1 BLOCK_SIZE = 16384 USE_BLOOM_FILTER = FALSE ENABLE_MACRO_BLOCK_BLOOM_FILTER = FALSE TABLET_SIZE = 134217728 PCTFREE = 0
CALL p2(3);
SELECT * FROM t1 ORDER BY 1,2,3;
c0	c1	c2
1	0	A
2	2	B
3	4	C
4	8	D
5	16	E
6	18	F
6	24	AA
7	20	G
8	156	AA
9	25	BB
10	206	AA
12	-103	CC
12	157	BB
15	150	DD
15	207	BB
16	-104	CC
18	151	EE
20	-105	CC
20	200	DD
21	152	FF
24	201	EE
25	250	DD
28	202	FF
30	251	EE
35	252	FF
103	21	test1
104	153	test1
105	203	test1
203	22	test2
204	154	test2
205	204	test2
303	23	test3
304	155	test3
305	205	test3
SELECT * FROM t2 ORDER BY 1,2;
c0	c1
-105	102
-104	102
-103	102
1	0
2	2
3	4
4	8
5	16
6	18
7	20
8	53
9	63
10	73
11	100
12	101
150	103
151	104
152	105
153	54
154	64
155	74
156	100
157	101
200	103
201	104
202	105
203	55
204	65
205	75
206	100
207	101
250	103
251	104
252	105
DROP PROCEDURE IF EXISTS p2;
DROP TABLE IF EXISTS t1;
CREATE TABLE t1(c0 INT(5),
c1 INT,
c2 VARCHAR(10));
INSERT INTO t1 VALUES(1,0,'A'),(2,2,'B'),(3,4,'C'),(4,8,'D'),(5,16,'E'),(6,18,'F'),(7,20,'G');
DROP TABLE IF EXISTS t2;
CREATE TABLE t2(c0 INT(5),
c1 INT);
INSERT INTO t2 VALUES(1,0),(2,2),(3,4),(4,8),(5,16),(6,18),(7,20);
DROP PROCEDURE IF EXISTS p3;
CREATE PROCEDURE p3(IN d INT)
BEGIN
lop:LOOP
INSERT INTO t1(c0,c2) VALUES(d+100,'test1'),(d+200,'test2'),(d+300,'test3');
INSERT INTO t2(c1) VALUES(d+50),(d+60),(d+70);
INSERT INTO t1 VALUES(d*2,NULL,'AA'),(d*3,NULL,'BB'),(d*4,-100-d,'CC'),(d*5,50*d,'DD'),(d*6,NULL,'EE'),(d*7,NULL,'FF');
INSERT INTO t2 VALUES(NULL,100),(NULL,101),(-100-d,102),(50*d,103),(NULL,104),(NULL,105);
IF d = 10 THEN
LEAVE lop;
END IF;
SET d = d + 1;
END LOOP;
END;
//
ALTER TABLE t2 MODIFY c0 INT PRIMARY KEY AUTO_INCREMENT;
SHOW CREATE TABLE t2;
Table	Create Table
t2	CREATE TABLE `t2` (
  `c0` int(11) NOT NULL AUTO_INCREMENT,
  `c1` int(11) DEFAULT NULL,
  PRIMARY KEY (`c0`)
) ORGANIZATION INDEX AUTO_INCREMENT = 8 AUTO_INCREMENT_MODE = 'ORDER' DEFAULT CHARSET = utf8mb4 ROW_FORMAT = DYNAMIC COMPRESSION = 'zstd_1.3.8' REPLICA_NUM = 1 BLOCK_SIZE = 16384 USE_BLOOM_FILTER = FALSE ENABLE_MACRO_BLOCK_BLOOM_FILTER = FALSE TABLET_SIZE = 134217728 PCTFREE = 0
ALTER TABLE t1 MODIFY c1 INT PRIMARY KEY AUTO_INCREMENT;
SHOW CREATE TABLE t1;
Table	Create Table
t1	CREATE TABLE `t1` (
  `c0` int(5) DEFAULT NULL,
  `c1` int(11) NOT NULL AUTO_INCREMENT,
  `c2` varchar(10) DEFAULT NULL,
  PRIMARY KEY (`c1`)
) ORGANIZATION INDEX AUTO_INCREMENT = 21 AUTO_INCREMENT_MODE = 'ORDER' DEFAULT CHARSET = utf8mb4 ROW_FORMAT = DYNAMIC COMPRESSION = 'zstd_1.3.8' REPLICA_NUM = 1 BLOCK_SIZE = 16384 USE_BLOOM_FILTER = FALSE ENABLE_MACRO_BLOCK_BLOOM_FILTER = FALSE TABLET_SIZE = 134217728 PCTFREE = 0
CALL p3(7);
SELECT * FROM t1 ORDER BY 1,2,3;
c0	c1	c2
1	0	A
2	2	B
3	4	C
4	8	D
5	16	E
6	18	F
7	20	G
14	24	AA
16	356	AA
18	406	AA
20	456	AA
21	25	BB
24	357	BB
27	407	BB
28	-107	CC
30	457	BB
32	-108	CC
35	350	DD
36	-109	CC
40	-110	CC
40	400	DD
42	351	EE
45	450	DD
48	401	EE
49	352	FF
50	500	DD
54	451	EE
56	402	FF
60	501	EE
63	452	FF
70	502	FF
107	21	test1
108	353	test1
109	403	test1
110	453	test1
207	22	test2
208	354	test2
209	404	test2
210	454	test2
307	23	test3
308	355	test3
309	405	test3
310	455	test3
SELECT * FROM t2 ORDER BY 1,2;
c0	c1
-110	102
-109	102
-108	102
-107	102
1	0
2	2
3	4
4	8
5	16
6	18
7	20
8	57
9	67
10	77
11	100
12	101
350	103
351	104
352	105
353	58
354	68
355	78
356	100
357	101
400	103
401	104
402	105
403	59
404	69
405	79
406	100
407	101
450	103
451	104
452	105
453	60
454	70
455	80
456	100
457	101
500	103
501	104
502	105
DROP PROCEDURE IF EXISTS p3;
DROP TABLE IF EXISTS t1;
CREATE TABLE t1(c0 INT(5),
c1 INT,
c2 VARCHAR(10));
INSERT INTO t1 VALUES(1,0,'A'),(2,2,'B'),(3,4,'C'),(4,8,'D'),(5,16,'E'),(6,18,'F'),(7,20,'G');
DROP TABLE IF EXISTS t2;
CREATE TABLE t2(c0 INT(5),
c1 INT);
INSERT INTO t2 VALUES(1,0),(2,2),(3,4),(4,8),(5,16),(6,18),(7,20);
DROP PROCEDURE IF EXISTS p4;
CREATE PROCEDURE p4(IN d INT)
BEGIN
ALTER TABLE t2 MODIFY c0 INT PRIMARY KEY AUTO_INCREMENT;
ALTER TABLE t1 MODIFY c1 INT PRIMARY KEY AUTO_INCREMENT;
lop:LOOP
INSERT INTO t1(c0,c2) VALUES(d+100,'test1'),(d+200,'test2'),(d+300,'test3');
INSERT INTO t2(c1) VALUES(d+50),(d+60),(d+70);
INSERT INTO t1 VALUES(d*2,NULL,'AA'),(d*3,NULL,'BB'),(d*4,-100-d,'CC'),(d*5,50*d,'DD'),(d*6,NULL,'EE'),(d*7,NULL,'FF');
INSERT INTO t2 VALUES(NULL,100),(NULL,101),(-100-d,102),(50*d,103),(NULL,104),(NULL,105);
IF d = 10 THEN
LEAVE lop;
END IF;
SET d = d + 1;
END LOOP;
END;
//
CALL p4(8);
SHOW CREATE TABLE t1;
Table	Create Table
t1	CREATE TABLE `t1` (
  `c0` int(5) DEFAULT NULL,
  `c1` int(11) NOT NULL AUTO_INCREMENT,
  `c2` varchar(10) DEFAULT NULL,
  PRIMARY KEY (`c1`)
) ORGANIZATION INDEX AUTO_INCREMENT = 503 AUTO_INCREMENT_MODE = 'ORDER' DEFAULT CHARSET = utf8mb4 ROW_FORMAT = DYNAMIC COMPRESSION = 'zstd_1.3.8' REPLICA_NUM = 1 BLOCK_SIZE = 16384 USE_BLOOM_FILTER = FALSE ENABLE_MACRO_BLOCK_BLOOM_FILTER = FALSE TABLET_SIZE = 134217728 PCTFREE = 0
SHOW CREATE TABLE t2;
Table	Create Table
t2	CREATE TABLE `t2` (
  `c0` int(11) NOT NULL AUTO_INCREMENT,
  `c1` int(11) DEFAULT NULL,
  PRIMARY KEY (`c0`)
) ORGANIZATION INDEX AUTO_INCREMENT = 503 AUTO_INCREMENT_MODE = 'ORDER' DEFAULT CHARSET = utf8mb4 ROW_FORMAT = DYNAMIC COMPRESSION = 'zstd_1.3.8' REPLICA_NUM = 1 BLOCK_SIZE = 16384 USE_BLOOM_FILTER = FALSE ENABLE_MACRO_BLOCK_BLOOM_FILTER = FALSE TABLET_SIZE = 134217728 PCTFREE = 0
SELECT * FROM t1 ORDER BY 1,2,3;
c0	c1	c2
1	0	A
2	2	B
3	4	C
4	8	D
5	16	E
6	18	F
7	20	G
16	24	AA
18	406	AA
20	456	AA
24	25	BB
27	407	BB
30	457	BB
32	-108	CC
36	-109	CC
40	-110	CC
40	400	DD
45	450	DD
48	401	EE
50	500	DD
54	451	EE
56	402	FF
60	501	EE
63	452	FF
70	502	FF
108	21	test1
109	403	test1
110	453	test1
208	22	test2
209	404	test2
210	454	test2
308	23	test3
309	405	test3
310	455	test3
SELECT * FROM t2 ORDER BY 1,2;
c0	c1
-110	102
-109	102
-108	102
1	0
2	2
3	4
4	8
5	16
6	18
7	20
8	58
9	68
10	78
11	100
12	101
400	103
401	104
402	105
403	59
404	69
405	79
406	100
407	101
450	103
451	104
452	105
453	60
454	70
455	80
456	100
457	101
500	103
501	104
502	105
DROP PROCEDURE IF EXISTS p4;
DROP TABLE IF EXISTS t2;
CREATE TABLE t2(c1 DOUBLE,
c2 BIGINT,
c3 VARBINARY(10));
DROP TABLE IF EXISTS t1;
CREATE TABLE t1(c0 FLOAT(5,0),
c1 INT,
c2 VARCHAR(10))
PARTITION BY RANGE(c1)
(PARTITION p1 VALUES LESS THAN(5),
PARTITION p2 VALUES LESS THAN(55),
PARTITION p3 VALUES LESS THAN(105)
);
INSERT INTO t1 VALUES(1,0,'A'),(2,2,'B'),(3,4,'C'),(4,8,'D'),(5,16,'E'),(6,18,'F'),(7,20,'G');
DROP PROCEDURE IF EXISTS p5;
CREATE PROCEDURE p5(IN table_name VARCHAR(50),IN column_type VARCHAR(20),IN con_index VARCHAR(100),IN position VARCHAR(20))
BEGIN
DECLARE var_1 VARCHAR(100);
IF table_name = 't1' THEN
SET var_1 = CONCAT("alter table ",table_name," MODIFY",column_type,con_index,position);
ELSE
SET var_1 = CONCAT("show create table ",table_name);
END IF;
SET @var_2 = var_1;
PREPARE stmt FROM @var_2;
EXECUTE stmt;
DEALLOCATE PREPARE stmt;
END;
//
CALL p5('t2',' c1 int(10)',' primary key auto_increment',' first');
Table	Create Table
t2	CREATE TABLE `t2` (
  `c1` double DEFAULT NULL,
  `c2` bigint(20) DEFAULT NULL,
  `c3` varbinary(10) DEFAULT NULL
) ORGANIZATION INDEX DEFAULT CHARSET = utf8mb4 ROW_FORMAT = DYNAMIC COMPRESSION = 'zstd_1.3.8' REPLICA_NUM = 1 BLOCK_SIZE = 16384 USE_BLOOM_FILTER = FALSE ENABLE_MACRO_BLOCK_BLOOM_FILTER = FALSE TABLET_SIZE = 134217728 PCTFREE = 0
CALL p5('t1',' c1 int(10)',' primary key auto_increment',' first');
SHOW CREATE TABLE t1;
Table	Create Table
t1	CREATE TABLE `t1` (
  `c1` int(10) NOT NULL AUTO_INCREMENT,
  `c0` float(5,0) DEFAULT NULL,
  `c2` varchar(10) DEFAULT NULL,
  PRIMARY KEY (`c1`)
) ORGANIZATION INDEX AUTO_INCREMENT = 21 AUTO_INCREMENT_MODE = 'ORDER' DEFAULT CHARSET = utf8mb4 ROW_FORMAT = DYNAMIC COMPRESSION = 'zstd_1.3.8' REPLICA_NUM = 1 BLOCK_SIZE = 16384 USE_BLOOM_FILTER = FALSE ENABLE_MACRO_BLOCK_BLOOM_FILTER = FALSE TABLET_SIZE = 134217728 PCTFREE = 0
 partition by range(c1)
(partition `p1` values less than (5),
partition `p2` values less than (55),
partition `p3` values less than (105))
INSERT INTO t1 VALUES(NULL,8,'H'),(NULL,9,'I'),(-100,10,'J'),(90,11,'K'),(NULL,12,'L'),(NULL,13,'M');
SELECT * FROM t1 ORDER BY 2;
c1	c0	c2
0	1	A
2	2	B
4	3	C
8	4	D
16	5	E
18	6	F
20	7	G
21	8	H
22	9	I
-100	10	J
90	11	K
91	12	L
92	13	M
INSERT INTO t1(c0,c2) VALUES(14,'N'),(15,'O');
SELECT * FROM t1 ORDER BY 2;
c1	c0	c2
0	1	A
2	2	B
4	3	C
8	4	D
16	5	E
18	6	F
20	7	G
21	8	H
22	9	I
-100	10	J
90	11	K
91	12	L
92	13	M
93	14	N
94	15	O
#####UDF函数#####
DROP TABLE IF EXISTS t1;
CREATE TABLE t1(c0 INT(5),
c1 INT,
c2 VARCHAR(10));
INSERT INTO t1 VALUES(1,0,'A'),(2,2,'B'),(3,4,'C'),(4,8,'D'),(5,16,'E'),(6,18,'F'),(7,20,'G');
DROP TABLE IF EXISTS t2;
CREATE TABLE t2(c0 INT(5),
c1 INT);
INSERT INTO t2 VALUES(1,0),(2,2),(3,4),(4,8),(5,16),(6,18),(7,20);
DROP FUNCTION IF EXISTS f1;
CREATE FUNCTION f1( d INT)
RETURNS VARCHAR(100)
BEGIN
DECLARE d1 INT;
DECLARE d2 INT;
DECLARE d3 VARCHAR(100);
IF d > 10 THEN
INSERT INTO t1(c0,c2) VALUES(d+100,'test1'),(d+200,'test2'),(d+300,'test3');
INSERT INTO t2(c1) VALUES(d+50),(d+60),(d+70);
ELSEIF d > 5 THEN
INSERT INTO t1 VALUES(d*2,NULL,'AA'),(d*3,NULL,'BB'),(d*4,-100,'CC'),(d*5,50,'DD'),(d*6,NULL,'EE'),(d*7,NULL,'FF');
INSERT INTO t2 VALUES(NULL,100),(NULL,101),(-100,102),(50,103),(NULL,104),(NULL,105);
ELSE
INSERT INTO t1(c0) SELECT c1 FROM t2 WHERE c0 < 5;
INSERT INTO t2(c1) SELECT c1 FROM t1 WHERE c0 < 5;
END IF;
SELECT COUNT(c1) INTO d1 FROM t1;
SELECT COUNT(c0) INTO d2 FROM t2;
SET d3 = CONCAT('t1表执行函数后条目合计：',d1,',','t2表执行函数后条目合计：',d2);
RETURN d3;
END;
//
ALTER TABLE t2 MODIFY c0 INT PRIMARY KEY AUTO_INCREMENT;
SHOW CREATE TABLE t2;
Table	Create Table
t2	CREATE TABLE `t2` (
  `c0` int(11) NOT NULL AUTO_INCREMENT,
  `c1` int(11) DEFAULT NULL,
  PRIMARY KEY (`c0`)
) ORGANIZATION INDEX AUTO_INCREMENT = 8 AUTO_INCREMENT_MODE = 'ORDER' DEFAULT CHARSET = utf8mb4 ROW_FORMAT = DYNAMIC COMPRESSION = 'zstd_1.3.8' REPLICA_NUM = 1 BLOCK_SIZE = 16384 USE_BLOOM_FILTER = FALSE ENABLE_MACRO_BLOCK_BLOOM_FILTER = FALSE TABLET_SIZE = 134217728 PCTFREE = 0
ALTER TABLE t1 MODIFY c1 INT PRIMARY KEY AUTO_INCREMENT;
SHOW CREATE TABLE t1;
Table	Create Table
t1	CREATE TABLE `t1` (
  `c0` int(5) DEFAULT NULL,
  `c1` int(11) NOT NULL AUTO_INCREMENT,
  `c2` varchar(10) DEFAULT NULL,
  PRIMARY KEY (`c1`)
) ORGANIZATION INDEX AUTO_INCREMENT = 21 AUTO_INCREMENT_MODE = 'ORDER' DEFAULT CHARSET = utf8mb4 ROW_FORMAT = DYNAMIC COMPRESSION = 'zstd_1.3.8' REPLICA_NUM = 1 BLOCK_SIZE = 16384 USE_BLOOM_FILTER = FALSE ENABLE_MACRO_BLOCK_BLOOM_FILTER = FALSE TABLET_SIZE = 134217728 PCTFREE = 0
SELECT f1(15);
f1(15)
t1表执行函数后条目合计：10,t2表执行函数后条目合计：10
SELECT * FROM t1 ORDER BY 1,2,3;
c0	c1	c2
1	0	A
2	2	B
3	4	C
4	8	D
5	16	E
6	18	F
7	20	G
115	21	test1
215	22	test2
315	23	test3
SELECT * FROM t2 ORDER BY 1,2;
c0	c1
1	0
2	2
3	4
4	8
5	16
6	18
7	20
8	65
9	75
10	85
SELECT f1(8);
f1(8)
t1表执行函数后条目合计：16,t2表执行函数后条目合计：16
SELECT * FROM t1 ORDER BY 1,2,3;
c0	c1	c2
1	0	A
2	2	B
3	4	C
4	8	D
5	16	E
6	18	F
7	20	G
16	24	AA
24	25	BB
32	-100	CC
40	50	DD
48	51	EE
56	52	FF
115	21	test1
215	22	test2
315	23	test3
SELECT * FROM t2 ORDER BY 1,2;
c0	c1
-100	102
1	0
2	2
3	4
4	8
5	16
6	18
7	20
8	65
9	75
10	85
11	100
12	101
50	103
51	104
52	105
SELECT f1(4);
f1(4)
t1表执行函数后条目合计：21,t2表执行函数后条目合计：23
SELECT * FROM t1 ORDER BY 1,2,3;
c0	c1	c2
0	54	NULL
1	0	A
2	2	B
2	55	NULL
3	4	C
4	8	D
4	56	NULL
5	16	E
6	18	F
7	20	G
8	57	NULL
16	24	AA
24	25	BB
32	-100	CC
40	50	DD
48	51	EE
56	52	FF
102	53	NULL
115	21	test1
215	22	test2
315	23	test3
SELECT * FROM t2 ORDER BY 1,2;
c0	c1
-100	102
1	0
2	2
3	4
4	8
5	16
6	18
7	20
8	65
9	75
10	85
11	100
12	101
50	103
51	104
52	105
53	0
54	2
55	4
56	8
57	54
58	55
59	56
DROP FUNCTION IF EXISTS f1;
DROP FUNCTION IF EXISTS f2;
CREATE FUNCTION f2( d INT)
RETURNS VARCHAR(100)
BEGIN
DECLARE d1 INT;
DECLARE d2 INT;
DECLARE d3 VARCHAR(100);
ALTER TABLE t2 MODIFY c0 INT PRIMARY KEY AUTO_INCREMENT;
ALTER TABLE t1 MODIFY c1 INT PRIMARY KEY AUTO_INCREMENT;
IF d > 10 THEN
INSERT INTO t1(c0,c2) VALUES(d+100,'test1'),(d+200,'test2'),(d+300,'test3');
INSERT INTO t2(c1) VALUES(d+50),(d+60),(d+70);
ELSEIF d > 5 THEN
INSERT INTO t1 VALUES(d*2,NULL,'AA'),(d*3,NULL,'BB'),(d*4,-100,'CC'),(d*5,50,'DD'),(d*6,NULL,'EE'),(d*7,NULL,'FF');
INSERT INTO t2 VALUES(NULL,100),(NULL,101),(-100,102),(50,103),(NULL,104),(NULL,105);
ELSE
INSERT INTO t1(c0) SELECT c1 FROM t2 WHERE c0 < 5;
INSERT INTO t2(c1) SELECT c1 FROM t1 WHERE c0 < 5;
END IF;
SELECT COUNT(c1) INTO d1 FROM t1;
SELECT COUNT(c0) INTO d2 FROM t2;
SET d3 = CONCAT('t1表执行函数后条目合计：',d1,',','t2表执行函数后条目合计：',d2);
RETURN d3;
END;
//
ERROR HY000: Explicit or implicit commit is not allowed in stored function or trigger.
DROP TABLE IF EXISTS t2;
DROP TABLE IF EXISTS t1;
#########Empty recycle bin, delete test database, tables, etc##########
purge recyclebin;
