#Environmental cleaning
drop user hjw@'%';
create user hjw identified by 'hjw';
grant all on *.* to hjw WITH GRANT OPTION;
#function-8     约束
#function-9     分区表
#function-10    PL/SQL
#function-8     约束=====>primary key
drop table test2;
drop table test1;
create table test1(c1 int,c2 varchar(50),c3 varchar(50),PRIMARY key(c2,c3));
insert into test1 values(1,hex(uuid_to_bin('e097bcbb-3fbd-11ed-9291-b8599f1d613a')),hex(uuid_to_bin('e0daf39c-3fbd-11ed-9291-b8599f1d613a')));
insert into test1 values(2,hex(uuid_to_bin('e0479be4-3fbd-11ed-9291-b8599f1d613a')),hex(uuid_to_bin('e11a70f8-3fbd-11ed-9291-b8599f1d613a')));
insert into test1 values(3,hex(uuid_to_bin('dd747f47-3fbd-11ed-9645-7cd30abc95d8')),hex(uuid_to_bin('de73a513-3fbd-11ed-9645-7cd30abc95d8')));
insert into test1 values(4,hex(uuid_to_bin('dec6af5e-3fbd-11ed-9645-7cd30abc95d8')),hex(uuid_to_bin('df0e8fae-3fbd-11ed-9645-7cd30abc95d8')));
select * from test1 order by c1 asc;
c1	c2	c3
1	E097BCBB3FBD11ED9291B8599F1D613A	E0DAF39C3FBD11ED9291B8599F1D613A
2	E0479BE43FBD11ED9291B8599F1D613A	E11A70F83FBD11ED9291B8599F1D613A
3	DD747F473FBD11ED96457CD30ABC95D8	DE73A5133FBD11ED96457CD30ABC95D8
4	DEC6AF5E3FBD11ED96457CD30ABC95D8	DF0E8FAE3FBD11ED96457CD30ABC95D8
insert into test1 values(4,hex(uuid_to_bin('dec6af5e-3fbd-11ed-9645-7cd30abc95d8',6)),hex(uuid_to_bin('df0e8fae-3fbd-11ed-9645-7cd30abc95d8',4)));
select * from test1 order by c1 asc;
c1	c2	c3
1	E097BCBB3FBD11ED9291B8599F1D613A	E0DAF39C3FBD11ED9291B8599F1D613A
2	E0479BE43FBD11ED9291B8599F1D613A	E11A70F83FBD11ED9291B8599F1D613A
3	DD747F473FBD11ED96457CD30ABC95D8	DE73A5133FBD11ED96457CD30ABC95D8
4	11ED3FBDDEC6AF5E96457CD30ABC95D8	11ED3FBDDF0E8FAE96457CD30ABC95D8
4	DEC6AF5E3FBD11ED96457CD30ABC95D8	DF0E8FAE3FBD11ED96457CD30ABC95D8
insert into test1 values(5,hex(uuid_to_bin('e097bcbb-3fbd-11ed-9291-b8599f1d613a')),hex(uuid_to_bin('e0daf39c-3fbd-11ed-9291-b8599f1d613a')));
insert into test1 values(5,hex(uuid_to_bin('e097bcbb-3fbd-11ed-9291-b8599f1d613a')),hex(uuid_to_bin('4d82490a-3fbe-11ed-9645-7cd30abc95d8')));
insert into test1 values(6,hex(uuid_to_bin('5dc89c44-3fbe-11ed-9645-7cd30abc95d8')),hex(uuid_to_bin('4d82490a-3fbe-11ed-9645-7cd30abc95d8')));
insert into test1 values(6,hex(uuid_to_bin('null')),hex(uuid_to_bin('null')));
select * from test1 order by c1 asc;
c1	c2	c3
1	E097BCBB3FBD11ED9291B8599F1D613A	E0DAF39C3FBD11ED9291B8599F1D613A
2	E0479BE43FBD11ED9291B8599F1D613A	E11A70F83FBD11ED9291B8599F1D613A
3	DD747F473FBD11ED96457CD30ABC95D8	DE73A5133FBD11ED96457CD30ABC95D8
4	11ED3FBDDEC6AF5E96457CD30ABC95D8	11ED3FBDDF0E8FAE96457CD30ABC95D8
4	DEC6AF5E3FBD11ED96457CD30ABC95D8	DF0E8FAE3FBD11ED96457CD30ABC95D8
5	E097BCBB3FBD11ED9291B8599F1D613A	4D82490A3FBE11ED96457CD30ABC95D8
6	5DC89C443FBE11ED96457CD30ABC95D8	4D82490A3FBE11ED96457CD30ABC95D8
select * from test1 where c2=hex(uuid_to_bin('e097bcbb-3fbd-11ed-9291-b8599f1d613a')) order by c1 asc;
c1	c2	c3
1	E097BCBB3FBD11ED9291B8599F1D613A	E0DAF39C3FBD11ED9291B8599F1D613A
5	E097BCBB3FBD11ED9291B8599F1D613A	4D82490A3FBE11ED96457CD30ABC95D8
select * from test1 where c2=hex(uuid_to_bin('e097bcbb-3fbd-11ed-9291-b8599f1d613a')) order by c1 asc;
c1	c2	c3
1	E097BCBB3FBD11ED9291B8599F1D613A	E0DAF39C3FBD11ED9291B8599F1D613A
5	E097BCBB3FBD11ED9291B8599F1D613A	4D82490A3FBE11ED96457CD30ABC95D8
update test1 set c2=hex(uuid_to_bin('e097bcbb-3fbd-11ed-9291-b8599f1d613a')) where c2=hex(uuid_to_bin('5dc89c44-3fbe-11ed-9645-7cd30abc95d8'));
select * from test1 order by c1 asc;
c1	c2	c3
1	E097BCBB3FBD11ED9291B8599F1D613A	E0DAF39C3FBD11ED9291B8599F1D613A
2	E0479BE43FBD11ED9291B8599F1D613A	E11A70F83FBD11ED9291B8599F1D613A
3	DD747F473FBD11ED96457CD30ABC95D8	DE73A5133FBD11ED96457CD30ABC95D8
4	11ED3FBDDEC6AF5E96457CD30ABC95D8	11ED3FBDDF0E8FAE96457CD30ABC95D8
4	DEC6AF5E3FBD11ED96457CD30ABC95D8	DF0E8FAE3FBD11ED96457CD30ABC95D8
5	E097BCBB3FBD11ED9291B8599F1D613A	4D82490A3FBE11ED96457CD30ABC95D8
6	5DC89C443FBE11ED96457CD30ABC95D8	4D82490A3FBE11ED96457CD30ABC95D8
update test1 set c2=hex(uuid_to_bin('e097bcbb-3fbd-11ed-9291-b8599f1d613a')),c3=hex(uuid_to_bin('e0daf39c-3fbd-11ed-9291-b8599f1d613a')) 
where c2=hex(uuid_to_bin('5dc89c44-3fbe-11ed-9645-7cd30abc95d8'));
select * from test1 order by c1 asc;
c1	c2	c3
1	E097BCBB3FBD11ED9291B8599F1D613A	E0DAF39C3FBD11ED9291B8599F1D613A
2	E0479BE43FBD11ED9291B8599F1D613A	E11A70F83FBD11ED9291B8599F1D613A
3	DD747F473FBD11ED96457CD30ABC95D8	DE73A5133FBD11ED96457CD30ABC95D8
4	11ED3FBDDEC6AF5E96457CD30ABC95D8	11ED3FBDDF0E8FAE96457CD30ABC95D8
4	DEC6AF5E3FBD11ED96457CD30ABC95D8	DF0E8FAE3FBD11ED96457CD30ABC95D8
5	E097BCBB3FBD11ED9291B8599F1D613A	4D82490A3FBE11ED96457CD30ABC95D8
6	5DC89C443FBE11ED96457CD30ABC95D8	4D82490A3FBE11ED96457CD30ABC95D8
update test1 set hex(uuid_to_bin('e097bcbb-3fbd-11ed-9291-b8599f1d613a'))=hex(uuid_to_bin('e097bcbb-3fbd-11ed-9291-b8599f1d613a')) where c2=hex(uuid_to_bin('5dc89c44-3fbe-11ed-9645-7cd30abc95d8'));
update test1 set hex(uuid_to_bin('e097bcbb-3fbd-11ed-9291-b8599f1d613a',6))=hex(uuid_to_bin('e097bcbb-3fbd-11ed-9291-b8599f1d613a')) where c2=hex(uuid_to_bin('5dc89c44-3fbe-11ed-9645-7cd30abc95d8',4));
drop table test1;
#function-8     约束=====>unique
drop table test1;
create table test1(c1 int,c2 varchar(50),c3 varchar(50),unique(c2,c3));
insert into test1 values(1,hex(uuid_to_bin('e097bcbb-3fbd-11ed-9291-b8599f1d613a')),hex(uuid_to_bin('e0daf39c-3fbd-11ed-9291-b8599f1d613a')));
insert into test1 values(2,hex(uuid_to_bin('e0479be4-3fbd-11ed-9291-b8599f1d613a')),hex(uuid_to_bin('e11a70f8-3fbd-11ed-9291-b8599f1d613a')));
insert into test1 values(3,hex(uuid_to_bin('dd747f47-3fbd-11ed-9645-7cd30abc95d8')),hex(uuid_to_bin('de73a513-3fbd-11ed-9645-7cd30abc95d8')));
insert into test1 values(4,hex(uuid_to_bin('dec6af5e-3fbd-11ed-9645-7cd30abc95d8')),hex(uuid_to_bin('df0e8fae-3fbd-11ed-9645-7cd30abc95d8')));
select * from test1 order by c1 asc;
c1	c2	c3
1	E097BCBB3FBD11ED9291B8599F1D613A	E0DAF39C3FBD11ED9291B8599F1D613A
2	E0479BE43FBD11ED9291B8599F1D613A	E11A70F83FBD11ED9291B8599F1D613A
3	DD747F473FBD11ED96457CD30ABC95D8	DE73A5133FBD11ED96457CD30ABC95D8
4	DEC6AF5E3FBD11ED96457CD30ABC95D8	DF0E8FAE3FBD11ED96457CD30ABC95D8
insert into test1 values(4,hex(uuid_to_bin('dec6af5e-3fbd-11ed-9645-7cd30abc95d8',6)),hex(uuid_to_bin('df0e8fae-3fbd-11ed-9645-7cd30abc95d8',5)));
select * from test1 order by c1 asc;
c1	c2	c3
1	E097BCBB3FBD11ED9291B8599F1D613A	E0DAF39C3FBD11ED9291B8599F1D613A
2	E0479BE43FBD11ED9291B8599F1D613A	E11A70F83FBD11ED9291B8599F1D613A
3	DD747F473FBD11ED96457CD30ABC95D8	DE73A5133FBD11ED96457CD30ABC95D8
4	DEC6AF5E3FBD11ED96457CD30ABC95D8	DF0E8FAE3FBD11ED96457CD30ABC95D8
4	11ED3FBDDEC6AF5E96457CD30ABC95D8	11ED3FBDDF0E8FAE96457CD30ABC95D8
insert into test1 values(5,hex(uuid_to_bin('e097bcbb-3fbd-11ed-9291-b8599f1d613a')),hex(uuid_to_bin('e0daf39c-3fbd-11ed-9291-b8599f1d613a')));
insert into test1 values(5,hex(uuid_to_bin('e097bcbb-3fbd-11ed-9291-b8599f1d613a')),hex(uuid_to_bin('4d82490a-3fbe-11ed-9645-7cd30abc95d8')));
insert into test1 values(6,hex(uuid_to_bin('5dc89c44-3fbe-11ed-9645-7cd30abc95d8')),hex(uuid_to_bin('4d82490a-3fbe-11ed-9645-7cd30abc95d8')));
insert into test1 values(6,hex(uuid_to_bin('null')),hex(uuid_to_bin('null')));
select * from test1 order by c1 asc;
c1	c2	c3
1	E097BCBB3FBD11ED9291B8599F1D613A	E0DAF39C3FBD11ED9291B8599F1D613A
2	E0479BE43FBD11ED9291B8599F1D613A	E11A70F83FBD11ED9291B8599F1D613A
3	DD747F473FBD11ED96457CD30ABC95D8	DE73A5133FBD11ED96457CD30ABC95D8
4	DEC6AF5E3FBD11ED96457CD30ABC95D8	DF0E8FAE3FBD11ED96457CD30ABC95D8
4	11ED3FBDDEC6AF5E96457CD30ABC95D8	11ED3FBDDF0E8FAE96457CD30ABC95D8
5	E097BCBB3FBD11ED9291B8599F1D613A	4D82490A3FBE11ED96457CD30ABC95D8
6	5DC89C443FBE11ED96457CD30ABC95D8	4D82490A3FBE11ED96457CD30ABC95D8
select * from test1 where c2=hex(uuid_to_bin('e097bcbb-3fbd-11ed-9291-b8599f1d613a')) order by c1 asc;
c1	c2	c3
1	E097BCBB3FBD11ED9291B8599F1D613A	E0DAF39C3FBD11ED9291B8599F1D613A
5	E097BCBB3FBD11ED9291B8599F1D613A	4D82490A3FBE11ED96457CD30ABC95D8
select * from test1 where c2=hex(uuid_to_bin('e097bcbb-3fbd-11ed-9291-b8599f1d613a')) order by c1 asc;
c1	c2	c3
1	E097BCBB3FBD11ED9291B8599F1D613A	E0DAF39C3FBD11ED9291B8599F1D613A
5	E097BCBB3FBD11ED9291B8599F1D613A	4D82490A3FBE11ED96457CD30ABC95D8
select * from test1 where c2=hex(uuid_to_bin('e097bcbb-3fbd-11ed-9291-b8599f1d613a',6)) order by c1 asc;
c1	c2	c3
update test1 set c2=hex(uuid_to_bin('e097bcbb-3fbd-11ed-9291-b8599f1d613a')) where c2=hex(uuid_to_bin('5dc89c44-3fbe-11ed-9645-7cd30abc95d8'));
select * from test1 order by c1 asc;
c1	c2	c3
1	E097BCBB3FBD11ED9291B8599F1D613A	E0DAF39C3FBD11ED9291B8599F1D613A
2	E0479BE43FBD11ED9291B8599F1D613A	E11A70F83FBD11ED9291B8599F1D613A
3	DD747F473FBD11ED96457CD30ABC95D8	DE73A5133FBD11ED96457CD30ABC95D8
4	DEC6AF5E3FBD11ED96457CD30ABC95D8	DF0E8FAE3FBD11ED96457CD30ABC95D8
4	11ED3FBDDEC6AF5E96457CD30ABC95D8	11ED3FBDDF0E8FAE96457CD30ABC95D8
5	E097BCBB3FBD11ED9291B8599F1D613A	4D82490A3FBE11ED96457CD30ABC95D8
6	5DC89C443FBE11ED96457CD30ABC95D8	4D82490A3FBE11ED96457CD30ABC95D8
update test1 set c2=hex(uuid_to_bin('e097bcbb-3fbd-11ed-9291-b8599f1d613a')),c3=hex(uuid_to_bin('e0daf39c-3fbd-11ed-9291-b8599f1d613a')) 
where c2=hex(uuid_to_bin('5dc89c44-3fbe-11ed-9645-7cd30abc95d8'));
select * from test1 order by c1 asc;
c1	c2	c3
1	E097BCBB3FBD11ED9291B8599F1D613A	E0DAF39C3FBD11ED9291B8599F1D613A
2	E0479BE43FBD11ED9291B8599F1D613A	E11A70F83FBD11ED9291B8599F1D613A
3	DD747F473FBD11ED96457CD30ABC95D8	DE73A5133FBD11ED96457CD30ABC95D8
4	DEC6AF5E3FBD11ED96457CD30ABC95D8	DF0E8FAE3FBD11ED96457CD30ABC95D8
4	11ED3FBDDEC6AF5E96457CD30ABC95D8	11ED3FBDDF0E8FAE96457CD30ABC95D8
5	E097BCBB3FBD11ED9291B8599F1D613A	4D82490A3FBE11ED96457CD30ABC95D8
6	5DC89C443FBE11ED96457CD30ABC95D8	4D82490A3FBE11ED96457CD30ABC95D8
update test1 set hex(uuid_to_bin('e097bcbb-3fbd-11ed-9291-b8599f1d613a'))=hex(uuid_to_bin('e097bcbb-3fbd-11ed-9291-b8599f1d613a')) where c2=hex(uuid_to_bin('5dc89c44-3fbe-11ed-9645-7cd30abc95d8'));
drop table test1;
#function-8     约束=====>check
drop table test1;
create table test1(c1 int,c2 varchar(50),c3 varchar(50),check(c2<hex(uuid_to_bin('e097bcbb-3fbd-11ed-9291-b8599f1d613a'))+52));
drop table test1;
create table test1(c1 int,c2 varchar(50),c3 varchar(50),check(c2<hex(uuid_to_bin('e097bcbb-3fbd-11ed-9291-b8599f1d613a'))));
drop table test1;
create table test1(c1 int,c2 varchar(50),c3 varchar(50),check(c2<(select hex(uuid_to_bin('e097bcbb-3fbd-11ed-9291-b8599f1d613a')))));
create table test1(c1 int,c2 varchar(50),c3 varchar(50),check(c2<hex(uuid_to_bin('e097bcbb-3fbd-11ed-9291-b8599f1d613a'))+52));
insert into test1 values(1,hex(uuid_to_bin('e097bcbb-3fbd-11ed-9291-b8599f1d613a'))+2,hex(uuid_to_bin('e0daf39c-3fbd-11ed-9291-b8599f1d613a'))-2);
Warnings:
Warning	1292	Truncated incorrect DOUBLE value: 'E097BCBB3FBD11ED9291B8599F1D613A'
Warning	1292	Truncated incorrect DOUBLE value: 'E0DAF39C3FBD11ED9291B8599F1D613A'
Warning	1292	Truncated incorrect DOUBLE value: 'E097BCBB3FBD11ED9291B8599F1D613A'
insert into test1 values(1,hex(uuid_to_bin('e097bcbb-3fbd-11ed-9291-b8599f1d613a',7))+2,hex(uuid_to_bin('e0daf39c-3fbd-11ed-9291-b8599f1d613a',9))-2);
Warnings:
Warning	1292	Truncated incorrect DOUBLE value: '11ED3FBDE097BCBB9291B8599F1D613A'
Warning	1292	Truncated incorrect DOUBLE value: '11ED3FBDE0DAF39C9291B8599F1D613A'
Warning	1292	Truncated incorrect DOUBLE value: 'E097BCBB3FBD11ED9291B8599F1D613A'
insert into test1 values(2,hex(uuid_to_bin('e0479be4-3fbd-11ed-9291-b8599f1d613a')),hex(uuid_to_bin('e11a70f8-3fbd-11ed-9291-b8599f1d613a')));
insert into test1 values(2,hex(uuid_to_bin('dec6af5e-3fbd-11ed-9645-7cd30abc95d8'))+53,hex(uuid_to_bin('df0e8fae-3fbd-11ed-9645-7cd30abc95d8'))+53);
insert into test1 values(2,hex(uuid_to_bin('dec6af5e-3fbd-11ed-9645-7cd30abc95d8'))+null,hex(uuid_to_bin('df0e8fae-3fbd-11ed-9645-7cd30abc95d8'))+null);
Warnings:
Warning	1292	Truncated incorrect DOUBLE value: 'DEC6AF5E3FBD11ED96457CD30ABC95D8'
Warning	1292	Truncated incorrect DOUBLE value: 'DF0E8FAE3FBD11ED96457CD30ABC95D8'
select * from test1 order by c1 asc;
c1	c2	c3
1	2	-2
1	13	9
2	NULL	NULL
insert into test1 values(2,hex(uuid_to_bin('dec6af5e-3fbd-11ed-9645-7cd30abc95d8'))+50,hex(uuid_to_bin('df0e8fae-3fbd-11ed-9645-7cd30abc95d8'))+50);
Warnings:
Warning	1292	Truncated incorrect DOUBLE value: 'DEC6AF5E3FBD11ED96457CD30ABC95D8'
Warning	1292	Truncated incorrect DOUBLE value: 'DF0E8FAE3FBD11ED96457CD30ABC95D8'
Warning	1292	Truncated incorrect DOUBLE value: 'E097BCBB3FBD11ED9291B8599F1D613A'
select * from test1 order by c1 asc;
c1	c2	c3
1	2	-2
1	13	9
2	NULL	NULL
2	50	50
update test1 set c2=hex(uuid_to_bin('e097bcbb-3fbd-11ed-9291-b8599f1d613a'))+55 where c2=50;
select * from test1 order by c1 asc;
c1	c2	c3
1	2	-2
1	13	9
2	NULL	NULL
2	50	50
update test1 set c2=hex(uuid_to_bin('e097bcbb-3fbd-11ed-9291-b8599f1d613a'))+49 where c2=50;
Warnings:
Warning	1292	Truncated incorrect DOUBLE value: 'E097BCBB3FBD11ED9291B8599F1D613A'
Warning	1292	Truncated incorrect DOUBLE value: 'E097BCBB3FBD11ED9291B8599F1D613A'
update test1 set c2=hex(uuid_to_bin('e097bcbb-3fbd-11ed-9291-b8599f1d613a',7))+49 where c2=50;
select * from test1 order by c1 asc;
c1	c2	c3
1	2	-2
1	13	9
2	NULL	NULL
2	49	50
update test1 set c2=hex(uuid_to_bin('e097bcbb-3fbd-11ed-9291-b8599f1d613a'))+4*hex(uuid_to_bin('e097bcbb-3fbd-11ed-9291-b8599f1d613a')) where c2=49;
Warnings:
Warning	1292	Truncated incorrect DOUBLE value: 'E097BCBB3FBD11ED9291B8599F1D613A'
Warning	1292	Truncated incorrect DOUBLE value: 'E097BCBB3FBD11ED9291B8599F1D613A'
Warning	1292	Truncated incorrect DOUBLE value: 'E097BCBB3FBD11ED9291B8599F1D613A'
select * from test1 order by c1 asc;
c1	c2	c3
1	2	-2
1	13	9
2	NULL	NULL
2	0	50
update test1 set c2=hex(uuid_to_bin('e097bcbb-3fbd-11ed-9291-b8599f1d613a'))+4,c2=hex(uuid_to_bin('e097bcbb-3fbd-11ed-9291-b8599f1d613a'))+10 where c2=0;
Warnings:
Warning	1292	Truncated incorrect DOUBLE value: 'E097BCBB3FBD11ED9291B8599F1D613A'
Warning	1292	Truncated incorrect DOUBLE value: 'E097BCBB3FBD11ED9291B8599F1D613A'
select * from test1 order by c1 asc;
c1	c2	c3
1	2	-2
1	13	9
2	NULL	NULL
2	10	50
delete from test1 where c2=hex(uuid_to_bin('e097bcbb-3fbd-11ed-9291-b8599f1d613a'))+10;
Warnings:
Warning	1292	Truncated incorrect DOUBLE value: 'E097BCBB3FBD11ED9291B8599F1D613A'
Warning	1292	Truncated incorrect DOUBLE value: 'E097BCBB3FBD11ED9291B8599F1D613A'
delete from test1 where c2=hex(uuid_to_bin('e097bcbb-3fbd-11ed-9291-b8599f1d613a'))+null;
Warnings:
Warning	1292	Truncated incorrect DOUBLE value: 'E097BCBB3FBD11ED9291B8599F1D613A'
select * from test1 order by c1 asc;
c1	c2	c3
1	2	-2
1	13	9
2	NULL	NULL
drop table test1;
#function-8     约束=====>not null
drop table test1;
create table test1(
c1 int PRIMARY key AUTO_INCREMENT,
c2 varchar(50) not null,
c3 varchar(50) not null
);
insert into test1(c2,c3) values(
hex(uuid_to_bin('dec6af5e-3fbd-11ed-9645-7cd30abc95d8'))+null,
hex(uuid_to_bin('dec6af5e-3fbd-11ed-9645-7cd30abc95d8'))+null);
insert into test1(c2,c3) values(
hex(uuid_to_bin('dec6af5e-3fbd-11ed-9645-7cd30abc95d8')),
hex(uuid_to_bin('dec6af5e-3fbd-11ed-9645-7cd30abc95d8')));
select * from test1 order by c1 asc;
c1	c2	c3
2	DEC6AF5E3FBD11ED96457CD30ABC95D8	DEC6AF5E3FBD11ED96457CD30ABC95D8
insert into test1(c2,c3) values(
hex(uuid_to_bin('dec6af5e-3fbd-11ed-9645-7cd30abc95d8'))+0,
hex(uuid_to_bin('dec6af5e-3fbd-11ed-9645-7cd30abc95d8'))+0);
Warnings:
Warning	1292	Truncated incorrect DOUBLE value: 'DEC6AF5E3FBD11ED96457CD30ABC95D8'
Warning	1292	Truncated incorrect DOUBLE value: 'DEC6AF5E3FBD11ED96457CD30ABC95D8'
select * from test1 order by c1 asc;
c1	c2	c3
2	DEC6AF5E3FBD11ED96457CD30ABC95D8	DEC6AF5E3FBD11ED96457CD30ABC95D8
3	0	0
insert into test1(c2,c3) values(
hex(uuid_to_bin('dec6af5e-3fbd-11ed-9645-7cd30abc95d8',9))+0,
hex(uuid_to_bin('dec6af5e-3fbd-11ed-9645-7cd30abc95d8',-9))+0);
Warnings:
Warning	1292	Truncated incorrect DOUBLE value: '11ED3FBDDEC6AF5E96457CD30ABC95D8'
Warning	1292	Truncated incorrect DOUBLE value: '11ED3FBDDEC6AF5E96457CD30ABC95D8'
select * from test1 order by c1 asc;
c1	c2	c3
2	DEC6AF5E3FBD11ED96457CD30ABC95D8	DEC6AF5E3FBD11ED96457CD30ABC95D8
3	0	0
4	11	11
update test1 set c2=hex(uuid_to_bin('dec6af5e-3fbd-11ed-9645-7cd30abc95d8'))+null where c2=0;
update test1 set c2=hex(uuid_to_bin('dec6af5e-3fbd-11ed-9645-7cd30abc95d8'))+null where c2='0';
select * from test1 order by c1 asc;
c1	c2	c3
2	DEC6AF5E3FBD11ED96457CD30ABC95D8	DEC6AF5E3FBD11ED96457CD30ABC95D8
3	0	0
4	11	11
delete from test1 where c2= hex(uuid_to_bin('dec6af5e-3fbd-11ed-9645-7cd30abc95d8'))+0;
delete from test1 where c2= hex(uuid_to_bin('dec6af5e-3fbd-11ed-9645-7cd30abc95d8'))+null;
Warnings:
Warning	1292	Truncated incorrect DOUBLE value: 'DEC6AF5E3FBD11ED96457CD30ABC95D8'
delete from test1 where c2= hex(uuid_to_bin('dec6af5e-3fbd-11ed-9645-7cd30abc95d8'));
select * from test1 order by c1 asc;
c1	c2	c3
3	0	0
4	11	11
drop table test1;
#function-8     约束=====>default
drop table test1;
create table test1(
c1 int PRIMARY key AUTO_INCREMENT,
c2 varchar(50) default (select hex(uuid_to_bin('dec6af5e-3fbd-11ed-9645-7cd30abc95d8'))));
create table test1(
c1 int PRIMARY key AUTO_INCREMENT,
c2 varchar(50) default hex(uuid_to_bin('dec6af5e-3fbd-11ed-9645-7cd30abc95d8')));
create table test1(
c1 int PRIMARY key AUTO_INCREMENT,
c2 varchar(50) default 'hex(uuid_to_bin(dec6af5e-3fbd-11ed-9645-7cd30abc95d8))');
#function-8     约束=====>foreign key
drop table test2;
drop table test1;
create table test1(c1 int PRIMARY key);
insert into test1 values(1);
insert into test1 values(4);
insert into test1 values(7);
create table test2(c1 int PRIMARY key,c2 int,CONSTRAINT wj FOREIGN KEY (c1) REFERENCES test1(c1));
insert into test2 values(hex(uuid_to_bin('dec6af5e-3fbd-11ed-9645-7cd30abc95d8'))+1,hex(uuid_to_bin('dec6af5e-3fbd-11ed-9645-7cd30abc95d8'))+4);
Warnings:
Warning	1292	Truncated incorrect DOUBLE value: 'DEC6AF5E3FBD11ED96457CD30ABC95D8'
Warning	1292	Truncated incorrect DOUBLE value: 'DEC6AF5E3FBD11ED96457CD30ABC95D8'
select * from test2 order by c1 asc;
c1	c2
1	4
insert into test2 values(hex(uuid_to_bin('dec6af5e-3fbd-11ed-9645-7cd30abc95d8'))+hex(uuid_to_bin('dec6af5e-3fbd-11ed-9645-7cd30abc95d8'))
+hex(uuid_to_bin('dec6af5e-3fbd-11ed-9645-7cd30abc95d8'))+hex(uuid_to_bin('dec6af5e-3fbd-11ed-9645-7cd30abc95d8'))
+hex(uuid_to_bin('dec6af5e-3fbd-11ed-9645-7cd30abc95d8')),hex(uuid_to_bin('dec6af5e-3fbd-11ed-9645-7cd30abc95d8')));
insert into test2 values(hex(uuid_to_bin('dec6af5e-3fbd-11ed-9645-7cd30abc95d8'))+hex(uuid_to_bin('dec6af5e-3fbd-11ed-9645-7cd30abc95d8'))
+hex(uuid_to_bin('dec6af5e-3fbd-11ed-9645-7cd30abc95d8'))-hex(uuid_to_bin('dec6af5e-3fbd-11ed-9645-7cd30abc95d8'))
-hex(uuid_to_bin('dec6af5e-3fbd-11ed-9645-7cd30abc95d8')),hex(uuid_to_bin('dec6af5e-3fbd-11ed-9645-7cd30abc95d8')));
select * from test2 order by c1 asc;
c1	c2
1	4
insert into test2 values(hex(uuid_to_bin('dec6af5e-3fbd-11ed-9645-7cd30abc95d8',6))+hex(uuid_to_bin('dec6af5e-3fbd-11ed-9645-7cd30abc95d8'))
+hex(uuid_to_bin('dec6af5e-3fbd-11ed-9645-7cd30abc95d8',-6))-hex(uuid_to_bin('dec6af5e-3fbd-11ed-9645-7cd30abc95d8'))
-hex(uuid_to_bin('dec6af5e-3fbd-11ed-9645-7cd30abc95d8')),hex(uuid_to_bin('dec6af5e-3fbd-11ed-9645-7cd30abc95d8',6.5)));
select * from test2 order by c1 asc;
c1	c2
1	4
update test2 set c1=(hex(uuid_to_bin('dec6af5e-3fbd-11ed-9645-7cd30abc95d8')))+7 where c2=(hex(uuid_to_bin('dec6af5e-3fbd-11ed-9645-7cd30abc95d8')))+ 4;
Warnings:
Warning	1292	Truncated incorrect DOUBLE value: 'DEC6AF5E3FBD11ED96457CD30ABC95D8'
Warning	1292	Truncated incorrect DOUBLE value: 'DEC6AF5E3FBD11ED96457CD30ABC95D8'
Warning	1292	Truncated incorrect DOUBLE value: 'DEC6AF5E3FBD11ED96457CD30ABC95D8'
select * from test2 order by c1 asc;
c1	c2
7	4
update test2 set c1=(hex(uuid_to_bin('dec6af5e-3fbd-11ed-9645-7cd30abc95d8')))*0 where c1=(hex(uuid_to_bin('dec6af5e-3fbd-11ed-9645-7cd30abc95d8')))* 7;
Warnings:
Warning	1292	Truncated incorrect DOUBLE value: 'DEC6AF5E3FBD11ED96457CD30ABC95D8'
Warning	1292	Truncated incorrect DOUBLE value: 'DEC6AF5E3FBD11ED96457CD30ABC95D8'
Warning	1292	Truncated incorrect DOUBLE value: 'DEC6AF5E3FBD11ED96457CD30ABC95D8'
Warning	1292	Truncated incorrect DOUBLE value: 'DEC6AF5E3FBD11ED96457CD30ABC95D8'
Warning	1292	Truncated incorrect DOUBLE value: 'DEC6AF5E3FBD11ED96457CD30ABC95D8'
delete from test2 where c1=(hex(uuid_to_bin('dec6af5e-3fbd-11ed-9645-7cd30abc95d8')))*7;
Warnings:
Warning	1292	Truncated incorrect DOUBLE value: 'DEC6AF5E3FBD11ED96457CD30ABC95D8'
Warning	1292	Truncated incorrect DOUBLE value: 'DEC6AF5E3FBD11ED96457CD30ABC95D8'
Warning	1292	Truncated incorrect DOUBLE value: 'DEC6AF5E3FBD11ED96457CD30ABC95D8'
Warning	1292	Truncated incorrect DOUBLE value: 'DEC6AF5E3FBD11ED96457CD30ABC95D8'
Warning	1292	Truncated incorrect DOUBLE value: 'DEC6AF5E3FBD11ED96457CD30ABC95D8'
select * from test2 order by c1 asc;
c1	c2
7	4
drop table test2;
drop table test1;
#function-9     分区表=====>hash
drop table test1;
create table test1(c1 bigint(50),c2 bigint(50))partition  by hash(c1)(PARTITION p1,PARTITION p2);
insert into test1 PARTITION(p2) values(uuid_to_bin('d92af14f-3fd2-11ed-9291-b8599f1d613a'),uuid_to_bin('d9ac7a51-3fd2-11ed-9291-b8599f1d613a'));
insert into test1 PARTITION(p1) values(uuid_to_bin('d92af14f-3fd2-11ed-9291-b8599f1d613a'),uuid_to_bin('d9ac7a51-3fd2-11ed-9291-b8599f1d613a'));
insert into test1 PARTITION(p1) values(hex(uuid_to_bin('da01b7f7-3fd2-11ed-9291-b8599f1d613a')),hex(uuid_to_bin('da410d10-3fd2-11ed-9291-b8599f1d613a')));
insert into test1 PARTITION(p1) values(hex(uuid_to_bin('da01b7f7-3fd2-11ed-9291-b8599f1d613a')),hex(uuid_to_bin('da410d10-3fd2-11ed-9291-b8599f1d613a')));
insert into test1 PARTITION(p1) values(hex(uuid_to_bin('da01b7f7-3fd2-11ed-9291-b8599f1d613a'))+2,hex(uuid_to_bin('da410d10-3fd2-11ed-9291-b8599f1d613a'))+3);
Warnings:
Warning	1292	Truncated incorrect DOUBLE value: 'DA01B7F73FD211ED9291B8599F1D613A'
Warning	1292	Truncated incorrect DOUBLE value: 'DA410D103FD211ED9291B8599F1D613A'
select * from test1 PARTITION(p1) order by c1 asc;
c1	c2
2	3
insert into test1 PARTITION(p2) values(hex(uuid_to_bin('da01b7f7-3fd2-11ed-9291-b8599f1d613a'))+3,hex(uuid_to_bin('da410d10-3fd2-11ed-9291-b8599f1d613a'))+3);
Warnings:
Warning	1292	Truncated incorrect DOUBLE value: 'DA01B7F73FD211ED9291B8599F1D613A'
Warning	1292	Truncated incorrect DOUBLE value: 'DA410D103FD211ED9291B8599F1D613A'
select * from test1 PARTITION(p2) order by c1 asc;
c1	c2
3	3
update test1 PARTITION(p1) set c1=hex(uuid_to_bin('da01b7f7-3fd2-11ed-9291-b8599f1d613a'))+4 where c1=2;
Warnings:
Warning	1292	Truncated incorrect DOUBLE value: 'DA01B7F73FD211ED9291B8599F1D613A'
select * from test1 PARTITION(p1) order by c1 asc;
c1	c2
4	3
delete from test1 PARTITION(p1) where c1=hex(uuid_to_bin('da01b7f7-3fd2-11ed-9291-b8599f1d613a'))+4;
Warnings:
Warning	1292	Truncated incorrect DOUBLE value: 'DA01B7F73FD211ED9291B8599F1D613A'
Warning	1292	Truncated incorrect DOUBLE value: 'DA01B7F73FD211ED9291B8599F1D613A'
Warning	1292	Truncated incorrect DOUBLE value: 'DA01B7F73FD211ED9291B8599F1D613A'
Warning	1292	Truncated incorrect DOUBLE value: 'DA01B7F73FD211ED9291B8599F1D613A'
Warning	1292	Truncated incorrect DOUBLE value: 'DA01B7F73FD211ED9291B8599F1D613A'
Warning	1292	Truncated incorrect DOUBLE value: 'DA01B7F73FD211ED9291B8599F1D613A'
select * from test1 PARTITION(p1) order by c1 asc;
c1	c2
insert into test1 PARTITION(p1) values(hex(uuid_to_bin('da01b7f7-3fd2-11ed-9291-b8599f1d613a',5))+2,hex(uuid_to_bin('da410d10-3fd2-11ed-9291-b8599f1d613a'))+3);
insert into test1 PARTITION(p1) values(hex(uuid_to_bin('da01b7f7-3fd2-11ed-9291-b8599f1d613a',5))+2,hex(uuid_to_bin('da410d10-3fd2-11ed-9291-b8599f1d613a',6))+3);
drop table test1;
#function-9     分区表=====>key
drop table test1;
create table test1(c1 bigint(50),c2 bigint(50))partition  by key(c1)(PARTITION p1,PARTITION p2);
insert into test1 PARTITION(p2) values(uuid_to_bin('d92af14f-3fd2-11ed-9291-b8599f1d613a'),uuid_to_bin('d9ac7a51-3fd2-11ed-9291-b8599f1d613a'));
insert into test1 PARTITION(p1) values(uuid_to_bin('d92af14f-3fd2-11ed-9291-b8599f1d613a'),uuid_to_bin('d9ac7a51-3fd2-11ed-9291-b8599f1d613a'));
insert into test1 PARTITION(p1) values(hex(uuid_to_bin('da01b7f7-3fd2-11ed-9291-b8599f1d613a')),hex(uuid_to_bin('da410d10-3fd2-11ed-9291-b8599f1d613a')));
insert into test1 PARTITION(p1) values(hex(uuid_to_bin('da01b7f7-3fd2-11ed-9291-b8599f1d613a')),hex(uuid_to_bin('da410d10-3fd2-11ed-9291-b8599f1d613a')));
insert into test1 PARTITION(p1) values(hex(uuid_to_bin('da01b7f7-3fd2-11ed-9291-b8599f1d613a'))+2,hex(uuid_to_bin('da410d10-3fd2-11ed-9291-b8599f1d613a'))+3);
Warnings:
Warning	1292	Truncated incorrect DOUBLE value: 'DA01B7F73FD211ED9291B8599F1D613A'
Warning	1292	Truncated incorrect DOUBLE value: 'DA410D103FD211ED9291B8599F1D613A'
select * from test1 PARTITION(p1) order by c1 asc;
c1	c2
2	3
insert into test1 PARTITION(p2) values(hex(uuid_to_bin('da01b7f7-3fd2-11ed-9291-b8599f1d613a'))+3,hex(uuid_to_bin('da410d10-3fd2-11ed-9291-b8599f1d613a'))+3);
select * from test1 PARTITION(p2) order by c1 asc;
c1	c2
drop table test1;
#function-9     分区表=====>range
drop table test1;
create table test1(c1 bigint(50),c2 bigint(50))partition  by range(c1)(
PARTITION p1 values less than(hex(uuid_to_bin('da01b7f7-3fd2-11ed-9291-b8599f1d613a'))),
PARTITION p2 values less than(hex(uuid_to_bin('da01b7f7-3fd2-11ed-9291-b8599f1d613a')))+5);
create table test1(c1 bigint(50),c2 bigint(50))partition  by range(c1)(
PARTITION p1 values less than(hex(uuid_to_bin('da01b7f7-3fd2-11ed-9291-b8599f1d613a'))),
PARTITION p2 values less than(hex(uuid_to_bin('da01b7f7-3fd2-11ed-9291-b8599f1d613a')+uuid_to_bin('da01b7f7-3fd2-11ed-9291-b8599f1d613a'))));
create table test1(c1 bigint(50),c2 bigint(50))partition  by range(c1)(
PARTITION p1 values less than(10),
PARTITION p2 values less than(20));
insert into test1 PARTITION(p1) values(hex(uuid_to_bin('da01b7f7-3fd2-11ed-9291-b8599f1d613a'))+2,
hex(uuid_to_bin('da410d10-3fd2-11ed-9291-b8599f1d613a'))+3);
Warnings:
Warning	1292	Truncated incorrect DOUBLE value: 'DA01B7F73FD211ED9291B8599F1D613A'
Warning	1292	Truncated incorrect DOUBLE value: 'DA410D103FD211ED9291B8599F1D613A'
insert into test1 PARTITION(p2) values(hex(uuid_to_bin('da01b7f7-3fd2-11ed-9291-b8599f1d613a'))+18,
hex(uuid_to_bin('da410d10-3fd2-11ed-9291-b8599f1d613a'))+15);
Warnings:
Warning	1292	Truncated incorrect DOUBLE value: 'DA01B7F73FD211ED9291B8599F1D613A'
Warning	1292	Truncated incorrect DOUBLE value: 'DA410D103FD211ED9291B8599F1D613A'
insert into test1 PARTITION(p2) values(hex(uuid_to_bin('da01b7f7-3fd2-11ed-9291-b8599f1d613a',6))+18,
hex(uuid_to_bin('da410d10-3fd2-11ed-9291-b8599f1d613a'))+15);
insert into test1 PARTITION(p2) values(hex(uuid_to_bin('da01b7f7-3fd2-11ed-9291-b8599f1d613a',6.6))+18,
hex(uuid_to_bin('da410d10-3fd2-11ed-9291-b8599f1d613a'))+15);
select * from test1 PARTITION(p2) order by c1 asc;
c1	c2
18	15
select * from test1 PARTITION(p1) order by c1 asc;
c1	c2
2	3
update test1 PARTITION(p1) set c1=hex(uuid_to_bin('da01b7f7-3fd2-11ed-9291-b8599f1d613a'))+4 where c1=2;
Warnings:
Warning	1292	Truncated incorrect DOUBLE value: 'DA01B7F73FD211ED9291B8599F1D613A'
select * from test1 PARTITION(p1) order by c1 asc;
c1	c2
4	3
update test1 PARTITION(p2) set c1=hex(uuid_to_bin('da01b7f7-3fd2-11ed-9291-b8599f1d613a'))+20-3 where c1=18;
Warnings:
Warning	1292	Truncated incorrect DOUBLE value: 'DA01B7F73FD211ED9291B8599F1D613A'
select * from test1 PARTITION(p2) order by c1 asc;
c1	c2
17	15
delete from test1 PARTITION(p2) where c1=hex(uuid_to_bin('da01b7f7-3fd2-11ed-9291-b8599f1d613a'))+20-3;
Warnings:
Warning	1292	Truncated incorrect DOUBLE value: 'DA01B7F73FD211ED9291B8599F1D613A'
Warning	1292	Truncated incorrect DOUBLE value: 'DA01B7F73FD211ED9291B8599F1D613A'
Warning	1292	Truncated incorrect DOUBLE value: 'DA01B7F73FD211ED9291B8599F1D613A'
Warning	1292	Truncated incorrect DOUBLE value: 'DA01B7F73FD211ED9291B8599F1D613A'
Warning	1292	Truncated incorrect DOUBLE value: 'DA01B7F73FD211ED9291B8599F1D613A'
Warning	1292	Truncated incorrect DOUBLE value: 'DA01B7F73FD211ED9291B8599F1D613A'
select * from test1 PARTITION(p2) order by c1 asc;
c1	c2
drop table test1;
#function-9     分区表=====>list
drop table test1;
create table test1(c1 bigint(50),c2 bigint(50))partition  by list(c1)(
PARTITION p1 values less than(hex(uuid_to_bin('da01b7f7-3fd2-11ed-9291-b8599f1d613a'))),
PARTITION p2 values less than(hex(uuid_to_bin('da01b7f7-3fd2-11ed-9291-b8599f1d613a')))+5);
create table test1(c1 bigint(50),c2 bigint(50))partition  by list(c1)(
PARTITION p1 values less than(hex(uuid_to_bin('da01b7f7-3fd2-11ed-9291-b8599f1d613a'))),
PARTITION p2 values less than(hex(uuid_to_bin('da01b7f7-3fd2-11ed-9291-b8599f1d613a')+uuid_to_bin('da01b7f7-3fd2-11ed-9291-b8599f1d613a'))));
create table test1(c1 bigint(50),c2 bigint(50))partition  by list(c1)(
PARTITION p1 values in(10),
PARTITION p2 values in(20));
insert into test1 PARTITION(p1) values(hex(uuid_to_bin('da01b7f7-3fd2-11ed-9291-b8599f1d613a'))+2,
hex(uuid_to_bin('da410d10-3fd2-11ed-9291-b8599f1d613a'))+3);
insert into test1 PARTITION(p1) values(hex(uuid_to_bin('da01b7f7-3fd2-11ed-9291-b8599f1d613a'))+10,
hex(uuid_to_bin('da410d10-3fd2-11ed-9291-b8599f1d613a'))+10);
Warnings:
Warning	1292	Truncated incorrect DOUBLE value: 'DA01B7F73FD211ED9291B8599F1D613A'
Warning	1292	Truncated incorrect DOUBLE value: 'DA410D103FD211ED9291B8599F1D613A'
insert into test1 PARTITION(p1) values(hex(uuid_to_bin('da01b7f7-3fd2-11ed-9291-b8599f1d613a'))+10,
hex(uuid_to_bin('da410d10-3fd2-11ed-9291-b8599f1d613a',5))+10);
Warnings:
Warning	1292	Truncated incorrect DOUBLE value: 'DA01B7F73FD211ED9291B8599F1D613A'
Warning	1292	Truncated incorrect DOUBLE value: '11ED3FD2DA410D109291B8599F1D613A'
insert into test1 PARTITION(p2) values(hex(uuid_to_bin('da01b7f7-3fd2-11ed-9291-b8599f1d613a'))+20,
hex(uuid_to_bin('da410d10-3fd2-11ed-9291-b8599f1d613a'))+20);
Warnings:
Warning	1292	Truncated incorrect DOUBLE value: 'DA01B7F73FD211ED9291B8599F1D613A'
Warning	1292	Truncated incorrect DOUBLE value: 'DA410D103FD211ED9291B8599F1D613A'
select * from test1 PARTITION(p2) order by c1 asc;
c1	c2
20	20
select * from test1 PARTITION(p1) order by c1 asc;
c1	c2
10	10
10	21
update test1 PARTITION(p1) set c1=hex(uuid_to_bin('da01b7f7-3fd2-11ed-9291-b8599f1d613a'))+4 where c1=10;
update test1 PARTITION(p1) set c1=hex(uuid_to_bin('da01b7f7-3fd2-11ed-9291-b8599f1d613a',6))+4 where c1=10;
update test1 PARTITION(p1) set c1=hex(uuid_to_bin('da01b7f7-3fd2-11ed-9291-b8599f1d613a',-6))+4 where c1=10;
update test1 PARTITION(p1) set c1=hex(uuid_to_bin('da01b7f7-3fd2-11ed-9291-b8599f1d613a',null))+4 where c1=10;
update test1 PARTITION(p1) set c1=hex(uuid_to_bin('da01b7f7-3fd2-11ed-9291-b8599f1d613a',-6.5))+4 where c1=10;
select * from test1 PARTITION(p1) order by c1 asc;
c1	c2
10	10
10	21
update test1 PARTITION(p2) set c1=hex(uuid_to_bin('da01b7f7-3fd2-11ed-9291-b8599f1d613a'))+20-3 where c1=20;
select * from test1 PARTITION(p2) order by c1 asc;
c1	c2
20	20
delete from test1 PARTITION(p2) where c1=hex(uuid_to_bin('da01b7f7-3fd2-11ed-9291-b8599f1d613a'))+20;
Warnings:
Warning	1292	Truncated incorrect DOUBLE value: 'DA01B7F73FD211ED9291B8599F1D613A'
Warning	1292	Truncated incorrect DOUBLE value: 'DA01B7F73FD211ED9291B8599F1D613A'
Warning	1292	Truncated incorrect DOUBLE value: 'DA01B7F73FD211ED9291B8599F1D613A'
Warning	1292	Truncated incorrect DOUBLE value: 'DA01B7F73FD211ED9291B8599F1D613A'
Warning	1292	Truncated incorrect DOUBLE value: 'DA01B7F73FD211ED9291B8599F1D613A'
Warning	1292	Truncated incorrect DOUBLE value: 'DA01B7F73FD211ED9291B8599F1D613A'
Warning	1292	Truncated incorrect DOUBLE value: 'DA01B7F73FD211ED9291B8599F1D613A'
Warning	1292	Truncated incorrect DOUBLE value: 'DA01B7F73FD211ED9291B8599F1D613A'
Warning	1292	Truncated incorrect DOUBLE value: 'DA01B7F73FD211ED9291B8599F1D613A'
Warning	1292	Truncated incorrect DOUBLE value: 'DA01B7F73FD211ED9291B8599F1D613A'
select * from test1 PARTITION(p2) order by c1 asc;
c1	c2
drop table test1;
#function-10    PL/SQL
#function-10-1   存储过程=====>while循环
drop table test1;
create table test1(c1 int ,c2 char(20));
drop procedure procedure_1;
create procedure procedure_1()
begin
declare i int default -10;
while i<hex(uuid_to_bin('da01b7f7-3fd2-11ed-9291-b8599f1d613a'))+20
do
insert into test1 values(i,'hangzhou');
set i=i+1;
end while;
commit;
end;
/
call procedure_1();
Warnings:
Warning	1292	Truncated incorrect DOUBLE value: 'DA01B7F73FD211ED9291B8599F1D613A'
select * from test1 order by c1 asc;
c1	c2
-10	hangzhou
-9	hangzhou
-8	hangzhou
-7	hangzhou
-6	hangzhou
-5	hangzhou
-4	hangzhou
-3	hangzhou
-2	hangzhou
-1	hangzhou
0	hangzhou
1	hangzhou
2	hangzhou
3	hangzhou
4	hangzhou
5	hangzhou
6	hangzhou
7	hangzhou
8	hangzhou
9	hangzhou
10	hangzhou
11	hangzhou
12	hangzhou
13	hangzhou
14	hangzhou
15	hangzhou
16	hangzhou
17	hangzhou
18	hangzhou
19	hangzhou
drop PROCEDURE procedure_1;
drop table test1;
create table test1(c1 int ,c2 char(100));
create procedure procedure_1()
begin
declare i int default -10;
while i<hex(uuid_to_bin('da01b7f7-3fd2-11ed-9291-b8599f1d613a'))+20
do
insert into test1 values(i,hex(uuid_to_bin('da01b7f7-3fd2-11ed-9291-b8599f1d613a')));
set i=i+1;
end while;
commit;
end;
/
call procedure_1();
Warnings:
Warning	1292	Truncated incorrect DOUBLE value: 'DA01B7F73FD211ED9291B8599F1D613A'
select * from test1 order by c1 asc;
c1	c2
-10	DA01B7F73FD211ED9291B8599F1D613A
-9	DA01B7F73FD211ED9291B8599F1D613A
-8	DA01B7F73FD211ED9291B8599F1D613A
-7	DA01B7F73FD211ED9291B8599F1D613A
-6	DA01B7F73FD211ED9291B8599F1D613A
-5	DA01B7F73FD211ED9291B8599F1D613A
-4	DA01B7F73FD211ED9291B8599F1D613A
-3	DA01B7F73FD211ED9291B8599F1D613A
-2	DA01B7F73FD211ED9291B8599F1D613A
-1	DA01B7F73FD211ED9291B8599F1D613A
0	DA01B7F73FD211ED9291B8599F1D613A
1	DA01B7F73FD211ED9291B8599F1D613A
2	DA01B7F73FD211ED9291B8599F1D613A
3	DA01B7F73FD211ED9291B8599F1D613A
4	DA01B7F73FD211ED9291B8599F1D613A
5	DA01B7F73FD211ED9291B8599F1D613A
6	DA01B7F73FD211ED9291B8599F1D613A
7	DA01B7F73FD211ED9291B8599F1D613A
8	DA01B7F73FD211ED9291B8599F1D613A
9	DA01B7F73FD211ED9291B8599F1D613A
10	DA01B7F73FD211ED9291B8599F1D613A
11	DA01B7F73FD211ED9291B8599F1D613A
12	DA01B7F73FD211ED9291B8599F1D613A
13	DA01B7F73FD211ED9291B8599F1D613A
14	DA01B7F73FD211ED9291B8599F1D613A
15	DA01B7F73FD211ED9291B8599F1D613A
16	DA01B7F73FD211ED9291B8599F1D613A
17	DA01B7F73FD211ED9291B8599F1D613A
18	DA01B7F73FD211ED9291B8599F1D613A
19	DA01B7F73FD211ED9291B8599F1D613A
drop PROCEDURE procedure_1;
drop table test1;
create table test1(c1 int ,c2 char(100));
create procedure procedure_1()
begin
declare i int default -10;
while i<hex(uuid_to_bin('da01b7f7-3fd2-11ed-9291-b8599f1d613a',54))+20
do
insert into test1 values(i,hex(uuid_to_bin('da01b7f7-3fd2-11ed-9291-b8599f1d613a','23')));
set i=i+1;
end while;
commit;
end;
/
call procedure_1();
Warnings:
Warning	1292	Truncated incorrect DOUBLE value: '11ED3FD2DA01B7F79291B8599F1D613A'
select * from test1 order by c1 asc;
c1	c2
-10	11ED3FD2DA01B7F79291B8599F1D613A
-9	11ED3FD2DA01B7F79291B8599F1D613A
-8	11ED3FD2DA01B7F79291B8599F1D613A
-7	11ED3FD2DA01B7F79291B8599F1D613A
-6	11ED3FD2DA01B7F79291B8599F1D613A
-5	11ED3FD2DA01B7F79291B8599F1D613A
-4	11ED3FD2DA01B7F79291B8599F1D613A
-3	11ED3FD2DA01B7F79291B8599F1D613A
-2	11ED3FD2DA01B7F79291B8599F1D613A
-1	11ED3FD2DA01B7F79291B8599F1D613A
0	11ED3FD2DA01B7F79291B8599F1D613A
1	11ED3FD2DA01B7F79291B8599F1D613A
2	11ED3FD2DA01B7F79291B8599F1D613A
3	11ED3FD2DA01B7F79291B8599F1D613A
4	11ED3FD2DA01B7F79291B8599F1D613A
5	11ED3FD2DA01B7F79291B8599F1D613A
6	11ED3FD2DA01B7F79291B8599F1D613A
7	11ED3FD2DA01B7F79291B8599F1D613A
8	11ED3FD2DA01B7F79291B8599F1D613A
9	11ED3FD2DA01B7F79291B8599F1D613A
10	11ED3FD2DA01B7F79291B8599F1D613A
11	11ED3FD2DA01B7F79291B8599F1D613A
12	11ED3FD2DA01B7F79291B8599F1D613A
13	11ED3FD2DA01B7F79291B8599F1D613A
14	11ED3FD2DA01B7F79291B8599F1D613A
15	11ED3FD2DA01B7F79291B8599F1D613A
16	11ED3FD2DA01B7F79291B8599F1D613A
17	11ED3FD2DA01B7F79291B8599F1D613A
18	11ED3FD2DA01B7F79291B8599F1D613A
19	11ED3FD2DA01B7F79291B8599F1D613A
20	11ED3FD2DA01B7F79291B8599F1D613A
21	11ED3FD2DA01B7F79291B8599F1D613A
22	11ED3FD2DA01B7F79291B8599F1D613A
23	11ED3FD2DA01B7F79291B8599F1D613A
24	11ED3FD2DA01B7F79291B8599F1D613A
25	11ED3FD2DA01B7F79291B8599F1D613A
26	11ED3FD2DA01B7F79291B8599F1D613A
27	11ED3FD2DA01B7F79291B8599F1D613A
28	11ED3FD2DA01B7F79291B8599F1D613A
29	11ED3FD2DA01B7F79291B8599F1D613A
30	11ED3FD2DA01B7F79291B8599F1D613A
drop PROCEDURE procedure_1;
drop table test1;
#function-10-1   存储过程=====>repeat循环
create table test1(id varchar(50));
drop procedure procedure_1;
create procedure procedure_1()
begin
declare i int;
set i =1 ;
repeat
insert into test1 values (hex(uuid_to_bin('7f7ec311-479d-11ed-9c3f-7cd30abc95d8')));
set i = i + 1;
until i > 10 end repeat;
select * from test1;
end; 
/
call procedure_1();
id
7F7EC311479D11ED9C3F7CD30ABC95D8
7F7EC311479D11ED9C3F7CD30ABC95D8
7F7EC311479D11ED9C3F7CD30ABC95D8
7F7EC311479D11ED9C3F7CD30ABC95D8
7F7EC311479D11ED9C3F7CD30ABC95D8
7F7EC311479D11ED9C3F7CD30ABC95D8
7F7EC311479D11ED9C3F7CD30ABC95D8
7F7EC311479D11ED9C3F7CD30ABC95D8
7F7EC311479D11ED9C3F7CD30ABC95D8
7F7EC311479D11ED9C3F7CD30ABC95D8
SELECT * from test1 order by id asc;
id
7F7EC311479D11ED9C3F7CD30ABC95D8
7F7EC311479D11ED9C3F7CD30ABC95D8
7F7EC311479D11ED9C3F7CD30ABC95D8
7F7EC311479D11ED9C3F7CD30ABC95D8
7F7EC311479D11ED9C3F7CD30ABC95D8
7F7EC311479D11ED9C3F7CD30ABC95D8
7F7EC311479D11ED9C3F7CD30ABC95D8
7F7EC311479D11ED9C3F7CD30ABC95D8
7F7EC311479D11ED9C3F7CD30ABC95D8
7F7EC311479D11ED9C3F7CD30ABC95D8
drop PROCEDURE procedure_1;
drop table test1;
create table test1(id varchar(50));
create procedure procedure_1()
begin
declare i int;
set i =1 ;
repeat
insert into test1 values (hex(uuid_to_bin('7f7ec311-479d-11ed-9c3f-7cd30abc95d8',null)));
set i = i + 1;
until i > 10 end repeat;
select * from test1;
end; 
/
call procedure_1();
id
7F7EC311479D11ED9C3F7CD30ABC95D8
7F7EC311479D11ED9C3F7CD30ABC95D8
7F7EC311479D11ED9C3F7CD30ABC95D8
7F7EC311479D11ED9C3F7CD30ABC95D8
7F7EC311479D11ED9C3F7CD30ABC95D8
7F7EC311479D11ED9C3F7CD30ABC95D8
7F7EC311479D11ED9C3F7CD30ABC95D8
7F7EC311479D11ED9C3F7CD30ABC95D8
7F7EC311479D11ED9C3F7CD30ABC95D8
7F7EC311479D11ED9C3F7CD30ABC95D8
SELECT * from test1 order by id asc;
id
7F7EC311479D11ED9C3F7CD30ABC95D8
7F7EC311479D11ED9C3F7CD30ABC95D8
7F7EC311479D11ED9C3F7CD30ABC95D8
7F7EC311479D11ED9C3F7CD30ABC95D8
7F7EC311479D11ED9C3F7CD30ABC95D8
7F7EC311479D11ED9C3F7CD30ABC95D8
7F7EC311479D11ED9C3F7CD30ABC95D8
7F7EC311479D11ED9C3F7CD30ABC95D8
7F7EC311479D11ED9C3F7CD30ABC95D8
7F7EC311479D11ED9C3F7CD30ABC95D8
drop PROCEDURE procedure_1;
drop table test1;
#function-10-1   存储过程=====>loop循环
drop table test1;
create table test1(id char(50));
drop procedure procedure_1;
create procedure procedure_1()
begin
declare i int;
set i = 1;
lp : loop
insert into test1 values (hex(uuid_to_bin('1b30d0ff-47a0-11ed-aedd-7cd30abc95d8',99)));
insert into test1 values (hex(uuid_to_bin('1b30d0ff-47a0-11ed-aedd-7cd30abc95d8',null)));
insert into test1 values (hex(uuid_to_bin('1b30d0ff-47a0-11ed-aedd-7cd30abc95d8',0.1)));
insert into test1 values (hex(uuid_to_bin('1b30d0ff-47a0-11ed-aedd-7cd30abc95d8',-0.9)));
insert into test1 values (hex(uuid_to_bin('1b30d0ff-47a0-11ed-aedd-7cd30abc95d8',-9)));
set i = i + 1;
if i > 1001 then
leave lp;
end if; 
end loop;
select * from test1 order by id asc;
end; 
/
call procedure_1();
id
11ED47A01B30D0FFAEDD7CD30ABC95D8
11ED47A01B30D0FFAEDD7CD30ABC95D8
11ED47A01B30D0FFAEDD7CD30ABC95D8
11ED47A01B30D0FFAEDD7CD30ABC95D8
11ED47A01B30D0FFAEDD7CD30ABC95D8
11ED47A01B30D0FFAEDD7CD30ABC95D8
11ED47A01B30D0FFAEDD7CD30ABC95D8
11ED47A01B30D0FFAEDD7CD30ABC95D8
11ED47A01B30D0FFAEDD7CD30ABC95D8
11ED47A01B30D0FFAEDD7CD30ABC95D8
11ED47A01B30D0FFAEDD7CD30ABC95D8
11ED47A01B30D0FFAEDD7CD30ABC95D8
11ED47A01B30D0FFAEDD7CD30ABC95D8
11ED47A01B30D0FFAEDD7CD30ABC95D8
11ED47A01B30D0FFAEDD7CD30ABC95D8
11ED47A01B30D0FFAEDD7CD30ABC95D8
11ED47A01B30D0FFAEDD7CD30ABC95D8
11ED47A01B30D0FFAEDD7CD30ABC95D8
11ED47A01B30D0FFAEDD7CD30ABC95D8
11ED47A01B30D0FFAEDD7CD30ABC95D8
11ED47A01B30D0FFAEDD7CD30ABC95D8
11ED47A01B30D0FFAEDD7CD30ABC95D8
11ED47A01B30D0FFAEDD7CD30ABC95D8
11ED47A01B30D0FFAEDD7CD30ABC95D8
11ED47A01B30D0FFAEDD7CD30ABC95D8
11ED47A01B30D0FFAEDD7CD30ABC95D8
11ED47A01B30D0FFAEDD7CD30ABC95D8
11ED47A01B30D0FFAEDD7CD30ABC95D8
11ED47A01B30D0FFAEDD7CD30ABC95D8
11ED47A01B30D0FFAEDD7CD30ABC95D8
11ED47A01B30D0FFAEDD7CD30ABC95D8
11ED47A01B30D0FFAEDD7CD30ABC95D8
11ED47A01B30D0FFAEDD7CD30ABC95D8
11ED47A01B30D0FFAEDD7CD30ABC95D8
11ED47A01B30D0FFAEDD7CD30ABC95D8
11ED47A01B30D0FFAEDD7CD30ABC95D8
11ED47A01B30D0FFAEDD7CD30ABC95D8
11ED47A01B30D0FFAEDD7CD30ABC95D8
11ED47A01B30D0FFAEDD7CD30ABC95D8
11ED47A01B30D0FFAEDD7CD30ABC95D8
11ED47A01B30D0FFAEDD7CD30ABC95D8
11ED47A01B30D0FFAEDD7CD30ABC95D8
11ED47A01B30D0FFAEDD7CD30ABC95D8
11ED47A01B30D0FFAEDD7CD30ABC95D8
11ED47A01B30D0FFAEDD7CD30ABC95D8
11ED47A01B30D0FFAEDD7CD30ABC95D8
11ED47A01B30D0FFAEDD7CD30ABC95D8
11ED47A01B30D0FFAEDD7CD30ABC95D8
11ED47A01B30D0FFAEDD7CD30ABC95D8
11ED47A01B30D0FFAEDD7CD30ABC95D8
11ED47A01B30D0FFAEDD7CD30ABC95D8
11ED47A01B30D0FFAEDD7CD30ABC95D8
11ED47A01B30D0FFAEDD7CD30ABC95D8
11ED47A01B30D0FFAEDD7CD30ABC95D8
11ED47A01B30D0FFAEDD7CD30ABC95D8
11ED47A01B30D0FFAEDD7CD30ABC95D8
11ED47A01B30D0FFAEDD7CD30ABC95D8
11ED47A01B30D0FFAEDD7CD30ABC95D8
11ED47A01B30D0FFAEDD7CD30ABC95D8
11ED47A01B30D0FFAEDD7CD30ABC95D8
11ED47A01B30D0FFAEDD7CD30ABC95D8
11ED47A01B30D0FFAEDD7CD30ABC95D8
11ED47A01B30D0FFAEDD7CD30ABC95D8
11ED47A01B30D0FFAEDD7CD30ABC95D8
11ED47A01B30D0FFAEDD7CD30ABC95D8
11ED47A01B30D0FFAEDD7CD30ABC95D8
11ED47A01B30D0FFAEDD7CD30ABC95D8
11ED47A01B30D0FFAEDD7CD30ABC95D8
11ED47A01B30D0FFAEDD7CD30ABC95D8
11ED47A01B30D0FFAEDD7CD30ABC95D8
11ED47A01B30D0FFAEDD7CD30ABC95D8
11ED47A01B30D0FFAEDD7CD30ABC95D8
11ED47A01B30D0FFAEDD7CD30ABC95D8
11ED47A01B30D0FFAEDD7CD30ABC95D8
11ED47A01B30D0FFAEDD7CD30ABC95D8
11ED47A01B30D0FFAEDD7CD30ABC95D8
11ED47A01B30D0FFAEDD7CD30ABC95D8
11ED47A01B30D0FFAEDD7CD30ABC95D8
11ED47A01B30D0FFAEDD7CD30ABC95D8
11ED47A01B30D0FFAEDD7CD30ABC95D8
11ED47A01B30D0FFAEDD7CD30ABC95D8
11ED47A01B30D0FFAEDD7CD30ABC95D8
11ED47A01B30D0FFAEDD7CD30ABC95D8
11ED47A01B30D0FFAEDD7CD30ABC95D8
11ED47A01B30D0FFAEDD7CD30ABC95D8
11ED47A01B30D0FFAEDD7CD30ABC95D8
11ED47A01B30D0FFAEDD7CD30ABC95D8
11ED47A01B30D0FFAEDD7CD30ABC95D8
11ED47A01B30D0FFAEDD7CD30ABC95D8
11ED47A01B30D0FFAEDD7CD30ABC95D8
11ED47A01B30D0FFAEDD7CD30ABC95D8
11ED47A01B30D0FFAEDD7CD30ABC95D8
11ED47A01B30D0FFAEDD7CD30ABC95D8
11ED47A01B30D0FFAEDD7CD30ABC95D8
11ED47A01B30D0FFAEDD7CD30ABC95D8
11ED47A01B30D0FFAEDD7CD30ABC95D8
11ED47A01B30D0FFAEDD7CD30ABC95D8
11ED47A01B30D0FFAEDD7CD30ABC95D8
11ED47A01B30D0FFAEDD7CD30ABC95D8
11ED47A01B30D0FFAEDD7CD30ABC95D8
11ED47A01B30D0FFAEDD7CD30ABC95D8
11ED47A01B30D0FFAEDD7CD30ABC95D8
11ED47A01B30D0FFAEDD7CD30ABC95D8
11ED47A01B30D0FFAEDD7CD30ABC95D8
11ED47A01B30D0FFAEDD7CD30ABC95D8
11ED47A01B30D0FFAEDD7CD30ABC95D8
11ED47A01B30D0FFAEDD7CD30ABC95D8
11ED47A01B30D0FFAEDD7CD30ABC95D8
11ED47A01B30D0FFAEDD7CD30ABC95D8
11ED47A01B30D0FFAEDD7CD30ABC95D8
11ED47A01B30D0FFAEDD7CD30ABC95D8
11ED47A01B30D0FFAEDD7CD30ABC95D8
11ED47A01B30D0FFAEDD7CD30ABC95D8
11ED47A01B30D0FFAEDD7CD30ABC95D8
11ED47A01B30D0FFAEDD7CD30ABC95D8
11ED47A01B30D0FFAEDD7CD30ABC95D8
11ED47A01B30D0FFAEDD7CD30ABC95D8
11ED47A01B30D0FFAEDD7CD30ABC95D8
11ED47A01B30D0FFAEDD7CD30ABC95D8
11ED47A01B30D0FFAEDD7CD30ABC95D8
11ED47A01B30D0FFAEDD7CD30ABC95D8
11ED47A01B30D0FFAEDD7CD30ABC95D8
11ED47A01B30D0FFAEDD7CD30ABC95D8
11ED47A01B30D0FFAEDD7CD30ABC95D8
11ED47A01B30D0FFAEDD7CD30ABC95D8
11ED47A01B30D0FFAEDD7CD30ABC95D8
11ED47A01B30D0FFAEDD7CD30ABC95D8
11ED47A01B30D0FFAEDD7CD30ABC95D8
11ED47A01B30D0FFAEDD7CD30ABC95D8
11ED47A01B30D0FFAEDD7CD30ABC95D8
11ED47A01B30D0FFAEDD7CD30ABC95D8
11ED47A01B30D0FFAEDD7CD30ABC95D8
11ED47A01B30D0FFAEDD7CD30ABC95D8
11ED47A01B30D0FFAEDD7CD30ABC95D8
11ED47A01B30D0FFAEDD7CD30ABC95D8
11ED47A01B30D0FFAEDD7CD30ABC95D8
11ED47A01B30D0FFAEDD7CD30ABC95D8
11ED47A01B30D0FFAEDD7CD30ABC95D8
11ED47A01B30D0FFAEDD7CD30ABC95D8
11ED47A01B30D0FFAEDD7CD30ABC95D8
11ED47A01B30D0FFAEDD7CD30ABC95D8
11ED47A01B30D0FFAEDD7CD30ABC95D8
11ED47A01B30D0FFAEDD7CD30ABC95D8
11ED47A01B30D0FFAEDD7CD30ABC95D8
11ED47A01B30D0FFAEDD7CD30ABC95D8
11ED47A01B30D0FFAEDD7CD30ABC95D8
11ED47A01B30D0FFAEDD7CD30ABC95D8
11ED47A01B30D0FFAEDD7CD30ABC95D8
11ED47A01B30D0FFAEDD7CD30ABC95D8
11ED47A01B30D0FFAEDD7CD30ABC95D8
11ED47A01B30D0FFAEDD7CD30ABC95D8
11ED47A01B30D0FFAEDD7CD30ABC95D8
11ED47A01B30D0FFAEDD7CD30ABC95D8
11ED47A01B30D0FFAEDD7CD30ABC95D8
11ED47A01B30D0FFAEDD7CD30ABC95D8
11ED47A01B30D0FFAEDD7CD30ABC95D8
11ED47A01B30D0FFAEDD7CD30ABC95D8
11ED47A01B30D0FFAEDD7CD30ABC95D8
11ED47A01B30D0FFAEDD7CD30ABC95D8
11ED47A01B30D0FFAEDD7CD30ABC95D8
11ED47A01B30D0FFAEDD7CD30ABC95D8
11ED47A01B30D0FFAEDD7CD30ABC95D8
11ED47A01B30D0FFAEDD7CD30ABC95D8
11ED47A01B30D0FFAEDD7CD30ABC95D8
11ED47A01B30D0FFAEDD7CD30ABC95D8
11ED47A01B30D0FFAEDD7CD30ABC95D8
11ED47A01B30D0FFAEDD7CD30ABC95D8
11ED47A01B30D0FFAEDD7CD30ABC95D8
11ED47A01B30D0FFAEDD7CD30ABC95D8
11ED47A01B30D0FFAEDD7CD30ABC95D8
11ED47A01B30D0FFAEDD7CD30ABC95D8
11ED47A01B30D0FFAEDD7CD30ABC95D8
11ED47A01B30D0FFAEDD7CD30ABC95D8
11ED47A01B30D0FFAEDD7CD30ABC95D8
11ED47A01B30D0FFAEDD7CD30ABC95D8
11ED47A01B30D0FFAEDD7CD30ABC95D8
11ED47A01B30D0FFAEDD7CD30ABC95D8
11ED47A01B30D0FFAEDD7CD30ABC95D8
11ED47A01B30D0FFAEDD7CD30ABC95D8
11ED47A01B30D0FFAEDD7CD30ABC95D8
11ED47A01B30D0FFAEDD7CD30ABC95D8
11ED47A01B30D0FFAEDD7CD30ABC95D8
11ED47A01B30D0FFAEDD7CD30ABC95D8
11ED47A01B30D0FFAEDD7CD30ABC95D8
11ED47A01B30D0FFAEDD7CD30ABC95D8
11ED47A01B30D0FFAEDD7CD30ABC95D8
11ED47A01B30D0FFAEDD7CD30ABC95D8
11ED47A01B30D0FFAEDD7CD30ABC95D8
11ED47A01B30D0FFAEDD7CD30ABC95D8
11ED47A01B30D0FFAEDD7CD30ABC95D8
11ED47A01B30D0FFAEDD7CD30ABC95D8
11ED47A01B30D0FFAEDD7CD30ABC95D8
11ED47A01B30D0FFAEDD7CD30ABC95D8
11ED47A01B30D0FFAEDD7CD30ABC95D8
11ED47A01B30D0FFAEDD7CD30ABC95D8
11ED47A01B30D0FFAEDD7CD30ABC95D8
11ED47A01B30D0FFAEDD7CD30ABC95D8
11ED47A01B30D0FFAEDD7CD30ABC95D8
11ED47A01B30D0FFAEDD7CD30ABC95D8
11ED47A01B30D0FFAEDD7CD30ABC95D8
11ED47A01B30D0FFAEDD7CD30ABC95D8
11ED47A01B30D0FFAEDD7CD30ABC95D8
11ED47A01B30D0FFAEDD7CD30ABC95D8
11ED47A01B30D0FFAEDD7CD30ABC95D8
11ED47A01B30D0FFAEDD7CD30ABC95D8
11ED47A01B30D0FFAEDD7CD30ABC95D8
11ED47A01B30D0FFAEDD7CD30ABC95D8
11ED47A01B30D0FFAEDD7CD30ABC95D8
11ED47A01B30D0FFAEDD7CD30ABC95D8
11ED47A01B30D0FFAEDD7CD30ABC95D8
11ED47A01B30D0FFAEDD7CD30ABC95D8
11ED47A01B30D0FFAEDD7CD30ABC95D8
11ED47A01B30D0FFAEDD7CD30ABC95D8
11ED47A01B30D0FFAEDD7CD30ABC95D8
11ED47A01B30D0FFAEDD7CD30ABC95D8
11ED47A01B30D0FFAEDD7CD30ABC95D8
11ED47A01B30D0FFAEDD7CD30ABC95D8
11ED47A01B30D0FFAEDD7CD30ABC95D8
11ED47A01B30D0FFAEDD7CD30ABC95D8
11ED47A01B30D0FFAEDD7CD30ABC95D8
11ED47A01B30D0FFAEDD7CD30ABC95D8
11ED47A01B30D0FFAEDD7CD30ABC95D8
11ED47A01B30D0FFAEDD7CD30ABC95D8
11ED47A01B30D0FFAEDD7CD30ABC95D8
11ED47A01B30D0FFAEDD7CD30ABC95D8
11ED47A01B30D0FFAEDD7CD30ABC95D8
11ED47A01B30D0FFAEDD7CD30ABC95D8
11ED47A01B30D0FFAEDD7CD30ABC95D8
11ED47A01B30D0FFAEDD7CD30ABC95D8
11ED47A01B30D0FFAEDD7CD30ABC95D8
11ED47A01B30D0FFAEDD7CD30ABC95D8
11ED47A01B30D0FFAEDD7CD30ABC95D8
11ED47A01B30D0FFAEDD7CD30ABC95D8
11ED47A01B30D0FFAEDD7CD30ABC95D8
11ED47A01B30D0FFAEDD7CD30ABC95D8
11ED47A01B30D0FFAEDD7CD30ABC95D8
11ED47A01B30D0FFAEDD7CD30ABC95D8
11ED47A01B30D0FFAEDD7CD30ABC95D8
11ED47A01B30D0FFAEDD7CD30ABC95D8
11ED47A01B30D0FFAEDD7CD30ABC95D8
11ED47A01B30D0FFAEDD7CD30ABC95D8
11ED47A01B30D0FFAEDD7CD30ABC95D8
11ED47A01B30D0FFAEDD7CD30ABC95D8
11ED47A01B30D0FFAEDD7CD30ABC95D8
11ED47A01B30D0FFAEDD7CD30ABC95D8
11ED47A01B30D0FFAEDD7CD30ABC95D8
11ED47A01B30D0FFAEDD7CD30ABC95D8
11ED47A01B30D0FFAEDD7CD30ABC95D8
11ED47A01B30D0FFAEDD7CD30ABC95D8
11ED47A01B30D0FFAEDD7CD30ABC95D8
11ED47A01B30D0FFAEDD7CD30ABC95D8
11ED47A01B30D0FFAEDD7CD30ABC95D8
11ED47A01B30D0FFAEDD7CD30ABC95D8
11ED47A01B30D0FFAEDD7CD30ABC95D8
11ED47A01B30D0FFAEDD7CD30ABC95D8
11ED47A01B30D0FFAEDD7CD30ABC95D8
11ED47A01B30D0FFAEDD7CD30ABC95D8
11ED47A01B30D0FFAEDD7CD30ABC95D8
11ED47A01B30D0FFAEDD7CD30ABC95D8
11ED47A01B30D0FFAEDD7CD30ABC95D8
11ED47A01B30D0FFAEDD7CD30ABC95D8
11ED47A01B30D0FFAEDD7CD30ABC95D8
11ED47A01B30D0FFAEDD7CD30ABC95D8
11ED47A01B30D0FFAEDD7CD30ABC95D8
11ED47A01B30D0FFAEDD7CD30ABC95D8
11ED47A01B30D0FFAEDD7CD30ABC95D8
11ED47A01B30D0FFAEDD7CD30ABC95D8
11ED47A01B30D0FFAEDD7CD30ABC95D8
11ED47A01B30D0FFAEDD7CD30ABC95D8
11ED47A01B30D0FFAEDD7CD30ABC95D8
11ED47A01B30D0FFAEDD7CD30ABC95D8
11ED47A01B30D0FFAEDD7CD30ABC95D8
11ED47A01B30D0FFAEDD7CD30ABC95D8
11ED47A01B30D0FFAEDD7CD30ABC95D8
11ED47A01B30D0FFAEDD7CD30ABC95D8
11ED47A01B30D0FFAEDD7CD30ABC95D8
11ED47A01B30D0FFAEDD7CD30ABC95D8
11ED47A01B30D0FFAEDD7CD30ABC95D8
11ED47A01B30D0FFAEDD7CD30ABC95D8
11ED47A01B30D0FFAEDD7CD30ABC95D8
11ED47A01B30D0FFAEDD7CD30ABC95D8
11ED47A01B30D0FFAEDD7CD30ABC95D8
11ED47A01B30D0FFAEDD7CD30ABC95D8
11ED47A01B30D0FFAEDD7CD30ABC95D8
11ED47A01B30D0FFAEDD7CD30ABC95D8
11ED47A01B30D0FFAEDD7CD30ABC95D8
11ED47A01B30D0FFAEDD7CD30ABC95D8
11ED47A01B30D0FFAEDD7CD30ABC95D8
11ED47A01B30D0FFAEDD7CD30ABC95D8
11ED47A01B30D0FFAEDD7CD30ABC95D8
11ED47A01B30D0FFAEDD7CD30ABC95D8
11ED47A01B30D0FFAEDD7CD30ABC95D8
11ED47A01B30D0FFAEDD7CD30ABC95D8
11ED47A01B30D0FFAEDD7CD30ABC95D8
11ED47A01B30D0FFAEDD7CD30ABC95D8
11ED47A01B30D0FFAEDD7CD30ABC95D8
11ED47A01B30D0FFAEDD7CD30ABC95D8
11ED47A01B30D0FFAEDD7CD30ABC95D8
11ED47A01B30D0FFAEDD7CD30ABC95D8
11ED47A01B30D0FFAEDD7CD30ABC95D8
11ED47A01B30D0FFAEDD7CD30ABC95D8
11ED47A01B30D0FFAEDD7CD30ABC95D8
11ED47A01B30D0FFAEDD7CD30ABC95D8
11ED47A01B30D0FFAEDD7CD30ABC95D8
11ED47A01B30D0FFAEDD7CD30ABC95D8
11ED47A01B30D0FFAEDD7CD30ABC95D8
11ED47A01B30D0FFAEDD7CD30ABC95D8
11ED47A01B30D0FFAEDD7CD30ABC95D8
11ED47A01B30D0FFAEDD7CD30ABC95D8
11ED47A01B30D0FFAEDD7CD30ABC95D8
11ED47A01B30D0FFAEDD7CD30ABC95D8
11ED47A01B30D0FFAEDD7CD30ABC95D8
11ED47A01B30D0FFAEDD7CD30ABC95D8
11ED47A01B30D0FFAEDD7CD30ABC95D8
11ED47A01B30D0FFAEDD7CD30ABC95D8
11ED47A01B30D0FFAEDD7CD30ABC95D8
11ED47A01B30D0FFAEDD7CD30ABC95D8
11ED47A01B30D0FFAEDD7CD30ABC95D8
11ED47A01B30D0FFAEDD7CD30ABC95D8
11ED47A01B30D0FFAEDD7CD30ABC95D8
11ED47A01B30D0FFAEDD7CD30ABC95D8
11ED47A01B30D0FFAEDD7CD30ABC95D8
11ED47A01B30D0FFAEDD7CD30ABC95D8
11ED47A01B30D0FFAEDD7CD30ABC95D8
11ED47A01B30D0FFAEDD7CD30ABC95D8
11ED47A01B30D0FFAEDD7CD30ABC95D8
11ED47A01B30D0FFAEDD7CD30ABC95D8
11ED47A01B30D0FFAEDD7CD30ABC95D8
11ED47A01B30D0FFAEDD7CD30ABC95D8
11ED47A01B30D0FFAEDD7CD30ABC95D8
11ED47A01B30D0FFAEDD7CD30ABC95D8
11ED47A01B30D0FFAEDD7CD30ABC95D8
11ED47A01B30D0FFAEDD7CD30ABC95D8
11ED47A01B30D0FFAEDD7CD30ABC95D8
11ED47A01B30D0FFAEDD7CD30ABC95D8
11ED47A01B30D0FFAEDD7CD30ABC95D8
11ED47A01B30D0FFAEDD7CD30ABC95D8
11ED47A01B30D0FFAEDD7CD30ABC95D8
11ED47A01B30D0FFAEDD7CD30ABC95D8
11ED47A01B30D0FFAEDD7CD30ABC95D8
11ED47A01B30D0FFAEDD7CD30ABC95D8
11ED47A01B30D0FFAEDD7CD30ABC95D8
11ED47A01B30D0FFAEDD7CD30ABC95D8
11ED47A01B30D0FFAEDD7CD30ABC95D8
11ED47A01B30D0FFAEDD7CD30ABC95D8
11ED47A01B30D0FFAEDD7CD30ABC95D8
11ED47A01B30D0FFAEDD7CD30ABC95D8
11ED47A01B30D0FFAEDD7CD30ABC95D8
11ED47A01B30D0FFAEDD7CD30ABC95D8
11ED47A01B30D0FFAEDD7CD30ABC95D8
11ED47A01B30D0FFAEDD7CD30ABC95D8
11ED47A01B30D0FFAEDD7CD30ABC95D8
11ED47A01B30D0FFAEDD7CD30ABC95D8
11ED47A01B30D0FFAEDD7CD30ABC95D8
11ED47A01B30D0FFAEDD7CD30ABC95D8
11ED47A01B30D0FFAEDD7CD30ABC95D8
11ED47A01B30D0FFAEDD7CD30ABC95D8
11ED47A01B30D0FFAEDD7CD30ABC95D8
11ED47A01B30D0FFAEDD7CD30ABC95D8
11ED47A01B30D0FFAEDD7CD30ABC95D8
11ED47A01B30D0FFAEDD7CD30ABC95D8
11ED47A01B30D0FFAEDD7CD30ABC95D8
11ED47A01B30D0FFAEDD7CD30ABC95D8
11ED47A01B30D0FFAEDD7CD30ABC95D8
11ED47A01B30D0FFAEDD7CD30ABC95D8
11ED47A01B30D0FFAEDD7CD30ABC95D8
11ED47A01B30D0FFAEDD7CD30ABC95D8
11ED47A01B30D0FFAEDD7CD30ABC95D8
11ED47A01B30D0FFAEDD7CD30ABC95D8
11ED47A01B30D0FFAEDD7CD30ABC95D8
11ED47A01B30D0FFAEDD7CD30ABC95D8
11ED47A01B30D0FFAEDD7CD30ABC95D8
11ED47A01B30D0FFAEDD7CD30ABC95D8
11ED47A01B30D0FFAEDD7CD30ABC95D8
11ED47A01B30D0FFAEDD7CD30ABC95D8
11ED47A01B30D0FFAEDD7CD30ABC95D8
11ED47A01B30D0FFAEDD7CD30ABC95D8
11ED47A01B30D0FFAEDD7CD30ABC95D8
11ED47A01B30D0FFAEDD7CD30ABC95D8
11ED47A01B30D0FFAEDD7CD30ABC95D8
11ED47A01B30D0FFAEDD7CD30ABC95D8
11ED47A01B30D0FFAEDD7CD30ABC95D8
11ED47A01B30D0FFAEDD7CD30ABC95D8
11ED47A01B30D0FFAEDD7CD30ABC95D8
11ED47A01B30D0FFAEDD7CD30ABC95D8
11ED47A01B30D0FFAEDD7CD30ABC95D8
11ED47A01B30D0FFAEDD7CD30ABC95D8
11ED47A01B30D0FFAEDD7CD30ABC95D8
11ED47A01B30D0FFAEDD7CD30ABC95D8
11ED47A01B30D0FFAEDD7CD30ABC95D8
11ED47A01B30D0FFAEDD7CD30ABC95D8
11ED47A01B30D0FFAEDD7CD30ABC95D8
11ED47A01B30D0FFAEDD7CD30ABC95D8
11ED47A01B30D0FFAEDD7CD30ABC95D8
11ED47A01B30D0FFAEDD7CD30ABC95D8
11ED47A01B30D0FFAEDD7CD30ABC95D8
11ED47A01B30D0FFAEDD7CD30ABC95D8
11ED47A01B30D0FFAEDD7CD30ABC95D8
11ED47A01B30D0FFAEDD7CD30ABC95D8
11ED47A01B30D0FFAEDD7CD30ABC95D8
11ED47A01B30D0FFAEDD7CD30ABC95D8
11ED47A01B30D0FFAEDD7CD30ABC95D8
11ED47A01B30D0FFAEDD7CD30ABC95D8
11ED47A01B30D0FFAEDD7CD30ABC95D8
11ED47A01B30D0FFAEDD7CD30ABC95D8
11ED47A01B30D0FFAEDD7CD30ABC95D8
11ED47A01B30D0FFAEDD7CD30ABC95D8
11ED47A01B30D0FFAEDD7CD30ABC95D8
11ED47A01B30D0FFAEDD7CD30ABC95D8
11ED47A01B30D0FFAEDD7CD30ABC95D8
11ED47A01B30D0FFAEDD7CD30ABC95D8
11ED47A01B30D0FFAEDD7CD30ABC95D8
11ED47A01B30D0FFAEDD7CD30ABC95D8
11ED47A01B30D0FFAEDD7CD30ABC95D8
11ED47A01B30D0FFAEDD7CD30ABC95D8
11ED47A01B30D0FFAEDD7CD30ABC95D8
11ED47A01B30D0FFAEDD7CD30ABC95D8
11ED47A01B30D0FFAEDD7CD30ABC95D8
11ED47A01B30D0FFAEDD7CD30ABC95D8
11ED47A01B30D0FFAEDD7CD30ABC95D8
11ED47A01B30D0FFAEDD7CD30ABC95D8
11ED47A01B30D0FFAEDD7CD30ABC95D8
11ED47A01B30D0FFAEDD7CD30ABC95D8
11ED47A01B30D0FFAEDD7CD30ABC95D8
11ED47A01B30D0FFAEDD7CD30ABC95D8
11ED47A01B30D0FFAEDD7CD30ABC95D8
11ED47A01B30D0FFAEDD7CD30ABC95D8
11ED47A01B30D0FFAEDD7CD30ABC95D8
11ED47A01B30D0FFAEDD7CD30ABC95D8
11ED47A01B30D0FFAEDD7CD30ABC95D8
11ED47A01B30D0FFAEDD7CD30ABC95D8
11ED47A01B30D0FFAEDD7CD30ABC95D8
11ED47A01B30D0FFAEDD7CD30ABC95D8
11ED47A01B30D0FFAEDD7CD30ABC95D8
11ED47A01B30D0FFAEDD7CD30ABC95D8
11ED47A01B30D0FFAEDD7CD30ABC95D8
11ED47A01B30D0FFAEDD7CD30ABC95D8
11ED47A01B30D0FFAEDD7CD30ABC95D8
11ED47A01B30D0FFAEDD7CD30ABC95D8
11ED47A01B30D0FFAEDD7CD30ABC95D8
11ED47A01B30D0FFAEDD7CD30ABC95D8
11ED47A01B30D0FFAEDD7CD30ABC95D8
11ED47A01B30D0FFAEDD7CD30ABC95D8
11ED47A01B30D0FFAEDD7CD30ABC95D8
11ED47A01B30D0FFAEDD7CD30ABC95D8
11ED47A01B30D0FFAEDD7CD30ABC95D8
11ED47A01B30D0FFAEDD7CD30ABC95D8
11ED47A01B30D0FFAEDD7CD30ABC95D8
11ED47A01B30D0FFAEDD7CD30ABC95D8
11ED47A01B30D0FFAEDD7CD30ABC95D8
11ED47A01B30D0FFAEDD7CD30ABC95D8
11ED47A01B30D0FFAEDD7CD30ABC95D8
11ED47A01B30D0FFAEDD7CD30ABC95D8
11ED47A01B30D0FFAEDD7CD30ABC95D8
11ED47A01B30D0FFAEDD7CD30ABC95D8
11ED47A01B30D0FFAEDD7CD30ABC95D8
11ED47A01B30D0FFAEDD7CD30ABC95D8
11ED47A01B30D0FFAEDD7CD30ABC95D8
11ED47A01B30D0FFAEDD7CD30ABC95D8
11ED47A01B30D0FFAEDD7CD30ABC95D8
11ED47A01B30D0FFAEDD7CD30ABC95D8
11ED47A01B30D0FFAEDD7CD30ABC95D8
11ED47A01B30D0FFAEDD7CD30ABC95D8
11ED47A01B30D0FFAEDD7CD30ABC95D8
11ED47A01B30D0FFAEDD7CD30ABC95D8
11ED47A01B30D0FFAEDD7CD30ABC95D8
11ED47A01B30D0FFAEDD7CD30ABC95D8
11ED47A01B30D0FFAEDD7CD30ABC95D8
11ED47A01B30D0FFAEDD7CD30ABC95D8
11ED47A01B30D0FFAEDD7CD30ABC95D8
11ED47A01B30D0FFAEDD7CD30ABC95D8
11ED47A01B30D0FFAEDD7CD30ABC95D8
11ED47A01B30D0FFAEDD7CD30ABC95D8
11ED47A01B30D0FFAEDD7CD30ABC95D8
11ED47A01B30D0FFAEDD7CD30ABC95D8
11ED47A01B30D0FFAEDD7CD30ABC95D8
11ED47A01B30D0FFAEDD7CD30ABC95D8
11ED47A01B30D0FFAEDD7CD30ABC95D8
11ED47A01B30D0FFAEDD7CD30ABC95D8
11ED47A01B30D0FFAEDD7CD30ABC95D8
11ED47A01B30D0FFAEDD7CD30ABC95D8
11ED47A01B30D0FFAEDD7CD30ABC95D8
11ED47A01B30D0FFAEDD7CD30ABC95D8
11ED47A01B30D0FFAEDD7CD30ABC95D8
11ED47A01B30D0FFAEDD7CD30ABC95D8
11ED47A01B30D0FFAEDD7CD30ABC95D8
11ED47A01B30D0FFAEDD7CD30ABC95D8
11ED47A01B30D0FFAEDD7CD30ABC95D8
11ED47A01B30D0FFAEDD7CD30ABC95D8
11ED47A01B30D0FFAEDD7CD30ABC95D8
11ED47A01B30D0FFAEDD7CD30ABC95D8
11ED47A01B30D0FFAEDD7CD30ABC95D8
11ED47A01B30D0FFAEDD7CD30ABC95D8
11ED47A01B30D0FFAEDD7CD30ABC95D8
11ED47A01B30D0FFAEDD7CD30ABC95D8
11ED47A01B30D0FFAEDD7CD30ABC95D8
11ED47A01B30D0FFAEDD7CD30ABC95D8
11ED47A01B30D0FFAEDD7CD30ABC95D8
11ED47A01B30D0FFAEDD7CD30ABC95D8
11ED47A01B30D0FFAEDD7CD30ABC95D8
11ED47A01B30D0FFAEDD7CD30ABC95D8
11ED47A01B30D0FFAEDD7CD30ABC95D8
11ED47A01B30D0FFAEDD7CD30ABC95D8
11ED47A01B30D0FFAEDD7CD30ABC95D8
11ED47A01B30D0FFAEDD7CD30ABC95D8
11ED47A01B30D0FFAEDD7CD30ABC95D8
11ED47A01B30D0FFAEDD7CD30ABC95D8
11ED47A01B30D0FFAEDD7CD30ABC95D8
11ED47A01B30D0FFAEDD7CD30ABC95D8
11ED47A01B30D0FFAEDD7CD30ABC95D8
11ED47A01B30D0FFAEDD7CD30ABC95D8
11ED47A01B30D0FFAEDD7CD30ABC95D8
11ED47A01B30D0FFAEDD7CD30ABC95D8
11ED47A01B30D0FFAEDD7CD30ABC95D8
11ED47A01B30D0FFAEDD7CD30ABC95D8
11ED47A01B30D0FFAEDD7CD30ABC95D8
11ED47A01B30D0FFAEDD7CD30ABC95D8
11ED47A01B30D0FFAEDD7CD30ABC95D8
11ED47A01B30D0FFAEDD7CD30ABC95D8
11ED47A01B30D0FFAEDD7CD30ABC95D8
11ED47A01B30D0FFAEDD7CD30ABC95D8
11ED47A01B30D0FFAEDD7CD30ABC95D8
11ED47A01B30D0FFAEDD7CD30ABC95D8
11ED47A01B30D0FFAEDD7CD30ABC95D8
11ED47A01B30D0FFAEDD7CD30ABC95D8
11ED47A01B30D0FFAEDD7CD30ABC95D8
11ED47A01B30D0FFAEDD7CD30ABC95D8
11ED47A01B30D0FFAEDD7CD30ABC95D8
11ED47A01B30D0FFAEDD7CD30ABC95D8
11ED47A01B30D0FFAEDD7CD30ABC95D8
11ED47A01B30D0FFAEDD7CD30ABC95D8
11ED47A01B30D0FFAEDD7CD30ABC95D8
11ED47A01B30D0FFAEDD7CD30ABC95D8
11ED47A01B30D0FFAEDD7CD30ABC95D8
11ED47A01B30D0FFAEDD7CD30ABC95D8
11ED47A01B30D0FFAEDD7CD30ABC95D8
11ED47A01B30D0FFAEDD7CD30ABC95D8
11ED47A01B30D0FFAEDD7CD30ABC95D8
11ED47A01B30D0FFAEDD7CD30ABC95D8
11ED47A01B30D0FFAEDD7CD30ABC95D8
11ED47A01B30D0FFAEDD7CD30ABC95D8
11ED47A01B30D0FFAEDD7CD30ABC95D8
11ED47A01B30D0FFAEDD7CD30ABC95D8
11ED47A01B30D0FFAEDD7CD30ABC95D8
11ED47A01B30D0FFAEDD7CD30ABC95D8
11ED47A01B30D0FFAEDD7CD30ABC95D8
11ED47A01B30D0FFAEDD7CD30ABC95D8
11ED47A01B30D0FFAEDD7CD30ABC95D8
11ED47A01B30D0FFAEDD7CD30ABC95D8
11ED47A01B30D0FFAEDD7CD30ABC95D8
11ED47A01B30D0FFAEDD7CD30ABC95D8
11ED47A01B30D0FFAEDD7CD30ABC95D8
11ED47A01B30D0FFAEDD7CD30ABC95D8
11ED47A01B30D0FFAEDD7CD30ABC95D8
11ED47A01B30D0FFAEDD7CD30ABC95D8
11ED47A01B30D0FFAEDD7CD30ABC95D8
11ED47A01B30D0FFAEDD7CD30ABC95D8
11ED47A01B30D0FFAEDD7CD30ABC95D8
11ED47A01B30D0FFAEDD7CD30ABC95D8
11ED47A01B30D0FFAEDD7CD30ABC95D8
11ED47A01B30D0FFAEDD7CD30ABC95D8
11ED47A01B30D0FFAEDD7CD30ABC95D8
11ED47A01B30D0FFAEDD7CD30ABC95D8
11ED47A01B30D0FFAEDD7CD30ABC95D8
11ED47A01B30D0FFAEDD7CD30ABC95D8
11ED47A01B30D0FFAEDD7CD30ABC95D8
11ED47A01B30D0FFAEDD7CD30ABC95D8
11ED47A01B30D0FFAEDD7CD30ABC95D8
11ED47A01B30D0FFAEDD7CD30ABC95D8
11ED47A01B30D0FFAEDD7CD30ABC95D8
11ED47A01B30D0FFAEDD7CD30ABC95D8
11ED47A01B30D0FFAEDD7CD30ABC95D8
11ED47A01B30D0FFAEDD7CD30ABC95D8
11ED47A01B30D0FFAEDD7CD30ABC95D8
11ED47A01B30D0FFAEDD7CD30ABC95D8
11ED47A01B30D0FFAEDD7CD30ABC95D8
11ED47A01B30D0FFAEDD7CD30ABC95D8
11ED47A01B30D0FFAEDD7CD30ABC95D8
11ED47A01B30D0FFAEDD7CD30ABC95D8
11ED47A01B30D0FFAEDD7CD30ABC95D8
11ED47A01B30D0FFAEDD7CD30ABC95D8
11ED47A01B30D0FFAEDD7CD30ABC95D8
11ED47A01B30D0FFAEDD7CD30ABC95D8
11ED47A01B30D0FFAEDD7CD30ABC95D8
11ED47A01B30D0FFAEDD7CD30ABC95D8
11ED47A01B30D0FFAEDD7CD30ABC95D8
11ED47A01B30D0FFAEDD7CD30ABC95D8
11ED47A01B30D0FFAEDD7CD30ABC95D8
11ED47A01B30D0FFAEDD7CD30ABC95D8
11ED47A01B30D0FFAEDD7CD30ABC95D8
11ED47A01B30D0FFAEDD7CD30ABC95D8
11ED47A01B30D0FFAEDD7CD30ABC95D8
11ED47A01B30D0FFAEDD7CD30ABC95D8
11ED47A01B30D0FFAEDD7CD30ABC95D8
11ED47A01B30D0FFAEDD7CD30ABC95D8
11ED47A01B30D0FFAEDD7CD30ABC95D8
11ED47A01B30D0FFAEDD7CD30ABC95D8
11ED47A01B30D0FFAEDD7CD30ABC95D8
11ED47A01B30D0FFAEDD7CD30ABC95D8
11ED47A01B30D0FFAEDD7CD30ABC95D8
11ED47A01B30D0FFAEDD7CD30ABC95D8
11ED47A01B30D0FFAEDD7CD30ABC95D8
11ED47A01B30D0FFAEDD7CD30ABC95D8
11ED47A01B30D0FFAEDD7CD30ABC95D8
11ED47A01B30D0FFAEDD7CD30ABC95D8
11ED47A01B30D0FFAEDD7CD30ABC95D8
11ED47A01B30D0FFAEDD7CD30ABC95D8
11ED47A01B30D0FFAEDD7CD30ABC95D8
11ED47A01B30D0FFAEDD7CD30ABC95D8
11ED47A01B30D0FFAEDD7CD30ABC95D8
11ED47A01B30D0FFAEDD7CD30ABC95D8
11ED47A01B30D0FFAEDD7CD30ABC95D8
11ED47A01B30D0FFAEDD7CD30ABC95D8
11ED47A01B30D0FFAEDD7CD30ABC95D8
11ED47A01B30D0FFAEDD7CD30ABC95D8
11ED47A01B30D0FFAEDD7CD30ABC95D8
11ED47A01B30D0FFAEDD7CD30ABC95D8
11ED47A01B30D0FFAEDD7CD30ABC95D8
11ED47A01B30D0FFAEDD7CD30ABC95D8
11ED47A01B30D0FFAEDD7CD30ABC95D8
11ED47A01B30D0FFAEDD7CD30ABC95D8
11ED47A01B30D0FFAEDD7CD30ABC95D8
11ED47A01B30D0FFAEDD7CD30ABC95D8
11ED47A01B30D0FFAEDD7CD30ABC95D8
11ED47A01B30D0FFAEDD7CD30ABC95D8
11ED47A01B30D0FFAEDD7CD30ABC95D8
11ED47A01B30D0FFAEDD7CD30ABC95D8
11ED47A01B30D0FFAEDD7CD30ABC95D8
11ED47A01B30D0FFAEDD7CD30ABC95D8
11ED47A01B30D0FFAEDD7CD30ABC95D8
11ED47A01B30D0FFAEDD7CD30ABC95D8
11ED47A01B30D0FFAEDD7CD30ABC95D8
11ED47A01B30D0FFAEDD7CD30ABC95D8
11ED47A01B30D0FFAEDD7CD30ABC95D8
11ED47A01B30D0FFAEDD7CD30ABC95D8
11ED47A01B30D0FFAEDD7CD30ABC95D8
11ED47A01B30D0FFAEDD7CD30ABC95D8
11ED47A01B30D0FFAEDD7CD30ABC95D8
11ED47A01B30D0FFAEDD7CD30ABC95D8
11ED47A01B30D0FFAEDD7CD30ABC95D8
11ED47A01B30D0FFAEDD7CD30ABC95D8
11ED47A01B30D0FFAEDD7CD30ABC95D8
11ED47A01B30D0FFAEDD7CD30ABC95D8
11ED47A01B30D0FFAEDD7CD30ABC95D8
11ED47A01B30D0FFAEDD7CD30ABC95D8
11ED47A01B30D0FFAEDD7CD30ABC95D8
11ED47A01B30D0FFAEDD7CD30ABC95D8
11ED47A01B30D0FFAEDD7CD30ABC95D8
11ED47A01B30D0FFAEDD7CD30ABC95D8
11ED47A01B30D0FFAEDD7CD30ABC95D8
11ED47A01B30D0FFAEDD7CD30ABC95D8
11ED47A01B30D0FFAEDD7CD30ABC95D8
11ED47A01B30D0FFAEDD7CD30ABC95D8
11ED47A01B30D0FFAEDD7CD30ABC95D8
11ED47A01B30D0FFAEDD7CD30ABC95D8
11ED47A01B30D0FFAEDD7CD30ABC95D8
11ED47A01B30D0FFAEDD7CD30ABC95D8
11ED47A01B30D0FFAEDD7CD30ABC95D8
11ED47A01B30D0FFAEDD7CD30ABC95D8
11ED47A01B30D0FFAEDD7CD30ABC95D8
11ED47A01B30D0FFAEDD7CD30ABC95D8
11ED47A01B30D0FFAEDD7CD30ABC95D8
11ED47A01B30D0FFAEDD7CD30ABC95D8
11ED47A01B30D0FFAEDD7CD30ABC95D8
11ED47A01B30D0FFAEDD7CD30ABC95D8
11ED47A01B30D0FFAEDD7CD30ABC95D8
11ED47A01B30D0FFAEDD7CD30ABC95D8
11ED47A01B30D0FFAEDD7CD30ABC95D8
11ED47A01B30D0FFAEDD7CD30ABC95D8
11ED47A01B30D0FFAEDD7CD30ABC95D8
11ED47A01B30D0FFAEDD7CD30ABC95D8
11ED47A01B30D0FFAEDD7CD30ABC95D8
11ED47A01B30D0FFAEDD7CD30ABC95D8
11ED47A01B30D0FFAEDD7CD30ABC95D8
11ED47A01B30D0FFAEDD7CD30ABC95D8
11ED47A01B30D0FFAEDD7CD30ABC95D8
11ED47A01B30D0FFAEDD7CD30ABC95D8
11ED47A01B30D0FFAEDD7CD30ABC95D8
11ED47A01B30D0FFAEDD7CD30ABC95D8
11ED47A01B30D0FFAEDD7CD30ABC95D8
11ED47A01B30D0FFAEDD7CD30ABC95D8
11ED47A01B30D0FFAEDD7CD30ABC95D8
11ED47A01B30D0FFAEDD7CD30ABC95D8
11ED47A01B30D0FFAEDD7CD30ABC95D8
11ED47A01B30D0FFAEDD7CD30ABC95D8
11ED47A01B30D0FFAEDD7CD30ABC95D8
11ED47A01B30D0FFAEDD7CD30ABC95D8
11ED47A01B30D0FFAEDD7CD30ABC95D8
11ED47A01B30D0FFAEDD7CD30ABC95D8
11ED47A01B30D0FFAEDD7CD30ABC95D8
11ED47A01B30D0FFAEDD7CD30ABC95D8
11ED47A01B30D0FFAEDD7CD30ABC95D8
11ED47A01B30D0FFAEDD7CD30ABC95D8
11ED47A01B30D0FFAEDD7CD30ABC95D8
11ED47A01B30D0FFAEDD7CD30ABC95D8
11ED47A01B30D0FFAEDD7CD30ABC95D8
11ED47A01B30D0FFAEDD7CD30ABC95D8
11ED47A01B30D0FFAEDD7CD30ABC95D8
11ED47A01B30D0FFAEDD7CD30ABC95D8
11ED47A01B30D0FFAEDD7CD30ABC95D8
11ED47A01B30D0FFAEDD7CD30ABC95D8
11ED47A01B30D0FFAEDD7CD30ABC95D8
11ED47A01B30D0FFAEDD7CD30ABC95D8
11ED47A01B30D0FFAEDD7CD30ABC95D8
11ED47A01B30D0FFAEDD7CD30ABC95D8
11ED47A01B30D0FFAEDD7CD30ABC95D8
11ED47A01B30D0FFAEDD7CD30ABC95D8
11ED47A01B30D0FFAEDD7CD30ABC95D8
11ED47A01B30D0FFAEDD7CD30ABC95D8
11ED47A01B30D0FFAEDD7CD30ABC95D8
11ED47A01B30D0FFAEDD7CD30ABC95D8
11ED47A01B30D0FFAEDD7CD30ABC95D8
11ED47A01B30D0FFAEDD7CD30ABC95D8
11ED47A01B30D0FFAEDD7CD30ABC95D8
11ED47A01B30D0FFAEDD7CD30ABC95D8
11ED47A01B30D0FFAEDD7CD30ABC95D8
11ED47A01B30D0FFAEDD7CD30ABC95D8
11ED47A01B30D0FFAEDD7CD30ABC95D8
11ED47A01B30D0FFAEDD7CD30ABC95D8
11ED47A01B30D0FFAEDD7CD30ABC95D8
11ED47A01B30D0FFAEDD7CD30ABC95D8
11ED47A01B30D0FFAEDD7CD30ABC95D8
11ED47A01B30D0FFAEDD7CD30ABC95D8
11ED47A01B30D0FFAEDD7CD30ABC95D8
11ED47A01B30D0FFAEDD7CD30ABC95D8
11ED47A01B30D0FFAEDD7CD30ABC95D8
11ED47A01B30D0FFAEDD7CD30ABC95D8
11ED47A01B30D0FFAEDD7CD30ABC95D8
11ED47A01B30D0FFAEDD7CD30ABC95D8
11ED47A01B30D0FFAEDD7CD30ABC95D8
11ED47A01B30D0FFAEDD7CD30ABC95D8
11ED47A01B30D0FFAEDD7CD30ABC95D8
11ED47A01B30D0FFAEDD7CD30ABC95D8
11ED47A01B30D0FFAEDD7CD30ABC95D8
11ED47A01B30D0FFAEDD7CD30ABC95D8
11ED47A01B30D0FFAEDD7CD30ABC95D8
11ED47A01B30D0FFAEDD7CD30ABC95D8
11ED47A01B30D0FFAEDD7CD30ABC95D8
11ED47A01B30D0FFAEDD7CD30ABC95D8
11ED47A01B30D0FFAEDD7CD30ABC95D8
11ED47A01B30D0FFAEDD7CD30ABC95D8
11ED47A01B30D0FFAEDD7CD30ABC95D8
11ED47A01B30D0FFAEDD7CD30ABC95D8
11ED47A01B30D0FFAEDD7CD30ABC95D8
11ED47A01B30D0FFAEDD7CD30ABC95D8
11ED47A01B30D0FFAEDD7CD30ABC95D8
11ED47A01B30D0FFAEDD7CD30ABC95D8
11ED47A01B30D0FFAEDD7CD30ABC95D8
11ED47A01B30D0FFAEDD7CD30ABC95D8
11ED47A01B30D0FFAEDD7CD30ABC95D8
11ED47A01B30D0FFAEDD7CD30ABC95D8
11ED47A01B30D0FFAEDD7CD30ABC95D8
11ED47A01B30D0FFAEDD7CD30ABC95D8
11ED47A01B30D0FFAEDD7CD30ABC95D8
11ED47A01B30D0FFAEDD7CD30ABC95D8
11ED47A01B30D0FFAEDD7CD30ABC95D8
11ED47A01B30D0FFAEDD7CD30ABC95D8
11ED47A01B30D0FFAEDD7CD30ABC95D8
11ED47A01B30D0FFAEDD7CD30ABC95D8
11ED47A01B30D0FFAEDD7CD30ABC95D8
11ED47A01B30D0FFAEDD7CD30ABC95D8
11ED47A01B30D0FFAEDD7CD30ABC95D8
11ED47A01B30D0FFAEDD7CD30ABC95D8
11ED47A01B30D0FFAEDD7CD30ABC95D8
11ED47A01B30D0FFAEDD7CD30ABC95D8
11ED47A01B30D0FFAEDD7CD30ABC95D8
11ED47A01B30D0FFAEDD7CD30ABC95D8
11ED47A01B30D0FFAEDD7CD30ABC95D8
11ED47A01B30D0FFAEDD7CD30ABC95D8
11ED47A01B30D0FFAEDD7CD30ABC95D8
11ED47A01B30D0FFAEDD7CD30ABC95D8
11ED47A01B30D0FFAEDD7CD30ABC95D8
11ED47A01B30D0FFAEDD7CD30ABC95D8
11ED47A01B30D0FFAEDD7CD30ABC95D8
11ED47A01B30D0FFAEDD7CD30ABC95D8
11ED47A01B30D0FFAEDD7CD30ABC95D8
11ED47A01B30D0FFAEDD7CD30ABC95D8
11ED47A01B30D0FFAEDD7CD30ABC95D8
11ED47A01B30D0FFAEDD7CD30ABC95D8
11ED47A01B30D0FFAEDD7CD30ABC95D8
11ED47A01B30D0FFAEDD7CD30ABC95D8
11ED47A01B30D0FFAEDD7CD30ABC95D8
11ED47A01B30D0FFAEDD7CD30ABC95D8
11ED47A01B30D0FFAEDD7CD30ABC95D8
11ED47A01B30D0FFAEDD7CD30ABC95D8
11ED47A01B30D0FFAEDD7CD30ABC95D8
11ED47A01B30D0FFAEDD7CD30ABC95D8
11ED47A01B30D0FFAEDD7CD30ABC95D8
11ED47A01B30D0FFAEDD7CD30ABC95D8
11ED47A01B30D0FFAEDD7CD30ABC95D8
11ED47A01B30D0FFAEDD7CD30ABC95D8
11ED47A01B30D0FFAEDD7CD30ABC95D8
11ED47A01B30D0FFAEDD7CD30ABC95D8
11ED47A01B30D0FFAEDD7CD30ABC95D8
11ED47A01B30D0FFAEDD7CD30ABC95D8
11ED47A01B30D0FFAEDD7CD30ABC95D8
11ED47A01B30D0FFAEDD7CD30ABC95D8
11ED47A01B30D0FFAEDD7CD30ABC95D8
11ED47A01B30D0FFAEDD7CD30ABC95D8
11ED47A01B30D0FFAEDD7CD30ABC95D8
11ED47A01B30D0FFAEDD7CD30ABC95D8
11ED47A01B30D0FFAEDD7CD30ABC95D8
11ED47A01B30D0FFAEDD7CD30ABC95D8
11ED47A01B30D0FFAEDD7CD30ABC95D8
11ED47A01B30D0FFAEDD7CD30ABC95D8
11ED47A01B30D0FFAEDD7CD30ABC95D8
11ED47A01B30D0FFAEDD7CD30ABC95D8
11ED47A01B30D0FFAEDD7CD30ABC95D8
11ED47A01B30D0FFAEDD7CD30ABC95D8
11ED47A01B30D0FFAEDD7CD30ABC95D8
11ED47A01B30D0FFAEDD7CD30ABC95D8
11ED47A01B30D0FFAEDD7CD30ABC95D8
11ED47A01B30D0FFAEDD7CD30ABC95D8
11ED47A01B30D0FFAEDD7CD30ABC95D8
11ED47A01B30D0FFAEDD7CD30ABC95D8
11ED47A01B30D0FFAEDD7CD30ABC95D8
11ED47A01B30D0FFAEDD7CD30ABC95D8
11ED47A01B30D0FFAEDD7CD30ABC95D8
11ED47A01B30D0FFAEDD7CD30ABC95D8
11ED47A01B30D0FFAEDD7CD30ABC95D8
11ED47A01B30D0FFAEDD7CD30ABC95D8
11ED47A01B30D0FFAEDD7CD30ABC95D8
11ED47A01B30D0FFAEDD7CD30ABC95D8
11ED47A01B30D0FFAEDD7CD30ABC95D8
11ED47A01B30D0FFAEDD7CD30ABC95D8
11ED47A01B30D0FFAEDD7CD30ABC95D8
11ED47A01B30D0FFAEDD7CD30ABC95D8
11ED47A01B30D0FFAEDD7CD30ABC95D8
11ED47A01B30D0FFAEDD7CD30ABC95D8
11ED47A01B30D0FFAEDD7CD30ABC95D8
11ED47A01B30D0FFAEDD7CD30ABC95D8
11ED47A01B30D0FFAEDD7CD30ABC95D8
11ED47A01B30D0FFAEDD7CD30ABC95D8
11ED47A01B30D0FFAEDD7CD30ABC95D8
11ED47A01B30D0FFAEDD7CD30ABC95D8
11ED47A01B30D0FFAEDD7CD30ABC95D8
11ED47A01B30D0FFAEDD7CD30ABC95D8
11ED47A01B30D0FFAEDD7CD30ABC95D8
11ED47A01B30D0FFAEDD7CD30ABC95D8
11ED47A01B30D0FFAEDD7CD30ABC95D8
11ED47A01B30D0FFAEDD7CD30ABC95D8
11ED47A01B30D0FFAEDD7CD30ABC95D8
11ED47A01B30D0FFAEDD7CD30ABC95D8
11ED47A01B30D0FFAEDD7CD30ABC95D8
11ED47A01B30D0FFAEDD7CD30ABC95D8
11ED47A01B30D0FFAEDD7CD30ABC95D8
11ED47A01B30D0FFAEDD7CD30ABC95D8
11ED47A01B30D0FFAEDD7CD30ABC95D8
11ED47A01B30D0FFAEDD7CD30ABC95D8
11ED47A01B30D0FFAEDD7CD30ABC95D8
11ED47A01B30D0FFAEDD7CD30ABC95D8
11ED47A01B30D0FFAEDD7CD30ABC95D8
11ED47A01B30D0FFAEDD7CD30ABC95D8
11ED47A01B30D0FFAEDD7CD30ABC95D8
11ED47A01B30D0FFAEDD7CD30ABC95D8
11ED47A01B30D0FFAEDD7CD30ABC95D8
11ED47A01B30D0FFAEDD7CD30ABC95D8
11ED47A01B30D0FFAEDD7CD30ABC95D8
11ED47A01B30D0FFAEDD7CD30ABC95D8
11ED47A01B30D0FFAEDD7CD30ABC95D8
11ED47A01B30D0FFAEDD7CD30ABC95D8
11ED47A01B30D0FFAEDD7CD30ABC95D8
11ED47A01B30D0FFAEDD7CD30ABC95D8
11ED47A01B30D0FFAEDD7CD30ABC95D8
11ED47A01B30D0FFAEDD7CD30ABC95D8
11ED47A01B30D0FFAEDD7CD30ABC95D8
11ED47A01B30D0FFAEDD7CD30ABC95D8
11ED47A01B30D0FFAEDD7CD30ABC95D8
11ED47A01B30D0FFAEDD7CD30ABC95D8
11ED47A01B30D0FFAEDD7CD30ABC95D8
11ED47A01B30D0FFAEDD7CD30ABC95D8
11ED47A01B30D0FFAEDD7CD30ABC95D8
11ED47A01B30D0FFAEDD7CD30ABC95D8
11ED47A01B30D0FFAEDD7CD30ABC95D8
11ED47A01B30D0FFAEDD7CD30ABC95D8
11ED47A01B30D0FFAEDD7CD30ABC95D8
11ED47A01B30D0FFAEDD7CD30ABC95D8
11ED47A01B30D0FFAEDD7CD30ABC95D8
11ED47A01B30D0FFAEDD7CD30ABC95D8
11ED47A01B30D0FFAEDD7CD30ABC95D8
11ED47A01B30D0FFAEDD7CD30ABC95D8
11ED47A01B30D0FFAEDD7CD30ABC95D8
11ED47A01B30D0FFAEDD7CD30ABC95D8
11ED47A01B30D0FFAEDD7CD30ABC95D8
11ED47A01B30D0FFAEDD7CD30ABC95D8
11ED47A01B30D0FFAEDD7CD30ABC95D8
11ED47A01B30D0FFAEDD7CD30ABC95D8
11ED47A01B30D0FFAEDD7CD30ABC95D8
11ED47A01B30D0FFAEDD7CD30ABC95D8
11ED47A01B30D0FFAEDD7CD30ABC95D8
11ED47A01B30D0FFAEDD7CD30ABC95D8
11ED47A01B30D0FFAEDD7CD30ABC95D8
11ED47A01B30D0FFAEDD7CD30ABC95D8
11ED47A01B30D0FFAEDD7CD30ABC95D8
11ED47A01B30D0FFAEDD7CD30ABC95D8
11ED47A01B30D0FFAEDD7CD30ABC95D8
11ED47A01B30D0FFAEDD7CD30ABC95D8
11ED47A01B30D0FFAEDD7CD30ABC95D8
11ED47A01B30D0FFAEDD7CD30ABC95D8
11ED47A01B30D0FFAEDD7CD30ABC95D8
11ED47A01B30D0FFAEDD7CD30ABC95D8
11ED47A01B30D0FFAEDD7CD30ABC95D8
11ED47A01B30D0FFAEDD7CD30ABC95D8
11ED47A01B30D0FFAEDD7CD30ABC95D8
11ED47A01B30D0FFAEDD7CD30ABC95D8
11ED47A01B30D0FFAEDD7CD30ABC95D8
11ED47A01B30D0FFAEDD7CD30ABC95D8
11ED47A01B30D0FFAEDD7CD30ABC95D8
11ED47A01B30D0FFAEDD7CD30ABC95D8
11ED47A01B30D0FFAEDD7CD30ABC95D8
11ED47A01B30D0FFAEDD7CD30ABC95D8
11ED47A01B30D0FFAEDD7CD30ABC95D8
11ED47A01B30D0FFAEDD7CD30ABC95D8
11ED47A01B30D0FFAEDD7CD30ABC95D8
11ED47A01B30D0FFAEDD7CD30ABC95D8
11ED47A01B30D0FFAEDD7CD30ABC95D8
11ED47A01B30D0FFAEDD7CD30ABC95D8
11ED47A01B30D0FFAEDD7CD30ABC95D8
11ED47A01B30D0FFAEDD7CD30ABC95D8
11ED47A01B30D0FFAEDD7CD30ABC95D8
11ED47A01B30D0FFAEDD7CD30ABC95D8
11ED47A01B30D0FFAEDD7CD30ABC95D8
11ED47A01B30D0FFAEDD7CD30ABC95D8
11ED47A01B30D0FFAEDD7CD30ABC95D8
11ED47A01B30D0FFAEDD7CD30ABC95D8
11ED47A01B30D0FFAEDD7CD30ABC95D8
11ED47A01B30D0FFAEDD7CD30ABC95D8
11ED47A01B30D0FFAEDD7CD30ABC95D8
11ED47A01B30D0FFAEDD7CD30ABC95D8
11ED47A01B30D0FFAEDD7CD30ABC95D8
11ED47A01B30D0FFAEDD7CD30ABC95D8
11ED47A01B30D0FFAEDD7CD30ABC95D8
11ED47A01B30D0FFAEDD7CD30ABC95D8
11ED47A01B30D0FFAEDD7CD30ABC95D8
11ED47A01B30D0FFAEDD7CD30ABC95D8
11ED47A01B30D0FFAEDD7CD30ABC95D8
11ED47A01B30D0FFAEDD7CD30ABC95D8
11ED47A01B30D0FFAEDD7CD30ABC95D8
11ED47A01B30D0FFAEDD7CD30ABC95D8
11ED47A01B30D0FFAEDD7CD30ABC95D8
11ED47A01B30D0FFAEDD7CD30ABC95D8
11ED47A01B30D0FFAEDD7CD30ABC95D8
11ED47A01B30D0FFAEDD7CD30ABC95D8
11ED47A01B30D0FFAEDD7CD30ABC95D8
11ED47A01B30D0FFAEDD7CD30ABC95D8
11ED47A01B30D0FFAEDD7CD30ABC95D8
11ED47A01B30D0FFAEDD7CD30ABC95D8
11ED47A01B30D0FFAEDD7CD30ABC95D8
11ED47A01B30D0FFAEDD7CD30ABC95D8
11ED47A01B30D0FFAEDD7CD30ABC95D8
11ED47A01B30D0FFAEDD7CD30ABC95D8
11ED47A01B30D0FFAEDD7CD30ABC95D8
11ED47A01B30D0FFAEDD7CD30ABC95D8
11ED47A01B30D0FFAEDD7CD30ABC95D8
11ED47A01B30D0FFAEDD7CD30ABC95D8
11ED47A01B30D0FFAEDD7CD30ABC95D8
11ED47A01B30D0FFAEDD7CD30ABC95D8
11ED47A01B30D0FFAEDD7CD30ABC95D8
11ED47A01B30D0FFAEDD7CD30ABC95D8
11ED47A01B30D0FFAEDD7CD30ABC95D8
11ED47A01B30D0FFAEDD7CD30ABC95D8
11ED47A01B30D0FFAEDD7CD30ABC95D8
11ED47A01B30D0FFAEDD7CD30ABC95D8
11ED47A01B30D0FFAEDD7CD30ABC95D8
11ED47A01B30D0FFAEDD7CD30ABC95D8
11ED47A01B30D0FFAEDD7CD30ABC95D8
11ED47A01B30D0FFAEDD7CD30ABC95D8
11ED47A01B30D0FFAEDD7CD30ABC95D8
11ED47A01B30D0FFAEDD7CD30ABC95D8
11ED47A01B30D0FFAEDD7CD30ABC95D8
11ED47A01B30D0FFAEDD7CD30ABC95D8
11ED47A01B30D0FFAEDD7CD30ABC95D8
11ED47A01B30D0FFAEDD7CD30ABC95D8
11ED47A01B30D0FFAEDD7CD30ABC95D8
11ED47A01B30D0FFAEDD7CD30ABC95D8
11ED47A01B30D0FFAEDD7CD30ABC95D8
11ED47A01B30D0FFAEDD7CD30ABC95D8
11ED47A01B30D0FFAEDD7CD30ABC95D8
11ED47A01B30D0FFAEDD7CD30ABC95D8
11ED47A01B30D0FFAEDD7CD30ABC95D8
11ED47A01B30D0FFAEDD7CD30ABC95D8
11ED47A01B30D0FFAEDD7CD30ABC95D8
11ED47A01B30D0FFAEDD7CD30ABC95D8
11ED47A01B30D0FFAEDD7CD30ABC95D8
11ED47A01B30D0FFAEDD7CD30ABC95D8
11ED47A01B30D0FFAEDD7CD30ABC95D8
11ED47A01B30D0FFAEDD7CD30ABC95D8
11ED47A01B30D0FFAEDD7CD30ABC95D8
11ED47A01B30D0FFAEDD7CD30ABC95D8
11ED47A01B30D0FFAEDD7CD30ABC95D8
11ED47A01B30D0FFAEDD7CD30ABC95D8
11ED47A01B30D0FFAEDD7CD30ABC95D8
11ED47A01B30D0FFAEDD7CD30ABC95D8
11ED47A01B30D0FFAEDD7CD30ABC95D8
11ED47A01B30D0FFAEDD7CD30ABC95D8
11ED47A01B30D0FFAEDD7CD30ABC95D8
11ED47A01B30D0FFAEDD7CD30ABC95D8
11ED47A01B30D0FFAEDD7CD30ABC95D8
11ED47A01B30D0FFAEDD7CD30ABC95D8
11ED47A01B30D0FFAEDD7CD30ABC95D8
11ED47A01B30D0FFAEDD7CD30ABC95D8
11ED47A01B30D0FFAEDD7CD30ABC95D8
11ED47A01B30D0FFAEDD7CD30ABC95D8
11ED47A01B30D0FFAEDD7CD30ABC95D8
11ED47A01B30D0FFAEDD7CD30ABC95D8
11ED47A01B30D0FFAEDD7CD30ABC95D8
11ED47A01B30D0FFAEDD7CD30ABC95D8
11ED47A01B30D0FFAEDD7CD30ABC95D8
11ED47A01B30D0FFAEDD7CD30ABC95D8
11ED47A01B30D0FFAEDD7CD30ABC95D8
11ED47A01B30D0FFAEDD7CD30ABC95D8
11ED47A01B30D0FFAEDD7CD30ABC95D8
11ED47A01B30D0FFAEDD7CD30ABC95D8
11ED47A01B30D0FFAEDD7CD30ABC95D8
11ED47A01B30D0FFAEDD7CD30ABC95D8
11ED47A01B30D0FFAEDD7CD30ABC95D8
11ED47A01B30D0FFAEDD7CD30ABC95D8
11ED47A01B30D0FFAEDD7CD30ABC95D8
11ED47A01B30D0FFAEDD7CD30ABC95D8
11ED47A01B30D0FFAEDD7CD30ABC95D8
11ED47A01B30D0FFAEDD7CD30ABC95D8
11ED47A01B30D0FFAEDD7CD30ABC95D8
11ED47A01B30D0FFAEDD7CD30ABC95D8
11ED47A01B30D0FFAEDD7CD30ABC95D8
11ED47A01B30D0FFAEDD7CD30ABC95D8
11ED47A01B30D0FFAEDD7CD30ABC95D8
11ED47A01B30D0FFAEDD7CD30ABC95D8
11ED47A01B30D0FFAEDD7CD30ABC95D8
11ED47A01B30D0FFAEDD7CD30ABC95D8
11ED47A01B30D0FFAEDD7CD30ABC95D8
11ED47A01B30D0FFAEDD7CD30ABC95D8
11ED47A01B30D0FFAEDD7CD30ABC95D8
11ED47A01B30D0FFAEDD7CD30ABC95D8
11ED47A01B30D0FFAEDD7CD30ABC95D8
11ED47A01B30D0FFAEDD7CD30ABC95D8
11ED47A01B30D0FFAEDD7CD30ABC95D8
11ED47A01B30D0FFAEDD7CD30ABC95D8
11ED47A01B30D0FFAEDD7CD30ABC95D8
11ED47A01B30D0FFAEDD7CD30ABC95D8
11ED47A01B30D0FFAEDD7CD30ABC95D8
11ED47A01B30D0FFAEDD7CD30ABC95D8
11ED47A01B30D0FFAEDD7CD30ABC95D8
11ED47A01B30D0FFAEDD7CD30ABC95D8
11ED47A01B30D0FFAEDD7CD30ABC95D8
11ED47A01B30D0FFAEDD7CD30ABC95D8
11ED47A01B30D0FFAEDD7CD30ABC95D8
11ED47A01B30D0FFAEDD7CD30ABC95D8
11ED47A01B30D0FFAEDD7CD30ABC95D8
11ED47A01B30D0FFAEDD7CD30ABC95D8
11ED47A01B30D0FFAEDD7CD30ABC95D8
11ED47A01B30D0FFAEDD7CD30ABC95D8
11ED47A01B30D0FFAEDD7CD30ABC95D8
11ED47A01B30D0FFAEDD7CD30ABC95D8
11ED47A01B30D0FFAEDD7CD30ABC95D8
11ED47A01B30D0FFAEDD7CD30ABC95D8
11ED47A01B30D0FFAEDD7CD30ABC95D8
11ED47A01B30D0FFAEDD7CD30ABC95D8
11ED47A01B30D0FFAEDD7CD30ABC95D8
11ED47A01B30D0FFAEDD7CD30ABC95D8
11ED47A01B30D0FFAEDD7CD30ABC95D8
11ED47A01B30D0FFAEDD7CD30ABC95D8
11ED47A01B30D0FFAEDD7CD30ABC95D8
11ED47A01B30D0FFAEDD7CD30ABC95D8
11ED47A01B30D0FFAEDD7CD30ABC95D8
11ED47A01B30D0FFAEDD7CD30ABC95D8
11ED47A01B30D0FFAEDD7CD30ABC95D8
11ED47A01B30D0FFAEDD7CD30ABC95D8
11ED47A01B30D0FFAEDD7CD30ABC95D8
11ED47A01B30D0FFAEDD7CD30ABC95D8
11ED47A01B30D0FFAEDD7CD30ABC95D8
11ED47A01B30D0FFAEDD7CD30ABC95D8
11ED47A01B30D0FFAEDD7CD30ABC95D8
11ED47A01B30D0FFAEDD7CD30ABC95D8
11ED47A01B30D0FFAEDD7CD30ABC95D8
11ED47A01B30D0FFAEDD7CD30ABC95D8
11ED47A01B30D0FFAEDD7CD30ABC95D8
11ED47A01B30D0FFAEDD7CD30ABC95D8
11ED47A01B30D0FFAEDD7CD30ABC95D8
11ED47A01B30D0FFAEDD7CD30ABC95D8
11ED47A01B30D0FFAEDD7CD30ABC95D8
11ED47A01B30D0FFAEDD7CD30ABC95D8
11ED47A01B30D0FFAEDD7CD30ABC95D8
11ED47A01B30D0FFAEDD7CD30ABC95D8
11ED47A01B30D0FFAEDD7CD30ABC95D8
11ED47A01B30D0FFAEDD7CD30ABC95D8
11ED47A01B30D0FFAEDD7CD30ABC95D8
11ED47A01B30D0FFAEDD7CD30ABC95D8
11ED47A01B30D0FFAEDD7CD30ABC95D8
11ED47A01B30D0FFAEDD7CD30ABC95D8
11ED47A01B30D0FFAEDD7CD30ABC95D8
11ED47A01B30D0FFAEDD7CD30ABC95D8
11ED47A01B30D0FFAEDD7CD30ABC95D8
11ED47A01B30D0FFAEDD7CD30ABC95D8
11ED47A01B30D0FFAEDD7CD30ABC95D8
11ED47A01B30D0FFAEDD7CD30ABC95D8
11ED47A01B30D0FFAEDD7CD30ABC95D8
11ED47A01B30D0FFAEDD7CD30ABC95D8
11ED47A01B30D0FFAEDD7CD30ABC95D8
11ED47A01B30D0FFAEDD7CD30ABC95D8
11ED47A01B30D0FFAEDD7CD30ABC95D8
11ED47A01B30D0FFAEDD7CD30ABC95D8
11ED47A01B30D0FFAEDD7CD30ABC95D8
11ED47A01B30D0FFAEDD7CD30ABC95D8
11ED47A01B30D0FFAEDD7CD30ABC95D8
11ED47A01B30D0FFAEDD7CD30ABC95D8
11ED47A01B30D0FFAEDD7CD30ABC95D8
11ED47A01B30D0FFAEDD7CD30ABC95D8
11ED47A01B30D0FFAEDD7CD30ABC95D8
11ED47A01B30D0FFAEDD7CD30ABC95D8
11ED47A01B30D0FFAEDD7CD30ABC95D8
11ED47A01B30D0FFAEDD7CD30ABC95D8
11ED47A01B30D0FFAEDD7CD30ABC95D8
11ED47A01B30D0FFAEDD7CD30ABC95D8
11ED47A01B30D0FFAEDD7CD30ABC95D8
11ED47A01B30D0FFAEDD7CD30ABC95D8
11ED47A01B30D0FFAEDD7CD30ABC95D8
11ED47A01B30D0FFAEDD7CD30ABC95D8
11ED47A01B30D0FFAEDD7CD30ABC95D8
11ED47A01B30D0FFAEDD7CD30ABC95D8
11ED47A01B30D0FFAEDD7CD30ABC95D8
11ED47A01B30D0FFAEDD7CD30ABC95D8
11ED47A01B30D0FFAEDD7CD30ABC95D8
11ED47A01B30D0FFAEDD7CD30ABC95D8
11ED47A01B30D0FFAEDD7CD30ABC95D8
11ED47A01B30D0FFAEDD7CD30ABC95D8
11ED47A01B30D0FFAEDD7CD30ABC95D8
11ED47A01B30D0FFAEDD7CD30ABC95D8
11ED47A01B30D0FFAEDD7CD30ABC95D8
11ED47A01B30D0FFAEDD7CD30ABC95D8
11ED47A01B30D0FFAEDD7CD30ABC95D8
11ED47A01B30D0FFAEDD7CD30ABC95D8
11ED47A01B30D0FFAEDD7CD30ABC95D8
11ED47A01B30D0FFAEDD7CD30ABC95D8
11ED47A01B30D0FFAEDD7CD30ABC95D8
11ED47A01B30D0FFAEDD7CD30ABC95D8
11ED47A01B30D0FFAEDD7CD30ABC95D8
11ED47A01B30D0FFAEDD7CD30ABC95D8
11ED47A01B30D0FFAEDD7CD30ABC95D8
11ED47A01B30D0FFAEDD7CD30ABC95D8
11ED47A01B30D0FFAEDD7CD30ABC95D8
11ED47A01B30D0FFAEDD7CD30ABC95D8
11ED47A01B30D0FFAEDD7CD30ABC95D8
11ED47A01B30D0FFAEDD7CD30ABC95D8
11ED47A01B30D0FFAEDD7CD30ABC95D8
11ED47A01B30D0FFAEDD7CD30ABC95D8
11ED47A01B30D0FFAEDD7CD30ABC95D8
11ED47A01B30D0FFAEDD7CD30ABC95D8
11ED47A01B30D0FFAEDD7CD30ABC95D8
11ED47A01B30D0FFAEDD7CD30ABC95D8
11ED47A01B30D0FFAEDD7CD30ABC95D8
11ED47A01B30D0FFAEDD7CD30ABC95D8
11ED47A01B30D0FFAEDD7CD30ABC95D8
11ED47A01B30D0FFAEDD7CD30ABC95D8
11ED47A01B30D0FFAEDD7CD30ABC95D8
11ED47A01B30D0FFAEDD7CD30ABC95D8
11ED47A01B30D0FFAEDD7CD30ABC95D8
11ED47A01B30D0FFAEDD7CD30ABC95D8
11ED47A01B30D0FFAEDD7CD30ABC95D8
11ED47A01B30D0FFAEDD7CD30ABC95D8
11ED47A01B30D0FFAEDD7CD30ABC95D8
11ED47A01B30D0FFAEDD7CD30ABC95D8
11ED47A01B30D0FFAEDD7CD30ABC95D8
11ED47A01B30D0FFAEDD7CD30ABC95D8
11ED47A01B30D0FFAEDD7CD30ABC95D8
11ED47A01B30D0FFAEDD7CD30ABC95D8
11ED47A01B30D0FFAEDD7CD30ABC95D8
11ED47A01B30D0FFAEDD7CD30ABC95D8
11ED47A01B30D0FFAEDD7CD30ABC95D8
11ED47A01B30D0FFAEDD7CD30ABC95D8
11ED47A01B30D0FFAEDD7CD30ABC95D8
11ED47A01B30D0FFAEDD7CD30ABC95D8
11ED47A01B30D0FFAEDD7CD30ABC95D8
11ED47A01B30D0FFAEDD7CD30ABC95D8
11ED47A01B30D0FFAEDD7CD30ABC95D8
11ED47A01B30D0FFAEDD7CD30ABC95D8
11ED47A01B30D0FFAEDD7CD30ABC95D8
11ED47A01B30D0FFAEDD7CD30ABC95D8
11ED47A01B30D0FFAEDD7CD30ABC95D8
11ED47A01B30D0FFAEDD7CD30ABC95D8
11ED47A01B30D0FFAEDD7CD30ABC95D8
11ED47A01B30D0FFAEDD7CD30ABC95D8
11ED47A01B30D0FFAEDD7CD30ABC95D8
11ED47A01B30D0FFAEDD7CD30ABC95D8
11ED47A01B30D0FFAEDD7CD30ABC95D8
11ED47A01B30D0FFAEDD7CD30ABC95D8
11ED47A01B30D0FFAEDD7CD30ABC95D8
11ED47A01B30D0FFAEDD7CD30ABC95D8
11ED47A01B30D0FFAEDD7CD30ABC95D8
11ED47A01B30D0FFAEDD7CD30ABC95D8
11ED47A01B30D0FFAEDD7CD30ABC95D8
11ED47A01B30D0FFAEDD7CD30ABC95D8
11ED47A01B30D0FFAEDD7CD30ABC95D8
11ED47A01B30D0FFAEDD7CD30ABC95D8
11ED47A01B30D0FFAEDD7CD30ABC95D8
11ED47A01B30D0FFAEDD7CD30ABC95D8
11ED47A01B30D0FFAEDD7CD30ABC95D8
11ED47A01B30D0FFAEDD7CD30ABC95D8
11ED47A01B30D0FFAEDD7CD30ABC95D8
11ED47A01B30D0FFAEDD7CD30ABC95D8
11ED47A01B30D0FFAEDD7CD30ABC95D8
11ED47A01B30D0FFAEDD7CD30ABC95D8
11ED47A01B30D0FFAEDD7CD30ABC95D8
11ED47A01B30D0FFAEDD7CD30ABC95D8
11ED47A01B30D0FFAEDD7CD30ABC95D8
11ED47A01B30D0FFAEDD7CD30ABC95D8
11ED47A01B30D0FFAEDD7CD30ABC95D8
11ED47A01B30D0FFAEDD7CD30ABC95D8
11ED47A01B30D0FFAEDD7CD30ABC95D8
11ED47A01B30D0FFAEDD7CD30ABC95D8
11ED47A01B30D0FFAEDD7CD30ABC95D8
11ED47A01B30D0FFAEDD7CD30ABC95D8
11ED47A01B30D0FFAEDD7CD30ABC95D8
11ED47A01B30D0FFAEDD7CD30ABC95D8
11ED47A01B30D0FFAEDD7CD30ABC95D8
11ED47A01B30D0FFAEDD7CD30ABC95D8
11ED47A01B30D0FFAEDD7CD30ABC95D8
11ED47A01B30D0FFAEDD7CD30ABC95D8
11ED47A01B30D0FFAEDD7CD30ABC95D8
11ED47A01B30D0FFAEDD7CD30ABC95D8
11ED47A01B30D0FFAEDD7CD30ABC95D8
11ED47A01B30D0FFAEDD7CD30ABC95D8
11ED47A01B30D0FFAEDD7CD30ABC95D8
11ED47A01B30D0FFAEDD7CD30ABC95D8
11ED47A01B30D0FFAEDD7CD30ABC95D8
11ED47A01B30D0FFAEDD7CD30ABC95D8
11ED47A01B30D0FFAEDD7CD30ABC95D8
11ED47A01B30D0FFAEDD7CD30ABC95D8
11ED47A01B30D0FFAEDD7CD30ABC95D8
11ED47A01B30D0FFAEDD7CD30ABC95D8
11ED47A01B30D0FFAEDD7CD30ABC95D8
11ED47A01B30D0FFAEDD7CD30ABC95D8
11ED47A01B30D0FFAEDD7CD30ABC95D8
11ED47A01B30D0FFAEDD7CD30ABC95D8
11ED47A01B30D0FFAEDD7CD30ABC95D8
11ED47A01B30D0FFAEDD7CD30ABC95D8
11ED47A01B30D0FFAEDD7CD30ABC95D8
11ED47A01B30D0FFAEDD7CD30ABC95D8
11ED47A01B30D0FFAEDD7CD30ABC95D8
11ED47A01B30D0FFAEDD7CD30ABC95D8
11ED47A01B30D0FFAEDD7CD30ABC95D8
11ED47A01B30D0FFAEDD7CD30ABC95D8
11ED47A01B30D0FFAEDD7CD30ABC95D8
11ED47A01B30D0FFAEDD7CD30ABC95D8
11ED47A01B30D0FFAEDD7CD30ABC95D8
11ED47A01B30D0FFAEDD7CD30ABC95D8
11ED47A01B30D0FFAEDD7CD30ABC95D8
11ED47A01B30D0FFAEDD7CD30ABC95D8
11ED47A01B30D0FFAEDD7CD30ABC95D8
11ED47A01B30D0FFAEDD7CD30ABC95D8
11ED47A01B30D0FFAEDD7CD30ABC95D8
11ED47A01B30D0FFAEDD7CD30ABC95D8
11ED47A01B30D0FFAEDD7CD30ABC95D8
11ED47A01B30D0FFAEDD7CD30ABC95D8
11ED47A01B30D0FFAEDD7CD30ABC95D8
11ED47A01B30D0FFAEDD7CD30ABC95D8
11ED47A01B30D0FFAEDD7CD30ABC95D8
11ED47A01B30D0FFAEDD7CD30ABC95D8
11ED47A01B30D0FFAEDD7CD30ABC95D8
11ED47A01B30D0FFAEDD7CD30ABC95D8
11ED47A01B30D0FFAEDD7CD30ABC95D8
11ED47A01B30D0FFAEDD7CD30ABC95D8
11ED47A01B30D0FFAEDD7CD30ABC95D8
11ED47A01B30D0FFAEDD7CD30ABC95D8
11ED47A01B30D0FFAEDD7CD30ABC95D8
11ED47A01B30D0FFAEDD7CD30ABC95D8
11ED47A01B30D0FFAEDD7CD30ABC95D8
11ED47A01B30D0FFAEDD7CD30ABC95D8
11ED47A01B30D0FFAEDD7CD30ABC95D8
11ED47A01B30D0FFAEDD7CD30ABC95D8
11ED47A01B30D0FFAEDD7CD30ABC95D8
11ED47A01B30D0FFAEDD7CD30ABC95D8
11ED47A01B30D0FFAEDD7CD30ABC95D8
11ED47A01B30D0FFAEDD7CD30ABC95D8
11ED47A01B30D0FFAEDD7CD30ABC95D8
11ED47A01B30D0FFAEDD7CD30ABC95D8
11ED47A01B30D0FFAEDD7CD30ABC95D8
11ED47A01B30D0FFAEDD7CD30ABC95D8
11ED47A01B30D0FFAEDD7CD30ABC95D8
11ED47A01B30D0FFAEDD7CD30ABC95D8
11ED47A01B30D0FFAEDD7CD30ABC95D8
11ED47A01B30D0FFAEDD7CD30ABC95D8
11ED47A01B30D0FFAEDD7CD30ABC95D8
11ED47A01B30D0FFAEDD7CD30ABC95D8
11ED47A01B30D0FFAEDD7CD30ABC95D8
11ED47A01B30D0FFAEDD7CD30ABC95D8
11ED47A01B30D0FFAEDD7CD30ABC95D8
11ED47A01B30D0FFAEDD7CD30ABC95D8
11ED47A01B30D0FFAEDD7CD30ABC95D8
11ED47A01B30D0FFAEDD7CD30ABC95D8
11ED47A01B30D0FFAEDD7CD30ABC95D8
11ED47A01B30D0FFAEDD7CD30ABC95D8
11ED47A01B30D0FFAEDD7CD30ABC95D8
11ED47A01B30D0FFAEDD7CD30ABC95D8
11ED47A01B30D0FFAEDD7CD30ABC95D8
11ED47A01B30D0FFAEDD7CD30ABC95D8
11ED47A01B30D0FFAEDD7CD30ABC95D8
11ED47A01B30D0FFAEDD7CD30ABC95D8
11ED47A01B30D0FFAEDD7CD30ABC95D8
11ED47A01B30D0FFAEDD7CD30ABC95D8
11ED47A01B30D0FFAEDD7CD30ABC95D8
11ED47A01B30D0FFAEDD7CD30ABC95D8
11ED47A01B30D0FFAEDD7CD30ABC95D8
11ED47A01B30D0FFAEDD7CD30ABC95D8
11ED47A01B30D0FFAEDD7CD30ABC95D8
11ED47A01B30D0FFAEDD7CD30ABC95D8
11ED47A01B30D0FFAEDD7CD30ABC95D8
11ED47A01B30D0FFAEDD7CD30ABC95D8
11ED47A01B30D0FFAEDD7CD30ABC95D8
11ED47A01B30D0FFAEDD7CD30ABC95D8
11ED47A01B30D0FFAEDD7CD30ABC95D8
11ED47A01B30D0FFAEDD7CD30ABC95D8
11ED47A01B30D0FFAEDD7CD30ABC95D8
11ED47A01B30D0FFAEDD7CD30ABC95D8
11ED47A01B30D0FFAEDD7CD30ABC95D8
11ED47A01B30D0FFAEDD7CD30ABC95D8
11ED47A01B30D0FFAEDD7CD30ABC95D8
11ED47A01B30D0FFAEDD7CD30ABC95D8
11ED47A01B30D0FFAEDD7CD30ABC95D8
11ED47A01B30D0FFAEDD7CD30ABC95D8
11ED47A01B30D0FFAEDD7CD30ABC95D8
11ED47A01B30D0FFAEDD7CD30ABC95D8
11ED47A01B30D0FFAEDD7CD30ABC95D8
11ED47A01B30D0FFAEDD7CD30ABC95D8
11ED47A01B30D0FFAEDD7CD30ABC95D8
11ED47A01B30D0FFAEDD7CD30ABC95D8
11ED47A01B30D0FFAEDD7CD30ABC95D8
11ED47A01B30D0FFAEDD7CD30ABC95D8
11ED47A01B30D0FFAEDD7CD30ABC95D8
11ED47A01B30D0FFAEDD7CD30ABC95D8
11ED47A01B30D0FFAEDD7CD30ABC95D8
11ED47A01B30D0FFAEDD7CD30ABC95D8
11ED47A01B30D0FFAEDD7CD30ABC95D8
11ED47A01B30D0FFAEDD7CD30ABC95D8
11ED47A01B30D0FFAEDD7CD30ABC95D8
11ED47A01B30D0FFAEDD7CD30ABC95D8
11ED47A01B30D0FFAEDD7CD30ABC95D8
11ED47A01B30D0FFAEDD7CD30ABC95D8
11ED47A01B30D0FFAEDD7CD30ABC95D8
11ED47A01B30D0FFAEDD7CD30ABC95D8
11ED47A01B30D0FFAEDD7CD30ABC95D8
11ED47A01B30D0FFAEDD7CD30ABC95D8
11ED47A01B30D0FFAEDD7CD30ABC95D8
11ED47A01B30D0FFAEDD7CD30ABC95D8
11ED47A01B30D0FFAEDD7CD30ABC95D8
11ED47A01B30D0FFAEDD7CD30ABC95D8
11ED47A01B30D0FFAEDD7CD30ABC95D8
11ED47A01B30D0FFAEDD7CD30ABC95D8
11ED47A01B30D0FFAEDD7CD30ABC95D8
11ED47A01B30D0FFAEDD7CD30ABC95D8
11ED47A01B30D0FFAEDD7CD30ABC95D8
11ED47A01B30D0FFAEDD7CD30ABC95D8
11ED47A01B30D0FFAEDD7CD30ABC95D8
11ED47A01B30D0FFAEDD7CD30ABC95D8
11ED47A01B30D0FFAEDD7CD30ABC95D8
11ED47A01B30D0FFAEDD7CD30ABC95D8
11ED47A01B30D0FFAEDD7CD30ABC95D8
11ED47A01B30D0FFAEDD7CD30ABC95D8
11ED47A01B30D0FFAEDD7CD30ABC95D8
11ED47A01B30D0FFAEDD7CD30ABC95D8
11ED47A01B30D0FFAEDD7CD30ABC95D8
11ED47A01B30D0FFAEDD7CD30ABC95D8
11ED47A01B30D0FFAEDD7CD30ABC95D8
11ED47A01B30D0FFAEDD7CD30ABC95D8
11ED47A01B30D0FFAEDD7CD30ABC95D8
11ED47A01B30D0FFAEDD7CD30ABC95D8
11ED47A01B30D0FFAEDD7CD30ABC95D8
11ED47A01B30D0FFAEDD7CD30ABC95D8
11ED47A01B30D0FFAEDD7CD30ABC95D8
11ED47A01B30D0FFAEDD7CD30ABC95D8
11ED47A01B30D0FFAEDD7CD30ABC95D8
11ED47A01B30D0FFAEDD7CD30ABC95D8
11ED47A01B30D0FFAEDD7CD30ABC95D8
11ED47A01B30D0FFAEDD7CD30ABC95D8
11ED47A01B30D0FFAEDD7CD30ABC95D8
11ED47A01B30D0FFAEDD7CD30ABC95D8
11ED47A01B30D0FFAEDD7CD30ABC95D8
11ED47A01B30D0FFAEDD7CD30ABC95D8
11ED47A01B30D0FFAEDD7CD30ABC95D8
11ED47A01B30D0FFAEDD7CD30ABC95D8
11ED47A01B30D0FFAEDD7CD30ABC95D8
11ED47A01B30D0FFAEDD7CD30ABC95D8
11ED47A01B30D0FFAEDD7CD30ABC95D8
11ED47A01B30D0FFAEDD7CD30ABC95D8
11ED47A01B30D0FFAEDD7CD30ABC95D8
11ED47A01B30D0FFAEDD7CD30ABC95D8
11ED47A01B30D0FFAEDD7CD30ABC95D8
11ED47A01B30D0FFAEDD7CD30ABC95D8
11ED47A01B30D0FFAEDD7CD30ABC95D8
11ED47A01B30D0FFAEDD7CD30ABC95D8
11ED47A01B30D0FFAEDD7CD30ABC95D8
11ED47A01B30D0FFAEDD7CD30ABC95D8
11ED47A01B30D0FFAEDD7CD30ABC95D8
11ED47A01B30D0FFAEDD7CD30ABC95D8
11ED47A01B30D0FFAEDD7CD30ABC95D8
11ED47A01B30D0FFAEDD7CD30ABC95D8
11ED47A01B30D0FFAEDD7CD30ABC95D8
11ED47A01B30D0FFAEDD7CD30ABC95D8
11ED47A01B30D0FFAEDD7CD30ABC95D8
11ED47A01B30D0FFAEDD7CD30ABC95D8
11ED47A01B30D0FFAEDD7CD30ABC95D8
11ED47A01B30D0FFAEDD7CD30ABC95D8
11ED47A01B30D0FFAEDD7CD30ABC95D8
11ED47A01B30D0FFAEDD7CD30ABC95D8
11ED47A01B30D0FFAEDD7CD30ABC95D8
11ED47A01B30D0FFAEDD7CD30ABC95D8
11ED47A01B30D0FFAEDD7CD30ABC95D8
11ED47A01B30D0FFAEDD7CD30ABC95D8
11ED47A01B30D0FFAEDD7CD30ABC95D8
11ED47A01B30D0FFAEDD7CD30ABC95D8
11ED47A01B30D0FFAEDD7CD30ABC95D8
11ED47A01B30D0FFAEDD7CD30ABC95D8
11ED47A01B30D0FFAEDD7CD30ABC95D8
11ED47A01B30D0FFAEDD7CD30ABC95D8
11ED47A01B30D0FFAEDD7CD30ABC95D8
11ED47A01B30D0FFAEDD7CD30ABC95D8
11ED47A01B30D0FFAEDD7CD30ABC95D8
11ED47A01B30D0FFAEDD7CD30ABC95D8
11ED47A01B30D0FFAEDD7CD30ABC95D8
11ED47A01B30D0FFAEDD7CD30ABC95D8
11ED47A01B30D0FFAEDD7CD30ABC95D8
11ED47A01B30D0FFAEDD7CD30ABC95D8
11ED47A01B30D0FFAEDD7CD30ABC95D8
11ED47A01B30D0FFAEDD7CD30ABC95D8
11ED47A01B30D0FFAEDD7CD30ABC95D8
11ED47A01B30D0FFAEDD7CD30ABC95D8
11ED47A01B30D0FFAEDD7CD30ABC95D8
11ED47A01B30D0FFAEDD7CD30ABC95D8
11ED47A01B30D0FFAEDD7CD30ABC95D8
11ED47A01B30D0FFAEDD7CD30ABC95D8
11ED47A01B30D0FFAEDD7CD30ABC95D8
11ED47A01B30D0FFAEDD7CD30ABC95D8
11ED47A01B30D0FFAEDD7CD30ABC95D8
11ED47A01B30D0FFAEDD7CD30ABC95D8
11ED47A01B30D0FFAEDD7CD30ABC95D8
11ED47A01B30D0FFAEDD7CD30ABC95D8
11ED47A01B30D0FFAEDD7CD30ABC95D8
11ED47A01B30D0FFAEDD7CD30ABC95D8
11ED47A01B30D0FFAEDD7CD30ABC95D8
11ED47A01B30D0FFAEDD7CD30ABC95D8
11ED47A01B30D0FFAEDD7CD30ABC95D8
11ED47A01B30D0FFAEDD7CD30ABC95D8
11ED47A01B30D0FFAEDD7CD30ABC95D8
11ED47A01B30D0FFAEDD7CD30ABC95D8
11ED47A01B30D0FFAEDD7CD30ABC95D8
11ED47A01B30D0FFAEDD7CD30ABC95D8
11ED47A01B30D0FFAEDD7CD30ABC95D8
11ED47A01B30D0FFAEDD7CD30ABC95D8
11ED47A01B30D0FFAEDD7CD30ABC95D8
11ED47A01B30D0FFAEDD7CD30ABC95D8
11ED47A01B30D0FFAEDD7CD30ABC95D8
11ED47A01B30D0FFAEDD7CD30ABC95D8
11ED47A01B30D0FFAEDD7CD30ABC95D8
11ED47A01B30D0FFAEDD7CD30ABC95D8
11ED47A01B30D0FFAEDD7CD30ABC95D8
11ED47A01B30D0FFAEDD7CD30ABC95D8
11ED47A01B30D0FFAEDD7CD30ABC95D8
11ED47A01B30D0FFAEDD7CD30ABC95D8
11ED47A01B30D0FFAEDD7CD30ABC95D8
11ED47A01B30D0FFAEDD7CD30ABC95D8
11ED47A01B30D0FFAEDD7CD30ABC95D8
11ED47A01B30D0FFAEDD7CD30ABC95D8
11ED47A01B30D0FFAEDD7CD30ABC95D8
11ED47A01B30D0FFAEDD7CD30ABC95D8
11ED47A01B30D0FFAEDD7CD30ABC95D8
11ED47A01B30D0FFAEDD7CD30ABC95D8
11ED47A01B30D0FFAEDD7CD30ABC95D8
11ED47A01B30D0FFAEDD7CD30ABC95D8
11ED47A01B30D0FFAEDD7CD30ABC95D8
11ED47A01B30D0FFAEDD7CD30ABC95D8
11ED47A01B30D0FFAEDD7CD30ABC95D8
11ED47A01B30D0FFAEDD7CD30ABC95D8
11ED47A01B30D0FFAEDD7CD30ABC95D8
11ED47A01B30D0FFAEDD7CD30ABC95D8
11ED47A01B30D0FFAEDD7CD30ABC95D8
11ED47A01B30D0FFAEDD7CD30ABC95D8
11ED47A01B30D0FFAEDD7CD30ABC95D8
11ED47A01B30D0FFAEDD7CD30ABC95D8
11ED47A01B30D0FFAEDD7CD30ABC95D8
11ED47A01B30D0FFAEDD7CD30ABC95D8
11ED47A01B30D0FFAEDD7CD30ABC95D8
11ED47A01B30D0FFAEDD7CD30ABC95D8
11ED47A01B30D0FFAEDD7CD30ABC95D8
11ED47A01B30D0FFAEDD7CD30ABC95D8
11ED47A01B30D0FFAEDD7CD30ABC95D8
11ED47A01B30D0FFAEDD7CD30ABC95D8
11ED47A01B30D0FFAEDD7CD30ABC95D8
11ED47A01B30D0FFAEDD7CD30ABC95D8
11ED47A01B30D0FFAEDD7CD30ABC95D8
11ED47A01B30D0FFAEDD7CD30ABC95D8
11ED47A01B30D0FFAEDD7CD30ABC95D8
11ED47A01B30D0FFAEDD7CD30ABC95D8
11ED47A01B30D0FFAEDD7CD30ABC95D8
11ED47A01B30D0FFAEDD7CD30ABC95D8
11ED47A01B30D0FFAEDD7CD30ABC95D8
11ED47A01B30D0FFAEDD7CD30ABC95D8
11ED47A01B30D0FFAEDD7CD30ABC95D8
11ED47A01B30D0FFAEDD7CD30ABC95D8
11ED47A01B30D0FFAEDD7CD30ABC95D8
11ED47A01B30D0FFAEDD7CD30ABC95D8
11ED47A01B30D0FFAEDD7CD30ABC95D8
11ED47A01B30D0FFAEDD7CD30ABC95D8
11ED47A01B30D0FFAEDD7CD30ABC95D8
11ED47A01B30D0FFAEDD7CD30ABC95D8
11ED47A01B30D0FFAEDD7CD30ABC95D8
11ED47A01B30D0FFAEDD7CD30ABC95D8
11ED47A01B30D0FFAEDD7CD30ABC95D8
11ED47A01B30D0FFAEDD7CD30ABC95D8
11ED47A01B30D0FFAEDD7CD30ABC95D8
11ED47A01B30D0FFAEDD7CD30ABC95D8
11ED47A01B30D0FFAEDD7CD30ABC95D8
11ED47A01B30D0FFAEDD7CD30ABC95D8
11ED47A01B30D0FFAEDD7CD30ABC95D8
11ED47A01B30D0FFAEDD7CD30ABC95D8
11ED47A01B30D0FFAEDD7CD30ABC95D8
11ED47A01B30D0FFAEDD7CD30ABC95D8
11ED47A01B30D0FFAEDD7CD30ABC95D8
11ED47A01B30D0FFAEDD7CD30ABC95D8
11ED47A01B30D0FFAEDD7CD30ABC95D8
11ED47A01B30D0FFAEDD7CD30ABC95D8
11ED47A01B30D0FFAEDD7CD30ABC95D8
11ED47A01B30D0FFAEDD7CD30ABC95D8
11ED47A01B30D0FFAEDD7CD30ABC95D8
11ED47A01B30D0FFAEDD7CD30ABC95D8
11ED47A01B30D0FFAEDD7CD30ABC95D8
11ED47A01B30D0FFAEDD7CD30ABC95D8
11ED47A01B30D0FFAEDD7CD30ABC95D8
11ED47A01B30D0FFAEDD7CD30ABC95D8
11ED47A01B30D0FFAEDD7CD30ABC95D8
11ED47A01B30D0FFAEDD7CD30ABC95D8
11ED47A01B30D0FFAEDD7CD30ABC95D8
11ED47A01B30D0FFAEDD7CD30ABC95D8
11ED47A01B30D0FFAEDD7CD30ABC95D8
11ED47A01B30D0FFAEDD7CD30ABC95D8
11ED47A01B30D0FFAEDD7CD30ABC95D8
11ED47A01B30D0FFAEDD7CD30ABC95D8
11ED47A01B30D0FFAEDD7CD30ABC95D8
11ED47A01B30D0FFAEDD7CD30ABC95D8
11ED47A01B30D0FFAEDD7CD30ABC95D8
11ED47A01B30D0FFAEDD7CD30ABC95D8
11ED47A01B30D0FFAEDD7CD30ABC95D8
11ED47A01B30D0FFAEDD7CD30ABC95D8
11ED47A01B30D0FFAEDD7CD30ABC95D8
11ED47A01B30D0FFAEDD7CD30ABC95D8
11ED47A01B30D0FFAEDD7CD30ABC95D8
11ED47A01B30D0FFAEDD7CD30ABC95D8
11ED47A01B30D0FFAEDD7CD30ABC95D8
11ED47A01B30D0FFAEDD7CD30ABC95D8
11ED47A01B30D0FFAEDD7CD30ABC95D8
11ED47A01B30D0FFAEDD7CD30ABC95D8
11ED47A01B30D0FFAEDD7CD30ABC95D8
11ED47A01B30D0FFAEDD7CD30ABC95D8
11ED47A01B30D0FFAEDD7CD30ABC95D8
11ED47A01B30D0FFAEDD7CD30ABC95D8
11ED47A01B30D0FFAEDD7CD30ABC95D8
11ED47A01B30D0FFAEDD7CD30ABC95D8
11ED47A01B30D0FFAEDD7CD30ABC95D8
11ED47A01B30D0FFAEDD7CD30ABC95D8
11ED47A01B30D0FFAEDD7CD30ABC95D8
11ED47A01B30D0FFAEDD7CD30ABC95D8
11ED47A01B30D0FFAEDD7CD30ABC95D8
11ED47A01B30D0FFAEDD7CD30ABC95D8
11ED47A01B30D0FFAEDD7CD30ABC95D8
11ED47A01B30D0FFAEDD7CD30ABC95D8
11ED47A01B30D0FFAEDD7CD30ABC95D8
11ED47A01B30D0FFAEDD7CD30ABC95D8
11ED47A01B30D0FFAEDD7CD30ABC95D8
11ED47A01B30D0FFAEDD7CD30ABC95D8
11ED47A01B30D0FFAEDD7CD30ABC95D8
11ED47A01B30D0FFAEDD7CD30ABC95D8
11ED47A01B30D0FFAEDD7CD30ABC95D8
11ED47A01B30D0FFAEDD7CD30ABC95D8
11ED47A01B30D0FFAEDD7CD30ABC95D8
11ED47A01B30D0FFAEDD7CD30ABC95D8
11ED47A01B30D0FFAEDD7CD30ABC95D8
11ED47A01B30D0FFAEDD7CD30ABC95D8
11ED47A01B30D0FFAEDD7CD30ABC95D8
11ED47A01B30D0FFAEDD7CD30ABC95D8
11ED47A01B30D0FFAEDD7CD30ABC95D8
11ED47A01B30D0FFAEDD7CD30ABC95D8
11ED47A01B30D0FFAEDD7CD30ABC95D8
11ED47A01B30D0FFAEDD7CD30ABC95D8
11ED47A01B30D0FFAEDD7CD30ABC95D8
11ED47A01B30D0FFAEDD7CD30ABC95D8
11ED47A01B30D0FFAEDD7CD30ABC95D8
11ED47A01B30D0FFAEDD7CD30ABC95D8
11ED47A01B30D0FFAEDD7CD30ABC95D8
11ED47A01B30D0FFAEDD7CD30ABC95D8
11ED47A01B30D0FFAEDD7CD30ABC95D8
11ED47A01B30D0FFAEDD7CD30ABC95D8
11ED47A01B30D0FFAEDD7CD30ABC95D8
11ED47A01B30D0FFAEDD7CD30ABC95D8
11ED47A01B30D0FFAEDD7CD30ABC95D8
11ED47A01B30D0FFAEDD7CD30ABC95D8
11ED47A01B30D0FFAEDD7CD30ABC95D8
11ED47A01B30D0FFAEDD7CD30ABC95D8
11ED47A01B30D0FFAEDD7CD30ABC95D8
11ED47A01B30D0FFAEDD7CD30ABC95D8
11ED47A01B30D0FFAEDD7CD30ABC95D8
11ED47A01B30D0FFAEDD7CD30ABC95D8
11ED47A01B30D0FFAEDD7CD30ABC95D8
11ED47A01B30D0FFAEDD7CD30ABC95D8
11ED47A01B30D0FFAEDD7CD30ABC95D8
11ED47A01B30D0FFAEDD7CD30ABC95D8
11ED47A01B30D0FFAEDD7CD30ABC95D8
11ED47A01B30D0FFAEDD7CD30ABC95D8
11ED47A01B30D0FFAEDD7CD30ABC95D8
11ED47A01B30D0FFAEDD7CD30ABC95D8
11ED47A01B30D0FFAEDD7CD30ABC95D8
11ED47A01B30D0FFAEDD7CD30ABC95D8
11ED47A01B30D0FFAEDD7CD30ABC95D8
11ED47A01B30D0FFAEDD7CD30ABC95D8
11ED47A01B30D0FFAEDD7CD30ABC95D8
11ED47A01B30D0FFAEDD7CD30ABC95D8
11ED47A01B30D0FFAEDD7CD30ABC95D8
11ED47A01B30D0FFAEDD7CD30ABC95D8
11ED47A01B30D0FFAEDD7CD30ABC95D8
11ED47A01B30D0FFAEDD7CD30ABC95D8
11ED47A01B30D0FFAEDD7CD30ABC95D8
11ED47A01B30D0FFAEDD7CD30ABC95D8
11ED47A01B30D0FFAEDD7CD30ABC95D8
11ED47A01B30D0FFAEDD7CD30ABC95D8
11ED47A01B30D0FFAEDD7CD30ABC95D8
11ED47A01B30D0FFAEDD7CD30ABC95D8
11ED47A01B30D0FFAEDD7CD30ABC95D8
11ED47A01B30D0FFAEDD7CD30ABC95D8
11ED47A01B30D0FFAEDD7CD30ABC95D8
11ED47A01B30D0FFAEDD7CD30ABC95D8
11ED47A01B30D0FFAEDD7CD30ABC95D8
11ED47A01B30D0FFAEDD7CD30ABC95D8
11ED47A01B30D0FFAEDD7CD30ABC95D8
11ED47A01B30D0FFAEDD7CD30ABC95D8
11ED47A01B30D0FFAEDD7CD30ABC95D8
11ED47A01B30D0FFAEDD7CD30ABC95D8
11ED47A01B30D0FFAEDD7CD30ABC95D8
11ED47A01B30D0FFAEDD7CD30ABC95D8
11ED47A01B30D0FFAEDD7CD30ABC95D8
11ED47A01B30D0FFAEDD7CD30ABC95D8
11ED47A01B30D0FFAEDD7CD30ABC95D8
11ED47A01B30D0FFAEDD7CD30ABC95D8
11ED47A01B30D0FFAEDD7CD30ABC95D8
11ED47A01B30D0FFAEDD7CD30ABC95D8
11ED47A01B30D0FFAEDD7CD30ABC95D8
11ED47A01B30D0FFAEDD7CD30ABC95D8
11ED47A01B30D0FFAEDD7CD30ABC95D8
11ED47A01B30D0FFAEDD7CD30ABC95D8
11ED47A01B30D0FFAEDD7CD30ABC95D8
11ED47A01B30D0FFAEDD7CD30ABC95D8
11ED47A01B30D0FFAEDD7CD30ABC95D8
11ED47A01B30D0FFAEDD7CD30ABC95D8
11ED47A01B30D0FFAEDD7CD30ABC95D8
11ED47A01B30D0FFAEDD7CD30ABC95D8
11ED47A01B30D0FFAEDD7CD30ABC95D8
11ED47A01B30D0FFAEDD7CD30ABC95D8
11ED47A01B30D0FFAEDD7CD30ABC95D8
11ED47A01B30D0FFAEDD7CD30ABC95D8
11ED47A01B30D0FFAEDD7CD30ABC95D8
11ED47A01B30D0FFAEDD7CD30ABC95D8
11ED47A01B30D0FFAEDD7CD30ABC95D8
11ED47A01B30D0FFAEDD7CD30ABC95D8
11ED47A01B30D0FFAEDD7CD30ABC95D8
11ED47A01B30D0FFAEDD7CD30ABC95D8
11ED47A01B30D0FFAEDD7CD30ABC95D8
11ED47A01B30D0FFAEDD7CD30ABC95D8
11ED47A01B30D0FFAEDD7CD30ABC95D8
11ED47A01B30D0FFAEDD7CD30ABC95D8
11ED47A01B30D0FFAEDD7CD30ABC95D8
11ED47A01B30D0FFAEDD7CD30ABC95D8
11ED47A01B30D0FFAEDD7CD30ABC95D8
11ED47A01B30D0FFAEDD7CD30ABC95D8
11ED47A01B30D0FFAEDD7CD30ABC95D8
11ED47A01B30D0FFAEDD7CD30ABC95D8
11ED47A01B30D0FFAEDD7CD30ABC95D8
11ED47A01B30D0FFAEDD7CD30ABC95D8
11ED47A01B30D0FFAEDD7CD30ABC95D8
11ED47A01B30D0FFAEDD7CD30ABC95D8
11ED47A01B30D0FFAEDD7CD30ABC95D8
11ED47A01B30D0FFAEDD7CD30ABC95D8
11ED47A01B30D0FFAEDD7CD30ABC95D8
11ED47A01B30D0FFAEDD7CD30ABC95D8
11ED47A01B30D0FFAEDD7CD30ABC95D8
11ED47A01B30D0FFAEDD7CD30ABC95D8
11ED47A01B30D0FFAEDD7CD30ABC95D8
11ED47A01B30D0FFAEDD7CD30ABC95D8
11ED47A01B30D0FFAEDD7CD30ABC95D8
11ED47A01B30D0FFAEDD7CD30ABC95D8
11ED47A01B30D0FFAEDD7CD30ABC95D8
11ED47A01B30D0FFAEDD7CD30ABC95D8
11ED47A01B30D0FFAEDD7CD30ABC95D8
11ED47A01B30D0FFAEDD7CD30ABC95D8
11ED47A01B30D0FFAEDD7CD30ABC95D8
11ED47A01B30D0FFAEDD7CD30ABC95D8
11ED47A01B30D0FFAEDD7CD30ABC95D8
11ED47A01B30D0FFAEDD7CD30ABC95D8
11ED47A01B30D0FFAEDD7CD30ABC95D8
11ED47A01B30D0FFAEDD7CD30ABC95D8
11ED47A01B30D0FFAEDD7CD30ABC95D8
11ED47A01B30D0FFAEDD7CD30ABC95D8
11ED47A01B30D0FFAEDD7CD30ABC95D8
11ED47A01B30D0FFAEDD7CD30ABC95D8
11ED47A01B30D0FFAEDD7CD30ABC95D8
11ED47A01B30D0FFAEDD7CD30ABC95D8
11ED47A01B30D0FFAEDD7CD30ABC95D8
11ED47A01B30D0FFAEDD7CD30ABC95D8
11ED47A01B30D0FFAEDD7CD30ABC95D8
11ED47A01B30D0FFAEDD7CD30ABC95D8
11ED47A01B30D0FFAEDD7CD30ABC95D8
11ED47A01B30D0FFAEDD7CD30ABC95D8
11ED47A01B30D0FFAEDD7CD30ABC95D8
11ED47A01B30D0FFAEDD7CD30ABC95D8
11ED47A01B30D0FFAEDD7CD30ABC95D8
11ED47A01B30D0FFAEDD7CD30ABC95D8
11ED47A01B30D0FFAEDD7CD30ABC95D8
11ED47A01B30D0FFAEDD7CD30ABC95D8
11ED47A01B30D0FFAEDD7CD30ABC95D8
11ED47A01B30D0FFAEDD7CD30ABC95D8
11ED47A01B30D0FFAEDD7CD30ABC95D8
11ED47A01B30D0FFAEDD7CD30ABC95D8
11ED47A01B30D0FFAEDD7CD30ABC95D8
11ED47A01B30D0FFAEDD7CD30ABC95D8
11ED47A01B30D0FFAEDD7CD30ABC95D8
11ED47A01B30D0FFAEDD7CD30ABC95D8
11ED47A01B30D0FFAEDD7CD30ABC95D8
11ED47A01B30D0FFAEDD7CD30ABC95D8
11ED47A01B30D0FFAEDD7CD30ABC95D8
11ED47A01B30D0FFAEDD7CD30ABC95D8
11ED47A01B30D0FFAEDD7CD30ABC95D8
11ED47A01B30D0FFAEDD7CD30ABC95D8
11ED47A01B30D0FFAEDD7CD30ABC95D8
11ED47A01B30D0FFAEDD7CD30ABC95D8
11ED47A01B30D0FFAEDD7CD30ABC95D8
11ED47A01B30D0FFAEDD7CD30ABC95D8
11ED47A01B30D0FFAEDD7CD30ABC95D8
11ED47A01B30D0FFAEDD7CD30ABC95D8
11ED47A01B30D0FFAEDD7CD30ABC95D8
11ED47A01B30D0FFAEDD7CD30ABC95D8
11ED47A01B30D0FFAEDD7CD30ABC95D8
11ED47A01B30D0FFAEDD7CD30ABC95D8
11ED47A01B30D0FFAEDD7CD30ABC95D8
11ED47A01B30D0FFAEDD7CD30ABC95D8
11ED47A01B30D0FFAEDD7CD30ABC95D8
11ED47A01B30D0FFAEDD7CD30ABC95D8
11ED47A01B30D0FFAEDD7CD30ABC95D8
11ED47A01B30D0FFAEDD7CD30ABC95D8
11ED47A01B30D0FFAEDD7CD30ABC95D8
11ED47A01B30D0FFAEDD7CD30ABC95D8
11ED47A01B30D0FFAEDD7CD30ABC95D8
11ED47A01B30D0FFAEDD7CD30ABC95D8
11ED47A01B30D0FFAEDD7CD30ABC95D8
11ED47A01B30D0FFAEDD7CD30ABC95D8
11ED47A01B30D0FFAEDD7CD30ABC95D8
11ED47A01B30D0FFAEDD7CD30ABC95D8
11ED47A01B30D0FFAEDD7CD30ABC95D8
11ED47A01B30D0FFAEDD7CD30ABC95D8
11ED47A01B30D0FFAEDD7CD30ABC95D8
11ED47A01B30D0FFAEDD7CD30ABC95D8
11ED47A01B30D0FFAEDD7CD30ABC95D8
11ED47A01B30D0FFAEDD7CD30ABC95D8
11ED47A01B30D0FFAEDD7CD30ABC95D8
11ED47A01B30D0FFAEDD7CD30ABC95D8
11ED47A01B30D0FFAEDD7CD30ABC95D8
11ED47A01B30D0FFAEDD7CD30ABC95D8
11ED47A01B30D0FFAEDD7CD30ABC95D8
11ED47A01B30D0FFAEDD7CD30ABC95D8
11ED47A01B30D0FFAEDD7CD30ABC95D8
11ED47A01B30D0FFAEDD7CD30ABC95D8
11ED47A01B30D0FFAEDD7CD30ABC95D8
11ED47A01B30D0FFAEDD7CD30ABC95D8
11ED47A01B30D0FFAEDD7CD30ABC95D8
11ED47A01B30D0FFAEDD7CD30ABC95D8
11ED47A01B30D0FFAEDD7CD30ABC95D8
11ED47A01B30D0FFAEDD7CD30ABC95D8
11ED47A01B30D0FFAEDD7CD30ABC95D8
11ED47A01B30D0FFAEDD7CD30ABC95D8
11ED47A01B30D0FFAEDD7CD30ABC95D8
11ED47A01B30D0FFAEDD7CD30ABC95D8
11ED47A01B30D0FFAEDD7CD30ABC95D8
11ED47A01B30D0FFAEDD7CD30ABC95D8
11ED47A01B30D0FFAEDD7CD30ABC95D8
11ED47A01B30D0FFAEDD7CD30ABC95D8
11ED47A01B30D0FFAEDD7CD30ABC95D8
11ED47A01B30D0FFAEDD7CD30ABC95D8
11ED47A01B30D0FFAEDD7CD30ABC95D8
11ED47A01B30D0FFAEDD7CD30ABC95D8
11ED47A01B30D0FFAEDD7CD30ABC95D8
11ED47A01B30D0FFAEDD7CD30ABC95D8
11ED47A01B30D0FFAEDD7CD30ABC95D8
11ED47A01B30D0FFAEDD7CD30ABC95D8
11ED47A01B30D0FFAEDD7CD30ABC95D8
11ED47A01B30D0FFAEDD7CD30ABC95D8
11ED47A01B30D0FFAEDD7CD30ABC95D8
11ED47A01B30D0FFAEDD7CD30ABC95D8
11ED47A01B30D0FFAEDD7CD30ABC95D8
11ED47A01B30D0FFAEDD7CD30ABC95D8
11ED47A01B30D0FFAEDD7CD30ABC95D8
11ED47A01B30D0FFAEDD7CD30ABC95D8
11ED47A01B30D0FFAEDD7CD30ABC95D8
11ED47A01B30D0FFAEDD7CD30ABC95D8
11ED47A01B30D0FFAEDD7CD30ABC95D8
11ED47A01B30D0FFAEDD7CD30ABC95D8
11ED47A01B30D0FFAEDD7CD30ABC95D8
11ED47A01B30D0FFAEDD7CD30ABC95D8
11ED47A01B30D0FFAEDD7CD30ABC95D8
11ED47A01B30D0FFAEDD7CD30ABC95D8
11ED47A01B30D0FFAEDD7CD30ABC95D8
11ED47A01B30D0FFAEDD7CD30ABC95D8
11ED47A01B30D0FFAEDD7CD30ABC95D8
11ED47A01B30D0FFAEDD7CD30ABC95D8
11ED47A01B30D0FFAEDD7CD30ABC95D8
11ED47A01B30D0FFAEDD7CD30ABC95D8
11ED47A01B30D0FFAEDD7CD30ABC95D8
11ED47A01B30D0FFAEDD7CD30ABC95D8
11ED47A01B30D0FFAEDD7CD30ABC95D8
11ED47A01B30D0FFAEDD7CD30ABC95D8
11ED47A01B30D0FFAEDD7CD30ABC95D8
11ED47A01B30D0FFAEDD7CD30ABC95D8
11ED47A01B30D0FFAEDD7CD30ABC95D8
11ED47A01B30D0FFAEDD7CD30ABC95D8
11ED47A01B30D0FFAEDD7CD30ABC95D8
11ED47A01B30D0FFAEDD7CD30ABC95D8
11ED47A01B30D0FFAEDD7CD30ABC95D8
11ED47A01B30D0FFAEDD7CD30ABC95D8
11ED47A01B30D0FFAEDD7CD30ABC95D8
11ED47A01B30D0FFAEDD7CD30ABC95D8
11ED47A01B30D0FFAEDD7CD30ABC95D8
11ED47A01B30D0FFAEDD7CD30ABC95D8
11ED47A01B30D0FFAEDD7CD30ABC95D8
11ED47A01B30D0FFAEDD7CD30ABC95D8
11ED47A01B30D0FFAEDD7CD30ABC95D8
11ED47A01B30D0FFAEDD7CD30ABC95D8
11ED47A01B30D0FFAEDD7CD30ABC95D8
11ED47A01B30D0FFAEDD7CD30ABC95D8
11ED47A01B30D0FFAEDD7CD30ABC95D8
11ED47A01B30D0FFAEDD7CD30ABC95D8
11ED47A01B30D0FFAEDD7CD30ABC95D8
11ED47A01B30D0FFAEDD7CD30ABC95D8
11ED47A01B30D0FFAEDD7CD30ABC95D8
11ED47A01B30D0FFAEDD7CD30ABC95D8
11ED47A01B30D0FFAEDD7CD30ABC95D8
11ED47A01B30D0FFAEDD7CD30ABC95D8
11ED47A01B30D0FFAEDD7CD30ABC95D8
11ED47A01B30D0FFAEDD7CD30ABC95D8
11ED47A01B30D0FFAEDD7CD30ABC95D8
11ED47A01B30D0FFAEDD7CD30ABC95D8
11ED47A01B30D0FFAEDD7CD30ABC95D8
11ED47A01B30D0FFAEDD7CD30ABC95D8
11ED47A01B30D0FFAEDD7CD30ABC95D8
11ED47A01B30D0FFAEDD7CD30ABC95D8
11ED47A01B30D0FFAEDD7CD30ABC95D8
11ED47A01B30D0FFAEDD7CD30ABC95D8
11ED47A01B30D0FFAEDD7CD30ABC95D8
11ED47A01B30D0FFAEDD7CD30ABC95D8
11ED47A01B30D0FFAEDD7CD30ABC95D8
11ED47A01B30D0FFAEDD7CD30ABC95D8
11ED47A01B30D0FFAEDD7CD30ABC95D8
11ED47A01B30D0FFAEDD7CD30ABC95D8
11ED47A01B30D0FFAEDD7CD30ABC95D8
11ED47A01B30D0FFAEDD7CD30ABC95D8
11ED47A01B30D0FFAEDD7CD30ABC95D8
11ED47A01B30D0FFAEDD7CD30ABC95D8
11ED47A01B30D0FFAEDD7CD30ABC95D8
11ED47A01B30D0FFAEDD7CD30ABC95D8
11ED47A01B30D0FFAEDD7CD30ABC95D8
11ED47A01B30D0FFAEDD7CD30ABC95D8
11ED47A01B30D0FFAEDD7CD30ABC95D8
11ED47A01B30D0FFAEDD7CD30ABC95D8
11ED47A01B30D0FFAEDD7CD30ABC95D8
11ED47A01B30D0FFAEDD7CD30ABC95D8
11ED47A01B30D0FFAEDD7CD30ABC95D8
11ED47A01B30D0FFAEDD7CD30ABC95D8
11ED47A01B30D0FFAEDD7CD30ABC95D8
11ED47A01B30D0FFAEDD7CD30ABC95D8
11ED47A01B30D0FFAEDD7CD30ABC95D8
11ED47A01B30D0FFAEDD7CD30ABC95D8
11ED47A01B30D0FFAEDD7CD30ABC95D8
11ED47A01B30D0FFAEDD7CD30ABC95D8
11ED47A01B30D0FFAEDD7CD30ABC95D8
11ED47A01B30D0FFAEDD7CD30ABC95D8
11ED47A01B30D0FFAEDD7CD30ABC95D8
11ED47A01B30D0FFAEDD7CD30ABC95D8
11ED47A01B30D0FFAEDD7CD30ABC95D8
11ED47A01B30D0FFAEDD7CD30ABC95D8
11ED47A01B30D0FFAEDD7CD30ABC95D8
11ED47A01B30D0FFAEDD7CD30ABC95D8
11ED47A01B30D0FFAEDD7CD30ABC95D8
11ED47A01B30D0FFAEDD7CD30ABC95D8
11ED47A01B30D0FFAEDD7CD30ABC95D8
11ED47A01B30D0FFAEDD7CD30ABC95D8
11ED47A01B30D0FFAEDD7CD30ABC95D8
11ED47A01B30D0FFAEDD7CD30ABC95D8
11ED47A01B30D0FFAEDD7CD30ABC95D8
11ED47A01B30D0FFAEDD7CD30ABC95D8
11ED47A01B30D0FFAEDD7CD30ABC95D8
11ED47A01B30D0FFAEDD7CD30ABC95D8
11ED47A01B30D0FFAEDD7CD30ABC95D8
11ED47A01B30D0FFAEDD7CD30ABC95D8
11ED47A01B30D0FFAEDD7CD30ABC95D8
11ED47A01B30D0FFAEDD7CD30ABC95D8
11ED47A01B30D0FFAEDD7CD30ABC95D8
11ED47A01B30D0FFAEDD7CD30ABC95D8
11ED47A01B30D0FFAEDD7CD30ABC95D8
11ED47A01B30D0FFAEDD7CD30ABC95D8
11ED47A01B30D0FFAEDD7CD30ABC95D8
11ED47A01B30D0FFAEDD7CD30ABC95D8
11ED47A01B30D0FFAEDD7CD30ABC95D8
11ED47A01B30D0FFAEDD7CD30ABC95D8
11ED47A01B30D0FFAEDD7CD30ABC95D8
11ED47A01B30D0FFAEDD7CD30ABC95D8
11ED47A01B30D0FFAEDD7CD30ABC95D8
11ED47A01B30D0FFAEDD7CD30ABC95D8
11ED47A01B30D0FFAEDD7CD30ABC95D8
11ED47A01B30D0FFAEDD7CD30ABC95D8
11ED47A01B30D0FFAEDD7CD30ABC95D8
11ED47A01B30D0FFAEDD7CD30ABC95D8
11ED47A01B30D0FFAEDD7CD30ABC95D8
11ED47A01B30D0FFAEDD7CD30ABC95D8
11ED47A01B30D0FFAEDD7CD30ABC95D8
11ED47A01B30D0FFAEDD7CD30ABC95D8
11ED47A01B30D0FFAEDD7CD30ABC95D8
11ED47A01B30D0FFAEDD7CD30ABC95D8
11ED47A01B30D0FFAEDD7CD30ABC95D8
11ED47A01B30D0FFAEDD7CD30ABC95D8
11ED47A01B30D0FFAEDD7CD30ABC95D8
11ED47A01B30D0FFAEDD7CD30ABC95D8
11ED47A01B30D0FFAEDD7CD30ABC95D8
11ED47A01B30D0FFAEDD7CD30ABC95D8
11ED47A01B30D0FFAEDD7CD30ABC95D8
11ED47A01B30D0FFAEDD7CD30ABC95D8
11ED47A01B30D0FFAEDD7CD30ABC95D8
11ED47A01B30D0FFAEDD7CD30ABC95D8
11ED47A01B30D0FFAEDD7CD30ABC95D8
11ED47A01B30D0FFAEDD7CD30ABC95D8
11ED47A01B30D0FFAEDD7CD30ABC95D8
11ED47A01B30D0FFAEDD7CD30ABC95D8
11ED47A01B30D0FFAEDD7CD30ABC95D8
11ED47A01B30D0FFAEDD7CD30ABC95D8
11ED47A01B30D0FFAEDD7CD30ABC95D8
11ED47A01B30D0FFAEDD7CD30ABC95D8
11ED47A01B30D0FFAEDD7CD30ABC95D8
11ED47A01B30D0FFAEDD7CD30ABC95D8
11ED47A01B30D0FFAEDD7CD30ABC95D8
11ED47A01B30D0FFAEDD7CD30ABC95D8
11ED47A01B30D0FFAEDD7CD30ABC95D8
11ED47A01B30D0FFAEDD7CD30ABC95D8
11ED47A01B30D0FFAEDD7CD30ABC95D8
11ED47A01B30D0FFAEDD7CD30ABC95D8
11ED47A01B30D0FFAEDD7CD30ABC95D8
11ED47A01B30D0FFAEDD7CD30ABC95D8
11ED47A01B30D0FFAEDD7CD30ABC95D8
11ED47A01B30D0FFAEDD7CD30ABC95D8
11ED47A01B30D0FFAEDD7CD30ABC95D8
11ED47A01B30D0FFAEDD7CD30ABC95D8
11ED47A01B30D0FFAEDD7CD30ABC95D8
11ED47A01B30D0FFAEDD7CD30ABC95D8
11ED47A01B30D0FFAEDD7CD30ABC95D8
11ED47A01B30D0FFAEDD7CD30ABC95D8
11ED47A01B30D0FFAEDD7CD30ABC95D8
11ED47A01B30D0FFAEDD7CD30ABC95D8
11ED47A01B30D0FFAEDD7CD30ABC95D8
11ED47A01B30D0FFAEDD7CD30ABC95D8
11ED47A01B30D0FFAEDD7CD30ABC95D8
11ED47A01B30D0FFAEDD7CD30ABC95D8
11ED47A01B30D0FFAEDD7CD30ABC95D8
11ED47A01B30D0FFAEDD7CD30ABC95D8
11ED47A01B30D0FFAEDD7CD30ABC95D8
11ED47A01B30D0FFAEDD7CD30ABC95D8
11ED47A01B30D0FFAEDD7CD30ABC95D8
11ED47A01B30D0FFAEDD7CD30ABC95D8
11ED47A01B30D0FFAEDD7CD30ABC95D8
11ED47A01B30D0FFAEDD7CD30ABC95D8
11ED47A01B30D0FFAEDD7CD30ABC95D8
11ED47A01B30D0FFAEDD7CD30ABC95D8
11ED47A01B30D0FFAEDD7CD30ABC95D8
11ED47A01B30D0FFAEDD7CD30ABC95D8
11ED47A01B30D0FFAEDD7CD30ABC95D8
11ED47A01B30D0FFAEDD7CD30ABC95D8
11ED47A01B30D0FFAEDD7CD30ABC95D8
11ED47A01B30D0FFAEDD7CD30ABC95D8
11ED47A01B30D0FFAEDD7CD30ABC95D8
11ED47A01B30D0FFAEDD7CD30ABC95D8
11ED47A01B30D0FFAEDD7CD30ABC95D8
11ED47A01B30D0FFAEDD7CD30ABC95D8
11ED47A01B30D0FFAEDD7CD30ABC95D8
11ED47A01B30D0FFAEDD7CD30ABC95D8
11ED47A01B30D0FFAEDD7CD30ABC95D8
11ED47A01B30D0FFAEDD7CD30ABC95D8
11ED47A01B30D0FFAEDD7CD30ABC95D8
11ED47A01B30D0FFAEDD7CD30ABC95D8
11ED47A01B30D0FFAEDD7CD30ABC95D8
11ED47A01B30D0FFAEDD7CD30ABC95D8
11ED47A01B30D0FFAEDD7CD30ABC95D8
11ED47A01B30D0FFAEDD7CD30ABC95D8
11ED47A01B30D0FFAEDD7CD30ABC95D8
11ED47A01B30D0FFAEDD7CD30ABC95D8
11ED47A01B30D0FFAEDD7CD30ABC95D8
11ED47A01B30D0FFAEDD7CD30ABC95D8
11ED47A01B30D0FFAEDD7CD30ABC95D8
11ED47A01B30D0FFAEDD7CD30ABC95D8
11ED47A01B30D0FFAEDD7CD30ABC95D8
11ED47A01B30D0FFAEDD7CD30ABC95D8
11ED47A01B30D0FFAEDD7CD30ABC95D8
11ED47A01B30D0FFAEDD7CD30ABC95D8
11ED47A01B30D0FFAEDD7CD30ABC95D8
11ED47A01B30D0FFAEDD7CD30ABC95D8
11ED47A01B30D0FFAEDD7CD30ABC95D8
11ED47A01B30D0FFAEDD7CD30ABC95D8
11ED47A01B30D0FFAEDD7CD30ABC95D8
11ED47A01B30D0FFAEDD7CD30ABC95D8
11ED47A01B30D0FFAEDD7CD30ABC95D8
11ED47A01B30D0FFAEDD7CD30ABC95D8
11ED47A01B30D0FFAEDD7CD30ABC95D8
11ED47A01B30D0FFAEDD7CD30ABC95D8
11ED47A01B30D0FFAEDD7CD30ABC95D8
11ED47A01B30D0FFAEDD7CD30ABC95D8
11ED47A01B30D0FFAEDD7CD30ABC95D8
11ED47A01B30D0FFAEDD7CD30ABC95D8
11ED47A01B30D0FFAEDD7CD30ABC95D8
11ED47A01B30D0FFAEDD7CD30ABC95D8
11ED47A01B30D0FFAEDD7CD30ABC95D8
11ED47A01B30D0FFAEDD7CD30ABC95D8
11ED47A01B30D0FFAEDD7CD30ABC95D8
11ED47A01B30D0FFAEDD7CD30ABC95D8
11ED47A01B30D0FFAEDD7CD30ABC95D8
11ED47A01B30D0FFAEDD7CD30ABC95D8
11ED47A01B30D0FFAEDD7CD30ABC95D8
11ED47A01B30D0FFAEDD7CD30ABC95D8
11ED47A01B30D0FFAEDD7CD30ABC95D8
11ED47A01B30D0FFAEDD7CD30ABC95D8
11ED47A01B30D0FFAEDD7CD30ABC95D8
11ED47A01B30D0FFAEDD7CD30ABC95D8
11ED47A01B30D0FFAEDD7CD30ABC95D8
11ED47A01B30D0FFAEDD7CD30ABC95D8
11ED47A01B30D0FFAEDD7CD30ABC95D8
11ED47A01B30D0FFAEDD7CD30ABC95D8
11ED47A01B30D0FFAEDD7CD30ABC95D8
11ED47A01B30D0FFAEDD7CD30ABC95D8
11ED47A01B30D0FFAEDD7CD30ABC95D8
11ED47A01B30D0FFAEDD7CD30ABC95D8
11ED47A01B30D0FFAEDD7CD30ABC95D8
11ED47A01B30D0FFAEDD7CD30ABC95D8
11ED47A01B30D0FFAEDD7CD30ABC95D8
11ED47A01B30D0FFAEDD7CD30ABC95D8
11ED47A01B30D0FFAEDD7CD30ABC95D8
11ED47A01B30D0FFAEDD7CD30ABC95D8
11ED47A01B30D0FFAEDD7CD30ABC95D8
11ED47A01B30D0FFAEDD7CD30ABC95D8
11ED47A01B30D0FFAEDD7CD30ABC95D8
11ED47A01B30D0FFAEDD7CD30ABC95D8
11ED47A01B30D0FFAEDD7CD30ABC95D8
11ED47A01B30D0FFAEDD7CD30ABC95D8
11ED47A01B30D0FFAEDD7CD30ABC95D8
11ED47A01B30D0FFAEDD7CD30ABC95D8
11ED47A01B30D0FFAEDD7CD30ABC95D8
11ED47A01B30D0FFAEDD7CD30ABC95D8
11ED47A01B30D0FFAEDD7CD30ABC95D8
11ED47A01B30D0FFAEDD7CD30ABC95D8
11ED47A01B30D0FFAEDD7CD30ABC95D8
11ED47A01B30D0FFAEDD7CD30ABC95D8
11ED47A01B30D0FFAEDD7CD30ABC95D8
11ED47A01B30D0FFAEDD7CD30ABC95D8
11ED47A01B30D0FFAEDD7CD30ABC95D8
11ED47A01B30D0FFAEDD7CD30ABC95D8
11ED47A01B30D0FFAEDD7CD30ABC95D8
11ED47A01B30D0FFAEDD7CD30ABC95D8
11ED47A01B30D0FFAEDD7CD30ABC95D8
11ED47A01B30D0FFAEDD7CD30ABC95D8
11ED47A01B30D0FFAEDD7CD30ABC95D8
11ED47A01B30D0FFAEDD7CD30ABC95D8
11ED47A01B30D0FFAEDD7CD30ABC95D8
11ED47A01B30D0FFAEDD7CD30ABC95D8
11ED47A01B30D0FFAEDD7CD30ABC95D8
11ED47A01B30D0FFAEDD7CD30ABC95D8
11ED47A01B30D0FFAEDD7CD30ABC95D8
11ED47A01B30D0FFAEDD7CD30ABC95D8
11ED47A01B30D0FFAEDD7CD30ABC95D8
11ED47A01B30D0FFAEDD7CD30ABC95D8
11ED47A01B30D0FFAEDD7CD30ABC95D8
11ED47A01B30D0FFAEDD7CD30ABC95D8
11ED47A01B30D0FFAEDD7CD30ABC95D8
11ED47A01B30D0FFAEDD7CD30ABC95D8
11ED47A01B30D0FFAEDD7CD30ABC95D8
11ED47A01B30D0FFAEDD7CD30ABC95D8
11ED47A01B30D0FFAEDD7CD30ABC95D8
11ED47A01B30D0FFAEDD7CD30ABC95D8
11ED47A01B30D0FFAEDD7CD30ABC95D8
11ED47A01B30D0FFAEDD7CD30ABC95D8
11ED47A01B30D0FFAEDD7CD30ABC95D8
11ED47A01B30D0FFAEDD7CD30ABC95D8
11ED47A01B30D0FFAEDD7CD30ABC95D8
11ED47A01B30D0FFAEDD7CD30ABC95D8
11ED47A01B30D0FFAEDD7CD30ABC95D8
11ED47A01B30D0FFAEDD7CD30ABC95D8
11ED47A01B30D0FFAEDD7CD30ABC95D8
11ED47A01B30D0FFAEDD7CD30ABC95D8
11ED47A01B30D0FFAEDD7CD30ABC95D8
11ED47A01B30D0FFAEDD7CD30ABC95D8
11ED47A01B30D0FFAEDD7CD30ABC95D8
11ED47A01B30D0FFAEDD7CD30ABC95D8
11ED47A01B30D0FFAEDD7CD30ABC95D8
11ED47A01B30D0FFAEDD7CD30ABC95D8
11ED47A01B30D0FFAEDD7CD30ABC95D8
11ED47A01B30D0FFAEDD7CD30ABC95D8
11ED47A01B30D0FFAEDD7CD30ABC95D8
11ED47A01B30D0FFAEDD7CD30ABC95D8
11ED47A01B30D0FFAEDD7CD30ABC95D8
11ED47A01B30D0FFAEDD7CD30ABC95D8
11ED47A01B30D0FFAEDD7CD30ABC95D8
11ED47A01B30D0FFAEDD7CD30ABC95D8
11ED47A01B30D0FFAEDD7CD30ABC95D8
11ED47A01B30D0FFAEDD7CD30ABC95D8
11ED47A01B30D0FFAEDD7CD30ABC95D8
11ED47A01B30D0FFAEDD7CD30ABC95D8
11ED47A01B30D0FFAEDD7CD30ABC95D8
11ED47A01B30D0FFAEDD7CD30ABC95D8
11ED47A01B30D0FFAEDD7CD30ABC95D8
11ED47A01B30D0FFAEDD7CD30ABC95D8
11ED47A01B30D0FFAEDD7CD30ABC95D8
11ED47A01B30D0FFAEDD7CD30ABC95D8
11ED47A01B30D0FFAEDD7CD30ABC95D8
11ED47A01B30D0FFAEDD7CD30ABC95D8
11ED47A01B30D0FFAEDD7CD30ABC95D8
11ED47A01B30D0FFAEDD7CD30ABC95D8
11ED47A01B30D0FFAEDD7CD30ABC95D8
11ED47A01B30D0FFAEDD7CD30ABC95D8
11ED47A01B30D0FFAEDD7CD30ABC95D8
11ED47A01B30D0FFAEDD7CD30ABC95D8
11ED47A01B30D0FFAEDD7CD30ABC95D8
11ED47A01B30D0FFAEDD7CD30ABC95D8
11ED47A01B30D0FFAEDD7CD30ABC95D8
11ED47A01B30D0FFAEDD7CD30ABC95D8
11ED47A01B30D0FFAEDD7CD30ABC95D8
11ED47A01B30D0FFAEDD7CD30ABC95D8
11ED47A01B30D0FFAEDD7CD30ABC95D8
11ED47A01B30D0FFAEDD7CD30ABC95D8
11ED47A01B30D0FFAEDD7CD30ABC95D8
11ED47A01B30D0FFAEDD7CD30ABC95D8
11ED47A01B30D0FFAEDD7CD30ABC95D8
11ED47A01B30D0FFAEDD7CD30ABC95D8
11ED47A01B30D0FFAEDD7CD30ABC95D8
11ED47A01B30D0FFAEDD7CD30ABC95D8
11ED47A01B30D0FFAEDD7CD30ABC95D8
11ED47A01B30D0FFAEDD7CD30ABC95D8
11ED47A01B30D0FFAEDD7CD30ABC95D8
11ED47A01B30D0FFAEDD7CD30ABC95D8
11ED47A01B30D0FFAEDD7CD30ABC95D8
11ED47A01B30D0FFAEDD7CD30ABC95D8
11ED47A01B30D0FFAEDD7CD30ABC95D8
11ED47A01B30D0FFAEDD7CD30ABC95D8
11ED47A01B30D0FFAEDD7CD30ABC95D8
11ED47A01B30D0FFAEDD7CD30ABC95D8
11ED47A01B30D0FFAEDD7CD30ABC95D8
11ED47A01B30D0FFAEDD7CD30ABC95D8
11ED47A01B30D0FFAEDD7CD30ABC95D8
11ED47A01B30D0FFAEDD7CD30ABC95D8
11ED47A01B30D0FFAEDD7CD30ABC95D8
11ED47A01B30D0FFAEDD7CD30ABC95D8
11ED47A01B30D0FFAEDD7CD30ABC95D8
11ED47A01B30D0FFAEDD7CD30ABC95D8
11ED47A01B30D0FFAEDD7CD30ABC95D8
11ED47A01B30D0FFAEDD7CD30ABC95D8
11ED47A01B30D0FFAEDD7CD30ABC95D8
11ED47A01B30D0FFAEDD7CD30ABC95D8
11ED47A01B30D0FFAEDD7CD30ABC95D8
11ED47A01B30D0FFAEDD7CD30ABC95D8
11ED47A01B30D0FFAEDD7CD30ABC95D8
11ED47A01B30D0FFAEDD7CD30ABC95D8
11ED47A01B30D0FFAEDD7CD30ABC95D8
11ED47A01B30D0FFAEDD7CD30ABC95D8
11ED47A01B30D0FFAEDD7CD30ABC95D8
11ED47A01B30D0FFAEDD7CD30ABC95D8
11ED47A01B30D0FFAEDD7CD30ABC95D8
11ED47A01B30D0FFAEDD7CD30ABC95D8
11ED47A01B30D0FFAEDD7CD30ABC95D8
11ED47A01B30D0FFAEDD7CD30ABC95D8
11ED47A01B30D0FFAEDD7CD30ABC95D8
11ED47A01B30D0FFAEDD7CD30ABC95D8
11ED47A01B30D0FFAEDD7CD30ABC95D8
11ED47A01B30D0FFAEDD7CD30ABC95D8
11ED47A01B30D0FFAEDD7CD30ABC95D8
11ED47A01B30D0FFAEDD7CD30ABC95D8
11ED47A01B30D0FFAEDD7CD30ABC95D8
11ED47A01B30D0FFAEDD7CD30ABC95D8
11ED47A01B30D0FFAEDD7CD30ABC95D8
11ED47A01B30D0FFAEDD7CD30ABC95D8
11ED47A01B30D0FFAEDD7CD30ABC95D8
11ED47A01B30D0FFAEDD7CD30ABC95D8
11ED47A01B30D0FFAEDD7CD30ABC95D8
11ED47A01B30D0FFAEDD7CD30ABC95D8
11ED47A01B30D0FFAEDD7CD30ABC95D8
11ED47A01B30D0FFAEDD7CD30ABC95D8
11ED47A01B30D0FFAEDD7CD30ABC95D8
11ED47A01B30D0FFAEDD7CD30ABC95D8
11ED47A01B30D0FFAEDD7CD30ABC95D8
11ED47A01B30D0FFAEDD7CD30ABC95D8
11ED47A01B30D0FFAEDD7CD30ABC95D8
11ED47A01B30D0FFAEDD7CD30ABC95D8
11ED47A01B30D0FFAEDD7CD30ABC95D8
11ED47A01B30D0FFAEDD7CD30ABC95D8
11ED47A01B30D0FFAEDD7CD30ABC95D8
11ED47A01B30D0FFAEDD7CD30ABC95D8
11ED47A01B30D0FFAEDD7CD30ABC95D8
11ED47A01B30D0FFAEDD7CD30ABC95D8
11ED47A01B30D0FFAEDD7CD30ABC95D8
11ED47A01B30D0FFAEDD7CD30ABC95D8
11ED47A01B30D0FFAEDD7CD30ABC95D8
11ED47A01B30D0FFAEDD7CD30ABC95D8
11ED47A01B30D0FFAEDD7CD30ABC95D8
11ED47A01B30D0FFAEDD7CD30ABC95D8
11ED47A01B30D0FFAEDD7CD30ABC95D8
11ED47A01B30D0FFAEDD7CD30ABC95D8
11ED47A01B30D0FFAEDD7CD30ABC95D8
11ED47A01B30D0FFAEDD7CD30ABC95D8
11ED47A01B30D0FFAEDD7CD30ABC95D8
11ED47A01B30D0FFAEDD7CD30ABC95D8
11ED47A01B30D0FFAEDD7CD30ABC95D8
11ED47A01B30D0FFAEDD7CD30ABC95D8
11ED47A01B30D0FFAEDD7CD30ABC95D8
11ED47A01B30D0FFAEDD7CD30ABC95D8
11ED47A01B30D0FFAEDD7CD30ABC95D8
11ED47A01B30D0FFAEDD7CD30ABC95D8
11ED47A01B30D0FFAEDD7CD30ABC95D8
11ED47A01B30D0FFAEDD7CD30ABC95D8
11ED47A01B30D0FFAEDD7CD30ABC95D8
11ED47A01B30D0FFAEDD7CD30ABC95D8
11ED47A01B30D0FFAEDD7CD30ABC95D8
11ED47A01B30D0FFAEDD7CD30ABC95D8
11ED47A01B30D0FFAEDD7CD30ABC95D8
11ED47A01B30D0FFAEDD7CD30ABC95D8
11ED47A01B30D0FFAEDD7CD30ABC95D8
11ED47A01B30D0FFAEDD7CD30ABC95D8
11ED47A01B30D0FFAEDD7CD30ABC95D8
11ED47A01B30D0FFAEDD7CD30ABC95D8
11ED47A01B30D0FFAEDD7CD30ABC95D8
11ED47A01B30D0FFAEDD7CD30ABC95D8
11ED47A01B30D0FFAEDD7CD30ABC95D8
11ED47A01B30D0FFAEDD7CD30ABC95D8
11ED47A01B30D0FFAEDD7CD30ABC95D8
11ED47A01B30D0FFAEDD7CD30ABC95D8
11ED47A01B30D0FFAEDD7CD30ABC95D8
11ED47A01B30D0FFAEDD7CD30ABC95D8
11ED47A01B30D0FFAEDD7CD30ABC95D8
11ED47A01B30D0FFAEDD7CD30ABC95D8
11ED47A01B30D0FFAEDD7CD30ABC95D8
11ED47A01B30D0FFAEDD7CD30ABC95D8
11ED47A01B30D0FFAEDD7CD30ABC95D8
11ED47A01B30D0FFAEDD7CD30ABC95D8
11ED47A01B30D0FFAEDD7CD30ABC95D8
11ED47A01B30D0FFAEDD7CD30ABC95D8
11ED47A01B30D0FFAEDD7CD30ABC95D8
11ED47A01B30D0FFAEDD7CD30ABC95D8
11ED47A01B30D0FFAEDD7CD30ABC95D8
11ED47A01B30D0FFAEDD7CD30ABC95D8
11ED47A01B30D0FFAEDD7CD30ABC95D8
11ED47A01B30D0FFAEDD7CD30ABC95D8
11ED47A01B30D0FFAEDD7CD30ABC95D8
11ED47A01B30D0FFAEDD7CD30ABC95D8
11ED47A01B30D0FFAEDD7CD30ABC95D8
11ED47A01B30D0FFAEDD7CD30ABC95D8
11ED47A01B30D0FFAEDD7CD30ABC95D8
11ED47A01B30D0FFAEDD7CD30ABC95D8
11ED47A01B30D0FFAEDD7CD30ABC95D8
11ED47A01B30D0FFAEDD7CD30ABC95D8
11ED47A01B30D0FFAEDD7CD30ABC95D8
11ED47A01B30D0FFAEDD7CD30ABC95D8
11ED47A01B30D0FFAEDD7CD30ABC95D8
11ED47A01B30D0FFAEDD7CD30ABC95D8
11ED47A01B30D0FFAEDD7CD30ABC95D8
11ED47A01B30D0FFAEDD7CD30ABC95D8
11ED47A01B30D0FFAEDD7CD30ABC95D8
11ED47A01B30D0FFAEDD7CD30ABC95D8
11ED47A01B30D0FFAEDD7CD30ABC95D8
11ED47A01B30D0FFAEDD7CD30ABC95D8
11ED47A01B30D0FFAEDD7CD30ABC95D8
11ED47A01B30D0FFAEDD7CD30ABC95D8
11ED47A01B30D0FFAEDD7CD30ABC95D8
11ED47A01B30D0FFAEDD7CD30ABC95D8
11ED47A01B30D0FFAEDD7CD30ABC95D8
11ED47A01B30D0FFAEDD7CD30ABC95D8
11ED47A01B30D0FFAEDD7CD30ABC95D8
11ED47A01B30D0FFAEDD7CD30ABC95D8
11ED47A01B30D0FFAEDD7CD30ABC95D8
11ED47A01B30D0FFAEDD7CD30ABC95D8
11ED47A01B30D0FFAEDD7CD30ABC95D8
11ED47A01B30D0FFAEDD7CD30ABC95D8
11ED47A01B30D0FFAEDD7CD30ABC95D8
11ED47A01B30D0FFAEDD7CD30ABC95D8
11ED47A01B30D0FFAEDD7CD30ABC95D8
11ED47A01B30D0FFAEDD7CD30ABC95D8
11ED47A01B30D0FFAEDD7CD30ABC95D8
11ED47A01B30D0FFAEDD7CD30ABC95D8
11ED47A01B30D0FFAEDD7CD30ABC95D8
11ED47A01B30D0FFAEDD7CD30ABC95D8
11ED47A01B30D0FFAEDD7CD30ABC95D8
11ED47A01B30D0FFAEDD7CD30ABC95D8
11ED47A01B30D0FFAEDD7CD30ABC95D8
11ED47A01B30D0FFAEDD7CD30ABC95D8
11ED47A01B30D0FFAEDD7CD30ABC95D8
11ED47A01B30D0FFAEDD7CD30ABC95D8
11ED47A01B30D0FFAEDD7CD30ABC95D8
11ED47A01B30D0FFAEDD7CD30ABC95D8
11ED47A01B30D0FFAEDD7CD30ABC95D8
11ED47A01B30D0FFAEDD7CD30ABC95D8
11ED47A01B30D0FFAEDD7CD30ABC95D8
11ED47A01B30D0FFAEDD7CD30ABC95D8
11ED47A01B30D0FFAEDD7CD30ABC95D8
11ED47A01B30D0FFAEDD7CD30ABC95D8
11ED47A01B30D0FFAEDD7CD30ABC95D8
11ED47A01B30D0FFAEDD7CD30ABC95D8
11ED47A01B30D0FFAEDD7CD30ABC95D8
11ED47A01B30D0FFAEDD7CD30ABC95D8
11ED47A01B30D0FFAEDD7CD30ABC95D8
11ED47A01B30D0FFAEDD7CD30ABC95D8
11ED47A01B30D0FFAEDD7CD30ABC95D8
11ED47A01B30D0FFAEDD7CD30ABC95D8
11ED47A01B30D0FFAEDD7CD30ABC95D8
11ED47A01B30D0FFAEDD7CD30ABC95D8
11ED47A01B30D0FFAEDD7CD30ABC95D8
11ED47A01B30D0FFAEDD7CD30ABC95D8
11ED47A01B30D0FFAEDD7CD30ABC95D8
11ED47A01B30D0FFAEDD7CD30ABC95D8
11ED47A01B30D0FFAEDD7CD30ABC95D8
11ED47A01B30D0FFAEDD7CD30ABC95D8
11ED47A01B30D0FFAEDD7CD30ABC95D8
11ED47A01B30D0FFAEDD7CD30ABC95D8
11ED47A01B30D0FFAEDD7CD30ABC95D8
11ED47A01B30D0FFAEDD7CD30ABC95D8
11ED47A01B30D0FFAEDD7CD30ABC95D8
11ED47A01B30D0FFAEDD7CD30ABC95D8
11ED47A01B30D0FFAEDD7CD30ABC95D8
11ED47A01B30D0FFAEDD7CD30ABC95D8
11ED47A01B30D0FFAEDD7CD30ABC95D8
11ED47A01B30D0FFAEDD7CD30ABC95D8
11ED47A01B30D0FFAEDD7CD30ABC95D8
11ED47A01B30D0FFAEDD7CD30ABC95D8
11ED47A01B30D0FFAEDD7CD30ABC95D8
11ED47A01B30D0FFAEDD7CD30ABC95D8
11ED47A01B30D0FFAEDD7CD30ABC95D8
11ED47A01B30D0FFAEDD7CD30ABC95D8
11ED47A01B30D0FFAEDD7CD30ABC95D8
11ED47A01B30D0FFAEDD7CD30ABC95D8
11ED47A01B30D0FFAEDD7CD30ABC95D8
11ED47A01B30D0FFAEDD7CD30ABC95D8
11ED47A01B30D0FFAEDD7CD30ABC95D8
11ED47A01B30D0FFAEDD7CD30ABC95D8
11ED47A01B30D0FFAEDD7CD30ABC95D8
11ED47A01B30D0FFAEDD7CD30ABC95D8
11ED47A01B30D0FFAEDD7CD30ABC95D8
11ED47A01B30D0FFAEDD7CD30ABC95D8
11ED47A01B30D0FFAEDD7CD30ABC95D8
11ED47A01B30D0FFAEDD7CD30ABC95D8
11ED47A01B30D0FFAEDD7CD30ABC95D8
11ED47A01B30D0FFAEDD7CD30ABC95D8
11ED47A01B30D0FFAEDD7CD30ABC95D8
11ED47A01B30D0FFAEDD7CD30ABC95D8
11ED47A01B30D0FFAEDD7CD30ABC95D8
11ED47A01B30D0FFAEDD7CD30ABC95D8
11ED47A01B30D0FFAEDD7CD30ABC95D8
11ED47A01B30D0FFAEDD7CD30ABC95D8
11ED47A01B30D0FFAEDD7CD30ABC95D8
11ED47A01B30D0FFAEDD7CD30ABC95D8
11ED47A01B30D0FFAEDD7CD30ABC95D8
11ED47A01B30D0FFAEDD7CD30ABC95D8
11ED47A01B30D0FFAEDD7CD30ABC95D8
11ED47A01B30D0FFAEDD7CD30ABC95D8
11ED47A01B30D0FFAEDD7CD30ABC95D8
11ED47A01B30D0FFAEDD7CD30ABC95D8
11ED47A01B30D0FFAEDD7CD30ABC95D8
11ED47A01B30D0FFAEDD7CD30ABC95D8
11ED47A01B30D0FFAEDD7CD30ABC95D8
11ED47A01B30D0FFAEDD7CD30ABC95D8
11ED47A01B30D0FFAEDD7CD30ABC95D8
11ED47A01B30D0FFAEDD7CD30ABC95D8
11ED47A01B30D0FFAEDD7CD30ABC95D8
11ED47A01B30D0FFAEDD7CD30ABC95D8
11ED47A01B30D0FFAEDD7CD30ABC95D8
11ED47A01B30D0FFAEDD7CD30ABC95D8
11ED47A01B30D0FFAEDD7CD30ABC95D8
11ED47A01B30D0FFAEDD7CD30ABC95D8
11ED47A01B30D0FFAEDD7CD30ABC95D8
11ED47A01B30D0FFAEDD7CD30ABC95D8
11ED47A01B30D0FFAEDD7CD30ABC95D8
11ED47A01B30D0FFAEDD7CD30ABC95D8
11ED47A01B30D0FFAEDD7CD30ABC95D8
11ED47A01B30D0FFAEDD7CD30ABC95D8
11ED47A01B30D0FFAEDD7CD30ABC95D8
11ED47A01B30D0FFAEDD7CD30ABC95D8
11ED47A01B30D0FFAEDD7CD30ABC95D8
11ED47A01B30D0FFAEDD7CD30ABC95D8
11ED47A01B30D0FFAEDD7CD30ABC95D8
11ED47A01B30D0FFAEDD7CD30ABC95D8
11ED47A01B30D0FFAEDD7CD30ABC95D8
11ED47A01B30D0FFAEDD7CD30ABC95D8
11ED47A01B30D0FFAEDD7CD30ABC95D8
11ED47A01B30D0FFAEDD7CD30ABC95D8
11ED47A01B30D0FFAEDD7CD30ABC95D8
11ED47A01B30D0FFAEDD7CD30ABC95D8
11ED47A01B30D0FFAEDD7CD30ABC95D8
11ED47A01B30D0FFAEDD7CD30ABC95D8
11ED47A01B30D0FFAEDD7CD30ABC95D8
11ED47A01B30D0FFAEDD7CD30ABC95D8
11ED47A01B30D0FFAEDD7CD30ABC95D8
11ED47A01B30D0FFAEDD7CD30ABC95D8
11ED47A01B30D0FFAEDD7CD30ABC95D8
11ED47A01B30D0FFAEDD7CD30ABC95D8
11ED47A01B30D0FFAEDD7CD30ABC95D8
11ED47A01B30D0FFAEDD7CD30ABC95D8
11ED47A01B30D0FFAEDD7CD30ABC95D8
11ED47A01B30D0FFAEDD7CD30ABC95D8
11ED47A01B30D0FFAEDD7CD30ABC95D8
11ED47A01B30D0FFAEDD7CD30ABC95D8
11ED47A01B30D0FFAEDD7CD30ABC95D8
11ED47A01B30D0FFAEDD7CD30ABC95D8
11ED47A01B30D0FFAEDD7CD30ABC95D8
11ED47A01B30D0FFAEDD7CD30ABC95D8
11ED47A01B30D0FFAEDD7CD30ABC95D8
11ED47A01B30D0FFAEDD7CD30ABC95D8
11ED47A01B30D0FFAEDD7CD30ABC95D8
11ED47A01B30D0FFAEDD7CD30ABC95D8
11ED47A01B30D0FFAEDD7CD30ABC95D8
11ED47A01B30D0FFAEDD7CD30ABC95D8
11ED47A01B30D0FFAEDD7CD30ABC95D8
11ED47A01B30D0FFAEDD7CD30ABC95D8
11ED47A01B30D0FFAEDD7CD30ABC95D8
11ED47A01B30D0FFAEDD7CD30ABC95D8
11ED47A01B30D0FFAEDD7CD30ABC95D8
11ED47A01B30D0FFAEDD7CD30ABC95D8
11ED47A01B30D0FFAEDD7CD30ABC95D8
11ED47A01B30D0FFAEDD7CD30ABC95D8
11ED47A01B30D0FFAEDD7CD30ABC95D8
11ED47A01B30D0FFAEDD7CD30ABC95D8
11ED47A01B30D0FFAEDD7CD30ABC95D8
11ED47A01B30D0FFAEDD7CD30ABC95D8
11ED47A01B30D0FFAEDD7CD30ABC95D8
11ED47A01B30D0FFAEDD7CD30ABC95D8
11ED47A01B30D0FFAEDD7CD30ABC95D8
11ED47A01B30D0FFAEDD7CD30ABC95D8
11ED47A01B30D0FFAEDD7CD30ABC95D8
11ED47A01B30D0FFAEDD7CD30ABC95D8
11ED47A01B30D0FFAEDD7CD30ABC95D8
11ED47A01B30D0FFAEDD7CD30ABC95D8
11ED47A01B30D0FFAEDD7CD30ABC95D8
11ED47A01B30D0FFAEDD7CD30ABC95D8
11ED47A01B30D0FFAEDD7CD30ABC95D8
11ED47A01B30D0FFAEDD7CD30ABC95D8
11ED47A01B30D0FFAEDD7CD30ABC95D8
11ED47A01B30D0FFAEDD7CD30ABC95D8
11ED47A01B30D0FFAEDD7CD30ABC95D8
11ED47A01B30D0FFAEDD7CD30ABC95D8
11ED47A01B30D0FFAEDD7CD30ABC95D8
11ED47A01B30D0FFAEDD7CD30ABC95D8
11ED47A01B30D0FFAEDD7CD30ABC95D8
11ED47A01B30D0FFAEDD7CD30ABC95D8
11ED47A01B30D0FFAEDD7CD30ABC95D8
11ED47A01B30D0FFAEDD7CD30ABC95D8
11ED47A01B30D0FFAEDD7CD30ABC95D8
11ED47A01B30D0FFAEDD7CD30ABC95D8
11ED47A01B30D0FFAEDD7CD30ABC95D8
11ED47A01B30D0FFAEDD7CD30ABC95D8
11ED47A01B30D0FFAEDD7CD30ABC95D8
11ED47A01B30D0FFAEDD7CD30ABC95D8
11ED47A01B30D0FFAEDD7CD30ABC95D8
11ED47A01B30D0FFAEDD7CD30ABC95D8
11ED47A01B30D0FFAEDD7CD30ABC95D8
11ED47A01B30D0FFAEDD7CD30ABC95D8
11ED47A01B30D0FFAEDD7CD30ABC95D8
11ED47A01B30D0FFAEDD7CD30ABC95D8
11ED47A01B30D0FFAEDD7CD30ABC95D8
11ED47A01B30D0FFAEDD7CD30ABC95D8
11ED47A01B30D0FFAEDD7CD30ABC95D8
11ED47A01B30D0FFAEDD7CD30ABC95D8
11ED47A01B30D0FFAEDD7CD30ABC95D8
11ED47A01B30D0FFAEDD7CD30ABC95D8
11ED47A01B30D0FFAEDD7CD30ABC95D8
11ED47A01B30D0FFAEDD7CD30ABC95D8
11ED47A01B30D0FFAEDD7CD30ABC95D8
11ED47A01B30D0FFAEDD7CD30ABC95D8
11ED47A01B30D0FFAEDD7CD30ABC95D8
11ED47A01B30D0FFAEDD7CD30ABC95D8
11ED47A01B30D0FFAEDD7CD30ABC95D8
11ED47A01B30D0FFAEDD7CD30ABC95D8
11ED47A01B30D0FFAEDD7CD30ABC95D8
11ED47A01B30D0FFAEDD7CD30ABC95D8
11ED47A01B30D0FFAEDD7CD30ABC95D8
11ED47A01B30D0FFAEDD7CD30ABC95D8
11ED47A01B30D0FFAEDD7CD30ABC95D8
11ED47A01B30D0FFAEDD7CD30ABC95D8
11ED47A01B30D0FFAEDD7CD30ABC95D8
11ED47A01B30D0FFAEDD7CD30ABC95D8
11ED47A01B30D0FFAEDD7CD30ABC95D8
11ED47A01B30D0FFAEDD7CD30ABC95D8
11ED47A01B30D0FFAEDD7CD30ABC95D8
11ED47A01B30D0FFAEDD7CD30ABC95D8
11ED47A01B30D0FFAEDD7CD30ABC95D8
11ED47A01B30D0FFAEDD7CD30ABC95D8
11ED47A01B30D0FFAEDD7CD30ABC95D8
11ED47A01B30D0FFAEDD7CD30ABC95D8
11ED47A01B30D0FFAEDD7CD30ABC95D8
11ED47A01B30D0FFAEDD7CD30ABC95D8
11ED47A01B30D0FFAEDD7CD30ABC95D8
11ED47A01B30D0FFAEDD7CD30ABC95D8
11ED47A01B30D0FFAEDD7CD30ABC95D8
11ED47A01B30D0FFAEDD7CD30ABC95D8
11ED47A01B30D0FFAEDD7CD30ABC95D8
11ED47A01B30D0FFAEDD7CD30ABC95D8
11ED47A01B30D0FFAEDD7CD30ABC95D8
11ED47A01B30D0FFAEDD7CD30ABC95D8
11ED47A01B30D0FFAEDD7CD30ABC95D8
11ED47A01B30D0FFAEDD7CD30ABC95D8
11ED47A01B30D0FFAEDD7CD30ABC95D8
11ED47A01B30D0FFAEDD7CD30ABC95D8
11ED47A01B30D0FFAEDD7CD30ABC95D8
11ED47A01B30D0FFAEDD7CD30ABC95D8
11ED47A01B30D0FFAEDD7CD30ABC95D8
11ED47A01B30D0FFAEDD7CD30ABC95D8
11ED47A01B30D0FFAEDD7CD30ABC95D8
11ED47A01B30D0FFAEDD7CD30ABC95D8
11ED47A01B30D0FFAEDD7CD30ABC95D8
11ED47A01B30D0FFAEDD7CD30ABC95D8
11ED47A01B30D0FFAEDD7CD30ABC95D8
11ED47A01B30D0FFAEDD7CD30ABC95D8
11ED47A01B30D0FFAEDD7CD30ABC95D8
11ED47A01B30D0FFAEDD7CD30ABC95D8
11ED47A01B30D0FFAEDD7CD30ABC95D8
11ED47A01B30D0FFAEDD7CD30ABC95D8
11ED47A01B30D0FFAEDD7CD30ABC95D8
11ED47A01B30D0FFAEDD7CD30ABC95D8
11ED47A01B30D0FFAEDD7CD30ABC95D8
11ED47A01B30D0FFAEDD7CD30ABC95D8
11ED47A01B30D0FFAEDD7CD30ABC95D8
11ED47A01B30D0FFAEDD7CD30ABC95D8
11ED47A01B30D0FFAEDD7CD30ABC95D8
11ED47A01B30D0FFAEDD7CD30ABC95D8
11ED47A01B30D0FFAEDD7CD30ABC95D8
11ED47A01B30D0FFAEDD7CD30ABC95D8
11ED47A01B30D0FFAEDD7CD30ABC95D8
11ED47A01B30D0FFAEDD7CD30ABC95D8
11ED47A01B30D0FFAEDD7CD30ABC95D8
11ED47A01B30D0FFAEDD7CD30ABC95D8
11ED47A01B30D0FFAEDD7CD30ABC95D8
11ED47A01B30D0FFAEDD7CD30ABC95D8
11ED47A01B30D0FFAEDD7CD30ABC95D8
11ED47A01B30D0FFAEDD7CD30ABC95D8
11ED47A01B30D0FFAEDD7CD30ABC95D8
11ED47A01B30D0FFAEDD7CD30ABC95D8
11ED47A01B30D0FFAEDD7CD30ABC95D8
11ED47A01B30D0FFAEDD7CD30ABC95D8
11ED47A01B30D0FFAEDD7CD30ABC95D8
11ED47A01B30D0FFAEDD7CD30ABC95D8
11ED47A01B30D0FFAEDD7CD30ABC95D8
11ED47A01B30D0FFAEDD7CD30ABC95D8
11ED47A01B30D0FFAEDD7CD30ABC95D8
11ED47A01B30D0FFAEDD7CD30ABC95D8
11ED47A01B30D0FFAEDD7CD30ABC95D8
11ED47A01B30D0FFAEDD7CD30ABC95D8
11ED47A01B30D0FFAEDD7CD30ABC95D8
11ED47A01B30D0FFAEDD7CD30ABC95D8
11ED47A01B30D0FFAEDD7CD30ABC95D8
11ED47A01B30D0FFAEDD7CD30ABC95D8
11ED47A01B30D0FFAEDD7CD30ABC95D8
11ED47A01B30D0FFAEDD7CD30ABC95D8
11ED47A01B30D0FFAEDD7CD30ABC95D8
11ED47A01B30D0FFAEDD7CD30ABC95D8
11ED47A01B30D0FFAEDD7CD30ABC95D8
11ED47A01B30D0FFAEDD7CD30ABC95D8
11ED47A01B30D0FFAEDD7CD30ABC95D8
11ED47A01B30D0FFAEDD7CD30ABC95D8
11ED47A01B30D0FFAEDD7CD30ABC95D8
11ED47A01B30D0FFAEDD7CD30ABC95D8
11ED47A01B30D0FFAEDD7CD30ABC95D8
11ED47A01B30D0FFAEDD7CD30ABC95D8
11ED47A01B30D0FFAEDD7CD30ABC95D8
11ED47A01B30D0FFAEDD7CD30ABC95D8
11ED47A01B30D0FFAEDD7CD30ABC95D8
11ED47A01B30D0FFAEDD7CD30ABC95D8
11ED47A01B30D0FFAEDD7CD30ABC95D8
11ED47A01B30D0FFAEDD7CD30ABC95D8
11ED47A01B30D0FFAEDD7CD30ABC95D8
11ED47A01B30D0FFAEDD7CD30ABC95D8
11ED47A01B30D0FFAEDD7CD30ABC95D8
11ED47A01B30D0FFAEDD7CD30ABC95D8
11ED47A01B30D0FFAEDD7CD30ABC95D8
11ED47A01B30D0FFAEDD7CD30ABC95D8
11ED47A01B30D0FFAEDD7CD30ABC95D8
11ED47A01B30D0FFAEDD7CD30ABC95D8
11ED47A01B30D0FFAEDD7CD30ABC95D8
11ED47A01B30D0FFAEDD7CD30ABC95D8
11ED47A01B30D0FFAEDD7CD30ABC95D8
11ED47A01B30D0FFAEDD7CD30ABC95D8
11ED47A01B30D0FFAEDD7CD30ABC95D8
11ED47A01B30D0FFAEDD7CD30ABC95D8
11ED47A01B30D0FFAEDD7CD30ABC95D8
11ED47A01B30D0FFAEDD7CD30ABC95D8
11ED47A01B30D0FFAEDD7CD30ABC95D8
11ED47A01B30D0FFAEDD7CD30ABC95D8
11ED47A01B30D0FFAEDD7CD30ABC95D8
11ED47A01B30D0FFAEDD7CD30ABC95D8
11ED47A01B30D0FFAEDD7CD30ABC95D8
11ED47A01B30D0FFAEDD7CD30ABC95D8
11ED47A01B30D0FFAEDD7CD30ABC95D8
11ED47A01B30D0FFAEDD7CD30ABC95D8
11ED47A01B30D0FFAEDD7CD30ABC95D8
11ED47A01B30D0FFAEDD7CD30ABC95D8
11ED47A01B30D0FFAEDD7CD30ABC95D8
11ED47A01B30D0FFAEDD7CD30ABC95D8
11ED47A01B30D0FFAEDD7CD30ABC95D8
11ED47A01B30D0FFAEDD7CD30ABC95D8
11ED47A01B30D0FFAEDD7CD30ABC95D8
11ED47A01B30D0FFAEDD7CD30ABC95D8
11ED47A01B30D0FFAEDD7CD30ABC95D8
11ED47A01B30D0FFAEDD7CD30ABC95D8
11ED47A01B30D0FFAEDD7CD30ABC95D8
11ED47A01B30D0FFAEDD7CD30ABC95D8
11ED47A01B30D0FFAEDD7CD30ABC95D8
11ED47A01B30D0FFAEDD7CD30ABC95D8
11ED47A01B30D0FFAEDD7CD30ABC95D8
11ED47A01B30D0FFAEDD7CD30ABC95D8
11ED47A01B30D0FFAEDD7CD30ABC95D8
11ED47A01B30D0FFAEDD7CD30ABC95D8
11ED47A01B30D0FFAEDD7CD30ABC95D8
11ED47A01B30D0FFAEDD7CD30ABC95D8
11ED47A01B30D0FFAEDD7CD30ABC95D8
11ED47A01B30D0FFAEDD7CD30ABC95D8
11ED47A01B30D0FFAEDD7CD30ABC95D8
11ED47A01B30D0FFAEDD7CD30ABC95D8
11ED47A01B30D0FFAEDD7CD30ABC95D8
11ED47A01B30D0FFAEDD7CD30ABC95D8
11ED47A01B30D0FFAEDD7CD30ABC95D8
11ED47A01B30D0FFAEDD7CD30ABC95D8
11ED47A01B30D0FFAEDD7CD30ABC95D8
11ED47A01B30D0FFAEDD7CD30ABC95D8
11ED47A01B30D0FFAEDD7CD30ABC95D8
11ED47A01B30D0FFAEDD7CD30ABC95D8
11ED47A01B30D0FFAEDD7CD30ABC95D8
11ED47A01B30D0FFAEDD7CD30ABC95D8
11ED47A01B30D0FFAEDD7CD30ABC95D8
11ED47A01B30D0FFAEDD7CD30ABC95D8
11ED47A01B30D0FFAEDD7CD30ABC95D8
11ED47A01B30D0FFAEDD7CD30ABC95D8
11ED47A01B30D0FFAEDD7CD30ABC95D8
11ED47A01B30D0FFAEDD7CD30ABC95D8
11ED47A01B30D0FFAEDD7CD30ABC95D8
11ED47A01B30D0FFAEDD7CD30ABC95D8
11ED47A01B30D0FFAEDD7CD30ABC95D8
11ED47A01B30D0FFAEDD7CD30ABC95D8
11ED47A01B30D0FFAEDD7CD30ABC95D8
11ED47A01B30D0FFAEDD7CD30ABC95D8
11ED47A01B30D0FFAEDD7CD30ABC95D8
11ED47A01B30D0FFAEDD7CD30ABC95D8
11ED47A01B30D0FFAEDD7CD30ABC95D8
11ED47A01B30D0FFAEDD7CD30ABC95D8
11ED47A01B30D0FFAEDD7CD30ABC95D8
11ED47A01B30D0FFAEDD7CD30ABC95D8
11ED47A01B30D0FFAEDD7CD30ABC95D8
11ED47A01B30D0FFAEDD7CD30ABC95D8
11ED47A01B30D0FFAEDD7CD30ABC95D8
11ED47A01B30D0FFAEDD7CD30ABC95D8
11ED47A01B30D0FFAEDD7CD30ABC95D8
11ED47A01B30D0FFAEDD7CD30ABC95D8
11ED47A01B30D0FFAEDD7CD30ABC95D8
11ED47A01B30D0FFAEDD7CD30ABC95D8
11ED47A01B30D0FFAEDD7CD30ABC95D8
11ED47A01B30D0FFAEDD7CD30ABC95D8
11ED47A01B30D0FFAEDD7CD30ABC95D8
11ED47A01B30D0FFAEDD7CD30ABC95D8
11ED47A01B30D0FFAEDD7CD30ABC95D8
11ED47A01B30D0FFAEDD7CD30ABC95D8
11ED47A01B30D0FFAEDD7CD30ABC95D8
11ED47A01B30D0FFAEDD7CD30ABC95D8
11ED47A01B30D0FFAEDD7CD30ABC95D8
11ED47A01B30D0FFAEDD7CD30ABC95D8
11ED47A01B30D0FFAEDD7CD30ABC95D8
11ED47A01B30D0FFAEDD7CD30ABC95D8
11ED47A01B30D0FFAEDD7CD30ABC95D8
11ED47A01B30D0FFAEDD7CD30ABC95D8
11ED47A01B30D0FFAEDD7CD30ABC95D8
11ED47A01B30D0FFAEDD7CD30ABC95D8
11ED47A01B30D0FFAEDD7CD30ABC95D8
11ED47A01B30D0FFAEDD7CD30ABC95D8
11ED47A01B30D0FFAEDD7CD30ABC95D8
11ED47A01B30D0FFAEDD7CD30ABC95D8
11ED47A01B30D0FFAEDD7CD30ABC95D8
11ED47A01B30D0FFAEDD7CD30ABC95D8
11ED47A01B30D0FFAEDD7CD30ABC95D8
11ED47A01B30D0FFAEDD7CD30ABC95D8
11ED47A01B30D0FFAEDD7CD30ABC95D8
11ED47A01B30D0FFAEDD7CD30ABC95D8
11ED47A01B30D0FFAEDD7CD30ABC95D8
11ED47A01B30D0FFAEDD7CD30ABC95D8
11ED47A01B30D0FFAEDD7CD30ABC95D8
11ED47A01B30D0FFAEDD7CD30ABC95D8
11ED47A01B30D0FFAEDD7CD30ABC95D8
11ED47A01B30D0FFAEDD7CD30ABC95D8
11ED47A01B30D0FFAEDD7CD30ABC95D8
11ED47A01B30D0FFAEDD7CD30ABC95D8
11ED47A01B30D0FFAEDD7CD30ABC95D8
11ED47A01B30D0FFAEDD7CD30ABC95D8
11ED47A01B30D0FFAEDD7CD30ABC95D8
11ED47A01B30D0FFAEDD7CD30ABC95D8
11ED47A01B30D0FFAEDD7CD30ABC95D8
11ED47A01B30D0FFAEDD7CD30ABC95D8
11ED47A01B30D0FFAEDD7CD30ABC95D8
11ED47A01B30D0FFAEDD7CD30ABC95D8
11ED47A01B30D0FFAEDD7CD30ABC95D8
11ED47A01B30D0FFAEDD7CD30ABC95D8
11ED47A01B30D0FFAEDD7CD30ABC95D8
11ED47A01B30D0FFAEDD7CD30ABC95D8
11ED47A01B30D0FFAEDD7CD30ABC95D8
11ED47A01B30D0FFAEDD7CD30ABC95D8
11ED47A01B30D0FFAEDD7CD30ABC95D8
11ED47A01B30D0FFAEDD7CD30ABC95D8
11ED47A01B30D0FFAEDD7CD30ABC95D8
11ED47A01B30D0FFAEDD7CD30ABC95D8
11ED47A01B30D0FFAEDD7CD30ABC95D8
11ED47A01B30D0FFAEDD7CD30ABC95D8
11ED47A01B30D0FFAEDD7CD30ABC95D8
11ED47A01B30D0FFAEDD7CD30ABC95D8
11ED47A01B30D0FFAEDD7CD30ABC95D8
11ED47A01B30D0FFAEDD7CD30ABC95D8
11ED47A01B30D0FFAEDD7CD30ABC95D8
11ED47A01B30D0FFAEDD7CD30ABC95D8
11ED47A01B30D0FFAEDD7CD30ABC95D8
11ED47A01B30D0FFAEDD7CD30ABC95D8
11ED47A01B30D0FFAEDD7CD30ABC95D8
11ED47A01B30D0FFAEDD7CD30ABC95D8
11ED47A01B30D0FFAEDD7CD30ABC95D8
11ED47A01B30D0FFAEDD7CD30ABC95D8
11ED47A01B30D0FFAEDD7CD30ABC95D8
11ED47A01B30D0FFAEDD7CD30ABC95D8
11ED47A01B30D0FFAEDD7CD30ABC95D8
11ED47A01B30D0FFAEDD7CD30ABC95D8
11ED47A01B30D0FFAEDD7CD30ABC95D8
11ED47A01B30D0FFAEDD7CD30ABC95D8
11ED47A01B30D0FFAEDD7CD30ABC95D8
11ED47A01B30D0FFAEDD7CD30ABC95D8
11ED47A01B30D0FFAEDD7CD30ABC95D8
11ED47A01B30D0FFAEDD7CD30ABC95D8
11ED47A01B30D0FFAEDD7CD30ABC95D8
11ED47A01B30D0FFAEDD7CD30ABC95D8
11ED47A01B30D0FFAEDD7CD30ABC95D8
11ED47A01B30D0FFAEDD7CD30ABC95D8
11ED47A01B30D0FFAEDD7CD30ABC95D8
11ED47A01B30D0FFAEDD7CD30ABC95D8
11ED47A01B30D0FFAEDD7CD30ABC95D8
11ED47A01B30D0FFAEDD7CD30ABC95D8
11ED47A01B30D0FFAEDD7CD30ABC95D8
11ED47A01B30D0FFAEDD7CD30ABC95D8
11ED47A01B30D0FFAEDD7CD30ABC95D8
11ED47A01B30D0FFAEDD7CD30ABC95D8
11ED47A01B30D0FFAEDD7CD30ABC95D8
11ED47A01B30D0FFAEDD7CD30ABC95D8
11ED47A01B30D0FFAEDD7CD30ABC95D8
11ED47A01B30D0FFAEDD7CD30ABC95D8
11ED47A01B30D0FFAEDD7CD30ABC95D8
11ED47A01B30D0FFAEDD7CD30ABC95D8
11ED47A01B30D0FFAEDD7CD30ABC95D8
11ED47A01B30D0FFAEDD7CD30ABC95D8
11ED47A01B30D0FFAEDD7CD30ABC95D8
11ED47A01B30D0FFAEDD7CD30ABC95D8
11ED47A01B30D0FFAEDD7CD30ABC95D8
11ED47A01B30D0FFAEDD7CD30ABC95D8
11ED47A01B30D0FFAEDD7CD30ABC95D8
11ED47A01B30D0FFAEDD7CD30ABC95D8
11ED47A01B30D0FFAEDD7CD30ABC95D8
11ED47A01B30D0FFAEDD7CD30ABC95D8
11ED47A01B30D0FFAEDD7CD30ABC95D8
11ED47A01B30D0FFAEDD7CD30ABC95D8
11ED47A01B30D0FFAEDD7CD30ABC95D8
11ED47A01B30D0FFAEDD7CD30ABC95D8
11ED47A01B30D0FFAEDD7CD30ABC95D8
11ED47A01B30D0FFAEDD7CD30ABC95D8
11ED47A01B30D0FFAEDD7CD30ABC95D8
11ED47A01B30D0FFAEDD7CD30ABC95D8
11ED47A01B30D0FFAEDD7CD30ABC95D8
11ED47A01B30D0FFAEDD7CD30ABC95D8
11ED47A01B30D0FFAEDD7CD30ABC95D8
11ED47A01B30D0FFAEDD7CD30ABC95D8
11ED47A01B30D0FFAEDD7CD30ABC95D8
11ED47A01B30D0FFAEDD7CD30ABC95D8
11ED47A01B30D0FFAEDD7CD30ABC95D8
11ED47A01B30D0FFAEDD7CD30ABC95D8
11ED47A01B30D0FFAEDD7CD30ABC95D8
11ED47A01B30D0FFAEDD7CD30ABC95D8
11ED47A01B30D0FFAEDD7CD30ABC95D8
11ED47A01B30D0FFAEDD7CD30ABC95D8
11ED47A01B30D0FFAEDD7CD30ABC95D8
11ED47A01B30D0FFAEDD7CD30ABC95D8
11ED47A01B30D0FFAEDD7CD30ABC95D8
11ED47A01B30D0FFAEDD7CD30ABC95D8
11ED47A01B30D0FFAEDD7CD30ABC95D8
11ED47A01B30D0FFAEDD7CD30ABC95D8
11ED47A01B30D0FFAEDD7CD30ABC95D8
11ED47A01B30D0FFAEDD7CD30ABC95D8
11ED47A01B30D0FFAEDD7CD30ABC95D8
11ED47A01B30D0FFAEDD7CD30ABC95D8
11ED47A01B30D0FFAEDD7CD30ABC95D8
11ED47A01B30D0FFAEDD7CD30ABC95D8
11ED47A01B30D0FFAEDD7CD30ABC95D8
11ED47A01B30D0FFAEDD7CD30ABC95D8
11ED47A01B30D0FFAEDD7CD30ABC95D8
11ED47A01B30D0FFAEDD7CD30ABC95D8
11ED47A01B30D0FFAEDD7CD30ABC95D8
11ED47A01B30D0FFAEDD7CD30ABC95D8
11ED47A01B30D0FFAEDD7CD30ABC95D8
11ED47A01B30D0FFAEDD7CD30ABC95D8
11ED47A01B30D0FFAEDD7CD30ABC95D8
11ED47A01B30D0FFAEDD7CD30ABC95D8
11ED47A01B30D0FFAEDD7CD30ABC95D8
11ED47A01B30D0FFAEDD7CD30ABC95D8
11ED47A01B30D0FFAEDD7CD30ABC95D8
11ED47A01B30D0FFAEDD7CD30ABC95D8
11ED47A01B30D0FFAEDD7CD30ABC95D8
11ED47A01B30D0FFAEDD7CD30ABC95D8
11ED47A01B30D0FFAEDD7CD30ABC95D8
11ED47A01B30D0FFAEDD7CD30ABC95D8
11ED47A01B30D0FFAEDD7CD30ABC95D8
11ED47A01B30D0FFAEDD7CD30ABC95D8
11ED47A01B30D0FFAEDD7CD30ABC95D8
11ED47A01B30D0FFAEDD7CD30ABC95D8
11ED47A01B30D0FFAEDD7CD30ABC95D8
11ED47A01B30D0FFAEDD7CD30ABC95D8
11ED47A01B30D0FFAEDD7CD30ABC95D8
11ED47A01B30D0FFAEDD7CD30ABC95D8
11ED47A01B30D0FFAEDD7CD30ABC95D8
11ED47A01B30D0FFAEDD7CD30ABC95D8
11ED47A01B30D0FFAEDD7CD30ABC95D8
11ED47A01B30D0FFAEDD7CD30ABC95D8
11ED47A01B30D0FFAEDD7CD30ABC95D8
11ED47A01B30D0FFAEDD7CD30ABC95D8
11ED47A01B30D0FFAEDD7CD30ABC95D8
11ED47A01B30D0FFAEDD7CD30ABC95D8
11ED47A01B30D0FFAEDD7CD30ABC95D8
11ED47A01B30D0FFAEDD7CD30ABC95D8
11ED47A01B30D0FFAEDD7CD30ABC95D8
11ED47A01B30D0FFAEDD7CD30ABC95D8
11ED47A01B30D0FFAEDD7CD30ABC95D8
11ED47A01B30D0FFAEDD7CD30ABC95D8
11ED47A01B30D0FFAEDD7CD30ABC95D8
11ED47A01B30D0FFAEDD7CD30ABC95D8
11ED47A01B30D0FFAEDD7CD30ABC95D8
11ED47A01B30D0FFAEDD7CD30ABC95D8
11ED47A01B30D0FFAEDD7CD30ABC95D8
11ED47A01B30D0FFAEDD7CD30ABC95D8
11ED47A01B30D0FFAEDD7CD30ABC95D8
11ED47A01B30D0FFAEDD7CD30ABC95D8
11ED47A01B30D0FFAEDD7CD30ABC95D8
11ED47A01B30D0FFAEDD7CD30ABC95D8
11ED47A01B30D0FFAEDD7CD30ABC95D8
11ED47A01B30D0FFAEDD7CD30ABC95D8
11ED47A01B30D0FFAEDD7CD30ABC95D8
11ED47A01B30D0FFAEDD7CD30ABC95D8
11ED47A01B30D0FFAEDD7CD30ABC95D8
11ED47A01B30D0FFAEDD7CD30ABC95D8
11ED47A01B30D0FFAEDD7CD30ABC95D8
11ED47A01B30D0FFAEDD7CD30ABC95D8
11ED47A01B30D0FFAEDD7CD30ABC95D8
11ED47A01B30D0FFAEDD7CD30ABC95D8
11ED47A01B30D0FFAEDD7CD30ABC95D8
11ED47A01B30D0FFAEDD7CD30ABC95D8
11ED47A01B30D0FFAEDD7CD30ABC95D8
11ED47A01B30D0FFAEDD7CD30ABC95D8
11ED47A01B30D0FFAEDD7CD30ABC95D8
11ED47A01B30D0FFAEDD7CD30ABC95D8
11ED47A01B30D0FFAEDD7CD30ABC95D8
11ED47A01B30D0FFAEDD7CD30ABC95D8
11ED47A01B30D0FFAEDD7CD30ABC95D8
11ED47A01B30D0FFAEDD7CD30ABC95D8
11ED47A01B30D0FFAEDD7CD30ABC95D8
11ED47A01B30D0FFAEDD7CD30ABC95D8
11ED47A01B30D0FFAEDD7CD30ABC95D8
11ED47A01B30D0FFAEDD7CD30ABC95D8
11ED47A01B30D0FFAEDD7CD30ABC95D8
11ED47A01B30D0FFAEDD7CD30ABC95D8
11ED47A01B30D0FFAEDD7CD30ABC95D8
11ED47A01B30D0FFAEDD7CD30ABC95D8
11ED47A01B30D0FFAEDD7CD30ABC95D8
11ED47A01B30D0FFAEDD7CD30ABC95D8
11ED47A01B30D0FFAEDD7CD30ABC95D8
11ED47A01B30D0FFAEDD7CD30ABC95D8
11ED47A01B30D0FFAEDD7CD30ABC95D8
11ED47A01B30D0FFAEDD7CD30ABC95D8
11ED47A01B30D0FFAEDD7CD30ABC95D8
11ED47A01B30D0FFAEDD7CD30ABC95D8
11ED47A01B30D0FFAEDD7CD30ABC95D8
11ED47A01B30D0FFAEDD7CD30ABC95D8
11ED47A01B30D0FFAEDD7CD30ABC95D8
11ED47A01B30D0FFAEDD7CD30ABC95D8
11ED47A01B30D0FFAEDD7CD30ABC95D8
11ED47A01B30D0FFAEDD7CD30ABC95D8
11ED47A01B30D0FFAEDD7CD30ABC95D8
11ED47A01B30D0FFAEDD7CD30ABC95D8
11ED47A01B30D0FFAEDD7CD30ABC95D8
11ED47A01B30D0FFAEDD7CD30ABC95D8
11ED47A01B30D0FFAEDD7CD30ABC95D8
11ED47A01B30D0FFAEDD7CD30ABC95D8
11ED47A01B30D0FFAEDD7CD30ABC95D8
11ED47A01B30D0FFAEDD7CD30ABC95D8
11ED47A01B30D0FFAEDD7CD30ABC95D8
11ED47A01B30D0FFAEDD7CD30ABC95D8
11ED47A01B30D0FFAEDD7CD30ABC95D8
11ED47A01B30D0FFAEDD7CD30ABC95D8
11ED47A01B30D0FFAEDD7CD30ABC95D8
11ED47A01B30D0FFAEDD7CD30ABC95D8
11ED47A01B30D0FFAEDD7CD30ABC95D8
11ED47A01B30D0FFAEDD7CD30ABC95D8
11ED47A01B30D0FFAEDD7CD30ABC95D8
11ED47A01B30D0FFAEDD7CD30ABC95D8
11ED47A01B30D0FFAEDD7CD30ABC95D8
11ED47A01B30D0FFAEDD7CD30ABC95D8
11ED47A01B30D0FFAEDD7CD30ABC95D8
11ED47A01B30D0FFAEDD7CD30ABC95D8
11ED47A01B30D0FFAEDD7CD30ABC95D8
11ED47A01B30D0FFAEDD7CD30ABC95D8
11ED47A01B30D0FFAEDD7CD30ABC95D8
11ED47A01B30D0FFAEDD7CD30ABC95D8
11ED47A01B30D0FFAEDD7CD30ABC95D8
11ED47A01B30D0FFAEDD7CD30ABC95D8
11ED47A01B30D0FFAEDD7CD30ABC95D8
11ED47A01B30D0FFAEDD7CD30ABC95D8
11ED47A01B30D0FFAEDD7CD30ABC95D8
11ED47A01B30D0FFAEDD7CD30ABC95D8
11ED47A01B30D0FFAEDD7CD30ABC95D8
11ED47A01B30D0FFAEDD7CD30ABC95D8
11ED47A01B30D0FFAEDD7CD30ABC95D8
11ED47A01B30D0FFAEDD7CD30ABC95D8
11ED47A01B30D0FFAEDD7CD30ABC95D8
11ED47A01B30D0FFAEDD7CD30ABC95D8
11ED47A01B30D0FFAEDD7CD30ABC95D8
11ED47A01B30D0FFAEDD7CD30ABC95D8
11ED47A01B30D0FFAEDD7CD30ABC95D8
11ED47A01B30D0FFAEDD7CD30ABC95D8
11ED47A01B30D0FFAEDD7CD30ABC95D8
11ED47A01B30D0FFAEDD7CD30ABC95D8
11ED47A01B30D0FFAEDD7CD30ABC95D8
11ED47A01B30D0FFAEDD7CD30ABC95D8
11ED47A01B30D0FFAEDD7CD30ABC95D8
11ED47A01B30D0FFAEDD7CD30ABC95D8
11ED47A01B30D0FFAEDD7CD30ABC95D8
11ED47A01B30D0FFAEDD7CD30ABC95D8
11ED47A01B30D0FFAEDD7CD30ABC95D8
11ED47A01B30D0FFAEDD7CD30ABC95D8
11ED47A01B30D0FFAEDD7CD30ABC95D8
11ED47A01B30D0FFAEDD7CD30ABC95D8
11ED47A01B30D0FFAEDD7CD30ABC95D8
11ED47A01B30D0FFAEDD7CD30ABC95D8
11ED47A01B30D0FFAEDD7CD30ABC95D8
11ED47A01B30D0FFAEDD7CD30ABC95D8
11ED47A01B30D0FFAEDD7CD30ABC95D8
11ED47A01B30D0FFAEDD7CD30ABC95D8
11ED47A01B30D0FFAEDD7CD30ABC95D8
11ED47A01B30D0FFAEDD7CD30ABC95D8
11ED47A01B30D0FFAEDD7CD30ABC95D8
11ED47A01B30D0FFAEDD7CD30ABC95D8
11ED47A01B30D0FFAEDD7CD30ABC95D8
11ED47A01B30D0FFAEDD7CD30ABC95D8
11ED47A01B30D0FFAEDD7CD30ABC95D8
11ED47A01B30D0FFAEDD7CD30ABC95D8
11ED47A01B30D0FFAEDD7CD30ABC95D8
11ED47A01B30D0FFAEDD7CD30ABC95D8
11ED47A01B30D0FFAEDD7CD30ABC95D8
11ED47A01B30D0FFAEDD7CD30ABC95D8
11ED47A01B30D0FFAEDD7CD30ABC95D8
11ED47A01B30D0FFAEDD7CD30ABC95D8
11ED47A01B30D0FFAEDD7CD30ABC95D8
11ED47A01B30D0FFAEDD7CD30ABC95D8
11ED47A01B30D0FFAEDD7CD30ABC95D8
11ED47A01B30D0FFAEDD7CD30ABC95D8
11ED47A01B30D0FFAEDD7CD30ABC95D8
11ED47A01B30D0FFAEDD7CD30ABC95D8
11ED47A01B30D0FFAEDD7CD30ABC95D8
11ED47A01B30D0FFAEDD7CD30ABC95D8
11ED47A01B30D0FFAEDD7CD30ABC95D8
11ED47A01B30D0FFAEDD7CD30ABC95D8
11ED47A01B30D0FFAEDD7CD30ABC95D8
11ED47A01B30D0FFAEDD7CD30ABC95D8
11ED47A01B30D0FFAEDD7CD30ABC95D8
11ED47A01B30D0FFAEDD7CD30ABC95D8
11ED47A01B30D0FFAEDD7CD30ABC95D8
11ED47A01B30D0FFAEDD7CD30ABC95D8
11ED47A01B30D0FFAEDD7CD30ABC95D8
11ED47A01B30D0FFAEDD7CD30ABC95D8
11ED47A01B30D0FFAEDD7CD30ABC95D8
11ED47A01B30D0FFAEDD7CD30ABC95D8
11ED47A01B30D0FFAEDD7CD30ABC95D8
11ED47A01B30D0FFAEDD7CD30ABC95D8
11ED47A01B30D0FFAEDD7CD30ABC95D8
11ED47A01B30D0FFAEDD7CD30ABC95D8
11ED47A01B30D0FFAEDD7CD30ABC95D8
11ED47A01B30D0FFAEDD7CD30ABC95D8
11ED47A01B30D0FFAEDD7CD30ABC95D8
11ED47A01B30D0FFAEDD7CD30ABC95D8
11ED47A01B30D0FFAEDD7CD30ABC95D8
11ED47A01B30D0FFAEDD7CD30ABC95D8
11ED47A01B30D0FFAEDD7CD30ABC95D8
11ED47A01B30D0FFAEDD7CD30ABC95D8
11ED47A01B30D0FFAEDD7CD30ABC95D8
11ED47A01B30D0FFAEDD7CD30ABC95D8
11ED47A01B30D0FFAEDD7CD30ABC95D8
11ED47A01B30D0FFAEDD7CD30ABC95D8
11ED47A01B30D0FFAEDD7CD30ABC95D8
11ED47A01B30D0FFAEDD7CD30ABC95D8
11ED47A01B30D0FFAEDD7CD30ABC95D8
11ED47A01B30D0FFAEDD7CD30ABC95D8
11ED47A01B30D0FFAEDD7CD30ABC95D8
11ED47A01B30D0FFAEDD7CD30ABC95D8
11ED47A01B30D0FFAEDD7CD30ABC95D8
11ED47A01B30D0FFAEDD7CD30ABC95D8
11ED47A01B30D0FFAEDD7CD30ABC95D8
11ED47A01B30D0FFAEDD7CD30ABC95D8
11ED47A01B30D0FFAEDD7CD30ABC95D8
11ED47A01B30D0FFAEDD7CD30ABC95D8
11ED47A01B30D0FFAEDD7CD30ABC95D8
11ED47A01B30D0FFAEDD7CD30ABC95D8
11ED47A01B30D0FFAEDD7CD30ABC95D8
11ED47A01B30D0FFAEDD7CD30ABC95D8
11ED47A01B30D0FFAEDD7CD30ABC95D8
11ED47A01B30D0FFAEDD7CD30ABC95D8
11ED47A01B30D0FFAEDD7CD30ABC95D8
11ED47A01B30D0FFAEDD7CD30ABC95D8
11ED47A01B30D0FFAEDD7CD30ABC95D8
11ED47A01B30D0FFAEDD7CD30ABC95D8
11ED47A01B30D0FFAEDD7CD30ABC95D8
11ED47A01B30D0FFAEDD7CD30ABC95D8
11ED47A01B30D0FFAEDD7CD30ABC95D8
11ED47A01B30D0FFAEDD7CD30ABC95D8
11ED47A01B30D0FFAEDD7CD30ABC95D8
11ED47A01B30D0FFAEDD7CD30ABC95D8
11ED47A01B30D0FFAEDD7CD30ABC95D8
11ED47A01B30D0FFAEDD7CD30ABC95D8
11ED47A01B30D0FFAEDD7CD30ABC95D8
11ED47A01B30D0FFAEDD7CD30ABC95D8
11ED47A01B30D0FFAEDD7CD30ABC95D8
11ED47A01B30D0FFAEDD7CD30ABC95D8
11ED47A01B30D0FFAEDD7CD30ABC95D8
11ED47A01B30D0FFAEDD7CD30ABC95D8
11ED47A01B30D0FFAEDD7CD30ABC95D8
11ED47A01B30D0FFAEDD7CD30ABC95D8
11ED47A01B30D0FFAEDD7CD30ABC95D8
11ED47A01B30D0FFAEDD7CD30ABC95D8
11ED47A01B30D0FFAEDD7CD30ABC95D8
11ED47A01B30D0FFAEDD7CD30ABC95D8
11ED47A01B30D0FFAEDD7CD30ABC95D8
11ED47A01B30D0FFAEDD7CD30ABC95D8
11ED47A01B30D0FFAEDD7CD30ABC95D8
11ED47A01B30D0FFAEDD7CD30ABC95D8
11ED47A01B30D0FFAEDD7CD30ABC95D8
11ED47A01B30D0FFAEDD7CD30ABC95D8
11ED47A01B30D0FFAEDD7CD30ABC95D8
11ED47A01B30D0FFAEDD7CD30ABC95D8
11ED47A01B30D0FFAEDD7CD30ABC95D8
11ED47A01B30D0FFAEDD7CD30ABC95D8
11ED47A01B30D0FFAEDD7CD30ABC95D8
11ED47A01B30D0FFAEDD7CD30ABC95D8
11ED47A01B30D0FFAEDD7CD30ABC95D8
11ED47A01B30D0FFAEDD7CD30ABC95D8
11ED47A01B30D0FFAEDD7CD30ABC95D8
11ED47A01B30D0FFAEDD7CD30ABC95D8
11ED47A01B30D0FFAEDD7CD30ABC95D8
11ED47A01B30D0FFAEDD7CD30ABC95D8
11ED47A01B30D0FFAEDD7CD30ABC95D8
11ED47A01B30D0FFAEDD7CD30ABC95D8
11ED47A01B30D0FFAEDD7CD30ABC95D8
11ED47A01B30D0FFAEDD7CD30ABC95D8
11ED47A01B30D0FFAEDD7CD30ABC95D8
11ED47A01B30D0FFAEDD7CD30ABC95D8
11ED47A01B30D0FFAEDD7CD30ABC95D8
11ED47A01B30D0FFAEDD7CD30ABC95D8
11ED47A01B30D0FFAEDD7CD30ABC95D8
11ED47A01B30D0FFAEDD7CD30ABC95D8
11ED47A01B30D0FFAEDD7CD30ABC95D8
11ED47A01B30D0FFAEDD7CD30ABC95D8
11ED47A01B30D0FFAEDD7CD30ABC95D8
11ED47A01B30D0FFAEDD7CD30ABC95D8
11ED47A01B30D0FFAEDD7CD30ABC95D8
11ED47A01B30D0FFAEDD7CD30ABC95D8
11ED47A01B30D0FFAEDD7CD30ABC95D8
11ED47A01B30D0FFAEDD7CD30ABC95D8
11ED47A01B30D0FFAEDD7CD30ABC95D8
11ED47A01B30D0FFAEDD7CD30ABC95D8
11ED47A01B30D0FFAEDD7CD30ABC95D8
11ED47A01B30D0FFAEDD7CD30ABC95D8
11ED47A01B30D0FFAEDD7CD30ABC95D8
11ED47A01B30D0FFAEDD7CD30ABC95D8
11ED47A01B30D0FFAEDD7CD30ABC95D8
11ED47A01B30D0FFAEDD7CD30ABC95D8
11ED47A01B30D0FFAEDD7CD30ABC95D8
11ED47A01B30D0FFAEDD7CD30ABC95D8
11ED47A01B30D0FFAEDD7CD30ABC95D8
11ED47A01B30D0FFAEDD7CD30ABC95D8
11ED47A01B30D0FFAEDD7CD30ABC95D8
11ED47A01B30D0FFAEDD7CD30ABC95D8
11ED47A01B30D0FFAEDD7CD30ABC95D8
11ED47A01B30D0FFAEDD7CD30ABC95D8
11ED47A01B30D0FFAEDD7CD30ABC95D8
11ED47A01B30D0FFAEDD7CD30ABC95D8
11ED47A01B30D0FFAEDD7CD30ABC95D8
11ED47A01B30D0FFAEDD7CD30ABC95D8
11ED47A01B30D0FFAEDD7CD30ABC95D8
11ED47A01B30D0FFAEDD7CD30ABC95D8
11ED47A01B30D0FFAEDD7CD30ABC95D8
11ED47A01B30D0FFAEDD7CD30ABC95D8
11ED47A01B30D0FFAEDD7CD30ABC95D8
11ED47A01B30D0FFAEDD7CD30ABC95D8
11ED47A01B30D0FFAEDD7CD30ABC95D8
11ED47A01B30D0FFAEDD7CD30ABC95D8
11ED47A01B30D0FFAEDD7CD30ABC95D8
11ED47A01B30D0FFAEDD7CD30ABC95D8
11ED47A01B30D0FFAEDD7CD30ABC95D8
11ED47A01B30D0FFAEDD7CD30ABC95D8
11ED47A01B30D0FFAEDD7CD30ABC95D8
11ED47A01B30D0FFAEDD7CD30ABC95D8
11ED47A01B30D0FFAEDD7CD30ABC95D8
11ED47A01B30D0FFAEDD7CD30ABC95D8
11ED47A01B30D0FFAEDD7CD30ABC95D8
11ED47A01B30D0FFAEDD7CD30ABC95D8
11ED47A01B30D0FFAEDD7CD30ABC95D8
11ED47A01B30D0FFAEDD7CD30ABC95D8
11ED47A01B30D0FFAEDD7CD30ABC95D8
11ED47A01B30D0FFAEDD7CD30ABC95D8
11ED47A01B30D0FFAEDD7CD30ABC95D8
11ED47A01B30D0FFAEDD7CD30ABC95D8
11ED47A01B30D0FFAEDD7CD30ABC95D8
11ED47A01B30D0FFAEDD7CD30ABC95D8
11ED47A01B30D0FFAEDD7CD30ABC95D8
11ED47A01B30D0FFAEDD7CD30ABC95D8
11ED47A01B30D0FFAEDD7CD30ABC95D8
11ED47A01B30D0FFAEDD7CD30ABC95D8
11ED47A01B30D0FFAEDD7CD30ABC95D8
11ED47A01B30D0FFAEDD7CD30ABC95D8
11ED47A01B30D0FFAEDD7CD30ABC95D8
11ED47A01B30D0FFAEDD7CD30ABC95D8
11ED47A01B30D0FFAEDD7CD30ABC95D8
11ED47A01B30D0FFAEDD7CD30ABC95D8
11ED47A01B30D0FFAEDD7CD30ABC95D8
11ED47A01B30D0FFAEDD7CD30ABC95D8
11ED47A01B30D0FFAEDD7CD30ABC95D8
11ED47A01B30D0FFAEDD7CD30ABC95D8
11ED47A01B30D0FFAEDD7CD30ABC95D8
11ED47A01B30D0FFAEDD7CD30ABC95D8
11ED47A01B30D0FFAEDD7CD30ABC95D8
11ED47A01B30D0FFAEDD7CD30ABC95D8
11ED47A01B30D0FFAEDD7CD30ABC95D8
11ED47A01B30D0FFAEDD7CD30ABC95D8
11ED47A01B30D0FFAEDD7CD30ABC95D8
11ED47A01B30D0FFAEDD7CD30ABC95D8
11ED47A01B30D0FFAEDD7CD30ABC95D8
11ED47A01B30D0FFAEDD7CD30ABC95D8
11ED47A01B30D0FFAEDD7CD30ABC95D8
11ED47A01B30D0FFAEDD7CD30ABC95D8
11ED47A01B30D0FFAEDD7CD30ABC95D8
11ED47A01B30D0FFAEDD7CD30ABC95D8
11ED47A01B30D0FFAEDD7CD30ABC95D8
11ED47A01B30D0FFAEDD7CD30ABC95D8
11ED47A01B30D0FFAEDD7CD30ABC95D8
11ED47A01B30D0FFAEDD7CD30ABC95D8
11ED47A01B30D0FFAEDD7CD30ABC95D8
11ED47A01B30D0FFAEDD7CD30ABC95D8
11ED47A01B30D0FFAEDD7CD30ABC95D8
11ED47A01B30D0FFAEDD7CD30ABC95D8
11ED47A01B30D0FFAEDD7CD30ABC95D8
11ED47A01B30D0FFAEDD7CD30ABC95D8
11ED47A01B30D0FFAEDD7CD30ABC95D8
11ED47A01B30D0FFAEDD7CD30ABC95D8
11ED47A01B30D0FFAEDD7CD30ABC95D8
11ED47A01B30D0FFAEDD7CD30ABC95D8
11ED47A01B30D0FFAEDD7CD30ABC95D8
11ED47A01B30D0FFAEDD7CD30ABC95D8
11ED47A01B30D0FFAEDD7CD30ABC95D8
11ED47A01B30D0FFAEDD7CD30ABC95D8
11ED47A01B30D0FFAEDD7CD30ABC95D8
11ED47A01B30D0FFAEDD7CD30ABC95D8
11ED47A01B30D0FFAEDD7CD30ABC95D8
11ED47A01B30D0FFAEDD7CD30ABC95D8
11ED47A01B30D0FFAEDD7CD30ABC95D8
11ED47A01B30D0FFAEDD7CD30ABC95D8
11ED47A01B30D0FFAEDD7CD30ABC95D8
11ED47A01B30D0FFAEDD7CD30ABC95D8
11ED47A01B30D0FFAEDD7CD30ABC95D8
11ED47A01B30D0FFAEDD7CD30ABC95D8
11ED47A01B30D0FFAEDD7CD30ABC95D8
11ED47A01B30D0FFAEDD7CD30ABC95D8
11ED47A01B30D0FFAEDD7CD30ABC95D8
11ED47A01B30D0FFAEDD7CD30ABC95D8
11ED47A01B30D0FFAEDD7CD30ABC95D8
11ED47A01B30D0FFAEDD7CD30ABC95D8
11ED47A01B30D0FFAEDD7CD30ABC95D8
11ED47A01B30D0FFAEDD7CD30ABC95D8
11ED47A01B30D0FFAEDD7CD30ABC95D8
11ED47A01B30D0FFAEDD7CD30ABC95D8
11ED47A01B30D0FFAEDD7CD30ABC95D8
11ED47A01B30D0FFAEDD7CD30ABC95D8
11ED47A01B30D0FFAEDD7CD30ABC95D8
11ED47A01B30D0FFAEDD7CD30ABC95D8
11ED47A01B30D0FFAEDD7CD30ABC95D8
11ED47A01B30D0FFAEDD7CD30ABC95D8
11ED47A01B30D0FFAEDD7CD30ABC95D8
11ED47A01B30D0FFAEDD7CD30ABC95D8
11ED47A01B30D0FFAEDD7CD30ABC95D8
11ED47A01B30D0FFAEDD7CD30ABC95D8
11ED47A01B30D0FFAEDD7CD30ABC95D8
11ED47A01B30D0FFAEDD7CD30ABC95D8
11ED47A01B30D0FFAEDD7CD30ABC95D8
11ED47A01B30D0FFAEDD7CD30ABC95D8
11ED47A01B30D0FFAEDD7CD30ABC95D8
11ED47A01B30D0FFAEDD7CD30ABC95D8
11ED47A01B30D0FFAEDD7CD30ABC95D8
11ED47A01B30D0FFAEDD7CD30ABC95D8
11ED47A01B30D0FFAEDD7CD30ABC95D8
11ED47A01B30D0FFAEDD7CD30ABC95D8
11ED47A01B30D0FFAEDD7CD30ABC95D8
11ED47A01B30D0FFAEDD7CD30ABC95D8
11ED47A01B30D0FFAEDD7CD30ABC95D8
11ED47A01B30D0FFAEDD7CD30ABC95D8
11ED47A01B30D0FFAEDD7CD30ABC95D8
11ED47A01B30D0FFAEDD7CD30ABC95D8
11ED47A01B30D0FFAEDD7CD30ABC95D8
11ED47A01B30D0FFAEDD7CD30ABC95D8
11ED47A01B30D0FFAEDD7CD30ABC95D8
11ED47A01B30D0FFAEDD7CD30ABC95D8
11ED47A01B30D0FFAEDD7CD30ABC95D8
11ED47A01B30D0FFAEDD7CD30ABC95D8
11ED47A01B30D0FFAEDD7CD30ABC95D8
11ED47A01B30D0FFAEDD7CD30ABC95D8
11ED47A01B30D0FFAEDD7CD30ABC95D8
11ED47A01B30D0FFAEDD7CD30ABC95D8
11ED47A01B30D0FFAEDD7CD30ABC95D8
11ED47A01B30D0FFAEDD7CD30ABC95D8
11ED47A01B30D0FFAEDD7CD30ABC95D8
11ED47A01B30D0FFAEDD7CD30ABC95D8
11ED47A01B30D0FFAEDD7CD30ABC95D8
11ED47A01B30D0FFAEDD7CD30ABC95D8
11ED47A01B30D0FFAEDD7CD30ABC95D8
11ED47A01B30D0FFAEDD7CD30ABC95D8
11ED47A01B30D0FFAEDD7CD30ABC95D8
11ED47A01B30D0FFAEDD7CD30ABC95D8
11ED47A01B30D0FFAEDD7CD30ABC95D8
11ED47A01B30D0FFAEDD7CD30ABC95D8
11ED47A01B30D0FFAEDD7CD30ABC95D8
11ED47A01B30D0FFAEDD7CD30ABC95D8
11ED47A01B30D0FFAEDD7CD30ABC95D8
11ED47A01B30D0FFAEDD7CD30ABC95D8
11ED47A01B30D0FFAEDD7CD30ABC95D8
11ED47A01B30D0FFAEDD7CD30ABC95D8
11ED47A01B30D0FFAEDD7CD30ABC95D8
11ED47A01B30D0FFAEDD7CD30ABC95D8
11ED47A01B30D0FFAEDD7CD30ABC95D8
11ED47A01B30D0FFAEDD7CD30ABC95D8
11ED47A01B30D0FFAEDD7CD30ABC95D8
11ED47A01B30D0FFAEDD7CD30ABC95D8
11ED47A01B30D0FFAEDD7CD30ABC95D8
11ED47A01B30D0FFAEDD7CD30ABC95D8
11ED47A01B30D0FFAEDD7CD30ABC95D8
11ED47A01B30D0FFAEDD7CD30ABC95D8
11ED47A01B30D0FFAEDD7CD30ABC95D8
11ED47A01B30D0FFAEDD7CD30ABC95D8
11ED47A01B30D0FFAEDD7CD30ABC95D8
11ED47A01B30D0FFAEDD7CD30ABC95D8
11ED47A01B30D0FFAEDD7CD30ABC95D8
11ED47A01B30D0FFAEDD7CD30ABC95D8
11ED47A01B30D0FFAEDD7CD30ABC95D8
11ED47A01B30D0FFAEDD7CD30ABC95D8
11ED47A01B30D0FFAEDD7CD30ABC95D8
11ED47A01B30D0FFAEDD7CD30ABC95D8
11ED47A01B30D0FFAEDD7CD30ABC95D8
11ED47A01B30D0FFAEDD7CD30ABC95D8
11ED47A01B30D0FFAEDD7CD30ABC95D8
11ED47A01B30D0FFAEDD7CD30ABC95D8
11ED47A01B30D0FFAEDD7CD30ABC95D8
11ED47A01B30D0FFAEDD7CD30ABC95D8
11ED47A01B30D0FFAEDD7CD30ABC95D8
11ED47A01B30D0FFAEDD7CD30ABC95D8
11ED47A01B30D0FFAEDD7CD30ABC95D8
11ED47A01B30D0FFAEDD7CD30ABC95D8
11ED47A01B30D0FFAEDD7CD30ABC95D8
11ED47A01B30D0FFAEDD7CD30ABC95D8
11ED47A01B30D0FFAEDD7CD30ABC95D8
11ED47A01B30D0FFAEDD7CD30ABC95D8
11ED47A01B30D0FFAEDD7CD30ABC95D8
11ED47A01B30D0FFAEDD7CD30ABC95D8
11ED47A01B30D0FFAEDD7CD30ABC95D8
11ED47A01B30D0FFAEDD7CD30ABC95D8
11ED47A01B30D0FFAEDD7CD30ABC95D8
11ED47A01B30D0FFAEDD7CD30ABC95D8
11ED47A01B30D0FFAEDD7CD30ABC95D8
11ED47A01B30D0FFAEDD7CD30ABC95D8
11ED47A01B30D0FFAEDD7CD30ABC95D8
11ED47A01B30D0FFAEDD7CD30ABC95D8
11ED47A01B30D0FFAEDD7CD30ABC95D8
11ED47A01B30D0FFAEDD7CD30ABC95D8
11ED47A01B30D0FFAEDD7CD30ABC95D8
11ED47A01B30D0FFAEDD7CD30ABC95D8
11ED47A01B30D0FFAEDD7CD30ABC95D8
11ED47A01B30D0FFAEDD7CD30ABC95D8
11ED47A01B30D0FFAEDD7CD30ABC95D8
11ED47A01B30D0FFAEDD7CD30ABC95D8
11ED47A01B30D0FFAEDD7CD30ABC95D8
11ED47A01B30D0FFAEDD7CD30ABC95D8
11ED47A01B30D0FFAEDD7CD30ABC95D8
11ED47A01B30D0FFAEDD7CD30ABC95D8
11ED47A01B30D0FFAEDD7CD30ABC95D8
11ED47A01B30D0FFAEDD7CD30ABC95D8
11ED47A01B30D0FFAEDD7CD30ABC95D8
11ED47A01B30D0FFAEDD7CD30ABC95D8
11ED47A01B30D0FFAEDD7CD30ABC95D8
11ED47A01B30D0FFAEDD7CD30ABC95D8
11ED47A01B30D0FFAEDD7CD30ABC95D8
11ED47A01B30D0FFAEDD7CD30ABC95D8
11ED47A01B30D0FFAEDD7CD30ABC95D8
11ED47A01B30D0FFAEDD7CD30ABC95D8
11ED47A01B30D0FFAEDD7CD30ABC95D8
11ED47A01B30D0FFAEDD7CD30ABC95D8
11ED47A01B30D0FFAEDD7CD30ABC95D8
11ED47A01B30D0FFAEDD7CD30ABC95D8
11ED47A01B30D0FFAEDD7CD30ABC95D8
11ED47A01B30D0FFAEDD7CD30ABC95D8
11ED47A01B30D0FFAEDD7CD30ABC95D8
11ED47A01B30D0FFAEDD7CD30ABC95D8
11ED47A01B30D0FFAEDD7CD30ABC95D8
11ED47A01B30D0FFAEDD7CD30ABC95D8
11ED47A01B30D0FFAEDD7CD30ABC95D8
11ED47A01B30D0FFAEDD7CD30ABC95D8
11ED47A01B30D0FFAEDD7CD30ABC95D8
11ED47A01B30D0FFAEDD7CD30ABC95D8
11ED47A01B30D0FFAEDD7CD30ABC95D8
11ED47A01B30D0FFAEDD7CD30ABC95D8
11ED47A01B30D0FFAEDD7CD30ABC95D8
11ED47A01B30D0FFAEDD7CD30ABC95D8
11ED47A01B30D0FFAEDD7CD30ABC95D8
11ED47A01B30D0FFAEDD7CD30ABC95D8
11ED47A01B30D0FFAEDD7CD30ABC95D8
11ED47A01B30D0FFAEDD7CD30ABC95D8
11ED47A01B30D0FFAEDD7CD30ABC95D8
11ED47A01B30D0FFAEDD7CD30ABC95D8
11ED47A01B30D0FFAEDD7CD30ABC95D8
11ED47A01B30D0FFAEDD7CD30ABC95D8
11ED47A01B30D0FFAEDD7CD30ABC95D8
11ED47A01B30D0FFAEDD7CD30ABC95D8
11ED47A01B30D0FFAEDD7CD30ABC95D8
11ED47A01B30D0FFAEDD7CD30ABC95D8
11ED47A01B30D0FFAEDD7CD30ABC95D8
11ED47A01B30D0FFAEDD7CD30ABC95D8
11ED47A01B30D0FFAEDD7CD30ABC95D8
11ED47A01B30D0FFAEDD7CD30ABC95D8
11ED47A01B30D0FFAEDD7CD30ABC95D8
11ED47A01B30D0FFAEDD7CD30ABC95D8
11ED47A01B30D0FFAEDD7CD30ABC95D8
11ED47A01B30D0FFAEDD7CD30ABC95D8
11ED47A01B30D0FFAEDD7CD30ABC95D8
11ED47A01B30D0FFAEDD7CD30ABC95D8
11ED47A01B30D0FFAEDD7CD30ABC95D8
11ED47A01B30D0FFAEDD7CD30ABC95D8
11ED47A01B30D0FFAEDD7CD30ABC95D8
11ED47A01B30D0FFAEDD7CD30ABC95D8
11ED47A01B30D0FFAEDD7CD30ABC95D8
11ED47A01B30D0FFAEDD7CD30ABC95D8
11ED47A01B30D0FFAEDD7CD30ABC95D8
11ED47A01B30D0FFAEDD7CD30ABC95D8
11ED47A01B30D0FFAEDD7CD30ABC95D8
11ED47A01B30D0FFAEDD7CD30ABC95D8
11ED47A01B30D0FFAEDD7CD30ABC95D8
11ED47A01B30D0FFAEDD7CD30ABC95D8
11ED47A01B30D0FFAEDD7CD30ABC95D8
11ED47A01B30D0FFAEDD7CD30ABC95D8
11ED47A01B30D0FFAEDD7CD30ABC95D8
11ED47A01B30D0FFAEDD7CD30ABC95D8
11ED47A01B30D0FFAEDD7CD30ABC95D8
11ED47A01B30D0FFAEDD7CD30ABC95D8
11ED47A01B30D0FFAEDD7CD30ABC95D8
11ED47A01B30D0FFAEDD7CD30ABC95D8
11ED47A01B30D0FFAEDD7CD30ABC95D8
11ED47A01B30D0FFAEDD7CD30ABC95D8
11ED47A01B30D0FFAEDD7CD30ABC95D8
11ED47A01B30D0FFAEDD7CD30ABC95D8
11ED47A01B30D0FFAEDD7CD30ABC95D8
11ED47A01B30D0FFAEDD7CD30ABC95D8
11ED47A01B30D0FFAEDD7CD30ABC95D8
11ED47A01B30D0FFAEDD7CD30ABC95D8
11ED47A01B30D0FFAEDD7CD30ABC95D8
11ED47A01B30D0FFAEDD7CD30ABC95D8
11ED47A01B30D0FFAEDD7CD30ABC95D8
11ED47A01B30D0FFAEDD7CD30ABC95D8
11ED47A01B30D0FFAEDD7CD30ABC95D8
11ED47A01B30D0FFAEDD7CD30ABC95D8
11ED47A01B30D0FFAEDD7CD30ABC95D8
11ED47A01B30D0FFAEDD7CD30ABC95D8
11ED47A01B30D0FFAEDD7CD30ABC95D8
11ED47A01B30D0FFAEDD7CD30ABC95D8
11ED47A01B30D0FFAEDD7CD30ABC95D8
11ED47A01B30D0FFAEDD7CD30ABC95D8
11ED47A01B30D0FFAEDD7CD30ABC95D8
11ED47A01B30D0FFAEDD7CD30ABC95D8
11ED47A01B30D0FFAEDD7CD30ABC95D8
11ED47A01B30D0FFAEDD7CD30ABC95D8
11ED47A01B30D0FFAEDD7CD30ABC95D8
11ED47A01B30D0FFAEDD7CD30ABC95D8
11ED47A01B30D0FFAEDD7CD30ABC95D8
11ED47A01B30D0FFAEDD7CD30ABC95D8
11ED47A01B30D0FFAEDD7CD30ABC95D8
11ED47A01B30D0FFAEDD7CD30ABC95D8
11ED47A01B30D0FFAEDD7CD30ABC95D8
11ED47A01B30D0FFAEDD7CD30ABC95D8
11ED47A01B30D0FFAEDD7CD30ABC95D8
11ED47A01B30D0FFAEDD7CD30ABC95D8
11ED47A01B30D0FFAEDD7CD30ABC95D8
11ED47A01B30D0FFAEDD7CD30ABC95D8
11ED47A01B30D0FFAEDD7CD30ABC95D8
11ED47A01B30D0FFAEDD7CD30ABC95D8
11ED47A01B30D0FFAEDD7CD30ABC95D8
11ED47A01B30D0FFAEDD7CD30ABC95D8
11ED47A01B30D0FFAEDD7CD30ABC95D8
11ED47A01B30D0FFAEDD7CD30ABC95D8
11ED47A01B30D0FFAEDD7CD30ABC95D8
11ED47A01B30D0FFAEDD7CD30ABC95D8
11ED47A01B30D0FFAEDD7CD30ABC95D8
11ED47A01B30D0FFAEDD7CD30ABC95D8
11ED47A01B30D0FFAEDD7CD30ABC95D8
11ED47A01B30D0FFAEDD7CD30ABC95D8
11ED47A01B30D0FFAEDD7CD30ABC95D8
11ED47A01B30D0FFAEDD7CD30ABC95D8
11ED47A01B30D0FFAEDD7CD30ABC95D8
11ED47A01B30D0FFAEDD7CD30ABC95D8
11ED47A01B30D0FFAEDD7CD30ABC95D8
11ED47A01B30D0FFAEDD7CD30ABC95D8
11ED47A01B30D0FFAEDD7CD30ABC95D8
11ED47A01B30D0FFAEDD7CD30ABC95D8
11ED47A01B30D0FFAEDD7CD30ABC95D8
11ED47A01B30D0FFAEDD7CD30ABC95D8
11ED47A01B30D0FFAEDD7CD30ABC95D8
11ED47A01B30D0FFAEDD7CD30ABC95D8
11ED47A01B30D0FFAEDD7CD30ABC95D8
11ED47A01B30D0FFAEDD7CD30ABC95D8
11ED47A01B30D0FFAEDD7CD30ABC95D8
11ED47A01B30D0FFAEDD7CD30ABC95D8
11ED47A01B30D0FFAEDD7CD30ABC95D8
11ED47A01B30D0FFAEDD7CD30ABC95D8
11ED47A01B30D0FFAEDD7CD30ABC95D8
11ED47A01B30D0FFAEDD7CD30ABC95D8
11ED47A01B30D0FFAEDD7CD30ABC95D8
11ED47A01B30D0FFAEDD7CD30ABC95D8
11ED47A01B30D0FFAEDD7CD30ABC95D8
11ED47A01B30D0FFAEDD7CD30ABC95D8
11ED47A01B30D0FFAEDD7CD30ABC95D8
11ED47A01B30D0FFAEDD7CD30ABC95D8
11ED47A01B30D0FFAEDD7CD30ABC95D8
11ED47A01B30D0FFAEDD7CD30ABC95D8
11ED47A01B30D0FFAEDD7CD30ABC95D8
11ED47A01B30D0FFAEDD7CD30ABC95D8
11ED47A01B30D0FFAEDD7CD30ABC95D8
11ED47A01B30D0FFAEDD7CD30ABC95D8
11ED47A01B30D0FFAEDD7CD30ABC95D8
11ED47A01B30D0FFAEDD7CD30ABC95D8
11ED47A01B30D0FFAEDD7CD30ABC95D8
11ED47A01B30D0FFAEDD7CD30ABC95D8
11ED47A01B30D0FFAEDD7CD30ABC95D8
11ED47A01B30D0FFAEDD7CD30ABC95D8
11ED47A01B30D0FFAEDD7CD30ABC95D8
11ED47A01B30D0FFAEDD7CD30ABC95D8
11ED47A01B30D0FFAEDD7CD30ABC95D8
11ED47A01B30D0FFAEDD7CD30ABC95D8
11ED47A01B30D0FFAEDD7CD30ABC95D8
11ED47A01B30D0FFAEDD7CD30ABC95D8
11ED47A01B30D0FFAEDD7CD30ABC95D8
11ED47A01B30D0FFAEDD7CD30ABC95D8
11ED47A01B30D0FFAEDD7CD30ABC95D8
11ED47A01B30D0FFAEDD7CD30ABC95D8
11ED47A01B30D0FFAEDD7CD30ABC95D8
11ED47A01B30D0FFAEDD7CD30ABC95D8
11ED47A01B30D0FFAEDD7CD30ABC95D8
11ED47A01B30D0FFAEDD7CD30ABC95D8
11ED47A01B30D0FFAEDD7CD30ABC95D8
11ED47A01B30D0FFAEDD7CD30ABC95D8
11ED47A01B30D0FFAEDD7CD30ABC95D8
11ED47A01B30D0FFAEDD7CD30ABC95D8
11ED47A01B30D0FFAEDD7CD30ABC95D8
11ED47A01B30D0FFAEDD7CD30ABC95D8
11ED47A01B30D0FFAEDD7CD30ABC95D8
11ED47A01B30D0FFAEDD7CD30ABC95D8
11ED47A01B30D0FFAEDD7CD30ABC95D8
11ED47A01B30D0FFAEDD7CD30ABC95D8
11ED47A01B30D0FFAEDD7CD30ABC95D8
11ED47A01B30D0FFAEDD7CD30ABC95D8
11ED47A01B30D0FFAEDD7CD30ABC95D8
11ED47A01B30D0FFAEDD7CD30ABC95D8
11ED47A01B30D0FFAEDD7CD30ABC95D8
11ED47A01B30D0FFAEDD7CD30ABC95D8
11ED47A01B30D0FFAEDD7CD30ABC95D8
11ED47A01B30D0FFAEDD7CD30ABC95D8
11ED47A01B30D0FFAEDD7CD30ABC95D8
11ED47A01B30D0FFAEDD7CD30ABC95D8
11ED47A01B30D0FFAEDD7CD30ABC95D8
11ED47A01B30D0FFAEDD7CD30ABC95D8
11ED47A01B30D0FFAEDD7CD30ABC95D8
11ED47A01B30D0FFAEDD7CD30ABC95D8
11ED47A01B30D0FFAEDD7CD30ABC95D8
11ED47A01B30D0FFAEDD7CD30ABC95D8
11ED47A01B30D0FFAEDD7CD30ABC95D8
11ED47A01B30D0FFAEDD7CD30ABC95D8
11ED47A01B30D0FFAEDD7CD30ABC95D8
11ED47A01B30D0FFAEDD7CD30ABC95D8
11ED47A01B30D0FFAEDD7CD30ABC95D8
11ED47A01B30D0FFAEDD7CD30ABC95D8
11ED47A01B30D0FFAEDD7CD30ABC95D8
11ED47A01B30D0FFAEDD7CD30ABC95D8
11ED47A01B30D0FFAEDD7CD30ABC95D8
11ED47A01B30D0FFAEDD7CD30ABC95D8
11ED47A01B30D0FFAEDD7CD30ABC95D8
11ED47A01B30D0FFAEDD7CD30ABC95D8
11ED47A01B30D0FFAEDD7CD30ABC95D8
11ED47A01B30D0FFAEDD7CD30ABC95D8
11ED47A01B30D0FFAEDD7CD30ABC95D8
11ED47A01B30D0FFAEDD7CD30ABC95D8
11ED47A01B30D0FFAEDD7CD30ABC95D8
11ED47A01B30D0FFAEDD7CD30ABC95D8
11ED47A01B30D0FFAEDD7CD30ABC95D8
11ED47A01B30D0FFAEDD7CD30ABC95D8
11ED47A01B30D0FFAEDD7CD30ABC95D8
11ED47A01B30D0FFAEDD7CD30ABC95D8
11ED47A01B30D0FFAEDD7CD30ABC95D8
11ED47A01B30D0FFAEDD7CD30ABC95D8
11ED47A01B30D0FFAEDD7CD30ABC95D8
11ED47A01B30D0FFAEDD7CD30ABC95D8
11ED47A01B30D0FFAEDD7CD30ABC95D8
11ED47A01B30D0FFAEDD7CD30ABC95D8
11ED47A01B30D0FFAEDD7CD30ABC95D8
11ED47A01B30D0FFAEDD7CD30ABC95D8
11ED47A01B30D0FFAEDD7CD30ABC95D8
11ED47A01B30D0FFAEDD7CD30ABC95D8
11ED47A01B30D0FFAEDD7CD30ABC95D8
11ED47A01B30D0FFAEDD7CD30ABC95D8
11ED47A01B30D0FFAEDD7CD30ABC95D8
11ED47A01B30D0FFAEDD7CD30ABC95D8
11ED47A01B30D0FFAEDD7CD30ABC95D8
11ED47A01B30D0FFAEDD7CD30ABC95D8
11ED47A01B30D0FFAEDD7CD30ABC95D8
11ED47A01B30D0FFAEDD7CD30ABC95D8
11ED47A01B30D0FFAEDD7CD30ABC95D8
11ED47A01B30D0FFAEDD7CD30ABC95D8
11ED47A01B30D0FFAEDD7CD30ABC95D8
11ED47A01B30D0FFAEDD7CD30ABC95D8
11ED47A01B30D0FFAEDD7CD30ABC95D8
11ED47A01B30D0FFAEDD7CD30ABC95D8
11ED47A01B30D0FFAEDD7CD30ABC95D8
11ED47A01B30D0FFAEDD7CD30ABC95D8
11ED47A01B30D0FFAEDD7CD30ABC95D8
11ED47A01B30D0FFAEDD7CD30ABC95D8
11ED47A01B30D0FFAEDD7CD30ABC95D8
11ED47A01B30D0FFAEDD7CD30ABC95D8
11ED47A01B30D0FFAEDD7CD30ABC95D8
11ED47A01B30D0FFAEDD7CD30ABC95D8
11ED47A01B30D0FFAEDD7CD30ABC95D8
11ED47A01B30D0FFAEDD7CD30ABC95D8
11ED47A01B30D0FFAEDD7CD30ABC95D8
11ED47A01B30D0FFAEDD7CD30ABC95D8
11ED47A01B30D0FFAEDD7CD30ABC95D8
11ED47A01B30D0FFAEDD7CD30ABC95D8
11ED47A01B30D0FFAEDD7CD30ABC95D8
11ED47A01B30D0FFAEDD7CD30ABC95D8
11ED47A01B30D0FFAEDD7CD30ABC95D8
11ED47A01B30D0FFAEDD7CD30ABC95D8
11ED47A01B30D0FFAEDD7CD30ABC95D8
11ED47A01B30D0FFAEDD7CD30ABC95D8
11ED47A01B30D0FFAEDD7CD30ABC95D8
11ED47A01B30D0FFAEDD7CD30ABC95D8
11ED47A01B30D0FFAEDD7CD30ABC95D8
11ED47A01B30D0FFAEDD7CD30ABC95D8
11ED47A01B30D0FFAEDD7CD30ABC95D8
11ED47A01B30D0FFAEDD7CD30ABC95D8
11ED47A01B30D0FFAEDD7CD30ABC95D8
11ED47A01B30D0FFAEDD7CD30ABC95D8
11ED47A01B30D0FFAEDD7CD30ABC95D8
11ED47A01B30D0FFAEDD7CD30ABC95D8
11ED47A01B30D0FFAEDD7CD30ABC95D8
11ED47A01B30D0FFAEDD7CD30ABC95D8
11ED47A01B30D0FFAEDD7CD30ABC95D8
11ED47A01B30D0FFAEDD7CD30ABC95D8
11ED47A01B30D0FFAEDD7CD30ABC95D8
11ED47A01B30D0FFAEDD7CD30ABC95D8
11ED47A01B30D0FFAEDD7CD30ABC95D8
11ED47A01B30D0FFAEDD7CD30ABC95D8
11ED47A01B30D0FFAEDD7CD30ABC95D8
11ED47A01B30D0FFAEDD7CD30ABC95D8
11ED47A01B30D0FFAEDD7CD30ABC95D8
11ED47A01B30D0FFAEDD7CD30ABC95D8
11ED47A01B30D0FFAEDD7CD30ABC95D8
11ED47A01B30D0FFAEDD7CD30ABC95D8
11ED47A01B30D0FFAEDD7CD30ABC95D8
11ED47A01B30D0FFAEDD7CD30ABC95D8
11ED47A01B30D0FFAEDD7CD30ABC95D8
11ED47A01B30D0FFAEDD7CD30ABC95D8
11ED47A01B30D0FFAEDD7CD30ABC95D8
11ED47A01B30D0FFAEDD7CD30ABC95D8
11ED47A01B30D0FFAEDD7CD30ABC95D8
11ED47A01B30D0FFAEDD7CD30ABC95D8
11ED47A01B30D0FFAEDD7CD30ABC95D8
11ED47A01B30D0FFAEDD7CD30ABC95D8
11ED47A01B30D0FFAEDD7CD30ABC95D8
11ED47A01B30D0FFAEDD7CD30ABC95D8
11ED47A01B30D0FFAEDD7CD30ABC95D8
11ED47A01B30D0FFAEDD7CD30ABC95D8
11ED47A01B30D0FFAEDD7CD30ABC95D8
11ED47A01B30D0FFAEDD7CD30ABC95D8
11ED47A01B30D0FFAEDD7CD30ABC95D8
11ED47A01B30D0FFAEDD7CD30ABC95D8
11ED47A01B30D0FFAEDD7CD30ABC95D8
11ED47A01B30D0FFAEDD7CD30ABC95D8
11ED47A01B30D0FFAEDD7CD30ABC95D8
11ED47A01B30D0FFAEDD7CD30ABC95D8
11ED47A01B30D0FFAEDD7CD30ABC95D8
11ED47A01B30D0FFAEDD7CD30ABC95D8
11ED47A01B30D0FFAEDD7CD30ABC95D8
11ED47A01B30D0FFAEDD7CD30ABC95D8
11ED47A01B30D0FFAEDD7CD30ABC95D8
11ED47A01B30D0FFAEDD7CD30ABC95D8
11ED47A01B30D0FFAEDD7CD30ABC95D8
11ED47A01B30D0FFAEDD7CD30ABC95D8
11ED47A01B30D0FFAEDD7CD30ABC95D8
11ED47A01B30D0FFAEDD7CD30ABC95D8
11ED47A01B30D0FFAEDD7CD30ABC95D8
11ED47A01B30D0FFAEDD7CD30ABC95D8
11ED47A01B30D0FFAEDD7CD30ABC95D8
11ED47A01B30D0FFAEDD7CD30ABC95D8
11ED47A01B30D0FFAEDD7CD30ABC95D8
11ED47A01B30D0FFAEDD7CD30ABC95D8
11ED47A01B30D0FFAEDD7CD30ABC95D8
11ED47A01B30D0FFAEDD7CD30ABC95D8
11ED47A01B30D0FFAEDD7CD30ABC95D8
11ED47A01B30D0FFAEDD7CD30ABC95D8
11ED47A01B30D0FFAEDD7CD30ABC95D8
11ED47A01B30D0FFAEDD7CD30ABC95D8
11ED47A01B30D0FFAEDD7CD30ABC95D8
11ED47A01B30D0FFAEDD7CD30ABC95D8
11ED47A01B30D0FFAEDD7CD30ABC95D8
11ED47A01B30D0FFAEDD7CD30ABC95D8
11ED47A01B30D0FFAEDD7CD30ABC95D8
11ED47A01B30D0FFAEDD7CD30ABC95D8
11ED47A01B30D0FFAEDD7CD30ABC95D8
11ED47A01B30D0FFAEDD7CD30ABC95D8
11ED47A01B30D0FFAEDD7CD30ABC95D8
11ED47A01B30D0FFAEDD7CD30ABC95D8
11ED47A01B30D0FFAEDD7CD30ABC95D8
11ED47A01B30D0FFAEDD7CD30ABC95D8
11ED47A01B30D0FFAEDD7CD30ABC95D8
11ED47A01B30D0FFAEDD7CD30ABC95D8
11ED47A01B30D0FFAEDD7CD30ABC95D8
11ED47A01B30D0FFAEDD7CD30ABC95D8
11ED47A01B30D0FFAEDD7CD30ABC95D8
11ED47A01B30D0FFAEDD7CD30ABC95D8
11ED47A01B30D0FFAEDD7CD30ABC95D8
11ED47A01B30D0FFAEDD7CD30ABC95D8
11ED47A01B30D0FFAEDD7CD30ABC95D8
11ED47A01B30D0FFAEDD7CD30ABC95D8
11ED47A01B30D0FFAEDD7CD30ABC95D8
11ED47A01B30D0FFAEDD7CD30ABC95D8
11ED47A01B30D0FFAEDD7CD30ABC95D8
11ED47A01B30D0FFAEDD7CD30ABC95D8
11ED47A01B30D0FFAEDD7CD30ABC95D8
11ED47A01B30D0FFAEDD7CD30ABC95D8
11ED47A01B30D0FFAEDD7CD30ABC95D8
11ED47A01B30D0FFAEDD7CD30ABC95D8
11ED47A01B30D0FFAEDD7CD30ABC95D8
11ED47A01B30D0FFAEDD7CD30ABC95D8
11ED47A01B30D0FFAEDD7CD30ABC95D8
11ED47A01B30D0FFAEDD7CD30ABC95D8
11ED47A01B30D0FFAEDD7CD30ABC95D8
11ED47A01B30D0FFAEDD7CD30ABC95D8
11ED47A01B30D0FFAEDD7CD30ABC95D8
11ED47A01B30D0FFAEDD7CD30ABC95D8
11ED47A01B30D0FFAEDD7CD30ABC95D8
11ED47A01B30D0FFAEDD7CD30ABC95D8
11ED47A01B30D0FFAEDD7CD30ABC95D8
11ED47A01B30D0FFAEDD7CD30ABC95D8
11ED47A01B30D0FFAEDD7CD30ABC95D8
11ED47A01B30D0FFAEDD7CD30ABC95D8
11ED47A01B30D0FFAEDD7CD30ABC95D8
11ED47A01B30D0FFAEDD7CD30ABC95D8
11ED47A01B30D0FFAEDD7CD30ABC95D8
11ED47A01B30D0FFAEDD7CD30ABC95D8
11ED47A01B30D0FFAEDD7CD30ABC95D8
11ED47A01B30D0FFAEDD7CD30ABC95D8
11ED47A01B30D0FFAEDD7CD30ABC95D8
11ED47A01B30D0FFAEDD7CD30ABC95D8
11ED47A01B30D0FFAEDD7CD30ABC95D8
11ED47A01B30D0FFAEDD7CD30ABC95D8
11ED47A01B30D0FFAEDD7CD30ABC95D8
11ED47A01B30D0FFAEDD7CD30ABC95D8
11ED47A01B30D0FFAEDD7CD30ABC95D8
11ED47A01B30D0FFAEDD7CD30ABC95D8
11ED47A01B30D0FFAEDD7CD30ABC95D8
11ED47A01B30D0FFAEDD7CD30ABC95D8
11ED47A01B30D0FFAEDD7CD30ABC95D8
11ED47A01B30D0FFAEDD7CD30ABC95D8
11ED47A01B30D0FFAEDD7CD30ABC95D8
11ED47A01B30D0FFAEDD7CD30ABC95D8
11ED47A01B30D0FFAEDD7CD30ABC95D8
11ED47A01B30D0FFAEDD7CD30ABC95D8
11ED47A01B30D0FFAEDD7CD30ABC95D8
11ED47A01B30D0FFAEDD7CD30ABC95D8
11ED47A01B30D0FFAEDD7CD30ABC95D8
11ED47A01B30D0FFAEDD7CD30ABC95D8
11ED47A01B30D0FFAEDD7CD30ABC95D8
11ED47A01B30D0FFAEDD7CD30ABC95D8
11ED47A01B30D0FFAEDD7CD30ABC95D8
11ED47A01B30D0FFAEDD7CD30ABC95D8
11ED47A01B30D0FFAEDD7CD30ABC95D8
11ED47A01B30D0FFAEDD7CD30ABC95D8
11ED47A01B30D0FFAEDD7CD30ABC95D8
11ED47A01B30D0FFAEDD7CD30ABC95D8
11ED47A01B30D0FFAEDD7CD30ABC95D8
11ED47A01B30D0FFAEDD7CD30ABC95D8
11ED47A01B30D0FFAEDD7CD30ABC95D8
11ED47A01B30D0FFAEDD7CD30ABC95D8
11ED47A01B30D0FFAEDD7CD30ABC95D8
11ED47A01B30D0FFAEDD7CD30ABC95D8
11ED47A01B30D0FFAEDD7CD30ABC95D8
11ED47A01B30D0FFAEDD7CD30ABC95D8
11ED47A01B30D0FFAEDD7CD30ABC95D8
11ED47A01B30D0FFAEDD7CD30ABC95D8
11ED47A01B30D0FFAEDD7CD30ABC95D8
11ED47A01B30D0FFAEDD7CD30ABC95D8
11ED47A01B30D0FFAEDD7CD30ABC95D8
11ED47A01B30D0FFAEDD7CD30ABC95D8
11ED47A01B30D0FFAEDD7CD30ABC95D8
11ED47A01B30D0FFAEDD7CD30ABC95D8
11ED47A01B30D0FFAEDD7CD30ABC95D8
11ED47A01B30D0FFAEDD7CD30ABC95D8
11ED47A01B30D0FFAEDD7CD30ABC95D8
11ED47A01B30D0FFAEDD7CD30ABC95D8
11ED47A01B30D0FFAEDD7CD30ABC95D8
11ED47A01B30D0FFAEDD7CD30ABC95D8
11ED47A01B30D0FFAEDD7CD30ABC95D8
11ED47A01B30D0FFAEDD7CD30ABC95D8
11ED47A01B30D0FFAEDD7CD30ABC95D8
11ED47A01B30D0FFAEDD7CD30ABC95D8
11ED47A01B30D0FFAEDD7CD30ABC95D8
11ED47A01B30D0FFAEDD7CD30ABC95D8
11ED47A01B30D0FFAEDD7CD30ABC95D8
11ED47A01B30D0FFAEDD7CD30ABC95D8
11ED47A01B30D0FFAEDD7CD30ABC95D8
11ED47A01B30D0FFAEDD7CD30ABC95D8
11ED47A01B30D0FFAEDD7CD30ABC95D8
11ED47A01B30D0FFAEDD7CD30ABC95D8
11ED47A01B30D0FFAEDD7CD30ABC95D8
11ED47A01B30D0FFAEDD7CD30ABC95D8
11ED47A01B30D0FFAEDD7CD30ABC95D8
11ED47A01B30D0FFAEDD7CD30ABC95D8
11ED47A01B30D0FFAEDD7CD30ABC95D8
11ED47A01B30D0FFAEDD7CD30ABC95D8
11ED47A01B30D0FFAEDD7CD30ABC95D8
11ED47A01B30D0FFAEDD7CD30ABC95D8
11ED47A01B30D0FFAEDD7CD30ABC95D8
11ED47A01B30D0FFAEDD7CD30ABC95D8
11ED47A01B30D0FFAEDD7CD30ABC95D8
11ED47A01B30D0FFAEDD7CD30ABC95D8
11ED47A01B30D0FFAEDD7CD30ABC95D8
11ED47A01B30D0FFAEDD7CD30ABC95D8
11ED47A01B30D0FFAEDD7CD30ABC95D8
11ED47A01B30D0FFAEDD7CD30ABC95D8
11ED47A01B30D0FFAEDD7CD30ABC95D8
11ED47A01B30D0FFAEDD7CD30ABC95D8
11ED47A01B30D0FFAEDD7CD30ABC95D8
11ED47A01B30D0FFAEDD7CD30ABC95D8
11ED47A01B30D0FFAEDD7CD30ABC95D8
11ED47A01B30D0FFAEDD7CD30ABC95D8
11ED47A01B30D0FFAEDD7CD30ABC95D8
11ED47A01B30D0FFAEDD7CD30ABC95D8
11ED47A01B30D0FFAEDD7CD30ABC95D8
11ED47A01B30D0FFAEDD7CD30ABC95D8
11ED47A01B30D0FFAEDD7CD30ABC95D8
11ED47A01B30D0FFAEDD7CD30ABC95D8
11ED47A01B30D0FFAEDD7CD30ABC95D8
11ED47A01B30D0FFAEDD7CD30ABC95D8
11ED47A01B30D0FFAEDD7CD30ABC95D8
11ED47A01B30D0FFAEDD7CD30ABC95D8
11ED47A01B30D0FFAEDD7CD30ABC95D8
11ED47A01B30D0FFAEDD7CD30ABC95D8
11ED47A01B30D0FFAEDD7CD30ABC95D8
11ED47A01B30D0FFAEDD7CD30ABC95D8
11ED47A01B30D0FFAEDD7CD30ABC95D8
11ED47A01B30D0FFAEDD7CD30ABC95D8
11ED47A01B30D0FFAEDD7CD30ABC95D8
11ED47A01B30D0FFAEDD7CD30ABC95D8
11ED47A01B30D0FFAEDD7CD30ABC95D8
11ED47A01B30D0FFAEDD7CD30ABC95D8
11ED47A01B30D0FFAEDD7CD30ABC95D8
11ED47A01B30D0FFAEDD7CD30ABC95D8
11ED47A01B30D0FFAEDD7CD30ABC95D8
11ED47A01B30D0FFAEDD7CD30ABC95D8
11ED47A01B30D0FFAEDD7CD30ABC95D8
11ED47A01B30D0FFAEDD7CD30ABC95D8
11ED47A01B30D0FFAEDD7CD30ABC95D8
11ED47A01B30D0FFAEDD7CD30ABC95D8
11ED47A01B30D0FFAEDD7CD30ABC95D8
11ED47A01B30D0FFAEDD7CD30ABC95D8
11ED47A01B30D0FFAEDD7CD30ABC95D8
11ED47A01B30D0FFAEDD7CD30ABC95D8
11ED47A01B30D0FFAEDD7CD30ABC95D8
11ED47A01B30D0FFAEDD7CD30ABC95D8
11ED47A01B30D0FFAEDD7CD30ABC95D8
11ED47A01B30D0FFAEDD7CD30ABC95D8
11ED47A01B30D0FFAEDD7CD30ABC95D8
11ED47A01B30D0FFAEDD7CD30ABC95D8
11ED47A01B30D0FFAEDD7CD30ABC95D8
11ED47A01B30D0FFAEDD7CD30ABC95D8
11ED47A01B30D0FFAEDD7CD30ABC95D8
11ED47A01B30D0FFAEDD7CD30ABC95D8
11ED47A01B30D0FFAEDD7CD30ABC95D8
11ED47A01B30D0FFAEDD7CD30ABC95D8
11ED47A01B30D0FFAEDD7CD30ABC95D8
11ED47A01B30D0FFAEDD7CD30ABC95D8
11ED47A01B30D0FFAEDD7CD30ABC95D8
11ED47A01B30D0FFAEDD7CD30ABC95D8
11ED47A01B30D0FFAEDD7CD30ABC95D8
11ED47A01B30D0FFAEDD7CD30ABC95D8
11ED47A01B30D0FFAEDD7CD30ABC95D8
11ED47A01B30D0FFAEDD7CD30ABC95D8
11ED47A01B30D0FFAEDD7CD30ABC95D8
11ED47A01B30D0FFAEDD7CD30ABC95D8
11ED47A01B30D0FFAEDD7CD30ABC95D8
11ED47A01B30D0FFAEDD7CD30ABC95D8
11ED47A01B30D0FFAEDD7CD30ABC95D8
11ED47A01B30D0FFAEDD7CD30ABC95D8
11ED47A01B30D0FFAEDD7CD30ABC95D8
11ED47A01B30D0FFAEDD7CD30ABC95D8
11ED47A01B30D0FFAEDD7CD30ABC95D8
11ED47A01B30D0FFAEDD7CD30ABC95D8
11ED47A01B30D0FFAEDD7CD30ABC95D8
11ED47A01B30D0FFAEDD7CD30ABC95D8
11ED47A01B30D0FFAEDD7CD30ABC95D8
11ED47A01B30D0FFAEDD7CD30ABC95D8
11ED47A01B30D0FFAEDD7CD30ABC95D8
11ED47A01B30D0FFAEDD7CD30ABC95D8
11ED47A01B30D0FFAEDD7CD30ABC95D8
11ED47A01B30D0FFAEDD7CD30ABC95D8
11ED47A01B30D0FFAEDD7CD30ABC95D8
11ED47A01B30D0FFAEDD7CD30ABC95D8
11ED47A01B30D0FFAEDD7CD30ABC95D8
11ED47A01B30D0FFAEDD7CD30ABC95D8
11ED47A01B30D0FFAEDD7CD30ABC95D8
11ED47A01B30D0FFAEDD7CD30ABC95D8
11ED47A01B30D0FFAEDD7CD30ABC95D8
11ED47A01B30D0FFAEDD7CD30ABC95D8
11ED47A01B30D0FFAEDD7CD30ABC95D8
11ED47A01B30D0FFAEDD7CD30ABC95D8
11ED47A01B30D0FFAEDD7CD30ABC95D8
11ED47A01B30D0FFAEDD7CD30ABC95D8
11ED47A01B30D0FFAEDD7CD30ABC95D8
11ED47A01B30D0FFAEDD7CD30ABC95D8
11ED47A01B30D0FFAEDD7CD30ABC95D8
11ED47A01B30D0FFAEDD7CD30ABC95D8
11ED47A01B30D0FFAEDD7CD30ABC95D8
11ED47A01B30D0FFAEDD7CD30ABC95D8
11ED47A01B30D0FFAEDD7CD30ABC95D8
11ED47A01B30D0FFAEDD7CD30ABC95D8
11ED47A01B30D0FFAEDD7CD30ABC95D8
11ED47A01B30D0FFAEDD7CD30ABC95D8
11ED47A01B30D0FFAEDD7CD30ABC95D8
11ED47A01B30D0FFAEDD7CD30ABC95D8
11ED47A01B30D0FFAEDD7CD30ABC95D8
11ED47A01B30D0FFAEDD7CD30ABC95D8
11ED47A01B30D0FFAEDD7CD30ABC95D8
11ED47A01B30D0FFAEDD7CD30ABC95D8
11ED47A01B30D0FFAEDD7CD30ABC95D8
11ED47A01B30D0FFAEDD7CD30ABC95D8
11ED47A01B30D0FFAEDD7CD30ABC95D8
11ED47A01B30D0FFAEDD7CD30ABC95D8
11ED47A01B30D0FFAEDD7CD30ABC95D8
11ED47A01B30D0FFAEDD7CD30ABC95D8
11ED47A01B30D0FFAEDD7CD30ABC95D8
11ED47A01B30D0FFAEDD7CD30ABC95D8
11ED47A01B30D0FFAEDD7CD30ABC95D8
11ED47A01B30D0FFAEDD7CD30ABC95D8
11ED47A01B30D0FFAEDD7CD30ABC95D8
11ED47A01B30D0FFAEDD7CD30ABC95D8
11ED47A01B30D0FFAEDD7CD30ABC95D8
11ED47A01B30D0FFAEDD7CD30ABC95D8
11ED47A01B30D0FFAEDD7CD30ABC95D8
11ED47A01B30D0FFAEDD7CD30ABC95D8
11ED47A01B30D0FFAEDD7CD30ABC95D8
11ED47A01B30D0FFAEDD7CD30ABC95D8
11ED47A01B30D0FFAEDD7CD30ABC95D8
11ED47A01B30D0FFAEDD7CD30ABC95D8
11ED47A01B30D0FFAEDD7CD30ABC95D8
11ED47A01B30D0FFAEDD7CD30ABC95D8
11ED47A01B30D0FFAEDD7CD30ABC95D8
11ED47A01B30D0FFAEDD7CD30ABC95D8
11ED47A01B30D0FFAEDD7CD30ABC95D8
11ED47A01B30D0FFAEDD7CD30ABC95D8
11ED47A01B30D0FFAEDD7CD30ABC95D8
11ED47A01B30D0FFAEDD7CD30ABC95D8
11ED47A01B30D0FFAEDD7CD30ABC95D8
11ED47A01B30D0FFAEDD7CD30ABC95D8
11ED47A01B30D0FFAEDD7CD30ABC95D8
11ED47A01B30D0FFAEDD7CD30ABC95D8
11ED47A01B30D0FFAEDD7CD30ABC95D8
11ED47A01B30D0FFAEDD7CD30ABC95D8
11ED47A01B30D0FFAEDD7CD30ABC95D8
11ED47A01B30D0FFAEDD7CD30ABC95D8
11ED47A01B30D0FFAEDD7CD30ABC95D8
11ED47A01B30D0FFAEDD7CD30ABC95D8
11ED47A01B30D0FFAEDD7CD30ABC95D8
11ED47A01B30D0FFAEDD7CD30ABC95D8
11ED47A01B30D0FFAEDD7CD30ABC95D8
11ED47A01B30D0FFAEDD7CD30ABC95D8
11ED47A01B30D0FFAEDD7CD30ABC95D8
11ED47A01B30D0FFAEDD7CD30ABC95D8
11ED47A01B30D0FFAEDD7CD30ABC95D8
11ED47A01B30D0FFAEDD7CD30ABC95D8
11ED47A01B30D0FFAEDD7CD30ABC95D8
11ED47A01B30D0FFAEDD7CD30ABC95D8
11ED47A01B30D0FFAEDD7CD30ABC95D8
11ED47A01B30D0FFAEDD7CD30ABC95D8
11ED47A01B30D0FFAEDD7CD30ABC95D8
11ED47A01B30D0FFAEDD7CD30ABC95D8
11ED47A01B30D0FFAEDD7CD30ABC95D8
11ED47A01B30D0FFAEDD7CD30ABC95D8
11ED47A01B30D0FFAEDD7CD30ABC95D8
11ED47A01B30D0FFAEDD7CD30ABC95D8
11ED47A01B30D0FFAEDD7CD30ABC95D8
11ED47A01B30D0FFAEDD7CD30ABC95D8
11ED47A01B30D0FFAEDD7CD30ABC95D8
11ED47A01B30D0FFAEDD7CD30ABC95D8
11ED47A01B30D0FFAEDD7CD30ABC95D8
11ED47A01B30D0FFAEDD7CD30ABC95D8
11ED47A01B30D0FFAEDD7CD30ABC95D8
11ED47A01B30D0FFAEDD7CD30ABC95D8
11ED47A01B30D0FFAEDD7CD30ABC95D8
11ED47A01B30D0FFAEDD7CD30ABC95D8
11ED47A01B30D0FFAEDD7CD30ABC95D8
11ED47A01B30D0FFAEDD7CD30ABC95D8
11ED47A01B30D0FFAEDD7CD30ABC95D8
11ED47A01B30D0FFAEDD7CD30ABC95D8
11ED47A01B30D0FFAEDD7CD30ABC95D8
11ED47A01B30D0FFAEDD7CD30ABC95D8
11ED47A01B30D0FFAEDD7CD30ABC95D8
11ED47A01B30D0FFAEDD7CD30ABC95D8
11ED47A01B30D0FFAEDD7CD30ABC95D8
11ED47A01B30D0FFAEDD7CD30ABC95D8
11ED47A01B30D0FFAEDD7CD30ABC95D8
11ED47A01B30D0FFAEDD7CD30ABC95D8
11ED47A01B30D0FFAEDD7CD30ABC95D8
11ED47A01B30D0FFAEDD7CD30ABC95D8
11ED47A01B30D0FFAEDD7CD30ABC95D8
11ED47A01B30D0FFAEDD7CD30ABC95D8
11ED47A01B30D0FFAEDD7CD30ABC95D8
11ED47A01B30D0FFAEDD7CD30ABC95D8
11ED47A01B30D0FFAEDD7CD30ABC95D8
11ED47A01B30D0FFAEDD7CD30ABC95D8
11ED47A01B30D0FFAEDD7CD30ABC95D8
11ED47A01B30D0FFAEDD7CD30ABC95D8
11ED47A01B30D0FFAEDD7CD30ABC95D8
11ED47A01B30D0FFAEDD7CD30ABC95D8
11ED47A01B30D0FFAEDD7CD30ABC95D8
11ED47A01B30D0FFAEDD7CD30ABC95D8
11ED47A01B30D0FFAEDD7CD30ABC95D8
11ED47A01B30D0FFAEDD7CD30ABC95D8
11ED47A01B30D0FFAEDD7CD30ABC95D8
11ED47A01B30D0FFAEDD7CD30ABC95D8
11ED47A01B30D0FFAEDD7CD30ABC95D8
11ED47A01B30D0FFAEDD7CD30ABC95D8
11ED47A01B30D0FFAEDD7CD30ABC95D8
11ED47A01B30D0FFAEDD7CD30ABC95D8
11ED47A01B30D0FFAEDD7CD30ABC95D8
11ED47A01B30D0FFAEDD7CD30ABC95D8
11ED47A01B30D0FFAEDD7CD30ABC95D8
11ED47A01B30D0FFAEDD7CD30ABC95D8
11ED47A01B30D0FFAEDD7CD30ABC95D8
11ED47A01B30D0FFAEDD7CD30ABC95D8
11ED47A01B30D0FFAEDD7CD30ABC95D8
11ED47A01B30D0FFAEDD7CD30ABC95D8
11ED47A01B30D0FFAEDD7CD30ABC95D8
11ED47A01B30D0FFAEDD7CD30ABC95D8
11ED47A01B30D0FFAEDD7CD30ABC95D8
11ED47A01B30D0FFAEDD7CD30ABC95D8
11ED47A01B30D0FFAEDD7CD30ABC95D8
11ED47A01B30D0FFAEDD7CD30ABC95D8
11ED47A01B30D0FFAEDD7CD30ABC95D8
11ED47A01B30D0FFAEDD7CD30ABC95D8
11ED47A01B30D0FFAEDD7CD30ABC95D8
11ED47A01B30D0FFAEDD7CD30ABC95D8
11ED47A01B30D0FFAEDD7CD30ABC95D8
11ED47A01B30D0FFAEDD7CD30ABC95D8
11ED47A01B30D0FFAEDD7CD30ABC95D8
11ED47A01B30D0FFAEDD7CD30ABC95D8
11ED47A01B30D0FFAEDD7CD30ABC95D8
11ED47A01B30D0FFAEDD7CD30ABC95D8
11ED47A01B30D0FFAEDD7CD30ABC95D8
11ED47A01B30D0FFAEDD7CD30ABC95D8
11ED47A01B30D0FFAEDD7CD30ABC95D8
11ED47A01B30D0FFAEDD7CD30ABC95D8
11ED47A01B30D0FFAEDD7CD30ABC95D8
11ED47A01B30D0FFAEDD7CD30ABC95D8
11ED47A01B30D0FFAEDD7CD30ABC95D8
11ED47A01B30D0FFAEDD7CD30ABC95D8
11ED47A01B30D0FFAEDD7CD30ABC95D8
11ED47A01B30D0FFAEDD7CD30ABC95D8
11ED47A01B30D0FFAEDD7CD30ABC95D8
11ED47A01B30D0FFAEDD7CD30ABC95D8
11ED47A01B30D0FFAEDD7CD30ABC95D8
11ED47A01B30D0FFAEDD7CD30ABC95D8
11ED47A01B30D0FFAEDD7CD30ABC95D8
11ED47A01B30D0FFAEDD7CD30ABC95D8
11ED47A01B30D0FFAEDD7CD30ABC95D8
11ED47A01B30D0FFAEDD7CD30ABC95D8
11ED47A01B30D0FFAEDD7CD30ABC95D8
11ED47A01B30D0FFAEDD7CD30ABC95D8
11ED47A01B30D0FFAEDD7CD30ABC95D8
1B30D0FF47A011EDAEDD7CD30ABC95D8
1B30D0FF47A011EDAEDD7CD30ABC95D8
1B30D0FF47A011EDAEDD7CD30ABC95D8
1B30D0FF47A011EDAEDD7CD30ABC95D8
1B30D0FF47A011EDAEDD7CD30ABC95D8
1B30D0FF47A011EDAEDD7CD30ABC95D8
1B30D0FF47A011EDAEDD7CD30ABC95D8
1B30D0FF47A011EDAEDD7CD30ABC95D8
1B30D0FF47A011EDAEDD7CD30ABC95D8
1B30D0FF47A011EDAEDD7CD30ABC95D8
1B30D0FF47A011EDAEDD7CD30ABC95D8
1B30D0FF47A011EDAEDD7CD30ABC95D8
1B30D0FF47A011EDAEDD7CD30ABC95D8
1B30D0FF47A011EDAEDD7CD30ABC95D8
1B30D0FF47A011EDAEDD7CD30ABC95D8
1B30D0FF47A011EDAEDD7CD30ABC95D8
1B30D0FF47A011EDAEDD7CD30ABC95D8
1B30D0FF47A011EDAEDD7CD30ABC95D8
1B30D0FF47A011EDAEDD7CD30ABC95D8
1B30D0FF47A011EDAEDD7CD30ABC95D8
1B30D0FF47A011EDAEDD7CD30ABC95D8
1B30D0FF47A011EDAEDD7CD30ABC95D8
1B30D0FF47A011EDAEDD7CD30ABC95D8
1B30D0FF47A011EDAEDD7CD30ABC95D8
1B30D0FF47A011EDAEDD7CD30ABC95D8
1B30D0FF47A011EDAEDD7CD30ABC95D8
1B30D0FF47A011EDAEDD7CD30ABC95D8
1B30D0FF47A011EDAEDD7CD30ABC95D8
1B30D0FF47A011EDAEDD7CD30ABC95D8
1B30D0FF47A011EDAEDD7CD30ABC95D8
1B30D0FF47A011EDAEDD7CD30ABC95D8
1B30D0FF47A011EDAEDD7CD30ABC95D8
1B30D0FF47A011EDAEDD7CD30ABC95D8
1B30D0FF47A011EDAEDD7CD30ABC95D8
1B30D0FF47A011EDAEDD7CD30ABC95D8
1B30D0FF47A011EDAEDD7CD30ABC95D8
1B30D0FF47A011EDAEDD7CD30ABC95D8
1B30D0FF47A011EDAEDD7CD30ABC95D8
1B30D0FF47A011EDAEDD7CD30ABC95D8
1B30D0FF47A011EDAEDD7CD30ABC95D8
1B30D0FF47A011EDAEDD7CD30ABC95D8
1B30D0FF47A011EDAEDD7CD30ABC95D8
1B30D0FF47A011EDAEDD7CD30ABC95D8
1B30D0FF47A011EDAEDD7CD30ABC95D8
1B30D0FF47A011EDAEDD7CD30ABC95D8
1B30D0FF47A011EDAEDD7CD30ABC95D8
1B30D0FF47A011EDAEDD7CD30ABC95D8
1B30D0FF47A011EDAEDD7CD30ABC95D8
1B30D0FF47A011EDAEDD7CD30ABC95D8
1B30D0FF47A011EDAEDD7CD30ABC95D8
1B30D0FF47A011EDAEDD7CD30ABC95D8
1B30D0FF47A011EDAEDD7CD30ABC95D8
1B30D0FF47A011EDAEDD7CD30ABC95D8
1B30D0FF47A011EDAEDD7CD30ABC95D8
1B30D0FF47A011EDAEDD7CD30ABC95D8
1B30D0FF47A011EDAEDD7CD30ABC95D8
1B30D0FF47A011EDAEDD7CD30ABC95D8
1B30D0FF47A011EDAEDD7CD30ABC95D8
1B30D0FF47A011EDAEDD7CD30ABC95D8
1B30D0FF47A011EDAEDD7CD30ABC95D8
1B30D0FF47A011EDAEDD7CD30ABC95D8
1B30D0FF47A011EDAEDD7CD30ABC95D8
1B30D0FF47A011EDAEDD7CD30ABC95D8
1B30D0FF47A011EDAEDD7CD30ABC95D8
1B30D0FF47A011EDAEDD7CD30ABC95D8
1B30D0FF47A011EDAEDD7CD30ABC95D8
1B30D0FF47A011EDAEDD7CD30ABC95D8
1B30D0FF47A011EDAEDD7CD30ABC95D8
1B30D0FF47A011EDAEDD7CD30ABC95D8
1B30D0FF47A011EDAEDD7CD30ABC95D8
1B30D0FF47A011EDAEDD7CD30ABC95D8
1B30D0FF47A011EDAEDD7CD30ABC95D8
1B30D0FF47A011EDAEDD7CD30ABC95D8
1B30D0FF47A011EDAEDD7CD30ABC95D8
1B30D0FF47A011EDAEDD7CD30ABC95D8
1B30D0FF47A011EDAEDD7CD30ABC95D8
1B30D0FF47A011EDAEDD7CD30ABC95D8
1B30D0FF47A011EDAEDD7CD30ABC95D8
1B30D0FF47A011EDAEDD7CD30ABC95D8
1B30D0FF47A011EDAEDD7CD30ABC95D8
1B30D0FF47A011EDAEDD7CD30ABC95D8
1B30D0FF47A011EDAEDD7CD30ABC95D8
1B30D0FF47A011EDAEDD7CD30ABC95D8
1B30D0FF47A011EDAEDD7CD30ABC95D8
1B30D0FF47A011EDAEDD7CD30ABC95D8
1B30D0FF47A011EDAEDD7CD30ABC95D8
1B30D0FF47A011EDAEDD7CD30ABC95D8
1B30D0FF47A011EDAEDD7CD30ABC95D8
1B30D0FF47A011EDAEDD7CD30ABC95D8
1B30D0FF47A011EDAEDD7CD30ABC95D8
1B30D0FF47A011EDAEDD7CD30ABC95D8
1B30D0FF47A011EDAEDD7CD30ABC95D8
1B30D0FF47A011EDAEDD7CD30ABC95D8
1B30D0FF47A011EDAEDD7CD30ABC95D8
1B30D0FF47A011EDAEDD7CD30ABC95D8
1B30D0FF47A011EDAEDD7CD30ABC95D8
1B30D0FF47A011EDAEDD7CD30ABC95D8
1B30D0FF47A011EDAEDD7CD30ABC95D8
1B30D0FF47A011EDAEDD7CD30ABC95D8
1B30D0FF47A011EDAEDD7CD30ABC95D8
1B30D0FF47A011EDAEDD7CD30ABC95D8
1B30D0FF47A011EDAEDD7CD30ABC95D8
1B30D0FF47A011EDAEDD7CD30ABC95D8
1B30D0FF47A011EDAEDD7CD30ABC95D8
1B30D0FF47A011EDAEDD7CD30ABC95D8
1B30D0FF47A011EDAEDD7CD30ABC95D8
1B30D0FF47A011EDAEDD7CD30ABC95D8
1B30D0FF47A011EDAEDD7CD30ABC95D8
1B30D0FF47A011EDAEDD7CD30ABC95D8
1B30D0FF47A011EDAEDD7CD30ABC95D8
1B30D0FF47A011EDAEDD7CD30ABC95D8
1B30D0FF47A011EDAEDD7CD30ABC95D8
1B30D0FF47A011EDAEDD7CD30ABC95D8
1B30D0FF47A011EDAEDD7CD30ABC95D8
1B30D0FF47A011EDAEDD7CD30ABC95D8
1B30D0FF47A011EDAEDD7CD30ABC95D8
1B30D0FF47A011EDAEDD7CD30ABC95D8
1B30D0FF47A011EDAEDD7CD30ABC95D8
1B30D0FF47A011EDAEDD7CD30ABC95D8
1B30D0FF47A011EDAEDD7CD30ABC95D8
1B30D0FF47A011EDAEDD7CD30ABC95D8
1B30D0FF47A011EDAEDD7CD30ABC95D8
1B30D0FF47A011EDAEDD7CD30ABC95D8
1B30D0FF47A011EDAEDD7CD30ABC95D8
1B30D0FF47A011EDAEDD7CD30ABC95D8
1B30D0FF47A011EDAEDD7CD30ABC95D8
1B30D0FF47A011EDAEDD7CD30ABC95D8
1B30D0FF47A011EDAEDD7CD30ABC95D8
1B30D0FF47A011EDAEDD7CD30ABC95D8
1B30D0FF47A011EDAEDD7CD30ABC95D8
1B30D0FF47A011EDAEDD7CD30ABC95D8
1B30D0FF47A011EDAEDD7CD30ABC95D8
1B30D0FF47A011EDAEDD7CD30ABC95D8
1B30D0FF47A011EDAEDD7CD30ABC95D8
1B30D0FF47A011EDAEDD7CD30ABC95D8
1B30D0FF47A011EDAEDD7CD30ABC95D8
1B30D0FF47A011EDAEDD7CD30ABC95D8
1B30D0FF47A011EDAEDD7CD30ABC95D8
1B30D0FF47A011EDAEDD7CD30ABC95D8
1B30D0FF47A011EDAEDD7CD30ABC95D8
1B30D0FF47A011EDAEDD7CD30ABC95D8
1B30D0FF47A011EDAEDD7CD30ABC95D8
1B30D0FF47A011EDAEDD7CD30ABC95D8
1B30D0FF47A011EDAEDD7CD30ABC95D8
1B30D0FF47A011EDAEDD7CD30ABC95D8
1B30D0FF47A011EDAEDD7CD30ABC95D8
1B30D0FF47A011EDAEDD7CD30ABC95D8
1B30D0FF47A011EDAEDD7CD30ABC95D8
1B30D0FF47A011EDAEDD7CD30ABC95D8
1B30D0FF47A011EDAEDD7CD30ABC95D8
1B30D0FF47A011EDAEDD7CD30ABC95D8
1B30D0FF47A011EDAEDD7CD30ABC95D8
1B30D0FF47A011EDAEDD7CD30ABC95D8
1B30D0FF47A011EDAEDD7CD30ABC95D8
1B30D0FF47A011EDAEDD7CD30ABC95D8
1B30D0FF47A011EDAEDD7CD30ABC95D8
1B30D0FF47A011EDAEDD7CD30ABC95D8
1B30D0FF47A011EDAEDD7CD30ABC95D8
1B30D0FF47A011EDAEDD7CD30ABC95D8
1B30D0FF47A011EDAEDD7CD30ABC95D8
1B30D0FF47A011EDAEDD7CD30ABC95D8
1B30D0FF47A011EDAEDD7CD30ABC95D8
1B30D0FF47A011EDAEDD7CD30ABC95D8
1B30D0FF47A011EDAEDD7CD30ABC95D8
1B30D0FF47A011EDAEDD7CD30ABC95D8
1B30D0FF47A011EDAEDD7CD30ABC95D8
1B30D0FF47A011EDAEDD7CD30ABC95D8
1B30D0FF47A011EDAEDD7CD30ABC95D8
1B30D0FF47A011EDAEDD7CD30ABC95D8
1B30D0FF47A011EDAEDD7CD30ABC95D8
1B30D0FF47A011EDAEDD7CD30ABC95D8
1B30D0FF47A011EDAEDD7CD30ABC95D8
1B30D0FF47A011EDAEDD7CD30ABC95D8
1B30D0FF47A011EDAEDD7CD30ABC95D8
1B30D0FF47A011EDAEDD7CD30ABC95D8
1B30D0FF47A011EDAEDD7CD30ABC95D8
1B30D0FF47A011EDAEDD7CD30ABC95D8
1B30D0FF47A011EDAEDD7CD30ABC95D8
1B30D0FF47A011EDAEDD7CD30ABC95D8
1B30D0FF47A011EDAEDD7CD30ABC95D8
1B30D0FF47A011EDAEDD7CD30ABC95D8
1B30D0FF47A011EDAEDD7CD30ABC95D8
1B30D0FF47A011EDAEDD7CD30ABC95D8
1B30D0FF47A011EDAEDD7CD30ABC95D8
1B30D0FF47A011EDAEDD7CD30ABC95D8
1B30D0FF47A011EDAEDD7CD30ABC95D8
1B30D0FF47A011EDAEDD7CD30ABC95D8
1B30D0FF47A011EDAEDD7CD30ABC95D8
1B30D0FF47A011EDAEDD7CD30ABC95D8
1B30D0FF47A011EDAEDD7CD30ABC95D8
1B30D0FF47A011EDAEDD7CD30ABC95D8
1B30D0FF47A011EDAEDD7CD30ABC95D8
1B30D0FF47A011EDAEDD7CD30ABC95D8
1B30D0FF47A011EDAEDD7CD30ABC95D8
1B30D0FF47A011EDAEDD7CD30ABC95D8
1B30D0FF47A011EDAEDD7CD30ABC95D8
1B30D0FF47A011EDAEDD7CD30ABC95D8
1B30D0FF47A011EDAEDD7CD30ABC95D8
1B30D0FF47A011EDAEDD7CD30ABC95D8
1B30D0FF47A011EDAEDD7CD30ABC95D8
1B30D0FF47A011EDAEDD7CD30ABC95D8
1B30D0FF47A011EDAEDD7CD30ABC95D8
1B30D0FF47A011EDAEDD7CD30ABC95D8
1B30D0FF47A011EDAEDD7CD30ABC95D8
1B30D0FF47A011EDAEDD7CD30ABC95D8
1B30D0FF47A011EDAEDD7CD30ABC95D8
1B30D0FF47A011EDAEDD7CD30ABC95D8
1B30D0FF47A011EDAEDD7CD30ABC95D8
1B30D0FF47A011EDAEDD7CD30ABC95D8
1B30D0FF47A011EDAEDD7CD30ABC95D8
1B30D0FF47A011EDAEDD7CD30ABC95D8
1B30D0FF47A011EDAEDD7CD30ABC95D8
1B30D0FF47A011EDAEDD7CD30ABC95D8
1B30D0FF47A011EDAEDD7CD30ABC95D8
1B30D0FF47A011EDAEDD7CD30ABC95D8
1B30D0FF47A011EDAEDD7CD30ABC95D8
1B30D0FF47A011EDAEDD7CD30ABC95D8
1B30D0FF47A011EDAEDD7CD30ABC95D8
1B30D0FF47A011EDAEDD7CD30ABC95D8
1B30D0FF47A011EDAEDD7CD30ABC95D8
1B30D0FF47A011EDAEDD7CD30ABC95D8
1B30D0FF47A011EDAEDD7CD30ABC95D8
1B30D0FF47A011EDAEDD7CD30ABC95D8
1B30D0FF47A011EDAEDD7CD30ABC95D8
1B30D0FF47A011EDAEDD7CD30ABC95D8
1B30D0FF47A011EDAEDD7CD30ABC95D8
1B30D0FF47A011EDAEDD7CD30ABC95D8
1B30D0FF47A011EDAEDD7CD30ABC95D8
1B30D0FF47A011EDAEDD7CD30ABC95D8
1B30D0FF47A011EDAEDD7CD30ABC95D8
1B30D0FF47A011EDAEDD7CD30ABC95D8
1B30D0FF47A011EDAEDD7CD30ABC95D8
1B30D0FF47A011EDAEDD7CD30ABC95D8
1B30D0FF47A011EDAEDD7CD30ABC95D8
1B30D0FF47A011EDAEDD7CD30ABC95D8
1B30D0FF47A011EDAEDD7CD30ABC95D8
1B30D0FF47A011EDAEDD7CD30ABC95D8
1B30D0FF47A011EDAEDD7CD30ABC95D8
1B30D0FF47A011EDAEDD7CD30ABC95D8
1B30D0FF47A011EDAEDD7CD30ABC95D8
1B30D0FF47A011EDAEDD7CD30ABC95D8
1B30D0FF47A011EDAEDD7CD30ABC95D8
1B30D0FF47A011EDAEDD7CD30ABC95D8
1B30D0FF47A011EDAEDD7CD30ABC95D8
1B30D0FF47A011EDAEDD7CD30ABC95D8
1B30D0FF47A011EDAEDD7CD30ABC95D8
1B30D0FF47A011EDAEDD7CD30ABC95D8
1B30D0FF47A011EDAEDD7CD30ABC95D8
1B30D0FF47A011EDAEDD7CD30ABC95D8
1B30D0FF47A011EDAEDD7CD30ABC95D8
1B30D0FF47A011EDAEDD7CD30ABC95D8
1B30D0FF47A011EDAEDD7CD30ABC95D8
1B30D0FF47A011EDAEDD7CD30ABC95D8
1B30D0FF47A011EDAEDD7CD30ABC95D8
1B30D0FF47A011EDAEDD7CD30ABC95D8
1B30D0FF47A011EDAEDD7CD30ABC95D8
1B30D0FF47A011EDAEDD7CD30ABC95D8
1B30D0FF47A011EDAEDD7CD30ABC95D8
1B30D0FF47A011EDAEDD7CD30ABC95D8
1B30D0FF47A011EDAEDD7CD30ABC95D8
1B30D0FF47A011EDAEDD7CD30ABC95D8
1B30D0FF47A011EDAEDD7CD30ABC95D8
1B30D0FF47A011EDAEDD7CD30ABC95D8
1B30D0FF47A011EDAEDD7CD30ABC95D8
1B30D0FF47A011EDAEDD7CD30ABC95D8
1B30D0FF47A011EDAEDD7CD30ABC95D8
1B30D0FF47A011EDAEDD7CD30ABC95D8
1B30D0FF47A011EDAEDD7CD30ABC95D8
1B30D0FF47A011EDAEDD7CD30ABC95D8
1B30D0FF47A011EDAEDD7CD30ABC95D8
1B30D0FF47A011EDAEDD7CD30ABC95D8
1B30D0FF47A011EDAEDD7CD30ABC95D8
1B30D0FF47A011EDAEDD7CD30ABC95D8
1B30D0FF47A011EDAEDD7CD30ABC95D8
1B30D0FF47A011EDAEDD7CD30ABC95D8
1B30D0FF47A011EDAEDD7CD30ABC95D8
1B30D0FF47A011EDAEDD7CD30ABC95D8
1B30D0FF47A011EDAEDD7CD30ABC95D8
1B30D0FF47A011EDAEDD7CD30ABC95D8
1B30D0FF47A011EDAEDD7CD30ABC95D8
1B30D0FF47A011EDAEDD7CD30ABC95D8
1B30D0FF47A011EDAEDD7CD30ABC95D8
1B30D0FF47A011EDAEDD7CD30ABC95D8
1B30D0FF47A011EDAEDD7CD30ABC95D8
1B30D0FF47A011EDAEDD7CD30ABC95D8
1B30D0FF47A011EDAEDD7CD30ABC95D8
1B30D0FF47A011EDAEDD7CD30ABC95D8
1B30D0FF47A011EDAEDD7CD30ABC95D8
1B30D0FF47A011EDAEDD7CD30ABC95D8
1B30D0FF47A011EDAEDD7CD30ABC95D8
1B30D0FF47A011EDAEDD7CD30ABC95D8
1B30D0FF47A011EDAEDD7CD30ABC95D8
1B30D0FF47A011EDAEDD7CD30ABC95D8
1B30D0FF47A011EDAEDD7CD30ABC95D8
1B30D0FF47A011EDAEDD7CD30ABC95D8
1B30D0FF47A011EDAEDD7CD30ABC95D8
1B30D0FF47A011EDAEDD7CD30ABC95D8
1B30D0FF47A011EDAEDD7CD30ABC95D8
1B30D0FF47A011EDAEDD7CD30ABC95D8
1B30D0FF47A011EDAEDD7CD30ABC95D8
1B30D0FF47A011EDAEDD7CD30ABC95D8
1B30D0FF47A011EDAEDD7CD30ABC95D8
1B30D0FF47A011EDAEDD7CD30ABC95D8
1B30D0FF47A011EDAEDD7CD30ABC95D8
1B30D0FF47A011EDAEDD7CD30ABC95D8
1B30D0FF47A011EDAEDD7CD30ABC95D8
1B30D0FF47A011EDAEDD7CD30ABC95D8
1B30D0FF47A011EDAEDD7CD30ABC95D8
1B30D0FF47A011EDAEDD7CD30ABC95D8
1B30D0FF47A011EDAEDD7CD30ABC95D8
1B30D0FF47A011EDAEDD7CD30ABC95D8
1B30D0FF47A011EDAEDD7CD30ABC95D8
1B30D0FF47A011EDAEDD7CD30ABC95D8
1B30D0FF47A011EDAEDD7CD30ABC95D8
1B30D0FF47A011EDAEDD7CD30ABC95D8
1B30D0FF47A011EDAEDD7CD30ABC95D8
1B30D0FF47A011EDAEDD7CD30ABC95D8
1B30D0FF47A011EDAEDD7CD30ABC95D8
1B30D0FF47A011EDAEDD7CD30ABC95D8
1B30D0FF47A011EDAEDD7CD30ABC95D8
1B30D0FF47A011EDAEDD7CD30ABC95D8
1B30D0FF47A011EDAEDD7CD30ABC95D8
1B30D0FF47A011EDAEDD7CD30ABC95D8
1B30D0FF47A011EDAEDD7CD30ABC95D8
1B30D0FF47A011EDAEDD7CD30ABC95D8
1B30D0FF47A011EDAEDD7CD30ABC95D8
1B30D0FF47A011EDAEDD7CD30ABC95D8
1B30D0FF47A011EDAEDD7CD30ABC95D8
1B30D0FF47A011EDAEDD7CD30ABC95D8
1B30D0FF47A011EDAEDD7CD30ABC95D8
1B30D0FF47A011EDAEDD7CD30ABC95D8
1B30D0FF47A011EDAEDD7CD30ABC95D8
1B30D0FF47A011EDAEDD7CD30ABC95D8
1B30D0FF47A011EDAEDD7CD30ABC95D8
1B30D0FF47A011EDAEDD7CD30ABC95D8
1B30D0FF47A011EDAEDD7CD30ABC95D8
1B30D0FF47A011EDAEDD7CD30ABC95D8
1B30D0FF47A011EDAEDD7CD30ABC95D8
1B30D0FF47A011EDAEDD7CD30ABC95D8
1B30D0FF47A011EDAEDD7CD30ABC95D8
1B30D0FF47A011EDAEDD7CD30ABC95D8
1B30D0FF47A011EDAEDD7CD30ABC95D8
1B30D0FF47A011EDAEDD7CD30ABC95D8
1B30D0FF47A011EDAEDD7CD30ABC95D8
1B30D0FF47A011EDAEDD7CD30ABC95D8
1B30D0FF47A011EDAEDD7CD30ABC95D8
1B30D0FF47A011EDAEDD7CD30ABC95D8
1B30D0FF47A011EDAEDD7CD30ABC95D8
1B30D0FF47A011EDAEDD7CD30ABC95D8
1B30D0FF47A011EDAEDD7CD30ABC95D8
1B30D0FF47A011EDAEDD7CD30ABC95D8
1B30D0FF47A011EDAEDD7CD30ABC95D8
1B30D0FF47A011EDAEDD7CD30ABC95D8
1B30D0FF47A011EDAEDD7CD30ABC95D8
1B30D0FF47A011EDAEDD7CD30ABC95D8
1B30D0FF47A011EDAEDD7CD30ABC95D8
1B30D0FF47A011EDAEDD7CD30ABC95D8
1B30D0FF47A011EDAEDD7CD30ABC95D8
1B30D0FF47A011EDAEDD7CD30ABC95D8
1B30D0FF47A011EDAEDD7CD30ABC95D8
1B30D0FF47A011EDAEDD7CD30ABC95D8
1B30D0FF47A011EDAEDD7CD30ABC95D8
1B30D0FF47A011EDAEDD7CD30ABC95D8
1B30D0FF47A011EDAEDD7CD30ABC95D8
1B30D0FF47A011EDAEDD7CD30ABC95D8
1B30D0FF47A011EDAEDD7CD30ABC95D8
1B30D0FF47A011EDAEDD7CD30ABC95D8
1B30D0FF47A011EDAEDD7CD30ABC95D8
1B30D0FF47A011EDAEDD7CD30ABC95D8
1B30D0FF47A011EDAEDD7CD30ABC95D8
1B30D0FF47A011EDAEDD7CD30ABC95D8
1B30D0FF47A011EDAEDD7CD30ABC95D8
1B30D0FF47A011EDAEDD7CD30ABC95D8
1B30D0FF47A011EDAEDD7CD30ABC95D8
1B30D0FF47A011EDAEDD7CD30ABC95D8
1B30D0FF47A011EDAEDD7CD30ABC95D8
1B30D0FF47A011EDAEDD7CD30ABC95D8
1B30D0FF47A011EDAEDD7CD30ABC95D8
1B30D0FF47A011EDAEDD7CD30ABC95D8
1B30D0FF47A011EDAEDD7CD30ABC95D8
1B30D0FF47A011EDAEDD7CD30ABC95D8
1B30D0FF47A011EDAEDD7CD30ABC95D8
1B30D0FF47A011EDAEDD7CD30ABC95D8
1B30D0FF47A011EDAEDD7CD30ABC95D8
1B30D0FF47A011EDAEDD7CD30ABC95D8
1B30D0FF47A011EDAEDD7CD30ABC95D8
1B30D0FF47A011EDAEDD7CD30ABC95D8
1B30D0FF47A011EDAEDD7CD30ABC95D8
1B30D0FF47A011EDAEDD7CD30ABC95D8
1B30D0FF47A011EDAEDD7CD30ABC95D8
1B30D0FF47A011EDAEDD7CD30ABC95D8
1B30D0FF47A011EDAEDD7CD30ABC95D8
1B30D0FF47A011EDAEDD7CD30ABC95D8
1B30D0FF47A011EDAEDD7CD30ABC95D8
1B30D0FF47A011EDAEDD7CD30ABC95D8
1B30D0FF47A011EDAEDD7CD30ABC95D8
1B30D0FF47A011EDAEDD7CD30ABC95D8
1B30D0FF47A011EDAEDD7CD30ABC95D8
1B30D0FF47A011EDAEDD7CD30ABC95D8
1B30D0FF47A011EDAEDD7CD30ABC95D8
1B30D0FF47A011EDAEDD7CD30ABC95D8
1B30D0FF47A011EDAEDD7CD30ABC95D8
1B30D0FF47A011EDAEDD7CD30ABC95D8
1B30D0FF47A011EDAEDD7CD30ABC95D8
1B30D0FF47A011EDAEDD7CD30ABC95D8
1B30D0FF47A011EDAEDD7CD30ABC95D8
1B30D0FF47A011EDAEDD7CD30ABC95D8
1B30D0FF47A011EDAEDD7CD30ABC95D8
1B30D0FF47A011EDAEDD7CD30ABC95D8
1B30D0FF47A011EDAEDD7CD30ABC95D8
1B30D0FF47A011EDAEDD7CD30ABC95D8
1B30D0FF47A011EDAEDD7CD30ABC95D8
1B30D0FF47A011EDAEDD7CD30ABC95D8
1B30D0FF47A011EDAEDD7CD30ABC95D8
1B30D0FF47A011EDAEDD7CD30ABC95D8
1B30D0FF47A011EDAEDD7CD30ABC95D8
1B30D0FF47A011EDAEDD7CD30ABC95D8
1B30D0FF47A011EDAEDD7CD30ABC95D8
1B30D0FF47A011EDAEDD7CD30ABC95D8
1B30D0FF47A011EDAEDD7CD30ABC95D8
1B30D0FF47A011EDAEDD7CD30ABC95D8
1B30D0FF47A011EDAEDD7CD30ABC95D8
1B30D0FF47A011EDAEDD7CD30ABC95D8
1B30D0FF47A011EDAEDD7CD30ABC95D8
1B30D0FF47A011EDAEDD7CD30ABC95D8
1B30D0FF47A011EDAEDD7CD30ABC95D8
1B30D0FF47A011EDAEDD7CD30ABC95D8
1B30D0FF47A011EDAEDD7CD30ABC95D8
1B30D0FF47A011EDAEDD7CD30ABC95D8
1B30D0FF47A011EDAEDD7CD30ABC95D8
1B30D0FF47A011EDAEDD7CD30ABC95D8
1B30D0FF47A011EDAEDD7CD30ABC95D8
1B30D0FF47A011EDAEDD7CD30ABC95D8
1B30D0FF47A011EDAEDD7CD30ABC95D8
1B30D0FF47A011EDAEDD7CD30ABC95D8
1B30D0FF47A011EDAEDD7CD30ABC95D8
1B30D0FF47A011EDAEDD7CD30ABC95D8
1B30D0FF47A011EDAEDD7CD30ABC95D8
1B30D0FF47A011EDAEDD7CD30ABC95D8
1B30D0FF47A011EDAEDD7CD30ABC95D8
1B30D0FF47A011EDAEDD7CD30ABC95D8
1B30D0FF47A011EDAEDD7CD30ABC95D8
1B30D0FF47A011EDAEDD7CD30ABC95D8
1B30D0FF47A011EDAEDD7CD30ABC95D8
1B30D0FF47A011EDAEDD7CD30ABC95D8
1B30D0FF47A011EDAEDD7CD30ABC95D8
1B30D0FF47A011EDAEDD7CD30ABC95D8
1B30D0FF47A011EDAEDD7CD30ABC95D8
1B30D0FF47A011EDAEDD7CD30ABC95D8
1B30D0FF47A011EDAEDD7CD30ABC95D8
1B30D0FF47A011EDAEDD7CD30ABC95D8
1B30D0FF47A011EDAEDD7CD30ABC95D8
1B30D0FF47A011EDAEDD7CD30ABC95D8
1B30D0FF47A011EDAEDD7CD30ABC95D8
1B30D0FF47A011EDAEDD7CD30ABC95D8
1B30D0FF47A011EDAEDD7CD30ABC95D8
1B30D0FF47A011EDAEDD7CD30ABC95D8
1B30D0FF47A011EDAEDD7CD30ABC95D8
1B30D0FF47A011EDAEDD7CD30ABC95D8
1B30D0FF47A011EDAEDD7CD30ABC95D8
1B30D0FF47A011EDAEDD7CD30ABC95D8
1B30D0FF47A011EDAEDD7CD30ABC95D8
1B30D0FF47A011EDAEDD7CD30ABC95D8
1B30D0FF47A011EDAEDD7CD30ABC95D8
1B30D0FF47A011EDAEDD7CD30ABC95D8
1B30D0FF47A011EDAEDD7CD30ABC95D8
1B30D0FF47A011EDAEDD7CD30ABC95D8
1B30D0FF47A011EDAEDD7CD30ABC95D8
1B30D0FF47A011EDAEDD7CD30ABC95D8
1B30D0FF47A011EDAEDD7CD30ABC95D8
1B30D0FF47A011EDAEDD7CD30ABC95D8
1B30D0FF47A011EDAEDD7CD30ABC95D8
1B30D0FF47A011EDAEDD7CD30ABC95D8
1B30D0FF47A011EDAEDD7CD30ABC95D8
1B30D0FF47A011EDAEDD7CD30ABC95D8
1B30D0FF47A011EDAEDD7CD30ABC95D8
1B30D0FF47A011EDAEDD7CD30ABC95D8
1B30D0FF47A011EDAEDD7CD30ABC95D8
1B30D0FF47A011EDAEDD7CD30ABC95D8
1B30D0FF47A011EDAEDD7CD30ABC95D8
1B30D0FF47A011EDAEDD7CD30ABC95D8
1B30D0FF47A011EDAEDD7CD30ABC95D8
1B30D0FF47A011EDAEDD7CD30ABC95D8
1B30D0FF47A011EDAEDD7CD30ABC95D8
1B30D0FF47A011EDAEDD7CD30ABC95D8
1B30D0FF47A011EDAEDD7CD30ABC95D8
1B30D0FF47A011EDAEDD7CD30ABC95D8
1B30D0FF47A011EDAEDD7CD30ABC95D8
1B30D0FF47A011EDAEDD7CD30ABC95D8
1B30D0FF47A011EDAEDD7CD30ABC95D8
1B30D0FF47A011EDAEDD7CD30ABC95D8
1B30D0FF47A011EDAEDD7CD30ABC95D8
1B30D0FF47A011EDAEDD7CD30ABC95D8
1B30D0FF47A011EDAEDD7CD30ABC95D8
1B30D0FF47A011EDAEDD7CD30ABC95D8
1B30D0FF47A011EDAEDD7CD30ABC95D8
1B30D0FF47A011EDAEDD7CD30ABC95D8
1B30D0FF47A011EDAEDD7CD30ABC95D8
1B30D0FF47A011EDAEDD7CD30ABC95D8
1B30D0FF47A011EDAEDD7CD30ABC95D8
1B30D0FF47A011EDAEDD7CD30ABC95D8
1B30D0FF47A011EDAEDD7CD30ABC95D8
1B30D0FF47A011EDAEDD7CD30ABC95D8
1B30D0FF47A011EDAEDD7CD30ABC95D8
1B30D0FF47A011EDAEDD7CD30ABC95D8
1B30D0FF47A011EDAEDD7CD30ABC95D8
1B30D0FF47A011EDAEDD7CD30ABC95D8
1B30D0FF47A011EDAEDD7CD30ABC95D8
1B30D0FF47A011EDAEDD7CD30ABC95D8
1B30D0FF47A011EDAEDD7CD30ABC95D8
1B30D0FF47A011EDAEDD7CD30ABC95D8
1B30D0FF47A011EDAEDD7CD30ABC95D8
1B30D0FF47A011EDAEDD7CD30ABC95D8
1B30D0FF47A011EDAEDD7CD30ABC95D8
1B30D0FF47A011EDAEDD7CD30ABC95D8
1B30D0FF47A011EDAEDD7CD30ABC95D8
1B30D0FF47A011EDAEDD7CD30ABC95D8
1B30D0FF47A011EDAEDD7CD30ABC95D8
1B30D0FF47A011EDAEDD7CD30ABC95D8
1B30D0FF47A011EDAEDD7CD30ABC95D8
1B30D0FF47A011EDAEDD7CD30ABC95D8
1B30D0FF47A011EDAEDD7CD30ABC95D8
1B30D0FF47A011EDAEDD7CD30ABC95D8
1B30D0FF47A011EDAEDD7CD30ABC95D8
1B30D0FF47A011EDAEDD7CD30ABC95D8
1B30D0FF47A011EDAEDD7CD30ABC95D8
1B30D0FF47A011EDAEDD7CD30ABC95D8
1B30D0FF47A011EDAEDD7CD30ABC95D8
1B30D0FF47A011EDAEDD7CD30ABC95D8
1B30D0FF47A011EDAEDD7CD30ABC95D8
1B30D0FF47A011EDAEDD7CD30ABC95D8
1B30D0FF47A011EDAEDD7CD30ABC95D8
1B30D0FF47A011EDAEDD7CD30ABC95D8
1B30D0FF47A011EDAEDD7CD30ABC95D8
1B30D0FF47A011EDAEDD7CD30ABC95D8
1B30D0FF47A011EDAEDD7CD30ABC95D8
1B30D0FF47A011EDAEDD7CD30ABC95D8
1B30D0FF47A011EDAEDD7CD30ABC95D8
1B30D0FF47A011EDAEDD7CD30ABC95D8
1B30D0FF47A011EDAEDD7CD30ABC95D8
1B30D0FF47A011EDAEDD7CD30ABC95D8
1B30D0FF47A011EDAEDD7CD30ABC95D8
1B30D0FF47A011EDAEDD7CD30ABC95D8
1B30D0FF47A011EDAEDD7CD30ABC95D8
1B30D0FF47A011EDAEDD7CD30ABC95D8
1B30D0FF47A011EDAEDD7CD30ABC95D8
1B30D0FF47A011EDAEDD7CD30ABC95D8
1B30D0FF47A011EDAEDD7CD30ABC95D8
1B30D0FF47A011EDAEDD7CD30ABC95D8
1B30D0FF47A011EDAEDD7CD30ABC95D8
1B30D0FF47A011EDAEDD7CD30ABC95D8
1B30D0FF47A011EDAEDD7CD30ABC95D8
1B30D0FF47A011EDAEDD7CD30ABC95D8
1B30D0FF47A011EDAEDD7CD30ABC95D8
1B30D0FF47A011EDAEDD7CD30ABC95D8
1B30D0FF47A011EDAEDD7CD30ABC95D8
1B30D0FF47A011EDAEDD7CD30ABC95D8
1B30D0FF47A011EDAEDD7CD30ABC95D8
1B30D0FF47A011EDAEDD7CD30ABC95D8
1B30D0FF47A011EDAEDD7CD30ABC95D8
1B30D0FF47A011EDAEDD7CD30ABC95D8
1B30D0FF47A011EDAEDD7CD30ABC95D8
1B30D0FF47A011EDAEDD7CD30ABC95D8
1B30D0FF47A011EDAEDD7CD30ABC95D8
1B30D0FF47A011EDAEDD7CD30ABC95D8
1B30D0FF47A011EDAEDD7CD30ABC95D8
1B30D0FF47A011EDAEDD7CD30ABC95D8
1B30D0FF47A011EDAEDD7CD30ABC95D8
1B30D0FF47A011EDAEDD7CD30ABC95D8
1B30D0FF47A011EDAEDD7CD30ABC95D8
1B30D0FF47A011EDAEDD7CD30ABC95D8
1B30D0FF47A011EDAEDD7CD30ABC95D8
1B30D0FF47A011EDAEDD7CD30ABC95D8
1B30D0FF47A011EDAEDD7CD30ABC95D8
1B30D0FF47A011EDAEDD7CD30ABC95D8
1B30D0FF47A011EDAEDD7CD30ABC95D8
1B30D0FF47A011EDAEDD7CD30ABC95D8
1B30D0FF47A011EDAEDD7CD30ABC95D8
1B30D0FF47A011EDAEDD7CD30ABC95D8
1B30D0FF47A011EDAEDD7CD30ABC95D8
1B30D0FF47A011EDAEDD7CD30ABC95D8
1B30D0FF47A011EDAEDD7CD30ABC95D8
1B30D0FF47A011EDAEDD7CD30ABC95D8
1B30D0FF47A011EDAEDD7CD30ABC95D8
1B30D0FF47A011EDAEDD7CD30ABC95D8
1B30D0FF47A011EDAEDD7CD30ABC95D8
1B30D0FF47A011EDAEDD7CD30ABC95D8
1B30D0FF47A011EDAEDD7CD30ABC95D8
1B30D0FF47A011EDAEDD7CD30ABC95D8
1B30D0FF47A011EDAEDD7CD30ABC95D8
1B30D0FF47A011EDAEDD7CD30ABC95D8
1B30D0FF47A011EDAEDD7CD30ABC95D8
1B30D0FF47A011EDAEDD7CD30ABC95D8
1B30D0FF47A011EDAEDD7CD30ABC95D8
1B30D0FF47A011EDAEDD7CD30ABC95D8
1B30D0FF47A011EDAEDD7CD30ABC95D8
1B30D0FF47A011EDAEDD7CD30ABC95D8
1B30D0FF47A011EDAEDD7CD30ABC95D8
1B30D0FF47A011EDAEDD7CD30ABC95D8
1B30D0FF47A011EDAEDD7CD30ABC95D8
1B30D0FF47A011EDAEDD7CD30ABC95D8
1B30D0FF47A011EDAEDD7CD30ABC95D8
1B30D0FF47A011EDAEDD7CD30ABC95D8
1B30D0FF47A011EDAEDD7CD30ABC95D8
1B30D0FF47A011EDAEDD7CD30ABC95D8
1B30D0FF47A011EDAEDD7CD30ABC95D8
1B30D0FF47A011EDAEDD7CD30ABC95D8
1B30D0FF47A011EDAEDD7CD30ABC95D8
1B30D0FF47A011EDAEDD7CD30ABC95D8
1B30D0FF47A011EDAEDD7CD30ABC95D8
1B30D0FF47A011EDAEDD7CD30ABC95D8
1B30D0FF47A011EDAEDD7CD30ABC95D8
1B30D0FF47A011EDAEDD7CD30ABC95D8
1B30D0FF47A011EDAEDD7CD30ABC95D8
1B30D0FF47A011EDAEDD7CD30ABC95D8
1B30D0FF47A011EDAEDD7CD30ABC95D8
1B30D0FF47A011EDAEDD7CD30ABC95D8
1B30D0FF47A011EDAEDD7CD30ABC95D8
1B30D0FF47A011EDAEDD7CD30ABC95D8
1B30D0FF47A011EDAEDD7CD30ABC95D8
1B30D0FF47A011EDAEDD7CD30ABC95D8
1B30D0FF47A011EDAEDD7CD30ABC95D8
1B30D0FF47A011EDAEDD7CD30ABC95D8
1B30D0FF47A011EDAEDD7CD30ABC95D8
1B30D0FF47A011EDAEDD7CD30ABC95D8
1B30D0FF47A011EDAEDD7CD30ABC95D8
1B30D0FF47A011EDAEDD7CD30ABC95D8
1B30D0FF47A011EDAEDD7CD30ABC95D8
1B30D0FF47A011EDAEDD7CD30ABC95D8
1B30D0FF47A011EDAEDD7CD30ABC95D8
1B30D0FF47A011EDAEDD7CD30ABC95D8
1B30D0FF47A011EDAEDD7CD30ABC95D8
1B30D0FF47A011EDAEDD7CD30ABC95D8
1B30D0FF47A011EDAEDD7CD30ABC95D8
1B30D0FF47A011EDAEDD7CD30ABC95D8
1B30D0FF47A011EDAEDD7CD30ABC95D8
1B30D0FF47A011EDAEDD7CD30ABC95D8
1B30D0FF47A011EDAEDD7CD30ABC95D8
1B30D0FF47A011EDAEDD7CD30ABC95D8
1B30D0FF47A011EDAEDD7CD30ABC95D8
1B30D0FF47A011EDAEDD7CD30ABC95D8
1B30D0FF47A011EDAEDD7CD30ABC95D8
1B30D0FF47A011EDAEDD7CD30ABC95D8
1B30D0FF47A011EDAEDD7CD30ABC95D8
1B30D0FF47A011EDAEDD7CD30ABC95D8
1B30D0FF47A011EDAEDD7CD30ABC95D8
1B30D0FF47A011EDAEDD7CD30ABC95D8
1B30D0FF47A011EDAEDD7CD30ABC95D8
1B30D0FF47A011EDAEDD7CD30ABC95D8
1B30D0FF47A011EDAEDD7CD30ABC95D8
1B30D0FF47A011EDAEDD7CD30ABC95D8
1B30D0FF47A011EDAEDD7CD30ABC95D8
1B30D0FF47A011EDAEDD7CD30ABC95D8
1B30D0FF47A011EDAEDD7CD30ABC95D8
1B30D0FF47A011EDAEDD7CD30ABC95D8
1B30D0FF47A011EDAEDD7CD30ABC95D8
1B30D0FF47A011EDAEDD7CD30ABC95D8
1B30D0FF47A011EDAEDD7CD30ABC95D8
1B30D0FF47A011EDAEDD7CD30ABC95D8
1B30D0FF47A011EDAEDD7CD30ABC95D8
1B30D0FF47A011EDAEDD7CD30ABC95D8
1B30D0FF47A011EDAEDD7CD30ABC95D8
1B30D0FF47A011EDAEDD7CD30ABC95D8
1B30D0FF47A011EDAEDD7CD30ABC95D8
1B30D0FF47A011EDAEDD7CD30ABC95D8
1B30D0FF47A011EDAEDD7CD30ABC95D8
1B30D0FF47A011EDAEDD7CD30ABC95D8
1B30D0FF47A011EDAEDD7CD30ABC95D8
1B30D0FF47A011EDAEDD7CD30ABC95D8
1B30D0FF47A011EDAEDD7CD30ABC95D8
1B30D0FF47A011EDAEDD7CD30ABC95D8
1B30D0FF47A011EDAEDD7CD30ABC95D8
1B30D0FF47A011EDAEDD7CD30ABC95D8
1B30D0FF47A011EDAEDD7CD30ABC95D8
1B30D0FF47A011EDAEDD7CD30ABC95D8
1B30D0FF47A011EDAEDD7CD30ABC95D8
1B30D0FF47A011EDAEDD7CD30ABC95D8
1B30D0FF47A011EDAEDD7CD30ABC95D8
1B30D0FF47A011EDAEDD7CD30ABC95D8
1B30D0FF47A011EDAEDD7CD30ABC95D8
1B30D0FF47A011EDAEDD7CD30ABC95D8
1B30D0FF47A011EDAEDD7CD30ABC95D8
1B30D0FF47A011EDAEDD7CD30ABC95D8
1B30D0FF47A011EDAEDD7CD30ABC95D8
1B30D0FF47A011EDAEDD7CD30ABC95D8
1B30D0FF47A011EDAEDD7CD30ABC95D8
1B30D0FF47A011EDAEDD7CD30ABC95D8
1B30D0FF47A011EDAEDD7CD30ABC95D8
1B30D0FF47A011EDAEDD7CD30ABC95D8
1B30D0FF47A011EDAEDD7CD30ABC95D8
1B30D0FF47A011EDAEDD7CD30ABC95D8
1B30D0FF47A011EDAEDD7CD30ABC95D8
1B30D0FF47A011EDAEDD7CD30ABC95D8
1B30D0FF47A011EDAEDD7CD30ABC95D8
1B30D0FF47A011EDAEDD7CD30ABC95D8
1B30D0FF47A011EDAEDD7CD30ABC95D8
1B30D0FF47A011EDAEDD7CD30ABC95D8
1B30D0FF47A011EDAEDD7CD30ABC95D8
1B30D0FF47A011EDAEDD7CD30ABC95D8
1B30D0FF47A011EDAEDD7CD30ABC95D8
1B30D0FF47A011EDAEDD7CD30ABC95D8
1B30D0FF47A011EDAEDD7CD30ABC95D8
1B30D0FF47A011EDAEDD7CD30ABC95D8
1B30D0FF47A011EDAEDD7CD30ABC95D8
1B30D0FF47A011EDAEDD7CD30ABC95D8
1B30D0FF47A011EDAEDD7CD30ABC95D8
1B30D0FF47A011EDAEDD7CD30ABC95D8
1B30D0FF47A011EDAEDD7CD30ABC95D8
1B30D0FF47A011EDAEDD7CD30ABC95D8
1B30D0FF47A011EDAEDD7CD30ABC95D8
1B30D0FF47A011EDAEDD7CD30ABC95D8
1B30D0FF47A011EDAEDD7CD30ABC95D8
1B30D0FF47A011EDAEDD7CD30ABC95D8
1B30D0FF47A011EDAEDD7CD30ABC95D8
1B30D0FF47A011EDAEDD7CD30ABC95D8
1B30D0FF47A011EDAEDD7CD30ABC95D8
1B30D0FF47A011EDAEDD7CD30ABC95D8
1B30D0FF47A011EDAEDD7CD30ABC95D8
1B30D0FF47A011EDAEDD7CD30ABC95D8
1B30D0FF47A011EDAEDD7CD30ABC95D8
1B30D0FF47A011EDAEDD7CD30ABC95D8
1B30D0FF47A011EDAEDD7CD30ABC95D8
1B30D0FF47A011EDAEDD7CD30ABC95D8
1B30D0FF47A011EDAEDD7CD30ABC95D8
1B30D0FF47A011EDAEDD7CD30ABC95D8
1B30D0FF47A011EDAEDD7CD30ABC95D8
1B30D0FF47A011EDAEDD7CD30ABC95D8
1B30D0FF47A011EDAEDD7CD30ABC95D8
1B30D0FF47A011EDAEDD7CD30ABC95D8
1B30D0FF47A011EDAEDD7CD30ABC95D8
1B30D0FF47A011EDAEDD7CD30ABC95D8
1B30D0FF47A011EDAEDD7CD30ABC95D8
1B30D0FF47A011EDAEDD7CD30ABC95D8
1B30D0FF47A011EDAEDD7CD30ABC95D8
1B30D0FF47A011EDAEDD7CD30ABC95D8
1B30D0FF47A011EDAEDD7CD30ABC95D8
1B30D0FF47A011EDAEDD7CD30ABC95D8
1B30D0FF47A011EDAEDD7CD30ABC95D8
1B30D0FF47A011EDAEDD7CD30ABC95D8
1B30D0FF47A011EDAEDD7CD30ABC95D8
1B30D0FF47A011EDAEDD7CD30ABC95D8
1B30D0FF47A011EDAEDD7CD30ABC95D8
1B30D0FF47A011EDAEDD7CD30ABC95D8
1B30D0FF47A011EDAEDD7CD30ABC95D8
1B30D0FF47A011EDAEDD7CD30ABC95D8
1B30D0FF47A011EDAEDD7CD30ABC95D8
1B30D0FF47A011EDAEDD7CD30ABC95D8
1B30D0FF47A011EDAEDD7CD30ABC95D8
1B30D0FF47A011EDAEDD7CD30ABC95D8
1B30D0FF47A011EDAEDD7CD30ABC95D8
1B30D0FF47A011EDAEDD7CD30ABC95D8
1B30D0FF47A011EDAEDD7CD30ABC95D8
1B30D0FF47A011EDAEDD7CD30ABC95D8
1B30D0FF47A011EDAEDD7CD30ABC95D8
1B30D0FF47A011EDAEDD7CD30ABC95D8
1B30D0FF47A011EDAEDD7CD30ABC95D8
1B30D0FF47A011EDAEDD7CD30ABC95D8
1B30D0FF47A011EDAEDD7CD30ABC95D8
1B30D0FF47A011EDAEDD7CD30ABC95D8
1B30D0FF47A011EDAEDD7CD30ABC95D8
1B30D0FF47A011EDAEDD7CD30ABC95D8
1B30D0FF47A011EDAEDD7CD30ABC95D8
1B30D0FF47A011EDAEDD7CD30ABC95D8
1B30D0FF47A011EDAEDD7CD30ABC95D8
1B30D0FF47A011EDAEDD7CD30ABC95D8
1B30D0FF47A011EDAEDD7CD30ABC95D8
1B30D0FF47A011EDAEDD7CD30ABC95D8
1B30D0FF47A011EDAEDD7CD30ABC95D8
1B30D0FF47A011EDAEDD7CD30ABC95D8
1B30D0FF47A011EDAEDD7CD30ABC95D8
1B30D0FF47A011EDAEDD7CD30ABC95D8
1B30D0FF47A011EDAEDD7CD30ABC95D8
1B30D0FF47A011EDAEDD7CD30ABC95D8
1B30D0FF47A011EDAEDD7CD30ABC95D8
1B30D0FF47A011EDAEDD7CD30ABC95D8
1B30D0FF47A011EDAEDD7CD30ABC95D8
1B30D0FF47A011EDAEDD7CD30ABC95D8
1B30D0FF47A011EDAEDD7CD30ABC95D8
1B30D0FF47A011EDAEDD7CD30ABC95D8
1B30D0FF47A011EDAEDD7CD30ABC95D8
1B30D0FF47A011EDAEDD7CD30ABC95D8
1B30D0FF47A011EDAEDD7CD30ABC95D8
1B30D0FF47A011EDAEDD7CD30ABC95D8
1B30D0FF47A011EDAEDD7CD30ABC95D8
1B30D0FF47A011EDAEDD7CD30ABC95D8
1B30D0FF47A011EDAEDD7CD30ABC95D8
1B30D0FF47A011EDAEDD7CD30ABC95D8
1B30D0FF47A011EDAEDD7CD30ABC95D8
1B30D0FF47A011EDAEDD7CD30ABC95D8
1B30D0FF47A011EDAEDD7CD30ABC95D8
1B30D0FF47A011EDAEDD7CD30ABC95D8
1B30D0FF47A011EDAEDD7CD30ABC95D8
1B30D0FF47A011EDAEDD7CD30ABC95D8
1B30D0FF47A011EDAEDD7CD30ABC95D8
1B30D0FF47A011EDAEDD7CD30ABC95D8
1B30D0FF47A011EDAEDD7CD30ABC95D8
1B30D0FF47A011EDAEDD7CD30ABC95D8
1B30D0FF47A011EDAEDD7CD30ABC95D8
1B30D0FF47A011EDAEDD7CD30ABC95D8
1B30D0FF47A011EDAEDD7CD30ABC95D8
1B30D0FF47A011EDAEDD7CD30ABC95D8
1B30D0FF47A011EDAEDD7CD30ABC95D8
1B30D0FF47A011EDAEDD7CD30ABC95D8
1B30D0FF47A011EDAEDD7CD30ABC95D8
1B30D0FF47A011EDAEDD7CD30ABC95D8
1B30D0FF47A011EDAEDD7CD30ABC95D8
1B30D0FF47A011EDAEDD7CD30ABC95D8
1B30D0FF47A011EDAEDD7CD30ABC95D8
1B30D0FF47A011EDAEDD7CD30ABC95D8
1B30D0FF47A011EDAEDD7CD30ABC95D8
1B30D0FF47A011EDAEDD7CD30ABC95D8
1B30D0FF47A011EDAEDD7CD30ABC95D8
1B30D0FF47A011EDAEDD7CD30ABC95D8
1B30D0FF47A011EDAEDD7CD30ABC95D8
1B30D0FF47A011EDAEDD7CD30ABC95D8
1B30D0FF47A011EDAEDD7CD30ABC95D8
1B30D0FF47A011EDAEDD7CD30ABC95D8
1B30D0FF47A011EDAEDD7CD30ABC95D8
1B30D0FF47A011EDAEDD7CD30ABC95D8
1B30D0FF47A011EDAEDD7CD30ABC95D8
1B30D0FF47A011EDAEDD7CD30ABC95D8
1B30D0FF47A011EDAEDD7CD30ABC95D8
1B30D0FF47A011EDAEDD7CD30ABC95D8
1B30D0FF47A011EDAEDD7CD30ABC95D8
1B30D0FF47A011EDAEDD7CD30ABC95D8
1B30D0FF47A011EDAEDD7CD30ABC95D8
1B30D0FF47A011EDAEDD7CD30ABC95D8
1B30D0FF47A011EDAEDD7CD30ABC95D8
1B30D0FF47A011EDAEDD7CD30ABC95D8
1B30D0FF47A011EDAEDD7CD30ABC95D8
1B30D0FF47A011EDAEDD7CD30ABC95D8
1B30D0FF47A011EDAEDD7CD30ABC95D8
1B30D0FF47A011EDAEDD7CD30ABC95D8
1B30D0FF47A011EDAEDD7CD30ABC95D8
1B30D0FF47A011EDAEDD7CD30ABC95D8
1B30D0FF47A011EDAEDD7CD30ABC95D8
1B30D0FF47A011EDAEDD7CD30ABC95D8
1B30D0FF47A011EDAEDD7CD30ABC95D8
1B30D0FF47A011EDAEDD7CD30ABC95D8
1B30D0FF47A011EDAEDD7CD30ABC95D8
1B30D0FF47A011EDAEDD7CD30ABC95D8
1B30D0FF47A011EDAEDD7CD30ABC95D8
1B30D0FF47A011EDAEDD7CD30ABC95D8
1B30D0FF47A011EDAEDD7CD30ABC95D8
1B30D0FF47A011EDAEDD7CD30ABC95D8
1B30D0FF47A011EDAEDD7CD30ABC95D8
1B30D0FF47A011EDAEDD7CD30ABC95D8
1B30D0FF47A011EDAEDD7CD30ABC95D8
1B30D0FF47A011EDAEDD7CD30ABC95D8
1B30D0FF47A011EDAEDD7CD30ABC95D8
1B30D0FF47A011EDAEDD7CD30ABC95D8
1B30D0FF47A011EDAEDD7CD30ABC95D8
1B30D0FF47A011EDAEDD7CD30ABC95D8
1B30D0FF47A011EDAEDD7CD30ABC95D8
1B30D0FF47A011EDAEDD7CD30ABC95D8
1B30D0FF47A011EDAEDD7CD30ABC95D8
1B30D0FF47A011EDAEDD7CD30ABC95D8
1B30D0FF47A011EDAEDD7CD30ABC95D8
1B30D0FF47A011EDAEDD7CD30ABC95D8
1B30D0FF47A011EDAEDD7CD30ABC95D8
1B30D0FF47A011EDAEDD7CD30ABC95D8
1B30D0FF47A011EDAEDD7CD30ABC95D8
1B30D0FF47A011EDAEDD7CD30ABC95D8
1B30D0FF47A011EDAEDD7CD30ABC95D8
1B30D0FF47A011EDAEDD7CD30ABC95D8
1B30D0FF47A011EDAEDD7CD30ABC95D8
1B30D0FF47A011EDAEDD7CD30ABC95D8
1B30D0FF47A011EDAEDD7CD30ABC95D8
1B30D0FF47A011EDAEDD7CD30ABC95D8
1B30D0FF47A011EDAEDD7CD30ABC95D8
1B30D0FF47A011EDAEDD7CD30ABC95D8
1B30D0FF47A011EDAEDD7CD30ABC95D8
1B30D0FF47A011EDAEDD7CD30ABC95D8
1B30D0FF47A011EDAEDD7CD30ABC95D8
1B30D0FF47A011EDAEDD7CD30ABC95D8
1B30D0FF47A011EDAEDD7CD30ABC95D8
1B30D0FF47A011EDAEDD7CD30ABC95D8
1B30D0FF47A011EDAEDD7CD30ABC95D8
1B30D0FF47A011EDAEDD7CD30ABC95D8
1B30D0FF47A011EDAEDD7CD30ABC95D8
1B30D0FF47A011EDAEDD7CD30ABC95D8
1B30D0FF47A011EDAEDD7CD30ABC95D8
1B30D0FF47A011EDAEDD7CD30ABC95D8
1B30D0FF47A011EDAEDD7CD30ABC95D8
1B30D0FF47A011EDAEDD7CD30ABC95D8
1B30D0FF47A011EDAEDD7CD30ABC95D8
1B30D0FF47A011EDAEDD7CD30ABC95D8
1B30D0FF47A011EDAEDD7CD30ABC95D8
1B30D0FF47A011EDAEDD7CD30ABC95D8
1B30D0FF47A011EDAEDD7CD30ABC95D8
1B30D0FF47A011EDAEDD7CD30ABC95D8
1B30D0FF47A011EDAEDD7CD30ABC95D8
1B30D0FF47A011EDAEDD7CD30ABC95D8
1B30D0FF47A011EDAEDD7CD30ABC95D8
1B30D0FF47A011EDAEDD7CD30ABC95D8
1B30D0FF47A011EDAEDD7CD30ABC95D8
1B30D0FF47A011EDAEDD7CD30ABC95D8
1B30D0FF47A011EDAEDD7CD30ABC95D8
1B30D0FF47A011EDAEDD7CD30ABC95D8
1B30D0FF47A011EDAEDD7CD30ABC95D8
1B30D0FF47A011EDAEDD7CD30ABC95D8
1B30D0FF47A011EDAEDD7CD30ABC95D8
1B30D0FF47A011EDAEDD7CD30ABC95D8
1B30D0FF47A011EDAEDD7CD30ABC95D8
1B30D0FF47A011EDAEDD7CD30ABC95D8
1B30D0FF47A011EDAEDD7CD30ABC95D8
1B30D0FF47A011EDAEDD7CD30ABC95D8
1B30D0FF47A011EDAEDD7CD30ABC95D8
1B30D0FF47A011EDAEDD7CD30ABC95D8
1B30D0FF47A011EDAEDD7CD30ABC95D8
1B30D0FF47A011EDAEDD7CD30ABC95D8
1B30D0FF47A011EDAEDD7CD30ABC95D8
1B30D0FF47A011EDAEDD7CD30ABC95D8
1B30D0FF47A011EDAEDD7CD30ABC95D8
1B30D0FF47A011EDAEDD7CD30ABC95D8
1B30D0FF47A011EDAEDD7CD30ABC95D8
1B30D0FF47A011EDAEDD7CD30ABC95D8
1B30D0FF47A011EDAEDD7CD30ABC95D8
1B30D0FF47A011EDAEDD7CD30ABC95D8
1B30D0FF47A011EDAEDD7CD30ABC95D8
1B30D0FF47A011EDAEDD7CD30ABC95D8
1B30D0FF47A011EDAEDD7CD30ABC95D8
1B30D0FF47A011EDAEDD7CD30ABC95D8
1B30D0FF47A011EDAEDD7CD30ABC95D8
1B30D0FF47A011EDAEDD7CD30ABC95D8
1B30D0FF47A011EDAEDD7CD30ABC95D8
1B30D0FF47A011EDAEDD7CD30ABC95D8
1B30D0FF47A011EDAEDD7CD30ABC95D8
1B30D0FF47A011EDAEDD7CD30ABC95D8
1B30D0FF47A011EDAEDD7CD30ABC95D8
1B30D0FF47A011EDAEDD7CD30ABC95D8
1B30D0FF47A011EDAEDD7CD30ABC95D8
1B30D0FF47A011EDAEDD7CD30ABC95D8
1B30D0FF47A011EDAEDD7CD30ABC95D8
1B30D0FF47A011EDAEDD7CD30ABC95D8
1B30D0FF47A011EDAEDD7CD30ABC95D8
1B30D0FF47A011EDAEDD7CD30ABC95D8
1B30D0FF47A011EDAEDD7CD30ABC95D8
1B30D0FF47A011EDAEDD7CD30ABC95D8
1B30D0FF47A011EDAEDD7CD30ABC95D8
1B30D0FF47A011EDAEDD7CD30ABC95D8
1B30D0FF47A011EDAEDD7CD30ABC95D8
1B30D0FF47A011EDAEDD7CD30ABC95D8
1B30D0FF47A011EDAEDD7CD30ABC95D8
1B30D0FF47A011EDAEDD7CD30ABC95D8
1B30D0FF47A011EDAEDD7CD30ABC95D8
1B30D0FF47A011EDAEDD7CD30ABC95D8
1B30D0FF47A011EDAEDD7CD30ABC95D8
1B30D0FF47A011EDAEDD7CD30ABC95D8
1B30D0FF47A011EDAEDD7CD30ABC95D8
1B30D0FF47A011EDAEDD7CD30ABC95D8
1B30D0FF47A011EDAEDD7CD30ABC95D8
1B30D0FF47A011EDAEDD7CD30ABC95D8
1B30D0FF47A011EDAEDD7CD30ABC95D8
1B30D0FF47A011EDAEDD7CD30ABC95D8
1B30D0FF47A011EDAEDD7CD30ABC95D8
1B30D0FF47A011EDAEDD7CD30ABC95D8
1B30D0FF47A011EDAEDD7CD30ABC95D8
1B30D0FF47A011EDAEDD7CD30ABC95D8
1B30D0FF47A011EDAEDD7CD30ABC95D8
1B30D0FF47A011EDAEDD7CD30ABC95D8
1B30D0FF47A011EDAEDD7CD30ABC95D8
1B30D0FF47A011EDAEDD7CD30ABC95D8
1B30D0FF47A011EDAEDD7CD30ABC95D8
1B30D0FF47A011EDAEDD7CD30ABC95D8
1B30D0FF47A011EDAEDD7CD30ABC95D8
1B30D0FF47A011EDAEDD7CD30ABC95D8
1B30D0FF47A011EDAEDD7CD30ABC95D8
1B30D0FF47A011EDAEDD7CD30ABC95D8
1B30D0FF47A011EDAEDD7CD30ABC95D8
1B30D0FF47A011EDAEDD7CD30ABC95D8
1B30D0FF47A011EDAEDD7CD30ABC95D8
1B30D0FF47A011EDAEDD7CD30ABC95D8
1B30D0FF47A011EDAEDD7CD30ABC95D8
1B30D0FF47A011EDAEDD7CD30ABC95D8
1B30D0FF47A011EDAEDD7CD30ABC95D8
1B30D0FF47A011EDAEDD7CD30ABC95D8
1B30D0FF47A011EDAEDD7CD30ABC95D8
1B30D0FF47A011EDAEDD7CD30ABC95D8
1B30D0FF47A011EDAEDD7CD30ABC95D8
1B30D0FF47A011EDAEDD7CD30ABC95D8
1B30D0FF47A011EDAEDD7CD30ABC95D8
1B30D0FF47A011EDAEDD7CD30ABC95D8
1B30D0FF47A011EDAEDD7CD30ABC95D8
1B30D0FF47A011EDAEDD7CD30ABC95D8
1B30D0FF47A011EDAEDD7CD30ABC95D8
1B30D0FF47A011EDAEDD7CD30ABC95D8
1B30D0FF47A011EDAEDD7CD30ABC95D8
1B30D0FF47A011EDAEDD7CD30ABC95D8
1B30D0FF47A011EDAEDD7CD30ABC95D8
1B30D0FF47A011EDAEDD7CD30ABC95D8
1B30D0FF47A011EDAEDD7CD30ABC95D8
1B30D0FF47A011EDAEDD7CD30ABC95D8
1B30D0FF47A011EDAEDD7CD30ABC95D8
1B30D0FF47A011EDAEDD7CD30ABC95D8
1B30D0FF47A011EDAEDD7CD30ABC95D8
1B30D0FF47A011EDAEDD7CD30ABC95D8
1B30D0FF47A011EDAEDD7CD30ABC95D8
1B30D0FF47A011EDAEDD7CD30ABC95D8
1B30D0FF47A011EDAEDD7CD30ABC95D8
1B30D0FF47A011EDAEDD7CD30ABC95D8
select * from test1 order by id asc;
id
11ED47A01B30D0FFAEDD7CD30ABC95D8
11ED47A01B30D0FFAEDD7CD30ABC95D8
11ED47A01B30D0FFAEDD7CD30ABC95D8
11ED47A01B30D0FFAEDD7CD30ABC95D8
11ED47A01B30D0FFAEDD7CD30ABC95D8
11ED47A01B30D0FFAEDD7CD30ABC95D8
11ED47A01B30D0FFAEDD7CD30ABC95D8
11ED47A01B30D0FFAEDD7CD30ABC95D8
11ED47A01B30D0FFAEDD7CD30ABC95D8
11ED47A01B30D0FFAEDD7CD30ABC95D8
11ED47A01B30D0FFAEDD7CD30ABC95D8
11ED47A01B30D0FFAEDD7CD30ABC95D8
11ED47A01B30D0FFAEDD7CD30ABC95D8
11ED47A01B30D0FFAEDD7CD30ABC95D8
11ED47A01B30D0FFAEDD7CD30ABC95D8
11ED47A01B30D0FFAEDD7CD30ABC95D8
11ED47A01B30D0FFAEDD7CD30ABC95D8
11ED47A01B30D0FFAEDD7CD30ABC95D8
11ED47A01B30D0FFAEDD7CD30ABC95D8
11ED47A01B30D0FFAEDD7CD30ABC95D8
11ED47A01B30D0FFAEDD7CD30ABC95D8
11ED47A01B30D0FFAEDD7CD30ABC95D8
11ED47A01B30D0FFAEDD7CD30ABC95D8
11ED47A01B30D0FFAEDD7CD30ABC95D8
11ED47A01B30D0FFAEDD7CD30ABC95D8
11ED47A01B30D0FFAEDD7CD30ABC95D8
11ED47A01B30D0FFAEDD7CD30ABC95D8
11ED47A01B30D0FFAEDD7CD30ABC95D8
11ED47A01B30D0FFAEDD7CD30ABC95D8
11ED47A01B30D0FFAEDD7CD30ABC95D8
11ED47A01B30D0FFAEDD7CD30ABC95D8
11ED47A01B30D0FFAEDD7CD30ABC95D8
11ED47A01B30D0FFAEDD7CD30ABC95D8
11ED47A01B30D0FFAEDD7CD30ABC95D8
11ED47A01B30D0FFAEDD7CD30ABC95D8
11ED47A01B30D0FFAEDD7CD30ABC95D8
11ED47A01B30D0FFAEDD7CD30ABC95D8
11ED47A01B30D0FFAEDD7CD30ABC95D8
11ED47A01B30D0FFAEDD7CD30ABC95D8
11ED47A01B30D0FFAEDD7CD30ABC95D8
11ED47A01B30D0FFAEDD7CD30ABC95D8
11ED47A01B30D0FFAEDD7CD30ABC95D8
11ED47A01B30D0FFAEDD7CD30ABC95D8
11ED47A01B30D0FFAEDD7CD30ABC95D8
11ED47A01B30D0FFAEDD7CD30ABC95D8
11ED47A01B30D0FFAEDD7CD30ABC95D8
11ED47A01B30D0FFAEDD7CD30ABC95D8
11ED47A01B30D0FFAEDD7CD30ABC95D8
11ED47A01B30D0FFAEDD7CD30ABC95D8
11ED47A01B30D0FFAEDD7CD30ABC95D8
11ED47A01B30D0FFAEDD7CD30ABC95D8
11ED47A01B30D0FFAEDD7CD30ABC95D8
11ED47A01B30D0FFAEDD7CD30ABC95D8
11ED47A01B30D0FFAEDD7CD30ABC95D8
11ED47A01B30D0FFAEDD7CD30ABC95D8
11ED47A01B30D0FFAEDD7CD30ABC95D8
11ED47A01B30D0FFAEDD7CD30ABC95D8
11ED47A01B30D0FFAEDD7CD30ABC95D8
11ED47A01B30D0FFAEDD7CD30ABC95D8
11ED47A01B30D0FFAEDD7CD30ABC95D8
11ED47A01B30D0FFAEDD7CD30ABC95D8
11ED47A01B30D0FFAEDD7CD30ABC95D8
11ED47A01B30D0FFAEDD7CD30ABC95D8
11ED47A01B30D0FFAEDD7CD30ABC95D8
11ED47A01B30D0FFAEDD7CD30ABC95D8
11ED47A01B30D0FFAEDD7CD30ABC95D8
11ED47A01B30D0FFAEDD7CD30ABC95D8
11ED47A01B30D0FFAEDD7CD30ABC95D8
11ED47A01B30D0FFAEDD7CD30ABC95D8
11ED47A01B30D0FFAEDD7CD30ABC95D8
11ED47A01B30D0FFAEDD7CD30ABC95D8
11ED47A01B30D0FFAEDD7CD30ABC95D8
11ED47A01B30D0FFAEDD7CD30ABC95D8
11ED47A01B30D0FFAEDD7CD30ABC95D8
11ED47A01B30D0FFAEDD7CD30ABC95D8
11ED47A01B30D0FFAEDD7CD30ABC95D8
11ED47A01B30D0FFAEDD7CD30ABC95D8
11ED47A01B30D0FFAEDD7CD30ABC95D8
11ED47A01B30D0FFAEDD7CD30ABC95D8
11ED47A01B30D0FFAEDD7CD30ABC95D8
11ED47A01B30D0FFAEDD7CD30ABC95D8
11ED47A01B30D0FFAEDD7CD30ABC95D8
11ED47A01B30D0FFAEDD7CD30ABC95D8
11ED47A01B30D0FFAEDD7CD30ABC95D8
11ED47A01B30D0FFAEDD7CD30ABC95D8
11ED47A01B30D0FFAEDD7CD30ABC95D8
11ED47A01B30D0FFAEDD7CD30ABC95D8
11ED47A01B30D0FFAEDD7CD30ABC95D8
11ED47A01B30D0FFAEDD7CD30ABC95D8
11ED47A01B30D0FFAEDD7CD30ABC95D8
11ED47A01B30D0FFAEDD7CD30ABC95D8
11ED47A01B30D0FFAEDD7CD30ABC95D8
11ED47A01B30D0FFAEDD7CD30ABC95D8
11ED47A01B30D0FFAEDD7CD30ABC95D8
11ED47A01B30D0FFAEDD7CD30ABC95D8
11ED47A01B30D0FFAEDD7CD30ABC95D8
11ED47A01B30D0FFAEDD7CD30ABC95D8
11ED47A01B30D0FFAEDD7CD30ABC95D8
11ED47A01B30D0FFAEDD7CD30ABC95D8
11ED47A01B30D0FFAEDD7CD30ABC95D8
11ED47A01B30D0FFAEDD7CD30ABC95D8
11ED47A01B30D0FFAEDD7CD30ABC95D8
11ED47A01B30D0FFAEDD7CD30ABC95D8
11ED47A01B30D0FFAEDD7CD30ABC95D8
11ED47A01B30D0FFAEDD7CD30ABC95D8
11ED47A01B30D0FFAEDD7CD30ABC95D8
11ED47A01B30D0FFAEDD7CD30ABC95D8
11ED47A01B30D0FFAEDD7CD30ABC95D8
11ED47A01B30D0FFAEDD7CD30ABC95D8
11ED47A01B30D0FFAEDD7CD30ABC95D8
11ED47A01B30D0FFAEDD7CD30ABC95D8
11ED47A01B30D0FFAEDD7CD30ABC95D8
11ED47A01B30D0FFAEDD7CD30ABC95D8
11ED47A01B30D0FFAEDD7CD30ABC95D8
11ED47A01B30D0FFAEDD7CD30ABC95D8
11ED47A01B30D0FFAEDD7CD30ABC95D8
11ED47A01B30D0FFAEDD7CD30ABC95D8
11ED47A01B30D0FFAEDD7CD30ABC95D8
11ED47A01B30D0FFAEDD7CD30ABC95D8
11ED47A01B30D0FFAEDD7CD30ABC95D8
11ED47A01B30D0FFAEDD7CD30ABC95D8
11ED47A01B30D0FFAEDD7CD30ABC95D8
11ED47A01B30D0FFAEDD7CD30ABC95D8
11ED47A01B30D0FFAEDD7CD30ABC95D8
11ED47A01B30D0FFAEDD7CD30ABC95D8
11ED47A01B30D0FFAEDD7CD30ABC95D8
11ED47A01B30D0FFAEDD7CD30ABC95D8
11ED47A01B30D0FFAEDD7CD30ABC95D8
11ED47A01B30D0FFAEDD7CD30ABC95D8
11ED47A01B30D0FFAEDD7CD30ABC95D8
11ED47A01B30D0FFAEDD7CD30ABC95D8
11ED47A01B30D0FFAEDD7CD30ABC95D8
11ED47A01B30D0FFAEDD7CD30ABC95D8
11ED47A01B30D0FFAEDD7CD30ABC95D8
11ED47A01B30D0FFAEDD7CD30ABC95D8
11ED47A01B30D0FFAEDD7CD30ABC95D8
11ED47A01B30D0FFAEDD7CD30ABC95D8
11ED47A01B30D0FFAEDD7CD30ABC95D8
11ED47A01B30D0FFAEDD7CD30ABC95D8
11ED47A01B30D0FFAEDD7CD30ABC95D8
11ED47A01B30D0FFAEDD7CD30ABC95D8
11ED47A01B30D0FFAEDD7CD30ABC95D8
11ED47A01B30D0FFAEDD7CD30ABC95D8
11ED47A01B30D0FFAEDD7CD30ABC95D8
11ED47A01B30D0FFAEDD7CD30ABC95D8
11ED47A01B30D0FFAEDD7CD30ABC95D8
11ED47A01B30D0FFAEDD7CD30ABC95D8
11ED47A01B30D0FFAEDD7CD30ABC95D8
11ED47A01B30D0FFAEDD7CD30ABC95D8
11ED47A01B30D0FFAEDD7CD30ABC95D8
11ED47A01B30D0FFAEDD7CD30ABC95D8
11ED47A01B30D0FFAEDD7CD30ABC95D8
11ED47A01B30D0FFAEDD7CD30ABC95D8
11ED47A01B30D0FFAEDD7CD30ABC95D8
11ED47A01B30D0FFAEDD7CD30ABC95D8
11ED47A01B30D0FFAEDD7CD30ABC95D8
11ED47A01B30D0FFAEDD7CD30ABC95D8
11ED47A01B30D0FFAEDD7CD30ABC95D8
11ED47A01B30D0FFAEDD7CD30ABC95D8
11ED47A01B30D0FFAEDD7CD30ABC95D8
11ED47A01B30D0FFAEDD7CD30ABC95D8
11ED47A01B30D0FFAEDD7CD30ABC95D8
11ED47A01B30D0FFAEDD7CD30ABC95D8
11ED47A01B30D0FFAEDD7CD30ABC95D8
11ED47A01B30D0FFAEDD7CD30ABC95D8
11ED47A01B30D0FFAEDD7CD30ABC95D8
11ED47A01B30D0FFAEDD7CD30ABC95D8
11ED47A01B30D0FFAEDD7CD30ABC95D8
11ED47A01B30D0FFAEDD7CD30ABC95D8
11ED47A01B30D0FFAEDD7CD30ABC95D8
11ED47A01B30D0FFAEDD7CD30ABC95D8
11ED47A01B30D0FFAEDD7CD30ABC95D8
11ED47A01B30D0FFAEDD7CD30ABC95D8
11ED47A01B30D0FFAEDD7CD30ABC95D8
11ED47A01B30D0FFAEDD7CD30ABC95D8
11ED47A01B30D0FFAEDD7CD30ABC95D8
11ED47A01B30D0FFAEDD7CD30ABC95D8
11ED47A01B30D0FFAEDD7CD30ABC95D8
11ED47A01B30D0FFAEDD7CD30ABC95D8
11ED47A01B30D0FFAEDD7CD30ABC95D8
11ED47A01B30D0FFAEDD7CD30ABC95D8
11ED47A01B30D0FFAEDD7CD30ABC95D8
11ED47A01B30D0FFAEDD7CD30ABC95D8
11ED47A01B30D0FFAEDD7CD30ABC95D8
11ED47A01B30D0FFAEDD7CD30ABC95D8
11ED47A01B30D0FFAEDD7CD30ABC95D8
11ED47A01B30D0FFAEDD7CD30ABC95D8
11ED47A01B30D0FFAEDD7CD30ABC95D8
11ED47A01B30D0FFAEDD7CD30ABC95D8
11ED47A01B30D0FFAEDD7CD30ABC95D8
11ED47A01B30D0FFAEDD7CD30ABC95D8
11ED47A01B30D0FFAEDD7CD30ABC95D8
11ED47A01B30D0FFAEDD7CD30ABC95D8
11ED47A01B30D0FFAEDD7CD30ABC95D8
11ED47A01B30D0FFAEDD7CD30ABC95D8
11ED47A01B30D0FFAEDD7CD30ABC95D8
11ED47A01B30D0FFAEDD7CD30ABC95D8
11ED47A01B30D0FFAEDD7CD30ABC95D8
11ED47A01B30D0FFAEDD7CD30ABC95D8
11ED47A01B30D0FFAEDD7CD30ABC95D8
11ED47A01B30D0FFAEDD7CD30ABC95D8
11ED47A01B30D0FFAEDD7CD30ABC95D8
11ED47A01B30D0FFAEDD7CD30ABC95D8
11ED47A01B30D0FFAEDD7CD30ABC95D8
11ED47A01B30D0FFAEDD7CD30ABC95D8
11ED47A01B30D0FFAEDD7CD30ABC95D8
11ED47A01B30D0FFAEDD7CD30ABC95D8
11ED47A01B30D0FFAEDD7CD30ABC95D8
11ED47A01B30D0FFAEDD7CD30ABC95D8
11ED47A01B30D0FFAEDD7CD30ABC95D8
11ED47A01B30D0FFAEDD7CD30ABC95D8
11ED47A01B30D0FFAEDD7CD30ABC95D8
11ED47A01B30D0FFAEDD7CD30ABC95D8
11ED47A01B30D0FFAEDD7CD30ABC95D8
11ED47A01B30D0FFAEDD7CD30ABC95D8
11ED47A01B30D0FFAEDD7CD30ABC95D8
11ED47A01B30D0FFAEDD7CD30ABC95D8
11ED47A01B30D0FFAEDD7CD30ABC95D8
11ED47A01B30D0FFAEDD7CD30ABC95D8
11ED47A01B30D0FFAEDD7CD30ABC95D8
11ED47A01B30D0FFAEDD7CD30ABC95D8
11ED47A01B30D0FFAEDD7CD30ABC95D8
11ED47A01B30D0FFAEDD7CD30ABC95D8
11ED47A01B30D0FFAEDD7CD30ABC95D8
11ED47A01B30D0FFAEDD7CD30ABC95D8
11ED47A01B30D0FFAEDD7CD30ABC95D8
11ED47A01B30D0FFAEDD7CD30ABC95D8
11ED47A01B30D0FFAEDD7CD30ABC95D8
11ED47A01B30D0FFAEDD7CD30ABC95D8
11ED47A01B30D0FFAEDD7CD30ABC95D8
11ED47A01B30D0FFAEDD7CD30ABC95D8
11ED47A01B30D0FFAEDD7CD30ABC95D8
11ED47A01B30D0FFAEDD7CD30ABC95D8
11ED47A01B30D0FFAEDD7CD30ABC95D8
11ED47A01B30D0FFAEDD7CD30ABC95D8
11ED47A01B30D0FFAEDD7CD30ABC95D8
11ED47A01B30D0FFAEDD7CD30ABC95D8
11ED47A01B30D0FFAEDD7CD30ABC95D8
11ED47A01B30D0FFAEDD7CD30ABC95D8
11ED47A01B30D0FFAEDD7CD30ABC95D8
11ED47A01B30D0FFAEDD7CD30ABC95D8
11ED47A01B30D0FFAEDD7CD30ABC95D8
11ED47A01B30D0FFAEDD7CD30ABC95D8
11ED47A01B30D0FFAEDD7CD30ABC95D8
11ED47A01B30D0FFAEDD7CD30ABC95D8
11ED47A01B30D0FFAEDD7CD30ABC95D8
11ED47A01B30D0FFAEDD7CD30ABC95D8
11ED47A01B30D0FFAEDD7CD30ABC95D8
11ED47A01B30D0FFAEDD7CD30ABC95D8
11ED47A01B30D0FFAEDD7CD30ABC95D8
11ED47A01B30D0FFAEDD7CD30ABC95D8
11ED47A01B30D0FFAEDD7CD30ABC95D8
11ED47A01B30D0FFAEDD7CD30ABC95D8
11ED47A01B30D0FFAEDD7CD30ABC95D8
11ED47A01B30D0FFAEDD7CD30ABC95D8
11ED47A01B30D0FFAEDD7CD30ABC95D8
11ED47A01B30D0FFAEDD7CD30ABC95D8
11ED47A01B30D0FFAEDD7CD30ABC95D8
11ED47A01B30D0FFAEDD7CD30ABC95D8
11ED47A01B30D0FFAEDD7CD30ABC95D8
11ED47A01B30D0FFAEDD7CD30ABC95D8
11ED47A01B30D0FFAEDD7CD30ABC95D8
11ED47A01B30D0FFAEDD7CD30ABC95D8
11ED47A01B30D0FFAEDD7CD30ABC95D8
11ED47A01B30D0FFAEDD7CD30ABC95D8
11ED47A01B30D0FFAEDD7CD30ABC95D8
11ED47A01B30D0FFAEDD7CD30ABC95D8
11ED47A01B30D0FFAEDD7CD30ABC95D8
11ED47A01B30D0FFAEDD7CD30ABC95D8
11ED47A01B30D0FFAEDD7CD30ABC95D8
11ED47A01B30D0FFAEDD7CD30ABC95D8
11ED47A01B30D0FFAEDD7CD30ABC95D8
11ED47A01B30D0FFAEDD7CD30ABC95D8
11ED47A01B30D0FFAEDD7CD30ABC95D8
11ED47A01B30D0FFAEDD7CD30ABC95D8
11ED47A01B30D0FFAEDD7CD30ABC95D8
11ED47A01B30D0FFAEDD7CD30ABC95D8
11ED47A01B30D0FFAEDD7CD30ABC95D8
11ED47A01B30D0FFAEDD7CD30ABC95D8
11ED47A01B30D0FFAEDD7CD30ABC95D8
11ED47A01B30D0FFAEDD7CD30ABC95D8
11ED47A01B30D0FFAEDD7CD30ABC95D8
11ED47A01B30D0FFAEDD7CD30ABC95D8
11ED47A01B30D0FFAEDD7CD30ABC95D8
11ED47A01B30D0FFAEDD7CD30ABC95D8
11ED47A01B30D0FFAEDD7CD30ABC95D8
11ED47A01B30D0FFAEDD7CD30ABC95D8
11ED47A01B30D0FFAEDD7CD30ABC95D8
11ED47A01B30D0FFAEDD7CD30ABC95D8
11ED47A01B30D0FFAEDD7CD30ABC95D8
11ED47A01B30D0FFAEDD7CD30ABC95D8
11ED47A01B30D0FFAEDD7CD30ABC95D8
11ED47A01B30D0FFAEDD7CD30ABC95D8
11ED47A01B30D0FFAEDD7CD30ABC95D8
11ED47A01B30D0FFAEDD7CD30ABC95D8
11ED47A01B30D0FFAEDD7CD30ABC95D8
11ED47A01B30D0FFAEDD7CD30ABC95D8
11ED47A01B30D0FFAEDD7CD30ABC95D8
11ED47A01B30D0FFAEDD7CD30ABC95D8
11ED47A01B30D0FFAEDD7CD30ABC95D8
11ED47A01B30D0FFAEDD7CD30ABC95D8
11ED47A01B30D0FFAEDD7CD30ABC95D8
11ED47A01B30D0FFAEDD7CD30ABC95D8
11ED47A01B30D0FFAEDD7CD30ABC95D8
11ED47A01B30D0FFAEDD7CD30ABC95D8
11ED47A01B30D0FFAEDD7CD30ABC95D8
11ED47A01B30D0FFAEDD7CD30ABC95D8
11ED47A01B30D0FFAEDD7CD30ABC95D8
11ED47A01B30D0FFAEDD7CD30ABC95D8
11ED47A01B30D0FFAEDD7CD30ABC95D8
11ED47A01B30D0FFAEDD7CD30ABC95D8
11ED47A01B30D0FFAEDD7CD30ABC95D8
11ED47A01B30D0FFAEDD7CD30ABC95D8
11ED47A01B30D0FFAEDD7CD30ABC95D8
11ED47A01B30D0FFAEDD7CD30ABC95D8
11ED47A01B30D0FFAEDD7CD30ABC95D8
11ED47A01B30D0FFAEDD7CD30ABC95D8
11ED47A01B30D0FFAEDD7CD30ABC95D8
11ED47A01B30D0FFAEDD7CD30ABC95D8
11ED47A01B30D0FFAEDD7CD30ABC95D8
11ED47A01B30D0FFAEDD7CD30ABC95D8
11ED47A01B30D0FFAEDD7CD30ABC95D8
11ED47A01B30D0FFAEDD7CD30ABC95D8
11ED47A01B30D0FFAEDD7CD30ABC95D8
11ED47A01B30D0FFAEDD7CD30ABC95D8
11ED47A01B30D0FFAEDD7CD30ABC95D8
11ED47A01B30D0FFAEDD7CD30ABC95D8
11ED47A01B30D0FFAEDD7CD30ABC95D8
11ED47A01B30D0FFAEDD7CD30ABC95D8
11ED47A01B30D0FFAEDD7CD30ABC95D8
11ED47A01B30D0FFAEDD7CD30ABC95D8
11ED47A01B30D0FFAEDD7CD30ABC95D8
11ED47A01B30D0FFAEDD7CD30ABC95D8
11ED47A01B30D0FFAEDD7CD30ABC95D8
11ED47A01B30D0FFAEDD7CD30ABC95D8
11ED47A01B30D0FFAEDD7CD30ABC95D8
11ED47A01B30D0FFAEDD7CD30ABC95D8
11ED47A01B30D0FFAEDD7CD30ABC95D8
11ED47A01B30D0FFAEDD7CD30ABC95D8
11ED47A01B30D0FFAEDD7CD30ABC95D8
11ED47A01B30D0FFAEDD7CD30ABC95D8
11ED47A01B30D0FFAEDD7CD30ABC95D8
11ED47A01B30D0FFAEDD7CD30ABC95D8
11ED47A01B30D0FFAEDD7CD30ABC95D8
11ED47A01B30D0FFAEDD7CD30ABC95D8
11ED47A01B30D0FFAEDD7CD30ABC95D8
11ED47A01B30D0FFAEDD7CD30ABC95D8
11ED47A01B30D0FFAEDD7CD30ABC95D8
11ED47A01B30D0FFAEDD7CD30ABC95D8
11ED47A01B30D0FFAEDD7CD30ABC95D8
11ED47A01B30D0FFAEDD7CD30ABC95D8
11ED47A01B30D0FFAEDD7CD30ABC95D8
11ED47A01B30D0FFAEDD7CD30ABC95D8
11ED47A01B30D0FFAEDD7CD30ABC95D8
11ED47A01B30D0FFAEDD7CD30ABC95D8
11ED47A01B30D0FFAEDD7CD30ABC95D8
11ED47A01B30D0FFAEDD7CD30ABC95D8
11ED47A01B30D0FFAEDD7CD30ABC95D8
11ED47A01B30D0FFAEDD7CD30ABC95D8
11ED47A01B30D0FFAEDD7CD30ABC95D8
11ED47A01B30D0FFAEDD7CD30ABC95D8
11ED47A01B30D0FFAEDD7CD30ABC95D8
11ED47A01B30D0FFAEDD7CD30ABC95D8
11ED47A01B30D0FFAEDD7CD30ABC95D8
11ED47A01B30D0FFAEDD7CD30ABC95D8
11ED47A01B30D0FFAEDD7CD30ABC95D8
11ED47A01B30D0FFAEDD7CD30ABC95D8
11ED47A01B30D0FFAEDD7CD30ABC95D8
11ED47A01B30D0FFAEDD7CD30ABC95D8
11ED47A01B30D0FFAEDD7CD30ABC95D8
11ED47A01B30D0FFAEDD7CD30ABC95D8
11ED47A01B30D0FFAEDD7CD30ABC95D8
11ED47A01B30D0FFAEDD7CD30ABC95D8
11ED47A01B30D0FFAEDD7CD30ABC95D8
11ED47A01B30D0FFAEDD7CD30ABC95D8
11ED47A01B30D0FFAEDD7CD30ABC95D8
11ED47A01B30D0FFAEDD7CD30ABC95D8
11ED47A01B30D0FFAEDD7CD30ABC95D8
11ED47A01B30D0FFAEDD7CD30ABC95D8
11ED47A01B30D0FFAEDD7CD30ABC95D8
11ED47A01B30D0FFAEDD7CD30ABC95D8
11ED47A01B30D0FFAEDD7CD30ABC95D8
11ED47A01B30D0FFAEDD7CD30ABC95D8
11ED47A01B30D0FFAEDD7CD30ABC95D8
11ED47A01B30D0FFAEDD7CD30ABC95D8
11ED47A01B30D0FFAEDD7CD30ABC95D8
11ED47A01B30D0FFAEDD7CD30ABC95D8
11ED47A01B30D0FFAEDD7CD30ABC95D8
11ED47A01B30D0FFAEDD7CD30ABC95D8
11ED47A01B30D0FFAEDD7CD30ABC95D8
11ED47A01B30D0FFAEDD7CD30ABC95D8
11ED47A01B30D0FFAEDD7CD30ABC95D8
11ED47A01B30D0FFAEDD7CD30ABC95D8
11ED47A01B30D0FFAEDD7CD30ABC95D8
11ED47A01B30D0FFAEDD7CD30ABC95D8
11ED47A01B30D0FFAEDD7CD30ABC95D8
11ED47A01B30D0FFAEDD7CD30ABC95D8
11ED47A01B30D0FFAEDD7CD30ABC95D8
11ED47A01B30D0FFAEDD7CD30ABC95D8
11ED47A01B30D0FFAEDD7CD30ABC95D8
11ED47A01B30D0FFAEDD7CD30ABC95D8
11ED47A01B30D0FFAEDD7CD30ABC95D8
11ED47A01B30D0FFAEDD7CD30ABC95D8
11ED47A01B30D0FFAEDD7CD30ABC95D8
11ED47A01B30D0FFAEDD7CD30ABC95D8
11ED47A01B30D0FFAEDD7CD30ABC95D8
11ED47A01B30D0FFAEDD7CD30ABC95D8
11ED47A01B30D0FFAEDD7CD30ABC95D8
11ED47A01B30D0FFAEDD7CD30ABC95D8
11ED47A01B30D0FFAEDD7CD30ABC95D8
11ED47A01B30D0FFAEDD7CD30ABC95D8
11ED47A01B30D0FFAEDD7CD30ABC95D8
11ED47A01B30D0FFAEDD7CD30ABC95D8
11ED47A01B30D0FFAEDD7CD30ABC95D8
11ED47A01B30D0FFAEDD7CD30ABC95D8
11ED47A01B30D0FFAEDD7CD30ABC95D8
11ED47A01B30D0FFAEDD7CD30ABC95D8
11ED47A01B30D0FFAEDD7CD30ABC95D8
11ED47A01B30D0FFAEDD7CD30ABC95D8
11ED47A01B30D0FFAEDD7CD30ABC95D8
11ED47A01B30D0FFAEDD7CD30ABC95D8
11ED47A01B30D0FFAEDD7CD30ABC95D8
11ED47A01B30D0FFAEDD7CD30ABC95D8
11ED47A01B30D0FFAEDD7CD30ABC95D8
11ED47A01B30D0FFAEDD7CD30ABC95D8
11ED47A01B30D0FFAEDD7CD30ABC95D8
11ED47A01B30D0FFAEDD7CD30ABC95D8
11ED47A01B30D0FFAEDD7CD30ABC95D8
11ED47A01B30D0FFAEDD7CD30ABC95D8
11ED47A01B30D0FFAEDD7CD30ABC95D8
11ED47A01B30D0FFAEDD7CD30ABC95D8
11ED47A01B30D0FFAEDD7CD30ABC95D8
11ED47A01B30D0FFAEDD7CD30ABC95D8
11ED47A01B30D0FFAEDD7CD30ABC95D8
11ED47A01B30D0FFAEDD7CD30ABC95D8
11ED47A01B30D0FFAEDD7CD30ABC95D8
11ED47A01B30D0FFAEDD7CD30ABC95D8
11ED47A01B30D0FFAEDD7CD30ABC95D8
11ED47A01B30D0FFAEDD7CD30ABC95D8
11ED47A01B30D0FFAEDD7CD30ABC95D8
11ED47A01B30D0FFAEDD7CD30ABC95D8
11ED47A01B30D0FFAEDD7CD30ABC95D8
11ED47A01B30D0FFAEDD7CD30ABC95D8
11ED47A01B30D0FFAEDD7CD30ABC95D8
11ED47A01B30D0FFAEDD7CD30ABC95D8
11ED47A01B30D0FFAEDD7CD30ABC95D8
11ED47A01B30D0FFAEDD7CD30ABC95D8
11ED47A01B30D0FFAEDD7CD30ABC95D8
11ED47A01B30D0FFAEDD7CD30ABC95D8
11ED47A01B30D0FFAEDD7CD30ABC95D8
11ED47A01B30D0FFAEDD7CD30ABC95D8
11ED47A01B30D0FFAEDD7CD30ABC95D8
11ED47A01B30D0FFAEDD7CD30ABC95D8
11ED47A01B30D0FFAEDD7CD30ABC95D8
11ED47A01B30D0FFAEDD7CD30ABC95D8
11ED47A01B30D0FFAEDD7CD30ABC95D8
11ED47A01B30D0FFAEDD7CD30ABC95D8
11ED47A01B30D0FFAEDD7CD30ABC95D8
11ED47A01B30D0FFAEDD7CD30ABC95D8
11ED47A01B30D0FFAEDD7CD30ABC95D8
11ED47A01B30D0FFAEDD7CD30ABC95D8
11ED47A01B30D0FFAEDD7CD30ABC95D8
11ED47A01B30D0FFAEDD7CD30ABC95D8
11ED47A01B30D0FFAEDD7CD30ABC95D8
11ED47A01B30D0FFAEDD7CD30ABC95D8
11ED47A01B30D0FFAEDD7CD30ABC95D8
11ED47A01B30D0FFAEDD7CD30ABC95D8
11ED47A01B30D0FFAEDD7CD30ABC95D8
11ED47A01B30D0FFAEDD7CD30ABC95D8
11ED47A01B30D0FFAEDD7CD30ABC95D8
11ED47A01B30D0FFAEDD7CD30ABC95D8
11ED47A01B30D0FFAEDD7CD30ABC95D8
11ED47A01B30D0FFAEDD7CD30ABC95D8
11ED47A01B30D0FFAEDD7CD30ABC95D8
11ED47A01B30D0FFAEDD7CD30ABC95D8
11ED47A01B30D0FFAEDD7CD30ABC95D8
11ED47A01B30D0FFAEDD7CD30ABC95D8
11ED47A01B30D0FFAEDD7CD30ABC95D8
11ED47A01B30D0FFAEDD7CD30ABC95D8
11ED47A01B30D0FFAEDD7CD30ABC95D8
11ED47A01B30D0FFAEDD7CD30ABC95D8
11ED47A01B30D0FFAEDD7CD30ABC95D8
11ED47A01B30D0FFAEDD7CD30ABC95D8
11ED47A01B30D0FFAEDD7CD30ABC95D8
11ED47A01B30D0FFAEDD7CD30ABC95D8
11ED47A01B30D0FFAEDD7CD30ABC95D8
11ED47A01B30D0FFAEDD7CD30ABC95D8
11ED47A01B30D0FFAEDD7CD30ABC95D8
11ED47A01B30D0FFAEDD7CD30ABC95D8
11ED47A01B30D0FFAEDD7CD30ABC95D8
11ED47A01B30D0FFAEDD7CD30ABC95D8
11ED47A01B30D0FFAEDD7CD30ABC95D8
11ED47A01B30D0FFAEDD7CD30ABC95D8
11ED47A01B30D0FFAEDD7CD30ABC95D8
11ED47A01B30D0FFAEDD7CD30ABC95D8
11ED47A01B30D0FFAEDD7CD30ABC95D8
11ED47A01B30D0FFAEDD7CD30ABC95D8
11ED47A01B30D0FFAEDD7CD30ABC95D8
11ED47A01B30D0FFAEDD7CD30ABC95D8
11ED47A01B30D0FFAEDD7CD30ABC95D8
11ED47A01B30D0FFAEDD7CD30ABC95D8
11ED47A01B30D0FFAEDD7CD30ABC95D8
11ED47A01B30D0FFAEDD7CD30ABC95D8
11ED47A01B30D0FFAEDD7CD30ABC95D8
11ED47A01B30D0FFAEDD7CD30ABC95D8
11ED47A01B30D0FFAEDD7CD30ABC95D8
11ED47A01B30D0FFAEDD7CD30ABC95D8
11ED47A01B30D0FFAEDD7CD30ABC95D8
11ED47A01B30D0FFAEDD7CD30ABC95D8
11ED47A01B30D0FFAEDD7CD30ABC95D8
11ED47A01B30D0FFAEDD7CD30ABC95D8
11ED47A01B30D0FFAEDD7CD30ABC95D8
11ED47A01B30D0FFAEDD7CD30ABC95D8
11ED47A01B30D0FFAEDD7CD30ABC95D8
11ED47A01B30D0FFAEDD7CD30ABC95D8
11ED47A01B30D0FFAEDD7CD30ABC95D8
11ED47A01B30D0FFAEDD7CD30ABC95D8
11ED47A01B30D0FFAEDD7CD30ABC95D8
11ED47A01B30D0FFAEDD7CD30ABC95D8
11ED47A01B30D0FFAEDD7CD30ABC95D8
11ED47A01B30D0FFAEDD7CD30ABC95D8
11ED47A01B30D0FFAEDD7CD30ABC95D8
11ED47A01B30D0FFAEDD7CD30ABC95D8
11ED47A01B30D0FFAEDD7CD30ABC95D8
11ED47A01B30D0FFAEDD7CD30ABC95D8
11ED47A01B30D0FFAEDD7CD30ABC95D8
11ED47A01B30D0FFAEDD7CD30ABC95D8
11ED47A01B30D0FFAEDD7CD30ABC95D8
11ED47A01B30D0FFAEDD7CD30ABC95D8
11ED47A01B30D0FFAEDD7CD30ABC95D8
11ED47A01B30D0FFAEDD7CD30ABC95D8
11ED47A01B30D0FFAEDD7CD30ABC95D8
11ED47A01B30D0FFAEDD7CD30ABC95D8
11ED47A01B30D0FFAEDD7CD30ABC95D8
11ED47A01B30D0FFAEDD7CD30ABC95D8
11ED47A01B30D0FFAEDD7CD30ABC95D8
11ED47A01B30D0FFAEDD7CD30ABC95D8
11ED47A01B30D0FFAEDD7CD30ABC95D8
11ED47A01B30D0FFAEDD7CD30ABC95D8
11ED47A01B30D0FFAEDD7CD30ABC95D8
11ED47A01B30D0FFAEDD7CD30ABC95D8
11ED47A01B30D0FFAEDD7CD30ABC95D8
11ED47A01B30D0FFAEDD7CD30ABC95D8
11ED47A01B30D0FFAEDD7CD30ABC95D8
11ED47A01B30D0FFAEDD7CD30ABC95D8
11ED47A01B30D0FFAEDD7CD30ABC95D8
11ED47A01B30D0FFAEDD7CD30ABC95D8
11ED47A01B30D0FFAEDD7CD30ABC95D8
11ED47A01B30D0FFAEDD7CD30ABC95D8
11ED47A01B30D0FFAEDD7CD30ABC95D8
11ED47A01B30D0FFAEDD7CD30ABC95D8
11ED47A01B30D0FFAEDD7CD30ABC95D8
11ED47A01B30D0FFAEDD7CD30ABC95D8
11ED47A01B30D0FFAEDD7CD30ABC95D8
11ED47A01B30D0FFAEDD7CD30ABC95D8
11ED47A01B30D0FFAEDD7CD30ABC95D8
11ED47A01B30D0FFAEDD7CD30ABC95D8
11ED47A01B30D0FFAEDD7CD30ABC95D8
11ED47A01B30D0FFAEDD7CD30ABC95D8
11ED47A01B30D0FFAEDD7CD30ABC95D8
11ED47A01B30D0FFAEDD7CD30ABC95D8
11ED47A01B30D0FFAEDD7CD30ABC95D8
11ED47A01B30D0FFAEDD7CD30ABC95D8
11ED47A01B30D0FFAEDD7CD30ABC95D8
11ED47A01B30D0FFAEDD7CD30ABC95D8
11ED47A01B30D0FFAEDD7CD30ABC95D8
11ED47A01B30D0FFAEDD7CD30ABC95D8
11ED47A01B30D0FFAEDD7CD30ABC95D8
11ED47A01B30D0FFAEDD7CD30ABC95D8
11ED47A01B30D0FFAEDD7CD30ABC95D8
11ED47A01B30D0FFAEDD7CD30ABC95D8
11ED47A01B30D0FFAEDD7CD30ABC95D8
11ED47A01B30D0FFAEDD7CD30ABC95D8
11ED47A01B30D0FFAEDD7CD30ABC95D8
11ED47A01B30D0FFAEDD7CD30ABC95D8
11ED47A01B30D0FFAEDD7CD30ABC95D8
11ED47A01B30D0FFAEDD7CD30ABC95D8
11ED47A01B30D0FFAEDD7CD30ABC95D8
11ED47A01B30D0FFAEDD7CD30ABC95D8
11ED47A01B30D0FFAEDD7CD30ABC95D8
11ED47A01B30D0FFAEDD7CD30ABC95D8
11ED47A01B30D0FFAEDD7CD30ABC95D8
11ED47A01B30D0FFAEDD7CD30ABC95D8
11ED47A01B30D0FFAEDD7CD30ABC95D8
11ED47A01B30D0FFAEDD7CD30ABC95D8
11ED47A01B30D0FFAEDD7CD30ABC95D8
11ED47A01B30D0FFAEDD7CD30ABC95D8
11ED47A01B30D0FFAEDD7CD30ABC95D8
11ED47A01B30D0FFAEDD7CD30ABC95D8
11ED47A01B30D0FFAEDD7CD30ABC95D8
11ED47A01B30D0FFAEDD7CD30ABC95D8
11ED47A01B30D0FFAEDD7CD30ABC95D8
11ED47A01B30D0FFAEDD7CD30ABC95D8
11ED47A01B30D0FFAEDD7CD30ABC95D8
11ED47A01B30D0FFAEDD7CD30ABC95D8
11ED47A01B30D0FFAEDD7CD30ABC95D8
11ED47A01B30D0FFAEDD7CD30ABC95D8
11ED47A01B30D0FFAEDD7CD30ABC95D8
11ED47A01B30D0FFAEDD7CD30ABC95D8
11ED47A01B30D0FFAEDD7CD30ABC95D8
11ED47A01B30D0FFAEDD7CD30ABC95D8
11ED47A01B30D0FFAEDD7CD30ABC95D8
11ED47A01B30D0FFAEDD7CD30ABC95D8
11ED47A01B30D0FFAEDD7CD30ABC95D8
11ED47A01B30D0FFAEDD7CD30ABC95D8
11ED47A01B30D0FFAEDD7CD30ABC95D8
11ED47A01B30D0FFAEDD7CD30ABC95D8
11ED47A01B30D0FFAEDD7CD30ABC95D8
11ED47A01B30D0FFAEDD7CD30ABC95D8
11ED47A01B30D0FFAEDD7CD30ABC95D8
11ED47A01B30D0FFAEDD7CD30ABC95D8
11ED47A01B30D0FFAEDD7CD30ABC95D8
11ED47A01B30D0FFAEDD7CD30ABC95D8
11ED47A01B30D0FFAEDD7CD30ABC95D8
11ED47A01B30D0FFAEDD7CD30ABC95D8
11ED47A01B30D0FFAEDD7CD30ABC95D8
11ED47A01B30D0FFAEDD7CD30ABC95D8
11ED47A01B30D0FFAEDD7CD30ABC95D8
11ED47A01B30D0FFAEDD7CD30ABC95D8
11ED47A01B30D0FFAEDD7CD30ABC95D8
11ED47A01B30D0FFAEDD7CD30ABC95D8
11ED47A01B30D0FFAEDD7CD30ABC95D8
11ED47A01B30D0FFAEDD7CD30ABC95D8
11ED47A01B30D0FFAEDD7CD30ABC95D8
11ED47A01B30D0FFAEDD7CD30ABC95D8
11ED47A01B30D0FFAEDD7CD30ABC95D8
11ED47A01B30D0FFAEDD7CD30ABC95D8
11ED47A01B30D0FFAEDD7CD30ABC95D8
11ED47A01B30D0FFAEDD7CD30ABC95D8
11ED47A01B30D0FFAEDD7CD30ABC95D8
11ED47A01B30D0FFAEDD7CD30ABC95D8
11ED47A01B30D0FFAEDD7CD30ABC95D8
11ED47A01B30D0FFAEDD7CD30ABC95D8
11ED47A01B30D0FFAEDD7CD30ABC95D8
11ED47A01B30D0FFAEDD7CD30ABC95D8
11ED47A01B30D0FFAEDD7CD30ABC95D8
11ED47A01B30D0FFAEDD7CD30ABC95D8
11ED47A01B30D0FFAEDD7CD30ABC95D8
11ED47A01B30D0FFAEDD7CD30ABC95D8
11ED47A01B30D0FFAEDD7CD30ABC95D8
11ED47A01B30D0FFAEDD7CD30ABC95D8
11ED47A01B30D0FFAEDD7CD30ABC95D8
11ED47A01B30D0FFAEDD7CD30ABC95D8
11ED47A01B30D0FFAEDD7CD30ABC95D8
11ED47A01B30D0FFAEDD7CD30ABC95D8
11ED47A01B30D0FFAEDD7CD30ABC95D8
11ED47A01B30D0FFAEDD7CD30ABC95D8
11ED47A01B30D0FFAEDD7CD30ABC95D8
11ED47A01B30D0FFAEDD7CD30ABC95D8
11ED47A01B30D0FFAEDD7CD30ABC95D8
11ED47A01B30D0FFAEDD7CD30ABC95D8
11ED47A01B30D0FFAEDD7CD30ABC95D8
11ED47A01B30D0FFAEDD7CD30ABC95D8
11ED47A01B30D0FFAEDD7CD30ABC95D8
11ED47A01B30D0FFAEDD7CD30ABC95D8
11ED47A01B30D0FFAEDD7CD30ABC95D8
11ED47A01B30D0FFAEDD7CD30ABC95D8
11ED47A01B30D0FFAEDD7CD30ABC95D8
11ED47A01B30D0FFAEDD7CD30ABC95D8
11ED47A01B30D0FFAEDD7CD30ABC95D8
11ED47A01B30D0FFAEDD7CD30ABC95D8
11ED47A01B30D0FFAEDD7CD30ABC95D8
11ED47A01B30D0FFAEDD7CD30ABC95D8
11ED47A01B30D0FFAEDD7CD30ABC95D8
11ED47A01B30D0FFAEDD7CD30ABC95D8
11ED47A01B30D0FFAEDD7CD30ABC95D8
11ED47A01B30D0FFAEDD7CD30ABC95D8
11ED47A01B30D0FFAEDD7CD30ABC95D8
11ED47A01B30D0FFAEDD7CD30ABC95D8
11ED47A01B30D0FFAEDD7CD30ABC95D8
11ED47A01B30D0FFAEDD7CD30ABC95D8
11ED47A01B30D0FFAEDD7CD30ABC95D8
11ED47A01B30D0FFAEDD7CD30ABC95D8
11ED47A01B30D0FFAEDD7CD30ABC95D8
11ED47A01B30D0FFAEDD7CD30ABC95D8
11ED47A01B30D0FFAEDD7CD30ABC95D8
11ED47A01B30D0FFAEDD7CD30ABC95D8
11ED47A01B30D0FFAEDD7CD30ABC95D8
11ED47A01B30D0FFAEDD7CD30ABC95D8
11ED47A01B30D0FFAEDD7CD30ABC95D8
11ED47A01B30D0FFAEDD7CD30ABC95D8
11ED47A01B30D0FFAEDD7CD30ABC95D8
11ED47A01B30D0FFAEDD7CD30ABC95D8
11ED47A01B30D0FFAEDD7CD30ABC95D8
11ED47A01B30D0FFAEDD7CD30ABC95D8
11ED47A01B30D0FFAEDD7CD30ABC95D8
11ED47A01B30D0FFAEDD7CD30ABC95D8
11ED47A01B30D0FFAEDD7CD30ABC95D8
11ED47A01B30D0FFAEDD7CD30ABC95D8
11ED47A01B30D0FFAEDD7CD30ABC95D8
11ED47A01B30D0FFAEDD7CD30ABC95D8
11ED47A01B30D0FFAEDD7CD30ABC95D8
11ED47A01B30D0FFAEDD7CD30ABC95D8
11ED47A01B30D0FFAEDD7CD30ABC95D8
11ED47A01B30D0FFAEDD7CD30ABC95D8
11ED47A01B30D0FFAEDD7CD30ABC95D8
11ED47A01B30D0FFAEDD7CD30ABC95D8
11ED47A01B30D0FFAEDD7CD30ABC95D8
11ED47A01B30D0FFAEDD7CD30ABC95D8
11ED47A01B30D0FFAEDD7CD30ABC95D8
11ED47A01B30D0FFAEDD7CD30ABC95D8
11ED47A01B30D0FFAEDD7CD30ABC95D8
11ED47A01B30D0FFAEDD7CD30ABC95D8
11ED47A01B30D0FFAEDD7CD30ABC95D8
11ED47A01B30D0FFAEDD7CD30ABC95D8
11ED47A01B30D0FFAEDD7CD30ABC95D8
11ED47A01B30D0FFAEDD7CD30ABC95D8
11ED47A01B30D0FFAEDD7CD30ABC95D8
11ED47A01B30D0FFAEDD7CD30ABC95D8
11ED47A01B30D0FFAEDD7CD30ABC95D8
11ED47A01B30D0FFAEDD7CD30ABC95D8
11ED47A01B30D0FFAEDD7CD30ABC95D8
11ED47A01B30D0FFAEDD7CD30ABC95D8
11ED47A01B30D0FFAEDD7CD30ABC95D8
11ED47A01B30D0FFAEDD7CD30ABC95D8
11ED47A01B30D0FFAEDD7CD30ABC95D8
11ED47A01B30D0FFAEDD7CD30ABC95D8
11ED47A01B30D0FFAEDD7CD30ABC95D8
11ED47A01B30D0FFAEDD7CD30ABC95D8
11ED47A01B30D0FFAEDD7CD30ABC95D8
11ED47A01B30D0FFAEDD7CD30ABC95D8
11ED47A01B30D0FFAEDD7CD30ABC95D8
11ED47A01B30D0FFAEDD7CD30ABC95D8
11ED47A01B30D0FFAEDD7CD30ABC95D8
11ED47A01B30D0FFAEDD7CD30ABC95D8
11ED47A01B30D0FFAEDD7CD30ABC95D8
11ED47A01B30D0FFAEDD7CD30ABC95D8
11ED47A01B30D0FFAEDD7CD30ABC95D8
11ED47A01B30D0FFAEDD7CD30ABC95D8
11ED47A01B30D0FFAEDD7CD30ABC95D8
11ED47A01B30D0FFAEDD7CD30ABC95D8
11ED47A01B30D0FFAEDD7CD30ABC95D8
11ED47A01B30D0FFAEDD7CD30ABC95D8
11ED47A01B30D0FFAEDD7CD30ABC95D8
11ED47A01B30D0FFAEDD7CD30ABC95D8
11ED47A01B30D0FFAEDD7CD30ABC95D8
11ED47A01B30D0FFAEDD7CD30ABC95D8
11ED47A01B30D0FFAEDD7CD30ABC95D8
11ED47A01B30D0FFAEDD7CD30ABC95D8
11ED47A01B30D0FFAEDD7CD30ABC95D8
11ED47A01B30D0FFAEDD7CD30ABC95D8
11ED47A01B30D0FFAEDD7CD30ABC95D8
11ED47A01B30D0FFAEDD7CD30ABC95D8
11ED47A01B30D0FFAEDD7CD30ABC95D8
11ED47A01B30D0FFAEDD7CD30ABC95D8
11ED47A01B30D0FFAEDD7CD30ABC95D8
11ED47A01B30D0FFAEDD7CD30ABC95D8
11ED47A01B30D0FFAEDD7CD30ABC95D8
11ED47A01B30D0FFAEDD7CD30ABC95D8
11ED47A01B30D0FFAEDD7CD30ABC95D8
11ED47A01B30D0FFAEDD7CD30ABC95D8
11ED47A01B30D0FFAEDD7CD30ABC95D8
11ED47A01B30D0FFAEDD7CD30ABC95D8
11ED47A01B30D0FFAEDD7CD30ABC95D8
11ED47A01B30D0FFAEDD7CD30ABC95D8
11ED47A01B30D0FFAEDD7CD30ABC95D8
11ED47A01B30D0FFAEDD7CD30ABC95D8
11ED47A01B30D0FFAEDD7CD30ABC95D8
11ED47A01B30D0FFAEDD7CD30ABC95D8
11ED47A01B30D0FFAEDD7CD30ABC95D8
11ED47A01B30D0FFAEDD7CD30ABC95D8
11ED47A01B30D0FFAEDD7CD30ABC95D8
11ED47A01B30D0FFAEDD7CD30ABC95D8
11ED47A01B30D0FFAEDD7CD30ABC95D8
11ED47A01B30D0FFAEDD7CD30ABC95D8
11ED47A01B30D0FFAEDD7CD30ABC95D8
11ED47A01B30D0FFAEDD7CD30ABC95D8
11ED47A01B30D0FFAEDD7CD30ABC95D8
11ED47A01B30D0FFAEDD7CD30ABC95D8
11ED47A01B30D0FFAEDD7CD30ABC95D8
11ED47A01B30D0FFAEDD7CD30ABC95D8
11ED47A01B30D0FFAEDD7CD30ABC95D8
11ED47A01B30D0FFAEDD7CD30ABC95D8
11ED47A01B30D0FFAEDD7CD30ABC95D8
11ED47A01B30D0FFAEDD7CD30ABC95D8
11ED47A01B30D0FFAEDD7CD30ABC95D8
11ED47A01B30D0FFAEDD7CD30ABC95D8
11ED47A01B30D0FFAEDD7CD30ABC95D8
11ED47A01B30D0FFAEDD7CD30ABC95D8
11ED47A01B30D0FFAEDD7CD30ABC95D8
11ED47A01B30D0FFAEDD7CD30ABC95D8
11ED47A01B30D0FFAEDD7CD30ABC95D8
11ED47A01B30D0FFAEDD7CD30ABC95D8
11ED47A01B30D0FFAEDD7CD30ABC95D8
11ED47A01B30D0FFAEDD7CD30ABC95D8
11ED47A01B30D0FFAEDD7CD30ABC95D8
11ED47A01B30D0FFAEDD7CD30ABC95D8
11ED47A01B30D0FFAEDD7CD30ABC95D8
11ED47A01B30D0FFAEDD7CD30ABC95D8
11ED47A01B30D0FFAEDD7CD30ABC95D8
11ED47A01B30D0FFAEDD7CD30ABC95D8
11ED47A01B30D0FFAEDD7CD30ABC95D8
11ED47A01B30D0FFAEDD7CD30ABC95D8
11ED47A01B30D0FFAEDD7CD30ABC95D8
11ED47A01B30D0FFAEDD7CD30ABC95D8
11ED47A01B30D0FFAEDD7CD30ABC95D8
11ED47A01B30D0FFAEDD7CD30ABC95D8
11ED47A01B30D0FFAEDD7CD30ABC95D8
11ED47A01B30D0FFAEDD7CD30ABC95D8
11ED47A01B30D0FFAEDD7CD30ABC95D8
11ED47A01B30D0FFAEDD7CD30ABC95D8
11ED47A01B30D0FFAEDD7CD30ABC95D8
11ED47A01B30D0FFAEDD7CD30ABC95D8
11ED47A01B30D0FFAEDD7CD30ABC95D8
11ED47A01B30D0FFAEDD7CD30ABC95D8
11ED47A01B30D0FFAEDD7CD30ABC95D8
11ED47A01B30D0FFAEDD7CD30ABC95D8
11ED47A01B30D0FFAEDD7CD30ABC95D8
11ED47A01B30D0FFAEDD7CD30ABC95D8
11ED47A01B30D0FFAEDD7CD30ABC95D8
11ED47A01B30D0FFAEDD7CD30ABC95D8
11ED47A01B30D0FFAEDD7CD30ABC95D8
11ED47A01B30D0FFAEDD7CD30ABC95D8
11ED47A01B30D0FFAEDD7CD30ABC95D8
11ED47A01B30D0FFAEDD7CD30ABC95D8
11ED47A01B30D0FFAEDD7CD30ABC95D8
11ED47A01B30D0FFAEDD7CD30ABC95D8
11ED47A01B30D0FFAEDD7CD30ABC95D8
11ED47A01B30D0FFAEDD7CD30ABC95D8
11ED47A01B30D0FFAEDD7CD30ABC95D8
11ED47A01B30D0FFAEDD7CD30ABC95D8
11ED47A01B30D0FFAEDD7CD30ABC95D8
11ED47A01B30D0FFAEDD7CD30ABC95D8
11ED47A01B30D0FFAEDD7CD30ABC95D8
11ED47A01B30D0FFAEDD7CD30ABC95D8
11ED47A01B30D0FFAEDD7CD30ABC95D8
11ED47A01B30D0FFAEDD7CD30ABC95D8
11ED47A01B30D0FFAEDD7CD30ABC95D8
11ED47A01B30D0FFAEDD7CD30ABC95D8
11ED47A01B30D0FFAEDD7CD30ABC95D8
11ED47A01B30D0FFAEDD7CD30ABC95D8
11ED47A01B30D0FFAEDD7CD30ABC95D8
11ED47A01B30D0FFAEDD7CD30ABC95D8
11ED47A01B30D0FFAEDD7CD30ABC95D8
11ED47A01B30D0FFAEDD7CD30ABC95D8
11ED47A01B30D0FFAEDD7CD30ABC95D8
11ED47A01B30D0FFAEDD7CD30ABC95D8
11ED47A01B30D0FFAEDD7CD30ABC95D8
11ED47A01B30D0FFAEDD7CD30ABC95D8
11ED47A01B30D0FFAEDD7CD30ABC95D8
11ED47A01B30D0FFAEDD7CD30ABC95D8
11ED47A01B30D0FFAEDD7CD30ABC95D8
11ED47A01B30D0FFAEDD7CD30ABC95D8
11ED47A01B30D0FFAEDD7CD30ABC95D8
11ED47A01B30D0FFAEDD7CD30ABC95D8
11ED47A01B30D0FFAEDD7CD30ABC95D8
11ED47A01B30D0FFAEDD7CD30ABC95D8
11ED47A01B30D0FFAEDD7CD30ABC95D8
11ED47A01B30D0FFAEDD7CD30ABC95D8
11ED47A01B30D0FFAEDD7CD30ABC95D8
11ED47A01B30D0FFAEDD7CD30ABC95D8
11ED47A01B30D0FFAEDD7CD30ABC95D8
11ED47A01B30D0FFAEDD7CD30ABC95D8
11ED47A01B30D0FFAEDD7CD30ABC95D8
11ED47A01B30D0FFAEDD7CD30ABC95D8
11ED47A01B30D0FFAEDD7CD30ABC95D8
11ED47A01B30D0FFAEDD7CD30ABC95D8
11ED47A01B30D0FFAEDD7CD30ABC95D8
11ED47A01B30D0FFAEDD7CD30ABC95D8
11ED47A01B30D0FFAEDD7CD30ABC95D8
11ED47A01B30D0FFAEDD7CD30ABC95D8
11ED47A01B30D0FFAEDD7CD30ABC95D8
11ED47A01B30D0FFAEDD7CD30ABC95D8
11ED47A01B30D0FFAEDD7CD30ABC95D8
11ED47A01B30D0FFAEDD7CD30ABC95D8
11ED47A01B30D0FFAEDD7CD30ABC95D8
11ED47A01B30D0FFAEDD7CD30ABC95D8
11ED47A01B30D0FFAEDD7CD30ABC95D8
11ED47A01B30D0FFAEDD7CD30ABC95D8
11ED47A01B30D0FFAEDD7CD30ABC95D8
11ED47A01B30D0FFAEDD7CD30ABC95D8
11ED47A01B30D0FFAEDD7CD30ABC95D8
11ED47A01B30D0FFAEDD7CD30ABC95D8
11ED47A01B30D0FFAEDD7CD30ABC95D8
11ED47A01B30D0FFAEDD7CD30ABC95D8
11ED47A01B30D0FFAEDD7CD30ABC95D8
11ED47A01B30D0FFAEDD7CD30ABC95D8
11ED47A01B30D0FFAEDD7CD30ABC95D8
11ED47A01B30D0FFAEDD7CD30ABC95D8
11ED47A01B30D0FFAEDD7CD30ABC95D8
11ED47A01B30D0FFAEDD7CD30ABC95D8
11ED47A01B30D0FFAEDD7CD30ABC95D8
11ED47A01B30D0FFAEDD7CD30ABC95D8
11ED47A01B30D0FFAEDD7CD30ABC95D8
11ED47A01B30D0FFAEDD7CD30ABC95D8
11ED47A01B30D0FFAEDD7CD30ABC95D8
11ED47A01B30D0FFAEDD7CD30ABC95D8
11ED47A01B30D0FFAEDD7CD30ABC95D8
11ED47A01B30D0FFAEDD7CD30ABC95D8
11ED47A01B30D0FFAEDD7CD30ABC95D8
11ED47A01B30D0FFAEDD7CD30ABC95D8
11ED47A01B30D0FFAEDD7CD30ABC95D8
11ED47A01B30D0FFAEDD7CD30ABC95D8
11ED47A01B30D0FFAEDD7CD30ABC95D8
11ED47A01B30D0FFAEDD7CD30ABC95D8
11ED47A01B30D0FFAEDD7CD30ABC95D8
11ED47A01B30D0FFAEDD7CD30ABC95D8
11ED47A01B30D0FFAEDD7CD30ABC95D8
11ED47A01B30D0FFAEDD7CD30ABC95D8
11ED47A01B30D0FFAEDD7CD30ABC95D8
11ED47A01B30D0FFAEDD7CD30ABC95D8
11ED47A01B30D0FFAEDD7CD30ABC95D8
11ED47A01B30D0FFAEDD7CD30ABC95D8
11ED47A01B30D0FFAEDD7CD30ABC95D8
11ED47A01B30D0FFAEDD7CD30ABC95D8
11ED47A01B30D0FFAEDD7CD30ABC95D8
11ED47A01B30D0FFAEDD7CD30ABC95D8
11ED47A01B30D0FFAEDD7CD30ABC95D8
11ED47A01B30D0FFAEDD7CD30ABC95D8
11ED47A01B30D0FFAEDD7CD30ABC95D8
11ED47A01B30D0FFAEDD7CD30ABC95D8
11ED47A01B30D0FFAEDD7CD30ABC95D8
11ED47A01B30D0FFAEDD7CD30ABC95D8
11ED47A01B30D0FFAEDD7CD30ABC95D8
11ED47A01B30D0FFAEDD7CD30ABC95D8
11ED47A01B30D0FFAEDD7CD30ABC95D8
11ED47A01B30D0FFAEDD7CD30ABC95D8
11ED47A01B30D0FFAEDD7CD30ABC95D8
11ED47A01B30D0FFAEDD7CD30ABC95D8
11ED47A01B30D0FFAEDD7CD30ABC95D8
11ED47A01B30D0FFAEDD7CD30ABC95D8
11ED47A01B30D0FFAEDD7CD30ABC95D8
11ED47A01B30D0FFAEDD7CD30ABC95D8
11ED47A01B30D0FFAEDD7CD30ABC95D8
11ED47A01B30D0FFAEDD7CD30ABC95D8
11ED47A01B30D0FFAEDD7CD30ABC95D8
11ED47A01B30D0FFAEDD7CD30ABC95D8
11ED47A01B30D0FFAEDD7CD30ABC95D8
11ED47A01B30D0FFAEDD7CD30ABC95D8
11ED47A01B30D0FFAEDD7CD30ABC95D8
11ED47A01B30D0FFAEDD7CD30ABC95D8
11ED47A01B30D0FFAEDD7CD30ABC95D8
11ED47A01B30D0FFAEDD7CD30ABC95D8
11ED47A01B30D0FFAEDD7CD30ABC95D8
11ED47A01B30D0FFAEDD7CD30ABC95D8
11ED47A01B30D0FFAEDD7CD30ABC95D8
11ED47A01B30D0FFAEDD7CD30ABC95D8
11ED47A01B30D0FFAEDD7CD30ABC95D8
11ED47A01B30D0FFAEDD7CD30ABC95D8
11ED47A01B30D0FFAEDD7CD30ABC95D8
11ED47A01B30D0FFAEDD7CD30ABC95D8
11ED47A01B30D0FFAEDD7CD30ABC95D8
11ED47A01B30D0FFAEDD7CD30ABC95D8
11ED47A01B30D0FFAEDD7CD30ABC95D8
11ED47A01B30D0FFAEDD7CD30ABC95D8
11ED47A01B30D0FFAEDD7CD30ABC95D8
11ED47A01B30D0FFAEDD7CD30ABC95D8
11ED47A01B30D0FFAEDD7CD30ABC95D8
11ED47A01B30D0FFAEDD7CD30ABC95D8
11ED47A01B30D0FFAEDD7CD30ABC95D8
11ED47A01B30D0FFAEDD7CD30ABC95D8
11ED47A01B30D0FFAEDD7CD30ABC95D8
11ED47A01B30D0FFAEDD7CD30ABC95D8
11ED47A01B30D0FFAEDD7CD30ABC95D8
11ED47A01B30D0FFAEDD7CD30ABC95D8
11ED47A01B30D0FFAEDD7CD30ABC95D8
11ED47A01B30D0FFAEDD7CD30ABC95D8
11ED47A01B30D0FFAEDD7CD30ABC95D8
11ED47A01B30D0FFAEDD7CD30ABC95D8
11ED47A01B30D0FFAEDD7CD30ABC95D8
11ED47A01B30D0FFAEDD7CD30ABC95D8
11ED47A01B30D0FFAEDD7CD30ABC95D8
11ED47A01B30D0FFAEDD7CD30ABC95D8
11ED47A01B30D0FFAEDD7CD30ABC95D8
11ED47A01B30D0FFAEDD7CD30ABC95D8
11ED47A01B30D0FFAEDD7CD30ABC95D8
11ED47A01B30D0FFAEDD7CD30ABC95D8
11ED47A01B30D0FFAEDD7CD30ABC95D8
11ED47A01B30D0FFAEDD7CD30ABC95D8
11ED47A01B30D0FFAEDD7CD30ABC95D8
11ED47A01B30D0FFAEDD7CD30ABC95D8
11ED47A01B30D0FFAEDD7CD30ABC95D8
11ED47A01B30D0FFAEDD7CD30ABC95D8
11ED47A01B30D0FFAEDD7CD30ABC95D8
11ED47A01B30D0FFAEDD7CD30ABC95D8
11ED47A01B30D0FFAEDD7CD30ABC95D8
11ED47A01B30D0FFAEDD7CD30ABC95D8
11ED47A01B30D0FFAEDD7CD30ABC95D8
11ED47A01B30D0FFAEDD7CD30ABC95D8
11ED47A01B30D0FFAEDD7CD30ABC95D8
11ED47A01B30D0FFAEDD7CD30ABC95D8
11ED47A01B30D0FFAEDD7CD30ABC95D8
11ED47A01B30D0FFAEDD7CD30ABC95D8
11ED47A01B30D0FFAEDD7CD30ABC95D8
11ED47A01B30D0FFAEDD7CD30ABC95D8
11ED47A01B30D0FFAEDD7CD30ABC95D8
11ED47A01B30D0FFAEDD7CD30ABC95D8
11ED47A01B30D0FFAEDD7CD30ABC95D8
11ED47A01B30D0FFAEDD7CD30ABC95D8
11ED47A01B30D0FFAEDD7CD30ABC95D8
11ED47A01B30D0FFAEDD7CD30ABC95D8
11ED47A01B30D0FFAEDD7CD30ABC95D8
11ED47A01B30D0FFAEDD7CD30ABC95D8
11ED47A01B30D0FFAEDD7CD30ABC95D8
11ED47A01B30D0FFAEDD7CD30ABC95D8
11ED47A01B30D0FFAEDD7CD30ABC95D8
11ED47A01B30D0FFAEDD7CD30ABC95D8
11ED47A01B30D0FFAEDD7CD30ABC95D8
11ED47A01B30D0FFAEDD7CD30ABC95D8
11ED47A01B30D0FFAEDD7CD30ABC95D8
11ED47A01B30D0FFAEDD7CD30ABC95D8
11ED47A01B30D0FFAEDD7CD30ABC95D8
11ED47A01B30D0FFAEDD7CD30ABC95D8
11ED47A01B30D0FFAEDD7CD30ABC95D8
11ED47A01B30D0FFAEDD7CD30ABC95D8
11ED47A01B30D0FFAEDD7CD30ABC95D8
11ED47A01B30D0FFAEDD7CD30ABC95D8
11ED47A01B30D0FFAEDD7CD30ABC95D8
11ED47A01B30D0FFAEDD7CD30ABC95D8
11ED47A01B30D0FFAEDD7CD30ABC95D8
11ED47A01B30D0FFAEDD7CD30ABC95D8
11ED47A01B30D0FFAEDD7CD30ABC95D8
11ED47A01B30D0FFAEDD7CD30ABC95D8
11ED47A01B30D0FFAEDD7CD30ABC95D8
11ED47A01B30D0FFAEDD7CD30ABC95D8
11ED47A01B30D0FFAEDD7CD30ABC95D8
11ED47A01B30D0FFAEDD7CD30ABC95D8
11ED47A01B30D0FFAEDD7CD30ABC95D8
11ED47A01B30D0FFAEDD7CD30ABC95D8
11ED47A01B30D0FFAEDD7CD30ABC95D8
11ED47A01B30D0FFAEDD7CD30ABC95D8
11ED47A01B30D0FFAEDD7CD30ABC95D8
11ED47A01B30D0FFAEDD7CD30ABC95D8
11ED47A01B30D0FFAEDD7CD30ABC95D8
11ED47A01B30D0FFAEDD7CD30ABC95D8
11ED47A01B30D0FFAEDD7CD30ABC95D8
11ED47A01B30D0FFAEDD7CD30ABC95D8
11ED47A01B30D0FFAEDD7CD30ABC95D8
11ED47A01B30D0FFAEDD7CD30ABC95D8
11ED47A01B30D0FFAEDD7CD30ABC95D8
11ED47A01B30D0FFAEDD7CD30ABC95D8
11ED47A01B30D0FFAEDD7CD30ABC95D8
11ED47A01B30D0FFAEDD7CD30ABC95D8
11ED47A01B30D0FFAEDD7CD30ABC95D8
11ED47A01B30D0FFAEDD7CD30ABC95D8
11ED47A01B30D0FFAEDD7CD30ABC95D8
11ED47A01B30D0FFAEDD7CD30ABC95D8
11ED47A01B30D0FFAEDD7CD30ABC95D8
11ED47A01B30D0FFAEDD7CD30ABC95D8
11ED47A01B30D0FFAEDD7CD30ABC95D8
11ED47A01B30D0FFAEDD7CD30ABC95D8
11ED47A01B30D0FFAEDD7CD30ABC95D8
11ED47A01B30D0FFAEDD7CD30ABC95D8
11ED47A01B30D0FFAEDD7CD30ABC95D8
11ED47A01B30D0FFAEDD7CD30ABC95D8
11ED47A01B30D0FFAEDD7CD30ABC95D8
11ED47A01B30D0FFAEDD7CD30ABC95D8
11ED47A01B30D0FFAEDD7CD30ABC95D8
11ED47A01B30D0FFAEDD7CD30ABC95D8
11ED47A01B30D0FFAEDD7CD30ABC95D8
11ED47A01B30D0FFAEDD7CD30ABC95D8
11ED47A01B30D0FFAEDD7CD30ABC95D8
11ED47A01B30D0FFAEDD7CD30ABC95D8
11ED47A01B30D0FFAEDD7CD30ABC95D8
11ED47A01B30D0FFAEDD7CD30ABC95D8
11ED47A01B30D0FFAEDD7CD30ABC95D8
11ED47A01B30D0FFAEDD7CD30ABC95D8
11ED47A01B30D0FFAEDD7CD30ABC95D8
11ED47A01B30D0FFAEDD7CD30ABC95D8
11ED47A01B30D0FFAEDD7CD30ABC95D8
11ED47A01B30D0FFAEDD7CD30ABC95D8
11ED47A01B30D0FFAEDD7CD30ABC95D8
11ED47A01B30D0FFAEDD7CD30ABC95D8
11ED47A01B30D0FFAEDD7CD30ABC95D8
11ED47A01B30D0FFAEDD7CD30ABC95D8
11ED47A01B30D0FFAEDD7CD30ABC95D8
11ED47A01B30D0FFAEDD7CD30ABC95D8
11ED47A01B30D0FFAEDD7CD30ABC95D8
11ED47A01B30D0FFAEDD7CD30ABC95D8
11ED47A01B30D0FFAEDD7CD30ABC95D8
11ED47A01B30D0FFAEDD7CD30ABC95D8
11ED47A01B30D0FFAEDD7CD30ABC95D8
11ED47A01B30D0FFAEDD7CD30ABC95D8
11ED47A01B30D0FFAEDD7CD30ABC95D8
11ED47A01B30D0FFAEDD7CD30ABC95D8
11ED47A01B30D0FFAEDD7CD30ABC95D8
11ED47A01B30D0FFAEDD7CD30ABC95D8
11ED47A01B30D0FFAEDD7CD30ABC95D8
11ED47A01B30D0FFAEDD7CD30ABC95D8
11ED47A01B30D0FFAEDD7CD30ABC95D8
11ED47A01B30D0FFAEDD7CD30ABC95D8
11ED47A01B30D0FFAEDD7CD30ABC95D8
11ED47A01B30D0FFAEDD7CD30ABC95D8
11ED47A01B30D0FFAEDD7CD30ABC95D8
11ED47A01B30D0FFAEDD7CD30ABC95D8
11ED47A01B30D0FFAEDD7CD30ABC95D8
11ED47A01B30D0FFAEDD7CD30ABC95D8
11ED47A01B30D0FFAEDD7CD30ABC95D8
11ED47A01B30D0FFAEDD7CD30ABC95D8
11ED47A01B30D0FFAEDD7CD30ABC95D8
11ED47A01B30D0FFAEDD7CD30ABC95D8
11ED47A01B30D0FFAEDD7CD30ABC95D8
11ED47A01B30D0FFAEDD7CD30ABC95D8
11ED47A01B30D0FFAEDD7CD30ABC95D8
11ED47A01B30D0FFAEDD7CD30ABC95D8
11ED47A01B30D0FFAEDD7CD30ABC95D8
11ED47A01B30D0FFAEDD7CD30ABC95D8
11ED47A01B30D0FFAEDD7CD30ABC95D8
11ED47A01B30D0FFAEDD7CD30ABC95D8
11ED47A01B30D0FFAEDD7CD30ABC95D8
11ED47A01B30D0FFAEDD7CD30ABC95D8
11ED47A01B30D0FFAEDD7CD30ABC95D8
11ED47A01B30D0FFAEDD7CD30ABC95D8
11ED47A01B30D0FFAEDD7CD30ABC95D8
11ED47A01B30D0FFAEDD7CD30ABC95D8
11ED47A01B30D0FFAEDD7CD30ABC95D8
11ED47A01B30D0FFAEDD7CD30ABC95D8
11ED47A01B30D0FFAEDD7CD30ABC95D8
11ED47A01B30D0FFAEDD7CD30ABC95D8
11ED47A01B30D0FFAEDD7CD30ABC95D8
11ED47A01B30D0FFAEDD7CD30ABC95D8
11ED47A01B30D0FFAEDD7CD30ABC95D8
11ED47A01B30D0FFAEDD7CD30ABC95D8
11ED47A01B30D0FFAEDD7CD30ABC95D8
11ED47A01B30D0FFAEDD7CD30ABC95D8
11ED47A01B30D0FFAEDD7CD30ABC95D8
11ED47A01B30D0FFAEDD7CD30ABC95D8
11ED47A01B30D0FFAEDD7CD30ABC95D8
11ED47A01B30D0FFAEDD7CD30ABC95D8
11ED47A01B30D0FFAEDD7CD30ABC95D8
11ED47A01B30D0FFAEDD7CD30ABC95D8
11ED47A01B30D0FFAEDD7CD30ABC95D8
11ED47A01B30D0FFAEDD7CD30ABC95D8
11ED47A01B30D0FFAEDD7CD30ABC95D8
11ED47A01B30D0FFAEDD7CD30ABC95D8
11ED47A01B30D0FFAEDD7CD30ABC95D8
11ED47A01B30D0FFAEDD7CD30ABC95D8
11ED47A01B30D0FFAEDD7CD30ABC95D8
11ED47A01B30D0FFAEDD7CD30ABC95D8
11ED47A01B30D0FFAEDD7CD30ABC95D8
11ED47A01B30D0FFAEDD7CD30ABC95D8
11ED47A01B30D0FFAEDD7CD30ABC95D8
11ED47A01B30D0FFAEDD7CD30ABC95D8
11ED47A01B30D0FFAEDD7CD30ABC95D8
11ED47A01B30D0FFAEDD7CD30ABC95D8
11ED47A01B30D0FFAEDD7CD30ABC95D8
11ED47A01B30D0FFAEDD7CD30ABC95D8
11ED47A01B30D0FFAEDD7CD30ABC95D8
11ED47A01B30D0FFAEDD7CD30ABC95D8
11ED47A01B30D0FFAEDD7CD30ABC95D8
11ED47A01B30D0FFAEDD7CD30ABC95D8
11ED47A01B30D0FFAEDD7CD30ABC95D8
11ED47A01B30D0FFAEDD7CD30ABC95D8
11ED47A01B30D0FFAEDD7CD30ABC95D8
11ED47A01B30D0FFAEDD7CD30ABC95D8
11ED47A01B30D0FFAEDD7CD30ABC95D8
11ED47A01B30D0FFAEDD7CD30ABC95D8
11ED47A01B30D0FFAEDD7CD30ABC95D8
11ED47A01B30D0FFAEDD7CD30ABC95D8
11ED47A01B30D0FFAEDD7CD30ABC95D8
11ED47A01B30D0FFAEDD7CD30ABC95D8
11ED47A01B30D0FFAEDD7CD30ABC95D8
11ED47A01B30D0FFAEDD7CD30ABC95D8
11ED47A01B30D0FFAEDD7CD30ABC95D8
11ED47A01B30D0FFAEDD7CD30ABC95D8
11ED47A01B30D0FFAEDD7CD30ABC95D8
11ED47A01B30D0FFAEDD7CD30ABC95D8
11ED47A01B30D0FFAEDD7CD30ABC95D8
11ED47A01B30D0FFAEDD7CD30ABC95D8
11ED47A01B30D0FFAEDD7CD30ABC95D8
11ED47A01B30D0FFAEDD7CD30ABC95D8
11ED47A01B30D0FFAEDD7CD30ABC95D8
11ED47A01B30D0FFAEDD7CD30ABC95D8
11ED47A01B30D0FFAEDD7CD30ABC95D8
11ED47A01B30D0FFAEDD7CD30ABC95D8
11ED47A01B30D0FFAEDD7CD30ABC95D8
11ED47A01B30D0FFAEDD7CD30ABC95D8
11ED47A01B30D0FFAEDD7CD30ABC95D8
11ED47A01B30D0FFAEDD7CD30ABC95D8
11ED47A01B30D0FFAEDD7CD30ABC95D8
11ED47A01B30D0FFAEDD7CD30ABC95D8
11ED47A01B30D0FFAEDD7CD30ABC95D8
11ED47A01B30D0FFAEDD7CD30ABC95D8
11ED47A01B30D0FFAEDD7CD30ABC95D8
11ED47A01B30D0FFAEDD7CD30ABC95D8
11ED47A01B30D0FFAEDD7CD30ABC95D8
11ED47A01B30D0FFAEDD7CD30ABC95D8
11ED47A01B30D0FFAEDD7CD30ABC95D8
11ED47A01B30D0FFAEDD7CD30ABC95D8
11ED47A01B30D0FFAEDD7CD30ABC95D8
11ED47A01B30D0FFAEDD7CD30ABC95D8
11ED47A01B30D0FFAEDD7CD30ABC95D8
11ED47A01B30D0FFAEDD7CD30ABC95D8
11ED47A01B30D0FFAEDD7CD30ABC95D8
11ED47A01B30D0FFAEDD7CD30ABC95D8
11ED47A01B30D0FFAEDD7CD30ABC95D8
11ED47A01B30D0FFAEDD7CD30ABC95D8
11ED47A01B30D0FFAEDD7CD30ABC95D8
11ED47A01B30D0FFAEDD7CD30ABC95D8
11ED47A01B30D0FFAEDD7CD30ABC95D8
11ED47A01B30D0FFAEDD7CD30ABC95D8
11ED47A01B30D0FFAEDD7CD30ABC95D8
11ED47A01B30D0FFAEDD7CD30ABC95D8
11ED47A01B30D0FFAEDD7CD30ABC95D8
11ED47A01B30D0FFAEDD7CD30ABC95D8
11ED47A01B30D0FFAEDD7CD30ABC95D8
11ED47A01B30D0FFAEDD7CD30ABC95D8
11ED47A01B30D0FFAEDD7CD30ABC95D8
11ED47A01B30D0FFAEDD7CD30ABC95D8
11ED47A01B30D0FFAEDD7CD30ABC95D8
11ED47A01B30D0FFAEDD7CD30ABC95D8
11ED47A01B30D0FFAEDD7CD30ABC95D8
11ED47A01B30D0FFAEDD7CD30ABC95D8
11ED47A01B30D0FFAEDD7CD30ABC95D8
11ED47A01B30D0FFAEDD7CD30ABC95D8
11ED47A01B30D0FFAEDD7CD30ABC95D8
11ED47A01B30D0FFAEDD7CD30ABC95D8
11ED47A01B30D0FFAEDD7CD30ABC95D8
11ED47A01B30D0FFAEDD7CD30ABC95D8
11ED47A01B30D0FFAEDD7CD30ABC95D8
11ED47A01B30D0FFAEDD7CD30ABC95D8
11ED47A01B30D0FFAEDD7CD30ABC95D8
11ED47A01B30D0FFAEDD7CD30ABC95D8
11ED47A01B30D0FFAEDD7CD30ABC95D8
11ED47A01B30D0FFAEDD7CD30ABC95D8
11ED47A01B30D0FFAEDD7CD30ABC95D8
11ED47A01B30D0FFAEDD7CD30ABC95D8
11ED47A01B30D0FFAEDD7CD30ABC95D8
11ED47A01B30D0FFAEDD7CD30ABC95D8
11ED47A01B30D0FFAEDD7CD30ABC95D8
11ED47A01B30D0FFAEDD7CD30ABC95D8
11ED47A01B30D0FFAEDD7CD30ABC95D8
11ED47A01B30D0FFAEDD7CD30ABC95D8
11ED47A01B30D0FFAEDD7CD30ABC95D8
11ED47A01B30D0FFAEDD7CD30ABC95D8
11ED47A01B30D0FFAEDD7CD30ABC95D8
11ED47A01B30D0FFAEDD7CD30ABC95D8
11ED47A01B30D0FFAEDD7CD30ABC95D8
11ED47A01B30D0FFAEDD7CD30ABC95D8
11ED47A01B30D0FFAEDD7CD30ABC95D8
11ED47A01B30D0FFAEDD7CD30ABC95D8
11ED47A01B30D0FFAEDD7CD30ABC95D8
11ED47A01B30D0FFAEDD7CD30ABC95D8
11ED47A01B30D0FFAEDD7CD30ABC95D8
11ED47A01B30D0FFAEDD7CD30ABC95D8
11ED47A01B30D0FFAEDD7CD30ABC95D8
11ED47A01B30D0FFAEDD7CD30ABC95D8
11ED47A01B30D0FFAEDD7CD30ABC95D8
11ED47A01B30D0FFAEDD7CD30ABC95D8
11ED47A01B30D0FFAEDD7CD30ABC95D8
11ED47A01B30D0FFAEDD7CD30ABC95D8
11ED47A01B30D0FFAEDD7CD30ABC95D8
11ED47A01B30D0FFAEDD7CD30ABC95D8
11ED47A01B30D0FFAEDD7CD30ABC95D8
11ED47A01B30D0FFAEDD7CD30ABC95D8
11ED47A01B30D0FFAEDD7CD30ABC95D8
11ED47A01B30D0FFAEDD7CD30ABC95D8
11ED47A01B30D0FFAEDD7CD30ABC95D8
11ED47A01B30D0FFAEDD7CD30ABC95D8
11ED47A01B30D0FFAEDD7CD30ABC95D8
11ED47A01B30D0FFAEDD7CD30ABC95D8
11ED47A01B30D0FFAEDD7CD30ABC95D8
11ED47A01B30D0FFAEDD7CD30ABC95D8
11ED47A01B30D0FFAEDD7CD30ABC95D8
11ED47A01B30D0FFAEDD7CD30ABC95D8
11ED47A01B30D0FFAEDD7CD30ABC95D8
11ED47A01B30D0FFAEDD7CD30ABC95D8
11ED47A01B30D0FFAEDD7CD30ABC95D8
11ED47A01B30D0FFAEDD7CD30ABC95D8
11ED47A01B30D0FFAEDD7CD30ABC95D8
11ED47A01B30D0FFAEDD7CD30ABC95D8
11ED47A01B30D0FFAEDD7CD30ABC95D8
11ED47A01B30D0FFAEDD7CD30ABC95D8
11ED47A01B30D0FFAEDD7CD30ABC95D8
11ED47A01B30D0FFAEDD7CD30ABC95D8
11ED47A01B30D0FFAEDD7CD30ABC95D8
11ED47A01B30D0FFAEDD7CD30ABC95D8
11ED47A01B30D0FFAEDD7CD30ABC95D8
11ED47A01B30D0FFAEDD7CD30ABC95D8
11ED47A01B30D0FFAEDD7CD30ABC95D8
11ED47A01B30D0FFAEDD7CD30ABC95D8
11ED47A01B30D0FFAEDD7CD30ABC95D8
11ED47A01B30D0FFAEDD7CD30ABC95D8
11ED47A01B30D0FFAEDD7CD30ABC95D8
11ED47A01B30D0FFAEDD7CD30ABC95D8
11ED47A01B30D0FFAEDD7CD30ABC95D8
11ED47A01B30D0FFAEDD7CD30ABC95D8
11ED47A01B30D0FFAEDD7CD30ABC95D8
11ED47A01B30D0FFAEDD7CD30ABC95D8
11ED47A01B30D0FFAEDD7CD30ABC95D8
11ED47A01B30D0FFAEDD7CD30ABC95D8
11ED47A01B30D0FFAEDD7CD30ABC95D8
11ED47A01B30D0FFAEDD7CD30ABC95D8
11ED47A01B30D0FFAEDD7CD30ABC95D8
11ED47A01B30D0FFAEDD7CD30ABC95D8
11ED47A01B30D0FFAEDD7CD30ABC95D8
11ED47A01B30D0FFAEDD7CD30ABC95D8
11ED47A01B30D0FFAEDD7CD30ABC95D8
11ED47A01B30D0FFAEDD7CD30ABC95D8
11ED47A01B30D0FFAEDD7CD30ABC95D8
11ED47A01B30D0FFAEDD7CD30ABC95D8
11ED47A01B30D0FFAEDD7CD30ABC95D8
11ED47A01B30D0FFAEDD7CD30ABC95D8
11ED47A01B30D0FFAEDD7CD30ABC95D8
11ED47A01B30D0FFAEDD7CD30ABC95D8
11ED47A01B30D0FFAEDD7CD30ABC95D8
11ED47A01B30D0FFAEDD7CD30ABC95D8
11ED47A01B30D0FFAEDD7CD30ABC95D8
11ED47A01B30D0FFAEDD7CD30ABC95D8
11ED47A01B30D0FFAEDD7CD30ABC95D8
11ED47A01B30D0FFAEDD7CD30ABC95D8
11ED47A01B30D0FFAEDD7CD30ABC95D8
11ED47A01B30D0FFAEDD7CD30ABC95D8
11ED47A01B30D0FFAEDD7CD30ABC95D8
11ED47A01B30D0FFAEDD7CD30ABC95D8
11ED47A01B30D0FFAEDD7CD30ABC95D8
11ED47A01B30D0FFAEDD7CD30ABC95D8
11ED47A01B30D0FFAEDD7CD30ABC95D8
11ED47A01B30D0FFAEDD7CD30ABC95D8
11ED47A01B30D0FFAEDD7CD30ABC95D8
11ED47A01B30D0FFAEDD7CD30ABC95D8
11ED47A01B30D0FFAEDD7CD30ABC95D8
11ED47A01B30D0FFAEDD7CD30ABC95D8
11ED47A01B30D0FFAEDD7CD30ABC95D8
11ED47A01B30D0FFAEDD7CD30ABC95D8
11ED47A01B30D0FFAEDD7CD30ABC95D8
11ED47A01B30D0FFAEDD7CD30ABC95D8
11ED47A01B30D0FFAEDD7CD30ABC95D8
11ED47A01B30D0FFAEDD7CD30ABC95D8
11ED47A01B30D0FFAEDD7CD30ABC95D8
11ED47A01B30D0FFAEDD7CD30ABC95D8
11ED47A01B30D0FFAEDD7CD30ABC95D8
11ED47A01B30D0FFAEDD7CD30ABC95D8
11ED47A01B30D0FFAEDD7CD30ABC95D8
11ED47A01B30D0FFAEDD7CD30ABC95D8
11ED47A01B30D0FFAEDD7CD30ABC95D8
11ED47A01B30D0FFAEDD7CD30ABC95D8
11ED47A01B30D0FFAEDD7CD30ABC95D8
11ED47A01B30D0FFAEDD7CD30ABC95D8
11ED47A01B30D0FFAEDD7CD30ABC95D8
11ED47A01B30D0FFAEDD7CD30ABC95D8
11ED47A01B30D0FFAEDD7CD30ABC95D8
11ED47A01B30D0FFAEDD7CD30ABC95D8
11ED47A01B30D0FFAEDD7CD30ABC95D8
11ED47A01B30D0FFAEDD7CD30ABC95D8
11ED47A01B30D0FFAEDD7CD30ABC95D8
11ED47A01B30D0FFAEDD7CD30ABC95D8
11ED47A01B30D0FFAEDD7CD30ABC95D8
11ED47A01B30D0FFAEDD7CD30ABC95D8
11ED47A01B30D0FFAEDD7CD30ABC95D8
11ED47A01B30D0FFAEDD7CD30ABC95D8
11ED47A01B30D0FFAEDD7CD30ABC95D8
11ED47A01B30D0FFAEDD7CD30ABC95D8
11ED47A01B30D0FFAEDD7CD30ABC95D8
11ED47A01B30D0FFAEDD7CD30ABC95D8
11ED47A01B30D0FFAEDD7CD30ABC95D8
11ED47A01B30D0FFAEDD7CD30ABC95D8
11ED47A01B30D0FFAEDD7CD30ABC95D8
11ED47A01B30D0FFAEDD7CD30ABC95D8
11ED47A01B30D0FFAEDD7CD30ABC95D8
11ED47A01B30D0FFAEDD7CD30ABC95D8
11ED47A01B30D0FFAEDD7CD30ABC95D8
11ED47A01B30D0FFAEDD7CD30ABC95D8
11ED47A01B30D0FFAEDD7CD30ABC95D8
11ED47A01B30D0FFAEDD7CD30ABC95D8
11ED47A01B30D0FFAEDD7CD30ABC95D8
11ED47A01B30D0FFAEDD7CD30ABC95D8
11ED47A01B30D0FFAEDD7CD30ABC95D8
11ED47A01B30D0FFAEDD7CD30ABC95D8
11ED47A01B30D0FFAEDD7CD30ABC95D8
11ED47A01B30D0FFAEDD7CD30ABC95D8
11ED47A01B30D0FFAEDD7CD30ABC95D8
11ED47A01B30D0FFAEDD7CD30ABC95D8
11ED47A01B30D0FFAEDD7CD30ABC95D8
11ED47A01B30D0FFAEDD7CD30ABC95D8
11ED47A01B30D0FFAEDD7CD30ABC95D8
11ED47A01B30D0FFAEDD7CD30ABC95D8
11ED47A01B30D0FFAEDD7CD30ABC95D8
11ED47A01B30D0FFAEDD7CD30ABC95D8
11ED47A01B30D0FFAEDD7CD30ABC95D8
11ED47A01B30D0FFAEDD7CD30ABC95D8
11ED47A01B30D0FFAEDD7CD30ABC95D8
11ED47A01B30D0FFAEDD7CD30ABC95D8
11ED47A01B30D0FFAEDD7CD30ABC95D8
11ED47A01B30D0FFAEDD7CD30ABC95D8
11ED47A01B30D0FFAEDD7CD30ABC95D8
11ED47A01B30D0FFAEDD7CD30ABC95D8
11ED47A01B30D0FFAEDD7CD30ABC95D8
11ED47A01B30D0FFAEDD7CD30ABC95D8
11ED47A01B30D0FFAEDD7CD30ABC95D8
11ED47A01B30D0FFAEDD7CD30ABC95D8
11ED47A01B30D0FFAEDD7CD30ABC95D8
11ED47A01B30D0FFAEDD7CD30ABC95D8
11ED47A01B30D0FFAEDD7CD30ABC95D8
11ED47A01B30D0FFAEDD7CD30ABC95D8
11ED47A01B30D0FFAEDD7CD30ABC95D8
11ED47A01B30D0FFAEDD7CD30ABC95D8
11ED47A01B30D0FFAEDD7CD30ABC95D8
11ED47A01B30D0FFAEDD7CD30ABC95D8
11ED47A01B30D0FFAEDD7CD30ABC95D8
11ED47A01B30D0FFAEDD7CD30ABC95D8
11ED47A01B30D0FFAEDD7CD30ABC95D8
11ED47A01B30D0FFAEDD7CD30ABC95D8
11ED47A01B30D0FFAEDD7CD30ABC95D8
11ED47A01B30D0FFAEDD7CD30ABC95D8
11ED47A01B30D0FFAEDD7CD30ABC95D8
11ED47A01B30D0FFAEDD7CD30ABC95D8
11ED47A01B30D0FFAEDD7CD30ABC95D8
11ED47A01B30D0FFAEDD7CD30ABC95D8
11ED47A01B30D0FFAEDD7CD30ABC95D8
11ED47A01B30D0FFAEDD7CD30ABC95D8
11ED47A01B30D0FFAEDD7CD30ABC95D8
11ED47A01B30D0FFAEDD7CD30ABC95D8
11ED47A01B30D0FFAEDD7CD30ABC95D8
11ED47A01B30D0FFAEDD7CD30ABC95D8
11ED47A01B30D0FFAEDD7CD30ABC95D8
11ED47A01B30D0FFAEDD7CD30ABC95D8
11ED47A01B30D0FFAEDD7CD30ABC95D8
11ED47A01B30D0FFAEDD7CD30ABC95D8
11ED47A01B30D0FFAEDD7CD30ABC95D8
11ED47A01B30D0FFAEDD7CD30ABC95D8
11ED47A01B30D0FFAEDD7CD30ABC95D8
11ED47A01B30D0FFAEDD7CD30ABC95D8
11ED47A01B30D0FFAEDD7CD30ABC95D8
11ED47A01B30D0FFAEDD7CD30ABC95D8
11ED47A01B30D0FFAEDD7CD30ABC95D8
11ED47A01B30D0FFAEDD7CD30ABC95D8
11ED47A01B30D0FFAEDD7CD30ABC95D8
11ED47A01B30D0FFAEDD7CD30ABC95D8
11ED47A01B30D0FFAEDD7CD30ABC95D8
11ED47A01B30D0FFAEDD7CD30ABC95D8
11ED47A01B30D0FFAEDD7CD30ABC95D8
11ED47A01B30D0FFAEDD7CD30ABC95D8
11ED47A01B30D0FFAEDD7CD30ABC95D8
11ED47A01B30D0FFAEDD7CD30ABC95D8
11ED47A01B30D0FFAEDD7CD30ABC95D8
11ED47A01B30D0FFAEDD7CD30ABC95D8
11ED47A01B30D0FFAEDD7CD30ABC95D8
11ED47A01B30D0FFAEDD7CD30ABC95D8
11ED47A01B30D0FFAEDD7CD30ABC95D8
11ED47A01B30D0FFAEDD7CD30ABC95D8
11ED47A01B30D0FFAEDD7CD30ABC95D8
11ED47A01B30D0FFAEDD7CD30ABC95D8
11ED47A01B30D0FFAEDD7CD30ABC95D8
11ED47A01B30D0FFAEDD7CD30ABC95D8
11ED47A01B30D0FFAEDD7CD30ABC95D8
11ED47A01B30D0FFAEDD7CD30ABC95D8
11ED47A01B30D0FFAEDD7CD30ABC95D8
11ED47A01B30D0FFAEDD7CD30ABC95D8
11ED47A01B30D0FFAEDD7CD30ABC95D8
11ED47A01B30D0FFAEDD7CD30ABC95D8
11ED47A01B30D0FFAEDD7CD30ABC95D8
11ED47A01B30D0FFAEDD7CD30ABC95D8
11ED47A01B30D0FFAEDD7CD30ABC95D8
11ED47A01B30D0FFAEDD7CD30ABC95D8
11ED47A01B30D0FFAEDD7CD30ABC95D8
11ED47A01B30D0FFAEDD7CD30ABC95D8
11ED47A01B30D0FFAEDD7CD30ABC95D8
11ED47A01B30D0FFAEDD7CD30ABC95D8
11ED47A01B30D0FFAEDD7CD30ABC95D8
11ED47A01B30D0FFAEDD7CD30ABC95D8
11ED47A01B30D0FFAEDD7CD30ABC95D8
11ED47A01B30D0FFAEDD7CD30ABC95D8
11ED47A01B30D0FFAEDD7CD30ABC95D8
11ED47A01B30D0FFAEDD7CD30ABC95D8
11ED47A01B30D0FFAEDD7CD30ABC95D8
11ED47A01B30D0FFAEDD7CD30ABC95D8
11ED47A01B30D0FFAEDD7CD30ABC95D8
11ED47A01B30D0FFAEDD7CD30ABC95D8
11ED47A01B30D0FFAEDD7CD30ABC95D8
11ED47A01B30D0FFAEDD7CD30ABC95D8
11ED47A01B30D0FFAEDD7CD30ABC95D8
11ED47A01B30D0FFAEDD7CD30ABC95D8
11ED47A01B30D0FFAEDD7CD30ABC95D8
11ED47A01B30D0FFAEDD7CD30ABC95D8
11ED47A01B30D0FFAEDD7CD30ABC95D8
11ED47A01B30D0FFAEDD7CD30ABC95D8
11ED47A01B30D0FFAEDD7CD30ABC95D8
11ED47A01B30D0FFAEDD7CD30ABC95D8
11ED47A01B30D0FFAEDD7CD30ABC95D8
11ED47A01B30D0FFAEDD7CD30ABC95D8
11ED47A01B30D0FFAEDD7CD30ABC95D8
11ED47A01B30D0FFAEDD7CD30ABC95D8
11ED47A01B30D0FFAEDD7CD30ABC95D8
11ED47A01B30D0FFAEDD7CD30ABC95D8
11ED47A01B30D0FFAEDD7CD30ABC95D8
11ED47A01B30D0FFAEDD7CD30ABC95D8
11ED47A01B30D0FFAEDD7CD30ABC95D8
11ED47A01B30D0FFAEDD7CD30ABC95D8
11ED47A01B30D0FFAEDD7CD30ABC95D8
11ED47A01B30D0FFAEDD7CD30ABC95D8
11ED47A01B30D0FFAEDD7CD30ABC95D8
11ED47A01B30D0FFAEDD7CD30ABC95D8
11ED47A01B30D0FFAEDD7CD30ABC95D8
11ED47A01B30D0FFAEDD7CD30ABC95D8
11ED47A01B30D0FFAEDD7CD30ABC95D8
11ED47A01B30D0FFAEDD7CD30ABC95D8
11ED47A01B30D0FFAEDD7CD30ABC95D8
11ED47A01B30D0FFAEDD7CD30ABC95D8
11ED47A01B30D0FFAEDD7CD30ABC95D8
11ED47A01B30D0FFAEDD7CD30ABC95D8
11ED47A01B30D0FFAEDD7CD30ABC95D8
11ED47A01B30D0FFAEDD7CD30ABC95D8
11ED47A01B30D0FFAEDD7CD30ABC95D8
11ED47A01B30D0FFAEDD7CD30ABC95D8
11ED47A01B30D0FFAEDD7CD30ABC95D8
11ED47A01B30D0FFAEDD7CD30ABC95D8
11ED47A01B30D0FFAEDD7CD30ABC95D8
11ED47A01B30D0FFAEDD7CD30ABC95D8
11ED47A01B30D0FFAEDD7CD30ABC95D8
11ED47A01B30D0FFAEDD7CD30ABC95D8
11ED47A01B30D0FFAEDD7CD30ABC95D8
11ED47A01B30D0FFAEDD7CD30ABC95D8
11ED47A01B30D0FFAEDD7CD30ABC95D8
11ED47A01B30D0FFAEDD7CD30ABC95D8
11ED47A01B30D0FFAEDD7CD30ABC95D8
11ED47A01B30D0FFAEDD7CD30ABC95D8
11ED47A01B30D0FFAEDD7CD30ABC95D8
11ED47A01B30D0FFAEDD7CD30ABC95D8
11ED47A01B30D0FFAEDD7CD30ABC95D8
11ED47A01B30D0FFAEDD7CD30ABC95D8
11ED47A01B30D0FFAEDD7CD30ABC95D8
11ED47A01B30D0FFAEDD7CD30ABC95D8
11ED47A01B30D0FFAEDD7CD30ABC95D8
11ED47A01B30D0FFAEDD7CD30ABC95D8
11ED47A01B30D0FFAEDD7CD30ABC95D8
11ED47A01B30D0FFAEDD7CD30ABC95D8
11ED47A01B30D0FFAEDD7CD30ABC95D8
11ED47A01B30D0FFAEDD7CD30ABC95D8
11ED47A01B30D0FFAEDD7CD30ABC95D8
11ED47A01B30D0FFAEDD7CD30ABC95D8
11ED47A01B30D0FFAEDD7CD30ABC95D8
11ED47A01B30D0FFAEDD7CD30ABC95D8
11ED47A01B30D0FFAEDD7CD30ABC95D8
11ED47A01B30D0FFAEDD7CD30ABC95D8
11ED47A01B30D0FFAEDD7CD30ABC95D8
11ED47A01B30D0FFAEDD7CD30ABC95D8
11ED47A01B30D0FFAEDD7CD30ABC95D8
11ED47A01B30D0FFAEDD7CD30ABC95D8
11ED47A01B30D0FFAEDD7CD30ABC95D8
11ED47A01B30D0FFAEDD7CD30ABC95D8
11ED47A01B30D0FFAEDD7CD30ABC95D8
11ED47A01B30D0FFAEDD7CD30ABC95D8
11ED47A01B30D0FFAEDD7CD30ABC95D8
11ED47A01B30D0FFAEDD7CD30ABC95D8
11ED47A01B30D0FFAEDD7CD30ABC95D8
11ED47A01B30D0FFAEDD7CD30ABC95D8
11ED47A01B30D0FFAEDD7CD30ABC95D8
11ED47A01B30D0FFAEDD7CD30ABC95D8
11ED47A01B30D0FFAEDD7CD30ABC95D8
11ED47A01B30D0FFAEDD7CD30ABC95D8
11ED47A01B30D0FFAEDD7CD30ABC95D8
11ED47A01B30D0FFAEDD7CD30ABC95D8
11ED47A01B30D0FFAEDD7CD30ABC95D8
11ED47A01B30D0FFAEDD7CD30ABC95D8
11ED47A01B30D0FFAEDD7CD30ABC95D8
11ED47A01B30D0FFAEDD7CD30ABC95D8
11ED47A01B30D0FFAEDD7CD30ABC95D8
11ED47A01B30D0FFAEDD7CD30ABC95D8
11ED47A01B30D0FFAEDD7CD30ABC95D8
11ED47A01B30D0FFAEDD7CD30ABC95D8
11ED47A01B30D0FFAEDD7CD30ABC95D8
11ED47A01B30D0FFAEDD7CD30ABC95D8
11ED47A01B30D0FFAEDD7CD30ABC95D8
11ED47A01B30D0FFAEDD7CD30ABC95D8
11ED47A01B30D0FFAEDD7CD30ABC95D8
11ED47A01B30D0FFAEDD7CD30ABC95D8
11ED47A01B30D0FFAEDD7CD30ABC95D8
11ED47A01B30D0FFAEDD7CD30ABC95D8
11ED47A01B30D0FFAEDD7CD30ABC95D8
11ED47A01B30D0FFAEDD7CD30ABC95D8
11ED47A01B30D0FFAEDD7CD30ABC95D8
11ED47A01B30D0FFAEDD7CD30ABC95D8
11ED47A01B30D0FFAEDD7CD30ABC95D8
11ED47A01B30D0FFAEDD7CD30ABC95D8
11ED47A01B30D0FFAEDD7CD30ABC95D8
11ED47A01B30D0FFAEDD7CD30ABC95D8
11ED47A01B30D0FFAEDD7CD30ABC95D8
11ED47A01B30D0FFAEDD7CD30ABC95D8
11ED47A01B30D0FFAEDD7CD30ABC95D8
11ED47A01B30D0FFAEDD7CD30ABC95D8
11ED47A01B30D0FFAEDD7CD30ABC95D8
11ED47A01B30D0FFAEDD7CD30ABC95D8
11ED47A01B30D0FFAEDD7CD30ABC95D8
11ED47A01B30D0FFAEDD7CD30ABC95D8
11ED47A01B30D0FFAEDD7CD30ABC95D8
11ED47A01B30D0FFAEDD7CD30ABC95D8
11ED47A01B30D0FFAEDD7CD30ABC95D8
11ED47A01B30D0FFAEDD7CD30ABC95D8
11ED47A01B30D0FFAEDD7CD30ABC95D8
11ED47A01B30D0FFAEDD7CD30ABC95D8
11ED47A01B30D0FFAEDD7CD30ABC95D8
11ED47A01B30D0FFAEDD7CD30ABC95D8
11ED47A01B30D0FFAEDD7CD30ABC95D8
11ED47A01B30D0FFAEDD7CD30ABC95D8
11ED47A01B30D0FFAEDD7CD30ABC95D8
11ED47A01B30D0FFAEDD7CD30ABC95D8
11ED47A01B30D0FFAEDD7CD30ABC95D8
11ED47A01B30D0FFAEDD7CD30ABC95D8
11ED47A01B30D0FFAEDD7CD30ABC95D8
11ED47A01B30D0FFAEDD7CD30ABC95D8
11ED47A01B30D0FFAEDD7CD30ABC95D8
11ED47A01B30D0FFAEDD7CD30ABC95D8
11ED47A01B30D0FFAEDD7CD30ABC95D8
11ED47A01B30D0FFAEDD7CD30ABC95D8
11ED47A01B30D0FFAEDD7CD30ABC95D8
11ED47A01B30D0FFAEDD7CD30ABC95D8
11ED47A01B30D0FFAEDD7CD30ABC95D8
11ED47A01B30D0FFAEDD7CD30ABC95D8
11ED47A01B30D0FFAEDD7CD30ABC95D8
11ED47A01B30D0FFAEDD7CD30ABC95D8
11ED47A01B30D0FFAEDD7CD30ABC95D8
11ED47A01B30D0FFAEDD7CD30ABC95D8
11ED47A01B30D0FFAEDD7CD30ABC95D8
11ED47A01B30D0FFAEDD7CD30ABC95D8
11ED47A01B30D0FFAEDD7CD30ABC95D8
11ED47A01B30D0FFAEDD7CD30ABC95D8
11ED47A01B30D0FFAEDD7CD30ABC95D8
11ED47A01B30D0FFAEDD7CD30ABC95D8
11ED47A01B30D0FFAEDD7CD30ABC95D8
11ED47A01B30D0FFAEDD7CD30ABC95D8
11ED47A01B30D0FFAEDD7CD30ABC95D8
11ED47A01B30D0FFAEDD7CD30ABC95D8
11ED47A01B30D0FFAEDD7CD30ABC95D8
11ED47A01B30D0FFAEDD7CD30ABC95D8
11ED47A01B30D0FFAEDD7CD30ABC95D8
11ED47A01B30D0FFAEDD7CD30ABC95D8
11ED47A01B30D0FFAEDD7CD30ABC95D8
11ED47A01B30D0FFAEDD7CD30ABC95D8
11ED47A01B30D0FFAEDD7CD30ABC95D8
11ED47A01B30D0FFAEDD7CD30ABC95D8
11ED47A01B30D0FFAEDD7CD30ABC95D8
11ED47A01B30D0FFAEDD7CD30ABC95D8
11ED47A01B30D0FFAEDD7CD30ABC95D8
11ED47A01B30D0FFAEDD7CD30ABC95D8
11ED47A01B30D0FFAEDD7CD30ABC95D8
11ED47A01B30D0FFAEDD7CD30ABC95D8
11ED47A01B30D0FFAEDD7CD30ABC95D8
11ED47A01B30D0FFAEDD7CD30ABC95D8
11ED47A01B30D0FFAEDD7CD30ABC95D8
11ED47A01B30D0FFAEDD7CD30ABC95D8
11ED47A01B30D0FFAEDD7CD30ABC95D8
11ED47A01B30D0FFAEDD7CD30ABC95D8
11ED47A01B30D0FFAEDD7CD30ABC95D8
11ED47A01B30D0FFAEDD7CD30ABC95D8
11ED47A01B30D0FFAEDD7CD30ABC95D8
11ED47A01B30D0FFAEDD7CD30ABC95D8
11ED47A01B30D0FFAEDD7CD30ABC95D8
11ED47A01B30D0FFAEDD7CD30ABC95D8
11ED47A01B30D0FFAEDD7CD30ABC95D8
11ED47A01B30D0FFAEDD7CD30ABC95D8
11ED47A01B30D0FFAEDD7CD30ABC95D8
11ED47A01B30D0FFAEDD7CD30ABC95D8
11ED47A01B30D0FFAEDD7CD30ABC95D8
11ED47A01B30D0FFAEDD7CD30ABC95D8
11ED47A01B30D0FFAEDD7CD30ABC95D8
11ED47A01B30D0FFAEDD7CD30ABC95D8
11ED47A01B30D0FFAEDD7CD30ABC95D8
11ED47A01B30D0FFAEDD7CD30ABC95D8
11ED47A01B30D0FFAEDD7CD30ABC95D8
11ED47A01B30D0FFAEDD7CD30ABC95D8
11ED47A01B30D0FFAEDD7CD30ABC95D8
11ED47A01B30D0FFAEDD7CD30ABC95D8
11ED47A01B30D0FFAEDD7CD30ABC95D8
11ED47A01B30D0FFAEDD7CD30ABC95D8
11ED47A01B30D0FFAEDD7CD30ABC95D8
11ED47A01B30D0FFAEDD7CD30ABC95D8
11ED47A01B30D0FFAEDD7CD30ABC95D8
11ED47A01B30D0FFAEDD7CD30ABC95D8
11ED47A01B30D0FFAEDD7CD30ABC95D8
11ED47A01B30D0FFAEDD7CD30ABC95D8
11ED47A01B30D0FFAEDD7CD30ABC95D8
11ED47A01B30D0FFAEDD7CD30ABC95D8
11ED47A01B30D0FFAEDD7CD30ABC95D8
11ED47A01B30D0FFAEDD7CD30ABC95D8
11ED47A01B30D0FFAEDD7CD30ABC95D8
11ED47A01B30D0FFAEDD7CD30ABC95D8
11ED47A01B30D0FFAEDD7CD30ABC95D8
11ED47A01B30D0FFAEDD7CD30ABC95D8
11ED47A01B30D0FFAEDD7CD30ABC95D8
11ED47A01B30D0FFAEDD7CD30ABC95D8
11ED47A01B30D0FFAEDD7CD30ABC95D8
11ED47A01B30D0FFAEDD7CD30ABC95D8
11ED47A01B30D0FFAEDD7CD30ABC95D8
11ED47A01B30D0FFAEDD7CD30ABC95D8
11ED47A01B30D0FFAEDD7CD30ABC95D8
11ED47A01B30D0FFAEDD7CD30ABC95D8
11ED47A01B30D0FFAEDD7CD30ABC95D8
11ED47A01B30D0FFAEDD7CD30ABC95D8
11ED47A01B30D0FFAEDD7CD30ABC95D8
11ED47A01B30D0FFAEDD7CD30ABC95D8
11ED47A01B30D0FFAEDD7CD30ABC95D8
11ED47A01B30D0FFAEDD7CD30ABC95D8
11ED47A01B30D0FFAEDD7CD30ABC95D8
11ED47A01B30D0FFAEDD7CD30ABC95D8
11ED47A01B30D0FFAEDD7CD30ABC95D8
11ED47A01B30D0FFAEDD7CD30ABC95D8
11ED47A01B30D0FFAEDD7CD30ABC95D8
11ED47A01B30D0FFAEDD7CD30ABC95D8
11ED47A01B30D0FFAEDD7CD30ABC95D8
11ED47A01B30D0FFAEDD7CD30ABC95D8
11ED47A01B30D0FFAEDD7CD30ABC95D8
11ED47A01B30D0FFAEDD7CD30ABC95D8
11ED47A01B30D0FFAEDD7CD30ABC95D8
11ED47A01B30D0FFAEDD7CD30ABC95D8
11ED47A01B30D0FFAEDD7CD30ABC95D8
11ED47A01B30D0FFAEDD7CD30ABC95D8
11ED47A01B30D0FFAEDD7CD30ABC95D8
11ED47A01B30D0FFAEDD7CD30ABC95D8
11ED47A01B30D0FFAEDD7CD30ABC95D8
11ED47A01B30D0FFAEDD7CD30ABC95D8
11ED47A01B30D0FFAEDD7CD30ABC95D8
11ED47A01B30D0FFAEDD7CD30ABC95D8
11ED47A01B30D0FFAEDD7CD30ABC95D8
11ED47A01B30D0FFAEDD7CD30ABC95D8
11ED47A01B30D0FFAEDD7CD30ABC95D8
11ED47A01B30D0FFAEDD7CD30ABC95D8
11ED47A01B30D0FFAEDD7CD30ABC95D8
11ED47A01B30D0FFAEDD7CD30ABC95D8
11ED47A01B30D0FFAEDD7CD30ABC95D8
11ED47A01B30D0FFAEDD7CD30ABC95D8
11ED47A01B30D0FFAEDD7CD30ABC95D8
11ED47A01B30D0FFAEDD7CD30ABC95D8
11ED47A01B30D0FFAEDD7CD30ABC95D8
11ED47A01B30D0FFAEDD7CD30ABC95D8
11ED47A01B30D0FFAEDD7CD30ABC95D8
11ED47A01B30D0FFAEDD7CD30ABC95D8
11ED47A01B30D0FFAEDD7CD30ABC95D8
11ED47A01B30D0FFAEDD7CD30ABC95D8
11ED47A01B30D0FFAEDD7CD30ABC95D8
11ED47A01B30D0FFAEDD7CD30ABC95D8
11ED47A01B30D0FFAEDD7CD30ABC95D8
11ED47A01B30D0FFAEDD7CD30ABC95D8
11ED47A01B30D0FFAEDD7CD30ABC95D8
11ED47A01B30D0FFAEDD7CD30ABC95D8
11ED47A01B30D0FFAEDD7CD30ABC95D8
11ED47A01B30D0FFAEDD7CD30ABC95D8
11ED47A01B30D0FFAEDD7CD30ABC95D8
11ED47A01B30D0FFAEDD7CD30ABC95D8
11ED47A01B30D0FFAEDD7CD30ABC95D8
11ED47A01B30D0FFAEDD7CD30ABC95D8
11ED47A01B30D0FFAEDD7CD30ABC95D8
11ED47A01B30D0FFAEDD7CD30ABC95D8
11ED47A01B30D0FFAEDD7CD30ABC95D8
11ED47A01B30D0FFAEDD7CD30ABC95D8
11ED47A01B30D0FFAEDD7CD30ABC95D8
11ED47A01B30D0FFAEDD7CD30ABC95D8
11ED47A01B30D0FFAEDD7CD30ABC95D8
11ED47A01B30D0FFAEDD7CD30ABC95D8
11ED47A01B30D0FFAEDD7CD30ABC95D8
11ED47A01B30D0FFAEDD7CD30ABC95D8
11ED47A01B30D0FFAEDD7CD30ABC95D8
11ED47A01B30D0FFAEDD7CD30ABC95D8
11ED47A01B30D0FFAEDD7CD30ABC95D8
11ED47A01B30D0FFAEDD7CD30ABC95D8
11ED47A01B30D0FFAEDD7CD30ABC95D8
11ED47A01B30D0FFAEDD7CD30ABC95D8
11ED47A01B30D0FFAEDD7CD30ABC95D8
11ED47A01B30D0FFAEDD7CD30ABC95D8
11ED47A01B30D0FFAEDD7CD30ABC95D8
11ED47A01B30D0FFAEDD7CD30ABC95D8
11ED47A01B30D0FFAEDD7CD30ABC95D8
11ED47A01B30D0FFAEDD7CD30ABC95D8
11ED47A01B30D0FFAEDD7CD30ABC95D8
11ED47A01B30D0FFAEDD7CD30ABC95D8
11ED47A01B30D0FFAEDD7CD30ABC95D8
11ED47A01B30D0FFAEDD7CD30ABC95D8
11ED47A01B30D0FFAEDD7CD30ABC95D8
11ED47A01B30D0FFAEDD7CD30ABC95D8
11ED47A01B30D0FFAEDD7CD30ABC95D8
11ED47A01B30D0FFAEDD7CD30ABC95D8
11ED47A01B30D0FFAEDD7CD30ABC95D8
11ED47A01B30D0FFAEDD7CD30ABC95D8
11ED47A01B30D0FFAEDD7CD30ABC95D8
11ED47A01B30D0FFAEDD7CD30ABC95D8
11ED47A01B30D0FFAEDD7CD30ABC95D8
11ED47A01B30D0FFAEDD7CD30ABC95D8
11ED47A01B30D0FFAEDD7CD30ABC95D8
11ED47A01B30D0FFAEDD7CD30ABC95D8
11ED47A01B30D0FFAEDD7CD30ABC95D8
11ED47A01B30D0FFAEDD7CD30ABC95D8
11ED47A01B30D0FFAEDD7CD30ABC95D8
11ED47A01B30D0FFAEDD7CD30ABC95D8
11ED47A01B30D0FFAEDD7CD30ABC95D8
11ED47A01B30D0FFAEDD7CD30ABC95D8
11ED47A01B30D0FFAEDD7CD30ABC95D8
11ED47A01B30D0FFAEDD7CD30ABC95D8
11ED47A01B30D0FFAEDD7CD30ABC95D8
11ED47A01B30D0FFAEDD7CD30ABC95D8
11ED47A01B30D0FFAEDD7CD30ABC95D8
11ED47A01B30D0FFAEDD7CD30ABC95D8
11ED47A01B30D0FFAEDD7CD30ABC95D8
11ED47A01B30D0FFAEDD7CD30ABC95D8
11ED47A01B30D0FFAEDD7CD30ABC95D8
11ED47A01B30D0FFAEDD7CD30ABC95D8
11ED47A01B30D0FFAEDD7CD30ABC95D8
11ED47A01B30D0FFAEDD7CD30ABC95D8
11ED47A01B30D0FFAEDD7CD30ABC95D8
11ED47A01B30D0FFAEDD7CD30ABC95D8
11ED47A01B30D0FFAEDD7CD30ABC95D8
11ED47A01B30D0FFAEDD7CD30ABC95D8
11ED47A01B30D0FFAEDD7CD30ABC95D8
11ED47A01B30D0FFAEDD7CD30ABC95D8
11ED47A01B30D0FFAEDD7CD30ABC95D8
11ED47A01B30D0FFAEDD7CD30ABC95D8
11ED47A01B30D0FFAEDD7CD30ABC95D8
11ED47A01B30D0FFAEDD7CD30ABC95D8
11ED47A01B30D0FFAEDD7CD30ABC95D8
11ED47A01B30D0FFAEDD7CD30ABC95D8
11ED47A01B30D0FFAEDD7CD30ABC95D8
11ED47A01B30D0FFAEDD7CD30ABC95D8
11ED47A01B30D0FFAEDD7CD30ABC95D8
11ED47A01B30D0FFAEDD7CD30ABC95D8
11ED47A01B30D0FFAEDD7CD30ABC95D8
11ED47A01B30D0FFAEDD7CD30ABC95D8
11ED47A01B30D0FFAEDD7CD30ABC95D8
11ED47A01B30D0FFAEDD7CD30ABC95D8
11ED47A01B30D0FFAEDD7CD30ABC95D8
11ED47A01B30D0FFAEDD7CD30ABC95D8
11ED47A01B30D0FFAEDD7CD30ABC95D8
11ED47A01B30D0FFAEDD7CD30ABC95D8
11ED47A01B30D0FFAEDD7CD30ABC95D8
11ED47A01B30D0FFAEDD7CD30ABC95D8
11ED47A01B30D0FFAEDD7CD30ABC95D8
11ED47A01B30D0FFAEDD7CD30ABC95D8
11ED47A01B30D0FFAEDD7CD30ABC95D8
11ED47A01B30D0FFAEDD7CD30ABC95D8
11ED47A01B30D0FFAEDD7CD30ABC95D8
11ED47A01B30D0FFAEDD7CD30ABC95D8
11ED47A01B30D0FFAEDD7CD30ABC95D8
11ED47A01B30D0FFAEDD7CD30ABC95D8
11ED47A01B30D0FFAEDD7CD30ABC95D8
11ED47A01B30D0FFAEDD7CD30ABC95D8
11ED47A01B30D0FFAEDD7CD30ABC95D8
11ED47A01B30D0FFAEDD7CD30ABC95D8
11ED47A01B30D0FFAEDD7CD30ABC95D8
11ED47A01B30D0FFAEDD7CD30ABC95D8
11ED47A01B30D0FFAEDD7CD30ABC95D8
11ED47A01B30D0FFAEDD7CD30ABC95D8
11ED47A01B30D0FFAEDD7CD30ABC95D8
11ED47A01B30D0FFAEDD7CD30ABC95D8
11ED47A01B30D0FFAEDD7CD30ABC95D8
11ED47A01B30D0FFAEDD7CD30ABC95D8
11ED47A01B30D0FFAEDD7CD30ABC95D8
11ED47A01B30D0FFAEDD7CD30ABC95D8
11ED47A01B30D0FFAEDD7CD30ABC95D8
11ED47A01B30D0FFAEDD7CD30ABC95D8
11ED47A01B30D0FFAEDD7CD30ABC95D8
11ED47A01B30D0FFAEDD7CD30ABC95D8
11ED47A01B30D0FFAEDD7CD30ABC95D8
11ED47A01B30D0FFAEDD7CD30ABC95D8
11ED47A01B30D0FFAEDD7CD30ABC95D8
11ED47A01B30D0FFAEDD7CD30ABC95D8
11ED47A01B30D0FFAEDD7CD30ABC95D8
11ED47A01B30D0FFAEDD7CD30ABC95D8
11ED47A01B30D0FFAEDD7CD30ABC95D8
11ED47A01B30D0FFAEDD7CD30ABC95D8
11ED47A01B30D0FFAEDD7CD30ABC95D8
11ED47A01B30D0FFAEDD7CD30ABC95D8
11ED47A01B30D0FFAEDD7CD30ABC95D8
11ED47A01B30D0FFAEDD7CD30ABC95D8
11ED47A01B30D0FFAEDD7CD30ABC95D8
11ED47A01B30D0FFAEDD7CD30ABC95D8
11ED47A01B30D0FFAEDD7CD30ABC95D8
11ED47A01B30D0FFAEDD7CD30ABC95D8
11ED47A01B30D0FFAEDD7CD30ABC95D8
11ED47A01B30D0FFAEDD7CD30ABC95D8
11ED47A01B30D0FFAEDD7CD30ABC95D8
11ED47A01B30D0FFAEDD7CD30ABC95D8
11ED47A01B30D0FFAEDD7CD30ABC95D8
11ED47A01B30D0FFAEDD7CD30ABC95D8
11ED47A01B30D0FFAEDD7CD30ABC95D8
11ED47A01B30D0FFAEDD7CD30ABC95D8
11ED47A01B30D0FFAEDD7CD30ABC95D8
11ED47A01B30D0FFAEDD7CD30ABC95D8
11ED47A01B30D0FFAEDD7CD30ABC95D8
11ED47A01B30D0FFAEDD7CD30ABC95D8
11ED47A01B30D0FFAEDD7CD30ABC95D8
11ED47A01B30D0FFAEDD7CD30ABC95D8
11ED47A01B30D0FFAEDD7CD30ABC95D8
11ED47A01B30D0FFAEDD7CD30ABC95D8
11ED47A01B30D0FFAEDD7CD30ABC95D8
11ED47A01B30D0FFAEDD7CD30ABC95D8
11ED47A01B30D0FFAEDD7CD30ABC95D8
11ED47A01B30D0FFAEDD7CD30ABC95D8
11ED47A01B30D0FFAEDD7CD30ABC95D8
11ED47A01B30D0FFAEDD7CD30ABC95D8
11ED47A01B30D0FFAEDD7CD30ABC95D8
11ED47A01B30D0FFAEDD7CD30ABC95D8
11ED47A01B30D0FFAEDD7CD30ABC95D8
11ED47A01B30D0FFAEDD7CD30ABC95D8
11ED47A01B30D0FFAEDD7CD30ABC95D8
11ED47A01B30D0FFAEDD7CD30ABC95D8
11ED47A01B30D0FFAEDD7CD30ABC95D8
11ED47A01B30D0FFAEDD7CD30ABC95D8
11ED47A01B30D0FFAEDD7CD30ABC95D8
11ED47A01B30D0FFAEDD7CD30ABC95D8
11ED47A01B30D0FFAEDD7CD30ABC95D8
11ED47A01B30D0FFAEDD7CD30ABC95D8
11ED47A01B30D0FFAEDD7CD30ABC95D8
11ED47A01B30D0FFAEDD7CD30ABC95D8
11ED47A01B30D0FFAEDD7CD30ABC95D8
11ED47A01B30D0FFAEDD7CD30ABC95D8
11ED47A01B30D0FFAEDD7CD30ABC95D8
11ED47A01B30D0FFAEDD7CD30ABC95D8
11ED47A01B30D0FFAEDD7CD30ABC95D8
11ED47A01B30D0FFAEDD7CD30ABC95D8
11ED47A01B30D0FFAEDD7CD30ABC95D8
11ED47A01B30D0FFAEDD7CD30ABC95D8
11ED47A01B30D0FFAEDD7CD30ABC95D8
11ED47A01B30D0FFAEDD7CD30ABC95D8
11ED47A01B30D0FFAEDD7CD30ABC95D8
11ED47A01B30D0FFAEDD7CD30ABC95D8
11ED47A01B30D0FFAEDD7CD30ABC95D8
11ED47A01B30D0FFAEDD7CD30ABC95D8
11ED47A01B30D0FFAEDD7CD30ABC95D8
11ED47A01B30D0FFAEDD7CD30ABC95D8
11ED47A01B30D0FFAEDD7CD30ABC95D8
11ED47A01B30D0FFAEDD7CD30ABC95D8
11ED47A01B30D0FFAEDD7CD30ABC95D8
11ED47A01B30D0FFAEDD7CD30ABC95D8
11ED47A01B30D0FFAEDD7CD30ABC95D8
11ED47A01B30D0FFAEDD7CD30ABC95D8
11ED47A01B30D0FFAEDD7CD30ABC95D8
11ED47A01B30D0FFAEDD7CD30ABC95D8
11ED47A01B30D0FFAEDD7CD30ABC95D8
11ED47A01B30D0FFAEDD7CD30ABC95D8
11ED47A01B30D0FFAEDD7CD30ABC95D8
11ED47A01B30D0FFAEDD7CD30ABC95D8
11ED47A01B30D0FFAEDD7CD30ABC95D8
11ED47A01B30D0FFAEDD7CD30ABC95D8
11ED47A01B30D0FFAEDD7CD30ABC95D8
11ED47A01B30D0FFAEDD7CD30ABC95D8
11ED47A01B30D0FFAEDD7CD30ABC95D8
11ED47A01B30D0FFAEDD7CD30ABC95D8
11ED47A01B30D0FFAEDD7CD30ABC95D8
11ED47A01B30D0FFAEDD7CD30ABC95D8
11ED47A01B30D0FFAEDD7CD30ABC95D8
11ED47A01B30D0FFAEDD7CD30ABC95D8
11ED47A01B30D0FFAEDD7CD30ABC95D8
11ED47A01B30D0FFAEDD7CD30ABC95D8
11ED47A01B30D0FFAEDD7CD30ABC95D8
11ED47A01B30D0FFAEDD7CD30ABC95D8
11ED47A01B30D0FFAEDD7CD30ABC95D8
11ED47A01B30D0FFAEDD7CD30ABC95D8
11ED47A01B30D0FFAEDD7CD30ABC95D8
11ED47A01B30D0FFAEDD7CD30ABC95D8
11ED47A01B30D0FFAEDD7CD30ABC95D8
11ED47A01B30D0FFAEDD7CD30ABC95D8
11ED47A01B30D0FFAEDD7CD30ABC95D8
11ED47A01B30D0FFAEDD7CD30ABC95D8
11ED47A01B30D0FFAEDD7CD30ABC95D8
11ED47A01B30D0FFAEDD7CD30ABC95D8
11ED47A01B30D0FFAEDD7CD30ABC95D8
11ED47A01B30D0FFAEDD7CD30ABC95D8
11ED47A01B30D0FFAEDD7CD30ABC95D8
11ED47A01B30D0FFAEDD7CD30ABC95D8
11ED47A01B30D0FFAEDD7CD30ABC95D8
11ED47A01B30D0FFAEDD7CD30ABC95D8
11ED47A01B30D0FFAEDD7CD30ABC95D8
11ED47A01B30D0FFAEDD7CD30ABC95D8
11ED47A01B30D0FFAEDD7CD30ABC95D8
11ED47A01B30D0FFAEDD7CD30ABC95D8
11ED47A01B30D0FFAEDD7CD30ABC95D8
11ED47A01B30D0FFAEDD7CD30ABC95D8
11ED47A01B30D0FFAEDD7CD30ABC95D8
11ED47A01B30D0FFAEDD7CD30ABC95D8
11ED47A01B30D0FFAEDD7CD30ABC95D8
11ED47A01B30D0FFAEDD7CD30ABC95D8
11ED47A01B30D0FFAEDD7CD30ABC95D8
11ED47A01B30D0FFAEDD7CD30ABC95D8
11ED47A01B30D0FFAEDD7CD30ABC95D8
11ED47A01B30D0FFAEDD7CD30ABC95D8
11ED47A01B30D0FFAEDD7CD30ABC95D8
11ED47A01B30D0FFAEDD7CD30ABC95D8
11ED47A01B30D0FFAEDD7CD30ABC95D8
11ED47A01B30D0FFAEDD7CD30ABC95D8
11ED47A01B30D0FFAEDD7CD30ABC95D8
11ED47A01B30D0FFAEDD7CD30ABC95D8
11ED47A01B30D0FFAEDD7CD30ABC95D8
11ED47A01B30D0FFAEDD7CD30ABC95D8
11ED47A01B30D0FFAEDD7CD30ABC95D8
11ED47A01B30D0FFAEDD7CD30ABC95D8
11ED47A01B30D0FFAEDD7CD30ABC95D8
11ED47A01B30D0FFAEDD7CD30ABC95D8
11ED47A01B30D0FFAEDD7CD30ABC95D8
11ED47A01B30D0FFAEDD7CD30ABC95D8
11ED47A01B30D0FFAEDD7CD30ABC95D8
11ED47A01B30D0FFAEDD7CD30ABC95D8
11ED47A01B30D0FFAEDD7CD30ABC95D8
11ED47A01B30D0FFAEDD7CD30ABC95D8
11ED47A01B30D0FFAEDD7CD30ABC95D8
11ED47A01B30D0FFAEDD7CD30ABC95D8
11ED47A01B30D0FFAEDD7CD30ABC95D8
11ED47A01B30D0FFAEDD7CD30ABC95D8
11ED47A01B30D0FFAEDD7CD30ABC95D8
11ED47A01B30D0FFAEDD7CD30ABC95D8
11ED47A01B30D0FFAEDD7CD30ABC95D8
11ED47A01B30D0FFAEDD7CD30ABC95D8
11ED47A01B30D0FFAEDD7CD30ABC95D8
11ED47A01B30D0FFAEDD7CD30ABC95D8
11ED47A01B30D0FFAEDD7CD30ABC95D8
11ED47A01B30D0FFAEDD7CD30ABC95D8
11ED47A01B30D0FFAEDD7CD30ABC95D8
11ED47A01B30D0FFAEDD7CD30ABC95D8
11ED47A01B30D0FFAEDD7CD30ABC95D8
11ED47A01B30D0FFAEDD7CD30ABC95D8
11ED47A01B30D0FFAEDD7CD30ABC95D8
11ED47A01B30D0FFAEDD7CD30ABC95D8
11ED47A01B30D0FFAEDD7CD30ABC95D8
11ED47A01B30D0FFAEDD7CD30ABC95D8
11ED47A01B30D0FFAEDD7CD30ABC95D8
11ED47A01B30D0FFAEDD7CD30ABC95D8
11ED47A01B30D0FFAEDD7CD30ABC95D8
11ED47A01B30D0FFAEDD7CD30ABC95D8
11ED47A01B30D0FFAEDD7CD30ABC95D8
11ED47A01B30D0FFAEDD7CD30ABC95D8
11ED47A01B30D0FFAEDD7CD30ABC95D8
11ED47A01B30D0FFAEDD7CD30ABC95D8
11ED47A01B30D0FFAEDD7CD30ABC95D8
11ED47A01B30D0FFAEDD7CD30ABC95D8
11ED47A01B30D0FFAEDD7CD30ABC95D8
11ED47A01B30D0FFAEDD7CD30ABC95D8
11ED47A01B30D0FFAEDD7CD30ABC95D8
11ED47A01B30D0FFAEDD7CD30ABC95D8
11ED47A01B30D0FFAEDD7CD30ABC95D8
11ED47A01B30D0FFAEDD7CD30ABC95D8
11ED47A01B30D0FFAEDD7CD30ABC95D8
11ED47A01B30D0FFAEDD7CD30ABC95D8
11ED47A01B30D0FFAEDD7CD30ABC95D8
11ED47A01B30D0FFAEDD7CD30ABC95D8
11ED47A01B30D0FFAEDD7CD30ABC95D8
11ED47A01B30D0FFAEDD7CD30ABC95D8
11ED47A01B30D0FFAEDD7CD30ABC95D8
11ED47A01B30D0FFAEDD7CD30ABC95D8
11ED47A01B30D0FFAEDD7CD30ABC95D8
11ED47A01B30D0FFAEDD7CD30ABC95D8
11ED47A01B30D0FFAEDD7CD30ABC95D8
11ED47A01B30D0FFAEDD7CD30ABC95D8
11ED47A01B30D0FFAEDD7CD30ABC95D8
11ED47A01B30D0FFAEDD7CD30ABC95D8
11ED47A01B30D0FFAEDD7CD30ABC95D8
11ED47A01B30D0FFAEDD7CD30ABC95D8
11ED47A01B30D0FFAEDD7CD30ABC95D8
11ED47A01B30D0FFAEDD7CD30ABC95D8
11ED47A01B30D0FFAEDD7CD30ABC95D8
11ED47A01B30D0FFAEDD7CD30ABC95D8
11ED47A01B30D0FFAEDD7CD30ABC95D8
11ED47A01B30D0FFAEDD7CD30ABC95D8
11ED47A01B30D0FFAEDD7CD30ABC95D8
11ED47A01B30D0FFAEDD7CD30ABC95D8
11ED47A01B30D0FFAEDD7CD30ABC95D8
11ED47A01B30D0FFAEDD7CD30ABC95D8
11ED47A01B30D0FFAEDD7CD30ABC95D8
11ED47A01B30D0FFAEDD7CD30ABC95D8
11ED47A01B30D0FFAEDD7CD30ABC95D8
11ED47A01B30D0FFAEDD7CD30ABC95D8
11ED47A01B30D0FFAEDD7CD30ABC95D8
11ED47A01B30D0FFAEDD7CD30ABC95D8
11ED47A01B30D0FFAEDD7CD30ABC95D8
11ED47A01B30D0FFAEDD7CD30ABC95D8
11ED47A01B30D0FFAEDD7CD30ABC95D8
11ED47A01B30D0FFAEDD7CD30ABC95D8
11ED47A01B30D0FFAEDD7CD30ABC95D8
11ED47A01B30D0FFAEDD7CD30ABC95D8
11ED47A01B30D0FFAEDD7CD30ABC95D8
11ED47A01B30D0FFAEDD7CD30ABC95D8
11ED47A01B30D0FFAEDD7CD30ABC95D8
11ED47A01B30D0FFAEDD7CD30ABC95D8
11ED47A01B30D0FFAEDD7CD30ABC95D8
11ED47A01B30D0FFAEDD7CD30ABC95D8
11ED47A01B30D0FFAEDD7CD30ABC95D8
11ED47A01B30D0FFAEDD7CD30ABC95D8
11ED47A01B30D0FFAEDD7CD30ABC95D8
11ED47A01B30D0FFAEDD7CD30ABC95D8
11ED47A01B30D0FFAEDD7CD30ABC95D8
11ED47A01B30D0FFAEDD7CD30ABC95D8
11ED47A01B30D0FFAEDD7CD30ABC95D8
11ED47A01B30D0FFAEDD7CD30ABC95D8
11ED47A01B30D0FFAEDD7CD30ABC95D8
11ED47A01B30D0FFAEDD7CD30ABC95D8
11ED47A01B30D0FFAEDD7CD30ABC95D8
11ED47A01B30D0FFAEDD7CD30ABC95D8
11ED47A01B30D0FFAEDD7CD30ABC95D8
11ED47A01B30D0FFAEDD7CD30ABC95D8
11ED47A01B30D0FFAEDD7CD30ABC95D8
11ED47A01B30D0FFAEDD7CD30ABC95D8
11ED47A01B30D0FFAEDD7CD30ABC95D8
11ED47A01B30D0FFAEDD7CD30ABC95D8
11ED47A01B30D0FFAEDD7CD30ABC95D8
11ED47A01B30D0FFAEDD7CD30ABC95D8
11ED47A01B30D0FFAEDD7CD30ABC95D8
11ED47A01B30D0FFAEDD7CD30ABC95D8
11ED47A01B30D0FFAEDD7CD30ABC95D8
11ED47A01B30D0FFAEDD7CD30ABC95D8
11ED47A01B30D0FFAEDD7CD30ABC95D8
11ED47A01B30D0FFAEDD7CD30ABC95D8
11ED47A01B30D0FFAEDD7CD30ABC95D8
11ED47A01B30D0FFAEDD7CD30ABC95D8
11ED47A01B30D0FFAEDD7CD30ABC95D8
11ED47A01B30D0FFAEDD7CD30ABC95D8
11ED47A01B30D0FFAEDD7CD30ABC95D8
11ED47A01B30D0FFAEDD7CD30ABC95D8
11ED47A01B30D0FFAEDD7CD30ABC95D8
11ED47A01B30D0FFAEDD7CD30ABC95D8
11ED47A01B30D0FFAEDD7CD30ABC95D8
11ED47A01B30D0FFAEDD7CD30ABC95D8
11ED47A01B30D0FFAEDD7CD30ABC95D8
11ED47A01B30D0FFAEDD7CD30ABC95D8
11ED47A01B30D0FFAEDD7CD30ABC95D8
11ED47A01B30D0FFAEDD7CD30ABC95D8
11ED47A01B30D0FFAEDD7CD30ABC95D8
11ED47A01B30D0FFAEDD7CD30ABC95D8
11ED47A01B30D0FFAEDD7CD30ABC95D8
11ED47A01B30D0FFAEDD7CD30ABC95D8
11ED47A01B30D0FFAEDD7CD30ABC95D8
11ED47A01B30D0FFAEDD7CD30ABC95D8
11ED47A01B30D0FFAEDD7CD30ABC95D8
11ED47A01B30D0FFAEDD7CD30ABC95D8
11ED47A01B30D0FFAEDD7CD30ABC95D8
11ED47A01B30D0FFAEDD7CD30ABC95D8
11ED47A01B30D0FFAEDD7CD30ABC95D8
11ED47A01B30D0FFAEDD7CD30ABC95D8
11ED47A01B30D0FFAEDD7CD30ABC95D8
11ED47A01B30D0FFAEDD7CD30ABC95D8
11ED47A01B30D0FFAEDD7CD30ABC95D8
11ED47A01B30D0FFAEDD7CD30ABC95D8
11ED47A01B30D0FFAEDD7CD30ABC95D8
11ED47A01B30D0FFAEDD7CD30ABC95D8
11ED47A01B30D0FFAEDD7CD30ABC95D8
11ED47A01B30D0FFAEDD7CD30ABC95D8
11ED47A01B30D0FFAEDD7CD30ABC95D8
11ED47A01B30D0FFAEDD7CD30ABC95D8
11ED47A01B30D0FFAEDD7CD30ABC95D8
11ED47A01B30D0FFAEDD7CD30ABC95D8
11ED47A01B30D0FFAEDD7CD30ABC95D8
11ED47A01B30D0FFAEDD7CD30ABC95D8
11ED47A01B30D0FFAEDD7CD30ABC95D8
11ED47A01B30D0FFAEDD7CD30ABC95D8
11ED47A01B30D0FFAEDD7CD30ABC95D8
11ED47A01B30D0FFAEDD7CD30ABC95D8
11ED47A01B30D0FFAEDD7CD30ABC95D8
11ED47A01B30D0FFAEDD7CD30ABC95D8
11ED47A01B30D0FFAEDD7CD30ABC95D8
11ED47A01B30D0FFAEDD7CD30ABC95D8
11ED47A01B30D0FFAEDD7CD30ABC95D8
11ED47A01B30D0FFAEDD7CD30ABC95D8
11ED47A01B30D0FFAEDD7CD30ABC95D8
11ED47A01B30D0FFAEDD7CD30ABC95D8
11ED47A01B30D0FFAEDD7CD30ABC95D8
11ED47A01B30D0FFAEDD7CD30ABC95D8
11ED47A01B30D0FFAEDD7CD30ABC95D8
11ED47A01B30D0FFAEDD7CD30ABC95D8
11ED47A01B30D0FFAEDD7CD30ABC95D8
11ED47A01B30D0FFAEDD7CD30ABC95D8
11ED47A01B30D0FFAEDD7CD30ABC95D8
11ED47A01B30D0FFAEDD7CD30ABC95D8
11ED47A01B30D0FFAEDD7CD30ABC95D8
11ED47A01B30D0FFAEDD7CD30ABC95D8
11ED47A01B30D0FFAEDD7CD30ABC95D8
11ED47A01B30D0FFAEDD7CD30ABC95D8
11ED47A01B30D0FFAEDD7CD30ABC95D8
11ED47A01B30D0FFAEDD7CD30ABC95D8
11ED47A01B30D0FFAEDD7CD30ABC95D8
11ED47A01B30D0FFAEDD7CD30ABC95D8
11ED47A01B30D0FFAEDD7CD30ABC95D8
11ED47A01B30D0FFAEDD7CD30ABC95D8
11ED47A01B30D0FFAEDD7CD30ABC95D8
11ED47A01B30D0FFAEDD7CD30ABC95D8
11ED47A01B30D0FFAEDD7CD30ABC95D8
11ED47A01B30D0FFAEDD7CD30ABC95D8
11ED47A01B30D0FFAEDD7CD30ABC95D8
11ED47A01B30D0FFAEDD7CD30ABC95D8
11ED47A01B30D0FFAEDD7CD30ABC95D8
11ED47A01B30D0FFAEDD7CD30ABC95D8
11ED47A01B30D0FFAEDD7CD30ABC95D8
11ED47A01B30D0FFAEDD7CD30ABC95D8
11ED47A01B30D0FFAEDD7CD30ABC95D8
11ED47A01B30D0FFAEDD7CD30ABC95D8
11ED47A01B30D0FFAEDD7CD30ABC95D8
11ED47A01B30D0FFAEDD7CD30ABC95D8
11ED47A01B30D0FFAEDD7CD30ABC95D8
11ED47A01B30D0FFAEDD7CD30ABC95D8
11ED47A01B30D0FFAEDD7CD30ABC95D8
11ED47A01B30D0FFAEDD7CD30ABC95D8
11ED47A01B30D0FFAEDD7CD30ABC95D8
11ED47A01B30D0FFAEDD7CD30ABC95D8
11ED47A01B30D0FFAEDD7CD30ABC95D8
11ED47A01B30D0FFAEDD7CD30ABC95D8
11ED47A01B30D0FFAEDD7CD30ABC95D8
11ED47A01B30D0FFAEDD7CD30ABC95D8
11ED47A01B30D0FFAEDD7CD30ABC95D8
11ED47A01B30D0FFAEDD7CD30ABC95D8
11ED47A01B30D0FFAEDD7CD30ABC95D8
11ED47A01B30D0FFAEDD7CD30ABC95D8
11ED47A01B30D0FFAEDD7CD30ABC95D8
11ED47A01B30D0FFAEDD7CD30ABC95D8
11ED47A01B30D0FFAEDD7CD30ABC95D8
11ED47A01B30D0FFAEDD7CD30ABC95D8
11ED47A01B30D0FFAEDD7CD30ABC95D8
11ED47A01B30D0FFAEDD7CD30ABC95D8
11ED47A01B30D0FFAEDD7CD30ABC95D8
11ED47A01B30D0FFAEDD7CD30ABC95D8
11ED47A01B30D0FFAEDD7CD30ABC95D8
11ED47A01B30D0FFAEDD7CD30ABC95D8
11ED47A01B30D0FFAEDD7CD30ABC95D8
11ED47A01B30D0FFAEDD7CD30ABC95D8
11ED47A01B30D0FFAEDD7CD30ABC95D8
11ED47A01B30D0FFAEDD7CD30ABC95D8
11ED47A01B30D0FFAEDD7CD30ABC95D8
11ED47A01B30D0FFAEDD7CD30ABC95D8
11ED47A01B30D0FFAEDD7CD30ABC95D8
11ED47A01B30D0FFAEDD7CD30ABC95D8
11ED47A01B30D0FFAEDD7CD30ABC95D8
11ED47A01B30D0FFAEDD7CD30ABC95D8
11ED47A01B30D0FFAEDD7CD30ABC95D8
11ED47A01B30D0FFAEDD7CD30ABC95D8
11ED47A01B30D0FFAEDD7CD30ABC95D8
11ED47A01B30D0FFAEDD7CD30ABC95D8
11ED47A01B30D0FFAEDD7CD30ABC95D8
11ED47A01B30D0FFAEDD7CD30ABC95D8
11ED47A01B30D0FFAEDD7CD30ABC95D8
11ED47A01B30D0FFAEDD7CD30ABC95D8
11ED47A01B30D0FFAEDD7CD30ABC95D8
11ED47A01B30D0FFAEDD7CD30ABC95D8
11ED47A01B30D0FFAEDD7CD30ABC95D8
11ED47A01B30D0FFAEDD7CD30ABC95D8
11ED47A01B30D0FFAEDD7CD30ABC95D8
11ED47A01B30D0FFAEDD7CD30ABC95D8
11ED47A01B30D0FFAEDD7CD30ABC95D8
11ED47A01B30D0FFAEDD7CD30ABC95D8
11ED47A01B30D0FFAEDD7CD30ABC95D8
11ED47A01B30D0FFAEDD7CD30ABC95D8
11ED47A01B30D0FFAEDD7CD30ABC95D8
11ED47A01B30D0FFAEDD7CD30ABC95D8
11ED47A01B30D0FFAEDD7CD30ABC95D8
11ED47A01B30D0FFAEDD7CD30ABC95D8
11ED47A01B30D0FFAEDD7CD30ABC95D8
11ED47A01B30D0FFAEDD7CD30ABC95D8
11ED47A01B30D0FFAEDD7CD30ABC95D8
11ED47A01B30D0FFAEDD7CD30ABC95D8
11ED47A01B30D0FFAEDD7CD30ABC95D8
11ED47A01B30D0FFAEDD7CD30ABC95D8
11ED47A01B30D0FFAEDD7CD30ABC95D8
11ED47A01B30D0FFAEDD7CD30ABC95D8
11ED47A01B30D0FFAEDD7CD30ABC95D8
11ED47A01B30D0FFAEDD7CD30ABC95D8
11ED47A01B30D0FFAEDD7CD30ABC95D8
11ED47A01B30D0FFAEDD7CD30ABC95D8
11ED47A01B30D0FFAEDD7CD30ABC95D8
11ED47A01B30D0FFAEDD7CD30ABC95D8
11ED47A01B30D0FFAEDD7CD30ABC95D8
11ED47A01B30D0FFAEDD7CD30ABC95D8
11ED47A01B30D0FFAEDD7CD30ABC95D8
11ED47A01B30D0FFAEDD7CD30ABC95D8
11ED47A01B30D0FFAEDD7CD30ABC95D8
11ED47A01B30D0FFAEDD7CD30ABC95D8
11ED47A01B30D0FFAEDD7CD30ABC95D8
11ED47A01B30D0FFAEDD7CD30ABC95D8
11ED47A01B30D0FFAEDD7CD30ABC95D8
11ED47A01B30D0FFAEDD7CD30ABC95D8
11ED47A01B30D0FFAEDD7CD30ABC95D8
11ED47A01B30D0FFAEDD7CD30ABC95D8
11ED47A01B30D0FFAEDD7CD30ABC95D8
11ED47A01B30D0FFAEDD7CD30ABC95D8
11ED47A01B30D0FFAEDD7CD30ABC95D8
11ED47A01B30D0FFAEDD7CD30ABC95D8
11ED47A01B30D0FFAEDD7CD30ABC95D8
11ED47A01B30D0FFAEDD7CD30ABC95D8
11ED47A01B30D0FFAEDD7CD30ABC95D8
11ED47A01B30D0FFAEDD7CD30ABC95D8
11ED47A01B30D0FFAEDD7CD30ABC95D8
11ED47A01B30D0FFAEDD7CD30ABC95D8
11ED47A01B30D0FFAEDD7CD30ABC95D8
11ED47A01B30D0FFAEDD7CD30ABC95D8
11ED47A01B30D0FFAEDD7CD30ABC95D8
11ED47A01B30D0FFAEDD7CD30ABC95D8
11ED47A01B30D0FFAEDD7CD30ABC95D8
11ED47A01B30D0FFAEDD7CD30ABC95D8
11ED47A01B30D0FFAEDD7CD30ABC95D8
11ED47A01B30D0FFAEDD7CD30ABC95D8
11ED47A01B30D0FFAEDD7CD30ABC95D8
11ED47A01B30D0FFAEDD7CD30ABC95D8
11ED47A01B30D0FFAEDD7CD30ABC95D8
11ED47A01B30D0FFAEDD7CD30ABC95D8
11ED47A01B30D0FFAEDD7CD30ABC95D8
11ED47A01B30D0FFAEDD7CD30ABC95D8
11ED47A01B30D0FFAEDD7CD30ABC95D8
11ED47A01B30D0FFAEDD7CD30ABC95D8
11ED47A01B30D0FFAEDD7CD30ABC95D8
11ED47A01B30D0FFAEDD7CD30ABC95D8
11ED47A01B30D0FFAEDD7CD30ABC95D8
11ED47A01B30D0FFAEDD7CD30ABC95D8
11ED47A01B30D0FFAEDD7CD30ABC95D8
11ED47A01B30D0FFAEDD7CD30ABC95D8
11ED47A01B30D0FFAEDD7CD30ABC95D8
11ED47A01B30D0FFAEDD7CD30ABC95D8
11ED47A01B30D0FFAEDD7CD30ABC95D8
11ED47A01B30D0FFAEDD7CD30ABC95D8
11ED47A01B30D0FFAEDD7CD30ABC95D8
11ED47A01B30D0FFAEDD7CD30ABC95D8
11ED47A01B30D0FFAEDD7CD30ABC95D8
11ED47A01B30D0FFAEDD7CD30ABC95D8
11ED47A01B30D0FFAEDD7CD30ABC95D8
11ED47A01B30D0FFAEDD7CD30ABC95D8
11ED47A01B30D0FFAEDD7CD30ABC95D8
11ED47A01B30D0FFAEDD7CD30ABC95D8
11ED47A01B30D0FFAEDD7CD30ABC95D8
11ED47A01B30D0FFAEDD7CD30ABC95D8
11ED47A01B30D0FFAEDD7CD30ABC95D8
11ED47A01B30D0FFAEDD7CD30ABC95D8
11ED47A01B30D0FFAEDD7CD30ABC95D8
11ED47A01B30D0FFAEDD7CD30ABC95D8
11ED47A01B30D0FFAEDD7CD30ABC95D8
11ED47A01B30D0FFAEDD7CD30ABC95D8
11ED47A01B30D0FFAEDD7CD30ABC95D8
11ED47A01B30D0FFAEDD7CD30ABC95D8
11ED47A01B30D0FFAEDD7CD30ABC95D8
11ED47A01B30D0FFAEDD7CD30ABC95D8
11ED47A01B30D0FFAEDD7CD30ABC95D8
11ED47A01B30D0FFAEDD7CD30ABC95D8
11ED47A01B30D0FFAEDD7CD30ABC95D8
11ED47A01B30D0FFAEDD7CD30ABC95D8
11ED47A01B30D0FFAEDD7CD30ABC95D8
11ED47A01B30D0FFAEDD7CD30ABC95D8
11ED47A01B30D0FFAEDD7CD30ABC95D8
11ED47A01B30D0FFAEDD7CD30ABC95D8
11ED47A01B30D0FFAEDD7CD30ABC95D8
11ED47A01B30D0FFAEDD7CD30ABC95D8
11ED47A01B30D0FFAEDD7CD30ABC95D8
11ED47A01B30D0FFAEDD7CD30ABC95D8
11ED47A01B30D0FFAEDD7CD30ABC95D8
11ED47A01B30D0FFAEDD7CD30ABC95D8
11ED47A01B30D0FFAEDD7CD30ABC95D8
11ED47A01B30D0FFAEDD7CD30ABC95D8
11ED47A01B30D0FFAEDD7CD30ABC95D8
11ED47A01B30D0FFAEDD7CD30ABC95D8
11ED47A01B30D0FFAEDD7CD30ABC95D8
11ED47A01B30D0FFAEDD7CD30ABC95D8
11ED47A01B30D0FFAEDD7CD30ABC95D8
11ED47A01B30D0FFAEDD7CD30ABC95D8
11ED47A01B30D0FFAEDD7CD30ABC95D8
11ED47A01B30D0FFAEDD7CD30ABC95D8
11ED47A01B30D0FFAEDD7CD30ABC95D8
11ED47A01B30D0FFAEDD7CD30ABC95D8
11ED47A01B30D0FFAEDD7CD30ABC95D8
11ED47A01B30D0FFAEDD7CD30ABC95D8
11ED47A01B30D0FFAEDD7CD30ABC95D8
11ED47A01B30D0FFAEDD7CD30ABC95D8
11ED47A01B30D0FFAEDD7CD30ABC95D8
11ED47A01B30D0FFAEDD7CD30ABC95D8
11ED47A01B30D0FFAEDD7CD30ABC95D8
11ED47A01B30D0FFAEDD7CD30ABC95D8
11ED47A01B30D0FFAEDD7CD30ABC95D8
11ED47A01B30D0FFAEDD7CD30ABC95D8
11ED47A01B30D0FFAEDD7CD30ABC95D8
11ED47A01B30D0FFAEDD7CD30ABC95D8
11ED47A01B30D0FFAEDD7CD30ABC95D8
11ED47A01B30D0FFAEDD7CD30ABC95D8
11ED47A01B30D0FFAEDD7CD30ABC95D8
11ED47A01B30D0FFAEDD7CD30ABC95D8
11ED47A01B30D0FFAEDD7CD30ABC95D8
11ED47A01B30D0FFAEDD7CD30ABC95D8
11ED47A01B30D0FFAEDD7CD30ABC95D8
11ED47A01B30D0FFAEDD7CD30ABC95D8
11ED47A01B30D0FFAEDD7CD30ABC95D8
11ED47A01B30D0FFAEDD7CD30ABC95D8
11ED47A01B30D0FFAEDD7CD30ABC95D8
11ED47A01B30D0FFAEDD7CD30ABC95D8
11ED47A01B30D0FFAEDD7CD30ABC95D8
11ED47A01B30D0FFAEDD7CD30ABC95D8
11ED47A01B30D0FFAEDD7CD30ABC95D8
11ED47A01B30D0FFAEDD7CD30ABC95D8
11ED47A01B30D0FFAEDD7CD30ABC95D8
11ED47A01B30D0FFAEDD7CD30ABC95D8
11ED47A01B30D0FFAEDD7CD30ABC95D8
11ED47A01B30D0FFAEDD7CD30ABC95D8
11ED47A01B30D0FFAEDD7CD30ABC95D8
11ED47A01B30D0FFAEDD7CD30ABC95D8
11ED47A01B30D0FFAEDD7CD30ABC95D8
11ED47A01B30D0FFAEDD7CD30ABC95D8
11ED47A01B30D0FFAEDD7CD30ABC95D8
11ED47A01B30D0FFAEDD7CD30ABC95D8
11ED47A01B30D0FFAEDD7CD30ABC95D8
11ED47A01B30D0FFAEDD7CD30ABC95D8
11ED47A01B30D0FFAEDD7CD30ABC95D8
11ED47A01B30D0FFAEDD7CD30ABC95D8
11ED47A01B30D0FFAEDD7CD30ABC95D8
11ED47A01B30D0FFAEDD7CD30ABC95D8
11ED47A01B30D0FFAEDD7CD30ABC95D8
11ED47A01B30D0FFAEDD7CD30ABC95D8
11ED47A01B30D0FFAEDD7CD30ABC95D8
11ED47A01B30D0FFAEDD7CD30ABC95D8
11ED47A01B30D0FFAEDD7CD30ABC95D8
11ED47A01B30D0FFAEDD7CD30ABC95D8
11ED47A01B30D0FFAEDD7CD30ABC95D8
11ED47A01B30D0FFAEDD7CD30ABC95D8
11ED47A01B30D0FFAEDD7CD30ABC95D8
11ED47A01B30D0FFAEDD7CD30ABC95D8
11ED47A01B30D0FFAEDD7CD30ABC95D8
11ED47A01B30D0FFAEDD7CD30ABC95D8
11ED47A01B30D0FFAEDD7CD30ABC95D8
11ED47A01B30D0FFAEDD7CD30ABC95D8
11ED47A01B30D0FFAEDD7CD30ABC95D8
11ED47A01B30D0FFAEDD7CD30ABC95D8
11ED47A01B30D0FFAEDD7CD30ABC95D8
11ED47A01B30D0FFAEDD7CD30ABC95D8
11ED47A01B30D0FFAEDD7CD30ABC95D8
11ED47A01B30D0FFAEDD7CD30ABC95D8
11ED47A01B30D0FFAEDD7CD30ABC95D8
11ED47A01B30D0FFAEDD7CD30ABC95D8
11ED47A01B30D0FFAEDD7CD30ABC95D8
11ED47A01B30D0FFAEDD7CD30ABC95D8
11ED47A01B30D0FFAEDD7CD30ABC95D8
11ED47A01B30D0FFAEDD7CD30ABC95D8
11ED47A01B30D0FFAEDD7CD30ABC95D8
11ED47A01B30D0FFAEDD7CD30ABC95D8
11ED47A01B30D0FFAEDD7CD30ABC95D8
11ED47A01B30D0FFAEDD7CD30ABC95D8
11ED47A01B30D0FFAEDD7CD30ABC95D8
11ED47A01B30D0FFAEDD7CD30ABC95D8
11ED47A01B30D0FFAEDD7CD30ABC95D8
11ED47A01B30D0FFAEDD7CD30ABC95D8
11ED47A01B30D0FFAEDD7CD30ABC95D8
11ED47A01B30D0FFAEDD7CD30ABC95D8
11ED47A01B30D0FFAEDD7CD30ABC95D8
11ED47A01B30D0FFAEDD7CD30ABC95D8
11ED47A01B30D0FFAEDD7CD30ABC95D8
11ED47A01B30D0FFAEDD7CD30ABC95D8
11ED47A01B30D0FFAEDD7CD30ABC95D8
11ED47A01B30D0FFAEDD7CD30ABC95D8
11ED47A01B30D0FFAEDD7CD30ABC95D8
11ED47A01B30D0FFAEDD7CD30ABC95D8
11ED47A01B30D0FFAEDD7CD30ABC95D8
11ED47A01B30D0FFAEDD7CD30ABC95D8
11ED47A01B30D0FFAEDD7CD30ABC95D8
11ED47A01B30D0FFAEDD7CD30ABC95D8
11ED47A01B30D0FFAEDD7CD30ABC95D8
11ED47A01B30D0FFAEDD7CD30ABC95D8
11ED47A01B30D0FFAEDD7CD30ABC95D8
11ED47A01B30D0FFAEDD7CD30ABC95D8
11ED47A01B30D0FFAEDD7CD30ABC95D8
11ED47A01B30D0FFAEDD7CD30ABC95D8
11ED47A01B30D0FFAEDD7CD30ABC95D8
11ED47A01B30D0FFAEDD7CD30ABC95D8
11ED47A01B30D0FFAEDD7CD30ABC95D8
11ED47A01B30D0FFAEDD7CD30ABC95D8
11ED47A01B30D0FFAEDD7CD30ABC95D8
11ED47A01B30D0FFAEDD7CD30ABC95D8
11ED47A01B30D0FFAEDD7CD30ABC95D8
11ED47A01B30D0FFAEDD7CD30ABC95D8
11ED47A01B30D0FFAEDD7CD30ABC95D8
11ED47A01B30D0FFAEDD7CD30ABC95D8
11ED47A01B30D0FFAEDD7CD30ABC95D8
11ED47A01B30D0FFAEDD7CD30ABC95D8
11ED47A01B30D0FFAEDD7CD30ABC95D8
11ED47A01B30D0FFAEDD7CD30ABC95D8
11ED47A01B30D0FFAEDD7CD30ABC95D8
11ED47A01B30D0FFAEDD7CD30ABC95D8
11ED47A01B30D0FFAEDD7CD30ABC95D8
11ED47A01B30D0FFAEDD7CD30ABC95D8
11ED47A01B30D0FFAEDD7CD30ABC95D8
11ED47A01B30D0FFAEDD7CD30ABC95D8
11ED47A01B30D0FFAEDD7CD30ABC95D8
11ED47A01B30D0FFAEDD7CD30ABC95D8
11ED47A01B30D0FFAEDD7CD30ABC95D8
11ED47A01B30D0FFAEDD7CD30ABC95D8
11ED47A01B30D0FFAEDD7CD30ABC95D8
11ED47A01B30D0FFAEDD7CD30ABC95D8
11ED47A01B30D0FFAEDD7CD30ABC95D8
11ED47A01B30D0FFAEDD7CD30ABC95D8
11ED47A01B30D0FFAEDD7CD30ABC95D8
11ED47A01B30D0FFAEDD7CD30ABC95D8
11ED47A01B30D0FFAEDD7CD30ABC95D8
11ED47A01B30D0FFAEDD7CD30ABC95D8
11ED47A01B30D0FFAEDD7CD30ABC95D8
11ED47A01B30D0FFAEDD7CD30ABC95D8
11ED47A01B30D0FFAEDD7CD30ABC95D8
11ED47A01B30D0FFAEDD7CD30ABC95D8
11ED47A01B30D0FFAEDD7CD30ABC95D8
11ED47A01B30D0FFAEDD7CD30ABC95D8
11ED47A01B30D0FFAEDD7CD30ABC95D8
11ED47A01B30D0FFAEDD7CD30ABC95D8
11ED47A01B30D0FFAEDD7CD30ABC95D8
11ED47A01B30D0FFAEDD7CD30ABC95D8
11ED47A01B30D0FFAEDD7CD30ABC95D8
11ED47A01B30D0FFAEDD7CD30ABC95D8
11ED47A01B30D0FFAEDD7CD30ABC95D8
11ED47A01B30D0FFAEDD7CD30ABC95D8
11ED47A01B30D0FFAEDD7CD30ABC95D8
11ED47A01B30D0FFAEDD7CD30ABC95D8
11ED47A01B30D0FFAEDD7CD30ABC95D8
11ED47A01B30D0FFAEDD7CD30ABC95D8
11ED47A01B30D0FFAEDD7CD30ABC95D8
11ED47A01B30D0FFAEDD7CD30ABC95D8
11ED47A01B30D0FFAEDD7CD30ABC95D8
11ED47A01B30D0FFAEDD7CD30ABC95D8
11ED47A01B30D0FFAEDD7CD30ABC95D8
11ED47A01B30D0FFAEDD7CD30ABC95D8
11ED47A01B30D0FFAEDD7CD30ABC95D8
11ED47A01B30D0FFAEDD7CD30ABC95D8
11ED47A01B30D0FFAEDD7CD30ABC95D8
11ED47A01B30D0FFAEDD7CD30ABC95D8
11ED47A01B30D0FFAEDD7CD30ABC95D8
11ED47A01B30D0FFAEDD7CD30ABC95D8
11ED47A01B30D0FFAEDD7CD30ABC95D8
11ED47A01B30D0FFAEDD7CD30ABC95D8
11ED47A01B30D0FFAEDD7CD30ABC95D8
11ED47A01B30D0FFAEDD7CD30ABC95D8
11ED47A01B30D0FFAEDD7CD30ABC95D8
11ED47A01B30D0FFAEDD7CD30ABC95D8
11ED47A01B30D0FFAEDD7CD30ABC95D8
11ED47A01B30D0FFAEDD7CD30ABC95D8
11ED47A01B30D0FFAEDD7CD30ABC95D8
11ED47A01B30D0FFAEDD7CD30ABC95D8
11ED47A01B30D0FFAEDD7CD30ABC95D8
11ED47A01B30D0FFAEDD7CD30ABC95D8
11ED47A01B30D0FFAEDD7CD30ABC95D8
11ED47A01B30D0FFAEDD7CD30ABC95D8
11ED47A01B30D0FFAEDD7CD30ABC95D8
11ED47A01B30D0FFAEDD7CD30ABC95D8
11ED47A01B30D0FFAEDD7CD30ABC95D8
11ED47A01B30D0FFAEDD7CD30ABC95D8
11ED47A01B30D0FFAEDD7CD30ABC95D8
11ED47A01B30D0FFAEDD7CD30ABC95D8
11ED47A01B30D0FFAEDD7CD30ABC95D8
11ED47A01B30D0FFAEDD7CD30ABC95D8
11ED47A01B30D0FFAEDD7CD30ABC95D8
11ED47A01B30D0FFAEDD7CD30ABC95D8
11ED47A01B30D0FFAEDD7CD30ABC95D8
11ED47A01B30D0FFAEDD7CD30ABC95D8
11ED47A01B30D0FFAEDD7CD30ABC95D8
11ED47A01B30D0FFAEDD7CD30ABC95D8
11ED47A01B30D0FFAEDD7CD30ABC95D8
11ED47A01B30D0FFAEDD7CD30ABC95D8
11ED47A01B30D0FFAEDD7CD30ABC95D8
11ED47A01B30D0FFAEDD7CD30ABC95D8
11ED47A01B30D0FFAEDD7CD30ABC95D8
11ED47A01B30D0FFAEDD7CD30ABC95D8
11ED47A01B30D0FFAEDD7CD30ABC95D8
11ED47A01B30D0FFAEDD7CD30ABC95D8
11ED47A01B30D0FFAEDD7CD30ABC95D8
11ED47A01B30D0FFAEDD7CD30ABC95D8
11ED47A01B30D0FFAEDD7CD30ABC95D8
11ED47A01B30D0FFAEDD7CD30ABC95D8
11ED47A01B30D0FFAEDD7CD30ABC95D8
11ED47A01B30D0FFAEDD7CD30ABC95D8
11ED47A01B30D0FFAEDD7CD30ABC95D8
11ED47A01B30D0FFAEDD7CD30ABC95D8
11ED47A01B30D0FFAEDD7CD30ABC95D8
11ED47A01B30D0FFAEDD7CD30ABC95D8
11ED47A01B30D0FFAEDD7CD30ABC95D8
11ED47A01B30D0FFAEDD7CD30ABC95D8
11ED47A01B30D0FFAEDD7CD30ABC95D8
11ED47A01B30D0FFAEDD7CD30ABC95D8
11ED47A01B30D0FFAEDD7CD30ABC95D8
11ED47A01B30D0FFAEDD7CD30ABC95D8
11ED47A01B30D0FFAEDD7CD30ABC95D8
11ED47A01B30D0FFAEDD7CD30ABC95D8
11ED47A01B30D0FFAEDD7CD30ABC95D8
11ED47A01B30D0FFAEDD7CD30ABC95D8
11ED47A01B30D0FFAEDD7CD30ABC95D8
11ED47A01B30D0FFAEDD7CD30ABC95D8
11ED47A01B30D0FFAEDD7CD30ABC95D8
11ED47A01B30D0FFAEDD7CD30ABC95D8
11ED47A01B30D0FFAEDD7CD30ABC95D8
11ED47A01B30D0FFAEDD7CD30ABC95D8
11ED47A01B30D0FFAEDD7CD30ABC95D8
11ED47A01B30D0FFAEDD7CD30ABC95D8
11ED47A01B30D0FFAEDD7CD30ABC95D8
11ED47A01B30D0FFAEDD7CD30ABC95D8
11ED47A01B30D0FFAEDD7CD30ABC95D8
11ED47A01B30D0FFAEDD7CD30ABC95D8
11ED47A01B30D0FFAEDD7CD30ABC95D8
11ED47A01B30D0FFAEDD7CD30ABC95D8
11ED47A01B30D0FFAEDD7CD30ABC95D8
11ED47A01B30D0FFAEDD7CD30ABC95D8
11ED47A01B30D0FFAEDD7CD30ABC95D8
11ED47A01B30D0FFAEDD7CD30ABC95D8
11ED47A01B30D0FFAEDD7CD30ABC95D8
11ED47A01B30D0FFAEDD7CD30ABC95D8
11ED47A01B30D0FFAEDD7CD30ABC95D8
11ED47A01B30D0FFAEDD7CD30ABC95D8
11ED47A01B30D0FFAEDD7CD30ABC95D8
11ED47A01B30D0FFAEDD7CD30ABC95D8
11ED47A01B30D0FFAEDD7CD30ABC95D8
11ED47A01B30D0FFAEDD7CD30ABC95D8
11ED47A01B30D0FFAEDD7CD30ABC95D8
11ED47A01B30D0FFAEDD7CD30ABC95D8
11ED47A01B30D0FFAEDD7CD30ABC95D8
11ED47A01B30D0FFAEDD7CD30ABC95D8
11ED47A01B30D0FFAEDD7CD30ABC95D8
11ED47A01B30D0FFAEDD7CD30ABC95D8
11ED47A01B30D0FFAEDD7CD30ABC95D8
11ED47A01B30D0FFAEDD7CD30ABC95D8
11ED47A01B30D0FFAEDD7CD30ABC95D8
11ED47A01B30D0FFAEDD7CD30ABC95D8
11ED47A01B30D0FFAEDD7CD30ABC95D8
11ED47A01B30D0FFAEDD7CD30ABC95D8
11ED47A01B30D0FFAEDD7CD30ABC95D8
11ED47A01B30D0FFAEDD7CD30ABC95D8
11ED47A01B30D0FFAEDD7CD30ABC95D8
11ED47A01B30D0FFAEDD7CD30ABC95D8
11ED47A01B30D0FFAEDD7CD30ABC95D8
11ED47A01B30D0FFAEDD7CD30ABC95D8
11ED47A01B30D0FFAEDD7CD30ABC95D8
11ED47A01B30D0FFAEDD7CD30ABC95D8
11ED47A01B30D0FFAEDD7CD30ABC95D8
11ED47A01B30D0FFAEDD7CD30ABC95D8
11ED47A01B30D0FFAEDD7CD30ABC95D8
11ED47A01B30D0FFAEDD7CD30ABC95D8
11ED47A01B30D0FFAEDD7CD30ABC95D8
11ED47A01B30D0FFAEDD7CD30ABC95D8
11ED47A01B30D0FFAEDD7CD30ABC95D8
11ED47A01B30D0FFAEDD7CD30ABC95D8
11ED47A01B30D0FFAEDD7CD30ABC95D8
11ED47A01B30D0FFAEDD7CD30ABC95D8
11ED47A01B30D0FFAEDD7CD30ABC95D8
11ED47A01B30D0FFAEDD7CD30ABC95D8
11ED47A01B30D0FFAEDD7CD30ABC95D8
11ED47A01B30D0FFAEDD7CD30ABC95D8
11ED47A01B30D0FFAEDD7CD30ABC95D8
11ED47A01B30D0FFAEDD7CD30ABC95D8
11ED47A01B30D0FFAEDD7CD30ABC95D8
11ED47A01B30D0FFAEDD7CD30ABC95D8
11ED47A01B30D0FFAEDD7CD30ABC95D8
11ED47A01B30D0FFAEDD7CD30ABC95D8
11ED47A01B30D0FFAEDD7CD30ABC95D8
11ED47A01B30D0FFAEDD7CD30ABC95D8
11ED47A01B30D0FFAEDD7CD30ABC95D8
11ED47A01B30D0FFAEDD7CD30ABC95D8
11ED47A01B30D0FFAEDD7CD30ABC95D8
11ED47A01B30D0FFAEDD7CD30ABC95D8
11ED47A01B30D0FFAEDD7CD30ABC95D8
11ED47A01B30D0FFAEDD7CD30ABC95D8
11ED47A01B30D0FFAEDD7CD30ABC95D8
11ED47A01B30D0FFAEDD7CD30ABC95D8
11ED47A01B30D0FFAEDD7CD30ABC95D8
11ED47A01B30D0FFAEDD7CD30ABC95D8
11ED47A01B30D0FFAEDD7CD30ABC95D8
11ED47A01B30D0FFAEDD7CD30ABC95D8
11ED47A01B30D0FFAEDD7CD30ABC95D8
11ED47A01B30D0FFAEDD7CD30ABC95D8
11ED47A01B30D0FFAEDD7CD30ABC95D8
11ED47A01B30D0FFAEDD7CD30ABC95D8
11ED47A01B30D0FFAEDD7CD30ABC95D8
11ED47A01B30D0FFAEDD7CD30ABC95D8
11ED47A01B30D0FFAEDD7CD30ABC95D8
11ED47A01B30D0FFAEDD7CD30ABC95D8
11ED47A01B30D0FFAEDD7CD30ABC95D8
11ED47A01B30D0FFAEDD7CD30ABC95D8
11ED47A01B30D0FFAEDD7CD30ABC95D8
11ED47A01B30D0FFAEDD7CD30ABC95D8
11ED47A01B30D0FFAEDD7CD30ABC95D8
11ED47A01B30D0FFAEDD7CD30ABC95D8
11ED47A01B30D0FFAEDD7CD30ABC95D8
11ED47A01B30D0FFAEDD7CD30ABC95D8
11ED47A01B30D0FFAEDD7CD30ABC95D8
11ED47A01B30D0FFAEDD7CD30ABC95D8
11ED47A01B30D0FFAEDD7CD30ABC95D8
11ED47A01B30D0FFAEDD7CD30ABC95D8
11ED47A01B30D0FFAEDD7CD30ABC95D8
11ED47A01B30D0FFAEDD7CD30ABC95D8
11ED47A01B30D0FFAEDD7CD30ABC95D8
11ED47A01B30D0FFAEDD7CD30ABC95D8
11ED47A01B30D0FFAEDD7CD30ABC95D8
11ED47A01B30D0FFAEDD7CD30ABC95D8
11ED47A01B30D0FFAEDD7CD30ABC95D8
11ED47A01B30D0FFAEDD7CD30ABC95D8
11ED47A01B30D0FFAEDD7CD30ABC95D8
11ED47A01B30D0FFAEDD7CD30ABC95D8
11ED47A01B30D0FFAEDD7CD30ABC95D8
11ED47A01B30D0FFAEDD7CD30ABC95D8
11ED47A01B30D0FFAEDD7CD30ABC95D8
11ED47A01B30D0FFAEDD7CD30ABC95D8
11ED47A01B30D0FFAEDD7CD30ABC95D8
11ED47A01B30D0FFAEDD7CD30ABC95D8
11ED47A01B30D0FFAEDD7CD30ABC95D8
11ED47A01B30D0FFAEDD7CD30ABC95D8
11ED47A01B30D0FFAEDD7CD30ABC95D8
11ED47A01B30D0FFAEDD7CD30ABC95D8
11ED47A01B30D0FFAEDD7CD30ABC95D8
11ED47A01B30D0FFAEDD7CD30ABC95D8
11ED47A01B30D0FFAEDD7CD30ABC95D8
11ED47A01B30D0FFAEDD7CD30ABC95D8
11ED47A01B30D0FFAEDD7CD30ABC95D8
11ED47A01B30D0FFAEDD7CD30ABC95D8
11ED47A01B30D0FFAEDD7CD30ABC95D8
11ED47A01B30D0FFAEDD7CD30ABC95D8
11ED47A01B30D0FFAEDD7CD30ABC95D8
11ED47A01B30D0FFAEDD7CD30ABC95D8
11ED47A01B30D0FFAEDD7CD30ABC95D8
11ED47A01B30D0FFAEDD7CD30ABC95D8
11ED47A01B30D0FFAEDD7CD30ABC95D8
11ED47A01B30D0FFAEDD7CD30ABC95D8
11ED47A01B30D0FFAEDD7CD30ABC95D8
11ED47A01B30D0FFAEDD7CD30ABC95D8
11ED47A01B30D0FFAEDD7CD30ABC95D8
11ED47A01B30D0FFAEDD7CD30ABC95D8
11ED47A01B30D0FFAEDD7CD30ABC95D8
11ED47A01B30D0FFAEDD7CD30ABC95D8
11ED47A01B30D0FFAEDD7CD30ABC95D8
11ED47A01B30D0FFAEDD7CD30ABC95D8
11ED47A01B30D0FFAEDD7CD30ABC95D8
11ED47A01B30D0FFAEDD7CD30ABC95D8
11ED47A01B30D0FFAEDD7CD30ABC95D8
11ED47A01B30D0FFAEDD7CD30ABC95D8
11ED47A01B30D0FFAEDD7CD30ABC95D8
11ED47A01B30D0FFAEDD7CD30ABC95D8
11ED47A01B30D0FFAEDD7CD30ABC95D8
11ED47A01B30D0FFAEDD7CD30ABC95D8
11ED47A01B30D0FFAEDD7CD30ABC95D8
11ED47A01B30D0FFAEDD7CD30ABC95D8
11ED47A01B30D0FFAEDD7CD30ABC95D8
11ED47A01B30D0FFAEDD7CD30ABC95D8
11ED47A01B30D0FFAEDD7CD30ABC95D8
11ED47A01B30D0FFAEDD7CD30ABC95D8
11ED47A01B30D0FFAEDD7CD30ABC95D8
11ED47A01B30D0FFAEDD7CD30ABC95D8
11ED47A01B30D0FFAEDD7CD30ABC95D8
11ED47A01B30D0FFAEDD7CD30ABC95D8
11ED47A01B30D0FFAEDD7CD30ABC95D8
11ED47A01B30D0FFAEDD7CD30ABC95D8
11ED47A01B30D0FFAEDD7CD30ABC95D8
11ED47A01B30D0FFAEDD7CD30ABC95D8
11ED47A01B30D0FFAEDD7CD30ABC95D8
11ED47A01B30D0FFAEDD7CD30ABC95D8
11ED47A01B30D0FFAEDD7CD30ABC95D8
11ED47A01B30D0FFAEDD7CD30ABC95D8
11ED47A01B30D0FFAEDD7CD30ABC95D8
11ED47A01B30D0FFAEDD7CD30ABC95D8
11ED47A01B30D0FFAEDD7CD30ABC95D8
11ED47A01B30D0FFAEDD7CD30ABC95D8
11ED47A01B30D0FFAEDD7CD30ABC95D8
11ED47A01B30D0FFAEDD7CD30ABC95D8
11ED47A01B30D0FFAEDD7CD30ABC95D8
11ED47A01B30D0FFAEDD7CD30ABC95D8
11ED47A01B30D0FFAEDD7CD30ABC95D8
11ED47A01B30D0FFAEDD7CD30ABC95D8
11ED47A01B30D0FFAEDD7CD30ABC95D8
11ED47A01B30D0FFAEDD7CD30ABC95D8
11ED47A01B30D0FFAEDD7CD30ABC95D8
11ED47A01B30D0FFAEDD7CD30ABC95D8
11ED47A01B30D0FFAEDD7CD30ABC95D8
11ED47A01B30D0FFAEDD7CD30ABC95D8
11ED47A01B30D0FFAEDD7CD30ABC95D8
11ED47A01B30D0FFAEDD7CD30ABC95D8
11ED47A01B30D0FFAEDD7CD30ABC95D8
11ED47A01B30D0FFAEDD7CD30ABC95D8
11ED47A01B30D0FFAEDD7CD30ABC95D8
11ED47A01B30D0FFAEDD7CD30ABC95D8
11ED47A01B30D0FFAEDD7CD30ABC95D8
11ED47A01B30D0FFAEDD7CD30ABC95D8
11ED47A01B30D0FFAEDD7CD30ABC95D8
11ED47A01B30D0FFAEDD7CD30ABC95D8
11ED47A01B30D0FFAEDD7CD30ABC95D8
11ED47A01B30D0FFAEDD7CD30ABC95D8
11ED47A01B30D0FFAEDD7CD30ABC95D8
11ED47A01B30D0FFAEDD7CD30ABC95D8
11ED47A01B30D0FFAEDD7CD30ABC95D8
11ED47A01B30D0FFAEDD7CD30ABC95D8
11ED47A01B30D0FFAEDD7CD30ABC95D8
11ED47A01B30D0FFAEDD7CD30ABC95D8
11ED47A01B30D0FFAEDD7CD30ABC95D8
11ED47A01B30D0FFAEDD7CD30ABC95D8
11ED47A01B30D0FFAEDD7CD30ABC95D8
11ED47A01B30D0FFAEDD7CD30ABC95D8
11ED47A01B30D0FFAEDD7CD30ABC95D8
11ED47A01B30D0FFAEDD7CD30ABC95D8
11ED47A01B30D0FFAEDD7CD30ABC95D8
11ED47A01B30D0FFAEDD7CD30ABC95D8
11ED47A01B30D0FFAEDD7CD30ABC95D8
11ED47A01B30D0FFAEDD7CD30ABC95D8
11ED47A01B30D0FFAEDD7CD30ABC95D8
11ED47A01B30D0FFAEDD7CD30ABC95D8
11ED47A01B30D0FFAEDD7CD30ABC95D8
11ED47A01B30D0FFAEDD7CD30ABC95D8
11ED47A01B30D0FFAEDD7CD30ABC95D8
11ED47A01B30D0FFAEDD7CD30ABC95D8
11ED47A01B30D0FFAEDD7CD30ABC95D8
11ED47A01B30D0FFAEDD7CD30ABC95D8
11ED47A01B30D0FFAEDD7CD30ABC95D8
11ED47A01B30D0FFAEDD7CD30ABC95D8
11ED47A01B30D0FFAEDD7CD30ABC95D8
11ED47A01B30D0FFAEDD7CD30ABC95D8
11ED47A01B30D0FFAEDD7CD30ABC95D8
11ED47A01B30D0FFAEDD7CD30ABC95D8
11ED47A01B30D0FFAEDD7CD30ABC95D8
11ED47A01B30D0FFAEDD7CD30ABC95D8
11ED47A01B30D0FFAEDD7CD30ABC95D8
11ED47A01B30D0FFAEDD7CD30ABC95D8
11ED47A01B30D0FFAEDD7CD30ABC95D8
11ED47A01B30D0FFAEDD7CD30ABC95D8
11ED47A01B30D0FFAEDD7CD30ABC95D8
11ED47A01B30D0FFAEDD7CD30ABC95D8
11ED47A01B30D0FFAEDD7CD30ABC95D8
11ED47A01B30D0FFAEDD7CD30ABC95D8
11ED47A01B30D0FFAEDD7CD30ABC95D8
11ED47A01B30D0FFAEDD7CD30ABC95D8
11ED47A01B30D0FFAEDD7CD30ABC95D8
11ED47A01B30D0FFAEDD7CD30ABC95D8
11ED47A01B30D0FFAEDD7CD30ABC95D8
11ED47A01B30D0FFAEDD7CD30ABC95D8
11ED47A01B30D0FFAEDD7CD30ABC95D8
11ED47A01B30D0FFAEDD7CD30ABC95D8
11ED47A01B30D0FFAEDD7CD30ABC95D8
11ED47A01B30D0FFAEDD7CD30ABC95D8
11ED47A01B30D0FFAEDD7CD30ABC95D8
11ED47A01B30D0FFAEDD7CD30ABC95D8
11ED47A01B30D0FFAEDD7CD30ABC95D8
11ED47A01B30D0FFAEDD7CD30ABC95D8
11ED47A01B30D0FFAEDD7CD30ABC95D8
11ED47A01B30D0FFAEDD7CD30ABC95D8
11ED47A01B30D0FFAEDD7CD30ABC95D8
11ED47A01B30D0FFAEDD7CD30ABC95D8
11ED47A01B30D0FFAEDD7CD30ABC95D8
11ED47A01B30D0FFAEDD7CD30ABC95D8
11ED47A01B30D0FFAEDD7CD30ABC95D8
11ED47A01B30D0FFAEDD7CD30ABC95D8
11ED47A01B30D0FFAEDD7CD30ABC95D8
11ED47A01B30D0FFAEDD7CD30ABC95D8
11ED47A01B30D0FFAEDD7CD30ABC95D8
11ED47A01B30D0FFAEDD7CD30ABC95D8
11ED47A01B30D0FFAEDD7CD30ABC95D8
11ED47A01B30D0FFAEDD7CD30ABC95D8
11ED47A01B30D0FFAEDD7CD30ABC95D8
11ED47A01B30D0FFAEDD7CD30ABC95D8
11ED47A01B30D0FFAEDD7CD30ABC95D8
11ED47A01B30D0FFAEDD7CD30ABC95D8
11ED47A01B30D0FFAEDD7CD30ABC95D8
11ED47A01B30D0FFAEDD7CD30ABC95D8
11ED47A01B30D0FFAEDD7CD30ABC95D8
11ED47A01B30D0FFAEDD7CD30ABC95D8
11ED47A01B30D0FFAEDD7CD30ABC95D8
11ED47A01B30D0FFAEDD7CD30ABC95D8
11ED47A01B30D0FFAEDD7CD30ABC95D8
11ED47A01B30D0FFAEDD7CD30ABC95D8
11ED47A01B30D0FFAEDD7CD30ABC95D8
11ED47A01B30D0FFAEDD7CD30ABC95D8
11ED47A01B30D0FFAEDD7CD30ABC95D8
11ED47A01B30D0FFAEDD7CD30ABC95D8
11ED47A01B30D0FFAEDD7CD30ABC95D8
11ED47A01B30D0FFAEDD7CD30ABC95D8
11ED47A01B30D0FFAEDD7CD30ABC95D8
11ED47A01B30D0FFAEDD7CD30ABC95D8
11ED47A01B30D0FFAEDD7CD30ABC95D8
11ED47A01B30D0FFAEDD7CD30ABC95D8
11ED47A01B30D0FFAEDD7CD30ABC95D8
11ED47A01B30D0FFAEDD7CD30ABC95D8
11ED47A01B30D0FFAEDD7CD30ABC95D8
11ED47A01B30D0FFAEDD7CD30ABC95D8
11ED47A01B30D0FFAEDD7CD30ABC95D8
11ED47A01B30D0FFAEDD7CD30ABC95D8
11ED47A01B30D0FFAEDD7CD30ABC95D8
11ED47A01B30D0FFAEDD7CD30ABC95D8
11ED47A01B30D0FFAEDD7CD30ABC95D8
11ED47A01B30D0FFAEDD7CD30ABC95D8
11ED47A01B30D0FFAEDD7CD30ABC95D8
11ED47A01B30D0FFAEDD7CD30ABC95D8
11ED47A01B30D0FFAEDD7CD30ABC95D8
11ED47A01B30D0FFAEDD7CD30ABC95D8
11ED47A01B30D0FFAEDD7CD30ABC95D8
11ED47A01B30D0FFAEDD7CD30ABC95D8
11ED47A01B30D0FFAEDD7CD30ABC95D8
11ED47A01B30D0FFAEDD7CD30ABC95D8
11ED47A01B30D0FFAEDD7CD30ABC95D8
11ED47A01B30D0FFAEDD7CD30ABC95D8
11ED47A01B30D0FFAEDD7CD30ABC95D8
11ED47A01B30D0FFAEDD7CD30ABC95D8
11ED47A01B30D0FFAEDD7CD30ABC95D8
11ED47A01B30D0FFAEDD7CD30ABC95D8
11ED47A01B30D0FFAEDD7CD30ABC95D8
11ED47A01B30D0FFAEDD7CD30ABC95D8
11ED47A01B30D0FFAEDD7CD30ABC95D8
11ED47A01B30D0FFAEDD7CD30ABC95D8
11ED47A01B30D0FFAEDD7CD30ABC95D8
11ED47A01B30D0FFAEDD7CD30ABC95D8
11ED47A01B30D0FFAEDD7CD30ABC95D8
11ED47A01B30D0FFAEDD7CD30ABC95D8
11ED47A01B30D0FFAEDD7CD30ABC95D8
11ED47A01B30D0FFAEDD7CD30ABC95D8
11ED47A01B30D0FFAEDD7CD30ABC95D8
11ED47A01B30D0FFAEDD7CD30ABC95D8
11ED47A01B30D0FFAEDD7CD30ABC95D8
11ED47A01B30D0FFAEDD7CD30ABC95D8
11ED47A01B30D0FFAEDD7CD30ABC95D8
11ED47A01B30D0FFAEDD7CD30ABC95D8
11ED47A01B30D0FFAEDD7CD30ABC95D8
11ED47A01B30D0FFAEDD7CD30ABC95D8
11ED47A01B30D0FFAEDD7CD30ABC95D8
11ED47A01B30D0FFAEDD7CD30ABC95D8
11ED47A01B30D0FFAEDD7CD30ABC95D8
11ED47A01B30D0FFAEDD7CD30ABC95D8
11ED47A01B30D0FFAEDD7CD30ABC95D8
11ED47A01B30D0FFAEDD7CD30ABC95D8
11ED47A01B30D0FFAEDD7CD30ABC95D8
11ED47A01B30D0FFAEDD7CD30ABC95D8
11ED47A01B30D0FFAEDD7CD30ABC95D8
11ED47A01B30D0FFAEDD7CD30ABC95D8
11ED47A01B30D0FFAEDD7CD30ABC95D8
11ED47A01B30D0FFAEDD7CD30ABC95D8
11ED47A01B30D0FFAEDD7CD30ABC95D8
11ED47A01B30D0FFAEDD7CD30ABC95D8
11ED47A01B30D0FFAEDD7CD30ABC95D8
11ED47A01B30D0FFAEDD7CD30ABC95D8
11ED47A01B30D0FFAEDD7CD30ABC95D8
11ED47A01B30D0FFAEDD7CD30ABC95D8
11ED47A01B30D0FFAEDD7CD30ABC95D8
11ED47A01B30D0FFAEDD7CD30ABC95D8
11ED47A01B30D0FFAEDD7CD30ABC95D8
11ED47A01B30D0FFAEDD7CD30ABC95D8
11ED47A01B30D0FFAEDD7CD30ABC95D8
11ED47A01B30D0FFAEDD7CD30ABC95D8
11ED47A01B30D0FFAEDD7CD30ABC95D8
11ED47A01B30D0FFAEDD7CD30ABC95D8
11ED47A01B30D0FFAEDD7CD30ABC95D8
11ED47A01B30D0FFAEDD7CD30ABC95D8
11ED47A01B30D0FFAEDD7CD30ABC95D8
11ED47A01B30D0FFAEDD7CD30ABC95D8
11ED47A01B30D0FFAEDD7CD30ABC95D8
11ED47A01B30D0FFAEDD7CD30ABC95D8
11ED47A01B30D0FFAEDD7CD30ABC95D8
11ED47A01B30D0FFAEDD7CD30ABC95D8
11ED47A01B30D0FFAEDD7CD30ABC95D8
11ED47A01B30D0FFAEDD7CD30ABC95D8
11ED47A01B30D0FFAEDD7CD30ABC95D8
11ED47A01B30D0FFAEDD7CD30ABC95D8
11ED47A01B30D0FFAEDD7CD30ABC95D8
11ED47A01B30D0FFAEDD7CD30ABC95D8
11ED47A01B30D0FFAEDD7CD30ABC95D8
11ED47A01B30D0FFAEDD7CD30ABC95D8
11ED47A01B30D0FFAEDD7CD30ABC95D8
11ED47A01B30D0FFAEDD7CD30ABC95D8
11ED47A01B30D0FFAEDD7CD30ABC95D8
11ED47A01B30D0FFAEDD7CD30ABC95D8
11ED47A01B30D0FFAEDD7CD30ABC95D8
11ED47A01B30D0FFAEDD7CD30ABC95D8
11ED47A01B30D0FFAEDD7CD30ABC95D8
11ED47A01B30D0FFAEDD7CD30ABC95D8
11ED47A01B30D0FFAEDD7CD30ABC95D8
11ED47A01B30D0FFAEDD7CD30ABC95D8
11ED47A01B30D0FFAEDD7CD30ABC95D8
11ED47A01B30D0FFAEDD7CD30ABC95D8
11ED47A01B30D0FFAEDD7CD30ABC95D8
11ED47A01B30D0FFAEDD7CD30ABC95D8
11ED47A01B30D0FFAEDD7CD30ABC95D8
11ED47A01B30D0FFAEDD7CD30ABC95D8
11ED47A01B30D0FFAEDD7CD30ABC95D8
11ED47A01B30D0FFAEDD7CD30ABC95D8
11ED47A01B30D0FFAEDD7CD30ABC95D8
11ED47A01B30D0FFAEDD7CD30ABC95D8
11ED47A01B30D0FFAEDD7CD30ABC95D8
11ED47A01B30D0FFAEDD7CD30ABC95D8
11ED47A01B30D0FFAEDD7CD30ABC95D8
11ED47A01B30D0FFAEDD7CD30ABC95D8
11ED47A01B30D0FFAEDD7CD30ABC95D8
11ED47A01B30D0FFAEDD7CD30ABC95D8
11ED47A01B30D0FFAEDD7CD30ABC95D8
11ED47A01B30D0FFAEDD7CD30ABC95D8
11ED47A01B30D0FFAEDD7CD30ABC95D8
11ED47A01B30D0FFAEDD7CD30ABC95D8
11ED47A01B30D0FFAEDD7CD30ABC95D8
11ED47A01B30D0FFAEDD7CD30ABC95D8
11ED47A01B30D0FFAEDD7CD30ABC95D8
11ED47A01B30D0FFAEDD7CD30ABC95D8
11ED47A01B30D0FFAEDD7CD30ABC95D8
11ED47A01B30D0FFAEDD7CD30ABC95D8
11ED47A01B30D0FFAEDD7CD30ABC95D8
11ED47A01B30D0FFAEDD7CD30ABC95D8
11ED47A01B30D0FFAEDD7CD30ABC95D8
11ED47A01B30D0FFAEDD7CD30ABC95D8
11ED47A01B30D0FFAEDD7CD30ABC95D8
11ED47A01B30D0FFAEDD7CD30ABC95D8
11ED47A01B30D0FFAEDD7CD30ABC95D8
11ED47A01B30D0FFAEDD7CD30ABC95D8
11ED47A01B30D0FFAEDD7CD30ABC95D8
11ED47A01B30D0FFAEDD7CD30ABC95D8
11ED47A01B30D0FFAEDD7CD30ABC95D8
11ED47A01B30D0FFAEDD7CD30ABC95D8
11ED47A01B30D0FFAEDD7CD30ABC95D8
11ED47A01B30D0FFAEDD7CD30ABC95D8
11ED47A01B30D0FFAEDD7CD30ABC95D8
11ED47A01B30D0FFAEDD7CD30ABC95D8
11ED47A01B30D0FFAEDD7CD30ABC95D8
11ED47A01B30D0FFAEDD7CD30ABC95D8
11ED47A01B30D0FFAEDD7CD30ABC95D8
11ED47A01B30D0FFAEDD7CD30ABC95D8
11ED47A01B30D0FFAEDD7CD30ABC95D8
11ED47A01B30D0FFAEDD7CD30ABC95D8
11ED47A01B30D0FFAEDD7CD30ABC95D8
11ED47A01B30D0FFAEDD7CD30ABC95D8
11ED47A01B30D0FFAEDD7CD30ABC95D8
11ED47A01B30D0FFAEDD7CD30ABC95D8
11ED47A01B30D0FFAEDD7CD30ABC95D8
11ED47A01B30D0FFAEDD7CD30ABC95D8
11ED47A01B30D0FFAEDD7CD30ABC95D8
11ED47A01B30D0FFAEDD7CD30ABC95D8
11ED47A01B30D0FFAEDD7CD30ABC95D8
11ED47A01B30D0FFAEDD7CD30ABC95D8
11ED47A01B30D0FFAEDD7CD30ABC95D8
11ED47A01B30D0FFAEDD7CD30ABC95D8
11ED47A01B30D0FFAEDD7CD30ABC95D8
11ED47A01B30D0FFAEDD7CD30ABC95D8
11ED47A01B30D0FFAEDD7CD30ABC95D8
11ED47A01B30D0FFAEDD7CD30ABC95D8
11ED47A01B30D0FFAEDD7CD30ABC95D8
11ED47A01B30D0FFAEDD7CD30ABC95D8
11ED47A01B30D0FFAEDD7CD30ABC95D8
11ED47A01B30D0FFAEDD7CD30ABC95D8
11ED47A01B30D0FFAEDD7CD30ABC95D8
11ED47A01B30D0FFAEDD7CD30ABC95D8
11ED47A01B30D0FFAEDD7CD30ABC95D8
11ED47A01B30D0FFAEDD7CD30ABC95D8
11ED47A01B30D0FFAEDD7CD30ABC95D8
11ED47A01B30D0FFAEDD7CD30ABC95D8
11ED47A01B30D0FFAEDD7CD30ABC95D8
11ED47A01B30D0FFAEDD7CD30ABC95D8
11ED47A01B30D0FFAEDD7CD30ABC95D8
11ED47A01B30D0FFAEDD7CD30ABC95D8
11ED47A01B30D0FFAEDD7CD30ABC95D8
11ED47A01B30D0FFAEDD7CD30ABC95D8
11ED47A01B30D0FFAEDD7CD30ABC95D8
11ED47A01B30D0FFAEDD7CD30ABC95D8
11ED47A01B30D0FFAEDD7CD30ABC95D8
11ED47A01B30D0FFAEDD7CD30ABC95D8
11ED47A01B30D0FFAEDD7CD30ABC95D8
11ED47A01B30D0FFAEDD7CD30ABC95D8
11ED47A01B30D0FFAEDD7CD30ABC95D8
11ED47A01B30D0FFAEDD7CD30ABC95D8
11ED47A01B30D0FFAEDD7CD30ABC95D8
11ED47A01B30D0FFAEDD7CD30ABC95D8
11ED47A01B30D0FFAEDD7CD30ABC95D8
11ED47A01B30D0FFAEDD7CD30ABC95D8
11ED47A01B30D0FFAEDD7CD30ABC95D8
11ED47A01B30D0FFAEDD7CD30ABC95D8
11ED47A01B30D0FFAEDD7CD30ABC95D8
11ED47A01B30D0FFAEDD7CD30ABC95D8
11ED47A01B30D0FFAEDD7CD30ABC95D8
11ED47A01B30D0FFAEDD7CD30ABC95D8
11ED47A01B30D0FFAEDD7CD30ABC95D8
11ED47A01B30D0FFAEDD7CD30ABC95D8
11ED47A01B30D0FFAEDD7CD30ABC95D8
11ED47A01B30D0FFAEDD7CD30ABC95D8
11ED47A01B30D0FFAEDD7CD30ABC95D8
11ED47A01B30D0FFAEDD7CD30ABC95D8
11ED47A01B30D0FFAEDD7CD30ABC95D8
11ED47A01B30D0FFAEDD7CD30ABC95D8
11ED47A01B30D0FFAEDD7CD30ABC95D8
11ED47A01B30D0FFAEDD7CD30ABC95D8
11ED47A01B30D0FFAEDD7CD30ABC95D8
11ED47A01B30D0FFAEDD7CD30ABC95D8
11ED47A01B30D0FFAEDD7CD30ABC95D8
11ED47A01B30D0FFAEDD7CD30ABC95D8
11ED47A01B30D0FFAEDD7CD30ABC95D8
11ED47A01B30D0FFAEDD7CD30ABC95D8
11ED47A01B30D0FFAEDD7CD30ABC95D8
11ED47A01B30D0FFAEDD7CD30ABC95D8
11ED47A01B30D0FFAEDD7CD30ABC95D8
11ED47A01B30D0FFAEDD7CD30ABC95D8
11ED47A01B30D0FFAEDD7CD30ABC95D8
11ED47A01B30D0FFAEDD7CD30ABC95D8
11ED47A01B30D0FFAEDD7CD30ABC95D8
11ED47A01B30D0FFAEDD7CD30ABC95D8
11ED47A01B30D0FFAEDD7CD30ABC95D8
11ED47A01B30D0FFAEDD7CD30ABC95D8
11ED47A01B30D0FFAEDD7CD30ABC95D8
11ED47A01B30D0FFAEDD7CD30ABC95D8
11ED47A01B30D0FFAEDD7CD30ABC95D8
11ED47A01B30D0FFAEDD7CD30ABC95D8
11ED47A01B30D0FFAEDD7CD30ABC95D8
11ED47A01B30D0FFAEDD7CD30ABC95D8
11ED47A01B30D0FFAEDD7CD30ABC95D8
11ED47A01B30D0FFAEDD7CD30ABC95D8
11ED47A01B30D0FFAEDD7CD30ABC95D8
11ED47A01B30D0FFAEDD7CD30ABC95D8
11ED47A01B30D0FFAEDD7CD30ABC95D8
11ED47A01B30D0FFAEDD7CD30ABC95D8
11ED47A01B30D0FFAEDD7CD30ABC95D8
11ED47A01B30D0FFAEDD7CD30ABC95D8
11ED47A01B30D0FFAEDD7CD30ABC95D8
11ED47A01B30D0FFAEDD7CD30ABC95D8
11ED47A01B30D0FFAEDD7CD30ABC95D8
11ED47A01B30D0FFAEDD7CD30ABC95D8
11ED47A01B30D0FFAEDD7CD30ABC95D8
11ED47A01B30D0FFAEDD7CD30ABC95D8
11ED47A01B30D0FFAEDD7CD30ABC95D8
11ED47A01B30D0FFAEDD7CD30ABC95D8
11ED47A01B30D0FFAEDD7CD30ABC95D8
11ED47A01B30D0FFAEDD7CD30ABC95D8
11ED47A01B30D0FFAEDD7CD30ABC95D8
11ED47A01B30D0FFAEDD7CD30ABC95D8
11ED47A01B30D0FFAEDD7CD30ABC95D8
11ED47A01B30D0FFAEDD7CD30ABC95D8
11ED47A01B30D0FFAEDD7CD30ABC95D8
11ED47A01B30D0FFAEDD7CD30ABC95D8
11ED47A01B30D0FFAEDD7CD30ABC95D8
11ED47A01B30D0FFAEDD7CD30ABC95D8
11ED47A01B30D0FFAEDD7CD30ABC95D8
11ED47A01B30D0FFAEDD7CD30ABC95D8
11ED47A01B30D0FFAEDD7CD30ABC95D8
11ED47A01B30D0FFAEDD7CD30ABC95D8
11ED47A01B30D0FFAEDD7CD30ABC95D8
11ED47A01B30D0FFAEDD7CD30ABC95D8
11ED47A01B30D0FFAEDD7CD30ABC95D8
11ED47A01B30D0FFAEDD7CD30ABC95D8
11ED47A01B30D0FFAEDD7CD30ABC95D8
11ED47A01B30D0FFAEDD7CD30ABC95D8
11ED47A01B30D0FFAEDD7CD30ABC95D8
11ED47A01B30D0FFAEDD7CD30ABC95D8
11ED47A01B30D0FFAEDD7CD30ABC95D8
11ED47A01B30D0FFAEDD7CD30ABC95D8
11ED47A01B30D0FFAEDD7CD30ABC95D8
11ED47A01B30D0FFAEDD7CD30ABC95D8
11ED47A01B30D0FFAEDD7CD30ABC95D8
11ED47A01B30D0FFAEDD7CD30ABC95D8
11ED47A01B30D0FFAEDD7CD30ABC95D8
11ED47A01B30D0FFAEDD7CD30ABC95D8
11ED47A01B30D0FFAEDD7CD30ABC95D8
11ED47A01B30D0FFAEDD7CD30ABC95D8
11ED47A01B30D0FFAEDD7CD30ABC95D8
11ED47A01B30D0FFAEDD7CD30ABC95D8
11ED47A01B30D0FFAEDD7CD30ABC95D8
11ED47A01B30D0FFAEDD7CD30ABC95D8
11ED47A01B30D0FFAEDD7CD30ABC95D8
11ED47A01B30D0FFAEDD7CD30ABC95D8
11ED47A01B30D0FFAEDD7CD30ABC95D8
11ED47A01B30D0FFAEDD7CD30ABC95D8
11ED47A01B30D0FFAEDD7CD30ABC95D8
11ED47A01B30D0FFAEDD7CD30ABC95D8
11ED47A01B30D0FFAEDD7CD30ABC95D8
11ED47A01B30D0FFAEDD7CD30ABC95D8
11ED47A01B30D0FFAEDD7CD30ABC95D8
11ED47A01B30D0FFAEDD7CD30ABC95D8
11ED47A01B30D0FFAEDD7CD30ABC95D8
11ED47A01B30D0FFAEDD7CD30ABC95D8
11ED47A01B30D0FFAEDD7CD30ABC95D8
11ED47A01B30D0FFAEDD7CD30ABC95D8
11ED47A01B30D0FFAEDD7CD30ABC95D8
11ED47A01B30D0FFAEDD7CD30ABC95D8
11ED47A01B30D0FFAEDD7CD30ABC95D8
11ED47A01B30D0FFAEDD7CD30ABC95D8
11ED47A01B30D0FFAEDD7CD30ABC95D8
11ED47A01B30D0FFAEDD7CD30ABC95D8
11ED47A01B30D0FFAEDD7CD30ABC95D8
11ED47A01B30D0FFAEDD7CD30ABC95D8
11ED47A01B30D0FFAEDD7CD30ABC95D8
11ED47A01B30D0FFAEDD7CD30ABC95D8
11ED47A01B30D0FFAEDD7CD30ABC95D8
11ED47A01B30D0FFAEDD7CD30ABC95D8
11ED47A01B30D0FFAEDD7CD30ABC95D8
11ED47A01B30D0FFAEDD7CD30ABC95D8
11ED47A01B30D0FFAEDD7CD30ABC95D8
11ED47A01B30D0FFAEDD7CD30ABC95D8
11ED47A01B30D0FFAEDD7CD30ABC95D8
11ED47A01B30D0FFAEDD7CD30ABC95D8
11ED47A01B30D0FFAEDD7CD30ABC95D8
11ED47A01B30D0FFAEDD7CD30ABC95D8
11ED47A01B30D0FFAEDD7CD30ABC95D8
11ED47A01B30D0FFAEDD7CD30ABC95D8
11ED47A01B30D0FFAEDD7CD30ABC95D8
11ED47A01B30D0FFAEDD7CD30ABC95D8
11ED47A01B30D0FFAEDD7CD30ABC95D8
11ED47A01B30D0FFAEDD7CD30ABC95D8
11ED47A01B30D0FFAEDD7CD30ABC95D8
11ED47A01B30D0FFAEDD7CD30ABC95D8
11ED47A01B30D0FFAEDD7CD30ABC95D8
11ED47A01B30D0FFAEDD7CD30ABC95D8
11ED47A01B30D0FFAEDD7CD30ABC95D8
11ED47A01B30D0FFAEDD7CD30ABC95D8
11ED47A01B30D0FFAEDD7CD30ABC95D8
11ED47A01B30D0FFAEDD7CD30ABC95D8
11ED47A01B30D0FFAEDD7CD30ABC95D8
11ED47A01B30D0FFAEDD7CD30ABC95D8
11ED47A01B30D0FFAEDD7CD30ABC95D8
11ED47A01B30D0FFAEDD7CD30ABC95D8
11ED47A01B30D0FFAEDD7CD30ABC95D8
11ED47A01B30D0FFAEDD7CD30ABC95D8
11ED47A01B30D0FFAEDD7CD30ABC95D8
11ED47A01B30D0FFAEDD7CD30ABC95D8
11ED47A01B30D0FFAEDD7CD30ABC95D8
11ED47A01B30D0FFAEDD7CD30ABC95D8
11ED47A01B30D0FFAEDD7CD30ABC95D8
11ED47A01B30D0FFAEDD7CD30ABC95D8
11ED47A01B30D0FFAEDD7CD30ABC95D8
11ED47A01B30D0FFAEDD7CD30ABC95D8
11ED47A01B30D0FFAEDD7CD30ABC95D8
11ED47A01B30D0FFAEDD7CD30ABC95D8
11ED47A01B30D0FFAEDD7CD30ABC95D8
11ED47A01B30D0FFAEDD7CD30ABC95D8
11ED47A01B30D0FFAEDD7CD30ABC95D8
11ED47A01B30D0FFAEDD7CD30ABC95D8
11ED47A01B30D0FFAEDD7CD30ABC95D8
11ED47A01B30D0FFAEDD7CD30ABC95D8
11ED47A01B30D0FFAEDD7CD30ABC95D8
11ED47A01B30D0FFAEDD7CD30ABC95D8
11ED47A01B30D0FFAEDD7CD30ABC95D8
11ED47A01B30D0FFAEDD7CD30ABC95D8
11ED47A01B30D0FFAEDD7CD30ABC95D8
11ED47A01B30D0FFAEDD7CD30ABC95D8
11ED47A01B30D0FFAEDD7CD30ABC95D8
11ED47A01B30D0FFAEDD7CD30ABC95D8
11ED47A01B30D0FFAEDD7CD30ABC95D8
11ED47A01B30D0FFAEDD7CD30ABC95D8
11ED47A01B30D0FFAEDD7CD30ABC95D8
11ED47A01B30D0FFAEDD7CD30ABC95D8
11ED47A01B30D0FFAEDD7CD30ABC95D8
11ED47A01B30D0FFAEDD7CD30ABC95D8
11ED47A01B30D0FFAEDD7CD30ABC95D8
11ED47A01B30D0FFAEDD7CD30ABC95D8
11ED47A01B30D0FFAEDD7CD30ABC95D8
11ED47A01B30D0FFAEDD7CD30ABC95D8
11ED47A01B30D0FFAEDD7CD30ABC95D8
11ED47A01B30D0FFAEDD7CD30ABC95D8
11ED47A01B30D0FFAEDD7CD30ABC95D8
11ED47A01B30D0FFAEDD7CD30ABC95D8
11ED47A01B30D0FFAEDD7CD30ABC95D8
11ED47A01B30D0FFAEDD7CD30ABC95D8
11ED47A01B30D0FFAEDD7CD30ABC95D8
11ED47A01B30D0FFAEDD7CD30ABC95D8
11ED47A01B30D0FFAEDD7CD30ABC95D8
11ED47A01B30D0FFAEDD7CD30ABC95D8
11ED47A01B30D0FFAEDD7CD30ABC95D8
11ED47A01B30D0FFAEDD7CD30ABC95D8
11ED47A01B30D0FFAEDD7CD30ABC95D8
11ED47A01B30D0FFAEDD7CD30ABC95D8
11ED47A01B30D0FFAEDD7CD30ABC95D8
11ED47A01B30D0FFAEDD7CD30ABC95D8
11ED47A01B30D0FFAEDD7CD30ABC95D8
11ED47A01B30D0FFAEDD7CD30ABC95D8
11ED47A01B30D0FFAEDD7CD30ABC95D8
11ED47A01B30D0FFAEDD7CD30ABC95D8
11ED47A01B30D0FFAEDD7CD30ABC95D8
11ED47A01B30D0FFAEDD7CD30ABC95D8
11ED47A01B30D0FFAEDD7CD30ABC95D8
11ED47A01B30D0FFAEDD7CD30ABC95D8
11ED47A01B30D0FFAEDD7CD30ABC95D8
11ED47A01B30D0FFAEDD7CD30ABC95D8
11ED47A01B30D0FFAEDD7CD30ABC95D8
11ED47A01B30D0FFAEDD7CD30ABC95D8
11ED47A01B30D0FFAEDD7CD30ABC95D8
11ED47A01B30D0FFAEDD7CD30ABC95D8
11ED47A01B30D0FFAEDD7CD30ABC95D8
11ED47A01B30D0FFAEDD7CD30ABC95D8
11ED47A01B30D0FFAEDD7CD30ABC95D8
11ED47A01B30D0FFAEDD7CD30ABC95D8
11ED47A01B30D0FFAEDD7CD30ABC95D8
11ED47A01B30D0FFAEDD7CD30ABC95D8
11ED47A01B30D0FFAEDD7CD30ABC95D8
11ED47A01B30D0FFAEDD7CD30ABC95D8
11ED47A01B30D0FFAEDD7CD30ABC95D8
11ED47A01B30D0FFAEDD7CD30ABC95D8
11ED47A01B30D0FFAEDD7CD30ABC95D8
11ED47A01B30D0FFAEDD7CD30ABC95D8
11ED47A01B30D0FFAEDD7CD30ABC95D8
11ED47A01B30D0FFAEDD7CD30ABC95D8
11ED47A01B30D0FFAEDD7CD30ABC95D8
11ED47A01B30D0FFAEDD7CD30ABC95D8
11ED47A01B30D0FFAEDD7CD30ABC95D8
11ED47A01B30D0FFAEDD7CD30ABC95D8
11ED47A01B30D0FFAEDD7CD30ABC95D8
11ED47A01B30D0FFAEDD7CD30ABC95D8
11ED47A01B30D0FFAEDD7CD30ABC95D8
11ED47A01B30D0FFAEDD7CD30ABC95D8
11ED47A01B30D0FFAEDD7CD30ABC95D8
11ED47A01B30D0FFAEDD7CD30ABC95D8
11ED47A01B30D0FFAEDD7CD30ABC95D8
11ED47A01B30D0FFAEDD7CD30ABC95D8
11ED47A01B30D0FFAEDD7CD30ABC95D8
11ED47A01B30D0FFAEDD7CD30ABC95D8
11ED47A01B30D0FFAEDD7CD30ABC95D8
11ED47A01B30D0FFAEDD7CD30ABC95D8
11ED47A01B30D0FFAEDD7CD30ABC95D8
11ED47A01B30D0FFAEDD7CD30ABC95D8
11ED47A01B30D0FFAEDD7CD30ABC95D8
11ED47A01B30D0FFAEDD7CD30ABC95D8
11ED47A01B30D0FFAEDD7CD30ABC95D8
11ED47A01B30D0FFAEDD7CD30ABC95D8
11ED47A01B30D0FFAEDD7CD30ABC95D8
11ED47A01B30D0FFAEDD7CD30ABC95D8
11ED47A01B30D0FFAEDD7CD30ABC95D8
11ED47A01B30D0FFAEDD7CD30ABC95D8
11ED47A01B30D0FFAEDD7CD30ABC95D8
11ED47A01B30D0FFAEDD7CD30ABC95D8
11ED47A01B30D0FFAEDD7CD30ABC95D8
11ED47A01B30D0FFAEDD7CD30ABC95D8
11ED47A01B30D0FFAEDD7CD30ABC95D8
11ED47A01B30D0FFAEDD7CD30ABC95D8
11ED47A01B30D0FFAEDD7CD30ABC95D8
11ED47A01B30D0FFAEDD7CD30ABC95D8
11ED47A01B30D0FFAEDD7CD30ABC95D8
11ED47A01B30D0FFAEDD7CD30ABC95D8
11ED47A01B30D0FFAEDD7CD30ABC95D8
11ED47A01B30D0FFAEDD7CD30ABC95D8
11ED47A01B30D0FFAEDD7CD30ABC95D8
11ED47A01B30D0FFAEDD7CD30ABC95D8
11ED47A01B30D0FFAEDD7CD30ABC95D8
11ED47A01B30D0FFAEDD7CD30ABC95D8
11ED47A01B30D0FFAEDD7CD30ABC95D8
11ED47A01B30D0FFAEDD7CD30ABC95D8
11ED47A01B30D0FFAEDD7CD30ABC95D8
11ED47A01B30D0FFAEDD7CD30ABC95D8
11ED47A01B30D0FFAEDD7CD30ABC95D8
11ED47A01B30D0FFAEDD7CD30ABC95D8
11ED47A01B30D0FFAEDD7CD30ABC95D8
11ED47A01B30D0FFAEDD7CD30ABC95D8
11ED47A01B30D0FFAEDD7CD30ABC95D8
11ED47A01B30D0FFAEDD7CD30ABC95D8
11ED47A01B30D0FFAEDD7CD30ABC95D8
11ED47A01B30D0FFAEDD7CD30ABC95D8
11ED47A01B30D0FFAEDD7CD30ABC95D8
11ED47A01B30D0FFAEDD7CD30ABC95D8
11ED47A01B30D0FFAEDD7CD30ABC95D8
11ED47A01B30D0FFAEDD7CD30ABC95D8
11ED47A01B30D0FFAEDD7CD30ABC95D8
11ED47A01B30D0FFAEDD7CD30ABC95D8
11ED47A01B30D0FFAEDD7CD30ABC95D8
11ED47A01B30D0FFAEDD7CD30ABC95D8
11ED47A01B30D0FFAEDD7CD30ABC95D8
11ED47A01B30D0FFAEDD7CD30ABC95D8
11ED47A01B30D0FFAEDD7CD30ABC95D8
11ED47A01B30D0FFAEDD7CD30ABC95D8
11ED47A01B30D0FFAEDD7CD30ABC95D8
11ED47A01B30D0FFAEDD7CD30ABC95D8
11ED47A01B30D0FFAEDD7CD30ABC95D8
11ED47A01B30D0FFAEDD7CD30ABC95D8
11ED47A01B30D0FFAEDD7CD30ABC95D8
11ED47A01B30D0FFAEDD7CD30ABC95D8
11ED47A01B30D0FFAEDD7CD30ABC95D8
11ED47A01B30D0FFAEDD7CD30ABC95D8
11ED47A01B30D0FFAEDD7CD30ABC95D8
11ED47A01B30D0FFAEDD7CD30ABC95D8
11ED47A01B30D0FFAEDD7CD30ABC95D8
11ED47A01B30D0FFAEDD7CD30ABC95D8
11ED47A01B30D0FFAEDD7CD30ABC95D8
11ED47A01B30D0FFAEDD7CD30ABC95D8
11ED47A01B30D0FFAEDD7CD30ABC95D8
11ED47A01B30D0FFAEDD7CD30ABC95D8
11ED47A01B30D0FFAEDD7CD30ABC95D8
11ED47A01B30D0FFAEDD7CD30ABC95D8
11ED47A01B30D0FFAEDD7CD30ABC95D8
11ED47A01B30D0FFAEDD7CD30ABC95D8
11ED47A01B30D0FFAEDD7CD30ABC95D8
11ED47A01B30D0FFAEDD7CD30ABC95D8
11ED47A01B30D0FFAEDD7CD30ABC95D8
11ED47A01B30D0FFAEDD7CD30ABC95D8
11ED47A01B30D0FFAEDD7CD30ABC95D8
11ED47A01B30D0FFAEDD7CD30ABC95D8
11ED47A01B30D0FFAEDD7CD30ABC95D8
11ED47A01B30D0FFAEDD7CD30ABC95D8
11ED47A01B30D0FFAEDD7CD30ABC95D8
11ED47A01B30D0FFAEDD7CD30ABC95D8
11ED47A01B30D0FFAEDD7CD30ABC95D8
11ED47A01B30D0FFAEDD7CD30ABC95D8
11ED47A01B30D0FFAEDD7CD30ABC95D8
11ED47A01B30D0FFAEDD7CD30ABC95D8
11ED47A01B30D0FFAEDD7CD30ABC95D8
11ED47A01B30D0FFAEDD7CD30ABC95D8
11ED47A01B30D0FFAEDD7CD30ABC95D8
11ED47A01B30D0FFAEDD7CD30ABC95D8
11ED47A01B30D0FFAEDD7CD30ABC95D8
11ED47A01B30D0FFAEDD7CD30ABC95D8
11ED47A01B30D0FFAEDD7CD30ABC95D8
11ED47A01B30D0FFAEDD7CD30ABC95D8
11ED47A01B30D0FFAEDD7CD30ABC95D8
11ED47A01B30D0FFAEDD7CD30ABC95D8
11ED47A01B30D0FFAEDD7CD30ABC95D8
11ED47A01B30D0FFAEDD7CD30ABC95D8
11ED47A01B30D0FFAEDD7CD30ABC95D8
11ED47A01B30D0FFAEDD7CD30ABC95D8
11ED47A01B30D0FFAEDD7CD30ABC95D8
11ED47A01B30D0FFAEDD7CD30ABC95D8
11ED47A01B30D0FFAEDD7CD30ABC95D8
11ED47A01B30D0FFAEDD7CD30ABC95D8
11ED47A01B30D0FFAEDD7CD30ABC95D8
11ED47A01B30D0FFAEDD7CD30ABC95D8
11ED47A01B30D0FFAEDD7CD30ABC95D8
11ED47A01B30D0FFAEDD7CD30ABC95D8
11ED47A01B30D0FFAEDD7CD30ABC95D8
11ED47A01B30D0FFAEDD7CD30ABC95D8
11ED47A01B30D0FFAEDD7CD30ABC95D8
11ED47A01B30D0FFAEDD7CD30ABC95D8
11ED47A01B30D0FFAEDD7CD30ABC95D8
11ED47A01B30D0FFAEDD7CD30ABC95D8
11ED47A01B30D0FFAEDD7CD30ABC95D8
11ED47A01B30D0FFAEDD7CD30ABC95D8
11ED47A01B30D0FFAEDD7CD30ABC95D8
11ED47A01B30D0FFAEDD7CD30ABC95D8
11ED47A01B30D0FFAEDD7CD30ABC95D8
11ED47A01B30D0FFAEDD7CD30ABC95D8
11ED47A01B30D0FFAEDD7CD30ABC95D8
11ED47A01B30D0FFAEDD7CD30ABC95D8
11ED47A01B30D0FFAEDD7CD30ABC95D8
11ED47A01B30D0FFAEDD7CD30ABC95D8
11ED47A01B30D0FFAEDD7CD30ABC95D8
11ED47A01B30D0FFAEDD7CD30ABC95D8
11ED47A01B30D0FFAEDD7CD30ABC95D8
11ED47A01B30D0FFAEDD7CD30ABC95D8
11ED47A01B30D0FFAEDD7CD30ABC95D8
11ED47A01B30D0FFAEDD7CD30ABC95D8
11ED47A01B30D0FFAEDD7CD30ABC95D8
11ED47A01B30D0FFAEDD7CD30ABC95D8
11ED47A01B30D0FFAEDD7CD30ABC95D8
11ED47A01B30D0FFAEDD7CD30ABC95D8
11ED47A01B30D0FFAEDD7CD30ABC95D8
11ED47A01B30D0FFAEDD7CD30ABC95D8
11ED47A01B30D0FFAEDD7CD30ABC95D8
11ED47A01B30D0FFAEDD7CD30ABC95D8
11ED47A01B30D0FFAEDD7CD30ABC95D8
11ED47A01B30D0FFAEDD7CD30ABC95D8
11ED47A01B30D0FFAEDD7CD30ABC95D8
11ED47A01B30D0FFAEDD7CD30ABC95D8
11ED47A01B30D0FFAEDD7CD30ABC95D8
11ED47A01B30D0FFAEDD7CD30ABC95D8
11ED47A01B30D0FFAEDD7CD30ABC95D8
11ED47A01B30D0FFAEDD7CD30ABC95D8
11ED47A01B30D0FFAEDD7CD30ABC95D8
11ED47A01B30D0FFAEDD7CD30ABC95D8
11ED47A01B30D0FFAEDD7CD30ABC95D8
11ED47A01B30D0FFAEDD7CD30ABC95D8
11ED47A01B30D0FFAEDD7CD30ABC95D8
11ED47A01B30D0FFAEDD7CD30ABC95D8
11ED47A01B30D0FFAEDD7CD30ABC95D8
11ED47A01B30D0FFAEDD7CD30ABC95D8
11ED47A01B30D0FFAEDD7CD30ABC95D8
11ED47A01B30D0FFAEDD7CD30ABC95D8
11ED47A01B30D0FFAEDD7CD30ABC95D8
11ED47A01B30D0FFAEDD7CD30ABC95D8
11ED47A01B30D0FFAEDD7CD30ABC95D8
11ED47A01B30D0FFAEDD7CD30ABC95D8
11ED47A01B30D0FFAEDD7CD30ABC95D8
11ED47A01B30D0FFAEDD7CD30ABC95D8
11ED47A01B30D0FFAEDD7CD30ABC95D8
11ED47A01B30D0FFAEDD7CD30ABC95D8
11ED47A01B30D0FFAEDD7CD30ABC95D8
11ED47A01B30D0FFAEDD7CD30ABC95D8
11ED47A01B30D0FFAEDD7CD30ABC95D8
11ED47A01B30D0FFAEDD7CD30ABC95D8
11ED47A01B30D0FFAEDD7CD30ABC95D8
11ED47A01B30D0FFAEDD7CD30ABC95D8
11ED47A01B30D0FFAEDD7CD30ABC95D8
11ED47A01B30D0FFAEDD7CD30ABC95D8
11ED47A01B30D0FFAEDD7CD30ABC95D8
11ED47A01B30D0FFAEDD7CD30ABC95D8
11ED47A01B30D0FFAEDD7CD30ABC95D8
11ED47A01B30D0FFAEDD7CD30ABC95D8
11ED47A01B30D0FFAEDD7CD30ABC95D8
11ED47A01B30D0FFAEDD7CD30ABC95D8
11ED47A01B30D0FFAEDD7CD30ABC95D8
11ED47A01B30D0FFAEDD7CD30ABC95D8
11ED47A01B30D0FFAEDD7CD30ABC95D8
11ED47A01B30D0FFAEDD7CD30ABC95D8
11ED47A01B30D0FFAEDD7CD30ABC95D8
11ED47A01B30D0FFAEDD7CD30ABC95D8
11ED47A01B30D0FFAEDD7CD30ABC95D8
11ED47A01B30D0FFAEDD7CD30ABC95D8
11ED47A01B30D0FFAEDD7CD30ABC95D8
11ED47A01B30D0FFAEDD7CD30ABC95D8
11ED47A01B30D0FFAEDD7CD30ABC95D8
11ED47A01B30D0FFAEDD7CD30ABC95D8
11ED47A01B30D0FFAEDD7CD30ABC95D8
11ED47A01B30D0FFAEDD7CD30ABC95D8
11ED47A01B30D0FFAEDD7CD30ABC95D8
11ED47A01B30D0FFAEDD7CD30ABC95D8
11ED47A01B30D0FFAEDD7CD30ABC95D8
11ED47A01B30D0FFAEDD7CD30ABC95D8
11ED47A01B30D0FFAEDD7CD30ABC95D8
11ED47A01B30D0FFAEDD7CD30ABC95D8
11ED47A01B30D0FFAEDD7CD30ABC95D8
11ED47A01B30D0FFAEDD7CD30ABC95D8
11ED47A01B30D0FFAEDD7CD30ABC95D8
11ED47A01B30D0FFAEDD7CD30ABC95D8
11ED47A01B30D0FFAEDD7CD30ABC95D8
11ED47A01B30D0FFAEDD7CD30ABC95D8
11ED47A01B30D0FFAEDD7CD30ABC95D8
11ED47A01B30D0FFAEDD7CD30ABC95D8
11ED47A01B30D0FFAEDD7CD30ABC95D8
11ED47A01B30D0FFAEDD7CD30ABC95D8
11ED47A01B30D0FFAEDD7CD30ABC95D8
11ED47A01B30D0FFAEDD7CD30ABC95D8
11ED47A01B30D0FFAEDD7CD30ABC95D8
11ED47A01B30D0FFAEDD7CD30ABC95D8
11ED47A01B30D0FFAEDD7CD30ABC95D8
11ED47A01B30D0FFAEDD7CD30ABC95D8
11ED47A01B30D0FFAEDD7CD30ABC95D8
11ED47A01B30D0FFAEDD7CD30ABC95D8
11ED47A01B30D0FFAEDD7CD30ABC95D8
11ED47A01B30D0FFAEDD7CD30ABC95D8
11ED47A01B30D0FFAEDD7CD30ABC95D8
11ED47A01B30D0FFAEDD7CD30ABC95D8
11ED47A01B30D0FFAEDD7CD30ABC95D8
11ED47A01B30D0FFAEDD7CD30ABC95D8
11ED47A01B30D0FFAEDD7CD30ABC95D8
11ED47A01B30D0FFAEDD7CD30ABC95D8
11ED47A01B30D0FFAEDD7CD30ABC95D8
11ED47A01B30D0FFAEDD7CD30ABC95D8
11ED47A01B30D0FFAEDD7CD30ABC95D8
11ED47A01B30D0FFAEDD7CD30ABC95D8
11ED47A01B30D0FFAEDD7CD30ABC95D8
11ED47A01B30D0FFAEDD7CD30ABC95D8
11ED47A01B30D0FFAEDD7CD30ABC95D8
11ED47A01B30D0FFAEDD7CD30ABC95D8
11ED47A01B30D0FFAEDD7CD30ABC95D8
11ED47A01B30D0FFAEDD7CD30ABC95D8
11ED47A01B30D0FFAEDD7CD30ABC95D8
11ED47A01B30D0FFAEDD7CD30ABC95D8
11ED47A01B30D0FFAEDD7CD30ABC95D8
11ED47A01B30D0FFAEDD7CD30ABC95D8
11ED47A01B30D0FFAEDD7CD30ABC95D8
11ED47A01B30D0FFAEDD7CD30ABC95D8
11ED47A01B30D0FFAEDD7CD30ABC95D8
11ED47A01B30D0FFAEDD7CD30ABC95D8
11ED47A01B30D0FFAEDD7CD30ABC95D8
11ED47A01B30D0FFAEDD7CD30ABC95D8
11ED47A01B30D0FFAEDD7CD30ABC95D8
11ED47A01B30D0FFAEDD7CD30ABC95D8
11ED47A01B30D0FFAEDD7CD30ABC95D8
11ED47A01B30D0FFAEDD7CD30ABC95D8
11ED47A01B30D0FFAEDD7CD30ABC95D8
11ED47A01B30D0FFAEDD7CD30ABC95D8
11ED47A01B30D0FFAEDD7CD30ABC95D8
11ED47A01B30D0FFAEDD7CD30ABC95D8
11ED47A01B30D0FFAEDD7CD30ABC95D8
11ED47A01B30D0FFAEDD7CD30ABC95D8
11ED47A01B30D0FFAEDD7CD30ABC95D8
11ED47A01B30D0FFAEDD7CD30ABC95D8
11ED47A01B30D0FFAEDD7CD30ABC95D8
11ED47A01B30D0FFAEDD7CD30ABC95D8
11ED47A01B30D0FFAEDD7CD30ABC95D8
11ED47A01B30D0FFAEDD7CD30ABC95D8
11ED47A01B30D0FFAEDD7CD30ABC95D8
11ED47A01B30D0FFAEDD7CD30ABC95D8
11ED47A01B30D0FFAEDD7CD30ABC95D8
11ED47A01B30D0FFAEDD7CD30ABC95D8
11ED47A01B30D0FFAEDD7CD30ABC95D8
11ED47A01B30D0FFAEDD7CD30ABC95D8
11ED47A01B30D0FFAEDD7CD30ABC95D8
11ED47A01B30D0FFAEDD7CD30ABC95D8
11ED47A01B30D0FFAEDD7CD30ABC95D8
11ED47A01B30D0FFAEDD7CD30ABC95D8
11ED47A01B30D0FFAEDD7CD30ABC95D8
11ED47A01B30D0FFAEDD7CD30ABC95D8
11ED47A01B30D0FFAEDD7CD30ABC95D8
11ED47A01B30D0FFAEDD7CD30ABC95D8
11ED47A01B30D0FFAEDD7CD30ABC95D8
11ED47A01B30D0FFAEDD7CD30ABC95D8
11ED47A01B30D0FFAEDD7CD30ABC95D8
11ED47A01B30D0FFAEDD7CD30ABC95D8
11ED47A01B30D0FFAEDD7CD30ABC95D8
11ED47A01B30D0FFAEDD7CD30ABC95D8
11ED47A01B30D0FFAEDD7CD30ABC95D8
11ED47A01B30D0FFAEDD7CD30ABC95D8
11ED47A01B30D0FFAEDD7CD30ABC95D8
11ED47A01B30D0FFAEDD7CD30ABC95D8
11ED47A01B30D0FFAEDD7CD30ABC95D8
11ED47A01B30D0FFAEDD7CD30ABC95D8
11ED47A01B30D0FFAEDD7CD30ABC95D8
11ED47A01B30D0FFAEDD7CD30ABC95D8
11ED47A01B30D0FFAEDD7CD30ABC95D8
11ED47A01B30D0FFAEDD7CD30ABC95D8
11ED47A01B30D0FFAEDD7CD30ABC95D8
11ED47A01B30D0FFAEDD7CD30ABC95D8
11ED47A01B30D0FFAEDD7CD30ABC95D8
11ED47A01B30D0FFAEDD7CD30ABC95D8
11ED47A01B30D0FFAEDD7CD30ABC95D8
11ED47A01B30D0FFAEDD7CD30ABC95D8
11ED47A01B30D0FFAEDD7CD30ABC95D8
11ED47A01B30D0FFAEDD7CD30ABC95D8
11ED47A01B30D0FFAEDD7CD30ABC95D8
11ED47A01B30D0FFAEDD7CD30ABC95D8
11ED47A01B30D0FFAEDD7CD30ABC95D8
11ED47A01B30D0FFAEDD7CD30ABC95D8
11ED47A01B30D0FFAEDD7CD30ABC95D8
11ED47A01B30D0FFAEDD7CD30ABC95D8
11ED47A01B30D0FFAEDD7CD30ABC95D8
11ED47A01B30D0FFAEDD7CD30ABC95D8
11ED47A01B30D0FFAEDD7CD30ABC95D8
11ED47A01B30D0FFAEDD7CD30ABC95D8
11ED47A01B30D0FFAEDD7CD30ABC95D8
11ED47A01B30D0FFAEDD7CD30ABC95D8
11ED47A01B30D0FFAEDD7CD30ABC95D8
11ED47A01B30D0FFAEDD7CD30ABC95D8
11ED47A01B30D0FFAEDD7CD30ABC95D8
11ED47A01B30D0FFAEDD7CD30ABC95D8
11ED47A01B30D0FFAEDD7CD30ABC95D8
11ED47A01B30D0FFAEDD7CD30ABC95D8
11ED47A01B30D0FFAEDD7CD30ABC95D8
11ED47A01B30D0FFAEDD7CD30ABC95D8
11ED47A01B30D0FFAEDD7CD30ABC95D8
11ED47A01B30D0FFAEDD7CD30ABC95D8
11ED47A01B30D0FFAEDD7CD30ABC95D8
11ED47A01B30D0FFAEDD7CD30ABC95D8
11ED47A01B30D0FFAEDD7CD30ABC95D8
11ED47A01B30D0FFAEDD7CD30ABC95D8
11ED47A01B30D0FFAEDD7CD30ABC95D8
11ED47A01B30D0FFAEDD7CD30ABC95D8
11ED47A01B30D0FFAEDD7CD30ABC95D8
11ED47A01B30D0FFAEDD7CD30ABC95D8
11ED47A01B30D0FFAEDD7CD30ABC95D8
11ED47A01B30D0FFAEDD7CD30ABC95D8
11ED47A01B30D0FFAEDD7CD30ABC95D8
11ED47A01B30D0FFAEDD7CD30ABC95D8
11ED47A01B30D0FFAEDD7CD30ABC95D8
11ED47A01B30D0FFAEDD7CD30ABC95D8
11ED47A01B30D0FFAEDD7CD30ABC95D8
11ED47A01B30D0FFAEDD7CD30ABC95D8
11ED47A01B30D0FFAEDD7CD30ABC95D8
11ED47A01B30D0FFAEDD7CD30ABC95D8
11ED47A01B30D0FFAEDD7CD30ABC95D8
11ED47A01B30D0FFAEDD7CD30ABC95D8
11ED47A01B30D0FFAEDD7CD30ABC95D8
11ED47A01B30D0FFAEDD7CD30ABC95D8
11ED47A01B30D0FFAEDD7CD30ABC95D8
11ED47A01B30D0FFAEDD7CD30ABC95D8
11ED47A01B30D0FFAEDD7CD30ABC95D8
11ED47A01B30D0FFAEDD7CD30ABC95D8
11ED47A01B30D0FFAEDD7CD30ABC95D8
11ED47A01B30D0FFAEDD7CD30ABC95D8
11ED47A01B30D0FFAEDD7CD30ABC95D8
11ED47A01B30D0FFAEDD7CD30ABC95D8
11ED47A01B30D0FFAEDD7CD30ABC95D8
11ED47A01B30D0FFAEDD7CD30ABC95D8
11ED47A01B30D0FFAEDD7CD30ABC95D8
11ED47A01B30D0FFAEDD7CD30ABC95D8
11ED47A01B30D0FFAEDD7CD30ABC95D8
11ED47A01B30D0FFAEDD7CD30ABC95D8
11ED47A01B30D0FFAEDD7CD30ABC95D8
11ED47A01B30D0FFAEDD7CD30ABC95D8
11ED47A01B30D0FFAEDD7CD30ABC95D8
11ED47A01B30D0FFAEDD7CD30ABC95D8
11ED47A01B30D0FFAEDD7CD30ABC95D8
11ED47A01B30D0FFAEDD7CD30ABC95D8
11ED47A01B30D0FFAEDD7CD30ABC95D8
11ED47A01B30D0FFAEDD7CD30ABC95D8
11ED47A01B30D0FFAEDD7CD30ABC95D8
11ED47A01B30D0FFAEDD7CD30ABC95D8
11ED47A01B30D0FFAEDD7CD30ABC95D8
11ED47A01B30D0FFAEDD7CD30ABC95D8
11ED47A01B30D0FFAEDD7CD30ABC95D8
11ED47A01B30D0FFAEDD7CD30ABC95D8
11ED47A01B30D0FFAEDD7CD30ABC95D8
11ED47A01B30D0FFAEDD7CD30ABC95D8
11ED47A01B30D0FFAEDD7CD30ABC95D8
11ED47A01B30D0FFAEDD7CD30ABC95D8
11ED47A01B30D0FFAEDD7CD30ABC95D8
11ED47A01B30D0FFAEDD7CD30ABC95D8
11ED47A01B30D0FFAEDD7CD30ABC95D8
11ED47A01B30D0FFAEDD7CD30ABC95D8
11ED47A01B30D0FFAEDD7CD30ABC95D8
11ED47A01B30D0FFAEDD7CD30ABC95D8
11ED47A01B30D0FFAEDD7CD30ABC95D8
11ED47A01B30D0FFAEDD7CD30ABC95D8
11ED47A01B30D0FFAEDD7CD30ABC95D8
11ED47A01B30D0FFAEDD7CD30ABC95D8
11ED47A01B30D0FFAEDD7CD30ABC95D8
11ED47A01B30D0FFAEDD7CD30ABC95D8
11ED47A01B30D0FFAEDD7CD30ABC95D8
11ED47A01B30D0FFAEDD7CD30ABC95D8
11ED47A01B30D0FFAEDD7CD30ABC95D8
11ED47A01B30D0FFAEDD7CD30ABC95D8
11ED47A01B30D0FFAEDD7CD30ABC95D8
11ED47A01B30D0FFAEDD7CD30ABC95D8
11ED47A01B30D0FFAEDD7CD30ABC95D8
11ED47A01B30D0FFAEDD7CD30ABC95D8
11ED47A01B30D0FFAEDD7CD30ABC95D8
11ED47A01B30D0FFAEDD7CD30ABC95D8
11ED47A01B30D0FFAEDD7CD30ABC95D8
11ED47A01B30D0FFAEDD7CD30ABC95D8
11ED47A01B30D0FFAEDD7CD30ABC95D8
11ED47A01B30D0FFAEDD7CD30ABC95D8
11ED47A01B30D0FFAEDD7CD30ABC95D8
11ED47A01B30D0FFAEDD7CD30ABC95D8
11ED47A01B30D0FFAEDD7CD30ABC95D8
11ED47A01B30D0FFAEDD7CD30ABC95D8
11ED47A01B30D0FFAEDD7CD30ABC95D8
11ED47A01B30D0FFAEDD7CD30ABC95D8
11ED47A01B30D0FFAEDD7CD30ABC95D8
11ED47A01B30D0FFAEDD7CD30ABC95D8
11ED47A01B30D0FFAEDD7CD30ABC95D8
11ED47A01B30D0FFAEDD7CD30ABC95D8
11ED47A01B30D0FFAEDD7CD30ABC95D8
11ED47A01B30D0FFAEDD7CD30ABC95D8
11ED47A01B30D0FFAEDD7CD30ABC95D8
11ED47A01B30D0FFAEDD7CD30ABC95D8
11ED47A01B30D0FFAEDD7CD30ABC95D8
11ED47A01B30D0FFAEDD7CD30ABC95D8
11ED47A01B30D0FFAEDD7CD30ABC95D8
11ED47A01B30D0FFAEDD7CD30ABC95D8
11ED47A01B30D0FFAEDD7CD30ABC95D8
11ED47A01B30D0FFAEDD7CD30ABC95D8
11ED47A01B30D0FFAEDD7CD30ABC95D8
11ED47A01B30D0FFAEDD7CD30ABC95D8
11ED47A01B30D0FFAEDD7CD30ABC95D8
11ED47A01B30D0FFAEDD7CD30ABC95D8
11ED47A01B30D0FFAEDD7CD30ABC95D8
11ED47A01B30D0FFAEDD7CD30ABC95D8
11ED47A01B30D0FFAEDD7CD30ABC95D8
11ED47A01B30D0FFAEDD7CD30ABC95D8
11ED47A01B30D0FFAEDD7CD30ABC95D8
11ED47A01B30D0FFAEDD7CD30ABC95D8
11ED47A01B30D0FFAEDD7CD30ABC95D8
11ED47A01B30D0FFAEDD7CD30ABC95D8
11ED47A01B30D0FFAEDD7CD30ABC95D8
11ED47A01B30D0FFAEDD7CD30ABC95D8
11ED47A01B30D0FFAEDD7CD30ABC95D8
11ED47A01B30D0FFAEDD7CD30ABC95D8
11ED47A01B30D0FFAEDD7CD30ABC95D8
11ED47A01B30D0FFAEDD7CD30ABC95D8
11ED47A01B30D0FFAEDD7CD30ABC95D8
11ED47A01B30D0FFAEDD7CD30ABC95D8
11ED47A01B30D0FFAEDD7CD30ABC95D8
11ED47A01B30D0FFAEDD7CD30ABC95D8
11ED47A01B30D0FFAEDD7CD30ABC95D8
11ED47A01B30D0FFAEDD7CD30ABC95D8
11ED47A01B30D0FFAEDD7CD30ABC95D8
11ED47A01B30D0FFAEDD7CD30ABC95D8
11ED47A01B30D0FFAEDD7CD30ABC95D8
11ED47A01B30D0FFAEDD7CD30ABC95D8
11ED47A01B30D0FFAEDD7CD30ABC95D8
11ED47A01B30D0FFAEDD7CD30ABC95D8
11ED47A01B30D0FFAEDD7CD30ABC95D8
11ED47A01B30D0FFAEDD7CD30ABC95D8
11ED47A01B30D0FFAEDD7CD30ABC95D8
11ED47A01B30D0FFAEDD7CD30ABC95D8
11ED47A01B30D0FFAEDD7CD30ABC95D8
11ED47A01B30D0FFAEDD7CD30ABC95D8
11ED47A01B30D0FFAEDD7CD30ABC95D8
11ED47A01B30D0FFAEDD7CD30ABC95D8
11ED47A01B30D0FFAEDD7CD30ABC95D8
11ED47A01B30D0FFAEDD7CD30ABC95D8
11ED47A01B30D0FFAEDD7CD30ABC95D8
11ED47A01B30D0FFAEDD7CD30ABC95D8
11ED47A01B30D0FFAEDD7CD30ABC95D8
11ED47A01B30D0FFAEDD7CD30ABC95D8
11ED47A01B30D0FFAEDD7CD30ABC95D8
11ED47A01B30D0FFAEDD7CD30ABC95D8
11ED47A01B30D0FFAEDD7CD30ABC95D8
11ED47A01B30D0FFAEDD7CD30ABC95D8
11ED47A01B30D0FFAEDD7CD30ABC95D8
11ED47A01B30D0FFAEDD7CD30ABC95D8
11ED47A01B30D0FFAEDD7CD30ABC95D8
11ED47A01B30D0FFAEDD7CD30ABC95D8
11ED47A01B30D0FFAEDD7CD30ABC95D8
11ED47A01B30D0FFAEDD7CD30ABC95D8
11ED47A01B30D0FFAEDD7CD30ABC95D8
11ED47A01B30D0FFAEDD7CD30ABC95D8
11ED47A01B30D0FFAEDD7CD30ABC95D8
11ED47A01B30D0FFAEDD7CD30ABC95D8
11ED47A01B30D0FFAEDD7CD30ABC95D8
11ED47A01B30D0FFAEDD7CD30ABC95D8
11ED47A01B30D0FFAEDD7CD30ABC95D8
11ED47A01B30D0FFAEDD7CD30ABC95D8
11ED47A01B30D0FFAEDD7CD30ABC95D8
11ED47A01B30D0FFAEDD7CD30ABC95D8
11ED47A01B30D0FFAEDD7CD30ABC95D8
11ED47A01B30D0FFAEDD7CD30ABC95D8
11ED47A01B30D0FFAEDD7CD30ABC95D8
11ED47A01B30D0FFAEDD7CD30ABC95D8
11ED47A01B30D0FFAEDD7CD30ABC95D8
11ED47A01B30D0FFAEDD7CD30ABC95D8
11ED47A01B30D0FFAEDD7CD30ABC95D8
11ED47A01B30D0FFAEDD7CD30ABC95D8
11ED47A01B30D0FFAEDD7CD30ABC95D8
11ED47A01B30D0FFAEDD7CD30ABC95D8
11ED47A01B30D0FFAEDD7CD30ABC95D8
11ED47A01B30D0FFAEDD7CD30ABC95D8
11ED47A01B30D0FFAEDD7CD30ABC95D8
11ED47A01B30D0FFAEDD7CD30ABC95D8
11ED47A01B30D0FFAEDD7CD30ABC95D8
11ED47A01B30D0FFAEDD7CD30ABC95D8
11ED47A01B30D0FFAEDD7CD30ABC95D8
11ED47A01B30D0FFAEDD7CD30ABC95D8
11ED47A01B30D0FFAEDD7CD30ABC95D8
11ED47A01B30D0FFAEDD7CD30ABC95D8
11ED47A01B30D0FFAEDD7CD30ABC95D8
11ED47A01B30D0FFAEDD7CD30ABC95D8
11ED47A01B30D0FFAEDD7CD30ABC95D8
11ED47A01B30D0FFAEDD7CD30ABC95D8
11ED47A01B30D0FFAEDD7CD30ABC95D8
11ED47A01B30D0FFAEDD7CD30ABC95D8
11ED47A01B30D0FFAEDD7CD30ABC95D8
11ED47A01B30D0FFAEDD7CD30ABC95D8
11ED47A01B30D0FFAEDD7CD30ABC95D8
11ED47A01B30D0FFAEDD7CD30ABC95D8
11ED47A01B30D0FFAEDD7CD30ABC95D8
11ED47A01B30D0FFAEDD7CD30ABC95D8
11ED47A01B30D0FFAEDD7CD30ABC95D8
11ED47A01B30D0FFAEDD7CD30ABC95D8
11ED47A01B30D0FFAEDD7CD30ABC95D8
11ED47A01B30D0FFAEDD7CD30ABC95D8
11ED47A01B30D0FFAEDD7CD30ABC95D8
11ED47A01B30D0FFAEDD7CD30ABC95D8
11ED47A01B30D0FFAEDD7CD30ABC95D8
11ED47A01B30D0FFAEDD7CD30ABC95D8
11ED47A01B30D0FFAEDD7CD30ABC95D8
11ED47A01B30D0FFAEDD7CD30ABC95D8
11ED47A01B30D0FFAEDD7CD30ABC95D8
11ED47A01B30D0FFAEDD7CD30ABC95D8
11ED47A01B30D0FFAEDD7CD30ABC95D8
11ED47A01B30D0FFAEDD7CD30ABC95D8
11ED47A01B30D0FFAEDD7CD30ABC95D8
11ED47A01B30D0FFAEDD7CD30ABC95D8
11ED47A01B30D0FFAEDD7CD30ABC95D8
11ED47A01B30D0FFAEDD7CD30ABC95D8
11ED47A01B30D0FFAEDD7CD30ABC95D8
11ED47A01B30D0FFAEDD7CD30ABC95D8
11ED47A01B30D0FFAEDD7CD30ABC95D8
11ED47A01B30D0FFAEDD7CD30ABC95D8
11ED47A01B30D0FFAEDD7CD30ABC95D8
11ED47A01B30D0FFAEDD7CD30ABC95D8
11ED47A01B30D0FFAEDD7CD30ABC95D8
11ED47A01B30D0FFAEDD7CD30ABC95D8
11ED47A01B30D0FFAEDD7CD30ABC95D8
11ED47A01B30D0FFAEDD7CD30ABC95D8
11ED47A01B30D0FFAEDD7CD30ABC95D8
11ED47A01B30D0FFAEDD7CD30ABC95D8
11ED47A01B30D0FFAEDD7CD30ABC95D8
11ED47A01B30D0FFAEDD7CD30ABC95D8
11ED47A01B30D0FFAEDD7CD30ABC95D8
11ED47A01B30D0FFAEDD7CD30ABC95D8
11ED47A01B30D0FFAEDD7CD30ABC95D8
11ED47A01B30D0FFAEDD7CD30ABC95D8
11ED47A01B30D0FFAEDD7CD30ABC95D8
11ED47A01B30D0FFAEDD7CD30ABC95D8
11ED47A01B30D0FFAEDD7CD30ABC95D8
11ED47A01B30D0FFAEDD7CD30ABC95D8
11ED47A01B30D0FFAEDD7CD30ABC95D8
11ED47A01B30D0FFAEDD7CD30ABC95D8
11ED47A01B30D0FFAEDD7CD30ABC95D8
11ED47A01B30D0FFAEDD7CD30ABC95D8
11ED47A01B30D0FFAEDD7CD30ABC95D8
11ED47A01B30D0FFAEDD7CD30ABC95D8
11ED47A01B30D0FFAEDD7CD30ABC95D8
11ED47A01B30D0FFAEDD7CD30ABC95D8
11ED47A01B30D0FFAEDD7CD30ABC95D8
11ED47A01B30D0FFAEDD7CD30ABC95D8
11ED47A01B30D0FFAEDD7CD30ABC95D8
11ED47A01B30D0FFAEDD7CD30ABC95D8
11ED47A01B30D0FFAEDD7CD30ABC95D8
11ED47A01B30D0FFAEDD7CD30ABC95D8
11ED47A01B30D0FFAEDD7CD30ABC95D8
11ED47A01B30D0FFAEDD7CD30ABC95D8
11ED47A01B30D0FFAEDD7CD30ABC95D8
11ED47A01B30D0FFAEDD7CD30ABC95D8
11ED47A01B30D0FFAEDD7CD30ABC95D8
11ED47A01B30D0FFAEDD7CD30ABC95D8
11ED47A01B30D0FFAEDD7CD30ABC95D8
11ED47A01B30D0FFAEDD7CD30ABC95D8
11ED47A01B30D0FFAEDD7CD30ABC95D8
11ED47A01B30D0FFAEDD7CD30ABC95D8
11ED47A01B30D0FFAEDD7CD30ABC95D8
11ED47A01B30D0FFAEDD7CD30ABC95D8
11ED47A01B30D0FFAEDD7CD30ABC95D8
11ED47A01B30D0FFAEDD7CD30ABC95D8
11ED47A01B30D0FFAEDD7CD30ABC95D8
11ED47A01B30D0FFAEDD7CD30ABC95D8
11ED47A01B30D0FFAEDD7CD30ABC95D8
11ED47A01B30D0FFAEDD7CD30ABC95D8
11ED47A01B30D0FFAEDD7CD30ABC95D8
11ED47A01B30D0FFAEDD7CD30ABC95D8
11ED47A01B30D0FFAEDD7CD30ABC95D8
11ED47A01B30D0FFAEDD7CD30ABC95D8
11ED47A01B30D0FFAEDD7CD30ABC95D8
11ED47A01B30D0FFAEDD7CD30ABC95D8
11ED47A01B30D0FFAEDD7CD30ABC95D8
11ED47A01B30D0FFAEDD7CD30ABC95D8
11ED47A01B30D0FFAEDD7CD30ABC95D8
11ED47A01B30D0FFAEDD7CD30ABC95D8
11ED47A01B30D0FFAEDD7CD30ABC95D8
11ED47A01B30D0FFAEDD7CD30ABC95D8
11ED47A01B30D0FFAEDD7CD30ABC95D8
11ED47A01B30D0FFAEDD7CD30ABC95D8
11ED47A01B30D0FFAEDD7CD30ABC95D8
11ED47A01B30D0FFAEDD7CD30ABC95D8
11ED47A01B30D0FFAEDD7CD30ABC95D8
11ED47A01B30D0FFAEDD7CD30ABC95D8
11ED47A01B30D0FFAEDD7CD30ABC95D8
11ED47A01B30D0FFAEDD7CD30ABC95D8
11ED47A01B30D0FFAEDD7CD30ABC95D8
11ED47A01B30D0FFAEDD7CD30ABC95D8
11ED47A01B30D0FFAEDD7CD30ABC95D8
11ED47A01B30D0FFAEDD7CD30ABC95D8
11ED47A01B30D0FFAEDD7CD30ABC95D8
11ED47A01B30D0FFAEDD7CD30ABC95D8
11ED47A01B30D0FFAEDD7CD30ABC95D8
11ED47A01B30D0FFAEDD7CD30ABC95D8
11ED47A01B30D0FFAEDD7CD30ABC95D8
11ED47A01B30D0FFAEDD7CD30ABC95D8
11ED47A01B30D0FFAEDD7CD30ABC95D8
11ED47A01B30D0FFAEDD7CD30ABC95D8
11ED47A01B30D0FFAEDD7CD30ABC95D8
11ED47A01B30D0FFAEDD7CD30ABC95D8
11ED47A01B30D0FFAEDD7CD30ABC95D8
11ED47A01B30D0FFAEDD7CD30ABC95D8
11ED47A01B30D0FFAEDD7CD30ABC95D8
11ED47A01B30D0FFAEDD7CD30ABC95D8
11ED47A01B30D0FFAEDD7CD30ABC95D8
11ED47A01B30D0FFAEDD7CD30ABC95D8
11ED47A01B30D0FFAEDD7CD30ABC95D8
11ED47A01B30D0FFAEDD7CD30ABC95D8
11ED47A01B30D0FFAEDD7CD30ABC95D8
11ED47A01B30D0FFAEDD7CD30ABC95D8
11ED47A01B30D0FFAEDD7CD30ABC95D8
11ED47A01B30D0FFAEDD7CD30ABC95D8
11ED47A01B30D0FFAEDD7CD30ABC95D8
11ED47A01B30D0FFAEDD7CD30ABC95D8
11ED47A01B30D0FFAEDD7CD30ABC95D8
11ED47A01B30D0FFAEDD7CD30ABC95D8
11ED47A01B30D0FFAEDD7CD30ABC95D8
11ED47A01B30D0FFAEDD7CD30ABC95D8
11ED47A01B30D0FFAEDD7CD30ABC95D8
11ED47A01B30D0FFAEDD7CD30ABC95D8
11ED47A01B30D0FFAEDD7CD30ABC95D8
11ED47A01B30D0FFAEDD7CD30ABC95D8
11ED47A01B30D0FFAEDD7CD30ABC95D8
11ED47A01B30D0FFAEDD7CD30ABC95D8
11ED47A01B30D0FFAEDD7CD30ABC95D8
11ED47A01B30D0FFAEDD7CD30ABC95D8
11ED47A01B30D0FFAEDD7CD30ABC95D8
11ED47A01B30D0FFAEDD7CD30ABC95D8
11ED47A01B30D0FFAEDD7CD30ABC95D8
11ED47A01B30D0FFAEDD7CD30ABC95D8
11ED47A01B30D0FFAEDD7CD30ABC95D8
11ED47A01B30D0FFAEDD7CD30ABC95D8
11ED47A01B30D0FFAEDD7CD30ABC95D8
11ED47A01B30D0FFAEDD7CD30ABC95D8
11ED47A01B30D0FFAEDD7CD30ABC95D8
11ED47A01B30D0FFAEDD7CD30ABC95D8
11ED47A01B30D0FFAEDD7CD30ABC95D8
11ED47A01B30D0FFAEDD7CD30ABC95D8
11ED47A01B30D0FFAEDD7CD30ABC95D8
11ED47A01B30D0FFAEDD7CD30ABC95D8
11ED47A01B30D0FFAEDD7CD30ABC95D8
11ED47A01B30D0FFAEDD7CD30ABC95D8
11ED47A01B30D0FFAEDD7CD30ABC95D8
11ED47A01B30D0FFAEDD7CD30ABC95D8
11ED47A01B30D0FFAEDD7CD30ABC95D8
11ED47A01B30D0FFAEDD7CD30ABC95D8
11ED47A01B30D0FFAEDD7CD30ABC95D8
11ED47A01B30D0FFAEDD7CD30ABC95D8
11ED47A01B30D0FFAEDD7CD30ABC95D8
11ED47A01B30D0FFAEDD7CD30ABC95D8
11ED47A01B30D0FFAEDD7CD30ABC95D8
11ED47A01B30D0FFAEDD7CD30ABC95D8
11ED47A01B30D0FFAEDD7CD30ABC95D8
11ED47A01B30D0FFAEDD7CD30ABC95D8
11ED47A01B30D0FFAEDD7CD30ABC95D8
11ED47A01B30D0FFAEDD7CD30ABC95D8
11ED47A01B30D0FFAEDD7CD30ABC95D8
11ED47A01B30D0FFAEDD7CD30ABC95D8
11ED47A01B30D0FFAEDD7CD30ABC95D8
11ED47A01B30D0FFAEDD7CD30ABC95D8
11ED47A01B30D0FFAEDD7CD30ABC95D8
11ED47A01B30D0FFAEDD7CD30ABC95D8
11ED47A01B30D0FFAEDD7CD30ABC95D8
11ED47A01B30D0FFAEDD7CD30ABC95D8
11ED47A01B30D0FFAEDD7CD30ABC95D8
11ED47A01B30D0FFAEDD7CD30ABC95D8
11ED47A01B30D0FFAEDD7CD30ABC95D8
11ED47A01B30D0FFAEDD7CD30ABC95D8
11ED47A01B30D0FFAEDD7CD30ABC95D8
11ED47A01B30D0FFAEDD7CD30ABC95D8
11ED47A01B30D0FFAEDD7CD30ABC95D8
11ED47A01B30D0FFAEDD7CD30ABC95D8
11ED47A01B30D0FFAEDD7CD30ABC95D8
11ED47A01B30D0FFAEDD7CD30ABC95D8
11ED47A01B30D0FFAEDD7CD30ABC95D8
11ED47A01B30D0FFAEDD7CD30ABC95D8
11ED47A01B30D0FFAEDD7CD30ABC95D8
11ED47A01B30D0FFAEDD7CD30ABC95D8
11ED47A01B30D0FFAEDD7CD30ABC95D8
11ED47A01B30D0FFAEDD7CD30ABC95D8
11ED47A01B30D0FFAEDD7CD30ABC95D8
11ED47A01B30D0FFAEDD7CD30ABC95D8
11ED47A01B30D0FFAEDD7CD30ABC95D8
11ED47A01B30D0FFAEDD7CD30ABC95D8
11ED47A01B30D0FFAEDD7CD30ABC95D8
11ED47A01B30D0FFAEDD7CD30ABC95D8
11ED47A01B30D0FFAEDD7CD30ABC95D8
11ED47A01B30D0FFAEDD7CD30ABC95D8
11ED47A01B30D0FFAEDD7CD30ABC95D8
11ED47A01B30D0FFAEDD7CD30ABC95D8
11ED47A01B30D0FFAEDD7CD30ABC95D8
11ED47A01B30D0FFAEDD7CD30ABC95D8
11ED47A01B30D0FFAEDD7CD30ABC95D8
11ED47A01B30D0FFAEDD7CD30ABC95D8
11ED47A01B30D0FFAEDD7CD30ABC95D8
11ED47A01B30D0FFAEDD7CD30ABC95D8
11ED47A01B30D0FFAEDD7CD30ABC95D8
11ED47A01B30D0FFAEDD7CD30ABC95D8
11ED47A01B30D0FFAEDD7CD30ABC95D8
11ED47A01B30D0FFAEDD7CD30ABC95D8
11ED47A01B30D0FFAEDD7CD30ABC95D8
11ED47A01B30D0FFAEDD7CD30ABC95D8
11ED47A01B30D0FFAEDD7CD30ABC95D8
11ED47A01B30D0FFAEDD7CD30ABC95D8
11ED47A01B30D0FFAEDD7CD30ABC95D8
11ED47A01B30D0FFAEDD7CD30ABC95D8
11ED47A01B30D0FFAEDD7CD30ABC95D8
11ED47A01B30D0FFAEDD7CD30ABC95D8
11ED47A01B30D0FFAEDD7CD30ABC95D8
11ED47A01B30D0FFAEDD7CD30ABC95D8
11ED47A01B30D0FFAEDD7CD30ABC95D8
11ED47A01B30D0FFAEDD7CD30ABC95D8
11ED47A01B30D0FFAEDD7CD30ABC95D8
11ED47A01B30D0FFAEDD7CD30ABC95D8
11ED47A01B30D0FFAEDD7CD30ABC95D8
11ED47A01B30D0FFAEDD7CD30ABC95D8
11ED47A01B30D0FFAEDD7CD30ABC95D8
11ED47A01B30D0FFAEDD7CD30ABC95D8
11ED47A01B30D0FFAEDD7CD30ABC95D8
11ED47A01B30D0FFAEDD7CD30ABC95D8
11ED47A01B30D0FFAEDD7CD30ABC95D8
11ED47A01B30D0FFAEDD7CD30ABC95D8
11ED47A01B30D0FFAEDD7CD30ABC95D8
1B30D0FF47A011EDAEDD7CD30ABC95D8
1B30D0FF47A011EDAEDD7CD30ABC95D8
1B30D0FF47A011EDAEDD7CD30ABC95D8
1B30D0FF47A011EDAEDD7CD30ABC95D8
1B30D0FF47A011EDAEDD7CD30ABC95D8
1B30D0FF47A011EDAEDD7CD30ABC95D8
1B30D0FF47A011EDAEDD7CD30ABC95D8
1B30D0FF47A011EDAEDD7CD30ABC95D8
1B30D0FF47A011EDAEDD7CD30ABC95D8
1B30D0FF47A011EDAEDD7CD30ABC95D8
1B30D0FF47A011EDAEDD7CD30ABC95D8
1B30D0FF47A011EDAEDD7CD30ABC95D8
1B30D0FF47A011EDAEDD7CD30ABC95D8
1B30D0FF47A011EDAEDD7CD30ABC95D8
1B30D0FF47A011EDAEDD7CD30ABC95D8
1B30D0FF47A011EDAEDD7CD30ABC95D8
1B30D0FF47A011EDAEDD7CD30ABC95D8
1B30D0FF47A011EDAEDD7CD30ABC95D8
1B30D0FF47A011EDAEDD7CD30ABC95D8
1B30D0FF47A011EDAEDD7CD30ABC95D8
1B30D0FF47A011EDAEDD7CD30ABC95D8
1B30D0FF47A011EDAEDD7CD30ABC95D8
1B30D0FF47A011EDAEDD7CD30ABC95D8
1B30D0FF47A011EDAEDD7CD30ABC95D8
1B30D0FF47A011EDAEDD7CD30ABC95D8
1B30D0FF47A011EDAEDD7CD30ABC95D8
1B30D0FF47A011EDAEDD7CD30ABC95D8
1B30D0FF47A011EDAEDD7CD30ABC95D8
1B30D0FF47A011EDAEDD7CD30ABC95D8
1B30D0FF47A011EDAEDD7CD30ABC95D8
1B30D0FF47A011EDAEDD7CD30ABC95D8
1B30D0FF47A011EDAEDD7CD30ABC95D8
1B30D0FF47A011EDAEDD7CD30ABC95D8
1B30D0FF47A011EDAEDD7CD30ABC95D8
1B30D0FF47A011EDAEDD7CD30ABC95D8
1B30D0FF47A011EDAEDD7CD30ABC95D8
1B30D0FF47A011EDAEDD7CD30ABC95D8
1B30D0FF47A011EDAEDD7CD30ABC95D8
1B30D0FF47A011EDAEDD7CD30ABC95D8
1B30D0FF47A011EDAEDD7CD30ABC95D8
1B30D0FF47A011EDAEDD7CD30ABC95D8
1B30D0FF47A011EDAEDD7CD30ABC95D8
1B30D0FF47A011EDAEDD7CD30ABC95D8
1B30D0FF47A011EDAEDD7CD30ABC95D8
1B30D0FF47A011EDAEDD7CD30ABC95D8
1B30D0FF47A011EDAEDD7CD30ABC95D8
1B30D0FF47A011EDAEDD7CD30ABC95D8
1B30D0FF47A011EDAEDD7CD30ABC95D8
1B30D0FF47A011EDAEDD7CD30ABC95D8
1B30D0FF47A011EDAEDD7CD30ABC95D8
1B30D0FF47A011EDAEDD7CD30ABC95D8
1B30D0FF47A011EDAEDD7CD30ABC95D8
1B30D0FF47A011EDAEDD7CD30ABC95D8
1B30D0FF47A011EDAEDD7CD30ABC95D8
1B30D0FF47A011EDAEDD7CD30ABC95D8
1B30D0FF47A011EDAEDD7CD30ABC95D8
1B30D0FF47A011EDAEDD7CD30ABC95D8
1B30D0FF47A011EDAEDD7CD30ABC95D8
1B30D0FF47A011EDAEDD7CD30ABC95D8
1B30D0FF47A011EDAEDD7CD30ABC95D8
1B30D0FF47A011EDAEDD7CD30ABC95D8
1B30D0FF47A011EDAEDD7CD30ABC95D8
1B30D0FF47A011EDAEDD7CD30ABC95D8
1B30D0FF47A011EDAEDD7CD30ABC95D8
1B30D0FF47A011EDAEDD7CD30ABC95D8
1B30D0FF47A011EDAEDD7CD30ABC95D8
1B30D0FF47A011EDAEDD7CD30ABC95D8
1B30D0FF47A011EDAEDD7CD30ABC95D8
1B30D0FF47A011EDAEDD7CD30ABC95D8
1B30D0FF47A011EDAEDD7CD30ABC95D8
1B30D0FF47A011EDAEDD7CD30ABC95D8
1B30D0FF47A011EDAEDD7CD30ABC95D8
1B30D0FF47A011EDAEDD7CD30ABC95D8
1B30D0FF47A011EDAEDD7CD30ABC95D8
1B30D0FF47A011EDAEDD7CD30ABC95D8
1B30D0FF47A011EDAEDD7CD30ABC95D8
1B30D0FF47A011EDAEDD7CD30ABC95D8
1B30D0FF47A011EDAEDD7CD30ABC95D8
1B30D0FF47A011EDAEDD7CD30ABC95D8
1B30D0FF47A011EDAEDD7CD30ABC95D8
1B30D0FF47A011EDAEDD7CD30ABC95D8
1B30D0FF47A011EDAEDD7CD30ABC95D8
1B30D0FF47A011EDAEDD7CD30ABC95D8
1B30D0FF47A011EDAEDD7CD30ABC95D8
1B30D0FF47A011EDAEDD7CD30ABC95D8
1B30D0FF47A011EDAEDD7CD30ABC95D8
1B30D0FF47A011EDAEDD7CD30ABC95D8
1B30D0FF47A011EDAEDD7CD30ABC95D8
1B30D0FF47A011EDAEDD7CD30ABC95D8
1B30D0FF47A011EDAEDD7CD30ABC95D8
1B30D0FF47A011EDAEDD7CD30ABC95D8
1B30D0FF47A011EDAEDD7CD30ABC95D8
1B30D0FF47A011EDAEDD7CD30ABC95D8
1B30D0FF47A011EDAEDD7CD30ABC95D8
1B30D0FF47A011EDAEDD7CD30ABC95D8
1B30D0FF47A011EDAEDD7CD30ABC95D8
1B30D0FF47A011EDAEDD7CD30ABC95D8
1B30D0FF47A011EDAEDD7CD30ABC95D8
1B30D0FF47A011EDAEDD7CD30ABC95D8
1B30D0FF47A011EDAEDD7CD30ABC95D8
1B30D0FF47A011EDAEDD7CD30ABC95D8
1B30D0FF47A011EDAEDD7CD30ABC95D8
1B30D0FF47A011EDAEDD7CD30ABC95D8
1B30D0FF47A011EDAEDD7CD30ABC95D8
1B30D0FF47A011EDAEDD7CD30ABC95D8
1B30D0FF47A011EDAEDD7CD30ABC95D8
1B30D0FF47A011EDAEDD7CD30ABC95D8
1B30D0FF47A011EDAEDD7CD30ABC95D8
1B30D0FF47A011EDAEDD7CD30ABC95D8
1B30D0FF47A011EDAEDD7CD30ABC95D8
1B30D0FF47A011EDAEDD7CD30ABC95D8
1B30D0FF47A011EDAEDD7CD30ABC95D8
1B30D0FF47A011EDAEDD7CD30ABC95D8
1B30D0FF47A011EDAEDD7CD30ABC95D8
1B30D0FF47A011EDAEDD7CD30ABC95D8
1B30D0FF47A011EDAEDD7CD30ABC95D8
1B30D0FF47A011EDAEDD7CD30ABC95D8
1B30D0FF47A011EDAEDD7CD30ABC95D8
1B30D0FF47A011EDAEDD7CD30ABC95D8
1B30D0FF47A011EDAEDD7CD30ABC95D8
1B30D0FF47A011EDAEDD7CD30ABC95D8
1B30D0FF47A011EDAEDD7CD30ABC95D8
1B30D0FF47A011EDAEDD7CD30ABC95D8
1B30D0FF47A011EDAEDD7CD30ABC95D8
1B30D0FF47A011EDAEDD7CD30ABC95D8
1B30D0FF47A011EDAEDD7CD30ABC95D8
1B30D0FF47A011EDAEDD7CD30ABC95D8
1B30D0FF47A011EDAEDD7CD30ABC95D8
1B30D0FF47A011EDAEDD7CD30ABC95D8
1B30D0FF47A011EDAEDD7CD30ABC95D8
1B30D0FF47A011EDAEDD7CD30ABC95D8
1B30D0FF47A011EDAEDD7CD30ABC95D8
1B30D0FF47A011EDAEDD7CD30ABC95D8
1B30D0FF47A011EDAEDD7CD30ABC95D8
1B30D0FF47A011EDAEDD7CD30ABC95D8
1B30D0FF47A011EDAEDD7CD30ABC95D8
1B30D0FF47A011EDAEDD7CD30ABC95D8
1B30D0FF47A011EDAEDD7CD30ABC95D8
1B30D0FF47A011EDAEDD7CD30ABC95D8
1B30D0FF47A011EDAEDD7CD30ABC95D8
1B30D0FF47A011EDAEDD7CD30ABC95D8
1B30D0FF47A011EDAEDD7CD30ABC95D8
1B30D0FF47A011EDAEDD7CD30ABC95D8
1B30D0FF47A011EDAEDD7CD30ABC95D8
1B30D0FF47A011EDAEDD7CD30ABC95D8
1B30D0FF47A011EDAEDD7CD30ABC95D8
1B30D0FF47A011EDAEDD7CD30ABC95D8
1B30D0FF47A011EDAEDD7CD30ABC95D8
1B30D0FF47A011EDAEDD7CD30ABC95D8
1B30D0FF47A011EDAEDD7CD30ABC95D8
1B30D0FF47A011EDAEDD7CD30ABC95D8
1B30D0FF47A011EDAEDD7CD30ABC95D8
1B30D0FF47A011EDAEDD7CD30ABC95D8
1B30D0FF47A011EDAEDD7CD30ABC95D8
1B30D0FF47A011EDAEDD7CD30ABC95D8
1B30D0FF47A011EDAEDD7CD30ABC95D8
1B30D0FF47A011EDAEDD7CD30ABC95D8
1B30D0FF47A011EDAEDD7CD30ABC95D8
1B30D0FF47A011EDAEDD7CD30ABC95D8
1B30D0FF47A011EDAEDD7CD30ABC95D8
1B30D0FF47A011EDAEDD7CD30ABC95D8
1B30D0FF47A011EDAEDD7CD30ABC95D8
1B30D0FF47A011EDAEDD7CD30ABC95D8
1B30D0FF47A011EDAEDD7CD30ABC95D8
1B30D0FF47A011EDAEDD7CD30ABC95D8
1B30D0FF47A011EDAEDD7CD30ABC95D8
1B30D0FF47A011EDAEDD7CD30ABC95D8
1B30D0FF47A011EDAEDD7CD30ABC95D8
1B30D0FF47A011EDAEDD7CD30ABC95D8
1B30D0FF47A011EDAEDD7CD30ABC95D8
1B30D0FF47A011EDAEDD7CD30ABC95D8
1B30D0FF47A011EDAEDD7CD30ABC95D8
1B30D0FF47A011EDAEDD7CD30ABC95D8
1B30D0FF47A011EDAEDD7CD30ABC95D8
1B30D0FF47A011EDAEDD7CD30ABC95D8
1B30D0FF47A011EDAEDD7CD30ABC95D8
1B30D0FF47A011EDAEDD7CD30ABC95D8
1B30D0FF47A011EDAEDD7CD30ABC95D8
1B30D0FF47A011EDAEDD7CD30ABC95D8
1B30D0FF47A011EDAEDD7CD30ABC95D8
1B30D0FF47A011EDAEDD7CD30ABC95D8
1B30D0FF47A011EDAEDD7CD30ABC95D8
1B30D0FF47A011EDAEDD7CD30ABC95D8
1B30D0FF47A011EDAEDD7CD30ABC95D8
1B30D0FF47A011EDAEDD7CD30ABC95D8
1B30D0FF47A011EDAEDD7CD30ABC95D8
1B30D0FF47A011EDAEDD7CD30ABC95D8
1B30D0FF47A011EDAEDD7CD30ABC95D8
1B30D0FF47A011EDAEDD7CD30ABC95D8
1B30D0FF47A011EDAEDD7CD30ABC95D8
1B30D0FF47A011EDAEDD7CD30ABC95D8
1B30D0FF47A011EDAEDD7CD30ABC95D8
1B30D0FF47A011EDAEDD7CD30ABC95D8
1B30D0FF47A011EDAEDD7CD30ABC95D8
1B30D0FF47A011EDAEDD7CD30ABC95D8
1B30D0FF47A011EDAEDD7CD30ABC95D8
1B30D0FF47A011EDAEDD7CD30ABC95D8
1B30D0FF47A011EDAEDD7CD30ABC95D8
1B30D0FF47A011EDAEDD7CD30ABC95D8
1B30D0FF47A011EDAEDD7CD30ABC95D8
1B30D0FF47A011EDAEDD7CD30ABC95D8
1B30D0FF47A011EDAEDD7CD30ABC95D8
1B30D0FF47A011EDAEDD7CD30ABC95D8
1B30D0FF47A011EDAEDD7CD30ABC95D8
1B30D0FF47A011EDAEDD7CD30ABC95D8
1B30D0FF47A011EDAEDD7CD30ABC95D8
1B30D0FF47A011EDAEDD7CD30ABC95D8
1B30D0FF47A011EDAEDD7CD30ABC95D8
1B30D0FF47A011EDAEDD7CD30ABC95D8
1B30D0FF47A011EDAEDD7CD30ABC95D8
1B30D0FF47A011EDAEDD7CD30ABC95D8
1B30D0FF47A011EDAEDD7CD30ABC95D8
1B30D0FF47A011EDAEDD7CD30ABC95D8
1B30D0FF47A011EDAEDD7CD30ABC95D8
1B30D0FF47A011EDAEDD7CD30ABC95D8
1B30D0FF47A011EDAEDD7CD30ABC95D8
1B30D0FF47A011EDAEDD7CD30ABC95D8
1B30D0FF47A011EDAEDD7CD30ABC95D8
1B30D0FF47A011EDAEDD7CD30ABC95D8
1B30D0FF47A011EDAEDD7CD30ABC95D8
1B30D0FF47A011EDAEDD7CD30ABC95D8
1B30D0FF47A011EDAEDD7CD30ABC95D8
1B30D0FF47A011EDAEDD7CD30ABC95D8
1B30D0FF47A011EDAEDD7CD30ABC95D8
1B30D0FF47A011EDAEDD7CD30ABC95D8
1B30D0FF47A011EDAEDD7CD30ABC95D8
1B30D0FF47A011EDAEDD7CD30ABC95D8
1B30D0FF47A011EDAEDD7CD30ABC95D8
1B30D0FF47A011EDAEDD7CD30ABC95D8
1B30D0FF47A011EDAEDD7CD30ABC95D8
1B30D0FF47A011EDAEDD7CD30ABC95D8
1B30D0FF47A011EDAEDD7CD30ABC95D8
1B30D0FF47A011EDAEDD7CD30ABC95D8
1B30D0FF47A011EDAEDD7CD30ABC95D8
1B30D0FF47A011EDAEDD7CD30ABC95D8
1B30D0FF47A011EDAEDD7CD30ABC95D8
1B30D0FF47A011EDAEDD7CD30ABC95D8
1B30D0FF47A011EDAEDD7CD30ABC95D8
1B30D0FF47A011EDAEDD7CD30ABC95D8
1B30D0FF47A011EDAEDD7CD30ABC95D8
1B30D0FF47A011EDAEDD7CD30ABC95D8
1B30D0FF47A011EDAEDD7CD30ABC95D8
1B30D0FF47A011EDAEDD7CD30ABC95D8
1B30D0FF47A011EDAEDD7CD30ABC95D8
1B30D0FF47A011EDAEDD7CD30ABC95D8
1B30D0FF47A011EDAEDD7CD30ABC95D8
1B30D0FF47A011EDAEDD7CD30ABC95D8
1B30D0FF47A011EDAEDD7CD30ABC95D8
1B30D0FF47A011EDAEDD7CD30ABC95D8
1B30D0FF47A011EDAEDD7CD30ABC95D8
1B30D0FF47A011EDAEDD7CD30ABC95D8
1B30D0FF47A011EDAEDD7CD30ABC95D8
1B30D0FF47A011EDAEDD7CD30ABC95D8
1B30D0FF47A011EDAEDD7CD30ABC95D8
1B30D0FF47A011EDAEDD7CD30ABC95D8
1B30D0FF47A011EDAEDD7CD30ABC95D8
1B30D0FF47A011EDAEDD7CD30ABC95D8
1B30D0FF47A011EDAEDD7CD30ABC95D8
1B30D0FF47A011EDAEDD7CD30ABC95D8
1B30D0FF47A011EDAEDD7CD30ABC95D8
1B30D0FF47A011EDAEDD7CD30ABC95D8
1B30D0FF47A011EDAEDD7CD30ABC95D8
1B30D0FF47A011EDAEDD7CD30ABC95D8
1B30D0FF47A011EDAEDD7CD30ABC95D8
1B30D0FF47A011EDAEDD7CD30ABC95D8
1B30D0FF47A011EDAEDD7CD30ABC95D8
1B30D0FF47A011EDAEDD7CD30ABC95D8
1B30D0FF47A011EDAEDD7CD30ABC95D8
1B30D0FF47A011EDAEDD7CD30ABC95D8
1B30D0FF47A011EDAEDD7CD30ABC95D8
1B30D0FF47A011EDAEDD7CD30ABC95D8
1B30D0FF47A011EDAEDD7CD30ABC95D8
1B30D0FF47A011EDAEDD7CD30ABC95D8
1B30D0FF47A011EDAEDD7CD30ABC95D8
1B30D0FF47A011EDAEDD7CD30ABC95D8
1B30D0FF47A011EDAEDD7CD30ABC95D8
1B30D0FF47A011EDAEDD7CD30ABC95D8
1B30D0FF47A011EDAEDD7CD30ABC95D8
1B30D0FF47A011EDAEDD7CD30ABC95D8
1B30D0FF47A011EDAEDD7CD30ABC95D8
1B30D0FF47A011EDAEDD7CD30ABC95D8
1B30D0FF47A011EDAEDD7CD30ABC95D8
1B30D0FF47A011EDAEDD7CD30ABC95D8
1B30D0FF47A011EDAEDD7CD30ABC95D8
1B30D0FF47A011EDAEDD7CD30ABC95D8
1B30D0FF47A011EDAEDD7CD30ABC95D8
1B30D0FF47A011EDAEDD7CD30ABC95D8
1B30D0FF47A011EDAEDD7CD30ABC95D8
1B30D0FF47A011EDAEDD7CD30ABC95D8
1B30D0FF47A011EDAEDD7CD30ABC95D8
1B30D0FF47A011EDAEDD7CD30ABC95D8
1B30D0FF47A011EDAEDD7CD30ABC95D8
1B30D0FF47A011EDAEDD7CD30ABC95D8
1B30D0FF47A011EDAEDD7CD30ABC95D8
1B30D0FF47A011EDAEDD7CD30ABC95D8
1B30D0FF47A011EDAEDD7CD30ABC95D8
1B30D0FF47A011EDAEDD7CD30ABC95D8
1B30D0FF47A011EDAEDD7CD30ABC95D8
1B30D0FF47A011EDAEDD7CD30ABC95D8
1B30D0FF47A011EDAEDD7CD30ABC95D8
1B30D0FF47A011EDAEDD7CD30ABC95D8
1B30D0FF47A011EDAEDD7CD30ABC95D8
1B30D0FF47A011EDAEDD7CD30ABC95D8
1B30D0FF47A011EDAEDD7CD30ABC95D8
1B30D0FF47A011EDAEDD7CD30ABC95D8
1B30D0FF47A011EDAEDD7CD30ABC95D8
1B30D0FF47A011EDAEDD7CD30ABC95D8
1B30D0FF47A011EDAEDD7CD30ABC95D8
1B30D0FF47A011EDAEDD7CD30ABC95D8
1B30D0FF47A011EDAEDD7CD30ABC95D8
1B30D0FF47A011EDAEDD7CD30ABC95D8
1B30D0FF47A011EDAEDD7CD30ABC95D8
1B30D0FF47A011EDAEDD7CD30ABC95D8
1B30D0FF47A011EDAEDD7CD30ABC95D8
1B30D0FF47A011EDAEDD7CD30ABC95D8
1B30D0FF47A011EDAEDD7CD30ABC95D8
1B30D0FF47A011EDAEDD7CD30ABC95D8
1B30D0FF47A011EDAEDD7CD30ABC95D8
1B30D0FF47A011EDAEDD7CD30ABC95D8
1B30D0FF47A011EDAEDD7CD30ABC95D8
1B30D0FF47A011EDAEDD7CD30ABC95D8
1B30D0FF47A011EDAEDD7CD30ABC95D8
1B30D0FF47A011EDAEDD7CD30ABC95D8
1B30D0FF47A011EDAEDD7CD30ABC95D8
1B30D0FF47A011EDAEDD7CD30ABC95D8
1B30D0FF47A011EDAEDD7CD30ABC95D8
1B30D0FF47A011EDAEDD7CD30ABC95D8
1B30D0FF47A011EDAEDD7CD30ABC95D8
1B30D0FF47A011EDAEDD7CD30ABC95D8
1B30D0FF47A011EDAEDD7CD30ABC95D8
1B30D0FF47A011EDAEDD7CD30ABC95D8
1B30D0FF47A011EDAEDD7CD30ABC95D8
1B30D0FF47A011EDAEDD7CD30ABC95D8
1B30D0FF47A011EDAEDD7CD30ABC95D8
1B30D0FF47A011EDAEDD7CD30ABC95D8
1B30D0FF47A011EDAEDD7CD30ABC95D8
1B30D0FF47A011EDAEDD7CD30ABC95D8
1B30D0FF47A011EDAEDD7CD30ABC95D8
1B30D0FF47A011EDAEDD7CD30ABC95D8
1B30D0FF47A011EDAEDD7CD30ABC95D8
1B30D0FF47A011EDAEDD7CD30ABC95D8
1B30D0FF47A011EDAEDD7CD30ABC95D8
1B30D0FF47A011EDAEDD7CD30ABC95D8
1B30D0FF47A011EDAEDD7CD30ABC95D8
1B30D0FF47A011EDAEDD7CD30ABC95D8
1B30D0FF47A011EDAEDD7CD30ABC95D8
1B30D0FF47A011EDAEDD7CD30ABC95D8
1B30D0FF47A011EDAEDD7CD30ABC95D8
1B30D0FF47A011EDAEDD7CD30ABC95D8
1B30D0FF47A011EDAEDD7CD30ABC95D8
1B30D0FF47A011EDAEDD7CD30ABC95D8
1B30D0FF47A011EDAEDD7CD30ABC95D8
1B30D0FF47A011EDAEDD7CD30ABC95D8
1B30D0FF47A011EDAEDD7CD30ABC95D8
1B30D0FF47A011EDAEDD7CD30ABC95D8
1B30D0FF47A011EDAEDD7CD30ABC95D8
1B30D0FF47A011EDAEDD7CD30ABC95D8
1B30D0FF47A011EDAEDD7CD30ABC95D8
1B30D0FF47A011EDAEDD7CD30ABC95D8
1B30D0FF47A011EDAEDD7CD30ABC95D8
1B30D0FF47A011EDAEDD7CD30ABC95D8
1B30D0FF47A011EDAEDD7CD30ABC95D8
1B30D0FF47A011EDAEDD7CD30ABC95D8
1B30D0FF47A011EDAEDD7CD30ABC95D8
1B30D0FF47A011EDAEDD7CD30ABC95D8
1B30D0FF47A011EDAEDD7CD30ABC95D8
1B30D0FF47A011EDAEDD7CD30ABC95D8
1B30D0FF47A011EDAEDD7CD30ABC95D8
1B30D0FF47A011EDAEDD7CD30ABC95D8
1B30D0FF47A011EDAEDD7CD30ABC95D8
1B30D0FF47A011EDAEDD7CD30ABC95D8
1B30D0FF47A011EDAEDD7CD30ABC95D8
1B30D0FF47A011EDAEDD7CD30ABC95D8
1B30D0FF47A011EDAEDD7CD30ABC95D8
1B30D0FF47A011EDAEDD7CD30ABC95D8
1B30D0FF47A011EDAEDD7CD30ABC95D8
1B30D0FF47A011EDAEDD7CD30ABC95D8
1B30D0FF47A011EDAEDD7CD30ABC95D8
1B30D0FF47A011EDAEDD7CD30ABC95D8
1B30D0FF47A011EDAEDD7CD30ABC95D8
1B30D0FF47A011EDAEDD7CD30ABC95D8
1B30D0FF47A011EDAEDD7CD30ABC95D8
1B30D0FF47A011EDAEDD7CD30ABC95D8
1B30D0FF47A011EDAEDD7CD30ABC95D8
1B30D0FF47A011EDAEDD7CD30ABC95D8
1B30D0FF47A011EDAEDD7CD30ABC95D8
1B30D0FF47A011EDAEDD7CD30ABC95D8
1B30D0FF47A011EDAEDD7CD30ABC95D8
1B30D0FF47A011EDAEDD7CD30ABC95D8
1B30D0FF47A011EDAEDD7CD30ABC95D8
1B30D0FF47A011EDAEDD7CD30ABC95D8
1B30D0FF47A011EDAEDD7CD30ABC95D8
1B30D0FF47A011EDAEDD7CD30ABC95D8
1B30D0FF47A011EDAEDD7CD30ABC95D8
1B30D0FF47A011EDAEDD7CD30ABC95D8
1B30D0FF47A011EDAEDD7CD30ABC95D8
1B30D0FF47A011EDAEDD7CD30ABC95D8
1B30D0FF47A011EDAEDD7CD30ABC95D8
1B30D0FF47A011EDAEDD7CD30ABC95D8
1B30D0FF47A011EDAEDD7CD30ABC95D8
1B30D0FF47A011EDAEDD7CD30ABC95D8
1B30D0FF47A011EDAEDD7CD30ABC95D8
1B30D0FF47A011EDAEDD7CD30ABC95D8
1B30D0FF47A011EDAEDD7CD30ABC95D8
1B30D0FF47A011EDAEDD7CD30ABC95D8
1B30D0FF47A011EDAEDD7CD30ABC95D8
1B30D0FF47A011EDAEDD7CD30ABC95D8
1B30D0FF47A011EDAEDD7CD30ABC95D8
1B30D0FF47A011EDAEDD7CD30ABC95D8
1B30D0FF47A011EDAEDD7CD30ABC95D8
1B30D0FF47A011EDAEDD7CD30ABC95D8
1B30D0FF47A011EDAEDD7CD30ABC95D8
1B30D0FF47A011EDAEDD7CD30ABC95D8
1B30D0FF47A011EDAEDD7CD30ABC95D8
1B30D0FF47A011EDAEDD7CD30ABC95D8
1B30D0FF47A011EDAEDD7CD30ABC95D8
1B30D0FF47A011EDAEDD7CD30ABC95D8
1B30D0FF47A011EDAEDD7CD30ABC95D8
1B30D0FF47A011EDAEDD7CD30ABC95D8
1B30D0FF47A011EDAEDD7CD30ABC95D8
1B30D0FF47A011EDAEDD7CD30ABC95D8
1B30D0FF47A011EDAEDD7CD30ABC95D8
1B30D0FF47A011EDAEDD7CD30ABC95D8
1B30D0FF47A011EDAEDD7CD30ABC95D8
1B30D0FF47A011EDAEDD7CD30ABC95D8
1B30D0FF47A011EDAEDD7CD30ABC95D8
1B30D0FF47A011EDAEDD7CD30ABC95D8
1B30D0FF47A011EDAEDD7CD30ABC95D8
1B30D0FF47A011EDAEDD7CD30ABC95D8
1B30D0FF47A011EDAEDD7CD30ABC95D8
1B30D0FF47A011EDAEDD7CD30ABC95D8
1B30D0FF47A011EDAEDD7CD30ABC95D8
1B30D0FF47A011EDAEDD7CD30ABC95D8
1B30D0FF47A011EDAEDD7CD30ABC95D8
1B30D0FF47A011EDAEDD7CD30ABC95D8
1B30D0FF47A011EDAEDD7CD30ABC95D8
1B30D0FF47A011EDAEDD7CD30ABC95D8
1B30D0FF47A011EDAEDD7CD30ABC95D8
1B30D0FF47A011EDAEDD7CD30ABC95D8
1B30D0FF47A011EDAEDD7CD30ABC95D8
1B30D0FF47A011EDAEDD7CD30ABC95D8
1B30D0FF47A011EDAEDD7CD30ABC95D8
1B30D0FF47A011EDAEDD7CD30ABC95D8
1B30D0FF47A011EDAEDD7CD30ABC95D8
1B30D0FF47A011EDAEDD7CD30ABC95D8
1B30D0FF47A011EDAEDD7CD30ABC95D8
1B30D0FF47A011EDAEDD7CD30ABC95D8
1B30D0FF47A011EDAEDD7CD30ABC95D8
1B30D0FF47A011EDAEDD7CD30ABC95D8
1B30D0FF47A011EDAEDD7CD30ABC95D8
1B30D0FF47A011EDAEDD7CD30ABC95D8
1B30D0FF47A011EDAEDD7CD30ABC95D8
1B30D0FF47A011EDAEDD7CD30ABC95D8
1B30D0FF47A011EDAEDD7CD30ABC95D8
1B30D0FF47A011EDAEDD7CD30ABC95D8
1B30D0FF47A011EDAEDD7CD30ABC95D8
1B30D0FF47A011EDAEDD7CD30ABC95D8
1B30D0FF47A011EDAEDD7CD30ABC95D8
1B30D0FF47A011EDAEDD7CD30ABC95D8
1B30D0FF47A011EDAEDD7CD30ABC95D8
1B30D0FF47A011EDAEDD7CD30ABC95D8
1B30D0FF47A011EDAEDD7CD30ABC95D8
1B30D0FF47A011EDAEDD7CD30ABC95D8
1B30D0FF47A011EDAEDD7CD30ABC95D8
1B30D0FF47A011EDAEDD7CD30ABC95D8
1B30D0FF47A011EDAEDD7CD30ABC95D8
1B30D0FF47A011EDAEDD7CD30ABC95D8
1B30D0FF47A011EDAEDD7CD30ABC95D8
1B30D0FF47A011EDAEDD7CD30ABC95D8
1B30D0FF47A011EDAEDD7CD30ABC95D8
1B30D0FF47A011EDAEDD7CD30ABC95D8
1B30D0FF47A011EDAEDD7CD30ABC95D8
1B30D0FF47A011EDAEDD7CD30ABC95D8
1B30D0FF47A011EDAEDD7CD30ABC95D8
1B30D0FF47A011EDAEDD7CD30ABC95D8
1B30D0FF47A011EDAEDD7CD30ABC95D8
1B30D0FF47A011EDAEDD7CD30ABC95D8
1B30D0FF47A011EDAEDD7CD30ABC95D8
1B30D0FF47A011EDAEDD7CD30ABC95D8
1B30D0FF47A011EDAEDD7CD30ABC95D8
1B30D0FF47A011EDAEDD7CD30ABC95D8
1B30D0FF47A011EDAEDD7CD30ABC95D8
1B30D0FF47A011EDAEDD7CD30ABC95D8
1B30D0FF47A011EDAEDD7CD30ABC95D8
1B30D0FF47A011EDAEDD7CD30ABC95D8
1B30D0FF47A011EDAEDD7CD30ABC95D8
1B30D0FF47A011EDAEDD7CD30ABC95D8
1B30D0FF47A011EDAEDD7CD30ABC95D8
1B30D0FF47A011EDAEDD7CD30ABC95D8
1B30D0FF47A011EDAEDD7CD30ABC95D8
1B30D0FF47A011EDAEDD7CD30ABC95D8
1B30D0FF47A011EDAEDD7CD30ABC95D8
1B30D0FF47A011EDAEDD7CD30ABC95D8
1B30D0FF47A011EDAEDD7CD30ABC95D8
1B30D0FF47A011EDAEDD7CD30ABC95D8
1B30D0FF47A011EDAEDD7CD30ABC95D8
1B30D0FF47A011EDAEDD7CD30ABC95D8
1B30D0FF47A011EDAEDD7CD30ABC95D8
1B30D0FF47A011EDAEDD7CD30ABC95D8
1B30D0FF47A011EDAEDD7CD30ABC95D8
1B30D0FF47A011EDAEDD7CD30ABC95D8
1B30D0FF47A011EDAEDD7CD30ABC95D8
1B30D0FF47A011EDAEDD7CD30ABC95D8
1B30D0FF47A011EDAEDD7CD30ABC95D8
1B30D0FF47A011EDAEDD7CD30ABC95D8
1B30D0FF47A011EDAEDD7CD30ABC95D8
1B30D0FF47A011EDAEDD7CD30ABC95D8
1B30D0FF47A011EDAEDD7CD30ABC95D8
1B30D0FF47A011EDAEDD7CD30ABC95D8
1B30D0FF47A011EDAEDD7CD30ABC95D8
1B30D0FF47A011EDAEDD7CD30ABC95D8
1B30D0FF47A011EDAEDD7CD30ABC95D8
1B30D0FF47A011EDAEDD7CD30ABC95D8
1B30D0FF47A011EDAEDD7CD30ABC95D8
1B30D0FF47A011EDAEDD7CD30ABC95D8
1B30D0FF47A011EDAEDD7CD30ABC95D8
1B30D0FF47A011EDAEDD7CD30ABC95D8
1B30D0FF47A011EDAEDD7CD30ABC95D8
1B30D0FF47A011EDAEDD7CD30ABC95D8
1B30D0FF47A011EDAEDD7CD30ABC95D8
1B30D0FF47A011EDAEDD7CD30ABC95D8
1B30D0FF47A011EDAEDD7CD30ABC95D8
1B30D0FF47A011EDAEDD7CD30ABC95D8
1B30D0FF47A011EDAEDD7CD30ABC95D8
1B30D0FF47A011EDAEDD7CD30ABC95D8
1B30D0FF47A011EDAEDD7CD30ABC95D8
1B30D0FF47A011EDAEDD7CD30ABC95D8
1B30D0FF47A011EDAEDD7CD30ABC95D8
1B30D0FF47A011EDAEDD7CD30ABC95D8
1B30D0FF47A011EDAEDD7CD30ABC95D8
1B30D0FF47A011EDAEDD7CD30ABC95D8
1B30D0FF47A011EDAEDD7CD30ABC95D8
1B30D0FF47A011EDAEDD7CD30ABC95D8
1B30D0FF47A011EDAEDD7CD30ABC95D8
1B30D0FF47A011EDAEDD7CD30ABC95D8
1B30D0FF47A011EDAEDD7CD30ABC95D8
1B30D0FF47A011EDAEDD7CD30ABC95D8
1B30D0FF47A011EDAEDD7CD30ABC95D8
1B30D0FF47A011EDAEDD7CD30ABC95D8
1B30D0FF47A011EDAEDD7CD30ABC95D8
1B30D0FF47A011EDAEDD7CD30ABC95D8
1B30D0FF47A011EDAEDD7CD30ABC95D8
1B30D0FF47A011EDAEDD7CD30ABC95D8
1B30D0FF47A011EDAEDD7CD30ABC95D8
1B30D0FF47A011EDAEDD7CD30ABC95D8
1B30D0FF47A011EDAEDD7CD30ABC95D8
1B30D0FF47A011EDAEDD7CD30ABC95D8
1B30D0FF47A011EDAEDD7CD30ABC95D8
1B30D0FF47A011EDAEDD7CD30ABC95D8
1B30D0FF47A011EDAEDD7CD30ABC95D8
1B30D0FF47A011EDAEDD7CD30ABC95D8
1B30D0FF47A011EDAEDD7CD30ABC95D8
1B30D0FF47A011EDAEDD7CD30ABC95D8
1B30D0FF47A011EDAEDD7CD30ABC95D8
1B30D0FF47A011EDAEDD7CD30ABC95D8
1B30D0FF47A011EDAEDD7CD30ABC95D8
1B30D0FF47A011EDAEDD7CD30ABC95D8
1B30D0FF47A011EDAEDD7CD30ABC95D8
1B30D0FF47A011EDAEDD7CD30ABC95D8
1B30D0FF47A011EDAEDD7CD30ABC95D8
1B30D0FF47A011EDAEDD7CD30ABC95D8
1B30D0FF47A011EDAEDD7CD30ABC95D8
1B30D0FF47A011EDAEDD7CD30ABC95D8
1B30D0FF47A011EDAEDD7CD30ABC95D8
1B30D0FF47A011EDAEDD7CD30ABC95D8
1B30D0FF47A011EDAEDD7CD30ABC95D8
1B30D0FF47A011EDAEDD7CD30ABC95D8
1B30D0FF47A011EDAEDD7CD30ABC95D8
1B30D0FF47A011EDAEDD7CD30ABC95D8
1B30D0FF47A011EDAEDD7CD30ABC95D8
1B30D0FF47A011EDAEDD7CD30ABC95D8
1B30D0FF47A011EDAEDD7CD30ABC95D8
1B30D0FF47A011EDAEDD7CD30ABC95D8
1B30D0FF47A011EDAEDD7CD30ABC95D8
1B30D0FF47A011EDAEDD7CD30ABC95D8
1B30D0FF47A011EDAEDD7CD30ABC95D8
1B30D0FF47A011EDAEDD7CD30ABC95D8
1B30D0FF47A011EDAEDD7CD30ABC95D8
1B30D0FF47A011EDAEDD7CD30ABC95D8
1B30D0FF47A011EDAEDD7CD30ABC95D8
1B30D0FF47A011EDAEDD7CD30ABC95D8
1B30D0FF47A011EDAEDD7CD30ABC95D8
1B30D0FF47A011EDAEDD7CD30ABC95D8
1B30D0FF47A011EDAEDD7CD30ABC95D8
1B30D0FF47A011EDAEDD7CD30ABC95D8
1B30D0FF47A011EDAEDD7CD30ABC95D8
1B30D0FF47A011EDAEDD7CD30ABC95D8
1B30D0FF47A011EDAEDD7CD30ABC95D8
1B30D0FF47A011EDAEDD7CD30ABC95D8
1B30D0FF47A011EDAEDD7CD30ABC95D8
1B30D0FF47A011EDAEDD7CD30ABC95D8
1B30D0FF47A011EDAEDD7CD30ABC95D8
1B30D0FF47A011EDAEDD7CD30ABC95D8
1B30D0FF47A011EDAEDD7CD30ABC95D8
1B30D0FF47A011EDAEDD7CD30ABC95D8
1B30D0FF47A011EDAEDD7CD30ABC95D8
1B30D0FF47A011EDAEDD7CD30ABC95D8
1B30D0FF47A011EDAEDD7CD30ABC95D8
1B30D0FF47A011EDAEDD7CD30ABC95D8
1B30D0FF47A011EDAEDD7CD30ABC95D8
1B30D0FF47A011EDAEDD7CD30ABC95D8
1B30D0FF47A011EDAEDD7CD30ABC95D8
1B30D0FF47A011EDAEDD7CD30ABC95D8
1B30D0FF47A011EDAEDD7CD30ABC95D8
1B30D0FF47A011EDAEDD7CD30ABC95D8
1B30D0FF47A011EDAEDD7CD30ABC95D8
1B30D0FF47A011EDAEDD7CD30ABC95D8
1B30D0FF47A011EDAEDD7CD30ABC95D8
1B30D0FF47A011EDAEDD7CD30ABC95D8
1B30D0FF47A011EDAEDD7CD30ABC95D8
1B30D0FF47A011EDAEDD7CD30ABC95D8
1B30D0FF47A011EDAEDD7CD30ABC95D8
1B30D0FF47A011EDAEDD7CD30ABC95D8
1B30D0FF47A011EDAEDD7CD30ABC95D8
1B30D0FF47A011EDAEDD7CD30ABC95D8
1B30D0FF47A011EDAEDD7CD30ABC95D8
1B30D0FF47A011EDAEDD7CD30ABC95D8
1B30D0FF47A011EDAEDD7CD30ABC95D8
1B30D0FF47A011EDAEDD7CD30ABC95D8
1B30D0FF47A011EDAEDD7CD30ABC95D8
1B30D0FF47A011EDAEDD7CD30ABC95D8
1B30D0FF47A011EDAEDD7CD30ABC95D8
1B30D0FF47A011EDAEDD7CD30ABC95D8
1B30D0FF47A011EDAEDD7CD30ABC95D8
1B30D0FF47A011EDAEDD7CD30ABC95D8
1B30D0FF47A011EDAEDD7CD30ABC95D8
1B30D0FF47A011EDAEDD7CD30ABC95D8
1B30D0FF47A011EDAEDD7CD30ABC95D8
1B30D0FF47A011EDAEDD7CD30ABC95D8
1B30D0FF47A011EDAEDD7CD30ABC95D8
1B30D0FF47A011EDAEDD7CD30ABC95D8
1B30D0FF47A011EDAEDD7CD30ABC95D8
1B30D0FF47A011EDAEDD7CD30ABC95D8
1B30D0FF47A011EDAEDD7CD30ABC95D8
1B30D0FF47A011EDAEDD7CD30ABC95D8
1B30D0FF47A011EDAEDD7CD30ABC95D8
1B30D0FF47A011EDAEDD7CD30ABC95D8
1B30D0FF47A011EDAEDD7CD30ABC95D8
1B30D0FF47A011EDAEDD7CD30ABC95D8
1B30D0FF47A011EDAEDD7CD30ABC95D8
1B30D0FF47A011EDAEDD7CD30ABC95D8
1B30D0FF47A011EDAEDD7CD30ABC95D8
1B30D0FF47A011EDAEDD7CD30ABC95D8
1B30D0FF47A011EDAEDD7CD30ABC95D8
1B30D0FF47A011EDAEDD7CD30ABC95D8
1B30D0FF47A011EDAEDD7CD30ABC95D8
1B30D0FF47A011EDAEDD7CD30ABC95D8
1B30D0FF47A011EDAEDD7CD30ABC95D8
1B30D0FF47A011EDAEDD7CD30ABC95D8
1B30D0FF47A011EDAEDD7CD30ABC95D8
1B30D0FF47A011EDAEDD7CD30ABC95D8
1B30D0FF47A011EDAEDD7CD30ABC95D8
1B30D0FF47A011EDAEDD7CD30ABC95D8
1B30D0FF47A011EDAEDD7CD30ABC95D8
1B30D0FF47A011EDAEDD7CD30ABC95D8
1B30D0FF47A011EDAEDD7CD30ABC95D8
1B30D0FF47A011EDAEDD7CD30ABC95D8
1B30D0FF47A011EDAEDD7CD30ABC95D8
1B30D0FF47A011EDAEDD7CD30ABC95D8
1B30D0FF47A011EDAEDD7CD30ABC95D8
1B30D0FF47A011EDAEDD7CD30ABC95D8
1B30D0FF47A011EDAEDD7CD30ABC95D8
1B30D0FF47A011EDAEDD7CD30ABC95D8
1B30D0FF47A011EDAEDD7CD30ABC95D8
1B30D0FF47A011EDAEDD7CD30ABC95D8
1B30D0FF47A011EDAEDD7CD30ABC95D8
1B30D0FF47A011EDAEDD7CD30ABC95D8
1B30D0FF47A011EDAEDD7CD30ABC95D8
1B30D0FF47A011EDAEDD7CD30ABC95D8
1B30D0FF47A011EDAEDD7CD30ABC95D8
1B30D0FF47A011EDAEDD7CD30ABC95D8
1B30D0FF47A011EDAEDD7CD30ABC95D8
1B30D0FF47A011EDAEDD7CD30ABC95D8
1B30D0FF47A011EDAEDD7CD30ABC95D8
1B30D0FF47A011EDAEDD7CD30ABC95D8
1B30D0FF47A011EDAEDD7CD30ABC95D8
1B30D0FF47A011EDAEDD7CD30ABC95D8
1B30D0FF47A011EDAEDD7CD30ABC95D8
1B30D0FF47A011EDAEDD7CD30ABC95D8
1B30D0FF47A011EDAEDD7CD30ABC95D8
1B30D0FF47A011EDAEDD7CD30ABC95D8
1B30D0FF47A011EDAEDD7CD30ABC95D8
1B30D0FF47A011EDAEDD7CD30ABC95D8
1B30D0FF47A011EDAEDD7CD30ABC95D8
1B30D0FF47A011EDAEDD7CD30ABC95D8
1B30D0FF47A011EDAEDD7CD30ABC95D8
1B30D0FF47A011EDAEDD7CD30ABC95D8
1B30D0FF47A011EDAEDD7CD30ABC95D8
1B30D0FF47A011EDAEDD7CD30ABC95D8
1B30D0FF47A011EDAEDD7CD30ABC95D8
1B30D0FF47A011EDAEDD7CD30ABC95D8
1B30D0FF47A011EDAEDD7CD30ABC95D8
1B30D0FF47A011EDAEDD7CD30ABC95D8
1B30D0FF47A011EDAEDD7CD30ABC95D8
1B30D0FF47A011EDAEDD7CD30ABC95D8
1B30D0FF47A011EDAEDD7CD30ABC95D8
1B30D0FF47A011EDAEDD7CD30ABC95D8
1B30D0FF47A011EDAEDD7CD30ABC95D8
1B30D0FF47A011EDAEDD7CD30ABC95D8
1B30D0FF47A011EDAEDD7CD30ABC95D8
1B30D0FF47A011EDAEDD7CD30ABC95D8
1B30D0FF47A011EDAEDD7CD30ABC95D8
1B30D0FF47A011EDAEDD7CD30ABC95D8
1B30D0FF47A011EDAEDD7CD30ABC95D8
1B30D0FF47A011EDAEDD7CD30ABC95D8
1B30D0FF47A011EDAEDD7CD30ABC95D8
1B30D0FF47A011EDAEDD7CD30ABC95D8
1B30D0FF47A011EDAEDD7CD30ABC95D8
1B30D0FF47A011EDAEDD7CD30ABC95D8
1B30D0FF47A011EDAEDD7CD30ABC95D8
1B30D0FF47A011EDAEDD7CD30ABC95D8
1B30D0FF47A011EDAEDD7CD30ABC95D8
1B30D0FF47A011EDAEDD7CD30ABC95D8
1B30D0FF47A011EDAEDD7CD30ABC95D8
1B30D0FF47A011EDAEDD7CD30ABC95D8
1B30D0FF47A011EDAEDD7CD30ABC95D8
1B30D0FF47A011EDAEDD7CD30ABC95D8
1B30D0FF47A011EDAEDD7CD30ABC95D8
1B30D0FF47A011EDAEDD7CD30ABC95D8
1B30D0FF47A011EDAEDD7CD30ABC95D8
1B30D0FF47A011EDAEDD7CD30ABC95D8
1B30D0FF47A011EDAEDD7CD30ABC95D8
1B30D0FF47A011EDAEDD7CD30ABC95D8
1B30D0FF47A011EDAEDD7CD30ABC95D8
1B30D0FF47A011EDAEDD7CD30ABC95D8
1B30D0FF47A011EDAEDD7CD30ABC95D8
1B30D0FF47A011EDAEDD7CD30ABC95D8
1B30D0FF47A011EDAEDD7CD30ABC95D8
1B30D0FF47A011EDAEDD7CD30ABC95D8
1B30D0FF47A011EDAEDD7CD30ABC95D8
1B30D0FF47A011EDAEDD7CD30ABC95D8
1B30D0FF47A011EDAEDD7CD30ABC95D8
1B30D0FF47A011EDAEDD7CD30ABC95D8
1B30D0FF47A011EDAEDD7CD30ABC95D8
1B30D0FF47A011EDAEDD7CD30ABC95D8
1B30D0FF47A011EDAEDD7CD30ABC95D8
1B30D0FF47A011EDAEDD7CD30ABC95D8
1B30D0FF47A011EDAEDD7CD30ABC95D8
1B30D0FF47A011EDAEDD7CD30ABC95D8
1B30D0FF47A011EDAEDD7CD30ABC95D8
1B30D0FF47A011EDAEDD7CD30ABC95D8
1B30D0FF47A011EDAEDD7CD30ABC95D8
1B30D0FF47A011EDAEDD7CD30ABC95D8
1B30D0FF47A011EDAEDD7CD30ABC95D8
1B30D0FF47A011EDAEDD7CD30ABC95D8
1B30D0FF47A011EDAEDD7CD30ABC95D8
1B30D0FF47A011EDAEDD7CD30ABC95D8
1B30D0FF47A011EDAEDD7CD30ABC95D8
1B30D0FF47A011EDAEDD7CD30ABC95D8
1B30D0FF47A011EDAEDD7CD30ABC95D8
1B30D0FF47A011EDAEDD7CD30ABC95D8
1B30D0FF47A011EDAEDD7CD30ABC95D8
1B30D0FF47A011EDAEDD7CD30ABC95D8
1B30D0FF47A011EDAEDD7CD30ABC95D8
1B30D0FF47A011EDAEDD7CD30ABC95D8
1B30D0FF47A011EDAEDD7CD30ABC95D8
1B30D0FF47A011EDAEDD7CD30ABC95D8
1B30D0FF47A011EDAEDD7CD30ABC95D8
1B30D0FF47A011EDAEDD7CD30ABC95D8
1B30D0FF47A011EDAEDD7CD30ABC95D8
1B30D0FF47A011EDAEDD7CD30ABC95D8
1B30D0FF47A011EDAEDD7CD30ABC95D8
1B30D0FF47A011EDAEDD7CD30ABC95D8
1B30D0FF47A011EDAEDD7CD30ABC95D8
1B30D0FF47A011EDAEDD7CD30ABC95D8
1B30D0FF47A011EDAEDD7CD30ABC95D8
1B30D0FF47A011EDAEDD7CD30ABC95D8
1B30D0FF47A011EDAEDD7CD30ABC95D8
1B30D0FF47A011EDAEDD7CD30ABC95D8
1B30D0FF47A011EDAEDD7CD30ABC95D8
1B30D0FF47A011EDAEDD7CD30ABC95D8
1B30D0FF47A011EDAEDD7CD30ABC95D8
1B30D0FF47A011EDAEDD7CD30ABC95D8
1B30D0FF47A011EDAEDD7CD30ABC95D8
1B30D0FF47A011EDAEDD7CD30ABC95D8
1B30D0FF47A011EDAEDD7CD30ABC95D8
1B30D0FF47A011EDAEDD7CD30ABC95D8
1B30D0FF47A011EDAEDD7CD30ABC95D8
1B30D0FF47A011EDAEDD7CD30ABC95D8
1B30D0FF47A011EDAEDD7CD30ABC95D8
1B30D0FF47A011EDAEDD7CD30ABC95D8
1B30D0FF47A011EDAEDD7CD30ABC95D8
1B30D0FF47A011EDAEDD7CD30ABC95D8
1B30D0FF47A011EDAEDD7CD30ABC95D8
1B30D0FF47A011EDAEDD7CD30ABC95D8
1B30D0FF47A011EDAEDD7CD30ABC95D8
1B30D0FF47A011EDAEDD7CD30ABC95D8
1B30D0FF47A011EDAEDD7CD30ABC95D8
1B30D0FF47A011EDAEDD7CD30ABC95D8
1B30D0FF47A011EDAEDD7CD30ABC95D8
1B30D0FF47A011EDAEDD7CD30ABC95D8
1B30D0FF47A011EDAEDD7CD30ABC95D8
1B30D0FF47A011EDAEDD7CD30ABC95D8
1B30D0FF47A011EDAEDD7CD30ABC95D8
1B30D0FF47A011EDAEDD7CD30ABC95D8
1B30D0FF47A011EDAEDD7CD30ABC95D8
1B30D0FF47A011EDAEDD7CD30ABC95D8
1B30D0FF47A011EDAEDD7CD30ABC95D8
1B30D0FF47A011EDAEDD7CD30ABC95D8
1B30D0FF47A011EDAEDD7CD30ABC95D8
1B30D0FF47A011EDAEDD7CD30ABC95D8
1B30D0FF47A011EDAEDD7CD30ABC95D8
1B30D0FF47A011EDAEDD7CD30ABC95D8
1B30D0FF47A011EDAEDD7CD30ABC95D8
1B30D0FF47A011EDAEDD7CD30ABC95D8
1B30D0FF47A011EDAEDD7CD30ABC95D8
1B30D0FF47A011EDAEDD7CD30ABC95D8
1B30D0FF47A011EDAEDD7CD30ABC95D8
1B30D0FF47A011EDAEDD7CD30ABC95D8
1B30D0FF47A011EDAEDD7CD30ABC95D8
1B30D0FF47A011EDAEDD7CD30ABC95D8
1B30D0FF47A011EDAEDD7CD30ABC95D8
1B30D0FF47A011EDAEDD7CD30ABC95D8
1B30D0FF47A011EDAEDD7CD30ABC95D8
1B30D0FF47A011EDAEDD7CD30ABC95D8
1B30D0FF47A011EDAEDD7CD30ABC95D8
1B30D0FF47A011EDAEDD7CD30ABC95D8
1B30D0FF47A011EDAEDD7CD30ABC95D8
1B30D0FF47A011EDAEDD7CD30ABC95D8
1B30D0FF47A011EDAEDD7CD30ABC95D8
1B30D0FF47A011EDAEDD7CD30ABC95D8
1B30D0FF47A011EDAEDD7CD30ABC95D8
1B30D0FF47A011EDAEDD7CD30ABC95D8
1B30D0FF47A011EDAEDD7CD30ABC95D8
1B30D0FF47A011EDAEDD7CD30ABC95D8
1B30D0FF47A011EDAEDD7CD30ABC95D8
1B30D0FF47A011EDAEDD7CD30ABC95D8
1B30D0FF47A011EDAEDD7CD30ABC95D8
1B30D0FF47A011EDAEDD7CD30ABC95D8
1B30D0FF47A011EDAEDD7CD30ABC95D8
1B30D0FF47A011EDAEDD7CD30ABC95D8
1B30D0FF47A011EDAEDD7CD30ABC95D8
1B30D0FF47A011EDAEDD7CD30ABC95D8
1B30D0FF47A011EDAEDD7CD30ABC95D8
1B30D0FF47A011EDAEDD7CD30ABC95D8
1B30D0FF47A011EDAEDD7CD30ABC95D8
1B30D0FF47A011EDAEDD7CD30ABC95D8
1B30D0FF47A011EDAEDD7CD30ABC95D8
1B30D0FF47A011EDAEDD7CD30ABC95D8
1B30D0FF47A011EDAEDD7CD30ABC95D8
1B30D0FF47A011EDAEDD7CD30ABC95D8
1B30D0FF47A011EDAEDD7CD30ABC95D8
1B30D0FF47A011EDAEDD7CD30ABC95D8
1B30D0FF47A011EDAEDD7CD30ABC95D8
1B30D0FF47A011EDAEDD7CD30ABC95D8
1B30D0FF47A011EDAEDD7CD30ABC95D8
1B30D0FF47A011EDAEDD7CD30ABC95D8
1B30D0FF47A011EDAEDD7CD30ABC95D8
1B30D0FF47A011EDAEDD7CD30ABC95D8
1B30D0FF47A011EDAEDD7CD30ABC95D8
1B30D0FF47A011EDAEDD7CD30ABC95D8
1B30D0FF47A011EDAEDD7CD30ABC95D8
1B30D0FF47A011EDAEDD7CD30ABC95D8
1B30D0FF47A011EDAEDD7CD30ABC95D8
1B30D0FF47A011EDAEDD7CD30ABC95D8
1B30D0FF47A011EDAEDD7CD30ABC95D8
1B30D0FF47A011EDAEDD7CD30ABC95D8
1B30D0FF47A011EDAEDD7CD30ABC95D8
1B30D0FF47A011EDAEDD7CD30ABC95D8
1B30D0FF47A011EDAEDD7CD30ABC95D8
1B30D0FF47A011EDAEDD7CD30ABC95D8
1B30D0FF47A011EDAEDD7CD30ABC95D8
1B30D0FF47A011EDAEDD7CD30ABC95D8
1B30D0FF47A011EDAEDD7CD30ABC95D8
1B30D0FF47A011EDAEDD7CD30ABC95D8
1B30D0FF47A011EDAEDD7CD30ABC95D8
1B30D0FF47A011EDAEDD7CD30ABC95D8
1B30D0FF47A011EDAEDD7CD30ABC95D8
1B30D0FF47A011EDAEDD7CD30ABC95D8
1B30D0FF47A011EDAEDD7CD30ABC95D8
1B30D0FF47A011EDAEDD7CD30ABC95D8
1B30D0FF47A011EDAEDD7CD30ABC95D8
1B30D0FF47A011EDAEDD7CD30ABC95D8
1B30D0FF47A011EDAEDD7CD30ABC95D8
1B30D0FF47A011EDAEDD7CD30ABC95D8
1B30D0FF47A011EDAEDD7CD30ABC95D8
1B30D0FF47A011EDAEDD7CD30ABC95D8
1B30D0FF47A011EDAEDD7CD30ABC95D8
1B30D0FF47A011EDAEDD7CD30ABC95D8
1B30D0FF47A011EDAEDD7CD30ABC95D8
1B30D0FF47A011EDAEDD7CD30ABC95D8
1B30D0FF47A011EDAEDD7CD30ABC95D8
1B30D0FF47A011EDAEDD7CD30ABC95D8
1B30D0FF47A011EDAEDD7CD30ABC95D8
1B30D0FF47A011EDAEDD7CD30ABC95D8
1B30D0FF47A011EDAEDD7CD30ABC95D8
1B30D0FF47A011EDAEDD7CD30ABC95D8
1B30D0FF47A011EDAEDD7CD30ABC95D8
1B30D0FF47A011EDAEDD7CD30ABC95D8
1B30D0FF47A011EDAEDD7CD30ABC95D8
1B30D0FF47A011EDAEDD7CD30ABC95D8
1B30D0FF47A011EDAEDD7CD30ABC95D8
1B30D0FF47A011EDAEDD7CD30ABC95D8
1B30D0FF47A011EDAEDD7CD30ABC95D8
1B30D0FF47A011EDAEDD7CD30ABC95D8
1B30D0FF47A011EDAEDD7CD30ABC95D8
1B30D0FF47A011EDAEDD7CD30ABC95D8
1B30D0FF47A011EDAEDD7CD30ABC95D8
1B30D0FF47A011EDAEDD7CD30ABC95D8
1B30D0FF47A011EDAEDD7CD30ABC95D8
1B30D0FF47A011EDAEDD7CD30ABC95D8
1B30D0FF47A011EDAEDD7CD30ABC95D8
1B30D0FF47A011EDAEDD7CD30ABC95D8
1B30D0FF47A011EDAEDD7CD30ABC95D8
1B30D0FF47A011EDAEDD7CD30ABC95D8
1B30D0FF47A011EDAEDD7CD30ABC95D8
1B30D0FF47A011EDAEDD7CD30ABC95D8
1B30D0FF47A011EDAEDD7CD30ABC95D8
1B30D0FF47A011EDAEDD7CD30ABC95D8
1B30D0FF47A011EDAEDD7CD30ABC95D8
1B30D0FF47A011EDAEDD7CD30ABC95D8
1B30D0FF47A011EDAEDD7CD30ABC95D8
1B30D0FF47A011EDAEDD7CD30ABC95D8
1B30D0FF47A011EDAEDD7CD30ABC95D8
1B30D0FF47A011EDAEDD7CD30ABC95D8
1B30D0FF47A011EDAEDD7CD30ABC95D8
1B30D0FF47A011EDAEDD7CD30ABC95D8
1B30D0FF47A011EDAEDD7CD30ABC95D8
1B30D0FF47A011EDAEDD7CD30ABC95D8
1B30D0FF47A011EDAEDD7CD30ABC95D8
1B30D0FF47A011EDAEDD7CD30ABC95D8
1B30D0FF47A011EDAEDD7CD30ABC95D8
1B30D0FF47A011EDAEDD7CD30ABC95D8
1B30D0FF47A011EDAEDD7CD30ABC95D8
1B30D0FF47A011EDAEDD7CD30ABC95D8
1B30D0FF47A011EDAEDD7CD30ABC95D8
1B30D0FF47A011EDAEDD7CD30ABC95D8
1B30D0FF47A011EDAEDD7CD30ABC95D8
1B30D0FF47A011EDAEDD7CD30ABC95D8
1B30D0FF47A011EDAEDD7CD30ABC95D8
1B30D0FF47A011EDAEDD7CD30ABC95D8
1B30D0FF47A011EDAEDD7CD30ABC95D8
1B30D0FF47A011EDAEDD7CD30ABC95D8
1B30D0FF47A011EDAEDD7CD30ABC95D8
1B30D0FF47A011EDAEDD7CD30ABC95D8
1B30D0FF47A011EDAEDD7CD30ABC95D8
1B30D0FF47A011EDAEDD7CD30ABC95D8
1B30D0FF47A011EDAEDD7CD30ABC95D8
1B30D0FF47A011EDAEDD7CD30ABC95D8
1B30D0FF47A011EDAEDD7CD30ABC95D8
1B30D0FF47A011EDAEDD7CD30ABC95D8
1B30D0FF47A011EDAEDD7CD30ABC95D8
1B30D0FF47A011EDAEDD7CD30ABC95D8
1B30D0FF47A011EDAEDD7CD30ABC95D8
1B30D0FF47A011EDAEDD7CD30ABC95D8
1B30D0FF47A011EDAEDD7CD30ABC95D8
1B30D0FF47A011EDAEDD7CD30ABC95D8
1B30D0FF47A011EDAEDD7CD30ABC95D8
1B30D0FF47A011EDAEDD7CD30ABC95D8
1B30D0FF47A011EDAEDD7CD30ABC95D8
1B30D0FF47A011EDAEDD7CD30ABC95D8
1B30D0FF47A011EDAEDD7CD30ABC95D8
1B30D0FF47A011EDAEDD7CD30ABC95D8
1B30D0FF47A011EDAEDD7CD30ABC95D8
1B30D0FF47A011EDAEDD7CD30ABC95D8
1B30D0FF47A011EDAEDD7CD30ABC95D8
1B30D0FF47A011EDAEDD7CD30ABC95D8
1B30D0FF47A011EDAEDD7CD30ABC95D8
1B30D0FF47A011EDAEDD7CD30ABC95D8
1B30D0FF47A011EDAEDD7CD30ABC95D8
1B30D0FF47A011EDAEDD7CD30ABC95D8
1B30D0FF47A011EDAEDD7CD30ABC95D8
1B30D0FF47A011EDAEDD7CD30ABC95D8
1B30D0FF47A011EDAEDD7CD30ABC95D8
1B30D0FF47A011EDAEDD7CD30ABC95D8
1B30D0FF47A011EDAEDD7CD30ABC95D8
1B30D0FF47A011EDAEDD7CD30ABC95D8
1B30D0FF47A011EDAEDD7CD30ABC95D8
1B30D0FF47A011EDAEDD7CD30ABC95D8
1B30D0FF47A011EDAEDD7CD30ABC95D8
1B30D0FF47A011EDAEDD7CD30ABC95D8
1B30D0FF47A011EDAEDD7CD30ABC95D8
1B30D0FF47A011EDAEDD7CD30ABC95D8
1B30D0FF47A011EDAEDD7CD30ABC95D8
1B30D0FF47A011EDAEDD7CD30ABC95D8
1B30D0FF47A011EDAEDD7CD30ABC95D8
1B30D0FF47A011EDAEDD7CD30ABC95D8
1B30D0FF47A011EDAEDD7CD30ABC95D8
1B30D0FF47A011EDAEDD7CD30ABC95D8
1B30D0FF47A011EDAEDD7CD30ABC95D8
1B30D0FF47A011EDAEDD7CD30ABC95D8
1B30D0FF47A011EDAEDD7CD30ABC95D8
1B30D0FF47A011EDAEDD7CD30ABC95D8
1B30D0FF47A011EDAEDD7CD30ABC95D8
1B30D0FF47A011EDAEDD7CD30ABC95D8
1B30D0FF47A011EDAEDD7CD30ABC95D8
1B30D0FF47A011EDAEDD7CD30ABC95D8
1B30D0FF47A011EDAEDD7CD30ABC95D8
1B30D0FF47A011EDAEDD7CD30ABC95D8
1B30D0FF47A011EDAEDD7CD30ABC95D8
1B30D0FF47A011EDAEDD7CD30ABC95D8
1B30D0FF47A011EDAEDD7CD30ABC95D8
1B30D0FF47A011EDAEDD7CD30ABC95D8
1B30D0FF47A011EDAEDD7CD30ABC95D8
1B30D0FF47A011EDAEDD7CD30ABC95D8
1B30D0FF47A011EDAEDD7CD30ABC95D8
1B30D0FF47A011EDAEDD7CD30ABC95D8
1B30D0FF47A011EDAEDD7CD30ABC95D8
1B30D0FF47A011EDAEDD7CD30ABC95D8
1B30D0FF47A011EDAEDD7CD30ABC95D8
1B30D0FF47A011EDAEDD7CD30ABC95D8
drop PROCEDURE procedure_1;
drop table test1;
#function-10-1   存储过程=====>if条件语句
drop table test1;
drop table test2;
drop table test3;
create table test1(uuid1 varchar(50));
create table test2(uuid2 varchar(50));
create table test3(uuid3 varchar(50));
drop procedure procedure_1;
create procedure procedure_1(aa int,bb int)
begin
if aa = bb then
insert into test1 values(hex(uuid_to_bin('972d531f-47a1-11ed-aedd-7cd30abc95d8')));
insert into test1 values(hex(uuid_to_bin('972d531f-47a1-11ed-aedd-7cd30abc95d8',-3)));
insert into test1 values(hex(uuid_to_bin('972d531f-47a1-11ed-aedd-7cd30abc95d8',9)));
insert into test1 values(hex(uuid_to_bin('972d531f-47a1-11ed-aedd-7cd30abc95d8',9.5)));
elseif aa > bb then
insert into test2 values(hex(uuid_to_bin('e6c39b4d-47a1-11ed-aedd-7cd30abc95d8')));
insert into test2 values(hex(uuid_to_bin('e6c39b4d-47a1-11ed-aedd-7cd30abc95d8',-3)));
insert into test2 values(hex(uuid_to_bin('e6c39b4d-47a1-11ed-aedd-7cd30abc95d8',9)));
insert into test2 values(hex(uuid_to_bin('e6c39b4d-47a1-11ed-aedd-7cd30abc95d8',9.5)));
else
insert into test3 values(hex(uuid_to_bin('054818d4-47a2-11ed-aedd-7cd30abc95d8')));
insert into test3 values(hex(uuid_to_bin('054818d4-47a2-11ed-aedd-7cd30abc95d8',-3)));
insert into test3 values(hex(uuid_to_bin('054818d4-47a2-11ed-aedd-7cd30abc95d8',9)));
insert into test3 values(hex(uuid_to_bin('054818d4-47a2-11ed-aedd-7cd30abc95d8',9.5)));
end if;
end;
/
call procedure_1(1,3);
select * from test3 order by uuid3 asc;
uuid3
054818D447A211EDAEDD7CD30ABC95D8
11ED47A2054818D4AEDD7CD30ABC95D8
11ED47A2054818D4AEDD7CD30ABC95D8
11ED47A2054818D4AEDD7CD30ABC95D8
call procedure_1(3,3);
select * from test1 order by uuid1 asc;
uuid1
11ED47A1972D531FAEDD7CD30ABC95D8
11ED47A1972D531FAEDD7CD30ABC95D8
11ED47A1972D531FAEDD7CD30ABC95D8
972D531F47A111EDAEDD7CD30ABC95D8
call procedure_1(3,1);
select * from test2 order by uuid2 asc;
uuid2
11ED47A1E6C39B4DAEDD7CD30ABC95D8
11ED47A1E6C39B4DAEDD7CD30ABC95D8
11ED47A1E6C39B4DAEDD7CD30ABC95D8
E6C39B4D47A111EDAEDD7CD30ABC95D8
drop procedure procedure_1;
drop table test1;
drop table test2;
drop table test3;
#function-10-2   函数=====>while循环
drop table test1;
create table test1(id int,h1 varchar(50));
insert into test1 values(1,hex(uuid_to_bin('8b40c560-47a5-11ed-aedd-7cd30abc95d8')));
insert into test1 values(1,hex(uuid_to_bin('8b40c560-47a5-11ed-aedd-7cd30abc95d8',0.5)));
select * from test1 order by id asc;
id	h1
1	8B40C56047A511EDAEDD7CD30ABC95D8
1	11ED47A58B40C560AEDD7CD30ABC95D8
drop FUNCTION FUNCTION_1;
CREATE FUNCTION FUNCTION_1() RETURNS int
BEGIN
DECLARE v1 decimal(50,1) DEFAULT 20;
WHILE v1<30 DO
UPDATE test1 SET h1=h1+9 where id=hex(uuid_to_bin('8b40c560-47a5-11ed-aedd-7cd30abc95d8',0.5));
SET v1=v1+5;
END WHILE;
RETURN hex(uuid_to_bin('8b40c560-47a5-11ed-aedd-7cd30abc95d8',0.5));
END;
/
select function_1();
drop FUNCTION FUNCTION_1;
CREATE FUNCTION FUNCTION_1() RETURNS varchar(100)
BEGIN
DECLARE v1 decimal(20,1) DEFAULT 10;
WHILE v1<30 DO
UPDATE test1 SET h1=hex(uuid_to_bin('8b40c560-47a5-11ed-aedd-7cd30abc95d8',2));
SET v1=v1+5;
END WHILE;
RETURN hex(uuid_to_bin('8b40c560-47a5-11ed-aedd-7cd30abc95d8',0.5));
END;
/
select function_1();
function_1()
11ED47A58B40C560AEDD7CD30ABC95D8
drop FUNCTION FUNCTION_1;
drop table test1;
#function-10-2   函数=====>repeat循环
drop table test1;
create table test1(id int,h1 varchar(50));
insert into test1 values(1,hex(uuid_to_bin('8b40c560-47a5-11ed-aedd-7cd30abc95d8')));
insert into test1 values(1,hex(uuid_to_bin('8b40c560-47a5-11ed-aedd-7cd30abc95d8',0.5)));
select * from test1 order by id asc;
id	h1
1	8B40C56047A511EDAEDD7CD30ABC95D8
1	11ED47A58B40C560AEDD7CD30ABC95D8
CREATE FUNCTION function_1() RETURNS varchar(50)
begin
declare i varchar(50);
set i = 1;
repeat
update test1 set h1=h1+10;
set i = i + 1;
until i > 50 end repeat;
RETURN hex(uuid_to_bin('8b40c560-47a5-11ed-aedd-7cd30abc95d8',99));
end;
/
select function_1();
ERROR 01000: Data truncated for column 'h1' at row 1
drop FUNCTION FUNCTION_1;
drop table test1;
#function-10-2   函数=====>loop循环
drop table test1;
create table test1(id int,h1 varchar(50));
insert into test1 values(1,3);
insert into test1 values(1,5);
select * from test1 order by id asc;
id	h1
1	3
1	5
drop function function_1;
CREATE FUNCTION function_1() RETURNS varchar(50)
BEGIN
DECLARE i int DEFAULT 2;
loop1:LOOP
IF i<0 THEN
UPDATE test1 SET h1=h1+1 where id<15;
LEAVE loop1;
END IF;
SET i = i-2;
END LOOP;
RETURN hex(uuid_to_bin('8b40c560-47a5-11ed-aedd-7cd30abc95d8',null));
END;
/
select function_1();
function_1()
8B40C56047A511EDAEDD7CD30ABC95D8
drop FUNCTION FUNCTION_1;
drop table test1;
#function-10-3   触发器=====>insert
drop table test1;
drop table test2;
create table test1(c1 int PRIMARY key AUTO_INCREMENT,c2 bigint(30));
create table test2(c1 int PRIMARY key AUTO_INCREMENT,c2 varchar(50));
insert into test1(c2) values(2),(4),(6);
select * from test1 order by c1 asc;
c1	c2
1	2
2	4
3	6
drop TRIGGER TRIGGER_1;
CREATE TRIGGER TRIGGER_1 BEFORE insert ON test1
FOR EACH ROW
BEGIN
insert into test2(c2) values(hex(uuid_to_bin('8b40c560-47a5-11ed-aedd-7cd30abc95d8')));
insert into test2(c2) values(hex(uuid_to_bin('8b40c560-47a5-11ed-aedd-7cd30abc95d8',66)));
insert into test2(c2) values(hex(uuid_to_bin('8b40c560-47a5-11ed-aedd-7cd30abc95d8',-2)));
insert into test2(c2) values(hex(uuid_to_bin('8b40c560-47a5-11ed-aedd-7cd30abc95d8',null)));
END
/
select * from test1 order by c1 asc;
c1	c2
1	2
2	4
3	6
select * from test2 order by c1 asc;
c1	c2
insert into test1(c2) values(7);
select * from test1 order by c1 asc;
c1	c2
1	2
2	4
3	6
4	7
select * from test2 order by c1 asc;
c1	c2
1	8B40C56047A511EDAEDD7CD30ABC95D8
2	11ED47A58B40C560AEDD7CD30ABC95D8
3	11ED47A58B40C560AEDD7CD30ABC95D8
4	8B40C56047A511EDAEDD7CD30ABC95D8
#function-10-3   触发器=====>update
drop table test1;
drop table test2;
create table test1(c1 int PRIMARY key AUTO_INCREMENT,c2 bigint(30));
create table test2(c1 int PRIMARY key AUTO_INCREMENT,c2 varchar(50));
insert into test2(c2) values(hex(uuid_to_bin('8b40c560-47a5-11ed-aedd-7cd30abc95d8')));
insert into test1(c2) values(2),(4),(6);
select * from test1 order by c1 asc;
c1	c2
1	2
2	4
3	6
drop TRIGGER TRIGGER_1;
CREATE TRIGGER TRIGGER_1 BEFORE update ON test1
FOR EACH ROW
BEGIN
update test2 set c2=hex(uuid_to_bin('8b40c560-47a5-11ed-aedd-7cd30abc95d8',66)) where c2=hex(uuid_to_bin('8b40c560-47a5-11ed-aedd-7cd30abc95d8'));
update test2 set c2=hex(uuid_to_bin('8b40c560-47a5-11ed-aedd-7cd30abc95d8',-6)) where c2=hex(uuid_to_bin('8b40c560-47a5-11ed-aedd-7cd30abc95d8',66));
update test2 set c2=hex(uuid_to_bin('8b40c560-47a5-11ed-aedd-7cd30abc95d8',0.5)) where c2=hex(uuid_to_bin('8b40c560-47a5-11ed-aedd-7cd30abc95d8',-6));
update test2 set c2=hex(uuid_to_bin('8b40c560-47a5-11ed-aedd-7cd30abc95d8',null)) where c2=hex(uuid_to_bin('8b40c560-47a5-11ed-aedd-7cd30abc95d8',0.5));
END
/
update test1 set c2=7 where c2=6;
select * from test1 order by c1 asc;
c1	c2
1	2
2	4
3	7
select * from test2 order by c1 asc;
c1	c2
1	8B40C56047A511EDAEDD7CD30ABC95D8
#function-10-3   触发器=====>delete
drop table test1;
drop table test2;
create table test1(c1 int PRIMARY key AUTO_INCREMENT,c2 bigint(30));
create table test2(c1 int PRIMARY key AUTO_INCREMENT,c2 varchar(50));
insert into test2(c2) values(hex(uuid_to_bin('8b40c560-47a5-11ed-aedd-7cd30abc95d8',9)));
insert into test2(c2) values(hex(uuid_to_bin('8b40c560-47a5-11ed-aedd-7cd30abc95d8',-9)));
insert into test2(c2) values(hex(uuid_to_bin('8b40c560-47a5-11ed-aedd-7cd30abc95d8',0.6)));
insert into test2(c2) values(hex(uuid_to_bin('8b40c560-47a5-11ed-aedd-7cd30abc95d8',null)));
insert into test2(c2) values(hex(uuid_to_bin('8b40c560-47a5-11ed-aedd-7cd30abc95d8',5.1)));
insert into test1(c2) values(2),(4),(6);
select * from test1 order by c1 asc;
c1	c2
1	2
2	4
3	6
select * from test2 order by c1 asc;
c1	c2
1	11ED47A58B40C560AEDD7CD30ABC95D8
2	11ED47A58B40C560AEDD7CD30ABC95D8
3	11ED47A58B40C560AEDD7CD30ABC95D8
4	8B40C56047A511EDAEDD7CD30ABC95D8
5	11ED47A58B40C560AEDD7CD30ABC95D8
drop TRIGGER TRIGGER_1;
CREATE TRIGGER TRIGGER_1 BEFORE DELETE ON test1
FOR EACH ROW
BEGIN
delete from test2 where c2=hex(uuid_to_bin('8b40c560-47a5-11ed-aedd-7cd30abc95d8',5.1));
delete from test2 where c2=hex(uuid_to_bin('8b40c560-47a5-11ed-aedd-7cd30abc95d8',null));
delete from test2 where c2=hex(uuid_to_bin('8b40c560-47a5-11ed-aedd-7cd30abc95d8',0.6));
delete from test2 where c2=hex(uuid_to_bin('8b40c560-47a5-11ed-aedd-7cd30abc95d8',9));
END
/
delete from test1 where  c2=6;
select * from test1 order by c1 asc;
c1	c2
1	2
2	4
select * from test2 order by c1 asc;
c1	c2
drop table test1;
drop table test2;
# Clean up users
drop user hjw@'%' ;
