#Environmental cleaning
drop user hjw@'%';
create user hjw identified by 'hjw';
grant all on *.* to hjw WITH GRANT OPTION;
#function-5     dml语句
#function-6     视图
#function-7     索引
#function-5-1    insert语句
#function-5-1-1    数值类型
drop table test1;
create table test1(c1 bigint(100),c2 bigint(100));
insert into test1 values(hex(uuid_to_bin('12345678-398f-11ed-958e-7cd30abc95d8')),hex(uuid_to_bin('66666666-398f-11ed-958e-7cd30abc95d8')));
insert into test1 values(1,2);
insert into test1 values(2,3);
insert into test1 values(3,4);
select * from test1 order by c1 asc;
c1	c2
1	2
2	3
3	4
insert into test1(c1) select * from (select hex(uuid_to_bin('12345678-398f-11ed-958e-7cd30abc95d8')) from dual) as a;
insert into test1(c2) select * from (select hex(uuid_to_bin('swef5678-398f-11ed-958e-7cd30abc95d8')) from dual) as a;
#function-5-1-2    字符类型
drop table test1;
create table test1(c1 char(100),c2 char(100),c3 char(100));
insert into test1 values(hex(uuid_to_bin('82134233-3990-11ed-958e-7cd30abc95d8')),hex(uuid_to_bin('12345678-398f-11ed-958e-7cd30abc95d8')),
hex(uuid_to_bin('00000000-398f-11ed-958e-7cd30abc95d8')));
select * from test1 order by c1 asc;
c1	c2	c3
82134233399011ED958E7CD30ABC95D8	12345678398F11ED958E7CD30ABC95D8	00000000398F11ED958E7CD30ABC95D8
insert into test1(c1) values(hex(uuid_to_bin('精华精华-3990-11ed-958e-7cd30abc95d8')));
insert into test1(c1) values(hex(uuid_to_bin('精华精华精华精华-3990-11ed-958e-7cd30abc95d8')));
insert into test1(c1) values(hex(uuid_to_bin('jinghuay-3990-11ed-958e-7cd30abc95d8')));
insert into test1(c1) values(hex(uuid_to_bin('jing1234-3990-11ed-958e-7cd30abc95d8')));
insert into test1(c1) values(hex(uuid_to_bin('1234jing-3990-11ed-958e-7cd30abc95d8')));
insert into test1(c1) values(hex(uuid_to_bin('1234abcd-3990-11ed-958e-7cd30abc95d8')));
insert into test1(c1) values(hex(uuid_to_bin('1234abcd-3990-11ed-958e-7cd30abc95d8','1234abcd-3990-11ed-958e-7cd30abc95d8')));
insert into test1 select * from (select c1,c2,c3 from test1) as a;
select * from test1 order by c1 asc;
c1	c2	c3
1234ABCD399011ED958E7CD30ABC95D8	NULL	NULL
1234ABCD399011ED958E7CD30ABC95D8	NULL	NULL
82134233399011ED958E7CD30ABC95D8	12345678398F11ED958E7CD30ABC95D8	00000000398F11ED958E7CD30ABC95D8
82134233399011ED958E7CD30ABC95D8	12345678398F11ED958E7CD30ABC95D8	00000000398F11ED958E7CD30ABC95D8
#function-5-1-3    时间日期类型
drop table test1;
create table test1(c1 date,c2 time,c3 year);
select * from test1 order by c1 asc;
c1	c2	c3
insert into test1 values(hex(uuid_to_bin('82134233-3990-11ed-958e-7cd30abc95d8')),hex(uuid_to_bin('12345678-398f-11ed-958e-7cd30abc95d8')),
hex(uuid_to_bin('00000000-398f-11ed-958e-7cd30abc95d8')));
select * from test1 order by c1 asc;
c1	c2	c3
insert into test1 values(hex(uuid_to_bin('2020-02-03')),hex(uuid_to_bin('20:20:20')),hex(uuid_to_bin('2020')));
insert into test1 values('2020-02-20','20:20:20','2022');
select * from test1 order by c3 asc;
c1	c2	c3
2020-02-20	20:20:20	2022
insert into test1 select * from(select uuid_to_bin(c1),uuid_to_bin(c2),uuid_to_bin(c3) from test1) as a;
#function-5-1-4    json类型
drop table test1;
create table test1(c1 json,c2 json);
insert into test1 values(hex(uuid_to_bin('')),hex(uuid_to_bin('6ccd780c-baba-1026-9564-5b8c656024db')));
insert into test1 values(hex(uuid_to_bin('{6ccd780c-baba-1026-9564-5b8c656024db}')),hex(uuid_to_bin('6ccd780c-baba-1026-9564-5b8c6560')));
insert into test1 values('{"name":"zhangsan"}','{"age":18}');
select * from test1 order by c1 asc;
c1	c2
{"name": "zhangsan"}	{"age": 18}
insert into test1 select * from(select * from test1) as a;
select * from test1 order by c1 asc;
c1	c2
{"name": "zhangsan"}	{"age": 18}
{"name": "zhangsan"}	{"age": 18}
insert into test1 select * from(select uuid_to_bin(c1),uuid_to_bin(c2) from test1) as a;
#function-5-2    select语句
drop table test1;
create table test1(c1 int PRIMARY key AUTO_INCREMENT,c2 varchar(100),c3 varchar(100));
insert into test1(c2,c3) values(hex(uuid_to_bin('661be1c9-3f0b-11ed-8ff3-7cd30abc95d8')),hex(uuid_to_bin('658517a8-3f0b-11ed-9291-b8599f1d613a')));
insert into test1(c2,c3) values(hex(uuid_to_bin('7945c0ae-3f0b-11ed-8ff3-7cd30abc95d8')),hex(uuid_to_bin('7e915fff-3f0b-11ed-9291-b8599f1d613a')));
insert into test1(c2,c3) values(hex(uuid_to_bin('84cb3d42-3f0b-11ed-8ff3-7cd30abc95d8')),hex(uuid_to_bin('867c697c-3f0b-11ed-9291-b8599f1d613a')));
insert into test1(c2,c3) values(hex(uuid_to_bin('854dc29c-3f0b-11ed-8ff3-7cd30abc95d8')),hex(uuid_to_bin('86d336c9-3f0b-11ed-9291-b8599f1d613a')));
select * from test1 order by c1 asc;
c1	c2	c3
1	661BE1C93F0B11ED8FF37CD30ABC95D8	658517A83F0B11ED9291B8599F1D613A
2	7945C0AE3F0B11ED8FF37CD30ABC95D8	7E915FFF3F0B11ED9291B8599F1D613A
3	84CB3D423F0B11ED8FF37CD30ABC95D8	867C697C3F0B11ED9291B8599F1D613A
4	854DC29C3F0B11ED8FF37CD30ABC95D8	86D336C93F0B11ED9291B8599F1D613A
select * from test1 where c2='661be1c9-3f0b-11ed-8ff3-7cd30abc95d8';
c1	c2	c3
select * from test1 where c2=uuid_to_bin('854dc29c-3f0b-11ed-8ff3-7cd30abc95d8');
c1	c2	c3
select * from test1 where c2=hex(uuid_to_bin('854dc29c-3f0b-11ed-8ff3-7cd30abc95d8'));
c1	c2	c3
4	854DC29C3F0B11ED8FF37CD30ABC95D8	86D336C93F0B11ED9291B8599F1D613A
select * from test1 where c2=hex(uuid_to_bin('854dc29c-3f0b-11ed-8ff3-7cd30abc95d8'))+hex(uuid_to_bin('867c697c-3f0b-11ed-9291-b8599f1d613a'));
c1	c2	c3
select * from test1 where c2=hex(uuid_to_bin('854dc29c-3f0b-11ed-8ff3-7cd30abc95d8'))+hex(uuid_to_bin('86d336c9-3f0b-11ed-9291-b8599f1d613a'));
c1	c2	c3
select * from test1 where c2=hex(uuid_to_bin('854dc29c-3f0b-11ed-8ff3-7cd30abc95d8'))+hex(uuid_to_bin('7945c0ae-3f0b-11ed-8ff3-7cd30abc95d8'));
c1	c2	c3
select * from test1 where c2=hex(uuid_to_bin('854dc29c-3f0b-11ed-8ff3-7cd30abc95d8'))-hex(uuid_to_bin('7945c0ae-3f0b-11ed-8ff3-7cd30abc95d8'));
c1	c2	c3
select * from test1 where c2=hex(uuid_to_bin('854dc29c-3f0b-11ed-8ff3-7cd30abc95d8'))*hex(uuid_to_bin('7945c0ae-3f0b-11ed-8ff3-7cd30abc95d8'));
c1	c2	c3
select * from test1 where c2=hex(uuid_to_bin('854dc29c-3f0b-11ed-8ff3-7cd30abc95d8'))/hex(uuid_to_bin('7945c0ae-3f0b-11ed-8ff3-7cd30abc95d8'));
c1	c2	c3
select * from test1 where c2=hex(uuid_to_bin('854dc29c-3f0b-11ed-8ff3-7cd30abc95d8'))+3;
c1	c2	c3
select * from test1 where c2=hex(uuid_to_bin('854dc29c-3f0b-11ed-8ff3-7cd30abc95d8'))-3;
c1	c2	c3
select * from test1 where c2=hex(uuid_to_bin('854dc29c-3f0b-11ed-8ff3-7cd30abc95d8'))+null;
c1	c2	c3
select * from test1 where c2=hex(uuid_to_bin('854dc29c-3f0b-11ed-8ff3-7cd30abc95d8')) and c3=hex(uuid_to_bin('86d336c9-3f0b-11ed-9291-b8599f1d613a'));
c1	c2	c3
4	854DC29C3F0B11ED8FF37CD30ABC95D8	86D336C93F0B11ED9291B8599F1D613A
select * from test1 where c2=hex(uuid_to_bin('854dc29c-3f0b-11ed-8ff3-7cd30abc95d8')) or c3=hex(uuid_to_bin('86d336c9-3f0b-11ed-9291-b8599f1d613a'));
c1	c2	c3
4	854DC29C3F0B11ED8FF37CD30ABC95D8	86D336C93F0B11ED9291B8599F1D613A
select * from test1 where c2=hex(uuid_to_bin('854dc29c-3f0b-11ed-8ff3-7cd30abc95d8')) or c3=hex(uuid_to_bin('7e915fff-3f0b-11ed-9291-b8599f1d613a'));
c1	c2	c3
2	7945C0AE3F0B11ED8FF37CD30ABC95D8	7E915FFF3F0B11ED9291B8599F1D613A
4	854DC29C3F0B11ED8FF37CD30ABC95D8	86D336C93F0B11ED9291B8599F1D613A
select * from test1 where hex(uuid_to_bin('854dc29c-3f0b-11ed-8ff3-7cd30abc95d8'))=hex(uuid_to_bin('854dc29c-3f0b-11ed-8ff3-7cd30abc95d8'));
c1	c2	c3
1	661BE1C93F0B11ED8FF37CD30ABC95D8	658517A83F0B11ED9291B8599F1D613A
2	7945C0AE3F0B11ED8FF37CD30ABC95D8	7E915FFF3F0B11ED9291B8599F1D613A
3	84CB3D423F0B11ED8FF37CD30ABC95D8	867C697C3F0B11ED9291B8599F1D613A
4	854DC29C3F0B11ED8FF37CD30ABC95D8	86D336C93F0B11ED9291B8599F1D613A
select * from test1 where hex(uuid_to_bin('7945c0ae-3f0b-11ed-8ff3-7cd30abc95d8'))=hex(uuid_to_bin('854dc29c-3f0b-11ed-8ff3-7cd30abc95d8'));
c1	c2	c3
select * from test1 where hex(uuid_to_bin('7945c0ae-3f0b-11ed-8ff3-7cd30abc95d8'))=hex(uuid_to_bin('854dc29c-3f0b-11ed-8ff3-7cd30abc95d8'))
or hex(uuid_to_bin('7945c0ae-3f0b-11ed-8ff3-7cd30abc95d8'))=hex(uuid_to_bin('7945c0ae-3f0b-11ed-8ff3-7cd30abc95d8'));
c1	c2	c3
1	661BE1C93F0B11ED8FF37CD30ABC95D8	658517A83F0B11ED9291B8599F1D613A
2	7945C0AE3F0B11ED8FF37CD30ABC95D8	7E915FFF3F0B11ED9291B8599F1D613A
3	84CB3D423F0B11ED8FF37CD30ABC95D8	867C697C3F0B11ED9291B8599F1D613A
4	854DC29C3F0B11ED8FF37CD30ABC95D8	86D336C93F0B11ED9291B8599F1D613A
select * from test1 where hex(uuid_to_bin('7945c0ae-3f0b-11ed-8ff3-7cd30abc95d8'))=hex(uuid_to_bin('854dc29c-3f0b-11ed-8ff3-7cd30abc95d8'))
and hex(uuid_to_bin('7945c0ae-3f0b-11ed-8ff3-7cd30abc95d8'))=hex(uuid_to_bin('7945c0ae-3f0b-11ed-8ff3-7cd30abc95d8'));
c1	c2	c3
select * from test1 order by hex(uuid_to_bin('854dc29c-3f0b-11ed-8ff3-7cd30abc95d8')) asc;
c1	c2	c3
1	661BE1C93F0B11ED8FF37CD30ABC95D8	658517A83F0B11ED9291B8599F1D613A
2	7945C0AE3F0B11ED8FF37CD30ABC95D8	7E915FFF3F0B11ED9291B8599F1D613A
3	84CB3D423F0B11ED8FF37CD30ABC95D8	867C697C3F0B11ED9291B8599F1D613A
4	854DC29C3F0B11ED8FF37CD30ABC95D8	86D336C93F0B11ED9291B8599F1D613A
select * from test1 order by hex(uuid_to_bin('854dc29c-3f0b-11ed-8ff3-7cd30abc95d8')) desc;
c1	c2	c3
1	661BE1C93F0B11ED8FF37CD30ABC95D8	658517A83F0B11ED9291B8599F1D613A
2	7945C0AE3F0B11ED8FF37CD30ABC95D8	7E915FFF3F0B11ED9291B8599F1D613A
3	84CB3D423F0B11ED8FF37CD30ABC95D8	867C697C3F0B11ED9291B8599F1D613A
4	854DC29C3F0B11ED8FF37CD30ABC95D8	86D336C93F0B11ED9291B8599F1D613A
select hex(uuid_to_bin('854dc29c-3f0b-11ed-8ff3-7cd30abc95d8')) from test1 order by hex(uuid_to_bin('854dc29c-3f0b-11ed-8ff3-7cd30abc95d8')) asc;
hex(uuid_to_bin('854dc29c-3f0b-11ed-8ff3-7cd30abc95d8'))
854DC29C3F0B11ED8FF37CD30ABC95D8
854DC29C3F0B11ED8FF37CD30ABC95D8
854DC29C3F0B11ED8FF37CD30ABC95D8
854DC29C3F0B11ED8FF37CD30ABC95D8
select hex(uuid_to_bin('854dc29c-3f0b-11ed-8ff3-7cd30abc95d8')) from test1 order by hex(uuid_to_bin('854dc29c-3f0b-11ed-8ff3-7cd30abc95d8')) desc;
hex(uuid_to_bin('854dc29c-3f0b-11ed-8ff3-7cd30abc95d8'))
854DC29C3F0B11ED8FF37CD30ABC95D8
854DC29C3F0B11ED8FF37CD30ABC95D8
854DC29C3F0B11ED8FF37CD30ABC95D8
854DC29C3F0B11ED8FF37CD30ABC95D8
select * from test1 group by hex(uuid_to_bin('854dc29c-3f0b-11ed-8ff3-7cd30abc95d8')) HAVING hex(uuid_to_bin('854dc29c-3f0b-11ed-8ff3-7cd30abc95d8')) order by c1 asc;
c1	c2	c3
1	661BE1C93F0B11ED8FF37CD30ABC95D8	658517A83F0B11ED9291B8599F1D613A
Warnings:
Warning	1292	Truncated incorrect DOUBLE value: '854DC29C3F0B11ED8FF37CD30ABC95D8'
select * from test1 group by hex(uuid_to_bin('854dc29c-3f0b-11ed-8ff3-7cd30abc95d8')) HAVING hex(uuid_to_bin('854dc29c-3f0b-11ed-8ff3-7cd30abc95d8')) order by c1 desc;
c1	c2	c3
4	854DC29C3F0B11ED8FF37CD30ABC95D8	86D336C93F0B11ED9291B8599F1D613A
Warnings:
Warning	1292	Truncated incorrect DOUBLE value: '854DC29C3F0B11ED8FF37CD30ABC95D8'
select * from test1 group by hex(uuid_to_bin('854dc29c-3f0b-11ed-8ff3-7cd30abc95d8')) HAVING hex(uuid_to_bin('854dc29c-3f0b-11ed-8ff3-7cd30abc95d8')) order by hex(uuid_to_bin('854dc29c-3f0b-11ed-8ff3-7cd30abc95d8')) desc;
c1	c2	c3
1	661BE1C93F0B11ED8FF37CD30ABC95D8	658517A83F0B11ED9291B8599F1D613A
Warnings:
Warning	1292	Truncated incorrect DOUBLE value: '854DC29C3F0B11ED8FF37CD30ABC95D8'
select * from test1 group by hex(uuid_to_bin('854dc29c-3f0b-11ed-8ff3-7cd30abc95d8')) HAVING hex(uuid_to_bin('854dc29c-3f0b-11ed-8ff3-7cd30abc95d8'))<2 order by c1 asc;
c1	c2	c3
Warnings:
Warning	1292	Truncated incorrect DECIMAL value: '854DC29C3F0B11ED8FF37CD30ABC95D8'
select * from test1 group by hex(uuid_to_bin('854dc29c-3f0b-11ed-8ff3-7cd30abc95d8')) HAVING hex(uuid_to_bin('854dc29c-3f0b-11ed-8ff3-7cd30abc95d8'))>2 order by c1 asc;
c1	c2	c3
1	661BE1C93F0B11ED8FF37CD30ABC95D8	658517A83F0B11ED9291B8599F1D613A
Warnings:
Warning	1292	Truncated incorrect DECIMAL value: '854DC29C3F0B11ED8FF37CD30ABC95D8'
select * from test1 group by hex(uuid_to_bin('854dc29c-3f0b-11ed-8ff3-7cd30abc95d8')) HAVING hex(uuid_to_bin('854dc29c-3f0b-11ed-8ff3-7cd30abc95d8'))=2 order by c1 asc;
c1	c2	c3
Warnings:
Warning	1292	Truncated incorrect DECIMAL value: '854DC29C3F0B11ED8FF37CD30ABC95D8'
select CASE c2  WHEN hex(uuid_to_bin('854dc29c-3f0b-11ed-8ff3-7cd30abc95d8')) THEN '男'  WHEN 0 THEN hex(uuid_to_bin('854dc29c-3f0b-11ed-8ff3-7cd30abc95d8'))  ELSE '其他' END  from test1 order by c1 asc;
CASE c2  WHEN hex(uuid_to_bin('854dc29c-3f0b-11ed-8ff3-7cd30abc95d8')) THEN '男'  WHEN 0 THEN hex(uuid_to_bin('854dc29c-3f0b-11ed-8ff3-7cd30abc95d8'))  ELSE '其他' END
其他
其他
其他
男
Warnings:
Warning	1292	Truncated incorrect DECIMAL value: '661BE1C93F0B11ED8FF37CD30ABC95D8'
Warning	1292	Truncated incorrect DECIMAL value: '7945C0AE3F0B11ED8FF37CD30ABC95D8'
Warning	1292	Truncated incorrect DECIMAL value: '84CB3D423F0B11ED8FF37CD30ABC95D8'
select CASE hex(uuid_to_bin('867c697c-3f0b-11ed-9291-b8599f1d613a')) WHEN hex(uuid_to_bin('854dc29c-3f0b-11ed-8ff3-7cd30abc95d8')) THEN '男'  WHEN 0 THEN hex(uuid_to_bin('854dc29c-3f0b-11ed-8ff3-7cd30abc95d8'))  ELSE '其他' END  from test1 order by c1 asc;
CASE hex(uuid_to_bin('867c697c-3f0b-11ed-9291-b8599f1d613a')) WHEN hex(uuid_to_bin('854dc29c-3f0b-11ed-8ff3-7cd30abc95d8')) THEN '男'  WHEN 0 THEN hex(uuid_to_bin('854dc29c-3f0b-11ed-8ff3-7cd30abc95d8'))  ELSE '其他' END
其他
其他
其他
其他
Warnings:
Warning	1292	Truncated incorrect DECIMAL value: '867C697C3F0B11ED9291B8599F1D613A'
select CASE hex(uuid_to_bin('867c697c-3f0b-11ed-9291-b8599f1d613a')) WHEN hex(uuid_to_bin('854dc29c-3f0b-11ed-8ff3-7cd30abc95d8')) THEN '男'  WHEN hex(uuid_to_bin('854dc29c-3f0b-11ed-8ff3-7cd30abc95d8')) THEN hex(uuid_to_bin('854dc29c-3f0b-11ed-8ff3-7cd30abc95d8'))  ELSE '其他' END  from test1 order by c1 asc;
CASE hex(uuid_to_bin('867c697c-3f0b-11ed-9291-b8599f1d613a')) WHEN hex(uuid_to_bin('854dc29c-3f0b-11ed-8ff3-7cd30abc95d8')) THEN '男'  WHEN hex(uuid_to_bin('854dc29c-3f0b-11ed-8ff3-7cd30abc95d8')) THEN hex(uuid_to_bin('854dc29c-3f0b-11ed-8ff3-7cd30abc95d
其他
其他
其他
其他
select * from test1 where EXISTS(select c2 from test1 where c2=hex(uuid_to_bin('854dc29c-3f0b-11ed-8ff3-7cd30abc95d8'))) order by c1 asc;
c1	c2	c3
1	661BE1C93F0B11ED8FF37CD30ABC95D8	658517A83F0B11ED9291B8599F1D613A
2	7945C0AE3F0B11ED8FF37CD30ABC95D8	7E915FFF3F0B11ED9291B8599F1D613A
3	84CB3D423F0B11ED8FF37CD30ABC95D8	867C697C3F0B11ED9291B8599F1D613A
4	854DC29C3F0B11ED8FF37CD30ABC95D8	86D336C93F0B11ED9291B8599F1D613A
select * from test1 where EXISTS(select hex(uuid_to_bin('854dc29c-3f0b-11ed-8ff3-7cd30abc95d8')) from test1 where c2=hex(uuid_to_bin('854dc29c-3f0b-11ed-8ff3-7cd30abc95d8'))) order by c1 asc;
c1	c2	c3
1	661BE1C93F0B11ED8FF37CD30ABC95D8	658517A83F0B11ED9291B8599F1D613A
2	7945C0AE3F0B11ED8FF37CD30ABC95D8	7E915FFF3F0B11ED9291B8599F1D613A
3	84CB3D423F0B11ED8FF37CD30ABC95D8	867C697C3F0B11ED9291B8599F1D613A
4	854DC29C3F0B11ED8FF37CD30ABC95D8	86D336C93F0B11ED9291B8599F1D613A
select * from test1 where EXISTS(select hex(uuid_to_bin('854dc29c-3f0b-11ed-8ff3-7cd30abc95d8')) from test1 where hex(uuid_to_bin('7945c0ae-3f0b-11ed-8ff3-7cd30abc95d8'))=hex(uuid_to_bin('854dc29c-3f0b-11ed-8ff3-7cd30abc95d8'))) order by c1 asc;
c1	c2	c3
select * from test1 where not EXISTS(select c2 from test1 where c2=hex(uuid_to_bin('854dc29c-3f0b-11ed-8ff3-7cd30abc95d8'))) order by c1 asc;
c1	c2	c3
select * from test1 where not EXISTS(select hex(uuid_to_bin('854dc29c-3f0b-11ed-8ff3-7cd30abc95d8')) from test1 where c2=hex(uuid_to_bin('854dc29c-3f0b-11ed-8ff3-7cd30abc95d8'))) order by c1 asc;
c1	c2	c3
select * from test1 where not EXISTS(select hex(uuid_to_bin('854dc29c-3f0b-11ed-8ff3-7cd30abc95d8')) from test1 where hex(uuid_to_bin('7945c0ae-3f0b-11ed-8ff3-7cd30abc95d8'))=hex(uuid_to_bin('854dc29c-3f0b-11ed-8ff3-7cd30abc95d8'))) order by c1 asc;
c1	c2	c3
1	661BE1C93F0B11ED8FF37CD30ABC95D8	658517A83F0B11ED9291B8599F1D613A
2	7945C0AE3F0B11ED8FF37CD30ABC95D8	7E915FFF3F0B11ED9291B8599F1D613A
3	84CB3D423F0B11ED8FF37CD30ABC95D8	867C697C3F0B11ED9291B8599F1D613A
4	854DC29C3F0B11ED8FF37CD30ABC95D8	86D336C93F0B11ED9291B8599F1D613A
select * from test1 where c2 in(select c2 from test1 where c2=hex(uuid_to_bin('854dc29c-3f0b-11ed-8ff3-7cd30abc95d8'))) order by c1 asc;
c1	c2	c3
4	854DC29C3F0B11ED8FF37CD30ABC95D8	86D336C93F0B11ED9291B8599F1D613A
select * from test1 where c2 not in(select c2 from test1 where c2=hex(uuid_to_bin('854dc29c-3f0b-11ed-8ff3-7cd30abc95d8'))) order by c1 asc;
c1	c2	c3
1	661BE1C93F0B11ED8FF37CD30ABC95D8	658517A83F0B11ED9291B8599F1D613A
2	7945C0AE3F0B11ED8FF37CD30ABC95D8	7E915FFF3F0B11ED9291B8599F1D613A
3	84CB3D423F0B11ED8FF37CD30ABC95D8	867C697C3F0B11ED9291B8599F1D613A
select * from test1 where hex(uuid_to_bin('854dc29c-3f0b-11ed-8ff3-7cd30abc95d8')) in(select c2 from test1 where c2=hex(uuid_to_bin('854dc29c-3f0b-11ed-8ff3-7cd30abc95d8'))) order by c1 asc;
c1	c2	c3
1	661BE1C93F0B11ED8FF37CD30ABC95D8	658517A83F0B11ED9291B8599F1D613A
2	7945C0AE3F0B11ED8FF37CD30ABC95D8	7E915FFF3F0B11ED9291B8599F1D613A
3	84CB3D423F0B11ED8FF37CD30ABC95D8	867C697C3F0B11ED9291B8599F1D613A
4	854DC29C3F0B11ED8FF37CD30ABC95D8	86D336C93F0B11ED9291B8599F1D613A
select * from test1 where hex(uuid_to_bin('854dc29c-3f0b-11ed-8ff3-7cd30abc95d8')) not in(select c2 from test1 where c2=hex(uuid_to_bin('854dc29c-3f0b-11ed-8ff3-7cd30abc95d8'))) order by c1 asc;
c1	c2	c3
select * from test1 where c2=any(select c1 from test1 where c2=hex(uuid_to_bin('854dc29c-3f0b-11ed-8ff3-7cd30abc95d8')) and c3=hex(uuid_to_bin('86d336c9-3f0b-11ed-9291-b8599f1d613a'))) order by c1 asc;
c1	c2	c3
Warnings:
Warning	1292	Truncated incorrect DECIMAL value: '661BE1C93F0B11ED8FF37CD30ABC95D8'
Warning	1292	Truncated incorrect DECIMAL value: '7945C0AE3F0B11ED8FF37CD30ABC95D8'
Warning	1292	Truncated incorrect DECIMAL value: '84CB3D423F0B11ED8FF37CD30ABC95D8'
Warning	1292	Truncated incorrect DECIMAL value: '854DC29C3F0B11ED8FF37CD30ABC95D8'
select * from test1 where c2>any(select c1 from test1 where c2=hex(uuid_to_bin('854dc29c-3f0b-11ed-8ff3-7cd30abc95d8')) and c3=hex(uuid_to_bin('86d336c9-3f0b-11ed-9291-b8599f1d613a'))) order by c1 asc;
c1	c2	c3
1	661BE1C93F0B11ED8FF37CD30ABC95D8	658517A83F0B11ED9291B8599F1D613A
2	7945C0AE3F0B11ED8FF37CD30ABC95D8	7E915FFF3F0B11ED9291B8599F1D613A
3	84CB3D423F0B11ED8FF37CD30ABC95D8	867C697C3F0B11ED9291B8599F1D613A
4	854DC29C3F0B11ED8FF37CD30ABC95D8	86D336C93F0B11ED9291B8599F1D613A
Warnings:
Warning	1292	Truncated incorrect DECIMAL value: '661BE1C93F0B11ED8FF37CD30ABC95D8'
Warning	1292	Truncated incorrect DECIMAL value: '661BE1C93F0B11ED8FF37CD30ABC95D8'
Warning	1292	Truncated incorrect DECIMAL value: '7945C0AE3F0B11ED8FF37CD30ABC95D8'
Warning	1292	Truncated incorrect DECIMAL value: '7945C0AE3F0B11ED8FF37CD30ABC95D8'
Warning	1292	Truncated incorrect DECIMAL value: '84CB3D423F0B11ED8FF37CD30ABC95D8'
Warning	1292	Truncated incorrect DECIMAL value: '84CB3D423F0B11ED8FF37CD30ABC95D8'
Warning	1292	Truncated incorrect DECIMAL value: '854DC29C3F0B11ED8FF37CD30ABC95D8'
Warning	1292	Truncated incorrect DECIMAL value: '854DC29C3F0B11ED8FF37CD30ABC95D8'
select * from test1 where c2<any(select c1 from test1 where c2=hex(uuid_to_bin('854dc29c-3f0b-11ed-8ff3-7cd30abc95d8')) and c3=hex(uuid_to_bin('86d336c9-3f0b-11ed-9291-b8599f1d613a'))) order by c1 asc;
c1	c2	c3
Warnings:
Warning	1292	Truncated incorrect DECIMAL value: '661BE1C93F0B11ED8FF37CD30ABC95D8'
Warning	1292	Truncated incorrect DECIMAL value: '661BE1C93F0B11ED8FF37CD30ABC95D8'
Warning	1292	Truncated incorrect DECIMAL value: '7945C0AE3F0B11ED8FF37CD30ABC95D8'
Warning	1292	Truncated incorrect DECIMAL value: '7945C0AE3F0B11ED8FF37CD30ABC95D8'
Warning	1292	Truncated incorrect DECIMAL value: '84CB3D423F0B11ED8FF37CD30ABC95D8'
Warning	1292	Truncated incorrect DECIMAL value: '84CB3D423F0B11ED8FF37CD30ABC95D8'
Warning	1292	Truncated incorrect DECIMAL value: '854DC29C3F0B11ED8FF37CD30ABC95D8'
Warning	1292	Truncated incorrect DECIMAL value: '854DC29C3F0B11ED8FF37CD30ABC95D8'
select * from test1 where c2=all(select c1 from test1 where c2=hex(uuid_to_bin('854dc29c-3f0b-11ed-8ff3-7cd30abc95d8')) and c3=hex(uuid_to_bin('86d336c9-3f0b-11ed-9291-b8599f1d613a'))) order by c1 asc;
c1	c2	c3
Warnings:
Warning	1292	Truncated incorrect DECIMAL value: '661BE1C93F0B11ED8FF37CD30ABC95D8'
Warning	1292	Truncated incorrect DECIMAL value: '7945C0AE3F0B11ED8FF37CD30ABC95D8'
Warning	1292	Truncated incorrect DECIMAL value: '84CB3D423F0B11ED8FF37CD30ABC95D8'
Warning	1292	Truncated incorrect DECIMAL value: '854DC29C3F0B11ED8FF37CD30ABC95D8'
select * from test1 where c2>all(select c1 from test1 where c2=hex(uuid_to_bin('854dc29c-3f0b-11ed-8ff3-7cd30abc95d8')) and c3=hex(uuid_to_bin('86d336c9-3f0b-11ed-9291-b8599f1d613a'))) order by c1 asc;
c1	c2	c3
1	661BE1C93F0B11ED8FF37CD30ABC95D8	658517A83F0B11ED9291B8599F1D613A
2	7945C0AE3F0B11ED8FF37CD30ABC95D8	7E915FFF3F0B11ED9291B8599F1D613A
3	84CB3D423F0B11ED8FF37CD30ABC95D8	867C697C3F0B11ED9291B8599F1D613A
4	854DC29C3F0B11ED8FF37CD30ABC95D8	86D336C93F0B11ED9291B8599F1D613A
Warnings:
Warning	1292	Truncated incorrect DECIMAL value: '661BE1C93F0B11ED8FF37CD30ABC95D8'
Warning	1292	Truncated incorrect DECIMAL value: '661BE1C93F0B11ED8FF37CD30ABC95D8'
Warning	1292	Truncated incorrect DECIMAL value: '661BE1C93F0B11ED8FF37CD30ABC95D8'
Warning	1292	Truncated incorrect DECIMAL value: '7945C0AE3F0B11ED8FF37CD30ABC95D8'
Warning	1292	Truncated incorrect DECIMAL value: '7945C0AE3F0B11ED8FF37CD30ABC95D8'
Warning	1292	Truncated incorrect DECIMAL value: '7945C0AE3F0B11ED8FF37CD30ABC95D8'
Warning	1292	Truncated incorrect DECIMAL value: '84CB3D423F0B11ED8FF37CD30ABC95D8'
Warning	1292	Truncated incorrect DECIMAL value: '84CB3D423F0B11ED8FF37CD30ABC95D8'
Warning	1292	Truncated incorrect DECIMAL value: '84CB3D423F0B11ED8FF37CD30ABC95D8'
Warning	1292	Truncated incorrect DECIMAL value: '854DC29C3F0B11ED8FF37CD30ABC95D8'
Warning	1292	Truncated incorrect DECIMAL value: '854DC29C3F0B11ED8FF37CD30ABC95D8'
Warning	1292	Truncated incorrect DECIMAL value: '854DC29C3F0B11ED8FF37CD30ABC95D8'
select * from test1 where c2<all(select c1 from test1 where c2=hex(uuid_to_bin('854dc29c-3f0b-11ed-8ff3-7cd30abc95d8')) and c3=hex(uuid_to_bin('86d336c9-3f0b-11ed-9291-b8599f1d613a'))) order by c1 asc;
c1	c2	c3
Warnings:
Warning	1292	Truncated incorrect DECIMAL value: '661BE1C93F0B11ED8FF37CD30ABC95D8'
Warning	1292	Truncated incorrect DECIMAL value: '661BE1C93F0B11ED8FF37CD30ABC95D8'
Warning	1292	Truncated incorrect DECIMAL value: '661BE1C93F0B11ED8FF37CD30ABC95D8'
Warning	1292	Truncated incorrect DECIMAL value: '7945C0AE3F0B11ED8FF37CD30ABC95D8'
Warning	1292	Truncated incorrect DECIMAL value: '7945C0AE3F0B11ED8FF37CD30ABC95D8'
Warning	1292	Truncated incorrect DECIMAL value: '7945C0AE3F0B11ED8FF37CD30ABC95D8'
Warning	1292	Truncated incorrect DECIMAL value: '84CB3D423F0B11ED8FF37CD30ABC95D8'
Warning	1292	Truncated incorrect DECIMAL value: '84CB3D423F0B11ED8FF37CD30ABC95D8'
Warning	1292	Truncated incorrect DECIMAL value: '84CB3D423F0B11ED8FF37CD30ABC95D8'
Warning	1292	Truncated incorrect DECIMAL value: '854DC29C3F0B11ED8FF37CD30ABC95D8'
Warning	1292	Truncated incorrect DECIMAL value: '854DC29C3F0B11ED8FF37CD30ABC95D8'
Warning	1292	Truncated incorrect DECIMAL value: '854DC29C3F0B11ED8FF37CD30ABC95D8'
select * from test1 where c2 like '%(select c1 from test1 where c2=hex(uuid_to_bin(854dc29c-3f0b-11ed-8ff3-7cd30abc95d8)) and c3=hex(uuid_to_bin(86d336c9-3f0b-11ed-9291-b8599f1d613a)))%' order by c1 asc;
c1	c2	c3
select * from test1 where c2 like '%hex(uuid_to_bin(854dc29c-3f0b-11ed-8ff3-7cd30abc95d8))%' order by c1 asc;
c1	c2	c3
select * from test1 where c2 like '%854dc29c%' order by c1 asc;
c1	c2	c3
4	854DC29C3F0B11ED8FF37CD30ABC95D8	86D336C93F0B11ED9291B8599F1D613A
#function-5-3    update语句
drop table test1;
create table test1(c1 int PRIMARY key AUTO_INCREMENT,c2 varchar(100),c3 varchar(100));
insert into test1(c2,c3) values(hex(uuid_to_bin('661be1c9-3f0b-11ed-8ff3-7cd30abc95d8')),hex(uuid_to_bin('658517a8-3f0b-11ed-9291-b8599f1d613a')));
insert into test1(c2,c3) values(hex(uuid_to_bin('7945c0ae-3f0b-11ed-8ff3-7cd30abc95d8')),hex(uuid_to_bin('7e915fff-3f0b-11ed-9291-b8599f1d613a')));
insert into test1(c2,c3) values(hex(uuid_to_bin('84cb3d42-3f0b-11ed-8ff3-7cd30abc95d8')),hex(uuid_to_bin('867c697c-3f0b-11ed-9291-b8599f1d613a')));
insert into test1(c2,c3) values(hex(uuid_to_bin('854dc29c-3f0b-11ed-8ff3-7cd30abc95d8')),hex(uuid_to_bin('86d336c9-3f0b-11ed-9291-b8599f1d613a')));
select * from test1 order by c1 asc;
c1	c2	c3
1	661BE1C93F0B11ED8FF37CD30ABC95D8	658517A83F0B11ED9291B8599F1D613A
2	7945C0AE3F0B11ED8FF37CD30ABC95D8	7E915FFF3F0B11ED9291B8599F1D613A
3	84CB3D423F0B11ED8FF37CD30ABC95D8	867C697C3F0B11ED9291B8599F1D613A
4	854DC29C3F0B11ED8FF37CD30ABC95D8	86D336C93F0B11ED9291B8599F1D613A
update test1 set c2=hex(uuid_to_bin('99cb3d42-3f0b-11ed-8ff3-7cd30abc95d8'))+hex(uuid_to_bin('84cb3d42-3f0b-11ed-8ff3-7cd30abc95d8')) where
c3=hex(uuid_to_bin('658517a8-3f0b-11ed-9291-b8599f1d613a'));
Warnings:
Warning	1292	Truncated incorrect DOUBLE value: '99CB3D423F0B11ED8FF37CD30ABC95D8'
Warning	1292	Truncated incorrect DOUBLE value: '84CB3D423F0B11ED8FF37CD30ABC95D8'
select * from test1 order by c1 asc;
c1	c2	c3
1	183	658517A83F0B11ED9291B8599F1D613A
2	7945C0AE3F0B11ED8FF37CD30ABC95D8	7E915FFF3F0B11ED9291B8599F1D613A
3	84CB3D423F0B11ED8FF37CD30ABC95D8	867C697C3F0B11ED9291B8599F1D613A
4	854DC29C3F0B11ED8FF37CD30ABC95D8	86D336C93F0B11ED9291B8599F1D613A
update test1 set c2=hex(uuid_to_bin('66cb3d42-3f0b-11ed-8ff3-7cd30abc95d8'))-hex(uuid_to_bin('84cb3d42-3f0b-11ed-8ff3-7cd30abc95d8')) where
c3=hex(uuid_to_bin('658517a8-3f0b-11ed-9291-b8599f1d613a'));
Warnings:
Warning	1292	Truncated incorrect DOUBLE value: '66CB3D423F0B11ED8FF37CD30ABC95D8'
Warning	1292	Truncated incorrect DOUBLE value: '84CB3D423F0B11ED8FF37CD30ABC95D8'
select * from test1 order by c1 asc;
c1	c2	c3
1	-18	658517A83F0B11ED9291B8599F1D613A
2	7945C0AE3F0B11ED8FF37CD30ABC95D8	7E915FFF3F0B11ED9291B8599F1D613A
3	84CB3D423F0B11ED8FF37CD30ABC95D8	867C697C3F0B11ED9291B8599F1D613A
4	854DC29C3F0B11ED8FF37CD30ABC95D8	86D336C93F0B11ED9291B8599F1D613A
update test1 set c2=hex(uuid_to_bin('16cb3d42-3f0b-11ed-8ff3-7cd30abc95d8'))*hex(uuid_to_bin('84cb3d42-3f0b-11ed-8ff3-7cd30abc95d8')) where
c3=hex(uuid_to_bin('658517a8-3f0b-11ed-9291-b8599f1d613a'));
Warnings:
Warning	1292	Truncated incorrect DOUBLE value: '16CB3D423F0B11ED8FF37CD30ABC95D8'
Warning	1292	Truncated incorrect DOUBLE value: '84CB3D423F0B11ED8FF37CD30ABC95D8'
select * from test1 order by c1 asc;
c1	c2	c3
1	1344	658517A83F0B11ED9291B8599F1D613A
2	7945C0AE3F0B11ED8FF37CD30ABC95D8	7E915FFF3F0B11ED9291B8599F1D613A
3	84CB3D423F0B11ED8FF37CD30ABC95D8	867C697C3F0B11ED9291B8599F1D613A
4	854DC29C3F0B11ED8FF37CD30ABC95D8	86D336C93F0B11ED9291B8599F1D613A
update test1 set c2=hex(uuid_to_bin('99cb3d42-3f0b-11ed-8ff3-7cd30abc95d8'))/hex(uuid_to_bin('84cb3d42-3f0b-11ed-8ff3-7cd30abc95d8')) where
c3=hex(uuid_to_bin('658517a8-3f0b-11ed-9291-b8599f1d613a'));
Warnings:
Warning	1292	Truncated incorrect DOUBLE value: '99CB3D423F0B11ED8FF37CD30ABC95D8'
Warning	1292	Truncated incorrect DOUBLE value: '84CB3D423F0B11ED8FF37CD30ABC95D8'
select * from test1 order by c1 asc;
c1	c2	c3
1	1.1785714285714286	658517A83F0B11ED9291B8599F1D613A
2	7945C0AE3F0B11ED8FF37CD30ABC95D8	7E915FFF3F0B11ED9291B8599F1D613A
3	84CB3D423F0B11ED8FF37CD30ABC95D8	867C697C3F0B11ED9291B8599F1D613A
4	854DC29C3F0B11ED8FF37CD30ABC95D8	86D336C93F0B11ED9291B8599F1D613A
update test1 set c2=hex(uuid_to_bin('86cb3d42-3f0b-11ed-8ff3-7cd30abc95d8'))+5 where c3=hex(uuid_to_bin('658517a8-3f0b-11ed-9291-b8599f1d613a'));
Warnings:
Warning	1292	Truncated incorrect DOUBLE value: '86CB3D423F0B11ED8FF37CD30ABC95D8'
select * from test1 order by c1 asc;
c1	c2	c3
1	91	658517A83F0B11ED9291B8599F1D613A
2	7945C0AE3F0B11ED8FF37CD30ABC95D8	7E915FFF3F0B11ED9291B8599F1D613A
3	84CB3D423F0B11ED8FF37CD30ABC95D8	867C697C3F0B11ED9291B8599F1D613A
4	854DC29C3F0B11ED8FF37CD30ABC95D8	86D336C93F0B11ED9291B8599F1D613A
update test1 set c2=hex(uuid_to_bin('44cb3d42-3f0b-11ed-8ff3-7cd30abc95d8')),c3=hex(uuid_to_bin('10cb3d42-3f0b-11ed-8ff3-7cd30abc95d8'))
where c3=hex(uuid_to_bin('658517a8-3f0b-11ed-9291-b8599f1d613a'));
select * from test1 order by c1 asc;
c1	c2	c3
1	44CB3D423F0B11ED8FF37CD30ABC95D8	10CB3D423F0B11ED8FF37CD30ABC95D8
2	7945C0AE3F0B11ED8FF37CD30ABC95D8	7E915FFF3F0B11ED9291B8599F1D613A
3	84CB3D423F0B11ED8FF37CD30ABC95D8	867C697C3F0B11ED9291B8599F1D613A
4	854DC29C3F0B11ED8FF37CD30ABC95D8	86D336C93F0B11ED9291B8599F1D613A
update test1 set c2=hex(uuid_to_bin('44cb3d42-3f0b-11ed-8ff3-7cd30abc95d8')),c3=hex(uuid_to_bin('10cb3d42-3f0b-11ed-8ff3-7cd30abc95d8'))
where c3=(select hex(uuid_to_bin('658517a8-3f0b-11ed-9291-b8599f1d613a')) from test1);
select * from test1 order by c1 asc;
c1	c2	c3
1	44CB3D423F0B11ED8FF37CD30ABC95D8	10CB3D423F0B11ED8FF37CD30ABC95D8
2	7945C0AE3F0B11ED8FF37CD30ABC95D8	7E915FFF3F0B11ED9291B8599F1D613A
3	84CB3D423F0B11ED8FF37CD30ABC95D8	867C697C3F0B11ED9291B8599F1D613A
4	854DC29C3F0B11ED8FF37CD30ABC95D8	86D336C93F0B11ED9291B8599F1D613A
#function-5-4    delete语句
DELETE from test1 where c2=hex(uuid_to_bin('854dc29c-3f0b-11ed-8ff3-7cd30abc95d8'));
select * from test1 order by c1 asc;
c1	c2	c3
1	44CB3D423F0B11ED8FF37CD30ABC95D8	10CB3D423F0B11ED8FF37CD30ABC95D8
2	7945C0AE3F0B11ED8FF37CD30ABC95D8	7E915FFF3F0B11ED9291B8599F1D613A
3	84CB3D423F0B11ED8FF37CD30ABC95D8	867C697C3F0B11ED9291B8599F1D613A
DELETE from test1 where c2=(select * from (select c2 from test1 where c2=hex(uuid_to_bin('84cb3d42-3f0b-11ed-8ff3-7cd30abc95d8')))as a) ;
select * from test1 order by c1 asc;
c1	c2	c3
1	44CB3D423F0B11ED8FF37CD30ABC95D8	10CB3D423F0B11ED8FF37CD30ABC95D8
2	7945C0AE3F0B11ED8FF37CD30ABC95D8	7E915FFF3F0B11ED9291B8599F1D613A
DELETE from test1 where c2=hex(uuid_to_bin('7945c0ae-3f0b-11ed-8ff3-7cd30abc95d8')) and c3=hex(uuid_to_bin('10CB3D423F0B11ED8FF37CD30ABC95D8'));
select * from test1 order by c1 asc;
c1	c2	c3
1	44CB3D423F0B11ED8FF37CD30ABC95D8	10CB3D423F0B11ED8FF37CD30ABC95D8
2	7945C0AE3F0B11ED8FF37CD30ABC95D8	7E915FFF3F0B11ED9291B8599F1D613A
DELETE from test1 where c2=hex(uuid_to_bin('7945c0ae-3f0b-11ed-8ff3-7cd30abc95d8')) or c3=hex(uuid_to_bin('10CB3D423F0B11ED8FF37CD30ABC95D8'));
select * from test1 order by c1 asc;
c1	c2	c3
drop table test1;
#function-6     视图=====>insert+select
drop table test1;
drop view view_1;
create table test1(c1 int PRIMARY key AUTO_INCREMENT,c2 varchar(100),c3 varchar(100));
create view view_1 as select * from test1;
insert into view_1(c2,c3) values(hex(uuid_to_bin('661be1c9-3f0b-11ed-8ff3-7cd30abc95d8')),hex(uuid_to_bin('658517a8-3f0b-11ed-9291-b8599f1d613a')));
insert into view_1(c2,c3) values(hex(uuid_to_bin('7945c0ae-3f0b-11ed-8ff3-7cd30abc95d8')),hex(uuid_to_bin('7e915fff-3f0b-11ed-9291-b8599f1d613a')));
insert into view_1(c2,c3) values(hex(uuid_to_bin('84cb3d42-3f0b-11ed-8ff3-7cd30abc95d8')),hex(uuid_to_bin('867c697c-3f0b-11ed-9291-b8599f1d613a')));
insert into view_1(c2,c3) values(hex(uuid_to_bin('854dc29c-3f0b-11ed-8ff3-7cd30abc95d8')),hex(uuid_to_bin('86d336c9-3f0b-11ed-9291-b8599f1d613a')));
select * from view_1 order by c1 asc;
c1	c2	c3
1	661BE1C93F0B11ED8FF37CD30ABC95D8	658517A83F0B11ED9291B8599F1D613A
2	7945C0AE3F0B11ED8FF37CD30ABC95D8	7E915FFF3F0B11ED9291B8599F1D613A
3	84CB3D423F0B11ED8FF37CD30ABC95D8	867C697C3F0B11ED9291B8599F1D613A
4	854DC29C3F0B11ED8FF37CD30ABC95D8	86D336C93F0B11ED9291B8599F1D613A
select * from test1 order by c1 asc;
c1	c2	c3
1	661BE1C93F0B11ED8FF37CD30ABC95D8	658517A83F0B11ED9291B8599F1D613A
2	7945C0AE3F0B11ED8FF37CD30ABC95D8	7E915FFF3F0B11ED9291B8599F1D613A
3	84CB3D423F0B11ED8FF37CD30ABC95D8	867C697C3F0B11ED9291B8599F1D613A
4	854DC29C3F0B11ED8FF37CD30ABC95D8	86D336C93F0B11ED9291B8599F1D613A
insert into view_1(c2,c3) select c2,c3 from view_1;
select * from view_1 order by c1 asc;
c1	c2	c3
1	661BE1C93F0B11ED8FF37CD30ABC95D8	658517A83F0B11ED9291B8599F1D613A
2	7945C0AE3F0B11ED8FF37CD30ABC95D8	7E915FFF3F0B11ED9291B8599F1D613A
3	84CB3D423F0B11ED8FF37CD30ABC95D8	867C697C3F0B11ED9291B8599F1D613A
4	854DC29C3F0B11ED8FF37CD30ABC95D8	86D336C93F0B11ED9291B8599F1D613A
5	661BE1C93F0B11ED8FF37CD30ABC95D8	658517A83F0B11ED9291B8599F1D613A
6	7945C0AE3F0B11ED8FF37CD30ABC95D8	7E915FFF3F0B11ED9291B8599F1D613A
7	84CB3D423F0B11ED8FF37CD30ABC95D8	867C697C3F0B11ED9291B8599F1D613A
8	854DC29C3F0B11ED8FF37CD30ABC95D8	86D336C93F0B11ED9291B8599F1D613A
select * from test1 order by c1 asc;
c1	c2	c3
1	661BE1C93F0B11ED8FF37CD30ABC95D8	658517A83F0B11ED9291B8599F1D613A
2	7945C0AE3F0B11ED8FF37CD30ABC95D8	7E915FFF3F0B11ED9291B8599F1D613A
3	84CB3D423F0B11ED8FF37CD30ABC95D8	867C697C3F0B11ED9291B8599F1D613A
4	854DC29C3F0B11ED8FF37CD30ABC95D8	86D336C93F0B11ED9291B8599F1D613A
5	661BE1C93F0B11ED8FF37CD30ABC95D8	658517A83F0B11ED9291B8599F1D613A
6	7945C0AE3F0B11ED8FF37CD30ABC95D8	7E915FFF3F0B11ED9291B8599F1D613A
7	84CB3D423F0B11ED8FF37CD30ABC95D8	867C697C3F0B11ED9291B8599F1D613A
8	854DC29C3F0B11ED8FF37CD30ABC95D8	86D336C93F0B11ED9291B8599F1D613A
select * from view_1 where c2='661BE1C93F0B11ED8FF37CD30ABC95D8';
c1	c2	c3
1	661BE1C93F0B11ED8FF37CD30ABC95D8	658517A83F0B11ED9291B8599F1D613A
5	661BE1C93F0B11ED8FF37CD30ABC95D8	658517A83F0B11ED9291B8599F1D613A
select * from view_1 where c2=uuid_to_bin('854dc29c-3f0b-11ed-8ff3-7cd30abc95d8');
c1	c2	c3
select * from view_1 where c2=hex(uuid_to_bin('854dc29c-3f0b-11ed-8ff3-7cd30abc95d8'));
c1	c2	c3
4	854DC29C3F0B11ED8FF37CD30ABC95D8	86D336C93F0B11ED9291B8599F1D613A
8	854DC29C3F0B11ED8FF37CD30ABC95D8	86D336C93F0B11ED9291B8599F1D613A
select * from view_1 where c2=hex(uuid_to_bin('854dc29c-3f0b-11ed-8ff3-7cd30abc95d8'))+hex(uuid_to_bin('867c697c-3f0b-11ed-9291-b8599f1d613a'));
c1	c2	c3
select * from view_1 where c2=hex(uuid_to_bin('854dc29c-3f0b-11ed-8ff3-7cd30abc95d8'))+hex(uuid_to_bin('86d336c9-3f0b-11ed-9291-b8599f1d613a'));
c1	c2	c3
select * from view_1 where c2=hex(uuid_to_bin('854dc29c-3f0b-11ed-8ff3-7cd30abc95d8'))+hex(uuid_to_bin('7945c0ae-3f0b-11ed-8ff3-7cd30abc95d8'));
c1	c2	c3
select * from view_1 where c2=hex(uuid_to_bin('854dc29c-3f0b-11ed-8ff3-7cd30abc95d8'))-hex(uuid_to_bin('7945c0ae-3f0b-11ed-8ff3-7cd30abc95d8'));
c1	c2	c3
select * from view_1 where c2=hex(uuid_to_bin('854dc29c-3f0b-11ed-8ff3-7cd30abc95d8'))*hex(uuid_to_bin('7945c0ae-3f0b-11ed-8ff3-7cd30abc95d8'));
c1	c2	c3
select * from view_1 where c2=hex(uuid_to_bin('854dc29c-3f0b-11ed-8ff3-7cd30abc95d8'))/hex(uuid_to_bin('7945c0ae-3f0b-11ed-8ff3-7cd30abc95d8'));
c1	c2	c3
select * from view_1 where c2=hex(uuid_to_bin('854dc29c-3f0b-11ed-8ff3-7cd30abc95d8'))+3;
c1	c2	c3
select * from view_1 where c2=hex(uuid_to_bin('854dc29c-3f0b-11ed-8ff3-7cd30abc95d8'))-3;
c1	c2	c3
select * from view_1 where c2=hex(uuid_to_bin('854dc29c-3f0b-11ed-8ff3-7cd30abc95d8'))+null;
c1	c2	c3
select * from view_1 where c2=hex(uuid_to_bin('854dc29c-3f0b-11ed-8ff3-7cd30abc95d8')) and c3=hex(uuid_to_bin('86d336c9-3f0b-11ed-9291-b8599f1d613a'));
c1	c2	c3
4	854DC29C3F0B11ED8FF37CD30ABC95D8	86D336C93F0B11ED9291B8599F1D613A
8	854DC29C3F0B11ED8FF37CD30ABC95D8	86D336C93F0B11ED9291B8599F1D613A
select * from view_1 where c2=hex(uuid_to_bin('854dc29c-3f0b-11ed-8ff3-7cd30abc95d8')) or c3=hex(uuid_to_bin('86d336c9-3f0b-11ed-9291-b8599f1d613a'));
c1	c2	c3
4	854DC29C3F0B11ED8FF37CD30ABC95D8	86D336C93F0B11ED9291B8599F1D613A
8	854DC29C3F0B11ED8FF37CD30ABC95D8	86D336C93F0B11ED9291B8599F1D613A
select * from view_1 where c2=hex(uuid_to_bin('854dc29c-3f0b-11ed-8ff3-7cd30abc95d8')) or c3=hex(uuid_to_bin('7e915fff-3f0b-11ed-9291-b8599f1d613a'));
c1	c2	c3
2	7945C0AE3F0B11ED8FF37CD30ABC95D8	7E915FFF3F0B11ED9291B8599F1D613A
4	854DC29C3F0B11ED8FF37CD30ABC95D8	86D336C93F0B11ED9291B8599F1D613A
6	7945C0AE3F0B11ED8FF37CD30ABC95D8	7E915FFF3F0B11ED9291B8599F1D613A
8	854DC29C3F0B11ED8FF37CD30ABC95D8	86D336C93F0B11ED9291B8599F1D613A
select * from view_1 where hex(uuid_to_bin('854dc29c-3f0b-11ed-8ff3-7cd30abc95d8'))=hex(uuid_to_bin('854dc29c-3f0b-11ed-8ff3-7cd30abc95d8'));
c1	c2	c3
1	661BE1C93F0B11ED8FF37CD30ABC95D8	658517A83F0B11ED9291B8599F1D613A
2	7945C0AE3F0B11ED8FF37CD30ABC95D8	7E915FFF3F0B11ED9291B8599F1D613A
3	84CB3D423F0B11ED8FF37CD30ABC95D8	867C697C3F0B11ED9291B8599F1D613A
4	854DC29C3F0B11ED8FF37CD30ABC95D8	86D336C93F0B11ED9291B8599F1D613A
5	661BE1C93F0B11ED8FF37CD30ABC95D8	658517A83F0B11ED9291B8599F1D613A
6	7945C0AE3F0B11ED8FF37CD30ABC95D8	7E915FFF3F0B11ED9291B8599F1D613A
7	84CB3D423F0B11ED8FF37CD30ABC95D8	867C697C3F0B11ED9291B8599F1D613A
8	854DC29C3F0B11ED8FF37CD30ABC95D8	86D336C93F0B11ED9291B8599F1D613A
select * from view_1 where hex(uuid_to_bin('7945c0ae-3f0b-11ed-8ff3-7cd30abc95d8'))=hex(uuid_to_bin('854dc29c-3f0b-11ed-8ff3-7cd30abc95d8'));
c1	c2	c3
select * from view_1 where hex(uuid_to_bin('7945c0ae-3f0b-11ed-8ff3-7cd30abc95d8'))=hex(uuid_to_bin('854dc29c-3f0b-11ed-8ff3-7cd30abc95d8'))
or hex(uuid_to_bin('7945c0ae-3f0b-11ed-8ff3-7cd30abc95d8'))=hex(uuid_to_bin('7945c0ae-3f0b-11ed-8ff3-7cd30abc95d8'));
c1	c2	c3
1	661BE1C93F0B11ED8FF37CD30ABC95D8	658517A83F0B11ED9291B8599F1D613A
2	7945C0AE3F0B11ED8FF37CD30ABC95D8	7E915FFF3F0B11ED9291B8599F1D613A
3	84CB3D423F0B11ED8FF37CD30ABC95D8	867C697C3F0B11ED9291B8599F1D613A
4	854DC29C3F0B11ED8FF37CD30ABC95D8	86D336C93F0B11ED9291B8599F1D613A
5	661BE1C93F0B11ED8FF37CD30ABC95D8	658517A83F0B11ED9291B8599F1D613A
6	7945C0AE3F0B11ED8FF37CD30ABC95D8	7E915FFF3F0B11ED9291B8599F1D613A
7	84CB3D423F0B11ED8FF37CD30ABC95D8	867C697C3F0B11ED9291B8599F1D613A
8	854DC29C3F0B11ED8FF37CD30ABC95D8	86D336C93F0B11ED9291B8599F1D613A
select * from view_1 where hex(uuid_to_bin('7945c0ae-3f0b-11ed-8ff3-7cd30abc95d8'))=hex(uuid_to_bin('854dc29c-3f0b-11ed-8ff3-7cd30abc95d8'))
and hex(uuid_to_bin('7945c0ae-3f0b-11ed-8ff3-7cd30abc95d8'))=hex(uuid_to_bin('7945c0ae-3f0b-11ed-8ff3-7cd30abc95d8'));
c1	c2	c3
select * from view_1 order by hex(uuid_to_bin('854dc29c-3f0b-11ed-8ff3-7cd30abc95d8')) asc;
c1	c2	c3
1	661BE1C93F0B11ED8FF37CD30ABC95D8	658517A83F0B11ED9291B8599F1D613A
2	7945C0AE3F0B11ED8FF37CD30ABC95D8	7E915FFF3F0B11ED9291B8599F1D613A
3	84CB3D423F0B11ED8FF37CD30ABC95D8	867C697C3F0B11ED9291B8599F1D613A
4	854DC29C3F0B11ED8FF37CD30ABC95D8	86D336C93F0B11ED9291B8599F1D613A
5	661BE1C93F0B11ED8FF37CD30ABC95D8	658517A83F0B11ED9291B8599F1D613A
6	7945C0AE3F0B11ED8FF37CD30ABC95D8	7E915FFF3F0B11ED9291B8599F1D613A
7	84CB3D423F0B11ED8FF37CD30ABC95D8	867C697C3F0B11ED9291B8599F1D613A
8	854DC29C3F0B11ED8FF37CD30ABC95D8	86D336C93F0B11ED9291B8599F1D613A
select * from view_1 order by hex(uuid_to_bin('854dc29c-3f0b-11ed-8ff3-7cd30abc95d8')) desc;
c1	c2	c3
1	661BE1C93F0B11ED8FF37CD30ABC95D8	658517A83F0B11ED9291B8599F1D613A
2	7945C0AE3F0B11ED8FF37CD30ABC95D8	7E915FFF3F0B11ED9291B8599F1D613A
3	84CB3D423F0B11ED8FF37CD30ABC95D8	867C697C3F0B11ED9291B8599F1D613A
4	854DC29C3F0B11ED8FF37CD30ABC95D8	86D336C93F0B11ED9291B8599F1D613A
5	661BE1C93F0B11ED8FF37CD30ABC95D8	658517A83F0B11ED9291B8599F1D613A
6	7945C0AE3F0B11ED8FF37CD30ABC95D8	7E915FFF3F0B11ED9291B8599F1D613A
7	84CB3D423F0B11ED8FF37CD30ABC95D8	867C697C3F0B11ED9291B8599F1D613A
8	854DC29C3F0B11ED8FF37CD30ABC95D8	86D336C93F0B11ED9291B8599F1D613A
select hex(uuid_to_bin('854dc29c-3f0b-11ed-8ff3-7cd30abc95d8')) from view_1 order by hex(uuid_to_bin('854dc29c-3f0b-11ed-8ff3-7cd30abc95d8')) asc;
hex(uuid_to_bin('854dc29c-3f0b-11ed-8ff3-7cd30abc95d8'))
854DC29C3F0B11ED8FF37CD30ABC95D8
854DC29C3F0B11ED8FF37CD30ABC95D8
854DC29C3F0B11ED8FF37CD30ABC95D8
854DC29C3F0B11ED8FF37CD30ABC95D8
854DC29C3F0B11ED8FF37CD30ABC95D8
854DC29C3F0B11ED8FF37CD30ABC95D8
854DC29C3F0B11ED8FF37CD30ABC95D8
854DC29C3F0B11ED8FF37CD30ABC95D8
select hex(uuid_to_bin('854dc29c-3f0b-11ed-8ff3-7cd30abc95d8')) from view_1 order by hex(uuid_to_bin('854dc29c-3f0b-11ed-8ff3-7cd30abc95d8')) desc;
hex(uuid_to_bin('854dc29c-3f0b-11ed-8ff3-7cd30abc95d8'))
854DC29C3F0B11ED8FF37CD30ABC95D8
854DC29C3F0B11ED8FF37CD30ABC95D8
854DC29C3F0B11ED8FF37CD30ABC95D8
854DC29C3F0B11ED8FF37CD30ABC95D8
854DC29C3F0B11ED8FF37CD30ABC95D8
854DC29C3F0B11ED8FF37CD30ABC95D8
854DC29C3F0B11ED8FF37CD30ABC95D8
854DC29C3F0B11ED8FF37CD30ABC95D8
select * from view_1 group by hex(uuid_to_bin('854dc29c-3f0b-11ed-8ff3-7cd30abc95d8')) HAVING hex(uuid_to_bin('854dc29c-3f0b-11ed-8ff3-7cd30abc95d8')) order by c1 asc;
c1	c2	c3
1	661BE1C93F0B11ED8FF37CD30ABC95D8	658517A83F0B11ED9291B8599F1D613A
Warnings:
Warning	1292	Truncated incorrect DOUBLE value: '854DC29C3F0B11ED8FF37CD30ABC95D8'
select * from view_1 group by hex(uuid_to_bin('854dc29c-3f0b-11ed-8ff3-7cd30abc95d8')) HAVING hex(uuid_to_bin('854dc29c-3f0b-11ed-8ff3-7cd30abc95d8')) order by c1 desc;
c1	c2	c3
8	854DC29C3F0B11ED8FF37CD30ABC95D8	86D336C93F0B11ED9291B8599F1D613A
Warnings:
Warning	1292	Truncated incorrect DOUBLE value: '854DC29C3F0B11ED8FF37CD30ABC95D8'
select * from view_1 group by hex(uuid_to_bin('854dc29c-3f0b-11ed-8ff3-7cd30abc95d8')) HAVING hex(uuid_to_bin('854dc29c-3f0b-11ed-8ff3-7cd30abc95d8')) order by hex(uuid_to_bin('854dc29c-3f0b-11ed-8ff3-7cd30abc95d8')) desc;
c1	c2	c3
1	661BE1C93F0B11ED8FF37CD30ABC95D8	658517A83F0B11ED9291B8599F1D613A
Warnings:
Warning	1292	Truncated incorrect DOUBLE value: '854DC29C3F0B11ED8FF37CD30ABC95D8'
select * from view_1 group by hex(uuid_to_bin('854dc29c-3f0b-11ed-8ff3-7cd30abc95d8')) HAVING hex(uuid_to_bin('854dc29c-3f0b-11ed-8ff3-7cd30abc95d8'))<2 order by c1 asc;
c1	c2	c3
Warnings:
Warning	1292	Truncated incorrect DECIMAL value: '854DC29C3F0B11ED8FF37CD30ABC95D8'
select * from view_1 group by hex(uuid_to_bin('854dc29c-3f0b-11ed-8ff3-7cd30abc95d8')) HAVING hex(uuid_to_bin('854dc29c-3f0b-11ed-8ff3-7cd30abc95d8'))>2 order by c1 asc;
c1	c2	c3
1	661BE1C93F0B11ED8FF37CD30ABC95D8	658517A83F0B11ED9291B8599F1D613A
Warnings:
Warning	1292	Truncated incorrect DECIMAL value: '854DC29C3F0B11ED8FF37CD30ABC95D8'
select * from view_1 group by hex(uuid_to_bin('854dc29c-3f0b-11ed-8ff3-7cd30abc95d8')) HAVING hex(uuid_to_bin('854dc29c-3f0b-11ed-8ff3-7cd30abc95d8'))=2 order by c1 asc;
c1	c2	c3
Warnings:
Warning	1292	Truncated incorrect DECIMAL value: '854DC29C3F0B11ED8FF37CD30ABC95D8'
select CASE c2  WHEN hex(uuid_to_bin('854dc29c-3f0b-11ed-8ff3-7cd30abc95d8')) THEN '男'  WHEN 0 THEN hex(uuid_to_bin('854dc29c-3f0b-11ed-8ff3-7cd30abc95d8'))  ELSE '其他' END  from view_1 order by c1 asc;
CASE c2  WHEN hex(uuid_to_bin('854dc29c-3f0b-11ed-8ff3-7cd30abc95d8')) THEN '男'  WHEN 0 THEN hex(uuid_to_bin('854dc29c-3f0b-11ed-8ff3-7cd30abc95d8'))  ELSE '其他' END
其他
其他
其他
男
其他
其他
其他
男
Warnings:
Warning	1292	Truncated incorrect DECIMAL value: '661BE1C93F0B11ED8FF37CD30ABC95D8'
Warning	1292	Truncated incorrect DECIMAL value: '7945C0AE3F0B11ED8FF37CD30ABC95D8'
Warning	1292	Truncated incorrect DECIMAL value: '84CB3D423F0B11ED8FF37CD30ABC95D8'
Warning	1292	Truncated incorrect DECIMAL value: '661BE1C93F0B11ED8FF37CD30ABC95D8'
Warning	1292	Truncated incorrect DECIMAL value: '7945C0AE3F0B11ED8FF37CD30ABC95D8'
Warning	1292	Truncated incorrect DECIMAL value: '84CB3D423F0B11ED8FF37CD30ABC95D8'
select CASE hex(uuid_to_bin('867c697c-3f0b-11ed-9291-b8599f1d613a')) WHEN hex(uuid_to_bin('854dc29c-3f0b-11ed-8ff3-7cd30abc95d8')) THEN '男'  WHEN 0 THEN hex(uuid_to_bin('854dc29c-3f0b-11ed-8ff3-7cd30abc95d8'))  ELSE '其他' END  from view_1 order by c1 asc;
CASE hex(uuid_to_bin('867c697c-3f0b-11ed-9291-b8599f1d613a')) WHEN hex(uuid_to_bin('854dc29c-3f0b-11ed-8ff3-7cd30abc95d8')) THEN '男'  WHEN 0 THEN hex(uuid_to_bin('854dc29c-3f0b-11ed-8ff3-7cd30abc95d8'))  ELSE '其他' END
其他
其他
其他
其他
其他
其他
其他
其他
Warnings:
Warning	1292	Truncated incorrect DECIMAL value: '867C697C3F0B11ED9291B8599F1D613A'
select CASE hex(uuid_to_bin('867c697c-3f0b-11ed-9291-b8599f1d613a')) WHEN hex(uuid_to_bin('854dc29c-3f0b-11ed-8ff3-7cd30abc95d8')) THEN '男'  WHEN hex(uuid_to_bin('854dc29c-3f0b-11ed-8ff3-7cd30abc95d8')) THEN hex(uuid_to_bin('854dc29c-3f0b-11ed-8ff3-7cd30abc95d8'))  ELSE '其他' END  from view_1 order by c1 asc;
CASE hex(uuid_to_bin('867c697c-3f0b-11ed-9291-b8599f1d613a')) WHEN hex(uuid_to_bin('854dc29c-3f0b-11ed-8ff3-7cd30abc95d8')) THEN '男'  WHEN hex(uuid_to_bin('854dc29c-3f0b-11ed-8ff3-7cd30abc95d8')) THEN hex(uuid_to_bin('854dc29c-3f0b-11ed-8ff3-7cd30abc95d
其他
其他
其他
其他
其他
其他
其他
其他
select * from view_1 where EXISTS(select c2 from view_1 where c2=hex(uuid_to_bin('854dc29c-3f0b-11ed-8ff3-7cd30abc95d8'))) order by c1 asc;
c1	c2	c3
1	661BE1C93F0B11ED8FF37CD30ABC95D8	658517A83F0B11ED9291B8599F1D613A
2	7945C0AE3F0B11ED8FF37CD30ABC95D8	7E915FFF3F0B11ED9291B8599F1D613A
3	84CB3D423F0B11ED8FF37CD30ABC95D8	867C697C3F0B11ED9291B8599F1D613A
4	854DC29C3F0B11ED8FF37CD30ABC95D8	86D336C93F0B11ED9291B8599F1D613A
5	661BE1C93F0B11ED8FF37CD30ABC95D8	658517A83F0B11ED9291B8599F1D613A
6	7945C0AE3F0B11ED8FF37CD30ABC95D8	7E915FFF3F0B11ED9291B8599F1D613A
7	84CB3D423F0B11ED8FF37CD30ABC95D8	867C697C3F0B11ED9291B8599F1D613A
8	854DC29C3F0B11ED8FF37CD30ABC95D8	86D336C93F0B11ED9291B8599F1D613A
select * from view_1 where EXISTS(select hex(uuid_to_bin('854dc29c-3f0b-11ed-8ff3-7cd30abc95d8')) from view_1 where c2=hex(uuid_to_bin('854dc29c-3f0b-11ed-8ff3-7cd30abc95d8'))) order by c1 asc;
c1	c2	c3
1	661BE1C93F0B11ED8FF37CD30ABC95D8	658517A83F0B11ED9291B8599F1D613A
2	7945C0AE3F0B11ED8FF37CD30ABC95D8	7E915FFF3F0B11ED9291B8599F1D613A
3	84CB3D423F0B11ED8FF37CD30ABC95D8	867C697C3F0B11ED9291B8599F1D613A
4	854DC29C3F0B11ED8FF37CD30ABC95D8	86D336C93F0B11ED9291B8599F1D613A
5	661BE1C93F0B11ED8FF37CD30ABC95D8	658517A83F0B11ED9291B8599F1D613A
6	7945C0AE3F0B11ED8FF37CD30ABC95D8	7E915FFF3F0B11ED9291B8599F1D613A
7	84CB3D423F0B11ED8FF37CD30ABC95D8	867C697C3F0B11ED9291B8599F1D613A
8	854DC29C3F0B11ED8FF37CD30ABC95D8	86D336C93F0B11ED9291B8599F1D613A
select * from view_1 where EXISTS(select hex(uuid_to_bin('854dc29c-3f0b-11ed-8ff3-7cd30abc95d8')) from view_1 where hex(uuid_to_bin('7945c0ae-3f0b-11ed-8ff3-7cd30abc95d8'))=hex(uuid_to_bin('854dc29c-3f0b-11ed-8ff3-7cd30abc95d8'))) order by c1 asc;
c1	c2	c3
select * from view_1 where not EXISTS(select c2 from view_1 where c2=hex(uuid_to_bin('854dc29c-3f0b-11ed-8ff3-7cd30abc95d8'))) order by c1 asc;
c1	c2	c3
select * from view_1 where not EXISTS(select hex(uuid_to_bin('854dc29c-3f0b-11ed-8ff3-7cd30abc95d8')) from view_1 where c2=hex(uuid_to_bin('854dc29c-3f0b-11ed-8ff3-7cd30abc95d8'))) order by c1 asc;
c1	c2	c3
select * from view_1 where not EXISTS(select hex(uuid_to_bin('854dc29c-3f0b-11ed-8ff3-7cd30abc95d8')) from view_1 where hex(uuid_to_bin('7945c0ae-3f0b-11ed-8ff3-7cd30abc95d8'))=hex(uuid_to_bin('854dc29c-3f0b-11ed-8ff3-7cd30abc95d8'))) order by c1 asc;
c1	c2	c3
1	661BE1C93F0B11ED8FF37CD30ABC95D8	658517A83F0B11ED9291B8599F1D613A
2	7945C0AE3F0B11ED8FF37CD30ABC95D8	7E915FFF3F0B11ED9291B8599F1D613A
3	84CB3D423F0B11ED8FF37CD30ABC95D8	867C697C3F0B11ED9291B8599F1D613A
4	854DC29C3F0B11ED8FF37CD30ABC95D8	86D336C93F0B11ED9291B8599F1D613A
5	661BE1C93F0B11ED8FF37CD30ABC95D8	658517A83F0B11ED9291B8599F1D613A
6	7945C0AE3F0B11ED8FF37CD30ABC95D8	7E915FFF3F0B11ED9291B8599F1D613A
7	84CB3D423F0B11ED8FF37CD30ABC95D8	867C697C3F0B11ED9291B8599F1D613A
8	854DC29C3F0B11ED8FF37CD30ABC95D8	86D336C93F0B11ED9291B8599F1D613A
select * from view_1 where c2 in(select c2 from view_1 where c2=hex(uuid_to_bin('854dc29c-3f0b-11ed-8ff3-7cd30abc95d8'))) order by c1 asc;
c1	c2	c3
4	854DC29C3F0B11ED8FF37CD30ABC95D8	86D336C93F0B11ED9291B8599F1D613A
8	854DC29C3F0B11ED8FF37CD30ABC95D8	86D336C93F0B11ED9291B8599F1D613A
select * from view_1 where c2 not in(select c2 from view_1 where c2=hex(uuid_to_bin('854dc29c-3f0b-11ed-8ff3-7cd30abc95d8'))) order by c1 asc;
c1	c2	c3
1	661BE1C93F0B11ED8FF37CD30ABC95D8	658517A83F0B11ED9291B8599F1D613A
2	7945C0AE3F0B11ED8FF37CD30ABC95D8	7E915FFF3F0B11ED9291B8599F1D613A
3	84CB3D423F0B11ED8FF37CD30ABC95D8	867C697C3F0B11ED9291B8599F1D613A
5	661BE1C93F0B11ED8FF37CD30ABC95D8	658517A83F0B11ED9291B8599F1D613A
6	7945C0AE3F0B11ED8FF37CD30ABC95D8	7E915FFF3F0B11ED9291B8599F1D613A
7	84CB3D423F0B11ED8FF37CD30ABC95D8	867C697C3F0B11ED9291B8599F1D613A
select * from view_1 where hex(uuid_to_bin('854dc29c-3f0b-11ed-8ff3-7cd30abc95d8')) in(select c2 from view_1 where c2=hex(uuid_to_bin('854dc29c-3f0b-11ed-8ff3-7cd30abc95d8'))) order by c1 asc;
c1	c2	c3
1	661BE1C93F0B11ED8FF37CD30ABC95D8	658517A83F0B11ED9291B8599F1D613A
2	7945C0AE3F0B11ED8FF37CD30ABC95D8	7E915FFF3F0B11ED9291B8599F1D613A
3	84CB3D423F0B11ED8FF37CD30ABC95D8	867C697C3F0B11ED9291B8599F1D613A
4	854DC29C3F0B11ED8FF37CD30ABC95D8	86D336C93F0B11ED9291B8599F1D613A
5	661BE1C93F0B11ED8FF37CD30ABC95D8	658517A83F0B11ED9291B8599F1D613A
6	7945C0AE3F0B11ED8FF37CD30ABC95D8	7E915FFF3F0B11ED9291B8599F1D613A
7	84CB3D423F0B11ED8FF37CD30ABC95D8	867C697C3F0B11ED9291B8599F1D613A
8	854DC29C3F0B11ED8FF37CD30ABC95D8	86D336C93F0B11ED9291B8599F1D613A
select * from view_1 where hex(uuid_to_bin('854dc29c-3f0b-11ed-8ff3-7cd30abc95d8')) not in(select c2 from view_1 where c2=hex(uuid_to_bin('854dc29c-3f0b-11ed-8ff3-7cd30abc95d8'))) order by c1 asc;
c1	c2	c3
select * from view_1 where c2=any(select c1 from view_1 where c2=hex(uuid_to_bin('854dc29c-3f0b-11ed-8ff3-7cd30abc95d8')) and c3=hex(uuid_to_bin('86d336c9-3f0b-11ed-9291-b8599f1d613a'))) order by c1 asc;
c1	c2	c3
Warnings:
Warning	1292	Truncated incorrect DECIMAL value: '661BE1C93F0B11ED8FF37CD30ABC95D8'
Warning	1292	Truncated incorrect DECIMAL value: '7945C0AE3F0B11ED8FF37CD30ABC95D8'
Warning	1292	Truncated incorrect DECIMAL value: '84CB3D423F0B11ED8FF37CD30ABC95D8'
Warning	1292	Truncated incorrect DECIMAL value: '854DC29C3F0B11ED8FF37CD30ABC95D8'
Warning	1292	Truncated incorrect DECIMAL value: '661BE1C93F0B11ED8FF37CD30ABC95D8'
Warning	1292	Truncated incorrect DECIMAL value: '7945C0AE3F0B11ED8FF37CD30ABC95D8'
Warning	1292	Truncated incorrect DECIMAL value: '84CB3D423F0B11ED8FF37CD30ABC95D8'
Warning	1292	Truncated incorrect DECIMAL value: '854DC29C3F0B11ED8FF37CD30ABC95D8'
select * from view_1 where c2>any(select c1 from view_1 where c2=hex(uuid_to_bin('854dc29c-3f0b-11ed-8ff3-7cd30abc95d8')) and c3=hex(uuid_to_bin('86d336c9-3f0b-11ed-9291-b8599f1d613a'))) order by c1 asc;
c1	c2	c3
1	661BE1C93F0B11ED8FF37CD30ABC95D8	658517A83F0B11ED9291B8599F1D613A
2	7945C0AE3F0B11ED8FF37CD30ABC95D8	7E915FFF3F0B11ED9291B8599F1D613A
3	84CB3D423F0B11ED8FF37CD30ABC95D8	867C697C3F0B11ED9291B8599F1D613A
4	854DC29C3F0B11ED8FF37CD30ABC95D8	86D336C93F0B11ED9291B8599F1D613A
5	661BE1C93F0B11ED8FF37CD30ABC95D8	658517A83F0B11ED9291B8599F1D613A
6	7945C0AE3F0B11ED8FF37CD30ABC95D8	7E915FFF3F0B11ED9291B8599F1D613A
7	84CB3D423F0B11ED8FF37CD30ABC95D8	867C697C3F0B11ED9291B8599F1D613A
8	854DC29C3F0B11ED8FF37CD30ABC95D8	86D336C93F0B11ED9291B8599F1D613A
Warnings:
Warning	1292	Truncated incorrect DECIMAL value: '661BE1C93F0B11ED8FF37CD30ABC95D8'
Warning	1292	Truncated incorrect DECIMAL value: '661BE1C93F0B11ED8FF37CD30ABC95D8'
Warning	1292	Truncated incorrect DECIMAL value: '7945C0AE3F0B11ED8FF37CD30ABC95D8'
Warning	1292	Truncated incorrect DECIMAL value: '7945C0AE3F0B11ED8FF37CD30ABC95D8'
Warning	1292	Truncated incorrect DECIMAL value: '84CB3D423F0B11ED8FF37CD30ABC95D8'
Warning	1292	Truncated incorrect DECIMAL value: '84CB3D423F0B11ED8FF37CD30ABC95D8'
Warning	1292	Truncated incorrect DECIMAL value: '854DC29C3F0B11ED8FF37CD30ABC95D8'
Warning	1292	Truncated incorrect DECIMAL value: '854DC29C3F0B11ED8FF37CD30ABC95D8'
Warning	1292	Truncated incorrect DECIMAL value: '661BE1C93F0B11ED8FF37CD30ABC95D8'
Warning	1292	Truncated incorrect DECIMAL value: '661BE1C93F0B11ED8FF37CD30ABC95D8'
Warning	1292	Truncated incorrect DECIMAL value: '7945C0AE3F0B11ED8FF37CD30ABC95D8'
Warning	1292	Truncated incorrect DECIMAL value: '7945C0AE3F0B11ED8FF37CD30ABC95D8'
Warning	1292	Truncated incorrect DECIMAL value: '84CB3D423F0B11ED8FF37CD30ABC95D8'
Warning	1292	Truncated incorrect DECIMAL value: '84CB3D423F0B11ED8FF37CD30ABC95D8'
Warning	1292	Truncated incorrect DECIMAL value: '854DC29C3F0B11ED8FF37CD30ABC95D8'
Warning	1292	Truncated incorrect DECIMAL value: '854DC29C3F0B11ED8FF37CD30ABC95D8'
select * from view_1 where c2<any(select c1 from view_1 where c2=hex(uuid_to_bin('854dc29c-3f0b-11ed-8ff3-7cd30abc95d8')) and c3=hex(uuid_to_bin('86d336c9-3f0b-11ed-9291-b8599f1d613a'))) order by c1 asc;
c1	c2	c3
Warnings:
Warning	1292	Truncated incorrect DECIMAL value: '661BE1C93F0B11ED8FF37CD30ABC95D8'
Warning	1292	Truncated incorrect DECIMAL value: '661BE1C93F0B11ED8FF37CD30ABC95D8'
Warning	1292	Truncated incorrect DECIMAL value: '7945C0AE3F0B11ED8FF37CD30ABC95D8'
Warning	1292	Truncated incorrect DECIMAL value: '7945C0AE3F0B11ED8FF37CD30ABC95D8'
Warning	1292	Truncated incorrect DECIMAL value: '84CB3D423F0B11ED8FF37CD30ABC95D8'
Warning	1292	Truncated incorrect DECIMAL value: '84CB3D423F0B11ED8FF37CD30ABC95D8'
Warning	1292	Truncated incorrect DECIMAL value: '854DC29C3F0B11ED8FF37CD30ABC95D8'
Warning	1292	Truncated incorrect DECIMAL value: '854DC29C3F0B11ED8FF37CD30ABC95D8'
Warning	1292	Truncated incorrect DECIMAL value: '661BE1C93F0B11ED8FF37CD30ABC95D8'
Warning	1292	Truncated incorrect DECIMAL value: '661BE1C93F0B11ED8FF37CD30ABC95D8'
Warning	1292	Truncated incorrect DECIMAL value: '7945C0AE3F0B11ED8FF37CD30ABC95D8'
Warning	1292	Truncated incorrect DECIMAL value: '7945C0AE3F0B11ED8FF37CD30ABC95D8'
Warning	1292	Truncated incorrect DECIMAL value: '84CB3D423F0B11ED8FF37CD30ABC95D8'
Warning	1292	Truncated incorrect DECIMAL value: '84CB3D423F0B11ED8FF37CD30ABC95D8'
Warning	1292	Truncated incorrect DECIMAL value: '854DC29C3F0B11ED8FF37CD30ABC95D8'
Warning	1292	Truncated incorrect DECIMAL value: '854DC29C3F0B11ED8FF37CD30ABC95D8'
select * from view_1 where c2=all(select c1 from view_1 where c2=hex(uuid_to_bin('854dc29c-3f0b-11ed-8ff3-7cd30abc95d8')) and c3=hex(uuid_to_bin('86d336c9-3f0b-11ed-9291-b8599f1d613a'))) order by c1 asc;
c1	c2	c3
Warnings:
Warning	1292	Truncated incorrect DECIMAL value: '661BE1C93F0B11ED8FF37CD30ABC95D8'
Warning	1292	Truncated incorrect DECIMAL value: '661BE1C93F0B11ED8FF37CD30ABC95D8'
Warning	1292	Truncated incorrect DECIMAL value: '7945C0AE3F0B11ED8FF37CD30ABC95D8'
Warning	1292	Truncated incorrect DECIMAL value: '7945C0AE3F0B11ED8FF37CD30ABC95D8'
Warning	1292	Truncated incorrect DECIMAL value: '84CB3D423F0B11ED8FF37CD30ABC95D8'
Warning	1292	Truncated incorrect DECIMAL value: '84CB3D423F0B11ED8FF37CD30ABC95D8'
Warning	1292	Truncated incorrect DECIMAL value: '854DC29C3F0B11ED8FF37CD30ABC95D8'
Warning	1292	Truncated incorrect DECIMAL value: '854DC29C3F0B11ED8FF37CD30ABC95D8'
Warning	1292	Truncated incorrect DECIMAL value: '661BE1C93F0B11ED8FF37CD30ABC95D8'
Warning	1292	Truncated incorrect DECIMAL value: '661BE1C93F0B11ED8FF37CD30ABC95D8'
Warning	1292	Truncated incorrect DECIMAL value: '7945C0AE3F0B11ED8FF37CD30ABC95D8'
Warning	1292	Truncated incorrect DECIMAL value: '7945C0AE3F0B11ED8FF37CD30ABC95D8'
Warning	1292	Truncated incorrect DECIMAL value: '84CB3D423F0B11ED8FF37CD30ABC95D8'
Warning	1292	Truncated incorrect DECIMAL value: '84CB3D423F0B11ED8FF37CD30ABC95D8'
Warning	1292	Truncated incorrect DECIMAL value: '854DC29C3F0B11ED8FF37CD30ABC95D8'
Warning	1292	Truncated incorrect DECIMAL value: '854DC29C3F0B11ED8FF37CD30ABC95D8'
select * from view_1 where c2>all(select c1 from view_1 where c2=hex(uuid_to_bin('854dc29c-3f0b-11ed-8ff3-7cd30abc95d8')) and c3=hex(uuid_to_bin('86d336c9-3f0b-11ed-9291-b8599f1d613a'))) order by c1 asc;
c1	c2	c3
1	661BE1C93F0B11ED8FF37CD30ABC95D8	658517A83F0B11ED9291B8599F1D613A
2	7945C0AE3F0B11ED8FF37CD30ABC95D8	7E915FFF3F0B11ED9291B8599F1D613A
3	84CB3D423F0B11ED8FF37CD30ABC95D8	867C697C3F0B11ED9291B8599F1D613A
4	854DC29C3F0B11ED8FF37CD30ABC95D8	86D336C93F0B11ED9291B8599F1D613A
5	661BE1C93F0B11ED8FF37CD30ABC95D8	658517A83F0B11ED9291B8599F1D613A
6	7945C0AE3F0B11ED8FF37CD30ABC95D8	7E915FFF3F0B11ED9291B8599F1D613A
7	84CB3D423F0B11ED8FF37CD30ABC95D8	867C697C3F0B11ED9291B8599F1D613A
8	854DC29C3F0B11ED8FF37CD30ABC95D8	86D336C93F0B11ED9291B8599F1D613A
Warnings:
Warning	1292	Truncated incorrect DECIMAL value: '661BE1C93F0B11ED8FF37CD30ABC95D8'
Warning	1292	Truncated incorrect DECIMAL value: '661BE1C93F0B11ED8FF37CD30ABC95D8'
Warning	1292	Truncated incorrect DECIMAL value: '661BE1C93F0B11ED8FF37CD30ABC95D8'
Warning	1292	Truncated incorrect DECIMAL value: '7945C0AE3F0B11ED8FF37CD30ABC95D8'
Warning	1292	Truncated incorrect DECIMAL value: '7945C0AE3F0B11ED8FF37CD30ABC95D8'
Warning	1292	Truncated incorrect DECIMAL value: '7945C0AE3F0B11ED8FF37CD30ABC95D8'
Warning	1292	Truncated incorrect DECIMAL value: '84CB3D423F0B11ED8FF37CD30ABC95D8'
Warning	1292	Truncated incorrect DECIMAL value: '84CB3D423F0B11ED8FF37CD30ABC95D8'
Warning	1292	Truncated incorrect DECIMAL value: '84CB3D423F0B11ED8FF37CD30ABC95D8'
Warning	1292	Truncated incorrect DECIMAL value: '854DC29C3F0B11ED8FF37CD30ABC95D8'
Warning	1292	Truncated incorrect DECIMAL value: '854DC29C3F0B11ED8FF37CD30ABC95D8'
Warning	1292	Truncated incorrect DECIMAL value: '854DC29C3F0B11ED8FF37CD30ABC95D8'
Warning	1292	Truncated incorrect DECIMAL value: '661BE1C93F0B11ED8FF37CD30ABC95D8'
Warning	1292	Truncated incorrect DECIMAL value: '661BE1C93F0B11ED8FF37CD30ABC95D8'
Warning	1292	Truncated incorrect DECIMAL value: '661BE1C93F0B11ED8FF37CD30ABC95D8'
Warning	1292	Truncated incorrect DECIMAL value: '7945C0AE3F0B11ED8FF37CD30ABC95D8'
Warning	1292	Truncated incorrect DECIMAL value: '7945C0AE3F0B11ED8FF37CD30ABC95D8'
Warning	1292	Truncated incorrect DECIMAL value: '7945C0AE3F0B11ED8FF37CD30ABC95D8'
Warning	1292	Truncated incorrect DECIMAL value: '84CB3D423F0B11ED8FF37CD30ABC95D8'
Warning	1292	Truncated incorrect DECIMAL value: '84CB3D423F0B11ED8FF37CD30ABC95D8'
Warning	1292	Truncated incorrect DECIMAL value: '84CB3D423F0B11ED8FF37CD30ABC95D8'
Warning	1292	Truncated incorrect DECIMAL value: '854DC29C3F0B11ED8FF37CD30ABC95D8'
Warning	1292	Truncated incorrect DECIMAL value: '854DC29C3F0B11ED8FF37CD30ABC95D8'
Warning	1292	Truncated incorrect DECIMAL value: '854DC29C3F0B11ED8FF37CD30ABC95D8'
select * from view_1 where c2<all(select c1 from view_1 where c2=hex(uuid_to_bin('854dc29c-3f0b-11ed-8ff3-7cd30abc95d8')) and c3=hex(uuid_to_bin('86d336c9-3f0b-11ed-9291-b8599f1d613a'))) order by c1 asc;
c1	c2	c3
Warnings:
Warning	1292	Truncated incorrect DECIMAL value: '661BE1C93F0B11ED8FF37CD30ABC95D8'
Warning	1292	Truncated incorrect DECIMAL value: '661BE1C93F0B11ED8FF37CD30ABC95D8'
Warning	1292	Truncated incorrect DECIMAL value: '661BE1C93F0B11ED8FF37CD30ABC95D8'
Warning	1292	Truncated incorrect DECIMAL value: '7945C0AE3F0B11ED8FF37CD30ABC95D8'
Warning	1292	Truncated incorrect DECIMAL value: '7945C0AE3F0B11ED8FF37CD30ABC95D8'
Warning	1292	Truncated incorrect DECIMAL value: '7945C0AE3F0B11ED8FF37CD30ABC95D8'
Warning	1292	Truncated incorrect DECIMAL value: '84CB3D423F0B11ED8FF37CD30ABC95D8'
Warning	1292	Truncated incorrect DECIMAL value: '84CB3D423F0B11ED8FF37CD30ABC95D8'
Warning	1292	Truncated incorrect DECIMAL value: '84CB3D423F0B11ED8FF37CD30ABC95D8'
Warning	1292	Truncated incorrect DECIMAL value: '854DC29C3F0B11ED8FF37CD30ABC95D8'
Warning	1292	Truncated incorrect DECIMAL value: '854DC29C3F0B11ED8FF37CD30ABC95D8'
Warning	1292	Truncated incorrect DECIMAL value: '854DC29C3F0B11ED8FF37CD30ABC95D8'
Warning	1292	Truncated incorrect DECIMAL value: '661BE1C93F0B11ED8FF37CD30ABC95D8'
Warning	1292	Truncated incorrect DECIMAL value: '661BE1C93F0B11ED8FF37CD30ABC95D8'
Warning	1292	Truncated incorrect DECIMAL value: '661BE1C93F0B11ED8FF37CD30ABC95D8'
Warning	1292	Truncated incorrect DECIMAL value: '7945C0AE3F0B11ED8FF37CD30ABC95D8'
Warning	1292	Truncated incorrect DECIMAL value: '7945C0AE3F0B11ED8FF37CD30ABC95D8'
Warning	1292	Truncated incorrect DECIMAL value: '7945C0AE3F0B11ED8FF37CD30ABC95D8'
Warning	1292	Truncated incorrect DECIMAL value: '84CB3D423F0B11ED8FF37CD30ABC95D8'
Warning	1292	Truncated incorrect DECIMAL value: '84CB3D423F0B11ED8FF37CD30ABC95D8'
Warning	1292	Truncated incorrect DECIMAL value: '84CB3D423F0B11ED8FF37CD30ABC95D8'
Warning	1292	Truncated incorrect DECIMAL value: '854DC29C3F0B11ED8FF37CD30ABC95D8'
Warning	1292	Truncated incorrect DECIMAL value: '854DC29C3F0B11ED8FF37CD30ABC95D8'
Warning	1292	Truncated incorrect DECIMAL value: '854DC29C3F0B11ED8FF37CD30ABC95D8'
select * from view_1 where c2 like '%(select c1 from view_1 where c2=hex(uuid_to_bin(854dc29c-3f0b-11ed-8ff3-7cd30abc95d8)) and c3=hex(uuid_to_bin(86d336c9-3f0b-11ed-9291-b8599f1d613a)))%' order by c1 asc;
c1	c2	c3
select * from view_1 where c2 like '%hex(uuid_to_bin(854dc29c-3f0b-11ed-8ff3-7cd30abc95d8))%' order by c1 asc;
c1	c2	c3
select * from view_1 where c2 like '%854dc29c%' order by c1 asc;
c1	c2	c3
4	854DC29C3F0B11ED8FF37CD30ABC95D8	86D336C93F0B11ED9291B8599F1D613A
8	854DC29C3F0B11ED8FF37CD30ABC95D8	86D336C93F0B11ED9291B8599F1D613A
#function-6     视图=====>update
update view_1 set c2=hex(uuid_to_bin('99cb3d42-3f0b-11ed-8ff3-7cd30abc95d8'))+hex(uuid_to_bin('84cb3d42-3f0b-11ed-8ff3-7cd30abc95d8')) where
c3=hex(uuid_to_bin('658517a8-3f0b-11ed-9291-b8599f1d613a'));
Warnings:
Warning	1292	Truncated incorrect DOUBLE value: '99CB3D423F0B11ED8FF37CD30ABC95D8'
Warning	1292	Truncated incorrect DOUBLE value: '84CB3D423F0B11ED8FF37CD30ABC95D8'
select * from view_1 order by c1 asc;
c1	c2	c3
1	183	658517A83F0B11ED9291B8599F1D613A
2	7945C0AE3F0B11ED8FF37CD30ABC95D8	7E915FFF3F0B11ED9291B8599F1D613A
3	84CB3D423F0B11ED8FF37CD30ABC95D8	867C697C3F0B11ED9291B8599F1D613A
4	854DC29C3F0B11ED8FF37CD30ABC95D8	86D336C93F0B11ED9291B8599F1D613A
5	183	658517A83F0B11ED9291B8599F1D613A
6	7945C0AE3F0B11ED8FF37CD30ABC95D8	7E915FFF3F0B11ED9291B8599F1D613A
7	84CB3D423F0B11ED8FF37CD30ABC95D8	867C697C3F0B11ED9291B8599F1D613A
8	854DC29C3F0B11ED8FF37CD30ABC95D8	86D336C93F0B11ED9291B8599F1D613A
update view_1 set c2=hex(uuid_to_bin('66cb3d42-3f0b-11ed-8ff3-7cd30abc95d8'))-hex(uuid_to_bin('84cb3d42-3f0b-11ed-8ff3-7cd30abc95d8')) where
c3=hex(uuid_to_bin('658517a8-3f0b-11ed-9291-b8599f1d613a'));
Warnings:
Warning	1292	Truncated incorrect DOUBLE value: '66CB3D423F0B11ED8FF37CD30ABC95D8'
Warning	1292	Truncated incorrect DOUBLE value: '84CB3D423F0B11ED8FF37CD30ABC95D8'
select * from view_1 order by c1 asc;
c1	c2	c3
1	-18	658517A83F0B11ED9291B8599F1D613A
2	7945C0AE3F0B11ED8FF37CD30ABC95D8	7E915FFF3F0B11ED9291B8599F1D613A
3	84CB3D423F0B11ED8FF37CD30ABC95D8	867C697C3F0B11ED9291B8599F1D613A
4	854DC29C3F0B11ED8FF37CD30ABC95D8	86D336C93F0B11ED9291B8599F1D613A
5	-18	658517A83F0B11ED9291B8599F1D613A
6	7945C0AE3F0B11ED8FF37CD30ABC95D8	7E915FFF3F0B11ED9291B8599F1D613A
7	84CB3D423F0B11ED8FF37CD30ABC95D8	867C697C3F0B11ED9291B8599F1D613A
8	854DC29C3F0B11ED8FF37CD30ABC95D8	86D336C93F0B11ED9291B8599F1D613A
update view_1 set c2=hex(uuid_to_bin('16cb3d42-3f0b-11ed-8ff3-7cd30abc95d8'))*hex(uuid_to_bin('84cb3d42-3f0b-11ed-8ff3-7cd30abc95d8')) where
c3=hex(uuid_to_bin('658517a8-3f0b-11ed-9291-b8599f1d613a'));
Warnings:
Warning	1292	Truncated incorrect DOUBLE value: '16CB3D423F0B11ED8FF37CD30ABC95D8'
Warning	1292	Truncated incorrect DOUBLE value: '84CB3D423F0B11ED8FF37CD30ABC95D8'
select * from view_1 order by c1 asc;
c1	c2	c3
1	1344	658517A83F0B11ED9291B8599F1D613A
2	7945C0AE3F0B11ED8FF37CD30ABC95D8	7E915FFF3F0B11ED9291B8599F1D613A
3	84CB3D423F0B11ED8FF37CD30ABC95D8	867C697C3F0B11ED9291B8599F1D613A
4	854DC29C3F0B11ED8FF37CD30ABC95D8	86D336C93F0B11ED9291B8599F1D613A
5	1344	658517A83F0B11ED9291B8599F1D613A
6	7945C0AE3F0B11ED8FF37CD30ABC95D8	7E915FFF3F0B11ED9291B8599F1D613A
7	84CB3D423F0B11ED8FF37CD30ABC95D8	867C697C3F0B11ED9291B8599F1D613A
8	854DC29C3F0B11ED8FF37CD30ABC95D8	86D336C93F0B11ED9291B8599F1D613A
update view_1 set c2=hex(uuid_to_bin('99cb3d42-3f0b-11ed-8ff3-7cd30abc95d8'))/hex(uuid_to_bin('84cb3d42-3f0b-11ed-8ff3-7cd30abc95d8')) where
c3=hex(uuid_to_bin('658517a8-3f0b-11ed-9291-b8599f1d613a'));
Warnings:
Warning	1292	Truncated incorrect DOUBLE value: '99CB3D423F0B11ED8FF37CD30ABC95D8'
Warning	1292	Truncated incorrect DOUBLE value: '84CB3D423F0B11ED8FF37CD30ABC95D8'
select * from view_1 order by c1 asc;
c1	c2	c3
1	1.1785714285714286	658517A83F0B11ED9291B8599F1D613A
2	7945C0AE3F0B11ED8FF37CD30ABC95D8	7E915FFF3F0B11ED9291B8599F1D613A
3	84CB3D423F0B11ED8FF37CD30ABC95D8	867C697C3F0B11ED9291B8599F1D613A
4	854DC29C3F0B11ED8FF37CD30ABC95D8	86D336C93F0B11ED9291B8599F1D613A
5	1.1785714285714286	658517A83F0B11ED9291B8599F1D613A
6	7945C0AE3F0B11ED8FF37CD30ABC95D8	7E915FFF3F0B11ED9291B8599F1D613A
7	84CB3D423F0B11ED8FF37CD30ABC95D8	867C697C3F0B11ED9291B8599F1D613A
8	854DC29C3F0B11ED8FF37CD30ABC95D8	86D336C93F0B11ED9291B8599F1D613A
update view_1 set c2=hex(uuid_to_bin('86cb3d42-3f0b-11ed-8ff3-7cd30abc95d8'))+5 where c3=hex(uuid_to_bin('658517a8-3f0b-11ed-9291-b8599f1d613a'));
Warnings:
Warning	1292	Truncated incorrect DOUBLE value: '86CB3D423F0B11ED8FF37CD30ABC95D8'
select * from view_1 order by c1 asc;
c1	c2	c3
1	91	658517A83F0B11ED9291B8599F1D613A
2	7945C0AE3F0B11ED8FF37CD30ABC95D8	7E915FFF3F0B11ED9291B8599F1D613A
3	84CB3D423F0B11ED8FF37CD30ABC95D8	867C697C3F0B11ED9291B8599F1D613A
4	854DC29C3F0B11ED8FF37CD30ABC95D8	86D336C93F0B11ED9291B8599F1D613A
5	91	658517A83F0B11ED9291B8599F1D613A
6	7945C0AE3F0B11ED8FF37CD30ABC95D8	7E915FFF3F0B11ED9291B8599F1D613A
7	84CB3D423F0B11ED8FF37CD30ABC95D8	867C697C3F0B11ED9291B8599F1D613A
8	854DC29C3F0B11ED8FF37CD30ABC95D8	86D336C93F0B11ED9291B8599F1D613A
update view_1 set c2=hex(uuid_to_bin('44cb3d42-3f0b-11ed-8ff3-7cd30abc95d8')),c3=hex(uuid_to_bin('10cb3d42-3f0b-11ed-8ff3-7cd30abc95d8'))
where c3=hex(uuid_to_bin('658517a8-3f0b-11ed-9291-b8599f1d613a'));
select * from view_1 order by c1 asc;
c1	c2	c3
1	44CB3D423F0B11ED8FF37CD30ABC95D8	10CB3D423F0B11ED8FF37CD30ABC95D8
2	7945C0AE3F0B11ED8FF37CD30ABC95D8	7E915FFF3F0B11ED9291B8599F1D613A
3	84CB3D423F0B11ED8FF37CD30ABC95D8	867C697C3F0B11ED9291B8599F1D613A
4	854DC29C3F0B11ED8FF37CD30ABC95D8	86D336C93F0B11ED9291B8599F1D613A
5	44CB3D423F0B11ED8FF37CD30ABC95D8	10CB3D423F0B11ED8FF37CD30ABC95D8
6	7945C0AE3F0B11ED8FF37CD30ABC95D8	7E915FFF3F0B11ED9291B8599F1D613A
7	84CB3D423F0B11ED8FF37CD30ABC95D8	867C697C3F0B11ED9291B8599F1D613A
8	854DC29C3F0B11ED8FF37CD30ABC95D8	86D336C93F0B11ED9291B8599F1D613A
update view_1 set c2=hex(uuid_to_bin('44cb3d42-3f0b-11ed-8ff3-7cd30abc95d8')),c3=hex(uuid_to_bin('10cb3d42-3f0b-11ed-8ff3-7cd30abc95d8'))
where c3=(select hex(uuid_to_bin('658517a8-3f0b-11ed-9291-b8599f1d613a')) from view_1);
select * from view_1 order by c1 asc;
c1	c2	c3
1	44CB3D423F0B11ED8FF37CD30ABC95D8	10CB3D423F0B11ED8FF37CD30ABC95D8
2	7945C0AE3F0B11ED8FF37CD30ABC95D8	7E915FFF3F0B11ED9291B8599F1D613A
3	84CB3D423F0B11ED8FF37CD30ABC95D8	867C697C3F0B11ED9291B8599F1D613A
4	854DC29C3F0B11ED8FF37CD30ABC95D8	86D336C93F0B11ED9291B8599F1D613A
5	44CB3D423F0B11ED8FF37CD30ABC95D8	10CB3D423F0B11ED8FF37CD30ABC95D8
6	7945C0AE3F0B11ED8FF37CD30ABC95D8	7E915FFF3F0B11ED9291B8599F1D613A
7	84CB3D423F0B11ED8FF37CD30ABC95D8	867C697C3F0B11ED9291B8599F1D613A
8	854DC29C3F0B11ED8FF37CD30ABC95D8	86D336C93F0B11ED9291B8599F1D613A
#function-6     视图=====>delete
DELETE from view_1 where c2=hex(uuid_to_bin('854dc29c-3f0b-11ed-8ff3-7cd30abc95d8'));
select * from view_1 order by c1 asc;
c1	c2	c3
1	44CB3D423F0B11ED8FF37CD30ABC95D8	10CB3D423F0B11ED8FF37CD30ABC95D8
2	7945C0AE3F0B11ED8FF37CD30ABC95D8	7E915FFF3F0B11ED9291B8599F1D613A
3	84CB3D423F0B11ED8FF37CD30ABC95D8	867C697C3F0B11ED9291B8599F1D613A
5	44CB3D423F0B11ED8FF37CD30ABC95D8	10CB3D423F0B11ED8FF37CD30ABC95D8
6	7945C0AE3F0B11ED8FF37CD30ABC95D8	7E915FFF3F0B11ED9291B8599F1D613A
7	84CB3D423F0B11ED8FF37CD30ABC95D8	867C697C3F0B11ED9291B8599F1D613A
DELETE from view_1 where c2=(select * from (select c2 from view_1 where c2=hex(uuid_to_bin('84cb3d42-3f0b-11ed-8ff3-7cd30abc95d8')))as a LIMIT 1);
select * from view_1 order by c1 asc;
c1	c2	c3
1	44CB3D423F0B11ED8FF37CD30ABC95D8	10CB3D423F0B11ED8FF37CD30ABC95D8
2	7945C0AE3F0B11ED8FF37CD30ABC95D8	7E915FFF3F0B11ED9291B8599F1D613A
5	44CB3D423F0B11ED8FF37CD30ABC95D8	10CB3D423F0B11ED8FF37CD30ABC95D8
6	7945C0AE3F0B11ED8FF37CD30ABC95D8	7E915FFF3F0B11ED9291B8599F1D613A
DELETE from view_1 where c2=hex(uuid_to_bin('7945c0ae-3f0b-11ed-8ff3-7cd30abc95d8')) and c3=hex(uuid_to_bin('10CB3D423F0B11ED8FF37CD30ABC95D8'));
select * from view_1 order by c1 asc;
c1	c2	c3
1	44CB3D423F0B11ED8FF37CD30ABC95D8	10CB3D423F0B11ED8FF37CD30ABC95D8
2	7945C0AE3F0B11ED8FF37CD30ABC95D8	7E915FFF3F0B11ED9291B8599F1D613A
5	44CB3D423F0B11ED8FF37CD30ABC95D8	10CB3D423F0B11ED8FF37CD30ABC95D8
6	7945C0AE3F0B11ED8FF37CD30ABC95D8	7E915FFF3F0B11ED9291B8599F1D613A
DELETE from view_1 where c2=hex(uuid_to_bin('7945c0ae-3f0b-11ed-8ff3-7cd30abc95d8')) or c3=hex(uuid_to_bin('10CB3D423F0B11ED8FF37CD30ABC95D8'));
select * from view_1 order by c1 asc;
c1	c2	c3
drop view view_1;
drop table test1;
#function-7     索引=====>唯一索引
drop table test1;
create table test1(c1 int PRIMARY key AUTO_INCREMENT,c2 varchar(100),c3 varchar(100));
insert into test1(c2,c3) values(hex(uuid_to_bin('661be1c9-3f0b-11ed-8ff3-7cd30abc95d8')),hex(uuid_to_bin('658517a8-3f0b-11ed-9291-b8599f1d613a')));
insert into test1(c2,c3) values(hex(uuid_to_bin('7945c0ae-3f0b-11ed-8ff3-7cd30abc95d8')),hex(uuid_to_bin('7e915fff-3f0b-11ed-9291-b8599f1d613a')));
insert into test1(c2,c3) values(hex(uuid_to_bin('84cb3d42-3f0b-11ed-8ff3-7cd30abc95d8')),hex(uuid_to_bin('867c697c-3f0b-11ed-9291-b8599f1d613a')));
insert into test1(c2,c3) values(hex(uuid_to_bin('854dc29c-3f0b-11ed-8ff3-7cd30abc95d8')),hex(uuid_to_bin('86d336c9-3f0b-11ed-9291-b8599f1d613a')));
select * from test1 order by c1 asc;
c1	c2	c3
1	661BE1C93F0B11ED8FF37CD30ABC95D8	658517A83F0B11ED9291B8599F1D613A
2	7945C0AE3F0B11ED8FF37CD30ABC95D8	7E915FFF3F0B11ED9291B8599F1D613A
3	84CB3D423F0B11ED8FF37CD30ABC95D8	867C697C3F0B11ED9291B8599F1D613A
4	854DC29C3F0B11ED8FF37CD30ABC95D8	86D336C93F0B11ED9291B8599F1D613A
create UNIQUE index index_1 on test1(c2);
insert into test1(c2,c3) values(hex(uuid_to_bin('854dc29c-3f0b-11ed-8ff3-7cd30abc95d8')),hex(uuid_to_bin('86d336c9-3f0b-11ed-9291-b8599f1d613a')));
insert into test1(c2,c3) select c2,c3 from test1;
insert into test1(c2,c3) values(hex(uuid_to_bin('84cb3d43-3f0b-11ed-8ff3-7cd30abc95d8')),hex(uuid_to_bin('867c699c-3f0b-11ed-9291-b8599f1d613a')));
select c2,c3 from test1 order by c2 asc;
c2	c3
661BE1C93F0B11ED8FF37CD30ABC95D8	658517A83F0B11ED9291B8599F1D613A
7945C0AE3F0B11ED8FF37CD30ABC95D8	7E915FFF3F0B11ED9291B8599F1D613A
84CB3D423F0B11ED8FF37CD30ABC95D8	867C697C3F0B11ED9291B8599F1D613A
84CB3D433F0B11ED8FF37CD30ABC95D8	867C699C3F0B11ED9291B8599F1D613A
854DC29C3F0B11ED8FF37CD30ABC95D8	86D336C93F0B11ED9291B8599F1D613A
update test1 set c2=hex(uuid_to_bin('7945c0ae-3f0b-11ed-8ff3-7cd30abc95d8')) where c3=hex(uuid_to_bin('7e915fff-3f0b-11ed-9291-b8599f1d613a'));
select c2,c3 from test1 order by c2 asc;
c2	c3
661BE1C93F0B11ED8FF37CD30ABC95D8	658517A83F0B11ED9291B8599F1D613A
7945C0AE3F0B11ED8FF37CD30ABC95D8	7E915FFF3F0B11ED9291B8599F1D613A
84CB3D423F0B11ED8FF37CD30ABC95D8	867C697C3F0B11ED9291B8599F1D613A
84CB3D433F0B11ED8FF37CD30ABC95D8	867C699C3F0B11ED9291B8599F1D613A
854DC29C3F0B11ED8FF37CD30ABC95D8	86D336C93F0B11ED9291B8599F1D613A
update test1 set c2=hex(uuid_to_bin('7945c0ae-3f0b-11ed-8ff3-7cd30abc95d8')) where c2=hex(uuid_to_bin('854dc29c-3f0b-11ed-8ff3-7cd30abc95d8'));
update test1 set c2=(select c2 from test1 where c2=hex(uuid_to_bin('7945c0ae-3f0b-11ed-8ff3-7cd30abc95d8'))) where c2=hex(uuid_to_bin('854dc29c-3f0b-11ed-8ff3-7cd30abc95d8'));
drop table test1;
#function-7     索引=====>复合索引
drop table test1;
create table test1(c1 int PRIMARY key AUTO_INCREMENT,c2 varchar(100),c3 varchar(100));
insert into test1(c2,c3) values(hex(uuid_to_bin('661be1c9-3f0b-11ed-8ff3-7cd30abc95d8')),hex(uuid_to_bin('658517a8-3f0b-11ed-9291-b8599f1d613a')));
insert into test1(c2,c3) values(hex(uuid_to_bin('7945c0ae-3f0b-11ed-8ff3-7cd30abc95d8')),hex(uuid_to_bin('7e915fff-3f0b-11ed-9291-b8599f1d613a')));
insert into test1(c2,c3) values(hex(uuid_to_bin('84cb3d42-3f0b-11ed-8ff3-7cd30abc95d8')),hex(uuid_to_bin('867c697c-3f0b-11ed-9291-b8599f1d613a')));
insert into test1(c2,c3) values(hex(uuid_to_bin('854dc29c-3f0b-11ed-8ff3-7cd30abc95d8')),hex(uuid_to_bin('86d336c9-3f0b-11ed-9291-b8599f1d613a')));
select * from test1 order by c1 asc;
c1	c2	c3
1	661BE1C93F0B11ED8FF37CD30ABC95D8	658517A83F0B11ED9291B8599F1D613A
2	7945C0AE3F0B11ED8FF37CD30ABC95D8	7E915FFF3F0B11ED9291B8599F1D613A
3	84CB3D423F0B11ED8FF37CD30ABC95D8	867C697C3F0B11ED9291B8599F1D613A
4	854DC29C3F0B11ED8FF37CD30ABC95D8	86D336C93F0B11ED9291B8599F1D613A
create index index_1 on test1(c2,c3);
insert into test1(c2,c3) values(hex(uuid_to_bin('854dc29c-3f0b-11ed-8ff3-7cd30abc95d8')),hex(uuid_to_bin('86d336c9-3f0b-11ed-9291-b8599f1d613a')));
insert into test1(c2,c3) select c2,c3 from test1;
insert into test1(c2,c3) values(hex(uuid_to_bin('84cb3d43-3f0b-11ed-8ff3-7cd30abc95d8')),hex(uuid_to_bin('867c699c-3f0b-11ed-9291-b8599f1d613a')));
select c2,c3 from test1 order by c2 asc;
c2	c3
661BE1C93F0B11ED8FF37CD30ABC95D8	658517A83F0B11ED9291B8599F1D613A
661BE1C93F0B11ED8FF37CD30ABC95D8	658517A83F0B11ED9291B8599F1D613A
7945C0AE3F0B11ED8FF37CD30ABC95D8	7E915FFF3F0B11ED9291B8599F1D613A
7945C0AE3F0B11ED8FF37CD30ABC95D8	7E915FFF3F0B11ED9291B8599F1D613A
84CB3D423F0B11ED8FF37CD30ABC95D8	867C697C3F0B11ED9291B8599F1D613A
84CB3D423F0B11ED8FF37CD30ABC95D8	867C697C3F0B11ED9291B8599F1D613A
84CB3D433F0B11ED8FF37CD30ABC95D8	867C699C3F0B11ED9291B8599F1D613A
854DC29C3F0B11ED8FF37CD30ABC95D8	86D336C93F0B11ED9291B8599F1D613A
854DC29C3F0B11ED8FF37CD30ABC95D8	86D336C93F0B11ED9291B8599F1D613A
854DC29C3F0B11ED8FF37CD30ABC95D8	86D336C93F0B11ED9291B8599F1D613A
854DC29C3F0B11ED8FF37CD30ABC95D8	86D336C93F0B11ED9291B8599F1D613A
update test1 set c2=hex(uuid_to_bin('7945c0ae-3f0b-11ed-8ff3-7cd30abc95d8')) where c3=hex(uuid_to_bin('7e915fff-3f0b-11ed-9291-b8599f1d613a'));
select c2,c3 from test1 order by c2 asc;
c2	c3
661BE1C93F0B11ED8FF37CD30ABC95D8	658517A83F0B11ED9291B8599F1D613A
661BE1C93F0B11ED8FF37CD30ABC95D8	658517A83F0B11ED9291B8599F1D613A
7945C0AE3F0B11ED8FF37CD30ABC95D8	7E915FFF3F0B11ED9291B8599F1D613A
7945C0AE3F0B11ED8FF37CD30ABC95D8	7E915FFF3F0B11ED9291B8599F1D613A
84CB3D423F0B11ED8FF37CD30ABC95D8	867C697C3F0B11ED9291B8599F1D613A
84CB3D423F0B11ED8FF37CD30ABC95D8	867C697C3F0B11ED9291B8599F1D613A
84CB3D433F0B11ED8FF37CD30ABC95D8	867C699C3F0B11ED9291B8599F1D613A
854DC29C3F0B11ED8FF37CD30ABC95D8	86D336C93F0B11ED9291B8599F1D613A
854DC29C3F0B11ED8FF37CD30ABC95D8	86D336C93F0B11ED9291B8599F1D613A
854DC29C3F0B11ED8FF37CD30ABC95D8	86D336C93F0B11ED9291B8599F1D613A
854DC29C3F0B11ED8FF37CD30ABC95D8	86D336C93F0B11ED9291B8599F1D613A
update test1 set c2=hex(uuid_to_bin('7945c0ae-3f0b-11ed-8ff3-7cd30abc95d8')) where c2=hex(uuid_to_bin('854dc29c-3f0b-11ed-8ff3-7cd30abc95d8'));
select c2,c3 from test1 order by c2 asc;
c2	c3
661BE1C93F0B11ED8FF37CD30ABC95D8	658517A83F0B11ED9291B8599F1D613A
661BE1C93F0B11ED8FF37CD30ABC95D8	658517A83F0B11ED9291B8599F1D613A
7945C0AE3F0B11ED8FF37CD30ABC95D8	7E915FFF3F0B11ED9291B8599F1D613A
7945C0AE3F0B11ED8FF37CD30ABC95D8	7E915FFF3F0B11ED9291B8599F1D613A
7945C0AE3F0B11ED8FF37CD30ABC95D8	86D336C93F0B11ED9291B8599F1D613A
7945C0AE3F0B11ED8FF37CD30ABC95D8	86D336C93F0B11ED9291B8599F1D613A
7945C0AE3F0B11ED8FF37CD30ABC95D8	86D336C93F0B11ED9291B8599F1D613A
7945C0AE3F0B11ED8FF37CD30ABC95D8	86D336C93F0B11ED9291B8599F1D613A
84CB3D423F0B11ED8FF37CD30ABC95D8	867C697C3F0B11ED9291B8599F1D613A
84CB3D423F0B11ED8FF37CD30ABC95D8	867C697C3F0B11ED9291B8599F1D613A
84CB3D433F0B11ED8FF37CD30ABC95D8	867C699C3F0B11ED9291B8599F1D613A
update test1 set c2=(select c2 from test1 where c2=hex(uuid_to_bin('7945c0ae-3f0b-11ed-8ff3-7cd30abc95d8'))) where c2=hex(uuid_to_bin('854dc29c-3f0b-11ed-8ff3-7cd30abc95d8'));
update test1 set c2=hex(uuid_to_bin('7945c0ae-3f0b-11ed-8ff3-7cd30abc95d8')),c3=hex(uuid_to_bin('7e915fff-3f0b-11ed-9291-b8599f1d613a')) where c2=hex(uuid_to_bin('854dc29c-3f0b-11ed-8ff3-7cd30abc95d8'));
select c2,c3 from test1 order by c2 asc;
c2	c3
661BE1C93F0B11ED8FF37CD30ABC95D8	658517A83F0B11ED9291B8599F1D613A
661BE1C93F0B11ED8FF37CD30ABC95D8	658517A83F0B11ED9291B8599F1D613A
7945C0AE3F0B11ED8FF37CD30ABC95D8	7E915FFF3F0B11ED9291B8599F1D613A
7945C0AE3F0B11ED8FF37CD30ABC95D8	7E915FFF3F0B11ED9291B8599F1D613A
7945C0AE3F0B11ED8FF37CD30ABC95D8	86D336C93F0B11ED9291B8599F1D613A
7945C0AE3F0B11ED8FF37CD30ABC95D8	86D336C93F0B11ED9291B8599F1D613A
7945C0AE3F0B11ED8FF37CD30ABC95D8	86D336C93F0B11ED9291B8599F1D613A
7945C0AE3F0B11ED8FF37CD30ABC95D8	86D336C93F0B11ED9291B8599F1D613A
84CB3D423F0B11ED8FF37CD30ABC95D8	867C697C3F0B11ED9291B8599F1D613A
84CB3D423F0B11ED8FF37CD30ABC95D8	867C697C3F0B11ED9291B8599F1D613A
84CB3D433F0B11ED8FF37CD30ABC95D8	867C699C3F0B11ED9291B8599F1D613A
drop table test1;
#function-7     索引=====>普通索引
drop table test1;
create table test1(c1 int PRIMARY key AUTO_INCREMENT,c2 varchar(100),c3 varchar(100));
insert into test1(c2,c3) values(hex(uuid_to_bin('661be1c9-3f0b-11ed-8ff3-7cd30abc95d8')),hex(uuid_to_bin('658517a8-3f0b-11ed-9291-b8599f1d613a')));
insert into test1(c2,c3) values(hex(uuid_to_bin('7945c0ae-3f0b-11ed-8ff3-7cd30abc95d8')),hex(uuid_to_bin('7e915fff-3f0b-11ed-9291-b8599f1d613a')));
insert into test1(c2,c3) values(hex(uuid_to_bin('84cb3d42-3f0b-11ed-8ff3-7cd30abc95d8')),hex(uuid_to_bin('867c697c-3f0b-11ed-9291-b8599f1d613a')));
insert into test1(c2,c3) values(hex(uuid_to_bin('854dc29c-3f0b-11ed-8ff3-7cd30abc95d8')),hex(uuid_to_bin('86d336c9-3f0b-11ed-9291-b8599f1d613a')));
select * from test1 order by c1 asc;
c1	c2	c3
1	661BE1C93F0B11ED8FF37CD30ABC95D8	658517A83F0B11ED9291B8599F1D613A
2	7945C0AE3F0B11ED8FF37CD30ABC95D8	7E915FFF3F0B11ED9291B8599F1D613A
3	84CB3D423F0B11ED8FF37CD30ABC95D8	867C697C3F0B11ED9291B8599F1D613A
4	854DC29C3F0B11ED8FF37CD30ABC95D8	86D336C93F0B11ED9291B8599F1D613A
create index index_1 on test1(c2);
insert into test1(c2,c3) values(hex(uuid_to_bin('854dc29c-3f0b-11ed-8ff3-7cd30abc95d8')),hex(uuid_to_bin('86d336c9-3f0b-11ed-9291-b8599f1d613a')));
insert into test1(c2,c3) select c2,c3 from test1;
insert into test1(c2,c3) values(hex(uuid_to_bin('84cb3d43-3f0b-11ed-8ff3-7cd30abc95d8')),hex(uuid_to_bin('867c699c-3f0b-11ed-9291-b8599f1d613a')));
select c2,c3 from test1 order by c2 asc;
c2	c3
661BE1C93F0B11ED8FF37CD30ABC95D8	658517A83F0B11ED9291B8599F1D613A
661BE1C93F0B11ED8FF37CD30ABC95D8	658517A83F0B11ED9291B8599F1D613A
7945C0AE3F0B11ED8FF37CD30ABC95D8	7E915FFF3F0B11ED9291B8599F1D613A
7945C0AE3F0B11ED8FF37CD30ABC95D8	7E915FFF3F0B11ED9291B8599F1D613A
84CB3D423F0B11ED8FF37CD30ABC95D8	867C697C3F0B11ED9291B8599F1D613A
84CB3D423F0B11ED8FF37CD30ABC95D8	867C697C3F0B11ED9291B8599F1D613A
84CB3D433F0B11ED8FF37CD30ABC95D8	867C699C3F0B11ED9291B8599F1D613A
854DC29C3F0B11ED8FF37CD30ABC95D8	86D336C93F0B11ED9291B8599F1D613A
854DC29C3F0B11ED8FF37CD30ABC95D8	86D336C93F0B11ED9291B8599F1D613A
854DC29C3F0B11ED8FF37CD30ABC95D8	86D336C93F0B11ED9291B8599F1D613A
854DC29C3F0B11ED8FF37CD30ABC95D8	86D336C93F0B11ED9291B8599F1D613A
update test1 set c2=hex(uuid_to_bin('7945c0ae-3f0b-11ed-8ff3-7cd30abc95d8')) where c3=hex(uuid_to_bin('7e915fff-3f0b-11ed-9291-b8599f1d613a'));
select c2,c3 from test1 order by c2 asc;
c2	c3
661BE1C93F0B11ED8FF37CD30ABC95D8	658517A83F0B11ED9291B8599F1D613A
661BE1C93F0B11ED8FF37CD30ABC95D8	658517A83F0B11ED9291B8599F1D613A
7945C0AE3F0B11ED8FF37CD30ABC95D8	7E915FFF3F0B11ED9291B8599F1D613A
7945C0AE3F0B11ED8FF37CD30ABC95D8	7E915FFF3F0B11ED9291B8599F1D613A
84CB3D423F0B11ED8FF37CD30ABC95D8	867C697C3F0B11ED9291B8599F1D613A
84CB3D423F0B11ED8FF37CD30ABC95D8	867C697C3F0B11ED9291B8599F1D613A
84CB3D433F0B11ED8FF37CD30ABC95D8	867C699C3F0B11ED9291B8599F1D613A
854DC29C3F0B11ED8FF37CD30ABC95D8	86D336C93F0B11ED9291B8599F1D613A
854DC29C3F0B11ED8FF37CD30ABC95D8	86D336C93F0B11ED9291B8599F1D613A
854DC29C3F0B11ED8FF37CD30ABC95D8	86D336C93F0B11ED9291B8599F1D613A
854DC29C3F0B11ED8FF37CD30ABC95D8	86D336C93F0B11ED9291B8599F1D613A
update test1 set c2=hex(uuid_to_bin('7945c0ae-3f0b-11ed-8ff3-7cd30abc95d8')) where c2=hex(uuid_to_bin('854dc29c-3f0b-11ed-8ff3-7cd30abc95d8'));
update test1 set c2=(select c2 from test1 where c2=hex(uuid_to_bin('7945c0ae-3f0b-11ed-8ff3-7cd30abc95d8'))) where c2=hex(uuid_to_bin('854dc29c-3f0b-11ed-8ff3-7cd30abc95d8'));
drop table test1;
# Clean up users
drop user hjw@'%' ;
