drop table if exists t1,t2,t3,t4,t5,t6,t7,t8,t11,t12;
select (select 2);
(select 2)
2
EXPLAIN  select (select 2);
Query Plan
==========================================
|ID|OPERATOR  |NAME|EST.ROWS|EST.TIME(us)|
------------------------------------------
|0 |EXPRESSION|    |1       |1           |
==========================================
Outputs & filters:
-------------------------------------
  0 - output([2]), filter(nil)
      values({2})
SELECT (SELECT 1) UNION SELECT (SELECT 2);
(SELECT 1)
1
2
EXPLAIN  SELECT (SELECT 1) UNION SELECT (SELECT 2);
Query Plan
====================================================
|ID|OPERATOR            |NAME|EST.ROWS|EST.TIME(us)|
----------------------------------------------------
|0 |MERGE UNION DISTINCT|    |2       |1           |
|1 |├─EXPRESSION        |    |1       |1           |
|2 |└─EXPRESSION        |    |1       |1           |
====================================================
Outputs & filters:
-------------------------------------
  0 - output([UNION([1])]), filter(nil), rowset=16
  1 - output([1]), filter(nil)
      values({1})
  2 - output([2]), filter(nil)
      values({2})
SELECT (SELECT (SELECT 0 UNION SELECT 0));
(SELECT (SELECT 0 UNION SELECT 0))
0
EXPLAIN  SELECT (SELECT (SELECT 0 UNION SELECT 0));
Query Plan
================================================================
|ID|OPERATOR               |NAME         |EST.ROWS|EST.TIME(us)|
----------------------------------------------------------------
|0 |SUBPLAN FILTER         |             |1       |1           |
|1 |├─EXPRESSION           |             |1       |1           |
|2 |└─HASH DISTINCT        |             |2       |1           |
|3 |  └─VALUES TABLE ACCESS|VALUES_TABLE1|2       |1           |
================================================================
Outputs & filters:
-------------------------------------
  0 - output([:0]), filter(nil), rowset=16
      exec_params_(nil), onetime_exprs_([subquery(1)(:0)]), init_plan_idxs_(nil), use_batch=false
  1 - output([1]), filter(nil)
      values({1})
  2 - output([VALUES_TABLE1.column_0]), filter(nil), rowset=16
      distinct([VALUES_TABLE1.column_0])
  3 - output([VALUES_TABLE1.column_0]), filter(nil)
      access([VALUES_TABLE1.column_0])
SELECT (SELECT 1 FROM (SELECT 1) as b HAVING a=1) as a;
ERROR 42S22: Unknown column 'a' in 'having clause'
SELECT (SELECT 1),MAX(1) FROM (SELECT 1) as a;
(SELECT 1)	MAX(1)
1	1
EXPLAIN  SELECT 1 FROM (SELECT 1 as a) as b  HAVING (SELECT a)=1;
ERROR 42S22: Unknown column 'a' in 'field list'
SELECT 1 FROM (SELECT 1 as a) as b HAVING (SELECT a)=1;
ERROR 42S22: Unknown column 'a' in 'field list'
SELECT (SELECT 1), a;
ERROR 42S22: Unknown column 'a' in 'field list'
SELECT 1 FROM (SELECT (SELECT a) b) c;
ERROR 42S22: Unknown column 'a' in 'field list'
SELECT * FROM (SELECT 1 as id) b WHERE id IN (SELECT * FROM (SELECT 1 as id) c ORDER BY id);
id
1
SELECT * FROM (SELECT 1) a  WHERE 1 IN (SELECT 1,1);
ERROR 21000: Operand should contain 1 column(s)
SELECT 1 IN (SELECT 1);
1 IN (SELECT 1)
1
SELECT 1 FROM (SELECT 1 as a) b WHERE 1 IN (SELECT (SELECT a));
1
1
SELECT 1 FROM (SELECT 1) a PROCEDURE ANALYSE((SELECT 1));
ERROR 42000: You have an error in your SQL syntax; check the manual that corresponds to your OceanBase version for the right syntax to use near 'PROCEDURE ANALYSE((SELECT 1))' at line 1
SELECT (SELECT 1) as a FROM (SELECT 1) b WHERE (SELECT a) IS NULL;
ERROR 42S22: Unknown column 'a' in 'field list'
SELECT (SELECT 1) as a FROM (SELECT 1) b WHERE (SELECT a) IS NOT NULL;
ERROR 42S22: Unknown column 'a' in 'field list'
SELECT (SELECT 1,2,3) = ROW(1,2,3);
(SELECT 1,2,3) = ROW(1,2,3)
1
SELECT (SELECT 1,2,3) = ROW(1,2,1);
(SELECT 1,2,3) = ROW(1,2,1)
0
SELECT (SELECT 1,2,3) < ROW(1,2,1);
(SELECT 1,2,3) < ROW(1,2,1)
0
SELECT (SELECT 1,2,3) > ROW(1,2,1);
(SELECT 1,2,3) > ROW(1,2,1)
1
SELECT (SELECT 1,2,3) = ROW(1,2,NULL);
(SELECT 1,2,3) = ROW(1,2,NULL)
NULL
SELECT ROW(1,2,3) = (SELECT 1,2,3);
ROW(1,2,3) = (SELECT 1,2,3)
1
SELECT ROW(1,2,3) = (SELECT 1,2,1);
ROW(1,2,3) = (SELECT 1,2,1)
0
SELECT ROW(1,2,3) < (SELECT 1,2,1);
ROW(1,2,3) < (SELECT 1,2,1)
0
SELECT ROW(1,2,3) > (SELECT 1,2,1);
ROW(1,2,3) > (SELECT 1,2,1)
1
SELECT ROW(1,2,3) = (SELECT 1,2,NULL);
ROW(1,2,3) = (SELECT 1,2,NULL)
NULL
SELECT (SELECT 1.5,2,'a') = ROW(1.5,2,'a');
(SELECT 1.5,2,'a') = ROW(1.5,2,'a')
1
SELECT (SELECT 1.5,2,'a') = ROW(1.5,2,'b');
(SELECT 1.5,2,'a') = ROW(1.5,2,'b')
0
SELECT (SELECT 1.5,2,'a') = ROW('1.5b',2,'b');
(SELECT 1.5,2,'a') = ROW('1.5b',2,'b')
0
Warnings:
Warning	1292	Truncated incorrect DECIMAL value: '1.5b'
SELECT (SELECT 'b',2,'a') = ROW(1.5,2,'a');
(SELECT 'b',2,'a') = ROW(1.5,2,'a')
0
Warnings:
Warning	1292	Truncated incorrect DECIMAL value: 'b'
SELECT (SELECT 1.5,2,'a') = ROW(1.5,'2','a');
(SELECT 1.5,2,'a') = ROW(1.5,'2','a')
1
SELECT (SELECT 1.5,'c','a') = ROW(1.5,2,'a');
(SELECT 1.5,'c','a') = ROW(1.5,2,'a')
0
Warnings:
Warning	1292	Truncated incorrect DECIMAL value: 'c'
SELECT (SELECT * FROM (SELECT 'test' a,'test' b) a);
ERROR 21000: Operand should contain 1 column(s)
create table t1 (a int);
create table t2 (a int, b int);
create table t3 (a int);
create table t4 (a int not null, b int not null);
insert into t1 values (2);
insert into t2 values (1,7),(2,7);
insert into t4 values (4,8),(3,8),(5,9);
select (select a from t1 where t1.a=t2.a), a from t2;
(select a from t1 where t1.a=t2.a)	a
NULL	1
2	2
select (select a from t1 where t1.a=t2.b), a from t2;
(select a from t1 where t1.a=t2.b)	a
NULL	1
NULL	2
select (select a from t1), a, (select 1 union select 2 limit 1) from t2;
(select a from t1)	a	(select 1 union select 2 limit 1)
2	1	1
2	2	1
select (select a from t3), a from t2;
(select a from t3)	a
NULL	1
NULL	2
select * from t2 where t2.a=(select a from t1);
a	b
2	7
insert into t3 values (6),(7),(3);
select * from t2 where t2.b=(select a from t3 order by 1 desc limit 1);
a	b
1	7
2	7
(select * from t2 where t2.b=(select a from t3 order by 1 desc limit 1)) union (select * from t4 order by a limit 2) limit 3;
a	b
1	7
2	7
3	8
(select * from t2 where t2.b=(select a from t3 order by 1 desc limit 1)) union (select * from t4 where t4.b=(select max(t2.a)*4 from t2) order by a);
a	b
1	7
2	7
4	8
3	8
EXPLAIN  (select * from t2 where t2.b=(select a from t3 order by 1 desc limit 1)) union (select * from t4 where t4.b=(select max(t2.a)*4 from t2) order by a);
Query Plan
========================================================
|ID|OPERATOR               |NAME |EST.ROWS|EST.TIME(us)|
--------------------------------------------------------
|0 |HASH UNION DISTINCT    |     |3       |10          |
|1 |├─SUBPLAN FILTER       |     |1       |5           |
|2 |│ ├─TABLE FULL SCAN    |t2   |1       |3           |
|3 |│ └─TOP-N SORT         |     |1       |3           |
|4 |│   └─TABLE FULL SCAN  |t3   |3       |3           |
|5 |└─MERGE JOIN           |     |2       |5           |
|6 |  ├─SUBPLAN SCAN       |VIEW1|1       |3           |
|7 |  │ └─SCALAR GROUP BY  |     |1       |3           |
|8 |  │   └─TABLE FULL SCAN|t2   |2       |3           |
|9 |  └─SORT               |     |3       |3           |
|10|    └─TABLE FULL SCAN  |t4   |3       |3           |
========================================================
Outputs & filters:
-------------------------------------
  0 - output([UNION([1])], [UNION([2])]), filter(nil), rowset=16
  1 - output([t2.a], [t2.b]), filter(nil), rowset=16
      exec_params_(nil), onetime_exprs_([subquery(1)(:0)]), init_plan_idxs_(nil), use_batch=false
  2 - output([t2.b], [t2.a]), filter([t2.b = :0]), rowset=16
      access([t2.b], [t2.a]), partitions(p0)
      is_index_back=false, is_global_index=false, filter_before_indexback[false], 
      range_key([t2.__pk_increment]), range(MIN ; MAX)always true
  3 - output([t3.a]), filter(nil), rowset=16
      sort_keys([t3.a, DESC]), topn(1)
  4 - output([t3.a]), filter(nil), rowset=16
      access([t3.a]), partitions(p0)
      is_index_back=false, is_global_index=false, 
      range_key([t3.__pk_increment]), range(MIN ; MAX)always true
  5 - output([t4.a], [t4.b]), filter(nil), rowset=16
      equal_conds([t4.b = VIEW1.max(t2.a)*4]), other_conds(nil)
      merge_directions([ASC])
  6 - output([VIEW1.max(t2.a)*4]), filter(nil), rowset=16
      access([VIEW1.max(t2.a)*4])
  7 - output([T_FUN_MAX(T_FUN_MAX(t2.a)) * 4]), filter(nil), rowset=16
      group(nil), agg_func([T_FUN_MAX(T_FUN_MAX(t2.a))])
  8 - output([T_FUN_MAX(t2.a)]), filter(nil), rowset=16
      access([t2.a]), partitions(p0)
      is_index_back=false, is_global_index=false, 
      range_key([t2.__pk_increment]), range(MIN ; MAX)always true, 
      pushdown_aggregation([T_FUN_MAX(t2.a)])
  9 - output([t4.a], [t4.b]), filter(nil), rowset=16
      sort_keys([t4.b, ASC])
 10 - output([t4.b], [t4.a]), filter(nil), rowset=16
      access([t4.b], [t4.a]), partitions(p0)
      is_index_back=false, is_global_index=false, 
      range_key([t4.__pk_increment]), range(MIN ; MAX)always true
select (select a from t3 where a<t2.a*4 order by 1 desc limit 1), a from t2;
(select a from t3 where a<t2.a*4 order by 1 desc limit 1)	a
3	1
7	2
select (select t3.a from t3 where a<8 order by 1 desc limit 1), a from
(select * from t2 where a>1) as tt;
(select t3.a from t3 where a<8 order by 1 desc limit 1)	a
7	2
EXPLAIN  select (select t3.a from t3 where a<8 order by 1 desc limit 1), a from
(select * from t2 where a>1) as tt;
Query Plan
===================================================
|ID|OPERATOR           |NAME|EST.ROWS|EST.TIME(us)|
---------------------------------------------------
|0 |SUBPLAN FILTER     |    |1       |5           |
|1 |├─TABLE FULL SCAN  |t2  |1       |3           |
|2 |└─TOP-N SORT       |    |1       |3           |
|3 |  └─TABLE FULL SCAN|t3  |1       |3           |
===================================================
Outputs & filters:
-------------------------------------
  0 - output([:0], [t2.a]), filter(nil), rowset=16
      exec_params_(nil), onetime_exprs_([subquery(1)(:0)]), init_plan_idxs_(nil), use_batch=false
  1 - output([t2.a]), filter([t2.a > 1]), rowset=16
      access([t2.a]), partitions(p0)
      is_index_back=false, is_global_index=false, filter_before_indexback[false], 
      range_key([t2.__pk_increment]), range(MIN ; MAX)always true
  2 - output([t3.a]), filter(nil), rowset=16
      sort_keys([t3.a, DESC]), topn(1)
  3 - output([t3.a]), filter([t3.a < 8]), rowset=16
      access([t3.a]), partitions(p0)
      is_index_back=false, is_global_index=false, filter_before_indexback[false], 
      range_key([t3.__pk_increment]), range(MIN ; MAX)always true
select * from t1 where t1.a=(select t2.a from t2 where t2.b=(select max(a) from t3) order by 1 desc limit 1);
a
2
select * from t1 where t1.a=(select t2.a from t2 where t2.b=(select max(a) from t3 where t3.a > t1.a) order by 1 desc limit 1);
a
2
select * from t1 where t1.a=(select t2.a from t2 where t2.b=(select max(a) from t3 where t3.a < t1.a) order by 1 desc limit 1);
a
select * from t3 where exists (select * from t2 where t2.b=t3.a);
a
7
select * from t3 where not exists (select * from t2 where t2.b=t3.a);
a
6
3
select * from t3 where a in (select b from t2);
a
7
select * from t3 where a not in (select b from t2);
a
6
3
select * from t3 where a = some (select b from t2);
a
7
select * from t3 where a <> any (select b from t2);
a
6
3
select * from t3 where a = all (select b from t2);
a
7
select * from t3 where a <> all (select b from t2);
a
6
3
insert into t2 values (100, 5);
select * from t3 where a < any (select b from t2);
a
6
3
select * from t3 where a < all (select b from t2);
a
3
select * from t3 where a >= any (select b from t2);
a
6
7
EXPLAIN  select * from t3 where a >= any (select b from t2);
Query Plan
======================================================
|ID|OPERATOR              |NAME|EST.ROWS|EST.TIME(us)|
------------------------------------------------------
|0 |NESTED-LOOP SEMI JOIN |    |1       |5           |
|1 |├─TABLE FULL SCAN     |t3  |3       |3           |
|2 |└─MATERIAL            |    |2       |3           |
|3 |  └─TABLE FULL SCAN   |t2  |2       |3           |
======================================================
Outputs & filters:
-------------------------------------
  0 - output([t3.a]), filter(nil), rowset=16
      conds([t3.a >= t2.b]), nl_params_(nil), use_batch=false
  1 - output([t3.a]), filter(nil), rowset=16
      access([t3.a]), partitions(p0)
      is_index_back=false, is_global_index=false, 
      range_key([t3.__pk_increment]), range(MIN ; MAX)always true
  2 - output([t2.b]), filter(nil), rowset=16
  3 - output([t2.b]), filter(nil), rowset=16
      access([t2.b]), partitions(p0)
      is_index_back=false, is_global_index=false, 
      range_key([t2.__pk_increment]), range(MIN ; MAX)always true
select * from t3 where a >= all (select b from t2);
a
7
delete from t2 where a=100;
select * from t3 where a in (select a,b from t2);
ERROR 21000: Operand should contain 1 column(s)
select * from t3 where a in (select * from t2);
ERROR 21000: Operand should contain 1 column(s)
insert into t4 values (12,7),(1,7),(10,9),(9,6),(7,6),(3,9),(1,10);
select b,max(a) as ma from t4 group by b having b < (select max(t2.a) from t2 where t2.b=t4.b);
b	ma
insert into t2 values (2,10);
select b,max(a) as ma from t4 group by b having ma < (select max(t2.a) from t2 where t2.b=t4.b);
b	ma
10	1
delete from t2 where a=2 and b=10;
select b,max(a) as ma from t4 group by b having b >= (select max(t2.a) from t2 where t2.b=t4.b);
b	ma
7	12
create table t5 (a int);
select (select a from t1 where t1.a=t2.a union select a from t5 where t5.a=t2.a), a from t2;
(select a from t1 where t1.a=t2.a union select a from t5 where t5.a=t2.a)	a
NULL	1
2	2
insert into t5 values (5);
select (select a from t1 where t1.a=t2.a union select a from t5 where t5.a=t2.a), a from t2;
(select a from t1 where t1.a=t2.a union select a from t5 where t5.a=t2.a)	a
NULL	1
2	2
insert into t5 values (2);
select (select a from t1 where t1.a=t2.a union select a from t5 where t5.a=t2.a), a from t2;
(select a from t1 where t1.a=t2.a union select a from t5 where t5.a=t2.a)	a
NULL	1
2	2
EXPLAIN  select (select a from t1 where t1.a=t2.a union select a from t5 where t5.a=t2.a), a from t2;
Query Plan
======================================================
|ID|OPERATOR              |NAME|EST.ROWS|EST.TIME(us)|
------------------------------------------------------
|0 |SUBPLAN FILTER        |    |2       |75          |
|1 |├─TABLE FULL SCAN     |t2  |2       |3           |
|2 |└─MERGE UNION DISTINCT|    |2       |36          |
|3 |  ├─TABLE FULL SCAN   |t1  |1       |18          |
|4 |  └─TABLE FULL SCAN   |t5  |1       |18          |
======================================================
Outputs & filters:
-------------------------------------
  0 - output([subquery(1)], [t2.a]), filter(nil), rowset=16
      exec_params_([t2.a(:0)]), onetime_exprs_(nil), init_plan_idxs_(nil), use_batch=false
  1 - output([t2.a]), filter(nil), rowset=16
      access([t2.a]), partitions(p0)
      is_index_back=false, is_global_index=false, 
      range_key([t2.__pk_increment]), range(MIN ; MAX)always true
  2 - output([UNION([1])]), filter(nil), rowset=16
  3 - output([t1.a]), filter([t1.a = :0]), rowset=16
      access([t1.a]), partitions(p0)
      is_index_back=false, is_global_index=false, filter_before_indexback[false], 
      range_key([t1.__pk_increment]), range(MIN ; MAX)always true
  4 - output([t5.a]), filter([t5.a = :0]), rowset=16
      access([t5.a]), partitions(p0)
      is_index_back=false, is_global_index=false, filter_before_indexback[false], 
      range_key([t5.__pk_increment]), range(MIN ; MAX)always true
select (select a from t1 where t1.a=t2.a union all select a from t5 where t5.a=t2.a), a from t2;
ERROR 21000: Subquery returns more than 1 row
create table t6 (patient_uq int, clinic_uq int, index i1 (clinic_uq));
create table t7( uq int primary key, name char(25));
insert into t7 values(1,"Oblastnaia bolnitsa"),(2,"Bolnitsa Krasnogo Kresta");
insert into t6 values (1,1),(1,2),(2,2),(1,3);
select * from t6 where exists (select * from t7 where uq = clinic_uq);
patient_uq	clinic_uq
1	1
1	2
2	2
EXPLAIN  select * from t6 where exists (select * from t7 where uq = clinic_uq);
Query Plan
===================================================
|ID|OPERATOR           |NAME|EST.ROWS|EST.TIME(us)|
---------------------------------------------------
|0 |MERGE JOIN         |    |3       |5           |
|1 |├─TABLE FULL SCAN  |t7  |2       |3           |
|2 |└─SORT             |    |4       |3           |
|3 |  └─TABLE FULL SCAN|t6  |4       |3           |
===================================================
Outputs & filters:
-------------------------------------
  0 - output([t6.patient_uq], [t6.clinic_uq]), filter(nil), rowset=16
      equal_conds([t7.uq = t6.clinic_uq]), other_conds(nil)
      merge_directions([ASC])
  1 - output([t7.uq]), filter(nil), rowset=16
      access([t7.uq]), partitions(p0)
      is_index_back=false, is_global_index=false, 
      range_key([t7.uq]), range(MIN ; MAX)always true
  2 - output([t6.patient_uq], [t6.clinic_uq]), filter(nil), rowset=16
      sort_keys([t6.clinic_uq, ASC])
  3 - output([t6.clinic_uq], [t6.patient_uq]), filter(nil), rowset=16
      access([t6.clinic_uq], [t6.patient_uq]), partitions(p0)
      is_index_back=false, is_global_index=false, 
      range_key([t6.__pk_increment]), range(MIN ; MAX)always true
select * from t1 where a= (select a from t2,t4 where t2.b=t4.b);
ERROR 23000: Column 'a' in field list is ambiguous
drop table t1,t2,t3;
CREATE TABLE t3 (a varchar(20),b char(1) NOT NULL default '0');
INSERT INTO t3 VALUES ('W','a'),('A','c'),('J','b');
CREATE TABLE t2 (a varchar(20),b int NOT NULL default '0');
INSERT INTO t2 VALUES ('W','1'),('A','3'),('J','2');
CREATE TABLE t1 (a varchar(20),b date NOT NULL default '0000-00-00');
INSERT INTO t1 VALUES ('W','1732-02-22'),('A','1735-10-30'),('J','1743-04-13');
SELECT * FROM t1 WHERE b = (SELECT MIN(b) FROM t1);
a	b
W	1732-02-22
SELECT * FROM t2 WHERE b = (SELECT MIN(b) FROM t2);
a	b
W	1
SELECT * FROM t3 WHERE b = (SELECT MIN(b) FROM t3);
a	b
W	a
CREATE TABLE `t8` (
`pseudo` varchar(35) character set utf8 NOT NULL default '',
`email` varchar(60) character set utf8 NOT NULL default '',
PRIMARY KEY  (`pseudo`),
UNIQUE KEY `email` (`email`)
) CHARSET=utf8;
INSERT INTO t8 (pseudo,email) VALUES ('joce','test');
INSERT INTO t8 (pseudo,email) VALUES ('joce1','test1');
INSERT INTO t8 (pseudo,email) VALUES ('2joce1','2test1');
EXPLAIN  SELECT pseudo,(SELECT email FROM t8 WHERE pseudo=(SELECT pseudo FROM t8 WHERE pseudo='joce')) FROM t8 WHERE pseudo=(SELECT pseudo FROM t8 WHERE pseudo='joce');
Query Plan
==============================================
|ID|OPERATOR      |NAME|EST.ROWS|EST.TIME(us)|
----------------------------------------------
|0 |SUBPLAN FILTER|    |1       |10          |
|1 |├─TABLE GET   |t8  |1       |5           |
|2 |└─TABLE GET   |t8  |1       |5           |
==============================================
Outputs & filters:
-------------------------------------
  0 - output([t8.pseudo], [:0]), filter(nil), rowset=16
      exec_params_(nil), onetime_exprs_([subquery(1)(:0)]), init_plan_idxs_(nil), use_batch=false
  1 - output([t8.pseudo]), filter(nil), rowset=16
      access([t8.pseudo]), partitions(p0)
      is_index_back=false, is_global_index=false, 
      range_key([t8.pseudo]), range[joce ; joce], 
      range_cond([t8.pseudo = 'joce'])
  2 - output([t8.email]), filter(nil), rowset=16
      access([t8.email]), partitions(p0)
      is_index_back=false, is_global_index=false, 
      range_key([t8.pseudo]), range[joce ; joce], 
      range_cond([t8.pseudo = 'joce'])
SELECT pseudo FROM t8 WHERE pseudo=(SELECT pseudo,email FROM
t8 WHERE pseudo='joce');
ERROR 21000: Operand should contain 1 column(s)
SELECT pseudo FROM t8 WHERE pseudo=(SELECT * FROM t8 WHERE
pseudo='joce');
ERROR 21000: Operand should contain 1 column(s)
SELECT pseudo FROM t8 WHERE pseudo=(SELECT pseudo FROM t8 WHERE pseudo='joce');
pseudo
joce
SELECT pseudo FROM t8 WHERE pseudo=(SELECT pseudo FROM t8 WHERE pseudo LIKE '%joce%');
ERROR 21000: Subquery returns more than 1 row
drop table if exists t1,t2,t3,t4,t5,t6,t7,t8;
CREATE TABLE `t1` (
`topic` mediumint(8) unsigned NOT NULL default '0',
`date` date NOT NULL default '0000-00-00',
`pseudo` varchar(35) character set utf8 NOT NULL default '',
PRIMARY KEY  (`pseudo`,`date`,`topic`),
KEY `topic` (`topic`)
);
INSERT INTO t1 (topic,date,pseudo) VALUES
('43506','2002-10-02','joce'),('40143','2002-08-03','joce');
EXPLAIN  SELECT DISTINCT date FROM t1 WHERE date='2002-08-03';
Query Plan
===============================================
|ID|OPERATOR       |NAME|EST.ROWS|EST.TIME(us)|
-----------------------------------------------
|0 |TABLE FULL SCAN|t1  |1       |3           |
===============================================
Outputs & filters:
-------------------------------------
  0 - output([t1.date]), filter([t1.date = demote_cast('2002-08-03', MYSQL_DATE(10, 0))]), rowset=16
      access([t1.date]), partitions(p0)
      limit(1), offset(nil), is_index_back=false, is_global_index=false, filter_before_indexback[false], 
      range_key([t1.pseudo], [t1.date], [t1.topic]), range(MIN,MIN,MIN ; MAX,MAX,MAX)always true
EXPLAIN  SELECT (SELECT DISTINCT date FROM t1 WHERE date='2002-08-03');
Query Plan
=================================================
|ID|OPERATOR         |NAME|EST.ROWS|EST.TIME(us)|
-------------------------------------------------
|0 |SUBPLAN FILTER   |    |1       |3           |
|1 |├─EXPRESSION     |    |1       |1           |
|2 |└─TABLE FULL SCAN|t1  |1       |3           |
=================================================
Outputs & filters:
-------------------------------------
  0 - output([:0]), filter(nil), rowset=16
      exec_params_(nil), onetime_exprs_([subquery(1)(:0)]), init_plan_idxs_(nil), use_batch=false
  1 - output([1]), filter(nil)
      values({1})
  2 - output([t1.date]), filter([t1.date = demote_cast('2002-08-03', MYSQL_DATE(10, 0))]), rowset=16
      access([t1.date]), partitions(p0)
      limit(1), offset(nil), is_index_back=false, is_global_index=false, filter_before_indexback[false], 
      range_key([t1.pseudo], [t1.date], [t1.topic]), range(MIN,MIN,MIN ; MAX,MAX,MAX)always true
SELECT DISTINCT date FROM t1 WHERE date='2002-08-03';
date
2002-08-03
SELECT (SELECT DISTINCT date FROM t1 WHERE date='2002-08-03');
(SELECT DISTINCT date FROM t1 WHERE date='2002-08-03')
2002-08-03
SELECT 1 FROM t1 WHERE 1=(SELECT 1 UNION SELECT 1) UNION ALL SELECT 1;
1
1
1
1
SELECT 1 FROM t1 WHERE 1=(SELECT 1 UNION ALL SELECT 1) UNION SELECT 1;
ERROR 21000: Subquery returns more than 1 row
EXPLAIN  SELECT 1 FROM t1 WHERE 1=(SELECT 1 UNION SELECT 1);
Query Plan
================================================================
|ID|OPERATOR               |NAME         |EST.ROWS|EST.TIME(us)|
----------------------------------------------------------------
|0 |SUBPLAN FILTER         |             |2       |3           |
|1 |├─TABLE FULL SCAN      |t1           |2       |3           |
|2 |└─HASH DISTINCT        |             |2       |1           |
|3 |  └─VALUES TABLE ACCESS|VALUES_TABLE1|2       |1           |
================================================================
Outputs & filters:
-------------------------------------
  0 - output([1]), filter(nil), rowset=16
      exec_params_(nil), onetime_exprs_([subquery(1)(:0)]), init_plan_idxs_(nil), use_batch=false
  1 - output(nil), filter(nil), startup_filter([1 = :0]), rowset=16
      access(nil), partitions(p0)
      is_index_back=false, is_global_index=false, 
      range_key([t1.pseudo], [t1.date], [t1.topic]), range(MIN,MIN,MIN ; MAX,MAX,MAX)always true
  2 - output([VALUES_TABLE1.column_0]), filter(nil), rowset=16
      distinct([VALUES_TABLE1.column_0])
  3 - output([VALUES_TABLE1.column_0]), filter(nil)
      access([VALUES_TABLE1.column_0])
drop table t1;
CREATE TABLE `t1` (
`numeropost` mediumint(8) unsigned NOT NULL auto_increment,
`maxnumrep` int(10) unsigned NOT NULL default '0',
PRIMARY KEY  (`numeropost`),
UNIQUE KEY `maxnumrep` (`maxnumrep`)
);
INSERT INTO t1 (numeropost,maxnumrep) VALUES (40143,1),(43506,2);
CREATE TABLE `t2` (
`mot` varchar(30) NOT NULL default '',
`topic` mediumint(8) unsigned NOT NULL default '0',
`date` date NOT NULL default '0000-00-00',
`pseudo` varchar(35) NOT NULL default '',
PRIMARY KEY  (`mot`,`pseudo`,`date`,`topic`)
);
INSERT INTO t2 (mot,topic,date,pseudo) VALUES ('joce','40143','2002-10-22','joce'), ('joce','43506','2002-10-22','joce');
SELECT numeropost,maxnumrep FROM t1 WHERE exists (SELECT 1 FROM t2 WHERE (mot='joce') AND date >= '2002-10-21' AND t1.numeropost = t2.topic) ORDER BY maxnumrep DESC LIMIT 0, 20;
numeropost	maxnumrep
43506	2
40143	1
SELECT (SELECT 1) as a FROM (SELECT 1 FROM t1 HAVING a=1) b;
ERROR 42S22: Unknown column 'a' in 'having clause'
SELECT 1 IN (SELECT 1 FROM t2 HAVING a);
ERROR 42S22: Unknown column 'a' in 'having clause'
SELECT * from t2 where topic IN (SELECT topic FROM t2 GROUP BY topic);
mot	topic	date	pseudo
joce	40143	2002-10-22	joce
joce	43506	2002-10-22	joce
SELECT * from t2 where topic IN (SELECT topic FROM t2 GROUP BY topic HAVING topic < 4100);
mot	topic	date	pseudo
SELECT * from t2 where topic IN (SELECT SUM(topic) FROM t1);
mot	topic	date	pseudo
SELECT * from t2 where topic = any (SELECT topic FROM t2 GROUP BY topic);
mot	topic	date	pseudo
joce	40143	2002-10-22	joce
joce	43506	2002-10-22	joce
SELECT * from t2 where topic = any (SELECT topic FROM t2 GROUP BY topic HAVING topic < 4100);
mot	topic	date	pseudo
SELECT * from t2 where topic = any (SELECT SUM(topic) FROM t1);
mot	topic	date	pseudo
SELECT * from t2 where topic = all (SELECT topic FROM t2 GROUP BY topic);
mot	topic	date	pseudo
SELECT * from t2 where topic = all (SELECT topic FROM t2 GROUP BY topic HAVING topic < 4100);
mot	topic	date	pseudo
joce	40143	2002-10-22	joce
joce	43506	2002-10-22	joce
SELECT *, topic = all (SELECT topic FROM t2 GROUP BY topic HAVING topic < 4100) from t2;
mot	topic	date	pseudo	topic = all (SELECT topic FROM t2 GROUP BY topic HAVING topic < 4100)
joce	40143	2002-10-22	joce	1
joce	43506	2002-10-22	joce	1
SELECT * from t2 where topic = all (SELECT SUM(topic) FROM t2);
mot	topic	date	pseudo
SELECT * from t2 where topic <> any (SELECT SUM(topic) FROM t2);
mot	topic	date	pseudo
joce	40143	2002-10-22	joce
joce	43506	2002-10-22	joce
SELECT * from t2 where topic IN (SELECT topic FROM t2 GROUP BY topic HAVING topic < 41000);
mot	topic	date	pseudo
joce	40143	2002-10-22	joce
SELECT * from t2 where topic = any (SELECT topic FROM t2 GROUP BY topic HAVING topic < 41000);
mot	topic	date	pseudo
joce	40143	2002-10-22	joce
SELECT * from t2 where topic = all (SELECT topic FROM t2 GROUP BY topic HAVING topic < 41000);
mot	topic	date	pseudo
joce	40143	2002-10-22	joce
SELECT *, topic = all (SELECT topic FROM t2 GROUP BY topic HAVING topic < 41000) from t2;
mot	topic	date	pseudo	topic = all (SELECT topic FROM t2 GROUP BY topic HAVING topic < 41000)
joce	40143	2002-10-22	joce	1
joce	43506	2002-10-22	joce	0
drop table t1,t2;
CREATE TABLE `t1` (
`numeropost` mediumint(8) unsigned NOT NULL auto_increment,
`maxnumrep` int(10) unsigned NOT NULL default '0',
PRIMARY KEY  (`numeropost`),
UNIQUE KEY `maxnumrep` (`maxnumrep`)
);
INSERT INTO t1 (numeropost,maxnumrep) VALUES (1,0),(2,1);
select numeropost as a FROM t1 GROUP BY (SELECT 1 FROM t1);
ERROR 21000: Subquery returns more than 1 row
select numeropost as a FROM t1 ORDER BY (SELECT 1 FROM t1);
ERROR 21000: Subquery returns more than 1 row
drop table t1;
create table t1 (a int);
insert into t1 values (1),(2),(3);
(select * from t1) union (select * from t1) order by (select a from t1 limit 1);
a
1
2
3
drop table t1;
CREATE TABLE t1 (field char(1) NOT NULL DEFAULT 'b');
INSERT INTO t1 VALUES ();
SELECT field FROM t1 WHERE 1=(SELECT 1 UNION ALL SELECT 1 FROM (SELECT 1) a HAVING field='b');
ERROR 21000: Subquery returns more than 1 row
drop table t1;
CREATE TABLE `t1` (
`numeropost` mediumint(8) unsigned NOT NULL default '0',
`numreponse` int(10) unsigned NOT NULL auto_increment,
`pseudo` varchar(35) NOT NULL default '',
PRIMARY KEY  (`numeropost`,`numreponse`),
UNIQUE KEY `numreponse` (`numreponse`),
KEY `pseudo` (`pseudo`,`numeropost`)
);
SELECT (SELECT numeropost FROM t1 HAVING numreponse=a),numreponse FROM (SELECT * FROM t1) as a;
ERROR 42S22: Unknown column 'a' in 'having clause'
SELECT numreponse, (SELECT numeropost FROM t1 HAVING numreponse=a) FROM (SELECT * FROM t1) as a;
ERROR 42S22: Unknown column 'a' in 'having clause'
SELECT numreponse, (SELECT numeropost FROM t1 HAVING numreponse=1) FROM (SELECT * FROM t1) as a;
numreponse	(SELECT numeropost FROM t1 HAVING numreponse=1)
INSERT INTO t1 (numeropost,numreponse,pseudo) VALUES (1,1,'joce'),(1,2,'joce'),(1,3,'test');
EXPLAIN  SELECT numreponse FROM t1 WHERE numeropost='1' AND numreponse=(SELECT 1 FROM t1 WHERE numeropost='1');
Query Plan
==================================================
|ID|OPERATOR          |NAME|EST.ROWS|EST.TIME(us)|
--------------------------------------------------
|0 |SUBPLAN FILTER    |    |1       |5           |
|1 |├─TABLE GET       |t1  |1       |3           |
|2 |└─TABLE RANGE SCAN|t1  |3       |3           |
==================================================
Outputs & filters:
-------------------------------------
  0 - output([t1.numreponse]), filter(nil), rowset=16
      exec_params_(nil), onetime_exprs_([subquery(1)(:0)]), init_plan_idxs_(nil), use_batch=false
  1 - output([t1.numreponse]), filter(nil), rowset=16
      access([t1.numreponse]), partitions(p0)
      is_index_back=false, is_global_index=false, 
      range_key([t1.numeropost], [t1.numreponse]), range(MIN,MIN ; MAX,MAX)always true, 
      range_cond([t1.numeropost = demote_cast('1', MEDIUMINT UNSIGNED(8, 0))], [t1.numreponse = :0])
  2 - output([1]), filter(nil), rowset=16
      access(nil), partitions(p0)
      is_index_back=false, is_global_index=false, 
      range_key([t1.numeropost], [t1.numreponse]), range(1,MIN ; 1,MAX), 
      range_cond([t1.numeropost = demote_cast('1', MEDIUMINT UNSIGNED(8, 0))])
EXPLAIN  SELECT MAX(numreponse) FROM t1 WHERE numeropost='1';
Query Plan
===========================================================
|ID|OPERATOR            |NAME       |EST.ROWS|EST.TIME(us)|
-----------------------------------------------------------
|0 |SCALAR GROUP BY     |           |1       |3           |
|1 |└─SUBPLAN SCAN      |VIEW1      |1       |3           |
|2 |  └─TABLE RANGE SCAN|t1(Reverse)|1       |3           |
===========================================================
Outputs & filters:
-------------------------------------
  0 - output([T_FUN_MAX(VIEW1.t1.numreponse)]), filter(nil), rowset=16
      group(nil), agg_func([T_FUN_MAX(VIEW1.t1.numreponse)])
  1 - output([VIEW1.t1.numreponse]), filter(nil), rowset=16
      access([VIEW1.t1.numreponse])
  2 - output([t1.numreponse]), filter(nil), rowset=16
      access([t1.numreponse]), partitions(p0)
      limit(1), offset(nil), is_index_back=false, is_global_index=false, 
      range_key([t1.numeropost], [t1.numreponse]), range(1,MIN ; 1,MAX), 
      range_cond([t1.numeropost = demote_cast('1', MEDIUMINT UNSIGNED(8, 0))])
EXPLAIN  SELECT numreponse FROM t1 WHERE numeropost='1' AND numreponse=(SELECT MAX(numreponse) FROM t1 WHERE numeropost='1');
Query Plan
=====================================================
|ID|OPERATOR            |NAME |EST.ROWS|EST.TIME(us)|
-----------------------------------------------------
|0 |SUBPLAN SCAN        |VIEW1|1       |5           |
|1 |└─WINDOW FUNCTION   |     |3       |5           |
|2 |  └─TABLE RANGE SCAN|t1   |3       |3           |
=====================================================
Outputs & filters:
-------------------------------------
  0 - output([VIEW1.t1.numreponse]), filter([VIEW1.t1.numreponse = VIEW1.MAX(numreponse)]), rowset=16
      access([VIEW1.MAX(numreponse)], [VIEW1.t1.numreponse])
  1 - output([T_FUN_MAX(t1.numreponse)], [t1.numreponse]), filter(nil), rowset=16
      win_expr(T_FUN_MAX(t1.numreponse)), partition_by(nil), order_by(nil), window_type(RANGE), upper(UNBOUNDED PRECEDING), lower(UNBOUNDED FOLLOWING)
  2 - output([t1.numreponse]), filter(nil), rowset=16
      access([t1.numreponse]), partitions(p0)
      is_index_back=false, is_global_index=false, 
      range_key([t1.numeropost], [t1.numreponse]), range(1,MIN ; 1,MAX), 
      range_cond([t1.numeropost = demote_cast('1', MEDIUMINT UNSIGNED(8, 0))])
drop table t1;
CREATE TABLE t1 (a int(1));
INSERT INTO t1 VALUES (1);
SELECT 1 FROM (SELECT a FROM t1) b HAVING (SELECT b.a)=1;
ERROR 42S22: Unknown column 'b.a' in 'field list'
drop table t1;
create table t1 (a int NOT NULL, b int, primary key (a));
create table t2 (a int NOT NULL, b int, primary key (a));
insert into t1 values (0, 10),(1, 11),(2, 12);
insert into t2 values (1, 21),(2, 22),(3, 23);
select * from t1;
a	b
0	10
1	11
2	12
update t1 set b= (select b from t1);
ERROR 21000: Subquery returns more than 1 row
update t1 set b= (select b from t2);
ERROR 21000: Subquery returns more than 1 row
update t1 set b= (select b from t2 where t1.a = t2.a);
select * from t1;
a	b
0	NULL
1	21
2	22
drop table t1, t2;
create table t1 (a int NOT NULL, b int, primary key (a));
create table t2 (a int NOT NULL, b int, primary key (a));
insert into t1 values (0, 10),(1, 11),(2, 12);
insert into t2 values (1, 21),(2, 12),(3, 23);
select * from t1;
a	b
0	10
1	11
2	12
select * from t1 where b = (select b from t2 where t1.a = t2.a);
a	b
2	12
delete from t1 where b = (select b from t1);
ERROR 21000: Subquery returns more than 1 row
delete from t1 where b = (select b from t2);
ERROR 21000: Subquery returns more than 1 row
delete from t1 where b = (select b from t2 where t1.a = t2.a);
select * from t1;
a	b
0	10
1	11
drop table t1, t2;
create table t11 (a int NOT NULL, b int, primary key (a));
create table t12 (a int NOT NULL, b int, primary key (a));
create table t2 (a int NOT NULL, b int, primary key (a));
insert into t11 values (0, 10),(1, 11),(2, 12);
insert into t12 values (33, 10),(22, 11),(2, 12);
insert into t2 values (1, 21),(2, 12),(3, 23);
select * from t11;
a	b
0	10
1	11
2	12
select * from t12;
a	b
2	12
22	11
33	10
drop table t11, t12, t2;
CREATE TABLE t1 (x int);
create table t2 (a int);
create table t3 (b int);
insert into t2 values (1);
insert into t3 values (1),(2);
select * from t1;
x
insert into t2 values (1);
select * from t1;
x
drop table t1, t2, t3;
CREATE TABLE t1 (x int not null, y int, primary key (x));
create table t2 (a int);
create table t3 (a int);
insert into t2 values (1);
insert into t3 values (1),(2);
select * from t1;
x	y
drop table t1, t2, t3;
SELECT * FROM (SELECT 1) b WHERE 1 IN (SELECT *);
ERROR HY000: No tables used
CREATE TABLE t2 (id int(11) default NULL, KEY id (id));
INSERT INTO t2 VALUES (1),(2);
SELECT * FROM t2 WHERE id IN (SELECT 1);
id
1
EXPLAIN  SELECT * FROM t2 WHERE id IN (SELECT 1);
Query Plan
==================================================
|ID|OPERATOR        |NAME  |EST.ROWS|EST.TIME(us)|
--------------------------------------------------
|0 |TABLE RANGE SCAN|t2(id)|1       |3           |
==================================================
Outputs & filters:
-------------------------------------
  0 - output([t2.id]), filter(nil), rowset=16
      access([t2.id]), partitions(p0)
      is_index_back=false, is_global_index=false, 
      range_key([t2.id], [t2.__pk_increment]), range(1,MIN ; 1,MAX), 
      range_cond([t2.id = 1])
SELECT * FROM t2 WHERE id IN (SELECT 1 UNION SELECT 3);
id
1
SELECT * FROM t2 WHERE id IN (SELECT 1+(select 1));
id
2
EXPLAIN  SELECT * FROM t2 WHERE id IN (SELECT 1+(select 1));
Query Plan
==================================================
|ID|OPERATOR        |NAME  |EST.ROWS|EST.TIME(us)|
--------------------------------------------------
|0 |TABLE RANGE SCAN|t2(id)|1       |3           |
==================================================
Outputs & filters:
-------------------------------------
  0 - output([t2.id]), filter(nil), rowset=16
      access([t2.id]), partitions(p0)
      is_index_back=false, is_global_index=false, 
      range_key([t2.id], [t2.__pk_increment]), range(2,MIN ; 2,MAX), 
      range_cond([t2.id = 1 + 1])
EXPLAIN  SELECT * FROM t2 WHERE id IN (SELECT 1 UNION SELECT 3);
Query Plan
====================================================================
|ID|OPERATOR                   |NAME         |EST.ROWS|EST.TIME(us)|
--------------------------------------------------------------------
|0 |MERGE JOIN                 |             |2       |3           |
|1 |├─TABLE FULL SCAN          |t2(id)       |2       |3           |
|2 |└─SORT                     |             |2       |1           |
|3 |  └─SUBPLAN SCAN           |VIEW2        |2       |1           |
|4 |    └─HASH DISTINCT        |             |2       |1           |
|5 |      └─VALUES TABLE ACCESS|VALUES_TABLE1|2       |1           |
====================================================================
Outputs & filters:
-------------------------------------
  0 - output([t2.id]), filter(nil), rowset=16
      equal_conds([t2.id = VIEW2.1]), other_conds(nil)
      merge_directions([ASC])
  1 - output([t2.id]), filter(nil), rowset=16
      access([t2.id]), partitions(p0)
      is_index_back=false, is_global_index=false, 
      range_key([t2.id], [t2.__pk_increment]), range(MIN,MIN ; MAX,MAX)always true
  2 - output([VIEW2.1]), filter(nil), rowset=16
      sort_keys([VIEW2.1, ASC])
  3 - output([VIEW2.1]), filter(nil), rowset=16
      access([VIEW2.1])
  4 - output([VALUES_TABLE1.column_0]), filter(nil), rowset=16
      distinct([VALUES_TABLE1.column_0])
  5 - output([VALUES_TABLE1.column_0]), filter(nil)
      access([VALUES_TABLE1.column_0])
SELECT * FROM t2 WHERE id IN (SELECT 5 UNION SELECT 3);
id
SELECT * FROM t2 WHERE id IN (SELECT 5 UNION SELECT 2);
id
2
SELECT * FROM t2;
id
1
2
CREATE TABLE t1 (id int(11) default NULL, KEY id (id));
INSERT INTO t1 values (1),(1);
UPDATE t2 SET id=(SELECT * FROM t1);
ERROR 21000: Subquery returns more than 1 row
drop table t2, t1;
create table t1 (a int);
insert into t1 values (1),(2),(3);
select 1 IN (SELECT * from t1);
1 IN (SELECT * from t1)
1
select 10 IN (SELECT * from t1);
10 IN (SELECT * from t1)
0
select NULL IN (SELECT * from t1);
NULL IN (SELECT * from t1)
NULL
update t1 set a=NULL where a=2;
select 1 IN (SELECT * from t1);
1 IN (SELECT * from t1)
1
select 3 IN (SELECT * from t1);
3 IN (SELECT * from t1)
1
select 10 IN (SELECT * from t1);
10 IN (SELECT * from t1)
NULL
select 1 > ALL (SELECT * from t1);
1 > ALL (SELECT * from t1)
0
select 10 > ALL (SELECT * from t1);
10 > ALL (SELECT * from t1)
NULL
select 1 > ANY (SELECT * from t1);
1 > ANY (SELECT * from t1)
NULL
select 10 > ANY (SELECT * from t1);
10 > ANY (SELECT * from t1)
1
drop table t1;
create table t1 (a varchar(20));
insert into t1 values ('A'),('BC'),('DEF');
select 'A' IN (SELECT * from t1);
'A' IN (SELECT * from t1)
1
select 'XYZS' IN (SELECT * from t1);
'XYZS' IN (SELECT * from t1)
0
select NULL IN (SELECT * from t1);
NULL IN (SELECT * from t1)
NULL
update t1 set a=NULL where a='BC';
select 'A' IN (SELECT * from t1);
'A' IN (SELECT * from t1)
1
select 'DEF' IN (SELECT * from t1);
'DEF' IN (SELECT * from t1)
1
select 'XYZS' IN (SELECT * from t1);
'XYZS' IN (SELECT * from t1)
NULL
select 'A' > ALL (SELECT * from t1);
'A' > ALL (SELECT * from t1)
0
select 'XYZS' > ALL (SELECT * from t1);
'XYZS' > ALL (SELECT * from t1)
NULL
select 'A' > ANY (SELECT * from t1);
'A' > ANY (SELECT * from t1)
NULL
select 'XYZS' > ANY (SELECT * from t1);
'XYZS' > ANY (SELECT * from t1)
1
drop table t1;
create table t1 (a float);
insert into t1 values (1.5),(2.5),(3.5);
select 1.5 IN (SELECT * from t1);
1.5 IN (SELECT * from t1)
1
select 10.5 IN (SELECT * from t1);
10.5 IN (SELECT * from t1)
0
select NULL IN (SELECT * from t1);
NULL IN (SELECT * from t1)
NULL
update t1 set a=NULL where a=2.5;
select 1.5 IN (SELECT * from t1);
1.5 IN (SELECT * from t1)
1
select 3.5 IN (SELECT * from t1);
3.5 IN (SELECT * from t1)
1
select 10.5 IN (SELECT * from t1);
10.5 IN (SELECT * from t1)
NULL
select 1.5 > ALL (SELECT * from t1);
1.5 > ALL (SELECT * from t1)
0
select 10.5 > ALL (SELECT * from t1);
10.5 > ALL (SELECT * from t1)
NULL
select 1.5 > ANY (SELECT * from t1);
1.5 > ANY (SELECT * from t1)
NULL
select 10.5 > ANY (SELECT * from t1);
10.5 > ANY (SELECT * from t1)
1
EXPLAIN  select (select a+1) from t1;
Query Plan
===============================================
|ID|OPERATOR       |NAME|EST.ROWS|EST.TIME(us)|
-----------------------------------------------
|0 |TABLE FULL SCAN|t1  |3       |3           |
===============================================
Outputs & filters:
-------------------------------------
  0 - output([cast(t1.a, DOUBLE(-1, -1)) + cast(1, DOUBLE(-1, -1))]), filter(nil), rowset=16
      access([t1.a]), partitions(p0)
      is_index_back=false, is_global_index=false, 
      range_key([t1.__pk_increment]), range(MIN ; MAX)always true
select (select a+1) from t1;
(select a+1)
2.5
NULL
4.5
drop table t1;
CREATE TABLE t1 (a int(11) NOT NULL default '0', PRIMARY KEY  (a));
CREATE TABLE t2 (a int(11) default '0', INDEX (a));
INSERT INTO t1 VALUES (1),(2),(3),(4);
INSERT INTO t2 VALUES (1),(2),(3);
SELECT t1.a, t1.a in (select t2.a from t2) FROM t1;
a	t1.a in (select t2.a from t2)
1	1
2	1
3	1
4	0
EXPLAIN  SELECT t1.a, t1.a in (select t2.a from t2) FROM t1;
Query Plan
=================================================
|ID|OPERATOR         |NAME|EST.ROWS|EST.TIME(us)|
-------------------------------------------------
|0 |SUBPLAN FILTER   |    |4       |5           |
|1 |├─TABLE FULL SCAN|t1  |4       |3           |
|2 |└─TABLE FULL SCAN|t2  |3       |3           |
=================================================
Outputs & filters:
-------------------------------------
  0 - output([t1.a], [t1.a = ANY(subquery(1))]), filter(nil), rowset=16
      exec_params_(nil), onetime_exprs_(nil), init_plan_idxs_([1]), use_batch=false
  1 - output([t1.a]), filter(nil), rowset=16
      access([t1.a]), partitions(p0)
      is_index_back=false, is_global_index=false, 
      range_key([t1.a]), range(MIN ; MAX)always true
  2 - output([t2.a]), filter(nil), rowset=16
      access([t2.a]), partitions(p0)
      is_index_back=false, is_global_index=false, 
      range_key([t2.__pk_increment]), range(MIN ; MAX)always true
CREATE TABLE t3 (a int(11) default '0');
INSERT INTO t3 VALUES (1),(2),(3);
SELECT t1.a, t1.a in (select t2.a from t2,t3 where t3.a=t2.a) FROM t1;
a	t1.a in (select t2.a from t2,t3 where t3.a=t2.a)
1	1
2	1
3	1
4	0
EXPLAIN  SELECT t1.a, t1.a in (select t2.a from t2,t3 where t3.a=t2.a) FROM t1;
Query Plan
======================================================
|ID|OPERATOR             |NAME |EST.ROWS|EST.TIME(us)|
------------------------------------------------------
|0 |SUBPLAN FILTER       |     |4       |8           |
|1 |├─TABLE FULL SCAN    |t1   |4       |3           |
|2 |└─MERGE JOIN         |     |3       |5           |
|3 |  ├─TABLE FULL SCAN  |t2(a)|3       |3           |
|4 |  └─SORT             |     |3       |3           |
|5 |    └─TABLE FULL SCAN|t3   |3       |3           |
======================================================
Outputs & filters:
-------------------------------------
  0 - output([t1.a], [t1.a = ANY(subquery(1))]), filter(nil), rowset=16
      exec_params_(nil), onetime_exprs_(nil), init_plan_idxs_([1]), use_batch=false
  1 - output([t1.a]), filter(nil), rowset=16
      access([t1.a]), partitions(p0)
      is_index_back=false, is_global_index=false, 
      range_key([t1.a]), range(MIN ; MAX)always true
  2 - output([t2.a]), filter(nil), rowset=16
      equal_conds([t3.a = t2.a]), other_conds(nil)
      merge_directions([ASC])
  3 - output([t2.a]), filter(nil), rowset=16
      access([t2.a]), partitions(p0)
      is_index_back=false, is_global_index=false, 
      range_key([t2.a], [t2.__pk_increment]), range(MIN,MIN ; MAX,MAX)always true
  4 - output([t3.a]), filter(nil), rowset=16
      sort_keys([t3.a, ASC])
  5 - output([t3.a]), filter(nil), rowset=16
      access([t3.a]), partitions(p0)
      is_index_back=false, is_global_index=false, 
      range_key([t3.__pk_increment]), range(MIN ; MAX)always true
drop table t1,t2,t3;
create table t1 (a float);
select 10.5 IN (SELECT * from t1 LIMIT 1);
10.5 IN (SELECT * from t1 LIMIT 1)
0
select 10.5 IN ((SELECT * from t1 LIMIT 1) UNION SELECT 1.5);
10.5 IN ((SELECT * from t1 LIMIT 1) UNION SELECT 1.5)
0
drop table t1;
create table t1 (a int, b int, c varchar(10));
create table t2 (a int);
insert into t1 values (1,2,'a'),(2,3,'b'),(3,4,'c');
insert into t2 values (1),(2),(NULL);
select a, (select a,b,c from t1 where t1.a=t2.a) = ROW(a,2,'a'),(select c from t1 where a=t2.a)  from t2;
a	(select a,b,c from t1 where t1.a=t2.a) = ROW(a,2,'a')	(select c from t1 where a=t2.a)
1	1	a
2	0	b
NULL	NULL	NULL
select a, (select a,b,c from t1 where t1.a=t2.a) = ROW(a,3,'b'),(select c from t1 where a=t2.a) from t2;
a	(select a,b,c from t1 where t1.a=t2.a) = ROW(a,3,'b')	(select c from t1 where a=t2.a)
1	0	a
2	1	b
NULL	NULL	NULL
select a, (select a,b,c from t1 where t1.a=t2.a) = ROW(a,4,'c'),(select c from t1 where a=t2.a) from t2;
a	(select a,b,c from t1 where t1.a=t2.a) = ROW(a,4,'c')	(select c from t1 where a=t2.a)
1	0	a
2	0	b
NULL	NULL	NULL
drop table t1,t2;
create table t1 (a int, b real, c varchar(10));
insert into t1 values (1, 1, 'a'), (2,2,'b'), (NULL, 2, 'b');
select ROW(1, 1, 'a') IN (select a,b,c from t1);
ROW(1, 1, 'a') IN (select a,b,c from t1)
1
select ROW(1, 2, 'a') IN (select a,b,c from t1);
ROW(1, 2, 'a') IN (select a,b,c from t1)
0
select ROW(1, 1, 'a') IN (select b,a,c from t1);
ROW(1, 1, 'a') IN (select b,a,c from t1)
1
select ROW(1, 1, 'a') IN (select a,b,c from t1 where a is not null);
ROW(1, 1, 'a') IN (select a,b,c from t1 where a is not null)
1
select ROW(1, 2, 'a') IN (select a,b,c from t1 where a is not null);
ROW(1, 2, 'a') IN (select a,b,c from t1 where a is not null)
0
select ROW(1, 1, 'a') IN (select b,a,c from t1 where a is not null);
ROW(1, 1, 'a') IN (select b,a,c from t1 where a is not null)
1
select ROW(1, 1, 'a') IN (select a,b,c from t1 where c='b' or c='a');
ROW(1, 1, 'a') IN (select a,b,c from t1 where c='b' or c='a')
1
select ROW(1, 2, 'a') IN (select a,b,c from t1 where c='b' or c='a');
ROW(1, 2, 'a') IN (select a,b,c from t1 where c='b' or c='a')
0
select ROW(1, 1, 'a') IN (select b,a,c from t1 where c='b' or c='a');
ROW(1, 1, 'a') IN (select b,a,c from t1 where c='b' or c='a')
1
select ROW(1, 1, 'a') IN (select b,a,c from t1 limit 2);
ROW(1, 1, 'a') IN (select b,a,c from t1 limit 2)
1
drop table t1;
create table t1 (a int);
create table t2 (b int);
insert into t1 values (1),(2);
insert into t2 values (1);
select a from t1 where a in (select a from t1 where a in (select b from t2));
a
1
drop table t1, t2;
create table t1 (a int, b int);
create table t2 (a int, b int);
insert into t1 values (1,2),(1,3),(1,4),(1,5);
insert into t2 values (1,2),(1,3);
select * from t1 where row(a,b) in (select a,b from t2);
a	b
1	2
1	3
drop table t1, t2;
CREATE TABLE `t1` (`i` int(11) NOT NULL default '0',PRIMARY KEY  (`i`));
INSERT INTO t1 VALUES (1);
UPDATE t1 SET i=i+1 WHERE i=(SELECT MAX(i));
select * from t1;
i
2
drop table t1;
CREATE TABLE `t1` (
`mot` varchar(30) character set utf8 NOT NULL default '',
`topic` mediumint(8) unsigned NOT NULL default '0',
`date` date NOT NULL default '0000-00-00',
`pseudo` varchar(35) character set utf8 NOT NULL default '',
PRIMARY KEY  (`mot`,`pseudo`,`date`,`topic`),
KEY `pseudo` (`pseudo`,`date`,`topic`),
KEY `topic` (`topic`)
) CHARSET=utf8;
CREATE TABLE `t2` (
`mot` varchar(30) character set utf8 NOT NULL default '',
`topic` mediumint(8) unsigned NOT NULL default '0',
`date` date NOT NULL default '0000-00-00',
`pseudo` varchar(35) character set utf8 NOT NULL default '',
PRIMARY KEY  (`mot`,`pseudo`,`date`,`topic`),
KEY `pseudo` (`pseudo`,`date`,`topic`),
KEY `topic` (`topic`)
) CHARSET=utf8;
CREATE TABLE `t3` (
`numeropost` mediumint(8) unsigned NOT NULL auto_increment,
`maxnumrep` int(10) unsigned NOT NULL default '0',
PRIMARY KEY  (`numeropost`),
UNIQUE KEY `maxnumrep` (`maxnumrep`)
) CHARSET=utf8;
INSERT INTO t1 VALUES ('joce','1','2015-10-21','joce'),('test','2','2015-10-21','test');
INSERT INTO t2 VALUES ('joce','1','2015-10-21','joce'),('test','2','2015-10-21','test');
INSERT INTO t3 VALUES (1,1);
SELECT DISTINCT topic FROM t2 WHERE NOT EXISTS(SELECT * FROM t3 WHERE
numeropost=topic);
topic
2
select * from t1;
mot	topic	date	pseudo
joce	1	2015-10-21	joce
test	2	2015-10-21	test
DELETE FROM t1 WHERE topic IN (SELECT DISTINCT topic FROM t2 WHERE NOT
EXISTS(SELECT * FROM t3 WHERE numeropost=topic));
select * from t1;
mot	topic	date	pseudo
joce	1	2015-10-21	joce
drop table t1, t2, t3;
create table t1 (a int);
insert into t1 values (1), (2), (3);
EXPLAIN  select a,(select (select 1 from t1 limit 1)  from t1 limit 1) from t1;
Query Plan
===================================================
|ID|OPERATOR           |NAME|EST.ROWS|EST.TIME(us)|
---------------------------------------------------
|0 |SUBPLAN FILTER     |    |3       |7           |
|1 |├─TABLE FULL SCAN  |t1  |3       |3           |
|2 |└─SUBPLAN FILTER   |    |1       |5           |
|3 |  ├─TABLE FULL SCAN|t1  |1       |3           |
|4 |  └─TABLE FULL SCAN|t1  |1       |3           |
===================================================
Outputs & filters:
-------------------------------------
  0 - output([t1.a], [:0]), filter(nil), rowset=16
      exec_params_(nil), onetime_exprs_([subquery(1)(:0)]), init_plan_idxs_(nil), use_batch=false
  1 - output([t1.a]), filter(nil), rowset=16
      access([t1.a]), partitions(p0)
      is_index_back=false, is_global_index=false, 
      range_key([t1.__pk_increment]), range(MIN ; MAX)always true
  2 - output([:1]), filter(nil), rowset=16
      exec_params_(nil), onetime_exprs_([subquery(1)(:1)]), init_plan_idxs_(nil), use_batch=false
  3 - output(nil), filter(nil), rowset=16
      access(nil), partitions(p0)
      limit(1), offset(nil), is_index_back=false, is_global_index=false, 
      range_key([t1.__pk_increment]), range(MIN ; MAX)always true
  4 - output([1]), filter(nil), rowset=16
      access(nil), partitions(p0)
      limit(1), offset(nil), is_index_back=false, is_global_index=false, 
      range_key([t1.__pk_increment]), range(MIN ; MAX)always true
drop table t1;
select t1.Continent, t2.Name, t2.Population from t1 LEFT JOIN t2 ON t1.Code = t2.Country  where t2.Population IN (select max(t2.Population) AS Population from t2, t1 where t2.Country = t1.Code group by Continent);
ERROR 42S02: Table 'test.t1' doesn't exist
CREATE TABLE `t1` (
`id` mediumint(8) unsigned NOT NULL auto_increment,
`pseudo` varchar(35) character set utf8 NOT NULL default '',
PRIMARY KEY  (`id`),
UNIQUE KEY `pseudo` (`pseudo`)
);
INSERT INTO t1 (pseudo) VALUES ('test');
SELECT 0 IN (SELECT 1 FROM t1 a);
0 IN (SELECT 1 FROM t1 a)
0
EXPLAIN  SELECT 0 IN (SELECT 1 FROM t1 a);
Query Plan
=================================================
|ID|OPERATOR         |NAME|EST.ROWS|EST.TIME(us)|
-------------------------------------------------
|0 |SUBPLAN FILTER   |    |1       |3           |
|1 |├─EXPRESSION     |    |1       |1           |
|2 |└─TABLE FULL SCAN|a   |1       |3           |
=================================================
Outputs & filters:
-------------------------------------
  0 - output([:0]), filter(nil), rowset=16
      exec_params_(nil), onetime_exprs_([0 = ANY(subquery(1))(:0)]), init_plan_idxs_(nil), use_batch=false
  1 - output([1]), filter(nil)
      values({1})
  2 - output([1]), filter(nil), rowset=16
      access(nil), partitions(p0)
      limit(1), offset(nil), is_index_back=false, is_global_index=false, 
      range_key([a.id]), range(MIN ; MAX)always true
INSERT INTO t1 (pseudo) VALUES ('test1');
SELECT 0 IN (SELECT 1 FROM t1 a);
0 IN (SELECT 1 FROM t1 a)
0
EXPLAIN  SELECT 0 IN (SELECT 1 FROM t1 a);
Query Plan
=================================================
|ID|OPERATOR         |NAME|EST.ROWS|EST.TIME(us)|
-------------------------------------------------
|0 |SUBPLAN FILTER   |    |1       |3           |
|1 |├─EXPRESSION     |    |1       |1           |
|2 |└─TABLE FULL SCAN|a   |1       |3           |
=================================================
Outputs & filters:
-------------------------------------
  0 - output([:0]), filter(nil), rowset=16
      exec_params_(nil), onetime_exprs_([0 = ANY(subquery(1))(:0)]), init_plan_idxs_(nil), use_batch=false
  1 - output([1]), filter(nil)
      values({1})
  2 - output([1]), filter(nil), rowset=16
      access(nil), partitions(p0)
      limit(1), offset(nil), is_index_back=false, is_global_index=false, 
      range_key([a.id]), range(MIN ; MAX)always true
drop table t1;
CREATE TABLE `t1` (
`i` int(11) NOT NULL default '0',
PRIMARY KEY  (`i`)
);
INSERT INTO t1 VALUES (1);
UPDATE t1 SET t.i=i+(SELECT MAX(i) FROM (SELECT 1) t);
ERROR 42S22: Unknown column 't.i' in 'field list'
select * from t1;
i
1
drop table t1;
CREATE TABLE t1 (
id int(11) default NULL
) CHARSET=utf8;
INSERT INTO t1 VALUES (1),(1),(2),(2),(1),(3);
CREATE TABLE t2 (
id int(11) default NULL,
name varchar(15) default NULL
) CHARSET=utf8;
INSERT INTO t2 VALUES (4,'vita'), (1,'vita'), (2,'vita'), (1,'vita');
update t2 set t2.name='lenka' where t2.id in (select id from t1);
select * from t2;
id	name
4	vita
1	lenka
2	lenka
1	lenka
drop table t1,t2;
create table t1 (a int, unique index indexa (a));
insert into t1 values (-1), (-4), (-2), (NULL);
select -10 IN (select a from t1 FORCE INDEX (indexa));
-10 IN (select a from t1 FORCE INDEX (indexa))
NULL
drop table t1;
create table t1 (id int not null auto_increment primary key, salary int, key(salary));
insert into t1 (salary) values (100),(1000),(10000),(10),(500),(5000),(50000);
EXPLAIN  SELECT id FROM t1 where salary = (SELECT MAX(salary) FROM t1);
Query Plan
=====================================================================
|ID|OPERATOR               |NAME              |EST.ROWS|EST.TIME(us)|
---------------------------------------------------------------------
|0 |MERGE JOIN             |                  |1       |6           |
|1 |├─SUBPLAN SCAN         |VIEW1             |1       |3           |
|2 |│ └─SCALAR GROUP BY    |                  |1       |3           |
|3 |│   └─SUBPLAN SCAN     |VIEW2             |1       |3           |
|4 |│     └─TABLE FULL SCAN|t1(salary,Reverse)|1       |3           |
|5 |└─TABLE FULL SCAN      |t1(salary)        |7       |3           |
=====================================================================
Outputs & filters:
-------------------------------------
  0 - output([t1.id]), filter(nil), rowset=16
      equal_conds([t1.salary = VIEW1.MAX(salary)]), other_conds(nil)
      merge_directions([ASC])
  1 - output([VIEW1.MAX(salary)]), filter(nil), rowset=16
      access([VIEW1.MAX(salary)])
  2 - output([T_FUN_MAX(VIEW2.t1.salary)]), filter(nil), rowset=16
      group(nil), agg_func([T_FUN_MAX(VIEW2.t1.salary)])
  3 - output([VIEW2.t1.salary]), filter(nil), rowset=16
      access([VIEW2.t1.salary])
  4 - output([t1.salary]), filter([t1.salary IS NOT NULL]), rowset=16
      access([t1.salary]), partitions(p0)
      limit(1), offset(nil), is_index_back=false, is_global_index=false, filter_before_indexback[false], 
      range_key([t1.salary], [t1.id]), range(MIN,MIN ; MAX,MAX)always true
  5 - output([t1.id], [t1.salary]), filter(nil), rowset=16
      access([t1.id], [t1.salary]), partitions(p0)
      is_index_back=false, is_global_index=false, 
      range_key([t1.salary], [t1.id]), range(MIN,MIN ; MAX,MAX)always true
drop table t1;
create table t1 (a int, b int);
create table t2 (a int, b int);
insert into t1 values (1,0), (2,0), (3,0);
insert into t2 values (1,1), (2,1), (3,1), (2,2);
update t1 set b=(select b from t2 where t1.a=t2.a);
ERROR 21000: Subquery returns more than 1 row
select * from t1;
a	b
1	0
2	0
3	0
drop table t1, t2;
CREATE TABLE `t1` (
`id` mediumint(8) unsigned NOT NULL auto_increment,
`pseudo` varchar(35) NOT NULL default '',
`email` varchar(60) NOT NULL default '',
PRIMARY KEY  (`id`),
UNIQUE KEY `email` (`email`),
UNIQUE KEY `pseudo` (`pseudo`)
);
INSERT INTO t1 (id,pseudo,email) VALUES (1,'test','test'),(2,'test1','test1');
SELECT pseudo as a, pseudo as b FROM t1 GROUP BY (SELECT a) ORDER BY (SELECT id*1);
a	b
test	test
test1	test1
drop table if exists t1;
create table t1 (a int, b int);
create table t2 (a int, b int);
create table t3 (a int, b int);
insert into t1 values (0,100),(1,2), (1,3), (2,2), (2,7), (2,-1), (3,10);
insert into t2 values (0,0), (1,1), (2,1), (3,1), (4,1);
insert into t3 values (3,3), (2,2), (1,1);
select a,(select count(distinct t1.b) as sum from t1,t2 where t1.a=t2.a and t2.b > 0 and t1.a <= t3.b group by t1.a order by sum limit 1) from t3;
a	(select count(distinct t1.b) as sum from t1,t2 where t1.a=t2.a and t2.b > 0 and t1.a <= t3.b group by t1.a order by sum limit 1)
3	1
2	2
1	2
drop table t1,t2,t3;
create table t1 (s1 int);
create table t2 (s1 int);
insert into t1 values (1);
insert into t2 values (1);
select * from t1 where exists (select s1 from t2 having max(t2.s1)=t1.s1);
s1
1
drop table t1,t2;
create table t1 (s1 int);
create table t2 (s1 int);
insert into t1 values (1);
insert into t2 values (1);
update t1 set  s1 = s1 + 1 where 1 = (select x.s1 as A from t2 WHERE t2.s1 > t1.s1 order by A);
ERROR 42S22: Unknown column 'x.s1' in 'field list'
DROP TABLE t1, t2;
CREATE TABLE t1 (s1 CHAR(5) COLLATE utf8_bin,
s2 CHAR(5) COLLATE utf8_general_ci);
INSERT INTO t1 VALUES ('z','?');
select * from t1 where s1 > (select max(s2) from t1);
s1	s2
z	?
select * from t1 where s1 > any (select max(s2) from t1);
s1	s2
z	?
drop table t1;
create table t1(toid int,rd int);
create table t2(userid int,pmnew int,pmtotal int);
insert into t2 values(1,0,0),(2,0,0);
insert into t1 values(1,0),(1,0),(1,0),(1,12),(1,15),(1,123),(1,12312),(1,12312),(1,123),(2,0),(2,0),(2,1),(2,2);
select userid,pmtotal,pmnew, (select count(rd) from t1 where toid=t2.userid) calc_total, (select count(rd) from t1 where rd=0 and toid=t2.userid) calc_new from t2 where userid in (select distinct toid from t1);
userid	pmtotal	pmnew	calc_total	calc_new
1	0	0	9	3
2	0	0	4	2
drop table t1, t2;
create table t1 (s1 char(5));
select (select 'a','b' from t1 union select 'a','b' from t1) from t1;
ERROR 21000: Operand should contain 1 column(s)
insert into t1 values ('tttt');
select * from t1 where ('a','b')=(select 'a','b' from t1 union select 'a','b' from t1);
s1
tttt
EXPLAIN  (select * from t1);
Query Plan
===============================================
|ID|OPERATOR       |NAME|EST.ROWS|EST.TIME(us)|
-----------------------------------------------
|0 |TABLE FULL SCAN|t1  |1       |3           |
===============================================
Outputs & filters:
-------------------------------------
  0 - output([t1.s1]), filter(nil), rowset=16
      access([t1.s1]), partitions(p0)
      is_index_back=false, is_global_index=false, 
      range_key([t1.__pk_increment]), range(MIN ; MAX)always true
(select * from t1);
s1
tttt
drop table t1;
create table t1 (s1 char(5), index s1(s1));
create table t2 (s1 char(5), index s1(s1));
insert into t1 values ('a1'),('a2'),('a3');
insert into t2 values ('a1'),('a2');
select s1, s1 NOT IN (SELECT s1 FROM t2) from t1;
s1	s1 NOT IN (SELECT s1 FROM t2)
a1	0
a2	0
a3	1
select s1, s1 = ANY (SELECT s1 FROM t2) from t1;
s1	s1 = ANY (SELECT s1 FROM t2)
a1	1
a2	1
a3	0
select s1, s1 <> ALL (SELECT s1 FROM t2) from t1;
s1	s1 <> ALL (SELECT s1 FROM t2)
a1	0
a2	0
a3	1
select s1, s1 NOT IN (SELECT s1 FROM t2 WHERE s1 < 'a2') from t1;
s1	s1 NOT IN (SELECT s1 FROM t2 WHERE s1 < 'a2')
a1	0
a2	1
a3	1
EXPLAIN  select s1, s1 NOT IN (SELECT s1 FROM t2) from t1;
Query Plan
=================================================
|ID|OPERATOR         |NAME|EST.ROWS|EST.TIME(us)|
-------------------------------------------------
|0 |SUBPLAN FILTER   |    |3       |5           |
|1 |├─TABLE FULL SCAN|t1  |3       |3           |
|2 |└─TABLE FULL SCAN|t2  |2       |3           |
=================================================
Outputs & filters:
-------------------------------------
  0 - output([t1.s1], [t1.s1 != ALL(subquery(1))]), filter(nil), rowset=16
      exec_params_(nil), onetime_exprs_(nil), init_plan_idxs_([1]), use_batch=false
  1 - output([t1.s1]), filter(nil), rowset=16
      access([t1.s1]), partitions(p0)
      is_index_back=false, is_global_index=false, 
      range_key([t1.__pk_increment]), range(MIN ; MAX)always true
  2 - output([t2.s1]), filter(nil), rowset=16
      access([t2.s1]), partitions(p0)
      is_index_back=false, is_global_index=false, 
      range_key([t2.__pk_increment]), range(MIN ; MAX)always true
EXPLAIN  select s1, s1 = ANY (SELECT s1 FROM t2) from t1;
Query Plan
=================================================
|ID|OPERATOR         |NAME|EST.ROWS|EST.TIME(us)|
-------------------------------------------------
|0 |SUBPLAN FILTER   |    |3       |5           |
|1 |├─TABLE FULL SCAN|t1  |3       |3           |
|2 |└─TABLE FULL SCAN|t2  |2       |3           |
=================================================
Outputs & filters:
-------------------------------------
  0 - output([t1.s1], [t1.s1 = ANY(subquery(1))]), filter(nil), rowset=16
      exec_params_(nil), onetime_exprs_(nil), init_plan_idxs_([1]), use_batch=false
  1 - output([t1.s1]), filter(nil), rowset=16
      access([t1.s1]), partitions(p0)
      is_index_back=false, is_global_index=false, 
      range_key([t1.__pk_increment]), range(MIN ; MAX)always true
  2 - output([t2.s1]), filter(nil), rowset=16
      access([t2.s1]), partitions(p0)
      is_index_back=false, is_global_index=false, 
      range_key([t2.__pk_increment]), range(MIN ; MAX)always true
EXPLAIN  select s1, s1 <> ALL (SELECT s1 FROM t2) from t1;
Query Plan
=================================================
|ID|OPERATOR         |NAME|EST.ROWS|EST.TIME(us)|
-------------------------------------------------
|0 |SUBPLAN FILTER   |    |3       |5           |
|1 |├─TABLE FULL SCAN|t1  |3       |3           |
|2 |└─TABLE FULL SCAN|t2  |2       |3           |
=================================================
Outputs & filters:
-------------------------------------
  0 - output([t1.s1], [t1.s1 != ALL(subquery(1))]), filter(nil), rowset=16
      exec_params_(nil), onetime_exprs_(nil), init_plan_idxs_([1]), use_batch=false
  1 - output([t1.s1]), filter(nil), rowset=16
      access([t1.s1]), partitions(p0)
      is_index_back=false, is_global_index=false, 
      range_key([t1.__pk_increment]), range(MIN ; MAX)always true
  2 - output([t2.s1]), filter(nil), rowset=16
      access([t2.s1]), partitions(p0)
      is_index_back=false, is_global_index=false, 
      range_key([t2.__pk_increment]), range(MIN ; MAX)always true
EXPLAIN  select s1, s1 NOT IN (SELECT s1 FROM t2 WHERE s1 < 'a2') from t1;
Query Plan
====================================================
|ID|OPERATOR          |NAME  |EST.ROWS|EST.TIME(us)|
----------------------------------------------------
|0 |SUBPLAN FILTER    |      |3       |5           |
|1 |├─TABLE FULL SCAN |t1    |3       |3           |
|2 |└─TABLE RANGE SCAN|t2(s1)|1       |3           |
====================================================
Outputs & filters:
-------------------------------------
  0 - output([t1.s1], [t1.s1 != ALL(subquery(1))]), filter(nil), rowset=16
      exec_params_(nil), onetime_exprs_(nil), init_plan_idxs_([1]), use_batch=false
  1 - output([t1.s1]), filter(nil), rowset=16
      access([t1.s1]), partitions(p0)
      is_index_back=false, is_global_index=false, 
      range_key([t1.__pk_increment]), range(MIN ; MAX)always true
  2 - output([t2.s1]), filter(nil), rowset=16
      access([t2.s1]), partitions(p0)
      is_index_back=false, is_global_index=false, 
      range_key([t2.s1], [t2.__pk_increment]), range(NULL,MAX ; a2,MIN), 
      range_cond([t2.s1 < 'a2'])
drop table t1,t2;
create table t2 (a int, b int);
create table t3 (a int);
insert into t3 values (6),(7),(3);
select * from t3 where a >= all (select b from t2);
a
6
7
3
EXPLAIN  select * from t3 where a >= all (select b from t2);
Query Plan
======================================================
|ID|OPERATOR              |NAME|EST.ROWS|EST.TIME(us)|
------------------------------------------------------
|0 |NESTED-LOOP ANTI JOIN |    |3       |5           |
|1 |├─TABLE FULL SCAN     |t3  |3       |3           |
|2 |└─MATERIAL            |    |1       |3           |
|3 |  └─TABLE FULL SCAN   |t2  |1       |3           |
======================================================
Outputs & filters:
-------------------------------------
  0 - output([t3.a]), filter(nil), rowset=16
      conds([(T_OP_OR, t3.a < t2.b, t3.a IS NULL, t2.b IS NULL)]), nl_params_(nil), use_batch=false
  1 - output([t3.a]), filter(nil), rowset=16
      access([t3.a]), partitions(p0)
      is_index_back=false, is_global_index=false, 
      range_key([t3.__pk_increment]), range(MIN ; MAX)always true
  2 - output([t2.b]), filter(nil), rowset=16
  3 - output([t2.b]), filter(nil), rowset=16
      access([t2.b]), partitions(p0)
      is_index_back=false, is_global_index=false, 
      range_key([t2.__pk_increment]), range(MIN ; MAX)always true
select * from t3 where a >= some (select b from t2);
a
EXPLAIN  select * from t3 where a >= some (select b from t2);
Query Plan
======================================================
|ID|OPERATOR              |NAME|EST.ROWS|EST.TIME(us)|
------------------------------------------------------
|0 |NESTED-LOOP SEMI JOIN |    |1       |5           |
|1 |├─TABLE FULL SCAN     |t3  |3       |3           |
|2 |└─MATERIAL            |    |1       |3           |
|3 |  └─TABLE FULL SCAN   |t2  |1       |3           |
======================================================
Outputs & filters:
-------------------------------------
  0 - output([t3.a]), filter(nil), rowset=16
      conds([t3.a >= t2.b]), nl_params_(nil), use_batch=false
  1 - output([t3.a]), filter(nil), rowset=16
      access([t3.a]), partitions(p0)
      is_index_back=false, is_global_index=false, 
      range_key([t3.__pk_increment]), range(MIN ; MAX)always true
  2 - output([t2.b]), filter(nil), rowset=16
  3 - output([t2.b]), filter(nil), rowset=16
      access([t2.b]), partitions(p0)
      is_index_back=false, is_global_index=false, 
      range_key([t2.__pk_increment]), range(MIN ; MAX)always true
select * from t3 where a >= all (select b from t2 group by 1);
a
6
7
3
EXPLAIN  select * from t3 where a >= all (select b from t2 group by 1);
Query Plan
========================================================
|ID|OPERATOR               |NAME |EST.ROWS|EST.TIME(us)|
--------------------------------------------------------
|0 |NESTED-LOOP ANTI JOIN  |     |3       |5           |
|1 |├─TABLE FULL SCAN      |t3   |3       |3           |
|2 |└─MATERIAL             |     |1       |3           |
|3 |  └─SUBPLAN SCAN       |VIEW1|1       |3           |
|4 |    └─HASH DISTINCT    |     |1       |3           |
|5 |      └─TABLE FULL SCAN|t2   |1       |3           |
========================================================
Outputs & filters:
-------------------------------------
  0 - output([t3.a]), filter(nil), rowset=16
      conds([(T_OP_OR, t3.a < VIEW1.b, t3.a IS NULL, VIEW1.b IS NULL)]), nl_params_(nil), use_batch=false
  1 - output([t3.a]), filter(nil), rowset=16
      access([t3.a]), partitions(p0)
      is_index_back=false, is_global_index=false, 
      range_key([t3.__pk_increment]), range(MIN ; MAX)always true
  2 - output([VIEW1.b]), filter(nil), rowset=16
  3 - output([VIEW1.b]), filter(nil), rowset=16
      access([VIEW1.b])
  4 - output([t2.b]), filter(nil), rowset=16
      distinct([t2.b])
  5 - output([t2.b]), filter(nil), rowset=16
      access([t2.b]), partitions(p0)
      is_index_back=false, is_global_index=false, 
      range_key([t2.__pk_increment]), range(MIN ; MAX)always true
select * from t3 where a >= some (select b from t2 group by 1);
a
EXPLAIN  select * from t3 where a >= some (select b from t2 group by 1);
Query Plan
========================================================
|ID|OPERATOR               |NAME |EST.ROWS|EST.TIME(us)|
--------------------------------------------------------
|0 |NESTED-LOOP SEMI JOIN  |     |1       |5           |
|1 |├─TABLE FULL SCAN      |t3   |3       |3           |
|2 |└─MATERIAL             |     |1       |3           |
|3 |  └─SUBPLAN SCAN       |VIEW1|1       |3           |
|4 |    └─HASH DISTINCT    |     |1       |3           |
|5 |      └─TABLE FULL SCAN|t2   |1       |3           |
========================================================
Outputs & filters:
-------------------------------------
  0 - output([t3.a]), filter(nil), rowset=16
      conds([t3.a >= VIEW1.b]), nl_params_(nil), use_batch=false
  1 - output([t3.a]), filter(nil), rowset=16
      access([t3.a]), partitions(p0)
      is_index_back=false, is_global_index=false, 
      range_key([t3.__pk_increment]), range(MIN ; MAX)always true
  2 - output([VIEW1.b]), filter(nil), rowset=16
  3 - output([VIEW1.b]), filter(nil), rowset=16
      access([VIEW1.b])
  4 - output([t2.b]), filter(nil), rowset=16
      distinct([t2.b])
  5 - output([t2.b]), filter(nil), rowset=16
      access([t2.b]), partitions(p0)
      is_index_back=false, is_global_index=false, 
      range_key([t2.__pk_increment]), range(MIN ; MAX)always true
select * from t3 where NULL >= any (select b from t2);
a
EXPLAIN  select * from t3 where NULL >= any (select b from t2);
Query Plan
===============================================
|ID|OPERATOR       |NAME|EST.ROWS|EST.TIME(us)|
-----------------------------------------------
|0 |TABLE FULL SCAN|t3  |0       |3           |
===============================================
Outputs & filters:
-------------------------------------
  0 - output([t3.a]), filter(nil), startup_filter([0]), rowset=16
      access([t3.a]), partitions(p0)
      is_index_back=false, is_global_index=false, 
      range_key([t3.__pk_increment]), range(MIN ; MAX)always true
select * from t3 where NULL >= any (select b from t2 group by 1);
a
EXPLAIN  select * from t3 where NULL >= any (select b from t2 group by 1);
Query Plan
===============================================
|ID|OPERATOR       |NAME|EST.ROWS|EST.TIME(us)|
-----------------------------------------------
|0 |TABLE FULL SCAN|t3  |0       |3           |
===============================================
Outputs & filters:
-------------------------------------
  0 - output([t3.a]), filter(nil), startup_filter([0]), rowset=16
      access([t3.a]), partitions(p0)
      is_index_back=false, is_global_index=false, 
      range_key([t3.__pk_increment]), range(MIN ; MAX)always true
select * from t3 where NULL >= some (select b from t2);
a
EXPLAIN  select * from t3 where NULL >= some (select b from t2);
Query Plan
===============================================
|ID|OPERATOR       |NAME|EST.ROWS|EST.TIME(us)|
-----------------------------------------------
|0 |TABLE FULL SCAN|t3  |0       |3           |
===============================================
Outputs & filters:
-------------------------------------
  0 - output([t3.a]), filter(nil), startup_filter([0]), rowset=16
      access([t3.a]), partitions(p0)
      is_index_back=false, is_global_index=false, 
      range_key([t3.__pk_increment]), range(MIN ; MAX)always true
select * from t3 where NULL >= some (select b from t2 group by 1);
a
EXPLAIN  select * from t3 where NULL >= some (select b from t2 group by 1);
Query Plan
===============================================
|ID|OPERATOR       |NAME|EST.ROWS|EST.TIME(us)|
-----------------------------------------------
|0 |TABLE FULL SCAN|t3  |0       |3           |
===============================================
Outputs & filters:
-------------------------------------
  0 - output([t3.a]), filter(nil), startup_filter([0]), rowset=16
      access([t3.a]), partitions(p0)
      is_index_back=false, is_global_index=false, 
      range_key([t3.__pk_increment]), range(MIN ; MAX)always true
insert into t2 values (2,2), (2,1), (3,3), (3,1);
select * from t3 where a > all (select max(b) from t2 group by a);
a
6
7
EXPLAIN  select * from t3 where a > all (select max(b) from t2 group by a);
Query Plan
========================================================
|ID|OPERATOR               |NAME |EST.ROWS|EST.TIME(us)|
--------------------------------------------------------
|0 |NESTED-LOOP ANTI JOIN  |     |3       |6           |
|1 |├─TABLE FULL SCAN      |t3   |3       |3           |
|2 |└─MATERIAL             |     |4       |4           |
|3 |  └─SUBPLAN SCAN       |VIEW1|4       |4           |
|4 |    └─HASH GROUP BY    |     |4       |4           |
|5 |      └─TABLE FULL SCAN|t2   |4       |3           |
========================================================
Outputs & filters:
-------------------------------------
  0 - output([t3.a]), filter(nil), rowset=16
      conds([(T_OP_OR, t3.a <= VIEW1.max(b), t3.a IS NULL, VIEW1.max(b) IS NULL)]), nl_params_(nil), use_batch=false
  1 - output([t3.a]), filter(nil), rowset=16
      access([t3.a]), partitions(p0)
      is_index_back=false, is_global_index=false, 
      range_key([t3.__pk_increment]), range(MIN ; MAX)always true
  2 - output([VIEW1.max(b)]), filter(nil), rowset=16
  3 - output([VIEW1.max(b)]), filter(nil), rowset=16
      access([VIEW1.max(b)])
  4 - output([T_FUN_MAX(t2.b)]), filter(nil), rowset=16
      group([t2.a]), agg_func([T_FUN_MAX(t2.b)])
  5 - output([t2.b], [t2.a]), filter(nil), rowset=16
      access([t2.b], [t2.a]), partitions(p0)
      is_index_back=false, is_global_index=false, 
      range_key([t2.__pk_increment]), range(MIN ; MAX)always true
drop table t2, t3;
CREATE TABLE `t1` (
`id` mediumint(9) NOT NULL auto_increment,
`taskid` bigint(20) NOT NULL default '0',
`dbid` int(11) NOT NULL default '0',
`create_date` datetime NOT NULL default '0000-00-00 00:00:00',
`last_update` datetime NOT NULL default '0000-00-00 00:00:00',
PRIMARY KEY  (`id`)
) AUTO_INCREMENT=3 ;
INSERT INTO `t1` (`id`, `taskid`, `dbid`, `create_date`,`last_update`) VALUES (1, 1, 15, '2003-09-29 10:31:36', '2003-09-29 10:31:36'), (2, 1, 21, now(), now());
CREATE TABLE `t2` (
`db_id` int(11) NOT NULL auto_increment,
`name` varchar(100) NOT NULL default '',
`primary_uid` smallint(6) NOT NULL default '0',
`secondary_uid` smallint(6) NOT NULL default '0',
PRIMARY KEY  (`db_id`),
UNIQUE KEY `name_2` (`name`)
) AUTO_INCREMENT=2147483647;
INSERT INTO `t2` (`db_id`, `name`, `primary_uid`, `secondary_uid`) VALUES (18, 'Not Set 1', 0, 0),(19, 'Valid', 1, 2),(20, 'Valid 2', 1, 2),(21, 'Should Not Return', 1, 2),(26, 'Not Set 2', 0, 0),(-1, 'ALL DB\'S', 0, 0);
CREATE TABLE `t3` (`taskgenid` mediumint(9) NOT NULL auto_increment,`dbid` int(11) NOT NULL default '0',`taskid` int(11) NOT NULL default '0',`mon` tinyint(4) NOT NULL default '1',`tues` tinyint(4) NOT NULL default '1',`wed` tinyint(4) NOT NULL default '1',`thur` tinyint(4) NOT NULL default '1',`fri` tinyint(4) NOT NULL default '1',`sat` tinyint(4) NOT NULL default '0',`sun` tinyint(4) NOT NULL default '0',`how_often` smallint(6) NOT NULL default '1',`userid` smallint(6) NOT NULL default '0',`active` tinyint(4) NOT NULL default '1',PRIMARY KEY  (`taskgenid`)) AUTO_INCREMENT=2 ;
INSERT INTO `t3` (`taskgenid`, `dbid`, `taskid`, `mon`, `tues`,`wed`, `thur`, `fri`, `sat`, `sun`, `how_often`, `userid`, `active`) VALUES (1,-1, 1, 1, 1, 1, 1, 1, 0, 0, 1, 0, 1);
CREATE TABLE `t4` (`task_id` smallint(6) NOT NULL default '0',`description` varchar(200) NOT NULL default '');
INSERT INTO `t4` (`task_id`, `description`) VALUES (1, 'Daily Check List'),(2, 'Weekly Status');
drop table t1,t2,t3,t4;
CREATE TABLE t1 (id int(11) default NULL);
INSERT INTO t1 VALUES (1),(5);
CREATE TABLE t2 (id int(11) default NULL);
INSERT INTO t2 VALUES (2),(6);
select * from t1 where (1,2,6) in (select * from t2);
ERROR 21000: Operand should contain 3 column(s)
DROP TABLE t1,t2;
create table t1 (s1 int);
insert into t1 values (1);
insert into t1 values (2);
set sort_buffer_size = (select s1 from t1);
ERROR 21000: Subquery returns more than 1 row
drop table t1;
create table t1 (s1 char);
insert into t1 values ('e');
select * from t1 where 'f' > any (select s1 from t1);
s1
e
select * from t1 where 'f' > any (select s1 from t1 union select s1 from t1);
s1
e
EXPLAIN  select * from t1 where 'f' > any (select s1 from t1 union select s1 from t1);
Query Plan
================================================================
|ID|OPERATOR                       |NAME |EST.ROWS|EST.TIME(us)|
----------------------------------------------------------------
|0 |NESTED-LOOP JOIN CARTESIAN     |     |1       |7           |
|1 |├─TABLE FULL SCAN              |t1   |1       |3           |
|2 |└─MATERIAL                     |     |1       |5           |
|3 |  └─SUBPLAN SCAN               |VIEW1|1       |5           |
|4 |    └─LIMIT                    |     |1       |5           |
|5 |      └─MERGE UNION DISTINCT   |     |1       |5           |
|6 |        ├─LIMIT                |     |1       |3           |
|7 |        │ └─MERGE DISTINCT     |     |1       |3           |
|8 |        │   └─SORT             |     |1       |3           |
|9 |        │     └─TABLE FULL SCAN|t1   |1       |3           |
|10|        └─LIMIT                |     |1       |3           |
|11|          └─MERGE DISTINCT     |     |1       |3           |
|12|            └─SORT             |     |1       |3           |
|13|              └─TABLE FULL SCAN|t1   |1       |3           |
================================================================
Outputs & filters:
-------------------------------------
  0 - output([t1.s1]), filter(nil), rowset=16
      conds(nil), nl_params_(nil), use_batch=false
  1 - output([t1.s1]), filter(nil), rowset=16
      access([t1.s1]), partitions(p0)
      is_index_back=false, is_global_index=false, 
      range_key([t1.__pk_increment]), range(MIN ; MAX)always true
  2 - output(nil), filter(nil), rowset=16
  3 - output(nil), filter(nil), rowset=16
      access(nil)
  4 - output([UNION([1])]), filter(nil), rowset=16
      limit(1), offset(nil)
  5 - output([UNION([1])]), filter(nil), rowset=16
  6 - output([t1.s1]), filter(nil), rowset=16
      limit(1), offset(nil)
  7 - output([t1.s1]), filter(nil), rowset=16
      distinct([t1.s1])
  8 - output([t1.s1]), filter(nil), rowset=16
      sort_keys([t1.s1, ASC])
  9 - output([t1.s1]), filter([t1.s1 < 'f']), rowset=16
      access([t1.s1]), partitions(p0)
      is_index_back=false, is_global_index=false, filter_before_indexback[false], 
      range_key([t1.__pk_increment]), range(MIN ; MAX)always true
 10 - output([t1.s1]), filter(nil), rowset=16
      limit(1), offset(nil)
 11 - output([t1.s1]), filter(nil), rowset=16
      distinct([t1.s1])
 12 - output([t1.s1]), filter(nil), rowset=16
      sort_keys([t1.s1, ASC])
 13 - output([t1.s1]), filter([t1.s1 < 'f']), rowset=16
      access([t1.s1]), partitions(p0)
      is_index_back=false, is_global_index=false, filter_before_indexback[false], 
      range_key([t1.__pk_increment]), range(MIN ; MAX)always true
drop table t1;
CREATE TABLE t1 (number char(11) NOT NULL default '');
INSERT INTO t1 VALUES ('69294728265'),('18621828126'),('89356874041'),('95895001874');
CREATE TABLE t2 (code char(5) NOT NULL default '',UNIQUE KEY code (code));
INSERT INTO t2 VALUES ('1'),('1226'),('1245'),('1862'),('18623'),('1874'),('1967'),('6');
select c.number as phone,(select p.code from t2 p where c.number like concat(p.code, '%') order by length(p.code) desc limit 1) as code from t1 c;
phone	code
69294728265	6
18621828126	1862
89356874041	NULL
95895001874	NULL
drop table t1, t2;
create table t1 (s1 int);
create table t2 (s1 int);
select * from t1 where (select count(*) from t2 where t1.s2) = 1;
ERROR 42S22: Unknown column 't1.s2' in 'where clause'
select * from t1 where (select count(*) from t2 group by t1.s2) = 1;
ERROR 42S22: Unknown column 't1.s2' in 'group statement'
select count(*) from t2 group by t1.s2;
ERROR 42S22: Unknown column 't1.s2' in 'group statement'
drop table t1, t2;
CREATE TABLE t1(COLA FLOAT NOT NULL,COLB FLOAT NOT NULL,COLC VARCHAR(20) DEFAULT NULL,PRIMARY KEY (COLA, COLB));
CREATE TABLE t2(COLA FLOAT NOT NULL,COLB FLOAT NOT NULL,COLC CHAR(1) NOT NULL,PRIMARY KEY (COLA));
INSERT INTO t1 VALUES (1,1,'1A3240'), (1,2,'4W2365');
INSERT INTO t2 VALUES (100, 200, 'C');
SELECT DISTINCT COLC FROM t1 WHERE COLA = (SELECT COLA FROM t2 WHERE COLB = 200 AND COLC ='C' LIMIT 1);
COLC
DROP TABLE t1, t2;
CREATE TABLE t1 (a int(1));
INSERT INTO t1 VALUES (1),(1),(1),(1),(1),(2),(3),(4),(5);
SELECT DISTINCT (SELECT a) FROM t1 LIMIT 100;
(SELECT a)
1
2
3
4
5
DROP TABLE t1;
create table t1 (a int);
insert into t1 values (1), (2), (3);
SET SQL_SELECT_LIMIT=1;
select sum(a) from (select * from t1) as a;
sum(a)
6
select 2 in (select * from t1);
2 in (select * from t1)
1
SET SQL_SELECT_LIMIT=default;
drop table t1;
CREATE TABLE t1 (a int, b int, INDEX (a));
INSERT INTO t1 VALUES (1, 1), (1, 2), (1, 3);
SELECT * FROM t1 WHERE a = (SELECT MAX(a) FROM t1 WHERE a = 1) ORDER BY b;
a	b
1	1
1	2
1	3
DROP TABLE t1;
create table t1(val varchar(10));
insert into t1 values ('aaa'), ('bbb'),('eee'),('mmm'),('ppp');
select count(*) from t1 as w1 where w1.val in (select w2.val from t1 as w2 where w2.val like 'm%') and w1.val in (select w3.val from t1 as w3 where w3.val like 'e%');
count(*)
0
drop table t1;
create table t1 (id int not null, text varchar(20) not null default '', primary key (id));
insert into t1 (id, text) values (1, 'text1'), (2, 'text2'), (3, 'text3'), (4, 'text4'), (5, 'text5'), (6, 'text6'), (7, 'text7'), (8, 'text8'), (9, 'text9'), (10, 'text10'), (11, 'text11'), (12, 'text12');
select * from t1 where id not in (select id from t1 where id < 8);
id	text
8	text8
9	text9
10	text10
11	text11
12	text12
select * from t1 as tt where not exists (select id from t1 where id < 8 and (id = tt.id or id is null) having id is not null);
id	text
8	text8
9	text9
10	text10
11	text11
12	text12
EXPLAIN  select * from t1 where id not in (select id from t1 where id < 8);
Query Plan
===============================================
|ID|OPERATOR       |NAME|EST.ROWS|EST.TIME(us)|
-----------------------------------------------
|0 |TABLE FULL SCAN|t1  |11      |3           |
===============================================
Outputs & filters:
-------------------------------------
  0 - output([t1.id], [t1.text]), filter([lnnvl(cast(t1.id < 8, TINYINT(-1, 0)))]), rowset=16
      access([t1.id], [t1.text]), partitions(p0)
      is_index_back=false, is_global_index=false, filter_before_indexback[false], 
      range_key([t1.id]), range(MIN ; MAX)always true
EXPLAIN  select * from t1 as tt where not exists (select id from t1 where id < 8 and (id = tt.id or id is null) having id is not null);
Query Plan
===============================================
|ID|OPERATOR       |NAME|EST.ROWS|EST.TIME(us)|
-----------------------------------------------
|0 |TABLE FULL SCAN|tt  |11      |3           |
===============================================
Outputs & filters:
-------------------------------------
  0 - output([tt.id], [tt.text]), filter([lnnvl(cast(tt.id < 8, TINYINT(-1, 0)))]), rowset=16
      access([tt.id], [tt.text]), partitions(p0)
      is_index_back=false, is_global_index=false, filter_before_indexback[false], 
      range_key([tt.id]), range(MIN ; MAX)always true
insert into t1 (id, text) values (1000, 'text1000'), (1001, 'text1001');
create table t2 (id int not null, text varchar(20) not null default '', primary key (id));
insert into t2 (id, text) values (1, 'text1'), (2, 'text2'), (3, 'text3'), (4, 'text4'), (5, 'text5'), (6, 'text6'), (7, 'text7'), (8, 'text8'), (9, 'text9'), (10, 'text10'), (11, 'text1'), (12, 'text2'), (13, 'text3'), (14, 'text4'), (15, 'text5'), (16, 'text6'), (17, 'text7'), (18, 'text8'), (19, 'text9'), (20, 'text10'),(21, 'text1'), (22, 'text2'), (23, 'text3'), (24, 'text4'), (25, 'text5'), (26, 'text6'), (27, 'text7'), (28, 'text8'), (29, 'text9'), (30, 'text10'), (31, 'text1'), (32, 'text2'), (33, 'text3'), (34, 'text4'), (35, 'text5'), (36, 'text6'), (37, 'text7'), (38, 'text8'), (39, 'text9'), (40, 'text10'), (41, 'text1'), (42, 'text2'), (43, 'text3'), (44, 'text4'), (45, 'text5'), (46, 'text6'), (47, 'text7'), (48, 'text8'), (49, 'text9'), (50, 'text10');
select * from t1 a left join t2 b on (a.id=b.id or b.id is null) join t1 c on (if(isnull(b.id), 1000, b.id)=c.id);
id	text	id	text	id	text
1	text1	1	text1	1	text1
2	text2	2	text2	2	text2
3	text3	3	text3	3	text3
4	text4	4	text4	4	text4
5	text5	5	text5	5	text5
6	text6	6	text6	6	text6
7	text7	7	text7	7	text7
8	text8	8	text8	8	text8
9	text9	9	text9	9	text9
10	text10	10	text10	10	text10
11	text11	11	text1	11	text11
12	text12	12	text2	12	text12
1000	text1000	NULL	NULL	1000	text1000
1001	text1001	NULL	NULL	1000	text1000
EXPLAIN  select * from t1 a left join t2 b on (a.id=b.id or b.id is null) join t1 c on (if(isnull(b.id), 1000, b.id)=c.id);
Query Plan
====================================================================
|ID|OPERATOR                           |NAME |EST.ROWS|EST.TIME(us)|
--------------------------------------------------------------------
|0 |HASH JOIN                          |     |27      |54          |
|1 |├─TABLE FULL SCAN                  |c    |14      |3           |
|2 |└─SUBPLAN SCAN                     |VIEW3|28      |45          |
|3 |  └─WINDOW FUNCTION                |     |28      |45          |
|4 |    └─SORT                         |     |28      |22          |
|5 |      └─SUBPLAN SCAN               |VIEW2|28      |16          |
|6 |        └─UNION ALL                |     |28      |16          |
|7 |          ├─MERGE OUTER JOIN       |     |14      |8           |
|8 |          │ ├─TABLE FULL SCAN      |a    |14      |3           |
|9 |          │ └─TABLE FULL SCAN      |b    |50      |4           |
|10|          └─NESTED-LOOP OUTER JOIN |     |14      |8           |
|11|            ├─TABLE FULL SCAN      |a    |14      |3           |
|12|            └─MATERIAL             |     |1       |5           |
|13|              └─TABLE GET          |b    |1       |5           |
====================================================================
Outputs & filters:
-------------------------------------
  0 - output([VIEW3.VIEW2.a.id], [VIEW3.VIEW2.a.text], [VIEW3.VIEW2.b.id], [VIEW3.VIEW2.b.text], [c.id], [c.text]), filter(nil), rowset=256
      equal_conds([CASE WHEN VIEW3.VIEW2.b.id IS NULL THEN 1000 ELSE VIEW3.VIEW2.b.id END = c.id]), other_conds(nil)
  1 - output([c.id], [c.text]), filter(nil), rowset=256
      access([c.id], [c.text]), partitions(p0)
      is_index_back=false, is_global_index=false, 
      range_key([c.id]), range(MIN ; MAX)always true
  2 - output([VIEW3.VIEW2.b.id], [VIEW3.VIEW2.a.id], [VIEW3.VIEW2.a.text], [VIEW3.VIEW2.b.text]), filter([VIEW3.RN = 1 OR VIEW3.VIEW2.b.id IS NOT NULL]), rowset=256
      access([VIEW3.VIEW2.b.id], [VIEW3.VIEW2.a.id], [VIEW3.VIEW2.a.text], [VIEW3.VIEW2.b.text], [VIEW3.RN])
  3 - output([VIEW2.b.id], [VIEW2.a.id], [VIEW2.a.text], [VIEW2.b.text], [T_WIN_FUN_ROW_NUMBER()]), filter(nil), rowset=256
      win_expr(T_WIN_FUN_ROW_NUMBER()), partition_by([VIEW2.a.id]), order_by([VIEW2.b.id, ASC]), window_type(RANGE), upper(UNBOUNDED PRECEDING), lower(UNBOUNDED 
      FOLLOWING)
  4 - output([VIEW2.b.id], [VIEW2.a.id], [VIEW2.a.text], [VIEW2.b.text]), filter(nil), rowset=256
      sort_keys([VIEW2.a.id, ASC], [VIEW2.b.id, ASC])
  5 - output([VIEW2.b.id], [VIEW2.a.id], [VIEW2.a.text], [VIEW2.b.text]), filter(nil), rowset=256
      access([VIEW2.b.id], [VIEW2.a.id], [VIEW2.a.text], [VIEW2.b.text])
  6 - output([UNION([1])], [UNION([2])], [UNION([3])], [UNION([4])]), filter(nil), rowset=256
  7 - output([b.id], [a.id], [a.text], [b.text]), filter(nil), rowset=256
      equal_conds([a.id = b.id]), other_conds(nil)
      merge_directions([ASC])
  8 - output([a.id], [a.text]), filter(nil), rowset=256
      access([a.id], [a.text]), partitions(p0)
      is_index_back=false, is_global_index=false, 
      range_key([a.id]), range(MIN ; MAX)always true
  9 - output([b.id], [b.text]), filter(nil), rowset=256
      access([b.id], [b.text]), partitions(p0)
      is_index_back=false, is_global_index=false, 
      range_key([b.id]), range(MIN ; MAX)always true
 10 - output([b.id], [a.id], [a.text], [b.text]), filter(nil), rowset=256
      conds([lnnvl(cast(a.id = NULL, TINYINT(-1, 0)))]), nl_params_(nil), use_batch=false
 11 - output([a.id], [a.text]), filter(nil), rowset=256
      access([a.id], [a.text]), partitions(p0)
      is_index_back=false, is_global_index=false, 
      range_key([a.id]), range(MIN ; MAX)always true
 12 - output([b.id], [b.text]), filter(nil), rowset=256
 13 - output([b.id], [b.text]), filter(nil), rowset=256
      access([b.id], [b.text]), partitions(p0)
      is_index_back=false, is_global_index=false, 
      range_key([b.id]), range[NULL ; NULL], 
      range_cond([b.id IS NULL])
drop table t1,t2;
create table t1 (a int);
insert into t1 values (1);
drop table t1;
create table t1(id int);
create table t2(id int);
create table t3(flag int);
select (select * from t3 where id not null) from t1, t2;
ERROR 42000: You have an error in your SQL syntax; check the manual that corresponds to your OceanBase version for the right syntax to use near 'null) from t1, t2' at line 1
drop table t1,t2,t3;
CREATE TABLE t1 (id INT);
CREATE TABLE t2 (id INT);
INSERT INTO t1 VALUES (1), (2);
INSERT INTO t2 VALUES (1);
SELECT t1.id, ( SELECT COUNT(t.id) FROM t2 AS t WHERE t.id = t1.id ) AS c FROM t1 LEFT JOIN t2 USING (id);
id	c
1	1
2	0
SELECT id, ( SELECT COUNT(t.id) FROM t2 AS t WHERE t.id = t1.id ) AS c FROM t1 LEFT JOIN t2 USING (id);
id	c
1	1
2	0
SELECT t1.id, ( SELECT COUNT(t.id) FROM t2 AS t WHERE t.id = t1.id ) AS c FROM t1 LEFT JOIN t2 USING (id) ORDER BY t1.id;
id	c
1	1
2	0
SELECT id, ( SELECT COUNT(t.id) FROM t2 AS t WHERE t.id = t1.id ) AS c FROM t1 LEFT JOIN t2 USING (id) ORDER BY id;
id	c
1	1
2	0
DROP TABLE t1,t2;
CREATE TABLE t1 ( a int, b int );
INSERT INTO t1 VALUES (1,1),(2,2),(3,3);
SELECT a FROM t1 WHERE a > ANY ( SELECT a FROM t1 WHERE b = 2 );
a
3
SELECT a FROM t1 WHERE a < ANY ( SELECT a FROM t1 WHERE b = 2 );
a
1
SELECT a FROM t1 WHERE a = ANY ( SELECT a FROM t1 WHERE b = 2 );
a
2
SELECT a FROM t1 WHERE a >= ANY ( SELECT a FROM t1 WHERE b = 2 );
a
2
3
SELECT a FROM t1 WHERE a <= ANY ( SELECT a FROM t1 WHERE b = 2 );
a
1
2
SELECT a FROM t1 WHERE a <> ANY ( SELECT a FROM t1 WHERE b = 2 );
a
1
3
SELECT a FROM t1 WHERE a > ALL ( SELECT a FROM t1 WHERE b = 2 );
a
3
SELECT a FROM t1 WHERE a < ALL ( SELECT a FROM t1 WHERE b = 2 );
a
1
SELECT a FROM t1 WHERE a = ALL ( SELECT a FROM t1 WHERE b = 2 );
a
2
SELECT a FROM t1 WHERE a >= ALL ( SELECT a FROM t1 WHERE b = 2 );
a
2
3
SELECT a FROM t1 WHERE a <= ALL ( SELECT a FROM t1 WHERE b = 2 );
a
1
2
SELECT a FROM t1 WHERE a <> ALL ( SELECT a FROM t1 WHERE b = 2 );
a
1
3
ALTER TABLE t1 ADD INDEX (a);
SELECT a FROM t1 WHERE a > ANY ( SELECT a FROM t1 WHERE b = 2 );
a
3
SELECT a FROM t1 WHERE a < ANY ( SELECT a FROM t1 WHERE b = 2 );
a
1
SELECT a FROM t1 WHERE a = ANY ( SELECT a FROM t1 WHERE b = 2 );
a
2
SELECT a FROM t1 WHERE a >= ANY ( SELECT a FROM t1 WHERE b = 2 );
a
2
3
SELECT a FROM t1 WHERE a <= ANY ( SELECT a FROM t1 WHERE b = 2 );
a
1
2
SELECT a FROM t1 WHERE a <> ANY ( SELECT a FROM t1 WHERE b = 2 );
a
1
3
SELECT a FROM t1 WHERE a > ALL ( SELECT a FROM t1 WHERE b = 2 );
a
3
SELECT a FROM t1 WHERE a < ALL ( SELECT a FROM t1 WHERE b = 2 );
a
1
SELECT a FROM t1 WHERE a = ALL ( SELECT a FROM t1 WHERE b = 2 );
a
2
SELECT a FROM t1 WHERE a >= ALL ( SELECT a FROM t1 WHERE b = 2 );
a
2
3
SELECT a FROM t1 WHERE a <= ALL ( SELECT a FROM t1 WHERE b = 2 );
a
1
2
SELECT a FROM t1 WHERE a <> ALL ( SELECT a FROM t1 WHERE b = 2 );
a
1
3
SELECT a FROM t1 WHERE a > ANY (SELECT a FROM t1 HAVING a = 2);
a
3
SELECT a FROM t1 WHERE a < ANY (SELECT a FROM t1 HAVING a = 2);
a
1
SELECT a FROM t1 WHERE a = ANY (SELECT a FROM t1 HAVING a = 2);
a
2
SELECT a FROM t1 WHERE a >= ANY (SELECT a FROM t1 HAVING a = 2);
a
2
3
SELECT a FROM t1 WHERE a <= ANY (SELECT a FROM t1 HAVING a = 2);
a
1
2
SELECT a FROM t1 WHERE a <> ANY (SELECT a FROM t1 HAVING a = 2);
a
1
3
SELECT a FROM t1 WHERE a > ALL (SELECT a FROM t1 HAVING a = 2);
a
3
SELECT a FROM t1 WHERE a < ALL (SELECT a FROM t1 HAVING a = 2);
a
1
SELECT a FROM t1 WHERE a = ALL (SELECT a FROM t1 HAVING a = 2);
a
2
SELECT a FROM t1 WHERE a >= ALL (SELECT a FROM t1 HAVING a = 2);
a
2
3
SELECT a FROM t1 WHERE a <= ALL (SELECT a FROM t1 HAVING a = 2);
a
1
2
SELECT a FROM t1 WHERE a <> ALL (SELECT a FROM t1 HAVING a = 2);
a
1
3
SELECT a FROM t1 WHERE a > ANY (SELECT a FROM t1 WHERE b = 2 UNION SELECT a FROM t1 WHERE b = 2);
a
3
SELECT a FROM t1 WHERE a < ANY (SELECT a FROM t1 WHERE b = 2 UNION SELECT a FROM t1 WHERE b = 2);
a
1
SELECT a FROM t1 WHERE a = ANY (SELECT a FROM t1 WHERE b = 2 UNION SELECT a FROM t1 WHERE b = 2);
a
2
SELECT a FROM t1 WHERE a >= ANY (SELECT a FROM t1 WHERE b = 2 UNION SELECT a FROM t1 WHERE b = 2);
a
2
3
SELECT a FROM t1 WHERE a <= ANY (SELECT a FROM t1 WHERE b = 2 UNION SELECT a FROM t1 WHERE b = 2);
a
1
2
SELECT a FROM t1 WHERE a <> ANY (SELECT a FROM t1 WHERE b = 2 UNION SELECT a FROM t1 WHERE b = 2);
a
1
3
SELECT a FROM t1 WHERE a > ALL (SELECT a FROM t1 WHERE b = 2 UNION SELECT a FROM t1 WHERE b = 2);
a
3
SELECT a FROM t1 WHERE a < ALL (SELECT a FROM t1 WHERE b = 2 UNION SELECT a FROM t1 WHERE b = 2);
a
1
SELECT a FROM t1 WHERE a = ALL (SELECT a FROM t1 WHERE b = 2 UNION SELECT a FROM t1 WHERE b = 2);
a
2
SELECT a FROM t1 WHERE a >= ALL (SELECT a FROM t1 WHERE b = 2 UNION SELECT a FROM t1 WHERE b = 2);
a
2
3
SELECT a FROM t1 WHERE a <= ALL (SELECT a FROM t1 WHERE b = 2 UNION SELECT a FROM t1 WHERE b = 2);
a
1
2
SELECT a FROM t1 WHERE a <> ALL (SELECT a FROM t1 WHERE b = 2 UNION SELECT a FROM t1 WHERE b = 2);
a
1
3
SELECT a FROM t1 WHERE a > ANY (SELECT a FROM t1 HAVING a = 2 UNION SELECT a FROM t1 HAVING a = 2);
a
3
SELECT a FROM t1 WHERE a < ANY (SELECT a FROM t1 HAVING a = 2 UNION SELECT a FROM t1 HAVING a = 2);
a
1
SELECT a FROM t1 WHERE a = ANY (SELECT a FROM t1 HAVING a = 2 UNION SELECT a FROM t1 HAVING a = 2);
a
2
SELECT a FROM t1 WHERE a >= ANY (SELECT a FROM t1 HAVING a = 2 UNION SELECT a FROM t1 HAVING a = 2);
a
2
3
SELECT a FROM t1 WHERE a <= ANY (SELECT a FROM t1 HAVING a = 2 UNION SELECT a FROM t1 HAVING a = 2);
a
1
2
SELECT a FROM t1 WHERE a <> ANY (SELECT a FROM t1 HAVING a = 2 UNION SELECT a FROM t1 HAVING a = 2);
a
1
3
SELECT a FROM t1 WHERE a > ALL (SELECT a FROM t1 HAVING a = 2 UNION SELECT a FROM t1 HAVING a = 2);
a
3
SELECT a FROM t1 WHERE a < ALL (SELECT a FROM t1 HAVING a = 2 UNION SELECT a FROM t1 HAVING a = 2);
a
1
SELECT a FROM t1 WHERE a = ALL (SELECT a FROM t1 HAVING a = 2 UNION SELECT a FROM t1 HAVING a = 2);
a
2
SELECT a FROM t1 WHERE a >= ALL (SELECT a FROM t1 HAVING a = 2 UNION SELECT a FROM t1 HAVING a = 2);
a
2
3
SELECT a FROM t1 WHERE a <= ALL (SELECT a FROM t1 HAVING a = 2 UNION SELECT a FROM t1 HAVING a = 2);
a
1
2
SELECT a FROM t1 WHERE a <> ALL (SELECT a FROM t1 HAVING a = 2 UNION SELECT a FROM t1 HAVING a = 2);
a
1
3
SELECT a FROM t1 WHERE (1,2) > ANY (SELECT a FROM t1 WHERE b = 2);
ERROR 21000: Operand should contain 1 column(s)
SELECT a FROM t1 WHERE a > ANY (SELECT a,2 FROM t1 WHERE b = 2);
ERROR 21000: Operand should contain 1 column(s)
SELECT a FROM t1 WHERE (1,2) > ANY (SELECT a,2 FROM t1 WHERE b = 2);
ERROR 21000: Operand should contain 1 column(s)
SELECT a FROM t1 WHERE (1,2) > ALL (SELECT a FROM t1 WHERE b = 2);
ERROR 21000: Operand should contain 1 column(s)
SELECT a FROM t1 WHERE a > ALL (SELECT a,2 FROM t1 WHERE b = 2);
ERROR 21000: Operand should contain 1 column(s)
SELECT a FROM t1 WHERE (1,2) > ALL (SELECT a,2 FROM t1 WHERE b = 2);
ERROR 21000: Operand should contain 1 column(s)
SELECT a FROM t1 WHERE (1,2) = ALL (SELECT a,2 FROM t1 WHERE b = 2);
a
SELECT a FROM t1 WHERE (1,2) <> ANY (SELECT a,2 FROM t1 WHERE b = 2);
a
1
2
3
SELECT a FROM t1 WHERE (1,2) = ANY (SELECT a FROM t1 WHERE b = 2);
ERROR 21000: Operand should contain 2 column(s)
SELECT a FROM t1 WHERE a = ANY (SELECT a,2 FROM t1 WHERE b = 2);
ERROR 21000: Operand should contain 1 column(s)
SELECT a FROM t1 WHERE (1,2) = ANY (SELECT a,2 FROM t1 WHERE b = 2);
a
SELECT a FROM t1 WHERE (1,2) <> ALL (SELECT a FROM t1 WHERE b = 2);
ERROR 21000: Operand should contain 2 column(s)
SELECT a FROM t1 WHERE a <> ALL (SELECT a,2 FROM t1 WHERE b = 2);
ERROR 21000: Operand should contain 1 column(s)
SELECT a FROM t1 WHERE (1,2) <> ALL (SELECT a,2 FROM t1 WHERE b = 2);
a
1
2
3
SELECT a FROM t1 WHERE (a,1) = ANY (SELECT a,1 FROM t1 WHERE b = 2);
a
2
SELECT a FROM t1 WHERE (a,1) <> ALL (SELECT a,1 FROM t1 WHERE b = 2);
a
1
3
SELECT a FROM t1 WHERE (a,1) = ANY (SELECT a,1 FROM t1 HAVING a = 2);
a
2
SELECT a FROM t1 WHERE (a,1) <> ALL (SELECT a,1 FROM t1 HAVING a = 2);
a
1
3
SELECT a FROM t1 WHERE (a,1) = ANY (SELECT a,1 FROM t1 WHERE b = 2 UNION SELECT a,1 FROM t1 WHERE b = 2);
a
2
SELECT a FROM t1 WHERE (a,1) <> ALL (SELECT a,1 FROM t1 WHERE b = 2 UNION SELECT a,1 FROM t1 WHERE b = 2);
a
1
3
SELECT a FROM t1 WHERE (a,1) = ANY (SELECT a,1 FROM t1 HAVING a = 2 UNION SELECT a,1 FROM t1 HAVING a = 2);
a
2
SELECT a FROM t1 WHERE (a,1) <> ALL (SELECT a,1 FROM t1 HAVING a = 2 UNION SELECT a,1 FROM t1 HAVING a = 2);
a
1
3
SELECT a FROM t1 WHERE a > ANY (SELECT a FROM t1 WHERE b = 2 group by a);
a
3
SELECT a FROM t1 WHERE a < ANY (SELECT a FROM t1 WHERE b = 2 group by a);
a
1
SELECT a FROM t1 WHERE a = ANY (SELECT a FROM t1 WHERE b = 2 group by a);
a
2
SELECT a FROM t1 WHERE a >= ANY (SELECT a FROM t1 WHERE b = 2 group by a);
a
2
3
SELECT a FROM t1 WHERE a <= ANY (SELECT a FROM t1 WHERE b = 2 group by a);
a
1
2
SELECT a FROM t1 WHERE a <> ANY (SELECT a FROM t1 WHERE b = 2 group by a);
a
1
3
SELECT a FROM t1 WHERE a > ALL (SELECT a FROM t1 WHERE b = 2 group by a);
a
3
SELECT a FROM t1 WHERE a < ALL (SELECT a FROM t1 WHERE b = 2 group by a);
a
1
SELECT a FROM t1 WHERE a = ALL (SELECT a FROM t1 WHERE b = 2 group by a);
a
2
SELECT a FROM t1 WHERE a >= ALL (SELECT a FROM t1 WHERE b = 2 group by a);
a
2
3
SELECT a FROM t1 WHERE a <= ALL (SELECT a FROM t1 WHERE b = 2 group by a);
a
1
2
SELECT a FROM t1 WHERE a <> ALL (SELECT a FROM t1 WHERE b = 2 group by a);
a
1
3
SELECT a FROM t1 WHERE a > ANY (SELECT a FROM t1 group by a HAVING a = 2);
a
3
SELECT a FROM t1 WHERE a < ANY (SELECT a FROM t1 group by a HAVING a = 2);
a
1
SELECT a FROM t1 WHERE a = ANY (SELECT a FROM t1 group by a HAVING a = 2);
a
2
SELECT a FROM t1 WHERE a >= ANY (SELECT a FROM t1 group by a HAVING a = 2);
a
2
3
SELECT a FROM t1 WHERE a <= ANY (SELECT a FROM t1 group by a HAVING a = 2);
a
1
2
SELECT a FROM t1 WHERE a <> ANY (SELECT a FROM t1 group by a HAVING a = 2);
a
1
3
SELECT a FROM t1 WHERE a > ALL (SELECT a FROM t1 group by a HAVING a = 2);
a
3
SELECT a FROM t1 WHERE a < ALL (SELECT a FROM t1 group by a HAVING a = 2);
a
1
SELECT a FROM t1 WHERE a = ALL (SELECT a FROM t1 group by a HAVING a = 2);
a
2
SELECT a FROM t1 WHERE a >= ALL (SELECT a FROM t1 group by a HAVING a = 2);
a
2
3
SELECT a FROM t1 WHERE a <= ALL (SELECT a FROM t1 group by a HAVING a = 2);
a
1
2
SELECT a FROM t1 WHERE a <> ALL (SELECT a FROM t1 group by a HAVING a = 2);
a
1
3
SELECT concat(EXISTS(SELECT a FROM t1 WHERE b = 2 and a.a > t1.a), '-') from t1 a;
concat(EXISTS(SELECT a FROM t1 WHERE b = 2 and a.a > t1.a), '-')
0-
0-
1-
SELECT concat(EXISTS(SELECT a FROM t1 WHERE b = 2 and a.a < t1.a), '-') from t1 a;
concat(EXISTS(SELECT a FROM t1 WHERE b = 2 and a.a < t1.a), '-')
1-
0-
0-
SELECT concat(EXISTS(SELECT a FROM t1 WHERE b = 2 and a.a = t1.a), '-') from t1 a;
concat(EXISTS(SELECT a FROM t1 WHERE b = 2 and a.a = t1.a), '-')
0-
1-
0-
DROP TABLE t1;
CREATE TABLE t1 ( a double, b double );
INSERT INTO t1 VALUES (1,1),(2,2),(3,3);
SELECT a FROM t1 WHERE a > ANY (SELECT a FROM t1 WHERE b = 2e0);
a
3
SELECT a FROM t1 WHERE a < ANY (SELECT a FROM t1 WHERE b = 2e0);
a
1
SELECT a FROM t1 WHERE a = ANY (SELECT a FROM t1 WHERE b = 2e0);
a
2
SELECT a FROM t1 WHERE a >= ANY (SELECT a FROM t1 WHERE b = 2e0);
a
2
3
SELECT a FROM t1 WHERE a <= ANY (SELECT a FROM t1 WHERE b = 2e0);
a
1
2
SELECT a FROM t1 WHERE a <> ANY (SELECT a FROM t1 WHERE b = 2e0);
a
1
3
SELECT a FROM t1 WHERE a > ALL (SELECT a FROM t1 WHERE b = 2e0);
a
3
SELECT a FROM t1 WHERE a < ALL (SELECT a FROM t1 WHERE b = 2e0);
a
1
SELECT a FROM t1 WHERE a = ALL (SELECT a FROM t1 WHERE b = 2e0);
a
2
SELECT a FROM t1 WHERE a >= ALL (SELECT a FROM t1 WHERE b = 2e0);
a
2
3
SELECT a FROM t1 WHERE a <= ALL (SELECT a FROM t1 WHERE b = 2e0);
a
1
2
SELECT a FROM t1 WHERE a <> ALL (SELECT a FROM t1 WHERE b = 2e0);
a
1
3
DROP TABLE t1;
CREATE TABLE t1 ( a char(1), b char(1));
INSERT INTO t1 VALUES ('1','1'),('2','2'),('3','3');
SELECT a FROM t1 WHERE a > ANY (SELECT a FROM t1 WHERE b = '2');
a
3
SELECT a FROM t1 WHERE a < ANY (SELECT a FROM t1 WHERE b = '2');
a
1
SELECT a FROM t1 WHERE a = ANY (SELECT a FROM t1 WHERE b = '2');
a
2
SELECT a FROM t1 WHERE a >= ANY (SELECT a FROM t1 WHERE b = '2');
a
2
3
SELECT a FROM t1 WHERE a <= ANY (SELECT a FROM t1 WHERE b = '2');
a
1
2
SELECT a FROM t1 WHERE a <> ANY (SELECT a FROM t1 WHERE b = '2');
a
1
3
SELECT a FROM t1 WHERE a > ALL (SELECT a FROM t1 WHERE b = '2');
a
3
SELECT a FROM t1 WHERE a < ALL (SELECT a FROM t1 WHERE b = '2');
a
1
SELECT a FROM t1 WHERE a = ALL (SELECT a FROM t1 WHERE b = '2');
a
2
SELECT a FROM t1 WHERE a >= ALL (SELECT a FROM t1 WHERE b = '2');
a
2
3
SELECT a FROM t1 WHERE a <= ALL (SELECT a FROM t1 WHERE b = '2');
a
1
2
SELECT a FROM t1 WHERE a <> ALL (SELECT a FROM t1 WHERE b = '2');
a
1
3
DROP TABLE t1;
create table t1 (a int, b int);
insert into t1 values (1,2),(3,4);
select * from t1 up where exists (select * from t1 where t1.a=up.a);
a	b
1	2
3	4
EXPLAIN  select * from t1 up where exists (select * from t1 where t1.a=up.a);
Query Plan
===============================================
|ID|OPERATOR       |NAME|EST.ROWS|EST.TIME(us)|
-----------------------------------------------
|0 |TABLE FULL SCAN|up  |2       |3           |
===============================================
Outputs & filters:
-------------------------------------
  0 - output([up.a], [up.b]), filter([up.a IS NOT NULL]), rowset=16
      access([up.a], [up.b]), partitions(p0)
      is_index_back=false, is_global_index=false, filter_before_indexback[false], 
      range_key([up.__pk_increment]), range(MIN ; MAX)always true
drop table t1;
CREATE TABLE t1 (t1_a int);
INSERT INTO t1 VALUES (1);
CREATE TABLE t2 (t2_a int, t2_b int, PRIMARY KEY (t2_a, t2_b));
INSERT INTO t2 VALUES (1, 1), (1, 2);
SELECT * FROM t1, t2 table2 WHERE t1_a = 1 AND table2.t2_a = 1
HAVING table2.t2_b = (SELECT MAX(t2_b) FROM t2 WHERE t2_a = table2.t2_a);
t1_a	t2_a	t2_b
1	1	2
DROP TABLE t1, t2;
CREATE TABLE t1 (id int(11) default NULL,name varchar(10) default NULL);
INSERT INTO t1 VALUES (1,'Tim'),(2,'Rebecca'),(3,NULL);
CREATE TABLE t2 (id int(11) default NULL, pet varchar(10) default NULL);
INSERT INTO t2 VALUES (1,'Fido'),(2,'Spot'),(3,'Felix');
SELECT a.*, b.* FROM (SELECT * FROM t1) AS a JOIN t2 as b on a.id=b.id;
id	name	id	pet
1	Tim	1	Fido
2	Rebecca	2	Spot
3	NULL	3	Felix
drop table t1,t2;
CREATE TABLE `t1` ( `a` int(11) default NULL);
insert into t1 values (1);
CREATE TABLE `t2` ( `b` int(11) default NULL, `a` int(11) default NULL);
insert into t2 values (1,2);
select t000.a, count(*) `C` FROM t1 t000 GROUP BY t000.a HAVING count(*) > ALL (SELECT count(*) FROM t2 t001 WHERE t001.a=1);
a	C
1	1
drop table t1,t2;
CREATE TABLE t1(`IZAVORGANG_ID` VARCHAR(11),`KUERZEL` VARCHAR(10),`IZAANALYSEART_ID` VARCHAR(11),`IZAPMKZ_ID` VARCHAR(11), index AK01IZAVORGANG(izaAnalyseart_id,Kuerzel));
INSERT INTO t1(`IZAVORGANG_ID`,`KUERZEL`,`IZAANALYSEART_ID`,`IZAPMKZ_ID`)VALUES('D0000000001','601','D0000000001','I0000000001');
INSERT INTO t1(`IZAVORGANG_ID`,`KUERZEL`,`IZAANALYSEART_ID`,`IZAPMKZ_ID`)VALUES('D0000000002','602','D0000000001','I0000000001');
INSERT INTO t1(`IZAVORGANG_ID`,`KUERZEL`,`IZAANALYSEART_ID`,`IZAPMKZ_ID`)VALUES('D0000000003','603','D0000000001','I0000000001');
INSERT INTO t1(`IZAVORGANG_ID`,`KUERZEL`,`IZAANALYSEART_ID`,`IZAPMKZ_ID`)VALUES('D0000000004','101','D0000000001','I0000000001');
SELECT `IZAVORGANG_ID` FROM t1 WHERE `KUERZEL` IN(SELECT MIN(`KUERZEL`)`Feld1` FROM t1 WHERE `KUERZEL` LIKE'601%'And`IZAANALYSEART_ID`='D0000000001');
IZAVORGANG_ID
D0000000001
drop table t1;
CREATE TABLE t1 (howmanyvalues bigint, avalue int);
INSERT INTO t1 VALUES (1, 1),(2, 1),(2, 2),(3, 1),(3, 2),(3, 3),(4, 1),(4, 2),(4, 3),(4, 4);
SELECT howmanyvalues, count(*) from t1 group by howmanyvalues;
howmanyvalues	count(*)
1	1
2	2
3	3
4	4
SELECT a.howmanyvalues, (SELECT count(*) from t1 b where b.howmanyvalues = a.howmanyvalues) as mycount from t1 a group by a.howmanyvalues;
howmanyvalues	mycount
1	1
2	2
3	3
4	4
CREATE INDEX t1_howmanyvalues_idx ON t1 (howmanyvalues);
SELECT a.howmanyvalues, (SELECT count(*) from t1 b where b.howmanyvalues+1 = a.howmanyvalues+1) as mycount from t1 a group by a.howmanyvalues;
howmanyvalues	mycount
1	1
2	2
3	3
4	4
SELECT a.howmanyvalues, (SELECT count(*) from t1 b where b.howmanyvalues = a.howmanyvalues) as mycount from t1 a group by a.howmanyvalues;
howmanyvalues	mycount
1	1
2	2
3	3
4	4
SELECT a.howmanyvalues, (SELECT count(*) from t1 b where b.howmanyvalues = a.avalue) as mycount from t1 a group by a.howmanyvalues;
howmanyvalues	mycount
1	1
2	1
3	1
4	1
drop table t1;
create table t1 (x int);
select  (select b.x from t1 as b where b.x=a.x) from t1 as a where a.x=2 group by a.x;
(select b.x from t1 as b where b.x=a.x)
drop table t1;
CREATE TABLE `t1` ( `master` int(10) unsigned NOT NULL default '0', `map` smallint(6) unsigned NOT NULL default '0', `slave` int(10) unsigned NOT NULL default '0', `access` int(10) unsigned NOT NULL default '0', UNIQUE KEY `access_u` (`master`,`map`,`slave`));
INSERT INTO `t1` VALUES (1,0,0,700),(1,1,1,400),(1,5,5,400),(1,12,12,400),(1,12,32,400),(4,12,32,400);
CREATE TABLE `t2` ( `id` int(10) unsigned NOT NULL default '0', `pid` int(10) unsigned NOT NULL default '0', `map` smallint(6) unsigned NOT NULL default '0', `level` tinyint(4) unsigned NOT NULL default '0', `title` varchar(255) default NULL, PRIMARY KEY  (`id`,`pid`,`map`), KEY `level` (`level`), KEY `id` (`id`,`map`)) ;
INSERT INTO `t2` VALUES (6,5,12,7,'a'),(12,0,0,7,'a'),(12,1,0,7,'a'),(12,5,5,7,'a'),(12,5,12,7,'a');
SELECT b.sc FROM (SELECT (SELECT a.access FROM t1 a WHERE a.map = op.map AND a.slave = op.pid AND a.master = 1) ac FROM t2 op WHERE op.id = 12 AND op.map = 0) b;
ERROR 42S22: Unknown column 'b.sc' in 'field list'
SELECT b.ac FROM (SELECT (SELECT a.access FROM t1 a WHERE a.map = op.map AND a.slave = op.pid AND a.master = 1) ac FROM t2 op WHERE op.id = 12 AND op.map = 0) b;
ac
700
NULL
drop tables t1,t2;
create table t1 (a int, b int);
create table t2 (a int, b int);
insert into t1 values (1,1),(1,2),(1,3),(2,4),(2,5);
insert into t2 values (1,3),(2,1);
drop table t1, t2;
create table t1 (s1 int,s2 int);
insert into t1 values (20,15);
select * from t1 where  (('a',null) <=> (select 'a',s2 from t1 where s1 = 0));
s1	s2
drop table t1;
create table t1 (s1 int);
insert into t1 values (1),(null);
select * from t1 where s1 < all (select s1 from t1);
s1
select s1, s1 < all (select s1 from t1) from t1;
s1	s1 < all (select s1 from t1)
1	0
NULL	NULL
drop table t1;
create table t1 (a1 int);
create table t2 (b1 int);
select * from t1 where a2 > any(select b1 from t2);
ERROR 42S22: Unknown column 'a2' in 'where clause'
select * from t1 where a1 > any(select b1 from t2);
a1
drop table t1,t2;
create table t1 (a integer, b integer);
select (select * from t1) = (select 1,2);
(select * from t1) = (select 1,2)
NULL
select (select 1,2) = (select * from t1);
(select 1,2) = (select * from t1)
NULL
select  row(1,2) = ANY (select * from t1);
row(1,2) = ANY (select * from t1)
0
select  row(1,2) != ALL (select * from t1);
row(1,2) != ALL (select * from t1)
1
drop table t1;
create table t1 (a integer, b integer);
select row(1,(2,2)) in (select * from t1 );
ERROR 21000: Operand should contain 1 column(s)
select row(1,(2,2)) = (select * from t1 );
ERROR 21000: Operand should contain 1 column(s)
select (select * from t1) = row(1,(2,2));
ERROR 21000: Operand should contain 1 column(s)
drop table t1;
create  table t1 (a integer);
insert into t1 values (1);
select 1 = ALL (select 1 from t1 where 1 = xx ), 1 as xx;
ERROR 42S22: Unknown column 'xx' in 'where clause'
select 1 as xx, 1 = ALL (  select 1 from t1 where 1 = xx );
xx	1 = ALL (  select 1 from t1 where 1 = xx )
1	1
select 1 = ALL (select 1 from t1 where 1 = xx ), 1 as xx from DUAL;
ERROR 42S22: Unknown column 'xx' in 'where clause'
drop table t1;
CREATE TABLE t1 (
categoryId int(11) NOT NULL,
courseId int(11) NOT NULL,
startDate datetime NOT NULL,
endDate datetime NOT NULL,
createDate datetime NOT NULL,
modifyDate timestamp NOT NULL,
attributes varchar(30) NOT NULL
);
INSERT INTO t1 VALUES (1,41,'2004-02-09','2010-01-01','2004-02-09','2004-02-09',''),
(1,86,'2004-08-16','2004-08-16','2004-08-16','2004-08-16',''),
(1,87,'2004-08-16','2004-08-16','2004-08-16','2004-08-16',''),
(2,52,'2004-03-15','2004-10-01','2004-03-15','2004-09-17',''),
(2,53,'2004-03-16','2004-10-01','2004-03-16','2004-09-17',''),
(2,88,'2004-08-16','2004-08-16','2004-08-16','2004-08-16',''),
(2,89,'2004-08-16','2004-08-16','2004-08-16','2004-08-16',''),
(3,51,'2004-02-09','2010-01-01','2004-02-09','2004-02-09',''),
(5,12,'2004-02-18','2010-01-01','2004-02-18','2004-02-18','');
CREATE TABLE t2 (
userId int(11) NOT NULL,
courseId int(11) NOT NULL,
date datetime NOT NULL
);
INSERT INTO t2 VALUES (5141,71,'2003-11-18'),
(5141,72,'2003-11-25'),(5141,41,'2004-08-06'),
(5141,52,'2004-08-06'),(5141,53,'2004-08-06'),
(5141,12,'2004-08-06'),(5141,86,'2004-10-21'),
(5141,87,'2004-10-21'),(5141,88,'2004-10-21'),
(5141,89,'2004-10-22'),(5141,51,'2004-10-26');
CREATE TABLE t3 (
groupId int(11) NOT NULL,
parentId int(11) NOT NULL,
startDate datetime NOT NULL,
endDate datetime NOT NULL,
createDate datetime NOT NULL,
modifyDate timestamp NOT NULL,
ordering int(11)
);
INSERT INTO t3 VALUES (12,9,'1000-01-01','3999-12-31','2004-01-29','2004-01-29',NULL);
CREATE TABLE t4 (
id int(11) NOT NULL,
groupTypeId int(11) NOT NULL,
groupKey varchar(50) NOT NULL,
name varchar(50),
ordering int(11),
description varchar(50),
createDate datetime NOT NULL,
modifyDate timestamp NOT NULL
);
INSERT INTO t4 VALUES (9,5,'stationer','stationer',0,'Stationer','2004-01-29','2004-01-29'),
(12,5,'group2','group2',0,'group2','2004-01-29','2004-01-29');
CREATE TABLE t5 (
userId int(11) NOT NULL,
groupId int(11) NOT NULL,
createDate datetime NOT NULL,
modifyDate timestamp NOT NULL
);
INSERT INTO t5 VALUES (5141,12,'2004-08-06','2004-08-06');
select
count(distinct t2.userid) pass,
groupstuff.*,
count(t2.courseid) crse,
t1.categoryid,
t2.courseid,
date_format(date, '%b%y') as colhead
from t2
join t1 on t2.courseid=t1.courseid
join
(
select
t5.userid,
parentid,
parentgroup,
childid,
groupname,
grouptypeid
from t5
join
(
select t4.id as parentid,
t4.name as parentgroup,
t4.id as childid,
t4.name as groupname,
t4.grouptypeid
from t4
) as gin on t5.groupid=gin.childid
) as groupstuff on t2.userid = groupstuff.userid
group by
groupstuff.groupname, colhead , t2.courseid;
pass	userid	parentid	parentgroup	childid	groupname	grouptypeid	crse	categoryid	courseid	colhead
1	5141	12	group2	12	group2	5	1	1	41	Aug04
1	5141	12	group2	12	group2	5	1	1	86	Oct04
1	5141	12	group2	12	group2	5	1	1	87	Oct04
1	5141	12	group2	12	group2	5	1	2	52	Aug04
1	5141	12	group2	12	group2	5	1	2	53	Aug04
1	5141	12	group2	12	group2	5	1	2	88	Oct04
1	5141	12	group2	12	group2	5	1	2	89	Oct04
1	5141	12	group2	12	group2	5	1	3	51	Oct04
1	5141	12	group2	12	group2	5	1	5	12	Aug04
drop table t1, t2, t3, t4, t5;
create table t1 (a int);
insert into t1 values (1), (2), (3);
SELECT 1 FROM t1 WHERE (SELECT 1) in (SELECT 1);
1
1
1
1
drop table t1;
create table t1 (a int);
create table t2 (a int);
insert into t1 values (1),(2);
insert into t2 values (0),(1),(2),(3);
select a from t2 where a in (select a from t1);
a
1
2
select a from t2 having a in (select a from t1);
a
1
2
drop table t1, t2;
create table t1 (a int, b int);
insert into t1 values (1,2);
select 1 = (select * from t1);
ERROR 21000: Operand should contain 1 column(s)
select (select * from t1) = 1;
ERROR 21000: Operand should contain 2 column(s)
select (1,2) = (select a from t1);
ERROR 21000: Operand should contain 2 column(s)
select (select a from t1) = (1,2);
ERROR 21000: Operand should contain 1 column(s)
select (1,2,3) = (select * from t1);
ERROR 21000: Operand should contain 3 column(s)
select (select * from t1) = (1,2,3);
ERROR 21000: Operand should contain 2 column(s)
drop table t1;
CREATE TABLE t1 (a int);
CREATE TABLE t2 (a int, b int);
CREATE TABLE t3 (b int NOT NULL);
INSERT INTO t1 VALUES (1), (2), (3), (4);
INSERT INTO t2 VALUES (1,10), (3,30);
SELECT * FROM t2 LEFT JOIN t3 ON t2.b=t3.b
WHERE t3.b IS NOT NULL OR t2.a > 10;
a	b	b
SELECT * FROM t1
WHERE t1.a NOT IN (SELECT a FROM t2 LEFT JOIN t3 ON t2.b=t3.b
WHERE t3.b IS NOT NULL OR t2.a > 10);
a
1
2
3
4
DROP TABLE t1,t2,t3;
CREATE TABLE t1 (f1 INT);
CREATE TABLE t2 (f2 INT);
INSERT INTO t1 VALUES (1);
SELECT * FROM t1 WHERE f1 > ALL (SELECT f2 FROM t2);
f1
1
SELECT * FROM t1 WHERE f1 > ALL (SELECT f2 FROM t2 WHERE 1=0);
f1
1
INSERT INTO t2 VALUES (1);
INSERT INTO t2 VALUES (2);
SELECT * FROM t1 WHERE f1 > ALL (SELECT f2 FROM t2 WHERE f2=0);
f1
1
DROP TABLE t1, t2;
select 1 from dual where 1 < any (select 2);
1
1
select 1 from dual where 1 < all (select 2);
1
1
select 1 from dual where 2 > any (select 1);
1
1
select 1 from dual where 2 > all (select 1);
1
1
select 1 from dual where 1 < any (select 2 from dual);
1
1
select 1 from dual where 1 < all (select 2 from dual where 1!=1);
1
1
create table t1 (s1 char);
insert into t1 values (1),(2);
select * from t1 where (s1 < any (select s1 from t1));
s1
1
select * from t1 where not (s1 < any (select s1 from t1));
s1
2
select * from t1 where (s1 < ALL (select s1+1 from t1));
s1
1
select * from t1 where not(s1 < ALL (select s1+1 from t1));
s1
2
select * from t1 where (s1+1 = ANY (select s1 from t1));
s1
1
select * from t1 where NOT(s1+1 = ANY (select s1 from t1));
s1
2
select * from t1 where (s1 = ALL (select s1/s1 from t1));
s1
1
select * from t1 where NOT(s1 = ALL (select s1/s1 from t1));
s1
2
drop table t1;
create table t1 (
retailerID varchar(8) NOT NULL,
statusID   int(10) unsigned NOT NULL,
changed    datetime NOT NULL,
UNIQUE KEY retailerID (retailerID, statusID, changed)
);
INSERT INTO t1 VALUES("0026", "1", "2005-12-06 12:18:56");
INSERT INTO t1 VALUES("0026", "2", "2006-01-06 12:25:53");
INSERT INTO t1 VALUES("0037", "1", "2005-12-06 12:18:56");
INSERT INTO t1 VALUES("0037", "2", "2006-01-06 12:25:53");
INSERT INTO t1 VALUES("0048", "1", "2006-01-06 12:37:50");
INSERT INTO t1 VALUES("0059", "1", "2006-01-06 12:37:50");
select * from t1 r1
where (r1.retailerID,(r1.changed)) in
(SELECT r2.retailerId,(max(changed)) from t1 r2
group by r2.retailerId);
retailerID	statusID	changed
0026	2	2006-01-06 12:25:53
0037	2	2006-01-06 12:25:53
0048	1	2006-01-06 12:37:50
0059	1	2006-01-06 12:37:50
drop table t1;
create table t1(a int, primary key (a));
insert into t1 values (10);
create table t2 (a int primary key, b varchar(32), c int, unique key b(c, b));
insert into t2(a, c, b) values (1,10,'359'), (2,10,'35988'), (3,10,'35989');
EXPLAIN  SELECT t1.a, r.a, r.b FROM t1 LEFT JOIN t2 r ON r.a = (SELECT t2.a FROM t2 WHERE t2.c = t1.a AND t2.b <= '359899' ORDER BY t2.c DESC, t2.b DESC LIMIT 1) WHERE t1.a = 10;
Query Plan
================================================================
|ID|OPERATOR               |NAME         |EST.ROWS|EST.TIME(us)|
----------------------------------------------------------------
|0 |NESTED-LOOP OUTER JOIN |             |1       |26          |
|1 |├─TABLE GET            |t1           |1       |5           |
|2 |└─SUBPLAN FILTER       |             |1       |21          |
|3 |  ├─TABLE GET          |r            |1       |18          |
|4 |  └─TABLE RANGE SCAN   |t2(b,Reverse)|1       |3           |
================================================================
Outputs & filters:
-------------------------------------
  0 - output([t1.a], [r.a], [r.b]), filter(nil), rowset=16
      conds(nil), nl_params_([t1.a(:0)]), use_batch=false
  1 - output([t1.a]), filter(nil), rowset=16
      access([t1.a]), partitions(p0)
      is_index_back=false, is_global_index=false, 
      range_key([t1.a]), range[10 ; 10], 
      range_cond([t1.a = 10])
  2 - output([r.a], [r.b]), filter(nil), rowset=16
      exec_params_(nil), onetime_exprs_([subquery(1)(:1)]), init_plan_idxs_(nil), use_batch=false
  3 - output([r.a], [r.b]), filter(nil), rowset=16
      access([r.a], [r.b]), partitions(p0)
      is_index_back=false, is_global_index=false, 
      range_key([r.a]), range(MIN ; MAX), 
      range_cond([r.a = :1])
  4 - output([t2.a]), filter(nil), rowset=16
      access([t2.a]), partitions(p0)
      limit(1), offset(nil), is_index_back=false, is_global_index=false, 
      range_key([t2.c], [t2.b], [t2.shadow_pk_0]), range(MIN,MIN,MIN ; MAX,MAX,MAX)always true, 
      range_cond([t2.c = :0], [t2.b <= '359899'])
EXPLAIN  SELECT t1.a, r.a, r.b FROM t1 LEFT JOIN t2 r ON r.a = (SELECT t2.a FROM t2 WHERE t2.c = t1.a AND t2.b <= '359899' ORDER BY t2.c, t2.b LIMIT 1) WHERE t1.a = 10;
Query Plan
========================================================
|ID|OPERATOR               |NAME |EST.ROWS|EST.TIME(us)|
--------------------------------------------------------
|0 |NESTED-LOOP OUTER JOIN |     |1       |26          |
|1 |├─TABLE GET            |t1   |1       |5           |
|2 |└─SUBPLAN FILTER       |     |1       |21          |
|3 |  ├─TABLE GET          |r    |1       |18          |
|4 |  └─TABLE RANGE SCAN   |t2(b)|1       |3           |
========================================================
Outputs & filters:
-------------------------------------
  0 - output([t1.a], [r.a], [r.b]), filter(nil), rowset=16
      conds(nil), nl_params_([t1.a(:0)]), use_batch=false
  1 - output([t1.a]), filter(nil), rowset=16
      access([t1.a]), partitions(p0)
      is_index_back=false, is_global_index=false, 
      range_key([t1.a]), range[10 ; 10], 
      range_cond([t1.a = 10])
  2 - output([r.a], [r.b]), filter(nil), rowset=16
      exec_params_(nil), onetime_exprs_([subquery(1)(:1)]), init_plan_idxs_(nil), use_batch=false
  3 - output([r.a], [r.b]), filter(nil), rowset=16
      access([r.a], [r.b]), partitions(p0)
      is_index_back=false, is_global_index=false, 
      range_key([r.a]), range(MIN ; MAX), 
      range_cond([r.a = :1])
  4 - output([t2.a]), filter(nil), rowset=16
      access([t2.a]), partitions(p0)
      limit(1), offset(nil), is_index_back=false, is_global_index=false, 
      range_key([t2.c], [t2.b], [t2.shadow_pk_0]), range(MIN,MIN,MIN ; MAX,MAX,MAX)always true, 
      range_cond([t2.c = :0], [t2.b <= '359899'])
drop table t1,t2;
CREATE TABLE t1 (
field1 int NOT NULL,
field2 int NOT NULL,
field3 int NOT NULL,
PRIMARY KEY  (field1,field2,field3)
);
CREATE TABLE t2 (
fieldA int NOT NULL,
fieldB int NOT NULL,
PRIMARY KEY  (fieldA,fieldB)
);
INSERT INTO t1 VALUES
(1,1,1), (1,1,2), (1,2,1), (1,2,2), (1,2,3), (1,3,1);
INSERT INTO t2 VALUES (1,1), (1,2), (1,3);
SELECT field1, field2, COUNT(*)
FROM t1 GROUP BY field1, field2;
field1	field2	COUNT(*)
1	1	2
1	2	3
1	3	1
SELECT field1, field2
FROM  t1
GROUP BY field1, field2
HAVING COUNT(*) >= ALL (SELECT fieldB
FROM t2 WHERE fieldA = field1);
field1	field2
1	2
SELECT field1, field2
FROM  t1
GROUP BY field1, field2
HAVING COUNT(*) < ANY (SELECT fieldB
FROM t2 WHERE fieldA = field1);
field1	field2
1	1
1	3
DROP TABLE t1, t2;
CREATE TABLE t1(a int, INDEX (a));
INSERT INTO t1 VALUES (1), (3), (5), (7);
INSERT INTO t1 VALUES (NULL);
CREATE TABLE t2(a int);
INSERT INTO t2 VALUES (1),(2),(3);
EXPLAIN  SELECT a, a IN (SELECT a FROM t1) FROM t2;
Query Plan
=================================================
|ID|OPERATOR         |NAME|EST.ROWS|EST.TIME(us)|
-------------------------------------------------
|0 |SUBPLAN FILTER   |    |3       |5           |
|1 |├─TABLE FULL SCAN|t2  |3       |3           |
|2 |└─TABLE FULL SCAN|t1  |5       |3           |
=================================================
Outputs & filters:
-------------------------------------
  0 - output([t2.a], [t2.a = ANY(subquery(1))]), filter(nil), rowset=16
      exec_params_(nil), onetime_exprs_(nil), init_plan_idxs_([1]), use_batch=false
  1 - output([t2.a]), filter(nil), rowset=16
      access([t2.a]), partitions(p0)
      is_index_back=false, is_global_index=false, 
      range_key([t2.__pk_increment]), range(MIN ; MAX)always true
  2 - output([t1.a]), filter(nil), rowset=16
      access([t1.a]), partitions(p0)
      is_index_back=false, is_global_index=false, 
      range_key([t1.__pk_increment]), range(MIN ; MAX)always true
SELECT a, a IN (SELECT a FROM t1) FROM t2;
a	a IN (SELECT a FROM t1)
1	1
2	NULL
3	1
DROP TABLE t1,t2;
CREATE TABLE t1 (a int);
INSERT INTO t1 VALUES (1), (2);
SELECT a FROM t1 WHERE (SELECT 1 FROM DUAL WHERE 1=0) > 0;
a
SELECT a FROM t1 WHERE (SELECT 1 FROM DUAL WHERE 1=0) IS NULL;
a
1
2
EXPLAIN  SELECT a FROM t1 WHERE (SELECT 1 FROM DUAL WHERE 1=0) IS NULL;
Query Plan
===============================================
|ID|OPERATOR       |NAME|EST.ROWS|EST.TIME(us)|
-----------------------------------------------
|0 |TABLE FULL SCAN|t1  |2       |3           |
===============================================
Outputs & filters:
-------------------------------------
  0 - output([t1.a]), filter(nil), rowset=16
      access([t1.a]), partitions(p0)
      is_index_back=false, is_global_index=false, 
      range_key([t1.__pk_increment]), range(MIN ; MAX)always true
DROP TABLE t1;
CREATE TABLE t1 (a int);
INSERT INTO t1 VALUES (2), (4), (1), (3);
CREATE TABLE t2 (b int, c int);
INSERT INTO t2 VALUES
(2,1), (1,3), (2,1), (4,4), (2,2), (1,4);
SELECT a FROM t1 ORDER BY (SELECT c FROM t2 WHERE b > 2 );
a
2
4
1
3
SELECT a FROM t1 ORDER BY (SELECT c FROM t2 WHERE b > 1);
ERROR 21000: Subquery returns more than 1 row
SELECT a FROM t1 ORDER BY (SELECT c FROM t2 WHERE b > 2), a;
a
1
2
3
4
SELECT a FROM t1 ORDER BY (SELECT c FROM t2 WHERE b > 1), a;
ERROR 21000: Subquery returns more than 1 row
SELECT b, MAX(c) FROM t2 GROUP BY b, (SELECT c FROM t2 WHERE b > 2);
b	MAX(c)
1	4
2	2
4	4
SELECT b, MAX(c) FROM t2 GROUP BY b, (SELECT c FROM t2 WHERE b > 1);
ERROR 21000: Subquery returns more than 1 row
DROP TABLE t1,t2;
create table t1 (df decimal(5,1));
insert into t1 values(1.1);
insert into t1 values(2.2);
select * from t1 where df <= all (select avg(df) from t1 group by df);
df
1.1
select * from t1 where df >= all (select avg(df) from t1 group by df);
df
2.2
drop table t1;
create table t1 (df decimal(5,1));
insert into t1 values(1.1);
select 1.1 * exists(select * from t1);
1.1 * exists(select * from t1)
1.1
drop table t1;
CREATE TABLE t1 (
grp int(11) default NULL,
a decimal(10,2) default NULL);
insert into t1 values (1, 1), (2, 2), (2, 3), (3, 4), (3, 5), (3, 6), (NULL, NULL);
select * from t1;
grp	a
1	1.00
2	2.00
2	3.00
3	4.00
3	5.00
3	6.00
NULL	NULL
select min(a) from t1 group by grp;
min(a)
1.00
2.00
4.00
NULL
drop table t1;
CREATE table t1 ( c1 integer );
INSERT INTO t1 VALUES ( 1 );
INSERT INTO t1 VALUES ( 2 );
INSERT INTO t1 VALUES ( 3 );
CREATE TABLE t2 ( c2 integer );
INSERT INTO t2 VALUES ( 1 );
INSERT INTO t2 VALUES ( 4 );
INSERT INTO t2 VALUES ( 5 );
SELECT * FROM t1 LEFT JOIN t2 ON c1 = c2 WHERE c2 IN (1);
c1	c2
1	1
SELECT * FROM t1 LEFT JOIN t2 ON c1 = c2
WHERE c2 IN ( SELECT c2 FROM t2 WHERE c2 IN ( 1 ) );
c1	c2
1	1
DROP TABLE t1,t2;
CREATE TABLE t1 ( c1 integer );
INSERT INTO t1 VALUES ( 1 );
INSERT INTO t1 VALUES ( 2 );
INSERT INTO t1 VALUES ( 3 );
INSERT INTO t1 VALUES ( 6 );
CREATE TABLE t2 ( c2 integer );
INSERT INTO t2 VALUES ( 1 );
INSERT INTO t2 VALUES ( 4 );
INSERT INTO t2 VALUES ( 5 );
INSERT INTO t2 VALUES ( 6 );
CREATE TABLE t3 ( c3 integer );
INSERT INTO t3 VALUES ( 7 );
INSERT INTO t3 VALUES ( 8 );
SELECT c1,c2 FROM t1 LEFT JOIN t2 ON c1 = c2
WHERE EXISTS (SELECT c3 FROM t3 WHERE c2 IS NULL );
c1	c2
2	NULL
3	NULL
select 2 from dual where 1>(select 0) and 2>(select 1) and 3>(select 2) and 4>(select 3) and 5>(select 4) and 6>(select 5) and 7>(select 6) and 8>(select 7) and 9>(select 8) and 10>(select 9) and 11>(select 10);
2
2
DROP TABLE t1,t2,t3;
create table t1(c1 int, c2 int);
create table t2(c1 int, c2 int);
create table t3(c1 int, c2 int);
insert into t1 values (1,1), (1,1), (1,1), (1,1), (1,1), (1,1);
insert into t2 values (1,1), (1,1), (1,1), (1,1), (1,1), (1,1);
insert into t3 values (1,1), (1,1), (1,1), (1,1), (1,1), (1,1);
select /*+no_rewrite monitor*/* from t3 where exists (select /*+no_rewrite*/ * from t1 where t1.c2 = t3.c2 and  exists (select c1 from t2 where t2.c2 = t1.c2));
c1	c2
1	1
1	1
1	1
1	1
1	1
1	1
select last_trace_id() into @a from dual;
select op_id, op, rows, rescan  FROM(select plan_line_id op_id, PROCESS_NAME thread, concat(lpad('', plan_depth, ' '), plan_operation) op, output_rows rows, STARTS rescan, first_refresh_time open_time, last_refresh_time close_time, first_change_time first_row_time, last_change_time last_row_eof_time from oceanbase.gv$sql_plan_monitor where trace_id = @a order by plan_line_id, PROCESS_NAME ) a
where op != 'PHY_DIRECT_RECEIVE';
op_id	op	rows	rescan
0	PHY_VEC_SUBPLAN_FILTER	6	0
1	 PHY_VEC_TABLE_SCAN	6	0
2	 PHY_VEC_SUBPLAN_FILTER	6	12
3	  PHY_VEC_TABLE_SCAN	6	12
4	  PHY_VEC_TABLE_SCAN	6	24
DROP TABLE t1,t2,t3;
