drop database  IF EXISTS  ob100x;
Warnings:
Note	1008	Can't drop database 'ob100x'; database doesn't exist
create database ob100x  character set utf8;
use ob100x;
select database();
database()
ob100x
coalesce-1-1  0个参数
select coalesce()  FROM   dual;
ERROR 42000: Incorrect parameter count in the call to native function 'coalesce'
coalesce-2-1  1个参数       
SELECT   coalesce(500) FROM dual;
coalesce(500)
500
SELECT   coalesce('') FROM dual;
coalesce('')

SELECT   coalesce(null) FROM dual;
coalesce(null)
NULL
SELECT   coalesce('gkkk') FROM dual;
coalesce('gkkk')
gkkk
coalesce-1-3-1   参数类型不相同
select coalesce('HelloWorld',1) value from dual;
value
HelloWorld
coalesce-1-3-2   参数类型都是 字符 
select coalesce('HelloWorld','1') value from dual;
value
HelloWorld
coalesce-1-3-3   参数类型都是数字
select coalesce(1,2) value from dual;
value
1
select coalesce(-1,2) value from dual;
value
-1
select coalesce(1,-2) value from dual;
value
1
select coalesce(1.1,2.1) value from dual;
value
1.1
select coalesce(0,2.1) value from dual;
value
0.0
coalesce-1-3-4  参数类型都是空
select coalesce(' ','') value from dual;
value
 
coalesce-1-3-5 参数类型都是null
select coalesce(NULL,null) value from dual;
value
NULL
coalesce-1-3-6  参数类型一个字符一个null
select coalesce('HelloWorld',null) value from dual;
value
HelloWorld
coalesce-1-3-7  参数类型一个数字一个null
select coalesce(100,null) value from dual;
value
100
coalesce-1-3-8 参数类型都是日期
select coalesce(null,date_format('2008-08-08 22:23:01', '%Y%m%d%H%i%s'))from dual;
coalesce(null,date_format('2008-08-08 22:23:01', '%Y%m%d%H%i%s'))
20080808222301
select coalesce(date_format('2008-08-08 22:23:01', '%Y%m%d%H%i%s'),date_format('2008-08-08 22:23:01', '%Y%m%d%H%i%s'))from dual;
coalesce(date_format('2008-08-08 22:23:01', '%Y%m%d%H%i%s'),date_format('2008-08-08 22:23:01', '%Y%m%d%H%i%s'))
20080808222301
select coalesce('',date_format('2008-08-08 22:23:01', '%Y%m%d%H%i%s'))from dual;
coalesce('',date_format('2008-08-08 22:23:01', '%Y%m%d%H%i%s'))

coalesce-1-3-9  参数类型一个数字一个null
select coalesce(100,' ') value from dual;
value
100
select coalesce(' ',100) value from dual;
value
 
coalesce-1-3-10  参数类型一个字符一个null
select coalesce('hello',' ') value from dual;
value
hello
select coalesce(' ','hello',' ') value from dual;
value
 
coalesce-1-4-1  普通的三个参数
select coalesce('HelloWorld','1','2') value from dual;
value
HelloWorld
select coalesce(1,2,3) value from dual;
value
1
select coalesce('','','  ') value from dual;
value

select coalesce(null,null,null) value from dual;
value
NULL
coalesce-1-4-2  字符和空                
select coalesce('HelloWorld',' ','2') value from dual;
value
HelloWorld
select coalesce(' ','HelloWorld',' ','2') value from dual;
value
 
select coalesce(' ','HelloWorld',' ',' ') value from dual;
value
 
coalesce-1-4-3    字符和数字
select coalesce(3,1,' ') value from dual;
value
3
select coalesce(3,'',6) value from dual;
value
3
coalesce-1-4-4  数字和null       
select coalesce(3,1,null) value from dual;
value
3
select coalesce(null,1,null) value from dual;
value
1
coalesce-1-4-5  字符和null        
select coalesce(NULL,'hello',null) value from dual;
value
hello
coalesce-1-4-6  空和null        
select coalesce(NULL,NULL,NULL,NULL,NULL,NULL,NULL,NULL,NULL,NULL,NULL,NULL,NULL,NULL,NULL,'') value from dual;
value

select coalesce('  ','  ','  ','  ','  ','  ','  ','  ','  ','  ','  ','  ','  ','  ','  ','  ','  ','  ','  ','  ','  ','  ','  ','  ','  ','  ','  ','  ','  ','  ','  ','  ','  ','  ','  ','  ','  ','  ','  ',null) value from dual;
value
  
coalesce-1-4-7 null和日期     
select coalesce(date_format('2004-05-07 13:23:44','yyyy-mm-dd hh24:mi:ss'),NULL,date_format('2006-05-07 13:23:44','yyyy-mm-dd hh24:mi:ss'),date_format('2006-05-07 13:23:44','yyyy-mm-dd hh24:mi:ss'),date_format('2006-05-07 13:23:44','yyyy-mm-dd hh24:mi:ss'),null)from dual;
coalesce(date_format('2004-05-07 13:23:44','yyyy-mm-dd hh24:mi:ss'),NULL,date_format('2006-05-07 13:23:44','yyyy-mm-dd hh24:mi:ss'),date_format('2006-05-07 13:23:44','yyyy-mm-dd hh24:mi:ss'),date_format('2006-05-07 13:23:44','yyyy-mm-dd hh24:mi:ss'),null)
yyyy-mm-dd hh24:mi:ss
coalesce-1-4-8  空和日期        
select coalesce('',date_format('2004-05-07 13:23:44','yyyy-mm-dd hh24:mi:ss'),date_format('2006-05-07 13:23:44','yyyy-mm-dd hh24:mi:ss'),date_format('2006-05-07 13:23:44','yyyy-mm-dd hh24:mi:ss'),date_format('2006-05-07 13:23:44','yyyy-mm-dd hh24:mi:ss'),'')from dual;
coalesce('',date_format('2004-05-07 13:23:44','yyyy-mm-dd hh24:mi:ss'),date_format('2006-05-07 13:23:44','yyyy-mm-dd hh24:mi:ss'),date_format('2006-05-07 13:23:44','yyyy-mm-dd hh24:mi:ss'),date_format('2006-05-07 13:23:44','yyyy-mm-dd hh24:mi:ss'),'')

coalesce-1-4-9    其他              
drop   table  if  exists   emp;
create   TABLE   EMP (empno int,ename VARCHAR(10),job VARCHAR(9),mgr int,hiredate DATE,
sal FLOAT(7,0),comm FLOAT(7,0),deptno binary,tno BLOB);
insert into EMP (empno )values (7369 );
insert into EMP (ename)values ( 'SMITH002');
insert into EMP (job)values ('CLERK003');
insert into EMP (mgr)values (7902);
insert into EMP (hiredate)values ('7980-12-07');
insert into EMP (sal)values (300);
insert into EMP (comm)values (65);
insert into EMP (deptno)values (2);
insert into EMP (tno)values (90);
SELECT coalesce(empno,e.ename,job,mgr,hiredate,sal,comm,deptno,tno)   eee FROM EMP e   ORDER  BY   eee  desc;
eee
SMITH002
CLERK003
90
7980-12-07
7902
7369
65
300
2
coalesce-1-5    最大参数个数测试
drop   table  if  exists   emp;
create   TABLE   EMP (empno int,ename VARCHAR(10),job VARCHAR(9),mgr int,hiredate DATE,
sal FLOAT(7,0),comm FLOAT(7,0),deptno int,tno int);
insert into EMP (empno, ename, job, mgr, hiredate, sal, comm, deptno,tno)values (7369, 'SMITH001', 'CLERK001', 7902, '7980-12-07',  800, null, 20,1);
insert into EMP (empno, ename, job, mgr, hiredate, sal, comm, deptno,tno)values (7370, 'SMITH002', 'CLERK002', 7902, '7980-12-07',  900, 15, 10,2);
insert into EMP (empno, ename, job, mgr, hiredate, sal, comm, deptno,tno)values (7371, 'SMITH003', 'CLERK003', 7902, '7980-12-07',  250, 25, 50,3);
insert into EMP (empno, ename, job, mgr, hiredate, sal, comm, deptno,tno)values (7372, 'SMITH004', 'CLERK004', 7902, '7980-12-07',  100, 35, 30,4);
insert into EMP (empno, ename, job, mgr, hiredate, sal, comm, deptno,tno)values (7373, 'SMITH005', 'CLERK005', 7902, '7980-12-07',  200, 45, 80,5);
insert into EMP (empno, ename, job, mgr, hiredate, sal, comm, deptno,tno)values (7374, 'SMITH006', 'CLERK002', 7902, '7980-12-07',  300, 55, 10,6);
insert into EMP (empno, ename, job, mgr, hiredate, sal, comm, deptno,tno)values (7375, 'SMITH007', 'CLERK003', 7902, '7980-12-07',  400, 65, 20,7);
insert into EMP (empno, ename, job, mgr, hiredate, sal, comm, deptno,tno)values (7376, 'SMITH008', 'CLERK006', 7902, '7980-12-07',  500, null, 20,8);
insert into EMP (empno, ename, job, mgr, hiredate, sal, comm, deptno,tno)values (7377, 'SMITH009', 'CLERK008', 7902, '7980-12-07',  600, 75, 30,9);
insert into EMP (empno, ename, job, mgr, hiredate, sal, comm, deptno,tno)values (7378, 'SMITH010', 'CLERK009', 7902, '7980-12-07',  800, 95, 20,10);
insert into EMP (empno, ename, job, mgr, hiredate, sal, comm, deptno,tno)values (7379, 'SMITH011', 'CLERK003', 7902, '7980-12-07',  700, null, 20,11);
SELECT COALESCE(comm, null, NULL, NULL, NULL, NULL, NULL, NULL, NULL, null, NULL, NULL, NULL, NULL, NULL, NULL, NULL, null, NULL, NULL, NULL, NULL, NULL, NULL, NULL, null, NULL, NULL, NULL, NULL, NULL, NULL, NULL, null, NULL, NULL, NULL, NULL, NULL, NULL, NULL, null
, NULL, NULL, NULL, NULL, NULL, NULL, NULL, null, NULL, NULL, NULL, NULL, NULL, NULL, NULL, null, NULL, NULL, NULL, NULL, NULL, NULL, NULL, null, NULL, NULL, NULL, NULL, NULL, NULL, NULL, null, NULL, NULL, NULL, NULL, NULL, NULL, NULL, null
, NULL, NULL, NULL, NULL, NULL, NULL, NULL, null, NULL, NULL, NULL, NULL, NULL, NULL, NULL, null, NULL, NULL, NULL, NULL, NULL, NULL, NULL, null, NULL, NULL, NULL, NULL, NULL, NULL, NULL, null, NULL, NULL, NULL, NULL, NULL, NULL, NULL, null
, NULL, NULL, NULL, NULL, NULL, NULL, NULL, null, NULL, NULL, NULL, NULL, NULL, NULL, NULL, null, NULL, NULL, NULL, NULL, NULL, NULL, NULL,  null, NULL, NULL, NULL, NULL, NULL, NULL, NULL, null, NULL, NULL, NULL, NULL, NULL, NULL, NULL, null
, NULL, NULL, NULL, NULL, NULL, NULL, NULL, null, NULL, NULL, NULL, NULL, NULL, NULL, NULL, null, NULL, NULL, NULL, NULL, NULL, NULL, NULL, null, NULL, NULL, NULL, NULL, NULL, NULL, NULL, null, NULL, NULL, NULL, NULL, NULL, NULL, NULL, null
, NULL, NULL, NULL, NULL, NULL, NULL, NULL, null, NULL, NULL, NULL, NULL, NULL, NULL, NULL, null, NULL, NULL, NULL, NULL, NULL, NULL, NULL,  null, NULL, NULL, NULL, NULL, NULL, NULL, NULL, null, NULL, NULL, NULL, NULL, NULL, NULL, NULL, null
, NULL, NULL, NULL, NULL, NULL, NULL, NULL, null, NULL, NULL, NULL, NULL, NULL, NULL, NULL, null, NULL, NULL, NULL, NULL, NULL, NULL, NULL, null, NULL, NULL, NULL, NULL, NULL, NULL, NULL, null, NULL, NULL, NULL, NULL, NULL, NULL, NULL, null
, NULL, NULL, NULL, NULL, NULL, NULL, NULL, null, NULL, NULL, NULL, NULL, NULL, NULL, NULL, null, NULL, NULL, NULL, NULL, NULL, NULL, NULL, null, NULL, NULL, NULL, NULL, NULL, NULL, NULL, null, NULL, NULL, NULL, NULL, NULL, NULL, NULL, null
, NULL, NULL, NULL, NULL, NULL, NULL, NULL, null, NULL, NULL, NULL, NULL, NULL, NULL, NULL, null, NULL, NULL, NULL, NULL, NULL, NULL, NULL, null, NULL, NULL, NULL, NULL, NULL, NULL, NULL, null, NULL, NULL, NULL, NULL, NULL, NULL, NULL, null
, NULL, NULL, NULL, NULL, NULL, NULL, NULL, null, NULL, NULL, NULL, NULL, NULL, NULL, NULL, null, NULL, NULL, NULL, NULL, NULL, NULL, NULL, null, NULL, NULL, NULL, NULL, NULL, NULL, NULL, null, NULL, NULL, NULL, NULL, NULL, NULL, NULL, sal)
eee  FROM  emp  ORDER BY eee;
eee
15
25
35
45
55
65
75
95
500
700
800
SELECT COALESCE(job, '', '', '', '', '', '', '', '', '', '', '', '', '', '', '', '', '','','','','', '', '', '', '', '', '', '', '', '', '', '', '', '', '', ''
, '', '', '', '', '', '', '', '', '', '', '', '', '', '', '', '', '', '', '', '', '', '', '',  '', '', '', '', '', '', '', '', '', '', '', '', '', '', '', '', ''
, '', '', '', '', '', '', '', '', '', '', '', '', '', '', '', '', '', '', '', '', '', '', '', '', '', '', '', '', '', '', '', '', '', '', '', '', '', '', '', ''
, '', '', '', '', '', '', '', '', '', '', '', '', '', '', '', '', '', '', '', '', '', '', '',  '', '', '', '', '', '', '', '', '', '', '', '', '', '', '', '', ''
, '', '', '', '', '', '', '', '', '', '', '', '', '', '', '', '', '', '', '', '', '', '', '',  '', '', '', '', '', '', '', '', '', '', '', '', '', '', '', '', ''
, '', '', '', '', '', '', '', '', '', '', '', '', '', '', '', '', '', '', '', '', '', '', '', '', '', '', '', '', '', '', '', '', '', '', '', '', '', '', '', ''
, '', '', '', '', '', '', '', '', '', '', '', '', '', '', '', '', '', '', '', '', '', '', '',  '', '', '', '', '', '', '', '', '', '', '', '', '', '', '', '', ''
, '', '', '', '', '', '', '', '', '', '', '', '', '', '', '', '', '', '', '', '', '', '', '',  '', '', '', '', '', '', '', '', '', '', '', '', '', '', '', '', ''
, '', '', '', '', '', '', '', '', '', '', '', '', '', '', '', '', '', '', '', '', '', '', '', '', '', '', '', '', '', '', '', '', '', '', '', '', '', '', '', ''
, '', '', '', '', '', '', '', '', '', '', '', '', '', '', '', '', '', '', '', '', '', '', '', '', '', '', '', '', '', '', '', '', '', '', '', '', '', '', '', ''
, '', '', '', '', '', '', '', '', '', '', '', '', '', '', '', '', '', '', '', '', '', '', '',  '', '', '', '', '', '', '', '', '', '', '', '', '', '', '', '', ''
, '', '', '', '', '', '', '', '', '', '', '', '', '', '', '', '', '', ''
, '', '', '', '', '', '', '', '', '', '', '', '', '', '', '', '', '', '', '', '', '', '', '', '', '', '', '', '', '', '', '', '', '', '', '', '', '', '', '', ''
, '', '', '', '', '', '', '', '', '', '', '', '', '', '', '', '', '', '', '', '', '', '', '', '', '', '', '', '', '', '', '', '', '', '', '', '', '', '', '', ''
, '', '', '', '', '', '', '', '', '', '', '', '', '', '', '', '', '', '', '', '', '', '', '', '', '', '', '', '', '', '', '', '', '', '', '', '', '', '', '', ename)
eee  FROM  emp  ORDER  BY  eee;
eee
CLERK001
CLERK002
CLERK002
CLERK003
CLERK003
CLERK003
CLERK004
CLERK005
CLERK006
CLERK008
CLERK009
coalesce-2-1-1    char               
drop   table  if  exists   emp;
create table EMP(a char(20),b char(20),c char(20));
insert into EMP values('helloworld','2','');
select coalesce(a,b,c) from EMP;
coalesce(a,b,c)
helloworld
coalesce-2-1-2   varchar    
drop   table  if  exists   emp;
create table EMP(a VARCHAR(20),b VARCHAR(20),c VARCHAR(20));
insert into EMP values('helloworld','null','');
select coalesce(a,b,c) from EMP;
coalesce(a,b,c)
helloworld
coalesce-2-1-3   TEXT               
drop   table  if  exists   emp;
create table EMP(a  TEXT,b  TEXT,c  TEXT);
insert into EMP values('helloworld','null','   ');
select coalesce(a,b,c) from EMP;
coalesce(a,b,c)
helloworld
coalesce-2-1-4   BLOB
drop   table  if  exists   emp;
create table EMP(a BLOB(20),b BLOB(20),c BLOB(20));
insert into EMP values('helloworld',null,null);
select coalesce(a,b,c) from EMP;
coalesce(a,b,c)
helloworld
coalesce-2-2-1    int    
drop   table  if  exists   emp;
create table EMP(a  INT,b  INT,c  INT);
insert into EMP values('10000',2,3);
select coalesce(null,a,2,2,c,b) from EMP;
coalesce(null,a,2,2,c,b)
10000
coalesce-2-2-2    float        
drop   table  if  exists   emp;
create table EMP(a FLOAT,b FLOAT,c FLOAT);
insert into EMP values('10000',2.1,3.1);
select coalesce(null,a,2,2,c,b) from EMP;
coalesce(null,a,2,2,c,b)
10000
coalesce-2-2-3    DOUBLE
drop   table  if  exists   emp;
create table EMP(a  DOUBLE,b  DOUBLE,c  DOUBLE);
insert into EMP values('10000',2.1,3.1);
select coalesce(null,a,2,2,c,b) from EMP;
coalesce(null,a,2,2,c,b)
10000
coalesce-2-2-4    BOOL
drop   table  if  exists   emp;
create table EMP(a BOOL,b BOOL,c BOOL);
insert into EMP values('100',1,2);
select coalesce(null,a,2,2,c,b) from EMP;
coalesce(null,a,2,2,c,b)
100
coalesce-2-2-5    DECIMAL
drop   table  if  exists   emp;
create table EMP(a DECIMAL,b DECIMAL,c DECIMAL);
insert into EMP values('100',1,2);
select coalesce(null,a,2,2,c,b) from EMP;
coalesce(null,a,2,2,c,b)
100
coalesce-2-3-1   LONGTEXT             
drop   table  if  exists   emp;
create table EMP(a longtext,b longtext,c LONGTEXT);
insert into EMP values('10000',5,9);
select coalesce(null,a,2,2,c,b) from EMP;
coalesce(null,a,2,2,c,b)
10000
coalesce-2-3-2  BINARY
drop   table  if  exists   emp;
create table EMP(a binary,b binary,c BINARY);
insert into EMP values('0',1,6);
select coalesce(null,a,2,2,c,b) from EMP;
coalesce(null,a,2,2,c,b)
0
coalesce-2-3-3   blob        
drop   table  if  exists   emp;
create table EMP(a BLOB,b BLOB,c BLOB);
insert into EMP values('0',1,6);
select coalesce(null,a,2,2,c,b) from EMP;
coalesce(null,a,2,2,c,b)
0
drop   table  if  exists   emp;
create   TABLE   EMP (empno int,ename VARCHAR(10),job VARCHAR(9),mgr int,hiredate DATE,
sal FLOAT(7,0),comm FLOAT(7,0),deptno int,tno int);
insert into EMP (empno, ename, job, mgr, hiredate, sal, comm, deptno,tno)values (7369, 'SMITH001', ' ', 7902, '7980-12-07',  800, null, 20,1);
insert into EMP (empno, ename, job, mgr, hiredate, sal, comm, deptno,tno)values (7370, 'SMITH002', 'CLERK002', 7902, '7980-12-07',  900, 15, 10,2);
insert into EMP (empno, ename, job, mgr, hiredate, sal, comm, deptno,tno)values (7371, 'SMITH003', 'CLERK003', 7902, '7980-12-07',  250, 25, 50,3);
insert into EMP (empno, ename, job, mgr, hiredate, sal, comm, deptno,tno)values (7372, 'SMITH004', 'CLERK004', 7902, '7980-12-07',  100, 35, 30,4);
insert into EMP (empno, ename, job, mgr, hiredate, sal, comm, deptno,tno)values (7373, 'SMITH005', 'CLERK005', 7902, '7980-12-07',  200, 45, 80,5);
insert into EMP (empno, ename, job, mgr, hiredate, sal, comm, deptno,tno)values (7374, 'SMITH006', 'CLERK002', 7902, '7980-12-07',  300, 55, 10,6);
insert into EMP (empno, ename, job, mgr, hiredate, sal, comm, deptno,tno)values (7375, 'SMITH007', 'CLERK003', 7902, '7980-12-07',  400, 65, 20,7);
insert into EMP (empno, ename, job, mgr, hiredate, sal, comm, deptno,tno)values (7376, 'SMITH008', 'CLERK006', 7902, '7980-12-07',  500, null, 20,8);
insert into EMP (empno, ename, job, mgr, hiredate, sal, comm, deptno,tno)values (7377, 'SMITH009', 'CLERK008', 7902, '7980-12-07',  600, 75, 30,9);
insert into EMP (empno, ename, job, mgr, hiredate, sal, comm, deptno,tno)values (7378, 'SMITH010', 'CLERK009', 7902, '7980-12-07',  800, 95, 20,10);
insert into EMP (empno, ename, job, mgr, hiredate, sal, comm, deptno,tno)values (7379, 'SMITH011', null, 7902, '7980-12-07',  700, null, 20,11);
coalesce-3-1-1-1  select   
SELECT coalesce(e.job, e.ename)   eee FROM EMP e   ORDER  BY   eee  desc;
eee
SMITH011
CLERK009
CLERK008
CLERK006
CLERK005
CLERK004
CLERK003
CLERK003
CLERK002
CLERK002
 
coalesce-3-1-1-2  select嵌套 
SELECT coalesce(coalesce(coalesce(coalesce(coalesce(coalesce(coalesce(coalesce(coalesce(coalesce(
coalesce(coalesce(coalesce(100,e.ename,10,coalesce(e.ename, 'M'))))))))))))))   eee FROM EMP e   ORDER  BY   eee  desc;
eee
100
100
100
100
100
100
100
100
100
100
100
coalesce-3-1-1-3    some,any,all
SELECT   sum(length(coalesce(e.ename,coalesce(e.ename, 'M'))))   eee FROM EMP e   ORDER  BY   eee  desc;
eee
88
SELECT   min(length(coalesce(e.ename,coalesce(e.ename, 'M'))))   eee FROM EMP e   ORDER  BY   eee  desc;
eee
8
SELECT   max(length(coalesce(e.ename,coalesce(e.ename, 'M'))))   eee FROM EMP e   ORDER  BY   eee  desc;
eee
8
SELECT   avg(length(coalesce(e.ename,coalesce(e.ename, 'M'))))   eee FROM EMP e   ORDER  BY   eee  desc;
eee
8.0000
coalesce-3-1-1-4    create as        
drop   table  if  exists   EMP001;
DROP VIEW  if  exists   EMP001;
create TABLE    EMP001   as  SELECT length(coalesce(e.ename,coalesce(e.ename, 'M')))   eee FROM EMP e   ORDER  BY   eee  desc;
select  *    FROM    EMP001   ORDER BY  eee;
eee
8
8
8
8
8
8
8
8
8
8
8
coalesce-3-1-2   where  语句    
select      length(coalesce(e.ename,coalesce(e.ename, 'M')))   eee   from    emp e  WHERE  e.sal > 2000    ORDER  BY   eee;
eee
coalesce-3-1-3     order by 子句
select       length(coalesce(e.ename,coalesce(e.ename, 'M')))  eee   from    emp e  WHERE  e.sal > 2000  OR   e.sal <1000     ORDER  BY   eee;
eee
8
8
8
8
8
8
8
8
8
8
8
coalesce-3-1-4     group by   子句
select       length(coalesce(e.ename,coalesce(e.ename, 'M')))   eee    from    emp e    GROUP  BY   e.ename   ORDER BY eee;
eee
8
8
8
8
8
8
8
8
8
8
8
coalesce-3-1-5     group by  having   子句
select       length(coalesce(e.ename,coalesce(e.ename, 'M')))    eee    from    emp e    GROUP  BY   e.ename   HAVING   coalesce(e.ename, 'S')>0   ORDER BY eee;
eee
coalesce-3-2-1   根据字段插入
insert into EMP (empno, ename, job, mgr, hiredate, sal, comm, deptno,tno)values (9000, concat(1,coalesce('World',0,2)), 'CLERK003', 7902, '7980-12-07',  700, null, length(coalesce('helloworld','l')),11);
insert into EMP (empno, ename, job, mgr, hiredate, sal, comm, deptno,tno)values (9000, concat(1,coalesce('World',1,2)), 'CLERK003', 7902, '7980-12-07',  700, null, length(coalesce('helloworld','l')),11);
select  *    FROM    EMP    e   WHERE   e.EMPNO=9000;
empno	ename	job	mgr	hiredate	sal	comm	deptno	tno
9000	1World	CLERK003	7902	7980-12-07	700	NULL	10	11
9000	1World	CLERK003	7902	7980-12-07	700	NULL	10	11
coalesce-3-2-2    根据表插入
insert into EMP (empno, ename, job, mgr, hiredate, sal, comm, deptno,tno)values (8000, concat('9',coalesce('World',1,3)), 'CLERK003', 7902, '7980-12-07',  700, null, coalesce(999,coalesce('helloworld','l')),11);
select  *    FROM    EMP    e   WHERE   e.EMPNO=8000;
empno	ename	job	mgr	hiredate	sal	comm	deptno	tno
8000	9World	CLERK003	7902	7980-12-07	700	NULL	999	11
coalesce-3-2-3    插入语句中使用嵌套
insert into EMP (empno, ename, job, mgr, hiredate, sal, comm, deptno,tno)values (7000, concat('SMITH',coalesce('World',1,4)), 'CLERK003', 7902, '7980-12-07',  700, null, coalesce(' 99',null,coalesce('helloworld','l')),11);
select  *    FROM    EMP    e   WHERE   e.EMPNO=7000;
empno	ename	job	mgr	hiredate	sal	comm	deptno	tno
7000	SMITHWorld	CLERK003	7902	7980-12-07	700	NULL	99	11
coalesce-3-3-1   单列              
UPDATE    EMP  e  SET    e.DEPTNO = length(concat('SMITH',coalesce('HelloWorld',1,4)))  WHERE   e.EMPNO = 7369;
select  *    FROM    EMP    e   WHERE   e.EMPNO=7369;
empno	ename	job	mgr	hiredate	sal	comm	deptno	tno
7369	SMITH001	 	7902	7980-12-07	800	NULL	15	1
coalesce-3-3-2  多列      
UPDATE    EMP  e  SET    e.DEPTNO =length(concat('SMITH',coalesce('HelloWorld',1,4)));
select  *    FROM    EMP    e   ORDER  BY e.EMPNO,e.TNO;
empno	ename	job	mgr	hiredate	sal	comm	deptno	tno
7000	SMITHWorld	CLERK003	7902	7980-12-07	700	NULL	15	11
7369	SMITH001	 	7902	7980-12-07	800	NULL	15	1
7370	SMITH002	CLERK002	7902	7980-12-07	900	15	15	2
7371	SMITH003	CLERK003	7902	7980-12-07	250	25	15	3
7372	SMITH004	CLERK004	7902	7980-12-07	100	35	15	4
7373	SMITH005	CLERK005	7902	7980-12-07	200	45	15	5
7374	SMITH006	CLERK002	7902	7980-12-07	300	55	15	6
7375	SMITH007	CLERK003	7902	7980-12-07	400	65	15	7
7376	SMITH008	CLERK006	7902	7980-12-07	500	NULL	15	8
7377	SMITH009	CLERK008	7902	7980-12-07	600	75	15	9
7378	SMITH010	CLERK009	7902	7980-12-07	800	95	15	10
7379	SMITH011	NULL	7902	7980-12-07	700	NULL	15	11
8000	9World	CLERK003	7902	7980-12-07	700	NULL	15	11
9000	1World	CLERK003	7902	7980-12-07	700	NULL	15	11
9000	1World	CLERK003	7902	7980-12-07	700	NULL	15	11
coalesce-3-4-1   单列              
DELETE  FROM     EMP      WHERE   EMPNO = 7369  and  DEPTNO = length(concat('SMITH',coalesce('HelloWorld',1,4)));
select  *    FROM    EMP       WHERE   EMPNO=7369;
empno	ename	job	mgr	hiredate	sal	comm	deptno	tno
coalesce-3-4-2  多列      
DELETE  FROM     EMP      WHERE    DEPTNO = length(concat('SMITH',coalesce('HelloWorld',1,4)));
select      count(*)     FROM    EMP;
count(*)
0
coalesce-3-5    多列
with e as (SELECT   length(concat('SMITH',coalesce('HelloWorld',1,4)))  from    emp e)  select * from e;
length(concat('SMITH',coalesce('HelloWorld',1,4)))
insert into EMP (empno, ename, job, mgr, hiredate, sal, comm, deptno,tno)values (8000, 'SMITH011', 'CLERK003', 7902, '7980-12-07',  700, null, coalesce(18,'helloworld','l'),11);
insert into EMP (empno, ename, job, mgr, hiredate, sal, comm, deptno,tno)values (8000, 'SMITH011', 'CLERK003', 7902, '7980-12-07',  700, null, coalesce(19,'helloworld','l'),11);
insert into EMP (empno, ename, job, mgr, hiredate, sal, comm, deptno,tno)values (8000, 'SMITH011', 'CLERK003', 7902, '7980-12-07',  700, null, coalesce(20,'helloworld','l'),11);
insert into EMP (empno, ename, job, mgr, hiredate, sal, comm, deptno,tno)values (8000, 'SMITH011', 'CLERK003', 7902, '7980-12-07',  700, null, coalesce(21,'helloworld','l'),11);
coalesce-3-6     CASE WHEN语句
SELECT   sum(empno),  length(CASE WHEN  length(concat('SMITH',coalesce('HelloWorld',1,4)))= 1 THEN 1 
ELSE       NULL      END) 数据A,         
length(CASE WHEN length(concat('SMITH',coalesce('HelloWorld',1,4))) = 2 THEN 1                      
ELSE       NULL       END) 数据B   
FROM EMP e   ORDER  BY MOD(e.empno,e.sal);
sum(empno)	数据A	数据B
32000	NULL	NULL
drop   table  if  exists   emp;
create   TABLE   EMP (empno int,ename VARCHAR(10),job VARCHAR(9),mgr int,hiredate DATE,
sal FLOAT(7,0),comm FLOAT(7,0),deptno int,tno int);
insert into EMP (empno, ename, job, mgr, hiredate, sal, comm, deptno,tno)values (7369, 'SMITH001', 'CLERK001', 7902, '7980-12-07',  800, null, 20,1);
insert into EMP (empno, ename, job, mgr, hiredate, sal, comm, deptno,tno)values (7370, 'SMITH002', 'CLERK002', 7902, '7980-12-07',  900, 15, 10,2);
insert into EMP (empno, ename, job, mgr, hiredate, sal, comm, deptno,tno)values (7371, 'SMITH003', 'CLERK003', 7902, '7980-12-07',  250, 25, 50,3);
insert into EMP (empno, ename, job, mgr, hiredate, sal, comm, deptno,tno)values (7372, 'SMITH004', 'CLERK004', 7902, '7980-12-07',  100, 35, 30,4);
insert into EMP (empno, ename, job, mgr, hiredate, sal, comm, deptno,tno)values (7373, 'SMITH005', 'CLERK005', 7902, '7980-12-07',  200, 45, 80,5);
insert into EMP (empno, ename, job, mgr, hiredate, sal, comm, deptno,tno)values (7374, 'SMITH006', 'CLERK002', 7902, '7980-12-07',  300, 55, 10,6);
insert into EMP (empno, ename, job, mgr, hiredate, sal, comm, deptno,tno)values (7375, 'SMITH007', 'CLERK003', 7902, '7980-12-07',  400, 65, 20,7);
insert into EMP (empno, ename, job, mgr, hiredate, sal, comm, deptno,tno)values (7376, 'SMITH008', 'CLERK006', 7902, '7980-12-07',  500, null, 20,8);
insert into EMP (empno, ename, job, mgr, hiredate, sal, comm, deptno,tno)values (7377, 'SMITH009', 'CLERK008', 7902, '7980-12-07',  600, 75, 30,9);
insert into EMP (empno, ename, job, mgr, hiredate, sal, comm, deptno,tno)values (7378, 'SMITH010', 'CLERK009', 7902, '7980-12-07',  800, 95, 20,10);
insert into EMP (empno, ename, job, mgr, hiredate, sal, comm, deptno,tno)values (7379, 'SMITH011', 'CLERK003', 7902, '7980-12-07',  700, null, 20,11);
drop   table  if  exists   EMP001;
CREATE OR  REPLACE  VIEW EMP001 AS   SELECT  *    FROM   emp;
coalesce-4-1-1-1-1  select   
SELECT coalesce(e.ename, 2,1)   eee   FROM EMP001 e   ORDER BY  eee;
eee
SMITH001
SMITH002
SMITH003
SMITH004
SMITH005
SMITH006
SMITH007
SMITH008
SMITH009
SMITH010
SMITH011
coalesce-4-1-1-1-2  select嵌套 
select    length(concat(e.ename,coalesce('HelloWorld',1,4)))  eee   from    EMP001 e   ORDER BY  eee;
eee
18
18
18
18
18
18
18
18
18
18
18
coalesce-4-1-1-1-3    聚合函数
SELECT sum(length(concat(e.ename,coalesce('HelloWorld',1,4))))   eee FROM EMP001 e   ORDER  BY   eee  desc;
eee
198
SELECT min(length(concat(e.ename,coalesce('HelloWorld',1,4))))   eee FROM EMP001 e   ORDER  BY   eee  desc;
eee
18
SELECT max(length(concat(e.ename,coalesce('HelloWorld',1,4))))   eee FROM EMP001 e   ORDER  BY   eee  desc;
eee
18
SELECT avg(length(concat(e.ename,coalesce('HelloWorld',1,4))))   eee FROM EMP001 e   ORDER  BY   eee  desc;
eee
18.0000
coalesce-4-1-1-1-4    create as        
drop   table  if  exists   EMP002;
create TABLE    EMP002   as   SELECT  length(concat(e.ename,coalesce('HelloWorld',1,4)))  eee   from    EMP001 e;
select  *    FROM    EMP002;
eee
18
18
18
18
18
18
18
18
18
18
18
coalesce-4-1-1-2   where  语句    
select     length(concat(e.ename,coalesce('HelloWorld',1,4)))   eee  from    EMP001 e  WHERE  e.sal > 200  ORDER BY  eee;
eee
18
18
18
18
18
18
18
18
18
coalesce-4-1-1-3     order by 子句
select      length(concat(e.ename,coalesce('HelloWorld',1,4))) eee   from    EMP001 e        ORDER BY  eee;
eee
18
18
18
18
18
18
18
18
18
18
18
coalesce-4-1-1-4     group by   子句
select    length(concat(e.ename,coalesce('HelloWorld',1,4)))  eee    from    EMP001 e    GROUP  BY   e.ename    ORDER BY  eee;
eee
18
18
18
18
18
18
18
18
18
18
18
coalesce-4-1-1-5     group by  having   子句
select     length(concat(e.ename,coalesce('HelloWorld',1,4)))  eee    from    EMP001 e    GROUP  BY   e.ename    HAVING   LENGTH(e.ename)>0   ORDER BY  eee;
eee
18
18
18
18
18
18
18
18
18
18
18
coalesce-4-1-2-1   根据字段插入
insert into EMP001 (empno, ename, job, mgr, hiredate, sal, comm, deptno,tno)values (9000, 'SMITH', 'CLERK', 7902,  '1980-12-17', 800, null, coalesce(coalesce(10,'helloworld','l')),length(concat('Hello',coalesce('HelloWorld',1,4))));
select  *    FROM    EMP001    e   WHERE   e.EMPNO=9000;
empno	ename	job	mgr	hiredate	sal	comm	deptno	tno
9000	SMITH	CLERK	7902	1980-12-17	800	NULL	10	15
coalesce-4-1-2-2    根据表插入
insert into EMP001 values (8000, 'SMITH', 'CLERK', 7902,  (select coalesce(date_format('2008-08-08 22:23:01', '%Y%m%d%H%i%s'),date_format('2008-08-08 22:23:01', '%Y%m%d%H%i%s'))from dual),(select length(concat('Hello',coalesce(50,'HelloWorld',1,4)))), null, coalesce(60,'helloworld','l'),1);
select  *    FROM    EMP001    e   WHERE   e.EMPNO=8000;
empno	ename	job	mgr	hiredate	sal	comm	deptno	tno
8000	SMITH	CLERK	7902	2008-08-08	7	NULL	60	1
coalesce-4-1-2-3    插入语句中使用嵌套
insert into EMP001 values (7000, 'SMITH', 'CLERK', length(length(concat('Hello',coalesce('HelloWorld',1,4)))),  '1980-12-17', 800, null, coalesce('90','helloworld', CAST(coalesce('helloworld','l') AS CHAR)),1);
select  *    FROM    EMP001    e   WHERE   e.EMPNO=7000;
empno	ename	job	mgr	hiredate	sal	comm	deptno	tno
7000	SMITH	CLERK	2	1980-12-17	800	NULL	90	1
coalesce-4-1-3-1   单列              
UPDATE    EMP001  e  SET    e.DEPTNO =length(concat('Hello',coalesce('HelloWorld',1,4)))  WHERE   e.EMPNO = 7369;
select  *    FROM    EMP001    e   WHERE   e.EMPNO=7369;
empno	ename	job	mgr	hiredate	sal	comm	deptno	tno
7369	SMITH001	CLERK001	7902	7980-12-07	800	NULL	15	1
coalesce-4-1-3-2  多列      
UPDATE    EMP001  e  SET    e.DEPTNO = length(concat('Hello',coalesce('HelloWorld',1,4)));
select  *    FROM    EMP001    e   ORDER  BY e.EMPNO,e.TNO;
empno	ename	job	mgr	hiredate	sal	comm	deptno	tno
7000	SMITH	CLERK	2	1980-12-17	800	NULL	15	1
7369	SMITH001	CLERK001	7902	7980-12-07	800	NULL	15	1
7370	SMITH002	CLERK002	7902	7980-12-07	900	15	15	2
7371	SMITH003	CLERK003	7902	7980-12-07	250	25	15	3
7372	SMITH004	CLERK004	7902	7980-12-07	100	35	15	4
7373	SMITH005	CLERK005	7902	7980-12-07	200	45	15	5
7374	SMITH006	CLERK002	7902	7980-12-07	300	55	15	6
7375	SMITH007	CLERK003	7902	7980-12-07	400	65	15	7
7376	SMITH008	CLERK006	7902	7980-12-07	500	NULL	15	8
7377	SMITH009	CLERK008	7902	7980-12-07	600	75	15	9
7378	SMITH010	CLERK009	7902	7980-12-07	800	95	15	10
7379	SMITH011	CLERK003	7902	7980-12-07	700	NULL	15	11
8000	SMITH	CLERK	7902	2008-08-08	7	NULL	15	1
9000	SMITH	CLERK	7902	1980-12-17	800	NULL	15	15
coalesce-4-1-4-1   单列              
DELETE  FROM     EMP001       WHERE   EMPNO = 7369   and   DEPTNO =length(concat('Hello',coalesce('HelloWorld',1,4)));
select  *    FROM    EMP001        WHERE   EMPNO=7369;
empno	ename	job	mgr	hiredate	sal	comm	deptno	tno
coalesce-4-1-4-2  多列      
DELETE          FROM     EMP001  WHERE     DEPTNO = length(concat('Hello',coalesce('HelloWorld',1,4)));
select      count(*)     FROM    EMP001;
count(*)
0
insert into EMP (empno, ename, job, mgr, hiredate, sal, comm, deptno,tno)values (7374, 'SMITH006', 'CLERK002', 7902, '7980-12-07',  300, 55, 10,6);
insert into EMP (empno, ename, job, mgr, hiredate, sal, comm, deptno,tno)values (7375, 'SMITH007', 'CLERK003', 7902, '7980-12-07',  400, 65, 20,7);
insert into EMP (empno, ename, job, mgr, hiredate, sal, comm, deptno,tno)values (7376, 'SMITH008', 'CLERK006', 7902, '7980-12-07',  500, null, 20,8);
insert into EMP (empno, ename, job, mgr, hiredate, sal, comm, deptno,tno)values (7377, 'SMITH009', 'CLERK008', 7902, '7980-12-07',  600, 75, 30,9);
insert into EMP (empno, ename, job, mgr, hiredate, sal, comm, deptno,tno)values (7378, 'SMITH010', 'CLERK009', 7902, '7980-12-07',  800, 95, 20,10);
insert into EMP (empno, ename, job, mgr, hiredate, sal, comm, deptno,tno)values (7379, 'SMITH011', 'CLERK003', 7902, '7980-12-07',  700, null, 20,11);
coalesce-4-1-5    多列
with e as (SELECT   length(concat('Hello',coalesce('HelloWorld',1,4)))  from    EMP001 e)  select * from e;
length(concat('Hello',coalesce('HelloWorld',1,4)))
15
15
15
15
15
15
coalesce-4-1-6     CASE WHEN语句
SELECT   sum(empno),  length(CASE WHEN length(concat('Hello',coalesce('HelloWorld',1,4))) = 1 THEN 1 
ELSE       NULL      END) 数据A,         
length (CASE WHEN length(concat('Hello',coalesce('HelloWorld',1,4)))= 2 THEN 1                      
ELSE       NULL       END) 数据B   
FROM EMP001 e   ORDER  BY MOD(e.empno,e.sal);
sum(empno)	数据A	数据B
44259	NULL	NULL
drop   table  if  exists   DEPT;
CREATE TABLE DEPT (DEPTNO int,DNAME VARCHAR(14) ,LOC VARCHAR(13));
INSERT INTO DEPT VALUES(10,'ACCOUNTING','NEW YORK');
INSERT INTO DEPT VALUES (20,'RESEARCH','DALLAS');
INSERT INTO DEPT VALUES(30,'SALES','CHICAGO');
INSERT INTO DEPT VALUES(40,'OPERATIONS','BOSTON');
drop   table  if  exists   emp;
create   TABLE   EMP (empno int,ename VARCHAR(10),job VARCHAR(9),mgr int,hiredate DATE,
sal FLOAT(7,0),comm FLOAT(7,0),deptno int,tno int);
insert into EMP (empno, ename, job, mgr, hiredate, sal, comm, deptno,tno)values (7369, 'SMITH001', 'CLERK001', 7902, '7980-12-07',  800, null, 20,1);
insert into EMP (empno, ename, job, mgr, hiredate, sal, comm, deptno,tno)values (7370, 'SMITH002', 'CLERK002', 7902, '7980-12-07',  900, 15, 10,2);
insert into EMP (empno, ename, job, mgr, hiredate, sal, comm, deptno,tno)values (7371, 'SMITH003', 'CLERK003', 7902, '7980-12-07',  250, 25, 50,3);
insert into EMP (empno, ename, job, mgr, hiredate, sal, comm, deptno,tno)values (7372, 'SMITH004', 'CLERK004', 7902, '7980-12-07',  100, 35, 30,4);
insert into EMP (empno, ename, job, mgr, hiredate, sal, comm, deptno,tno)values (7373, 'SMITH005', 'CLERK005', 7902, '7980-12-07',  200, 45, 80,5);
insert into EMP (empno, ename, job, mgr, hiredate, sal, comm, deptno,tno)values (7374, 'SMITH006', 'CLERK002', 7902, '7980-12-07',  300, 55, 10,6);
insert into EMP (empno, ename, job, mgr, hiredate, sal, comm, deptno,tno)values (7375, 'SMITH007', 'CLERK003', 7902, '7980-12-07',  400, 65, 20,7);
insert into EMP (empno, ename, job, mgr, hiredate, sal, comm, deptno,tno)values (7376, 'SMITH008', 'CLERK006', 7902, '7980-12-07',  500, null, 20,8);
insert into EMP (empno, ename, job, mgr, hiredate, sal, comm, deptno,tno)values (7377, 'SMITH009', 'CLERK008', 7902, '7980-12-07',  600, 75, 30,9);
insert into EMP (empno, ename, job, mgr, hiredate, sal, comm, deptno,tno)values (7378, 'SMITH010', 'CLERK009', 7902, '7980-12-07',  800, 95, 20,10);
insert into EMP (empno, ename, job, mgr, hiredate, sal, comm, deptno,tno)values (7379, 'SMITH011', 'CLERK003', 7902, '7980-12-07',  700, null, 20,11);
coalesce-4-2-1     内连接
SELECT length(concat('Hello',coalesce('HelloWorld',1,4)))  from emp e  join dept d  on e.deptno = d.deptno;
length(concat('Hello',coalesce('HelloWorld',1,4)))
15
15
15
15
15
15
15
15
15
coalesce-4-2-2
select     length(concat('Hello',coalesce(1,'HelloWorld',1,4)))  eee  from emp e left  join  dept d on e.deptno = d.deptno   ORDER BY  eee;
eee
6
6
6
6
6
6
6
6
6
6
6
select     length(concat('Hello',coalesce('HelloWorld',1,4)))  eee  from emp e left outer join  dept d on e.deptno = d.deptno   ORDER BY  eee;
eee
15
15
15
15
15
15
15
15
15
15
15
coalesce-4-2-3
select      length(concat('Hello',coalesce(null,'HelloWorld',1,4)))    eee   from emp e right join dept d on e.deptno = d.deptno  ORDER BY  eee;
eee
15
15
15
15
15
15
15
15
15
15
select     length(concat('Hello',coalesce(9,'HelloWorld',1,4)))   eee  from emp e right outer join  dept d on e.deptno = d.deptno  ORDER BY  eee;
eee
6
6
6
6
6
6
6
6
6
6
coalesce-4-2-4    全连接full join
select   length(concat('Hello',coalesce('99','HelloWorld',1,4)))  eee  from emp e full join dept d on e.DEPTNO=d.DEPTNO    ORDER BY  eee;
eee
7
7
7
7
7
7
7
7
7
7
7
7
coalesce-4-3-1  
SELECT empno,ename,job    FROM emp     WHERE deptno  in(SELECT length(concat('Hello',coalesce('HelloWorld',1,4))) FROM  emp);
empno	ename	job
coalesce-4-3-2
SELECT empno,ename,job    FROM emp  e    WHERE deptno  NOT  in(SELECT length(concat('Hello',coalesce('HelloWorld',1,4))) FROM  emp)   ORDER BY  e.empno;
empno	ename	job
7369	SMITH001	CLERK001
7370	SMITH002	CLERK002
7371	SMITH003	CLERK003
7372	SMITH004	CLERK004
7373	SMITH005	CLERK005
7374	SMITH006	CLERK002
7375	SMITH007	CLERK003
7376	SMITH008	CLERK006
7377	SMITH009	CLERK008
7378	SMITH010	CLERK009
7379	SMITH011	CLERK003
coalesce-5-1-1                    
select  coalesce(e.ename,2, coalesce(e.ename, 'S')) eee from emp e  ORDER BY  eee;
eee
SMITH001
SMITH002
SMITH003
SMITH004
SMITH005
SMITH006
SMITH007
SMITH008
SMITH009
SMITH010
SMITH011
coalesce-5-1-2
SELECT   replace(e.ename,'SMITH',coalesce(e.ename,length(concat('Hello',coalesce('HelloWorld',1,4))), coalesce(e.ename, 'S')))   eee  FROM   emp e  ORDER BY  eee;
eee
SMITH001001
SMITH002002
SMITH003003
SMITH004004
SMITH005005
SMITH006006
SMITH007007
SMITH008008
SMITH009009
SMITH010010
SMITH011011
coalesce-5-1-3
SELECT   ABS(length(concat('Hello',coalesce('HelloWorld',1,4))))   eee  FROM   emp e  ORDER BY  eee;
eee
15
15
15
15
15
15
15
15
15
15
15
coalesce-5-1-4
SELECT   CEIL(length(concat('Hello',coalesce('HelloWorld',1,4))))   eee  FROM   emp e  ORDER BY  eee;
eee
15
15
15
15
15
15
15
15
15
15
15
coalesce-5-1-5
SELECT   FLOOR(length(concat('Hello',coalesce('HelloWorld',1,4))))  eee   FROM   emp e   ORDER BY  eee;
eee
15
15
15
15
15
15
15
15
15
15
15
coalesce-5-1-6
SELECT   MOD(coalesce(sal,ename, 'S'),length(concat('Hello',coalesce(sal,'HelloWorld',1,4))))   eee  FROM   emp e   ORDER BY  eee;
eee
0
0
0
0
0
2
4
4
4
4
4
coalesce-5-1-7
SELECT   char(length(concat(e.ename,coalesce('HelloWorld',1,4))))   eee  FROM   emp e  ORDER BY  eee;
eee











coalesce-5-1-8
SELECT   LENGTH(concat(e.ename,coalesce('HelloWorld',1,4)))   FROM   emp e;
LENGTH(concat(e.ename,coalesce('HelloWorld',1,4)))
18
18
18
18
18
18
18
18
18
18
18
coalesce-5-1-9
SELECT  MOD(length(concat(e.ename,coalesce('HelloWorld',1,4))),1)   eee FROM  emp e    ORDER BY  eee;
eee
0
0
0
0
0
0
0
0
0
0
0
coalesce-5-1-10
coalesce-5-1-11
SELECT   POWER(1,length(concat(e.ename,coalesce('HelloWorld',1,4))))   eee  FROM   emp e   ORDER BY  eee;
eee
1
1
1
1
1
1
1
1
1
1
1
coalesce-5-1-12
SELECT   SQRT(MOD(e.empno,length(concat(e.ename,coalesce('HelloWorld',1,4)))))   eee  FROM   emp e   ORDER BY  eee;
eee
2.6457513110645907
2.8284271247461903
3
3.1622776601683795
3.3166247903554
3.4641016151377544
3.605551275463989
3.7416573867739413
3.872983346207417
4
4.123105625617661
coalesce-5-1-13
SELECT   round(MOD(e.empno,e.sal),length(concat(e.ename,coalesce('HelloWorld',1,4))))   eee  FROM   emp e   ORDER BY  eee;
eee
72
121
169
170
173
174
175
177
178
376
379
coalesce-5-1-14
SELECT ENAME,JOB,SAL,IFNULL(length(concat(e.ename,coalesce('HelloWorld',1,4))),MOD(e.empno,e.sal)) FROM EMP e WHERE SAL<2000   ORDER  BY   sal;
ENAME	JOB	SAL	IFNULL(length(concat(e.ename,coalesce('HelloWorld',1,4))),MOD(e.empno,e.sal))
SMITH004	CLERK004	100	18
SMITH005	CLERK005	200	18
SMITH003	CLERK003	250	18
SMITH006	CLERK002	300	18
SMITH007	CLERK003	400	18
SMITH008	CLERK006	500	18
SMITH009	CLERK008	600	18
SMITH011	CLERK003	700	18
SMITH001	CLERK001	800	18
SMITH010	CLERK009	800	18
SMITH002	CLERK002	900	18
coalesce-5-1-15
SELECT   COALESCE (coalesce(e.ename, 'S'),length(concat(e.ename,coalesce('HelloWorld',1,4))))  eee    FROM   emp e   ORDER BY  eee;
eee
SMITH001
SMITH002
SMITH003
SMITH004
SMITH005
SMITH006
SMITH007
SMITH008
SMITH009
SMITH010
SMITH011
coalesce-5-1-16
SELECT   GREATEST(length(concat(e.ename,coalesce('HelloWorld',1,4))),MOD(e.empno,e.sal))   FROM   emp   e;
GREATEST(length(concat(e.ename,coalesce('HelloWorld',1,4))),MOD(e.empno,e.sal))
169
170
121
72
173
174
175
376
177
178
379
coalesce-5-1-17
select cast(length(concat(e.ename,coalesce('HelloWorld',1,4))) as char) as eee    from emp e   ORDER  BY   eee;
eee
18
18
18
18
18
18
18
18
18
18
18
coalesce-5-2
SELECT     hex(CONCAT(CHAR(length(concat(e.ename,coalesce('HelloWorld',1,4)))),CHAR(e.empno)))  eee    from emp e   ORDER  BY   eee;
eee
121CC9
121CCA
121CCB
121CCC
121CCD
121CCE
121CCF
121CD0
121CD1
121CD2
121CD3
SELECT   CASE if(coalesce(null,IFNULL(null,99))>100,101,102) WHEN '102' THEN "one" WHEN 2 THEN "two" ELSE "more" END;
CASE if(coalesce(null,IFNULL(null,99))>100,101,102) WHEN '102' THEN "one" WHEN 2 THEN "two" ELSE "more" END
one
SELECT   COALESCE ((SELECT CASE if(coalesce(null,IFNULL(null,99))>100,101,102) WHEN 109 THEN "one" WHEN 2 THEN "two"  end),88);
COALESCE ((SELECT CASE if(coalesce(null,IFNULL(null,99))>100,101,102) WHEN 109 THEN "one" WHEN 2 THEN "two"  end),88)
88
coalesce-6-1-1
SELECT   MOD(e.empno,e.sal)+length(concat(e.ename,coalesce('HelloWorld',1,4))) eee    from emp e   ORDER  BY   eee;
eee
90
139
187
188
191
192
193
195
196
394
397
coalesce-6-1-2
SELECT   MOD(e.empno,e.sal)-length(concat(e.ename,coalesce('HelloWorld',1,4)))   eee    from emp e   ORDER  BY   eee;
eee
54
103
151
152
155
156
157
159
160
358
361
coalesce-6-1-3
SELECT   MOD(e.empno,e.sal)*length(concat(e.ename,coalesce('HelloWorld',1,4)))    eee    from emp e   ORDER  BY   eee;
eee
1296
2178
3042
3060
3114
3132
3150
3186
3204
6768
6822
coalesce-6-1-4
SELECT   MOD(e.empno,e.sal)/length(concat(e.ename,coalesce('HelloWorld',1,4)))    eee    from emp e   ORDER  BY   eee;
eee
4.0000
6.7222
9.3889
9.4444
9.6111
9.6667
9.7222
9.8333
9.8889
20.8889
21.0556
coalesce-6-2-1
SELECT   *    FROM   emp e  WHERE  MOD(e.empno,e.sal) NOT IN(select  length(concat(e.ename,coalesce('HelloWorld',1,4)))    FROM emp)   ORDER BY empno;
empno	ename	job	mgr	hiredate	sal	comm	deptno	tno
7369	SMITH001	CLERK001	7902	7980-12-07	800	NULL	20	1
7370	SMITH002	CLERK002	7902	7980-12-07	900	15	10	2
7371	SMITH003	CLERK003	7902	7980-12-07	250	25	50	3
7372	SMITH004	CLERK004	7902	7980-12-07	100	35	30	4
7373	SMITH005	CLERK005	7902	7980-12-07	200	45	80	5
7374	SMITH006	CLERK002	7902	7980-12-07	300	55	10	6
7375	SMITH007	CLERK003	7902	7980-12-07	400	65	20	7
7376	SMITH008	CLERK006	7902	7980-12-07	500	NULL	20	8
7377	SMITH009	CLERK008	7902	7980-12-07	600	75	30	9
7378	SMITH010	CLERK009	7902	7980-12-07	800	95	20	10
7379	SMITH011	CLERK003	7902	7980-12-07	700	NULL	20	11
coalesce-6-2-2
SELECT   *    FROM   emp e  WHERE  MOD(e.empno,e.sal)<sal  AND length(concat(e.ename,coalesce('HelloWorld',1,4)))>tno  ORDER BY empno;
empno	ename	job	mgr	hiredate	sal	comm	deptno	tno
7369	SMITH001	CLERK001	7902	7980-12-07	800	NULL	20	1
7370	SMITH002	CLERK002	7902	7980-12-07	900	15	10	2
7371	SMITH003	CLERK003	7902	7980-12-07	250	25	50	3
7372	SMITH004	CLERK004	7902	7980-12-07	100	35	30	4
7373	SMITH005	CLERK005	7902	7980-12-07	200	45	80	5
7374	SMITH006	CLERK002	7902	7980-12-07	300	55	10	6
7375	SMITH007	CLERK003	7902	7980-12-07	400	65	20	7
7376	SMITH008	CLERK006	7902	7980-12-07	500	NULL	20	8
7377	SMITH009	CLERK008	7902	7980-12-07	600	75	30	9
7378	SMITH010	CLERK009	7902	7980-12-07	800	95	20	10
7379	SMITH011	CLERK003	7902	7980-12-07	700	NULL	20	11
coalesce-6-2-3    
SELECT   *    FROM   emp e  WHERE  MOD(e.empno,e.sal)<sal  or length(concat(e.ename,coalesce('HelloWorld',1,4))) >tno  ORDER BY empno;
empno	ename	job	mgr	hiredate	sal	comm	deptno	tno
7369	SMITH001	CLERK001	7902	7980-12-07	800	NULL	20	1
7370	SMITH002	CLERK002	7902	7980-12-07	900	15	10	2
7371	SMITH003	CLERK003	7902	7980-12-07	250	25	50	3
7372	SMITH004	CLERK004	7902	7980-12-07	100	35	30	4
7373	SMITH005	CLERK005	7902	7980-12-07	200	45	80	5
7374	SMITH006	CLERK002	7902	7980-12-07	300	55	10	6
7375	SMITH007	CLERK003	7902	7980-12-07	400	65	20	7
7376	SMITH008	CLERK006	7902	7980-12-07	500	NULL	20	8
7377	SMITH009	CLERK008	7902	7980-12-07	600	75	30	9
7378	SMITH010	CLERK009	7902	7980-12-07	800	95	20	10
7379	SMITH011	CLERK003	7902	7980-12-07	700	NULL	20	11
coalesce-6-3-1
SELECT   *   FROM   emp e   WHERE   e.sal =length(concat(e.ename,coalesce('HelloWorld',1,4)))   ORDER BY e.EMPNO,e.sal;
empno	ename	job	mgr	hiredate	sal	comm	deptno	tno
coalesce-6-3-2
SELECT   *   FROM   emp e   WHERE   e.sal >= length(concat(e.ename,coalesce('HelloWorld',1,4)))  ORDER BY e.EMPNO,e.sal;
empno	ename	job	mgr	hiredate	sal	comm	deptno	tno
7369	SMITH001	CLERK001	7902	7980-12-07	800	NULL	20	1
7370	SMITH002	CLERK002	7902	7980-12-07	900	15	10	2
7371	SMITH003	CLERK003	7902	7980-12-07	250	25	50	3
7372	SMITH004	CLERK004	7902	7980-12-07	100	35	30	4
7373	SMITH005	CLERK005	7902	7980-12-07	200	45	80	5
7374	SMITH006	CLERK002	7902	7980-12-07	300	55	10	6
7375	SMITH007	CLERK003	7902	7980-12-07	400	65	20	7
7376	SMITH008	CLERK006	7902	7980-12-07	500	NULL	20	8
7377	SMITH009	CLERK008	7902	7980-12-07	600	75	30	9
7378	SMITH010	CLERK009	7902	7980-12-07	800	95	20	10
7379	SMITH011	CLERK003	7902	7980-12-07	700	NULL	20	11
coalesce-6-3-3
SELECT   *   FROM   emp e   WHERE   e.sal < length(concat(e.ename,coalesce('HelloWorld',1,4)))  ORDER BY e.EMPNO,e.sal;
empno	ename	job	mgr	hiredate	sal	comm	deptno	tno
coalesce-6-3-4
SELECT   *   FROM   emp e   WHERE   e.sal <=length(concat(e.ename,coalesce('HelloWorld',1,4)))   ORDER BY e.EMPNO,e.sal;
empno	ename	job	mgr	hiredate	sal	comm	deptno	tno
coalesce-6-3-5
SELECT   *   FROM   emp e   WHERE   e.sal !=length(concat(e.ename,coalesce('HelloWorld',1,4)))  ORDER BY e.EMPNO,e.sal;
empno	ename	job	mgr	hiredate	sal	comm	deptno	tno
7369	SMITH001	CLERK001	7902	7980-12-07	800	NULL	20	1
7370	SMITH002	CLERK002	7902	7980-12-07	900	15	10	2
7371	SMITH003	CLERK003	7902	7980-12-07	250	25	50	3
7372	SMITH004	CLERK004	7902	7980-12-07	100	35	30	4
7373	SMITH005	CLERK005	7902	7980-12-07	200	45	80	5
7374	SMITH006	CLERK002	7902	7980-12-07	300	55	10	6
7375	SMITH007	CLERK003	7902	7980-12-07	400	65	20	7
7376	SMITH008	CLERK006	7902	7980-12-07	500	NULL	20	8
7377	SMITH009	CLERK008	7902	7980-12-07	600	75	30	9
7378	SMITH010	CLERK009	7902	7980-12-07	800	95	20	10
7379	SMITH011	CLERK003	7902	7980-12-07	700	NULL	20	11
coalesce-6-3-6
SELECT   *   FROM   emp e   WHERE   e.sal <>length(concat(e.ename,coalesce('HelloWorld',1,4)))   ORDER BY e.EMPNO,e.sal;
empno	ename	job	mgr	hiredate	sal	comm	deptno	tno
7369	SMITH001	CLERK001	7902	7980-12-07	800	NULL	20	1
7370	SMITH002	CLERK002	7902	7980-12-07	900	15	10	2
7371	SMITH003	CLERK003	7902	7980-12-07	250	25	50	3
7372	SMITH004	CLERK004	7902	7980-12-07	100	35	30	4
7373	SMITH005	CLERK005	7902	7980-12-07	200	45	80	5
7374	SMITH006	CLERK002	7902	7980-12-07	300	55	10	6
7375	SMITH007	CLERK003	7902	7980-12-07	400	65	20	7
7376	SMITH008	CLERK006	7902	7980-12-07	500	NULL	20	8
7377	SMITH009	CLERK008	7902	7980-12-07	600	75	30	9
7378	SMITH010	CLERK009	7902	7980-12-07	800	95	20	10
7379	SMITH011	CLERK003	7902	7980-12-07	700	NULL	20	11
drop   table  if  exists   emp;
create   TABLE   EMP (empno int,ename VARCHAR(10),job VARCHAR(9),mgr int,hiredate DATE,
sal FLOAT(7,0),comm FLOAT(7,0),deptno int,tno int);
coalesce-7-1-1  无参数的存储过程
drop procedure if exists myproc1;
create procedure myproc1()
begin
insert into EMP (empno, ename, job, mgr, hiredate, sal, comm, deptno,tno)values (7369, 'SMITH001', 'CLERK001', 7902, '7980-12-07',  800, null, coalesce(80,'helloworld','l'),1);
insert into EMP (empno, ename, job, mgr, hiredate, sal, comm, deptno,tno)values (7370, 'SMITH002', 'CLERK002', 7902, '7980-12-07',  900, 15, length(coalesce('helloworld','o')),2);
insert into EMP (empno, ename, job, mgr, hiredate, sal, comm, deptno,tno)values (7371, 'SMITH003', 'CLERK003', 7902, '7980-12-07',  250, 25, length(coalesce('helloworld','w')),3);
insert into EMP (empno, ename, job, mgr, hiredate, sal, comm, deptno,tno)values (7372, 'SMITH004', 'CLERK004', 7902, '7980-12-07',  100, 35, length(coalesce('helloworld','d')),4);
insert into EMP (empno, ename, job, mgr, hiredate, sal, comm, deptno,tno)values (7373, 'SMITH005', 'CLERK005', 7902, '7980-12-07',  200, 45, coalesce(900,'helloworld','e'),5);
end 
//
call myproc1();
select  *  from   emp e order by  e.empno;
empno	ename	job	mgr	hiredate	sal	comm	deptno	tno
7369	SMITH001	CLERK001	7902	7980-12-07	800	NULL	80	1
7370	SMITH002	CLERK002	7902	7980-12-07	900	15	10	2
7371	SMITH003	CLERK003	7902	7980-12-07	250	25	10	3
7372	SMITH004	CLERK004	7902	7980-12-07	100	35	10	4
7373	SMITH005	CLERK005	7902	7980-12-07	200	45	900	5
coalesce-7-1-2    只有一个 in 参数的存储过程 
drop procedure if exists myproc2;
create procedure myproc2(in userId int)
begin
SELECT    coalesce(e.ename,userId/10, coalesce(e.ename, 'S'))      FROM emp  e;
end
//
set @dum =10;
call myproc2(@dum);
coalesce(e.ename,userId/10, coalesce(e.ename, 'S'))
SMITH001
SMITH002
SMITH003
SMITH004
SMITH005
SELECT    coalesce(e.ename,@dum/10, coalesce(e.ename, 'S'))      FROM emp  e;
coalesce(e.ename,@dum/10, coalesce(e.ename, 'S'))
SMITH001
SMITH002
SMITH003
SMITH004
SMITH005
coalesce-7-1-3    :包含 in 参数和 out 参数的存储过程,只能将一行的查询到的用户名赋值给username 
drop procedure if exists myproc3;
create procedure myproc3(in userId int, out username varchar(20))
begin
set username= userId;	
SELECT *  FROM emp d where  d.DEPTNO> username;		
end
//
--  调用时，传入查询的userid 和 全局变量 @username
call myproc3(coalesce(100,'helloworld','l'),@username);
empno	ename	job	mgr	hiredate	sal	comm	deptno	tno
7373	SMITH005	CLERK005	7902	7980-12-07	200	45	900	5
select  *  from   emp e order by  e.empno;
empno	ename	job	mgr	hiredate	sal	comm	deptno	tno
7369	SMITH001	CLERK001	7902	7980-12-07	800	NULL	80	1
7370	SMITH002	CLERK002	7902	7980-12-07	900	15	10	2
7371	SMITH003	CLERK003	7902	7980-12-07	250	25	10	3
7372	SMITH004	CLERK004	7902	7980-12-07	100	35	10	4
7373	SMITH005	CLERK005	7902	7980-12-07	200	45	900	5
coalesce-7-1-4     包含 inout 参数的存储过程
drop procedure if exists myproc4;
create procedure myproc4(inout a char(10))
begin
SELECT     coalesce(a,'l')  eee     FROM emp  e;	
end
//
--  用户变量 （全局的变量）作用域： 用户变量: 在当前连接（即当前会话）中都有效
set @num ='helloworld';
call  myproc4(@num);
eee
helloworld
helloworld
helloworld
helloworld
helloworld
SELECT     coalesce(@num,'l')     FROM emp  e;
coalesce(@num,'l')
helloworld
helloworld
helloworld
helloworld
helloworld
coalesce-7-2-1 无参数的自定义函数
drop function  IF EXISTS salemp001;
CREATE FUNCTION salemp001(saller001 int) RETURNS DOUBLE
BEGIN
DECLARE ag DOUBLE DEFAULT 0;#定义局部变量并初始化
SELECT  sum(coalesce('helloworld','l'))  INTO ag #为局部变量赋值
FROM emp e INNER JOIN dept d ON e.DEPTNO=d.DEPTNO where  e.sal >saller001 GROUP BY d.DEPTNO having d.DEPTNO>1;
RETURN ag;
end
//
SELECT salemp001(100);
salemp001(100)
0
coalesce-7-2-2  自定义函数  有参数
drop function  IF EXISTS salemp001;
CREATE FUNCTION salemp001(saller001 int) RETURNS DOUBLE
BEGIN
DECLARE ag DOUBLE DEFAULT 0;#定义局部变量并初始化
SELECT    coalesce(9999,coalesce(90,'helloworld','l')) INTO ag #为局部变量赋值
FROM emp e INNER JOIN dept d ON e.DEPTNO!=d.DEPTNO where  e.sal <saller001 GROUP BY d.DEPTNO having d.DEPTNO>10;
RETURN ag;
end
//
SELECT   coalesce(999+(SELECT salemp001(100)),888)  from  dual;
coalesce(999+(SELECT salemp001(100)),888)
999
coalesce-7-2-3   自定义函数使用循环 
drop function  IF EXISTS salemp001;
CREATE FUNCTION salemp001(saller001 int) RETURNS DOUBLE
BEGIN
DECLARE ag DOUBLE DEFAULT 0;
DECLARE i INT DEFAULT 1;
WHILE i<=1000 DO
insert into EMP (empno, ename, job, mgr, hiredate, sal, comm, deptno,tno)values (saller001+i*10, 'SMITH001', 'CLERK001', 7902, '7980-12-07',  800, null, coalesce(90,'helloworld','l'),1);
SET i = i+1;
END WHILE;
SELECT  count(*)  into  ag   from   EMP;
RETURN ag + coalesce(90,'helloworld','l');
end
//
SELECT salemp001(100);
salemp001(100)
1095
drop database  IF EXISTS  ob100x;
