# 环境清理
purge recyclebin;
result_format: 4
drop DATABASE IF EXISTS yx5493;
CREATE DATABASE IF NOT EXISTS yx5493;
USE yx5493;
drop table t1;
create table t1(
c0 float,
c1 int,
c2 varchar(10))
PARTITION by range(c1)
(partition p1 values less than(10),
partition p2 values less than(20),
partition p3 values less than(9999)
);
insert into t1 values(1,0,'a'),(2,6,'b'),(3,12,'c'),(4,18,'d'),(5,24,'e'),(6,30,'f'),(7,36,'g');
alter table t1 modify c1 int default 0 not null;
show create table t1;
Table	Create Table
t1	CREATE TABLE `t1` (
  `c0` float DEFAULT NULL,
  `c1` int(11) NOT NULL DEFAULT '0',
  `c2` varchar(10) DEFAULT NULL
) ORGANIZATION INDEX DEFAULT CHARSET = utf8mb4 ROW_FORMAT = DYNAMIC COMPRESSION = 'zstd_1.3.8' REPLICA_NUM = 1 BLOCK_SIZE = 16384 USE_BLOOM_FILTER = FALSE ENABLE_MACRO_BLOCK_BLOOM_FILTER = FALSE TABLET_SIZE = 134217728 PCTFREE = 0
 partition by range(c1)
(partition `p1` values less than (10),
partition `p2` values less than (20),
partition `p3` values less than (9999))
insert into t1(c0) values(8),(9),(10);
select * from t1 order by 1;
+------+----+------+
| c0   | c1 | c2   |
+------+----+------+
|    1 |  0 | a    |
|    2 |  6 | b    |
|    3 | 12 | c    |
|    4 | 18 | d    |
|    5 | 24 | e    |
|    6 | 30 | f    |
|    7 | 36 | g    |
|    8 |  0 | NULL |
|    9 |  0 | NULL |
|   10 |  0 | NULL |
+------+----+------+
drop table t1;
create table t1(
c0 float,
c1 int,
c2 varchar(10))
PARTITION by range(c1)
(partition p1 values less than(10),
partition p2 values less than(20),
partition p3 values less than(9999)
);
insert into t1 values(1,0,'a'),(2,6,'b'),(3,12,'c'),(4,18,'d'),(5,24,'e'),(6,30,'f'),(7,36,'g');
select * from t1 order by 1;
+------+------+------+
| c0   | c1   | c2   |
+------+------+------+
|    1 |    0 | a    |
|    2 |    6 | b    |
|    3 |   12 | c    |
|    4 |   18 | d    |
|    5 |   24 | e    |
|    6 |   30 | f    |
|    7 |   36 | g    |
+------+------+------+
alter table t1 modify c2 varchar(10) default 'unknow' not null;
show create table t1;
Table	Create Table
t1	CREATE TABLE `t1` (
  `c0` float DEFAULT NULL,
  `c1` int(11) DEFAULT NULL,
  `c2` varchar(10) NOT NULL DEFAULT 'unknow'
) ORGANIZATION INDEX DEFAULT CHARSET = utf8mb4 ROW_FORMAT = DYNAMIC COMPRESSION = 'zstd_1.3.8' REPLICA_NUM = 1 BLOCK_SIZE = 16384 USE_BLOOM_FILTER = FALSE ENABLE_MACRO_BLOCK_BLOOM_FILTER = FALSE TABLET_SIZE = 134217728 PCTFREE = 0
 partition by range(c1)
(partition `p1` values less than (10),
partition `p2` values less than (20),
partition `p3` values less than (9999))
insert into t1(c0,c1) values(1,1),(2,2);
select * from t1 order by 1;
+------+------+--------+
| c0   | c1   | c2     |
+------+------+--------+
|    1 |    0 | a      |
|    1 |    1 | unknow |
|    2 |    6 | b      |
|    2 |    2 | unknow |
|    3 |   12 | c      |
|    4 |   18 | d      |
|    5 |   24 | e      |
|    6 |   30 | f      |
|    7 |   36 | g      |
+------+------+--------+
drop table t1;
create table t1(c0 float,
c1 int,
c2 varchar(10))
PARTITION BY LIST(c1)
(PARTITION p1 values IN(-5,-4,-3,-2,-1,0,1,2,3,4,5,6,7,8,9,10),
PARTITION p2 values IN(11,12,13,14,15,16,17,18,19,20),
PARTITION p3 values IN(21,22,23,24,25,26,27,28,29,30),
PARTITION p4 values IN(31,32,33,34,35,36,37,38,39,40)
);
insert into t1 values(1,0,'A'),(2,2,'B'),(3,4,'C'),(4,14,'D'),(5,17,'E'),(6,20,'F'),(7,23,'G');
alter table t1 modify c1 int default 0 not null;
show create table t1;
Table	Create Table
t1	CREATE TABLE `t1` (
  `c0` float DEFAULT NULL,
  `c1` int(11) NOT NULL DEFAULT '0',
  `c2` varchar(10) DEFAULT NULL
) ORGANIZATION INDEX DEFAULT CHARSET = utf8mb4 ROW_FORMAT = DYNAMIC COMPRESSION = 'zstd_1.3.8' REPLICA_NUM = 1 BLOCK_SIZE = 16384 USE_BLOOM_FILTER = FALSE ENABLE_MACRO_BLOCK_BLOOM_FILTER = FALSE TABLET_SIZE = 134217728 PCTFREE = 0
 partition by list(c1)
(partition `p1` values in (-5,-4,-3,-2,-1,0,1,2,3,4,5,6,7,8,9,10),
partition `p2` values in (11,12,13,14,15,16,17,18,19,20),
partition `p3` values in (21,22,23,24,25,26,27,28,29,30),
partition `p4` values in (31,32,33,34,35,36,37,38,39,40))
insert into t1(c0,c2) values(8,'H'),(9,'I'),(10,'J');
select * from t1 order by 1;
+------+----+------+
| c0   | c1 | c2   |
+------+----+------+
|    1 |  0 | A    |
|    2 |  2 | B    |
|    3 |  4 | C    |
|    4 | 14 | D    |
|    5 | 17 | E    |
|    6 | 20 | F    |
|    7 | 23 | G    |
|    8 |  0 | H    |
|    9 |  0 | I    |
|   10 |  0 | J    |
+------+----+------+
drop table t1;
create table t1(c0 float,
c1 int,
c2 varchar(10))
PARTITION BY LIST(c1)
(PARTITION p1 values IN(-5,-4,-3,-2,-1,0,1,2,3,4,5,6,7,8,9,10),
PARTITION p2 values IN(11,12,13,14,15,16,17,18,19,20),
PARTITION p3 values IN(21,22,23,24,25,26,27,28,29,30),
PARTITION p4 values IN(31,32,33,34,35,36,37,38,39,40)
);
insert into t1 values(1,0,'A'),(2,2,'B'),(3,4,'C'),(4,14,'D'),(5,17,'E'),(6,20,'F'),(7,23,'G');
alter table t1 modify c2 varchar(10) default 'unknow' not null;
insert into t1(c0,c1) values(8,15),(9,25);
select * from t1 order by 1;
+------+------+--------+
| c0   | c1   | c2     |
+------+------+--------+
|    1 |    0 | A      |
|    2 |    2 | B      |
|    3 |    4 | C      |
|    4 |   14 | D      |
|    5 |   17 | E      |
|    6 |   20 | F      |
|    7 |   23 | G      |
|    8 |   15 | unknow |
|    9 |   25 | unknow |
+------+------+--------+
drop table t1;
create table t1(c0 float,
c1 int,
c2 varchar(10))
PARTITION BY HASH(c1)
(PARTITION p1,PARTITION p2,PARTITION p3);
insert into t1 values(1,0,'A'),(2,2,'B'),(3,4,'C'),(4,14,'D'),(5,17,'E'),(6,20,'F'),(7,23,'G');
alter table t1 modify c1 int default 0 not null;
show create table t1;
Table	Create Table
t1	CREATE TABLE `t1` (
  `c0` float DEFAULT NULL,
  `c1` int(11) NOT NULL DEFAULT '0',
  `c2` varchar(10) DEFAULT NULL
) ORGANIZATION INDEX DEFAULT CHARSET = utf8mb4 ROW_FORMAT = DYNAMIC COMPRESSION = 'zstd_1.3.8' REPLICA_NUM = 1 BLOCK_SIZE = 16384 USE_BLOOM_FILTER = FALSE ENABLE_MACRO_BLOCK_BLOOM_FILTER = FALSE TABLET_SIZE = 134217728 PCTFREE = 0
 partition by hash(c1)
(partition `p1`,
partition `p2`,
partition `p3`)
insert into t1 values(8,11,'a');
insert into t1(c0) values(9),(10);
select * from t1 order by 1;
+------+----+------+
| c0   | c1 | c2   |
+------+----+------+
|    1 |  0 | A    |
|    2 |  2 | B    |
|    3 |  4 | C    |
|    4 | 14 | D    |
|    5 | 17 | E    |
|    6 | 20 | F    |
|    7 | 23 | G    |
|    8 | 11 | a    |
|    9 |  0 | NULL |
|   10 |  0 | NULL |
+------+----+------+
drop table t1;
create table t1(c0 float,
c1 int,
c2 varchar(10))
PARTITION BY HASH(c1)
(PARTITION p1,PARTITION p2,PARTITION p3);
insert into t1 values(1,0,'A'),(2,2,'B'),(3,4,'C'),(4,14,'D'),(5,17,'E'),(6,20,'F'),(7,23,'G');
alter table t1 modify c2 varchar(10) default 'XX' not null;
show create table t1;
Table	Create Table
t1	CREATE TABLE `t1` (
  `c0` float DEFAULT NULL,
  `c1` int(11) DEFAULT NULL,
  `c2` varchar(10) NOT NULL DEFAULT 'XX'
) ORGANIZATION INDEX DEFAULT CHARSET = utf8mb4 ROW_FORMAT = DYNAMIC COMPRESSION = 'zstd_1.3.8' REPLICA_NUM = 1 BLOCK_SIZE = 16384 USE_BLOOM_FILTER = FALSE ENABLE_MACRO_BLOCK_BLOOM_FILTER = FALSE TABLET_SIZE = 134217728 PCTFREE = 0
 partition by hash(c1)
(partition `p1`,
partition `p2`,
partition `p3`)
insert into t1 values(8,11,'a');
insert into t1(c0) values(9),(10);
select * from t1 order by 1;
+------+------+----+
| c0   | c1   | c2 |
+------+------+----+
|    1 |    0 | A  |
|    2 |    2 | B  |
|    3 |    4 | C  |
|    4 |   14 | D  |
|    5 |   17 | E  |
|    6 |   20 | F  |
|    7 |   23 | G  |
|    8 |   11 | a  |
|    9 | NULL | XX |
|   10 | NULL | XX |
+------+------+----+
drop table t1;
create table t1(c0 float,
c1 int,
c2 varchar(10))
PARTITION BY KEY(c1) PARTITIONS 3;
insert into t1 values(1,0,'A'),(2,2,'B'),(3,4,'C'),(4,14,'D'),(5,17,'E'),(6,20,'F'),(7,23,'G');
alter table t1 modify c1 int default 123 not null;
show create table t1;
Table	Create Table
t1	CREATE TABLE `t1` (
  `c0` float DEFAULT NULL,
  `c1` int(11) NOT NULL DEFAULT '123',
  `c2` varchar(10) DEFAULT NULL
) ORGANIZATION INDEX DEFAULT CHARSET = utf8mb4 ROW_FORMAT = DYNAMIC COMPRESSION = 'zstd_1.3.8' REPLICA_NUM = 1 BLOCK_SIZE = 16384 USE_BLOOM_FILTER = FALSE ENABLE_MACRO_BLOCK_BLOOM_FILTER = FALSE TABLET_SIZE = 134217728 PCTFREE = 0
 partition by key(c1)
(partition `p0`,
partition `p1`,
partition `p2`)
insert into t1 values(8,33,'H');
insert into t1(c0) values(9),(10);
select * from t1;
+------+-----+------+
| c0   | c1  | c2   |
+------+-----+------+
|    3 |   4 | C    |
|    5 |  17 | E    |
|    6 |  20 | F    |
|    8 |  33 | H    |
|    1 |   0 | A    |
|    2 |   2 | B    |
|    4 |  14 | D    |
|    7 |  23 | G    |
|    9 | 123 | NULL |
|   10 | 123 | NULL |
+------+-----+------+
drop table t1;
create table t1(c0 float,
c1 int,
c2 varchar(10))
PARTITION BY KEY(c1) PARTITIONS 3;
insert into t1 values(1,0,'A'),(2,2,'B'),(3,4,'C'),(4,14,'D'),(5,17,'E'),(6,20,'F'),(7,23,'G');
alter table t1 modify c2 varchar(10) default 'XX' not null;
show create table t1;
Table	Create Table
t1	CREATE TABLE `t1` (
  `c0` float DEFAULT NULL,
  `c1` int(11) DEFAULT NULL,
  `c2` varchar(10) NOT NULL DEFAULT 'XX'
) ORGANIZATION INDEX DEFAULT CHARSET = utf8mb4 ROW_FORMAT = DYNAMIC COMPRESSION = 'zstd_1.3.8' REPLICA_NUM = 1 BLOCK_SIZE = 16384 USE_BLOOM_FILTER = FALSE ENABLE_MACRO_BLOCK_BLOOM_FILTER = FALSE TABLET_SIZE = 134217728 PCTFREE = 0
 partition by key(c1)
(partition `p0`,
partition `p1`,
partition `p2`)
insert into t1 values(8,33,'H');
insert into t1(c0) values(9),(10);
select * from t1;
+------+------+----+
| c0   | c1   | c2 |
+------+------+----+
|    3 |    4 | C  |
|    5 |   17 | E  |
|    6 |   20 | F  |
|    8 |   33 | H  |
|    1 |    0 | A  |
|    2 |    2 | B  |
|    4 |   14 | D  |
|    7 |   23 | G  |
|    9 | NULL | XX |
|   10 | NULL | XX |
+------+------+----+
drop table t1;
create table t1(c0 float,
c1 int,
c2 varchar(10))
PARTITION BY RANGE COLUMNS(c2)
SUBPARTITION BY HASH(c1) SUBPARTITIONS 4
(PARTITION r1 values less than('10'),
partition r2 values less than('20'),
partition r3 values less than('30'),
partition r4 values less than('40'));
insert into t1 values(1,1,'1'),(2,2,'2'),(3,0,'3'),(4,-20,'-5'),(5,6,'-10'),(6,-10,'11'),(7,7,'15');
alter table t1 modify c1 int default 0 not null;
show create table t1;
Table	Create Table
t1	CREATE TABLE `t1` (
  `c0` float DEFAULT NULL,
  `c1` int(11) NOT NULL DEFAULT '0',
  `c2` varchar(10) DEFAULT NULL
) ORGANIZATION INDEX DEFAULT CHARSET = utf8mb4 ROW_FORMAT = DYNAMIC COMPRESSION = 'zstd_1.3.8' REPLICA_NUM = 1 BLOCK_SIZE = 16384 USE_BLOOM_FILTER = FALSE ENABLE_MACRO_BLOCK_BLOOM_FILTER = FALSE TABLET_SIZE = 134217728 PCTFREE = 0
 partition by range columns(c2) subpartition by hash(c1) subpartition template (
subpartition `p0`,
subpartition `p1`,
subpartition `p2`,
subpartition `p3`)
(partition `r1` values less than ('10'),
partition `r2` values less than ('20'),
partition `r3` values less than ('30'),
partition `r4` values less than ('40'))
insert into t1 values(8,18,'28');
delete from t1 where c1 = 0;
insert into t1(c0) values(9),(10);
select * from t1;
+------+-----+------+
| c0   | c1  | c2   |
+------+-----+------+
|    4 | -20 | -5   |
|    9 |   0 | NULL |
|   10 |   0 | NULL |
|    1 |   1 | 1    |
|    5 |   6 | -10  |
|    2 |   2 | 2    |
|    6 | -10 | 11   |
|    7 |   7 | 15   |
|    8 |  18 | 28   |
+------+-----+------+
drop table t1;
create table t1(c0 float,
c1 int,
c2 varchar(10))
PARTITION BY RANGE COLUMNS(c2)
SUBPARTITION BY HASH(c1) SUBPARTITIONS 4
(PARTITION r1 values less than('10'),
partition r2 values less than('20'),
partition r3 values less than('30'),
partition r4 values less than('40'));
insert into t1 values(1,1,'1'),(2,2,'2'),(3,0,'3'),(4,-20,'-5'),(5,6,'-10'),(6,-10,'11'),(7,7,'15');
alter table t1 modify c2 varchar(10) default '0' not null;
show create table t1;
Table	Create Table
t1	CREATE TABLE `t1` (
  `c0` float DEFAULT NULL,
  `c1` int(11) DEFAULT NULL,
  `c2` varchar(10) NOT NULL DEFAULT '0'
) ORGANIZATION INDEX DEFAULT CHARSET = utf8mb4 ROW_FORMAT = DYNAMIC COMPRESSION = 'zstd_1.3.8' REPLICA_NUM = 1 BLOCK_SIZE = 16384 USE_BLOOM_FILTER = FALSE ENABLE_MACRO_BLOCK_BLOOM_FILTER = FALSE TABLET_SIZE = 134217728 PCTFREE = 0
 partition by range columns(c2) subpartition by hash(c1) subpartition template (
subpartition `p0`,
subpartition `p1`,
subpartition `p2`,
subpartition `p3`)
(partition `r1` values less than ('10'),
partition `r2` values less than ('20'),
partition `r3` values less than ('30'),
partition `r4` values less than ('40'))
insert into t1 values(8,18,'28');
delete from t1 where c1 = 0;
insert into t1(c0) values(9),(10);
select * from t1;
+------+------+-----+
| c0   | c1   | c2  |
+------+------+-----+
|    4 |  -20 | -5  |
|    9 | NULL | 0   |
|   10 | NULL | 0   |
|    1 |    1 | 1   |
|    5 |    6 | -10 |
|    2 |    2 | 2   |
|    6 |  -10 | 11  |
|    7 |    7 | 15  |
|    8 |   18 | 28  |
+------+------+-----+
drop database if exists yx5493;
PURGE RECYCLEBIN;
