# 环境清理
purge recyclebin;
result_format: 4
drop DATABASE IF EXISTS yx5493;
CREATE DATABASE IF NOT EXISTS yx5493;
USE yx5493;
drop table t1;
create table t1(
c0 int,
c1 varchar(4));
alter table t1 modify c0 int default 0 not null;
show create table t1;
Table	Create Table
t1	CREATE TABLE `t1` (
  `c0` int(11) NOT NULL DEFAULT '0',
  `c1` varchar(4) DEFAULT NULL
) ORGANIZATION INDEX DEFAULT CHARSET = utf8mb4 ROW_FORMAT = DYNAMIC COMPRESSION = 'zstd_1.3.8' REPLICA_NUM = 1 BLOCK_SIZE = 16384 USE_BLOOM_FILTER = FALSE ENABLE_MACRO_BLOCK_BLOOM_FILTER = FALSE TABLET_SIZE = 134217728 PCTFREE = 0
insert into t1(c1) values('a'),('b'),('c');
select * from t1;
+----+------+
| c0 | c1   |
+----+------+
|  0 | a    |
|  0 | b    |
|  0 | c    |
+----+------+
drop table t1;
create table t1(
c0 int default null,
c1 varchar(4));
alter table t1 modify c0 int default 0 not null;
show create table t1;
Table	Create Table
t1	CREATE TABLE `t1` (
  `c0` int(11) NOT NULL DEFAULT '0',
  `c1` varchar(4) DEFAULT NULL
) ORGANIZATION INDEX DEFAULT CHARSET = utf8mb4 ROW_FORMAT = DYNAMIC COMPRESSION = 'zstd_1.3.8' REPLICA_NUM = 1 BLOCK_SIZE = 16384 USE_BLOOM_FILTER = FALSE ENABLE_MACRO_BLOCK_BLOOM_FILTER = FALSE TABLET_SIZE = 134217728 PCTFREE = 0
insert into t1(c1) values('a'),('b'),('c');
select * from t1;
+----+------+
| c0 | c1   |
+----+------+
|  0 | a    |
|  0 | b    |
|  0 | c    |
+----+------+
drop table t1;
create table t1(
c0 INT,
c1 FLOAT);
insert into t1 values(1,2),(null,22),(11,222),(null,2222);
alter table t1 modify c0 int default 100 not null;
ERROR 22004: Invalid use of NULL value
drop table t1;
create table t1(
c0 INT default null,
c1 FLOAT);
insert into t1 values(1,2),(null,22),(11,222),(null,2222);
alter table t1 modify c0 int default 100 not null;
ERROR 22004: Invalid use of NULL value
drop table t1;
create table t1(
c0 INT default null,
c1 FLOAT);
insert into t1 values(null,2),(null,22),(null,222),(null,2222);
alter table t1 modify c0 int default null not null;
ERROR 42000: Invalid default value for 'c0'
drop table t1;
create table t1(
c0 INT,
c1 int);
insert into t1 values(1,2),(11,22);
alter table t1 modify c0 int default 999 not null;
alter table t1 change c1 c1 int default 9999 not null;
show create table t1;
Table	Create Table
t1	CREATE TABLE `t1` (
  `c0` int(11) NOT NULL DEFAULT '999',
  `c1` int(11) NOT NULL DEFAULT '9999'
) ORGANIZATION INDEX DEFAULT CHARSET = utf8mb4 ROW_FORMAT = DYNAMIC COMPRESSION = 'zstd_1.3.8' REPLICA_NUM = 1 BLOCK_SIZE = 16384 USE_BLOOM_FILTER = FALSE ENABLE_MACRO_BLOCK_BLOOM_FILTER = FALSE TABLET_SIZE = 134217728 PCTFREE = 0
select c0,c1 FROM t1;
+----+----+
| c0 | c1 |
+----+----+
|  1 |  2 |
| 11 | 22 |
+----+----+
drop table t1;
create table t1(
c0 INT default null,
c1 int default null);
insert into t1 values(1,2),(11,22);
alter table t1 modify c0 int default 999 not null;
alter table t1 change c1 c1 int default 9999 not null;
show create table t1;
Table	Create Table
t1	CREATE TABLE `t1` (
  `c0` int(11) NOT NULL DEFAULT '999',
  `c1` int(11) NOT NULL DEFAULT '9999'
) ORGANIZATION INDEX DEFAULT CHARSET = utf8mb4 ROW_FORMAT = DYNAMIC COMPRESSION = 'zstd_1.3.8' REPLICA_NUM = 1 BLOCK_SIZE = 16384 USE_BLOOM_FILTER = FALSE ENABLE_MACRO_BLOCK_BLOOM_FILTER = FALSE TABLET_SIZE = 134217728 PCTFREE = 0
select c0,c1 FROM t1;
+----+----+
| c0 | c1 |
+----+----+
|  1 |  2 |
| 11 | 22 |
+----+----+
insert into t1(c0) values(111),(1111);
insert into t1(c1) values(222),(2222);
select c0,c1 FROM t1;
+------+------+
| c0   | c1   |
+------+------+
|    1 |    2 |
|   11 |   22 |
|  111 | 9999 |
| 1111 | 9999 |
|  999 |  222 |
|  999 | 2222 |
+------+------+
drop table t1;
CREATE TABLE t1(c0 INT default null,
c1 FLOAT default null,
c2 DOUBLE);
insert into t1 values(0,1.5,1.12),(-1,2.5,2.23),(5,3.5,3.34),(4,4.5,4.45),(3,5.15,5.56);
alter table t1 modify c0 int default 100 not null,modify c1 float default 100 not null;
show create table t1;
Table	Create Table
t1	CREATE TABLE `t1` (
  `c0` int(11) NOT NULL DEFAULT '100',
  `c1` float NOT NULL DEFAULT '100',
  `c2` double DEFAULT NULL
) ORGANIZATION INDEX DEFAULT CHARSET = utf8mb4 ROW_FORMAT = DYNAMIC COMPRESSION = 'zstd_1.3.8' REPLICA_NUM = 1 BLOCK_SIZE = 16384 USE_BLOOM_FILTER = FALSE ENABLE_MACRO_BLOCK_BLOOM_FILTER = FALSE TABLET_SIZE = 134217728 PCTFREE = 0
select c0,c1,c2 FROM t1 ORDER by 1;
+----+------+------+
| c0 | c1   | c2   |
+----+------+------+
| -1 |  2.5 | 2.23 |
|  0 |  1.5 | 1.12 |
|  3 | 5.15 | 5.56 |
|  4 |  4.5 | 4.45 |
|  5 |  3.5 | 3.34 |
+----+------+------+
insert into t1(c2) values(5.66),(6.55);
select c0,c1,c2 FROM t1 ORDER by 1;
+-----+------+------+
| c0  | c1   | c2   |
+-----+------+------+
|  -1 |  2.5 | 2.23 |
|   0 |  1.5 | 1.12 |
|   3 | 5.15 | 5.56 |
|   4 |  4.5 | 4.45 |
|   5 |  3.5 | 3.34 |
| 100 |  100 | 5.66 |
| 100 |  100 | 6.55 |
+-----+------+------+
drop table t1;
create table t1(c0 varchar(10) default null,
c1 varchar(10));
alter table t1 modify c0 char(10) default 'AAA' not null;
alter table t1 modify c0 int default 123 not null;
drop table t1;
create table t1(c0 int default null,
c1 int);
insert into t1 values(1,0),(101,22),(66,999);
alter table t1 modify c0 char(10) default '00' not null;
select c0,c1 from t1 order by 1;
+-----+------+
| c0  | c1   |
+-----+------+
| 1   |    0 |
| 101 |   22 |
| 66  |  999 |
+-----+------+
insert into t1(c1) values(22),(333),(4444);
select c0,c1 from t1 order by 1;
+-----+------+
| c0  | c1   |
+-----+------+
| 00  |   22 |
| 00  |  333 |
| 00  | 4444 |
| 1   |    0 |
| 101 |   22 |
| 66  |  999 |
+-----+------+
drop table t1;
create table t1(c0 int default null,
c1 int);
insert into t1 values(1,0),(101,22),(66,999);
alter table t1 modify c0 char(10);
alter table t1 modify c0 char(10) default '00' not null;
select c0,c1 from t1 order by 1;
+-----+------+
| c0  | c1   |
+-----+------+
| 1   |    0 |
| 101 |   22 |
| 66  |  999 |
+-----+------+
insert into t1(c1) values(22),(333),(4444);
select c0,c1 from t1 order by 1;
+-----+------+
| c0  | c1   |
+-----+------+
| 00  |   22 |
| 00  |  333 |
| 00  | 4444 |
| 1   |    0 |
| 101 |   22 |
| 66  |  999 |
+-----+------+
drop table t1;
create table t1(c0 int default null,
c1 int);
insert into t1 values(1,0),(101,22),(66,999);
alter table t1 modify c0 int default '00' not null;
alter table t1 modify c0 char(10) default '00' not null;
select c0,c1 from t1 order by 1;
+-----+------+
| c0  | c1   |
+-----+------+
| 1   |    0 |
| 101 |   22 |
| 66  |  999 |
+-----+------+
insert into t1(c1) values(22),(333),(4444);
select c0,c1 from t1 order by 1;
+-----+------+
| c0  | c1   |
+-----+------+
| 00  |   22 |
| 00  |  333 |
| 00  | 4444 |
| 1   |    0 |
| 101 |   22 |
| 66  |  999 |
+-----+------+
drop table t1;
CREATE TABLE t1(c0 BINARY(10) default null,
c1 VARBINARY(10));
insert into t1 values(5.12,'% '),(10.23,0),('te st','te st'),(4.45,13),('$$',NULL),('',20),('中文','test');
alter table t1 modify c0 binary(10) default '待输入' not null;
select * FROM t1 ORDER by 1;
+------------+-------+
| c0         | c1    |
+------------+-------+
|            | 20    |
| $$         | NULL  |
| 10.23      | 0     |
| 4.45       | 13    |
| 5.12       | %     |
| te st      | te st |
| 中文       | test  |
+------------+-------+
insert into t1(c1) values(null),(1);
select * from t1 order by 1;
+------------+-------+
| c0         | c1    |
+------------+-------+
|            | 20    |
| $$         | NULL  |
| 10.23      | 0     |
| 4.45       | 13    |
| 5.12       | %     |
| te st      | te st |
| 中文       | test  |
| 待输入     | NULL  |
| 待输入     | 1     |
+------------+-------+
drop table t1;
create table t1(c0 int default null,
c1 float not null default 0);
alter table t1 modify c0 int default max(10) not null;
ERROR 42000: You have an error in your SQL syntax; check the manual that corresponds to your OceanBase version for the right syntax to use near 'max(10) not null' at line 1
set @p=1;
drop table t1;
create table t1(c0 int,
c1 float);
alter table t1 modify c0 int default @p not null;
ERROR 42000: You have an error in your SQL syntax; check the manual that corresponds to your OceanBase version for the right syntax to use near '@p not null' at line 1
drop table t1;
create table t1(c0 int,
c1 float not null default 0);
alter table t1 modify c0 int default (1+1) not null;
drop table t1;
create table t1(c1 float default null,c2 int);
alter table t1 modify c1 float default (RAND() * RAND()) not null;
drop table t1;
create table t1(c1 BINARY default null,c2 int);
alter table t1 modify c1 BINARY DEFAULT (UUID_TO_BIN(UUID())) not null;
ERROR 22001: Data too long for column
drop table t1;
create table t1(c1 DATE default null,c2 int);
alter table t1 modify c1 DATE  DEFAULT (CURRENT_DATE + INTERVAL 1 YEAR) not null;
drop table t1;
create table t1(c0 int as (2*c1),
c1 int,
c2 int
);
insert into t1(c1) values(0),(1),(2),(4),(6),(7);
alter table t1 modify c0 int default 100 not null;
ERROR HY000: 'Changing the STORED status' is not supported for generated columns.
show create table t1;
Table	Create Table
t1	CREATE TABLE `t1` (
  `c0` int(11) GENERATED ALWAYS AS ((2 * `c1`)) VIRTUAL,
  `c1` int(11) DEFAULT NULL,
  `c2` int(11) DEFAULT NULL
) ORGANIZATION INDEX DEFAULT CHARSET = utf8mb4 ROW_FORMAT = DYNAMIC COMPRESSION = 'zstd_1.3.8' REPLICA_NUM = 1 BLOCK_SIZE = 16384 USE_BLOOM_FILTER = FALSE ENABLE_MACRO_BLOCK_BLOOM_FILTER = FALSE TABLET_SIZE = 134217728 PCTFREE = 0
select * from t1;
+------+------+------+
| c0   | c1   | c2   |
+------+------+------+
|    0 |    0 | NULL |
|    2 |    1 | NULL |
|    4 |    2 | NULL |
|    8 |    4 | NULL |
|   12 |    6 | NULL |
|   14 |    7 | NULL |
+------+------+------+
drop table t1;
create table t1(c1 int,c2 varchar(10),c3 double);
alter table t1 modify c1 int default -1 not null;
alter table t1 modify c2 varchar(10) default '' not null;
alter table t1 modify c3 double default 0.00 not null;
desc t1;
+-------+-------------+------+-----+---------+-------+
| Field | Type        | Null | Key | Default | Extra |
+-------+-------------+------+-----+---------+-------+
| c1    | int(11)     | NO   |     | -1      |       |
| c2    | varchar(10) | NO   |     |         |       |
| c3    | double      | NO   |     | 0       |       |
+-------+-------------+------+-----+---------+-------+
insert into t1(c1,c2) values(1,'aa');
insert into t1(c3) values(9.99);
select * from t1;
+----+----+------+
| c1 | c2 | c3   |
+----+----+------+
|  1 | aa |    0 |
| -1 |    | 9.99 |
+----+----+------+
drop table t1;
create table t1(c1 BLOB default null,c2 int);
alter table t1 modify c1 BLOB  DEFAULT 'abc' not null;
drop table t1;
create table t1(c1 BLOB,c2 int);
alter table t1 modify c1 BLOB DEFAULT ('abc') not null;
drop table t1;
create table t1(c1 int default 1 not null);
insert into t1() values();
select * from t1;
+----+
| c1 |
+----+
|  1 |
+----+
insert into t1() values(default);
select * from t1;
+----+
| c1 |
+----+
|  1 |
|  1 |
+----+
drop table t1;
create table t1(c0 int default null,
c1 int);
insert into t1 values(1,1),(2,2),(3,3);
alter table t1 change c0 c0_1 int default 123 not null;
show create table t1;
Table	Create Table
t1	CREATE TABLE `t1` (
  `c0_1` int(11) NOT NULL DEFAULT '123',
  `c1` int(11) DEFAULT NULL
) ORGANIZATION INDEX DEFAULT CHARSET = utf8mb4 ROW_FORMAT = DYNAMIC COMPRESSION = 'zstd_1.3.8' REPLICA_NUM = 1 BLOCK_SIZE = 16384 USE_BLOOM_FILTER = FALSE ENABLE_MACRO_BLOCK_BLOOM_FILTER = FALSE TABLET_SIZE = 134217728 PCTFREE = 0
drop table t1;
create table t1(c0 int default null,
c1 int);
insert into t1 values(1,1),(2,2),(3,3);
alter table t1 change c0 c0_1 int default null;
alter table t1 modify c0_1 int default '123' not null;
show create table t1;
Table	Create Table
t1	CREATE TABLE `t1` (
  `c0_1` int(11) NOT NULL DEFAULT '123',
  `c1` int(11) DEFAULT NULL
) ORGANIZATION INDEX DEFAULT CHARSET = utf8mb4 ROW_FORMAT = DYNAMIC COMPRESSION = 'zstd_1.3.8' REPLICA_NUM = 1 BLOCK_SIZE = 16384 USE_BLOOM_FILTER = FALSE ENABLE_MACRO_BLOCK_BLOOM_FILTER = FALSE TABLET_SIZE = 134217728 PCTFREE = 0
delete from t1 where c1 = 3;
update t1 set c0_1 = 0 where c1 = 2;
select * from t1;
+------+------+
| c0_1 | c1   |
+------+------+
|    1 |    1 |
|    0 |    2 |
+------+------+
drop table t1;
create table t1(c0 double default null,
c1 float);
insert into t1 values(1,1),(2,2),(3,3);
alter table t1 modify c0 double default 99.99 not null;
show create table t1;
Table	Create Table
t1	CREATE TABLE `t1` (
  `c0` double NOT NULL DEFAULT '99.99',
  `c1` float DEFAULT NULL
) ORGANIZATION INDEX DEFAULT CHARSET = utf8mb4 ROW_FORMAT = DYNAMIC COMPRESSION = 'zstd_1.3.8' REPLICA_NUM = 1 BLOCK_SIZE = 16384 USE_BLOOM_FILTER = FALSE ENABLE_MACRO_BLOCK_BLOOM_FILTER = FALSE TABLET_SIZE = 134217728 PCTFREE = 0
alter table t1 drop c0;
show create table t1;
Table	Create Table
t1	CREATE TABLE `t1` (
  `c1` float DEFAULT NULL
) ORGANIZATION INDEX DEFAULT CHARSET = utf8mb4 ROW_FORMAT = DYNAMIC COMPRESSION = 'zstd_1.3.8' REPLICA_NUM = 1 BLOCK_SIZE = 16384 USE_BLOOM_FILTER = FALSE ENABLE_MACRO_BLOCK_BLOOM_FILTER = FALSE TABLET_SIZE = 134217728 PCTFREE = 0
insert into t1 values(22),(33);
select * from t1;
+------+
| c1   |
+------+
|    1 |
|    2 |
|    3 |
|   22 |
|   33 |
+------+
drop table t1;
create table t1(c0 int,
c1 int);
insert into t1 values(1,1),(2,4),(3,8);
alter table t1 modify c0 int default 99 not null comment '第一列';
show create table t1;
Table	Create Table
t1	CREATE TABLE `t1` (
  `c0` int(11) NOT NULL DEFAULT '99' COMMENT '第一列',
  `c1` int(11) DEFAULT NULL
) ORGANIZATION INDEX DEFAULT CHARSET = utf8mb4 ROW_FORMAT = DYNAMIC COMPRESSION = 'zstd_1.3.8' REPLICA_NUM = 1 BLOCK_SIZE = 16384 USE_BLOOM_FILTER = FALSE ENABLE_MACRO_BLOCK_BLOOM_FILTER = FALSE TABLET_SIZE = 134217728 PCTFREE = 0
insert into t1(c1) values(16),(32);
select * from t1;
+----+------+
| c0 | c1   |
+----+------+
|  1 |    1 |
|  2 |    4 |
|  3 |    8 |
| 99 |   16 |
| 99 |   32 |
+----+------+
delete from t1 where c1 < 10;
select * from t1;
+----+------+
| c0 | c1   |
+----+------+
| 99 |   16 |
| 99 |   32 |
+----+------+
drop table t1;
create table t1(c0 int,
c1 int);
insert into t1 values(1,1),(2,4),(3,8);
alter table t1 modify c0 int default 99 not null after c1;
show create table t1;
Table	Create Table
t1	CREATE TABLE `t1` (
  `c1` int(11) DEFAULT NULL,
  `c0` int(11) NOT NULL DEFAULT '99'
) ORGANIZATION INDEX DEFAULT CHARSET = utf8mb4 ROW_FORMAT = DYNAMIC COMPRESSION = 'zstd_1.3.8' REPLICA_NUM = 1 BLOCK_SIZE = 16384 USE_BLOOM_FILTER = FALSE ENABLE_MACRO_BLOCK_BLOOM_FILTER = FALSE TABLET_SIZE = 134217728 PCTFREE = 0
insert into t1(c1) values(16),(32);
select * from t1;
+------+----+
| c1   | c0 |
+------+----+
|    1 |  1 |
|    4 |  2 |
|    8 |  3 |
|   16 | 99 |
|   32 | 99 |
+------+----+
delete from t1 where c1 < 10;
select * from t1;
+------+----+
| c1   | c0 |
+------+----+
|   16 | 99 |
|   32 | 99 |
+------+----+
drop table t1;
create table t1(c0 int,
c1 int);
insert into t1 values(1,1),(2,4),(3,8);
alter table t1 modify c0 int default 99 not null;
alter table t1 modify c0 int default 99 not null after c1;
show create table t1;
Table	Create Table
t1	CREATE TABLE `t1` (
  `c1` int(11) DEFAULT NULL,
  `c0` int(11) NOT NULL DEFAULT '99'
) ORGANIZATION INDEX DEFAULT CHARSET = utf8mb4 ROW_FORMAT = DYNAMIC COMPRESSION = 'zstd_1.3.8' REPLICA_NUM = 1 BLOCK_SIZE = 16384 USE_BLOOM_FILTER = FALSE ENABLE_MACRO_BLOCK_BLOOM_FILTER = FALSE TABLET_SIZE = 134217728 PCTFREE = 0
insert into t1(c1) values(16),(32);
select * from t1;
+------+----+
| c1   | c0 |
+------+----+
|    1 |  1 |
|    4 |  2 |
|    8 |  3 |
|   16 | 99 |
|   32 | 99 |
+------+----+
delete from t1 where c1 < 10;
select * from t1;
+------+----+
| c1   | c0 |
+------+----+
|   16 | 99 |
|   32 | 99 |
+------+----+
drop database if exists yx5493;
PURGE RECYCLEBIN;
