# 环境清理
purge recyclebin;
result_format: 4
drop DATABASE IF EXISTS yx5493;
CREATE DATABASE IF NOT EXISTS yx5493;
USE yx5493;
drop table t1;
create table t1(
c0 INT default null,
c1 int default null);
insert into t1 values(1,2),(11,22);
alter table t1 modify c0 int default 999 not null;
alter table t1 change c1 c1 int default 9999 not null;
show create table t1;
Table	Create Table
t1	CREATE TABLE `t1` (
  `c0` int(11) NOT NULL DEFAULT '999',
  `c1` int(11) NOT NULL DEFAULT '9999'
) ORGANIZATION INDEX DEFAULT CHARSET = utf8mb4 ROW_FORMAT = DYNAMIC COMPRESSION = 'zstd_1.3.8' REPLICA_NUM = 1 BLOCK_SIZE = 16384 USE_BLOOM_FILTER = FALSE ENABLE_MACRO_BLOCK_BLOOM_FILTER = FALSE TABLET_SIZE = 134217728 PCTFREE = 0
select c0,c1 FROM t1;
+----+----+
| c0 | c1 |
+----+----+
|  1 |  2 |
| 11 | 22 |
+----+----+
insert into t1(c0) values(111),(1111);
insert into t1(c1) values(222),(2222);
select c0,c1 FROM t1;
+------+------+
| c0   | c1   |
+------+------+
|    1 |    2 |
|   11 |   22 |
|  111 | 9999 |
| 1111 | 9999 |
|  999 |  222 |
|  999 | 2222 |
+------+------+
delete from t1 where c0 = 1;
delete from t1 where c1 = 22;
select c0,c1 FROM t1;
+------+------+
| c0   | c1   |
+------+------+
|  111 | 9999 |
| 1111 | 9999 |
|  999 |  222 |
|  999 | 2222 |
+------+------+
update t1 set c0 = 11111 where c1 = 222;
update t1 set c1 = 222 where c0 = 111;
select c0,c1 FROM t1;
+-------+------+
| c0    | c1   |
+-------+------+
|   111 |  222 |
|  1111 | 9999 |
| 11111 |  222 |
|   999 | 2222 |
+-------+------+
alter table t1 modify c0 int null;
alter table t1 modify c1 int null;
show create table t1;
Table	Create Table
t1	CREATE TABLE `t1` (
  `c0` int(11) DEFAULT NULL,
  `c1` int(11) DEFAULT NULL
) ORGANIZATION INDEX DEFAULT CHARSET = utf8mb4 ROW_FORMAT = DYNAMIC COMPRESSION = 'zstd_1.3.8' REPLICA_NUM = 1 BLOCK_SIZE = 16384 USE_BLOOM_FILTER = FALSE ENABLE_MACRO_BLOCK_BLOOM_FILTER = FALSE TABLET_SIZE = 134217728 PCTFREE = 0
select c0,c1 FROM t1;
+-------+------+
| c0    | c1   |
+-------+------+
|   111 |  222 |
|  1111 | 9999 |
| 11111 |  222 |
|   999 | 2222 |
+-------+------+
drop table t1;
create table t1(
c0 integer default null,
c1 FLOAT);
insert into t1 values(1,2),(3,4);
alter table t1 modify c0 integer(10) default 100 not null;
show create table t1;
Table	Create Table
t1	CREATE TABLE `t1` (
  `c0` int(10) NOT NULL DEFAULT '100',
  `c1` float DEFAULT NULL
) ORGANIZATION INDEX DEFAULT CHARSET = utf8mb4 ROW_FORMAT = DYNAMIC COMPRESSION = 'zstd_1.3.8' REPLICA_NUM = 1 BLOCK_SIZE = 16384 USE_BLOOM_FILTER = FALSE ENABLE_MACRO_BLOCK_BLOOM_FILTER = FALSE TABLET_SIZE = 134217728 PCTFREE = 0
select c0,c1 FROM t1 ORDER by 1;
+----+------+
| c0 | c1   |
+----+------+
|  1 |    2 |
|  3 |    4 |
+----+------+
insert into t1(c1) values(5),(6);
select c0,c1 FROM t1 ORDER by 1;
+-----+------+
| c0  | c1   |
+-----+------+
|   1 |    2 |
|   3 |    4 |
| 100 |    5 |
| 100 |    6 |
+-----+------+
drop table t1;
create table t1(
c0 bigint default null,
c1 FLOAT);
insert into t1 values(12345678901,2),(98765432101,4);
alter table t1 modify c0 bigint default 112233445566 not null;
show create table t1;
Table	Create Table
t1	CREATE TABLE `t1` (
  `c0` bigint(20) NOT NULL DEFAULT '112233445566',
  `c1` float DEFAULT NULL
) ORGANIZATION INDEX DEFAULT CHARSET = utf8mb4 ROW_FORMAT = DYNAMIC COMPRESSION = 'zstd_1.3.8' REPLICA_NUM = 1 BLOCK_SIZE = 16384 USE_BLOOM_FILTER = FALSE ENABLE_MACRO_BLOCK_BLOOM_FILTER = FALSE TABLET_SIZE = 134217728 PCTFREE = 0
select c0,c1 FROM t1 ORDER by 1;
+-------------+------+
| c0          | c1   |
+-------------+------+
| 12345678901 |    2 |
| 98765432101 |    4 |
+-------------+------+
insert into t1(c1) values(5),(6);
select c0,c1 FROM t1 ORDER by 1;
+--------------+------+
| c0           | c1   |
+--------------+------+
|  12345678901 |    2 |
|  98765432101 |    4 |
| 112233445566 |    5 |
| 112233445566 |    6 |
+--------------+------+
drop table t1;
create table t1(
c0 SMALLINT default null,
c1 int);
insert into t1 values(345,2),(444,5);
alter table t1 modify c0 SMALLINT default 0 not null;
show create table t1;
Table	Create Table
t1	CREATE TABLE `t1` (
  `c0` smallint(6) NOT NULL DEFAULT '0',
  `c1` int(11) DEFAULT NULL
) ORGANIZATION INDEX DEFAULT CHARSET = utf8mb4 ROW_FORMAT = DYNAMIC COMPRESSION = 'zstd_1.3.8' REPLICA_NUM = 1 BLOCK_SIZE = 16384 USE_BLOOM_FILTER = FALSE ENABLE_MACRO_BLOCK_BLOOM_FILTER = FALSE TABLET_SIZE = 134217728 PCTFREE = 0
select c0,c1 FROM t1 ORDER by 1;
+-----+------+
| c0  | c1   |
+-----+------+
| 345 |    2 |
| 444 |    5 |
+-----+------+
insert into t1(c1) values(55),(61);
select c0,c1 FROM t1 ORDER by 1;
+-----+------+
| c0  | c1   |
+-----+------+
|   0 |   55 |
|   0 |   61 |
| 345 |    2 |
| 444 |    5 |
+-----+------+
drop table t1;
create table t1(
c0 tinyint(3) zerofill default null,
c1 int);
insert into t1 values(0,128),(127,-128);
alter table t1 modify c0 tinyint zerofill default 0 not null;
show create table t1;
Table	Create Table
t1	CREATE TABLE `t1` (
  `c0` tinyint(3) unsigned zerofill NOT NULL DEFAULT '0',
  `c1` int(11) DEFAULT NULL
) ORGANIZATION INDEX DEFAULT CHARSET = utf8mb4 ROW_FORMAT = DYNAMIC COMPRESSION = 'zstd_1.3.8' REPLICA_NUM = 1 BLOCK_SIZE = 16384 USE_BLOOM_FILTER = FALSE ENABLE_MACRO_BLOCK_BLOOM_FILTER = FALSE TABLET_SIZE = 134217728 PCTFREE = 0
select c0,c1 FROM t1 ORDER by 1;
+-----+------+
| c0  | c1   |
+-----+------+
| 000 |  128 |
| 127 | -128 |
+-----+------+
insert into t1(c1) values(255),(0);
select c0,c1 FROM t1 ORDER by 1;
+-----+------+
| c0  | c1   |
+-----+------+
| 000 |  128 |
| 000 |  255 |
| 000 |    0 |
| 127 | -128 |
+-----+------+
drop table t1;
create table t1(
c0 mediumint default null,
c1 decimal default null,
c2 float default null,
c3 double default null,
c4 bit default null
);
insert into t1 values(11,222,3,4444,0),(22,111,3.35,4.4,1),(3,6666,7.77,8.9,0);
alter table t1 modify c0 mediumint default 9999 not null;
alter table t1 modify c1 decimal default 9999 not null;
alter table t1 modify c2 float default 9999 not null;
alter table t1 modify c3 double default 9999 not null;
alter table t1 modify c4 bit default 1 not null;
show create table t1;
Table	Create Table
t1	CREATE TABLE `t1` (
  `c0` mediumint(9) NOT NULL DEFAULT '9999',
  `c1` decimal(10,0) NOT NULL DEFAULT '9999',
  `c2` float NOT NULL DEFAULT '9999',
  `c3` double NOT NULL DEFAULT '9999',
  `c4` bit(1) NOT NULL DEFAULT b'1'
) ORGANIZATION INDEX DEFAULT CHARSET = utf8mb4 ROW_FORMAT = DYNAMIC COMPRESSION = 'zstd_1.3.8' REPLICA_NUM = 1 BLOCK_SIZE = 16384 USE_BLOOM_FILTER = FALSE ENABLE_MACRO_BLOCK_BLOOM_FILTER = FALSE TABLET_SIZE = 134217728 PCTFREE = 0
select * from t1;
+----+------+------+------+----+
| c0 | c1   | c2   | c3   | c4 |
+----+------+------+------+----+
| 11 |  222 |    3 | 4444 |    |
| 22 |  111 | 3.35 |  4.4 |   |
|  3 | 6666 | 7.77 |  8.9 |    |
+----+------+------+------+----+
insert into t1(c0) values(5555),(234);
insert into t1(c1) values(22),(33);
insert into t1(c2) values(1.23),(9.87);
insert into t1(c3) values(1.234567),(9.876543);
insert into t1(c4) values(''),(1),(0);
select * from t1;
+------+------+------+----------+----+
| c0   | c1   | c2   | c3       | c4 |
+------+------+------+----------+----+
|   11 |  222 |    3 |     4444 |    |
|   22 |  111 | 3.35 |      4.4 |   |
|    3 | 6666 | 7.77 |      8.9 |    |
| 5555 | 9999 | 9999 |     9999 |   |
|  234 | 9999 | 9999 |     9999 |   |
| 9999 |   22 | 9999 |     9999 |   |
| 9999 |   33 | 9999 |     9999 |   |
| 9999 | 9999 | 1.23 |     9999 |   |
| 9999 | 9999 | 9.87 |     9999 |   |
| 9999 | 9999 | 9999 | 1.234567 |   |
| 9999 | 9999 | 9999 | 9.876543 |   |
| 9999 | 9999 | 9999 |     9999 |    |
| 9999 | 9999 | 9999 |     9999 |   |
| 9999 | 9999 | 9999 |     9999 |    |
+------+------+------+----------+----+
drop table t1;
create table t1(
c0 date default null,
c1 datetime default null,
c2 timestamp default null,
c3 time default null,
c4 year default null
);
insert into t1 values('2022-06-23','2023-06-23 10:35:00','2023-06-23 10:35:00','10:35:00','2022'),

('2022-06-03','2023-06-11 10:35:00','2023-06-23 10:05:00','08:22:00','2000');
alter table t1 modify c0 date default '0000-00-00' not null;
alter table t1 modify c1 datetime default '0000-00-00 00:00:00' not null;
alter table t1 modify c2 timestamp default '0000-00-00 00:00:00' not null;
alter table t1 modify c3 time default '00:00:00' not null;
alter table t1 modify c4 year default '0000' not null;
show create table t1;
Table	Create Table
t1	CREATE TABLE `t1` (
  `c0` date NOT NULL DEFAULT '0000-00-00',
  `c1` datetime NOT NULL DEFAULT '0000-00-00 00:00:00',
  `c2` timestamp NOT NULL DEFAULT '0000-00-00 00:00:00',
  `c3` time NOT NULL DEFAULT '00:00:00',
  `c4` year(4) NOT NULL DEFAULT '0000'
) ORGANIZATION INDEX DEFAULT CHARSET = utf8mb4 ROW_FORMAT = DYNAMIC COMPRESSION = 'zstd_1.3.8' REPLICA_NUM = 1 BLOCK_SIZE = 16384 USE_BLOOM_FILTER = FALSE ENABLE_MACRO_BLOCK_BLOOM_FILTER = FALSE TABLET_SIZE = 134217728 PCTFREE = 0
select * from t1;
+------------+---------------------+---------------------+----------+------+
| c0         | c1                  | c2                  | c3       | c4   |
+------------+---------------------+---------------------+----------+------+
| 2022-06-23 | 2023-06-23 10:35:00 | 2023-06-23 10:35:00 | 10:35:00 | 2022 |
| 2022-06-03 | 2023-06-11 10:35:00 | 2023-06-23 10:05:00 | 08:22:00 | 2000 |
+------------+---------------------+---------------------+----------+------+
insert into t1(c0) values('1997-01-01');
insert into t1(c1) values('1998-02-02 01:01:01');
insert into t1(c2) values('1999-03-03 01:02:03');
insert into t1(c3) values('12:12:00');
insert into t1(c4) values('2022');
select * from t1;
+------------+---------------------+---------------------+----------+------+
| c0         | c1                  | c2                  | c3       | c4   |
+------------+---------------------+---------------------+----------+------+
| 2022-06-23 | 2023-06-23 10:35:00 | 2023-06-23 10:35:00 | 10:35:00 | 2022 |
| 2022-06-03 | 2023-06-11 10:35:00 | 2023-06-23 10:05:00 | 08:22:00 | 2000 |
| 1997-01-01 | 0000-00-00 00:00:00 | 0000-00-00 00:00:00 | 00:00:00 | 0000 |
| 0000-00-00 | 1998-02-02 01:01:01 | 0000-00-00 00:00:00 | 00:00:00 | 0000 |
| 0000-00-00 | 0000-00-00 00:00:00 | 1999-03-03 01:02:03 | 00:00:00 | 0000 |
| 0000-00-00 | 0000-00-00 00:00:00 | 0000-00-00 00:00:00 | 12:12:00 | 0000 |
| 0000-00-00 | 0000-00-00 00:00:00 | 0000-00-00 00:00:00 | 00:00:00 | 2022 |
+------------+---------------------+---------------------+----------+------+
drop table t1;
create table t1(
c0 char default null,
c1 char(10) default null);
insert into t1 values('一','二'),('三','四');
alter table t1 modify c0 char default '十' not null;
alter table t1 change c1 c1 char(10) default 'ling' not null;
show create table t1;
Table	Create Table
t1	CREATE TABLE `t1` (
  `c0` char(1) NOT NULL DEFAULT '十',
  `c1` char(10) NOT NULL DEFAULT 'ling'
) ORGANIZATION INDEX DEFAULT CHARSET = utf8mb4 ROW_FORMAT = DYNAMIC COMPRESSION = 'zstd_1.3.8' REPLICA_NUM = 1 BLOCK_SIZE = 16384 USE_BLOOM_FILTER = FALSE ENABLE_MACRO_BLOCK_BLOOM_FILTER = FALSE TABLET_SIZE = 134217728 PCTFREE = 0
select c0,c1 from t1 order by 1;
+-----+-----+
| c0  | c1  |
+-----+-----+
| 一  | 二  |
| 三  | 四  |
+-----+-----+
insert into t1(c0) values('a'),('c');
insert into t1(c1) values('ac'),('bd');
select c0,c1 FROM t1 ORDER by 1;
+-----+------+
| c0  | c1   |
+-----+------+
| a   | ling |
| c   | ling |
| 一  | 二   |
| 三  | 四   |
| 十  | ac   |
| 十  | bd   |
+-----+------+
drop table t1;
create table t1(
c0 char(4) default null,
c1 varchar(4) default null,
c2 binary(10) default null,
c3 varbinary(10) default null
);
insert into t1 values('abc','abcd','100','111'),('ok','okay','onezero','oneone');
alter table t1 modify c0 char(4) default 'abc' not null;
alter table t1 modify c1 varchar(4) default 'abcd' not null;
alter table t1 modify c2 binary(10) default 'zero' not null;
alter table t1 modify c3 varbinary(10) default 'one' not null;
show create table t1;
Table	Create Table
t1	CREATE TABLE `t1` (
  `c0` char(4) NOT NULL DEFAULT 'abc',
  `c1` varchar(4) NOT NULL DEFAULT 'abcd',
  `c2` binary(10) NOT NULL DEFAULT 'zero',
  `c3` varbinary(10) NOT NULL DEFAULT 'one'
) ORGANIZATION INDEX DEFAULT CHARSET = utf8mb4 ROW_FORMAT = DYNAMIC COMPRESSION = 'zstd_1.3.8' REPLICA_NUM = 1 BLOCK_SIZE = 16384 USE_BLOOM_FILTER = FALSE ENABLE_MACRO_BLOCK_BLOOM_FILTER = FALSE TABLET_SIZE = 134217728 PCTFREE = 0
select * from t1;
+-----+------+------------+--------+
| c0  | c1   | c2         | c3     |
+-----+------+------------+--------+
| abc | abcd | 100        | 111    |
| ok  | okay | onezero    | oneone |
+-----+------+------------+--------+
insert into t1(c0) values('');
insert into t1(c1) values('');
insert into t1(c2) values('');
insert into t1(c3) values('');
select * from t1;
+-----+------+------------+--------+
| c0  | c1   | c2         | c3     |
+-----+------+------------+--------+
| abc | abcd | 100        | 111    |
| ok  | okay | onezero    | oneone |
|     | abcd | zero       | one    |
| abc |      | zero       | one    |
| abc | abcd |            | one    |
| abc | abcd | zero       |        |
+-----+------+------------+--------+
drop table t1;
create table t1(
c0 blob(11) default null,
c1 text(11) default null,
c2 enum('0','1','9999') default null,
c3 set('ok','no','fine') default null
);
insert into t1 values('123456','abcdef','0','ok'),('23456','abcd','1','no');
alter table t1 modify c2 enum('0','1','9999') default '9999' not null;
alter table t1 modify c3 set('ok','no','fine') default 'ok' not null;
show create table t1;
Table	Create Table
t1	CREATE TABLE `t1` (
  `c0` tinyblob DEFAULT NULL,
  `c1` tinytext DEFAULT NULL,
  `c2` enum('0','1','9999') NOT NULL DEFAULT '9999',
  `c3` set('ok','no','fine') NOT NULL DEFAULT 'ok'
) ORGANIZATION INDEX DEFAULT CHARSET = utf8mb4 ROW_FORMAT = DYNAMIC COMPRESSION = 'zstd_1.3.8' REPLICA_NUM = 1 BLOCK_SIZE = 16384 USE_BLOOM_FILTER = FALSE ENABLE_MACRO_BLOCK_BLOOM_FILTER = FALSE TABLET_SIZE = 134217728 PCTFREE = 0
drop database if exists yx5493;
PURGE RECYCLEBIN;
