# 环境清理
purge recyclebin;
result_format: 4
drop DATABASE IF EXISTS yx5493;
CREATE DATABASE IF NOT EXISTS yx5493;
USE yx5493;
drop table t1;
create table t1(c0 float,
c1 int default null,
c2 varchar(10));
insert into t1 values(1,0,'A'),(2,2,'B'),(3,4,'C'),(4,8,'D'),(5,16,'E'),(6,18,'F'),(7,20,'G');
set @@autocommit=0;
BEGIN;
ALTER TABLE t1 MODIFY c1 INT default 0 not null;
ROLLBACK;
show create table t1;
Table	Create Table
t1	CREATE TABLE `t1` (
  `c0` float DEFAULT NULL,
  `c1` int(11) NOT NULL DEFAULT '0',
  `c2` varchar(10) DEFAULT NULL
) ORGANIZATION INDEX DEFAULT CHARSET = utf8mb4 ROW_FORMAT = DYNAMIC COMPRESSION = 'zstd_1.3.8' REPLICA_NUM = 1 BLOCK_SIZE = 16384 USE_BLOOM_FILTER = FALSE ENABLE_MACRO_BLOCK_BLOOM_FILTER = FALSE TABLET_SIZE = 134217728 PCTFREE = 0
insert into t1 values(8,30,'G'),(9,30,'H'),(10,-50,'I'),(11,28,'G'),(12,40,'K'),(13,50,'L');
select * FROM t1 ORDER BY 1;
+------+-----+------+
| c0   | c1  | c2   |
+------+-----+------+
|    1 |   0 | A    |
|    2 |   2 | B    |
|    3 |   4 | C    |
|    4 |   8 | D    |
|    5 |  16 | E    |
|    6 |  18 | F    |
|    7 |  20 | G    |
|    8 |  30 | G    |
|    9 |  30 | H    |
|   10 | -50 | I    |
|   11 |  28 | G    |
|   12 |  40 | K    |
|   13 |  50 | L    |
+------+-----+------+
rollback;
select * from t1 order by 1;
+------+----+------+
| c0   | c1 | c2   |
+------+----+------+
|    1 |  0 | A    |
|    2 |  2 | B    |
|    3 |  4 | C    |
|    4 |  8 | D    |
|    5 | 16 | E    |
|    6 | 18 | F    |
|    7 | 20 | G    |
+------+----+------+
insert into t1(c0,c2) values(14,'M'),(15,'N');
select * FROM t1 ORDER BY 1;
+------+----+------+
| c0   | c1 | c2   |
+------+----+------+
|    1 |  0 | A    |
|    2 |  2 | B    |
|    3 |  4 | C    |
|    4 |  8 | D    |
|    5 | 16 | E    |
|    6 | 18 | F    |
|    7 | 20 | G    |
|   14 |  0 | M    |
|   15 |  0 | N    |
+------+----+------+
rollback;
select * from t1 order by 1;
+------+----+------+
| c0   | c1 | c2   |
+------+----+------+
|    1 |  0 | A    |
|    2 |  2 | B    |
|    3 |  4 | C    |
|    4 |  8 | D    |
|    5 | 16 | E    |
|    6 | 18 | F    |
|    7 | 20 | G    |
+------+----+------+
commit;
drop table t1;
CREATE TABLE t1(c0 FLOAT,
c1 INT,
c2 VARCHAR(10) default null);
insert into t1 values(1,0,'A'),(2,2,'B'),(3,4,'C'),(4,8,'D'),(5,16,'E'),(6,18,'F'),(7,20,'G');
BEGIN;
insert into t1 values(8,21,'H');
SAVEPOINT s1;
ALTER TABLE t1 MODIFY c2 varchar(10) default '空' not null;
SAVEPOINT s2;
insert into t1(c0) values(9),(10),(11);
select * FROM t1 ORDER BY 1;
+------+------+-----+
| c0   | c1   | c2  |
+------+------+-----+
|    1 |    0 | A   |
|    2 |    2 | B   |
|    3 |    4 | C   |
|    4 |    8 | D   |
|    5 |   16 | E   |
|    6 |   18 | F   |
|    7 |   20 | G   |
|    8 |   21 | H   |
|    9 | NULL | 空  |
|   10 | NULL | 空  |
|   11 | NULL | 空  |
+------+------+-----+
ROLLBACK TO s1;
ERROR 42000: savepoint does not exist
ROLLBACK TO s2;
select * FROM t1 ORDER BY 1;
+------+------+----+
| c0   | c1   | c2 |
+------+------+----+
|    1 |    0 | A  |
|    2 |    2 | B  |
|    3 |    4 | C  |
|    4 |    8 | D  |
|    5 |   16 | E  |
|    6 |   18 | F  |
|    7 |   20 | G  |
|    8 |   21 | H  |
+------+------+----+
SHOW CREATE TABLE t1;
Table	Create Table
t1	CREATE TABLE `t1` (
  `c0` float DEFAULT NULL,
  `c1` int(11) DEFAULT NULL,
  `c2` varchar(10) NOT NULL DEFAULT '空'
) ORGANIZATION INDEX DEFAULT CHARSET = utf8mb4 ROW_FORMAT = DYNAMIC COMPRESSION = 'zstd_1.3.8' REPLICA_NUM = 1 BLOCK_SIZE = 16384 USE_BLOOM_FILTER = FALSE ENABLE_MACRO_BLOCK_BLOOM_FILTER = FALSE TABLET_SIZE = 134217728 PCTFREE = 0
COMMIT;
drop table t1;
CREATE TABLE t1(c0 FLOAT,
c1 INT,
c2 VARCHAR(10) default null);
insert into t1 values(1,0,'A'),(2,2,'B'),(3,4,'C'),(4,8,'D'),(5,16,'E'),(6,18,'F'),(7,20,'G');
ALTER TABLE t1 MODIFY c2 varchar(10) default '空' not null;
BEGIN;
insert into t1 values(8,21,'H');
SAVEPOINT s1;
insert into t1(c0) values(9),(10),(11);
select * FROM t1 ORDER BY 1;
+------+------+-----+
| c0   | c1   | c2  |
+------+------+-----+
|    1 |    0 | A   |
|    2 |    2 | B   |
|    3 |    4 | C   |
|    4 |    8 | D   |
|    5 |   16 | E   |
|    6 |   18 | F   |
|    7 |   20 | G   |
|    8 |   21 | H   |
|    9 | NULL | 空  |
|   10 | NULL | 空  |
|   11 | NULL | 空  |
+------+------+-----+
SAVEPOINT s2;
rollback to s1;
select * from t1 order by 1;
+------+------+----+
| c0   | c1   | c2 |
+------+------+----+
|    1 |    0 | A  |
|    2 |    2 | B  |
|    3 |    4 | C  |
|    4 |    8 | D  |
|    5 |   16 | E  |
|    6 |   18 | F  |
|    7 |   20 | G  |
|    8 |   21 | H  |
+------+------+----+
commit;
insert into t1(c0) values(15),(16);
select * FROM t1 ORDER BY 1;
+------+------+-----+
| c0   | c1   | c2  |
+------+------+-----+
|    1 |    0 | A   |
|    2 |    2 | B   |
|    3 |    4 | C   |
|    4 |    8 | D   |
|    5 |   16 | E   |
|    6 |   18 | F   |
|    7 |   20 | G   |
|    8 |   21 | H   |
|   15 | NULL | 空  |
|   16 | NULL | 空  |
+------+------+-----+
drop table t1;
CREATE TABLE t1(c0 FLOAT(5,0),
c1 INT default null,
c2 VARCHAR(10))
PARTITION BY RANGE(c1)
(PARTITION p1 values LESS THAN(15),
PARTITION p2 values LESS THAN(25),
PARTITION p3 values LESS THAN(35)
);
insert into t1 values(1,0,'A'),(2,2,'B'),(3,4,'C'),(4,8,'D'),(5,16,'E'),(6,18,'F'),(7,20,'G');
ALTER TABLE t1 MODIFY c1 INT default -1 not null;
SHOW CREATE TABLE t1;
Table	Create Table
t1	CREATE TABLE `t1` (
  `c0` float(5,0) DEFAULT NULL,
  `c1` int(11) NOT NULL DEFAULT '-1',
  `c2` varchar(10) DEFAULT NULL
) ORGANIZATION INDEX DEFAULT CHARSET = utf8mb4 ROW_FORMAT = DYNAMIC COMPRESSION = 'zstd_1.3.8' REPLICA_NUM = 1 BLOCK_SIZE = 16384 USE_BLOOM_FILTER = FALSE ENABLE_MACRO_BLOCK_BLOOM_FILTER = FALSE TABLET_SIZE = 134217728 PCTFREE = 0
 partition by range(c1)
(partition `p1` values less than (15),
partition `p2` values less than (25),
partition `p3` values less than (35))
BEGIN;
SAVEPOINT s1;
insert into t1 values(9,34,'H'),(10,22,'I'),(11,28,'J'),(12,-50,'K'),(13,31,'L'),(14,1,'M');
SAVEPOINT s2;
insert into t1(c0) values(15),(16);
ROLLBACK TO s2;
select * FROM t1 ORDER BY 1;
+------+-----+------+
| c0   | c1  | c2   |
+------+-----+------+
|    1 |   0 | A    |
|    2 |   2 | B    |
|    3 |   4 | C    |
|    4 |   8 | D    |
|    5 |  16 | E    |
|    6 |  18 | F    |
|    7 |  20 | G    |
|    9 |  34 | H    |
|   10 |  22 | I    |
|   11 |  28 | J    |
|   12 | -50 | K    |
|   13 |  31 | L    |
|   14 |   1 | M    |
+------+-----+------+
COMMIT;
insert into t1(c0) values(15),(16);
select * from t1 order by 1;
+------+-----+------+
| c0   | c1  | c2   |
+------+-----+------+
|    1 |   0 | A    |
|    2 |   2 | B    |
|    3 |   4 | C    |
|    4 |   8 | D    |
|    5 |  16 | E    |
|    6 |  18 | F    |
|    7 |  20 | G    |
|    9 |  34 | H    |
|   10 |  22 | I    |
|   11 |  28 | J    |
|   12 | -50 | K    |
|   13 |  31 | L    |
|   14 |   1 | M    |
|   15 |  -1 | NULL |
|   16 |  -1 | NULL |
+------+-----+------+
SET @@AUTOCOMMIT=1;
drop table t1;
drop table if exists t2;
Warnings:
Note	1051	Unknown table 'yx5493.t2'
create table t1(c1 int,
c2 int);
create table t2(c1 int,
c2 int);
drop trigger if exists trg_insert;
Warnings:
Note	1360	Trigger does not exist
create trigger trg_insert 
after insert on t1
for each ROW
insert into t2
values(new.c1,2*new.c2);
insert into t1 values(1,2);
select * from t1;
+------+------+
| c1   | c2   |
+------+------+
|    1 |    2 |
+------+------+
select * from t2;
+------+------+
| c1   | c2   |
+------+------+
|    1 |    4 |
+------+------+
alter table t2 modify c2 int default 0 not null;
show create table t2;
Table	Create Table
t2	CREATE TABLE `t2` (
  `c1` int(11) DEFAULT NULL,
  `c2` int(11) NOT NULL DEFAULT '0'
) ORGANIZATION INDEX DEFAULT CHARSET = utf8mb4 ROW_FORMAT = DYNAMIC COMPRESSION = 'zstd_1.3.8' REPLICA_NUM = 1 BLOCK_SIZE = 16384 USE_BLOOM_FILTER = FALSE ENABLE_MACRO_BLOCK_BLOOM_FILTER = FALSE TABLET_SIZE = 134217728 PCTFREE = 0
insert into t1 values(10,100);
insert into t2(c1) values (100),(1000);
select * from t1;
+------+------+
| c1   | c2   |
+------+------+
|    1 |    2 |
|   10 |  100 |
+------+------+
select * from t2;
+------+-----+
| c1   | c2  |
+------+-----+
|    1 |   4 |
|   10 | 200 |
|  100 |   0 |
| 1000 |   0 |
+------+-----+
alter table t1 modify c1 int default 1 not null;
insert into t2 values(100,1000);
insert into t1(c2) values(3),(4);
select * from t1;
+----+------+
| c1 | c2   |
+----+------+
|  1 |    2 |
| 10 |  100 |
|  1 |    3 |
|  1 |    4 |
+----+------+
select * from t2;
+------+------+
| c1   | c2   |
+------+------+
|    1 |    4 |
|   10 |  200 |
|  100 |    0 |
| 1000 |    0 |
|  100 | 1000 |
|    1 |    6 |
|    1 |    8 |
+------+------+
drop table if exists t2;
create table t2(c0 int,
c1 int);
insert into t2 values(1,0),(2,2),(3,4),(4,8),(5,16),(6,18),(7,20);
drop table t1;
CREATE TABLE t1(c0 INT,
c1 INT,
c2 VARCHAR(10));
insert into t1 values(1,0,'A'),(2,2,'B'),(3,4,'C'),(4,8,'D'),(5,16,'E'),(6,18,'F'),(7,20,'G');
drop trigger if exists trg_update;
Warnings:
Note	1360	Trigger does not exist
create trigger trg_update before update on t2 for each row
begin
	declare c int;
	select count(c0) into c from t1;
	
	if c >= 20 then
		update t1 set c1=OLD.c0 where c0=OLD.c0;
	else
		insert into t1 values(OLD.c0,null,'AA');
	end if;
end
/
update t2 set c1 = 1 where c1 = 0;
select * from t2 order by 1;
+------+------+
| c0   | c1   |
+------+------+
|    1 |    1 |
|    2 |    2 |
|    3 |    4 |
|    4 |    8 |
|    5 |   16 |
|    6 |   18 |
|    7 |   20 |
+------+------+
select * from t1 order by 1;
+------+------+------+
| c0   | c1   | c2   |
+------+------+------+
|    1 |    0 | A    |
|    1 | NULL | AA   |
|    2 |    2 | B    |
|    3 |    4 | C    |
|    4 |    8 | D    |
|    5 |   16 | E    |
|    6 |   18 | F    |
|    7 |   20 | G    |
+------+------+------+
alter table t1 modify c0 int default 0 not null;
alter table t2 modify c0 int default 0 not null;
insert into t1(c1) values(24);
insert into t2(c1) values(24);
select * from t2 order by 1;
+----+------+
| c0 | c1   |
+----+------+
|  0 |   24 |
|  1 |    1 |
|  2 |    2 |
|  3 |    4 |
|  4 |    8 |
|  5 |   16 |
|  6 |   18 |
|  7 |   20 |
+----+------+
select * from t1 order by 1;
+----+------+------+
| c0 | c1   | c2   |
+----+------+------+
|  0 |   24 | NULL |
|  1 |    0 | A    |
|  1 | NULL | AA   |
|  2 |    2 | B    |
|  3 |    4 | C    |
|  4 |    8 | D    |
|  5 |   16 | E    |
|  6 |   18 | F    |
|  7 |   20 | G    |
+----+------+------+
drop table if exists t2;
create table t2(c0 int,
c1 int);
insert into t2 values(1,0),(2,2),(3,4),(4,8),(5,16),(6,18),(7,20);
drop table t1;
CREATE TABLE t1(c0 INT,
c1 INT,
c2 VARCHAR(10));
insert into t1 values(1,0,'A'),(2,2,'B'),(3,4,'C'),(4,8,'D'),(5,16,'E'),(6,18,'F'),(7,20,'G');
drop trigger if exists trg_delete;
Warnings:
Note	1360	Trigger does not exist
create trigger trg_delete before delete on t2 for each row
delete from t1 where c0=old.c0;
delete from t2 where c0 = 2;
select * from t2 order by 1;
+------+------+
| c0   | c1   |
+------+------+
|    1 |    0 |
|    3 |    4 |
|    4 |    8 |
|    5 |   16 |
|    6 |   18 |
|    7 |   20 |
+------+------+
select * from t1 order by 1;
+------+------+------+
| c0   | c1   | c2   |
+------+------+------+
|    1 |    0 | A    |
|    3 |    4 | C    |
|    4 |    8 | D    |
|    5 |   16 | E    |
|    6 |   18 | F    |
|    7 |   20 | G    |
+------+------+------+
alter table t1 modify c0 int default 0 not null;
alter table t2 modify c0 int default 0 not null;
insert into t1(c1) values(24);
insert into t2(c1) values(24);
select * from t2 order by 1;
+----+------+
| c0 | c1   |
+----+------+
|  0 |   24 |
|  1 |    0 |
|  3 |    4 |
|  4 |    8 |
|  5 |   16 |
|  6 |   18 |
|  7 |   20 |
+----+------+
select * from t1 order by 1;
+----+------+------+
| c0 | c1   | c2   |
+----+------+------+
|  0 |   24 | NULL |
|  1 |    0 | A    |
|  3 |    4 | C    |
|  4 |    8 | D    |
|  5 |   16 | E    |
|  6 |   18 | F    |
|  7 |   20 | G    |
+----+------+------+
drop table t1;
drop table if exists t2;
create table t1(c1 int default null,
c2 int);
create table t2(c1 int default null,
c2 int);
drop trigger trg_insert;
create trigger trg_insert
after insert on t1
for each row
begin
alter table t2 modify c1 int default 9999 not null;
end;
/
drop trigger if exists trg_update;
Warnings:
Note	1360	Trigger does not exist
create trigger trg_update
after update on t1
for each row
begin
alter table t2 modify c1 int default 9999 not null;
end;
/
drop trigger if exists trg_delete;
Warnings:
Note	1360	Trigger does not exist
create trigger trg_delete
after delete on t1
for each row
begin
alter table t2 modify c1 int default 9999 not null;
end;
/
drop table t1;
create table t1(id int primary key auto_increment,
name varchar(20),
pwd int default '123456' not null,
verify varchar(20) default 'qwe123' not null);
insert into t1(id,name,pwd,verify) values(1,'people1',123456,'qwe123');
drop procedure if exists p1;
create procedure p1(n int)
begin
declare i int default(select count(*) from t1);
declare name varchar(20) default " ";
if i>=n then
select count(*) from t1;
else
while n > i DO
set i = i+1;
set name=(select concat('people',i));
insert into t1(name)values(name);
end while;
select * from t1;
end if;
END;
/
call p1(100);
+-----+-----------+--------+--------+
| id  | name      | pwd    | verify |
+-----+-----------+--------+--------+
|   1 | people1   | 123456 | qwe123 |
|   2 | people2   | 123456 | qwe123 |
|   3 | people3   | 123456 | qwe123 |
|   4 | people4   | 123456 | qwe123 |
|   5 | people5   | 123456 | qwe123 |
|   6 | people6   | 123456 | qwe123 |
|   7 | people7   | 123456 | qwe123 |
|   8 | people8   | 123456 | qwe123 |
|   9 | people9   | 123456 | qwe123 |
|  10 | people10  | 123456 | qwe123 |
|  11 | people11  | 123456 | qwe123 |
|  12 | people12  | 123456 | qwe123 |
|  13 | people13  | 123456 | qwe123 |
|  14 | people14  | 123456 | qwe123 |
|  15 | people15  | 123456 | qwe123 |
|  16 | people16  | 123456 | qwe123 |
|  17 | people17  | 123456 | qwe123 |
|  18 | people18  | 123456 | qwe123 |
|  19 | people19  | 123456 | qwe123 |
|  20 | people20  | 123456 | qwe123 |
|  21 | people21  | 123456 | qwe123 |
|  22 | people22  | 123456 | qwe123 |
|  23 | people23  | 123456 | qwe123 |
|  24 | people24  | 123456 | qwe123 |
|  25 | people25  | 123456 | qwe123 |
|  26 | people26  | 123456 | qwe123 |
|  27 | people27  | 123456 | qwe123 |
|  28 | people28  | 123456 | qwe123 |
|  29 | people29  | 123456 | qwe123 |
|  30 | people30  | 123456 | qwe123 |
|  31 | people31  | 123456 | qwe123 |
|  32 | people32  | 123456 | qwe123 |
|  33 | people33  | 123456 | qwe123 |
|  34 | people34  | 123456 | qwe123 |
|  35 | people35  | 123456 | qwe123 |
|  36 | people36  | 123456 | qwe123 |
|  37 | people37  | 123456 | qwe123 |
|  38 | people38  | 123456 | qwe123 |
|  39 | people39  | 123456 | qwe123 |
|  40 | people40  | 123456 | qwe123 |
|  41 | people41  | 123456 | qwe123 |
|  42 | people42  | 123456 | qwe123 |
|  43 | people43  | 123456 | qwe123 |
|  44 | people44  | 123456 | qwe123 |
|  45 | people45  | 123456 | qwe123 |
|  46 | people46  | 123456 | qwe123 |
|  47 | people47  | 123456 | qwe123 |
|  48 | people48  | 123456 | qwe123 |
|  49 | people49  | 123456 | qwe123 |
|  50 | people50  | 123456 | qwe123 |
|  51 | people51  | 123456 | qwe123 |
|  52 | people52  | 123456 | qwe123 |
|  53 | people53  | 123456 | qwe123 |
|  54 | people54  | 123456 | qwe123 |
|  55 | people55  | 123456 | qwe123 |
|  56 | people56  | 123456 | qwe123 |
|  57 | people57  | 123456 | qwe123 |
|  58 | people58  | 123456 | qwe123 |
|  59 | people59  | 123456 | qwe123 |
|  60 | people60  | 123456 | qwe123 |
|  61 | people61  | 123456 | qwe123 |
|  62 | people62  | 123456 | qwe123 |
|  63 | people63  | 123456 | qwe123 |
|  64 | people64  | 123456 | qwe123 |
|  65 | people65  | 123456 | qwe123 |
|  66 | people66  | 123456 | qwe123 |
|  67 | people67  | 123456 | qwe123 |
|  68 | people68  | 123456 | qwe123 |
|  69 | people69  | 123456 | qwe123 |
|  70 | people70  | 123456 | qwe123 |
|  71 | people71  | 123456 | qwe123 |
|  72 | people72  | 123456 | qwe123 |
|  73 | people73  | 123456 | qwe123 |
|  74 | people74  | 123456 | qwe123 |
|  75 | people75  | 123456 | qwe123 |
|  76 | people76  | 123456 | qwe123 |
|  77 | people77  | 123456 | qwe123 |
|  78 | people78  | 123456 | qwe123 |
|  79 | people79  | 123456 | qwe123 |
|  80 | people80  | 123456 | qwe123 |
|  81 | people81  | 123456 | qwe123 |
|  82 | people82  | 123456 | qwe123 |
|  83 | people83  | 123456 | qwe123 |
|  84 | people84  | 123456 | qwe123 |
|  85 | people85  | 123456 | qwe123 |
|  86 | people86  | 123456 | qwe123 |
|  87 | people87  | 123456 | qwe123 |
|  88 | people88  | 123456 | qwe123 |
|  89 | people89  | 123456 | qwe123 |
|  90 | people90  | 123456 | qwe123 |
|  91 | people91  | 123456 | qwe123 |
|  92 | people92  | 123456 | qwe123 |
|  93 | people93  | 123456 | qwe123 |
|  94 | people94  | 123456 | qwe123 |
|  95 | people95  | 123456 | qwe123 |
|  96 | people96  | 123456 | qwe123 |
|  97 | people97  | 123456 | qwe123 |
|  98 | people98  | 123456 | qwe123 |
|  99 | people99  | 123456 | qwe123 |
| 100 | people100 | 123456 | qwe123 |
+-----+-----------+--------+--------+
alter table t1 modify name varchar(20) default 'unknow' not null;
insert into t1(verify) values('qwe223'),('qwer23');
select * from t1;
+-----+-----------+--------+--------+
| id  | name      | pwd    | verify |
+-----+-----------+--------+--------+
|   1 | people1   | 123456 | qwe123 |
|   2 | people2   | 123456 | qwe123 |
|   3 | people3   | 123456 | qwe123 |
|   4 | people4   | 123456 | qwe123 |
|   5 | people5   | 123456 | qwe123 |
|   6 | people6   | 123456 | qwe123 |
|   7 | people7   | 123456 | qwe123 |
|   8 | people8   | 123456 | qwe123 |
|   9 | people9   | 123456 | qwe123 |
|  10 | people10  | 123456 | qwe123 |
|  11 | people11  | 123456 | qwe123 |
|  12 | people12  | 123456 | qwe123 |
|  13 | people13  | 123456 | qwe123 |
|  14 | people14  | 123456 | qwe123 |
|  15 | people15  | 123456 | qwe123 |
|  16 | people16  | 123456 | qwe123 |
|  17 | people17  | 123456 | qwe123 |
|  18 | people18  | 123456 | qwe123 |
|  19 | people19  | 123456 | qwe123 |
|  20 | people20  | 123456 | qwe123 |
|  21 | people21  | 123456 | qwe123 |
|  22 | people22  | 123456 | qwe123 |
|  23 | people23  | 123456 | qwe123 |
|  24 | people24  | 123456 | qwe123 |
|  25 | people25  | 123456 | qwe123 |
|  26 | people26  | 123456 | qwe123 |
|  27 | people27  | 123456 | qwe123 |
|  28 | people28  | 123456 | qwe123 |
|  29 | people29  | 123456 | qwe123 |
|  30 | people30  | 123456 | qwe123 |
|  31 | people31  | 123456 | qwe123 |
|  32 | people32  | 123456 | qwe123 |
|  33 | people33  | 123456 | qwe123 |
|  34 | people34  | 123456 | qwe123 |
|  35 | people35  | 123456 | qwe123 |
|  36 | people36  | 123456 | qwe123 |
|  37 | people37  | 123456 | qwe123 |
|  38 | people38  | 123456 | qwe123 |
|  39 | people39  | 123456 | qwe123 |
|  40 | people40  | 123456 | qwe123 |
|  41 | people41  | 123456 | qwe123 |
|  42 | people42  | 123456 | qwe123 |
|  43 | people43  | 123456 | qwe123 |
|  44 | people44  | 123456 | qwe123 |
|  45 | people45  | 123456 | qwe123 |
|  46 | people46  | 123456 | qwe123 |
|  47 | people47  | 123456 | qwe123 |
|  48 | people48  | 123456 | qwe123 |
|  49 | people49  | 123456 | qwe123 |
|  50 | people50  | 123456 | qwe123 |
|  51 | people51  | 123456 | qwe123 |
|  52 | people52  | 123456 | qwe123 |
|  53 | people53  | 123456 | qwe123 |
|  54 | people54  | 123456 | qwe123 |
|  55 | people55  | 123456 | qwe123 |
|  56 | people56  | 123456 | qwe123 |
|  57 | people57  | 123456 | qwe123 |
|  58 | people58  | 123456 | qwe123 |
|  59 | people59  | 123456 | qwe123 |
|  60 | people60  | 123456 | qwe123 |
|  61 | people61  | 123456 | qwe123 |
|  62 | people62  | 123456 | qwe123 |
|  63 | people63  | 123456 | qwe123 |
|  64 | people64  | 123456 | qwe123 |
|  65 | people65  | 123456 | qwe123 |
|  66 | people66  | 123456 | qwe123 |
|  67 | people67  | 123456 | qwe123 |
|  68 | people68  | 123456 | qwe123 |
|  69 | people69  | 123456 | qwe123 |
|  70 | people70  | 123456 | qwe123 |
|  71 | people71  | 123456 | qwe123 |
|  72 | people72  | 123456 | qwe123 |
|  73 | people73  | 123456 | qwe123 |
|  74 | people74  | 123456 | qwe123 |
|  75 | people75  | 123456 | qwe123 |
|  76 | people76  | 123456 | qwe123 |
|  77 | people77  | 123456 | qwe123 |
|  78 | people78  | 123456 | qwe123 |
|  79 | people79  | 123456 | qwe123 |
|  80 | people80  | 123456 | qwe123 |
|  81 | people81  | 123456 | qwe123 |
|  82 | people82  | 123456 | qwe123 |
|  83 | people83  | 123456 | qwe123 |
|  84 | people84  | 123456 | qwe123 |
|  85 | people85  | 123456 | qwe123 |
|  86 | people86  | 123456 | qwe123 |
|  87 | people87  | 123456 | qwe123 |
|  88 | people88  | 123456 | qwe123 |
|  89 | people89  | 123456 | qwe123 |
|  90 | people90  | 123456 | qwe123 |
|  91 | people91  | 123456 | qwe123 |
|  92 | people92  | 123456 | qwe123 |
|  93 | people93  | 123456 | qwe123 |
|  94 | people94  | 123456 | qwe123 |
|  95 | people95  | 123456 | qwe123 |
|  96 | people96  | 123456 | qwe123 |
|  97 | people97  | 123456 | qwe123 |
|  98 | people98  | 123456 | qwe123 |
|  99 | people99  | 123456 | qwe123 |
| 100 | people100 | 123456 | qwe123 |
| 101 | unknow    | 123456 | qwe223 |
| 102 | unknow    | 123456 | qwer23 |
+-----+-----------+--------+--------+
drop table t1;
create table t1(c0 int,
c1 varchar(10));
insert into t1 values(1,'A'),(2,'B'),(3,'C'),(4,'D'),(5,'E'),(6,'F'),(7,'G');
drop table if exists t2;
create table t2(c0 int,
c1 varchar(10));
insert into t2 values(10,'A'),(20,'B'),(30,'C'),(40,'D'),(50,'E'),(60,'F'),(70,'G');
drop function if exists f1;
create function f1(d int)
returns varchar(100)
begin
declare d1 int;
declare d2 int;
declare d3 varchar(100);
if d > 10 then
	insert into t1 values(d+100,'test1'),(d+200,'test2'),(d+300,'test3');
	insert into t2 values(d-50,'a'),(d-60,'b'),(d-70,'c');
elseif d <= 10 then
	insert into t1(c0) select c0 FROM t2 WHERE c0 <= 10;
	insert into t2(c1) select c1 FROM t1 WHERE c0 <= 10;
end if;

select count(c1) into d1 from t1;
select count(c0) into d2 from t2;

set d3 = concat('t1表执行函数后条目合计：',d1,',','t2表执行函数后条目合计：',d2);
return d3;

end
/
alter table t2 modify c0 int default 9999 not null;
alter table t1 modify c1 varchar(10) default 'unknow' not null;
select f1(11);
+-----------------------------------------------------------------------------+
| f1(11)                                                                      |
+-----------------------------------------------------------------------------+
| t1表执行函数后条目合计：10,t2表执行函数后条目合计：10                       |
+-----------------------------------------------------------------------------+
select * FROM t1;
+------+-------+
| c0   | c1    |
+------+-------+
|    1 | A     |
|    2 | B     |
|    3 | C     |
|    4 | D     |
|    5 | E     |
|    6 | F     |
|    7 | G     |
|  111 | test1 |
|  211 | test2 |
|  311 | test3 |
+------+-------+
select * FROM t2;
+-----+------+
| c0  | c1   |
+-----+------+
|  10 | A    |
|  20 | B    |
|  30 | C    |
|  40 | D    |
|  50 | E    |
|  60 | F    |
|  70 | G    |
| -39 | a    |
| -49 | b    |
| -59 | c    |
+-----+------+
select f1(9);
+-----------------------------------------------------------------------------+
| f1(9)                                                                       |
+-----------------------------------------------------------------------------+
| t1表执行函数后条目合计：14,t2表执行函数后条目合计：21                       |
+-----------------------------------------------------------------------------+
select * FROM t1;
+------+--------+
| c0   | c1     |
+------+--------+
|    1 | A      |
|    2 | B      |
|    3 | C      |
|    4 | D      |
|    5 | E      |
|    6 | F      |
|    7 | G      |
|  111 | test1  |
|  211 | test2  |
|  311 | test3  |
|   10 | unknow |
|  -39 | unknow |
|  -49 | unknow |
|  -59 | unknow |
+------+--------+
select * FROM t2;
+------+--------+
| c0   | c1     |
+------+--------+
|   10 | A      |
|   20 | B      |
|   30 | C      |
|   40 | D      |
|   50 | E      |
|   60 | F      |
|   70 | G      |
|  -39 | a      |
|  -49 | b      |
|  -59 | c      |
| 9999 | A      |
| 9999 | B      |
| 9999 | C      |
| 9999 | D      |
| 9999 | E      |
| 9999 | F      |
| 9999 | G      |
| 9999 | unknow |
| 9999 | unknow |
| 9999 | unknow |
| 9999 | unknow |
+------+--------+
DROP FUNCTION IF EXISTS f1;
drop database if exists yx5493;
PURGE RECYCLEBIN;
