set ob_trx_timeout = 10000000000;
set ob_query_timeout = 10000000000;
drop database IF EXISTS nxa;
create database nxa  character set utf8;
use nxa;
set ob_enable_plan_cache=0;
set@@sql_mode='STRICT_ALL_TABLES,NO_ZERO_DATE,NO_ZERO_IN_DATE,ERROR_FOR_DIVISION_BY_ZERO ';
result_format: 4
#udf_3_2  deterministic
#udf_1  select 
#udf_1_1  一般select
#前置条件
drop table t1;
ERROR 42S02: Unknown table 'nxa.t1'
create table t1(stats int , s1 int , s2 int);
insert into t1 values(2,1,3),(1,0,0),(0,0,0);
drop table t2;
ERROR 42S02: Unknown table 'nxa.t2'
create table t2(id int ,s1 int, s2 int);
drop function n_1;
ERROR 42000: FUNCTION nxa.n_1 does not exist
create function n_1() returns int deterministic 
begin
  insert into t2 values(1,0,1);
  return 0;
end/
查询场景
# 43664563一般select,ob执行一次，不兼容
select n_1() from t1;
+-------+
| n_1() |
+-------+
|     0 |
|     0 |
|     0 |
+-------+
select count(*) from t2;
+----------+
| count(*) |
+----------+
|        1 |
+----------+
查询udf from 空表
delete from  t2;
drop table kong;
ERROR 42S02: Unknown table 'nxa.kong'
create table kong(id int ,s1 int, s2 int);
select n_1() from kong;
+-------+
| n_1() |
+-------+
+-------+
select count( * ) from t2;
+------------+
| count( * ) |
+------------+
|          0 |
+------------+
查询udf from dual
drop table t2;
create table t2(id int ,s1 int, s2 int);
select n_1() from dual;
+-------+
| n_1() |
+-------+
|     0 |
+-------+
select count( * ) from t2;
+------------+
| count( * ) |
+------------+
|          1 |
+------------+
distinct
drop table t1;
create table t1(id int primary key, s1 int, s2 int);
insert into t1 values(1,1,3),(5,7,0),(3,1,0),(9,1,0),(2,7,0);
drop table t2;
create table t2(id int ,s1 int, s2 int);
drop function n_1;
create function n_1() returns int deterministic
begin
  insert into t2 values(1,0,1);
  return 1;
end/
select distinct(n_1()) from t1 where id=9  ;
+---------+
| (n_1()) |
+---------+
|       1 |
+---------+
select * from t2;
+------+------+------+
| id   | s1   | s2   |
+------+------+------+
|    1 |    0 |    1 |
+------+------+------+
distinct+order by
drop table t1;
create table t1(id int primary key, s1 int, s2 int);
insert into t1 values(1,1,3),(5,1,0),(3,1,0),(9,1,0),(2,7,0);
drop table t2;
create table t2(id int ,s1 int, s2 int);
drop function n_1;
create function n_1() returns int deterministic
begin
  insert into t2 values(1,0,1);
  return 1;
end/
select distinct(n_1()) from t1 order by n_1() ;
+---------+
| (n_1()) |
+---------+
|       1 |
+---------+
select * from t2;
+------+------+------+
| id   | s1   | s2   |
+------+------+------+
|    1 |    0 |    1 |
+------+------+------+
#运算(select exp,不予兼容）
前置条件
drop table t1;
create table t1(stats int , s1 int primary key, s2 int);
insert into t1 values(2,1,3),(1,11,0),(0,2,0);
drop function n_1;
create function n_1() returns int deterministic 
begin
  insert into t2 values(1,0,1);
  return 1;
end/
drop table t2;
create table t2(id int ,s1 int, s2 int);
select n_1()+n_1() from t1 order by stats;
+-------------+
| n_1()+n_1() |
+-------------+
|           2 |
|           2 |
|           2 |
+-------------+
select count(*) from t2;
+----------+
| count(*) |
+----------+
|        1 |
+----------+
select n_1()-n_1() from t1 order by stats;
+-------------+
| n_1()-n_1() |
+-------------+
|           0 |
|           0 |
|           0 |
+-------------+
select count(*) from t2;
+----------+
| count(*) |
+----------+
|        2 |
+----------+
select n_1() * n_1() from t1 order by stats;
+---------------+
| n_1() * n_1() |
+---------------+
|             1 |
|             1 |
|             1 |
+---------------+
select count(*) from t2;
+----------+
| count(*) |
+----------+
|        3 |
+----------+
select n_1() div n_1() from t1 order by stats;
+-----------------+
| n_1() div n_1() |
+-----------------+
|               1 |
|               1 |
|               1 |
+-----------------+
select count(*) from t2;
+----------+
| count(*) |
+----------+
|        4 |
+----------+
drop table t2;
create table t2(id int ,s1 int, s2 int);
select n_1()+2 from t1 order by stats;
+---------+
| n_1()+2 |
+---------+
|       3 |
|       3 |
|       3 |
+---------+
select count(*) from t2;
+----------+
| count(*) |
+----------+
|        1 |
+----------+
select n_1()-3 from t1 order by stats;
+---------+
| n_1()-3 |
+---------+
|      -2 |
|      -2 |
|      -2 |
+---------+
select count(*) from t2;
+----------+
| count(*) |
+----------+
|        2 |
+----------+
select n_1() * 3 from t1 order by stats;
+-----------+
| n_1() * 3 |
+-----------+
|         3 |
|         3 |
|         3 |
+-----------+
select count(*) from t2;
+----------+
| count(*) |
+----------+
|        3 |
+----------+
select n_1() div 6 from t1 order by stats;
+-------------+
| n_1() div 6 |
+-------------+
|           0 |
|           0 |
|           0 |
+-------------+
select count(*) from t2;
+----------+
| count(*) |
+----------+
|        4 |
+----------+
drop table t2;
create table t2(id int ,s1 int, s2 int);
select n_1()+stats from t1 order by stats;
+-------------+
| n_1()+stats |
+-------------+
|           1 |
|           2 |
|           3 |
+-------------+
select count(*) from t2;
+----------+
| count(*) |
+----------+
|        1 |
+----------+
select n_1()-stats from t1 order by stats;
+-------------+
| n_1()-stats |
+-------------+
|           1 |
|           0 |
|          -1 |
+-------------+
select count(*) from t2;
+----------+
| count(*) |
+----------+
|        2 |
+----------+
select n_1() * stats from t1 order by stats;
+---------------+
| n_1() * stats |
+---------------+
|             0 |
|             1 |
|             2 |
+---------------+
select count(*) from t2;
+----------+
| count(*) |
+----------+
|        3 |
+----------+
select n_1() div stats from t1 order by stats;
+-----------------+
| n_1() div stats |
+-----------------+
|            NULL |
|               1 |
|               0 |
+-----------------+
select count(*) from t2;
+----------+
| count(*) |
+----------+
|        4 |
+----------+
concat
#43668126  在where后不一致,待修复后验证
drop table t1;
create table t1(stats int , s1 int , s2 int);
insert into t1 values(2,1,3),(1,11,0),(0,2,0);
drop function n_1;
create function n_1() returns int  deterministic 
begin
  insert into t2 values(1,0,1);
  return 1;
end/
drop table t2;
create table t2(id int ,s1 int, s2 int);
select * from t1 where s1=concat(n_1(),n_1());
+-------+------+------+
| stats | s1   | s2   |
+-------+------+------+
|     1 |   11 |    0 |
+-------+------+------+
select count(*) from t2;
+----------+
| count(*) |
+----------+
|        2 |
+----------+
#udf_1_2  函数嵌套(与select expr表现一致）
#前置条件
drop table t1;
create table t1(stats int , s1 int primary key, s2 int);
insert into t1 values(2,1,3),(1,0,0),(0,2,0);
drop table t2;
create table t2(id int ,s1 int, s2 int);
drop function n_1;
create function n_1() returns int  deterministic 
begin
  insert into t2 values(1,0,1);
  return 0;
end/
#字符和数字函数
select count(*) from t2;
+----------+
| count(*) |
+----------+
|        0 |
+----------+
select ascii (n_1()) from t1 order by stats;
+---------------+
| ascii (n_1()) |
+---------------+
|            48 |
|            48 |
|            48 |
+---------------+
select count(*) from t2;
+----------+
| count(*) |
+----------+
|        1 |
+----------+
select instr(n_1(),1) from t1 order by stats;
+----------------+
| instr(n_1(),1) |
+----------------+
|              0 |
|              0 |
|              0 |
+----------------+
select count(*) from t2;
+----------+
| count(*) |
+----------+
|        2 |
+----------+
select length(n_1()) from t1 order by stats;
+---------------+
| length(n_1()) |
+---------------+
|             1 |
|             1 |
|             1 |
+---------------+
select count(*) from t2;
+----------+
| count(*) |
+----------+
|        3 |
+----------+
select abs(n_1()) from t1 order by stats;
+------------+
| abs(n_1()) |
+------------+
|          0 |
|          0 |
|          0 |
+------------+
select count(*) from t2;
+----------+
| count(*) |
+----------+
|        4 |
+----------+
select ceil(n_1())from t1 order by stats;
+-------------+
| ceil(n_1()) |
+-------------+
|           0 |
|           0 |
|           0 |
+-------------+
select count(*) from t2;
+----------+
| count(*) |
+----------+
|        5 |
+----------+
select floor(n_1()) from t1 order by stats;
+--------------+
| floor(n_1()) |
+--------------+
|            0 |
|            0 |
|            0 |
+--------------+
select count(*) from t2;
+----------+
| count(*) |
+----------+
|        6 |
+----------+
select sin(n_1()) from t1 order by stats;
+------------+
| sin(n_1()) |
+------------+
|          0 |
|          0 |
|          0 |
+------------+
select count(*) from t2;
+----------+
| count(*) |
+----------+
|        7 |
+----------+
select cos(n_1()) from t1 order by stats;
+------------+
| cos(n_1()) |
+------------+
|          1 |
|          1 |
|          1 |
+------------+
select count(*) from t2;
+----------+
| count(*) |
+----------+
|        8 |
+----------+
select sign(n_1()) from t1 order by stats;
+-------------+
| sign(n_1()) |
+-------------+
|           0 |
|           0 |
|           0 |
+-------------+
select count(*) from t2;
+----------+
| count(*) |
+----------+
|        9 |
+----------+
select power(n_1(),0.5) from t1 order by stats;
+------------------+
| power(n_1(),0.5) |
+------------------+
|                0 |
|                0 |
|                0 |
+------------------+
select count(*) from t2;
+----------+
| count(*) |
+----------+
|       10 |
+----------+
select mod(n_1(),stats) from t1 order by stats;
+------------------+
| mod(n_1(),stats) |
+------------------+
|             NULL |
|                0 |
|                0 |
+------------------+
select count(*) from t2;
+----------+
| count(*) |
+----------+
|       11 |
+----------+
select round(n_1()) from t1 order by stats;
+--------------+
| round(n_1()) |
+--------------+
|            0 |
|            0 |
|            0 |
+--------------+
select count(*) from t2;
+----------+
| count(*) |
+----------+
|       12 |
+----------+
select sqrt(n_1()) from t1 order by stats;
+-------------+
| sqrt(n_1()) |
+-------------+
|           0 |
|           0 |
|           0 |
+-------------+
select count(*) from t2;
+----------+
| count(*) |
+----------+
|       13 |
+----------+
#聚合函数
drop table t2;
create table t2(id int ,s1 int, s2 int);
select sum(n_1()) from t1  ;
+------------+
| sum(n_1()) |
+------------+
|          0 |
+------------+
select count(*) from t2;
+----------+
| count(*) |
+----------+
|        1 |
+----------+
delete from t2;
select count(n_1()) from t1  ;
+--------------+
| count(n_1()) |
+--------------+
|            3 |
+--------------+
select count(*) from t2;
+----------+
| count(*) |
+----------+
|        1 |
+----------+
delete from t2;
select avg(n_1()) from t1  ;
+------------+
| avg(n_1()) |
+------------+
|     0.0000 |
+------------+
select count( * ) from t2;
+------------+
| count( * ) |
+------------+
|          2 |
+------------+
delete from t2;
select max(n_1()) from t1 ;
+------------+
| max(n_1()) |
+------------+
|          0 |
+------------+
select count( * ) from t2;
+------------+
| count( * ) |
+------------+
|          1 |
+------------+
delete from t2;
select min(n_1()) from t1 ;
+------------+
| min(n_1()) |
+------------+
|          0 |
+------------+
select count( * ) from t2;
+------------+
| count( * ) |
+------------+
|          1 |
+------------+
#udf_1_3 where子句
#43668126 udf定义为deterministic，udf在where后ob会执行两次，修复后统一验证
前置条件
drop table kong;
create table kong(stats int );
drop table t1;
create table t1(stats int , s1 int primary key, s2 int);
insert into t1 values(2,1,3),(1,0,0),(0,2,0);
drop table t2;
create table t2(id int ,s1 int, s2 int);
drop function n_1;
create function n_1() returns int deterministic 
begin
  insert into t2 values(1,0,1);
  return 0;
end/
字段与函数值比较
select * from t1 where stats = n_1();
+-------+----+------+
| stats | s1 | s2   |
+-------+----+------+
|     0 |  2 |    0 |
+-------+----+------+
select count(*) from t2;
+----------+
| count(*) |
+----------+
|        2 |
+----------+
select * from t1 where stats != n_1();
+-------+----+------+
| stats | s1 | s2   |
+-------+----+------+
|     1 |  0 |    0 |
|     2 |  1 |    3 |
+-------+----+------+
select count(*) from t2;
+----------+
| count(*) |
+----------+
|        4 |
+----------+
select * from t1 where stats < n_1();
+-------+----+------+
| stats | s1 | s2   |
+-------+----+------+
+-------+----+------+
select count(*) from t2;
+----------+
| count(*) |
+----------+
|       12 |
+----------+
select * from t1 where stats > n_1();
+-------+----+------+
| stats | s1 | s2   |
+-------+----+------+
|     1 |  0 |    0 |
|     2 |  1 |    3 |
+-------+----+------+
select count(*) from t2;
+----------+
| count(*) |
+----------+
|       20 |
+----------+
select * from t1 where stats <= n_1();
+-------+----+------+
| stats | s1 | s2   |
+-------+----+------+
|     0 |  2 |    0 |
+-------+----+------+
select count(*) from t2;
+----------+
| count(*) |
+----------+
|       28 |
+----------+
select * from t1 where stats >= n_1();
+-------+----+------+
| stats | s1 | s2   |
+-------+----+------+
|     1 |  0 |    0 |
|     2 |  1 |    3 |
|     0 |  2 |    0 |
+-------+----+------+
select count(*) from t2;
+----------+
| count(*) |
+----------+
|       36 |
+----------+
函数值比较
drop table t2;
create table t2(id int ,s1 int, s2 int);
select * from t1 where n_1()=0;
+-------+----+------+
| stats | s1 | s2   |
+-------+----+------+
|     1 |  0 |    0 |
|     2 |  1 |    3 |
|     0 |  2 |    0 |
+-------+----+------+
select count( * ) from t2;
+------------+
| count( * ) |
+------------+
|          1 |
+------------+
select * from t1 where n_1()!=0;
+-------+----+------+
| stats | s1 | s2   |
+-------+----+------+
+-------+----+------+
select count( * ) from t2;
+------------+
| count( * ) |
+------------+
|          2 |
+------------+
select * from t1 where n_1()<1;
+-------+----+------+
| stats | s1 | s2   |
+-------+----+------+
|     1 |  0 |    0 |
|     2 |  1 |    3 |
|     0 |  2 |    0 |
+-------+----+------+
select count( * ) from t2;
+------------+
| count( * ) |
+------------+
|          3 |
+------------+
select * from t1 where n_1()>1;
+-------+----+------+
| stats | s1 | s2   |
+-------+----+------+
+-------+----+------+
select count( * ) from t2;
+------------+
| count( * ) |
+------------+
|          4 |
+------------+
select * from t1 where n_1()<=1;
+-------+----+------+
| stats | s1 | s2   |
+-------+----+------+
|     1 |  0 |    0 |
|     2 |  1 |    3 |
|     0 |  2 |    0 |
+-------+----+------+
select count( * ) from t2;
+------------+
| count( * ) |
+------------+
|          5 |
+------------+
select n_1() from t1 where n_1()>=1;
+-------+
| n_1() |
+-------+
+-------+
select count( * ) from t2;
+------------+
| count( * ) |
+------------+
|          6 |
+------------+
delete from t2;
select * from t1 where n_1()=0;
+-------+----+------+
| stats | s1 | s2   |
+-------+----+------+
|     1 |  0 |    0 |
|     2 |  1 |    3 |
|     0 |  2 |    0 |
+-------+----+------+
select count( * ) from t2;
+------------+
| count( * ) |
+------------+
|          1 |
+------------+
select * from t1 where n_1()=n_1();
+-------+----+------+
| stats | s1 | s2   |
+-------+----+------+
|     1 |  0 |    0 |
|     2 |  1 |    3 |
|     0 |  2 |    0 |
+-------+----+------+
select count( * ) from t2;
+------------+
| count( * ) |
+------------+
|          2 |
+------------+
between..and
drop table t2;
create table t2(id int ,s1 int, s2 int);
select * from t1 where stats between (n_1()) and 9;
+-------+----+------+
| stats | s1 | s2   |
+-------+----+------+
|     1 |  0 |    0 |
|     2 |  1 |    3 |
|     0 |  2 |    0 |
+-------+----+------+
select count( * ) from t2;
+------------+
| count( * ) |
+------------+
|          9 |
+------------+
select n_1() from t1 where stats between 0 and 9;
+-------+
| n_1() |
+-------+
|     0 |
|     0 |
|     0 |
+-------+
select count( * ) from t2;
+------------+
| count( * ) |
+------------+
|         10 |
+------------+
select n_1() from t1 where stats between (n_1()) and 9;
+-------+
| n_1() |
+-------+
|     0 |
|     0 |
|     0 |
+-------+
select count( * ) from t2;
+------------+
| count( * ) |
+------------+
|         19 |
+------------+
in 
#44002969 in不兼容
drop table t1;
create table t1(stats int , s1 int primary key, s2 int);
insert into t1 values(2,1,3),(1,0,0),(0,2,0);
drop table t2;
create table t2(id int ,s1 int, s2 int);
drop function n_1;
create function n_1() returns int deterministic 
begin
  insert into t2 values(1,0,1);
  return 0;
end/
一个参数
drop table t2;
create table t2(id int ,s1 int, s2 int);
select * from t1 where stats in(n_1());
+-------+----+------+
| stats | s1 | s2   |
+-------+----+------+
|     0 |  2 |    0 |
+-------+----+------+
select count( * ) from t2;
+------------+
| count( * ) |
+------------+
|          2 |
+------------+
select * from t1 where stats not in(n_1());
+-------+----+------+
| stats | s1 | s2   |
+-------+----+------+
|     1 |  0 |    0 |
|     2 |  1 |    3 |
+-------+----+------+
select count( * ) from t2;
+------------+
| count( * ) |
+------------+
|          4 |
+------------+
多个参数
drop table t2;
create table t2(id int ,s1 int, s2 int);
select * from t1 where stats in ((n_1()) ,4);
+-------+----+------+
| stats | s1 | s2   |
+-------+----+------+
|     0 |  2 |    0 |
+-------+----+------+
select count( * ) from t2;
+------------+
| count( * ) |
+------------+
|          2 |
+------------+
select * from t1 where stats not in ((n_1()) ,4);
+-------+----+------+
| stats | s1 | s2   |
+-------+----+------+
|     1 |  0 |    0 |
|     2 |  1 |    3 |
+-------+----+------+
select count( * ) from t2;
+------------+
| count( * ) |
+------------+
|          4 |
+------------+
delete from t2;
select * from t1 where stats not in ((n_1()) ,null);
+-------+----+------+
| stats | s1 | s2   |
+-------+----+------+
+-------+----+------+
select count( * ) from t2;
+------------+
| count( * ) |
+------------+
|          1 |
+------------+
delete from t2;
select * from t1 where stats not in (n_1() ,n_1(),n_1(),n_1(),n_1());
+-------+----+------+
| stats | s1 | s2   |
+-------+----+------+
|     1 |  0 |    0 |
|     2 |  1 |    3 |
+-------+----+------+
select count( * ) from t2;
+------------+
| count( * ) |
+------------+
|         10 |
+------------+
udf 返回null
drop table t1;
create table t1(stats int , s1 int primary key, s2 int);
insert into t1 values(2,1,3),(1,0,0),(null,2,0);
drop table t2;
create table t2(id int ,s1 int, s2 int);
drop function n_1;
create function n_1() returns int deterministic 
begin
  insert into t2 values(1,0,1);
  return null;
end/
select * from t1 where stats not in (n_1() ,1);
+-------+----+------+
| stats | s1 | s2   |
+-------+----+------+
+-------+----+------+
select count( * ) from t2;
+------------+
| count( * ) |
+------------+
|          1 |
+------------+
delete from t2;
and
and 和 or对逻辑判断之间多个列进行筛选，不兼容
drop table t1;
create table t1(id int , s1 int, s2 int);
insert into t1 values(1,1,3),(5,2,0),(3,3,0);
drop table t2;
create table t2(id int ,s1 int, s2 int);
drop function n_1;
create function n_1() returns int deterministic
begin
  insert into t2 values(1,0,1);
  return 1;
end/
select count(*) from t1 where (id = n_1() or id = 2) and s1 < 3 ;
+----------+
| count(*) |
+----------+
|        1 |
+----------+
select * from t2;
+------+------+------+
| id   | s1   | s2   |
+------+------+------+
|    1 |    0 |    1 |
|    1 |    0 |    1 |
+------+------+------+
drop table t2;
create table t2(id int ,s1 int, s2 int);
select * from t1 where id =n_1() and id =n_1();
+------+------+------+
| id   | s1   | s2   |
+------+------+------+
|    1 |    1 |    3 |
+------+------+------+
select count( * ) from t2;
+------------+
| count( * ) |
+------------+
|          2 |
+------------+
or
drop table t2;
create table t2(id int ,s1 int, s2 int);
select * from t1 where id =n_1() or id =n_1();
+------+------+------+
| id   | s1   | s2   |
+------+------+------+
|    1 |    1 |    3 |
+------+------+------+
select count( * ) from t2;
+------------+
| count( * ) |
+------------+
|          2 |
+------------+
is null
drop table t4;
ERROR 42S02: Unknown table 'nxa.t4'
create table t4(s1 int,s2 int);
insert into t4 values(null,3),(1,9);
drop function n_2;
ERROR 42000: FUNCTION nxa.n_2 does not exist
create function n_2(a int) returns int deterministic
begin
  insert into t2 values(null,1,a);
  return a;
end/
drop table t2;
create table t2(id int ,s1 int, s2 int);
select * from t4 where (select n_2(s1)) is null ;
+------+------+
| s1   | s2   |
+------+------+
| NULL |    3 |
+------+------+
select count(*) from t2;
+----------+
| count(*) |
+----------+
|        2 |
+----------+
select * from t4 where (select n_2(s1)) is not null ;
+------+------+
| s1   | s2   |
+------+------+
|    1 |    9 |
+------+------+
select count(*) from t2;
+----------+
| count(*) |
+----------+
|        4 |
+----------+
select * from t4 where (n_2(s1)) is  null ;
+------+------+
| s1   | s2   |
+------+------+
| NULL |    3 |
+------+------+
select count(*) from t2;
+----------+
| count(*) |
+----------+
|        6 |
+----------+
select * from t4 where (n_2(s1)) is not null ;
+------+------+
| s1   | s2   |
+------+------+
|    1 |    9 |
+------+------+
select count(*) from t2;
+----------+
| count(*) |
+----------+
|        8 |
+----------+
包含运算
drop table t1;
create table t1(id int , s1 int, s2 int);
insert into t1 values(1,1,3),(5,2,0),(3,3,0);
drop table t2;
create table t2(id int ,s1 int, s2 int);
drop function n_1;
create function n_1() returns int deterministic
begin
  insert into t2 values(1,0,1);
  return 1;
end/
drop table t2;
create table t2(id int ,s1 int, s2 int);
select * from t1 where (n_1() div 0) is null;
+------+------+------+
| id   | s1   | s2   |
+------+------+------+
|    1 |    1 |    3 |
|    5 |    2 |    0 |
|    3 |    3 |    0 |
+------+------+------+
select count( * ) from t2;
+------------+
| count( * ) |
+------------+
|          1 |
+------------+
select * from t1 where (n_1()+n_1())=2;
+------+------+------+
| id   | s1   | s2   |
+------+------+------+
|    1 |    1 |    3 |
|    5 |    2 |    0 |
|    3 |    3 |    0 |
+------+------+------+
select count( * ) from t2;
+------------+
| count( * ) |
+------------+
|          2 |
+------------+
select * from t1 where (select n_1()+n_1() from t1 where id=1) =2;
+------+------+------+
| id   | s1   | s2   |
+------+------+------+
|    1 |    1 |    3 |
|    5 |    2 |    0 |
|    3 |    3 |    0 |
+------+------+------+
select count( * ) from t2;
+------------+
| count( * ) |
+------------+
|          4 |
+------------+
like
drop table t2;
create table t2(id int ,s1 int, s2 int);
select * from t1 where n_1() like '%1%';
+------+------+------+
| id   | s1   | s2   |
+------+------+------+
|    1 |    1 |    3 |
|    5 |    2 |    0 |
|    3 |    3 |    0 |
+------+------+------+
select count( * ) from t2;
+------------+
| count( * ) |
+------------+
|          1 |
+------------+
select * from t1 where (select n_1() from t1 where id=1) like '%1%';
+------+------+------+
| id   | s1   | s2   |
+------+------+------+
|    1 |    1 |    3 |
|    5 |    2 |    0 |
|    3 |    3 |    0 |
+------+------+------+
select count( * ) from t2;
+------------+
| count( * ) |
+------------+
|          3 |
+------------+
判定ture或false
前置条件
drop table t3;
ERROR 42S02: Unknown table 'nxa.t3'
create table t3(id int , s1 int, s2 int);
insert into t3 values(1,1,3),(5,2,0),(3,3,0);
drop table t1;
create table t1(stats int , s1 int primary key, s2 int);
insert into t1 values(2,1,3),(1,0,0),(0,2,0);
drop table t2;
create table t2(id int ,s1 int, s2 int);
drop function n_1;
create function n_1() returns int deterministic 
begin
  insert into t2 values(1,0,1);
  return 0;
end/
exists
#43748653- exists语句，ob与mysql结果不一致
drop table t2;
create table t2(id int ,s1 int, s2 int);
select * from t1 where exists (select n_1() from t3 where t1.stats = t3.id);
+-------+----+------+
| stats | s1 | s2   |
+-------+----+------+
|     1 |  0 |    0 |
+-------+----+------+
select count( * ) from t2;
+------------+
| count( * ) |
+------------+
|          0 |
+------------+
delete from t2;
select * from t1 where exists (select n_1() =0);
+-------+----+------+
| stats | s1 | s2   |
+-------+----+------+
|     1 |  0 |    0 |
|     2 |  1 |    3 |
|     0 |  2 |    0 |
+-------+----+------+
select count( * ) from t2;
+------------+
| count( * ) |
+------------+
|          0 |
+------------+
delete from t2;
select * from t1 where exists (select n_1() from dual);
+-------+----+------+
| stats | s1 | s2   |
+-------+----+------+
|     1 |  0 |    0 |
|     2 |  1 |    3 |
|     0 |  2 |    0 |
+-------+----+------+
select count( * ) from t2;
+------------+
| count( * ) |
+------------+
|          0 |
+------------+
delete from t2;
select * from t1 where exists (select * from t1 where s1=n_1());
+-------+----+------+
| stats | s1 | s2   |
+-------+----+------+
|     1 |  0 |    0 |
|     2 |  1 |    3 |
|     0 |  2 |    0 |
+-------+----+------+
select count( * ) from t2;
+------------+
| count( * ) |
+------------+
|          3 |
+------------+
drop table t1;
create table t1(id int , s1 int, s2 int);
insert into t1 values(1,3,5);
insert into t1 values(2,2,4);
insert into t1 values(3,3,3);
drop table t2;
create table t2(id int ,s1 int, s2 int);
drop function n_1;
create function n_1() returns int deterministic
begin
  insert into t2 values(1,0,1);
  return 3;
end/
select * from t1 where exists (select * from t1 where s2=n_1());
+------+------+------+
| id   | s1   | s2   |
+------+------+------+
|    1 |    3 |    5 |
|    2 |    2 |    4 |
|    3 |    3 |    3 |
+------+------+------+
select * from t2;
+------+------+------+
| id   | s1   | s2   |
+------+------+------+
|    1 |    0 |    1 |
|    1 |    0 |    1 |
+------+------+------+
any和all
#id:43976556&&43976556  any和all结果次数不一致
drop table t1;
create table t1(stats int , s1 int , s2 int);
insert into t1 values(2,1,3),(1,0,0),(0,0,0);
drop table t2;
create table t2(id int ,s1 int, s2 int);
drop function n_1;
create function n_1() returns int deterministic 
begin
  insert into t2 values(1,0,1);
  return 1;
end/
select * from t1 where n_1() > any (select s1 from t1 );
+-------+------+------+
| stats | s1   | s2   |
+-------+------+------+
|     2 |    1 |    3 |
|     1 |    0 |    0 |
|     0 |    0 |    0 |
+-------+------+------+
SELECT * FROM t2;
+------+------+------+
| id   | s1   | s2   |
+------+------+------+
|    1 |    0 |    1 |
|    1 |    0 |    1 |
|    1 |    0 |    1 |
|    1 |    0 |    1 |
|    1 |    0 |    1 |
|    1 |    0 |    1 |
|    1 |    0 |    1 |
|    1 |    0 |    1 |
+------+------+------+
drop table t1;
create table t1(stats int , s1 int , s2 int);
insert into t1 values(2,1,3),(1,0,0),(0,0,0),(9,9,9);
drop table t2;
create table t2(id int ,s1 int, s2 int);
drop function n_1;
create function n_1() returns int deterministic 
begin
  insert into t2 values(1,0,1);
  return 0;
end/
select * from t1 where s1 = any (select n_1() from t1 );
+-------+------+------+
| stats | s1   | s2   |
+-------+------+------+
|     1 |    0 |    0 |
|     0 |    0 |    0 |
+-------+------+------+
SELECT * FROM t2;
+------+------+------+
| id   | s1   | s2   |
+------+------+------+
|    1 |    0 |    1 |
|    1 |    0 |    1 |
+------+------+------+
drop table t1;
create table t1(stats int , s1 int , s2 int);
insert into t1 values(2,1,3),(1,0,1),(0,0,0),(9,9,9);
drop table t2;
create table t2(id int ,s1 int, s2 int);
drop function n_1;
create function n_1() returns int deterministic 
begin
  insert into t2 values(1,0,1);
  return 0;
end/
select * from t1 where s1 = any (select s2 from t1 where stats in (n_1(),9,1));
+-------+------+------+
| stats | s1   | s2   |
+-------+------+------+
|     2 |    1 |    3 |
|     1 |    0 |    1 |
|     0 |    0 |    0 |
|     9 |    9 |    9 |
+-------+------+------+
SELECT * FROM t2;
+------+------+------+
| id   | s1   | s2   |
+------+------+------+
|    1 |    0 |    1 |
|    1 |    0 |    1 |
+------+------+------+
drop table t1;
create table t1(stats int , s1 int , s2 int);
insert into t1 values(2,1,3),(1,0,0),(0,0,0);
drop table t2;
create table t2(id int ,s1 int, s2 int);
drop function n_1;
drop function n_2;
create function n_1() returns int deterministic 
begin
  insert into t2 values(1,0,1);
  return 0;
end/
select * from t1 where n_1() = any (select n_1() from t1 );
+-------+------+------+
| stats | s1   | s2   |
+-------+------+------+
|     2 |    1 |    3 |
|     1 |    0 |    0 |
|     0 |    0 |    0 |
+-------+------+------+
SELECT * FROM t2;
+------+------+------+
| id   | s1   | s2   |
+------+------+------+
|    1 |    0 |    1 |
|    1 |    0 |    1 |
|    1 |    0 |    1 |
|    1 |    0 |    1 |
+------+------+------+
#all
drop table t1;
create table t1(stats int , s1 int , s2 int);
insert into t1 values(2,1,3),(1,1,0),(0,3,0);
drop table t2;
create table t2(id int ,s1 int, s2 int);
drop function n_1;
create function n_1() returns int deterministic 
begin
  insert into t2 values(1,0,1);
  return 3;
end/
select * from t1 where n_1() > all (select s1 from t1);
+-------+------+------+
| stats | s1   | s2   |
+-------+------+------+
+-------+------+------+
SELECT * FROM t2;
+------+------+------+
| id   | s1   | s2   |
+------+------+------+
|    1 |    0 |    1 |
|    1 |    0 |    1 |
|    1 |    0 |    1 |
|    1 |    0 |    1 |
|    1 |    0 |    1 |
|    1 |    0 |    1 |
|    1 |    0 |    1 |
+------+------+------+
drop table t1;
create table t1(stats int , s1 int , s2 int);
insert into t1 values(2,1,3),(1,1,0),(0,1,0),(9,1,9);
drop table t2;
create table t2(id int ,s1 int, s2 int);
drop function n_1;
create function n_1() returns int deterministic 
begin
  insert into t2 values(1,0,1);
  return 1;
end/
select * from t1 where s1 = all (select n_1() from t1 );
+-------+------+------+
| stats | s1   | s2   |
+-------+------+------+
|     2 |    1 |    3 |
|     1 |    1 |    0 |
|     0 |    1 |    0 |
|     9 |    1 |    9 |
+-------+------+------+
SELECT * FROM t2;
+------+------+------+
| id   | s1   | s2   |
+------+------+------+
|    1 |    0 |    1 |
|    1 |    0 |    1 |
+------+------+------+
drop table t1;
create table t1(stats int , s1 int , s2 int);
insert into t1 values(2,0,0),(1,0,0),(0,0,0),(9,0,0);
drop table t2;
create table t2(id int ,s1 int, s2 int);
drop function n_1;
create function n_1() returns int deterministic 
begin
  insert into t2 values(1,0,1);
  return 0;
end/
select * from t1 where s1 = all (select s2 from t1 where stats in (n_1()));
+-------+------+------+
| stats | s1   | s2   |
+-------+------+------+
|     2 |    0 |    0 |
|     1 |    0 |    0 |
|     0 |    0 |    0 |
|     9 |    0 |    0 |
+-------+------+------+
SELECT * FROM t2;
+------+------+------+
| id   | s1   | s2   |
+------+------+------+
|    1 |    0 |    1 |
|    1 |    0 |    1 |
+------+------+------+
drop table t1;
create table t1(stats int , s1 int , s2 int);
insert into t1 values(2,1,3),(1,0,0),(0,0,0);
drop table t2;
create table t2(id int ,s1 int, s2 int);
drop function n_1;
create function n_1() returns int deterministic 
begin
  insert into t2 values(1,0,1);
  return 0;
end/
select * from t1 where n_1() = all (select n_1() from t1 );
+-------+------+------+
| stats | s1   | s2   |
+-------+------+------+
|     2 |    1 |    3 |
|     1 |    0 |    0 |
|     0 |    0 |    0 |
+-------+------+------+
SELECT * FROM t2;
+------+------+------+
| id   | s1   | s2   |
+------+------+------+
|    1 |    0 |    1 |
|    1 |    0 |    1 |
|    1 |    0 |    1 |
|    1 |    0 |    1 |
+------+------+------+
#udf_1_4  ##limit
drop table t1;
create table t1(stats int , s1 int , s2 int);
insert into t1 values(2,1,3),(1,0,0),(0,0,0),(0,0,0);
drop table t2;
create table t2(id int ,s1 int, s2 int);
drop function n_1;
create function n_1() returns int deterministic 
begin
  insert into t2 values(1,0,1);
  return 0;
end/
select n_1() from t1 limit 0;
+-------+
| n_1() |
+-------+
+-------+
select count( * ) from t2;
+------------+
| count( * ) |
+------------+
|          0 |
+------------+
drop table t2;
create table t2(id int ,s1 int, s2 int);
select n_1() from t1 limit 1;
+-------+
| n_1() |
+-------+
|     0 |
+-------+
select count( * ) from t2;
+------------+
| count( * ) |
+------------+
|          1 |
+------------+
drop table t2;
create table t2(id int ,s1 int, s2 int);
select n_1() from t1 limit 2;
+-------+
| n_1() |
+-------+
|     0 |
|     0 |
+-------+
select count( * ) from t2;
+------------+
| count( * ) |
+------------+
|          1 |
+------------+
drop table t2;
create table t2(id int ,s1 int, s2 int);
select n_1() from t1 limit 1,3;
+-------+
| n_1() |
+-------+
|     0 |
|     0 |
|     0 |
+-------+
select count( * ) from t2;
+------------+
| count( * ) |
+------------+
|          1 |
+------------+
distinct+limit
drop table t2;
create table t2(id int ,s1 int, s2 int);
select distinct(n_1()) from t1 limit 2,3;
+---------+
| (n_1()) |
+---------+
+---------+
select count( * ) from t2;
+------------+
| count( * ) |
+------------+
|          0 |
+------------+
where+limit 
drop table t2;
create table t2(id int ,s1 int, s2 int);
select * from t1 where s1=n_1() limit 1,3;
+-------+------+------+
| stats | s1   | s2   |
+-------+------+------+
|     0 |    0 |    0 |
|     0 |    0 |    0 |
+-------+------+------+
SELECT count( * ) FROM t2;
+------------+
| count( * ) |
+------------+
|          2 |
+------------+
order by+limit 
drop table t2;
create table t2(id int ,s1 int, s2 int);
select * from t1 order by n_1() limit 1,3;
+-------+------+------+
| stats | s1   | s2   |
+-------+------+------+
|     1 |    0 |    0 |
|     0 |    0 |    0 |
|     0 |    0 |    0 |
+-------+------+------+
SELECT count( * ) FROM t2;
+------------+
| count( * ) |
+------------+
|          0 |
+------------+
group by+limit 
drop table t2;
create table t2(id int ,s1 int, s2 int);
select * from t1 group by n_1() limit 1,3;
+-------+------+------+
| stats | s1   | s2   |
+-------+------+------+
+-------+------+------+
SELECT count( * ) FROM t2;
+------------+
| count( * ) |
+------------+
|          0 |
+------------+
#udf_1_5  #order by
drop table t1;
create table t1(stats int , s1 int primary key , s2 int);
insert into t1 values(2,1,3),(1,2,0),(3,3,0);
drop table t2;
create table t2(id int ,s1 int, s2 int);
drop function n_1;
create function n_1() returns int deterministic 
begin
  insert into t2 values(1,0,1);
  return 1;
end/
select n_1() from t1 order by s1;
+-------+
| n_1() |
+-------+
|     1 |
|     1 |
|     1 |
+-------+
SELECT count( * ) FROM t2;
+------------+
| count( * ) |
+------------+
|          1 |
+------------+
delete from t2;
select s1 from t1 order by n_1();
+----+
| s1 |
+----+
|  1 |
|  2 |
|  3 |
+----+
SELECT count( * ) FROM t2;
+------------+
| count( * ) |
+------------+
|          0 |
+------------+
drop table t1;
create table t1(id int , s1 int , s2 int,primary key(id,s1));
insert into t1 values(2,1,3),(1,2,0),(3,3,0);
drop table t2;
create table t2(id int ,s1 int, s2 int);
drop function n_1;
create function n_1() returns float  deterministic 
begin
  insert into t2 values(1,0,1);
  return rand();
end/
select s2 from t1 order by n_1();
+------+
| s2   |
+------+
|    0 |
|    3 |
|    0 |
+------+
SELECT * FROM t2;
+------+------+------+
| id   | s1   | s2   |
+------+------+------+
+------+------+------+
delete from t2;
select id from t1 order by id,n_1() limit 1,3;
+----+
| id |
+----+
|  2 |
|  3 |
+----+
SELECT * FROM t2;
+------+------+------+
| id   | s1   | s2   |
+------+------+------+
+------+------+------+
delete from t2;
select * from t1 order by id,s1,n_1();
+----+----+------+
| id | s1 | s2   |
+----+----+------+
|  1 |  2 |    0 |
|  2 |  1 |    3 |
|  3 |  3 |    0 |
+----+----+------+
SELECT * FROM t2;
+------+------+------+
| id   | s1   | s2   |
+------+------+------+
+------+------+------+
#udf_1_6   group by 
普通group by 
次数不一致，不兼容
drop table t1;
create table t1(stats int , s1 int , s2 int);
insert into t1 values(2,1,3),(1,0,0),(0,0,0),(0,0,0);
drop table t2;
create table t2(id int ,s1 int, s2 int);
drop function n_1;
create function n_1() returns int deterministic 
begin
  insert into t2 values(1,0,1);
  return 0;
end/
drop table t2;
create table t2(id int ,s1 int, s2 int);
select * from t1 group by n_1();
+-------+------+------+
| stats | s1   | s2   |
+-------+------+------+
|     2 |    1 |    3 |
+-------+------+------+
SELECT count( * ) FROM t2;
+------------+
| count( * ) |
+------------+
|          0 |
+------------+
drop table t1;
create table t1(stats int primary key , s1 int, s2 int);
insert into t1 values(1,1,3),(2,2,0),(3,2,0);
drop table t2;
create table t2(id int ,s1 int, s2 int);
drop function n_1;
create function n_1() returns int deterministic
begin
  insert into t2 values(1,0,1);
  return 1;
end/
select sum(stats) from t1 group  by n_1();
+------------+
| sum(stats) |
+------------+
|          6 |
+------------+
select * from t2;
+------+------+------+
| id   | s1   | s2   |
+------+------+------+
+------+------+------+
# having不兼容
drop table t2;
create table t2(id int ,s1 int, s2 int);
select n_1() from t1 group by n_1() having max(n_1());
+-------+
| n_1() |
+-------+
|     1 |
+-------+
select count( * ) from t2;
+------------+
| count( * ) |
+------------+
|          3 |
+------------+
#udf_1_7 #case when
drop table t1;
create table t1(stats int , s1 int , s2 int);
insert into t1 values(2,1,3),(1,0,0),(0,2,0);
drop table t2;
create table t2(id int ,s1 int, s2 int);
drop function n_1;
create function n_1() returns int deterministic 
begin
  insert into t2 values(1,0,1);
  return 1;
end/
drop table t2;
create table t2(id int ,s1 int, s2 int);
select case when n_1()=0 then 0.75 else 0 end from t1 order by stats;
+----------------------------------------+
| case when n_1()=0 then 0.75 else 0 end |
+----------------------------------------+
|                                   0.00 |
|                                   0.00 |
|                                   0.00 |
+----------------------------------------+
select count( * ) from t2;
+------------+
| count( * ) |
+------------+
|          1 |
+------------+
drop table t2;
create table t2(id int ,s1 int, s2 int);
select case when s1=n_1() then 0.75 else n_1() end from t1 order by stats;
+---------------------------------------------+
| case when s1=n_1() then 0.75 else n_1() end |
+---------------------------------------------+
|                                        1.00 |
|                                        1.00 |
|                                        0.75 |
+---------------------------------------------+
select count( * ) from t2;
+------------+
| count( * ) |
+------------+
|          2 |
+------------+
drop table t2;
create table t2(id int ,s1 int, s2 int);
select case when n_1()=concat(n_1(),s1) then 0.75 else n_1() end from t1 order by stats;
+-----------------------------------------------------------+
| case when n_1()=concat(n_1(),s1) then 0.75 else n_1() end |
+-----------------------------------------------------------+
|                                                      1.00 |
|                                                      1.00 |
|                                                      1.00 |
+-----------------------------------------------------------+
select count( * ) from t2;
+------------+
| count( * ) |
+------------+
|          3 |
+------------+
drop table t2;
create table t2(id int ,s1 int, s2 int);
select (case n_1() when 0 then 0.29 when 1 then 9 else 0 end) from t1;
+--------------------------------------------------------+
| (case n_1() when 0 then 0.29 when 1 then 9 else 0 end) |
+--------------------------------------------------------+
|                                                   9.00 |
|                                                   9.00 |
|                                                   9.00 |
+--------------------------------------------------------+
select count( * ) from t2;
+------------+
| count( * ) |
+------------+
|          1 |
+------------+
drop table t2;
create table t2(id int ,s1 int, s2 int);
select (case stats when n_1() then 0.02 when 1 then 'a' else 0 end) from t1;
+--------------------------------------------------------------+
| (case stats when n_1() then 0.02 when 1 then 'a' else 0 end) |
+--------------------------------------------------------------+
| 0                                                            |
| 0.02                                                         |
| 0                                                            |
+--------------------------------------------------------------+
select count( * ) from t2;
+------------+
| count( * ) |
+------------+
|          1 |
+------------+
case when concat 不兼容不一致
drop table t2;
create table t2(id int ,s1 int, s2 int);
select (case n_1() when concat(s1,n_1()) then 0.02 when 0 then 9 else 55 end) from t1;
+------------------------------------------------------------------------+
| (case n_1() when concat(s1,n_1()) then 0.02 when 0 then 9 else 55 end) |
+------------------------------------------------------------------------+
|                                                                  55.00 |
|                                                                   0.02 |
|                                                                  55.00 |
+------------------------------------------------------------------------+
select count( * ) from t2;
+------------+
| count( * ) |
+------------+
|          1 |
+------------+
drop table t2;
create table t2(id int ,s1 int, s2 int);
select (case n_1() when 0 then 0.29 when 1 then 9 else 0 end) from t1 group by (case n_1() when 0 then 0.29 when 1 then 9 else 0 end) order by stats;
+--------------------------------------------------------+
| (case n_1() when 0 then 0.29 when 1 then 9 else 0 end) |
+--------------------------------------------------------+
|                                                   9.00 |
+--------------------------------------------------------+
select count( * ) from t2;
+------------+
| count( * ) |
+------------+
|          1 |
+------------+
#udf_1_8  #多表联查
join，待修复后验证
drop table t1;
create table t1(id int , s1 int, s2 int);
insert into t1 values(1,4,3);
insert into t1 values(2,2,3);
insert into t1 values(3,5,3);
drop table t2;
create table t2(id int ,s1 int, s2 int);
drop table t3;
create table t3(id int , s1 int, s2 int);
insert into t3 values(1,4,3);
insert into t3 values(2,7,3);
drop function n_1;
create function n_1() returns int  deterministic
begin
  insert into t2 values(1,0,1);
  return 4;
end/
SELECT t1.s1 + t3.s2 FROM t1, t3 where t1.s1=n_1();
+---------------+
| t1.s1 + t3.s2 |
+---------------+
|             7 |
|             7 |
+---------------+
select count(*) from t2;
+----------+
| count(*) |
+----------+
|        2 |
+----------+
delete from t2;
select * from t1  join t3  on t1.id = t3.id where t1.s1=n_1();
+------+------+------+------+------+------+
| id   | s1   | s2   | id   | s1   | s2   |
+------+------+------+------+------+------+
|    1 |    4 |    3 |    1 |    4 |    3 |
+------+------+------+------+------+------+
select count(*) from t2;
+----------+
| count(*) |
+----------+
|        2 |
+----------+
delete from t2;
select n_1() from t1  join t3  on t1.id = t3.id ;
+-------+
| n_1() |
+-------+
|     4 |
|     4 |
+-------+
select count(*) from t2;
+----------+
| count(*) |
+----------+
|        1 |
+----------+
left join
次数不一致
drop table t1;
create table t1(id int, s1 int, s2 int);
INSERT INTO t1 VALUES(0,1,3),(1,0,0),(2,7,0);
drop table t3;
create table t3(bid int ,s1 int, s2 int);
INSERT INTO t3 VALUES(0,1,3),(1,6,0),(2,7,0);
drop table t2;
create table t2(id int ,s1 int, s2 int);
drop function n_1;
create function n_1() returns int deterministic
begin
  insert into t2 values(1,0,1);
  return 7;
end/
select * from t1  left join t3  on t1.id = t3.bid where t1.s1=n_1()  ;
+------+------+------+------+------+------+
| id   | s1   | s2   | bid  | s1   | s2   |
+------+------+------+------+------+------+
|    2 |    7 |    0 |    2 |    7 |    0 |
+------+------+------+------+------+------+
select * from t2;
+------+------+------+
| id   | s1   | s2   |
+------+------+------+
|    1 |    0 |    1 |
|    1 |    0 |    1 |
+------+------+------+
delete from t2;
select n_1() from t1  left join t3  on t1.id = t3.bid ;
+-------+
| n_1() |
+-------+
|     7 |
|     7 |
|     7 |
+-------+
select * from t2;
+------+------+------+
| id   | s1   | s2   |
+------+------+------+
|    1 |    0 |    1 |
+------+------+------+
right join
次数不一致
delete from t2;
select * from t1  right  join t3  on t1.id = t3.bid where t3.s1=n_1()  ;
+------+------+------+------+------+------+
| id   | s1   | s2   | bid  | s1   | s2   |
+------+------+------+------+------+------+
|    2 |    7 |    0 |    2 |    7 |    0 |
+------+------+------+------+------+------+
select * from t2;
+------+------+------+
| id   | s1   | s2   |
+------+------+------+
|    1 |    0 |    1 |
|    1 |    0 |    1 |
+------+------+------+
delete from t2;
select n_1() from t1  left join t3  on t1.id = t3.bid ;
+-------+
| n_1() |
+-------+
|     7 |
|     7 |
|     7 |
+-------+
select * from t2;
+------+------+------+
| id   | s1   | s2   |
+------+------+------+
|    1 |    0 |    1 |
+------+------+------+
cross join
drop table t2;
create table t2(id int ,s1 int, s2 int);
select * from t1 q cross join t3 w on q.id = w.bid where w.s1=n_1();
+------+------+------+------+------+------+
| id   | s1   | s2   | bid  | s1   | s2   |
+------+------+------+------+------+------+
|    2 |    7 |    0 |    2 |    7 |    0 |
+------+------+------+------+------+------+
select count( * ) from t2;
+------------+
| count( * ) |
+------------+
|          2 |
+------------+
#udf_1_9  嵌套,不兼容
drop table t1;
create table t1(stats int , s1 int, s2 int);
insert into t1 values(1,1,3),(2,2,0),(2,3,0),(2,2,0),(2,7,0);
drop table t3;
create table t3(bid int ,s1 int, s2 int);
INSERT INTO t3 VALUES(0,1,3),(1,6,0),(2,7,0);
drop table t2;
create table t2(id int ,s1 int, s2 int);
drop function n_1;
create function n_1() returns int deterministic
begin
  insert into t2 values(1,0,1);
  return 1;
end/
select * from (select n_1() from t1) qq;
+-------+
| n_1() |
+-------+
|     1 |
|     1 |
|     1 |
|     1 |
|     1 |
+-------+
select count( * ) from t2;
+------------+
| count( * ) |
+------------+
|          2 |
+------------+
delete from t2;
select * from t1 where  s1 in (select n_1() from t3 );
+-------+------+------+
| stats | s1   | s2   |
+-------+------+------+
|     1 |    1 |    3 |
+-------+------+------+
select * from t2;
+------+------+------+
| id   | s1   | s2   |
+------+------+------+
|    1 |    0 |    1 |
|    1 |    0 |    1 |
+------+------+------+
delete from t2;
select s1,s2,(select n_1() from t3 limit 1 ) as ret from t1  ;
+------+------+------+
| s1   | s2   | ret  |
+------+------+------+
|    1 |    3 |    1 |
|    2 |    0 |    1 |
|    3 |    0 |    1 |
|    2 |    0 |    1 |
|    7 |    0 |    1 |
+------+------+------+
select * from t2;
+------+------+------+
| id   | s1   | s2   |
+------+------+------+
|    1 |    0 |    1 |
|    1 |    0 |    1 |
+------+------+------+
delete from t2;
with ccc as (select n_1() from t1) select * from ccc;
+-------+
| n_1() |
+-------+
|     1 |
|     1 |
|     1 |
|     1 |
|     1 |
+-------+
select * from t2;
+------+------+------+
| id   | s1   | s2   |
+------+------+------+
|    1 |    0 |    1 |
|    1 |    0 |    1 |
+------+------+------+
嵌套function查询function from dual，次数不一致，待修复后验证
drop table t2;
create table t2(id int ,s1 int, s2 int);
select n_1() from (select n_1() from dual) qq;
+-------+
| n_1() |
+-------+
|     1 |
+-------+
select count( * ) from t2;
+------------+
| count( * ) |
+------------+
|          1 |
+------------+
#udf_1_10 操作结果集
##45211054- 【udf】对于查询deterministic_udf的结果使用union，ob为执行两次
drop table t2;
create table t2(id int ,s1 int, s2 int);
(select n_1() from t1) union (select s1 from t1);
+-------+
| n_1() |
+-------+
|     1 |
|     2 |
|     3 |
|     7 |
+-------+
select count( * ) from t2;
+------------+
| count( * ) |
+------------+
|          2 |
+------------+
drop table t2;
create table t2(id int ,s1 int, s2 int);
(select n_1() from t1) union (select n_1() from t1);
+-------+
| n_1() |
+-------+
|     1 |
+-------+
select count( * ) from t2;
+------------+
| count( * ) |
+------------+
|          4 |
+------------+
drop table t2;
create table t2(id int ,s1 int, s2 int);
(select n_1() from t1) union all (select s1 from t1);
+-------+
| n_1() |
+-------+
|     1 |
|     1 |
|     1 |
|     1 |
|     1 |
|     1 |
|     2 |
|     3 |
|     2 |
|     7 |
+-------+
select count( * ) from t2;
+------------+
| count( * ) |
+------------+
|          2 |
+------------+
drop table t2;
create table t2(id int ,s1 int, s2 int);
select n_1() from ((select * from t1) union all (select * from t1)) ee;
+-------+
| n_1() |
+-------+
|     1 |
|     1 |
|     1 |
|     1 |
|     1 |
|     1 |
|     1 |
|     1 |
|     1 |
|     1 |
+-------+
select count( * ) from t2;
+------------+
| count( * ) |
+------------+
|          4 |
+------------+
udf_2 #table
索引
主键
drop table t1;
create table t1(id int primary key, s1 int, s2 int);
insert into t1 values(1,1,3),(5,1,0),(3,1,0),(9,1,0),(2,7,0);
drop table t2;
create table t2(id int ,s1 int, s2 int);
drop function n_1;
create function n_1() returns int deterministic
begin
  insert into t2 values(1,0,1);
  return 1;
end/
select id+n_1() from t1 ;
+----------+
| id+n_1() |
+----------+
|        2 |
|        3 |
|        4 |
|        6 |
|       10 |
+----------+
select * from t2;
+------+------+------+
| id   | s1   | s2   |
+------+------+------+
|    1 |    0 |    1 |
+------+------+------+
delete from t2;
select * from t1 where id=n_1()  ;
+----+------+------+
| id | s1   | s2   |
+----+------+------+
|  1 |    1 |    3 |
+----+------+------+
select * from t2;
+------+------+------+
| id   | s1   | s2   |
+------+------+------+
|    1 |    0 |    1 |
|    1 |    0 |    1 |
|    1 |    0 |    1 |
+------+------+------+
外键
drop table t3;
drop table t1;
create table t1(id int primary key, s1 int, s2 int);
insert into t1 values(1,1,3),(5,1,0),(3,1,0),(9,1,0),(2,7,0);
create table t3(bid int ,s1 int, s2 int,foreign key (bid) references t1(id));
INSERT INTO t3 VALUES(3,1,3),(1,6,0),(1,6,0),(2,7,0);
drop table t2;
create table t2(id int ,s1 int, s2 int);
drop function n_1;
create function n_1() returns int deterministic
begin
  insert into t2 values(1,0,1);
  return 1;
end/
select n_1() from t3,t1 where t3.bid=t1.id ;
+-------+
| n_1() |
+-------+
|     1 |
|     1 |
|     1 |
|     1 |
+-------+
select * from t2;
+------+------+------+
| id   | s1   | s2   |
+------+------+------+
|    1 |    0 |    1 |
+------+------+------+
delete from t2;
select * from t3,t1 where t3.bid=t1.id and t1.id=n_1() ;
+------+------+------+----+------+------+
| bid  | s1   | s2   | id | s1   | s2   |
+------+------+------+----+------+------+
|    1 |    6 |    0 |  1 |    1 |    3 |
|    1 |    6 |    0 |  1 |    1 |    3 |
+------+------+------+----+------+------+
select * from t2;
+------+------+------+
| id   | s1   | s2   |
+------+------+------+
|    1 |    0 |    1 |
|    1 |    0 |    1 |
|    1 |    0 |    1 |
|    1 |    0 |    1 |
+------+------+------+
delete from t2;
select * from t3 where bid=n_1()  ;
+------+------+------+
| bid  | s1   | s2   |
+------+------+------+
|    1 |    6 |    0 |
|    1 |    6 |    0 |
+------+------+------+
select * from t2;
+------+------+------+
| id   | s1   | s2   |
+------+------+------+
|    1 |    0 |    1 |
|    1 |    0 |    1 |
+------+------+------+
普通索引
drop table t3;
drop procedure initData;
ERROR 42000: PROCEDURE nxa.initData does not exist
create procedure initData()
begin
declare count int default 1;
while count <= 100 DO
 insert into t1 (id,s1,s2) values (count,count,count); 
 set count = count +1;
end while;
end;
/
drop table t1;
create table t1(id int, s1 int, s2 int,index ix_id(id),index idx_id(s1));
call initData();
drop table t2;
create table t2(id int ,s1 int, s2 int);
drop function n_1;
create function n_1() returns int deterministic
begin
  insert into t2 values(1,0,1);
  return 50;
end/
delete from t2;
select n_1() from t1 where id =n_1() ;
+-------+
| n_1() |
+-------+
|    50 |
+-------+
select * from t2;
+------+------+------+
| id   | s1   | s2   |
+------+------+------+
|    1 |    0 |    1 |
|    1 |    0 |    1 |
|    1 |    0 |    1 |
|    1 |    0 |    1 |
|    1 |    0 |    1 |
|    1 |    0 |    1 |
+------+------+------+
delete from t2;
select n_1() from t1 where s1 <50 order by id ;
+-------+
| n_1() |
+-------+
|    50 |
|    50 |
|    50 |
|    50 |
|    50 |
|    50 |
|    50 |
|    50 |
|    50 |
|    50 |
|    50 |
|    50 |
|    50 |
|    50 |
|    50 |
|    50 |
|    50 |
|    50 |
|    50 |
|    50 |
|    50 |
|    50 |
|    50 |
|    50 |
|    50 |
|    50 |
|    50 |
|    50 |
|    50 |
|    50 |
|    50 |
|    50 |
|    50 |
|    50 |
|    50 |
|    50 |
|    50 |
|    50 |
|    50 |
|    50 |
|    50 |
|    50 |
|    50 |
|    50 |
|    50 |
|    50 |
|    50 |
|    50 |
|    50 |
+-------+
select * from t2;
+------+------+------+
| id   | s1   | s2   |
+------+------+------+
|    1 |    0 |    1 |
+------+------+------+
delete from t2;
select n_1() from t1 where s1 <50 group by id ;
+-------+
| n_1() |
+-------+
|    50 |
|    50 |
|    50 |
|    50 |
|    50 |
|    50 |
|    50 |
|    50 |
|    50 |
|    50 |
|    50 |
|    50 |
|    50 |
|    50 |
|    50 |
|    50 |
|    50 |
|    50 |
|    50 |
|    50 |
|    50 |
|    50 |
|    50 |
|    50 |
|    50 |
|    50 |
|    50 |
|    50 |
|    50 |
|    50 |
|    50 |
|    50 |
|    50 |
|    50 |
|    50 |
|    50 |
|    50 |
|    50 |
|    50 |
|    50 |
|    50 |
|    50 |
|    50 |
|    50 |
|    50 |
|    50 |
|    50 |
|    50 |
|    50 |
+-------+
select * from t2;
+------+------+------+
| id   | s1   | s2   |
+------+------+------+
|    1 |    0 |    1 |
+------+------+------+
delete from t2;
select * from t1 where id=n_1() ;
+------+------+------+
| id   | s1   | s2   |
+------+------+------+
|   50 |   50 |   50 |
+------+------+------+
select * from t2;
+------+------+------+
| id   | s1   | s2   |
+------+------+------+
|    1 |    0 |    1 |
|    1 |    0 |    1 |
|    1 |    0 |    1 |
|    1 |    0 |    1 |
|    1 |    0 |    1 |
+------+------+------+
联合索引
drop procedure initData;
create procedure initData()
begin
declare count int default 1;
while count <= 100 DO
 insert into t1 (id,s1,s2) values (count,count,count); 
 set count = count +1;
end while;
end;
/
drop table t1;
create table t1(id int primary key,s1 int, s2 int);
call initData();
drop table t2;
create table t2(id int ,s1 int, s2 int);
drop function n_1;
create function n_1() returns int deterministic
begin
  insert into t2 values(1,0,1);
  return 50;
end/
create index ix_iot on t1(id,s1,s2);
delete from t2;
select id,s1,s2,n_1() from t1 where s1 =50 and s2= n_1();
+----+------+------+-------+
| id | s1   | s2   | n_1() |
+----+------+------+-------+
| 50 |   50 |   50 |    50 |
+----+------+------+-------+
select * from t2;
+------+------+------+
| id   | s1   | s2   |
+------+------+------+
|    1 |    0 |    1 |
|    1 |    0 |    1 |
|    1 |    0 |    1 |
|    1 |    0 |    1 |
|    1 |    0 |    1 |
|    1 |    0 |    1 |
+------+------+------+
alter table t1 drop index ix_iot;
create index ix_iot on t1(s1,s2,id);
delete from t2;
select id,s1,s2,n_1()from t1 ;
+-----+------+------+-------+
| id  | s1   | s2   | n_1() |
+-----+------+------+-------+
|   1 |    1 |    1 |    50 |
|   2 |    2 |    2 |    50 |
|   3 |    3 |    3 |    50 |
|   4 |    4 |    4 |    50 |
|   5 |    5 |    5 |    50 |
|   6 |    6 |    6 |    50 |
|   7 |    7 |    7 |    50 |
|   8 |    8 |    8 |    50 |
|   9 |    9 |    9 |    50 |
|  10 |   10 |   10 |    50 |
|  11 |   11 |   11 |    50 |
|  12 |   12 |   12 |    50 |
|  13 |   13 |   13 |    50 |
|  14 |   14 |   14 |    50 |
|  15 |   15 |   15 |    50 |
|  16 |   16 |   16 |    50 |
|  17 |   17 |   17 |    50 |
|  18 |   18 |   18 |    50 |
|  19 |   19 |   19 |    50 |
|  20 |   20 |   20 |    50 |
|  21 |   21 |   21 |    50 |
|  22 |   22 |   22 |    50 |
|  23 |   23 |   23 |    50 |
|  24 |   24 |   24 |    50 |
|  25 |   25 |   25 |    50 |
|  26 |   26 |   26 |    50 |
|  27 |   27 |   27 |    50 |
|  28 |   28 |   28 |    50 |
|  29 |   29 |   29 |    50 |
|  30 |   30 |   30 |    50 |
|  31 |   31 |   31 |    50 |
|  32 |   32 |   32 |    50 |
|  33 |   33 |   33 |    50 |
|  34 |   34 |   34 |    50 |
|  35 |   35 |   35 |    50 |
|  36 |   36 |   36 |    50 |
|  37 |   37 |   37 |    50 |
|  38 |   38 |   38 |    50 |
|  39 |   39 |   39 |    50 |
|  40 |   40 |   40 |    50 |
|  41 |   41 |   41 |    50 |
|  42 |   42 |   42 |    50 |
|  43 |   43 |   43 |    50 |
|  44 |   44 |   44 |    50 |
|  45 |   45 |   45 |    50 |
|  46 |   46 |   46 |    50 |
|  47 |   47 |   47 |    50 |
|  48 |   48 |   48 |    50 |
|  49 |   49 |   49 |    50 |
|  50 |   50 |   50 |    50 |
|  51 |   51 |   51 |    50 |
|  52 |   52 |   52 |    50 |
|  53 |   53 |   53 |    50 |
|  54 |   54 |   54 |    50 |
|  55 |   55 |   55 |    50 |
|  56 |   56 |   56 |    50 |
|  57 |   57 |   57 |    50 |
|  58 |   58 |   58 |    50 |
|  59 |   59 |   59 |    50 |
|  60 |   60 |   60 |    50 |
|  61 |   61 |   61 |    50 |
|  62 |   62 |   62 |    50 |
|  63 |   63 |   63 |    50 |
|  64 |   64 |   64 |    50 |
|  65 |   65 |   65 |    50 |
|  66 |   66 |   66 |    50 |
|  67 |   67 |   67 |    50 |
|  68 |   68 |   68 |    50 |
|  69 |   69 |   69 |    50 |
|  70 |   70 |   70 |    50 |
|  71 |   71 |   71 |    50 |
|  72 |   72 |   72 |    50 |
|  73 |   73 |   73 |    50 |
|  74 |   74 |   74 |    50 |
|  75 |   75 |   75 |    50 |
|  76 |   76 |   76 |    50 |
|  77 |   77 |   77 |    50 |
|  78 |   78 |   78 |    50 |
|  79 |   79 |   79 |    50 |
|  80 |   80 |   80 |    50 |
|  81 |   81 |   81 |    50 |
|  82 |   82 |   82 |    50 |
|  83 |   83 |   83 |    50 |
|  84 |   84 |   84 |    50 |
|  85 |   85 |   85 |    50 |
|  86 |   86 |   86 |    50 |
|  87 |   87 |   87 |    50 |
|  88 |   88 |   88 |    50 |
|  89 |   89 |   89 |    50 |
|  90 |   90 |   90 |    50 |
|  91 |   91 |   91 |    50 |
|  92 |   92 |   92 |    50 |
|  93 |   93 |   93 |    50 |
|  94 |   94 |   94 |    50 |
|  95 |   95 |   95 |    50 |
|  96 |   96 |   96 |    50 |
|  97 |   97 |   97 |    50 |
|  98 |   98 |   98 |    50 |
|  99 |   99 |   99 |    50 |
| 100 |  100 |  100 |    50 |
+-----+------+------+-------+
select * from t2;
+------+------+------+
| id   | s1   | s2   |
+------+------+------+
|    1 |    0 |    1 |
+------+------+------+
alter table t1 drop index ix_iot;
create index ix_iot on t1(id,s1,s2);
delete from t2;
select id,s1,s2,n_1()from t1 where id =50 and s1= n_1() order by s2;
+----+------+------+-------+
| id | s1   | s2   | n_1() |
+----+------+------+-------+
| 50 |   50 |   50 |    50 |
+----+------+------+-------+
select * from t2;
+------+------+------+
| id   | s1   | s2   |
+------+------+------+
|    1 |    0 |    1 |
|    1 |    0 |    1 |
|    1 |    0 |    1 |
|    1 |    0 |    1 |
+------+------+------+
delete from t2;
select id,s1,s2,n_1()from t1 where id <51 and s1= n_1() order by s2;
+----+------+------+-------+
| id | s1   | s2   | n_1() |
+----+------+------+-------+
| 50 |   50 |   50 |    50 |
+----+------+------+-------+
select * from t2;
+------+------+------+
| id   | s1   | s2   |
+------+------+------+
|    1 |    0 |    1 |
|    1 |    0 |    1 |
|    1 |    0 |    1 |
|    1 |    0 |    1 |
|    1 |    0 |    1 |
|    1 |    0 |    1 |
+------+------+------+
约束
auto_increment
drop table t1;
create table t1(id int primary key auto_increment, s1 int, s2 int);
insert into t1 values(1,1,3),(5,1,0),(3,1,0),(9,1,0),(2,7,0);
drop table t2;
create table t2(id int ,s1 int, s2 int);
drop function n_1;
create function n_1() returns int deterministic
begin
  insert into t2 values(1,0,1);
  return null;
end/
insert into t1(id) select n_1() from t1;
select * from t1;
+----+------+------+
| id | s1   | s2   |
+----+------+------+
|  1 |    1 |    3 |
|  2 |    7 |    0 |
|  3 |    1 |    0 |
|  5 |    1 |    0 |
|  9 |    1 |    0 |
| 10 | NULL | NULL |
| 11 | NULL | NULL |
| 12 | NULL | NULL |
| 13 | NULL | NULL |
| 14 | NULL | NULL |
+----+------+------+
select * from t2;
+------+------+------+
| id   | s1   | s2   |
+------+------+------+
|    1 |    0 |    1 |
|    1 |    0 |    1 |
+------+------+------+
default 
drop table t1;
create table t1(id int default null, s1 int, s2 int default 1 not null);
insert into t1 values(1,1,3),(5,1,0),(3,1,0),(9,1,0),(2,7,0);
drop table t2;
create table t2(id int ,s1 int, s2 int);
drop function n_1;
create function n_1() returns int deterministic
begin
  insert into t2 values(1,0,1);
  return 99;
end/
insert into t1(id) select n_1() from t1;
select * from t1;
+------+------+----+
| id   | s1   | s2 |
+------+------+----+
|    1 |    1 |  3 |
|    5 |    1 |  0 |
|    3 |    1 |  0 |
|    9 |    1 |  0 |
|    2 |    7 |  0 |
|   99 | NULL |  1 |
|   99 | NULL |  1 |
|   99 | NULL |  1 |
|   99 | NULL |  1 |
|   99 | NULL |  1 |
+------+------+----+
select * from t2;
+------+------+------+
| id   | s1   | s2   |
+------+------+------+
|    1 |    0 |    1 |
|    1 |    0 |    1 |
+------+------+------+
虚拟列
drop table t1;
create table t1(id int, s1 int, s2 int,bao int GENERATED ALWAYS AS (id+s1) VIRTUAL);
insert into t1(id,s1,s2) values (1,1,3),(5,1,0),(3,1,0),(9,1,0),(2,7,0);
drop table t2;
create table t2(id int ,s1 int, s2 int);
drop function n_1;
create function n_1() returns int deterministic
begin
  insert into t2 values(1,0,1);
  return 99;
end/
insert into t1(id,s1) select n_1(),n_1() from t1;
select * from t1;
+------+------+------+------+
| id   | s1   | s2   | bao  |
+------+------+------+------+
|    1 |    1 |    3 |    2 |
|    5 |    1 |    0 |    6 |
|    3 |    1 |    0 |    4 |
|    9 |    1 |    0 |   10 |
|    2 |    7 |    0 |    9 |
|   99 |   99 | NULL |  198 |
|   99 |   99 | NULL |  198 |
|   99 |   99 | NULL |  198 |
|   99 |   99 | NULL |  198 |
|   99 |   99 | NULL |  198 |
+------+------+------+------+
select * from t2;
+------+------+------+
| id   | s1   | s2   |
+------+------+------+
|    1 |    0 |    1 |
|    1 |    0 |    1 |
+------+------+------+
unique
drop table t1;
create table t1(id int unique, s1 int, s2 int);
insert into t1(id,s1,s2) values (1,1,3),(5,1,0),(3,1,0),(9,1,0),(2,7,0);
drop table t2;
create table t2(id int ,s1 int, s2 int);
drop function n_1;
create function n_1() returns int deterministic
begin
  insert into t2 values(1,0,1);
  return 9;
end/
insert into t1(id) select n_1()from t1;
ERROR 23000: Duplicate entry '9' for key 'id'
select * from t1;
+------+------+------+
| id   | s1   | s2   |
+------+------+------+
|    1 |    1 |    3 |
|    5 |    1 |    0 |
|    3 |    1 |    0 |
|    9 |    1 |    0 |
|    2 |    7 |    0 |
+------+------+------+
select * from t2;
+------+------+------+
| id   | s1   | s2   |
+------+------+------+
+------+------+------+
zerofill
drop table t1;
create table t1(id int zerofill, s1 int, s2 int);
insert into t1(id,s1,s2) values (1,1,3),(5,1,0),(3,1,0),(9,1,0),(2,7,0);
drop table t2;
create table t2(id int(9) ,s1 int, s2 int);
drop function n_1;
create function n_1() returns int deterministic
begin
  insert into t2 values(1,0,1);
  return 99;
end/
insert into t1(id) select n_1()from t1;
select * from t1;
+------------+------+------+
| id         | s1   | s2   |
+------------+------+------+
| 0000000001 |    1 |    3 |
| 0000000005 |    1 |    0 |
| 0000000003 |    1 |    0 |
| 0000000009 |    1 |    0 |
| 0000000002 |    7 |    0 |
| 0000000099 | NULL | NULL |
| 0000000099 | NULL | NULL |
| 0000000099 | NULL | NULL |
| 0000000099 | NULL | NULL |
| 0000000099 | NULL | NULL |
+------------+------+------+
select * from t2;
+------+------+------+
| id   | s1   | s2   |
+------+------+------+
|    1 |    0 |    1 |
|    1 |    0 |    1 |
+------+------+------+
not null
drop table t1;
create table t1(id int not null, s1 int, s2 int);
insert into t1(id,s1,s2) values (1,1,3),(5,1,0),(3,1,0),(9,1,0),(2,7,0);
drop table t2;
create table t2(id int(9) ,s1 int, s2 int);
drop function n_1;
create function n_1() returns int deterministic
begin
  insert into t2 values(1,0,1);
  return null;
end/
insert into t1(id) select n_1()from t1;
ERROR 23000: Column 'id' cannot be null
select * from t1;
+----+------+------+
| id | s1   | s2   |
+----+------+------+
|  1 |    1 |    3 |
|  5 |    1 |    0 |
|  3 |    1 |    0 |
|  9 |    1 |    0 |
|  2 |    7 |    0 |
+----+------+------+
select * from t2;
+------+------+------+
| id   | s1   | s2   |
+------+------+------+
+------+------+------+
insert
drop table t1;
create table t1(id int , s1 int, s2 int);
insert into t1(id,s1,s2) values (1,1,3),(5,1,0),(3,1,0),(9,1,0),(2,7,0);
drop table t2;
create table t2(id int(9) ,s1 int, s2 int);
drop function n_1;
create function n_1() returns int deterministic
begin
  insert into t2 values(1,0,1);
  return 6;
end/
drop table t2;
create table t2(id int ,s1 int, s2 int);
insert into t1 values(0,(n_1()),3),(1,0,0);
select count( * ) from t2;
+------------+
| count( * ) |
+------------+
|          1 |
+------------+
drop table t1;
create table t1(id int , s1 int, s2 int);
insert into t1(id,s1,s2) values (1,1,3),(5,1,0),(3,1,0);
drop table t2;
create table t2(id int ,s1 int, s2 int);
insert into t1 values(0,(select n_1()),3),(1,0,0);
select count( * ) from t2;
+------------+
| count( * ) |
+------------+
|          1 |
+------------+
分区
rang分区
drop table t1;
create table t1(
  pid  int primary key,
  pname varchar(30)
) partition by range(pid)(
  partition p1 values less than(1000) ,
  partition p2 values less than(2000) ,
  partition p3 values less than(maxvalue)
);
insert into t1 (pid, pname) values (1, '瑶瑶');
insert into t1 (pid, pname) values (2, '西西');
insert into t1 (pid, pname) values (1500, '倩倩');
insert into t1 (pid, pname) values (1600, '菲菲');
insert into t1 (pid, pname) values (3000, '小花');
drop table t2;
create table t2(id int ,s1 int, s2 int);
drop function n_1;
create function n_1() returns int deterministic
begin
  insert into t2 values(1,0,1);
  return 2;
end/
select * from t1  where pid=n_1() ;
+-----+--------+
| pid | pname  |
+-----+--------+
|   2 | 西西   |
+-----+--------+
select * from t2;
+------+------+------+
| id   | s1   | s2   |
+------+------+------+
|    1 |    0 |    1 |
|    1 |    0 |    1 |
|    1 |    0 |    1 |
|    1 |    0 |    1 |
|    1 |    0 |    1 |
|    1 |    0 |    1 |
+------+------+------+
list
drop table t1;
create table t1(
  pid   int,
  pname varchar(30)
) partition by list(pid)(
  partition p1 values in (1,2),
  partition p2 values in (1500,1600),
  partition p3 values in (3000)
);
insert into t1 (pid, pname) values (1, '瑶瑶');
insert into t1 (pid, pname) values (2, '西西');
insert into t1 (pid, pname) values (1500, '倩倩');
insert into t1 (pid, pname) values (1600, '菲菲');
insert into t1 (pid, pname) values (3000, '小花');
drop table t2;
create table t2(id int ,s1 int, s2 int);
drop function n_1;
create function n_1() returns int deterministic
begin
  insert into t2 values(1,0,1);
  return 1600;
end/
select * from t1  where pid=n_1() ;
+------+--------+
| pid  | pname  |
+------+--------+
| 1600 | 菲菲   |
+------+--------+
select * from t2;
+------+------+------+
| id   | s1   | s2   |
+------+------+------+
|    1 |    0 |    1 |
|    1 |    0 |    1 |
|    1 |    0 |    1 |
|    1 |    0 |    1 |
|    1 |    0 |    1 |
+------+------+------+
hash
drop table t1;
create table t1(
  pid   int,
  pname varchar(30)
)
partition by hash(pid)
partitions 4
;
insert into t1 (pid, pname) values (1, '瑶瑶');
insert into t1 (pid, pname) values (2, '西西');
insert into t1 (pid, pname) values (1500, '倩倩');
insert into t1 (pid, pname) values (1600, '菲菲');
insert into t1 (pid, pname) values (3000, '小花');
drop table t2;
create table t2(id int ,s1 int, s2 int);
drop function n_1;
create function n_1() returns int deterministic
begin
  insert into t2 values(1,0,1);
  return 1;
end/
select * from t1  where pid=n_1() ;
+------+--------+
| pid  | pname  |
+------+--------+
|    1 | 瑶瑶   |
+------+--------+
select * from t2;
+------+------+------+
| id   | s1   | s2   |
+------+------+------+
|    1 |    0 |    1 |
|    1 |    0 |    1 |
|    1 |    0 |    1 |
|    1 |    0 |    1 |
|    1 |    0 |    1 |
+------+------+------+
select pid from t1  where pid in(n_1(),3000);
+------+
| pid  |
+------+
|    1 |
| 3000 |
+------+
select * from t2;
+------+------+------+
| id   | s1   | s2   |
+------+------+------+
|    1 |    0 |    1 |
|    1 |    0 |    1 |
|    1 |    0 |    1 |
|    1 |    0 |    1 |
|    1 |    0 |    1 |
|    1 |    0 |    1 |
|    1 |    0 |    1 |
|    1 |    0 |    1 |
|    1 |    0 |    1 |
|    1 |    0 |    1 |
|    1 |    0 |    1 |
|    1 |    0 |    1 |
|    1 |    0 |    1 |
+------+------+------+
子分区
drop table t1;
CREATE TABLE t1 (id INT, s1 int,s2 int)
    PARTITION BY RANGE( id )
    SUBPARTITION BY HASH( s1 )
    SUBPARTITIONS 2 (
        PARTITION p0 VALUES LESS THAN (1990),
        PARTITION p1 VALUES LESS THAN (2000),
        PARTITION p2 VALUES LESS THAN MAXVALUE
    );
insert into t1 values (1,1990,4),(2,1991,3),(3,2009,2),(4,1,1);
drop table t2;
create table t2(id int ,s1 int, s2 int);
drop function n_1;
create function n_1() returns int deterministic
begin
  insert into t2 values(1,0,1);
  return 1;
end/
delete from t2;
select id from t1  where s1=n_1() ;
+------+
| id   |
+------+
|    4 |
+------+
select * from t2;
+------+------+------+
| id   | s1   | s2   |
+------+------+------+
|    1 |    0 |    1 |
|    1 |    0 |    1 |
|    1 |    0 |    1 |
|    1 |    0 |    1 |
|    1 |    0 |    1 |
+------+------+------+
delete from t2;
select s1 from t1  where id=n_1() ;
+------+
| s1   |
+------+
| 1990 |
+------+
select * from t2;
+------+------+------+
| id   | s1   | s2   |
+------+------+------+
|    1 |    0 |    1 |
|    1 |    0 |    1 |
|    1 |    0 |    1 |
|    1 |    0 |    1 |
|    1 |    0 |    1 |
+------+------+------+
delete from t2;
select n_1() from t1 group by s1 ;
+-------+
| n_1() |
+-------+
|     1 |
|     1 |
|     1 |
|     1 |
+-------+
select * from t2;
+------+------+------+
| id   | s1   | s2   |
+------+------+------+
|    1 |    0 |    1 |
+------+------+------+
delete from t2;
select n_1() from t1 where (id = 1 or id = 2) and s1 > 1990  ;
+-------+
| n_1() |
+-------+
|     1 |
+-------+
select * from t2;
+------+------+------+
| id   | s1   | s2   |
+------+------+------+
|    1 |    0 |    1 |
+------+------+------+
一级分区裁剪
hash
drop table t1;
create table t1 (id int, s1 int,s2 int) partition by hash(s1+s2) partitions 5;
insert into t1 values(1,1,3),(5,2,0),(3,3,0),(9,2,0),(2,7,0);
drop table t2;
create table t2(id int ,s1 int, s2 int);
drop function n_1;
create function n_1() returns int deterministic
begin
  insert into t2 values(1,0,1);
  return 4;
end/
select * from t1 where  s1+s2=n_1();
+------+------+------+
| id   | s1   | s2   |
+------+------+------+
|    1 |    1 |    3 |
+------+------+------+
select * from t2;
+------+------+------+
| id   | s1   | s2   |
+------+------+------+
|    1 |    0 |    1 |
|    1 |    0 |    1 |
|    1 |    0 |    1 |
|    1 |    0 |    1 |
|    1 |    0 |    1 |
+------+------+------+
drop table t1;
create table t1 (id int, s1 int,s2 int) partition by hash(s1+s2) partitions 5;
insert into t1 values(1,1,3),(5,2,0),(3,3,0),(9,2,0),(2,7,0);
drop table t2;
create table t2(id int ,s1 int, s2 int);
drop function n_1;
create function n_1() returns int deterministic
begin
  insert into t1 values(0,0,0);
  return 4;
end/
insert into t2 values(2,2,4);
select * from t2 where  s1+s2=n_1();
+------+------+------+
| id   | s1   | s2   |
+------+------+------+
+------+------+------+
select * from t1;
+------+------+------+
| id   | s1   | s2   |
+------+------+------+
|    0 |    0 |    0 |
|    0 |    0 |    0 |
|    5 |    2 |    0 |
|    9 |    2 |    0 |
|    2 |    7 |    0 |
|    3 |    3 |    0 |
|    1 |    1 |    3 |
+------+------+------+
range
不可分
drop table t1;
create table t1 (id int, s1 int,s2 int)  partition by range(id+1)(
  partition p1 values less than(2) ,
  partition p2 values less than(4) ,
  partition p3 values less than(maxvalue)
);
insert into t1 values(1,1,3),(5,2,0),(3,3,0),(9,2,0),(2,7,0);
drop table t2;
create table t2(id int ,s1 int, s2 int);
drop function n_1;
create function n_1() returns int deterministic
begin
  insert into t2 values(1,0,1);
  return 4;
end/
select * from t1 where id < 9 and id > n_1() ;
+------+------+------+
| id   | s1   | s2   |
+------+------+------+
|    5 |    2 |    0 |
+------+------+------+
select * from t2;
+------+------+------+
| id   | s1   | s2   |
+------+------+------+
|    1 |    0 |    1 |
|    1 |    0 |    1 |
|    1 |    0 |    1 |
|    1 |    0 |    1 |
|    1 |    0 |    1 |
|    1 |    0 |    1 |
|    1 |    0 |    1 |
|    1 |    0 |    1 |
|    1 |    0 |    1 |
|    1 |    0 |    1 |
|    1 |    0 |    1 |
+------+------+------+
可分
drop table t1;
create table t1 (id int, s1 int,s2 int)  partition by range(id+1)(
  partition p1 values less than(2) ,
  partition p2 values less than(4) ,
  partition p3 values less than(maxvalue)
);
insert into t1 values(1,1,3),(5,2,0),(3,3,0),(9,2,0),(2,7,0);
drop table t2;
create table t2(id int ,s1 int, s2 int);
drop function n_1;
create function n_1() returns int deterministic
begin
  insert into t2 values(1,0,1);
  return 3;
end/
select n_1() from t1 where id = n_1();
+-------+
| n_1() |
+-------+
|     3 |
+-------+
select * from t2;
+------+------+------+
| id   | s1   | s2   |
+------+------+------+
|    1 |    0 |    1 |
|    1 |    0 |    1 |
|    1 |    0 |    1 |
|    1 |    0 |    1 |
|    1 |    0 |    1 |
+------+------+------+
drop table t1;
create table t1(
  pid  int primary key,
  pname varchar(30)
) partition by range(pid)(
  partition p1 values less than(1000) ,
  partition p2 values less than(2000) ,
  partition p3 values less than(maxvalue)
);
insert into t1 (pid, pname) values (1, '瑶瑶');
insert into t1 (pid, pname) values (1500, '倩倩');
insert into t1 (pid, pname) values (1400, '倩倩');
insert into t1 (pid, pname) values (3000, '小花');
drop table t2;
create table t2(id int ,s1 int, s2 int);
drop function n_1;
create function n_1() returns int deterministic
begin
  insert into t2 values(1,0,1);
  return 1500;
end/
select n_1() from t1  partition (p2) where pid <n_1();
+-------+
| n_1() |
+-------+
|  1500 |
+-------+
select * from t2;
+------+------+------+
| id   | s1   | s2   |
+------+------+------+
|    1 |    0 |    1 |
|    1 |    0 |    1 |
|    1 |    0 |    1 |
|    1 |    0 |    1 |
|    1 |    0 |    1 |
|    1 |    0 |    1 |
|    1 |    0 |    1 |
|    1 |    0 |    1 |
|    1 |    0 |    1 |
|    1 |    0 |    1 |
|    1 |    0 |    1 |
|    1 |    0 |    1 |
|    1 |    0 |    1 |
|    1 |    0 |    1 |
|    1 |    0 |    1 |
|    1 |    0 |    1 |
|    1 |    0 |    1 |
+------+------+------+
#udf_4  udf_dml
insert 嵌套
drop table t1;
create table t1(id int , s1 int, s2 int);
insert into t1(id,s1,s2) values (1,1,3),(5,1,0),(3,1,0);
drop table t2;
create table t2(id int ,s1 int, s2 int);
insert into t1 select n_1(),1,2 from t1;
select count( * ) from t2;
+------------+
| count( * ) |
+------------+
|          2 |
+------------+
drop table t1;
create table t1(id int , s1 int, s2 int);
insert into t1(id,s1,s2) values (1,1,3),(5,1,0),(3,1,0);
drop table t2;
create table t2(id int ,s1 int, s2 int);
insert into t1(id) select s1 from t1 order by (n_1());
select count( * ) from t2;
+------------+
| count( * ) |
+------------+
|          0 |
+------------+
drop table t1;
create table t1(id int , s1 int, s2 int);
insert into t1(id,s1,s2) values (1,1,3),(5,1,0),(3,1,0);
drop table t2;
create table t2(id int ,s1 int, s2 int);
insert into t1(id) select n_1() from t1 order by (n_1());
select count( * ) from t2;
+------------+
| count( * ) |
+------------+
|          2 |
+------------+
drop table t1;
create table t1(id int , s1 int, s2 int);
insert into t1(id,s1,s2) values (1,1,3),(5,1,0),(3,1,0);
drop table t2;
create table t2(id int ,s1 int, s2 int);
insert into t1(id) select n_1() from t1 where n_1()>1;
select count( * ) from t2;
+------------+
| count( * ) |
+------------+
|          3 |
+------------+
drop table t1;
create table t1(id int , s1 int, s2 int);
insert into t1(id,s1,s2) values (1,1,3),(5,1,0),(3,1,0);
drop table t2;
create table t2(id int ,s1 int, s2 int);
insert into t1(id) select n_1() from t1 group by n_1() having max(n_1());
select count( * ) from t2;
+------------+
| count( * ) |
+------------+
|          3 |
+------------+
updata
#43716487 up date set字段等于子查询调用udf值，次数不一致
drop table t1;
create table t1(id int , s1 int, s2 int);
insert into t1(id,s1,s2) values (1,1,3),(5,1,0),(3,1,0),(9,1,0),(2,7,0);
drop table t2;
create table t2(id int(9) ,s1 int, s2 int);
drop function n_1;
create function n_1() returns int deterministic
begin
  insert into t2 values(1,0,1);
  return 3;
end/
drop table t2;
create table t2(id int ,s1 int, s2 int);
update t1 set id=n_1() ;
select count( * ) from t2;
+------------+
| count( * ) |
+------------+
|          1 |
+------------+
drop table t2;
create table t2(id int ,s1 int, s2 int);
update t1 set id=(select n_1() ) ;
select count( * ) from t2;
+------------+
| count( * ) |
+------------+
|          1 |
+------------+
drop table t2;
create table t2(id int ,s1 int, s2 int);
update t1 set id=1 where id=(select n_1());
select count( * ) from t2;
+------------+
| count( * ) |
+------------+
|          2 |
+------------+
update 嵌套
drop table t1;
create table t1(id int, s1 int, s2 int);
insert into t1 values(0,1,3),(1,0,0);
drop table t3;
ERROR 42S02: Unknown table 'nxa.t3'
create table t3(id int, s1 int, s2 int);
insert into t3 values(0,1,3),(1,0,0);
drop table t2;
create table t2(id int ,s1 int, s2 int);
update t1 set id=(select n_1() from t3 where t3.s1=1 );
select count( * ) from t2;
+------------+
| count( * ) |
+------------+
|          2 |
+------------+
drop table t2;
create table t2(id int ,s1 int, s2 int);
update t1 set id=(select n_1() from t3  limit 1);
select count( * ) from t2;
+------------+
| count( * ) |
+------------+
|          2 |
+------------+
drop table t1;
create table t1(stats int, s1 int, s2 int);
insert into t1 values(0,1,3),(1,0,0);
drop table t2;
create table t2(id int ,s1 int, s2 int);
update t1 set stats=(select n_1() from t3 group by n_1() having max(n_1()));
select count( * ) from t2;
+------------+
| count( * ) |
+------------+
|          3 |
+------------+
delete
drop table t1;
create table t1(id int , s1 int, s2 int);
insert into t1(id,s1,s2) values (1,1,3),(5,1,0),(3,1,0),(9,1,0),(3,7,0);
drop table t2;
create table t2(id int(9) ,s1 int, s2 int);
drop function n_1;
create function n_1() returns int deterministic
begin
  insert into t2 values(1,0,1);
  return 3;
end/
delete from t1 where id=n_1();
select count( * ) from t2;
+------------+
| count( * ) |
+------------+
|          2 |
+------------+
drop table t1;
create table t1(id int, s1 int, s2 int);
insert into t1 values(0,1,3),(1,0,0);
drop table t3;
create table t3(id int, s1 int, s2 int);
insert into t3 values(0,1,3),(1,0,0);
drop table t2;
create table t2(id int ,s1 int, s2 int);
delete from t1 where id=(select n_1() from t3 group by n_1() having max(n_1()));
select count( * ) from t2;
+------------+
| count( * ) |
+------------+
|          3 |
+------------+
limit
drop table t1;
create table t1(id int, s1 int, s2 int);
insert into t1 values(0,1,3),(1,0,0);
drop table t3;
create table t3(id int, s1 int, s2 int);
insert into t3 values(0,3,3),(1,0,0),(0,3,0);
drop table t2;
create table t2(id int ,s1 int, s2 int);
delete from t1 where id =(select id from t3 where s1 = n_1() limit 1);
select count( * ) from t2;
+------------+
| count( * ) |
+------------+
|          2 |
+------------+
replace into
drop table t1;
create table t1(id int, s1 int, s2 int);
insert into t1 values(0,1,3),(1,0,0);
drop table t3;
create table t3(id int, s1 int, s2 int);
insert into t3 values(0,3,3),(1,0,0),(0,3,0);
drop function n_1;
create function n_1() returns int deterministic
begin
  insert into t2 values(1,0,1);
  return 3;
end/
drop table t2;
create table t2(id int ,s1 int, s2 int);
replace into t1 select n_1(),1,2 from t3;
select count( * ) from t2;
+------------+
| count( * ) |
+------------+
|          2 |
+------------+
drop table t1;
create table t1(id int, s1 int, s2 int);
insert into t1 values(0,1,3),(1,0,0);
drop table t2;
create table t2(id int ,s1 int, s2 int);
replace into t1 values(n_1(),1,2);
select count( * ) from t2;
+------------+
| count( * ) |
+------------+
|          1 |
+------------+
delete from t1;
insert into t1 values(0,1,3),(1,0,0);
drop table t2;
create table t2(id int ,s1 int, s2 int);
replace into t1(id) select n_1() from t3 group by n_1() having max(n_1());
select count( * ) from t2;
+------------+
| count( * ) |
+------------+
|          3 |
+------------+
delete from t1;
insert into t1 values(0,1,3),(1,0,0);
drop table t2;
create table t2(id int ,s1 int, s2 int);
replace into t1 select * from t3 order by (n_1());
select count( * ) from t2;
+------------+
| count( * ) |
+------------+
|          0 |
+------------+
drop table t1;
create table t1(id int, s1 int, s2 int);
drop table t2;
create table t2(id int ,s1 int, s2 int);
insert into t1(id) select n_1() from t3 where n_1()>1;
select count( * ) from t2;
+------------+
| count( * ) |
+------------+
|          3 |
+------------+
当replace into为改的情况，ob计算为空
drop table t1;
create table t1(stats int primary key, s1 int, s2 int);
insert into t1 values(0,1,3),(1,0,0);
drop function n_1;
create function n_1() returns int deterministic
begin
  insert into t2 values(1,0,1);
  return 1;
end/
drop table t2;
create table t2(id int ,s1 int, s2 int);
replace into t1 values(n_1(),1,2);
select count( * ) from t2;
+------------+
| count( * ) |
+------------+
|          0 |
+------------+
drop table t1;
create table t1(stats int primary key, s1 int, s2 int);
insert into t1 values(0,1,3),(1,0,0);
drop table t2;
create table t2(id int ,s1 int, s2 int);
replace into t1 select n_1(),1,2 from t3;
select count( * ) from t2;
+------------+
| count( * ) |
+------------+
|          1 |
+------------+
drop table t1;
create table t1(stats int primary key, s1 int, s2 int);
insert into t1 values(0,1,3),(1,0,0);
drop table t2;
create table t2(id int ,s1 int, s2 int);
replace into t1(stats) select n_1() from t3 order by n_1();
select count( * ) from t2;
+------------+
| count( * ) |
+------------+
|          1 |
+------------+
drop table t1;
create table t1(stats int primary key, s1 int, s2 int);
insert into t1 values(0,1,3),(1,0,0);
drop table t2;
create table t2(id int ,s1 int, s2 int);
replace into t1(stats) select n_1() from t3 group by n_1() having sum(n_1())>0;
select count( * ) from t2;
+------------+
| count( * ) |
+------------+
|          1 |
+------------+
###清理环境
drop user yyl;
purge recyclebin;
