set ob_trx_timeout = 10000000000;
set ob_query_timeout = 10000000000;
drop database if exists nxa;
create database nxa  character set utf8;
use nxa;
set ob_enable_plan_cache=0;
set@@sql_mode='strict_all_tables,no_zero_date,no_zero_in_date,error_for_division_by_zero ';
result_format: 4
#udf_3_3 subquery_udf
#udf_1  select 
#udf_1_1  一般select
#前置条件
drop table t1;
ERROR 42S02: Unknown table 'nxa.t1'
create table t1(stats int , s1 int primary key, s2 int);
insert into t1 values(2,1,3),(1,0,0),(0,2,0);
drop table t2;
ERROR 42S02: Unknown table 'nxa.t2'
create table t2(id int ,s1 int, s2 int);
drop function n_1;
ERROR 42000: FUNCTION nxa.n_1 does not exist
create function n_1(a int) returns int deterministic 
begin
  insert into t2 values(1,0,1);
  return a;
end/
#查询场景
#一般select
select (select n_1(s1)) from t1;
+------------------+
| (select n_1(s1)) |
+------------------+
|                0 |
|                1 |
|                2 |
+------------------+
select count(*) from t2;
+----------+
| count(*) |
+----------+
|        3 |
+----------+
#distinct
drop table t1;
create table t1(id int primary key, s1 int, s2 int);
insert into t1 values(1,1,3),(5,1,0),(3,1,0),(9,1,0),(2,7,0);
drop table t3;
ERROR 42S02: Unknown table 'nxa.t3'
create table t3(bid int ,s1 int, s2 int);
INSERT INTO t3 VALUES(0,1,3),(1,6,0),(2,7,0);
drop table t2;
create table t2(id int ,s1 int, s2 int);
drop function n_1;
create function n_1(a int) returns int deterministic 
begin
  insert into t2 values(1,0,1);
  return a;
end/
select distinct((select n_1(s1))) from t1 ;
+--------------------+
| ((select n_1(s1))) |
+--------------------+
|                  1 |
|                  7 |
+--------------------+
select * from t2;
+------+------+------+
| id   | s1   | s2   |
+------+------+------+
|    1 |    0 |    1 |
|    1 |    0 |    1 |
|    1 |    0 |    1 |
|    1 |    0 |    1 |
|    1 |    0 |    1 |
+------+------+------+
drop table t1;
create table t1(id int primary key, s1 int, s2 int);
insert into t1 values(1,1,3),(5,1,0),(3,1,0),(9,1,0),(2,7,0);
drop table t2;
create table t2(id int ,s1 int, s2 int);
drop function n_1;
create function n_1(a int) returns int deterministic 
begin
  insert into t2 values(1,0,1);
  return a;
end/
select distinct((select n_1(s1))) from t1 order by (select n_1(s1)) ;
+--------------------+
| ((select n_1(s1))) |
+--------------------+
|                  1 |
|                  7 |
+--------------------+
select * from t2;
+------+------+------+
| id   | s1   | s2   |
+------+------+------+
|    1 |    0 |    1 |
|    1 |    0 |    1 |
|    1 |    0 |    1 |
|    1 |    0 |    1 |
|    1 |    0 |    1 |
+------+------+------+
#运算
drop table t2;
create table t2(id int ,s1 int, s2 int);
select (select n_1(s1))+(select n_1(s1)) from t1 order by id;
+-----------------------------------+
| (select n_1(s1))+(select n_1(s1)) |
+-----------------------------------+
|                                 2 |
|                                14 |
|                                 2 |
|                                 2 |
|                                 2 |
+-----------------------------------+
select count(*) from t2;
+----------+
| count(*) |
+----------+
|       10 |
+----------+
select (select n_1(s1))-(select n_1(s1)) from t1 order by id;
+-----------------------------------+
| (select n_1(s1))-(select n_1(s1)) |
+-----------------------------------+
|                                 0 |
|                                 0 |
|                                 0 |
|                                 0 |
|                                 0 |
+-----------------------------------+
select count(*) from t2;
+----------+
| count(*) |
+----------+
|       20 |
+----------+
select (select n_1(s1)) * (select n_1(s1)) from t1 order by id;
+-------------------------------------+
| (select n_1(s1)) * (select n_1(s1)) |
+-------------------------------------+
|                                   1 |
|                                  49 |
|                                   1 |
|                                   1 |
|                                   1 |
+-------------------------------------+
select count(*) from t2;
+----------+
| count(*) |
+----------+
|       30 |
+----------+
select (select n_1(s1)) div (select n_1(s1)) from t1 order by id;
+---------------------------------------+
| (select n_1(s1)) div (select n_1(s1)) |
+---------------------------------------+
|                                     1 |
|                                     1 |
|                                     1 |
|                                     1 |
|                                     1 |
+---------------------------------------+
select count(*) from t2;
+----------+
| count(*) |
+----------+
|       40 |
+----------+
drop table t2;
create table t2(id int ,s1 int, s2 int);
select (select n_1(s1))+2 from t1 order by id;
+--------------------+
| (select n_1(s1))+2 |
+--------------------+
|                  3 |
|                  9 |
|                  3 |
|                  3 |
|                  3 |
+--------------------+
select count(*) from t2;
+----------+
| count(*) |
+----------+
|        5 |
+----------+
select (select n_1(s1))-3 from t1 order by id;
+--------------------+
| (select n_1(s1))-3 |
+--------------------+
|                 -2 |
|                  4 |
|                 -2 |
|                 -2 |
|                 -2 |
+--------------------+
select count(*) from t2;
+----------+
| count(*) |
+----------+
|       10 |
+----------+
select (select n_1(s1)) * 3 from t1 order by id;
+----------------------+
| (select n_1(s1)) * 3 |
+----------------------+
|                    3 |
|                   21 |
|                    3 |
|                    3 |
|                    3 |
+----------------------+
select count(*) from t2;
+----------+
| count(*) |
+----------+
|       15 |
+----------+
select (select n_1(s1)) div 6 from t1 order by id;
+------------------------+
| (select n_1(s1)) div 6 |
+------------------------+
|                      0 |
|                      1 |
|                      0 |
|                      0 |
|                      0 |
+------------------------+
select count(*) from t2;
+----------+
| count(*) |
+----------+
|       20 |
+----------+
drop table t2;
create table t2(id int ,s1 int, s2 int);
select (select n_1(s1))+id from t1 order by id;
+---------------------+
| (select n_1(s1))+id |
+---------------------+
|                   2 |
|                   9 |
|                   4 |
|                   6 |
|                  10 |
+---------------------+
select count(*) from t2;
+----------+
| count(*) |
+----------+
|        5 |
+----------+
select (select n_1(s1))-id from t1 order by id;
+---------------------+
| (select n_1(s1))-id |
+---------------------+
|                   0 |
|                   5 |
|                  -2 |
|                  -4 |
|                  -8 |
+---------------------+
select count(*) from t2;
+----------+
| count(*) |
+----------+
|       10 |
+----------+
select (select n_1(s1)) * id from t1 order by id;
+-----------------------+
| (select n_1(s1)) * id |
+-----------------------+
|                     1 |
|                    14 |
|                     3 |
|                     5 |
|                     9 |
+-----------------------+
select count(*) from t2;
+----------+
| count(*) |
+----------+
|       15 |
+----------+
select (select n_1(s1)) div id from t1 order by id;
+-------------------------+
| (select n_1(s1)) div id |
+-------------------------+
|                       1 |
|                       3 |
|                       0 |
|                       0 |
|                       0 |
+-------------------------+
select count(*) from t2;
+----------+
| count(*) |
+----------+
|       20 |
+----------+
#concat
drop table t2;
create table t2(id int ,s1 int, s2 int);
select concat((select n_1(s1)),(select n_1(s1))) from t1 ;
+-------------------------------------------+
| concat((select n_1(s1)),(select n_1(s1))) |
+-------------------------------------------+
| 11                                        |
| 77                                        |
| 11                                        |
| 11                                        |
| 11                                        |
+-------------------------------------------+
select count(*) from t2;
+----------+
| count(*) |
+----------+
|       10 |
+----------+
#udf_1_2  函数嵌套
#前置条件
drop table t1;
create table t1(stats int , s1 int primary key, s2 int);
insert into t1 values(2,1,3),(1,0,0),(0,2,0);
drop table t2;
create table t2(id int ,s1 int, s2 int);
drop function n_1;
create function n_1(a int) returns int deterministic 
begin
  insert into t2 values(1,0,1);
  return a;
end/
#字符和数字函数
select count(*) from t2;
+----------+
| count(*) |
+----------+
|        0 |
+----------+
select ascii ((select n_1(s1))) from t1 order by stats;
+--------------------------+
| ascii ((select n_1(s1))) |
+--------------------------+
|                       50 |
|                       48 |
|                       49 |
+--------------------------+
select count(*) from t2;
+----------+
| count(*) |
+----------+
|        3 |
+----------+
select instr((select n_1(s1)),1) from t1 order by stats;
+---------------------------+
| instr((select n_1(s1)),1) |
+---------------------------+
|                         0 |
|                         0 |
|                         1 |
+---------------------------+
select count(*) from t2;
+----------+
| count(*) |
+----------+
|        6 |
+----------+
select length((select n_1(s1))) from t1 order by stats;
+--------------------------+
| length((select n_1(s1))) |
+--------------------------+
|                        1 |
|                        1 |
|                        1 |
+--------------------------+
select count(*) from t2;
+----------+
| count(*) |
+----------+
|        9 |
+----------+
select abs((select n_1(s1))) from t1 order by stats;
+-----------------------+
| abs((select n_1(s1))) |
+-----------------------+
|                     2 |
|                     0 |
|                     1 |
+-----------------------+
select count(*) from t2;
+----------+
| count(*) |
+----------+
|       12 |
+----------+
select ceil((select n_1(s1)))from t1 order by stats;
+------------------------+
| ceil((select n_1(s1))) |
+------------------------+
|                      2 |
|                      0 |
|                      1 |
+------------------------+
select count(*) from t2;
+----------+
| count(*) |
+----------+
|       15 |
+----------+
select floor((select n_1(s1))) from t1 order by stats;
+-------------------------+
| floor((select n_1(s1))) |
+-------------------------+
|                       2 |
|                       0 |
|                       1 |
+-------------------------+
select count(*) from t2;
+----------+
| count(*) |
+----------+
|       18 |
+----------+
select sin((select n_1(s1))) from t1 order by stats;
+-----------------------+
| sin((select n_1(s1))) |
+-----------------------+
|    0.9092974268256817 |
|                     0 |
|    0.8414709848078965 |
+-----------------------+
select count(*) from t2;
+----------+
| count(*) |
+----------+
|       21 |
+----------+
select cos((select n_1(s1))) from t1 order by stats;
+-----------------------+
| cos((select n_1(s1))) |
+-----------------------+
|   -0.4161468365471424 |
|                     1 |
|    0.5403023058681398 |
+-----------------------+
select count(*) from t2;
+----------+
| count(*) |
+----------+
|       24 |
+----------+
select sign((select n_1(s1))) from t1 order by stats;
+------------------------+
| sign((select n_1(s1))) |
+------------------------+
|                      1 |
|                      0 |
|                      1 |
+------------------------+
select count(*) from t2;
+----------+
| count(*) |
+----------+
|       27 |
+----------+
select power((select n_1(s1)),0.5) from t1 order by stats;
+-----------------------------+
| power((select n_1(s1)),0.5) |
+-----------------------------+
|          1.4142135623730951 |
|                           0 |
|                           1 |
+-----------------------------+
select count(*) from t2;
+----------+
| count(*) |
+----------+
|       30 |
+----------+
select mod((select n_1(s1)),stats) from t1 order by stats;
+-----------------------------+
| mod((select n_1(s1)),stats) |
+-----------------------------+
|                        NULL |
|                           0 |
|                           1 |
+-----------------------------+
select count(*) from t2;
+----------+
| count(*) |
+----------+
|       33 |
+----------+
select round((select n_1(s1))) from t1 order by stats;
+-------------------------+
| round((select n_1(s1))) |
+-------------------------+
|                       2 |
|                       0 |
|                       1 |
+-------------------------+
select count(*) from t2;
+----------+
| count(*) |
+----------+
|       36 |
+----------+
select sqrt((select n_1(s1))) from t1 order by stats;
+------------------------+
| sqrt((select n_1(s1))) |
+------------------------+
|     1.4142135623730951 |
|                      0 |
|                      1 |
+------------------------+
select count(*) from t2;
+----------+
| count(*) |
+----------+
|       39 |
+----------+
#聚合函数
drop table t2;
create table t2(id int ,s1 int, s2 int);
select sum((select n_1(s1))) from t1 order by stats ;
+-----------------------+
| sum((select n_1(s1))) |
+-----------------------+
|                     3 |
+-----------------------+
select count(*) from t2;
+----------+
| count(*) |
+----------+
|        3 |
+----------+
select count((select n_1(s1))) from t1 order by stats ;
+-------------------------+
| count((select n_1(s1))) |
+-------------------------+
|                       3 |
+-------------------------+
select count(*) from t2;
+----------+
| count(*) |
+----------+
|        6 |
+----------+
select avg((select n_1(s1))) from t1 order by stats ;
+-----------------------+
| avg((select n_1(s1))) |
+-----------------------+
|                1.0000 |
+-----------------------+
select count( * ) from t2;
+------------+
| count( * ) |
+------------+
|          9 |
+------------+
drop table t2;
create table t2(id int ,s1 int, s2 int);
select max((select n_1(s1))) from t1 ;
+-----------------------+
| max((select n_1(s1))) |
+-----------------------+
|                     2 |
+-----------------------+
select count( * ) from t2;
+------------+
| count( * ) |
+------------+
|          3 |
+------------+
select min((select n_1(s1))) from t1 order by stats ;
+-----------------------+
| min((select n_1(s1))) |
+-----------------------+
|                     0 |
+-----------------------+
select count( * ) from t2;
+------------+
| count( * ) |
+------------+
|          6 |
+------------+
#udf_1_3 where子句
#前置条件
drop table t1;
create table t1(stats int , s1 int primary key, s2 int);
insert into t1 values(2,1,3),(1,0,0),(0,2,0);
drop table t2;
create table t2(id int ,s1 int, s2 int);
drop function n_1;
create function n_1(a int) returns int deterministic 
begin
  insert into t2 values(1,0,1);
  return a;
end/
#字段与函数值比较
select * from t1 where stats = (select n_1(s1));
+-------+----+------+
| stats | s1 | s2   |
+-------+----+------+
+-------+----+------+
select count(*) from t2;
+----------+
| count(*) |
+----------+
|        3 |
+----------+
select * from t1 where stats != (select n_1(s1));
+-------+----+------+
| stats | s1 | s2   |
+-------+----+------+
|     1 |  0 |    0 |
|     2 |  1 |    3 |
|     0 |  2 |    0 |
+-------+----+------+
select count(*) from t2;
+----------+
| count(*) |
+----------+
|        6 |
+----------+
select * from t1 where stats < (select n_1(s1));
+-------+----+------+
| stats | s1 | s2   |
+-------+----+------+
|     0 |  2 |    0 |
+-------+----+------+
select count(*) from t2;
+----------+
| count(*) |
+----------+
|        9 |
+----------+
select * from t1 where stats > (select n_1(s1));
+-------+----+------+
| stats | s1 | s2   |
+-------+----+------+
|     1 |  0 |    0 |
|     2 |  1 |    3 |
+-------+----+------+
select count(*) from t2;
+----------+
| count(*) |
+----------+
|       12 |
+----------+
select * from t1 where stats <= (select n_1(s1));
+-------+----+------+
| stats | s1 | s2   |
+-------+----+------+
|     0 |  2 |    0 |
+-------+----+------+
select count(*) from t2;
+----------+
| count(*) |
+----------+
|       15 |
+----------+
select * from t1 where stats >= (select n_1(s1));
+-------+----+------+
| stats | s1 | s2   |
+-------+----+------+
|     1 |  0 |    0 |
|     2 |  1 |    3 |
+-------+----+------+
select count(*) from t2;
+----------+
| count(*) |
+----------+
|       18 |
+----------+
#函数值比较
drop table t2;
create table t2(id int ,s1 int, s2 int);
select * from t1 where (select n_1(s1))=0;
+-------+----+------+
| stats | s1 | s2   |
+-------+----+------+
|     1 |  0 |    0 |
+-------+----+------+
select count( * ) from t2;
+------------+
| count( * ) |
+------------+
|          3 |
+------------+
select * from t1 where (select n_1(s1))!=0;
+-------+----+------+
| stats | s1 | s2   |
+-------+----+------+
|     2 |  1 |    3 |
|     0 |  2 |    0 |
+-------+----+------+
select count( * ) from t2;
+------------+
| count( * ) |
+------------+
|          6 |
+------------+
select * from t1 where (select n_1(s1))<1;
+-------+----+------+
| stats | s1 | s2   |
+-------+----+------+
|     1 |  0 |    0 |
+-------+----+------+
select count( * ) from t2;
+------------+
| count( * ) |
+------------+
|          9 |
+------------+
select * from t1 where (select n_1(s1))>1;
+-------+----+------+
| stats | s1 | s2   |
+-------+----+------+
|     0 |  2 |    0 |
+-------+----+------+
select count( * ) from t2;
+------------+
| count( * ) |
+------------+
|         12 |
+------------+
select * from t1 where (select n_1(s1))<=1;
+-------+----+------+
| stats | s1 | s2   |
+-------+----+------+
|     1 |  0 |    0 |
|     2 |  1 |    3 |
+-------+----+------+
select count( * ) from t2;
+------------+
| count( * ) |
+------------+
|         15 |
+------------+
select (select n_1(s1)) from t1 where (select n_1(s1))>=1;
+------------------+
| (select n_1(s1)) |
+------------------+
|                1 |
|                2 |
+------------------+
select count( * ) from t2;
+------------+
| count( * ) |
+------------+
|         20 |
+------------+
select (select n_1(s1)) from t1 where (select n_1(s1))=0;
+------------------+
| (select n_1(s1)) |
+------------------+
|                0 |
+------------------+
select count( * ) from t2;
+------------+
| count( * ) |
+------------+
|         24 |
+------------+
select * from t1 where (select n_1(s1))=(select n_1(s1));
+-------+----+------+
| stats | s1 | s2   |
+-------+----+------+
|     1 |  0 |    0 |
|     2 |  1 |    3 |
|     0 |  2 |    0 |
+-------+----+------+
select count( * ) from t2;
+------------+
| count( * ) |
+------------+
|         30 |
+------------+
#between..and
drop table t2;
create table t2(id int ,s1 int, s2 int);
select * from t1 where stats between ((select n_1(s1))) and 9;
+-------+----+------+
| stats | s1 | s2   |
+-------+----+------+
|     1 |  0 |    0 |
|     2 |  1 |    3 |
+-------+----+------+
select count( * ) from t2;
+------------+
| count( * ) |
+------------+
|          3 |
+------------+
select (select n_1(s1)) from t1 where stats between 0 and 9;
+------------------+
| (select n_1(s1)) |
+------------------+
|                0 |
|                1 |
|                2 |
+------------------+
select count( * ) from t2;
+------------+
| count( * ) |
+------------+
|          6 |
+------------+
select (select n_1(s1)) from t1 where stats between ((select n_1(s1))) and 9;
+------------------+
| (select n_1(s1)) |
+------------------+
|                0 |
|                1 |
+------------------+
select count( * ) from t2;
+------------+
| count( * ) |
+------------+
|         11 |
+------------+
#in
#一个参数
drop table t2;
create table t2(id int ,s1 int, s2 int);
select * from t1 where stats in((select n_1(s1)));
+-------+----+------+
| stats | s1 | s2   |
+-------+----+------+
+-------+----+------+
select count( * ) from t2;
+------------+
| count( * ) |
+------------+
|          3 |
+------------+
select * from t1 where stats not in((select n_1(s1)));
+-------+----+------+
| stats | s1 | s2   |
+-------+----+------+
|     1 |  0 |    0 |
|     2 |  1 |    3 |
|     0 |  2 |    0 |
+-------+----+------+
select count( * ) from t2;
+------------+
| count( * ) |
+------------+
|          6 |
+------------+
#两个参数
drop table t2;
create table t2(id int ,s1 int, s2 int);
select * from t1 where stats in (((select n_1(s1))) ,4);
+-------+----+------+
| stats | s1 | s2   |
+-------+----+------+
+-------+----+------+
select count( * ) from t2;
+------------+
| count( * ) |
+------------+
|          3 |
+------------+
select * from t1 where stats not in (((select n_1(s1))) ,4);
+-------+----+------+
| stats | s1 | s2   |
+-------+----+------+
|     1 |  0 |    0 |
|     2 |  1 |    3 |
|     0 |  2 |    0 |
+-------+----+------+
select count( * ) from t2;
+------------+
| count( * ) |
+------------+
|          6 |
+------------+
#and
drop table t1;
create table t1(id int , s1 int, s2 int);
insert into t1 values(1,1,3),(5,2,0),(3,3,0);
drop table t2;
create table t2(id int ,s1 int, s2 int);
drop function n_1;
create function n_1(a int) returns int deterministic 
begin
  insert into t2 values(1,0,1);
  return a;
end/
select count(*) from t1 where (id = (select n_1(s1)) or id = 2) and s1 < 3 ;
+----------+
| count(*) |
+----------+
|        1 |
+----------+
select * from t2;
+------+------+------+
| id   | s1   | s2   |
+------+------+------+
|    1 |    0 |    1 |
|    1 |    0 |    1 |
+------+------+------+
drop table t2;
create table t2(id int ,s1 int, s2 int);
select * from t1 where id =(select n_1(s1)) and id =(select n_1(s1));
+------+------+------+
| id   | s1   | s2   |
+------+------+------+
|    1 |    1 |    3 |
|    3 |    3 |    0 |
+------+------+------+
select count( * ) from t2;
+------------+
| count( * ) |
+------------+
|          3 |
+------------+
#or
drop table t2;
create table t2(id int ,s1 int, s2 int);
select * from t1 where id =(select n_1(s1)) or id =(select n_1(s1));
+------+------+------+
| id   | s1   | s2   |
+------+------+------+
|    1 |    1 |    3 |
|    3 |    3 |    0 |
+------+------+------+
select count( * ) from t2;
+------------+
| count( * ) |
+------------+
|          3 |
+------------+
#is null
drop table t4;
ERROR 42S02: Unknown table 'nxa.t4'
create table t4(s1 int,s2 int);
insert into t4 values(null,3);
drop function n_2;
ERROR 42000: FUNCTION nxa.n_2 does not exist
create function n_2(a int) returns int 
begin
  insert into t2 values(null,1,a);
  return a;
end/
drop table t2;
create table t2(id int ,s1 int, s2 int);
select * from t4 where (select n_2(s1)) is null ;
+------+------+
| s1   | s2   |
+------+------+
| NULL |    3 |
+------+------+
select count(*) from t2;
+----------+
| count(*) |
+----------+
|        1 |
+----------+
select * from t4 where (select n_2(s1)) is not null ;
+------+------+
| s1   | s2   |
+------+------+
+------+------+
select count(*) from t2;
+----------+
| count(*) |
+----------+
|        2 |
+----------+
#where包含运算
drop table t2;
create table t2(id int ,s1 int, s2 int);
select * from t1 where ((select n_1(s1)) div 0) is null;
+------+------+------+
| id   | s1   | s2   |
+------+------+------+
|    1 |    1 |    3 |
|    5 |    2 |    0 |
|    3 |    3 |    0 |
+------+------+------+
select count( * ) from t2;
+------------+
| count( * ) |
+------------+
|          3 |
+------------+
select * from t1 where ((select n_1(s1))+(select n_1(s1)))=0;
+------+------+------+
| id   | s1   | s2   |
+------+------+------+
+------+------+------+
select count( * ) from t2;
+------------+
| count( * ) |
+------------+
|          9 |
+------------+
select * from t1 where (select (select n_1(s1))+(select n_1(s1)) from t1 where id=1) =2;
+------+------+------+
| id   | s1   | s2   |
+------+------+------+
|    1 |    1 |    3 |
|    5 |    2 |    0 |
|    3 |    3 |    0 |
+------+------+------+
select count( * ) from t2;
+------------+
| count( * ) |
+------------+
|         11 |
+------------+
#like
drop table t2;
create table t2(id int ,s1 int, s2 int);
select * from t1 where (select n_1(s1)) like '%0%';
+------+------+------+
| id   | s1   | s2   |
+------+------+------+
+------+------+------+
select count( * ) from t2;
+------------+
| count( * ) |
+------------+
|          3 |
+------------+
select * from t1 where (select (select n_1(s1)) from t1 where id=1) like '%1%';
+------+------+------+
| id   | s1   | s2   |
+------+------+------+
|    1 |    1 |    3 |
|    5 |    2 |    0 |
|    3 |    3 |    0 |
+------+------+------+
select count( * ) from t2;
+------------+
| count( * ) |
+------------+
|          4 |
+------------+
#判定ture或false
#前置条件
drop table t3;
create table t3(id int , s1 int, s2 int);
insert into t3 values(1,1,3),(5,2,0),(3,3,0);
drop table t1;
create table t1(stats int , s1 int primary key, s2 int);
insert into t1 values(2,1,3),(1,0,0),(0,2,0);
drop table t2;
create table t2(id int ,s1 int, s2 int);
drop function n_1;
create function n_1(a int) returns int deterministic 
begin
  insert into t2 values(1,0,1);
  return a;
end/
#exists
drop table t2;
create table t2(id int ,s1 int, s2 int);
select * from t1 where exists (select (select n_1(s1)) from t3 where t1.stats = t3.id);
+-------+----+------+
| stats | s1 | s2   |
+-------+----+------+
|     1 |  0 |    0 |
+-------+----+------+
select count( * ) from t2;
+------------+
| count( * ) |
+------------+
|          0 |
+------------+
delete from t2;
select * from t1 where exists (select (select n_1(s1)) =0);
+-------+----+------+
| stats | s1 | s2   |
+-------+----+------+
|     1 |  0 |    0 |
|     2 |  1 |    3 |
|     0 |  2 |    0 |
+-------+----+------+
select count( * ) from t2;
+------------+
| count( * ) |
+------------+
|          0 |
+------------+
delete from t2;
select * from t1 where exists (select (select n_1(s1)) from dual);
+-------+----+------+
| stats | s1 | s2   |
+-------+----+------+
|     1 |  0 |    0 |
|     2 |  1 |    3 |
|     0 |  2 |    0 |
+-------+----+------+
select count( * ) from t2;
+------------+
| count( * ) |
+------------+
|          0 |
+------------+
delete from t2;
select * from t1 where exists (select * from t1 where s1=(select n_1(s1)));
+-------+----+------+
| stats | s1 | s2   |
+-------+----+------+
|     1 |  0 |    0 |
|     2 |  1 |    3 |
|     0 |  2 |    0 |
+-------+----+------+
select count( * ) from t2;
+------------+
| count( * ) |
+------------+
|          1 |
+------------+
drop table t1;
create table t1(id int , s1 int, s2 int);
insert into t1 values(1,3,5);
insert into t1 values(2,2,4);
insert into t1 values(3,3,3);
drop table t2;
create table t2(id int ,s1 int, s2 int);
drop function n_1;
create function n_1(a int) returns int deterministic 
begin
  insert into t2 values(1,0,1);
  return a;
end/
select * from t1 where exists (select * from t1 where s2=(select n_1(s1)));
+------+------+------+
| id   | s1   | s2   |
+------+------+------+
|    1 |    3 |    5 |
|    2 |    2 |    4 |
|    3 |    3 |    3 |
+------+------+------+
select * from t2;
+------+------+------+
| id   | s1   | s2   |
+------+------+------+
|    1 |    0 |    1 |
|    1 |    0 |    1 |
|    1 |    0 |    1 |
+------+------+------+
#any和all
drop table t1;
create table t1(stats int , s1 int , s2 int);
insert into t1 values(2,1,3),(1,0,0),(0,0,0);
drop table t2;
create table t2(id int ,s1 int, s2 int);
drop function n_1;
create function n_1(a int) returns int deterministic 
begin
  insert into t2 values(1,0,1);
  return a;
end/
select * from t1 where (select n_1(s1)) > any (select s1 from t1 );
+-------+------+------+
| stats | s1   | s2   |
+-------+------+------+
|     2 |    1 |    3 |
+-------+------+------+
SELECT * FROM t2;
+------+------+------+
| id   | s1   | s2   |
+------+------+------+
|    1 |    0 |    1 |
|    1 |    0 |    1 |
+------+------+------+
drop table t1;
create table t1(stats int , s1 int , s2 int);
insert into t1 values(2,1,3),(1,0,0),(0,0,0),(9,9,9);
drop table t2;
create table t2(id int ,s1 int, s2 int);
drop function n_1;
create function n_1(a int) returns int deterministic 
begin
  insert into t2 values(1,0,1);
  return a;
end/
select * from t1 where s1 = any (select (select n_1(s1)) from t1 );
+-------+------+------+
| stats | s1   | s2   |
+-------+------+------+
|     2 |    1 |    3 |
|     1 |    0 |    0 |
|     0 |    0 |    0 |
|     9 |    9 |    9 |
+-------+------+------+
SELECT * FROM t2;
+------+------+------+
| id   | s1   | s2   |
+------+------+------+
|    1 |    0 |    1 |
|    1 |    0 |    1 |
|    1 |    0 |    1 |
|    1 |    0 |    1 |
+------+------+------+
drop table t1;
create table t1(stats int , s1 int , s2 int);
insert into t1 values(2,1,3),(1,0,1),(0,0,0),(9,9,9);
drop table t2;
create table t2(id int ,s1 int, s2 int);
drop function n_1;
create function n_1(a int) returns int deterministic 
begin
  insert into t2 values(1,0,1);
  return a;
end/
select * from t1 where s1 = any (select s2 from t1 where stats in ((select n_1(s1)),9,1));
+-------+------+------+
| stats | s1   | s2   |
+-------+------+------+
|     2 |    1 |    3 |
|     1 |    0 |    1 |
|     0 |    0 |    0 |
|     9 |    9 |    9 |
+-------+------+------+
SELECT * FROM t2;
+------+------+------+
| id   | s1   | s2   |
+------+------+------+
|    1 |    0 |    1 |
|    1 |    0 |    1 |
|    1 |    0 |    1 |
|    1 |    0 |    1 |
+------+------+------+
drop table t1;
create table t1(stats int , s1 int , s2 int);
insert into t1 values(2,1,3),(1,0,0),(0,0,0);
drop table t2;
create table t2(id int ,s1 int, s2 int);
drop function n_1;
drop function n_2;
create function n_1(a int) returns int deterministic 
begin
  insert into t2 values(1,0,1);
  return a;
end/
select * from t1 where (select n_1(s1)) = any (select (select n_1(s1)) from t1 );
+-------+------+------+
| stats | s1   | s2   |
+-------+------+------+
|     2 |    1 |    3 |
|     1 |    0 |    0 |
|     0 |    0 |    0 |
+-------+------+------+
SELECT * FROM t2;
+------+------+------+
| id   | s1   | s2   |
+------+------+------+
|    1 |    0 |    1 |
|    1 |    0 |    1 |
|    1 |    0 |    1 |
|    1 |    0 |    1 |
|    1 |    0 |    1 |
+------+------+------+
##all
drop table t1;
create table t1(stats int , s1 int , s2 int);
insert into t1 values(2,1,3),(1,1,0),(0,3,0);
drop table t2;
create table t2(id int ,s1 int, s2 int);
drop function n_1;
create function n_1(a int) returns int deterministic 
begin
  insert into t2 values(1,0,1);
  return a;
end/
select * from t1 where (select n_1(s1)) > all (select s1 from t1);
+-------+------+------+
| stats | s1   | s2   |
+-------+------+------+
+-------+------+------+
SELECT * FROM t2;
+------+------+------+
| id   | s1   | s2   |
+------+------+------+
|    1 |    0 |    1 |
|    1 |    0 |    1 |
+------+------+------+
drop table t1;
create table t1(stats int , s1 int , s2 int);
insert into t1 values(2,1,3),(1,1,0),(0,1,0),(9,1,9);
drop table t2;
create table t2(id int ,s1 int, s2 int);
drop function n_1;
create function n_1(a int) returns int deterministic 
begin
  insert into t2 values(1,0,1);
  return a;
end/
select * from t1 where s1 = all (select (select n_1(s1)) from t1 );
+-------+------+------+
| stats | s1   | s2   |
+-------+------+------+
|     2 |    1 |    3 |
|     1 |    1 |    0 |
|     0 |    1 |    0 |
|     9 |    1 |    9 |
+-------+------+------+
SELECT * FROM t2;
+------+------+------+
| id   | s1   | s2   |
+------+------+------+
|    1 |    0 |    1 |
|    1 |    0 |    1 |
|    1 |    0 |    1 |
|    1 |    0 |    1 |
|    1 |    0 |    1 |
|    1 |    0 |    1 |
|    1 |    0 |    1 |
|    1 |    0 |    1 |
|    1 |    0 |    1 |
|    1 |    0 |    1 |
|    1 |    0 |    1 |
|    1 |    0 |    1 |
|    1 |    0 |    1 |
|    1 |    0 |    1 |
|    1 |    0 |    1 |
|    1 |    0 |    1 |
+------+------+------+
drop table t1;
create table t1(stats int , s1 int , s2 int);
insert into t1 values(2,0,0),(1,0,0),(0,0,0),(9,0,0);
drop table t2;
create table t2(id int ,s1 int, s2 int);
drop function n_1;
create function n_1(a int) returns int deterministic 
begin
  insert into t2 values(1,0,1);
  return a;
end/
select * from t1 where s1 = all (select s2 from t1 where stats in ((select n_1(s1))));
+-------+------+------+
| stats | s1   | s2   |
+-------+------+------+
|     2 |    0 |    0 |
|     1 |    0 |    0 |
|     0 |    0 |    0 |
|     9 |    0 |    0 |
+-------+------+------+
SELECT * FROM t2;
+------+------+------+
| id   | s1   | s2   |
+------+------+------+
|    1 |    0 |    1 |
|    1 |    0 |    1 |
|    1 |    0 |    1 |
|    1 |    0 |    1 |
+------+------+------+
drop table t1;
create table t1(stats int , s1 int , s2 int);
insert into t1 values(2,1,3),(1,0,0),(0,0,0);
drop table t2;
create table t2(id int ,s1 int, s2 int);
drop function n_1;
create function n_1(a int) returns int deterministic 
begin
  insert into t2 values(1,0,1);
  return a;
end/
select * from t1 where (select n_1(s1)) = all (select (select n_1(s1)) from t1 );
+-------+------+------+
| stats | s1   | s2   |
+-------+------+------+
+-------+------+------+
SELECT * FROM t2;
+------+------+------+
| id   | s1   | s2   |
+------+------+------+
|    1 |    0 |    1 |
|    1 |    0 |    1 |
|    1 |    0 |    1 |
|    1 |    0 |    1 |
|    1 |    0 |    1 |
+------+------+------+
#udf_1_4  ##limit
drop table t1;
create table t1(stats int , s1 int , s2 int);
insert into t1 values(2,1,3),(1,0,0),(0,0,0),(0,0,0);
drop table t2;
create table t2(id int ,s1 int, s2 int);
drop function n_1;
create function n_1(a int) returns int deterministic 
begin
  insert into t2 values(1,0,1);
  return a;
end/
select (select n_1(s1)) from t1 limit 0;
+------------------+
| (select n_1(s1)) |
+------------------+
+------------------+
select count( * ) from t2;
+------------+
| count( * ) |
+------------+
|          0 |
+------------+
drop table t2;
create table t2(id int ,s1 int, s2 int);
select (select n_1(s1)) from t1 limit 1;
+------------------+
| (select n_1(s1)) |
+------------------+
|                1 |
+------------------+
select count( * ) from t2;
+------------+
| count( * ) |
+------------+
|          1 |
+------------+
drop table t2;
create table t2(id int ,s1 int, s2 int);
select (select n_1(s1)) from t1 limit 2;
+------------------+
| (select n_1(s1)) |
+------------------+
|                1 |
|                0 |
+------------------+
select count( * ) from t2;
+------------+
| count( * ) |
+------------+
|          2 |
+------------+
drop table t2;
create table t2(id int ,s1 int, s2 int);
select (select n_1(s1)) from t1 limit 1,3;
+------------------+
| (select n_1(s1)) |
+------------------+
|                0 |
|                0 |
|                0 |
+------------------+
select count( * ) from t2;
+------------+
| count( * ) |
+------------+
|          3 |
+------------+
#distinct+limit
drop table t2;
create table t2(id int ,s1 int, s2 int);
select distinct((select n_1(s1))) from t1 limit 2,3;
+--------------------+
| ((select n_1(s1))) |
+--------------------+
+--------------------+
select count( * ) from t2;
+------------+
| count( * ) |
+------------+
|          4 |
+------------+
## where+limit 
drop table t2;
create table t2(id int ,s1 int, s2 int);
select * from t1 where s1=(select n_1(s1)) limit 1,3;
+-------+------+------+
| stats | s1   | s2   |
+-------+------+------+
|     1 |    0 |    0 |
|     0 |    0 |    0 |
|     0 |    0 |    0 |
+-------+------+------+
SELECT count( * ) FROM t2;
+------------+
| count( * ) |
+------------+
|          4 |
+------------+
#order by+limit 
drop table t2;
create table t2(id int ,s1 int, s2 int);
select * from t1 order by (select n_1(s1)) limit 1,3;
+-------+------+------+
| stats | s1   | s2   |
+-------+------+------+
|     0 |    0 |    0 |
|     0 |    0 |    0 |
|     2 |    1 |    3 |
+-------+------+------+
SELECT count( * ) FROM t2;
+------------+
| count( * ) |
+------------+
|          4 |
+------------+
#group by+limit 
drop table t2;
create table t2(id int ,s1 int, s2 int);
select * from t1 group by (select n_1(s1)) limit 1,3;
+-------+------+------+
| stats | s1   | s2   |
+-------+------+------+
|     1 |    0 |    0 |
+-------+------+------+
SELECT count( * ) FROM t2;
+------------+
| count( * ) |
+------------+
|          4 |
+------------+
#udf_1_5  #order by
#普通
drop table t1;
create table t1(stats int , s1 int primary key , s2 int);
insert into t1 values(2,1,3),(1,2,0),(3,3,0);
drop table t2;
create table t2(id int ,s1 int, s2 int);
drop function n_1;
create function n_1(a int) returns int deterministic 
begin
  insert into t2 values(1,0,1);
  return a;
end/
select (select n_1(s1)) from t1 order by s1;
+------------------+
| (select n_1(s1)) |
+------------------+
|                1 |
|                2 |
|                3 |
+------------------+
SELECT count( * ) FROM t2;
+------------+
| count( * ) |
+------------+
|          3 |
+------------+
delete from t2;
select s1 from t1 order by (select n_1(s1));
+----+
| s1 |
+----+
|  1 |
|  2 |
|  3 |
+----+
SELECT count( * ) FROM t2;
+------------+
| count( * ) |
+------------+
|          3 |
+------------+
#order by
#普通排序
drop table t1;
create table t1(id int , s1 int , s2 int,primary key(id,s1));
insert into t1 values(2,1,3),(1,2,0),(3,3,0);
drop table t2;
create table t2(id int ,s1 int, s2 int);
drop function n_1;
create function n_1(a int) returns int deterministic 
begin
  insert into t2 values(1,0,1);
  return a;
end/
select (select n_1(s1)) from t1 order by (select n_1(s1));
+------------------+
| (select n_1(s1)) |
+------------------+
|                1 |
|                2 |
|                3 |
+------------------+
SELECT * FROM t2;
+------+------+------+
| id   | s1   | s2   |
+------+------+------+
|    1 |    0 |    1 |
|    1 |    0 |    1 |
|    1 |    0 |    1 |
|    1 |    0 |    1 |
|    1 |    0 |    1 |
|    1 |    0 |    1 |
+------+------+------+
#前缀排序
drop table t1;
create table t1(id int , s1 int , s2 int,primary key(id,s1));
insert into t1 values(2,1,3),(1,2,0),(3,3,0);
drop table t2;
create table t2(id int ,s1 int, s2 int);
drop function n_1;
create function n_1(a int) returns int deterministic 
begin
  insert into t2 values(1,0,1);
  return a;
end/
select (select n_1(s1)) from t1 order by id,(select n_1(s1));
+------------------+
| (select n_1(s1)) |
+------------------+
|                2 |
|                1 |
|                3 |
+------------------+
SELECT * FROM t2;
+------+------+------+
| id   | s1   | s2   |
+------+------+------+
|    1 |    0 |    1 |
|    1 |    0 |    1 |
|    1 |    0 |    1 |
|    1 |    0 |    1 |
|    1 |    0 |    1 |
|    1 |    0 |    1 |
+------+------+------+
#TOP-N 排序
drop table t1;
create table t1(id int , s1 int , s2 int,primary key(id,s1));
insert into t1 values(2,1,3),(1,2,0),(3,3,0);
drop table t2;
create table t2(id int ,s1 int, s2 int);
drop function n_1;
create function n_1(a int) returns int deterministic 
begin
  insert into t2 values(1,0,1);
  return a;
end/
select (select n_1(s1)) from t1 order by id,(select n_1(s1)) limit 1,3;
+------------------+
| (select n_1(s1)) |
+------------------+
|                1 |
|                3 |
+------------------+
SELECT * FROM t2;
+------+------+------+
| id   | s1   | s2   |
+------+------+------+
|    1 |    0 |    1 |
|    1 |    0 |    1 |
|    1 |    0 |    1 |
|    1 |    0 |    1 |
|    1 |    0 |    1 |
+------+------+------+
#udf_1_6   group by 
drop table t1;
create table t1(stats int , s1 int , s2 int);
insert into t1 values(2,1,3),(1,0,0),(0,0,0),(0,0,0);
drop table t2;
create table t2(id int ,s1 int, s2 int);
drop function n_1;
create function n_1(a int) returns int deterministic 
begin
  insert into t2 values(1,0,1);
  return a;
end/
drop table t2;
create table t2(id int ,s1 int, s2 int);
select (select n_1(s1)) from t1 group by stats order by stats;
+------------------+
| (select n_1(s1)) |
+------------------+
|                0 |
|                0 |
|                1 |
+------------------+
SELECT count( * ) FROM t2;
+------------+
| count( * ) |
+------------+
|          3 |
+------------+
#MERGE GROUP BY
drop table t1;
create table t1(stats int primary key , s1 int, s2 int);
insert into t1 values(1,1,3),(2,2,0),(3,2,0);
drop table t2;
create table t2(id int ,s1 int, s2 int);
drop function n_1;
create function n_1(a int) returns int deterministic 
begin
  insert into t2 values(1,0,1);
  return a;
end/
select sum(stats) from t1 group  by (select n_1(s1));
+------------+
| sum(stats) |
+------------+
|          1 |
|          5 |
+------------+
select * from t2;
+------+------+------+
| id   | s1   | s2   |
+------+------+------+
|    1 |    0 |    1 |
|    1 |    0 |    1 |
|    1 |    0 |    1 |
+------+------+------+
#HASH GROUP BY
drop procedure initData;
ERROR 42000: PROCEDURE nxa.initData does not exist
create procedure initData()
begin
declare count int default 1;
while count <= 9 DO
 insert into t1 (stats,s1,s2) values (count,count,count); 
 set count = count +1;
end while;
end;
/
drop table t1;
create table t1(stats int primary key , s1 int, s2 int);
call initData();
drop table t2;
create table t2(id int ,s1 int, s2 int);
drop function n_1;
create function n_1(a int) returns int deterministic 
begin
  insert into t2 values(1,0,1);
  return a;
end/
select sum(stats) from t1 group  by (select n_1(s1)) order by (select n_1(s1));
+------------+
| sum(stats) |
+------------+
|          1 |
|          2 |
|          3 |
|          4 |
|          5 |
|          6 |
|          7 |
|          8 |
|          9 |
+------------+
select * from t2;
+------+------+------+
| id   | s1   | s2   |
+------+------+------+
|    1 |    0 |    1 |
|    1 |    0 |    1 |
|    1 |    0 |    1 |
|    1 |    0 |    1 |
|    1 |    0 |    1 |
|    1 |    0 |    1 |
|    1 |    0 |    1 |
|    1 |    0 |    1 |
|    1 |    0 |    1 |
+------+------+------+
##42037046 带参udf在having内无法传入字段
drop table t2;
create table t2(id int ,s1 int, s2 int);
select (select n_1(s1)) from t1 group by (select n_1(s1)) having max((select n_1(s1)));
+------------------+
| (select n_1(s1)) |
+------------------+
|                1 |
|                2 |
|                3 |
|                4 |
|                5 |
|                6 |
|                7 |
|                8 |
|                9 |
+------------------+
select count( * ) from t2;
+------------+
| count( * ) |
+------------+
|          9 |
+------------+
#udf_1_7 #case when
drop table t1;
create table t1(stats int , s1 int , s2 int);
insert into t1 values(2,1,3),(1,0,0),(0,2,0);
drop table t2;
create table t2(id int ,s1 int, s2 int);
drop function n_1;
create function n_1(a int) returns int deterministic 
begin
  insert into t2 values(1,0,1);
  return a;
end/
drop table t2;
create table t2(id int ,s1 int, s2 int);
select case when (select n_1(s1))=0 then 0.75 else 0 end from t1 order by stats;
+---------------------------------------------------+
| case when (select n_1(s1))=0 then 0.75 else 0 end |
+---------------------------------------------------+
|                                              0.00 |
|                                              0.75 |
|                                              0.00 |
+---------------------------------------------------+
select count( * ) from t2;
+------------+
| count( * ) |
+------------+
|          3 |
+------------+
drop table t2;
create table t2(id int ,s1 int, s2 int);
select case when s1=(select n_1(s1)) then 0.75 else (select n_1(s1)) end from t1 order by stats;
+-------------------------------------------------------------------+
| case when s1=(select n_1(s1)) then 0.75 else (select n_1(s1)) end |
+-------------------------------------------------------------------+
|                                                              0.75 |
|                                                              0.75 |
|                                                              0.75 |
+-------------------------------------------------------------------+
select count( * ) from t2;
+------------+
| count( * ) |
+------------+
|          3 |
+------------+
drop table t2;
create table t2(id int ,s1 int, s2 int);
select case when (select n_1(s1))=concat((select n_1(s1)),s1) then 0.75 else (select n_1(s1)) end from t1 order by stats;
+--------------------------------------------------------------------------------------------+
| case when (select n_1(s1))=concat((select n_1(s1)),s1) then 0.75 else (select n_1(s1)) end |
+--------------------------------------------------------------------------------------------+
|                                                                                       2.00 |
|                                                                                       0.75 |
|                                                                                       1.00 |
+--------------------------------------------------------------------------------------------+
select count( * ) from t2;
+------------+
| count( * ) |
+------------+
|          8 |
+------------+
drop table t2;
create table t2(id int ,s1 int, s2 int);
select (case (select n_1(s1)) when 0 then 0.29 when 1 then 9 else 0 end) from t1;
+-------------------------------------------------------------------+
| (case (select n_1(s1)) when 0 then 0.29 when 1 then 9 else 0 end) |
+-------------------------------------------------------------------+
|                                                              9.00 |
|                                                              0.29 |
|                                                              0.00 |
+-------------------------------------------------------------------+
select count( * ) from t2;
+------------+
| count( * ) |
+------------+
|          3 |
+------------+
drop table t2;
create table t2(id int ,s1 int, s2 int);
select (case stats when (select n_1(s1)) then 0.02 when 1 then 'a' else 0 end) from t1;
+-------------------------------------------------------------------------+
| (case stats when (select n_1(s1)) then 0.02 when 1 then 'a' else 0 end) |
+-------------------------------------------------------------------------+
| 0                                                                       |
| a                                                                       |
| 0                                                                       |
+-------------------------------------------------------------------------+
select count( * ) from t2;
+------------+
| count( * ) |
+------------+
|          3 |
+------------+
drop table t2;
create table t2(id int ,s1 int, s2 int);
select (case s1 when concat(s1,(select n_1(s1))) then 2 when 0 then 9 else 55.333 end) from t1;
+---------------------------------------------------------------------------------+
| (case s1 when concat(s1,(select n_1(s1))) then 2 when 0 then 9 else 55.333 end) |
+---------------------------------------------------------------------------------+
|                                                                          55.333 |
|                                                                           2.000 |
|                                                                          55.333 |
+---------------------------------------------------------------------------------+
select count( * ) from t2;
+------------+
| count( * ) |
+------------+
|          3 |
+------------+
drop table t2;
create table t2(id int ,s1 int, s2 int);
select (case (select n_1(s1)) when 0 then 0.29 when 1 then 9 else 0 end) from t1 group by (case (select n_1(s1)) when 0 then 0.29 when 1 then 9 else 0 end) order by stats;
+-------------------------------------------------------------------+
| (case (select n_1(s1)) when 0 then 0.29 when 1 then 9 else 0 end) |
+-------------------------------------------------------------------+
|                                                              0.00 |
|                                                              0.29 |
|                                                              9.00 |
+-------------------------------------------------------------------+
select count( * ) from t2;
+------------+
| count( * ) |
+------------+
|          3 |
+------------+
#udf_1_8  #多表联查
#join
drop table t1;
create table t1(id int , s1 int, s2 int);
insert into t1 values(1,4,3);
insert into t1 values(2,2,3);
insert into t1 values(3,5,3);
drop table t2;
create table t2(id int ,s1 int, s2 int);
drop table t3;
create table t3(id int , s1 int, s2 int);
insert into t3 values(1,4,3);
insert into t3 values(2,7,3);
drop function n_1;
create function n_1(a int) returns int deterministic 
begin
  insert into t2 values(1,0,1);
  return a;
end/
SELECT t1.s1 + t3.s2 FROM t1, t3 where t1.s1=(select n_1(t3.s1));
+---------------+
| t1.s1 + t3.s2 |
+---------------+
|             7 |
+---------------+
select count(*) from t2;
+----------+
| count(*) |
+----------+
|        2 |
+----------+
delete from t2;
select (select n_1(t1.s1)) from t1  join t3  on t1.id = t3.id where t1.s1=(select n_1(t3.s1));
+---------------------+
| (select n_1(t1.s1)) |
+---------------------+
|                   4 |
+---------------------+
select count(*) from t2;
+----------+
| count(*) |
+----------+
|        3 |
+----------+
delete from t2;
select (select n_1(t3.s1)) from t1  join t3  on t1.id = t3.id ;
+---------------------+
| (select n_1(t3.s1)) |
+---------------------+
|                   4 |
|                   7 |
+---------------------+
select count(*) from t2;
+----------+
| count(*) |
+----------+
|        2 |
+----------+
#left join
drop table t1;
create table t1(id int, s1 int, s2 int);
INSERT INTO t1 VALUES(0,1,3),(1,0,0),(2,7,0);
drop table t3;
create table t3(bid int ,s1 int, s2 int);
INSERT INTO t3 VALUES(0,1,3),(1,6,0),(2,7,0);
drop table t2;
create table t2(id int ,s1 int, s2 int);
drop function n_1;
create function n_1(a int) returns int deterministic 
begin
  insert into t2 values(1,0,1);
  return a;
end/
select * from t1  left join t3  on t1.id = t3.bid where t1.s1=(select n_1(t3.s1))  ;
+------+------+------+------+------+------+
| id   | s1   | s2   | bid  | s1   | s2   |
+------+------+------+------+------+------+
|    0 |    1 |    3 |    0 |    1 |    3 |
|    2 |    7 |    0 |    2 |    7 |    0 |
+------+------+------+------+------+------+
select * from t2;
+------+------+------+
| id   | s1   | s2   |
+------+------+------+
|    1 |    0 |    1 |
|    1 |    0 |    1 |
|    1 |    0 |    1 |
+------+------+------+
delete from t2;
select (select n_1(t1.s1)) from t1  left join t3  on t1.id = t3.bid ;
+---------------------+
| (select n_1(t1.s1)) |
+---------------------+
|                   1 |
|                   0 |
|                   7 |
+---------------------+
select * from t2;
+------+------+------+
| id   | s1   | s2   |
+------+------+------+
|    1 |    0 |    1 |
|    1 |    0 |    1 |
|    1 |    0 |    1 |
+------+------+------+
#right join
delete from t2;
select * from t1  right  join t3  on t1.id = t3.bid where t3.s1=(select n_1(t3.s1))  ;
+------+------+------+------+------+------+
| id   | s1   | s2   | bid  | s1   | s2   |
+------+------+------+------+------+------+
|    0 |    1 |    3 |    0 |    1 |    3 |
|    1 |    0 |    0 |    1 |    6 |    0 |
|    2 |    7 |    0 |    2 |    7 |    0 |
+------+------+------+------+------+------+
select * from t2;
+------+------+------+
| id   | s1   | s2   |
+------+------+------+
|    1 |    0 |    1 |
|    1 |    0 |    1 |
|    1 |    0 |    1 |
+------+------+------+
delete from t2;
select (select n_1(t1.s1)) from t1  left join t3  on t1.id = t3.bid ;
+---------------------+
| (select n_1(t1.s1)) |
+---------------------+
|                   1 |
|                   0 |
|                   7 |
+---------------------+
select * from t2;
+------+------+------+
| id   | s1   | s2   |
+------+------+------+
|    1 |    0 |    1 |
|    1 |    0 |    1 |
|    1 |    0 |    1 |
+------+------+------+
#cross join
drop table t2;
create table t2(id int ,s1 int, s2 int);
select * from t1 q cross join t3 w on q.id = w.bid where w.s1=(select n_1(q.s1));
+------+------+------+------+------+------+
| id   | s1   | s2   | bid  | s1   | s2   |
+------+------+------+------+------+------+
|    0 |    1 |    3 |    0 |    1 |    3 |
|    2 |    7 |    0 |    2 |    7 |    0 |
+------+------+------+------+------+------+
select count( * ) from t2;
+------------+
| count( * ) |
+------------+
|          3 |
+------------+
#udf_1_9  嵌套
drop table t1;
create table t1(stats int , s1 int, s2 int);
insert into t1 values(1,1,3),(2,2,0),(2,3,0),(2,2,0),(2,7,0);
drop table t3;
create table t3(bid int ,s1 int, s2 int);
INSERT INTO t3 VALUES(0,1,3),(1,6,0),(2,7,0);
drop table t2;
create table t2(id int ,s1 int, s2 int);
drop function n_1;
create function n_1(a int) returns int deterministic 
begin
  insert into t2 values(1,0,1);
  return a;
end/
select * from (select (select n_1(s1)) from t1) qq;
+------------------+
| (select n_1(s1)) |
+------------------+
|                1 |
|                2 |
|                3 |
|                2 |
|                7 |
+------------------+
select count( * ) from t2;
+------------+
| count( * ) |
+------------+
|          5 |
+------------+
delete from t2;
select * from (select sum((select n_1(s1))) from t1) qq;
+-----------------------+
| sum((select n_1(s1))) |
+-----------------------+
|                    15 |
+-----------------------+
select count( * ) from t2;
+------------+
| count( * ) |
+------------+
|          5 |
+------------+
delete from t2;
select * from t1 where  s1 in (select (select n_1(s1)) from t3 );
+-------+------+------+
| stats | s1   | s2   |
+-------+------+------+
|     1 |    1 |    3 |
|     2 |    7 |    0 |
+-------+------+------+
select * from t2;
+------+------+------+
| id   | s1   | s2   |
+------+------+------+
|    1 |    0 |    1 |
|    1 |    0 |    1 |
|    1 |    0 |    1 |
+------+------+------+
delete from t2;
select s1,s2,(select (select n_1(s1)) from t3 limit 1 ) as ret from t1  ;
+------+------+------+
| s1   | s2   | ret  |
+------+------+------+
|    1 |    3 |    1 |
|    2 |    0 |    1 |
|    3 |    0 |    1 |
|    2 |    0 |    1 |
|    7 |    0 |    1 |
+------+------+------+
select * from t2;
+------+------+------+
| id   | s1   | s2   |
+------+------+------+
|    1 |    0 |    1 |
+------+------+------+
delete from t2;
with ccc as (select (select n_1(s1)) from t1) select * from ccc;
+------------------+
| (select n_1(s1)) |
+------------------+
|                1 |
|                2 |
|                3 |
|                2 |
|                7 |
+------------------+
select * from t2;
+------+------+------+
| id   | s1   | s2   |
+------+------+------+
|    1 |    0 |    1 |
|    1 |    0 |    1 |
|    1 |    0 |    1 |
|    1 |    0 |    1 |
|    1 |    0 |    1 |
+------+------+------+
#udf_1_10  操作结果集
drop table t2;
create table t2(id int ,s1 int, s2 int);
(select (select n_1(s1)) from t1) union (select s1 from t1);
+------------------+
| (select n_1(s1)) |
+------------------+
|                1 |
|                2 |
|                3 |
|                7 |
+------------------+
select count( * ) from t2;
+------------+
| count( * ) |
+------------+
|          5 |
+------------+
drop table t2;
create table t2(id int ,s1 int, s2 int);
(select (select n_1(s1)) from t1) union (select (select n_1(s1)) from t1);
+------------------+
| (select n_1(s1)) |
+------------------+
|                1 |
|                2 |
|                3 |
|                7 |
+------------------+
select count( * ) from t2;
+------------+
| count( * ) |
+------------+
|         10 |
+------------+
drop table t2;
create table t2(id int ,s1 int, s2 int);
(select (select n_1(s1)) from t1) union all (select s1 from t1);
+------------------+
| (select n_1(s1)) |
+------------------+
|                1 |
|                2 |
|                3 |
|                2 |
|                7 |
|                1 |
|                2 |
|                3 |
|                2 |
|                7 |
+------------------+
select count( * ) from t2;
+------------+
| count( * ) |
+------------+
|          5 |
+------------+
drop table t2;
create table t2(id int ,s1 int, s2 int);
select * from ((select (select n_1(s1)) from t1) union all (select (select n_1(s1)) from t1)) ee;
+------------------+
| (select n_1(s1)) |
+------------------+
|                1 |
|                2 |
|                3 |
|                2 |
|                7 |
|                1 |
|                2 |
|                3 |
|                2 |
|                7 |
+------------------+
select count( * ) from t2;
+------------+
| count( * ) |
+------------+
|         10 |
+------------+
udf_2 #table
#索引
#主键
drop table t1;
create table t1(id int primary key, s1 int, s2 int);
insert into t1 values(1,1,3),(5,1,0),(3,1,0),(9,1,0),(2,7,0);
drop table t2;
create table t2(id int ,s1 int, s2 int);
drop function n_1;
create function n_1(a int) returns int deterministic 
begin
  insert into t2 values(1,0,1);
  return a;
end/
select id+(select n_1(s1)) from t1 ;
+---------------------+
| id+(select n_1(s1)) |
+---------------------+
|                   2 |
|                   9 |
|                   4 |
|                   6 |
|                  10 |
+---------------------+
select * from t2;
+------+------+------+
| id   | s1   | s2   |
+------+------+------+
|    1 |    0 |    1 |
|    1 |    0 |    1 |
|    1 |    0 |    1 |
|    1 |    0 |    1 |
|    1 |    0 |    1 |
+------+------+------+
select * from t1 where id=(select n_1(s1))  ;
+----+------+------+
| id | s1   | s2   |
+----+------+------+
|  1 |    1 |    3 |
+----+------+------+
select * from t2;
+------+------+------+
| id   | s1   | s2   |
+------+------+------+
|    1 |    0 |    1 |
|    1 |    0 |    1 |
|    1 |    0 |    1 |
|    1 |    0 |    1 |
|    1 |    0 |    1 |
|    1 |    0 |    1 |
|    1 |    0 |    1 |
|    1 |    0 |    1 |
|    1 |    0 |    1 |
|    1 |    0 |    1 |
+------+------+------+
#外键
drop table t3;
drop table t1;
create table t1(id int primary key, s1 int, s2 int);
insert into t1 values(1,1,3),(5,1,0),(3,1,0),(9,1,0),(2,7,0);
create table t3(bid int ,s1 int, s2 int,foreign key (bid) references t1(id));
INSERT INTO t3 VALUES(3,1,3),(1,6,0),(1,6,0),(2,7,0);
drop table t2;
create table t2(id int ,s1 int, s2 int);
drop function n_1;
create function n_1(a int) returns int deterministic
begin
  insert into t2 values(1,0,1);
  return a;
end/
select (select n_1(t3.s1)) from t3,t1 where t3.bid=t1.id ;
+---------------------+
| (select n_1(t3.s1)) |
+---------------------+
|                   1 |
|                   6 |
|                   6 |
|                   7 |
+---------------------+
select * from t2;
+------+------+------+
| id   | s1   | s2   |
+------+------+------+
|    1 |    0 |    1 |
|    1 |    0 |    1 |
|    1 |    0 |    1 |
|    1 |    0 |    1 |
+------+------+------+
delete from t2;
select * from t3,t1 where t3.bid=t1.id and t1.id=(select n_1(t3.s1));
+------+------+------+----+------+------+
| bid  | s1   | s2   | id | s1   | s2   |
+------+------+------+----+------+------+
+------+------+------+----+------+------+
select * from t2;
+------+------+------+
| id   | s1   | s2   |
+------+------+------+
|    1 |    0 |    1 |
|    1 |    0 |    1 |
|    1 |    0 |    1 |
|    1 |    0 |    1 |
+------+------+------+
delete from t2;
select * from t3 where bid=(select n_1(s1))  ;
+------+------+------+
| bid  | s1   | s2   |
+------+------+------+
+------+------+------+
select * from t2;
+------+------+------+
| id   | s1   | s2   |
+------+------+------+
|    1 |    0 |    1 |
|    1 |    0 |    1 |
|    1 |    0 |    1 |
|    1 |    0 |    1 |
+------+------+------+
#普通索引
drop procedure initData;
create procedure initData()
begin
declare count int default 1;
while count <= 100 DO
 insert into t1 (id,s1,s2) values (count,count,count); 
 set count = count +1;
end while;
end;
/
drop table t3;
drop table t1;
create table t1(id int, s1 int, s2 int,index ix_id(id),index idx_id(s1));
call initData();
drop table t2;
create table t2(id int ,s1 int, s2 int);
drop function n_1;
create function n_1(a int) returns int deterministic 
begin
  insert into t2 values(1,0,1);
  return a;
end/
delete from t2;
select (select n_1(s1)) from t1 where id =(select n_1(s1)) ;
+------------------+
| (select n_1(s1)) |
+------------------+
|                1 |
|                2 |
|                3 |
|                4 |
|                5 |
|                6 |
|                7 |
|                8 |
|                9 |
|               10 |
|               11 |
|               12 |
|               13 |
|               14 |
|               15 |
|               16 |
|               17 |
|               18 |
|               19 |
|               20 |
|               21 |
|               22 |
|               23 |
|               24 |
|               25 |
|               26 |
|               27 |
|               28 |
|               29 |
|               30 |
|               31 |
|               32 |
|               33 |
|               34 |
|               35 |
|               36 |
|               37 |
|               38 |
|               39 |
|               40 |
|               41 |
|               42 |
|               43 |
|               44 |
|               45 |
|               46 |
|               47 |
|               48 |
|               49 |
|               50 |
|               51 |
|               52 |
|               53 |
|               54 |
|               55 |
|               56 |
|               57 |
|               58 |
|               59 |
|               60 |
|               61 |
|               62 |
|               63 |
|               64 |
|               65 |
|               66 |
|               67 |
|               68 |
|               69 |
|               70 |
|               71 |
|               72 |
|               73 |
|               74 |
|               75 |
|               76 |
|               77 |
|               78 |
|               79 |
|               80 |
|               81 |
|               82 |
|               83 |
|               84 |
|               85 |
|               86 |
|               87 |
|               88 |
|               89 |
|               90 |
|               91 |
|               92 |
|               93 |
|               94 |
|               95 |
|               96 |
|               97 |
|               98 |
|               99 |
|              100 |
+------------------+
select * from t2;
+------+------+------+
| id   | s1   | s2   |
+------+------+------+
|    1 |    0 |    1 |
|    1 |    0 |    1 |
|    1 |    0 |    1 |
|    1 |    0 |    1 |
|    1 |    0 |    1 |
|    1 |    0 |    1 |
|    1 |    0 |    1 |
|    1 |    0 |    1 |
|    1 |    0 |    1 |
|    1 |    0 |    1 |
|    1 |    0 |    1 |
|    1 |    0 |    1 |
|    1 |    0 |    1 |
|    1 |    0 |    1 |
|    1 |    0 |    1 |
|    1 |    0 |    1 |
|    1 |    0 |    1 |
|    1 |    0 |    1 |
|    1 |    0 |    1 |
|    1 |    0 |    1 |
|    1 |    0 |    1 |
|    1 |    0 |    1 |
|    1 |    0 |    1 |
|    1 |    0 |    1 |
|    1 |    0 |    1 |
|    1 |    0 |    1 |
|    1 |    0 |    1 |
|    1 |    0 |    1 |
|    1 |    0 |    1 |
|    1 |    0 |    1 |
|    1 |    0 |    1 |
|    1 |    0 |    1 |
|    1 |    0 |    1 |
|    1 |    0 |    1 |
|    1 |    0 |    1 |
|    1 |    0 |    1 |
|    1 |    0 |    1 |
|    1 |    0 |    1 |
|    1 |    0 |    1 |
|    1 |    0 |    1 |
|    1 |    0 |    1 |
|    1 |    0 |    1 |
|    1 |    0 |    1 |
|    1 |    0 |    1 |
|    1 |    0 |    1 |
|    1 |    0 |    1 |
|    1 |    0 |    1 |
|    1 |    0 |    1 |
|    1 |    0 |    1 |
|    1 |    0 |    1 |
|    1 |    0 |    1 |
|    1 |    0 |    1 |
|    1 |    0 |    1 |
|    1 |    0 |    1 |
|    1 |    0 |    1 |
|    1 |    0 |    1 |
|    1 |    0 |    1 |
|    1 |    0 |    1 |
|    1 |    0 |    1 |
|    1 |    0 |    1 |
|    1 |    0 |    1 |
|    1 |    0 |    1 |
|    1 |    0 |    1 |
|    1 |    0 |    1 |
|    1 |    0 |    1 |
|    1 |    0 |    1 |
|    1 |    0 |    1 |
|    1 |    0 |    1 |
|    1 |    0 |    1 |
|    1 |    0 |    1 |
|    1 |    0 |    1 |
|    1 |    0 |    1 |
|    1 |    0 |    1 |
|    1 |    0 |    1 |
|    1 |    0 |    1 |
|    1 |    0 |    1 |
|    1 |    0 |    1 |
|    1 |    0 |    1 |
|    1 |    0 |    1 |
|    1 |    0 |    1 |
|    1 |    0 |    1 |
|    1 |    0 |    1 |
|    1 |    0 |    1 |
|    1 |    0 |    1 |
|    1 |    0 |    1 |
|    1 |    0 |    1 |
|    1 |    0 |    1 |
|    1 |    0 |    1 |
|    1 |    0 |    1 |
|    1 |    0 |    1 |
|    1 |    0 |    1 |
|    1 |    0 |    1 |
|    1 |    0 |    1 |
|    1 |    0 |    1 |
|    1 |    0 |    1 |
|    1 |    0 |    1 |
|    1 |    0 |    1 |
|    1 |    0 |    1 |
|    1 |    0 |    1 |
|    1 |    0 |    1 |
|    1 |    0 |    1 |
|    1 |    0 |    1 |
|    1 |    0 |    1 |
|    1 |    0 |    1 |
|    1 |    0 |    1 |
|    1 |    0 |    1 |
|    1 |    0 |    1 |
|    1 |    0 |    1 |
|    1 |    0 |    1 |
|    1 |    0 |    1 |
|    1 |    0 |    1 |
|    1 |    0 |    1 |
|    1 |    0 |    1 |
|    1 |    0 |    1 |
|    1 |    0 |    1 |
|    1 |    0 |    1 |
|    1 |    0 |    1 |
|    1 |    0 |    1 |
|    1 |    0 |    1 |
|    1 |    0 |    1 |
|    1 |    0 |    1 |
|    1 |    0 |    1 |
|    1 |    0 |    1 |
|    1 |    0 |    1 |
|    1 |    0 |    1 |
|    1 |    0 |    1 |
|    1 |    0 |    1 |
|    1 |    0 |    1 |
|    1 |    0 |    1 |
|    1 |    0 |    1 |
|    1 |    0 |    1 |
|    1 |    0 |    1 |
|    1 |    0 |    1 |
|    1 |    0 |    1 |
|    1 |    0 |    1 |
|    1 |    0 |    1 |
|    1 |    0 |    1 |
|    1 |    0 |    1 |
|    1 |    0 |    1 |
|    1 |    0 |    1 |
|    1 |    0 |    1 |
|    1 |    0 |    1 |
|    1 |    0 |    1 |
|    1 |    0 |    1 |
|    1 |    0 |    1 |
|    1 |    0 |    1 |
|    1 |    0 |    1 |
|    1 |    0 |    1 |
|    1 |    0 |    1 |
|    1 |    0 |    1 |
|    1 |    0 |    1 |
|    1 |    0 |    1 |
|    1 |    0 |    1 |
|    1 |    0 |    1 |
|    1 |    0 |    1 |
|    1 |    0 |    1 |
|    1 |    0 |    1 |
|    1 |    0 |    1 |
|    1 |    0 |    1 |
|    1 |    0 |    1 |
|    1 |    0 |    1 |
|    1 |    0 |    1 |
|    1 |    0 |    1 |
|    1 |    0 |    1 |
|    1 |    0 |    1 |
|    1 |    0 |    1 |
|    1 |    0 |    1 |
|    1 |    0 |    1 |
|    1 |    0 |    1 |
|    1 |    0 |    1 |
|    1 |    0 |    1 |
|    1 |    0 |    1 |
|    1 |    0 |    1 |
|    1 |    0 |    1 |
|    1 |    0 |    1 |
|    1 |    0 |    1 |
|    1 |    0 |    1 |
|    1 |    0 |    1 |
|    1 |    0 |    1 |
|    1 |    0 |    1 |
|    1 |    0 |    1 |
|    1 |    0 |    1 |
|    1 |    0 |    1 |
|    1 |    0 |    1 |
|    1 |    0 |    1 |
|    1 |    0 |    1 |
|    1 |    0 |    1 |
|    1 |    0 |    1 |
|    1 |    0 |    1 |
|    1 |    0 |    1 |
|    1 |    0 |    1 |
|    1 |    0 |    1 |
|    1 |    0 |    1 |
|    1 |    0 |    1 |
|    1 |    0 |    1 |
|    1 |    0 |    1 |
|    1 |    0 |    1 |
|    1 |    0 |    1 |
|    1 |    0 |    1 |
|    1 |    0 |    1 |
+------+------+------+
delete from t2;
select (select n_1(s1)) from t1 where s1 <50 order by id ;
+------------------+
| (select n_1(s1)) |
+------------------+
|                1 |
|                2 |
|                3 |
|                4 |
|                5 |
|                6 |
|                7 |
|                8 |
|                9 |
|               10 |
|               11 |
|               12 |
|               13 |
|               14 |
|               15 |
|               16 |
|               17 |
|               18 |
|               19 |
|               20 |
|               21 |
|               22 |
|               23 |
|               24 |
|               25 |
|               26 |
|               27 |
|               28 |
|               29 |
|               30 |
|               31 |
|               32 |
|               33 |
|               34 |
|               35 |
|               36 |
|               37 |
|               38 |
|               39 |
|               40 |
|               41 |
|               42 |
|               43 |
|               44 |
|               45 |
|               46 |
|               47 |
|               48 |
|               49 |
+------------------+
select * from t2;
+------+------+------+
| id   | s1   | s2   |
+------+------+------+
|    1 |    0 |    1 |
|    1 |    0 |    1 |
|    1 |    0 |    1 |
|    1 |    0 |    1 |
|    1 |    0 |    1 |
|    1 |    0 |    1 |
|    1 |    0 |    1 |
|    1 |    0 |    1 |
|    1 |    0 |    1 |
|    1 |    0 |    1 |
|    1 |    0 |    1 |
|    1 |    0 |    1 |
|    1 |    0 |    1 |
|    1 |    0 |    1 |
|    1 |    0 |    1 |
|    1 |    0 |    1 |
|    1 |    0 |    1 |
|    1 |    0 |    1 |
|    1 |    0 |    1 |
|    1 |    0 |    1 |
|    1 |    0 |    1 |
|    1 |    0 |    1 |
|    1 |    0 |    1 |
|    1 |    0 |    1 |
|    1 |    0 |    1 |
|    1 |    0 |    1 |
|    1 |    0 |    1 |
|    1 |    0 |    1 |
|    1 |    0 |    1 |
|    1 |    0 |    1 |
|    1 |    0 |    1 |
|    1 |    0 |    1 |
|    1 |    0 |    1 |
|    1 |    0 |    1 |
|    1 |    0 |    1 |
|    1 |    0 |    1 |
|    1 |    0 |    1 |
|    1 |    0 |    1 |
|    1 |    0 |    1 |
|    1 |    0 |    1 |
|    1 |    0 |    1 |
|    1 |    0 |    1 |
|    1 |    0 |    1 |
|    1 |    0 |    1 |
|    1 |    0 |    1 |
|    1 |    0 |    1 |
|    1 |    0 |    1 |
|    1 |    0 |    1 |
|    1 |    0 |    1 |
+------+------+------+
delete from t2;
select (select n_1(s1)) from t1 where s1 <50 group by id ;
+------------------+
| (select n_1(s1)) |
+------------------+
|                1 |
|                2 |
|                3 |
|                4 |
|                5 |
|                6 |
|                7 |
|                8 |
|                9 |
|               10 |
|               11 |
|               12 |
|               13 |
|               14 |
|               15 |
|               16 |
|               17 |
|               18 |
|               19 |
|               20 |
|               21 |
|               22 |
|               23 |
|               24 |
|               25 |
|               26 |
|               27 |
|               28 |
|               29 |
|               30 |
|               31 |
|               32 |
|               33 |
|               34 |
|               35 |
|               36 |
|               37 |
|               38 |
|               39 |
|               40 |
|               41 |
|               42 |
|               43 |
|               44 |
|               45 |
|               46 |
|               47 |
|               48 |
|               49 |
+------------------+
select * from t2;
+------+------+------+
| id   | s1   | s2   |
+------+------+------+
|    1 |    0 |    1 |
|    1 |    0 |    1 |
|    1 |    0 |    1 |
|    1 |    0 |    1 |
|    1 |    0 |    1 |
|    1 |    0 |    1 |
|    1 |    0 |    1 |
|    1 |    0 |    1 |
|    1 |    0 |    1 |
|    1 |    0 |    1 |
|    1 |    0 |    1 |
|    1 |    0 |    1 |
|    1 |    0 |    1 |
|    1 |    0 |    1 |
|    1 |    0 |    1 |
|    1 |    0 |    1 |
|    1 |    0 |    1 |
|    1 |    0 |    1 |
|    1 |    0 |    1 |
|    1 |    0 |    1 |
|    1 |    0 |    1 |
|    1 |    0 |    1 |
|    1 |    0 |    1 |
|    1 |    0 |    1 |
|    1 |    0 |    1 |
|    1 |    0 |    1 |
|    1 |    0 |    1 |
|    1 |    0 |    1 |
|    1 |    0 |    1 |
|    1 |    0 |    1 |
|    1 |    0 |    1 |
|    1 |    0 |    1 |
|    1 |    0 |    1 |
|    1 |    0 |    1 |
|    1 |    0 |    1 |
|    1 |    0 |    1 |
|    1 |    0 |    1 |
|    1 |    0 |    1 |
|    1 |    0 |    1 |
|    1 |    0 |    1 |
|    1 |    0 |    1 |
|    1 |    0 |    1 |
|    1 |    0 |    1 |
|    1 |    0 |    1 |
|    1 |    0 |    1 |
|    1 |    0 |    1 |
|    1 |    0 |    1 |
|    1 |    0 |    1 |
|    1 |    0 |    1 |
+------+------+------+
delete from t2;
select * from t1 where id=(select n_1(s1)) ;
+------+------+------+
| id   | s1   | s2   |
+------+------+------+
|    1 |    1 |    1 |
|    2 |    2 |    2 |
|    3 |    3 |    3 |
|    4 |    4 |    4 |
|    5 |    5 |    5 |
|    6 |    6 |    6 |
|    7 |    7 |    7 |
|    8 |    8 |    8 |
|    9 |    9 |    9 |
|   10 |   10 |   10 |
|   11 |   11 |   11 |
|   12 |   12 |   12 |
|   13 |   13 |   13 |
|   14 |   14 |   14 |
|   15 |   15 |   15 |
|   16 |   16 |   16 |
|   17 |   17 |   17 |
|   18 |   18 |   18 |
|   19 |   19 |   19 |
|   20 |   20 |   20 |
|   21 |   21 |   21 |
|   22 |   22 |   22 |
|   23 |   23 |   23 |
|   24 |   24 |   24 |
|   25 |   25 |   25 |
|   26 |   26 |   26 |
|   27 |   27 |   27 |
|   28 |   28 |   28 |
|   29 |   29 |   29 |
|   30 |   30 |   30 |
|   31 |   31 |   31 |
|   32 |   32 |   32 |
|   33 |   33 |   33 |
|   34 |   34 |   34 |
|   35 |   35 |   35 |
|   36 |   36 |   36 |
|   37 |   37 |   37 |
|   38 |   38 |   38 |
|   39 |   39 |   39 |
|   40 |   40 |   40 |
|   41 |   41 |   41 |
|   42 |   42 |   42 |
|   43 |   43 |   43 |
|   44 |   44 |   44 |
|   45 |   45 |   45 |
|   46 |   46 |   46 |
|   47 |   47 |   47 |
|   48 |   48 |   48 |
|   49 |   49 |   49 |
|   50 |   50 |   50 |
|   51 |   51 |   51 |
|   52 |   52 |   52 |
|   53 |   53 |   53 |
|   54 |   54 |   54 |
|   55 |   55 |   55 |
|   56 |   56 |   56 |
|   57 |   57 |   57 |
|   58 |   58 |   58 |
|   59 |   59 |   59 |
|   60 |   60 |   60 |
|   61 |   61 |   61 |
|   62 |   62 |   62 |
|   63 |   63 |   63 |
|   64 |   64 |   64 |
|   65 |   65 |   65 |
|   66 |   66 |   66 |
|   67 |   67 |   67 |
|   68 |   68 |   68 |
|   69 |   69 |   69 |
|   70 |   70 |   70 |
|   71 |   71 |   71 |
|   72 |   72 |   72 |
|   73 |   73 |   73 |
|   74 |   74 |   74 |
|   75 |   75 |   75 |
|   76 |   76 |   76 |
|   77 |   77 |   77 |
|   78 |   78 |   78 |
|   79 |   79 |   79 |
|   80 |   80 |   80 |
|   81 |   81 |   81 |
|   82 |   82 |   82 |
|   83 |   83 |   83 |
|   84 |   84 |   84 |
|   85 |   85 |   85 |
|   86 |   86 |   86 |
|   87 |   87 |   87 |
|   88 |   88 |   88 |
|   89 |   89 |   89 |
|   90 |   90 |   90 |
|   91 |   91 |   91 |
|   92 |   92 |   92 |
|   93 |   93 |   93 |
|   94 |   94 |   94 |
|   95 |   95 |   95 |
|   96 |   96 |   96 |
|   97 |   97 |   97 |
|   98 |   98 |   98 |
|   99 |   99 |   99 |
|  100 |  100 |  100 |
+------+------+------+
select * from t2;
+------+------+------+
| id   | s1   | s2   |
+------+------+------+
|    1 |    0 |    1 |
|    1 |    0 |    1 |
|    1 |    0 |    1 |
|    1 |    0 |    1 |
|    1 |    0 |    1 |
|    1 |    0 |    1 |
|    1 |    0 |    1 |
|    1 |    0 |    1 |
|    1 |    0 |    1 |
|    1 |    0 |    1 |
|    1 |    0 |    1 |
|    1 |    0 |    1 |
|    1 |    0 |    1 |
|    1 |    0 |    1 |
|    1 |    0 |    1 |
|    1 |    0 |    1 |
|    1 |    0 |    1 |
|    1 |    0 |    1 |
|    1 |    0 |    1 |
|    1 |    0 |    1 |
|    1 |    0 |    1 |
|    1 |    0 |    1 |
|    1 |    0 |    1 |
|    1 |    0 |    1 |
|    1 |    0 |    1 |
|    1 |    0 |    1 |
|    1 |    0 |    1 |
|    1 |    0 |    1 |
|    1 |    0 |    1 |
|    1 |    0 |    1 |
|    1 |    0 |    1 |
|    1 |    0 |    1 |
|    1 |    0 |    1 |
|    1 |    0 |    1 |
|    1 |    0 |    1 |
|    1 |    0 |    1 |
|    1 |    0 |    1 |
|    1 |    0 |    1 |
|    1 |    0 |    1 |
|    1 |    0 |    1 |
|    1 |    0 |    1 |
|    1 |    0 |    1 |
|    1 |    0 |    1 |
|    1 |    0 |    1 |
|    1 |    0 |    1 |
|    1 |    0 |    1 |
|    1 |    0 |    1 |
|    1 |    0 |    1 |
|    1 |    0 |    1 |
|    1 |    0 |    1 |
|    1 |    0 |    1 |
|    1 |    0 |    1 |
|    1 |    0 |    1 |
|    1 |    0 |    1 |
|    1 |    0 |    1 |
|    1 |    0 |    1 |
|    1 |    0 |    1 |
|    1 |    0 |    1 |
|    1 |    0 |    1 |
|    1 |    0 |    1 |
|    1 |    0 |    1 |
|    1 |    0 |    1 |
|    1 |    0 |    1 |
|    1 |    0 |    1 |
|    1 |    0 |    1 |
|    1 |    0 |    1 |
|    1 |    0 |    1 |
|    1 |    0 |    1 |
|    1 |    0 |    1 |
|    1 |    0 |    1 |
|    1 |    0 |    1 |
|    1 |    0 |    1 |
|    1 |    0 |    1 |
|    1 |    0 |    1 |
|    1 |    0 |    1 |
|    1 |    0 |    1 |
|    1 |    0 |    1 |
|    1 |    0 |    1 |
|    1 |    0 |    1 |
|    1 |    0 |    1 |
|    1 |    0 |    1 |
|    1 |    0 |    1 |
|    1 |    0 |    1 |
|    1 |    0 |    1 |
|    1 |    0 |    1 |
|    1 |    0 |    1 |
|    1 |    0 |    1 |
|    1 |    0 |    1 |
|    1 |    0 |    1 |
|    1 |    0 |    1 |
|    1 |    0 |    1 |
|    1 |    0 |    1 |
|    1 |    0 |    1 |
|    1 |    0 |    1 |
|    1 |    0 |    1 |
|    1 |    0 |    1 |
|    1 |    0 |    1 |
|    1 |    0 |    1 |
|    1 |    0 |    1 |
|    1 |    0 |    1 |
+------+------+------+
#联合索引
drop procedure initData;
create procedure initData()
begin
declare count int default 1;
while count <= 100 DO
 insert into t1 (id,s1,s2) values (count,count,count); 
 set count = count +1;
end while;
end;
/
drop table t3;
ERROR 42S02: Unknown table 'nxa.t3'
drop table t1;
create table t1(id int primary key,s1 int, s2 int);
call initData();
drop table t2;
create table t2(id int ,s1 int, s2 int);
drop function n_1;
create function n_1(a int) returns int deterministic 
begin
  insert into t2 values(1,0,1);
  return a;
end/
#不走索引
create index ix_iot on t1(id,s1,s2);
delete from t2;
select id,s1,s2,(select n_1(s1)) from t1 where s1 =50 and s2= (select n_1(s1));
+----+------+------+------------------+
| id | s1   | s2   | (select n_1(s1)) |
+----+------+------+------------------+
| 50 |   50 |   50 |               50 |
+----+------+------+------------------+
select * from t2;
+------+------+------+
| id   | s1   | s2   |
+------+------+------+
|    1 |    0 |    1 |
|    1 |    0 |    1 |
|    1 |    0 |    1 |
|    1 |    0 |    1 |
|    1 |    0 |    1 |
|    1 |    0 |    1 |
|    1 |    0 |    1 |
+------+------+------+
#走索引
alter table t1 drop index ix_iot;
create index ix_iot on t1(s1,s2,id);
delete from t2;
select id,s1,s2,(select n_1(s1))from t1 where s1 =50 and s2= (select n_1(s1));
+----+------+------+------------------+
| id | s1   | s2   | (select n_1(s1)) |
+----+------+------+------------------+
| 50 |   50 |   50 |               50 |
+----+------+------+------------------+
select * from t2;
+------+------+------+
| id   | s1   | s2   |
+------+------+------+
|    1 |    0 |    1 |
|    1 |    0 |    1 |
|    1 |    0 |    1 |
|    1 |    0 |    1 |
|    1 |    0 |    1 |
|    1 |    0 |    1 |
+------+------+------+
#索引列排序
alter table t1 drop index ix_iot;
create index ix_iot on t1(id,s1,s2);
delete from t2;
select id,s1,s2,(select n_1(s1))from t1 where id =50 and s1= (select n_1(s1)) order by s2;
+----+------+------+------------------+
| id | s1   | s2   | (select n_1(s1)) |
+----+------+------+------------------+
| 50 |   50 |   50 |               50 |
+----+------+------+------------------+
select * from t2;
+------+------+------+
| id   | s1   | s2   |
+------+------+------+
|    1 |    0 |    1 |
|    1 |    0 |    1 |
+------+------+------+
#索引列排序sort
delete from t2;
select id,s1,s2,(select n_1(s1))from t1 where id <51 and s1= (select n_1(s1)) order by s2;
+----+------+------+------------------+
| id | s1   | s2   | (select n_1(s1)) |
+----+------+------+------------------+
|  1 |    1 |    1 |                1 |
|  2 |    2 |    2 |                2 |
|  3 |    3 |    3 |                3 |
|  4 |    4 |    4 |                4 |
|  5 |    5 |    5 |                5 |
|  6 |    6 |    6 |                6 |
|  7 |    7 |    7 |                7 |
|  8 |    8 |    8 |                8 |
|  9 |    9 |    9 |                9 |
| 10 |   10 |   10 |               10 |
| 11 |   11 |   11 |               11 |
| 12 |   12 |   12 |               12 |
| 13 |   13 |   13 |               13 |
| 14 |   14 |   14 |               14 |
| 15 |   15 |   15 |               15 |
| 16 |   16 |   16 |               16 |
| 17 |   17 |   17 |               17 |
| 18 |   18 |   18 |               18 |
| 19 |   19 |   19 |               19 |
| 20 |   20 |   20 |               20 |
| 21 |   21 |   21 |               21 |
| 22 |   22 |   22 |               22 |
| 23 |   23 |   23 |               23 |
| 24 |   24 |   24 |               24 |
| 25 |   25 |   25 |               25 |
| 26 |   26 |   26 |               26 |
| 27 |   27 |   27 |               27 |
| 28 |   28 |   28 |               28 |
| 29 |   29 |   29 |               29 |
| 30 |   30 |   30 |               30 |
| 31 |   31 |   31 |               31 |
| 32 |   32 |   32 |               32 |
| 33 |   33 |   33 |               33 |
| 34 |   34 |   34 |               34 |
| 35 |   35 |   35 |               35 |
| 36 |   36 |   36 |               36 |
| 37 |   37 |   37 |               37 |
| 38 |   38 |   38 |               38 |
| 39 |   39 |   39 |               39 |
| 40 |   40 |   40 |               40 |
| 41 |   41 |   41 |               41 |
| 42 |   42 |   42 |               42 |
| 43 |   43 |   43 |               43 |
| 44 |   44 |   44 |               44 |
| 45 |   45 |   45 |               45 |
| 46 |   46 |   46 |               46 |
| 47 |   47 |   47 |               47 |
| 48 |   48 |   48 |               48 |
| 49 |   49 |   49 |               49 |
| 50 |   50 |   50 |               50 |
+----+------+------+------------------+
select count(*) from t2;
+----------+
| count(*) |
+----------+
|      100 |
+----------+
#约束
#auto_increment
drop table t1;
create table t1(id int primary key auto_increment, s1 int, s2 int);
insert into t1 values(1,1,3),(5,1,0),(3,1,0),(9,1,0),(2,7,0);
drop table t2;
create table t2(id int ,s1 int, s2 int);
drop function n_1;
create function n_1(a int) returns int deterministic 
begin
  insert into t2 values(1,0,1);
  return null;
end/
insert into t1(id) select (select n_1(s1)) from t1;
select * from t1;
+----+------+------+
| id | s1   | s2   |
+----+------+------+
|  1 |    1 |    3 |
|  2 |    7 |    0 |
|  3 |    1 |    0 |
|  5 |    1 |    0 |
|  9 |    1 |    0 |
| 10 | NULL | NULL |
| 11 | NULL | NULL |
| 12 | NULL | NULL |
| 13 | NULL | NULL |
| 14 | NULL | NULL |
+----+------+------+
select * from t2;
+------+------+------+
| id   | s1   | s2   |
+------+------+------+
|    1 |    0 |    1 |
|    1 |    0 |    1 |
|    1 |    0 |    1 |
|    1 |    0 |    1 |
|    1 |    0 |    1 |
+------+------+------+
#default 
drop table t1;
create table t1(id int default null, s1 int, s2 int default 1 not null);
insert into t1 values(1,1,3),(5,1,0),(3,1,0),(9,1,0),(2,7,0);
drop table t2;
create table t2(id int ,s1 int, s2 int);
drop function n_1;
create function n_1(a int) returns int deterministic 
begin
  insert into t2 values(1,0,1);
  return a;
end/
insert into t1(id) select (select n_1(s1)) from t1;
select * from t1;
+------+------+----+
| id   | s1   | s2 |
+------+------+----+
|    1 |    1 |  3 |
|    5 |    1 |  0 |
|    3 |    1 |  0 |
|    9 |    1 |  0 |
|    2 |    7 |  0 |
|    1 | NULL |  1 |
|    1 | NULL |  1 |
|    1 | NULL |  1 |
|    1 | NULL |  1 |
|    7 | NULL |  1 |
+------+------+----+
select * from t2;
+------+------+------+
| id   | s1   | s2   |
+------+------+------+
|    1 |    0 |    1 |
|    1 |    0 |    1 |
|    1 |    0 |    1 |
|    1 |    0 |    1 |
|    1 |    0 |    1 |
+------+------+------+
#虚拟列
drop table t1;
create table t1(id int, s1 int, s2 int,bao int GENERATED ALWAYS AS (id+s1) VIRTUAL);
insert into t1(id,s1,s2) values (1,1,3),(5,1,0),(3,1,0),(9,1,0),(2,7,0);
drop table t2;
create table t2(id int ,s1 int, s2 int);
drop function n_1;
create function n_1(a int) returns int deterministic 
begin
  insert into t2 values(1,0,1);
  return a;
end/
insert into t1(id,s1) select (select n_1(s1)),(select n_1(s1)) from t1;
select * from t1;
+------+------+------+------+
| id   | s1   | s2   | bao  |
+------+------+------+------+
|    1 |    1 |    3 |    2 |
|    5 |    1 |    0 |    6 |
|    3 |    1 |    0 |    4 |
|    9 |    1 |    0 |   10 |
|    2 |    7 |    0 |    9 |
|    1 |    1 | NULL |    2 |
|    1 |    1 | NULL |    2 |
|    1 |    1 | NULL |    2 |
|    1 |    1 | NULL |    2 |
|    7 |    7 | NULL |   14 |
+------+------+------+------+
select * from t2;
+------+------+------+
| id   | s1   | s2   |
+------+------+------+
|    1 |    0 |    1 |
|    1 |    0 |    1 |
|    1 |    0 |    1 |
|    1 |    0 |    1 |
|    1 |    0 |    1 |
|    1 |    0 |    1 |
|    1 |    0 |    1 |
|    1 |    0 |    1 |
|    1 |    0 |    1 |
|    1 |    0 |    1 |
+------+------+------+
#unique
drop table t1;
create table t1(id int unique, s1 int, s2 int);
insert into t1(id,s1,s2) values (1,1,3),(5,1,0),(3,1,0),(9,1,0),(2,7,0);
drop table t2;
create table t2(id int ,s1 int, s2 int);
drop function n_1;
create function n_1(a int) returns int deterministic 
begin
  insert into t2 values(1,0,1);
  return a;
end/
insert into t1(id) select (select n_1(s1))from t1;
ERROR 23000: Duplicate entry '1' for key 'id'
select * from t1;
+------+------+------+
| id   | s1   | s2   |
+------+------+------+
|    1 |    1 |    3 |
|    5 |    1 |    0 |
|    3 |    1 |    0 |
|    9 |    1 |    0 |
|    2 |    7 |    0 |
+------+------+------+
select * from t2;
+------+------+------+
| id   | s1   | s2   |
+------+------+------+
+------+------+------+
#zerofill
drop table t1;
create table t1(id int zerofill, s1 int, s2 int);
insert into t1(id,s1,s2) values (1,1,3),(5,1,0),(3,1,0),(9,1,0),(2,7,0);
drop table t2;
create table t2(id int(9) ,s1 int, s2 int);
drop function n_1;
create function n_1(a int) returns int deterministic 
begin
  insert into t2 values(1,0,1);
  return a;
end/
insert into t1(id) select (select n_1(s1))from t1;
select * from t1;
+------------+------+------+
| id         | s1   | s2   |
+------------+------+------+
| 0000000001 |    1 |    3 |
| 0000000005 |    1 |    0 |
| 0000000003 |    1 |    0 |
| 0000000009 |    1 |    0 |
| 0000000002 |    7 |    0 |
| 0000000001 | NULL | NULL |
| 0000000001 | NULL | NULL |
| 0000000001 | NULL | NULL |
| 0000000001 | NULL | NULL |
| 0000000007 | NULL | NULL |
+------------+------+------+
select * from t2;
+------+------+------+
| id   | s1   | s2   |
+------+------+------+
|    1 |    0 |    1 |
|    1 |    0 |    1 |
|    1 |    0 |    1 |
|    1 |    0 |    1 |
|    1 |    0 |    1 |
+------+------+------+
#not null
drop table t1;
create table t1(id int not null, s1 int, s2 int);
insert into t1(id,s1,s2) values (1,1,3),(5,1,0),(3,1,0),(9,1,0),(2,7,0);
drop table t2;
create table t2(id int(9) ,s1 int, s2 int);
drop function n_1;
create function n_1(a int) returns int deterministic 
begin
  insert into t2 values(1,0,1);
  return null;
end/
insert into t1(id) select (select n_1(s1))from t1;
ERROR 23000: Column 'id' cannot be null
select * from t1;
+----+------+------+
| id | s1   | s2   |
+----+------+------+
|  1 |    1 |    3 |
|  5 |    1 |    0 |
|  3 |    1 |    0 |
|  9 |    1 |    0 |
|  2 |    7 |    0 |
+----+------+------+
select * from t2;
+------+------+------+
| id   | s1   | s2   |
+------+------+------+
+------+------+------+
#分区
#rang分区
drop table t1;
create table t1(
  pid  int primary key,
  pname varchar(30)
) partition by range(pid)(
  partition p1 values less than(1000) ,
  partition p2 values less than(2000) ,
  partition p3 values less than(maxvalue)
);
insert into t1 (pid, pname) values (1, '瑶瑶');
insert into t1 (pid, pname) values (2, '西西');
insert into t1 (pid, pname) values (1500, '倩倩');
insert into t1 (pid, pname) values (1600, '菲菲');
insert into t1 (pid, pname) values (3000, '小花');
drop table t2;
create table t2(id int ,s1 int, s2 int);
drop function n_1;
create function n_1(a int) returns int deterministic 
begin
  insert into t2 values(1,0,1);
  return a;
end/
select * from t1  where pid=(select n_1(pid)) ;
+------+--------+
| pid  | pname  |
+------+--------+
|    1 | 瑶瑶   |
|    2 | 西西   |
| 1500 | 倩倩   |
| 1600 | 菲菲   |
| 3000 | 小花   |
+------+--------+
select * from t2;
+------+------+------+
| id   | s1   | s2   |
+------+------+------+
|    1 |    0 |    1 |
|    1 |    0 |    1 |
|    1 |    0 |    1 |
|    1 |    0 |    1 |
|    1 |    0 |    1 |
+------+------+------+
#list
drop table t1;
create table t1(
  pid   int,
  pname varchar(30)
) partition by list(pid)(
  partition p1 values in (1,2),
  partition p2 values in (1500,1600),
  partition p3 values in (3000)
);
insert into t1 (pid, pname) values (1, '瑶瑶');
insert into t1 (pid, pname) values (2, '西西');
insert into t1 (pid, pname) values (1500, '倩倩');
insert into t1 (pid, pname) values (1600, '菲菲');
insert into t1 (pid, pname) values (3000, '小花');
drop table t2;
create table t2(id int ,s1 int, s2 int);
drop function n_1;
create function n_1(a int) returns int deterministic 
begin
  insert into t2 values(1,0,1);
  return a;
end/
select * from t1  where pid=(select n_1(pid)) ;
+------+--------+
| pid  | pname  |
+------+--------+
|    1 | 瑶瑶   |
|    2 | 西西   |
| 1500 | 倩倩   |
| 1600 | 菲菲   |
| 3000 | 小花   |
+------+--------+
select * from t2;
+------+------+------+
| id   | s1   | s2   |
+------+------+------+
|    1 |    0 |    1 |
|    1 |    0 |    1 |
|    1 |    0 |    1 |
|    1 |    0 |    1 |
|    1 |    0 |    1 |
|    1 |    0 |    1 |
|    1 |    0 |    1 |
|    1 |    0 |    1 |
|    1 |    0 |    1 |
|    1 |    0 |    1 |
|    1 |    0 |    1 |
|    1 |    0 |    1 |
|    1 |    0 |    1 |
|    1 |    0 |    1 |
+------+------+------+
#hash
drop table t1;
create table t1(
  pid   int,
  pname varchar(30)
)
partition by hash(pid)
partitions 4
;
insert into t1 (pid, pname) values (1, '瑶瑶');
insert into t1 (pid, pname) values (2, '西西');
insert into t1 (pid, pname) values (1500, '倩倩');
insert into t1 (pid, pname) values (1600, '菲菲');
insert into t1 (pid, pname) values (3000, '小花');
drop table t2;
create table t2(id int ,s1 int, s2 int);
drop function n_1;
create function n_1(a int) returns int deterministic 
begin
  insert into t2 values(1,0,1);
  return a;
end/
select * from t1  where pid=(select n_1(pid)) ;
+------+--------+
| pid  | pname  |
+------+--------+
| 1500 | 倩倩   |
| 1600 | 菲菲   |
| 3000 | 小花   |
|    1 | 瑶瑶   |
|    2 | 西西   |
+------+--------+
select * from t2;
+------+------+------+
| id   | s1   | s2   |
+------+------+------+
|    1 |    0 |    1 |
|    1 |    0 |    1 |
|    1 |    0 |    1 |
|    1 |    0 |    1 |
|    1 |    0 |    1 |
+------+------+------+
select pid from t1  where pid in((select n_1(pid)),3000);
+------+
| pid  |
+------+
| 1500 |
| 1600 |
| 3000 |
|    1 |
|    2 |
+------+
select * from t2;
+------+------+------+
| id   | s1   | s2   |
+------+------+------+
|    1 |    0 |    1 |
|    1 |    0 |    1 |
|    1 |    0 |    1 |
|    1 |    0 |    1 |
|    1 |    0 |    1 |
|    1 |    0 |    1 |
|    1 |    0 |    1 |
|    1 |    0 |    1 |
|    1 |    0 |    1 |
|    1 |    0 |    1 |
+------+------+------+
#子分区
drop table t1;
CREATE TABLE t1 (id INT, s1 int,s2 int)
    PARTITION BY RANGE( id )
    SUBPARTITION BY HASH( s1 )
    SUBPARTITIONS 2 (
        PARTITION p0 VALUES LESS THAN (1990),
        PARTITION p1 VALUES LESS THAN (2000),
        PARTITION p2 VALUES LESS THAN MAXVALUE
    );
insert into t1 values (1,1990,4),(2,1991,3),(3,2009,2),(4,1,1);
drop table t2;
create table t2(id int ,s1 int, s2 int);
drop function n_1;
create function n_1(a int) returns int deterministic 
begin
  insert into t2 values(1,0,1);
  return a;
end/
delete from t2;
select id from t1  where s1=(select n_1(s1)) ;
+------+
| id   |
+------+
|    1 |
|    2 |
|    3 |
|    4 |
+------+
select * from t2;
+------+------+------+
| id   | s1   | s2   |
+------+------+------+
|    1 |    0 |    1 |
|    1 |    0 |    1 |
|    1 |    0 |    1 |
|    1 |    0 |    1 |
+------+------+------+
delete from t2;
select s1 from t1  where id=(select n_1(s1)) ;
+------+
| s1   |
+------+
+------+
select * from t2;
+------+------+------+
| id   | s1   | s2   |
+------+------+------+
|    1 |    0 |    1 |
|    1 |    0 |    1 |
|    1 |    0 |    1 |
|    1 |    0 |    1 |
+------+------+------+
delete from t2;
select (select n_1(s1)) from t1 group by s1 ;
+------------------+
| (select n_1(s1)) |
+------------------+
|             1990 |
|             1991 |
|             2009 |
|                1 |
+------------------+
select * from t2;
+------+------+------+
| id   | s1   | s2   |
+------+------+------+
|    1 |    0 |    1 |
|    1 |    0 |    1 |
|    1 |    0 |    1 |
|    1 |    0 |    1 |
+------+------+------+
delete from t2;
select (select n_1(s1)) from t1 where (id = 1 or id = 2) and s1 > 1990  ;
+------------------+
| (select n_1(s1)) |
+------------------+
|             1991 |
+------------------+
select * from t2;
+------+------+------+
| id   | s1   | s2   |
+------+------+------+
|    1 |    0 |    1 |
+------+------+------+
#一级分区裁剪
#hash
drop table t1;
create table t1 (id int, s1 int,s2 int) partition by hash(s1+s2) partitions 5;
insert into t1 values(1,1,3),(5,2,0),(3,3,0),(9,2,0),(2,7,0);
drop table t2;
create table t2(id int ,s1 int, s2 int);
drop function n_1;
create function n_1(a int) returns int deterministic 
begin
  insert into t2 values(1,0,1);
  return a;
end/
select * from t1 where  s1+s2=(select n_1(s1));
+------+------+------+
| id   | s1   | s2   |
+------+------+------+
|    5 |    2 |    0 |
|    9 |    2 |    0 |
|    2 |    7 |    0 |
|    3 |    3 |    0 |
+------+------+------+
select * from t2;
+------+------+------+
| id   | s1   | s2   |
+------+------+------+
|    1 |    0 |    1 |
|    1 |    0 |    1 |
|    1 |    0 |    1 |
|    1 |    0 |    1 |
|    1 |    0 |    1 |
+------+------+------+
#range
#不可分
drop table t1;
create table t1 (id int, s1 int,s2 int)  partition by range(id+1)(
  partition p1 values less than(2) ,
  partition p2 values less than(4) ,
  partition p3 values less than(maxvalue)
);
insert into t1 values(1,1,3),(5,2,0),(3,3,0),(9,2,0),(2,7,0);
drop table t2;
create table t2(id int ,s1 int, s2 int);
drop function n_1;
create function n_1(a int) returns int deterministic 
begin
  insert into t2 values(1,0,1);
  return a;
end/
select * from t1 where id < 9 and id > (select n_1(s1)) ;
+------+------+------+
| id   | s1   | s2   |
+------+------+------+
|    5 |    2 |    0 |
+------+------+------+
select * from t2;
+------+------+------+
| id   | s1   | s2   |
+------+------+------+
|    1 |    0 |    1 |
|    1 |    0 |    1 |
|    1 |    0 |    1 |
|    1 |    0 |    1 |
+------+------+------+
#可分
drop table t1;
create table t1 (id int, s1 int,s2 int)  partition by range(id+1)(
  partition p1 values less than(2) ,
  partition p2 values less than(4) ,
  partition p3 values less than(maxvalue)
);
insert into t1 values(1,1,3),(5,2,0),(3,3,0),(9,2,0),(2,7,0);
drop table t2;
create table t2(id int ,s1 int, s2 int);
drop function n_1;
create function n_1(a int) returns int deterministic 
begin
  insert into t2 values(1,0,1);
  return a;
end/
select (select n_1(s1)) from t1 where id = (select n_1(s1));
+------------------+
| (select n_1(s1)) |
+------------------+
|                1 |
|                3 |
+------------------+
select * from t2;
+------+------+------+
| id   | s1   | s2   |
+------+------+------+
|    1 |    0 |    1 |
|    1 |    0 |    1 |
|    1 |    0 |    1 |
|    1 |    0 |    1 |
|    1 |    0 |    1 |
|    1 |    0 |    1 |
|    1 |    0 |    1 |
+------+------+------+
drop table t1;
create table t1(
  pid  int primary key,
  pname varchar(30)
) partition by range(pid)(
  partition p1 values less than(1000) ,
  partition p2 values less than(2000) ,
  partition p3 values less than(maxvalue)
);
insert into t1 (pid, pname) values (1, '瑶瑶');
insert into t1 (pid, pname) values (1500, '倩倩');
insert into t1 (pid, pname) values (1400, '倩倩');
insert into t1 (pid, pname) values (3000, '小花');
drop table t2;
create table t2(id int ,s1 int, s2 int);
drop function n_1;
create function n_1(a int) returns int deterministic 
begin
  insert into t2 values(1,0,1);
  return a;
end/
select (select n_1(pid)) from t1  partition (p2) where pid <(select n_1(pid));
+-------------------+
| (select n_1(pid)) |
+-------------------+
+-------------------+
select * from t2;
+------+------+------+
| id   | s1   | s2   |
+------+------+------+
|    1 |    0 |    1 |
|    1 |    0 |    1 |
+------+------+------+
#udf_4  udf_dml
#insert
drop table t1;
create table t1(id int , s1 int, s2 int);
insert into t1(id,s1,s2) values (1,1,3),(5,1,0),(3,1,0),(9,1,0),(2,7,0);
drop table t3;
ERROR 42S02: Unknown table 'nxa.t3'
create table t3(id int , s1 int, s2 int);
insert into t3(id,s1,s2) values (1,1,3);
drop table t2;
create table t2(id int(9) ,s1 int, s2 int);
drop function n_1;
create function n_1(a int) returns int deterministic 
begin
  insert into t2 values(1,0,1);
  return a;
end/
drop table t2;
create table t2(id int ,s1 int, s2 int);
insert into t1 values(0,((select n_1(s1) from t3)),3),(1,0,0);
select  *  from t1;
+------+------+------+
| id   | s1   | s2   |
+------+------+------+
|    1 |    1 |    3 |
|    5 |    1 |    0 |
|    3 |    1 |    0 |
|    9 |    1 |    0 |
|    2 |    7 |    0 |
|    0 |    1 |    3 |
|    1 |    0 |    0 |
+------+------+------+
select count( * ) from t2;
+------------+
| count( * ) |
+------------+
|          1 |
+------------+
drop table t1;
create table t1(id int , s1 int, s2 int);
insert into t1(id,s1,s2) values (1,1,3),(5,1,0),(3,1,0);
drop table t2;
create table t2(id int ,s1 int, s2 int);
insert into t1 values(0,((select n_1(s1) from t3)),3),(1,0,0);
select count( * ) from t2;
+------------+
| count( * ) |
+------------+
|          1 |
+------------+
drop table t1;
create table t1(id int , s1 int, s2 int);
insert into t1(id,s1,s2) values (1,1,3),(5,1,0),(3,1,0);
drop table t2;
create table t2(id int ,s1 int, s2 int);
insert into t1 select (select n_1(s1)),1,2 from t1;
select count( * ) from t2;
+------------+
| count( * ) |
+------------+
|          3 |
+------------+
drop table t1;
create table t1(id int , s1 int, s2 int);
insert into t1(id,s1,s2) values (1,1,3),(5,1,0),(3,1,0);
drop table t2;
create table t2(id int ,s1 int, s2 int);
insert into t1(id) select s1 from t1 order by ((select n_1(s1)));
select count( * ) from t2;
+------------+
| count( * ) |
+------------+
|          3 |
+------------+
drop table t1;
create table t1(id int , s1 int, s2 int);
insert into t1(id,s1,s2) values (1,1,3),(5,1,0),(3,1,0);
drop table t2;
create table t2(id int ,s1 int, s2 int);
insert into t1(id) select s1 from t1 where (select n_1(s1))>1;
select count( * ) from t2;
+------------+
| count( * ) |
+------------+
|          3 |
+------------+
#updata
drop table t1;
create table t1(id int , s1 int, s2 int);
insert into t1(id,s1,s2) values (1,1,3),(5,1,0),(3,1,0),(9,1,0),(2,7,0);
drop table t2;
create table t2(id int(9) ,s1 int, s2 int);
drop function n_1;
create function n_1(a int) returns int deterministic 
begin
  insert into t2 values(1,0,1);
  return a;
end/
drop table t2;
create table t2(id int ,s1 int, s2 int);
update t1 set id=(select n_1(s1)) ;
select count( * ) from t2;
+------------+
| count( * ) |
+------------+
|          5 |
+------------+
drop table t2;
create table t2(id int ,s1 int, s2 int);
update t1 set id=(select (select n_1(s1)) ) ;
select count( * ) from t2;
+------------+
| count( * ) |
+------------+
|          5 |
+------------+
drop table t2;
create table t2(id int ,s1 int, s2 int);
update t1 set id=1 where id=(select (select n_1(s1)));
select count( * ) from t2;
+------------+
| count( * ) |
+------------+
|          5 |
+------------+
drop table t1;
create table t1(id int, s1 int, s2 int);
insert into t1 values(0,1,3),(1,0,0);
drop table t3;
create table t3(id int, s1 int, s2 int);
insert into t3 values(0,1,3),(1,0,0);
drop table t2;
create table t2(id int ,s1 int, s2 int);
update t1 set id=(select (select n_1(s1)) from t3 where t3.s1=1 );
select count( * ) from t2;
+------------+
| count( * ) |
+------------+
|          2 |
+------------+
drop table t2;
create table t2(id int ,s1 int, s2 int);
update t1 set id=(select (select n_1(s1)) from t3  limit 1);
select count( * ) from t2;
+------------+
| count( * ) |
+------------+
|          1 |
+------------+
drop table t1;
create table t1(stats int, s1 int, s2 int);
insert into t1 values(0,1,3),(1,0,0);
drop table t2;
create table t2(id int ,s1 int, s2 int);
update t1 set stats=(select (select n_1(s1)) from t3 group by (select n_1(s1)) having max((select n_1(s1))) limit 1);
select count( * ) from t2;
+------------+
| count( * ) |
+------------+
|          1 |
+------------+
#delete
drop table t1;
create table t1(id int , s1 int, s2 int);
insert into t1(id,s1,s2) values (1,1,3),(5,1,0),(3,1,0),(9,1,0),(3,7,0);
drop table t2;
create table t2(id int(9) ,s1 int, s2 int);
drop function n_1;
create function n_1(a int) returns int deterministic 
begin
  insert into t2 values(1,0,1);
  return a;
end/
delete from t1 where id=(select n_1(s1));
select count( * ) from t2;
+------------+
| count( * ) |
+------------+
|          5 |
+------------+
drop table t1;
create table t1(id int, s1 int, s2 int);
insert into t1 values(0,1,3),(1,0,0);
drop table t3;
create table t3(id int, s1 int, s2 int);
insert into t3 values(0,1,3),(1,0,0);
drop table t2;
create table t2(id int ,s1 int, s2 int);
delete from t1 where id=(select (select n_1(s1)) from t3 group by (select n_1(s1)) having max((select n_1(s1)))limit 1);
select count( * ) from t2;
+------------+
| count( * ) |
+------------+
|          1 |
+------------+
drop table t1;
create table t1(id int, s1 int, s2 int);
insert into t1 values(0,1,3),(1,0,0);
drop table t3;
create table t3(id int, s1 int, s2 int);
insert into t3 values(0,3,3),(1,0,0),(0,3,0);
drop table t2;
create table t2(id int ,s1 int, s2 int);
delete from t1 where id =(select id from t3 where s1 = (select n_1(s1)) limit 1);
select count( * ) from t2;
+------------+
| count( * ) |
+------------+
|          1 |
+------------+
#replace into
drop table t1;
create table t1(id int, s1 int, s2 int);
insert into t1 values(0,1,3),(1,0,0);
drop table t3;
create table t3(id int, s1 int, s2 int);
insert into t3 values(0,3,3),(1,0,0),(0,3,0);
drop function n_1;
create function n_1(a int) returns int deterministic 
begin
  insert into t2 values(1,0,1);
  return a;
end/
drop table t2;
create table t2(id int ,s1 int, s2 int);
replace into t1 select (select n_1(s1)),1,2 from t3;
select count( * ) from t2;
+------------+
| count( * ) |
+------------+
|          3 |
+------------+
drop table t1;
create table t1(id int, s1 int, s2 int);
insert into t1 values(0,1,3),(1,0,0);
drop table t2;
create table t2(id int ,s1 int, s2 int);
replace into t1 values((select n_1(s1) from t3 limit 1),1,2);
select count( * ) from t2;
+------------+
| count( * ) |
+------------+
|          1 |
+------------+
##42037046 带参udf在having内无法传入字段
delete from t1;
insert into t1 values(0,1,3),(1,0,0);
drop table t2;
create table t2(id int ,s1 int, s2 int);
replace into t1(id) select (select n_1(s1)) from t3 group by (select n_1(s1)) having max((select n_1(s1)));
select count( * ) from t2;
+------------+
| count( * ) |
+------------+
|          3 |
+------------+
delete from t1;
insert into t1 values(0,1,3),(1,0,0);
drop table t2;
create table t2(id int ,s1 int, s2 int);
replace into t1 select * from t3 order by ((select n_1(s1)));
select count( * ) from t2;
+------------+
| count( * ) |
+------------+
|          3 |
+------------+
drop table t1;
create table t1(id int, s1 int, s2 int);
drop table t2;
create table t2(id int ,s1 int, s2 int);
insert into t1(id) select (select n_1(s1)) from t3 where (select n_1(s1))>1;
select count( * ) from t2;
+------------+
| count( * ) |
+------------+
|          5 |
+------------+
replace 作为改
drop table t1;
create table t1(stats int primary key, s1 int, s2 int);
insert into t1 values(0,1,3),(1,0,0);
drop table t2;
create table t2(id int ,s1 int, s2 int);
replace into t1 select (select n_1(s1)),1,2 from t3;
select count( * ) from t2;
+------------+
| count( * ) |
+------------+
|          0 |
+------------+
drop table t1;
create table t1(stats int primary key, s1 int, s2 int);
insert into t1 values(0,1,3),(1,0,0);
drop table t2;
create table t2(id int ,s1 int, s2 int);
replace into t1(stats) select (select n_1(s1)) from t3 order by (select n_1(s1));
select count( * ) from t2;
+------------+
| count( * ) |
+------------+
|          0 |
+------------+
##42037046 带参udf在having内无法传入字段
drop table t1;
create table t1(stats int primary key, s1 int, s2 int);
insert into t1 values(0,1,3),(1,0,0);
drop table t2;
create table t2(id int ,s1 int, s2 int);
replace into t1(stats) select (select n_1(s1)) from t3 group by (select n_1(s1)) having sum((select n_1(s1)))>0;
select count( * ) from t2;
+------------+
| count( * ) |
+------------+
|          3 |
+------------+
###清理环境
drop user yyl;
purge recyclebin;
