purge recyclebin;
drop user ljh@'%';
create user ljh identified by 'ljh';
grant all on *.* to ljh WITH GRANT OPTION;
SET character_set_client = 'utf8mb4';
SET character_set_connection = 'utf8mb4';
SET character_set_results = 'utf8mb4';
--------------------------------------------------------------------------
######################## 标签：FIND_IN_SET-2 SQL操作  ########################
######## FIND_IN_SET-3-1  select
DROP TABLE t1;
CREATE TABLE t1(
id int, 
name varchar(100), 
age int,
city varchar(100),
depno int not null,
sal int, 
PRIMARY KEY (id,age))
PARTITION BY RANGE (age) ( 
PARTITION p0 VALUES LESS THAN (20), 
PARTITION p1 VALUES LESS THAN (30),  
PARTITION p2 VALUES LESS THAN MAXVALUE);
INSERT INTO t1 VALUES(1,'程程',20,'杭州',101,8000);
INSERT INTO t1 VALUES(2,'依依',25,'广州',101,7000);
INSERT INTO t1 VALUES(3,'阿布',30,'苏州',102,6000);
INSERT INTO t1 VALUES(4,'一诺',31,'苏州',103,5000);
DROP TABLE t2;
CREATE TABLE t2(
id int,
depno int,
depname varchar(200),
INDEX index_name (depno))
PARTITION BY LIST(depno)( 
PARTITION p0 VALUES IN (101,102),
PARTITION p1 VALUES IN (103,104),
PARTITION p2 VALUES IN (105,106));
INSERT INTO t2 VALUES(1,101,'蚂蚁');
INSERT INTO t2 VALUES(2,102,'淘宝');
INSERT INTO t2 VALUES(3,103,'支付');
DROP TABLE t3;
CREATE TABLE t3(
id int,
c1 varchar(200),
c2 varchar(200),
c3 varchar(200))
PARTITION BY HASH(id) PARTITIONS 3;
INSERT INTO t3 VALUES(1,'张','章',NULL);
INSERT INTO t3 VALUES(2,'陈','陈',NULL);
INSERT INTO t3 VALUES(3,'王','望',NULL);
DROP VIEW v1;
CREATE VIEW v1 as SELECT id,name,age FROM t1;
###### select 普通查询
SELECT FIND_IN_SET(name,'依依') FROM t1 ORDER BY 1;
FIND_IN_SET(name,'依依')
0
0
0
1
SELECT FIND_IN_SET(depno,102) FROM t2 ORDER BY 1;
FIND_IN_SET(depno,102)
0
0
1
SELECT FIND_IN_SET(c1,c2) FROM t3 ORDER BY 1;
FIND_IN_SET(c1,c2)
0
0
1
SELECT FIND_IN_SET(age,20+3) FROM v1 ORDER BY 1;
FIND_IN_SET(age,20+3)
0
0
0
0
###### where 子句
SELECT * FROM t1 WHERE FIND_IN_SET(name,'依依') = 0 ORDER BY 1;
id	name	age	city	depno	sal
1	程程	20	杭州	101	8000
3	阿布	30	苏州	102	6000
4	一诺	31	苏州	103	5000
SELECT * FROM t2 WHERE FIND_IN_SET(depno,102) != 0 ORDER BY 1;
id	depno	depname
2	102	淘宝
SELECT * FROM t2 WHERE FIND_IN_SET(depno,102) < 0 ORDER BY 1;
id	depno	depname
SELECT * FROM t3 WHERE FIND_IN_SET(c1,c2) > 0 ORDER BY 1;
id	c1	c2	c3
2	陈	陈	NULL
SELECT * FROM v1 WHERE FIND_IN_SET(age,20+3) <= FIND_IN_SET(age,age-3) ORDER BY 1;
id	name	age
1	程程	20
2	依依	25
3	阿布	30
4	一诺	31
##order by 子句
SELECT * FROM t1 WHERE FIND_IN_SET(name,'依依') = 0 ORDER BY FIND_IN_SET(name,name);
id	name	age	city	depno	sal
1	程程	20	杭州	101	8000
3	阿布	30	苏州	102	6000
4	一诺	31	苏州	103	5000
SELECT * FROM t2 WHERE FIND_IN_SET(depno,102) < 0 ORDER BY FIND_IN_SET(depno,102);
id	depno	depname
SELECT * FROM t3 WHERE FIND_IN_SET(c1,c2) > 0 ORDER BY FIND_IN_SET(c1,c2);
id	c1	c2	c3
2	陈	陈	NULL
SELECT * FROM v1 WHERE FIND_IN_SET(age,20+5) = 0 ORDER BY FIND_IN_SET(age,25);
id	name	age
1	程程	20
3	阿布	30
4	一诺	31
SELECT * FROM v1 ORDER BY FIND_IN_SET(age,NULL);
id	name	age
1	程程	20
2	依依	25
3	阿布	30
4	一诺	31
SELECT * FROM v1 ORDER BY FIND_IN_SET(NULL,NULL);
id	name	age
1	程程	20
2	依依	25
3	阿布	30
4	一诺	31
##group by having 子句
SELECT * FROM t1 WHERE FIND_IN_SET(name,'依依') = 0 GROUP BY FIND_IN_SET(name,'') ORDER BY 1;
id	name	age	city	depno	sal
1	程程	20	杭州	101	8000
SELECT * FROM t2 WHERE FIND_IN_SET(depno,102) != 0 GROUP BY FIND_IN_SET(depname,'') HAVING FIND_IN_SET(depno,102) != 0 ORDER BY 1;
id	depno	depname
2	102	淘宝
SELECT * FROM t3 WHERE FIND_IN_SET(c1,c2) > 0 GROUP BY FIND_IN_SET(c1,'') ORDER BY 1;
id	c1	c2	c3
2	陈	陈	NULL
SELECT * FROM v1 WHERE FIND_IN_SET(age,20+3) <= FIND_IN_SET(age,name) GROUP BY FIND_IN_SET(age,20) ORDER BY 1;
id	name	age
1	程程	20
2	依依	25
#DISTINCT
SELECT DISTINCT FIND_IN_SET(city,'苏州') FROM t1 WHERE FIND_IN_SET(name,'依依') = 0 ORDER BY 1;
FIND_IN_SET(city,'苏州')
0
1
SELECT DISTINCT FIND_IN_SET(depno,103) FROM t2 WHERE FIND_IN_SET(depno,102) < 0 ORDER BY 1;
FIND_IN_SET(depno,103)
SELECT DISTINCT FIND_IN_SET(c1,c2) FROM t3 WHERE FIND_IN_SET(c1,c2) > 0 ORDER BY 1;
FIND_IN_SET(c1,c2)
1
SELECT DISTINCT FIND_IN_SET(age,25) FROM v1 ORDER BY 1;
FIND_IN_SET(age,25)
0
1
#CASE WHEN
SELECT id,name,sal,FIND_IN_SET(CASE WHEN sal < 6000 THEN NULL ELSE sal END,sal) FIND_IN_SET_sal FROM t1 ORDER BY 1;
id	name	sal	FIND_IN_SET_sal
1	程程	8000	1
2	依依	7000	1
3	阿布	6000	1
4	一诺	5000	NULL
SELECT id,depno,depname,CASE FIND_IN_SET(depno,102) WHEN 1 THEN 'depno>102' WHEN 0 THEN 'depno=102' ELSE 'depno<102' END FIND_IN_SET_depo FROM t2 ORDER BY 1;
id	depno	depname	FIND_IN_SET_depo
1	101	蚂蚁	depno=102
2	102	淘宝	depno>102
3	103	支付	depno=102
SELECT id,c1,c2,CASE WHEN FIND_IN_SET(c1,c2)=0 THEN 'c1=c2' WHEN FIND_IN_SET(c1,c2)>0 THEN 'c1>c2' ELSE 'c1<c2' END FROM t3 ORDER BY 1 ;
id	c1	c2	CASE WHEN FIND_IN_SET(c1,c2)=0 THEN 'c1=c2' WHEN FIND_IN_SET(c1,c2)>0 THEN 'c1>c2' ELSE 'c1<c2' END
1	张	章	c1=c2
2	陈	陈	c1>c2
3	王	望	c1=c2
##连接查询
SELECT e.*,p.*,FIND_IN_SET(e.depno,p.depno) FROM t1 e, t2 p WHERE FIND_IN_SET(e.depno,p.depno) = 0 ORDER BY 1;
id	name	age	city	depno	sal	id	depno	depname	FIND_IN_SET(e.depno,p.depno)
1	程程	20	杭州	101	8000	2	102	淘宝	0
1	程程	20	杭州	101	8000	3	103	支付	0
2	依依	25	广州	101	7000	2	102	淘宝	0
2	依依	25	广州	101	7000	3	103	支付	0
3	阿布	30	苏州	102	6000	1	101	蚂蚁	0
3	阿布	30	苏州	102	6000	3	103	支付	0
4	一诺	31	苏州	103	5000	1	101	蚂蚁	0
4	一诺	31	苏州	103	5000	2	102	淘宝	0
SELECT e.*,p.*,FIND_IN_SET(e.id,p.depno)  FROM t1 e LEFT JOIN t2 p ON FIND_IN_SET(e.depno,p.depno) = 0 ORDER BY 1;
id	name	age	city	depno	sal	id	depno	depname	FIND_IN_SET(e.id,p.depno)
1	程程	20	杭州	101	8000	2	102	淘宝	0
1	程程	20	杭州	101	8000	3	103	支付	0
2	依依	25	广州	101	7000	2	102	淘宝	0
2	依依	25	广州	101	7000	3	103	支付	0
3	阿布	30	苏州	102	6000	1	101	蚂蚁	0
3	阿布	30	苏州	102	6000	3	103	支付	0
4	一诺	31	苏州	103	5000	1	101	蚂蚁	0
4	一诺	31	苏州	103	5000	2	102	淘宝	0
SELECT e.*,p.*,FIND_IN_SET(e.name,p.depname)  FROM t1 e RIGHT JOIN t2 p ON FIND_IN_SET(e.depno,p.depno) = 0 ORDER BY 1;
id	name	age	city	depno	sal	id	depno	depname	FIND_IN_SET(e.name,p.depname)
1	程程	20	杭州	101	8000	2	102	淘宝	0
1	程程	20	杭州	101	8000	3	103	支付	0
2	依依	25	广州	101	7000	2	102	淘宝	0
2	依依	25	广州	101	7000	3	103	支付	0
3	阿布	30	苏州	102	6000	1	101	蚂蚁	0
3	阿布	30	苏州	102	6000	3	103	支付	0
4	一诺	31	苏州	103	5000	1	101	蚂蚁	0
4	一诺	31	苏州	103	5000	2	102	淘宝	0
SELECT e.*,p.*,FIND_IN_SET(e.depno,NULL)  FROM t1 e INNER JOIN t2 p ON FIND_IN_SET(e.depno,p.depno) = 0 ORDER BY 1;
id	name	age	city	depno	sal	id	depno	depname	FIND_IN_SET(e.depno,NULL)
1	程程	20	杭州	101	8000	2	102	淘宝	NULL
1	程程	20	杭州	101	8000	3	103	支付	NULL
2	依依	25	广州	101	7000	2	102	淘宝	NULL
2	依依	25	广州	101	7000	3	103	支付	NULL
3	阿布	30	苏州	102	6000	1	101	蚂蚁	NULL
3	阿布	30	苏州	102	6000	3	103	支付	NULL
4	一诺	31	苏州	103	5000	1	101	蚂蚁	NULL
4	一诺	31	苏州	103	5000	2	102	淘宝	NULL
##select嵌套
#SELECT
SELECT id,name,age,FIND_IN_SET(sal,5000) FROM (SELECT * FROM t1 WHERE FIND_IN_SET(age,30) = 1 ORDER BY 1) t1 ORDER BY 1;
id	name	age	FIND_IN_SET(sal,5000)
3	阿布	30	0
SELECT id,depno,depname,FIND_IN_SET(depno,102) FROM t2 where depno = (SELECT depno FROM t1 WHERE FIND_IN_SET(depno,102) <= 0 limit 1) ORDER BY 1;
id	depno	depname	FIND_IN_SET(depno,102)
1	101	蚂蚁	0
#EXISTS AND NOT EXISTS
SELECT id,name,age,FIND_IN_SET(sal,5000) FROM t1 WHERE EXISTS (SELECT * FROM t2 where FIND_IN_SET(depno,102)) ORDER BY 1;
id	name	age	FIND_IN_SET(sal,5000)
1	程程	20	0
2	依依	25	0
3	阿布	30	0
4	一诺	31	1
SELECT id,depno,depname,FIND_IN_SET(depno,102) FROM t2 WHERE NOT EXISTS (SELECT * FROM t3 WHERE FIND_IN_SET(c1,'wang') != 0) ORDER BY 1;
id	depno	depname	FIND_IN_SET(depno,102)
1	101	蚂蚁	0
2	102	淘宝	1
3	103	支付	0
#ANY
SELECT id,name,age,FIND_IN_SET(sal,5000) FROM t1 WHERE FIND_IN_SET(sal,5000) = ANY (SELECT FIND_IN_SET(age,25) FROM t1) ORDER BY 1;
id	name	age	FIND_IN_SET(sal,5000)
1	程程	20	0
2	依依	25	0
3	阿布	30	0
4	一诺	31	1
SELECT id,depno,depname,FIND_IN_SET(depno,102) FROM t2 WHERE FIND_IN_SET(depno,102) <= ANY (SELECT FIND_IN_SET(depno,25) FROM t1) ORDER BY 1;
id	depno	depname	FIND_IN_SET(depno,102)
1	101	蚂蚁	0
3	103	支付	0
SELECT id,c1,c2,FIND_IN_SET(c1,c2) FROM t3 WHERE FIND_IN_SET(c1,c2) >= ANY (SELECT FIND_IN_SET(c1,'a') FROM t3) ORDER BY 1;
id	c1	c2	FIND_IN_SET(c1,c2)
1	张	章	0
2	陈	陈	1
3	王	望	0
#ALL 
SELECT id,name,age,FIND_IN_SET(sal,5000) FROM t1 WHERE FIND_IN_SET(sal,5000) = ALL (SELECT FIND_IN_SET(age,25) FROM t1) ORDER BY 1;
id	name	age	FIND_IN_SET(sal,5000)
SELECT id,depno,depname,FIND_IN_SET(depno,102) FROM t2 WHERE FIND_IN_SET(depno,102) <= ALL (SELECT FIND_IN_SET(depno,25) FROM t1) ORDER BY 1;
id	depno	depname	FIND_IN_SET(depno,102)
1	101	蚂蚁	0
3	103	支付	0
SELECT id,c1,c2,FIND_IN_SET(c1,c2) FROM t3 WHERE FIND_IN_SET(c1,c2) >= ALL (SELECT FIND_IN_SET(c1,'a') FROM t3) ORDER BY 1;
id	c1	c2	FIND_IN_SET(c1,c2)
1	张	章	0
2	陈	陈	1
3	王	望	0
#CREATE AS
DROP TABLE t4;
CREATE TABLE t4 AS SELECT id,name,age,FIND_IN_SET(sal,6000) FROM t1;
SELECT * FROM t4;
id	name	age	FIND_IN_SET(sal,6000)
1	程程	20	0
2	依依	25	0
3	阿布	30	1
4	一诺	31	0
#INSERT INTO AS
INSERT INTO t3 SELECT id,name,FIND_IN_SET(age,20),FIND_IN_SET(sal,6000) FROM t1 WHERE FIND_IN_SET(name,'程程') = 0;
SELECT * FROM t3 ORDER BY 1;
id	c1	c2	c3
1	张	章	NULL
2	陈	陈	NULL
2	依依	0	0
3	王	望	NULL
3	阿布	0	1
4	一诺	0	0
#UPDATE SET
UPDATE t3 e INNER JOIN  t1 p ON e.id = p.id SET e.c2 = FIND_IN_SET(p.sal,6000) where FIND_IN_SET(p.name,'程程') = 0;
SELECT * FROM t3 ORDER BY 1;
id	c1	c2	c3
1	张	章	NULL
2	陈	0	NULL
2	依依	0	0
3	王	1	NULL
3	阿布	1	1
4	一诺	0	0
#WITH AS的SELECT
WITH a AS (SELECT id,name,city,FIND_IN_SET(name,'a'),FIND_IN_SET(city,'a') name2 FROM t1) SELECT * FROM a ORDER BY 1;
id	name	city	FIND_IN_SET(name,'a')	name2
1	程程	杭州	0	0
2	依依	广州	0	0
3	阿布	苏州	0	0
4	一诺	苏州	0	0
WITH a AS (SELECT id,depno,depname,FIND_IN_SET(depno,102),FIND_IN_SET(depname,'a') FROM t2 where FIND_IN_SET(depno,102) = 0) SELECT * FROM a ORDER BY 1;
id	depno	depname	FIND_IN_SET(depno,102)	FIND_IN_SET(depname,'a')
1	101	蚂蚁	0	0
3	103	支付	0	0
#模糊查询like 
SELECT id,name,age,FIND_IN_SET(sal,5000) FROM t1 WHERE FIND_IN_SET(sal,5000) LIKE '%1%';
id	name	age	FIND_IN_SET(sal,5000)
4	一诺	31	1
SELECT id,depno,depname,FIND_IN_SET(depno,102) FROM t2 WHERE FIND_IN_SET(depno,102) LIKE '%0%';
id	depno	depname	FIND_IN_SET(depno,102)
1	101	蚂蚁	0
3	103	支付	0
### 标签：FIND_IN_SET-3-2 insert
INSERT INTO t3 VALUES(4,FIND_IN_SET('wang','Wan'),FIND_IN_SET(2022,2023),FIND_IN_SET(NULL,0));
INSERT INTO t3 SELECT id,name,age,FIND_IN_SET(sal,6000) FROM t1 WHERE FIND_IN_SET(name,'一诺')=0 ORDER BY 1;
SELECT * FROM  t3 ORDER BY 1;
id	c1	c2	c3
1	张	章	NULL
1	程程	20	0
2	陈	0	NULL
2	依依	0	0
2	依依	25	0
3	王	1	NULL
3	阿布	1	1
3	阿布	30	1
4	一诺	0	0
4	0	0	NULL
### 标签：FIND_IN_SET-3-3 update
UPDATE t3 SET c2 = FIND_IN_SET(c2,'a'),c3 = FIND_IN_SET(c1,c2)  where FIND_IN_SET(concat(c1,c2),'陈陈') = 0;
SELECT * FROM t3 ORDER BY 1;
id	c1	c2	c3
1	张	0	0
1	程程	0	0
2	陈	0	0
2	依依	0	0
2	依依	0	0
3	王	0	0
3	阿布	0	0
3	阿布	0	0
4	一诺	0	0
4	0	0	1
### 标签：FIND_IN_SET-3-4 delete
DELETE FROM t3 WHERE c3 = FIND_IN_SET(1,2);
SELECT * FROM  t3 ORDER BY 1;
id	c1	c2	c3
4	0	0	1
### 标签：FIND_IN_SET-3-5 replace   
replace into t1 values(5,'replace',28,'杭州',103,9000);
select * from t1 where id = 5;
id	name	age	city	depno	sal
5	replace	28	杭州	103	9000
replace into t1 values(5,'replace',28,'杭州',103,FIND_IN_SET(9000,null));
select * from t1 where id = 5;
id	name	age	city	depno	sal
5	replace	28	杭州	103	NULL
drop table t1;
CREATE table t1(id bigint PRIMARY key AUTO_INCREMENT,c1 varchar(20),c2 FLOAT,c3 datetime);
insert into t1(c1,c2,c3) values('不是放入额我确认',513514,'2023-06-20 01:01:01');
insert into t1(c1,c2,c3) values('sgfwrertew',-5164564,'2023-06-21 02:01:01');
insert into t1(c1,c2,c3) values('sgfwr散热问问如果',0.5164564,'2023-06-22 03:01:01');
insert into t1(c1,c2,c3) values('nusfwhif',null,'2023-06-23 04:01:01');
insert into t1(c1,c2,c3) values('54wmd国土】【】',3.5464,'2023-06-24 05:01:01');
select * from t1 order by id asc;
id	c1	c2	c3
1	不是放入额我确认	513514	2023-06-20 01:01:01
2	sgfwrertew	-5164560	2023-06-21 02:01:01
3	sgfwr散热问问如果	0.516456	2023-06-22 03:01:01
4	nusfwhif	NULL	2023-06-23 04:01:01
5	54wmd国土】【】	3.5464	2023-06-24 05:01:01
select * from t1 where id=FIND_IN_SET((select c2 from t1 where id=2),'-5164564,,0.01,2023-06-22 03:01:01');
id	c1	c2	c3
select * from t1 where id=1;
id	c1	c2	c3
1	不是放入额我确认	513514	2023-06-20 01:01:01
select * from t1 where FIND_IN_SET((select c2 from t1 where id=2),'-5164564,,0.01,2023-06-22 03:01:01') or FIND_IN_SET((select c2 from t1 where id=2),'-5164564,,0.01,2023-06-22 03:01:01');
id	c1	c2	c3
SELECT * FROM t1 WHERE id=FIND_IN_SET('1+1', CONCAT(true,'+',true));
id	c1	c2	c3
1	不是放入额我确认	513514	2023-06-20 01:01:01
SELECT * FROM t1 WHERE id=FIND_IN_SET('1+1', '2,1+1,2');
id	c1	c2	c3
2	sgfwrertew	-5164560	2023-06-21 02:01:01
SELECT * FROM t1 WHERE FIND_IN_SET('54wmd国土', CONCAT(54, 'wmd', '国土'));
id	c1	c2	c3
1	不是放入额我确认	513514	2023-06-20 01:01:01
2	sgfwrertew	-5164560	2023-06-21 02:01:01
3	sgfwr散热问问如果	0.516456	2023-06-22 03:01:01
4	nusfwhif	NULL	2023-06-23 04:01:01
5	54wmd国土】【】	3.5464	2023-06-24 05:01:01
SELECT * FROM t1 WHERE FIND_IN_SET('value1','value2') and FIND_IN_SET('value2','value2');
id	c1	c2	c3
SELECT FIND_IN_SET(1,1) FROM dual WHERE abs(1) OR 2;
FIND_IN_SET(1,1)
1
SELECT FIND_IN_SET(-1.0e-131,0) FROM dual;
FIND_IN_SET(-1.0e-131,0)
0
drop table t1;
CREATE table t1(id bigint PRIMARY key AUTO_INCREMENT,c1 FLOAT);
insert into t1(c1) values(12356);
insert into t1(c1) values(-8654491);
insert into t1(c1) values(null);
insert into t1(c1) values(0.512334);
insert into t1(c1) values(3.1415926);
select * from t1 order by id asc;
id	c1
1	12356
2	-8654490
3	NULL
4	0.512334
5	3.14159
select * from t1 where id=FIND_IN_SET((select c1 from t1 where id=2),'-8654490,-8654491');
id	c1
1	12356
select * from t1 where id=FIND_IN_SET((select c1 from t1 where id=2),'-8654491');
id	c1
drop table tt1;
create table tt1 as select FIND_IN_SET(NULL,'null') from dual;
desc tt1;
Field	Type	Null	Key	Default	Extra
FIND_IN_SET(NULL,'null')	bigint(20) unsigned	YES		NULL	
select * from tt1;
FIND_IN_SET(NULL,'null')
NULL
drop table tt1;
create table tt1 as select FIND_IN_SET(1,'str,99 1,1,999') from dual;
desc tt1;
Field	Type	Null	Key	Default	Extra
FIND_IN_SET(1,'str,99 1,1,999')	bigint(20) unsigned	YES		NULL	
select * from tt1;
FIND_IN_SET(1,'str,99 1,1,999')
3
drop table tt1;
create table tt1 as select FIND_IN_SET('',',') from dual;
desc tt1;
Field	Type	Null	Key	Default	Extra
FIND_IN_SET('',',')	bigint(20) unsigned	YES		NULL	
select * from tt1;
FIND_IN_SET('',',')
1
drop table tt1;
select FIND_IN_SET(NULL,'null') from dual;
FIND_IN_SET(NULL,'null')
NULL
select FIND_IN_SET(NULL,'str,null') from dual;
FIND_IN_SET(NULL,'str,null')
NULL
select FIND_IN_SET(1,'str,99 1,1,999') from dual;
FIND_IN_SET(1,'str,99 1,1,999')
3
select FIND_IN_SET('',',') from dual;
FIND_IN_SET('',',')
1
select FIND_IN_SET('','str,') from dual;
FIND_IN_SET('','str,')
2
select FIND_IN_SET('','str,,null,') from dual;
FIND_IN_SET('','str,,null,')
2
select FIND_IN_SET(' ','str') from dual;
FIND_IN_SET(' ','str')
0
select FIND_IN_SET(' ','str, ') from dual;
FIND_IN_SET(' ','str, ')
2
select FIND_IN_SET(' ','str, ,null') from dual;
FIND_IN_SET(' ','str, ,null')
2
select FIND_IN_SET(0,'0.123000000000000000000000000000,0');
FIND_IN_SET(0,'0.123000000000000000000000000000,0')
2
drop table t1;
create table t1(c1 set('中文字符','123456','ABCabc','!@#$%^&*','2020-10-10','2020-10-10 10:10:10','10:10:10'));
insert into t1 values('中文字符');
insert into t1 values('123456');
insert into t1 values('ABCabc');
insert into t1 values('!@#$%^&*');
insert into t1 values('2020-10-10');
insert into t1 values('2020-10-10 10:10:10');
insert into t1 values('10:10:10');
select FIND_IN_SET('中文字符',c1) from t1;
FIND_IN_SET('中文字符',c1)
1
0
0
0
0
0
0
select FIND_IN_SET('123456',c1) from t1;
FIND_IN_SET('123456',c1)
0
1
0
0
0
0
0
select FIND_IN_SET('',c1) from t1;
FIND_IN_SET('',c1)
0
0
0
0
0
0
0
SELECT * FROM t1 WHERE FIND_IN_SET('',c1)=1;
c1
drop table t1;
create table t1(c1 varchar(20));
insert into t1 values('中文字符');
insert into t1 values('123456');
insert into t1 values('ABCabc');
insert into t1 values('!@#$%^&*');
insert into t1 values('2020-10-10');
insert into t1 values('2020-10-10 10:10:10');
insert into t1 values('10:10:10');
insert into t1 values('');
SELECT * FROM t1 WHERE FIND_IN_SET(' ',c1) > -100;
c1
中文字符
123456
ABCabc
!@#$%^&*
2020-10-10
2020-10-10 10:10:10
10:10:10

select FIND_IN_SET('123456',c1) from t1;
FIND_IN_SET('123456',c1)
0
1
0
0
0
0
0
0
SELECT FIND_IN_SET(_GBK 'YOU are very good', _GBK'good ,very , are, you,YOUareverygood,YOU are very good');
FIND_IN_SET(_GBK 'YOU are very good', _GBK'good ,very , are, you,YOUareverygood,YOU are very good')
6
SELECT FIND_IN_SET(binary LOWER('??'),'我,y,-,10,??');
FIND_IN_SET(binary LOWER('??'),'我,y,-,10,??')
5
SELECT FIND_IN_SET(binary upper('y'),'我,y,-,10');
FIND_IN_SET(binary upper('y'),'我,y,-,10')
0
SELECT FIND_IN_SET(binary '我',binary '我,y,-,10');
FIND_IN_SET(binary '我',binary '我,y,-,10')
1
SELECT FIND_IN_SET(ASCII('A'),'ABS(-65),1,65');
FIND_IN_SET(ASCII('A'),'ABS(-65),1,65')
3
# Clean up users
drop user ljh@'%';
