result_format: 4
# 创建用户
drop database cwx_db;
drop database cwx_db1;
drop user cwx@'%';
drop user cwx1@'%';

# 创建测试用户
create database cwx_db;
use cwx_db;
create user cwx identified by 'cwx';
grant all privileges on *.* to cwx;

create database cwx_db1;
use cwx_db1;
create user 'cwx1' identified by 'cwx1';
grant all privileges on *.* to 'cwx1';
# 建立链接
##trigger-1-1-3，trigger-1-2，trigger-4，trigger-5,trigger-3
##创建（权限+注意点），删除触发器，显示触发器,使用触发器
set session autocommit=1;
##触发器创建
create table c1(t1 int);$
create table c2(t1 int);$
##使用 lock tables 
lock tables c1 read;$
##36093068，使用lock table，ob触发成功，mysql创建失败；预期结果：ob创建失败
create trigger cai_trig1 before insert on c1
for each row
insert into c2 values(3);
$
insert into c1 values(1);$
drop trigger cai_trig1;$
##同 36093068
create trigger cai_trig1 before update on c1
for each row
insert into c2 values(3);
$
update c1 set t1=2;$
drop trigger cai_trig1;$
##同 36093068
create trigger cai_trig1 before delete on c1
for each row
insert into c2 values(3);
$
delete from c1;$
drop trigger cai_trig1;$
##解锁后使用
unlock tables;$
delete from c1;$
delete from c2;$
create trigger cai_trig1 before insert on c1
for each row
insert into c2 values(3);
$
insert into c1 values(1);$
select * from c1 order by t1;$
+------+
| t1   |
+------+
|    1 |
+------+
select * from c2 order by t1;$
+------+
| t1   |
+------+
|    3 |
+------+
drop trigger cai_trig1;$
drop table c1;$
create table c1(t1 int primary key);$
##注意点
##trigger_time
##不符合条件时，使用before触发器将无法执行内部逻辑
delete from c1;$
delete from c2;$
create trigger cai_trig1 before insert on c1
for each row
insert into c2 values('aaa');
$
insert into c1 values(1);$
ERROR HY000: Incorrect integer value for column 't1' at row 1
select * from c1 order by t1;$
+----+
| t1 |
+----+
+----+
select * from c2 order by t1;$
+------+
| t1   |
+------+
+------+
drop trigger cai_trig1;$
delete from c1;$
delete from c2;$
create trigger cai_trig1 before insert on c1
for each row 
insert into c2 values(1);
$
insert into c1 values('aa');$
ERROR HY000: Incorrect integer value for column 't1' at row 1
select * from c1 order by t1;$
+----+
| t1 |
+----+
+----+
select * from c2 order by t1;$
+------+
| t1   |
+------+
+------+
drop trigger cai_trig1;$
##不符合条件时，使用after触发器
delete from c1;$
delete from c2;$
create trigger cai_trig1 after insert on c1
for each row
insert into c2 values('aaa');
$
insert into c1 values(1);$
ERROR HY000: Incorrect integer value for column 't1' at row 1
select * from c1 order by t1;$
+----+
| t1 |
+----+
+----+
select * from c2 order by t1;$
+------+
| t1   |
+------+
+------+
drop trigger cai_trig1;$
delete from c1;$
delete from c2;$
create trigger cai_trig1 after insert on c1
for each row
insert into c2 values(1);
$
insert into c1 values('aa');$
ERROR HY000: Incorrect integer value for column 't1' at row 1
select * from c1 order by t1;$
+----+
| t1 |
+----+
+----+
select * from c2 order by t1;$
+------+
| t1   |
+------+
+------+
drop trigger cai_trig1;$
##trigger_event 
##支持insert into table（激活方式：insert ，load data ，replace）
##由于mysqltest无法执行load data，故此验证点，暂不计入
drop table c1;$
drop table c2;$
create table c1(t1 int primary key);$
create table c2(t1 int);$
delete from c1;$
delete from c2;$
create trigger cai_trig1 before insert on c1
for each row
insert into c2 values(1);
$
insert into c1 values(1);$
insert into c1 select 4 from dual;$
insert into c1 set t1=7;$
##最新版本中ob失败，之前版本成功
replace into c1 values(5);$
##最新版本中ob失败，之前版本成功
insert into c1 values(2) on duplicate key update t1=t1+3;$
##--error 1227
##load data infile 'data_for_mysqltest_loaddata/data.dat' replace into table c1 fields terminated by ',';$
select * from c1 order by t1;$
+----+
| t1 |
+----+
|  1 |
|  2 |
|  4 |
|  5 |
|  7 |
+----+
select * from c2 order by t1;$
+------+
| t1   |
+------+
|    1 |
|    1 |
|    1 |
|    1 |
|    1 |
+------+
##使用其他语句触发失败
update c1 set t1=15 where t1=7;$
delete from c1;$
select * from c1 order by t1;$
+----+
| t1 |
+----+
+----+
select * from c2 order by t1;$
+------+
| t1   |
+------+
|    1 |
|    1 |
|    1 |
|    1 |
|    1 |
+------+
drop trigger cai_trig1;$
delete from c2;$
create trigger cai_trig1 after insert on c1
for each row
insert into c2 values(1);
$
##同 36103379
##--error 1227
##load data infile 'data_for_mysqltest_loaddata/data.dat' replace into table c1 fields terminated by ',';$
replace into c1 values(5);$
insert into c1 values(1);$
##最新版本中ob失败，之前版本成功
insert into c1 values(2) on duplicate key update t1=t1+3;$
insert into c1 select 4 from dual;$
insert into c1 set t1=7;$
select * from c1 order by t1;$
+----+
| t1 |
+----+
|  1 |
|  2 |
|  4 |
|  5 |
|  7 |
+----+
select * from c2 order by t1;$
+------+
| t1   |
+------+
|    1 |
|    1 |
|    1 |
|    1 |
|    1 |
+------+
##使用其他语句触发失败
update c1 set t1=14 where t1=7;$
delete from c1;$
select * from c1 order by t1;$
+----+
| t1 |
+----+
+----+
select * from c2 order by t1;$
+------+
| t1   |
+------+
|    1 |
|    1 |
|    1 |
|    1 |
|    1 |
+------+
drop trigger cai_trig1;$
delete from c1;$
delete from c2;$
create trigger cai_trig1 before insert on c1
for each row
insert into c2 values(1);
$
insert into c1 values(1);$
insert into c1 select 4 from dual;$
insert into c1 set t1=7;$
insert into c1 values(3);$
##最新版本中ob失败，之前版本成功
replace into c1 values(5);$
##最新版本中ob失败，之前版本成功
insert into c1 values(2) on duplicate key update t1=t1+3;$
select * from c1 order by t1;$
+----+
| t1 |
+----+
|  1 |
|  2 |
|  3 |
|  4 |
|  5 |
|  7 |
+----+
select * from c2 order by t1;$
+------+
| t1   |
+------+
|    1 |
|    1 |
|    1 |
|    1 |
|    1 |
|    1 |
+------+
##使用其他语句触发失败
update c1 set t1=15 where t1=7;$
delete from c1;$
select * from c1 order by t1;$
+----+
| t1 |
+----+
+----+
select * from c2 order by t1;$
+------+
| t1   |
+------+
|    1 |
|    1 |
|    1 |
|    1 |
|    1 |
|    1 |
+------+
drop trigger cai_trig1;$
delete from c2;$
create trigger cai_trig1 after insert on c1
for each row
insert into c2 values(1);
$
insert into c1 values(3);$
##最新版本中ob失败，之前版本成功
replace into c1 values(5);$
insert into c1 values(1);$
##最新版本中ob失败，之前版本成功
insert into c1 values(2) on duplicate key update t1=t1+3;$
insert into c1 select 4 from dual;$
insert into c1 set t1=7;$
select * from c1 order by t1;$
+----+
| t1 |
+----+
|  1 |
|  2 |
|  3 |
|  4 |
|  5 |
|  7 |
+----+
select * from c2 order by t1;$
+------+
| t1   |
+------+
|    1 |
|    1 |
|    1 |
|    1 |
|    1 |
|    1 |
+------+
##使用其他语句触发失败
update c1 set t1=14 where t1=7;$
delete from c1;$
select * from c1 order by t1;$
+----+
| t1 |
+----+
+----+
select * from c2 order by t1;$
+------+
| t1   |
+------+
|    1 |
|    1 |
|    1 |
|    1 |
|    1 |
|    1 |
+------+
drop trigger cai_trig1;$
##支持update table（激活方式：update，insert into on duplicate ）
delete from c2;$
insert into c1 values(2);$
create trigger cai_trig1 before update on c1
for each row
insert into c2 values(1);
$
##最新版本中ob失败，之前版本成功
insert into c1 values(2) on duplicate key update t1=t1+3;$
select * from c1 order by t1;$
+----+
| t1 |
+----+
|  5 |
+----+
select * from c2 order by t1;$
+------+
| t1   |
+------+
|    1 |
+------+
##使用其他语句触发失败
insert into c1 values(7);$
delete from c1;$
select * from c1 order by t1;$
+----+
| t1 |
+----+
+----+
select * from c2 order by t1;$
+------+
| t1   |
+------+
|    1 |
+------+
drop trigger cai_trig1;$
delete from c2;$
insert into c1 values(2);$
create trigger cai_trig1 after update on c1
for each row
insert into c2 values(1);
$
##最新版本中ob失败，之前版本成功
insert into c1 values(2) on duplicate key update t1=t1+3;$
select * from c1 order by t1;$
+----+
| t1 |
+----+
|  5 |
+----+
select * from c2 order by t1;$
+------+
| t1   |
+------+
|    1 |
+------+
##使用其他语句触发失败
insert into c1 values(7);$
delete from c1;$
select * from c1 order by t1;$
+----+
| t1 |
+----+
+----+
select * from c2 order by t1;$
+------+
| t1   |
+------+
|    1 |
+------+
drop trigger cai_trig1;$
##支持delete table（激活方式：delete，replace）
delete from c1;$
delete from c2;$
insert into c1 values(1);$
create trigger cai_trig1 before delete on c1
for each row
insert into c2 values(2);
$
##最新版本中ob失败，之前版本成功
replace into c1 values(1);$
select * from c1 order by t1;$
+----+
| t1 |
+----+
|  1 |
+----+
select * from c2 order by t1;$
+------+
| t1   |
+------+
|    2 |
+------+
##使用其他语句触发失败(insert,update,truncate)
insert into c1 values(7);$
update c1 set t1=8 where t1=7;$
update c1 set t1=8 where t1=10;$
##36105650，存在delete触发器，执行truncate table时，ob失败，mysql成功；预期结果：ob执行成功
##mysqltest端执行成功,obclient执行失败
truncate table c1;$
select * from c1 order by t1;$
+----+
| t1 |
+----+
+----+
select * from c2 order by t1;$
+------+
| t1   |
+------+
|    2 |
+------+
drop trigger cai_trig1;$
drop table c1;$
create table c1(t1 int primary key);$
delete from c2;$
insert into c1 values(1);$
create trigger cai_trig1 after delete on c1
for each row
insert into c2 values(2);
$
##最新版本中ob失败，之前版本成功
replace into c1 values(1);$
select * from c1 order by t1;$
+----+
| t1 |
+----+
|  1 |
+----+
select * from c2 order by t1;$
+------+
| t1   |
+------+
|    2 |
+------+
##使用其他语句触发失败(insert,update,drop)
insert into c1 values(7);$
update c1 set t1=9 where t1=7;$
drop table c1;$
select * from c1 order by t1;$
ERROR 42S02: Table 'cwx_db.c1' doesn't exist
select * from c2 order by t1;$
+------+
| t1   |
+------+
|    2 |
+------+
drop trigger cai_trig1;$
ERROR HY000: Trigger does not exist
##多个trigger_time  相同的触发器 + 触发时间及行为均相同的触发器
create table c3(t1 int);$
create table c4(t1 int);$
create trigger cai_trig before insert on c3
for each row
insert into c4 values(2);
$
create trigger cai_trig1 before update on c3
for each row
insert into c4 values(2);
$
create trigger cai_trig2 before delete on c3
for each row
insert into c4 values(2);
$
create trigger cai_trig3 after insert on c3
for each row
insert into c4 values(1);
$
create trigger cai_trig4 after update on c3
for each row
insert into c4 values(1);
$
create trigger cai_trig5 after delete on c3
for each row
insert into c4 values(1);
$
insert into c3 values(1);$
update c3 set t1=4;$
delete from c3;$
select * from c3 order by t1;$
+------+
| t1   |
+------+
+------+
select * from c4 order by t1;$
+------+
| t1   |
+------+
|    1 |
|    1 |
|    1 |
|    2 |
|    2 |
|    2 |
+------+
##触发时间+动作均相同的触发器
create trigger cai_trig6 before insert on c3
for each row
insert into c4 values(2);
$
drop trigger cai_trig;$
drop trigger cai_trig1;$
drop trigger cai_trig2;$
drop trigger cai_trig3;$
drop trigger cai_trig4;$
drop trigger cai_trig5;$
##不能使用 CALL 语句调用将数据返回给客户端或使用动态 SQL 的存储过程。 （允许存储过程通过 OUT 或 INOUT 参数将数据返回给触发器。）
##触发器中存在call调用
##存储过程中存在dml，ddl，动态sql
##36123693，存储过程中存在动态sql，触发器逻辑为call调用时，mysql触发失败，ob成功；预期结果：ob触发失败
create table c5(t1 int,t2 int,t3 int);$
delete from c4;$
delete from c5;$
drop procedure if exists cai_pro;$
create procedure cai_pro()
begin
set @sql='insert into c5 values (1,1,1)';
prepare stmt from @sql;
execute stmt;
deallocate prepare stmt;
end;
$
create trigger cai_trig before insert on c4
for each row
call cai_pro;
$
##目前执行为obclient端报错，mysqltest端执行成功
insert into c4 values(1);$
ERROR 0A000: Dynamic SQL is not allowed in stored function or trigger
select * from c4 order by t1;$
+------+
| t1   |
+------+
+------+
select * from c5 order by t1;$
+------+------+------+
| t1   | t2   | t3   |
+------+------+------+
+------+------+------+
drop trigger cai_trig;$
##36124187，存储过程中存在ddl，触发器逻辑为call调用时，mysql触发失败，ob创建失败；预期结果：ob触发失败
drop procedure if exists cai_pro;$
create procedure cai_pro()
begin
create table c6(t1 int);
end;
$
create trigger cai_trig before insert on c4
for each row
call cai_pro;
$
insert into c4 values(1);$
ERROR HY000: Explicit or implicit commit is not allowed in stored function or trigger.
select * from c6 order by t1;$
ERROR 42S02: Table 'cwx_db.c6' doesn't exist
drop trigger cai_trig;$
##procedure中存在out 参数，触发器逻辑为call pro
delete from c4;$
delete from c5;$
drop procedure if exists cai_pro;$
drop procedure if exists cai_pro1;$
create procedure cai_pro(in a int,inout b int)
begin
insert into c5 values(a,b,7);
end;
$
create procedure cai_pro1(in a int,out b int)
begin
set b =a+2;
insert into c5 values(a,b,7);
end;
$
create trigger cai_trig before insert on c4
for each row
begin
call cai_pro(1,2);
end;
$
Warnings:
Warning	5002	Resolve error
Warning	5884	TRIGGER 'cwx_db.cai_trig' compile error
##mysql行为：创建成功，触发失败，ob行为：创建存在warning，触发失败
insert into c4 values(1);$
ERROR 0A000: use T_INT type as out param not supported
drop trigger cai_trig;$
create trigger cai_trig before insert on c4
for each row
begin
declare a int;
call cai_pro(1,a);
insert into c5(t1) values(a);
end;
$
##目前执行为obclient端报错，mysqltest端执行成功
insert into c4 values(1);$
select * from c4 order by t1;$
+------+
| t1   |
+------+
|    1 |
+------+
select * from c5 order by t1;$
+------+------+------+
| t1   | t2   | t3   |
+------+------+------+
| NULL | NULL | NULL |
|    1 | NULL |    7 |
+------+------+------+
drop trigger cai_trig;$
create trigger cai_trig before insert on c4
for each row
begin
call cai_pro1(1,2);
end;
$
Warnings:
Warning	5002	Resolve error
Warning	5884	TRIGGER 'cwx_db.cai_trig' compile error
##mysql行为：创建成功，触发失败，ob行为：创建存在warning，触发失败
insert into c4 values(1);$
ERROR 0A000: use T_INT type as out param not supported
drop trigger cai_trig;$
delete from c4;$
delete from c5;$
create trigger cai_trig before insert on c4
for each row
begin
declare a int;
call cai_pro1(1,a);
insert into c5(t1) values(a);
end;
$
##目前执行为obclient端报错，mysqltest端执行成功
insert into c4 values(1);$
select * from c4 order by t1;$
+------+
| t1   |
+------+
|    1 |
+------+
select * from c5 order by t1;$
+------+------+------+
| t1   | t2   | t3   |
+------+------+------+
|    1 |    3 |    7 |
|    3 | NULL | NULL |
+------+------+------+
drop trigger cai_trig;$
##procedure 中存在 in参数+ dml + 其他语句
delete from c4;$
delete from c5;$
drop procedure if exists cai_pro;$
create procedure cai_pro(in a int)
begin
set @b=a+6;
insert into c5 values(a,a,a);
insert into c5 values(@b,@b,@b);
end;
$
create trigger cai_trig before insert on c4
for each row
begin
call cai_pro(2);
end;
$
##目前执行为obclient端报错，mysqltest端执行成功
insert into c4 values(1);$
select * from c4 order by t1;$
+------+
| t1   |
+------+
|    1 |
+------+
select * from c5 order by t1;$
+------+------+------+
| t1   | t2   | t3   |
+------+------+------+
|    2 |    2 |    2 |
|    8 |    8 |    8 |
+------+------+------+
drop trigger cai_trig;$
##触发器中存在嵌套procedure(mysql中不支持子程序嵌套子程序。以procedure为例)
create procedure cai_pro()
begin
begin
insert into c5 values(1,1,1);
end；
insert into c5 values(1,1,1);
end;
$
ERROR 42000: You have an error in your SQL syntax; check the manual that corresponds to your OceanBase version for the right syntax to use near 'insert' at line 6
##触发器中存在select调用
##function中存在dml，ddl，动态sql
delete from c4;$
delete from c5;$
drop function if exists cai_func;$
##function 中不可使用动态sql
create function cai_func() returns int
begin
set @sql='insert into c5 values (1,1,1)';
prepare stmt from @sql;
execute stmt;
deallocate prepare stmt;
return 1;
end;
$
ERROR 0A000: Dynamic SQL is not allowed in stored function or trigger
##function中不可使用ddl
drop function if exists cai_func;$
create function cai_func() returns int
begin
create table c6(t1 int);
return 1;
end;
$
ERROR HY000: Explicit or implicit commit is not allowed in stored function or trigger.
##function中不存在out 参数
delete from c4;$
delete from c5;$
drop function if exists cai_func;$
drop function if exists cai_func1;$
create function cai_func(out b int) returns int
begin
return 1;
end;
$
ERROR 42000: You have an error in your SQL syntax; check the manual that corresponds to your OceanBase version for the right syntax to use near 'out' at line 1
create function cai_func1(inout b int) returns int
begin
return 1;
end;
$
ERROR 42000: You have an error in your SQL syntax; check the manual that corresponds to your OceanBase version for the right syntax to use near 'inout' at line 1
##function 中存在 in参数+ dml + 其他语句
delete from c4;$
delete from c5;$
create table c6(t1 int,t2 int,t3 int);$
drop function if exists cai_func;$
create function cai_func(a int) returns int
begin
set @b=a+6;
insert into c5 values(a,a,a);
insert into c5 values(@b,@b,@b);
return 1;
end;
$
create trigger cai_trig before insert on c4
for each row
begin
insert into c6 select cai_func(2),cai_func(4),cai_func(6) from dual;
end;
$
insert into c4 values(1);$
select * from c4 order by t1;$
+------+
| t1   |
+------+
|    1 |
+------+
select * from c5 order by t1;$
+------+------+------+
| t1   | t2   | t3   |
+------+------+------+
|    2 |    2 |    2 |
|    4 |    4 |    4 |
|    6 |    6 |    6 |
|    8 |    8 |    8 |
|   10 |   10 |   10 |
|   12 |   12 |   12 |
+------+------+------+
select * from c6 order by t1;$
+------+------+------+
| t1   | t2   | t3   |
+------+------+------+
|    1 |    1 |    1 |
+------+------+------+
drop trigger cai_trig;$
##触发器中存在dml，ddl，动态sql
##同 36123693
delete from c4;$
delete from c5;$
create trigger cai_trig before insert on c4
for each row
begin
set @sql='insert into c5 values (1,1,1)';
prepare stmt from @sql;
execute stmt;
deallocate prepare stmt;
end;
$
ERROR 0A000: Dynamic SQL is not allowed in stored function or trigger
##触发器不能使用显式或隐式开始或结束事务的语句，例如 START TRANSACTION、COMMIT 或 ROLLBACK。 （回滚到 SAVEPOINT 是允许的，因为它不会结束事务。）。
##触发器存在 START TRANSACTION、COMMIT 、 ROLLBACK、SAVEPOINT 
delete from c4;$
delete from c5;$
###mysql: ERROR 1422 (HY000): Explicit or implicit commit is not allowed in stored function or trigger.
create trigger cai_trig before insert on c4
for each row
begin
start transaction;
insert into c5 values (1,1,1);
end;
$
ERROR HY000: Explicit or implicit commit is not allowed in stored function or trigger.
##36128024，触发器中存在事务相关语句，ob创建成功，mysql失败；预期结果：ob创建失败
insert into c4 values(1);$
select * from c4 order by t1;$
+------+
| t1   |
+------+
|    1 |
+------+
select * from c5 order by t1;$
+------+------+------+
| t1   | t2   | t3   |
+------+------+------+
+------+------+------+
delete from c4;$
delete from c5;$
create trigger cai_trig before insert on c4
for each row
begin
insert into c5 values (1,1,1);
commit;
end;
$
ERROR HY000: Explicit or implicit commit is not allowed in stored function or trigger.
insert into c4 values(1);$
create trigger cai_trig before insert on c4
for each row
begin
insert into c5 values (1,1,1);
rollback;
end;
$
ERROR HY000: Explicit or implicit commit is not allowed in stored function or trigger.
insert into c4 values(1);$
delete from c4;$
delete from c5;$
##同 36128024
create trigger cai_trig before insert on c4
for each row
begin
insert into c5 values (2,2,2);
savepoint p1;
insert into c5 values (1,1,1);
rollback to p1;
end;
$
insert into c4 values(1);$
select * from c4 order by t1;$
+------+
| t1   |
+------+
|    1 |
+------+
select * from c5 order by t1;$
+------+------+------+
| t1   | t2   | t3   |
+------+------+------+
|    2 |    2 |    2 |
+------+------+------+
drop trigger cai_trig;$
##仅当任何 BEFORE 触发器和行操作成功执行时，才会执行 AFTER 触发器。
##before触发器成功，after触发器失败
delete from c4;$
delete from c5;$
create trigger cai_trig before insert on c4
for each row
begin
insert into c5 values (2,2,2);
end;
$
create trigger cai_trig1 after insert on c4
for each row
begin
insert into c5 values ('a','b');
end;
$
##36128626，before 触发器可触发成功，after可触发失败；ob及mysql表内结果不一致；预期结果：ob结果同mysql
insert into c4 values(1);$
ERROR 21S01: Column count doesn't match value count at row 1
select * from c4 order by t1;$
+------+
| t1   |
+------+
+------+
select * from c5 order by t1;$
+------+------+------+
| t1   | t2   | t3   |
+------+------+------+
+------+------+------+
drop trigger cai_trig;$
drop trigger cai_trig1;$
##BEFORE 或 AFTER 触发器期间的错误会导致导致触发器调用的整个语句失败。
##before 、after 触发器中存在多条语句（多正一错）
delete from c4;$
delete from c5;$
create trigger cai_trig before insert on c4
for each row
begin
insert into c5 values (2,2,2);
insert into c5 values (2,2,2);
insert into c5 values (2,2,'a');
end;
$
##mysql行为：c5内有正确的数据；ob执行：c5内无数据，同手册描述；已和开发确认，此场景未符合预期
insert into c4 values(1);$
ERROR HY000: Incorrect integer value for column 't3' at row 1
select * from c4 order by t1;$
+------+
| t1   |
+------+
+------+
select * from c5 order by t1;$
+------+------+------+
| t1   | t2   | t3   |
+------+------+------+
+------+------+------+
drop trigger cai_trig;$
delete from c4;$
delete from c5;$
create trigger cai_trig after insert on c4
for each row
begin
insert into c5 values (2,2,2);
insert into c5 values (2,2,2);
insert into c5 values ('a','b');
end;
$
##同 before 行为，符合预期
insert into c4 values(1);$
ERROR 21S01: Column count doesn't match value count at row 1
select * from c4 order by t1;$
+------+
| t1   |
+------+
+------+
select * from c5 order by t1;$
+------+------+------+
| t1   | t2   | t3   |
+------+------+------+
+------+------+------+
drop trigger cai_trig;$
##对于事务表，语句失败应导致该语句执行的所有更改回滚。 触发器失败会导致语句失败，因此触发器失败也会导致回滚。 对于非事务性表，无法进行这种回滚，因此尽管语句失败，但在错误点之前执行的任何更改仍然有效。
create table c7(t1 int,t2 int);$
set session autocommit=0;$
start transaction;$
delete from c4;$
delete from c7;$
create trigger cai_trig before insert on c4
for each row
begin
insert into c7 values(1,1);
insert into c7 values(2,2);
insert into c7 values(3,3);
insert into c7 values(4,4);
end;
$
insert into c4 values('a');$
ERROR HY000: Incorrect integer value for column 't1' at row 1
insert into c4 values(1);$
rollback;$
select * from c4 order by t1;$
+------+
| t1   |
+------+
+------+
select * from c7 order by t1;$
+------+------+
| t1   | t2   |
+------+------+
+------+------+
drop trigger cai_trig;$
set session autocommit=1;$
start transaction;$
delete from c4;$
delete from c7;$
create trigger cai_trig before insert on c4
for each row
begin
insert into c7 values(1,1);
insert into c7 values(2,2);
end;
$
insert into c4 values('a');$
ERROR HY000: Incorrect integer value for column 't1' at row 1
insert into c4 values(1);$
rollback;$
select * from c4 order by t1;$
+------+
| t1   |
+------+
|    1 |
+------+
select * from c7 order by t1;$
+------+------+
| t1   | t2   |
+------+------+
|    1 |    1 |
|    2 |    2 |
+------+------+
drop trigger cai_trig;$
##级联外键操作不会激活触发器。
##目前ob创建相应表报错，无法验证后续行为
create table u1(id int not null,sex int);$
create table u2(id1 int not null,sex1 int,constraint u2con foreign key(sex1) references u1(id) on delete cascade on update cascade);$
ERROR HY000: Cannot add foreign key constraint
##drop trigger + show trigger
##语法
delete from c4;$
delete from c7;$
create trigger cai_trig before insert on c4
for each row
insert into c7 values(1,1);
$
select * from c4 order by t1;$
+------+
| t1   |
+------+
+------+
select * from c7 order by t1;$
+------+------+
| t1   | t2   |
+------+------+
+------+------+
##36150149，drop trigger 存在 if语法，ob失败，mysql成功；预期结果：ob删除失败
drop trigger if exists cai_trig;$
create trigger cai_trig before insert on c4
for each row
insert into c7 values(1,1);
$
##36434437,drop trigger 的 if语法为用户名.触发器名，ob失败，mysql成功;预期结果：ob删除成功
drop trigger if exists cwx.cai_trig;$
Warnings:
Note	1360	Trigger does not exist
##传入不存在用户名
drop trigger if exists cai_trig;$
create trigger cai_trig before insert on c4
for each row
insert into c7 values(1,1);
$
show triggers;$
Trigger	Event	Table	Statement	Timing	Created	sql_mode	Definer	character_set_client	collation_connection	Database Collation
cai_trig6	INSERT	c3	trigger cai_trig6 before insert on c3
for each row
insert into c4 values(2)	BEFORE	2022-11-16 11:16:22	STRICT_ALL_TABLES,NO_ZERO_IN_DATE,NO_AUTO_CREATE_USER	cwx@%	utf8mb4	utf8mb4_general_ci	utf8mb4_general_ci
cai_trig	INSERT	c4	trigger cai_trig before insert on c4
for each row
insert into c7 values(1,1)	BEFORE	2022-11-16 11:16:22	STRICT_ALL_TABLES,NO_ZERO_IN_DATE,NO_AUTO_CREATE_USER	cwx@%	utf8mb4	utf8mb4_general_ci	utf8mb4_general_ci
select * from INFORMATION_SCHEMA.TRIGGERS where trigger_schema = 'cwx_db';$
+-----------------+----------------+--------------+--------------------+----------------------+---------------------+--------------------+--------------+------------------+------------------------------------------------------------------------------+--------------------+---------------+----------------------------+----------------------------+--------------------------+--------------------------+------------------------+-------------------------------------------------------+---------+----------------------+----------------------+--------------------+
| TRIGGER_CATALOG | TRIGGER_SCHEMA | TRIGGER_NAME | EVENT_MANIPULATION | EVENT_OBJECT_CATALOG | EVENT_OBJECT_SCHEMA | EVENT_OBJECT_TABLE | ACTION_ORDER | ACTION_CONDITION | ACTION_STATEMENT                                                             | ACTION_ORIENTATION | ACTION_TIMING | ACTION_REFERENCE_OLD_TABLE | ACTION_REFERENCE_NEW_TABLE | ACTION_REFERENCE_OLD_ROW | ACTION_REFERENCE_NEW_ROW | CREATED                | SQL_MODE                                              | DEFINER | CHARACTER_SET_CLIENT | COLLATION_CONNECTION | DATABASE_COLLATION |
+-----------------+----------------+--------------+--------------------+----------------------+---------------------+--------------------+--------------+------------------+------------------------------------------------------------------------------+--------------------+---------------+----------------------------+----------------------------+--------------------------+--------------------------+------------------------+-------------------------------------------------------+---------+----------------------+----------------------+--------------------+
| def             | cwx_db         | cai_trig6    | INSERT             | def                  | cwx_db              | c3                 |            1 | NULL             | trigger cai_trig6 before insert on c3
for each row
insert into c4 values(2)  | ROW                | BEFORE        | NULL                       | NULL                       | OLD                      | NEW                      | 2022-11-16 11:16:22    | STRICT_ALL_TABLES,NO_ZERO_IN_DATE,NO_AUTO_CREATE_USER | cwx@%   | utf8mb4              | utf8mb4_general_ci   | utf8mb4_general_ci |
| def             | cwx_db         | cai_trig     | INSERT             | def                  | cwx_db              | c4                 |            1 | NULL             | trigger cai_trig before insert on c4
for each row
insert into c7 values(1,1) | ROW                | BEFORE        | NULL                       | NULL                       | OLD                      | NEW                      | 2022-11-16 11:16:22    | STRICT_ALL_TABLES,NO_ZERO_IN_DATE,NO_AUTO_CREATE_USER | cwx@%   | utf8mb4              | utf8mb4_general_ci   | utf8mb4_general_ci |
+-----------------+----------------+--------------+--------------------+----------------------+---------------------+--------------------+--------------+------------------+------------------------------------------------------------------------------+--------------------+---------------+----------------------------+----------------------------+--------------------------+--------------------------+------------------------+-------------------------------------------------------+---------+----------------------+----------------------+--------------------+
##同 36434437
drop trigger if exists cwx33.cai_trig;$
Warnings:
Note	1360	Trigger does not exist
##触发器删除后查询
drop trigger if exists cai_trig;$
show triggers;$
Trigger	Event	Table	Statement	Timing	Created	sql_mode	Definer	character_set_client	collation_connection	Database Collation
cai_trig6	INSERT	c3	trigger cai_trig6 before insert on c3
for each row
insert into c4 values(2)	BEFORE	2022-11-16 11:16:22	STRICT_ALL_TABLES,NO_ZERO_IN_DATE,NO_AUTO_CREATE_USER	cwx@%	utf8mb4	utf8mb4_general_ci	utf8mb4_general_ci
select * from INFORMATION_SCHEMA.TRIGGERS where trigger_schema = 'cwx_db';$
+-----------------+----------------+--------------+--------------------+----------------------+---------------------+--------------------+--------------+------------------+-----------------------------------------------------------------------------+--------------------+---------------+----------------------------+----------------------------+--------------------------+--------------------------+------------------------+-------------------------------------------------------+---------+----------------------+----------------------+--------------------+
| TRIGGER_CATALOG | TRIGGER_SCHEMA | TRIGGER_NAME | EVENT_MANIPULATION | EVENT_OBJECT_CATALOG | EVENT_OBJECT_SCHEMA | EVENT_OBJECT_TABLE | ACTION_ORDER | ACTION_CONDITION | ACTION_STATEMENT                                                            | ACTION_ORIENTATION | ACTION_TIMING | ACTION_REFERENCE_OLD_TABLE | ACTION_REFERENCE_NEW_TABLE | ACTION_REFERENCE_OLD_ROW | ACTION_REFERENCE_NEW_ROW | CREATED                | SQL_MODE                                              | DEFINER | CHARACTER_SET_CLIENT | COLLATION_CONNECTION | DATABASE_COLLATION |
+-----------------+----------------+--------------+--------------------+----------------------+---------------------+--------------------+--------------+------------------+-----------------------------------------------------------------------------+--------------------+---------------+----------------------------+----------------------------+--------------------------+--------------------------+------------------------+-------------------------------------------------------+---------+----------------------+----------------------+--------------------+
| def             | cwx_db         | cai_trig6    | INSERT             | def                  | cwx_db              | c3                 |            1 | NULL             | trigger cai_trig6 before insert on c3
for each row
insert into c4 values(2) | ROW                | BEFORE        | NULL                       | NULL                       | OLD                      | NEW                      | 2022-11-16 11:16:22    | STRICT_ALL_TABLES,NO_ZERO_IN_DATE,NO_AUTO_CREATE_USER | cwx@%   | utf8mb4              | utf8mb4_general_ci   | utf8mb4_general_ci |
+-----------------+----------------+--------------+--------------------+----------------------+---------------------+--------------------+--------------+------------------+-----------------------------------------------------------------------------+--------------------+---------------+----------------------------+----------------------------+--------------------------+--------------------------+------------------------+-------------------------------------------------------+---------+----------------------+----------------------+--------------------+
##删除基表，触发器也不存在
create trigger cai_trig before insert on c4
for each row
insert into c7 values(1,1);
$
drop table c4;$
##36151693，drop table,查看触发器信息，ob不同mysql；预期结果：ob结果同mysql
select * from INFORMATION_SCHEMA.TRIGGERS where trigger_schema = 'cwx_db';$
+-----------------+----------------+--------------+--------------------+----------------------+---------------------+--------------------+--------------+------------------+-----------------------------------------------------------------------------+--------------------+---------------+----------------------------+----------------------------+--------------------------+--------------------------+------------------------+-------------------------------------------------------+---------+----------------------+----------------------+--------------------+
| TRIGGER_CATALOG | TRIGGER_SCHEMA | TRIGGER_NAME | EVENT_MANIPULATION | EVENT_OBJECT_CATALOG | EVENT_OBJECT_SCHEMA | EVENT_OBJECT_TABLE | ACTION_ORDER | ACTION_CONDITION | ACTION_STATEMENT                                                            | ACTION_ORIENTATION | ACTION_TIMING | ACTION_REFERENCE_OLD_TABLE | ACTION_REFERENCE_NEW_TABLE | ACTION_REFERENCE_OLD_ROW | ACTION_REFERENCE_NEW_ROW | CREATED                | SQL_MODE                                              | DEFINER | CHARACTER_SET_CLIENT | COLLATION_CONNECTION | DATABASE_COLLATION |
+-----------------+----------------+--------------+--------------------+----------------------+---------------------+--------------------+--------------+------------------+-----------------------------------------------------------------------------+--------------------+---------------+----------------------------+----------------------------+--------------------------+--------------------------+------------------------+-------------------------------------------------------+---------+----------------------+----------------------+--------------------+
| def             | cwx_db         | cai_trig6    | INSERT             | def                  | cwx_db              | c3                 |            1 | NULL             | trigger cai_trig6 before insert on c3
for each row
insert into c4 values(2) | ROW                | BEFORE        | NULL                       | NULL                       | OLD                      | NEW                      | 2022-11-16 11:16:22    | STRICT_ALL_TABLES,NO_ZERO_IN_DATE,NO_AUTO_CREATE_USER | cwx@%   | utf8mb4              | utf8mb4_general_ci   | utf8mb4_general_ci |
+-----------------+----------------+--------------+--------------------+----------------------+---------------------+--------------------+--------------+------------------+-----------------------------------------------------------------------------+--------------------+---------------+----------------------------+----------------------------+--------------------------+--------------------------+------------------------+-------------------------------------------------------+---------+----------------------+----------------------+--------------------+
##use trigger
##INFORMATION_SCHEMA / performance_schema 作为基表
create table c8(t1 int);$
create trigger cai_trig before insert on INFORMATION_SCHEMA
for each row
insert into c8 values(1);
$
ERROR 42S02: Table 'cwx_db.INFORMATION_SCHEMA' doesn't exist
create trigger cai_trig before insert on performance_schema
for each row
insert into c8 values(1);
$
ERROR 42S02: Table 'cwx_db.performance_schema' doesn't exist
# 清理环境
drop database cwx_db;
drop database cwx_db1;
drop user cwx@'%';
Warnings:
Warning	4005	User 'cwx'@'%' is referenced as a definer account in a stored routine.
drop user cwx1@'%';
