result_format: 4
SET NAMES utf8mb4;
##根据外表来创建table，view##
create external table ex_t1 (
id NUMBER  as (metadata$filecol1),
name VARCHAR(50) as (metadata$filecol2),
mon FLOAT as (metadata$filecol3),
age VARCHAR(50) as (metadata$filecol4),
tel_number VARCHAR(50) as (metadata$filecol5),
bir DATE as (metadata$filecol6))
location='mysqltest_data_for_external_table'
format (
    type = 'csv'
	ENCODING = 'UTF8MB4'
	FIELD_DELIMITER = ','
	EMPTY_FIELD_AS_NULL = true
)
PATTERN = 'test06.csv';
##RENAME##
RENAME TABLE EX_t1 TO EX_T2;
RENAME TABLE EX_t2 TO EX_T1;
select ID,NAME,MON,AGE,TEL_NUMBER from ex_t1;
+------+------+---------+------+-------------+
| ID   | NAME | MON     | AGE  | TEL_NUMBER  |
+------+------+---------+------+-------------+
|    1 | wxm  |    3500 | 25   | 13000000000 |
|    2 | ldp  | 3000.01 | 30   | 13000000001 |
|    3 | zhx  | 6000.05 | 28   | 13000000002 |
| NULL | NULL |    NULL | NULL | NULL        |
|    4 | zff  | 4500.12 | 35   | 13000000003 |
|    5 | dyl  |   -4000 | 40   | 13000000004 |
+------+------+---------+------+-------------+
CREATE TABLE T1 AS SELECT ID,NAME,MON FROM EX_T1;
SELECT * FROM T1;
+------+------+---------+
| ID   | NAME | MON     |
+------+------+---------+
|    1 | wxm  |    3500 |
|    2 | ldp  | 3000.01 |
|    3 | zhx  | 6000.05 |
| NULL | NULL |    NULL |
|    4 | zff  | 4500.12 |
|    5 | dyl  |   -4000 |
+------+------+---------+
CREATE VIEW EX_V1 AS SELECT ID,NAME,TEL_NUMBER FROM EX_T1;
SELECT * FROM EX_V1;
+------+------+-------------+
| ID   | NAME | TEL_NUMBER  |
+------+------+-------------+
|    1 | wxm  | 13000000000 |
|    2 | ldp  | 13000000001 |
|    3 | zhx  | 13000000002 |
| NULL | NULL | NULL        |
|    4 | zff  | 13000000003 |
|    5 | dyl  | 13000000004 |
+------+------+-------------+
##对table进行dml，预期不影响外表##
INSERT INTO T1 VALUES (6,'TEST',6666);
SELECT * FROM T1;
+------+------+---------+
| ID   | NAME | MON     |
+------+------+---------+
|    1 | wxm  |    3500 |
|    2 | ldp  | 3000.01 |
|    3 | zhx  | 6000.05 |
| NULL | NULL |    NULL |
|    4 | zff  | 4500.12 |
|    5 | dyl  |   -4000 |
|    6 | TEST |    6666 |
+------+------+---------+
UPDATE T1 SET MON = 0 WHERE ID = 6;
SELECT * FROM T1;
+------+------+---------+
| ID   | NAME | MON     |
+------+------+---------+
|    1 | wxm  |    3500 |
|    2 | ldp  | 3000.01 |
|    3 | zhx  | 6000.05 |
| NULL | NULL |    NULL |
|    4 | zff  | 4500.12 |
|    5 | dyl  |   -4000 |
|    6 | TEST |       0 |
+------+------+---------+
DELETE FROM T1 ;
SELECT * FROM T1;
+------+------+------+
| ID   | NAME | MON  |
+------+------+------+
+------+------+------+
##已修复##
##--error 600
##对view进行dml，预期无法进行##
INSERT INTO EX_V1 VALUES (6,'TEST',133);
ERROR HY000: The value specified for generated column 'ID' in table 'ex_v1' is not allowed
update EX_V1 set tel_number = 133 where id = 1;
ERROR HY000: The value specified for generated column 'TEL_NUMBER' in table 'ex_v1' is not allowed
DELETE FROM EX_V1;
ERROR 0A000: DML operation on External Table not supported
SELECT * FROM EX_V1;
+------+------+-------------+
| ID   | NAME | TEL_NUMBER  |
+------+------+-------------+
|    1 | wxm  | 13000000000 |
|    2 | ldp  | 13000000001 |
|    3 | zhx  | 13000000002 |
| NULL | NULL | NULL        |
|    4 | zff  | 13000000003 |
|    5 | dyl  | 13000000004 |
+------+------+-------------+
DROP TABLE IF EXISTS T1;
DROP VIEW IF EXISTS EX_V1;
drop table IF EXISTS ex_t1;
##外表分区##
##本期不支持##
CREATE EXTERNAL TABLE EX_T1(
ID CHAR(10) AS (METADATA$FILECOL1),
NAME VARCHAR(10) AS (METADATA$FILECOL2),
MON CHAR(10) AS (METADATA$FILECOL3),
AGE CHAR(10) AS (METADATA$FILECOL4),
PHONE VARCHAR(15) AS (METADATA$FILECOL5)
)
LOCATION='mysqltest_data_for_external_table'
FORMAT (
	TYPE = 'CSV'
	ENCODING = 'UTF8MB4'
	FIELD_DELIMITER = ','
	FIELD_OPTIONALLY_ENCLOSED_BY = char(34)
	SKIP_HEADER = 1
	EMPTY_FIELD_AS_NULL = true
)
PATTERN = 'test0[3-5].csv';
CREATE TABLE P_T1 PARTITION BY KEY(ID) PARTITIONS 3 AS SELECT * FROM EX_T1;
SELECT * FROM P_T1 PARTITION(P0);
+------+-----------+----------+------+-------------+
| ID   | NAME      | MON      | AGE  | PHONE       |
+------+-----------+----------+------+-------------+
| 3    | 张红霞    | 6000     | 28   | 13000000002 |
| 4    | 赵芳芳    | 4500     | 35   | 13000000003 |
| 3    | 张红霞    | 6000.05  | 28   | 13000000002 |
| 4    | 赵芳芳    | 4500.123 | 35   | 13000000003 |
| 3    | zhx       | 6000.05  | 28   | 13000000002 |
| 4    | zff       | 4500.123 | 35   | 13000000003 |
+------+-----------+----------+------+-------------+
SELECT * FROM P_T1 PARTITION(P1);
+------+-----------+-------+------+-------------+
| ID   | NAME      | MON   | AGE  | PHONE       |
+------+-----------+-------+------+-------------+
| 5    | 邓玉林    | 4000  | 40   | 13000000004 |
| 5    | 邓玉林    | -4000 | 40   | 13000000004 |
| 5    | dyl       | -4000 | 40   | 13000000004 |
+------+-----------+-------+------+-------------+
SELECT * FROM P_T1 PARTITION(P2);
+------+-----------+---------+------+-------------+
| ID   | NAME      | MON     | AGE  | PHONE       |
+------+-----------+---------+------+-------------+
| 1    | 王小明    | 3500    | 25   | 13000000000 |
| 2    | 李大鹏    | 3000    | 30   | 13000000001 |
| NULL | NULL      | NULL    | NULL | NULL        |
| 1    | 王小明    | 3500.00 | 25   | 13000000000 |
| 2    | 李大鹏    | 3000.01 | 30   | 13000000001 |
| NULL | NULL      | NULL    | NULL | NULL        |
| 1    | wxm       | 3500.00 | 25   | 13000000000 |
| 2    | ldp       | 3000.01 | 30   | 13000000001 |
| NULL | NULL      | NULL    | NULL | NULL        |
+------+-----------+---------+------+-------------+
DROP TABLE EX_T1;
DROP TABLE P_T1;
##INDEX,约束##
##预期不支持##
create external table ex_t1 (
id NUMBER  as (metadata$filecol1))
location='mysqltest_data_for_external_table'
format (
    type = 'csv'
	ENCODING = 'UTF8MB4'
	FIELD_DELIMITER = ','
)
PATTERN = 'test06.csv';
CREATE INDEX IN_A ON EX_T1(ID);
ERROR 0A000: operation on external table not supported
DROP TABLE EX_T1;
create external table ex_t1 (
id NUMBER  as (metadata$filecol1) PRIMARY KEY)
location='mysqltest_data_for_external_table'
format (
    type = 'csv'
	ENCODING = 'UTF8MB4'
	FIELD_DELIMITER = ','
)
PATTERN = 'test06.csv';
ERROR 0A000: Primary key constraint on external table columns not supported
create external table ex_t1 (
id NUMBER  as (metadata$filecol1) not null)
location='mysqltest_data_for_external_table'
format (
    type = 'csv'
	ENCODING = 'UTF8MB4'
	FIELD_DELIMITER = ','
)
PATTERN = 'test06.csv';
ERROR 0A000: Null constraint on external table columns not supported
create external table ex_t1 (
id NUMBER  as (metadata$filecol1) UNIQUE)
location='mysqltest_data_for_external_table'
format (
    type = 'csv'
	ENCODING = 'UTF8MB4'
	FIELD_DELIMITER = ','
)
PATTERN = 'test06.csv';
ERROR 0A000: Unique constraint on external table columns not supported
create external table ex_t1 (
id CHAR (10) default '0',
name CHAR (10),
mon CHAR (10),
age CHAR (10),
tel_number varCHAR (50)
)
location='mysqltest_data_for_external_table'
format (
    type = 'csv'
	LINE_DELIMITER = char(10)
)
PATTERN = 'test.csv'
;
ERROR 0A000: DEFAULT constraint on external table columns not supported
create external table ex_t1 (
id CHAR (10) ,
name CHAR (10),
mon CHAR (10),
age number check (age > 0),
tel_number varCHAR (50)
)
location='mysqltest_data_for_external_table'
format (
    type = 'csv'
	LINE_DELIMITER = char(10)
)
PATTERN = 'test.csv'
;
ERROR 0A000: Check constraint on external table columns not supported
create table t1 (a int primary key);
create external table ex_t1 (
id CHAR (10) ,
name CHAR (10),
mon CHAR (10),
age CHAR(10),
tel_number varCHAR (50),
FOREIGN KEY(id) REFERENCES T1(A)
)
location='mysqltest_data_for_external_table'
format (
    type = 'csv'
	LINE_DELIMITER = char(10)
)
PATTERN = 'test.csv'
;
ERROR 0A000: operation on external table not supported
create external table ex_t1 (
id NUMBER  as (metadata$filecol1),
name VARCHAR(50) as (metadata$filecol2),
mon FLOAT as (metadata$filecol3),
age VARCHAR(50) as (metadata$filecol4),
tel_number VARCHAR(50) as (metadata$filecol5),
bir DATE as (metadata$filecol6),
CONSTRAINT EX_PK PRIMARY KEY (ID),
CONSTRAINT EX_UN UNIQUE (TEL_NUMBER),
CONSTRAINT EX_FOR FOREIGN KEY (ID) REFERENCES T1(A),
CONSTRAINT EX_CHK CHECK (AGE > 0)
)
location='mysqltest_data_for_external_table'
format (
    type = 'csv'
	ENCODING = 'UTF8MB4'
	FIELD_DELIMITER = ','
)
PATTERN = 'test06.csv';
ERROR 0A000: Primary key constraint on external table not supported
DROP TABLE T1;
DROP VIEW EX_V1;
drop table ex_t1;
##COMMENT##
create external table ex_t1 (
id NUMBER  as (metadata$filecol1),
name VARCHAR(50) as (metadata$filecol2),
mon FLOAT as (metadata$filecol3),
age VARCHAR(50) as (metadata$filecol4),
tel_number VARCHAR(50) as (metadata$filecol5),
bir DATE as (metadata$filecol6)
)COMMENT 'ENTERNAL TABLE'
location='mysqltest_data_for_external_table'
format (
    type = 'csv'
	ENCODING = 'UTF8MB4'
	FIELD_DELIMITER = ','
)
PATTERN = 'test06.csv';
##--error 600
DROP TABLE EX_T1;
create external table ex_t1 (
id NUMBER  as (metadata$filecol1) COMMENT 'ID',
name VARCHAR(50) as (metadata$filecol2),
mon FLOAT as (metadata$filecol3),
age VARCHAR(50) as (metadata$filecol4),
tel_number VARCHAR(50) as (metadata$filecol5)
)
location='mysqltest_data_for_external_table'
format (
    type = 'csv'
	ENCODING = 'UTF8MB4'
	FIELD_DELIMITER = ','
	EMPTY_FIELD_AS_NULL = true
)
PATTERN = 'test06.csv';
CREATE INDEX my_index ON ex_t1 (name) COMMENT 'This is my index';
ERROR 0A000: operation on external table not supported
DROP TABLE EX_T1;
####ALTER####
##目前仅支持refresh##
create external table ex_t1 (
id NUMBER  as (metadata$filecol1),
name VARCHAR(50) as (metadata$filecol2),
mon FLOAT as (metadata$filecol3),
age VARCHAR(50) as (metadata$filecol4),
tel_number VARCHAR(50) as (metadata$filecol5),
bir DATE as (metadata$filecol6)
)
location='mysqltest_data_for_external_table'
format (
    type = 'csv'
	ENCODING = 'UTF8MB4'
	FIELD_DELIMITER = ','
	EMPTY_FIELD_AS_NULL = true
)
PATTERN = 'test06.csv';
ALTER TABLE EX_T1 ADD SEX VARCHAR(10);
ERROR 0A000: alter table type not supported
ALTER TABLE EX_T1 DROP NAME;
ERROR 0A000: alter table type not supported
ALTER TABLE EX_T1 RENAME EX_T2;
ERROR 0A000: alter table type not supported
ALTER EXTERNAL TABLE EX_T1 ADD SEX VARCHAR(10);
ERROR 0A000: alter external table option is not supported
ALTER EXTERNAL TABLE EX_T1 REFRESH;
DROP TABLE EX_T1;
DROP TABLE T1;
DROP TABLE T2;
####INSERT,UPDATE,MERGE,DELETE####
##预期不支持##
create external table ex_t1 (
id NUMBER  as (metadata$filecol1),
name VARCHAR(50) as (metadata$filecol2),
mon FLOAT as (metadata$filecol3),
age VARCHAR(50) as (metadata$filecol4),
tel_number VARCHAR(50) as (metadata$filecol5),
bir DATE as (metadata$filecol6)
)
location='mysqltest_data_for_external_table'
format (
    type = 'csv'
	ENCODING = 'UTF8MB4'
	FIELD_DELIMITER = ','
	EMPTY_FIELD_AS_NULL = true
)
PATTERN = 'test06.csv';
CREATE TABLE T1 AS SELECT ID,NAME,MON,AGE,TEL_NUMBER FROM EX_T1;
CREATE TABLE T2 AS SELECT ID,NAME,MON,AGE,TEL_NUMBER FROM EX_T1;
DELETE FROM T2;
##直接insert##
INSERT INTO EX_T1 VALUES(6,NULL,NULL,NULL,NULL,NULL);
ERROR 0A000: insert into external table with values, replace, ignore, returning, update not supported
INSERT IGNORE INTO EX_T1 VALUES(6,NULL,NULL,NULL,NULL,NULL);
ERROR 0A000: insert into external table with values, replace, ignore, returning, update not supported
##子查询insert##
INSERT INTO EX_T1(NAME) SELECT NAME FROM EX_T1;
ERROR 0A000: insert into external table which is not in odps not supported
INSERT INTO EX_T1 SELECT ID,NAME,MON,AGE,TEL_NUMBER,BIR FROM EX_T1;
ERROR 0A000: insert into external table which is not in odps not supported
INSERT INTO T1 SELECT ID,NAME,MON,AGE,TEL_NUMBER FROM EX_T1;
##replace##
REPLACE INTO EX_T1 VALUES (NULL,NULL,NULL,NULL,NULL,NULL);
ERROR 0A000: insert into external table with values, replace, ignore, returning, update not supported
REPLACE INTO T2 SELECT ID,NAME,MON,AGE,TEL_NUMBER FROM EX_T1;
SELECT * FROM T2;
+------+------+---------+------+-------------+
| ID   | NAME | MON     | AGE  | TEL_NUMBER  |
+------+------+---------+------+-------------+
|    1 | wxm  |    3500 | 25   | 13000000000 |
|    2 | ldp  | 3000.01 | 30   | 13000000001 |
|    3 | zhx  | 6000.05 | 28   | 13000000002 |
| NULL | NULL |    NULL | NULL | NULL        |
|    4 | zff  | 4500.12 | 35   | 13000000003 |
|    5 | dyl  |   -4000 | 40   | 13000000004 |
+------+------+---------+------+-------------+
##直接update##
UPDATE EX_T1 SET ID = 6 WHERE EX_T1.BIR IS NULL;
ERROR HY000: The value specified for generated column 'id' in table 'ex_t1' is not allowed
##子查询UPDATE##
UPDATE EX_T1 SET ID = 6 WHERE NAME IN (SELECT NAME FROM EX_T1 WHERE ID IS NULL);
ERROR HY000: The value specified for generated column 'id' in table 'ex_t1' is not allowed
UPDATE T1,EX_T1 SET T1.ID = 100, EX_T1.ID = 200 WHERE T1.NAME = EX_T1.NAME;
ERROR HY000: The value specified for generated column 'id' in table 'ex_t1' is not allowed
UPDATE T1 SET ID = 6 WHERE NAME IN (SELECT NAME FROM EX_T1 WHERE ID IS NULL);
##直接delete##
DELETE FROM EX_T1;
ERROR 0A000: DML operation on External Table not supported
##子查询delete##
DELETE FROM EX_T1 WHERE ID IN (SELECT ID FROM T1 WHERE NAME IS NULL);
ERROR 0A000: DML operation on External Table not supported
DELETE FROM T1 WHERE ID IN (SELECT ID FROM EX_T1 WHERE NAME IS NOT NULL);
##TRUNCATE##
TRUNCATE EX_T1;
ERROR 0A000: Not supported feature or function
##lock table##
##语句可以执行，但不生效##
LOCK TABLES ex_t1 as t1 WRITE;
DROP TABLE T1;
DROP TABLE T2;
DROP VIEW EX_V1;
##CREATE TABLE LIKE##
##外表不是base table，无法作为like依赖##
create table t1 like ex_t1;
ERROR HY000: 'test.ex_t1' is not BASE TABLE
####table_option####
##CHARSET&COLLATE##
DROP TABLE EX_T1;
create external table ex_t1 (
id NUMBER  as (metadata$filecol1),
name VARCHAR(50) as (metadata$filecol2),
mon FLOAT as (metadata$filecol3),
age VARCHAR(50) as (metadata$filecol4),
tel_number VARCHAR(50) as (metadata$filecol5),
bir DATE as (metadata$filecol6))
CHARSET = gb18030
location='mysqltest_data_for_external_table'
format (
    type = 'csv'
	ENCODING = 'UTF8MB4'
	FIELD_DELIMITER = ','
	FIELD_OPTIONALLY_ENCLOSED_BY = char(34)
	EMPTY_FIELD_AS_NULL = true
)
PATTERN = 'test04.csv';
select * from ex_t1;
+------+-----------+---------+------+-------------+------------+
| id   | name      | mon     | age  | tel_number  | bir        |
+------+-----------+---------+------+-------------+------------+
| NULL | NULL      |    NULL | NULL | NULL        | NULL       |
|    1 | 王小明    |    3500 | 25   | 13000000000 | 1990-01-01 |
|    2 | 李大鹏    | 3000.01 | 30   | 13000000001 | 1991-02-02 |
|    3 | 张红霞    | 6000.05 | 28   | 13000000002 | 1992-03-03 |
| NULL | NULL      |    NULL | NULL | NULL        | NULL       |
|    4 | 赵芳芳    | 4500.12 | 35   | 13000000003 | 1993-04-04 |
|    5 | 邓玉林    |   -4000 | 40   | 13000000004 | 1994-05-05 |
+------+-----------+---------+------+-------------+------------+
DROP TABLE EX_T1;
create external table ex_t1 (
id NUMBER  as (metadata$filecol1),
name VARCHAR(50) as (metadata$filecol2),
mon FLOAT as (metadata$filecol3),
age VARCHAR(50) as (metadata$filecol4),
tel_number VARCHAR(50) as (metadata$filecol5),
bir DATE as (metadata$filecol6))
CHARSET = gbk
COLLATE = gbk_bin
location='mysqltest_data_for_external_table'
format (
    type = 'csv'
	ENCODING = 'UTF8MB4'
	FIELD_DELIMITER = ','
	FIELD_OPTIONALLY_ENCLOSED_BY = char(34)
	EMPTY_FIELD_AS_NULL = true
)
PATTERN = 'test04.csv';
select * from ex_t1;
+------+-----------+---------+------+-------------+------------+
| id   | name      | mon     | age  | tel_number  | bir        |
+------+-----------+---------+------+-------------+------------+
| NULL | NULL      |    NULL | NULL | NULL        | NULL       |
|    1 | 王小明    |    3500 | 25   | 13000000000 | 1990-01-01 |
|    2 | 李大鹏    | 3000.01 | 30   | 13000000001 | 1991-02-02 |
|    3 | 张红霞    | 6000.05 | 28   | 13000000002 | 1992-03-03 |
| NULL | NULL      |    NULL | NULL | NULL        | NULL       |
|    4 | 赵芳芳    | 4500.12 | 35   | 13000000003 | 1993-04-04 |
|    5 | 邓玉林    |   -4000 | 40   | 13000000004 | 1994-05-05 |
+------+-----------+---------+------+-------------+------------+
##TABLE GROUP##
##不支持##
DROP TABLE EX_T1;
drop tablegroup EX_TG;
create tablegroup EX_TG;
create external table ex_t1 (
id NUMBER  as (metadata$filecol1),
name VARCHAR(50) as (metadata$filecol2),
mon FLOAT as (metadata$filecol3),
age CHAR(10) as (metadata$filecol4),
tel_number VARCHAR(50) as (metadata$filecol5),
bir DATE as (metadata$filecol6)
)

location='mysqltest_data_for_external_table'
format (
    type = 'csv'
	FIELD_DELIMITER = ','
	FIELD_OPTIONALLY_ENCLOSED_BY = char(34)
	ENCODING = 'UTF8MB4'
)
PATTERN = 'test05.csv'
tablegroup = EX_TG;
ERROR 0A000: Specifying tablegroup on external table not supported
##block_size##
DROP TABLE EX_T1;
create external table ex_t1 (
id NUMBER  as (metadata$filecol1),
name VARCHAR(50) as (metadata$filecol2),
mon FLOAT as (metadata$filecol3),
age VARCHAR(50) as (metadata$filecol4),
tel_number VARCHAR(50) as (metadata$filecol5),
bir DATE as (metadata$filecol6))
BLOCK_SIZE = 1024
location='mysqltest_data_for_external_table'
format (
    type = 'csv'
	ENCODING = 'UTF8MB4'
	FIELD_DELIMITER = ','
	FIELD_OPTIONALLY_ENCLOSED_BY = char(34)
	EMPTY_FIELD_AS_NULL = true
)
PATTERN = 'test04.csv';
select * from ex_t1;
+------+-----------+---------+------+-------------+------------+
| id   | name      | mon     | age  | tel_number  | bir        |
+------+-----------+---------+------+-------------+------------+
| NULL | NULL      |    NULL | NULL | NULL        | NULL       |
|    1 | 王小明    |    3500 | 25   | 13000000000 | 1990-01-01 |
|    2 | 李大鹏    | 3000.01 | 30   | 13000000001 | 1991-02-02 |
|    3 | 张红霞    | 6000.05 | 28   | 13000000002 | 1992-03-03 |
| NULL | NULL      |    NULL | NULL | NULL        | NULL       |
|    4 | 赵芳芳    | 4500.12 | 35   | 13000000003 | 1993-04-04 |
|    5 | 邓玉林    |   -4000 | 40   | 13000000004 | 1994-05-05 |
+------+-----------+---------+------+-------------+------------+
##COMPRESSION##
##row_format##
##PCTFREE##
DROP TABLE EX_T1;
create external table ex_t1 (
id NUMBER  as (metadata$filecol1),
name VARCHAR(50) as (metadata$filecol2),
mon FLOAT as (metadata$filecol3),
age VARCHAR(50) as (metadata$filecol4),
tel_number VARCHAR(50) as (metadata$filecol5),
bir DATE as (metadata$filecol6))
COMPRESSION 'zstd_1.0'
ROW_FORMAT DYNAMIC
PCTFREE 5
location='mysqltest_data_for_external_table'
format (
    type = 'csv'
	ENCODING = 'UTF8MB4'
	FIELD_DELIMITER = ','
	FIELD_OPTIONALLY_ENCLOSED_BY = char(34)
	EMPTY_FIELD_AS_NULL = true
)
PATTERN = 'test04.csv';
select * from ex_t1;
+------+-----------+---------+------+-------------+------------+
| id   | name      | mon     | age  | tel_number  | bir        |
+------+-----------+---------+------+-------------+------------+
| NULL | NULL      |    NULL | NULL | NULL        | NULL       |
|    1 | 王小明    |    3500 | 25   | 13000000000 | 1990-01-01 |
|    2 | 李大鹏    | 3000.01 | 30   | 13000000001 | 1991-02-02 |
|    3 | 张红霞    | 6000.05 | 28   | 13000000002 | 1992-03-03 |
| NULL | NULL      |    NULL | NULL | NULL        | NULL       |
|    4 | 赵芳芳    | 4500.12 | 35   | 13000000003 | 1993-04-04 |
|    5 | 邓玉林    |   -4000 | 40   | 13000000004 | 1994-05-05 |
+------+-----------+---------+------+-------------+------------+
SHOW CREATE TABLE EX_T1;
Table	Create Table
ex_t1	CREATE EXTERNAL TABLE `ex_t1` (
  `id` decimal(10,0) GENERATED ALWAYS AS (metadata$filecol1),
  `name` varchar(50) GENERATED ALWAYS AS (metadata$filecol2),
  `mon` float GENERATED ALWAYS AS (metadata$filecol3),
  `age` varchar(50) GENERATED ALWAYS AS (metadata$filecol4),
  `tel_number` varchar(50) GENERATED ALWAYS AS (metadata$filecol5),
  `bir` date GENERATED ALWAYS AS (metadata$filecol6)
) 
LOCATION='file://mysqltest_data_for_external_table'
PATTERN='test04.csv'
AUTO_REFRESH = OFF
FORMAT (
  TYPE = 'CSV',
  FIELD_DELIMITER = ',',
  FIELD_OPTIONALLY_ENCLOSED_BY = char(34),
  ENCODING = 'utf8mb4',
  EMPTY_FIELD_AS_NULL = TRUE
) DEFAULT CHARSET = utf8mb4
##AUTO_INCREMENT##
##报语法错（如果不指定自增列可以创建成功）##
DROP TABLE EX_T1;
create external table ex_t1 (
id NUMBER AUTO_INCREMENT,
name VARCHAR(50) ,
mon FLOAT ,
age VARCHAR(50) ,
tel_number VARCHAR(50) ,
bir DATE )
location='mysqltest_data_for_external_table'
format (
    type = 'csv'
	ENCODING = 'UTF8MB4'
	FIELD_DELIMITER = ','
	FIELD_OPTIONALLY_ENCLOSED_BY = char(34)
	EMPTY_FIELD_AS_NULL = true
)
PATTERN = 'test04.csv'
AUTO_INCREMENT = 1
;
ERROR 42000: You have an error in your SQL syntax; check the manual that corresponds to your OceanBase version for the right syntax to use
##DUPLICATE_SCOPE##
##不支持##
DROP TABLE EX_T1;
create external table ex_t1 (
id NUMBER AUTO_INCREMENT,
name VARCHAR(50) ,
mon FLOAT ,
age VARCHAR(50) ,
tel_number VARCHAR(50) ,
bir DATE )
DUPLICATE_SCOPE = "none"
location='mysqltest_data_for_external_table'
format (
    type = 'csv'
	ENCODING = 'UTF8MB4'
	FIELD_DELIMITER = ','
	FIELD_OPTIONALLY_ENCLOSED_BY = char(34)
	EMPTY_FIELD_AS_NULL = true
)
PATTERN = 'test04.csv'
;
ERROR 42000: You have an error in your SQL syntax; check the manual that corresponds to your OceanBase version for the right syntax to use
##parallel_clause##
##语法错##
DROP TABLE EX_T1;
create external table ex_t1 (
id NUMBER AUTO_INCREMENT,
name VARCHAR(50) ,
mon FLOAT ,
age VARCHAR(50) ,
tel_number VARCHAR(50) ,
bir DATE )
PARALLEL 1
location='mysqltest_data_for_external_table'
format (
    type = 'csv'
	ENCODING = 'UTF8MB4'
	FIELD_DELIMITER = ','
	FIELD_OPTIONALLY_ENCLOSED_BY = char(34)
	EMPTY_FIELD_AS_NULL = true
)
PATTERN = 'test04.csv'
;
ERROR 42000: You have an error in your SQL syntax; check the manual that corresponds to your OceanBase version for the right syntax to use
##VIRTUAL生成列##
##不支持##
DROP TABLE EX_T1;
create external table ex_t1 (
id NUMBER  as (metadata$filecol1) VIRTUAL,
name VARCHAR(50) as (metadata$filecol2) VIRTUAL,
mon FLOAT as (metadata$filecol3) VIRTUAL,
age VARCHAR(50) as (metadata$filecol4) VIRTUAL,
tel_number VARCHAR(50) as (metadata$filecol5) VIRTUAL,
bir DATE as (metadata$filecol6))
location='mysqltest_data_for_external_table'
format (
    type = 'csv'
	ENCODING = 'UTF8MB4'
	FIELD_DELIMITER = ','
	FIELD_OPTIONALLY_ENCLOSED_BY = char(34)
	EMPTY_FIELD_AS_NULL = true
)
PATTERN = 'test04.csv';
ERROR 0A000: virtual column not supported
DROP TABLE EX_T1;
DROP TABLE T1;
DROP TABLE T2;
DROP VIEW EX_V1;
