drop user zwc cascade;
create user zwc identified by zwc;
grant all on *.* to zwc with grant option;
grant dba to zwc;
#设置超时等待时间
SET wait_timeout=30000000;
SET ob_trx_timeout = 100000000;
SET ob_query_timeout = 100000000;
alter system flush plan cache global;
set autocommit = false;
set ob_enable_batched_multi_statement=true;
ERROR HY000: internal error code, arguments: -5044, Unknown system variable 'ob_enable_batched_multi_statement'
#字符数据类型
create table t1(c1 char(30),c2 nchar(40),c3 varchar2(50),c4 varchar(60),c5 nvarchar2(80));
insert into t1 values('AA','11','@@$#$%','张三','--**//++');
insert into t1 values('BB','CC','22','wang王W','ab123');
insert into t1 values('33','DDDDd的','2*2+2','五五','APRI');
insert into t1 values('张三','fgh','3a+b','马六','bus');
insert into t1 values('！！@','sky','2*2+2','田七','com');
insert into t1 values('AA','01','01','ACC','oo哦');
insert into t1 values('BB','02','02','BDD','mm秒');
insert into t1 values('张三','03','03','马六','bus');
commit;
delete from t1 where c1 = 'AA';delete from t1 where c1 = '33';delete from t1 where c1 = '张三';//
select * from t1;
C1	C2	C3	C4	C5
BB                            	CC                                      	22	wang王W	ab123
！！@                       	sky                                     	2*2+2	田七	com
BB                            	02                                      	02	BDD	mm秒
rollback;
#delete + order by
delete from t1 where c1 = 'AA' order by c1;delete from t1 where c1 = '33' order by c1;delete from t1 where c1 = '张三' order by c1;//
rollback;
#delete + limit
delete from t1 where c1 = 'AA' limit 1;delete from t1 where c1 = 'BB' limit 1;delete from t1 where c1 = '！！@' limit 1;//
ERROR 42000: You have an error in your SQL syntax; check the manual that corresponds to your OceanBase version for the right syntax to use near 'limit 1;' at line 1
rollback;
delete from t1 where c2 = '01' and c3 = '01';delete from t1 where c2 = '02' and c3 = '02';delete from t1 where c2 = '03' and c3 = '03';//
select * from t1;
C1	C2	C3	C4	C5
AA                            	11                                      	@@$#$%	张三	--**//++
BB                            	CC                                      	22	wang王W	ab123
33                            	DDDDd的                                  	2*2+2	五五	APRI
张三                        	fgh                                     	3a+b	马六	bus
！！@                       	sky                                     	2*2+2	田七	com
rollback;
delete from t1 where c2 = '01' and c3 = '01';delete from t1 where c2 = 02 and c3 = 02;delete from t1 where c2 = '03' and c3 = '03';//
ERROR 42000: invalid number
rollback;
drop table t1;
#数值数据类型
create table t2(c1 number(5,2) primary key,c2 float(20)) partition by hash(c1)
(
partition p0,
partition p1,
partition p2
);
create unique index index_c2 on t2(c2);
insert into t2 values(1.1,1.111);
insert into t2 values(2.2,2.222);
insert into t2 values(3.333333,3.3333);
insert into t2 values(4.4,4.444);
insert into t2 values(5.5,5.555);
commit;
select * from t2;
C1	C2
1.1	1.111
2.2	2.222
3.33	3.3333
4.4	4.444
5.5	5.555
delete from t2 where c1 = 1.1;delete from t2 where c1 = 2.2;delete from t2 where c1 = 4.4;//
select * from t2;
C1	C2
3.33	3.3333
5.5	5.555
rollback;
delete from t2 where c1 = 1.1;delete from t2 where c1 = 2.2;delete from t2 where c1 = 3.33;//
select * from t2;
C1	C2
4.4	4.444
5.5	5.555
rollback;
delete from t2 where c1 = '1.1';delete from t2 where c1 = '2.2';delete from t2 where c1 = '4.4';//
select * from t2;
C1	C2
3.33	3.3333
5.5	5.555
rollback;
delete from t2 where c2 = 1.111;delete from t2 where c2 = 2.222;delete from t2 where c2 = 3.3333;//
select * from t2;
C1	C2
4.4	4.444
5.5	5.555
rollback;
delete from t2 where c1 = 1.075+0.025;delete from t2 where c1 = 1.1+1.1;delete from t2 where c1 = 2.225+2.175;//
select * from t2;
C1	C2
3.33	3.3333
5.5	5.555
rollback;
drop table t2;
create table t3(c1 binary_float not null primary key,c2 binary_double not null) partition by range(c1)
(
partition p0 values less than(3),
partition p1 values less than(maxvalue)
);
insert into t3 values(1.001,1.001);
insert into t3 values(2.001,2.001);
insert into t3 values(3.001,3.001);
insert into t3 values(4.001,4.001);
insert into t3 values(5.001,5.001);
commit;
delete from t3 where c1 = 1.001;delete from t3 where c1 = 2.001;delete from t3 where c1 = 3.001;//
select * from t3;
C1	C2
4.00099993E+000	4.0010000000000003E+000
5.00099993E+000	5.0010000000000003E+000
rollback;
delete from t3 where c1 = 1+0.001;delete from t3 where c1 = 2+0.001;delete from t3 where c1 = 3+0.001;//
select * from t3;
C1	C2
4.00099993E+000	4.0010000000000003E+000
5.00099993E+000	5.0010000000000003E+000
rollback;
delete from t3 partition(p1) where c1 = 3.001;delete from t3 partition(p1) where c1 = 4.001;delete from t3 partition(p1) where c1 = 5.001;//
select * from t3 partition(p1);
C1	C2
rollback;
drop table t3;
create table t4(c1 decimal(5,3),c2 binary_double not null);
insert into t4 values(10.222,1.123);
insert into t4 values(20.222,2.234);
insert into t4 values(30.333,3.456);
insert into t4 values(1.12,5.2);
commit;
select * from t4;
C1	C2
10.222	1.123E+000
20.222	2.234E+000
30.333	3.456E+000
1.12	5.2000000000000002E+000
delete from t4 where c1 = 10.222;delete from t4 where c1 = 20.222;delete from t4 where c1 = 30.333;//
select * from t4;
C1	C2
1.12	5.2000000000000002E+000
rollback;
delete from t4 where c1 = 10.222;delete from t4 where c1 = 1.12;delete from t4 where c1 = 30.333;//
select * from t4;
C1	C2
20.222	2.234E+000
rollback;
delete from t4 where c1 = 20-9.778;delete from t4 where c1 = 30-9.778;delete from t4 where c1 = 40-9.667;//
select * from t4;
C1	C2
1.12	5.2000000000000002E+000
rollback;
drop table t4;
#日期时间和间隔数据类型
create table t5(c1 date not null,c2 timestamp not null) partition by list(c1)
(
partition p0 values('2022-01-01 10:35:00','2022-01-02 11:35:00','2022-01-03 12:35:00','2022-01-04 13:35:00','2022-01-05 14:35:00'),
partition p1 values('2022-01-06 10:35:00','2022-01-07 11:35:00','2022-01-08 12:35:00','2022-01-09 14:35:00','2022-01-10 15:35:00')
);
create index index_c1_C2 on t5(c1,c2);
insert into t5 values(to_date('2022-01-01 10:35:00','yyyy-mm-dd hh24:mi:ss'),to_date('2022-01-11 10:35:00','yyyy-mm-dd hh24:mi:ss'));
insert into t5 values(to_date('2022-01-02 11:35:00','yyyy-mm-dd hh24:mi:ss'),to_date('2022-01-12 11:35:00','yyyy-mm-dd hh24:mi:ss'));
insert into t5 values(to_date('2022-01-03 12:35:00','yyyy-mm-dd hh24:mi:ss'),to_date('2022-01-13 12:35:00','yyyy-mm-dd hh24:mi:ss'));
insert into t5 values(to_date('2022-01-04 13:35:00','yyyy-mm-dd hh24:mi:ss'),to_date('2022-01-14 13:35:00','yyyy-mm-dd hh24:mi:ss'));
insert into t5 values(to_date('2022-01-05 14:35:00','yyyy-mm-dd hh24:mi:ss'),to_date('2022-01-15 14:35:00','yyyy-mm-dd hh24:mi:ss'));
insert into t5 values(to_date('2022-01-06 10:35:00','yyyy-mm-dd hh24:mi:ss'),to_date('2022-01-16 10:35:00','yyyy-mm-dd hh24:mi:ss'));
insert into t5 values(to_date('2022-01-07 11:35:00','yyyy-mm-dd hh24:mi:ss'),to_date('2022-01-17 11:35:00','yyyy-mm-dd hh24:mi:ss'));
insert into t5 values(to_date('2022-01-08 12:35:00','yyyy-mm-dd hh24:mi:ss'),to_date('2022-01-18 12:35:00','yyyy-mm-dd hh24:mi:ss'));
insert into t5 values(to_date('2022-01-09 14:35:00','yyyy-mm-dd hh24:mi:ss'),to_date('2022-01-19 14:35:00','yyyy-mm-dd hh24:mi:ss'));
insert into t5 values(to_date('2022-01-10 15:35:00','yyyy-mm-dd hh24:mi:ss'),to_date('2022-01-20 15:35:00','yyyy-mm-dd hh24:mi:ss'));
commit;
delete from t5 where c1 = '2022-01-01 10:35:00';delete from t5 where c1 = '2022-01-02 11:35:00';delete from t5 where c1 = '2022-01-03 12:35:00';//
select * from t5;
C1	C2
2022-01-04 13:35:00	2022-01-14 13:35:00.000000
2022-01-05 14:35:00	2022-01-15 14:35:00.000000
2022-01-06 10:35:00	2022-01-16 10:35:00.000000
2022-01-07 11:35:00	2022-01-17 11:35:00.000000
2022-01-08 12:35:00	2022-01-18 12:35:00.000000
2022-01-09 14:35:00	2022-01-19 14:35:00.000000
2022-01-10 15:35:00	2022-01-20 15:35:00.000000
rollback;
delete from t5 partition(p0) where c1 = '2022-01-01 10:35:00';delete from t5 partition(p0)  where c1 = '2022-01-02 11:35:00';delete from t5 partition(p0)  where c1 = '2022-01-03 12:36:00';//
select * from t5 partition(p0);
C1	C2
2022-01-03 12:35:00	2022-01-13 12:35:00.000000
2022-01-04 13:35:00	2022-01-14 13:35:00.000000
2022-01-05 14:35:00	2022-01-15 14:35:00.000000
rollback;
delete from t5 where c2 = '2022-01-11 10:35:00';delete from t5 where c2 = '2022-01-12 11:35:00';delete from t5 where c2 = '2022-01-13 12:35:00';//
select * from t5;
C1	C2
2022-01-04 13:35:00	2022-01-14 13:35:00.000000
2022-01-05 14:35:00	2022-01-15 14:35:00.000000
2022-01-06 10:35:00	2022-01-16 10:35:00.000000
2022-01-07 11:35:00	2022-01-17 11:35:00.000000
2022-01-08 12:35:00	2022-01-18 12:35:00.000000
2022-01-09 14:35:00	2022-01-19 14:35:00.000000
2022-01-10 15:35:00	2022-01-20 15:35:00.000000
rollback;
delete from t5 where c1 = '20200102113500';delete from t5 where c1 = '20200103123500';delete from t5 where c1 = '20200104133500';//
select * from t5;
C1	C2
2022-01-01 10:35:00	2022-01-11 10:35:00.000000
2022-01-02 11:35:00	2022-01-12 11:35:00.000000
2022-01-03 12:35:00	2022-01-13 12:35:00.000000
2022-01-04 13:35:00	2022-01-14 13:35:00.000000
2022-01-05 14:35:00	2022-01-15 14:35:00.000000
2022-01-06 10:35:00	2022-01-16 10:35:00.000000
2022-01-07 11:35:00	2022-01-17 11:35:00.000000
2022-01-08 12:35:00	2022-01-18 12:35:00.000000
2022-01-09 14:35:00	2022-01-19 14:35:00.000000
2022-01-10 15:35:00	2022-01-20 15:35:00.000000
rollback;
drop table t5;
#timestamp with time zone
create table t6(c1 timestamp(8) with time zone);
insert into t6 values(TO_TIMESTAMP_TZ('2006-12-14 19:45:09.9003 -12:00', 'YYYY-MM-DD HH24:MI:SS.FF TZH:TZM'));
insert into t6 values(TO_TIMESTAMP_TZ('2007-12-15 20:45:09.9003 -10:00', 'YYYY-MM-DD HH24:MI:SS.FF TZH:TZM'));
insert into t6 values(TO_TIMESTAMP_TZ('2008-12-16 21:45:09.9003 -09:00', 'YYYY-MM-DD HH24:MI:SS.FF TZH:TZM'));
insert into t6 values(TO_TIMESTAMP_TZ('2009-12-17 22:45:09.9003 -08:00', 'YYYY-MM-DD HH24:MI:SS.FF TZH:TZM'));
insert into t6 values(TO_TIMESTAMP_TZ('2010-12-18 23:45:09.9003 -07:00', 'YYYY-MM-DD HH24:MI:SS.FF TZH:TZM'));
commit;
select * from t6;
C1
2006-12-14 19:45:09.90030000 -12:00 
2007-12-15 20:45:09.90030000 -10:00 
2008-12-16 21:45:09.90030000 -09:00 
2009-12-17 22:45:09.90030000 -08:00 
2010-12-18 23:45:09.90030000 -07:00 
delete from t6 where c1 = TO_TIMESTAMP_TZ('2006-12-14 19:45:09.9003 -12:00', 'YYYY-MM-DD HH24:MI:SS.FF TZH:TZM');delete from t6 where c1 = TO_TIMESTAMP_TZ('2007-12-15 20:45:09.9003 -10:00', 'YYYY-MM-DD HH24:MI:SS.FF TZH:TZM');delete from t6 where c1 = TO_TIMESTAMP_TZ('2008-12-16 21:45:09.9003 -09:00', 'YYYY-MM-DD HH24:MI:SS.FF TZH:TZM');//
select * from t6;
C1
2009-12-17 22:45:09.90030000 -08:00 
2010-12-18 23:45:09.90030000 -07:00 
rollback;
delete from t6 where c1 = '2006-12-14 19:45:09.9003 -12:00';delete from t6 where c1 = '2007-12-15 20:45:09.9003 -10:00';delete from t6 where c1 = '2008-12-16 21:45:09.9003 -09:00';//
select * from t6;
C1
2009-12-17 22:45:09.90030000 -08:00 
2010-12-18 23:45:09.90030000 -07:00 
rollback;
delete from t6 where c1 = '2006-12-14 19:45:09.9003 -12:00';delete from t6 where c1 = '2007-12-15 20:45:09.9003 -10:00';delete from t6 where c1 = '2008-12-16 21:45:09.9003 -13:00';//
select * from t6;
C1
2008-12-16 21:45:09.90030000 -09:00 
2009-12-17 22:45:09.90030000 -08:00 
2010-12-18 23:45:09.90030000 -07:00 
rollback;
delete from t6 where c1 = TO_TIMESTAMP_TZ('2006-12-14 19:45:09.9003 -12:00', 'YYYY-MM-DD HH24:MI:SS.FF TZH:TZM');delete from t6 where c1 = TO_TIMESTAMP_TZ('2007-12-15 20:45:09.9003 -10:00', 'YYYY-MM-DD HH24:MI:SS.FF TZH:TZM');delete from t6 where c1 = TO_TIMESTAMP_TZ('2008-12-16 21:45:09.9003 -13:00', 'YYYY-MM-DD HH24:MI:SS.FF TZH:TZM');//
select * from t6;
C1
2008-12-16 21:45:09.90030000 -09:00 
2009-12-17 22:45:09.90030000 -08:00 
2010-12-18 23:45:09.90030000 -07:00 
rollback;
drop table t6;
#timestamp with local time zone
create table t7(c1 timestamp(9) with local time zone);
insert into t7 values(TO_TIMESTAMP_TZ('2022-01-01 01:01:01.001 -12:44', 'YYYY-MM-DD HH24:MI:SS.FF TZH:TZM'));
insert into t7 values(TO_TIMESTAMP_TZ('2022-02-02 02:02:02.002 +10:00', 'YYYY-MM-DD HH24:MI:SS.FF TZH:TZM'));
insert into t7 values(TO_TIMESTAMP_TZ('2022-03-03 03:03:03.003 -09:20', 'YYYY-MM-DD HH24:MI:SS.FF TZH:TZM'));
insert into t7 values(TO_TIMESTAMP_TZ('2022-04-04 04:04:04.004 +11:20', 'YYYY-MM-DD HH24:MI:SS.FF TZH:TZM'));
insert into t7 values(TO_TIMESTAMP_TZ('2022-05-05 05:05:05.005 -13:00', 'YYYY-MM-DD HH24:MI:SS.FF TZH:TZM'));
commit;
select * from t7;
C1
2022-01-01 21:45:01.001000000
2022-02-02 00:02:02.002000000
2022-03-03 20:23:03.003000000
2022-04-04 00:44:04.004000000
2022-05-06 02:05:05.005000000
delete from t7 where c1 = TO_TIMESTAMP_TZ('2022-01-01 01:01:01.001 -12:44', 'YYYY-MM-DD HH24:MI:SS.FF TZH:TZM');delete from t7 where c1 = TO_TIMESTAMP_TZ('2022-02-02 02:02:02.002 +10:00', 'YYYY-MM-DD HH24:MI:SS.FF TZH:TZM');delete from t7 where c1 = TO_TIMESTAMP_TZ('2022-03-03 03:03:03.003 -09:20', 'YYYY-MM-DD HH24:MI:SS.FF TZH:TZM');//
select * from t7
rollback;
C1
2022-04-04 00:44:04.004000000
2022-05-06 02:05:05.005000000
delete from t7 where c1 = '2022-01-01 01:01:01.001-12:44';delete from t7 where c1 = '2022-02-02 02:02:02.002 +10:00';delete from t7 where c1 = '2022-05-05 05:05:05.005 -13:00';//
select * from t7;
C1
2022-04-04 00:44:04.004000000
2022-05-06 02:05:05.005000000
rollback;
delete from t7 where c1 = '2022-01-01 21:45:01.001';delete from t7 where c1 = '2022-02-02 00:02:02.002000000';delete from t7 where c1 = '2022-05-06 02:05:05.0050';//
select * from t7;
C1
2022-03-03 20:23:03.003000000
2022-04-04 00:44:04.004000000
rollback;
drop table t7;
CREATE TABLE t8 (
interval1 INTERVAL YEAR TO MONTH,
interval2 INTERVAL YEAR(3) TO MONTH not null,
interval3 INTERVAL YEAR TO MONTH not null,
constraint uk_int1 unique(interval1)
);
INSERT INTO t8 VALUES (INTERVAL '12-3' YEAR TO MONTH, INTERVAL '120-3' YEAR(3) TO MONTH, INTERVAL '40' MONTH);
INSERT INTO t8 VALUES (INTERVAL '10-3' YEAR TO MONTH, INTERVAL '100-3' YEAR(3) TO MONTH, INTERVAL '30' MONTH);
INSERT INTO t8 VALUES (INTERVAL '8-3' YEAR TO MONTH, INTERVAL '80-3' YEAR(3) TO MONTH, INTERVAL '20' MONTH);
INSERT INTO t8 VALUES (INTERVAL '6-3' YEAR TO MONTH, INTERVAL '60-3' YEAR(3) TO MONTH, INTERVAL '10' MONTH);
commit;
SELECT * FROM t8;
INTERVAL1	INTERVAL2	INTERVAL3
+12-03	+120-03	+03-04
+10-03	+100-03	+02-06
+08-03	+080-03	+01-08
+06-03	+060-03	+00-10
delete from t8 where interval1 = '+12-03';delete from t8 where interval1 = '+10-03';delete from t8 where interval1 = '+08-03';//
select * from t8;
INTERVAL1	INTERVAL2	INTERVAL3
+06-03	+060-03	+00-10
rollback;
delete from t8 where interval2 = INTERVAL '120-3' YEAR(3) TO MONTH;delete from t8 where interval2 = INTERVAL '100-3' YEAR(3) TO MONTH;delete from t8 where interval2 = INTERVAL '80-3' YEAR(3) TO MONTH;//
select * from t8;
INTERVAL1	INTERVAL2	INTERVAL3
+06-03	+060-03	+00-10
rollback;
drop table t8;
CREATE TABLE t9 (c1 INTERVAL DAY TO SECOND, c2 INTERVAL DAY(3) TO SECOND(3));
INSERT INTO t9 VALUES ( INTERVAL '15 06:10:08' DAY TO SECOND, INTERVAL '150 06:10:08' DAY(3) TO SECOND(3));
INSERT INTO t9 VALUES ( INTERVAL '20 07:07:07' DAY TO SECOND, INTERVAL '200 07:17:17' DAY(3) TO SECOND(3));
INSERT INTO t9 VALUES ( INTERVAL '25 06:06:06' DAY TO SECOND, INTERVAL '250 06:16:16' DAY(3) TO SECOND(3));
INSERT INTO t9 VALUES ( INTERVAL '30 05:05:05' DAY TO SECOND, INTERVAL '300 05:15:15' DAY(3) TO SECOND(3));
commit;
SELECT * FROM t9;
C1	C2
+15 06:10:08.000000	+150 06:10:08.000
+20 07:07:07.000000	+200 07:17:17.000
+25 06:06:06.000000	+250 06:16:16.000
+30 05:05:05.000000	+300 05:15:15.000
delete from t9 where c1 = '+15 06:10:08.000000';delete from t9 where c1 = '+20 07:07:07.000000';delete from t9 where c1 = '+25 06:06:06.000000';//
select * from t9;
C1	C2
+30 05:05:05.000000	+300 05:15:15.000
rollback;
delete from t9 where c2 = INTERVAL '150 06:10:08' DAY(3) TO SECOND(3);delete from t9 where c2 = INTERVAL '250 06:16:16' DAY(3) TO SECOND(3);delete from t9 where c2 = INTERVAL '300 05:15:15' DAY(3) TO SECOND(3);//
select * from t9;
C1	C2
+20 07:07:07.000000	+200 07:17:17.000
rollback;
drop table t9;
#raw类型
CREATE TABLE t10 (c1 RAW(10) not null default 'AA',c2 RAW(10) not null primary key);
INSERT INTO t10 VALUES (utl_raw.cast_to_raw('A'),hextoraw('ff'));
INSERT INTO t10 VALUES (utl_raw.cast_to_raw('123'),hextoraw('aa'));
INSERT INTO t10 VALUES (utl_raw.cast_to_raw('B'),hextoraw('dd'));
INSERT INTO t10 VALUES (utl_raw.cast_to_raw('D'),hextoraw('cc'));
commit;
create index index_c1 on t10(c1);
SELECT utl_raw.cast_to_varchar2(c1) FROM t10;
UTL_RAW.CAST_TO_VARCHAR2(C1)
123
D
B
A
select * from t10;
C1	C2
313233	AA
44	CC
42	DD
41	FF
delete from t10 where c1 = '41';delete from t10 where c1 = '42';delete from t10 where c1 = '44';//
select * from t10;
C1	C2
313233	AA
rollback;
delete from t10 where c1 = utl_raw.cast_to_raw('A');delete from t10 where c1 = utl_raw.cast_to_raw('123');delete from t10 where c1 = utl_raw.cast_to_raw('B');//
select utl_raw.cast_to_varchar2(c1) FROM t10;
UTL_RAW.CAST_TO_VARCHAR2(C1)
D
rollback;
delete from t10 where c2 = hextoraw('ff');delete from t10 where c2 = hextoraw('aa');delete from t10 where c2 = hextoraw('dd');//
select * from t10;
C1	C2
44	CC
rollback;
drop table t10;
#大对象数据类型
create table t11(c1 blob,c2 blob);
insert into t11 values('a','10');
insert into t11 values('b','11');
insert into t11 values('c','12');
insert into t11 values('d','13');
insert into t11 values('e','14');
commit;
select * from t11;
C1	C2

	
	
	
	
	
delete from t11 where c1 = 'a';delete from t11 where c1 = 'b';delete from t11 where c1 = 'c';//
delete from t11 where c2 = '10';delete from t11 where c2 = '11';delete from t11 where c2 = '12';//
drop table t11;
create table t12 (c1 clob,c2 clob);
insert into t12 values('aaa','111');
insert into t12 values('bbb','222');
insert into t12 values('ccc','333');
insert into t12 values('ddd','444');
insert into t12 values('eee','555');
commit;
select * from t12;
C1	C2
aaa	111
bbb	222
ccc	333
ddd	444
eee	555
delete from t12 where c1 = 'aaa';delete from t12 where c1 = 'bbb';delete from t12 where c1 = 'ccc';//
delete from t12 where c1 = '111';delete from t12 where c1 = '222';delete from t12 where c1 = '333';//
drop table t12;
# Clean up users
drop user zwc cascade;
