purge recyclebin;
result_format: 4
drop user whh@'%';
create user whh identified by 'whh';
grant all on *.* to whh WITH GRANT OPTION;


set ob_query_timeout = 10000000000;
---------------------------------------------------------------------------------
######################## 标签：generator-1      2、随机函数  ######################
######################## 标签：distribution-1   3、分布函数  ######################
######################## 标签：table-function-2 SQL场景   ######################
######## table-function-2-1 select
###### 测试表
DROP TABLE t1;
CREATE TABLE t1(
  id int not null, 
  c1 varchar(50), 
  c2 varchar(50),
  c3 varchar(50), 
  PRIMARY KEY (id))
PARTITION BY HASH(id) PARTITIONS 3;
INSERT INTO t1 VALUES(1,'中','国','china');
INSERT INTO t1 VALUES(2,'中','国','china');
INSERT INTO t1 VALUES(3,'中','国','china');
INSERT INTO t1 VALUES(4,'中','国','china');
DROP TABLE t2;
CREATE TABLE t2(
  id int,
  c1 int unique,
  c2 int,
  INDEX index_name (c1))
PARTITION BY LIST(c1)( 
  PARTITION p0 VALUES IN (1,2),
  PARTITION p1 VALUES IN (3,4),
  PARTITION p2 VALUES IN (5,6));
INSERT INTO t2 VALUES(1,1,11);
INSERT INTO t2 VALUES(2,2,12);
INSERT INTO t2 VALUES(3,3,13);
DROP TABLE t3;
CREATE TABLE t3(
  id int unique,
  c1 double,
  c2 varchar(50),
  c3 double default 0,
  c4 double default 0,
  c5 double default 0)
PARTITION BY RANGE (id) ( 
  PARTITION p0 VALUES LESS THAN (5), 
  PARTITION p1 VALUES LESS THAN (10),  
  PARTITION p2 VALUES LESS THAN MAXVALUE);
INSERT INTO t3 VALUES(1,1,10,20,30,40);
INSERT INTO t3 VALUES(2,2,12,13,14,15);
INSERT INTO t3 VALUES(3,3,23,24,25,26);
DROP VIEW v1;
CREATE VIEW v1 as select t1.id,t1.c1,t2.c2 from t1,t2 where t1.id = t2.id;
###### select 普通查询
SELECT random(1),randstr(5,random(1)) FROM dual;
+----------------------+----------------------+
| random(1)            | randstr(5,random(1)) |
+----------------------+----------------------+
| -6753783847308464280 | Z8bwj                |
+----------------------+----------------------+
SELECT normal(1,2,random(1)),uniform(1,10,random(1)),zipf(1,10,random(1)) FROM dual;
+-----------------------+-------------------------+----------------------+
| normal(1,2,random(1)) | uniform(1,10,random(1)) | zipf(1,10,random(1)) |
+-----------------------+-------------------------+----------------------+
|   -1.1668020685810387 |                       4 |                    0 |
+-----------------------+-------------------------+----------------------+
SELECT c2,random(c1),randstr(5,c1) FROM v1 order by 1;
+------+----------------------+---------------+
| c2   | random(c1)           | randstr(5,c1) |
+------+----------------------+---------------+
|   11 | -6275704758082610114 | HYzwJ         |
|   12 | -6275704758082610114 | HYzwJ         |
|   13 | -6275704758082610114 | HYzwJ         |
+------+----------------------+---------------+
SELECT c2,normal(1,2,c2),uniform(1,10,c2),zipf(1,10,c2) FROM v1 order by 1;
+------+---------------------+------------------+---------------+
| c2   | normal(1,2,c2)      | uniform(1,10,c2) | zipf(1,10,c2) |
+------+---------------------+------------------+---------------+
|   11 |  1.9692873643275037 |                2 |             0 |
|   12 |  1.5011740324425584 |                2 |             0 |
|   13 | -1.9108987947763545 |                7 |             2 |
+------+---------------------+------------------+---------------+
SELECT id,random(id) FROM t1 order by 1;
+----+----------------------+
| id | random(id)           |
+----+----------------------+
|  1 | -6753783847308464280 |
|  2 |  7445180178319379020 |
|  3 |  1084041170817055659 |
|  4 |  5267436225003336391 |
+----+----------------------+
SELECT id,randstr(5,id) FROM t1 order by 1;
+----+---------------+
| id | randstr(5,id) |
+----+---------------+
|  1 | GLC9O         |
|  2 | DAPMR         |
|  3 | CxcZU         |
|  4 | 9mpmX         |
+----+---------------+
SELECT c1,normal(1,2,c1) FROM t2 order by 1;
+------+---------------------+
| c1   | normal(1,2,c1)      |
+------+---------------------+
|    1 | 0.22633647675792012 |
|    2 | -0.1829602411067861 |
|    3 | -1.7166965217039651 |
+------+---------------------+
SELECT c1,uniform(1,10,c1) FROM t2 order by 1;
+------+------------------+
| c1   | uniform(1,10,c1) |
+------+------------------+
|    1 |                2 |
|    2 |               10 |
|    3 |                6 |
+------+------------------+
SELECT c1,zipf(1,10,c1) FROM t2 order by 1;
+------+---------------+
| c1   | zipf(1,10,c1) |
+------+---------------+
|    1 |             0 |
|    2 |             7 |
|    3 |             2 |
+------+---------------+
###### where 子句
SELECT id,random(id) FROM t1 where random(id) > 0 order by 1;
+----+---------------------+
| id | random(id)          |
+----+---------------------+
|  2 | 7445180178319379020 |
|  3 | 1084041170817055659 |
|  4 | 5267436225003336391 |
+----+---------------------+
SELECT id,randstr(5,id) FROM t1 where randstr(5,id) like '%A%' order by 1;
+----+---------------+
| id | randstr(5,id) |
+----+---------------+
|  2 | DAPMR         |
+----+---------------+
SELECT c1,normal(1,2,c1) FROM t2 where normal(1,2,c1) > 0 order by 1;
+------+---------------------+
| c1   | normal(1,2,c1)      |
+------+---------------------+
|    1 | 0.22633647675792012 |
+------+---------------------+
SELECT c1,uniform(1,10,c1) FROM t2 where uniform(1,10,c1) > 5 order by 1;
+------+------------------+
| c1   | uniform(1,10,c1) |
+------+------------------+
|    2 |               10 |
|    3 |                6 |
+------+------------------+
SELECT c1,zipf(1,10,c1) FROM t2 where zipf(1,10,c1) > 0 order by 1;
+------+---------------+
| c1   | zipf(1,10,c1) |
+------+---------------+
|    2 |             7 |
|    3 |             2 |
+------+---------------+
###### order by 子句
SELECT id,random(id) FROM t1 where random(id) > 0 order by random(id);
+----+---------------------+
| id | random(id)          |
+----+---------------------+
|  3 | 1084041170817055659 |
|  4 | 5267436225003336391 |
|  2 | 7445180178319379020 |
+----+---------------------+
SELECT id,randstr(5,id) FROM t1 where randstr(5,id) like '%A%' order by randstr(5,id);
+----+---------------+
| id | randstr(5,id) |
+----+---------------+
|  2 | DAPMR         |
+----+---------------+
SELECT c1,normal(1,2,c1) FROM t2 where normal(1,2,c1) > 0 order by normal(1,2,c1);
+------+---------------------+
| c1   | normal(1,2,c1)      |
+------+---------------------+
|    1 | 0.22633647675792012 |
+------+---------------------+
SELECT c1,uniform(1,10,c1) FROM t2 where uniform(1,10,c1) > 5 order by uniform(1,10,c1);
+------+------------------+
| c1   | uniform(1,10,c1) |
+------+------------------+
|    3 |                6 |
|    2 |               10 |
+------+------------------+
SELECT c1,zipf(1,10,c1) FROM t2 where zipf(1,10,c1) > 0 order by zipf(1,10,c1);
+------+---------------+
| c1   | zipf(1,10,c1) |
+------+---------------+
|    3 |             2 |
|    2 |             7 |
+------+---------------+
###### group by having 子句
SELECT id,random(id) col FROM t1 group by col having random(id) > 0 order by 1;
+----+---------------------+
| id | col                 |
+----+---------------------+
|  2 | 7445180178319379020 |
|  3 | 1084041170817055659 |
|  4 | 5267436225003336391 |
+----+---------------------+
SELECT id,randstr(5,id) col FROM t1 group by col having randstr(5,id) LIKE '%C%' order by 1;
+----+-------+
| id | col   |
+----+-------+
|  1 | GLC9O |
|  3 | CxcZU |
+----+-------+
SELECT c1,normal(1,2,c1) col FROM t2 group by col having normal(1,2,c1) > 0 order by 1;
+------+---------------------+
| c1   | col                 |
+------+---------------------+
|    1 | 0.22633647675792012 |
+------+---------------------+
SELECT c1,uniform(1,10,c1) col FROM t2 group by col having normal(1,2,c1) > 1 order by 1;
+------+------+
| c1   | col  |
+------+------+
+------+------+
SELECT c1,zipf(1,10,c1) col FROM t2 group by col having zipf(1,10,c1) > 0 order by 1;
+------+------+
| c1   | col  |
+------+------+
|    2 |    7 |
|    3 |    2 |
+------+------+
###### distinct
SELECT distinct random(id),id FROM t1 order by 1;
+----------------------+----+
| random(id)           | id |
+----------------------+----+
| -6753783847308464280 |  1 |
|  1084041170817055659 |  3 |
|  5267436225003336391 |  4 |
|  7445180178319379020 |  2 |
+----------------------+----+
SELECT distinct randstr(5,id),id FROM t1 order by 1;
+---------------+----+
| randstr(5,id) | id |
+---------------+----+
| 9mpmX         |  4 |
| CxcZU         |  3 |
| DAPMR         |  2 |
| GLC9O         |  1 |
+---------------+----+
SELECT distinct normal(1,2,c1),c1 FROM t2 order by 1;
+---------------------+------+
| normal(1,2,c1)      | c1   |
+---------------------+------+
| -1.7166965217039651 |    3 |
| -0.1829602411067861 |    2 |
| 0.22633647675792012 |    1 |
+---------------------+------+
SELECT distinct uniform(1,10,c1),c1 FROM t2 order by 1;
+------------------+------+
| uniform(1,10,c1) | c1   |
+------------------+------+
|                2 |    1 |
|                6 |    3 |
|               10 |    2 |
+------------------+------+
SELECT distinct zipf(1,10,c1),c1 FROM t2 order by 1;
+---------------+------+
| zipf(1,10,c1) | c1   |
+---------------+------+
|             0 |    1 |
|             2 |    3 |
|             7 |    2 |
+---------------+------+
###### case when
SELECT id,random(id),CASE WHEN random(id)>0 THEN '>0' ELSE '<0' END FROM t1 order by 1;
+----+----------------------+------------------------------------------------+
| id | random(id)           | CASE WHEN random(id)>0 THEN '>0' ELSE '<0' END |
+----+----------------------+------------------------------------------------+
|  1 | -6753783847308464280 | <0                                             |
|  2 |  7445180178319379020 | >0                                             |
|  3 |  1084041170817055659 | >0                                             |
|  4 |  5267436225003336391 | >0                                             |
+----+----------------------+------------------------------------------------+
SELECT id,randstr(5,CASE WHEN id%2=0 THEN 0 ELSE 1 END) FROM t1 order by 1;
+----+-----------------------------------------------+
| id | randstr(5,CASE WHEN id%2=0 THEN 0 ELSE 1 END) |
+----+-----------------------------------------------+
|  1 | GLC9O                                         |
|  2 | HYzwJ                                         |
|  3 | GLC9O                                         |
|  4 | HYzwJ                                         |
+----+-----------------------------------------------+
SELECT c1,normal(1,2,c1),CASE WHEN normal(1,2,c1)>0 THEN '>0' ELSE '<0' END FROM t2 order by 1;
+------+---------------------+----------------------------------------------------+
| c1   | normal(1,2,c1)      | CASE WHEN normal(1,2,c1)>0 THEN '>0' ELSE '<0' END |
+------+---------------------+----------------------------------------------------+
|    1 | 0.22633647675792012 | >0                                                 |
|    2 | -0.1829602411067861 | <0                                                 |
|    3 | -1.7166965217039651 | <0                                                 |
+------+---------------------+----------------------------------------------------+
SELECT c1,uniform(1,10,c1),CASE WHEN uniform(1,10,c1)>0 THEN '>0' ELSE '<0' END FROM t2 order by 1;
+------+------------------+------------------------------------------------------+
| c1   | uniform(1,10,c1) | CASE WHEN uniform(1,10,c1)>0 THEN '>0' ELSE '<0' END |
+------+------------------+------------------------------------------------------+
|    1 |                2 | >0                                                   |
|    2 |               10 | >0                                                   |
|    3 |                6 | >0                                                   |
+------+------------------+------------------------------------------------------+
SELECT c1,zipf(1,10,c1),CASE zipf(1,10,c1) WHEN zipf(1,10,100)  THEN 'c1=100'  ELSE 'c1!=100' END FROM t2 order by 1;
+------+---------------+---------------------------------------------------------------------------+
| c1   | zipf(1,10,c1) | CASE zipf(1,10,c1) WHEN zipf(1,10,100)  THEN 'c1=100'  ELSE 'c1!=100' END |
+------+---------------+---------------------------------------------------------------------------+
|    1 |             0 | c1!=100                                                                   |
|    2 |             7 | c1!=100                                                                   |
|    3 |             2 | c1!=100                                                                   |
+------+---------------+---------------------------------------------------------------------------+
###### 连接查询
SELECT t2.c1,random(t2.c1) FROM t1,t2 where t1.id=t2.id order by 1;
+------+----------------------+
| c1   | random(t2.c1)        |
+------+----------------------+
|    1 | -6753783847308464280 |
|    2 |  7445180178319379020 |
|    3 |  1084041170817055659 |
+------+----------------------+
SELECT t2.c1,randstr(5,t2.c1) FROM t1,t2 where t1.id=t2.id order by 1;
+------+------------------+
| c1   | randstr(5,t2.c1) |
+------+------------------+
|    1 | GLC9O            |
|    2 | DAPMR            |
|    3 | CxcZU            |
+------+------------------+
SELECT t2.c1,normal(1,2,t2.c1) FROM t1,t2 where t1.id=t2.id order by 1;
+------+---------------------+
| c1   | normal(1,2,t2.c1)   |
+------+---------------------+
|    1 | 0.22633647675792012 |
|    2 | -0.1829602411067861 |
|    3 | -1.7166965217039651 |
+------+---------------------+
SELECT t2.c1,uniform(1,10,t2.c1) FROM t1,t2 where t1.id=t2.id order by 1;
+------+---------------------+
| c1   | uniform(1,10,t2.c1) |
+------+---------------------+
|    1 |                   2 |
|    2 |                  10 |
|    3 |                   6 |
+------+---------------------+
SELECT t2.c1,zipf(1,10,t2.c1) FROM t1,t2 where t1.id=t2.id order by 1;
+------+------------------+
| c1   | zipf(1,10,t2.c1) |
+------+------------------+
|    1 |                0 |
|    2 |                7 |
|    3 |                2 |
+------+------------------+
SELECT t2.c2,random(t2.c2) FROM t1 LEFT JOIN t2 ON t1.id=t2.id order by 1;
+------+----------------------+
| c2   | random(t2.c2)        |
+------+----------------------+
| NULL | -6275704758082610114 |
|   11 | -6166504658982550541 |
|   12 | -5769750714249136284 |
|   13 |  2034403572012397583 |
+------+----------------------+
SELECT t2.c2,randstr(5,t2.c2) FROM t1 LEFT JOIN t2 ON t1.id=t2.id order by 1;
+------+------------------+
| c2   | randstr(5,t2.c2) |
+------+------------------+
| NULL | NULL             |
|   11 | wPIHu            |
|   12 | tEVWx            |
|   13 | s1ij0            |
+------+------------------+
SELECT t2.c2,normal(1,2,t2.c2) FROM t1 LEFT JOIN t2 ON t1.id=t2.id order by 1;
+------+---------------------+
| c2   | normal(1,2,t2.c2)   |
+------+---------------------+
| NULL |                NULL |
|   11 |  1.9692873643275037 |
|   12 |  1.5011740324425584 |
|   13 | -1.9108987947763545 |
+------+---------------------+
SELECT t2.c2,uniform(1,10,t2.c2) FROM t1 LEFT JOIN t2 ON t1.id=t2.id order by 1;
+------+---------------------+
| c2   | uniform(1,10,t2.c2) |
+------+---------------------+
| NULL |                NULL |
|   11 |                   2 |
|   12 |                   2 |
|   13 |                   7 |
+------+---------------------+
SELECT t2.c2,zipf(1,10,t2.c2) FROM t1 LEFT JOIN t2 ON t1.id=t2.id order by 1;
+------+------------------+
| c2   | zipf(1,10,t2.c2) |
+------+------------------+
| NULL |             NULL |
|   11 |                0 |
|   12 |                0 |
|   13 |                2 |
+------+------------------+
SELECT t2.c1,random(t2.c1) FROM t1 RIGHT JOIN t2 ON t1.id=t2.id order by 1;
+------+----------------------+
| c1   | random(t2.c1)        |
+------+----------------------+
|    1 | -6753783847308464280 |
|    2 |  7445180178319379020 |
|    3 |  1084041170817055659 |
+------+----------------------+
SELECT t2.c1,randstr(5,t2.c1) FROM t1 RIGHT JOIN t2 ON t1.id=t2.id order by 1;
+------+------------------+
| c1   | randstr(5,t2.c1) |
+------+------------------+
|    1 | GLC9O            |
|    2 | DAPMR            |
|    3 | CxcZU            |
+------+------------------+
SELECT t2.c1,normal(1,2,t2.c1) FROM t1 RIGHT JOIN t2 ON t1.id=t2.id order by 1;
+------+---------------------+
| c1   | normal(1,2,t2.c1)   |
+------+---------------------+
|    1 | 0.22633647675792012 |
|    2 | -0.1829602411067861 |
|    3 | -1.7166965217039651 |
+------+---------------------+
SELECT t2.c1,uniform(1,10,t2.c1) FROM t1 RIGHT JOIN t2 ON t1.id=t2.id order by 1;
+------+---------------------+
| c1   | uniform(1,10,t2.c1) |
+------+---------------------+
|    1 |                   2 |
|    2 |                  10 |
|    3 |                   6 |
+------+---------------------+
SELECT t2.c1,zipf(1,10,t2.c1) FROM t1 RIGHT JOIN t2 ON t1.id=t2.id order by 1;
+------+------------------+
| c1   | zipf(1,10,t2.c1) |
+------+------------------+
|    1 |                0 |
|    2 |                7 |
|    3 |                2 |
+------+------------------+
SELECT t2.c2,random(t2.c2) FROM t1 INNER JOIN t2 ON t1.id=t2.id order by 1;
+------+----------------------+
| c2   | random(t2.c2)        |
+------+----------------------+
|   11 | -6166504658982550541 |
|   12 | -5769750714249136284 |
|   13 |  2034403572012397583 |
+------+----------------------+
SELECT t2.c2,randstr(5,t2.c2) FROM t1 INNER JOIN t2 ON t1.id=t2.id order by 1;
+------+------------------+
| c2   | randstr(5,t2.c2) |
+------+------------------+
|   11 | wPIHu            |
|   12 | tEVWx            |
|   13 | s1ij0            |
+------+------------------+
SELECT t2.c2,normal(1,2,t2.c2) FROM t1 INNER JOIN t2 ON t1.id=t2.id order by 1;
+------+---------------------+
| c2   | normal(1,2,t2.c2)   |
+------+---------------------+
|   11 |  1.9692873643275037 |
|   12 |  1.5011740324425584 |
|   13 | -1.9108987947763545 |
+------+---------------------+
SELECT t2.c2,uniform(1,10,t2.c2) FROM t1 INNER JOIN t2 ON t1.id=t2.id order by 1;
+------+---------------------+
| c2   | uniform(1,10,t2.c2) |
+------+---------------------+
|   11 |                   2 |
|   12 |                   2 |
|   13 |                   7 |
+------+---------------------+
SELECT t2.c2,zipf(1,10,t2.c2) FROM t1 INNER JOIN t2 ON t1.id=t2.id order by 1;
+------+------------------+
| c2   | zipf(1,10,t2.c2) |
+------+------------------+
|   11 |                0 |
|   12 |                0 |
|   13 |                2 |
+------+------------------+
###### select嵌套
### SELECT
SELECT col,random(col) FROM (SELECT id,random(id) col FROM t1) order by 1;
+----------------------+----------------------+
| col                  | random(col)          |
+----------------------+----------------------+
| -6753783847308464280 | -3616236869674197915 |
|  1084041170817055659 | -1641300189172225232 |
|  5267436225003336391 | -2573818771448689138 |
|  7445180178319379020 | -3001497895515806538 |
+----------------------+----------------------+
SELECT col,randstr(5,col) FROM (SELECT id,randstr(5,id) col FROM t1) order by 1;
+-------+----------------+
| col   | randstr(5,col) |
+-------+----------------+
| 9mpmX | 0nsro          |
| CxcZU | HYzwJ          |
| DAPMR | HYzwJ          |
| GLC9O | HYzwJ          |
+-------+----------------+
SELECT col,normal(1,2,col) FROM (SELECT c1,normal(1,2,c1) col FROM t2) order by 1;
+---------------------+--------------------+
| col                 | normal(1,2,col)    |
+---------------------+--------------------+
| -1.7166965217039651 | 1.4931672764815447 |
| -0.1829602411067861 | 1.2038371110290758 |
| 0.22633647675792012 | 1.2038371110290758 |
+---------------------+--------------------+
SELECT col,uniform(1,10,col) FROM (SELECT c1,uniform(1,10,c1) col FROM t2) order by 1;
+------+-------------------+
| col  | uniform(1,10,col) |
+------+-------------------+
|    2 |                10 |
|    6 |                 8 |
|   10 |                 7 |
+------+-------------------+
SELECT col,zipf(1,10,col) FROM (SELECT c1,zipf(1,10,c1) col FROM t2) order by 1;
+------+----------------+
| col  | zipf(1,10,col) |
+------+----------------+
|    0 |              0 |
|    2 |              7 |
|    7 |              4 |
+------+----------------+
### EXISTS
SELECT id,random(id) FROM t1 where EXISTS (SELECT id,random(id) FROM t1 where random(id) > 0) order by 1;
+----+----------------------+
| id | random(id)           |
+----+----------------------+
|  1 | -6753783847308464280 |
|  2 |  7445180178319379020 |
|  3 |  1084041170817055659 |
|  4 |  5267436225003336391 |
+----+----------------------+
SELECT id,randstr(5,id) FROM t1 where EXISTS (SELECT id,randstr(5,id) FROM t1 where randstr(5,id) like '%A%' ) order by 1;
+----+---------------+
| id | randstr(5,id) |
+----+---------------+
|  1 | GLC9O         |
|  2 | DAPMR         |
|  3 | CxcZU         |
|  4 | 9mpmX         |
+----+---------------+
SELECT c1,normal(1,2,c1) FROM t2 where EXISTS (SELECT c1,normal(1,2,c1) FROM t2 where normal(1,2,c1) > 0) order by 1;
+------+---------------------+
| c1   | normal(1,2,c1)      |
+------+---------------------+
|    1 | 0.22633647675792012 |
|    2 | -0.1829602411067861 |
|    3 | -1.7166965217039651 |
+------+---------------------+
SELECT c1,uniform(1,10,c1) FROM t2 where EXISTS (SELECT c1,uniform(1,10,c1) FROM t2 where uniform(1,10,c1) > 5) order by 1;
+------+------------------+
| c1   | uniform(1,10,c1) |
+------+------------------+
|    1 |                2 |
|    2 |               10 |
|    3 |                6 |
+------+------------------+
SELECT c1,zipf(1,10,c1) FROM t2 where EXISTS (SELECT c1,zipf(1,10,c1) FROM t2 where zipf(1,10,c1) > 0) order by 1;
+------+---------------+
| c1   | zipf(1,10,c1) |
+------+---------------+
|    1 |             0 |
|    2 |             7 |
|    3 |             2 |
+------+---------------+
### ANY
SELECT id,random(id) FROM t1 where random(id) > ANY(SELECT random(id) FROM t1 where random(id) > 0) order by 1;
+----+---------------------+
| id | random(id)          |
+----+---------------------+
|  2 | 7445180178319379020 |
|  4 | 5267436225003336391 |
+----+---------------------+
SELECT id,randstr(5,id) FROM t1 where randstr(5,id) = ANY(SELECT randstr(5,id) FROM t1 where randstr(5,id) like '%A%') order by 1;
+----+---------------+
| id | randstr(5,id) |
+----+---------------+
|  2 | DAPMR         |
+----+---------------+
SELECT c1,normal(1,2,c1) FROM t2 where normal(1,2,c1) < ANY(SELECT normal(1,2,c1) FROM t2 where normal(1,2,c1) > 0) order by 1;
+------+---------------------+
| c1   | normal(1,2,c1)      |
+------+---------------------+
|    2 | -0.1829602411067861 |
|    3 | -1.7166965217039651 |
+------+---------------------+
SELECT c1,uniform(1,10,c1) FROM t2 where uniform(1,10,c1) >= ANY(SELECT uniform(1,10,c1) FROM t2 where uniform(1,10,c1) > 5) order by 1;
+------+------------------+
| c1   | uniform(1,10,c1) |
+------+------------------+
|    2 |               10 |
|    3 |                6 |
+------+------------------+
SELECT c1,zipf(1,10,c1) FROM t2 where zipf(1,10,c1) <= ANY(SELECT zipf(1,10,c1) FROM t2 where zipf(1,10,c1) > 0) order by 1;
+------+---------------+
| c1   | zipf(1,10,c1) |
+------+---------------+
|    1 |             0 |
|    2 |             7 |
|    3 |             2 |
+------+---------------+
### ALL
SELECT id,random(id) FROM t1 where random(id) > ALL(SELECT random(id) FROM t1 where random(id) > 0) order by 1;
+----+------------+
| id | random(id) |
+----+------------+
+----+------------+
SELECT id,randstr(5,id) FROM t1 where randstr(5,id) = ALL(SELECT randstr(5,id) FROM t1 where randstr(5,id) like '%A%') order by 1;
+----+---------------+
| id | randstr(5,id) |
+----+---------------+
|  2 | DAPMR         |
+----+---------------+
SELECT c1,normal(1,2,c1) FROM t2 where normal(1,2,c1) < ALL(SELECT normal(1,2,c1) FROM t2 where normal(1,2,c1) > 0) order by 1;
+------+---------------------+
| c1   | normal(1,2,c1)      |
+------+---------------------+
|    2 | -0.1829602411067861 |
|    3 | -1.7166965217039651 |
+------+---------------------+
SELECT c1,uniform(1,10,c1) FROM t2 where uniform(1,10,c1) >= ALL(SELECT uniform(1,10,c1) FROM t2 where uniform(1,10,c1) > 5) order by 1;
+------+------------------+
| c1   | uniform(1,10,c1) |
+------+------------------+
|    2 |               10 |
+------+------------------+
SELECT c1,zipf(1,10,c1) FROM t2 where zipf(1,10,c1) <= ALL(SELECT zipf(1,10,c1) FROM t2 where zipf(1,10,c1) > 0) order by 1;
+------+---------------+
| c1   | zipf(1,10,c1) |
+------+---------------+
|    1 |             0 |
|    3 |             2 |
+------+---------------+
### CREATE AS
DROP TABLE t4;
CREATE TABLE t4 AS SELECT c1,random(c1) c2,randstr(5,c1) c3,normal(1,2,c1) c4,uniform(1,10,c1) c5,zipf(1,10,c1) c6 FROM t2;
SELECT * FROM t4 order by 1;
+------+----------------------+-------+---------------------+------+------+
| c1   | c2                   | c3    | c4                  | c5   | c6   |
+------+----------------------+-------+---------------------+------+------+
|    1 | -6753783847308464280 | GLC9O | 0.22633647675792012 |    2 |    0 |
|    2 |  7445180178319379020 | DAPMR | -0.1829602411067861 |   10 |    7 |
|    3 |  1084041170817055659 | CxcZU | -1.7166965217039651 |    6 |    2 |
+------+----------------------+-------+---------------------+------+------+
### INSERT INTO AS
INSERT INTO t4 SELECT 111,random(1),randstr(5,random(1)),normal(1,2,random(1)),uniform(1,10,random(1)),zipf(1,10,random(1)) FROM TABLE(generator(3));
SELECT * FROM t4 order by 1;
+------+----------------------+-------+---------------------+------+------+
| c1   | c2                   | c3    | c4                  | c5   | c6   |
+------+----------------------+-------+---------------------+------+------+
|    1 | -6753783847308464280 | GLC9O | 0.22633647675792012 |    2 |    0 |
|    2 |  7445180178319379020 | DAPMR | -0.1829602411067861 |   10 |    7 |
|    3 |  1084041170817055659 | CxcZU | -1.7166965217039651 |    6 |    2 |
|  111 | -6753783847308464280 | Z8bwj | -1.1668020685810387 |    4 |    0 |
|  111 | -6707106347154343346 | BQNIz |   1.548042646501783 |    2 |    0 |
|  111 |  -899926183391115878 | nMVCX |   5.471170747395348 |    9 |    6 |
+------+----------------------+-------+---------------------+------+------+
### UPDATE SET
UPDATE t4 e INNER JOIN t2 p ON e.c1 = p.c1 SET e.c2=random(1) where e.c1 = 101;
UPDATE t4 e INNER JOIN t2 p ON e.c1 = p.c1 SET e.c3=randstr(5,random(1)) where e.c1 = 102;
UPDATE t4 e INNER JOIN t2 p ON e.c1 = p.c1 SET e.c4=normal(1,2,random(1)) where e.c1 = 103;
SELECT * FROM t4 order by 1;
+------+----------------------+-------+---------------------+------+------+
| c1   | c2                   | c3    | c4                  | c5   | c6   |
+------+----------------------+-------+---------------------+------+------+
|    1 | -6753783847308464280 | GLC9O | 0.22633647675792012 |    2 |    0 |
|    2 |  7445180178319379020 | DAPMR | -0.1829602411067861 |   10 |    7 |
|    3 |  1084041170817055659 | CxcZU | -1.7166965217039651 |    6 |    2 |
|  111 | -6753783847308464280 | Z8bwj | -1.1668020685810387 |    4 |    0 |
|  111 | -6707106347154343346 | BQNIz |   1.548042646501783 |    2 |    0 |
|  111 |  -899926183391115878 | nMVCX |   5.471170747395348 |    9 |    6 |
+------+----------------------+-------+---------------------+------+------+
#WITH AS的SELECT
WITH a AS(
  SELECT id,random(c2) random,randstr(5,c2) randstr,normal(1,2,c2) normal,uniform(1,10,c2) uniform,zipf(1,10,c2) zipf 
  FROM t2)
SELECT a.id,a.random,a.randstr,a.normal,a.uniform,a.zipf FROM a ORDER BY a.id;
+------+----------------------+---------+---------------------+---------+------+
| id   | random               | randstr | normal              | uniform | zipf |
+------+----------------------+---------+---------------------+---------+------+
|    1 | -6166504658982550541 | wPIHu   |  1.9692873643275037 |       2 |    0 |
|    2 | -5769750714249136284 | tEVWx   |  1.5011740324425584 |       2 |    0 |
|    3 |  2034403572012397583 | s1ij0   | -1.9108987947763545 |       7 |    2 |
+------+----------------------+---------+---------------------+---------+------+
#模糊查询like 
SELECT id,random(id) FROM t1 where random(id) like '%0%' order by 1;
+----+----------------------+
| id | random(id)           |
+----+----------------------+
|  1 | -6753783847308464280 |
|  2 |  7445180178319379020 |
|  3 |  1084041170817055659 |
|  4 |  5267436225003336391 |
+----+----------------------+
SELECT id,randstr(5,id) FROM t1 where randstr(5,id) like '%A%' order by 1;
+----+---------------+
| id | randstr(5,id) |
+----+---------------+
|  2 | DAPMR         |
+----+---------------+
SELECT c1,normal(1,2,c1) FROM t2 where normal(1,2,c1) like '%1%' order by 1;
+------+---------------------+
| c1   | normal(1,2,c1)      |
+------+---------------------+
|    1 | 0.22633647675792012 |
|    2 | -0.1829602411067861 |
|    3 | -1.7166965217039651 |
+------+---------------------+
SELECT c1,uniform(1,10,c1) FROM t2 where uniform(1,10,c1) like '%1%' order by 1;
+------+------------------+
| c1   | uniform(1,10,c1) |
+------+------------------+
|    2 |               10 |
+------+------------------+
SELECT c1,zipf(1,10,c1) FROM t2 where zipf(1,10,c1) like '%2%' order by 1;
+------+---------------+
| c1   | zipf(1,10,c1) |
+------+---------------+
|    3 |             2 |
+------+---------------+
### 标签：table-function-2-2 insert
INSERT INTO t4 values(222,random(123),randstr(5,123),normal(1,2,123),uniform(1,10,123),zipf(1,10,123));
INSERT INTO t4 SELECT 333,random(1),randstr(5,random(1)),normal(1,2,random(1)),uniform(1,10,random(1)),zipf(1,10,random(1)) FROM TABLE(generator(3));
SELECT * FROM t4 order by 1;
+------+----------------------+-------+---------------------+------+------+
| c1   | c2                   | c3    | c4                  | c5   | c6   |
+------+----------------------+-------+---------------------+------+------+
|    1 | -6753783847308464280 | GLC9O | 0.22633647675792012 |    2 |    0 |
|    2 |  7445180178319379020 | DAPMR | -0.1829602411067861 |   10 |    7 |
|    3 |  1084041170817055659 | CxcZU | -1.7166965217039651 |    6 |    2 |
|  111 | -6753783847308464280 | Z8bwj | -1.1668020685810387 |    4 |    0 |
|  111 | -6707106347154343346 | BQNIz |   1.548042646501783 |    2 |    0 |
|  111 |  -899926183391115878 | nMVCX |   5.471170747395348 |    9 |    6 |
|  222 | -3445848496932922304 | GfmHu |  2.1141966552451867 |    4 |    0 |
|  333 | -6753783847308464280 | Z8bwj | -1.1668020685810387 |    4 |    0 |
|  333 | -6707106347154343346 | BQNIz |   1.548042646501783 |    2 |    0 |
|  333 |  -899926183391115878 | nMVCX |   5.471170747395348 |    9 |    6 |
+------+----------------------+-------+---------------------+------+------+
### 标签：table-function-2-3 update
UPDATE t3 SET c1 = random(123),c2 = randstr(5,123),c3 = normal(1,2,123),c4 = uniform(1,10,123),c5 = zipf(1,10,123) WHERE random(id)=random(1);
SELECT * FROM t3 order by 1;
+------+------------------------+-------+--------------------+------+------+
| id   | c1                     | c2    | c3                 | c4   | c5   |
+------+------------------------+-------+--------------------+------+------+
|    1 | -3.4458484969329224e18 | GfmHu | 2.1141966552451867 |    4 |    0 |
|    2 |                      2 | 12    |                 13 |   14 |   15 |
|    3 |                      3 | 23    |                 24 |   25 |   26 |
+------+------------------------+-------+--------------------+------+------+
### 标签：sha-2-4 delete
SELECT * FROM t4 order by 1;
+------+----------------------+-------+---------------------+------+------+
| c1   | c2                   | c3    | c4                  | c5   | c6   |
+------+----------------------+-------+---------------------+------+------+
|    1 | -6753783847308464280 | GLC9O | 0.22633647675792012 |    2 |    0 |
|    2 |  7445180178319379020 | DAPMR | -0.1829602411067861 |   10 |    7 |
|    3 |  1084041170817055659 | CxcZU | -1.7166965217039651 |    6 |    2 |
|  111 | -6753783847308464280 | Z8bwj | -1.1668020685810387 |    4 |    0 |
|  111 | -6707106347154343346 | BQNIz |   1.548042646501783 |    2 |    0 |
|  111 |  -899926183391115878 | nMVCX |   5.471170747395348 |    9 |    6 |
|  222 | -3445848496932922304 | GfmHu |  2.1141966552451867 |    4 |    0 |
|  333 | -6753783847308464280 | Z8bwj | -1.1668020685810387 |    4 |    0 |
|  333 | -6707106347154343346 | BQNIz |   1.548042646501783 |    2 |    0 |
|  333 |  -899926183391115878 | nMVCX |   5.471170747395348 |    9 |    6 |
+------+----------------------+-------+---------------------+------+------+
DELETE FROM t4 WHERE c2 = (select random(c1) from t2 where id = 2);
SELECT * FROM t4 order by 1;
+------+----------------------+-------+---------------------+------+------+
| c1   | c2                   | c3    | c4                  | c5   | c6   |
+------+----------------------+-------+---------------------+------+------+
|    1 | -6753783847308464280 | GLC9O | 0.22633647675792012 |    2 |    0 |
|    3 |  1084041170817055659 | CxcZU | -1.7166965217039651 |    6 |    2 |
|  111 | -6753783847308464280 | Z8bwj | -1.1668020685810387 |    4 |    0 |
|  111 | -6707106347154343346 | BQNIz |   1.548042646501783 |    2 |    0 |
|  111 |  -899926183391115878 | nMVCX |   5.471170747395348 |    9 |    6 |
|  222 | -3445848496932922304 | GfmHu |  2.1141966552451867 |    4 |    0 |
|  333 | -6753783847308464280 | Z8bwj | -1.1668020685810387 |    4 |    0 |
|  333 | -6707106347154343346 | BQNIz |   1.548042646501783 |    2 |    0 |
|  333 |  -899926183391115878 | nMVCX |   5.471170747395348 |    9 |    6 |
+------+----------------------+-------+---------------------+------+------+
### 标签：table-function-2-5 replace   
REPLACE INTO t2 values(4,uniform(1,10,123),zipf(1,10,123));
SELECT * FROM t2 order by 1;
+------+------+------+
| id   | c1   | c2   |
+------+------+------+
|    1 |    1 |   11 |
|    2 |    2 |   12 |
|    3 |    3 |   13 |
|    4 |    4 |    0 |
+------+------+------+
REPLACE INTO t2 values(4,zipf(1,10,3),uniform(1,10,3));
SELECT * FROM t2 order by 1;
+------+------+------+
| id   | c1   | c2   |
+------+------+------+
|    1 |    1 |   11 |
|    3 |    3 |   13 |
|    4 |    2 |    6 |
|    4 |    4 |    0 |
+------+------+------+
# Clean up users
drop user whh@'%';
