purge recyclebin;
result_format: 4
drop user whh@'%';
create user whh identified by 'whh';
grant all on *.* to whh WITH GRANT OPTION;


set ob_query_timeout = 10000000000;
------------------------------------------------------------------------------
######################## 标签：generator-1 1、表函数  ########################
######## generator-1-1  参数个数
###### generator-1-1-1 0个
SELECT COUNT(*) FROM TABLE(GENERATOR());
ERROR 42000: Incorrect parameter count in the call to native function 'GENERATOR'
###### generator-1-1-2 1个
#### N-参数值 - 常量
## 数值
SELECT COUNT(*) FROM TABLE(GENERATOR(-1));
+----------+
| COUNT(*) |
+----------+
|        0 |
+----------+
SELECT COUNT(*) FROM TABLE(GENERATOR(-1.2));
+----------+
| COUNT(*) |
+----------+
|        0 |
+----------+
SELECT COUNT(*) FROM TABLE(GENERATOR(-100));
+----------+
| COUNT(*) |
+----------+
|        0 |
+----------+
SELECT COUNT(*) FROM TABLE(GENERATOR(0));
+----------+
| COUNT(*) |
+----------+
|        0 |
+----------+
SELECT COUNT(*) FROM TABLE(GENERATOR(1));
+----------+
| COUNT(*) |
+----------+
|        1 |
+----------+
SELECT COUNT(*) FROM TABLE(GENERATOR(1000000));
+----------+
| COUNT(*) |
+----------+
|  1000000 |
+----------+
SELECT COUNT(*) FROM TABLE(GENERATOR(8000000));
+----------+
| COUNT(*) |
+----------+
|  8000000 |
+----------+
SELECT COUNT(*) FROM TABLE(GENERATOR('100000'));
+----------+
| COUNT(*) |
+----------+
|   100000 |
+----------+
SELECT COUNT(*) FROM TABLE(GENERATOR("100000"));
+----------+
| COUNT(*) |
+----------+
|   100000 |
+----------+
SELECT COUNT(*) FROM TABLE(GENERATOR(９９９９９９９));
ERROR HY000: Incorrect arguments to generator function. The argument should be a constant integer
SELECT COUNT(*) FROM TABLE(GENERATOR(-９));
ERROR HY000: Incorrect arguments to generator function. The argument should be a constant integer
SELECT COUNT(*) FROM TABLE(GENERATOR(3.1415));
+----------+
| COUNT(*) |
+----------+
|        3 |
+----------+
SELECT COUNT(*) FROM TABLE(GENERATOR(10.01));
+----------+
| COUNT(*) |
+----------+
|       10 |
+----------+
SELECT COUNT(*) FROM TABLE(GENERATOR(10.15));
+----------+
| COUNT(*) |
+----------+
|       10 |
+----------+
SELECT COUNT(*) FROM TABLE(GENERATOR(10.55));
+----------+
| COUNT(*) |
+----------+
|       11 |
+----------+
SELECT COUNT(*) FROM TABLE(GENERATOR(1.0E+5));
+----------+
| COUNT(*) |
+----------+
|   100000 |
+----------+
SELECT COUNT(*) FROM TABLE(GENERATOR(3.5E+5));
+----------+
| COUNT(*) |
+----------+
|   350000 |
+----------+
SELECT COUNT(*) FROM TABLE(GENERATOR(TRUE));
+----------+
| COUNT(*) |
+----------+
|        1 |
+----------+
SELECT COUNT(*) FROM TABLE(GENERATOR(FALSE));
+----------+
| COUNT(*) |
+----------+
|        0 |
+----------+
SELECT COUNT(*) FROM TABLE(GENERATOR(1+2-30*2/3));
ERROR HY000: Incorrect arguments to generator function. The argument should be a constant integer
SELECT COUNT(*) FROM TABLE(GENERATOR(1+20-30*2/3));
ERROR HY000: Incorrect arguments to generator function. The argument should be a constant integer
SELECT COUNT(*) FROM TABLE(GENERATOR(!5|2&2|3^2));
ERROR HY000: Incorrect arguments to generator function. The argument should be a constant integer
SELECT COUNT(*) FROM TABLE(GENERATOR(4>=2));
ERROR HY000: Incorrect arguments to generator function. The argument should be a constant integer
SELECT COUNT(*) FROM TABLE(GENERATOR(4<=2));
ERROR HY000: Incorrect arguments to generator function. The argument should be a constant integer
SELECT COUNT(*) FROM TABLE(GENERATOR(2<<2));
ERROR HY000: Incorrect arguments to generator function. The argument should be a constant integer
SELECT COUNT(*) FROM TABLE(GENERATOR(2>>2));
ERROR HY000: Incorrect arguments to generator function. The argument should be a constant integer
## 非数值
SELECT COUNT(*) FROM TABLE(GENERATOR(NULL));
ERROR HY000: Incorrect arguments to generator function. The argument should be an integer.
SELECT COUNT(*) FROM TABLE(GENERATOR(''));
+----------+
| COUNT(*) |
+----------+
|        0 |
+----------+
SELECT COUNT(*) FROM TABLE(GENERATOR(' '));
+----------+
| COUNT(*) |
+----------+
|        0 |
+----------+
SELECT COUNT(*) FROM TABLE(GENERATOR('good'));
+----------+
| COUNT(*) |
+----------+
|        0 |
+----------+
SELECT COUNT(*) FROM TABLE(GENERATOR('好'));
+----------+
| COUNT(*) |
+----------+
|        0 |
+----------+
SELECT COUNT(*) FROM TABLE(GENERATOR('良い'));
+----------+
| COUNT(*) |
+----------+
|        0 |
+----------+
SELECT COUNT(*) FROM TABLE(GENERATOR('abc123'));
+----------+
| COUNT(*) |
+----------+
|        0 |
+----------+
SELECT COUNT(*) FROM TABLE(GENERATOR('123abc'));
+----------+
| COUNT(*) |
+----------+
|      123 |
+----------+
SELECT COUNT(*) FROM TABLE(GENERATOR('!@#$%^&*'));
+----------+
| COUNT(*) |
+----------+
|        0 |
+----------+
SELECT COUNT(*) FROM TABLE(GENERATOR('\n'));
+----------+
| COUNT(*) |
+----------+
|        0 |
+----------+
SELECT COUNT(*) FROM TABLE(GENERATOR('\r'));
+----------+
| COUNT(*) |
+----------+
|        0 |
+----------+
SELECT COUNT(*) FROM TABLE(GENERATOR('\t'));
+----------+
| COUNT(*) |
+----------+
|        0 |
+----------+
SELECT COUNT(*) FROM TABLE(GENERATOR(date'2023-02-13'));
+----------+
| COUNT(*) |
+----------+
| 20230213 |
+----------+
SELECT COUNT(*) FROM TABLE(GENERATOR('2024'));
+----------+
| COUNT(*) |
+----------+
|     2024 |
+----------+
#### N-参数值 - 常量以外场景
## 变量
drop procedure p0;//
create procedure p0(in inval int) 
begin
  declare var int;
  set var = 20; 
  SELECT COUNT(*) into @res1 FROM TABLE(GENERATOR(inval));
  SELECT COUNT(*) into @res2 FROM TABLE(GENERATOR(var));
end;
//
set @res1=null,@res2=null;
call p0(10);
select @res1,@res2 from dual;
+-------+-------+
| @res1 | @res2 |
+-------+-------+
|    10 |    20 |
+-------+-------+
## 表列字段
drop table t1;
create table t1 (a int);
insert into t1 values(30);
SELECT COUNT(g.*) FROM TABLE(GENERATOR(t1.a)) g,t1;
ERROR HY000: Incorrect arguments to generator function. The argument should be a constant integer
## 内置函数
SELECT COUNT(*) FROM TABLE(GENERATOR(abs(-40)));
ERROR HY000: Incorrect arguments to generator function. The argument should be a constant integer
SELECT COUNT(*) FROM TABLE(GENERATOR(floor(3.54)));
ERROR HY000: Incorrect arguments to generator function. The argument should be a constant integer
SELECT COUNT(*) FROM TABLE(GENERATOR(ceil(3.54)));
ERROR HY000: Incorrect arguments to generator function. The argument should be a constant integer
## 随机函数
SELECT COUNT(*) FROM TABLE(GENERATOR(rand(1)));
ERROR HY000: Incorrect arguments to generator function. The argument should be a constant integer
SELECT COUNT(*) FROM TABLE(GENERATOR(random(1)));
ERROR HY000: Incorrect arguments to generator function. The argument should be a constant integer
## 自定义函数
drop function f0;//
create function f0() returns int
begin
  return 50;
end;
//
SELECT COUNT(*) FROM TABLE(GENERATOR(f0));
ERROR HY000: Incorrect arguments to generator function. The argument should be a constant integer
## 用户自定义变量
set @userval=60;
SELECT COUNT(*) FROM TABLE(GENERATOR(@userval));
ERROR HY000: Incorrect arguments to generator function. The argument should be a constant integer
## sql语句
SELECT COUNT(*) FROM TABLE(GENERATOR((select 10 from dual)));
ERROR HY000: Incorrect arguments to generator function. The argument should be a constant integer
###### generator-1-1-3 >1个
SELECT COUNT(*) FROM TABLE(GENERATOR(1,2));
ERROR 42000: Incorrect parameter count in the call to native function 'GENERATOR'
SELECT COUNT(*) FROM TABLE(GENERATOR(1,2,3));
ERROR 42000: Incorrect parameter count in the call to native function 'GENERATOR'
SELECT COUNT(*) FROM TABLE(GENERATOR(1,2,3,4));
ERROR 42000: Incorrect parameter count in the call to native function 'GENERATOR'
######## generator-1-2  功能点测试
###### 配合随机/分布函数使用
select rand(1) from table(generator(5));
+---------------------+
| rand(1)             |
+---------------------+
| 0.40540353712197724 |
|  0.8716141803857071 |
|  0.1418603212962489 |
| 0.09445909605776807 |
| 0.04671454713373868 |
+---------------------+
select rand(123) from table(generator(5));
+--------------------+
| rand(123)          |
+--------------------+
| 0.9277428611440052 |
| 0.4609715924234796 |
| 0.5216294094190276 |
| 0.2252323005583438 |
| 0.5612733052682815 |
+--------------------+
select random(1) from table(generator(5));
+----------------------+
| random(1)            |
+----------------------+
| -6753783847308464280 |
| -6707106347154343346 |
|  -899926183391115878 |
| -8835543475904200562 |
| -2750444335953844424 |
+----------------------+
select random(123) from table(generator(5));
+----------------------+
| random(123)          |
+----------------------+
| -3445848496932922304 |
|  1032632488948585963 |
|  8084933221873407293 |
|  4359373536036025982 |
| -5674079147706729428 |
+----------------------+
select randstr(1,123) str from table(generator(5));
+------+
| str  |
+------+
| G    |
| G    |
| G    |
| G    |
| G    |
+------+
select randstr(1,random(1)) str from table(generator(5));
+------+
| str  |
+------+
| Z    |
| B    |
| n    |
| Z    |
| f    |
+------+
select randstr(1,zipf(1,5,random(1))) str from table(generator(5));
+------+
| str  |
+------+
| H    |
| H    |
| C    |
| C    |
| 9    |
+------+
select randstr(1,normal(0,1,random(1))) str from table(generator(5));
+------+
| str  |
+------+
| K    |
| H    |
| D    |
| H    |
| K    |
+------+
select randstr(1,uniform(0,10,random(1))) str from table(generator(5));
+------+
| str  |
+------+
| C    |
| G    |
| 0    |
| 0    |
| x    |
+------+
select zipf(1,5,random(1)) from table(generator(5));
+---------------------+
| zipf(1,5,random(1)) |
+---------------------+
|                   0 |
|                   0 |
|                   3 |
|                   3 |
|                   4 |
+---------------------+
select normal(0,1,random(1)) from table(generator(5));
+-----------------------+
| normal(0,1,random(1)) |
+-----------------------+
|   -1.0834010342905194 |
|   0.27402132325089146 |
|     2.235585373697674 |
|   0.09087858991550991 |
|   -0.7761979011260313 |
+-----------------------+
select uniform(0,10,random(1)) from table(generator(5));
+-------------------------+
| uniform(0,10,random(1)) |
+-------------------------+
|                       3 |
|                       1 |
|                       9 |
|                       9 |
|                      10 |
+-------------------------+
###### 验证 N 取不同值时对输出结果影响
SELECT COUNT(*) FROM TABLE(GENERATOR(1));
+----------+
| COUNT(*) |
+----------+
|        1 |
+----------+
SELECT COUNT(*) FROM TABLE(GENERATOR(10));
+----------+
| COUNT(*) |
+----------+
|       10 |
+----------+
SELECT COUNT(*) FROM TABLE(GENERATOR(100));
+----------+
| COUNT(*) |
+----------+
|      100 |
+----------+
SELECT COUNT(*) FROM TABLE(GENERATOR(1000));
+----------+
| COUNT(*) |
+----------+
|     1000 |
+----------+
SELECT COUNT(*) FROM TABLE(GENERATOR(10000));
+----------+
| COUNT(*) |
+----------+
|    10000 |
+----------+
SELECT COUNT(*) FROM TABLE(GENERATOR(100000));
+----------+
| COUNT(*) |
+----------+
|   100000 |
+----------+
SELECT COUNT(*) FROM TABLE(GENERATOR(1000000));
+----------+
| COUNT(*) |
+----------+
|  1000000 |
+----------+
###### GENERATOR(N) 出现在 table function 内部以外场景
select * from generator(20);
ERROR 42000: You have an error in your SQL syntax; check the manual that corresponds to your OceanBase version for the right syntax to use near '(20)' at line 1
select generator(20) from dual;
ERROR 42000: Incorrect parameters in the call to native function 'generator'
select * from generator(20) where generator(20) > 3;
ERROR 42000: You have an error in your SQL syntax; check the manual that corresponds to your OceanBase version for the right syntax to use near '(20) where generator(20) > 3' at line 1
select * from table(generator(20)) where generator(20) > 3;
ERROR 42000: Incorrect parameters in the call to native function 'generator'
select * from table(generator(20) + generator(20));
ERROR 42000: You have an error in your SQL syntax; check the manual that corresponds to your OceanBase version for the right syntax to use near '+ generator(20))' at line 1
select abs(generator(20)) from dual;
ERROR 42000: Incorrect parameters in the call to native function 'generator'
###### TABLE(GENERATOR(N))和其他表关联
DROP TABLE t1;
CREATE TABLE t1 (a INT);
INSERT INTO t1 VALUES(123);
INSERT INTO t1 VALUES(456);
## 集合运算
SELECT 123 FROM TABLE(GENERATOR(5))
UNION
SELECT * FROM t1;
+------+
| 123  |
+------+
|  123 |
|  456 |
+------+
SELECT 123 FROM TABLE(GENERATOR(5))
INTERSECT
SELECT * FROM t1;
+------+
| 123  |
+------+
|  123 |
+------+
SELECT 123 FROM TABLE(GENERATOR(5))
EXCEPT
SELECT * FROM t1;
+------+
| 123  |
+------+
+------+
## 多表连接
SELECT * FROM (SELECT 123 as b FROM TABLE(GENERATOR(5))) g left join t1 on g.b=t1.a;
+-----+------+
| b   | a    |
+-----+------+
| 123 |  123 |
| 123 |  123 |
| 123 |  123 |
| 123 |  123 |
| 123 |  123 |
+-----+------+
SELECT * FROM (SELECT 123 as b FROM TABLE(GENERATOR(5))) g right join t1 on g.b=t1.a;
+-----+------+
| b   | a    |
+-----+------+
| 123 |  123 |
| 123 |  123 |
| 123 |  123 |
| 123 |  123 |
| 123 |  123 |
| NULL |  456 |
+-----+------+
SELECT * FROM (SELECT 123 as b FROM TABLE(GENERATOR(5))) g inner join t1 on g.b=t1.a;
+-----+------+
| b   | a    |
+-----+------+
| 123 |  123 |
| 123 |  123 |
| 123 |  123 |
| 123 |  123 |
| 123 |  123 |
+-----+------+
## select 后面添加具体的表达式
drop function f0;//
create function f0() returns int
begin
  return 444;
end;
//
set @var = 222;
SELECT 111 FROM TABLE(GENERATOR(5));
+-----+
| 111 |
+-----+
| 111 |
| 111 |
| 111 |
| 111 |
| 111 |
+-----+
SELECT @var FROM TABLE(GENERATOR(5));
+------+
| @var |
+------+
|  222 |
|  222 |
|  222 |
|  222 |
|  222 |
+------+
SELECT abs(-333) FROM TABLE(GENERATOR(5));
+-----------+
| abs(-333) |
+-----------+
|       333 |
|       333 |
|       333 |
|       333 |
|       333 |
+-----------+
SELECT f0 FROM TABLE(GENERATOR(5));
+------+
| f0   |
+------+
|  444 |
|  444 |
|  444 |
|  444 |
|  444 |
+------+
SELECT * FROM TABLE(GENERATOR(10));
+--------------+
| COLUMN_VALUE |
+--------------+
|            1 |
|            2 |
|            3 |
|            4 |
|            5 |
|            6 |
|            7 |
|            8 |
|            9 |
|           10 |
+--------------+
## TABLE(GENERATOR(N)) 表字段和表起别名
SELECT 123 col FROM TABLE(GENERATOR(5));
+-----+
| col |
+-----+
| 123 |
| 123 |
| 123 |
| 123 |
| 123 |
+-----+
SELECT 123 as col FROM TABLE(GENERATOR(5));
+-----+
| col |
+-----+
| 123 |
| 123 |
| 123 |
| 123 |
| 123 |
+-----+
SELECT 123 col FROM TABLE(GENERATOR(5)) gen;
+-----+
| col |
+-----+
| 123 |
| 123 |
| 123 |
| 123 |
| 123 |
+-----+
SELECT 123 col FROM TABLE(GENERATOR(5)) as gen;
+-----+
| col |
+-----+
| 123 |
| 123 |
| 123 |
| 123 |
| 123 |
+-----+
SELECT 123 as col FROM TABLE(GENERATOR(5)) as gen;
+-----+
| col |
+-----+
| 123 |
| 123 |
| 123 |
| 123 |
| 123 |
+-----+
## TABLE(GENERATOR(N)) 表进行插入或删除操作
insert into TABLE(GENERATOR(1)) values (1);
ERROR 42000: You have an error in your SQL syntax; check the manual that corresponds to your OceanBase version for the right syntax to use near 'TABLE(GENERATOR(1)) values (1)' at line 1
delete from TABLE(GENERATOR(1));
ERROR 42000: Incorrect parameters in the call to native function 'GENERATOR'
update TABLE(GENERATOR(1)) set column_value=2;
ERROR 42000: Incorrect parameters in the call to native function 'GENERATOR'
## TABLE(GENERATOR(N)) 表SELECT 后添加其他子句
SELECT random(1) a,123 b FROM TABLE(GENERATOR(10)) where a > 5;
ERROR 42S22: Unknown column 'a' in 'where clause'
SELECT random(1) a FROM TABLE(GENERATOR(10)) where 6 > 5;
+----------------------+
| a                    |
+----------------------+
| -6753783847308464280 |
| -6707106347154343346 |
|  -899926183391115878 |
| -8835543475904200562 |
| -2750444335953844424 |
|  7588216632478230601 |
|  -539527926654447180 |
| -7850472369986385143 |
|  1288452476385911040 |
|  2494575675009433616 |
+----------------------+
SELECT random(1) a FROM TABLE(GENERATOR(10)) order by 1;
+----------------------+
| a                    |
+----------------------+
| -8835543475904200562 |
| -7850472369986385143 |
| -6753783847308464280 |
| -6707106347154343346 |
| -2750444335953844424 |
|  -899926183391115878 |
|  -539527926654447180 |
|  1288452476385911040 |
|  2494575675009433616 |
|  7588216632478230601 |
+----------------------+
SELECT distinct random(1) FROM TABLE(GENERATOR(10));
+----------------------+
| random(1)            |
+----------------------+
| -6753783847308464280 |
| -6707106347154343346 |
|  -899926183391115878 |
| -8835543475904200562 |
| -2750444335953844424 |
|  7588216632478230601 |
|  -539527926654447180 |
| -7850472369986385143 |
|  1288452476385911040 |
|  2494575675009433616 |
+----------------------+
SELECT distinct random(123) FROM TABLE(GENERATOR(10));
+----------------------+
| random(123)          |
+----------------------+
| -3445848496932922304 |
|  1032632488948585963 |
|  8084933221873407293 |
|  4359373536036025982 |
| -5674079147706729428 |
| -5623673212186659420 |
|  8318739604675415080 |
| -3865600016783140402 |
|  5886030532686412245 |
|  -217493953219567568 |
+----------------------+
SELECT random(1) FROM TABLE(GENERATOR(10)) limit 5;
+----------------------+
| random(1)            |
+----------------------+
| -6753783847308464280 |
| -6707106347154343346 |
|  -899926183391115878 |
| -8835543475904200562 |
| -2750444335953844424 |
+----------------------+
SELECT random(1) a,123 b FROM TABLE(GENERATOR(10)) group by a having a > 2;
+---------------------+-----+
| a                   | b   |
+---------------------+-----+
| 7588216632478230601 | 123 |
| 1288452476385911040 | 123 |
| 2494575675009433616 | 123 |
+---------------------+-----+
# Clean up users
drop user whh@'%';
