set GLOBAL ob_query_timeout = 1000000000000;
set GLOBAL ob_trx_timeout = 1000000000000;
set GLOBAL ob_trx_idle_timeout = 10000000000;
alter system set minor_compact_trigger = 10;
drop table if exists test_point_select_for_block_format;
create table test_point_select_for_block_format(c1 varchar(100) primary key, c2 int);
insert into test_point_select_for_block_format values ('0',0);
insert into test_point_select_for_block_format values ('1',1);
insert into test_point_select_for_block_format values ('2',2);
insert into test_point_select_for_block_format values ('3',3);
insert into test_point_select_for_block_format values ('4',4);
insert into test_point_select_for_block_format values ('5',5);
insert into test_point_select_for_block_format values ('6',6);
insert into test_point_select_for_block_format values ('7',7);
insert into test_point_select_for_block_format values ('8',8);
insert into test_point_select_for_block_format values ('9',9);
insert into test_point_select_for_block_format values ('10',10);
insert into test_point_select_for_block_format values ('11',11);
insert into test_point_select_for_block_format values ('12',12);
insert into test_point_select_for_block_format values ('13','13');
insert into test_point_select_for_block_format values ('14','14');
insert into test_point_select_for_block_format values ('15',15);
insert into test_point_select_for_block_format values ('16',16);
alter system minor freeze;
select * from test_point_select_for_block_format where c1 = '0';
c1	c2
0	0
select * from test_point_select_for_block_format where c1 = '1';
c1	c2
1	1
select * from test_point_select_for_block_format where c1 = '2';
c1	c2
2	2
select * from test_point_select_for_block_format where c1 = '3';
c1	c2
3	3
select * from test_point_select_for_block_format where c1 = '4';
c1	c2
4	4
select * from test_point_select_for_block_format where c1 = '5';
c1	c2
5	5
select * from test_point_select_for_block_format where c1 = '6';
c1	c2
6	6
select * from test_point_select_for_block_format where c1 = '7';
c1	c2
7	7
select * from test_point_select_for_block_format where c1 = '8';
c1	c2
8	8
select * from test_point_select_for_block_format where c1 = '9';
c1	c2
9	9
select * from test_point_select_for_block_format where c1 = '10';
c1	c2
10	10
select * from test_point_select_for_block_format where c1 = '11';
c1	c2
11	11
select * from test_point_select_for_block_format where c1 = '12';
c1	c2
12	12
select * from test_point_select_for_block_format where c1 = '13';
c1	c2
13	13
select * from test_point_select_for_block_format where c1 = '14';
c1	c2
14	14
select * from test_point_select_for_block_format where c1 = '15';
c1	c2
15	15
select * from test_point_select_for_block_format where c1 = '16';
c1	c2
16	16
drop table if exists test_point_select_for_block_format;
create table test_point_select_for_block_format(c1 varchar(100) primary key, c2 int);
insert into test_point_select_for_block_format values ('0',0);
insert into test_point_select_for_block_format values ('1',1);
insert into test_point_select_for_block_format values ('2',2);
insert into test_point_select_for_block_format values ('3',3);
insert into test_point_select_for_block_format values ('4',4);
insert into test_point_select_for_block_format values ('5',5);
insert into test_point_select_for_block_format values ('6',6);
insert into test_point_select_for_block_format values ('7',7);
insert into test_point_select_for_block_format values ('8',8);
insert into test_point_select_for_block_format values ('9',9);
insert into test_point_select_for_block_format values ('10',10);
insert into test_point_select_for_block_format values ('11',11);
insert into test_point_select_for_block_format values ('12',12);
insert into test_point_select_for_block_format values ('13','13');
insert into test_point_select_for_block_format values ('14','14');
insert into test_point_select_for_block_format values ('15',15);
insert into test_point_select_for_block_format values ('16',16);
set session transaction isolation level repeatable read;
begin;
select * from test_point_select_for_block_format where c1 = '6';
c1	c2
6	6
update test_point_select_for_block_format set c2 = -6 where c1 = '6';
update test_point_select_for_block_format set c2 = -1 where c1 = '1';
begin;
insert into test_point_select_for_block_format values ('17',17);
alter system minor freeze;
commit;
select * from test_point_select_for_block_format where c1 = '0';
c1	c2
0	0
select * from test_point_select_for_block_format where c1 = '1';
c1	c2
1	-1
select * from test_point_select_for_block_format where c1 = '2';
c1	c2
2	2
select * from test_point_select_for_block_format where c1 = '3';
c1	c2
3	3
select * from test_point_select_for_block_format where c1 = '4';
c1	c2
4	4
select * from test_point_select_for_block_format where c1 = '5';
c1	c2
5	5
select * from test_point_select_for_block_format where c1 = '6';
c1	c2
6	-6
select * from test_point_select_for_block_format where c1 = '7';
c1	c2
7	7
select * from test_point_select_for_block_format where c1 = '8';
c1	c2
8	8
select * from test_point_select_for_block_format where c1 = '9';
c1	c2
9	9
select * from test_point_select_for_block_format where c1 = '10';
c1	c2
10	10
select * from test_point_select_for_block_format where c1 = '11';
c1	c2
11	11
select * from test_point_select_for_block_format where c1 = '12';
c1	c2
12	12
select * from test_point_select_for_block_format where c1 = '13';
c1	c2
13	13
select * from test_point_select_for_block_format where c1 = '14';
c1	c2
14	14
select * from test_point_select_for_block_format where c1 = '15';
c1	c2
15	15
select * from test_point_select_for_block_format where c1 = '16';
c1	c2
16	16
select * from test_point_select_for_block_format where c1 = '17';
c1	c2
17	17
select * from test_point_select_for_block_format where c1 = '0';
c1	c2
0	0
select * from test_point_select_for_block_format where c1 = '1';
c1	c2
1	1
select * from test_point_select_for_block_format where c1 = '2';
c1	c2
2	2
select * from test_point_select_for_block_format where c1 = '3';
c1	c2
3	3
select * from test_point_select_for_block_format where c1 = '4';
c1	c2
4	4
select * from test_point_select_for_block_format where c1 = '5';
c1	c2
5	5
select * from test_point_select_for_block_format where c1 = '6';
c1	c2
6	6
select * from test_point_select_for_block_format where c1 = '7';
c1	c2
7	7
select * from test_point_select_for_block_format where c1 = '8';
c1	c2
8	8
select * from test_point_select_for_block_format where c1 = '9';
c1	c2
9	9
select * from test_point_select_for_block_format where c1 = '10';
c1	c2
10	10
select * from test_point_select_for_block_format where c1 = '11';
c1	c2
11	11
select * from test_point_select_for_block_format where c1 = '12';
c1	c2
12	12
select * from test_point_select_for_block_format where c1 = '13';
c1	c2
13	13
select * from test_point_select_for_block_format where c1 = '14';
c1	c2
14	14
select * from test_point_select_for_block_format where c1 = '15';
c1	c2
15	15
select * from test_point_select_for_block_format where c1 = '16';
c1	c2
16	16
select * from test_point_select_for_block_format where c1 = '17';
c1	c2
commit;
select * from test_point_select_for_block_format where c1 = '0';
c1	c2
0	0
select * from test_point_select_for_block_format where c1 = '1';
c1	c2
1	-1
select * from test_point_select_for_block_format where c1 = '2';
c1	c2
2	2
select * from test_point_select_for_block_format where c1 = '3';
c1	c2
3	3
select * from test_point_select_for_block_format where c1 = '4';
c1	c2
4	4
select * from test_point_select_for_block_format where c1 = '5';
c1	c2
5	5
select * from test_point_select_for_block_format where c1 = '6';
c1	c2
6	-6
select * from test_point_select_for_block_format where c1 = '7';
c1	c2
7	7
select * from test_point_select_for_block_format where c1 = '8';
c1	c2
8	8
select * from test_point_select_for_block_format where c1 = '9';
c1	c2
9	9
select * from test_point_select_for_block_format where c1 = '10';
c1	c2
10	10
select * from test_point_select_for_block_format where c1 = '11';
c1	c2
11	11
select * from test_point_select_for_block_format where c1 = '12';
c1	c2
12	12
select * from test_point_select_for_block_format where c1 = '13';
c1	c2
13	13
select * from test_point_select_for_block_format where c1 = '14';
c1	c2
14	14
select * from test_point_select_for_block_format where c1 = '15';
c1	c2
15	15
select * from test_point_select_for_block_format where c1 = '16';
c1	c2
16	16
select * from test_point_select_for_block_format where c1 = '17';
c1	c2
17	17
drop table if exists test_point_select_for_block_format;
create table test_point_select_for_block_format(c1 varchar(100) primary key, c2 int);
insert into test_point_select_for_block_format values ('0',0);
insert into test_point_select_for_block_format values ('1',1);
insert into test_point_select_for_block_format values ('2',2);
insert into test_point_select_for_block_format values ('3',3);
insert into test_point_select_for_block_format values ('4',4);
insert into test_point_select_for_block_format values ('5',5);
insert into test_point_select_for_block_format values ('6',6);
insert into test_point_select_for_block_format values ('7',7);
insert into test_point_select_for_block_format values ('8',8);
insert into test_point_select_for_block_format values ('9',9);
insert into test_point_select_for_block_format values ('10',10);
insert into test_point_select_for_block_format values ('11',11);
insert into test_point_select_for_block_format values ('12',12);
insert into test_point_select_for_block_format values ('13','13');
insert into test_point_select_for_block_format values ('14','14');
insert into test_point_select_for_block_format values ('15',15);
insert into test_point_select_for_block_format values ('16',16);
alter system minor freeze;
alter system major freeze;
select * from test_point_select_for_block_format where c1 = '0';
c1	c2
0	0
select * from test_point_select_for_block_format where c1 = '1';
c1	c2
1	1
select * from test_point_select_for_block_format where c1 = '2';
c1	c2
2	2
select * from test_point_select_for_block_format where c1 = '3';
c1	c2
3	3
select * from test_point_select_for_block_format where c1 = '4';
c1	c2
4	4
select * from test_point_select_for_block_format where c1 = '5';
c1	c2
5	5
select * from test_point_select_for_block_format where c1 = '6';
c1	c2
6	6
select * from test_point_select_for_block_format where c1 = '7';
c1	c2
7	7
select * from test_point_select_for_block_format where c1 = '8';
c1	c2
8	8
select * from test_point_select_for_block_format where c1 = '9';
c1	c2
9	9
select * from test_point_select_for_block_format where c1 = '10';
c1	c2
10	10
select * from test_point_select_for_block_format where c1 = '11';
c1	c2
11	11
select * from test_point_select_for_block_format where c1 = '12';
c1	c2
12	12
select * from test_point_select_for_block_format where c1 = '13';
c1	c2
13	13
select * from test_point_select_for_block_format where c1 = '14';
c1	c2
14	14
select * from test_point_select_for_block_format where c1 = '15';
c1	c2
15	15
select * from test_point_select_for_block_format where c1 = '16';
c1	c2
16	16
select * from test_point_select_for_block_format where c1 = '17';
c1	c2
drop table test_point_select_for_block_format;
