drop database if exists select_bug;
create database select_bug;
use select_bug;
create table t1(c1 int, c2 int);
create table t2(c1 int, c2 int);
create table t3(c1 int);
insert into t1 values (10,1),(3,1),(3,2);
insert into t2 values (2,1);
insert into t3 values (5);
select * from (t1);
c1	c2
10	1
3	1
3	2
select * from (t1,(t2));
c1	c2	c1	c2
10	1	2	1
3	1	2	1
3	2	2	1
select * from (t3,((t1,t2)));
c1	c1	c2	c1	c2
5	10	1	2	1
5	3	1	2	1
5	3	2	2	1
select * from t1 join t2 join t3;
c1	c2	c1	c2	c1
10	1	2	1	5
3	1	2	1	5
3	2	2	1	5
select * from (t1 join t2) join t3;
c1	c2	c1	c2	c1
10	1	2	1	5
3	1	2	1	5
3	2	2	1	5
select * from (t1 join t2) join (select * from t3) a;
c1	c2	c1	c2	c1
10	1	2	1	5
3	1	2	1	5
3	2	2	1	5
select * from ((t1 join t2) join (select * from t3) a);
c1	c2	c1	c2	c1
10	1	2	1	5
3	1	2	1	5
3	2	2	1	5
drop table if exists t1,t2,t3;
create table t1(c1 int,c2 int);
insert into t1 values(1,1),(2,2),(3,3);
delete from t1 where c1 in (select max(c1) from t1 t2);
select * from t1;
c1	c2
1	1
2	2
delete from t1 where c1 in (select min(c2) from (select max(c1) as c2 from t1 ) t2);
select * from t1;
c1	c2
1	1
insert into t1 values (2,2),(3,3);
update t1 set c1 = 5 where c1 in (select max(c1) from t1);
select * from t1;
c1	c2
1	1
2	2
5	3
drop table t1;
create table t1(c1 int, c2 int);
create index idx on t1(c2);
insert into t1 values(1,1),(2,2),(3,3);
select * from t1 use key();
c1	c2
1	1
2	2
3	3
select * from t1 force index();
ERROR 42000: You have an error in your SQL syntax; check the manual that corresponds to your OceanBase version for the right syntax to use near ')' at line 1
select * from t1 ignore index();
ERROR 42000: You have an error in your SQL syntax; check the manual that corresponds to your OceanBase version for the right syntax to use near ')' at line 1
select * from t1 use key(idx);
c1	c2
1	1
2	2
3	3
select * from t1 force index(idx);
c1	c2
1	1
2	2
3	3
select * from t1 ignore key(idx);
c1	c2
1	1
2	2
3	3
select * from t1 use key(a);
c1	c2
1	1
2	2
3	3
select * from t1 force index(a);
c1	c2
1	1
2	2
3	3
select * from t1 ignore key(a);
c1	c2
1	1
2	2
3	3
drop table t1;
SELECT a.x FROM (SELECT 1 AS x) AS a HAVING a.x = 1;
x
1
create table t1(c1 int,c2 int);
insert into t1 values(1,1),(2,2);
select a.c1 from (select c1 from t1) as a having a.c1 = 1;
c1
1
drop table t1;
create table t1 (c1 int);
insert into t1 values (1);
select * from t1 where 'a' not like 'b' and ((c1 < 2 and false) or (c1 < 2 and c1 is not null)) ;
c1
1
select * from t1 where 'a' not like 'b' and ((false) or (c1 < 2 and c1 is not null));
c1
1
drop table t1;
create table t1 (c1 int, c2 int);
create table t2 (c1 int, c2 int);
insert into t1 values(1,2),(3,4);
select * from t1 group by 1>(select count(*) from t2);
c1	c2
1	2
select * from t1 order by 1>(select count(*) from t2);
c1	c2
1	2
3	4
select (1>(select count(*) from t2)) from t1;
(1>(select count(*) from t2))
1
1
select * from t1 where 1>(select count(*) from t2);
c1	c2
1	2
3	4
select (1>(select count(*) from t2)) from t1 union select c1 from t2;
(1>(select count(*) from t2))
1
select * from t1 group by 1>(select count(*) from t2) union select * from t2;
c1	c2
1	2
(select * from t1 order by 1>(select count(*) from t2)) intersect select * from t2;
c1	c2
select * from t1 where 1>(select count(*) from t2) union select * from t2;
c1	c2
1	2
3	4
insert into t2 values(1,2);
select * from t1 group by 1>(select count(*) from t2);
c1	c2
1	2
select * from t1 order by 1>(select count(*) from t2);
c1	c2
1	2
3	4
select (1>(select count(*) from t2)) from t1;
(1>(select count(*) from t2))
0
0
select * from t1 where 1>(select count(*) from t2);
c1	c2
select (1>(select count(*) from t2)) from t1 union select c1 from t2;
(1>(select count(*) from t2))
0
1
select * from t1 group by 1>(select count(*) from t2) union select * from t2;
c1	c2
1	2
(select * from t1 order by 1>(select count(*) from t2)) intersect select * from t2;
c1	c2
1	2
select * from t1 where 1>(select count(*) from t2) union select * from t2;
c1	c2
1	2
drop table t1,t2;
create table t1 (a int not null, b char (10) not null) partition by hash(a) partitions 3;
insert into t1 value(11,22);
(select count(*) from t1) UNION (select count(*) from t1);
count(*)
1
select min(2) from t1;
min(2)
2
select max(2) from t1;
max(2)
2
select sum(2) from t1;
sum(2)
2
select avg(2) from t1;
avg(2)
2.0000
drop table t1;
create table t1 (id int, value varchar(4096));
insert into t1 values
(1, '/usr/local/mysql/data/'),(2, ''),(3, '1');
select max(t3.value) from t1 as t3, t1 t4 where t3.value = t4.value;
max(t3.value)
1
drop table t1;
select /*+query_timeout;
ERROR 42000: You have an error in your SQL syntax; check the manual that corresponds to your OceanBase version for the right syntax to use near 'query_timeout' at line 1
select /*+ query_timeout;
ERROR 42000: You have an error in your SQL syntax; check the manual that corresponds to your OceanBase version for the right syntax to use near 'query_timeout' at line 1
select /*+ 32345;
ERROR 42000: You have an error in your SQL syntax; check the manual that corresponds to your OceanBase version for the right syntax to use near '32345' at line 1
create table t1(c1 int);
create table t2(c1 int);
select * from t1, t2 for update wait 1;
c1	c1
drop table t1, t2;
select * from oceanbase.__all_virtual_database partition(p20);
ERROR HY000: Unkown partition 'p20' in table '__all_virtual_database'
drop table if exists jx_ts;
create table jx_ts (id int, purchased date, primary key(id, purchased))partition by range(year(purchased)) subpartition by hash(to_days(purchased)) subpartitions 2 (partition p0 values less than (1990), partition p1 values less than (2000), partition p2 values less than maxvalue);
select * from jx_ts partition(p1sp0);
id	purchased
drop table jx_ts;
drop table if exists jx_t1;
create table jx_t1(c1 int primary key) partition by range(c1) (partition p0 values less than (10));
select * from jx_t1 partition(p10);
ERROR HY000: Unkown partition 'p10' in table 'jx_t1'
select * from jx_t1 partition(p0);
c1
drop table jx_t1;
explain select /*+NO_QUERY_TRANSFORMATION*/ 1 from dual where 1 = (select 1 from dual where 1 = (select 1 from dual where 1 = (select 1 from dual where 1 = (select 1 from dual where 1 = (select 1 from dual where 1 = (select 1 from dual where 1 = (select 1 from dual  where 1 = (select 1 from dual where 1 = (select 1 from dual where 1 = (select 1 from dual where 1 = (select 1 from dual where 1 = (select 1 from dual where 1 = (select 1 from dual where 1 = (select 1 from dual where 1 = (select 1 from dual where 1 = (select 1 from dual where 1 = (select 1 from dual where 1 = (select 1 from dual where 1 = (select 1 from dual  where 1 = (select 1 from dual where 1 = (select 1 from dual  where 1 = (select 1 from dual where 1 = (select 1 from dual where 1 = (select 1 from dual where 1 = (select 1 from dual where 1 = (select 1 from dual where 1 = (select 1 from dual where 1 = (select 1 from dual where 1 = (select 1 from dual  where 1 = (select 1 from dual where 1 = (select 1 from dual where 1 = (select 1 from dual where 1 = (select 1 from dual where 1 = (select 1 from dual where 1 = (select 1 from dual  where 1 = (select 1 from dual where 1 = (select 1 from dual where 1 = (select 1 from dual where 1 = (select 1 from dual where 1 = (select 1 from dual where 1 = (select 1 from dual  where 1 = (select 1 from dual where 1 = (select 1 from dual  where 1 = (select 1 from dual where 1 = (select 1 from dual where 1 = (select 1 from dual where 1 = (select 1 from dual  where 1 = (select 1 from dual where 1 = (select 1 from dual  where 1 = (select 1 from dual where 1 = (select 1 from dual where 1 = (select 1 from dual where 1 = (select 1 from dual where 1 = (select 1 from dual where 1 = (select 1 from dual where 1 = (select 1 from dual where 1 = (select 1 from dual  where 1 = (select 1 from dual where 1 = (select 1 from dual  where 1 = (select 1 from dual where 1 = (select 1 from dual ))))))))))))))))))))))))))  )  ) )  )  ) ))))))))))))))))))))))))))))));
Query Plan
=======================================================================================================================================================================
|ID |OPERATOR                                                                                                                              |NAME|EST.ROWS|EST.TIME(us)|
-----------------------------------------------------------------------------------------------------------------------------------------------------------------------
|0  |SUBPLAN FILTER                                                                                                                        |    |1       |1           |
|1  |├─EXPRESSION                                                                                                                          |    |1       |1           |
|2  |└─SUBPLAN FILTER                                                                                                                      |    |1       |1           |
|3  |  ├─EXPRESSION                                                                                                                        |    |1       |1           |
|4  |  └─SUBPLAN FILTER                                                                                                                    |    |1       |1           |
|5  |    ├─EXPRESSION                                                                                                                      |    |1       |1           |
|6  |    └─SUBPLAN FILTER                                                                                                                  |    |1       |1           |
|7  |      ├─EXPRESSION                                                                                                                    |    |1       |1           |
|8  |      └─SUBPLAN FILTER                                                                                                                |    |1       |1           |
|9  |        ├─EXPRESSION                                                                                                                  |    |1       |1           |
|10 |        └─SUBPLAN FILTER                                                                                                              |    |1       |1           |
|11 |          ├─EXPRESSION                                                                                                                |    |1       |1           |
|12 |          └─SUBPLAN FILTER                                                                                                            |    |1       |1           |
|13 |            ├─EXPRESSION                                                                                                              |    |1       |1           |
|14 |            └─SUBPLAN FILTER                                                                                                          |    |1       |1           |
|15 |              ├─EXPRESSION                                                                                                            |    |1       |1           |
|16 |              └─SUBPLAN FILTER                                                                                                        |    |1       |1           |
|17 |                ├─EXPRESSION                                                                                                          |    |1       |1           |
|18 |                └─SUBPLAN FILTER                                                                                                      |    |1       |1           |
|19 |                  ├─EXPRESSION                                                                                                        |    |1       |1           |
|20 |                  └─SUBPLAN FILTER                                                                                                    |    |1       |1           |
|21 |                    ├─EXPRESSION                                                                                                      |    |1       |1           |
|22 |                    └─SUBPLAN FILTER                                                                                                  |    |1       |1           |
|23 |                      ├─EXPRESSION                                                                                                    |    |1       |1           |
|24 |                      └─SUBPLAN FILTER                                                                                                |    |1       |1           |
|25 |                        ├─EXPRESSION                                                                                                  |    |1       |1           |
|26 |                        └─SUBPLAN FILTER                                                                                              |    |1       |1           |
|27 |                          ├─EXPRESSION                                                                                                |    |1       |1           |
|28 |                          └─SUBPLAN FILTER                                                                                            |    |1       |1           |
|29 |                            ├─EXPRESSION                                                                                              |    |1       |1           |
|30 |                            └─SUBPLAN FILTER                                                                                          |    |1       |1           |
|31 |                              ├─EXPRESSION                                                                                            |    |1       |1           |
|32 |                              └─SUBPLAN FILTER                                                                                        |    |1       |1           |
|33 |                                ├─EXPRESSION                                                                                          |    |1       |1           |
|34 |                                └─SUBPLAN FILTER                                                                                      |    |1       |1           |
|35 |                                  ├─EXPRESSION                                                                                        |    |1       |1           |
|36 |                                  └─SUBPLAN FILTER                                                                                    |    |1       |1           |
|37 |                                    ├─EXPRESSION                                                                                      |    |1       |1           |
|38 |                                    └─SUBPLAN FILTER                                                                                  |    |1       |1           |
|39 |                                      ├─EXPRESSION                                                                                    |    |1       |1           |
|40 |                                      └─SUBPLAN FILTER                                                                                |    |1       |1           |
|41 |                                        ├─EXPRESSION                                                                                  |    |1       |1           |
|42 |                                        └─SUBPLAN FILTER                                                                              |    |1       |1           |
|43 |                                          ├─EXPRESSION                                                                                |    |1       |1           |
|44 |                                          └─SUBPLAN FILTER                                                                            |    |1       |1           |
|45 |                                            ├─EXPRESSION                                                                              |    |1       |1           |
|46 |                                            └─SUBPLAN FILTER                                                                          |    |1       |1           |
|47 |                                              ├─EXPRESSION                                                                            |    |1       |1           |
|48 |                                              └─SUBPLAN FILTER                                                                        |    |1       |1           |
|49 |                                                ├─EXPRESSION                                                                          |    |1       |1           |
|50 |                                                └─SUBPLAN FILTER                                                                      |    |1       |1           |
|51 |                                                  ├─EXPRESSION                                                                        |    |1       |1           |
|52 |                                                  └─SUBPLAN FILTER                                                                    |    |1       |1           |
|53 |                                                    ├─EXPRESSION                                                                      |    |1       |1           |
|54 |                                                    └─SUBPLAN FILTER                                                                  |    |1       |1           |
|55 |                                                      ├─EXPRESSION                                                                    |    |1       |1           |
|56 |                                                      └─SUBPLAN FILTER                                                                |    |1       |1           |
|57 |                                                        ├─EXPRESSION                                                                  |    |1       |1           |
|58 |                                                        └─SUBPLAN FILTER                                                              |    |1       |1           |
|59 |                                                          ├─EXPRESSION                                                                |    |1       |1           |
|60 |                                                          └─SUBPLAN FILTER                                                            |    |1       |1           |
|61 |                                                            ├─EXPRESSION                                                              |    |1       |1           |
|62 |                                                            └─SUBPLAN FILTER                                                          |    |1       |1           |
|63 |                                                              ├─EXPRESSION                                                            |    |1       |1           |
|64 |                                                              └─SUBPLAN FILTER                                                        |    |1       |1           |
|65 |                                                                ├─EXPRESSION                                                          |    |1       |1           |
|66 |                                                                └─SUBPLAN FILTER                                                      |    |1       |1           |
|67 |                                                                  ├─EXPRESSION                                                        |    |1       |1           |
|68 |                                                                  └─SUBPLAN FILTER                                                    |    |1       |1           |
|69 |                                                                    ├─EXPRESSION                                                      |    |1       |1           |
|70 |                                                                    └─SUBPLAN FILTER                                                  |    |1       |1           |
|71 |                                                                      ├─EXPRESSION                                                    |    |1       |1           |
|72 |                                                                      └─SUBPLAN FILTER                                                |    |1       |1           |
|73 |                                                                        ├─EXPRESSION                                                  |    |1       |1           |
|74 |                                                                        └─SUBPLAN FILTER                                              |    |1       |1           |
|75 |                                                                          ├─EXPRESSION                                                |    |1       |1           |
|76 |                                                                          └─SUBPLAN FILTER                                            |    |1       |1           |
|77 |                                                                            ├─EXPRESSION                                              |    |1       |1           |
|78 |                                                                            └─SUBPLAN FILTER                                          |    |1       |1           |
|79 |                                                                              ├─EXPRESSION                                            |    |1       |1           |
|80 |                                                                              └─SUBPLAN FILTER                                        |    |1       |1           |
|81 |                                                                                ├─EXPRESSION                                          |    |1       |1           |
|82 |                                                                                └─SUBPLAN FILTER                                      |    |1       |1           |
|83 |                                                                                  ├─EXPRESSION                                        |    |1       |1           |
|84 |                                                                                  └─SUBPLAN FILTER                                    |    |1       |1           |
|85 |                                                                                    ├─EXPRESSION                                      |    |1       |1           |
|86 |                                                                                    └─SUBPLAN FILTER                                  |    |1       |1           |
|87 |                                                                                      ├─EXPRESSION                                    |    |1       |1           |
|88 |                                                                                      └─SUBPLAN FILTER                                |    |1       |1           |
|89 |                                                                                        ├─EXPRESSION                                  |    |1       |1           |
|90 |                                                                                        └─SUBPLAN FILTER                              |    |1       |1           |
|91 |                                                                                          ├─EXPRESSION                                |    |1       |1           |
|92 |                                                                                          └─SUBPLAN FILTER                            |    |1       |1           |
|93 |                                                                                            ├─EXPRESSION                              |    |1       |1           |
|94 |                                                                                            └─SUBPLAN FILTER                          |    |1       |1           |
|95 |                                                                                              ├─EXPRESSION                            |    |1       |1           |
|96 |                                                                                              └─SUBPLAN FILTER                        |    |1       |1           |
|97 |                                                                                                ├─EXPRESSION                          |    |1       |1           |
|98 |                                                                                                └─SUBPLAN FILTER                      |    |1       |1           |
|99 |                                                                                                  ├─EXPRESSION                        |    |1       |1           |
|100|                                                                                                  └─SUBPLAN FILTER                    |    |1       |1           |
|101|                                                                                                    ├─EXPRESSION                      |    |1       |1           |
|102|                                                                                                    └─SUBPLAN FILTER                  |    |1       |1           |
|103|                                                                                                      ├─EXPRESSION                    |    |1       |1           |
|104|                                                                                                      └─SUBPLAN FILTER                |    |1       |1           |
|105|                                                                                                        ├─EXPRESSION                  |    |1       |1           |
|106|                                                                                                        └─SUBPLAN FILTER              |    |1       |1           |
|107|                                                                                                          ├─EXPRESSION                |    |1       |1           |
|108|                                                                                                          └─SUBPLAN FILTER            |    |1       |1           |
|109|                                                                                                            ├─EXPRESSION              |    |1       |1           |
|110|                                                                                                            └─SUBPLAN FILTER          |    |1       |1           |
|111|                                                                                                              ├─EXPRESSION            |    |1       |1           |
|112|                                                                                                              └─SUBPLAN FILTER        |    |1       |1           |
|113|                                                                                                                ├─EXPRESSION          |    |1       |1           |
|114|                                                                                                                └─SUBPLAN FILTER      |    |1       |1           |
|115|                                                                                                                  ├─EXPRESSION        |    |1       |1           |
|116|                                                                                                                  └─SUBPLAN FILTER    |    |1       |1           |
|117|                                                                                                                    ├─EXPRESSION      |    |1       |1           |
|118|                                                                                                                    └─SUBPLAN FILTER  |    |1       |1           |
|119|                                                                                                                      ├─EXPRESSION    |    |1       |1           |
|120|                                                                                                                      └─SUBPLAN FILTER|    |1       |1           |
|121|                                                                                                                        ├─EXPRESSION  |    |1       |1           |
|122|                                                                                                                        └─EXPRESSION  |    |1       |1           |
=======================================================================================================================================================================
Outputs & filters:
-------------------------------------
  0 - output([1]), filter([1 = :0]), rowset=16
      exec_params_(nil), onetime_exprs_([subquery(1)(:0)]), init_plan_idxs_(nil), use_batch=false
  1 - output([1]), filter(nil)
      values({1})
  2 - output([1]), filter([1 = :1]), rowset=16
      exec_params_(nil), onetime_exprs_([subquery(1)(:1)]), init_plan_idxs_(nil), use_batch=false
  3 - output([1]), filter(nil)
      values({1})
  4 - output([1]), filter([1 = :2]), rowset=16
      exec_params_(nil), onetime_exprs_([subquery(1)(:2)]), init_plan_idxs_(nil), use_batch=false
  5 - output([1]), filter(nil)
      values({1})
  6 - output([1]), filter([1 = :3]), rowset=16
      exec_params_(nil), onetime_exprs_([subquery(1)(:3)]), init_plan_idxs_(nil), use_batch=false
  7 - output([1]), filter(nil)
      values({1})
  8 - output([1]), filter([1 = :4]), rowset=16
      exec_params_(nil), onetime_exprs_([subquery(1)(:4)]), init_plan_idxs_(nil), use_batch=false
  9 - output([1]), filter(nil)
      values({1})
 10 - output([1]), filter([1 = :5]), rowset=16
      exec_params_(nil), onetime_exprs_([subquery(1)(:5)]), init_plan_idxs_(nil), use_batch=false
 11 - output([1]), filter(nil)
      values({1})
 12 - output([1]), filter([1 = :6]), rowset=16
      exec_params_(nil), onetime_exprs_([subquery(1)(:6)]), init_plan_idxs_(nil), use_batch=false
 13 - output([1]), filter(nil)
      values({1})
 14 - output([1]), filter([1 = :7]), rowset=16
      exec_params_(nil), onetime_exprs_([subquery(1)(:7)]), init_plan_idxs_(nil), use_batch=false
 15 - output([1]), filter(nil)
      values({1})
 16 - output([1]), filter([1 = :8]), rowset=16
      exec_params_(nil), onetime_exprs_([subquery(1)(:8)]), init_plan_idxs_(nil), use_batch=false
 17 - output([1]), filter(nil)
      values({1})
 18 - output([1]), filter([1 = :9]), rowset=16
      exec_params_(nil), onetime_exprs_([subquery(1)(:9)]), init_plan_idxs_(nil), use_batch=false
 19 - output([1]), filter(nil)
      values({1})
 20 - output([1]), filter([1 = :10]), rowset=16
      exec_params_(nil), onetime_exprs_([subquery(1)(:10)]), init_plan_idxs_(nil), use_batch=false
 21 - output([1]), filter(nil)
      values({1})
 22 - output([1]), filter([1 = :11]), rowset=16
      exec_params_(nil), onetime_exprs_([subquery(1)(:11)]), init_plan_idxs_(nil), use_batch=false
 23 - output([1]), filter(nil)
      values({1})
 24 - output([1]), filter([1 = :12]), rowset=16
      exec_params_(nil), onetime_exprs_([subquery(1)(:12)]), init_plan_idxs_(nil), use_batch=false
 25 - output([1]), filter(nil)
      values({1})
 26 - output([1]), filter([1 = :13]), rowset=16
      exec_params_(nil), onetime_exprs_([subquery(1)(:13)]), init_plan_idxs_(nil), use_batch=false
 27 - output([1]), filter(nil)
      values({1})
 28 - output([1]), filter([1 = :14]), rowset=16
      exec_params_(nil), onetime_exprs_([subquery(1)(:14)]), init_plan_idxs_(nil), use_batch=false
 29 - output([1]), filter(nil)
      values({1})
 30 - output([1]), filter([1 = :15]), rowset=16
      exec_params_(nil), onetime_exprs_([subquery(1)(:15)]), init_plan_idxs_(nil), use_batch=false
 31 - output([1]), filter(nil)
      values({1})
 32 - output([1]), filter([1 = :16]), rowset=16
      exec_params_(nil), onetime_exprs_([subquery(1)(:16)]), init_plan_idxs_(nil), use_batch=false
 33 - output([1]), filter(nil)
      values({1})
 34 - output([1]), filter([1 = :17]), rowset=16
      exec_params_(nil), onetime_exprs_([subquery(1)(:17)]), init_plan_idxs_(nil), use_batch=false
 35 - output([1]), filter(nil)
      values({1})
 36 - output([1]), filter([1 = :18]), rowset=16
      exec_params_(nil), onetime_exprs_([subquery(1)(:18)]), init_plan_idxs_(nil), use_batch=false
 37 - output([1]), filter(nil)
      values({1})
 38 - output([1]), filter([1 = :19]), rowset=16
      exec_params_(nil), onetime_exprs_([subquery(1)(:19)]), init_plan_idxs_(nil), use_batch=false
 39 - output([1]), filter(nil)
      values({1})
 40 - output([1]), filter([1 = :20]), rowset=16
      exec_params_(nil), onetime_exprs_([subquery(1)(:20)]), init_plan_idxs_(nil), use_batch=false
 41 - output([1]), filter(nil)
      values({1})
 42 - output([1]), filter([1 = :21]), rowset=16
      exec_params_(nil), onetime_exprs_([subquery(1)(:21)]), init_plan_idxs_(nil), use_batch=false
 43 - output([1]), filter(nil)
      values({1})
 44 - output([1]), filter([1 = :22]), rowset=16
      exec_params_(nil), onetime_exprs_([subquery(1)(:22)]), init_plan_idxs_(nil), use_batch=false
 45 - output([1]), filter(nil)
      values({1})
 46 - output([1]), filter([1 = :23]), rowset=16
      exec_params_(nil), onetime_exprs_([subquery(1)(:23)]), init_plan_idxs_(nil), use_batch=false
 47 - output([1]), filter(nil)
      values({1})
 48 - output([1]), filter([1 = :24]), rowset=16
      exec_params_(nil), onetime_exprs_([subquery(1)(:24)]), init_plan_idxs_(nil), use_batch=false
 49 - output([1]), filter(nil)
      values({1})
 50 - output([1]), filter([1 = :25]), rowset=16
      exec_params_(nil), onetime_exprs_([subquery(1)(:25)]), init_plan_idxs_(nil), use_batch=false
 51 - output([1]), filter(nil)
      values({1})
 52 - output([1]), filter([1 = :26]), rowset=16
      exec_params_(nil), onetime_exprs_([subquery(1)(:26)]), init_plan_idxs_(nil), use_batch=false
 53 - output([1]), filter(nil)
      values({1})
 54 - output([1]), filter([1 = :27]), rowset=16
      exec_params_(nil), onetime_exprs_([subquery(1)(:27)]), init_plan_idxs_(nil), use_batch=false
 55 - output([1]), filter(nil)
      values({1})
 56 - output([1]), filter([1 = :28]), rowset=16
      exec_params_(nil), onetime_exprs_([subquery(1)(:28)]), init_plan_idxs_(nil), use_batch=false
 57 - output([1]), filter(nil)
      values({1})
 58 - output([1]), filter([1 = :29]), rowset=16
      exec_params_(nil), onetime_exprs_([subquery(1)(:29)]), init_plan_idxs_(nil), use_batch=false
 59 - output([1]), filter(nil)
      values({1})
 60 - output([1]), filter([1 = :30]), rowset=16
      exec_params_(nil), onetime_exprs_([subquery(1)(:30)]), init_plan_idxs_(nil), use_batch=false
 61 - output([1]), filter(nil)
      values({1})
 62 - output([1]), filter([1 = :31]), rowset=16
      exec_params_(nil), onetime_exprs_([subquery(1)(:31)]), init_plan_idxs_(nil), use_batch=false
 63 - output([1]), filter(nil)
      values({1})
 64 - output([1]), filter([1 = :32]), rowset=16
      exec_params_(nil), onetime_exprs_([subquery(1)(:32)]), init_plan_idxs_(nil), use_batch=false
 65 - output([1]), filter(nil)
      values({1})
 66 - output([1]), filter([1 = :33]), rowset=16
      exec_params_(nil), onetime_exprs_([subquery(1)(:33)]), init_plan_idxs_(nil), use_batch=false
 67 - output([1]), filter(nil)
      values({1})
 68 - output([1]), filter([1 = :34]), rowset=16
      exec_params_(nil), onetime_exprs_([subquery(1)(:34)]), init_plan_idxs_(nil), use_batch=false
 69 - output([1]), filter(nil)
      values({1})
 70 - output([1]), filter([1 = :35]), rowset=16
      exec_params_(nil), onetime_exprs_([subquery(1)(:35)]), init_plan_idxs_(nil), use_batch=false
 71 - output([1]), filter(nil)
      values({1})
 72 - output([1]), filter([1 = :36]), rowset=16
      exec_params_(nil), onetime_exprs_([subquery(1)(:36)]), init_plan_idxs_(nil), use_batch=false
 73 - output([1]), filter(nil)
      values({1})
 74 - output([1]), filter([1 = :37]), rowset=16
      exec_params_(nil), onetime_exprs_([subquery(1)(:37)]), init_plan_idxs_(nil), use_batch=false
 75 - output([1]), filter(nil)
      values({1})
 76 - output([1]), filter([1 = :38]), rowset=16
      exec_params_(nil), onetime_exprs_([subquery(1)(:38)]), init_plan_idxs_(nil), use_batch=false
 77 - output([1]), filter(nil)
      values({1})
 78 - output([1]), filter([1 = :39]), rowset=16
      exec_params_(nil), onetime_exprs_([subquery(1)(:39)]), init_plan_idxs_(nil), use_batch=false
 79 - output([1]), filter(nil)
      values({1})
 80 - output([1]), filter([1 = :40]), rowset=16
      exec_params_(nil), onetime_exprs_([subquery(1)(:40)]), init_plan_idxs_(nil), use_batch=false
 81 - output([1]), filter(nil)
      values({1})
 82 - output([1]), filter([1 = :41]), rowset=16
      exec_params_(nil), onetime_exprs_([subquery(1)(:41)]), init_plan_idxs_(nil), use_batch=false
 83 - output([1]), filter(nil)
      values({1})
 84 - output([1]), filter([1 = :42]), rowset=16
      exec_params_(nil), onetime_exprs_([subquery(1)(:42)]), init_plan_idxs_(nil), use_batch=false
 85 - output([1]), filter(nil)
      values({1})
 86 - output([1]), filter([1 = :43]), rowset=16
      exec_params_(nil), onetime_exprs_([subquery(1)(:43)]), init_plan_idxs_(nil), use_batch=false
 87 - output([1]), filter(nil)
      values({1})
 88 - output([1]), filter([1 = :44]), rowset=16
      exec_params_(nil), onetime_exprs_([subquery(1)(:44)]), init_plan_idxs_(nil), use_batch=false
 89 - output([1]), filter(nil)
      values({1})
 90 - output([1]), filter([1 = :45]), rowset=16
      exec_params_(nil), onetime_exprs_([subquery(1)(:45)]), init_plan_idxs_(nil), use_batch=false
 91 - output([1]), filter(nil)
      values({1})
 92 - output([1]), filter([1 = :46]), rowset=16
      exec_params_(nil), onetime_exprs_([subquery(1)(:46)]), init_plan_idxs_(nil), use_batch=false
 93 - output([1]), filter(nil)
      values({1})
 94 - output([1]), filter([1 = :47]), rowset=16
      exec_params_(nil), onetime_exprs_([subquery(1)(:47)]), init_plan_idxs_(nil), use_batch=false
 95 - output([1]), filter(nil)
      values({1})
 96 - output([1]), filter([1 = :48]), rowset=16
      exec_params_(nil), onetime_exprs_([subquery(1)(:48)]), init_plan_idxs_(nil), use_batch=false
 97 - output([1]), filter(nil)
      values({1})
 98 - output([1]), filter([1 = :49]), rowset=16
      exec_params_(nil), onetime_exprs_([subquery(1)(:49)]), init_plan_idxs_(nil), use_batch=false
 99 - output([1]), filter(nil)
      values({1})
100 - output([1]), filter([1 = :50]), rowset=16
      exec_params_(nil), onetime_exprs_([subquery(1)(:50)]), init_plan_idxs_(nil), use_batch=false
101 - output([1]), filter(nil)
      values({1})
102 - output([1]), filter([1 = :51]), rowset=16
      exec_params_(nil), onetime_exprs_([subquery(1)(:51)]), init_plan_idxs_(nil), use_batch=false
103 - output([1]), filter(nil)
      values({1})
104 - output([1]), filter([1 = :52]), rowset=16
      exec_params_(nil), onetime_exprs_([subquery(1)(:52)]), init_plan_idxs_(nil), use_batch=false
105 - output([1]), filter(nil)
      values({1})
106 - output([1]), filter([1 = :53]), rowset=16
      exec_params_(nil), onetime_exprs_([subquery(1)(:53)]), init_plan_idxs_(nil), use_batch=false
107 - output([1]), filter(nil)
      values({1})
108 - output([1]), filter([1 = :54]), rowset=16
      exec_params_(nil), onetime_exprs_([subquery(1)(:54)]), init_plan_idxs_(nil), use_batch=false
109 - output([1]), filter(nil)
      values({1})
110 - output([1]), filter([1 = :55]), rowset=16
      exec_params_(nil), onetime_exprs_([subquery(1)(:55)]), init_plan_idxs_(nil), use_batch=false
111 - output([1]), filter(nil)
      values({1})
112 - output([1]), filter([1 = :56]), rowset=16
      exec_params_(nil), onetime_exprs_([subquery(1)(:56)]), init_plan_idxs_(nil), use_batch=false
113 - output([1]), filter(nil)
      values({1})
114 - output([1]), filter([1 = :57]), rowset=16
      exec_params_(nil), onetime_exprs_([subquery(1)(:57)]), init_plan_idxs_(nil), use_batch=false
115 - output([1]), filter(nil)
      values({1})
116 - output([1]), filter([1 = :58]), rowset=16
      exec_params_(nil), onetime_exprs_([subquery(1)(:58)]), init_plan_idxs_(nil), use_batch=false
117 - output([1]), filter(nil)
      values({1})
118 - output([1]), filter([1 = :59]), rowset=16
      exec_params_(nil), onetime_exprs_([subquery(1)(:59)]), init_plan_idxs_(nil), use_batch=false
119 - output([1]), filter(nil)
      values({1})
120 - output([1]), filter([1 = :60]), rowset=16
      exec_params_(nil), onetime_exprs_([subquery(1)(:60)]), init_plan_idxs_(nil), use_batch=false
121 - output([1]), filter(nil)
      values({1})
122 - output([1]), filter(nil)
      values({1})
use test;
drop table if exists test.a;
drop table if exists test.b;
drop table if exists test.c;
create table a(a1 char(5));
create table b(b1 char(6));
create table c(c1 bigint);
insert into a values('a');
insert into b values('bbb');
insert into c values(12);
set @xxx = 'asd';
select @xxx;
@xxx
asd
select a1 from a into @xxx;
select @xxx;
@xxx
a
select @xxx;
@xxx
a
select b1 from b into @xxx;
select @xxx;
@xxx
bbb
select @xxx;
@xxx
bbb
select c1 from c into @xxx;
select @xxx;
@xxx
12
select @xxx;
@xxx
12
set ob_read_consistency='weak';
set @xxx = 'asd';
select @xxx;
@xxx
asd
select a1 from a into @xxx;
select @xxx;
@xxx
a
select @xxx;
@xxx
a
select b1 from b into @xxx;
select @xxx;
@xxx
bbb
select @xxx;
@xxx
bbb
select c1 from c into @xxx;
select @xxx;
@xxx
12
select @xxx;
@xxx
12
set ob_read_consistency='weak';
set @xxx = 'asd';
select @xxx;
@xxx
asd
select a1 from a into @xxx;
select @xxx;
@xxx
a
select @xxx;
@xxx
a
select b1 from b into @xxx;
select @xxx;
@xxx
bbb
select @xxx;
@xxx
bbb
select c1 from c into @xxx;
select @xxx;
@xxx
12
select @xxx;
@xxx
12
set ob_read_consistency='weak';
set @xxx = 'asd';
select @xxx;
@xxx
asd
select a1 from a into @xxx;
select @xxx;
@xxx
a
select @xxx;
@xxx
a
select b1 from b into @xxx;
select @xxx;
@xxx
bbb
select @xxx;
@xxx
bbb
select c1 from c into @xxx;
select @xxx;
@xxx
12
select @xxx;
@xxx
12
set ob_read_consistency='weak';
set @xxx = 'asd';
select @xxx;
@xxx
asd
select a1 from a into @xxx;
select @xxx;
@xxx
a
select @xxx;
@xxx
a
select b1 from b into @xxx;
select @xxx;
@xxx
bbb
select @xxx;
@xxx
bbb
select c1 from c into @xxx;
select @xxx;
@xxx
12
select @xxx;
@xxx
12
set ob_read_consistency='weak';
set @xxx = 'asd';
select @xxx;
@xxx
asd
select a1 from a into @xxx;
select @xxx;
@xxx
a
select @xxx;
@xxx
a
select b1 from b into @xxx;
select @xxx;
@xxx
bbb
select @xxx;
@xxx
bbb
select c1 from c into @xxx;
select @xxx;
@xxx
12
select @xxx;
@xxx
12
drop table a;
drop table b;
drop table c;
drop database select_bug;
