drop table if exists t1;
create table t1 (a int not null default 0 primary key, b int not null default 0);
insert into t1 () values ();
insert into t1 values (1,1),(2,1),(3,1);
update t1 set a=4 where b=1 limit 1;
select * from t1;
a	b
0	0
2	1
3	1
4	1
update t1 set b=2 where b=1 limit 2;
select * from t1;
a	b
0	0
2	2
3	2
4	1
update t1 set b=4 where b=1;
select * from t1;
a	b
0	0
2	2
3	2
4	4
delete from t1 where b=2 limit 1;
select * from t1;
a	b
0	0
3	2
4	4
delete from t1 limit 1;
select * from t1;
a	b
3	2
4	4
drop table t1;
create table t1 (i int);
insert into t1 (i) values(1),(1),(1);
delete from t1 limit 1;
update t1 set i=2 limit 1;
delete from t1 limit 0;
update t1 set i=3 limit 0;
select * from t1;
i
2
1
drop table t1;
select 0 limit 0;
0
CREATE TABLE t1(id int auto_increment primary key, id2 int, index(id2));
INSERT INTO t1 (id2) values (0),(0),(0);
DELETE FROM t1 WHERE id=1;
INSERT INTO t1 SET id2=0;
SELECT * FROM t1;
id	id2
2	0
3	0
4	0
DELETE FROM t1 WHERE id2 = 0 ORDER BY id LIMIT 1;
SELECT * FROM t1;
id	id2
3	0
4	0
DELETE FROM t1 WHERE id2 = 0 ORDER BY id desc LIMIT 1;
SELECT * FROM t1;
id	id2
3	0
DROP TABLE t1;
create table t1 (a integer);
insert into t1 values (1);
select 1 as a from t1 union all select 1 from dual limit 1;
a
1
(select 1 as a from t1) union all (select 1 from dual) limit 1;
a
1
drop table t1;
create table t1 (a int);
insert into t1 values (1),(2),(3),(4),(5),(6),(7);
explain basic select count(*) c FROM t1 WHERE a > 0 ORDER BY c LIMIT 3;
Query Plan
=============================
|ID|OPERATOR           |NAME|
-----------------------------
|0 |LIMIT              |    |
|1 |└─SCALAR GROUP BY  |    |
|2 |  └─TABLE FULL SCAN|t1  |
=============================
Outputs & filters:
-------------------------------------
  0 - output([T_FUN_COUNT_SUM(T_FUN_COUNT(*))]), filter(nil), rowset=16
      limit(3), offset(nil)
  1 - output([T_FUN_COUNT_SUM(T_FUN_COUNT(*))]), filter(nil), rowset=16
      group(nil), agg_func([T_FUN_COUNT_SUM(T_FUN_COUNT(*))])
  2 - output([T_FUN_COUNT(*)]), filter([t1.a > 0]), rowset=16
      access([t1.a]), partitions(p0)
      is_index_back=false, is_global_index=false, filter_before_indexback[false], 
      range_key([t1.__pk_increment]), range(MIN ; MAX)always true, 
      pushdown_aggregation([T_FUN_COUNT(*)])
select count(*) c FROM t1 WHERE a > 0 ORDER BY c LIMIT 3;
c
7
explain basic select sum(a) c FROM t1 WHERE a > 0 ORDER BY c LIMIT 3;
Query Plan
=============================
|ID|OPERATOR           |NAME|
-----------------------------
|0 |LIMIT              |    |
|1 |└─SCALAR GROUP BY  |    |
|2 |  └─TABLE FULL SCAN|t1  |
=============================
Outputs & filters:
-------------------------------------
  0 - output([T_FUN_SUM(T_FUN_SUM(t1.a))]), filter(nil), rowset=16
      limit(3), offset(nil)
  1 - output([T_FUN_SUM(T_FUN_SUM(t1.a))]), filter(nil), rowset=16
      group(nil), agg_func([T_FUN_SUM(T_FUN_SUM(t1.a))])
  2 - output([T_FUN_SUM(t1.a)]), filter([t1.a > 0]), rowset=16
      access([t1.a]), partitions(p0)
      is_index_back=false, is_global_index=false, filter_before_indexback[false], 
      range_key([t1.__pk_increment]), range(MIN ; MAX)always true, 
      pushdown_aggregation([T_FUN_SUM(t1.a)])
select sum(a) c FROM t1 WHERE a > 0 ORDER BY c LIMIT 3;
c
28
drop table t1;
select 1 limit 'qwe';
ERROR 42000: You have an error in your SQL syntax; check the manual that corresponds to your OceanBase version for the right syntax to use near ''qwe'' at line 1
select 1 limit -1;
ERROR 42000: You have an error in your SQL syntax; check the manual that corresponds to your OceanBase version for the right syntax to use near '-1' at line 1
select 1 limit 1, -1;
ERROR 42000: You have an error in your SQL syntax; check the manual that corresponds to your OceanBase version for the right syntax to use near '-1' at line 1
select 1 limit -1, -1;
ERROR 42000: You have an error in your SQL syntax; check the manual that corresponds to your OceanBase version for the right syntax to use near '-1, -1' at line 1
select 1 limit 14632475938453979136, 14632475938453979136;
1
select 1 limit -14632475938453979136, -14632475938453979136;
ERROR 42000: You have an error in your SQL syntax; check the manual that corresponds to your OceanBase version for the right syntax to use near '-14632475938453979136, -14632475938453979136' at line 1
End of 5.0 tests
select 1 as a limit 4294967296,10;
a
End of 5.1 tests
