drop table if exists t1,t2,t3;
drop database if exists mysqltest;
drop view if exists v1;
result_format: 4
create table t1(id1 int not null auto_increment primary key, t char(12));
create table t2(id2 int not null, t char(12));
create table t3(id3 int not null, t char(12), index(id3));

select count(*) from t1 where id1 > 95;
+----------+
| count(*) |
+----------+
|        5 |
+----------+
select count(*) from t2 where id2 > 95;
+----------+
| count(*) |
+----------+
|       25 |
+----------+
select count(*) from t3 where id3 > 95;
+----------+
| count(*) |
+----------+
|      250 |
+----------+

update t1,t2,t3 set t1.t="aaa", t2.t="bbb", t3.t="cc" where  t1.id1 = t2.id2 and t2.id2 = t3.id3  and t1.id1 > 90;
select count(*) from t1 where t = "aaa";
+----------+
| count(*) |
+----------+
|       10 |
+----------+
select count(*) from t1 where id1 > 90;
+----------+
| count(*) |
+----------+
|       10 |
+----------+
select count(*) from t2 where t = "bbb";
+----------+
| count(*) |
+----------+
|       50 |
+----------+
select count(*) from t2 where id2 > 90;
+----------+
| count(*) |
+----------+
|       50 |
+----------+
select count(*) from t3 where t = "cc";
+----------+
| count(*) |
+----------+
|      500 |
+----------+
select count(*) from t3 where id3 > 90;
+----------+
| count(*) |
+----------+
|      500 |
+----------+
delete t1.*, t2.*, t3.*  from t1,t2,t3 where t1.id1 = t2.id2 and t2.id2 = t3.id3  and t1.id1 > 95;

select count(*) from t1 where id1 > 95;
+----------+
| count(*) |
+----------+
|        0 |
+----------+
select count(*) from t2 where id2 > 95;
+----------+
| count(*) |
+----------+
|        0 |
+----------+
select count(*) from t3 where id3 > 95;
+----------+
| count(*) |
+----------+
|        0 |
+----------+

delete t1, t2, t3  from t1,t2,t3 where t1.id1 = t2.id2 and t2.id2 = t3.id3  and t1.id1 > 5;
select count(*) from t1 where id1 > 5;
+----------+
| count(*) |
+----------+
|        0 |
+----------+
select count(*) from t2 where id2 > 5;
+----------+
| count(*) |
+----------+
|        0 |
+----------+
select count(*) from t3 where id3 > 5;
+----------+
| count(*) |
+----------+
|        0 |
+----------+

delete from t1, t2, t3  using t1,t2,t3 where t1.id1 = t2.id2 and t2.id2 = t3.id3  and t1.id1 > 0;

select count(*) from t1 where id1;
+----------+
| count(*) |
+----------+
|        0 |
+----------+
select count(*) from t2 where id2;
+----------+
| count(*) |
+----------+
|        0 |
+----------+
select count(*) from t3 where id3;
+----------+
| count(*) |
+----------+
|        0 |
+----------+
drop table t1,t2,t3;

create table t1(id1 int not null  primary key, t varchar(100));
create table t2(id2 int not null, t varchar(100), index(id2));
delete t1 from t1,t2 where t1.id1 = t2.id2 and t1.id1 > 500;
select * from t1;
+-----+----------------------+
| id1 | t                    |
+-----+----------------------+
|   1 | aaaaaaaaaaaaaaaaaaaa |
|   2 | aaaaaaaaaaaaaaaaaaaa |
|   3 | aaaaaaaaaaaaaaaaaaaa |
|   4 | aaaaaaaaaaaaaaaaaaaa |
|   5 | aaaaaaaaaaaaaaaaaaaa |
|   6 | aaaaaaaaaaaaaaaaaaaa |
|   7 | aaaaaaaaaaaaaaaaaaaa |
|   8 | aaaaaaaaaaaaaaaaaaaa |
|   9 | aaaaaaaaaaaaaaaaaaaa |
|  10 | aaaaaaaaaaaaaaaaaaaa |
|  11 | aaaaaaaaaaaaaaaaaaaa |
|  12 | aaaaaaaaaaaaaaaaaaaa |
|  13 | aaaaaaaaaaaaaaaaaaaa |
|  14 | aaaaaaaaaaaaaaaaaaaa |
|  15 | aaaaaaaaaaaaaaaaaaaa |
|  16 | aaaaaaaaaaaaaaaaaaaa |
|  17 | aaaaaaaaaaaaaaaaaaaa |
|  18 | aaaaaaaaaaaaaaaaaaaa |
|  19 | aaaaaaaaaaaaaaaaaaaa |
|  20 | aaaaaaaaaaaaaaaaaaaa |
|  21 | aaaaaaaaaaaaaaaaaaaa |
|  22 | aaaaaaaaaaaaaaaaaaaa |
|  23 | aaaaaaaaaaaaaaaaaaaa |
|  24 | aaaaaaaaaaaaaaaaaaaa |
|  25 | aaaaaaaaaaaaaaaaaaaa |
|  26 | aaaaaaaaaaaaaaaaaaaa |
|  27 | aaaaaaaaaaaaaaaaaaaa |
|  28 | aaaaaaaaaaaaaaaaaaaa |
|  29 | aaaaaaaaaaaaaaaaaaaa |
|  30 | aaaaaaaaaaaaaaaaaaaa |
|  31 | aaaaaaaaaaaaaaaaaaaa |
|  32 | aaaaaaaaaaaaaaaaaaaa |
|  33 | aaaaaaaaaaaaaaaaaaaa |
|  34 | aaaaaaaaaaaaaaaaaaaa |
|  35 | aaaaaaaaaaaaaaaaaaaa |
|  36 | aaaaaaaaaaaaaaaaaaaa |
|  37 | aaaaaaaaaaaaaaaaaaaa |
|  38 | aaaaaaaaaaaaaaaaaaaa |
|  39 | aaaaaaaaaaaaaaaaaaaa |
|  40 | aaaaaaaaaaaaaaaaaaaa |
|  41 | aaaaaaaaaaaaaaaaaaaa |
|  42 | aaaaaaaaaaaaaaaaaaaa |
|  43 | aaaaaaaaaaaaaaaaaaaa |
|  44 | aaaaaaaaaaaaaaaaaaaa |
|  45 | aaaaaaaaaaaaaaaaaaaa |
|  46 | aaaaaaaaaaaaaaaaaaaa |
|  47 | aaaaaaaaaaaaaaaaaaaa |
|  48 | aaaaaaaaaaaaaaaaaaaa |
|  49 | aaaaaaaaaaaaaaaaaaaa |
|  50 | aaaaaaaaaaaaaaaaaaaa |
|  51 | aaaaaaaaaaaaaaaaaaaa |
|  52 | aaaaaaaaaaaaaaaaaaaa |
|  53 | aaaaaaaaaaaaaaaaaaaa |
|  54 | aaaaaaaaaaaaaaaaaaaa |
|  55 | aaaaaaaaaaaaaaaaaaaa |
|  56 | aaaaaaaaaaaaaaaaaaaa |
|  57 | aaaaaaaaaaaaaaaaaaaa |
|  58 | aaaaaaaaaaaaaaaaaaaa |
|  59 | aaaaaaaaaaaaaaaaaaaa |
|  60 | aaaaaaaaaaaaaaaaaaaa |
|  61 | aaaaaaaaaaaaaaaaaaaa |
|  62 | aaaaaaaaaaaaaaaaaaaa |
|  63 | aaaaaaaaaaaaaaaaaaaa |
|  64 | aaaaaaaaaaaaaaaaaaaa |
|  65 | aaaaaaaaaaaaaaaaaaaa |
|  66 | aaaaaaaaaaaaaaaaaaaa |
|  67 | aaaaaaaaaaaaaaaaaaaa |
|  68 | aaaaaaaaaaaaaaaaaaaa |
|  69 | aaaaaaaaaaaaaaaaaaaa |
|  70 | aaaaaaaaaaaaaaaaaaaa |
|  71 | aaaaaaaaaaaaaaaaaaaa |
|  72 | aaaaaaaaaaaaaaaaaaaa |
|  73 | aaaaaaaaaaaaaaaaaaaa |
|  74 | aaaaaaaaaaaaaaaaaaaa |
|  75 | aaaaaaaaaaaaaaaaaaaa |
|  76 | aaaaaaaaaaaaaaaaaaaa |
|  77 | aaaaaaaaaaaaaaaaaaaa |
|  78 | aaaaaaaaaaaaaaaaaaaa |
|  79 | aaaaaaaaaaaaaaaaaaaa |
|  80 | aaaaaaaaaaaaaaaaaaaa |
|  81 | aaaaaaaaaaaaaaaaaaaa |
|  82 | aaaaaaaaaaaaaaaaaaaa |
|  83 | aaaaaaaaaaaaaaaaaaaa |
|  84 | aaaaaaaaaaaaaaaaaaaa |
|  85 | aaaaaaaaaaaaaaaaaaaa |
|  86 | aaaaaaaaaaaaaaaaaaaa |
|  87 | aaaaaaaaaaaaaaaaaaaa |
|  88 | aaaaaaaaaaaaaaaaaaaa |
|  89 | aaaaaaaaaaaaaaaaaaaa |
|  90 | aaaaaaaaaaaaaaaaaaaa |
|  91 | aaaaaaaaaaaaaaaaaaaa |
|  92 | aaaaaaaaaaaaaaaaaaaa |
|  93 | aaaaaaaaaaaaaaaaaaaa |
|  94 | aaaaaaaaaaaaaaaaaaaa |
|  95 | aaaaaaaaaaaaaaaaaaaa |
|  96 | aaaaaaaaaaaaaaaaaaaa |
|  97 | aaaaaaaaaaaaaaaaaaaa |
|  98 | aaaaaaaaaaaaaaaaaaaa |
|  99 | aaaaaaaaaaaaaaaaaaaa |
| 100 | aaaaaaaaaaaaaaaaaaaa |
| 101 | aaaaaaaaaaaaaaaaaaaa |
| 102 | aaaaaaaaaaaaaaaaaaaa |
| 103 | aaaaaaaaaaaaaaaaaaaa |
| 104 | aaaaaaaaaaaaaaaaaaaa |
| 105 | aaaaaaaaaaaaaaaaaaaa |
| 106 | aaaaaaaaaaaaaaaaaaaa |
| 107 | aaaaaaaaaaaaaaaaaaaa |
| 108 | aaaaaaaaaaaaaaaaaaaa |
| 109 | aaaaaaaaaaaaaaaaaaaa |
| 110 | aaaaaaaaaaaaaaaaaaaa |
| 111 | aaaaaaaaaaaaaaaaaaaa |
| 112 | aaaaaaaaaaaaaaaaaaaa |
| 113 | aaaaaaaaaaaaaaaaaaaa |
| 114 | aaaaaaaaaaaaaaaaaaaa |
| 115 | aaaaaaaaaaaaaaaaaaaa |
| 116 | aaaaaaaaaaaaaaaaaaaa |
| 117 | aaaaaaaaaaaaaaaaaaaa |
| 118 | aaaaaaaaaaaaaaaaaaaa |
| 119 | aaaaaaaaaaaaaaaaaaaa |
| 120 | aaaaaaaaaaaaaaaaaaaa |
| 121 | aaaaaaaaaaaaaaaaaaaa |
| 122 | aaaaaaaaaaaaaaaaaaaa |
| 123 | aaaaaaaaaaaaaaaaaaaa |
| 124 | aaaaaaaaaaaaaaaaaaaa |
| 125 | aaaaaaaaaaaaaaaaaaaa |
| 126 | aaaaaaaaaaaaaaaaaaaa |
| 127 | aaaaaaaaaaaaaaaaaaaa |
| 128 | aaaaaaaaaaaaaaaaaaaa |
| 129 | aaaaaaaaaaaaaaaaaaaa |
| 130 | aaaaaaaaaaaaaaaaaaaa |
| 131 | aaaaaaaaaaaaaaaaaaaa |
| 132 | aaaaaaaaaaaaaaaaaaaa |
| 133 | aaaaaaaaaaaaaaaaaaaa |
| 134 | aaaaaaaaaaaaaaaaaaaa |
| 135 | aaaaaaaaaaaaaaaaaaaa |
| 136 | aaaaaaaaaaaaaaaaaaaa |
| 137 | aaaaaaaaaaaaaaaaaaaa |
| 138 | aaaaaaaaaaaaaaaaaaaa |
| 139 | aaaaaaaaaaaaaaaaaaaa |
| 140 | aaaaaaaaaaaaaaaaaaaa |
| 141 | aaaaaaaaaaaaaaaaaaaa |
| 142 | aaaaaaaaaaaaaaaaaaaa |
| 143 | aaaaaaaaaaaaaaaaaaaa |
| 144 | aaaaaaaaaaaaaaaaaaaa |
| 145 | aaaaaaaaaaaaaaaaaaaa |
| 146 | aaaaaaaaaaaaaaaaaaaa |
| 147 | aaaaaaaaaaaaaaaaaaaa |
| 148 | aaaaaaaaaaaaaaaaaaaa |
| 149 | aaaaaaaaaaaaaaaaaaaa |
| 150 | aaaaaaaaaaaaaaaaaaaa |
| 151 | aaaaaaaaaaaaaaaaaaaa |
| 152 | aaaaaaaaaaaaaaaaaaaa |
| 153 | aaaaaaaaaaaaaaaaaaaa |
| 154 | aaaaaaaaaaaaaaaaaaaa |
| 155 | aaaaaaaaaaaaaaaaaaaa |
| 156 | aaaaaaaaaaaaaaaaaaaa |
| 157 | aaaaaaaaaaaaaaaaaaaa |
| 158 | aaaaaaaaaaaaaaaaaaaa |
| 159 | aaaaaaaaaaaaaaaaaaaa |
| 160 | aaaaaaaaaaaaaaaaaaaa |
| 161 | aaaaaaaaaaaaaaaaaaaa |
| 162 | aaaaaaaaaaaaaaaaaaaa |
| 163 | aaaaaaaaaaaaaaaaaaaa |
| 164 | aaaaaaaaaaaaaaaaaaaa |
| 165 | aaaaaaaaaaaaaaaaaaaa |
| 166 | aaaaaaaaaaaaaaaaaaaa |
| 167 | aaaaaaaaaaaaaaaaaaaa |
| 168 | aaaaaaaaaaaaaaaaaaaa |
| 169 | aaaaaaaaaaaaaaaaaaaa |
| 170 | aaaaaaaaaaaaaaaaaaaa |
| 171 | aaaaaaaaaaaaaaaaaaaa |
| 172 | aaaaaaaaaaaaaaaaaaaa |
| 173 | aaaaaaaaaaaaaaaaaaaa |
| 174 | aaaaaaaaaaaaaaaaaaaa |
| 175 | aaaaaaaaaaaaaaaaaaaa |
| 176 | aaaaaaaaaaaaaaaaaaaa |
| 177 | aaaaaaaaaaaaaaaaaaaa |
| 178 | aaaaaaaaaaaaaaaaaaaa |
| 179 | aaaaaaaaaaaaaaaaaaaa |
| 180 | aaaaaaaaaaaaaaaaaaaa |
| 181 | aaaaaaaaaaaaaaaaaaaa |
| 182 | aaaaaaaaaaaaaaaaaaaa |
| 183 | aaaaaaaaaaaaaaaaaaaa |
| 184 | aaaaaaaaaaaaaaaaaaaa |
| 185 | aaaaaaaaaaaaaaaaaaaa |
| 186 | aaaaaaaaaaaaaaaaaaaa |
| 187 | aaaaaaaaaaaaaaaaaaaa |
| 188 | aaaaaaaaaaaaaaaaaaaa |
| 189 | aaaaaaaaaaaaaaaaaaaa |
| 190 | aaaaaaaaaaaaaaaaaaaa |
| 191 | aaaaaaaaaaaaaaaaaaaa |
| 192 | aaaaaaaaaaaaaaaaaaaa |
| 193 | aaaaaaaaaaaaaaaaaaaa |
| 194 | aaaaaaaaaaaaaaaaaaaa |
| 195 | aaaaaaaaaaaaaaaaaaaa |
| 196 | aaaaaaaaaaaaaaaaaaaa |
| 197 | aaaaaaaaaaaaaaaaaaaa |
| 198 | aaaaaaaaaaaaaaaaaaaa |
| 199 | aaaaaaaaaaaaaaaaaaaa |
| 200 | aaaaaaaaaaaaaaaaaaaa |
| 201 | aaaaaaaaaaaaaaaaaaaa |
| 202 | aaaaaaaaaaaaaaaaaaaa |
| 203 | aaaaaaaaaaaaaaaaaaaa |
| 204 | aaaaaaaaaaaaaaaaaaaa |
| 205 | aaaaaaaaaaaaaaaaaaaa |
| 206 | aaaaaaaaaaaaaaaaaaaa |
| 207 | aaaaaaaaaaaaaaaaaaaa |
| 208 | aaaaaaaaaaaaaaaaaaaa |
| 209 | aaaaaaaaaaaaaaaaaaaa |
| 210 | aaaaaaaaaaaaaaaaaaaa |
| 211 | aaaaaaaaaaaaaaaaaaaa |
| 212 | aaaaaaaaaaaaaaaaaaaa |
| 213 | aaaaaaaaaaaaaaaaaaaa |
| 214 | aaaaaaaaaaaaaaaaaaaa |
| 215 | aaaaaaaaaaaaaaaaaaaa |
| 216 | aaaaaaaaaaaaaaaaaaaa |
| 217 | aaaaaaaaaaaaaaaaaaaa |
| 218 | aaaaaaaaaaaaaaaaaaaa |
| 219 | aaaaaaaaaaaaaaaaaaaa |
| 220 | aaaaaaaaaaaaaaaaaaaa |
| 221 | aaaaaaaaaaaaaaaaaaaa |
| 222 | aaaaaaaaaaaaaaaaaaaa |
| 223 | aaaaaaaaaaaaaaaaaaaa |
| 224 | aaaaaaaaaaaaaaaaaaaa |
| 225 | aaaaaaaaaaaaaaaaaaaa |
| 226 | aaaaaaaaaaaaaaaaaaaa |
| 227 | aaaaaaaaaaaaaaaaaaaa |
| 228 | aaaaaaaaaaaaaaaaaaaa |
| 229 | aaaaaaaaaaaaaaaaaaaa |
| 230 | aaaaaaaaaaaaaaaaaaaa |
| 231 | aaaaaaaaaaaaaaaaaaaa |
| 232 | aaaaaaaaaaaaaaaaaaaa |
| 233 | aaaaaaaaaaaaaaaaaaaa |
| 234 | aaaaaaaaaaaaaaaaaaaa |
| 235 | aaaaaaaaaaaaaaaaaaaa |
| 236 | aaaaaaaaaaaaaaaaaaaa |
| 237 | aaaaaaaaaaaaaaaaaaaa |
| 238 | aaaaaaaaaaaaaaaaaaaa |
| 239 | aaaaaaaaaaaaaaaaaaaa |
| 240 | aaaaaaaaaaaaaaaaaaaa |
| 241 | aaaaaaaaaaaaaaaaaaaa |
| 242 | aaaaaaaaaaaaaaaaaaaa |
| 243 | aaaaaaaaaaaaaaaaaaaa |
| 244 | aaaaaaaaaaaaaaaaaaaa |
| 245 | aaaaaaaaaaaaaaaaaaaa |
| 246 | aaaaaaaaaaaaaaaaaaaa |
| 247 | aaaaaaaaaaaaaaaaaaaa |
| 248 | aaaaaaaaaaaaaaaaaaaa |
| 249 | aaaaaaaaaaaaaaaaaaaa |
| 250 | aaaaaaaaaaaaaaaaaaaa |
| 251 | aaaaaaaaaaaaaaaaaaaa |
| 252 | aaaaaaaaaaaaaaaaaaaa |
| 253 | aaaaaaaaaaaaaaaaaaaa |
| 254 | aaaaaaaaaaaaaaaaaaaa |
| 255 | aaaaaaaaaaaaaaaaaaaa |
| 256 | aaaaaaaaaaaaaaaaaaaa |
| 257 | aaaaaaaaaaaaaaaaaaaa |
| 258 | aaaaaaaaaaaaaaaaaaaa |
| 259 | aaaaaaaaaaaaaaaaaaaa |
| 260 | aaaaaaaaaaaaaaaaaaaa |
| 261 | aaaaaaaaaaaaaaaaaaaa |
| 262 | aaaaaaaaaaaaaaaaaaaa |
| 263 | aaaaaaaaaaaaaaaaaaaa |
| 264 | aaaaaaaaaaaaaaaaaaaa |
| 265 | aaaaaaaaaaaaaaaaaaaa |
| 266 | aaaaaaaaaaaaaaaaaaaa |
| 267 | aaaaaaaaaaaaaaaaaaaa |
| 268 | aaaaaaaaaaaaaaaaaaaa |
| 269 | aaaaaaaaaaaaaaaaaaaa |
| 270 | aaaaaaaaaaaaaaaaaaaa |
| 271 | aaaaaaaaaaaaaaaaaaaa |
| 272 | aaaaaaaaaaaaaaaaaaaa |
| 273 | aaaaaaaaaaaaaaaaaaaa |
| 274 | aaaaaaaaaaaaaaaaaaaa |
| 275 | aaaaaaaaaaaaaaaaaaaa |
| 276 | aaaaaaaaaaaaaaaaaaaa |
| 277 | aaaaaaaaaaaaaaaaaaaa |
| 278 | aaaaaaaaaaaaaaaaaaaa |
| 279 | aaaaaaaaaaaaaaaaaaaa |
| 280 | aaaaaaaaaaaaaaaaaaaa |
| 281 | aaaaaaaaaaaaaaaaaaaa |
| 282 | aaaaaaaaaaaaaaaaaaaa |
| 283 | aaaaaaaaaaaaaaaaaaaa |
| 284 | aaaaaaaaaaaaaaaaaaaa |
| 285 | aaaaaaaaaaaaaaaaaaaa |
| 286 | aaaaaaaaaaaaaaaaaaaa |
| 287 | aaaaaaaaaaaaaaaaaaaa |
| 288 | aaaaaaaaaaaaaaaaaaaa |
| 289 | aaaaaaaaaaaaaaaaaaaa |
| 290 | aaaaaaaaaaaaaaaaaaaa |
| 291 | aaaaaaaaaaaaaaaaaaaa |
| 292 | aaaaaaaaaaaaaaaaaaaa |
| 293 | aaaaaaaaaaaaaaaaaaaa |
| 294 | aaaaaaaaaaaaaaaaaaaa |
| 295 | aaaaaaaaaaaaaaaaaaaa |
| 296 | aaaaaaaaaaaaaaaaaaaa |
| 297 | aaaaaaaaaaaaaaaaaaaa |
| 298 | aaaaaaaaaaaaaaaaaaaa |
| 299 | aaaaaaaaaaaaaaaaaaaa |
| 300 | aaaaaaaaaaaaaaaaaaaa |
| 301 | aaaaaaaaaaaaaaaaaaaa |
| 302 | aaaaaaaaaaaaaaaaaaaa |
| 303 | aaaaaaaaaaaaaaaaaaaa |
| 304 | aaaaaaaaaaaaaaaaaaaa |
| 305 | aaaaaaaaaaaaaaaaaaaa |
| 306 | aaaaaaaaaaaaaaaaaaaa |
| 307 | aaaaaaaaaaaaaaaaaaaa |
| 308 | aaaaaaaaaaaaaaaaaaaa |
| 309 | aaaaaaaaaaaaaaaaaaaa |
| 310 | aaaaaaaaaaaaaaaaaaaa |
| 311 | aaaaaaaaaaaaaaaaaaaa |
| 312 | aaaaaaaaaaaaaaaaaaaa |
| 313 | aaaaaaaaaaaaaaaaaaaa |
| 314 | aaaaaaaaaaaaaaaaaaaa |
| 315 | aaaaaaaaaaaaaaaaaaaa |
| 316 | aaaaaaaaaaaaaaaaaaaa |
| 317 | aaaaaaaaaaaaaaaaaaaa |
| 318 | aaaaaaaaaaaaaaaaaaaa |
| 319 | aaaaaaaaaaaaaaaaaaaa |
| 320 | aaaaaaaaaaaaaaaaaaaa |
| 321 | aaaaaaaaaaaaaaaaaaaa |
| 322 | aaaaaaaaaaaaaaaaaaaa |
| 323 | aaaaaaaaaaaaaaaaaaaa |
| 324 | aaaaaaaaaaaaaaaaaaaa |
| 325 | aaaaaaaaaaaaaaaaaaaa |
| 326 | aaaaaaaaaaaaaaaaaaaa |
| 327 | aaaaaaaaaaaaaaaaaaaa |
| 328 | aaaaaaaaaaaaaaaaaaaa |
| 329 | aaaaaaaaaaaaaaaaaaaa |
| 330 | aaaaaaaaaaaaaaaaaaaa |
| 331 | aaaaaaaaaaaaaaaaaaaa |
| 332 | aaaaaaaaaaaaaaaaaaaa |
| 333 | aaaaaaaaaaaaaaaaaaaa |
| 334 | aaaaaaaaaaaaaaaaaaaa |
| 335 | aaaaaaaaaaaaaaaaaaaa |
| 336 | aaaaaaaaaaaaaaaaaaaa |
| 337 | aaaaaaaaaaaaaaaaaaaa |
| 338 | aaaaaaaaaaaaaaaaaaaa |
| 339 | aaaaaaaaaaaaaaaaaaaa |
| 340 | aaaaaaaaaaaaaaaaaaaa |
| 341 | aaaaaaaaaaaaaaaaaaaa |
| 342 | aaaaaaaaaaaaaaaaaaaa |
| 343 | aaaaaaaaaaaaaaaaaaaa |
| 344 | aaaaaaaaaaaaaaaaaaaa |
| 345 | aaaaaaaaaaaaaaaaaaaa |
| 346 | aaaaaaaaaaaaaaaaaaaa |
| 347 | aaaaaaaaaaaaaaaaaaaa |
| 348 | aaaaaaaaaaaaaaaaaaaa |
| 349 | aaaaaaaaaaaaaaaaaaaa |
| 350 | aaaaaaaaaaaaaaaaaaaa |
| 351 | aaaaaaaaaaaaaaaaaaaa |
| 352 | aaaaaaaaaaaaaaaaaaaa |
| 353 | aaaaaaaaaaaaaaaaaaaa |
| 354 | aaaaaaaaaaaaaaaaaaaa |
| 355 | aaaaaaaaaaaaaaaaaaaa |
| 356 | aaaaaaaaaaaaaaaaaaaa |
| 357 | aaaaaaaaaaaaaaaaaaaa |
| 358 | aaaaaaaaaaaaaaaaaaaa |
| 359 | aaaaaaaaaaaaaaaaaaaa |
| 360 | aaaaaaaaaaaaaaaaaaaa |
| 361 | aaaaaaaaaaaaaaaaaaaa |
| 362 | aaaaaaaaaaaaaaaaaaaa |
| 363 | aaaaaaaaaaaaaaaaaaaa |
| 364 | aaaaaaaaaaaaaaaaaaaa |
| 365 | aaaaaaaaaaaaaaaaaaaa |
| 366 | aaaaaaaaaaaaaaaaaaaa |
| 367 | aaaaaaaaaaaaaaaaaaaa |
| 368 | aaaaaaaaaaaaaaaaaaaa |
| 369 | aaaaaaaaaaaaaaaaaaaa |
| 370 | aaaaaaaaaaaaaaaaaaaa |
| 371 | aaaaaaaaaaaaaaaaaaaa |
| 372 | aaaaaaaaaaaaaaaaaaaa |
| 373 | aaaaaaaaaaaaaaaaaaaa |
| 374 | aaaaaaaaaaaaaaaaaaaa |
| 375 | aaaaaaaaaaaaaaaaaaaa |
| 376 | aaaaaaaaaaaaaaaaaaaa |
| 377 | aaaaaaaaaaaaaaaaaaaa |
| 378 | aaaaaaaaaaaaaaaaaaaa |
| 379 | aaaaaaaaaaaaaaaaaaaa |
| 380 | aaaaaaaaaaaaaaaaaaaa |
| 381 | aaaaaaaaaaaaaaaaaaaa |
| 382 | aaaaaaaaaaaaaaaaaaaa |
| 383 | aaaaaaaaaaaaaaaaaaaa |
| 384 | aaaaaaaaaaaaaaaaaaaa |
| 385 | aaaaaaaaaaaaaaaaaaaa |
| 386 | aaaaaaaaaaaaaaaaaaaa |
| 387 | aaaaaaaaaaaaaaaaaaaa |
| 388 | aaaaaaaaaaaaaaaaaaaa |
| 389 | aaaaaaaaaaaaaaaaaaaa |
| 390 | aaaaaaaaaaaaaaaaaaaa |
| 391 | aaaaaaaaaaaaaaaaaaaa |
| 392 | aaaaaaaaaaaaaaaaaaaa |
| 393 | aaaaaaaaaaaaaaaaaaaa |
| 394 | aaaaaaaaaaaaaaaaaaaa |
| 395 | aaaaaaaaaaaaaaaaaaaa |
| 396 | aaaaaaaaaaaaaaaaaaaa |
| 397 | aaaaaaaaaaaaaaaaaaaa |
| 398 | aaaaaaaaaaaaaaaaaaaa |
| 399 | aaaaaaaaaaaaaaaaaaaa |
| 400 | aaaaaaaaaaaaaaaaaaaa |
| 401 | aaaaaaaaaaaaaaaaaaaa |
| 402 | aaaaaaaaaaaaaaaaaaaa |
| 403 | aaaaaaaaaaaaaaaaaaaa |
| 404 | aaaaaaaaaaaaaaaaaaaa |
| 405 | aaaaaaaaaaaaaaaaaaaa |
| 406 | aaaaaaaaaaaaaaaaaaaa |
| 407 | aaaaaaaaaaaaaaaaaaaa |
| 408 | aaaaaaaaaaaaaaaaaaaa |
| 409 | aaaaaaaaaaaaaaaaaaaa |
| 410 | aaaaaaaaaaaaaaaaaaaa |
| 411 | aaaaaaaaaaaaaaaaaaaa |
| 412 | aaaaaaaaaaaaaaaaaaaa |
| 413 | aaaaaaaaaaaaaaaaaaaa |
| 414 | aaaaaaaaaaaaaaaaaaaa |
| 415 | aaaaaaaaaaaaaaaaaaaa |
| 416 | aaaaaaaaaaaaaaaaaaaa |
| 417 | aaaaaaaaaaaaaaaaaaaa |
| 418 | aaaaaaaaaaaaaaaaaaaa |
| 419 | aaaaaaaaaaaaaaaaaaaa |
| 420 | aaaaaaaaaaaaaaaaaaaa |
| 421 | aaaaaaaaaaaaaaaaaaaa |
| 422 | aaaaaaaaaaaaaaaaaaaa |
| 423 | aaaaaaaaaaaaaaaaaaaa |
| 424 | aaaaaaaaaaaaaaaaaaaa |
| 425 | aaaaaaaaaaaaaaaaaaaa |
| 426 | aaaaaaaaaaaaaaaaaaaa |
| 427 | aaaaaaaaaaaaaaaaaaaa |
| 428 | aaaaaaaaaaaaaaaaaaaa |
| 429 | aaaaaaaaaaaaaaaaaaaa |
| 430 | aaaaaaaaaaaaaaaaaaaa |
| 431 | aaaaaaaaaaaaaaaaaaaa |
| 432 | aaaaaaaaaaaaaaaaaaaa |
| 433 | aaaaaaaaaaaaaaaaaaaa |
| 434 | aaaaaaaaaaaaaaaaaaaa |
| 435 | aaaaaaaaaaaaaaaaaaaa |
| 436 | aaaaaaaaaaaaaaaaaaaa |
| 437 | aaaaaaaaaaaaaaaaaaaa |
| 438 | aaaaaaaaaaaaaaaaaaaa |
| 439 | aaaaaaaaaaaaaaaaaaaa |
| 440 | aaaaaaaaaaaaaaaaaaaa |
| 441 | aaaaaaaaaaaaaaaaaaaa |
| 442 | aaaaaaaaaaaaaaaaaaaa |
| 443 | aaaaaaaaaaaaaaaaaaaa |
| 444 | aaaaaaaaaaaaaaaaaaaa |
| 445 | aaaaaaaaaaaaaaaaaaaa |
| 446 | aaaaaaaaaaaaaaaaaaaa |
| 447 | aaaaaaaaaaaaaaaaaaaa |
| 448 | aaaaaaaaaaaaaaaaaaaa |
| 449 | aaaaaaaaaaaaaaaaaaaa |
| 450 | aaaaaaaaaaaaaaaaaaaa |
| 451 | aaaaaaaaaaaaaaaaaaaa |
| 452 | aaaaaaaaaaaaaaaaaaaa |
| 453 | aaaaaaaaaaaaaaaaaaaa |
| 454 | aaaaaaaaaaaaaaaaaaaa |
| 455 | aaaaaaaaaaaaaaaaaaaa |
| 456 | aaaaaaaaaaaaaaaaaaaa |
| 457 | aaaaaaaaaaaaaaaaaaaa |
| 458 | aaaaaaaaaaaaaaaaaaaa |
| 459 | aaaaaaaaaaaaaaaaaaaa |
| 460 | aaaaaaaaaaaaaaaaaaaa |
| 461 | aaaaaaaaaaaaaaaaaaaa |
| 462 | aaaaaaaaaaaaaaaaaaaa |
| 463 | aaaaaaaaaaaaaaaaaaaa |
| 464 | aaaaaaaaaaaaaaaaaaaa |
| 465 | aaaaaaaaaaaaaaaaaaaa |
| 466 | aaaaaaaaaaaaaaaaaaaa |
| 467 | aaaaaaaaaaaaaaaaaaaa |
| 468 | aaaaaaaaaaaaaaaaaaaa |
| 469 | aaaaaaaaaaaaaaaaaaaa |
| 470 | aaaaaaaaaaaaaaaaaaaa |
| 471 | aaaaaaaaaaaaaaaaaaaa |
| 472 | aaaaaaaaaaaaaaaaaaaa |
| 473 | aaaaaaaaaaaaaaaaaaaa |
| 474 | aaaaaaaaaaaaaaaaaaaa |
| 475 | aaaaaaaaaaaaaaaaaaaa |
| 476 | aaaaaaaaaaaaaaaaaaaa |
| 477 | aaaaaaaaaaaaaaaaaaaa |
| 478 | aaaaaaaaaaaaaaaaaaaa |
| 479 | aaaaaaaaaaaaaaaaaaaa |
| 480 | aaaaaaaaaaaaaaaaaaaa |
| 481 | aaaaaaaaaaaaaaaaaaaa |
| 482 | aaaaaaaaaaaaaaaaaaaa |
| 483 | aaaaaaaaaaaaaaaaaaaa |
| 484 | aaaaaaaaaaaaaaaaaaaa |
| 485 | aaaaaaaaaaaaaaaaaaaa |
| 486 | aaaaaaaaaaaaaaaaaaaa |
| 487 | aaaaaaaaaaaaaaaaaaaa |
| 488 | aaaaaaaaaaaaaaaaaaaa |
| 489 | aaaaaaaaaaaaaaaaaaaa |
| 490 | aaaaaaaaaaaaaaaaaaaa |
| 491 | aaaaaaaaaaaaaaaaaaaa |
| 492 | aaaaaaaaaaaaaaaaaaaa |
| 493 | aaaaaaaaaaaaaaaaaaaa |
| 494 | aaaaaaaaaaaaaaaaaaaa |
| 495 | aaaaaaaaaaaaaaaaaaaa |
| 496 | aaaaaaaaaaaaaaaaaaaa |
| 497 | aaaaaaaaaaaaaaaaaaaa |
| 498 | aaaaaaaaaaaaaaaaaaaa |
| 499 | aaaaaaaaaaaaaaaaaaaa |
| 500 | aaaaaaaaaaaaaaaaaaaa |
+-----+----------------------+
drop table t1,t2;

CREATE TABLE t1 (
  id int(11) NOT NULL default '0',
  name varchar(10) default NULL,
  PRIMARY KEY  (id)
);
INSERT INTO t1 VALUES (1,'aaa'),(2,'aaa'),(3,'aaa');
CREATE TABLE t2 (
  id int(11) NOT NULL default '0',
  name varchar(10) default NULL,
  PRIMARY KEY  (id)
);
INSERT INTO t2 VALUES (2,'bbb'),(3,'bbb'),(4,'bbb');
CREATE TABLE t3 (
  id int(11) NOT NULL default '0',
  mydate datetime default NULL,
  PRIMARY KEY  (id)
);
INSERT INTO t3 VALUES (1,'2002-02-04 00:00:00'),(3,'2002-05-12 00:00:00'),(5,'2002-05-12 00:00:00'),(6,'2002-06-22
00:00:00'),(7,'2002-07-22 00:00:00');
delete t1,t2,t3 from t1,t2,t3 where to_days(now())-to_days(t3.mydate)>=30 and t3.id=t1.id and t3.id=t2.id;
select * from t3;
+----+---------------------+
| id | mydate              |
+----+---------------------+
|  1 | 2002-02-04 00:00:00 |
|  5 | 2002-05-12 00:00:00 |
|  6 | 2002-06-22 00:00:00 |
|  7 | 2002-07-22 00:00:00 |
+----+---------------------+
DROP TABLE t1,t2,t3;

CREATE TABLE IF NOT EXISTS `t1` (
  `id` int(11) NOT NULL auto_increment,
  `tst` varchar(10),
  `tst1` varchar(10),
  PRIMARY KEY  (`id`)
);

CREATE TABLE IF NOT EXISTS `t2` (
  `ID` int(11) NOT NULL auto_increment,
  `ParId` int(11) default NULL,
  `tst` varchar(10),
  `tst1` varchar(10),
  PRIMARY KEY  (`ID`),
  KEY `IX_ParId_t2` (`ParId`),
  FOREIGN KEY (`ParId`) REFERENCES `t1` (`id`)
);

INSERT INTO t1(tst,tst1) VALUES("MySQL","MySQL AB"), ("MSSQL","Microsoft"), ("ORACLE","ORACLE");

INSERT INTO t2(ParId) VALUES(1), (2), (3);

select * from t2;
+----+-------+------+------+
| ID | ParId | tst  | tst1 |
+----+-------+------+------+
|  1 |     1 | NULL | NULL |
|  2 |     2 | NULL | NULL |
|  3 |     3 | NULL | NULL |
+----+-------+------+------+

UPDATE t2, t1 SET t2.tst = t1.tst, t2.tst1 = t1.tst1 WHERE t2.ParId = t1.Id;

select * from t2;
+----+-------+--------+-----------+
| ID | ParId | tst    | tst1      |
+----+-------+--------+-----------+
|  1 |     1 | MySQL  | MySQL AB  |
|  2 |     2 | MSSQL  | Microsoft |
|  3 |     3 | ORACLE | ORACLE    |
+----+-------+--------+-----------+
drop table t2, t1;

create table t1 (n numeric(10));
create table t2 (n numeric(10));
insert into t2 values (1),(2),(4),(8),(16),(32);
+----------+
| count(*) |
+----------+
|        6 |
+----------+
select * from t2 left outer join t1  using (n);
+------+
| n    |
+------+
|    1 |
|    2 |
|    4 |
|    8 |
|   16 |
|   32 |
+------+
delete  t1,t2 from t2 left outer join t1  using (n);
select * from t2 left outer join t1  using (n);
+------+
| n    |
+------+
+------+
drop table t1,t2 ;

create table t1 (n int(10), d int(10));
create table t2 (n int(10), d int(10));
insert into t1 values(1,1);
insert into t2 values(1,10),(2,20);
+----------+
| count(*) |
+----------+
|        1 |
+----------+
+----------+
| count(*) |
+----------+
|        2 |
+----------+
UPDATE t1,t2 SET t1.d=t2.d WHERE t1.n=t2.n;
drop table t1,t2;
set timestamp=1038401397;
create table t1 (n int(10) not null primary key, d int(10), t timestamp NOT NULL DEFAULT CURRENT_TIMESTAMP ON UPDATE CURRENT_TIMESTAMP);
create table t2 (n int(10) not null primary key, d int(10), t timestamp NOT NULL DEFAULT CURRENT_TIMESTAMP ON UPDATE CURRENT_TIMESTAMP);
insert into t1 values(1,1,NULL);
insert into t2 values(1,10,NULL),(2,20,NULL);
+----------+
| count(*) |
+----------+
|        1 |
+----------+
+----------+
| count(*) |
+----------+
|        2 |
+----------+
set timestamp=1038000000;
UPDATE t1,t2 SET t1.d=t2.d WHERE t1.n=t2.n;
select n,d,unix_timestamp(t) from t1;
+---+------+-------------------+
| n | d    | unix_timestamp(t) |
+---+------+-------------------+
| 1 |   10 |        1038000000 |
+---+------+-------------------+
select n,d,unix_timestamp(t) from t2;
+---+------+-------------------+
| n | d    | unix_timestamp(t) |
+---+------+-------------------+
| 1 |   10 |        1038401397 |
| 2 |   20 |        1038401397 |
+---+------+-------------------+
UPDATE t1,t2 SET 1=2 WHERE t1.n=t2.n;
ERROR 42000: You have an error in your SQL syntax; check the manual that corresponds to your OceanBase version for the right syntax to use near '1=2 WHERE t1.n=t2.n' at line 1
drop table t1,t2;
set timestamp=0;
create table t1 (n int(10) not null primary key, d int(10));
create table t2 (n int(10) not null primary key, d int(10));
insert into t1 values(1,1), (3,3);
insert into t2 values(1,10),(2,20);
+----------+
| count(*) |
+----------+
|        2 |
+----------+
+----------+
| count(*) |
+----------+
|        2 |
+----------+
UPDATE t2 left outer join t1 on t1.n=t2.n  SET t1.d=t2.d;
select * from t1;
+---+------+
| n | d    |
+---+------+
| 1 |   10 |
| 3 |    3 |
+---+------+
select * from t2;
+---+------+
| n | d    |
+---+------+
| 1 |   10 |
| 2 |   20 |
+---+------+
drop table t1,t2;
create table t1 (n int(10), d int(10));
create table t2 (n int(10), d int(10));
insert into t1 values(1,1),(1,2);
insert into t2 values(1,10),(2,20);
+----------+
| count(*) |
+----------+
|        2 |
+----------+
+----------+
| count(*) |
+----------+
|        2 |
+----------+
UPDATE t1,t2 SET t1.d=t2.d,t2.d=30 WHERE t1.n=t2.n;
select * from t1;
+------+------+
| n    | d    |
+------+------+
|    1 |   10 |
|    1 |   10 |
+------+------+
select * from t2;
+------+------+
| n    | d    |
+------+------+
|    1 |   30 |
|    2 |   20 |
+------+------+
drop table t1,t2;
create table t1 (n int(10), d int(10));
create table t2 (n int(10), d int(10));
insert into t1 values(1,1),(3,2);
insert into t2 values(1,10),(1,20);
+----------+
| count(*) |
+----------+
|        2 |
+----------+
+----------+
| count(*) |
+----------+
|        2 |
+----------+
UPDATE t1,t2 SET t1.d=t2.d,t2.d=30 WHERE t1.n=t2.n;
select * from t1;
+------+------+
| n    | d    |
+------+------+
|    1 |   10 |
|    3 |    2 |
+------+------+
select * from t2;
+------+------+
| n    | d    |
+------+------+
|    1 |   30 |
|    1 |   30 |
+------+------+
UPDATE t1 a ,t2 b SET a.d=b.d,b.d=30 WHERE a.n=b.n;
select * from t1;
+------+------+
| n    | d    |
+------+------+
|    1 |   30 |
|    3 |    2 |
+------+------+
select * from t2;
+------+------+
| n    | d    |
+------+------+
|    1 |   30 |
|    1 |   30 |
+------+------+
DELETE a, b  FROM t1 a,t2 b where a.n=b.n;
select * from t1;
+------+------+
| n    | d    |
+------+------+
|    3 |    2 |
+------+------+
select * from t2;
+------+------+
| n    | d    |
+------+------+
+------+------+
drop table t1,t2;

CREATE TABLE t1 ( broj int(4) unsigned NOT NULL default '0',  naziv char(25) NOT NULL default 'NEPOZNAT',  PRIMARY KEY  (broj)) ENGINE=MyISAM;
Warnings:
Warning	1286	Unknown storage engine 'MyISAM'
INSERT INTO t1 VALUES (1,'jedan'),(2,'dva'),(3,'tri'),(4,'xxxxxxxxxx'),(5,'a'),(10,''),(11,''),(12,''),(13,'');
CREATE TABLE t2 ( broj int(4) unsigned NOT NULL default '0',  naziv char(25) NOT NULL default 'NEPOZNAT',  PRIMARY KEY  (broj)) ENGINE=MyISAM;
Warnings:
Warning	1286	Unknown storage engine 'MyISAM'
INSERT INTO t2 VALUES (1,'jedan'),(2,'dva'),(3,'tri'),(4,'xxxxxxxxxx'),(5,'a');
CREATE TABLE t3 ( broj int(4) unsigned NOT NULL default '0',  naziv char(25) NOT NULL default 'NEPOZNAT',  PRIMARY KEY  (broj)) ENGINE=MyISAM;
Warnings:
Warning	1286	Unknown storage engine 'MyISAM'
INSERT INTO t3 VALUES (1,'jedan'),(2,'dva');
update t1,t2 set t1.naziv="aaaa" where t1.broj=t2.broj;
update t1,t2,t3 set t1.naziv="bbbb", t2.naziv="aaaa" where t1.broj=t2.broj and t2.broj=t3.broj;
drop table t1,t2,t3;

CREATE TABLE t1 (a int not null primary key, b int not null, key (b));
CREATE TABLE t2 (a int not null primary key, b int not null, key (b));
INSERT INTO t1 values (1,1),(2,2),(3,3),(4,4),(5,5),(6,6),(7,7),(8,8),(9,9);
INSERT INTO t2 values (1,1),(2,2),(3,3),(4,4),(5,5),(6,6),(7,7),(8,8),(9,9);

update t1,t2 set t1.a=t1.a+100;
select * from t1;
+-----+---+
| a   | b |
+-----+---+
| 101 | 1 |
| 102 | 2 |
| 103 | 3 |
| 104 | 4 |
| 105 | 5 |
| 106 | 6 |
| 107 | 7 |
| 108 | 8 |
| 109 | 9 |
+-----+---+

update t1,t2 set t1.a=t1.a+100 where t1.a=101;
select * from t1;
+-----+---+
| a   | b |
+-----+---+
| 102 | 2 |
| 103 | 3 |
| 104 | 4 |
| 105 | 5 |
| 106 | 6 |
| 107 | 7 |
| 108 | 8 |
| 109 | 9 |
| 201 | 1 |
+-----+---+

update t1,t2 set t1.b=t1.b+10 where t1.b=2;
select * from t1;
+-----+----+
| a   | b  |
+-----+----+
| 102 | 12 |
| 103 |  3 |
| 104 |  4 |
| 105 |  5 |
| 106 |  6 |
| 107 |  7 |
| 108 |  8 |
| 109 |  9 |
| 201 |  1 |
+-----+----+

update t1,t2 set t1.b=t1.b+2,t2.b=t1.b+10 where t1.b between 3 and 5 and t2.a=t1.a-100;
select * from t1;
+-----+----+
| a   | b  |
+-----+----+
| 102 | 12 |
| 103 |  5 |
| 104 |  6 |
| 105 |  7 |
| 106 |  6 |
| 107 |  7 |
| 108 |  8 |
| 109 |  9 |
| 201 |  1 |
+-----+----+
select * from t2;
+---+----+
| a | b  |
+---+----+
| 1 |  1 |
| 2 |  2 |
| 3 | 13 |
| 4 | 14 |
| 5 | 15 |
| 6 |  6 |
| 7 |  7 |
| 8 |  8 |
| 9 |  9 |
+---+----+

update t1,t2 set t1.b=t2.b, t1.a=t2.a where t1.a=t2.a and not exists (select * from t2 where t2.a > 10);

drop table t1,t2;
CREATE TABLE t3 (  KEY1 varchar(50) NOT NULL default '',  PARAM_CORR_DISTANCE_RUSH double default NULL,  PARAM_CORR_DISTANCE_GEM double default NULL,  PARAM_AVG_TARE double default NULL,  PARAM_AVG_NB_DAYS double default NULL,  PARAM_DEFAULT_PROP_GEM_SRVC varchar(50) default NULL,  PARAM_DEFAULT_PROP_GEM_NO_ETIK varchar(50) default NULL,  PARAM_SCENARIO_COSTS varchar(50) default NULL,  PARAM_DEFAULT_WAGON_COST double default NULL,  tmp int(11) default NULL,  PRIMARY KEY  (KEY1)) ENGINE=MyISAM;
Warnings:
Warning	1286	Unknown storage engine 'MyISAM'
INSERT INTO t3 VALUES ('A',1,1,22,3.2,'R','R','BASE2',0.24,NULL);
create table t1 (A varchar(1));
insert into t1 values  ("A") ,("B"),("C"),("D");
create table t2(Z varchar(15));
insert into t2(Z)  select concat(a.a,b.a,c.a,d.a) from t1 as a, t1 as b, t1 as c, t1 as d;
update t2,t3 set Z =param_scenario_costs;
drop table t1,t2,t3;
create table t1 (a int, b int);
create table t2 (a int, b int);
insert into t1 values (1,1),(2,1),(3,1);
insert into t2 values (1,1), (3,1);
update t1 left join t2  on t1.a=t2.a set t1.b=2, t2.b=2 where t1.b=1 and t2.b=1 or t2.a is NULL;
select t1.a, t1.b,t2.a, t2.b from t1 left join t2  on t1.a=t2.a where t1.b=1 and t2.b=1 or t2.a is NULL;
+------+------+------+------+
| a    | b    | a    | b    |
+------+------+------+------+
|    2 |    2 | NULL | NULL |
+------+------+------+------+
drop table t1,t2;

create table t1 (a int not null auto_increment primary key, b int not null);
insert into t1 (b) values (1),(2),(3),(4);
update t1, t1 as t2 set t1.b=t2.b+1 where t1.a=t2.a;
select * from t1;
+---+---+
| a | b |
+---+---+
| 1 | 2 |
| 2 | 3 |
| 3 | 4 |
| 4 | 5 |
+---+---+
drop table t1;

create table t1(id1 smallint(5), field char(5));
create table t2(id2 smallint(5), field char(5));

insert into t1 values (1, 'a'), (2, 'aa');
insert into t2 values (1, 'b'), (2, 'bb');

select * from t1;
+------+-------+
| id1  | field |
+------+-------+
|    1 | a     |
|    2 | aa    |
+------+-------+
select * from t2;
+------+-------+
| id2  | field |
+------+-------+
|    1 | b     |
|    2 | bb    |
+------+-------+

update t2 inner join t1 on t1.id1=t2.id2
  set t2.field=t1.field
  where 0=1;
update t2, t1 set t2.field=t1.field
  where t1.id1=t2.id2 and 0=1;

delete t1, t2 from t2 inner join t1 on t1.id1=t2.id2
  where 0=1;
delete t1, t2 from t2,t1
  where t1.id1=t2.id2 and 0=1;

drop table t1,t2;

##
##
## End of 4.1 tests
create table t1 ( c char(8) not null );
insert into t1 values ('0'),('1'),('2'),('3'),('4'),('5'),('6'),('7'),('8'),('9');
insert into t1 values ('A'),('B'),('C'),('D'),('E'),('F');

alter table t1 add b char(8) not null;
alter table t1 add a char(8) not null;
update t1 set a=c, b=c;

create table t2 like t1;
drop table t1,t2;

create table t1 ( c char(8) not null ) engine=innodb;
insert into t1 values ('0'),('1'),('2'),('3'),('4'),('5'),('6'),('7'),('8'),('9');
insert into t1 values ('A'),('B'),('C'),('D'),('E'),('F');

alter table t1 add b char(8) not null;
alter table t1 add a char(8) not null;
update t1 set a=c, b=c;

create table t2 like t1;
drop table t1,t2;

## Wait till "alter table t1 ..." of session changer is in work.
## = There is one session waiting.
## Wait till
## - "alter table t1 ..." of session changer and
## - "update t1, v1 ..." of session updater
## are in work.
## = There are two session waiting.
CREATE TABLE `t1` (
  `a` int(11) NOT NULL auto_increment,
  `b` int(11) default NULL,
  PRIMARY KEY  (`a`)
);

CREATE TABLE `t2` (
  `a` int(11) NOT NULL auto_increment,
  `b` int(11) default NULL,
  PRIMARY KEY  (`a`)
);


insert into t1 values (1,1),(2,2);
insert into t2 values (1,1),(4,4);
UPDATE t2,t1 SET t2.a=t1.a+2;
ERROR 23000: Duplicate entry '3' for key 'PRIMARY'
select * from t2 /* must be (3,1), (4,4) */;
+---+------+
| a | b    |
+---+------+
| 1 |    1 |
| 4 |    4 |
+---+------+
delete from t1;
delete from t2;
insert into t1 values (1,2),(3,4),(4,4);
insert into t2 values (1,2),(3,4),(4,4);
UPDATE t2,t1  SET t2.a=t2.b where t2.a=t1.a;
ERROR 23000: Duplicate entry '4' for key 'PRIMARY'
drop table t1, t2;
drop table if exists t1, t2, t3;
CREATE TABLE t1 (a int, PRIMARY KEY (a));
CREATE TABLE t2 (a int, PRIMARY KEY (a));
CREATE TABLE t3 (a int, PRIMARY KEY (a));
insert into t2 values (1),(2);
insert into t3 values (1),(2);
delete t3.* from t2,t3 where t2.a=t3.a;

select count(*) from t1 /* must be 1 */;
+----------+
| count(*) |
+----------+
|        0 |
+----------+
select count(*) from t3 /* must be 1 */;
+----------+
| count(*) |
+----------+
|        0 |
+----------+

drop table t1, t2, t3;

#
# Bug#49534: multitable IGNORE update with sql_safe_updates error
# causes debug assertion
#
CREATE TABLE t1( a INT, KEY( a ) );
INSERT INTO t1 VALUES (1), (2), (3);
# Must not cause failed assertion
UPDATE IGNORE t1, t1 t1a SET t1.a = 1 WHERE t1a.a = 1;
DROP TABLE t1;

#
# Bug#54543: update ignore with incorrect subquery leads to assertion
# failure: inited==INDEX
#
CREATE TABLE t1 ( a INT );
INSERT INTO t1 VALUES (1), (2);

CREATE TABLE t2 ( a INT );
INSERT INTO t2 VALUES (1), (2);

CREATE TABLE t3 ( a INT );
INSERT INTO t3 VALUES (1), (2);

DROP TABLE t1, t2, t3;
#
# Bug#52157 various crashes and assertions with multi-table update, stored function
#
#
# BUG#57373: Multi update+InnoDB reports ER_KEY_NOT_FOUND if a
#            table is updated twice
#
CREATE TABLE t1(
  pk INT,
  a INT,
  PRIMARY KEY (pk)
);

INSERT INTO t1 VALUES (0,0);
UPDATE t1 AS A, t1 AS B SET A.pk = 1, B.a = 2;
ERROR 0A000: multiple aliases to same table not supported

# Should be (1,2)
SELECT * FROM t1;
+----+------+
| pk | a    |
+----+------+
|  0 |    0 |
+----+------+
DROP TABLE t1;

#
# BUG#11882110: UPDATE REPORTS ER_KEY_NOT_FOUND IF TABLE IS 
#               UPDATED TWICE
#
CREATE TABLE t1 ( 
  col_int_key int, 
  pk int, 
  col_int int, 
  key(col_int_key), 
  primary key (pk)
);
INSERT INTO t1 VALUES (1,2,3);


CREATE TABLE t2 ( 
  col_int_key int, 
  pk_1 int, 
  pk_2 int, 
  col_int int, 
  key(col_int_key), 
  primary key (pk_1,pk_2)
);
INSERT INTO t2 VALUES (1,2,3,4);

UPDATE t1 AS A NATURAL JOIN t1 B SET A.pk=5,B.pk=7;
ERROR 0A000: multiple aliases to same table not supported
UPDATE t1 AS A NATURAL JOIN t1 B SET A.col_int_key=5,B.col_int_key=7;
ERROR 0A000: multiple aliases to same table not supported


SELECT * FROM t1;
+-------------+----+---------+
| col_int_key | pk | col_int |
+-------------+----+---------+
|           1 |  2 |       3 |
+-------------+----+---------+


UPDATE t2 AS A NATURAL JOIN t2 B SET A.pk_1=5,B.pk_1=7;
ERROR 0A000: multiple aliases to same table not supported
UPDATE t2 AS A NATURAL JOIN t2 B SET A.col_int_key=5,B.col_int_key=7;
ERROR 0A000: multiple aliases to same table not supported

UPDATE t2 AS A NATURAL JOIN t2 B SET A.pk_2=10,B.pk_2=11;
ERROR 0A000: multiple aliases to same table not supported
UPDATE t2 AS A NATURAL JOIN t2 B SET A.col_int_key=10,B.col_int_key=11;
ERROR 0A000: multiple aliases to same table not supported


SELECT * FROM t2;
+-------------+------+------+---------+
| col_int_key | pk_1 | pk_2 | col_int |
+-------------+------+------+---------+
|           1 |    2 |    3 |       4 |
+-------------+------+------+---------+

DROP TABLE t1,t2;

explain_protocol: 2
create table t1 (c1 int, c2 char(6), c3 int);
create table t2 (c1 int, c2 char(6));
EXPLAIN insert into t1 values (1, "t1c2-1", 10), (2, "t1c2-2", 20);
Query Plan
==================================================
|ID|OPERATOR          |NAME|EST.ROWS|EST.TIME(us)|
--------------------------------------------------
|0 |DISTRIBUTED INSERT|    |2       |20          |
|1 |└─EXPRESSION      |    |2       |1           |
==================================================
Outputs & filters:
-------------------------------------
  0 - output(nil), filter(nil)
      columns([{t1: ({t1: (t1.__pk_increment, t1.c1, t1.c2, t1.c3)})}]), 
      column_values([T_HIDDEN_PK], [column_conv(INT,PS:(11,0),NULL,__values.c1)], [column_conv(CHAR,utf8mb4_general_ci,length:6,NULL,__values.c2)], [column_conv(INT,
      PS:(11,0),NULL,__values.c3)])
  1 - output([__values.c1], [__values.c2], [__values.c3]), filter(nil)
      values({1, 't1c2-1', 10}, {2, 't1c2-2', 20})
insert into t1 values (1, "t1c2-1", 10), (2, "t1c2-2", 20);
EXPLAIN update t1 left join t2 on t1.c1 = t2.c1 set t2.c2 = "t2c2-1";
Query Plan
========================================================
|ID|OPERATOR                |NAME|EST.ROWS|EST.TIME(us)|
--------------------------------------------------------
|0 |UPDATE                  |    |2       |44          |
|1 |└─HASH RIGHT OUTER JOIN |    |2       |5           |
|2 |  ├─TABLE FULL SCAN     |t2  |1       |3           |
|3 |  └─TABLE FULL SCAN     |t1  |2       |3           |
========================================================
Outputs & filters:
-------------------------------------
  0 - output(nil), filter(nil)
      table_columns([{t2: ({t2: (t2.__pk_increment, t2.c1, t2.c2)}), hash_distinct}]),
      update([t2.c2=column_conv(CHAR,utf8mb4_general_ci,length:6,NULL,cast(inner_trim(2, cast(' ', VARCHAR(1048576)), cast('t2c2-1', VARCHAR(1048576))),
       CHAR(1048576)))])
  1 - output([t2.__pk_increment], [t2.c1], [t2.c2]), filter(nil), rowset=16
      equal_conds([t1.c1 = t2.c1]), other_conds(nil)
  2 - output([t2.__pk_increment], [t2.c1], [t2.c2]), filter(nil), rowset=16
      access([t2.__pk_increment], [t2.c1], [t2.c2]), partitions(p0)
      is_index_back=false, is_global_index=false, 
      range_key([t2.__pk_increment]), range(MIN ; MAX)always true
  3 - output([t1.c1]), filter(nil), rowset=16
      access([t1.c1]), partitions(p0)
      is_index_back=false, is_global_index=false, 
      range_key([t1.__pk_increment]), range(MIN ; MAX)always true
update t1 left join t2 on t1.c1 = t2.c1 set t2.c2 = "t2c2-1";
EXPLAIN select * from t2;
Query Plan
===============================================
|ID|OPERATOR       |NAME|EST.ROWS|EST.TIME(us)|
-----------------------------------------------
|0 |TABLE FULL SCAN|t2  |1       |3           |
===============================================
Outputs & filters:
-------------------------------------
  0 - output([t2.c1], [t2.c2]), filter(nil), rowset=16
      access([t2.c1], [t2.c2]), partitions(p0)
      is_index_back=false, is_global_index=false, 
      range_key([t2.__pk_increment]), range(MIN ; MAX)always true
select * from t2;
+------+------+
| c1   | c2   |
+------+------+
+------+------+
EXPLAIN update t1 left join t2 on t1.c1=t2.c1 set t1.c2="t1c2+1", t2.c2="t2c2-1";
Query Plan
========================================================
|ID|OPERATOR                |NAME|EST.ROWS|EST.TIME(us)|
--------------------------------------------------------
|0 |DISTRIBUTED UPDATE      |    |2       |68          |
|1 |└─HASH RIGHT OUTER JOIN |    |2       |5           |
|2 |  ├─TABLE FULL SCAN     |t2  |1       |3           |
|3 |  └─TABLE FULL SCAN     |t1  |2       |3           |
========================================================
Outputs & filters:
-------------------------------------
  0 - output(nil), filter(nil)
      table_columns([{t1: ({t1: (t1.__pk_increment, t1.c1, t1.c2, t1.c3)}), hash_distinct}], [{t2: ({t2: (t2.__pk_increment, t2.c1, t2.c2)}), hash_distinct}]),
      
      update([t1.c2=column_conv(CHAR,utf8mb4_general_ci,length:6,NULL,cast(inner_trim(2, cast(' ', VARCHAR(1048576)), cast('t1c2+1', VARCHAR(1048576))),
       CHAR(1048576)))], [t2.c2=column_conv(CHAR,utf8mb4_general_ci,length:6,NULL,cast(inner_trim(2, cast(' ', VARCHAR(1048576)), cast('t2c2-1', VARCHAR(1048576))),
       CHAR(1048576)))])
  1 - output([t1.__pk_increment], [t1.c1], [t1.c2], [t1.c3], [t2.__pk_increment], [t2.c1], [t2.c2]), filter(nil), rowset=16
      equal_conds([t1.c1 = t2.c1]), other_conds(nil)
  2 - output([t2.__pk_increment], [t2.c1], [t2.c2]), filter(nil), rowset=16
      access([t2.__pk_increment], [t2.c1], [t2.c2]), partitions(p0)
      is_index_back=false, is_global_index=false, 
      range_key([t2.__pk_increment]), range(MIN ; MAX)always true
  3 - output([t1.__pk_increment], [t1.c1], [t1.c2], [t1.c3]), filter(nil), rowset=16
      access([t1.__pk_increment], [t1.c1], [t1.c2], [t1.c3]), partitions(p0)
      is_index_back=false, is_global_index=false, 
      range_key([t1.__pk_increment]), range(MIN ; MAX)always true
update t1 left join t2 on t1.c1=t2.c1 set t1.c2="t1c2+1", t2.c2="t2c2-1";
EXPLAIN select * from t1;
Query Plan
===============================================
|ID|OPERATOR       |NAME|EST.ROWS|EST.TIME(us)|
-----------------------------------------------
|0 |TABLE FULL SCAN|t1  |2       |3           |
===============================================
Outputs & filters:
-------------------------------------
  0 - output([t1.c1], [t1.c2], [t1.c3]), filter(nil), rowset=16
      access([t1.c1], [t1.c2], [t1.c3]), partitions(p0)
      is_index_back=false, is_global_index=false, 
      range_key([t1.__pk_increment]), range(MIN ; MAX)always true
select * from t1;
+------+--------+------+
| c1   | c2     | c3   |
+------+--------+------+
|    1 | t1c2+1 |   10 |
|    2 | t1c2+1 |   20 |
+------+--------+------+
EXPLAIN select * from t2;
Query Plan
===============================================
|ID|OPERATOR       |NAME|EST.ROWS|EST.TIME(us)|
-----------------------------------------------
|0 |TABLE FULL SCAN|t2  |1       |3           |
===============================================
Outputs & filters:
-------------------------------------
  0 - output([t2.c1], [t2.c2]), filter(nil), rowset=16
      access([t2.c1], [t2.c2]), partitions(p0)
      is_index_back=false, is_global_index=false, 
      range_key([t2.__pk_increment]), range(MIN ; MAX)always true
select * from t2;
+------+------+
| c1   | c2   |
+------+------+
+------+------+
EXPLAIN update t1 left join t2 on t1.c1=t2.c1 set t1.c2="t1c2+2";
Query Plan
========================================================
|ID|OPERATOR                |NAME|EST.ROWS|EST.TIME(us)|
--------------------------------------------------------
|0 |UPDATE                  |    |2       |44          |
|1 |└─HASH RIGHT OUTER JOIN |    |2       |5           |
|2 |  ├─TABLE FULL SCAN     |t2  |1       |3           |
|3 |  └─TABLE FULL SCAN     |t1  |2       |3           |
========================================================
Outputs & filters:
-------------------------------------
  0 - output(nil), filter(nil)
      table_columns([{t1: ({t1: (t1.__pk_increment, t1.c1, t1.c2, t1.c3)}), hash_distinct}]),
      update([t1.c2=column_conv(CHAR,utf8mb4_general_ci,length:6,NULL,cast(inner_trim(2, cast(' ', VARCHAR(1048576)), cast('t1c2+2', VARCHAR(1048576))),
       CHAR(1048576)))])
  1 - output([t1.__pk_increment], [t1.c1], [t1.c2], [t1.c3]), filter(nil), rowset=16
      equal_conds([t1.c1 = t2.c1]), other_conds(nil)
  2 - output([t2.c1]), filter(nil), rowset=16
      access([t2.c1]), partitions(p0)
      is_index_back=false, is_global_index=false, 
      range_key([t2.__pk_increment]), range(MIN ; MAX)always true
  3 - output([t1.__pk_increment], [t1.c1], [t1.c2], [t1.c3]), filter(nil), rowset=16
      access([t1.__pk_increment], [t1.c1], [t1.c2], [t1.c3]), partitions(p0)
      is_index_back=false, is_global_index=false, 
      range_key([t1.__pk_increment]), range(MIN ; MAX)always true
update t1 left join t2 on t1.c1=t2.c1 set t1.c2="t1c2+2";
EXPLAIN select * from t1;
Query Plan
===============================================
|ID|OPERATOR       |NAME|EST.ROWS|EST.TIME(us)|
-----------------------------------------------
|0 |TABLE FULL SCAN|t1  |2       |3           |
===============================================
Outputs & filters:
-------------------------------------
  0 - output([t1.c1], [t1.c2], [t1.c3]), filter(nil), rowset=16
      access([t1.c1], [t1.c2], [t1.c3]), partitions(p0)
      is_index_back=false, is_global_index=false, 
      range_key([t1.__pk_increment]), range(MIN ; MAX)always true
select * from t1;
+------+--------+------+
| c1   | c2     | c3   |
+------+--------+------+
|    1 | t1c2+2 |   10 |
|    2 | t1c2+2 |   20 |
+------+--------+------+
EXPLAIN select * from t2;
Query Plan
===============================================
|ID|OPERATOR       |NAME|EST.ROWS|EST.TIME(us)|
-----------------------------------------------
|0 |TABLE FULL SCAN|t2  |1       |3           |
===============================================
Outputs & filters:
-------------------------------------
  0 - output([t2.c1], [t2.c2]), filter(nil), rowset=16
      access([t2.c1], [t2.c2]), partitions(p0)
      is_index_back=false, is_global_index=false, 
      range_key([t2.__pk_increment]), range(MIN ; MAX)always true
select * from t2;
+------+------+
| c1   | c2   |
+------+------+
+------+------+
drop table t1, t2;

create table t1 (aclid bigint not null primary key, status tinyint(1) not null);
create table t2 (refid bigint not null primary key, aclid bigint, index idx_acl(aclid));
EXPLAIN insert into t2 values(1,null);
Query Plan
==================================================
|ID|OPERATOR          |NAME|EST.ROWS|EST.TIME(us)|
--------------------------------------------------
|0 |DISTRIBUTED INSERT|    |1       |13          |
|1 |└─EXPRESSION      |    |1       |1           |
==================================================
Outputs & filters:
-------------------------------------
  0 - output(nil), filter(nil)
      columns([{t2: ({t2: (t2.refid, t2.aclid)})}]), 
      column_values([column_conv(BIGINT,PS:(20,0),NOT NULL,__values.refid)], [column_conv(BIGINT,PS:(20,0),NULL,__values.aclid)])
  1 - output([__values.refid], [__values.aclid]), filter(nil)
      values({1, NULL})
insert into t2 values(1,null);
Query Plan
=================================================
|ID|OPERATOR         |NAME|EST.ROWS|EST.TIME(us)|
-------------------------------------------------
|0 |SCALAR GROUP BY  |    |1       |3           |
|1 |└─TABLE FULL SCAN|t2  |1       |3           |
=================================================
Outputs & filters:
-------------------------------------
  0 - output([T_FUN_COUNT_SUM(T_FUN_COUNT(*))]), filter(nil), rowset=16
      group(nil), agg_func([T_FUN_COUNT_SUM(T_FUN_COUNT(*))])
  1 - output([T_FUN_COUNT(*)]), filter(nil), rowset=16
      access(nil), partitions(p0)
      is_index_back=false, is_global_index=false, 
      range_key([t2.refid]), range(MIN ; MAX)always true, 
      pushdown_aggregation([T_FUN_COUNT(*)])
+----------+
| count(*) |
+----------+
|        1 |
+----------+
EXPLAIN delete t2, t1 from t2 left join t1 on (t2.aclid=t1.aclid) where t2.refid='1';
Query Plan
===================================================
|ID|OPERATOR           |NAME|EST.ROWS|EST.TIME(us)|
---------------------------------------------------
|0 |DISTRIBUTED DELETE |    |1       |25          |
|1 |└─MERGE OUTER JOIN |    |1       |7           |
|2 |  ├─TABLE GET      |t2  |1       |5           |
|3 |  └─TABLE FULL SCAN|t1  |1       |3           |
===================================================
Outputs & filters:
-------------------------------------
  0 - output(nil), filter(nil)
      table_columns([{t2: ({t2: (t2.refid, t2.aclid)})}], [{t1: ({t1: (t1.aclid, t1.status)})}])
  1 - output([t2.refid], [t2.aclid], [t1.aclid], [t1.status]), filter(nil), rowset=16
      equal_conds([t2.aclid = t1.aclid]), other_conds(nil)
      merge_directions([ASC])
  2 - output([t2.refid], [t2.aclid]), filter(nil), rowset=16
      access([t2.refid], [t2.aclid]), partitions(p0)
      is_index_back=false, is_global_index=false, 
      range_key([t2.refid]), range[1 ; 1], 
      range_cond([t2.refid = demote_cast('1', BIGINT(20, 0))])
  3 - output([t1.aclid], [t1.status]), filter(nil), rowset=16
      access([t1.aclid], [t1.status]), partitions(p0)
      is_index_back=false, is_global_index=false, 
      range_key([t1.aclid]), range(MIN ; MAX)always true
delete t2, t1 from t2 left join t1 on (t2.aclid=t1.aclid) where t2.refid='1';
EXPLAIN select * from t1;
Query Plan
===============================================
|ID|OPERATOR       |NAME|EST.ROWS|EST.TIME(us)|
-----------------------------------------------
|0 |TABLE FULL SCAN|t1  |1       |3           |
===============================================
Outputs & filters:
-------------------------------------
  0 - output([t1.aclid], [t1.status]), filter(nil), rowset=16
      access([t1.aclid], [t1.status]), partitions(p0)
      is_index_back=false, is_global_index=false, 
      range_key([t1.aclid]), range(MIN ; MAX)always true
select * from t1;
+-------+--------+
| aclid | status |
+-------+--------+
+-------+--------+
EXPLAIN select * from t2;
Query Plan
===============================================
|ID|OPERATOR       |NAME|EST.ROWS|EST.TIME(us)|
-----------------------------------------------
|0 |TABLE FULL SCAN|t2  |1       |3           |
===============================================
Outputs & filters:
-------------------------------------
  0 - output([t2.refid], [t2.aclid]), filter(nil), rowset=16
      access([t2.refid], [t2.aclid]), partitions(p0)
      is_index_back=false, is_global_index=false, 
      range_key([t2.refid]), range(MIN ; MAX)always true
select * from t2;
+-------+-------+
| refid | aclid |
+-------+-------+
+-------+-------+
drop table t1, t2;

create table t1(c1 int primary key, c2 int);
create table t2(c1 int primary key, c2 int);
EXPLAIN insert into t1 values(1, 1), (2, 2);
Query Plan
==================================================
|ID|OPERATOR          |NAME|EST.ROWS|EST.TIME(us)|
--------------------------------------------------
|0 |DISTRIBUTED INSERT|    |2       |20          |
|1 |└─EXPRESSION      |    |2       |1           |
==================================================
Outputs & filters:
-------------------------------------
  0 - output(nil), filter(nil)
      columns([{t1: ({t1: (t1.c1, t1.c2)})}]), 
      column_values([column_conv(INT,PS:(11,0),NOT NULL,__values.c1)], [column_conv(INT,PS:(11,0),NULL,__values.c2)])
  1 - output([__values.c1], [__values.c2]), filter(nil)
      values({1, 1}, {2, 2})
insert into t1 values(1, 1), (2, 2);
EXPLAIN insert into t2 values(1, 1), (3, 3);
Query Plan
==================================================
|ID|OPERATOR          |NAME|EST.ROWS|EST.TIME(us)|
--------------------------------------------------
|0 |DISTRIBUTED INSERT|    |2       |20          |
|1 |└─EXPRESSION      |    |2       |1           |
==================================================
Outputs & filters:
-------------------------------------
  0 - output(nil), filter(nil)
      columns([{t2: ({t2: (t2.c1, t2.c2)})}]), 
      column_values([column_conv(INT,PS:(11,0),NOT NULL,__values.c1)], [column_conv(INT,PS:(11,0),NULL,__values.c2)])
  1 - output([__values.c1], [__values.c2]), filter(nil)
      values({1, 1}, {3, 3})
insert into t2 values(1, 1), (3, 3);
EXPLAIN update t1 left join t2 on t1.c1=t2.c1 set t2.c2=5;
Query Plan
===================================================
|ID|OPERATOR           |NAME|EST.ROWS|EST.TIME(us)|
---------------------------------------------------
|0 |UPDATE             |    |2       |44          |
|1 |└─MERGE OUTER JOIN |    |2       |5           |
|2 |  ├─TABLE FULL SCAN|t1  |2       |3           |
|3 |  └─TABLE FULL SCAN|t2  |2       |3           |
===================================================
Outputs & filters:
-------------------------------------
  0 - output(nil), filter(nil)
      table_columns([{t2: ({t2: (t2.c1, t2.c2)}), hash_distinct}]),
      update([t2.c2=column_conv(INT,PS:(11,0),NULL,5)])
  1 - output([t2.c1], [t2.c2]), filter(nil), rowset=16
      equal_conds([t1.c1 = t2.c1]), other_conds(nil)
      merge_directions([ASC])
  2 - output([t1.c1]), filter(nil), rowset=16
      access([t1.c1]), partitions(p0)
      is_index_back=false, is_global_index=false, 
      range_key([t1.c1]), range(MIN ; MAX)always true
  3 - output([t2.c1], [t2.c2]), filter(nil), rowset=16
      access([t2.c1], [t2.c2]), partitions(p0)
      is_index_back=false, is_global_index=false, 
      range_key([t2.c1]), range(MIN ; MAX)always true
update t1 left join t2 on t1.c1=t2.c1 set t2.c2=5;
EXPLAIN select * from t2;
Query Plan
===============================================
|ID|OPERATOR       |NAME|EST.ROWS|EST.TIME(us)|
-----------------------------------------------
|0 |TABLE FULL SCAN|t2  |2       |3           |
===============================================
Outputs & filters:
-------------------------------------
  0 - output([t2.c1], [t2.c2]), filter(nil), rowset=16
      access([t2.c1], [t2.c2]), partitions(p0)
      is_index_back=false, is_global_index=false, 
      range_key([t2.c1]), range(MIN ; MAX)always true
select * from t2;
+----+------+
| c1 | c2   |
+----+------+
|  1 |    5 |
|  3 |    3 |
+----+------+
EXPLAIN update t1 left join t2 on t1.c1=t2.c1 set t1.c2=5;
Query Plan
=================================================
|ID|OPERATOR         |NAME|EST.ROWS|EST.TIME(us)|
-------------------------------------------------
|0 |UPDATE           |    |2       |42          |
|1 |└─TABLE FULL SCAN|t1  |2       |3           |
=================================================
Outputs & filters:
-------------------------------------
  0 - output(nil), filter(nil)
      table_columns([{t1: ({t1: (t1.c1, t1.c2)})}]),
      update([t1.c2=column_conv(INT,PS:(11,0),NULL,5)])
  1 - output([t1.c1], [t1.c2]), filter(nil), rowset=16
      access([t1.c1], [t1.c2]), partitions(p0)
      is_index_back=false, is_global_index=false, 
      range_key([t1.c1]), range(MIN ; MAX)always true
update t1 left join t2 on t1.c1=t2.c1 set t1.c2=5;
EXPLAIN select * from t1;
Query Plan
===============================================
|ID|OPERATOR       |NAME|EST.ROWS|EST.TIME(us)|
-----------------------------------------------
|0 |TABLE FULL SCAN|t1  |2       |3           |
===============================================
Outputs & filters:
-------------------------------------
  0 - output([t1.c1], [t1.c2]), filter(nil), rowset=16
      access([t1.c1], [t1.c2]), partitions(p0)
      is_index_back=false, is_global_index=false, 
      range_key([t1.c1]), range(MIN ; MAX)always true
select * from t1;
+----+------+
| c1 | c2   |
+----+------+
|  1 |    5 |
|  2 |    5 |
+----+------+
EXPLAIN update t1 right join t2 on t1.c1=t2.c1 set t2.c2=10;
Query Plan
=================================================
|ID|OPERATOR         |NAME|EST.ROWS|EST.TIME(us)|
-------------------------------------------------
|0 |UPDATE           |    |2       |42          |
|1 |└─TABLE FULL SCAN|t2  |2       |3           |
=================================================
Outputs & filters:
-------------------------------------
  0 - output(nil), filter(nil)
      table_columns([{t2: ({t2: (t2.c1, t2.c2)})}]),
      update([t2.c2=column_conv(INT,PS:(11,0),NULL,10)])
  1 - output([t2.c1], [t2.c2]), filter(nil), rowset=16
      access([t2.c1], [t2.c2]), partitions(p0)
      is_index_back=false, is_global_index=false, 
      range_key([t2.c1]), range(MIN ; MAX)always true
update t1 right join t2 on t1.c1=t2.c1 set t2.c2=10;
EXPLAIN select * from t2;
Query Plan
===============================================
|ID|OPERATOR       |NAME|EST.ROWS|EST.TIME(us)|
-----------------------------------------------
|0 |TABLE FULL SCAN|t2  |2       |3           |
===============================================
Outputs & filters:
-------------------------------------
  0 - output([t2.c1], [t2.c2]), filter(nil), rowset=16
      access([t2.c1], [t2.c2]), partitions(p0)
      is_index_back=false, is_global_index=false, 
      range_key([t2.c1]), range(MIN ; MAX)always true
select * from t2;
+----+------+
| c1 | c2   |
+----+------+
|  1 |   10 |
|  3 |   10 |
+----+------+
EXPLAIN update t1 right join t2 on t1.c1=t2.c1 set t1.c2=10;
Query Plan
===================================================
|ID|OPERATOR           |NAME|EST.ROWS|EST.TIME(us)|
---------------------------------------------------
|0 |UPDATE             |    |2       |44          |
|1 |└─MERGE OUTER JOIN |    |2       |5           |
|2 |  ├─TABLE FULL SCAN|t2  |2       |3           |
|3 |  └─TABLE FULL SCAN|t1  |2       |3           |
===================================================
Outputs & filters:
-------------------------------------
  0 - output(nil), filter(nil)
      table_columns([{t1: ({t1: (t1.c1, t1.c2)}), hash_distinct}]),
      update([t1.c2=column_conv(INT,PS:(11,0),NULL,10)])
  1 - output([t1.c1], [t1.c2]), filter(nil), rowset=16
      equal_conds([t1.c1 = t2.c1]), other_conds(nil)
      merge_directions([ASC])
  2 - output([t2.c1]), filter(nil), rowset=16
      access([t2.c1]), partitions(p0)
      is_index_back=false, is_global_index=false, 
      range_key([t2.c1]), range(MIN ; MAX)always true
  3 - output([t1.c1], [t1.c2]), filter(nil), rowset=16
      access([t1.c1], [t1.c2]), partitions(p0)
      is_index_back=false, is_global_index=false, 
      range_key([t1.c1]), range(MIN ; MAX)always true
update t1 right join t2 on t1.c1=t2.c1 set t1.c2=10;
EXPLAIN select * from t1;
Query Plan
===============================================
|ID|OPERATOR       |NAME|EST.ROWS|EST.TIME(us)|
-----------------------------------------------
|0 |TABLE FULL SCAN|t1  |2       |3           |
===============================================
Outputs & filters:
-------------------------------------
  0 - output([t1.c1], [t1.c2]), filter(nil), rowset=16
      access([t1.c1], [t1.c2]), partitions(p0)
      is_index_back=false, is_global_index=false, 
      range_key([t1.c1]), range(MIN ; MAX)always true
select * from t1;
+----+------+
| c1 | c2   |
+----+------+
|  1 |   10 |
|  2 |    5 |
+----+------+
EXPLAIN update t1 join t2 on t1.c1=t2.c1 set t1.c2=20, t2.c2=20;
Query Plan
===================================================
|ID|OPERATOR           |NAME|EST.ROWS|EST.TIME(us)|
---------------------------------------------------
|0 |DISTRIBUTED UPDATE |    |2       |68          |
|1 |└─MERGE JOIN       |    |2       |5           |
|2 |  ├─TABLE FULL SCAN|t1  |2       |3           |
|3 |  └─TABLE FULL SCAN|t2  |2       |3           |
===================================================
Outputs & filters:
-------------------------------------
  0 - output(nil), filter(nil)
      table_columns([{t1: ({t1: (t1.c1, t1.c2)})}], [{t2: ({t2: (t2.c1, t2.c2)})}]),
      update([t1.c2=column_conv(INT,PS:(11,0),NULL,20)], [t2.c2=column_conv(INT,PS:(11,0),NULL,20)])
  1 - output([t1.c1], [t1.c2], [t2.c1], [t2.c2]), filter(nil), rowset=16
      equal_conds([t1.c1 = t2.c1]), other_conds(nil)
      merge_directions([ASC])
  2 - output([t1.c1], [t1.c2]), filter(nil), rowset=16
      access([t1.c1], [t1.c2]), partitions(p0)
      is_index_back=false, is_global_index=false, 
      range_key([t1.c1]), range(MIN ; MAX)always true
  3 - output([t2.c1], [t2.c2]), filter(nil), rowset=16
      access([t2.c1], [t2.c2]), partitions(p0)
      is_index_back=false, is_global_index=false, 
      range_key([t2.c1]), range(MIN ; MAX)always true
update t1 join t2 on t1.c1=t2.c1 set t1.c2=20, t2.c2=20;
EXPLAIN select * from t1;
Query Plan
===============================================
|ID|OPERATOR       |NAME|EST.ROWS|EST.TIME(us)|
-----------------------------------------------
|0 |TABLE FULL SCAN|t1  |2       |3           |
===============================================
Outputs & filters:
-------------------------------------
  0 - output([t1.c1], [t1.c2]), filter(nil), rowset=16
      access([t1.c1], [t1.c2]), partitions(p0)
      is_index_back=false, is_global_index=false, 
      range_key([t1.c1]), range(MIN ; MAX)always true
select * from t1;
+----+------+
| c1 | c2   |
+----+------+
|  1 |   20 |
|  2 |    5 |
+----+------+
EXPLAIN select * from t2;
Query Plan
===============================================
|ID|OPERATOR       |NAME|EST.ROWS|EST.TIME(us)|
-----------------------------------------------
|0 |TABLE FULL SCAN|t2  |2       |3           |
===============================================
Outputs & filters:
-------------------------------------
  0 - output([t2.c1], [t2.c2]), filter(nil), rowset=16
      access([t2.c1], [t2.c2]), partitions(p0)
      is_index_back=false, is_global_index=false, 
      range_key([t2.c1]), range(MIN ; MAX)always true
select * from t2;
+----+------+
| c1 | c2   |
+----+------+
|  1 |   20 |
|  3 |   10 |
+----+------+
EXPLAIN update t1 full join t2 using(c1) set t1.c2=30, t2.c2=30;
Query Plan
========================================================
|ID|OPERATOR                |NAME|EST.ROWS|EST.TIME(us)|
--------------------------------------------------------
|0 |DISTRIBUTED UPDATE      |    |2       |68          |
|1 |└─MERGE FULL OUTER JOIN |    |2       |5           |
|2 |  ├─TABLE FULL SCAN     |t1  |2       |3           |
|3 |  └─TABLE FULL SCAN     |t2  |2       |3           |
========================================================
Outputs & filters:
-------------------------------------
  0 - output(nil), filter(nil)
      table_columns([{t1: ({t1: (t1.c1, t1.c2)}), hash_distinct}], [{t2: ({t2: (t2.c1, t2.c2)}), hash_distinct}]),
      update([t1.c2=column_conv(INT,PS:(11,0),NULL,30)], [t2.c2=column_conv(INT,PS:(11,0),NULL,30)])
  1 - output([t1.c1], [t1.c2], [t2.c1], [t2.c2]), filter(nil), rowset=16
      equal_conds([t1.c1 = t2.c1]), other_conds(nil)
      merge_directions([ASC])
  2 - output([t1.c1], [t1.c2]), filter(nil), rowset=16
      access([t1.c1], [t1.c2]), partitions(p0)
      is_index_back=false, is_global_index=false, 
      range_key([t1.c1]), range(MIN ; MAX)always true
  3 - output([t2.c1], [t2.c2]), filter(nil), rowset=16
      access([t2.c1], [t2.c2]), partitions(p0)
      is_index_back=false, is_global_index=false, 
      range_key([t2.c1]), range(MIN ; MAX)always true
update t1 full join t2 using(c1) set t1.c2=30, t2.c2=30;
EXPLAIN select * from t1;
Query Plan
===============================================
|ID|OPERATOR       |NAME|EST.ROWS|EST.TIME(us)|
-----------------------------------------------
|0 |TABLE FULL SCAN|t1  |2       |3           |
===============================================
Outputs & filters:
-------------------------------------
  0 - output([t1.c1], [t1.c2]), filter(nil), rowset=16
      access([t1.c1], [t1.c2]), partitions(p0)
      is_index_back=false, is_global_index=false, 
      range_key([t1.c1]), range(MIN ; MAX)always true
select * from t1;
+----+------+
| c1 | c2   |
+----+------+
|  1 |   30 |
|  2 |   30 |
+----+------+
EXPLAIN select * from t2;
Query Plan
===============================================
|ID|OPERATOR       |NAME|EST.ROWS|EST.TIME(us)|
-----------------------------------------------
|0 |TABLE FULL SCAN|t2  |2       |3           |
===============================================
Outputs & filters:
-------------------------------------
  0 - output([t2.c1], [t2.c2]), filter(nil), rowset=16
      access([t2.c1], [t2.c2]), partitions(p0)
      is_index_back=false, is_global_index=false, 
      range_key([t2.c1]), range(MIN ; MAX)always true
select * from t2;
+----+------+
| c1 | c2   |
+----+------+
|  1 |   30 |
|  3 |   30 |
+----+------+
drop table t1, t2;

create table t1(a int primary key, b int, c int, index idx(a,b));
EXPLAIN insert into t1 values(1, 1, 1);
Query Plan
==================================================
|ID|OPERATOR          |NAME|EST.ROWS|EST.TIME(us)|
--------------------------------------------------
|0 |DISTRIBUTED INSERT|    |1       |13          |
|1 |└─EXPRESSION      |    |1       |1           |
==================================================
Outputs & filters:
-------------------------------------
  0 - output(nil), filter(nil)
      columns([{t1: ({t1: (t1.a, t1.b, t1.c)})}]), 
      column_values([column_conv(INT,PS:(11,0),NOT NULL,__values.a)], [column_conv(INT,PS:(11,0),NULL,__values.b)], [column_conv(INT,PS:(11,0),NULL,__values.c)])
  1 - output([__values.a], [__values.b], [__values.c]), filter(nil)
      values({1, 1, 1})
insert into t1 values(1, 1, 1);
update t1 ta1, t1 ta2 set ta1.b=2, ta2.b=3;
ERROR 0A000: multiple aliases to same table not supported
update t1 ta1, t1 ta2 set ta1.c=2, ta2.c=3;
ERROR 0A000: multiple aliases to same table not supported
drop table t1;

create table t1 (c1 int primary key);
create table t2 (c1 int primary key);
EXPLAIN insert into t2 values (1);
Query Plan
==================================================
|ID|OPERATOR          |NAME|EST.ROWS|EST.TIME(us)|
--------------------------------------------------
|0 |DISTRIBUTED INSERT|    |1       |13          |
|1 |└─EXPRESSION      |    |1       |1           |
==================================================
Outputs & filters:
-------------------------------------
  0 - output(nil), filter(nil)
      columns([{t2: ({t2: (t2.c1)})}]), 
      column_values([column_conv(INT,PS:(11,0),NOT NULL,__values.c1)])
  1 - output([__values.c1]), filter(nil)
      values({1})
insert into t2 values (1);
EXPLAIN update t2 left join t1 on t1.c1 = t2.c1 set t1.c1 = t2.c1;
Query Plan
===================================================
|ID|OPERATOR           |NAME|EST.ROWS|EST.TIME(us)|
---------------------------------------------------
|0 |UPDATE             |    |1       |36          |
|1 |└─MERGE OUTER JOIN |    |1       |5           |
|2 |  ├─TABLE FULL SCAN|t2  |1       |3           |
|3 |  └─TABLE FULL SCAN|t1  |1       |3           |
===================================================
Outputs & filters:
-------------------------------------
  0 - output(nil), filter(nil)
      table_columns([{t1: ({t1: (t1.c1)}), hash_distinct}]),
      update([t1.c1=column_conv(INT,PS:(11,0),NOT NULL,t2.c1)])
  1 - output([t1.c1], [t2.c1]), filter(nil), rowset=16
      equal_conds([t1.c1 = t2.c1]), other_conds(nil)
      merge_directions([ASC])
  2 - output([t2.c1]), filter(nil), rowset=16
      access([t2.c1]), partitions(p0)
      is_index_back=false, is_global_index=false, 
      range_key([t2.c1]), range(MIN ; MAX)always true
  3 - output([t1.c1]), filter(nil), rowset=16
      access([t1.c1]), partitions(p0)
      is_index_back=false, is_global_index=false, 
      range_key([t1.c1]), range(MIN ; MAX)always true
update t2 left join t1 on t1.c1 = t2.c1 set t1.c1 = t2.c1;
EXPLAIN select * from t1;
Query Plan
===============================================
|ID|OPERATOR       |NAME|EST.ROWS|EST.TIME(us)|
-----------------------------------------------
|0 |TABLE FULL SCAN|t1  |1       |3           |
===============================================
Outputs & filters:
-------------------------------------
  0 - output([t1.c1]), filter(nil), rowset=16
      access([t1.c1]), partitions(p0)
      is_index_back=false, is_global_index=false, 
      range_key([t1.c1]), range(MIN ; MAX)always true
select * from t1;
+----+
| c1 |
+----+
+----+
drop table t1, t2;

create table t1 (a int primary key, b int, c int);
EXPLAIN insert into t1 values (1, 1, 1);
Query Plan
==================================================
|ID|OPERATOR          |NAME|EST.ROWS|EST.TIME(us)|
--------------------------------------------------
|0 |DISTRIBUTED INSERT|    |1       |13          |
|1 |└─EXPRESSION      |    |1       |1           |
==================================================
Outputs & filters:
-------------------------------------
  0 - output(nil), filter(nil)
      columns([{t1: ({t1: (t1.a, t1.b, t1.c)})}]), 
      column_values([column_conv(INT,PS:(11,0),NOT NULL,__values.a)], [column_conv(INT,PS:(11,0),NULL,__values.b)], [column_conv(INT,PS:(11,0),NULL,__values.c)])
  1 - output([__values.a], [__values.b], [__values.c]), filter(nil)
      values({1, 1, 1})
insert into t1 values (1, 1, 1);
update t1 as A, t1 as B set A.a = 2, B.b = 2;
ERROR 0A000: multiple aliases to same table not supported
update t1 as B, t1 as C set B.b = 2, C.c = 2;
ERROR 0A000: multiple aliases to same table not supported
drop table t1;

