alter system set _enable_defensive_check = 2;
drop table if exists t1,t2,t3,t4,t5,t6,t7,t8,t9,t10,t11,t12, t13;
result_format: 4
set @@binlog_row_image = 'MINIMAL';
create table t1(c1 int, c2 int, c3 int, c4 int, primary key(c1, c2));
insert into t1(c1,c2,c3,c4) values(1,2,3,4),(5,6,7,8),(9,10,11,12),(13,14,15,16),(17,18,19,20);
update t1 set c1 = c1 + 100;
select * from t1;
+-----+----+------+------+
| c1  | c2 | c3   | c4   |
+-----+----+------+------+
| 101 |  2 |    3 |    4 |
| 105 |  6 |    7 |    8 |
| 109 | 10 |   11 |   12 |
| 113 | 14 |   15 |   16 |
| 117 | 18 |   19 |   20 |
+-----+----+------+------+

create table t2(c1 int, c2 int, c3 int, c4 int, primary key(c1, c2));
insert into t2(c1,c2,c3,c4) values(1,2,3,4),(5,6,7,8),(9,10,11,12),(13,14,15,16),(17,18,19,20);
update t2 set c3 = c3 + 100;
select * from t2;
+----+----+------+------+
| c1 | c2 | c3   | c4   |
+----+----+------+------+
|  1 |  2 |  103 |    4 |
|  5 |  6 |  107 |    8 |
|  9 | 10 |  111 |   12 |
| 13 | 14 |  115 |   16 |
| 17 | 18 |  119 |   20 |
+----+----+------+------+

create table t3(c1 int, c2 int, c3 int, c4 int, primary key(c1, c2)) partition by hash(c1) partitions 4;
create unique index t3_idx_01 on t3(c3) global;
insert into t3(c1,c2,c3,c4) values(1,2,3,4),(5,6,7,8),(9,10,11,12),(13,14,15,16),(17,18,19,20);
update t3 set c3 = c3 + 100;
select * from t3 order by c1;
+----+----+------+------+
| c1 | c2 | c3   | c4   |
+----+----+------+------+
|  1 |  2 |  103 |    4 |
|  5 |  6 |  107 |    8 |
|  9 | 10 |  111 |   12 |
| 13 | 14 |  115 |   16 |
| 17 | 18 |  119 |   20 |
+----+----+------+------+

create table t4(c1 int, c2 int, c3 int, c4 int, primary key(c1, c2)) partition by hash(c1) partitions 4;
create index t4_idx_01 on t4(c3, c4) global;
insert into t4(c1,c2,c3,c4) values(1,2,3,4),(5,6,7,8),(9,10,11,12),(13,14,15,16),(17,18,19,20);
update t4 set c3 = c3 + 100;
select * from t4 order by c1;
+----+----+------+------+
| c1 | c2 | c3   | c4   |
+----+----+------+------+
|  1 |  2 |  103 |    4 |
|  5 |  6 |  107 |    8 |
|  9 | 10 |  111 |   12 |
| 13 | 14 |  115 |   16 |
| 17 | 18 |  119 |   20 |
+----+----+------+------+

create table t5(c1 int, c2 int, c3 int, c4 int);
create unique index t5_idx_01 on t5(c3, c4) local;
insert into t5(c1,c2,c3,c4) values(1,2,3,4),(5,6,7,8),(9,10,11,12),(13,14,15,16),(17,18,19,20);
update t5 set c2 = c2 + 100;
select * from t5;
+------+------+------+------+
| c1   | c2   | c3   | c4   |
+------+------+------+------+
|    1 |  102 |    3 |    4 |
|    5 |  106 |    7 |    8 |
|    9 |  110 |   11 |   12 |
|   13 |  114 |   15 |   16 |
|   17 |  118 |   19 |   20 |
+------+------+------+------+

create table t6(c1 int, c2 int not null, c3 int not null, c4 int);
create unique index t6_idx_01 on t6(c2, c3) local;
insert into t6(c1,c2,c3,c4) values(1,2,3,4),(5,6,7,8),(9,10,11,12),(13,14,15,16),(17,18,19,20);
update t6 set c4 = c4 + 100;
select * from t6;
+------+----+----+------+
| c1   | c2 | c3 | c4   |
+------+----+----+------+
|    1 |  2 |  3 |  104 |
|    5 |  6 |  7 |  108 |
|    9 | 10 | 11 |  112 |
|   13 | 14 | 15 |  116 |
|   17 | 18 | 19 |  120 |
+------+----+----+------+

create table t7(c1 int, c2 datetime, c3 timestamp(6) not null default '2012-10-12', c4 timestamp DEFAULT CURRENT_TIMESTAMP ON UPDATE CURRENT_TIMESTAMP, c5 int, primary key(c1));
insert into t7(c1,c2,c3, c4, c5) values(1, '2020-01-01','2012-10-11','2023-12-11 20:24:20',1),(2, '2020-01-02','2012-10-12','2023-12-15 20:24:20',2),(3, '2020-01-03','2012-10-14','2023-12-13 20:24:20',3),(4, '2020-01-04','2012-10-14','2023-12-14 20:24:20',4);
update t7 set c2 = c2 + 1;
select c1,c2,c3,c5 from t7;
+----+---------------------+----------------------------+------+
| c1 | c2                  | c3                         | c5   |
+----+---------------------+----------------------------+------+
|  1 | 2020-01-01 00:00:01 | 2012-10-11 00:00:00.000000 |    1 |
|  2 | 2020-01-02 00:00:01 | 2012-10-12 00:00:00.000000 |    2 |
|  3 | 2020-01-03 00:00:01 | 2012-10-14 00:00:00.000000 |    3 |
|  4 | 2020-01-04 00:00:01 | 2012-10-14 00:00:00.000000 |    4 |
+----+---------------------+----------------------------+------+

create table t8(c1 int primary key, c2 int, c3 int, c4 int unique, c5 int unique);
insert into t8 values(1,1,1,1,1),(2,2,2,2,2),(3,3,3,3,3),(4,4,4,4,4),(5,5,5,5,5);
update t8 set c2 = c2 + 1;
select * from t8;
+----+------+------+------+------+
| c1 | c2   | c3   | c4   | c5   |
+----+------+------+------+------+
|  1 |    2 |    1 |    1 |    1 |
|  2 |    3 |    2 |    2 |    2 |
|  3 |    4 |    3 |    3 |    3 |
|  4 |    5 |    4 |    4 |    4 |
|  5 |    6 |    5 |    5 |    5 |
+----+------+------+------+------+

create table t9(c1 int, c2 int, c3 int, c4 int not null, c5 int as (c1 + c2) not null, c6 int) partition by hash(c5) partitions 4;
create unique index t9_idx_01 on t9(c4, c5) global;
insert into t9(c1,c2,c3,c4, c6) values(1,2,3,4, 44),(5,6,7,8,88),(9,10,11,12,122),(13,14,15,16,166),(17,18,19,20,200);
update t9 set c3 = c3 + 100 where c2 < 10;
select * from t9 order by c1;
+------+------+------+----+----+------+
| c1   | c2   | c3   | c4 | c5 | c6   |
+------+------+------+----+----+------+
|    1 |    2 |  103 |  4 |  3 |   44 |
|    5 |    6 |  107 |  8 | 11 |   88 |
|    9 |   10 |   11 | 12 | 19 |  122 |
|   13 |   14 |   15 | 16 | 27 |  166 |
|   17 |   18 |   19 | 20 | 35 |  200 |
+------+------+------+----+----+------+
explain select /*+index(t9 t9_idx_01)*/ c4, c5 from t9;
Query Plan
========================================================
|ID|OPERATOR       |NAME         |EST.ROWS|EST.TIME(us)|
--------------------------------------------------------
|0 |TABLE FULL SCAN|t9(t9_idx_01)|5       |3           |
========================================================
Outputs & filters:
-------------------------------------
  0 - output([t9.c4], [t9.c5]), filter(nil), rowset=16
      access([t9.c5], [t9.c4]), partitions(p0)
      is_index_back=false, is_global_index=true, 
      range_key([t9.c4], [t9.c5], [t9.shadow_pk_0], [t9.shadow_pk_1]), range(MIN,MIN,MIN,MIN ; MAX,MAX,MAX,MAX)always true
select /*+index(t9 t9_idx_01)*/ c4, c5 from t9;
+----+----+
| c4 | c5 |
+----+----+
|  4 |  3 |
|  8 | 11 |
| 12 | 19 |
| 16 | 27 |
| 20 | 35 |
+----+----+

create table t10(c1 int, c2 int, c3 int, c4 int not null, c5 int as (c1 + c2) not null, c6 int) partition by hash(c5) partitions 4;
create unique index t10_idx_01 on t10(c4, c5) global;
insert into t10(c1,c2,c3,c4, c6) values(1,2,3,4, 44),(5,6,7,8,88),(9,10,11,12,122),(13,14,15,16,166),(17,18,19,20,200);
update t10 set c4 = c4 + 100 where c2 < 10;
select * from t10 order by c1;
+------+------+------+-----+----+------+
| c1   | c2   | c3   | c4  | c5 | c6   |
+------+------+------+-----+----+------+
|    1 |    2 |    3 | 104 |  3 |   44 |
|    5 |    6 |    7 | 108 | 11 |   88 |
|    9 |   10 |   11 |  12 | 19 |  122 |
|   13 |   14 |   15 |  16 | 27 |  166 |
|   17 |   18 |   19 |  20 | 35 |  200 |
+------+------+------+-----+----+------+
explain select /*+index(t10 t10_idx_01)*/ c4, c5 from t10;
Query Plan
==========================================================
|ID|OPERATOR       |NAME           |EST.ROWS|EST.TIME(us)|
----------------------------------------------------------
|0 |TABLE FULL SCAN|t10(t10_idx_01)|5       |3           |
==========================================================
Outputs & filters:
-------------------------------------
  0 - output([t10.c4], [t10.c5]), filter(nil), rowset=16
      access([t10.c5], [t10.c4]), partitions(p0)
      is_index_back=false, is_global_index=true, 
      range_key([t10.c4], [t10.c5], [t10.shadow_pk_0], [t10.shadow_pk_1]), range(MIN,MIN,MIN,MIN ; MAX,MAX,MAX,MAX)always true
select /*+index(t10 t10_idx_01)*/ c4, c5 from t10;
+-----+----+
| c4  | c5 |
+-----+----+
|  12 | 19 |
|  16 | 27 |
|  20 | 35 |
| 104 |  3 |
| 108 | 11 |
+-----+----+

create table t11(c1 int, c2 int, c3 int, c4 int not null, c5 int as (c1 + c2) not null, c6 int, primary key(c1, c2)) partition by hash(c5) partitions 4;
insert into t11(c1,c2,c3,c4, c6) values(1,2,3,4, 44),(5,6,7,8,88),(9,10,11,12,122),(13,14,15,16,166),(17,18,19,20,200);
update t11 set c1 = c1 + 100, c2 = c2 + 100;
select * from t11 order by c1;
+-----+-----+------+----+-----+------+
| c1  | c2  | c3   | c4 | c5  | c6   |
+-----+-----+------+----+-----+------+
| 101 | 102 |    3 |  4 | 203 |   44 |
| 105 | 106 |    7 |  8 | 211 |   88 |
| 109 | 110 |   11 | 12 | 219 |  122 |
| 113 | 114 |   15 | 16 | 227 |  166 |
| 117 | 118 |   19 | 20 | 235 |  200 |
+-----+-----+------+----+-----+------+
explain select /*+index(t11 t11_idx_01)*/ c4, c5 from t11;
Query Plan
=============================================================
|ID|OPERATOR                 |NAME    |EST.ROWS|EST.TIME(us)|
-------------------------------------------------------------
|0 |PX COORDINATOR           |        |5       |20          |
|1 |└─EXCHANGE OUT DISTR     |:EX10000|5       |17          |
|2 |  └─PX PARTITION ITERATOR|        |5       |10          |
|3 |    └─TABLE FULL SCAN    |t11     |5       |10          |
=============================================================
Outputs & filters:
-------------------------------------
  0 - output([INTERNAL_FUNCTION(t11.c4, column_conv(INT,PS:(11,0),NOT NULL,cast(t11.c1 + t11.c2, INT(-1, 0))))]), filter(nil), rowset=16
  1 - output([INTERNAL_FUNCTION(t11.c4, column_conv(INT,PS:(11,0),NOT NULL,cast(t11.c1 + t11.c2, INT(-1, 0))))]), filter(nil), rowset=16
      dop=1
  2 - output([column_conv(INT,PS:(11,0),NOT NULL,cast(t11.c1 + t11.c2, INT(-1, 0)))], [t11.c4]), filter(nil), rowset=16
      force partition granule
  3 - output([column_conv(INT,PS:(11,0),NOT NULL,cast(t11.c1 + t11.c2, INT(-1, 0)))], [t11.c4]), filter(nil), rowset=16
      access([t11.c1], [t11.c2], [t11.c4]), partitions(p[0-3])
      is_index_back=false, is_global_index=false, 
      range_key([t11.c1], [t11.c2]), range(MIN,MIN ; MAX,MAX)always true
select /*+index(t11 t11_idx_01)*/ c4, c5 from t11;
+----+-----+
| c4 | c5  |
+----+-----+
|  4 | 203 |
|  8 | 211 |
| 12 | 219 |
| 16 | 227 |
| 20 | 235 |
+----+-----+

create table t12(c1 int, c2 int, c3 int, c4 int, c5 int);
insert into t12 values(1,1,1,1,1),(2,2,2,2,2),(3,3,3,3,3),(4,4,4,4,4);
update t12 set c1 = c1+1, c2 = c2 + 1;
select * from t12;
+------+------+------+------+------+
| c1   | c2   | c3   | c4   | c5   |
+------+------+------+------+------+
|    2 |    2 |    1 |    1 |    1 |
|    3 |    3 |    2 |    2 |    2 |
|    4 |    4 |    3 |    3 |    3 |
|    5 |    5 |    4 |    4 |    4 |
+------+------+------+------+------+

create table t13(c1 int, c2 int, c3 int, c4 int , primary key(c1, c2)) partition by hash(c1) partitions 4;
create unique index t13_idx_01 on t13(c3) global;
insert into t13(c1, c2,c3,c4) values(1,1,null,1),(2,2,2,2),(3,3,3,3);
update t13 set c1 = 11  where c2 = 1;

drop table if exists t1,t2,t3,t4,t5,t6,t7,t8,t9, t10, t11, t12, t13;
set @@binlog_row_image = 'FULL';

alter system set _enable_defensive_check = 0;
