drop table if exists t1,t2, v1, obright_part;
drop view if exists v1;
result_format: 4
create table t1 (a int auto_increment , primary key (a));
insert into t1 values (NULL),(NULL),(NULL),(NULL),(NULL),(NULL),(NULL),(NULL),(NULL),(NULL),(NULL),(NULL),(NULL),(NULL),(NULL),(NULL),(NULL),(NULL),(NULL),(NULL),(NULL),(NULL),(NULL),(NULL),(NULL),(NULL),(NULL),(NULL),(NULL),(NULL),(NULL),(NULL),(NULL),(NULL),(NULL),(NULL);
update t1 set a=a+10 where a > 34;
update t1 set a=a+100 where a > 0;

update t1 set a=a+100 where a=1 and a=2;
update t1 set a=b+100 where a=1 and a=2;
ERROR 42S22: Unknown column 'b' in 'field list'
update t1 set a=b+100 where c=1 and a=2;
ERROR 42S22: Unknown column 'b' in 'field list'
update t1 set d=a+100 where a=1;
ERROR 42S22: Unknown column 'd' in 'field list'
select * from t1;
+-----+
| a   |
+-----+
| 101 |
| 102 |
| 103 |
| 104 |
| 105 |
| 106 |
| 107 |
| 108 |
| 109 |
| 110 |
| 111 |
| 112 |
| 113 |
| 114 |
| 115 |
| 116 |
| 117 |
| 118 |
| 119 |
| 120 |
| 121 |
| 122 |
| 123 |
| 124 |
| 125 |
| 126 |
| 127 |
| 128 |
| 129 |
| 130 |
| 131 |
| 132 |
| 133 |
| 134 |
| 145 |
| 146 |
+-----+
drop table t1;

CREATE TABLE t1
 (
 place_id int (10) unsigned NOT NULL,
 shows int(10) unsigned DEFAULT '0' NOT NULL,
 ishows int(10) unsigned DEFAULT '0' NOT NULL,
 ushows int(10) unsigned DEFAULT '0' NOT NULL,
 clicks int(10) unsigned DEFAULT '0' NOT NULL,
 iclicks int(10) unsigned DEFAULT '0' NOT NULL,
 uclicks int(10) unsigned DEFAULT '0' NOT NULL,
 ts timestamp,
 PRIMARY KEY (place_id,ts)
 );

INSERT INTO t1 (place_id,shows,ishows,ushows,clicks,iclicks,uclicks,ts)
VALUES (1,0,0,0,0,0,0,20000928174434);
UPDATE t1 SET shows=shows+1,ishows=ishows+1,ushows=ushows+1,clicks=clicks+1,iclicks=iclicks+1,uclicks=uclicks+1 WHERE place_id=1 AND ts>="2000-09-28 00:00:00";
select place_id,shows from t1;
+----------+-------+
| place_id | shows |
+----------+-------+
|        1 |     1 |
+----------+-------+
drop table t1;

CREATE TABLE t1 (
  lfdnr int(10) unsigned NOT NULL default '0',
  ticket int(10) unsigned NOT NULL default '0',
  client varchar(255) NOT NULL default '',
  replyto varchar(255) NOT NULL default '',
  subject varchar(100) NOT NULL default '',
  timestamp int(10) unsigned NOT NULL default '0',
  tstamp timestamp NOT NULL,
  status int(3) NOT NULL default '0',
  type varchar(15) NOT NULL default '',
  assignment int(10) unsigned NOT NULL default '0',
  fupcount int(4) unsigned NOT NULL default '0',
  parent int(10) unsigned NOT NULL default '0',
  activity int(10) unsigned NOT NULL default '0',
  priority tinyint(1) unsigned NOT NULL default '1',
  cc varchar(255) NOT NULL default '',
  bcc varchar(255) NOT NULL default '',
  body varchar(1024) NOT NULL,
  comment varchar(1024),
  header varchar(1024),
  PRIMARY KEY  (lfdnr),
  KEY k1 (timestamp),
  KEY k2 (type),
  KEY k3 (parent),
  KEY k4 (assignment),
  KEY ticket (ticket)
);

INSERT INTO t1 VALUES (773,773,'','','',980257344,20010318180652,0,'Open',10,0,0,0,1,'','','','','');
update t1 set status=1 where type='Open';
select status from t1;
+--------+
| status |
+--------+
|      1 |
+--------+
drop table t1;

create table t1 (a int not null, b int not null, key (a));
insert into t1 values (1,1),(1,2),(1,3),(3,1),(3,2),(3,3),(3,1),(3,2),(3,3),(2,1),(2,2),(2,3);
SET @tmp=0;
update t1 set b=(@tmp:=@tmp+1) order by a;
update t1 set b=99 where a=1 order by b asc limit 1;
select * from t1 order by a,b;
+---+----+
| a | b  |
+---+----+
| 1 |  2 |
| 1 |  3 |
| 1 | 99 |
| 2 |  4 |
| 2 |  5 |
| 2 |  6 |
| 3 |  7 |
| 3 |  8 |
| 3 |  9 |
| 3 | 10 |
| 3 | 11 |
| 3 | 12 |
+---+----+
update t1 set b=100 where a=1 order by b desc limit 2;
update t1 set a=a+10+b where a=1 order by b;
select * from t1 order by a,b;
+-----+-----+
| a   | b   |
+-----+-----+
|   2 |   4 |
|   2 |   5 |
|   2 |   6 |
|   3 |   7 |
|   3 |   8 |
|   3 |   9 |
|   3 |  10 |
|   3 |  11 |
|   3 |  12 |
|  13 |   2 |
| 111 | 100 |
| 111 | 100 |
+-----+-----+
create table t2 (a int not null, b int not null);
insert into t2 values (1,1),(1,2),(1,3);
update t1 set b=(select distinct 1 from (select * from t2) a);
drop table t1,t2;

CREATE TABLE t1 (
   `id_param` smallint(3) unsigned NOT NULL default '0',
   `nom_option` char(40) NOT NULL default '',
   `valid` tinyint(1) NOT NULL default '0',
   KEY `id_param` (`id_param`,`nom_option`)
 );

INSERT INTO t1 (id_param,nom_option,valid) VALUES (185,'600x1200',1);

UPDATE t1 SET nom_option='test' WHERE id_param=185 AND nom_option='600x1200' AND valid=1 LIMIT 1;
select * from t1;
+----------+------------+-------+
| id_param | nom_option | valid |
+----------+------------+-------+
|      185 | test       |     1 |
+----------+------------+-------+
drop table t1;

create table t1 (F1 VARCHAR(30), F2 VARCHAR(30), F3 VARCHAR(30), cnt int, groupid int, KEY groupid_index (groupid));

insert into t1 (F1,F2,F3,cnt,groupid) values ('0','0','0',1,6),
('0','1','2',1,5), ('0','2','0',1,3), ('1','0','1',1,2),
('1','2','1',1,1), ('1','2','2',1,1), ('2','0','1',2,4),
('2','2','0',1,7);
delete from m1 using t1 m1,t1 m2 where m1.groupid=m2.groupid and (m1.cnt < m2.cnt or m1.cnt=m2.cnt and m1.F3>m2.F3);
select * from t1;
+------+------+------+------+---------+
| F1   | F2   | F3   | cnt  | groupid |
+------+------+------+------+---------+
| 0    | 0    | 0    |    1 |       6 |
| 0    | 1    | 2    |    1 |       5 |
| 0    | 2    | 0    |    1 |       3 |
| 1    | 0    | 1    |    1 |       2 |
| 1    | 2    | 1    |    1 |       1 |
| 2    | 0    | 1    |    2 |       4 |
| 2    | 2    | 0    |    1 |       7 |
+------+------+------+------+---------+
drop table t1;

CREATE TABLE t1 ( 
   `colA` int(10) unsigned NOT NULL auto_increment,
   `colB` int(11) NOT NULL default '0',
   PRIMARY KEY  (`colA`)
);

INSERT INTO t1 VALUES (4433,5424);
CREATE TABLE t2 (
  `colC` int(10) unsigned NOT NULL default '0',
  `colA` int(10) unsigned NOT NULL default '0',
  `colD` int(10) unsigned NOT NULL default '0',
  `colE` int(10) unsigned NOT NULL default '0',
  `colF` int(10) unsigned NOT NULL default '0',
  PRIMARY KEY  (`colC`,`colA`,`colD`,`colE`)
);
INSERT INTO t2 VALUES (3,4433,10005,495,500);
INSERT INTO t2 VALUES (3,4433,10005,496,500);
INSERT INTO t2 VALUES (3,4433,10009,494,500);
INSERT INTO t2 VALUES (3,4433,10011,494,500);
INSERT INTO t2 VALUES (3,4433,10005,497,500);
INSERT INTO t2 VALUES (3,4433,10013,489,500);
INSERT INTO t2 VALUES (3,4433,10005,494,500);
INSERT INTO t2 VALUES (3,4433,10005,493,500);
INSERT INTO t2 VALUES (3,4433,10005,492,500);
UPDATE t2,t1 set t2.colE = t2.colE + 10,colF=0 WHERE t1.colA = t2.colA AND (t1.colB & 4096) > 0 AND (colE + 1) < colF;
SELECT * FROM t2;
+------+------+-------+------+------+
| colC | colA | colD  | colE | colF |
+------+------+-------+------+------+
|    3 | 4433 | 10005 |  502 |    0 |
|    3 | 4433 | 10005 |  503 |    0 |
|    3 | 4433 | 10005 |  504 |    0 |
|    3 | 4433 | 10005 |  505 |    0 |
|    3 | 4433 | 10005 |  506 |    0 |
|    3 | 4433 | 10005 |  507 |    0 |
|    3 | 4433 | 10009 |  504 |    0 |
|    3 | 4433 | 10011 |  504 |    0 |
|    3 | 4433 | 10013 |  499 |    0 |
+------+------+-------+------+------+
DROP TABLE t1;
DROP TABLE t2;

create table t1 (c1 int, c2 char(6), c3 int);
create table t2 (c1 int, c2 char(6));
insert into t1 values (1, "t1c2-1", 10), (2, "t1c2-2", 20);
update t1 left join t2 on t1.c1 = t2.c1 set t2.c2 = "t2c2-1";
update t1 left join t2 on t1.c1 = t2.c1 set t2.c2 = "t2c2-1" where t1.c3 = 10;
drop table t1, t2;

create table t1 (id int not null auto_increment primary key, id_str varchar(32));
insert into t1 (id_str) values ("test");
update t1 set id_str = concat(id_str, id) where id = last_insert_id();
select * from t1;
+----+--------+
| id | id_str |
+----+--------+
|  1 | test1  |
+----+--------+
drop table t1;

create table t1 (a int, b char(255), key(a, b(20)));
insert into t1 values (0, '1');
update t1 set b = b + 1 where a = 0;
select * from t1;
+------+------+
| a    | b    |
+------+------+
|    0 | 2    |
+------+------+
drop table t1;

create table t1 (a int, b varchar(10), key b(b(5)));
create table t2 (a int, b varchar(10));
insert into t1 values ( 1, 'abcd1e');
insert into t1 values ( 2, 'abcd2e');
insert into t2 values ( 1, 'abcd1e');
insert into t2 values ( 2, 'abcd2e');
update t1, t2 set t1.a = t2.a where t2.b = t1.b;
show warnings;
Level	Code	Message
drop table t1, t2;

create table t1(f1 int, f2 int);
create table t2(f3 int, f4 int);
create index idx on t2(f3);
insert into t1 values(1,0),(2,0);
insert into t2 values(1,1),(2,2);
UPDATE t1 SET t1.f2=(SELECT MAX(t2.f4) FROM t2 WHERE t2.f3=t1.f1);
select * from t1;
+------+------+
| f1   | f2   |
+------+------+
|    1 |    1 |
|    2 |    2 |
+------+------+
drop table t1,t2;

create table t1(f1 int);
select DATABASE();
+------------+
| DATABASE() |
+------------+
| test       |
+------------+
update t1 set f1=1 where count(*)=1;
ERROR HY000: Invalid use of group function
select DATABASE();
+------------+
| DATABASE() |
+------------+
| test       |
+------------+
delete from t1 where count(*)=1;
ERROR HY000: Invalid use of group function
drop table t1;

create table t1 (f1 int);
create table t2 (f2 int);
insert into t1 values(1),(2);
insert into t2 values(1),(1);
update t1,t2 set f1=3,f2=3 where f1=f2 and f1=1;
affected rows: 3
info: Rows matched: 3  Changed: 3  Warnings: 0
update t2 set f2=1;
update t1 set f1=1 where f1=3;
update t2,t1 set f1=3,f2=3 where f1=f2 and f1=1;
affected rows: 3
info: Rows matched: 3  Changed: 3  Warnings: 0
drop table t1,t2;

create table t1(f1 int, `*f2` int);
insert into t1 values (1,1);
update t1 set `*f2`=1;
drop table t1;

create table t1(f1 int);
update t1 set f2=1 order by f2;
ERROR 42S22: Unknown column 'f2' in 'field list'
drop table t1;
CREATE TABLE t1 (
  request_id int unsigned NOT NULL auto_increment,
  user_id varchar(12) default NULL,
  time_stamp datetime NOT NULL default '0000-00-00 00:00:00',
  ip_address varchar(15) default NULL,
  PRIMARY KEY (request_id),
  KEY user_id_2 (user_id,time_stamp)
);

INSERT INTO t1 (user_id) VALUES ('user1');
INSERT INTO t1(user_id) SELECT user_id FROM t1;
INSERT INTO t1(user_id) SELECT user_id FROM t1;
INSERT INTO t1(user_id) SELECT user_id FROM t1;
INSERT INTO t1(user_id) SELECT user_id FROM t1;
INSERT INTO t1(user_id) SELECT user_id FROM t1;
INSERT INTO t1(user_id) SELECT user_id FROM t1;
INSERT INTO t1(user_id) SELECT user_id FROM t1;
INSERT INTO t1(user_id) SELECT user_id FROM t1;

SELECT user_id FROM t1 WHERE request_id=9999999999999;
+---------+
| user_id |
+---------+
+---------+
SELECT user_id FROM t1 WHERE request_id=999999999999999999999999999999;
+---------+
| user_id |
+---------+
+---------+
UPDATE t1 SET user_id=null WHERE request_id=9999999999999;
UPDATE t1 SET user_id=null WHERE request_id=999999999999999999999999999999;

DROP TABLE t1;

CREATE TABLE t1 (

  a INT(11),
  quux decimal( 31, 30 ),

  UNIQUE KEY bar (a),
  KEY quux (quux)
);

INSERT INTO
 t1 ( a, quux )
VALUES
    ( 1,    1 ),
    ( 2,  0.1 );

INSERT INTO t1( a )
  SELECT @newA := 1 + a FROM t1 WHERE quux <= 0.1;

SELECT * FROM t1;
+------+----------------------------------+
| a    | quux                             |
+------+----------------------------------+
|    1 | 1.000000000000000000000000000000 |
|    2 | 0.100000000000000000000000000000 |
|    3 |                             NULL |
+------+----------------------------------+

DROP TABLE t1;

create table t1 (id int, a int, key idx(a));
create table t2 (id int unsigned not null auto_increment primary key, a int);
insert into t2(a) values(1),(2),(3),(4),(5),(6),(7),(8);
insert into t2(a) select a from t2;
insert into t2(a) select a from t2;
insert into t2(a) select a from t2;
update t2 set a=id;
insert into t1 select * from t2;

select count(*) from t1 join t2 on (t1.a=t2.a);
+----------+
| count(*) |
+----------+
|       64 |
+----------+
update t1 join t2 on (t1.a=t2.a) set t1.id=t2.id;
affected rows: 0
info: Rows matched: 64  Changed: 0  Warnings: 0
insert into t2(a) select a from t2;
update t2 set a=id;
truncate t1;
insert into t1 select * from t2;

select count(*) from t1 join t2 on (t1.a=t2.a);
+----------+
| count(*) |
+----------+
|      128 |
+----------+
update t1 join t2 on (t1.a=t2.a) set t1.id=t2.id;
affected rows: 0
info: Rows matched: 128  Changed: 0  Warnings: 0
update t1 set a=1;
update t2 set a=1;
select count(*) from t1 join t2 on (t1.a=t2.a);
+----------+
| count(*) |
+----------+
|    16384 |
+----------+
update t1 join t2 on (t1.a=t2.a) set t1.id=t2.id;
affected rows: 127
info: Rows matched: 128  Changed: 127  Warnings: 0
drop table t1,t2;

DROP TABLE IF EXISTS t1;
DROP FUNCTION IF EXISTS f1;
CREATE FUNCTION f1() RETURNS INT RETURN f1();
CREATE TABLE t1 (i INT);
INSERT INTO t1 VALUES (1);

UPDATE t1 SET i = 3 WHERE f1();
ERROR HY000: Recursive stored functions are not allowed.
UPDATE t1 SET i = f1();
ERROR HY000: Recursive stored functions are not allowed.

DROP TABLE t1;
DROP FUNCTION f1;

End of 5.0 tests
CREATE TABLE t1 (f1 INTEGER AUTO_INCREMENT, PRIMARY KEY (f1));
CREATE TABLE t2 LIKE t1;
INSERT INTO t1 VALUES (1);
INSERT INTO t2 VALUES (1);

ALTER TABLE t2 COMMENT = 'ABC';
UPDATE t2, t1 SET t2.f1 = 2, t1.f1 = 9;
ALTER TABLE t2 COMMENT = 'DEF';

DROP TABLE t1, t2;

#
# Bug#50545: Single table UPDATE IGNORE crashes on join view in
# sql_safe_updates mode.
#
CREATE TABLE t1 ( a INT, KEY( a ) );
INSERT INTO t1 VALUES (0), (1);
CREATE VIEW v1 AS SELECT t11.a, t12.a AS b FROM t1 t11, t1 t12;
UPDATE v1 SET a = 1;

DROP TABLE t1;
DROP VIEW v1;

#
# Bug#54734 assert in Diagnostics_area::set_ok_status
#
DROP TABLE IF EXISTS t1, not_exists;
DROP FUNCTION IF EXISTS f1;
DROP VIEW IF EXISTS v1;
CREATE TABLE t1 (pk int, PRIMARY KEY(pk)) AS SELECT 1 AS pk;
CREATE FUNCTION f1() RETURNS INTEGER RETURN (SELECT 1 FROM not_exists);
CREATE VIEW v1 AS SELECT pk FROM t1 WHERE f1() = 13;
DROP VIEW v1;
DROP FUNCTION f1;
DROP TABLE t1;

#
# Verify that UPDATE does the same number of handler_update
# operations, no matter if there is ORDER BY or not.
#
CREATE TABLE t1 (i INT) ENGINE=INNODB;
Warnings:
Warning	1286	Unknown storage engine 'INNODB'
INSERT INTO t1 VALUES (10),(11),(12),(13),(14),(15),(16),(17),(18),(19),
                      (20),(21),(22),(23),(24),(25),(26),(27),(28),(29),
                      (30),(31),(32),(33),(34),(35);
CREATE TABLE t2 (a CHAR(2), b CHAR(2), c CHAR(2), d CHAR(2),
                 INDEX idx (a,b(1),c)) ENGINE=INNODB;
Warnings:
Warning	1286	Unknown storage engine 'INNODB'
INSERT INTO t2 SELECT i, i, i, i FROM t1;
START TRANSACTION;
UPDATE t2 SET d = 10 WHERE b = 10 LIMIT 5;
SHOW STATUS LIKE 'HANDLER_UPDATE';
Variable_name	Value
ROLLBACK;
START TRANSACTION;
UPDATE t2 SET d = 10 WHERE b = 10 ORDER BY a, c LIMIT 5;
SHOW STATUS LIKE 'HANDLER_UPDATE';
Variable_name	Value
ROLLBACK;

Same test with a different UPDATE.
ALTER TABLE t2 DROP INDEX idx;
alter table t2 ADD INDEX idx2 (a, b);
START TRANSACTION;
UPDATE t2 SET c = 10 LIMIT 5;
SHOW STATUS LIKE 'HANDLER_UPDATE';
Variable_name	Value
ROLLBACK;
START TRANSACTION;
UPDATE t2 SET c = 10 ORDER BY a, b DESC LIMIT 5;
SHOW STATUS LIKE 'HANDLER_UPDATE';
Variable_name	Value
ROLLBACK;
DROP TABLE t1, t2;

explain_protocol: 1
create table t1(c1 int primary key, c2 int);
create table t2(c1 int primary key, c2 int);
EXPLAIN BASIC insert into t1 values(1, 1), (2, 2);
Query Plan
============================
|ID|OPERATOR          |NAME|
----------------------------
|0 |DISTRIBUTED INSERT|    |
|1 |└─EXPRESSION      |    |
============================
Outputs & filters:
-------------------------------------
  0 - output(nil), filter(nil)
      columns([{t1: ({t1: (t1.c1, t1.c2)})}]), 
      column_values([column_conv(INT,PS:(11,0),NOT NULL,__values.c1)], [column_conv(INT,PS:(11,0),NULL,__values.c2)])
  1 - output([__values.c1], [__values.c2]), filter(nil)
      values({1, 1}, {2, 2})
insert into t1 values(1, 1), (2, 2);
EXPLAIN BASIC insert into t2 values(2, 2), (3, 3);
Query Plan
============================
|ID|OPERATOR          |NAME|
----------------------------
|0 |DISTRIBUTED INSERT|    |
|1 |└─EXPRESSION      |    |
============================
Outputs & filters:
-------------------------------------
  0 - output(nil), filter(nil)
      columns([{t2: ({t2: (t2.c1, t2.c2)})}]), 
      column_values([column_conv(INT,PS:(11,0),NOT NULL,__values.c1)], [column_conv(INT,PS:(11,0),NULL,__values.c2)])
  1 - output([__values.c1], [__values.c2]), filter(nil)
      values({2, 2}, {3, 3})
insert into t2 values(2, 2), (3, 3);
EXPLAIN BASIC update t1, (select count(1) as a from t2) t set t1.c1=t.a+1 where t1.c1=1;
Query Plan
=======================================
|ID|OPERATOR                     |NAME|
---------------------------------------
|0 |UPDATE                       |    |
|1 |└─NESTED-LOOP JOIN CARTESIAN |    |
|2 |  ├─TABLE GET                |t1  |
|3 |  └─SUBPLAN SCAN             |t   |
|4 |    └─SCALAR GROUP BY        |    |
|5 |      └─TABLE FULL SCAN      |t2  |
=======================================
Outputs & filters:
-------------------------------------
  0 - output(nil), filter(nil)
      table_columns([{t1: ({t1: (t1.c1, t1.c2)}), hash_distinct}]),
      update([t1.c1=column_conv(INT,PS:(11,0),NOT NULL,cast(t.a + 1, INT(-1, 0)))])
  1 - output([t1.c1], [t1.c2], [t.a]), filter(nil), rowset=16
      conds(nil), nl_params_(nil), use_batch=false
  2 - output([t1.c1], [t1.c2]), filter(nil), rowset=16
      access([t1.c1], [t1.c2]), partitions(p0)
      is_index_back=false, is_global_index=false, 
      range_key([t1.c1]), range[1 ; 1], 
      range_cond([t1.c1 = 1])
  3 - output([t.a]), filter(nil), rowset=16
      access([t.a])
  4 - output([T_FUN_COUNT_SUM(T_FUN_COUNT(*))]), filter(nil), rowset=16
      group(nil), agg_func([T_FUN_COUNT_SUM(T_FUN_COUNT(*))])
  5 - output([T_FUN_COUNT(*)]), filter(nil), rowset=16
      access(nil), partitions(p0)
      is_index_back=false, is_global_index=false, 
      range_key([t2.c1]), range(MIN ; MAX)always true, 
      pushdown_aggregation([T_FUN_COUNT(*)])
update t1, (select count(1) as a from t2) t set t1.c1=t.a+1 where t1.c1=1;
EXPLAIN BASIC select * from t1;
Query Plan
=========================
|ID|OPERATOR       |NAME|
-------------------------
|0 |TABLE FULL SCAN|t1  |
=========================
Outputs & filters:
-------------------------------------
  0 - output([t1.c1], [t1.c2]), filter(nil), rowset=16
      access([t1.c1], [t1.c2]), partitions(p0)
      is_index_back=false, is_global_index=false, 
      range_key([t1.c1]), range(MIN ; MAX)always true
select * from t1;
+----+------+
| c1 | c2   |
+----+------+
|  2 |    2 |
|  3 |    1 |
+----+------+
update t1 join (select * from t2) t set t.c1=t1.c1 where t1.c1=0;
ERROR HY000: The target table t of the UPDATE is not updatable
EXPLAIN BASIC select * from t1;
Query Plan
=========================
|ID|OPERATOR       |NAME|
-------------------------
|0 |TABLE FULL SCAN|t1  |
=========================
Outputs & filters:
-------------------------------------
  0 - output([t1.c1], [t1.c2]), filter(nil), rowset=16
      access([t1.c1], [t1.c2]), partitions(p0)
      is_index_back=false, is_global_index=false, 
      range_key([t1.c1]), range(MIN ; MAX)always true
select * from t1;
+----+------+
| c1 | c2   |
+----+------+
|  2 |    2 |
|  3 |    1 |
+----+------+
EXPLAIN BASIC update t1 join t2 using(c1) set c1=1 where t1.c1=1;
Query Plan
=======================================
|ID|OPERATOR                     |NAME|
---------------------------------------
|0 |UPDATE                       |    |
|1 |└─NESTED-LOOP JOIN CARTESIAN |    |
|2 |  ├─TABLE GET                |t1  |
|3 |  └─TABLE GET                |t2  |
=======================================
Outputs & filters:
-------------------------------------
  0 - output(nil), filter(nil)
      table_columns([{t1: ({t1: (t1.c1, t1.c2)})}]),
      update([t1.c1=column_conv(INT,PS:(11,0),NOT NULL,1)])
  1 - output([t1.c1], [t1.c2]), filter(nil), rowset=16
      conds(nil), nl_params_(nil), use_batch=false
  2 - output([t1.c1], [t1.c2]), filter(nil), rowset=16
      access([t1.c1], [t1.c2]), partitions(p0)
      is_index_back=false, is_global_index=false, 
      range_key([t1.c1]), range[1 ; 1], 
      range_cond([t1.c1 = 1])
  3 - output(nil), filter(nil), rowset=16
      access(nil), partitions(p0)
      is_index_back=false, is_global_index=false, 
      range_key([t2.c1]), range[1 ; 1], 
      range_cond([t2.c1 = 1])
update t1 join t2 using(c1) set c1=1 where t1.c1=1;
EXPLAIN BASIC select * from t1;
Query Plan
=========================
|ID|OPERATOR       |NAME|
-------------------------
|0 |TABLE FULL SCAN|t1  |
=========================
Outputs & filters:
-------------------------------------
  0 - output([t1.c1], [t1.c2]), filter(nil), rowset=16
      access([t1.c1], [t1.c2]), partitions(p0)
      is_index_back=false, is_global_index=false, 
      range_key([t1.c1]), range(MIN ; MAX)always true
select * from t1;
+----+------+
| c1 | c2   |
+----+------+
|  2 |    2 |
|  3 |    1 |
+----+------+
EXPLAIN BASIC update t1, t2 set t1.c1=t2.c1+2, t2.c1=t1.c1+2 where t1.c2=t2.c2;
Query Plan
=============================
|ID|OPERATOR           |NAME|
-----------------------------
|0 |DISTRIBUTED UPDATE |    |
|1 |└─HASH JOIN        |    |
|2 |  ├─TABLE FULL SCAN|t1  |
|3 |  └─TABLE FULL SCAN|t2  |
=============================
Outputs & filters:
-------------------------------------
  0 - output(nil), filter(nil)
      table_columns([{t1: ({t1: (t1.c1, t1.c2)}), hash_distinct}], [{t2: ({t2: (t2.c1, t2.c2)}), hash_distinct}]),
      update([t1.c1=column_conv(INT,PS:(11,0),NOT NULL,cast(t2.c1 + 2, INT(-1, 0)))], [t2.c1=column_conv(INT,PS:(11,0),NOT NULL,cast(t1.c1 + 2, INT(-1, 
      0)))])
  1 - output([t1.c1], [t1.c2], [t2.c1], [t2.c2]), filter(nil), rowset=16
      equal_conds([t1.c2 = t2.c2]), other_conds(nil)
  2 - output([t1.c1], [t1.c2]), filter(nil), rowset=16
      access([t1.c1], [t1.c2]), partitions(p0)
      is_index_back=false, is_global_index=false, 
      range_key([t1.c1]), range(MIN ; MAX)always true
  3 - output([t2.c1], [t2.c2]), filter(nil), rowset=16
      access([t2.c1], [t2.c2]), partitions(p0)
      is_index_back=false, is_global_index=false, 
      range_key([t2.c1]), range(MIN ; MAX)always true
update t1, t2 set t1.c1=t2.c1+2, t2.c1=t1.c1+2 where t1.c2=t2.c2;
drop table t1, t2;

drop database if exists multi_dml;
create database multi_dml;
create table multi_dml.t1(c1 int primary key, c2 int);
create table t1(c1 int primary key, c2 int);
create table t2(c1 int primary key, c2 int);
EXPLAIN BASIC insert into multi_dml.t1 values(1, 1), (2, 2);
Query Plan
============================
|ID|OPERATOR          |NAME|
----------------------------
|0 |DISTRIBUTED INSERT|    |
|1 |└─EXPRESSION      |    |
============================
Outputs & filters:
-------------------------------------
  0 - output(nil), filter(nil)
      columns([{t1: ({t1: (t1.c1, t1.c2)})}]), 
      column_values([column_conv(INT,PS:(11,0),NOT NULL,__values.c1)], [column_conv(INT,PS:(11,0),NULL,__values.c2)])
  1 - output([__values.c1], [__values.c2]), filter(nil)
      values({1, 1}, {2, 2})
insert into multi_dml.t1 values(1, 1), (2, 2);
EXPLAIN BASIC insert into t1 values(1, 1), (2, 2);
Query Plan
============================
|ID|OPERATOR          |NAME|
----------------------------
|0 |DISTRIBUTED INSERT|    |
|1 |└─EXPRESSION      |    |
============================
Outputs & filters:
-------------------------------------
  0 - output(nil), filter(nil)
      columns([{t1: ({t1: (t1.c1, t1.c2)})}]), 
      column_values([column_conv(INT,PS:(11,0),NOT NULL,__values.c1)], [column_conv(INT,PS:(11,0),NULL,__values.c2)])
  1 - output([__values.c1], [__values.c2]), filter(nil)
      values({1, 1}, {2, 2})
insert into t1 values(1, 1), (2, 2);
EXPLAIN BASIC insert into t2 values(2, 2), (3, 3);
Query Plan
============================
|ID|OPERATOR          |NAME|
----------------------------
|0 |DISTRIBUTED INSERT|    |
|1 |└─EXPRESSION      |    |
============================
Outputs & filters:
-------------------------------------
  0 - output(nil), filter(nil)
      columns([{t2: ({t2: (t2.c1, t2.c2)})}]), 
      column_values([column_conv(INT,PS:(11,0),NOT NULL,__values.c1)], [column_conv(INT,PS:(11,0),NULL,__values.c2)])
  1 - output([__values.c1], [__values.c2]), filter(nil)
      values({2, 2}, {3, 3})
insert into t2 values(2, 2), (3, 3);
EXPLAIN BASIC delete from t1 using test.t2 join multi_dml.t1 on t1.c1=t2.c1;
Query Plan
=============================
|ID|OPERATOR           |NAME|
-----------------------------
|0 |DELETE             |    |
|1 |└─MERGE JOIN       |    |
|2 |  ├─TABLE FULL SCAN|t2  |
|3 |  └─TABLE FULL SCAN|t1  |
=============================
Outputs & filters:
-------------------------------------
  0 - output(nil), filter(nil)
      table_columns([{t1: ({t1: (t1.c1, t1.c2)})}])
  1 - output([t1.c1], [t1.c2]), filter(nil), rowset=16
      equal_conds([t1.c1 = t2.c1]), other_conds(nil)
      merge_directions([ASC])
  2 - output([t2.c1]), filter(nil), rowset=16
      access([t2.c1]), partitions(p0)
      is_index_back=false, is_global_index=false, 
      range_key([t2.c1]), range(MIN ; MAX)always true
  3 - output([t1.c1], [t1.c2]), filter(nil), rowset=16
      access([t1.c1], [t1.c2]), partitions(p0)
      is_index_back=false, is_global_index=false, 
      range_key([t1.c1]), range(MIN ; MAX)always true
delete from t1 using test.t2 join multi_dml.t1 on t1.c1=t2.c1;
delete from t1 using test.t1 join multi_dml.t1 on t1.c1=t1.c1;
ERROR 23000: Column 't1.c1' in on clause is ambiguous
EXPLAIN BASIC delete from t1, t2 using t1, t2 where t1.c1=t2.c1;
Query Plan
=============================
|ID|OPERATOR           |NAME|
-----------------------------
|0 |DISTRIBUTED DELETE |    |
|1 |└─MERGE JOIN       |    |
|2 |  ├─TABLE FULL SCAN|t1  |
|3 |  └─TABLE FULL SCAN|t2  |
=============================
Outputs & filters:
-------------------------------------
  0 - output(nil), filter(nil)
      table_columns([{t1: ({t1: (t1.c1, t1.c2)})}], [{t2: ({t2: (t2.c1, t2.c2)})}])
  1 - output([t1.c1], [t1.c2], [t2.c1], [t2.c2]), filter(nil), rowset=16
      equal_conds([t1.c1 = t2.c1]), other_conds(nil)
      merge_directions([ASC])
  2 - output([t1.c1], [t1.c2]), filter(nil), rowset=16
      access([t1.c1], [t1.c2]), partitions(p0)
      is_index_back=false, is_global_index=false, 
      range_key([t1.c1]), range(MIN ; MAX)always true
  3 - output([t2.c1], [t2.c2]), filter(nil), rowset=16
      access([t2.c1], [t2.c2]), partitions(p0)
      is_index_back=false, is_global_index=false, 
      range_key([t2.c1]), range(MIN ; MAX)always true
delete from t1, t2 using t1, t2 where t1.c1=t2.c1;
EXPLAIN BASIC select * from t1;
Query Plan
=========================
|ID|OPERATOR       |NAME|
-------------------------
|0 |TABLE FULL SCAN|t1  |
=========================
Outputs & filters:
-------------------------------------
  0 - output([t1.c1], [t1.c2]), filter(nil), rowset=16
      access([t1.c1], [t1.c2]), partitions(p0)
      is_index_back=false, is_global_index=false, 
      range_key([t1.c1]), range(MIN ; MAX)always true
select * from t1;
+----+------+
| c1 | c2   |
+----+------+
|  1 |    1 |
+----+------+
EXPLAIN BASIC select * from t2;
Query Plan
=========================
|ID|OPERATOR       |NAME|
-------------------------
|0 |TABLE FULL SCAN|t2  |
=========================
Outputs & filters:
-------------------------------------
  0 - output([t2.c1], [t2.c2]), filter(nil), rowset=16
      access([t2.c1], [t2.c2]), partitions(p0)
      is_index_back=false, is_global_index=false, 
      range_key([t2.c1]), range(MIN ; MAX)always true
select * from t2;
+----+------+
| c1 | c2   |
+----+------+
|  3 |    3 |
+----+------+
drop table t1, t2;
drop database multi_dml;

CREATE TABLE `obright_part` (
  `grp_id` bigint(20) NOT NULL,
  `row_id` bigint(20) NOT NULL,
  `row_hex` varchar(2048) NOT NULL,
  `trx_grp` bigint(20) DEFAULT NULL,
  `v1` varchar(65536) DEFAULT NULL,
  `v1_check` bigint(20) DEFAULT NULL,
  `v2` varchar(65536) DEFAULT NULL,
  `v2_check` bigint(20) DEFAULT NULL,
  `r1` int(11) DEFAULT NULL,
  `r2` int(11) DEFAULT NULL,
  `glike` varchar(4096) DEFAULT NULL,
  `c1` bigint(20) DEFAULT NULL,
  `c2` bigint(20) DEFAULT NULL,
  `c3` bigint(20) DEFAULT NULL,
  `c4` bigint(20) DEFAULT NULL,
  `c5` bigint(20) DEFAULT NULL,
  `c6` tinyint(4) DEFAULT NULL,
  `c7` bigint(20) DEFAULT NULL,
  `c8` bigint(20) DEFAULT NULL,
  `c9` bigint(20) DEFAULT NULL,
  `c10` bigint(20) DEFAULT NULL,
  `v3` varchar(1024) DEFAULT NULL,
  `ts` timestamp(6) NULL DEFAULT CURRENT_TIMESTAMP(6) ON UPDATE CURRENT_TIMESTAMP(6),
  `t1` timestamp(6) NULL DEFAULT NULL,
  `t2` datetime(6) DEFAULT NULL,
  `dec1` decimal(16,4) DEFAULT NULL,
  `dec2` decimal(16,4) DEFAULT NULL,
  `dec3` decimal(16,6) DEFAULT NULL,
  `b1` tinyint(1) DEFAULT NULL,
  `d1` bigint(20) DEFAULT '0',
  `ac1` bigint(20) NOT NULL AUTO_INCREMENT,
  `gmt_create` timestamp(6) NULL DEFAULT CURRENT_TIMESTAMP(6),
  `gmt_modified` timestamp(6) NULL DEFAULT CURRENT_TIMESTAMP(6),
  PRIMARY KEY (`grp_id`, `row_id`, `row_hex`),
  UNIQUE KEY `obright_part1_uniq` (`t1`, `grp_id`, `row_id`, `row_hex`) LOCAL,
  UNIQUE KEY `obright_part2_uniq` (`trx_grp`, `r1`, `row_hex`, `row_id`, `grp_id`) LOCAL,
  UNIQUE KEY `obright_part3_uniq` (`row_hex`, `grp_id`, `row_id`) LOCAL,
  UNIQUE KEY `obright_part4_uniq` (`trx_grp`, `row_hex`, `grp_id`) STORING (`v1`, `v1_check`, `r1`, `r2`) LOCAL,
  KEY `obright_part2` (`trx_grp`, `row_id`, `ac1`) LOCAL,
  KEY `obright_part3` (`glike`) LOCAL,
  KEY `obright_part4` (`t1`, `ts`, `dec1`, `dec2`) STORING (`v1`, `v1_check`, `r1`, `r2`) LOCAL,
  KEY `obright_part5` (`v1_check`, `v2_check`) LOCAL,
  KEY `obright_part6` (`row_hex`, `v1_check`) STORING (`r1`, `glike`, `t1`) LOCAL,
  KEY `obright_part1` (`row_id`) GLOBAL,
  KEY `obright_part7` (`grp_id`, `row_id`, `row_hex`, `trx_grp`, `v1_check`, `r1`, `r2`) STORING (`v1`) GLOBAL,
  KEY `obright_part8` (`ac1`) LOCAL,
  KEY `obright_part9` (`grp_id`, `row_id`, `row_hex`) LOCAL
) partition by key(grp_id) partitions 2;

EXPLAIN BASIC insert into obright_part values(1, 1, 'a', 2839, 'aa', 1, 'aa', 2, '1', '1', 'bb', 1, 2, 3, 4, 5, 6, 7, 8, 9, 10, 'v3', now(), now(), now(), 1.1, 1.1, 1.1, 1, 1, 1, now(), now());
Query Plan
============================
|ID|OPERATOR          |NAME|
----------------------------
|0 |DISTRIBUTED INSERT|    |
|1 |└─EXPRESSION      |    |
============================
Outputs & filters:
-------------------------------------
  0 - output(nil), filter(nil)
      columns([{obright_part: ({obright_part: (obright_part.grp_id, obright_part.row_id, obright_part.row_hex, obright_part.trx_grp, obright_part.v1, obright_part.v1_check,
       obright_part.v2, obright_part.v2_check, obright_part.r1, obright_part.r2, obright_part.glike, obright_part.c1, obright_part.c2, obright_part.c3, obright_part.c4,
       obright_part.c5, obright_part.c6, obright_part.c7, obright_part.c8, obright_part.c9, obright_part.c10, obright_part.v3, obright_part.ts, obright_part.t1,
       obright_part.t2, obright_part.dec1, obright_part.dec2, obright_part.dec3, obright_part.b1, obright_part.d1, obright_part.ac1, obright_part.gmt_create, 
      obright_part.gmt_modified)}, {obright_part1: (obright_part.row_id, obright_part.grp_id, obright_part.row_hex)}, {obright_part7: (obright_part.grp_id, obright_part.row_id,
       obright_part.row_hex, obright_part.trx_grp, obright_part.v1_check, obright_part.r1, obright_part.r2, obright_part.v1)})}]), 
      column_values([column_conv(BIGINT,PS:(20,0),NOT NULL,__values.grp_id)], [column_conv(BIGINT,PS:(20,0),NOT NULL,__values.row_id)], [column_conv(VARCHAR,
      utf8mb4_general_ci,length:2048,NOT NULL,__values.row_hex)], [column_conv(BIGINT,PS:(20,0),NULL,__values.trx_grp)], [column_conv(VARCHAR,utf8mb4_general_ci,
      length:65536,NULL,__values.v1)], [column_conv(BIGINT,PS:(20,0),NULL,__values.v1_check)], [column_conv(VARCHAR,utf8mb4_general_ci,length:65536,NULL,__values.v2)],
       [column_conv(BIGINT,PS:(20,0),NULL,__values.v2_check)], [column_conv(INT,PS:(11,0),NULL,__values.r1)], [column_conv(INT,PS:(11,0),NULL,__values.r2)], [column_conv(VARCHAR,
      utf8mb4_general_ci,length:4096,NULL,__values.glike)], [column_conv(BIGINT,PS:(20,0),NULL,__values.c1)], [column_conv(BIGINT,PS:(20,0),NULL,__values.c2)],
       [column_conv(BIGINT,PS:(20,0),NULL,__values.c3)], [column_conv(BIGINT,PS:(20,0),NULL,__values.c4)], [column_conv(BIGINT,PS:(20,0),NULL,__values.c5)], [column_conv(TINYINT,
      PS:(4,0),NULL,__values.c6)], [column_conv(BIGINT,PS:(20,0),NULL,__values.c7)], [column_conv(BIGINT,PS:(20,0),NULL,__values.c8)], [column_conv(BIGINT,PS:(20,
      0),NULL,__values.c9)], [column_conv(BIGINT,PS:(20,0),NULL,__values.c10)], [column_conv(VARCHAR,utf8mb4_general_ci,length:1024,NULL,__values.v3)], [column_conv(TIMESTAMP,
      PS:(25,6),NULL,__values.ts)], [column_conv(TIMESTAMP,PS:(25,6),NULL,__values.t1)], [column_conv(MYSQL_DATETIME,PS:(25,6),NULL,__values.t2)], [column_conv(DECIMAL_INT,
      PS:(16,4),NULL,__values.dec1)], [column_conv(DECIMAL_INT,PS:(16,4),NULL,__values.dec2)], [column_conv(DECIMAL_INT,PS:(16,6),NULL,__values.dec3)], [column_conv(TINYINT,
      PS:(1,0),NULL,__values.b1)], [column_conv(BIGINT,PS:(20,0),NULL,__values.d1)], [column_conv(BIGINT,PS:(20,0),NOT NULL,obright_part.ac1.nextval(column_conv(BIGINT,
      PS:(20,0),NOT NULL,__values.ac1)))], [column_conv(TIMESTAMP,PS:(25,6),NULL,__values.gmt_create)], [column_conv(TIMESTAMP,PS:(25,6),NULL,__values.gmt_modified)])
  1 - output([__values.grp_id], [__values.row_id], [__values.row_hex], [__values.trx_grp], [__values.v1], [__values.v1_check], [__values.v2], [__values.v2_check],
       [__values.r1], [__values.r2], [__values.glike], [__values.c1], [__values.c2], [__values.c3], [__values.c4], [__values.c5], [__values.c6], [__values.c7],
       [__values.c8], [__values.c9], [__values.c10], [__values.v3], [__values.ts], [__values.t1], [__values.t2], [__values.dec1], [__values.dec2], [__values.dec3],
       [__values.b1], [__values.d1], [__values.ac1], [__values.gmt_create], [__values.gmt_modified]), filter(nil)
      values({1, 1, 'a', 2839, 'aa', 1, 'aa', 2, '1', '1', 'bb', 1, 2, 3, 4, 5, 6, 7, 8, 9, 10, 'v3', current_timestamp(), current_timestamp(), current_timestamp(),
       1.1, 1.1, 1.1, 1, 1, 1, current_timestamp(), current_timestamp()})
insert into obright_part values(1, 1, 'a', 2839, 'aa', 1, 'aa', 2, '1', '1', 'bb', 1, 2, 3, 4, 5, 6, 7, 8, 9, 10, 'v3', now(), now(), now(), 1.1, 1.1, 1.1, 1, 1, 1, now(), now());
EXPLAIN BASIC update obright_part set v1='mBCSj91aUlHxnmbrN7g5olC0UDUwnLlBUmR64JjDt2nbCdLGeuE3oN6QXxnyREPlxa91Gj8hBM0o8YWnudseTs7k8m92vcqlyiz67opx8iaDhuvIyUmSDYq7IIxEDYb2GDyDtdxoeT40uXSTrjGvMe',v1_check=472593373,v2='l4E4g7RtZVzQRRGasKc0zi3jBaT0bav53UQq3zVCwskHVNN3kZN7e5RrzMqgKKGb',v2_check=3046643075,dec1=(r2*1024*1024/10000),dec2=(r1*1024*1024/10000),gmt_modified=now(6) where trx_grp>=2838 and trx_grp<2938;
Query Plan
=================================================================
|ID|OPERATOR                   |NAME                            |
-----------------------------------------------------------------
|0 |DISTRIBUTED UPDATE         |                                |
|1 |└─PX COORDINATOR           |                                |
|2 |  └─EXCHANGE OUT DISTR     |:EX10000                        |
|3 |    └─PX PARTITION ITERATOR|                                |
|4 |      └─TABLE RANGE SCAN   |obright_part(obright_part4_uniq)|
=================================================================
Outputs & filters:
-------------------------------------
  0 - output(nil), filter(nil)
      table_columns([{obright_part: ({obright_part: (obright_part.grp_id, obright_part.row_id, obright_part.row_hex, obright_part.trx_grp, obright_part.v1,
       obright_part.v1_check, obright_part.v2, obright_part.v2_check, obright_part.r1, obright_part.r2, obright_part.glike, obright_part.c1, obright_part.c2, 
      obright_part.c3, obright_part.c4, obright_part.c5, obright_part.c6, obright_part.c7, obright_part.c8, obright_part.c9, obright_part.c10, obright_part.v3,
       obright_part.ts, obright_part.t1, obright_part.t2, obright_part.dec1, obright_part.dec2, obright_part.dec3, obright_part.b1, obright_part.d1, obright_part.ac1,
       obright_part.gmt_create, obright_part.gmt_modified)}, {obright_part7: (obright_part.grp_id, obright_part.row_id, obright_part.row_hex, obright_part.trx_grp,
       obright_part.v1_check, obright_part.r1, obright_part.r2, obright_part.v1)})}]),
      update([obright_part.v1=column_conv(VARCHAR,utf8mb4_general_ci,length:65536,NULL,'mBCSj91aUlHxnmbrN7g5olC0UDUwnLlBUmR64JjDt2nbCdLGeuE3oN6QXxnyREPlxa91Gj8hBM0o8YWnudseTs7k8m92vcqlyiz67opx8iaDhuvIy
      UmSDYq7IIxEDYb2GDyDtdxoeT40uXSTrjGvMe')], [obright_part.v1_check=column_conv(BIGINT,PS:(20,0),NULL,472593373)], [obright_part.v2=column_conv(VARCHAR,utf8mb4_general_ci,
      length:65536,NULL,'l4E4g7RtZVzQRRGasKc0zi3jBaT0bav53UQq3zVCwskHVNN3kZN7e5RrzMqgKKGb')], [obright_part.v2_check=column_conv(BIGINT,PS:(20,0),NULL,3046643075)],
       [obright_part.dec1=column_conv(DECIMAL_INT,PS:(16,4),NULL,cast(cast(obright_part.r2 * 1024 * 1024, DECIMAL(51, 0)) / cast(10000, DECIMAL(20, 0)), DECIMAL_INT(16,
       4)))], [obright_part.dec2=column_conv(DECIMAL_INT,PS:(16,4),NULL,cast(cast(obright_part.r1 * 1024 * 1024, DECIMAL(51, 0)) / cast(10000, DECIMAL(20, 0)),
       DECIMAL_INT(16, 4)))], [obright_part.gmt_modified=column_conv(TIMESTAMP,PS:(25,6),NULL,cast(current_timestamp(), TIMESTAMP(-1, 6)))], [obright_part.ts=column_conv(TIMESTAMP,
      PS:(25,6),NULL,cast(current_timestamp(), TIMESTAMP(25, 6)))])
  1 - output([obright_part.grp_id], [obright_part.row_id], [obright_part.row_hex], [obright_part.trx_grp], [obright_part.v1], [obright_part.v1_check], [obright_part.v2],
       [obright_part.v2_check], [obright_part.r1], [obright_part.r2], [obright_part.glike], [obright_part.c1], [obright_part.c2], [obright_part.c3], [obright_part.c4],
       [obright_part.c5], [obright_part.c6], [obright_part.c7], [obright_part.c8], [obright_part.c9], [obright_part.c10], [obright_part.v3], [obright_part.ts],
       [obright_part.t1], [obright_part.t2], [obright_part.dec1], [obright_part.dec2], [obright_part.dec3], [obright_part.b1], [obright_part.d1], [obright_part.ac1],
       [obright_part.gmt_create], [obright_part.gmt_modified]), filter(nil), rowset=16
  2 - output([obright_part.grp_id], [obright_part.row_id], [obright_part.row_hex], [obright_part.trx_grp], [obright_part.v1], [obright_part.v1_check], [obright_part.v2],
       [obright_part.v2_check], [obright_part.r1], [obright_part.r2], [obright_part.glike], [obright_part.c1], [obright_part.c2], [obright_part.c3], [obright_part.c4],
       [obright_part.c5], [obright_part.c6], [obright_part.c7], [obright_part.c8], [obright_part.c9], [obright_part.c10], [obright_part.v3], [obright_part.ts],
       [obright_part.t1], [obright_part.t2], [obright_part.dec1], [obright_part.dec2], [obright_part.dec3], [obright_part.b1], [obright_part.d1], [obright_part.ac1],
       [obright_part.gmt_create], [obright_part.gmt_modified]), filter(nil), rowset=16
      dop=1
  3 - output([obright_part.grp_id], [obright_part.row_id], [obright_part.row_hex], [obright_part.v1], [obright_part.v1_check], [obright_part.v2], [obright_part.v2_check],
       [obright_part.dec1], [obright_part.r2], [obright_part.dec2], [obright_part.r1], [obright_part.gmt_modified], [obright_part.ts], [obright_part.trx_grp],
       [obright_part.glike], [obright_part.c1], [obright_part.c2], [obright_part.c3], [obright_part.c4], [obright_part.c5], [obright_part.c6], [obright_part.c7],
       [obright_part.c8], [obright_part.c9], [obright_part.c10], [obright_part.v3], [obright_part.t1], [obright_part.t2], [obright_part.dec3], [obright_part.b1],
       [obright_part.d1], [obright_part.ac1], [obright_part.gmt_create]), filter(nil), rowset=16
      force partition granule
  4 - output([obright_part.grp_id], [obright_part.row_id], [obright_part.row_hex], [obright_part.v1], [obright_part.v1_check], [obright_part.v2], [obright_part.v2_check],
       [obright_part.dec1], [obright_part.r2], [obright_part.dec2], [obright_part.r1], [obright_part.gmt_modified], [obright_part.ts], [obright_part.trx_grp],
       [obright_part.glike], [obright_part.c1], [obright_part.c2], [obright_part.c3], [obright_part.c4], [obright_part.c5], [obright_part.c6], [obright_part.c7],
       [obright_part.c8], [obright_part.c9], [obright_part.c10], [obright_part.v3], [obright_part.t1], [obright_part.t2], [obright_part.dec3], [obright_part.b1],
       [obright_part.d1], [obright_part.ac1], [obright_part.gmt_create]), filter(nil), rowset=16
      access([obright_part.grp_id], [obright_part.row_id], [obright_part.row_hex], [obright_part.v1], [obright_part.v1_check], [obright_part.v2], [obright_part.v2_check],
       [obright_part.dec1], [obright_part.r2], [obright_part.dec2], [obright_part.r1], [obright_part.gmt_modified], [obright_part.ts], [obright_part.trx_grp],
       [obright_part.glike], [obright_part.c1], [obright_part.c2], [obright_part.c3], [obright_part.c4], [obright_part.c5], [obright_part.c6], [obright_part.c7],
       [obright_part.c8], [obright_part.c9], [obright_part.c10], [obright_part.v3], [obright_part.t1], [obright_part.t2], [obright_part.dec3], [obright_part.b1],
       [obright_part.d1], [obright_part.ac1], [obright_part.gmt_create]), partitions(p[0-1])
      is_index_back=true, is_global_index=false, 
      range_key([obright_part.trx_grp], [obright_part.row_hex], [obright_part.grp_id], [obright_part.shadow_pk_0], [obright_part.shadow_pk_1], [obright_part.shadow_pk_2]),
       range(2838,MIN,MIN,MIN,MIN,MIN ; 2938,MIN,MIN,MIN,MIN,MIN), 
      range_cond([obright_part.trx_grp >= 2838], [obright_part.trx_grp < 2938])
update obright_part set v1='mBCSj91aUlHxnmbrN7g5olC0UDUwnLlBUmR64JjDt2nbCdLGeuE3oN6QXxnyREPlxa91Gj8hBM0o8YWnudseTs7k8m92vcqlyiz67opx8iaDhuvIyUmSDYq7IIxEDYb2GDyDtdxoeT40uXSTrjGvMe',v1_check=472593373,v2='l4E4g7RtZVzQRRGasKc0zi3jBaT0bav53UQq3zVCwskHVNN3kZN7e5RrzMqgKKGb',v2_check=3046643075,dec1=(r2*1024*1024/10000),dec2=(r1*1024*1024/10000),gmt_modified=now(6) where trx_grp>=2838 and trx_grp<2938;
EXPLAIN BASIC select `grp_id`,`row_id`,`row_hex`,`trx_grp`,`v1`,`v1_check`,`v2`,`v2_check`,`r1`,`r2`,`glike`,`c1`,`c2`,`c3`,`c4`,`c5`,`c6`,`c7`,`c8`,`c9`,`c10`,`v3`,`dec1`,`dec2`,`dec3`,`b1`,`d1`,`ac1` from obright_part;
Query Plan
===========================================
|ID|OPERATOR                 |NAME        |
-------------------------------------------
|0 |PX COORDINATOR           |            |
|1 |└─EXCHANGE OUT DISTR     |:EX10000    |
|2 |  └─PX PARTITION ITERATOR|            |
|3 |    └─TABLE FULL SCAN    |obright_part|
===========================================
Outputs & filters:
-------------------------------------
  0 - output([INTERNAL_FUNCTION(obright_part.grp_id, obright_part.row_id, obright_part.row_hex, obright_part.trx_grp, obright_part.v1, obright_part.v1_check,
       obright_part.v2, obright_part.v2_check, obright_part.r1, obright_part.r2, obright_part.glike, obright_part.c1, obright_part.c2, obright_part.c3, obright_part.c4,
       obright_part.c5, obright_part.c6, obright_part.c7, obright_part.c8, obright_part.c9, obright_part.c10, obright_part.v3, obright_part.dec1, obright_part.dec2,
       obright_part.dec3, obright_part.b1, obright_part.d1, obright_part.ac1)]), filter(nil), rowset=16
  1 - output([INTERNAL_FUNCTION(obright_part.grp_id, obright_part.row_id, obright_part.row_hex, obright_part.trx_grp, obright_part.v1, obright_part.v1_check,
       obright_part.v2, obright_part.v2_check, obright_part.r1, obright_part.r2, obright_part.glike, obright_part.c1, obright_part.c2, obright_part.c3, obright_part.c4,
       obright_part.c5, obright_part.c6, obright_part.c7, obright_part.c8, obright_part.c9, obright_part.c10, obright_part.v3, obright_part.dec1, obright_part.dec2,
       obright_part.dec3, obright_part.b1, obright_part.d1, obright_part.ac1)]), filter(nil), rowset=16
      dop=1
  2 - output([obright_part.grp_id], [obright_part.row_id], [obright_part.row_hex], [obright_part.trx_grp], [obright_part.v1], [obright_part.v1_check], [obright_part.v2],
       [obright_part.v2_check], [obright_part.r1], [obright_part.r2], [obright_part.glike], [obright_part.c1], [obright_part.c2], [obright_part.c3], [obright_part.c4],
       [obright_part.c5], [obright_part.c6], [obright_part.c7], [obright_part.c8], [obright_part.c9], [obright_part.c10], [obright_part.v3], [obright_part.dec1],
       [obright_part.dec2], [obright_part.dec3], [obright_part.b1], [obright_part.d1], [obright_part.ac1]), filter(nil), rowset=16
      force partition granule
  3 - output([obright_part.grp_id], [obright_part.row_id], [obright_part.row_hex], [obright_part.trx_grp], [obright_part.v1], [obright_part.v1_check], [obright_part.v2],
       [obright_part.v2_check], [obright_part.r1], [obright_part.r2], [obright_part.glike], [obright_part.c1], [obright_part.c2], [obright_part.c3], [obright_part.c4],
       [obright_part.c5], [obright_part.c6], [obright_part.c7], [obright_part.c8], [obright_part.c9], [obright_part.c10], [obright_part.v3], [obright_part.dec1],
       [obright_part.dec2], [obright_part.dec3], [obright_part.b1], [obright_part.d1], [obright_part.ac1]), filter(nil), rowset=16
      access([obright_part.grp_id], [obright_part.row_id], [obright_part.row_hex], [obright_part.trx_grp], [obright_part.v1], [obright_part.v1_check], [obright_part.v2],
       [obright_part.v2_check], [obright_part.r1], [obright_part.r2], [obright_part.glike], [obright_part.c1], [obright_part.c2], [obright_part.c3], [obright_part.c4],
       [obright_part.c5], [obright_part.c6], [obright_part.c7], [obright_part.c8], [obright_part.c9], [obright_part.c10], [obright_part.v3], [obright_part.dec1],
       [obright_part.dec2], [obright_part.dec3], [obright_part.b1], [obright_part.d1], [obright_part.ac1]), partitions(p[0-1])
      is_index_back=false, is_global_index=false, 
      range_key([obright_part.grp_id], [obright_part.row_id], [obright_part.row_hex]), range(MIN,MIN,MIN ; MAX,MAX,MAX)always true
select `grp_id`,`row_id`,`row_hex`,`trx_grp`,`v1`,`v1_check`,`v2`,`v2_check`,`r1`,`r2`,`glike`,`c1`,`c2`,`c3`,`c4`,`c5`,`c6`,`c7`,`c8`,`c9`,`c10`,`v3`,`dec1`,`dec2`,`dec3`,`b1`,`d1`,`ac1` from obright_part;
+--------+--------+---------+---------+--------------------------------------------------------------------------------------------------------------------------------------------------------+-----------+------------------------------------------------------------------+------------+------+------+-------+------+------+------+------+------+------+------+------+------+------+------+----------+----------+----------+------+------+-----+
| grp_id | row_id | row_hex | trx_grp | v1                                                                                                                                                     | v1_check  | v2                                                               | v2_check   | r1   | r2   | glike | c1   | c2   | c3   | c4   | c5   | c6   | c7   | c8   | c9   | c10  | v3   | dec1     | dec2     | dec3     | b1   | d1   | ac1 |
+--------+--------+---------+---------+--------------------------------------------------------------------------------------------------------------------------------------------------------+-----------+------------------------------------------------------------------+------------+------+------+-------+------+------+------+------+------+------+------+------+------+------+------+----------+----------+----------+------+------+-----+
|      1 |      1 | a       |    2839 | mBCSj91aUlHxnmbrN7g5olC0UDUwnLlBUmR64JjDt2nbCdLGeuE3oN6QXxnyREPlxa91Gj8hBM0o8YWnudseTs7k8m92vcqlyiz67opx8iaDhuvIyUmSDYq7IIxEDYb2GDyDtdxoeT40uXSTrjGvMe | 472593373 | l4E4g7RtZVzQRRGasKc0zi3jBaT0bav53UQq3zVCwskHVNN3kZN7e5RrzMqgKKGb | 3046643075 |    1 |    1 | bb    |    1 |    2 |    3 |    4 |    5 |    6 |    7 |    8 |    9 |   10 | v3   | 104.8576 | 104.8576 | 1.100000 |    1 |    1 |   1 |
+--------+--------+---------+---------+--------------------------------------------------------------------------------------------------------------------------------------------------------+-----------+------------------------------------------------------------------+------------+------+------+-------+------+------+------+------+------+------+------+------+------+------+------+----------+----------+----------+------+------+-----+
drop table obright_part;

create table t1(a int primary key, b int) partition by hash(a) partitions 2;
create table t2(a int primary key, b int) partition by hash(a) partitions 2;
EXPLAIN BASIC insert into t1 values(1, 1);
Query Plan
============================
|ID|OPERATOR          |NAME|
----------------------------
|0 |DISTRIBUTED INSERT|    |
|1 |└─EXPRESSION      |    |
============================
Outputs & filters:
-------------------------------------
  0 - output(nil), filter(nil)
      columns([{t1: ({t1: (t1.a, t1.b)})}]), 
      column_values([column_conv(INT,PS:(11,0),NOT NULL,__values.a)], [column_conv(INT,PS:(11,0),NULL,__values.b)])
  1 - output([__values.a], [__values.b]), filter(nil)
      values({1, 1})
insert into t1 values(1, 1);
EXPLAIN BASIC insert into t2 values(1, 1);
Query Plan
============================
|ID|OPERATOR          |NAME|
----------------------------
|0 |DISTRIBUTED INSERT|    |
|1 |└─EXPRESSION      |    |
============================
Outputs & filters:
-------------------------------------
  0 - output(nil), filter(nil)
      columns([{t2: ({t2: (t2.a, t2.b)})}]), 
      column_values([column_conv(INT,PS:(11,0),NOT NULL,__values.a)], [column_conv(INT,PS:(11,0),NULL,__values.b)])
  1 - output([__values.a], [__values.b]), filter(nil)
      values({1, 1})
insert into t2 values(1, 1);
EXPLAIN BASIC update t1, t2 set t1.b=1, t2.b=2 where t1.a=t2.a and t1.a=1;
Query Plan
=======================================
|ID|OPERATOR                     |NAME|
---------------------------------------
|0 |DISTRIBUTED UPDATE           |    |
|1 |└─NESTED-LOOP JOIN CARTESIAN |    |
|2 |  ├─TABLE GET                |t1  |
|3 |  └─TABLE GET                |t2  |
=======================================
Outputs & filters:
-------------------------------------
  0 - output(nil), filter(nil)
      table_columns([{t1: ({t1: (t1.a, t1.b)})}], [{t2: ({t2: (t2.a, t2.b)})}]),
      update([t1.b=column_conv(INT,PS:(11,0),NULL,1)], [t2.b=column_conv(INT,PS:(11,0),NULL,2)])
  1 - output([t1.a], [t1.b], [t2.a], [t2.b]), filter(nil), rowset=16
      conds(nil), nl_params_(nil), use_batch=false
  2 - output([t1.a], [t1.b]), filter(nil), rowset=16
      access([t1.a], [t1.b]), partitions(p1)
      is_index_back=false, is_global_index=false, 
      range_key([t1.a]), range[1 ; 1], 
      range_cond([t1.a = 1])
  3 - output([t2.a], [t2.b]), filter(nil), rowset=16
      access([t2.a], [t2.b]), partitions(p1)
      is_index_back=false, is_global_index=false, 
      range_key([t2.a]), range[1 ; 1], 
      range_cond([1 = t2.a])
update t1, t2 set t1.b=1, t2.b=2 where t1.a=t2.a and t1.a=1;
EXPLAIN BASIC select * from t1;
Query Plan
=======================================
|ID|OPERATOR                 |NAME    |
---------------------------------------
|0 |PX COORDINATOR           |        |
|1 |└─EXCHANGE OUT DISTR     |:EX10000|
|2 |  └─PX PARTITION ITERATOR|        |
|3 |    └─TABLE FULL SCAN    |t1      |
=======================================
Outputs & filters:
-------------------------------------
  0 - output([INTERNAL_FUNCTION(t1.a, t1.b)]), filter(nil), rowset=16
  1 - output([INTERNAL_FUNCTION(t1.a, t1.b)]), filter(nil), rowset=16
      dop=1
  2 - output([t1.a], [t1.b]), filter(nil), rowset=16
      force partition granule
  3 - output([t1.a], [t1.b]), filter(nil), rowset=16
      access([t1.a], [t1.b]), partitions(p[0-1])
      is_index_back=false, is_global_index=false, 
      range_key([t1.a]), range(MIN ; MAX)always true
select * from t1;
+---+------+
| a | b    |
+---+------+
| 1 |    1 |
+---+------+
EXPLAIN BASIC select * from t2;
Query Plan
=======================================
|ID|OPERATOR                 |NAME    |
---------------------------------------
|0 |PX COORDINATOR           |        |
|1 |└─EXCHANGE OUT DISTR     |:EX10000|
|2 |  └─PX PARTITION ITERATOR|        |
|3 |    └─TABLE FULL SCAN    |t2      |
=======================================
Outputs & filters:
-------------------------------------
  0 - output([INTERNAL_FUNCTION(t2.a, t2.b)]), filter(nil), rowset=16
  1 - output([INTERNAL_FUNCTION(t2.a, t2.b)]), filter(nil), rowset=16
      dop=1
  2 - output([t2.a], [t2.b]), filter(nil), rowset=16
      force partition granule
  3 - output([t2.a], [t2.b]), filter(nil), rowset=16
      access([t2.a], [t2.b]), partitions(p[0-1])
      is_index_back=false, is_global_index=false, 
      range_key([t2.a]), range(MIN ; MAX)always true
select * from t2;
+---+------+
| a | b    |
+---+------+
| 1 |    2 |
+---+------+
EXPLAIN BASIC update t1, t2 set t1.a=1, t2.a=2 where t1.a=t2.a and t1.a=1;
Query Plan
=======================================
|ID|OPERATOR                     |NAME|
---------------------------------------
|0 |DISTRIBUTED UPDATE           |    |
|1 |└─NESTED-LOOP JOIN CARTESIAN |    |
|2 |  ├─TABLE GET                |t1  |
|3 |  └─TABLE GET                |t2  |
=======================================
Outputs & filters:
-------------------------------------
  0 - output(nil), filter(nil)
      table_columns([{t1: ({t1: (t1.a, t1.b)})}], [{t2: ({t2: (t2.a, t2.b)})}]),
      update([t1.a=column_conv(INT,PS:(11,0),NOT NULL,1)], [t2.a=column_conv(INT,PS:(11,0),NOT NULL,2)])
  1 - output([t1.a], [t1.b], [t2.a], [t2.b]), filter(nil), rowset=16
      conds(nil), nl_params_(nil), use_batch=false
  2 - output([t1.a], [t1.b]), filter(nil), rowset=16
      access([t1.a], [t1.b]), partitions(p1)
      is_index_back=false, is_global_index=false, 
      range_key([t1.a]), range[1 ; 1], 
      range_cond([t1.a = 1])
  3 - output([t2.a], [t2.b]), filter(nil), rowset=16
      access([t2.a], [t2.b]), partitions(p1)
      is_index_back=false, is_global_index=false, 
      range_key([t2.a]), range[1 ; 1], 
      range_cond([1 = t2.a])
update t1, t2 set t1.a=1, t2.a=2 where t1.a=t2.a and t1.a=1;
EXPLAIN BASIC select * from t1;
Query Plan
=======================================
|ID|OPERATOR                 |NAME    |
---------------------------------------
|0 |PX COORDINATOR           |        |
|1 |└─EXCHANGE OUT DISTR     |:EX10000|
|2 |  └─PX PARTITION ITERATOR|        |
|3 |    └─TABLE FULL SCAN    |t1      |
=======================================
Outputs & filters:
-------------------------------------
  0 - output([INTERNAL_FUNCTION(t1.a, t1.b)]), filter(nil), rowset=16
  1 - output([INTERNAL_FUNCTION(t1.a, t1.b)]), filter(nil), rowset=16
      dop=1
  2 - output([t1.a], [t1.b]), filter(nil), rowset=16
      force partition granule
  3 - output([t1.a], [t1.b]), filter(nil), rowset=16
      access([t1.a], [t1.b]), partitions(p[0-1])
      is_index_back=false, is_global_index=false, 
      range_key([t1.a]), range(MIN ; MAX)always true
select * from t1;
+---+------+
| a | b    |
+---+------+
| 1 |    1 |
+---+------+
EXPLAIN BASIC select * from t2;
Query Plan
=======================================
|ID|OPERATOR                 |NAME    |
---------------------------------------
|0 |PX COORDINATOR           |        |
|1 |└─EXCHANGE OUT DISTR     |:EX10000|
|2 |  └─PX PARTITION ITERATOR|        |
|3 |    └─TABLE FULL SCAN    |t2      |
=======================================
Outputs & filters:
-------------------------------------
  0 - output([INTERNAL_FUNCTION(t2.a, t2.b)]), filter(nil), rowset=16
  1 - output([INTERNAL_FUNCTION(t2.a, t2.b)]), filter(nil), rowset=16
      dop=1
  2 - output([t2.a], [t2.b]), filter(nil), rowset=16
      force partition granule
  3 - output([t2.a], [t2.b]), filter(nil), rowset=16
      access([t2.a], [t2.b]), partitions(p[0-1])
      is_index_back=false, is_global_index=false, 
      range_key([t2.a]), range(MIN ; MAX)always true
select * from t2;
+---+------+
| a | b    |
+---+------+
| 2 |    2 |
+---+------+
EXPLAIN BASIC delete t1, t2 from t1, t2;
Query Plan
=============================================
|ID|OPERATOR                       |NAME    |
---------------------------------------------
|0 |DISTRIBUTED DELETE             |        |
|1 |└─NESTED-LOOP JOIN CARTESIAN   |        |
|2 |  ├─PX COORDINATOR             |        |
|3 |  │ └─EXCHANGE OUT DISTR       |:EX10000|
|4 |  │   └─PX PARTITION ITERATOR  |        |
|5 |  │     └─TABLE FULL SCAN      |t1      |
|6 |  └─MATERIAL                   |        |
|7 |    └─PX COORDINATOR           |        |
|8 |      └─EXCHANGE OUT DISTR     |:EX20000|
|9 |        └─PX PARTITION ITERATOR|        |
|10|          └─TABLE FULL SCAN    |t2      |
=============================================
Outputs & filters:
-------------------------------------
  0 - output(nil), filter(nil)
      table_columns([{t1: ({t1: (t1.a, t1.b)}), hash_distinct}], [{t2: ({t2: (t2.a, t2.b)}), hash_distinct}])
  1 - output([t1.a], [t1.b], [t2.a], [t2.b]), filter(nil), rowset=16
      conds(nil), nl_params_(nil), use_batch=false
  2 - output([t1.a], [t1.b]), filter(nil), rowset=16
  3 - output([t1.a], [t1.b]), filter(nil), rowset=16
      dop=1
  4 - output([t1.a], [t1.b]), filter(nil), rowset=16
      force partition granule
  5 - output([t1.a], [t1.b]), filter(nil), rowset=16
      access([t1.a], [t1.b]), partitions(p[0-1])
      is_index_back=false, is_global_index=false, 
      range_key([t1.a]), range(MIN ; MAX)always true
  6 - output([t2.a], [t2.b]), filter(nil), rowset=16
  7 - output([t2.a], [t2.b]), filter(nil), rowset=16
  8 - output([t2.a], [t2.b]), filter(nil), rowset=16
      dop=1
  9 - output([t2.a], [t2.b]), filter(nil), rowset=16
      force partition granule
 10 - output([t2.a], [t2.b]), filter(nil), rowset=16
      access([t2.a], [t2.b]), partitions(p[0-1])
      is_index_back=false, is_global_index=false, 
      range_key([t2.a]), range(MIN ; MAX)always true
delete t1, t2 from t1, t2;
EXPLAIN BASIC insert into t1 values(1, 1);
Query Plan
============================
|ID|OPERATOR          |NAME|
----------------------------
|0 |DISTRIBUTED INSERT|    |
|1 |└─EXPRESSION      |    |
============================
Outputs & filters:
-------------------------------------
  0 - output(nil), filter(nil)
      columns([{t1: ({t1: (t1.a, t1.b)})}]), 
      column_values([column_conv(INT,PS:(11,0),NOT NULL,__values.a)], [column_conv(INT,PS:(11,0),NULL,__values.b)])
  1 - output([__values.a], [__values.b]), filter(nil)
      values({1, 1})
insert into t1 values(1, 1);
EXPLAIN BASIC insert into t2 values(1, 1);
Query Plan
============================
|ID|OPERATOR          |NAME|
----------------------------
|0 |DISTRIBUTED INSERT|    |
|1 |└─EXPRESSION      |    |
============================
Outputs & filters:
-------------------------------------
  0 - output(nil), filter(nil)
      columns([{t2: ({t2: (t2.a, t2.b)})}]), 
      column_values([column_conv(INT,PS:(11,0),NOT NULL,__values.a)], [column_conv(INT,PS:(11,0),NULL,__values.b)])
  1 - output([__values.a], [__values.b]), filter(nil)
      values({1, 1})
insert into t2 values(1, 1);
EXPLAIN BASIC update t1, t2 set t1.b=2, t2.b=1 where t1.a=t2.a and t1.a=1;
Query Plan
=======================================
|ID|OPERATOR                     |NAME|
---------------------------------------
|0 |DISTRIBUTED UPDATE           |    |
|1 |└─NESTED-LOOP JOIN CARTESIAN |    |
|2 |  ├─TABLE GET                |t1  |
|3 |  └─TABLE GET                |t2  |
=======================================
Outputs & filters:
-------------------------------------
  0 - output(nil), filter(nil)
      table_columns([{t1: ({t1: (t1.a, t1.b)})}], [{t2: ({t2: (t2.a, t2.b)})}]),
      update([t1.b=column_conv(INT,PS:(11,0),NULL,2)], [t2.b=column_conv(INT,PS:(11,0),NULL,1)])
  1 - output([t1.a], [t1.b], [t2.a], [t2.b]), filter(nil), rowset=16
      conds(nil), nl_params_(nil), use_batch=false
  2 - output([t1.a], [t1.b]), filter(nil), rowset=16
      access([t1.a], [t1.b]), partitions(p1)
      is_index_back=false, is_global_index=false, 
      range_key([t1.a]), range[1 ; 1], 
      range_cond([t1.a = 1])
  3 - output([t2.a], [t2.b]), filter(nil), rowset=16
      access([t2.a], [t2.b]), partitions(p1)
      is_index_back=false, is_global_index=false, 
      range_key([t2.a]), range[1 ; 1], 
      range_cond([1 = t2.a])
update t1, t2 set t1.b=2, t2.b=1 where t1.a=t2.a and t1.a=1;
EXPLAIN BASIC select * from t1;
Query Plan
=======================================
|ID|OPERATOR                 |NAME    |
---------------------------------------
|0 |PX COORDINATOR           |        |
|1 |└─EXCHANGE OUT DISTR     |:EX10000|
|2 |  └─PX PARTITION ITERATOR|        |
|3 |    └─TABLE FULL SCAN    |t1      |
=======================================
Outputs & filters:
-------------------------------------
  0 - output([INTERNAL_FUNCTION(t1.a, t1.b)]), filter(nil), rowset=16
  1 - output([INTERNAL_FUNCTION(t1.a, t1.b)]), filter(nil), rowset=16
      dop=1
  2 - output([t1.a], [t1.b]), filter(nil), rowset=16
      force partition granule
  3 - output([t1.a], [t1.b]), filter(nil), rowset=16
      access([t1.a], [t1.b]), partitions(p[0-1])
      is_index_back=false, is_global_index=false, 
      range_key([t1.a]), range(MIN ; MAX)always true
select * from t1;
+---+------+
| a | b    |
+---+------+
| 1 |    2 |
+---+------+
EXPLAIN BASIC select * from t2;
Query Plan
=======================================
|ID|OPERATOR                 |NAME    |
---------------------------------------
|0 |PX COORDINATOR           |        |
|1 |└─EXCHANGE OUT DISTR     |:EX10000|
|2 |  └─PX PARTITION ITERATOR|        |
|3 |    └─TABLE FULL SCAN    |t2      |
=======================================
Outputs & filters:
-------------------------------------
  0 - output([INTERNAL_FUNCTION(t2.a, t2.b)]), filter(nil), rowset=16
  1 - output([INTERNAL_FUNCTION(t2.a, t2.b)]), filter(nil), rowset=16
      dop=1
  2 - output([t2.a], [t2.b]), filter(nil), rowset=16
      force partition granule
  3 - output([t2.a], [t2.b]), filter(nil), rowset=16
      access([t2.a], [t2.b]), partitions(p[0-1])
      is_index_back=false, is_global_index=false, 
      range_key([t2.a]), range(MIN ; MAX)always true
select * from t2;
+---+------+
| a | b    |
+---+------+
| 1 |    1 |
+---+------+
EXPLAIN BASIC update t1, t2 set t1.a=2, t2.a=1 where t1.a=t2.a and t1.a=1;
Query Plan
=======================================
|ID|OPERATOR                     |NAME|
---------------------------------------
|0 |DISTRIBUTED UPDATE           |    |
|1 |└─NESTED-LOOP JOIN CARTESIAN |    |
|2 |  ├─TABLE GET                |t1  |
|3 |  └─TABLE GET                |t2  |
=======================================
Outputs & filters:
-------------------------------------
  0 - output(nil), filter(nil)
      table_columns([{t1: ({t1: (t1.a, t1.b)})}], [{t2: ({t2: (t2.a, t2.b)})}]),
      update([t1.a=column_conv(INT,PS:(11,0),NOT NULL,2)], [t2.a=column_conv(INT,PS:(11,0),NOT NULL,1)])
  1 - output([t1.a], [t1.b], [t2.a], [t2.b]), filter(nil), rowset=16
      conds(nil), nl_params_(nil), use_batch=false
  2 - output([t1.a], [t1.b]), filter(nil), rowset=16
      access([t1.a], [t1.b]), partitions(p1)
      is_index_back=false, is_global_index=false, 
      range_key([t1.a]), range[1 ; 1], 
      range_cond([t1.a = 1])
  3 - output([t2.a], [t2.b]), filter(nil), rowset=16
      access([t2.a], [t2.b]), partitions(p1)
      is_index_back=false, is_global_index=false, 
      range_key([t2.a]), range[1 ; 1], 
      range_cond([1 = t2.a])
update t1, t2 set t1.a=2, t2.a=1 where t1.a=t2.a and t1.a=1;
EXPLAIN BASIC select * from t1;
Query Plan
=======================================
|ID|OPERATOR                 |NAME    |
---------------------------------------
|0 |PX COORDINATOR           |        |
|1 |└─EXCHANGE OUT DISTR     |:EX10000|
|2 |  └─PX PARTITION ITERATOR|        |
|3 |    └─TABLE FULL SCAN    |t1      |
=======================================
Outputs & filters:
-------------------------------------
  0 - output([INTERNAL_FUNCTION(t1.a, t1.b)]), filter(nil), rowset=16
  1 - output([INTERNAL_FUNCTION(t1.a, t1.b)]), filter(nil), rowset=16
      dop=1
  2 - output([t1.a], [t1.b]), filter(nil), rowset=16
      force partition granule
  3 - output([t1.a], [t1.b]), filter(nil), rowset=16
      access([t1.a], [t1.b]), partitions(p[0-1])
      is_index_back=false, is_global_index=false, 
      range_key([t1.a]), range(MIN ; MAX)always true
select * from t1;
+---+------+
| a | b    |
+---+------+
| 2 |    2 |
+---+------+
EXPLAIN BASIC select * from t2;
Query Plan
=======================================
|ID|OPERATOR                 |NAME    |
---------------------------------------
|0 |PX COORDINATOR           |        |
|1 |└─EXCHANGE OUT DISTR     |:EX10000|
|2 |  └─PX PARTITION ITERATOR|        |
|3 |    └─TABLE FULL SCAN    |t2      |
=======================================
Outputs & filters:
-------------------------------------
  0 - output([INTERNAL_FUNCTION(t2.a, t2.b)]), filter(nil), rowset=16
  1 - output([INTERNAL_FUNCTION(t2.a, t2.b)]), filter(nil), rowset=16
      dop=1
  2 - output([t2.a], [t2.b]), filter(nil), rowset=16
      force partition granule
  3 - output([t2.a], [t2.b]), filter(nil), rowset=16
      access([t2.a], [t2.b]), partitions(p[0-1])
      is_index_back=false, is_global_index=false, 
      range_key([t2.a]), range(MIN ; MAX)always true
select * from t2;
+---+------+
| a | b    |
+---+------+
| 1 |    1 |
+---+------+
EXPLAIN BASIC delete t1, t2 from t1, t2;
Query Plan
=============================================
|ID|OPERATOR                       |NAME    |
---------------------------------------------
|0 |DISTRIBUTED DELETE             |        |
|1 |└─NESTED-LOOP JOIN CARTESIAN   |        |
|2 |  ├─PX COORDINATOR             |        |
|3 |  │ └─EXCHANGE OUT DISTR       |:EX10000|
|4 |  │   └─PX PARTITION ITERATOR  |        |
|5 |  │     └─TABLE FULL SCAN      |t1      |
|6 |  └─MATERIAL                   |        |
|7 |    └─PX COORDINATOR           |        |
|8 |      └─EXCHANGE OUT DISTR     |:EX20000|
|9 |        └─PX PARTITION ITERATOR|        |
|10|          └─TABLE FULL SCAN    |t2      |
=============================================
Outputs & filters:
-------------------------------------
  0 - output(nil), filter(nil)
      table_columns([{t1: ({t1: (t1.a, t1.b)}), hash_distinct}], [{t2: ({t2: (t2.a, t2.b)}), hash_distinct}])
  1 - output([t1.a], [t1.b], [t2.a], [t2.b]), filter(nil), rowset=16
      conds(nil), nl_params_(nil), use_batch=false
  2 - output([t1.a], [t1.b]), filter(nil), rowset=16
  3 - output([t1.a], [t1.b]), filter(nil), rowset=16
      dop=1
  4 - output([t1.a], [t1.b]), filter(nil), rowset=16
      force partition granule
  5 - output([t1.a], [t1.b]), filter(nil), rowset=16
      access([t1.a], [t1.b]), partitions(p[0-1])
      is_index_back=false, is_global_index=false, 
      range_key([t1.a]), range(MIN ; MAX)always true
  6 - output([t2.a], [t2.b]), filter(nil), rowset=16
  7 - output([t2.a], [t2.b]), filter(nil), rowset=16
  8 - output([t2.a], [t2.b]), filter(nil), rowset=16
      dop=1
  9 - output([t2.a], [t2.b]), filter(nil), rowset=16
      force partition granule
 10 - output([t2.a], [t2.b]), filter(nil), rowset=16
      access([t2.a], [t2.b]), partitions(p[0-1])
      is_index_back=false, is_global_index=false, 
      range_key([t2.a]), range(MIN ; MAX)always true
delete t1, t2 from t1, t2;
EXPLAIN BASIC insert into t1 values(1, 1);
Query Plan
============================
|ID|OPERATOR          |NAME|
----------------------------
|0 |DISTRIBUTED INSERT|    |
|1 |└─EXPRESSION      |    |
============================
Outputs & filters:
-------------------------------------
  0 - output(nil), filter(nil)
      columns([{t1: ({t1: (t1.a, t1.b)})}]), 
      column_values([column_conv(INT,PS:(11,0),NOT NULL,__values.a)], [column_conv(INT,PS:(11,0),NULL,__values.b)])
  1 - output([__values.a], [__values.b]), filter(nil)
      values({1, 1})
insert into t1 values(1, 1);
EXPLAIN BASIC insert into t2 values(1, 1);
Query Plan
============================
|ID|OPERATOR          |NAME|
----------------------------
|0 |DISTRIBUTED INSERT|    |
|1 |└─EXPRESSION      |    |
============================
Outputs & filters:
-------------------------------------
  0 - output(nil), filter(nil)
      columns([{t2: ({t2: (t2.a, t2.b)})}]), 
      column_values([column_conv(INT,PS:(11,0),NOT NULL,__values.a)], [column_conv(INT,PS:(11,0),NULL,__values.b)])
  1 - output([__values.a], [__values.b]), filter(nil)
      values({1, 1})
insert into t2 values(1, 1);
EXPLAIN BASIC update t1, t2 set t1.b=2, t2.b=2 where t1.a=t2.a and t1.a=1;
Query Plan
=======================================
|ID|OPERATOR                     |NAME|
---------------------------------------
|0 |DISTRIBUTED UPDATE           |    |
|1 |└─NESTED-LOOP JOIN CARTESIAN |    |
|2 |  ├─TABLE GET                |t1  |
|3 |  └─TABLE GET                |t2  |
=======================================
Outputs & filters:
-------------------------------------
  0 - output(nil), filter(nil)
      table_columns([{t1: ({t1: (t1.a, t1.b)})}], [{t2: ({t2: (t2.a, t2.b)})}]),
      update([t1.b=column_conv(INT,PS:(11,0),NULL,2)], [t2.b=column_conv(INT,PS:(11,0),NULL,2)])
  1 - output([t1.a], [t1.b], [t2.a], [t2.b]), filter(nil), rowset=16
      conds(nil), nl_params_(nil), use_batch=false
  2 - output([t1.a], [t1.b]), filter(nil), rowset=16
      access([t1.a], [t1.b]), partitions(p1)
      is_index_back=false, is_global_index=false, 
      range_key([t1.a]), range[1 ; 1], 
      range_cond([t1.a = 1])
  3 - output([t2.a], [t2.b]), filter(nil), rowset=16
      access([t2.a], [t2.b]), partitions(p1)
      is_index_back=false, is_global_index=false, 
      range_key([t2.a]), range[1 ; 1], 
      range_cond([1 = t2.a])
update t1, t2 set t1.b=2, t2.b=2 where t1.a=t2.a and t1.a=1;
EXPLAIN BASIC select * from t1;
Query Plan
=======================================
|ID|OPERATOR                 |NAME    |
---------------------------------------
|0 |PX COORDINATOR           |        |
|1 |└─EXCHANGE OUT DISTR     |:EX10000|
|2 |  └─PX PARTITION ITERATOR|        |
|3 |    └─TABLE FULL SCAN    |t1      |
=======================================
Outputs & filters:
-------------------------------------
  0 - output([INTERNAL_FUNCTION(t1.a, t1.b)]), filter(nil), rowset=16
  1 - output([INTERNAL_FUNCTION(t1.a, t1.b)]), filter(nil), rowset=16
      dop=1
  2 - output([t1.a], [t1.b]), filter(nil), rowset=16
      force partition granule
  3 - output([t1.a], [t1.b]), filter(nil), rowset=16
      access([t1.a], [t1.b]), partitions(p[0-1])
      is_index_back=false, is_global_index=false, 
      range_key([t1.a]), range(MIN ; MAX)always true
select * from t1;
+---+------+
| a | b    |
+---+------+
| 1 |    2 |
+---+------+
EXPLAIN BASIC select * from t2;
Query Plan
=======================================
|ID|OPERATOR                 |NAME    |
---------------------------------------
|0 |PX COORDINATOR           |        |
|1 |└─EXCHANGE OUT DISTR     |:EX10000|
|2 |  └─PX PARTITION ITERATOR|        |
|3 |    └─TABLE FULL SCAN    |t2      |
=======================================
Outputs & filters:
-------------------------------------
  0 - output([INTERNAL_FUNCTION(t2.a, t2.b)]), filter(nil), rowset=16
  1 - output([INTERNAL_FUNCTION(t2.a, t2.b)]), filter(nil), rowset=16
      dop=1
  2 - output([t2.a], [t2.b]), filter(nil), rowset=16
      force partition granule
  3 - output([t2.a], [t2.b]), filter(nil), rowset=16
      access([t2.a], [t2.b]), partitions(p[0-1])
      is_index_back=false, is_global_index=false, 
      range_key([t2.a]), range(MIN ; MAX)always true
select * from t2;
+---+------+
| a | b    |
+---+------+
| 1 |    2 |
+---+------+
EXPLAIN BASIC update t1, t2 set t1.a=2, t2.a=2 where t1.a=t2.a and t1.a=1;
Query Plan
=======================================
|ID|OPERATOR                     |NAME|
---------------------------------------
|0 |DISTRIBUTED UPDATE           |    |
|1 |└─NESTED-LOOP JOIN CARTESIAN |    |
|2 |  ├─TABLE GET                |t1  |
|3 |  └─TABLE GET                |t2  |
=======================================
Outputs & filters:
-------------------------------------
  0 - output(nil), filter(nil)
      table_columns([{t1: ({t1: (t1.a, t1.b)})}], [{t2: ({t2: (t2.a, t2.b)})}]),
      update([t1.a=column_conv(INT,PS:(11,0),NOT NULL,2)], [t2.a=column_conv(INT,PS:(11,0),NOT NULL,2)])
  1 - output([t1.a], [t1.b], [t2.a], [t2.b]), filter(nil), rowset=16
      conds(nil), nl_params_(nil), use_batch=false
  2 - output([t1.a], [t1.b]), filter(nil), rowset=16
      access([t1.a], [t1.b]), partitions(p1)
      is_index_back=false, is_global_index=false, 
      range_key([t1.a]), range[1 ; 1], 
      range_cond([t1.a = 1])
  3 - output([t2.a], [t2.b]), filter(nil), rowset=16
      access([t2.a], [t2.b]), partitions(p1)
      is_index_back=false, is_global_index=false, 
      range_key([t2.a]), range[1 ; 1], 
      range_cond([1 = t2.a])
update t1, t2 set t1.a=2, t2.a=2 where t1.a=t2.a and t1.a=1;
EXPLAIN BASIC select * from t1;
Query Plan
=======================================
|ID|OPERATOR                 |NAME    |
---------------------------------------
|0 |PX COORDINATOR           |        |
|1 |└─EXCHANGE OUT DISTR     |:EX10000|
|2 |  └─PX PARTITION ITERATOR|        |
|3 |    └─TABLE FULL SCAN    |t1      |
=======================================
Outputs & filters:
-------------------------------------
  0 - output([INTERNAL_FUNCTION(t1.a, t1.b)]), filter(nil), rowset=16
  1 - output([INTERNAL_FUNCTION(t1.a, t1.b)]), filter(nil), rowset=16
      dop=1
  2 - output([t1.a], [t1.b]), filter(nil), rowset=16
      force partition granule
  3 - output([t1.a], [t1.b]), filter(nil), rowset=16
      access([t1.a], [t1.b]), partitions(p[0-1])
      is_index_back=false, is_global_index=false, 
      range_key([t1.a]), range(MIN ; MAX)always true
select * from t1;
+---+------+
| a | b    |
+---+------+
| 2 |    2 |
+---+------+
EXPLAIN BASIC select * from t2;
Query Plan
=======================================
|ID|OPERATOR                 |NAME    |
---------------------------------------
|0 |PX COORDINATOR           |        |
|1 |└─EXCHANGE OUT DISTR     |:EX10000|
|2 |  └─PX PARTITION ITERATOR|        |
|3 |    └─TABLE FULL SCAN    |t2      |
=======================================
Outputs & filters:
-------------------------------------
  0 - output([INTERNAL_FUNCTION(t2.a, t2.b)]), filter(nil), rowset=16
  1 - output([INTERNAL_FUNCTION(t2.a, t2.b)]), filter(nil), rowset=16
      dop=1
  2 - output([t2.a], [t2.b]), filter(nil), rowset=16
      force partition granule
  3 - output([t2.a], [t2.b]), filter(nil), rowset=16
      access([t2.a], [t2.b]), partitions(p[0-1])
      is_index_back=false, is_global_index=false, 
      range_key([t2.a]), range(MIN ; MAX)always true
select * from t2;
+---+------+
| a | b    |
+---+------+
| 2 |    2 |
+---+------+
drop table t1, t2;

create table t1(a int primary key, b int) partition by hash(a) partitions 1;
EXPLAIN BASIC insert into t1 values(1, 1) on duplicate key update a=2;
Query Plan
===============================
|ID|OPERATOR             |NAME|
-------------------------------
|0 |DISTRIBUTED INSERT_UP|    |
|1 |└─EXPRESSION         |    |
===============================
Outputs & filters:
-------------------------------------
  0 - output(nil), filter(nil)
      columns([{t1: ({t1: (t1.a, t1.b)})}]), 
      column_values([column_conv(INT,PS:(11,0),NOT NULL,__values.a)], [column_conv(INT,PS:(11,0),NULL,__values.b)]),
      update([t1.a=column_conv(INT,PS:(11,0),NOT NULL,2)])
  1 - output([__values.a], [__values.b]), filter(nil)
      values({1, 1})
insert into t1 values(1, 1) on duplicate key update a=2;
EXPLAIN BASIC insert into t1 values(1, 1) on duplicate key update a=2;
Query Plan
===============================
|ID|OPERATOR             |NAME|
-------------------------------
|0 |DISTRIBUTED INSERT_UP|    |
|1 |└─EXPRESSION         |    |
===============================
Outputs & filters:
-------------------------------------
  0 - output(nil), filter(nil)
      columns([{t1: ({t1: (t1.a, t1.b)})}]), 
      column_values([column_conv(INT,PS:(11,0),NOT NULL,__values.a)], [column_conv(INT,PS:(11,0),NULL,__values.b)]),
      update([t1.a=column_conv(INT,PS:(11,0),NOT NULL,2)])
  1 - output([__values.a], [__values.b]), filter(nil)
      values({1, 1})
insert into t1 values(1, 1) on duplicate key update a=2;
EXPLAIN BASIC select * from t1;
Query Plan
=========================
|ID|OPERATOR       |NAME|
-------------------------
|0 |TABLE FULL SCAN|t1  |
=========================
Outputs & filters:
-------------------------------------
  0 - output([t1.a], [t1.b]), filter(nil), rowset=16
      access([t1.a], [t1.b]), partitions(p0)
      is_index_back=false, is_global_index=false, 
      range_key([t1.a]), range(MIN ; MAX)always true
select * from t1;
+---+------+
| a | b    |
+---+------+
| 2 |    1 |
+---+------+
EXPLAIN BASIC select * from t1 where a=2;
Query Plan
===================
|ID|OPERATOR |NAME|
-------------------
|0 |TABLE GET|t1  |
===================
Outputs & filters:
-------------------------------------
  0 - output([t1.a], [t1.b]), filter(nil), rowset=16
      access([t1.a], [t1.b]), partitions(p0)
      is_index_back=false, is_global_index=false, 
      range_key([t1.a]), range[2 ; 2], 
      range_cond([t1.a = 2])
select * from t1 where a=2;
+---+------+
| a | b    |
+---+------+
| 2 |    1 |
+---+------+
EXPLAIN BASIC update t1 set a=3 where a=2;
Query Plan
=====================
|ID|OPERATOR   |NAME|
---------------------
|0 |UPDATE     |    |
|1 |└─TABLE GET|t1  |
=====================
Outputs & filters:
-------------------------------------
  0 - output(nil), filter(nil)
      table_columns([{t1: ({t1: (t1.a, t1.b)})}]),
      update([t1.a=column_conv(INT,PS:(11,0),NOT NULL,3)])
  1 - output([t1.a], [t1.b]), filter(nil), rowset=16
      access([t1.a], [t1.b]), partitions(p0)
      is_index_back=false, is_global_index=false, 
      range_key([t1.a]), range[2 ; 2], 
      range_cond([t1.a = 2])
update t1 set a=3 where a=2;
EXPLAIN BASIC select * from t1 where a=2;
Query Plan
===================
|ID|OPERATOR |NAME|
-------------------
|0 |TABLE GET|t1  |
===================
Outputs & filters:
-------------------------------------
  0 - output([t1.a], [t1.b]), filter(nil), rowset=16
      access([t1.a], [t1.b]), partitions(p0)
      is_index_back=false, is_global_index=false, 
      range_key([t1.a]), range[2 ; 2], 
      range_cond([t1.a = 2])
select * from t1 where a=2;
+---+------+
| a | b    |
+---+------+
+---+------+
EXPLAIN BASIC select * from t1 where a=3;
Query Plan
===================
|ID|OPERATOR |NAME|
-------------------
|0 |TABLE GET|t1  |
===================
Outputs & filters:
-------------------------------------
  0 - output([t1.a], [t1.b]), filter(nil), rowset=16
      access([t1.a], [t1.b]), partitions(p0)
      is_index_back=false, is_global_index=false, 
      range_key([t1.a]), range[3 ; 3], 
      range_cond([t1.a = 3])
select * from t1 where a=3;
+---+------+
| a | b    |
+---+------+
| 3 |    1 |
+---+------+
drop table t1;
