set ob_enable_index_direct_select=1;
use test;
drop table if exists t1;
set ob_enable_index_direct_select=1;
alter system set merger_check_interval = '10s' tenant sys;
alter system set merger_check_interval = '10s' tenant all_user;
alter system set merger_check_interval = '10s' tenant all_meta;
create table t1 (pk int primary key, key1 int, key2 int, v1 varchar(20));
create index i1 on t1(key1) storing(v1);
create index i2 on t1(key2) storing(pk);
insert into t1 values(1,1,1,'a'),(2,1,1,'b'),(3,2,2,'c'),(4,3,3,'d');
update t1 set pk=5 where key1=1;
ERROR 23000: Duplicate entry '5' for key 'PRIMARY'
update t1 set pk=6 where key1=2;
update t1 set pk=7 where key2=1;
ERROR 23000: Duplicate entry '7' for key 'PRIMARY'
update t1 set pk=9,v1='e' where key1=3;
pk	key1	v1
1	1	a
2	1	b
8	2	c
9	3	e
pk	key2
1	1
2	1
8	2
9	3
select * from t1 where pk<10;
pk	key1	key2	v1
1	1	1	a
2	1	1	b
8	2	2	c
9	3	3	e
replace into t1 values(11,11,11,'a'),(12,11,11,'b'),(13,12,12,'c'),(14,13,13,'d');
update t1 set pk=15 where key1>11 and key1<13;
update t1 set pk=16 where key1>=11 and key1<13;
ERROR 23000: Duplicate entry '16' for key 'PRIMARY'
update t1 set pk=17 where key2>11 and key2<13;
update t1 set pk=18 where key2>=11 and key2<13;
ERROR 23000: Duplicate entry '18' for key 'PRIMARY'
update t1 set pk=19,v1='e' where key1>11 and key1<13;
pk	key1	v1
1	1	a
2	1	b
8	2	c
9	3	e
11	11	a
12	11	b
19	12	e
14	13	d
pk	key2
1	1
2	1
8	2
9	3
11	11
12	11
19	12
14	13
select * from t1 where pk>10;
pk	key1	key2	v1
11	11	11	a
12	11	11	b
14	13	13	d
19	12	12	e
replace into t1 values(21,21,21,'a'),(22,21,21,'b'),(23,22,22,'c'),(24,23,23,'d');
update t1 set key1=25 where key1=21;
update t1 set key1=26 where key1=22;
update t1 set key1=26,v1='e' where key1=23;
update t1 set key1=25 where key1=26;
pk	key1	v1
1	1	a
2	1	b
8	2	c
9	3	e
11	11	a
12	11	b
19	12	e
14	13	d
21	25	a
22	25	b
23	25	c
24	25	e
pk	key2
1	1
2	1
8	2
9	3
11	11
12	11
19	12
14	13
21	21
22	21
23	22
24	23
select * from t1 where pk>20;
pk	key1	key2	v1
21	25	21	a
22	25	21	b
23	25	22	c
24	25	23	e
replace into t1 values(31,31,31,'a'),(32,31,31,'b'),(33,32,32,'c'),(34,33,33,'d');
update t1 set key1=35 where key1>31 and key1<33;
update t1 set key1=36 where key1>=31 and key1<33;
update t1 set key1=36,v1='e' where key1>=33 and key1<35;
update t1 set key1=35 where key1>35 and key1<37;
pk	key1	v1
1	1	a
2	1	b
8	2	c
9	3	e
11	11	a
12	11	b
19	12	e
14	13	d
21	25	a
22	25	b
23	25	c
24	25	e
31	35	a
32	35	b
33	35	c
34	35	e
pk	key2
1	1
2	1
8	2
9	3
11	11
12	11
19	12
14	13
21	21
22	21
23	22
24	23
31	31
32	31
33	32
34	33
select * from t1 where pk>30;
pk	key1	key2	v1
31	35	31	a
32	35	31	b
33	35	32	c
34	35	33	e
replace into t1 values(41,41,41,'a'),(42,41,41,'b'),(43,42,42,'c'),(44,43,43,'d');
update t1 set pk=45,key1=45 where key1=41;
ERROR 23000: Duplicate entry '45' for key 'PRIMARY'
update t1 set pk=46,key1=46 where key1=42;
update t1 set pk=47,key2=45 where key2=41;
ERROR 23000: Duplicate entry '47' for key 'PRIMARY'
update t1 set pk=48,key2=46 where key2=42;
pk	key1	v1
1	1	a
2	1	b
8	2	c
9	3	e
11	11	a
12	11	b
19	12	e
14	13	d
21	25	a
22	25	b
23	25	c
24	25	e
31	35	a
32	35	b
33	35	c
34	35	e
41	41	a
42	41	b
44	43	d
48	46	c
pk	key2
1	1
2	1
8	2
9	3
11	11
12	11
19	12
14	13
21	21
22	21
23	22
24	23
31	31
32	31
33	32
34	33
41	41
42	41
44	43
48	46
select * from t1 where pk>40;
pk	key1	key2	v1
41	41	41	a
42	41	41	b
44	43	43	d
48	46	46	c
replace into t1 values(51,51,51,'a'),(52,51,51,'b'),(53,52,52,'c'),(54,53,53,'d');
update t1 set pk=55,key1=55 where key1>=51 and key1<52;
ERROR 23000: Duplicate entry '55' for key 'PRIMARY'
update t1 set pk=56,key1=56 where key1>=51 and key1<53;
ERROR 23000: Duplicate entry '56' for key 'PRIMARY'
update t1 set pk=56,key1=56,v1='e' where key1>=53 and key1<55;
update t1 set pk=56,key1=55 where key1>55 and key1<57;
pk	key1	v1
1	1	a
2	1	b
8	2	c
9	3	e
11	11	a
12	11	b
19	12	e
14	13	d
21	25	a
22	25	b
23	25	c
24	25	e
31	35	a
32	35	b
33	35	c
34	35	e
41	41	a
42	41	b
44	43	d
48	46	c
51	51	a
52	51	b
53	52	c
56	55	e
pk	key2
1	1
2	1
8	2
9	3
11	11
12	11
19	12
14	13
21	21
22	21
23	22
24	23
31	31
32	31
33	32
34	33
41	41
42	41
44	43
48	46
51	51
52	51
53	52
56	53
select * from t1 where pk>50;
pk	key1	key2	v1
51	51	51	a
52	51	51	b
53	52	52	c
56	55	53	e
replace into t1 values(61,61,61,'a'),(62,61,61,'b'),(63,62,62,'c'),(64,63,63,'d');
update t1 set key1=62 where pk=62;
update t1 set key1=61 where pk=62;
update t1 set key2=62,v1='b' where pk=61;
pk	key1	v1
1	1	a
2	1	b
8	2	c
9	3	e
11	11	a
12	11	b
19	12	e
14	13	d
21	25	a
22	25	b
23	25	c
24	25	e
31	35	a
32	35	b
33	35	c
34	35	e
41	41	a
42	41	b
44	43	d
48	46	c
51	51	a
52	51	b
53	52	c
56	55	e
61	61	b
62	61	b
63	62	c
64	63	d
pk	key2
1	1
2	1
8	2
9	3
11	11
12	11
19	12
14	13
21	21
22	21
23	22
24	23
31	31
32	31
33	32
34	33
41	41
42	41
44	43
48	46
51	51
52	51
53	52
56	53
62	61
61	62
63	62
64	63
select * from t1 where pk>60;
pk	key1	key2	v1
61	61	62	b
62	61	61	b
63	62	62	c
64	63	63	d
replace into t1 values(71,71,71,'a'),(72,71,71,'b'),(73,72,72,'c'),(74,73,73,'d');
update t1 set key1=62 where pk>=61 and pk<63;
update t1 set key1=63 where pk>62 and pk<64;
update t1 set key1=65 where pk>=64 and pk<66;
update t1 set key1=66,v1='e' where pk>=64 and pk<66;
pk	key1	v1
1	1	a
2	1	b
8	2	c
9	3	e
11	11	a
12	11	b
19	12	e
14	13	d
21	25	a
22	25	b
23	25	c
24	25	e
31	35	a
32	35	b
33	35	c
34	35	e
41	41	a
42	41	b
44	43	d
48	46	c
51	51	a
52	51	b
53	52	c
56	55	e
61	62	b
62	62	b
63	63	c
64	66	e
71	71	a
72	71	b
73	72	c
74	73	d
pk	key2
1	1
2	1
8	2
9	3
11	11
12	11
19	12
14	13
21	21
22	21
23	22
24	23
31	31
32	31
33	32
34	33
41	41
42	41
44	43
48	46
51	51
52	51
53	52
56	53
62	61
61	62
63	62
64	63
71	71
72	71
73	72
74	73
select * from t1 where pk>70;
pk	key1	key2	v1
71	71	71	a
72	71	71	b
73	72	72	c
74	73	73	d
replace into t1 values(81,81,81,'a'),(82,81,81,'b'),(83,82,82,'c'),(84,83,83,'d');
update t1 set pk=85,key1=82 where pk=82;
update t1 set pk=82,key1=81 where pk=85;
update t1 set pk=85,key2=83 where pk=84;
pk	key1	v1
1	1	a
2	1	b
8	2	c
9	3	e
11	11	a
12	11	b
19	12	e
14	13	d
21	25	a
22	25	b
23	25	c
24	25	e
31	35	a
32	35	b
33	35	c
34	35	e
41	41	a
42	41	b
44	43	d
48	46	c
51	51	a
52	51	b
53	52	c
56	55	e
61	62	b
62	62	b
63	63	c
64	66	e
71	71	a
72	71	b
73	72	c
74	73	d
81	81	a
82	81	b
83	82	c
85	83	d
pk	key2
1	1
2	1
8	2
9	3
11	11
12	11
19	12
14	13
21	21
22	21
23	22
24	23
31	31
32	31
33	32
34	33
41	41
42	41
44	43
48	46
51	51
52	51
53	52
56	53
62	61
61	62
63	62
64	63
71	71
72	71
73	72
74	73
81	81
82	81
83	82
85	83
select * from t1 where pk>80;
pk	key1	key2	v1
81	81	81	a
82	81	81	b
83	82	82	c
85	83	83	d
replace into t1 values(91,91,91,'a'),(92,91,91,'b'),(93,92,92,'c'),(94,93,93,'d');
update t1 set pk=95,key1=94 where pk>=94 and pk<96;
update t1 set pk=96,key1=91 where pk>91 and pk<94;
ERROR 23000: Duplicate entry '96' for key 'PRIMARY'
update t1 set pk=97,key1=97 where pk>=91 and pk<93;
ERROR 23000: Duplicate entry '97' for key 'PRIMARY'
pk	key1	v1
1	1	a
2	1	b
8	2	c
9	3	e
11	11	a
12	11	b
19	12	e
14	13	d
21	25	a
22	25	b
23	25	c
24	25	e
31	35	a
32	35	b
33	35	c
34	35	e
41	41	a
42	41	b
44	43	d
48	46	c
51	51	a
52	51	b
53	52	c
56	55	e
61	62	b
62	62	b
63	63	c
64	66	e
71	71	a
72	71	b
73	72	c
74	73	d
81	81	a
82	81	b
83	82	c
85	83	d
91	91	a
92	91	b
93	92	c
95	94	d
pk	key2
1	1
2	1
8	2
9	3
11	11
12	11
19	12
14	13
21	21
22	21
23	22
24	23
31	31
32	31
33	32
34	33
41	41
42	41
44	43
48	46
51	51
52	51
53	52
56	53
62	61
61	62
63	62
64	63
71	71
72	71
73	72
74	73
81	81
82	81
83	82
85	83
91	91
92	91
93	92
95	93
select * from t1 where pk>90;
pk	key1	key2	v1
91	91	91	a
92	91	91	b
93	92	92	c
95	94	93	d
delete from t1 where pk<100;
insert into t1 values(1,1,1,'a'),(2,1,1,'b'),(3,2,2,'c'),(4,3,3,'d');
set autocommit=0;
update t1 set pk=5,key1=5 where pk=1;
select * from t1;
pk	key1	key2	v1
2	1	1	b
3	2	2	c
4	3	3	d
5	5	1	a
update t1 set v1='aa' where pk=5;
commit;
select * from t1;
pk	key1	key2	v1
2	1	1	b
3	2	2	c
4	3	3	d
5	5	1	aa
pk	key1	v1
2	1	b
3	2	c
4	3	d
5	5	aa
pk	key2
2	1
5	1
3	2
4	3
delete from t1 where pk<100;
insert into t1 values(1,1,1,'a'),(2,1,1,'b'),(3,2,2,'c'),(4,3,3,'d');
set autocommit=0;
update t1 set pk=5,key1=5 where pk=1;
select * from t1;
pk	key1	key2	v1
2	1	1	b
3	2	2	c
4	3	3	d
5	5	1	a
update t1 set v1='aa' where pk=5;
rollback;
select * from t1;
pk	key1	key2	v1
2	1	1	b
3	2	2	c
4	3	3	d
5	5	1	aa
pk	key1	v1
2	1	b
3	2	c
4	3	d
5	5	aa
pk	key2
2	1
5	1
3	2
4	3
delete from t1 where pk<100;
insert into t1 values(1,1,1,'a'),(2,1,1,'b'),(3,2,2,'c'),(4,3,3,'d');
set autocommit=0;
update t1 set pk=5,key1=5 where pk=1;
set autocommit=0;
update t1 set v1='aaa' where pk=1;
commit;
update t1 set v1='aaa' where pk=5;
commit;
select * from t1;
pk	key1	key2	v1
2	1	1	b
3	2	2	c
4	3	3	d
5	5	1	aaa
pk	key1	v1
2	1	b
3	2	c
4	3	d
5	5	aaa
pk	key2
2	1
5	1
3	2
4	3
delete from t1 where pk<100;
insert into t1 values(1,1,1,'a'),(2,1,1,'b'),(3,2,2,'c'),(4,3,3,'d');
commit;
set autocommit=0;
update t1 set pk=5,key1=5 where pk=1;
set autocommit=0;
update t1 set v1='aaa' where pk=1;
rollback;
update t1 set v1='aaa' where pk=1;
commit;
select * from t1;
pk	key1	key2	v1
1	1	1	aaa
2	1	1	b
3	2	2	c
4	3	3	d
pk	key1	v1
1	1	aaa
2	1	b
3	2	c
4	3	d
pk	key2
1	1
2	1
3	2
4	3
set ob_enable_index_direct_select=0;
