result_format: 4


drop table if exists t_my_loaddata_test;
create table t_my_loaddata_test (
c_TINYINT TINYINT,
c_SMALLINT SMALLINT,
c_MEDIUMINT MEDIUMINT,
c_INT INT,
c_BIGINT BIGINT,
c_FLOAT FLOAT,
c_DOUBLE DOUBLE,
c_DECIMAL DECIMAL,
c_DATE DATE,
c_TIME TIME,
c_YEAR YEAR,
c_DATETIME DATETIME,
c_TIMESTAMP TIMESTAMP,
c_CHAR CHAR(10),
c_VARCHAR VARCHAR(10)
);

delete from t_my_loaddata_test;

load data
infile 'data_for_mysqltest_loaddata/empty_field.dat'
ignore
into table t_my_loaddata_test
fields terminated by '|';

select * from t_my_loaddata_test order by 1;
+-----------+------------+-------------+-------+----------+---------+----------+-----------+------------+----------+--------+---------------------+---------------------+--------+-----------+
| c_TINYINT | c_SMALLINT | c_MEDIUMINT | c_INT | c_BIGINT | c_FLOAT | c_DOUBLE | c_DECIMAL | c_DATE     | c_TIME   | c_YEAR | c_DATETIME          | c_TIMESTAMP         | c_CHAR | c_VARCHAR |
+-----------+------------+-------------+-------+----------+---------+----------+-----------+------------+----------+--------+---------------------+---------------------+--------+-----------+
|         0 |          0 |           0 |     0 |        0 |       0 |        0 |         0 | 0000-00-00 | 00:00:00 |   0000 | 0000-00-00 00:00:00 | 0000-00-00 00:00:00 |        | NULL      |
+-----------+------------+-------------+-------+----------+---------+----------+-----------+------------+----------+--------+---------------------+---------------------+--------+-----------+

drop table t_my_loaddata_test;

create table t_my_loaddata_test(c1 varchar(100), c2 varchar(100));
load data
infile 'data_for_mysqltest_loaddata/null_field1.dat'
into table t_my_loaddata_test
fields terminated by ',';
select * from t_my_loaddata_test order by 1;
+--------+--------+
| c1     | c2     |
+--------+--------+
| "N"    | "N"    |
| "N"    | "N"    |
| "N"    | N      |
| "N"    | NULL   |
| "NULL" | "NULL" |
| 1      | N      |
| 1      | NULL   |
| 1      | NULL   |
| N      | "N"    |
| N      | 1      |
| N      | N      |
| NULL   | "N"    |
| NULL   | 1      |
| NULL   | 1      |
| NULL   | NULL   |
| NULL   | NULL   |
+--------+--------+
delete from t_my_loaddata_test;
load data
infile 'data_for_mysqltest_loaddata/null_field1.dat'
into table t_my_loaddata_test
fields terminated by ',' enclosed by '"';
select * from t_my_loaddata_test order by 1;
+------+------+
| c1   | c2   |
+------+------+
| 1    | N    |
| 1    | NULL |
| 1    | NULL |
| N    | 1    |
| N    | N    |
| N    | N    |
| N    | N    |
| N    | N    |
| N    | N    |
| N    | NULL |
| NULL | 1    |
| NULL | 1    |
| NULL | N    |
| NULL | NULL |
| NULL | NULL |
| NULL | NULL |
+------+------+

drop table t_my_loaddata_test;


drop table if exists web_returns;
CREATE TABLE `web_returns` (
  `wr_returned_date_sk` int(11) DEFAULT NULL,
  `wr_returned_time_sk` int(11) DEFAULT NULL,
  `wr_item_sk` int(11) NOT NULL,
  `wr_refunded_customer_sk` int(11) DEFAULT NULL,
  `wr_refunded_cdemo_sk` int(11) DEFAULT NULL,
  `wr_refunded_hdemo_sk` int(11) DEFAULT NULL,
  `wr_refunded_addr_sk` int(11) DEFAULT NULL,
  `wr_returning_customer_sk` int(11) DEFAULT NULL,
  `wr_returning_cdemo_sk` int(11) DEFAULT NULL,
  `wr_returning_hdemo_sk` int(11) DEFAULT NULL,
  `wr_returning_addr_sk` int(11) DEFAULT NULL,
  `wr_web_page_sk` int(11) DEFAULT NULL,
  `wr_reason_sk` int(11) DEFAULT NULL,
  `wr_order_number` int(11) NOT NULL,
  `wr_return_quantity` int(11) DEFAULT NULL,
  `wr_return_amt` decimal(7,2) DEFAULT NULL,
  `wr_return_tax` decimal(7,2) DEFAULT NULL,
  `wr_return_amt_inc_tax` decimal(7,2) DEFAULT NULL,
  `wr_fee` decimal(7,2) DEFAULT NULL,
  `wr_return_ship_cost` decimal(7,2) DEFAULT NULL,
  `wr_refunded_cash` decimal(7,2) DEFAULT NULL,
  `wr_reversed_charge` decimal(7,2) DEFAULT NULL,
  `wr_account_credit` decimal(7,2) DEFAULT NULL,
  `wr_net_loss` decimal(7,2) DEFAULT NULL
)TABLET_SIZE = 134217728 PCTFREE = 0
 partition by range(wr_returned_date_sk)
(partition part_1 values less than (2450846),
partition part_73 values less than (MAXVALUE));

load data infile 'data_for_mysqltest_loaddata/null_field2.dat'
into table web_returns
fields terminated by '|';
select * from web_returns;
+---------------------+---------------------+------------+-------------------------+----------------------+----------------------+---------------------+--------------------------+-----------------------+-----------------------+----------------------+----------------+--------------+-----------------+--------------------+---------------+---------------+-----------------------+--------+---------------------+------------------+--------------------+-------------------+-------------+
| wr_returned_date_sk | wr_returned_time_sk | wr_item_sk | wr_refunded_customer_sk | wr_refunded_cdemo_sk | wr_refunded_hdemo_sk | wr_refunded_addr_sk | wr_returning_customer_sk | wr_returning_cdemo_sk | wr_returning_hdemo_sk | wr_returning_addr_sk | wr_web_page_sk | wr_reason_sk | wr_order_number | wr_return_quantity | wr_return_amt | wr_return_tax | wr_return_amt_inc_tax | wr_fee | wr_return_ship_cost | wr_refunded_cash | wr_reversed_charge | wr_account_credit | wr_net_loss |
+---------------------+---------------------+------------+-------------------------+----------------------+----------------------+---------------------+--------------------------+-----------------------+-----------------------+----------------------+----------------+--------------+-----------------+--------------------+---------------+---------------+-----------------------+--------+---------------------+------------------+--------------------+-------------------+-------------+
|                NULL |                NULL |       4933 |                    NULL |                 NULL |                 2358 |                NULL |                    14932 |                418645 |                  NULL |                 NULL |           NULL |         NULL |              15 |                 24 |          NULL |          NULL |                  NULL |  54.71 |               62.40 |             NULL |             129.49 |             60.94 |      143.37 |
+---------------------+---------------------+------------+-------------------------+----------------------+----------------------+---------------------+--------------------------+-----------------------+-----------------------+----------------------+----------------+--------------+-----------------+--------------------+---------------+---------------+-----------------------+--------+---------------------+------------------+--------------------+-------------------+-------------+

drop table web_returns;

