purge recyclebin;
result_format: 4
drop user whh@'%';
create user whh identified by 'whh';
grant all on *.* to whh WITH GRANT OPTION;


-----------------------------------------------------------------------------------------------------------------
------------------------- GET DIAGNOSTICS  诊断语句 -------------------------------------------------------------
###### 标签：diagnostics-1 基本语法 
-----------------------------------------------------------------------------------------------------------------
######################### 标签：diagnostics-1-1 基本语法 - 关键字参数  #########################
SET @p2=NULL, @p20=NULL, @p21=NULL, @p22=NULL, @p23=NULL, @p24=NULL, @p25=NULL;//
SET @p3=NULL, @p30=NULL, @p31=NULL, @p32=NULL, @p33=NULL, @p34=NULL, @p35=NULL;//
DROP PROCEDURE IF EXISTS pro1;//
CREATE PROCEDURE pro1 () 
BEGIN
  DECLARE CONTINUE HANDLER FOR SQLEXCEPTION
   BEGIN
      GET CURRENT DIAGNOSTICS @p2 = NUMBER, @p20 = ROW_COUNT;
      GET CURRENT DIAGNOSTICS CONDITION 1 @p21 = CLASS_ORIGIN, @p22 = SUBCLASS_ORIGIN, @p23 = RETURNED_SQLSTATE, @p24 = MESSAGE_TEXT, @p25 = MYSQL_ERRNO;
      GET STACKED DIAGNOSTICS @p3 = NUMBER, @p30 = ROW_COUNT;
	  GET STACKED DIAGNOSTICS CONDITION 1 @p31 = CLASS_ORIGIN, @p32 = SUBCLASS_ORIGIN, @p33 = RETURNED_SQLSTATE, @p34 = MESSAGE_TEXT, @p35 = MYSQL_ERRNO;
      SELECT 'CURRENT DIAGNOSTICS',@p2 'NUMBER', @p20 'ROW_COUNT',@p21 'CLASS_ORIGIN', @p22 'SUBCLASS_ORIGIN', @p23 'RETURNED_SQLSTATE', @p24 'MESSAGE_TEXT', @p25 'MYSQL_ERRNO';
	  SELECT 'STACKED DIAGNOSTICS',@p3 'NUMBER', @p30 'ROW_COUNT',@p31 'CLASS_ORIGIN', @p32 'SUBCLASS_ORIGIN', @p33 'RETURNED_SQLSTATE', @p34 'MESSAGE_TEXT', @p35 'MYSQL_ERRNO';
  END;
  DROP TABLE no_such_table0;
END;
//
CALL pro1()//
+---------------------+--------+-----------+--------------+-----------------+-------------------+-------------------------------------+-------------+
| CURRENT DIAGNOSTICS | NUMBER | ROW_COUNT | CLASS_ORIGIN | SUBCLASS_ORIGIN | RETURNED_SQLSTATE | MESSAGE_TEXT                        | MYSQL_ERRNO |
+---------------------+--------+-----------+--------------+-----------------+-------------------+-------------------------------------+-------------+
+---------------------+--------+-----------+--------------+-----------------+-------------------+-------------------------------------+-------------+
| STACKED DIAGNOSTICS | NUMBER | ROW_COUNT | CLASS_ORIGIN | SUBCLASS_ORIGIN | RETURNED_SQLSTATE | MESSAGE_TEXT                        | MYSQL_ERRNO |
+---------------------+--------+-----------+--------------+-----------------+-------------------+-------------------------------------+-------------+
| CURRENT DIAGNOSTICS |      1 |        -1 | ISO 9075     | ISO 9075        | 42S02             | Unknown table 'test.no_such_table0' | 1051        |
| STACKED DIAGNOSTICS |      1 |        -1 | ISO 9075     | ISO 9075        | 42S02             | Unknown table 'test.no_such_table0' | 1051        |
+---------------------+--------+-----------+--------------+-----------------+-------------------+-------------------------------------+-------------+
+---------------------+--------+-----------+--------------+-----------------+-------------------+-------------------------------------+-------------+
######################### 标签：diagnostics-1-2 基本语法 - 检索列表参数 #########################
#### 测试前表准备
DROP TABLE dia_table1;
CREATE TABLE dia_table1( 
  c1 int, 
  c2 VARCHAR(200),
  c3 VARCHAR(200)
);
insert into dia_table1 values(1,'mysql','8.0');
insert into dia_table1 values(2,'oracle','-');
insert into dia_table1 values(3,'ob','8.0');
DROP TABLE dia_table2;
CREATE TABLE dia_table2( 
  id int primary key auto_increment,
  numbers  varchar(200),
  row_count varchar(200),
  cla_ori varchar(200),
  sub_ori varchar(200),
  ret_sqlstate varchar(200),
  mes_text varchar(200),
  mysql_err varchar(200)
);
#### 标签：diagnostics-1-2-1 语句信息
# bug1:GET DIAGNOSTICS 诊断语句获取ROW_COUNT （SQL语句改变的行数），mysql与ob结果不一致。
SET @p1=NULL, @p2=NULL;
DELETE FROM dia_table1 WHERE c1 <= 2;
GET CURRENT DIAGNOSTICS @p1 = NUMBER, @p2 = ROW_COUNT;
SELECT  @p1 'NUMBER', @p2 'ROW_COUNT';
+--------+-----------+
| NUMBER | ROW_COUNT |
+--------+-----------+
|      0 |        -1 |
+--------+-----------+
SET @p1=NULL, @p2=NULL;
INSERT INTO dia_table1 VALUES(2,'oracle','-');
GET DIAGNOSTICS @p1 = NUMBER, @p2 = ROW_COUNT;
SELECT  @p1 'NUMBER', @p2 'ROW_COUNT';
+--------+-----------+
| NUMBER | ROW_COUNT |
+--------+-----------+
|      0 |        -1 |
+--------+-----------+
SET @p1=NULL, @p2=NULL;
UPDATE dia_table1 SET c2='oracle-update' WHERE c1 = 2;
GET CURRENT DIAGNOSTICS @p1 = NUMBER, @p2 = ROW_COUNT;
SELECT  @p1 'NUMBER', @p2 'ROW_COUNT';
+--------+-----------+
| NUMBER | ROW_COUNT |
+--------+-----------+
|      0 |        -1 |
+--------+-----------+
SET @p1=NULL, @p2=NULL;
SELECT * FROM dia_table1 ORDER BY c1;
+------+---------------+------+
| c1   | c2            | c3   |
+------+---------------+------+
|    2 | oracle-update | -    |
|    3 | ob            | 8.0  |
+------+---------------+------+
GET DIAGNOSTICS @p1 = NUMBER, @p2 = ROW_COUNT;
SELECT  @p1 'NUMBER', @p2 'ROW_COUNT';
+--------+-----------+
| NUMBER | ROW_COUNT |
+--------+-----------+
|      0 |        -1 |
+--------+-----------+
SET @p1=NULL, @p2=NULL;
DROP TABLE no_such_table1;
ERROR 42S02: Unknown table 'test.no_such_table1'
GET CURRENT DIAGNOSTICS @p1 = NUMBER, @p2 = ROW_COUNT;
SELECT  @p1 'NUMBER', @p2 'ROW_COUNT';
+--------+-----------+
| NUMBER | ROW_COUNT |
+--------+-----------+
|      1 |        -1 |
+--------+-----------+
#### 标签：diagnostics-1-2-2 条件信息
SET @p10=NULL, @p20=NULL, @p30=NULL, @p40=NULL, @p50=NULL;
SET @p11=NULL, @p12=NULL, @p13=NULL, @p1=NULL, @p15=NULL, @p16=NULL, @p17=NULL;
insert into dia_table1 values(1,'mysql','8.0');
GET CURRENT DIAGNOSTICS CONDITION 1 @p10 = CLASS_ORIGIN, @p20 = SUBCLASS_ORIGIN, @p30 = RETURNED_SQLSTATE, @p40 = MESSAGE_TEXT, @p50 = MYSQL_ERRNO;
Warnings:
Warning	1758	Invalid condition number
GET CURRENT DIAGNOSTICS CONDITION 1 @p11 = CONSTRAINT_CATALOG, @p12 = CONSTRAINT_SCHEMA, @p13 = CONSTRAINT_NAME, @p14 = CATALOG_NAME, @p15 = SCHEMA_NAME, @p16 = TABLE_NAME, @p17 = COLUMN_NAME, @p18 = CURSOR_NAME;
SELECT @p10, @p20, @p30, @p40, @p50;
+------+------+------+------+------+
| @p10 | @p20 | @p30 | @p40 | @p50 |
+------+------+------+------+------+
| NULL | NULL | NULL | NULL | NULL |
+------+------+------+------+------+
SELECT @p11, @p12, @p13, @p14, @p15, @p16, @p17;
+------+------+------+------+------+------+------+
| @p11 | @p12 | @p13 | @p14 | @p15 | @p16 | @p17 |
+------+------+------+------+------+------+------+
| NULL | NULL | NULL | NULL | NULL | NULL | NULL |
+------+------+------+------+------+------+------+
SET @p1=NULL, @p2=NULL, @p3=NULL, @p4=NULL, @p5=NULL;
SET @p11=NULL, @p12=NULL, @p13=NULL, @p1=NULL, @p15=NULL, @p16=NULL, @p17=NULL;
DROP TABLE no_such_table2;
ERROR 42S02: Unknown table 'test.no_such_table2'
GET DIAGNOSTICS CONDITION 1 @p1 = CLASS_ORIGIN, @p2 = SUBCLASS_ORIGIN, @p3 = RETURNED_SQLSTATE, @p4 = MESSAGE_TEXT, @p5 = MYSQL_ERRNO;
GET DIAGNOSTICS CONDITION 1 @p11 = CONSTRAINT_CATALOG, @p12 = CONSTRAINT_SCHEMA, @p13 = CONSTRAINT_NAME, @p14 = CATALOG_NAME, @p15 = SCHEMA_NAME, @p16 = TABLE_NAME, @p17 = COLUMN_NAME, @p18 = CURSOR_NAME;
SELECT @p1, @p2, @p3, @p4, @p5;
+----------+----------+-------+-------------------------------------+------+
| @p1      | @p2      | @p3   | @p4                                 | @p5  |
+----------+----------+-------+-------------------------------------+------+
| ISO 9075 | ISO 9075 | 42S02 | Unknown table 'test.no_such_table2' | 1051 |
+----------+----------+-------+-------------------------------------+------+
SELECT @p11, @p12, @p13, @p14, @p15, @p16, @p17;
+------+------+------+------+------+------+------+
| @p11 | @p12 | @p13 | @p14 | @p15 | @p16 | @p17 |
+------+------+------+------+------+------+------+
| NULL | NULL | NULL | NULL | NULL | NULL | NULL |
+------+------+------+------+------+------+------+
#### 标签：diagnostics-1-2-3 存储信息指示符 
#### 标签：diagnostics-1-2-3-1 指示符对象-语句信息指示符对象
# issue: 41307421 Closed bug2:GET DIAGNOSTICS 诊断语句,target用于存储项目信息的有效指示符是存储过程参数，DECLARE声明的存储程序局部变量或用户定义的变量，获取ROW_COUNT （SQL语句改变的行数）时，mysql与ob结果不一致。
### 指示符对象-存储过程参数
SET @p11=NULL, @p12=NULL,@p21=NULL, @p22=NULL;//
DROP PROCEDURE IF EXISTS pro1;//
CREATE PROCEDURE pro1 (out num1 varchar(200),out row_cou1 varchar(200),out num2 varchar(200),out row_cou2 varchar(200)) 
BEGIN
  DECLARE CONTINUE HANDLER FOR SQLEXCEPTION
   BEGIN
      GET CURRENT DIAGNOSTICS num1 = NUMBER, row_cou1 = ROW_COUNT;
	  GET STACKED DIAGNOSTICS num2 = NUMBER, row_cou2 = ROW_COUNT;
  END;
  DROP TABLE no_such_table3;
END;
//
CALL pro1(@p11, @p12,@p21, @p22)//
SELECT 'CURRENT DIAGNOSTICS',@p11 'NUMBER', @p12 'ROW_COUNT';//
+---------------------+--------+-----------+
| CURRENT DIAGNOSTICS | NUMBER | ROW_COUNT |
+---------------------+--------+-----------+
| CURRENT DIAGNOSTICS | 1      | -1        |
+---------------------+--------+-----------+
SELECT 'STACKED DIAGNOSTICS',@p21 'NUMBER', @p22 'ROW_COUNT';//
+---------------------+--------+-----------+
| STACKED DIAGNOSTICS | NUMBER | ROW_COUNT |
+---------------------+--------+-----------+
| STACKED DIAGNOSTICS | 1      | -1        |
+---------------------+--------+-----------+
SET @p11=NULL, @p12=NULL,@p21=NULL, @p22=NULL;//
DROP PROCEDURE IF EXISTS pro1;//
CREATE PROCEDURE pro1 (inout num1 varchar(200),inout row_cou1 varchar(200),inout num2 varchar(200),inout row_cou2 varchar(200)) 
BEGIN
  DECLARE CONTINUE HANDLER FOR SQLEXCEPTION
   BEGIN
      GET CURRENT DIAGNOSTICS num1 = NUMBER, row_cou1 = ROW_COUNT;
	  GET STACKED DIAGNOSTICS num2 = NUMBER, row_cou2 = ROW_COUNT;
  END;
  DROP TABLE no_such_table3;
END;
//
CALL pro1(@p11, @p12,@p21, @p22)//
SELECT 'CURRENT DIAGNOSTICS',@p11 'NUMBER', @p12 'ROW_COUNT';//
+---------------------+--------+-----------+
| CURRENT DIAGNOSTICS | NUMBER | ROW_COUNT |
+---------------------+--------+-----------+
| CURRENT DIAGNOSTICS | 1      | -1        |
+---------------------+--------+-----------+
SELECT 'STACKED DIAGNOSTICS',@p21 'NUMBER', @p22 'ROW_COUNT';//
+---------------------+--------+-----------+
| STACKED DIAGNOSTICS | NUMBER | ROW_COUNT |
+---------------------+--------+-----------+
| STACKED DIAGNOSTICS | 1      | -1        |
+---------------------+--------+-----------+
### 指示符对象-用户定义的变量
SET @p1=NULL, @p2=NULL,@p3=NULL, @p4=NULL;//
DROP PROCEDURE IF EXISTS pro1;//
CREATE PROCEDURE pro1 () 
BEGIN
  DECLARE CONTINUE HANDLER FOR SQLEXCEPTION
   BEGIN
      GET DIAGNOSTICS @p1 = NUMBER, @p2 = ROW_COUNT;
	  GET STACKED DIAGNOSTICS @p3 = NUMBER, @p4 = ROW_COUNT;
      SELECT 'CURRENT DIAGNOSTICS',@p1 'NUMBER', @p2 'ROW_COUNT';
	  SELECT 'STACKED DIAGNOSTICS',@p3 'NUMBER', @p4 'ROW_COUNT';
  END;
  DROP TABLE no_such_table4;
END;
//
CALL pro1()//
+---------------------+--------+-----------+
| CURRENT DIAGNOSTICS | NUMBER | ROW_COUNT |
+---------------------+--------+-----------+
+---------------------+--------+-----------+
| STACKED DIAGNOSTICS | NUMBER | ROW_COUNT |
+---------------------+--------+-----------+
| CURRENT DIAGNOSTICS |      1 |        -1 |
| STACKED DIAGNOSTICS |      1 |        -1 |
+---------------------+--------+-----------+
+---------------------+--------+-----------+
### 指示符对象- DECLARE声明的局部变量
DROP PROCEDURE IF EXISTS pro1;//
CREATE PROCEDURE pro1()
BEGIN
   DECLARE num1,cou1 INT;
   DECLARE num2,cou2 INT;
   DECLARE CONTINUE HANDLER FOR SQLEXCEPTION
   BEGIN
    GET DIAGNOSTICS num1 = NUMBER, cou1 = ROW_COUNT;
	GET STACKED DIAGNOSTICS num2 = NUMBER, cou2 = ROW_COUNT;
    SELECT 'CURRENT DIAGNOSTICS',num1 'NUMBER', cou1 'ROW_COUNT';
	SELECT 'STACKED DIAGNOSTICS',num2 'NUMBER', cou2 'ROW_COUNT';
  END;
  SELECT * FROM tt1;
END;//
CALL pro1()//
+---------------------+--------+-----------+
| CURRENT DIAGNOSTICS | NUMBER | ROW_COUNT |
+---------------------+--------+-----------+
+---------------------+--------+-----------+
| STACKED DIAGNOSTICS | NUMBER | ROW_COUNT |
+---------------------+--------+-----------+
| CURRENT DIAGNOSTICS |      1 |        -1 |
| STACKED DIAGNOSTICS |      1 |        -1 |
+---------------------+--------+-----------+
+---------------------+--------+-----------+
#### 标签：diagnostics-1-2-3-2 指示符对象-条件信息指示符对象
### 指示符对象-存储过程参数
SET @p21=NULL, @p22=NULL, @p23=NULL, @p24=NULL, @p25=NULL;//
DROP PROCEDURE IF EXISTS pro1;//
CREATE PROCEDURE pro1 (out cla_ori varchar(200),out sub_ori varchar(200),out ret_sqlstate varchar(200),out mes_text varchar(200),out mysql_err varchar(200)) 
BEGIN
  UPDATE dia_table1 SET c2='oracle-update' WHERE c1 = 2;
  GET CURRENT DIAGNOSTICS CONDITION 1 cla_ori = CLASS_ORIGIN, sub_ori = SUBCLASS_ORIGIN, ret_sqlstate = RETURNED_SQLSTATE, mes_text = MESSAGE_TEXT, mysql_err = MYSQL_ERRNO;
END;
//
CALL pro1(@p21, @p22, @p23, @p24, @p25)//
Warnings:
Warning	1758	Invalid condition number
SELECT  @p21 'CLASS_ORIGIN', @p22 'SUBCLASS_ORIGIN', @p23 'RETURNED_SQLSTATE', @p24 'MESSAGE_TEXT', @p25 'MYSQL_ERRNO';//
+--------------+-----------------+-------------------+--------------+-------------+
| CLASS_ORIGIN | SUBCLASS_ORIGIN | RETURNED_SQLSTATE | MESSAGE_TEXT | MYSQL_ERRNO |
+--------------+-----------------+-------------------+--------------+-------------+
| NULL         | NULL            | NULL              | NULL         | NULL        |
+--------------+-----------------+-------------------+--------------+-------------+
SET @p21=NULL, @p22=NULL, @p23=NULL, @p24=NULL, @p25=NULL,@p31=NULL, @p32=NULL, @p33=NULL, @p34=NULL, @p35=NULL;//
DROP PROCEDURE IF EXISTS pro1;//
CREATE PROCEDURE pro1 (out cla_ori varchar(200),out sub_ori varchar(200),out ret_sqlstate varchar(200),out mes_text varchar(200),out mysql_err varchar(200),out cla_ori2 varchar(200),out sub_ori2 varchar(200),out ret_sqlstate2 varchar(200),out mes_text2 varchar(200),out mysql_err2 varchar(200)) 
BEGIN
  DECLARE CONTINUE HANDLER FOR SQLEXCEPTION
   BEGIN
      GET DIAGNOSTICS CONDITION 1 cla_ori = CLASS_ORIGIN, sub_ori = SUBCLASS_ORIGIN, ret_sqlstate = RETURNED_SQLSTATE, mes_text = MESSAGE_TEXT, mysql_err = MYSQL_ERRNO;
      GET STACKED DIAGNOSTICS CONDITION 1 cla_ori2 = CLASS_ORIGIN, sub_ori2 = SUBCLASS_ORIGIN, ret_sqlstate2 = RETURNED_SQLSTATE, mes_text2 = MESSAGE_TEXT, mysql_err2 = MYSQL_ERRNO;
  END;
  DROP TABLE no_such_table3;
END;
//
CALL pro1(@p21, @p22, @p23, @p24, @p25,@p31, @p32, @p33, @p34, @p35)//
SELECT 'CURRENT DIAGNOSTICS',@p21 'CLASS_ORIGIN', @p22 'SUBCLASS_ORIGIN', @p23 'RETURNED_SQLSTATE', @p24 'MESSAGE_TEXT', @p25 'MYSQL_ERRNO';//
+---------------------+--------------+-----------------+-------------------+-------------------------------------+-------------+
| CURRENT DIAGNOSTICS | CLASS_ORIGIN | SUBCLASS_ORIGIN | RETURNED_SQLSTATE | MESSAGE_TEXT                        | MYSQL_ERRNO |
+---------------------+--------------+-----------------+-------------------+-------------------------------------+-------------+
| CURRENT DIAGNOSTICS | ISO 9075     | ISO 9075        | 42S02             | Unknown table 'test.no_such_table3' | 1051        |
+---------------------+--------------+-----------------+-------------------+-------------------------------------+-------------+
SELECT 'STACKED DIAGNOSTICS',@p31 'CLASS_ORIGIN', @p32 'SUBCLASS_ORIGIN', @p33 'RETURNED_SQLSTATE', @p34 'MESSAGE_TEXT', @p35 'MYSQL_ERRNO';//
+---------------------+--------------+-----------------+-------------------+-------------------------------------+-------------+
| STACKED DIAGNOSTICS | CLASS_ORIGIN | SUBCLASS_ORIGIN | RETURNED_SQLSTATE | MESSAGE_TEXT                        | MYSQL_ERRNO |
+---------------------+--------------+-----------------+-------------------+-------------------------------------+-------------+
| STACKED DIAGNOSTICS | ISO 9075     | ISO 9075        | 42S02             | Unknown table 'test.no_such_table3' | 1051        |
+---------------------+--------------+-----------------+-------------------+-------------------------------------+-------------+
SET @p21=NULL, @p22=NULL, @p23=NULL, @p24=NULL, @p25=NULL,@p31=NULL, @p32=NULL, @p33=NULL, @p34=NULL, @p35=NULL;//
DROP PROCEDURE IF EXISTS pro1;//
CREATE PROCEDURE pro1 (inout cla_ori varchar(200),inout sub_ori varchar(200),inout ret_sqlstate varchar(200),inout mes_text varchar(200),inout mysql_err varchar(200),inout cla_ori2 varchar(200),inout sub_ori2 varchar(200),inout ret_sqlstate2 varchar(200),inout mes_text2 varchar(200),inout mysql_err2 varchar(200)) 
BEGIN
  DECLARE CONTINUE HANDLER FOR SQLEXCEPTION
   BEGIN
      GET DIAGNOSTICS CONDITION 1 cla_ori = CLASS_ORIGIN, sub_ori = SUBCLASS_ORIGIN, ret_sqlstate = RETURNED_SQLSTATE, mes_text = MESSAGE_TEXT, mysql_err = MYSQL_ERRNO;
      GET STACKED DIAGNOSTICS CONDITION 1 cla_ori2 = CLASS_ORIGIN, sub_ori2 = SUBCLASS_ORIGIN, ret_sqlstate2 = RETURNED_SQLSTATE, mes_text2 = MESSAGE_TEXT, mysql_err2 = MYSQL_ERRNO;
  END;
  DROP TABLE no_such_table3;
END;
//
CALL pro1(@p21, @p22, @p23, @p24, @p25,@p31, @p32, @p33, @p34, @p35)//
SELECT 'CURRENT DIAGNOSTICS',@p21 'CLASS_ORIGIN', @p22 'SUBCLASS_ORIGIN', @p23 'RETURNED_SQLSTATE', @p24 'MESSAGE_TEXT', @p25 'MYSQL_ERRNO';//
+---------------------+--------------+-----------------+-------------------+-------------------------------------+-------------+
| CURRENT DIAGNOSTICS | CLASS_ORIGIN | SUBCLASS_ORIGIN | RETURNED_SQLSTATE | MESSAGE_TEXT                        | MYSQL_ERRNO |
+---------------------+--------------+-----------------+-------------------+-------------------------------------+-------------+
| CURRENT DIAGNOSTICS | ISO 9075     | ISO 9075        | 42S02             | Unknown table 'test.no_such_table3' | 1051        |
+---------------------+--------------+-----------------+-------------------+-------------------------------------+-------------+
SELECT 'STACKED DIAGNOSTICS',@p31 'CLASS_ORIGIN', @p32 'SUBCLASS_ORIGIN', @p33 'RETURNED_SQLSTATE', @p34 'MESSAGE_TEXT', @p35 'MYSQL_ERRNO';//
+---------------------+--------------+-----------------+-------------------+-------------------------------------+-------------+
| STACKED DIAGNOSTICS | CLASS_ORIGIN | SUBCLASS_ORIGIN | RETURNED_SQLSTATE | MESSAGE_TEXT                        | MYSQL_ERRNO |
+---------------------+--------------+-----------------+-------------------+-------------------------------------+-------------+
| STACKED DIAGNOSTICS | ISO 9075     | ISO 9075        | 42S02             | Unknown table 'test.no_such_table3' | 1051        |
+---------------------+--------------+-----------------+-------------------+-------------------------------------+-------------+
### 指示符对象-用户定义的变量
SET @p21=NULL, @p22=NULL, @p23=NULL, @p24=NULL, @p25=NULL;//
DROP PROCEDURE IF EXISTS pro1;//
CREATE PROCEDURE pro1 () 
BEGIN
  UPDATE dia_table1 SET c2='oracle-update' WHERE c1 = 2;
  GET DIAGNOSTICS CONDITION 1 @p21 = CLASS_ORIGIN, @p22 = SUBCLASS_ORIGIN, @p23 = RETURNED_SQLSTATE, @p24 = MESSAGE_TEXT, @p25 = MYSQL_ERRNO;
  SELECT @p21 'CLASS_ORIGIN', @p22 'SUBCLASS_ORIGIN', @p23 'RETURNED_SQLSTATE', @p24 'MESSAGE_TEXT', @p25 'MYSQL_ERRNO';
END;
//
CALL pro1()//
+--------------+-----------------+-------------------+--------------+-------------+
| CLASS_ORIGIN | SUBCLASS_ORIGIN | RETURNED_SQLSTATE | MESSAGE_TEXT | MYSQL_ERRNO |
+--------------+-----------------+-------------------+--------------+-------------+
| NULL         | NULL            | NULL              | NULL         | NULL        |
+--------------+-----------------+-------------------+--------------+-------------+
SET @p21=NULL, @p22=NULL, @p23=NULL, @p24=NULL, @p25=NULL,@p31=NULL, @p32=NULL, @p33=NULL, @p34=NULL, @p35=NULL;//
DROP PROCEDURE IF EXISTS pro1;//
CREATE PROCEDURE pro1 () 
BEGIN
  DECLARE CONTINUE HANDLER FOR SQLEXCEPTION
   BEGIN
      GET CURRENT DIAGNOSTICS CONDITION 1 @p21 = CLASS_ORIGIN, @p22 = SUBCLASS_ORIGIN, @p23 = RETURNED_SQLSTATE, @p24 = MESSAGE_TEXT, @p25 = MYSQL_ERRNO;
      GET STACKED DIAGNOSTICS CONDITION 1 @p31 = CLASS_ORIGIN, @p32 = SUBCLASS_ORIGIN, @p33 = RETURNED_SQLSTATE, @p34 = MESSAGE_TEXT, @p35 = MYSQL_ERRNO;
      SELECT 'CURRENT DIAGNOSTICS',@p21 'CLASS_ORIGIN', @p22 'SUBCLASS_ORIGIN', @p23 'RETURNED_SQLSTATE', @p24 'MESSAGE_TEXT', @p25 'MYSQL_ERRNO';
	  SELECT 'STACKED DIAGNOSTICS',@p31 'CLASS_ORIGIN', @p32 'SUBCLASS_ORIGIN', @p33 'RETURNED_SQLSTATE', @p34 'MESSAGE_TEXT', @p35 'MYSQL_ERRNO';
  END;
  DROP TABLE no_such_table4;
END;
//
CALL pro1()//
+---------------------+--------------+-----------------+-------------------+-------------------------------------+-------------+
| CURRENT DIAGNOSTICS | CLASS_ORIGIN | SUBCLASS_ORIGIN | RETURNED_SQLSTATE | MESSAGE_TEXT                        | MYSQL_ERRNO |
+---------------------+--------------+-----------------+-------------------+-------------------------------------+-------------+
+---------------------+--------------+-----------------+-------------------+-------------------------------------+-------------+
| STACKED DIAGNOSTICS | CLASS_ORIGIN | SUBCLASS_ORIGIN | RETURNED_SQLSTATE | MESSAGE_TEXT                        | MYSQL_ERRNO |
+---------------------+--------------+-----------------+-------------------+-------------------------------------+-------------+
| CURRENT DIAGNOSTICS | ISO 9075     | ISO 9075        | 42S02             | Unknown table 'test.no_such_table4' | 1051        |
| STACKED DIAGNOSTICS | ISO 9075     | ISO 9075        | 42S02             | Unknown table 'test.no_such_table4' | 1051        |
+---------------------+--------------+-----------------+-------------------+-------------------------------------+-------------+
+---------------------+--------------+-----------------+-------------------+-------------------------------------+-------------+
### 指示符对象- DECLARE声明的局部变量
DROP PROCEDURE IF EXISTS pro1;//
CREATE PROCEDURE pro1 () DETERMINISTIC
BEGIN
  DECLARE cla_ori varchar(200);
  DECLARE sub_ori varchar(200);
  DECLARE ret_sqlstate varchar(200);
  DECLARE mes_text varchar(200);
  DECLARE mysql_err varchar(200);
  UPDATE dia_table1 SET c2='oracle-update' WHERE c1 = 2;
  GET DIAGNOSTICS CONDITION 1 cla_ori = CLASS_ORIGIN, sub_ori = SUBCLASS_ORIGIN, ret_sqlstate = RETURNED_SQLSTATE, mes_text = MESSAGE_TEXT, mysql_err = MYSQL_ERRNO;
  INSERT INTO dia_table2 VALUES(null,'-','-',cla_ori,sub_ori,ret_sqlstate,mes_text,mysql_err);
END;
//
CALL pro1()//
SELECT * FROM dia_table2 ORDER BY id;//
+----+---------+-----------+---------+---------+--------------+----------+-----------+
| id | numbers | row_count | cla_ori | sub_ori | ret_sqlstate | mes_text | mysql_err |
+----+---------+-----------+---------+---------+--------------+----------+-----------+
|  1 | -       | -         | NULL    | NULL    | NULL         | NULL     | NULL      |
+----+---------+-----------+---------+---------+--------------+----------+-----------+
DROP PROCEDURE IF EXISTS pro1;//
CREATE PROCEDURE pro1 () DETERMINISTIC
BEGIN
  DECLARE cla_ori,cla_ori2 varchar(200);
  DECLARE sub_ori,sub_ori2 varchar(200);
  DECLARE ret_sqlstate,ret_sqlstate2 varchar(200);
  DECLARE mes_text,mes_text2 varchar(200);
  DECLARE mysql_err,mysql_err2 varchar(200);
  
  DECLARE CONTINUE HANDLER FOR SQLEXCEPTION
   BEGIN
      GET DIAGNOSTICS CONDITION 1 cla_ori = CLASS_ORIGIN, sub_ori = SUBCLASS_ORIGIN, ret_sqlstate = RETURNED_SQLSTATE, mes_text = MESSAGE_TEXT, mysql_err = MYSQL_ERRNO;
      GET STACKED DIAGNOSTICS CONDITION 1 cla_ori2 = CLASS_ORIGIN, sub_ori2 = SUBCLASS_ORIGIN, ret_sqlstate2 = RETURNED_SQLSTATE, mes_text2 = MESSAGE_TEXT, mysql_err2 = MYSQL_ERRNO;
      INSERT INTO dia_table2 VALUES(null,'-','-',cla_ori,sub_ori,ret_sqlstate,mes_text,mysql_err);
	  INSERT INTO dia_table2 VALUES(null,'-','-',cla_ori2,sub_ori2,ret_sqlstate2,mes_text2,mysql_err2);
  END;
  SELECT * FROM no_such_table5;
END;
//
CALL pro1()//
SELECT * FROM dia_table2 ORDER BY id;//
+----+---------+-----------+----------+----------+--------------+-------------------------------------------+-----------+
| id | numbers | row_count | cla_ori  | sub_ori  | ret_sqlstate | mes_text                                  | mysql_err |
+----+---------+-----------+----------+----------+--------------+-------------------------------------------+-----------+
|  1 | -       | -         | NULL     | NULL     | NULL         | NULL                                      | NULL      |
|  2 | -       | -         | ISO 9075 | ISO 9075 | 42S02        | Table 'test.no_such_table5' doesn't exist | 1146      |
|  3 | -       | -         | ISO 9075 | ISO 9075 | 42S02        | Table 'test.no_such_table5' doesn't exist | 1146      |
+----+---------+-----------+----------+----------+--------------+-------------------------------------------+-----------+
#### 标签：diagnostics-1-2-3-2 指示符对象-指示符数据类型
# bug3:GET DIAGNOSTICS 诊断语句,target(用于存储项目信息的有效指示符)用数值，字符，日期数据类型存储时，mysql与ob结果不一致。
##数值类型
DROP PROCEDURE IF EXISTS pro1;//
CREATE PROCEDURE pro1 () DETERMINISTIC
BEGIN
  DECLARE num,num2 tinyint;
  DECLARE row_count,row_count2 smallint;
  DECLARE cla_ori,cla_ori2 mediumint;
  DECLARE sub_ori,sub_ori2 int;
  DECLARE ret_sqlstate,ret_sqlstate2 bigint;
  DECLARE mes_text,mes_text2 float;
  DECLARE mysql_err,mysql_err2 double;
  
  DECLARE CONTINUE HANDLER FOR SQLEXCEPTION
   BEGIN
      GET CURRENT DIAGNOSTICS num = NUMBER, row_count = ROW_COUNT;
	  GET STACKED DIAGNOSTICS num2 = NUMBER, row_count2 = ROW_COUNT;
      GET CURRENT DIAGNOSTICS CONDITION 1 cla_ori = CLASS_ORIGIN, sub_ori = SUBCLASS_ORIGIN, ret_sqlstate = RETURNED_SQLSTATE, mes_text = MESSAGE_TEXT, mysql_err = MYSQL_ERRNO;
	  GET STACKED DIAGNOSTICS CONDITION 1 cla_ori2 = CLASS_ORIGIN, sub_ori2 = SUBCLASS_ORIGIN, ret_sqlstate2 = RETURNED_SQLSTATE, mes_text2 = MESSAGE_TEXT, mysql_err2 = MYSQL_ERRNO;
      SELECT 'CURRENT DIAGNOSTICS',num 'NUMBER',row_count 'ROW_COUNT';
	  SELECT 'STACKED DIAGNOSTICS',num2 'NUMBER',row_count2 'ROW_COUNT';
	  SELECT 'CURRENT DIAGNOSTICS',cla_ori 'CLASS_ORIGIN', sub_ori 'SUBCLASS_ORIGIN', ret_sqlstate 'RETURNED_SQLSTATE', mes_text 'MESSAGE_TEXT', mysql_err 'MYSQL_ERRNO';
	  SELECT 'STACKED DIAGNOSTICS',cla_ori2 'CLASS_ORIGIN', sub_ori2 'SUBCLASS_ORIGIN', ret_sqlstate2 'RETURNED_SQLSTATE', mes_text2 'MESSAGE_TEXT', mysql_err2 'MYSQL_ERRNO';
  END;
  SELECT * FROM no_such_table6;
END;
//
CALL pro1()//
+---------------------+--------+-----------+
| CURRENT DIAGNOSTICS | NUMBER | ROW_COUNT |
+---------------------+--------+-----------+
+---------------------+--------+-----------+
| STACKED DIAGNOSTICS | NUMBER | ROW_COUNT |
+---------------------+--------+-----------+
+---------------------+--------------+-----------------+-------------------+--------------+-------------+
| CURRENT DIAGNOSTICS | CLASS_ORIGIN | SUBCLASS_ORIGIN | RETURNED_SQLSTATE | MESSAGE_TEXT | MYSQL_ERRNO |
+---------------------+--------------+-----------------+-------------------+--------------+-------------+
+---------------------+--------------+-----------------+-------------------+--------------+-------------+
| STACKED DIAGNOSTICS | CLASS_ORIGIN | SUBCLASS_ORIGIN | RETURNED_SQLSTATE | MESSAGE_TEXT | MYSQL_ERRNO |
+---------------------+--------------+-----------------+-------------------+--------------+-------------+
| CURRENT DIAGNOSTICS |      1 |        -1 |
| STACKED DIAGNOSTICS |      1 |        -1 |
| CURRENT DIAGNOSTICS |            0 |               0 |                 0 |            0 |        1146 |
| STACKED DIAGNOSTICS |            0 |               0 |                 0 |            0 |        1146 |
+---------------------+--------+-----------+
+---------------------+--------+-----------+
+---------------------+--------------+-----------------+-------------------+--------------+-------------+
+---------------------+--------------+-----------------+-------------------+--------------+-------------+
DROP PROCEDURE IF EXISTS pro1;//
CREATE PROCEDURE pro1 () DETERMINISTIC
BEGIN
  DECLARE num,num2 decimal;
  DECLARE row_count,row_count2 bit;
  DECLARE cla_ori,cla_ori2 float;
  DECLARE sub_ori,sub_ori2 double;
  DECLARE ret_sqlstate,ret_sqlstate2 decimal;
  DECLARE mes_text,mes_text2 tinyint;
  DECLARE mysql_err,mysql_err2 bigint;
  
  DECLARE CONTINUE HANDLER FOR SQLEXCEPTION
   BEGIN
      GET CURRENT DIAGNOSTICS num = NUMBER, row_count = ROW_COUNT;
	  GET STACKED DIAGNOSTICS num2 = NUMBER, row_count2 = ROW_COUNT;
      GET CURRENT DIAGNOSTICS CONDITION 1 cla_ori = CLASS_ORIGIN, sub_ori = SUBCLASS_ORIGIN, ret_sqlstate = RETURNED_SQLSTATE, mes_text = MESSAGE_TEXT, mysql_err = MYSQL_ERRNO;
	  GET STACKED DIAGNOSTICS CONDITION 1 cla_ori2 = CLASS_ORIGIN, sub_ori2 = SUBCLASS_ORIGIN, ret_sqlstate2 = RETURNED_SQLSTATE, mes_text2 = MESSAGE_TEXT, mysql_err2 = MYSQL_ERRNO;
      SELECT 'CURRENT DIAGNOSTICS',num 'NUMBER',row_count 'ROW_COUNT';
	  SELECT 'STACKED DIAGNOSTICS',num2 'NUMBER',row_count2 'ROW_COUNT';
	  SELECT 'CURRENT DIAGNOSTICS',cla_ori 'CLASS_ORIGIN', sub_ori 'SUBCLASS_ORIGIN', ret_sqlstate 'RETURNED_SQLSTATE', mes_text 'MESSAGE_TEXT', mysql_err 'MYSQL_ERRNO';
	  SELECT 'STACKED DIAGNOSTICS',cla_ori2 'CLASS_ORIGIN', sub_ori2 'SUBCLASS_ORIGIN', ret_sqlstate2 'RETURNED_SQLSTATE', mes_text2 'MESSAGE_TEXT', mysql_err2 'MYSQL_ERRNO';
  END;
  SELECT * FROM no_such_table7;
END;
//
CALL pro1()//
+---------------------+--------+-----------+
| CURRENT DIAGNOSTICS | NUMBER | ROW_COUNT |
+---------------------+--------+-----------+
+---------------------+--------+-----------+
| STACKED DIAGNOSTICS | NUMBER | ROW_COUNT |
+---------------------+--------+-----------+
+---------------------+--------------+-----------------+-------------------+--------------+-------------+
| CURRENT DIAGNOSTICS | CLASS_ORIGIN | SUBCLASS_ORIGIN | RETURNED_SQLSTATE | MESSAGE_TEXT | MYSQL_ERRNO |
+---------------------+--------------+-----------------+-------------------+--------------+-------------+
+---------------------+--------------+-----------------+-------------------+--------------+-------------+
| STACKED DIAGNOSTICS | CLASS_ORIGIN | SUBCLASS_ORIGIN | RETURNED_SQLSTATE | MESSAGE_TEXT | MYSQL_ERRNO |
+---------------------+--------------+-----------------+-------------------+--------------+-------------+
| CURRENT DIAGNOSTICS |      1 | NULL      |
| STACKED DIAGNOSTICS |      1 | NULL      |
| CURRENT DIAGNOSTICS |            0 |               0 |                 0 |            0 |        1235 |
| STACKED DIAGNOSTICS |            0 |               0 |                 0 |            0 |        1146 |
+---------------------+--------+-----------+
+---------------------+--------+-----------+
+---------------------+--------------+-----------------+-------------------+--------------+-------------+
+---------------------+--------------+-----------------+-------------------+--------------+-------------+
##字符串类型
DROP PROCEDURE IF EXISTS pro1;//
CREATE PROCEDURE pro1 () DETERMINISTIC
BEGIN
  DECLARE num,num2 CHAR(200);
  DECLARE row_count,row_count2 BINARY;
  DECLARE cla_ori,cla_ori2 BLOB;
  DECLARE sub_ori,sub_ori2 BLOB;
  DECLARE ret_sqlstate,ret_sqlstate2 TEXT;
  DECLARE mes_text,mes_text2 BINARY;
  DECLARE mysql_err,mysql_err2 VARBINARY(200);
  DECLARE CONTINUE HANDLER FOR SQLEXCEPTION
   BEGIN
      GET CURRENT DIAGNOSTICS num = NUMBER, row_count = ROW_COUNT;
	  GET STACKED DIAGNOSTICS num2 = NUMBER, row_count2 = ROW_COUNT;
      GET CURRENT DIAGNOSTICS CONDITION 1 cla_ori = CLASS_ORIGIN, sub_ori = SUBCLASS_ORIGIN, ret_sqlstate = RETURNED_SQLSTATE, mes_text = MESSAGE_TEXT, mysql_err = MYSQL_ERRNO;
	  GET STACKED DIAGNOSTICS CONDITION 1 cla_ori2 = CLASS_ORIGIN, sub_ori2 = SUBCLASS_ORIGIN, ret_sqlstate2 = RETURNED_SQLSTATE, mes_text2 = MESSAGE_TEXT, mysql_err2 = MYSQL_ERRNO;
      SELECT 'CURRENT DIAGNOSTICS',num 'NUMBER',row_count 'ROW_COUNT';
	  SELECT 'STACKED DIAGNOSTICS',num2 'NUMBER',row_count2 'ROW_COUNT';
	  SELECT 'CURRENT DIAGNOSTICS',cla_ori 'CLASS_ORIGIN', sub_ori 'SUBCLASS_ORIGIN', ret_sqlstate 'RETURNED_SQLSTATE', mes_text 'MESSAGE_TEXT', mysql_err 'MYSQL_ERRNO';
	  SELECT 'STACKED DIAGNOSTICS',cla_ori2 'CLASS_ORIGIN', sub_ori2 'SUBCLASS_ORIGIN', ret_sqlstate2 'RETURNED_SQLSTATE', mes_text2 'MESSAGE_TEXT', mysql_err2 'MYSQL_ERRNO';
  END;
  SELECT * FROM no_such_table8;
END;
//
CALL pro1()//
+---------------------+--------+-----------+
| CURRENT DIAGNOSTICS | NUMBER | ROW_COUNT |
+---------------------+--------+-----------+
+---------------------+--------+-----------+
| STACKED DIAGNOSTICS | NUMBER | ROW_COUNT |
+---------------------+--------+-----------+
+---------------------+--------------+-----------------+-------------------+-------------------------------------------+-------------+
| CURRENT DIAGNOSTICS | CLASS_ORIGIN | SUBCLASS_ORIGIN | RETURNED_SQLSTATE | MESSAGE_TEXT                              | MYSQL_ERRNO |
+---------------------+--------------+-----------------+-------------------+-------------------------------------------+-------------+
+---------------------+--------------+-----------------+-------------------+-------------------------------------------+-------------+
| STACKED DIAGNOSTICS | CLASS_ORIGIN | SUBCLASS_ORIGIN | RETURNED_SQLSTATE | MESSAGE_TEXT                              | MYSQL_ERRNO |
+---------------------+--------------+-----------------+-------------------+-------------------------------------------+-------------+
| CURRENT DIAGNOSTICS | 1      | -1        |
| STACKED DIAGNOSTICS | 1      | -1        |
| CURRENT DIAGNOSTICS | ISO 9075     | ISO 9075        | 42S02             | Table 'test.no_such_table8' doesn't exist | 1146        |
| STACKED DIAGNOSTICS | ISO 9075     | ISO 9075        | 42S02             | Table 'test.no_such_table8' doesn't exist | 1146        |
+---------------------+--------+-----------+
+---------------------+--------+-----------+
+---------------------+--------------+-----------------+-------------------+-------------------------------------------+-------------+
+---------------------+--------------+-----------------+-------------------+-------------------------------------------+-------------+
DROP PROCEDURE IF EXISTS pro1;//
CREATE PROCEDURE pro1 () DETERMINISTIC
BEGIN
  DECLARE num,num2 BINARY;
  DECLARE row_count,row_count2 SET('1');
  DECLARE cla_ori,cla_ori2 ENUM ('1');
  DECLARE sub_ori,sub_ori2 SET('1');
  DECLARE ret_sqlstate,ret_sqlstate2 ENUM ('1');
  DECLARE mes_text,mes_text2 SET('1');
  DECLARE mysql_err,mysql_err2 ENUM ('1');
  DECLARE CONTINUE HANDLER FOR SQLEXCEPTION
   BEGIN
      GET CURRENT DIAGNOSTICS num = NUMBER, row_count = ROW_COUNT;
	  GET STACKED DIAGNOSTICS num2 = NUMBER, row_count2 = ROW_COUNT;
      GET CURRENT DIAGNOSTICS CONDITION 1 cla_ori = CLASS_ORIGIN, sub_ori = SUBCLASS_ORIGIN, ret_sqlstate = RETURNED_SQLSTATE, mes_text = MESSAGE_TEXT, mysql_err = MYSQL_ERRNO;
	  GET STACKED DIAGNOSTICS CONDITION 1 cla_ori2 = CLASS_ORIGIN, sub_ori2 = SUBCLASS_ORIGIN, ret_sqlstate2 = RETURNED_SQLSTATE, mes_text2 = MESSAGE_TEXT, mysql_err2 = MYSQL_ERRNO;
      SELECT 'CURRENT DIAGNOSTICS',num 'NUMBER',row_count 'ROW_COUNT';
	  SELECT 'STACKED DIAGNOSTICS',num2 'NUMBER',row_count2 'ROW_COUNT';
	  SELECT 'CURRENT DIAGNOSTICS',cla_ori 'CLASS_ORIGIN', sub_ori 'SUBCLASS_ORIGIN', ret_sqlstate 'RETURNED_SQLSTATE', mes_text 'MESSAGE_TEXT', mysql_err 'MYSQL_ERRNO';
	  SELECT 'STACKED DIAGNOSTICS',cla_ori2 'CLASS_ORIGIN', sub_ori2 'SUBCLASS_ORIGIN', ret_sqlstate2 'RETURNED_SQLSTATE', mes_text2 'MESSAGE_TEXT', mysql_err2 'MYSQL_ERRNO';
  END;
  SELECT * FROM no_such_table9;
END;
//
CALL pro1()//
+---------------------+--------+-----------+
| CURRENT DIAGNOSTICS | NUMBER | ROW_COUNT |
+---------------------+--------+-----------+
+---------------------+--------+-----------+
| STACKED DIAGNOSTICS | NUMBER | ROW_COUNT |
+---------------------+--------+-----------+
+---------------------+--------------+-----------------+-------------------+--------------+-------------+
| CURRENT DIAGNOSTICS | CLASS_ORIGIN | SUBCLASS_ORIGIN | RETURNED_SQLSTATE | MESSAGE_TEXT | MYSQL_ERRNO |
+---------------------+--------------+-----------------+-------------------+--------------+-------------+
+---------------------+--------------+-----------------+-------------------+--------------+-------------+
| STACKED DIAGNOSTICS | CLASS_ORIGIN | SUBCLASS_ORIGIN | RETURNED_SQLSTATE | MESSAGE_TEXT | MYSQL_ERRNO |
+---------------------+--------------+-----------------+-------------------+--------------+-------------+
| CURRENT DIAGNOSTICS | 1      | NULL      |
| STACKED DIAGNOSTICS | 1      | NULL      |
| CURRENT DIAGNOSTICS | NULL         | NULL            | NULL              | NULL         | NULL        |
| STACKED DIAGNOSTICS | NULL         | NULL            | NULL              | NULL         | NULL        |
+---------------------+--------+-----------+
+---------------------+--------+-----------+
+---------------------+--------------+-----------------+-------------------+--------------+-------------+
+---------------------+--------------+-----------------+-------------------+--------------+-------------+
##日期时间类型
DROP PROCEDURE IF EXISTS pro1;//
CREATE PROCEDURE pro1 () DETERMINISTIC
BEGIN
  DECLARE num,num2 date;
  DECLARE row_count,row_count2 VARCHAR(200);
  DECLARE cla_ori,cla_ori2 time;
  DECLARE sub_ori,sub_ori2 year;
  DECLARE ret_sqlstate,ret_sqlstate2 datetime;
  DECLARE mes_text,mes_text2 timestamp;
  DECLARE mysql_err,mysql_err2 json;
  
  DECLARE CONTINUE HANDLER FOR SQLEXCEPTION
   BEGIN
      GET CURRENT DIAGNOSTICS num = NUMBER, row_count = ROW_COUNT;
	  GET STACKED DIAGNOSTICS num2 = NUMBER, row_count2 = ROW_COUNT;
      GET CURRENT DIAGNOSTICS CONDITION 1 cla_ori = CLASS_ORIGIN, sub_ori = SUBCLASS_ORIGIN, ret_sqlstate = RETURNED_SQLSTATE, mes_text = MESSAGE_TEXT, mysql_err = MYSQL_ERRNO;
	  GET STACKED DIAGNOSTICS CONDITION 1 cla_ori2 = CLASS_ORIGIN, sub_ori2 = SUBCLASS_ORIGIN, ret_sqlstate2 = RETURNED_SQLSTATE, mes_text2 = MESSAGE_TEXT, mysql_err2 = MYSQL_ERRNO;
      SELECT 'CURRENT DIAGNOSTICS',num 'NUMBER',row_count 'ROW_COUNT';
	  SELECT 'STACKED DIAGNOSTICS',num2 'NUMBER',row_count2 'ROW_COUNT';
	  SELECT 'CURRENT DIAGNOSTICS',cla_ori 'CLASS_ORIGIN', sub_ori 'SUBCLASS_ORIGIN', ret_sqlstate 'RETURNED_SQLSTATE', mes_text 'MESSAGE_TEXT', mysql_err 'MYSQL_ERRNO';
	  SELECT 'STACKED DIAGNOSTICS',cla_ori2 'CLASS_ORIGIN', sub_ori2 'SUBCLASS_ORIGIN', ret_sqlstate2 'RETURNED_SQLSTATE', mes_text2 'MESSAGE_TEXT', mysql_err2 'MYSQL_ERRNO';
  END;
  SELECT * FROM no_such_table8;
END;
//
CALL pro1()//
+---------------------+--------+-----------+
| CURRENT DIAGNOSTICS | NUMBER | ROW_COUNT |
+---------------------+--------+-----------+
+---------------------+--------+-----------+
| STACKED DIAGNOSTICS | NUMBER | ROW_COUNT |
+---------------------+--------+-----------+
+---------------------+--------------+-----------------+-------------------+--------------+-------------+
| CURRENT DIAGNOSTICS | CLASS_ORIGIN | SUBCLASS_ORIGIN | RETURNED_SQLSTATE | MESSAGE_TEXT | MYSQL_ERRNO |
+---------------------+--------------+-----------------+-------------------+--------------+-------------+
+---------------------+--------------+-----------------+-------------------+--------------+-------------+
| STACKED DIAGNOSTICS | CLASS_ORIGIN | SUBCLASS_ORIGIN | RETURNED_SQLSTATE | MESSAGE_TEXT | MYSQL_ERRNO |
+---------------------+--------------+-----------------+-------------------+--------------+-------------+
| CURRENT DIAGNOSTICS | NULL   | NULL      |
| STACKED DIAGNOSTICS | NULL   | NULL      |
| CURRENT DIAGNOSTICS | NULL         |            NULL | NULL              | NULL         | NULL        |
| STACKED DIAGNOSTICS | NULL         |            NULL | NULL              | NULL         | NULL        |
+---------------------+--------+-----------+
+---------------------+--------+-----------+
+---------------------+--------------+-----------------+-------------------+--------------+-------------+
+---------------------+--------------+-----------------+-------------------+--------------+-------------+
######################### 标签：diagnostics-1-3 基本语法 - 条件编号指示符 #########################
#### 标签：diagnostics-1-3-1 函数参数
SET @p21=NULL, @p22=NULL, @p23=NULL, @p24=NULL, @p25=NULL;//
DROP FUNCTION IF EXISTS fun1;//
CREATE FUNCTION fun1 (num int) RETURNS varchar(200) DETERMINISTIC 
BEGIN
  GET DIAGNOSTICS CONDITION num @p21 = CLASS_ORIGIN, @p22 = SUBCLASS_ORIGIN, @p23 = RETURNED_SQLSTATE, @p24 = MESSAGE_TEXT, @p25 = MYSQL_ERRNO;
  RETURN 'ok';
END;
//
UPDATE dia_table1 SET c2 = 'mysql-update' WHERE c1 = 1;//
SELECT fun1(1)//
+---------+
| fun1(1) |
+---------+
| ok      |
+---------+
Warnings:
Warning	1758	Invalid condition number
SELECT 'CURRENT DIAGNOSTICS',@p21 'CLASS_ORIGIN', @p22 'SUBCLASS_ORIGIN', @p23 'RETURNED_SQLSTATE', @p24 'MESSAGE_TEXT', @p25 'MYSQL_ERRNO'; //
+---------------------+--------------+-----------------+-------------------+--------------+-------------+
| CURRENT DIAGNOSTICS | CLASS_ORIGIN | SUBCLASS_ORIGIN | RETURNED_SQLSTATE | MESSAGE_TEXT | MYSQL_ERRNO |
+---------------------+--------------+-----------------+-------------------+--------------+-------------+
| CURRENT DIAGNOSTICS | NULL         | NULL            | NULL              | NULL         | NULL        |
+---------------------+--------------+-----------------+-------------------+--------------+-------------+
SET @p21=NULL, @p22=NULL, @p23=NULL, @p24=NULL, @p25=NULL,@p31=NULL, @p32=NULL, @p33=NULL, @p34=NULL, @p35=NULL;//
DROP FUNCTION IF EXISTS fun1;//
CREATE FUNCTION fun1 (num int) RETURNS varchar(200) DETERMINISTIC 
BEGIN
  DECLARE CONTINUE HANDLER FOR SQLEXCEPTION
  BEGIN
    GET DIAGNOSTICS CONDITION num @p21 = CLASS_ORIGIN, @p22 = SUBCLASS_ORIGIN, @p23 = RETURNED_SQLSTATE, @p24 = MESSAGE_TEXT, @p25 = MYSQL_ERRNO;
	GET STACKED DIAGNOSTICS CONDITION num @p31 = CLASS_ORIGIN, @p32 = SUBCLASS_ORIGIN, @p33 = RETURNED_SQLSTATE, @p34 = MESSAGE_TEXT, @p35 = MYSQL_ERRNO;
  END;  
  SELECT id into @p FROM no_such_table9;
  RETURN 'ok';
END;
//
SELECT fun1(1)//
+---------+
| fun1(1) |
+---------+
| ok      |
+---------+
SELECT 'CURRENT DIAGNOSTICS',@p21 'CLASS_ORIGIN', @p22 'SUBCLASS_ORIGIN', @p23 'RETURNED_SQLSTATE', @p24 'MESSAGE_TEXT', @p25 'MYSQL_ERRNO'; //
+---------------------+--------------+-----------------+-------------------+-------------------------------------------+-------------+
| CURRENT DIAGNOSTICS | CLASS_ORIGIN | SUBCLASS_ORIGIN | RETURNED_SQLSTATE | MESSAGE_TEXT                              | MYSQL_ERRNO |
+---------------------+--------------+-----------------+-------------------+-------------------------------------------+-------------+
| CURRENT DIAGNOSTICS | ISO 9075     | ISO 9075        | 42S02             | Table 'test.no_such_table9' doesn't exist | 1146        |
+---------------------+--------------+-----------------+-------------------+-------------------------------------------+-------------+
SELECT 'STACKED DIAGNOSTICS',@p31 'CLASS_ORIGIN', @p32 'SUBCLASS_ORIGIN', @p33 'RETURNED_SQLSTATE', @p34 'MESSAGE_TEXT', @p35 'MYSQL_ERRNO'; //
+---------------------+--------------+-----------------+-------------------+-------------------------------------------+-------------+
| STACKED DIAGNOSTICS | CLASS_ORIGIN | SUBCLASS_ORIGIN | RETURNED_SQLSTATE | MESSAGE_TEXT                              | MYSQL_ERRNO |
+---------------------+--------------+-----------------+-------------------+-------------------------------------------+-------------+
| STACKED DIAGNOSTICS | ISO 9075     | ISO 9075        | 42S02             | Table 'test.no_such_table9' doesn't exist | 1146        |
+---------------------+--------------+-----------------+-------------------+-------------------------------------------+-------------+
#### 标签：diagnostics-1-3-2 存储过程参数（in/inout）
SET @p21=NULL, @p22=NULL, @p23=NULL, @p24=NULL, @p25=NULL;//
DROP PROCEDURE IF EXISTS pro1;//
CREATE PROCEDURE pro1 (in num int) 
BEGIN
  UPDATE dia_table1 SET c2 = 'mysql-update' WHERE c1 = 1;
  GET DIAGNOSTICS CONDITION num @p21 = CLASS_ORIGIN, @p22 = SUBCLASS_ORIGIN, @p23 = RETURNED_SQLSTATE, @p24 = MESSAGE_TEXT, @p25 = MYSQL_ERRNO;
END;
//
CALL pro1(1)//
Warnings:
Warning	1758	Invalid condition number
SELECT @p21 'CLASS_ORIGIN', @p22 'SUBCLASS_ORIGIN', @p23 'RETURNED_SQLSTATE', @p24 'MESSAGE_TEXT', @p25 'MYSQL_ERRNO';//
+--------------+-----------------+-------------------+--------------+-------------+
| CLASS_ORIGIN | SUBCLASS_ORIGIN | RETURNED_SQLSTATE | MESSAGE_TEXT | MYSQL_ERRNO |
+--------------+-----------------+-------------------+--------------+-------------+
| NULL         | NULL            | NULL              | NULL         | NULL        |
+--------------+-----------------+-------------------+--------------+-------------+
SET @p21=NULL, @p22=NULL, @p23=NULL, @p24=NULL, @p25=NULL,@p31=NULL, @p32=NULL, @p33=NULL, @p34=NULL, @p35=NULL;//
DROP PROCEDURE IF EXISTS pro1;//
CREATE PROCEDURE pro1 (num int) DETERMINISTIC 
BEGIN
  DECLARE CONTINUE HANDLER FOR SQLEXCEPTION
  BEGIN
    GET DIAGNOSTICS CONDITION num @p21 = CLASS_ORIGIN, @p22 = SUBCLASS_ORIGIN, @p23 = RETURNED_SQLSTATE, @p24 = MESSAGE_TEXT, @p25 = MYSQL_ERRNO;
	GET STACKED DIAGNOSTICS CONDITION num @p31 = CLASS_ORIGIN, @p32 = SUBCLASS_ORIGIN, @p33 = RETURNED_SQLSTATE, @p34 = MESSAGE_TEXT, @p35 = MYSQL_ERRNO;
  END;  
  SELECT * FROM no_such_table10;
END;
//
CALL pro1(1)//
SELECT 'CURRENT DIAGNOSTICS',@p21 'CLASS_ORIGIN', @p22 'SUBCLASS_ORIGIN', @p23 'RETURNED_SQLSTATE', @p24 'MESSAGE_TEXT', @p25 'MYSQL_ERRNO'; //
+---------------------+--------------+-----------------+-------------------+--------------------------------------------+-------------+
| CURRENT DIAGNOSTICS | CLASS_ORIGIN | SUBCLASS_ORIGIN | RETURNED_SQLSTATE | MESSAGE_TEXT                               | MYSQL_ERRNO |
+---------------------+--------------+-----------------+-------------------+--------------------------------------------+-------------+
| CURRENT DIAGNOSTICS | ISO 9075     | ISO 9075        | 42S02             | Table 'test.no_such_table10' doesn't exist | 1146        |
+---------------------+--------------+-----------------+-------------------+--------------------------------------------+-------------+
SELECT 'STACKED DIAGNOSTICS',@p31 'CLASS_ORIGIN', @p32 'SUBCLASS_ORIGIN', @p33 'RETURNED_SQLSTATE', @p34 'MESSAGE_TEXT', @p35 'MYSQL_ERRNO'; //
+---------------------+--------------+-----------------+-------------------+--------------------------------------------+-------------+
| STACKED DIAGNOSTICS | CLASS_ORIGIN | SUBCLASS_ORIGIN | RETURNED_SQLSTATE | MESSAGE_TEXT                               | MYSQL_ERRNO |
+---------------------+--------------+-----------------+-------------------+--------------------------------------------+-------------+
| STACKED DIAGNOSTICS | ISO 9075     | ISO 9075        | 42S02             | Table 'test.no_such_table10' doesn't exist | 1146        |
+---------------------+--------------+-----------------+-------------------+--------------------------------------------+-------------+
SET @p21=NULL, @p22=NULL, @p23=NULL, @p24=NULL, @p25=NULL,@p31=NULL, @p32=NULL, @p33=NULL, @p34=NULL, @p35=NULL;//
DROP PROCEDURE IF EXISTS pro1;//
CREATE PROCEDURE pro1 (inout num int) DETERMINISTIC 
BEGIN
  DECLARE CONTINUE HANDLER FOR SQLEXCEPTION
  BEGIN
    GET DIAGNOSTICS CONDITION num @p21 = CLASS_ORIGIN, @p22 = SUBCLASS_ORIGIN, @p23 = RETURNED_SQLSTATE, @p24 = MESSAGE_TEXT, @p25 = MYSQL_ERRNO;
	GET STACKED DIAGNOSTICS CONDITION num @p31 = CLASS_ORIGIN, @p32 = SUBCLASS_ORIGIN, @p33 = RETURNED_SQLSTATE, @p34 = MESSAGE_TEXT, @p35 = MYSQL_ERRNO;
    GET DIAGNOSTICS num = NUMBER;
  END;  
  SELECT * FROM no_such_table11;
END;
//
SET @num=1;//
CALL pro1(@num)//
SELECT @num;//
+------+
| @num |
+------+
|    1 |
+------+
SELECT 'CURRENT DIAGNOSTICS',@p21 'CLASS_ORIGIN', @p22 'SUBCLASS_ORIGIN', @p23 'RETURNED_SQLSTATE', @p24 'MESSAGE_TEXT', @p25 'MYSQL_ERRNO'; //
+---------------------+--------------+-----------------+-------------------+--------------------------------------------+-------------+
| CURRENT DIAGNOSTICS | CLASS_ORIGIN | SUBCLASS_ORIGIN | RETURNED_SQLSTATE | MESSAGE_TEXT                               | MYSQL_ERRNO |
+---------------------+--------------+-----------------+-------------------+--------------------------------------------+-------------+
| CURRENT DIAGNOSTICS | ISO 9075     | ISO 9075        | 42S02             | Table 'test.no_such_table11' doesn't exist | 1146        |
+---------------------+--------------+-----------------+-------------------+--------------------------------------------+-------------+
SELECT 'STACKED DIAGNOSTICS',@p31 'CLASS_ORIGIN', @p32 'SUBCLASS_ORIGIN', @p33 'RETURNED_SQLSTATE', @p34 'MESSAGE_TEXT', @p35 'MYSQL_ERRNO'; //
+---------------------+--------------+-----------------+-------------------+--------------------------------------------+-------------+
| STACKED DIAGNOSTICS | CLASS_ORIGIN | SUBCLASS_ORIGIN | RETURNED_SQLSTATE | MESSAGE_TEXT                               | MYSQL_ERRNO |
+---------------------+--------------+-----------------+-------------------+--------------------------------------------+-------------+
| STACKED DIAGNOSTICS | ISO 9075     | ISO 9075        | 42S02             | Table 'test.no_such_table11' doesn't exist | 1146        |
+---------------------+--------------+-----------------+-------------------+--------------------------------------------+-------------+
#### 标签：diagnostics-1-3-3 DECLARE声明的局部变量
SET @p21=NULL, @p22=NULL, @p23=NULL, @p24=NULL, @p25=NULL;//
DROP PROCEDURE IF EXISTS pro1;//
CREATE PROCEDURE pro1 () DETERMINISTIC
BEGIN
  DECLARE num int;
  SET num := 1; 
  GET DIAGNOSTICS CONDITION num @p21 = CLASS_ORIGIN, @p22 = SUBCLASS_ORIGIN, @p23 = RETURNED_SQLSTATE, @p24 = MESSAGE_TEXT, @p25 = MYSQL_ERRNO;
END;
//
UPDATE dia_table1 SET c2 = 'mysql-update' WHERE c1 = 1;//
CALL pro1()//
Warnings:
Warning	1758	Invalid condition number
SELECT @p21 'CLASS_ORIGIN', @p22 'SUBCLASS_ORIGIN', @p23 'RETURNED_SQLSTATE', @p24 'MESSAGE_TEXT', @p25 'MYSQL_ERRNO';//
+--------------+-----------------+-------------------+--------------+-------------+
| CLASS_ORIGIN | SUBCLASS_ORIGIN | RETURNED_SQLSTATE | MESSAGE_TEXT | MYSQL_ERRNO |
+--------------+-----------------+-------------------+--------------+-------------+
| NULL         | NULL            | NULL              | NULL         | NULL        |
+--------------+-----------------+-------------------+--------------+-------------+
SET @p21=NULL, @p22=NULL, @p23=NULL, @p24=NULL, @p25=NULL,@p31=NULL, @p32=NULL, @p33=NULL, @p34=NULL, @p35=NULL;//
DROP PROCEDURE IF EXISTS pro1;//
CREATE PROCEDURE pro1 () DETERMINISTIC 
BEGIN
  DECLARE num int DEFAULT 1;
  DECLARE CONTINUE HANDLER FOR SQLEXCEPTION
  BEGIN
    GET DIAGNOSTICS CONDITION num @p21 = CLASS_ORIGIN, @p22 = SUBCLASS_ORIGIN, @p23 = RETURNED_SQLSTATE, @p24 = MESSAGE_TEXT, @p25 = MYSQL_ERRNO;
	GET STACKED DIAGNOSTICS CONDITION num @p31 = CLASS_ORIGIN, @p32 = SUBCLASS_ORIGIN, @p33 = RETURNED_SQLSTATE, @p34 = MESSAGE_TEXT, @p35 = MYSQL_ERRNO;
  END;  
  SELECT * FROM no_such_table11;
END;
//
CALL pro1()//
SELECT 'CURRENT DIAGNOSTICS',@p21 'CLASS_ORIGIN', @p22 'SUBCLASS_ORIGIN', @p23 'RETURNED_SQLSTATE', @p24 'MESSAGE_TEXT', @p25 'MYSQL_ERRNO'; //
+---------------------+--------------+-----------------+-------------------+--------------------------------------------+-------------+
| CURRENT DIAGNOSTICS | CLASS_ORIGIN | SUBCLASS_ORIGIN | RETURNED_SQLSTATE | MESSAGE_TEXT                               | MYSQL_ERRNO |
+---------------------+--------------+-----------------+-------------------+--------------------------------------------+-------------+
| CURRENT DIAGNOSTICS | ISO 9075     | ISO 9075        | 42S02             | Table 'test.no_such_table11' doesn't exist | 1146        |
+---------------------+--------------+-----------------+-------------------+--------------------------------------------+-------------+
SELECT 'STACKED DIAGNOSTICS',@p31 'CLASS_ORIGIN', @p32 'SUBCLASS_ORIGIN', @p33 'RETURNED_SQLSTATE', @p34 'MESSAGE_TEXT', @p35 'MYSQL_ERRNO'; //
+---------------------+--------------+-----------------+-------------------+--------------------------------------------+-------------+
| STACKED DIAGNOSTICS | CLASS_ORIGIN | SUBCLASS_ORIGIN | RETURNED_SQLSTATE | MESSAGE_TEXT                               | MYSQL_ERRNO |
+---------------------+--------------+-----------------+-------------------+--------------------------------------------+-------------+
| STACKED DIAGNOSTICS | ISO 9075     | ISO 9075        | 42S02             | Table 'test.no_such_table11' doesn't exist | 1146        |
+---------------------+--------------+-----------------+-------------------+--------------------------------------------+-------------+
#### 标签：diagnostics-1-3-4 用户定义的变量
SET @p21=NULL, @p22=NULL, @p23=NULL, @p24=NULL, @p25=NULL;//
DROP PROCEDURE IF EXISTS pro1;//
CREATE PROCEDURE pro1 () 
BEGIN
  GET DIAGNOSTICS CONDITION @num @p21 = CLASS_ORIGIN, @p22 = SUBCLASS_ORIGIN, @p23 = RETURNED_SQLSTATE, @p24 = MESSAGE_TEXT, @p25 = MYSQL_ERRNO;
END;
//
SET @num=1;//
UPDATE dia_table1 SET c2 = 'mysql-update' WHERE c1 = 1;//
CALL pro1()//
Warnings:
Warning	1758	Invalid condition number
SELECT @p21 'CLASS_ORIGIN', @p22 'SUBCLASS_ORIGIN', @p23 'RETURNED_SQLSTATE', @p24 'MESSAGE_TEXT', @p25 'MYSQL_ERRNO';//
+--------------+-----------------+-------------------+--------------+-------------+
| CLASS_ORIGIN | SUBCLASS_ORIGIN | RETURNED_SQLSTATE | MESSAGE_TEXT | MYSQL_ERRNO |
+--------------+-----------------+-------------------+--------------+-------------+
| NULL         | NULL            | NULL              | NULL         | NULL        |
+--------------+-----------------+-------------------+--------------+-------------+
SET @p21=NULL, @p22=NULL, @p23=NULL, @p24=NULL, @p25=NULL,@p31=NULL, @p32=NULL, @p33=NULL, @p34=NULL, @p35=NULL;//
DROP PROCEDURE IF EXISTS pro1;//
CREATE PROCEDURE pro1() DETERMINISTIC 
BEGIN
  DECLARE CONTINUE HANDLER FOR SQLEXCEPTION
  BEGIN
    GET DIAGNOSTICS CONDITION @num @p21 = CLASS_ORIGIN, @p22 = SUBCLASS_ORIGIN, @p23 = RETURNED_SQLSTATE, @p24 = MESSAGE_TEXT, @p25 = MYSQL_ERRNO;
	GET STACKED DIAGNOSTICS CONDITION @num @p31 = CLASS_ORIGIN, @p32 = SUBCLASS_ORIGIN, @p33 = RETURNED_SQLSTATE, @p34 = MESSAGE_TEXT, @p35 = MYSQL_ERRNO;
  END;  
  SELECT * FROM no_such_table12;
END;
//
SET @num=1;//
CALL pro1()//
SELECT 'CURRENT DIAGNOSTICS',@p21 'CLASS_ORIGIN', @p22 'SUBCLASS_ORIGIN', @p23 'RETURNED_SQLSTATE', @p24 'MESSAGE_TEXT', @p25 'MYSQL_ERRNO'; //
+---------------------+--------------+-----------------+-------------------+--------------------------------------------+-------------+
| CURRENT DIAGNOSTICS | CLASS_ORIGIN | SUBCLASS_ORIGIN | RETURNED_SQLSTATE | MESSAGE_TEXT                               | MYSQL_ERRNO |
+---------------------+--------------+-----------------+-------------------+--------------------------------------------+-------------+
| CURRENT DIAGNOSTICS | ISO 9075     | ISO 9075        | 42S02             | Table 'test.no_such_table12' doesn't exist | 1146        |
+---------------------+--------------+-----------------+-------------------+--------------------------------------------+-------------+
SELECT 'STACKED DIAGNOSTICS',@p31 'CLASS_ORIGIN', @p32 'SUBCLASS_ORIGIN', @p33 'RETURNED_SQLSTATE', @p34 'MESSAGE_TEXT', @p35 'MYSQL_ERRNO'; //
+---------------------+--------------+-----------------+-------------------+--------------------------------------------+-------------+
| STACKED DIAGNOSTICS | CLASS_ORIGIN | SUBCLASS_ORIGIN | RETURNED_SQLSTATE | MESSAGE_TEXT                               | MYSQL_ERRNO |
+---------------------+--------------+-----------------+-------------------+--------------------------------------------+-------------+
| STACKED DIAGNOSTICS | ISO 9075     | ISO 9075        | 42S02             | Table 'test.no_such_table12' doesn't exist | 1146        |
+---------------------+--------------+-----------------+-------------------+--------------------------------------------+-------------+
#### 标签：diagnostics-1-3-5 字面量
## ''/' '/null/false
# bug4:GET DIAGNOSTICS 诊断语句,条件编号指示符值是''/' '/null/false时，mysql警告，ob报错。 
SET @p11=NULL, @p12=NULL, @p21=NULL, @p22=NULL, @p31=NULL,@p32=NULL, @p41=NULL, @p42=NULL, @p51=NULL, @p52=NULL, @p61=NULL, @p62=NULL;//
DROP PROCEDURE IF EXISTS pro1;//
CREATE PROCEDURE pro1 () DETERMINISTIC 
BEGIN
  DECLARE CONTINUE HANDLER FOR SQLEXCEPTION
  BEGIN
    GET CURRENT DIAGNOSTICS CONDITION '' @p11 = RETURNED_SQLSTATE, @p12 = MESSAGE_TEXT;
    GET CURRENT DIAGNOSTICS CONDITION ' ' @p21 = RETURNED_SQLSTATE, @p22 = MESSAGE_TEXT;
    GET CURRENT DIAGNOSTICS CONDITION null @p31 = RETURNED_SQLSTATE, @p32 = MESSAGE_TEXT;
	GET CURRENT DIAGNOSTICS CONDITION false @p31 = RETURNED_SQLSTATE, @p32 = MESSAGE_TEXT;
    GET STACKED DIAGNOSTICS CONDITION '' @p41 = RETURNED_SQLSTATE, @p42 = MESSAGE_TEXT;
    GET STACKED DIAGNOSTICS CONDITION ' ' @p51 = RETURNED_SQLSTATE, @p52 = MESSAGE_TEXT;
    GET STACKED DIAGNOSTICS CONDITION null @p61 = RETURNED_SQLSTATE, @p62 = MESSAGE_TEXT;
	GET STACKED DIAGNOSTICS CONDITION false @p61 = RETURNED_SQLSTATE, @p62 = MESSAGE_TEXT;
    show warnings;
  END;  
  SELECT * FROM no_such_table13;
END;
//
ERROR 42000: You have an error in your SQL syntax; check the manual that corresponds to your OceanBase version for the right syntax to use near 'GET CURRENT DIAGNOSTICS CONDITION null @p31 = RETURNED_SQLSTATE, @p32 = MESSAGE_TEXT' at line 7
CALL pro1()//
ERROR 42000: procedure test.pro1 does not exist
SELECT * FROM no_such_table13;//
ERROR 42S02: Table 'test.no_such_table13' doesn't exist
GET CURRENT DIAGNOSTICS CONDITION ''  @p11 = RETURNED_SQLSTATE, @p12 = MESSAGE_TEXT;//
Warnings:
Error	1146	Table 'test.no_such_table13' doesn't exist
Warning	1758	Invalid condition number
GET CURRENT DIAGNOSTICS CONDITION ' ' @p21 = RETURNED_SQLSTATE, @p22 = MESSAGE_TEXT;//
Warnings:
Error	1146	Table 'test.no_such_table13' doesn't exist
Warning	1758	Invalid condition number
Warning	1758	Invalid condition number
GET CURRENT DIAGNOSTICS CONDITION null @p31 = RETURNED_SQLSTATE, @p32 = MESSAGE_TEXT;//
ERROR 42000: You have an error in your SQL syntax; check the manual that corresponds to your OceanBase version for the right syntax to use near 'null @p31 = RETURNED_SQLSTATE, @p32 = MESSAGE_TEXT;' at line 1
GET CURRENT DIAGNOSTICS CONDITION false @p11 = RETURNED_SQLSTATE, @p12 = MESSAGE_TEXT;//
Warnings:
Error	1064	You have an error in your SQL syntax; check the manual that corresponds to your OceanBase version for the right syntax to use near 'null @p31 = RETURNED_SQLSTATE, @p32 = MESSAGE_TEXT;' at line 1
Warning	1758	Invalid condition number
show warnings;//
Level	Code	Message
Error	1064	You have an error in your SQL syntax; check the manual that corresponds to your OceanBase version for the right syntax to use near 'null @p31 = RETURNED_SQLSTATE, @p32 = MESSAGE_TEXT;' at line 1
Warning	1758	Invalid condition number
## 布尔值(true)
# bug5:GET DIAGNOSTICS 诊断语句,条件编号指示符值是true时，mysql成功，ob失败。 
SET @p11=NULL, @p12=NULL, @p21=NULL, @p22=NULL;//
DROP PROCEDURE IF EXISTS pro1;//
CREATE PROCEDURE pro1 () DETERMINISTIC 
BEGIN
  DECLARE CONTINUE HANDLER FOR SQLEXCEPTION
  BEGIN
    GET CURRENT DIAGNOSTICS CONDITION true @p11 = RETURNED_SQLSTATE, @p12 = MESSAGE_TEXT;
    GET STACKED DIAGNOSTICS CONDITION true @p21 = RETURNED_SQLSTATE, @p22 = MESSAGE_TEXT;
    show warnings;
  END;  
  SELECT * FROM no_such_table14;
END;
//
CALL pro1()//
+-------+------+--------------------------------------------+
| Level | Code | Message                                    |
+-------+------+--------------------------------------------+
| Error | 1146 | Table 'test.no_such_table14' doesn't exist |
+-------+------+--------------------------------------------+
SELECT 'CURRENT DIAGNOSTICS',@p11 'RETURNED_SQLSTATE', @p12 'MESSAGE_TEXT';//
+---------------------+-------------------+--------------------------------------------+
| CURRENT DIAGNOSTICS | RETURNED_SQLSTATE | MESSAGE_TEXT                               |
+---------------------+-------------------+--------------------------------------------+
| CURRENT DIAGNOSTICS | 42S02             | Table 'test.no_such_table14' doesn't exist |
+---------------------+-------------------+--------------------------------------------+
SELECT 'STACKED DIAGNOSTICS',@p21 'RETURNED_SQLSTATE', @p22 'MESSAGE_TEXT';//
+---------------------+-------------------+--------------------------------------------+
| STACKED DIAGNOSTICS | RETURNED_SQLSTATE | MESSAGE_TEXT                               |
+---------------------+-------------------+--------------------------------------------+
| STACKED DIAGNOSTICS | 42S02             | Table 'test.no_such_table14' doesn't exist |
+---------------------+-------------------+--------------------------------------------+
SET @p11=NULL, @p12=NULL, @p21=NULL, @p22=NULL;//
DROP PROCEDURE IF EXISTS pro1;//
CREATE PROCEDURE pro1 () DETERMINISTIC 
BEGIN
  DECLARE CONTINUE HANDLER FOR SQLEXCEPTION
  BEGIN
    GET CURRENT DIAGNOSTICS CONDITION 'a' @p11 = RETURNED_SQLSTATE, @p12 = MESSAGE_TEXT;
    GET CURRENT DIAGNOSTICS CONDITION 'a1 ' @p11 = RETURNED_SQLSTATE, @p12 = MESSAGE_TEXT;
	GET CURRENT DIAGNOSTICS CONDITION 'ａ' @p11 = RETURNED_SQLSTATE, @p12 = MESSAGE_TEXT;
	GET CURRENT DIAGNOSTICS CONDITION '&' @p11 = RETURNED_SQLSTATE, @p12 = MESSAGE_TEXT;
	GET CURRENT DIAGNOSTICS CONDITION '\n' @p11 = RETURNED_SQLSTATE, @p12 = MESSAGE_TEXT;
	GET CURRENT DIAGNOSTICS CONDITION '三' @p11 = RETURNED_SQLSTATE, @p12 = MESSAGE_TEXT;
	GET CURRENT DIAGNOSTICS CONDITION '@' @p11 = RETURNED_SQLSTATE, @p12 = MESSAGE_TEXT;
	GET STACKED DIAGNOSTICS CONDITION 'A' @p21 = RETURNED_SQLSTATE, @p22 = MESSAGE_TEXT;
	GET STACKED DIAGNOSTICS CONDITION 'A1 ' @p21 = RETURNED_SQLSTATE, @p22 = MESSAGE_TEXT;
	GET STACKED DIAGNOSTICS CONDITION 'a ' @p21 = RETURNED_SQLSTATE, @p22 = MESSAGE_TEXT;
	GET STACKED DIAGNOSTICS CONDITION '$' @p21 = RETURNED_SQLSTATE, @p22 = MESSAGE_TEXT;
    GET STACKED DIAGNOSTICS CONDITION '\t' @p21 = RETURNED_SQLSTATE, @p22 = MESSAGE_TEXT;
    GET STACKED DIAGNOSTICS CONDITION '四' @p21 = RETURNED_SQLSTATE, @p22 = MESSAGE_TEXT;
    GET STACKED DIAGNOSTICS CONDITION '！' @p21 = RETURNED_SQLSTATE, @p22 = MESSAGE_TEXT;
   	show warnings;
  END;  
  SELECT * FROM no_such_table15;
END;
//
CALL pro1()//
+---------+------+--------------------------------------------+
| Level   | Code | Message                                    |
+---------+------+--------------------------------------------+
| Error   | 1146 | Table 'test.no_such_table15' doesn't exist |
| Warning | 1758 | Invalid condition number                   |
| Warning | 1758 | Invalid condition number                   |
| Warning | 1758 | Invalid condition number                   |
| Warning | 1758 | Invalid condition number                   |
| Warning | 1758 | Invalid condition number                   |
| Warning | 1758 | Invalid condition number                   |
| Warning | 1758 | Invalid condition number                   |
| Warning | 1758 | Invalid condition number                   |
| Warning | 1758 | Invalid condition number                   |
| Warning | 1758 | Invalid condition number                   |
| Warning | 1758 | Invalid condition number                   |
| Warning | 1758 | Invalid condition number                   |
| Warning | 1758 | Invalid condition number                   |
| Warning | 1758 | Invalid condition number                   |
+---------+------+--------------------------------------------+
Warnings:
Warning	1758	Invalid condition number
Warning	1758	Invalid condition number
Warning	1758	Invalid condition number
Warning	1758	Invalid condition number
Warning	1758	Invalid condition number
Warning	1758	Invalid condition number
Warning	1758	Invalid condition number
Warning	1758	Invalid condition number
Warning	1758	Invalid condition number
Warning	1758	Invalid condition number
Warning	1758	Invalid condition number
Warning	1758	Invalid condition number
Warning	1758	Invalid condition number
Warning	1758	Invalid condition number
### 数字 
## 整数 (0)
# bug6:GET DIAGNOSTICS 诊断语句,条件编号指示符值是0时，mysql警告，ob报错。 
SET @p11=NULL, @p12=NULL, @p21=NULL, @p22=NULL;//
DROP PROCEDURE IF EXISTS pro1;//
CREATE PROCEDURE pro1 () DETERMINISTIC 
BEGIN
  DECLARE CONTINUE HANDLER FOR SQLEXCEPTION
  BEGIN
    GET CURRENT DIAGNOSTICS CONDITION 0 @p11 = RETURNED_SQLSTATE, @p12 = MESSAGE_TEXT;
	GET STACKED DIAGNOSTICS CONDITION 0 @p21 = RETURNED_SQLSTATE, @p22 = MESSAGE_TEXT;
   	show warnings;
  END;  
  SELECT * FROM no_such_table16;
END;
//
CALL pro1()//
+---------+------+--------------------------------------------+
| Level   | Code | Message                                    |
+---------+------+--------------------------------------------+
| Error   | 1146 | Table 'test.no_such_table16' doesn't exist |
| Warning | 1758 | Invalid condition number                   |
| Warning | 1758 | Invalid condition number                   |
+---------+------+--------------------------------------------+
Warnings:
Warning	1758	Invalid condition number
Warning	1758	Invalid condition number
SELECT * FROM no_such_table16;//
ERROR 42S02: Table 'test.no_such_table16' doesn't exist
GET CURRENT DIAGNOSTICS CONDITION 0 @p11 = RETURNED_SQLSTATE, @p12 = MESSAGE_TEXT;//
Warnings:
Error	1146	Table 'test.no_such_table16' doesn't exist
Warning	1758	Invalid condition number
## 整数 (1)
SET @p13=NULL, @p14=NULL,@p23=NULL, @p24=NULL;//
DROP PROCEDURE IF EXISTS pro1;//
CREATE PROCEDURE pro1 () DETERMINISTIC 
BEGIN
  DECLARE CONTINUE HANDLER FOR SQLEXCEPTION
  BEGIN
    GET CURRENT DIAGNOSTICS CONDITION 1 @p13 = RETURNED_SQLSTATE, @p14 = MESSAGE_TEXT;
	GET STACKED DIAGNOSTICS CONDITION 1 @p23 = RETURNED_SQLSTATE, @p24 = MESSAGE_TEXT;
   	show warnings;
  END;  
  SELECT * FROM no_such_table17;
END;
//
CALL pro1()//
+-------+------+--------------------------------------------+
| Level | Code | Message                                    |
+-------+------+--------------------------------------------+
| Error | 1146 | Table 'test.no_such_table17' doesn't exist |
+-------+------+--------------------------------------------+
SELECT 'CURRENT DIAGNOSTICS', @p13, @p14;//
+---------------------+-------+--------------------------------------------+
| CURRENT DIAGNOSTICS | @p13  | @p14                                       |
+---------------------+-------+--------------------------------------------+
| CURRENT DIAGNOSTICS | 42S02 | Table 'test.no_such_table17' doesn't exist |
+---------------------+-------+--------------------------------------------+
SELECT 'STACKED DIAGNOSTICS', @p23, @p24;//
+---------------------+-------+--------------------------------------------+
| STACKED DIAGNOSTICS | @p23  | @p24                                       |
+---------------------+-------+--------------------------------------------+
| STACKED DIAGNOSTICS | 42S02 | Table 'test.no_such_table17' doesn't exist |
+---------------------+-------+--------------------------------------------+
## 整数 > NUMBER(条件区域的数量)
# bug7:GET DIAGNOSTICS 诊断语句,条件编号指示符的值 > NUMBER(条件区域的数量)时，mysql与ob结果不一致。
SET @p15=NULL, @p16=NULL, @p25=NULL, @p26=NULL;//
DROP PROCEDURE IF EXISTS pro1;//
CREATE PROCEDURE pro1 () DETERMINISTIC 
BEGIN
  DECLARE CONTINUE HANDLER FOR SQLEXCEPTION
  BEGIN
	GET CURRENT DIAGNOSTICS CONDITION 100 @p15 = RETURNED_SQLSTATE, @p16 = MESSAGE_TEXT;
	GET STACKED DIAGNOSTICS CONDITION 100 @p25 = RETURNED_SQLSTATE, @p26 = MESSAGE_TEXT;
   	show warnings;
	GET CURRENT DIAGNOSTICS @cur_number = NUMBER;
	GET STACKED DIAGNOSTICS @sta_number = NUMBER;
  END;  
  SELECT * FROM no_such_table18;
END;
//
CALL pro1()//
+---------+------+--------------------------------------------+
| Level   | Code | Message                                    |
+---------+------+--------------------------------------------+
| Error   | 1146 | Table 'test.no_such_table18' doesn't exist |
| Warning | 1758 | Invalid condition number                   |
| Warning | 1758 | Invalid condition number                   |
+---------+------+--------------------------------------------+
Warnings:
Warning	1758	Invalid condition number
Warning	1758	Invalid condition number
SELECT 'CURRENT DIAGNOSTICS',@cur_number 'NUMBER', @p15 'RETURNED_SQLSTATE', @p16 'MESSAGE_TEXT';//
+---------------------+--------+-------------------+--------------+
| CURRENT DIAGNOSTICS | NUMBER | RETURNED_SQLSTATE | MESSAGE_TEXT |
+---------------------+--------+-------------------+--------------+
| CURRENT DIAGNOSTICS |      3 | NULL              | NULL         |
+---------------------+--------+-------------------+--------------+
SELECT 'STACKED DIAGNOSTICS',@sta_number 'NUMBER', @p25 'RETURNED_SQLSTATE', @p26 'MESSAGE_TEXT';//
+---------------------+--------+-------------------+--------------+
| STACKED DIAGNOSTICS | NUMBER | RETURNED_SQLSTATE | MESSAGE_TEXT |
+---------------------+--------+-------------------+--------------+
| STACKED DIAGNOSTICS |      1 | NULL              | NULL         |
+---------------------+--------+-------------------+--------------+
## 小数
# bug8:GET DIAGNOSTICS 诊断语句,条件编号指示符的值小数时，mysql成功，ob失败。 
SET @p11=NULL, @p12=NULL, @p13=NULL, @p14=NULL,@p21=NULL, @p22=NULL, @p23=NULL, @p24=NULL;//
DROP PROCEDURE IF EXISTS pro1;//
CREATE PROCEDURE pro1 () DETERMINISTIC 
BEGIN
  DECLARE CONTINUE HANDLER FOR SQLEXCEPTION
  BEGIN
	GET CURRENT DIAGNOSTICS CONDITION 1.4 @p11 = RETURNED_SQLSTATE, @p12 = MESSAGE_TEXT;
	GET CURRENT DIAGNOSTICS CONDITION 1.5 @p13 = RETURNED_SQLSTATE, @p14 = MESSAGE_TEXT;
	GET STACKED DIAGNOSTICS CONDITION 1.4 @p21 = RETURNED_SQLSTATE, @p22 = MESSAGE_TEXT;
	GET STACKED DIAGNOSTICS CONDITION 1.5 @p23 = RETURNED_SQLSTATE, @p24 = MESSAGE_TEXT;
   	show warnings;
	GET CURRENT DIAGNOSTICS @cur_number = NUMBER;
	GET STACKED DIAGNOSTICS @sta_number = NUMBER;
  END;  
  SELECT * FROM no_such_table19;
END;
//
ERROR 42000: You have an error in your SQL syntax; check the manual that corresponds to your OceanBase version for the right syntax to use near 'GET CURRENT DIAGNOSTICS CONDITION 1.4 @p11 = RETURNED_SQLSTATE, @p12 = MESSAGE_TEXT' at line 5
CALL pro1()//
ERROR 42000: procedure test.pro1 does not exist
SELECT 'CURRENT DIAGNOSTICS CONDITION 1.4',@cur_number 'NUMBER', @p11, @p12;//
+-----------------------------------+--------+------+------+
| CURRENT DIAGNOSTICS CONDITION 1.4 | NUMBER | @p11 | @p12 |
+-----------------------------------+--------+------+------+
| CURRENT DIAGNOSTICS CONDITION 1.4 |      3 | NULL | NULL |
+-----------------------------------+--------+------+------+
SELECT 'CURRENT DIAGNOSTICS CONDITION 1.5',@cur_number 'NUMBER', @p13, @p14;//
+-----------------------------------+--------+------+------+
| CURRENT DIAGNOSTICS CONDITION 1.5 | NUMBER | @p13 | @p14 |
+-----------------------------------+--------+------+------+
| CURRENT DIAGNOSTICS CONDITION 1.5 |      3 | NULL | NULL |
+-----------------------------------+--------+------+------+
SELECT 'STACKED DIAGNOSTICS CONDITION 1.4',@sta_number 'NUMBER', @p21, @p22;//
+-----------------------------------+--------+------+------+
| STACKED DIAGNOSTICS CONDITION 1.4 | NUMBER | @p21 | @p22 |
+-----------------------------------+--------+------+------+
| STACKED DIAGNOSTICS CONDITION 1.4 |      1 | NULL | NULL |
+-----------------------------------+--------+------+------+
SELECT 'STACKED DIAGNOSTICS CONDITION 1.5',@sta_number 'NUMBER', @p23, @p24;//
+-----------------------------------+--------+------+------+
| STACKED DIAGNOSTICS CONDITION 1.5 | NUMBER | @p23 | @p24 |
+-----------------------------------+--------+------+------+
| STACKED DIAGNOSTICS CONDITION 1.5 |      1 | NULL | NULL |
+-----------------------------------+--------+------+------+
SELECT * FROM no_such_table19;//
ERROR 42S02: Table 'test.no_such_table19' doesn't exist
GET CURRENT DIAGNOSTICS CONDITION 1.4 @p15 = RETURNED_SQLSTATE, @p16 = MESSAGE_TEXT;//
ERROR 42000: You have an error in your SQL syntax; check the manual that corresponds to your OceanBase version for the right syntax to use near '1.4 @p15 = RETURNED_SQLSTATE, @p16 = MESSAGE_TEXT;' at line 1
GET CURRENT DIAGNOSTICS CONDITION 1.7 @p15 = RETURNED_SQLSTATE, @p16 = MESSAGE_TEXT;//
ERROR 42000: You have an error in your SQL syntax; check the manual that corresponds to your OceanBase version for the right syntax to use near '1.7 @p15 = RETURNED_SQLSTATE, @p16 = MESSAGE_TEXT;' at line 1
show warnings;//
Level	Code	Message
Error	1064	You have an error in your SQL syntax; check the manual that corresponds to your OceanBase version for the right syntax to use near '1.7 @p15 = RETURNED_SQLSTATE, @p16 = MESSAGE_TEXT;' at line 1
## 负数
SET @p11=NULL, @p12=NULL,@p21=NULL, @p22=NULL;//
DROP PROCEDURE IF EXISTS pro1;//
CREATE PROCEDURE pro1 () DETERMINISTIC 
BEGIN
  DECLARE CONTINUE HANDLER FOR SQLEXCEPTION
  BEGIN
	GET CURRENT DIAGNOSTICS CONDITION -1 @p11 = RETURNED_SQLSTATE, @p12 = MESSAGE_TEXT;
	GET STACKED DIAGNOSTICS CONDITION -1 @p21 = RETURNED_SQLSTATE, @p22 = MESSAGE_TEXT;
   	show warnings;
	GET CURRENT DIAGNOSTICS @cur_number = NUMBER;
	GET STACKED DIAGNOSTICS @sta_number = NUMBER;
  END;  
  SELECT * FROM no_such_table19;
END;
//
ERROR 42000: You have an error in your SQL syntax; check the manual that corresponds to your OceanBase version for the right syntax to use near 'GET CURRENT DIAGNOSTICS CONDITION -1 @p11 = RETURNED_SQLSTATE, @p12 = MESSAGE_TEXT' at line 5
## 单引号数字/双引号数字
# bug9:GET DIAGNOSTICS 诊断语句,条件编号指示符的值单引号数字/双引号数字时，mysql成功，ob失败。
SET @p11=NULL, @p12=NULL,@p13=NULL, @p14=NULL,@p21=NULL, @p22=NULL,@p23=NULL, @p24=NULL;//
DROP PROCEDURE IF EXISTS pro1;//
CREATE PROCEDURE pro1 () DETERMINISTIC 
BEGIN
  DECLARE CONTINUE HANDLER FOR SQLEXCEPTION
  BEGIN
	GET CURRENT DIAGNOSTICS CONDITION '1' @p11 = RETURNED_SQLSTATE, @p12 = MESSAGE_TEXT;
	GET CURRENT DIAGNOSTICS CONDITION "1" @p13 = RETURNED_SQLSTATE, @p14 = MESSAGE_TEXT;
	GET STACKED DIAGNOSTICS CONDITION '1' @p21 = RETURNED_SQLSTATE, @p22 = MESSAGE_TEXT;
	GET STACKED DIAGNOSTICS CONDITION "1" @p23 = RETURNED_SQLSTATE, @p24 = MESSAGE_TEXT;
   	show warnings;
	GET CURRENT DIAGNOSTICS @cur_number = NUMBER;
	GET STACKED DIAGNOSTICS @sta_number = NUMBER;
  END;  
  SELECT * FROM no_such_table19;
END;
//
CALL pro1()//
+-------+------+--------------------------------------------+
| Level | Code | Message                                    |
+-------+------+--------------------------------------------+
| Error | 1146 | Table 'test.no_such_table19' doesn't exist |
+-------+------+--------------------------------------------+
SELECT 'CURRENT DIAGNOSTICS CONDITION ''1''',@cur_number 'NUMBER', @p11, @p12;//
+-----------------------------------+--------+-------+--------------------------------------------+
| CURRENT DIAGNOSTICS CONDITION '1' | NUMBER | @p11  | @p12                                       |
+-----------------------------------+--------+-------+--------------------------------------------+
| CURRENT DIAGNOSTICS CONDITION '1' |      1 | 42S02 | Table 'test.no_such_table19' doesn't exist |
+-----------------------------------+--------+-------+--------------------------------------------+
SELECT 'CURRENT DIAGNOSTICS CONDITION "1"',@cur_number 'NUMBER', @p13, @p14;//
+-----------------------------------+--------+-------+--------------------------------------------+
| CURRENT DIAGNOSTICS CONDITION "1" | NUMBER | @p13  | @p14                                       |
+-----------------------------------+--------+-------+--------------------------------------------+
| CURRENT DIAGNOSTICS CONDITION "1" |      1 | 42S02 | Table 'test.no_such_table19' doesn't exist |
+-----------------------------------+--------+-------+--------------------------------------------+
SELECT 'STACKED DIAGNOSTICS CONDITION ''1''',@sta_number 'NUMBER', @p21, @p22;//
+-----------------------------------+--------+-------+--------------------------------------------+
| STACKED DIAGNOSTICS CONDITION '1' | NUMBER | @p21  | @p22                                       |
+-----------------------------------+--------+-------+--------------------------------------------+
| STACKED DIAGNOSTICS CONDITION '1' |      1 | 42S02 | Table 'test.no_such_table19' doesn't exist |
+-----------------------------------+--------+-------+--------------------------------------------+
SELECT 'STACKED DIAGNOSTICS CONDITION "1"',@sta_number 'NUMBER', @p23, @p24;//
+-----------------------------------+--------+-------+--------------------------------------------+
| STACKED DIAGNOSTICS CONDITION "1" | NUMBER | @p23  | @p24                                       |
+-----------------------------------+--------+-------+--------------------------------------------+
| STACKED DIAGNOSTICS CONDITION "1" |      1 | 42S02 | Table 'test.no_such_table19' doesn't exist |
+-----------------------------------+--------+-------+--------------------------------------------+
## 科学计数
# bug4:GET DIAGNOSTICS 诊断语句,条件编号指示符值是''/' '/null/false/科学计数时，mysql警告，ob报错。
SET @p11=NULL, @p12=NULL,@p21=NULL, @p22=NULL;//
DROP PROCEDURE IF EXISTS pro1;//
CREATE PROCEDURE pro1 () DETERMINISTIC 
BEGIN
  DECLARE CONTINUE HANDLER FOR SQLEXCEPTION
  BEGIN
	GET CURRENT DIAGNOSTICS CONDITION 1.0e+10 @p11 = RETURNED_SQLSTATE, @p12 = MESSAGE_TEXT;
	GET STACKED DIAGNOSTICS CONDITION 1.0e+10 @p21 = RETURNED_SQLSTATE, @p22 = MESSAGE_TEXT;
   	show warnings;
	GET CURRENT DIAGNOSTICS @cur_number = NUMBER;
	GET STACKED DIAGNOSTICS @sta_number = NUMBER;
  END;  
  SELECT * FROM no_such_table19;
END;
//
ERROR 42000: You have an error in your SQL syntax; check the manual that corresponds to your OceanBase version for the right syntax to use near 'GET CURRENT DIAGNOSTICS CONDITION 1.0e+10 @p11 = RETURNED_SQLSTATE, @p12 = MESSAGE_TEXT' at line 5
CALL pro1()//
ERROR 42000: procedure test.pro1 does not exist
SELECT 'CURRENT DIAGNOSTICS ',@cur_number 'NUMBER', @p11, @p12;//
+----------------------+--------+------+------+
| CURRENT DIAGNOSTICS  | NUMBER | @p11 | @p12 |
+----------------------+--------+------+------+
| CURRENT DIAGNOSTICS  |      1 | NULL | NULL |
+----------------------+--------+------+------+
SELECT 'STACKED DIAGNOSTICS ',@sta_number 'NUMBER', @p21, @p22;//
+----------------------+--------+------+------+
| STACKED DIAGNOSTICS  | NUMBER | @p21 | @p22 |
+----------------------+--------+------+------+
| STACKED DIAGNOSTICS  |      1 | NULL | NULL |
+----------------------+--------+------+------+
## 非法数字
# bug10:GET DIAGNOSTICS 诊断语句,条件编号指示符的值非法数字时，mysql警告，ob报错。
SET @p11=NULL, @p12=NULL,@p21=NULL, @p22=NULL;//
DROP PROCEDURE IF EXISTS pro1;//
CREATE PROCEDURE pro1 () DETERMINISTIC 
BEGIN
  DECLARE CONTINUE HANDLER FOR SQLEXCEPTION
  BEGIN
	GET CURRENT DIAGNOSTICS CONDITION 1a @p11 = RETURNED_SQLSTATE, @p12 = MESSAGE_TEXT;
	GET STACKED DIAGNOSTICS CONDITION 1a @p21 = RETURNED_SQLSTATE, @p22 = MESSAGE_TEXT;
   	show warnings;
	GET CURRENT DIAGNOSTICS @cur_number = NUMBER;
	GET STACKED DIAGNOSTICS @sta_number = NUMBER;
  END;  
  SELECT * FROM no_such_table19;
END;
//
CALL pro1()//
+---------+------+--------------------------------------------+
| Level   | Code | Message                                    |
+---------+------+--------------------------------------------+
| Error   | 1146 | Table 'test.no_such_table19' doesn't exist |
| Warning | 1054 | Unknown column '1a' in 'field_list'        |
| Warning | 1054 | Unknown column '1a' in 'field_list'        |
+---------+------+--------------------------------------------+
Warnings:
Warning	1054	Unknown column '1a' in 'field_list'
Warning	1054	Unknown column '1a' in 'field_list'
SELECT 'CURRENT DIAGNOSTICS CONDITION 1a',@cur_number 'NUMBER', @p11, @p12;//
+----------------------------------+--------+------+------+
| CURRENT DIAGNOSTICS CONDITION 1a | NUMBER | @p11 | @p12 |
+----------------------------------+--------+------+------+
| CURRENT DIAGNOSTICS CONDITION 1a |      3 | NULL | NULL |
+----------------------------------+--------+------+------+
SELECT 'STACKED DIAGNOSTICS CONDITION 1a',@sta_number 'NUMBER', @p21, @p22;//
+----------------------------------+--------+------+------+
| STACKED DIAGNOSTICS CONDITION 1a | NUMBER | @p21 | @p22 |
+----------------------------------+--------+------+------+
| STACKED DIAGNOSTICS CONDITION 1a |      1 | NULL | NULL |
+----------------------------------+--------+------+------+
## 表达式(+,-,*,/,&,|,!,||,>=,<=,<>,!=,^,>>,<<等，函数)
SET @p11=NULL, @p12=NULL,@p21=NULL, @p22=NULL;//
DROP PROCEDURE IF EXISTS pro1;//
CREATE PROCEDURE pro1 () DETERMINISTIC 
BEGIN
  DECLARE CONTINUE HANDLER FOR SQLEXCEPTION
  BEGIN
	GET CURRENT DIAGNOSTICS CONDITION 3*2/2+1-3 @p11 = RETURNED_SQLSTATE, @p12 = MESSAGE_TEXT;
	GET STACKED DIAGNOSTICS CONDITION 3*2/2+1-3 @p21 = RETURNED_SQLSTATE, @p22 = MESSAGE_TEXT;
   	show warnings;
	GET CURRENT DIAGNOSTICS @cur_number = NUMBER;
	GET STACKED DIAGNOSTICS @sta_number = NUMBER;
  END;  
  SELECT * FROM no_such_table19;
END;
//
ERROR 42000: You have an error in your SQL syntax; check the manual that corresponds to your OceanBase version for the right syntax to use near 'GET CURRENT DIAGNOSTICS CONDITION 3*2/2+1-3 @p11 = RETURNED_SQLSTATE, @p12 = MESSAGE_TEXT' at line 5
DROP PROCEDURE IF EXISTS pro1;//
CREATE PROCEDURE pro1 () DETERMINISTIC 
BEGIN
  DECLARE CONTINUE HANDLER FOR SQLEXCEPTION
  BEGIN
	GET CURRENT DIAGNOSTICS CONDITION 3&3|2^3 @p11 = RETURNED_SQLSTATE, @p12 = MESSAGE_TEXT;
	GET STACKED DIAGNOSTICS CONDITION 3&3|2^3 @p21 = RETURNED_SQLSTATE, @p22 = MESSAGE_TEXT;
   	show warnings;
	GET CURRENT DIAGNOSTICS @cur_number = NUMBER;
	GET STACKED DIAGNOSTICS @sta_number = NUMBER;
  END;  
  SELECT * FROM no_such_table19;
END;
//
ERROR 42000: You have an error in your SQL syntax; check the manual that corresponds to your OceanBase version for the right syntax to use near 'GET CURRENT DIAGNOSTICS CONDITION 3&3|2^3 @p11 = RETURNED_SQLSTATE, @p12 = MESSAGE_TEXT' at line 5
DROP PROCEDURE IF EXISTS pro1;//
CREATE PROCEDURE pro1 () DETERMINISTIC 
BEGIN
  DECLARE CONTINUE HANDLER FOR SQLEXCEPTION
  BEGIN
	GET CURRENT DIAGNOSTICS CONDITION 4>3 @p11 = RETURNED_SQLSTATE, @p12 = MESSAGE_TEXT;
	GET STACKED DIAGNOSTICS CONDITION 4>3 @p21 = RETURNED_SQLSTATE, @p22 = MESSAGE_TEXT;
   	show warnings;
	GET CURRENT DIAGNOSTICS @cur_number = NUMBER;
	GET STACKED DIAGNOSTICS @sta_number = NUMBER;
  END;  
  SELECT * FROM no_such_table19;
END;
//
ERROR 42000: You have an error in your SQL syntax; check the manual that corresponds to your OceanBase version for the right syntax to use near 'GET CURRENT DIAGNOSTICS CONDITION 4>3 @p11 = RETURNED_SQLSTATE, @p12 = MESSAGE_TEXT' at line 5
DROP PROCEDURE IF EXISTS pro1;//
CREATE PROCEDURE pro1 () DETERMINISTIC 
BEGIN
  DECLARE CONTINUE HANDLER FOR SQLEXCEPTION
  BEGIN
	GET CURRENT DIAGNOSTICS CONDITION abs(-1) @p11 = RETURNED_SQLSTATE, @p12 = MESSAGE_TEXT;
	GET STACKED DIAGNOSTICS CONDITION abs(-1) @p21 = RETURNED_SQLSTATE, @p22 = MESSAGE_TEXT;
   	show warnings;
	GET CURRENT DIAGNOSTICS @cur_number = NUMBER;
	GET STACKED DIAGNOSTICS @sta_number = NUMBER;
  END;  
  SELECT * FROM no_such_table19;
END;
//
ERROR 42000: You have an error in your SQL syntax; check the manual that corresponds to your OceanBase version for the right syntax to use near 'GET CURRENT DIAGNOSTICS CONDITION abs(-1) @p11 = RETURNED_SQLSTATE, @p12 = MESSAGE_TEXT' at line 5
### 日期  ('20220311','2022-03-11 15:32:22'等) 
#bug4:GET DIAGNOSTICS 诊断语句,条件编号指示符值是''/' '/null/false/科学计数/日期时，mysql警告，ob报错。
SET @p11=NULL, @p12=NULL,@p21=NULL, @p22=NULL;//
DROP PROCEDURE IF EXISTS pro1;//
CREATE PROCEDURE pro1 () DETERMINISTIC 
BEGIN
  DECLARE CONTINUE HANDLER FOR SQLEXCEPTION
  BEGIN
	GET CURRENT DIAGNOSTICS CONDITION '2022-03-11 15:32:22' @p11 = RETURNED_SQLSTATE, @p12 = MESSAGE_TEXT;
	GET STACKED DIAGNOSTICS CONDITION '2022-03-11 15:32:22' @p21 = RETURNED_SQLSTATE, @p22 = MESSAGE_TEXT;
   	show warnings;
	GET CURRENT DIAGNOSTICS @cur_number = NUMBER;
	GET STACKED DIAGNOSTICS @sta_number = NUMBER;
  END;  
  SELECT * FROM no_such_table19;
END;
//
CALL pro1()//
+---------+------+--------------------------------------------+
| Level   | Code | Message                                    |
+---------+------+--------------------------------------------+
| Error   | 1146 | Table 'test.no_such_table19' doesn't exist |
| Warning | 1758 | Invalid condition number                   |
| Warning | 1758 | Invalid condition number                   |
+---------+------+--------------------------------------------+
Warnings:
Warning	1758	Invalid condition number
Warning	1758	Invalid condition number
SELECT 'CURRENT DIAGNOSTICS CONDITION 1a',@cur_number 'NUMBER', @p11, @p12;//
+----------------------------------+--------+------+------+
| CURRENT DIAGNOSTICS CONDITION 1a | NUMBER | @p11 | @p12 |
+----------------------------------+--------+------+------+
| CURRENT DIAGNOSTICS CONDITION 1a |      3 | NULL | NULL |
+----------------------------------+--------+------+------+
SELECT 'STACKED DIAGNOSTICS CONDITION 1a',@sta_number 'NUMBER', @p21, @p22;//
+----------------------------------+--------+------+------+
| STACKED DIAGNOSTICS CONDITION 1a | NUMBER | @p21 | @p22 |
+----------------------------------+--------+------+------+
| STACKED DIAGNOSTICS CONDITION 1a |      1 | NULL | NULL |
+----------------------------------+--------+------+------+
# Clean up users
drop user whh@'%';
