drop table if exists t1;
result_format: 4
create table t1(c1 int, c2 int) partition by hash(c1) partitions 10;
explain_protocol: 2
EXPLAIN select @var:=0 as init, @var:=@var+1 as assign from t1 limit 10;
Query Plan
=============================================================
|ID|OPERATOR                     |NAME|EST.ROWS|EST.TIME(us)|
-------------------------------------------------------------
|0 |LIMIT                        |    |10      |22          |
|1 |└─DISTRIBUTED TABLE FULL SCAN|t1  |10      |22          |
=============================================================
Outputs & filters:
-------------------------------------
  0 - output([(T_OP_ASSIGN, 'var', 0)], [(T_OP_ASSIGN, 'var', cast(('var'), DOUBLE(-1, -1)) + cast(1, DOUBLE(-1, -1)))]), filter(nil)
      limit(10), offset(nil)
  1 - output(nil), filter(nil)
      access(nil), partitions(p[0-9])
      limit(10), offset(nil), is_index_back=false, is_global_index=false, 
      range_key([t1.__pk_increment]), range(MIN ; MAX)always true
select @var:=0 as init, @var:=@var+1 as assign from t1 limit 10;
+------+--------+
| init | assign |
+------+--------+
|    0 |      1 |
|    0 |      1 |
|    0 |      1 |
|    0 |      1 |
|    0 |      1 |
|    0 |      1 |
|    0 |      1 |
|    0 |      1 |
|    0 |      1 |
|    0 |      1 |
+------+--------+
EXPLAIN select /*+parallel(10)*/@var:=0 as init, @var:=@var+1 as assign from t1 limit 10;
Query Plan
=============================================================
|ID|OPERATOR                     |NAME|EST.ROWS|EST.TIME(us)|
-------------------------------------------------------------
|0 |LIMIT                        |    |10      |22          |
|1 |└─DISTRIBUTED TABLE FULL SCAN|t1  |10      |22          |
=============================================================
Outputs & filters:
-------------------------------------
  0 - output([(T_OP_ASSIGN, 'var', 0)], [(T_OP_ASSIGN, 'var', ('var') + cast(1, DOUBLE(-1, -1)))]), filter(nil)
      limit(10), offset(nil)
  1 - output(nil), filter(nil)
      access(nil), partitions(p[0-9])
      limit(10), offset(nil), is_index_back=false, is_global_index=false, 
      range_key([t1.__pk_increment]), range(MIN ; MAX)always true
select /*+parallel(10)*/@var:=0 as init, @var:=@var+1 as assign from t1 limit 10;
+------+--------+
| init | assign |
+------+--------+
|    0 |      1 |
|    0 |      1 |
|    0 |      1 |
|    0 |      1 |
|    0 |      1 |
|    0 |      1 |
|    0 |      1 |
|    0 |      1 |
|    0 |      1 |
|    0 |      1 |
+------+--------+
EXPLAIN select @var:=0 as init, @var:=@var + 1 as assign from t1, t1 t2 limit 10;
Query Plan
======================================================================
|ID|OPERATOR                             |NAME |EST.ROWS|EST.TIME(us)|
----------------------------------------------------------------------
|0 |LIMIT                                |     |10      |43          |
|1 |└─NESTED-LOOP JOIN CARTESIAN         |     |10      |43          |
|2 |  ├─SUBPLAN SCAN                     |VIEW1|1       |22          |
|3 |  │ └─LIMIT                          |     |1       |22          |
|4 |  │   └─DISTRIBUTED TABLE FULL SCAN  |t1   |1       |22          |
|5 |  └─MATERIAL                         |     |10      |22          |
|6 |    └─SUBPLAN SCAN                   |VIEW2|10      |22          |
|7 |      └─LIMIT                        |     |10      |22          |
|8 |        └─DISTRIBUTED TABLE FULL SCAN|t2   |10      |22          |
======================================================================
Outputs & filters:
-------------------------------------
  0 - output([(T_OP_ASSIGN, 'var', 0)], [(T_OP_ASSIGN, 'var', ('var') + cast(1, DOUBLE(-1, -1)))]), filter(nil)
      limit(10), offset(nil)
  1 - output(nil), filter(nil)
      conds(nil), nl_params_(nil), use_batch=false
  2 - output(nil), filter(nil)
      access(nil)
  3 - output([1]), filter(nil)
      limit(10), offset(nil)
  4 - output(nil), filter(nil)
      access(nil), partitions(p[0-9])
      limit(10), offset(nil), is_index_back=false, is_global_index=false, 
      range_key([t1.__pk_increment]), range(MIN ; MAX)always true
  5 - output(nil), filter(nil)
  6 - output(nil), filter(nil)
      access(nil)
  7 - output([1]), filter(nil)
      limit(10), offset(nil)
  8 - output(nil), filter(nil)
      access(nil), partitions(p[0-9])
      limit(10), offset(nil), is_index_back=false, is_global_index=false, 
      range_key([t2.__pk_increment]), range(MIN ; MAX)always true
select @var:=0 as init, @var:=@var + 1 as assign from t1, t1 t2 limit 10;
+------+--------+
| init | assign |
+------+--------+
|    0 |      1 |
|    0 |      1 |
|    0 |      1 |
|    0 |      1 |
|    0 |      1 |
|    0 |      1 |
|    0 |      1 |
|    0 |      1 |
|    0 |      1 |
|    0 |      1 |
+------+--------+

EXPLAIN select /*+parallel(10)*/c1, @var:=@var + 1, @var - c1 as diff, var_init from t1, (select @var:=0 as var_init from dual) tt order by c1;
Query Plan
===============================================================
|ID|OPERATOR                       |NAME|EST.ROWS|EST.TIME(us)|
---------------------------------------------------------------
|0 |SORT                           |    |99      |41          |
|1 |└─NESTED-LOOP JOIN CARTESIAN   |    |99      |27          |
|2 |  ├─SUBPLAN SCAN               |tt  |1       |1           |
|3 |  │ └─EXPRESSION               |    |1       |1           |
|4 |  └─DISTRIBUTED TABLE FULL SCAN|t1  |99      |24          |
===============================================================
Outputs & filters:
-------------------------------------
  0 - output([t1.c1], [(T_OP_ASSIGN, 'var', ('var') + cast(1, DOUBLE(-1, -1)))], [('var') - cast(t1.c1, DOUBLE(-1, -1))], [tt.var_init]), filter(nil)
      sort_keys([t1.c1, ASC])
  1 - output([t1.c1], [tt.var_init]), filter(nil)
      conds(nil), nl_params_(nil), use_batch=false
  2 - output([tt.var_init]), filter(nil)
      access([tt.var_init])
  3 - output([(T_OP_ASSIGN, 'var', 0)]), filter(nil)
      values({(T_OP_ASSIGN, 'var', 0)})
  4 - output([t1.c1]), filter(nil)
      access([t1.c1]), partitions(p[0-9])
      is_index_back=false, is_global_index=false, 
      range_key([t1.__pk_increment]), range(MIN ; MAX)always true
select /*+parallel(10)*/c1, @var:=@var + 1, @var - c1 as diff, var_init from t1, (select @var:=0 as var_init from dual) tt order by c1;
+------+----------------+------+----------+
| c1   | @var:=@var + 1 | diff | var_init |
+------+----------------+------+----------+
|    1 |              1 |    0 |        0 |
|    2 |              2 |    0 |        0 |
|    3 |              3 |    0 |        0 |
|    4 |              4 |    0 |        0 |
|    5 |              5 |    0 |        0 |
|    6 |              6 |    0 |        0 |
|    7 |              7 |    0 |        0 |
|    8 |              8 |    0 |        0 |
|    9 |              9 |    0 |        0 |
|   10 |             10 |    0 |        0 |
|   11 |             11 |    0 |        0 |
|   12 |             12 |    0 |        0 |
|   13 |             13 |    0 |        0 |
|   14 |             14 |    0 |        0 |
|   15 |             15 |    0 |        0 |
|   16 |             16 |    0 |        0 |
|   17 |             17 |    0 |        0 |
|   18 |             18 |    0 |        0 |
|   19 |             19 |    0 |        0 |
|   20 |             20 |    0 |        0 |
|   21 |             21 |    0 |        0 |
|   22 |             22 |    0 |        0 |
|   23 |             23 |    0 |        0 |
|   24 |             24 |    0 |        0 |
|   25 |             25 |    0 |        0 |
|   26 |             26 |    0 |        0 |
|   27 |             27 |    0 |        0 |
|   28 |             28 |    0 |        0 |
|   29 |             29 |    0 |        0 |
|   30 |             30 |    0 |        0 |
|   31 |             31 |    0 |        0 |
|   32 |             32 |    0 |        0 |
|   33 |             33 |    0 |        0 |
|   34 |             34 |    0 |        0 |
|   35 |             35 |    0 |        0 |
|   36 |             36 |    0 |        0 |
|   37 |             37 |    0 |        0 |
|   38 |             38 |    0 |        0 |
|   39 |             39 |    0 |        0 |
|   40 |             40 |    0 |        0 |
|   41 |             41 |    0 |        0 |
|   42 |             42 |    0 |        0 |
|   43 |             43 |    0 |        0 |
|   44 |             44 |    0 |        0 |
|   45 |             45 |    0 |        0 |
|   46 |             46 |    0 |        0 |
|   47 |             47 |    0 |        0 |
|   48 |             48 |    0 |        0 |
|   49 |             49 |    0 |        0 |
|   50 |             50 |    0 |        0 |
|   51 |             51 |    0 |        0 |
|   52 |             52 |    0 |        0 |
|   53 |             53 |    0 |        0 |
|   54 |             54 |    0 |        0 |
|   55 |             55 |    0 |        0 |
|   56 |             56 |    0 |        0 |
|   57 |             57 |    0 |        0 |
|   58 |             58 |    0 |        0 |
|   59 |             59 |    0 |        0 |
|   60 |             60 |    0 |        0 |
|   61 |             61 |    0 |        0 |
|   62 |             62 |    0 |        0 |
|   63 |             63 |    0 |        0 |
|   64 |             64 |    0 |        0 |
|   65 |             65 |    0 |        0 |
|   66 |             66 |    0 |        0 |
|   67 |             67 |    0 |        0 |
|   68 |             68 |    0 |        0 |
|   69 |             69 |    0 |        0 |
|   70 |             70 |    0 |        0 |
|   71 |             71 |    0 |        0 |
|   72 |             72 |    0 |        0 |
|   73 |             73 |    0 |        0 |
|   74 |             74 |    0 |        0 |
|   75 |             75 |    0 |        0 |
|   76 |             76 |    0 |        0 |
|   77 |             77 |    0 |        0 |
|   78 |             78 |    0 |        0 |
|   79 |             79 |    0 |        0 |
|   80 |             80 |    0 |        0 |
|   81 |             81 |    0 |        0 |
|   82 |             82 |    0 |        0 |
|   83 |             83 |    0 |        0 |
|   84 |             84 |    0 |        0 |
|   85 |             85 |    0 |        0 |
|   86 |             86 |    0 |        0 |
|   87 |             87 |    0 |        0 |
|   88 |             88 |    0 |        0 |
|   89 |             89 |    0 |        0 |
|   90 |             90 |    0 |        0 |
|   91 |             91 |    0 |        0 |
|   92 |             92 |    0 |        0 |
|   93 |             93 |    0 |        0 |
|   94 |             94 |    0 |        0 |
|   95 |             95 |    0 |        0 |
|   96 |             96 |    0 |        0 |
|   97 |             97 |    0 |        0 |
|   98 |             98 |    0 |        0 |
|   99 |             99 |    0 |        0 |
+------+----------------+------+----------+
EXPLAIN select c1, @var:=@var + 1, @var - c1 as diff, var_init from t1, (select @var:=0 as var_init from dual) tt order by c1;
Query Plan
===============================================================
|ID|OPERATOR                       |NAME|EST.ROWS|EST.TIME(us)|
---------------------------------------------------------------
|0 |SORT                           |    |99      |41          |
|1 |└─NESTED-LOOP JOIN CARTESIAN   |    |99      |27          |
|2 |  ├─SUBPLAN SCAN               |tt  |1       |1           |
|3 |  │ └─EXPRESSION               |    |1       |1           |
|4 |  └─DISTRIBUTED TABLE FULL SCAN|t1  |99      |24          |
===============================================================
Outputs & filters:
-------------------------------------
  0 - output([t1.c1], [(T_OP_ASSIGN, 'var', ('var') + cast(1, DOUBLE(-1, -1)))], [('var') - cast(t1.c1, DOUBLE(-1, -1))], [tt.var_init]), filter(nil)
      sort_keys([t1.c1, ASC])
  1 - output([t1.c1], [tt.var_init]), filter(nil)
      conds(nil), nl_params_(nil), use_batch=false
  2 - output([tt.var_init]), filter(nil)
      access([tt.var_init])
  3 - output([(T_OP_ASSIGN, 'var', 0)]), filter(nil)
      values({(T_OP_ASSIGN, 'var', 0)})
  4 - output([t1.c1]), filter(nil)
      access([t1.c1]), partitions(p[0-9])
      is_index_back=false, is_global_index=false, 
      range_key([t1.__pk_increment]), range(MIN ; MAX)always true
select c1, @var:=@var + 1, @var - c1 as diff, var_init from t1, (select @var:=0 as var_init from dual) tt order by c1;
+------+----------------+------+----------+
| c1   | @var:=@var + 1 | diff | var_init |
+------+----------------+------+----------+
|    1 |              1 |    0 |        0 |
|    2 |              2 |    0 |        0 |
|    3 |              3 |    0 |        0 |
|    4 |              4 |    0 |        0 |
|    5 |              5 |    0 |        0 |
|    6 |              6 |    0 |        0 |
|    7 |              7 |    0 |        0 |
|    8 |              8 |    0 |        0 |
|    9 |              9 |    0 |        0 |
|   10 |             10 |    0 |        0 |
|   11 |             11 |    0 |        0 |
|   12 |             12 |    0 |        0 |
|   13 |             13 |    0 |        0 |
|   14 |             14 |    0 |        0 |
|   15 |             15 |    0 |        0 |
|   16 |             16 |    0 |        0 |
|   17 |             17 |    0 |        0 |
|   18 |             18 |    0 |        0 |
|   19 |             19 |    0 |        0 |
|   20 |             20 |    0 |        0 |
|   21 |             21 |    0 |        0 |
|   22 |             22 |    0 |        0 |
|   23 |             23 |    0 |        0 |
|   24 |             24 |    0 |        0 |
|   25 |             25 |    0 |        0 |
|   26 |             26 |    0 |        0 |
|   27 |             27 |    0 |        0 |
|   28 |             28 |    0 |        0 |
|   29 |             29 |    0 |        0 |
|   30 |             30 |    0 |        0 |
|   31 |             31 |    0 |        0 |
|   32 |             32 |    0 |        0 |
|   33 |             33 |    0 |        0 |
|   34 |             34 |    0 |        0 |
|   35 |             35 |    0 |        0 |
|   36 |             36 |    0 |        0 |
|   37 |             37 |    0 |        0 |
|   38 |             38 |    0 |        0 |
|   39 |             39 |    0 |        0 |
|   40 |             40 |    0 |        0 |
|   41 |             41 |    0 |        0 |
|   42 |             42 |    0 |        0 |
|   43 |             43 |    0 |        0 |
|   44 |             44 |    0 |        0 |
|   45 |             45 |    0 |        0 |
|   46 |             46 |    0 |        0 |
|   47 |             47 |    0 |        0 |
|   48 |             48 |    0 |        0 |
|   49 |             49 |    0 |        0 |
|   50 |             50 |    0 |        0 |
|   51 |             51 |    0 |        0 |
|   52 |             52 |    0 |        0 |
|   53 |             53 |    0 |        0 |
|   54 |             54 |    0 |        0 |
|   55 |             55 |    0 |        0 |
|   56 |             56 |    0 |        0 |
|   57 |             57 |    0 |        0 |
|   58 |             58 |    0 |        0 |
|   59 |             59 |    0 |        0 |
|   60 |             60 |    0 |        0 |
|   61 |             61 |    0 |        0 |
|   62 |             62 |    0 |        0 |
|   63 |             63 |    0 |        0 |
|   64 |             64 |    0 |        0 |
|   65 |             65 |    0 |        0 |
|   66 |             66 |    0 |        0 |
|   67 |             67 |    0 |        0 |
|   68 |             68 |    0 |        0 |
|   69 |             69 |    0 |        0 |
|   70 |             70 |    0 |        0 |
|   71 |             71 |    0 |        0 |
|   72 |             72 |    0 |        0 |
|   73 |             73 |    0 |        0 |
|   74 |             74 |    0 |        0 |
|   75 |             75 |    0 |        0 |
|   76 |             76 |    0 |        0 |
|   77 |             77 |    0 |        0 |
|   78 |             78 |    0 |        0 |
|   79 |             79 |    0 |        0 |
|   80 |             80 |    0 |        0 |
|   81 |             81 |    0 |        0 |
|   82 |             82 |    0 |        0 |
|   83 |             83 |    0 |        0 |
|   84 |             84 |    0 |        0 |
|   85 |             85 |    0 |        0 |
|   86 |             86 |    0 |        0 |
|   87 |             87 |    0 |        0 |
|   88 |             88 |    0 |        0 |
|   89 |             89 |    0 |        0 |
|   90 |             90 |    0 |        0 |
|   91 |             91 |    0 |        0 |
|   92 |             92 |    0 |        0 |
|   93 |             93 |    0 |        0 |
|   94 |             94 |    0 |        0 |
|   95 |             95 |    0 |        0 |
|   96 |             96 |    0 |        0 |
|   97 |             97 |    0 |        0 |
|   98 |             98 |    0 |        0 |
|   99 |             99 |    0 |        0 |
+------+----------------+------+----------+
set autocommit = 0;
EXPLAIN update /*+parallel(10) enable_parallel_dml*/t1 set c1 = (@a:=@a + 1), c2 = (select @a:=0 from dual);
Query Plan
===============================================================
|ID|OPERATOR                       |NAME|EST.ROWS|EST.TIME(us)|
---------------------------------------------------------------
|0 |DISTRIBUTED UPDATE             |    |99      |802         |
|1 |└─SUBPLAN FILTER               |    |99      |29          |
|2 |  ├─DISTRIBUTED TABLE FULL SCAN|t1  |99      |29          |
|3 |  └─EXPRESSION                 |    |1       |1           |
===============================================================
Outputs & filters:
-------------------------------------
  0 - output(nil), filter(nil)
      table_columns([{t1: ({t1: (t1.__pk_increment, t1.c1, t1.c2)})}]),
      update([t1.c1=column_conv(INT,PS:(11,0),NULL,cast((T_OP_ASSIGN, 'a', cast(('a'), DOUBLE(-1, -1)) + cast(1, DOUBLE(-1, -1))), INT(-1, 0)))], [t1.c2=column_conv(INT,
      PS:(11,0),NULL,cast(subquery(1), INT(-1, 0)))], [t1.__pk_increment=T_HIDDEN_PK])
  1 - output([t1.__pk_increment], [t1.c1], [t1.c2], [subquery(1)]), filter(nil)
      exec_params_(nil), onetime_exprs_(nil), init_plan_idxs_(nil), use_batch=false
  2 - output([t1.__pk_increment], [t1.c1], [t1.c2]), filter(nil)
      access([t1.__pk_increment], [t1.c1], [t1.c2]), partitions(p[0-9])
      is_index_back=false, is_global_index=false, 
      range_key([t1.__pk_increment]), range(MIN ; MAX)always true
  3 - output([(T_OP_ASSIGN, 'a', 0)]), filter(nil)
      values({(T_OP_ASSIGN, 'a', 0)})
update /*+parallel(10) enable_parallel_dml*/t1 set c1 = (@a:=@a + 1), c2 = (select @a:=0 from dual);
EXPLAIN select * from t1;
Query Plan
=============================================================
|ID|OPERATOR                 |NAME    |EST.ROWS|EST.TIME(us)|
-------------------------------------------------------------
|0 |PX COORDINATOR           |        |188     |217         |
|1 |└─EXCHANGE OUT DISTR     |:EX10000|188     |159         |
|2 |  └─PX PARTITION ITERATOR|        |188     |31          |
|3 |    └─TABLE FULL SCAN    |t1      |188     |31          |
=============================================================
Outputs & filters:
-------------------------------------
  0 - output([INTERNAL_FUNCTION(t1.c1, t1.c2)]), filter(nil), rowset=256
  1 - output([INTERNAL_FUNCTION(t1.c1, t1.c2)]), filter(nil), rowset=256
      dop=1
  2 - output([t1.c1], [t1.c2]), filter(nil), rowset=256
      force partition granule
  3 - output([t1.c1], [t1.c2]), filter(nil), rowset=256
      access([t1.c1], [t1.c2]), partitions(p[0-9])
      is_index_back=false, is_global_index=false, 
      range_key([t1.__pk_increment]), range(MIN ; MAX)always true
select * from t1;
+------+------+
| c1   | c2   |
+------+------+
|    1 |    0 |
|    1 |    0 |
|    1 |    0 |
|    1 |    0 |
|    1 |    0 |
|    1 |    0 |
|    1 |    0 |
|    1 |    0 |
|    1 |    0 |
|    1 |    0 |
|    1 |    0 |
|    1 |    0 |
|    1 |    0 |
|    1 |    0 |
|    1 |    0 |
|    1 |    0 |
|    1 |    0 |
|    1 |    0 |
|    1 |    0 |
|    1 |    0 |
|    1 |    0 |
|    1 |    0 |
|    1 |    0 |
|    1 |    0 |
|    1 |    0 |
|    1 |    0 |
|    1 |    0 |
|    1 |    0 |
|    1 |    0 |
|    1 |    0 |
|    1 |    0 |
|    1 |    0 |
|    1 |    0 |
|    1 |    0 |
|    1 |    0 |
|    1 |    0 |
|    1 |    0 |
|    1 |    0 |
|    1 |    0 |
|    1 |    0 |
|    1 |    0 |
|    1 |    0 |
|    1 |    0 |
|    1 |    0 |
|    1 |    0 |
|    1 |    0 |
|    1 |    0 |
|    1 |    0 |
|    1 |    0 |
|    1 |    0 |
|    1 |    0 |
|    1 |    0 |
|    1 |    0 |
|    1 |    0 |
|    1 |    0 |
|    1 |    0 |
|    1 |    0 |
|    1 |    0 |
|    1 |    0 |
|    1 |    0 |
|    1 |    0 |
|    1 |    0 |
|    1 |    0 |
|    1 |    0 |
|    1 |    0 |
|    1 |    0 |
|    1 |    0 |
|    1 |    0 |
|    1 |    0 |
|    1 |    0 |
|    1 |    0 |
|    1 |    0 |
|    1 |    0 |
|    1 |    0 |
|    1 |    0 |
|    1 |    0 |
|    1 |    0 |
|    1 |    0 |
|    1 |    0 |
|    1 |    0 |
|    1 |    0 |
|    1 |    0 |
|    1 |    0 |
|    1 |    0 |
|    1 |    0 |
|    1 |    0 |
|    1 |    0 |
|    1 |    0 |
|    1 |    0 |
|    1 |    0 |
|    1 |    0 |
|    1 |    0 |
|    1 |    0 |
|    1 |    0 |
|    1 |    0 |
|    1 |    0 |
|    1 |    0 |
|    1 |    0 |
|    1 |    0 |
+------+------+
ROLLBACK;
EXPLAIN update t1 set c1 = (@b:=@b + 1), c2 = (select @b:=0 from dual);
Query Plan
===============================================================
|ID|OPERATOR                       |NAME|EST.ROWS|EST.TIME(us)|
---------------------------------------------------------------
|0 |DISTRIBUTED UPDATE             |    |99      |802         |
|1 |└─SUBPLAN FILTER               |    |99      |29          |
|2 |  ├─DISTRIBUTED TABLE FULL SCAN|t1  |99      |29          |
|3 |  └─EXPRESSION                 |    |1       |1           |
===============================================================
Outputs & filters:
-------------------------------------
  0 - output(nil), filter(nil)
      table_columns([{t1: ({t1: (t1.__pk_increment, t1.c1, t1.c2)})}]),
      update([t1.c1=column_conv(INT,PS:(11,0),NULL,cast((T_OP_ASSIGN, 'b', cast(('b'), DOUBLE(-1, -1)) + cast(1, DOUBLE(-1, -1))), INT(-1, 0)))], [t1.c2=column_conv(INT,
      PS:(11,0),NULL,cast(subquery(1), INT(-1, 0)))], [t1.__pk_increment=T_HIDDEN_PK])
  1 - output([t1.__pk_increment], [t1.c1], [t1.c2], [subquery(1)]), filter(nil)
      exec_params_(nil), onetime_exprs_(nil), init_plan_idxs_(nil), use_batch=false
  2 - output([t1.__pk_increment], [t1.c1], [t1.c2]), filter(nil)
      access([t1.__pk_increment], [t1.c1], [t1.c2]), partitions(p[0-9])
      is_index_back=false, is_global_index=false, 
      range_key([t1.__pk_increment]), range(MIN ; MAX)always true
  3 - output([(T_OP_ASSIGN, 'b', 0)]), filter(nil)
      values({(T_OP_ASSIGN, 'b', 0)})
update t1 set c1 = (@b:=@b + 1), c2 = (select @b:=0 from dual);
EXPLAIN select * from t1;
Query Plan
=============================================================
|ID|OPERATOR                 |NAME    |EST.ROWS|EST.TIME(us)|
-------------------------------------------------------------
|0 |PX COORDINATOR           |        |188     |217         |
|1 |└─EXCHANGE OUT DISTR     |:EX10000|188     |159         |
|2 |  └─PX PARTITION ITERATOR|        |188     |31          |
|3 |    └─TABLE FULL SCAN    |t1      |188     |31          |
=============================================================
Outputs & filters:
-------------------------------------
  0 - output([INTERNAL_FUNCTION(t1.c1, t1.c2)]), filter(nil), rowset=256
  1 - output([INTERNAL_FUNCTION(t1.c1, t1.c2)]), filter(nil), rowset=256
      dop=1
  2 - output([t1.c1], [t1.c2]), filter(nil), rowset=256
      force partition granule
  3 - output([t1.c1], [t1.c2]), filter(nil), rowset=256
      access([t1.c1], [t1.c2]), partitions(p[0-9])
      is_index_back=false, is_global_index=false, 
      range_key([t1.__pk_increment]), range(MIN ; MAX)always true
select * from t1;
+------+------+
| c1   | c2   |
+------+------+
|    1 |    0 |
|    1 |    0 |
|    1 |    0 |
|    1 |    0 |
|    1 |    0 |
|    1 |    0 |
|    1 |    0 |
|    1 |    0 |
|    1 |    0 |
|    1 |    0 |
|    1 |    0 |
|    1 |    0 |
|    1 |    0 |
|    1 |    0 |
|    1 |    0 |
|    1 |    0 |
|    1 |    0 |
|    1 |    0 |
|    1 |    0 |
|    1 |    0 |
|    1 |    0 |
|    1 |    0 |
|    1 |    0 |
|    1 |    0 |
|    1 |    0 |
|    1 |    0 |
|    1 |    0 |
|    1 |    0 |
|    1 |    0 |
|    1 |    0 |
|    1 |    0 |
|    1 |    0 |
|    1 |    0 |
|    1 |    0 |
|    1 |    0 |
|    1 |    0 |
|    1 |    0 |
|    1 |    0 |
|    1 |    0 |
|    1 |    0 |
|    1 |    0 |
|    1 |    0 |
|    1 |    0 |
|    1 |    0 |
|    1 |    0 |
|    1 |    0 |
|    1 |    0 |
|    1 |    0 |
|    1 |    0 |
|    1 |    0 |
|    1 |    0 |
|    1 |    0 |
|    1 |    0 |
|    1 |    0 |
|    1 |    0 |
|    1 |    0 |
|    1 |    0 |
|    1 |    0 |
|    1 |    0 |
|    1 |    0 |
|    1 |    0 |
|    1 |    0 |
|    1 |    0 |
|    1 |    0 |
|    1 |    0 |
|    1 |    0 |
|    1 |    0 |
|    1 |    0 |
|    1 |    0 |
|    1 |    0 |
|    1 |    0 |
|    1 |    0 |
|    1 |    0 |
|    1 |    0 |
|    1 |    0 |
|    1 |    0 |
|    1 |    0 |
|    1 |    0 |
|    1 |    0 |
|    1 |    0 |
|    1 |    0 |
|    1 |    0 |
|    1 |    0 |
|    1 |    0 |
|    1 |    0 |
|    1 |    0 |
|    1 |    0 |
|    1 |    0 |
|    1 |    0 |
|    1 |    0 |
|    1 |    0 |
|    1 |    0 |
|    1 |    0 |
|    1 |    0 |
|    1 |    0 |
|    1 |    0 |
|    1 |    0 |
|    1 |    0 |
|    1 |    0 |
+------+------+
ROLLBACK;
set autocommit = 1;

explain_protocol: 0
drop table t1;
