purge recyclebin;
drop database  IF EXISTS  testkj;
CREATE DATABASE testkj;
USE testkj;
SET timestamp = 1600000000;
SET ob_trx_timeout = 10000000000;
SET ob_query_timeout = 100000000000;
SET SESSION group_concat_max_len = 100000000;
result_format: 4
drop table tt1;
create table tt1(id int,c1 array(int), c2 array(varchar(256)), c3 array(tinyint), c4 array(bigint), c5 array(float), c6 array(double), c7 array(smallint), c8 vector(3)) 
PARTITION BY range COLUMNS(id)(
PARTITION p0 values less than(1),
PARTITION p1 values less than(2),
PARTITION p2 values less than(MAXVALUE)
);
create index idx_tt1 on tt1(id);
create UNIQUE index idx_tt1_id on tt1(id);
CREATE INDEX tt1_func_idx1 on tt1((array_length(array_compact(c1))));
CREATE INDEX tt1_func_idx2 on tt1((array_length(c2)));
CREATE INDEX tt1_func_idx3 on tt1((array_min(c5)));
CREATE INDEX idx_tt1_cg on tt1(id) WITH COLUMN GROUP(each column);
insert into tt1 values(1,[-2147483648.5,-2147483648.5 ,0, 2147483647.4999998],['test','test',null,null],[127.499999999999992,127.499999999999992,0,-128.5,-128.5],[-9223372036854775808,9223372036854775807,0],[3.402, 0, 1.175], [1.7976931348623157E+308,0, 2.2250738585072014E-308],[-32768.5,0,32767.499999999998],[1.3,1.3,1.3]);
insert into tt1 values(2,[-2147483648.5 ,0, null, 2147483647.4999998],['test','a',null,null,'null','null'],[127.499999999999992,0, null, null, -128.5],[-9223372036854775808, null,9223372036854775807,0],[null,null, 0,3.402,1.175], [-1.7976931348623157E+308, null, 0,2.2250738585072014E-308],[-32768.5,-32768.5,0,null,null,32767.499999999998],[1,2,3]);
insert into tt1 values(3,null,null,null,null,null,null,null,null);
insert into tt1 values(4,'[]','[]','[]','[]','[]','[]','[]',[1,2,3]);
insert into tt1 values(5,array_remove([1],1),array_remove([1],1),array_remove([1],1),array_remove([1],1),array_remove([1],1),array_remove([1],1),array_remove([1],1),[1,2,3]);

drop view vtt1;
create view vtt1 as select * from tt1;

drop table tt2;
ERROR 42S02: Unknown table 'testkj.tt2'
create table tt2(id int,c1 array(int unsigned), c2 array(varchar(256)), c3 array(tinyint unsigned), c4 array(bigint unsigned), c5 array(float), c6 array(double), c7 array(smallint unsigned),c8 vector(3))
PARTITION BY range COLUMNS(id)(
PARTITION p0 values less than(19),
PARTITION p1 values less than(25),
PARTITION p2 values less than(30)
);

create index idx_tt2 on tt2(id);
create UNIQUE index idx_tt2_id on tt2(id);

create index func_idx1 on tt2 ((array_length(c1)));
create index func_idx2 on tt2 ((array_length(c3)));
create index func_idx3 on tt2 ((array_length(array_compact(c4))));
create index func_group on tt2(id) with column group (each column);

insert into tt2 values(1,[2147483648, 2147483648,0],['test'],[52,0,5],[ 852,9223372036854775807,775,808,2,0,9223372036854775807],[3.402, 0, 1.175,1.175],
[1.7976931348623157E+308, 2.2250738585072014E-308,2.2250738585072014E-308],[88,0,32767.32767],[1.1,1.1,1.1]);

insert into tt2 values(2,[87666,0, 2147483647,4],['test'],[5,0,7,6,50],[1,100000,9223372036854775807,775,808,2,0,1],[3.402, 0, 1.175,4],
[1.7976931348623157E+308,1.2,2.2250738585072014E-308],[68,0,32767,0,1],[2,2,2]);
insert into tt2 values(3,null,null,null,null,null,null,null,null);
insert into tt2 values(4,'[]','[]','[]','[]','[]','[]','[]',[0,1,1]);
insert into tt2 values(5,array_remove([1],1),array_remove([1],1),array_remove([1],1),array_remove([1],1),array_remove([1],1),array_remove([1],1),array_remove([1],1),[0,0,0]);

drop view vtt2;
create view vtt2 as select * from tt2;

select id, c3 , array_compact(c3) from tt1 order by id;
+------+------------------------+-------------------+
| id   | c3                     | array_compact(c3) |
+------+------------------------+-------------------+
|    1 | [127,127,0,-128,-128]  | [127,0,-128]      |
|    2 | [127,0,NULL,NULL,-128] | [127,0,NULL,-128] |
|    3 | NULL                   | NULL              |
|    4 | []                     | []                |
|    5 | []                     | []                |
+------+------------------------+-------------------+
select id, c4, array_compact(c4) from vtt2 order by id;
+------+-----------------------------------------------------------+-----------------------------------------------------------+
| id   | c4                                                        | array_compact(c4)                                         |
+------+-----------------------------------------------------------+-----------------------------------------------------------+
|    1 | [852,9223372036854775807,775,808,2,0,9223372036854775807] | [852,9223372036854775807,775,808,2,0,9223372036854775807] |
|    2 | [1,100000,9223372036854775807,775,808,2,0,1]              | [1,100000,9223372036854775807,775,808,2,0,1]              |
|    3 | NULL                                                      | NULL                                                      |
|    4 | []                                                        | []                                                        |
|    5 | []                                                        | []                                                        |
+------+-----------------------------------------------------------+-----------------------------------------------------------+
select id, c8 ,array_compact(c8) from tt1 order by id desc;
+------+---------------+-------------------+
| id   | c8            | array_compact(c8) |
+------+---------------+-------------------+
|    5 | [1,2,3]       | [1,2,3]           |
|    4 | [1,2,3]       | [1,2,3]           |
|    3 | NULL          | NULL              |
|    2 | [1,2,3]       | [1,2,3]           |
|    1 | [1.3,1.3,1.3] | [1.3]             |
+------+---------------+-------------------+

select id, c3, array_compact([tt1.c8,[1,2,3]]) from tt1 order by id;
+------+------------------------+---------------------------------+
| id   | c3                     | array_compact([tt1.c8,[1,2,3]]) |
+------+------------------------+---------------------------------+
|    1 | [127,127,0,-128,-128]  | [[1.3,1.3,1.3],[1,2,3]]         |
|    2 | [127,0,NULL,NULL,-128] | [[1,2,3]]                       |
|    3 | NULL                   | [NULL,[1,2,3]]                  |
|    4 | []                     | [[1,2,3]]                       |
|    5 | []                     | [[1,2,3]]                       |
+------+------------------------+---------------------------------+

select /*+ OPT_PARAM('enable_rich_vector_format', 'FALSE') */ array_compact(c2) a from tt2;
+----------+
| a        |
+----------+
| ["test"] |
| ["test"] |
| NULL     |
| []       |
| []       |
+----------+
select /*+ OPT_PARAM('rowsets_enabled', 'FALSE') */ array_compact(c2) a from tt2;
+----------+
| a        |
+----------+
| ["test"] |
| ["test"] |
| NULL     |
| []       |
| []       |
+----------+

select /*+ OPT_PARAM('enable_rich_vector_format', 'FALSE') */ array_compact(c2) a from vtt2;
+----------+
| a        |
+----------+
| ["test"] |
| ["test"] |
| NULL     |
| []       |
| []       |
+----------+
select /*+ OPT_PARAM('rowsets_enabled', 'FALSE') */ array_compact(c2) a from vtt2;
+----------+
| a        |
+----------+
| ["test"] |
| ["test"] |
| NULL     |
| []       |
| []       |
+----------+

select /*+ OPT_PARAM('enable_rich_vector_format', 'FALSE') */ array_compact(c2) a from vtt1;
+--------------------------+
| a                        |
+--------------------------+
| ["test",NULL]            |
| ["test","a",NULL,"null"] |
| NULL                     |
| []                       |
| []                       |
+--------------------------+
select /*+ OPT_PARAM('rowsets_enabled', 'FALSE') */ array_compact(c2) a from vtt1;
+--------------------------+
| a                        |
+--------------------------+
| ["test",NULL]            |
| ["test","a",NULL,"null"] |
| NULL                     |
| []                       |
| []                       |
+--------------------------+
select /*+ OPT_PARAM('enable_rich_vector_format', 'FALSE') */ array_compact(c2) a from tt1;
+--------------------------+
| a                        |
+--------------------------+
| ["test",NULL]            |
| ["test","a",NULL,"null"] |
| NULL                     |
| []                       |
| []                       |
+--------------------------+
select /*+ OPT_PARAM('rowsets_enabled', 'FALSE') */ array_compact(c2) a from tt1;
+--------------------------+
| a                        |
+--------------------------+
| ["test",NULL]            |
| ["test","a",NULL,"null"] |
| NULL                     |
| []                       |
| []                       |
+--------------------------+

select /*+ OPT_PARAM('rowsets_enabled', 'FALSE') */ /*+ OPT_PARAM('enable_rich_vector_format', 'FALSE') */ array_compact(c2) a from tt2;
+----------+
| a        |
+----------+
| ["test"] |
| ["test"] |
| NULL     |
| []       |
| []       |
+----------+

select array_compact([null]);
+-----------------------+
| array_compact([null]) |
+-----------------------+
| [NULL]                |
+-----------------------+
select array_compact([null,null]);
+----------------------------+
| array_compact([null,null]) |
+----------------------------+
| [NULL]                     |
+----------------------------+
select array_compact([[1,2,3,3,4],null,null]);
+----------------------------------------+
| array_compact([[1,2,3,3,4],null,null]) |
+----------------------------------------+
| [[1,2,3,3,4],NULL]                     |
+----------------------------------------+
select array_compact([[1,2,3,4,4,null,null],null,null]);
+--------------------------------------------------+
| array_compact([[1,2,3,4,4,null,null],null,null]) |
+--------------------------------------------------+
| [[1,2,3,4,4,NULL,NULL],NULL]                     |
+--------------------------------------------------+
select array_compact([["null","123"],["null","123","check"],["null","123","check"]]);
+-------------------------------------------------------------------------------+
| array_compact([["null","123"],["null","123","check"],["null","123","check"]]) |
+-------------------------------------------------------------------------------+
| [["null","123"],["null","123","check"]]                                       |
+-------------------------------------------------------------------------------+
select array_compact([[true,false,true,null],[true,null,false,true],["true",null,"false","true"]]);
+---------------------------------------------------------------------------------------------+
| array_compact([[true,false,true,null],[true,null,false,true],["true",null,"false","true"]]) |
+---------------------------------------------------------------------------------------------+
| [["1","0","1",NULL],["1",NULL,"0","1"],["true",NULL,"false","true"]]                        |
+---------------------------------------------------------------------------------------------+
select array_compact([[true,false,true,null],[true,null,false,true]]);
+----------------------------------------------------------------+
| array_compact([[true,false,true,null],[true,null,false,true]]) |
+----------------------------------------------------------------+
| [[1,0,1,NULL],[1,NULL,0,1]]                                    |
+----------------------------------------------------------------+
select array_compact([[true,false,true,null],[true,false,true,null],["true",null,"false","true"]]);
+---------------------------------------------------------------------------------------------+
| array_compact([[true,false,true,null],[true,false,true,null],["true",null,"false","true"]]) |
+---------------------------------------------------------------------------------------------+
| [["1","0","1",NULL],["true",NULL,"false","true"]]                                           |
+---------------------------------------------------------------------------------------------+
select array_compact([[],[]]);
ERROR 42000: You have an error in your SQL syntax; check the manual that corresponds to your OceanBase version for the right syntax to use near '],[]])' at line 1
select array_compact([]);
ERROR 42000: You have an error in your SQL syntax; check the manual that corresponds to your OceanBase version for the right syntax to use near '])' at line 1
select array_compact([[null],[NULL]]);
+--------------------------------+
| array_compact([[null],[NULL]]) |
+--------------------------------+
| [[NULL]]                       |
+--------------------------------+
select array_compact(([[""],null]));
+------------------------------+
| array_compact(([[""],null])) |
+------------------------------+
| [[""],NULL]                  |
+------------------------------+
select array_compact([[null],[null],[""]]);
+-------------------------------------+
| array_compact([[null],[null],[""]]) |
+-------------------------------------+
| [[NULL],[""]]                       |
+-------------------------------------+

select array_compact([[-1,-3,"check"],[-1,-3,"check"],[true,false,-1,-3,"check"]]);
+-----------------------------------------------------------------------------+
| array_compact([[-1,-3,"check"],[-1,-3,"check"],[true,false,-1,-3,"check"]]) |
+-----------------------------------------------------------------------------+
| [["-1","-3","check"],["1","0","-1","-3","check"]]                           |
+-----------------------------------------------------------------------------+
select array_compact([["ttt","123123","ses"],["ttt","123123","ses"],["a","b","c"]]);
+------------------------------------------------------------------------------+
| array_compact([["ttt","123123","ses"],["ttt","123123","ses"],["a","b","c"]]) |
+------------------------------------------------------------------------------+
| [["ttt","123123","ses"],["a","b","c"]]                                       |
+------------------------------------------------------------------------------+
select array_compact([["ttt","123123","ses"],["ttt","123123","ses"],["ttt","123123","ses"]]);
+---------------------------------------------------------------------------------------+
| array_compact([["ttt","123123","ses"],["ttt","123123","ses"],["ttt","123123","ses"]]) |
+---------------------------------------------------------------------------------------+
| [["ttt","123123","ses"]]                                                              |
+---------------------------------------------------------------------------------------+
select array_compact([[""],[""]]);
+----------------------------+
| array_compact([[""],[""]]) |
+----------------------------+
| [[""]]                     |
+----------------------------+
select array_compact(["","",""]);
+---------------------------+
| array_compact(["","",""]) |
+---------------------------+
| [""]                      |
+---------------------------+

select array_compact(["",'[]','[]',"array_remove[]"]);
+------------------------------------------------+
| array_compact(["",'[]','[]',"array_remove[]"]) |
+------------------------------------------------+
| ["","[]","array_remove[]"]                     |
+------------------------------------------------+
select array_compact([['',''],['','']]);
+----------------------------------+
| array_compact([['',''],['','']]) |
+----------------------------------+
| [["",""]]                        |
+----------------------------------+
select array_compact([[['','']],[['','']]]);
+--------------------------------------+
| array_compact([[['','']],[['','']]]) |
+--------------------------------------+
| [[["",""]]]                          |
+--------------------------------------+
select array_compact([[null,''],[null,'']]);
+--------------------------------------+
| array_compact([[null,''],[null,'']]) |
+--------------------------------------+
| [[NULL,""]]                          |
+--------------------------------------+

select array_compact(['test1',null,null,'test1']);
+--------------------------------------------+
| array_compact(['test1',null,null,'test1']) |
+--------------------------------------------+
| ["test1",NULL,"test1"]                     |
+--------------------------------------------+
select array_compact([['test1',null],['test1',null],[null],[null],['null'],['null']]);
+--------------------------------------------------------------------------------+
| array_compact([['test1',null],['test1',null],[null],[null],['null'],['null']]) |
+--------------------------------------------------------------------------------+
| [["test1",NULL],[NULL],["null"]]                                               |
+--------------------------------------------------------------------------------+
select array_compact([[null,'test'],[null]]);
+---------------------------------------+
| array_compact([[null,'test'],[null]]) |
+---------------------------------------+
| [[NULL,"test"],[NULL]]                |
+---------------------------------------+
select array_compact([[null],['test']]);
+----------------------------------+
| array_compact([[null],['test']]) |
+----------------------------------+
| [[NULL],["test"]]                |
+----------------------------------+

drop table test;
create table test(id int,a varchar(262144));
insert into test values(1,repeat('x',262));
select array_compact([array(a),array(a)]) from test;
+------------------------------------------------------------------------------------------------------------------------------------------------------------------------------------------------------------------------------------------------------------------------------+
| array_compact([array(a),array(a)])                                                                                                                                                                                                                                           |
+------------------------------------------------------------------------------------------------------------------------------------------------------------------------------------------------------------------------------------------------------------------------------+
| [["xxxxxxxxxxxxxxxxxxxxxxxxxxxxxxxxxxxxxxxxxxxxxxxxxxxxxxxxxxxxxxxxxxxxxxxxxxxxxxxxxxxxxxxxxxxxxxxxxxxxxxxxxxxxxxxxxxxxxxxxxxxxxxxxxxxxxxxxxxxxxxxxxxxxxxxxxxxxxxxxxxxxxxxxxxxxxxxxxxxxxxxxxxxxxxxxxxxxxxxxxxxxxxxxxxxxxxxxxxxxxxxxxxxxxxxxxxxxxxxxxxxxxxxxxxxxxxxxxxxxxx"]] |
+------------------------------------------------------------------------------------------------------------------------------------------------------------------------------------------------------------------------------------------------------------------------------+
select array_compact([array(a),[3]]) from test;
+------------------------------------------------------------------------------------------------------------------------------------------------------------------------------------------------------------------------------------------------------------------------------------+
| array_compact([array(a),[3]])                                                                                                                                                                                                                                                      |
+------------------------------------------------------------------------------------------------------------------------------------------------------------------------------------------------------------------------------------------------------------------------------------+
| [["xxxxxxxxxxxxxxxxxxxxxxxxxxxxxxxxxxxxxxxxxxxxxxxxxxxxxxxxxxxxxxxxxxxxxxxxxxxxxxxxxxxxxxxxxxxxxxxxxxxxxxxxxxxxxxxxxxxxxxxxxxxxxxxxxxxxxxxxxxxxxxxxxxxxxxxxxxxxxxxxxxxxxxxxxxxxxxxxxxxxxxxxxxxxxxxxxxxxxxxxxxxxxxxxxxxxxxxxxxxxxxxxxxxxxxxxxxxxxxxxxxxxxxxxxxxxxxxxxxxxxx"],["3"]] |
+------------------------------------------------------------------------------------------------------------------------------------------------------------------------------------------------------------------------------------------------------------------------------------+
select array_compact([array(a),['xxxxxxxx']]) from test;
+-------------------------------------------------------------------------------------------------------------------------------------------------------------------------------------------------------------------------------------------------------------------------------------------+
| array_compact([array(a),['xxxxxxxx']])                                                                                                                                                                                                                                                    |
+-------------------------------------------------------------------------------------------------------------------------------------------------------------------------------------------------------------------------------------------------------------------------------------------+
| [["xxxxxxxxxxxxxxxxxxxxxxxxxxxxxxxxxxxxxxxxxxxxxxxxxxxxxxxxxxxxxxxxxxxxxxxxxxxxxxxxxxxxxxxxxxxxxxxxxxxxxxxxxxxxxxxxxxxxxxxxxxxxxxxxxxxxxxxxxxxxxxxxxxxxxxxxxxxxxxxxxxxxxxxxxxxxxxxxxxxxxxxxxxxxxxxxxxxxxxxxxxxxxxxxxxxxxxxxxxxxxxxxxxxxxxxxxxxxxxxxxxxxxxxxxxxxxxxxxxxxxx"],["xxxxxxxx"]] |
+-------------------------------------------------------------------------------------------------------------------------------------------------------------------------------------------------------------------------------------------------------------------------------------------+
select array_compact([['[1]'],['[1]','test']]);
+-----------------------------------------+
| array_compact([['[1]'],['[1]','test']]) |
+-----------------------------------------+
| [["[1]"],["[1]","test"]]                |
+-----------------------------------------+
select array_compact([['test','test1','test2'],['[1]','test']]);
+----------------------------------------------------------+
| array_compact([['test','test1','test2'],['[1]','test']]) |
+----------------------------------------------------------+
| [["test","test1","test2"],["[1]","test"]]                |
+----------------------------------------------------------+
select array_compact([["aaaa","teset"],['aaaa','testet']]);
+-----------------------------------------------------+
| array_compact([["aaaa","teset"],['aaaa','testet']]) |
+-----------------------------------------------------+
| [["aaaa","teset"],["aaaa","testet"]]                |
+-----------------------------------------------------+

select array_compact([['test],[test1'],['test1']]);
+---------------------------------------------+
| array_compact([['test],[test1'],['test1']]) |
+---------------------------------------------+
| [["test],[test1"],["test1"]]                |
+---------------------------------------------+

drop table tt1;
create table tt1(id int,c1 array(array(int)), c2 array(array(varchar(256))), c3 array(array(tinyint)), c4 array(array(bigint)), c5 array(array(float)), c6 array(array(double)), c7 array(array(smallint)));

insert into tt1 values(1,[null,null,[-2147483648,-2147483647,0,77777],[null]],[[''],[''],['test','test'],['test',null],null,null],[[127,0,-128],[127,0,-128],null,null],[[-9223372036854775808,775,808,2,0],[-9223372036854775808,775,808,2,0],[null],null],[[3.402, 0, 1.175],null,null],
[[1.7976931348623157E+308, 2.2250738585072014E-308,2.2250738585072014E-308],null,null],[null,null,[-32768,0,32767,32767],[-32768,0,32767,32767]]);

insert into tt1 values(2,[null,null,[null],[null]],[[null,null],[''],['']],[null,null,[null],[null]],[null,null,[null],[null]],[null,null,[null],[null]],[null,null,[null],[null]],[null,null,[null],[null]]);

insert into tt1 values(3,null,null,null,null,null,null,null);

select * from tt1;
+------+------------------------------------------------------+-----------------------------------------------------+---------------------------------------+-------------------------------------------------------------------------------------+-----------------------------+--------------------------------------------------------------------------------------+-----------------------------------------------------------+
| id   | c1                                                   | c2                                                  | c3                                    | c4                                                                                  | c5                          | c6                                                                                   | c7                                                        |
+------+------------------------------------------------------+-----------------------------------------------------+---------------------------------------+-------------------------------------------------------------------------------------+-----------------------------+--------------------------------------------------------------------------------------+-----------------------------------------------------------+
|    1 | [NULL,NULL,[-2147483648,-2147483647,0,77777],[NULL]] | [[""],[""],["test","test"],["test",NULL],NULL,NULL] | [[127,0,-128],[127,0,-128],NULL,NULL] | [[-9223372036854775808,775,808,2,0],[-9223372036854775808,775,808,2,0],[NULL],NULL] | [[3.402,0,1.175],NULL,NULL] | [[1.7976931348623157e308,2.2250738585072014e-308,2.2250738585072014e-308],NULL,NULL] | [NULL,NULL,[-32768,0,32767,32767],[-32768,0,32767,32767]] |
|    2 | [NULL,NULL,[NULL],[NULL]]                            | [[NULL,NULL],[""],[""]]                             | [NULL,NULL,[NULL],[NULL]]             | [NULL,NULL,[NULL],[NULL]]                                                           | [NULL,NULL,[NULL],[NULL]]   | [NULL,NULL,[NULL],[NULL]]                                                            | [NULL,NULL,[NULL],[NULL]]                                 |
|    3 | NULL                                                 | NULL                                                | NULL                                  | NULL                                                                                | NULL                        | NULL                                                                                 | NULL                                                      |
+------+------------------------------------------------------+-----------------------------------------------------+---------------------------------------+-------------------------------------------------------------------------------------+-----------------------------+--------------------------------------------------------------------------------------+-----------------------------------------------------------+
select array_compact(tt1.c1) from tt1;
+-------------------------------------------------+
| array_compact(tt1.c1)                           |
+-------------------------------------------------+
| [NULL,[-2147483648,-2147483647,0,77777],[NULL]] |
| [NULL,[NULL]]                                   |
| NULL                                            |
+-------------------------------------------------+
select array_compact(tt1.c2) from tt1;
+-------------------------------------------+
| array_compact(tt1.c2)                     |
+-------------------------------------------+
| [[""],["test","test"],["test",NULL],NULL] |
| [[NULL,NULL],[""]]                        |
| NULL                                      |
+-------------------------------------------+
select array_compact(tt1.c3) from tt1;
+-----------------------+
| array_compact(tt1.c3) |
+-----------------------+
| [[127,0,-128],NULL]   |
| [NULL,[NULL]]         |
| NULL                  |
+-----------------------+
select array_compact(tt1.c4) from tt1;
+--------------------------------------------------+
| array_compact(tt1.c4)                            |
+--------------------------------------------------+
| [[-9223372036854775808,775,808,2,0],[NULL],NULL] |
| [NULL,[NULL]]                                    |
| NULL                                             |
+--------------------------------------------------+
select array_compact(tt1.c5) from tt1;
+------------------------+
| array_compact(tt1.c5)  |
+------------------------+
| [[3.402,0,1.175],NULL] |
| [NULL,[NULL]]          |
| NULL                   |
+------------------------+
select array_compact(tt1.c6) from tt1;
+---------------------------------------------------------------------------------+
| array_compact(tt1.c6)                                                           |
+---------------------------------------------------------------------------------+
| [[1.7976931348623157e308,2.2250738585072014e-308,2.2250738585072014e-308],NULL] |
| [NULL,[NULL]]                                                                   |
| NULL                                                                            |
+---------------------------------------------------------------------------------+
select array_compact(tt1.c7) from tt1;
+-------------------------------+
| array_compact(tt1.c7)         |
+-------------------------------+
| [NULL,[-32768,0,32767,32767]] |
| [NULL,[NULL]]                 |
| NULL                          |
+-------------------------------+

select array_length(array_compact(array_compact(array_compact(tt1.c4)))) from tt1;
+-------------------------------------------------------------------+
| array_length(array_compact(array_compact(array_compact(tt1.c4)))) |
+-------------------------------------------------------------------+
|                                                                 3 |
|                                                                 2 |
|                                                              NULL |
+-------------------------------------------------------------------+

drop table test;
create table test as select array_compact(tt1.c1) from tt1;
desc test;
+-----------------------+-------------------+------+-----+---------+-------+
| Field                 | Type              | Null | Key | Default | Extra |
+-----------------------+-------------------+------+-----+---------+-------+
| array_compact(tt1.c1) | ARRAY(ARRAY(INT)) | YES  |     | NULL    |       |
+-----------------------+-------------------+------+-----+---------+-------+
drop table test;

drop table tt1;
create table tt1(id int,c1 array(array(int)), c2 array(array(varchar(256))), c3 array(array(tinyint)), c4 array(array(bigint)), c5 array(array(float)), c6 array(array(double)), c7 array(array(smallint)));

insert into tt1 values(1,[null,null,[-2147483648,-2147483647,0,77777],[null]],[['[]'],['[]'],['],['],[''],[''],['test','test'],['test',null],null,null],[[127,0,-128],[127,0,-128],null,null],[[-9223372036854775808,775,808,2,0],[-9223372036854775808,775,808,2,0],[null],null],[[3.402, 0, 1.175],null,null],
[[1.7976931348623157E+308, 2.2250738585072014E-308,2.2250738585072014E-308],null,null],[null,null,[-32768,0,32767,32767],[-32768,0,32767,32767]]);

insert into tt1 values(2,[null,null,[null],[null]],[[null,null],[''],[''],['[]'],['[]'],['],['],['']],[null,null,[null],[null]],[null,null,[null],[null]],[null,null,[null],[null]],[null,null,[null],[null]],[null,null,[null],[null]]);

insert into tt1 values(3,null,null,null,null,null,null,null);

insert into tt1 values(4,null,array(array_remove([1],1)),array(array_remove([1],1)),array(array_remove([1],1)),null,null,null);

select * from tt1;
+------+------------------------------------------------------+---------------------------------------------------------------------------+---------------------------------------+-------------------------------------------------------------------------------------+-----------------------------+--------------------------------------------------------------------------------------+-----------------------------------------------------------+
| id   | c1                                                   | c2                                                                        | c3                                    | c4                                                                                  | c5                          | c6                                                                                   | c7                                                        |
+------+------------------------------------------------------+---------------------------------------------------------------------------+---------------------------------------+-------------------------------------------------------------------------------------+-----------------------------+--------------------------------------------------------------------------------------+-----------------------------------------------------------+
|    1 | [NULL,NULL,[-2147483648,-2147483647,0,77777],[NULL]] | [["[]"],["[]"],["],["],[""],[""],["test","test"],["test",NULL],NULL,NULL] | [[127,0,-128],[127,0,-128],NULL,NULL] | [[-9223372036854775808,775,808,2,0],[-9223372036854775808,775,808,2,0],[NULL],NULL] | [[3.402,0,1.175],NULL,NULL] | [[1.7976931348623157e308,2.2250738585072014e-308,2.2250738585072014e-308],NULL,NULL] | [NULL,NULL,[-32768,0,32767,32767],[-32768,0,32767,32767]] |
|    2 | [NULL,NULL,[NULL],[NULL]]                            | [[NULL,NULL],[""],[""],["[]"],["[]"],["],["],[""]]                        | [NULL,NULL,[NULL],[NULL]]             | [NULL,NULL,[NULL],[NULL]]                                                           | [NULL,NULL,[NULL],[NULL]]   | [NULL,NULL,[NULL],[NULL]]                                                            | [NULL,NULL,[NULL],[NULL]]                                 |
|    3 | NULL                                                 | NULL                                                                      | NULL                                  | NULL                                                                                | NULL                        | NULL                                                                                 | NULL                                                      |
|    4 | NULL                                                 | [[]]                                                                      | [[]]                                  | [[]]                                                                                | NULL                        | NULL                                                                                 | NULL                                                      |
+------+------------------------------------------------------+---------------------------------------------------------------------------+---------------------------------------+-------------------------------------------------------------------------------------+-----------------------------+--------------------------------------------------------------------------------------+-----------------------------------------------------------+
select array_compact(tt1.c1) from tt1;
+-------------------------------------------------+
| array_compact(tt1.c1)                           |
+-------------------------------------------------+
| [NULL,[-2147483648,-2147483647,0,77777],[NULL]] |
| [NULL,[NULL]]                                   |
| NULL                                            |
| NULL                                            |
+-------------------------------------------------+
select array_compact(tt1.c2) from tt1;
+----------------------------------------------------------+
| array_compact(tt1.c2)                                    |
+----------------------------------------------------------+
| [["[]"],["],["],[""],["test","test"],["test",NULL],NULL] |
| [[NULL,NULL],[""],["[]"],["],["],[""]]                   |
| NULL                                                     |
| [[]]                                                     |
+----------------------------------------------------------+
select array_compact(tt1.c3) from tt1;
+-----------------------+
| array_compact(tt1.c3) |
+-----------------------+
| [[127,0,-128],NULL]   |
| [NULL,[NULL]]         |
| NULL                  |
| [[]]                  |
+-----------------------+
select array_compact(tt1.c4) from tt1;
+--------------------------------------------------+
| array_compact(tt1.c4)                            |
+--------------------------------------------------+
| [[-9223372036854775808,775,808,2,0],[NULL],NULL] |
| [NULL,[NULL]]                                    |
| NULL                                             |
| [[]]                                             |
+--------------------------------------------------+
select array_compact(tt1.c5) from tt1;
+------------------------+
| array_compact(tt1.c5)  |
+------------------------+
| [[3.402,0,1.175],NULL] |
| [NULL,[NULL]]          |
| NULL                   |
| NULL                   |
+------------------------+
select array_compact(tt1.c6) from tt1;
+---------------------------------------------------------------------------------+
| array_compact(tt1.c6)                                                           |
+---------------------------------------------------------------------------------+
| [[1.7976931348623157e308,2.2250738585072014e-308,2.2250738585072014e-308],NULL] |
| [NULL,[NULL]]                                                                   |
| NULL                                                                            |
| NULL                                                                            |
+---------------------------------------------------------------------------------+
select array_compact(tt1.c7) from tt1;
+-------------------------------+
| array_compact(tt1.c7)         |
+-------------------------------+
| [NULL,[-32768,0,32767,32767]] |
| [NULL,[NULL]]                 |
| NULL                          |
| NULL                          |
+-------------------------------+

drop table test;
create table test as select array_compact(tt1.c2) from tt1;
desc test;
+-----------------------+----------------------------+------+-----+---------+-------+
| Field                 | Type                       | Null | Key | Default | Extra |
+-----------------------+----------------------------+------+-----+---------+-------+
| array_compact(tt1.c2) | ARRAY(ARRAY(VARCHAR(256))) | YES  |     | NULL    |       |
+-----------------------+----------------------------+------+-----+---------+-------+
drop table test;

drop table tt1;
create table tt1(id int,c1 array(array(varchar(256))), c2 array(array(varchar(256))));
insert into tt1 values(1,[null,null,[null],[null]],[null,null,[''],[''],array_remove([1,''],1),array_remove([2,''],''),array_remove([''],'')]);
insert into tt1 values(2,[null,null,array_remove([1,''],''),array_remove([2,''],''),array_remove(['',']','['],'[')],[null,null,array_remove(['',null],'')]);

select * from tt1;
+------+----------------------------------+-------------------------------------+
| id   | c1                               | c2                                  |
+------+----------------------------------+-------------------------------------+
|    1 | [NULL,NULL,[NULL],[NULL]]        | [NULL,NULL,[""],[""],[""],["2"],[]] |
|    2 | [NULL,NULL,["1"],["2"],["","]"]] | [NULL,NULL,[NULL]]                  |
+------+----------------------------------+-------------------------------------+
select array_compact(tt1.c1) from tt1;
+-----------------------------+
| array_compact(tt1.c1)       |
+-----------------------------+
| [NULL,[NULL]]               |
| [NULL,["1"],["2"],["","]"]] |
+-----------------------------+
select array_compact(tt1.c2) from tt1;
+-----------------------+
| array_compact(tt1.c2) |
+-----------------------+
| [NULL,[""],["2"],[]]  |
| [NULL,[NULL]]         |
+-----------------------+

drop table test;
create table test as select array_compact(tt1.c2) from tt1;
desc test;
+-----------------------+----------------------------+------+-----+---------+-------+
| Field                 | Type                       | Null | Key | Default | Extra |
+-----------------------+----------------------------+------+-----+---------+-------+
| array_compact(tt1.c2) | ARRAY(ARRAY(VARCHAR(256))) | YES  |     | NULL    |       |
+-----------------------+----------------------------+------+-----+---------+-------+
drop table test;

drop table tt1;
create table tt1(id int,c1 array(array(int)), c2 array(varchar(256)), c3 array(tinyint), c4 array(bigint), c5 array(float), c6 array(double), c7 array(smallint));

insert into tt1 values(1,[[null,1,3,2,2,null],null,null],['test','test'],[127,0,-128],[-9223372036854775808,9223372036854775807,775,808,2,0],[3.402, 0, 1.175],
[1.7976931348623157E+308, 2.2250738585072014E-308,2.2250738585072014E-308],[-32768,0,32767,32767]);

select array_compact(c1) from tt1;
+----------------------------+
| array_compact(c1)          |
+----------------------------+
| [[NULL,1,3,2,2,NULL],NULL] |
+----------------------------+
select array_compact(array_compact(c1)) from tt1;
+----------------------------------+
| array_compact(array_compact(c1)) |
+----------------------------------+
| [[NULL,1,3,2,2,NULL],NULL]       |
+----------------------------------+

drop table tt1;
create table tt1(id int ,c1 varchar(256)[][]);
insert into tt1 values(1,'[null,[null,null],[null],["tt",null]]');
insert into tt1 values(2,'[[null,"null"],[null,"null"]]');
select * from tt1;
+------+---------------------------------------+
| id   | c1                                    |
+------+---------------------------------------+
|    1 | [NULL,[NULL,NULL],[NULL],["tt",NULL]] |
|    2 | [[NULL,"null"],[NULL,"null"]]         |
+------+---------------------------------------+
select array_compact(tt1.c1) from tt1;
+---------------------------------------+
| array_compact(tt1.c1)                 |
+---------------------------------------+
| [NULL,[NULL,NULL],[NULL],["tt",NULL]] |
| [[NULL,"null"]]                       |
+---------------------------------------+
drop table if exists test;
Warnings:
Note	1051	Unknown table 'testkj.test'
CREATE TABLE test (id int ,c4 varchar(256)[][]);
insert into test values(1,'[null,[],[1],["test",null],[null],[],null,null]');
select array_compact(test.c4) from test;
+----------------------------------------------+
| array_compact(test.c4)                       |
+----------------------------------------------+
| [NULL,[],["1"],["test",NULL],[NULL],[],NULL] |
+----------------------------------------------+
drop table tt1;
create table tt1(id int, c1 varchar(256)[][][]);
insert into tt1 values(1,'[[null,[],[1],[3,null],[null],[]],null,null]');
insert into tt1 values(2,'[null,null,[null,[],[1],[3,null],[null],[]]]');
select * from tt1;
+------+--------------------------------------------------+
| id   | c1                                               |
+------+--------------------------------------------------+
|    1 | [[NULL,[],["1"],["3",NULL],[NULL],[]],NULL,NULL] |
|    2 | [NULL,NULL,[NULL,[],["1"],["3",NULL],[NULL],[]]] |
+------+--------------------------------------------------+
select array_compact(tt1.c1) from tt1;
+---------------------------------------------+
| array_compact(tt1.c1)                       |
+---------------------------------------------+
| [[NULL,[],["1"],["3",NULL],[NULL],[]],NULL] |
| [NULL,[NULL,[],["1"],["3",NULL],[NULL],[]]] |
+---------------------------------------------+

select array_compact([[null,array_remove([1],1),[1],[3,null],[null]],[null,array_remove([2],2),[1],[3,null],[null]]]);
+----------------------------------------------------------------------------------------------------------------+
| array_compact([[null,array_remove([1],1),[1],[3,null],[null]],[null,array_remove([2],2),[1],[3,null],[null]]]) |
+----------------------------------------------------------------------------------------------------------------+
| [[NULL,[],[1],[3,NULL],[NULL]]]                                                                                |
+----------------------------------------------------------------------------------------------------------------+
drop table if exists test;
CREATE TABLE test (id int ,c4 varchar(256)[][][][]);
insert into test values(1,'[null,null,[[null,[],[1],["test",null],["test",null],[null],[]]],[[[null]]],[[[null]]]]');
select array_compact(test.c4) from test;
+---------------------------------------------------------------------------+
| array_compact(test.c4)                                                    |
+---------------------------------------------------------------------------+
| [NULL,[[NULL,[],["1"],["test",NULL],["test",NULL],[NULL],[]]],[[[NULL]]]] |
+---------------------------------------------------------------------------+
select * from test;
+------+-------------------------------------------------------------------------------------------+
| id   | c4                                                                                        |
+------+-------------------------------------------------------------------------------------------+
|    1 | [NULL,NULL,[[NULL,[],["1"],["test",NULL],["test",NULL],[NULL],[]]],[[[NULL]]],[[[NULL]]]] |
+------+-------------------------------------------------------------------------------------------+

drop table if exists test;
CREATE TABLE test (id int ,c4 varchar(256)[][][][][]);
insert into test values(1,'[null,null,[[[null,[],[1],["test",null],["test",null],[null],[]]]],[[[[null]]]],[[[[null]]]]]');

select array_compact(test.c4) from test;
+-------------------------------------------------------------------------------+
| array_compact(test.c4)                                                        |
+-------------------------------------------------------------------------------+
| [NULL,[[[NULL,[],["1"],["test",NULL],["test",NULL],[NULL],[]]]],[[[[NULL]]]]] |
+-------------------------------------------------------------------------------+
select * from test;
+------+-------------------------------------------------------------------------------------------------+
| id   | c4                                                                                              |
+------+-------------------------------------------------------------------------------------------------+
|    1 | [NULL,NULL,[[[NULL,[],["1"],["test",NULL],["test",NULL],[NULL],[]]]],[[[[NULL]]]],[[[[NULL]]]]] |
+------+-------------------------------------------------------------------------------------------------+

drop table if exists test;
CREATE TABLE test (id int ,c4 varchar(256)[][][][][][]);
insert into test values(1,'[null,null,[[[[null,[],[1],["test",null],["test",null],[null],[]]]]],[[[[[null]]]]],[[[[[null]]]]]]');

select array_compact(test.c4) from test;
+-----------------------------------------------------------------------------------+
| array_compact(test.c4)                                                            |
+-----------------------------------------------------------------------------------+
| [NULL,[[[[NULL,[],["1"],["test",NULL],["test",NULL],[NULL],[]]]]],[[[[[NULL]]]]]] |
+-----------------------------------------------------------------------------------+
select * from test;
+------+-------------------------------------------------------------------------------------------------------+
| id   | c4                                                                                                    |
+------+-------------------------------------------------------------------------------------------------------+
|    1 | [NULL,NULL,[[[[NULL,[],["1"],["test",NULL],["test",NULL],[NULL],[]]]]],[[[[[NULL]]]]],[[[[[NULL]]]]]] |
+------+-------------------------------------------------------------------------------------------------------+
desc test;
+-------+--------------------------------------------------------+------+-----+---------+-------+
| Field | Type                                                   | Null | Key | Default | Extra |
+-------+--------------------------------------------------------+------+-----+---------+-------+
| id    | int(11)                                                | YES  |     | NULL    |       |
| c4    | ARRAY(ARRAY(ARRAY(ARRAY(ARRAY(ARRAY(VARCHAR(256))))))) | YES  |     | NULL    |       |
+-------+--------------------------------------------------------+------+-----+---------+-------+
drop table test;

select array_compact([[b'111',b'101'],[b'111',b'101']]);
ERROR 0A000: array element type not supported
select array_compact([[cast('{}' as json)],[[1]]]);
ERROR 0A000: array element type not supported

select array_compact([[true],[1]]);
+-----------------------------+
| array_compact([[true],[1]]) |
+-----------------------------+
| [[1]]                       |
+-----------------------------+
select array_compact([[x'01',1,2],[x'01',1,2]]);
ERROR 0A000: array element type not supported
select array_compact([[11],[0x010101000000],[0x010101000000],[11]]);
ERROR 0A000: array element type not supported

select array_compact([[11],[11],[0x0000000001010000000000000000002E400000000000003440],[0x0000000001010000000000000000002E400000000000003440]]);
ERROR 0A000: array element type not supported

select array_compact([-9223372036854775808,-9223372036854775808]);
+------------------------------------------------------------+
| array_compact([-9223372036854775808,-9223372036854775808]) |
+------------------------------------------------------------+
| [-9223372036854775808]                                     |
+------------------------------------------------------------+
select array_compact([[5.00,3.02],[5.00,3.02]]);
+------------------------------------------+
| array_compact([[5.00,3.02],[5.00,3.02]]) |
+------------------------------------------+
| [[5,3.02]]                               |
+------------------------------------------+
select array_compact([[-5.0,10000000.02],[-5.00,10000000.02]]);
+---------------------------------------------------------+
| array_compact([[-5.0,10000000.02],[-5.00,10000000.02]]) |
+---------------------------------------------------------+
| [[-5,10000000.02]]                                      |
+---------------------------------------------------------+
select array_compact([[--5.0,1000000.02,-0.00],[--5.0,1000000.02,-0.00],[5.02,-3000000.02],[5.02,-3000000.02],[true,false,null]]);
+----------------------------------------------------------------------------------------------------------------------------+
| array_compact([[--5.0,1000000.02,-0.00],[--5.0,1000000.02,-0.00],[5.02,-3000000.02],[5.02,-3000000.02],[true,false,null]]) |
+----------------------------------------------------------------------------------------------------------------------------+
| [[5,1000000.02,0],[5.02,-3000000.02],[1,0,NULL]]                                                                           |
+----------------------------------------------------------------------------------------------------------------------------+
select array_compact([[--5.0,1000000.02,-0.00],[--5.0,1000000.02,-0.00],[5.02,-3000000.02],[5.02,-3000000.02],[true,false,null,0.23],[true,false,null,0.23]]);
+--------------------------------------------------------------------------------------------------------------------------------------------------------+
| array_compact([[--5.0,1000000.02,-0.00],[--5.0,1000000.02,-0.00],[5.02,-3000000.02],[5.02,-3000000.02],[true,false,null,0.23],[true,false,null,0.23]]) |
+--------------------------------------------------------------------------------------------------------------------------------------------------------+
| [[5,1000000.02,0],[5.02,-3000000.02],[1,0,NULL,0.23]]                                                                                                  |
+--------------------------------------------------------------------------------------------------------------------------------------------------------+
select array_compact([[-5.0,1000000.02],[-5.0,1000000.02],[1.3,-5.0,6,0,-63],[1.3,-5.0,6,0,-63]]);
+--------------------------------------------------------------------------------------------+
| array_compact([[-5.0,1000000.02],[-5.0,1000000.02],[1.3,-5.0,6,0,-63],[1.3,-5.0,6,0,-63]]) |
+--------------------------------------------------------------------------------------------+
| [[-5,1000000.02],[1.3,-5,6,0,-63]]                                                         |
+--------------------------------------------------------------------------------------------+
select array_compact([[5.0,-200000.02,200000.03,0.62622],[5.0,-200000.02,200000.03,0.62622],['test',null],[null,'test']]);
+--------------------------------------------------------------------------------------------------------------------+
| array_compact([[5.0,-200000.02,200000.03,0.62622],[5.0,-200000.02,200000.03,0.62622],['test',null],[null,'test']]) |
+--------------------------------------------------------------------------------------------------------------------+
| [["5","-200000.02","200000.03","0.62622"],["test",NULL],[NULL,"test"]]                                             |
+--------------------------------------------------------------------------------------------------------------------+

select array_compact([-2.7976931348623157E+308,-2.7976931348623157E+308,-2.7976931348623157E+308]);
ERROR 22007: Illegal double '2.7976931348623157E+308' value found during parsing

select array_compact([[1,2],[1,2,null]]);
+-----------------------------------+
| array_compact([[1,2],[1,2,null]]) |
+-----------------------------------+
| [[1,2],[1,2,NULL]]                |
+-----------------------------------+
select array_compact([[1,2],[1,2]]);
+------------------------------+
| array_compact([[1,2],[1,2]]) |
+------------------------------+
| [[1,2]]                      |
+------------------------------+
select array_compact([[[4,5,6,7],[4,5,6,7]],[[4,5,6,7],[4,5,6,7]]]);
+--------------------------------------------------------------+
| array_compact([[[4,5,6,7],[4,5,6,7]],[[4,5,6,7],[4,5,6,7]]]) |
+--------------------------------------------------------------+
| [[[4,5,6,7],[4,5,6,7]]]                                      |
+--------------------------------------------------------------+
select array_compact([[[4,5,6,7],[4,5,6,7]]]);
+----------------------------------------+
| array_compact([[[4,5,6,7],[4,5,6,7]]]) |
+----------------------------------------+
| [[[4,5,6,7],[4,5,6,7]]]                |
+----------------------------------------+
select array_compact([[1.0,2.1],[1.0,2.1],[1]]);
+------------------------------------------+
| array_compact([[1.0,2.1],[1.0,2.1],[1]]) |
+------------------------------------------+
| [[1,2.1],[1]]                            |
+------------------------------------------+

select array_compact([[[[[4,5]]]],[[[[4,5]]]]]);
+------------------------------------------+
| array_compact([[[[[4,5]]]],[[[[4,5]]]]]) |
+------------------------------------------+
| [[[[[4,5]]]]]                            |
+------------------------------------------+
select array_compact([[[[[[4,5]]]]],[[[[[4,5]]]]]]);
+----------------------------------------------+
| array_compact([[[[[[4,5]]]]],[[[[[4,5]]]]]]) |
+----------------------------------------------+
| [[[[[[4,5]]]]]]                              |
+----------------------------------------------+
select array_compact([[[[[[4,5],[7]]]]],[[[[[4,5],[7]]]]]]);
+------------------------------------------------------+
| array_compact([[[[[[4,5],[7]]]]],[[[[[4,5],[7]]]]]]) |
+------------------------------------------------------+
| [[[[[[4,5],[7]]]]]]                                  |
+------------------------------------------------------+
select array_compact([[[[[[4,5],[7]]]]],[[[[[4,5],[8]]]]]]);
+------------------------------------------------------+
| array_compact([[[[[[4,5],[7]]]]],[[[[[4,5],[8]]]]]]) |
+------------------------------------------------------+
| [[[[[[4,5],[7]]]]],[[[[[4,5],[8]]]]]]                |
+------------------------------------------------------+

drop table test;
create table test(a bigint[],a1 bigint[]);
insert into test values((SELECT CONCAT('[', GROUP_CONCAT(number ORDER BY number SEPARATOR ', '), ']') AS nums
FROM (
     SELECT FLOOR(1+RAND() * 10) AS number
    FROM TABLE(GENERATOR(10000))
) AS temp),(SELECT CONCAT('[', GROUP_CONCAT(number ORDER BY number SEPARATOR ', '), ']') AS nums
FROM (
     SELECT FLOOR(1+RAND() * 100) AS number
    FROM TABLE(GENERATOR(10000))
) AS temp));
select array_compact(a1) from test;
+-------------------------------------------------------------------------------------------------------------------------------------------------------------------------------------------------------------------------------------------------------------------------------------------------------+
| array_compact(a1)                                                                                                                                                                                                                                                                                     |
+-------------------------------------------------------------------------------------------------------------------------------------------------------------------------------------------------------------------------------------------------------------------------------------------------------+
| [1,2,3,4,5,6,7,8,9,10,11,12,13,14,15,16,17,18,19,20,21,22,23,24,25,26,27,28,29,30,31,32,33,34,35,36,37,38,39,40,41,42,43,44,45,46,47,48,49,50,51,52,53,54,55,56,57,58,59,60,61,62,63,64,65,66,67,68,69,70,71,72,73,74,75,76,77,78,79,80,81,82,83,84,85,86,87,88,89,90,91,92,93,94,95,96,97,98,99,100] |
+-------------------------------------------------------------------------------------------------------------------------------------------------------------------------------------------------------------------------------------------------------------------------------------------------------+

### select/group by/order by/limit
drop table tt1;
create table tt1(id int,c1 array(int), c2 array(varchar(256)), c3 array(tinyint), c4 array(bigint), c5 array(float), c6 array(double), c7 array(smallint), c8 vector(3))
PARTITION BY range COLUMNS(id)(
PARTITION p0 values less than(1),
PARTITION p1 values less than(2),
PARTITION p2 values less than(MAXVALUE)
);
create index idx_tt1 on tt1(id);
create UNIQUE index idx_tt1_id on tt1(id);
CREATE INDEX tt1_func_idx2 on tt1((array_max(c2)));
CREATE INDEX tt1_func_idx3 on tt1((array_min(c5)));
CREATE INDEX idx_tt1_cg on tt1(id) WITH COLUMN GROUP(each column);
insert into tt1 values(1,[-2147483648.5,-2147483648.5 ,0, 2147483647.4999998],['test','test',null,null],[127.499999999999992,127.499999999999992,0,-128.5,-128.5],[-9223372036854775808,9223372036854775807,0],[3.402, 0,0,0,0.175], [1.7976931348623157E+308,0, 2.2250738585072014E-308,2.2250738585072014E-308,2.2250738585072014E-308],[-32768.5,0,32767.499999999998],[0.1,2.2,2.2]);
insert into tt1 values(2,[-2147483648.5 ,0, null, 2147483647.4999998],['test','a',null,null,'null','null'],[127.499999999999992,0, null, null, -128.5],[-9223372036854775808, null,9223372036854775807,0],[null,null, 0,3.402,1.175], [-1.7976931348623157E+308, null, 0,2.2250738585072014E-308],[-32768.5,-32768.5,0,null,null,32767.499999999998],[1,2,3]);
insert into tt1 values(3,null,null,null,null,null,null,null,null);
insert into tt1 values(4,'[]','[]','[]','[]','[]','[]','[]',[1,2,3]);
insert into tt1 values(5,array_remove([1],1),array_remove([1],1),array_remove([1],1),array_remove([1],1),array_remove([1],1),array_remove([1],1),array_remove([1],1),[1,2,3]);

drop view vtt1;
create view vtt1 as select * from tt1;

select *,array_compact(c1) as a from tt1;
+------+----------------------------------------+--------------------------------------+------------------------+---------------------------------------------------+---------------------------+----------------------------------------------------------------------------------------------------+-----------------------------------+---------------+---------------------------------+
| id   | c1                                     | c2                                   | c3                     | c4                                                | c5                        | c6                                                                                                 | c7                                | c8            | a                               |
+------+----------------------------------------+--------------------------------------+------------------------+---------------------------------------------------+---------------------------+----------------------------------------------------------------------------------------------------+-----------------------------------+---------------+---------------------------------+
|    1 | [-2147483648,-2147483648,0,2147483647] | ["test","test",NULL,NULL]            | [127,127,0,-128,-128]  | [-9223372036854775808,9223372036854775807,0]      | [3.402,0,0,0,0.175]       | [1.7976931348623157e308,0,2.2250738585072014e-308,2.2250738585072014e-308,2.2250738585072014e-308] | [-32768,0,32767]                  | [0.1,2.2,2.2] | [-2147483648,0,2147483647]      |
|    2 | [-2147483648,0,NULL,2147483647]        | ["test","a",NULL,NULL,"null","null"] | [127,0,NULL,NULL,-128] | [-9223372036854775808,NULL,9223372036854775807,0] | [NULL,NULL,0,3.402,1.175] | [-1.7976931348623157e308,NULL,0,2.2250738585072014e-308]                                           | [-32768,-32768,0,NULL,NULL,32767] | [1,2,3]       | [-2147483648,0,NULL,2147483647] |
|    3 | NULL                                   | NULL                                 | NULL                   | NULL                                              | NULL                      | NULL                                                                                               | NULL                              | NULL          | NULL                            |
|    4 | []                                     | []                                   | []                     | []                                                | []                        | []                                                                                                 | []                                | [1,2,3]       | []                              |
|    5 | []                                     | []                                   | []                     | []                                                | []                        | []                                                                                                 | []                                | [1,2,3]       | []                              |
+------+----------------------------------------+--------------------------------------+------------------------+---------------------------------------------------+---------------------------+----------------------------------------------------------------------------------------------------+-----------------------------------+---------------+---------------------------------+
select array_compact(c1),array_compact(c3),array_compact(c4),array_compact(c5),array_compact(c6),array_compact(c7),array_compact(c8) from tt1;
+---------------------------------+-------------------+---------------------------------------------------+----------------------+----------------------------------------------------------+-----------------------+-------------------+
| array_compact(c1)               | array_compact(c3) | array_compact(c4)                                 | array_compact(c5)    | array_compact(c6)                                        | array_compact(c7)     | array_compact(c8) |
+---------------------------------+-------------------+---------------------------------------------------+----------------------+----------------------------------------------------------+-----------------------+-------------------+
| NULL                            | NULL              | NULL                                              | NULL                 | NULL                                                     | NULL                  | NULL              |
| [-2147483648,0,2147483647]      | [127,0,-128]      | [-9223372036854775808,9223372036854775807,0]      | [3.402,0,0.175]      | [1.7976931348623157e308,0,2.2250738585072014e-308]       | [-32768,0,32767]      | [0.1,2.2]         |
| [-2147483648,0,NULL,2147483647] | [127,0,NULL,-128] | [-9223372036854775808,NULL,9223372036854775807,0] | [NULL,0,3.402,1.175] | [-1.7976931348623157e308,NULL,0,2.2250738585072014e-308] | [-32768,0,NULL,32767] | [1,2,3]           |
| []                              | []                | []                                                | []                   | []                                                       | []                    | [1,2,3]           |
| []                              | []                | []                                                | []                   | []                                                       | []                    | [1,2,3]           |
+---------------------------------+-------------------+---------------------------------------------------+----------------------+----------------------------------------------------------+-----------------------+-------------------+
select array_compact(c1),array_compact(c3),array_compact(c4),array_compact(c5),array_compact(c6),array_compact(c7),array_compact(c8) from vtt1;
+---------------------------------+-------------------+---------------------------------------------------+----------------------+----------------------------------------------------------+-----------------------+-------------------+
| array_compact(c1)               | array_compact(c3) | array_compact(c4)                                 | array_compact(c5)    | array_compact(c6)                                        | array_compact(c7)     | array_compact(c8) |
+---------------------------------+-------------------+---------------------------------------------------+----------------------+----------------------------------------------------------+-----------------------+-------------------+
| NULL                            | NULL              | NULL                                              | NULL                 | NULL                                                     | NULL                  | NULL              |
| [-2147483648,0,2147483647]      | [127,0,-128]      | [-9223372036854775808,9223372036854775807,0]      | [3.402,0,0.175]      | [1.7976931348623157e308,0,2.2250738585072014e-308]       | [-32768,0,32767]      | [0.1,2.2]         |
| [-2147483648,0,NULL,2147483647] | [127,0,NULL,-128] | [-9223372036854775808,NULL,9223372036854775807,0] | [NULL,0,3.402,1.175] | [-1.7976931348623157e308,NULL,0,2.2250738585072014e-308] | [-32768,0,NULL,32767] | [1,2,3]           |
| []                              | []                | []                                                | []                   | []                                                       | []                    | [1,2,3]           |
| []                              | []                | []                                                | []                   | []                                                       | []                    | [1,2,3]           |
+---------------------------------+-------------------+---------------------------------------------------+----------------------+----------------------------------------------------------+-----------------------+-------------------+

select distinct array_compact(c1),array_compact(c3),array_compact(c4),array_compact(c5),array_compact(c6),array_compact(c7),array_compact(c8) from tt1;
ERROR 22000: Invalid data type for the operation
select distinct array_compact([1,1,1,2,3,3,3,5]) from tt1;
+----------------------------------+
| array_compact([1,1,1,2,3,3,3,5]) |
+----------------------------------+
| [1,2,3,5]                        |
+----------------------------------+
select array_compact(c1),array_compact(c3),array_compact(c4),array_compact(c5),array_compact(c6),array_compact(c7),array_compact(c8) from tt1 where array_length(array_compact(c5))>0;
+---------------------------------+-------------------+---------------------------------------------------+----------------------+----------------------------------------------------------+-----------------------+-------------------+
| array_compact(c1)               | array_compact(c3) | array_compact(c4)                                 | array_compact(c5)    | array_compact(c6)                                        | array_compact(c7)     | array_compact(c8) |
+---------------------------------+-------------------+---------------------------------------------------+----------------------+----------------------------------------------------------+-----------------------+-------------------+
| [-2147483648,0,2147483647]      | [127,0,-128]      | [-9223372036854775808,9223372036854775807,0]      | [3.402,0,0.175]      | [1.7976931348623157e308,0,2.2250738585072014e-308]       | [-32768,0,32767]      | [0.1,2.2]         |
| [-2147483648,0,NULL,2147483647] | [127,0,NULL,-128] | [-9223372036854775808,NULL,9223372036854775807,0] | [NULL,0,3.402,1.175] | [-1.7976931348623157e308,NULL,0,2.2250738585072014e-308] | [-32768,0,NULL,32767] | [1,2,3]           |
+---------------------------------+-------------------+---------------------------------------------------+----------------------+----------------------------------------------------------+-----------------------+-------------------+
select array_compact(c1),array_compact(c3),array_compact(c4),array_compact(c5),array_compact(c6),array_compact(c7),array_compact(c8) from tt1 group by array_length(array_compact(c1)) desc;
+---------------------------------+-------------------+---------------------------------------------------+----------------------+----------------------------------------------------------+-----------------------+-------------------+
| array_compact(c1)               | array_compact(c3) | array_compact(c4)                                 | array_compact(c5)    | array_compact(c6)                                        | array_compact(c7)     | array_compact(c8) |
+---------------------------------+-------------------+---------------------------------------------------+----------------------+----------------------------------------------------------+-----------------------+-------------------+
| NULL                            | NULL              | NULL                                              | NULL                 | NULL                                                     | NULL                  | NULL              |
| [-2147483648,0,2147483647]      | [127,0,-128]      | [-9223372036854775808,9223372036854775807,0]      | [3.402,0,0.175]      | [1.7976931348623157e308,0,2.2250738585072014e-308]       | [-32768,0,32767]      | [0.1,2.2]         |
| [-2147483648,0,NULL,2147483647] | [127,0,NULL,-128] | [-9223372036854775808,NULL,9223372036854775807,0] | [NULL,0,3.402,1.175] | [-1.7976931348623157e308,NULL,0,2.2250738585072014e-308] | [-32768,0,NULL,32767] | [1,2,3]           |
| []                              | []                | []                                                | []                   | []                                                       | []                    | [1,2,3]           |
+---------------------------------+-------------------+---------------------------------------------------+----------------------+----------------------------------------------------------+-----------------------+-------------------+
select array_compact(c1),array_compact(c3),array_compact(c4),array_compact(c5),array_compact(c6),array_compact(c7),array_compact(c8) from tt1 group by array_length(array_compact(c1)) with rollup;
+---------------------------------+-------------------+---------------------------------------------------+----------------------+----------------------------------------------------------+-----------------------+-------------------+
| array_compact(c1)               | array_compact(c3) | array_compact(c4)                                 | array_compact(c5)    | array_compact(c6)                                        | array_compact(c7)     | array_compact(c8) |
+---------------------------------+-------------------+---------------------------------------------------+----------------------+----------------------------------------------------------+-----------------------+-------------------+
| NULL                            | NULL              | NULL                                              | NULL                 | NULL                                                     | NULL                  | NULL              |
| [-2147483648,0,2147483647]      | [127,0,-128]      | [-9223372036854775808,9223372036854775807,0]      | [3.402,0,0.175]      | [1.7976931348623157e308,0,2.2250738585072014e-308]       | [-32768,0,32767]      | [0.1,2.2]         |
| [-2147483648,0,2147483647]      | [127,0,-128]      | [-9223372036854775808,9223372036854775807,0]      | [3.402,0,0.175]      | [1.7976931348623157e308,0,2.2250738585072014e-308]       | [-32768,0,32767]      | [0.1,2.2]         |
| [-2147483648,0,NULL,2147483647] | [127,0,NULL,-128] | [-9223372036854775808,NULL,9223372036854775807,0] | [NULL,0,3.402,1.175] | [-1.7976931348623157e308,NULL,0,2.2250738585072014e-308] | [-32768,0,NULL,32767] | [1,2,3]           |
| []                              | []                | []                                                | []                   | []                                                       | []                    | [1,2,3]           |
+---------------------------------+-------------------+---------------------------------------------------+----------------------+----------------------------------------------------------+-----------------------+-------------------+
select c1,array_compact(c1),array_compact(c3),array_compact(c4),array_compact(c5),array_compact(c6),array_compact(c7),array_compact(c8) from tt1 group by id with rollup having array_length(array_compact(c1)) > 0;
+----------------------------------------+---------------------------------+-------------------+---------------------------------------------------+----------------------+----------------------------------------------------------+-----------------------+-------------------+
| c1                                     | array_compact(c1)               | array_compact(c3) | array_compact(c4)                                 | array_compact(c5)    | array_compact(c6)                                        | array_compact(c7)     | array_compact(c8) |
+----------------------------------------+---------------------------------+-------------------+---------------------------------------------------+----------------------+----------------------------------------------------------+-----------------------+-------------------+
| [-2147483648,-2147483648,0,2147483647] | [-2147483648,0,2147483647]      | [127,0,-128]      | [-9223372036854775808,9223372036854775807,0]      | [3.402,0,0.175]      | [1.7976931348623157e308,0,2.2250738585072014e-308]       | [-32768,0,32767]      | [0.1,2.2]         |
| [-2147483648,-2147483648,0,2147483647] | [-2147483648,0,2147483647]      | [127,0,-128]      | [-9223372036854775808,9223372036854775807,0]      | [3.402,0,0.175]      | [1.7976931348623157e308,0,2.2250738585072014e-308]       | [-32768,0,32767]      | [0.1,2.2]         |
| [-2147483648,0,NULL,2147483647]        | [-2147483648,0,NULL,2147483647] | [127,0,NULL,-128] | [-9223372036854775808,NULL,9223372036854775807,0] | [NULL,0,3.402,1.175] | [-1.7976931348623157e308,NULL,0,2.2250738585072014e-308] | [-32768,0,NULL,32767] | [1,2,3]           |
+----------------------------------------+---------------------------------+-------------------+---------------------------------------------------+----------------------+----------------------------------------------------------+-----------------------+-------------------+
select c1,array_compact(c1),array_compact(c3),array_compact(c4),array_compact(c5),array_compact(c6),array_compact(c7),array_compact(c8) from tt1 group by id desc having array_length(array_compact(c1)) > 0;
+----------------------------------------+---------------------------------+-------------------+---------------------------------------------------+----------------------+----------------------------------------------------------+-----------------------+-------------------+
| c1                                     | array_compact(c1)               | array_compact(c3) | array_compact(c4)                                 | array_compact(c5)    | array_compact(c6)                                        | array_compact(c7)     | array_compact(c8) |
+----------------------------------------+---------------------------------+-------------------+---------------------------------------------------+----------------------+----------------------------------------------------------+-----------------------+-------------------+
| [-2147483648,0,NULL,2147483647]        | [-2147483648,0,NULL,2147483647] | [127,0,NULL,-128] | [-9223372036854775808,NULL,9223372036854775807,0] | [NULL,0,3.402,1.175] | [-1.7976931348623157e308,NULL,0,2.2250738585072014e-308] | [-32768,0,NULL,32767] | [1,2,3]           |
| [-2147483648,-2147483648,0,2147483647] | [-2147483648,0,2147483647]      | [127,0,-128]      | [-9223372036854775808,9223372036854775807,0]      | [3.402,0,0.175]      | [1.7976931348623157e308,0,2.2250738585072014e-308]       | [-32768,0,32767]      | [0.1,2.2]         |
+----------------------------------------+---------------------------------+-------------------+---------------------------------------------------+----------------------+----------------------------------------------------------+-----------------------+-------------------+
select array_compact(c1),array_compact(c3),array_compact(c4),array_compact(c5),array_compact(c6),array_compact(c7),array_compact(c8) from vtt1 group by array_length(array_compact(c1)) with rollup;
+---------------------------------+-------------------+---------------------------------------------------+----------------------+----------------------------------------------------------+-----------------------+-------------------+
| array_compact(c1)               | array_compact(c3) | array_compact(c4)                                 | array_compact(c5)    | array_compact(c6)                                        | array_compact(c7)     | array_compact(c8) |
+---------------------------------+-------------------+---------------------------------------------------+----------------------+----------------------------------------------------------+-----------------------+-------------------+
| NULL                            | NULL              | NULL                                              | NULL                 | NULL                                                     | NULL                  | NULL              |
| [-2147483648,0,2147483647]      | [127,0,-128]      | [-9223372036854775808,9223372036854775807,0]      | [3.402,0,0.175]      | [1.7976931348623157e308,0,2.2250738585072014e-308]       | [-32768,0,32767]      | [0.1,2.2]         |
| [-2147483648,0,2147483647]      | [127,0,-128]      | [-9223372036854775808,9223372036854775807,0]      | [3.402,0,0.175]      | [1.7976931348623157e308,0,2.2250738585072014e-308]       | [-32768,0,32767]      | [0.1,2.2]         |
| [-2147483648,0,NULL,2147483647] | [127,0,NULL,-128] | [-9223372036854775808,NULL,9223372036854775807,0] | [NULL,0,3.402,1.175] | [-1.7976931348623157e308,NULL,0,2.2250738585072014e-308] | [-32768,0,NULL,32767] | [1,2,3]           |
| []                              | []                | []                                                | []                   | []                                                       | []                    | [1,2,3]           |
+---------------------------------+-------------------+---------------------------------------------------+----------------------+----------------------------------------------------------+-----------------------+-------------------+
select array_compact(c1),array_compact(c3),array_compact(c4),array_compact(c5),array_compact(c6),array_compact(c7),array_compact(c8) from tt1 rollup FOR UPDATE;
+---------------------------------+-------------------+---------------------------------------------------+----------------------+----------------------------------------------------------+-----------------------+-------------------+
| array_compact(c1)               | array_compact(c3) | array_compact(c4)                                 | array_compact(c5)    | array_compact(c6)                                        | array_compact(c7)     | array_compact(c8) |
+---------------------------------+-------------------+---------------------------------------------------+----------------------+----------------------------------------------------------+-----------------------+-------------------+
| NULL                            | NULL              | NULL                                              | NULL                 | NULL                                                     | NULL                  | NULL              |
| [-2147483648,0,2147483647]      | [127,0,-128]      | [-9223372036854775808,9223372036854775807,0]      | [3.402,0,0.175]      | [1.7976931348623157e308,0,2.2250738585072014e-308]       | [-32768,0,32767]      | [0.1,2.2]         |
| [-2147483648,0,NULL,2147483647] | [127,0,NULL,-128] | [-9223372036854775808,NULL,9223372036854775807,0] | [NULL,0,3.402,1.175] | [-1.7976931348623157e308,NULL,0,2.2250738585072014e-308] | [-32768,0,NULL,32767] | [1,2,3]           |
| []                              | []                | []                                                | []                   | []                                                       | []                    | [1,2,3]           |
| []                              | []                | []                                                | []                   | []                                                       | []                    | [1,2,3]           |
+---------------------------------+-------------------+---------------------------------------------------+----------------------+----------------------------------------------------------+-----------------------+-------------------+
select array_compact(c1),array_compact(c3),array_compact(c4),array_compact(c5),array_compact(c6),array_compact(c7),array_compact(c8) from tt1 order by id;
+---------------------------------+-------------------+---------------------------------------------------+----------------------+----------------------------------------------------------+-----------------------+-------------------+
| array_compact(c1)               | array_compact(c3) | array_compact(c4)                                 | array_compact(c5)    | array_compact(c6)                                        | array_compact(c7)     | array_compact(c8) |
+---------------------------------+-------------------+---------------------------------------------------+----------------------+----------------------------------------------------------+-----------------------+-------------------+
| NULL                            | NULL              | NULL                                              | NULL                 | NULL                                                     | NULL                  | NULL              |
| [-2147483648,0,2147483647]      | [127,0,-128]      | [-9223372036854775808,9223372036854775807,0]      | [3.402,0,0.175]      | [1.7976931348623157e308,0,2.2250738585072014e-308]       | [-32768,0,32767]      | [0.1,2.2]         |
| [-2147483648,0,NULL,2147483647] | [127,0,NULL,-128] | [-9223372036854775808,NULL,9223372036854775807,0] | [NULL,0,3.402,1.175] | [-1.7976931348623157e308,NULL,0,2.2250738585072014e-308] | [-32768,0,NULL,32767] | [1,2,3]           |
| []                              | []                | []                                                | []                   | []                                                       | []                    | [1,2,3]           |
| []                              | []                | []                                                | []                   | []                                                       | []                    | [1,2,3]           |
+---------------------------------+-------------------+---------------------------------------------------+----------------------+----------------------------------------------------------+-----------------------+-------------------+
select array_compact(c1),array_compact(c3),array_compact(c4),array_compact(c5),array_compact(c6),array_compact(c7),array_compact(c8) from tt1 order by array_length(array_compact(c5));
+---------------------------------+-------------------+---------------------------------------------------+----------------------+----------------------------------------------------------+-----------------------+-------------------+
| array_compact(c1)               | array_compact(c3) | array_compact(c4)                                 | array_compact(c5)    | array_compact(c6)                                        | array_compact(c7)     | array_compact(c8) |
+---------------------------------+-------------------+---------------------------------------------------+----------------------+----------------------------------------------------------+-----------------------+-------------------+
| NULL                            | NULL              | NULL                                              | NULL                 | NULL                                                     | NULL                  | NULL              |
| [-2147483648,0,2147483647]      | [127,0,-128]      | [-9223372036854775808,9223372036854775807,0]      | [3.402,0,0.175]      | [1.7976931348623157e308,0,2.2250738585072014e-308]       | [-32768,0,32767]      | [0.1,2.2]         |
| [-2147483648,0,NULL,2147483647] | [127,0,NULL,-128] | [-9223372036854775808,NULL,9223372036854775807,0] | [NULL,0,3.402,1.175] | [-1.7976931348623157e308,NULL,0,2.2250738585072014e-308] | [-32768,0,NULL,32767] | [1,2,3]           |
| []                              | []                | []                                                | []                   | []                                                       | []                    | [1,2,3]           |
| []                              | []                | []                                                | []                   | []                                                       | []                    | [1,2,3]           |
+---------------------------------+-------------------+---------------------------------------------------+----------------------+----------------------------------------------------------+-----------------------+-------------------+
select array_compact(c1),array_compact(c3),array_compact(c4),array_compact(c5),array_compact(c6),array_compact(c7),array_compact(c8) from tt1 order by array_avg(array_compact(c5)) desc;
+---------------------------------+-------------------+---------------------------------------------------+----------------------+----------------------------------------------------------+-----------------------+-------------------+
| array_compact(c1)               | array_compact(c3) | array_compact(c4)                                 | array_compact(c5)    | array_compact(c6)                                        | array_compact(c7)     | array_compact(c8) |
+---------------------------------+-------------------+---------------------------------------------------+----------------------+----------------------------------------------------------+-----------------------+-------------------+
| NULL                            | NULL              | NULL                                              | NULL                 | NULL                                                     | NULL                  | NULL              |
| [-2147483648,0,2147483647]      | [127,0,-128]      | [-9223372036854775808,9223372036854775807,0]      | [3.402,0,0.175]      | [1.7976931348623157e308,0,2.2250738585072014e-308]       | [-32768,0,32767]      | [0.1,2.2]         |
| [-2147483648,0,NULL,2147483647] | [127,0,NULL,-128] | [-9223372036854775808,NULL,9223372036854775807,0] | [NULL,0,3.402,1.175] | [-1.7976931348623157e308,NULL,0,2.2250738585072014e-308] | [-32768,0,NULL,32767] | [1,2,3]           |
| []                              | []                | []                                                | []                   | []                                                       | []                    | [1,2,3]           |
| []                              | []                | []                                                | []                   | []                                                       | []                    | [1,2,3]           |
+---------------------------------+-------------------+---------------------------------------------------+----------------------+----------------------------------------------------------+-----------------------+-------------------+
select array_compact(c1),array_compact(c3),array_compact(c4),array_compact(c5),array_compact(c6),array_compact(c7),array_compact(c8) from tt1 limit 1;
+----------------------------+-------------------+----------------------------------------------+-------------------+----------------------------------------------------+-------------------+-------------------+
| array_compact(c1)          | array_compact(c3) | array_compact(c4)                            | array_compact(c5) | array_compact(c6)                                  | array_compact(c7) | array_compact(c8) |
+----------------------------+-------------------+----------------------------------------------+-------------------+----------------------------------------------------+-------------------+-------------------+
| [-2147483648,0,2147483647] | [127,0,-128]      | [-9223372036854775808,9223372036854775807,0] | [3.402,0,0.175]   | [1.7976931348623157e308,0,2.2250738585072014e-308] | [-32768,0,32767]  | [0.1,2.2]         |
+----------------------------+-------------------+----------------------------------------------+-------------------+----------------------------------------------------+-------------------+-------------------+
select c1,array_compact(c1),array_compact(c3),array_compact(c4),array_compact(c5),array_compact(c6),array_compact(c7),array_compact(c8) from tt1 where array_compact(c5) is not null group by array_avg(array_compact(c1)) having array_length(array_compact(c1)) > 0 order by id desc;
+----------------------------------------+---------------------------------+-------------------+---------------------------------------------------+----------------------+----------------------------------------------------------+-----------------------+-------------------+
| c1                                     | array_compact(c1)               | array_compact(c3) | array_compact(c4)                                 | array_compact(c5)    | array_compact(c6)                                        | array_compact(c7)     | array_compact(c8) |
+----------------------------------------+---------------------------------+-------------------+---------------------------------------------------+----------------------+----------------------------------------------------------+-----------------------+-------------------+
| [-2147483648,-2147483648,0,2147483647] | [-2147483648,0,2147483647]      | [127,0,-128]      | [-9223372036854775808,9223372036854775807,0]      | [3.402,0,0.175]      | [1.7976931348623157e308,0,2.2250738585072014e-308]       | [-32768,0,32767]      | [0.1,2.2]         |
| [-2147483648,0,NULL,2147483647]        | [-2147483648,0,NULL,2147483647] | [127,0,NULL,-128] | [-9223372036854775808,NULL,9223372036854775807,0] | [NULL,0,3.402,1.175] | [-1.7976931348623157e308,NULL,0,2.2250738585072014e-308] | [-32768,0,NULL,32767] | [1,2,3]           |
+----------------------------------------+---------------------------------+-------------------+---------------------------------------------------+----------------------+----------------------------------------------------------+-----------------------+-------------------+
select array_compact(c1),array_compact(c3),array_compact(c4),array_compact(c5),array_compact(c6),array_compact(c7)from tt1 union all select array_compact(c1),array_compact(c3),array_compact(c4),array_compact(c5),array_compact(c6),array_compact(c7) from tt2;
+---------------------------------+-------------------+-----------------------------------------------------------+----------------------+----------------------------------------------------------+-----------------------+
| array_compact(c1)               | array_compact(c3) | array_compact(c4)                                         | array_compact(c5)    | array_compact(c6)                                        | array_compact(c7)     |
+---------------------------------+-------------------+-----------------------------------------------------------+----------------------+----------------------------------------------------------+-----------------------+
| NULL                            | NULL              | NULL                                                      | NULL                 | NULL                                                     | NULL                  |
| NULL                            | NULL              | NULL                                                      | NULL                 | NULL                                                     | NULL                  |
| [-2147483648,0,2147483647]      | [127,0,-128]      | [-9223372036854775808,9223372036854775807,0]              | [3.402,0,0.175]      | [1.7976931348623157e308,0,2.2250738585072014e-308]       | [-32768,0,32767]      |
| [-2147483648,0,NULL,2147483647] | [127,0,NULL,-128] | [-9223372036854775808,NULL,9223372036854775807,0]         | [NULL,0,3.402,1.175] | [-1.7976931348623157e308,NULL,0,2.2250738585072014e-308] | [-32768,0,NULL,32767] |
| [2147483648,0]                  | [52,0,5]          | [852,9223372036854775807,775,808,2,0,9223372036854775807] | [3.402,0,1.175]      | [1.7976931348623157e308,2.2250738585072014e-308]         | [88,0,32767]          |
| [87666,0,2147483647,4]          | [5,0,7,6,50]      | [1,100000,9223372036854775807,775,808,2,0,1]              | [3.402,0,1.175,4]    | [1.7976931348623157e308,1.2,2.2250738585072014e-308]     | [68,0,32767,0,1]      |
| []                              | []                | []                                                        | []                   | []                                                       | []                    |
| []                              | []                | []                                                        | []                   | []                                                       | []                    |
| []                              | []                | []                                                        | []                   | []                                                       | []                    |
| []                              | []                | []                                                        | []                   | []                                                       | []                    |
+---------------------------------+-------------------+-----------------------------------------------------------+----------------------+----------------------------------------------------------+-----------------------+

with test_1 as ( 
    select array_compact(c1),array_compact(c3),array_compact(c4),array_compact(c5),array_compact(c6),array_compact(c7) from tt1
)
select * from test_1;
+---------------------------------+-------------------+---------------------------------------------------+----------------------+----------------------------------------------------------+-----------------------+
| array_compact(c1)               | array_compact(c3) | array_compact(c4)                                 | array_compact(c5)    | array_compact(c6)                                        | array_compact(c7)     |
+---------------------------------+-------------------+---------------------------------------------------+----------------------+----------------------------------------------------------+-----------------------+
| [-2147483648,0,2147483647]      | [127,0,-128]      | [-9223372036854775808,9223372036854775807,0]      | [3.402,0,0.175]      | [1.7976931348623157e308,0,2.2250738585072014e-308]       | [-32768,0,32767]      |
| [-2147483648,0,NULL,2147483647] | [127,0,NULL,-128] | [-9223372036854775808,NULL,9223372036854775807,0] | [NULL,0,3.402,1.175] | [-1.7976931348623157e308,NULL,0,2.2250738585072014e-308] | [-32768,0,NULL,32767] |
| NULL                            | NULL              | NULL                                              | NULL                 | NULL                                                     | NULL                  |
| []                              | []                | []                                                | []                   | []                                                       | []                    |
| []                              | []                | []                                                | []                   | []                                                       | []                    |
+---------------------------------+-------------------+---------------------------------------------------+----------------------+----------------------------------------------------------+-----------------------+

with test_1 as (
    select array_compact(c1),array_compact(c3),array_compact(c4),array_compact(c5) as a,array_compact(c6),array_compact(c7) from tt1
)
select array_compact((select array_compact([a]) from test_1 limit 1)) from test_1;
+----------------------------------------------------------------+
| array_compact((select array_compact([a]) from test_1 limit 1)) |
+----------------------------------------------------------------+
| [[3.402,0,0.175]]                                              |
| [[3.402,0,0.175]]                                              |
| [[3.402,0,0.175]]                                              |
| [[3.402,0,0.175]]                                              |
| [[3.402,0,0.175]]                                              |
+----------------------------------------------------------------+

select /*+ parallel(20) */ array_compact(array_compact(c4)) from tt1 union all select /*+ no_rewrite leading(v t1) use_nl(v t1) parallel(20) */array_compact(array_compact(c4)) from tt2;
+-----------------------------------------------------------+
| array_compact(array_compact(c4))                          |
+-----------------------------------------------------------+
| NULL                                                      |
| NULL                                                      |
| [-9223372036854775808,9223372036854775807,0]              |
| [-9223372036854775808,NULL,9223372036854775807,0]         |
| [1,100000,9223372036854775807,775,808,2,0,1]              |
| [852,9223372036854775807,775,808,2,0,9223372036854775807] |
| []                                                        |
| []                                                        |
| []                                                        |
| []                                                        |
+-----------------------------------------------------------+

select /*+no_rewrite opt_param('PUSHDOWN_STORAGE_LEVEL', 0) opt_param('PUSHDOWN_STORAGE_LEVEL', 0) filter_pushdown_single_column.yaml */ array_compact(array_remove([1],1));
+------------------------------------+
| array_compact(array_remove([1],1)) |
+------------------------------------+
| []                                 |
+------------------------------------+
select /*+no_rewrite opt_param('PUSHDOWN_STORAGE_LEVEL', 0) opt_param('PUSHDOWN_STORAGE_LEVEL', 0) filter_pushdown_single_column.yaml */ array_compact(c5) from tt1 order by id;
+----------------------+
| array_compact(c5)    |
+----------------------+
| [3.402,0,0.175]      |
| [NULL,0,3.402,1.175] |
| NULL                 |
| []                   |
| []                   |
+----------------------+

select array_compact([[1,[1],[1],1],[[1],1],[[1],[1],1,1]]);
ERROR 22000: Invalid data type for the operation

select array_compact([[cast(1 as unsigned)], [cast(1 as unsigned)]]);
+---------------------------------------------------------------+
| array_compact([[cast(1 as unsigned)], [cast(1 as unsigned)]]) |
+---------------------------------------------------------------+
| [[1]]                                                         |
+---------------------------------------------------------------+
select array_compact([[cast(null as unsigned)],[cast(null as unsigned)]]);
+--------------------------------------------------------------------+
| array_compact([[cast(null as unsigned)],[cast(null as unsigned)]]) |
+--------------------------------------------------------------------+
| [[NULL]]                                                           |
+--------------------------------------------------------------------+

select * from tt1 group by array_length(c1);
+------+----------------------------------------+---------------------------+-----------------------+----------------------------------------------+---------------------+----------------------------------------------------------------------------------------------------+------------------+---------------+
| id   | c1                                     | c2                        | c3                    | c4                                           | c5                  | c6                                                                                                 | c7               | c8            |
+------+----------------------------------------+---------------------------+-----------------------+----------------------------------------------+---------------------+----------------------------------------------------------------------------------------------------+------------------+---------------+
|    1 | [-2147483648,-2147483648,0,2147483647] | ["test","test",NULL,NULL] | [127,127,0,-128,-128] | [-9223372036854775808,9223372036854775807,0] | [3.402,0,0,0,0.175] | [1.7976931348623157e308,0,2.2250738585072014e-308,2.2250738585072014e-308,2.2250738585072014e-308] | [-32768,0,32767] | [0.1,2.2,2.2] |
|    3 | NULL                                   | NULL                      | NULL                  | NULL                                         | NULL                | NULL                                                                                               | NULL             | NULL          |
|    4 | []                                     | []                        | []                    | []                                           | []                  | []                                                                                                 | []               | [1,2,3]       |
+------+----------------------------------------+---------------------------+-----------------------+----------------------------------------------+---------------------+----------------------------------------------------------------------------------------------------+------------------+---------------+
select array_compact(c1) from tt1 group by array_length(c3);
+----------------------------+
| array_compact(c1)          |
+----------------------------+
| [-2147483648,0,2147483647] |
| NULL                       |
| []                         |
+----------------------------+
select * ,array_compact(c1) from vtt1 group by id having array_length(c2)>1;
+------+----------------------------------------+--------------------------------------+------------------------+---------------------------------------------------+---------------------------+----------------------------------------------------------------------------------------------------+-----------------------------------+---------------+---------------------------------+
| id   | c1                                     | c2                                   | c3                     | c4                                                | c5                        | c6                                                                                                 | c7                                | c8            | array_compact(c1)               |
+------+----------------------------------------+--------------------------------------+------------------------+---------------------------------------------------+---------------------------+----------------------------------------------------------------------------------------------------+-----------------------------------+---------------+---------------------------------+
|    1 | [-2147483648,-2147483648,0,2147483647] | ["test","test",NULL,NULL]            | [127,127,0,-128,-128]  | [-9223372036854775808,9223372036854775807,0]      | [3.402,0,0,0,0.175]       | [1.7976931348623157e308,0,2.2250738585072014e-308,2.2250738585072014e-308,2.2250738585072014e-308] | [-32768,0,32767]                  | [0.1,2.2,2.2] | [-2147483648,0,2147483647]      |
|    2 | [-2147483648,0,NULL,2147483647]        | ["test","a",NULL,NULL,"null","null"] | [127,0,NULL,NULL,-128] | [-9223372036854775808,NULL,9223372036854775807,0] | [NULL,NULL,0,3.402,1.175] | [-1.7976931348623157e308,NULL,0,2.2250738585072014e-308]                                           | [-32768,-32768,0,NULL,NULL,32767] | [1,2,3]       | [-2147483648,0,NULL,2147483647] |
+------+----------------------------------------+--------------------------------------+------------------------+---------------------------------------------------+---------------------------+----------------------------------------------------------------------------------------------------+-----------------------------------+---------------+---------------------------------+
select * ,array_compact(c5) from tt2 group by id having array_length(c4)>2;
+------+---------------------------+----------+--------------+-----------------------------------------------------------+-----------------------+--------------------------------------------------------------------------+------------------+---------------+-------------------+
| id   | c1                        | c2       | c3           | c4                                                        | c5                    | c6                                                                       | c7               | c8            | array_compact(c5) |
+------+---------------------------+----------+--------------+-----------------------------------------------------------+-----------------------+--------------------------------------------------------------------------+------------------+---------------+-------------------+
|    1 | [2147483648,2147483648,0] | ["test"] | [52,0,5]     | [852,9223372036854775807,775,808,2,0,9223372036854775807] | [3.402,0,1.175,1.175] | [1.7976931348623157e308,2.2250738585072014e-308,2.2250738585072014e-308] | [88,0,32767]     | [1.1,1.1,1.1] | [3.402,0,1.175]   |
|    2 | [87666,0,2147483647,4]    | ["test"] | [5,0,7,6,50] | [1,100000,9223372036854775807,775,808,2,0,1]              | [3.402,0,1.175,4]     | [1.7976931348623157e308,1.2,2.2250738585072014e-308]                     | [68,0,32767,0,1] | [2,2,2]       | [3.402,0,1.175,4] |
+------+---------------------------+----------+--------------+-----------------------------------------------------------+-----------------------+--------------------------------------------------------------------------+------------------+---------------+-------------------+

select * ,array_compact(c1), c1 from tt1 order by array_length(c1);
+------+----------------------------------------+--------------------------------------+------------------------+---------------------------------------------------+---------------------------+----------------------------------------------------------------------------------------------------+-----------------------------------+---------------+---------------------------------+----------------------------------------+
| id   | c1                                     | c2                                   | c3                     | c4                                                | c5                        | c6                                                                                                 | c7                                | c8            | array_compact(c1)               | c1                                     |
+------+----------------------------------------+--------------------------------------+------------------------+---------------------------------------------------+---------------------------+----------------------------------------------------------------------------------------------------+-----------------------------------+---------------+---------------------------------+----------------------------------------+
|    3 | NULL                                   | NULL                                 | NULL                   | NULL                                              | NULL                      | NULL                                                                                               | NULL                              | NULL          | NULL                            | NULL                                   |
|    4 | []                                     | []                                   | []                     | []                                                | []                        | []                                                                                                 | []                                | [1,2,3]       | []                              | []                                     |
|    5 | []                                     | []                                   | []                     | []                                                | []                        | []                                                                                                 | []                                | [1,2,3]       | []                              | []                                     |
|    1 | [-2147483648,-2147483648,0,2147483647] | ["test","test",NULL,NULL]            | [127,127,0,-128,-128]  | [-9223372036854775808,9223372036854775807,0]      | [3.402,0,0,0,0.175]       | [1.7976931348623157e308,0,2.2250738585072014e-308,2.2250738585072014e-308,2.2250738585072014e-308] | [-32768,0,32767]                  | [0.1,2.2,2.2] | [-2147483648,0,2147483647]      | [-2147483648,-2147483648,0,2147483647] |
|    2 | [-2147483648,0,NULL,2147483647]        | ["test","a",NULL,NULL,"null","null"] | [127,0,NULL,NULL,-128] | [-9223372036854775808,NULL,9223372036854775807,0] | [NULL,NULL,0,3.402,1.175] | [-1.7976931348623157e308,NULL,0,2.2250738585072014e-308]                                           | [-32768,-32768,0,NULL,NULL,32767] | [1,2,3]       | [-2147483648,0,NULL,2147483647] | [-2147483648,0,NULL,2147483647]        |
+------+----------------------------------------+--------------------------------------+------------------------+---------------------------------------------------+---------------------------+----------------------------------------------------------------------------------------------------+-----------------------------------+---------------+---------------------------------+----------------------------------------+
select * ,array_compact(c1), c1,c2 from tt1 order by array_length(c1) desc ;
+------+----------------------------------------+--------------------------------------+------------------------+---------------------------------------------------+---------------------------+----------------------------------------------------------------------------------------------------+-----------------------------------+---------------+---------------------------------+----------------------------------------+--------------------------------------+
| id   | c1                                     | c2                                   | c3                     | c4                                                | c5                        | c6                                                                                                 | c7                                | c8            | array_compact(c1)               | c1                                     | c2                                   |
+------+----------------------------------------+--------------------------------------+------------------------+---------------------------------------------------+---------------------------+----------------------------------------------------------------------------------------------------+-----------------------------------+---------------+---------------------------------+----------------------------------------+--------------------------------------+
|    1 | [-2147483648,-2147483648,0,2147483647] | ["test","test",NULL,NULL]            | [127,127,0,-128,-128]  | [-9223372036854775808,9223372036854775807,0]      | [3.402,0,0,0,0.175]       | [1.7976931348623157e308,0,2.2250738585072014e-308,2.2250738585072014e-308,2.2250738585072014e-308] | [-32768,0,32767]                  | [0.1,2.2,2.2] | [-2147483648,0,2147483647]      | [-2147483648,-2147483648,0,2147483647] | ["test","test",NULL,NULL]            |
|    2 | [-2147483648,0,NULL,2147483647]        | ["test","a",NULL,NULL,"null","null"] | [127,0,NULL,NULL,-128] | [-9223372036854775808,NULL,9223372036854775807,0] | [NULL,NULL,0,3.402,1.175] | [-1.7976931348623157e308,NULL,0,2.2250738585072014e-308]                                           | [-32768,-32768,0,NULL,NULL,32767] | [1,2,3]       | [-2147483648,0,NULL,2147483647] | [-2147483648,0,NULL,2147483647]        | ["test","a",NULL,NULL,"null","null"] |
|    4 | []                                     | []                                   | []                     | []                                                | []                        | []                                                                                                 | []                                | [1,2,3]       | []                              | []                                     | []                                   |
|    5 | []                                     | []                                   | []                     | []                                                | []                        | []                                                                                                 | []                                | [1,2,3]       | []                              | []                                     | []                                   |
|    3 | NULL                                   | NULL                                 | NULL                   | NULL                                              | NULL                      | NULL                                                                                               | NULL                              | NULL          | NULL                            | NULL                                   | NULL                                 |
+------+----------------------------------------+--------------------------------------+------------------------+---------------------------------------------------+---------------------------+----------------------------------------------------------------------------------------------------+-----------------------------------+---------------+---------------------------------+----------------------------------------+--------------------------------------+
select * ,array_compact(c2), c1,c2 from tt1 order by array_length(c2) asc ;
+------+----------------------------------------+--------------------------------------+------------------------+---------------------------------------------------+---------------------------+----------------------------------------------------------------------------------------------------+-----------------------------------+---------------+--------------------------+----------------------------------------+--------------------------------------+
| id   | c1                                     | c2                                   | c3                     | c4                                                | c5                        | c6                                                                                                 | c7                                | c8            | array_compact(c2)        | c1                                     | c2                                   |
+------+----------------------------------------+--------------------------------------+------------------------+---------------------------------------------------+---------------------------+----------------------------------------------------------------------------------------------------+-----------------------------------+---------------+--------------------------+----------------------------------------+--------------------------------------+
|    3 | NULL                                   | NULL                                 | NULL                   | NULL                                              | NULL                      | NULL                                                                                               | NULL                              | NULL          | NULL                     | NULL                                   | NULL                                 |
|    4 | []                                     | []                                   | []                     | []                                                | []                        | []                                                                                                 | []                                | [1,2,3]       | []                       | []                                     | []                                   |
|    5 | []                                     | []                                   | []                     | []                                                | []                        | []                                                                                                 | []                                | [1,2,3]       | []                       | []                                     | []                                   |
|    1 | [-2147483648,-2147483648,0,2147483647] | ["test","test",NULL,NULL]            | [127,127,0,-128,-128]  | [-9223372036854775808,9223372036854775807,0]      | [3.402,0,0,0,0.175]       | [1.7976931348623157e308,0,2.2250738585072014e-308,2.2250738585072014e-308,2.2250738585072014e-308] | [-32768,0,32767]                  | [0.1,2.2,2.2] | ["test",NULL]            | [-2147483648,-2147483648,0,2147483647] | ["test","test",NULL,NULL]            |
|    2 | [-2147483648,0,NULL,2147483647]        | ["test","a",NULL,NULL,"null","null"] | [127,0,NULL,NULL,-128] | [-9223372036854775808,NULL,9223372036854775807,0] | [NULL,NULL,0,3.402,1.175] | [-1.7976931348623157e308,NULL,0,2.2250738585072014e-308]                                           | [-32768,-32768,0,NULL,NULL,32767] | [1,2,3]       | ["test","a",NULL,"null"] | [-2147483648,0,NULL,2147483647]        | ["test","a",NULL,NULL,"null","null"] |
+------+----------------------------------------+--------------------------------------+------------------------+---------------------------------------------------+---------------------------+----------------------------------------------------------------------------------------------------+-----------------------------------+---------------+--------------------------+----------------------------------------+--------------------------------------+

select * ,array_compact(c1), c1 from vtt1 order by array_length(c1);
+------+----------------------------------------+--------------------------------------+------------------------+---------------------------------------------------+---------------------------+----------------------------------------------------------------------------------------------------+-----------------------------------+---------------+---------------------------------+----------------------------------------+
| id   | c1                                     | c2                                   | c3                     | c4                                                | c5                        | c6                                                                                                 | c7                                | c8            | array_compact(c1)               | c1                                     |
+------+----------------------------------------+--------------------------------------+------------------------+---------------------------------------------------+---------------------------+----------------------------------------------------------------------------------------------------+-----------------------------------+---------------+---------------------------------+----------------------------------------+
|    3 | NULL                                   | NULL                                 | NULL                   | NULL                                              | NULL                      | NULL                                                                                               | NULL                              | NULL          | NULL                            | NULL                                   |
|    4 | []                                     | []                                   | []                     | []                                                | []                        | []                                                                                                 | []                                | [1,2,3]       | []                              | []                                     |
|    5 | []                                     | []                                   | []                     | []                                                | []                        | []                                                                                                 | []                                | [1,2,3]       | []                              | []                                     |
|    1 | [-2147483648,-2147483648,0,2147483647] | ["test","test",NULL,NULL]            | [127,127,0,-128,-128]  | [-9223372036854775808,9223372036854775807,0]      | [3.402,0,0,0,0.175]       | [1.7976931348623157e308,0,2.2250738585072014e-308,2.2250738585072014e-308,2.2250738585072014e-308] | [-32768,0,32767]                  | [0.1,2.2,2.2] | [-2147483648,0,2147483647]      | [-2147483648,-2147483648,0,2147483647] |
|    2 | [-2147483648,0,NULL,2147483647]        | ["test","a",NULL,NULL,"null","null"] | [127,0,NULL,NULL,-128] | [-9223372036854775808,NULL,9223372036854775807,0] | [NULL,NULL,0,3.402,1.175] | [-1.7976931348623157e308,NULL,0,2.2250738585072014e-308]                                           | [-32768,-32768,0,NULL,NULL,32767] | [1,2,3]       | [-2147483648,0,NULL,2147483647] | [-2147483648,0,NULL,2147483647]        |
+------+----------------------------------------+--------------------------------------+------------------------+---------------------------------------------------+---------------------------+----------------------------------------------------------------------------------------------------+-----------------------------------+---------------+---------------------------------+----------------------------------------+
select * ,array_compact(c1), c1,c2 from vtt1 order by array_length(c1) desc ;
+------+----------------------------------------+--------------------------------------+------------------------+---------------------------------------------------+---------------------------+----------------------------------------------------------------------------------------------------+-----------------------------------+---------------+---------------------------------+----------------------------------------+--------------------------------------+
| id   | c1                                     | c2                                   | c3                     | c4                                                | c5                        | c6                                                                                                 | c7                                | c8            | array_compact(c1)               | c1                                     | c2                                   |
+------+----------------------------------------+--------------------------------------+------------------------+---------------------------------------------------+---------------------------+----------------------------------------------------------------------------------------------------+-----------------------------------+---------------+---------------------------------+----------------------------------------+--------------------------------------+
|    1 | [-2147483648,-2147483648,0,2147483647] | ["test","test",NULL,NULL]            | [127,127,0,-128,-128]  | [-9223372036854775808,9223372036854775807,0]      | [3.402,0,0,0,0.175]       | [1.7976931348623157e308,0,2.2250738585072014e-308,2.2250738585072014e-308,2.2250738585072014e-308] | [-32768,0,32767]                  | [0.1,2.2,2.2] | [-2147483648,0,2147483647]      | [-2147483648,-2147483648,0,2147483647] | ["test","test",NULL,NULL]            |
|    2 | [-2147483648,0,NULL,2147483647]        | ["test","a",NULL,NULL,"null","null"] | [127,0,NULL,NULL,-128] | [-9223372036854775808,NULL,9223372036854775807,0] | [NULL,NULL,0,3.402,1.175] | [-1.7976931348623157e308,NULL,0,2.2250738585072014e-308]                                           | [-32768,-32768,0,NULL,NULL,32767] | [1,2,3]       | [-2147483648,0,NULL,2147483647] | [-2147483648,0,NULL,2147483647]        | ["test","a",NULL,NULL,"null","null"] |
|    4 | []                                     | []                                   | []                     | []                                                | []                        | []                                                                                                 | []                                | [1,2,3]       | []                              | []                                     | []                                   |
|    5 | []                                     | []                                   | []                     | []                                                | []                        | []                                                                                                 | []                                | [1,2,3]       | []                              | []                                     | []                                   |
|    3 | NULL                                   | NULL                                 | NULL                   | NULL                                              | NULL                      | NULL                                                                                               | NULL                              | NULL          | NULL                            | NULL                                   | NULL                                 |
+------+----------------------------------------+--------------------------------------+------------------------+---------------------------------------------------+---------------------------+----------------------------------------------------------------------------------------------------+-----------------------------------+---------------+---------------------------------+----------------------------------------+--------------------------------------+
select * ,array_compact(c2), c1,c2 from vtt1 order by array_length(c2) asc ;
+------+----------------------------------------+--------------------------------------+------------------------+---------------------------------------------------+---------------------------+----------------------------------------------------------------------------------------------------+-----------------------------------+---------------+--------------------------+----------------------------------------+--------------------------------------+
| id   | c1                                     | c2                                   | c3                     | c4                                                | c5                        | c6                                                                                                 | c7                                | c8            | array_compact(c2)        | c1                                     | c2                                   |
+------+----------------------------------------+--------------------------------------+------------------------+---------------------------------------------------+---------------------------+----------------------------------------------------------------------------------------------------+-----------------------------------+---------------+--------------------------+----------------------------------------+--------------------------------------+
|    3 | NULL                                   | NULL                                 | NULL                   | NULL                                              | NULL                      | NULL                                                                                               | NULL                              | NULL          | NULL                     | NULL                                   | NULL                                 |
|    4 | []                                     | []                                   | []                     | []                                                | []                        | []                                                                                                 | []                                | [1,2,3]       | []                       | []                                     | []                                   |
|    5 | []                                     | []                                   | []                     | []                                                | []                        | []                                                                                                 | []                                | [1,2,3]       | []                       | []                                     | []                                   |
|    1 | [-2147483648,-2147483648,0,2147483647] | ["test","test",NULL,NULL]            | [127,127,0,-128,-128]  | [-9223372036854775808,9223372036854775807,0]      | [3.402,0,0,0,0.175]       | [1.7976931348623157e308,0,2.2250738585072014e-308,2.2250738585072014e-308,2.2250738585072014e-308] | [-32768,0,32767]                  | [0.1,2.2,2.2] | ["test",NULL]            | [-2147483648,-2147483648,0,2147483647] | ["test","test",NULL,NULL]            |
|    2 | [-2147483648,0,NULL,2147483647]        | ["test","a",NULL,NULL,"null","null"] | [127,0,NULL,NULL,-128] | [-9223372036854775808,NULL,9223372036854775807,0] | [NULL,NULL,0,3.402,1.175] | [-1.7976931348623157e308,NULL,0,2.2250738585072014e-308]                                           | [-32768,-32768,0,NULL,NULL,32767] | [1,2,3]       | ["test","a",NULL,"null"] | [-2147483648,0,NULL,2147483647]        | ["test","a",NULL,NULL,"null","null"] |
+------+----------------------------------------+--------------------------------------+------------------------+---------------------------------------------------+---------------------------+----------------------------------------------------------------------------------------------------+-----------------------------------+---------------+--------------------------+----------------------------------------+--------------------------------------+

select * ,array_compact(c1), c1 from tt2 where id=1 order by array_length(c1);
+------+---------------------------+----------+----------+-----------------------------------------------------------+-----------------------+--------------------------------------------------------------------------+--------------+---------------+-------------------+---------------------------+
| id   | c1                        | c2       | c3       | c4                                                        | c5                    | c6                                                                       | c7           | c8            | array_compact(c1) | c1                        |
+------+---------------------------+----------+----------+-----------------------------------------------------------+-----------------------+--------------------------------------------------------------------------+--------------+---------------+-------------------+---------------------------+
|    1 | [2147483648,2147483648,0] | ["test"] | [52,0,5] | [852,9223372036854775807,775,808,2,0,9223372036854775807] | [3.402,0,1.175,1.175] | [1.7976931348623157e308,2.2250738585072014e-308,2.2250738585072014e-308] | [88,0,32767] | [1.1,1.1,1.1] | [2147483648,0]    | [2147483648,2147483648,0] |
+------+---------------------------+----------+----------+-----------------------------------------------------------+-----------------------+--------------------------------------------------------------------------+--------------+---------------+-------------------+---------------------------+
select * ,array_compact(c1), c1,c2 from tt2 where id=1  order by array_length(c1) desc ;
+------+---------------------------+----------+----------+-----------------------------------------------------------+-----------------------+--------------------------------------------------------------------------+--------------+---------------+-------------------+---------------------------+----------+
| id   | c1                        | c2       | c3       | c4                                                        | c5                    | c6                                                                       | c7           | c8            | array_compact(c1) | c1                        | c2       |
+------+---------------------------+----------+----------+-----------------------------------------------------------+-----------------------+--------------------------------------------------------------------------+--------------+---------------+-------------------+---------------------------+----------+
|    1 | [2147483648,2147483648,0] | ["test"] | [52,0,5] | [852,9223372036854775807,775,808,2,0,9223372036854775807] | [3.402,0,1.175,1.175] | [1.7976931348623157e308,2.2250738585072014e-308,2.2250738585072014e-308] | [88,0,32767] | [1.1,1.1,1.1] | [2147483648,0]    | [2147483648,2147483648,0] | ["test"] |
+------+---------------------------+----------+----------+-----------------------------------------------------------+-----------------------+--------------------------------------------------------------------------+--------------+---------------+-------------------+---------------------------+----------+
select * ,array_compact(c2), c1,c2 from tt2  where id=1  order by array_length(c5) asc ;
+------+---------------------------+----------+----------+-----------------------------------------------------------+-----------------------+--------------------------------------------------------------------------+--------------+---------------+-------------------+---------------------------+----------+
| id   | c1                        | c2       | c3       | c4                                                        | c5                    | c6                                                                       | c7           | c8            | array_compact(c2) | c1                        | c2       |
+------+---------------------------+----------+----------+-----------------------------------------------------------+-----------------------+--------------------------------------------------------------------------+--------------+---------------+-------------------+---------------------------+----------+
|    1 | [2147483648,2147483648,0] | ["test"] | [52,0,5] | [852,9223372036854775807,775,808,2,0,9223372036854775807] | [3.402,0,1.175,1.175] | [1.7976931348623157e308,2.2250738585072014e-308,2.2250738585072014e-308] | [88,0,32767] | [1.1,1.1,1.1] | ["test"]          | [2147483648,2147483648,0] | ["test"] |
+------+---------------------------+----------+----------+-----------------------------------------------------------+-----------------------+--------------------------------------------------------------------------+--------------+---------------+-------------------+---------------------------+----------+
select * ,array_compact(c1), c1 from vtt2 where id=1 order by array_length(c1);
+------+---------------------------+----------+----------+-----------------------------------------------------------+-----------------------+--------------------------------------------------------------------------+--------------+---------------+-------------------+---------------------------+
| id   | c1                        | c2       | c3       | c4                                                        | c5                    | c6                                                                       | c7           | c8            | array_compact(c1) | c1                        |
+------+---------------------------+----------+----------+-----------------------------------------------------------+-----------------------+--------------------------------------------------------------------------+--------------+---------------+-------------------+---------------------------+
|    1 | [2147483648,2147483648,0] | ["test"] | [52,0,5] | [852,9223372036854775807,775,808,2,0,9223372036854775807] | [3.402,0,1.175,1.175] | [1.7976931348623157e308,2.2250738585072014e-308,2.2250738585072014e-308] | [88,0,32767] | [1.1,1.1,1.1] | [2147483648,0]    | [2147483648,2147483648,0] |
+------+---------------------------+----------+----------+-----------------------------------------------------------+-----------------------+--------------------------------------------------------------------------+--------------+---------------+-------------------+---------------------------+
select * ,array_compact(c1), c1,c2 from vtt2 where id=1  order by array_length(c1) desc ;
+------+---------------------------+----------+----------+-----------------------------------------------------------+-----------------------+--------------------------------------------------------------------------+--------------+---------------+-------------------+---------------------------+----------+
| id   | c1                        | c2       | c3       | c4                                                        | c5                    | c6                                                                       | c7           | c8            | array_compact(c1) | c1                        | c2       |
+------+---------------------------+----------+----------+-----------------------------------------------------------+-----------------------+--------------------------------------------------------------------------+--------------+---------------+-------------------+---------------------------+----------+
|    1 | [2147483648,2147483648,0] | ["test"] | [52,0,5] | [852,9223372036854775807,775,808,2,0,9223372036854775807] | [3.402,0,1.175,1.175] | [1.7976931348623157e308,2.2250738585072014e-308,2.2250738585072014e-308] | [88,0,32767] | [1.1,1.1,1.1] | [2147483648,0]    | [2147483648,2147483648,0] | ["test"] |
+------+---------------------------+----------+----------+-----------------------------------------------------------+-----------------------+--------------------------------------------------------------------------+--------------+---------------+-------------------+---------------------------+----------+
select * ,array_compact(c2), c1,c2 from vtt2  where id=1  order by array_length(c2) asc ;
+------+---------------------------+----------+----------+-----------------------------------------------------------+-----------------------+--------------------------------------------------------------------------+--------------+---------------+-------------------+---------------------------+----------+
| id   | c1                        | c2       | c3       | c4                                                        | c5                    | c6                                                                       | c7           | c8            | array_compact(c2) | c1                        | c2       |
+------+---------------------------+----------+----------+-----------------------------------------------------------+-----------------------+--------------------------------------------------------------------------+--------------+---------------+-------------------+---------------------------+----------+
|    1 | [2147483648,2147483648,0] | ["test"] | [52,0,5] | [852,9223372036854775807,775,808,2,0,9223372036854775807] | [3.402,0,1.175,1.175] | [1.7976931348623157e308,2.2250738585072014e-308,2.2250738585072014e-308] | [88,0,32767] | [1.1,1.1,1.1] | ["test"]          | [2147483648,2147483648,0] | ["test"] |
+------+---------------------------+----------+----------+-----------------------------------------------------------+-----------------------+--------------------------------------------------------------------------+--------------+---------------+-------------------+---------------------------+----------+

select distinct array_compact(c1) from tt1;
ERROR 22000: Invalid data type for the operation

select cast(array_compact([c1]) as unsigned) from tt1;
ERROR 22000: Invalid data type for the operation
select cast(array_compact(c1) as  point) from tt1;
ERROR 22000: Invalid data type for the operation
select cast(array_compact(c1) as  json) from tt1;
ERROR 22000: Invalid data type for the operation
select cast(array_compact(c1) as  roaringbitmap) from vtt1;
ERROR 22000: Invalid data type for the operation

select * ,array_compact(c1) from tt1 where array_length(c1) = 3;
+------+------+------+------+------+------+------+------+------+-------------------+
| id   | c1   | c2   | c3   | c4   | c5   | c6   | c7   | c8   | array_compact(c1) |
+------+------+------+------+------+------+------+------+------+-------------------+
+------+------+------+------+------+------+------+------+------+-------------------+
select * from tt1 where  array_compact(c2)<>['test'];
+------+----------------------------------------+--------------------------------------+------------------------+---------------------------------------------------+---------------------------+----------------------------------------------------------------------------------------------------+-----------------------------------+---------------+
| id   | c1                                     | c2                                   | c3                     | c4                                                | c5                        | c6                                                                                                 | c7                                | c8            |
+------+----------------------------------------+--------------------------------------+------------------------+---------------------------------------------------+---------------------------+----------------------------------------------------------------------------------------------------+-----------------------------------+---------------+
|    1 | [-2147483648,-2147483648,0,2147483647] | ["test","test",NULL,NULL]            | [127,127,0,-128,-128]  | [-9223372036854775808,9223372036854775807,0]      | [3.402,0,0,0,0.175]       | [1.7976931348623157e308,0,2.2250738585072014e-308,2.2250738585072014e-308,2.2250738585072014e-308] | [-32768,0,32767]                  | [0.1,2.2,2.2] |
|    2 | [-2147483648,0,NULL,2147483647]        | ["test","a",NULL,NULL,"null","null"] | [127,0,NULL,NULL,-128] | [-9223372036854775808,NULL,9223372036854775807,0] | [NULL,NULL,0,3.402,1.175] | [-1.7976931348623157e308,NULL,0,2.2250738585072014e-308]                                           | [-32768,-32768,0,NULL,NULL,32767] | [1,2,3]       |
|    4 | []                                     | []                                   | []                     | []                                                | []                        | []                                                                                                 | []                                | [1,2,3]       |
|    5 | []                                     | []                                   | []                     | []                                                | []                        | []                                                                                                 | []                                | [1,2,3]       |
+------+----------------------------------------+--------------------------------------+------------------------+---------------------------------------------------+---------------------------+----------------------------------------------------------------------------------------------------+-----------------------------------+---------------+
select * from tt1 where  array_compact(c2)=['test'];
+------+------+------+------+------+------+------+------+------+
| id   | c1   | c2   | c3   | c4   | c5   | c6   | c7   | c8   |
+------+------+------+------+------+------+------+------+------+
+------+------+------+------+------+------+------+------+------+
select * from tt1 where  array_compact(c2)!=['test'];
+------+----------------------------------------+--------------------------------------+------------------------+---------------------------------------------------+---------------------------+----------------------------------------------------------------------------------------------------+-----------------------------------+---------------+
| id   | c1                                     | c2                                   | c3                     | c4                                                | c5                        | c6                                                                                                 | c7                                | c8            |
+------+----------------------------------------+--------------------------------------+------------------------+---------------------------------------------------+---------------------------+----------------------------------------------------------------------------------------------------+-----------------------------------+---------------+
|    1 | [-2147483648,-2147483648,0,2147483647] | ["test","test",NULL,NULL]            | [127,127,0,-128,-128]  | [-9223372036854775808,9223372036854775807,0]      | [3.402,0,0,0,0.175]       | [1.7976931348623157e308,0,2.2250738585072014e-308,2.2250738585072014e-308,2.2250738585072014e-308] | [-32768,0,32767]                  | [0.1,2.2,2.2] |
|    2 | [-2147483648,0,NULL,2147483647]        | ["test","a",NULL,NULL,"null","null"] | [127,0,NULL,NULL,-128] | [-9223372036854775808,NULL,9223372036854775807,0] | [NULL,NULL,0,3.402,1.175] | [-1.7976931348623157e308,NULL,0,2.2250738585072014e-308]                                           | [-32768,-32768,0,NULL,NULL,32767] | [1,2,3]       |
|    4 | []                                     | []                                   | []                     | []                                                | []                        | []                                                                                                 | []                                | [1,2,3]       |
|    5 | []                                     | []                                   | []                     | []                                                | []                        | []                                                                                                 | []                                | [1,2,3]       |
+------+----------------------------------------+--------------------------------------+------------------------+---------------------------------------------------+---------------------------+----------------------------------------------------------------------------------------------------+-----------------------------------+---------------+
select * from tt1 where  array_compact(c5)=array_compact(c5);
+------+----------------------------------------+--------------------------------------+------------------------+---------------------------------------------------+---------------------------+----------------------------------------------------------------------------------------------------+-----------------------------------+---------------+
| id   | c1                                     | c2                                   | c3                     | c4                                                | c5                        | c6                                                                                                 | c7                                | c8            |
+------+----------------------------------------+--------------------------------------+------------------------+---------------------------------------------------+---------------------------+----------------------------------------------------------------------------------------------------+-----------------------------------+---------------+
|    1 | [-2147483648,-2147483648,0,2147483647] | ["test","test",NULL,NULL]            | [127,127,0,-128,-128]  | [-9223372036854775808,9223372036854775807,0]      | [3.402,0,0,0,0.175]       | [1.7976931348623157e308,0,2.2250738585072014e-308,2.2250738585072014e-308,2.2250738585072014e-308] | [-32768,0,32767]                  | [0.1,2.2,2.2] |
|    2 | [-2147483648,0,NULL,2147483647]        | ["test","a",NULL,NULL,"null","null"] | [127,0,NULL,NULL,-128] | [-9223372036854775808,NULL,9223372036854775807,0] | [NULL,NULL,0,3.402,1.175] | [-1.7976931348623157e308,NULL,0,2.2250738585072014e-308]                                           | [-32768,-32768,0,NULL,NULL,32767] | [1,2,3]       |
|    4 | []                                     | []                                   | []                     | []                                                | []                        | []                                                                                                 | []                                | [1,2,3]       |
|    5 | []                                     | []                                   | []                     | []                                                | []                        | []                                                                                                 | []                                | [1,2,3]       |
+------+----------------------------------------+--------------------------------------+------------------------+---------------------------------------------------+---------------------------+----------------------------------------------------------------------------------------------------+-----------------------------------+---------------+
select * from tt1 where  array_compact(c5)=array_compact(c5);
+------+----------------------------------------+--------------------------------------+------------------------+---------------------------------------------------+---------------------------+----------------------------------------------------------------------------------------------------+-----------------------------------+---------------+
| id   | c1                                     | c2                                   | c3                     | c4                                                | c5                        | c6                                                                                                 | c7                                | c8            |
+------+----------------------------------------+--------------------------------------+------------------------+---------------------------------------------------+---------------------------+----------------------------------------------------------------------------------------------------+-----------------------------------+---------------+
|    1 | [-2147483648,-2147483648,0,2147483647] | ["test","test",NULL,NULL]            | [127,127,0,-128,-128]  | [-9223372036854775808,9223372036854775807,0]      | [3.402,0,0,0,0.175]       | [1.7976931348623157e308,0,2.2250738585072014e-308,2.2250738585072014e-308,2.2250738585072014e-308] | [-32768,0,32767]                  | [0.1,2.2,2.2] |
|    2 | [-2147483648,0,NULL,2147483647]        | ["test","a",NULL,NULL,"null","null"] | [127,0,NULL,NULL,-128] | [-9223372036854775808,NULL,9223372036854775807,0] | [NULL,NULL,0,3.402,1.175] | [-1.7976931348623157e308,NULL,0,2.2250738585072014e-308]                                           | [-32768,-32768,0,NULL,NULL,32767] | [1,2,3]       |
|    4 | []                                     | []                                   | []                     | []                                                | []                        | []                                                                                                 | []                                | [1,2,3]       |
|    5 | []                                     | []                                   | []                     | []                                                | []                        | []                                                                                                 | []                                | [1,2,3]       |
+------+----------------------------------------+--------------------------------------+------------------------+---------------------------------------------------+---------------------------+----------------------------------------------------------------------------------------------------+-----------------------------------+---------------+
select * from tt1 where array_compact(c1)!= [cardinality([1,2,34,5,6])];
+------+----------------------------------------+--------------------------------------+------------------------+---------------------------------------------------+---------------------------+----------------------------------------------------------------------------------------------------+-----------------------------------+---------------+
| id   | c1                                     | c2                                   | c3                     | c4                                                | c5                        | c6                                                                                                 | c7                                | c8            |
+------+----------------------------------------+--------------------------------------+------------------------+---------------------------------------------------+---------------------------+----------------------------------------------------------------------------------------------------+-----------------------------------+---------------+
|    1 | [-2147483648,-2147483648,0,2147483647] | ["test","test",NULL,NULL]            | [127,127,0,-128,-128]  | [-9223372036854775808,9223372036854775807,0]      | [3.402,0,0,0,0.175]       | [1.7976931348623157e308,0,2.2250738585072014e-308,2.2250738585072014e-308,2.2250738585072014e-308] | [-32768,0,32767]                  | [0.1,2.2,2.2] |
|    2 | [-2147483648,0,NULL,2147483647]        | ["test","a",NULL,NULL,"null","null"] | [127,0,NULL,NULL,-128] | [-9223372036854775808,NULL,9223372036854775807,0] | [NULL,NULL,0,3.402,1.175] | [-1.7976931348623157e308,NULL,0,2.2250738585072014e-308]                                           | [-32768,-32768,0,NULL,NULL,32767] | [1,2,3]       |
|    4 | []                                     | []                                   | []                     | []                                                | []                        | []                                                                                                 | []                                | [1,2,3]       |
|    5 | []                                     | []                                   | []                     | []                                                | []                        | []                                                                                                 | []                                | [1,2,3]       |
+------+----------------------------------------+--------------------------------------+------------------------+---------------------------------------------------+---------------------------+----------------------------------------------------------------------------------------------------+-----------------------------------+---------------+
select * from tt1 where array_length(array_compact(c5)) BETWEEN array_length(c2) AND array_length(c3);
+------+------+------+------+------+------+------+------+---------+
| id   | c1   | c2   | c3   | c4   | c5   | c6   | c7   | c8      |
+------+------+------+------+------+------+------+------+---------+
|    4 | []   | []   | []   | []   | []   | []   | []   | [1,2,3] |
|    5 | []   | []   | []   | []   | []   | []   | []   | [1,2,3] |
+------+------+------+------+------+------+------+------+---------+
select * from tt1 where array_length(array_compact(c5)) not BETWEEN array_length(c1) AND array_length(c1);
+------+----------------------------------------+---------------------------+-----------------------+----------------------------------------------+---------------------+----------------------------------------------------------------------------------------------------+------------------+---------------+
| id   | c1                                     | c2                        | c3                    | c4                                           | c5                  | c6                                                                                                 | c7               | c8            |
+------+----------------------------------------+---------------------------+-----------------------+----------------------------------------------+---------------------+----------------------------------------------------------------------------------------------------+------------------+---------------+
|    1 | [-2147483648,-2147483648,0,2147483647] | ["test","test",NULL,NULL] | [127,127,0,-128,-128] | [-9223372036854775808,9223372036854775807,0] | [3.402,0,0,0,0.175] | [1.7976931348623157e308,0,2.2250738585072014e-308,2.2250738585072014e-308,2.2250738585072014e-308] | [-32768,0,32767] | [0.1,2.2,2.2] |
+------+----------------------------------------+---------------------------+-----------------------+----------------------------------------------+---------------------+----------------------------------------------------------------------------------------------------+------------------+---------------+

select * from tt1 where array_compact(c1) like array_compact(c1);
ERROR 22000: Invalid data type for the operation
select * from tt1 where array_compact(c1) not like array_compact(c1);
ERROR 22000: Invalid data type for the operation

select * from tt1 where array_compact(c5) is true;
ERROR 22000: Invalid data type for the operation
select * from tt1 where array_compact(c3)  is not true;
ERROR 22000: Invalid data type for the operation
select * from tt1 where array_compact(c1)   is false;
ERROR 22000: Invalid data type for the operation
select * from tt1 where array_compact(c2)   is not false;
ERROR 22000: Invalid data type for the operation

select * from tt1 where array_compact(c5)  is not null;
+------+----------------------------------------+--------------------------------------+------------------------+---------------------------------------------------+---------------------------+----------------------------------------------------------------------------------------------------+-----------------------------------+---------------+
| id   | c1                                     | c2                                   | c3                     | c4                                                | c5                        | c6                                                                                                 | c7                                | c8            |
+------+----------------------------------------+--------------------------------------+------------------------+---------------------------------------------------+---------------------------+----------------------------------------------------------------------------------------------------+-----------------------------------+---------------+
|    1 | [-2147483648,-2147483648,0,2147483647] | ["test","test",NULL,NULL]            | [127,127,0,-128,-128]  | [-9223372036854775808,9223372036854775807,0]      | [3.402,0,0,0,0.175]       | [1.7976931348623157e308,0,2.2250738585072014e-308,2.2250738585072014e-308,2.2250738585072014e-308] | [-32768,0,32767]                  | [0.1,2.2,2.2] |
|    2 | [-2147483648,0,NULL,2147483647]        | ["test","a",NULL,NULL,"null","null"] | [127,0,NULL,NULL,-128] | [-9223372036854775808,NULL,9223372036854775807,0] | [NULL,NULL,0,3.402,1.175] | [-1.7976931348623157e308,NULL,0,2.2250738585072014e-308]                                           | [-32768,-32768,0,NULL,NULL,32767] | [1,2,3]       |
|    4 | []                                     | []                                   | []                     | []                                                | []                        | []                                                                                                 | []                                | [1,2,3]       |
|    5 | []                                     | []                                   | []                     | []                                                | []                        | []                                                                                                 | []                                | [1,2,3]       |
+------+----------------------------------------+--------------------------------------+------------------------+---------------------------------------------------+---------------------------+----------------------------------------------------------------------------------------------------+-----------------------------------+---------------+
select * from tt1 where array_compact(c5)  is  null;
+------+------+------+------+------+------+------+------+------+
| id   | c1   | c2   | c3   | c4   | c5   | c6   | c7   | c8   |
+------+------+------+------+------+------+------+------+------+
|    3 | NULL | NULL | NULL | NULL | NULL | NULL | NULL | NULL |
+------+------+------+------+------+------+------+------+------+

drop table tt3;
create table tt3(id int,id1 INTEGER unsigned,id2 BOOL,id3 SMALLINT unsigned,id4 MEDIUMINT,id5 SERIAL,id6 BIGINT);
insert into tt3 values(1,2,3,4,5,6,7);
select array_compact(id)from tt3;
ERROR 22000: invalid obj type for type promotion: left_type=ARRAY right_type=INT
select array_compact(id1) from  tt3;
ERROR 22000: invalid obj type for type promotion: left_type=ARRAY right_type=INT UNSIGNED
select array_compact(id2) from tt3;
ERROR 22000: invalid obj type for type promotion: left_type=ARRAY right_type=TINYINT
select array_compact(id3) from tt3;
ERROR 22000: invalid obj type for type promotion: left_type=ARRAY right_type=SMALLINT UNSIGNED
select array_compact(id4) from tt3;
ERROR 22000: invalid obj type for type promotion: left_type=ARRAY right_type=MEDIUMINT
select array_compact(id5) from tt3;
ERROR 22000: invalid obj type for type promotion: left_type=ARRAY right_type=BIGINT UNSIGNED
select array_compact([1]) from tt3;
+--------------------+
| array_compact([1]) |
+--------------------+
| [1]                |
+--------------------+

drop table tt3;
create table tt3(id DECIMAL,id1 DECIMAL ZEROFILL,id2 NUMERIC,id3 FIXED unsigned,id4 FIXED,id5 NUMERIC unsigned);
insert into tt3 values(1,2,3,4,5,6);
select array_compact(id)from tt3;
ERROR 22000: invalid obj type for type promotion: left_type=ARRAY right_type=DECIMAL
select array_compact(id1) from  tt3;
ERROR 22000: invalid obj type for type promotion: left_type=ARRAY right_type=DECIMAL UNSIGNED
select array_compact(id2) from tt3;
ERROR 22000: invalid obj type for type promotion: left_type=ARRAY right_type=DECIMAL
select array_compact(id3) from tt3;
ERROR 22000: invalid obj type for type promotion: left_type=ARRAY right_type=DECIMAL UNSIGNED
select array_compact(id4) from tt3;
ERROR 22000: invalid obj type for type promotion: left_type=ARRAY right_type=DECIMAL
select array_compact(id5) from tt3;
ERROR 22000: invalid obj type for type promotion: left_type=ARRAY right_type=DECIMAL UNSIGNED
select array_compact([1]) from tt3;
+--------------------+
| array_compact([1]) |
+--------------------+
| [1]                |
+--------------------+

drop table tt3;
create table tt3(id float,id1 float unsigned,id2 double,id3 double unsigned);
insert into tt3 values(1,2,3,4);
select array_compact(id) from tt3;
ERROR 22000: invalid obj type for type promotion: left_type=ARRAY right_type=FLOAT
select array_compact(id1) from tt3;
ERROR 22000: invalid obj type for type promotion: left_type=ARRAY right_type=FLOAT UNSIGNED
select array_compact(id2) from tt3;
ERROR 22000: invalid obj type for type promotion: left_type=ARRAY right_type=DOUBLE
select array_compact(id3) from tt3;
ERROR 22000: invalid obj type for type promotion: left_type=ARRAY right_type=DOUBLE UNSIGNED

drop table tt3;
create table tt3(id char(50),id1 varchar(50),id2 binary(50),id3 varbinary(50));
insert into tt3 values(1,2,3,4);

select array_compact(id) from tt3;
ERROR 22000: invalid obj type for type promotion: left_type=ARRAY right_type=CHAR
select array_compact(id1) from tt3;
ERROR 22000: invalid obj type for type promotion: left_type=ARRAY right_type=VARCHAR
select array_compact(id2) from tt3;
ERROR 22000: invalid obj type for type promotion: left_type=ARRAY right_type=CHAR
select array_compact(id3) from tt3;
ERROR 22000: invalid obj type for type promotion: left_type=ARRAY right_type=VARCHAR

drop table tt3;
create table tt3(id date,id1 datetime,id2 timestamp,id3 time,id4 year);
insert into tt3 values('2010-1-1','2010-10-1 14:58:00','2010-10-1 14:58:00.9999','14:14:50','2010');

select array_compact(id) from tt3;
ERROR 22000: invalid obj type for type promotion: left_type=ARRAY right_type=MYSQL_DATE
select array_compact(id1) from tt3;
ERROR 22000: invalid obj type for type promotion: left_type=ARRAY right_type=MYSQL_DATETIME
select array_compact(id2) from tt3;
ERROR 22000: invalid obj type for type promotion: left_type=ARRAY right_type=TIMESTAMP
select array_compact(id3) from tt3;
ERROR 22000: invalid obj type for type promotion: left_type=ARRAY right_type=TIME
select array_compact([[1,2,3],id4]) from tt3;
ERROR 22000: Invalid data type for the operation

drop table tt3;
create table tt3(id TINYBLOB,id1 blob,id2 MEDIUMBLOB,id3 LONGBLOB);
insert into tt3 values(1,2,3,4);

select array_compact(id) from tt3;
ERROR 22000: invalid obj type for type promotion: left_type=ARRAY right_type=TINYTEXT
select array_compact(id1) from tt3;
ERROR 22000: invalid obj type for type promotion: left_type=ARRAY right_type=TEXT
select array_compact(id2) from tt3;
ERROR 22000: invalid obj type for type promotion: left_type=ARRAY right_type=MEDIUMTEXT
select array_compact(id3) from tt3;
ERROR 22000: invalid obj type for type promotion: left_type=ARRAY right_type=LONGTEXT

drop table tt3;
create table tt3(id TINYTEXT,id1 TEXT,id2 MEDIUMTEXT,id3 LONGTEXT);
insert into tt3 values('[1]','[2]','[3]','[4]');

select array_compact(id) from tt3;
ERROR 22000: invalid obj type for type promotion: left_type=ARRAY right_type=TINYTEXT
select array_compact(id1) from tt3;
ERROR 22000: invalid obj type for type promotion: left_type=ARRAY right_type=TEXT
select array_compact(id2) from tt3;
ERROR 22000: invalid obj type for type promotion: left_type=ARRAY right_type=MEDIUMTEXT
select array_compact([[1,3],id3]) from tt3;
ERROR 22000: Invalid data type for the operation

drop table if exists tt3;
CREATE TABLE tt3 (id int primary key, d varchar(50), c2 int[],c3 array(float),c4 varchar(256)[][],v vector(2)) partition by hash(id);
insert into tt3 values(1,1,[1,2,3,5],[2.123,2.123,3.123,4.123],[['中文ing123',1,'1',1,'1']],[1,23]);
insert into tt3 values(2,2,[2,3,3,3,3,4,5],[2.123,2.123,3.123,4.123],[[null,'a','sss']],[1,23]);
insert into tt3 values(3,3,[3,3,3,3],[3.123,2.123,3.123,4.123],[['null','a','sss'],null],[1,23]);
insert into tt3 values(4,4,[2,3,4,4,4,5],[4.123,2.123,3.123,4.123],[[2,3,4,5],null],[1,23]);
insert into tt3 values(5,null,null,null,null,null);
insert into tt3 values(6,null,[null,null],[null],[[null]],[1,23]);
insert into tt3(id) values(7);
insert into tt3 values(8,8,'[]','[]',[[1,'test'],[2,3,NULL],NULL],'[1,2]');
insert into tt3 values(9,9,'[-12,7347]','[1,2,5,6]',[[1,'test'],[2,3,NULL],NULL],'[25,-50]');
insert into tt3 values(10,10,'[null,null]','[]','[null,[],[1],["test",null],[null],[]]','[1,3]');
insert into tt3 values(11,11,'[1,2,5,6,null]','[197734E-3,2.3,988]','[null,[],[1,"test"],[2,3,NULL],NULL,[]]','[25,-50]');

drop view if exists vtt3;
Warnings:
Note	1051	Unknown table 'testkj.vtt3'
create view vtt3 as select * from tt3;

drop table if exists tt4;
Warnings:
Note	1051	Unknown table 'testkj.tt4'
CREATE TABLE tt4 (id int primary key, d varchar(50), c2 int[],c3 array(float),c4 varchar(256)[][],v vector(2)) partition by hash(id);
insert into tt4 values(1,1,[1,2,3,5],[2.123,2.123,3.123,4.123],[['中文ing123',1,'1']],[1,23]);
insert into tt4 values(2,2,[2,3,4,5],[2.123,2.123,3.123,4.123],[[null,'a','sss']],[1,23]);
insert into tt4 values(3,3,[3,3,3,3],[3.123,2.123,3.123,4.123],[['null','a','sss'],null],[1,23]);
insert into tt4 values(4,4,[2,3,4,5],[4.123,2.123,3.123,4.123],[[2,3,4,5],null],[1,23]);
insert into tt4 values(5,null,null,null,null,null);
insert into tt4 values(6,null,[null,null],[null],[[null]],[1,23]);
insert into tt4(id) values(7);
insert into tt4 values(8,8,'[]','[]',[[1,'test'],[2,3,NULL],NULL],'[1,2]');
insert into tt4 values(9,9,'[-12,7347]','[1,2,5,6]',[[1,'test'],[2,3,NULL],NULL],'[25,-50]');
insert into tt4  values(10,10,'[null,null]','[]','[null,[],[1],["test",null],[null],[]]','[1,3]');
insert into tt4 values(11,11,'[1,2,5,6,null]','[197734E-3,2.3,988]','[null,[],[1,"test"],[2,3,NULL],NULL,[]]','[25,-50]');

drop view if exists vtt4;
Warnings:
Note	1051	Unknown table 'testkj.vtt4'
create view vtt4 as select * from tt4;

select t3.*,array_compact(t3.c2) from tt3 t3 inner join tt4 t4 on array_compact(t3.c2)=array_compact(t4.c2);
+----+------+-----------------+---------------------------+-----------------------------------------------+----------+----------------------+
| id | d    | c2              | c3                        | c4                                            | v        | array_compact(t3.c2) |
+----+------+-----------------+---------------------------+-----------------------------------------------+----------+----------------------+
|  1 | 1    | [1,2,3,5]       | [2.123,2.123,3.123,4.123] | [["中文ing123","1","1","1","1"]]              | [1,23]   | [1,2,3,5]            |
|  2 | 2    | [2,3,3,3,3,4,5] | [2.123,2.123,3.123,4.123] | [[NULL,"a","sss"]]                            | [1,23]   | [2,3,4,5]            |
|  3 | 3    | [3,3,3,3]       | [3.123,2.123,3.123,4.123] | [["null","a","sss"],NULL]                     | [1,23]   | [3]                  |
|  4 | 4    | [2,3,4,4,4,5]   | [4.123,2.123,3.123,4.123] | [["2","3","4","5"],NULL]                      | [1,23]   | [2,3,4,5]            |
|  6 | NULL | [NULL,NULL]     | [NULL]                    | [[NULL]]                                      | [1,23]   | [NULL]               |
|  8 | 8    | []              | []                        | [["1","test"],["2","3",NULL],NULL]            | [1,2]    | []                   |
|  9 | 9    | [-12,7347]      | [1,2,5,6]                 | [["1","test"],["2","3",NULL],NULL]            | [25,-50] | [-12,7347]           |
| 10 | 10   | [NULL,NULL]     | []                        | [NULL,[],["1"],["test",NULL],[NULL],[]]       | [1,3]    | [NULL]               |
| 11 | 11   | [1,2,5,6,NULL]  | [197.734,2.3,988]         | [NULL,[],["1","test"],["2","3",NULL],NULL,[]] | [25,-50] | [1,2,5,6,NULL]       |
|  2 | 2    | [2,3,3,3,3,4,5] | [2.123,2.123,3.123,4.123] | [[NULL,"a","sss"]]                            | [1,23]   | [2,3,4,5]            |
|  4 | 4    | [2,3,4,4,4,5]   | [4.123,2.123,3.123,4.123] | [["2","3","4","5"],NULL]                      | [1,23]   | [2,3,4,5]            |
|  6 | NULL | [NULL,NULL]     | [NULL]                    | [[NULL]]                                      | [1,23]   | [NULL]               |
| 10 | 10   | [NULL,NULL]     | []                        | [NULL,[],["1"],["test",NULL],[NULL],[]]       | [1,3]    | [NULL]               |
+----+------+-----------------+---------------------------+-----------------------------------------------+----------+----------------------+
select t3.*,array_compact(t3.c3) from tt3 t3 right join tt4 t4 on  array_compact(t3.c3)=array_compact(t4.c3);
+----+------+-----------------+---------------------------+-----------------------------------------------+----------+---------------------------+
| id | d    | c2              | c3                        | c4                                            | v        | array_compact(t3.c3)      |
+----+------+-----------------+---------------------------+-----------------------------------------------+----------+---------------------------+
|  1 | 1    | [1,2,3,5]       | [2.123,2.123,3.123,4.123] | [["中文ing123","1","1","1","1"]]              | [1,23]   | [2.123,3.123,4.123]       |
|  2 | 2    | [2,3,3,3,3,4,5] | [2.123,2.123,3.123,4.123] | [[NULL,"a","sss"]]                            | [1,23]   | [2.123,3.123,4.123]       |
|  3 | 3    | [3,3,3,3]       | [3.123,2.123,3.123,4.123] | [["null","a","sss"],NULL]                     | [1,23]   | [3.123,2.123,3.123,4.123] |
|  4 | 4    | [2,3,4,4,4,5]   | [4.123,2.123,3.123,4.123] | [["2","3","4","5"],NULL]                      | [1,23]   | [4.123,2.123,3.123,4.123] |
|  6 | NULL | [NULL,NULL]     | [NULL]                    | [[NULL]]                                      | [1,23]   | [NULL]                    |
|  8 | 8    | []              | []                        | [["1","test"],["2","3",NULL],NULL]            | [1,2]    | []                        |
|  9 | 9    | [-12,7347]      | [1,2,5,6]                 | [["1","test"],["2","3",NULL],NULL]            | [25,-50] | [1,2,5,6]                 |
| 10 | 10   | [NULL,NULL]     | []                        | [NULL,[],["1"],["test",NULL],[NULL],[]]       | [1,3]    | []                        |
| 11 | 11   | [1,2,5,6,NULL]  | [197.734,2.3,988]         | [NULL,[],["1","test"],["2","3",NULL],NULL,[]] | [25,-50] | [197.734,2.3,988]         |
|  1 | 1    | [1,2,3,5]       | [2.123,2.123,3.123,4.123] | [["中文ing123","1","1","1","1"]]              | [1,23]   | [2.123,3.123,4.123]       |
|  2 | 2    | [2,3,3,3,3,4,5] | [2.123,2.123,3.123,4.123] | [[NULL,"a","sss"]]                            | [1,23]   | [2.123,3.123,4.123]       |
|  8 | 8    | []              | []                        | [["1","test"],["2","3",NULL],NULL]            | [1,2]    | []                        |
| 10 | 10   | [NULL,NULL]     | []                        | [NULL,[],["1"],["test",NULL],[NULL],[]]       | [1,3]    | []                        |
| NULL | NULL | NULL            | NULL                      | NULL                                          | NULL     | NULL                      |
| NULL | NULL | NULL            | NULL                      | NULL                                          | NULL     | NULL                      |
+----+------+-----------------+---------------------------+-----------------------------------------------+----------+---------------------------+
select t3.*,array_compact(t3.c4) from tt3 t3 left join tt4 t4 on  array_compact(t3.c4)=array_compact(t4.c4);
+----+------+-----------------+---------------------------+-----------------------------------------------+----------+-----------------------------------------------+
| id | d    | c2              | c3                        | c4                                            | v        | array_compact(t3.c4)                          |
+----+------+-----------------+---------------------------+-----------------------------------------------+----------+-----------------------------------------------+
|  1 | 1    | [1,2,3,5]       | [2.123,2.123,3.123,4.123] | [["中文ing123","1","1","1","1"]]              | [1,23]   | [["中文ing123","1","1","1","1"]]              |
|  2 | 2    | [2,3,3,3,3,4,5] | [2.123,2.123,3.123,4.123] | [[NULL,"a","sss"]]                            | [1,23]   | [[NULL,"a","sss"]]                            |
|  3 | 3    | [3,3,3,3]       | [3.123,2.123,3.123,4.123] | [["null","a","sss"],NULL]                     | [1,23]   | [["null","a","sss"],NULL]                     |
|  4 | 4    | [2,3,4,4,4,5]   | [4.123,2.123,3.123,4.123] | [["2","3","4","5"],NULL]                      | [1,23]   | [["2","3","4","5"],NULL]                      |
|  5 | NULL | NULL            | NULL                      | NULL                                          | NULL     | NULL                                          |
|  6 | NULL | [NULL,NULL]     | [NULL]                    | [[NULL]]                                      | [1,23]   | [[NULL]]                                      |
|  7 | NULL | NULL            | NULL                      | NULL                                          | NULL     | NULL                                          |
|  8 | 8    | []              | []                        | [["1","test"],["2","3",NULL],NULL]            | [1,2]    | [["1","test"],["2","3",NULL],NULL]            |
|  9 | 9    | [-12,7347]      | [1,2,5,6]                 | [["1","test"],["2","3",NULL],NULL]            | [25,-50] | [["1","test"],["2","3",NULL],NULL]            |
| 10 | 10   | [NULL,NULL]     | []                        | [NULL,[],["1"],["test",NULL],[NULL],[]]       | [1,3]    | [NULL,[],["1"],["test",NULL],[NULL],[]]       |
| 11 | 11   | [1,2,5,6,NULL]  | [197.734,2.3,988]         | [NULL,[],["1","test"],["2","3",NULL],NULL,[]] | [25,-50] | [NULL,[],["1","test"],["2","3",NULL],NULL,[]] |
|  8 | 8    | []              | []                        | [["1","test"],["2","3",NULL],NULL]            | [1,2]    | [["1","test"],["2","3",NULL],NULL]            |
|  9 | 9    | [-12,7347]      | [1,2,5,6]                 | [["1","test"],["2","3",NULL],NULL]            | [25,-50] | [["1","test"],["2","3",NULL],NULL]            |
+----+------+-----------------+---------------------------+-----------------------------------------------+----------+-----------------------------------------------+
select t3.*,array_compact(t3.v) from tt3 t3  join tt4 t4 on  array_compact(t3.v)=array_compact(t4.v);
+----+------+-----------------+---------------------------+-----------------------------------------------+----------+---------------------+
| id | d    | c2              | c3                        | c4                                            | v        | array_compact(t3.v) |
+----+------+-----------------+---------------------------+-----------------------------------------------+----------+---------------------+
|  1 | 1    | [1,2,3,5]       | [2.123,2.123,3.123,4.123] | [["中文ing123","1","1","1","1"]]              | [1,23]   | [1,23]              |
|  2 | 2    | [2,3,3,3,3,4,5] | [2.123,2.123,3.123,4.123] | [[NULL,"a","sss"]]                            | [1,23]   | [1,23]              |
|  3 | 3    | [3,3,3,3]       | [3.123,2.123,3.123,4.123] | [["null","a","sss"],NULL]                     | [1,23]   | [1,23]              |
|  4 | 4    | [2,3,4,4,4,5]   | [4.123,2.123,3.123,4.123] | [["2","3","4","5"],NULL]                      | [1,23]   | [1,23]              |
|  6 | NULL | [NULL,NULL]     | [NULL]                    | [[NULL]]                                      | [1,23]   | [1,23]              |
|  8 | 8    | []              | []                        | [["1","test"],["2","3",NULL],NULL]            | [1,2]    | [1,2]               |
|  9 | 9    | [-12,7347]      | [1,2,5,6]                 | [["1","test"],["2","3",NULL],NULL]            | [25,-50] | [25,-50]            |
| 10 | 10   | [NULL,NULL]     | []                        | [NULL,[],["1"],["test",NULL],[NULL],[]]       | [1,3]    | [1,3]               |
| 11 | 11   | [1,2,5,6,NULL]  | [197.734,2.3,988]         | [NULL,[],["1","test"],["2","3",NULL],NULL,[]] | [25,-50] | [25,-50]            |
|  1 | 1    | [1,2,3,5]       | [2.123,2.123,3.123,4.123] | [["中文ing123","1","1","1","1"]]              | [1,23]   | [1,23]              |
|  2 | 2    | [2,3,3,3,3,4,5] | [2.123,2.123,3.123,4.123] | [[NULL,"a","sss"]]                            | [1,23]   | [1,23]              |
|  3 | 3    | [3,3,3,3]       | [3.123,2.123,3.123,4.123] | [["null","a","sss"],NULL]                     | [1,23]   | [1,23]              |
|  4 | 4    | [2,3,4,4,4,5]   | [4.123,2.123,3.123,4.123] | [["2","3","4","5"],NULL]                      | [1,23]   | [1,23]              |
|  6 | NULL | [NULL,NULL]     | [NULL]                    | [[NULL]]                                      | [1,23]   | [1,23]              |
|  9 | 9    | [-12,7347]      | [1,2,5,6]                 | [["1","test"],["2","3",NULL],NULL]            | [25,-50] | [25,-50]            |
| 11 | 11   | [1,2,5,6,NULL]  | [197.734,2.3,988]         | [NULL,[],["1","test"],["2","3",NULL],NULL,[]] | [25,-50] | [25,-50]            |
|  1 | 1    | [1,2,3,5]       | [2.123,2.123,3.123,4.123] | [["中文ing123","1","1","1","1"]]              | [1,23]   | [1,23]              |
|  2 | 2    | [2,3,3,3,3,4,5] | [2.123,2.123,3.123,4.123] | [[NULL,"a","sss"]]                            | [1,23]   | [1,23]              |
|  3 | 3    | [3,3,3,3]       | [3.123,2.123,3.123,4.123] | [["null","a","sss"],NULL]                     | [1,23]   | [1,23]              |
|  4 | 4    | [2,3,4,4,4,5]   | [4.123,2.123,3.123,4.123] | [["2","3","4","5"],NULL]                      | [1,23]   | [1,23]              |
|  6 | NULL | [NULL,NULL]     | [NULL]                    | [[NULL]]                                      | [1,23]   | [1,23]              |
|  1 | 1    | [1,2,3,5]       | [2.123,2.123,3.123,4.123] | [["中文ing123","1","1","1","1"]]              | [1,23]   | [1,23]              |
|  2 | 2    | [2,3,3,3,3,4,5] | [2.123,2.123,3.123,4.123] | [[NULL,"a","sss"]]                            | [1,23]   | [1,23]              |
|  3 | 3    | [3,3,3,3]       | [3.123,2.123,3.123,4.123] | [["null","a","sss"],NULL]                     | [1,23]   | [1,23]              |
|  4 | 4    | [2,3,4,4,4,5]   | [4.123,2.123,3.123,4.123] | [["2","3","4","5"],NULL]                      | [1,23]   | [1,23]              |
|  6 | NULL | [NULL,NULL]     | [NULL]                    | [[NULL]]                                      | [1,23]   | [1,23]              |
|  1 | 1    | [1,2,3,5]       | [2.123,2.123,3.123,4.123] | [["中文ing123","1","1","1","1"]]              | [1,23]   | [1,23]              |
|  2 | 2    | [2,3,3,3,3,4,5] | [2.123,2.123,3.123,4.123] | [[NULL,"a","sss"]]                            | [1,23]   | [1,23]              |
|  3 | 3    | [3,3,3,3]       | [3.123,2.123,3.123,4.123] | [["null","a","sss"],NULL]                     | [1,23]   | [1,23]              |
|  4 | 4    | [2,3,4,4,4,5]   | [4.123,2.123,3.123,4.123] | [["2","3","4","5"],NULL]                      | [1,23]   | [1,23]              |
|  6 | NULL | [NULL,NULL]     | [NULL]                    | [[NULL]]                                      | [1,23]   | [1,23]              |
+----+------+-----------------+---------------------------+-----------------------------------------------+----------+---------------------+
select t3.*,array_compact(t3.c2) from tt3 t3 inner join tt4 t4 on array_compact(t3.c2)=array_compact(t4.c2) union select t3.*,array_compact(t3.c2) from tt3 t3 inner join tt4 t4 on array_compact(t3.c2)=array_compact(t4.c2);
+----+------+-----------------+---------------------------+-----------------------------------------------+----------+----------------------+
| id | d    | c2              | c3                        | c4                                            | v        | array_compact(t3.c2) |
+----+------+-----------------+---------------------------+-----------------------------------------------+----------+----------------------+
|  1 | 1    | [1,2,3,5]       | [2.123,2.123,3.123,4.123] | [["中文ing123","1","1","1","1"]]              | [1,23]   | [1,2,3,5]            |
|  2 | 2    | [2,3,3,3,3,4,5] | [2.123,2.123,3.123,4.123] | [[NULL,"a","sss"]]                            | [1,23]   | [2,3,4,5]            |
|  3 | 3    | [3,3,3,3]       | [3.123,2.123,3.123,4.123] | [["null","a","sss"],NULL]                     | [1,23]   | [3]                  |
|  4 | 4    | [2,3,4,4,4,5]   | [4.123,2.123,3.123,4.123] | [["2","3","4","5"],NULL]                      | [1,23]   | [2,3,4,5]            |
|  6 | NULL | [NULL,NULL]     | [NULL]                    | [[NULL]]                                      | [1,23]   | [NULL]               |
|  8 | 8    | []              | []                        | [["1","test"],["2","3",NULL],NULL]            | [1,2]    | []                   |
|  9 | 9    | [-12,7347]      | [1,2,5,6]                 | [["1","test"],["2","3",NULL],NULL]            | [25,-50] | [-12,7347]           |
| 10 | 10   | [NULL,NULL]     | []                        | [NULL,[],["1"],["test",NULL],[NULL],[]]       | [1,3]    | [NULL]               |
| 11 | 11   | [1,2,5,6,NULL]  | [197.734,2.3,988]         | [NULL,[],["1","test"],["2","3",NULL],NULL,[]] | [25,-50] | [1,2,5,6,NULL]       |
+----+------+-----------------+---------------------------+-----------------------------------------------+----------+----------------------+
select t3.*,array_compact(t3.c3) from tt3 t3 right join tt4 t4 on  array_compact(t3.c3)=array_compact(t4.c3) MINUS select t3.*,array_compact(t3.c3) from tt3 t3 right join tt4 t4 on  array_compact(t3.c3)=array_compact(t4.c3);
+------+------+------+------+------+------+----------------------+
| id   | d    | c2   | c3   | c4   | v    | array_compact(t3.c3) |
+------+------+------+------+------+------+----------------------+
+------+------+------+------+------+------+----------------------+
select t3.*,array_compact(t3.c4) from tt3 t3 left join tt4 t4 on  array_compact(t3.c4)=array_compact(t4.c4) UNION ALL select t3.*,array_compact(t3.c4) from tt3 t3 left join tt4 t4 on  array_compact(t3.c4)=array_compact(t4.c4);
+----+------+-----------------+---------------------------+-----------------------------------------------+----------+-----------------------------------------------+
| id | d    | c2              | c3                        | c4                                            | v        | array_compact(t3.c4)                          |
+----+------+-----------------+---------------------------+-----------------------------------------------+----------+-----------------------------------------------+
|  1 | 1    | [1,2,3,5]       | [2.123,2.123,3.123,4.123] | [["中文ing123","1","1","1","1"]]              | [1,23]   | [["中文ing123","1","1","1","1"]]              |
|  2 | 2    | [2,3,3,3,3,4,5] | [2.123,2.123,3.123,4.123] | [[NULL,"a","sss"]]                            | [1,23]   | [[NULL,"a","sss"]]                            |
|  3 | 3    | [3,3,3,3]       | [3.123,2.123,3.123,4.123] | [["null","a","sss"],NULL]                     | [1,23]   | [["null","a","sss"],NULL]                     |
|  4 | 4    | [2,3,4,4,4,5]   | [4.123,2.123,3.123,4.123] | [["2","3","4","5"],NULL]                      | [1,23]   | [["2","3","4","5"],NULL]                      |
|  5 | NULL | NULL            | NULL                      | NULL                                          | NULL     | NULL                                          |
|  6 | NULL | [NULL,NULL]     | [NULL]                    | [[NULL]]                                      | [1,23]   | [[NULL]]                                      |
|  7 | NULL | NULL            | NULL                      | NULL                                          | NULL     | NULL                                          |
|  8 | 8    | []              | []                        | [["1","test"],["2","3",NULL],NULL]            | [1,2]    | [["1","test"],["2","3",NULL],NULL]            |
|  9 | 9    | [-12,7347]      | [1,2,5,6]                 | [["1","test"],["2","3",NULL],NULL]            | [25,-50] | [["1","test"],["2","3",NULL],NULL]            |
| 10 | 10   | [NULL,NULL]     | []                        | [NULL,[],["1"],["test",NULL],[NULL],[]]       | [1,3]    | [NULL,[],["1"],["test",NULL],[NULL],[]]       |
| 11 | 11   | [1,2,5,6,NULL]  | [197.734,2.3,988]         | [NULL,[],["1","test"],["2","3",NULL],NULL,[]] | [25,-50] | [NULL,[],["1","test"],["2","3",NULL],NULL,[]] |
|  8 | 8    | []              | []                        | [["1","test"],["2","3",NULL],NULL]            | [1,2]    | [["1","test"],["2","3",NULL],NULL]            |
|  9 | 9    | [-12,7347]      | [1,2,5,6]                 | [["1","test"],["2","3",NULL],NULL]            | [25,-50] | [["1","test"],["2","3",NULL],NULL]            |
|  1 | 1    | [1,2,3,5]       | [2.123,2.123,3.123,4.123] | [["中文ing123","1","1","1","1"]]              | [1,23]   | [["中文ing123","1","1","1","1"]]              |
|  2 | 2    | [2,3,3,3,3,4,5] | [2.123,2.123,3.123,4.123] | [[NULL,"a","sss"]]                            | [1,23]   | [[NULL,"a","sss"]]                            |
|  3 | 3    | [3,3,3,3]       | [3.123,2.123,3.123,4.123] | [["null","a","sss"],NULL]                     | [1,23]   | [["null","a","sss"],NULL]                     |
|  4 | 4    | [2,3,4,4,4,5]   | [4.123,2.123,3.123,4.123] | [["2","3","4","5"],NULL]                      | [1,23]   | [["2","3","4","5"],NULL]                      |
|  5 | NULL | NULL            | NULL                      | NULL                                          | NULL     | NULL                                          |
|  6 | NULL | [NULL,NULL]     | [NULL]                    | [[NULL]]                                      | [1,23]   | [[NULL]]                                      |
|  7 | NULL | NULL            | NULL                      | NULL                                          | NULL     | NULL                                          |
|  8 | 8    | []              | []                        | [["1","test"],["2","3",NULL],NULL]            | [1,2]    | [["1","test"],["2","3",NULL],NULL]            |
|  9 | 9    | [-12,7347]      | [1,2,5,6]                 | [["1","test"],["2","3",NULL],NULL]            | [25,-50] | [["1","test"],["2","3",NULL],NULL]            |
| 10 | 10   | [NULL,NULL]     | []                        | [NULL,[],["1"],["test",NULL],[NULL],[]]       | [1,3]    | [NULL,[],["1"],["test",NULL],[NULL],[]]       |
| 11 | 11   | [1,2,5,6,NULL]  | [197.734,2.3,988]         | [NULL,[],["1","test"],["2","3",NULL],NULL,[]] | [25,-50] | [NULL,[],["1","test"],["2","3",NULL],NULL,[]] |
|  8 | 8    | []              | []                        | [["1","test"],["2","3",NULL],NULL]            | [1,2]    | [["1","test"],["2","3",NULL],NULL]            |
|  9 | 9    | [-12,7347]      | [1,2,5,6]                 | [["1","test"],["2","3",NULL],NULL]            | [25,-50] | [["1","test"],["2","3",NULL],NULL]            |
+----+------+-----------------+---------------------------+-----------------------------------------------+----------+-----------------------------------------------+
select t3.*,array_compact(t3.v) from tt3 t3  join tt4 t4 on  array_compact(t3.v)=array_compact(t4.v) INTERSECT select t3.*,array_compact(t3.v) from tt3 t3  join tt4 t4 on  array_compact(t3.v)=array_compact(t4.v);
+----+------+-----------------+---------------------------+-----------------------------------------------+----------+---------------------+
| id | d    | c2              | c3                        | c4                                            | v        | array_compact(t3.v) |
+----+------+-----------------+---------------------------+-----------------------------------------------+----------+---------------------+
|  1 | 1    | [1,2,3,5]       | [2.123,2.123,3.123,4.123] | [["中文ing123","1","1","1","1"]]              | [1,23]   | [1,23]              |
|  2 | 2    | [2,3,3,3,3,4,5] | [2.123,2.123,3.123,4.123] | [[NULL,"a","sss"]]                            | [1,23]   | [1,23]              |
|  3 | 3    | [3,3,3,3]       | [3.123,2.123,3.123,4.123] | [["null","a","sss"],NULL]                     | [1,23]   | [1,23]              |
|  4 | 4    | [2,3,4,4,4,5]   | [4.123,2.123,3.123,4.123] | [["2","3","4","5"],NULL]                      | [1,23]   | [1,23]              |
|  6 | NULL | [NULL,NULL]     | [NULL]                    | [[NULL]]                                      | [1,23]   | [1,23]              |
|  8 | 8    | []              | []                        | [["1","test"],["2","3",NULL],NULL]            | [1,2]    | [1,2]               |
|  9 | 9    | [-12,7347]      | [1,2,5,6]                 | [["1","test"],["2","3",NULL],NULL]            | [25,-50] | [25,-50]            |
| 10 | 10   | [NULL,NULL]     | []                        | [NULL,[],["1"],["test",NULL],[NULL],[]]       | [1,3]    | [1,3]               |
| 11 | 11   | [1,2,5,6,NULL]  | [197.734,2.3,988]         | [NULL,[],["1","test"],["2","3",NULL],NULL,[]] | [25,-50] | [25,-50]            |
+----+------+-----------------+---------------------------+-----------------------------------------------+----------+---------------------+

drop table tt3;
create table tt3(id int,a int[]);
insert into tt3 values(1,[1,2,3,3]);
insert into tt3 values(2,[5,6,7,7,null]);
insert into tt3 values(3,[5,6,7]);
insert into tt3 values(5,null);
insert into tt3 values(6,'[]');
drop table tt4;
create table tt4(id int,a int[]);
insert into tt4 values(1,[1,2,3]);
insert into tt4 values(2,[5,6,7,7,null]);
insert into tt4 values(3,[9]);
insert into tt3 values(5,null);
insert into tt3 values(6,'[]');

select t3.* from tt3 t3 inner join tt4 t4 on array_compact(t3.a)=array_compact(t4.a);
+------+----------------+
| id   | a              |
+------+----------------+
|    1 | [1,2,3,3]      |
|    2 | [5,6,7,7,NULL] |
+------+----------------+
select t3.* from tt3 t3 inner join tt4 t4 on array_compact(t3.a)=array_compact(t4.a);
+------+----------------+
| id   | a              |
+------+----------------+
|    1 | [1,2,3,3]      |
|    2 | [5,6,7,7,NULL] |
+------+----------------+
select t3.* from tt3 t3 right join tt4 t4 on array_compact(t3.a)=array_compact(t4.a);
+------+----------------+
| id   | a              |
+------+----------------+
|    1 | [1,2,3,3]      |
|    2 | [5,6,7,7,NULL] |
| NULL | NULL           |
+------+----------------+
select t3.* from tt3 t3 full join tt4 t4 on array_compact(t3.a)=array_compact(t4.a);
+------+----------------+
| id   | a              |
+------+----------------+
|    1 | [1,2,3,3]      |
|    2 | [5,6,7,7,NULL] |
|    3 | [5,6,7]        |
|    5 | NULL           |
|    6 | []             |
|    5 | NULL           |
|    6 | []             |
| NULL | NULL           |
+------+----------------+
select array_compact(tt3.a) from tt3;
+----------------------+
| array_compact(tt3.a) |
+----------------------+
| [1,2,3]              |
| [5,6,7,NULL]         |
| [5,6,7]              |
| NULL                 |
| []                   |
| NULL                 |
| []                   |
+----------------------+

select array_compact([t2.a]) from tt3 t1 join (select array_compact(t1.a) a from tt3 t1 full join tt3 t2 on array_compact(t1.a)=array_compact(t2.a)) t2 on array_compact(t1.a)=array_compact(t2.a);
+-----------------------+
| array_compact([t2.a]) |
+-----------------------+
| [[1,2,3]]             |
| [[5,6,7,NULL]]        |
| [[5,6,7]]             |
| [[]]                  |
| [[]]                  |
| [[]]                  |
| [[]]                  |
| [[]]                  |
| [[]]                  |
| [[]]                  |
| [[]]                  |
+-----------------------+
select array_compact([t2.a]) from tt3 t1 inner join (select array_compact(t1.a) a from tt3 t1 full join tt3 t2 on array_compact(t1.a)=array_compact(t2.a)) t2 on array_compact(t1.a)=array_compact(t2.a);
+-----------------------+
| array_compact([t2.a]) |
+-----------------------+
| [[1,2,3]]             |
| [[5,6,7,NULL]]        |
| [[5,6,7]]             |
| [[]]                  |
| [[]]                  |
| [[]]                  |
| [[]]                  |
| [[]]                  |
| [[]]                  |
| [[]]                  |
| [[]]                  |
+-----------------------+
select array_compact([t2.a]) from tt3 t1 right join (select array_compact(t1.a) a from tt3 t1 full join tt3 t2 on array_compact(t1.a)=array_compact(t2.a)) t2 on array_compact(t1.a)=array_compact(t2.a);
+-----------------------+
| array_compact([t2.a]) |
+-----------------------+
| [[1,2,3]]             |
| [[5,6,7,NULL]]        |
| [[5,6,7]]             |
| [[]]                  |
| [[]]                  |
| [[]]                  |
| [[]]                  |
| [[]]                  |
| [[]]                  |
| [[]]                  |
| [[]]                  |
| [NULL]                |
| [NULL]                |
| [NULL]                |
| [NULL]                |
+-----------------------+
select array_compact([t2.a]) from tt3 t1 cross join (select array_compact(t1.a) a from tt3 t1 full join tt3 t2 on array_compact(t1.a)=array_compact(t2.a)) t2 on array_compact(t1.a)=array_compact(t2.a);
+-----------------------+
| array_compact([t2.a]) |
+-----------------------+
| [[1,2,3]]             |
| [[5,6,7,NULL]]        |
| [[5,6,7]]             |
| [[]]                  |
| [[]]                  |
| [[]]                  |
| [[]]                  |
| [[]]                  |
| [[]]                  |
| [[]]                  |
| [[]]                  |
+-----------------------+
select array_compact([t2.a]) from tt3 t1 left join (select array_compact(t1.a) a from tt3 t1 full join tt3 t2 on array_compact(t1.a)=array_compact(t2.a)) t2 on array_compact(t1.a)=array_compact(t2.a);
+-----------------------+
| array_compact([t2.a]) |
+-----------------------+
| [[1,2,3]]             |
| [[5,6,7,NULL]]        |
| [[5,6,7]]             |
| [[]]                  |
| [[]]                  |
| [[]]                  |
| [[]]                  |
| [[]]                  |
| [[]]                  |
| [[]]                  |
| [[]]                  |
| [NULL]                |
| [NULL]                |
+-----------------------+
select array_compact([t2.a]) from tt3 t1 full join (select array_compact(t1.a) a from tt3 t1 full join tt3 t2 on array_compact(t1.a)=array_compact(t2.a)) t2 on array_compact(t1.a)=array_compact(t2.a);
+-----------------------+
| array_compact([t2.a]) |
+-----------------------+
| [[1,2,3]]             |
| [[5,6,7,NULL]]        |
| [[5,6,7]]             |
| [NULL]                |
| [[]]                  |
| [NULL]                |
| [[]]                  |
| [[]]                  |
| [[]]                  |
| [[]]                  |
| [[]]                  |
| [[]]                  |
| [[]]                  |
| [NULL]                |
| [NULL]                |
| [NULL]                |
| [NULL]                |
+-----------------------+

select array_compact(t3.a),array_compact([t3.id,t4.id]) from tt3 t3 join tt4 t4 on array_compact(t3.a)=array_compact(t4.a);
+---------------------+------------------------------+
| array_compact(t3.a) | array_compact([t3.id,t4.id]) |
+---------------------+------------------------------+
| [1,2,3]             | [1]                          |
| [5,6,7,NULL]        | [2]                          |
+---------------------+------------------------------+
select array_compact(t3.a),array_compact([t3.id,t4.id]) from tt3 t3 join tt4 t4 where array_compact(t3.a)=array_compact(t4.a);
+---------------------+------------------------------+
| array_compact(t3.a) | array_compact([t3.id,t4.id]) |
+---------------------+------------------------------+
| [1,2,3]             | [1]                          |
| [5,6,7,NULL]        | [2]                          |
+---------------------+------------------------------+
select array_compact(t3.a),array_compact([t3.id,t4.id]) from tt3 t3 inner join tt4 t4 on [t3.id]=array_compact(t4.a);
+---------------------+------------------------------+
| array_compact(t3.a) | array_compact([t3.id,t4.id]) |
+---------------------+------------------------------+
+---------------------+------------------------------+
select array_compact(t3.a),array_compact([t3.id,t4.id]) from tt3 t3 left join tt4 t4 on array_compact(t3.a)=[t4.id];
+---------------------+------------------------------+
| array_compact(t3.a) | array_compact([t3.id,t4.id]) |
+---------------------+------------------------------+
| [1,2,3]             | [1,NULL]                     |
| [5,6,7,NULL]        | [2,NULL]                     |
| [5,6,7]             | [3,NULL]                     |
| NULL                | [5,NULL]                     |
| []                  | [6,NULL]                     |
| NULL                | [5,NULL]                     |
| []                  | [6,NULL]                     |
+---------------------+------------------------------+
select array_compact(t3.a),array_compact([t3.id,t4.id]) from tt3 t3 right join tt4 t4 on t3.id=t4.id;
+---------------------+------------------------------+
| array_compact(t3.a) | array_compact([t3.id,t4.id]) |
+---------------------+------------------------------+
| [1,2,3]             | [1]                          |
| [5,6,7,NULL]        | [2]                          |
| [5,6,7]             | [3]                          |
+---------------------+------------------------------+
select array_compact(t3.a),array_compact([t3.id,t4.id]) from tt3 t3 full join tt4 t4 on array_compact(t3.a)<>array_compact(t4.a);
+---------------------+------------------------------+
| array_compact(t3.a) | array_compact([t3.id,t4.id]) |
+---------------------+------------------------------+
| [1,2,3]             | [1,2]                        |
| [1,2,3]             | [1,3]                        |
| [5,6,7,NULL]        | [2,1]                        |
| [5,6,7,NULL]        | [2,3]                        |
| [5,6,7]             | [3,1]                        |
| [5,6,7]             | [3,2]                        |
| [5,6,7]             | [3]                          |
| NULL                | [5,NULL]                     |
| []                  | [6,1]                        |
| []                  | [6,2]                        |
| []                  | [6,3]                        |
| NULL                | [5,NULL]                     |
| []                  | [6,1]                        |
| []                  | [6,2]                        |
| []                  | [6,3]                        |
+---------------------+------------------------------+
select array_compact(t3.a),array_compact([t3.id,t4.id]) from tt3 t3 cross join tt4 t4 on array_compact(t3.a)!=array_compact(t4.a);
+---------------------+------------------------------+
| array_compact(t3.a) | array_compact([t3.id,t4.id]) |
+---------------------+------------------------------+
| [1,2,3]             | [1,2]                        |
| [1,2,3]             | [1,3]                        |
| [5,6,7,NULL]        | [2,1]                        |
| [5,6,7,NULL]        | [2,3]                        |
| [5,6,7]             | [3,1]                        |
| [5,6,7]             | [3,2]                        |
| [5,6,7]             | [3]                          |
| []                  | [6,1]                        |
| []                  | [6,2]                        |
| []                  | [6,3]                        |
| []                  | [6,1]                        |
| []                  | [6,2]                        |
| []                  | [6,3]                        |
+---------------------+------------------------------+

select t3.* from tt3 t3 join tt4 t4 on array_compact(t3.a)=array_compact(t4.a);
+------+----------------+
| id   | a              |
+------+----------------+
|    1 | [1,2,3,3]      |
|    2 | [5,6,7,7,NULL] |
+------+----------------+
select t3.* from tt3 t3 inner join tt4 t4 on [t3.id]=array_compact(t4.a);
+------+------+
| id   | a    |
+------+------+
+------+------+
select t3.* from tt3 t3 inner join tt4 t4 on array_compact(t3.a)=[t4.id];
+------+------+
| id   | a    |
+------+------+
+------+------+
select t3.* from tt3 t3 left join tt4 t4 on array_compact(t3.a)=array_compact(t4.a);
+------+----------------+
| id   | a              |
+------+----------------+
|    1 | [1,2,3,3]      |
|    2 | [5,6,7,7,NULL] |
|    3 | [5,6,7]        |
|    5 | NULL           |
|    6 | []             |
|    5 | NULL           |
|    6 | []             |
+------+----------------+
select * from tt3 t3 right join tt4 t4 on [t4.id]!=array_compact(t3.a);
+------+----------------+------+----------------+
| id   | a              | id   | a              |
+------+----------------+------+----------------+
|    1 | [1,2,3,3]      |    1 | [1,2,3]        |
|    2 | [5,6,7,7,NULL] |    1 | [1,2,3]        |
|    3 | [5,6,7]        |    1 | [1,2,3]        |
|    6 | []             |    1 | [1,2,3]        |
|    6 | []             |    1 | [1,2,3]        |
|    1 | [1,2,3,3]      |    2 | [5,6,7,7,NULL] |
|    2 | [5,6,7,7,NULL] |    2 | [5,6,7,7,NULL] |
|    3 | [5,6,7]        |    2 | [5,6,7,7,NULL] |
|    6 | []             |    2 | [5,6,7,7,NULL] |
|    6 | []             |    2 | [5,6,7,7,NULL] |
|    1 | [1,2,3,3]      |    3 | [9]            |
|    2 | [5,6,7,7,NULL] |    3 | [9]            |
|    3 | [5,6,7]        |    3 | [9]            |
|    6 | []             |    3 | [9]            |
|    6 | []             |    3 | [9]            |
+------+----------------+------+----------------+
select * from tt3 t3 full join tt4 t4 on [t3.id]<>array_compact([1,2,45,67]);
+------+----------------+------+----------------+
| id   | a              | id   | a              |
+------+----------------+------+----------------+
|    1 | [1,2,3,3]      |    1 | [1,2,3]        |
|    1 | [1,2,3,3]      |    2 | [5,6,7,7,NULL] |
|    1 | [1,2,3,3]      |    3 | [9]            |
|    2 | [5,6,7,7,NULL] |    1 | [1,2,3]        |
|    2 | [5,6,7,7,NULL] |    2 | [5,6,7,7,NULL] |
|    2 | [5,6,7,7,NULL] |    3 | [9]            |
|    3 | [5,6,7]        |    1 | [1,2,3]        |
|    3 | [5,6,7]        |    2 | [5,6,7,7,NULL] |
|    3 | [5,6,7]        |    3 | [9]            |
|    5 | NULL           |    1 | [1,2,3]        |
|    5 | NULL           |    2 | [5,6,7,7,NULL] |
|    5 | NULL           |    3 | [9]            |
|    6 | []             |    1 | [1,2,3]        |
|    6 | []             |    2 | [5,6,7,7,NULL] |
|    6 | []             |    3 | [9]            |
|    5 | NULL           |    1 | [1,2,3]        |
|    5 | NULL           |    2 | [5,6,7,7,NULL] |
|    5 | NULL           |    3 | [9]            |
|    6 | []             |    1 | [1,2,3]        |
|    6 | []             |    2 | [5,6,7,7,NULL] |
|    6 | []             |    3 | [9]            |
+------+----------------+------+----------------+
select * from tt3 t3 cross join tt4 t4 on [t3.id]<>array_compact(t4.a);
+------+----------------+------+----------------+
| id   | a              | id   | a              |
+------+----------------+------+----------------+
|    1 | [1,2,3,3]      |    1 | [1,2,3]        |
|    1 | [1,2,3,3]      |    2 | [5,6,7,7,NULL] |
|    1 | [1,2,3,3]      |    3 | [9]            |
|    2 | [5,6,7,7,NULL] |    1 | [1,2,3]        |
|    2 | [5,6,7,7,NULL] |    2 | [5,6,7,7,NULL] |
|    2 | [5,6,7,7,NULL] |    3 | [9]            |
|    3 | [5,6,7]        |    1 | [1,2,3]        |
|    3 | [5,6,7]        |    2 | [5,6,7,7,NULL] |
|    3 | [5,6,7]        |    3 | [9]            |
|    5 | NULL           |    1 | [1,2,3]        |
|    5 | NULL           |    2 | [5,6,7,7,NULL] |
|    5 | NULL           |    3 | [9]            |
|    6 | []             |    1 | [1,2,3]        |
|    6 | []             |    2 | [5,6,7,7,NULL] |
|    6 | []             |    3 | [9]            |
|    5 | NULL           |    1 | [1,2,3]        |
|    5 | NULL           |    2 | [5,6,7,7,NULL] |
|    5 | NULL           |    3 | [9]            |
|    6 | []             |    1 | [1,2,3]        |
|    6 | []             |    2 | [5,6,7,7,NULL] |
|    6 | []             |    3 | [9]            |
+------+----------------+------+----------------+

select t3.* from (select array_compact(t3.a) a,array_compact([t3.id,t4.id]) b from tt3 t3 join tt4 t4 on array_compact(t3.a)=array_compact(t4.a)) as t3 join (select array_compact(t3.a) a,array_compact([t3.id,t4.id]) b from tt3 t3 join tt4 t4 where array_compact(t3.a)=array_compact(t4.a)) as t4 on array_compact([t3.a])=array_compact([t4.a]);
+--------------+------+
| a            | b    |
+--------------+------+
| [1,2,3]      | [1]  |
| [5,6,7,NULL] | [2]  |
+--------------+------+
select * from (select t3.* from tt3 t3 join tt4 t4 on array_compact(t3.a)=array_compact(t4.a)) as t3 join (select t4.* from tt3 t3 right join tt4 t4 on [t4.id]!=array_compact(t3.a)) as t4 on array_compact(t3.a)=array_compact(t4.a);
+------+----------------+------+----------------+
| id   | a              | id   | a              |
+------+----------------+------+----------------+
|    1 | [1,2,3,3]      |    1 | [1,2,3]        |
|    1 | [1,2,3,3]      |    1 | [1,2,3]        |
|    1 | [1,2,3,3]      |    1 | [1,2,3]        |
|    1 | [1,2,3,3]      |    1 | [1,2,3]        |
|    1 | [1,2,3,3]      |    1 | [1,2,3]        |
|    2 | [5,6,7,7,NULL] |    2 | [5,6,7,7,NULL] |
|    2 | [5,6,7,7,NULL] |    2 | [5,6,7,7,NULL] |
|    2 | [5,6,7,7,NULL] |    2 | [5,6,7,7,NULL] |
|    2 | [5,6,7,7,NULL] |    2 | [5,6,7,7,NULL] |
|    2 | [5,6,7,7,NULL] |    2 | [5,6,7,7,NULL] |
+------+----------------+------+----------------+

select * from tt3 union select * from tt4;
+------+----------------+
| id   | a              |
+------+----------------+
|    1 | [1,2,3,3]      |
|    2 | [5,6,7,7,NULL] |
|    3 | [5,6,7]        |
|    5 | NULL           |
|    6 | []             |
|    1 | [1,2,3]        |
|    3 | [9]            |
+------+----------------+
(select array_compact(t3.a) from tt3 t3) union distinct(select array_compact(t4.a) from tt4 t4);
+---------------------+
| array_compact(t3.a) |
+---------------------+
| [1,2,3]             |
| [5,6,7,NULL]        |
| [5,6,7]             |
| NULL                |
| []                  |
| [9]                 |
+---------------------+

select * from tt2 where array_compact(c1)<>[0] union select * from tt2 where array_compact(c2)<>[0];
+------+---------------------------+----------+--------------+-----------------------------------------------------------+-----------------------+--------------------------------------------------------------------------+------------------+---------------+
| id   | c1                        | c2       | c3           | c4                                                        | c5                    | c6                                                                       | c7               | c8            |
+------+---------------------------+----------+--------------+-----------------------------------------------------------+-----------------------+--------------------------------------------------------------------------+------------------+---------------+
|    1 | [2147483648,2147483648,0] | ["test"] | [52,0,5]     | [852,9223372036854775807,775,808,2,0,9223372036854775807] | [3.402,0,1.175,1.175] | [1.7976931348623157e308,2.2250738585072014e-308,2.2250738585072014e-308] | [88,0,32767]     | [1.1,1.1,1.1] |
|    2 | [87666,0,2147483647,4]    | ["test"] | [5,0,7,6,50] | [1,100000,9223372036854775807,775,808,2,0,1]              | [3.402,0,1.175,4]     | [1.7976931348623157e308,1.2,2.2250738585072014e-308]                     | [68,0,32767,0,1] | [2,2,2]       |
|    4 | []                        | []       | []           | []                                                        | []                    | []                                                                       | []               | [0,1,1]       |
|    5 | []                        | []       | []           | []                                                        | []                    | []                                                                       | []               | [0,0,0]       |
+------+---------------------------+----------+--------------+-----------------------------------------------------------+-----------------------+--------------------------------------------------------------------------+------------------+---------------+
select array_compact(c1),array_compact(c2),array_compact(c3),array_compact(c4),array_compact(c5),array_compact(c6),array_compact(c7) from tt1 union select array_compact(c1),array_compact(c2),array_compact(c3),array_compact(c4),array_compact(c5),array_compact(c6),array_compact(c7) from tt2 where id>0;
select array_compact(c1),array_compact(c2),array_compact(c3),array_compact(c4),array_compact(c5),array_compact(c6),array_compact(c7) from tt1 where array_compact(c5)<>[0] union select array_compact(c1),array_compact(c2),array_compact(c3),array_compact(c4),array_compact(c5),array_compact(c6),array_compact(c7) from tt2;
select array_compact(c1),array_compact(c2),array_compact(c3),array_compact(c4),array_compact(c5),array_compact(c6),array_compact(c7) from tt1 group by id union select array_compact(c1),array_compact(c2),array_compact(c3),array_compact(c4),array_compact(c5),array_compact(c6),array_compact(c7) from tt1;
select array_compact(c1),array_compact(c2),array_compact(c3),array_compact(c4),array_compact(c5),array_compact(c6),array_compact(c7) from tt1 union select array_compact(c1),array_compact(c2),array_compact(c3),array_compact(c4),array_compact(c5),array_compact(c6),array_compact(c7) from tt1 rollup FOR UPDATE;
select array_compact(c1),array_compact(c2),array_compact(c3),array_compact(c4),array_compact(c5),array_compact(c6),array_compact(c7) from tt1 union select array_compact(c1),array_compact(c2),array_compact(c3),array_compact(c4),array_compact(c5),array_compact(c6),array_compact(c7) from tt1 limit 1;

select array_compact(c1),array_compact(c2),array_compact(c3),array_compact(c4),array_compact(c5),array_compact(c6),array_compact(c7) from tt1 union all select array_compact(c1),array_compact(c2),array_compact(c3),array_compact(c4),array_compact(c5),array_compact(c6),array_compact(c7) from tt2 where id>0;
+---------------------------------+--------------------------+-------------------+-----------------------------------------------------------+----------------------+----------------------------------------------------------+-----------------------+
| array_compact(c1)               | array_compact(c2)        | array_compact(c3) | array_compact(c4)                                         | array_compact(c5)    | array_compact(c6)                                        | array_compact(c7)     |
+---------------------------------+--------------------------+-------------------+-----------------------------------------------------------+----------------------+----------------------------------------------------------+-----------------------+
| [-2147483648,0,2147483647]      | ["test",NULL]            | [127,0,-128]      | [-9223372036854775808,9223372036854775807,0]              | [3.402,0,0.175]      | [1.7976931348623157e308,0,2.2250738585072014e-308]       | [-32768,0,32767]      |
| [-2147483648,0,NULL,2147483647] | ["test","a",NULL,"null"] | [127,0,NULL,-128] | [-9223372036854775808,NULL,9223372036854775807,0]         | [NULL,0,3.402,1.175] | [-1.7976931348623157e308,NULL,0,2.2250738585072014e-308] | [-32768,0,NULL,32767] |
| NULL                            | NULL                     | NULL              | NULL                                                      | NULL                 | NULL                                                     | NULL                  |
| []                              | []                       | []                | []                                                        | []                   | []                                                       | []                    |
| []                              | []                       | []                | []                                                        | []                   | []                                                       | []                    |
| [2147483648,0]                  | ["test"]                 | [52,0,5]          | [852,9223372036854775807,775,808,2,0,9223372036854775807] | [3.402,0,1.175]      | [1.7976931348623157e308,2.2250738585072014e-308]         | [88,0,32767]          |
| [87666,0,2147483647,4]          | ["test"]                 | [5,0,7,6,50]      | [1,100000,9223372036854775807,775,808,2,0,1]              | [3.402,0,1.175,4]    | [1.7976931348623157e308,1.2,2.2250738585072014e-308]     | [68,0,32767,0,1]      |
| NULL                            | NULL                     | NULL              | NULL                                                      | NULL                 | NULL                                                     | NULL                  |
| []                              | []                       | []                | []                                                        | []                   | []                                                       | []                    |
| []                              | []                       | []                | []                                                        | []                   | []                                                       | []                    |
+---------------------------------+--------------------------+-------------------+-----------------------------------------------------------+----------------------+----------------------------------------------------------+-----------------------+
select array_compact(c1),array_compact(c2),array_compact(c3),array_compact(c4),array_compact(c5),array_compact(c6),array_compact(c7) from tt1 where array_compact(c5)<>[0] union all select array_compact(c1),array_compact(c2),array_compact(c3),array_compact(c4),array_compact(c5),array_compact(c6),array_compact(c7) from tt2;
+---------------------------------+--------------------------+-------------------+-----------------------------------------------------------+----------------------+----------------------------------------------------------+-----------------------+
| array_compact(c1)               | array_compact(c2)        | array_compact(c3) | array_compact(c4)                                         | array_compact(c5)    | array_compact(c6)                                        | array_compact(c7)     |
+---------------------------------+--------------------------+-------------------+-----------------------------------------------------------+----------------------+----------------------------------------------------------+-----------------------+
| [-2147483648,0,2147483647]      | ["test",NULL]            | [127,0,-128]      | [-9223372036854775808,9223372036854775807,0]              | [3.402,0,0.175]      | [1.7976931348623157e308,0,2.2250738585072014e-308]       | [-32768,0,32767]      |
| [-2147483648,0,NULL,2147483647] | ["test","a",NULL,"null"] | [127,0,NULL,-128] | [-9223372036854775808,NULL,9223372036854775807,0]         | [NULL,0,3.402,1.175] | [-1.7976931348623157e308,NULL,0,2.2250738585072014e-308] | [-32768,0,NULL,32767] |
| []                              | []                       | []                | []                                                        | []                   | []                                                       | []                    |
| []                              | []                       | []                | []                                                        | []                   | []                                                       | []                    |
| [2147483648,0]                  | ["test"]                 | [52,0,5]          | [852,9223372036854775807,775,808,2,0,9223372036854775807] | [3.402,0,1.175]      | [1.7976931348623157e308,2.2250738585072014e-308]         | [88,0,32767]          |
| [87666,0,2147483647,4]          | ["test"]                 | [5,0,7,6,50]      | [1,100000,9223372036854775807,775,808,2,0,1]              | [3.402,0,1.175,4]    | [1.7976931348623157e308,1.2,2.2250738585072014e-308]     | [68,0,32767,0,1]      |
| NULL                            | NULL                     | NULL              | NULL                                                      | NULL                 | NULL                                                     | NULL                  |
| []                              | []                       | []                | []                                                        | []                   | []                                                       | []                    |
| []                              | []                       | []                | []                                                        | []                   | []                                                       | []                    |
+---------------------------------+--------------------------+-------------------+-----------------------------------------------------------+----------------------+----------------------------------------------------------+-----------------------+
select array_compact(c1),array_compact(c2),array_compact(c3),array_compact(c4),array_compact(c5),array_compact(c6),array_compact(c7) from tt1 group by id union all select array_compact(c1),array_compact(c2),array_compact(c3),array_compact(c4),array_compact(c5),array_compact(c6),array_compact(c7) from tt1;
+---------------------------------+--------------------------+-------------------+---------------------------------------------------+----------------------+----------------------------------------------------------+-----------------------+
| array_compact(c1)               | array_compact(c2)        | array_compact(c3) | array_compact(c4)                                 | array_compact(c5)    | array_compact(c6)                                        | array_compact(c7)     |
+---------------------------------+--------------------------+-------------------+---------------------------------------------------+----------------------+----------------------------------------------------------+-----------------------+
| [-2147483648,0,2147483647]      | ["test",NULL]            | [127,0,-128]      | [-9223372036854775808,9223372036854775807,0]      | [3.402,0,0.175]      | [1.7976931348623157e308,0,2.2250738585072014e-308]       | [-32768,0,32767]      |
| [-2147483648,0,NULL,2147483647] | ["test","a",NULL,"null"] | [127,0,NULL,-128] | [-9223372036854775808,NULL,9223372036854775807,0] | [NULL,0,3.402,1.175] | [-1.7976931348623157e308,NULL,0,2.2250738585072014e-308] | [-32768,0,NULL,32767] |
| NULL                            | NULL                     | NULL              | NULL                                              | NULL                 | NULL                                                     | NULL                  |
| []                              | []                       | []                | []                                                | []                   | []                                                       | []                    |
| []                              | []                       | []                | []                                                | []                   | []                                                       | []                    |
| [-2147483648,0,2147483647]      | ["test",NULL]            | [127,0,-128]      | [-9223372036854775808,9223372036854775807,0]      | [3.402,0,0.175]      | [1.7976931348623157e308,0,2.2250738585072014e-308]       | [-32768,0,32767]      |
| [-2147483648,0,NULL,2147483647] | ["test","a",NULL,"null"] | [127,0,NULL,-128] | [-9223372036854775808,NULL,9223372036854775807,0] | [NULL,0,3.402,1.175] | [-1.7976931348623157e308,NULL,0,2.2250738585072014e-308] | [-32768,0,NULL,32767] |
| NULL                            | NULL                     | NULL              | NULL                                              | NULL                 | NULL                                                     | NULL                  |
| []                              | []                       | []                | []                                                | []                   | []                                                       | []                    |
| []                              | []                       | []                | []                                                | []                   | []                                                       | []                    |
+---------------------------------+--------------------------+-------------------+---------------------------------------------------+----------------------+----------------------------------------------------------+-----------------------+
select array_compact(c1),array_compact(c2),array_compact(c3),array_compact(c4),array_compact(c5),array_compact(c6),array_compact(c7) from tt1 union all select array_compact(c1),array_compact(c2),array_compact(c3),array_compact(c4),array_compact(c5),array_compact(c6),array_compact(c7) from tt1 rollup FOR UPDATE;
+---------------------------------+--------------------------+-------------------+---------------------------------------------------+----------------------+----------------------------------------------------------+-----------------------+
| array_compact(c1)               | array_compact(c2)        | array_compact(c3) | array_compact(c4)                                 | array_compact(c5)    | array_compact(c6)                                        | array_compact(c7)     |
+---------------------------------+--------------------------+-------------------+---------------------------------------------------+----------------------+----------------------------------------------------------+-----------------------+
| [-2147483648,0,2147483647]      | ["test",NULL]            | [127,0,-128]      | [-9223372036854775808,9223372036854775807,0]      | [3.402,0,0.175]      | [1.7976931348623157e308,0,2.2250738585072014e-308]       | [-32768,0,32767]      |
| [-2147483648,0,NULL,2147483647] | ["test","a",NULL,"null"] | [127,0,NULL,-128] | [-9223372036854775808,NULL,9223372036854775807,0] | [NULL,0,3.402,1.175] | [-1.7976931348623157e308,NULL,0,2.2250738585072014e-308] | [-32768,0,NULL,32767] |
| NULL                            | NULL                     | NULL              | NULL                                              | NULL                 | NULL                                                     | NULL                  |
| []                              | []                       | []                | []                                                | []                   | []                                                       | []                    |
| []                              | []                       | []                | []                                                | []                   | []                                                       | []                    |
| [-2147483648,0,2147483647]      | ["test",NULL]            | [127,0,-128]      | [-9223372036854775808,9223372036854775807,0]      | [3.402,0,0.175]      | [1.7976931348623157e308,0,2.2250738585072014e-308]       | [-32768,0,32767]      |
| [-2147483648,0,NULL,2147483647] | ["test","a",NULL,"null"] | [127,0,NULL,-128] | [-9223372036854775808,NULL,9223372036854775807,0] | [NULL,0,3.402,1.175] | [-1.7976931348623157e308,NULL,0,2.2250738585072014e-308] | [-32768,0,NULL,32767] |
| NULL                            | NULL                     | NULL              | NULL                                              | NULL                 | NULL                                                     | NULL                  |
| []                              | []                       | []                | []                                                | []                   | []                                                       | []                    |
| []                              | []                       | []                | []                                                | []                   | []                                                       | []                    |
+---------------------------------+--------------------------+-------------------+---------------------------------------------------+----------------------+----------------------------------------------------------+-----------------------+
select array_compact(c1),array_compact(c2),array_compact(c3),array_compact(c4),array_compact(c5),array_compact(c6),array_compact(c7) from tt1 union all select array_compact(c1),array_compact(c2),array_compact(c3),array_compact(c4),array_compact(c5),array_compact(c6),array_compact(c7) from tt1 limit 1;
+----------------------------+-------------------+-------------------+----------------------------------------------+-------------------+----------------------------------------------------+-------------------+
| array_compact(c1)          | array_compact(c2) | array_compact(c3) | array_compact(c4)                            | array_compact(c5) | array_compact(c6)                                  | array_compact(c7) |
+----------------------------+-------------------+-------------------+----------------------------------------------+-------------------+----------------------------------------------------+-------------------+
| [-2147483648,0,2147483647] | ["test",NULL]     | [127,0,-128]      | [-9223372036854775808,9223372036854775807,0] | [3.402,0,0.175]   | [1.7976931348623157e308,0,2.2250738585072014e-308] | [-32768,0,32767]  |
+----------------------------+-------------------+-------------------+----------------------------------------------+-------------------+----------------------------------------------------+-------------------+

select array_compact(t3.a),array_compact([t3.id,t4.id]) from tt3 t3 join tt4 t4 on t3.id=t4.id union select array_compact(t3.a),array_compact([t3.id,t4.id]) from tt3 t3 join tt4 t4 on t3.id=t4.id;
+---------------------+------------------------------+
| array_compact(t3.a) | array_compact([t3.id,t4.id]) |
+---------------------+------------------------------+
| [1,2,3]             | [1]                          |
| [5,6,7,NULL]        | [2]                          |
| [5,6,7]             | [3]                          |
+---------------------+------------------------------+
select array_compact(t3.a),array_compact([t3.id,t4.id]) from tt3 t3 join tt4 t4 on t3.id=t4.id union select array_compact(t3.a),array_compact([t3.id,t4.id]) from tt3 t3 join tt4 t4 where t3.id=t4.id;
+---------------------+------------------------------+
| array_compact(t3.a) | array_compact([t3.id,t4.id]) |
+---------------------+------------------------------+
| [1,2,3]             | [1]                          |
| [5,6,7,NULL]        | [2]                          |
| [5,6,7]             | [3]                          |
+---------------------+------------------------------+
select array_compact(t3.a),array_compact([t3.id,t4.id]) from tt3 t3 join tt4 t4 where t3.id=t4.id union select array_compact(t3.a),array_compact([t3.id,t4.id]) from tt3 t3 inner join tt4 t4 on t3.id=t4.id;
+---------------------+------------------------------+
| array_compact(t3.a) | array_compact([t3.id,t4.id]) |
+---------------------+------------------------------+
| [1,2,3]             | [1]                          |
| [5,6,7,NULL]        | [2]                          |
| [5,6,7]             | [3]                          |
+---------------------+------------------------------+
select array_compact(t3.a),array_compact([t3.id,t4.id]) from tt3 t3 inner join tt4 t4 on t3.id=t4.id union select array_compact(t3.a),array_compact([t3.id,t4.id]) from tt3 t3 left join tt4 t4 on t3.id=t4.id;
+---------------------+------------------------------+
| array_compact(t3.a) | array_compact([t3.id,t4.id]) |
+---------------------+------------------------------+
| [1,2,3]             | [1]                          |
| [5,6,7,NULL]        | [2]                          |
| [5,6,7]             | [3]                          |
| NULL                | [5,NULL]                     |
| []                  | [6,NULL]                     |
+---------------------+------------------------------+
select array_compact(t3.a),array_compact([t3.id,t4.id]) from tt3 t3 left join tt4 t4 on t3.id=t4.id union select array_compact(t3.a),array_compact([t3.id,t4.id]) from tt3 t3 right join tt4 t4 on t3.id=t4.id;
+---------------------+------------------------------+
| array_compact(t3.a) | array_compact([t3.id,t4.id]) |
+---------------------+------------------------------+
| [1,2,3]             | [1]                          |
| [5,6,7,NULL]        | [2]                          |
| [5,6,7]             | [3]                          |
| NULL                | [5,NULL]                     |
| []                  | [6,NULL]                     |
+---------------------+------------------------------+
select array_compact(t3.a),array_compact([t3.id,t4.id]) from tt3 t3 right join tt4 t4 on t3.id=t4.id union select array_compact(t3.a),array_compact([t3.id,t4.id]) from tt3 t3 full join tt4 t4 on t3.id=t4.id;
+---------------------+------------------------------+
| array_compact(t3.a) | array_compact([t3.id,t4.id]) |
+---------------------+------------------------------+
| [1,2,3]             | [1]                          |
| [5,6,7,NULL]        | [2]                          |
| [5,6,7]             | [3]                          |
| NULL                | [5,NULL]                     |
| []                  | [6,NULL]                     |
+---------------------+------------------------------+
select array_compact(t3.a),array_compact([t3.id,t4.id]) from tt3 t3 full join tt4 t4 on t3.id=t4.id union select array_compact(t3.a),array_compact([t3.id,t4.id]) from tt3 t3 cross join tt4 t4 on t3.id=t4.id;
+---------------------+------------------------------+
| array_compact(t3.a) | array_compact([t3.id,t4.id]) |
+---------------------+------------------------------+
| [1,2,3]             | [1]                          |
| [5,6,7,NULL]        | [2]                          |
| [5,6,7]             | [3]                          |
| NULL                | [5,NULL]                     |
| []                  | [6,NULL]                     |
+---------------------+------------------------------+

select t3.* from tt3 t3 join tt4 t4 on array_compact(t3.a)=array_compact(t4.a) union select t3.* from tt3 t3 join tt4 t4 on array_compact(t3.a)=array_compact(t4.a);
+------+----------------+
| id   | a              |
+------+----------------+
|    1 | [1,2,3,3]      |
|    2 | [5,6,7,7,NULL] |
+------+----------------+
select t3.* from tt3 t3 join tt4 t4 on array_compact(t3.a)=array_compact(t4.a) union select t3.* from tt3 t3 inner join tt4 t4 on array_compact(t3.a)=array_compact(t4.a);
+------+----------------+
| id   | a              |
+------+----------------+
|    1 | [1,2,3,3]      |
|    2 | [5,6,7,7,NULL] |
+------+----------------+
select t3.* from tt3 t3 join tt4 t4 on array_compact(t3.a)=array_compact(t4.a) union select t3.* from tt3 t3 right join tt4 t4 on array_compact(t3.a)=array_compact(t4.a);
+------+----------------+
| id   | a              |
+------+----------------+
|    1 | [1,2,3,3]      |
|    2 | [5,6,7,7,NULL] |
| NULL | NULL           |
+------+----------------+
select t3.* from tt3 t3 join tt4 t4 on array_compact(t3.a)=array_compact(t4.a) union select t3.* from tt3 t3 cross join tt4 t4 on array_compact(t3.a)=array_compact(t4.a);
+------+----------------+
| id   | a              |
+------+----------------+
|    1 | [1,2,3,3]      |
|    2 | [5,6,7,7,NULL] |
+------+----------------+
select t3.* from tt3 t3 join tt4 t4 on array_compact(t3.a)=array_compact(t4.a) union select t3.* from tt3 t3 left join tt4 t4 on array_compact(t3.a)=array_compact(t4.a);
+------+----------------+
| id   | a              |
+------+----------------+
|    1 | [1,2,3,3]      |
|    2 | [5,6,7,7,NULL] |
|    3 | [5,6,7]        |
|    5 | NULL           |
|    6 | []             |
+------+----------------+
select t3.* from tt3 t3 join tt4 t4 on array_compact(t3.a)=array_compact(t4.a) union select t3.* from tt3 t3 cross join tt4 t4 on array_compact(t3.a)=array_compact(t4.a);
+------+----------------+
| id   | a              |
+------+----------------+
|    1 | [1,2,3,3]      |
|    2 | [5,6,7,7,NULL] |
+------+----------------+

select t3.* from tt3 t3 join tt4 t4 on array_compact(t3.a)=array_compact(t4.a) union select t3.* from tt3 t3 inner join tt4 t4 on [t3.id]=array_compact(t4.a);
+------+----------------+
| id   | a              |
+------+----------------+
|    1 | [1,2,3,3]      |
|    2 | [5,6,7,7,NULL] |
+------+----------------+
select t3.* from tt3 t3 inner join tt4 t4 on array_compact(t3.a)=[t4.id] union select t3.* from tt3 t3 inner join tt4 t4 on [t3.id]!=array_compact(t4.a);
+------+----------------+
| id   | a              |
+------+----------------+
|    1 | [1,2,3,3]      |
|    2 | [5,6,7,7,NULL] |
|    3 | [5,6,7]        |
|    5 | NULL           |
|    6 | []             |
+------+----------------+
select t3.* from tt3 t3 inner join tt4 t4 on array_compact(t3.a)=[t4.id] union select t3.* from tt3 t3 left join tt4 t4 on array_compact(t3.a)=array_compact(t4.a);
+------+----------------+
| id   | a              |
+------+----------------+
|    1 | [1,2,3,3]      |
|    2 | [5,6,7,7,NULL] |
|    3 | [5,6,7]        |
|    5 | NULL           |
|    6 | []             |
+------+----------------+
select * from tt3 t3 left join tt4 t4 on array_compact(t3.a)=array_compact(t4.a) union select * from tt3 t3 right join tt4 t4 on [t4.id]!=array_compact(t3.a);
+------+----------------+------+----------------+
| id   | a              | id   | a              |
+------+----------------+------+----------------+
|    1 | [1,2,3,3]      |    1 | [1,2,3]        |
|    2 | [5,6,7,7,NULL] |    2 | [5,6,7,7,NULL] |
|    3 | [5,6,7]        | NULL | NULL           |
|    5 | NULL           | NULL | NULL           |
|    6 | []             | NULL | NULL           |
|    2 | [5,6,7,7,NULL] |    1 | [1,2,3]        |
|    3 | [5,6,7]        |    1 | [1,2,3]        |
|    6 | []             |    1 | [1,2,3]        |
|    1 | [1,2,3,3]      |    2 | [5,6,7,7,NULL] |
|    3 | [5,6,7]        |    2 | [5,6,7,7,NULL] |
|    6 | []             |    2 | [5,6,7,7,NULL] |
|    1 | [1,2,3,3]      |    3 | [9]            |
|    2 | [5,6,7,7,NULL] |    3 | [9]            |
|    3 | [5,6,7]        |    3 | [9]            |
|    6 | []             |    3 | [9]            |
+------+----------------+------+----------------+
select * from tt3 t3 right join tt4 t4 on [t4.id]!=array_compact(t3.a) union select * from tt3 t3 full join tt4 t4 on [t3.id]<>array_compact([1,2,45,67]);
+------+----------------+------+----------------+
| id   | a              | id   | a              |
+------+----------------+------+----------------+
|    1 | [1,2,3,3]      |    1 | [1,2,3]        |
|    2 | [5,6,7,7,NULL] |    1 | [1,2,3]        |
|    3 | [5,6,7]        |    1 | [1,2,3]        |
|    6 | []             |    1 | [1,2,3]        |
|    1 | [1,2,3,3]      |    2 | [5,6,7,7,NULL] |
|    2 | [5,6,7,7,NULL] |    2 | [5,6,7,7,NULL] |
|    3 | [5,6,7]        |    2 | [5,6,7,7,NULL] |
|    6 | []             |    2 | [5,6,7,7,NULL] |
|    1 | [1,2,3,3]      |    3 | [9]            |
|    2 | [5,6,7,7,NULL] |    3 | [9]            |
|    3 | [5,6,7]        |    3 | [9]            |
|    6 | []             |    3 | [9]            |
|    5 | NULL           |    1 | [1,2,3]        |
|    5 | NULL           |    2 | [5,6,7,7,NULL] |
|    5 | NULL           |    3 | [9]            |
+------+----------------+------+----------------+
select * from tt3 t3 full join tt4 t4 on [t3.id]<>array_compact([1,2,45,67]) union select * from tt3 t3 cross join tt4 t4 on [t3.id]!=array_compact(t4.a);
+------+----------------+------+----------------+
| id   | a              | id   | a              |
+------+----------------+------+----------------+
|    1 | [1,2,3,3]      |    1 | [1,2,3]        |
|    1 | [1,2,3,3]      |    2 | [5,6,7,7,NULL] |
|    1 | [1,2,3,3]      |    3 | [9]            |
|    2 | [5,6,7,7,NULL] |    1 | [1,2,3]        |
|    2 | [5,6,7,7,NULL] |    2 | [5,6,7,7,NULL] |
|    2 | [5,6,7,7,NULL] |    3 | [9]            |
|    3 | [5,6,7]        |    1 | [1,2,3]        |
|    3 | [5,6,7]        |    2 | [5,6,7,7,NULL] |
|    3 | [5,6,7]        |    3 | [9]            |
|    5 | NULL           |    1 | [1,2,3]        |
|    5 | NULL           |    2 | [5,6,7,7,NULL] |
|    5 | NULL           |    3 | [9]            |
|    6 | []             |    1 | [1,2,3]        |
|    6 | []             |    2 | [5,6,7,7,NULL] |
|    6 | []             |    3 | [9]            |
+------+----------------+------+----------------+
select t3.* from tt3 t3 cross join tt4 t4 on [t3.id]!=array_compact(t4.a) union select t3.* from tt3 t3 join tt4 t4 on array_compact(t3.a)=array_compact(t4.a);
+------+----------------+
| id   | a              |
+------+----------------+
|    1 | [1,2,3,3]      |
|    2 | [5,6,7,7,NULL] |
|    3 | [5,6,7]        |
|    5 | NULL           |
|    6 | []             |
+------+----------------+

select array_compact(t3.a),array_compact([t3.id,t4.id]) from tt3 t3 join tt4 t4 on t3.id=t4.id union all select array_compact(t3.a),array_compact([t3.id,t4.id]) from tt3 t3 join tt4 t4 on t3.id=t4.id;
+---------------------+------------------------------+
| array_compact(t3.a) | array_compact([t3.id,t4.id]) |
+---------------------+------------------------------+
| [1,2,3]             | [1]                          |
| [5,6,7,NULL]        | [2]                          |
| [5,6,7]             | [3]                          |
| [1,2,3]             | [1]                          |
| [5,6,7,NULL]        | [2]                          |
| [5,6,7]             | [3]                          |
+---------------------+------------------------------+
select array_compact(t3.a),array_compact([t3.id,t4.id]) from tt3 t3 join tt4 t4 on t3.id=t4.id union all select array_compact(t3.a),array_compact([t3.id,t4.id]) from tt3 t3 join tt4 t4 where t3.id=t4.id;
+---------------------+------------------------------+
| array_compact(t3.a) | array_compact([t3.id,t4.id]) |
+---------------------+------------------------------+
| [1,2,3]             | [1]                          |
| [5,6,7,NULL]        | [2]                          |
| [5,6,7]             | [3]                          |
| [1,2,3]             | [1]                          |
| [5,6,7,NULL]        | [2]                          |
| [5,6,7]             | [3]                          |
+---------------------+------------------------------+
select array_compact(t3.a),array_compact([t3.id,t4.id]) from tt3 t3 join tt4 t4 where t3.id=t4.id union all select array_compact(t3.a),array_compact([t3.id,t4.id]) from tt3 t3 inner join tt4 t4 on t3.id=t4.id;
+---------------------+------------------------------+
| array_compact(t3.a) | array_compact([t3.id,t4.id]) |
+---------------------+------------------------------+
| [1,2,3]             | [1]                          |
| [5,6,7,NULL]        | [2]                          |
| [5,6,7]             | [3]                          |
| [1,2,3]             | [1]                          |
| [5,6,7,NULL]        | [2]                          |
| [5,6,7]             | [3]                          |
+---------------------+------------------------------+
select array_compact(t3.a),array_compact([t3.id,t4.id]) from tt3 t3 inner join tt4 t4 on t3.id=t4.id union all select array_compact(t3.a),array_compact([t3.id,t4.id]) from tt3 t3 left join tt4 t4 on t3.id=t4.id;
+---------------------+------------------------------+
| array_compact(t3.a) | array_compact([t3.id,t4.id]) |
+---------------------+------------------------------+
| [1,2,3]             | [1]                          |
| [5,6,7,NULL]        | [2]                          |
| [5,6,7]             | [3]                          |
| [1,2,3]             | [1]                          |
| [5,6,7,NULL]        | [2]                          |
| [5,6,7]             | [3]                          |
| NULL                | [5,NULL]                     |
| []                  | [6,NULL]                     |
| NULL                | [5,NULL]                     |
| []                  | [6,NULL]                     |
+---------------------+------------------------------+
select array_compact(t3.a),array_compact([t3.id,t4.id]) from tt3 t3 left join tt4 t4 on t3.id=t4.id union all select array_compact(t3.a),array_compact([t3.id,t4.id]) from tt3 t3 right join tt4 t4 on t3.id=t4.id;
+---------------------+------------------------------+
| array_compact(t3.a) | array_compact([t3.id,t4.id]) |
+---------------------+------------------------------+
| [1,2,3]             | [1]                          |
| [5,6,7,NULL]        | [2]                          |
| [5,6,7]             | [3]                          |
| NULL                | [5,NULL]                     |
| []                  | [6,NULL]                     |
| NULL                | [5,NULL]                     |
| []                  | [6,NULL]                     |
| [1,2,3]             | [1]                          |
| [5,6,7,NULL]        | [2]                          |
| [5,6,7]             | [3]                          |
+---------------------+------------------------------+
select array_compact(t3.a),array_compact([t3.id,t4.id]) from tt3 t3 right join tt4 t4 on t3.id=t4.id union all select array_compact(t3.a),array_compact([t3.id,t4.id]) from tt3 t3 full join tt4 t4 on t3.id=t4.id;
+---------------------+------------------------------+
| array_compact(t3.a) | array_compact([t3.id,t4.id]) |
+---------------------+------------------------------+
| [1,2,3]             | [1]                          |
| [5,6,7,NULL]        | [2]                          |
| [5,6,7]             | [3]                          |
| [1,2,3]             | [1]                          |
| [5,6,7,NULL]        | [2]                          |
| [5,6,7]             | [3]                          |
| NULL                | [5,NULL]                     |
| []                  | [6,NULL]                     |
| NULL                | [5,NULL]                     |
| []                  | [6,NULL]                     |
+---------------------+------------------------------+
select array_compact(t3.a),array_compact([t3.id,t4.id]) from tt3 t3 full join tt4 t4 on t3.id=t4.id union all select array_compact(t3.a),array_compact([t3.id,t4.id]) from tt3 t3 cross join tt4 t4 on t3.id=t4.id;
+---------------------+------------------------------+
| array_compact(t3.a) | array_compact([t3.id,t4.id]) |
+---------------------+------------------------------+
| [1,2,3]             | [1]                          |
| [5,6,7,NULL]        | [2]                          |
| [5,6,7]             | [3]                          |
| NULL                | [5,NULL]                     |
| []                  | [6,NULL]                     |
| NULL                | [5,NULL]                     |
| []                  | [6,NULL]                     |
| [1,2,3]             | [1]                          |
| [5,6,7,NULL]        | [2]                          |
| [5,6,7]             | [3]                          |
+---------------------+------------------------------+

select t3.* from tt3 t3 join tt4 t4 on array_compact(t3.a)=array_compact(t4.a) union all select t3.* from tt3 t3 join tt4 t4 on array_compact(t3.a)=array_compact(t4.a);
+------+----------------+
| id   | a              |
+------+----------------+
|    1 | [1,2,3,3]      |
|    2 | [5,6,7,7,NULL] |
|    1 | [1,2,3,3]      |
|    2 | [5,6,7,7,NULL] |
+------+----------------+
select t3.* from tt3 t3 join tt4 t4 on array_compact(t3.a)=array_compact(t4.a) union all select t3.* from tt3 t3 inner join tt4 t4 on array_compact(t3.a)=array_compact(t4.a);
+------+----------------+
| id   | a              |
+------+----------------+
|    1 | [1,2,3,3]      |
|    2 | [5,6,7,7,NULL] |
|    1 | [1,2,3,3]      |
|    2 | [5,6,7,7,NULL] |
+------+----------------+
select t3.* from tt3 t3 join tt4 t4 on array_compact(t3.a)=array_compact(t4.a) union all select t3.* from tt3 t3 right join tt4 t4 on array_compact(t3.a)=array_compact(t4.a);
+------+----------------+
| id   | a              |
+------+----------------+
|    1 | [1,2,3,3]      |
|    2 | [5,6,7,7,NULL] |
|    1 | [1,2,3,3]      |
|    2 | [5,6,7,7,NULL] |
| NULL | NULL           |
+------+----------------+
select t3.* from tt3 t3 join tt4 t4 on array_compact(t3.a)=array_compact(t4.a) union all select t3.* from tt3 t3 cross join tt4 t4 on array_compact(t3.a)=array_compact(t4.a);
+------+----------------+
| id   | a              |
+------+----------------+
|    1 | [1,2,3,3]      |
|    2 | [5,6,7,7,NULL] |
|    1 | [1,2,3,3]      |
|    2 | [5,6,7,7,NULL] |
+------+----------------+
select t3.* from tt3 t3 join tt4 t4 on array_compact(t3.a)=array_compact(t4.a) union all select t3.* from tt3 t3 left join tt4 t4 on array_compact(t3.a)=array_compact(t4.a);
+------+----------------+
| id   | a              |
+------+----------------+
|    1 | [1,2,3,3]      |
|    2 | [5,6,7,7,NULL] |
|    1 | [1,2,3,3]      |
|    2 | [5,6,7,7,NULL] |
|    3 | [5,6,7]        |
|    5 | NULL           |
|    6 | []             |
|    5 | NULL           |
|    6 | []             |
+------+----------------+
select t3.* from tt3 t3 join tt4 t4 on array_compact(t3.a)=array_compact(t4.a) union all select t3.* from tt3 t3 cross join tt4 t4 on array_compact(t3.a)=array_compact(t4.a);
+------+----------------+
| id   | a              |
+------+----------------+
|    1 | [1,2,3,3]      |
|    2 | [5,6,7,7,NULL] |
|    1 | [1,2,3,3]      |
|    2 | [5,6,7,7,NULL] |
+------+----------------+

select t3.* from tt3 t3 join tt4 t4 on array_compact(t3.a)=array_compact(t4.a) union all select t3.* from tt3 t3 join tt4 t4 on array_compact(t3.a)=array_compact(t4.a);
+------+----------------+
| id   | a              |
+------+----------------+
|    1 | [1,2,3,3]      |
|    2 | [5,6,7,7,NULL] |
|    1 | [1,2,3,3]      |
|    2 | [5,6,7,7,NULL] |
+------+----------------+
select t3.* from tt3 t3 join tt4 t4 on array_compact(t3.a)!=array_compact(t4.a) union all select t3.* from tt3 t3 inner join tt4 t4 on [t3.id]=array_compact(t4.a);
+------+----------------+
| id   | a              |
+------+----------------+
|    1 | [1,2,3,3]      |
|    1 | [1,2,3,3]      |
|    2 | [5,6,7,7,NULL] |
|    2 | [5,6,7,7,NULL] |
|    3 | [5,6,7]        |
|    3 | [5,6,7]        |
|    3 | [5,6,7]        |
|    6 | []             |
|    6 | []             |
|    6 | []             |
|    6 | []             |
|    6 | []             |
|    6 | []             |
+------+----------------+
select t3.* from tt3 t3 inner join tt4 t4 on array_compact(t3.a)=[t4.id] union all select t3.* from tt3 t3 inner join tt4 t4 on [t3.id]=array_compact(t4.a);
+------+------+
| id   | a    |
+------+------+
+------+------+
select t3.* from tt3 t3 inner join tt4 t4 on array_compact(t3.a)=[t4.id] union all select t3.* from tt3 t3 left join tt4 t4 on array_compact(t3.a)=array_compact(t4.a);
+------+----------------+
| id   | a              |
+------+----------------+
|    1 | [1,2,3,3]      |
|    2 | [5,6,7,7,NULL] |
|    3 | [5,6,7]        |
|    5 | NULL           |
|    6 | []             |
|    5 | NULL           |
|    6 | []             |
+------+----------------+
select * from tt3 t3 left join tt4 t4 on array_compact(t3.a)=array_compact(t4.a) union all select * from tt3 t3 right join tt4 t4 on [t4.id]!=array_compact(t3.a);
+------+----------------+------+----------------+
| id   | a              | id   | a              |
+------+----------------+------+----------------+
|    1 | [1,2,3,3]      |    1 | [1,2,3]        |
|    2 | [5,6,7,7,NULL] |    2 | [5,6,7,7,NULL] |
|    3 | [5,6,7]        | NULL | NULL           |
|    5 | NULL           | NULL | NULL           |
|    6 | []             | NULL | NULL           |
|    5 | NULL           | NULL | NULL           |
|    6 | []             | NULL | NULL           |
|    1 | [1,2,3,3]      |    1 | [1,2,3]        |
|    2 | [5,6,7,7,NULL] |    1 | [1,2,3]        |
|    3 | [5,6,7]        |    1 | [1,2,3]        |
|    6 | []             |    1 | [1,2,3]        |
|    6 | []             |    1 | [1,2,3]        |
|    1 | [1,2,3,3]      |    2 | [5,6,7,7,NULL] |
|    2 | [5,6,7,7,NULL] |    2 | [5,6,7,7,NULL] |
|    3 | [5,6,7]        |    2 | [5,6,7,7,NULL] |
|    6 | []             |    2 | [5,6,7,7,NULL] |
|    6 | []             |    2 | [5,6,7,7,NULL] |
|    1 | [1,2,3,3]      |    3 | [9]            |
|    2 | [5,6,7,7,NULL] |    3 | [9]            |
|    3 | [5,6,7]        |    3 | [9]            |
|    6 | []             |    3 | [9]            |
|    6 | []             |    3 | [9]            |
+------+----------------+------+----------------+
select * from tt3 t3 right join tt4 t4 on [t4.id]!=array_compact(t3.a) union all select * from tt3 t3 full join tt4 t4 on [t3.id]<>array_compact([1,2,45,67]);
+------+----------------+------+----------------+
| id   | a              | id   | a              |
+------+----------------+------+----------------+
|    1 | [1,2,3,3]      |    1 | [1,2,3]        |
|    2 | [5,6,7,7,NULL] |    1 | [1,2,3]        |
|    3 | [5,6,7]        |    1 | [1,2,3]        |
|    6 | []             |    1 | [1,2,3]        |
|    6 | []             |    1 | [1,2,3]        |
|    1 | [1,2,3,3]      |    2 | [5,6,7,7,NULL] |
|    2 | [5,6,7,7,NULL] |    2 | [5,6,7,7,NULL] |
|    3 | [5,6,7]        |    2 | [5,6,7,7,NULL] |
|    6 | []             |    2 | [5,6,7,7,NULL] |
|    6 | []             |    2 | [5,6,7,7,NULL] |
|    1 | [1,2,3,3]      |    3 | [9]            |
|    2 | [5,6,7,7,NULL] |    3 | [9]            |
|    3 | [5,6,7]        |    3 | [9]            |
|    6 | []             |    3 | [9]            |
|    6 | []             |    3 | [9]            |
|    1 | [1,2,3,3]      |    1 | [1,2,3]        |
|    1 | [1,2,3,3]      |    2 | [5,6,7,7,NULL] |
|    1 | [1,2,3,3]      |    3 | [9]            |
|    2 | [5,6,7,7,NULL] |    1 | [1,2,3]        |
|    2 | [5,6,7,7,NULL] |    2 | [5,6,7,7,NULL] |
|    2 | [5,6,7,7,NULL] |    3 | [9]            |
|    3 | [5,6,7]        |    1 | [1,2,3]        |
|    3 | [5,6,7]        |    2 | [5,6,7,7,NULL] |
|    3 | [5,6,7]        |    3 | [9]            |
|    5 | NULL           |    1 | [1,2,3]        |
|    5 | NULL           |    2 | [5,6,7,7,NULL] |
|    5 | NULL           |    3 | [9]            |
|    6 | []             |    1 | [1,2,3]        |
|    6 | []             |    2 | [5,6,7,7,NULL] |
|    6 | []             |    3 | [9]            |
|    5 | NULL           |    1 | [1,2,3]        |
|    5 | NULL           |    2 | [5,6,7,7,NULL] |
|    5 | NULL           |    3 | [9]            |
|    6 | []             |    1 | [1,2,3]        |
|    6 | []             |    2 | [5,6,7,7,NULL] |
|    6 | []             |    3 | [9]            |
+------+----------------+------+----------------+
select * from tt3 t3 full join tt4 t4 on [t3.id]<>array_compact([1,2,45,67]) union all select * from tt3 t3 cross join tt4 t4 on [t3.id]!=array_compact(t4.a);
+------+----------------+------+----------------+
| id   | a              | id   | a              |
+------+----------------+------+----------------+
|    1 | [1,2,3,3]      |    1 | [1,2,3]        |
|    1 | [1,2,3,3]      |    2 | [5,6,7,7,NULL] |
|    1 | [1,2,3,3]      |    3 | [9]            |
|    2 | [5,6,7,7,NULL] |    1 | [1,2,3]        |
|    2 | [5,6,7,7,NULL] |    2 | [5,6,7,7,NULL] |
|    2 | [5,6,7,7,NULL] |    3 | [9]            |
|    3 | [5,6,7]        |    1 | [1,2,3]        |
|    3 | [5,6,7]        |    2 | [5,6,7,7,NULL] |
|    3 | [5,6,7]        |    3 | [9]            |
|    5 | NULL           |    1 | [1,2,3]        |
|    5 | NULL           |    2 | [5,6,7,7,NULL] |
|    5 | NULL           |    3 | [9]            |
|    6 | []             |    1 | [1,2,3]        |
|    6 | []             |    2 | [5,6,7,7,NULL] |
|    6 | []             |    3 | [9]            |
|    5 | NULL           |    1 | [1,2,3]        |
|    5 | NULL           |    2 | [5,6,7,7,NULL] |
|    5 | NULL           |    3 | [9]            |
|    6 | []             |    1 | [1,2,3]        |
|    6 | []             |    2 | [5,6,7,7,NULL] |
|    6 | []             |    3 | [9]            |
|    1 | [1,2,3,3]      |    1 | [1,2,3]        |
|    1 | [1,2,3,3]      |    2 | [5,6,7,7,NULL] |
|    1 | [1,2,3,3]      |    3 | [9]            |
|    2 | [5,6,7,7,NULL] |    1 | [1,2,3]        |
|    2 | [5,6,7,7,NULL] |    2 | [5,6,7,7,NULL] |
|    2 | [5,6,7,7,NULL] |    3 | [9]            |
|    3 | [5,6,7]        |    1 | [1,2,3]        |
|    3 | [5,6,7]        |    2 | [5,6,7,7,NULL] |
|    3 | [5,6,7]        |    3 | [9]            |
|    5 | NULL           |    1 | [1,2,3]        |
|    5 | NULL           |    2 | [5,6,7,7,NULL] |
|    5 | NULL           |    3 | [9]            |
|    6 | []             |    1 | [1,2,3]        |
|    6 | []             |    2 | [5,6,7,7,NULL] |
|    6 | []             |    3 | [9]            |
|    5 | NULL           |    1 | [1,2,3]        |
|    5 | NULL           |    2 | [5,6,7,7,NULL] |
|    5 | NULL           |    3 | [9]            |
|    6 | []             |    1 | [1,2,3]        |
|    6 | []             |    2 | [5,6,7,7,NULL] |
|    6 | []             |    3 | [9]            |
+------+----------------+------+----------------+
select t3.* from tt3 t3 cross join tt4 t4 on [t3.id]!=array_compact(t4.a) union all select t3.* from tt3 t3 join tt4 t4 on array_compact(t3.a)=array_compact(t4.a);
+------+----------------+
| id   | a              |
+------+----------------+
|    1 | [1,2,3,3]      |
|    1 | [1,2,3,3]      |
|    1 | [1,2,3,3]      |
|    2 | [5,6,7,7,NULL] |
|    2 | [5,6,7,7,NULL] |
|    2 | [5,6,7,7,NULL] |
|    3 | [5,6,7]        |
|    3 | [5,6,7]        |
|    3 | [5,6,7]        |
|    5 | NULL           |
|    5 | NULL           |
|    5 | NULL           |
|    6 | []             |
|    6 | []             |
|    6 | []             |
|    5 | NULL           |
|    5 | NULL           |
|    5 | NULL           |
|    6 | []             |
|    6 | []             |
|    6 | []             |
|    1 | [1,2,3,3]      |
|    2 | [5,6,7,7,NULL] |
+------+----------------+

select * from (select array_compact(c1) from tt1);
+---------------------------------+
| array_compact(c1)               |
+---------------------------------+
| [-2147483648,0,2147483647]      |
| [-2147483648,0,NULL,2147483647] |
| NULL                            |
| []                              |
| []                              |
+---------------------------------+
select * from ( select array_compact([1,2,3,4,4,3]));
+------------------------------+
| array_compact([1,2,3,4,4,3]) |
+------------------------------+
| [1,2,3,4,3]                  |
+------------------------------+

select * from tt1 where c1 !=any(select array_compact(c3));
ERROR 22000: Invalid data type for the operation
select * from tt1 where c1 !=some(select array_compact(c5));
ERROR 22000: Invalid data type for the operation
select * from tt1 where c1 =all(select array_compact([2,2,3]));
ERROR 22000: Invalid data type for the operation

select +array_compact(c1) from tt1;
+---------------------------------+
| +array_compact(c1)              |
+---------------------------------+
| [-2147483648,0,2147483647]      |
| [-2147483648,0,NULL,2147483647] |
| NULL                            |
| []                              |
| []                              |
+---------------------------------+
select +array_compact(c1)from vtt2;
+------------------------+
| +array_compact(c1)     |
+------------------------+
| [2147483648,0]         |
| [87666,0,2147483647,4] |
| NULL                   |
| []                     |
| []                     |
+------------------------+
select -array_compact(c1)from tt1;
ERROR 22000: Invalid data type for the operation
select array_compact(c1)+array_compact(c1)from tt1;
+-------------------------------------+
| array_compact(c1)+array_compact(c1) |
+-------------------------------------+
| [-4294967296,0,4294967294]          |
| [-4294967296,0,NULL,4294967294]     |
| NULL                                |
| []                                  |
| []                                  |
+-------------------------------------+
select array_compact(c1)+1 from tt1;
ERROR 22000: Invalid data type for the operation
select array_compact(c1)+'test' from tt1;
ERROR 22032: Invalid JSON text.
select array_compact(c1)+null from tt1;
+------------------------+
| array_compact(c1)+null |
+------------------------+
| NULL                   |
| NULL                   |
| NULL                   |
| NULL                   |
| NULL                   |
+------------------------+
select array_compact(c1)+false from tt1;
ERROR 22000: Invalid data type for the operation
select array_compact(c1)+true from tt1;
ERROR 22000: Invalid data type for the operation

select array_compact(c1)-array_compact(c1)from tt1;
+-------------------------------------+
| array_compact(c1)-array_compact(c1) |
+-------------------------------------+
| [0,0,0]                             |
| [0,0,NULL,0]                        |
| NULL                                |
| []                                  |
| []                                  |
+-------------------------------------+
select array_compact(c1)-1 from tt1;
ERROR 22000: Invalid data type for the operation
select array_compact(c1)-'test' from tt1;
ERROR 22032: Invalid JSON text.
select array_compact(c1)-null from tt1;
+------------------------+
| array_compact(c1)-null |
+------------------------+
| NULL                   |
| NULL                   |
| NULL                   |
| NULL                   |
| NULL                   |
+------------------------+
select array_compact(c1)-false from tt1;
ERROR 22000: Invalid data type for the operation
select array_compact(c1)-true from tt1;
ERROR 22000: Invalid data type for the operation
select array_compact(c1)*array_compact(c1)from tt1;
ERROR 42000: Null value
select array_compact(c1)*1 from tt1;
ERROR 22000: Invalid data type for the operation
select array_compact(c1)*'test' from tt1;
ERROR 22032: Invalid JSON text.
select array_compact(c1)*null from tt1;
+------------------------+
| array_compact(c1)*null |
+------------------------+
| NULL                   |
| NULL                   |
| NULL                   |
| NULL                   |
| NULL                   |
+------------------------+
select array_compact(c1)*false from tt1;
ERROR 22000: Invalid data type for the operation
select array_compact(c1)*true from tt1;
ERROR 22000: Invalid data type for the operation
select array_compact(c1)/array_compact(c1) from tt1;
ERROR 22000: Invalid data type for the operation
select array_compact(c1)/1 from tt1;
ERROR 22000: Invalid data type for the operation
select array_compact(c1)/'test' from tt1;
ERROR 22000: Invalid data type for the operation
select array_compact(c1)/null from tt1;
ERROR 22000: Invalid data type for the operation
select array_compact(c1)/false from tt1;
ERROR 22000: Invalid data type for the operation
select array_compact(c1)/true from tt1;
ERROR 22000: Invalid data type for the operation
select array_compact(c1) div array_compact(c1) from tt1;
ERROR 22000: Invalid data type for the operation
select array_compact(c1) div 1 from tt1;
ERROR 22000: Invalid data type for the operation
select array_compact(c1) div 'test' from tt1;
ERROR 22000: Invalid data type for the operation
select array_compact(c1) div null from tt1;
ERROR 22000: Invalid data type for the operation
select array_compact(c1) div false from tt1;
ERROR 22000: Invalid data type for the operation
select array_compact(c1) div true from tt1;
ERROR 22000: Invalid data type for the operation
select array_compact(c1) % array_compact(c1) from tt1;
ERROR 22000: Invalid data type for the operation
select array_compact(c1) % 1 from tt1;
ERROR 22000: Invalid data type for the operation
select array_compact(c1) % 'test' from tt1;
ERROR 22000: Invalid data type for the operation
select array_compact(c1) % null from tt1;
ERROR 22000: Invalid data type for the operation
select array_compact(c1) % false from tt1;
ERROR 22000: Invalid data type for the operation
select array_compact(c1) % true from tt1;
ERROR 22000: Invalid data type for the operation
select array_compact(c1) mod array_compact(c1) from tt1;
ERROR 22000: Invalid data type for the operation
select array_compact(c1) mod 1 from tt1;
ERROR 22000: Invalid data type for the operation
select array_compact(c1) mod 'test' from tt1;
ERROR 22000: Invalid data type for the operation
select array_compact(c1) mod null from tt1;
ERROR 22000: Invalid data type for the operation
select array_compact(c1) mod false from tt1;
ERROR 22000: Invalid data type for the operation
select array_compact(c1) mod true from tt1;
ERROR 22000: Invalid data type for the operation

select array_compact(c1) & array_compact(c1) from tt1;
ERROR 22000: Invalid data type for the operation
select array_compact(c1) | array_compact(c1) from tt1;
ERROR 22000: Invalid data type for the operation
select ~array_compact(c1)from tt1;
ERROR 22000: Invalid data type for the operation
select array_compact(c1) ^ array_compact(c1) from tt1;
ERROR 22000: Invalid data type for the operation
select array_compact(c1) << array_compact(c1) from tt1;
ERROR 22000: Invalid data type for the operation

select array_compact([c1]) is true from tt1;
ERROR 22000: Invalid data type for the operation
select array_compact(c1) in (array_compact(c1),cardinality([1,2,3,4,5,56,7,8,9,10])) from tt1;
ERROR 22000: Invalid data type for the operation
select array_compact(c1) not in (cardinality([1,2,3,4,5,56,7,8,9,10])) from tt1;
ERROR 22000: Invalid data type for the operation
select array_compact(c1) like [-2147483648,0,77777] from tt1;
ERROR 22000: Invalid data type for the operation

select  array_compact(c1) BETWEEN array_compact(c1) and array_compact(c1) from tt1;
ERROR 22000: Invalid data type for the operation
select  array_compact(c1) is null from tt1;
+---------------------------+
| array_compact(c1) is null |
+---------------------------+
|                         0 |
|                         0 |
|                         1 |
|                         0 |
|                         0 |
+---------------------------+
select  array_compact(c1) is not null from tt1;
+-------------------------------+
| array_compact(c1) is not null |
+-------------------------------+
|                             1 |
|                             1 |
|                             0 |
|                             1 |
|                             1 |
+-------------------------------+
select  array_compact(c1) is false from tt1;
ERROR 22000: Invalid data type for the operation

select not array_compact(c1) from tt1;
ERROR 22000: Invalid data type for the operation
select  array_compact(c1) and array_compact(c1)  from tt1;
ERROR 22000: Invalid data type for the operation
select  array_compact(c1) && array_compact(c1)  from tt1;
ERROR 22000: Invalid data type for the operation
select  array_compact(c1) or array_compact(c1)  from tt1;
ERROR 22000: Invalid data type for the operation
select  array_compact(c1) || array_compact(c1)  from tt1;
ERROR 22000: Invalid data type for the operation
select  array_compact(c1) || true from tt1;
ERROR 22000: Invalid data type for the operation
select  array_compact(c1) XOR array_compact(c1)  from tt1;
ERROR 22000: Invalid data type for the operation
select  array_compact(c1) XOR 1 from tt1;
ERROR 22000: Invalid data type for the operation
select  'test' XOR array_compact(c1) from tt1;
ERROR 22000: Invalid data type for the operation
SELECT BINARY array_compact(c1) = array_compact(c1) from tt1;
ERROR 22000: Invalid data type for the operation
select CONVERT(array_compact(c1) USING BINARY) from tt1;
ERROR 22000: Invalid data type for the operation

SELECT CASE array_compact(c1) WHEN array_compact(c1) THEN array_compact(c1) WHEN array_compact(c1) THEN array_compact(c1) END from tt1;
+------------------------------------------------------------------------------------------------------------------------+
| CASE array_compact(c1) WHEN array_compact(c1) THEN array_compact(c1) WHEN array_compact(c1) THEN array_compact(c1) END |
+------------------------------------------------------------------------------------------------------------------------+
| [-2147483648,0,2147483647]                                                                                             |
| [-2147483648,0,NULL,2147483647]                                                                                        |
| NULL                                                                                                                   |
| []                                                                                                                     |
| []                                                                                                                     |
+------------------------------------------------------------------------------------------------------------------------+
SELECT CASE  WHEN array_compact(c1) =array_compact(c1) THEN array_compact(c1) else  array_compact(c1) END from vtt1;
+----------------------------------------------------------------------------------------------------+
| CASE  WHEN array_compact(c1) =array_compact(c1) THEN array_compact(c1) else  array_compact(c1) END |
+----------------------------------------------------------------------------------------------------+
| [-2147483648,0,2147483647]                                                                         |
| [-2147483648,0,NULL,2147483647]                                                                    |
| NULL                                                                                               |
| []                                                                                                 |
| []                                                                                                 |
+----------------------------------------------------------------------------------------------------+

SELECT CASE  WHEN cardinality([1]) =array_compact(c1) THEN array_compact(c1) else  array_compact(c1)  END from vtt1;
ERROR 22000: Invalid data type for the operation

select array_compact( array_map((x,y)->(x+y), array_map(x2->(x2+1),[1,2,3]),array_map(x1->(x1+2),[1,2,3])));
+------------------------------------------------------------------------------------------------------+
| array_compact( array_map((x,y)->(x+y), array_map(x2->(x2+1),[1,2,3]),array_map(x1->(x1+2),[1,2,3]))) |
+------------------------------------------------------------------------------------------------------+
| [5,7,9]                                                                                              |
+------------------------------------------------------------------------------------------------------+

select array_compact([1,1]) = ANY([[1],[2],[3]]);
+-------------------------------------------+
| array_compact([1,1]) = ANY([[1],[2],[3]]) |
+-------------------------------------------+
|                                         1 |
+-------------------------------------------+
select array_compact(c1) = ANY(c1) from tt1;
ERROR 22000: array type mismatch found between definition and data
select sum(array_compact(c1)) from tt1;
ERROR 0A000: Not supported feature or function

select count(array_compact(c1)) from tt1;
+--------------------------+
| count(array_compact(c1)) |
+--------------------------+
|                        4 |
+--------------------------+
select max(array_compact(c1)) from tt1;
ERROR HY000: Invalid argument
select min(array_compact(c1)) from tt1;
ERROR HY000: Invalid argument
select avg(array_compact(c1)) from tt1;
ERROR 0A000: Not supported feature or function
select ASCII(array_compact(c1)) from tt1;
ERROR 22000: Invalid data type for the operation
select ABS(array_compact(c1)) from tt1;
ERROR 22000: Invalid data type for the operation
select INTERVAL(array_compact(c1)) from tt1;
ERROR 42000: You have an error in your SQL syntax; check the manual that corresponds to your OceanBase version for the right syntax to use near 'from tt1' at line 1
select NULLIF(array_compact(c1)) from tt1;
ERROR 42000: Incorrect parameter count in the call to native function 'NULLIF'
select array_compact(JSON_ARRAY(1,2,3));
ERROR 22000: invalid obj type for type promotion: left_type=ARRAY right_type=JSON
select array_length(array_compact([null,1,2,2,3,3,null,null]));
+---------------------------------------------------------+
| array_length(array_compact([null,1,2,2,3,3,null,null])) |
+---------------------------------------------------------+
|                                                       5 |
+---------------------------------------------------------+
select array_contains([1,2,3], array_compact([1,1,1,1]));
ERROR 22000: array type mismatch found between definition and data

select array_compact([array_remove([1,2,2,3],3)]);
+--------------------------------------------+
| array_compact([array_remove([1,2,2,3],3)]) |
+--------------------------------------------+
| [[1,2,2]]                                  |
+--------------------------------------------+
select array_compact(string_to_array('1,1,2,3', ''));
+-----------------------------------------------+
| array_compact(string_to_array('1,1,2,3', '')) |
+-----------------------------------------------+
| ["1,1,2,3"]                                   |
+-----------------------------------------------+
select array_compact(string_to_array('1,1,2,3','1,1,2,3', ''));
+---------------------------------------------------------+
| array_compact(string_to_array('1,1,2,3','1,1,2,3', '')) |
+---------------------------------------------------------+
| [NULL]                                                  |
+---------------------------------------------------------+
select array_compact(string_to_array('1,1,2,3','1,1,2,3', ''));
+---------------------------------------------------------+
| array_compact(string_to_array('1,1,2,3','1,1,2,3', '')) |
+---------------------------------------------------------+
| [NULL]                                                  |
+---------------------------------------------------------+
select array_agg(array_compact([[1],[1]]));
+-------------------------------------+
| array_agg(array_compact([[1],[1]])) |
+-------------------------------------+
| [[[1]]]                             |
+-------------------------------------+
select array_compact([[1,4]+[1,3],[1,4]+[1,3]]);
+------------------------------------------+
| array_compact([[1,4]+[1,3],[1,4]+[1,3]]) |
+------------------------------------------+
| [[2,7]]                                  |
+------------------------------------------+
select array_compact([[1,4]-[1,3],[1,4]-[1,3]]);
+------------------------------------------+
| array_compact([[1,4]-[1,3],[1,4]-[1,3]]) |
+------------------------------------------+
| [[0,1]]                                  |
+------------------------------------------+
select [[[[array_compact([[1,4]-[1,3],[1,4]-[1,3]])]]]];
+--------------------------------------------------+
| [[[[array_compact([[1,4]-[1,3],[1,4]-[1,3]])]]]] |
+--------------------------------------------------+
| [[[[[[0,1]]]]]]                                  |
+--------------------------------------------------+
select array_compact([1= any([1]),1,1]);
+----------------------------------+
| array_compact([1= any([1]),1,1]) |
+----------------------------------+
| [1]                              |
+----------------------------------+


drop table tt3;
create table tt3(id int,c array(int),c1 array(int),c2 array(tinyint));
drop view vtt3;
create view vtt3 as select * from tt3;
insert into tt3 values(1,[1,3],[null],[2,4]);
insert /*+ OPT_PARAM('rowsets_enabled', 'FALSE') */ /*+ OPT_PARAM('rowsets_enabled', 'FALSE') */ into tt3 values(2,[null],[2,4,3,4],[2,2,3,4,4,5]);

drop table tt3;
create table tt3(id int,c array(int),c1 array(int),c2 array(int));
insert into tt3 values((select array_length([1,3])),
(select array_compact(c3) from tt1 limit 1),(select array_compact(c2) from tt3 limit 1),(select array_compact(c7) from vtt1 limit 1));

insert into tt3 values((select array_length([1,3,3])),(select array_compact(c3) from tt1 limit 1),
(select array_compact([2,4]) from tt2 limit 1),(select array_compact(c7) from vtt1 limit 1));
select * from tt3;
+------+--------------+-------+------------------+
| id   | c            | c1    | c2               |
+------+--------------+-------+------------------+
|    2 | [127,0,-128] | NULL  | [-32768,0,32767] |
|    3 | [127,0,-128] | [2,4] | [-32768,0,32767] |
+------+--------------+-------+------------------+

replace into tt3 values(2,(select array_compact([1,3,3,4])),(select array_compact([2,4])),(select array_compact([null])));
select * from tt3;
+------+--------------+-------+------------------+
| id   | c            | c1    | c2               |
+------+--------------+-------+------------------+
|    2 | [127,0,-128] | NULL  | [-32768,0,32767] |
|    3 | [127,0,-128] | [2,4] | [-32768,0,32767] |
|    2 | [1,3,4]      | [2,4] | [NULL]           |
+------+--------------+-------+------------------+

insert into tt3 values((select array_length([3,4,3])),
(select array_compact(c3) from tt1 limit 1),(select array_compact(c3) from tt2 limit 1),(select array_compact([1,null]) from vtt1 limit 1)) ON DUPLICATE KEY UPDATE  id=array_length([1]);

insert into tt3 values((select array_length([3,4,3])),
(select array_compact([1,3,3,4,2,2,3])),(select array_compact([3,2,1,2,1,1,null])),(select array_compact([1,null]) )) ON DUPLICATE KEY UPDATE  id=array_length([1,2]);

update /*+ OPT_PARAM('rowsets_enabled', 'FALSE') */ /*+ OPT_PARAM('rowsets_enabled', 'FALSE') */ tt3 set c2= array_compact([1,2,3,4,5,5,6,7,8,9,9,90]) ;

select * from tt3;
+------+--------------+------------------+------------------------+
| id   | c            | c1               | c2                     |
+------+--------------+------------------+------------------------+
|    2 | [127,0,-128] | NULL             | [1,2,3,4,5,6,7,8,9,90] |
|    3 | [127,0,-128] | [2,4]            | [1,2,3,4,5,6,7,8,9,90] |
|    2 | [1,3,4]      | [2,4]            | [1,2,3,4,5,6,7,8,9,90] |
|    3 | [127,0,-128] | [52,0,5]         | [1,2,3,4,5,6,7,8,9,90] |
|    3 | [1,3,4,2,3]  | [3,2,1,2,1,NULL] | [1,2,3,4,5,6,7,8,9,90] |
+------+--------------+------------------+------------------------+
update tt3 set c2= array_compact([1,2,3,4,4,null,6,5,5,6,7,8,9,9,90]) limit 1;
update tt3 set c2= array_compact([1,2,3,4,5,6,7,8,null,null,9,9,90]);
update /*+ enable_parallel_dml parallel(2) append*/ tt3 set c2= (select array_compact([1,2,3,4,5,6,7,7,8,8,9,9,90]) limit 1);
update vtt3 set c2= (select array_compact([1,2,3,4,5,5,6,7,8,9,9,90,null]));
select * from tt3;
+------+--------------+------------------+-----------------------------+
| id   | c            | c1               | c2                          |
+------+--------------+------------------+-----------------------------+
|    2 | [127,0,-128] | NULL             | [1,2,3,4,5,6,7,8,9,90,NULL] |
|    3 | [127,0,-128] | [2,4]            | [1,2,3,4,5,6,7,8,9,90,NULL] |
|    2 | [1,3,4]      | [2,4]            | [1,2,3,4,5,6,7,8,9,90,NULL] |
|    3 | [127,0,-128] | [52,0,5]         | [1,2,3,4,5,6,7,8,9,90,NULL] |
|    3 | [1,3,4,2,3]  | [3,2,1,2,1,NULL] | [1,2,3,4,5,6,7,8,9,90,NULL] |
+------+--------------+------------------+-----------------------------+
delete  /*+ enable_parallel_dml parallel(2) append*/ from tt3;

update /*+read_consistency(weak) */ tt3 set c2 = array_compact(array_compact([1,2,2,3,3,3,3,4,59])) limit 1;
insert /*+read_consistency(weak) */ tt3 set c1 = (select array_compact(array_compact([1,2,3,4,59,100])) from dual);
select * from tt3;
+------+------+------------------+------+
| id   | c    | c1               | c2   |
+------+------+------------------+------+
| NULL | NULL | [1,2,3,4,59,100] | NULL |
+------+------+------------------+------+

drop table tt3;
create table tt3(c1 array(int));
drop view vtt3;
create view vtt3 as select * from tt3;
insert into tt3 select array_compact([1,2,2,2,3,4,5,4,5,6,5,9]);
replace into tt3 select array_compact([1,2,3,2,2,7,6,5,6,6,6,7]);
select * from tt3;
+-----------------------+
| c1                    |
+-----------------------+
| [1,2,3,4,5,4,5,6,5,9] |
| [1,2,3,2,7,6,5,6,7]   |
+-----------------------+

insert /*+ direct(true,100,'inc') enable_parallel_dml parallel(2)*/ into tt3 select array_compact(c1) from tt1;
insert /*+ direct(true,100) enable_parallel_dml parallel(2) append*/ into tt3 select array_compact(c1) from tt1;

replace /*+ direct(true,100,'inc') enable_parallel_dml parallel(2)*/ into tt3 select array_compact(c1) from tt1;
replace /*+ direct(true,100) enable_parallel_dml parallel(2) append*/ into tt3 select array_compact(c1) from tt1;

insert overwrite tt3 select array_compact([1,2,3,4,5,6,6,7,8,9,9,90,null]);

drop table tt3;
create table tt3 as select array_compact([1,2,3,-2,-1,-2,-2,4,3,5,6,6,7,9,8,9,9,90,90]) as a;
desc tt3;
+-------+---------------+------+-----+---------+-------+
| Field | Type          | Null | Key | Default | Extra |
+-------+---------------+------+-----+---------+-------+
| a     | ARRAY(BIGINT) | YES  |     | NULL    |       |
+-------+---------------+------+-----+---------+-------+
insert into tt3 values(array_compact([1,2,3,-2,-1,-2,-2,4,3,5,6,6,7,9,8,9,9,90,90]));
delete from tt3;

drop table tt3;
create table tt3 as select array_compact(c1) from tt1;
desc tt3;
+-------------------+------------+------+-----+---------+-------+
| Field             | Type       | Null | Key | Default | Extra |
+-------------------+------------+------+-----+---------+-------+
| array_compact(c1) | ARRAY(INT) | YES  |     | NULL    |       |
+-------------------+------------+------+-----+---------+-------+
insert into tt3 values((select array_compact(c1) from tt1 limit 1));
select * from tt3;
+---------------------------------+
| array_compact(c1)               |
+---------------------------------+
| [-2147483648,0,2147483647]      |
| [-2147483648,0,NULL,2147483647] |
| NULL                            |
| []                              |
| []                              |
| [-2147483648,0,2147483647]      |
+---------------------------------+
delete from tt3;

drop view vtt3;
create view vtt3 as select array_compact(c1) from tt1;
select * from vtt3;
+---------------------------------+
| array_compact(c1)               |
+---------------------------------+
| [-2147483648,0,2147483647]      |
| [-2147483648,0,NULL,2147483647] |
| NULL                            |
| []                              |
| []                              |
+---------------------------------+
desc vtt3;
+-------------------+------------+------+-----+---------+-------+
| Field             | Type       | Null | Key | Default | Extra |
+-------------------+------------+------+-----+---------+-------+
| array_compact(c1) | ARRAY(INT) | YES  |     | NULL    |       |
+-------------------+------------+------+-----+---------+-------+

drop table tt3;
create table tt3(id int, a array(int) as (array_compact([1,2,3,4,-1,-1,-2,-3,-3,4,4,5,5,6,7,7,8,8,9,9,90])) STORED);
alter table tt3 add a1 int[] after a;
alter table tt3 add a2 varchar(256)[][] first;
desc tt3;
+-------+----------------------------+------+-----+-----------------------------------------------------------------------+------------------+
| Field | Type                       | Null | Key | Default                                                               | Extra            |
+-------+----------------------------+------+-----+-----------------------------------------------------------------------+------------------+
| a2    | ARRAY(ARRAY(VARCHAR(256))) | YES  |     | NULL                                                                  |                  |
| id    | int(11)                    | YES  |     | NULL                                                                  |                  |
| a     | ARRAY(INT)                 | YES  |     | array_compact(array(1,2,3,4,-1,-1,-2,-3,-3,4,4,5,5,6,7,7,8,8,9,9,90)) | STORED GENERATED |
| a1    | ARRAY(INT)                 | YES  |     | NULL                                                                  |                  |
+-------+----------------------------+------+-----+-----------------------------------------------------------------------+------------------+
insert into tt3(id) values(1);
insert into tt3(a1,a2) values([2,2,2,2,2],[null,['null']]);
update tt3 set a1=array_compact([0,0,0,0,0]);
select * from tt3;
+-----------------+------+-----------------------------------+------+
| a2              | id   | a                                 | a1   |
+-----------------+------+-----------------------------------+------+
| NULL            |    1 | [1,2,3,4,-1,-2,-3,4,5,6,7,8,9,90] | [0]  |
| [NULL,["null"]] | NULL | [1,2,3,4,-1,-2,-3,4,5,6,7,8,9,90] | [0]  |
+-----------------+------+-----------------------------------+------+
delete /*+enable_parallel_dml parallel(2) */ from tt3 where id=1;
insert into tt3(id) values(1);
insert into tt3(id) values(2);
insert into tt3(a1,a2) values([1,1,1,1,1],[[''],null,null,[null]]);
update tt3 set a1=array_compact([0,0,0,0,0]);
update tt3 set a1=array_compact([0,0,0,0,1]) limit 2;
delete /*+OPT_PARAM('enable_rich_vector_format', 'FALSE')*/ from tt3 where id=2;
truncate tt3;
select * from tt3;
+------+------+------+------+
| a2   | id   | a    | a1   |
+------+------+------+------+
+------+------+------+------+

drop table tt3;
create table tt3(id int, a array(int) as (array_compact([1,2,3,4,-1,-1,-2,-3,-3,4,4,5,5,6,7,7,8,8,9,9,90])) VIRTUAL);
desc tt3;
+-------+------------+------+-----+-----------------------------------------------------------------------+-------------------+
| Field | Type       | Null | Key | Default                                                               | Extra             |
+-------+------------+------+-----+-----------------------------------------------------------------------+-------------------+
| id    | int(11)    | YES  |     | NULL                                                                  |                   |
| a     | ARRAY(INT) | YES  |     | array_compact(array(1,2,3,4,-1,-1,-2,-3,-3,4,4,5,5,6,7,7,8,8,9,9,90)) | VIRTUAL GENERATED |
+-------+------------+------+-----+-----------------------------------------------------------------------+-------------------+
ALTER TABLE tt3 ADD id INT AUTO_INCREMENT PRIMARY KEY first;
ERROR 0A000: Not supported feature or function

alter table tt3 modify id int AUTO_INCREMENT not null;
ALTER TABLE tt3 ADD PRIMARY KEY (id);
alter table tt3 add a1 int[] after a;
alter table tt3 add a2 varchar(256)[][] first;

insert into tt3(a1,a2) values([1,1,1,1,1],[[''],null,null,[null]]);
insert into tt3(a1) values([3,3,3,3,3]);
select * from tt3;
+-------------------------+----+-----------------------------------+-------------+
| a2                      | id | a                                 | a1          |
+-------------------------+----+-----------------------------------+-------------+
| [[""],NULL,NULL,[NULL]] |  1 | [1,2,3,4,-1,-2,-3,4,5,6,7,8,9,90] | [1,1,1,1,1] |
| NULL                    |  2 | [1,2,3,4,-1,-2,-3,4,5,6,7,8,9,90] | [3,3,3,3,3] |
+-------------------------+----+-----------------------------------+-------------+
replace into tt3(a1) values(array_compact([4,3,2,2,2,2,2]));
select * from tt3;
+-------------------------+----+-----------------------------------+-------------+
| a2                      | id | a                                 | a1          |
+-------------------------+----+-----------------------------------+-------------+
| [[""],NULL,NULL,[NULL]] |  1 | [1,2,3,4,-1,-2,-3,4,5,6,7,8,9,90] | [1,1,1,1,1] |
| NULL                    |  2 | [1,2,3,4,-1,-2,-3,4,5,6,7,8,9,90] | [3,3,3,3,3] |
| NULL                    |  3 | [1,2,3,4,-1,-2,-3,4,5,6,7,8,9,90] | [4,3,2]     |
+-------------------------+----+-----------------------------------+-------------+
delete from tt3 where id = 3;
insert into  tt3(id) values(1);
ERROR 23000: Duplicate entry '1' for key 'PRIMARY'

insert /*+ OPT_PARAM('enable_rich_vector_format', 'FALSE') */ into tt3(a1) values(reverse(array_compact([1,2,3,4,59])));
insert /*+read_consistency(weak) */ into tt3(a1,a2) values((select array_compact([1,1,2,2,2,2,3,4,59]) from dual),(select reverse([[1,2,3,4,59,100]]) from dual));
select * from tt3;
+--------------------------------+----+-----------------------------------+--------------+
| a2                             | id | a                                 | a1           |
+--------------------------------+----+-----------------------------------+--------------+
| [[""],NULL,NULL,[NULL]]        |  1 | [1,2,3,4,-1,-2,-3,4,5,6,7,8,9,90] | [1,1,1,1,1]  |
| NULL                           |  2 | [1,2,3,4,-1,-2,-3,4,5,6,7,8,9,90] | [3,3,3,3,3]  |
| NULL                           |  4 | [1,2,3,4,-1,-2,-3,4,5,6,7,8,9,90] | [59,4,3,2,1] |
| [["1","2","3","4","59","100"]] |  5 | [1,2,3,4,-1,-2,-3,4,5,6,7,8,9,90] | [1,2,3,4,59] |
+--------------------------------+----+-----------------------------------+--------------+
truncate tt3;

drop table tt3;
create table tt3(id int, a array(int) as (array_compact([1,2,3,4,-1,-1,-2,-3,-3,4,4,5,5,6,7,7,8,8,9,9,90])) );
desc tt3;
+-------+------------+------+-----+-----------------------------------------------------------------------+-------------------+
| Field | Type       | Null | Key | Default                                                               | Extra             |
+-------+------------+------+-----+-----------------------------------------------------------------------+-------------------+
| id    | int(11)    | YES  |     | NULL                                                                  |                   |
| a     | ARRAY(INT) | YES  |     | array_compact(array(1,2,3,4,-1,-1,-2,-3,-3,4,4,5,5,6,7,7,8,8,9,9,90)) | VIRTUAL GENERATED |
+-------+------------+------+-----+-----------------------------------------------------------------------+-------------------+

alter table tt3 add a1 int[][] after a;
alter table tt3 add a2 varchar(256)[] after a1;

insert into  tt3(id) values(1);
select * from tt3;
+------+-----------------------------------+------+------+
| id   | a                                 | a1   | a2   |
+------+-----------------------------------+------+------+
|    1 | [1,2,3,4,-1,-2,-3,4,5,6,7,8,9,90] | NULL | NULL |
+------+-----------------------------------+------+------+
delete from tt3;
insert into  tt3(id) values(1);
truncate tt3;
select * from tt3;
+------+------+------+------+
| id   | a    | a1   | a2   |
+------+------+------+------+
+------+------+------+------+

drop table tt3;
create table tt3(id int);
ALTER TABLE tt3
ADD COLUMN a array(int) AS (array_compact(([1,2,3,4,-1,-1,-2,-3,-3,4,4,5,5,6,7,7,8,8,9,9,90]))) STORED;
desc tt3;
+-------+------------+------+-----+-----------------------------------------------------------------------+------------------+
| Field | Type       | Null | Key | Default                                                               | Extra            |
+-------+------------+------+-----+-----------------------------------------------------------------------+------------------+
| id    | int(11)    | YES  |     | NULL                                                                  |                  |
| a     | ARRAY(INT) | YES  |     | array_compact(array(1,2,3,4,-1,-1,-2,-3,-3,4,4,5,5,6,7,7,8,8,9,9,90)) | STORED GENERATED |
+-------+------------+------+-----+-----------------------------------------------------------------------+------------------+
insert into  tt3(id) values(1);
select * from tt3;
+------+-----------------------------------+
| id   | a                                 |
+------+-----------------------------------+
|    1 | [1,2,3,4,-1,-2,-3,4,5,6,7,8,9,90] |
+------+-----------------------------------+
delete from tt3;
insert into  tt3(id) values(1);
truncate tt3;
select * from tt3;
+------+------+
| id   | a    |
+------+------+
+------+------+

drop table tt3;
create table tt3(id int);
ALTER TABLE tt3
ADD COLUMN a array(int) AS (array_compact(([1,2,3,4,-1,-1,-2,-3,-3,4,4,5,5,6,7,7,8,8,9,9,90]))) VIRTUAL;
desc tt3;
+-------+------------+------+-----+-----------------------------------------------------------------------+-------------------+
| Field | Type       | Null | Key | Default                                                               | Extra             |
+-------+------------+------+-----+-----------------------------------------------------------------------+-------------------+
| id    | int(11)    | YES  |     | NULL                                                                  |                   |
| a     | ARRAY(INT) | YES  |     | array_compact(array(1,2,3,4,-1,-1,-2,-3,-3,4,4,5,5,6,7,7,8,8,9,9,90)) | VIRTUAL GENERATED |
+-------+------------+------+-----+-----------------------------------------------------------------------+-------------------+
insert into  tt3(id) values(1);
select * from tt3;
+------+-----------------------------------+
| id   | a                                 |
+------+-----------------------------------+
|    1 | [1,2,3,4,-1,-2,-3,4,5,6,7,8,9,90] |
+------+-----------------------------------+
delete from tt3;
insert into  tt3(id) values(1);
truncate tt3;
select * from tt3;
+------+------+
| id   | a    |
+------+------+
+------+------+

drop table tt3;
create table tt3(id int,a varchar(50),ar array(int),INDEX index_1((array_compact(ar))));
ERROR HY000: Functional index on a column is not supported. Consider using a regular index instead.
CREATE TABLE tt3 (id INT,a VARCHAR(50),ar array(INT),INDEX index_1 (ar));
ERROR 0A000: vector column index but not vector index is not supported

CREATE TABLE tt3 (id INT,a VARCHAR(50),ar array(INT),INDEX index_1 (id));

drop table tt3;
create table tt3(id int,a varchar(50),r int[])PARTITION BY range COLUMNS(id)(
PARTITION p0 values less than(19),
PARTITION p1 values less than(25),
PARTITION p2 values less than(30)
) ;
CREATE INDEX index_1 ON tt3 ((array_compact(r)));
ERROR HY000: Functional index on a column is not supported. Consider using a regular index instead.
insert into tt3 values(1,'test',[-1,2,330,50]);
insert into tt3 values(2,'test1',[840-2934,945,4512]);
insert into tt3 values(3,'test',[90,4581,932114]);
insert into tt3 values(5,'test',[9,4581,932114]);
select * from tt3;
+------+-------+------------------+
| id   | a     | r                |
+------+-------+------------------+
|    1 | test  | [-1,2,330,50]    |
|    2 | test1 | [-2094,945,4512] |
|    3 | test  | [90,4581,932114] |
|    5 | test  | [9,4581,932114]  |
+------+-------+------------------+
drop table tt5;
create table tt5(id int primary key,v vector(2), a varchar(100),d double,a1 array(float),a2 array(int))
PARTITION BY range COLUMNS(id)(
PARTITION p0 values less than(19),
PARTITION p1 values less than(25),
PARTITION p2 values less than(30)
);
drop view vtt5;
ERROR 42S02: Unknown table 'testkj.vtt5'
create view vtt5 as select * from tt5;
insert into tt5 values(1,[1,2],'test','1.2E-2',[1,525.12E-2],[1,1,1,-1,1,3,2,2,3,4,5]);
insert into tt5 values(2,[1,2],'test1','1.5E-2',[1,523.12E-2],[1,2,2,2,2,3,4,5]);
insert into tt5 values(3,[1,2],'test2','1.5E-2',[1,523.12E-2],[1,2,3,4,5]);
insert into tt5 values(4,[3,4],'test3','142143144.5E-7',[1,523.12E-2],[1,6,3,4,5,5,4,5]);
insert into tt5 values(5,[6,7],'test4','142143144.5E-7',[1,523.12E-2],[1,2,3,3,4,5]);
insert into tt5 values(6,null,'test4','142143144.5E-7',[1,523.12E-2],[-5,2,2,2,2,3,3,4,5]);
insert into tt5 values(7,null,'test5','142143144.5E-7',[1,523.12E-2],[1,2,3,4,4,4,4,5,5,5,5]);
insert into tt5 values(8,[6,7],'test6','142143144.5E-7',[1,523.12E+2,1,6,9],[1,2,3,4,5]);
insert into tt5 values(9,[6,7],'test6','142143144.5E-7',null,[1,2,3,4,5]);
insert into tt5 values(20,[6,7],null,'142143144.5E-7',null,[1,2,3,4,6]);

drop table tt6;
create table tt6(id int primary key,v vector(2), a varchar(100),d double,a1 array(float),a2 int[])
PARTITION BY range COLUMNS(id)(
PARTITION p0 values less than(19),
PARTITION p1 values less than(25),
PARTITION p2 values less than(30)
);
drop view vtt6;
create view vtt6 as select * from tt6;
insert into tt6 values(1,[1,2],'test','1.2E-2',[1,525.12E-2],[1,2,3,4,5]);
insert into tt6 values(2,[1,2],'test1','1.5E-2',[1,523.12E-2],[1,2,3,4,5]);
insert into tt6 values(3,[1,2],'test2','1.5E-2',[1,523.12E-2],[1,2,3,4,5]);
insert into tt6 values(4,[3,4],'test3','142143144.5E-7',[1,523.12E-2],[1,6,3,4,5]);
insert into tt6 values(5,[6,7],'test4','142143144.5E-7',[1,523.12E-2],[1,2,3,4,5]);
insert into tt6 values(6,null,'test4','142143144.5E-7',[1,523.12E-2],[5,2,3,4,5]);
insert into tt6 values(7,null,'test5','142143144.5E-7',[1,523.12E-2],[1,2,3,4,5]);
insert into tt6 values(8,[6,7],'test6','142143144.5E-7',[1,523.12E+2,1,6,9],[1,2,3,4,5]);
insert into tt6 values(9,[6,7],'test6','142143144.5E-7',null,[1,2,3,4,5]);
insert into tt6 values(20,[6,7],null,'142143144.5E-7',null,[1,2,3,4,6]);

select array_compact(a2) from tt5 UNION ALL select array_compact(a2) from tt6;
+--------------------+
| array_compact(a2)  |
+--------------------+
| [1,-1,1,3,2,3,4,5] |
| [1,2,3,4,5]        |
| [1,2,3,4,5]        |
| [1,6,3,4,5,4,5]    |
| [1,2,3,4,5]        |
| [-5,2,3,4,5]       |
| [1,2,3,4,5]        |
| [1,2,3,4,5]        |
| [1,2,3,4,5]        |
| [1,2,3,4,6]        |
| [1,2,3,4,5]        |
| [1,2,3,4,5]        |
| [1,2,3,4,5]        |
| [1,6,3,4,5]        |
| [1,2,3,4,5]        |
| [5,2,3,4,5]        |
| [1,2,3,4,5]        |
| [1,2,3,4,5]        |
| [1,2,3,4,5]        |
| [1,2,3,4,6]        |
+--------------------+
select a1,a2 from tt5 UNION ALL select a1 ,a2 from tt6;
+-----------------+--------------------------+
| a1              | a2                       |
+-----------------+--------------------------+
| [1,5.2512]      | [1,1,1,-1,1,3,2,2,3,4,5] |
| [1,5.2312]      | [1,2,2,2,2,3,4,5]        |
| [1,5.2312]      | [1,2,3,4,5]              |
| [1,5.2312]      | [1,6,3,4,5,5,4,5]        |
| [1,5.2312]      | [1,2,3,3,4,5]            |
| [1,5.2312]      | [-5,2,2,2,2,3,3,4,5]     |
| [1,5.2312]      | [1,2,3,4,4,4,4,5,5,5,5]  |
| [1,52312,1,6,9] | [1,2,3,4,5]              |
| NULL            | [1,2,3,4,5]              |
| NULL            | [1,2,3,4,6]              |
| [1,5.2512]      | [1,2,3,4,5]              |
| [1,5.2312]      | [1,2,3,4,5]              |
| [1,5.2312]      | [1,2,3,4,5]              |
| [1,5.2312]      | [1,6,3,4,5]              |
| [1,5.2312]      | [1,2,3,4,5]              |
| [1,5.2312]      | [5,2,3,4,5]              |
| [1,5.2312]      | [1,2,3,4,5]              |
| [1,52312,1,6,9] | [1,2,3,4,5]              |
| NULL            | [1,2,3,4,5]              |
| NULL            | [1,2,3,4,6]              |
+-----------------+--------------------------+
select * from tt5 UNION select * from tt6;
+----+-------+-------+-------------+-----------------+--------------------------+
| id | v     | a     | d           | a1              | a2                       |
+----+-------+-------+-------------+-----------------+--------------------------+
|  1 | [1,2] | test  |       0.012 | [1,5.2512]      | [1,2,3,4,5]              |
|  1 | [1,2] | test  |       0.012 | [1,5.2512]      | [1,1,1,-1,1,3,2,2,3,4,5] |
|  2 | [1,2] | test1 |       0.015 | [1,5.2312]      | [1,2,3,4,5]              |
|  2 | [1,2] | test1 |       0.015 | [1,5.2312]      | [1,2,2,2,2,3,4,5]        |
|  3 | [1,2] | test2 |       0.015 | [1,5.2312]      | [1,2,3,4,5]              |
|  4 | [3,4] | test3 | 14.21431445 | [1,5.2312]      | [1,6,3,4,5]              |
|  4 | [3,4] | test3 | 14.21431445 | [1,5.2312]      | [1,6,3,4,5,5,4,5]        |
|  5 | [6,7] | test4 | 14.21431445 | [1,5.2312]      | [1,2,3,4,5]              |
|  5 | [6,7] | test4 | 14.21431445 | [1,5.2312]      | [1,2,3,3,4,5]            |
|  6 | NULL  | test4 | 14.21431445 | [1,5.2312]      | [5,2,3,4,5]              |
|  6 | NULL  | test4 | 14.21431445 | [1,5.2312]      | [-5,2,2,2,2,3,3,4,5]     |
|  7 | NULL  | test5 | 14.21431445 | [1,5.2312]      | [1,2,3,4,5]              |
|  7 | NULL  | test5 | 14.21431445 | [1,5.2312]      | [1,2,3,4,4,4,4,5,5,5,5]  |
|  8 | [6,7] | test6 | 14.21431445 | [1,52312,1,6,9] | [1,2,3,4,5]              |
|  9 | [6,7] | test6 | 14.21431445 | NULL            | [1,2,3,4,5]              |
| 20 | [6,7] | NULL  | 14.21431445 | NULL            | [1,2,3,4,6]              |
+----+-------+-------+-------------+-----------------+--------------------------+
(SELECT array_compact(a2) FROM tt5) UNION ALL (SELECT array_compact(a2) FROM tt6 ORDER BY array_length(a2) desc);
+--------------------+
| array_compact(a2)  |
+--------------------+
| [1,-1,1,3,2,3,4,5] |
| [1,2,3,4,5]        |
| [1,2,3,4,5]        |
| [1,6,3,4,5,4,5]    |
| [1,2,3,4,5]        |
| [-5,2,3,4,5]       |
| [1,2,3,4,5]        |
| [1,2,3,4,5]        |
| [1,2,3,4,5]        |
| [1,2,3,4,6]        |
| [1,2,3,4,5]        |
| [1,2,3,4,5]        |
| [1,2,3,4,5]        |
| [1,6,3,4,5]        |
| [1,2,3,4,5]        |
| [5,2,3,4,5]        |
| [1,2,3,4,5]        |
| [1,2,3,4,5]        |
| [1,2,3,4,5]        |
| [1,2,3,4,6]        |
+--------------------+
select array_compact(v) from tt5 union all select array_compact(v) from tt6;
+------------------+
| array_compact(v) |
+------------------+
| [1,2]            |
| [1,2]            |
| [1,2]            |
| [3,4]            |
| [6,7]            |
| NULL             |
| NULL             |
| [6,7]            |
| [6,7]            |
| [6,7]            |
| [1,2]            |
| [1,2]            |
| [1,2]            |
| [3,4]            |
| [6,7]            |
| NULL             |
| NULL             |
| [6,7]            |
| [6,7]            |
| [6,7]            |
+------------------+

drop table tt5;
create table tt5(id int primary key,v vector(2), a varchar(100),d double,a1 array(float),a2 array(int))
PARTITION BY range COLUMNS(id)(
PARTITION p0 values less than(19),
PARTITION p1 values less than(25),
PARTITION p2 values less than(30)
);
drop view vtt5;
create view vtt5 as select * from tt5;
insert into tt5 values(1,[1,2],'test','1.2E-2',[1,525.12E-2],[1,2,3,4,4,5]);
insert into tt5 values(2,[1,2],'test1','1.5E-2',[1,523.12E-2],[1,2,3,3,4,5]);
insert into tt5 values(3,[1,2],'test2','1.5E-2',[1,523.12E-2],[1,2,2,2,3,3,3,4,5]);
insert into tt5 values(4,[3,4],'test3','142143144.5E-7',[1,523.12E-2],[1,6,6,6,6,3,4,5]);
insert into tt5 values(5,[6,7],'test4','142143144.5E-7',[1,523.12E-2],[1,2,2,3,4,5]);
insert into tt5 values(6,null,'test4','142143144.5E-7',[1,523.12E-2],[5,2,2,3,4,5]);
insert into tt5 values(7,null,'test5','142143144.5E-7',[1,523.12E-2],[1,2,3,3,4,5]);
insert into tt5 values(8,[6,7],'test6','142143144.5E-7',[1,523.12E+2,1,6,9],[1,1,1,1,12,3,4,5]);
insert into tt5 values(9,[6,7],'test6','142143144.5E-7',null,[1,2,3,4,5,5,6,5,6,7,7,7]);
insert into tt5 values(20,[6,7],null,'142143144.5E-7',null,[1,2,3,4,6,7,7,7,8,4,9,8,9,9]);

create materialized view mv1 as select array_compact(a2) from tt5;
desc mv1;
+-------------------+------------+------+-----+---------+-------+
| Field             | Type       | Null | Key | Default | Extra |
+-------------------+------------+------+-----+---------+-------+
| array_compact(a2) | ARRAY(INT) | YES  |     | NULL    |       |
+-------------------+------------+------+-----+---------+-------+
create view tt9 as select array_compact(a2) from tt5;
desc tt9;
+-------------------+------------+------+-----+---------+-------+
| Field             | Type       | Null | Key | Default | Extra |
+-------------------+------------+------+-----+---------+-------+
| array_compact(a2) | ARRAY(INT) | YES  |     | NULL    |       |
+-------------------+------------+------+-----+---------+-------+
select * from tt9;
+-------------------------+
| array_compact(a2)       |
+-------------------------+
| [1,12,3,4,5]            |
| [1,2,3,4,5,6,5,6,7]     |
| [1,2,3,4,5]             |
| [1,2,3,4,5]             |
| [1,2,3,4,5]             |
| [1,2,3,4,5]             |
| [1,2,3,4,5]             |
| [1,2,3,4,6,7,8,4,9,8,9] |
| [1,6,3,4,5]             |
| [5,2,3,4,5]             |
+-------------------------+
drop view tt9;

insert into tt5 values(21,[6,7],null,'142143144.5E-7',null,[1,2,3,4,6]);
call DBMS_MVIEW.REFRESH('mv1','c');
DROP materialized view mv1;

create materialized view mv1  as select array_length(a2) from tt5;
call DBMS_MVIEW.REFRESH('mv1','c');
DROP materialized view mv1;

drop table if exists t32;
Warnings:
Note	1051	Unknown table 'testkj.t32'
create table t32 (id int primary key , age int, array1 array(int), array2 array(int));
insert into t32 values (1,12,[1,2,3], [34,565]);
insert into t32 values (2,23,null, null);
drop materialized view if exists mv1_t32;
Warnings:
Note	9757	materialized view `testkj`.`mv1_t32` does not exist
drop view if exists v1;
Warnings:
Note	1051	Unknown table 'testkj.v1'
create view v1 as select id, array_compact(array1),array_compact(array2) from t32;

create materialized view mv1_t32 refresh complete as select id, array_compact(array1),array_compact(array2) from t32;

drop table t1;
Got one of the listed errors
create table t1(id int, c1 array(int),c2 array(int));
insert into t1 values(1, [1,2,2,3,4,null],[2,3,3,1,4,null,null]);
insert into t1 values(2, [null,null,null,null],[null,null,null,null]);
insert into t1 values(3, null ,null);

select c1 from t1;
+-----------------------+
| c1                    |
+-----------------------+
| [1,2,2,3,4,NULL]      |
| [NULL,NULL,NULL,NULL] |
| NULL                  |
+-----------------------+
select c2 from t1;
+-----------------------+
| c2                    |
+-----------------------+
| [2,3,3,1,4,NULL,NULL] |
| [NULL,NULL,NULL,NULL] |
| NULL                  |
+-----------------------+
select c1, c2 from t1;
+-----------------------+-----------------------+
| c1                    | c2                    |
+-----------------------+-----------------------+
| [1,2,2,3,4,NULL]      | [2,3,3,1,4,NULL,NULL] |
| [NULL,NULL,NULL,NULL] | [NULL,NULL,NULL,NULL] |
| NULL                  | NULL                  |
+-----------------------+-----------------------+
select array_compact(c1) cc1,array_compact(c2) cc2 from t1;
+----------------+----------------+
| cc1            | cc2            |
+----------------+----------------+
| [1,2,3,4,NULL] | [2,3,1,4,NULL] |
| [NULL]         | [NULL]         |
| NULL           | NULL           |
+----------------+----------------+
drop table t1;

drop table tt1;
create table if not exists tt1(id int primary key,a1 array(int),a2 array(varchar(256)));
drop view vtt1;
create view vtt1 as select * from tt1;
insert into tt1 values(1,array_compact([2,3,3,3,4,4,null,null]),array_compact(["","","string_to_array()","null","null",null,null]));
insert into tt1 values(2, (select array_compact(a1) from tt1 where id = 1),(select array_compact(a2) from tt1 where id= 2));
replace into tt1 values(1, array_compact([1,1,1,1,1,2,2,4,4,4,4,null,null]),array_compact([null,null,"","array_agg(111)","string_to_array()",null]));
insert into tt1 values(3,array_compact([2,3,3,3,4,4,null,null]),array_compact(["","","string_to_array()","null","null",null,null]));
insert into tt1 values(3,array_compact([1,2,2,2,2,3,3,null,null,3]),array_compact([1,1,"string_to_array"])) ON DUPLICATE KEY UPDATE  a1=array_compact([1,3,3,3,4,4,null,null]);
insert into tt1 values(3,array_compact([1,2,2,2,2,3,3,null,null,3]),array_compact([1,1,"string_to_array"])) ON DUPLICATE KEY UPDATE  a2=array_compact([1,"","",",",",",3,4,4,null,null]);
select * from tt1;
+----+--------------+-----------------------------------------------------+
| id | a1           | a2                                                  |
+----+--------------+-----------------------------------------------------+
|  1 | [1,2,4,NULL] | [NULL,"","array_agg(111)","string_to_array()",NULL] |
|  2 | [2,3,4,NULL] | NULL                                                |
|  3 | [1,3,4,NULL] | ["1","",",","3","4",NULL]                           |
+----+--------------+-----------------------------------------------------+

truncate tt1;

insert into tt1 values(1,array_compact([2,3,3,3,4,4,null,null]),array_compact(["","","string_to_array()","null","null",null,null]));
insert into tt1 values(2, (select array_compact(a1) from tt1 where id = 1),(select array_compact(a2) from tt1 where id= 2));
replace into tt1 values(1, array_compact([1,1,1,1,1,2,2,4,4,4,4,null,null]),array_compact([null,null,"","array_agg(111)","string_to_array()",null]));
insert into tt1 values(3,array_compact([2,3,3,3,4,4,null,null]),array_compact(["","","string_to_array()","null","null",null,null]));
insert into tt1 values(3,array_compact([1,2,2,2,2,3,3,null,null,3]),array_compact([1,1,"string_to_array"])) ON DUPLICATE KEY UPDATE  a1=array_compact([1,3,3,3,4,4,null,null]);

insert into tt1 values(3,array_compact([1,2,2,2,2,3,3,null,null,3]),array_compact([1,1,"string_to_array"])) ON DUPLICATE KEY UPDATE  a2=array_compact([1,"","",",",3,4,4,null,null]);
insert overwrite tt1 values(3,array_compact([1,2,2,2,2,3,3,null,null,3]),array_compact([1,1,"string_to_array"])) ON DUPLICATE KEY UPDATE  a2=array_compact([1,"","",",",3,4,4,null,null]);
ERROR 42000: You have an error in your SQL syntax; check the manual that corresponds to your OceanBase version for the right syntax to use near 'ON DUPLICATE KEY UPDATE  a2=array_compact([1,"","",",",3,4,4,null,null])' at line 1
insert into tt1 values(3,array_compact([1,2,2,2,2,3,3,null,null,3]),array_compact([1,1,"string_to_array"])) on DUPLICATE KEY update a2 = array_compact(["","",1,1,1,"[]","[]"]);
insert into tt1 values(4,array_compact([1,2,2,2,2,3,3,null,null,3]),array_compact([1,1,"string_to_array"]));

select * from tt1;
+----+----------------+-----------------------------------------------------+
| id | a1             | a2                                                  |
+----+----------------+-----------------------------------------------------+
|  1 | [1,2,4,NULL]   | [NULL,"","array_agg(111)","string_to_array()",NULL] |
|  2 | [2,3,4,NULL]   | NULL                                                |
|  3 | [1,3,4,NULL]   | ["","1","[]"]                                       |
|  4 | [1,2,3,NULL,3] | ["1","string_to_array"]                             |
+----+----------------+-----------------------------------------------------+

replace /*+ OPT_PARAM('rowsets_enabled', 'FALSE') */ into tt1 values(1,array_compact([1,1,1,1,2,2,3,3,4,5,6,6,7,7,7,8,9,17,17,18,19,20,4]),array_compact(["","","",":","\x1","\\"]));
INSERT /*+ OPT_PARAM('enable_rich_vector_format', 'FALSE') */ into vtt1 values(11,array_compact([1,1,1,1,2,2,2,2,8,9,10,101,-3,3,-4,-4,20,4]),array_compact(["","",1,1,1,1,null,null]));
update tt1 set a1=array_compact([1,1,-3,null,null,-3,-3]);

update /*+ OPT_PARAM('enable_rich_vector_format', 'FALSE') */  /*+ OPT_PARAM('rowsets_enabled', 'FALSE') */ vtt1 set a2=array_compact(["","","null","[","[",1,1,5,8741]);
select * from tt1;
+----+----------------+--------------------------------+
| id | a1             | a2                             |
+----+----------------+--------------------------------+
|  1 | [1,-3,NULL,-3] | ["","null","[","1","5","8741"] |
|  2 | [1,-3,NULL,-3] | ["","null","[","1","5","8741"] |
|  3 | [1,-3,NULL,-3] | ["","null","[","1","5","8741"] |
|  4 | [1,-3,NULL,-3] | ["","null","[","1","5","8741"] |
| 11 | [1,-3,NULL,-3] | ["","null","[","1","5","8741"] |
+----+----------------+--------------------------------+
select * from vtt1;
+----+----------------+--------------------------------+
| id | a1             | a2                             |
+----+----------------+--------------------------------+
|  1 | [1,-3,NULL,-3] | ["","null","[","1","5","8741"] |
|  2 | [1,-3,NULL,-3] | ["","null","[","1","5","8741"] |
|  3 | [1,-3,NULL,-3] | ["","null","[","1","5","8741"] |
|  4 | [1,-3,NULL,-3] | ["","null","[","1","5","8741"] |
| 11 | [1,-3,NULL,-3] | ["","null","[","1","5","8741"] |
+----+----------------+--------------------------------+

drop table tt2;
create table if not exists tt2(id int primary key,a1 int[][],a2 varchar(256)[][]);
insert into tt2 values(1,array_compact([[4,56,56,null,null,null]]),array_compact([["","","string_to_array()","","null","null",null,null]]));
insert into tt2 values(2, [(select array_compact(a1) from tt1 where id = 1)],[(select array_compact(a2) from tt1 where id= 2)]);
insert into tt2 values(3, array_compact([[null,null,2,2,2,3,3,3]]),[(select array_compact(a2) from tt1 where id = 2)]);
insert into tt2 values(4, [array_compact([null,null])],null);
delete from tt2 where id = 3;
select * from tt2 where array_compact(tt2.a2) is not null;
+----+----------------------------+----------------------------------------------------------+
| id | a1                         | a2                                                       |
+----+----------------------------+----------------------------------------------------------+
|  1 | [[4,56,56,NULL,NULL,NULL]] | [["","","string_to_array()","","null","null",NULL,NULL]] |
|  2 | [[1,-3,NULL,-3]]           | [["","null","[","1","5","8741"]]                         |
+----+----------------------------+----------------------------------------------------------+
truncate tt2;
insert into tt2 values(3, array_compact([[null,null,2,2,2,3,3,3]]),[(select array_compact(a2) from tt1 where id = 2)]);
insert into tt2 values(4, [array_compact([null,null])],null);
delete from tt2 where id = 3;
select * from tt2;
+----+----------+------+
| id | a1       | a2   |
+----+----------+------+
|  4 | [[NULL]] | NULL |
+----+----------+------+
UPDATE tt2 SET a1 = array_compact(array_compact(a1)) WHERE id = 1;

select * , array_compact(tt1.a1) from tt1 group by array_length(tt1.a1) >0;
+----+----------------+--------------------------------+-----------------------+
| id | a1             | a2                             | array_compact(tt1.a1) |
+----+----------------+--------------------------------+-----------------------+
|  1 | [1,-3,NULL,-3] | ["","null","[","1","5","8741"] | [1,-3,NULL,-3]        |
+----+----------------+--------------------------------+-----------------------+
select array_compact(tt2.a1) from tt2 group by id ,array_length(tt2.a2)>0;
+-----------------------+
| array_compact(tt2.a1) |
+-----------------------+
| [[NULL]]              |
+-----------------------+

drop table tt3;
CREATE TABLE tt3 (id int primary key, d varchar(50), c2 int[],c3 float[],c4 varchar(256)[][],v vector(2)) partition by hash(id);
insert into tt3 values(1,1,[1,1,1,2,3,5],[2.123,2.123,3.123,4.123],[['中文ing123',1,'1']],[1,23]);
insert into tt3 values(2,2,[2,3,3,3,4,4,4,5],[2.123,2.123,3.123,4.123],[[null,'a','sss']],[1,23]);
insert into tt3 values(3,3,[3,3,3,3],[3.123,2.123,3.123,4.123],[['null','a','sss'],null],[1,23]);
insert into tt3 values(4,4,[2,2,2,2,2,3,4,5],[4.123,2.123,3.123,4.123],[[2,3,4,5],null],[1,23]);
insert into tt3 values(5,null,null,null,null,null);
insert into tt3 values(6,null,[null],[null],[[null]],[1,23]);
insert into tt3(id) values(7);
insert into tt3 values(8,8,'[]','[]',[[1,'test'],[2,3,NULL],NULL],'[1,2]');
insert into tt3 values(9,9,'[-12,7347]','[1,2,5,6]',[[1,'test'],[2,3,NULL],NULL],'[25,-50]');

select * from tt3 where id BETWEEN 1 and 9;
+----+------+-------------------+---------------------------+------------------------------------+----------+
| id | d    | c2                | c3                        | c4                                 | v        |
+----+------+-------------------+---------------------------+------------------------------------+----------+
|  1 | 1    | [1,1,1,2,3,5]     | [2.123,2.123,3.123,4.123] | [["中文ing123","1","1"]]           | [1,23]   |
|  2 | 2    | [2,3,3,3,4,4,4,5] | [2.123,2.123,3.123,4.123] | [[NULL,"a","sss"]]                 | [1,23]   |
|  3 | 3    | [3,3,3,3]         | [3.123,2.123,3.123,4.123] | [["null","a","sss"],NULL]          | [1,23]   |
|  4 | 4    | [2,2,2,2,2,3,4,5] | [4.123,2.123,3.123,4.123] | [["2","3","4","5"],NULL]           | [1,23]   |
|  5 | NULL | NULL              | NULL                      | NULL                               | NULL     |
|  6 | NULL | [NULL]            | [NULL]                    | [[NULL]]                           | [1,23]   |
|  7 | NULL | NULL              | NULL                      | NULL                               | NULL     |
|  8 | 8    | []                | []                        | [["1","test"],["2","3",NULL],NULL] | [1,2]    |
|  9 | 9    | [-12,7347]        | [1,2,5,6]                 | [["1","test"],["2","3",NULL],NULL] | [25,-50] |
+----+------+-------------------+---------------------------+------------------------------------+----------+
select array_compact(tt3.c2) from tt3 where id > 2;
+-----------------------+
| array_compact(tt3.c2) |
+-----------------------+
| [3]                   |
| [2,3,4,5]             |
| NULL                  |
| [NULL]                |
| NULL                  |
| []                    |
| [-12,7347]            |
+-----------------------+
SELECT id % 4 AS partition_key, COUNT(*),array_compact(c2) FROM tt3 GROUP BY partition_key order by partition_key;
+---------------+----------+-------------------+
| partition_key | COUNT(*) | array_compact(c2) |
+---------------+----------+-------------------+
|             0 |        2 | [2,3,4,5]         |
|             1 |        3 | [1,2,3,5]         |
|             2 |        2 | [2,3,4,5]         |
|             3 |        2 | [3]               |
+---------------+----------+-------------------+

update tt3 set c3 = array_compact(c3);
update /*+read_consistency(weak) OPT_PARAM('enable_rich_vector_format', 'FALSE') OPT_PARAM('rowsets_enabled', 'FALSE')  enable_parallel_dml parallel(2) */ tt3 set c2=array_compact(c2);

CREATE INDEX idx_a1_global ON tt1(a1) GLOBAL;
ERROR 0A000: create index on vector or array column is not supported

drop table tt1;
create table tt1(id int primary key, a3 int[][],a4 array(varchar(256)));

drop view vtt1;
create view vtt1 as select * from tt1;

insert into tt1 select 1,[array_compact([1,2,3,3,4,4,4,null,null])],array_compact(["null","s",null]);
select * from tt1;
+----+------------------+-------------------+
| id | a3               | a4                |
+----+------------------+-------------------+
|  1 | [[1,2,3,4,NULL]] | ["null","s",NULL] |
+----+------------------+-------------------+
replace into tt1 select 1,[[null],null,[1,1,1]],[null,null];
select * from tt1;
+----+-----------------------+-------------+
| id | a3                    | a4          |
+----+-----------------------+-------------+
|  1 | [[NULL],NULL,[1,1,1]] | [NULL,NULL] |
+----+-----------------------+-------------+
insert overwrite tt1 select 1,array_compact([null,null,[null]]),null;

truncate tt1;

insert into tt1 select 2,[array_compact([1,2,3,3,4,4,4,null,null])],array_compact(["null","s",null]);
select * from tt1;
+----+------------------+-------------------+
| id | a3               | a4                |
+----+------------------+-------------------+
|  2 | [[1,2,3,4,NULL]] | ["null","s",NULL] |
+----+------------------+-------------------+
replace into tt1 select 2,[[null],null],[null,null];
select * from tt1;
+----+---------------+-------------+
| id | a3            | a4          |
+----+---------------+-------------+
|  2 | [[NULL],NULL] | [NULL,NULL] |
+----+---------------+-------------+
insert overwrite tt1 select 3,array_compact([null,null,[null]]),null;

insert  /*+ direct(true,100,'inc') enable_parallel_dml parallel(2)*/  into tt1 select 4, array_compact([[1,2],[1,2],[null],null,null]),array_compact(["null","","","nnn"]);

replace  /*+ direct(true,100,'inc') enable_parallel_dml parallel(2)*/ into tt1 select 4, array_compact([[1,2],[1,2],[null],null,null]),array_compact(["null","","","nnn"]);
insert  /*+ direct(true,100) enable_parallel_dml parallel(2) append*/ into tt1 select 5, array_compact([[1,2],[1,2],[null],null,null]),array_compact(["null","","","nnn"]);
replace  /*+ direct(true,100) enable_parallel_dml parallel(2) append*/ into tt1 select 4, array_compact([[1,2],[1,2],[null],null,null]),array_compact(["null","","","nnn"]);
replace  /*+ direct(true,100) enable_parallel_dml parallel(2) append*/  into tt1 select 1, array_compact(a3),array_compact(["null","","","nnn"]) from tt1;

select * from tt1;
+----+---------------------+-------------------+
| id | a3                  | a4                |
+----+---------------------+-------------------+
|  1 | [[1,2],[NULL],NULL] | ["null","","nnn"] |
|  3 | [NULL,[NULL]]       | NULL              |
|  4 | [[1,2],[NULL],NULL] | ["null","","nnn"] |
|  5 | [[1,2],[NULL],NULL] | ["null","","nnn"] |
+----+---------------------+-------------------+
select id, array_compact(a3) from tt1;
+----+---------------------+
| id | array_compact(a3)   |
+----+---------------------+
|  1 | [[1,2],[NULL],NULL] |
|  3 | [NULL,[NULL]]       |
|  4 | [[1,2],[NULL],NULL] |
|  5 | [[1,2],[NULL],NULL] |
+----+---------------------+
desc tt1;
+-------+---------------------+------+-----+---------+-------+
| Field | Type                | Null | Key | Default | Extra |
+-------+---------------------+------+-----+---------+-------+
| id    | int(11)             | NO   | PRI | NULL    |       |
| a3    | ARRAY(ARRAY(INT))   | YES  |     | NULL    |       |
| a4    | ARRAY(VARCHAR(256)) | YES  |     | NULL    |       |
+-------+---------------------+------+-----+---------+-------+

drop view vtt4;
create view vtt4 as select array_compact([1,1,1,2,2,null,null]) a;
select * from vtt4;
+------------+
| a          |
+------------+
| [1,2,NULL] |
+------------+
desc vtt4;
+-------+---------------+------+-----+---------+-------+
| Field | Type          | Null | Key | Default | Extra |
+-------+---------------+------+-----+---------+-------+
| a     | ARRAY(BIGINT) | NO   |     |         |       |
+-------+---------------+------+-----+---------+-------+

drop table tt1;
create table tt1 (id int primary key, a1 int[][][], a2 varchar(256)[][][]);
insert into tt1 values(1,[[[1,3,2,2,2]]],[[[""]]]);
insert into tt1 values(2,[[[null],[null],[1],[1]]],[[[""],[""]]]);
insert into tt1 values(3,null,null);
select * , array_compact(tt1.a2) from tt1;
+----+---------------------------+---------------+-----------------------+
| id | a1                        | a2            | array_compact(tt1.a2) |
+----+---------------------------+---------------+-----------------------+
|  1 | [[[1,3,2,2,2]]]           | [[[""]]]      | [[[""]]]              |
|  2 | [[[NULL],[NULL],[1],[1]]] | [[[""],[""]]] | [[[""],[""]]]         |
|  3 | NULL                      | NULL          | NULL                  |
+----+---------------------------+---------------+-----------------------+
truncate tt1;

drop view vtt4;
create view vtt4 as select array_compact(tt1.a2) from tt1 where array_length(tt1.a2) > 0 limit 1;

drop table tt3;
CREATE TABLE tt3 (id int primary key, d varchar(50), c2 int[],c3 float[],c4 varchar(256)[][],v vector(2)) partition by hash(id);
insert into tt3 values(1,1,[1,2,3,5],[2.123,2.123,3.123,4.123],[['中文ing123',1,'1']],[1,23]);
insert into tt3 values(2,2,[2,3,4,5],[2.123,2.123,3.123,4.123],[[null,'a','sss']],[1,23]);
insert into tt3 values(3,3,[3,3,3,3],[3.123,2.123,3.123,4.123],[['null','a','sss'],null],[1,23]);
insert into tt3 values(4,4,[2,3,4,5],[4.123,2.123,3.123,4.123],[[2,3,4,5],null],[1,23]);
insert into tt3 values(5,null,null,null,null,null);
insert into tt3 values(6,null,[null],[null],[[null]],[1,23]);
insert into tt3(id) values(7);
insert into tt3 values(8,8,'[]','[]',[[1,'test'],[2,3,NULL]],'[1,2]');
insert into tt3 values(9,9,'[-12,7347]','[1,2,5,6]',[[1,'test'],[2,3,NULL],NULL],'[25,-50]');
select * from tt3;
+----+------+------------+---------------------------+------------------------------------+----------+
| id | d    | c2         | c3                        | c4                                 | v        |
+----+------+------------+---------------------------+------------------------------------+----------+
|  1 | 1    | [1,2,3,5]  | [2.123,2.123,3.123,4.123] | [["中文ing123","1","1"]]           | [1,23]   |
|  2 | 2    | [2,3,4,5]  | [2.123,2.123,3.123,4.123] | [[NULL,"a","sss"]]                 | [1,23]   |
|  3 | 3    | [3,3,3,3]  | [3.123,2.123,3.123,4.123] | [["null","a","sss"],NULL]          | [1,23]   |
|  4 | 4    | [2,3,4,5]  | [4.123,2.123,3.123,4.123] | [["2","3","4","5"],NULL]           | [1,23]   |
|  5 | NULL | NULL       | NULL                      | NULL                               | NULL     |
|  6 | NULL | [NULL]     | [NULL]                    | [[NULL]]                           | [1,23]   |
|  7 | NULL | NULL       | NULL                      | NULL                               | NULL     |
|  8 | 8    | []         | []                        | [["1","test"],["2","3",NULL]]      | [1,2]    |
|  9 | 9    | [-12,7347] | [1,2,5,6]                 | [["1","test"],["2","3",NULL],NULL] | [25,-50] |
+----+------+------------+---------------------------+------------------------------------+----------+
alter table tt3 drop COLUMN d;
alter table tt3 add COLUMN d varchar(50);
alter table tt3 change COLUMN d d varchar(256);
alter table tt3 change COLUMN d d varchar(256)[];

alter table tt3 ADD CONSTRAINT Length check (array_length(c2) > 0);
ERROR HY000: check constraint violated
alter table tt3 add COLUMN b int[][];
update tt3 set c3 = array_compact(c3)  order by id desc limit 2;
delete from tt3 where array_length(array_compact(c2)) > 0 limit 2;

select * from tt3 where array_length(array_compact(tt3.c3))>2 limit 2 for update;
+----+-----------+---------------------------+---------------------------+--------+------+------+
| id | c2        | c3                        | c4                        | v      | d    | b    |
+----+-----------+---------------------------+---------------------------+--------+------+------+
|  3 | [3,3,3,3] | [3.123,2.123,3.123,4.123] | [["null","a","sss"],NULL] | [1,23] | NULL | NULL |
|  4 | [2,3,4,5] | [4.123,2.123,3.123,4.123] | [["2","3","4","5"],NULL]  | [1,23] | NULL | NULL |
+----+-----------+---------------------------+---------------------------+--------+------+------+
UPDATE tt3 SET d = ["test"] WHERE  array_length(array_compact(tt3.v))>0 LIMIT 10;
select * from tt3;
+----+------------+---------------------------+------------------------------------+----------+----------+------+
| id | c2         | c3                        | c4                                 | v        | d        | b    |
+----+------------+---------------------------+------------------------------------+----------+----------+------+
|  3 | [3,3,3,3]  | [3.123,2.123,3.123,4.123] | [["null","a","sss"],NULL]          | [1,23]   | ["test"] | NULL |
|  4 | [2,3,4,5]  | [4.123,2.123,3.123,4.123] | [["2","3","4","5"],NULL]           | [1,23]   | ["test"] | NULL |
|  5 | NULL       | NULL                      | NULL                               | NULL     | NULL     | NULL |
|  6 | [NULL]     | [NULL]                    | [[NULL]]                           | [1,23]   | ["test"] | NULL |
|  7 | NULL       | NULL                      | NULL                               | NULL     | NULL     | NULL |
|  8 | []         | []                        | [["1","test"],["2","3",NULL]]      | [1,2]    | ["test"] | NULL |
|  9 | [-12,7347] | [1,2,5,6]                 | [["1","test"],["2","3",NULL],NULL] | [25,-50] | ["test"] | NULL |
+----+------------+---------------------------+------------------------------------+----------+----------+------+
DELETE FROM tt3 WHERE array_length(array_compact(tt3.c2))<2 LIMIT 2;

UPDATE tt3 SET c4 = array_compact([tt3.d]) limit 4;
SELECT array_filter(x->(x=x),array_compact(array_agg(array_compact([tt3.d])))) AS new_array FROM tt3;
+--------------------------------+
| new_array                      |
+--------------------------------+
| [[["test"]],[NULL],[["test"]]] |
+--------------------------------+

begin;
select * from tt3 where array_length(array_compact(tt3.c3))>2 limit 2 for update;
+----+------------+---------------------------+------------------------------------+----------+----------+------+
| id | c2         | c3                        | c4                                 | v        | d        | b    |
+----+------------+---------------------------+------------------------------------+----------+----------+------+
|  4 | [2,3,4,5]  | [4.123,2.123,3.123,4.123] | [["test"]]                         | [1,23]   | ["test"] | NULL |
|  9 | [-12,7347] | [1,2,5,6]                 | [["1","test"],["2","3",NULL],NULL] | [25,-50] | ["test"] | NULL |
+----+------------+---------------------------+------------------------------------+----------+----------+------+
update tt3 set c4 = array_compact([[""],["[]"],["[]"],array_remove([""],""),["[]["]]) where id >3;
update tt3 set c4 = array_compact([[""],["[]"],["[]"],array_remove([""],""),["[]["]]) where id >3;

commit;

select /*+ ENABLE_PARALLEL_DML parallel(256) */  array_map(x->(array_length((array_compact(x)))),tt3.c4)from tt3;
+---------------------------------------------------------+
| array_map(x->(array_length((array_compact(x)))),tt3.c4) |
+---------------------------------------------------------+
| [1,1,0,1]                                               |
| [1,1,0,1]                                               |
| [1,1,0,1]                                               |
| [1,1,0,1]                                               |
| [1,1,0,1]                                               |
+---------------------------------------------------------+

select /*+ ENABLE_PARALLEL_DML parallel(256) */  array_filter(x->(array_length(array_compact(x))>0),tt3.c4) from tt3;
+------------------------------------------------------------+
| array_filter(x->(array_length(array_compact(x))>0),tt3.c4) |
+------------------------------------------------------------+
| [[""],["[]"],["[]["]]                                      |
| [[""],["[]"],["[]["]]                                      |
| [[""],["[]"],["[]["]]                                      |
| [[""],["[]"],["[]["]]                                      |
| [[""],["[]"],["[]["]]                                      |
+------------------------------------------------------------+
desc tt3;
+-------+----------------------------+------+-----+---------+-------+
| Field | Type                       | Null | Key | Default | Extra |
+-------+----------------------------+------+-----+---------+-------+
| id    | int(11)                    | NO   | PRI | NULL    |       |
| c2    | ARRAY(INT)                 | YES  |     | NULL    |       |
| c3    | ARRAY(FLOAT)               | YES  |     | NULL    |       |
| c4    | ARRAY(ARRAY(VARCHAR(256))) | YES  |     | NULL    |       |
| v     | VECTOR(2)                  | YES  |     | NULL    |       |
| d     | ARRAY(VARCHAR(256))        | YES  |     | NULL    |       |
| b     | ARRAY(ARRAY(INT))          | YES  |     | NULL    |       |
+-------+----------------------------+------+-----+---------+-------+
alter table tt3 change COLUMN c2 c2 varchar(256)[];
UPDATE tt3 /*+ ENABLE_PARALLEL_DML parallel(256) */ SET c2 = (SELECT 
array_compact(tt3.c3));

select /*+read_consistency(weak) */  distinct array_compact(array_agg(array_compact(tt3.c3))) from tt3;
+-------------------------------------------------+
| array_compact(array_agg(array_compact(tt3.c3))) |
+-------------------------------------------------+
| [[4.123,2.123,3.123,4.123],NULL,[],[1,2,5,6]]   |
+-------------------------------------------------+
select * from tt3;
+----+-----------------------------------+---------------------------+--------------------------+----------+----------+------+
| id | c2                                | c3                        | c4                       | v        | d        | b    |
+----+-----------------------------------+---------------------------+--------------------------+----------+----------+------+
|  4 | ["4.123","2.123","3.123","4.123"] | [4.123,2.123,3.123,4.123] | [[""],["[]"],[],["[]["]] | [1,23]   | ["test"] | NULL |
|  5 | NULL                              | NULL                      | [[""],["[]"],[],["[]["]] | NULL     | NULL     | NULL |
|  7 | NULL                              | NULL                      | [[""],["[]"],[],["[]["]] | NULL     | NULL     | NULL |
|  8 | []                                | []                        | [[""],["[]"],[],["[]["]] | [1,2]    | ["test"] | NULL |
|  9 | ["1","2","5","6"]                 | [1,2,5,6]                 | [[""],["[]"],[],["[]["]] | [25,-50] | ["test"] | NULL |
+----+-----------------------------------+---------------------------+--------------------------+----------+----------+------+

drop table tt3;
create table tt3 (id int primary key,a int[], index index_1((array_compact([0,0,null,null,1]))));
ERROR HY000: Functional index on a column is not supported. Consider using a regular index instead.

drop table tt3;
create table tt3(id int,a varchar(50)[],c1 int[]);
show index from tt3;
Table	Non_unique	Key_name	Seq_in_index	Column_name	Collation	Cardinality	Sub_part	Packed	Null	Index_type	Comment	Index_comment	Visible	Expression
insert into tt3 values(1,['test'],[1]);
insert into tt3 values(2,['test1'],[null]);
insert into tt3 values(3,['test'],null);
insert into tt3 values(1,['test2'],[true,false]);
insert into tt3 values(1,['test3'],[0,null,true,false]);
insert into tt3 values(1,['test4'],[-2147483648.5 ,0, 2147483647.4999998]);
insert into tt3 values(null,null,null);
drop table tt3;
create table tt3(id int primary key,c1 varchar(50)[])
PARTITION BY range COLUMNS(id)(
PARTITION p0 values less than(10),
PARTITION p1 values less than(20),
PARTITION p2 values less than(30)
);
insert into tt3 values(1,['[][']);
insert into tt3 values(-2,['test']);
insert into tt3 values(10,[null]);
insert into tt3 values(21,[true,false]);
insert into tt3 values(13,[0,null,true,false]);
insert into tt3 values(-1,[-2147483648.5 ,0, 2147483647.4999998]);
select  /*+ index(tt3 index_1)*/ array_compact(c1) from tt3 order by id;
+--------------------------------------------+
| array_compact(c1)                          |
+--------------------------------------------+
| ["test"]                                   |
| ["-2147483648.5","0","2147483647.4999998"] |
| ["[]["]                                    |
| [NULL]                                     |
| ["0",NULL,"1","0"]                         |
| ["1","0"]                                  |
+--------------------------------------------+
EXPLAIN select  /*+ index(tt3 index_1)*/ array_compact(c1) from tt3;
Query Plan
=============================================================
|ID|OPERATOR                 |NAME    |EST.ROWS|EST.TIME(us)|
-------------------------------------------------------------
|0 |PX COORDINATOR           |        |6       |11          |
|1 |└─EXCHANGE OUT DISTR     |:EX10000|6       |10          |
|2 |  └─PX PARTITION ITERATOR|        |6       |7           |
|3 |    └─TABLE FULL SCAN    |tt3     |6       |7           |
=============================================================
Outputs & filters:
-------------------------------------
  0 - output([INTERNAL_FUNCTION(array_compact(tt3.c1))]), filter(nil), rowset=16
  1 - output([INTERNAL_FUNCTION(array_compact(tt3.c1))]), filter(nil), rowset=16
      dop=1
  2 - output([tt3.c1]), filter(nil), rowset=16
      force partition granule
  3 - output([tt3.c1]), filter(nil), rowset=16
      access([tt3.c1]), partitions(p[0-2])
      is_index_back=false, is_global_index=false, 
      range_key([tt3.id]), range(MIN ; MAX)always true
EXPLAIN select  /*+ index(tt3 index_1)*/ array_compact(c1) from tt3 where array_compact(c1)<>[1];
Query Plan
=============================================================
|ID|OPERATOR                 |NAME    |EST.ROWS|EST.TIME(us)|
-------------------------------------------------------------
|0 |PX COORDINATOR           |        |5       |69          |
|1 |└─EXCHANGE OUT DISTR     |:EX10000|5       |68          |
|2 |  └─PX PARTITION ITERATOR|        |5       |65          |
|3 |    └─TABLE FULL SCAN    |tt3     |5       |65          |
=============================================================
Outputs & filters:
-------------------------------------
  0 - output([INTERNAL_FUNCTION(array_compact(tt3.c1))]), filter(nil), rowset=16
  1 - output([INTERNAL_FUNCTION(array_compact(tt3.c1))]), filter(nil), rowset=16
      dop=1
  2 - output([array_compact(tt3.c1)]), filter(nil), rowset=16
      force partition granule
  3 - output([array_compact(tt3.c1)]), filter([array_compact(tt3.c1) != cast(array(1), ARRAY(18, -1))]), rowset=16
      access([tt3.c1]), partitions(p[0-2])
      is_index_back=false, is_global_index=false, filter_before_indexback[false], 
      range_key([tt3.id]), range(MIN ; MAX)always true

select /*+no_rewrite filter_pushdown_single_column.yaml */ array_compact(tt3.c1) from tt3 left join tt1 on tt3.id = tt1.id;
+--------------------------------------------+
| array_compact(tt3.c1)                      |
+--------------------------------------------+
| ["test"]                                   |
| ["-2147483648.5","0","2147483647.4999998"] |
| ["[]["]                                    |
| [NULL]                                     |
| ["0",NULL,"1","0"]                         |
| ["1","0"]                                  |
+--------------------------------------------+

select array_compact(tt3.c1) from tt3 left join tt1 on tt3.id = tt1.id;
+--------------------------------------------+
| array_compact(tt3.c1)                      |
+--------------------------------------------+
| ["test"]                                   |
| ["-2147483648.5","0","2147483647.4999998"] |
| ["[]["]                                    |
| [NULL]                                     |
| ["0",NULL,"1","0"]                         |
| ["1","0"]                                  |
+--------------------------------------------+

select /*+no_rewrite opt_param('PUSHDOWN_STORAGE_LEVEL', 0) opt_param('PUSHDOWN_STORAGE_LEVEL', 0) filter_pushdown_single_column.yaml */ array_compact(tt3.c1) from tt3 left join tt1 on tt3.id = tt1.id;
+--------------------------------------------+
| array_compact(tt3.c1)                      |
+--------------------------------------------+
| ["test"]                                   |
| ["-2147483648.5","0","2147483647.4999998"] |
| ["[]["]                                    |
| [NULL]                                     |
| ["0",NULL,"1","0"]                         |
| ["1","0"]                                  |
+--------------------------------------------+

drop table if exists tt3;
CREATE TABLE tt3 (id int primary key, d varchar(50), c2 int[][][],c3 array(float unsigned),c4 varchar(256)[][],v vector(2)) partition by hash(id);
insert into tt3 values(1,1,[[[1,2,3,5]]],[2.123,2.123,3.123,4.123],[['中文ing123',1,'1']],[1,23]);
insert into tt3 values(2,2,[[[2,3,4,5]]],[2.123,2.123,3.123,4.123],[[null,'a','sss']],[1,23]);
insert into tt3 values(3,3,[[[3,3,3,3]]],[3.123,2.123,3.123,4.123],[['null','a','sss'],null],[1,23]);
insert into tt3 values(4,4,[[[2,3,4,5]]],[4.123,2.123,3.123,4.123],[[2,3,4,5],null],[1,23]);
insert into tt3 values(5,null,null,null,null,null);
insert into tt3 values(6,null,[[[null,null]]],[null],[[null]],[1,23]);
insert into tt3(id) values(7);
insert into tt3 values(8,8,'[[[]]]','[]','[[]]','[1,2]');
insert into tt3 values(9,9,'[[[-12,7347]]]','[1,2,5,6]',[[1,'test'],[2,3,NULL],NULL],'[25,-50]');
insert into tt3 values(10,10,'[[[null,null]]]','[]','[null,[],[1],["test",null],[null],[]]','[1,3]');
insert into tt3 values(11,11,'[[[1,2,5,6,null]]]','[197734E-3,2.3,988]','[null,[],[1,"test"],[2,3,NULL],NULL,[]]','[25,-50]');
drop view if exists vtt3;
create view vtt3 as select * from tt3;

drop table if exists tt4;
CREATE TABLE tt4 (id int primary key, d varchar(50), c2 int[][][],c3 array(float unsigned),c4 varchar(256)[][],v vector(2)) partition by hash(id);
insert into tt4 values(1,1,[[[1,2,3,5]]],[2.123,2.123,3.123,4.123],[['中文ing123',1,'1']],[1,23]);
insert into tt4 values(2,2,[[[2,3,4,5]]],[2.123,2.123,3.123,4.123],[[null,'a','sss']],[1,23]);
insert into tt4 values(3,3,[[[3,3,3,3]]],[3.123,2.123,3.123,4.123],[['null','a','sss'],null],[1,23]);
insert into tt4 values(4,4,[[[2,3,4,5]]],[4.123,2.123,3.123,4.123],[[2,3,4,5],null],[1,23]);
insert into tt4 values(5,null,null,null,null,null);
insert into tt4 values(6,null,[[[null,null]]],[null],[[null]],[1,23]);
insert into tt4(id) values(7);

insert into tt4 values(9,9,'[[[-12,7347]]]','[1,2,5,6]',[[1,'test'],[2,3,NULL],NULL],'[25,-50]');
insert into tt4 values(10,10,'[[[null,null]]]','[]','[null,[],[1],["test",null],[null],[]]','[1,3]');
insert into tt4 values(11,11,'[[[1,2,5,6,null]]]','[197734E-3,2.3,988]','[null,[],[1,"test"],[2,3,NULL],NULL,[]]','[25,-50]');
drop view if exists vtt4;
create view vtt4 as select * from tt4;

DROP MATERIALIZED VIEW  mv1;
create materialized view mv1  as select array_compact(c2) c2,array_compact(c3) c3,array_compact(c4) c4, array_compact(v) v from tt3;
desc mv1;
+-------+----------------------------+------+-----+---------+-------+
| Field | Type                       | Null | Key | Default | Extra |
+-------+----------------------------+------+-----+---------+-------+
| c2    | ARRAY(ARRAY(ARRAY(INT)))   | YES  |     | NULL    |       |
| c3    | ARRAY(FLOAT UNSIGNED)      | YES  |     | NULL    |       |
| c4    | ARRAY(ARRAY(VARCHAR(256))) | YES  |     | NULL    |       |
| v     | VECTOR(2)                  | YES  |     | NULL    |       |
+-------+----------------------------+------+-----+---------+-------+
insert into tt3 values(12,1,[[[1,2,3,5]]],[2.123,2.123,3.123,4.123],[['中文ing123',1,'1']],[1,23]);
call DBMS_MVIEW.REFRESH('mv1','c');
call DBMS_MVIEW.REFRESH('mv1','C');
call DBMS_MVIEW.REFRESH('mv1','A');
call DBMS_MVIEW.REFRESH('mv1','a');
call DBMS_MVIEW.REFRESH('mv1','?');
create materialized view mv2  as select array_compact(c2) c2,array_compact(c3) c3,array_compact(c4) c4, array_compact(v) v from mv1;
call DBMS_MVIEW.REFRESH('mv2','c');
DROP MATERIALIZED VIEW LOG ON tt4;
CREATE MATERIALIZED VIEW LOG ON tt4 WITH PRIMARY KEY, ROWID,SEQUENCE(d,c2,c3,c4,v) INCLUDING NEW VALUES;
DROP MATERIALIZED VIEW  mv1;
create materialized view mv1  REFRESH FAST  as 
select t1.id as id1,t2.id as id2 ,array_compact(t1.c2) a0,array_compact(t1.c3) a1,array_compact(t1.c4) a2,array_compact(t2.v) v from tt4 t1 inner join tt4 t2 on t1.c3=t2.c3;

insert into tt4 values(13,13,[[[3,3,3,3]]],[3.123,2.123,3.123,4.123],[['null','a','sss'],null],[1,23]);
call DBMS_MVIEW.REFRESH('mv1','F');
call DBMS_MVIEW.REFRESH('mv1','f');
call DBMS_MVIEW.REFRESH('mv1','c');
call DBMS_MVIEW.REFRESH('mv1','A');
call DBMS_MVIEW.REFRESH('mv1','?');

########清空回收站，删除测试数据库，表等 ##########
drop database  IF EXISTS  testkj;
purge recyclebin;

