purge recyclebin;
drop database  IF EXISTS  testkj;
create DATABASE testkj;
USE testkj;
SET timestamp = 1600000000;
SET ob_trx_timeout = 10000000000;
SET ob_query_timeout = 100000000000;
SET SESSION group_concat_max_len = 100000000;
result_format: 4
select array_sortby(x ->(x is null),null);
+------------------------------------+
| array_sortby(x ->(x is null),null) |
+------------------------------------+
|                               NULL |
+------------------------------------+
select array_sortby(x -> (x),[1]);
+----------------------------+
| array_sortby(x -> (x),[1]) |
+----------------------------+
| [1]                        |
+----------------------------+
select array_sortby((x,y,z) -> (x is null and y is not null or z is not null), [[1]], [1],['abc']);
+---------------------------------------------------------------------------------------------+
| array_sortby((x,y,z) -> (x is null and y is not null or z is not null), [[1]], [1],['abc']) |
+---------------------------------------------------------------------------------------------+
| [[1]]                                                                                       |
+---------------------------------------------------------------------------------------------+
select array_sortby((x,y) -> (x + y),[1], [2]);
+-----------------------------------------+
| array_sortby((x,y) -> (x + y),[1], [2]) |
+-----------------------------------------+
| [1]                                     |
+-----------------------------------------+
select array_sortby((a,A) -> (a + A),[1], [2]);
+-----------------------------------------+
| array_sortby((a,A) -> (a + A),[1], [2]) |
+-----------------------------------------+
| [1]                                     |
+-----------------------------------------+
select array_sortby((x,y) -> (x),[1], [2]);
+-------------------------------------+
| array_sortby((x,y) -> (x),[1], [2]) |
+-------------------------------------+
| [1]                                 |
+-------------------------------------+
select array_sortby((x,y) -> (y),[1], [2]);
+-------------------------------------+
| array_sortby((x,y) -> (y),[1], [2]) |
+-------------------------------------+
| [1]                                 |
+-------------------------------------+
select array_sortby((x,y) -> (1),[1], [2]);
+-------------------------------------+
| array_sortby((x,y) -> (1),[1], [2]) |
+-------------------------------------+
| [1]                                 |
+-------------------------------------+
select array_sortby((x,y)->((x is null) and (y is null)), [1232], [[['abc']]]);
+-------------------------------------------------------------------------+
| array_sortby((x,y)->((x is null) and (y is null)), [1232], [[['abc']]]) |
+-------------------------------------------------------------------------+
| [1232]                                                                  |
+-------------------------------------------------------------------------+
select array_sortby((x,y)->(x+y), array_sortby(x2->(x2+1),[1,2,3]),array_sortby(x1->(x1+2),[1,2,3]));
+-----------------------------------------------------------------------------------------------+
| array_sortby((x,y)->(x+y), array_sortby(x2->(x2+1),[1,2,3]),array_sortby(x1->(x1+2),[1,2,3])) |
+-----------------------------------------------------------------------------------------------+
| [1,2,3]                                                                                       |
+-----------------------------------------------------------------------------------------------+
select array_sortby(x ->(x*2 + x*2), [1,3]);
+--------------------------------------+
| array_sortby(x ->(x*2 + x*2), [1,3]) |
+--------------------------------------+
| [1,3]                                |
+--------------------------------------+
select array_sortby((x,y) ->(x*2+y+x*2), [1,3],[4,5]);
+------------------------------------------------+
| array_sortby((x,y) ->(x*2+y+x*2), [1,3],[4,5]) |
+------------------------------------------------+
| [1,3]                                          |
+------------------------------------------------+
select array_sortby((x,y) -> (if(x>1.5,log(x),x+y)), [1,2,3], [11,12,13]);
+--------------------------------------------------------------------+
| array_sortby((x,y) -> (if(x>1.5,log(x),x+y)), [1,2,3], [11,12,13]) |
+--------------------------------------------------------------------+
| [2,3,1]                                                            |
+--------------------------------------------------------------------+
select array_sortby(x ->(upper(x)), ['efg','abc']);
+---------------------------------------------+
| array_sortby(x ->(upper(x)), ['efg','abc']) |
+---------------------------------------------+
| ["abc","efg"]                               |
+---------------------------------------------+
select array_sortby(x -> (round(x,1)), [1.22, 3.44, 5.33]);
+-----------------------------------------------------+
| array_sortby(x -> (round(x,1)), [1.22, 3.44, 5.33]) |
+-----------------------------------------------------+
| [1.22,3.44,5.33]                                    |
+-----------------------------------------------------+
select array_sortby(x ->(length(x)), ['abceeee', 'efgaa']);
+-----------------------------------------------------+
| array_sortby(x ->(length(x)), ['abceeee', 'efgaa']) |
+-----------------------------------------------------+
| ["efgaa","abceeee"]                                 |
+-----------------------------------------------------+
select array_sortby((x, y)->(floor((y - x) / x)), [4, 5, 6], [3,8,5]);
+----------------------------------------------------------------+
| array_sortby((x, y)->(floor((y - x) / x)), [4, 5, 6], [3,8,5]) |
+----------------------------------------------------------------+
| [4,6,5]                                                        |
+----------------------------------------------------------------+

SELECT array_sortby(x ->(x LIKE '%World%'), ['Hello', 'abc World','World','null']);
+-----------------------------------------------------------------------------+
| array_sortby(x ->(x LIKE '%World%'), ['Hello', 'abc World','World','null']) |
+-----------------------------------------------------------------------------+
| ["Hello","null","abc World","World"]                                        |
+-----------------------------------------------------------------------------+
select array_sortby(x1->(x1+1.66),[1,2,3]);
+-------------------------------------+
| array_sortby(x1->(x1+1.66),[1,2,3]) |
+-------------------------------------+
| [1,2,3]                             |
+-------------------------------------+
select array_sortby((x, y) -> (x + 1 + y + 1), [(9223372036854775798), (null)], [(9223372036854775798), (9223372036854775798)]);
ERROR 22003: BIGINT value is out of range in ''(9223372036854775799 + 9223372036854775798)''
select array_sortby(x1->(x1+9223372036854775800),[1,2,3,-2,-4,0]);
+------------------------------------------------------------+
| array_sortby(x1->(x1+9223372036854775800),[1,2,3,-2,-4,0]) |
+------------------------------------------------------------+
| [-4,-2,0,1,2,3]                                            |
+------------------------------------------------------------+
select array_sortby(x1->(x1*null),[2,1,null,3,1]);
+--------------------------------------------+
| array_sortby(x1->(x1*null),[2,1,null,3,1]) |
+--------------------------------------------+
| [2,1,NULL,3,1]                             |
+--------------------------------------------+

select array_sortby((x) ->(x + 1),[1,3,2,2,null]);
+--------------------------------------------+
| array_sortby((x) ->(x + 1),[1,3,2,2,null]) |
+--------------------------------------------+
| [1,2,2,3,NULL]                             |
+--------------------------------------------+
select array_sortby((x) ->(x%2),[3,2,1,4,3,5,6]);
+-------------------------------------------+
| array_sortby((x) ->(x%2),[3,2,1,4,3,5,6]) |
+-------------------------------------------+
| [2,4,6,3,1,3,5]                           |
+-------------------------------------------+
select array_sortby(x ->(x*2), [1,'c',NULL,'a',NULL]);
+------------------------------------------------+
| array_sortby(x ->(x*2), [1,'c',NULL,'a',NULL]) |
+------------------------------------------------+
| ["c","a","1",NULL,NULL]                        |
+------------------------------------------------+
Warnings:
Warning	1292	Truncated incorrect DOUBLE value: 'c'
Warning	1292	Truncated incorrect DOUBLE value: 'a'
SELECT array_sortby(x ->(x LIKE '%World%'), ['Hello', 'abc World','World','null',null]);
+----------------------------------------------------------------------------------+
| array_sortby(x ->(x LIKE '%World%'), ['Hello', 'abc World','World','null',null]) |
+----------------------------------------------------------------------------------+
| ["Hello","null","abc World","World",NULL]                                        |
+----------------------------------------------------------------------------------+
select array_sortby((x,y)->(x),[null,4],[3,2]);
+-----------------------------------------+
| array_sortby((x,y)->(x),[null,4],[3,2]) |
+-----------------------------------------+
| [4,NULL]                                |
+-----------------------------------------+
select array_sortby((x,y)->(x*2),[null,6,2,3],[2,4,2,4]);
+---------------------------------------------------+
| array_sortby((x,y)->(x*2),[null,6,2,3],[2,4,2,4]) |
+---------------------------------------------------+
| [2,3,6,NULL]                                      |
+---------------------------------------------------+
select array_sortby((x,y)->(length(y)),[null,'null',3,5,2],[null,'null',2,3,3]);
+--------------------------------------------------------------------------+
| array_sortby((x,y)->(length(y)),[null,'null',3,5,2],[null,'null',2,3,3]) |
+--------------------------------------------------------------------------+
| ["3","5","2","null",NULL]                                                |
+--------------------------------------------------------------------------+
select array_sortby(x->length(x),[null,'null,null','null']);
+------------------------------------------------------+
| array_sortby(x->length(x),[null,'null,null','null']) |
+------------------------------------------------------+
| ["null","null,null",NULL]                            |
+------------------------------------------------------+
select array_sortby((x,y) -> (x + y),[1,null], [null,2]);
+---------------------------------------------------+
| array_sortby((x,y) -> (x + y),[1,null], [null,2]) |
+---------------------------------------------------+
| [1,NULL]                                          |
+---------------------------------------------------+
select array_sortby((a,A) -> (a + A),[1,null], [null,2]);
+---------------------------------------------------+
| array_sortby((a,A) -> (a + A),[1,null], [null,2]) |
+---------------------------------------------------+
| [1,NULL]                                          |
+---------------------------------------------------+
select array_sortby((x,y)->(y),[null,4,3,2,1],[null,1,2,3,4]);
+--------------------------------------------------------+
| array_sortby((x,y)->(y),[null,4,3,2,1],[null,1,2,3,4]) |
+--------------------------------------------------------+
| [4,3,2,1,NULL]                                         |
+--------------------------------------------------------+
select array_sortby((x)->(x+x),[null,2,1,null]);
+------------------------------------------+
| array_sortby((x)->(x+x),[null,2,1,null]) |
+------------------------------------------+
| [1,2,NULL,NULL]                          |
+------------------------------------------+
select array_sortby((x,y)->(y+y),[null,'null',22,"a"],[4,1,3,null]);
+--------------------------------------------------------------+
| array_sortby((x,y)->(y+y),[null,'null',22,"a"],[4,1,3,null]) |
+--------------------------------------------------------------+
| ["null","22",NULL,"a"]                                       |
+--------------------------------------------------------------+
select array_sortby((x)->(array_compact(x)),[[null,"aaa华侨城",123,'','null'],[4,2,3,1,2,3],["111",11,1,NULL,'NULL']]);
ERROR 22000: Invalid data type for the operation
select array_sortby((x)->array_length(x),[[1,'test','test'],[2,2,3,3,null,NULL],null]);
+---------------------------------------------------------------------------------+
| array_sortby((x)->array_length(x),[[1,'test','test'],[2,2,3,3,null,NULL],null]) |
+---------------------------------------------------------------------------------+
| [["1","test","test"],["2","2","3","3",NULL,NULL],NULL]                          |
+---------------------------------------------------------------------------------+
select array_sortby((x)->null,[null,[null]]);
+---------------------------------------+
| array_sortby((x)->null,[null,[null]]) |
+---------------------------------------+
| [NULL,[NULL]]                         |
+---------------------------------------+

select array_sortby(x1->(x1+1000000000000000000000),[1,2,3]);
+-------------------------------------------------------+
| array_sortby(x1->(x1+1000000000000000000000),[1,2,3]) |
+-------------------------------------------------------+
| [1,2,3]                                               |
+-------------------------------------------------------+
select array_sortby((a)-> (0),['中文'])  from dual ;
+------------------------------------+
| array_sortby((a)-> (0),['中文'])   |
+------------------------------------+
| ["中文"]                           |
+------------------------------------+
select array_sortby((a)-> (-1.1111),['中文'])  from dual ;
+------------------------------------------+
| array_sortby((a)-> (-1.1111),['中文'])   |
+------------------------------------------+
| ["中文"]                                 |
+------------------------------------------+
select array_sortby((a)-> (1.123456),['中文'])  from dual ;
+-------------------------------------------+
| array_sortby((a)-> (1.123456),['中文'])   |
+-------------------------------------------+
| ["中文"]                                  |
+-------------------------------------------+
select array_sortby((a)-> ('zhongwen'),['zhongwen'])  from dual ;
+-----------------------------------------------+
| array_sortby((a)-> ('zhongwen'),['zhongwen']) |
+-----------------------------------------------+
| ["zhongwen"]                                  |
+-----------------------------------------------+
select array_sortby((中文ing) -> (中文 is not null),[2])  from dual ;
ERROR 42S22: Unknown column '中文' in 'field list'
select array_sortby((中文ing) -> (中文ing is not null),[2,'null',null])  from dual ;
+----------------------------------------------------------------------+
| array_sortby((中文ing) -> (中文ing is not null),[2,'null',null])     |
+----------------------------------------------------------------------+
| [NULL,"2","null"]                                                    |
+----------------------------------------------------------------------+
select array_sortby((中文ing) -> ('中文' is not null),[2,null,'null'])  from dual ;
+---------------------------------------------------------------------+
| array_sortby((中文ing) -> ('中文' is not null),[2,null,'null'])     |
+---------------------------------------------------------------------+
| ["2",NULL,"null"]                                                   |
+---------------------------------------------------------------------+

select array_sortby((x,x) -> (x), [1,null],[2,null]);
ERROR 42000: Duplicated parameters
select array_sortby((x) -> (array(x)), [1]);
ERROR 22000: Invalid data type for the operation
select array_sortby((x) -> (array(x)), [3,5,1,2,3]);
ERROR 22000: Invalid data type for the operation

select array_sortby((x,y) ->(y),[['a'],['b'],['c']],[1,3,2]);
+-------------------------------------------------------+
| array_sortby((x,y) ->(y),[['a'],['b'],['c']],[1,3,2]) |
+-------------------------------------------------------+
| [["a"],["c"],["b"]]                                   |
+-------------------------------------------------------+
select array_sortby(x2->(x2),[1]);
+----------------------------+
| array_sortby(x2->(x2),[1]) |
+----------------------------+
| [1]                        |
+----------------------------+
select array_sortby(x2->(x2),[['2'],['1']]);
ERROR 22000: Invalid data type for the operation
select array_sortby((x,y)->(x+y),[1,2,NULL], [NULL,3,4]);
+---------------------------------------------------+
| array_sortby((x,y)->(x+y),[1,2,NULL], [NULL,3,4]) |
+---------------------------------------------------+
| [2,1,NULL]                                        |
+---------------------------------------------------+
select array_sortby((x)->(array_sortby((x)->(x),[1])),[1]);
ERROR 22000: Invalid data type for the operation
select array_sortby((z)->(z+array_sortby((x)->(x),[1])),[2]);
ERROR 22000: Invalid data type for the operation

select array_sortby((x,y)->(x/y),[3,1,null],[1,2,null]);
+--------------------------------------------------+
| array_sortby((x,y)->(x/y),[3,1,null],[1,2,null]) |
+--------------------------------------------------+
| [1,3,NULL]                                       |
+--------------------------------------------------+
select array_sortby((x,y)->(x%y),[null],[null]);
+------------------------------------------+
| array_sortby((x,y)->(x%y),[null],[null]) |
+------------------------------------------+
| [NULL]                                   |
+------------------------------------------+

select array_sortby((x,y)->(x/y),[null,1,null],[null,5,null]);
+--------------------------------------------------------+
| array_sortby((x,y)->(x/y),[null,1,null],[null,5,null]) |
+--------------------------------------------------------+
| [1,NULL,NULL]                                          |
+--------------------------------------------------------+

select array_sortby((x,y)->(x*y),[null,1,2,3,4],[4,3,2,1,null]);
+----------------------------------------------------------+
| array_sortby((x,y)->(x*y),[null,1,2,3,4],[4,3,2,1,null]) |
+----------------------------------------------------------+
| [1,3,2,NULL,4]                                           |
+----------------------------------------------------------+
select array_sortby((x,y)->(x+y),[null,1,2,3,4],[4,3,2,1,null]);
+----------------------------------------------------------+
| array_sortby((x,y)->(x+y),[null,1,2,3,4],[4,3,2,1,null]) |
+----------------------------------------------------------+
| [1,2,3,NULL,4]                                           |
+----------------------------------------------------------+
select array_sortby((x,y)->(x-2*y),[null,1,2,3,4],[4,3,2,1,null]);
+------------------------------------------------------------+
| array_sortby((x,y)->(x-2*y),[null,1,2,3,4],[4,3,2,1,null]) |
+------------------------------------------------------------+
| [1,2,3,NULL,4]                                             |
+------------------------------------------------------------+
select array_sortby((x,y)->(x*2-y/x),[null,1,2,3,4],[4,3,2,1,null]);
+--------------------------------------------------------------+
| array_sortby((x,y)->(x*2-y/x),[null,1,2,3,4],[4,3,2,1,null]) |
+--------------------------------------------------------------+
| [1,2,3,NULL,4]                                               |
+--------------------------------------------------------------+

select array_sortby((x1,x2)->(array_length(x1)>2),[[null,3,2,1,1,2]],[[5,4,6,4,3,null]]);
+-----------------------------------------------------------------------------------+
| array_sortby((x1,x2)->(array_length(x1)>2),[[null,3,2,1,1,2]],[[5,4,6,4,3,null]]) |
+-----------------------------------------------------------------------------------+
| [[NULL,3,2,1,1,2]]                                                                |
+-----------------------------------------------------------------------------------+
select array_sortby((x1,x2)->(array_compact(x1)!=[1,2,3]),[[1,1,1,12,2,2,3,3,3,4,5,null]],[[1,2,3]]);
+-----------------------------------------------------------------------------------------------+
| array_sortby((x1,x2)->(array_compact(x1)!=[1,2,3]),[[1,1,1,12,2,2,3,3,3,4,5,null]],[[1,2,3]]) |
+-----------------------------------------------------------------------------------------------+
| [[1,1,1,12,2,2,3,3,3,4,5,NULL]]                                                               |
+-----------------------------------------------------------------------------------------------+
select array_sortby(x1->(array_sort(x1)!=[1,2,3]),[[1,2,3,null],[3,2,1],[3,1,2]]);
+----------------------------------------------------------------------------+
| array_sortby(x1->(array_sort(x1)!=[1,2,3]),[[1,2,3,null],[3,2,1],[3,1,2]]) |
+----------------------------------------------------------------------------+
| [[3,2,1],[3,1,2],[1,2,3,NULL]]                                             |
+----------------------------------------------------------------------------+
select array_sortby((x,y)->(x*y),array_compact([1,1,1,2,3,null]),array_compact([2,2,2,1,3,null]));
+--------------------------------------------------------------------------------------------+
| array_sortby((x,y)->(x*y),array_compact([1,1,1,2,3,null]),array_compact([2,2,2,1,3,null])) |
+--------------------------------------------------------------------------------------------+
| [1,2,3,NULL]                                                                               |
+--------------------------------------------------------------------------------------------+

drop table tt3;
create table tt3(id int,a int[]);
insert into tt3 values(1,[1,2,3,3]);
insert into tt3 values(2,[5,6,7,7,null]);
insert into tt3 values(3,[5,6,7]);
drop table tt4;
create table tt4(id int,a int[]);
insert into tt4 values(1,[1,2,3]);
insert into tt4 values(2,[5,6,7,7,null]);
insert into tt4 values(3,[9]);

select t3.* from tt3 t3 inner join tt4 t4 on array_sortby(x1->(x1*x1),t3.a)=array_sortby(x1->(x1*x1),t4.a);
+------+----------------+
| id   | a              |
+------+----------------+
|    2 | [5,6,7,7,NULL] |
+------+----------------+
select t3.* from tt3 t3 right join tt4 t4 on array_sortby(x1->(x1 or 1),t3.a)=array_sortby(x1 ->(x1 or 1),t4.a);
+------+----------------+
| id   | a              |
+------+----------------+
|    2 | [5,6,7,7,NULL] |
| NULL | NULL           |
| NULL | NULL           |
+------+----------------+
select t3.* from tt3 t3 full join tt4 t4 on array_sortby(x1->(x1*2),t3.a)=array_sortby(x1->(x1*2),t4.a);
+------+----------------+
| id   | a              |
+------+----------------+
|    1 | [1,2,3,3]      |
|    2 | [5,6,7,7,NULL] |
|    3 | [5,6,7]        |
| NULL | NULL           |
| NULL | NULL           |
+------+----------------+
select array_sortby(x->(x),tt3.a) from tt3;
+----------------------------+
| array_sortby(x->(x),tt3.a) |
+----------------------------+
| [1,2,3,3]                  |
| [5,6,7,7,NULL]             |
| [5,6,7]                    |
+----------------------------+

select * from tt3 union select * from tt4;
+------+----------------+
| id   | a              |
+------+----------------+
|    1 | [1,2,3,3]      |
|    2 | [5,6,7,7,NULL] |
|    3 | [5,6,7]        |
|    1 | [1,2,3]        |
|    3 | [9]            |
+------+----------------+
(select array_sortby((x,y)->(!x/y),t3.a,t3.a) from tt3 t3) union distinct(select array_sortby((x,y)->(!x/y),t4.a,t4.a) from tt4 t4);
+---------------------------------------+
| array_sortby((x,y)->(!x/y),t3.a,t3.a) |
+---------------------------------------+
| [1,2,3,3]                             |
| [5,6,7,7,NULL]                        |
| [5,6,7]                               |
| [1,2,3]                               |
| [9]                                   |
+---------------------------------------+

(SELECT array_sortby((x, y) -> (x+y), t3.a, t3.a) FROM tt3 t3 WHERE t3.a IS NOT NULL) UNION DISTINCT (SELECT array_sortby((x, y) -> (y+x), t4.a, t4.a)FROM tt4 t4 WHERE t4.a is not null);
+-------------------------------------------+
| array_sortby((x, y) -> (x+y), t3.a, t3.a) |
+-------------------------------------------+
| [1,2,3,3]                                 |
| [5,6,7,7,NULL]                            |
| [5,6,7]                                   |
| [1,2,3]                                   |
| [9]                                       |
+-------------------------------------------+

(SELECT array_sortby((x, y) -> (y - x), t3.a, t3.a)FROM tt3 t3) UNION (SELECT array_sortby((x, y) -> (y - x), t4.a, t4.a)FROM tt4 t4);
+---------------------------------------------+
| array_sortby((x, y) -> (y - x), t3.a, t3.a) |
+---------------------------------------------+
| [1,2,3,3]                                   |
| [5,6,7,7,NULL]                              |
| [5,6,7]                                     |
| [1,2,3]                                     |
| [9]                                         |
+---------------------------------------------+

SELECT * FROM (
    (SELECT array_sortby((x, y) -> (y - x), t3.a, t3.a) FROM tt3 t3)
    UNION
    (SELECT array_sortby((x, y) -> (y - x), t4.a, t4.a) FROM tt4 t4)
) AS combined_results;
+---------------------------------------------+
| array_sortby((x, y) -> (y - x), t3.a, t3.a) |
+---------------------------------------------+
| [1,2,3,3]                                   |
| [5,6,7,7,NULL]                              |
| [5,6,7]                                     |
| [1,2,3]                                     |
| [9]                                         |
+---------------------------------------------+

(SELECT t3.a FROM tt3 t3 ORDER BY t3.a IS NULL DESC, t3.a DESC) UNION (SELECT t4.a FROM tt4 t4 ORDER BY t4.a IS NULL DESC, t4.a DESC);
+----------------+
| a              |
+----------------+
| [1,2,3,3]      |
| [5,6,7,7,NULL] |
| [5,6,7]        |
| [1,2,3]        |
| [9]            |
+----------------+

drop table tt1;
create table tt1(id int,c1 array(int), c2 array(varchar(256)), c3 array(tinyint), c4 array(bigint), c5 array(float), c6 array(double), c7 array(smallint),c8 array(int));
insert into tt1 values(1,[-2147483648,-2147483647,0,77777],['test','test'],[127,0,-128],[-9223372036854775808,9223372036854775807,775,808,2,0],[3.402, 0, 1.175],
[1.7976931348623157E+308, 2.2250738585072014E-308,2.2250738585072014E-308],[-32768,0,32767,32767],[5,3,2,1,4]);

insert into tt1 values(2,[-2147483648,0, 2147483647,4,3,2,1,26,5,2147483647,null],['test',null],[-128,127,0,-128,6,77],[-9223372036854775808,9223372036854775807,775,808,2,0,1],[3.402, 0, 1.175, 1.175, 4],
[-1.7976931348623157E+30,1.2,2.2250738585072014E-308,2.2250738585072014E-308],[-32768,0,32767,0],[14444,2,32,6565,3333,222]);
insert into tt1 values(3,null,null,null,null,null,null,null,null);

drop view vtt1;
create view vtt1 as select * from tt1;

select * from (select array_sortby(x1->(!x1),c1) from tt1);
+---------------------------------------------------------+
| array_sortby(x1->(!x1),c1)                              |
+---------------------------------------------------------+
| [-2147483648,-2147483647,77777,0]                       |
| [-2147483648,2147483647,4,3,2,1,26,5,2147483647,0,NULL] |
| NULL                                                    |
+---------------------------------------------------------+
select * from ( select array_sortby(x1->(array_compact(x1)!=null),[[1,2,3,4],[1,2,3,4],null]));
+------------------------------------------------------------------------+
| array_sortby(x1->(array_compact(x1)!=null),[[1,2,3,4],[1,2,3,4],null]) |
+------------------------------------------------------------------------+
| [[1,2,3,4],[1,2,3,4],NULL]                                             |
+------------------------------------------------------------------------+
select * from tt1 where id != any(select array_length(array_sortby(x1->(!x1),[4,4,3])));
+------+---------------------------------------------------------+-----------------+------------------------+----------------------------------------------------------+-------------------------+------------------------------------------------------------------------------+------------------------+----------------------------+
| id   | c1                                                      | c2              | c3                     | c4                                                       | c5                      | c6                                                                           | c7                     | c8                         |
+------+---------------------------------------------------------+-----------------+------------------------+----------------------------------------------------------+-------------------------+------------------------------------------------------------------------------+------------------------+----------------------------+
|    1 | [-2147483648,-2147483647,0,77777]                       | ["test","test"] | [127,0,-128]           | [-9223372036854775808,9223372036854775807,775,808,2,0]   | [3.402,0,1.175]         | [1.7976931348623157e308,2.2250738585072014e-308,2.2250738585072014e-308]     | [-32768,0,32767,32767] | [5,3,2,1,4]                |
|    2 | [-2147483648,0,2147483647,4,3,2,1,26,5,2147483647,NULL] | ["test",NULL]   | [-128,127,0,-128,6,77] | [-9223372036854775808,9223372036854775807,775,808,2,0,1] | [3.402,0,1.175,1.175,4] | [-1.7976931348623158e30,1.2,2.2250738585072014e-308,2.2250738585072014e-308] | [-32768,0,32767,0]     | [14444,2,32,6565,3333,222] |
+------+---------------------------------------------------------+-----------------+------------------------+----------------------------------------------------------+-------------------------+------------------------------------------------------------------------------+------------------------+----------------------------+

drop table tt2;
create table tt2(id int,c1 array(int unsigned), c2 array(varchar(256)), c3 array(tinyint unsigned), c4 array(bigint unsigned), c5 array(float unsigned), c6 array(double unsigned), c7 array(smallint unsigned), c8 vector(3)) CHARACTER SET gbk
PARTITION BY range COLUMNS(id)(
PARTITION p0 values less than(1),
PARTITION p1 values less than(2),
PARTITION p2 values less than(MAXVALUE)
);
create index idx_tt2 on tt2(id);
create UNIQUE index idx_tt2_id on tt2(id);
CREATE INDEX tt2_func_idx1 on tt2((array_avg(c1)));
CREATE INDEX tt2_func_idx2 on tt2((array_max(c2)));
CREATE INDEX tt2_func_idx3 on tt2((array_min(c5)));
CREATE INDEX idx_tt2_cg on tt2(id) WITH COLUMN GROUP(each column);
insert into tt2 values(5,[-0.5 ,0, 2147483647.4999998],['test'],[127.499999999999992,0,-0.5],[-0.5,9223372036854775807,0],[9223372036854775807 , 0], [0, 1.7976931348623157E+308],[-0.5 ,0,32767.499999999998],[0.1,2.2,1.3]);
insert into tt2 values(4,[-0.5 ,0 , null, 2147483647.4999998],['array测试',true+false,null],[127.499999999999992,0,-0.5, null],[-0.5,9223372036854775807, null,0],[9223372036854775807, null, 0], [0, null, 1.7976931348623157E+308],[-0.5 ,0, null,32767.499999999998],[1,2,3]);
insert into tt2 values(3,null,null,null,null,null,null,null,null);
insert into tt2 values(2,'[]','[]','[]','[]','[]','[]','[]',[1,2,3]);
insert into tt2 values(1,array_remove([1],1),array_remove([1],1),array_remove([1],1),array_remove([1],1),array_remove([1],1),array_remove([1],1),array_remove([1],1),[1,2,3]);
drop view vtt2;
create view vtt2 as select * from tt2;
select array_sortby((x) -> (x=x), [1,null,b'111']);
ERROR 0A000: array element type not supported

select array_sortby((x)->(x = x), c1) from tt2;
+--------------------------------+
| array_sortby((x)->(x = x), c1) |
+--------------------------------+
| []                             |
| [0,0,2147483647]               |
| [0,0,2147483647,NULL]          |
| NULL                           |
| []                             |
+--------------------------------+

drop table if exists arr_test, t1;
CREATE TABLE `arr_test` (
  `id` int(11) NULL COMMENT "",
  `name` varchar(255) NULL COMMENT "",
  `subject` varchar(255) NULL COMMENT "",
  `score` float NULL COMMENT "",
   arr array(int)
);

insert into arr_test values (1,"Tom","English",90.5, [1,2]);
insert into arr_test values (1,"Tom","Math",80.8, [1,2]);
insert into arr_test values (2,"Tom","English",NULL,[1]);
insert into arr_test values (2,"Tom",NULL,NULL,null);
insert into arr_test values (3,"May",NULL,NULL,[2]);
insert into arr_test values (3,"Ti","English",98.3, [null]);
insert into arr_test values (4,NULL,NULL,NULL,null);
insert into arr_test values (NULL,NULL,NULL,NULL,null);
insert into arr_test values (NULL,"Ti","欢乐谷Valley",99,[3,4]);
insert into arr_test values (11,"我在上班","大南山sky",98.3,[0,2]);
insert into arr_test values (11,"世界之窗1301","aaa华侨城看看看看",78.5,[1]);
insert into arr_test values (12,"深圳湾华侨城","桔钓沙看海啊",NULL,[89]);
insert into arr_test values (2,"香蜜湖桔钓沙","红树林钓鱼",22,[23]);
insert into arr_test values (3,"大梅沙小梅沙","南头古城啊啊",NULL,[1]);

select array_sortby(x->(x+12), array_agg(score)) from arr_test;
+---------------------------------------------------------------------+
| array_sortby(x->(x+12), array_agg(score))                           |
+---------------------------------------------------------------------+
| [22,78.5,80.8,90.5,98.3,98.3,99,NULL,NULL,NULL,NULL,NULL,NULL,NULL] |
+---------------------------------------------------------------------+
select array_sortby(x->(x > 90), array_agg(score)) from arr_test;
+---------------------------------------------------------------------+
| array_sortby(x->(x > 90), array_agg(score))                         |
+---------------------------------------------------------------------+
| [80.8,78.5,22,90.5,98.3,99,98.3,NULL,NULL,NULL,NULL,NULL,NULL,NULL] |
+---------------------------------------------------------------------+
select array_sortby(x->(x + id), [1]) from arr_test;
+--------------------------------+
| array_sortby(x->(x + id), [1]) |
+--------------------------------+
| [1]                            |
| [1]                            |
| [1]                            |
| [1]                            |
| [1]                            |
| [1]                            |
| [1]                            |
| [1]                            |
| [1]                            |
| [1]                            |
| [1]                            |
| [1]                            |
| [1]                            |
| [1]                            |
+--------------------------------+
select array_sortby(x->(concat(x, '!!!')), array_agg(name)) from arr_test;
+------------------------------------------------------------------------------------------------------------------------------------------------------+
| array_sortby(x->(concat(x, '!!!')), array_agg(name))                                                                                                 |
+------------------------------------------------------------------------------------------------------------------------------------------------------+
| ["May","Ti","Ti","Tom","Tom","Tom","Tom","世界之窗1301","大梅沙小梅沙","我在上班","深圳湾华侨城","香蜜湖桔钓沙",NULL,NULL]                           |
+------------------------------------------------------------------------------------------------------------------------------------------------------+
select array_sortby(x->(length(x) > 3), array_agg(name)) from arr_test;
+------------------------------------------------------------------------------------------------------------------------------------------------------+
| array_sortby(x->(length(x) > 3), array_agg(name))                                                                                                    |
+------------------------------------------------------------------------------------------------------------------------------------------------------+
| ["Tom","Tom","Tom","Tom","May","Ti","Ti","我在上班","世界之窗1301","深圳湾华侨城","香蜜湖桔钓沙","大梅沙小梅沙",NULL,NULL]                           |
+------------------------------------------------------------------------------------------------------------------------------------------------------+
select array_sortby(x ->(upper(x)), array_agg(subject)) from arr_test;
+------------------------------------------------------------------------------------------------------------------------------------------------------------------------------------+
| array_sortby(x ->(upper(x)), array_agg(subject))                                                                                                                                   |
+------------------------------------------------------------------------------------------------------------------------------------------------------------------------------------+
| ["aaa华侨城看看看看","English","English","English","Math","南头古城啊啊","大南山sky","桔钓沙看海啊","欢乐谷Valley","红树林钓鱼",NULL,NULL,NULL,NULL]                               |
+------------------------------------------------------------------------------------------------------------------------------------------------------------------------------------+
select array_sortby((x,y)->(concat(concat(x, ' : '), y)), array_agg(name), array_agg(subject)) from arr_test;
+------------------------------------------------------------------------------------------------------------------------------------------------------+
| array_sortby((x,y)->(concat(concat(x, ' : '), y)), array_agg(name), array_agg(subject))                                                              |
+------------------------------------------------------------------------------------------------------------------------------------------------------+
| ["Ti","Ti","Tom","Tom","Tom","世界之窗1301","大梅沙小梅沙","我在上班","深圳湾华侨城","香蜜湖桔钓沙","Tom","May",NULL,NULL]                           |
+------------------------------------------------------------------------------------------------------------------------------------------------------+
create table t1 as select array_sortby(x->(concat(x, '!!!')), array_agg(name)) from arr_test;
drop table t1;

create table t1 as select array_sortby(x -> (round(x,1)), [1.22, 3.44, 5.33]);
select * from t1;
+-----------------------------------------------------+
| array_sortby(x -> (round(x,1)), [1.22, 3.44, 5.33]) |
+-----------------------------------------------------+
| [1.22,3.44,5.33]                                    |
+-----------------------------------------------------+
drop table t1;

create table t1 as select array_sortby((x,y)->(x+y), array_sortby(x2->(x2+1),[1,2,3]),array_sortby(x1->(x1+2),[1,2,3]));
select * from t1;
+-----------------------------------------------------------------------------------------------+
| array_sortby((x,y)->(x+y), array_sortby(x2->(x2+1),[1,2,3]),array_sortby(x1->(x1+2),[1,2,3])) |
+-----------------------------------------------------------------------------------------------+
| [1,2,3]                                                                                       |
+-----------------------------------------------------------------------------------------------+
drop table t1;

create table t1 as select array_sortby((x) -> (1), null);
select * from t1;
+--------------------------------+
| array_sortby((x) -> (1), null) |
+--------------------------------+
| NULL                           |
+--------------------------------+
drop table t1;

drop table arr_test;

CREATE TABLE `arr_test` (
  `id` int(11) NULL COMMENT "",
  `name` varchar(255) NULL COMMENT "",
  `subject` varchar(255) NULL COMMENT "",
  `score` float NULL COMMENT "",
   arr array(int)
) partition by hash(id) partitions 3;

insert into arr_test values (1,"Tom","English",90.5, [1,2]);
insert into arr_test values (1,"Tom","Math",80.8, [1,2]);
insert into arr_test values (2,"Tom","English",NULL,[1]);
insert into arr_test values (2,"Tom",NULL,NULL,null);
insert into arr_test values (3,"May",NULL,NULL,[2]);
insert into arr_test values (3,"Ti","English",98.3, [null]);

select array_sortby(x->(x+12), array_agg(score)) from arr_test;
+-------------------------------------------+
| array_sortby(x->(x+12), array_agg(score)) |
+-------------------------------------------+
| [80.8,90.5,98.3,NULL,NULL,NULL]           |
+-------------------------------------------+
select array_sortby(x->(x + id), [1]) from arr_test;
+--------------------------------+
| array_sortby(x->(x + id), [1]) |
+--------------------------------+
| [1]                            |
| [1]                            |
| [1]                            |
| [1]                            |
| [1]                            |
| [1]                            |
+--------------------------------+
select array_sortby(x->(concat(x, '!!!')), array_agg(name)) from arr_test;
+------------------------------------------------------+
| array_sortby(x->(concat(x, '!!!')), array_agg(name)) |
+------------------------------------------------------+
| ["May","Ti","Tom","Tom","Tom","Tom"]                 |
+------------------------------------------------------+
select array_sortby(x->(x > 90), array_agg(score)) from arr_test;
+---------------------------------------------+
| array_sortby(x->(x > 90), array_agg(score)) |
+---------------------------------------------+
| [80.8,98.3,90.5,NULL,NULL,NULL]             |
+---------------------------------------------+
drop table arr_test;

drop table if exists t1;
Warnings:
Note	1051	Unknown table 'testkj.t1'
create table t1 as select array_sortby(x -> (round(x,1)), [1.22, 3.44, 5.33]);
select * from t1;
+-----------------------------------------------------+
| array_sortby(x -> (round(x,1)), [1.22, 3.44, 5.33]) |
+-----------------------------------------------------+
| [1.22,3.44,5.33]                                    |
+-----------------------------------------------------+
drop table t1;
create table t1 as select array_sortby((x,y)->(x+y), array_sortby(x2->(x2+1),[1,2,3]),array_sortby(x1->(x1+2),[1,2,3]));
select * from t1;
+-----------------------------------------------------------------------------------------------+
| array_sortby((x,y)->(x+y), array_sortby(x2->(x2+1),[1,2,3]),array_sortby(x1->(x1+2),[1,2,3])) |
+-----------------------------------------------------------------------------------------------+
| [1,2,3]                                                                                       |
+-----------------------------------------------------------------------------------------------+
drop table t1;
create table t1 as select array_sortby((x) -> (1), null);
select * from t1;
+--------------------------------+
| array_sortby((x) -> (1), null) |
+--------------------------------+
| NULL                           |
+--------------------------------+
drop table t1;
create view v1 as  select array_sortby((x,y) -> (x+y), [1],[1]);
select * from v1;
+---------------------------------------+
| array_sortby((x,y) -> (x+y), [1],[1]) |
+---------------------------------------+
| [1]                                   |
+---------------------------------------+
drop view v1;

drop table if exists t1;
Warnings:
Note	1051	Unknown table 'testkj.t1'
CREATE TABLE t1 (c1 int PRIMARY KEY, c2 char(30),c3 vector(3));
ALTER TABLE t1 ADD COLUMN c5 varchar(256)[] AS (array_sortby((a) -> (a), [1,2,3])) STORED;
ERROR HY000: Expression of generated column contains a disallowed function
insert into t1 values(1,'[1,1,2]',[2,2,3]);
insert into t1 values(2,'[2,2,3]',[3,2,null]);
ERROR 42000: Null value
insert into t1 values(3,'[29,2,2]',[3,2,3]);
insert into t1 values(4,'[-1,-2,-2]',[null,null,null]);
ERROR 42000: Null value
insert into t1 values(5,null,null);
select array_sortby((x) -> (x/x), c3) from t1;
+--------------------------------+
| array_sortby((x) -> (x/x), c3) |
+--------------------------------+
| [2,2,3]                        |
| [3,2,3]                        |
| NULL                           |
+--------------------------------+
select array_sortby((x) -> (x), c3) from t1;
+------------------------------+
| array_sortby((x) -> (x), c3) |
+------------------------------+
| [2,2,3]                      |
| [2,3,3]                      |
| NULL                         |
+------------------------------+
select array(c3) from t1;
+-----------+
| array(c3) |
+-----------+
| [[2,2,3]] |
| [[3,2,3]] |
| [NULL]    |
+-----------+
drop table t1;

SELECT CASE 2 WHEN 1 THEN  [1] WHEN  2  THEN  ['test'] END;
+-----------------------------------------------------+
| CASE 2 WHEN 1 THEN  [1] WHEN  2  THEN  ['test'] END |
+-----------------------------------------------------+
| ["test"]                                            |
+-----------------------------------------------------+
SELECT CASE 1 WHEN 1 THEN  [1] WHEN  2  THEN  ['test'] END;
+-----------------------------------------------------+
| CASE 1 WHEN 1 THEN  [1] WHEN  2  THEN  ['test'] END |
+-----------------------------------------------------+
| ["1"]                                               |
+-----------------------------------------------------+

drop table tt3;
create table tt3(id int,c array(int),c1 array(int),c2 array(tinyint));
drop view vtt3;
create view vtt3 as select * from tt3;
insert into tt3 values(1,[1,3],[null],[2,4]);
insert /*+ OPT_PARAM('rowsets_enabled', 'FALSE') */ /*+ OPT_PARAM('rowsets_enabled', 'FALSE') */ into tt3 values(2,[null],[2,4,3,4],[2,2,3,4,4,5]);

drop table tt3;
create table tt3(id int,c array(int),c1 array(int),c2 array(int));
insert into tt3 values((select array_length([1,3])),
(select array_sortby((x)->(x+x),c3) from tt1 limit 1),(select array_sortby((x2)->(!x2),c2) from tt3 limit 1),(select array_sortby((x3)->(null+x3),c7) from vtt1 limit 1));

insert into tt3 values((select array_length([1,3,3])),(select array_sortby(x->(null/x),c3) from tt1 limit 1),
(select array_compact([2,4]) from tt3 limit 1),(select array_compact(c7) from vtt1 limit 1));
select * from tt3;
+------+--------------+-------+------------------------+
| id   | c            | c1    | c2                     |
+------+--------------+-------+------------------------+
|    2 | [-128,0,127] | NULL  | [-32768,0,32767,32767] |
|    3 | [127,0,-128] | [2,4] | [-32768,0,32767]       |
+------+--------------+-------+------------------------+

replace into tt3 values(2,(select array_compact([1,3,3,4])),(select array_sortby((x,y)->(x+3+y+2),[1,3],[2,4])),(select array_sortby(x->!x,[null])));
select * from tt3;
+------+--------------+-------+------------------------+
| id   | c            | c1    | c2                     |
+------+--------------+-------+------------------------+
|    2 | [-128,0,127] | NULL  | [-32768,0,32767,32767] |
|    3 | [127,0,-128] | [2,4] | [-32768,0,32767]       |
|    2 | [1,3,4]      | [1,3] | [NULL]                 |
+------+--------------+-------+------------------------+

insert into tt3 values((select array_length([3,4,3])),
(select array_compact(c3) from tt1 limit 1),(select array_sortby((x)->(x+x),c1) from tt1 limit 1),(select array_sortby(x->!x,[1,null]) from vtt1 limit 1)) ON DUPLICATE KEY UPDATE  id=array_length([1]);

insert into tt3 values((select array_length([3,4,3])),
(select array_sortby((x)->(x*x),[1,3,3,4,2,2,3])),(select array_compact([3,2,1,2,1,1,null])),(select array_sortby((x)->(!x),[null,1,null]) )) ON DUPLICATE KEY UPDATE  id=array_length([1,2]);

update /*+ OPT_PARAM('rowsets_enabled', 'FALSE') */ /*+ OPT_PARAM('rowsets_enabled', 'FALSE') */ tt3 set c2= array_sortby((x)->(x%(x-2)!=0),[1,2,3,4,5,null,null]) ;

select * from tt3;
+------+-----------------+-----------------------------------+-----------------------+
| id   | c               | c1                                | c2                    |
+------+-----------------+-----------------------------------+-----------------------+
|    2 | [-128,0,127]    | NULL                              | [1,3,4,5,2,NULL,NULL] |
|    3 | [127,0,-128]    | [2,4]                             | [1,3,4,5,2,NULL,NULL] |
|    2 | [1,3,4]         | [1,3]                             | [1,3,4,5,2,NULL,NULL] |
|    3 | [127,0,-128]    | [-2147483648,-2147483647,0,77777] | [1,3,4,5,2,NULL,NULL] |
|    3 | [1,2,2,3,3,3,4] | [3,2,1,2,1,NULL]                  | [1,3,4,5,2,NULL,NULL] |
+------+-----------------+-----------------------------------+-----------------------+
update tt3 set c2= array_sortby((x)->(!x%2),[1,2,3,4,4,null,6,5,5,6,7,8,9,9,90]) limit 1;
update vtt3 set c2= array_sortby((x)->(!x),[1,2,3,4,5,6,7,8,null,null,9,9,90]);
update /*+ enable_parallel_dml parallel(2) append*/ tt3 set c2= (select array_sortby((x1)->(x1+x1%2),[1,2,3,4,5,6,7,7,8,8,9,9,90]) limit 1);
update vtt3 set c2= (select array_sortby((x)->(x*x*x),[1,2,3,4,5,5,6,7,8,9,9,90,null]));
select * from tt3;
+------+-----------------+-----------------------------------+---------------------------------+
| id   | c               | c1                                | c2                              |
+------+-----------------+-----------------------------------+---------------------------------+
|    2 | [-128,0,127]    | NULL                              | [1,2,3,4,5,5,6,7,8,9,9,90,NULL] |
|    3 | [127,0,-128]    | [2,4]                             | [1,2,3,4,5,5,6,7,8,9,9,90,NULL] |
|    2 | [1,3,4]         | [1,3]                             | [1,2,3,4,5,5,6,7,8,9,9,90,NULL] |
|    3 | [127,0,-128]    | [-2147483648,-2147483647,0,77777] | [1,2,3,4,5,5,6,7,8,9,9,90,NULL] |
|    3 | [1,2,2,3,3,3,4] | [3,2,1,2,1,NULL]                  | [1,2,3,4,5,5,6,7,8,9,9,90,NULL] |
+------+-----------------+-----------------------------------+---------------------------------+
delete  /*+ enable_parallel_dml parallel(2) append*/ from tt3;

drop table tt3;
create table tt3(c1 array(int));
drop view vtt3;
create view vtt3 as select * from tt3;
insert into tt3 select array_sortby(x->(x+2),[1,2,2,2,3,4,5,4,5,6,5,9,null]);
replace into tt3 select array_sortby(x->(x+2),[1,2,3,2,2,7,6,5,6,6,6,null,7]);
select * from tt3;
+--------------------------------+
| c1                             |
+--------------------------------+
| [1,2,2,2,3,4,4,5,5,5,6,9,NULL] |
| [1,2,2,2,3,5,6,6,6,6,7,7,NULL] |
+--------------------------------+

insert /*+ direct(true,100,'inc') enable_parallel_dml parallel(2)*/ into tt3 select array_sortby(x->x,c1) from tt1;
insert /*+ direct(true,100) enable_parallel_dml parallel(2) append*/ into tt3 select array_sortby(x->x%2,c1) from tt1;

replace /*+ direct(true,100,'inc') enable_parallel_dml parallel(2)*/ into tt3 select array_sortby(x->x*x,c1) from tt1;
replace /*+ direct(true,100) enable_parallel_dml parallel(2) append*/ into tt3 select array_sortby(x->x%3,c3) from tt1;

insert overwrite tt3 select array_sortby(x->(x&x),[1,2,3,4,5,6,6,7,8,9,9,90,null]);
select * from tt3;
+---------------------------------+
| c1                              |
+---------------------------------+
| [1,2,3,4,5,6,6,7,8,9,9,90,NULL] |
+---------------------------------+

drop table tt3;
create table tt3(id int,a varchar(50),ar array(int),INDEX index_1((array_sortby(x->(x&x),ar))));
ERROR HY000: Expression of functional index contains a disallowed function.
CREATE TABLE tt3 (id INT,a VARCHAR(50),ar array(INT),INDEX index_1 (ar));
ERROR 0A000: vector column index but not vector index is not supported

CREATE TABLE tt3 (id INT,a VARCHAR(50),ar array(INT),INDEX index_1 (id));

drop table tt3;
create table tt3(id int,a varchar(50),r int[])PARTITION BY range COLUMNS(id)(
PARTITION p0 values less than(19),
PARTITION p1 values less than(25),
PARTITION p2 values less than(30)
) ;
CREATE INDEX index_1 ON tt3 ((array_sortby(x->(x&x),r)));
ERROR HY000: Expression of functional index contains a disallowed function.
insert into tt3 values(1,'test',[-1,2,330,50]);
insert into tt3 values(2,'test1',[840-2934,945,4512]);
insert into tt3 values(3,'test',[90,4581,932114]);
insert into tt3 values(5,'test',[9,4581,932114]);
select * from tt3;
+------+-------+------------------+
| id   | a     | r                |
+------+-------+------------------+
|    1 | test  | [-1,2,330,50]    |
|    2 | test1 | [-2094,945,4512] |
|    3 | test  | [90,4581,932114] |
|    5 | test  | [9,4581,932114]  |
+------+-------+------------------+
drop table tt5;
create table tt5(id int primary key,v vector(2), a varchar(100),d double,a1 array(float),a2 array(int))
PARTITION BY range COLUMNS(id)(
PARTITION p0 values less than(19),
PARTITION p1 values less than(25),
PARTITION p2 values less than(30)
);
drop view vtt5;
create view vtt5 as select * from tt5;
insert into tt5 values(1,[1,2],'test','1.2E-2',[1,525.12E-2],[1,1,1,-1,1,3,2,null,2,3,4,5]);
insert into tt5 values(2,[1,2],'test1','1.5E-2',[1,523.12E-2],[1,null,null,2,2,3,4,5]);
insert into tt5 values(3,[1,2],'test2','1.5E-2',[1,523.12E-2],[1,2,3,4,-2,null,4,5]);
insert into tt5 values(4,[3,4],'test3','142143144.5E-7',[1,523.12E-2],[1,6,3,4,null,null,5,5,4,5]);
insert into tt5 values(5,[6,7],'test4','142143144.5E-7',[1,523.12E-2],[1,2,null,3,4,5]);
insert into tt5 values(6,null,'test4','142143144.5E-7',[1,523.12E-2],[-5,2,2,2-7,-9,3,3,4,5]);
insert into tt5 values(7,null,'test5','142143144.5E-7',[1,523.12E-2],[1,2,3,4,5,5,null,null,5,5]);
insert into tt5 values(8,[6,7],'test6','142143144.5E-7',[1,523.12E+2,1,6,9],[1,2,3,4,5]);
insert into tt5 values(9,[6,7],'test6','142143144.5E-7',null,[1,2,null,null,5]);
insert into tt5 values(20,[6,7],null,'142143144.5E-7',null,[1,2,3,null,3,2,1]);

drop table tt6;
create table tt6(id int primary key,v vector(2), a varchar(100),d double,a1 array(float),a2 int[])
PARTITION BY range COLUMNS(id)(
PARTITION p0 values less than(19),
PARTITION p1 values less than(25),
PARTITION p2 values less than(30)
);
drop view vtt6;
create view vtt6 as select * from tt6;
insert into tt6 values(1,[1,2],'test','1.2E-2',[1,525.12E-2],[1,2,3,4,5]);
insert into tt6 values(2,[1,2],'test1','1.5E-2',[1,523.12E-2],[1,2,3,4,5]);
insert into tt6 values(3,[1,2],'test2','1.5E-2',[1,523.12E-2],[1,2,3,4,5]);
insert into tt6 values(4,[3,4],'test3','142143144.5E-7',[1,523.12E-2],[1,6,3,4,5]);
insert into tt6 values(5,[6,7],'test4','142143144.5E-7',[1,523.12E-2],[1,2,3,4,5]);
insert into tt6 values(6,null,'test4','142143144.5E-7',[1,523.12E-2],[5,2,3,4,5]);
insert into tt6 values(7,null,'test5','142143144.5E-7',[1,523.12E-2],[1,2,3,4,5]);
insert into tt6 values(8,[6,7],'test6','142143144.5E-7',[1,523.12E+2,1,6,9],[1,2,3,4,5]);
insert into tt6 values(9,[6,7],'test6','142143144.5E-7',null,[1,2,3,4,5]);
insert into tt6 values(20,[6,7],null,'142143144.5E-7',null,[1,2,3,4,6]);

select array_sortby(x->x%x,a2) from tt5 UNION ALL select array_sortby(x->x+2,a2) from tt6;
+-------------------------------+
| array_sortby(x->x%x,a2)       |
+-------------------------------+
| [1,1,1,-1,1,3,2,2,3,4,5,NULL] |
| [1,2,2,3,4,5,NULL,NULL]       |
| [1,2,3,4,-2,4,5,NULL]         |
| [1,6,3,4,5,5,4,5,NULL,NULL]   |
| [1,2,3,4,5,NULL]              |
| [-5,2,2,-5,-9,3,3,4,5]        |
| [1,2,3,4,5,5,5,5,NULL,NULL]   |
| [1,2,3,4,5]                   |
| [1,2,5,NULL,NULL]             |
| [1,2,3,3,2,1,NULL]            |
| [1,2,3,4,5]                   |
| [1,2,3,4,5]                   |
| [1,2,3,4,5]                   |
| [1,3,4,5,6]                   |
| [1,2,3,4,5]                   |
| [2,3,4,5,5]                   |
| [1,2,3,4,5]                   |
| [1,2,3,4,5]                   |
| [1,2,3,4,5]                   |
| [1,2,3,4,6]                   |
+-------------------------------+
select a1,a2 from tt5 UNION ALL select a1 ,a2 from tt6;
+-----------------+-------------------------------+
| a1              | a2                            |
+-----------------+-------------------------------+
| [1,5.2512]      | [1,1,1,-1,1,3,2,NULL,2,3,4,5] |
| [1,5.2312]      | [1,NULL,NULL,2,2,3,4,5]       |
| [1,5.2312]      | [1,2,3,4,-2,NULL,4,5]         |
| [1,5.2312]      | [1,6,3,4,NULL,NULL,5,5,4,5]   |
| [1,5.2312]      | [1,2,NULL,3,4,5]              |
| [1,5.2312]      | [-5,2,2,-5,-9,3,3,4,5]        |
| [1,5.2312]      | [1,2,3,4,5,5,NULL,NULL,5,5]   |
| [1,52312,1,6,9] | [1,2,3,4,5]                   |
| NULL            | [1,2,NULL,NULL,5]             |
| NULL            | [1,2,3,NULL,3,2,1]            |
| [1,5.2512]      | [1,2,3,4,5]                   |
| [1,5.2312]      | [1,2,3,4,5]                   |
| [1,5.2312]      | [1,2,3,4,5]                   |
| [1,5.2312]      | [1,6,3,4,5]                   |
| [1,5.2312]      | [1,2,3,4,5]                   |
| [1,5.2312]      | [5,2,3,4,5]                   |
| [1,5.2312]      | [1,2,3,4,5]                   |
| [1,52312,1,6,9] | [1,2,3,4,5]                   |
| NULL            | [1,2,3,4,5]                   |
| NULL            | [1,2,3,4,6]                   |
+-----------------+-------------------------------+
select * from tt5 UNION select * from tt6;
+----+-------+-------+-------------+-----------------+-------------------------------+
| id | v     | a     | d           | a1              | a2                            |
+----+-------+-------+-------------+-----------------+-------------------------------+
|  1 | [1,2] | test  |       0.012 | [1,5.2512]      | [1,2,3,4,5]                   |
|  1 | [1,2] | test  |       0.012 | [1,5.2512]      | [1,1,1,-1,1,3,2,NULL,2,3,4,5] |
|  2 | [1,2] | test1 |       0.015 | [1,5.2312]      | [1,2,3,4,5]                   |
|  2 | [1,2] | test1 |       0.015 | [1,5.2312]      | [1,NULL,NULL,2,2,3,4,5]       |
|  3 | [1,2] | test2 |       0.015 | [1,5.2312]      | [1,2,3,4,5]                   |
|  3 | [1,2] | test2 |       0.015 | [1,5.2312]      | [1,2,3,4,-2,NULL,4,5]         |
|  4 | [3,4] | test3 | 14.21431445 | [1,5.2312]      | [1,6,3,4,5]                   |
|  4 | [3,4] | test3 | 14.21431445 | [1,5.2312]      | [1,6,3,4,NULL,NULL,5,5,4,5]   |
|  5 | [6,7] | test4 | 14.21431445 | [1,5.2312]      | [1,2,3,4,5]                   |
|  5 | [6,7] | test4 | 14.21431445 | [1,5.2312]      | [1,2,NULL,3,4,5]              |
|  6 | NULL  | test4 | 14.21431445 | [1,5.2312]      | [5,2,3,4,5]                   |
|  6 | NULL  | test4 | 14.21431445 | [1,5.2312]      | [-5,2,2,-5,-9,3,3,4,5]        |
|  7 | NULL  | test5 | 14.21431445 | [1,5.2312]      | [1,2,3,4,5]                   |
|  7 | NULL  | test5 | 14.21431445 | [1,5.2312]      | [1,2,3,4,5,5,NULL,NULL,5,5]   |
|  8 | [6,7] | test6 | 14.21431445 | [1,52312,1,6,9] | [1,2,3,4,5]                   |
|  9 | [6,7] | test6 | 14.21431445 | NULL            | [1,2,3,4,5]                   |
|  9 | [6,7] | test6 | 14.21431445 | NULL            | [1,2,NULL,NULL,5]             |
| 20 | [6,7] | NULL  | 14.21431445 | NULL            | [1,2,3,4,6]                   |
| 20 | [6,7] | NULL  | 14.21431445 | NULL            | [1,2,3,NULL,3,2,1]            |
+----+-------+-------+-------------+-----------------+-------------------------------+
(SELECT array_sortby(x->x*x,a1) FROM tt5) UNION ALL (SELECT array_sortby(x->x/x,a2) FROM tt6 ORDER BY array_length(a2) desc);
+-------------------------+
| array_sortby(x->x*x,a1) |
+-------------------------+
| [1,5.251200199127197]   |
| [1,5.231200218200684]   |
| [1,5.231200218200684]   |
| [1,5.231200218200684]   |
| [1,5.231200218200684]   |
| [1,5.231200218200684]   |
| [1,5.231200218200684]   |
| [1,1,6,9,52312]         |
| NULL                    |
| NULL                    |
| [1,2,3,4,5]             |
| [1,2,3,4,5]             |
| [1,2,3,4,5]             |
| [1,6,3,4,5]             |
| [1,2,3,4,5]             |
| [5,2,3,4,5]             |
| [1,2,3,4,5]             |
| [1,2,3,4,5]             |
| [1,2,3,4,5]             |
| [1,2,3,4,6]             |
+-------------------------+

drop table tt5;
create table tt5(id int primary key,v vector(2), a varchar(100),d double,a1 array(float),a2 array(int))
PARTITION BY range COLUMNS(id)(
PARTITION p0 values less than(19),
PARTITION p1 values less than(25),
PARTITION p2 values less than(30)
);
drop view vtt5;
create view vtt5 as select * from tt5;
insert into tt5 values(1,[1,2],'test','1.2E-2',[1,525.12E-2],[1,1,1,-1,1,3,2,null,2,3,4,5]);
insert into tt5 values(2,[1,2],'test1','1.5E-2',[1,523.12E-2],[1,null,null,2,2,3,4,5]);
insert into tt5 values(3,[1,2],'test2','1.5E-2',[1,523.12E-2],[1,2,3,4,-2,null,4,5]);
insert into tt5 values(4,[3,4],'test3','142143144.5E-7',[1,523.12E-2],[1,6,3,4,null,null,5,5,4,5]);
insert into tt5 values(5,[6,7],'test4','142143144.5E-7',[1,523.12E-2],[1,2,null,3,4,5]);
insert into tt5 values(6,null,'test4','142143144.5E-7',[1,523.12E-2],[-5,2,2,2-7,-9,3,3,4,5]);
insert into tt5 values(7,null,'test5','142143144.5E-7',[1,523.12E-2],[1,2,3,4,5,5,null,null,5,5]);
insert into tt5 values(8,[6,7],'test6','142143144.5E-7',[1,523.12E+2,1,6,9],[1,2,3,4,5]);
insert into tt5 values(9,[6,7],'test6','142143144.5E-7',null,[1,2,null,null,5]);
insert into tt5 values(20,[6,7],null,'142143144.5E-7',null,[1,2,3,null,3,2,1]);

create materialized view mv1 as select array_sortby(x->x/x,a2) from tt5;
desc mv1;
+-------------------------+------------+------+-----+---------+-------+
| Field                   | Type       | Null | Key | Default | Extra |
+-------------------------+------------+------+-----+---------+-------+
| array_sortby(x->x/x,a2) | ARRAY(INT) | YES  |     | NULL    |       |
+-------------------------+------------+------+-----+---------+-------+
insert into tt5 values(21,[6,7],null,'142143144.5E-7',null,[1,2,3,4,6]);
call DBMS_MVIEW.REFRESH('mv1','c');
DROP materialized view mv1;

create materialized view mv1  as select array_length(a2) from tt5;
call DBMS_MVIEW.REFRESH('mv1','c');

DROP materialized view mv1;

drop materialized view if exists mv1;
drop table t1;
Got one of the listed errors
CREATE TABLE t1 (c1 int primary key, c2 int[], c3 float[]);
insert into t1(c1,c2,c3) values(1,'[1,1,2]',[2,2,3]);
insert into t1(c1,c2,c3) values(2,'[2,2,3]',[3,2,3]);
create materialized view mv1(primary key(c1))  as select c1,array_sortby((x,y) -> (x*y), c2,c2) c2  from t1 ;
select * from mv1;
+----+---------+
| c1 | c2      |
+----+---------+
|  1 | [1,1,2] |
|  2 | [2,2,3] |
+----+---------+
drop table t1;
drop materialized view mv1;

CREATE TABLE t1 (c1 int primary key, c2 int[],c3 float[],c4 varchar(256)[][])partition by hash(c1) partitions 4;
insert into t1 values(1,[1,2,3,null,5],[2.123,2.123,3.123,4.123],[['中文ing123',1,'1'],null]);
insert into t1 values(2,[2,3,null,4,5],[2.123,2.123,3.123,4.123],[[null,'a','sss'],null,null,array_remove([1],1)]);
insert into t1 values(3,[3,3,3,3],[3.123,2.123,3.123,4.123],[['null','a','sss']]);
insert into t1 values(4,[2,3,4,null,5],[4.123,2.123,3.123,4.123],[[2,3,4,5]]);
insert into t1 values(5,null,null,null);
select array_sortby((x) -> (x%x), c2) from t1;
+--------------------------------+
| array_sortby((x) -> (x%x), c2) |
+--------------------------------+
| [2,3,4,5,NULL]                 |
| [1,2,3,5,NULL]                 |
| NULL                           |
| [2,3,4,5,NULL]                 |
| [3,3,3,3]                      |
+--------------------------------+
select array_sortby((x)->(x) is not null,array_compact(c4)) from t1;
+------------------------------------------------------+
| array_sortby((x)->(x) is not null,array_compact(c4)) |
+------------------------------------------------------+
| [["2","3","4","5"]]                                  |
| [NULL,["中文ing123","1","1"]]                        |
| NULL                                                 |
| [NULL,[NULL,"a","sss"],[]]                           |
| [["null","a","sss"]]                                 |
+------------------------------------------------------+

drop table t1;
CREATE TABLE t1 (c1 float UNSIGNED[],c2 double UNSIGNED[], c3 tinyint UNSIGNED[],c4 smallint UNSIGNED[],c5 int UNSIGNED[],c6 bigint UNSIGNED[], c7 smallint[], c8 int primary key AUTO_INCREMENT) ;
insert into t1 (c1,c2,c3,c4,c5,c6,c7) values([1,1,2,2,null],[1,null],[1,2,5,4,3],[1,null,null],[null,1],[null,23,1,3,2],[0,null,null,1]);
select array_sortby((x) -> (x/x), c1) from t1;
+--------------------------------+
| array_sortby((x) -> (x/x), c1) |
+--------------------------------+
| [1,1,2,2,NULL]                 |
+--------------------------------+
select array_sortby((x) -> (x*x), c2) from t1;
+--------------------------------+
| array_sortby((x) -> (x*x), c2) |
+--------------------------------+
| [1,NULL]                       |
+--------------------------------+
select array_sortby((x) -> (x+x), c3) from t1;
+--------------------------------+
| array_sortby((x) -> (x+x), c3) |
+--------------------------------+
| [1,2,3,4,5]                    |
+--------------------------------+
select array_sortby((x) -> (x-x), c4) from t1;
+--------------------------------+
| array_sortby((x) -> (x-x), c4) |
+--------------------------------+
| [1,NULL,NULL]                  |
+--------------------------------+
select array_sortby((x) -> (x%x), c5) from t1;
+--------------------------------+
| array_sortby((x) -> (x%x), c5) |
+--------------------------------+
| [1,NULL]                       |
+--------------------------------+
select array_sortby((x) -> (x&x), c6) from t1;
+--------------------------------+
| array_sortby((x) -> (x&x), c6) |
+--------------------------------+
| [1,2,3,23,NULL]                |
+--------------------------------+
select array_sortby((x) -> (x>>x), c7) from t1;
+---------------------------------+
| array_sortby((x) -> (x>>x), c7) |
+---------------------------------+
| [0,1,NULL,NULL]                 |
+---------------------------------+
drop table t1;

select array_sortby((x)->(x=x),[[null],[""],null]);
+---------------------------------------------+
| array_sortby((x)->(x=x),[[null],[""],null]) |
+---------------------------------------------+
| [[NULL],[""],NULL]                          |
+---------------------------------------------+
select array_sortby((x)->(x/x),[null,0,"null"]);
+------------------------------------------+
| array_sortby((x)->(x/x),[null,0,"null"]) |
+------------------------------------------+
| [NULL,"0","null"]                        |
+------------------------------------------+
Warnings:
Warning	1292	Truncated incorrect DOUBLE value: 'null'
Warning	1292	Truncated incorrect DOUBLE value: 'null'
select array_sortby((x)->(x%x),[null,0,"null"]);
+------------------------------------------+
| array_sortby((x)->(x%x),[null,0,"null"]) |
+------------------------------------------+
| [NULL,"0","null"]                        |
+------------------------------------------+
Warnings:
Warning	1292	Truncated incorrect DOUBLE value: 'null'
Warning	1292	Truncated incorrect DOUBLE value: 'null'

drop table tt1;
create table tt1(id int,c1 array(int), c2 array(varchar(256)), c3 array(tinyint), c4 array(bigint), c5 array(float), c6 array(double), c7 array(smallint));

insert into tt1 values(1,[null,null,-2147483648,-2147483647,0,77777],['','test','test',null,null],[127,0,-128,127,null],[-9223372036854775808,775,808,2,0],[-9223372036854775808,775,808,2,0],[null,null,3.402, 0, 1.175,3.266,null,null],
[-32768,0,32767,32767]);
insert into tt1 values(2,[null,null],[null,null,'[]',''],[null,null,1],[null,null,1],[null,null,1],[null,null,1,0],[null,null,1,0]);
insert into tt1 values(3,null,null,null,null,null,null,null);

select * from tt1;
+------+---------------------------------------------+------------------------------+-----------------------+------------------------------------+---------------------------+-------------------------------------------+------------------------+
| id   | c1                                          | c2                           | c3                    | c4                                 | c5                        | c6                                        | c7                     |
+------+---------------------------------------------+------------------------------+-----------------------+------------------------------------+---------------------------+-------------------------------------------+------------------------+
|    1 | [NULL,NULL,-2147483648,-2147483647,0,77777] | ["","test","test",NULL,NULL] | [127,0,-128,127,NULL] | [-9223372036854775808,775,808,2,0] | [-9.22337e18,775,808,2,0] | [NULL,NULL,3.402,0,1.175,3.266,NULL,NULL] | [-32768,0,32767,32767] |
|    2 | [NULL,NULL]                                 | [NULL,NULL,"[]",""]          | [NULL,NULL,1]         | [NULL,NULL,1]                      | [NULL,NULL,1]             | [NULL,NULL,1,0]                           | [NULL,NULL,1,0]        |
|    3 | NULL                                        | NULL                         | NULL                  | NULL                               | NULL                      | NULL                                      | NULL                   |
+------+---------------------------------------------+------------------------------+-----------------------+------------------------------------+---------------------------+-------------------------------------------+------------------------+
select array_sortby(x->(x) is not null,c2) FROM tt1;
+-------------------------------------+
| array_sortby(x->(x) is not null,c2) |
+-------------------------------------+
| [NULL,NULL,"","test","test"]        |
| [NULL,NULL,"[]",""]                 |
| NULL                                |
+-------------------------------------+

drop table tt1;
create table tt1(id int,c1 array(varchar(256)));
insert into tt1 values(1,[null,null,'[]','']);
insert into tt1 values(2,['','test','test',null,null]);
insert into tt1 values(3,null);
select array_sortby(x->(x) is not null,c1) FROM tt1;
+-------------------------------------+
| array_sortby(x->(x) is not null,c1) |
+-------------------------------------+
| [NULL,NULL,"[]",""]                 |
| [NULL,NULL,"","test","test"]        |
| NULL                                |
+-------------------------------------+

drop table tt1;
create table tt1(id int,c1 array(array(int)), c2 array(array(varchar(256))), c3 array(array(tinyint)), c4 array(array(bigint)), c5 array(array(float)), c6 array(array(double)), c7 array(array(smallint)));

insert into tt1 values(1,[null,null,[-2147483648,-2147483647,0,77777],[null]],[[''],['test','test'],['test',null]],[[127,0,-128],[127,0,-128],null,null],[[-9223372036854775808,775,808,2,0],[-9223372036854775808,775,808,2,0],[null],null],[[3.402, 0, 1.175],null,null],
[[1.7976931348623157E+308, 2.2250738585072014E-308,2.2250738585072014E-308],null,null],[null,null,[-32768,0,32767,32767],[-32768,0,32767,32767]]);

insert into tt1 values(2,[null,null,[null],[null]],[[null,null],[''],['']],[null,null,[null],[null]],[null,null,[null],[null]],[null,null,[null],[null]],[null,null,[null],[null]],[null,null,[null],[null]]);

insert into tt1 values(3,null,null,null,null,null,null,null);

select * from tt1;
+------+------------------------------------------------------+--------------------------------------+---------------------------------------+-------------------------------------------------------------------------------------+-----------------------------+--------------------------------------------------------------------------------------+-----------------------------------------------------------+
| id   | c1                                                   | c2                                   | c3                                    | c4                                                                                  | c5                          | c6                                                                                   | c7                                                        |
+------+------------------------------------------------------+--------------------------------------+---------------------------------------+-------------------------------------------------------------------------------------+-----------------------------+--------------------------------------------------------------------------------------+-----------------------------------------------------------+
|    1 | [NULL,NULL,[-2147483648,-2147483647,0,77777],[NULL]] | [[""],["test","test"],["test",NULL]] | [[127,0,-128],[127,0,-128],NULL,NULL] | [[-9223372036854775808,775,808,2,0],[-9223372036854775808,775,808,2,0],[NULL],NULL] | [[3.402,0,1.175],NULL,NULL] | [[1.7976931348623157e308,2.2250738585072014e-308,2.2250738585072014e-308],NULL,NULL] | [NULL,NULL,[-32768,0,32767,32767],[-32768,0,32767,32767]] |
|    2 | [NULL,NULL,[NULL],[NULL]]                            | [[NULL,NULL],[""],[""]]              | [NULL,NULL,[NULL],[NULL]]             | [NULL,NULL,[NULL],[NULL]]                                                           | [NULL,NULL,[NULL],[NULL]]   | [NULL,NULL,[NULL],[NULL]]                                                            | [NULL,NULL,[NULL],[NULL]]                                 |
|    3 | NULL                                                 | NULL                                 | NULL                                  | NULL                                                                                | NULL                        | NULL                                                                                 | NULL                                                      |
+------+------------------------------------------------------+--------------------------------------+---------------------------------------+-------------------------------------------------------------------------------------+-----------------------------+--------------------------------------------------------------------------------------+-----------------------------------------------------------+
select array_sortby((x,y)->(y),c2,[3,1,2]) FROM tt1;
+--------------------------------------+
| array_sortby((x,y)->(y),c2,[3,1,2])  |
+--------------------------------------+
| [["test","test"],["test",NULL],[""]] |
| [[""],[""],[NULL,NULL]]              |
| NULL                                 |
+--------------------------------------+

drop table tt1;
create table tt1(id int,c1 array(array(int)), c2 array(array(varchar(256))));

insert into tt1 values(1,[null,null,[-2147483648,-2147483647,0,77777],[null]],[['[]'],['],['],[''],['test',null],null]);

insert into tt1 values(2,[null,null,[null],[null]],[[null,null],[''],['[]'],['],['],['']]);

insert into tt1 values(3,null,null);

insert into tt1 values(4,null,[array_remove([1],1),array_remove([1,2],1),null,array_remove([3],3),[''],null]);

select * from tt1;
+------+------------------------------------------------------+------------------------------------------+
| id   | c1                                                   | c2                                       |
+------+------------------------------------------------------+------------------------------------------+
|    1 | [NULL,NULL,[-2147483648,-2147483647,0,77777],[NULL]] | [["[]"],["],["],[""],["test",NULL],NULL] |
|    2 | [NULL,NULL,[NULL],[NULL]]                            | [[NULL,NULL],[""],["[]"],["],["],[""]]   |
|    3 | NULL                                                 | NULL                                     |
|    4 | NULL                                                 | [[],["2"],NULL,[],[""],NULL]             |
+------+------------------------------------------------------+------------------------------------------+
select array_sortby(x->(x=x),c2) FROM tt1;
+------------------------------------------+
| array_sortby(x->(x=x),c2)                |
+------------------------------------------+
| [["[]"],["],["],[""],["test",NULL],NULL] |
| [[NULL,NULL],[""],["[]"],["],["],[""]]   |
| NULL                                     |
| [[],["2"],[],[""],NULL,NULL]             |
+------------------------------------------+

drop table tt1;
create table tt1(id int, c1 varchar(256)[]);
insert into tt1 values(1,'[]');
insert into tt1 values(2,'["[]"]');

select * from tt1;
+------+--------+
| id   | c1     |
+------+--------+
|    1 | []     |
|    2 | ["[]"] |
+------+--------+
select array_sortby(x->(x=x),array_compact(c1)) from tt1;
+------------------------------------------+
| array_sortby(x->(x=x),array_compact(c1)) |
+------------------------------------------+
| []                                       |
| ["[]"]                                   |
+------------------------------------------+

drop table tt1;
create table tt1(id int ,c1 varchar(256)[][]);
insert into tt1 values(1,'[null,[null,null],[null],["tt",null]]');
insert into tt1 values(2,'[[null,"null"],[null,"null"]]');
select * from tt1;
+------+---------------------------------------+
| id   | c1                                    |
+------+---------------------------------------+
|    1 | [NULL,[NULL,NULL],[NULL],["tt",NULL]] |
|    2 | [[NULL,"null"],[NULL,"null"]]         |
+------+---------------------------------------+
select array_sortby(x->(array_compact(x) is not NULL) ,array_compact(c1)) from tt1;
+--------------------------------------------------------------------+
| array_sortby(x->(array_compact(x) is not NULL) ,array_compact(c1)) |
+--------------------------------------------------------------------+
| [NULL,[NULL,NULL],[NULL],["tt",NULL]]                              |
| [[NULL,"null"]]                                                    |
+--------------------------------------------------------------------+

drop table if exists test;
Warnings:
Note	1051	Unknown table 'testkj.test'
CREATE TABLE test (id int ,c4 varchar(256)[][]);
insert into test values(1,'[null,[],[1],["test",null],[null],[],null,null]');
select array_sortby(x->(array_compact(x) is not NULL) ,array_compact(c4)) from test;
+--------------------------------------------------------------------+
| array_sortby(x->(array_compact(x) is not NULL) ,array_compact(c4)) |
+--------------------------------------------------------------------+
| [NULL,NULL,[],["1"],["test",NULL],[NULL],[]]                       |
+--------------------------------------------------------------------+

drop table tt1;
create table tt1(id int, c1 varchar(256)[][][]);
insert into tt1 values(1,'[[null,[],[1],[3,null],[null],[]],null,null]');
insert into tt1 values(2,'[null,null,[null,[],[1],[3,null],[null],[]]]');
select * from tt1;
+------+--------------------------------------------------+
| id   | c1                                               |
+------+--------------------------------------------------+
|    1 | [[NULL,[],["1"],["3",NULL],[NULL],[]],NULL,NULL] |
|    2 | [NULL,NULL,[NULL,[],["1"],["3",NULL],[NULL],[]]] |
+------+--------------------------------------------------+
select array_sortby(x->(array_compact(x) is not NULL) ,array_compact(c1)) from tt1;
+--------------------------------------------------------------------+
| array_sortby(x->(array_compact(x) is not NULL) ,array_compact(c1)) |
+--------------------------------------------------------------------+
| [NULL,[NULL,[],["1"],["3",NULL],[NULL],[]]]                        |
| [NULL,[NULL,[],["1"],["3",NULL],[NULL],[]]]                        |
+--------------------------------------------------------------------+

select array_compact([[null,array_remove([1],1),[1],[3,null],[null]],[null,array_remove([2],2),[1],[3,null],[null]]]);
+----------------------------------------------------------------------------------------------------------------+
| array_compact([[null,array_remove([1],1),[1],[3,null],[null]],[null,array_remove([2],2),[1],[3,null],[null]]]) |
+----------------------------------------------------------------------------------------------------------------+
| [[NULL,[],[1],[3,NULL],[NULL]]]                                                                                |
+----------------------------------------------------------------------------------------------------------------+

drop table if exists test;
CREATE TABLE test (id int ,c4 varchar(256)[][][][]);
insert into test values(1,'[null,null,[[null,[],[1],["test",null],["test",null],[null],[]]],[[[null]]],[[[null]]]]');

select array_sortby(x->(array_compact(x) is not NULL) ,array_compact(c4)) from test;
+---------------------------------------------------------------------------+
| array_sortby(x->(array_compact(x) is not NULL) ,array_compact(c4))        |
+---------------------------------------------------------------------------+
| [NULL,[[NULL,[],["1"],["test",NULL],["test",NULL],[NULL],[]]],[[[NULL]]]] |
+---------------------------------------------------------------------------+
select * from test;
+------+-------------------------------------------------------------------------------------------+
| id   | c4                                                                                        |
+------+-------------------------------------------------------------------------------------------+
|    1 | [NULL,NULL,[[NULL,[],["1"],["test",NULL],["test",NULL],[NULL],[]]],[[[NULL]]],[[[NULL]]]] |
+------+-------------------------------------------------------------------------------------------+

drop table if exists test;
CREATE TABLE test (id int ,c4 varchar(256)[][][][][]);
insert into test values(1,'[null,null,[[[null,[],[1],["test",null],["test",null],[null],[]]]],[[[[null]]]],[[[[null]]]]]');

select array_sortby(x->(array_compact(x) is not NULL) ,array_compact(c4)) from test;
+-------------------------------------------------------------------------------+
| array_sortby(x->(array_compact(x) is not NULL) ,array_compact(c4))            |
+-------------------------------------------------------------------------------+
| [NULL,[[[NULL,[],["1"],["test",NULL],["test",NULL],[NULL],[]]]],[[[[NULL]]]]] |
+-------------------------------------------------------------------------------+
select * from test;
+------+-------------------------------------------------------------------------------------------------+
| id   | c4                                                                                              |
+------+-------------------------------------------------------------------------------------------------+
|    1 | [NULL,NULL,[[[NULL,[],["1"],["test",NULL],["test",NULL],[NULL],[]]]],[[[[NULL]]]],[[[[NULL]]]]] |
+------+-------------------------------------------------------------------------------------------------+

drop table if exists test;
CREATE TABLE test (id int ,c4 varchar(256)[][][][][][]);
insert into test values(1,'[null,null,[[[[null,[],[1],["test",null],["test",null],[null],[]]]]],[[[[[null]]]]],[[[[[null]]]]]]');

select array_sortby(x->(array_compact(x) is not NULL) ,array_compact(c4)) from test;
+-----------------------------------------------------------------------------------+
| array_sortby(x->(array_compact(x) is not NULL) ,array_compact(c4))                |
+-----------------------------------------------------------------------------------+
| [NULL,[[[[NULL,[],["1"],["test",NULL],["test",NULL],[NULL],[]]]]],[[[[[NULL]]]]]] |
+-----------------------------------------------------------------------------------+
select * from test;
+------+-------------------------------------------------------------------------------------------------------+
| id   | c4                                                                                                    |
+------+-------------------------------------------------------------------------------------------------------+
|    1 | [NULL,NULL,[[[[NULL,[],["1"],["test",NULL],["test",NULL],[NULL],[]]]]],[[[[[NULL]]]]],[[[[[NULL]]]]]] |
+------+-------------------------------------------------------------------------------------------------------+
desc test;
+-------+--------------------------------------------------------+------+-----+---------+-------+
| Field | Type                                                   | Null | Key | Default | Extra |
+-------+--------------------------------------------------------+------+-----+---------+-------+
| id    | int(11)                                                | YES  |     | NULL    |       |
| c4    | ARRAY(ARRAY(ARRAY(ARRAY(ARRAY(ARRAY(VARCHAR(256))))))) | YES  |     | NULL    |       |
+-------+--------------------------------------------------------+------+-----+---------+-------+
drop table test;

drop table tt1;
create table tt1(id int primary key,c1 array(int), c2 array(varchar(256)), c3 array(tinyint), c4 array(bigint), c5 array(float), c6 array(double), c7 array(smallint))
PARTITION BY range COLUMNS(id)(
PARTITION p0 values less than(13),
PARTITION p1 values less than(50),
PARTITION p2 values less than(100)
);

insert into tt1 values(10,null,null,null,null,null,null,null);
insert into tt1 values (1,'[]','[]','[]','[]','[]','[]','[]');
insert into tt1 values (2,array_remove([1],1),array_remove([1],1),array_remove([1],1),array_remove([1],1),array_remove([1],1),array_remove([1],1),array_remove([1],1));
insert into tt1 values(3,[-2147483648.5,-2147483648.5 ,0, 2147483647.4999998],['test','test',null,null],[127.499999999999992,127.499999999999992,0,-128.5,-128.5],[-9223372036854775808,9223372036854775807,0],[3.402, 0, 1.175], [1.7976931348623157E+308,0, 2.2250738585072014E-308],[-32768.5,0,32767.499999999998]);

INSERT /*+ DIRECT(true, 0, 'full') enable_parallel_dml parallel(16) */ INTO tt1 partition(p0) values(5,array_sortby((x,y)->(x+y),array_compact([1,1,1,1,2,2,2,2,4,3,4,4,6]),[6,3,4,1,2,5]),'[]','[]','[]','[]','[]','[]');

INSERT /*+ DIRECT(true, 0, 'inc_replace') enable_parallel_dml parallel(16) */ INTO tt1 partition(p0) values(6,array_sortby((x,y)->(y>0),array_remove([1,null],1),[1]),'[]','[]','[]','[]','[]','[]');

## insert/replace/update/delete
drop table tt3;
create table tt3(id int primary key,id1 int[],id2 int[])
PARTITION BY range(id)(
PARTITION p0 values less than(10),
PARTITION p1 values less than(20),
PARTITION p2 values less than(MAXVALUE)
);
drop view vtt3;
create view vtt3 as select * from tt3;
insert into tt3 values(1, array_sortby((x) -> (x=x),[1,2,34]),array_sortby((x) -> (x=x),[1,2,34]));
insert into tt3 values(2, array_sortby((x) -> (x=x),[2,2,null]),(array_sortby((x) -> (x=x),[1,2,34])));
insert into tt3 values(3, array_sortby((x) -> (x=x),[3,9,null]),array_sortby((x) -> (x=x),[false]));
insert into tt3 partition (p0) values(4, array_sortby((x) -> (x=x),[4,-50]),array_sortby((x) -> (x=x),[false]));
insert into tt3 partition (p0) (id,id1) values(5, array_sortby((x) -> (x=x),[5,-11,null]));
insert into tt3 partition (p1) (id,id1,id2) values(16, array_sortby((x) -> (x=x),[16,10]),array_sortby((x) -> (x=x),[true,false,false]));
insert ignore into tt3 values(8, array_sortby((x) -> (x=x),[15,2,34]),array_sortby((x) -> (x=x),[1,2,34])) ON DUPLICATE KEY UPDATE  id1=array_sortby((x) -> (x=x),array_compact([3,3,3,9,9,9,null]));

INSERT /*+ DIRECT(true, 0, 'full') enable_parallel_dml parallel(16) */ INTO vtt3 SELECT 9, array_sortby((x) -> (x=x),[id+40,5]),array_sortby((x) -> (x=x),[id]) from tt3 where id =1 limit 1;
INSERT /*+ DIRECT(true, 0, 'inc_replace') enable_parallel_dml parallel(16) */ INTO tt3 (id,id1,id2) SELECT 10, array_sortby((x) -> (x=x),[id*8,10]) , array_sortby((x) -> (x=x),[id]) from tt3 limit 3;

alter table tt3 add index index_1((array_sortby((x) -> (x=x),[id])));

replace into tt3 values(2,array_sortby((x) -> (x=x),[1,2,34]),(select array_sortby((x) -> (x=x),id1) from tt3 where id=1));
replace into tt3 values(3, array_sortby((x) -> (x=x),[1,2,34,98,9077]),(select array_sortby((x) -> (x=x),id1) from tt3 where id=1));
replace into tt3 partition (p1) values(14,array_sortby((x) -> (x=x),[1,2,34]),(select array_sortby((x) -> (x=x),id2) from tt3 where id=1));
replace into tt3 partition (p1) (id,id2)values(15, (select array_sortby((x) -> (x=x),id1) from tt3 where id=5));

replace /*+ OPT_PARAM('rowsets_enabled', 'FALSE') */ /*+ OPT_PARAM('rowsets_enabled', 'FALSE') */ into tt3 values(2,  array_sortby((x) -> (x=x),[33,34,4,5,7,3,4,54767,34]),array_sortby((x) -> (x=x),[1,2,34]));
replace into tt3 values(6, array_sortby((x) -> (x=x),array_compact([1,1,1,1,2,33,34,4,4,4,4,5,7,3,4,54767,34,1])),array_sortby((x) -> (x=x),[1,2,34]));
insert into tt3 values(3, array_sortby((x) -> (x=x),[1]),array_sortby((x) -> (x=x),[1]))ON DUPLICATE KEY UPDATE id1=array_compact([1,1]);

replace into vtt3 values(1, array_sortby((x) -> (x=x),[1,2,34]),(select array_sortby((x) -> (x=x),id1) from tt3 where id=1));
replace into vtt3 values(2, array_sortby((x) -> (x=x),[1,2,34,98,9077]),(select array_sortby((x) -> (x=x),id1) from tt3 where id=1));
replace into vtt3 values(9,array_sortby((x) -> (x=x),[1,2,33,34,4,5,7,3,4,54767,34,1]),array_sortby((x) -> (x=x),[1,2,34]));
replace into vtt3 values(7,(array_sortby((x) -> (x=x),[1,2,33,34,4,5,7,3,4,54767,52,45,78])),(array_sortby((x) -> (x=x),[1,2,34,9,7])));
drop table tt4;
create table tt4(id int primary key,id1 int[])
PARTITION BY range(id)(
PARTITION p0 values less than(0),
PARTITION p1 values less than(20),
PARTITION p2 values less than(MAXVALUE)
) WITH COLUMN GROUP(each column);
drop view vtt4;
create view vtt4 as select * from tt4;
replace /*+ direct(true,100,'inc') enable_parallel_dml parallel(2)*/ into tt4(id,id1) select 1,array_sortby((x) -> (x=x),[id*3,10]) from tt3 limit 3;
INSERT /*+ DIRECT(true, 0, 'inc_replace') enable_parallel_dml parallel(16) */ INTO tt4 (id,id1) SELECT 10, array_sortby((x) -> (x=x),[id*8,10]) from tt3 limit 3;

update tt3 set id1=array_sortby((x) -> (x=x),[912,0,5]) limit 1;
update tt3 set id1=array_sortby((x) -> (x=x),[12,3,833,9,0,5]),id2=array_sortby((x) -> (x=x),[null]) where array_sortby((x) -> (x=x),[id])<>null limit 3;

update ignore tt3 set id1=array_sortby((x) -> (x=x),[12,3,8,9,0,50]) where array_sortby((x) -> (x=x),[id])<>null order by id limit 5;
update tt3 set id1 =(select array_sortby((x) -> (x=x),id2) from tt3 where id=1) order by id desc limit 3;
update  /*+ OPT_PARAM('rowsets_enabled', 'FALSE') */ /*+ OPT_PARAM('rowsets_enabled', 'FALSE') */ vtt3 set id1=array_sortby((x) -> (x=x),[12,3,8,90,0,5]) limit 1;
update vtt3 set id1=array_sortby((x) -> (x=x),[12,3,8,9,0,5]);
update  /*+ OPT_PARAM('rowsets_enabled', 'FALSE') */  tt3 set id2=array_sortby((x) -> (x=x),[9,0,5,78754]) limit 1;
delete from tt3 where array(id) =array_sortby((x) -> (x=x),[1]);
delete from tt3 where id1 <>array_sortby((x) -> (x=x),[0,null]);
delete from tt3 where id1=array_sortby((x) -> (x=x),[12,6,0]) limit 1;
delete from tt3 where id1 =(select array_sortby((x) -> (x=x),id1) from tt3 where id=1);
delete from tt3 order by id limit 3;
delete tt3,tt4 from tt3 inner join tt4 on array_sortby((x) -> (x=x),[tt3.id])=array_sortby((x) -> (x=x),[tt4.id]) where array_sortby((x) -> (x=x),[tt3.id]) <> null;

drop table tt2;
create table tt2(id int,c1 array(int unsigned), c2 array(varchar(256)), c3 array(tinyint unsigned), c4 array(bigint unsigned), c5 array(float unsigned), c6 array(double unsigned), c7 array(smallint unsigned), c8 vector(3)) CHARACTER SET gbk
PARTITION BY range COLUMNS(id)(
PARTITION p0 values less than(1),
PARTITION p1 values less than(2),
PARTITION p2 values less than(MAXVALUE)
);
create index idx_tt2 on tt2(id);
create UNIQUE index idx_tt2_id on tt2(id);
CREATE INDEX tt2_func_idx1 on tt2((array_avg(c1)));
CREATE INDEX tt2_func_idx2 on tt2((array_max(c2)));
CREATE INDEX tt2_func_idx3 on tt2((array_min(c5)));
CREATE INDEX idx_tt2_cg on tt2(id) WITH COLUMN GROUP(each column);
insert into tt2 values(5,[-0.5 ,0, 2147483647.4999998],['test'],[127.499999999999992,0,-0.5],[-0.5,9223372036854775807,0],[9223372036854775807 , 0], [0, 1.7976931348623157E+308],[-0.5 ,0,32767.499999999998],[0.1,2.2,1.3]);
insert into tt2 values(4,[-0.5 ,0 , null, 2147483647.4999998],['array测试',true+false,null],[127.499999999999992,0,-0.5, null],[-0.5,9223372036854775807, null,0],[9223372036854775807, null, 0], [0, null, 1.7976931348623157E+308],[-0.5 ,0, null,32767.499999999998],[1,2,3]);
insert into tt2 values(3,null,null,null,null,null,null,null,null);
insert into tt2 values(2,'[]','[]','[]','[]','[]','[]','[]',[1,2,3]);
insert into tt2 values(1,array_remove([1],1),array_remove([1],1),array_remove([1],1),array_remove([1],1),array_remove([1],1),array_remove([1],1),array_remove([1],1),[1,2,3]);

drop view vtt2;
create view vtt2 as select * from tt2;

drop table tt3;
create table tt3(id int[]);

drop view vtt3;
create view vtt3 as select * from tt3;
insert into tt3  select array_sortby((x) -> (x=x),c1) from tt2;
replace into tt3  select array_sortby((x) -> (x=x),c1) from tt2;
insert /*+ direct(true,100,'inc') enable_parallel_dml parallel(2)*/ into tt3 select array_sortby((x) -> (x=x),c1) from tt2;
insert /*+ direct(true,100) enable_parallel_dml parallel(2) append*/ into tt3 select array_sortby((x) -> (x=x),c1) from tt2;
insert /*+ direct(true,100) enable_parallel_dml parallel(2) append*/ /*+ OPT_PARAM('enable_rich_vector_format', 'FALSE') */ into tt3 select array_sortby((x) -> (x=x),c1) from tt2;
replace /*+ direct(true,100) enable_parallel_dml parallel(2) append*/ /*+ OPT_PARAM('rowsets_enabled', 'FALSE') */  /*+ OPT_PARAM('enable_rich_vector_format', 'FALSE') */into tt3 select array_sortby((x) -> (x=x),c1) from tt2;
replace /*+ direct(true,100,'inc') enable_parallel_dml parallel(2)*/ into tt3  select array_sortby((x) -> (x=x),c1) from tt2;
replace /*+ direct(true,100) enable_parallel_dml parallel(2) append*/ into tt3  select array_sortby((x) -> (x=x),c1) from tt2;
insert /*+ OPT_PARAM('rowsets_enabled', 'FALSE') */ /*+ OPT_PARAM('enable_rich_vector_format', 'FALSE') */ overwrite tt3 select array_sortby((x) -> (x=x),c1) from tt2;
drop table tt3;
create table tt3 as select array_sortby((x) -> (x=x),[0,1,null,true,false]) as a;
desc tt3;
+-------+---------------+------+-----+---------+-------+
| Field | Type          | Null | Key | Default | Extra |
+-------+---------------+------+-----+---------+-------+
| a     | ARRAY(BIGINT) | YES  |     | NULL    |       |
+-------+---------------+------+-----+---------+-------+
insert into tt3 values(array_sortby((x) -> (x=x),[2343]));
replace into tt3 values(array_sortby((x) -> (x=x),[2343,0]));
update tt3 set a=array_sortby((x) -> (x=x),[2343,0,4]);
truncate tt3;
delete from tt3;

drop table tt3;
create table tt3 (a int[] NOT NULL) ;
desc tt3;
+-------+------------+------+-----+---------+-------+
| Field | Type       | Null | Key | Default | Extra |
+-------+------------+------+-----+---------+-------+
| a     | ARRAY(INT) | NO   |     | NULL    |       |
+-------+------------+------+-----+---------+-------+
insert into tt3 values(array_sortby((x) -> (x=x),[2343]));
replace into tt3 values(array_sortby((x) -> (x=x),[2343,0]));
update tt3 set a=array_sortby((x) -> (x=x),[2343,0,4]);
select * from tt3;
+------------+
| a          |
+------------+
| [2343,0,4] |
| [2343,0,4] |
+------------+
delete from tt3;

drop table tt4;
CREATE TABLE tt4(a INT[],FOREIGN KEY(a) REFERENCES tt3(a) ON DELETE SET NULL);
ERROR HY000: Cannot add foreign key constraint

drop view vtt3;
create view vtt3 as select array_sortby((x) -> (x=x),c1) as a1,array_sortby((x) -> (x=x),c2) as a2,array_sortby((x) -> (x=x),c3) as a3,array_sortby((x) -> (x=x),c4) as a4,array_sortby((x) -> (x=x),c5) as a5,array_sortby((x) -> (x=x),c6) as a6,array_sortby((x) -> (x=x),c7) as a7 from tt1;
desc vtt3;
+-------+---------------------+------+-----+---------+-------+
| Field | Type                | Null | Key | Default | Extra |
+-------+---------------------+------+-----+---------+-------+
| a1    | ARRAY(INT)          | YES  |     | NULL    |       |
| a2    | ARRAY(VARCHAR(256)) | YES  |     | NULL    |       |
| a3    | ARRAY(TINYINT)      | YES  |     | NULL    |       |
| a4    | ARRAY(BIGINT)       | YES  |     | NULL    |       |
| a5    | ARRAY(FLOAT)        | YES  |     | NULL    |       |
| a6    | ARRAY(DOUBLE)       | YES  |     | NULL    |       |
| a7    | ARRAY(SMALLINT)     | YES  |     | NULL    |       |
+-------+---------------------+------+-----+---------+-------+

########清空回收站，删除测试数据库，表等 ##########
drop database  IF EXISTS  testkj;
purge recyclebin;

