purge recyclebin;
drop database  IF EXISTS  testkj;
create DATABASE testkj;
USE testkj;
SET timestamp = 1600000000;
SET ob_trx_timeout = 10000000000;
SET ob_query_timeout = 100000000000;
SET SESSION group_concat_max_len = 100000000;
result_format: 4
drop table tt1;
create table tt1(id int,c1 array(int), c2 array(varchar(256)), c3 array(tinyint), c4 array(bigint), c5 array(float), c6 array(double), c7 array(smallint),c8 array(int));
insert into tt1 values(1,[-2147483648,-2147483647,0,77777],['test','test'],[127,0,-128],[-9223372036854775808,9223372036854775807,775,808,2,0],[3.402, 0, 1.175],
[1.7976931348623157E+308, 2.2250738585072014E-308,2.2250738585072014E-308],[-32768,0,32767,32767],[5,3,2,1,4]);

insert into tt1 values(2,[-2147483648,0, 2147483647,4,3,2,1,26,5,2147483647,null],['test',null],[-128,127,0,-128,6,77],[-9223372036854775808,9223372036854775807,775,808,2,0,1],[3.402, 0, 1.175, 1.175, 4],
[-1.7976931348623157E+30,1.2,2.2250738585072014E-308,2.2250738585072014E-308],[-32768,0,32767,0],[14444,2,32,6565,3333,222]);
insert into tt1 values(3,null,null,null,null,null,null,null,null);

drop view vtt1;
create view vtt1 as select * from tt1;

drop table tt2;
create table tt2(id int,c1 array(int unsigned), c2 array(varchar(256)), c3 array(tinyint unsigned), c4 array(bigint unsigned), c5 array(float), c6 array(double), c7 array(smallint unsigned))
PARTITION BY range COLUMNS(id)(
PARTITION p0 values less than(19),
PARTITION p1 values less than(25),
PARTITION p2 values less than(30)
);
insert into tt2 values(1,[2147483648, 2147483648,0],['test'],[52,0,5,0,5,3,8,7,7,67,9],[ 852,9223372036854775807,775,808,2,0,9223372036854775807],[3.402, 0, 1.175,1.175,1.1750001,1.2212],
[1.7976931348623157E+308, 2.2250738585072014E-308,2.2250738585072014E-308],[88,0,32767,32767]);

insert into tt2 values(2,[87666,0, 2147483647,4],['test'],[5,0,7,6,50],[1,100000,9223372036854775807,775,808,2,0,1],[3.402, 0, 1.175,4],
[1.7976931348623157E+308,1.2,2.2250738585072014E-308],[68,0,32767,32766,1]);
insert into tt2 values(3,null,null,null,null,null,null,null);

drop view vtt2;
create view vtt2 as select * from tt2;

select /*+ OPT_PARAM('enable_rich_vector_format', 'FALSE') */ array_sort(c2) a from tt2;
+----------+
| a        |
+----------+
| ["test"] |
| ["test"] |
| NULL     |
+----------+
select /*+ OPT_PARAM('rowsets_enabled', 'FALSE') */ array_sort(c2) a from tt2;
+----------+
| a        |
+----------+
| ["test"] |
| ["test"] |
| NULL     |
+----------+

select /*+ OPT_PARAM('enable_rich_vector_format', 'FALSE') */ array_sort(c2) a from vtt2;
+----------+
| a        |
+----------+
| ["test"] |
| ["test"] |
| NULL     |
+----------+
select /*+ OPT_PARAM('rowsets_enabled', 'FALSE') */ array_sort(c2) a from vtt2;
+----------+
| a        |
+----------+
| ["test"] |
| ["test"] |
| NULL     |
+----------+

select /*+ OPT_PARAM('enable_rich_vector_format', 'FALSE') */ array_sort(c2) a from vtt1;
+-----------------+
| a               |
+-----------------+
| ["test","test"] |
| ["test",NULL]   |
| NULL            |
+-----------------+
select /*+ OPT_PARAM('rowsets_enabled', 'FALSE') */ array_sort(c2) a from vtt1;
+-----------------+
| a               |
+-----------------+
| ["test","test"] |
| ["test",NULL]   |
| NULL            |
+-----------------+
select /*+ OPT_PARAM('enable_rich_vector_format', 'FALSE') */ array_sort(c2) a from tt1;
+-----------------+
| a               |
+-----------------+
| ["test","test"] |
| ["test",NULL]   |
| NULL            |
+-----------------+
select /*+ OPT_PARAM('rowsets_enabled', 'FALSE') */ array_sort(c2) a from tt1;
+-----------------+
| a               |
+-----------------+
| ["test","test"] |
| ["test",NULL]   |
| NULL            |
+-----------------+

select /*+ OPT_PARAM('rowsets_enabled', 'FALSE') */ /*+ OPT_PARAM('enable_rich_vector_format', 'FALSE') */ array_sort(c2) a from tt2;
+----------+
| a        |
+----------+
| ["test"] |
| ["test"] |
| NULL     |
+----------+

select array_sort([null]);
+--------------------+
| array_sort([null]) |
+--------------------+
| [NULL]             |
+--------------------+
select array_sort([null,null]);
+-------------------------+
| array_sort([null,null]) |
+-------------------------+
| [NULL,NULL]             |
+-------------------------+
select array_sort([null,null,null]);
+------------------------------+
| array_sort([null,null,null]) |
+------------------------------+
| [NULL,NULL,NULL]             |
+------------------------------+
select array_sort([4,2,1,4,5,3,4,4,6,4,null,null]);
+---------------------------------------------+
| array_sort([4,2,1,4,5,3,4,4,6,4,null,null]) |
+---------------------------------------------+
| [1,2,3,4,4,4,4,4,5,6,NULL,NULL]             |
+---------------------------------------------+
select array_sort(["null","123","check"]);
+------------------------------------+
| array_sort(["null","123","check"]) |
+------------------------------------+
| ["123","check","null"]             |
+------------------------------------+
select array_sort([true,false,true,null]);
+------------------------------------+
| array_sort([true,false,true,null]) |
+------------------------------------+
| [0,1,1,NULL]                       |
+------------------------------------+
select array_sort(["true",null,"false","true",true,false]);
+-----------------------------------------------------+
| array_sort(["true",null,"false","true",true,false]) |
+-----------------------------------------------------+
| ["0","1","false","true","true",NULL]                |
+-----------------------------------------------------+
select array_sort([null,""]);
+-----------------------+
| array_sort([null,""]) |
+-----------------------+
| ["",NULL]             |
+-----------------------+
select array_sort([null,"null","","null,null"]);
+------------------------------------------+
| array_sort([null,"null","","null,null"]) |
+------------------------------------------+
| ["","null","null,null",NULL]             |
+------------------------------------------+
select array_sort(['a',null,'null','']);
+----------------------------------+
| array_sort(['a',null,'null','']) |
+----------------------------------+
| ["","a","null",NULL]             |
+----------------------------------+
select array_sort(['[1]','[1]','test']);
+----------------------------------+
| array_sort(['[1]','[1]','test']) |
+----------------------------------+
| ["[1]","[1]","test"]             |
+----------------------------------+
select array_sort(['test','test1','test2','[1]','test']);
+---------------------------------------------------+
| array_sort(['test','test1','test2','[1]','test']) |
+---------------------------------------------------+
| ["[1]","test","test","test1","test2"]             |
+---------------------------------------------------+
select array_sort(["aaaa","teset",'aaaa','testet']);
+----------------------------------------------+
| array_sort(["aaaa","teset",'aaaa','testet']) |
+----------------------------------------------+
| ["aaaa","aaaa","teset","testet"]             |
+----------------------------------------------+
select array_sort(['',"",null,"aa","aaa","aaaa",'[]']);
+-------------------------------------------------+
| array_sort(['',"",null,"aa","aaa","aaaa",'[]']) |
+-------------------------------------------------+
| ["","","[]","aa","aaa","aaaa",NULL]             |
+-------------------------------------------------+
select array_sort(['test],[test1','test1','test1']);
+----------------------------------------------+
| array_sort(['test],[test1','test1','test1']) |
+----------------------------------------------+
| ["test1","test1","test],[test1"]             |
+----------------------------------------------+
select array_sort(["","",""]);
+------------------------+
| array_sort(["","",""]) |
+------------------------+
| ["","",""]             |
+------------------------+
select array_sort(["",'[]','[]','array_remove([1],1)']);
+--------------------------------------------------+
| array_sort(["",'[]','[]','array_remove([1],1)']) |
+--------------------------------------------------+
| ["","[]","[]","array_remove([1],1)"]             |
+--------------------------------------------------+

select array_sort([['test],[test1'],['test1']]);
ERROR 0A000: array_sort with multi-dimension array not supported

select array_sort([b'111',b'101']);
ERROR 0A000: array element type not supported
select array_sort([cast('{}' as json)]);
ERROR 0A000: array element type not supported

select array_sort([true,1]);
+----------------------+
| array_sort([true,1]) |
+----------------------+
| [1,1]                |
+----------------------+
select array_sort([x'01',1,2]);
ERROR 0A000: array element type not supported
select array_sort([11,0x010101000000]);
ERROR 0A000: array element type not supported

select array_sort([11,0x0000000001010000000000000000002E400000000000003440,0x0000000001010000000000000000002E400000000000003440]);
ERROR 0A000: array element type not supported

select array_sort([18446744073709551614,9223372036854775808,18446744073709551616]);
+-----------------------------------------------------------------------------+
| array_sort([18446744073709551614,9223372036854775808,18446744073709551616]) |
+-----------------------------------------------------------------------------+
| [9223372036854775807,9223372036854775807,9223372036854775807]               |
+-----------------------------------------------------------------------------+

select array_sort([-9223372036854775808,-9223372036854775808]);
+---------------------------------------------------------+
| array_sort([-9223372036854775808,-9223372036854775808]) |
+---------------------------------------------------------+
| [-9223372036854775808,-9223372036854775808]             |
+---------------------------------------------------------+
select array_sort([5.00,3.02,5.00,3.02]);
+-----------------------------------+
| array_sort([5.00,3.02,5.00,3.02]) |
+-----------------------------------+
| [3.02,3.02,5,5]                   |
+-----------------------------------+
select array_sort([-5.0,10000000.02,-5.00,10000000.02]);
+--------------------------------------------------+
| array_sort([-5.0,10000000.02,-5.00,10000000.02]) |
+--------------------------------------------------+
| [-5,-5,10000000.02,10000000.02]                  |
+--------------------------------------------------+
select array_sort([--5.0,1000000.02,-0.00,--5.0,1000000.02,-0.00,true,false,null]);
+-----------------------------------------------------------------------------+
| array_sort([--5.0,1000000.02,-0.00,--5.0,1000000.02,-0.00,true,false,null]) |
+-----------------------------------------------------------------------------+
| [0,0,0,1,5,5,1000000.02,1000000.02,NULL]                                    |
+-----------------------------------------------------------------------------+

select array_sort([5.0,-200000.02,200000.03,0.62622,5.0,-200000.02,200000.03,0.62622,'test',null,null,'test']);
+-------------------------------------------------------------------------------------------------------------+
| array_sort([5.0,-200000.02,200000.03,0.62622,5.0,-200000.02,200000.03,0.62622,'test',null,null,'test'])     |
+-------------------------------------------------------------------------------------------------------------+
| ["-200000.02","-200000.02","0.62622","0.62622","200000.03","200000.03","5.0","5.0","test","test",NULL,NULL] |
+-------------------------------------------------------------------------------------------------------------+

select array_sort([-2.7976931348623157E+308,-2.7976931348623157E+308,-2.7976931348623157E+308]);
ERROR 22007: Illegal double '2.7976931348623157E+308' value found during parsing

select array_sort(c1) from tt1;
+---------------------------------------------------------+
| array_sort(c1)                                          |
+---------------------------------------------------------+
| [-2147483648,-2147483647,0,77777]                       |
| [-2147483648,0,1,2,3,4,5,26,2147483647,2147483647,NULL] |
| NULL                                                    |
+---------------------------------------------------------+
select array_sort(c2) from tt1;
+-----------------+
| array_sort(c2)  |
+-----------------+
| ["test","test"] |
| ["test",NULL]   |
| NULL            |
+-----------------+
select array_sort(c3) from tt1;
+------------------------+
| array_sort(c3)         |
+------------------------+
| [-128,0,127]           |
| [-128,-128,0,6,77,127] |
| NULL                   |
+------------------------+
select array_sort(c4) from tt1;
+----------------------------------------------------------+
| array_sort(c4)                                           |
+----------------------------------------------------------+
| [-9223372036854775808,0,2,775,808,9223372036854775807]   |
| [-9223372036854775808,0,1,2,775,808,9223372036854775807] |
| NULL                                                     |
+----------------------------------------------------------+
select array_sort(c5) from tt1;
+-------------------------+
| array_sort(c5)          |
+-------------------------+
| [0,1.175,3.402]         |
| [0,1.175,1.175,3.402,4] |
| NULL                    |
+-------------------------+
select array_sort(c6) from tt1;
+------------------------------------------------------------------------------+
| array_sort(c6)                                                               |
+------------------------------------------------------------------------------+
| [2.2250738585072014e-308,2.2250738585072014e-308,1.7976931348623157e308]     |
| [-1.7976931348623158e30,2.2250738585072014e-308,2.2250738585072014e-308,1.2] |
| NULL                                                                         |
+------------------------------------------------------------------------------+
select array_sort(c7) from tt1;
+------------------------+
| array_sort(c7)         |
+------------------------+
| [-32768,0,32767,32767] |
| [-32768,0,0,32767]     |
| NULL                   |
+------------------------+

select array_sort(c1) from vtt2;
+---------------------------+
| array_sort(c1)            |
+---------------------------+
| [0,2147483648,2147483648] |
| [0,4,87666,2147483647]    |
| NULL                      |
+---------------------------+
select array_sort(c1) from tt2;
+---------------------------+
| array_sort(c1)            |
+---------------------------+
| [0,2147483648,2147483648] |
| [0,4,87666,2147483647]    |
| NULL                      |
+---------------------------+
select *, array_sort(c7) from vtt1;
+------+---------------------------------------------------------+-----------------+------------------------+----------------------------------------------------------+-------------------------+------------------------------------------------------------------------------+------------------------+----------------------------+------------------------+
| id   | c1                                                      | c2              | c3                     | c4                                                       | c5                      | c6                                                                           | c7                     | c8                         | array_sort(c7)         |
+------+---------------------------------------------------------+-----------------+------------------------+----------------------------------------------------------+-------------------------+------------------------------------------------------------------------------+------------------------+----------------------------+------------------------+
|    1 | [-2147483648,-2147483647,0,77777]                       | ["test","test"] | [127,0,-128]           | [-9223372036854775808,9223372036854775807,775,808,2,0]   | [3.402,0,1.175]         | [1.7976931348623157e308,2.2250738585072014e-308,2.2250738585072014e-308]     | [-32768,0,32767,32767] | [5,3,2,1,4]                | [-32768,0,32767,32767] |
|    2 | [-2147483648,0,2147483647,4,3,2,1,26,5,2147483647,NULL] | ["test",NULL]   | [-128,127,0,-128,6,77] | [-9223372036854775808,9223372036854775807,775,808,2,0,1] | [3.402,0,1.175,1.175,4] | [-1.7976931348623158e30,1.2,2.2250738585072014e-308,2.2250738585072014e-308] | [-32768,0,32767,0]     | [14444,2,32,6565,3333,222] | [-32768,0,0,32767]     |
|    3 | NULL                                                    | NULL            | NULL                   | NULL                                                     | NULL                    | NULL                                                                         | NULL                   | NULL                       | NULL                   |
+------+---------------------------------------------------------+-----------------+------------------------+----------------------------------------------------------+-------------------------+------------------------------------------------------------------------------+------------------------+----------------------------+------------------------+
select *,array_sort(c7) from vtt2;
+------+---------------------------+----------+---------------------------+-----------------------------------------------------------+------------------------------------+--------------------------------------------------------------------------+----------------------+----------------------+
| id   | c1                        | c2       | c3                        | c4                                                        | c5                                 | c6                                                                       | c7                   | array_sort(c7)       |
+------+---------------------------+----------+---------------------------+-----------------------------------------------------------+------------------------------------+--------------------------------------------------------------------------+----------------------+----------------------+
|    1 | [2147483648,2147483648,0] | ["test"] | [52,0,5,0,5,3,8,7,7,67,9] | [852,9223372036854775807,775,808,2,0,9223372036854775807] | [3.402,0,1.175,1.175,1.175,1.2212] | [1.7976931348623157e308,2.2250738585072014e-308,2.2250738585072014e-308] | [88,0,32767,32767]   | [0,88,32767,32767]   |
|    2 | [87666,0,2147483647,4]    | ["test"] | [5,0,7,6,50]              | [1,100000,9223372036854775807,775,808,2,0,1]              | [3.402,0,1.175,4]                  | [1.7976931348623157e308,1.2,2.2250738585072014e-308]                     | [68,0,32767,32766,1] | [0,1,68,32766,32767] |
|    3 | NULL                      | NULL     | NULL                      | NULL                                                      | NULL                               | NULL                                                                     | NULL                 | NULL                 |
+------+---------------------------+----------+---------------------------+-----------------------------------------------------------+------------------------------------+--------------------------------------------------------------------------+----------------------+----------------------+
select *,array_sort(c5) from tt2;
+------+---------------------------+----------+---------------------------+-----------------------------------------------------------+------------------------------------+--------------------------------------------------------------------------+----------------------+------------------------------------+
| id   | c1                        | c2       | c3                        | c4                                                        | c5                                 | c6                                                                       | c7                   | array_sort(c5)                     |
+------+---------------------------+----------+---------------------------+-----------------------------------------------------------+------------------------------------+--------------------------------------------------------------------------+----------------------+------------------------------------+
|    1 | [2147483648,2147483648,0] | ["test"] | [52,0,5,0,5,3,8,7,7,67,9] | [852,9223372036854775807,775,808,2,0,9223372036854775807] | [3.402,0,1.175,1.175,1.175,1.2212] | [1.7976931348623157e308,2.2250738585072014e-308,2.2250738585072014e-308] | [88,0,32767,32767]   | [0,1.175,1.175,1.175,1.2212,3.402] |
|    2 | [87666,0,2147483647,4]    | ["test"] | [5,0,7,6,50]              | [1,100000,9223372036854775807,775,808,2,0,1]              | [3.402,0,1.175,4]                  | [1.7976931348623157e308,1.2,2.2250738585072014e-308]                     | [68,0,32767,32766,1] | [0,1.175,3.402,4]                  |
|    3 | NULL                      | NULL     | NULL                      | NULL                                                      | NULL                               | NULL                                                                     | NULL                 | NULL                               |
+------+---------------------------+----------+---------------------------+-----------------------------------------------------------+------------------------------------+--------------------------------------------------------------------------+----------------------+------------------------------------+

select *,array_sort([null,null,1,4,2,3,5,4,4,null,3,null]) from tt1;
+------+---------------------------------------------------------+-----------------+------------------------+----------------------------------------------------------+-------------------------+------------------------------------------------------------------------------+------------------------+----------------------------+---------------------------------------------------+
| id   | c1                                                      | c2              | c3                     | c4                                                       | c5                      | c6                                                                           | c7                     | c8                         | array_sort([null,null,1,4,2,3,5,4,4,null,3,null]) |
+------+---------------------------------------------------------+-----------------+------------------------+----------------------------------------------------------+-------------------------+------------------------------------------------------------------------------+------------------------+----------------------------+---------------------------------------------------+
|    1 | [-2147483648,-2147483647,0,77777]                       | ["test","test"] | [127,0,-128]           | [-9223372036854775808,9223372036854775807,775,808,2,0]   | [3.402,0,1.175]         | [1.7976931348623157e308,2.2250738585072014e-308,2.2250738585072014e-308]     | [-32768,0,32767,32767] | [5,3,2,1,4]                | [1,2,3,3,4,4,4,5,NULL,NULL,NULL,NULL]             |
|    2 | [-2147483648,0,2147483647,4,3,2,1,26,5,2147483647,NULL] | ["test",NULL]   | [-128,127,0,-128,6,77] | [-9223372036854775808,9223372036854775807,775,808,2,0,1] | [3.402,0,1.175,1.175,4] | [-1.7976931348623158e30,1.2,2.2250738585072014e-308,2.2250738585072014e-308] | [-32768,0,32767,0]     | [14444,2,32,6565,3333,222] | [1,2,3,3,4,4,4,5,NULL,NULL,NULL,NULL]             |
|    3 | NULL                                                    | NULL            | NULL                   | NULL                                                     | NULL                    | NULL                                                                         | NULL                   | NULL                       | [1,2,3,3,4,4,4,5,NULL,NULL,NULL,NULL]             |
+------+---------------------------------------------------------+-----------------+------------------------+----------------------------------------------------------+-------------------------+------------------------------------------------------------------------------+------------------------+----------------------------+---------------------------------------------------+

select /*+enable_parallel_dml parallel(3) */ array_sort(c1) from tt2;
+---------------------------+
| array_sort(c1)            |
+---------------------------+
| [0,2147483648,2147483648] |
| [0,4,87666,2147483647]    |
| NULL                      |
+---------------------------+
select /*+enable_parallel_dml parallel(3) */ array_sort(c2) from tt1;
+-----------------+
| array_sort(c2)  |
+-----------------+
| ["test","test"] |
| ["test",NULL]   |
| NULL            |
+-----------------+
select /*+enable_parallel_dml parallel(3) */ array_sort(c3) from vtt2;
+---------------------------+
| array_sort(c3)            |
+---------------------------+
| [0,0,3,5,5,7,7,8,9,52,67] |
| [0,5,6,7,50]              |
| NULL                      |
+---------------------------+
select /*+enable_parallel_dml parallel(3) */ array_sort(c4) from vtt1;
+----------------------------------------------------------+
| array_sort(c4)                                           |
+----------------------------------------------------------+
| [-9223372036854775808,0,2,775,808,9223372036854775807]   |
| [-9223372036854775808,0,1,2,775,808,9223372036854775807] |
| NULL                                                     |
+----------------------------------------------------------+


select array_sort([cast(1 as unsigned),cast(1 as unsigned)]);
+-------------------------------------------------------+
| array_sort([cast(1 as unsigned),cast(1 as unsigned)]) |
+-------------------------------------------------------+
| [1,1]                                                 |
+-------------------------------------------------------+
select array_sort([cast(null as unsigned),cast(null as unsigned)]);
+-------------------------------------------------------------+
| array_sort([cast(null as unsigned),cast(null as unsigned)]) |
+-------------------------------------------------------------+
| [NULL,NULL]                                                 |
+-------------------------------------------------------------+

select * from tt1 group by array_length(c1);
+------+---------------------------------------------------------+-----------------+------------------------+----------------------------------------------------------+-------------------------+------------------------------------------------------------------------------+------------------------+----------------------------+
| id   | c1                                                      | c2              | c3                     | c4                                                       | c5                      | c6                                                                           | c7                     | c8                         |
+------+---------------------------------------------------------+-----------------+------------------------+----------------------------------------------------------+-------------------------+------------------------------------------------------------------------------+------------------------+----------------------------+
|    1 | [-2147483648,-2147483647,0,77777]                       | ["test","test"] | [127,0,-128]           | [-9223372036854775808,9223372036854775807,775,808,2,0]   | [3.402,0,1.175]         | [1.7976931348623157e308,2.2250738585072014e-308,2.2250738585072014e-308]     | [-32768,0,32767,32767] | [5,3,2,1,4]                |
|    2 | [-2147483648,0,2147483647,4,3,2,1,26,5,2147483647,NULL] | ["test",NULL]   | [-128,127,0,-128,6,77] | [-9223372036854775808,9223372036854775807,775,808,2,0,1] | [3.402,0,1.175,1.175,4] | [-1.7976931348623158e30,1.2,2.2250738585072014e-308,2.2250738585072014e-308] | [-32768,0,32767,0]     | [14444,2,32,6565,3333,222] |
|    3 | NULL                                                    | NULL            | NULL                   | NULL                                                     | NULL                    | NULL                                                                         | NULL                   | NULL                       |
+------+---------------------------------------------------------+-----------------+------------------------+----------------------------------------------------------+-------------------------+------------------------------------------------------------------------------+------------------------+----------------------------+
select array_sort(c1) from tt1 group by array_length(c3);
+---------------------------------------------------------+
| array_sort(c1)                                          |
+---------------------------------------------------------+
| [-2147483648,-2147483647,0,77777]                       |
| [-2147483648,0,1,2,3,4,5,26,2147483647,2147483647,NULL] |
| NULL                                                    |
+---------------------------------------------------------+
select * ,array_sort(c1) from vtt1 group by id having array_length(c2)>1;
+------+---------------------------------------------------------+-----------------+------------------------+----------------------------------------------------------+-------------------------+------------------------------------------------------------------------------+------------------------+----------------------------+---------------------------------------------------------+
| id   | c1                                                      | c2              | c3                     | c4                                                       | c5                      | c6                                                                           | c7                     | c8                         | array_sort(c1)                                          |
+------+---------------------------------------------------------+-----------------+------------------------+----------------------------------------------------------+-------------------------+------------------------------------------------------------------------------+------------------------+----------------------------+---------------------------------------------------------+
|    1 | [-2147483648,-2147483647,0,77777]                       | ["test","test"] | [127,0,-128]           | [-9223372036854775808,9223372036854775807,775,808,2,0]   | [3.402,0,1.175]         | [1.7976931348623157e308,2.2250738585072014e-308,2.2250738585072014e-308]     | [-32768,0,32767,32767] | [5,3,2,1,4]                | [-2147483648,-2147483647,0,77777]                       |
|    2 | [-2147483648,0,2147483647,4,3,2,1,26,5,2147483647,NULL] | ["test",NULL]   | [-128,127,0,-128,6,77] | [-9223372036854775808,9223372036854775807,775,808,2,0,1] | [3.402,0,1.175,1.175,4] | [-1.7976931348623158e30,1.2,2.2250738585072014e-308,2.2250738585072014e-308] | [-32768,0,32767,0]     | [14444,2,32,6565,3333,222] | [-2147483648,0,1,2,3,4,5,26,2147483647,2147483647,NULL] |
+------+---------------------------------------------------------+-----------------+------------------------+----------------------------------------------------------+-------------------------+------------------------------------------------------------------------------+------------------------+----------------------------+---------------------------------------------------------+
select * ,array_sort(c5) from tt2 group by id having array_length(c4)>2;
+------+---------------------------+----------+---------------------------+-----------------------------------------------------------+------------------------------------+--------------------------------------------------------------------------+----------------------+------------------------------------+
| id   | c1                        | c2       | c3                        | c4                                                        | c5                                 | c6                                                                       | c7                   | array_sort(c5)                     |
+------+---------------------------+----------+---------------------------+-----------------------------------------------------------+------------------------------------+--------------------------------------------------------------------------+----------------------+------------------------------------+
|    1 | [2147483648,2147483648,0] | ["test"] | [52,0,5,0,5,3,8,7,7,67,9] | [852,9223372036854775807,775,808,2,0,9223372036854775807] | [3.402,0,1.175,1.175,1.175,1.2212] | [1.7976931348623157e308,2.2250738585072014e-308,2.2250738585072014e-308] | [88,0,32767,32767]   | [0,1.175,1.175,1.175,1.2212,3.402] |
|    2 | [87666,0,2147483647,4]    | ["test"] | [5,0,7,6,50]              | [1,100000,9223372036854775807,775,808,2,0,1]              | [3.402,0,1.175,4]                  | [1.7976931348623157e308,1.2,2.2250738585072014e-308]                     | [68,0,32767,32766,1] | [0,1.175,3.402,4]                  |
+------+---------------------------+----------+---------------------------+-----------------------------------------------------------+------------------------------------+--------------------------------------------------------------------------+----------------------+------------------------------------+

select * ,array_sort(c1), c1 from tt1 order by array_length(c1);
+------+---------------------------------------------------------+-----------------+------------------------+----------------------------------------------------------+-------------------------+------------------------------------------------------------------------------+------------------------+----------------------------+---------------------------------------------------------+---------------------------------------------------------+
| id   | c1                                                      | c2              | c3                     | c4                                                       | c5                      | c6                                                                           | c7                     | c8                         | array_sort(c1)                                          | c1                                                      |
+------+---------------------------------------------------------+-----------------+------------------------+----------------------------------------------------------+-------------------------+------------------------------------------------------------------------------+------------------------+----------------------------+---------------------------------------------------------+---------------------------------------------------------+
|    3 | NULL                                                    | NULL            | NULL                   | NULL                                                     | NULL                    | NULL                                                                         | NULL                   | NULL                       | NULL                                                    | NULL                                                    |
|    1 | [-2147483648,-2147483647,0,77777]                       | ["test","test"] | [127,0,-128]           | [-9223372036854775808,9223372036854775807,775,808,2,0]   | [3.402,0,1.175]         | [1.7976931348623157e308,2.2250738585072014e-308,2.2250738585072014e-308]     | [-32768,0,32767,32767] | [5,3,2,1,4]                | [-2147483648,-2147483647,0,77777]                       | [-2147483648,-2147483647,0,77777]                       |
|    2 | [-2147483648,0,2147483647,4,3,2,1,26,5,2147483647,NULL] | ["test",NULL]   | [-128,127,0,-128,6,77] | [-9223372036854775808,9223372036854775807,775,808,2,0,1] | [3.402,0,1.175,1.175,4] | [-1.7976931348623158e30,1.2,2.2250738585072014e-308,2.2250738585072014e-308] | [-32768,0,32767,0]     | [14444,2,32,6565,3333,222] | [-2147483648,0,1,2,3,4,5,26,2147483647,2147483647,NULL] | [-2147483648,0,2147483647,4,3,2,1,26,5,2147483647,NULL] |
+------+---------------------------------------------------------+-----------------+------------------------+----------------------------------------------------------+-------------------------+------------------------------------------------------------------------------+------------------------+----------------------------+---------------------------------------------------------+---------------------------------------------------------+
select * ,array_sort(c1), c1,c2 from tt1 order by array_length(c1) desc ;
+------+---------------------------------------------------------+-----------------+------------------------+----------------------------------------------------------+-------------------------+------------------------------------------------------------------------------+------------------------+----------------------------+---------------------------------------------------------+---------------------------------------------------------+-----------------+
| id   | c1                                                      | c2              | c3                     | c4                                                       | c5                      | c6                                                                           | c7                     | c8                         | array_sort(c1)                                          | c1                                                      | c2              |
+------+---------------------------------------------------------+-----------------+------------------------+----------------------------------------------------------+-------------------------+------------------------------------------------------------------------------+------------------------+----------------------------+---------------------------------------------------------+---------------------------------------------------------+-----------------+
|    2 | [-2147483648,0,2147483647,4,3,2,1,26,5,2147483647,NULL] | ["test",NULL]   | [-128,127,0,-128,6,77] | [-9223372036854775808,9223372036854775807,775,808,2,0,1] | [3.402,0,1.175,1.175,4] | [-1.7976931348623158e30,1.2,2.2250738585072014e-308,2.2250738585072014e-308] | [-32768,0,32767,0]     | [14444,2,32,6565,3333,222] | [-2147483648,0,1,2,3,4,5,26,2147483647,2147483647,NULL] | [-2147483648,0,2147483647,4,3,2,1,26,5,2147483647,NULL] | ["test",NULL]   |
|    1 | [-2147483648,-2147483647,0,77777]                       | ["test","test"] | [127,0,-128]           | [-9223372036854775808,9223372036854775807,775,808,2,0]   | [3.402,0,1.175]         | [1.7976931348623157e308,2.2250738585072014e-308,2.2250738585072014e-308]     | [-32768,0,32767,32767] | [5,3,2,1,4]                | [-2147483648,-2147483647,0,77777]                       | [-2147483648,-2147483647,0,77777]                       | ["test","test"] |
|    3 | NULL                                                    | NULL            | NULL                   | NULL                                                     | NULL                    | NULL                                                                         | NULL                   | NULL                       | NULL                                                    | NULL                                                    | NULL            |
+------+---------------------------------------------------------+-----------------+------------------------+----------------------------------------------------------+-------------------------+------------------------------------------------------------------------------+------------------------+----------------------------+---------------------------------------------------------+---------------------------------------------------------+-----------------+
select * ,array_sort(c2), c1,c2 from tt1 order by array_length(c2) asc ;
+------+---------------------------------------------------------+-----------------+------------------------+----------------------------------------------------------+-------------------------+------------------------------------------------------------------------------+------------------------+----------------------------+-----------------+---------------------------------------------------------+-----------------+
| id   | c1                                                      | c2              | c3                     | c4                                                       | c5                      | c6                                                                           | c7                     | c8                         | array_sort(c2)  | c1                                                      | c2              |
+------+---------------------------------------------------------+-----------------+------------------------+----------------------------------------------------------+-------------------------+------------------------------------------------------------------------------+------------------------+----------------------------+-----------------+---------------------------------------------------------+-----------------+
|    3 | NULL                                                    | NULL            | NULL                   | NULL                                                     | NULL                    | NULL                                                                         | NULL                   | NULL                       | NULL            | NULL                                                    | NULL            |
|    1 | [-2147483648,-2147483647,0,77777]                       | ["test","test"] | [127,0,-128]           | [-9223372036854775808,9223372036854775807,775,808,2,0]   | [3.402,0,1.175]         | [1.7976931348623157e308,2.2250738585072014e-308,2.2250738585072014e-308]     | [-32768,0,32767,32767] | [5,3,2,1,4]                | ["test","test"] | [-2147483648,-2147483647,0,77777]                       | ["test","test"] |
|    2 | [-2147483648,0,2147483647,4,3,2,1,26,5,2147483647,NULL] | ["test",NULL]   | [-128,127,0,-128,6,77] | [-9223372036854775808,9223372036854775807,775,808,2,0,1] | [3.402,0,1.175,1.175,4] | [-1.7976931348623158e30,1.2,2.2250738585072014e-308,2.2250738585072014e-308] | [-32768,0,32767,0]     | [14444,2,32,6565,3333,222] | ["test",NULL]   | [-2147483648,0,2147483647,4,3,2,1,26,5,2147483647,NULL] | ["test",NULL]   |
+------+---------------------------------------------------------+-----------------+------------------------+----------------------------------------------------------+-------------------------+------------------------------------------------------------------------------+------------------------+----------------------------+-----------------+---------------------------------------------------------+-----------------+

select * ,array_sort(c1), c1 from vtt1 order by array_length(c1);
+------+---------------------------------------------------------+-----------------+------------------------+----------------------------------------------------------+-------------------------+------------------------------------------------------------------------------+------------------------+----------------------------+---------------------------------------------------------+---------------------------------------------------------+
| id   | c1                                                      | c2              | c3                     | c4                                                       | c5                      | c6                                                                           | c7                     | c8                         | array_sort(c1)                                          | c1                                                      |
+------+---------------------------------------------------------+-----------------+------------------------+----------------------------------------------------------+-------------------------+------------------------------------------------------------------------------+------------------------+----------------------------+---------------------------------------------------------+---------------------------------------------------------+
|    3 | NULL                                                    | NULL            | NULL                   | NULL                                                     | NULL                    | NULL                                                                         | NULL                   | NULL                       | NULL                                                    | NULL                                                    |
|    1 | [-2147483648,-2147483647,0,77777]                       | ["test","test"] | [127,0,-128]           | [-9223372036854775808,9223372036854775807,775,808,2,0]   | [3.402,0,1.175]         | [1.7976931348623157e308,2.2250738585072014e-308,2.2250738585072014e-308]     | [-32768,0,32767,32767] | [5,3,2,1,4]                | [-2147483648,-2147483647,0,77777]                       | [-2147483648,-2147483647,0,77777]                       |
|    2 | [-2147483648,0,2147483647,4,3,2,1,26,5,2147483647,NULL] | ["test",NULL]   | [-128,127,0,-128,6,77] | [-9223372036854775808,9223372036854775807,775,808,2,0,1] | [3.402,0,1.175,1.175,4] | [-1.7976931348623158e30,1.2,2.2250738585072014e-308,2.2250738585072014e-308] | [-32768,0,32767,0]     | [14444,2,32,6565,3333,222] | [-2147483648,0,1,2,3,4,5,26,2147483647,2147483647,NULL] | [-2147483648,0,2147483647,4,3,2,1,26,5,2147483647,NULL] |
+------+---------------------------------------------------------+-----------------+------------------------+----------------------------------------------------------+-------------------------+------------------------------------------------------------------------------+------------------------+----------------------------+---------------------------------------------------------+---------------------------------------------------------+
select * ,array_sort(c1), c1,c2 from vtt1 order by array_length(c1) desc ;
+------+---------------------------------------------------------+-----------------+------------------------+----------------------------------------------------------+-------------------------+------------------------------------------------------------------------------+------------------------+----------------------------+---------------------------------------------------------+---------------------------------------------------------+-----------------+
| id   | c1                                                      | c2              | c3                     | c4                                                       | c5                      | c6                                                                           | c7                     | c8                         | array_sort(c1)                                          | c1                                                      | c2              |
+------+---------------------------------------------------------+-----------------+------------------------+----------------------------------------------------------+-------------------------+------------------------------------------------------------------------------+------------------------+----------------------------+---------------------------------------------------------+---------------------------------------------------------+-----------------+
|    2 | [-2147483648,0,2147483647,4,3,2,1,26,5,2147483647,NULL] | ["test",NULL]   | [-128,127,0,-128,6,77] | [-9223372036854775808,9223372036854775807,775,808,2,0,1] | [3.402,0,1.175,1.175,4] | [-1.7976931348623158e30,1.2,2.2250738585072014e-308,2.2250738585072014e-308] | [-32768,0,32767,0]     | [14444,2,32,6565,3333,222] | [-2147483648,0,1,2,3,4,5,26,2147483647,2147483647,NULL] | [-2147483648,0,2147483647,4,3,2,1,26,5,2147483647,NULL] | ["test",NULL]   |
|    1 | [-2147483648,-2147483647,0,77777]                       | ["test","test"] | [127,0,-128]           | [-9223372036854775808,9223372036854775807,775,808,2,0]   | [3.402,0,1.175]         | [1.7976931348623157e308,2.2250738585072014e-308,2.2250738585072014e-308]     | [-32768,0,32767,32767] | [5,3,2,1,4]                | [-2147483648,-2147483647,0,77777]                       | [-2147483648,-2147483647,0,77777]                       | ["test","test"] |
|    3 | NULL                                                    | NULL            | NULL                   | NULL                                                     | NULL                    | NULL                                                                         | NULL                   | NULL                       | NULL                                                    | NULL                                                    | NULL            |
+------+---------------------------------------------------------+-----------------+------------------------+----------------------------------------------------------+-------------------------+------------------------------------------------------------------------------+------------------------+----------------------------+---------------------------------------------------------+---------------------------------------------------------+-----------------+
select * ,array_sort(c2), c1,c2 from vtt1 order by array_length(c2) asc ;
+------+---------------------------------------------------------+-----------------+------------------------+----------------------------------------------------------+-------------------------+------------------------------------------------------------------------------+------------------------+----------------------------+-----------------+---------------------------------------------------------+-----------------+
| id   | c1                                                      | c2              | c3                     | c4                                                       | c5                      | c6                                                                           | c7                     | c8                         | array_sort(c2)  | c1                                                      | c2              |
+------+---------------------------------------------------------+-----------------+------------------------+----------------------------------------------------------+-------------------------+------------------------------------------------------------------------------+------------------------+----------------------------+-----------------+---------------------------------------------------------+-----------------+
|    3 | NULL                                                    | NULL            | NULL                   | NULL                                                     | NULL                    | NULL                                                                         | NULL                   | NULL                       | NULL            | NULL                                                    | NULL            |
|    1 | [-2147483648,-2147483647,0,77777]                       | ["test","test"] | [127,0,-128]           | [-9223372036854775808,9223372036854775807,775,808,2,0]   | [3.402,0,1.175]         | [1.7976931348623157e308,2.2250738585072014e-308,2.2250738585072014e-308]     | [-32768,0,32767,32767] | [5,3,2,1,4]                | ["test","test"] | [-2147483648,-2147483647,0,77777]                       | ["test","test"] |
|    2 | [-2147483648,0,2147483647,4,3,2,1,26,5,2147483647,NULL] | ["test",NULL]   | [-128,127,0,-128,6,77] | [-9223372036854775808,9223372036854775807,775,808,2,0,1] | [3.402,0,1.175,1.175,4] | [-1.7976931348623158e30,1.2,2.2250738585072014e-308,2.2250738585072014e-308] | [-32768,0,32767,0]     | [14444,2,32,6565,3333,222] | ["test",NULL]   | [-2147483648,0,2147483647,4,3,2,1,26,5,2147483647,NULL] | ["test",NULL]   |
+------+---------------------------------------------------------+-----------------+------------------------+----------------------------------------------------------+-------------------------+------------------------------------------------------------------------------+------------------------+----------------------------+-----------------+---------------------------------------------------------+-----------------+

select * ,array_sort(c1), c1 from tt2 where id=1 order by array_length(c1);
+------+---------------------------+----------+---------------------------+-----------------------------------------------------------+------------------------------------+--------------------------------------------------------------------------+--------------------+---------------------------+---------------------------+
| id   | c1                        | c2       | c3                        | c4                                                        | c5                                 | c6                                                                       | c7                 | array_sort(c1)            | c1                        |
+------+---------------------------+----------+---------------------------+-----------------------------------------------------------+------------------------------------+--------------------------------------------------------------------------+--------------------+---------------------------+---------------------------+
|    1 | [2147483648,2147483648,0] | ["test"] | [52,0,5,0,5,3,8,7,7,67,9] | [852,9223372036854775807,775,808,2,0,9223372036854775807] | [3.402,0,1.175,1.175,1.175,1.2212] | [1.7976931348623157e308,2.2250738585072014e-308,2.2250738585072014e-308] | [88,0,32767,32767] | [0,2147483648,2147483648] | [2147483648,2147483648,0] |
+------+---------------------------+----------+---------------------------+-----------------------------------------------------------+------------------------------------+--------------------------------------------------------------------------+--------------------+---------------------------+---------------------------+
select * ,array_sort(c1), c1,c2 from tt2 where id=1  order by array_length(c1) desc ;
+------+---------------------------+----------+---------------------------+-----------------------------------------------------------+------------------------------------+--------------------------------------------------------------------------+--------------------+---------------------------+---------------------------+----------+
| id   | c1                        | c2       | c3                        | c4                                                        | c5                                 | c6                                                                       | c7                 | array_sort(c1)            | c1                        | c2       |
+------+---------------------------+----------+---------------------------+-----------------------------------------------------------+------------------------------------+--------------------------------------------------------------------------+--------------------+---------------------------+---------------------------+----------+
|    1 | [2147483648,2147483648,0] | ["test"] | [52,0,5,0,5,3,8,7,7,67,9] | [852,9223372036854775807,775,808,2,0,9223372036854775807] | [3.402,0,1.175,1.175,1.175,1.2212] | [1.7976931348623157e308,2.2250738585072014e-308,2.2250738585072014e-308] | [88,0,32767,32767] | [0,2147483648,2147483648] | [2147483648,2147483648,0] | ["test"] |
+------+---------------------------+----------+---------------------------+-----------------------------------------------------------+------------------------------------+--------------------------------------------------------------------------+--------------------+---------------------------+---------------------------+----------+
select * ,array_sort(c2), c1,c2 from tt2  where id=1  order by array_length(c5) asc ;
+------+---------------------------+----------+---------------------------+-----------------------------------------------------------+------------------------------------+--------------------------------------------------------------------------+--------------------+----------------+---------------------------+----------+
| id   | c1                        | c2       | c3                        | c4                                                        | c5                                 | c6                                                                       | c7                 | array_sort(c2) | c1                        | c2       |
+------+---------------------------+----------+---------------------------+-----------------------------------------------------------+------------------------------------+--------------------------------------------------------------------------+--------------------+----------------+---------------------------+----------+
|    1 | [2147483648,2147483648,0] | ["test"] | [52,0,5,0,5,3,8,7,7,67,9] | [852,9223372036854775807,775,808,2,0,9223372036854775807] | [3.402,0,1.175,1.175,1.175,1.2212] | [1.7976931348623157e308,2.2250738585072014e-308,2.2250738585072014e-308] | [88,0,32767,32767] | ["test"]       | [2147483648,2147483648,0] | ["test"] |
+------+---------------------------+----------+---------------------------+-----------------------------------------------------------+------------------------------------+--------------------------------------------------------------------------+--------------------+----------------+---------------------------+----------+
select * ,array_sort(c1), c1 from vtt2 where id=1 order by array_length(c1);
+------+---------------------------+----------+---------------------------+-----------------------------------------------------------+------------------------------------+--------------------------------------------------------------------------+--------------------+---------------------------+---------------------------+
| id   | c1                        | c2       | c3                        | c4                                                        | c5                                 | c6                                                                       | c7                 | array_sort(c1)            | c1                        |
+------+---------------------------+----------+---------------------------+-----------------------------------------------------------+------------------------------------+--------------------------------------------------------------------------+--------------------+---------------------------+---------------------------+
|    1 | [2147483648,2147483648,0] | ["test"] | [52,0,5,0,5,3,8,7,7,67,9] | [852,9223372036854775807,775,808,2,0,9223372036854775807] | [3.402,0,1.175,1.175,1.175,1.2212] | [1.7976931348623157e308,2.2250738585072014e-308,2.2250738585072014e-308] | [88,0,32767,32767] | [0,2147483648,2147483648] | [2147483648,2147483648,0] |
+------+---------------------------+----------+---------------------------+-----------------------------------------------------------+------------------------------------+--------------------------------------------------------------------------+--------------------+---------------------------+---------------------------+
select * ,array_sort(c1), c1,c2 from vtt2 where id=1  order by array_length(c1) desc ;
+------+---------------------------+----------+---------------------------+-----------------------------------------------------------+------------------------------------+--------------------------------------------------------------------------+--------------------+---------------------------+---------------------------+----------+
| id   | c1                        | c2       | c3                        | c4                                                        | c5                                 | c6                                                                       | c7                 | array_sort(c1)            | c1                        | c2       |
+------+---------------------------+----------+---------------------------+-----------------------------------------------------------+------------------------------------+--------------------------------------------------------------------------+--------------------+---------------------------+---------------------------+----------+
|    1 | [2147483648,2147483648,0] | ["test"] | [52,0,5,0,5,3,8,7,7,67,9] | [852,9223372036854775807,775,808,2,0,9223372036854775807] | [3.402,0,1.175,1.175,1.175,1.2212] | [1.7976931348623157e308,2.2250738585072014e-308,2.2250738585072014e-308] | [88,0,32767,32767] | [0,2147483648,2147483648] | [2147483648,2147483648,0] | ["test"] |
+------+---------------------------+----------+---------------------------+-----------------------------------------------------------+------------------------------------+--------------------------------------------------------------------------+--------------------+---------------------------+---------------------------+----------+
select * ,array_sort(c2), c1,c2 from vtt2  where id=1  order by array_length(c2) asc ;
+------+---------------------------+----------+---------------------------+-----------------------------------------------------------+------------------------------------+--------------------------------------------------------------------------+--------------------+----------------+---------------------------+----------+
| id   | c1                        | c2       | c3                        | c4                                                        | c5                                 | c6                                                                       | c7                 | array_sort(c2) | c1                        | c2       |
+------+---------------------------+----------+---------------------------+-----------------------------------------------------------+------------------------------------+--------------------------------------------------------------------------+--------------------+----------------+---------------------------+----------+
|    1 | [2147483648,2147483648,0] | ["test"] | [52,0,5,0,5,3,8,7,7,67,9] | [852,9223372036854775807,775,808,2,0,9223372036854775807] | [3.402,0,1.175,1.175,1.175,1.2212] | [1.7976931348623157e308,2.2250738585072014e-308,2.2250738585072014e-308] | [88,0,32767,32767] | ["test"]       | [2147483648,2147483648,0] | ["test"] |
+------+---------------------------+----------+---------------------------+-----------------------------------------------------------+------------------------------------+--------------------------------------------------------------------------+--------------------+----------------+---------------------------+----------+

select distinct array_sort(c1) from tt1;
ERROR 22000: Invalid data type for the operation

select cast(array_sort(c4) as unsigned) from tt1;
ERROR 22000: Invalid data type for the operation
select cast(array_sort(c4) as point) from 
tt1;
ERROR 22000: Invalid data type for the operation
select cast(array_sort(c4) as json) from tt1;
ERROR 22000: Invalid data type for the operation
select cast(array_sort(c4) as roaringbitmap) from tt1;
ERROR 22000: Invalid data type for the operation

select * ,array_sort(c1) from tt1 where array_length(c1) = 4;
+------+-----------------------------------+-----------------+--------------+--------------------------------------------------------+-----------------+--------------------------------------------------------------------------+------------------------+-------------+-----------------------------------+
| id   | c1                                | c2              | c3           | c4                                                     | c5              | c6                                                                       | c7                     | c8          | array_sort(c1)                    |
+------+-----------------------------------+-----------------+--------------+--------------------------------------------------------+-----------------+--------------------------------------------------------------------------+------------------------+-------------+-----------------------------------+
|    1 | [-2147483648,-2147483647,0,77777] | ["test","test"] | [127,0,-128] | [-9223372036854775808,9223372036854775807,775,808,2,0] | [3.402,0,1.175] | [1.7976931348623157e308,2.2250738585072014e-308,2.2250738585072014e-308] | [-32768,0,32767,32767] | [5,3,2,1,4] | [-2147483648,-2147483647,0,77777] |
+------+-----------------------------------+-----------------+--------------+--------------------------------------------------------+-----------------+--------------------------------------------------------------------------+------------------------+-------------+-----------------------------------+
select * from tt1 where array_sort(c2) = array_sort(c2);
+------+---------------------------------------------------------+-----------------+------------------------+----------------------------------------------------------+-------------------------+------------------------------------------------------------------------------+------------------------+----------------------------+
| id   | c1                                                      | c2              | c3                     | c4                                                       | c5                      | c6                                                                           | c7                     | c8                         |
+------+---------------------------------------------------------+-----------------+------------------------+----------------------------------------------------------+-------------------------+------------------------------------------------------------------------------+------------------------+----------------------------+
|    1 | [-2147483648,-2147483647,0,77777]                       | ["test","test"] | [127,0,-128]           | [-9223372036854775808,9223372036854775807,775,808,2,0]   | [3.402,0,1.175]         | [1.7976931348623157e308,2.2250738585072014e-308,2.2250738585072014e-308]     | [-32768,0,32767,32767] | [5,3,2,1,4]                |
|    2 | [-2147483648,0,2147483647,4,3,2,1,26,5,2147483647,NULL] | ["test",NULL]   | [-128,127,0,-128,6,77] | [-9223372036854775808,9223372036854775807,775,808,2,0,1] | [3.402,0,1.175,1.175,4] | [-1.7976931348623158e30,1.2,2.2250738585072014e-308,2.2250738585072014e-308] | [-32768,0,32767,0]     | [14444,2,32,6565,3333,222] |
+------+---------------------------------------------------------+-----------------+------------------------+----------------------------------------------------------+-------------------------+------------------------------------------------------------------------------+------------------------+----------------------------+
select * from tt1 where array_sort(c8) = [1,2,3,4,5];
+------+-----------------------------------+-----------------+--------------+--------------------------------------------------------+-----------------+--------------------------------------------------------------------------+------------------------+-------------+
| id   | c1                                | c2              | c3           | c4                                                     | c5              | c6                                                                       | c7                     | c8          |
+------+-----------------------------------+-----------------+--------------+--------------------------------------------------------+-----------------+--------------------------------------------------------------------------+------------------------+-------------+
|    1 | [-2147483648,-2147483647,0,77777] | ["test","test"] | [127,0,-128] | [-9223372036854775808,9223372036854775807,775,808,2,0] | [3.402,0,1.175] | [1.7976931348623157e308,2.2250738585072014e-308,2.2250738585072014e-308] | [-32768,0,32767,32767] | [5,3,2,1,4] |
+------+-----------------------------------+-----------------+--------------+--------------------------------------------------------+-----------------+--------------------------------------------------------------------------+------------------------+-------------+
select * from tt1 where array_sort(c8) <>[1,2,3,4,5];
+------+---------------------------------------------------------+---------------+------------------------+----------------------------------------------------------+-------------------------+------------------------------------------------------------------------------+--------------------+----------------------------+
| id   | c1                                                      | c2            | c3                     | c4                                                       | c5                      | c6                                                                           | c7                 | c8                         |
+------+---------------------------------------------------------+---------------+------------------------+----------------------------------------------------------+-------------------------+------------------------------------------------------------------------------+--------------------+----------------------------+
|    2 | [-2147483648,0,2147483647,4,3,2,1,26,5,2147483647,NULL] | ["test",NULL] | [-128,127,0,-128,6,77] | [-9223372036854775808,9223372036854775807,775,808,2,0,1] | [3.402,0,1.175,1.175,4] | [-1.7976931348623158e30,1.2,2.2250738585072014e-308,2.2250738585072014e-308] | [-32768,0,32767,0] | [14444,2,32,6565,3333,222] |
+------+---------------------------------------------------------+---------------+------------------------+----------------------------------------------------------+-------------------------+------------------------------------------------------------------------------+--------------------+----------------------------+
select * from tt1 where array_sort(c8) !=[1,2,3,4,5];
+------+---------------------------------------------------------+---------------+------------------------+----------------------------------------------------------+-------------------------+------------------------------------------------------------------------------+--------------------+----------------------------+
| id   | c1                                                      | c2            | c3                     | c4                                                       | c5                      | c6                                                                           | c7                 | c8                         |
+------+---------------------------------------------------------+---------------+------------------------+----------------------------------------------------------+-------------------------+------------------------------------------------------------------------------+--------------------+----------------------------+
|    2 | [-2147483648,0,2147483647,4,3,2,1,26,5,2147483647,NULL] | ["test",NULL] | [-128,127,0,-128,6,77] | [-9223372036854775808,9223372036854775807,775,808,2,0,1] | [3.402,0,1.175,1.175,4] | [-1.7976931348623158e30,1.2,2.2250738585072014e-308,2.2250738585072014e-308] | [-32768,0,32767,0] | [14444,2,32,6565,3333,222] |
+------+---------------------------------------------------------+---------------+------------------------+----------------------------------------------------------+-------------------------+------------------------------------------------------------------------------+--------------------+----------------------------+
select * from tt1 where array_sort(c8)!= [cardinality([1,2,3,4,5])];
+------+---------------------------------------------------------+-----------------+------------------------+----------------------------------------------------------+-------------------------+------------------------------------------------------------------------------+------------------------+----------------------------+
| id   | c1                                                      | c2              | c3                     | c4                                                       | c5                      | c6                                                                           | c7                     | c8                         |
+------+---------------------------------------------------------+-----------------+------------------------+----------------------------------------------------------+-------------------------+------------------------------------------------------------------------------+------------------------+----------------------------+
|    1 | [-2147483648,-2147483647,0,77777]                       | ["test","test"] | [127,0,-128]           | [-9223372036854775808,9223372036854775807,775,808,2,0]   | [3.402,0,1.175]         | [1.7976931348623157e308,2.2250738585072014e-308,2.2250738585072014e-308]     | [-32768,0,32767,32767] | [5,3,2,1,4]                |
|    2 | [-2147483648,0,2147483647,4,3,2,1,26,5,2147483647,NULL] | ["test",NULL]   | [-128,127,0,-128,6,77] | [-9223372036854775808,9223372036854775807,775,808,2,0,1] | [3.402,0,1.175,1.175,4] | [-1.7976931348623158e30,1.2,2.2250738585072014e-308,2.2250738585072014e-308] | [-32768,0,32767,0]     | [14444,2,32,6565,3333,222] |
+------+---------------------------------------------------------+-----------------+------------------------+----------------------------------------------------------+-------------------------+------------------------------------------------------------------------------+------------------------+----------------------------+
select * from tt1 where array_length(array_sort(c5)) BETWEEN array_length(c2) AND array_length(c1);
+------+---------------------------------------------------------+-----------------+------------------------+----------------------------------------------------------+-------------------------+------------------------------------------------------------------------------+------------------------+----------------------------+
| id   | c1                                                      | c2              | c3                     | c4                                                       | c5                      | c6                                                                           | c7                     | c8                         |
+------+---------------------------------------------------------+-----------------+------------------------+----------------------------------------------------------+-------------------------+------------------------------------------------------------------------------+------------------------+----------------------------+
|    1 | [-2147483648,-2147483647,0,77777]                       | ["test","test"] | [127,0,-128]           | [-9223372036854775808,9223372036854775807,775,808,2,0]   | [3.402,0,1.175]         | [1.7976931348623157e308,2.2250738585072014e-308,2.2250738585072014e-308]     | [-32768,0,32767,32767] | [5,3,2,1,4]                |
|    2 | [-2147483648,0,2147483647,4,3,2,1,26,5,2147483647,NULL] | ["test",NULL]   | [-128,127,0,-128,6,77] | [-9223372036854775808,9223372036854775807,775,808,2,0,1] | [3.402,0,1.175,1.175,4] | [-1.7976931348623158e30,1.2,2.2250738585072014e-308,2.2250738585072014e-308] | [-32768,0,32767,0]     | [14444,2,32,6565,3333,222] |
+------+---------------------------------------------------------+-----------------+------------------------+----------------------------------------------------------+-------------------------+------------------------------------------------------------------------------+------------------------+----------------------------+

select * from tt1 where array_length(c1) like array_length(c1);
+------+---------------------------------------------------------+-----------------+------------------------+----------------------------------------------------------+-------------------------+------------------------------------------------------------------------------+------------------------+----------------------------+
| id   | c1                                                      | c2              | c3                     | c4                                                       | c5                      | c6                                                                           | c7                     | c8                         |
+------+---------------------------------------------------------+-----------------+------------------------+----------------------------------------------------------+-------------------------+------------------------------------------------------------------------------+------------------------+----------------------------+
|    1 | [-2147483648,-2147483647,0,77777]                       | ["test","test"] | [127,0,-128]           | [-9223372036854775808,9223372036854775807,775,808,2,0]   | [3.402,0,1.175]         | [1.7976931348623157e308,2.2250738585072014e-308,2.2250738585072014e-308]     | [-32768,0,32767,32767] | [5,3,2,1,4]                |
|    2 | [-2147483648,0,2147483647,4,3,2,1,26,5,2147483647,NULL] | ["test",NULL]   | [-128,127,0,-128,6,77] | [-9223372036854775808,9223372036854775807,775,808,2,0,1] | [3.402,0,1.175,1.175,4] | [-1.7976931348623158e30,1.2,2.2250738585072014e-308,2.2250738585072014e-308] | [-32768,0,32767,0]     | [14444,2,32,6565,3333,222] |
+------+---------------------------------------------------------+-----------------+------------------------+----------------------------------------------------------+-------------------------+------------------------------------------------------------------------------+------------------------+----------------------------+
select * from tt1 where array_length(c1) not like array_length(c1);
+------+------+------+------+------+------+------+------+------+
| id   | c1   | c2   | c3   | c4   | c5   | c6   | c7   | c8   |
+------+------+------+------+------+------+------+------+------+
+------+------+------+------+------+------+------+------+------+

select * from tt1 where array_sort(c8) is not null;
+------+---------------------------------------------------------+-----------------+------------------------+----------------------------------------------------------+-------------------------+------------------------------------------------------------------------------+------------------------+----------------------------+
| id   | c1                                                      | c2              | c3                     | c4                                                       | c5                      | c6                                                                           | c7                     | c8                         |
+------+---------------------------------------------------------+-----------------+------------------------+----------------------------------------------------------+-------------------------+------------------------------------------------------------------------------+------------------------+----------------------------+
|    1 | [-2147483648,-2147483647,0,77777]                       | ["test","test"] | [127,0,-128]           | [-9223372036854775808,9223372036854775807,775,808,2,0]   | [3.402,0,1.175]         | [1.7976931348623157e308,2.2250738585072014e-308,2.2250738585072014e-308]     | [-32768,0,32767,32767] | [5,3,2,1,4]                |
|    2 | [-2147483648,0,2147483647,4,3,2,1,26,5,2147483647,NULL] | ["test",NULL]   | [-128,127,0,-128,6,77] | [-9223372036854775808,9223372036854775807,775,808,2,0,1] | [3.402,0,1.175,1.175,4] | [-1.7976931348623158e30,1.2,2.2250738585072014e-308,2.2250738585072014e-308] | [-32768,0,32767,0]     | [14444,2,32,6565,3333,222] |
+------+---------------------------------------------------------+-----------------+------------------------+----------------------------------------------------------+-------------------------+------------------------------------------------------------------------------+------------------------+----------------------------+
select * from tt1 where array_sort(c8) is null;
+------+------+------+------+------+------+------+------+------+
| id   | c1   | c2   | c3   | c4   | c5   | c6   | c7   | c8   |
+------+------+------+------+------+------+------+------+------+
|    3 | NULL | NULL | NULL | NULL | NULL | NULL | NULL | NULL |
+------+------+------+------+------+------+------+------+------+

drop table tt3;
create table tt3(id int,id1 INTEGER unsigned,id2 BOOL,id3 SMALLINT unsigned,id4 MEDIUMINT,id5 SERIAL,id6 BIGINT);
insert into tt3 values(1,2,3,4,5,6,7);
select array_sort(id) from tt3;
ERROR 22000: invalid obj type for type promotion: left_type=ARRAY right_type=INT
select array_sort(id1) from tt3;
ERROR 22000: invalid obj type for type promotion: left_type=ARRAY right_type=INT UNSIGNED
select array_sort(id2) from tt3;
ERROR 22000: invalid obj type for type promotion: left_type=ARRAY right_type=TINYINT
select array_sort(id3) from tt3;
ERROR 22000: invalid obj type for type promotion: left_type=ARRAY right_type=SMALLINT UNSIGNED

drop table tt3;
create table tt3(id date,id1 datetime,id2 timestamp,id3 time,id4 year);
insert into tt3 values('2010-1-1','2010-10-1 14:58:00','2010-10-1 14:58:00.9999','14:14:50','2010');

select array_sort(id) from tt3;
ERROR 22000: invalid obj type for type promotion: left_type=ARRAY right_type=MYSQL_DATE
select array_sort(id1) from tt3;
ERROR 22000: invalid obj type for type promotion: left_type=ARRAY right_type=MYSQL_DATETIME
select array_sort(id2) from tt3;
ERROR 22000: invalid obj type for type promotion: left_type=ARRAY right_type=TIMESTAMP
select array_sort(id3) from tt3;
ERROR 22000: invalid obj type for type promotion: left_type=ARRAY right_type=TIME
select array_sort([1,2,3,id4]) from tt3;
ERROR 0A000: array element type not supported

drop table tt3;
create table tt3(id TINYTEXT,id1 TEXT,id2 MEDIUMTEXT,id3 LONGTEXT);
insert into tt3 values('[1]','[2]','[3]','[4]');

select array_sort(id) from tt3;
ERROR 22000: invalid obj type for type promotion: left_type=ARRAY right_type=TINYTEXT
select array_sort(id1) from tt3;
ERROR 22000: invalid obj type for type promotion: left_type=ARRAY right_type=TEXT
select array_sort(id2) from tt3;
ERROR 22000: invalid obj type for type promotion: left_type=ARRAY right_type=MEDIUMTEXT
select array_sort([1,3,id3]) from tt3;
ERROR 0A000: array element type not supported

drop table tt3;
create table tt3(id DECIMAL,id1 DECIMAL ZEROFILL,id2 NUMERIC,id3 FIXED unsigned,id4 FIXED,id5 NUMERIC unsigned);
insert into tt3 values(1,2,3,4,5,6);
select array_sort(id)from tt3;
ERROR 22000: invalid obj type for type promotion: left_type=ARRAY right_type=DECIMAL
select array_sort(id1) from  tt3;
ERROR 22000: invalid obj type for type promotion: left_type=ARRAY right_type=DECIMAL UNSIGNED
select array_sort(id2) from tt3;
ERROR 22000: invalid obj type for type promotion: left_type=ARRAY right_type=DECIMAL
select array_sort(id3) from tt3;
ERROR 22000: invalid obj type for type promotion: left_type=ARRAY right_type=DECIMAL UNSIGNED
select array_sort(id4) from tt3;
ERROR 22000: invalid obj type for type promotion: left_type=ARRAY right_type=DECIMAL
select array_sort(id5) from tt3;
ERROR 22000: invalid obj type for type promotion: left_type=ARRAY right_type=DECIMAL UNSIGNED
select array_sort([1]) from tt3;
+-----------------+
| array_sort([1]) |
+-----------------+
| [1]             |
+-----------------+

drop table tt3;
create table tt3(id char(50),id1 varchar(50),id2 binary(50),id3 varbinary(50));
insert into tt3 values(1,2,3,4);

select array_sort(id) from tt3;
ERROR 22000: invalid obj type for type promotion: left_type=ARRAY right_type=CHAR
select array_sort(id1) from tt3;
ERROR 22000: invalid obj type for type promotion: left_type=ARRAY right_type=VARCHAR
select array_sort(id2) from tt3;
ERROR 22000: invalid obj type for type promotion: left_type=ARRAY right_type=CHAR
select array_sort(id3) from tt3;
ERROR 22000: invalid obj type for type promotion: left_type=ARRAY right_type=VARCHAR

drop table tt3;
create table tt3(id int,a int[]);
insert into tt3 values(1,[1,4,3,2,3,2]);
insert into tt3 values(2,[6,5,7,7,null]);
insert into tt3 values(3,[5,7,6,2,3,1]);
drop table tt4;
create table tt4(id int,a int[]);
insert into tt4 values(1,[1,4,3,2,3,2]);
insert into tt4 values(2,[5,7,6,1,2,null]);
insert into tt4 values(3,[9]);

select t3.* ,array_sort(t3.a) from tt3 t3 inner join tt4 t4 on array_sort(t3.a)=array_sort(t4.a);
+------+---------------+------------------+
| id   | a             | array_sort(t3.a) |
+------+---------------+------------------+
|    1 | [1,4,3,2,3,2] | [1,2,2,3,3,4]    |
+------+---------------+------------------+
select t3.* ,array_sort(t3.a) from tt3 t3 inner join tt4 t4 on array_sort(t3.a)=array_sort(t4.a);
+------+---------------+------------------+
| id   | a             | array_sort(t3.a) |
+------+---------------+------------------+
|    1 | [1,4,3,2,3,2] | [1,2,2,3,3,4]    |
+------+---------------+------------------+
select t3.* ,array_sort(t4.a) from tt3 t3 right join tt4 t4 on array_sort(t3.a)=array_sort(t4.a);
+------+---------------+------------------+
| id   | a             | array_sort(t4.a) |
+------+---------------+------------------+
|    1 | [1,4,3,2,3,2] | [1,2,2,3,3,4]    |
| NULL | NULL          | [9]              |
| NULL | NULL          | [1,2,5,6,7,NULL] |
+------+---------------+------------------+
select t3.* ,array_sort(t4.a) from tt3 t3 full join tt4 t4 on array_sort(t3.a)=array_sort(t4.a);
+------+----------------+------------------+
| id   | a              | array_sort(t4.a) |
+------+----------------+------------------+
|    1 | [1,4,3,2,3,2]  | [1,2,2,3,3,4]    |
|    2 | [6,5,7,7,NULL] | NULL             |
|    3 | [5,7,6,2,3,1]  | NULL             |
| NULL | NULL           | [9]              |
| NULL | NULL           | [1,2,5,6,7,NULL] |
+------+----------------+------------------+
select array_sort(tt3.a) from tt3;
+-------------------+
| array_sort(tt3.a) |
+-------------------+
| [1,2,2,3,3,4]     |
| [5,6,7,7,NULL]    |
| [1,2,3,5,6,7]     |
+-------------------+

select * from tt3 union select * from tt4;
+------+------------------+
| id   | a                |
+------+------------------+
|    1 | [1,4,3,2,3,2]    |
|    2 | [6,5,7,7,NULL]   |
|    3 | [5,7,6,2,3,1]    |
|    2 | [5,7,6,1,2,NULL] |
|    3 | [9]              |
+------+------------------+
(select array_sort(t3.a) from tt3 t3) union distinct(select array_sort(t4.a) from tt4 t4);
+------------------+
| array_sort(t3.a) |
+------------------+
| [1,2,2,3,3,4]    |
| [5,6,7,7,NULL]   |
| [1,2,3,5,6,7]    |
| [1,2,5,6,7,NULL] |
| [9]              |
+------------------+

drop table tt1;
create table tt1(id int,c1 array(int), c2 array(varchar(256)), c3 array(tinyint), c4 array(bigint), c5 array(float), c6 array(double), c7 array(smallint),c8 array(int));
insert into tt1 values(1,[-2147483648,-2147483647,0,77777],['test','test'],[127,0,-128],[-9223372036854775808,9223372036854775807,775,808,2,0],[3.402, 0, 1.175],
[1.7976931348623157E+308, 2.2250738585072014E-308,2.2250738585072014E-308],[-32768,0,32767,32767],[5,3,2,1,4]);

insert into tt1 values(2,[-2147483648,0, 2147483647,4,3,2,1,26,5,2147483647,null],['test',null],[-128,127,0,-128,6,77],[-9223372036854775808,9223372036854775807,775,808,2,0,1],[3.402, 0, 1.175, 1.175, 4],
[-1.7976931348623157E+30,1.2,2.2250738585072014E-308,2.2250738585072014E-308],[-32768,0,32767,0],[14444,2,32,6565,3333,222]);
insert into tt1 values(3,null,null,null,null,null,null,null,null);

drop view vtt1;
create view vtt1 as select * from tt1;

drop table tt2;
create table tt2(id int,c1 array(int unsigned), c2 array(varchar(256)), c3 array(tinyint unsigned), c4 array(bigint unsigned), c5 array(float), c6 array(double), c7 array(smallint unsigned))
PARTITION BY range COLUMNS(id)(
PARTITION p0 values less than(19),
PARTITION p1 values less than(25),
PARTITION p2 values less than(30)
);
insert into tt2 values(1,[2147483648, 2147483648,0],['test'],[52,0,5,0,5,3,8,7,7,67,9],[ 852,9223372036854775807,775,808,2,0,9223372036854775807],[3.402, 0, 1.175,1.175,1.1750001,1.2212],
[1.7976931348623157E+308, 2.2250738585072014E-308,2.2250738585072014E-308],[88,0,32767,32767]);

insert into tt2 values(2,[87666,0, 2147483647,4],['test'],[5,0,7,6,50],[1,100000,9223372036854775807,775,808,2,0,1],[3.402, 0, 1.175,4],
[1.7976931348623157E+308,1.2,2.2250738585072014E-308],[68,0,32767,32766,1]);
insert into tt2 values(3,null,null,null,null,null,null,null);

drop view vtt2;
create view vtt2 as select * from tt2;

select * from (select array_sort(c1) from tt1);
+---------------------------------------------------------+
| array_sort(c1)                                          |
+---------------------------------------------------------+
| [-2147483648,-2147483647,0,77777]                       |
| [-2147483648,0,1,2,3,4,5,26,2147483647,2147483647,NULL] |
| NULL                                                    |
+---------------------------------------------------------+
select * from ( select array_sort([1,4,3,2,1,2,4,3,4,3,5]));
+-------------------------------------+
| array_sort([1,4,3,2,1,2,4,3,4,3,5]) |
+-------------------------------------+
| [1,1,2,2,3,3,3,4,4,4,5]             |
+-------------------------------------+
select * from tt1 where id > any(select array_length(array_sort([4,3])));
+------+------+------+------+------+------+------+------+------+
| id   | c1   | c2   | c3   | c4   | c5   | c6   | c7   | c8   |
+------+------+------+------+------+------+------+------+------+
|    3 | NULL | NULL | NULL | NULL | NULL | NULL | NULL | NULL |
+------+------+------+------+------+------+------+------+------+

select * from tt1 where c1 !=any(select array_sort(c3));
ERROR 22000: Invalid data type for the operation
select * from tt1 where c1 !=some(select array_sort(c5));
ERROR 22000: Invalid data type for the operation
select * from tt1 where c1 =all(select array_sort([2,2,3]));
ERROR 22000: Invalid data type for the operation

select /*+enable_parallel_dml parallel(2) */ array_sortby((x) -> (x=x),c1) from tt1;
+---------------------------------------------------------+
| array_sortby((x) -> (x=x),c1)                           |
+---------------------------------------------------------+
| [-2147483648,-2147483647,0,77777]                       |
| [-2147483648,0,2147483647,4,3,2,1,26,5,2147483647,NULL] |
| NULL                                                    |
+---------------------------------------------------------+
select /*+enable_parallel_dml parallel(2) */ array_sortby((x) -> (x=x),c1) from vtt1;
+---------------------------------------------------------+
| array_sortby((x) -> (x=x),c1)                           |
+---------------------------------------------------------+
| [-2147483648,-2147483647,0,77777]                       |
| [-2147483648,0,2147483647,4,3,2,1,26,5,2147483647,NULL] |
| NULL                                                    |
+---------------------------------------------------------+
select /*+enable_parallel_dml parallel(2) */ array_sortby((x) -> (x=x),c1) from tt2;
+-------------------------------+
| array_sortby((x) -> (x=x),c1) |
+-------------------------------+
| [2147483648,2147483648,0]     |
| [87666,0,2147483647,4]        |
| NULL                          |
+-------------------------------+
select /*+enable_parallel_dml parallel(2) */ array_sortby((x) -> (x=x),c1) from vtt2;
+-------------------------------+
| array_sortby((x) -> (x=x),c1) |
+-------------------------------+
| [2147483648,2147483648,0]     |
| [87666,0,2147483647,4]        |
| NULL                          |
+-------------------------------+
select /*+enable_parallel_dml parallel(2) */ array_sortby((x) -> (x=x),c2) from tt1;
+-------------------------------+
| array_sortby((x) -> (x=x),c2) |
+-------------------------------+
| ["test","test"]               |
| ["test",NULL]                 |
| NULL                          |
+-------------------------------+
select /*+enable_parallel_dml parallel(2) */ array_sortby((x) -> (x=x),c2) from vtt1;
+-------------------------------+
| array_sortby((x) -> (x=x),c2) |
+-------------------------------+
| ["test","test"]               |
| ["test",NULL]                 |
| NULL                          |
+-------------------------------+
select /*+enable_parallel_dml parallel(2) */ array_sortby((x) -> (x=x),c2) from tt2;
+-------------------------------+
| array_sortby((x) -> (x=x),c2) |
+-------------------------------+
| ["test"]                      |
| ["test"]                      |
| NULL                          |
+-------------------------------+
select /*+enable_parallel_dml parallel(2) */ array_sortby((x) -> (x=x),c2) from vtt2;
+-------------------------------+
| array_sortby((x) -> (x=x),c2) |
+-------------------------------+
| ["test"]                      |
| ["test"]                      |
| NULL                          |
+-------------------------------+
select /*+enable_parallel_dml parallel(2) */ array_sortby((x) -> (x=x),c3) from tt1;
+-------------------------------+
| array_sortby((x) -> (x=x),c3) |
+-------------------------------+
| [127,0,-128]                  |
| [-128,127,0,-128,6,77]        |
| NULL                          |
+-------------------------------+
select /*+enable_parallel_dml parallel(2) */ array_sortby((x) -> (x=x),c3) from vtt1;
+-------------------------------+
| array_sortby((x) -> (x=x),c3) |
+-------------------------------+
| [127,0,-128]                  |
| [-128,127,0,-128,6,77]        |
| NULL                          |
+-------------------------------+
select /*+enable_parallel_dml parallel(2) */ array_sortby((x) -> (x=x),c3) from tt2;
+-------------------------------+
| array_sortby((x) -> (x=x),c3) |
+-------------------------------+
| [52,0,5,0,5,3,8,7,7,67,9]     |
| [5,0,7,6,50]                  |
| NULL                          |
+-------------------------------+
select /*+enable_parallel_dml parallel(2) */ array_sortby((x) -> (x=x),c3) from vtt2;
+-------------------------------+
| array_sortby((x) -> (x=x),c3) |
+-------------------------------+
| [52,0,5,0,5,3,8,7,7,67,9]     |
| [5,0,7,6,50]                  |
| NULL                          |
+-------------------------------+
select /*+enable_parallel_dml parallel(2) */ array_sortby((x) -> (x=x),c4) from tt1;
+----------------------------------------------------------+
| array_sortby((x) -> (x=x),c4)                            |
+----------------------------------------------------------+
| [-9223372036854775808,9223372036854775807,775,808,2,0]   |
| [-9223372036854775808,9223372036854775807,775,808,2,0,1] |
| NULL                                                     |
+----------------------------------------------------------+
select /*+enable_parallel_dml parallel(2) */ array_sortby((x) -> (x=x),c4) from vtt1;
+----------------------------------------------------------+
| array_sortby((x) -> (x=x),c4)                            |
+----------------------------------------------------------+
| [-9223372036854775808,9223372036854775807,775,808,2,0]   |
| [-9223372036854775808,9223372036854775807,775,808,2,0,1] |
| NULL                                                     |
+----------------------------------------------------------+
select /*+enable_parallel_dml parallel(2) */ array_sortby((x) -> (x=x),c4) from tt2;
+-----------------------------------------------------------+
| array_sortby((x) -> (x=x),c4)                             |
+-----------------------------------------------------------+
| [852,9223372036854775807,775,808,2,0,9223372036854775807] |
| [1,100000,9223372036854775807,775,808,2,0,1]              |
| NULL                                                      |
+-----------------------------------------------------------+
select /*+enable_parallel_dml parallel(2) */ array_sortby((x) -> (x=x),c4) from vtt2;
+-----------------------------------------------------------+
| array_sortby((x) -> (x=x),c4)                             |
+-----------------------------------------------------------+
| [852,9223372036854775807,775,808,2,0,9223372036854775807] |
| [1,100000,9223372036854775807,775,808,2,0,1]              |
| NULL                                                      |
+-----------------------------------------------------------+
select /*+enable_parallel_dml parallel(2) */ array_sortby((x) -> (x=x),c5) from tt1;
+-------------------------------+
| array_sortby((x) -> (x=x),c5) |
+-------------------------------+
| [3.402,0,1.175]               |
| [3.402,0,1.175,1.175,4]       |
| NULL                          |
+-------------------------------+
select /*+enable_parallel_dml parallel(2) */ array_sortby((x) -> (x=x),c5) from vtt1;
+-------------------------------+
| array_sortby((x) -> (x=x),c5) |
+-------------------------------+
| [3.402,0,1.175]               |
| [3.402,0,1.175,1.175,4]       |
| NULL                          |
+-------------------------------+
select /*+enable_parallel_dml parallel(2) */ array_sortby((x) -> (x=x),c5) from tt2;
+------------------------------------+
| array_sortby((x) -> (x=x),c5)      |
+------------------------------------+
| [3.402,0,1.175,1.175,1.175,1.2212] |
| [3.402,0,1.175,4]                  |
| NULL                               |
+------------------------------------+
select /*+enable_parallel_dml parallel(2) */ array_sortby((x) -> (x=x),c5) from vtt2;
+------------------------------------+
| array_sortby((x) -> (x=x),c5)      |
+------------------------------------+
| [3.402,0,1.175,1.175,1.175,1.2212] |
| [3.402,0,1.175,4]                  |
| NULL                               |
+------------------------------------+
select /*+enable_parallel_dml parallel(2) */ array_sortby((x) -> (x=x),c6) from tt1;
+------------------------------------------------------------------------------+
| array_sortby((x) -> (x=x),c6)                                                |
+------------------------------------------------------------------------------+
| [1.7976931348623157e308,2.2250738585072014e-308,2.2250738585072014e-308]     |
| [-1.7976931348623158e30,1.2,2.2250738585072014e-308,2.2250738585072014e-308] |
| NULL                                                                         |
+------------------------------------------------------------------------------+
select /*+enable_parallel_dml parallel(2) */ array_sortby((x) -> (x=x),c6) from vtt1;
+------------------------------------------------------------------------------+
| array_sortby((x) -> (x=x),c6)                                                |
+------------------------------------------------------------------------------+
| [1.7976931348623157e308,2.2250738585072014e-308,2.2250738585072014e-308]     |
| [-1.7976931348623158e30,1.2,2.2250738585072014e-308,2.2250738585072014e-308] |
| NULL                                                                         |
+------------------------------------------------------------------------------+
select /*+enable_parallel_dml parallel(2) */ array_sortby((x) -> (x=x),c6) from tt2;
+--------------------------------------------------------------------------+
| array_sortby((x) -> (x=x),c6)                                            |
+--------------------------------------------------------------------------+
| [1.7976931348623157e308,2.2250738585072014e-308,2.2250738585072014e-308] |
| [1.7976931348623157e308,1.2,2.2250738585072014e-308]                     |
| NULL                                                                     |
+--------------------------------------------------------------------------+
select /*+enable_parallel_dml parallel(2) */ array_sortby((x) -> (x=x),c6) from vtt2;
+--------------------------------------------------------------------------+
| array_sortby((x) -> (x=x),c6)                                            |
+--------------------------------------------------------------------------+
| [1.7976931348623157e308,2.2250738585072014e-308,2.2250738585072014e-308] |
| [1.7976931348623157e308,1.2,2.2250738585072014e-308]                     |
| NULL                                                                     |
+--------------------------------------------------------------------------+
select /*+enable_parallel_dml parallel(2) */ array_sortby((x) -> (x=x),c7) from tt1;
+-------------------------------+
| array_sortby((x) -> (x=x),c7) |
+-------------------------------+
| [-32768,0,32767,32767]        |
| [-32768,0,32767,0]            |
| NULL                          |
+-------------------------------+
select /*+enable_parallel_dml parallel(2) */ array_sortby((x) -> (x=x),c7) from vtt1;
+-------------------------------+
| array_sortby((x) -> (x=x),c7) |
+-------------------------------+
| [-32768,0,32767,32767]        |
| [-32768,0,32767,0]            |
| NULL                          |
+-------------------------------+
select /*+enable_parallel_dml parallel(2) */ array_sortby((x) -> (x=x),c7) from tt2;
+-------------------------------+
| array_sortby((x) -> (x=x),c7) |
+-------------------------------+
| [88,0,32767,32767]            |
| [68,0,32767,32766,1]          |
| NULL                          |
+-------------------------------+
select /*+enable_parallel_dml parallel(2) */ array_sortby((x) -> (x=x),c7) from vtt2;
+-------------------------------+
| array_sortby((x) -> (x=x),c7) |
+-------------------------------+
| [88,0,32767,32767]            |
| [68,0,32767,32766,1]          |
| NULL                          |
+-------------------------------+

select /*+read_consistency(weak) */ array_sortby((x) -> (x=x),c1) from tt1;
+---------------------------------------------------------+
| array_sortby((x) -> (x=x),c1)                           |
+---------------------------------------------------------+
| [-2147483648,-2147483647,0,77777]                       |
| [-2147483648,0,2147483647,4,3,2,1,26,5,2147483647,NULL] |
| NULL                                                    |
+---------------------------------------------------------+
select /*+read_consistency(weak) */ array_sortby((x) -> (x=x),c1) from vtt1;
+---------------------------------------------------------+
| array_sortby((x) -> (x=x),c1)                           |
+---------------------------------------------------------+
| [-2147483648,-2147483647,0,77777]                       |
| [-2147483648,0,2147483647,4,3,2,1,26,5,2147483647,NULL] |
| NULL                                                    |
+---------------------------------------------------------+
select /*+read_consistency(weak) */ array_sortby((x) -> (x=x),c1) from tt2;
+-------------------------------+
| array_sortby((x) -> (x=x),c1) |
+-------------------------------+
| [2147483648,2147483648,0]     |
| [87666,0,2147483647,4]        |
| NULL                          |
+-------------------------------+
select /*+read_consistency(weak) */ array_sortby((x) -> (x=x),c1) from vtt2;
+-------------------------------+
| array_sortby((x) -> (x=x),c1) |
+-------------------------------+
| [2147483648,2147483648,0]     |
| [87666,0,2147483647,4]        |
| NULL                          |
+-------------------------------+
select /*+read_consistency(weak) */ array_sortby((x) -> (x=x),c2) from tt1;
+-------------------------------+
| array_sortby((x) -> (x=x),c2) |
+-------------------------------+
| ["test","test"]               |
| ["test",NULL]                 |
| NULL                          |
+-------------------------------+
select /*+read_consistency(weak) */ array_sortby((x) -> (x=x),c2) from vtt1;
+-------------------------------+
| array_sortby((x) -> (x=x),c2) |
+-------------------------------+
| ["test","test"]               |
| ["test",NULL]                 |
| NULL                          |
+-------------------------------+
select /*+read_consistency(weak) */ array_sortby((x) -> (x=x),c2) from tt2;
+-------------------------------+
| array_sortby((x) -> (x=x),c2) |
+-------------------------------+
| ["test"]                      |
| ["test"]                      |
| NULL                          |
+-------------------------------+
select /*+read_consistency(weak) */ array_sortby((x) -> (x=x),c2) from vtt2;
+-------------------------------+
| array_sortby((x) -> (x=x),c2) |
+-------------------------------+
| ["test"]                      |
| ["test"]                      |
| NULL                          |
+-------------------------------+
select /*+read_consistency(weak) */ array_sortby((x) -> (x=x),c3) from tt1;
+-------------------------------+
| array_sortby((x) -> (x=x),c3) |
+-------------------------------+
| [127,0,-128]                  |
| [-128,127,0,-128,6,77]        |
| NULL                          |
+-------------------------------+
select /*+read_consistency(weak) */ array_sortby((x) -> (x=x),c3) from vtt1;
+-------------------------------+
| array_sortby((x) -> (x=x),c3) |
+-------------------------------+
| [127,0,-128]                  |
| [-128,127,0,-128,6,77]        |
| NULL                          |
+-------------------------------+
select /*+read_consistency(weak) */ array_sortby((x) -> (x=x),c3) from tt2;
+-------------------------------+
| array_sortby((x) -> (x=x),c3) |
+-------------------------------+
| [52,0,5,0,5,3,8,7,7,67,9]     |
| [5,0,7,6,50]                  |
| NULL                          |
+-------------------------------+
select /*+read_consistency(weak) */ array_sortby((x) -> (x=x),c3) from vtt2;
+-------------------------------+
| array_sortby((x) -> (x=x),c3) |
+-------------------------------+
| [52,0,5,0,5,3,8,7,7,67,9]     |
| [5,0,7,6,50]                  |
| NULL                          |
+-------------------------------+
select /*+read_consistency(weak) */ array_sortby((x) -> (x=x),c4) from tt1;
+----------------------------------------------------------+
| array_sortby((x) -> (x=x),c4)                            |
+----------------------------------------------------------+
| [-9223372036854775808,9223372036854775807,775,808,2,0]   |
| [-9223372036854775808,9223372036854775807,775,808,2,0,1] |
| NULL                                                     |
+----------------------------------------------------------+
select /*+read_consistency(weak) */ array_sortby((x) -> (x=x),c4) from vtt1;
+----------------------------------------------------------+
| array_sortby((x) -> (x=x),c4)                            |
+----------------------------------------------------------+
| [-9223372036854775808,9223372036854775807,775,808,2,0]   |
| [-9223372036854775808,9223372036854775807,775,808,2,0,1] |
| NULL                                                     |
+----------------------------------------------------------+
select /*+read_consistency(weak) */ array_sortby((x) -> (x=x),c4) from tt2;
+-----------------------------------------------------------+
| array_sortby((x) -> (x=x),c4)                             |
+-----------------------------------------------------------+
| [852,9223372036854775807,775,808,2,0,9223372036854775807] |
| [1,100000,9223372036854775807,775,808,2,0,1]              |
| NULL                                                      |
+-----------------------------------------------------------+
select /*+read_consistency(weak) */ array_sortby((x) -> (x=x),c4) from vtt2;
+-----------------------------------------------------------+
| array_sortby((x) -> (x=x),c4)                             |
+-----------------------------------------------------------+
| [852,9223372036854775807,775,808,2,0,9223372036854775807] |
| [1,100000,9223372036854775807,775,808,2,0,1]              |
| NULL                                                      |
+-----------------------------------------------------------+
select /*+read_consistency(weak) */ array_sortby((x) -> (x=x),c5) from tt1;
+-------------------------------+
| array_sortby((x) -> (x=x),c5) |
+-------------------------------+
| [3.402,0,1.175]               |
| [3.402,0,1.175,1.175,4]       |
| NULL                          |
+-------------------------------+
select /*+read_consistency(weak) */ array_sortby((x) -> (x=x),c5) from vtt1;
+-------------------------------+
| array_sortby((x) -> (x=x),c5) |
+-------------------------------+
| [3.402,0,1.175]               |
| [3.402,0,1.175,1.175,4]       |
| NULL                          |
+-------------------------------+
select /*+read_consistency(weak) */ array_sortby((x) -> (x=x),c5) from tt2;
+------------------------------------+
| array_sortby((x) -> (x=x),c5)      |
+------------------------------------+
| [3.402,0,1.175,1.175,1.175,1.2212] |
| [3.402,0,1.175,4]                  |
| NULL                               |
+------------------------------------+
select /*+read_consistency(weak) */ array_sortby((x) -> (x=x),c5) from vtt2;
+------------------------------------+
| array_sortby((x) -> (x=x),c5)      |
+------------------------------------+
| [3.402,0,1.175,1.175,1.175,1.2212] |
| [3.402,0,1.175,4]                  |
| NULL                               |
+------------------------------------+
select /*+read_consistency(weak) */ array_sortby((x) -> (x=x),c6) from tt1;
+------------------------------------------------------------------------------+
| array_sortby((x) -> (x=x),c6)                                                |
+------------------------------------------------------------------------------+
| [1.7976931348623157e308,2.2250738585072014e-308,2.2250738585072014e-308]     |
| [-1.7976931348623158e30,1.2,2.2250738585072014e-308,2.2250738585072014e-308] |
| NULL                                                                         |
+------------------------------------------------------------------------------+
select /*+read_consistency(weak) */ array_sortby((x) -> (x=x),c6) from vtt1;
+------------------------------------------------------------------------------+
| array_sortby((x) -> (x=x),c6)                                                |
+------------------------------------------------------------------------------+
| [1.7976931348623157e308,2.2250738585072014e-308,2.2250738585072014e-308]     |
| [-1.7976931348623158e30,1.2,2.2250738585072014e-308,2.2250738585072014e-308] |
| NULL                                                                         |
+------------------------------------------------------------------------------+
select /*+read_consistency(weak) */ array_sortby((x) -> (x=x),c6) from tt2;
+--------------------------------------------------------------------------+
| array_sortby((x) -> (x=x),c6)                                            |
+--------------------------------------------------------------------------+
| [1.7976931348623157e308,2.2250738585072014e-308,2.2250738585072014e-308] |
| [1.7976931348623157e308,1.2,2.2250738585072014e-308]                     |
| NULL                                                                     |
+--------------------------------------------------------------------------+
select /*+read_consistency(weak) */ array_sortby((x) -> (x=x),c6) from vtt2;
+--------------------------------------------------------------------------+
| array_sortby((x) -> (x=x),c6)                                            |
+--------------------------------------------------------------------------+
| [1.7976931348623157e308,2.2250738585072014e-308,2.2250738585072014e-308] |
| [1.7976931348623157e308,1.2,2.2250738585072014e-308]                     |
| NULL                                                                     |
+--------------------------------------------------------------------------+
select /*+read_consistency(weak) */ array_sortby((x) -> (x=x),c7) from tt1;
+-------------------------------+
| array_sortby((x) -> (x=x),c7) |
+-------------------------------+
| [-32768,0,32767,32767]        |
| [-32768,0,32767,0]            |
| NULL                          |
+-------------------------------+
select /*+read_consistency(weak) */ array_sortby((x) -> (x=x),c7) from vtt1;
+-------------------------------+
| array_sortby((x) -> (x=x),c7) |
+-------------------------------+
| [-32768,0,32767,32767]        |
| [-32768,0,32767,0]            |
| NULL                          |
+-------------------------------+
select /*+read_consistency(weak) */ array_sortby((x) -> (x=x),c7) from tt2;
+-------------------------------+
| array_sortby((x) -> (x=x),c7) |
+-------------------------------+
| [88,0,32767,32767]            |
| [68,0,32767,32766,1]          |
| NULL                          |
+-------------------------------+
select /*+read_consistency(weak) */ array_sortby((x) -> (x=x),c7) from vtt2;
+-------------------------------+
| array_sortby((x) -> (x=x),c7) |
+-------------------------------+
| [88,0,32767,32767]            |
| [68,0,32767,32766,1]          |
| NULL                          |
+-------------------------------+

select /*+  parallel(4) NO_PRED_DEDUCE USE_MERGE (tt1, tt2) */ array_sortby((x) -> (x=x),c1) from tt1;
+---------------------------------------------------------+
| array_sortby((x) -> (x=x),c1)                           |
+---------------------------------------------------------+
| [-2147483648,-2147483647,0,77777]                       |
| [-2147483648,0,2147483647,4,3,2,1,26,5,2147483647,NULL] |
| NULL                                                    |
+---------------------------------------------------------+
select /*+  parallel(4) NO_PRED_DEDUCE USE_MERGE (tt1, tt2) */ array_sortby((x) -> (x=x),c1) from vtt1;
+---------------------------------------------------------+
| array_sortby((x) -> (x=x),c1)                           |
+---------------------------------------------------------+
| [-2147483648,-2147483647,0,77777]                       |
| [-2147483648,0,2147483647,4,3,2,1,26,5,2147483647,NULL] |
| NULL                                                    |
+---------------------------------------------------------+
select /*+  parallel(4) NO_PRED_DEDUCE USE_MERGE (tt1, tt2) */ array_sortby((x) -> (x=x),c1) from tt2;
+-------------------------------+
| array_sortby((x) -> (x=x),c1) |
+-------------------------------+
| [2147483648,2147483648,0]     |
| [87666,0,2147483647,4]        |
| NULL                          |
+-------------------------------+
select /*+  parallel(4) NO_PRED_DEDUCE USE_MERGE (tt1, tt2) */ array_sortby((x) -> (x=x),c1) from vtt2;
+-------------------------------+
| array_sortby((x) -> (x=x),c1) |
+-------------------------------+
| [2147483648,2147483648,0]     |
| [87666,0,2147483647,4]        |
| NULL                          |
+-------------------------------+
select /*+  parallel(4) NO_PRED_DEDUCE USE_MERGE (tt1, tt2) */ array_sortby((x) -> (x=x),c2) from tt1;
+-------------------------------+
| array_sortby((x) -> (x=x),c2) |
+-------------------------------+
| ["test","test"]               |
| ["test",NULL]                 |
| NULL                          |
+-------------------------------+
select /*+  parallel(4) NO_PRED_DEDUCE USE_MERGE (tt1, tt2) */ array_sortby((x) -> (x=x),c2) from vtt1;
+-------------------------------+
| array_sortby((x) -> (x=x),c2) |
+-------------------------------+
| ["test","test"]               |
| ["test",NULL]                 |
| NULL                          |
+-------------------------------+
select /*+  parallel(4) NO_PRED_DEDUCE USE_MERGE (tt1, tt2) */ array_sortby((x) -> (x=x),c2) from tt2;
+-------------------------------+
| array_sortby((x) -> (x=x),c2) |
+-------------------------------+
| ["test"]                      |
| ["test"]                      |
| NULL                          |
+-------------------------------+
select /*+  parallel(4) NO_PRED_DEDUCE USE_MERGE (tt1, tt2) */ array_sortby((x) -> (x=x),c2) from vtt2;
+-------------------------------+
| array_sortby((x) -> (x=x),c2) |
+-------------------------------+
| ["test"]                      |
| ["test"]                      |
| NULL                          |
+-------------------------------+
select /*+  parallel(4) NO_PRED_DEDUCE USE_MERGE (tt1, tt2) */ array_sortby((x) -> (x=x),c3) from tt1;
+-------------------------------+
| array_sortby((x) -> (x=x),c3) |
+-------------------------------+
| [127,0,-128]                  |
| [-128,127,0,-128,6,77]        |
| NULL                          |
+-------------------------------+
select /*+  parallel(4) NO_PRED_DEDUCE USE_MERGE (tt1, tt2) */ array_sortby((x) -> (x=x),c3) from vtt1;
+-------------------------------+
| array_sortby((x) -> (x=x),c3) |
+-------------------------------+
| [127,0,-128]                  |
| [-128,127,0,-128,6,77]        |
| NULL                          |
+-------------------------------+
select /*+  parallel(4) NO_PRED_DEDUCE USE_MERGE (tt1, tt2) */ array_sortby((x) -> (x=x),c3) from tt2;
+-------------------------------+
| array_sortby((x) -> (x=x),c3) |
+-------------------------------+
| [52,0,5,0,5,3,8,7,7,67,9]     |
| [5,0,7,6,50]                  |
| NULL                          |
+-------------------------------+
select /*+  parallel(4) NO_PRED_DEDUCE USE_MERGE (tt1, tt2) */ array_sortby((x) -> (x=x),c3) from vtt2;
+-------------------------------+
| array_sortby((x) -> (x=x),c3) |
+-------------------------------+
| [52,0,5,0,5,3,8,7,7,67,9]     |
| [5,0,7,6,50]                  |
| NULL                          |
+-------------------------------+
select /*+  parallel(4) NO_PRED_DEDUCE USE_MERGE (tt1, tt2) */ array_sortby((x) -> (x=x),c4) from tt1;
+----------------------------------------------------------+
| array_sortby((x) -> (x=x),c4)                            |
+----------------------------------------------------------+
| [-9223372036854775808,9223372036854775807,775,808,2,0]   |
| [-9223372036854775808,9223372036854775807,775,808,2,0,1] |
| NULL                                                     |
+----------------------------------------------------------+
select /*+  parallel(4) NO_PRED_DEDUCE USE_MERGE (tt1, tt2) */ array_sortby((x) -> (x=x),c4) from vtt1;
+----------------------------------------------------------+
| array_sortby((x) -> (x=x),c4)                            |
+----------------------------------------------------------+
| [-9223372036854775808,9223372036854775807,775,808,2,0]   |
| [-9223372036854775808,9223372036854775807,775,808,2,0,1] |
| NULL                                                     |
+----------------------------------------------------------+
select /*+  parallel(4) NO_PRED_DEDUCE USE_MERGE (tt1, tt2) */ array_sortby((x) -> (x=x),c4) from tt2;
+-----------------------------------------------------------+
| array_sortby((x) -> (x=x),c4)                             |
+-----------------------------------------------------------+
| [852,9223372036854775807,775,808,2,0,9223372036854775807] |
| [1,100000,9223372036854775807,775,808,2,0,1]              |
| NULL                                                      |
+-----------------------------------------------------------+
select /*+  parallel(4) NO_PRED_DEDUCE USE_MERGE (tt1, tt2) */ array_sortby((x) -> (x=x),c4) from vtt2;
+-----------------------------------------------------------+
| array_sortby((x) -> (x=x),c4)                             |
+-----------------------------------------------------------+
| [852,9223372036854775807,775,808,2,0,9223372036854775807] |
| [1,100000,9223372036854775807,775,808,2,0,1]              |
| NULL                                                      |
+-----------------------------------------------------------+
select /*+  parallel(4) NO_PRED_DEDUCE USE_MERGE (tt1, tt2) */ array_sortby((x) -> (x=x),c5) from tt1;
+-------------------------------+
| array_sortby((x) -> (x=x),c5) |
+-------------------------------+
| [3.402,0,1.175]               |
| [3.402,0,1.175,1.175,4]       |
| NULL                          |
+-------------------------------+
select /*+  parallel(4) NO_PRED_DEDUCE USE_MERGE (tt1, tt2) */ array_sortby((x) -> (x=x),c5) from vtt1;
+-------------------------------+
| array_sortby((x) -> (x=x),c5) |
+-------------------------------+
| [3.402,0,1.175]               |
| [3.402,0,1.175,1.175,4]       |
| NULL                          |
+-------------------------------+
select /*+  parallel(4) NO_PRED_DEDUCE USE_MERGE (tt1, tt2) */ array_sortby((x) -> (x=x),c5) from tt2;
+------------------------------------+
| array_sortby((x) -> (x=x),c5)      |
+------------------------------------+
| [3.402,0,1.175,1.175,1.175,1.2212] |
| [3.402,0,1.175,4]                  |
| NULL                               |
+------------------------------------+
select /*+  parallel(4) NO_PRED_DEDUCE USE_MERGE (tt1, tt2) */ array_sortby((x) -> (x=x),c5) from vtt2;
+------------------------------------+
| array_sortby((x) -> (x=x),c5)      |
+------------------------------------+
| [3.402,0,1.175,1.175,1.175,1.2212] |
| [3.402,0,1.175,4]                  |
| NULL                               |
+------------------------------------+
select /*+  parallel(4) NO_PRED_DEDUCE USE_MERGE (tt1, tt2) */ array_sortby((x) -> (x=x),c6) from tt1;
+------------------------------------------------------------------------------+
| array_sortby((x) -> (x=x),c6)                                                |
+------------------------------------------------------------------------------+
| [1.7976931348623157e308,2.2250738585072014e-308,2.2250738585072014e-308]     |
| [-1.7976931348623158e30,1.2,2.2250738585072014e-308,2.2250738585072014e-308] |
| NULL                                                                         |
+------------------------------------------------------------------------------+
select /*+  parallel(4) NO_PRED_DEDUCE USE_MERGE (tt1, tt2) */ array_sortby((x) -> (x=x),c6) from vtt1;
+------------------------------------------------------------------------------+
| array_sortby((x) -> (x=x),c6)                                                |
+------------------------------------------------------------------------------+
| [1.7976931348623157e308,2.2250738585072014e-308,2.2250738585072014e-308]     |
| [-1.7976931348623158e30,1.2,2.2250738585072014e-308,2.2250738585072014e-308] |
| NULL                                                                         |
+------------------------------------------------------------------------------+
select /*+  parallel(4) NO_PRED_DEDUCE USE_MERGE (tt1, tt2) */ array_sortby((x) -> (x=x),c6) from tt2;
+--------------------------------------------------------------------------+
| array_sortby((x) -> (x=x),c6)                                            |
+--------------------------------------------------------------------------+
| [1.7976931348623157e308,2.2250738585072014e-308,2.2250738585072014e-308] |
| [1.7976931348623157e308,1.2,2.2250738585072014e-308]                     |
| NULL                                                                     |
+--------------------------------------------------------------------------+
select /*+  parallel(4) NO_PRED_DEDUCE USE_MERGE (tt1, tt2) */ array_sortby((x) -> (x=x),c6) from vtt2;
+--------------------------------------------------------------------------+
| array_sortby((x) -> (x=x),c6)                                            |
+--------------------------------------------------------------------------+
| [1.7976931348623157e308,2.2250738585072014e-308,2.2250738585072014e-308] |
| [1.7976931348623157e308,1.2,2.2250738585072014e-308]                     |
| NULL                                                                     |
+--------------------------------------------------------------------------+
select /*+  parallel(4) NO_PRED_DEDUCE USE_MERGE (tt1, tt2) */ array_sortby((x) -> (x=x),c7) from tt1;
+-------------------------------+
| array_sortby((x) -> (x=x),c7) |
+-------------------------------+
| [-32768,0,32767,32767]        |
| [-32768,0,32767,0]            |
| NULL                          |
+-------------------------------+
select /*+  parallel(4) NO_PRED_DEDUCE USE_MERGE (tt1, tt2) */ array_sortby((x) -> (x=x),c7) from vtt1;
+-------------------------------+
| array_sortby((x) -> (x=x),c7) |
+-------------------------------+
| [-32768,0,32767,32767]        |
| [-32768,0,32767,0]            |
| NULL                          |
+-------------------------------+
select /*+  parallel(4) NO_PRED_DEDUCE USE_MERGE (tt1, tt2) */ array_sortby((x) -> (x=x),c7) from tt2;
+-------------------------------+
| array_sortby((x) -> (x=x),c7) |
+-------------------------------+
| [88,0,32767,32767]            |
| [68,0,32767,32766,1]          |
| NULL                          |
+-------------------------------+
select /*+  parallel(4) NO_PRED_DEDUCE USE_MERGE (tt1, tt2) */ array_sortby((x) -> (x=x),c7) from vtt2;
+-------------------------------+
| array_sortby((x) -> (x=x),c7) |
+-------------------------------+
| [88,0,32767,32767]            |
| [68,0,32767,32766,1]          |
| NULL                          |
+-------------------------------+

select /*+ OPT_PARAM('enable_rich_vector_format', 'FALSE') */ array_sortby((x) -> (x=x),c1) from tt1;
+---------------------------------------------------------+
| array_sortby((x) -> (x=x),c1)                           |
+---------------------------------------------------------+
| [-2147483648,-2147483647,0,77777]                       |
| [-2147483648,0,2147483647,4,3,2,1,26,5,2147483647,NULL] |
| NULL                                                    |
+---------------------------------------------------------+
select /*+ OPT_PARAM('enable_rich_vector_format', 'FALSE') */ array_sortby((x) -> (x=x),c1) from vtt1;
+---------------------------------------------------------+
| array_sortby((x) -> (x=x),c1)                           |
+---------------------------------------------------------+
| [-2147483648,-2147483647,0,77777]                       |
| [-2147483648,0,2147483647,4,3,2,1,26,5,2147483647,NULL] |
| NULL                                                    |
+---------------------------------------------------------+
select /*+ OPT_PARAM('enable_rich_vector_format', 'FALSE') */ array_sortby((x) -> (x=x),c1) from tt2;
+-------------------------------+
| array_sortby((x) -> (x=x),c1) |
+-------------------------------+
| [2147483648,2147483648,0]     |
| [87666,0,2147483647,4]        |
| NULL                          |
+-------------------------------+
select /*+ OPT_PARAM('enable_rich_vector_format', 'FALSE') */ array_sortby((x) -> (x=x),c1) from vtt2;
+-------------------------------+
| array_sortby((x) -> (x=x),c1) |
+-------------------------------+
| [2147483648,2147483648,0]     |
| [87666,0,2147483647,4]        |
| NULL                          |
+-------------------------------+
select /*+ OPT_PARAM('enable_rich_vector_format', 'FALSE') */ array_sortby((x) -> (x=x),c2) from tt1;
+-------------------------------+
| array_sortby((x) -> (x=x),c2) |
+-------------------------------+
| ["test","test"]               |
| ["test",NULL]                 |
| NULL                          |
+-------------------------------+
select /*+ OPT_PARAM('enable_rich_vector_format', 'FALSE') */ array_sortby((x) -> (x=x),c2) from vtt1;
+-------------------------------+
| array_sortby((x) -> (x=x),c2) |
+-------------------------------+
| ["test","test"]               |
| ["test",NULL]                 |
| NULL                          |
+-------------------------------+
select /*+ OPT_PARAM('enable_rich_vector_format', 'FALSE') */ array_sortby((x) -> (x=x),c2) from tt2;
+-------------------------------+
| array_sortby((x) -> (x=x),c2) |
+-------------------------------+
| ["test"]                      |
| ["test"]                      |
| NULL                          |
+-------------------------------+
select /*+ OPT_PARAM('enable_rich_vector_format', 'FALSE') */ array_sortby((x) -> (x=x),c2) from vtt2;
+-------------------------------+
| array_sortby((x) -> (x=x),c2) |
+-------------------------------+
| ["test"]                      |
| ["test"]                      |
| NULL                          |
+-------------------------------+
select /*+ OPT_PARAM('enable_rich_vector_format', 'FALSE') */ array_sortby((x) -> (x=x),c3) from tt1;
+-------------------------------+
| array_sortby((x) -> (x=x),c3) |
+-------------------------------+
| [127,0,-128]                  |
| [-128,127,0,-128,6,77]        |
| NULL                          |
+-------------------------------+
select /*+ OPT_PARAM('enable_rich_vector_format', 'FALSE') */ array_sortby((x) -> (x=x),c3) from vtt1;
+-------------------------------+
| array_sortby((x) -> (x=x),c3) |
+-------------------------------+
| [127,0,-128]                  |
| [-128,127,0,-128,6,77]        |
| NULL                          |
+-------------------------------+
select /*+ OPT_PARAM('enable_rich_vector_format', 'FALSE') */ array_sortby((x) -> (x=x),c3) from tt2;
+-------------------------------+
| array_sortby((x) -> (x=x),c3) |
+-------------------------------+
| [52,0,5,0,5,3,8,7,7,67,9]     |
| [5,0,7,6,50]                  |
| NULL                          |
+-------------------------------+
select /*+ OPT_PARAM('enable_rich_vector_format', 'FALSE') */ array_sortby((x) -> (x=x),c3) from vtt2;
+-------------------------------+
| array_sortby((x) -> (x=x),c3) |
+-------------------------------+
| [52,0,5,0,5,3,8,7,7,67,9]     |
| [5,0,7,6,50]                  |
| NULL                          |
+-------------------------------+
select /*+ OPT_PARAM('enable_rich_vector_format', 'FALSE') */ array_sortby((x) -> (x=x),c4) from tt1;
+----------------------------------------------------------+
| array_sortby((x) -> (x=x),c4)                            |
+----------------------------------------------------------+
| [-9223372036854775808,9223372036854775807,775,808,2,0]   |
| [-9223372036854775808,9223372036854775807,775,808,2,0,1] |
| NULL                                                     |
+----------------------------------------------------------+
select /*+ OPT_PARAM('enable_rich_vector_format', 'FALSE') */ array_sortby((x) -> (x=x),c4) from vtt1;
+----------------------------------------------------------+
| array_sortby((x) -> (x=x),c4)                            |
+----------------------------------------------------------+
| [-9223372036854775808,9223372036854775807,775,808,2,0]   |
| [-9223372036854775808,9223372036854775807,775,808,2,0,1] |
| NULL                                                     |
+----------------------------------------------------------+
select /*+ OPT_PARAM('enable_rich_vector_format', 'FALSE') */ array_sortby((x) -> (x=x),c4) from tt2;
+-----------------------------------------------------------+
| array_sortby((x) -> (x=x),c4)                             |
+-----------------------------------------------------------+
| [852,9223372036854775807,775,808,2,0,9223372036854775807] |
| [1,100000,9223372036854775807,775,808,2,0,1]              |
| NULL                                                      |
+-----------------------------------------------------------+
select /*+ OPT_PARAM('enable_rich_vector_format', 'FALSE') */ array_sortby((x) -> (x=x),c4) from vtt2;
+-----------------------------------------------------------+
| array_sortby((x) -> (x=x),c4)                             |
+-----------------------------------------------------------+
| [852,9223372036854775807,775,808,2,0,9223372036854775807] |
| [1,100000,9223372036854775807,775,808,2,0,1]              |
| NULL                                                      |
+-----------------------------------------------------------+
select /*+ OPT_PARAM('enable_rich_vector_format', 'FALSE') */ array_sortby((x) -> (x=x),c5) from tt1;
+-------------------------------+
| array_sortby((x) -> (x=x),c5) |
+-------------------------------+
| [3.402,0,1.175]               |
| [3.402,0,1.175,1.175,4]       |
| NULL                          |
+-------------------------------+
select /*+ OPT_PARAM('enable_rich_vector_format', 'FALSE') */ array_sortby((x) -> (x=x),c5) from vtt1;
+-------------------------------+
| array_sortby((x) -> (x=x),c5) |
+-------------------------------+
| [3.402,0,1.175]               |
| [3.402,0,1.175,1.175,4]       |
| NULL                          |
+-------------------------------+
select /*+ OPT_PARAM('enable_rich_vector_format', 'FALSE') */ array_sortby((x) -> (x=x),c5) from tt2;
+------------------------------------+
| array_sortby((x) -> (x=x),c5)      |
+------------------------------------+
| [3.402,0,1.175,1.175,1.175,1.2212] |
| [3.402,0,1.175,4]                  |
| NULL                               |
+------------------------------------+
select /*+ OPT_PARAM('enable_rich_vector_format', 'FALSE') */ array_sortby((x) -> (x=x),c5) from vtt2;
+------------------------------------+
| array_sortby((x) -> (x=x),c5)      |
+------------------------------------+
| [3.402,0,1.175,1.175,1.175,1.2212] |
| [3.402,0,1.175,4]                  |
| NULL                               |
+------------------------------------+
select /*+ OPT_PARAM('enable_rich_vector_format', 'FALSE') */ array_sortby((x) -> (x=x),c6) from tt1;
+------------------------------------------------------------------------------+
| array_sortby((x) -> (x=x),c6)                                                |
+------------------------------------------------------------------------------+
| [1.7976931348623157e308,2.2250738585072014e-308,2.2250738585072014e-308]     |
| [-1.7976931348623158e30,1.2,2.2250738585072014e-308,2.2250738585072014e-308] |
| NULL                                                                         |
+------------------------------------------------------------------------------+
select /*+ OPT_PARAM('enable_rich_vector_format', 'FALSE') */ array_sortby((x) -> (x=x),c6) from vtt1;
+------------------------------------------------------------------------------+
| array_sortby((x) -> (x=x),c6)                                                |
+------------------------------------------------------------------------------+
| [1.7976931348623157e308,2.2250738585072014e-308,2.2250738585072014e-308]     |
| [-1.7976931348623158e30,1.2,2.2250738585072014e-308,2.2250738585072014e-308] |
| NULL                                                                         |
+------------------------------------------------------------------------------+
select /*+ OPT_PARAM('enable_rich_vector_format', 'FALSE') */ array_sortby((x) -> (x=x),c6) from tt2;
+--------------------------------------------------------------------------+
| array_sortby((x) -> (x=x),c6)                                            |
+--------------------------------------------------------------------------+
| [1.7976931348623157e308,2.2250738585072014e-308,2.2250738585072014e-308] |
| [1.7976931348623157e308,1.2,2.2250738585072014e-308]                     |
| NULL                                                                     |
+--------------------------------------------------------------------------+
select /*+ OPT_PARAM('enable_rich_vector_format', 'FALSE') */ array_sortby((x) -> (x=x),c6) from vtt2;
+--------------------------------------------------------------------------+
| array_sortby((x) -> (x=x),c6)                                            |
+--------------------------------------------------------------------------+
| [1.7976931348623157e308,2.2250738585072014e-308,2.2250738585072014e-308] |
| [1.7976931348623157e308,1.2,2.2250738585072014e-308]                     |
| NULL                                                                     |
+--------------------------------------------------------------------------+
select /*+ OPT_PARAM('enable_rich_vector_format', 'FALSE') */ array_sortby((x) -> (x=x),c7) from tt1;
+-------------------------------+
| array_sortby((x) -> (x=x),c7) |
+-------------------------------+
| [-32768,0,32767,32767]        |
| [-32768,0,32767,0]            |
| NULL                          |
+-------------------------------+
select /*+ OPT_PARAM('enable_rich_vector_format', 'FALSE') */ array_sortby((x) -> (x=x),c7) from vtt1;
+-------------------------------+
| array_sortby((x) -> (x=x),c7) |
+-------------------------------+
| [-32768,0,32767,32767]        |
| [-32768,0,32767,0]            |
| NULL                          |
+-------------------------------+
select /*+ OPT_PARAM('enable_rich_vector_format', 'FALSE') */ array_sortby((x) -> (x=x),c7) from tt2;
+-------------------------------+
| array_sortby((x) -> (x=x),c7) |
+-------------------------------+
| [88,0,32767,32767]            |
| [68,0,32767,32766,1]          |
| NULL                          |
+-------------------------------+
select /*+ OPT_PARAM('enable_rich_vector_format', 'FALSE') */ array_sortby((x) -> (x=x),c7) from vtt2;
+-------------------------------+
| array_sortby((x) -> (x=x),c7) |
+-------------------------------+
| [88,0,32767,32767]            |
| [68,0,32767,32766,1]          |
| NULL                          |
+-------------------------------+

select /*+ OPT_PARAM('rowsets_enabled', 'FALSE') */  array_sortby((x) -> (x=x),c1) from tt1;
+---------------------------------------------------------+
| array_sortby((x) -> (x=x),c1)                           |
+---------------------------------------------------------+
| [-2147483648,-2147483647,0,77777]                       |
| [-2147483648,0,2147483647,4,3,2,1,26,5,2147483647,NULL] |
| NULL                                                    |
+---------------------------------------------------------+
select /*+ OPT_PARAM('rowsets_enabled', 'FALSE') */  array_sortby((x) -> (x=x),c1) from vtt1;
+---------------------------------------------------------+
| array_sortby((x) -> (x=x),c1)                           |
+---------------------------------------------------------+
| [-2147483648,-2147483647,0,77777]                       |
| [-2147483648,0,2147483647,4,3,2,1,26,5,2147483647,NULL] |
| NULL                                                    |
+---------------------------------------------------------+
select /*+ OPT_PARAM('rowsets_enabled', 'FALSE') */  array_sortby((x) -> (x=x),c1) from tt2;
+-------------------------------+
| array_sortby((x) -> (x=x),c1) |
+-------------------------------+
| [2147483648,2147483648,0]     |
| [87666,0,2147483647,4]        |
| NULL                          |
+-------------------------------+
select /*+ OPT_PARAM('rowsets_enabled', 'FALSE') */  array_sortby((x) -> (x=x),c1) from vtt2;
+-------------------------------+
| array_sortby((x) -> (x=x),c1) |
+-------------------------------+
| [2147483648,2147483648,0]     |
| [87666,0,2147483647,4]        |
| NULL                          |
+-------------------------------+
select /*+ OPT_PARAM('rowsets_enabled', 'FALSE') */  array_sortby((x) -> (x=x),c2) from tt1;
+-------------------------------+
| array_sortby((x) -> (x=x),c2) |
+-------------------------------+
| ["test","test"]               |
| ["test",NULL]                 |
| NULL                          |
+-------------------------------+
select /*+ OPT_PARAM('rowsets_enabled', 'FALSE') */  array_sortby((x) -> (x=x),c2) from vtt1;
+-------------------------------+
| array_sortby((x) -> (x=x),c2) |
+-------------------------------+
| ["test","test"]               |
| ["test",NULL]                 |
| NULL                          |
+-------------------------------+
select /*+ OPT_PARAM('rowsets_enabled', 'FALSE') */  array_sortby((x) -> (x=x),c2) from tt2;
+-------------------------------+
| array_sortby((x) -> (x=x),c2) |
+-------------------------------+
| ["test"]                      |
| ["test"]                      |
| NULL                          |
+-------------------------------+
select /*+ OPT_PARAM('rowsets_enabled', 'FALSE') */  array_sortby((x) -> (x=x),c2) from vtt2;
+-------------------------------+
| array_sortby((x) -> (x=x),c2) |
+-------------------------------+
| ["test"]                      |
| ["test"]                      |
| NULL                          |
+-------------------------------+
select /*+ OPT_PARAM('rowsets_enabled', 'FALSE') */  array_sortby((x) -> (x=x),c3) from tt1;
+-------------------------------+
| array_sortby((x) -> (x=x),c3) |
+-------------------------------+
| [127,0,-128]                  |
| [-128,127,0,-128,6,77]        |
| NULL                          |
+-------------------------------+
select /*+ OPT_PARAM('rowsets_enabled', 'FALSE') */  array_sortby((x) -> (x=x),c3) from vtt1;
+-------------------------------+
| array_sortby((x) -> (x=x),c3) |
+-------------------------------+
| [127,0,-128]                  |
| [-128,127,0,-128,6,77]        |
| NULL                          |
+-------------------------------+
select /*+ OPT_PARAM('rowsets_enabled', 'FALSE') */  array_sortby((x) -> (x=x),c3) from tt2;
+-------------------------------+
| array_sortby((x) -> (x=x),c3) |
+-------------------------------+
| [52,0,5,0,5,3,8,7,7,67,9]     |
| [5,0,7,6,50]                  |
| NULL                          |
+-------------------------------+
select /*+ OPT_PARAM('rowsets_enabled', 'FALSE') */  array_sortby((x) -> (x=x),c3) from vtt2;
+-------------------------------+
| array_sortby((x) -> (x=x),c3) |
+-------------------------------+
| [52,0,5,0,5,3,8,7,7,67,9]     |
| [5,0,7,6,50]                  |
| NULL                          |
+-------------------------------+
select /*+ OPT_PARAM('rowsets_enabled', 'FALSE') */  array_sortby((x) -> (x=x),c4) from tt1;
+----------------------------------------------------------+
| array_sortby((x) -> (x=x),c4)                            |
+----------------------------------------------------------+
| [-9223372036854775808,9223372036854775807,775,808,2,0]   |
| [-9223372036854775808,9223372036854775807,775,808,2,0,1] |
| NULL                                                     |
+----------------------------------------------------------+
select /*+ OPT_PARAM('rowsets_enabled', 'FALSE') */  array_sortby((x) -> (x=x),c4) from vtt1;
+----------------------------------------------------------+
| array_sortby((x) -> (x=x),c4)                            |
+----------------------------------------------------------+
| [-9223372036854775808,9223372036854775807,775,808,2,0]   |
| [-9223372036854775808,9223372036854775807,775,808,2,0,1] |
| NULL                                                     |
+----------------------------------------------------------+
select /*+ OPT_PARAM('rowsets_enabled', 'FALSE') */  array_sortby((x) -> (x=x),c4) from tt2;
+-----------------------------------------------------------+
| array_sortby((x) -> (x=x),c4)                             |
+-----------------------------------------------------------+
| [852,9223372036854775807,775,808,2,0,9223372036854775807] |
| [1,100000,9223372036854775807,775,808,2,0,1]              |
| NULL                                                      |
+-----------------------------------------------------------+
select /*+ OPT_PARAM('rowsets_enabled', 'FALSE') */  array_sortby((x) -> (x=x),c4) from vtt2;
+-----------------------------------------------------------+
| array_sortby((x) -> (x=x),c4)                             |
+-----------------------------------------------------------+
| [852,9223372036854775807,775,808,2,0,9223372036854775807] |
| [1,100000,9223372036854775807,775,808,2,0,1]              |
| NULL                                                      |
+-----------------------------------------------------------+
select /*+ OPT_PARAM('rowsets_enabled', 'FALSE') */  array_sortby((x) -> (x=x),c5) from tt1;
+-------------------------------+
| array_sortby((x) -> (x=x),c5) |
+-------------------------------+
| [3.402,0,1.175]               |
| [3.402,0,1.175,1.175,4]       |
| NULL                          |
+-------------------------------+
select /*+ OPT_PARAM('rowsets_enabled', 'FALSE') */  array_sortby((x) -> (x=x),c5) from vtt1;
+-------------------------------+
| array_sortby((x) -> (x=x),c5) |
+-------------------------------+
| [3.402,0,1.175]               |
| [3.402,0,1.175,1.175,4]       |
| NULL                          |
+-------------------------------+
select /*+ OPT_PARAM('rowsets_enabled', 'FALSE') */  array_sortby((x) -> (x=x),c5) from tt2;
+------------------------------------+
| array_sortby((x) -> (x=x),c5)      |
+------------------------------------+
| [3.402,0,1.175,1.175,1.175,1.2212] |
| [3.402,0,1.175,4]                  |
| NULL                               |
+------------------------------------+
select /*+ OPT_PARAM('rowsets_enabled', 'FALSE') */  array_sortby((x) -> (x=x),c5) from vtt2;
+------------------------------------+
| array_sortby((x) -> (x=x),c5)      |
+------------------------------------+
| [3.402,0,1.175,1.175,1.175,1.2212] |
| [3.402,0,1.175,4]                  |
| NULL                               |
+------------------------------------+
select /*+ OPT_PARAM('rowsets_enabled', 'FALSE') */  array_sortby((x) -> (x=x),c6) from tt1;
+------------------------------------------------------------------------------+
| array_sortby((x) -> (x=x),c6)                                                |
+------------------------------------------------------------------------------+
| [1.7976931348623157e308,2.2250738585072014e-308,2.2250738585072014e-308]     |
| [-1.7976931348623158e30,1.2,2.2250738585072014e-308,2.2250738585072014e-308] |
| NULL                                                                         |
+------------------------------------------------------------------------------+
select /*+ OPT_PARAM('rowsets_enabled', 'FALSE') */  array_sortby((x) -> (x=x),c6) from vtt1;
+------------------------------------------------------------------------------+
| array_sortby((x) -> (x=x),c6)                                                |
+------------------------------------------------------------------------------+
| [1.7976931348623157e308,2.2250738585072014e-308,2.2250738585072014e-308]     |
| [-1.7976931348623158e30,1.2,2.2250738585072014e-308,2.2250738585072014e-308] |
| NULL                                                                         |
+------------------------------------------------------------------------------+
select /*+ OPT_PARAM('rowsets_enabled', 'FALSE') */  array_sortby((x) -> (x=x),c6) from tt2;
+--------------------------------------------------------------------------+
| array_sortby((x) -> (x=x),c6)                                            |
+--------------------------------------------------------------------------+
| [1.7976931348623157e308,2.2250738585072014e-308,2.2250738585072014e-308] |
| [1.7976931348623157e308,1.2,2.2250738585072014e-308]                     |
| NULL                                                                     |
+--------------------------------------------------------------------------+
select /*+ OPT_PARAM('rowsets_enabled', 'FALSE') */  array_sortby((x) -> (x=x),c6) from vtt2;
+--------------------------------------------------------------------------+
| array_sortby((x) -> (x=x),c6)                                            |
+--------------------------------------------------------------------------+
| [1.7976931348623157e308,2.2250738585072014e-308,2.2250738585072014e-308] |
| [1.7976931348623157e308,1.2,2.2250738585072014e-308]                     |
| NULL                                                                     |
+--------------------------------------------------------------------------+
select /*+ OPT_PARAM('rowsets_enabled', 'FALSE') */  array_sortby((x) -> (x=x),c7) from tt1;
+-------------------------------+
| array_sortby((x) -> (x=x),c7) |
+-------------------------------+
| [-32768,0,32767,32767]        |
| [-32768,0,32767,0]            |
| NULL                          |
+-------------------------------+
select /*+ OPT_PARAM('rowsets_enabled', 'FALSE') */  array_sortby((x) -> (x=x),c7) from vtt1;
+-------------------------------+
| array_sortby((x) -> (x=x),c7) |
+-------------------------------+
| [-32768,0,32767,32767]        |
| [-32768,0,32767,0]            |
| NULL                          |
+-------------------------------+
select /*+ OPT_PARAM('rowsets_enabled', 'FALSE') */  array_sortby((x) -> (x=x),c7) from tt2;
+-------------------------------+
| array_sortby((x) -> (x=x),c7) |
+-------------------------------+
| [88,0,32767,32767]            |
| [68,0,32767,32766,1]          |
| NULL                          |
+-------------------------------+
select /*+ OPT_PARAM('rowsets_enabled', 'FALSE') */  array_sortby((x) -> (x=x),c7) from vtt2;
+-------------------------------+
| array_sortby((x) -> (x=x),c7) |
+-------------------------------+
| [88,0,32767,32767]            |
| [68,0,32767,32766,1]          |
| NULL                          |
+-------------------------------+

select +array_sort(c1) from tt1;
+---------------------------------------------------------+
| +array_sort(c1)                                         |
+---------------------------------------------------------+
| [-2147483648,-2147483647,0,77777]                       |
| [-2147483648,0,1,2,3,4,5,26,2147483647,2147483647,NULL] |
| NULL                                                    |
+---------------------------------------------------------+
select +array_sort(c1)from vtt2;
+---------------------------+
| +array_sort(c1)           |
+---------------------------+
| [0,2147483648,2147483648] |
| [0,4,87666,2147483647]    |
| NULL                      |
+---------------------------+
select -array_sort(c1)from tt1;
ERROR 22000: Invalid data type for the operation
select array_sort(c1)+array_sort(c1)from tt1;
+----------------------------------------------------------+
| array_sort(c1)+array_sort(c1)                            |
+----------------------------------------------------------+
| [-4294967296,-4294967294,0,155554]                       |
| [-4294967296,0,2,4,6,8,10,52,4294967294,4294967294,NULL] |
| NULL                                                     |
+----------------------------------------------------------+
select array_sort(c1)+1 from tt1;
ERROR 22000: Invalid data type for the operation
select array_sort(c1)+'test' from tt1;
ERROR 22032: Invalid JSON text.
select array_sort(c1)+null from tt1;
+---------------------+
| array_sort(c1)+null |
+---------------------+
| NULL                |
| NULL                |
| NULL                |
+---------------------+
select array_sort(c1)+false from tt1;
ERROR 22000: Invalid data type for the operation
select array_sort(c1)+true from tt1;
ERROR 22000: Invalid data type for the operation

select array_sort(c1)-array_sort(c1)from tt1;
+-------------------------------+
| array_sort(c1)-array_sort(c1) |
+-------------------------------+
| [0,0,0,0]                     |
| [0,0,0,0,0,0,0,0,0,0,NULL]    |
| NULL                          |
+-------------------------------+
select array_sort(c1)-1 from tt1;
ERROR 22000: Invalid data type for the operation
select array_sort(c1)-'test' from tt1;
ERROR 22032: Invalid JSON text.
select array_sort(c1)-null from tt1;
+---------------------+
| array_sort(c1)-null |
+---------------------+
| NULL                |
| NULL                |
| NULL                |
+---------------------+
select array_sort(c1)-false from tt1;
ERROR 22000: Invalid data type for the operation
select array_sort(c1)-true from tt1;
ERROR 22000: Invalid data type for the operation

select array_sort(c1)*1 from tt1;
ERROR 22000: Invalid data type for the operation
select array_sort(c1)*'test' from tt1;
ERROR 22032: Invalid JSON text.
select array_sort(c1)*null from tt1;
+---------------------+
| array_sort(c1)*null |
+---------------------+
| NULL                |
| NULL                |
| NULL                |
+---------------------+
select array_sort(c1)*false from tt1;
ERROR 22000: Invalid data type for the operation
select array_sort(c1)*true from tt1;
ERROR 22000: Invalid data type for the operation
select array_sort(c1)/array_sort(c1) from tt1;
ERROR 22000: Invalid data type for the operation
select array_sort(c1)/1 from tt1;
ERROR 22000: Invalid data type for the operation
select array_sort(c1)/'test' from tt1;
ERROR 22000: Invalid data type for the operation
select array_sort(c1)/null from tt1;
ERROR 22000: Invalid data type for the operation
select array_sort(c1)/false from tt1;
ERROR 22000: Invalid data type for the operation
select array_sort(c1)/true from tt1;
ERROR 22000: Invalid data type for the operation
select array_sort(c1) div array_sort(c1) from tt1;
ERROR 22000: Invalid data type for the operation
select array_sort(c1) div 1 from tt1;
ERROR 22000: Invalid data type for the operation
select array_sort(c1) div 'test' from tt1;
ERROR 22000: Invalid data type for the operation
select array_sort(c1) div null from tt1;
ERROR 22000: Invalid data type for the operation
select array_sort(c1) div false from tt1;
ERROR 22000: Invalid data type for the operation
select array_sort(c1) div true from tt1;
ERROR 22000: Invalid data type for the operation
select array_sort(c1) % array_sort(c1) from tt1;
ERROR 22000: Invalid data type for the operation
select array_sort(c1) % 1 from tt1;
ERROR 22000: Invalid data type for the operation
select array_sort(c1) % 'test' from tt1;
ERROR 22000: Invalid data type for the operation
select array_sort(c1) % null from tt1;
ERROR 22000: Invalid data type for the operation
select array_sort(c1) % false from tt1;
ERROR 22000: Invalid data type for the operation
select array_sort(c1) % true from tt1;
ERROR 22000: Invalid data type for the operation
select array_sort(c1) mod array_sort(c1) from tt1;
ERROR 22000: Invalid data type for the operation
select array_sort(c1) mod 1 from tt1;
ERROR 22000: Invalid data type for the operation
select array_sort(c1) mod 'test' from tt1;
ERROR 22000: Invalid data type for the operation
select array_sort(c1) mod null from tt1;
ERROR 22000: Invalid data type for the operation
select array_sort(c1) mod false from tt1;
ERROR 22000: Invalid data type for the operation
select array_sort(c1) mod true from tt1;
ERROR 22000: Invalid data type for the operation

select array_sort(c1) & array_sort(c1) from tt1;
ERROR 22000: Invalid data type for the operation
select array_sort(c1) | array_sort(c1) from tt1;
ERROR 22000: Invalid data type for the operation
select ~array_sort(c1)from tt1;
ERROR 22000: Invalid data type for the operation
select array_sort(c1) ^ array_sort(c1) from tt1;
ERROR 22000: Invalid data type for the operation
select array_sort(c1) << array_sort(c1) from tt1;
ERROR 22000: Invalid data type for the operation

select array_sort([c1]) is true from tt1;
ERROR 0A000: array_sort with multi-dimension array not supported
select array_sort(c1) in (array_sort(c1),cardinality([1,2,3,4,5,56,7,8,9,10])) from tt1;
ERROR 22000: Invalid data type for the operation

select array_sort(c1) like [-2147483648,0,77777] from tt1;
ERROR 22000: Invalid data type for the operation

select  array_sort(c1) is null from tt1;
+------------------------+
| array_sort(c1) is null |
+------------------------+
|                      0 |
|                      0 |
|                      1 |
+------------------------+
select  array_sort(c1) is not null from tt1;
+----------------------------+
| array_sort(c1) is not null |
+----------------------------+
|                          1 |
|                          1 |
|                          0 |
+----------------------------+
select  array_sort(c1) is false from tt1;
ERROR 22000: Invalid data type for the operation

select not array_sort(c1) from tt1;
ERROR 22000: Invalid data type for the operation
select  array_sort(c1) and array_sort(c1)  from tt1;
ERROR 22000: Invalid data type for the operation
select  array_sort(c1) && array_sort(c1)  from tt1;
ERROR 22000: Invalid data type for the operation
select  array_sort(c1) or array_sort(c1)  from tt1;
ERROR 22000: Invalid data type for the operation
select  array_sort(c1) || array_sort(c1)  from tt1;
ERROR 22000: Invalid data type for the operation
select  array_sort(c1) || true from tt1;
ERROR 22000: Invalid data type for the operation
select  array_sort(c1) XOR array_sort(c1)  from tt1;
ERROR 22000: Invalid data type for the operation
select  array_sort(c1) XOR 1 from tt1;
ERROR 22000: Invalid data type for the operation
select  'test' XOR array_sort(c1) from tt1;
ERROR 22000: Invalid data type for the operation
SELECT BINARY array_sort(c1) = array_sort(c1) from tt1;
ERROR 22000: Invalid data type for the operation
select CONVERT(array_sort(c1) USING BINARY) from tt1;
ERROR 22000: Invalid data type for the operation

SELECT CASE array_sort(c3) WHEN array_sort(c1) THEN array_sort(c1) WHEN array_sort(c1) THEN array_sort(c1) END from tt1;
+---------------------------------------------------------------------------------------------------------+
| CASE array_sort(c3) WHEN array_sort(c1) THEN array_sort(c1) WHEN array_sort(c1) THEN array_sort(c1) END |
+---------------------------------------------------------------------------------------------------------+
| NULL                                                                                                    |
| NULL                                                                                                    |
| NULL                                                                                                    |
+---------------------------------------------------------------------------------------------------------+
SELECT CASE  WHEN array_sort(c2) =array_sort(c2) THEN array_sort(c1) else  array_sort(c1) END from vtt1;
+----------------------------------------------------------------------------------------+
| CASE  WHEN array_sort(c2) =array_sort(c2) THEN array_sort(c1) else  array_sort(c1) END |
+----------------------------------------------------------------------------------------+
| [-2147483648,-2147483647,0,77777]                                                      |
| [-2147483648,0,1,2,3,4,5,26,2147483647,2147483647,NULL]                                |
| NULL                                                                                   |
+----------------------------------------------------------------------------------------+

SELECT CASE  WHEN cardinality([1]) =array_sort(c1) THEN array_sort(c1) else  array_sort(c1)  END from vtt1;
ERROR HY000: Invalid argument

drop table tt3;
create table tt3(id int,c array(int),c1 array(int),c2 array(tinyint));
drop view vtt3;
create view vtt3 as select * from tt3;
insert into tt3 values(1,[1,3],[null],[2,4]);
insert /*+ OPT_PARAM('rowsets_enabled', 'FALSE') */ /*+ OPT_PARAM('rowsets_enabled', 'FALSE') */ into tt3 values(2,[null,null,3,2,1,25,4,2],[2,4,3,4],[3,4,2,2,1,6,4,5]);

drop table tt3;
create table tt3(id int,c array(int),c1 array(int),c2 array(int));
insert into tt3 values((select array_length([1,7,8,4,6,3,2,3,3])),
(select array_sort(c3) from tt1 limit 1),(select array_sort(c2) from tt3 limit 1),(select array_sort(c7) from vtt1 limit 1));

insert into tt3 values((select array_length([5,3,7,6,7,6,8,3])),(select array_sort(c3) from tt1 limit 1),
(select array_sort([3,2,1,5,4,2,4]) from tt2 limit 1),(select array_sort(c7) from vtt1 limit 1));
select * from tt3;
+------+--------------+-----------------+------------------------+
| id   | c            | c1              | c2                     |
+------+--------------+-----------------+------------------------+
|    9 | [-128,0,127] | NULL            | [-32768,0,32767,32767] |
|    8 | [-128,0,127] | [1,2,2,3,4,4,5] | [-32768,0,32767,32767] |
+------+--------------+-----------------+------------------------+

replace into tt3 values(2,(select array_sort([3,1,2,5,6,4,3,4,4])),(select array_sort([2,4])),(select array_sort([null])));
select * from tt3;
+------+---------------------+-----------------+------------------------+
| id   | c                   | c1              | c2                     |
+------+---------------------+-----------------+------------------------+
|    9 | [-128,0,127]        | NULL            | [-32768,0,32767,32767] |
|    8 | [-128,0,127]        | [1,2,2,3,4,4,5] | [-32768,0,32767,32767] |
|    2 | [1,2,3,3,4,4,4,5,6] | [2,4]           | [NULL]                 |
+------+---------------------+-----------------+------------------------+

insert into tt3 values((select array_length([null,3,4,3])),
(select array_sort(c3) from tt1 limit 1),(select array_sort(c3) from tt2 limit 1),(select array_sort([1,null,2,4,3,null,5,3,2,1]) from vtt1 limit 1)) ON DUPLICATE KEY UPDATE  id=array_length([1]);

insert into tt3 values((select array_length([3,4,3])),
(select array_sort([1,3,3,4,2,2,3])),(select array_sort([3,2,1,2,1,1,null])),(select array_sort([1,null]) )) ON DUPLICATE KEY UPDATE  id=array_length([1,2]);

update /*+ OPT_PARAM('rowsets_enabled', 'FALSE') */ /*+ OPT_PARAM('rowsets_enabled', 'FALSE') */ tt3 set c2= array_sort([2,3,4,3,2,3,5,4,6,5,7,6,5,41,2,1,4,8,9,8,90]) ;

select * from tt3;
+------+---------------------+---------------------------+-----------------------------------------------+
| id   | c                   | c1                        | c2                                            |
+------+---------------------+---------------------------+-----------------------------------------------+
|    9 | [-128,0,127]        | NULL                      | [1,2,2,2,3,3,3,4,4,4,5,5,5,6,6,7,8,8,9,41,90] |
|    8 | [-128,0,127]        | [1,2,2,3,4,4,5]           | [1,2,2,2,3,3,3,4,4,4,5,5,5,6,6,7,8,8,9,41,90] |
|    2 | [1,2,3,3,4,4,4,5,6] | [2,4]                     | [1,2,2,2,3,3,3,4,4,4,5,5,5,6,6,7,8,8,9,41,90] |
|    4 | [-128,0,127]        | [0,0,3,5,5,7,7,8,9,52,67] | [1,2,2,2,3,3,3,4,4,4,5,5,5,6,6,7,8,8,9,41,90] |
|    3 | [1,2,2,3,3,3,4]     | [1,1,1,2,2,3,NULL]        | [1,2,2,2,3,3,3,4,4,4,5,5,5,6,6,7,8,8,9,41,90] |
+------+---------------------+---------------------------+-----------------------------------------------+
update tt3 set c2= array_sort([1,2,3,4,4,null,6,5,5,6,7,8,9,9,90]) limit 1;
update vtt3 set c2= array_sort([1,2,3,4,5,6,7,8,null,null,4,3,2,3,6,5,4,3,9,9,90]);
update /*+ enable_parallel_dml parallel(2) append*/ tt3 set c2= (select array_sort([null,7,null,5,3,null,2,4,5,3,2,3,5,7,8,99,null]) limit 1);
update vtt3 set c2= (select array_sort([null,3,2,4,2,5,1,2,null,null]));
select * from tt3;
+------+---------------------+---------------------------+--------------------------------+
| id   | c                   | c1                        | c2                             |
+------+---------------------+---------------------------+--------------------------------+
|    9 | [-128,0,127]        | NULL                      | [1,2,2,2,3,4,5,NULL,NULL,NULL] |
|    8 | [-128,0,127]        | [1,2,2,3,4,4,5]           | [1,2,2,2,3,4,5,NULL,NULL,NULL] |
|    2 | [1,2,3,3,4,4,4,5,6] | [2,4]                     | [1,2,2,2,3,4,5,NULL,NULL,NULL] |
|    4 | [-128,0,127]        | [0,0,3,5,5,7,7,8,9,52,67] | [1,2,2,2,3,4,5,NULL,NULL,NULL] |
|    3 | [1,2,2,3,3,3,4]     | [1,1,1,2,2,3,NULL]        | [1,2,2,2,3,4,5,NULL,NULL,NULL] |
+------+---------------------+---------------------------+--------------------------------+
delete  /*+ enable_parallel_dml parallel(2) append*/ from tt3;

drop table tt3;
create table tt3(c1 array(int));

drop view vtt3;
create view vtt3 as select * from tt3;
insert into tt3 select array_sort([8,9,8,1,null,null,4,5,4,1,3,2,null,5,9]);
replace into tt3 select array_sort([8,9,8,1,null,null,7,6,5,1,3,2,null,6,7]);
select * from tt3;
+------------------------------------------+
| c1                                       |
+------------------------------------------+
| [1,1,2,3,4,4,5,5,8,8,9,9,NULL,NULL,NULL] |
| [1,1,2,3,5,6,6,7,7,8,8,9,NULL,NULL,NULL] |
+------------------------------------------+

insert /*+ direct(true,100,'inc') enable_parallel_dml parallel(2)*/ into tt3 select array_sort(c1) from tt1;
insert /*+ direct(true,100) enable_parallel_dml parallel(2) append*/ into tt3 select array_sort(c1) from tt1;

replace /*+ direct(true,100,'inc') enable_parallel_dml parallel(2)*/ into tt3 select array_sort(c1) from tt1;
replace /*+ direct(true,100) enable_parallel_dml parallel(2) append*/ into tt3 select array_sort(c1) from tt1;

insert overwrite tt3 select array_sort([2,1,4,5,6,4,5,3,4,null,67,8,7,5,65,3,2,null,null,null]);
select * from tt3;
+---------------------------------------------------------+
| c1                                                      |
+---------------------------------------------------------+
| [1,2,2,3,3,4,4,4,5,5,5,6,7,8,65,67,NULL,NULL,NULL,NULL] |
+---------------------------------------------------------+

drop table tt3;
create table tt3 as select array_sort([1,2,3,-2,-1,-2,-2,7,3,2,4,5,43,2,null,423,2,3,null,null,32,8,9,9,90,90]) as a;
desc tt3;
+-------+---------------+------+-----+---------+-------+
| Field | Type          | Null | Key | Default | Extra |
+-------+---------------+------+-----+---------+-------+
| a     | ARRAY(BIGINT) | YES  |     | NULL    |       |
+-------+---------------+------+-----+---------+-------+
select * from tt3;
+--------------------------------------------------------------------------+
| a                                                                        |
+--------------------------------------------------------------------------+
| [-2,-2,-2,-1,1,2,2,2,2,3,3,3,4,5,7,8,9,9,32,43,90,90,423,NULL,NULL,NULL] |
+--------------------------------------------------------------------------+
insert into tt3 values(array_sort([1,2,3,-2,-1,-2,-2,7,3,2,4,5,43,2,null,423,2,3,null,null,32,8,9,9,90,90]));
select * from tt3;
+--------------------------------------------------------------------------+
| a                                                                        |
+--------------------------------------------------------------------------+
| [-2,-2,-2,-1,1,2,2,2,2,3,3,3,4,5,7,8,9,9,32,43,90,90,423,NULL,NULL,NULL] |
| [-2,-2,-2,-1,1,2,2,2,2,3,3,3,4,5,7,8,9,9,32,43,90,90,423,NULL,NULL,NULL] |
+--------------------------------------------------------------------------+
delete from tt3;

drop table tt3;
create table tt3 as select array_sort(c1) from tt1;
desc tt3;
+----------------+------------+------+-----+---------+-------+
| Field          | Type       | Null | Key | Default | Extra |
+----------------+------------+------+-----+---------+-------+
| array_sort(c1) | ARRAY(INT) | YES  |     | NULL    |       |
+----------------+------------+------+-----+---------+-------+
insert into tt3 values((select array_sort(c1) from tt1 limit 1));
select * from tt3;
+---------------------------------------------------------+
| array_sort(c1)                                          |
+---------------------------------------------------------+
| [-2147483648,-2147483647,0,77777]                       |
| [-2147483648,0,1,2,3,4,5,26,2147483647,2147483647,NULL] |
| NULL                                                    |
| [-2147483648,-2147483647,0,77777]                       |
+---------------------------------------------------------+
delete from tt3;

drop view vtt3;
create view vtt3 as select array_sort(c1) from tt1;
select * from vtt3;
+---------------------------------------------------------+
| array_sort(c1)                                          |
+---------------------------------------------------------+
| [-2147483648,-2147483647,0,77777]                       |
| [-2147483648,0,1,2,3,4,5,26,2147483647,2147483647,NULL] |
| NULL                                                    |
+---------------------------------------------------------+
desc vtt3;
+----------------+------------+------+-----+---------+-------+
| Field          | Type       | Null | Key | Default | Extra |
+----------------+------------+------+-----+---------+-------+
| array_sort(c1) | ARRAY(INT) | YES  |     | NULL    |       |
+----------------+------------+------+-----+---------+-------+

drop table tt3;
create table tt3(id int, a array(int) as (array_sort([5,4,3,6,7,6,7,8,7,-1,2,1,-4,0,-6,-7,-3,-2,0,3,2,null,null,null,54,3,90])) STORED);
desc tt3;
+-------+------------+------+-----+-------------------------------------------------------------------------------------------+------------------+
| Field | Type       | Null | Key | Default                                                                                   | Extra            |
+-------+------------+------+-----+-------------------------------------------------------------------------------------------+------------------+
| id    | int(11)    | YES  |     | NULL                                                                                      |                  |
| a     | ARRAY(INT) | YES  |     | array_sort(array(5,4,3,6,7,6,7,8,7,-1,2,1,-4,0,-6,-7,-3,-2,0,3,2,NULL,NULL,NULL,54,3,90)) | STORED GENERATED |
+-------+------------+------+-----+-------------------------------------------------------------------------------------------+------------------+
insert into  tt3(id) values(1);
select * from tt3;
+------+--------------------------------------------------------------------------+
| id   | a                                                                        |
+------+--------------------------------------------------------------------------+
|    1 | [-7,-6,-4,-3,-2,-1,0,0,1,2,2,3,3,3,4,5,6,6,7,7,7,8,54,90,NULL,NULL,NULL] |
+------+--------------------------------------------------------------------------+
delete from tt3;
insert into  tt3(id) values(1);
truncate tt3;
select * from tt3;
+------+------+
| id   | a    |
+------+------+
+------+------+

drop table tt3;
create table tt3(id int, a array(int) as (array_sort([5,4,3,6,7,6,7,8,7,-1,2,1,-4,0,-6,-7,-3,-2,0,3,2,null,null,null,54,3,90])) VIRTUAL);
desc tt3;
+-------+------------+------+-----+-------------------------------------------------------------------------------------------+-------------------+
| Field | Type       | Null | Key | Default                                                                                   | Extra             |
+-------+------------+------+-----+-------------------------------------------------------------------------------------------+-------------------+
| id    | int(11)    | YES  |     | NULL                                                                                      |                   |
| a     | ARRAY(INT) | YES  |     | array_sort(array(5,4,3,6,7,6,7,8,7,-1,2,1,-4,0,-6,-7,-3,-2,0,3,2,NULL,NULL,NULL,54,3,90)) | VIRTUAL GENERATED |
+-------+------------+------+-----+-------------------------------------------------------------------------------------------+-------------------+
insert into  tt3(id) values(1);
select * from tt3;
+------+--------------------------------------------------------------------------+
| id   | a                                                                        |
+------+--------------------------------------------------------------------------+
|    1 | [-7,-6,-4,-3,-2,-1,0,0,1,2,2,3,3,3,4,5,6,6,7,7,7,8,54,90,NULL,NULL,NULL] |
+------+--------------------------------------------------------------------------+
delete from tt3;
insert into  tt3(id) values(1);
truncate tt3;
select * from tt3;
+------+------+
| id   | a    |
+------+------+
+------+------+

drop table tt3;
create table tt3(id int, a array(int) as (array_sort([5,4,3,6,7,6,7,8,7,-1,2,1,-4,0,-6,-7,-3,-2,0,3,2,null,null,null,54,3,90])) );
desc tt3;
+-------+------------+------+-----+-------------------------------------------------------------------------------------------+-------------------+
| Field | Type       | Null | Key | Default                                                                                   | Extra             |
+-------+------------+------+-----+-------------------------------------------------------------------------------------------+-------------------+
| id    | int(11)    | YES  |     | NULL                                                                                      |                   |
| a     | ARRAY(INT) | YES  |     | array_sort(array(5,4,3,6,7,6,7,8,7,-1,2,1,-4,0,-6,-7,-3,-2,0,3,2,NULL,NULL,NULL,54,3,90)) | VIRTUAL GENERATED |
+-------+------------+------+-----+-------------------------------------------------------------------------------------------+-------------------+
insert into  tt3(id) values(1);
select * from tt3;
+------+--------------------------------------------------------------------------+
| id   | a                                                                        |
+------+--------------------------------------------------------------------------+
|    1 | [-7,-6,-4,-3,-2,-1,0,0,1,2,2,3,3,3,4,5,6,6,7,7,7,8,54,90,NULL,NULL,NULL] |
+------+--------------------------------------------------------------------------+
delete from tt3;
insert into  tt3(id) values(1);
truncate tt3;
select * from tt3;
+------+------+
| id   | a    |
+------+------+
+------+------+

drop table tt3;
create table tt3(id int);
ALTER TABLE tt3
ADD COLUMN a array(int) AS (array_sort(([5,4,3,6,7,6,7,8,7,-1,2,1,-4,0,-6,-7,-3,-2,0,3,2,null,null,null,54,3,90]))) STORED;
desc tt3;
+-------+------------+------+-----+-------------------------------------------------------------------------------------------+------------------+
| Field | Type       | Null | Key | Default                                                                                   | Extra            |
+-------+------------+------+-----+-------------------------------------------------------------------------------------------+------------------+
| id    | int(11)    | YES  |     | NULL                                                                                      |                  |
| a     | ARRAY(INT) | YES  |     | array_sort(array(5,4,3,6,7,6,7,8,7,-1,2,1,-4,0,-6,-7,-3,-2,0,3,2,NULL,NULL,NULL,54,3,90)) | STORED GENERATED |
+-------+------------+------+-----+-------------------------------------------------------------------------------------------+------------------+
insert into  tt3(id) values(1);
select * from tt3;
+------+--------------------------------------------------------------------------+
| id   | a                                                                        |
+------+--------------------------------------------------------------------------+
|    1 | [-7,-6,-4,-3,-2,-1,0,0,1,2,2,3,3,3,4,5,6,6,7,7,7,8,54,90,NULL,NULL,NULL] |
+------+--------------------------------------------------------------------------+
delete from tt3;
insert into  tt3(id) values(1);
truncate tt3;
select * from tt3;
+------+------+
| id   | a    |
+------+------+
+------+------+

drop table tt3;
create table tt3(id int);
ALTER TABLE tt3
ADD COLUMN a array(int) AS (array_sort(([5,4,3,6,7,6,7,8,7,-1,2,1,-4,0,-6,-7,-3,-2,0,3,2,null,null,null,54,3,90]))) VIRTUAL;
desc tt3;
+-------+------------+------+-----+-------------------------------------------------------------------------------------------+-------------------+
| Field | Type       | Null | Key | Default                                                                                   | Extra             |
+-------+------------+------+-----+-------------------------------------------------------------------------------------------+-------------------+
| id    | int(11)    | YES  |     | NULL                                                                                      |                   |
| a     | ARRAY(INT) | YES  |     | array_sort(array(5,4,3,6,7,6,7,8,7,-1,2,1,-4,0,-6,-7,-3,-2,0,3,2,NULL,NULL,NULL,54,3,90)) | VIRTUAL GENERATED |
+-------+------------+------+-----+-------------------------------------------------------------------------------------------+-------------------+
insert into  tt3(id) values(1);
select * from tt3;
+------+--------------------------------------------------------------------------+
| id   | a                                                                        |
+------+--------------------------------------------------------------------------+
|    1 | [-7,-6,-4,-3,-2,-1,0,0,1,2,2,3,3,3,4,5,6,6,7,7,7,8,54,90,NULL,NULL,NULL] |
+------+--------------------------------------------------------------------------+
delete from tt3;
insert into  tt3(id) values(1);
truncate tt3;
select * from tt3;
+------+------+
| id   | a    |
+------+------+
+------+------+

drop table tt3;
create table tt3(id int,a varchar(50),ar array(int),INDEX index_1((array_sort(ar))));
ERROR HY000: Functional index on a column is not supported. Consider using a regular index instead.
CREATE TABLE tt3 (id INT,a VARCHAR(50),ar array(INT),INDEX index_1 (ar));
ERROR 0A000: vector column index but not vector index is not supported

CREATE TABLE tt3 (id INT,a VARCHAR(50),ar array(INT),INDEX index_1 (id));

drop table tt3;
create table tt3(id int,a varchar(50),r int[])PARTITION BY range COLUMNS(id)(
PARTITION p0 values less than(19),
PARTITION p1 values less than(25),
PARTITION p2 values less than(30)
) ;
CREATE INDEX index_1 ON tt3 ((array_sort(r)));
ERROR HY000: Functional index on a column is not supported. Consider using a regular index instead.
insert into tt3 values(1,'test',[-1,2,330,50]);
insert into tt3 values(2,'test1',[840-2934,945,4512]);
insert into tt3 values(3,'test',[90,4581,932114]);
insert into tt3 values(5,'test',[9,4581,932114]);
select * from tt3;
+------+-------+------------------+
| id   | a     | r                |
+------+-------+------------------+
|    1 | test  | [-1,2,330,50]    |
|    2 | test1 | [-2094,945,4512] |
|    3 | test  | [90,4581,932114] |
|    5 | test  | [9,4581,932114]  |
+------+-------+------------------+
drop table tt5;
create table tt5(id int primary key,v vector(2), a varchar(100),d double,a1 array(float),a2 array(int))
PARTITION BY range COLUMNS(id)(
PARTITION p0 values less than(19),
PARTITION p1 values less than(25),
PARTITION p2 values less than(30)
);

insert into tt5 values(1,[1,2],'test','1.2E-2',[1,525.12E-2],[1,1,1,null,-1,1,3,2,7,99,44,3,32,3,4,5]);
insert into tt5 values(2,[1,2],'test1','1.5E-2',[1,523.12E-2],[2,3,1,4,5]);
insert into tt5 values(3,[1,2],'test2','1.5E-2',[1,523.12E-2],[1,2,3,4,5]);
insert into tt5 values(4,[3,4],'test3','142143144.5E-7',[1,523.12E-2],[1,6,3,4,5,5,4,5]);
insert into tt5 values(5,[6,7],'test4','142143144.5E-7',[1,523.12E-2],[3,4,5,null,3,2,1,2,1]);
insert into tt5 values(6,null,'test4','142143144.5E-7',[1,523.12E-2],[2,2,null,-2,-5,3,4,3,41,5]);
insert into tt5 values(7,null,'test5','142143144.5E-7',[1,523.12E-2],[444,3,2,3,21,5,6,6,null,5,5,5,5]);
insert into tt5 values(8,[6,7],'test6','142143144.5E-7',[1,523.12E+2,1,6,9],[null,3,2,1,4,5]);
insert into tt5 values(9,[6,7],'test6','142143144.5E-7',null,[9,8,7,3,4,5]);
insert into tt5 values(20,[6,7],null,'142143144.5E-7',null,[4,6,4,3,2,1,5,4,3,2]);

drop view vtt5;
create view vtt5 as select * from tt5;

drop table tt6;
create table tt6(id int primary key,v vector(2), a varchar(100),d double,a1 array(float),a2 int[])
PARTITION BY range COLUMNS(id)(
PARTITION p0 values less than(19),
PARTITION p1 values less than(25),
PARTITION p2 values less than(30)
);

insert into tt6 values(1,[1,2],'test','1.2E-2',[1,525.12E-2],[1,2,3,4,5]);
insert into tt6 values(2,[1,2],'test1','1.5E-2',[1,523.12E-2],[1,2,3,4,5]);
insert into tt6 values(3,[1,2],'test2','1.5E-2',[1,523.12E-2],[1,2,3,4,5]);
insert into tt6 values(4,[3,4],'test3','142143144.5E-7',[1,523.12E-2],[1,6,3,4,5]);
insert into tt6 values(5,[6,7],'test4','142143144.5E-7',[1,523.12E-2],[1,2,3,4,5]);
insert into tt6 values(6,null,'test4','142143144.5E-7',[1,523.12E-2],[5,2,3,4,5]);
insert into tt6 values(7,null,'test5','142143144.5E-7',[1,523.12E-2],[1,2,3,4,5]);
insert into tt6 values(8,[6,7],'test6','142143144.5E-7',[1,523.12E+2,1,6,9],[1,2,3,4,5]);
insert into tt6 values(9,[6,7],'test6','142143144.5E-7',null,[1,2,3,4,5]);
insert into tt6 values(20,[6,7],null,'142143144.5E-7',null,[1,2,3,4,6]);

drop view vtt6;
create view vtt6 as select * from tt6;

select array_sort(a2) from tt5 UNION ALL select array_sort(a2) from tt6;
+------------------------------------------+
| array_sort(a2)                           |
+------------------------------------------+
| [-1,1,1,1,1,2,3,3,3,4,5,7,32,44,99,NULL] |
| [1,2,3,4,5]                              |
| [1,2,3,4,5]                              |
| [1,3,4,4,5,5,5,6]                        |
| [1,1,2,2,3,3,4,5,NULL]                   |
| [-5,-2,2,2,3,3,4,5,41,NULL]              |
| [2,3,3,5,5,5,5,5,6,6,21,444,NULL]        |
| [1,2,3,4,5,NULL]                         |
| [3,4,5,7,8,9]                            |
| [1,2,2,3,3,4,4,4,5,6]                    |
| [1,2,3,4,5]                              |
| [1,2,3,4,5]                              |
| [1,2,3,4,5]                              |
| [1,3,4,5,6]                              |
| [1,2,3,4,5]                              |
| [2,3,4,5,5]                              |
| [1,2,3,4,5]                              |
| [1,2,3,4,5]                              |
| [1,2,3,4,5]                              |
| [1,2,3,4,6]                              |
+------------------------------------------+
select a1,a2 from tt5 UNION ALL select a1 ,a2 from tt6;
+-----------------+------------------------------------------+
| a1              | a2                                       |
+-----------------+------------------------------------------+
| [1,5.2512]      | [1,1,1,NULL,-1,1,3,2,7,99,44,3,32,3,4,5] |
| [1,5.2312]      | [2,3,1,4,5]                              |
| [1,5.2312]      | [1,2,3,4,5]                              |
| [1,5.2312]      | [1,6,3,4,5,5,4,5]                        |
| [1,5.2312]      | [3,4,5,NULL,3,2,1,2,1]                   |
| [1,5.2312]      | [2,2,NULL,-2,-5,3,4,3,41,5]              |
| [1,5.2312]      | [444,3,2,3,21,5,6,6,NULL,5,5,5,5]        |
| [1,52312,1,6,9] | [NULL,3,2,1,4,5]                         |
| NULL            | [9,8,7,3,4,5]                            |
| NULL            | [4,6,4,3,2,1,5,4,3,2]                    |
| [1,5.2512]      | [1,2,3,4,5]                              |
| [1,5.2312]      | [1,2,3,4,5]                              |
| [1,5.2312]      | [1,2,3,4,5]                              |
| [1,5.2312]      | [1,6,3,4,5]                              |
| [1,5.2312]      | [1,2,3,4,5]                              |
| [1,5.2312]      | [5,2,3,4,5]                              |
| [1,5.2312]      | [1,2,3,4,5]                              |
| [1,52312,1,6,9] | [1,2,3,4,5]                              |
| NULL            | [1,2,3,4,5]                              |
| NULL            | [1,2,3,4,6]                              |
+-----------------+------------------------------------------+
select * from tt5 UNION select * from tt6;
+----+-------+-------+-------------+-----------------+------------------------------------------+
| id | v     | a     | d           | a1              | a2                                       |
+----+-------+-------+-------------+-----------------+------------------------------------------+
|  1 | [1,2] | test  |       0.012 | [1,5.2512]      | [1,2,3,4,5]                              |
|  1 | [1,2] | test  |       0.012 | [1,5.2512]      | [1,1,1,NULL,-1,1,3,2,7,99,44,3,32,3,4,5] |
|  2 | [1,2] | test1 |       0.015 | [1,5.2312]      | [1,2,3,4,5]                              |
|  2 | [1,2] | test1 |       0.015 | [1,5.2312]      | [2,3,1,4,5]                              |
|  3 | [1,2] | test2 |       0.015 | [1,5.2312]      | [1,2,3,4,5]                              |
|  4 | [3,4] | test3 | 14.21431445 | [1,5.2312]      | [1,6,3,4,5]                              |
|  4 | [3,4] | test3 | 14.21431445 | [1,5.2312]      | [1,6,3,4,5,5,4,5]                        |
|  5 | [6,7] | test4 | 14.21431445 | [1,5.2312]      | [1,2,3,4,5]                              |
|  5 | [6,7] | test4 | 14.21431445 | [1,5.2312]      | [3,4,5,NULL,3,2,1,2,1]                   |
|  6 | NULL  | test4 | 14.21431445 | [1,5.2312]      | [5,2,3,4,5]                              |
|  6 | NULL  | test4 | 14.21431445 | [1,5.2312]      | [2,2,NULL,-2,-5,3,4,3,41,5]              |
|  7 | NULL  | test5 | 14.21431445 | [1,5.2312]      | [1,2,3,4,5]                              |
|  7 | NULL  | test5 | 14.21431445 | [1,5.2312]      | [444,3,2,3,21,5,6,6,NULL,5,5,5,5]        |
|  8 | [6,7] | test6 | 14.21431445 | [1,52312,1,6,9] | [1,2,3,4,5]                              |
|  8 | [6,7] | test6 | 14.21431445 | [1,52312,1,6,9] | [NULL,3,2,1,4,5]                         |
|  9 | [6,7] | test6 | 14.21431445 | NULL            | [1,2,3,4,5]                              |
|  9 | [6,7] | test6 | 14.21431445 | NULL            | [9,8,7,3,4,5]                            |
| 20 | [6,7] | NULL  | 14.21431445 | NULL            | [1,2,3,4,6]                              |
| 20 | [6,7] | NULL  | 14.21431445 | NULL            | [4,6,4,3,2,1,5,4,3,2]                    |
+----+-------+-------+-------------+-----------------+------------------------------------------+
SELECT array_sort(a2) FROM tt5 UNION ALL SELECT array_sort(a2) FROM tt6;
+------------------------------------------+
| array_sort(a2)                           |
+------------------------------------------+
| [-1,1,1,1,1,2,3,3,3,4,5,7,32,44,99,NULL] |
| [1,2,3,4,5]                              |
| [1,2,3,4,5]                              |
| [1,3,4,4,5,5,5,6]                        |
| [1,1,2,2,3,3,4,5,NULL]                   |
| [-5,-2,2,2,3,3,4,5,41,NULL]              |
| [2,3,3,5,5,5,5,5,6,6,21,444,NULL]        |
| [1,2,3,4,5,NULL]                         |
| [3,4,5,7,8,9]                            |
| [1,2,2,3,3,4,4,4,5,6]                    |
| [1,2,3,4,5]                              |
| [1,2,3,4,5]                              |
| [1,2,3,4,5]                              |
| [1,3,4,5,6]                              |
| [1,2,3,4,5]                              |
| [2,3,4,5,5]                              |
| [1,2,3,4,5]                              |
| [1,2,3,4,5]                              |
| [1,2,3,4,5]                              |
| [1,2,3,4,6]                              |
+------------------------------------------+
select array_sort(a2) from tt5 union all select array_sort(a2) from tt6 where array_length(a2) > 3;
+------------------------------------------+
| array_sort(a2)                           |
+------------------------------------------+
| [-1,1,1,1,1,2,3,3,3,4,5,7,32,44,99,NULL] |
| [1,2,3,4,5]                              |
| [1,2,3,4,5]                              |
| [1,3,4,4,5,5,5,6]                        |
| [1,1,2,2,3,3,4,5,NULL]                   |
| [-5,-2,2,2,3,3,4,5,41,NULL]              |
| [2,3,3,5,5,5,5,5,6,6,21,444,NULL]        |
| [1,2,3,4,5,NULL]                         |
| [3,4,5,7,8,9]                            |
| [1,2,2,3,3,4,4,4,5,6]                    |
| [1,2,3,4,5]                              |
| [1,2,3,4,5]                              |
| [1,2,3,4,5]                              |
| [1,3,4,5,6]                              |
| [1,2,3,4,5]                              |
| [2,3,4,5,5]                              |
| [1,2,3,4,5]                              |
| [1,2,3,4,5]                              |
| [1,2,3,4,5]                              |
| [1,2,3,4,6]                              |
+------------------------------------------+

(SELECT array_sort(a2) FROM tt5) UNION ALL (SELECT array_sort(a2) FROM tt6 ORDER BY array_length(a2) desc);
+------------------------------------------+
| array_sort(a2)                           |
+------------------------------------------+
| [-1,1,1,1,1,2,3,3,3,4,5,7,32,44,99,NULL] |
| [1,2,3,4,5]                              |
| [1,2,3,4,5]                              |
| [1,3,4,4,5,5,5,6]                        |
| [1,1,2,2,3,3,4,5,NULL]                   |
| [-5,-2,2,2,3,3,4,5,41,NULL]              |
| [2,3,3,5,5,5,5,5,6,6,21,444,NULL]        |
| [1,2,3,4,5,NULL]                         |
| [3,4,5,7,8,9]                            |
| [1,2,2,3,3,4,4,4,5,6]                    |
| [1,2,3,4,5]                              |
| [1,2,3,4,5]                              |
| [1,2,3,4,5]                              |
| [1,3,4,5,6]                              |
| [1,2,3,4,5]                              |
| [2,3,4,5,5]                              |
| [1,2,3,4,5]                              |
| [1,2,3,4,5]                              |
| [1,2,3,4,5]                              |
| [1,2,3,4,6]                              |
+------------------------------------------+

drop table tt7;
create table tt7(id int primary key,v vector(2), a varchar(100),d double,a1 array(float),a2 array(int))
PARTITION BY range COLUMNS(id)(
PARTITION p0 values less than(19),
PARTITION p1 values less than(25),
PARTITION p2 values less than(30)
);

insert into tt7 values(1,[1,2],'test','1.2E-2',[1,525.12E-2],[4,1,3,2,4,6,5,7,6,5]);
insert into tt7 values(2,[1,2],'test1','1.5E-2',[1,523.12E-2],[2,4,5,3,11,7,5,4,34]);
insert into tt7 values(3,[1,2],'test2','1.5E-2',[1,523.12E-2],[1,2,2,7,99,7,3,4,5,6,4,4,5]);
insert into tt7 values(4,[3,4],'test3','142143144.5E-7',[1,523.12E-2],[1,6,6,6,6,3,4,5]);
insert into tt7 values(5,[6,7],'test4','142143144.5E-7',[1,523.12E-2],[1,3,2,4,4,7,8,6,9,4,5]);
insert into tt7 values(6,null,'test4','142143144.5E-7',[1,523.12E-2],[5,2,2,3,4,5]);
insert into tt7 values(7,null,'test5','142143144.5E-7',[1,523.12E-2],[1,3,2,6,7,4,5]);
insert into tt7 values(8,[6,7],'test6','142143144.5E-7',[1,523.12E+2,1,6,9],[1,1,1,1,12,3,4,5]);
insert into tt7 values(9,[6,7],'test6','142143144.5E-7',null,[1,7,5,6,4,3,2,3,4,5,90,88]);
insert into tt7 values(20,[6,7],null,'142143144.5E-7',null,[19,1,3,2,45,6,3,4,2,3,5,464,33,7]);

drop view vtt7;
create view vtt7 as select * from tt7;

create materialized view mv1 as select array_sort(a2) from tt7;
desc mv1;
+----------------+------------+------+-----+---------+-------+
| Field          | Type       | Null | Key | Default | Extra |
+----------------+------------+------+-----+---------+-------+
| array_sort(a2) | ARRAY(INT) | YES  |     | NULL    |       |
+----------------+------------+------+-----+---------+-------+
insert into tt7 values(21,[6,7],null,'142143144.5E-7',null,[1,4,6,7,6,5,4,43,2,null]);
call DBMS_MVIEW.REFRESH('mv1','c');
DROP materialized view mv1;

create materialized view mv1  as select array_length(a2) from tt7;
call DBMS_MVIEW.REFRESH('mv1','c');

DROP materialized view mv1;

drop table tt1;
create table tt1(id int,c1 array(int), c2 array(varchar(256)), c3 array(tinyint), c4 array(bigint), c5 array(float), c6 array(double), c7 array(smallint));

insert into tt1 values(1,[null,null,-2147483648,-2147483647,0,77777],['','test','test',null,null],[127,0,-128,127,null],[-9223372036854775808,775,808,2,0],[-9223372036854775808,775,808,2,0],[null,null,3.402, 0, 1.175,3.266,null,null],
[-32768,0,32767,32767]);

insert into tt1 values(2,[null,null],[null,null,'',''],[null,null,1],[null,null,1],[null,null,1],[null,null,1,0],[null,null,1,0]);

insert into tt1 values(3,null,null,null,null,null,null,null);

select * from tt1;
+------+---------------------------------------------+------------------------------+-----------------------+------------------------------------+---------------------------+-------------------------------------------+------------------------+
| id   | c1                                          | c2                           | c3                    | c4                                 | c5                        | c6                                        | c7                     |
+------+---------------------------------------------+------------------------------+-----------------------+------------------------------------+---------------------------+-------------------------------------------+------------------------+
|    1 | [NULL,NULL,-2147483648,-2147483647,0,77777] | ["","test","test",NULL,NULL] | [127,0,-128,127,NULL] | [-9223372036854775808,775,808,2,0] | [-9.22337e18,775,808,2,0] | [NULL,NULL,3.402,0,1.175,3.266,NULL,NULL] | [-32768,0,32767,32767] |
|    2 | [NULL,NULL]                                 | [NULL,NULL,"",""]            | [NULL,NULL,1]         | [NULL,NULL,1]                      | [NULL,NULL,1]             | [NULL,NULL,1,0]                           | [NULL,NULL,1,0]        |
|    3 | NULL                                        | NULL                         | NULL                  | NULL                               | NULL                      | NULL                                      | NULL                   |
+------+---------------------------------------------+------------------------------+-----------------------+------------------------------------+---------------------------+-------------------------------------------+------------------------+
select array_sort(tt1.c1) from tt1;
+---------------------------------------------+
| array_sort(tt1.c1)                          |
+---------------------------------------------+
| [-2147483648,-2147483647,0,77777,NULL,NULL] |
| [NULL,NULL]                                 |
| NULL                                        |
+---------------------------------------------+
select array_sort(tt1.c2) from tt1;
+------------------------------+
| array_sort(tt1.c2)           |
+------------------------------+
| ["","test","test",NULL,NULL] |
| ["","",NULL,NULL]            |
| NULL                         |
+------------------------------+
select array_sort(tt1.c3) from tt1;
+-----------------------+
| array_sort(tt1.c3)    |
+-----------------------+
| [-128,0,127,127,NULL] |
| [1,NULL,NULL]         |
| NULL                  |
+-----------------------+
select array_sort(tt1.c4) from tt1;
+------------------------------------+
| array_sort(tt1.c4)                 |
+------------------------------------+
| [-9223372036854775808,0,2,775,808] |
| [1,NULL,NULL]                      |
| NULL                               |
+------------------------------------+
select array_sort(tt1.c5) from tt1;
+---------------------------+
| array_sort(tt1.c5)        |
+---------------------------+
| [-9.22337e18,0,2,775,808] |
| [1,NULL,NULL]             |
| NULL                      |
+---------------------------+
select array_sort(tt1.c6) from tt1;
+-------------------------------------------+
| array_sort(tt1.c6)                        |
+-------------------------------------------+
| [0,1.175,3.266,3.402,NULL,NULL,NULL,NULL] |
| [0,1,NULL,NULL]                           |
| NULL                                      |
+-------------------------------------------+
select array_sort(tt1.c7) from tt1;
+------------------------+
| array_sort(tt1.c7)     |
+------------------------+
| [-32768,0,32767,32767] |
| [0,1,NULL,NULL]        |
| NULL                   |
+------------------------+

drop table test;
create table test as select array_sort(tt1.c1) from tt1;
desc test;
+--------------------+------------+------+-----+---------+-------+
| Field              | Type       | Null | Key | Default | Extra |
+--------------------+------------+------+-----+---------+-------+
| array_sort(tt1.c1) | ARRAY(INT) | YES  |     | NULL    |       |
+--------------------+------------+------+-----+---------+-------+

drop table tt1;
create table tt1(id int,c1 array(int), c2 array(varchar(256)), c3 array(tinyint), c4 array(bigint), c5 array(float), c6 array(double), c7 array(smallint));

insert into tt1 values(1,[null,null,-2147483648,-2147483647,0,77777],['','[]',"[],[]",'test','test',null,null],[127,0,-128,127,null],[-9223372036854775808,775,808,2,0],[-9223372036854775808,775,808,2,0],[null,null,3.402, 0, 1.175,3.266,null,null],[-32768,0,32767,32767]);

insert into tt1 values(2,[null,null],[null,null,'',''],[null,null,1],[null,null,1],[null,null,1],[null,null,1,0],[null,null,1,0]);

insert into tt1 values(3,null,null,null,null,null,null,null);

insert into tt1 values(4,null,array_remove([1],1),array_remove([1],1),array_remove([1],1),null,null,null);

select * from tt1;
+------+---------------------------------------------+-------------------------------------------+-----------------------+------------------------------------+---------------------------+-------------------------------------------+------------------------+
| id   | c1                                          | c2                                        | c3                    | c4                                 | c5                        | c6                                        | c7                     |
+------+---------------------------------------------+-------------------------------------------+-----------------------+------------------------------------+---------------------------+-------------------------------------------+------------------------+
|    1 | [NULL,NULL,-2147483648,-2147483647,0,77777] | ["","[]","[],[]","test","test",NULL,NULL] | [127,0,-128,127,NULL] | [-9223372036854775808,775,808,2,0] | [-9.22337e18,775,808,2,0] | [NULL,NULL,3.402,0,1.175,3.266,NULL,NULL] | [-32768,0,32767,32767] |
|    2 | [NULL,NULL]                                 | [NULL,NULL,"",""]                         | [NULL,NULL,1]         | [NULL,NULL,1]                      | [NULL,NULL,1]             | [NULL,NULL,1,0]                           | [NULL,NULL,1,0]        |
|    3 | NULL                                        | NULL                                      | NULL                  | NULL                               | NULL                      | NULL                                      | NULL                   |
|    4 | NULL                                        | []                                        | []                    | []                                 | NULL                      | NULL                                      | NULL                   |
+------+---------------------------------------------+-------------------------------------------+-----------------------+------------------------------------+---------------------------+-------------------------------------------+------------------------+
select array_sort(tt1.c1) from tt1;
+---------------------------------------------+
| array_sort(tt1.c1)                          |
+---------------------------------------------+
| [-2147483648,-2147483647,0,77777,NULL,NULL] |
| [NULL,NULL]                                 |
| NULL                                        |
| NULL                                        |
+---------------------------------------------+
select array_sort(tt1.c2) from tt1;
+-------------------------------------------+
| array_sort(tt1.c2)                        |
+-------------------------------------------+
| ["","[]","[],[]","test","test",NULL,NULL] |
| ["","",NULL,NULL]                         |
| NULL                                      |
| []                                        |
+-------------------------------------------+
select array_sort(tt1.c3) from tt1;
+-----------------------+
| array_sort(tt1.c3)    |
+-----------------------+
| [-128,0,127,127,NULL] |
| [1,NULL,NULL]         |
| NULL                  |
| []                    |
+-----------------------+
select array_sort(tt1.c4) from tt1;
+------------------------------------+
| array_sort(tt1.c4)                 |
+------------------------------------+
| [-9223372036854775808,0,2,775,808] |
| [1,NULL,NULL]                      |
| NULL                               |
| []                                 |
+------------------------------------+
select array_sort(tt1.c5) from tt1;
+---------------------------+
| array_sort(tt1.c5)        |
+---------------------------+
| [-9.22337e18,0,2,775,808] |
| [1,NULL,NULL]             |
| NULL                      |
| NULL                      |
+---------------------------+
select array_sort(tt1.c6) from tt1;
+-------------------------------------------+
| array_sort(tt1.c6)                        |
+-------------------------------------------+
| [0,1.175,3.266,3.402,NULL,NULL,NULL,NULL] |
| [0,1,NULL,NULL]                           |
| NULL                                      |
| NULL                                      |
+-------------------------------------------+
select array_sort(tt1.c7) from tt1;
+------------------------+
| array_sort(tt1.c7)     |
+------------------------+
| [-32768,0,32767,32767] |
| [0,1,NULL,NULL]        |
| NULL                   |
| NULL                   |
+------------------------+

drop table tt1;
create table tt1(id int,c1 array(varchar(256)), c2 array(varchar(256)));
insert into tt1 values(1,[null,null,'',"],["],array_remove([''],''));
insert into tt1 values(2,[null,null],array_remove(['',']','['],'['));

select * from tt1;
+------+----------------------+----------+
| id   | c1                   | c2       |
+------+----------------------+----------+
|    1 | [NULL,NULL,"","],["] | []       |
|    2 | [NULL,NULL]          | ["","]"] |
+------+----------------------+----------+
select array_sort(tt1.c1) from tt1;
+----------------------+
| array_sort(tt1.c1)   |
+----------------------+
| ["","],[",NULL,NULL] |
| [NULL,NULL]          |
+----------------------+
select array_sort(tt1.c2) from tt1;
+--------------------+
| array_sort(tt1.c2) |
+--------------------+
| []                 |
| ["","]"]           |
+--------------------+

drop table test;
create table test as select array_sort(tt1.c2) from tt1;
desc test;
+--------------------+---------------------+------+-----+---------+-------+
| Field              | Type                | Null | Key | Default | Extra |
+--------------------+---------------------+------+-----+---------+-------+
| array_sort(tt1.c2) | ARRAY(VARCHAR(256)) | YES  |     | NULL    |       |
+--------------------+---------------------+------+-----+---------+-------+
drop table test;

### ddl
drop table tt3;
create table tt3 as select array_sort([0,1,1,1,1,1,null,true,false]) as a;
desc tt3;
+-------+---------------+------+-----+---------+-------+
| Field | Type          | Null | Key | Default | Extra |
+-------+---------------+------+-----+---------+-------+
| a     | ARRAY(BIGINT) | YES  |     | NULL    |       |
+-------+---------------+------+-----+---------+-------+
insert into tt3 values(array_sort([2343,3,3,4,2,7,5,5,4,0,null]));
replace into tt3 values(array_sort([2343,0,0,4,3,2,6,5,4,7,6,7,50]));
update tt3 set a=array_sort([2343,0,0,2,2,2,111,4]) limit 1;
select * from tt3;
+---------------------------------+
| a                               |
+---------------------------------+
| [0,0,2,2,2,4,111,2343]          |
| [0,2,3,3,4,4,5,5,7,2343,NULL]   |
| [0,0,2,3,4,4,5,6,6,7,7,50,2343] |
+---------------------------------+
truncate tt3;
delete from tt3;

drop table tt3;
create table tt3 (a int[] NOT NULL) ;
desc tt3;
+-------+------------+------+-----+---------+-------+
| Field | Type       | Null | Key | Default | Extra |
+-------+------------+------+-----+---------+-------+
| a     | ARRAY(INT) | NO   |     | NULL    |       |
+-------+------------+------+-----+---------+-------+
insert into tt3 values(array_sort([2343,2,1,4,2,34,3,3,null,null,7]));
replace into tt3 values(array_sort([2343,0,3,3,3,3,3,3]));
update tt3 set a=array_sort([2343,0,4]);
select * from tt3;
+------------+
| a          |
+------------+
| [0,4,2343] |
| [0,4,2343] |
+------------+
truncate tt3;
delete from tt3;

drop table tt3;
create table tt3 (a int[]) ;
desc tt3;
+-------+------------+------+-----+---------+-------+
| Field | Type       | Null | Key | Default | Extra |
+-------+------------+------+-----+---------+-------+
| a     | ARRAY(INT) | YES  |     | NULL    |       |
+-------+------------+------+-----+---------+-------+
insert into tt3 values(array_sort([234,3,2,1,1,1,1,18,6,4,6,4,4,54,53]));
replace into tt3 values(array_sort([2,1,1,1,7,5,4,3,2,3,3,23,0]));
update tt3 set a=array_sort([null,6,4,12,3,2,45,6,4,3,2343,null,234]) limit 1;
select * from tt3;
+------------------------------------------+
| a                                        |
+------------------------------------------+
| [2,3,3,4,4,6,6,12,45,234,2343,NULL,NULL] |
| [0,1,1,1,2,2,3,3,3,4,5,7,23]             |
+------------------------------------------+
truncate tt3;
delete from tt3;
truncate tt3;

drop table tt3;

create table tt3(id int, r int[] as (array_sort([0,1,null,true,true,false,4,3,3,1,1,1,false])) STORED);
drop table tt3;

create table tt3(id int, r int[] as (array_sort([0,1,null,true,false])) VIRTUAL);

drop table tt3;
create table tt3(id int);

ALTER TABLE tt3 ADD COLUMN r int[] AS (array_sort([0,1,null,true,false])) STORED;
drop table tt3;
create table tt3(id int);
ALTER TABLE tt3 ADD COLUMN r int[] AS (array_sort([0,1,null,true,false])) VIRTUAL;

drop table tt3;
create table tt3(id int, c1 int[]);
insert into tt3 values(1,[0]);
insert into tt3 values(1,[true,false]);
insert into tt3 values(1,[0,null,true,false]);
insert into tt3 values(1,[-2147483648.5 ,0, 2147483647.4999998]);
select array_sort(c1) from tt3;
+----------------------------+
| array_sort(c1)             |
+----------------------------+
| [0]                        |
| [0,1]                      |
| [0,0,1,NULL]               |
| [-2147483648,0,2147483647] |
+----------------------------+
ALTER TABLE tt3 ADD COLUMN (c2 TINYINT default (array_sort(c1)));
ERROR 0A000: Column reference in default value expression not supported
alter table tt3 add column (c2 int GENERATED ALWAYS AS (array_sort(c1))  STORED);
ERROR 22000: Invalid data type for the operation
alter table tt3 add column (c3 int GENERATED ALWAYS AS (array_sort(c1))  VIRTUAL);
ERROR 22000: Invalid data type for the operation

desc tt3;
+-------+------------+------+-----+---------+-------+
| Field | Type       | Null | Key | Default | Extra |
+-------+------------+------+-----+---------+-------+
| id    | int(11)    | YES  |     | NULL    |       |
| c1    | ARRAY(INT) | YES  |     | NULL    |       |
+-------+------------+------+-----+---------+-------+
select * from tt3;
+------+----------------------------+
| id   | c1                         |
+------+----------------------------+
|    1 | [0]                        |
|    1 | [1,0]                      |
|    1 | [0,NULL,1,0]               |
|    1 | [-2147483648,0,2147483647] |
+------+----------------------------+
select array_sort(c1) from tt3;
+----------------------------+
| array_sort(c1)             |
+----------------------------+
| [0]                        |
| [0,1]                      |
| [0,0,1,NULL]               |
| [-2147483648,0,2147483647] |
+----------------------------+

drop table tt3;
create table tt3(id int, c1 int[]);
insert into tt3 values(1,[0]);
insert into tt3 values(1,[true,false]);
insert into tt3 values(1,[0,null,true,false]);
insert into tt3 values(1,[-2147483648.5 ,0, 2147483647.4999998]);
select * from tt3;
+------+----------------------------+
| id   | c1                         |
+------+----------------------------+
|    1 | [0]                        |
|    1 | [1,0]                      |
|    1 | [0,NULL,1,0]               |
|    1 | [-2147483648,0,2147483647] |
+------+----------------------------+
ALTER TABLE tt3 MODIFY c1 BIGINT[];
select array_sort(c1) from tt3;
+----------------------------+
| array_sort(c1)             |
+----------------------------+
| [0]                        |
| [0,1]                      |
| [0,0,1,NULL]               |
| [-2147483648,0,2147483647] |
+----------------------------+
select * from tt3;
+------+----------------------------+
| id   | c1                         |
+------+----------------------------+
|    1 | [0]                        |
|    1 | [1,0]                      |
|    1 | [0,NULL,1,0]               |
|    1 | [-2147483648,0,2147483647] |
+------+----------------------------+

drop table tt3;
create table tt3(id int, c1 int[]);
insert into tt3 values(1,[0]);
insert into tt3 values(1,[true,false]);
insert into tt3 values(1,[0,null,true,false]);
insert into tt3 values(1,[-2147483648.5 ,0, 2147483647.4999998]);
ALTER TABLE tt3 ADD COLUMN (c3 VARCHAR(20)[] GENERATED ALWAYS AS ([array_sort(c1)]) STORED);

ALTER TABLE tt3 ADD COLUMN (c2 VARCHAR(20)[] GENERATED ALWAYS AS ([array_sort(c1)]) VIRTUAL);


########清空回收站，删除测试数据库，表等 ##########
drop database  IF EXISTS  testkj;
purge recyclebin;
