ob1=OBI(cluster=1:1:2, proxy_num=0);
ob1.z1.obs0.set extra_config=$extra_conf;
ob1.z2.obs0.set extra_config=$extra_conf;
ob1.z3.obs0.set extra_config=$extra_conf;
ob1.reboot;
set @@session.ob_query_timeout = 1000000000;
CREATE RESOURCE UNIT unit_1 MAX_CPU 1, MEMORY_SIZE '3G', LOG_DISK_SIZE '4G';
CREATE RESOURCE POOL pool_1 UNIT = 'unit_1', UNIT_NUM = 1, zone_list = ('z1', 'z2', 'z3');;
CREATE TENANT clog_update_disk RESOURCE_POOL_LIST = ('pool_1'), primary_zone='z1;z2;z3' set ob_tcp_invited_nodes='%';
ob1.check_until_timeout select count(*) as cnt from oceanbase.__all_virtual_server_schema_info as a join oceanbase.__all_virtual_server_schema_info as b on a.tenant_id = b.tenant_id  where a.refreshed_schema_version != b.refreshed_schema_version, 0, 60;
create table t1_no_pk (c1 int);
insert into t1_no_pk values (1), (2), (3);
select * from t1_no_pk;
c1
1
2
3
update t1_no_pk set c1=c1+10;
select * from t1_no_pk;
c1
11
12
13
create table t1_pk (c1 int primary key);
insert into t1_pk values (1), (2), (3);
select * from t1_pk;
c1
1
2
3
update t1_pk set c1=c1+10;
select * from t1_pk;
c1
11
12
13
create table t1_part (c1 int primary key) partition by hash(c1) partitions 4;
insert into t1_part values (1), (2), (3), (4);
select * from t1_part;
c1
4
1
2
3
update t1_part set c1=c1+10;
select * from t1_part;
c1
12
13
14
11
alter system minor freeze tenant clog_update_disk;
ob1.z1.obs0.check_log_until_success -c "succeed to release head data memtable";
ob1.z3.obs1.check_log_until_success -c "succeed to release head data memtable";
insert into t1_no_pk values (4), (5), (6);
insert into t1_no_pk values (7), (8), (9);
insert into t1_no_pk values (10), (11), (12);
insert into t1_pk values (4), (5), (6);
insert into t1_pk values (7), (8), (9);
insert into t1_pk values (10);
insert into t1_part values (5), (6), (7), (8);
insert into t1_part values (9), (10), (21), (22);
alter system minor freeze tenant clog_update_disk;
ob1.z1.obs0.check_log_until_success -c "succeed to release head data memtable";
ob1.z3.obs1.check_log_until_success -c "succeed to release head data memtable";
'prepare finished'
ob1.mysql alter tenant sys set primary_zone = "z1";
ob1.check_until_timeout select count(*) from __all_virtual_core_meta_table where role = 1 and zone = 'z1', 1, 60;
ob1.mysql alter tenant sys set primary_zone = "z2";
ob1.check_until_timeout select count(*) from __all_virtual_core_meta_table where role = 1 and zone = 'z2', 1, 60;
ob1.mysql alter tenant sys set primary_zone = "z1";
ob1.check_until_timeout select count(*) from __all_virtual_core_meta_table where role = 1 and zone = 'z1', 1, 60;
ob1.z3.obs0.mysql alter system set log_disk_size = '10G';
ob1.z3.force_stop;
ob1.z3.start;
ob1.check_until_timeout select count(*) from oceanbase.__all_server a left join oceanbase.__all_virtual_server_schema_info b on a.svr_ip = b.svr_ip and a.svr_port = b.svr_port where b.svr_ip is null, 0, 120;
ob1.check_until_timeout select count(*) as cnt from oceanbase.__all_virtual_server_schema_info as a join oceanbase.__all_virtual_server_schema_info as b on a.tenant_id = b.tenant_id  where a.refreshed_schema_version != b.refreshed_schema_version or a.refreshed_schema_version % 8 != 0, 0, 180;
ob1.z3.obs0.mysql alter system set log_disk_size = '10G';
