ob1=OBI(cluster=1:1:1, proxy_num=0, asvr_num=1);
ob1.z1.obs0.set extra_config=$extra_conf;
ob1.z2.obs0.set extra_config=$extra_conf;
ob1.z3.obs0.set extra_config=$extra_conf;
ob1.asvr0.set status=disable;
ob1.reboot;
set @@session.ob_query_timeout = 1000000000;
CREATE RESOURCE UNIT unit_1 MAX_CPU 4, MIN_CPU 1, MEMORY_SIZE 4294967296, LOG_DISK_SIZE 2147483648;
CREATE RESOURCE POOL pool_1 UNIT = 'unit_1', UNIT_NUM = 1, zone_list = ('z1', 'z2', 'z3');
CREATE TENANT mysql RESOURCE_POOL_LIST = ('pool_1'), primary_zone='z1;z2;z3' set ob_tcp_invited_nodes='%';
ob1.check_until_timeout select count(*) from __all_server_event_history where module='LOG' and event='ROLE TRANSITION' and value1='$mysql_tenant_id' and value2='1001' and value3='FOLLOWER INIT' and value4='FOLLOWER ACTIVE' and gmt_create>'$start_time' and gmt_create<'$end_time', 3, 120;
ob1.check_until_timeout select count(*) from __all_server_event_history where module='LOG' and event='SET INITIAL MEMBER LIST' and value1='$mysql_tenant_id' and value2='1001' and value4='3' and gmt_create>'$start_time' and gmt_create<'$end_time', 3, 120;
ob1.check_until_timeout select count(*) from __all_server_event_history where module='LOG' and event='ROLE TRANSITION' and value1='$mysql_tenant_id' and value2='1001' and value3='FOLLOWER ACTIVE' and value4='LEADER RECONFIRM' and gmt_create>'$start_time' and gmt_create<'$end_time', 1, 120;
ob1.check_until_timeout select count(*) from __all_server_event_history where module='LOG' and event='ROLE TRANSITION' and value1='$mysql_tenant_id' and value2='1001' and value3='LEADER RECONFIRM' and value4='LEADER ACTIVE' and gmt_create>'$start_time' and gmt_create<'$end_time', 1, 120;
count(*)
0
ob1.check_until_timeout select count(*) from __all_virtual_ls_meta_table where tenant_id = '$mysql_tenant_id' and svr_ip = '$follower1_svr_ip' and svr_port='$follower1_svr_port' and ls_id = 1001 and role = 1, 1, 30;
count(*)
1
ob1.check_until_timeout select count(*) from __all_server_event_history where module='LOG' and event='ELECTION LEADER CHANGE' and gmt_create>'$start_time' and gmt_create<'$end_time', 1, 120;
ob1.check_until_timeout select count(*) from __all_server_event_history where module='LOG' and event='ROLE TRANSITION' and value3='LEADER ACTIVE' and value4='FOLLOWER PENDING' and gmt_create>'$start_time' and gmt_create<'$end_time', 1, 120;
ob1.check_until_timeout select count(*) from __all_server_event_history where module='LOG' and event='ROLE TRANSITION' and value3='FOLLOWER PENDING' and value4='FOLLOWER ACTIVE' and gmt_create>'$start_time' and gmt_create<'$end_time', 1, 120;
SELECT LOCALITY FROM oceanbase.DBA_OB_TENANTS where TENANT_ID = 1002;
LOCALITY
FULL{1}@z1, FULL{1}@z2, FULL{1}@z3
ob1.check_until_timeout select JOB_STATUS from oceanbase.DBA_OB_TENANT_JOBS WHERE JOB_TYPE = 'ALTER_TENANT_LOCALITY' order by JOB_ID desc limit 1, SUCCESS, 120;
ob1.check_until_timeout select count(*) from __all_server_event_history where module='LOG' and event='RECONFIGURATION:REMOVE_MEMBER' and value4='3' and value5='2' and gmt_create>'$start_time' and gmt_create<'$end_time', 3, 120;
ob1.check_until_timeout select count(*) from __all_server_event_history where module='LOG' and event='DISABLE SYNC' and gmt_create>'$start_time', 3, 120;
ob1.check_until_timeout select JOB_STATUS from oceanbase.DBA_OB_TENANT_JOBS WHERE JOB_TYPE = 'ALTER_TENANT_LOCALITY' order by JOB_ID desc limit 1, SUCCESS, 120;
ob1.check_until_timeout select count(*) from __all_server_event_history where module='LOG' and event='ENABLE SYNC' and gmt_create>'$start_time' and gmt_create<'$end_time', 3, 120;
ob1.check_until_timeout select count(*) from __all_server_event_history where module='LOG' and event='RECONFIGURATION:ADD_MEMBER' and value4='2' and value5='3' and gmt_create>'$start_time' and gmt_create<'$end_time', 3, 120;
ob1.check_until_timeout select JOB_STATUS from oceanbase.DBA_OB_TENANT_JOBS WHERE JOB_TYPE = 'ALTER_TENANT_LOCALITY' order by JOB_ID desc limit 1, SUCCESS, 120;
ob1.check_until_timeout select count(*) from __all_virtual_ls_meta_table where tenant_id = '$mysql_tenant_id' and svr_ip = '$z1_obs0_ip' and svr_port='$z1_obs0_port' and ls_id = 1001 and role = 1, 1, 30;
ob1.asvr0.set status=enable;
ob1.asvr0.reboot;
ob1.mysql ALTER SYSTEM SET debug_sync_timeout = '1000s';
ob1.mysql ALTER SYSTEM SET enable_rebalance = 'false';
ob1.mysql ALTER SYSTEM SET enable_rereplication = 'true';
ob1.check_until_timeout select count(*) from DBA_OB_ARBITRATION_SERVICE where arbitration_service = "$arb_svr_ip_0:$arb_svr_port_0", 1, 30;
alter tenant mysql enable_arbitration_service = true;
ob1.check_until_timeout select count(*) from DBA_OB_TENANTS where TENANT_NAME = 'mysql' and ARBITRATION_SERVICE_STATUS = 'enabled', 1, 30;
ob1.check_until_timeout select count(*) from __all_server_event_history where module='LOG' and event='RECONFIGURATION:ADD_ARB_MEMBER' and value1='$mysql_tenant_id' and gmt_create>'$start_time' and gmt_create<'$end_time', 2, 120;
alter tenant mysql enable_arbitration_service = false;
ob1.check_until_timeout select count(*) from DBA_OB_TENANTS where TENANT_NAME = 'mysql' and ARBITRATION_SERVICE_STATUS = 'disabled', 1, 30;
ob1.check_until_timeout select count(*) from __all_server_event_history where module='LOG' and event='RECONFIGURATION:REMOVE_ARB_MEMBER' and value1='$mysql_tenant_id' and gmt_create>'$start_time' and gmt_create<'$end_time', 2, 120;
alter tenant mysql enable_arbitration_service = true;
ob1.check_until_timeout select count(*) from DBA_OB_TENANTS where TENANT_NAME = 'mysql' and ARBITRATION_SERVICE_STATUS = 'enabled', 1, 30;
ob1.z2.obs0.force_stop;
ob1.check_until_timeout select count(*) from __all_virtual_log_stat where tenant_id=$mysql_tenant_id and degraded_list not like "%$follower_ip_port%", 0, 120;
ob1.check_until_timeout select count(*) from __all_virtual_log_stat where tenant_id=$mysql_tenant_id and role = 'LEADER', 2, 60;
ob1.z2.obs0.nstart;
ob1.check_until_timeout select count(*) from __all_virtual_log_stat where tenant_id=$mysql_tenant_id and degraded_list like "%$follower_ip_port%", 0, 120;
ob1.check_until_timeout select count(*) from __all_virtual_log_stat where tenant_id=$mysql_tenant_id and role = 'LEADER', 2, 60;
alter tenant mysql enable_arbitration_service = false;
ob1.check_until_timeout select count(*) from DBA_OB_TENANTS where TENANT_NAME = 'mysql' and ARBITRATION_SERVICE_STATUS = 'disabled', 1, 30;
ALTER TENANT mysql locality="FULL{1}@z1, FULL{1}@z2, FULL{1}@z3";
ob1.check_until_timeout select JOB_STATUS from oceanbase.DBA_OB_TENANT_JOBS WHERE JOB_TYPE = 'ALTER_TENANT_LOCALITY' order by JOB_ID desc limit 1, SUCCESS, 120;
ob1.mysql ALTER system log_disk_utilization_threshold = 10;
set @@session.ob_query_timeout = 1000000000;
create table t1_no_pk (c1 int, a varchar(260000));
ob1.check_until_timeout select count(*) as cnt from oceanbase.__all_virtual_server_schema_info as a join oceanbase.__all_virtual_server_schema_info as b on a.tenant_id = b.tenant_id  where a.refreshed_schema_version != b.refreshed_schema_version, 0, 60;
$leader_obs.block_net $follower_obs;
select count(1) from t1_no_pk;
count(1)
6000
ob1.mysql alter system minor freeze server = ('$leader_ip_port');
'can rebuild'
$leader_obs.clean_net $follower_obs;
ob1.check_until_timeout select count(*) from __all_server_event_history where module='LOG' and event='REBUILD' and gmt_create>'$start_time', 1, 120;
ob1.check_until_timeout select count(*) from __all_server_event_history where module='LOG' and event='DISABLE SYNC' and gmt_create>'$start_time', 1, 120;
ob1.check_until_timeout select count(*) from __all_server_event_history where module='LOG' and event='ADVANCE BASE INFO' and gmt_create>'$start_time', 1, 120;
ob1.check_until_timeout select count(*) from __all_server_event_history where module='LOG' and event='TRUNCATE' and gmt_create>'$start_time', 1, 120;
ob1.check_until_timeout select count(*) from __all_server_event_history where module='LOG' and event='ENABLE SYNC' and gmt_create>'$start_time', 1, 120;
ob1.check_until_timeout select count(*) from __all_server_event_history where module='LOG' and event='ENABLE VOTE' and gmt_create>'$start_time', 1, 120;
ob1.check_until_timeout SELECT COUNT(*) AS cnt FROM oceanbase.__all_server_event_history WHERE module = 'storage_ha' and event = 'ls_ha_finish' and value1 = '$mysql_tenant_id' AND value2 = '1001' and value6 = '0' and extra_info = 'REBUILD_LS_OP', 1, 600;
ob1.mysql alter system major freeze tenant = 'mysql';
ob1.check_until_timeout select (frozen_scn - last_scn) as result from oceanbase.CDB_OB_MAJOR_COMPACTION where tenant_id=$mysql_tenant_id, 0, 600;
ob1.force_stop;
ob2=OBI(cluster=2:2:2, proxy_num=0);
ob2.z1.obs0.set extra_config=$extra_conf;
ob2.z1.obs1.set extra_config=$extra_conf;
ob2.z2.obs0.set extra_config=$extra_conf;
ob2.z2.obs1.set extra_config=$extra_conf;
ob2.z3.obs0.set extra_config=$extra_conf;
ob2.z3.obs1.set extra_config=$extra_conf;
ob2.reboot;
alter tenant sys primary_zone='z1';
ob2.mysql alter system migrate unit $unit_id destination '$destination_obs_ip:$destination_obs_port';
pass
ob2.check_until_timeout select count(*) c from oceanbase.__all_rootservice_job, 1 ,30;
ob2.check_until_timeout select count(*) from __all_server_event_history where module='LOG' and event='RECONFIGURATION:REPLACE_MEMBER' and value1='1' and value2='1' and gmt_create>'$start_time', 1, 30;
ob2.force_stop;
ob3=OBI(cluster=1, proxy_num=0);
ob4=OBI(cluster=1, proxy_num=0);
ob3.z1.obs0.set extra_config = "cpu_count=16,memory_limit='30G',system_memory='7G',__min_full_resource_pool_memory='1073741824',cache_wash_threshold='1G',_ob_minor_merge_schedule_interval='3s'";
ob4.z1.obs0.set extra_config = "cpu_count=16,memory_limit='30G',system_memory='7G',__min_full_resource_pool_memory='1073741824',cache_wash_threshold='1G',_ob_minor_merge_schedule_interval='3s'";
ob3.force_stop;
ob3.clean_backup_dest;
ob3.reboot;
ob3.mysql alter resource unit sys_unit_config memory_size='2G';
use oceanbase;
ob3.mysql alter system set _backup_idle_time = '10s';
ob3.mysql alter system set merger_check_interval = '10s';
ob3.mysql alter system set enable_async_syslog=false;
ob3.mysql CREATE TENANT $backup_mysql_tenant RESOURCE_POOL_LIST = ('small_pool'), primary_zone = "z1" set ob_tcp_invited_nodes='%', ob_compatibility_mode='mysql';
set global wait_timeout = 288000;
create table t1(a int, b int, c int);
insert into t1(a, b) values(1, 1);
ob3.mysql alter system archivelog;
ob3.check_until_timeout select status from oceanbase.CDB_OB_ARCHIVELOG where tenant_id=$backup_mysql_tenant_id, DOING, 600;
ob3.mysql alter system major freeze tenant = '$backup_mysql_tenant';
ob3.check_until_timeout select (frozen_scn - last_scn) as result from oceanbase.CDB_OB_MAJOR_COMPACTION where tenant_id=$backup_mysql_tenant_id, 0, 600;
ob3.mysql alter system backup database;
ob3.check_until_timeout select count(*) c from __all_backup_job_history where tenant_id = 1, 1, 600;
ob3.check_until_timeout select result from oceanbase.CDB_OB_BACKUP_JOB_HISTORY where tenant_id = $backup_mysql_tenant_id, 0, 10;
ob3.check_until_timeout select result from oceanbase.CDB_OB_BACKUP_TASK_HISTORY where tenant_id = $backup_mysql_tenant_id, 0, 10;
use oceanbase;
ob3.mysql alter tenant $backup_mysql_tenant set primary_zone = 'z1';
ob3.check_until_timeout select count(*)>=1 from oceanbase.__all_virtual_ls_status where status = 'NORMAL' and tenant_id = $backup_mysql_tenant_id, 1, 100;
ob3.check_until_timeout select floor(checkpoint_scn / 1000) > '$restore_checkpoint1' from CDB_OB_ARCHIVELOG, 1, 600;
ob3.check_until_timeout select floor(checkpoint_scn / 1000) > '$restore_checkpoint2' from CDB_OB_ARCHIVELOG, 1, 600;
ob4.reboot;
ob4.mysql alter resource unit sys_unit_config memory_size='2G';
ob4.mysql alter system set enable_async_syslog=false;
ob4.mysql alter system restore $restore_mysql_tenant from '$restore_path' until time='$restore_checkpoint' with 'pool_list=small_pool_2&primary_zone=z1';
ob4.check_until_timeout SELECT status FROM __all_tenant WHERE tenant_id = 1001, NORMAL, 200;
ob4.check_until_timeout select count(*) from __all_virtual_ls_meta_table where tenant_id = 1002 and restore_status = 0, 2, 1200;
ob4.check_until_timeout select status FROM __all_tenant WHERE tenant_id = 1002, NORMAL, 200;
ob4.check_until_timeout select count(*) FROM __all_restore_job, 0, 200;
ob4.mysql ALTER SYSTEM RECOVER STANDBY TENANT $restore_mysql_tenant UNTIL UNLIMITED;
ob4.mysql alter system set debug_sync_timeout = '100000s';
ob4.mysql set ob_global_debug_sync = 'BLOCK_STANDBY_REFRESH_SCHEMA wait_for continue_signal execute 10000';
create table t2(a int, b int, c int);
insert into t2(a, b) values(10, 10);
ob4.check_until_timeout select count(*) FROM oceanbase.dba_ob_tenants where tenant_id = $restore_mysql_tenant_id and SYNC_SCN >= $check_sync_scn, 1, 50;
alter system change tenant tenant_id = 1001;
select tenant_role from __all_tenant_info where tenant_id = 1002;
tenant_role
STANDBY
ob4.mysql alter system set debug_sync_timeout = '100000s';
ob4.mysql set ob_global_debug_sync = 'BEFORE_PREPARE_FLASHBACK wait_for continue_signal execute 10000';
ALTER SYSTEM ACTIVATE STANDBY;
ERROR HY000: Incorrect arguments to tenant name, should specify tenant name
set ob_query_timeout  = 10000000;
ALTER SYSTEM ACTIVATE STANDBY TENANT restore_mysql_tenant;
ob4.check_until_timeout select count(*) from __all_virtual_tenant_info where tenant_id = 1002 and switchover_status = 'PREPARE FLASHBACK' and tenant_role = 'STANDBY', 1, 5;
ob4.mysql alter system set debug_sync_timeout = '100000s';
ob4.mysql set ob_global_debug_sync = 'STOP_RECOVERY_LS_THREAD1 wait_for continue_signal execute 10000';
update t1 set a=2, b=2;
ob4.check_until_timeout select count(*) from oceanbase.__all_virtual_log_stat where role = 'LEADER' and tenant_id = 1002 and end_scn >= $primary_max_log_scn and ls_id != 1, 1, 400;
ob4.mysql set ob_global_debug_sync = 'now signal continue_signal';
ob4.mysql set ob_global_debug_sync = 'BEFORE_PREPARE_FLASHBACK clear';
ob4.mysql set ob_global_debug_sync = 'BEFORE_DO_FLASHBACK wait_for continue_signal execute 10000';
ALTER SYSTEM ACTIVATE STANDBY;
ERROR HY000: Incorrect arguments to tenant name, should specify tenant name
set ob_query_timeout  = 5000000;
ALTER SYSTEM ACTIVATE STANDBY TENANT restore_mysql_tenant;
ob4.check_until_timeout select count(*) from __all_virtual_tenant_info where tenant_id = 1002 and switchover_status = 'FLASHBACK' and tenant_role = 'STANDBY' and recovery_until_scn < 4611686018427387903, 1, 5;
ob4.check_until_timeout select count(*) from __all_virtual_log_restore_source where tenant_id = 1002 and recovery_until_scn < 4611686018427387903, 1, 5;
ob4.mysql set ob_global_debug_sync = 'now signal continue_signal';
ob4.mysql set ob_global_debug_sync = 'BEFORE_DO_FLASHBACK clear';
ALTER SYSTEM ACTIVATE STANDBY TENANT restore_mysql_tenant;
ob4.check_until_timeout select count(*) from __all_virtual_tenant_info where tenant_id = 1002 and tenant_role = 'PRIMARY' and switchover_status = 'NORMAL', 1, 5;
ob4.mysql set ob_global_debug_sync = 'now signal continue_signal';
ob4.mysql set ob_global_debug_sync = 'STOP_RECOVERY_LS_THREAD1 clear';
select * from t1;
a	b	c
1	1	NULL
select * from t2;
ERROR 42S02: Table 'test.t2' doesn't exist
ob4.mysql set ob_global_debug_sync = 'now signal continue_signal';
ob4.mysql set ob_global_debug_sync = 'BLOCK_STANDBY_REFRESH_SCHEMA clear';
ob3.check_until_timeout select count(*) as cnt from oceanbase.__all_virtual_server_schema_info as a join oceanbase.__all_virtual_server_schema_info as b on a.tenant_id = b.tenant_id  where a.refreshed_schema_version != b.refreshed_schema_version, 0, 60;
select * from t2;
a	b	c
10	10	NULL
alter system archivelog;
ob4.check_until_timeout select status from oceanbase.CDB_OB_ARCHIVELOG where tenant_id=$restore_mysql_tenant_id, DOING, 600;
ob4.mysql_p select count(*) from oceanbase.__all_virtual_ls where tenant_id = $restore_mysql_tenant_id and ls_id = $ls_id1 and create_scn = $create_scn1;
count(*)
1
ob4.mysql_p select count(*) from oceanbase.__all_virtual_ls where tenant_id = $restore_mysql_tenant_id and ls_id = $ls_id2 and create_scn = $create_scn2;
count(*)
1
ob4.mysql alter system restore $fo_mysql_tenant from '$restore_path' until time='$restore_checkpoint' with 'pool_list=small_pool_0&primary_zone=z1';
ob4.check_until_timeout SELECT status FROM __all_tenant WHERE tenant_id = 1003, NORMAL, 200;
ob4.check_until_timeout select count(*) from __all_virtual_ls_meta_table where tenant_id = 1004 and restore_status = 0, 2, 1200;
ob4.check_until_timeout select status FROM __all_tenant WHERE tenant_id = 1004, NORMAL, 200;
ob4.check_until_timeout select count(*) FROM __all_restore_job, 0, 200;
ob4.mysql ALTER SYSTEM RECOVER STANDBY TENANT $fo_mysql_tenant UNTIL UNLIMITED;
alter system change tenant tenant_id = 1003;
select tenant_role from __all_tenant_info where tenant_id = 1004;
tenant_role
STANDBY
ALTER SYSTEM ACTIVATE STANDBY TENANT fo_mysql_tenant;
ERROR HY000: Incorrect arguments to tenant name, please don't specify tenant name
set ob_query_timeout  = 10000000;
ALTER SYSTEM ACTIVATE STANDBY VERIFY;
ALTER SYSTEM ACTIVATE STANDBY;
ob4.check_until_timeout select count(*) from __all_virtual_tenant_info where tenant_id = 1004 and tenant_role = 'PRIMARY' and switchover_status = 'NORMAL', 1, 5;
select * from t1;
a	b	c
1	1	NULL
ob4.check_until_timeout select count(*) from __all_server_event_history where module='LOG' and event='FLASHBACK' and value1='$restore_mysql_tenant_id' and value2='1001', 1, 30;
