result_format: 4

# ◆ 准备测试用户
drop user if exists fk_testuser;
drop database if exists fk_testuser_db;
create user 'fk_testuser' identified by 'fk_testuser';
CREATE DATABASE IF NOT EXISTS  fk_testuser_db;
grant all on *.* to fk_testuser WITH GRANT OPTION;



drop table if exists t6;
drop table if exists t5;
drop table if exists t4;
drop table if exists t3;
drop table if exists t2;
drop table if exists t1;
################################
#### index/unique index/primary key
create table t1(c1 int primary key,c2 int,c3 int,c4 int);
create index t1index1 on t1(c2);
create unique index t1index2 on t1(c3);

create table t2(c1 int,c2 int,c3 int,c4 int);

alter table t2 add CONSTRAINT fk1 foreign key(c1) references t1(c1) on update cascade;
alter table t2 add CONSTRAINT fk2 foreign key(c1) references t1(c2) on update cascade;
alter table t2 add CONSTRAINT fk3 foreign key(c1) references t1(c3) on update cascade;
alter table t2 add CONSTRAINT fk4 foreign key(c1) references t1(c4) on update cascade;
ERROR HY000: Cannot add foreign key constraint

alter table t2 add CONSTRAINT fk5 foreign key(c1,c2) references t1(c1,c1) on update cascade;
ERROR HY000: Cannot add foreign key constraint
alter table t2 add CONSTRAINT fk6 foreign key(c1,c2) references t1(c1,c2) on update cascade;
ERROR HY000: Cannot add foreign key constraint
alter table t2 add CONSTRAINT fk7 foreign key(c1,c2) references t1(c1,c3) on update cascade;
ERROR HY000: Cannot add foreign key constraint
alter table t2 add CONSTRAINT fk8 foreign key(c1,c2) references t1(c1,c4) on update cascade;
ERROR HY000: Cannot add foreign key constraint

alter table t2 add CONSTRAINT fk9 foreign key(c1,c2) references t1(c2,c1) on update cascade;
ERROR HY000: Cannot add foreign key constraint
alter table t2 add CONSTRAINT fk10 foreign key(c1,c2) references t1(c2,c2) on update cascade;
ERROR HY000: Cannot add foreign key constraint
alter table t2 add CONSTRAINT fk11 foreign key(c1,c2) references t1(c2,c3) on update cascade;
ERROR HY000: Cannot add foreign key constraint
alter table t2 add CONSTRAINT fk12 foreign key(c1,c2) references t1(c2,c4) on update cascade;
ERROR HY000: Cannot add foreign key constraint

alter table t2 add CONSTRAINT fk13 foreign key(c1,c2) references t1(c3,c1) on update cascade;
ERROR HY000: Cannot add foreign key constraint
alter table t2 add CONSTRAINT fk14 foreign key(c1,c2) references t1(c3,c2) on update cascade;
ERROR HY000: Cannot add foreign key constraint
alter table t2 add CONSTRAINT fk15 foreign key(c1,c2) references t1(c3,c3) on update cascade;
ERROR HY000: Cannot add foreign key constraint
alter table t2 add CONSTRAINT fk16 foreign key(c1,c2) references t1(c3,c4) on update cascade;
ERROR HY000: Cannot add foreign key constraint

alter table t2 add CONSTRAINT fk17 foreign key(c1,c2,c3) references t1(c1,c2,c3) on update cascade;
ERROR HY000: Cannot add foreign key constraint

insert into t1 values(1,2,3,4),(11,21,31,41),(12,22,32,42);
select * from t1 order by 1,2,3,4;
+----+------+------+------+
| c1 | c2   | c3   | c4   |
+----+------+------+------+
|  1 |    2 |    3 |    4 |
| 11 |   21 |   31 |   41 |
| 12 |   22 |   32 |   42 |
+----+------+------+------+

insert into t2(c1) values(1);
ERROR 23000: Cannot add or update a child row: a foreign key constraint fails
insert into t2(c1) values(11);
ERROR 23000: Cannot add or update a child row: a foreign key constraint fails
insert into t2(c1) values(12);
ERROR 23000: Cannot add or update a child row: a foreign key constraint fails
insert into t2(c1) values(2);
ERROR 23000: Cannot add or update a child row: a foreign key constraint fails
insert into t2(c1) values(21);
ERROR 23000: Cannot add or update a child row: a foreign key constraint fails
insert into t2(c1) values(22);
ERROR 23000: Cannot add or update a child row: a foreign key constraint fails
insert into t2(c1) values(3);
ERROR 23000: Cannot add or update a child row: a foreign key constraint fails
insert into t2(c1) values(31);
ERROR 23000: Cannot add or update a child row: a foreign key constraint fails
insert into t2(c1) values(32);
ERROR 23000: Cannot add or update a child row: a foreign key constraint fails
insert into t2(c1) values(1),(2),(3),(11),(21),(31);
ERROR 23000: Cannot add or update a child row: a foreign key constraint fails
insert into t2(c1) values(1111111);
ERROR 23000: Cannot add or update a child row: a foreign key constraint fails

insert into t2(c1,c2) values(null,1);

update t1 set c1 = c1*10;
update t1 set c2 = c2*10;
update t1 set c3 = c3*10;

insert into t2(c1) values(10);
ERROR 23000: Cannot add or update a child row: a foreign key constraint fails
update t2 set c1 = 10;
ERROR 23000: Cannot add or update a child row: a foreign key constraint fails
update t2 set c1 = c2;
ERROR 23000: Cannot add or update a child row: a foreign key constraint fails

select * from t1 order by 1,2,3,4;
+-----+------+------+------+
| c1  | c2   | c3   | c4   |
+-----+------+------+------+
|  10 |   20 |   30 |    4 |
| 110 |  210 |  310 |   41 |
| 120 |  220 |  320 |   42 |
+-----+------+------+------+
select * from t2 order by 1,2,3,4;
+------+------+------+------+
| c1   | c2   | c3   | c4   |
+------+------+------+------+
| NULL |    1 | NULL | NULL |
+------+------+------+------+

drop table t2;
drop table t1;

################################
#### 引用非唯一索引的列（索引表达式）
create table t1(c1 int,c2 int,c3 int,c4 int);
create index t1index on t1((c1+c2+2),c3);

create table t2(c1 int,c2 int,c3 int,c4 int);
alter table t2 add CONSTRAINT fk1 foreign key(c1) references t1(c1) on update cascade on delete cascade;
ERROR HY000: Cannot add foreign key constraint
alter table t2 add CONSTRAINT fk1 foreign key(c1) references t1(c2) on update cascade on delete cascade;
ERROR HY000: Cannot add foreign key constraint

alter table t2 add CONSTRAINT fk1 foreign key(c1) references t1(c3) on update cascade on delete cascade;

alter table t2 add CONSTRAINT fk1 foreign key(c1) references t1(c4) on update cascade on delete cascade;
ERROR HY000: Cannot add foreign key constraint
alter table t2 add CONSTRAINT fk1 foreign key(c1) references t1(c1+c2) on update cascade on delete cascade;
ERROR 42000: You have an error in your SQL syntax; check the manual that corresponds to your OceanBase version for the right syntax to use near '+c2) on update cascade on delete cascade' at line 1
alter table t2 add CONSTRAINT fk1 foreign key(c1) references t1(c1+c2+2) on update cascade on delete cascade;
ERROR 42000: You have an error in your SQL syntax; check the manual that corresponds to your OceanBase version for the right syntax to use near '+c2+2) on update cascade on delete cascade' at line 1
alter table t2 add CONSTRAINT fk1 foreign key(c1) references t1((c1+c2)) on update cascade on delete cascade;
ERROR 42000: You have an error in your SQL syntax; check the manual that corresponds to your OceanBase version for the right syntax to use near '(c1+c2)) on update cascade on delete cascade' at line 1
alter table t2 add CONSTRAINT fk1 foreign key(c1) references t1((c1+c2+2)) on update cascade on delete cascade;
ERROR 42000: You have an error in your SQL syntax; check the manual that corresponds to your OceanBase version for the right syntax to use near '(c1+c2+2)) on update cascade on delete cascade' at line 1
alter table t2 add CONSTRAINT fk1 foreign key((c1+c2+2)) references t1((c1+c2+2)) on update cascade on delete cascade;
ERROR 42000: You have an error in your SQL syntax; check the manual that corresponds to your OceanBase version for the right syntax to use near '(c1+c2+2)) references t1((c1+c2+2)) on update cascade on delete cascade' at line 1

drop table t2;
drop table t1;

################################
#### 引用非唯一索引的列
create table t1(c1 int,c2 int,c3 int,c4 int);
create index t1index on t1((abs(c1+c2)),c3);

create table t2(c1 int,c2 int,c3 int,c4 int);

alter table t2 add CONSTRAINT fk1 foreign key(c1) references t1(c1) on update cascade on delete cascade;
ERROR HY000: Cannot add foreign key constraint
alter table t2 add CONSTRAINT fk1 foreign key(c1) references t1(c2) on update cascade on delete cascade;
ERROR HY000: Cannot add foreign key constraint
alter table t2 add CONSTRAINT fk1 foreign key(c1,c2) references t1(c1,c2) on update cascade on delete cascade;
ERROR HY000: Cannot add foreign key constraint
alter table t2 add CONSTRAINT fk1 foreign key(c1,c2) references t1(c1,c3) on update cascade on delete cascade;
ERROR HY000: Cannot add foreign key constraint

alter table t2 add CONSTRAINT fk1 foreign key(c1) references t1(c3) on update cascade on delete cascade;

alter table t2 add CONSTRAINT fk1 foreign key(c1) references t1(abs(c1)) on update cascade on delete cascade;
ERROR 42000: You have an error in your SQL syntax; check the manual that corresponds to your OceanBase version for the right syntax to use near '(c1)) on update cascade on delete cascade' at line 1
alter table t2 add CONSTRAINT fk1 foreign key(c1) references t1((abs(c1))) on update cascade on delete cascade;
ERROR 42000: You have an error in your SQL syntax; check the manual that corresponds to your OceanBase version for the right syntax to use near '(abs(c1))) on update cascade on delete cascade' at line 1
alter table t2 add CONSTRAINT fk1 foreign key(c1) references t1(abs(c2)) on update cascade on delete cascade;
ERROR 42000: You have an error in your SQL syntax; check the manual that corresponds to your OceanBase version for the right syntax to use near '(c2)) on update cascade on delete cascade' at line 1
alter table t2 add CONSTRAINT fk1 foreign key(c1) references t1((abs(c2))) on update cascade on delete cascade;
ERROR 42000: You have an error in your SQL syntax; check the manual that corresponds to your OceanBase version for the right syntax to use near '(abs(c2))) on update cascade on delete cascade' at line 1
alter table t2 add CONSTRAINT fk1 foreign key(c1) references t1(abs(c1+c2)) on update cascade on delete cascade;
ERROR 42000: You have an error in your SQL syntax; check the manual that corresponds to your OceanBase version for the right syntax to use near '(c1+c2)) on update cascade on delete cascade' at line 1
alter table t2 add CONSTRAINT fk1 foreign key(c1) references t1((abs(c1+c2))) on update cascade on delete cascade;
ERROR 42000: You have an error in your SQL syntax; check the manual that corresponds to your OceanBase version for the right syntax to use near '(abs(c1+c2))) on update cascade on delete cascade' at line 1

alter table t2 add CONSTRAINT fk1 foreign key(c1) references t1(c4) on update cascade on delete cascade;
ERROR HY000: Cannot add foreign key constraint
alter table t2 add CONSTRAINT fk1 foreign key(c1) references t1(c1+c2) on update cascade on delete cascade;
ERROR 42000: You have an error in your SQL syntax; check the manual that corresponds to your OceanBase version for the right syntax to use near '+c2) on update cascade on delete cascade' at line 1
alter table t2 add CONSTRAINT fk1 foreign key(c1) references t1(c1+c2+2) on update cascade on delete cascade;
ERROR 42000: You have an error in your SQL syntax; check the manual that corresponds to your OceanBase version for the right syntax to use near '+c2+2) on update cascade on delete cascade' at line 1
alter table t2 add CONSTRAINT fk1 foreign key(c1) references t1((c1+c2)) on update cascade on delete cascade;
ERROR 42000: You have an error in your SQL syntax; check the manual that corresponds to your OceanBase version for the right syntax to use near '(c1+c2)) on update cascade on delete cascade' at line 1
alter table t2 add CONSTRAINT fk1 foreign key(c1) references t1((c1+c2+2)) on update cascade on delete cascade;
ERROR 42000: You have an error in your SQL syntax; check the manual that corresponds to your OceanBase version for the right syntax to use near '(c1+c2+2)) on update cascade on delete cascade' at line 1
alter table t2 add CONSTRAINT fk1 foreign key((c1+c2+2)) references t1((c1+c2+2)) on update cascade on delete cascade;
ERROR 42000: You have an error in your SQL syntax; check the manual that corresponds to your OceanBase version for the right syntax to use near '(c1+c2+2)) references t1((c1+c2+2)) on update cascade on delete cascade' at line 1

drop table t2;
drop table t1;

################################
#### alter table
create table t1(c1 int,c2 int not null,c3 int,c4 int);
create index t1index on t1(c1,c2,c3);
create table t2(c1 int not null,c2 int,c3 int,c4 int, CONSTRAINT fk1 foreign key(c1,c2) references t1(c1,c2));

## 删除列
alter table t1 drop c1;
ERROR HY000: 'c1': used in a foreign key constraint
alter table t1 drop c2;
ERROR HY000: 'c2': used in a foreign key constraint
alter table t2 drop c1;
ERROR HY000: 'c1': used in a foreign key constraint
alter table t2 drop c2;
ERROR HY000: 'c2': used in a foreign key constraint

alter table t1 drop c3;
alter table t1 drop c4;
alter table t2 drop c3;
alter table t2 drop c4;

ALTER TABLE t1 ADD COLUMN c3 int;
ALTER TABLE t1 ADD COLUMN c4 int;
ALTER TABLE t2 ADD COLUMN c3 int;
ALTER TABLE t2 ADD COLUMN c4 int;

## 删除索引
alter table t1 drop index t1index;
ERROR HY000: Cannot drop index 't1index': needed in a foreign key constraint

## 修改索引 t1index 不可见。
ALTER TABLE t1 ALTER INDEX t1index INVISIBLE;
create table t3(c1 int not null,c2 int,c3 int,c4 int, CONSTRAINT fk2 foreign key(c1,c2) references t1(c1,c2));

alter table t1 drop c1;
ERROR HY000: 'c1': used in a foreign key constraint
alter table t1 drop c2;
ERROR HY000: 'c2': used in a foreign key constraint
alter table t1 drop index t1index;
ERROR HY000: Cannot drop index 't1index': needed in a foreign key constraint
ALTER TABLE t1 ALTER INDEX t1index VISIBLE;

alter table t1 drop c1;
ERROR HY000: 'c1': used in a foreign key constraint
alter table t1 drop c2;
ERROR HY000: 'c2': used in a foreign key constraint
alter table t1 drop index t1index;
ERROR HY000: Cannot drop index 't1index': needed in a foreign key constraint

## 重命名列
ALTER TABLE t1 CHANGE c1 new_c1 int;
ALTER TABLE t1 CHANGE new_c1 c1 INTEGER;

select TABLE_NAME,REFERENCED_TABLE_NAME,UNIQUE_CONSTRAINT_NAME from information_schema.referential_constraints where TABLE_NAME = 't2' and CONSTRAINT_SCHEMA = schema();
+------------+-----------------------+------------------------+
| TABLE_NAME | REFERENCED_TABLE_NAME | UNIQUE_CONSTRAINT_NAME |
+------------+-----------------------+------------------------+
| t2         | t1                    | NULL                   |
+------------+-----------------------+------------------------+

ALTER TABLE t1 CHANGE c1 c1 TINYINT;
ERROR HY000: 'c1': used in a foreign key constraint
ALTER TABLE t1 CHANGE c1 c1 SMALLINT;
ERROR HY000: 'c1': used in a foreign key constraint
ALTER TABLE t1 CHANGE c1 c1 BIGINT;
ERROR HY000: 'c1': used in a foreign key constraint
ALTER TABLE t1 CHANGE c1 c1 DECIMAL;
ERROR HY000: 'c1': used in a foreign key constraint
ALTER TABLE t1 CHANGE c1 c1 FLOAT;
ERROR HY000: 'c1': used in a foreign key constraint
ALTER TABLE t1 CHANGE c1 c1 BIT;
ERROR HY000: 'c1': used in a foreign key constraint

## 修改列的默认值
ALTER TABLE t1 ALTER COLUMN c1 SET DEFAULT NULL;
ALTER TABLE t1 ALTER COLUMN c2 SET DEFAULT NULL;
ERROR 42000: Invalid default value for 'c2'
ALTER TABLE t1 ALTER COLUMN c1 SET DEFAULT 1;
ALTER TABLE t1 ALTER COLUMN c2 SET DEFAULT 1;

ALTER TABLE t2 ALTER COLUMN c1 SET DEFAULT NULL;
ERROR 42000: Invalid default value for 'c1'
ALTER TABLE t2 ALTER COLUMN c2 SET DEFAULT NULL;
ALTER TABLE t2 ALTER COLUMN c1 SET DEFAULT 2;
ALTER TABLE t2 ALTER COLUMN c2 SET DEFAULT 2;

## 插入数据
insert into t1 values (1,1,1,1);
insert into t1 values (2,3,1,1);
insert into t1 values (3,4,1,1);

insert into t2 values (1,1,1,1);
insert into t2 values (1,2,1,1);
ERROR 23000: Cannot add or update a child row: a foreign key constraint fails
insert into t2 values (2,4,1,1);
ERROR 23000: Cannot add or update a child row: a foreign key constraint fails
insert into t2 values (2,2,2,2);
ERROR 23000: Cannot add or update a child row: a foreign key constraint fails
insert into t2 values (NULL,NULL,NULL,NULL);
ERROR 23000: Column 'c1' cannot be null
insert into t2 values (1,NULL,NULL,NULL);
insert into t2 values (2,NULL,NULL,NULL);
insert into t2 values (3,NULL,NULL,NULL);
insert into t2 values (2,2,NULL,NULL);
ERROR 23000: Cannot add or update a child row: a foreign key constraint fails

update t1 set c1 = c2;
update t1 set c1 = c1 * 10;
ERROR 23000: Cannot delete or update a parent row: a foreign key constraint fails
update t1 set c1 = c1 * 10 where c1 = 1;
ERROR 23000: Cannot delete or update a parent row: a foreign key constraint fails
delete from t1 where c1 = 1;
ERROR 23000: Cannot delete or update a parent row: a foreign key constraint fails

select * from t1 order by 1;
+------+----+------+------+
| c1   | c2 | c3   | c4   |
+------+----+------+------+
|    1 |  1 |    1 |    1 |
|    3 |  3 |    1 |    1 |
|    4 |  4 |    1 |    1 |
+------+----+------+------+
select * from t2 order by 1;
+----+------+------+------+
| c1 | c2   | c3   | c4   |
+----+------+------+------+
|  1 |    1 |    1 |    1 |
|  1 | NULL | NULL | NULL |
|  2 | NULL | NULL | NULL |
|  3 | NULL | NULL | NULL |
+----+------+------+------+

## 删除父表数据
delete from t1;
ERROR 23000: Cannot delete or update a parent row: a foreign key constraint fails
TRUNCATE TABLE t1;
ERROR 42000: Cannot truncate a table referenced in a foreign key constraint (`fk_testuser_db`.`t3`, CONSTRAINT `fk2` FOREIGN KEY (`c1`, `c2`) REFERENCES `fk_testuser_db`.`t1` (`c1`, `c2`))
drop table t1;
ERROR HY000: Cannot drop table 't1' referenced by a foreign key constraint 'fk2' on table 't3'

## 重命名父表
ALTER TABLE t1 RENAME TO new_t1;
ALTER TABLE new_t1 RENAME TO t1;

show create table t2;
Table	Create Table
t2	CREATE TABLE `t2` (
  `c1` int(11) NOT NULL DEFAULT '2',
  `c2` int(11) DEFAULT '2',
  `c3` int(11) DEFAULT NULL,
  `c4` int(11) DEFAULT NULL,
  CONSTRAINT `fk1` FOREIGN KEY (`c1`, `c2`) REFERENCES `fk_testuser_db`.`t1`(`c1`, `c2`) ON UPDATE RESTRICT ON DELETE RESTRICT 
) ORGANIZATION INDEX DEFAULT CHARSET = utf8mb4 ROW_FORMAT = DYNAMIC COMPRESSION = 'zstd_1.3.8' REPLICA_NUM = 1 BLOCK_SIZE = 16384 USE_BLOOM_FILTER = FALSE ENABLE_MACRO_BLOCK_BLOOM_FILTER = FALSE TABLET_SIZE = 134217728 PCTFREE = 0
select TABLE_NAME,REFERENCED_TABLE_NAME,UNIQUE_CONSTRAINT_NAME from information_schema.referential_constraints where TABLE_NAME = 't2' and CONSTRAINT_SCHEMA = schema();
+------------+-----------------------+------------------------+
| TABLE_NAME | REFERENCED_TABLE_NAME | UNIQUE_CONSTRAINT_NAME |
+------------+-----------------------+------------------------+
| t2         | t1                    | NULL                   |
+------------+-----------------------+------------------------+

drop table if exists t3;
drop table if exists t2;
drop table if exists t1;
drop table if exists new_t1;
################################
#### 多个index（index）
create table t1(c1 int,c2 int,c3 int,c4 int);
create index t1index1 on t1(c1,c2);

create table t2(
    c1 int not null,c2 int,c3 int,c4 int, 
    CONSTRAINT fk1 foreign key(c1,c2) references t1(c1,c2));

create index t1index2 on t1(c1,c2,c3);
create index t1index3 on t1(c1,c2,c4);
create index t1index4 on t1(c2,c1);
create index t1index5 on t1(c2,c1,c3);
create index t1index6 on t1(c2,c1,c4);

select TABLE_NAME,REFERENCED_TABLE_NAME,UNIQUE_CONSTRAINT_NAME from information_schema.referential_constraints where TABLE_NAME = 't2' and CONSTRAINT_SCHEMA = schema();
+------------+-----------------------+------------------------+
| TABLE_NAME | REFERENCED_TABLE_NAME | UNIQUE_CONSTRAINT_NAME |
+------------+-----------------------+------------------------+
| t2         | t1                    | NULL                   |
+------------+-----------------------+------------------------+

alter table t1 drop index t1index1;
ERROR HY000: Cannot drop index 't1index1': needed in a foreign key constraint
select TABLE_NAME,REFERENCED_TABLE_NAME,UNIQUE_CONSTRAINT_NAME from information_schema.referential_constraints where TABLE_NAME = 't2' and CONSTRAINT_SCHEMA = schema();
+------------+-----------------------+------------------------+
| TABLE_NAME | REFERENCED_TABLE_NAME | UNIQUE_CONSTRAINT_NAME |
+------------+-----------------------+------------------------+
| t2         | t1                    | NULL                   |
+------------+-----------------------+------------------------+

alter table t1 drop index t1index2;
select TABLE_NAME,REFERENCED_TABLE_NAME,UNIQUE_CONSTRAINT_NAME from information_schema.referential_constraints where TABLE_NAME = 't2' and CONSTRAINT_SCHEMA = schema();
+------------+-----------------------+------------------------+
| TABLE_NAME | REFERENCED_TABLE_NAME | UNIQUE_CONSTRAINT_NAME |
+------------+-----------------------+------------------------+
| t2         | t1                    | NULL                   |
+------------+-----------------------+------------------------+

alter table t1 drop index t1index3;
select TABLE_NAME,REFERENCED_TABLE_NAME,UNIQUE_CONSTRAINT_NAME from information_schema.referential_constraints where TABLE_NAME = 't2' and CONSTRAINT_SCHEMA = schema();
+------------+-----------------------+------------------------+
| TABLE_NAME | REFERENCED_TABLE_NAME | UNIQUE_CONSTRAINT_NAME |
+------------+-----------------------+------------------------+
| t2         | t1                    | NULL                   |
+------------+-----------------------+------------------------+

alter table t1 drop index t1index4;
select TABLE_NAME,REFERENCED_TABLE_NAME,UNIQUE_CONSTRAINT_NAME from information_schema.referential_constraints where TABLE_NAME = 't2' and CONSTRAINT_SCHEMA = schema();
+------------+-----------------------+------------------------+
| TABLE_NAME | REFERENCED_TABLE_NAME | UNIQUE_CONSTRAINT_NAME |
+------------+-----------------------+------------------------+
| t2         | t1                    | NULL                   |
+------------+-----------------------+------------------------+

alter table t1 drop index t1index5;
select TABLE_NAME,REFERENCED_TABLE_NAME,UNIQUE_CONSTRAINT_NAME from information_schema.referential_constraints where TABLE_NAME = 't2' and CONSTRAINT_SCHEMA = schema();
+------------+-----------------------+------------------------+
| TABLE_NAME | REFERENCED_TABLE_NAME | UNIQUE_CONSTRAINT_NAME |
+------------+-----------------------+------------------------+
| t2         | t1                    | NULL                   |
+------------+-----------------------+------------------------+

alter table t1 drop index t1index6;
select TABLE_NAME,REFERENCED_TABLE_NAME,UNIQUE_CONSTRAINT_NAME from information_schema.referential_constraints where TABLE_NAME = 't2' and CONSTRAINT_SCHEMA = schema();
+------------+-----------------------+------------------------+
| TABLE_NAME | REFERENCED_TABLE_NAME | UNIQUE_CONSTRAINT_NAME |
+------------+-----------------------+------------------------+
| t2         | t1                    | NULL                   |
+------------+-----------------------+------------------------+

drop table if exists t3;
drop table if exists t2;
drop table if exists t1;
drop table if exists new_t1;
drop user fk_testuser;
purge recyclebin;
