result_format: 4

# ◆ 准备测试用户
drop user if exists fk_testuser;
drop database if exists fk_testuser_db;
create user 'fk_testuser' identified by 'fk_testuser';
CREATE DATABASE IF NOT EXISTS  fk_testuser_db;
grant all on *.* to fk_testuser WITH GRANT OPTION;



drop table if exists t6;
drop table if exists t5;
drop table if exists t4;
drop table if exists t3;
drop table if exists t2;
drop table if exists t1;
################################
#### 自引用
create table t1(c1 int primary key, c2 int, 
    foreign key (c2) references t1(c1) on update cascade);
insert into t1 values(1, NULL), (2, 1), (3, 2);
insert into t1 values(4, 4), (5, 5), (6, 6);

update t1 set t1.c1 = 10 where t1.c1 = 1;
ERROR 23000: Cannot delete or update a parent row: a foreign key constraint fails
update t1 set t1.c1 = 10,t1.c2 = 10 where t1.c1 = 5;
update t1 set t1.c1 = 11 where t1.c2 = 6;
ERROR 23000: Cannot delete or update a parent row: a foreign key constraint fails

update t1 set t1.c2 = 4 where t1.c2 = 1;
update t1 set t1.c1 = 11 where t1.c2 = 2;

select * from t1 order by 1,2;
+----+------+
| c1 | c2   |
+----+------+
|  1 | NULL |
|  2 |    4 |
|  4 |    4 |
|  6 |    6 |
| 10 |   10 |
| 11 |    2 |
+----+------+

drop table if exists t1;

#### 自引用
create table t1(c1 int primary key, c2 int);
set foreign_key_checks=off;
insert into t1 values(4, 4), (5, 5), (6, 6);
alter table t1 add foreign key (c2) references t1(c1) on update cascade;
set foreign_key_checks=on;
update t1 set c1 = c1 + 1;
ERROR 23000: Cannot delete or update a parent row: a foreign key constraint fails
select * from t1 order by 1,2;
+----+------+
| c1 | c2   |
+----+------+
|  4 |    4 |
|  5 |    5 |
|  6 |    6 |
+----+------+
drop table if exists t1;

#### 自引用
create table t1(c1 int, c2 int);
create index t1index on t1(c1);
create index t1index2 on t1(c2);
set foreign_key_checks=off;
insert into t1 values(2, 3), (3, null);
alter table t1 add foreign key (c2) references t1(c1) on update cascade;
set foreign_key_checks=on;
update t1 set c1 = c1 + 1;
ERROR 23000: Cannot delete or update a parent row: a foreign key constraint fails
update t1 set c1 = c1 + 1 where c1 = 2;

insert into t1 values(4, 3);
update t1 set c1 = c1 + 1 where c1 = 3;
ERROR 23000: Cannot delete or update a parent row: a foreign key constraint fails

select * from t1 order by 1,2;
+------+------+
| c1   | c2   |
+------+------+
|    3 | NULL |
|    3 |    3 |
|    4 |    3 |
+------+------+
drop table if exists t1;

#### 自引用
create table t1(c1 int primary key, c2 int);
create index t1index on t1(c2);
set foreign_key_checks=off;
insert into t1 values(2, 2),(3, 3);

alter table t1 add foreign key (c1,c2) references t1(c1,c2) on update cascade;
ERROR HY000: Cannot add foreign key constraint

alter table t1 add foreign key (c1) references t1(c2) on update cascade;
set foreign_key_checks=on;

insert into t1 values(4, 4);

update t1 set c2 = c2 + 1;
ERROR 23000: Cannot delete or update a parent row: a foreign key constraint fails

select * from t1 order by 1,2;
+----+------+
| c1 | c2   |
+----+------+
|  2 |    2 |
|  3 |    3 |
|  4 |    4 |
+----+------+
drop table if exists t1;

################################
#### 相互引用
create table t1(c1 int primary key,c2 int);
create table t2(c1 int primary key,c2 int unique);

set foreign_key_checks=on;
insert into t1 values(1, 2), (2, 3), (3, 3);
insert into t2 values(1, 2), (2, 3);
alter table t2 add CONSTRAINT fk1 foreign key (c2) references t1(c1) on update cascade;
alter table t1 add CONSTRAINT fk2 foreign key (c2) references t2(c2) on update cascade;

update t1 set c1 = c1 * 10;
ERROR 23000: Cannot delete or update a parent row: a foreign key constraint fails
update t1 set c1 = c1 * 10 where c1 = 1;
update t1 set c1 = c1 * 10 where c1 = 2;
ERROR 23000: Cannot delete or update a parent row: a foreign key constraint fails
update t1 set c1 = c1 * 10 where c1 = 3;
ERROR 23000: Cannot delete or update a parent row: a foreign key constraint fails
update t1 set c1 = c1;
select * from t1 order by 1,2;
+----+------+
| c1 | c2   |
+----+------+
|  2 |    3 |
|  3 |    3 |
| 10 |    2 |
+----+------+
select * from t2 order by 1,2;
+----+------+
| c1 | c2   |
+----+------+
|  1 |    2 |
|  2 |    3 |
+----+------+

alter table t1 DROP FOREIGN KEY fk2;
drop table t2;
drop table t1;

################################
#### 相互引用
create table t1(c1 int primary key,c2 int unique);
create table t2(c1 int primary key,c2 int unique);
set foreign_key_checks=on;
insert into t1 values(1, 2), (2, 3), (3, 4);
insert into t2 values(1, 2), (2, 3);

alter table t2 add CONSTRAINT fk1 foreign key (c1) references t1(c1) on update cascade;
alter table t1 add CONSTRAINT fk2 foreign key (c2) references t2(c2) on update cascade;
ERROR HY000: cannot validate (fk_testuser_db.fk2) - parent keys not found
alter table t1 add CONSTRAINT fk2 foreign key (c2) references t2(c1) on update cascade;
ERROR HY000: cannot validate (fk_testuser_db.fk2) - parent keys not found
alter table t1 add CONSTRAINT fk2 foreign key (c1) references t2(c1) on update cascade;
ERROR HY000: cannot validate (fk_testuser_db.fk2) - parent keys not found
alter table t1 add CONSTRAINT fk2 foreign key (c1) references t2(c2) on update cascade;
ERROR HY000: cannot validate (fk_testuser_db.fk2) - parent keys not found
alter table t1 add CONSTRAINT fk2 foreign key (c1) references t1(c2) on update cascade;
ERROR HY000: cannot validate (fk_testuser_db.fk2) - parent keys not found
alter table t1 add CONSTRAINT fk2 foreign key (c2) references t1(c1) on update cascade;
ERROR HY000: cannot validate (fk_testuser_db.fk2) - parent keys not found

drop table t2;
drop table t1;

################################
#### 子表多列引用同一列
create table t1(c1 int primary key);
create table t2(c1 int primary key,c2 int unique,c3 int,c4 int);
set foreign_key_checks=on;
insert into t1 values(1), (2), (3), (4), (5);
insert into t2 values(1,1,2,1), (2,2,2,1), (3,3,null,2), (4,4,null,3);

alter table t2 add CONSTRAINT fk1 foreign key (c2) references t1(c1) on update cascade on delete cascade;
alter table t2 add CONSTRAINT fk2 foreign key (c3) references t1(c1) on update cascade on delete cascade;

set foreign_key_checks=on;
update t1, t2 set t1.c1 = 30, t2.c4 = 5 where t1.c1 = 1 and t2.c1 = 1;
ERROR 23000: Cannot delete or update a parent row: a foreign key constraint fails
update t1, t2 set t1.c1 = 40, t2.c4 = 6 where t1.c1 = 2 and t2.c4 = 1;
ERROR 23000: Cannot delete or update a parent row: a foreign key constraint fails
update t1, t2 set t1.c1 = 50, t2.c4 = 7 where t1.c1 = 3 and t2.c4 = 2;
ERROR 23000: Cannot delete or update a parent row: a foreign key constraint fails
update t1, t2 set t1.c1 = 60, t2.c4 = 8 where t1.c1 = 4 and t2.c4 = 3;
ERROR 23000: Cannot delete or update a parent row: a foreign key constraint fails

update t1 set t1.c1 = 70 where t1.c1 = 4;
update t1 set t1.c1 = 80 where t1.c1 = 3;
update t2 set t2.c2 = 10 where t2.c1 = 1;
ERROR 23000: Cannot add or update a child row: a foreign key constraint fails
update t2 set t2.c3 = 5 where t2.c1 = 4;

delete from t1 where c1 = 2;
delete from t1 where c1 = 4;

select * from t1 order by 1;
+----+
| c1 |
+----+
|  1 |
|  5 |
| 70 |
| 80 |
+----+
select * from t2 order by 1,2;
+----+------+------+------+
| c1 | c2   | c3   | c4   |
+----+------+------+------+
|  3 |   80 | NULL |    2 |
|  4 |   70 |    5 |    3 |
+----+------+------+------+

drop table t2;
drop table t1;

drop table if exists t2;
drop table if exists t1;
################################
#### 多表引用
create table t1(c1 int primary key,c2 int unique);
create table t2(c1 int primary key,c2 int unique);
create table t3(c1 int primary key,c2 int unique);
create table t4(c1 int primary key,c2 int unique);
create table t5(c1 int primary key,c2 int unique);
create table t6(c1 int primary key,c2 int unique);

set foreign_key_checks=off;
insert into t1 values(1,1), (2,2), (3,3), (4,4), (5,5);
insert into t2 values(1,1), (2,null), (3,2), (4,4), (5,null);
insert into t3 values(1,1), (2,null), (3,2), (4,4), (5,null);
insert into t4 values(1,null), (2,null), (3,2), (4,4), (5,null);
insert into t5 values(1,null), (2,4), (3,null), (4,null), (5,null);
insert into t6 values(1,null), (2,2), (3,4), (4,null), (5,null);

alter table t2 add foreign key (c2) references t1(c1) on update cascade;
alter table t3 add foreign key (c2) references t2(c2) on update cascade;
alter table t4 add foreign key (c2) references t3(c2) on update cascade;
alter table t5 add foreign key (c2) references t4(c2) on update cascade;
alter table t6 add foreign key (c2) references t4(c2) on update cascade;

set foreign_key_checks=on;
update t1 set c1 = 6 where c1 = 1;
update t1 set c1 = 7 where c1 = 2;
update t1 set c1 = 8 where c1 = 3;
update t1 set c1 = 9 where c1 = 4;
update t1 set c1 = 10 where c1 = 5;
update t1 set c1 = c1 * 10;

select * from t1 order by 1,2;
+-----+------+
| c1  | c2   |
+-----+------+
|  60 |    1 |
|  70 |    2 |
|  80 |    3 |
|  90 |    4 |
| 100 |    5 |
+-----+------+
select * from t2 order by 1,2;
+----+------+
| c1 | c2   |
+----+------+
|  1 |   60 |
|  2 | NULL |
|  3 |   70 |
|  4 |   90 |
|  5 | NULL |
+----+------+
select * from t3 order by 1,2;
+----+------+
| c1 | c2   |
+----+------+
|  1 |   60 |
|  2 | NULL |
|  3 |   70 |
|  4 |   90 |
|  5 | NULL |
+----+------+
select * from t4 order by 1,2;
+----+------+
| c1 | c2   |
+----+------+
|  1 | NULL |
|  2 | NULL |
|  3 |   70 |
|  4 |   90 |
|  5 | NULL |
+----+------+
select * from t5 order by 1,2;
+----+------+
| c1 | c2   |
+----+------+
|  1 | NULL |
|  2 |   90 |
|  3 | NULL |
|  4 | NULL |
|  5 | NULL |
+----+------+
select * from t6 order by 1,2;
+----+------+
| c1 | c2   |
+----+------+
|  1 | NULL |
|  2 |   70 |
|  3 |   90 |
|  4 | NULL |
|  5 | NULL |
+----+------+

update t2 set c2 = 61 where c2 = 60;
ERROR 23000: Cannot add or update a child row: a foreign key constraint fails
update t3 set c2 = 71 where c2 = 70;
ERROR 23000: Cannot add or update a child row: a foreign key constraint fails
update t4 set c2 = 91 where c2 = 90;
ERROR 23000: Cannot add or update a child row: a foreign key constraint fails
update t5 set c2 = 91 where c2 = 90;
ERROR 23000: Cannot add or update a child row: a foreign key constraint fails
update t6 set c2 = 91 where c2 = 90;
ERROR 23000: Cannot add or update a child row: a foreign key constraint fails

drop table if exists t6;
drop table if exists t5;
drop table if exists t4;
drop table if exists t3;
drop table if exists t2;
drop table if exists t1;
################################
#### 自引用(非唯一索引)
create table t1(c1 int,c2 int,c3 int,c4 int);
create index t1index on t1(c1);

alter table t1 add CONSTRAINT fk1 foreign key (c1) references t1(c1) on update cascade on delete cascade;
ERROR HY000: Cannot add foreign key constraint
alter table t1 add CONSTRAINT fk1 foreign key (c1) references t1(c2) on update cascade on delete cascade;
ERROR HY000: Cannot add foreign key constraint

alter table t1 add CONSTRAINT fk1 foreign key (c2) references t1(c1) on update cascade on delete cascade;
insert into t1 values(1,null,1,1),(2,2,1,2),(3,1,1,1),(4,2,1,2),(5,3,1,3);

update t1 set c1=c1+1;
ERROR 23000: Cannot delete or update a parent row: a foreign key constraint fails
update t1 set c1=5 where c1 = 1;
ERROR 23000: Cannot delete or update a parent row: a foreign key constraint fails
update t1 set c1=6 where c1 = 2;
ERROR 23000: Cannot delete or update a parent row: a foreign key constraint fails
update t1 set c1=7 where c1 = 3;
ERROR 23000: Cannot delete or update a parent row: a foreign key constraint fails
update t1 set c1=8 where c1 = 4;
update t1 set c1=9 where c1 = 5;

insert into t1 values(10,null,1,1),(11,8,1,2),(12,8,1,1),(13,9,1,2),(14,3,1,3);

delete from t1 where c1 = 1;
select * from t1 order by 1,2,3,4;
+------+------+------+------+
| c1   | c2   | c3   | c4   |
+------+------+------+------+
|    2 |    2 |    1 |    2 |
|    8 |    2 |    1 |    2 |
|   10 | NULL |    1 |    1 |
|   11 |    8 |    1 |    2 |
|   12 |    8 |    1 |    1 |
+------+------+------+------+

delete from t1 where c1 = 2;
select * from t1 order by 1,2,3,4;
+------+------+------+------+
| c1   | c2   | c3   | c4   |
+------+------+------+------+
|   10 | NULL |    1 |    1 |
+------+------+------+------+

delete from t1 where c1 = 3;
select * from t1 order by 1,2,3,4;
+------+------+------+------+
| c1   | c2   | c3   | c4   |
+------+------+------+------+
|   10 | NULL |    1 |    1 |
+------+------+------+------+

update t1 set c1=11,c2=11 where c1 = 10;
select * from t1 order by 1,2,3,4;
+------+------+------+------+
| c1   | c2   | c3   | c4   |
+------+------+------+------+
|   11 |   11 |    1 |    1 |
+------+------+------+------+

drop table t1;

################################
#### 自引用(非唯一索引)
create table t1(c1 int,c2 int,c3 int,c4 int);
create index t1index on t1(c1,c2);

alter table t1 add CONSTRAINT fk1 foreign key (c1) references t1(c1) on update cascade on delete cascade;
ERROR HY000: Cannot add foreign key constraint
alter table t1 add CONSTRAINT fk1 foreign key (c1) references t1(c2) on update cascade on delete cascade;
ERROR HY000: Cannot add foreign key constraint
alter table t1 add CONSTRAINT fk1 foreign key (c1) references t1(c3) on update cascade on delete cascade;
ERROR HY000: Cannot add foreign key constraint

alter table t1 add CONSTRAINT fk1 foreign key (c2) references t1(c1) on update cascade on delete cascade;

alter table t1 add CONSTRAINT fk1 foreign key ('c2') references t1('c1') on update cascade on delete cascade;
ERROR 42000: You have an error in your SQL syntax; check the manual that corresponds to your OceanBase version for the right syntax to use near ''c2') references t1('c1') on update cascade on delete cascade' at line 1
alter table t1 add CONSTRAINT fk1 foreign key (c2,1) references t1(c1,1) on update cascade on delete cascade;
ERROR 42000: You have an error in your SQL syntax; check the manual that corresponds to your OceanBase version for the right syntax to use near '1) references t1(c1,1) on update cascade on delete cascade' at line 1
alter table t1 add CONSTRAINT fk1 foreign key (c2) references t1() on update cascade on delete cascade;
ERROR 42000: You have an error in your SQL syntax; check the manual that corresponds to your OceanBase version for the right syntax to use near ') on update cascade on delete cascade' at line 1
alter table t1 add CONSTRAINT fk1 foreign key (c2) references t1(null) on update cascade on delete cascade;
ERROR 42000: You have an error in your SQL syntax; check the manual that corresponds to your OceanBase version for the right syntax to use near 'null) on update cascade on delete cascade' at line 1
alter table t1 add CONSTRAINT fk1 foreign key (c2) references t1(c5) on update cascade on delete cascade;
ERROR HY000: Column not found
alter table t1 add CONSTRAINT fk1 foreign key (c2) references t1(c1,c2) on update cascade on delete cascade;
ERROR HY000: Cannot add foreign key constraint
alter table t1 add CONSTRAINT fk1 foreign key (c2) references t1(1) on update cascade on delete cascade;
ERROR 42000: You have an error in your SQL syntax; check the manual that corresponds to your OceanBase version for the right syntax to use near '1) on update cascade on delete cascade' at line 1
alter table t1 add CONSTRAINT fk1 foreign key (c2) references t1(c1+1) on update cascade on delete cascade;
ERROR 42000: You have an error in your SQL syntax; check the manual that corresponds to your OceanBase version for the right syntax to use near '+1) on update cascade on delete cascade' at line 1

alter table t1 add CONSTRAINT fk2 foreign key (c2) references t1(c2) on update cascade on delete cascade;
ERROR HY000: Cannot add foreign key constraint
alter table t1 add CONSTRAINT fk2 foreign key (c2) references t1(c3) on update cascade on delete cascade;
ERROR HY000: Cannot add foreign key constraint

alter table t1 add CONSTRAINT fk2 foreign key (c3) references t1(c1) on update cascade on delete cascade;

alter table t1 add CONSTRAINT fk3 foreign key (c3) references t1(c2) on update cascade on delete cascade;
ERROR HY000: Cannot add foreign key constraint
alter table t1 add CONSTRAINT fk4 foreign key (c3) references t1(c3) on update cascade on delete cascade;
ERROR HY000: Cannot add foreign key constraint
alter table t1 add CONSTRAINT fk4 foreign key (c3) references t1(c4) on update cascade on delete cascade;
ERROR HY000: Cannot add foreign key constraint
alter table t1 add CONSTRAINT fk4 foreign key (c1,c1) references t1(c1,c1) on update cascade on delete cascade;
ERROR HY000: Cannot add foreign key constraint
alter table t1 add CONSTRAINT fk4 foreign key (c1,c1) references t1(c2,c2) on update cascade on delete cascade;
ERROR HY000: Cannot add foreign key constraint
alter table t1 add CONSTRAINT fk4 foreign key (c1,c2) references t1(c1,c2) on update cascade on delete cascade;
ERROR HY000: Cannot add foreign key constraint
alter table t1 add CONSTRAINT fk4 foreign key (c1,c2) references t1(c2,c1) on update cascade on delete cascade;
ERROR HY000: Cannot add foreign key constraint
alter table t1 add CONSTRAINT fk4 foreign key (c1,c2) references t1(c1,c3) on update cascade on delete cascade;
ERROR HY000: Cannot add foreign key constraint
alter table t1 add CONSTRAINT fk4 foreign key (c1,c2) references t1(c3,c4) on update cascade on delete cascade;
ERROR HY000: Cannot add foreign key constraint
alter table t1 add CONSTRAINT fk4 foreign key (c1,c3) references t1(c1,c1) on update cascade on delete cascade;
ERROR HY000: Cannot add foreign key constraint
alter table t1 add CONSTRAINT fk4 foreign key (c1,c3) references t1(c2,c2) on update cascade on delete cascade;
ERROR HY000: Cannot add foreign key constraint

alter table t1 add CONSTRAINT fk4 foreign key (c1,c3) references t1(c1,c2) on update cascade on delete cascade;
ERROR HY000: Cannot add foreign key constraint

alter table t1 add CONSTRAINT fk5 foreign key (c1,c3) references t1(c2,c1) on update cascade on delete cascade;
ERROR HY000: Cannot add foreign key constraint
alter table t1 add CONSTRAINT fk5 foreign key (c1,c3) references t1(c1,c3) on update cascade on delete cascade;
ERROR HY000: Cannot add foreign key constraint
alter table t1 add CONSTRAINT fk5 foreign key (c1,c3) references t1(c3,c4) on update cascade on delete cascade;
ERROR HY000: Cannot add foreign key constraint
alter table t1 add CONSTRAINT fk5 foreign key (c3,c4) references t1(c1,c1) on update cascade on delete cascade;
ERROR HY000: Cannot add foreign key constraint
alter table t1 add CONSTRAINT fk5 foreign key (c3,c4) references t1(c2,c2) on update cascade on delete cascade;
ERROR HY000: Cannot add foreign key constraint

alter table t1 add CONSTRAINT fk5 foreign key (c3,c4) references t1(c1,c2) on update cascade on delete cascade;
alter table t1 add CONSTRAINT fk6 foreign key (c3,c4) references t1(c2,c1) on update cascade on delete cascade;

alter table t1 add CONSTRAINT fk7 foreign key (c3,c4) references t1(c1,c3) on update cascade on delete cascade;
ERROR HY000: Cannot add foreign key constraint
alter table t1 add CONSTRAINT fk8 foreign key (c3,c4) references t1(c2,c3) on update cascade on delete cascade;
ERROR HY000: Cannot add foreign key constraint
alter table t1 add CONSTRAINT fk8 foreign key (c3,c4) references t1(c1,c4) on update cascade on delete cascade;
ERROR HY000: Cannot add foreign key constraint
alter table t1 add CONSTRAINT fk8 foreign key (c3,c4) references t1(c2,c4) on update cascade on delete cascade;
ERROR HY000: Cannot add foreign key constraint
alter table t1 add CONSTRAINT fk8 foreign key (c3,c4) references t1(c3,c4) on update cascade on delete cascade;
ERROR HY000: Cannot add foreign key constraint
alter table t1 add CONSTRAINT fk8 foreign key (c1,c3,c4) references t1(c2,c1,c2) on update cascade on delete cascade;
ERROR HY000: Cannot add foreign key constraint
alter table t1 add CONSTRAINT fk8 foreign key (c2,c3,c4) references t1(c1,c1,c1) on update cascade on delete cascade;
ERROR HY000: Cannot add foreign key constraint

drop table t1;

################################
#### 自引用(非唯一索引)
create table t1(id int,c1 int,c2 int,c3 int,c4 int unique,c5 int unique);
create index t1index1 on t1(c1);
create index t1index2 on t1(c2);
create index t1index3 on t1(c3);

alter table t1 add CONSTRAINT fk1 foreign key (c1) references t1(c2) on update cascade on delete cascade;
alter table t1 add CONSTRAINT fk2 foreign key (c2) references t1(c3) on update cascade on delete cascade;
alter table t1 add CONSTRAINT fk3 foreign key (c3) references t1(c4) on update cascade on delete cascade;
alter table t1 add CONSTRAINT fk4 foreign key (c4) references t1(c5) on update cascade on delete cascade;
alter table t1 add CONSTRAINT fk5 foreign key (c5) references t1(c1) on update cascade on delete cascade;

set foreign_key_checks=off;
insert into t1 values(1,1,1,1,1,1);
insert into t1 values(2,null,null,null,null,null);
insert into t1 values(3,1,1,1,null,null);

set foreign_key_checks=on;
update t1 set c1=10 where id = 1;
ERROR 23000: Cannot delete or update a parent row: a foreign key constraint fails
update t1 set c1=null where id = 1;
ERROR 23000: Cannot delete or update a parent row: a foreign key constraint fails
update t1 set c1=10,c2=10,c3=10,c4=10,c5=10 where id = 1;
ERROR 23000: Cannot delete or update a parent row: a foreign key constraint fails
update t1 set c1=null,c2=null,c3=null,c4=null,c5=null where id = 1;
ERROR 23000: Cannot delete or update a parent row: a foreign key constraint fails
update t1 set c1=2 where id = 2;
ERROR 23000: Cannot add or update a child row: a foreign key constraint fails

update t1 set c1=1 where id = 2;
update t1 set c2=1 where id = 2;
update t1 set c3=1 where id = 2;

update t1 set c1=1,c2=1 where id = 2;
update t1 set c1=1,c2=1,c3=1 where id = 2;
update t1 set c1=2,c2=2,c3=2,c4=2,c5=2 where id = 2;
ERROR 23000: Cannot delete or update a parent row: a foreign key constraint fails

select * from t1 order by id;
+------+------+------+------+------+------+
| id   | c1   | c2   | c3   | c4   | c5   |
+------+------+------+------+------+------+
|    1 |    1 |    1 |    1 |    1 |    1 |
|    2 |    1 |    1 |    1 | NULL | NULL |
|    3 |    1 |    1 |    1 | NULL | NULL |
+------+------+------+------+------+------+

update t1 set c1=1 where id = 3;
update t1 set c4=1 where id = 3;
ERROR 23000: Duplicate entry '1' for key 'c4'
update t1 set c4=2 where id = 3;
ERROR 23000: Cannot add or update a child row: a foreign key constraint fails
update t1 set c1=c1+1 where id = 3;
ERROR 23000: Cannot delete or update a parent row: a foreign key constraint fails

select * from t1 order by 1,2,3,4;
+------+------+------+------+------+------+
| id   | c1   | c2   | c3   | c4   | c5   |
+------+------+------+------+------+------+
|    1 |    1 |    1 |    1 |    1 |    1 |
|    2 |    1 |    1 |    1 | NULL | NULL |
|    3 |    1 |    1 |    1 | NULL | NULL |
+------+------+------+------+------+------+

drop table t1;

drop user fk_testuser;
purge recyclebin;
