result_format: 4

# ◆ 准备测试用户
drop user if exists fk_testuser;
drop database if exists fk_testuser_db;
create user 'fk_testuser' identified by 'fk_testuser';
CREATE DATABASE IF NOT EXISTS  fk_testuser_db;
grant all on *.* to fk_testuser WITH GRANT OPTION;



drop table if exists t6;
drop table if exists t5;
drop table if exists t4;
drop table if exists t3;
drop table if exists t2;
drop table if exists t1;
################################
#### 相互引用
create table t1(c1 int primary key,c2 int);
create table t2(c1 int primary key,c2 int unique);

set foreign_key_checks=off;
insert into t1 values(1, 2), (2, 3), (3, 4);
insert into t2 values(10, 20), (20, 30), (30, 40);

alter table t2 add CONSTRAINT fk1 foreign key (c2) references t1(c1) on update cascade;
alter table t1 add CONSTRAINT fk2 foreign key (c1) references t2(c2) on update cascade;

set foreign_key_checks=on;
update t1 set c1 = c1 * 10;
ERROR 23000: Cannot add or update a child row: a foreign key constraint fails
update t1 set c1 = c1 * 10 where c1 = 1;
ERROR 23000: Cannot add or update a child row: a foreign key constraint fails

update t1 set c1 = c1 * 10 where c1 = 2;
update t1 set c1 = c1 * 10 where c1 = 3;
update t1 set c1 = c1;
select * from t1 order by 1,2;
+----+------+
| c1 | c2   |
+----+------+
|  1 |    2 |
| 20 |    3 |
| 30 |    4 |
+----+------+
select * from t2 order by 1,2;
+----+------+
| c1 | c2   |
+----+------+
| 10 |   20 |
| 20 |   30 |
| 30 |   40 |
+----+------+

insert into t1 values(40, 4);
insert into t2 values(40, 50);
ERROR 23000: Cannot add or update a child row: a foreign key constraint fails

alter table t1 DROP FOREIGN KEY fk2;
drop table t2;
drop table t1;

################################
#### 多表引用(表没有索引)
create table t1(c1 int primary key,c2 int);
create table t2(c1 int primary key,c2 int);
create table t3(c1 int primary key,c2 int);
create table t4(c1 int primary key,c2 int);
create table t5(c1 int primary key,c2 int);

set foreign_key_checks=off;
insert into t1 values(10, 11), (12, 13), (14, 15);
insert into t2 values(20, 21), (22, 23), (24, 25);
insert into t3 values(30, 31), (32, 33), (34, 35);
insert into t4 values(40, 41), (42, 43), (44, 45);
insert into t5 values(50, 51), (52, 53), (54, 55);

alter table t2 add CONSTRAINT fk1 foreign key (c2) references t1(c1) on update cascade;

alter table t3 add CONSTRAINT fk2 foreign key (c2) references t2(c2) on update cascade;
ERROR HY000: Cannot add foreign key constraint
alter table t4 add CONSTRAINT fk3 foreign key (c2) references t3(c2) on update cascade;
ERROR HY000: Cannot add foreign key constraint
alter table t5 add CONSTRAINT fk4 foreign key (c2) references t4(c2) on update cascade;
ERROR HY000: Cannot add foreign key constraint

set foreign_key_checks=on;
insert into t2 values(26, 1);
ERROR 23000: Cannot add or update a child row: a foreign key constraint fails
insert into t2 values(26, 10);

drop table if exists t6;
drop table if exists t5;
drop table if exists t4;
drop table if exists t3;
drop table if exists t2;
drop table if exists t1;
################################
#### 多表引用
create table t1(c1 int primary key,c2 int);
create table t2(c1 int primary key,c2 int unique);
create table t3(c1 int primary key,c2 int unique);
create table t4(c1 int primary key,c2 int unique);
create table t5(c1 int primary key,c2 int unique);

set foreign_key_checks=off;
insert into t1 values(10, 11), (12, 13), (14, 15);
insert into t2 values(20, 21), (22, 23), (24, 25);
insert into t3 values(30, 31), (32, 33), (34, 35);
insert into t4 values(40, 41), (42, 43), (44, 45);
insert into t5 values(50, 51), (52, 53), (54, 55);

alter table t2 add CONSTRAINT fk1 foreign key (c2) references t1(c1) on update cascade on delete cascade;
alter table t3 add CONSTRAINT fk2 foreign key (c2) references t2(c2) on update cascade on delete cascade;
alter table t4 add CONSTRAINT fk3 foreign key (c2) references t3(c2) on update cascade on delete cascade;
alter table t5 add CONSTRAINT fk4 foreign key (c2) references t4(c2) on update cascade on delete cascade;

set foreign_key_checks=on;
insert into t2 values(26, 1);
ERROR 23000: Cannot add or update a child row: a foreign key constraint fails
insert into t2 values(26, 10);

insert into t3 values(36, 11);
ERROR 23000: Cannot add or update a child row: a foreign key constraint fails
insert into t3 values(36, 21);

insert into t4 values(46, 23);
ERROR 23000: Cannot add or update a child row: a foreign key constraint fails
insert into t4 values(46, 33);

insert into t5 values(56, 35);
ERROR 23000: Cannot add or update a child row: a foreign key constraint fails
insert into t5 values(56, 45);

insert into t2 values(27, 12),(28, 14);
insert into t3 values(37, 23),(38, 25);
insert into t4 values(47, 31),(48, 35);
insert into t5 values(57, 41),(58, 43);

select * from t1 order by 1,2;
+----+------+
| c1 | c2   |
+----+------+
| 10 |   11 |
| 12 |   13 |
| 14 |   15 |
+----+------+
select * from t2 order by 1,2;
+----+------+
| c1 | c2   |
+----+------+
| 20 |   21 |
| 22 |   23 |
| 24 |   25 |
| 26 |   10 |
| 27 |   12 |
| 28 |   14 |
+----+------+
select * from t3 order by 1,2;
+----+------+
| c1 | c2   |
+----+------+
| 30 |   31 |
| 32 |   33 |
| 34 |   35 |
| 36 |   21 |
| 37 |   23 |
| 38 |   25 |
+----+------+
select * from t4 order by 1,2;
+----+------+
| c1 | c2   |
+----+------+
| 40 |   41 |
| 42 |   43 |
| 44 |   45 |
| 46 |   33 |
| 47 |   31 |
| 48 |   35 |
+----+------+
select * from t5 order by 1,2;
+----+------+
| c1 | c2   |
+----+------+
| 50 |   51 |
| 52 |   53 |
| 54 |   55 |
| 56 |   45 |
| 57 |   41 |
| 58 |   43 |
+----+------+

update t1 set c1 = c1 + 5;
update t2 set c2 = c2 + 5;
ERROR 23000: Cannot add or update a child row: a foreign key constraint fails
update t3 set c2 = c2 + 5;
ERROR 23000: Cannot add or update a child row: a foreign key constraint fails
update t4 set c2 = c2 + 5;
ERROR 23000: Cannot add or update a child row: a foreign key constraint fails
update t5 set c2 = c2 + 5;
ERROR 23000: Cannot add or update a child row: a foreign key constraint fails

insert into t3 values(39, 15);
insert into t4 values(49, 15);
insert into t5 values(59, 15);

update t1 set c1 = c1 * 10;

select * from t1 order by 1,2;
+-----+------+
| c1  | c2   |
+-----+------+
| 150 |   11 |
| 170 |   13 |
| 190 |   15 |
+-----+------+
select * from t2 order by 1,2;
+----+------+
| c1 | c2   |
+----+------+
| 20 |   21 |
| 22 |   23 |
| 24 |   25 |
| 26 |  150 |
| 27 |  170 |
| 28 |  190 |
+----+------+
select * from t3 order by 1,2;
+----+------+
| c1 | c2   |
+----+------+
| 30 |   31 |
| 32 |   33 |
| 34 |   35 |
| 36 |   21 |
| 37 |   23 |
| 38 |   25 |
| 39 |  150 |
+----+------+
select * from t4 order by 1,2;
+----+------+
| c1 | c2   |
+----+------+
| 40 |   41 |
| 42 |   43 |
| 44 |   45 |
| 46 |   33 |
| 47 |   31 |
| 48 |   35 |
| 49 |  150 |
+----+------+
select * from t5 order by 1,2;
+----+------+
| c1 | c2   |
+----+------+
| 50 |   51 |
| 52 |   53 |
| 54 |   55 |
| 56 |   45 |
| 57 |   41 |
| 58 |   43 |
| 59 |  150 |
+----+------+

delete from t1 where c1 = 150;

select * from t1 order by 1,2;
+-----+------+
| c1  | c2   |
+-----+------+
| 170 |   13 |
| 190 |   15 |
+-----+------+
select * from t2 order by 1,2;
+----+------+
| c1 | c2   |
+----+------+
| 20 |   21 |
| 22 |   23 |
| 24 |   25 |
| 27 |  170 |
| 28 |  190 |
+----+------+
select * from t3 order by 1,2;
+----+------+
| c1 | c2   |
+----+------+
| 30 |   31 |
| 32 |   33 |
| 34 |   35 |
| 36 |   21 |
| 37 |   23 |
| 38 |   25 |
+----+------+
select * from t4 order by 1,2;
+----+------+
| c1 | c2   |
+----+------+
| 40 |   41 |
| 42 |   43 |
| 44 |   45 |
| 46 |   33 |
| 47 |   31 |
| 48 |   35 |
+----+------+
select * from t5 order by 1,2;
+----+------+
| c1 | c2   |
+----+------+
| 50 |   51 |
| 52 |   53 |
| 54 |   55 |
| 56 |   45 |
| 57 |   41 |
| 58 |   43 |
+----+------+

alter table t1 drop primary key;
ERROR HY000: unique/primary keys in table referenced by enabled foreign keys
drop table t2;
ERROR HY000: Cannot drop table 't2' referenced by a foreign key constraint 'fk2' on table 't3'
alter table t3 drop COLUMN c2;
ERROR HY000: 'c2': used in a foreign key constraint
alter table t4 CHANGE COLUMN c2 c2 char(100);
ERROR HY000: 'c2': used in a foreign key constraint

select * from t1  where c1 = 170 for update;
+-----+------+
| c1  | c2   |
+-----+------+
| 170 |   13 |
+-----+------+

drop table if exists t6;
drop table if exists t5;
drop table if exists t4;
drop table if exists t3;
drop table if exists t2;
drop table if exists t1;
################################
#### 多个表的更新
create table t1(a int primary key, id int);
create table t2(b int primary key, a int unique, id int);
create table t3(c int primary key, a int unique, id int);

alter table t2 add CONSTRAINT fk1 foreign key(a) references t1(a) on update cascade on delete cascade;
alter table t3 add CONSTRAINT fk2 foreign key(a) references t2(a) on update cascade on delete cascade;
insert into t1 values(1, 110);
insert into t2 values(1, 1, 110);
insert into t3 values(1, 1, 110);

#### update
update t1, t2, t3 set t1.a = 10, t2.b = 20 where t1.id = t2.id and t2.id = t3.id;
ERROR 23000: Cannot delete or update a parent row: a foreign key constraint fails

update t1 set t1.a = 10 where t1.id = 1;
update t1 set t1.a = 11 where t1.id = 110;

select * from t1 order by 1,2 for update;
+----+------+
| a  | id   |
+----+------+
| 11 |  110 |
+----+------+
select * from t2 order by 1,2 for update;
+---+------+------+
| b | a    | id   |
+---+------+------+
| 1 |   11 |  110 |
+---+------+------+
select * from t3 order by 1,2 for update;
+---+------+------+
| c | a    | id   |
+---+------+------+
| 1 |   11 |  110 |
+---+------+------+

#### REPLACE
REPLACE INTO t1 VALUES (11, 1110);

select * from t1 order by 1,2 for update;
+----+------+
| a  | id   |
+----+------+
| 11 | 1110 |
+----+------+
select * from t2 order by 1,2 for update;
+---+------+------+
| b | a    | id   |
+---+------+------+
+---+------+------+
select * from t3 order by 1,2 for update;
+---+------+------+
| c | a    | id   |
+---+------+------+
+---+------+------+

REPLACE INTO t1 VALUES (12, 111),(13, 112),(14,113);
insert into t2 values(2, 13, 112);
insert into t3 values(2, 13, 112);
insert into t3 values(3, 12, 111);
ERROR 23000: Cannot add or update a child row: a foreign key constraint fails

update t1 set t1.a = 130 where t1.id = 112;

select * from t1 order by 1,2 for update;
+-----+------+
| a   | id   |
+-----+------+
|  11 | 1110 |
|  12 |  111 |
|  14 |  113 |
| 130 |  112 |
+-----+------+
select * from t2 order by 1,2 for update;
+---+------+------+
| b | a    | id   |
+---+------+------+
| 2 |  130 |  112 |
+---+------+------+
select * from t3 order by 1,2 for update;
+---+------+------+
| c | a    | id   |
+---+------+------+
| 2 |  130 |  112 |
+---+------+------+

#### TRUNCATE 
TRUNCATE TABLE t1;
ERROR 42000: Cannot truncate a table referenced in a foreign key constraint (`fk_testuser_db`.`t2`, CONSTRAINT `fk1` FOREIGN KEY (`a`) REFERENCES `fk_testuser_db`.`t1` (`a`))

#### delete
delete from t1 where id = 112;

select * from t1 order by 1,2 for update;
+----+------+
| a  | id   |
+----+------+
| 11 | 1110 |
| 12 |  111 |
| 14 |  113 |
+----+------+
select * from t2 order by 1,2 for update;
+---+------+------+
| b | a    | id   |
+---+------+------+
+---+------+------+
select * from t3 order by 1,2 for update;
+---+------+------+
| c | a    | id   |
+---+------+------+
+---+------+------+

drop table if exists t3;
drop table if exists t2;
drop table if exists t1;
################################
#### 自引用
create table t1 (c1 int primary key, c2 int, 
	foreign key (c2) references t1(c1) on update cascade on delete cascade);

set foreign_key_checks=off;
insert into t1 values (1,1),(2,2),(3,3);
insert into t1 values (4,40),(5,50),(6,60);
select * from t1 order by 1,2 for update;
+----+------+
| c1 | c2   |
+----+------+
|  1 |    1 |
|  2 |    2 |
|  3 |    3 |
|  4 |   40 |
|  5 |   50 |
|  6 |   60 |
+----+------+

set foreign_key_checks=on;
update t1 set c1 = c2 where c1 = 1;
update t1 set c1 = c2 where c1 = 4;
select * from t1 order by 1,2 for update;
+----+------+
| c1 | c2   |
+----+------+
|  1 |    1 |
|  2 |    2 |
|  3 |    3 |
|  5 |   50 |
|  6 |   60 |
| 40 |   40 |
+----+------+

update t1 set c1 = c2*10 where c1 = 1;
ERROR 23000: Cannot delete or update a parent row: a foreign key constraint fails

update t1 set c1 = c1,c2 = c2 where c1 = 1;
update t1 set c1 = c2,c2 = c1 where c1 = 1;
select * from t1 order by 1,2 for update;
+----+------+
| c1 | c2   |
+----+------+
|  1 |    1 |
|  2 |    2 |
|  3 |    3 |
|  5 |   50 |
|  6 |   60 |
| 40 |   40 |
+----+------+

update t1 set c1 = c1,c2 = c2 where c1 = 5;
update t1 set c1 = c2,c2 = c1 where c1 = 6;
select * from t1 order by 1,2 for update;
+----+------+
| c1 | c2   |
+----+------+
|  1 |    1 |
|  2 |    2 |
|  3 |    3 |
|  5 |   50 |
| 40 |   40 |
| 60 |   60 |
+----+------+

update t1 set c1 = 4, c2 = 4 where c1 = 1;
select * from t1 order by 1,2 for update;
+----+------+
| c1 | c2   |
+----+------+
|  2 |    2 |
|  3 |    3 |
|  4 |    4 |
|  5 |   50 |
| 40 |   40 |
| 60 |   60 |
+----+------+

drop table t1;

################################
#### 外键引用生成列
create table t1(c1 int primary key,c2 int AS (c1*c1) STORED, id int);
create index t1index1 on t1(c2);
insert into t1(c1,id) values(1,1),(2,2),(3,3);

create table t2(c1 int primary key,c2 int, id int);
alter table t2 add foreign key(c2) references t1(c2) on update cascade on delete cascade;
insert into t2 values(1,1,1),(2,4,2),(3,9,3);

select * from t1 order by 1,2 for update;
+----+------+------+
| c1 | c2   | id   |
+----+------+------+
|  1 |    1 |    1 |
|  2 |    4 |    2 |
|  3 |    9 |    3 |
+----+------+------+
select * from t2 order by 1,2 for update;
+----+------+------+
| c1 | c2   | id   |
+----+------+------+
|  1 |    1 |    1 |
|  2 |    4 |    2 |
|  3 |    9 |    3 |
+----+------+------+

update t1 set c1 = 4 where c1 = 1;
update t2 set c2 = 9 where c1 = 2;
select * from t1 order by 1,2 for update;
+----+------+------+
| c1 | c2   | id   |
+----+------+------+
|  2 |    4 |    2 |
|  3 |    9 |    3 |
|  4 |   16 |    1 |
+----+------+------+
select * from t2 order by 1,2 for update;
+----+------+------+
| c1 | c2   | id   |
+----+------+------+
|  1 |   16 |    1 |
|  2 |    9 |    2 |
|  3 |    9 |    3 |
+----+------+------+

delete from t1 where c1 = 2;
select * from t1 order by 1,2 for update;
+----+------+------+
| c1 | c2   | id   |
+----+------+------+
|  3 |    9 |    3 |
|  4 |   16 |    1 |
+----+------+------+
select * from t2 order by 1,2 for update;
+----+------+------+
| c1 | c2   | id   |
+----+------+------+
|  1 |   16 |    1 |
|  2 |    9 |    2 |
|  3 |    9 |    3 |
+----+------+------+

update t1,t2 set t1.c1 = 6,t2.id=30 where t1.id=t2.id and t1.c1 = 3;
ERROR 23000: Cannot delete or update a parent row: a foreign key constraint fails
update t1,t2 set t1.c1 = 6 where t1.id=t2.id and t1.c1 = 3;
select * from t1,t2 order by 1,2 for update;
+----+------+------+----+------+------+
| c1 | c2   | id   | c1 | c2   | id   |
+----+------+------+----+------+------+
|  4 |   16 |    1 |  1 |   16 |    1 |
|  4 |   16 |    1 |  2 |   36 |    2 |
|  4 |   16 |    1 |  3 |   36 |    3 |
|  6 |   36 |    3 |  1 |   16 |    1 |
|  6 |   36 |    3 |  2 |   36 |    2 |
|  6 |   36 |    3 |  3 |   36 |    3 |
+----+------+------+----+------+------+

drop table if exists t2;
drop table if exists t1;
################################
#### 级联操作，触发触发器
create table t1(c1 int primary key, id int);
create table t2(c1 int primary key, c2 int, id int);
create table t3(c1 int primary key, c2 int, id int, c3 varchar(2000));
alter table t2 add foreign key(c2) references t1(c1) on update cascade on delete cascade;

insert into t1 values(1, 110),(2, 111);
insert into t2 values(1, 1, 110),(2, 1, 110),(3, 2, 111);

CREATE TRIGGER tri1 BEFORE update ON t2 FOR EACH ROW
BEGIN
   insert into t3 values(old.c1,old.c2,old.id,'表t2有更新，触发触发器，记录旧值');
END;
/

update t1 set c1 = c1 * 10 where c1 = 1;

select * from t1 order by 1,2 for update;
+----+------+
| c1 | id   |
+----+------+
|  2 |  111 |
| 10 |  110 |
+----+------+
select * from t2 order by 1,2 for update;
+----+------+------+
| c1 | c2   | id   |
+----+------+------+
|  1 |   10 |  110 |
|  2 |   10 |  110 |
|  3 |    2 |  111 |
+----+------+------+
select * from t3 order by 1,2 for update;
+----+------+------+-------------------------------------------------+
| c1 | c2   | id   | c3                                              |
+----+------+------+-------------------------------------------------+
|  1 |    1 |  110 | 表t2有更新，触发触发器，记录旧值                |
|  2 |    1 |  110 | 表t2有更新，触发触发器，记录旧值                |
+----+------+------+-------------------------------------------------+

drop table t3;
drop table t2;
drop table t1;

################################
#### 多条记录
create table t1(c1 int primary key, c2 int);
create index t1index1 on t1(c2);

create table t2(c1 int, c2 int, id int);
alter table t2 add foreign key(c2) references t1(c2) on update cascade on delete cascade;

drop PROCEDURE insert_data;

CREATE PROCEDURE insert_t1()
BEGIN
    DECLARE i INT DEFAULT 1;
    WHILE i <= 1000 DO
        INSERT INTO t1 VALUES (i, i + 99);
        SET i = i + 1;
    END WHILE;
END;
/

CALL insert_t1();

CREATE PROCEDURE insert_t2()
BEGIN
    DECLARE i INT DEFAULT 1;
    WHILE i <= 1000 DO
        INSERT INTO t2 VALUES (i, i + 99,i);
        INSERT INTO t2 VALUES (i, i + 99,i);
        INSERT INTO t2 VALUES (i, i + 99,i);
        INSERT INTO t2 VALUES (i, i + 99,i);
        SET i = i + 1;
    END WHILE;
END;
/

CALL insert_t2();

select count(1) from t1;
+----------+
| count(1) |
+----------+
|     1000 |
+----------+
select count(1) from t2;
+----------+
| count(1) |
+----------+
|     4000 |
+----------+

delete from t1 where c1 = 1;
select count(1) from t1;
+----------+
| count(1) |
+----------+
|      999 |
+----------+
select count(1) from t2;
+----------+
| count(1) |
+----------+
|     3996 |
+----------+

delete from t1 where c1 <10;
select count(1) from t1;
+----------+
| count(1) |
+----------+
|      991 |
+----------+
select count(1) from t2;
+----------+
| count(1) |
+----------+
|     3964 |
+----------+

update t1 set c2 = c2 + 1 where c1 < 20;
select * from t1 where c1 < 20 order by 1,2 for update;
+----+------+
| c1 | c2   |
+----+------+
| 10 |  110 |
| 11 |  111 |
| 12 |  112 |
| 13 |  113 |
| 14 |  114 |
| 15 |  115 |
| 16 |  116 |
| 17 |  117 |
| 18 |  118 |
| 19 |  119 |
+----+------+
select * from t2 where c1 < 20 order by 1,2 for update;
+------+------+------+
| c1   | c2   | id   |
+------+------+------+
|   10 |  119 |   10 |
|   10 |  119 |   10 |
|   10 |  119 |   10 |
|   10 |  119 |   10 |
|   11 |  119 |   11 |
|   11 |  119 |   11 |
|   11 |  119 |   11 |
|   11 |  119 |   11 |
|   12 |  119 |   12 |
|   12 |  119 |   12 |
|   12 |  119 |   12 |
|   12 |  119 |   12 |
|   13 |  119 |   13 |
|   13 |  119 |   13 |
|   13 |  119 |   13 |
|   13 |  119 |   13 |
|   14 |  119 |   14 |
|   14 |  119 |   14 |
|   14 |  119 |   14 |
|   14 |  119 |   14 |
|   15 |  119 |   15 |
|   15 |  119 |   15 |
|   15 |  119 |   15 |
|   15 |  119 |   15 |
|   16 |  119 |   16 |
|   16 |  119 |   16 |
|   16 |  119 |   16 |
|   16 |  119 |   16 |
|   17 |  119 |   17 |
|   17 |  119 |   17 |
|   17 |  119 |   17 |
|   17 |  119 |   17 |
|   18 |  119 |   18 |
|   18 |  119 |   18 |
|   18 |  119 |   18 |
|   18 |  119 |   18 |
|   19 |  119 |   19 |
|   19 |  119 |   19 |
|   19 |  119 |   19 |
|   19 |  119 |   19 |
+------+------+------+

delete from t1 where c1 = 19;
select count(1) from t1;
+----------+
| count(1) |
+----------+
|      990 |
+----------+
select count(1) from t2;
+----------+
| count(1) |
+----------+
|     3920 |
+----------+

drop table t2;
drop table t1;

################################
#### 删除索引
create table t1(c1 int primary key, c2 int);
create unique index t1index1 on t1(c2);

create table t2(c1 int, c2 int, id int);
alter table t2 add foreign key(c2) references t1(c2) on update cascade on delete cascade;

alter table t1 drop index t1index1;
ERROR HY000: unique/primary keys in table referenced by enabled foreign keys
select TABLE_NAME,REFERENCED_TABLE_NAME,UNIQUE_CONSTRAINT_NAME from information_schema.referential_constraints where CONSTRAINT_SCHEMA = schema();
+------------+-----------------------+------------------------+
| TABLE_NAME | REFERENCED_TABLE_NAME | UNIQUE_CONSTRAINT_NAME |
+------------+-----------------------+------------------------+
| t2         | t1                    | t1index1               |
+------------+-----------------------+------------------------+

create unique index t1index2 on t1(c2);

alter table t1 drop index t1index1;
ERROR HY000: unique/primary keys in table referenced by enabled foreign keys

alter table t1 drop index t1index2;

select TABLE_NAME,REFERENCED_TABLE_NAME,UNIQUE_CONSTRAINT_NAME from information_schema.referential_constraints where CONSTRAINT_SCHEMA = schema();
+------------+-----------------------+------------------------+
| TABLE_NAME | REFERENCED_TABLE_NAME | UNIQUE_CONSTRAINT_NAME |
+------------+-----------------------+------------------------+
| t2         | t1                    | t1index1               |
+------------+-----------------------+------------------------+

drop table t2;
drop table t1;

################################
#### 外键引用不同的索引
create table t1(c1 int primary key, c2 int,c3 int,c4 int);
create index t1index1 on t1(c2);
create index t1index2 on t1(c3);
create unique index t1index3 on t1(c4);

insert into t1 values(11,22,33,44),(12,23,34,45),(13,24,35,46),(14,25,36,47);

create table t2(c1 int, c2 int,c3 int,c4 int, id int);
alter table t2 add foreign key(c1) references t1(c1) on update cascade on delete cascade;
alter table t2 add foreign key(c1) references t1(c2) on update cascade on delete cascade;
alter table t2 add foreign key(c1) references t1(c3) on update cascade on delete cascade;
alter table t2 add foreign key(c1) references t1(c4) on update cascade on delete cascade;

alter table t2 add foreign key(c2) references t1(c2) on update cascade on delete cascade;
alter table t2 add foreign key(c3) references t1(c3) on update cascade on delete cascade;
alter table t2 add foreign key(c4) references t1(c4) on update cascade on delete cascade;
alter table t2 add foreign key(c4) references t1(null) on update cascade on delete cascade;
ERROR 42000: You have an error in your SQL syntax; check the manual that corresponds to your OceanBase version for the right syntax to use near 'null) on update cascade on delete cascade' at line 1

insert into t2 values(11,null,null,null,null);
ERROR 23000: Cannot add or update a child row: a foreign key constraint fails
insert into t2 values(22,null,null,null,null);
ERROR 23000: Cannot add or update a child row: a foreign key constraint fails
insert into t2 values(33,null,null,null,null);
ERROR 23000: Cannot add or update a child row: a foreign key constraint fails
insert into t2 values(44,null,null,null,null);
ERROR 23000: Cannot add or update a child row: a foreign key constraint fails

insert into t2 values(null,22,33,44,null);
update t1 set c1 = c1,c2 = c2 * 10 where c2 = 22 ;

select * from t1 order by 1,2 for update;
+----+------+------+------+
| c1 | c2   | c3   | c4   |
+----+------+------+------+
| 11 |  220 |   33 |   44 |
| 12 |   23 |   34 |   45 |
| 13 |   24 |   35 |   46 |
| 14 |   25 |   36 |   47 |
+----+------+------+------+
select * from t2 order by 1,2 for update;
+------+------+------+------+------+
| c1   | c2   | c3   | c4   | id   |
+------+------+------+------+------+
| NULL |  220 |   33 |   44 | NULL |
+------+------+------+------+------+

alter table t2 add foreign key(c1,c2) references t1(c1,c2) on update cascade on delete cascade;
ERROR HY000: Cannot add foreign key constraint
alter table t2 add foreign key(c1,c2) references t1(c2,c3) on update cascade on delete cascade;
ERROR HY000: Cannot add foreign key constraint
alter table t2 add foreign key(c1,c2) references t1(c3,c4) on update cascade on delete cascade;
ERROR HY000: Cannot add foreign key constraint
alter table t2 add foreign key(c1,c2) references t1(c1,1) on update cascade on delete cascade;
ERROR 42000: You have an error in your SQL syntax; check the manual that corresponds to your OceanBase version for the right syntax to use near '1) on update cascade on delete cascade' at line 1
alter table t2 add foreign key(c1,c2) references t1(c1,c1) on update cascade on delete cascade;
ERROR HY000: Cannot add foreign key constraint
alter table t2 add foreign key(c1,c2) references t1(c2,c2) on update cascade on delete cascade;
ERROR HY000: Cannot add foreign key constraint
alter table t2 add foreign key(c1,c2) references t1(c3,c3) on update cascade on delete cascade;
ERROR HY000: Cannot add foreign key constraint
alter table t2 add foreign key(c1,c2) references t1(c4,c4) on update cascade on delete cascade;
ERROR HY000: Cannot add foreign key constraint
alter table t2 add foreign key(c1,c2) references t1(null,null) on update cascade on delete cascade;
ERROR 42000: You have an error in your SQL syntax; check the manual that corresponds to your OceanBase version for the right syntax to use near 'null,null) on update cascade on delete cascade' at line 1

drop table t2;
drop table t1;

drop user fk_testuser;
purge recyclebin;
