result_format: 4

# ◆ 准备测试用户
drop user if exists fk_testuser;
drop database if exists fk_testuser_db;
create user 'fk_testuser' identified by 'fk_testuser';
CREATE DATABASE IF NOT EXISTS  fk_testuser_db;
grant all on *.* to fk_testuser WITH GRANT OPTION;



drop table if exists t6;
drop table if exists t5;
drop table if exists t4;
drop table if exists t3;
drop table if exists t2;
drop table if exists t1;
##################################
###### 级联操作，触发触发器
create table t1(c1 int primary key, id int);
create table t2(c1 int primary key, c2 int, id int);
create table t3(c1 int, c2 int, id int, c3 varchar(2000));
alter table t2 add foreign key(c2) references t1(c1) on update cascade on delete cascade;

insert into t1 values(1, 110),(2, 111);
insert into t2 values(1, 1, 110),(2, 1, 110),(3, 2, 111);

CREATE TRIGGER tri1 BEFORE update ON t2 FOR EACH ROW
BEGIN
   insert into t3 values(old.c1,old.c2,old.id,'表t2有更新，触发触发器，记录旧值');
   update t1 set c1 = c1 * 10 where id = 110;
END;
/

select * from t1 order by 1,2 for update;
+----+------+
| c1 | id   |
+----+------+
|  1 |  110 |
|  2 |  111 |
+----+------+
select * from t2 order by 1,2 for update;
+----+------+------+
| c1 | c2   | id   |
+----+------+------+
|  1 |    1 |  110 |
|  2 |    1 |  110 |
|  3 |    2 |  111 |
+----+------+------+
select * from t3 order by 1,2 for update;
+------+------+------+------+
| c1   | c2   | id   | c3   |
+------+------+------+------+
+------+------+------+------+

update t2 set c2 = 1 where c1 = 3;
ERROR HY000: Recursive limit 0 (as set by the max_sp_recursion_depth variable) was exceeded for routine

update t2 set c2 = 2,id=1110 where c1 = 3;
ERROR HY000: Recursive limit 0 (as set by the max_sp_recursion_depth variable) was exceeded for routine
select * from t1 order by 1,2 for update;
+----+------+
| c1 | id   |
+----+------+
|  1 |  110 |
|  2 |  111 |
+----+------+
select * from t2 order by 1,2 for update;
+----+------+------+
| c1 | c2   | id   |
+----+------+------+
|  1 |    1 |  110 |
|  2 |    1 |  110 |
|  3 |    2 |  111 |
+----+------+------+
select * from t3 order by 1,2 for update;
+------+------+------+------+
| c1   | c2   | id   | c3   |
+------+------+------+------+
+------+------+------+------+

update t2 set c2 = 1 where c1 = 2;
ERROR HY000: Recursive limit 0 (as set by the max_sp_recursion_depth variable) was exceeded for routine
select * from t1 order by 1,2 for update;
+----+------+
| c1 | id   |
+----+------+
|  1 |  110 |
|  2 |  111 |
+----+------+
select * from t2 order by 1,2 for update;
+----+------+------+
| c1 | c2   | id   |
+----+------+------+
|  1 |    1 |  110 |
|  2 |    1 |  110 |
|  3 |    2 |  111 |
+----+------+------+
select * from t3 order by 1,2 for update;
+------+------+------+------+
| c1   | c2   | id   | c3   |
+------+------+------+------+
+------+------+------+------+

update t2 set c2 = 2 where c1 = 2;
ERROR HY000: Recursive limit 0 (as set by the max_sp_recursion_depth variable) was exceeded for routine
select * from t1 order by 1,2 for update;
+----+------+
| c1 | id   |
+----+------+
|  1 |  110 |
|  2 |  111 |
+----+------+
select * from t2 order by 1,2 for update;
+----+------+------+
| c1 | c2   | id   |
+----+------+------+
|  1 |    1 |  110 |
|  2 |    1 |  110 |
|  3 |    2 |  111 |
+----+------+------+
select * from t3 order by 1,2 for update;
+------+------+------+------+
| c1   | c2   | id   | c3   |
+------+------+------+------+
+------+------+------+------+

update t2 set c2 = null where c1 = 1;
ERROR HY000: Recursive limit 0 (as set by the max_sp_recursion_depth variable) was exceeded for routine
select * from t1 order by 1,2 for update;
+----+------+
| c1 | id   |
+----+------+
|  1 |  110 |
|  2 |  111 |
+----+------+
select * from t2 order by 1,2 for update;
+----+------+------+
| c1 | c2   | id   |
+----+------+------+
|  1 |    1 |  110 |
|  2 |    1 |  110 |
|  3 |    2 |  111 |
+----+------+------+
select * from t3 order by 1,2 for update;
+------+------+------+------+
| c1   | c2   | id   | c3   |
+------+------+------+------+
+------+------+------+------+

update t1 set c1 = c1 * 10 where c1 = 1;

select * from t1 order by 1,2 for update;
+------+------+
| c1   | id   |
+------+------+
|    2 |  111 |
| 1000 |  110 |
+------+------+
select * from t2 order by 1,2 for update;
+----+------+------+
| c1 | c2   | id   |
+----+------+------+
|  1 |   10 |  110 |
|  2 |   10 |  110 |
|  3 |    2 |  111 |
+----+------+------+
select * from t3 order by 1,2 for update;
+------+------+------+-------------------------------------------------+
| c1   | c2   | id   | c3                                              |
+------+------+------+-------------------------------------------------+
|    1 |    1 |  110 | 表t2有更新，触发触发器，记录旧值                |
|    2 |    1 |  110 | 表t2有更新，触发触发器，记录旧值                |
+------+------+------+-------------------------------------------------+

drop table t3;
drop table t2;
drop table t1;

##################################
###### Prepared 语句创建表
PREPARE stmt1 FROM 'create table t1(id int primary key,c1 int,c2 int,index index1(c1,c2))';
EXECUTE stmt1;

PREPARE stmt2 FROM 'create table t2(id int primary key,c1 int,c2 int,foreign key(c1) references t1(c1) on update cascade on delete cascade)';
EXECUTE stmt2;

PREPARE stmt3 FROM 'alter table t2 add foreign key(c1,c2) references t1(c1,c2) on update cascade on delete cascade;';
EXECUTE stmt3;

insert into t1 values(1,1,1),(2,2,2),(3,2,2),(4,3,3);
insert into t2 values(1,1,1),(2,3,3);

update t1 set c1 = 10 where id = 1;
select * from t1 order by 1,2 for update;
+----+------+------+
| id | c1   | c2   |
+----+------+------+
|  1 |   10 |    1 |
|  2 |    2 |    2 |
|  3 |    2 |    2 |
|  4 |    3 |    3 |
+----+------+------+
select * from t2 order by 1,2 for update;
+----+------+------+
| id | c1   | c2   |
+----+------+------+
|  1 |   10 |    1 |
|  2 |    3 |    3 |
+----+------+------+

drop table t2;
drop table t1;

##################################
###### 非unique key的特性
create table t1(id int primary key,c1 int,c2 int ,index index1(c1));
create table t2(id int primary key,c1 int,c2 int);
alter table t2 add CONSTRAINT fk1  foreign key(c1) references t1(c1) on update cascade on delete cascade;

insert into t1 values(1,1,1),(2,1,1),(3,1,1),(4,1,1);
insert into t1 values(5,2,2),(6,2,2),(7,2,2),(8,2,2),(9,2,2),(10,2,2);
insert into t1 values(11,3,3),(12,3,3),(13,3,3),(14,3,3),(15,3,3),(16,3,3),(17,3,3),(18,3,3),(19,3,3),(20,3,3);
insert into t1 values(21,4,4),(22,4,4),(23,4,4),(24,4,4);
insert into t1 values(25,5,5),(26,5,5),(27,5,5),(28,5,5),(29,5,5),(30,5,5);

insert into t2 values(1,1,1);
insert into t2 values(2,2,2),(3,2,2);
insert into t2 values(4,3,3),(5,3,3),(6,3,3);

drop table t1_bk;
create table t1_bk as select * from t1;

drop table t2_bk;
create table t2_bk as select * from t2;

select * from t1 order by 1,2,3;
+----+------+------+
| id | c1   | c2   |
+----+------+------+
|  1 |    1 |    1 |
|  2 |    1 |    1 |
|  3 |    1 |    1 |
|  4 |    1 |    1 |
|  5 |    2 |    2 |
|  6 |    2 |    2 |
|  7 |    2 |    2 |
|  8 |    2 |    2 |
|  9 |    2 |    2 |
| 10 |    2 |    2 |
| 11 |    3 |    3 |
| 12 |    3 |    3 |
| 13 |    3 |    3 |
| 14 |    3 |    3 |
| 15 |    3 |    3 |
| 16 |    3 |    3 |
| 17 |    3 |    3 |
| 18 |    3 |    3 |
| 19 |    3 |    3 |
| 20 |    3 |    3 |
| 21 |    4 |    4 |
| 22 |    4 |    4 |
| 23 |    4 |    4 |
| 24 |    4 |    4 |
| 25 |    5 |    5 |
| 26 |    5 |    5 |
| 27 |    5 |    5 |
| 28 |    5 |    5 |
| 29 |    5 |    5 |
| 30 |    5 |    5 |
+----+------+------+
select * from t2 order by 1,2,3;
+----+------+------+
| id | c1   | c2   |
+----+------+------+
|  1 |    1 |    1 |
|  2 |    2 |    2 |
|  3 |    2 |    2 |
|  4 |    3 |    3 |
|  5 |    3 |    3 |
|  6 |    3 |    3 |
+----+------+------+

## 1、更新父表部分数据
update t1 set c1 = c1 * 2 where c2 = 1;
select * from t1 where c2 = 1 order by 1,2,3;
+----+------+------+
| id | c1   | c2   |
+----+------+------+
|  1 |    2 |    1 |
|  2 |    2 |    1 |
|  3 |    2 |    1 |
|  4 |    2 |    1 |
+----+------+------+
select * from t2 where c2 = 1 order by 1,2,3;
+----+------+------+
| id | c1   | c2   |
+----+------+------+
|  1 |    2 |    1 |
+----+------+------+

update t1 set c1 = c1 * 3 where c2 = 2 and id between 5 and 7;
select * from t1 where c2 = 2 order by 1,2,3;
+----+------+------+
| id | c1   | c2   |
+----+------+------+
|  5 |    6 |    2 |
|  6 |    6 |    2 |
|  7 |    6 |    2 |
|  8 |    2 |    2 |
|  9 |    2 |    2 |
| 10 |    2 |    2 |
+----+------+------+
select * from t2 where c2 = 2 order by 1,2,3;
+----+------+------+
| id | c1   | c2   |
+----+------+------+
|  2 |    6 |    2 |
|  3 |    6 |    2 |
+----+------+------+

update t1 set c1 = c1 * 4 where c2 = 2;
select * from t1 where c2 = 2 order by 1,2,3;
+----+------+------+
| id | c1   | c2   |
+----+------+------+
|  5 |   24 |    2 |
|  6 |   24 |    2 |
|  7 |   24 |    2 |
|  8 |    8 |    2 |
|  9 |    8 |    2 |
| 10 |    8 |    2 |
+----+------+------+
select * from t2 where c2 = 2 order by 1,2,3;
+----+------+------+
| id | c1   | c2   |
+----+------+------+
|  2 |   24 |    2 |
|  3 |   24 |    2 |
+----+------+------+

## 2、锁父表 LOCK TABLES
LOCK TABLES t1 WRITE;
insert into t2 values(7,1,1);
ERROR 23000: Cannot add or update a child row: a foreign key constraint fails

insert into t2 values(7,2,2);

UNLOCK TABLES;
insert into t2 values(8,1,1);
ERROR 23000: Cannot add or update a child row: a foreign key constraint fails
insert into t2 values(8,2,2);
select * from t1 order by 1,2,3;
+----+------+------+
| id | c1   | c2   |
+----+------+------+
|  1 |    2 |    1 |
|  2 |    2 |    1 |
|  3 |    2 |    1 |
|  4 |    2 |    1 |
|  5 |   24 |    2 |
|  6 |   24 |    2 |
|  7 |   24 |    2 |
|  8 |    8 |    2 |
|  9 |    8 |    2 |
| 10 |    8 |    2 |
| 11 |    3 |    3 |
| 12 |    3 |    3 |
| 13 |    3 |    3 |
| 14 |    3 |    3 |
| 15 |    3 |    3 |
| 16 |    3 |    3 |
| 17 |    3 |    3 |
| 18 |    3 |    3 |
| 19 |    3 |    3 |
| 20 |    3 |    3 |
| 21 |    4 |    4 |
| 22 |    4 |    4 |
| 23 |    4 |    4 |
| 24 |    4 |    4 |
| 25 |    5 |    5 |
| 26 |    5 |    5 |
| 27 |    5 |    5 |
| 28 |    5 |    5 |
| 29 |    5 |    5 |
| 30 |    5 |    5 |
+----+------+------+
select * from t2 where c2 = 2 order by 1,2,3;
+----+------+------+
| id | c1   | c2   |
+----+------+------+
|  2 |   24 |    2 |
|  3 |   24 |    2 |
|  7 |    2 |    2 |
|  8 |    2 |    2 |
+----+------+------+

##锁父表
LOCK TABLES t1 READ;
insert into t2 values(9,1,1);
ERROR 23000: Cannot add or update a child row: a foreign key constraint fails
insert into t2 values(9,2,2);

UNLOCK TABLES;
insert into t2 values(10,1,1);
ERROR 23000: Cannot add or update a child row: a foreign key constraint fails
insert into t2 values(10,2,2);
select * from t1 order by 1,2,3;
+----+------+------+
| id | c1   | c2   |
+----+------+------+
|  1 |    2 |    1 |
|  2 |    2 |    1 |
|  3 |    2 |    1 |
|  4 |    2 |    1 |
|  5 |   24 |    2 |
|  6 |   24 |    2 |
|  7 |   24 |    2 |
|  8 |    8 |    2 |
|  9 |    8 |    2 |
| 10 |    8 |    2 |
| 11 |    3 |    3 |
| 12 |    3 |    3 |
| 13 |    3 |    3 |
| 14 |    3 |    3 |
| 15 |    3 |    3 |
| 16 |    3 |    3 |
| 17 |    3 |    3 |
| 18 |    3 |    3 |
| 19 |    3 |    3 |
| 20 |    3 |    3 |
| 21 |    4 |    4 |
| 22 |    4 |    4 |
| 23 |    4 |    4 |
| 24 |    4 |    4 |
| 25 |    5 |    5 |
| 26 |    5 |    5 |
| 27 |    5 |    5 |
| 28 |    5 |    5 |
| 29 |    5 |    5 |
| 30 |    5 |    5 |
+----+------+------+
select * from t2 where c2 = 2 order by 1,2,3;
+----+------+------+
| id | c1   | c2   |
+----+------+------+
|  2 |   24 |    2 |
|  3 |   24 |    2 |
|  7 |    2 |    2 |
|  8 |    2 |    2 |
|  9 |    2 |    2 |
| 10 |    2 |    2 |
+----+------+------+

## 3、行锁父表 FOR UPDATE 排他锁（部分数据加了锁）
## 用户1 session 1
START TRANSACTION;
SELECT * FROM t1 WHERE c2 = 3 FOR UPDATE;
+----+------+------+
| id | c1   | c2   |
+----+------+------+
| 11 |    3 |    3 |
| 12 |    3 |    3 |
| 13 |    3 |    3 |
| 14 |    3 |    3 |
| 15 |    3 |    3 |
| 16 |    3 |    3 |
| 17 |    3 |    3 |
| 18 |    3 |    3 |
| 19 |    3 |    3 |
| 20 |    3 |    3 |
+----+------+------+

## 连接用户1 session 2
insert into t2 values(11,3,3);
ERROR HY000: Lock wait timeout exceeded; try restarting transaction

## 连接用户1
COMMIT;

## 连接用户1 session 2
insert into t2 values(12,3,3);

select * from t2 order by 1,2,3;
+----+------+------+
| id | c1   | c2   |
+----+------+------+
|  1 |   24 |    1 |
|  2 |   24 |    2 |
|  3 |   24 |    2 |
|  4 |    3 |    3 |
|  5 |    3 |    3 |
|  6 |    3 |    3 |
|  7 |    2 |    2 |
|  8 |    2 |    2 |
|  9 |    2 |    2 |
| 10 |    2 |    2 |
| 12 |    3 |    3 |
+----+------+------+
select * from t1 order by 1,2,3;
+----+------+------+
| id | c1   | c2   |
+----+------+------+
|  1 |    2 |    1 |
|  2 |    2 |    1 |
|  3 |    2 |    1 |
|  4 |    2 |    1 |
|  5 |   24 |    2 |
|  6 |   24 |    2 |
|  7 |   24 |    2 |
|  8 |    8 |    2 |
|  9 |    8 |    2 |
| 10 |    8 |    2 |
| 11 |    3 |    3 |
| 12 |    3 |    3 |
| 13 |    3 |    3 |
| 14 |    3 |    3 |
| 15 |    3 |    3 |
| 16 |    3 |    3 |
| 17 |    3 |    3 |
| 18 |    3 |    3 |
| 19 |    3 |    3 |
| 20 |    3 |    3 |
| 21 |    4 |    4 |
| 22 |    4 |    4 |
| 23 |    4 |    4 |
| 24 |    4 |    4 |
| 25 |    5 |    5 |
| 26 |    5 |    5 |
| 27 |    5 |    5 |
| 28 |    5 |    5 |
| 29 |    5 |    5 |
| 30 |    5 |    5 |
+----+------+------+

## 4、行锁父表 FOR UPDATE 排他锁（其中一行数据加了锁）
## 用户1 session 1
START TRANSACTION;
SELECT * FROM t1 WHERE c2 = 3 and id = 11 FOR UPDATE;
+----+------+------+
| id | c1   | c2   |
+----+------+------+
| 11 |    3 |    3 |
+----+------+------+

## 连接用户1 session 2
insert into t2 values(13,3,3);
ERROR HY000: Lock wait timeout exceeded; try restarting transaction

## 连接用户1 session 1
COMMIT;

## 连接用户1 session 2
insert into t2 values(14,3,3);

select * from t2 order by 1,2,3;
+----+------+------+
| id | c1   | c2   |
+----+------+------+
|  1 |   24 |    1 |
|  2 |   24 |    2 |
|  3 |   24 |    2 |
|  4 |    3 |    3 |
|  5 |    3 |    3 |
|  6 |    3 |    3 |
|  7 |    2 |    2 |
|  8 |    2 |    2 |
|  9 |    2 |    2 |
| 10 |    2 |    2 |
| 12 |    3 |    3 |
| 14 |    3 |    3 |
+----+------+------+
select * from t1 order by 1,2,3;
+----+------+------+
| id | c1   | c2   |
+----+------+------+
|  1 |    2 |    1 |
|  2 |    2 |    1 |
|  3 |    2 |    1 |
|  4 |    2 |    1 |
|  5 |   24 |    2 |
|  6 |   24 |    2 |
|  7 |   24 |    2 |
|  8 |    8 |    2 |
|  9 |    8 |    2 |
| 10 |    8 |    2 |
| 11 |    3 |    3 |
| 12 |    3 |    3 |
| 13 |    3 |    3 |
| 14 |    3 |    3 |
| 15 |    3 |    3 |
| 16 |    3 |    3 |
| 17 |    3 |    3 |
| 18 |    3 |    3 |
| 19 |    3 |    3 |
| 20 |    3 |    3 |
| 21 |    4 |    4 |
| 22 |    4 |    4 |
| 23 |    4 |    4 |
| 24 |    4 |    4 |
| 25 |    5 |    5 |
| 26 |    5 |    5 |
| 27 |    5 |    5 |
| 28 |    5 |    5 |
| 29 |    5 |    5 |
| 30 |    5 |    5 |
+----+------+------+

## 5.1、删除父表行数据
## 用户1 session 1

delete from t1 where c1 = 3 and id = 20;
select * from t1 order by 1,2,3;
+----+------+------+
| id | c1   | c2   |
+----+------+------+
|  1 |    2 |    1 |
|  2 |    2 |    1 |
|  3 |    2 |    1 |
|  4 |    2 |    1 |
|  5 |   24 |    2 |
|  6 |   24 |    2 |
|  7 |   24 |    2 |
|  8 |    8 |    2 |
|  9 |    8 |    2 |
| 10 |    8 |    2 |
| 11 |    3 |    3 |
| 12 |    3 |    3 |
| 13 |    3 |    3 |
| 14 |    3 |    3 |
| 15 |    3 |    3 |
| 16 |    3 |    3 |
| 17 |    3 |    3 |
| 18 |    3 |    3 |
| 19 |    3 |    3 |
| 21 |    4 |    4 |
| 22 |    4 |    4 |
| 23 |    4 |    4 |
| 24 |    4 |    4 |
| 25 |    5 |    5 |
| 26 |    5 |    5 |
| 27 |    5 |    5 |
| 28 |    5 |    5 |
| 29 |    5 |    5 |
| 30 |    5 |    5 |
+----+------+------+
select * from t2 order by 1,2,3;
+----+------+------+
| id | c1   | c2   |
+----+------+------+
|  1 |   24 |    1 |
|  2 |   24 |    2 |
|  3 |   24 |    2 |
|  7 |    2 |    2 |
|  8 |    2 |    2 |
|  9 |    2 |    2 |
| 10 |    2 |    2 |
+----+------+------+

insert into t2 values(15,2,2),(16,2,2),(17,3,3),(18,4,4),(19,4,4);

delete from t1 where c1 = 2;
select * from t1 order by 1,2,3;
+----+------+------+
| id | c1   | c2   |
+----+------+------+
|  5 |   24 |    2 |
|  6 |   24 |    2 |
|  7 |   24 |    2 |
|  8 |    8 |    2 |
|  9 |    8 |    2 |
| 10 |    8 |    2 |
| 11 |    3 |    3 |
| 12 |    3 |    3 |
| 13 |    3 |    3 |
| 14 |    3 |    3 |
| 15 |    3 |    3 |
| 16 |    3 |    3 |
| 17 |    3 |    3 |
| 18 |    3 |    3 |
| 19 |    3 |    3 |
| 21 |    4 |    4 |
| 22 |    4 |    4 |
| 23 |    4 |    4 |
| 24 |    4 |    4 |
| 25 |    5 |    5 |
| 26 |    5 |    5 |
| 27 |    5 |    5 |
| 28 |    5 |    5 |
| 29 |    5 |    5 |
| 30 |    5 |    5 |
+----+------+------+
select * from t2 order by 1,2,3;
+----+------+------+
| id | c1   | c2   |
+----+------+------+
|  1 |   24 |    1 |
|  2 |   24 |    2 |
|  3 |   24 |    2 |
| 17 |    3 |    3 |
| 18 |    4 |    4 |
| 19 |    4 |    4 |
+----+------+------+

delete from t1 where c1 = 2 ORDER BY id DESC LIMIT 1;
select * from t1 order by 1,2,3;
+----+------+------+
| id | c1   | c2   |
+----+------+------+
|  5 |   24 |    2 |
|  6 |   24 |    2 |
|  7 |   24 |    2 |
|  8 |    8 |    2 |
|  9 |    8 |    2 |
| 10 |    8 |    2 |
| 11 |    3 |    3 |
| 12 |    3 |    3 |
| 13 |    3 |    3 |
| 14 |    3 |    3 |
| 15 |    3 |    3 |
| 16 |    3 |    3 |
| 17 |    3 |    3 |
| 18 |    3 |    3 |
| 19 |    3 |    3 |
| 21 |    4 |    4 |
| 22 |    4 |    4 |
| 23 |    4 |    4 |
| 24 |    4 |    4 |
| 25 |    5 |    5 |
| 26 |    5 |    5 |
| 27 |    5 |    5 |
| 28 |    5 |    5 |
| 29 |    5 |    5 |
| 30 |    5 |    5 |
+----+------+------+
select * from t2 order by 1,2,3;
+----+------+------+
| id | c1   | c2   |
+----+------+------+
|  1 |   24 |    1 |
|  2 |   24 |    2 |
|  3 |   24 |    2 |
| 17 |    3 |    3 |
| 18 |    4 |    4 |
| 19 |    4 |    4 |
+----+------+------+

## 5.2、多表删除父表行数据
delete from t1;
delete from t2;
insert into t1 select * from t1_bk;
insert into t2 select * from t2_bk;

DELETE t1, t2 FROM t1, t2 WHERE t1.c1 = t2.c1 AND (t1.id = 5 or t2.id = 4);
select * from t1 order by 1,2,3;
+----+------+------+
| id | c1   | c2   |
+----+------+------+
|  1 |    1 |    1 |
|  2 |    1 |    1 |
|  3 |    1 |    1 |
|  4 |    1 |    1 |
|  6 |    2 |    2 |
|  7 |    2 |    2 |
|  8 |    2 |    2 |
|  9 |    2 |    2 |
| 10 |    2 |    2 |
| 21 |    4 |    4 |
| 22 |    4 |    4 |
| 23 |    4 |    4 |
| 24 |    4 |    4 |
| 25 |    5 |    5 |
| 26 |    5 |    5 |
| 27 |    5 |    5 |
| 28 |    5 |    5 |
| 29 |    5 |    5 |
| 30 |    5 |    5 |
+----+------+------+
select * from t2 order by 1,2,3;
+----+------+------+
| id | c1   | c2   |
+----+------+------+
|  1 |    1 |    1 |
+----+------+------+

delete from t1;
delete from t2;
insert into t1 select * from t1_bk;
insert into t2 select * from t2_bk;

DELETE t1, t1 FROM t1, t1 WHERE t1.c1 = t1.c1 AND (t1.id = 1 or t1.id = 10);
ERROR 42000: Not unique table/alias: 't1'
DELETE t1, t2 FROM t1, t1 as t2 WHERE t1.c1 = t2.c1 AND (t1.id = 1 or t2.id = 10);
ERROR 0A000: multiple aliases to same table not supported

DELETE FROM t1, t1 USING t1, t1 WHERE t1.c1 = t1.c1 AND (t1.id = 1 or t1.id = 10);
ERROR 42000: Not unique table/alias: 't1'
DELETE FROM t1, t2 USING t1, t1 t2 WHERE t1.c1 = t2.c1 AND (t1.id = 1 or t2.id = 10);
ERROR 0A000: multiple aliases to same table not supported
DELETE FROM t1, t2 USING t1, (select * from t1) t2 WHERE t1.c1 = t2.c1 AND (t1.id = 1 or t2.id = 10);
ERROR 0A000: multiple aliases to same table not supported

select * from t1 order by 1,2,3;
+----+------+------+
| id | c1   | c2   |
+----+------+------+
|  1 |    1 |    1 |
|  2 |    1 |    1 |
|  3 |    1 |    1 |
|  4 |    1 |    1 |
|  5 |    2 |    2 |
|  6 |    2 |    2 |
|  7 |    2 |    2 |
|  8 |    2 |    2 |
|  9 |    2 |    2 |
| 10 |    2 |    2 |
| 11 |    3 |    3 |
| 12 |    3 |    3 |
| 13 |    3 |    3 |
| 14 |    3 |    3 |
| 15 |    3 |    3 |
| 16 |    3 |    3 |
| 17 |    3 |    3 |
| 18 |    3 |    3 |
| 19 |    3 |    3 |
| 20 |    3 |    3 |
| 21 |    4 |    4 |
| 22 |    4 |    4 |
| 23 |    4 |    4 |
| 24 |    4 |    4 |
| 25 |    5 |    5 |
| 26 |    5 |    5 |
| 27 |    5 |    5 |
| 28 |    5 |    5 |
| 29 |    5 |    5 |
| 30 |    5 |    5 |
+----+------+------+
select * from t2 order by 1,2,3;
+----+------+------+
| id | c1   | c2   |
+----+------+------+
|  1 |    1 |    1 |
|  2 |    2 |    2 |
|  3 |    2 |    2 |
|  4 |    3 |    3 |
|  5 |    3 |    3 |
|  6 |    3 |    3 |
+----+------+------+

## 6、truncate 父表
truncate table t1;
ERROR 42000: Cannot truncate a table referenced in a foreign key constraint (`fk_testuser_db`.`t2`, CONSTRAINT `fk1` FOREIGN KEY (`c1`) REFERENCES `fk_testuser_db`.`t1` (`c1`))

## 7、行锁父表  LOCK IN SHARE MODE 共享锁
## 用户1 session 1
START TRANSACTION;
SELECT * FROM t1 WHERE c1 = 4 and id = 21 LOCK IN SHARE MODE;
+----+------+------+
| id | c1   | c2   |
+----+------+------+
| 21 |    4 |    4 |
+----+------+------+

## 连接用户1 session 2

START TRANSACTION;
insert into t2 values(20,4,4);
ERROR HY000: Lock wait timeout exceeded; try restarting transaction

## 连接用户1
COMMIT;

## 连接用户1 session 2

insert into t2 values(20,4,4);
select * from t1 order by 1,2,3;
+----+------+------+
| id | c1   | c2   |
+----+------+------+
|  1 |    1 |    1 |
|  2 |    1 |    1 |
|  3 |    1 |    1 |
|  4 |    1 |    1 |
|  5 |    2 |    2 |
|  6 |    2 |    2 |
|  7 |    2 |    2 |
|  8 |    2 |    2 |
|  9 |    2 |    2 |
| 10 |    2 |    2 |
| 11 |    3 |    3 |
| 12 |    3 |    3 |
| 13 |    3 |    3 |
| 14 |    3 |    3 |
| 15 |    3 |    3 |
| 16 |    3 |    3 |
| 17 |    3 |    3 |
| 18 |    3 |    3 |
| 19 |    3 |    3 |
| 20 |    3 |    3 |
| 21 |    4 |    4 |
| 22 |    4 |    4 |
| 23 |    4 |    4 |
| 24 |    4 |    4 |
| 25 |    5 |    5 |
| 26 |    5 |    5 |
| 27 |    5 |    5 |
| 28 |    5 |    5 |
| 29 |    5 |    5 |
| 30 |    5 |    5 |
+----+------+------+
select * from t2 order by 1,2,3;
+----+------+------+
| id | c1   | c2   |
+----+------+------+
|  1 |    1 |    1 |
|  2 |    2 |    2 |
|  3 |    2 |    2 |
|  4 |    3 |    3 |
|  5 |    3 |    3 |
|  6 |    3 |    3 |
| 20 |    4 |    4 |
+----+------+------+

COMMIT;

## 8、子表插入数据
## 用户1 session 1

delete from t1;
delete from t2;
insert into t1 select * from t1_bk;
insert into t2 select * from t2_bk;

insert into t2 values(21,4,4),(22,4,4),(23,4,4),(24,4,4),(25,4,4);
insert into t2 values (1,5,1) on duplicate key update c1 = values(c1);
insert into t2 select * from t1 where id > 25 for update;
insert overwrite t2 select * from t1 where id < 5 for update;
ERROR 0A000: PDML is disabled, insert overwrite is not supported

select * from t1 order by 1,2,3;
+----+------+------+
| id | c1   | c2   |
+----+------+------+
|  1 |    1 |    1 |
|  2 |    1 |    1 |
|  3 |    1 |    1 |
|  4 |    1 |    1 |
|  5 |    2 |    2 |
|  6 |    2 |    2 |
|  7 |    2 |    2 |
|  8 |    2 |    2 |
|  9 |    2 |    2 |
| 10 |    2 |    2 |
| 11 |    3 |    3 |
| 12 |    3 |    3 |
| 13 |    3 |    3 |
| 14 |    3 |    3 |
| 15 |    3 |    3 |
| 16 |    3 |    3 |
| 17 |    3 |    3 |
| 18 |    3 |    3 |
| 19 |    3 |    3 |
| 20 |    3 |    3 |
| 21 |    4 |    4 |
| 22 |    4 |    4 |
| 23 |    4 |    4 |
| 24 |    4 |    4 |
| 25 |    5 |    5 |
| 26 |    5 |    5 |
| 27 |    5 |    5 |
| 28 |    5 |    5 |
| 29 |    5 |    5 |
| 30 |    5 |    5 |
+----+------+------+
select * from t2 order by 1,2,3;
+----+------+------+
| id | c1   | c2   |
+----+------+------+
|  1 |    5 |    1 |
|  2 |    2 |    2 |
|  3 |    2 |    2 |
|  4 |    3 |    3 |
|  5 |    3 |    3 |
|  6 |    3 |    3 |
| 21 |    4 |    4 |
| 22 |    4 |    4 |
| 23 |    4 |    4 |
| 24 |    4 |    4 |
| 25 |    4 |    4 |
| 26 |    5 |    5 |
| 27 |    5 |    5 |
| 28 |    5 |    5 |
| 29 |    5 |    5 |
| 30 |    5 |    5 |
+----+------+------+

## 9、父表插入数据
delete from t1;
delete from t2;
insert into t1 select * from t1_bk;
insert into t2 select * from t2_bk;

insert into t1 values(32,6,6),(33,5,5),(34,4,4),(35,3,3);
insert into t1 values (5,10,2) on duplicate key update c1 = values(c1);
insert into t1 select id*100,c1,c2 from t2 where id < 5 for update;
insert overwrite t1 select * from t2 where id < 5 for update;
ERROR 0A000: PDML is disabled, insert overwrite is not supported

select * from t1 order by 1,2,3;
+-----+------+------+
| id  | c1   | c2   |
+-----+------+------+
|   1 |    1 |    1 |
|   2 |    1 |    1 |
|   3 |    1 |    1 |
|   4 |    1 |    1 |
|   5 |   10 |    2 |
|   6 |    2 |    2 |
|   7 |    2 |    2 |
|   8 |    2 |    2 |
|   9 |    2 |    2 |
|  10 |    2 |    2 |
|  11 |    3 |    3 |
|  12 |    3 |    3 |
|  13 |    3 |    3 |
|  14 |    3 |    3 |
|  15 |    3 |    3 |
|  16 |    3 |    3 |
|  17 |    3 |    3 |
|  18 |    3 |    3 |
|  19 |    3 |    3 |
|  20 |    3 |    3 |
|  21 |    4 |    4 |
|  22 |    4 |    4 |
|  23 |    4 |    4 |
|  24 |    4 |    4 |
|  25 |    5 |    5 |
|  26 |    5 |    5 |
|  27 |    5 |    5 |
|  28 |    5 |    5 |
|  29 |    5 |    5 |
|  30 |    5 |    5 |
|  32 |    6 |    6 |
|  33 |    5 |    5 |
|  34 |    4 |    4 |
|  35 |    3 |    3 |
| 100 |    1 |    1 |
| 200 |   10 |    2 |
| 300 |   10 |    2 |
| 400 |    3 |    3 |
+-----+------+------+
select * from t2 order by 1,2,3;
+----+------+------+
| id | c1   | c2   |
+----+------+------+
|  1 |    1 |    1 |
|  2 |   10 |    2 |
|  3 |   10 |    2 |
|  4 |    3 |    3 |
|  5 |    3 |    3 |
|  6 |    3 |    3 |
+----+------+------+

## 10、修改多个表
delete from t1;
delete from t2;
insert into t1 select * from t1_bk;
insert into t2 select * from t2_bk;

UPDATE t1,t2 SET t1.c1 = t1.c1 * 10,t2.c2 = t1.c2*10 WHERE t1.c2 = t2.c2 and t1.c2 = 3;
ERROR 23000: Cannot delete or update a parent row: a foreign key constraint fails

UPDATE t1,t2 SET t1.c1 = 200,t2.c1 = 1 WHERE t1.c2 = t2.c2 and t1.c2 = 2;
select * from t1 order by 1,2,3;
+----+------+------+
| id | c1   | c2   |
+----+------+------+
|  1 |    1 |    1 |
|  2 |    1 |    1 |
|  3 |    1 |    1 |
|  4 |    1 |    1 |
|  5 |  200 |    2 |
|  6 |  200 |    2 |
|  7 |  200 |    2 |
|  8 |  200 |    2 |
|  9 |  200 |    2 |
| 10 |  200 |    2 |
| 11 |    3 |    3 |
| 12 |    3 |    3 |
| 13 |    3 |    3 |
| 14 |    3 |    3 |
| 15 |    3 |    3 |
| 16 |    3 |    3 |
| 17 |    3 |    3 |
| 18 |    3 |    3 |
| 19 |    3 |    3 |
| 20 |    3 |    3 |
| 21 |    4 |    4 |
| 22 |    4 |    4 |
| 23 |    4 |    4 |
| 24 |    4 |    4 |
| 25 |    5 |    5 |
| 26 |    5 |    5 |
| 27 |    5 |    5 |
| 28 |    5 |    5 |
| 29 |    5 |    5 |
| 30 |    5 |    5 |
+----+------+------+
select * from t2 order by 1,2,3;
+----+------+------+
| id | c1   | c2   |
+----+------+------+
|  1 |    1 |    1 |
|  2 |    1 |    2 |
|  3 |    1 |    2 |
|  4 |    3 |    3 |
|  5 |    3 |    3 |
|  6 |    3 |    3 |
+----+------+------+

UPDATE t1,t1 as t2 SET t1.c1 = 300,t1.c2 = 300 WHERE t1.c1 = t2.c1 and t1.c2 = 3;
select * from t1 order by 1,2,3;
+----+------+------+
| id | c1   | c2   |
+----+------+------+
|  1 |    1 |    1 |
|  2 |    1 |    1 |
|  3 |    1 |    1 |
|  4 |    1 |    1 |
|  5 |  200 |    2 |
|  6 |  200 |    2 |
|  7 |  200 |    2 |
|  8 |  200 |    2 |
|  9 |  200 |    2 |
| 10 |  200 |    2 |
| 11 |  300 |  300 |
| 12 |  300 |  300 |
| 13 |  300 |  300 |
| 14 |  300 |  300 |
| 15 |  300 |  300 |
| 16 |  300 |  300 |
| 17 |  300 |  300 |
| 18 |  300 |  300 |
| 19 |  300 |  300 |
| 20 |  300 |  300 |
| 21 |    4 |    4 |
| 22 |    4 |    4 |
| 23 |    4 |    4 |
| 24 |    4 |    4 |
| 25 |    5 |    5 |
| 26 |    5 |    5 |
| 27 |    5 |    5 |
| 28 |    5 |    5 |
| 29 |    5 |    5 |
| 30 |    5 |    5 |
+----+------+------+
select * from t2 order by 1,2,3;
+----+------+------+
| id | c1   | c2   |
+----+------+------+
|  1 |    1 |    1 |
|  2 |    1 |    2 |
|  3 |    1 |    2 |
|  4 |  300 |    3 |
|  5 |  300 |    3 |
|  6 |  300 |    3 |
+----+------+------+

UPDATE t1,t1 as t2 SET t1.c1 = 200,t1.c1 = 201 WHERE t1.c1 = t2.c1 and t1.c2 = 2;
select * from t1 order by 1,2,3;
+----+------+------+
| id | c1   | c2   |
+----+------+------+
|  1 |    1 |    1 |
|  2 |    1 |    1 |
|  3 |    1 |    1 |
|  4 |    1 |    1 |
|  5 |  201 |    2 |
|  6 |  201 |    2 |
|  7 |  201 |    2 |
|  8 |  201 |    2 |
|  9 |  201 |    2 |
| 10 |  201 |    2 |
| 11 |  300 |  300 |
| 12 |  300 |  300 |
| 13 |  300 |  300 |
| 14 |  300 |  300 |
| 15 |  300 |  300 |
| 16 |  300 |  300 |
| 17 |  300 |  300 |
| 18 |  300 |  300 |
| 19 |  300 |  300 |
| 20 |  300 |  300 |
| 21 |    4 |    4 |
| 22 |    4 |    4 |
| 23 |    4 |    4 |
| 24 |    4 |    4 |
| 25 |    5 |    5 |
| 26 |    5 |    5 |
| 27 |    5 |    5 |
| 28 |    5 |    5 |
| 29 |    5 |    5 |
| 30 |    5 |    5 |
+----+------+------+
select * from t2 order by 1,2,3;
+----+------+------+
| id | c1   | c2   |
+----+------+------+
|  1 |    1 |    1 |
|  2 |    1 |    2 |
|  3 |    1 |    2 |
|  4 |  300 |    3 |
|  5 |  300 |    3 |
|  6 |  300 |    3 |
+----+------+------+

## 11、UPDATE IGNORE 更新父表
delete from t1;
delete from t2;
insert into t1 select * from t1_bk;
insert into t2 select * from t2_bk;
select * from t1 order by 1,2,3;
+----+------+------+
| id | c1   | c2   |
+----+------+------+
|  1 |    1 |    1 |
|  2 |    1 |    1 |
|  3 |    1 |    1 |
|  4 |    1 |    1 |
|  5 |    2 |    2 |
|  6 |    2 |    2 |
|  7 |    2 |    2 |
|  8 |    2 |    2 |
|  9 |    2 |    2 |
| 10 |    2 |    2 |
| 11 |    3 |    3 |
| 12 |    3 |    3 |
| 13 |    3 |    3 |
| 14 |    3 |    3 |
| 15 |    3 |    3 |
| 16 |    3 |    3 |
| 17 |    3 |    3 |
| 18 |    3 |    3 |
| 19 |    3 |    3 |
| 20 |    3 |    3 |
| 21 |    4 |    4 |
| 22 |    4 |    4 |
| 23 |    4 |    4 |
| 24 |    4 |    4 |
| 25 |    5 |    5 |
| 26 |    5 |    5 |
| 27 |    5 |    5 |
| 28 |    5 |    5 |
| 29 |    5 |    5 |
| 30 |    5 |    5 |
+----+------+------+
select * from t2 order by 1,2,3;
+----+------+------+
| id | c1   | c2   |
+----+------+------+
|  1 |    1 |    1 |
|  2 |    2 |    2 |
|  3 |    2 |    2 |
|  4 |    3 |    3 |
|  5 |    3 |    3 |
|  6 |    3 |    3 |
+----+------+------+

UPDATE IGNORE t1 SET id = 2,c1 = 100 WHERE id = 1;
ERROR 23000: Cannot add or update a child row: a foreign key constraint fails
select * from t1 where c2 = 1 order by 1,2,3;
+----+------+------+
| id | c1   | c2   |
+----+------+------+
|  1 |    1 |    1 |
|  2 |    1 |    1 |
|  3 |    1 |    1 |
|  4 |    1 |    1 |
+----+------+------+
select * from t2 where c2 = 1 order by 1,2,3;
+----+------+------+
| id | c1   | c2   |
+----+------+------+
|  1 |    1 |    1 |
+----+------+------+

UPDATE IGNORE t1 SET id = 31,c1 = 20 WHERE id = 5;
select * from t1 where c2 = 2 order by 1,2,3;
+----+------+------+
| id | c1   | c2   |
+----+------+------+
|  6 |    2 |    2 |
|  7 |    2 |    2 |
|  8 |    2 |    2 |
|  9 |    2 |    2 |
| 10 |    2 |    2 |
| 31 |   20 |    2 |
+----+------+------+
select * from t2 where c2 = 2 order by 1,2,3;
+----+------+------+
| id | c1   | c2   |
+----+------+------+
|  2 |   20 |    2 |
|  3 |   20 |    2 |
+----+------+------+

## 12、REPLACE 父表
delete from t1;
delete from t2;
insert into t1 select * from t1_bk;
insert into t2 select * from t2_bk;

REPLACE INTO t1 VALUES (1,10,10),(2,11,11),(5,20,20),(31,6,6);
select * from t1 order by 1,2,3;
+----+------+------+
| id | c1   | c2   |
+----+------+------+
|  1 |   10 |   10 |
|  2 |   11 |   11 |
|  3 |    1 |    1 |
|  4 |    1 |    1 |
|  5 |   20 |   20 |
|  6 |    2 |    2 |
|  7 |    2 |    2 |
|  8 |    2 |    2 |
|  9 |    2 |    2 |
| 10 |    2 |    2 |
| 11 |    3 |    3 |
| 12 |    3 |    3 |
| 13 |    3 |    3 |
| 14 |    3 |    3 |
| 15 |    3 |    3 |
| 16 |    3 |    3 |
| 17 |    3 |    3 |
| 18 |    3 |    3 |
| 19 |    3 |    3 |
| 20 |    3 |    3 |
| 21 |    4 |    4 |
| 22 |    4 |    4 |
| 23 |    4 |    4 |
| 24 |    4 |    4 |
| 25 |    5 |    5 |
| 26 |    5 |    5 |
| 27 |    5 |    5 |
| 28 |    5 |    5 |
| 29 |    5 |    5 |
| 30 |    5 |    5 |
| 31 |    6 |    6 |
+----+------+------+
select * from t2 order by 1,2,3;
+----+------+------+
| id | c1   | c2   |
+----+------+------+
|  4 |    3 |    3 |
|  5 |    3 |    3 |
|  6 |    3 |    3 |
+----+------+------+

REPLACE INTO t1 VALUES (11,30,30);
select * from t1 order by 1,2,3;
+----+------+------+
| id | c1   | c2   |
+----+------+------+
|  1 |   10 |   10 |
|  2 |   11 |   11 |
|  3 |    1 |    1 |
|  4 |    1 |    1 |
|  5 |   20 |   20 |
|  6 |    2 |    2 |
|  7 |    2 |    2 |
|  8 |    2 |    2 |
|  9 |    2 |    2 |
| 10 |    2 |    2 |
| 11 |   30 |   30 |
| 12 |    3 |    3 |
| 13 |    3 |    3 |
| 14 |    3 |    3 |
| 15 |    3 |    3 |
| 16 |    3 |    3 |
| 17 |    3 |    3 |
| 18 |    3 |    3 |
| 19 |    3 |    3 |
| 20 |    3 |    3 |
| 21 |    4 |    4 |
| 22 |    4 |    4 |
| 23 |    4 |    4 |
| 24 |    4 |    4 |
| 25 |    5 |    5 |
| 26 |    5 |    5 |
| 27 |    5 |    5 |
| 28 |    5 |    5 |
| 29 |    5 |    5 |
| 30 |    5 |    5 |
| 31 |    6 |    6 |
+----+------+------+
select * from t2 order by 1,2,3;
+----+------+------+
| id | c1   | c2   |
+----+------+------+
+----+------+------+

## 13、重命名表
delete from t1;
delete from t2;
insert into t1 select * from t1_bk;
insert into t2 select * from t2_bk;
select * from t1 order by 1,2,3;
+----+------+------+
| id | c1   | c2   |
+----+------+------+
|  1 |    1 |    1 |
|  2 |    1 |    1 |
|  3 |    1 |    1 |
|  4 |    1 |    1 |
|  5 |    2 |    2 |
|  6 |    2 |    2 |
|  7 |    2 |    2 |
|  8 |    2 |    2 |
|  9 |    2 |    2 |
| 10 |    2 |    2 |
| 11 |    3 |    3 |
| 12 |    3 |    3 |
| 13 |    3 |    3 |
| 14 |    3 |    3 |
| 15 |    3 |    3 |
| 16 |    3 |    3 |
| 17 |    3 |    3 |
| 18 |    3 |    3 |
| 19 |    3 |    3 |
| 20 |    3 |    3 |
| 21 |    4 |    4 |
| 22 |    4 |    4 |
| 23 |    4 |    4 |
| 24 |    4 |    4 |
| 25 |    5 |    5 |
| 26 |    5 |    5 |
| 27 |    5 |    5 |
| 28 |    5 |    5 |
| 29 |    5 |    5 |
| 30 |    5 |    5 |
+----+------+------+
select * from t2 order by 1,2,3;
+----+------+------+
| id | c1   | c2   |
+----+------+------+
|  1 |    1 |    1 |
|  2 |    2 |    2 |
|  3 |    2 |    2 |
|  4 |    3 |    3 |
|  5 |    3 |    3 |
|  6 |    3 |    3 |
+----+------+------+

RENAME TABLE t1 TO t11;
RENAME TABLE t11 TO t1;
select * from t2 order by 1,2,3;
+----+------+------+
| id | c1   | c2   |
+----+------+------+
|  1 |    1 |    1 |
|  2 |    2 |    2 |
|  3 |    2 |    2 |
|  4 |    3 |    3 |
|  5 |    3 |    3 |
|  6 |    3 |    3 |
+----+------+------+

RENAME TABLE t2 TO t22;
RENAME TABLE t22 TO t2;
select * from t1 order by 1,2,3;
+----+------+------+
| id | c1   | c2   |
+----+------+------+
|  1 |    1 |    1 |
|  2 |    1 |    1 |
|  3 |    1 |    1 |
|  4 |    1 |    1 |
|  5 |    2 |    2 |
|  6 |    2 |    2 |
|  7 |    2 |    2 |
|  8 |    2 |    2 |
|  9 |    2 |    2 |
| 10 |    2 |    2 |
| 11 |    3 |    3 |
| 12 |    3 |    3 |
| 13 |    3 |    3 |
| 14 |    3 |    3 |
| 15 |    3 |    3 |
| 16 |    3 |    3 |
| 17 |    3 |    3 |
| 18 |    3 |    3 |
| 19 |    3 |    3 |
| 20 |    3 |    3 |
| 21 |    4 |    4 |
| 22 |    4 |    4 |
| 23 |    4 |    4 |
| 24 |    4 |    4 |
| 25 |    5 |    5 |
| 26 |    5 |    5 |
| 27 |    5 |    5 |
| 28 |    5 |    5 |
| 29 |    5 |    5 |
| 30 |    5 |    5 |
+----+------+------+
select * from t2 order by 1,2,3;
+----+------+------+
| id | c1   | c2   |
+----+------+------+
|  1 |    1 |    1 |
|  2 |    2 |    2 |
|  3 |    2 |    2 |
|  4 |    3 |    3 |
|  5 |    3 |    3 |
|  6 |    3 |    3 |
+----+------+------+

drop table t2;
drop table t1;

## 14、子表对应多个父表 t3->t1,t2
create table t1(id int primary key,c1 int,c2 int,index index1(c1));
create table t2(id int primary key,c1 int,c2 int,index index1(c2));

create table t3(id int primary key,c1 int,c2 int);
alter table t3 add CONSTRAINT fk1 foreign key(c1) references t1(c1) on update cascade on delete cascade;
alter table t3 add CONSTRAINT fk2 foreign key(c2) references t2(c2) on update cascade on delete cascade;

insert into t1 values(1,1,1),(2,1,1),(3,1,1),(4,1,1);
insert into t1 values(5,2,2),(6,2,2),(7,2,2),(8,2,2),(9,2,2),(10,2,2);
insert into t1 values(11,3,3),(12,3,3),(13,3,3),(14,3,3),(15,3,3),(16,3,3),(17,3,3),(18,3,3),(19,3,3),(20,3,3);
insert into t1 values(21,4,4),(22,4,4),(23,4,4),(24,4,4);
insert into t1 values(25,5,5),(26,5,5),(27,5,5),(28,5,5),(29,5,5),(30,5,5);

insert into t2 values(1,11,11),(2,11,11),(3,11,11),(4,11,11);
insert into t2 values(5,12,12),(6,12,12),(7,12,12),(8,12,12),(9,12,12),(10,12,12);
insert into t2 values(11,13,13),(12,13,13),(13,13,13),(14,13,13),(15,13,13),(16,13,13),(17,13,13),(18,13,13),(19,13,13),(20,13,13);
insert into t2 values(21,14,14),(22,14,14),(23,14,14),(24,14,14);
insert into t2 values(25,15,15),(26,15,15),(27,15,15),(28,15,15),(29,15,15),(30,15,15);

insert into t3 values(1,1,11),(2,1,11);
insert into t3 values(3,2,12),(4,2,12),(5,2,12);
insert into t3 values(6,3,13),(7,3,13),(8,3,13),(9,3,13);

select * from t1 order by 1,2,3;
+----+------+------+
| id | c1   | c2   |
+----+------+------+
|  1 |    1 |    1 |
|  2 |    1 |    1 |
|  3 |    1 |    1 |
|  4 |    1 |    1 |
|  5 |    2 |    2 |
|  6 |    2 |    2 |
|  7 |    2 |    2 |
|  8 |    2 |    2 |
|  9 |    2 |    2 |
| 10 |    2 |    2 |
| 11 |    3 |    3 |
| 12 |    3 |    3 |
| 13 |    3 |    3 |
| 14 |    3 |    3 |
| 15 |    3 |    3 |
| 16 |    3 |    3 |
| 17 |    3 |    3 |
| 18 |    3 |    3 |
| 19 |    3 |    3 |
| 20 |    3 |    3 |
| 21 |    4 |    4 |
| 22 |    4 |    4 |
| 23 |    4 |    4 |
| 24 |    4 |    4 |
| 25 |    5 |    5 |
| 26 |    5 |    5 |
| 27 |    5 |    5 |
| 28 |    5 |    5 |
| 29 |    5 |    5 |
| 30 |    5 |    5 |
+----+------+------+
select * from t2 order by 1,2,3;
+----+------+------+
| id | c1   | c2   |
+----+------+------+
|  1 |   11 |   11 |
|  2 |   11 |   11 |
|  3 |   11 |   11 |
|  4 |   11 |   11 |
|  5 |   12 |   12 |
|  6 |   12 |   12 |
|  7 |   12 |   12 |
|  8 |   12 |   12 |
|  9 |   12 |   12 |
| 10 |   12 |   12 |
| 11 |   13 |   13 |
| 12 |   13 |   13 |
| 13 |   13 |   13 |
| 14 |   13 |   13 |
| 15 |   13 |   13 |
| 16 |   13 |   13 |
| 17 |   13 |   13 |
| 18 |   13 |   13 |
| 19 |   13 |   13 |
| 20 |   13 |   13 |
| 21 |   14 |   14 |
| 22 |   14 |   14 |
| 23 |   14 |   14 |
| 24 |   14 |   14 |
| 25 |   15 |   15 |
| 26 |   15 |   15 |
| 27 |   15 |   15 |
| 28 |   15 |   15 |
| 29 |   15 |   15 |
| 30 |   15 |   15 |
+----+------+------+
select * from t3 order by 1,2,3;
+----+------+------+
| id | c1   | c2   |
+----+------+------+
|  1 |    1 |   11 |
|  2 |    1 |   11 |
|  3 |    2 |   12 |
|  4 |    2 |   12 |
|  5 |    2 |   12 |
|  6 |    3 |   13 |
|  7 |    3 |   13 |
|  8 |    3 |   13 |
|  9 |    3 |   13 |
+----+------+------+

UPDATE t1 SET c1 = c1 * 100 WHERE id = 1;
select * from t1 where c2 = 1 order by 1,2,3;
+----+------+------+
| id | c1   | c2   |
+----+------+------+
|  1 |  100 |    1 |
|  2 |    1 |    1 |
|  3 |    1 |    1 |
|  4 |    1 |    1 |
+----+------+------+
select * from t3 order by 1,2,3;
+----+------+------+
| id | c1   | c2   |
+----+------+------+
|  1 |  100 |   11 |
|  2 |  100 |   11 |
|  3 |    2 |   12 |
|  4 |    2 |   12 |
|  5 |    2 |   12 |
|  6 |    3 |   13 |
|  7 |    3 |   13 |
|  8 |    3 |   13 |
|  9 |    3 |   13 |
+----+------+------+

UPDATE t1 SET c1 = c1 * 100 WHERE c2 = 2;
select * from t1 where c2 = 2 order by 1,2,3;
+----+------+------+
| id | c1   | c2   |
+----+------+------+
|  5 |  200 |    2 |
|  6 |  200 |    2 |
|  7 |  200 |    2 |
|  8 |  200 |    2 |
|  9 |  200 |    2 |
| 10 |  200 |    2 |
+----+------+------+
select * from t3 order by 1,2,3;
+----+------+------+
| id | c1   | c2   |
+----+------+------+
|  1 |  100 |   11 |
|  2 |  100 |   11 |
|  3 |  200 |   12 |
|  4 |  200 |   12 |
|  5 |  200 |   12 |
|  6 |    3 |   13 |
|  7 |    3 |   13 |
|  8 |    3 |   13 |
|  9 |    3 |   13 |
+----+------+------+

UPDATE t2 SET c2 = c2 * 100 WHERE id = 1;
select * from t2 where id <= 4 order by 1,2,3;
+----+------+------+
| id | c1   | c2   |
+----+------+------+
|  1 |   11 | 1100 |
|  2 |   11 |   11 |
|  3 |   11 |   11 |
|  4 |   11 |   11 |
+----+------+------+
select * from t3 order by 1,2,3;
+----+------+------+
| id | c1   | c2   |
+----+------+------+
|  1 |  100 | 1100 |
|  2 |  100 | 1100 |
|  3 |  200 |   12 |
|  4 |  200 |   12 |
|  5 |  200 |   12 |
|  6 |    3 |   13 |
|  7 |    3 |   13 |
|  8 |    3 |   13 |
|  9 |    3 |   13 |
+----+------+------+

UPDATE t2 SET c2 = c2 * 100 WHERE id between 5 and 7;
select * from t2 where id between 5 and 10 order by 1,2,3;
+----+------+------+
| id | c1   | c2   |
+----+------+------+
|  5 |   12 | 1200 |
|  6 |   12 | 1200 |
|  7 |   12 | 1200 |
|  8 |   12 |   12 |
|  9 |   12 |   12 |
| 10 |   12 |   12 |
+----+------+------+
select * from t3 order by 1,2,3;
+----+------+------+
| id | c1   | c2   |
+----+------+------+
|  1 |  100 | 1100 |
|  2 |  100 | 1100 |
|  3 |  200 | 1200 |
|  4 |  200 | 1200 |
|  5 |  200 | 1200 |
|  6 |    3 |   13 |
|  7 |    3 |   13 |
|  8 |    3 |   13 |
|  9 |    3 |   13 |
+----+------+------+

UPDATE t1,t2 SET t1.c1 = t1.c1 * 100,t2.c2 = t2.c2 * 100 WHERE t1.id = t2.id and t1.id = 12;
select * from t1 where c2 = 3 order by 1,2,3;
+----+------+------+
| id | c1   | c2   |
+----+------+------+
| 11 |    3 |    3 |
| 12 |  300 |    3 |
| 13 |    3 |    3 |
| 14 |    3 |    3 |
| 15 |    3 |    3 |
| 16 |    3 |    3 |
| 17 |    3 |    3 |
| 18 |    3 |    3 |
| 19 |    3 |    3 |
| 20 |    3 |    3 |
+----+------+------+
select * from t2 where c1 = 13 order by 1,2,3;
+----+------+------+
| id | c1   | c2   |
+----+------+------+
| 11 |   13 |   13 |
| 12 |   13 | 1300 |
| 13 |   13 |   13 |
| 14 |   13 |   13 |
| 15 |   13 |   13 |
| 16 |   13 |   13 |
| 17 |   13 |   13 |
| 18 |   13 |   13 |
| 19 |   13 |   13 |
| 20 |   13 |   13 |
+----+------+------+
select * from t3 order by 1,2,3;
+----+------+------+
| id | c1   | c2   |
+----+------+------+
|  1 |  100 | 1100 |
|  2 |  100 | 1100 |
|  3 |  200 | 1200 |
|  4 |  200 | 1200 |
|  5 |  200 | 1200 |
|  6 |  300 | 1300 |
|  7 |  300 | 1300 |
|  8 |  300 | 1300 |
|  9 |  300 | 1300 |
+----+------+------+

UPDATE t1,t2 SET t1.c1 = t1.c1 * 100,t2.c2 = t2.c2 * 100 WHERE t1.id = t2.id and t1.id <= 4;
select * from t1 where c2 = 1 order by 1,2,3;
+----+-------+------+
| id | c1    | c2   |
+----+-------+------+
|  1 | 10000 |    1 |
|  2 |   100 |    1 |
|  3 |   100 |    1 |
|  4 |   100 |    1 |
+----+-------+------+
select * from t2 where c1 = 11 order by 1,2,3;
+----+------+--------+
| id | c1   | c2     |
+----+------+--------+
|  1 |   11 | 110000 |
|  2 |   11 |   1100 |
|  3 |   11 |   1100 |
|  4 |   11 |   1100 |
+----+------+--------+
select * from t3 order by 1,2,3;
+----+-------+--------+
| id | c1    | c2     |
+----+-------+--------+
|  1 | 10000 | 110000 |
|  2 | 10000 | 110000 |
|  3 |   200 |   1200 |
|  4 |   200 |   1200 |
|  5 |   200 |   1200 |
|  6 |   300 |   1300 |
|  7 |   300 |   1300 |
|  8 |   300 |   1300 |
|  9 |   300 |   1300 |
+----+-------+--------+

insert into t3 values(10,4,14),(11,5,15);
insert into t3 values(12,444,14),(13,5,15);
ERROR 23000: Cannot add or update a child row: a foreign key constraint fails
insert into t3 values(14,4,14),(15,55555,15);
ERROR 23000: Cannot add or update a child row: a foreign key constraint fails
select * from t3 order by 1,2,3;
+----+-------+--------+
| id | c1    | c2     |
+----+-------+--------+
|  1 | 10000 | 110000 |
|  2 | 10000 | 110000 |
|  3 |   200 |   1200 |
|  4 |   200 |   1200 |
|  5 |   200 |   1200 |
|  6 |   300 |   1300 |
|  7 |   300 |   1300 |
|  8 |   300 |   1300 |
|  9 |   300 |   1300 |
| 10 |     4 |     14 |
| 11 |     5 |     15 |
+----+-------+--------+

insert into t3 select t1.id*100,t1.c1,t2.c2 from t1,t2 where t1.id = t2.id and t1.id >= 21 for update;
select * from t3 order by 1,2,3;
+------+-------+--------+
| id   | c1    | c2     |
+------+-------+--------+
|    1 | 10000 | 110000 |
|    2 | 10000 | 110000 |
|    3 |   200 |   1200 |
|    4 |   200 |   1200 |
|    5 |   200 |   1200 |
|    6 |   300 |   1300 |
|    7 |   300 |   1300 |
|    8 |   300 |   1300 |
|    9 |   300 |   1300 |
|   10 |     4 |     14 |
|   11 |     5 |     15 |
| 2100 |     4 |     14 |
| 2200 |     4 |     14 |
| 2300 |     4 |     14 |
| 2400 |     4 |     14 |
| 2500 |     5 |     15 |
| 2600 |     5 |     15 |
| 2700 |     5 |     15 |
| 2800 |     5 |     15 |
| 2900 |     5 |     15 |
| 3000 |     5 |     15 |
+------+-------+--------+

delete from t1 where id = 1;
select * from t1 where c2 = 1 order by 1,2,3;
+----+------+------+
| id | c1   | c2   |
+----+------+------+
|  2 |  100 |    1 |
|  3 |  100 |    1 |
|  4 |  100 |    1 |
+----+------+------+
select * from t3 order by 1,2,3;
+------+------+------+
| id   | c1   | c2   |
+------+------+------+
|    3 |  200 | 1200 |
|    4 |  200 | 1200 |
|    5 |  200 | 1200 |
|    6 |  300 | 1300 |
|    7 |  300 | 1300 |
|    8 |  300 | 1300 |
|    9 |  300 | 1300 |
|   10 |    4 |   14 |
|   11 |    5 |   15 |
| 2100 |    4 |   14 |
| 2200 |    4 |   14 |
| 2300 |    4 |   14 |
| 2400 |    4 |   14 |
| 2500 |    5 |   15 |
| 2600 |    5 |   15 |
| 2700 |    5 |   15 |
| 2800 |    5 |   15 |
| 2900 |    5 |   15 |
| 3000 |    5 |   15 |
+------+------+------+

delete from t2 where c1 = 12;
select * from t2 where c1 = 12 order by 1,2,3;
+----+------+------+
| id | c1   | c2   |
+----+------+------+
+----+------+------+
select * from t3 order by 1,2,3;
+------+------+------+
| id   | c1   | c2   |
+------+------+------+
|    6 |  300 | 1300 |
|    7 |  300 | 1300 |
|    8 |  300 | 1300 |
|    9 |  300 | 1300 |
|   10 |    4 |   14 |
|   11 |    5 |   15 |
| 2100 |    4 |   14 |
| 2200 |    4 |   14 |
| 2300 |    4 |   14 |
| 2400 |    4 |   14 |
| 2500 |    5 |   15 |
| 2600 |    5 |   15 |
| 2700 |    5 |   15 |
| 2800 |    5 |   15 |
| 2900 |    5 |   15 |
| 3000 |    5 |   15 |
+------+------+------+

DELETE t1, t2 FROM t1, t2 WHERE t1.id = t2.id AND (t1.id = 12 or t2.c2 = 14);
select * from t1, t2 WHERE t1.id = t2.id order by 1,2,3;
+----+------+------+----+------+------+
| id | c1   | c2   | id | c1   | c2   |
+----+------+------+----+------+------+
|  2 |  100 |    1 |  2 |   11 | 1100 |
|  3 |  100 |    1 |  3 |   11 | 1100 |
|  4 |  100 |    1 |  4 |   11 | 1100 |
| 11 |    3 |    3 | 11 |   13 |   13 |
| 13 |    3 |    3 | 13 |   13 |   13 |
| 14 |    3 |    3 | 14 |   13 |   13 |
| 15 |    3 |    3 | 15 |   13 |   13 |
| 16 |    3 |    3 | 16 |   13 |   13 |
| 17 |    3 |    3 | 17 |   13 |   13 |
| 18 |    3 |    3 | 18 |   13 |   13 |
| 19 |    3 |    3 | 19 |   13 |   13 |
| 20 |    3 |    3 | 20 |   13 |   13 |
| 25 |    5 |    5 | 25 |   15 |   15 |
| 26 |    5 |    5 | 26 |   15 |   15 |
| 27 |    5 |    5 | 27 |   15 |   15 |
| 28 |    5 |    5 | 28 |   15 |   15 |
| 29 |    5 |    5 | 29 |   15 |   15 |
| 30 |    5 |    5 | 30 |   15 |   15 |
+----+------+------+----+------+------+
select * from t3 order by 1,2,3;
+------+------+------+
| id   | c1   | c2   |
+------+------+------+
|   11 |    5 |   15 |
| 2500 |    5 |   15 |
| 2600 |    5 |   15 |
| 2700 |    5 |   15 |
| 2800 |    5 |   15 |
| 2900 |    5 |   15 |
| 3000 |    5 |   15 |
+------+------+------+

insert into t3 select t1.id*10,t1.c1,t2.c2 from t1,t2 where t1.id = t2.id and t1.id < 21 for update;
select * from t3 order by 1,2,3;
+------+------+------+
| id   | c1   | c2   |
+------+------+------+
|   11 |    5 |   15 |
|   20 |  100 | 1100 |
|   30 |  100 | 1100 |
|   40 |  100 | 1100 |
|  110 |    3 |   13 |
|  130 |    3 |   13 |
|  140 |    3 |   13 |
|  150 |    3 |   13 |
|  160 |    3 |   13 |
|  170 |    3 |   13 |
|  180 |    3 |   13 |
|  190 |    3 |   13 |
|  200 |    3 |   13 |
| 2500 |    5 |   15 |
| 2600 |    5 |   15 |
| 2700 |    5 |   15 |
| 2800 |    5 |   15 |
| 2900 |    5 |   15 |
| 3000 |    5 |   15 |
+------+------+------+

DELETE t1 FROM t1 INNER JOIN t2 ON t1.id = t2.id WHERE t1.c2= 3;
select * from t1 INNER JOIN t2 ON t1.id = t2.id order by 1,2,3;
+----+------+------+----+------+------+
| id | c1   | c2   | id | c1   | c2   |
+----+------+------+----+------+------+
|  2 |  100 |    1 |  2 |   11 | 1100 |
|  3 |  100 |    1 |  3 |   11 | 1100 |
|  4 |  100 |    1 |  4 |   11 | 1100 |
| 25 |    5 |    5 | 25 |   15 |   15 |
| 26 |    5 |    5 | 26 |   15 |   15 |
| 27 |    5 |    5 | 27 |   15 |   15 |
| 28 |    5 |    5 | 28 |   15 |   15 |
| 29 |    5 |    5 | 29 |   15 |   15 |
| 30 |    5 |    5 | 30 |   15 |   15 |
+----+------+------+----+------+------+
select * from t3 order by 1,2,3;
+------+------+------+
| id   | c1   | c2   |
+------+------+------+
|   11 |    5 |   15 |
|   20 |  100 | 1100 |
|   30 |  100 | 1100 |
|   40 |  100 | 1100 |
| 2500 |    5 |   15 |
| 2600 |    5 |   15 |
| 2700 |    5 |   15 |
| 2800 |    5 |   15 |
| 2900 |    5 |   15 |
| 3000 |    5 |   15 |
+------+------+------+

drop table t3;
drop table t2;
drop table t1;

## 15、多个表级联引用 t3->t2->t1
create table t1(id int primary key,c1 int,c2 int,index index1(c1));

create table t2(id int primary key,c1 int,c2 int,index index1(c1));
alter table t2 add CONSTRAINT fk1 foreign key(c1) references t1(c1) on update cascade on delete cascade;

create table t3(id int primary key,c1 int,c2 int);
alter table t3 add CONSTRAINT fk2 foreign key(c1) references t2(c1) on update cascade on delete cascade;

insert into t1 values(1,1,1),(2,1,1),(3,1,1),(4,1,1);
insert into t1 values(5,2,2),(6,2,2),(7,2,2),(8,2,2),(9,2,2),(10,2,2);
insert into t1 values(11,3,3),(12,3,3),(13,3,3),(14,3,3),(15,3,3),(16,3,3),(17,3,3),(18,3,3),(19,3,3),(20,3,3);
insert into t1 values(21,4,4),(22,4,4),(23,4,4),(24,4,4);
insert into t1 values(25,5,5),(26,5,5),(27,5,5),(28,5,5),(29,5,5),(30,5,5);

insert into t2 values(1,1,1),(2,1,1),(3,1,1);
insert into t2 values(4,2,2),(5,2,2),(6,2,2),(7,2,2);
insert into t2 values(8,3,3),(9,3,3),(10,3,3),(11,3,3),(12,3,3);
insert into t2 values(13,4,4),(14,4,4),(15,4,4),(16,4,4),(17,4,4),(18,4,4),(19,4,4);
insert into t2 values(20,5,5),(21,5,5),(22,5,5),(23,5,5),(24,5,5),(25,5,5),(26,5,5),(27,5,5),(28,5,5),(29,5,5),(30,5,5);

insert into t3 values(1,1,1),(2,1,1);
insert into t3 values(3,2,2),(4,2,2),(5,2,2);
insert into t3 values(6,3,3),(7,3,3),(8,3,3),(9,3,3);
insert into t3 values(10,4,4),(11,4,4),(12,4,4),(13,4,4);
insert into t3 values(14,5,5),(15,5,5),(16,5,5),(17,5,5),(18,5,5);

select * from t1 order by 1,2,3;
+----+------+------+
| id | c1   | c2   |
+----+------+------+
|  1 |    1 |    1 |
|  2 |    1 |    1 |
|  3 |    1 |    1 |
|  4 |    1 |    1 |
|  5 |    2 |    2 |
|  6 |    2 |    2 |
|  7 |    2 |    2 |
|  8 |    2 |    2 |
|  9 |    2 |    2 |
| 10 |    2 |    2 |
| 11 |    3 |    3 |
| 12 |    3 |    3 |
| 13 |    3 |    3 |
| 14 |    3 |    3 |
| 15 |    3 |    3 |
| 16 |    3 |    3 |
| 17 |    3 |    3 |
| 18 |    3 |    3 |
| 19 |    3 |    3 |
| 20 |    3 |    3 |
| 21 |    4 |    4 |
| 22 |    4 |    4 |
| 23 |    4 |    4 |
| 24 |    4 |    4 |
| 25 |    5 |    5 |
| 26 |    5 |    5 |
| 27 |    5 |    5 |
| 28 |    5 |    5 |
| 29 |    5 |    5 |
| 30 |    5 |    5 |
+----+------+------+
select * from t2 order by 1,2,3;
+----+------+------+
| id | c1   | c2   |
+----+------+------+
|  1 |    1 |    1 |
|  2 |    1 |    1 |
|  3 |    1 |    1 |
|  4 |    2 |    2 |
|  5 |    2 |    2 |
|  6 |    2 |    2 |
|  7 |    2 |    2 |
|  8 |    3 |    3 |
|  9 |    3 |    3 |
| 10 |    3 |    3 |
| 11 |    3 |    3 |
| 12 |    3 |    3 |
| 13 |    4 |    4 |
| 14 |    4 |    4 |
| 15 |    4 |    4 |
| 16 |    4 |    4 |
| 17 |    4 |    4 |
| 18 |    4 |    4 |
| 19 |    4 |    4 |
| 20 |    5 |    5 |
| 21 |    5 |    5 |
| 22 |    5 |    5 |
| 23 |    5 |    5 |
| 24 |    5 |    5 |
| 25 |    5 |    5 |
| 26 |    5 |    5 |
| 27 |    5 |    5 |
| 28 |    5 |    5 |
| 29 |    5 |    5 |
| 30 |    5 |    5 |
+----+------+------+
select * from t3 order by 1,2,3;
+----+------+------+
| id | c1   | c2   |
+----+------+------+
|  1 |    1 |    1 |
|  2 |    1 |    1 |
|  3 |    2 |    2 |
|  4 |    2 |    2 |
|  5 |    2 |    2 |
|  6 |    3 |    3 |
|  7 |    3 |    3 |
|  8 |    3 |    3 |
|  9 |    3 |    3 |
| 10 |    4 |    4 |
| 11 |    4 |    4 |
| 12 |    4 |    4 |
| 13 |    4 |    4 |
| 14 |    5 |    5 |
| 15 |    5 |    5 |
| 16 |    5 |    5 |
| 17 |    5 |    5 |
| 18 |    5 |    5 |
+----+------+------+

UPDATE t1 SET c1 = c1 * 10 WHERE id = 1;
select * from t1 where c2 = 1 order by 1,2,3;
+----+------+------+
| id | c1   | c2   |
+----+------+------+
|  1 |   10 |    1 |
|  2 |    1 |    1 |
|  3 |    1 |    1 |
|  4 |    1 |    1 |
+----+------+------+
select * from t2 where c2 = 1 order by 1,2,3;
+----+------+------+
| id | c1   | c2   |
+----+------+------+
|  1 |   10 |    1 |
|  2 |   10 |    1 |
|  3 |   10 |    1 |
+----+------+------+
select * from t3 where c2 = 1 order by 1,2,3;
+----+------+------+
| id | c1   | c2   |
+----+------+------+
|  1 |   10 |    1 |
|  2 |   10 |    1 |
+----+------+------+

UPDATE t1 SET c1 = c1 * 10 WHERE c2 = 2;
select * from t1 where c2 = 2 order by 1,2,3;
+----+------+------+
| id | c1   | c2   |
+----+------+------+
|  5 |   20 |    2 |
|  6 |   20 |    2 |
|  7 |   20 |    2 |
|  8 |   20 |    2 |
|  9 |   20 |    2 |
| 10 |   20 |    2 |
+----+------+------+
select * from t2 where c2 = 2 order by 1,2,3;
+----+------+------+
| id | c1   | c2   |
+----+------+------+
|  4 |   20 |    2 |
|  5 |   20 |    2 |
|  6 |   20 |    2 |
|  7 |   20 |    2 |
+----+------+------+
select * from t3 where c2 = 2 order by 1,2,3;
+----+------+------+
| id | c1   | c2   |
+----+------+------+
|  3 |   20 |    2 |
|  4 |   20 |    2 |
|  5 |   20 |    2 |
+----+------+------+

UPDATE t2 SET c1 = c2 WHERE id = 2;
select * from t1 where c2 = 1 order by 1,2,3;
+----+------+------+
| id | c1   | c2   |
+----+------+------+
|  1 |   10 |    1 |
|  2 |    1 |    1 |
|  3 |    1 |    1 |
|  4 |    1 |    1 |
+----+------+------+
select * from t2 where c2 = 1 order by 1,2,3;
+----+------+------+
| id | c1   | c2   |
+----+------+------+
|  1 |   10 |    1 |
|  2 |    1 |    1 |
|  3 |   10 |    1 |
+----+------+------+
select * from t3 where c2 = 1 order by 1,2,3;
+----+------+------+
| id | c1   | c2   |
+----+------+------+
|  1 |    1 |    1 |
|  2 |    1 |    1 |
+----+------+------+

UPDATE t2 SET c1 = c2 WHERE c2 = 2;
ERROR 23000: Cannot add or update a child row: a foreign key constraint fails
UPDATE t2 SET c1 = c2 WHERE c2 = 1;
select * from t1 where c2 = 1 order by 1,2,3;
+----+------+------+
| id | c1   | c2   |
+----+------+------+
|  1 |   10 |    1 |
|  2 |    1 |    1 |
|  3 |    1 |    1 |
|  4 |    1 |    1 |
+----+------+------+
select * from t2 where c2 = 1 order by 1,2,3;
+----+------+------+
| id | c1   | c2   |
+----+------+------+
|  1 |    1 |    1 |
|  2 |    1 |    1 |
|  3 |    1 |    1 |
+----+------+------+
select * from t3 where c2 = 1 order by 1,2,3;
+----+------+------+
| id | c1   | c2   |
+----+------+------+
|  1 |    1 |    1 |
|  2 |    1 |    1 |
+----+------+------+

UPDATE t1,t2 SET t1.c1 = 10,t2.c1 = 1 WHERE t1.id = t2.id and t1.id = 2;
ERROR 23000: Cannot delete or update a parent row: a foreign key constraint fails
select * from t1 where c2 = 1 order by 1,2,3;
+----+------+------+
| id | c1   | c2   |
+----+------+------+
|  1 |   10 |    1 |
|  2 |    1 |    1 |
|  3 |    1 |    1 |
|  4 |    1 |    1 |
+----+------+------+
select * from t2 where c2 = 1 order by 1,2,3;
+----+------+------+
| id | c1   | c2   |
+----+------+------+
|  1 |    1 |    1 |
|  2 |    1 |    1 |
|  3 |    1 |    1 |
+----+------+------+
select * from t3 order by 1,2,3;
+----+------+------+
| id | c1   | c2   |
+----+------+------+
|  1 |    1 |    1 |
|  2 |    1 |    1 |
|  3 |   20 |    2 |
|  4 |   20 |    2 |
|  5 |   20 |    2 |
|  6 |    3 |    3 |
|  7 |    3 |    3 |
|  8 |    3 |    3 |
|  9 |    3 |    3 |
| 10 |    4 |    4 |
| 11 |    4 |    4 |
| 12 |    4 |    4 |
| 13 |    4 |    4 |
| 14 |    5 |    5 |
| 15 |    5 |    5 |
| 16 |    5 |    5 |
| 17 |    5 |    5 |
| 18 |    5 |    5 |
+----+------+------+

UPDATE t1,t3 SET t1.c1 = t1.c2,t3.c1 = 1 WHERE t1.c2 = t3.c2 and t1.c2 = 2;
select * from t1 order by 1,2,3;
+----+------+------+
| id | c1   | c2   |
+----+------+------+
|  1 |   10 |    1 |
|  2 |    1 |    1 |
|  3 |    1 |    1 |
|  4 |    1 |    1 |
|  5 |    2 |    2 |
|  6 |    2 |    2 |
|  7 |    2 |    2 |
|  8 |    2 |    2 |
|  9 |    2 |    2 |
| 10 |    2 |    2 |
| 11 |    3 |    3 |
| 12 |    3 |    3 |
| 13 |    3 |    3 |
| 14 |    3 |    3 |
| 15 |    3 |    3 |
| 16 |    3 |    3 |
| 17 |    3 |    3 |
| 18 |    3 |    3 |
| 19 |    3 |    3 |
| 20 |    3 |    3 |
| 21 |    4 |    4 |
| 22 |    4 |    4 |
| 23 |    4 |    4 |
| 24 |    4 |    4 |
| 25 |    5 |    5 |
| 26 |    5 |    5 |
| 27 |    5 |    5 |
| 28 |    5 |    5 |
| 29 |    5 |    5 |
| 30 |    5 |    5 |
+----+------+------+
select * from t2 order by 1,2,3;
+----+------+------+
| id | c1   | c2   |
+----+------+------+
|  1 |    1 |    1 |
|  2 |    1 |    1 |
|  3 |    1 |    1 |
|  4 |    2 |    2 |
|  5 |    2 |    2 |
|  6 |    2 |    2 |
|  7 |    2 |    2 |
|  8 |    3 |    3 |
|  9 |    3 |    3 |
| 10 |    3 |    3 |
| 11 |    3 |    3 |
| 12 |    3 |    3 |
| 13 |    4 |    4 |
| 14 |    4 |    4 |
| 15 |    4 |    4 |
| 16 |    4 |    4 |
| 17 |    4 |    4 |
| 18 |    4 |    4 |
| 19 |    4 |    4 |
| 20 |    5 |    5 |
| 21 |    5 |    5 |
| 22 |    5 |    5 |
| 23 |    5 |    5 |
| 24 |    5 |    5 |
| 25 |    5 |    5 |
| 26 |    5 |    5 |
| 27 |    5 |    5 |
| 28 |    5 |    5 |
| 29 |    5 |    5 |
| 30 |    5 |    5 |
+----+------+------+
select * from t3 order by 1,2,3;
+----+------+------+
| id | c1   | c2   |
+----+------+------+
|  1 |    1 |    1 |
|  2 |    1 |    1 |
|  3 |    1 |    2 |
|  4 |    1 |    2 |
|  5 |    1 |    2 |
|  6 |    3 |    3 |
|  7 |    3 |    3 |
|  8 |    3 |    3 |
|  9 |    3 |    3 |
| 10 |    4 |    4 |
| 11 |    4 |    4 |
| 12 |    4 |    4 |
| 13 |    4 |    4 |
| 14 |    5 |    5 |
| 15 |    5 |    5 |
| 16 |    5 |    5 |
| 17 |    5 |    5 |
| 18 |    5 |    5 |
+----+------+------+

UPDATE t2,t3 SET t2.c1 = 1,t3.c1 = 3 WHERE t2.c2 = t3.c2 and t2.c2 = 3;
ERROR 23000: Cannot delete or update a parent row: a foreign key constraint fails
select * from t1 where c2 = 3 order by 1,2,3;
+----+------+------+
| id | c1   | c2   |
+----+------+------+
| 11 |    3 |    3 |
| 12 |    3 |    3 |
| 13 |    3 |    3 |
| 14 |    3 |    3 |
| 15 |    3 |    3 |
| 16 |    3 |    3 |
| 17 |    3 |    3 |
| 18 |    3 |    3 |
| 19 |    3 |    3 |
| 20 |    3 |    3 |
+----+------+------+
select * from t2 where c2 = 3 order by 1,2,3;
+----+------+------+
| id | c1   | c2   |
+----+------+------+
|  8 |    3 |    3 |
|  9 |    3 |    3 |
| 10 |    3 |    3 |
| 11 |    3 |    3 |
| 12 |    3 |    3 |
+----+------+------+
select * from t3 where c2 = 3 order by 1,2,3;
+----+------+------+
| id | c1   | c2   |
+----+------+------+
|  6 |    3 |    3 |
|  7 |    3 |    3 |
|  8 |    3 |    3 |
|  9 |    3 |    3 |
+----+------+------+

UPDATE t2,t3 SET t2.c1 = 2,t3.c1 = 1 WHERE t2.c2 = t3.c2 and t2.c2 = 3;
select * from t1 where c2 = 3 order by 1,2,3;
+----+------+------+
| id | c1   | c2   |
+----+------+------+
| 11 |    3 |    3 |
| 12 |    3 |    3 |
| 13 |    3 |    3 |
| 14 |    3 |    3 |
| 15 |    3 |    3 |
| 16 |    3 |    3 |
| 17 |    3 |    3 |
| 18 |    3 |    3 |
| 19 |    3 |    3 |
| 20 |    3 |    3 |
+----+------+------+
select * from t2 where c2 = 3 order by 1,2,3;
+----+------+------+
| id | c1   | c2   |
+----+------+------+
|  8 |    2 |    3 |
|  9 |    2 |    3 |
| 10 |    2 |    3 |
| 11 |    2 |    3 |
| 12 |    2 |    3 |
+----+------+------+
select * from t3 where c2 = 3 order by 1,2,3;
+----+------+------+
| id | c1   | c2   |
+----+------+------+
|  6 |    1 |    3 |
|  7 |    1 |    3 |
|  8 |    1 |    3 |
|  9 |    1 |    3 |
+----+------+------+

UPDATE t2,t3 SET t2.c1 = 3,t3.c1 = 4 WHERE t2.c2 = t3.c2 and t2.c2 = 3;
select * from t1 where c2 = 3 order by 1,2,3;
+----+------+------+
| id | c1   | c2   |
+----+------+------+
| 11 |    3 |    3 |
| 12 |    3 |    3 |
| 13 |    3 |    3 |
| 14 |    3 |    3 |
| 15 |    3 |    3 |
| 16 |    3 |    3 |
| 17 |    3 |    3 |
| 18 |    3 |    3 |
| 19 |    3 |    3 |
| 20 |    3 |    3 |
+----+------+------+
select * from t2 where c2 = 3 order by 1,2,3;
+----+------+------+
| id | c1   | c2   |
+----+------+------+
|  8 |    3 |    3 |
|  9 |    3 |    3 |
| 10 |    3 |    3 |
| 11 |    3 |    3 |
| 12 |    3 |    3 |
+----+------+------+
select * from t3 where c2 = 3 order by 1,2,3;
+----+------+------+
| id | c1   | c2   |
+----+------+------+
|  6 |    4 |    3 |
|  7 |    4 |    3 |
|  8 |    4 |    3 |
|  9 |    4 |    3 |
+----+------+------+

UPDATE t2,t3 SET t2.c1 = 2,t3.c1 = null WHERE t2.c2 = t3.c2 and t2.c2 = 3;
select * from t1 where c2 = 3 order by 1,2,3;
+----+------+------+
| id | c1   | c2   |
+----+------+------+
| 11 |    3 |    3 |
| 12 |    3 |    3 |
| 13 |    3 |    3 |
| 14 |    3 |    3 |
| 15 |    3 |    3 |
| 16 |    3 |    3 |
| 17 |    3 |    3 |
| 18 |    3 |    3 |
| 19 |    3 |    3 |
| 20 |    3 |    3 |
+----+------+------+
select * from t2 where c2 = 3 order by 1,2,3;
+----+------+------+
| id | c1   | c2   |
+----+------+------+
|  8 |    2 |    3 |
|  9 |    2 |    3 |
| 10 |    2 |    3 |
| 11 |    2 |    3 |
| 12 |    2 |    3 |
+----+------+------+
select * from t3 where c2 = 3 order by 1,2,3;
+----+------+------+
| id | c1   | c2   |
+----+------+------+
|  6 | NULL |    3 |
|  7 | NULL |    3 |
|  8 | NULL |    3 |
|  9 | NULL |    3 |
+----+------+------+

UPDATE t2,t3 SET t2.c1 = 4,t3.c1 = 4 WHERE t2.c2 = t3.c2 and t2.c2 = 3;
select * from t1 where c2 = 3 order by 1,2,3;
+----+------+------+
| id | c1   | c2   |
+----+------+------+
| 11 |    3 |    3 |
| 12 |    3 |    3 |
| 13 |    3 |    3 |
| 14 |    3 |    3 |
| 15 |    3 |    3 |
| 16 |    3 |    3 |
| 17 |    3 |    3 |
| 18 |    3 |    3 |
| 19 |    3 |    3 |
| 20 |    3 |    3 |
+----+------+------+
select * from t2 where c2 = 3 order by 1,2,3;
+----+------+------+
| id | c1   | c2   |
+----+------+------+
|  8 |    4 |    3 |
|  9 |    4 |    3 |
| 10 |    4 |    3 |
| 11 |    4 |    3 |
| 12 |    4 |    3 |
+----+------+------+
select * from t3 where c2 = 3 order by 1,2,3;
+----+------+------+
| id | c1   | c2   |
+----+------+------+
|  6 |    4 |    3 |
|  7 |    4 |    3 |
|  8 |    4 |    3 |
|  9 |    4 |    3 |
+----+------+------+

drop table t3;
drop table t2;
drop table t1;

drop user fk_testuser;
purge recyclebin;
