CREATE RESOURCE UNIT unit1 MAX_CPU=1, MAX_MEMORY=1, MAX_IOPS=1, MAX_DISK_SIZE=1, MAX_SESSION_NUM=1, MIN_CPU=1, MIN_MEMORY=1, MIN_IOPS=128;
create resource pool pool1 unit='unit1', unit_num = 3, zone = 'test';
create resource pool pool2 unit='unit1', unit_num = 3, zone = 'test2';
create tenant tenant1 resource_pool_list=('pool1'), replica_num=1, zone_list=('test'),primary_zone='test' set ob_tcp_invited_nodes='%';
select effective_tenant();
effective_tenant()
tenant1
drop database if exists db_1;
drop database db_1;
ERROR HY000: OB-1008: Can't drop database.database doesn't exist
create database db_1
default character set = utf8,
collate = utf8_bin;
show create database db_1;
Database	Create Database
db_1	CREATE DATABASE `db_1` DEFAULT CHARACTER SET = utf8, DEFAULT COLLATE = utf8_bin, REPLICA_NUM = 1, ZONE_LIST = (test), PRIMARY_ZONE = test
use db_1;
create table t_1(c1 int primary key, c2 char(20), c3 int, index i_1(c1, c2), unique index i_2(c3));
create index i_3 on t_1(c1, c2, c3);
create unique index i_4 on t_1(c3);
insert into t_1 values(1,1,1),(2,2,2);
show create table t_1;
table_name	table_define
t_1	CREATE TABLE t_1 (
  c1 INT NOT NULL,
  c2 CHAR(20) COLLATE utf8_bin,
  c3 INT,
  KEY i_1(c1, c2),
  UNIQUE KEY i_2(c3),
  KEY i_3(c1, c2, c3),
  UNIQUE KEY i_4(c3),
  PRIMARY KEY(c1)
) BLOCK_SIZE = 16384, PROGRESSIVE_MERGE_NUM = 1, REPLICA_NUM = 1, DEFAULT CHARSET = utf8, COLLATE = utf8_bin
create database db_2
default character set = utf8mb4,
collate = utf8mb4_bin,
replica_num = 1;
show create database db_2;
Database	Create Database
db_2	CREATE DATABASE `db_2` DEFAULT CHARACTER SET = utf8mb4, DEFAULT COLLATE = utf8mb4_bin, REPLICA_NUM = 1, ZONE_LIST = (test), PRIMARY_ZONE = test
use db_2;
create table t_1(c1 int primary key, c2 char(20), c3 int, index i_1(c1, c2), unique index i_2(c3));
create index i_3 on t_1(c1, c2, c3);
create unique index i_4 on t_1(c3);
insert into t_1 values(1,1,1),(2,2,2),(3,3,3);
show create table t_1;
table_name	table_define
t_1	CREATE TABLE t_1 (
  c1 INT NOT NULL,
  c2 CHAR(20) COLLATE utf8mb4_bin,
  c3 INT,
  KEY i_1(c1, c2),
  UNIQUE KEY i_2(c3),
  KEY i_3(c1, c2, c3),
  UNIQUE KEY i_4(c3),
  PRIMARY KEY(c1)
) BLOCK_SIZE = 16384, PROGRESSIVE_MERGE_NUM = 1, REPLICA_NUM = 1, DEFAULT CHARSET = utf8mb4, COLLATE = utf8mb4_bin
create table t_2(c1 int primary key, c2 char(20), index i_1(c1, c2), unique index i_2(c1));
insert into t_2 values(1,1);
create database db_3;
show create database db_3;
Database	Create Database
db_3	CREATE DATABASE `db_3` DEFAULT CHARACTER SET = utf8mb4, REPLICA_NUM = 1, ZONE_LIST = (test), PRIMARY_ZONE = test
select * from oceanbase.__all_database;
gmt_create	gmt_modified	tenant_id	database_id	database_name	replica_num	zone_list	primary_zone	collation_type	comment
gmt_create	gmt_modified	tenant_id	database_id	oceanbase	2	test;test2	test	45	system database
gmt_create	gmt_modified	tenant_id	database_id	information_schema	2	test;test2	test	45	information_schema
gmt_create	gmt_modified	tenant_id	database_id	mysql	2	test;test2	test	45	MySql schema
gmt_create	gmt_modified	tenant_id	database_id	test	2	test;test2	test	45	
gmt_create	gmt_modified	tenant_id	database_id	oceanbase	1	test	test	45	system database
gmt_create	gmt_modified	tenant_id	database_id	information_schema	1	test	test	45	information_schema
gmt_create	gmt_modified	tenant_id	database_id	mysql	1	test	test	45	MySql schema
gmt_create	gmt_modified	tenant_id	database_id	db_1	1	test	test	83	
gmt_create	gmt_modified	tenant_id	database_id	db_2	1	test	test	46	
gmt_create	gmt_modified	tenant_id	database_id	db_3	1	test	test	45	
select table_name from oceanbase.__all_virtual_table where table_name like "t\_%";
table_name
t_1
t_1
t_2
use db_1;
drop database if exist db_1;
ERROR 42000: You have an error in your SQL syntax; check the manual that corresponds to your OceanBase version for the right syntax to use near 'exist db_1' at line 1
drop database db_1, db_2;
ERROR 42000: You have an error in your SQL syntax; check the manual that corresponds to your OceanBase version for the right syntax to use near ', db_2' at line 1
drop database db_1 if exists;
ERROR 42000: You have an error in your SQL syntax; check the manual that corresponds to your OceanBase version for the right syntax to use near 'if exists' at line 1
use db_1;
select * from t_1;
c1	c2	c3
1	1	1
2	2	2
select * from t_2;
ERROR 42S02: Table 't_2' doesn't exist
drop database db_3;
show create database db_3;
ERROR 42000: Unknown database 'db_3'
select * from db_1.t_1;
c1	c2	c3
1	1	1
2	2	2
select * from db_2.t_1;
c1	c2	c3
1	1	1
2	2	2
3	3	3
select * from db_2.t_2 where db_2.t_2.c1=1;
c1	c2
1	1
delete from  db_2.t_1 where db_2.t_1.c1>2;
select count(*) from db_2.t_1;
count(*)
2
drop table db_1.t_1;
create database test_10 default character set=utf8, default collate= utf8_bin, replica_num=1;
drop database test_10;
create database test_9 default character set=utf8, default collate= utf8_bin, replica_num=1;
drop database test_9;
create database test_8 default character set=utf8, default collate= utf8_bin, replica_num=1;
drop database test_8;
create database test_7 default character set=utf8, default collate= utf8_bin, replica_num=1;
drop database test_7;
create database test_6 default character set=utf8, default collate= utf8_bin, replica_num=1;
drop database test_6;
create database test_5 default character set=utf8, default collate= utf8_bin, replica_num=1;
drop database test_5;
create database test_4 default character set=utf8, default collate= utf8_bin, replica_num=1;
drop database test_4;
create database test_3 default character set=utf8, default collate= utf8_bin, replica_num=1;
drop database test_3;
create database test_2 default character set=utf8, default collate= utf8_bin, replica_num=1;
drop database test_2;
create database test_1 default character set=utf8, default collate= utf8_bin, replica_num=1;
drop database test_1;
select * from oceanbase.__all_database;
gmt_create	gmt_modified	tenant_id	database_id	database_name	replica_num	zone_list	primary_zone	collation_type	comment
gmt_create	gmt_modified	tenant_id	database_id	oceanbase	2	test;test2	test	45	system database
gmt_create	gmt_modified	tenant_id	database_id	information_schema	2	test;test2	test	45	information_schema
gmt_create	gmt_modified	tenant_id	database_id	mysql	2	test;test2	test	45	MySql schema
gmt_create	gmt_modified	tenant_id	database_id	test	2	test;test2	test	45	
gmt_create	gmt_modified	tenant_id	database_id	oceanbase	1	test	test	45	system database
gmt_create	gmt_modified	tenant_id	database_id	information_schema	1	test	test	45	information_schema
gmt_create	gmt_modified	tenant_id	database_id	mysql	1	test	test	45	MySql schema
gmt_create	gmt_modified	tenant_id	database_id	db_1	1	test	test	83	
gmt_create	gmt_modified	tenant_id	database_id	db_2	1	test	test	46	
select table_name from oceanbase.__all_virtual_table where table_name like "t\_%";
table_name
t_1
t_2
drop tenant tenant1 force;
drop resource pool pool1;
drop resource pool pool2;
drop resource unit unit1;
select * from oceanbase.__all_database;
gmt_create	gmt_modified	tenant_id	database_id	database_name	replica_num	zone_list	primary_zone	collation_type	comment
gmt_create	gmt_modified	tenant_id	database_id	oceanbase	2	test;test2	test	45	system database
gmt_create	gmt_modified	tenant_id	database_id	information_schema	2	test;test2	test	45	information_schema
gmt_create	gmt_modified	tenant_id	database_id	mysql	2	test;test2	test	45	MySql schema
gmt_create	gmt_modified	tenant_id	database_id	test	2	test;test2	test	45	
select table_name from oceanbase.__all_virtual_table where table_name like "t\_%";
table_name