#Environmental cleaning
drop user wmj456@'%';
drop database obwmjtest;
create database obwmjtest;
create user wmj456 identified by 'wmj456';
grant all on *.* to wmj456 WITH GRANT OPTION;
DROP TABLE T1;
# makedate-2-mysql
CREATE TABLE `t1` (
`id` int NOT NULL AUTO_INCREMENT,
`consumer` char(20) DEFAULT NULL,
`brand` varchar(20) DEFAULT NULL,
`sal` bigint DEFAULT NULL,
PRIMARY KEY (`id`)
);
INSERT INTO t1 VALUES(1,'书局','apple',5000);
INSERT INTO t1 VALUES(2,'微山','xiaomi',-4000);
INSERT INTO t1 VALUES(3,'深咖','oppo',0);
INSERT INTO t1 VALUES(4,'流苏','huawei',NULL);
INSERT INTO t1 VALUES(5,'玻璃','LG',6000);
INSERT INTO t1 VALUES(6,'钛钢','HTC',8000);
INSERT INTO t1 VALUES(7,'合金','VIVO',3500);
DROP TABLE IF EXISTS T2;
CREATE TABLE `t2` (
`id` int NOT NULL AUTO_INCREMENT,
`model` varchar(200) DEFAULT NULL,
`Price` bigint DEFAULT NULL,
PRIMARY KEY (`id`)
);
INSERT INTO t2 VALUES(1,'apple 12',7000);
INSERT INTO t2 VALUES(2,'xiaomi 9',0);
INSERT INTO t2 VALUES(3,'oppo findx',-6000);
INSERT INTO t2 VALUES(4,'huawei mata30',8000);
INSERT INTO t2 VALUES(5,'huawei mata30',NULL);
INSERT INTO t2 VALUES(6,'htc cc30',26.44);
INSERT INTO t2 VALUES(7,'shumei xi2',-26.44);
CREATE VIEW t1_view AS SELECT *  FROM t1;
CREATE VIEW t2_view AS SELECT *  FROM t2;
SELECT makedate(e.id,10) FROM t1 e;
makedate(e.id,10)
2001-01-10
2002-01-10
2003-01-10
2004-01-10
2005-01-10
2006-01-10
2007-01-10
SELECT makedate(e.consumer,10) FROM t1 e;
makedate(e.consumer,10)
2000-01-10
2000-01-10
2000-01-10
2000-01-10
2000-01-10
2000-01-10
2000-01-10
Warnings:
Warning	1292	Truncated incorrect INTEGER value: '书局'
Warning	1292	Truncated incorrect INTEGER value: '微山'
Warning	1292	Truncated incorrect INTEGER value: '深咖'
Warning	1292	Truncated incorrect INTEGER value: '流苏'
Warning	1292	Truncated incorrect INTEGER value: '玻璃'
Warning	1292	Truncated incorrect INTEGER value: '钛钢'
Warning	1292	Truncated incorrect INTEGER value: '合金'
SELECT makedate(e.brand,10) FROM t1 e;
makedate(e.brand,10)
2000-01-10
2000-01-10
2000-01-10
2000-01-10
2000-01-10
2000-01-10
2000-01-10
Warnings:
Warning	1292	Truncated incorrect INTEGER value: 'apple'
Warning	1292	Truncated incorrect INTEGER value: 'xiaomi'
Warning	1292	Truncated incorrect INTEGER value: 'oppo'
Warning	1292	Truncated incorrect INTEGER value: 'huawei'
Warning	1292	Truncated incorrect INTEGER value: 'LG'
Warning	1292	Truncated incorrect INTEGER value: 'HTC'
Warning	1292	Truncated incorrect INTEGER value: 'VIVO'
SELECT * FROM t1 e WHERE makedate(e.sal,10) = 1;
id	consumer	brand	sal
SELECT makedate(e.sal,10) sal,makedate(p.Price,10) FROM t1 e LEFT JOIN t2 p ON e.id = p.id ORDER BY e.sal DESC;
sal	makedate(p.Price,10)
8000-01-10	2026-01-10
6000-01-10	NULL
5000-01-10	7000-01-10
3500-01-10	NULL
2000-01-10	NULL
NULL	2000-01-10
NULL	8000-01-10
SELECT makedate(e.sal,10) sal,makedate(p.Price,10) FROM t1 e RIGHT JOIN t2 p ON e.id = p.id ORDER BY e.sal DESC;
sal	makedate(p.Price,10)
8000-01-10	2026-01-10
6000-01-10	NULL
5000-01-10	7000-01-10
3500-01-10	NULL
2000-01-10	NULL
NULL	2000-01-10
NULL	8000-01-10
SELECT makedate(e.sal,10) sal,makedate(p.Price,10) FROM t1 e INNER JOIN t2 p ON e.id = p.id ORDER BY e.sal DESC;
sal	makedate(p.Price,10)
8000-01-10	2026-01-10
6000-01-10	NULL
5000-01-10	7000-01-10
3500-01-10	NULL
2000-01-10	NULL
NULL	2000-01-10
NULL	8000-01-10
SELECT * FROM (SELECT e.id,makedate(e.sal,10) sal,makedate(p.Price,10) FROM t1 e LEFT JOIN t2 p ON e.id = p.id ) e ORDER BY e.sal;
id	sal	makedate(p.Price,10)
2	NULL	2000-01-10
4	NULL	8000-01-10
3	2000-01-10	NULL
7	3500-01-10	NULL
1	5000-01-10	7000-01-10
5	6000-01-10	NULL
6	8000-01-10	2026-01-10
SELECT *  FROM t1 e WHERE makedate(e.sal,10) = ANY (SELECT makedate(p.Price,10) FROM t2 p ) ORDER BY e.id;
id	consumer	brand	sal
3	深咖	oppo	0
6	钛钢	HTC	8000
SELECT *  FROM t1 e WHERE makedate(e.sal,10) < ANY (SELECT makedate(p.Price,10) FROM t2 p ) ORDER BY e.id;
id	consumer	brand	sal
1	书局	apple	5000
3	深咖	oppo	0
5	玻璃	LG	6000
7	合金	VIVO	3500
SELECT *  FROM t1 e WHERE makedate(e.sal,10) > ANY (SELECT makedate(p.Price,10) FROM t2 p ) ORDER BY e.id;
id	consumer	brand	sal
1	书局	apple	5000
5	玻璃	LG	6000
6	钛钢	HTC	8000
7	合金	VIVO	3500
SELECT *  FROM t1 e WHERE makedate(e.sal,10) < ALL (SELECT makedate(p.Price,10) FROM t2 p ) ORDER BY e.id;
id	consumer	brand	sal
SELECT *  FROM t1 e WHERE makedate(e.sal,10) > ALL (SELECT makedate(p.Price,10) FROM t2 p ) ORDER BY e.id;
id	consumer	brand	sal
SELECT *  FROM t1 e WHERE makedate(e.sal,10) = ALL (SELECT makedate(p.Price,10) FROM t2 p WHERE p.model = 'oppo findx') ORDER BY e.id;
id	consumer	brand	sal
SELECT *  FROM t1 e WHERE EXISTS (SELECT makedate(p.Price,10) FROM t2 p ) ORDER BY e.id;
id	consumer	brand	sal
1	书局	apple	5000
2	微山	xiaomi	-4000
3	深咖	oppo	0
4	流苏	huawei	NULL
5	玻璃	LG	6000
6	钛钢	HTC	8000
7	合金	VIVO	3500
SELECT makedate(e.sal,10)  FROM t1 e WHERE NOT EXISTS (SELECT p.id,p.price FROM t2 p WHERE makedate(p.Price,10)='2000-01-10' ) ORDER BY e.id;
makedate(e.sal,10)
SELECT makedate(e.sal,10)  FROM t1 e WHERE NOT EXISTS (SELECT p.id,p.price FROM t2 p WHERE makedate(p.Price,10)=7500 ) ORDER BY e.id;
makedate(e.sal,10)
5000-01-10
NULL
2000-01-10
NULL
6000-01-10
8000-01-10
3500-01-10
CREATE TABLE t3 AS SELECT * FROM t1 e WHERE makedate(e.sal,10) ='2000-01-10';
DROP TABLE t3;
CREATE TABLE t3 AS SELECT * FROM t1 e WHERE makedate(e.sal,11.1) ='6000-01-11';
DROP TABLE t3;
CREATE TABLE t3 AS SELECT * FROM t1 e WHERE makedate(e.sal,0) <=> NUll;
DROP TABLE t3;
SELECT brand, makedate(brand,10) FROM t1 e WHERE e.brand LIKE '%a%';
brand	makedate(brand,10)
apple	2000-01-10
xiaomi	2000-01-10
huawei	2000-01-10
Warnings:
Warning	1292	Truncated incorrect INTEGER value: 'apple'
Warning	1292	Truncated incorrect INTEGER value: 'xiaomi'
Warning	1292	Truncated incorrect INTEGER value: 'huawei'
SELECT sal, makedate(sal,10) FROM t1 e LEFT JOIN t2 p ON e.id = p.id WHERE e.sal LIKE '%00%';
sal	makedate(sal,10)
5000	5000-01-10
-4000	NULL
6000	6000-01-10
8000	8000-01-10
3500	3500-01-10
SELECT * FROM t1 e WHERE makedate(e.sal,10) = 0;
id	consumer	brand	sal
SELECT * FROM t1 e WHERE makedate(e.sal,10) = 1;
id	consumer	brand	sal
SELECT * FROM t1 e WHERE makedate(e.sal,10) = NULL;
id	consumer	brand	sal
SELECT * FROM t1 e WHERE makedate(e.sal,10) <=> NULL;
id	consumer	brand	sal
2	微山	xiaomi	-4000
4	流苏	huawei	NULL
SELECT * FROM t1 e WHERE makedate(e.sal,10) > 0 ORDER BY e.id;
id	consumer	brand	sal
1	书局	apple	5000
3	深咖	oppo	0
5	玻璃	LG	6000
6	钛钢	HTC	8000
7	合金	VIVO	3500
SELECT * FROM t1 e WHERE makedate(e.sal,10) >= 0 ORDER BY e.id;
id	consumer	brand	sal
1	书局	apple	5000
3	深咖	oppo	0
5	玻璃	LG	6000
6	钛钢	HTC	8000
7	合金	VIVO	3500
SELECT * FROM t1 e WHERE makedate(e.sal,10) < 0 ORDER BY e.id;
id	consumer	brand	sal
SELECT * FROM t1 e WHERE makedate(e.sal,10) <= 0 ORDER BY e.id;
id	consumer	brand	sal
SELECT * FROM t1 e WHERE makedate(e.sal,10) <> 0 ORDER BY e.id;
id	consumer	brand	sal
1	书局	apple	5000
3	深咖	oppo	0
5	玻璃	LG	6000
6	钛钢	HTC	8000
7	合金	VIVO	3500
SELECT e.id, e.sal, makedate(e.sal,10) FROM t1 e WHERE e.id > 0 ORDER BY makedate(e.sal,10);
id	sal	makedate(e.sal,10)
2	-4000	NULL
4	NULL	NULL
3	0	2000-01-10
7	3500	3500-01-10
1	5000	5000-01-10
5	6000	6000-01-10
6	8000	8000-01-10
SELECT e.id, e.sal, makedate(e.sal,10) FROM t1 e WHERE e.id > 0 ORDER BY makedate(e.sal,10) DESC;
id	sal	makedate(e.sal,10)
6	8000	8000-01-10
5	6000	6000-01-10
1	5000	5000-01-10
7	3500	3500-01-10
3	0	2000-01-10
2	-4000	NULL
4	NULL	NULL
SELECT e.id, e.sal, makedate(e.brand,10) FROM t1 e WHERE e.id > 0 ORDER BY makedate(e.brand,10) ASC;
id	sal	makedate(e.brand,10)
1	5000	2000-01-10
2	-4000	2000-01-10
3	0	2000-01-10
4	NULL	2000-01-10
5	6000	2000-01-10
6	8000	2000-01-10
7	3500	2000-01-10
Warnings:
Warning	1292	Truncated incorrect INTEGER value: 'apple'
Warning	1292	Truncated incorrect INTEGER value: 'xiaomi'
Warning	1292	Truncated incorrect INTEGER value: 'oppo'
Warning	1292	Truncated incorrect INTEGER value: 'huawei'
Warning	1292	Truncated incorrect INTEGER value: 'LG'
Warning	1292	Truncated incorrect INTEGER value: 'HTC'
Warning	1292	Truncated incorrect INTEGER value: 'VIVO'
Warning	1292	Truncated incorrect INTEGER value: 'apple'
Warning	1292	Truncated incorrect INTEGER value: 'xiaomi'
Warning	1292	Truncated incorrect INTEGER value: 'oppo'
Warning	1292	Truncated incorrect INTEGER value: 'huawei'
Warning	1292	Truncated incorrect INTEGER value: 'LG'
Warning	1292	Truncated incorrect INTEGER value: 'HTC'
Warning	1292	Truncated incorrect INTEGER value: 'VIVO'
SELECT e.id, e.sal, makedate(e.brand,10) FROM t1 e WHERE e.id > 0 ORDER BY makedate(e.brand,10) DESC;
id	sal	makedate(e.brand,10)
1	5000	2000-01-10
2	-4000	2000-01-10
3	0	2000-01-10
4	NULL	2000-01-10
5	6000	2000-01-10
6	8000	2000-01-10
7	3500	2000-01-10
Warnings:
Warning	1292	Truncated incorrect INTEGER value: 'apple'
Warning	1292	Truncated incorrect INTEGER value: 'xiaomi'
Warning	1292	Truncated incorrect INTEGER value: 'oppo'
Warning	1292	Truncated incorrect INTEGER value: 'huawei'
Warning	1292	Truncated incorrect INTEGER value: 'LG'
Warning	1292	Truncated incorrect INTEGER value: 'HTC'
Warning	1292	Truncated incorrect INTEGER value: 'VIVO'
Warning	1292	Truncated incorrect INTEGER value: 'apple'
Warning	1292	Truncated incorrect INTEGER value: 'xiaomi'
Warning	1292	Truncated incorrect INTEGER value: 'oppo'
Warning	1292	Truncated incorrect INTEGER value: 'huawei'
Warning	1292	Truncated incorrect INTEGER value: 'LG'
Warning	1292	Truncated incorrect INTEGER value: 'HTC'
Warning	1292	Truncated incorrect INTEGER value: 'VIVO'
SELECT e.id, makedate(e.sal,10), SUM(e.sal+p.Price) FROM t1 e ,t2 p WHERE e.id=p.id GROUP BY e.id, makedate(e.sal,10)  ORDER BY e.id;
id	makedate(e.sal,10)	SUM(e.sal+p.Price)
1	5000-01-10	12000
2	NULL	-4000
3	2000-01-10	-6000
4	NULL	NULL
5	6000-01-10	NULL
6	8000-01-10	8026
7	3500-01-10	3474
SELECT e.id, e.sal,makedate(e.sal,10) tt, SUM(e.sal+p.Price) FROM t1 e ,t2 p WHERE e.id=p.id GROUP BY e.id, makedate(e.sal,10) HAVING tt > -1 ORDER BY e.id;
id	sal	tt	SUM(e.sal+p.Price)
1	5000	5000-01-10	12000
3	0	2000-01-10	-6000
5	6000	6000-01-10	NULL
6	8000	8000-01-10	8026
7	3500	3500-01-10	3474
select id, sal, makedate(case when sal=0 then 200 else sal end, 10) from t1_view ORDER BY id;
id	sal	makedate(case when sal=0 then 200 else sal end, 10)
1	5000	5000-01-10
2	-4000	NULL
3	0	0200-01-10
4	NULL	NULL
5	6000	6000-01-10
6	8000	8000-01-10
7	3500	3500-01-10
select id, sal, makedate(case when sal>0 then 200 else sal end, 10) from t1_view order by id;
id	sal	makedate(case when sal>0 then 200 else sal end, 10)
1	5000	0200-01-10
2	-4000	NULL
3	0	2000-01-10
4	NULL	NULL
5	6000	0200-01-10
6	8000	0200-01-10
7	3500	0200-01-10
select id, sal, makedate(case when sal=0 then 200 else sal end, 10), COUNT(*) from t1_view GROUP by makedate(case when sal=0 then 200 else sal end, 10),id ORDER BY id;
id	sal	makedate(case when sal=0 then 200 else sal end, 10)	COUNT(*)
1	5000	5000-01-10	1
2	-4000	NULL	1
3	0	0200-01-10	1
4	NULL	NULL	1
5	6000	6000-01-10	1
6	8000	8000-01-10	1
7	3500	3500-01-10	1
INSERT INTO t2(model,price) SELECT model,price from t2_view WHERE makedate(price,10) = '2000-01-10';
SELECT COUNT(*) FROM t2;
COUNT(*)
8
INSERT INTO t2(model,price) SELECT model,price from t2_view WHERE makedate(price,10) = ' ';
SELECT COUNT(*) FROM t2;
COUNT(*)
8
UPDATE t2_view SET MODEL = 'xiaomi 10' WHERE makedate(Price,10) = '2026-01-10 ';
UPDATE t2_view SET price = '9000' WHERE makedate(Price,10) < 0;
UPDATE t2_view SET price = (SELECT makedate(t1.sal,10) FROM t1 WHERE makedate(t1.sal,10) = '2000-01-10 ' ) WHERE id = 1 ;
SELECT price FROM t2_view;
price
20000110
0
-6000
8000
NULL
26
-26
0
UPDATE t2_view SET price = (makedate('2003-12-31 12:00:00.123',10));
UPDATE t2_view SET price = (makedate(201,10));
UPDATE t2_view SET price = (cast(makedate(201,10) as unsigned integer));
DELETE FROM t2_view WHERE makedate(Price,10) = 0;
SELECT COUNT(*) FROM t2_view;
COUNT(*)
8
DELETE FROM t2_view WHERE makedate(Price,10) = -1;
SELECT COUNT(*) FROM t2_view;
COUNT(*)
8
DELETE FROM t2_view WHERE makedate(Price,10) <= 2;
SELECT COUNT(*) FROM t2_view;
COUNT(*)
8
DROP TABLE IF EXISTS t1;
CREATE TABLE `t1` (
`id` int,
`consumer` char(20) DEFAULT NULL,
`price` varchar(20) DEFAULT NULL,
`sal` int DEFAULT NULL,
`datetime1` DATE,
`datetime2` bigint
);
INSERT INTO t1 VALUES(1,'书局','7000',5000,'2020-09-22',20200923121200);
INSERT INTO t1 VALUES(2,'微山','3000',-4000,'2020-09-21',20200921101159);
INSERT INTO t1 VALUES(3,'深咖','5000',0,'2020-08-21',20190821101159);
INSERT INTO t1 VALUES(4,'流苏','0',NULL,'2020-02-29',20200228101159);
INSERT INTO t1 VALUES(5,'玻璃','3200',6000,'2020-02-29',20200228101159);
INSERT INTO t1 VALUES(6,'钛钢',NULL,8000,'2020-02-29',20200228101159);
INSERT INTO t1 VALUES(7,'合金','VIVO',3500,'2020-02-29',20200228101159);
CREATE INDEX index_test ON t1(sal);
CREATE INDEX index_test1 ON t1(price);
CREATE INDEX index_test2 ON t1(consumer);
CREATE INDEX index_test3 ON t1(datetime1);
CREATE INDEX index_test4 ON t1(datetime2);
SELECT * FROM t1;
id	consumer	price	sal	datetime1	datetime2
1	书局	7000	5000	2020-09-22	20200923121200
2	微山	3000	-4000	2020-09-21	20200921101159
3	深咖	5000	0	2020-08-21	20190821101159
4	流苏	0	NULL	2020-02-29	20200228101159
5	玻璃	3200	6000	2020-02-29	20200228101159
6	钛钢	NULL	8000	2020-02-29	20200228101159
7	合金	VIVO	3500	2020-02-29	20200228101159
SELECT sal, makedate(sal,10) FROM t1;
sal	makedate(sal,10)
NULL	NULL
-4000	NULL
0	2000-01-10
3500	3500-01-10
5000	5000-01-10
6000	6000-01-10
8000	8000-01-10
SELECT id, consumer, makedate(sal,10) FROM t1 WHERE makedate(sal,10) = '6000-01-10' ORDER BY id DESC;
id	consumer	makedate(sal,10)
5	玻璃	6000-01-10
SELECT id,consumer,makedate(sal,10) FROM t1 WHERE makedate(sal,10) > 0 ORDER BY makedate(sal,10);
id	consumer	makedate(sal,10)
3	深咖	2000-01-10
7	合金	3500-01-10
1	书局	5000-01-10
5	玻璃	6000-01-10
6	钛钢	8000-01-10
SELECT id,SUM(sal) FROM t1 WHERE makedate(sal,10) > 0 GROUP BY id HAVING SUM(sal) > 3000 ORDER BY id;
id	SUM(sal)
1	5000
5	6000
6	8000
7	3500
SELECT id,SUM(sal) FROM t1 WHERE makedate(sal,10) > 0 GROUP BY id HAVING SUM(sal) > 5000 ORDER BY id;
id	SUM(sal)
5	6000
6	8000
UPDATE t1 SET sal = 10 WHERE makedate(sal,10) = '2000-01-10 ' ;
INSERT INTO t1(consumer,price,sal,datetime1,datetime2) SELECT consumer,price,sal,datetime1,datetime2  FROM t1 WHERE makedate(sal,10)<0;
INSERT INTO t1 VALUES(8,'流苏','9111',makedate(200,10),'2020-02-29 10:11:59',20200228101159);
INSERT INTO t1 VALUES(8,'流苏','9112',makedate('156',10),'2020-02-29 10:11:59',20200228101159);
INSERT INTO t1 VALUES(8,'流苏','9113',makedate(-100,10),'2020-02-29 10:11:59',20200228101159);
INSERT INTO t1 VALUES(8,'流苏','9114',makedate(0,10),'2020-02-29 10:11:59',20200228101159);
INSERT INTO t1 VALUES(8,'流苏','9115',makedate(NULL,10),'2020-02-29 10:11:59',20200228101159);
SELECT COUNT(*)  FROM t1;
COUNT(*)
12
DELETE FROM t1 WHERE makedate(sal,10)='3500-01-10';
DROP TABLE IF EXISTS t1;
CREATE TABLE `t1` (
`id` int NOT NULL AUTO_INCREMENT,
`consumer` char(20) NOT NULL,
`price` varchar(20) DEFAULT NULL,
`sal` int DEFAULT NULL,
`datetime1` DATE,
`datetime2` bigint,
PRIMARY KEY (`id`),
UNIQUE KEY `t1_UN` (`price`)
);
INSERT INTO t1 VALUES(1,'书局','7000',5000,'2020-09-22',20200923121200);
INSERT INTO t1 VALUES(2,'微山','3000',-4000,'2020-09-21',20200921101159);
INSERT INTO t1 VALUES(3,'深咖','5000',0,'2020-08-21',20190821101159);
INSERT INTO t1 VALUES(4,'流苏','0',NULL,'2020-02-29',20200228101159);
INSERT INTO t1 VALUES(5,'玻璃','3200',6000,'2020-02-29',20200228101159);
INSERT INTO t1 VALUES(6,'钛钢',NULL,8000,'2020-02-29',20200228101159);
INSERT INTO t1 VALUES(7,'合金','VIVO',3500,'2020-02-29',20200228101159);
SELECT makedate(price,10) FROM t1 order by id;
makedate(price,10)
7000-01-10
3000-01-10
5000-01-10
2000-01-10
3200-01-10
NULL
2000-01-10
Warnings:
Warning	1292	Truncated incorrect INTEGER value: 'VIVO'
SELECT makedate(sal,10) FROM t1 order by id;
makedate(sal,10)
5000-01-10
NULL
2000-01-10
NULL
6000-01-10
8000-01-10
3500-01-10
SELECT makedate(datetime1,10), makedate(datetime2,10), makedate(sal,10), makedate(price,10) FROM t1 order by id;
makedate(datetime1,10)	makedate(datetime2,10)	makedate(sal,10)	makedate(price,10)
NULL	NULL	5000-01-10	7000-01-10
NULL	NULL	NULL	3000-01-10
NULL	NULL	2000-01-10	5000-01-10
NULL	NULL	NULL	2000-01-10
NULL	NULL	6000-01-10	3200-01-10
NULL	NULL	8000-01-10	NULL
NULL	NULL	3500-01-10	2000-01-10
Warnings:
Warning	1292	Truncated incorrect INTEGER value: 'VIVO'
SELECT id, consumer, makedate(sal,10), makedate(price,10) FROM t1 WHERE makedate(sal,10)>0 ORDER BY id DESC;
id	consumer	makedate(sal,10)	makedate(price,10)
7	合金	3500-01-10	2000-01-10
6	钛钢	8000-01-10	NULL
5	玻璃	6000-01-10	3200-01-10
3	深咖	2000-01-10	5000-01-10
1	书局	5000-01-10	7000-01-10
Warnings:
Warning	1292	Truncated incorrect INTEGER value: 'VIVO'
SELECT id,consumer, makedate(sal,10), makedate(price,10) FROM t1 WHERE makedate(sal,10)<0 ORDER BY makedate(sal,10);
id	consumer	makedate(sal,10)	makedate(price,10)
SELECT id, sal,SUM(makedate(sal,10)) FROM t1 WHERE t1.sal <> 6000 GROUP BY sal,id HAVING SUM(makedate(sal,10)) > 0 ORDER BY id;
id	sal	SUM(makedate(sal,10))
1	5000	50000110
3	0	20000110
6	8000	80000110
7	3500	35000110
SELECT price, sal FROM t1;
price	sal
7000	5000
3000	-4000
5000	0
0	NULL
3200	6000
NULL	8000
VIVO	3500
UPDATE t1 SET sal = 10 WHERE makedate(sal,10) = '2000-01-10' ;
UPDATE t1 SET price = '9527' where makedate(sal,10) > '6000-01-10';
SELECT price, sal FROM t1;
price	sal
7000	5000
3000	-4000
5000	10
0	NULL
3200	6000
9527	8000
VIVO	3500
SELECT COUNT(*) FROM t1;
COUNT(*)
7
INSERT INTO t1 VALUES(0,'流苏_insert1',makedate('200',10),makedate(200,10),'2020-02-29 10:11:59',20200228101159);
INSERT INTO t1 VALUES(0,'流苏_insert2',2,makedate('156',10),'2020-02-29 10:11:59',20200228101159);
INSERT INTO t1 VALUES(0,'流苏_insert3',3,makedate(-100,10),'2020-02-29 10:11:59',20200228101159);
INSERT INTO t1 VALUES(0,'流苏_insert4',makedate(NULL,10),makedate(0,10),'2020-02-29 10:11:59',20200228101159);
INSERT INTO t1 VALUES(0,'流苏_insert5','9115',makedate(NULL,10),'2020-02-29 10:11:59',20200228101159);
SELECT COUNT(*)  FROM t1;
COUNT(*)
12
DELETE FROM t1 WHERE CAST(makedate('2020-02-28 10:11:59',10) AS UNSIGNED INTEGER)= 20000110;
SELECT COUNT(*)  FROM t1;
COUNT(*)
12
DROP VIEW t2_view;
DROP VIEW t1_view;
DROP TABLE t1;
DROP TABLE t2;
DROP TABLE t3;
DROP TABLE IF EXISTS t1;
Warnings:
Note	1051	Unknown table 'test.t1'
CREATE TABLE t1 (
a INT,
c_time VARCHAR(50),
d_time VARCHAR(101) GENERATED ALWAYS AS (makedate(c_time,10))
);
CREATE UNIQUE INDEX idx_t1 ON T1(d_time);
DROP INDEX idx_t1 ON t1;
CREATE INDEX idx_t1 ON T1(d_time);
INSERT INTO T1(A,C_TIME) VALUES(1,'202001');
INSERT INTO T1(A,C_TIME) VALUES(2,'201');
INSERT INTO T1(A,C_TIME) VALUES(3,'2020-02-29');
INSERT INTO T1(A,C_TIME) VALUES(4,0);
INSERT INTO T1(A,C_TIME) VALUES(5,'甲骨文');
DROP TABLE IF EXISTS t1;
CREATE TABLE t1 (
a INT AUTO_INCREMENT PRIMARY KEY,
c_time VARCHAR(50),
d_time int GENERATED ALWAYS AS (makedate(c_time-10, 10))
);
CREATE INDEX idx_t1 ON T1(d_time);
INSERT INTO T1(A,C_TIME) VALUES(1,'202001');
INSERT INTO T1(A,C_TIME) VALUES(2,'201');
INSERT INTO T1(A,C_TIME) VALUES(3,'2020-02-29');
INSERT INTO T1(A,C_TIME) VALUES(4,0);
INSERT INTO T1(A,C_TIME) VALUES(5,'甲骨文');
DROP TABLE IF EXISTS t1;
CREATE TABLE t1 (
a INT AUTO_INCREMENT PRIMARY KEY,
c_time VARCHAR(50),
d_time int GENERATED ALWAYS AS (makedate(c_time,(10+10)))
);
CREATE INDEX idx_t1 ON T1(d_time);
INSERT INTO T1(A,C_TIME) VALUES(1,'202001');
INSERT INTO T1(A,C_TIME) VALUES(2,'201');
INSERT INTO T1(A,C_TIME) VALUES(3,'2020-02-29');
INSERT INTO T1(A,C_TIME) VALUES(4,0);
INSERT INTO T1(A,C_TIME) VALUES(5,'甲骨文');
INSERT INTO T1(A,C_TIME) VALUES(6,100+20011);
DROP TABLE IF EXISTS t1;
CREATE TABLE t1 (
a INT AUTO_INCREMENT PRIMARY KEY,
c_time VARCHAR(50),
d_time int GENERATED ALWAYS AS (makedate(c_time,10))
);
CREATE INDEX idx_t1 ON T1(d_time);
INSERT INTO T1(A,C_TIME) VALUES(1,'202001');
INSERT INTO T1(A,C_TIME) VALUES(2,'201');
INSERT INTO T1(A,C_TIME) VALUES(3,0);
INSERT INTO T1(A,C_TIME) VALUES(4,100+20011);
DROP TABLE IF EXISTS t1;
CREATE TABLE t1 (
a INT AUTO_INCREMENT PRIMARY KEY,
c_time VARCHAR(50),
d_time timestamp GENERATED ALWAYS AS (makedate(c_time,10))
);
CREATE INDEX idx_t1 ON T1(d_time);
INSERT INTO T1(A,C_TIME) VALUES(1,'202001');
INSERT INTO T1(A,C_TIME) VALUES(2,'2001');
INSERT INTO T1(A,C_TIME) VALUES(3,0);
INSERT INTO T1(A,C_TIME) VALUES(4,100+20011);
DROP TABLE IF EXISTS t1;
CREATE TABLE t1 (
a INT AUTO_INCREMENT PRIMARY KEY,
c_time timestamp,
d_time varchar(101) GENERATED ALWAYS AS (makedate(c_time,10))
);
CREATE INDEX idx_t1 ON T1(d_time);
INSERT INTO T1(A,C_TIME) VALUES(1,'2020-02-29 10:11:59');
INSERT INTO T1(A,C_TIME) VALUES(2,'09:10:05');
INSERT INTO T1(A,C_TIME) VALUES(3,0);
INSERT INTO T1(A,C_TIME) VALUES(4,100+20011);
DROP TABLE IF EXISTS t1;
CREATE TABLE t1 (
a INT AUTO_INCREMENT PRIMARY KEY,
c_time timestamp,
d_time varchar(101) GENERATED ALWAYS AS (makedate(c_time,10) + 123456789)
);
CREATE INDEX idx_t1 ON T1(d_time);
INSERT INTO T1(A,C_TIME) VALUES(1,'202001');
INSERT INTO T1(A,C_TIME) VALUES(2,'09:10:05');
INSERT INTO T1(A,C_TIME) VALUES(3,0);
INSERT INTO T1(A,C_TIME) VALUES(4,100+20011);
DROP TABLE IF EXISTS t1;
CREATE TABLE t1 (
a INT AUTO_INCREMENT PRIMARY KEY,
c_time varchar(50),
d_time datetime GENERATED ALWAYS AS (makedate(c_time,10) + 1234)
);
CREATE INDEX idx_t1 ON T1(d_time);
INSERT INTO T1(A,C_TIME) VALUES(1,'2020-02-29 10:11:59');
INSERT INTO T1(A,C_TIME) VALUES(4,100+20011);
DROP TABLE IF EXISTS t1;
CREATE TABLE t1 (
a INT AUTO_INCREMENT PRIMARY KEY,
c_time varchar(50),
d_time varchar(50) GENERATED ALWAYS AS (case when makedate(c_time,10) > "20210706" then "now" when makedate(c_time,10) <= "20210706" then 'yesterday' end)
);
CREATE INDEX idx_t1 ON T1(d_time);
INSERT INTO T1(A,C_TIME) VALUES(1,'2022');
INSERT INTO T1(A,C_TIME) VALUES(2,'2019');
INSERT INTO T1(A,C_TIME) VALUES(3,NULL);
INSERT INTO T1(A,C_TIME) VALUES(4,0);
# makedate-3-mysql
# 内置转换
DROP TABLE IF EXISTS t2;
Warnings:
Note	1051	Unknown table 'test.t2'
CREATE TABLE t2 (
time_stp timestamp
);
INSERT INTO T2 VALUES('2013-05-22 18:32:37.000');
DROP TABLE IF EXISTS T1;
CREATE TABLE `t1` (
a bigint DEFAULT NULL,
b float DEFAULT NULL,
c double DEFAULT NULL,
d date DEFAULT NULL,
e time DEFAULT NULL,
f year DEFAULT NULL,
g timestamp,
h char(20) DEFAULT NULL,
i varchar(20) DEFAULT NULL,
j text DEFAULT NULL
);
INSERT INTO T1(a) values(makedate((select time_stp from t2),10));
INSERT INTO T1(a) values(makedate(201,10));
INSERT INTO T1(a) values(makedate(0.4,10));
INSERT INTO T1(b) values(makedate((select time_stp from t2),10));
INSERT INTO T1(b) values(makedate(201,10));
INSERT INTO T1(b) values(makedate(0.4,10));
INSERT INTO T1(c) values(makedate((select time_stp from t2),10));
INSERT INTO T1(c) values(makedate(201,10));
INSERT INTO T1(c) values(makedate(0.4,10));
INSERT INTO T1(d) values(makedate((select time_stp from t2),10));
INSERT INTO T1(d) values(makedate(201,10));
INSERT INTO T1(d) values(makedate(0.4,10));
INSERT INTO T1(e) values(makedate((select time_stp from t2),10));
INSERT INTO T1(e) values(makedate(201,10));
INSERT INTO T1(e) values(makedate(0.4,10));
INSERT INTO T1(f) values(makedate((select time_stp from t2),10));
INSERT INTO T1(f) values(makedate(201,10));
INSERT INTO T1(f) values(makedate(0.4,10));
INSERT INTO T1(g) values(makedate((select time_stp from t2),10));
INSERT INTO T1(g) values(makedate(201,10));
INSERT INTO T1(g) values(makedate(0.4,10));
INSERT INTO T1(h) values(makedate((select time_stp from t2),10));
INSERT INTO T1(h) values(makedate(201,10));
INSERT INTO T1(h) values(makedate(0.4,10));
INSERT INTO T1(i) values(makedate((select time_stp from t2),10));
INSERT INTO T1(i) values(makedate(201,10));
INSERT INTO T1(i) values(makedate(0.4,10));
INSERT INTO T1(j) values(makedate((select time_stp from t2),10));
INSERT INTO T1(j) values(makedate(201,10));
INSERT INTO T1(j) values(makedate(0.4,10));
TRUNCATE TABLE T1;
INSERT INTO T1(a) values(makedate((select time_stp from t2),10));
UPDATE T1 SET A = (makedate((select time_stp from t2),10));
UPDATE T1 SET A = (makedate(201,10));
UPDATE T1 SET A = (makedate(0.4,10));
SELECT a FROM T1;
a
20000110
UPDATE T1 SET B = (makedate((select time_stp from t2),10));
UPDATE T1 SET B = (makedate(201,10));
UPDATE T1 SET B = (makedate(0.4,10));
SELECT B FROM T1;
B
20000100
UPDATE T1 SET C = (makedate((select time_stp from t2),10));
UPDATE T1 SET c = (makedate(201,10));
UPDATE T1 SET c = (makedate(0.4,10));
SELECT c FROM T1;
c
20000110
UPDATE T1 SET d = (makedate((select time_stp from t2),10));
UPDATE T1 SET d = (makedate(201,10));
UPDATE T1 SET d = (makedate(0.4,10));
SELECT d FROM T1;
d
2000-01-10
UPDATE T1 SET e = (makedate((select time_stp from t2),10));
UPDATE T1 SET e = (makedate(201,10));
UPDATE T1 SET e = (makedate(0.4,10));
SELECT e FROM T1;
e
00:00:00
UPDATE T1 SET f = (makedate((select time_stp from t2),10));
UPDATE T1 SET f = (makedate(201,10));
UPDATE T1 SET f = (makedate(0.4,10));
SELECT f FROM T1;
f
2000
UPDATE T1 SET g = (makedate((select time_stp from t2),10));
UPDATE T1 SET g = (makedate(201,10));
UPDATE T1 SET g = (makedate(0.4,10));
SELECT g FROM T1;
g
2000-01-10 00:00:00
UPDATE T1 SET h = (makedate((select time_stp from t2),10));
UPDATE T1 SET h = (makedate(201,10));
UPDATE T1 SET h = (makedate(0.4,10));
SELECT h FROM T1;
h
2000-01-10
UPDATE T1 SET i = (makedate((select time_stp from t2),10));
UPDATE T1 SET i = (makedate(201,10));
UPDATE T1 SET i = (makedate(0.4,10));
SELECT i FROM T1;
i
2000-01-10
UPDATE T1 SET j = (makedate((select time_stp from t2),10));
UPDATE T1 SET j = (makedate(201,10));
UPDATE T1 SET j = (makedate(0.4,10));
SELECT j FROM T1;
j
2000-01-10
# makedate-4-mysql
# 函数嵌套
DROP TABLE IF EXISTS t1;
CREATE TABLE T1(
a bigint,
b varchar(30),
c timestamp
)PARTITION BY RANGE(a)
(
PARTITION id_part1 values less than (3),
PARTITION id_part2 values less than (8),
PARTITION id_part3 values less than (MAXVALUE)
);
insert into t1 values (1, CAST(makedate(2012,10) AS UNSIGNED INTEGER), '2013-05-22 18:32:37.000');
insert into t1 values (2, null , '1992-01-02 23:51:32.000');
insert into t1 values (3, FROM_UNIXTIME(UNIX_timestamp(makedate('1995',10))), '2006-08-09 03:20:51');
insert into t1 values (4, hour(makedate('1995',10)), '1980-12-03 01:08:01.000');
insert into t1 values (7, date(makedate('1980',10)), '1980-12-03 01:08:01.000');
insert into t1 values(11, (select makedate(e.c,10) from t1 e where a=3),  '2006-08-09 03:20:51');
insert into t1 values (makedate(201,10), '2006-08-09 03:20:51', '2015-01-30 06:13:54.000');
update t1 set b = DATE_FORMAT(makedate('2014',10), '%Y-%M-%D') where a = 1;
update t1 set b = makedate(STR_TO_DATE('2014-January-1st', '%Y-%M-%d'),10) where a = 3;
update t1 set b = TIME_TO_USEC(makedate('2014',10)) where a = 4;
# 分区表
DROP TABLE IF EXISTS t1;
CREATE TABLE T1(
a bigint,
b datetime
)partition by range columns(b) subpartition by hash(a) subpartitions 2
( 
partition part_1 values less than ('2016-09-01'),
partition part_2 values less than ('2020-09-01'),
partition part_3 values less than ('2021-09-01')
);
insert into t1 values(1,(substr(makedate('2012',10),1)));
insert into t1 values(LENGTH(makedate('1995',10)),'1995-12-02 22:30:27');
insert into t1 values(ROUND(makedate('2006',10)), '2006-08-09 03:20:51');
insert into t1 values(CEIL(makedate('2006',10)), '2006-03-31 14:45:32');
insert into t1 values(FLOOR(makedate('2016',10)), '2016-03-19 13:22:51');
insert into t1 values(ABS(makedate('2010',10)), '2010-12-03 16:03:03');
insert into t1 values(NEG(makedate('1992',10)), '1992-01-02 23:51:32');
insert into t1 values(SIGN(makedate('1980',10)), '1980-12-03 01:08:01.000');
insert into t1 values(11,null);
select least(makedate(b,10), '1987-06-28 02:24:22.000', sign(null)) from t1;
least(makedate(b,10), '1987-06-28 02:24:22.000', sign(null))
NULL
NULL
NULL
NULL
NULL
NULL
NULL
NULL
NULL
select least(makedate(b,10), '1987-06-28 02:24:22.000') from t1;
least(makedate(b,10), '1987-06-28 02:24:22.000')
NULL
NULL
NULL
NULL
NULL
NULL
NULL
NULL
NULL
select * from t1 where makedate(b,10) is null;
a	b
10	1995-12-02 22:30:27
20060110	2006-08-09 03:20:51
20060110	2006-03-31 14:45:32
20160110	2016-03-19 13:22:51
20100110	2010-12-03 16:03:03
-19920110	1992-01-02 23:51:32
1	2012-01-10 00:00:00
1	1980-12-03 01:08:01
11	NULL
select * from t1 where makedate(b,10) is not null;
a	b
SELECT * FROM T1 WHERE A = CAST(makedate('09:10:05',10) AS UNSIGNED INTEGER);
a	b
Warnings:
Warning	1292	Truncated incorrect INTEGER value: '09:10:05'
Warning	1292	Truncated incorrect INTEGER value: '09:10:05'
Warning	1292	Truncated incorrect INTEGER value: '09:10:05'
Warning	1292	Truncated incorrect INTEGER value: '09:10:05'
Warning	1292	Truncated incorrect INTEGER value: '09:10:05'
SELECT * FROM T1 WHERE A > CAST(makedate('09:10:05',10) AS UNSIGNED INTEGER) ORDER BY B;
a	b
20100110	2010-12-03 16:03:03
20160110	2016-03-19 13:22:51
Warnings:
Warning	1292	Truncated incorrect INTEGER value: '09:10:05'
Warning	1292	Truncated incorrect INTEGER value: '09:10:05'
Warning	1292	Truncated incorrect INTEGER value: '09:10:05'
Warning	1292	Truncated incorrect INTEGER value: '09:10:05'
Warning	1292	Truncated incorrect INTEGER value: '09:10:05'
Warning	1292	Truncated incorrect INTEGER value: '09:10:05'
Warning	1292	Truncated incorrect INTEGER value: '09:10:05'
Warning	1292	Truncated incorrect INTEGER value: '09:10:05'
Warning	1292	Truncated incorrect INTEGER value: '09:10:05'
Warning	1292	Truncated incorrect INTEGER value: '09:10:05'
SELECT * FROM T1 WHERE A < CAST(makedate('09:10:05',10) AS UNSIGNED INTEGER) ORDER BY B;
a	b
11	NULL
1	1980-12-03 01:08:01
-19920110	1992-01-02 23:51:32
10	1995-12-02 22:30:27
20060110	2006-03-31 14:45:32
20060110	2006-08-09 03:20:51
1	2012-01-10 00:00:00
Warnings:
Warning	1292	Truncated incorrect INTEGER value: '09:10:05'
Warning	1292	Truncated incorrect INTEGER value: '09:10:05'
Warning	1292	Truncated incorrect INTEGER value: '09:10:05'
Warning	1292	Truncated incorrect INTEGER value: '09:10:05'
Warning	1292	Truncated incorrect INTEGER value: '09:10:05'
Warning	1292	Truncated incorrect INTEGER value: '09:10:05'
Warning	1292	Truncated incorrect INTEGER value: '09:10:05'
Warning	1292	Truncated incorrect INTEGER value: '09:10:05'
Warning	1292	Truncated incorrect INTEGER value: '09:10:05'
Warning	1292	Truncated incorrect INTEGER value: '09:10:05'
SELECT * FROM T1 WHERE B < makedate('2012',10) ORDER BY B;
a	b
1	1980-12-03 01:08:01
-19920110	1992-01-02 23:51:32
10	1995-12-02 22:30:27
20060110	2006-03-31 14:45:32
20060110	2006-08-09 03:20:51
20100110	2010-12-03 16:03:03
SELECT * FROM T1 WHERE B <= makedate('2012',10) ORDER BY B;
a	b
1	1980-12-03 01:08:01
-19920110	1992-01-02 23:51:32
10	1995-12-02 22:30:27
20060110	2006-03-31 14:45:32
20060110	2006-08-09 03:20:51
20100110	2010-12-03 16:03:03
1	2012-01-10 00:00:00
SELECT * FROM T1 WHERE B > makedate('2012',10) ORDER BY B;
a	b
20160110	2016-03-19 13:22:51
SELECT * FROM T1 WHERE B != makedate('2012',10) ORDER BY B;
a	b
1	1980-12-03 01:08:01
-19920110	1992-01-02 23:51:32
10	1995-12-02 22:30:27
20060110	2006-03-31 14:45:32
20060110	2006-08-09 03:20:51
20100110	2010-12-03 16:03:03
20160110	2016-03-19 13:22:51
TRUNCATE TABLE T1;
insert into t1 values(12,'2021-07-07 11:57:49.000001');
insert into t1 values(13,'2021-07-07 11:57:49.00002');
SELECT * FROM T1 WHERE B <= makedate('2021',10) ORDER BY B;
a	b
SELECT * FROM T1 WHERE B > makedate('2021',10) ORDER BY B;
a	b
12	2021-07-07 11:57:49
13	2021-07-07 11:57:49
SELECT * FROM T1 WHERE B < makedate('2021',10) ORDER BY B;
a	b
SELECT * FROM T1 WHERE B = makedate('2021',10) ORDER BY B;
a	b
SELECT * FROM T1 WHERE B = makedate('2021',10) ORDER BY B;
a	b
SET timestamp=1626061421;
SELECT makedate((DATE_ADD(current_timestamp(), INTERVAL '01 05:05:65.000065' DAY_MICROSECOND)),10);
makedate((DATE_ADD(current_timestamp(), INTERVAL '01 05:05:65.000065' DAY_MICROSECOND)),10)
NULL
SELECT makedate(b * 10,10) FROM t1 ;
makedate(b * 10,10)
NULL
NULL
SELECT makedate(b + 1500,10) FROM t1 ;
makedate(b + 1500,10)
NULL
NULL
SELECT makedate(b - 1000,10) FROM t1;
makedate(b - 1000,10)
NULL
NULL
SELECT makedate(b / 1500,10) FROM t1 ;
makedate(b / 1500,10)
NULL
NULL
SELECT makedate(b / 1500 * 10,10) FROM t1;
makedate(b / 1500 * 10,10)
NULL
NULL
SELECT makedate(b * 10 - 0.1,10) FROM t1;
makedate(b * 10 - 0.1,10)
NULL
NULL
SELECT makedate(b * 0.221 - 0.1,10) FROM t1 ;
makedate(b * 0.221 - 0.1,10)
NULL
NULL
SELECT makedate(b % 3,10) FROM t1 ;
makedate(b % 3,10)
2001-01-10
2001-01-10
SELECT makedate(b * 0,10) FROM t1 ;
makedate(b * 0,10)
2000-01-10
2000-01-10
SELECT makedate(b * NULL,10) FROM t1 ;
makedate(b * NULL,10)
NULL
NULL
SELECT makedate(b - 0.111,10) FROM t1 ;
makedate(b - 0.111,10)
NULL
NULL
SELECT makedate('2003',10) > makedate('2003',9) FROM DUAL;
makedate('2003',10) > makedate('2003',9)
1
SELECT makedate('2003',10) < makedate('2003',9) FROM DUAL;
makedate('2003',10) < makedate('2003',9)
0
SELECT makedate('2003',10) = makedate('2003',10) FROM DUAL;
makedate('2003',10) = makedate('2003',10)
1
SELECT makedate('2003',10) <=> makedate(NULL,10)  FROM DUAL;
makedate('2003',10) <=> makedate(NULL,10)
0
SELECT makedate(null,10) <=> makedate(NULL,10)  FROM DUAL;
makedate(null,10) <=> makedate(NULL,10)
1
SELECT '2013-12-31 12:00:00' BETWEEN makedate('2003',10) AND makedate('2023',10) FROM DUAL;
'2013-12-31 12:00:00' BETWEEN makedate('2003',10) AND makedate('2023',10)
1
SELECT '2013-12-31' BETWEEN makedate('2003',0) AND makedate('2013',20) FROM DUAL;
'2013-12-31' BETWEEN makedate('2003',0) AND makedate('2013',20)
0
SELECT '2013-12-31 12:00:00' BETWEEN makedate('2003',1) AND makedate('2023',1) FROM DUAL;
'2013-12-31 12:00:00' BETWEEN makedate('2003',1) AND makedate('2023',1)
1
SELECT makedate('09:10:05',10) OR makedate('09:10:06',10) FROM DUAL;
makedate('09:10:05',10) OR makedate('09:10:06',10)
1
Warnings:
Warning	1292	Truncated incorrect INTEGER value: '09:10:05'
SELECT makedate('09:10:05',10) OR makedate(201,10) FROM DUAL;
makedate('09:10:05',10) OR makedate(201,10)
1
Warnings:
Warning	1292	Truncated incorrect INTEGER value: '09:10:05'
SELECT makedate(201,10) or makedate('09:10:05',10) FROM DUAL;
makedate(201,10) or makedate('09:10:05',10)
1
SELECT makedate(NULL,10) or makedate('09:10:05',10) FROM DUAL;
makedate(NULL,10) or makedate('09:10:05',10)
1
Warnings:
Warning	1292	Truncated incorrect INTEGER value: '09:10:05'
SELECT makedate(NULL,10) and makedate('09:10:05',10) FROM DUAL;
makedate(NULL,10) and makedate('09:10:05',10)
NULL
Warnings:
Warning	1292	Truncated incorrect INTEGER value: '09:10:05'
SELECT makedate('09:10:05',10) and makedate(NULL,10) FROM DUAL;
makedate('09:10:05',10) and makedate(NULL,10)
NULL
Warnings:
Warning	1292	Truncated incorrect INTEGER value: '09:10:05'
SELECT makedate(301,10) OR makedate(201,10) FROM DUAL;
makedate(301,10) OR makedate(201,10)
1
SELECT NOT makedate(301,10) FROM DUAL;
NOT makedate(301,10)
0
SELECT NOT makedate(NULL,10) FROM DUAL;
NOT makedate(NULL,10)
NULL
SELECT NOT makedate(0,10) FROM DUAL;
NOT makedate(0,10)
0
SELECT !makedate(0,10) FROM DUAL;
!makedate(0,10)
0
SELECT !makedate(301,10) FROM DUAL;
!makedate(301,10)
0
SELECT !makedate('2003-12-31 12:00:00',10) FROM DUAL;
!makedate('2003-12-31 12:00:00',10)
0
Warnings:
Warning	1292	Truncated incorrect INTEGER value: '2003-12-31 12:00:00'
SELECT makedate('2003',10) xor makedate('2003',10) FROM DUAL;
makedate('2003',10) xor makedate('2003',10)
0
SELECT makedate('2003',10) xor makedate(null,10) FROM DUAL;
makedate('2003',10) xor makedate(null,10)
NULL
SELECT makedate(201,10) xor makedate('2003',10) FROM DUAL;
makedate(201,10) xor makedate('2003',10)
0
SELECT makedate('2003',10) xor makedate(0,10) FROM DUAL;
makedate('2003',10) xor makedate(0,10)
0
SELECT (makedate('2003',10)) ^ (makedate(0,10)) FROM DUAL;
(makedate('2003',10)) ^ (makedate(0,10))
36848
SELECT makedate('2003',10) ^ makedate(201,10) FROM DUAL;
makedate('2003',10) ^ makedate(201,10)
19859808
SELECT makedate('2003',10) ^ makedate('2012',10) FROM DUAL;
makedate('2003',10) ^ makedate('2012',10)
172208
SELECT makedate('2003',10) >> makedate(201,10) FROM DUAL;
makedate('2003',10) >> makedate(201,10)
0
SELECT makedate('2003',10) << makedate(201,10) FROM DUAL;
makedate('2003',10) << makedate(201,10)
0
SELECT ~makedate(201,10) FROM DUAL;
~makedate(201,10)
18446744073707541505
SELECT ~makedate('2003',10) FROM DUAL;
~makedate('2003',10)
18446744073689521505
SELECT ~makedate(0,10) FROM DUAL;
~makedate(0,10)
18446744073689551505
SELECT makedate('0910',10) > makedate('0916',10) FROM DUAL;
makedate('0910',10) > makedate('0916',10)
0
SELECT makedate('0910',10) < makedate('0916',10) FROM DUAL;
makedate('0910',10) < makedate('0916',10)
1
SELECT makedate('09:10',10) <> makedate('09:10',10) FROM DUAL;
makedate('09:10',10) <> makedate('09:10',10)
0
Warnings:
Warning	1292	Truncated incorrect INTEGER value: '09:10'
SELECT makedate('0900',10) + 123456 FROM DUAL;
makedate('0900',10) + 123456
9123566
SELECT makedate('0900',0) - 133444 FROM DUAL;
makedate('0900',0) - 133444
NULL
SELECT makedate('0910',10) - 123.456 FROM dual;
makedate('0910',10) - 123.456
9099986.544
SELECT makedate('0905',10) - 123456 FROM dual;
makedate('0905',10) - 123456
8926654
SELECT makedate('2003',10) * 1024 FROM DUAL;
makedate('2003',10) * 1024
20510832640
SELECT makedate('2003',10) - 1.175494351E-38 FROM DUAL;
makedate('2003',10) - 1.175494351E-38
20030110
SELECT 1.175494351E-38 - makedate('2003',10) FROM DUAL;
1.175494351E-38 - makedate('2003',10)
-20030110
SELECT -3.402823466E+38 - makedate('2003',10) FROM DUAL;
-3.402823466E+38 - makedate('2003',10)
-3.402823466e38
SELECT 2.2250738585072014E-308  - makedate('2003',10) FROM DUAL;
2.2250738585072014E-308  - makedate('2003',10)
-20030110
SELECT makedate('2003',10) + 1.7976931348623157E+308 FROM DUAL;
makedate('2003',10) + 1.7976931348623157E+308
1.7976931348623157e308
SELECT makedate('2003',10) + '0000-12-25' FROM DUAL;
makedate('2003',10) + '0000-12-25'
20030110
Warnings:
Warning	1292	Truncated incorrect DOUBLE value: '0000-12-25'
# Clean up users
drop database obwmjtest;
drop user wmj456@'%' ;
