#Environmental cleaning
drop user wmj456@'%';
drop database obwmjtest;
create database obwmjtest;
create user wmj456 identified by 'wmj456';
grant all on *.* to wmj456 WITH GRANT OPTION;
DROP TABLE t1;
DROP FUNCTION f_test;
DROP PROCEDURE p_test;
CREATE TABLE t1 (
float_1 float ,
double_2 varchar(200),
id int,
date_1 DATE,
time_2 time,
year_3 year,
date_tim datetime,
time_stp varchar(200)
);
INSERT INTO t1
(float_1, double_2, id, date_1, time_2, year_3, date_tim, time_stp)
VALUES(3092, 30062, 6252, '2002-02-11', '09:10:05', 1994, '2012-04-20 11:57:49.000', '2013-05-22 18:32:37.000');
INSERT INTO t1
(float_1, double_2, id, date_1, time_2, year_3, date_tim, time_stp)
VALUES(13198, 23189, 20692, '1987-06-25', '13:24:39', 1995, '1995-12-02 22:30:27.000', '1992-01-02 23:51:32.000');
INSERT INTO t1
(float_1, double_2, id, date_1, time_2, year_3, date_tim, time_stp)
VALUES(7209, 21039, 32227, '2017-06-19', '17:50:25', 2003, '2006-08-09 03:20:51.000', '2015-01-30 06:13:54.000');
INSERT INTO t1
(float_1, double_2, id, date_1, time_2, year_3, date_tim, time_stp)
VALUES(32505, 1416, 1465, '2019-10-01', '14:47:02', 2007, '1980-12-03 01:08:01.000', '2006-03-31 14:45:32.000');
INSERT INTO t1
(float_1, double_2, id, date_1, time_2, year_3, date_tim, time_stp)
VALUES(9355, 13935, 27247, '2016-12-30', '05:34:52', 1992, '1996-05-28 11:23:57.000', '2018-01-20 10:56:17.000');
INSERT INTO t1
(float_1, double_2, id, date_1, time_2, year_3, date_tim, time_stp)
VALUES(17703, 15796, 24548, '1988-03-16', '00:44:58', 1993, '2016-02-11 04:33:56.000', '1992-02-26 07:44:26.000');
INSERT INTO t1
(float_1, double_2, id, date_1, time_2, year_3, date_tim, time_stp)
VALUES(7129, 5287, 4201, '1980-10-03', '10:52:57', 1988, '1987-06-28 02:24:22.000', '1999-03-16 12:53:22.000');
INSERT INTO t1
(float_1, double_2, id, date_1, time_2, year_3, date_tim, time_stp)
VALUES(559, 22386, 339, '2010-04-06', '23:15:01', 1988, '1985-03-07 21:03:26.000', '1980-06-30 17:37:42.000');
INSERT INTO t1
(float_1, double_2, id, date_1, time_2, year_3, date_tim, time_stp)
VALUES(27658, 6732, 2287, '2004-04-13', '23:38:33', 2018, '1980-03-07 05:28:24.000', '2000-09-26 02:08:37.000');
INSERT INTO t1
(float_1, double_2, id, date_1, time_2, year_3, date_tim, time_stp)
VALUES(6872, 7400, 19733, '1988-08-05', '11:12:20', 1987, '2010-12-03 16:03:03.000', '2006-09-28 22:55:55.000');
obmysql-periodadd-6
drop function f_test ;//
CREATE  FUNCTION f_test()
returns varchar(200)
begin
declare a varchar(200);
SELECT PERIOD_ADD(year_3,10) FROM t1 e WHERE PERIOD_ADD(year_3,10)='202709' INTO a;
return a;
END;
//
SELECT f_test();
f_test()
202709
drop function f_test ;//
CREATE FUNCTION f_test(samplename varchar(200))
returns varchar(200)
begin
declare a varchar(200);
SELECT PERIOD_ADD(samplename,10) FROM t1 e WHERE PERIOD_ADD(year_3,10)='202709' INTO a ;
return a;
END;
//
SELECT f_test(-100);
f_test(-100)
0
SELECT f_test('2015');
f_test('2015')
202201
SELECT f_test('0000-12-25 00:00:00');
f_test('0000-12-25 00:00:00')
0
Warnings:
Warning	1292	Truncated incorrect INTEGER value: '0000-12-25 00:00:00'
SELECT f_test('09:10:05:12:34:44');
f_test('09:10:05:12:34:44')
200107
Warnings:
Warning	1292	Truncated incorrect INTEGER value: '09:10:05:12:34:44'
SELECT f_test(abc);
SELECT f_test(NULL);
f_test(NULL)
NULL
obmysql-PERIOD_ADD-8-2
drop function f_test;//
CREATE FUNCTION f_test(samplename varchar(200), samplename1 varchar(200))
returns  varchar(200)
begin
declare a varchar(200);
declare b varchar(200);
declare i int default 0;
SELECT PERIOD_ADD(year_3,10) FROM t1 e WHERE PERIOD_ADD(year_3,10) = samplename into a;
SELECT PERIOD_ADD(year_3,10) FROM t1 e WHERE PERIOD_ADD(year_3,10) = samplename1 into b;
WHILE i <= 0 do
INSERT INTO t1 VALUES (2951,a,1088,'1985-05-10','05:14:41',1984,'2000-03-23 00:15:01.000','2002-06-20 05:50:54');
INSERT INTO t1 VALUES (17854,b,32209,'2005-11-05','07:00:06',2005,'1982-04-20 13:13:32.000','2014-11-24 23:19:45.000');
set i := i + 1;
END WHILE;
return a+b;
END;
//
SELECT f_test(0,-1) FROM dual;
f_test(0,-1)
NULL
SELECT f_test(NULL,-1) FROM dual;
f_test(NULL,-1)
NULL
SELECT f_test('202709',0) FROM dual;
f_test('202709',0)
NULL
SELECT f_test(-1,-1) FROM dual;
f_test(-1,-1)
NULL
select count(*) from t1;
count(*)
18
delete from t1 where id in (1088,32209);
drop function f_test;//
CREATE  FUNCTION f_test(samplename varchar(200),samplename1 varchar(200))
returns  varchar(200)
begin
declare a varchar(200);
declare b varchar(200);
declare i int default 0;
SELECT PERIOD_ADD(year_3,10) FROM t1 e WHERE PERIOD_ADD(year_3,10) = samplename into a;
SELECT PERIOD_ADD(year_3,10) FROM t1 e WHERE PERIOD_ADD(year_3,10) = samplename1 into b;
repeat 	
INSERT INTO t1 VALUES(0,a,1088,'1985-05-10','05:14:41',1984,'2000-03-23 00:15:01.000','2002-06-20 05:50:54'),(0,b,32209,'2005-11-05','07:00:06',2005,'1982-04-20 13:13:32.000','2014-11-24 23:19:45.000');
set i := i + 1;
until i >= 1	
end repeat;
return period_add(a,10);
END;
//
select count(*) from t1;
count(*)
10
SELECT f_test(0,-1) FROM dual;
f_test(0,-1)
NULL
SELECT f_test(NULL,-1) FROM dual;
f_test(NULL,-1)
NULL
SELECT f_test('202709', '202204') FROM dual;
f_test('202709', '202204')
202807
SELECT f_test(-1,0) FROM dual;
f_test(-1,0)
NULL
SELECT f_test(-1,-1) FROM dual;
f_test(-1,-1)
NULL
select count(*) from t1;
count(*)
20
delete from t1 where id in (1088,32209);
drop function f_test;//
CREATE  FUNCTION f_test(samplename varchar(200),samplename1 varchar(200))
returns  varchar(200)
begin
declare a varchar(200);
declare b varchar(200);
declare i int default 0;
SELECT PERIOD_ADD(year_3,10) FROM t1 e WHERE PERIOD_ADD(year_3,10) = samplename into a;
SELECT PERIOD_ADD(year_3,10) FROM t1 e WHERE PERIOD_ADD(year_3,10) = samplename1 into b;
return a;
END;
//
SELECT f_test('202709', '2007-01-10') FROM dual;
f_test('202709', '2007-01-10')
202709
Warnings:
Warning	1292	Truncated incorrect DECIMAL value: '2007-01-10'
drop function f_test;//
CREATE FUNCTION f_test(samplename varchar(200),samplename1 varchar(200))
returns varchar(200)
BEGIN
declare a varchar(200);
declare b varchar(200);
declare i int default 0;
SELECT PERIOD_ADD(year_3,10) FROM t1 e WHERE PERIOD_ADD(year_3,10) = samplename into a;
SELECT PERIOD_ADD(year_3,10) FROM t1 e WHERE PERIOD_ADD(year_3,10) = samplename1 into b;
lp1:loop
set i := i + 1;
INSERT INTO t1 VALUES(0,a,1088,'1985-05-10','05:14:41',1984,'2000-03-23 00:15:01.000','2002-06-20 05:50:54');
INSERT INTO t1 VALUES(0,b,32209,'2005-11-05','07:00:06',2005,'1982-04-20 13:13:32.000','2014-11-24 23:19:45.000');
if i > 1 then
leave lp1;
end if;
end Loop lp1;
return period_add(b,10);
END;
//
select count(*) from t1;
count(*)
10
SELECT f_test(0,-1) FROM dual;
f_test(0,-1)
NULL
SELECT f_test(NULL,-1) FROM dual;
f_test(NULL,-1)
NULL
SELECT f_test(-1,0) FROM dual;
f_test(-1,0)
NULL
SELECT f_test(-1,-1) FROM dual;
f_test(-1,-1)
NULL
SELECT f_test('202709', '202204') FROM dual;
f_test('202709', '202204')
202302
select count(*) from t1;
count(*)
30
delete from t1 where id in (1088,32209);
obmysql-PERIOD_ADD-9
obmysql-PERIOD_ADD-9-1
drop procedure p_test;//
CREATE PROCEDURE p_test()
begin
declare a varchar(200);
declare b varchar(200);
declare i int default 0;
SELECT PERIOD_ADD(year_3,10) FROM t1 e WHERE PERIOD_ADD(year_3,10) = '202709' into a;
SELECT PERIOD_ADD(year_3,10) FROM t1 e WHERE PERIOD_ADD(year_3,10) = '202204' into b;
WHILE i < 1 do
INSERT INTO t1 VALUES(0,a,1088,'1985-05-10','05:14:41',1984,'2000-03-23 00:15:01.000','2002-06-20 05:50:54');
INSERT INTO t1 VALUES(0,b,32209,'2005-11-05','07:00:06',2005,'1982-04-20 13:13:32.000','2014-11-24 23:19:45.000');
set i := i + 1;
END while;
END;
//
SELECT COUNT(*) FROM t1;
COUNT(*)
10
CALL p_test();
SELECT COUNT(*) FROM t1;
COUNT(*)
12
delete from t1 where id in (1088,32209);
drop procedure p_test;//
CREATE PROCEDURE p_test(in samplename varchar(200))
begin
declare i int;
declare a varchar(200);
declare b varchar(200);
SELECT PERIOD_ADD(year_3,10) FROM t1 e WHERE PERIOD_ADD(year_3,10) = samplename into a;
SELECT PERIOD_ADD(year_3,10) FROM t1 e WHERE PERIOD_ADD(year_3,10) = samplename into b;
set i := 1;
repeat
INSERT INTO t1 VALUES(0,a,1088,'1985-05-10','05:14:41',1984,'2000-03-23 00:15:01.000','2002-06-20 05:50:54');
INSERT INTO t1 VALUES(0,b,32209,'2005-11-05','07:00:06',2005,'1982-04-20 13:13:32.000','2014-11-24 23:19:45.000');
set i := i+1;
until i >= 2
end	 repeat;
END ;
//
SELECT COUNT(*) FROM t1;
COUNT(*)
10
CALL p_test(500);
CALL p_test(0);
CALL p_test(-1);
CALL p_test('202709');
CALL p_test(NULL);
SELECT COUNT(*) FROM t1;
COUNT(*)
20
delete from t1 where id in (1088,32209);
drop procedure p_test;//
CREATE PROCEDURE p_test(out wb  varchar(200), out wb1  varchar(200))
begin
declare i int;
SELECT PERIOD_ADD(year_3,10) FROM t1 e WHERE TIME_FORMAT(e.time_stp,10) ='2015-01-30 06:13:54' into wb;
SELECT PERIOD_ADD(year_3,10) FROM t1 e WHERE TIME_FORMAT(e.time_stp,10) ='2018-01-20 10:56:17' into wb1;
set i :=  1;
while i <= 1 do
INSERT INTO t1 VALUES(0,wb,1088,'1985-05-10','05:14:41',1984,'2000-03-23 00:15:01.000','2002-06-20 05:50:54');
INSERT INTO t1 VALUES(0,wb1,1088,'1985-05-10','05:14:41',1984,'2000-03-23 00:15:01.000','2002-06-20 05:50:54');
set i := i + 1;
end while;
END;
//
SELECT COUNT(*) FROM t1;
COUNT(*)
10
call p_test(@wb,@wb1);
SELECT COUNT(*) FROM t1;
COUNT(*)
12
delete from t1 where id in (1088,32209);
drop PROCEDURE p_test;//
CREATE PROCEDURE p_test( out wb varchar(200),inout wb1 varchar(200))
begin
declare i int;
SELECT PERIOD_ADD(year_3,10) FROM t1 e WHERE PERIOD_ADD(year_3,10) ='202709' into wb;
SELECT PERIOD_ADD(year_3,10) FROM t1 e WHERE PERIOD_ADD(year_3,10) ='2007-01-10' into wb1;
set i := 1;
while i <= 1 do
INSERT INTO t1 VALUES(0,wb,1088,'1985-05-10','05:14:41',1984,'2000-03-23 00:15:01.000','2002-06-20 05:50:54');
INSERT INTO t1 VALUES(0,wb1,32209,'1985-05-10','05:14:41',1984,'2000-03-23 00:15:01.000','2002-06-20 05:50:54');
set i := i + 1;
end while;
END;
//
SELECT COUNT(*) FROM t1;
COUNT(*)
10
call p_test(@wb,@wb1);
SELECT COUNT(*) FROM t1;
COUNT(*)
12
delete from t1 where id in (1088,32209);
drop procedure p_test;//
CREATE PROCEDURE p_test(OUT wb varchar(200),inout wb1 timestamp ,in wb2 datetime)
begin
declare i int;
SELECT PERIOD_ADD(year_3,10) FROM t1 e WHERE PERIOD_ADD(year_3,10) = '202204' into wb;
set wb1 := '2000-03-23 00:15:01';
set i := 1;
WHILE i < 2 do
INSERT INTO t1 VALUES(0,15879,1088,'1985-05-10','05:14:41',1984,'2000-03-23 00:15:01.000',wb1);
INSERT INTO t1 VALUES(0,488,32209,'1985-05-10','05:14:41',1984,'2000-03-23 00:15:01.000',wb2);
set i := i + 1;
END while;
END;
//
SELECT COUNT(*) FROM t1;
COUNT(*)
10
call p_test(@wb,@wb1,'2015-01-30 06:13:54');
SELECT COUNT(*) FROM t1;
COUNT(*)
12
delete from t1 where id in (1088,32209);
drop procedure p_test;//
create PROCEDURE p_test(in wb varchar(200))
begin
declare i int;
set i := 1;
WHILE i < 2 do
INSERT INTO t1 VALUES(0,15879,1088,'1985-05-10','05:14:41',1984,'2000-03-23 00:15:01.000',wb);
set i := i+1;
END while;
END;
//
SELECT COUNT(*) FROM  t1;
COUNT(*)
10
CALL p_test(PERIOD_ADD(0221,10));
CALL p_test(PERIOD_ADD('202709',10));
CALL p_test(PERIOD_ADD('01',10));
CALL p_test(PERIOD_ADD(NULL,10));
CALL p_test(PERIOD_ADD(1000,10));
SELECT COUNT(*) FROM  t1;
COUNT(*)
15
delete from t1 where id in (1088,32209);
drop function f_test;//
CREATE FUNCTION f_test()
returns varchar(200)
begin
declare a varchar(200);
SELECT PERIOD_ADD(year_3,10) FROM t1 e WHERE PERIOD_ADD(year_3,10)= '202204' into a ;
RETURN a;
END;
//
SELECT f_test() FROM  dual;
f_test()
202204
drop procedure p_test;//
create  PROCEDURE p_test(in wb varchar(200))
begin
declare i int;
set i := 1;
WHILE i <= 1 do
INSERT INTO t1 VALUES(0,15879,1088,'1985-05-10','05:14:41',1984,'2000-03-23 00:15:01.000',wb);
set i := i+1;
END while;
END;
//
CALL p_test(f_test());
SELECT COUNT(*) FROM t1;
COUNT(*)
11
# Clean up users
drop database obwmjtest;
drop user wmj456@'%' ;
