#Environmental cleaning
drop user wmj456@'%';
drop database obwmjtest;
create database obwmjtest;
create user wmj456 identified by 'wmj456';
grant all on *.* to wmj456 WITH GRANT OPTION;
DROP TABLE T1;
# periodadd-2-mysql
CREATE TABLE `t1` (
`id` int NOT NULL AUTO_INCREMENT,
`consumer` char(20) DEFAULT NULL,
`brand` varchar(20) DEFAULT NULL,
`sal` bigint DEFAULT NULL,
PRIMARY KEY (`id`)
);
INSERT INTO t1 VALUES(1,'书局','apple',5000);
INSERT INTO t1 VALUES(2,'微山','xiaomi',-4000);
INSERT INTO t1 VALUES(3,'深咖','oppo',0);
INSERT INTO t1 VALUES(4,'流苏','huawei',NULL);
INSERT INTO t1 VALUES(5,'玻璃','LG',6000);
INSERT INTO t1 VALUES(6,'钛钢','HTC',8000);
INSERT INTO t1 VALUES(7,'合金','VIVO',3500);
DROP TABLE T2;
CREATE TABLE `t2` (
`id` int NOT NULL AUTO_INCREMENT,
`model` varchar(200) DEFAULT NULL,
`Price` bigint DEFAULT NULL,
PRIMARY KEY (`id`)
);
INSERT INTO t2 VALUES(1,'apple 12',7000);
INSERT INTO t2 VALUES(2,'xiaomi 9',0);
INSERT INTO t2 VALUES(3,'oppo findx',-6000);
INSERT INTO t2 VALUES(4,'huawei mata30',8000);
INSERT INTO t2 VALUES(5,'huawei mata30',NULL);
INSERT INTO t2 VALUES(6,'htc cc30',26.44);
INSERT INTO t2 VALUES(7,'shumei xi2',-26.44);
CREATE VIEW t1_view AS SELECT *  FROM t1;
CREATE VIEW t2_view AS SELECT *  FROM t2;
SELECT period_add(e.id,10) FROM t1 e;
period_add(e.id,10)
200011
200012
200101
200102
200103
200104
200105
SELECT period_add(e.consumer,10) FROM t1 e;
period_add(e.consumer,10)
0
0
0
0
0
0
0
Warnings:
Warning	1292	Truncated incorrect INTEGER value: '书局'
Warning	1292	Truncated incorrect INTEGER value: '微山'
Warning	1292	Truncated incorrect INTEGER value: '深咖'
Warning	1292	Truncated incorrect INTEGER value: '流苏'
Warning	1292	Truncated incorrect INTEGER value: '玻璃'
Warning	1292	Truncated incorrect INTEGER value: '钛钢'
Warning	1292	Truncated incorrect INTEGER value: '合金'
SELECT period_add(e.brand,10) FROM t1 e;
period_add(e.brand,10)
0
0
0
0
0
0
0
Warnings:
Warning	1292	Truncated incorrect INTEGER value: 'apple'
Warning	1292	Truncated incorrect INTEGER value: 'xiaomi'
Warning	1292	Truncated incorrect INTEGER value: 'oppo'
Warning	1292	Truncated incorrect INTEGER value: 'huawei'
Warning	1292	Truncated incorrect INTEGER value: 'LG'
Warning	1292	Truncated incorrect INTEGER value: 'HTC'
Warning	1292	Truncated incorrect INTEGER value: 'VIVO'
SELECT * FROM t1 e WHERE period_add(e.sal,10) = '205010';
id	consumer	brand	sal
1	书局	apple	5000
SELECT period_add(e.sal,10) sal,p.Price,period_add(p.Price,10) FROM t1 e LEFT JOIN t2 p ON e.id = p.id ORDER BY e.sal DESC;
sal	Price	period_add(p.Price,10)
198010	26	200212
206010	NULL	NULL
205010	7000	197010
203510	-26	0
0	-6000	0
0	0	0
NULL	8000	198010
SELECT period_add(e.sal,10) sal,period_add(p.Price,10), p.Price FROM t1 e RIGHT JOIN t2 p ON e.id = p.id ORDER BY e.sal DESC;
sal	period_add(p.Price,10)	Price
198010	200212	26
206010	NULL	NULL
205010	197010	7000
203510	0	-26
0	0	-6000
0	0	0
NULL	198010	8000
SELECT period_add(e.sal,10) sal,period_add(p.Price,10), p.Price FROM t1 e INNER JOIN t2 p ON e.id = p.id ORDER BY e.sal DESC;
sal	period_add(p.Price,10)	Price
198010	200212	26
206010	NULL	NULL
205010	197010	7000
203510	0	-26
0	0	-6000
0	0	0
NULL	198010	8000
SELECT * FROM (SELECT e.id,period_add(e.sal,10) sal,period_add(p.Price,10) FROM t1 e LEFT JOIN t2 p ON e.id = p.id ) e ORDER BY e.sal;
id	sal	period_add(p.Price,10)
4	NULL	198010
2	0	0
3	0	0
6	198010	200212
7	203510	0
1	205010	197010
5	206010	NULL
SELECT *  FROM t1 e WHERE period_add(e.sal,10) = ANY (SELECT period_add(p.Price,10) FROM t2 p ) ORDER BY e.id;
id	consumer	brand	sal
2	微山	xiaomi	-4000
3	深咖	oppo	0
6	钛钢	HTC	8000
SELECT *  FROM t1 e WHERE period_add(e.sal,10) < ANY (SELECT period_add(p.Price,10) FROM t2 p ) ORDER BY e.id;
id	consumer	brand	sal
2	微山	xiaomi	-4000
3	深咖	oppo	0
6	钛钢	HTC	8000
SELECT *  FROM t1 e WHERE period_add(e.sal,10) > ANY (SELECT period_add(p.Price,10) FROM t2 p ) ORDER BY e.id;
id	consumer	brand	sal
1	书局	apple	5000
5	玻璃	LG	6000
6	钛钢	HTC	8000
7	合金	VIVO	3500
SELECT *  FROM t1 e WHERE period_add(e.sal,10) < ALL (SELECT period_add(p.Price,10) FROM t2 p ) ORDER BY e.id;
id	consumer	brand	sal
SELECT *  FROM t1 e WHERE period_add(e.sal,10) > ALL (SELECT period_add(p.Price,10) FROM t2 p ) ORDER BY e.id;
id	consumer	brand	sal
SELECT *  FROM t1 e WHERE period_add(e.sal,10) = ALL (SELECT period_add(p.Price,10) FROM t2 p WHERE p.model = 'oppo findx') ORDER BY e.id;
id	consumer	brand	sal
2	微山	xiaomi	-4000
3	深咖	oppo	0
SELECT *  FROM t1 e WHERE EXISTS (SELECT period_add(p.Price,10) FROM t2 p ) ORDER BY e.id;
id	consumer	brand	sal
1	书局	apple	5000
2	微山	xiaomi	-4000
3	深咖	oppo	0
4	流苏	huawei	NULL
5	玻璃	LG	6000
6	钛钢	HTC	8000
7	合金	VIVO	3500
SELECT period_add(e.sal,10)  FROM t1 e WHERE NOT EXISTS (SELECT p.id,p.price FROM t2 p WHERE period_add(p.Price,10)='2000-01-10' ) ORDER BY e.id;
period_add(e.sal,10)
205010
0
0
NULL
206010
198010
203510
Warnings:
Warning	1292	Truncated incorrect DECIMAL value: '2000-01-10'
Warning	1292	Truncated incorrect DECIMAL value: '2000-01-10'
SELECT period_add(e.sal,10)  FROM t1 e WHERE NOT EXISTS (SELECT p.id,p.price FROM t2 p WHERE period_add(p.Price,10)=7500 ) ORDER BY e.id;
period_add(e.sal,10)
205010
0
0
NULL
206010
198010
203510
CREATE TABLE t3 AS SELECT * FROM t1 e WHERE period_add(e.sal,10) ='205010';
DROP TABLE t3;
CREATE TABLE t3 AS SELECT * FROM t1 e WHERE period_add(e.sal,11.1) ='205010';
DROP TABLE t3;
CREATE TABLE t3 AS SELECT * FROM t1 e WHERE period_add(e.sal,0) <=> NUll;
DROP TABLE t3;
SELECT brand, period_add(brand,10) FROM t1 e WHERE e.brand LIKE '%a%';
brand	period_add(brand,10)
apple	0
xiaomi	0
huawei	0
Warnings:
Warning	1292	Truncated incorrect INTEGER value: 'apple'
Warning	1292	Truncated incorrect INTEGER value: 'xiaomi'
Warning	1292	Truncated incorrect INTEGER value: 'huawei'
SELECT sal, period_add(sal,10) FROM t1 e LEFT JOIN t2 p ON e.id = p.id WHERE e.sal LIKE '%00%';
sal	period_add(sal,10)
5000	205010
-4000	0
6000	206010
8000	198010
3500	203510
SELECT * FROM t1 e WHERE period_add(e.sal,10) = 0;
id	consumer	brand	sal
2	微山	xiaomi	-4000
3	深咖	oppo	0
SELECT * FROM t1 e WHERE period_add(e.sal,10) = 1;
id	consumer	brand	sal
SELECT * FROM t1 e WHERE period_add(e.sal,10) = NULL;
id	consumer	brand	sal
SELECT * FROM t1 e WHERE period_add(e.sal,10) <=> NULL;
id	consumer	brand	sal
4	流苏	huawei	NULL
SELECT * FROM t1 e WHERE period_add(e.sal,10) > 0 ORDER BY e.id;
id	consumer	brand	sal
1	书局	apple	5000
5	玻璃	LG	6000
6	钛钢	HTC	8000
7	合金	VIVO	3500
SELECT * FROM t1 e WHERE period_add(e.sal,10) >= 0 ORDER BY e.id;
id	consumer	brand	sal
1	书局	apple	5000
2	微山	xiaomi	-4000
3	深咖	oppo	0
5	玻璃	LG	6000
6	钛钢	HTC	8000
7	合金	VIVO	3500
SELECT * FROM t1 e WHERE period_add(e.sal,10) < 0 ORDER BY e.id;
id	consumer	brand	sal
SELECT * FROM t1 e WHERE period_add(e.sal,10) <= 0 ORDER BY e.id;
id	consumer	brand	sal
2	微山	xiaomi	-4000
3	深咖	oppo	0
SELECT * FROM t1 e WHERE period_add(e.sal,10) <> 0 ORDER BY e.id;
id	consumer	brand	sal
1	书局	apple	5000
5	玻璃	LG	6000
6	钛钢	HTC	8000
7	合金	VIVO	3500
SELECT e.id, e.sal, period_add(e.sal,10) FROM t1 e WHERE e.id > 0 ORDER BY period_add(e.sal,10);
id	sal	period_add(e.sal,10)
4	NULL	NULL
2	-4000	0
3	0	0
6	8000	198010
7	3500	203510
1	5000	205010
5	6000	206010
SELECT e.id, e.sal, period_add(e.sal,10) FROM t1 e WHERE e.id > 0 ORDER BY period_add(e.sal,10) DESC;
id	sal	period_add(e.sal,10)
5	6000	206010
1	5000	205010
7	3500	203510
6	8000	198010
2	-4000	0
3	0	0
4	NULL	NULL
SELECT e.id, e.sal, period_add(e.brand,10) FROM t1 e WHERE e.id > 0 ORDER BY period_add(e.brand,10) ASC;
id	sal	period_add(e.brand,10)
1	5000	0
2	-4000	0
3	0	0
4	NULL	0
5	6000	0
6	8000	0
7	3500	0
Warnings:
Warning	1292	Truncated incorrect INTEGER value: 'apple'
Warning	1292	Truncated incorrect INTEGER value: 'xiaomi'
Warning	1292	Truncated incorrect INTEGER value: 'oppo'
Warning	1292	Truncated incorrect INTEGER value: 'huawei'
Warning	1292	Truncated incorrect INTEGER value: 'LG'
Warning	1292	Truncated incorrect INTEGER value: 'HTC'
Warning	1292	Truncated incorrect INTEGER value: 'VIVO'
Warning	1292	Truncated incorrect INTEGER value: 'apple'
Warning	1292	Truncated incorrect INTEGER value: 'xiaomi'
Warning	1292	Truncated incorrect INTEGER value: 'oppo'
Warning	1292	Truncated incorrect INTEGER value: 'huawei'
Warning	1292	Truncated incorrect INTEGER value: 'LG'
Warning	1292	Truncated incorrect INTEGER value: 'HTC'
Warning	1292	Truncated incorrect INTEGER value: 'VIVO'
SELECT e.id, e.sal, period_add(e.brand,10) FROM t1 e WHERE e.id > 0 ORDER BY period_add(e.brand,10) DESC;
id	sal	period_add(e.brand,10)
1	5000	0
2	-4000	0
3	0	0
4	NULL	0
5	6000	0
6	8000	0
7	3500	0
Warnings:
Warning	1292	Truncated incorrect INTEGER value: 'apple'
Warning	1292	Truncated incorrect INTEGER value: 'xiaomi'
Warning	1292	Truncated incorrect INTEGER value: 'oppo'
Warning	1292	Truncated incorrect INTEGER value: 'huawei'
Warning	1292	Truncated incorrect INTEGER value: 'LG'
Warning	1292	Truncated incorrect INTEGER value: 'HTC'
Warning	1292	Truncated incorrect INTEGER value: 'VIVO'
Warning	1292	Truncated incorrect INTEGER value: 'apple'
Warning	1292	Truncated incorrect INTEGER value: 'xiaomi'
Warning	1292	Truncated incorrect INTEGER value: 'oppo'
Warning	1292	Truncated incorrect INTEGER value: 'huawei'
Warning	1292	Truncated incorrect INTEGER value: 'LG'
Warning	1292	Truncated incorrect INTEGER value: 'HTC'
Warning	1292	Truncated incorrect INTEGER value: 'VIVO'
SELECT e.id, period_add(e.sal,10), SUM(e.sal+p.Price) FROM t1 e ,t2 p WHERE e.id=p.id GROUP BY e.id, period_add(e.sal,10)  ORDER BY e.id;
id	period_add(e.sal,10)	SUM(e.sal+p.Price)
1	205010	12000
2	0	-4000
3	0	-6000
4	NULL	NULL
5	206010	NULL
6	198010	8026
7	203510	3474
SELECT e.id, e.sal,period_add(e.sal,10) tt, SUM(e.sal+p.Price) FROM t1 e ,t2 p WHERE e.id=p.id GROUP BY e.id, period_add(e.sal,10) HAVING tt > -1 ORDER BY e.id;
id	sal	tt	SUM(e.sal+p.Price)
1	5000	205010	12000
2	-4000	0	-4000
3	0	0	-6000
5	6000	206010	NULL
6	8000	198010	8026
7	3500	203510	3474
select id, sal, period_add(case when sal=0 then 200 else sal end, 10) from t1_view ORDER BY id;
id	sal	period_add(case when sal=0 then 200 else sal end, 10)
1	5000	205010
2	-4000	0
3	0	200210
4	NULL	NULL
5	6000	206010
6	8000	198010
7	3500	203510
select id, sal, period_add(case when sal>0 then 200 else sal end, 10) from t1_view order by id;
id	sal	period_add(case when sal>0 then 200 else sal end, 10)
1	5000	200210
2	-4000	0
3	0	0
4	NULL	NULL
5	6000	200210
6	8000	200210
7	3500	200210
select id, sal, period_add(case when sal=0 then 200 else sal end, 10), COUNT(*) from t1_view GROUP by period_add(case when sal=0 then 200 else sal end, 10),id ORDER BY id;
id	sal	period_add(case when sal=0 then 200 else sal end, 10)	COUNT(*)
1	5000	205010	1
2	-4000	0	1
3	0	200210	1
4	NULL	NULL	1
5	6000	206010	1
6	8000	198010	1
7	3500	203510	1
INSERT INTO t2(model,price) SELECT model,price from t2_view WHERE period_add(price,10) = '205010';
SELECT COUNT(*) FROM t2;
COUNT(*)
7
INSERT INTO t2(model,price) SELECT model,price from t2_view WHERE period_add(price,10) = '0';
SELECT COUNT(*) FROM t2;
COUNT(*)
10
UPDATE t2_view SET MODEL = 'xiaomi 10' WHERE period_add(Price,10) = '205010';
UPDATE t2_view SET price = '9000' WHERE period_add(Price,10) < 0;
UPDATE t2_view SET price = (SELECT period_add(t1.sal,10) FROM t1 WHERE period_add(t1.sal,10) = '197010' ) WHERE id = 1 ;
UPDATE t2_view SET price = (period_add('2003',10));
UPDATE t2_view SET price = (period_add(201,10));
UPDATE t2_view SET price = (cast(period_add(201,10) as unsigned integer));
DELETE FROM t2_view WHERE period_add(Price,10) = 0;
SELECT COUNT(*) FROM t2_view;
COUNT(*)
10
DELETE FROM t2_view WHERE period_add(Price,10) = -1;
SELECT COUNT(*) FROM t2_view;
COUNT(*)
10
DELETE FROM t2_view WHERE period_add(Price,10) <= 2;
SELECT COUNT(*) FROM t2_view;
COUNT(*)
10
DROP TABLE t1;
CREATE TABLE `t1` (
`id` int,
`consumer` char(20) DEFAULT NULL,
`price` varchar(20) DEFAULT NULL,
`sal` int DEFAULT NULL,
`datetime1` DATE,
`datetime2` bigint
);
INSERT INTO t1 VALUES(1,'书局','7000',5000,'2020-09-22',20200923121200);
INSERT INTO t1 VALUES(2,'微山','3000',-4000,'2020-09-21',20200921101159);
INSERT INTO t1 VALUES(3,'深咖','5000',0,'2020-08-21',20190821101159);
INSERT INTO t1 VALUES(4,'流苏','0',NULL,'2020-02-29',20200228101159);
INSERT INTO t1 VALUES(5,'玻璃','3200',6000,'2020-02-29',20200228101159);
INSERT INTO t1 VALUES(6,'钛钢',NULL,8000,'2020-02-29',20200228101159);
INSERT INTO t1 VALUES(7,'合金','VIVO',3500,'2020-02-29',20200228101159);
CREATE INDEX index_test ON t1(sal);
CREATE INDEX index_test1 ON t1(price);
CREATE INDEX index_test2 ON t1(consumer);
CREATE INDEX index_test3 ON t1(datetime1);
CREATE INDEX index_test4 ON t1(datetime2);
SELECT * FROM t1;
id	consumer	price	sal	datetime1	datetime2
1	书局	7000	5000	2020-09-22	20200923121200
2	微山	3000	-4000	2020-09-21	20200921101159
3	深咖	5000	0	2020-08-21	20190821101159
4	流苏	0	NULL	2020-02-29	20200228101159
5	玻璃	3200	6000	2020-02-29	20200228101159
6	钛钢	NULL	8000	2020-02-29	20200228101159
7	合金	VIVO	3500	2020-02-29	20200228101159
SELECT sal, period_add(sal,10) FROM t1 order by sal;
sal	period_add(sal,10)
NULL	NULL
-4000	0
0	0
3500	203510
5000	205010
6000	206010
8000	198010
SELECT id, consumer, period_add(sal,10) FROM t1 WHERE period_add(sal,10) = '203510' ORDER BY id DESC;
id	consumer	period_add(sal,10)
7	合金	203510
SELECT id,consumer,period_add(sal,10) FROM t1 WHERE period_add(sal,10) > 0 ORDER BY period_add(sal,10);
id	consumer	period_add(sal,10)
6	钛钢	198010
7	合金	203510
1	书局	205010
5	玻璃	206010
SELECT id,SUM(sal) FROM t1 WHERE period_add(sal,10) > 0 GROUP BY id HAVING SUM(sal) > 3000 ORDER BY id;
id	SUM(sal)
1	5000
5	6000
6	8000
7	3500
SELECT id,SUM(sal) FROM t1 WHERE period_add(sal,10) > 0 GROUP BY id HAVING SUM(sal) > 5000 ORDER BY id;
id	SUM(sal)
5	6000
6	8000
UPDATE t1 SET sal = 10 WHERE period_add(sal,10) = '203510' ;
INSERT INTO t1(consumer,price,sal,datetime1,datetime2) SELECT consumer,price,sal,datetime1,datetime2  FROM t1 WHERE period_add(sal,10)<0;
INSERT INTO t1 VALUES(8,'流苏','9111',period_add(200,10),'2020-02-29 10:11:59',20200228101159);
INSERT INTO t1 VALUES(8,'流苏','9112',period_add('156',10),'2020-02-29 10:11:59',20200228101159);
INSERT INTO t1 VALUES(8,'流苏','9113',period_add(-100,10),'2020-02-29 10:11:59',20200228101159);
INSERT INTO t1 VALUES(8,'流苏','9114',period_add(0,10),'2020-02-29 10:11:59',20200228101159);
INSERT INTO t1 VALUES(8,'流苏','9115',period_add(NULL,10),'2020-02-29 10:11:59',20200228101159);
SELECT COUNT(*)  FROM t1;
COUNT(*)
12
DELETE FROM t1 WHERE period_add(sal,10)='202204';
DROP TABLE t1;
CREATE TABLE `t1` (
`id` int NOT NULL AUTO_INCREMENT,
`consumer` char(20) NOT NULL,
`price` varchar(20) DEFAULT NULL,
`sal` int DEFAULT NULL,
`datetime1` DATE,
`datetime2` bigint,
PRIMARY KEY (`id`),
UNIQUE KEY `t1_UN` (`price`)
);
INSERT INTO t1 VALUES(1,'书局','7000',5000,'2020-09-22',20200923121200);
INSERT INTO t1 VALUES(2,'微山','3000',-4000,'2020-09-21',20200921101159);
INSERT INTO t1 VALUES(3,'深咖','5000',0,'2020-08-21',20190821101159);
INSERT INTO t1 VALUES(4,'流苏','0',NULL,'2020-02-29',20200228101159);
INSERT INTO t1 VALUES(5,'玻璃','3200',6000,'2020-02-29',20200228101159);
INSERT INTO t1 VALUES(6,'钛钢',NULL,8000,'2020-02-29',20200228101159);
INSERT INTO t1 VALUES(7,'合金','VIVO',3500,'2020-02-29',20200228101159);
SELECT period_add(price,10) FROM t1 order by id;
period_add(price,10)
197010
203010
205010
0
203210
NULL
0
Warnings:
Warning	1292	Truncated incorrect INTEGER value: 'VIVO'
SELECT period_add(sal,10) FROM t1 order by id;
period_add(sal,10)
205010
0
0
NULL
206010
198010
203510
SELECT period_add(datetime1,10), period_add(datetime2,10), period_add(sal,10), period_add(price,10) FROM t1 order by id;
period_add(datetime1,10)	period_add(datetime2,10)	period_add(sal,10)	period_add(price,10)
20201108	20200923121210	205010	197010
20201107	20200921101609	0	203010
20201007	20190821101609	0	205010
20200503	20200228101609	NULL	0
20200503	20200228101609	206010	203210
20200503	20200228101609	198010	NULL
20200503	20200228101609	203510	0
Warnings:
Warning	1292	Truncated incorrect INTEGER value: 'VIVO'
SELECT id, consumer, period_add(sal,10), period_add(price,10) FROM t1 WHERE period_add(sal,10)>0 ORDER BY id DESC;
id	consumer	period_add(sal,10)	period_add(price,10)
7	合金	203510	0
6	钛钢	198010	NULL
5	玻璃	206010	203210
1	书局	205010	197010
Warnings:
Warning	1292	Truncated incorrect INTEGER value: 'VIVO'
SELECT id,consumer, period_add(sal,10), period_add(price,10) FROM t1 WHERE period_add(sal,10)<0 ORDER BY period_add(sal,10);
id	consumer	period_add(sal,10)	period_add(price,10)
SELECT id, sal,SUM(period_add(sal,10)) FROM t1 WHERE t1.sal <> 6000 GROUP BY sal,id HAVING SUM(period_add(sal,10)) > 0 ORDER BY id;
id	sal	SUM(period_add(sal,10))
1	5000	205010
6	8000	198010
7	3500	203510
SELECT price, sal FROM t1;
price	sal
7000	5000
3000	-4000
5000	0
0	NULL
3200	6000
NULL	8000
VIVO	3500
UPDATE t1 SET sal = 10 WHERE period_add(sal,10) = '202204' ;
SELECT COUNT(*) FROM t1;
COUNT(*)
7
INSERT INTO t1 VALUES(0,'流苏_insert1',period_add('200',10),period_add(200,10),'2020-02-29 10:11:59',20200228101159);
INSERT INTO t1 VALUES(0,'流苏_insert2',2,period_add('156',10),'2020-02-29 10:11:59',20200228101159);
INSERT INTO t1 VALUES(0,'流苏_insert3',3,period_add(-100,10),'2020-02-29 10:11:59',20200228101159);
INSERT INTO t1 VALUES(0,'流苏_insert4',period_add(NULL,10),period_add(0,10),'2020-02-29 10:11:59',20200228101159);
INSERT INTO t1 VALUES(0,'流苏_insert5','9115',period_add(NULL,10),'2020-02-29 10:11:59',20200228101159);
SELECT COUNT(*)  FROM t1;
COUNT(*)
12
DELETE FROM t1 WHERE CAST(period_add('2020-02-28 10:11:59',10) AS UNSIGNED INTEGER)= 20000110;
SELECT COUNT(*)  FROM t1;
COUNT(*)
12
DROP VIEW t2_view;
DROP VIEW t1_view;
DROP TABLE t1;
DROP TABLE t2;
DROP TABLE t3;
DROP TABLE t1;
CREATE TABLE t1 (
a INT,
c_time VARCHAR(50),
d_time VARCHAR(101) GENERATED ALWAYS AS (period_add(c_time,10))
);
CREATE UNIQUE INDEX idx_t1 ON T1(d_time);
DROP INDEX idx_t1 ON t1;
CREATE INDEX idx_t1 ON T1(d_time);
INSERT INTO T1(A,C_TIME) VALUES(1,'202001');
INSERT INTO T1(A,C_TIME) VALUES(2,'201');
INSERT INTO T1(A,C_TIME) VALUES(3,'2020-02-29');
INSERT INTO T1(A,C_TIME) VALUES(4,0);
INSERT INTO T1(A,C_TIME) VALUES(5,'甲骨文');
DROP TABLE t1;
CREATE TABLE t1 (
a INT AUTO_INCREMENT PRIMARY KEY,
c_time VARCHAR(50),
d_time int GENERATED ALWAYS AS (period_add(c_time-10, 10))
);
CREATE INDEX idx_t1 ON T1(d_time);
INSERT INTO T1(A,C_TIME) VALUES(1,'202001');
INSERT INTO T1(A,C_TIME) VALUES(2,'201');
INSERT INTO T1(A,C_TIME) VALUES(3,'2020-02-29');
INSERT INTO T1(A,C_TIME) VALUES(4,0);
INSERT INTO T1(A,C_TIME) VALUES(5,'甲骨文');
DROP TABLE t1;
CREATE TABLE t1 (
a INT AUTO_INCREMENT PRIMARY KEY,
c_time VARCHAR(50),
d_time int GENERATED ALWAYS AS (period_add(c_time,(10+10)))
);
CREATE INDEX idx_t1 ON T1(d_time);
INSERT INTO T1(A,C_TIME) VALUES(1,'202001');
INSERT INTO T1(A,C_TIME) VALUES(2,'201');
INSERT INTO T1(A,C_TIME) VALUES(3,'2020-02-29');
INSERT INTO T1(A,C_TIME) VALUES(4,0);
INSERT INTO T1(A,C_TIME) VALUES(5,'甲骨文');
INSERT INTO T1(A,C_TIME) VALUES(6,100+20011);
DROP TABLE t1;
CREATE TABLE t1 (
a INT AUTO_INCREMENT PRIMARY KEY,
c_time VARCHAR(50),
d_time int GENERATED ALWAYS AS (period_add(c_time,10))
);
CREATE INDEX idx_t1 ON T1(d_time);
INSERT INTO T1(A,C_TIME) VALUES(1,'202001');
INSERT INTO T1(A,C_TIME) VALUES(2,'201');
INSERT INTO T1(A,C_TIME) VALUES(3,0);
INSERT INTO T1(A,C_TIME) VALUES(4,100+20011);
DROP TABLE t1;
CREATE TABLE t1 (
a INT AUTO_INCREMENT PRIMARY KEY,
c_time VARCHAR(50),
d_time timestamp GENERATED ALWAYS AS (period_add(c_time,10))
);
CREATE INDEX idx_t1 ON T1(d_time);
INSERT INTO T1(A,C_TIME) VALUES(1,'202001');
INSERT INTO T1(A,C_TIME) VALUES(2,'2001');
INSERT INTO T1(A,C_TIME) VALUES(3,0);
INSERT INTO T1(A,C_TIME) VALUES(4,100+20011);
DROP TABLE t1;
CREATE TABLE t1 (
a INT AUTO_INCREMENT PRIMARY KEY,
c_time timestamp,
d_time varchar(101) GENERATED ALWAYS AS (period_add(c_time,10))
);
CREATE INDEX idx_t1 ON T1(d_time);
INSERT INTO T1(A,C_TIME) VALUES(1,'2020-02-29 10:11:59');
INSERT INTO T1(A,C_TIME) VALUES(2,'09:10:05');
INSERT INTO T1(A,C_TIME) VALUES(3,0);
INSERT INTO T1(A,C_TIME) VALUES(4,100+20011);
DROP TABLE t1;
CREATE TABLE t1 (
a INT AUTO_INCREMENT PRIMARY KEY,
c_time timestamp,
d_time varchar(101) GENERATED ALWAYS AS (period_add(c_time,10) + 123456789)
);
CREATE INDEX idx_t1 ON T1(d_time);
INSERT INTO T1(A,C_TIME) VALUES(1,'202001');
INSERT INTO T1(A,C_TIME) VALUES(2,'09:10:05');
INSERT INTO T1(A,C_TIME) VALUES(3,0);
INSERT INTO T1(A,C_TIME) VALUES(4,100+20011);
DROP TABLE t1;
CREATE TABLE t1 (
a INT AUTO_INCREMENT PRIMARY KEY,
c_time varchar(50),
d_time varchar(50) GENERATED ALWAYS AS (case when period_add(c_time,10) > "20210706" then "now" when period_add(c_time,10) <= "20210706" then 'yesterday' end)
);
CREATE INDEX idx_t1 ON T1(d_time);
INSERT INTO T1(A,C_TIME) VALUES(1,'2022');
INSERT INTO T1(A,C_TIME) VALUES(2,'2019');
INSERT INTO T1(A,C_TIME) VALUES(3,NULL);
INSERT INTO T1(A,C_TIME) VALUES(4,0);
# periodadd-3-mysql
# 内置转换
DROP TABLE t2;
CREATE TABLE t2 (
time_stp timestamp
);
INSERT INTO T2 VALUES('2013-05-22 18:32:37.000');
DROP TABLE T1;
CREATE TABLE `t1` (
a bigint DEFAULT NULL,
b float DEFAULT NULL,
c double DEFAULT NULL,
d date DEFAULT NULL,
e time DEFAULT NULL,
f year DEFAULT NULL,
g timestamp,
h char(20) DEFAULT NULL,
i varchar(20) DEFAULT NULL,
j text DEFAULT NULL
);
INSERT INTO T1(a) values(period_add((select time_stp from t2),10));
INSERT INTO T1(a) values(period_add(201,10));
INSERT INTO T1(a) values(period_add(0.4,10));
INSERT INTO T1(b) values(period_add((select time_stp from t2),10));
INSERT INTO T1(b) values(period_add(201,10));
INSERT INTO T1(b) values(period_add(0.4,10));
INSERT INTO T1(c) values(period_add((select time_stp from t2),10));
INSERT INTO T1(c) values(period_add(201,10));
INSERT INTO T1(c) values(period_add(0.4,10));
INSERT INTO T1(d) values(period_add((select time_stp from t2),10));
INSERT INTO T1(d) values(period_add(201,10));
INSERT INTO T1(d) values(period_add(0.4,10));
INSERT INTO T1(e) values(period_add((select time_stp from t2),10));
INSERT INTO T1(e) values(period_add(201,10));
INSERT INTO T1(e) values(period_add(0.4,10));
INSERT INTO T1(f) values(period_add((select time_stp from t2),10));
INSERT INTO T1(f) values(period_add(201,10));
INSERT INTO T1(f) values(period_add(0.4,10));
INSERT INTO T1(g) values(period_add((select time_stp from t2),10));
INSERT INTO T1(g) values(period_add(201,10));
INSERT INTO T1(g) values(period_add(0.4,10));
INSERT INTO T1(h) values(period_add((select time_stp from t2),10));
INSERT INTO T1(h) values(period_add(201,10));
INSERT INTO T1(h) values(period_add(0.4,10));
INSERT INTO T1(i) values(period_add((select time_stp from t2),10));
INSERT INTO T1(i) values(period_add(201,10));
INSERT INTO T1(i) values(period_add(0.4,10));
INSERT INTO T1(j) values(period_add((select time_stp from t2),10));
INSERT INTO T1(j) values(period_add(201,10));
INSERT INTO T1(j) values(period_add(0.4,10));
TRUNCATE TABLE T1;
INSERT INTO T1(a) values(period_add((select time_stp from t2),10));
UPDATE T1 SET A = (period_add((select time_stp from t2),10));
UPDATE T1 SET A = (period_add(201,10));
UPDATE T1 SET A = (period_add(0.4,10));
SELECT a FROM T1;
a
0
UPDATE T1 SET B = (period_add((select time_stp from t2),10));
UPDATE T1 SET B = (period_add(201,10));
UPDATE T1 SET B = (period_add(0.4,10));
SELECT B FROM T1;
B
0
UPDATE T1 SET C = (period_add((select time_stp from t2),10));
UPDATE T1 SET c = (period_add(201,10));
UPDATE T1 SET c = (period_add(0.4,10));
SELECT c FROM T1;
c
0
UPDATE T1 SET d = (period_add((select time_stp from t2),10));
UPDATE T1 SET d = (period_add(201,10));
UPDATE T1 SET d = (period_add(0.4,10));
SELECT d FROM T1;
d
0000-00-00
UPDATE T1 SET e = (period_add((select time_stp from t2),10));
UPDATE T1 SET e = (period_add(201,10));
UPDATE T1 SET e = (period_add(0.4,10));
SELECT e FROM T1;
e
00:00:00
UPDATE T1 SET f = (period_add((select time_stp from t2),10));
UPDATE T1 SET f = (period_add(201,10));
UPDATE T1 SET f = (period_add(0.4,10));
SELECT f FROM T1;
f
0000
UPDATE T1 SET g = (period_add((select time_stp from t2),10));
UPDATE T1 SET g = (period_add(201,10));
UPDATE T1 SET g = (period_add(0.4,10));
SELECT g FROM T1;
g
0000-00-00 00:00:00
UPDATE T1 SET h = (period_add((select time_stp from t2),10));
UPDATE T1 SET h = (period_add(201,10));
UPDATE T1 SET h = (period_add(0.4,10));
SELECT h FROM T1;
h
0
UPDATE T1 SET i = (period_add((select time_stp from t2),10));
UPDATE T1 SET i = (period_add(201,10));
UPDATE T1 SET i = (period_add(0.4,10));
SELECT i FROM T1;
i
0
UPDATE T1 SET j = (period_add((select time_stp from t2),10));
UPDATE T1 SET j = (period_add(201,10));
UPDATE T1 SET j = (period_add(0.4,10));
SELECT j FROM T1;
j
0
# periodadd-4-mysql
# 函数嵌套
DROP TABLE t1;
CREATE TABLE T1(
a bigint,
b varchar(30),
c timestamp
)PARTITION BY RANGE(a)
(
PARTITION id_part1 values less than (3),
PARTITION id_part2 values less than (8),
PARTITION id_part3 values less than (MAXVALUE)
);
insert into t1 values (1, CAST(period_add(2012,10) AS UNSIGNED INTEGER), '2013-05-22 18:32:37.000');
insert into t1 values (2, null , '1992-01-02 23:51:32.000');
insert into t1 values (4, hour(period_add('1995',10)), '1980-12-03 01:08:01.000');
insert into t1 values(11, (select period_add(e.c,10) from t1 e where a=3),  '2006-08-09 03:20:51');
insert into t1 values (period_add(201,10), '2006-08-09 03:20:51', '2015-01-30 06:13:54.000');
update t1 set b = period_add(STR_TO_DATE('2014-January-1st', '%Y-%M-%d'),10) where a = 3;
# 分区表
DROP TABLE t1;
CREATE TABLE T1(
a bigint,
b datetime
)partition by range columns(b) subpartition by hash(a) subpartitions 2
( 
partition part_1 values less than ('2016-09-01'),
partition part_2 values less than ('2020-09-01'),
partition part_3 values less than ('2021-09-01')
);
insert into t1 values(LENGTH(period_add('1995',10)),'1995-12-02 22:30:27');
insert into t1 values(ROUND(period_add('2006',10)), '2006-08-09 03:20:51');
insert into t1 values(CEIL(period_add('2006',10)), '2006-03-31 14:45:32');
insert into t1 values(FLOOR(period_add('2016',10)), '2016-03-19 13:22:51');
insert into t1 values(ABS(period_add('2010',10)), '2010-12-03 16:03:03');
insert into t1 values(NEG(period_add('1992',10)), '1992-01-02 23:51:32');
insert into t1 values(SIGN(period_add('1980',10)), '1980-12-03 01:08:01.000');
insert into t1 values(11,null);
select least(period_add(b,10), '1987-06-28 02:24:22.000', sign(null)) from t1;
least(period_add(b,10), '1987-06-28 02:24:22.000', sign(null))
NULL
NULL
NULL
NULL
NULL
NULL
NULL
NULL
select least(period_add(b,10), '1987-06-28 02:24:22.000') from t1;
least(period_add(b,10), '1987-06-28 02:24:22.000')
1987
1987
1987
1987
1987
1987
1987
NULL
Warnings:
Warning	1292	Truncated incorrect DECIMAL value: '1987-06-28 02:24:22.000'
Warning	1292	Truncated incorrect DOUBLE value: '1987-06-28 02:24:22.000'
Warning	1292	Truncated incorrect DECIMAL value: '1987-06-28 02:24:22.000'
Warning	1292	Truncated incorrect DOUBLE value: '1987-06-28 02:24:22.000'
Warning	1292	Truncated incorrect DECIMAL value: '1987-06-28 02:24:22.000'
Warning	1292	Truncated incorrect DOUBLE value: '1987-06-28 02:24:22.000'
Warning	1292	Truncated incorrect DECIMAL value: '1987-06-28 02:24:22.000'
Warning	1292	Truncated incorrect DOUBLE value: '1987-06-28 02:24:22.000'
Warning	1292	Truncated incorrect DECIMAL value: '1987-06-28 02:24:22.000'
Warning	1292	Truncated incorrect DOUBLE value: '1987-06-28 02:24:22.000'
Warning	1292	Truncated incorrect DECIMAL value: '1987-06-28 02:24:22.000'
Warning	1292	Truncated incorrect DOUBLE value: '1987-06-28 02:24:22.000'
Warning	1292	Truncated incorrect DECIMAL value: '1987-06-28 02:24:22.000'
Warning	1292	Truncated incorrect DOUBLE value: '1987-06-28 02:24:22.000'
select * from t1 where period_add(b,10) is null;
a	b
11	NULL
select * from t1 where period_add(b,10) is not null;
a	b
6	1995-12-02 22:30:27
202104	2006-08-09 03:20:51
202104	2006-03-31 14:45:32
202202	2016-03-19 13:22:51
202108	2010-12-03 16:03:03
-202706	1992-01-02 23:51:32
1	1980-12-03 01:08:01
SELECT * FROM T1 WHERE A = CAST(period_add('09:10:05',10) AS UNSIGNED INTEGER);
a	b
Warnings:
Warning	1292	Truncated incorrect INTEGER value: '09:10:05'
Warning	1292	Truncated incorrect INTEGER value: '09:10:05'
Warning	1292	Truncated incorrect INTEGER value: '09:10:05'
Warning	1292	Truncated incorrect INTEGER value: '09:10:05'
Warning	1292	Truncated incorrect INTEGER value: '09:10:05'
SELECT * FROM T1 WHERE A > CAST(period_add('09:10:05',10) AS UNSIGNED INTEGER) ORDER BY B;
a	b
202104	2006-03-31 14:45:32
202104	2006-08-09 03:20:51
202108	2010-12-03 16:03:03
202202	2016-03-19 13:22:51
Warnings:
Warning	1292	Truncated incorrect INTEGER value: '09:10:05'
Warning	1292	Truncated incorrect INTEGER value: '09:10:05'
Warning	1292	Truncated incorrect INTEGER value: '09:10:05'
Warning	1292	Truncated incorrect INTEGER value: '09:10:05'
Warning	1292	Truncated incorrect INTEGER value: '09:10:05'
Warning	1292	Truncated incorrect INTEGER value: '09:10:05'
Warning	1292	Truncated incorrect INTEGER value: '09:10:05'
Warning	1292	Truncated incorrect INTEGER value: '09:10:05'
Warning	1292	Truncated incorrect INTEGER value: '09:10:05'
Warning	1292	Truncated incorrect INTEGER value: '09:10:05'
SELECT * FROM T1 WHERE A < CAST(period_add('09:10:05',10) AS UNSIGNED INTEGER) ORDER BY B;
a	b
11	NULL
1	1980-12-03 01:08:01
-202706	1992-01-02 23:51:32
6	1995-12-02 22:30:27
Warnings:
Warning	1292	Truncated incorrect INTEGER value: '09:10:05'
Warning	1292	Truncated incorrect INTEGER value: '09:10:05'
Warning	1292	Truncated incorrect INTEGER value: '09:10:05'
Warning	1292	Truncated incorrect INTEGER value: '09:10:05'
Warning	1292	Truncated incorrect INTEGER value: '09:10:05'
Warning	1292	Truncated incorrect INTEGER value: '09:10:05'
Warning	1292	Truncated incorrect INTEGER value: '09:10:05'
Warning	1292	Truncated incorrect INTEGER value: '09:10:05'
Warning	1292	Truncated incorrect INTEGER value: '09:10:05'
Warning	1292	Truncated incorrect INTEGER value: '09:10:05'
SELECT * FROM T1 WHERE B < period_add('2012',10) ORDER BY B;
a	b
SELECT * FROM T1 WHERE B <= period_add('2012',10) ORDER BY B;
a	b
SELECT * FROM T1 WHERE B > period_add('2012',10) ORDER BY B;
a	b
1	1980-12-03 01:08:01
-202706	1992-01-02 23:51:32
6	1995-12-02 22:30:27
202104	2006-03-31 14:45:32
202104	2006-08-09 03:20:51
202108	2010-12-03 16:03:03
202202	2016-03-19 13:22:51
SELECT * FROM T1 WHERE B != period_add('2012',10) ORDER BY B;
a	b
1	1980-12-03 01:08:01
-202706	1992-01-02 23:51:32
6	1995-12-02 22:30:27
202104	2006-03-31 14:45:32
202104	2006-08-09 03:20:51
202108	2010-12-03 16:03:03
202202	2016-03-19 13:22:51
TRUNCATE TABLE T1;
insert into t1 values(12,'2021-07-07 11:57:49.000001');
insert into t1 values(13,'2021-07-07 11:57:49.00002');
SELECT * FROM T1 WHERE B <= period_add('2021',10) ORDER BY B;
a	b
SELECT * FROM T1 WHERE B > period_add('2021',10) ORDER BY B;
a	b
12	2021-07-07 11:57:49
13	2021-07-07 11:57:49
SELECT * FROM T1 WHERE B < period_add('2021',10) ORDER BY B;
a	b
SELECT * FROM T1 WHERE B = period_add('2021',10) ORDER BY B;
a	b
SELECT * FROM T1 WHERE B = period_add('2021',10) ORDER BY B;
a	b
SET timestamp=1626061421;
SELECT period_add((DATE_ADD(current_timestamp(), INTERVAL '01 05:05:65.000065' DAY_MICROSECOND)),10);
period_add((DATE_ADD(current_timestamp(), INTERVAL '01 05:05:65.000065' DAY_MICROSECOND)),10)
20210713165308
SELECT period_add(b * 10,10) FROM t1 ;
period_add(b * 10,10)
202107071158204
202107071158204
SELECT period_add(b + 1500,10) FROM t1 ;
period_add(b + 1500,10)
20210707117611
20210707117611
SELECT period_add(b - 1000,10) FROM t1;
period_add(b - 1000,10)
20210707115111
20210707115111
SELECT period_add(b / 1500,10) FROM t1 ;
period_add(b / 1500,10)
13473805106
13473805106
SELECT period_add(b / 1500 * 10,10) FROM t1;
period_add(b / 1500 * 10,10)
134738047712
134738047712
SELECT period_add(b * 10 - 0.1,10) FROM t1;
period_add(b * 10 - 0.1,10)
202107071158204
202107071158204
SELECT period_add(b * 0.221 - 0.1,10) FROM t1 ;
period_add(b * 0.221 - 0.1,10)
4466566273206
4466566273206
SELECT period_add(b % 3,10) FROM t1 ;
period_add(b % 3,10)
200011
200011
SELECT period_add(b * 0,10) FROM t1 ;
period_add(b * 0,10)
0
0
SELECT period_add(b * NULL,10) FROM t1 ;
period_add(b * NULL,10)
NULL
NULL
SELECT period_add(b - 0.111,10) FROM t1 ;
period_add(b - 0.111,10)
20210707116111
20210707116111
SELECT period_add('2003',10) > period_add('2003',9) FROM DUAL;
period_add('2003',10) > period_add('2003',9)
1
SELECT period_add('2003',10) < period_add('2003',9) FROM DUAL;
period_add('2003',10) < period_add('2003',9)
0
SELECT period_add('2003',10) = period_add('2003',10) FROM DUAL;
period_add('2003',10) = period_add('2003',10)
1
SELECT period_add('2003',10) <=> period_add(NULL,10)  FROM DUAL;
period_add('2003',10) <=> period_add(NULL,10)
0
SELECT period_add(null,10) <=> period_add(NULL,10)  FROM DUAL;
period_add(null,10) <=> period_add(NULL,10)
1
SELECT '2013-12-31 12:00:00' BETWEEN period_add('2003',10) AND period_add('2023',10) FROM DUAL;
'2013-12-31 12:00:00' BETWEEN period_add('2003',10) AND period_add('2023',10)
0
Warnings:
Warning	1292	Truncated incorrect DECIMAL value: '2013-12-31 12:00:00'
SELECT '2013-12-31' BETWEEN period_add('2003',0) AND period_add('2013',20) FROM DUAL;
'2013-12-31' BETWEEN period_add('2003',0) AND period_add('2013',20)
0
Warnings:
Warning	1292	Truncated incorrect DECIMAL value: '2013-12-31'
SELECT '2013-12-31 12:00:00' BETWEEN period_add('2003',1) AND period_add('2023',1) FROM DUAL;
'2013-12-31 12:00:00' BETWEEN period_add('2003',1) AND period_add('2023',1)
0
Warnings:
Warning	1292	Truncated incorrect DECIMAL value: '2013-12-31 12:00:00'
SELECT period_add('09:10:05',10) OR period_add('09:10:06',10) FROM DUAL;
period_add('09:10:05',10) OR period_add('09:10:06',10)
1
Warnings:
Warning	1292	Truncated incorrect INTEGER value: '09:10:05'
SELECT period_add('09:10:05',10) OR period_add(201,10) FROM DUAL;
period_add('09:10:05',10) OR period_add(201,10)
1
Warnings:
Warning	1292	Truncated incorrect INTEGER value: '09:10:05'
SELECT period_add(201,10) or period_add('09:10:05',10) FROM DUAL;
period_add(201,10) or period_add('09:10:05',10)
1
SELECT period_add(NULL,10) or period_add('09:10:05',10) FROM DUAL;
period_add(NULL,10) or period_add('09:10:05',10)
1
Warnings:
Warning	1292	Truncated incorrect INTEGER value: '09:10:05'
SELECT period_add(NULL,10) and period_add('09:10:05',10) FROM DUAL;
period_add(NULL,10) and period_add('09:10:05',10)
NULL
Warnings:
Warning	1292	Truncated incorrect INTEGER value: '09:10:05'
SELECT period_add('09:10:05',10) and period_add(NULL,10) FROM DUAL;
period_add('09:10:05',10) and period_add(NULL,10)
NULL
Warnings:
Warning	1292	Truncated incorrect INTEGER value: '09:10:05'
SELECT period_add(301,10) OR period_add(201,10) FROM DUAL;
period_add(301,10) OR period_add(201,10)
1
SELECT NOT period_add(301,10) FROM DUAL;
NOT period_add(301,10)
0
SELECT NOT period_add(NULL,10) FROM DUAL;
NOT period_add(NULL,10)
NULL
SELECT NOT period_add(0,10) FROM DUAL;
NOT period_add(0,10)
1
SELECT !period_add(0,10) FROM DUAL;
!period_add(0,10)
1
SELECT !period_add(301,10) FROM DUAL;
!period_add(301,10)
0
SELECT !period_add('2003-12-31 12:00:00',10) FROM DUAL;
!period_add('2003-12-31 12:00:00',10)
0
Warnings:
Warning	1292	Truncated incorrect INTEGER value: '2003-12-31 12:00:00'
SELECT period_add('2003',10) xor period_add('2003',10) FROM DUAL;
period_add('2003',10) xor period_add('2003',10)
0
SELECT period_add('2003',10) xor period_add(null,10) FROM DUAL;
period_add('2003',10) xor period_add(null,10)
NULL
SELECT period_add(201,10) xor period_add('2003',10) FROM DUAL;
period_add(201,10) xor period_add('2003',10)
0
SELECT period_add('2003',10) xor period_add(0,10) FROM DUAL;
period_add('2003',10) xor period_add(0,10)
1
SELECT (period_add('2003',10)) ^ (period_add(0,10)) FROM DUAL;
(period_add('2003',10)) ^ (period_add(0,10))
202101
SELECT period_add('2003',10) ^ period_add(201,10) FROM DUAL;
period_add('2003',10) ^ period_add(201,10)
7014
SELECT period_add('2003',10) ^ period_add('2012',10) FROM DUAL;
period_add('2003',10) ^ period_add('2012',10)
11
SELECT period_add('2003',10) >> period_add(201,10) FROM DUAL;
period_add('2003',10) >> period_add(201,10)
0
SELECT period_add('2003',10) << period_add(201,10) FROM DUAL;
period_add('2003',10) << period_add(201,10)
0
SELECT ~period_add(201,10) FROM DUAL;
~period_add(201,10)
18446744073709351404
SELECT ~period_add('2003',10) FROM DUAL;
~period_add('2003',10)
18446744073709349514
SELECT ~period_add(0,10) FROM DUAL;
~period_add(0,10)
18446744073709551615
SELECT period_add('0910',10) > period_add('0916',10) FROM DUAL;
period_add('0910',10) > period_add('0916',10)
0
SELECT period_add('0910',10) < period_add('0916',10) FROM DUAL;
period_add('0910',10) < period_add('0916',10)
1
SELECT period_add('09:10',10) <> period_add('09:10',10) FROM DUAL;
period_add('09:10',10) <> period_add('09:10',10)
0
Warnings:
Warning	1292	Truncated incorrect INTEGER value: '09:10'
SELECT period_add('0900',10) + 123456 FROM DUAL;
period_add('0900',10) + 123456
324366
SELECT period_add('0900',0) - 133444 FROM DUAL;
period_add('0900',0) - 133444
67368
SELECT period_add('0910',10) - 123.456 FROM dual;
period_add('0910',10) - 123.456
200884.544
SELECT period_add('0905',10) - 123456 FROM dual;
period_add('0905',10) - 123456
77547
SELECT period_add('2003',10) * 1024 FROM DUAL;
period_add('2003',10) * 1024
206951424
SELECT period_add('2003',10) - 1.175494351E-38 FROM DUAL;
period_add('2003',10) - 1.175494351E-38
202101
SELECT 1.175494351E-38 - period_add('2003',10) FROM DUAL;
1.175494351E-38 - period_add('2003',10)
-202101
SELECT -3.402823466E+38 - period_add('2003',10) FROM DUAL;
-3.402823466E+38 - period_add('2003',10)
-3.402823466e38
SELECT 2.2250738585072014E-308  - period_add('2003',10) FROM DUAL;
2.2250738585072014E-308  - period_add('2003',10)
-202101
SELECT period_add('2003',10) + 1.7976931348623157E+308 FROM DUAL;
period_add('2003',10) + 1.7976931348623157E+308
1.7976931348623157e308
SELECT period_add('2003',10) + '0000-12-25' FROM DUAL;
period_add('2003',10) + '0000-12-25'
202101
Warnings:
Warning	1292	Truncated incorrect DOUBLE value: '0000-12-25'
# Clean up users
drop database obwmjtest;
drop user wmj456@'%' ;
