#Environmental cleaning
drop user wmj456@'%';
drop database obwmjtest;
create database obwmjtest;
create user wmj456 identified by 'wmj456';
grant all on *.* to wmj456 WITH GRANT OPTION;
# timeformat-2-mysql
DROP TABLE T2;
DROP TABLE  T1;
CREATE TABLE `t1` (
`id` int NOT NULL AUTO_INCREMENT,
`consumer` char(20) DEFAULT NULL,
`brand` varchar(20) DEFAULT NULL,
`sal` bigint DEFAULT NULL,
PRIMARY KEY (`id`)
);
INSERT INTO t1 VALUES(1,'书局','apple',5000);
INSERT INTO t1 VALUES(2,'微山','xiaomi',-4000);
INSERT INTO t1 VALUES(3,'深咖','oppo',0);
INSERT INTO t1 VALUES(4,'流苏','huawei',NULL);
INSERT INTO t1 VALUES(5,'玻璃','LG',6000);
INSERT INTO t1 VALUES(6,'钛钢','HTC',8000);
INSERT INTO t1 VALUES(7,'合金','VIVO',3500);
DROP TABLE T2;
CREATE TABLE `t2` (
`id` int NOT NULL AUTO_INCREMENT,
`model` varchar(200) DEFAULT NULL,
`Price` bigint DEFAULT NULL,
PRIMARY KEY (`id`)
);
INSERT INTO t2 VALUES(1,'apple 12',7000);
INSERT INTO t2 VALUES(2,'xiaomi 9',0);
INSERT INTO t2 VALUES(3,'oppo findx',-6000);
INSERT INTO t2 VALUES(4,'huawei mata30',8000);
INSERT INTO t2 VALUES(5,'huawei mata30',NULL);
INSERT INTO t2 VALUES(6,'htc cc30',26.44);
INSERT INTO t2 VALUES(7,'shumei xi2',-26.44);
DROP VIEW T1_VIEW;
DROP VIEW T2_VIEW;
CREATE VIEW t1_view AS SELECT *  FROM t1;
CREATE VIEW t2_view AS SELECT *  FROM t2;
SELECT TIME_FORMAT(e.id, '%r %T %H %k %I %i %s %f') FROM t1 e;
TIME_FORMAT(e.id, '%r %T %H %k %I %i %s %f')
12:00:01 AM 00:00:01 00 0 12 00 01 000000
12:00:02 AM 00:00:02 00 0 12 00 02 000000
12:00:03 AM 00:00:03 00 0 12 00 03 000000
12:00:04 AM 00:00:04 00 0 12 00 04 000000
12:00:05 AM 00:00:05 00 0 12 00 05 000000
12:00:06 AM 00:00:06 00 0 12 00 06 000000
12:00:07 AM 00:00:07 00 0 12 00 07 000000
SELECT TIME_FORMAT(e.consumer, '%r %T %H %k %I %i %s %f') FROM t1 e;
TIME_FORMAT(e.consumer, '%r %T %H %k %I %i %s %f')
12:00:00 AM 00:00:00 00 0 12 00 00 000000
12:00:00 AM 00:00:00 00 0 12 00 00 000000
12:00:00 AM 00:00:00 00 0 12 00 00 000000
12:00:00 AM 00:00:00 00 0 12 00 00 000000
12:00:00 AM 00:00:00 00 0 12 00 00 000000
12:00:00 AM 00:00:00 00 0 12 00 00 000000
12:00:00 AM 00:00:00 00 0 12 00 00 000000
SELECT TIME_FORMAT(e.brand, '%r %T %H %k %I %i %s %f') FROM t1 e;
TIME_FORMAT(e.brand, '%r %T %H %k %I %i %s %f')
12:00:00 AM 00:00:00 00 0 12 00 00 000000
12:00:00 AM 00:00:00 00 0 12 00 00 000000
12:00:00 AM 00:00:00 00 0 12 00 00 000000
12:00:00 AM 00:00:00 00 0 12 00 00 000000
12:00:00 AM 00:00:00 00 0 12 00 00 000000
12:00:00 AM 00:00:00 00 0 12 00 00 000000
12:00:00 AM 00:00:00 00 0 12 00 00 000000
SELECT * FROM t1 e WHERE TIME_FORMAT(e.sal, '%r %T %H %k %I %i %s %f') = 1;
id	consumer	brand	sal
Warnings:
Warning	1292	Truncated incorrect DECIMAL value: '12:50:00 AM 00:50:00 00 0 12 50 00 000000'
Warning	1292	Truncated incorrect DECIMAL value: '-12:40:00 AM 00:40:00 00 0 12 40 00 000000'
Warning	1292	Truncated incorrect DECIMAL value: '12:00:00 AM 00:00:00 00 0 12 00 00 000000'
Warning	1292	Truncated incorrect DECIMAL value: '12:35:00 AM 00:35:00 00 0 12 35 00 000000'
SELECT TIME_FORMAT(e.sal, '%r %T %H %k %I %i %s %f') sal,TIME_FORMAT(p.Price, '%r %T %H %k %I %i %s %f') FROM t1 e LEFT JOIN t2 p ON e.id = p.id ORDER BY e.sal DESC;
sal	TIME_FORMAT(p.Price, '%r %T %H %k %I %i %s %f')
NULL	12:00:26 AM 00:00:26 00 0 12 00 26 000000
NULL	NULL
12:50:00 AM 00:50:00 00 0 12 50 00 000000	NULL
12:35:00 AM 00:35:00 00 0 12 35 00 000000	-12:00:26 AM 00:00:26 00 0 12 00 26 000000
12:00:00 AM 00:00:00 00 0 12 00 00 000000	NULL
-12:40:00 AM 00:40:00 00 0 12 40 00 000000	12:00:00 AM 00:00:00 00 0 12 00 00 000000
NULL	NULL
SELECT e.sal, TIME_FORMAT(e.sal, '%r %T %H %k %I %i %s %f') sal,TIME_FORMAT(p.Price, '%r %T %H %k %I %i %s %f') FROM t1 e RIGHT JOIN t2 p ON e.id = p.id ORDER BY e.sal DESC;
sal	sal	TIME_FORMAT(p.Price, '%r %T %H %k %I %i %s %f')
8000	NULL	12:00:26 AM 00:00:26 00 0 12 00 26 000000
6000	NULL	NULL
5000	12:50:00 AM 00:50:00 00 0 12 50 00 000000	NULL
3500	12:35:00 AM 00:35:00 00 0 12 35 00 000000	-12:00:26 AM 00:00:26 00 0 12 00 26 000000
0	12:00:00 AM 00:00:00 00 0 12 00 00 000000	NULL
-4000	-12:40:00 AM 00:40:00 00 0 12 40 00 000000	12:00:00 AM 00:00:00 00 0 12 00 00 000000
NULL	NULL	NULL
SELECT TIME_FORMAT(e.sal, '%r %T %H %k %I %i %s %f') sal,TIME_FORMAT(p.Price, '%r %T %H %k %I %i %s %f') FROM t1 e INNER JOIN t2 p ON e.id = p.id ORDER BY e.sal DESC;
sal	TIME_FORMAT(p.Price, '%r %T %H %k %I %i %s %f')
NULL	12:00:26 AM 00:00:26 00 0 12 00 26 000000
NULL	NULL
12:50:00 AM 00:50:00 00 0 12 50 00 000000	NULL
12:35:00 AM 00:35:00 00 0 12 35 00 000000	-12:00:26 AM 00:00:26 00 0 12 00 26 000000
12:00:00 AM 00:00:00 00 0 12 00 00 000000	NULL
-12:40:00 AM 00:40:00 00 0 12 40 00 000000	12:00:00 AM 00:00:00 00 0 12 00 00 000000
NULL	NULL
SELECT * FROM (SELECT e.id,TIME_FORMAT(e.sal, '%r %T %H %k %I %i %s %f') sal,TIME_FORMAT(p.Price, '%r %T %H %k %I %i %s %f') FROM t1 e LEFT JOIN t2 p ON e.id = p.id ) e ORDER BY e.id;
id	sal	TIME_FORMAT(p.Price, '%r %T %H %k %I %i %s %f')
1	12:50:00 AM 00:50:00 00 0 12 50 00 000000	NULL
2	-12:40:00 AM 00:40:00 00 0 12 40 00 000000	12:00:00 AM 00:00:00 00 0 12 00 00 000000
3	12:00:00 AM 00:00:00 00 0 12 00 00 000000	NULL
4	NULL	NULL
5	NULL	NULL
6	NULL	12:00:26 AM 00:00:26 00 0 12 00 26 000000
7	12:35:00 AM 00:35:00 00 0 12 35 00 000000	-12:00:26 AM 00:00:26 00 0 12 00 26 000000
SELECT *  FROM t1 e WHERE time_format(e.sal, '%r %T %H %k %I %i %s %f') = ANY (SELECT time_format(p.Price, '%r %T %H %k %I %i %s %f') FROM t2 p ) ORDER BY e.id;
id	consumer	brand	sal
3	深咖	oppo	0
SELECT *  FROM t1 e WHERE time_format(e.sal, '%r %T %H %k %I %i %s %f') < ANY (SELECT time_format(p.Price, '%r %T %H %k %I %i %s %f') FROM t2 p ) ORDER BY e.id;
id	consumer	brand	sal
2	微山	xiaomi	-4000
3	深咖	oppo	0
SELECT *  FROM t1 e WHERE time_format(e.sal, '%r %T %H %k %I %i %s %f') > ANY (SELECT time_format(p.Price, '%r %T %H %k %I %i %s %f') FROM t2 p ) ORDER BY e.id;
id	consumer	brand	sal
1	书局	apple	5000
2	微山	xiaomi	-4000
3	深咖	oppo	0
7	合金	VIVO	3500
SELECT *  FROM t1 e WHERE time_format(e.sal, '%r %T %H %k %I %i %s %f') < ALL (SELECT time_format(p.Price, '%r %T %H %k %I %i %s %f') FROM t2 p ) ORDER BY e.id;
id	consumer	brand	sal
SELECT *  FROM t1 e WHERE time_format(e.sal, '%r %T %H %k %I %i %s %f') > ALL (SELECT time_format(p.Price, '%r %T %H %k %I %i %s %f') FROM t2 p ) ORDER BY e.id;
id	consumer	brand	sal
SELECT *  FROM t1 e WHERE time_format(e.sal, '%r %T %H %k %I %i %s %f') = ALL (SELECT time_format(p.Price, '%r %T %H %k %I %i %s %f') FROM t2 p WHERE p.model = 'oppo findx') ORDER BY e.id;
id	consumer	brand	sal
SELECT *  FROM t1 e WHERE EXISTS (SELECT time_format(p.Price, '%r %T %H %k %I %i %s %f') FROM t2 p ) ORDER BY e.id;
id	consumer	brand	sal
1	书局	apple	5000
2	微山	xiaomi	-4000
3	深咖	oppo	0
4	流苏	huawei	NULL
5	玻璃	LG	6000
6	钛钢	HTC	8000
7	合金	VIVO	3500
SELECT time_format(e.sal, '%r %T %H %k %I %i %s %f')  FROM t1 e WHERE NOT EXISTS (SELECT p.id,p.price FROM t2 p WHERE time_format(p.Price, '%r %T %H %k %I %i %s %f')=7500 ) ORDER BY e.id;
time_format(e.sal, '%r %T %H %k %I %i %s %f')
12:50:00 AM 00:50:00 00 0 12 50 00 000000
-12:40:00 AM 00:40:00 00 0 12 40 00 000000
12:00:00 AM 00:00:00 00 0 12 00 00 000000
NULL
NULL
NULL
12:35:00 AM 00:35:00 00 0 12 35 00 000000
Warnings:
Warning	1292	Truncated incorrect DECIMAL value: '12:00:00 AM 00:00:00 00 0 12 00 00 000000'
Warning	1292	Truncated incorrect DECIMAL value: '12:00:26 AM 00:00:26 00 0 12 00 26 000000'
Warning	1292	Truncated incorrect DECIMAL value: '-12:00:26 AM 00:00:26 00 0 12 00 26 000000'
CREATE TABLE t3 AS SELECT * FROM t1 e WHERE time_format(e.sal, '%r %T %H %k %I %i %s %f') = '12:50:00 AM 00:50:00 00 0 12 50 00 000000';
DROP TABLE t3;
CREATE TABLE t3 AS SELECT * FROM t1 e WHERE time_format(e.sal, '%r %T %H %k %I %i %s %f') = '-12:40:00 AM 00:40:00 00 0 12 40 00 000000';
DROP TABLE t3;
CREATE TABLE t3 AS SELECT * FROM t1 e WHERE time_format(e.sal, '%r %T %H %k %I %i %s %f') = NUll;
DROP TABLE t3;
SELECT brand, time_format(brand, '%r %T %H %k %I %i %s %f') as tf FROM t1 e WHERE time_format(brand, '%r %T %H %k %I %i %s %f') LIKE '%12:00%';
brand	tf
apple	12:00:00 AM 00:00:00 00 0 12 00 00 000000
xiaomi	12:00:00 AM 00:00:00 00 0 12 00 00 000000
oppo	12:00:00 AM 00:00:00 00 0 12 00 00 000000
huawei	12:00:00 AM 00:00:00 00 0 12 00 00 000000
LG	12:00:00 AM 00:00:00 00 0 12 00 00 000000
HTC	12:00:00 AM 00:00:00 00 0 12 00 00 000000
VIVO	12:00:00 AM 00:00:00 00 0 12 00 00 000000
SELECT sal, time_format(sal, '%r %T %H %k %I %i %s %f') FROM t1 e LEFT JOIN t2 p ON e.id = p.id WHERE e.sal LIKE '%00%';
sal	time_format(sal, '%r %T %H %k %I %i %s %f')
5000	12:50:00 AM 00:50:00 00 0 12 50 00 000000
-4000	-12:40:00 AM 00:40:00 00 0 12 40 00 000000
6000	NULL
8000	NULL
3500	12:35:00 AM 00:35:00 00 0 12 35 00 000000
SELECT * FROM t1 e WHERE time_format(e.sal, '%r %T %H %k %I %i %s %f') = 0;
id	consumer	brand	sal
Warnings:
Warning	1292	Truncated incorrect DECIMAL value: '12:50:00 AM 00:50:00 00 0 12 50 00 000000'
Warning	1292	Truncated incorrect DECIMAL value: '-12:40:00 AM 00:40:00 00 0 12 40 00 000000'
Warning	1292	Truncated incorrect DECIMAL value: '12:00:00 AM 00:00:00 00 0 12 00 00 000000'
Warning	1292	Truncated incorrect DECIMAL value: '12:35:00 AM 00:35:00 00 0 12 35 00 000000'
SELECT * FROM t1 e WHERE time_format(e.sal, '%r %T %H %k %I %i %s %f') = '-12:40:00 AM 00:40:00 00 0 12 40 00 000000';
id	consumer	brand	sal
2	微山	xiaomi	-4000
SELECT * FROM t1 e WHERE time_format(e.sal, '%r %T %H %k %I %i %s %f') = NULL;
id	consumer	brand	sal
SELECT * FROM t1 e WHERE time_format(e.sal, '%r %T %H %k %I %i %s %f') <=> NULL;
id	consumer	brand	sal
4	流苏	huawei	NULL
5	玻璃	LG	6000
6	钛钢	HTC	8000
SELECT * FROM t1 e WHERE time_format(e.sal, '%r %T %H %k %I %i %s %f') > 0 ORDER BY e.id;
id	consumer	brand	sal
1	书局	apple	5000
3	深咖	oppo	0
7	合金	VIVO	3500
Warnings:
Warning	1292	Truncated incorrect DECIMAL value: '12:50:00 AM 00:50:00 00 0 12 50 00 000000'
Warning	1292	Truncated incorrect DECIMAL value: '-12:40:00 AM 00:40:00 00 0 12 40 00 000000'
Warning	1292	Truncated incorrect DECIMAL value: '12:00:00 AM 00:00:00 00 0 12 00 00 000000'
Warning	1292	Truncated incorrect DECIMAL value: '12:35:00 AM 00:35:00 00 0 12 35 00 000000'
SELECT * FROM t1 e WHERE time_format(e.sal, '%r %T %H %k %I %i %s %f') >= 0 ORDER BY e.id;
id	consumer	brand	sal
1	书局	apple	5000
3	深咖	oppo	0
7	合金	VIVO	3500
Warnings:
Warning	1292	Truncated incorrect DECIMAL value: '12:50:00 AM 00:50:00 00 0 12 50 00 000000'
Warning	1292	Truncated incorrect DECIMAL value: '-12:40:00 AM 00:40:00 00 0 12 40 00 000000'
Warning	1292	Truncated incorrect DECIMAL value: '12:00:00 AM 00:00:00 00 0 12 00 00 000000'
Warning	1292	Truncated incorrect DECIMAL value: '12:35:00 AM 00:35:00 00 0 12 35 00 000000'
SELECT * FROM t1 e WHERE time_format(e.sal, '%r %T %H %k %I %i %s %f') < 0 ORDER BY e.id;
id	consumer	brand	sal
2	微山	xiaomi	-4000
Warnings:
Warning	1292	Truncated incorrect DECIMAL value: '12:50:00 AM 00:50:00 00 0 12 50 00 000000'
Warning	1292	Truncated incorrect DECIMAL value: '-12:40:00 AM 00:40:00 00 0 12 40 00 000000'
Warning	1292	Truncated incorrect DECIMAL value: '12:00:00 AM 00:00:00 00 0 12 00 00 000000'
Warning	1292	Truncated incorrect DECIMAL value: '12:35:00 AM 00:35:00 00 0 12 35 00 000000'
SELECT * FROM t1 e WHERE time_format(e.sal, '%r %T %H %k %I %i %s %f') <= 0 ORDER BY e.id;
id	consumer	brand	sal
2	微山	xiaomi	-4000
Warnings:
Warning	1292	Truncated incorrect DECIMAL value: '12:50:00 AM 00:50:00 00 0 12 50 00 000000'
Warning	1292	Truncated incorrect DECIMAL value: '-12:40:00 AM 00:40:00 00 0 12 40 00 000000'
Warning	1292	Truncated incorrect DECIMAL value: '12:00:00 AM 00:00:00 00 0 12 00 00 000000'
Warning	1292	Truncated incorrect DECIMAL value: '12:35:00 AM 00:35:00 00 0 12 35 00 000000'
SELECT * FROM t1 e WHERE time_format(e.sal, '%r %T %H %k %I %i %s %f') = 1 ORDER BY e.id;
id	consumer	brand	sal
Warnings:
Warning	1292	Truncated incorrect DECIMAL value: '12:50:00 AM 00:50:00 00 0 12 50 00 000000'
Warning	1292	Truncated incorrect DECIMAL value: '-12:40:00 AM 00:40:00 00 0 12 40 00 000000'
Warning	1292	Truncated incorrect DECIMAL value: '12:00:00 AM 00:00:00 00 0 12 00 00 000000'
Warning	1292	Truncated incorrect DECIMAL value: '12:35:00 AM 00:35:00 00 0 12 35 00 000000'
SELECT * FROM t1 e WHERE time_format(e.sal, '%r %T %H %k %I %i %s %f') <> 0 ORDER BY e.id;
id	consumer	brand	sal
1	书局	apple	5000
2	微山	xiaomi	-4000
3	深咖	oppo	0
7	合金	VIVO	3500
Warnings:
Warning	1292	Truncated incorrect DECIMAL value: '12:50:00 AM 00:50:00 00 0 12 50 00 000000'
Warning	1292	Truncated incorrect DECIMAL value: '-12:40:00 AM 00:40:00 00 0 12 40 00 000000'
Warning	1292	Truncated incorrect DECIMAL value: '12:00:00 AM 00:00:00 00 0 12 00 00 000000'
Warning	1292	Truncated incorrect DECIMAL value: '12:35:00 AM 00:35:00 00 0 12 35 00 000000'
SELECT e.id, e.sal, time_format(e.sal, '%r %T %H %k %I %i %s %f') FROM t1 e WHERE e.id > 0 ORDER BY time_format(e.sal, '%r %T %H %k %I %i %s %f');
id	sal	time_format(e.sal, '%r %T %H %k %I %i %s %f')
4	NULL	NULL
5	6000	NULL
6	8000	NULL
2	-4000	-12:40:00 AM 00:40:00 00 0 12 40 00 000000
3	0	12:00:00 AM 00:00:00 00 0 12 00 00 000000
7	3500	12:35:00 AM 00:35:00 00 0 12 35 00 000000
1	5000	12:50:00 AM 00:50:00 00 0 12 50 00 000000
SELECT e.id, e.sal, time_format(e.sal, '%r %T %H %k %I %i %s %f') FROM t1 e WHERE e.id > 0 ORDER BY time_format(e.sal, '%r %T %H %k %I %i %s %f') DESC;
id	sal	time_format(e.sal, '%r %T %H %k %I %i %s %f')
1	5000	12:50:00 AM 00:50:00 00 0 12 50 00 000000
7	3500	12:35:00 AM 00:35:00 00 0 12 35 00 000000
3	0	12:00:00 AM 00:00:00 00 0 12 00 00 000000
2	-4000	-12:40:00 AM 00:40:00 00 0 12 40 00 000000
4	NULL	NULL
5	6000	NULL
6	8000	NULL
SELECT e.id, e.sal, time_format(e.brand, '%r %T %H %k %I %i %s %f') FROM t1 e WHERE e.id > 0 ORDER BY time_format(e.brand, '%r %T %H %k %I %i %s %f') ASC;
id	sal	time_format(e.brand, '%r %T %H %k %I %i %s %f')
1	5000	12:00:00 AM 00:00:00 00 0 12 00 00 000000
2	-4000	12:00:00 AM 00:00:00 00 0 12 00 00 000000
3	0	12:00:00 AM 00:00:00 00 0 12 00 00 000000
4	NULL	12:00:00 AM 00:00:00 00 0 12 00 00 000000
5	6000	12:00:00 AM 00:00:00 00 0 12 00 00 000000
6	8000	12:00:00 AM 00:00:00 00 0 12 00 00 000000
7	3500	12:00:00 AM 00:00:00 00 0 12 00 00 000000
SELECT e.id, e.sal, time_format(e.brand, '%r %T %H %k %I %i %s %f') FROM t1 e WHERE e.id > 0 ORDER BY time_format(e.brand, '%r %T %H %k %I %i %s %f') DESC;
id	sal	time_format(e.brand, '%r %T %H %k %I %i %s %f')
1	5000	12:00:00 AM 00:00:00 00 0 12 00 00 000000
2	-4000	12:00:00 AM 00:00:00 00 0 12 00 00 000000
3	0	12:00:00 AM 00:00:00 00 0 12 00 00 000000
4	NULL	12:00:00 AM 00:00:00 00 0 12 00 00 000000
5	6000	12:00:00 AM 00:00:00 00 0 12 00 00 000000
6	8000	12:00:00 AM 00:00:00 00 0 12 00 00 000000
7	3500	12:00:00 AM 00:00:00 00 0 12 00 00 000000
SELECT e.id, time_format(e.sal, '%r %T %H %k %I %i %s %f'), SUM(e.sal+p.Price) FROM t1 e ,t2 p WHERE e.id=p.id GROUP BY e.id, time_format(e.sal, '%r %T %H %k %I %i %s %f')  ORDER BY e.id;
id	time_format(e.sal, '%r %T %H %k %I %i %s %f')	SUM(e.sal+p.Price)
1	12:50:00 AM 00:50:00 00 0 12 50 00 000000	12000
2	-12:40:00 AM 00:40:00 00 0 12 40 00 000000	-4000
3	12:00:00 AM 00:00:00 00 0 12 00 00 000000	-6000
4	NULL	NULL
5	NULL	NULL
6	NULL	8026
7	12:35:00 AM 00:35:00 00 0 12 35 00 000000	3474
SELECT e.id, e.sal,time_format(e.sal,'%r %T %H %k %I %i %s %f') tt, SUM(e.sal+p.Price) FROM t1 e ,t2 p WHERE e.id=p.id GROUP BY e.id, time_format(e.sal, '%r %T %H %k %I %i %s %f') HAVING tt > -1 ORDER BY e.id;
id	sal	tt	SUM(e.sal+p.Price)
1	5000	12:50:00 AM 00:50:00 00 0 12 50 00 000000	12000
3	0	12:00:00 AM 00:00:00 00 0 12 00 00 000000	-6000
7	3500	12:35:00 AM 00:35:00 00 0 12 35 00 000000	3474
Warnings:
Warning	1292	Truncated incorrect DECIMAL value: '12:50:00 AM 00:50:00 00 0 12 50 00 000000'
Warning	1292	Truncated incorrect DECIMAL value: '-12:40:00 AM 00:40:00 00 0 12 40 00 000000'
Warning	1292	Truncated incorrect DECIMAL value: '12:00:00 AM 00:00:00 00 0 12 00 00 000000'
Warning	1292	Truncated incorrect DECIMAL value: '12:35:00 AM 00:35:00 00 0 12 35 00 000000'
Warning	1292	Truncated incorrect DECIMAL value: '12:50:00 AM 00:50:00 00 0 12 50 00 000000'
Warning	1292	Truncated incorrect DECIMAL value: '-12:40:00 AM 00:40:00 00 0 12 40 00 000000'
Warning	1292	Truncated incorrect DECIMAL value: '12:00:00 AM 00:00:00 00 0 12 00 00 000000'
Warning	1292	Truncated incorrect DECIMAL value: '12:35:00 AM 00:35:00 00 0 12 35 00 000000'
SELECT e.id, e.sal,time_format(e.sal+p.Price,'%r %T %H %k %I %i %s %f') tt, SUM(e.sal+p.Price) FROM t1 e ,t2 p WHERE e.id=p.id GROUP BY e.id, time_format(e.sal+p.Price, '%r %T %H %k %I %i %s %f') HAVING tt > -1 ORDER BY e.id;
id	sal	tt	SUM(e.sal+p.Price)
1	5000	01:20:00 AM 01:20:00 01 1 01 20 00 000000	12000
Warnings:
Warning	1292	Truncated incorrect DECIMAL value: '01:20:00 AM 01:20:00 01 1 01 20 00 000000'
Warning	1292	Truncated incorrect DECIMAL value: '-12:40:00 AM 00:40:00 00 0 12 40 00 000000'
select id, sal, time_format(case when sal=0 then 200 else sal end, '%r %T %H %k %I %i %s %f') from t1_view ORDER BY id;
id	sal	time_format(case when sal=0 then 200 else sal end, '%r %T %H %k %I %i %s %f')
1	5000	12:50:00 AM 00:50:00 00 0 12 50 00 000000
2	-4000	-12:40:00 AM 00:40:00 00 0 12 40 00 000000
3	0	12:02:00 AM 00:02:00 00 0 12 02 00 000000
4	NULL	NULL
5	6000	NULL
6	8000	NULL
7	3500	12:35:00 AM 00:35:00 00 0 12 35 00 000000
select id, sal, time_format(case when sal=0 then 6000 else sal end, '%r %T %H %k %I %i %s %f') from t1_view ORDER BY id;
id	sal	time_format(case when sal=0 then 6000 else sal end, '%r %T %H %k %I %i %s %f')
1	5000	12:50:00 AM 00:50:00 00 0 12 50 00 000000
2	-4000	-12:40:00 AM 00:40:00 00 0 12 40 00 000000
3	0	NULL
4	NULL	NULL
5	6000	NULL
6	8000	NULL
7	3500	12:35:00 AM 00:35:00 00 0 12 35 00 000000
select id, sal, time_format(case when sal=0 then null else sal end, '%r %T %H %k %I %i %s %f') from t1_view ORDER BY id;
id	sal	time_format(case when sal=0 then null else sal end, '%r %T %H %k %I %i %s %f')
1	5000	12:50:00 AM 00:50:00 00 0 12 50 00 000000
2	-4000	-12:40:00 AM 00:40:00 00 0 12 40 00 000000
3	0	NULL
4	NULL	NULL
5	6000	NULL
6	8000	NULL
7	3500	12:35:00 AM 00:35:00 00 0 12 35 00 000000
select id, sal, time_format(case when sal>0 then 200 else sal end, '%r %T %H %k %I %i %s %f') from t1_view order by id;
id	sal	time_format(case when sal>0 then 200 else sal end, '%r %T %H %k %I %i %s %f')
1	5000	12:02:00 AM 00:02:00 00 0 12 02 00 000000
2	-4000	-12:40:00 AM 00:40:00 00 0 12 40 00 000000
3	0	12:00:00 AM 00:00:00 00 0 12 00 00 000000
4	NULL	NULL
5	6000	12:02:00 AM 00:02:00 00 0 12 02 00 000000
6	8000	12:02:00 AM 00:02:00 00 0 12 02 00 000000
7	3500	12:02:00 AM 00:02:00 00 0 12 02 00 000000
select id, sal, time_format(case when sal=0 then 200 else sal end, '%r %T %H %k %I %i %s %f' ), COUNT(*) from t1_view GROUP by time_format(case when sal=0 then 200 else sal end, '%r %T %H %k %I %i %s %f' ),id ORDER BY id;
id	sal	time_format(case when sal=0 then 200 else sal end, '%r %T %H %k %I %i %s %f' )	COUNT(*)
1	5000	12:50:00 AM 00:50:00 00 0 12 50 00 000000	1
2	-4000	-12:40:00 AM 00:40:00 00 0 12 40 00 000000	1
3	0	12:02:00 AM 00:02:00 00 0 12 02 00 000000	1
4	NULL	NULL	1
5	6000	NULL	1
6	8000	NULL	1
7	3500	12:35:00 AM 00:35:00 00 0 12 35 00 000000	1
INSERT INTO t2(model,price) SELECT model,price from t2_view WHERE time_format(price, '%r %T %H %k %I %i %s %f') = '-12:00:26 AM 00:00:26 00 0 12 00 26 000000';
SELECT COUNT(*) FROM t2;
COUNT(*)
7
INSERT INTO t2(model,price) SELECT model,price from t2_view WHERE time_format(price, '%r %T %H %k %I %i %s %f') = 0;
SELECT COUNT(*) FROM t2;
COUNT(*)
7
DELETE FROM t2_view WHERE time_format(Price, '%i') = 0;
SELECT COUNT(*) FROM t2_view;
COUNT(*)
7
DELETE FROM t2_view WHERE time_format(Price, '%i') = -1;
SELECT COUNT(*) FROM t2_view;
COUNT(*)
7
DELETE FROM t2_view WHERE time_format(Price, '%i') <= 2;
SELECT COUNT(*) FROM t2_view;
COUNT(*)
7
DROP TABLE t1;
CREATE TABLE `t1` (
`id` int,
`consumer` char(20) DEFAULT NULL,
`price` varchar(20) DEFAULT NULL,
`sal` int DEFAULT NULL,
`datetime1` DATE,
`datetime2` bigint
);
INSERT INTO t1 VALUES(1,'书局','7000',5000,'2020-09-22',20200923121200);
INSERT INTO t1 VALUES(2,'微山','3000',-4000,'2020-09-21',20200921101159);
INSERT INTO t1 VALUES(3,'深咖','5000',0,'2020-08-21',20190821101159);
INSERT INTO t1 VALUES(4,'流苏','0',NULL,'2020-02-29',20200228101159);
INSERT INTO t1 VALUES(5,'玻璃','3200',6000,'2020-02-29',20200228101159);
INSERT INTO t1 VALUES(6,'钛钢',NULL,8000,'2020-02-29',20200228101159);
INSERT INTO t1 VALUES(7,'合金','VIVO',3500,'2020-02-29',20200228101159);
CREATE INDEX index_test ON t1(sal);
CREATE INDEX index_test1 ON t1(price);
CREATE INDEX index_test2 ON t1(consumer);
CREATE INDEX index_test3 ON t1(datetime1);
CREATE INDEX index_test4 ON t1(datetime2);
SELECT * FROM t1;
id	consumer	price	sal	datetime1	datetime2
1	书局	7000	5000	2020-09-22	20200923121200
2	微山	3000	-4000	2020-09-21	20200921101159
3	深咖	5000	0	2020-08-21	20190821101159
4	流苏	0	NULL	2020-02-29	20200228101159
5	玻璃	3200	6000	2020-02-29	20200228101159
6	钛钢	NULL	8000	2020-02-29	20200228101159
7	合金	VIVO	3500	2020-02-29	20200228101159
SELECT sal, time_format(sal, '%r %T %H %k %I %i %s %f') FROM t1 ORDER BY SAL;
sal	time_format(sal, '%r %T %H %k %I %i %s %f')
NULL	NULL
-4000	-12:40:00 AM 00:40:00 00 0 12 40 00 000000
0	12:00:00 AM 00:00:00 00 0 12 00 00 000000
3500	12:35:00 AM 00:35:00 00 0 12 35 00 000000
5000	12:50:00 AM 00:50:00 00 0 12 50 00 000000
6000	NULL
8000	NULL
SELECT id, consumer, time_format(sal, '%r %T %H %k %I %i %s %f') FROM t1 WHERE time_format(sal, '%r %T %H %k %I %i %s %f') = '-12:40:00 AM 00:40:00 00 0 12 40 00 000000' ORDER BY id DESC;
id	consumer	time_format(sal, '%r %T %H %k %I %i %s %f')
2	微山	-12:40:00 AM 00:40:00 00 0 12 40 00 000000
SELECT id,consumer,time_format(sal, '%r %T %H %k %I %i %s %f') FROM t1 WHERE time_format(sal, '%r %T %H %k %I %i %s %f') > 0 ORDER BY timestamp(sal);
id	consumer	time_format(sal, '%r %T %H %k %I %i %s %f')
1	书局	12:50:00 AM 00:50:00 00 0 12 50 00 000000
7	合金	12:35:00 AM 00:35:00 00 0 12 35 00 000000
3	深咖	12:00:00 AM 00:00:00 00 0 12 00 00 000000
Warnings:
Warning	1292	Truncated incorrect DECIMAL value: '12:50:00 AM 00:50:00 00 0 12 50 00 000000'
Warning	1292	Truncated incorrect DECIMAL value: '-12:40:00 AM 00:40:00 00 0 12 40 00 000000'
Warning	1292	Truncated incorrect DECIMAL value: '12:00:00 AM 00:00:00 00 0 12 00 00 000000'
Warning	1292	Truncated incorrect DECIMAL value: '12:35:00 AM 00:35:00 00 0 12 35 00 000000'
SELECT id,SUM(sal) FROM t1 WHERE time_format(sal, '%r %T %H %k %I %i %s %f') > 0 GROUP BY id HAVING SUM(sal) > 3000 ORDER BY id;
id	SUM(sal)
1	5000
7	3500
Warnings:
Warning	1292	Truncated incorrect DECIMAL value: '12:50:00 AM 00:50:00 00 0 12 50 00 000000'
Warning	1292	Truncated incorrect DECIMAL value: '-12:40:00 AM 00:40:00 00 0 12 40 00 000000'
Warning	1292	Truncated incorrect DECIMAL value: '12:00:00 AM 00:00:00 00 0 12 00 00 000000'
Warning	1292	Truncated incorrect DECIMAL value: '12:35:00 AM 00:35:00 00 0 12 35 00 000000'
SELECT id,SUM(sal) FROM t1 WHERE time_format(sal, '%r %T %H %k %I %i %s %f') > 0 GROUP BY id HAVING SUM(sal) > 5000 ORDER BY id;
id	SUM(sal)
Warnings:
Warning	1292	Truncated incorrect DECIMAL value: '12:50:00 AM 00:50:00 00 0 12 50 00 000000'
Warning	1292	Truncated incorrect DECIMAL value: '-12:40:00 AM 00:40:00 00 0 12 40 00 000000'
Warning	1292	Truncated incorrect DECIMAL value: '12:00:00 AM 00:00:00 00 0 12 00 00 000000'
Warning	1292	Truncated incorrect DECIMAL value: '12:35:00 AM 00:35:00 00 0 12 35 00 000000'
UPDATE t1 SET sal = 10 WHERE time_format(sal, '%r %T %H %k %I %i %s %f') = 0 ;
INSERT INTO t1(consumer,price,sal,datetime1,datetime2) SELECT consumer,price,sal,datetime1,datetime2  FROM t1 WHERE time_format(sal, '%r %T %H %k %I %i %s %f')<0;
SELECT COUNT(*) FROM t1;
COUNT(*)
7
INSERT INTO t1 VALUES(8,'流苏','9111',time_format(200, '%i'),'2020-02-29 10:11:59',20200228101159);
INSERT INTO t1 VALUES(8,'流苏','9112',time_format('156', '%i'),'2020-02-29 10:11:59',20200228101159);
INSERT INTO t1 VALUES(8,'流苏','9113',time_format(-100, '%f'),'2020-02-29 10:11:59',20200228101159);
INSERT INTO t1 VALUES(8,'流苏','9114',time_format(0, '%i'),'2020-02-29 10:11:59',20200228101159);
INSERT INTO t1 VALUES(8,'流苏','9115',time_format(NULL, '%i'),'2020-02-29 10:11:59',20200228101159);
SELECT COUNT(*)  FROM t1;
COUNT(*)
12
DELETE FROM t1 WHERE time_format(sal, '%i')=0;
DROP TABLE t1;
CREATE TABLE `t1` (
`id` int NOT NULL AUTO_INCREMENT,
`consumer` char(20) NOT NULL,
`price` varchar(20) DEFAULT NULL,
`sal` int DEFAULT NULL,
`datetime1` DATE,
`datetime2` bigint,
PRIMARY KEY (`id`),
UNIQUE KEY `t1_UN` (`price`)
);
INSERT INTO t1 VALUES(1,'书局','7000',5000,'2020-09-22',20200923121200);
INSERT INTO t1 VALUES(2,'微山','3000',-4000,'2020-09-21',20200921101159);
INSERT INTO t1 VALUES(3,'深咖','5000',0,'2020-08-21',20190821101159);
INSERT INTO t1 VALUES(4,'流苏','0',NULL,'2020-02-29',20200228101159);
INSERT INTO t1 VALUES(5,'玻璃','3200',6000,'2020-02-29',20200228101159);
INSERT INTO t1 VALUES(6,'钛钢',NULL,8000,'2020-02-29',20200228101159);
INSERT INTO t1 VALUES(7,'合金','VIVO',3500,'2020-02-29',20200228101159);
SELECT time_format(price, '%r %T %H %k %I %i %s %f') FROM t1;
time_format(price, '%r %T %H %k %I %i %s %f')
NULL
12:00:00 AM 00:00:00 00 0 12 00 00 000000
12:30:00 AM 00:30:00 00 0 12 30 00 000000
12:32:00 AM 00:32:00 00 0 12 32 00 000000
12:50:00 AM 00:50:00 00 0 12 50 00 000000
NULL
12:00:00 AM 00:00:00 00 0 12 00 00 000000
SELECT time_format(sal, '%r %T %H %k %I %i %s %f') FROM t1;
time_format(sal, '%r %T %H %k %I %i %s %f')
12:50:00 AM 00:50:00 00 0 12 50 00 000000
-12:40:00 AM 00:40:00 00 0 12 40 00 000000
12:00:00 AM 00:00:00 00 0 12 00 00 000000
NULL
NULL
NULL
12:35:00 AM 00:35:00 00 0 12 35 00 000000
SELECT time_format(datetime1, '%r %T %H %k %I %i %s %f'), time_format(datetime2, '%r %T %H %k %I %i %s %f'), time_format(sal, '%r %T %H %k %I %i %s %f'), time_format(price, '%r %T %H %k %I %i %s %f') FROM t1;
time_format(datetime1, '%r %T %H %k %I %i %s %f')	time_format(datetime2, '%r %T %H %k %I %i %s %f')	time_format(sal, '%r %T %H %k %I %i %s %f')	time_format(price, '%r %T %H %k %I %i %s %f')
12:00:00 AM 00:00:00 00 0 12 00 00 000000	12:12:00 PM 12:12:00 12 12 12 12 00 000000	12:50:00 AM 00:50:00 00 0 12 50 00 000000	NULL
12:00:00 AM 00:00:00 00 0 12 00 00 000000	10:11:59 AM 10:11:59 10 10 10 11 59 000000	-12:40:00 AM 00:40:00 00 0 12 40 00 000000	12:30:00 AM 00:30:00 00 0 12 30 00 000000
12:00:00 AM 00:00:00 00 0 12 00 00 000000	10:11:59 AM 10:11:59 10 10 10 11 59 000000	12:00:00 AM 00:00:00 00 0 12 00 00 000000	12:50:00 AM 00:50:00 00 0 12 50 00 000000
12:00:00 AM 00:00:00 00 0 12 00 00 000000	10:11:59 AM 10:11:59 10 10 10 11 59 000000	NULL	12:00:00 AM 00:00:00 00 0 12 00 00 000000
12:00:00 AM 00:00:00 00 0 12 00 00 000000	10:11:59 AM 10:11:59 10 10 10 11 59 000000	NULL	12:32:00 AM 00:32:00 00 0 12 32 00 000000
12:00:00 AM 00:00:00 00 0 12 00 00 000000	10:11:59 AM 10:11:59 10 10 10 11 59 000000	NULL	NULL
12:00:00 AM 00:00:00 00 0 12 00 00 000000	10:11:59 AM 10:11:59 10 10 10 11 59 000000	12:35:00 AM 00:35:00 00 0 12 35 00 000000	12:00:00 AM 00:00:00 00 0 12 00 00 000000
SELECT id, consumer, time_format(sal, '%r %T %H %k %I %i %s %f'), time_format(price, '%r %T %H %k %I %i %s %f') FROM t1 WHERE time_format(sal, '%r %T %H %k %I %i %s %f')>0 ORDER BY id DESC;
id	consumer	time_format(sal, '%r %T %H %k %I %i %s %f')	time_format(price, '%r %T %H %k %I %i %s %f')
7	合金	12:35:00 AM 00:35:00 00 0 12 35 00 000000	12:00:00 AM 00:00:00 00 0 12 00 00 000000
3	深咖	12:00:00 AM 00:00:00 00 0 12 00 00 000000	12:50:00 AM 00:50:00 00 0 12 50 00 000000
1	书局	12:50:00 AM 00:50:00 00 0 12 50 00 000000	NULL
Warnings:
Warning	1292	Truncated incorrect DECIMAL value: '12:35:00 AM 00:35:00 00 0 12 35 00 000000'
Warning	1292	Truncated incorrect DECIMAL value: '12:00:00 AM 00:00:00 00 0 12 00 00 000000'
Warning	1292	Truncated incorrect DECIMAL value: '-12:40:00 AM 00:40:00 00 0 12 40 00 000000'
Warning	1292	Truncated incorrect DECIMAL value: '12:50:00 AM 00:50:00 00 0 12 50 00 000000'
SELECT id,consumer, time_format(sal, '%r %T %H %k %I %i %s %f'), time_format(price, '%r %T %H %k %I %i %s %f') FROM t1 WHERE time_format(sal, '%r %T %H %k %I %i %s %f')<0 ORDER BY time_format(sal, '%r %T %H %k %I %i %s %f');
id	consumer	time_format(sal, '%r %T %H %k %I %i %s %f')	time_format(price, '%r %T %H %k %I %i %s %f')
2	微山	-12:40:00 AM 00:40:00 00 0 12 40 00 000000	12:30:00 AM 00:30:00 00 0 12 30 00 000000
Warnings:
Warning	1292	Truncated incorrect DECIMAL value: '12:50:00 AM 00:50:00 00 0 12 50 00 000000'
Warning	1292	Truncated incorrect DECIMAL value: '-12:40:00 AM 00:40:00 00 0 12 40 00 000000'
Warning	1292	Truncated incorrect DECIMAL value: '12:00:00 AM 00:00:00 00 0 12 00 00 000000'
Warning	1292	Truncated incorrect DECIMAL value: '12:35:00 AM 00:35:00 00 0 12 35 00 000000'
SELECT id, sal,SUM(time_format(sal, '%r %T %H %k %I %i %s %f')) FROM t1 WHERE t1.sal <> 6000 GROUP BY sal,id HAVING SUM(time_format(sal, '%r %T %H %k %I %i %s %f')) > 0 ORDER BY id;
id	sal	SUM(time_format(sal, '%r %T %H %k %I %i %s %f'))
1	5000	12
3	0	12
7	3500	12
Warnings:
Warning	1292	Truncated incorrect DOUBLE value: '12:50:00 AM 00:50:00 00 0 12 50 00 000000'
Warning	1292	Truncated incorrect DOUBLE value: '-12:40:00 AM 00:40:00 00 0 12 40 00 000000'
Warning	1292	Truncated incorrect DOUBLE value: '12:00:00 AM 00:00:00 00 0 12 00 00 000000'
Warning	1292	Truncated incorrect DOUBLE value: '12:35:00 AM 00:35:00 00 0 12 35 00 000000'
Warning	1292	Truncated incorrect DOUBLE value: '12:50:00 AM 00:50:00 00 0 12 50 00 000000'
Warning	1292	Truncated incorrect DOUBLE value: '12:00:00 AM 00:00:00 00 0 12 00 00 000000'
Warning	1292	Truncated incorrect DOUBLE value: '12:35:00 AM 00:35:00 00 0 12 35 00 000000'
SELECT price, sal FROM t1;
price	sal
7000	5000
3000	-4000
5000	0
0	NULL
3200	6000
NULL	8000
VIVO	3500
UPDATE t1 SET sal = 10 WHERE time_format(sal, '%r %T %H %k %I %i %s %f') = '12:50:00 AM 00:50:00 00 0 12 50 00 000000' ;
UPDATE t1 SET price = '9527' where time_format(sal, '%r %T %H %k %I %i %s %f') < 0;
SELECT price, sal FROM t1;
price	sal
7000	5000
3000	-4000
5000	0
0	NULL
3200	6000
NULL	8000
VIVO	3500
SELECT COUNT(*) FROM t1;
COUNT(*)
7
INSERT INTO t1 VALUES(0,'流苏_insert1',time_format('200', '%i %s %f'),time_format(200, '%H'),'2020-02-29 10:11:59',20200228101159);
INSERT INTO t1 VALUES(0,'流苏_insert2',2,time_format('156', '%k'),'2020-02-29 10:11:59',20200228101159);
INSERT INTO t1 VALUES(0,'流苏_insert3',3,time_format(-100,'%i'),'2020-02-29 10:11:59',20200228101159);
INSERT INTO t1 VALUES(0,'流苏_insert4',time_format(NULL, '%i %s %f'),time_format(0,'%H'),'2020-02-29 10:11:59',20200228101159);
INSERT INTO t1 VALUES(0,'流苏_insert5','9115',time_format(NULL, '%k'),'2020-02-29 10:11:59',20200228101159);
SELECT COUNT(*)  FROM t1;
COUNT(*)
12
DELETE FROM t1 WHERE CAST(time_format('2020-02-28 10:11:59', '%k%i%s%f') AS UNSIGNED INTEGER)= 20200228101159;
SELECT COUNT(*)  FROM t1;
COUNT(*)
12
DROP VIEW t2_view;
DROP VIEW t1_view;
DROP TABLE t1;
DROP TABLE t2;
DROP TABLE t3;
DROP TABLE t1;
CREATE TABLE t1 (
a INT,
c_time VARCHAR(50),
d_time VARCHAR(101) GENERATED ALWAYS AS (time_format(c_time, '%k%i%s'))
);
CREATE INDEX idx_t1 ON T1(d_time);
INSERT INTO T1(A,C_TIME) VALUES(1,'2020-02-29 10:11:59');
INSERT INTO T1(A,C_TIME) VALUES(2,'09:10:05');
INSERT INTO T1(A,C_TIME) VALUES(3,'201');
INSERT INTO T1(A,C_TIME) VALUES(4,'2020-02-29');
INSERT INTO T1(A,C_TIME) VALUES(5,'09:10:05:12:34:44');
INSERT INTO T1(A,C_TIME) VALUES(6,'CURRENT_TIMESTAMP()');
DROP TABLE t1;
CREATE TABLE t1 (
a INT AUTO_INCREMENT PRIMARY KEY,
c_time VARCHAR(50),
d_time int GENERATED ALWAYS AS (time_format(c_time, '%k'))
);
CREATE INDEX idx_t1 ON T1(d_time);
INSERT INTO T1(A,C_TIME) VALUES(1,'2020-02-29 10:11:59');
INSERT INTO T1(A,C_TIME) VALUES(2,'09:10:05');
INSERT INTO T1(A,C_TIME) VALUES(3,'201');
INSERT INTO T1(A,C_TIME) VALUES(4,'2020-02-29');
INSERT INTO T1(A,C_TIME) VALUES(5,'09:10:05:12:34:44');
INSERT INTO T1(A,C_TIME) VALUES(6,'CURRENT_TIMESTAMP()');
DROP TABLE t1;
CREATE TABLE t1 (
a INT AUTO_INCREMENT PRIMARY KEY,
c_time VARCHAR(50),
d_time timestamp GENERATED ALWAYS AS (time_format(c_time, '%k:%i:%s.%f'))
);
CREATE INDEX idx_t1 ON T1(d_time);
INSERT INTO T1(A,C_TIME) VALUES(1,'2020-02-29 10:11:59');
INSERT INTO T1(A,C_TIME) VALUES(2,'09:10:05');
INSERT INTO T1(A,C_TIME) VALUES(3,'201');
INSERT INTO T1(A,C_TIME) VALUES(4,'2020-02-29');
INSERT INTO T1(A,C_TIME) VALUES(5,'09:10:05:12:34:44');
INSERT INTO T1(A,C_TIME) VALUES(6,'CURRENT_TIMESTAMP()');
INSERT INTO T1(A,C_TIME) VALUES(7,1103.56);
DROP TABLE t1;
CREATE TABLE t1 (
a INT AUTO_INCREMENT PRIMARY KEY,
c_time timestamp,
d_time varchar(101) GENERATED ALWAYS AS (time_format(c_time,'%k:%i:%s.%f'))
);
CREATE INDEX idx_t1 ON T1(d_time);
INSERT INTO T1(A,C_TIME) VALUES(1,'2020-02-29 10:11:59');
INSERT INTO T1(A,C_TIME) VALUES(2,'09:10:05');
INSERT INTO T1(A,C_TIME) VALUES(3,'201');
INSERT INTO T1(A,C_TIME) VALUES(4,'2020-02-29');
INSERT INTO T1(A,C_TIME) VALUES(5,'09:10:05:12:34:44');
INSERT INTO T1(A,C_TIME) VALUES(6,'CURRENT_TIMESTAMP()');
INSERT INTO T1(A,C_TIME) VALUES(7,1103.56);
DROP TABLE t1;
CREATE TABLE t1 (
a INT AUTO_INCREMENT PRIMARY KEY,
c_time timestamp,
d_time varchar(101) GENERATED ALWAYS AS (time_format(c_time,'%k:%i:%s.%f') + 1234)
);
CREATE INDEX idx_t1 ON T1(d_time);
INSERT INTO T1(A,C_TIME) VALUES(1,'2020-02-29 10:11:59');
Warnings:
Warning	1292	Truncated incorrect DOUBLE value: '10:11:59.000000'
INSERT INTO T1(A,C_TIME) VALUES(2,'09:10:05');
Warnings:
Warning	1292	Truncated incorrect DOUBLE value: '0:00:00.000000'
INSERT INTO T1(A,C_TIME) VALUES(3,NULL);
DROP TABLE t1;
CREATE TABLE t1 (
a INT AUTO_INCREMENT PRIMARY KEY,
c_time varchar(50),
d_time datetime GENERATED ALWAYS AS (time_format(c_time,'%k:%i:%s.%f') + 1234)
);
CREATE INDEX idx_t1 ON T1(d_time);
INSERT INTO T1(A,C_TIME) VALUES(1,'2020-02-29 10:11:59');
INSERT INTO T1(A,C_TIME) VALUES(2,'09:10:05');
INSERT INTO T1(A,C_TIME) VALUES(3,NULL);
INSERT INTO T1(A,C_TIME) VALUES(4,0);
DROP TABLE t1;
CREATE TABLE t1 (
a INT AUTO_INCREMENT PRIMARY KEY,
c_time varchar(50),
d_time varchar(50) GENERATED ALWAYS AS (case when time_format(c_time,'%H:%i:%s.%f') > "10:10:10" then "now" when time_format(c_time, '%H:%i:%s.%f') <= "21:10:10" then 'yesterday' end)
);
CREATE INDEX idx_t1 ON T1(d_time);
INSERT INTO T1(A,C_TIME) VALUES(1,'2020-02-29 10:11:59');
INSERT INTO T1(A,C_TIME) VALUES(2,'09:10:05');
INSERT INTO T1(A,C_TIME) VALUES(3,'21:10:15');
INSERT INTO T1(A,C_TIME) VALUES(4,NULL);
INSERT INTO T1(A,C_TIME) VALUES(5,0);
# timeformat-3-mysql
# 内置转换
DROP TABLE t2;
CREATE TABLE t2 (
time_stp timestamp
);
INSERT INTO T2 VALUES('2013-05-22 18:32:37.4455848');
DROP TABLE T1;
CREATE TABLE `t1` (
a bigint DEFAULT NULL,
b float DEFAULT NULL,
c double DEFAULT NULL,
d date DEFAULT NULL,
e time DEFAULT NULL,
f year DEFAULT NULL,
g timestamp,
h char(20) DEFAULT NULL,
i varchar(20) DEFAULT NULL,
j text DEFAULT NULL
);
INSERT INTO T1(a) values((time_format((select time_stp from t2), '%H%i%s')));
INSERT INTO T1(a) values(time_format(201, '%H%i%s'));
INSERT INTO T1(a) values(time_format('09:10:05', '%H%i%s'));
INSERT INTO T1(b) values(time_format((select time_stp from t2), '%H%i%s.%f'));
INSERT INTO T1(b) values(time_format(201, '%H%i%s.%f'));
INSERT INTO T1(b) values(time_format('09:10:05', '%H%i%s'));
INSERT INTO T1(c) values(time_format((select time_stp from t2), '%H%i%s.%f'));
INSERT INTO T1(c) values(time_format(201, '%H%i%s.%f'));
INSERT INTO T1(c) values(time_format('09:10:05', '%H%i%s.%f'));
INSERT INTO T1(d) values(time_format((select time_stp from t2), '%H-%i-%s'));
INSERT INTO T1(d) values(time_format(201, '%H%i%s.%f'));
INSERT INTO T1(d) values(time_format('09:10:05', '%H%i%s.%f'));
INSERT INTO T1(e) values(time_format((select time_stp from t2), '%H%i%s.%f'));
INSERT INTO T1(e) values(time_format(201, '%H%i%s.%f'));
INSERT INTO T1(e) values(time_format('09:10:05', '%H%i%s.%f'));
INSERT INTO T1(f) values(time_format((select time_stp from t2), '%H%i%s.%f'));
INSERT INTO T1(f) values(time_format(201, '%H%i%s.%f'));
INSERT INTO T1(f) values(time_format('09:10:05', '%H%i%s.%f'));
INSERT INTO T1(g) values(time_format((select time_stp from t2), '%H%i%s.%f'));
INSERT INTO T1(g) values(time_format('09:10:05', '%H%i%s.%f'));
INSERT INTO T1(h) values(time_format((select time_stp from t2), '%H%i%s.%f'));
INSERT INTO T1(h) values(time_format(201, '%H%i%s.%f'));
INSERT INTO T1(h) values(time_format('09:10:05', '%H%i%s.%f'));
INSERT INTO T1(i) values(time_format((select time_stp from t2), '%H%i%s.%f'));
INSERT INTO T1(i) values(time_format(201, '%H%i%s.%f'));
INSERT INTO T1(i) values(time_format('09:10:05', '%H%i%s.%f'));
INSERT INTO T1(j) values(time_format((select time_stp from t2), '%H%i%s.%f'));
INSERT INTO T1(j) values(time_format(201, '%H%i%s.%f'));
INSERT INTO T1(j) values(time_format('09:10:05', '%H%i%s.%f'));
TRUNCATE TABLE T1;
INSERT INTO T1(a) values(time_format((select time_stp from t2), '%H%i%s.%f'));
UPDATE T1 SET A = (time_format((select time_stp from t2), '%H%i%s.%f'));
UPDATE T1 SET A = (time_format(201, '%H%i%s.%f'));
UPDATE T1 SET A = (time_format('09:10:05', '%H%i%s.%f'));
SELECT a FROM T1;
a
91005
UPDATE T1 SET B = (time_format((select time_stp from t2), '%H%i%s.%f'));
UPDATE T1 SET B = (time_format(201, '%H%i%s.%f'));
UPDATE T1 SET B = (time_format('09:10:05', '%H%i%s.%f'));
SELECT B FROM T1;
B
91005
UPDATE T1 SET C = (time_format((select time_stp from t2), '%H%i%s.%f'));
UPDATE T1 SET c = (time_format(201, '%H%i%s.%f'));
UPDATE T1 SET c = (time_format('09:10:05', '%H%i%s.%f'));
SELECT c FROM T1;
c
91005
UPDATE T1 SET d = (time_format((select time_stp from t2), '%H%i%s.%f'));
UPDATE T1 SET d = (time_format(201, '%H%i%s.%f'));
UPDATE T1 SET d = (time_format('09:10:05', '%H%i%s.%f'));
SELECT d FROM T1;
d
2009-10-05
UPDATE T1 SET e = (time_format((select time_stp from t2), '%H%i%s.%f'));
UPDATE T1 SET e = (time_format(201, '%H%i%s.%f'));
UPDATE T1 SET e = (time_format('09:10:05', '%H%i%s.%f'));
SELECT e FROM T1;
e
09:10:05
UPDATE T1 SET f = (time_format((select time_stp from t2), '%H%i%s.%f'));
UPDATE T1 SET f = (time_format(201, '%H%i%s.%f'));
UPDATE T1 SET f = (time_format('09:10:05', '%H%i%s.%f'));
SELECT f FROM T1;
f
NULL
UPDATE T1 SET g = (time_format((select time_stp from t2), '%H%i%s.%f'));
UPDATE T1 SET g = (time_format(201, '%H%i%s.%f'));
UPDATE T1 SET g = (time_format('09:10:05', '%H%i%s.%f'));
SELECT g FROM T1;
g
2009-10-05 00:00:00
UPDATE T1 SET h = (time_format((select time_stp from t2), '%H%i%s.%f'));
UPDATE T1 SET h = (time_format(201, '%H%i%s.%f'));
UPDATE T1 SET h = (time_format('09:10:05', '%H%i%s.%f'));
SELECT h FROM T1;
h
091005.000000
UPDATE T1 SET i = (time_format((select time_stp from t2), '%H%i%s.%f'));
UPDATE T1 SET i = (time_format(201, '%H%i%s.%f'));
UPDATE T1 SET i = (time_format('09:10:05', '%H%i%s.%f'));
SELECT i FROM T1;
i
091005.000000
UPDATE T1 SET j = (time_format((select time_stp from t2), '%H%i%s.%f'));
UPDATE T1 SET j = (time_format(201, '%H%i%s.%f'));
UPDATE T1 SET j = (time_format('09:10:05', '%H%i%s.%f'));
SELECT j FROM T1;
j
091005.000000
# timeformat-4-mysql
# 函数嵌套
DROP TABLE t1;
CREATE TABLE T1(
a bigint,
b varchar(30),
c timestamp
)PARTITION BY RANGE(a)
(
PARTITION id_part1 values less than (3),
PARTITION id_part2 values less than (8),
PARTITION id_part3 values less than (MAXVALUE)
);
insert into t1 values (1, CAST(time_format('2012-04-20 11:57:49.000', '%H%i%s') AS UNSIGNED INTEGER), '2013-05-22 18:32:37.000');
insert into t1 values (2, null , '1992-01-02 23:51:32.000');
insert into t1 values (4, hour(time_format('1995-12-02 22:30:27', '%H%i%s')), '1980-12-03 01:08:01.000');
insert into t1 values (7, date(time_format('1980-12-03 01:08:01.000', '%H%i%s.%f')), '1980-12-03 01:08:01.000');
insert into t1 values (10, time_format(CURRENT_DATE(), '%H%i%s.%f'), '2006-03-31 14:45:32.000');
insert into t1 values(11, (select time_format(e.c, '%H%i%s.%f') from t1 e where e.a=3),  '2006-08-09 03:20:51');
insert into t1 values (time_format(201, '%H%i%s.%f'), '2006-08-09 03:20:51', '2015-01-30 06:13:54.000');
update t1 set b = time_format(STR_TO_DATE('1995-12-02 22:30:27', '%Y-%m-%d'), '%H%i%s.%f') where a = 3;
# 分区表
DROP TABLE t1;
CREATE TABLE T1(
a bigint,
b datetime
)partition by range columns(b) subpartition by hash(a) subpartitions 2
( 
partition part_1 values less than ('2016-09-01'),
partition part_2 values less than ('2020-09-01'),
partition part_3 values less than ('2021-09-01')
);
insert into t1 values(1,(substr(time_format('2012-04-20 11:57:49.000', '%H:%i:%s'),1)));
insert into t1 values(LENGTH(time_format('1995-12-02 22:30:27', '%H%i%s')),'1995-12-02 22:30:27');
insert into t1 values(ROUND(time_format('2006-08-09 03:20:51', '%H%i%s')), '2006-08-09 03:20:51');
insert into t1 values(CEIL(time_format('2006-03-31 14:45:32', '%H%i%s')), '2006-03-31 14:45:32');
insert into t1 values(FLOOR(time_format('2016-03-19 13:22:51', '%H%i%s')), '2016-03-19 13:22:51');
insert into t1 values(ABS(time_format('2010-12-03 16:03:03', '%H%i%s')), '2010-12-03 16:03:03');
insert into t1 values(NEG(time_format('1992-01-02 23:51:32', '%H%i%s')), '1992-01-02 23:51:32');
insert into t1 values(SIGN(time_format('1980-12-03 01:08:01', '%H%i%s')), '1980-12-03 01:08:01.000');
insert into t1 values(11,null);
select least(time_format(b, '%H%i%s'), '1987-06-28 02:24:22.000', sign(null)) from t1;
least(time_format(b, '%H%i%s'), '1987-06-28 02:24:22.000', sign(null))
NULL
NULL
NULL
NULL
NULL
NULL
NULL
NULL
select least(time_format(b, '%H%i%s'), '1987-06-28 02:24:22.000') from t1;
least(time_format(b, '%H%i%s'), '1987-06-28 02:24:22.000')
1987-06-28 02:24:22.000
144532
1987-06-28 02:24:22.000
032051
132251
160303
010801
NULL
select * from t1 where time_format(b, '%H%i%s') is null order by a;
a	b
11	NULL
select * from t1 where time_format(b, '%H%i%s') is not null order by a;
a	b
-235132	1992-01-02 23:51:32
1	1980-12-03 01:08:01
6	1995-12-02 22:30:27
32051	2006-08-09 03:20:51
132251	2016-03-19 13:22:51
144532	2006-03-31 14:45:32
160303	2010-12-03 16:03:03
SELECT TIME_FORMAT((DATE_ADD('2021-04-21 16:04:53', INTERVAL 5 DAY)), '%r %T %H %k %I %i %s %f');
TIME_FORMAT((DATE_ADD('2021-04-21 16:04:53', INTERVAL 5 DAY)), '%r %T %H %k %I %i %s %f')
04:04:53 PM 16:04:53 16 16 04 04 53 000000
SELECT TIME_FORMAT((DATE_ADD('2021-04-21', INTERVAL 5 MICROSECOND)), '%r %T %H %k %I %f');
TIME_FORMAT((DATE_ADD('2021-04-21', INTERVAL 5 MICROSECOND)), '%r %T %H %k %I %f')
12:00:00 AM 00:00:00 00 0 12 000005
SELECT TIME_FORMAT((DATE_ADD('2021-04-21', INTERVAL 5 SECOND)), '%r %T %H %k %I %f');
TIME_FORMAT((DATE_ADD('2021-04-21', INTERVAL 5 SECOND)), '%r %T %H %k %I %f')
12:00:05 AM 00:00:05 00 0 12 000000
SELECT TIME_FORMAT((DATE_ADD('2021-04-21', INTERVAL 5 WEEK)), '%r %T %H %k %I %f');
TIME_FORMAT((DATE_ADD('2021-04-21', INTERVAL 5 WEEK)), '%r %T %H %k %I %f')
12:20:21 AM 00:20:21 00 0 12 000000
SELECT TIME_FORMAT((DATE_ADD('2021-04-21', INTERVAL 5 MONTH)), '%r %T %H %k %I %f');
TIME_FORMAT((DATE_ADD('2021-04-21', INTERVAL 5 MONTH)), '%r %T %H %k %I %f')
12:20:21 AM 00:20:21 00 0 12 000000
SELECT TIME_FORMAT((DATE_ADD('2021-04-21', INTERVAL 5 YEAR)), '%r %T %H %k %I %f');
TIME_FORMAT((DATE_ADD('2021-04-21', INTERVAL 5 YEAR)), '%r %T %H %k %I %f')
12:20:26 AM 00:20:26 00 0 12 000000
SELECT TIME_FORMAT((DATE_ADD('2014-01-10', INTERVAL '5.000005' SECOND_MICROSECOND)), '%r %T %H %k %I %f');
TIME_FORMAT((DATE_ADD('2014-01-10', INTERVAL '5.000005' SECOND_MICROSECOND)), '%r %T %H %k %I %f')
12:00:05 AM 00:00:05 00 0 12 000005
SELECT TIME_FORMAT((DATE_ADD('2014-01-10', INTERVAL '05:05.000005' MINUTE_MICROSECOND)), '%r %T %H %k %I %f');
TIME_FORMAT((DATE_ADD('2014-01-10', INTERVAL '05:05.000005' MINUTE_MICROSECOND)), '%r %T %H %k %I %f')
12:05:05 AM 00:05:05 00 0 12 000005
SELECT TIME_FORMAT((DATE_ADD('2014-01-10', INTERVAL '05:65' HOUR_MINUTE)), '%r %T %H %k %I %f');
TIME_FORMAT((DATE_ADD('2014-01-10', INTERVAL '05:65' HOUR_MINUTE)), '%r %T %H %k %I %f')
06:05:00 AM 06:05:00 06 6 06 000000
SELECT TIME_FORMAT((DATE_ADD('2014-01-10', INTERVAL '61:65' HOUR_MINUTE)), '%r %T %H %k %I %f');
TIME_FORMAT((DATE_ADD('2014-01-10', INTERVAL '61:65' HOUR_MINUTE)), '%r %T %H %k %I %f')
02:05:00 PM 14:05:00 14 14 02 000000
SELECT TIME_FORMAT((DATE_ADD('2014-01-10', INTERVAL '01 05:05:65.000065' DAY_MICROSECOND)), '%r %T %H %k %I %f');
TIME_FORMAT((DATE_ADD('2014-01-10', INTERVAL '01 05:05:65.000065' DAY_MICROSECOND)), '%r %T %H %k %I %f')
05:06:05 AM 05:06:05 05 5 05 000065
SELECT time_format(b * 10, '%r %T %H %k %I %f') FROM t1 order by a ;
time_format(b * 10, '%r %T %H %k %I %f')
11:51:32 PM 23:51:32 23 23 11 000000
01:08:01 AM 01:08:01 01 1 01 000000
10:30:27 PM 22:30:27 22 22 10 000000
NULL
03:20:51 AM 03:20:51 03 3 03 000000
01:22:51 PM 13:22:51 13 13 01 000000
02:45:32 PM 14:45:32 14 14 02 000000
04:03:03 PM 16:03:03 16 16 04 000000
SELECT time_format(b + 1500, '%r %T %H %k %I %f') FROM t1 order by a ;
time_format(b + 1500, '%r %T %H %k %I %f')
NULL
01:23:01 AM 01:23:01 01 1 01 000000
10:45:27 PM 22:45:27 22 22 10 000000
NULL
03:35:51 AM 03:35:51 03 3 03 000000
01:37:51 PM 13:37:51 13 13 01 000000
NULL
04:18:03 PM 16:18:03 16 16 04 000000
SELECT time_format(b - 1000, '%r %T %H %k %I %f') FROM t1 order by a;
time_format(b - 1000, '%r %T %H %k %I %f')
11:41:32 PM 23:41:32 23 23 11 000000
NULL
10:20:27 PM 22:20:27 22 22 10 000000
NULL
03:10:51 AM 03:10:51 03 3 03 000000
01:12:51 PM 13:12:51 13 13 01 000000
02:35:32 PM 14:35:32 14 14 02 000000
NULL
SELECT time_format(b / 1500, '%r %T %H %k %I %f') FROM t1 order by a;
time_format(b / 1500, '%r %T %H %k %I %f')
NULL
NULL
NULL
NULL
NULL
NULL
NULL
NULL
SELECT time_format(b / 1500 * 10, '%r %T %H %k %I %f') FROM t1 order by a;
time_format(b / 1500 * 10, '%r %T %H %k %I %f')
NULL
NULL
NULL
NULL
NULL
NULL
NULL
NULL
SELECT time_format(b * 10 - 0.1, '%r %T %H %k %I %f') FROM t1 order by a;
time_format(b * 10 - 0.1, '%r %T %H %k %I %f')
11:51:31 PM 23:51:31 23 23 11 000000
01:08:00 AM 01:08:00 01 1 01 000000
10:30:26 PM 22:30:26 22 22 10 000000
NULL
03:20:50 AM 03:20:50 03 3 03 000000
01:22:50 PM 13:22:50 13 13 01 000000
02:45:31 PM 14:45:31 14 14 02 000000
04:03:02 PM 16:03:02 16 16 04 000000
SELECT time_format(b * 0.221 - 0.1, '%r %T %H %k %I %f') FROM t1 order by a;
time_format(b * 0.221 - 0.1, '%r %T %H %k %I %f')
NULL
NULL
NULL
NULL
NULL
NULL
NULL
NULL
SELECT time_format(b % 3, '%r %T %H %k %I %f') FROM t1 order by a;
time_format(b % 3, '%r %T %H %k %I %f')
12:00:01 AM 00:00:01 00 0 12 000000
12:00:01 AM 00:00:01 00 0 12 000000
12:00:00 AM 00:00:00 00 0 12 000000
NULL
12:00:00 AM 00:00:00 00 0 12 000000
12:00:00 AM 00:00:00 00 0 12 000000
12:00:01 AM 00:00:01 00 0 12 000000
12:00:01 AM 00:00:01 00 0 12 000000
SELECT time_format(b * 0, '%r %T %H %k %I %f') FROM t1 order by a;
time_format(b * 0, '%r %T %H %k %I %f')
12:00:00 AM 00:00:00 00 0 12 000000
12:00:00 AM 00:00:00 00 0 12 000000
12:00:00 AM 00:00:00 00 0 12 000000
NULL
12:00:00 AM 00:00:00 00 0 12 000000
12:00:00 AM 00:00:00 00 0 12 000000
12:00:00 AM 00:00:00 00 0 12 000000
12:00:00 AM 00:00:00 00 0 12 000000
SELECT time_format(b / 0, '%r %T %H %k %I %f') FROM t1 order by a;
time_format(b / 0, '%r %T %H %k %I %f')
NULL
NULL
NULL
NULL
NULL
NULL
NULL
NULL
SELECT time_format(b * NULL, '%r %T %H %k %I %f') FROM t1 order by a;
time_format(b * NULL, '%r %T %H %k %I %f')
NULL
NULL
NULL
NULL
NULL
NULL
NULL
NULL
SELECT time_format(b - 0.111, '%r %T %H %k %I %f') FROM t1 order by a;
time_format(b - 0.111, '%r %T %H %k %I %f')
11:51:31 PM 23:51:31 23 23 11 889000
01:08:00 AM 01:08:00 01 1 01 889000
10:30:26 PM 22:30:26 22 22 10 889000
NULL
03:20:50 AM 03:20:50 03 3 03 889000
01:22:50 PM 13:22:50 13 13 01 889000
02:45:31 PM 14:45:31 14 14 02 889000
04:03:02 PM 16:03:02 16 16 04 889000
SELECT time_format('2003-12-31 12:00:00.000001', '%H:%i:%s.%f') > time_format('2003-12-31 12:00:00.000002','%H:%i:%S') FROM DUAL;
time_format('2003-12-31 12:00:00.000001', '%H:%i:%s.%f') > time_format('2003-12-31 12:00:00.000002','%H:%i:%S')
1
SELECT time_format('2003-12-31 12:00:00.000001', '%H:%i:%s.%f') < time_format('2003-12-31 12:00:00.000002', '%H:%i:%S') FROM DUAL;
time_format('2003-12-31 12:00:00.000001', '%H:%i:%s.%f') < time_format('2003-12-31 12:00:00.000002', '%H:%i:%S')
0
SELECT time_format('2003-12-31 12:00:00.000001', '%H:%i:%s.%f') = time_format('2003-12-31 12:00:00.000002', '%H:%i:%S.%f') FROM DUAL;
time_format('2003-12-31 12:00:00.000001', '%H:%i:%s.%f') = time_format('2003-12-31 12:00:00.000002', '%H:%i:%S.%f')
0
SELECT time_format('2005-12-31 12:00:00.000001', '%H:%i:%s.%f') > time_format('2003-12-31 12:00:00.0000002', '%H:%i:%s.%f') FROM DUAL;
time_format('2005-12-31 12:00:00.000001', '%H:%i:%s.%f') > time_format('2003-12-31 12:00:00.0000002', '%H:%i:%s.%f')
1
SELECT time_format('2003-12-31 12:00:00.000001', '%H:%i:%s.%f') = time_format('2003-12-31 12:00:00.0000002', '%H:%i:%s.%f') FROM DUAL;
time_format('2003-12-31 12:00:00.000001', '%H:%i:%s.%f') = time_format('2003-12-31 12:00:00.0000002', '%H:%i:%s.%f')
0
SELECT time_format('2003-12-31 12:00:00.000001', '%H:%i:%s.%f') < time_format('2003-12-31 12:00:00.0000002', '%H:%i:%s.%f') FROM DUAL;
time_format('2003-12-31 12:00:00.000001', '%H:%i:%s.%f') < time_format('2003-12-31 12:00:00.0000002', '%H:%i:%s.%f')
0
SELECT time_format('2003-12-31 12:00:00.000001', '%H:%i:%s.%f') < time_format('2003-12-31 12:00:00.000002', '%H:%i:%s.%f') FROM DUAL;
time_format('2003-12-31 12:00:00.000001', '%H:%i:%s.%f') < time_format('2003-12-31 12:00:00.000002', '%H:%i:%s.%f')
1
SELECT time_format('2003-12-31 12:00:00.000001', '%H:%i:%s.%f') <=> time_format(NULL, '%H:%i:%s.%f')  FROM DUAL;
time_format('2003-12-31 12:00:00.000001', '%H:%i:%s.%f') <=> time_format(NULL, '%H:%i:%s.%f')
0
SELECT time_format(null, '%H:%i:%s.%f') <=> time_format(NULL, '%H:%i:%s.%f')  FROM DUAL;
time_format(null, '%H:%i:%s.%f') <=> time_format(NULL, '%H:%i:%s.%f')
1
SELECT '12:00:00' BETWEEN time_format('2003-12-31 12:00:00.000001', '%H:%i:%s.%f') AND time_format('2023-12-31 12:00:00.000001', '%H:%i:%s.%f') FROM DUAL;
'12:00:00' BETWEEN time_format('2003-12-31 12:00:00.000001', '%H:%i:%s.%f') AND time_format('2023-12-31 12:00:00.000001', '%H:%i:%s.%f')
0
SELECT '12:00:00' BETWEEN time_format('2003-12-31 11:00:00.000001', '%H:%i:%s.%f') AND time_format('2023-12-31 12:00:00.000001', '%H:%i:%s.%f') FROM DUAL;
'12:00:00' BETWEEN time_format('2003-12-31 11:00:00.000001', '%H:%i:%s.%f') AND time_format('2023-12-31 12:00:00.000001', '%H:%i:%s.%f')
1
SELECT '2013-12-31' BETWEEN time_format('2003-12-31 12:00:00.000001', '%H:%i:%s.%f') AND time_format('2023-12-31 12:00:00.000001', '%H:%i:%s.%f') FROM DUAL;
'2013-12-31' BETWEEN time_format('2003-12-31 12:00:00.000001', '%H:%i:%s.%f') AND time_format('2023-12-31 12:00:00.000001', '%H:%i:%s.%f')
0
SELECT '2013-12-31 12:00:00' BETWEEN time_format('2003-12-31', '%H:%i:%s.%f') AND time_format('2023-12-31', '%H:%i:%s.%f') FROM DUAL;
'2013-12-31 12:00:00' BETWEEN time_format('2003-12-31', '%H:%i:%s.%f') AND time_format('2023-12-31', '%H:%i:%s.%f')
0
SELECT time_format('09:10:05', '%H:%i:%s.%f') OR time_format('09:10:06', '%H:%i:%s.%f') FROM DUAL;
time_format('09:10:05', '%H:%i:%s.%f') OR time_format('09:10:06', '%H:%i:%s.%f')
1
Warnings:
Warning	1292	Truncated incorrect DOUBLE value: '09:10:05.000000'
SELECT time_format('09:10:05', '%H:%i:%s.%f') OR time_format(201, '%H:%i:%s.%f') FROM DUAL;
time_format('09:10:05', '%H:%i:%s.%f') OR time_format(201, '%H:%i:%s.%f')
1
Warnings:
Warning	1292	Truncated incorrect DOUBLE value: '09:10:05.000000'
SELECT time_format(201, '%H:%i:%s.%f') or time_format('09:10:05', '%H:%i:%s.%f') FROM DUAL;
time_format(201, '%H:%i:%s.%f') or time_format('09:10:05', '%H:%i:%s.%f')
1
Warnings:
Warning	1292	Truncated incorrect DOUBLE value: '00:02:01.000000'
Warning	1292	Truncated incorrect DOUBLE value: '09:10:05.000000'
SELECT time_format(NULL, '%H:%i:%s.%f') or time_format('09:10:05', '%H:%i:%s.%f') FROM DUAL;
time_format(NULL, '%H:%i:%s.%f') or time_format('09:10:05', '%H:%i:%s.%f')
1
Warnings:
Warning	1292	Truncated incorrect DOUBLE value: '09:10:05.000000'
SELECT time_format(NULL, '%H:%i:%s.%f') and time_format('09:10:05', '%H:%i:%s.%f') FROM DUAL;
time_format(NULL, '%H:%i:%s.%f') and time_format('09:10:05', '%H:%i:%s.%f')
NULL
Warnings:
Warning	1292	Truncated incorrect DOUBLE value: '09:10:05.000000'
SELECT time_format('09:10:05', '%H:%i:%s.%f') and time_format(NULL, '%H:%i:%s.%f') FROM DUAL;
time_format('09:10:05', '%H:%i:%s.%f') and time_format(NULL, '%H:%i:%s.%f')
NULL
Warnings:
Warning	1292	Truncated incorrect DOUBLE value: '09:10:05.000000'
SELECT time_format(301, '%H:%i:%s.%f') OR time_format(201, '%H:%i:%s.%f') FROM DUAL;
time_format(301, '%H:%i:%s.%f') OR time_format(201, '%H:%i:%s.%f')
0
Warnings:
Warning	1292	Truncated incorrect DOUBLE value: '00:03:01.000000'
Warning	1292	Truncated incorrect DOUBLE value: '00:02:01.000000'
SELECT NOT time_format(301, '%H:%i:%s.%f') FROM DUAL;
NOT time_format(301, '%H:%i:%s.%f')
1
Warnings:
Warning	1292	Truncated incorrect DOUBLE value: '00:03:01.000000'
SELECT NOT time_format(NULL, '%H:%i:%s.%f') FROM DUAL;
NOT time_format(NULL, '%H:%i:%s.%f')
NULL
SELECT NOT time_format(0, '%H:%i:%s.%f') FROM DUAL;
NOT time_format(0, '%H:%i:%s.%f')
1
Warnings:
Warning	1292	Truncated incorrect DOUBLE value: '00:00:00.000000'
SELECT !time_format(0, '%H:%i:%s.%f') FROM DUAL;
!time_format(0, '%H:%i:%s.%f')
1
Warnings:
Warning	1292	Truncated incorrect DOUBLE value: '00:00:00.000000'
SELECT !time_format(301, '%H:%i:%s.%f') FROM DUAL;
!time_format(301, '%H:%i:%s.%f')
1
Warnings:
Warning	1292	Truncated incorrect DOUBLE value: '00:03:01.000000'
SELECT !time_format('2003-12-31 12:00:00', '%H:%i:%s.%f') FROM DUAL;
!time_format('2003-12-31 12:00:00', '%H:%i:%s.%f')
0
Warnings:
Warning	1292	Truncated incorrect DOUBLE value: '12:00:00.000000'
SELECT time_format('2003-12-31 12:00:00', '%H:%i:%s.%f') xor time_format('2003-12-31 12:00:00', '%H:%i:%s.%f') FROM DUAL;
time_format('2003-12-31 12:00:00', '%H:%i:%s.%f') xor time_format('2003-12-31 12:00:00', '%H:%i:%s.%f')
0
Warnings:
Warning	1292	Truncated incorrect DOUBLE value: '12:00:00.000000'
SELECT time_format('2003-12-31 12:00:00', '%H:%i:%s.%f') xor time_format(null, '%H:%i:%s.%f') FROM DUAL;
time_format('2003-12-31 12:00:00', '%H:%i:%s.%f') xor time_format(null, '%H:%i:%s.%f')
NULL
Warnings:
Warning	1292	Truncated incorrect DOUBLE value: '12:00:00.000000'
SELECT time_format(201, '%H:%i:%s.%f') xor time_format('2003-12-31 12:00:00', '%H:%i:%s.%f') FROM DUAL;
time_format(201, '%H:%i:%s.%f') xor time_format('2003-12-31 12:00:00', '%H:%i:%s.%f')
1
Warnings:
Warning	1292	Truncated incorrect DOUBLE value: '00:02:01.000000'
Warning	1292	Truncated incorrect DOUBLE value: '12:00:00.000000'
SELECT time_format('2003-12-31 12:00:00', '%H:%i:%s.%f') xor time_format(0, '%H:%i:%s.%f') FROM DUAL;
time_format('2003-12-31 12:00:00', '%H:%i:%s.%f') xor time_format(0, '%H:%i:%s.%f')
1
Warnings:
Warning	1292	Truncated incorrect DOUBLE value: '12:00:00.000000'
Warning	1292	Truncated incorrect DOUBLE value: '00:00:00.000000'
SELECT (time_format('2003-12-31 12:00:00', '%H:%i:%s.%f')) ^ (time_format(0, '%H:%i:%s.%f')) FROM DUAL;
(time_format('2003-12-31 12:00:00', '%H:%i:%s.%f')) ^ (time_format(0, '%H:%i:%s.%f'))
12
Warnings:
Warning	1292	Truncated incorrect INTEGER value: '12:00:00.000000'
Warning	1292	Truncated incorrect INTEGER value: '00:00:00.000000'
SELECT time_format('2003-12-31 12:00:00', '%H:%i:%s.%f') ^ time_format(201, '%H:%i:%s.%f') FROM DUAL;
time_format('2003-12-31 12:00:00', '%H:%i:%s.%f') ^ time_format(201, '%H:%i:%s.%f')
12
Warnings:
Warning	1292	Truncated incorrect INTEGER value: '12:00:00.000000'
Warning	1292	Truncated incorrect INTEGER value: '00:02:01.000000'
SELECT time_format('2003-12-31 12:00:00', '%H:%i:%s.%f') ^ time_format('2012-04-20 11:57:49.000', '%H:%i:%s.%f') FROM DUAL;
time_format('2003-12-31 12:00:00', '%H:%i:%s.%f') ^ time_format('2012-04-20 11:57:49.000', '%H:%i:%s.%f')
7
Warnings:
Warning	1292	Truncated incorrect INTEGER value: '12:00:00.000000'
Warning	1292	Truncated incorrect INTEGER value: '11:57:49.000000'
SELECT time_format('2003-12-31 12:00:00', '%H:%i:%s.%f') >> time_format(201, '%H:%i:%s.%f') FROM DUAL;
time_format('2003-12-31 12:00:00', '%H:%i:%s.%f') >> time_format(201, '%H:%i:%s.%f')
12
Warnings:
Warning	1292	Truncated incorrect INTEGER value: '12:00:00.000000'
Warning	1292	Truncated incorrect INTEGER value: '00:02:01.000000'
SELECT time_format('2003-12-31 12:00:00', '%H:%i:%s.%f') << time_format(201, '%H:%i:%s.%f') FROM DUAL;
time_format('2003-12-31 12:00:00', '%H:%i:%s.%f') << time_format(201, '%H:%i:%s.%f')
12
Warnings:
Warning	1292	Truncated incorrect INTEGER value: '12:00:00.000000'
Warning	1292	Truncated incorrect INTEGER value: '00:02:01.000000'
SELECT ~time_format(201, '%H:%i:%s.%f') FROM DUAL;
~time_format(201, '%H:%i:%s.%f')
18446744073709551615
Warnings:
Warning	1292	Truncated incorrect INTEGER value: '00:02:01.000000'
SELECT ~time_format('2003-12-31 12:00:00', '%H:%i:%s.%f') FROM DUAL;
~time_format('2003-12-31 12:00:00', '%H:%i:%s.%f')
18446744073709551603
Warnings:
Warning	1292	Truncated incorrect INTEGER value: '12:00:00.000000'
SELECT ~time_format(0, '%H:%i:%s.%f') FROM DUAL;
~time_format(0, '%H:%i:%s.%f')
18446744073709551615
Warnings:
Warning	1292	Truncated incorrect INTEGER value: '00:00:00.000000'
SELECT time_format('09:10:05', '%H:%i:%s.%f') > time_format('09:10:06', '%H:%i:%s.%f') FROM DUAL;
time_format('09:10:05', '%H:%i:%s.%f') > time_format('09:10:06', '%H:%i:%s.%f')
0
SELECT time_format('09:10:05', '%H:%i:%s.%f') < time_format('09:10:06', '%H:%i:%s.%f') FROM DUAL;
time_format('09:10:05', '%H:%i:%s.%f') < time_format('09:10:06', '%H:%i:%s.%f')
1
SELECT time_format('09:10:05', '%H:%i:%s.%f') <> time_format('09:10:06', '%H:%i:%s.%f') FROM DUAL;
time_format('09:10:05', '%H:%i:%s.%f') <> time_format('09:10:06', '%H:%i:%s.%f')
1
SELECT time_format('09:10:05', '%H:%i:%s.%f') = time_format('09:10:06', '%H:%i:%s.%f') FROM DUAL;
time_format('09:10:05', '%H:%i:%s.%f') = time_format('09:10:06', '%H:%i:%s.%f')
0
SELECT time_format('09:10:05', '%H:%i:%s.%f') + 123456 FROM DUAL;
time_format('09:10:05', '%H:%i:%s.%f') + 123456
123465
Warnings:
Warning	1292	Truncated incorrect DOUBLE value: '09:10:05.000000'
SELECT time_format('09:10:05', '%H:%i:%s.%f') - 133444 FROM DUAL;
time_format('09:10:05', '%H:%i:%s.%f') - 133444
-133435
Warnings:
Warning	1292	Truncated incorrect DOUBLE value: '09:10:05.000000'
SELECT time_format('09:10:05', '%H:%i:%s.%f') - 123.456 FROM dual;
time_format('09:10:05', '%H:%i:%s.%f') - 123.456
-114.456
Warnings:
Warning	1292	Truncated incorrect DOUBLE value: '09:10:05.000000'
SELECT time_format('09:10:05', '%H:%i:%s.%f') - 123456 FROM dual;
time_format('09:10:05', '%H:%i:%s.%f') - 123456
-123447
Warnings:
Warning	1292	Truncated incorrect DOUBLE value: '09:10:05.000000'
SELECT time_format('2003-12-31 12:00:00', '%H:%i:%s.%f') * 1024 FROM DUAL;
time_format('2003-12-31 12:00:00', '%H:%i:%s.%f') * 1024
12288
Warnings:
Warning	1292	Truncated incorrect DOUBLE value: '12:00:00.000000'
SELECT time_format('2003-12-31 12:00:00', '%H:%i:%s.%f') - 1.175494351E-38 FROM DUAL;
time_format('2003-12-31 12:00:00', '%H:%i:%s.%f') - 1.175494351E-38
12
Warnings:
Warning	1292	Truncated incorrect DOUBLE value: '12:00:00.000000'
SELECT 1.175494351E-38 - time_format('2003-12-31 12:00:00', '%H:%i:%s.%f') FROM DUAL;
1.175494351E-38 - time_format('2003-12-31 12:00:00', '%H:%i:%s.%f')
-12
Warnings:
Warning	1292	Truncated incorrect DOUBLE value: '12:00:00.000000'
SELECT -3.402823466E+38 - time_format('2003-12-31 12:00:00', '%H:%i:%s.%f') FROM DUAL;
-3.402823466E+38 - time_format('2003-12-31 12:00:00', '%H:%i:%s.%f')
-3.402823466e38
Warnings:
Warning	1292	Truncated incorrect DOUBLE value: '12:00:00.000000'
SELECT 2.2250738585072014E-308  - time_format('2003-12-31 12:00:00', '%H:%i:%s.%f') FROM DUAL;
2.2250738585072014E-308  - time_format('2003-12-31 12:00:00', '%H:%i:%s.%f')
-12
Warnings:
Warning	1292	Truncated incorrect DOUBLE value: '12:00:00.000000'
SELECT time_format('2003-12-31 12:00:00', '%H:%i:%s.%f') + 1.7976931348623157E+308 FROM DUAL;
time_format('2003-12-31 12:00:00', '%H:%i:%s.%f') + 1.7976931348623157E+308
1.7976931348623157e308
Warnings:
Warning	1292	Truncated incorrect DOUBLE value: '12:00:00.000000'
SELECT time_format('2003-12-31 12:00:00', '%H:%i:%s.%f') + '0000-12-25' FROM DUAL;
time_format('2003-12-31 12:00:00', '%H:%i:%s.%f') + '0000-12-25'
12
Warnings:
Warning	1292	Truncated incorrect DOUBLE value: '12:00:00.000000'
Warning	1292	Truncated incorrect DOUBLE value: '0000-12-25'
SELECT time_format('09:10:05', '%H:%i:%s.%f') -  TIME('2003-12-31 01:02:03') FROM dual;
time_format('09:10:05', '%H:%i:%s.%f') -  TIME('2003-12-31 01:02:03')
-10194
Warnings:
Warning	1292	Truncated incorrect DOUBLE value: '09:10:05.000000'
SELECT TIME_FORMAT('2003-12-31 12:00:00.000001','%T') > TIME_FORMAT('2003-12-31 12:00:00.000002','%T') FROM DUAL;
TIME_FORMAT('2003-12-31 12:00:00.000001','%T') > TIME_FORMAT('2003-12-31 12:00:00.000002','%T')
0
SELECT TIME_FORMAT('2003-12-31 12:00:00.000001','%T.%f') < TIME_FORMAT('2003-12-31 12:00:00.000002','%T.%f') FROM DUAL;
TIME_FORMAT('2003-12-31 12:00:00.000001','%T.%f') < TIME_FORMAT('2003-12-31 12:00:00.000002','%T.%f')
1
SELECT TIME_FORMAT('2003-12-31 12:00:00.000001','%T.%f') = TIME_FORMAT('2003-12-31 12:00:00.000002','%T.%f') FROM DUAL;
TIME_FORMAT('2003-12-31 12:00:00.000001','%T.%f') = TIME_FORMAT('2003-12-31 12:00:00.000002','%T.%f')
0
SELECT TIME_FORMAT('2003-12-31 12:00:00.000001','%T.%f') > TIME_FORMAT('2003-12-31 12:00:00.0000002','%T.%f') FROM DUAL;
TIME_FORMAT('2003-12-31 12:00:00.000001','%T.%f') > TIME_FORMAT('2003-12-31 12:00:00.0000002','%T.%f')
1
SELECT TIME_FORMAT('2003-12-31 12:00:00.000001','%T.%f') = TIME_FORMAT('2003-12-31 12:00:00.0000002','%T.%f') FROM DUAL;
TIME_FORMAT('2003-12-31 12:00:00.000001','%T.%f') = TIME_FORMAT('2003-12-31 12:00:00.0000002','%T.%f')
0
SELECT TIME_FORMAT('2003-12-31 12:00:00.000001','%T.%f') < TIME_FORMAT('2003-12-31 12:00:00.0000002','%T.%f') FROM DUAL;
TIME_FORMAT('2003-12-31 12:00:00.000001','%T.%f') < TIME_FORMAT('2003-12-31 12:00:00.0000002','%T.%f')
0
SELECT TIME_FORMAT('2003-12-31 12:00:00.000001','%T.%f') <=> TIME_FORMAT(NULL,'%T.%f')  FROM DUAL;
TIME_FORMAT('2003-12-31 12:00:00.000001','%T.%f') <=> TIME_FORMAT(NULL,'%T.%f')
0
SELECT TIME_FORMAT(null,'%T.%f') <=> TIME_FORMAT(NULL,'%T.%f')  FROM DUAL;
TIME_FORMAT(null,'%T.%f') <=> TIME_FORMAT(NULL,'%T.%f')
1
SELECT '2013-12-31 12:00:00' BETWEEN TIME_FORMAT('2003-12-31 12:00:00.000001','%T.%f') AND TIME_FORMAT('2023-12-31 12:00:00.000001','%T.%f') FROM DUAL;
'2013-12-31 12:00:00' BETWEEN TIME_FORMAT('2003-12-31 12:00:00.000001','%T.%f') AND TIME_FORMAT('2023-12-31 12:00:00.000001','%T.%f')
0
SELECT '2013-12-31 12:00:00' BETWEEN TIME_FORMAT('2003-12-31 11:00:00.000001','%T.%f') AND TIME_FORMAT('2023-12-31 12:00:00.000001','%T.%f') FROM DUAL;
'2013-12-31 12:00:00' BETWEEN TIME_FORMAT('2003-12-31 11:00:00.000001','%T.%f') AND TIME_FORMAT('2023-12-31 12:00:00.000001','%T.%f')
0
SELECT '2013-12-31' BETWEEN TIME_FORMAT('2003-12-31 12:00:00.000001','%T.%f') AND TIME_FORMAT('2023-12-31 12:00:00.000001','%T.%f') FROM DUAL;
'2013-12-31' BETWEEN TIME_FORMAT('2003-12-31 12:00:00.000001','%T.%f') AND TIME_FORMAT('2023-12-31 12:00:00.000001','%T.%f')
0
SELECT '2013-12-31 12:00:00' BETWEEN TIME_FORMAT('2003-12-31','%T.%f') AND TIME_FORMAT('2023-12-31','%T.%f') FROM DUAL;
'2013-12-31 12:00:00' BETWEEN TIME_FORMAT('2003-12-31','%T.%f') AND TIME_FORMAT('2023-12-31','%T.%f')
0
SELECT TIME_FORMAT('09:10:05','%T.%f') OR TIME_FORMAT('09:10:06','%T.%f') FROM DUAL;
TIME_FORMAT('09:10:05','%T.%f') OR TIME_FORMAT('09:10:06','%T.%f')
1
Warnings:
Warning	1292	Truncated incorrect DOUBLE value: '09:10:05.000000'
SELECT TIME_FORMAT('09:10:05','%T.%f') OR TIME_FORMAT(201,'%T.%f') FROM DUAL;
TIME_FORMAT('09:10:05','%T.%f') OR TIME_FORMAT(201,'%T.%f')
1
Warnings:
Warning	1292	Truncated incorrect DOUBLE value: '09:10:05.000000'
SELECT TIME_FORMAT(201,'%T.%f') or TIME_FORMAT('09:10:05','%T.%f') FROM DUAL;
TIME_FORMAT(201,'%T.%f') or TIME_FORMAT('09:10:05','%T.%f')
1
Warnings:
Warning	1292	Truncated incorrect DOUBLE value: '00:02:01.000000'
Warning	1292	Truncated incorrect DOUBLE value: '09:10:05.000000'
SELECT TIME_FORMAT(NULL,'%T.%f') or TIME_FORMAT('09:10:05','%T.%f') FROM DUAL;
TIME_FORMAT(NULL,'%T.%f') or TIME_FORMAT('09:10:05','%T.%f')
1
Warnings:
Warning	1292	Truncated incorrect DOUBLE value: '09:10:05.000000'
SELECT TIME_FORMAT(NULL,'%T.%f') and TIME_FORMAT('09:10:05','%T.%f') FROM DUAL;
TIME_FORMAT(NULL,'%T.%f') and TIME_FORMAT('09:10:05','%T.%f')
NULL
Warnings:
Warning	1292	Truncated incorrect DOUBLE value: '09:10:05.000000'
SELECT TIME_FORMAT('09:10:05','%T.%f') and TIME_FORMAT(NULL,'%T.%f') FROM DUAL;
TIME_FORMAT('09:10:05','%T.%f') and TIME_FORMAT(NULL,'%T.%f')
NULL
Warnings:
Warning	1292	Truncated incorrect DOUBLE value: '09:10:05.000000'
SELECT TIME_FORMAT(301,'%T.%f') OR TIME_FORMAT(201,'%T.%f') FROM DUAL;
TIME_FORMAT(301,'%T.%f') OR TIME_FORMAT(201,'%T.%f')
0
Warnings:
Warning	1292	Truncated incorrect DOUBLE value: '00:03:01.000000'
Warning	1292	Truncated incorrect DOUBLE value: '00:02:01.000000'
SELECT NOT TIME_FORMAT(301,'%T.%f') FROM DUAL;
NOT TIME_FORMAT(301,'%T.%f')
1
Warnings:
Warning	1292	Truncated incorrect DOUBLE value: '00:03:01.000000'
SELECT NOT TIME_FORMAT(NULL,'%T.%f') FROM DUAL;
NOT TIME_FORMAT(NULL,'%T.%f')
NULL
SELECT NOT TIME_FORMAT(0,'%T.%f') FROM DUAL;
NOT TIME_FORMAT(0,'%T.%f')
1
Warnings:
Warning	1292	Truncated incorrect DOUBLE value: '00:00:00.000000'
SELECT !TIME_FORMAT(0,'%T.%f') FROM DUAL;
!TIME_FORMAT(0,'%T.%f')
1
Warnings:
Warning	1292	Truncated incorrect DOUBLE value: '00:00:00.000000'
SELECT !TIME_FORMAT(301,'%T.%f') FROM DUAL;
!TIME_FORMAT(301,'%T.%f')
1
Warnings:
Warning	1292	Truncated incorrect DOUBLE value: '00:03:01.000000'
SELECT !TIME_FORMAT('2003-12-31 12:00:00','%T.%f') FROM DUAL;
!TIME_FORMAT('2003-12-31 12:00:00','%T.%f')
0
Warnings:
Warning	1292	Truncated incorrect DOUBLE value: '12:00:00.000000'
SELECT TIME_FORMAT('2003-12-31 12:00:00','%T.%f') xor TIME_FORMAT('2003-12-31 12:00:00','%T.%f') FROM DUAL;
TIME_FORMAT('2003-12-31 12:00:00','%T.%f') xor TIME_FORMAT('2003-12-31 12:00:00','%T.%f')
0
Warnings:
Warning	1292	Truncated incorrect DOUBLE value: '12:00:00.000000'
SELECT TIME_FORMAT('2003-12-31 12:00:00','%T.%f') xor TIME_FORMAT(null,'%T.%f') FROM DUAL;
TIME_FORMAT('2003-12-31 12:00:00','%T.%f') xor TIME_FORMAT(null,'%T.%f')
NULL
Warnings:
Warning	1292	Truncated incorrect DOUBLE value: '12:00:00.000000'
SELECT TIME_FORMAT(201,'%T.%f') xor TIME_FORMAT('2003-12-31 12:00:00','%T.%f') FROM DUAL;
TIME_FORMAT(201,'%T.%f') xor TIME_FORMAT('2003-12-31 12:00:00','%T.%f')
1
Warnings:
Warning	1292	Truncated incorrect DOUBLE value: '00:02:01.000000'
Warning	1292	Truncated incorrect DOUBLE value: '12:00:00.000000'
SELECT TIME_FORMAT('2003-12-31 12:00:00','%T.%f') xor TIME_FORMAT(0,'%T.%f') FROM DUAL;
TIME_FORMAT('2003-12-31 12:00:00','%T.%f') xor TIME_FORMAT(0,'%T.%f')
1
Warnings:
Warning	1292	Truncated incorrect DOUBLE value: '12:00:00.000000'
Warning	1292	Truncated incorrect DOUBLE value: '00:00:00.000000'
SELECT (TIME_FORMAT('2003-12-31 12:00:00','%T.%f')) ^ (TIME_FORMAT(0,'%T.%f')) FROM DUAL;
(TIME_FORMAT('2003-12-31 12:00:00','%T.%f')) ^ (TIME_FORMAT(0,'%T.%f'))
12
Warnings:
Warning	1292	Truncated incorrect INTEGER value: '12:00:00.000000'
Warning	1292	Truncated incorrect INTEGER value: '00:00:00.000000'
SELECT TIME_FORMAT('2003-12-31 12:00:00','%T.%f') ^ TIME_FORMAT(201,'%T.%f') FROM DUAL;
TIME_FORMAT('2003-12-31 12:00:00','%T.%f') ^ TIME_FORMAT(201,'%T.%f')
12
Warnings:
Warning	1292	Truncated incorrect INTEGER value: '12:00:00.000000'
Warning	1292	Truncated incorrect INTEGER value: '00:02:01.000000'
SELECT TIME_FORMAT('2003-12-31 12:00:00','%T.%f') ^ TIME_FORMAT('2012-04-20 11:57:49.000','%T.%f') FROM DUAL;
TIME_FORMAT('2003-12-31 12:00:00','%T.%f') ^ TIME_FORMAT('2012-04-20 11:57:49.000','%T.%f')
7
Warnings:
Warning	1292	Truncated incorrect INTEGER value: '12:00:00.000000'
Warning	1292	Truncated incorrect INTEGER value: '11:57:49.000000'
SELECT TIME_FORMAT('2003-12-31 12:00:00','%T.%f') >> TIME_FORMAT(201,'%T.%f') FROM DUAL;
TIME_FORMAT('2003-12-31 12:00:00','%T.%f') >> TIME_FORMAT(201,'%T.%f')
12
Warnings:
Warning	1292	Truncated incorrect INTEGER value: '12:00:00.000000'
Warning	1292	Truncated incorrect INTEGER value: '00:02:01.000000'
SELECT TIME_FORMAT('2003-12-31 12:00:00','%T.%f') << TIME_FORMAT(201,'%T.%f') FROM DUAL;
TIME_FORMAT('2003-12-31 12:00:00','%T.%f') << TIME_FORMAT(201,'%T.%f')
12
Warnings:
Warning	1292	Truncated incorrect INTEGER value: '12:00:00.000000'
Warning	1292	Truncated incorrect INTEGER value: '00:02:01.000000'
SELECT ~TIME_FORMAT(201,'%T.%f') FROM DUAL;
~TIME_FORMAT(201,'%T.%f')
18446744073709551615
Warnings:
Warning	1292	Truncated incorrect INTEGER value: '00:02:01.000000'
SELECT ~TIME_FORMAT('2003-12-31 12:00:00','%T.%f') FROM DUAL;
~TIME_FORMAT('2003-12-31 12:00:00','%T.%f')
18446744073709551603
Warnings:
Warning	1292	Truncated incorrect INTEGER value: '12:00:00.000000'
SELECT ~TIME_FORMAT(0,'%T.%f') FROM DUAL;
~TIME_FORMAT(0,'%T.%f')
18446744073709551615
Warnings:
Warning	1292	Truncated incorrect INTEGER value: '00:00:00.000000'
SELECT TIME_FORMAT('09:10:05','%T.%f') > TIME_FORMAT('09:10:06','%T.%f') FROM DUAL;
TIME_FORMAT('09:10:05','%T.%f') > TIME_FORMAT('09:10:06','%T.%f')
0
SELECT TIME_FORMAT('09:10:05','%T.%f') < TIME_FORMAT('09:10:06','%T.%f') FROM DUAL;
TIME_FORMAT('09:10:05','%T.%f') < TIME_FORMAT('09:10:06','%T.%f')
1
SELECT TIME_FORMAT('09:10:05','%T.%f') <> TIME_FORMAT('09:10:06','%T.%f') FROM DUAL;
TIME_FORMAT('09:10:05','%T.%f') <> TIME_FORMAT('09:10:06','%T.%f')
1
SELECT TIME_FORMAT('09:10:05','%T.%f') + 123456 FROM DUAL;
TIME_FORMAT('09:10:05','%T.%f') + 123456
123465
Warnings:
Warning	1292	Truncated incorrect DOUBLE value: '09:10:05.000000'
SELECT TIME_FORMAT('09:10:05','%T.%f') - 133444 FROM DUAL;
TIME_FORMAT('09:10:05','%T.%f') - 133444
-133435
Warnings:
Warning	1292	Truncated incorrect DOUBLE value: '09:10:05.000000'
SELECT TIME_FORMAT('09:10:05','%T.%f') - 123.456 FROM dual;
TIME_FORMAT('09:10:05','%T.%f') - 123.456
-114.456
Warnings:
Warning	1292	Truncated incorrect DOUBLE value: '09:10:05.000000'
SELECT TIME_FORMAT('09:10:05','%T.%f') - 123456 FROM dual;
TIME_FORMAT('09:10:05','%T.%f') - 123456
-123447
Warnings:
Warning	1292	Truncated incorrect DOUBLE value: '09:10:05.000000'
SELECT TIME_FORMAT('2003-12-31 12:00:00','%T.%f') * 1024 FROM DUAL;
TIME_FORMAT('2003-12-31 12:00:00','%T.%f') * 1024
12288
Warnings:
Warning	1292	Truncated incorrect DOUBLE value: '12:00:00.000000'
SELECT TIME_FORMAT('2003-12-31 12:00:00','%T.%f') - 1.175494351E-38 FROM DUAL;
TIME_FORMAT('2003-12-31 12:00:00','%T.%f') - 1.175494351E-38
12
Warnings:
Warning	1292	Truncated incorrect DOUBLE value: '12:00:00.000000'
SELECT 1.175494351E-38 - TIME_FORMAT('2003-12-31 12:00:00','%T.%f') FROM DUAL;
1.175494351E-38 - TIME_FORMAT('2003-12-31 12:00:00','%T.%f')
-12
Warnings:
Warning	1292	Truncated incorrect DOUBLE value: '12:00:00.000000'
SELECT -3.402823466E+38 - TIME_FORMAT('2003-12-31 12:00:00','%T.%f') FROM DUAL;
-3.402823466E+38 - TIME_FORMAT('2003-12-31 12:00:00','%T.%f')
-3.402823466e38
Warnings:
Warning	1292	Truncated incorrect DOUBLE value: '12:00:00.000000'
SELECT 2.2250738585072014E-308  - TIME_FORMAT('2003-12-31 12:00:00','%T.%f') FROM DUAL;
2.2250738585072014E-308  - TIME_FORMAT('2003-12-31 12:00:00','%T.%f')
-12
Warnings:
Warning	1292	Truncated incorrect DOUBLE value: '12:00:00.000000'
SELECT TIME_FORMAT('2003-12-31 12:00:00','%T.%f') + 1.7976931348623157E+308 FROM DUAL;
TIME_FORMAT('2003-12-31 12:00:00','%T.%f') + 1.7976931348623157E+308
1.7976931348623157e308
Warnings:
Warning	1292	Truncated incorrect DOUBLE value: '12:00:00.000000'
SELECT TIME_FORMAT('2003-12-31 12:00:00','%T.%f') + '0000-12-25' FROM DUAL;
TIME_FORMAT('2003-12-31 12:00:00','%T.%f') + '0000-12-25'
12
Warnings:
Warning	1292	Truncated incorrect DOUBLE value: '12:00:00.000000'
Warning	1292	Truncated incorrect DOUBLE value: '0000-12-25'
SELECT TIME_FORMAT('09:10:05','%T.%f') -  TIME('2003-12-31 01:02:03') FROM dual;
TIME_FORMAT('09:10:05','%T.%f') -  TIME('2003-12-31 01:02:03')
-10194
Warnings:
Warning	1292	Truncated incorrect DOUBLE value: '09:10:05.000000'
# Clean up users
drop database obwmjtest;
drop user wmj456@'%' ;
