#Environmental cleaning
drop user wmj456@'%';
drop database obwmjtest;
create database obwmjtest;
create user wmj456 identified by 'wmj456';
grant all on *.* to wmj456 WITH GRANT OPTION;
DROP TABLE t2;
DROP TABLE t1;
DROP TABLE t3;
# timestamp-2-mysql
CREATE TABLE `t1` (
`id` int NOT NULL AUTO_INCREMENT,
`consumer` char(20) DEFAULT NULL,
`brand` varchar(20) DEFAULT NULL,
`sal` bigint DEFAULT NULL,
PRIMARY KEY (`id`)
);
INSERT INTO t1 VALUES(1,'书局','apple',5000);
INSERT INTO t1 VALUES(2,'微山','xiaomi',-4000);
INSERT INTO t1 VALUES(3,'深咖','oppo',0);
INSERT INTO t1 VALUES(4,'流苏','huawei',NULL);
INSERT INTO t1 VALUES(5,'玻璃','LG',6000);
INSERT INTO t1 VALUES(6,'钛钢','HTC',8000);
INSERT INTO t1 VALUES(7,'合金','VIVO',3500);
CREATE TABLE `t2` (
`id` int NOT NULL AUTO_INCREMENT,
`model` varchar(200) DEFAULT NULL,
`Price` bigint DEFAULT NULL,
PRIMARY KEY (`id`)
);
INSERT INTO t2 VALUES(1,'apple 12',7000);
INSERT INTO t2 VALUES(2,'xiaomi 9',0);
INSERT INTO t2 VALUES(3,'oppo findx',-6000);
INSERT INTO t2 VALUES(4,'huawei mata30',8000);
INSERT INTO t2 VALUES(5,'huawei mata30',NULL);
INSERT INTO t2 VALUES(6,'htc cc30',26.44);
INSERT INTO t2 VALUES(7,'shumei xi2',-26.44);
DROP VIEW T1_VIEW;
DROP VIEW T2_VIEW;
CREATE VIEW t1_view AS SELECT *  FROM t1;
CREATE VIEW t2_view AS SELECT *  FROM t2;
SELECT timestamp(e.id) FROM t1 e;
timestamp(e.id)
NULL
NULL
NULL
NULL
NULL
NULL
NULL
SELECT timestamp(e.consumer) FROM t1 e;
timestamp(e.consumer)
NULL
NULL
NULL
NULL
NULL
NULL
NULL
SELECT timestamp(e.brand) FROM t1 e;
timestamp(e.brand)
NULL
NULL
NULL
NULL
NULL
NULL
NULL
SELECT * FROM t1 e WHERE timestamp(e.sal) = 1;
id	consumer	brand	sal
3	深咖	oppo	0
SELECT timestamp(e.sal) sal,timestamp(p.Price) FROM t1 e LEFT JOIN t2 p ON e.id = p.id ORDER BY e.sal DESC;
sal	timestamp(p.Price)
NULL	NULL
NULL	NULL
NULL	NULL
NULL	NULL
0000-00-00 00:00:00	NULL
NULL	0000-00-00 00:00:00
NULL	NULL
SELECT timestamp(e.sal) sal,timestamp(p.Price) FROM t1 e RIGHT JOIN t2 p ON e.id = p.id ORDER BY e.sal DESC;
sal	timestamp(p.Price)
NULL	NULL
NULL	NULL
NULL	NULL
NULL	NULL
0000-00-00 00:00:00	NULL
NULL	0000-00-00 00:00:00
NULL	NULL
SELECT timestamp(e.sal) sal,timestamp(p.Price) FROM t1 e INNER JOIN t2 p ON e.id = p.id ORDER BY e.sal DESC;
sal	timestamp(p.Price)
NULL	NULL
NULL	NULL
NULL	NULL
NULL	NULL
0000-00-00 00:00:00	NULL
NULL	0000-00-00 00:00:00
NULL	NULL
SELECT * FROM (SELECT e.id,timestamp(e.sal) sal,timestamp(p.Price) FROM t1 e LEFT JOIN t2 p ON e.id = p.id ) e ORDER BY e.sal;
id	sal	timestamp(p.Price)
1	NULL	NULL
2	NULL	0000-00-00 00:00:00.000000
4	NULL	NULL
5	NULL	NULL
6	NULL	NULL
7	NULL	NULL
3	0000-00-00 00:00:00.000000	NULL
SELECT *  FROM t1 e WHERE timestamp(e.sal) = ANY (SELECT timestamp(p.Price) FROM t2 p ) ORDER BY e.id;
id	consumer	brand	sal
3	深咖	oppo	0
SELECT *  FROM t1 e WHERE timestamp(e.sal) < ANY (SELECT timestamp(p.Price) FROM t2 p ) ORDER BY e.id;
id	consumer	brand	sal
SELECT *  FROM t1 e WHERE timestamp(e.sal) > ANY (SELECT timestamp(p.Price) FROM t2 p ) ORDER BY e.id;
id	consumer	brand	sal
SELECT *  FROM t1 e WHERE timestamp(e.sal) < ALL (SELECT timestamp(p.Price) FROM t2 p ) ORDER BY e.id;
id	consumer	brand	sal
SELECT *  FROM t1 e WHERE timestamp(e.sal) > ALL (SELECT timestamp(p.Price) FROM t2 p ) ORDER BY e.id;
id	consumer	brand	sal
SELECT *  FROM t1 e WHERE timestamp(e.sal) = ALL (SELECT timestamp(p.Price) FROM t2 p WHERE p.model = 'oppo findx') ORDER BY e.id;
id	consumer	brand	sal
SELECT *  FROM t1 e WHERE EXISTS (SELECT timestamp(p.Price) FROM t2 p ) ORDER BY e.id;
id	consumer	brand	sal
1	书局	apple	5000
2	微山	xiaomi	-4000
3	深咖	oppo	0
4	流苏	huawei	NULL
5	玻璃	LG	6000
6	钛钢	HTC	8000
7	合金	VIVO	3500
SELECT timestamp(e.sal)  FROM t1 e WHERE NOT EXISTS (SELECT p.id,p.price FROM t2 p WHERE timestamp(p.Price)=7500 ) ORDER BY e.id;
timestamp(e.sal)
CREATE TABLE t3 AS SELECT * FROM t1 e WHERE timestamp(e.sal) = 1;
DROP TABLE t3;
CREATE TABLE t3 AS SELECT * FROM t1 e WHERE timestamp(e.sal) <=> NULL;
DROP TABLE t3;
CREATE TABLE t3 AS SELECT * FROM t1 e WHERE timestamp(e.sal) = NUll;
DROP TABLE t3;
SELECT brand, timestamp(brand) FROM t1 e WHERE e.brand LIKE '%a%';
brand	timestamp(brand)
apple	NULL
xiaomi	NULL
huawei	NULL
SELECT sal, timestamp(sal) FROM t1 e LEFT JOIN t2 p ON e.id = p.id WHERE e.sal LIKE '%00%';
sal	timestamp(sal)
5000	NULL
-4000	NULL
6000	NULL
8000	NULL
3500	NULL
SELECT * FROM t1 e WHERE timestamp(e.sal) = 0;
id	consumer	brand	sal
3	深咖	oppo	0
SELECT * FROM t1 e WHERE timestamp(e.sal) = 1;
id	consumer	brand	sal
3	深咖	oppo	0
SELECT * FROM t1 e WHERE timestamp(e.sal) = NULL;
id	consumer	brand	sal
SELECT * FROM t1 e WHERE timestamp(e.sal) > 0 ORDER BY e.id;
id	consumer	brand	sal
SELECT * FROM t1 e WHERE timestamp(e.sal) >= 0 ORDER BY e.id;
id	consumer	brand	sal
3	深咖	oppo	0
SELECT * FROM t1 e WHERE timestamp(e.sal) < 0 ORDER BY e.id;
id	consumer	brand	sal
SELECT * FROM t1 e WHERE timestamp(e.sal) <= 0 ORDER BY e.id;
id	consumer	brand	sal
3	深咖	oppo	0
SELECT * FROM t1 e WHERE timestamp(e.sal) = 1 ORDER BY e.id;
id	consumer	brand	sal
3	深咖	oppo	0
SELECT * FROM t1 e WHERE timestamp(e.sal) <> 0 ORDER BY e.id;
id	consumer	brand	sal
SELECT e.id, e.sal, timestamp(e.sal) FROM t1 e WHERE e.id > 0 ORDER BY timestamp(e.sal);
id	sal	timestamp(e.sal)
1	5000	NULL
2	-4000	NULL
4	NULL	NULL
5	6000	NULL
6	8000	NULL
7	3500	NULL
3	0	0000-00-00 00:00:00
SELECT e.id, e.sal, timestamp(e.sal) FROM t1 e WHERE e.id > 0 ORDER BY timestamp(e.sal) DESC;
id	sal	timestamp(e.sal)
3	0	0000-00-00 00:00:00
1	5000	NULL
2	-4000	NULL
4	NULL	NULL
5	6000	NULL
6	8000	NULL
7	3500	NULL
SELECT e.id, e.sal, timestamp(e.brand) FROM t1 e WHERE e.id > 0 ORDER BY timestamp(e.brand) ASC;
id	sal	timestamp(e.brand)
1	5000	NULL
2	-4000	NULL
3	0	NULL
4	NULL	NULL
5	6000	NULL
6	8000	NULL
7	3500	NULL
SELECT e.id, e.sal, timestamp(e.brand) FROM t1 e WHERE e.id > 0 ORDER BY timestamp(e.brand) DESC;
id	sal	timestamp(e.brand)
1	5000	NULL
2	-4000	NULL
3	0	NULL
4	NULL	NULL
5	6000	NULL
6	8000	NULL
7	3500	NULL
SELECT e.id, timestamp(e.sal), SUM(e.sal+p.Price) FROM t1 e ,t2 p WHERE e.id=p.id GROUP BY e.id, timestamp(e.sal)  ORDER BY e.id;
id	timestamp(e.sal)	SUM(e.sal+p.Price)
1	NULL	12000
2	NULL	-4000
3	0000-00-00 00:00:00	-6000
4	NULL	NULL
5	NULL	NULL
6	NULL	8026
7	NULL	3474
SELECT e.id, e.sal,timestamp(e.sal) tt, SUM(e.sal+p.Price) FROM t1 e ,t2 p WHERE e.id=p.id GROUP BY e.id, timestamp(e.sal) HAVING tt > -1 ORDER BY e.id;
id	sal	tt	SUM(e.sal+p.Price)
select id, sal, timestamp(case when sal=0 then 200 else sal end ) from t1_view ORDER BY id;
id	sal	timestamp(case when sal=0 then 200 else sal end )
1	5000	NULL
2	-4000	NULL
3	0	NULL
4	NULL	NULL
5	6000	NULL
6	8000	NULL
7	3500	NULL
select id, sal, timestamp(case when sal>0 then 200 else sal end ) from t1_view order by id;
id	sal	timestamp(case when sal>0 then 200 else sal end )
1	5000	NULL
2	-4000	NULL
3	0	0000-00-00 00:00:00
4	NULL	NULL
5	6000	NULL
6	8000	NULL
7	3500	NULL
select id, sal, timestamp(case when sal=0 then 200 else sal end ), COUNT(*) from t1_view GROUP by timestamp(case when sal=0 then 200 else sal end ),id ORDER BY id;
id	sal	timestamp(case when sal=0 then 200 else sal end )	COUNT(*)
1	5000	NULL	1
2	-4000	NULL	1
3	0	NULL	1
4	NULL	NULL	1
5	6000	NULL	1
6	8000	NULL	1
7	3500	NULL	1
INSERT INTO t2(model,price) SELECT model,price from t2_view WHERE timestamp(price) = 1;
SELECT COUNT(*) FROM t2;
COUNT(*)
7
INSERT INTO t2(model,price) SELECT model,price from t2_view WHERE timestamp(price) = 0;
SELECT COUNT(*) FROM t2;
COUNT(*)
7
UPDATE t2_view SET MODEL = 'xiaomi 10' WHERE timestamp(Price) = 0;
SELECT model FROM t2_view;
model
apple 12
xiaomi 9
oppo findx
huawei mata30
huawei mata30
htc cc30
shumei xi2
UPDATE t2_view SET price = '9000' WHERE timestamp(Price) < 0;
SELECT price FROM t2_view;
price
7000
0
-6000
8000
NULL
26
-26
UPDATE t2_view SET price = (SELECT timestamp(t1.sal) FROM t1 WHERE timestamp(t1.sal) = 0 ) WHERE id = 1 ;
SELECT price FROM t2_view;
price
7000
0
-6000
8000
NULL
26
-26
DELETE FROM t2_view WHERE timestamp(Price) = 0;
SELECT COUNT(*) FROM t2_view;
COUNT(*)
7
DELETE FROM t2_view WHERE timestamp(Price) = -1;
SELECT COUNT(*) FROM t2_view;
COUNT(*)
7
DELETE FROM t2_view WHERE timestamp(Price) <= 2;
SELECT COUNT(*) FROM t2_view;
COUNT(*)
7
DROP TABLE t1;
CREATE TABLE `t1` (
`id` int,
`consumer` char(20) DEFAULT NULL,
`price` varchar(20) DEFAULT NULL,
`sal` int DEFAULT NULL,
`datetime1` DATE,
`datetime2` bigint
);
INSERT INTO t1 VALUES(1,'书局','7000',5000,'2020-09-22',20200923121200);
INSERT INTO t1 VALUES(2,'微山','3000',-4000,'2020-09-21',20200921101159);
INSERT INTO t1 VALUES(3,'深咖','5000',0,'2020-08-21',20190821101159);
INSERT INTO t1 VALUES(4,'流苏','0',NULL,'2020-02-29',20200228101159);
INSERT INTO t1 VALUES(5,'玻璃','3200',6000,'2020-02-29',20200228101159);
INSERT INTO t1 VALUES(6,'钛钢',NULL,8000,'2020-02-29',20200228101159);
INSERT INTO t1 VALUES(7,'合金','VIVO',3500,'2020-02-29',20200228101159);
CREATE INDEX index_test ON t1(sal);
CREATE INDEX index_test1 ON t1(price);
CREATE INDEX index_test2 ON t1(consumer);
CREATE INDEX index_test3 ON t1(datetime1);
CREATE INDEX index_test4 ON t1(datetime2);
SELECT * FROM t1;
id	consumer	price	sal	datetime1	datetime2
1	书局	7000	5000	2020-09-22	20200923121200
2	微山	3000	-4000	2020-09-21	20200921101159
3	深咖	5000	0	2020-08-21	20190821101159
4	流苏	0	NULL	2020-02-29	20200228101159
5	玻璃	3200	6000	2020-02-29	20200228101159
6	钛钢	NULL	8000	2020-02-29	20200228101159
7	合金	VIVO	3500	2020-02-29	20200228101159
SELECT sal, timestamp(sal) FROM t1;
sal	timestamp(sal)
NULL	NULL
-4000	NULL
0	0000-00-00 00:00:00
3500	NULL
5000	NULL
6000	NULL
8000	NULL
SELECT id, consumer, timestamp(sal) FROM t1 WHERE timestamp(sal) = 0 ORDER BY id DESC;
id	consumer	timestamp(sal)
3	深咖	0000-00-00 00:00:00
SELECT id,consumer,timestamp(sal) FROM t1 WHERE timestamp(sal) > 0 ORDER BY timestamp(sal);
id	consumer	timestamp(sal)
SELECT id,SUM(sal) FROM t1 WHERE timestamp(sal) > 0 GROUP BY id HAVING SUM(sal) > 3000 ORDER BY id;
id	SUM(sal)
SELECT id,SUM(sal) FROM t1 WHERE timestamp(sal) > 0 GROUP BY id HAVING SUM(sal) > 5000 ORDER BY id;
id	SUM(sal)
UPDATE t1 SET sal = 10 WHERE timestamp(sal) = 0 ;
INSERT INTO t1(consumer,price,sal,datetime1,datetime2) SELECT consumer,price,sal,datetime1,datetime2  FROM t1 WHERE timestamp(sal)<0;
SELECT COUNT(*) FROM t1;
COUNT(*)
7
INSERT INTO t1 VALUES(8,'流苏','9111',timestamp(200),'2020-02-29 10:11:59',20200228101159);
INSERT INTO t1 VALUES(8,'流苏','9112',timestamp('156'),'2020-02-29 10:11:59',20200228101159);
INSERT INTO t1 VALUES(8,'流苏','9113',timestamp(-100),'2020-02-29 10:11:59',20200228101159);
INSERT INTO t1 VALUES(8,'流苏','9114',timestamp(0),'2020-02-29 10:11:59',20200228101159);
INSERT INTO t1 VALUES(8,'流苏','9115',timestamp(NULL),'2020-02-29 10:11:59',20200228101159);
SELECT COUNT(*)  FROM t1;
COUNT(*)
9
DELETE FROM t1 WHERE timestamp(sal)=0;
DROP TABLE t1;
CREATE TABLE `t1` (
`id` int NOT NULL AUTO_INCREMENT,
`consumer` char(20) NOT NULL,
`price` varchar(20) DEFAULT NULL,
`sal` int DEFAULT NULL,
`datetime1` DATE,
`datetime2` bigint,
PRIMARY KEY (`id`),
UNIQUE KEY `t1_UN` (`price`)
);
INSERT INTO t1 VALUES(1,'书局','7000',5000,'2020-09-22',20200923121200);
INSERT INTO t1 VALUES(2,'微山','3000',-4000,'2020-09-21',20200921101159);
INSERT INTO t1 VALUES(3,'深咖','5000',0,'2020-08-21',20190821101159);
INSERT INTO t1 VALUES(4,'流苏','0',NULL,'2020-02-29',20200228101159);
INSERT INTO t1 VALUES(5,'玻璃','3200',6000,'2020-02-29',20200228101159);
INSERT INTO t1 VALUES(6,'钛钢',NULL,8000,'2020-02-29',20200228101159);
INSERT INTO t1 VALUES(7,'合金','VIVO',3500,'2020-02-29',20200228101159);
SELECT timestamp(price) FROM t1;
timestamp(price)
NULL
NULL
NULL
NULL
NULL
NULL
NULL
SELECT timestamp(sal) FROM t1;
timestamp(sal)
NULL
NULL
0000-00-00 00:00:00
NULL
NULL
NULL
NULL
SELECT timestamp(datetime1), timestamp(datetime2), timestamp(sal), timestamp(price) FROM t1;
timestamp(datetime1)	timestamp(datetime2)	timestamp(sal)	timestamp(price)
2020-09-22 00:00:00	2020-09-23 12:12:00	NULL	NULL
2020-09-21 00:00:00	2020-09-21 10:11:59	NULL	NULL
2020-08-21 00:00:00	2019-08-21 10:11:59	0000-00-00 00:00:00	NULL
2020-02-29 00:00:00	2020-02-28 10:11:59	NULL	NULL
2020-02-29 00:00:00	2020-02-28 10:11:59	NULL	NULL
2020-02-29 00:00:00	2020-02-28 10:11:59	NULL	NULL
2020-02-29 00:00:00	2020-02-28 10:11:59	NULL	NULL
SELECT id, consumer, timestamp(sal), timestamp(price) FROM t1 WHERE timestamp(sal)>0 ORDER BY id DESC;
id	consumer	timestamp(sal)	timestamp(price)
SELECT id,consumer, timestamp(sal), timestamp(price) FROM t1 WHERE timestamp(sal)<0 ORDER BY timestamp(sal);
id	consumer	timestamp(sal)	timestamp(price)
SELECT id, sal,SUM(timestamp(sal)) FROM t1 WHERE t1.sal <> 6000 GROUP BY sal,id HAVING SUM(timestamp(sal)) > 0 ORDER BY id;
id	sal	SUM(timestamp(sal))
SELECT price, sal FROM t1;
price	sal
7000	5000
3000	-4000
5000	0
0	NULL
3200	6000
NULL	8000
VIVO	3500
UPDATE t1 SET sal = 10 WHERE timestamp(sal) = 0 ;
UPDATE t1 SET price = '9527' where timestamp(sal) < 0;
SELECT price, sal FROM t1;
price	sal
7000	5000
3000	-4000
5000	0
0	NULL
3200	6000
NULL	8000
VIVO	3500
SELECT COUNT(*) FROM t1;
COUNT(*)
7
INSERT INTO t1 VALUES(0,'流苏_insert1',timestamp('200'),timestamp(200),'2020-02-29 10:11:59',20200228101159);
INSERT INTO t1 VALUES(0,'流苏_insert2',2,timestamp('156'),'2020-02-29 10:11:59',20200228101159);
INSERT INTO t1 VALUES(0,'流苏_insert3',3,timestamp(-100),'2020-02-29 10:11:59',20200228101159);
INSERT INTO t1 VALUES(0,'流苏_insert4',timestamp(NULL),timestamp(0),'2020-02-29 10:11:59',20200228101159);
INSERT INTO t1 VALUES(0,'流苏_insert5','9115',timestamp(NULL),'2020-02-29 10:11:59',20200228101159);
SELECT COUNT(*)  FROM t1;
COUNT(*)
9
DELETE FROM t1 WHERE CAST(timestamp('2020-02-28 10:11:59') AS UNSIGNED INTEGER)= 20200228101159;
SELECT COUNT(*)  FROM t1;
COUNT(*)
0
DROP VIEW t2_view;
DROP VIEW t1_view;
DROP TABLE t1;
DROP TABLE t2;
DROP TABLE t3;
DROP TABLE t1;
CREATE TABLE t1 (
a INT,
c_time VARCHAR(50),
d_time VARCHAR(101) GENERATED ALWAYS AS (timestamp(c_time))
);
CREATE INDEX idx_t1 ON T1(d_time);
INSERT INTO T1(A,C_TIME) VALUES(1,'2020-02-29 10:11:59');
INSERT INTO T1(A,C_TIME) VALUES(2,'09:10:05');
INSERT INTO T1(A,C_TIME) VALUES(3,'201');
INSERT INTO T1(A,C_TIME) VALUES(4,'2020-02-29');
INSERT INTO T1(A,C_TIME) VALUES(5,'09:10:05:12:34:44');
INSERT INTO T1(A,C_TIME) VALUES(6,'CURRENT_TIMESTAMP()');
DROP TABLE t1;
CREATE TABLE t1 (
a INT,
c_time VARCHAR(50),
d_time VARCHAR(101) GENERATED ALWAYS AS (timestamp(c_time,'11:12:20'))
);
CREATE INDEX idx_t1 ON T1(d_time);
INSERT INTO T1(A,C_TIME) VALUES(1,'2020-02-29 10:11:59');
INSERT INTO T1(A,C_TIME) VALUES(2,'09:10:05');
INSERT INTO T1(A,C_TIME) VALUES(3,'201');
INSERT INTO T1(A,C_TIME) VALUES(4,'2020-02-29');
INSERT INTO T1(A,C_TIME) VALUES(5,'09:10:05:12:34:44');
INSERT INTO T1(A,C_TIME) VALUES(6,NULL);
DROP TABLE t1;
CREATE TABLE t1 (
a INT AUTO_INCREMENT PRIMARY KEY,
c_time VARCHAR(50),
d_time int GENERATED ALWAYS AS (timestamp(c_time))
);
INSERT INTO T1(A,C_TIME) VALUES(1,'2020-02-29 10:11:59');
INSERT INTO T1(A,C_TIME) VALUES(2,'09:10:05');
INSERT INTO T1(A,C_TIME) VALUES(3,'201');
INSERT INTO T1(A,C_TIME) VALUES(4,'2020-02-29');
INSERT INTO T1(A,C_TIME) VALUES(5,'09:10:05:12:34:44');
INSERT INTO T1(A,C_TIME) VALUES(6,'CURRENT_TIMESTAMP()');
DROP TABLE t1;
CREATE TABLE t1 (
a INT AUTO_INCREMENT PRIMARY KEY,
c_time VARCHAR(50),
d_time timestamp GENERATED ALWAYS AS (timestamp(c_time))
);
INSERT INTO T1(A,C_TIME) VALUES(1,'2020-02-29 10:11:59');
INSERT INTO T1(A,C_TIME) VALUES(2,'09:10:05');
INSERT INTO T1(A,C_TIME) VALUES(3,'201');
INSERT INTO T1(A,C_TIME) VALUES(4,'2020-02-29');
INSERT INTO T1(A,C_TIME) VALUES(5,'09:10:05:12:34:44');
INSERT INTO T1(A,C_TIME) VALUES(6,'CURRENT_TIMESTAMP()');
INSERT INTO T1(A,C_TIME) VALUES(7,1103.56);
SELECT * FROM T1;
a	c_time	d_time
1	2020-02-29 10:11:59	2020-02-29 10:11:59
2	09:10:05	2009-10-05 00:00:00
4	2020-02-29	2020-02-29 00:00:00
5	09:10:05:12:34:44	2009-10-05 12:34:44
DROP TABLE t1;
CREATE TABLE t1 (
a INT AUTO_INCREMENT PRIMARY KEY,
c_time timestamp,
d_time varchar(101) GENERATED ALWAYS AS (timestamp(c_time))
);
INSERT INTO T1(A,C_TIME) VALUES(1,'2020-02-29 10:11:59');
INSERT INTO T1(A,C_TIME) VALUES(2,'09:10:05');
INSERT INTO T1(A,C_TIME) VALUES(3,'201');
INSERT INTO T1(A,C_TIME) VALUES(4,'2020-02-29');
INSERT INTO T1(A,C_TIME) VALUES(5,'09:10:05:12:34:44');
INSERT INTO T1(A,C_TIME) VALUES(6,'CURRENT_TIMESTAMP()');
INSERT INTO T1(A,C_TIME) VALUES(7,1103.56);
SELECT * FROM T1;
a	c_time	d_time
1	2020-02-29 10:11:59	2020-02-29 10:11:59
2	2009-10-05 00:00:00	2009-10-05 00:00:00
4	2020-02-29 00:00:00	2020-02-29 00:00:00
5	2009-10-05 12:34:44	2009-10-05 12:34:44
DROP TABLE t1;
CREATE TABLE t1 (
a INT AUTO_INCREMENT PRIMARY KEY,
c_time timestamp,
d_time varchar(101) GENERATED ALWAYS AS (timestamp(c_time) + 1234)
);
INSERT INTO T1(A,C_TIME) VALUES(1,'2020-02-29 10:11:59');
INSERT INTO T1(A,C_TIME) VALUES(2,'09:10:05');
INSERT INTO T1(A,C_TIME) VALUES(3,NULL);
DROP TABLE t1;
CREATE TABLE t1 (
a INT AUTO_INCREMENT PRIMARY KEY,
c_time varchar(50),
d_time datetime GENERATED ALWAYS AS (timestamp(c_time) + 1234)
);
INSERT INTO T1(A,C_TIME) VALUES(1,'2020-02-29 10:11:59');
INSERT INTO T1(A,C_TIME) VALUES(2,'09:10:05');
INSERT INTO T1(A,C_TIME) VALUES(3,NULL);
INSERT INTO T1(A,C_TIME) VALUES(4,0);
DROP TABLE t1;
CREATE TABLE t1 (
a INT AUTO_INCREMENT PRIMARY KEY,
c_time varchar(50),
d_time varchar(50) GENERATED ALWAYS AS (case when timestamp(c_time) > "2021-07-06" then "now" when timestamp(c_time) <= "2021-07-06" then 'yesterday' end)
);
INSERT INTO T1(A,C_TIME) VALUES(1,'2020-02-29 10:11:59');
INSERT INTO T1(A,C_TIME) VALUES(2,'09:10:05');
INSERT INTO T1(A,C_TIME) VALUES(3,NULL);
INSERT INTO T1(A,C_TIME) VALUES(4,0);
# timestamp-3-mysql
# 内置转换
DROP TABLE t2;
CREATE TABLE t2 (
time_stp timestamp
);
INSERT INTO T2 VALUES('2013-05-22 18:32:37.000');
DROP TABLE T1;
CREATE TABLE `t1` (
a bigint DEFAULT NULL,
b float DEFAULT NULL,
c double DEFAULT NULL,
d date DEFAULT NULL,
e time DEFAULT NULL,
f year DEFAULT NULL,
g timestamp,
h char(20) DEFAULT NULL,
i varchar(20) DEFAULT NULL,
j text DEFAULT NULL
);
INSERT INTO T1(a) values(timestamp((select time_stp from t2)));
INSERT INTO T1(a) values(timestamp(201));
INSERT INTO T1(a) values(timestamp('09:10:05'));
INSERT INTO T1(b) values(timestamp((select time_stp from t2)));
INSERT INTO T1(b) values(timestamp(201));
INSERT INTO T1(b) values(timestamp('09:10:05'));
INSERT INTO T1(c) values(timestamp((select time_stp from t2)));
INSERT INTO T1(c) values(timestamp(201));
INSERT INTO T1(c) values(timestamp('09:10:05'));
INSERT INTO T1(d) values(timestamp((select time_stp from t2)));
INSERT INTO T1(d) values(timestamp(201));
INSERT INTO T1(d) values(timestamp('09:10:05'));
INSERT INTO T1(e) values(timestamp((select time_stp from t2)));
INSERT INTO T1(e) values(timestamp(201));
INSERT INTO T1(e) values(timestamp('09:10:05'));
INSERT INTO T1(f) values(timestamp((select time_stp from t2)));
INSERT INTO T1(f) values(timestamp(201));
INSERT INTO T1(f) values(timestamp('09:10:05'));
INSERT INTO T1(g) values(timestamp((select time_stp from t2)));
INSERT INTO T1(g) values(timestamp(201));
INSERT INTO T1(g) values(timestamp('09:10:05'));
INSERT INTO T1(h) values(timestamp((select time_stp from t2)));
INSERT INTO T1(h) values(timestamp(201));
INSERT INTO T1(h) values(timestamp('09:10:05'));
INSERT INTO T1(i) values(timestamp((select time_stp from t2)));
INSERT INTO T1(i) values(timestamp(201));
INSERT INTO T1(i) values(timestamp('09:10:05'));
INSERT INTO T1(j) values(timestamp((select time_stp from t2)));
INSERT INTO T1(j) values(timestamp(201));
INSERT INTO T1(j) values(timestamp('09:10:05'));
TRUNCATE TABLE T1;
INSERT INTO T1(a) values(timestamp((select time_stp from t2)));
UPDATE T1 SET A = (TIMESTAMP((select time_stp from t2)));
UPDATE T1 SET A = (timestamp(201));
UPDATE T1 SET A = (timestamp('09:10:05'));
SELECT a FROM T1;
a
20091005000000
UPDATE T1 SET B = (TIMESTAMP((select time_stp from t2)));
UPDATE T1 SET B = (timestamp(201));
UPDATE T1 SET B = (timestamp('09:10:05'));
SELECT B FROM T1;
B
20091000000000
UPDATE T1 SET C = (TIMESTAMP((select time_stp from t2)));
UPDATE T1 SET c = (timestamp(201));
UPDATE T1 SET c = (timestamp('09:10:05'));
SELECT c FROM T1;
c
20091005000000
UPDATE T1 SET d = (TIMESTAMP((select time_stp from t2)));
UPDATE T1 SET d = (timestamp(201));
UPDATE T1 SET d = (timestamp('09:10:05'));
SELECT d FROM T1;
d
2009-10-05
UPDATE T1 SET e = (TIMESTAMP((select time_stp from t2)));
UPDATE T1 SET e = (timestamp(201));
UPDATE T1 SET e = (timestamp('09:10:05'));
SELECT e FROM T1;
e
00:00:00
UPDATE T1 SET f = (TIMESTAMP((select time_stp from t2)));
UPDATE T1 SET f = (timestamp(201));
UPDATE T1 SET f = (timestamp('09:10:05'));
SELECT f FROM T1;
f
2009
UPDATE T1 SET g = (TIMESTAMP((select time_stp from t2)));
UPDATE T1 SET g = (timestamp(201));
UPDATE T1 SET g = (timestamp('09:10:05'));
SELECT g FROM T1;
g
2009-10-05 00:00:00
UPDATE T1 SET h = (TIMESTAMP((select time_stp from t2)));
UPDATE T1 SET h = (timestamp(201));
UPDATE T1 SET h = (timestamp('09:10:05'));
SELECT h FROM T1;
h
2013-05-22 18:32:37
UPDATE T1 SET i = (TIMESTAMP((select time_stp from t2)));
UPDATE T1 SET i = (timestamp(201));
UPDATE T1 SET i = (timestamp('09:10:05'));
SELECT i FROM T1;
i
2013-05-22 18:32:37
UPDATE T1 SET j = (TIMESTAMP((select time_stp from t2)));
UPDATE T1 SET j = (timestamp(201));
UPDATE T1 SET j = (timestamp('09:10:05'));
SELECT j FROM T1;
j
2009-10-05 00:00:00.000000
# timestamp-4-mysql
# 函数嵌套
DROP TABLE t1;
CREATE TABLE T1(
a bigint,
b varchar(30),
c timestamp
)PARTITION BY RANGE(a)
(
PARTITION id_part1 values less than (3),
PARTITION id_part2 values less than (8),
PARTITION id_part3 values less than (MAXVALUE)
);
insert into t1 values (1, CAST(TIMESTAMP('2012-04-20 11:57:49.000') AS UNSIGNED INTEGER), '2013-05-22 18:32:37.000');
insert into t1 values (2, null , '1992-01-02 23:51:32.000');
insert into t1 values (3, FROM_UNIXTIME(UNIX_TIMESTAMP(timestamp('1995-12-02 22:30:27'))), '2006-08-09 03:20:51');
insert into t1 values (4, hour(timestamp('1995-12-02 22:30:27')), '1980-12-03 01:08:01.000');
insert into t1 values (7, date(timestamp('1980-12-03 01:08:01.000')), '1980-12-03 01:08:01.000');
insert into t1 values(11, (select timestamp(c) from t1 where a=3),  '2006-08-09 03:20:51');
insert into t1 values (timestamp(201), '2006-08-09 03:20:51', '2015-01-30 06:13:54.000');
update t1 set b = DATE_FORMAT(timestamp('2014-01-01'), '%Y-%M-%D') where a = 1;
update t1 set b = timestamp(STR_TO_DATE('2014-January-1st', '%Y-%M-%d')) where a = 3;
update t1 set b = TIME_TO_USEC(timestamp('2014-01-01')) where a = 4;
# 分区表
DROP TABLE t1;
CREATE TABLE T1(
a bigint,
b datetime
)partition by range columns(b) subpartition by hash(a) subpartitions 2
( 
partition part_1 values less than ('2016-09-01'),
partition part_2 values less than ('2020-09-01'),
partition part_3 values less than ('2021-09-01')
);
insert into t1 values(1,(substr(timestamp('2012-04-20 11:57:49.000'),1)));
insert into t1 values(2,(substr(timestamp('2012-04-20 11:57:49.000','23:47:04'),1)));
insert into t1 values(LENGTH(timestamp('1995-12-02 22:30:27')),'1995-12-02 22:30:27');
insert into t1 values(ROUND(timestamp('2006-08-09 03:20:51')), '2006-08-09 03:20:51');
insert into t1 values(CEIL(timestamp('2006-03-31 14:45:32')), '2006-03-31 14:45:32');
insert into t1 values(FLOOR(timestamp('2016-03-19 13:22:51')), '2016-03-19 13:22:51');
insert into t1 values(ABS(timestamp('2010-12-03 16:03:03')), '2010-12-03 16:03:03');
insert into t1 values(NEG(timestamp('1992-01-02 23:51:32')), '1992-01-02 23:51:32');
insert into t1 values(SIGN(timestamp('1980-12-03 01:08:01')), '1980-12-03 01:08:01.000');
insert into t1 values(11,null);
select least(timestamp(b), '1987-06-28 02:24:22.000', sign(null)) from t1;
least(timestamp(b), '1987-06-28 02:24:22.000', sign(null))
NULL
NULL
NULL
NULL
NULL
NULL
NULL
NULL
NULL
NULL
select least(timestamp(b), '1987-06-28 02:24:22.000') from t1;
least(timestamp(b), '1987-06-28 02:24:22.000')
1987-06-28 02:24:22.000
1987-06-28 02:24:22.000
1987-06-28 02:24:22.000
1987-06-28 02:24:22.000
1987-06-28 02:24:22.000
1987-06-28 02:24:22.000
1987-06-28 02:24:22.000
1987-06-28 02:24:22.000
1980-12-03 01:08:01
NULL
select * from t1 where timestamp(b) is null;
a	b
11	NULL
select * from t1 where timestamp(b) is not null;
a	b
2	2012-04-21 11:44:53
26	1995-12-02 22:30:27
20060331144532	2006-03-31 14:45:32
-19920102235132	1992-01-02 23:51:32
1	2012-04-20 11:57:49
20060809032051	2006-08-09 03:20:51
20160319132251	2016-03-19 13:22:51
20101203160303	2010-12-03 16:03:03
1	1980-12-03 01:08:01
SELECT * FROM T1 WHERE A = CAST(TIMESTAMP('09:10:05') AS UNSIGNED INTEGER);
a	b
SELECT * FROM T1 WHERE A > CAST(TIMESTAMP('09:10:05') AS UNSIGNED INTEGER) ORDER BY B;
a	b
20101203160303	2010-12-03 16:03:03
20160319132251	2016-03-19 13:22:51
SELECT * FROM T1 WHERE A < CAST(TIMESTAMP('09:10:05') AS UNSIGNED INTEGER) ORDER BY B;
a	b
11	NULL
1	1980-12-03 01:08:01
-19920102235132	1992-01-02 23:51:32
26	1995-12-02 22:30:27
20060331144532	2006-03-31 14:45:32
20060809032051	2006-08-09 03:20:51
1	2012-04-20 11:57:49
2	2012-04-21 11:44:53
SELECT * FROM T1 WHERE B < TIMESTAMP('2012-04-20 11:57:49.000') ORDER BY B;
a	b
1	1980-12-03 01:08:01
-19920102235132	1992-01-02 23:51:32
26	1995-12-02 22:30:27
20060331144532	2006-03-31 14:45:32
20060809032051	2006-08-09 03:20:51
20101203160303	2010-12-03 16:03:03
SELECT * FROM T1 WHERE B <= TIMESTAMP('2012-04-20 11:57:49.000') ORDER BY B;
a	b
1	1980-12-03 01:08:01
-19920102235132	1992-01-02 23:51:32
26	1995-12-02 22:30:27
20060331144532	2006-03-31 14:45:32
20060809032051	2006-08-09 03:20:51
20101203160303	2010-12-03 16:03:03
1	2012-04-20 11:57:49
SELECT * FROM T1 WHERE B > TIMESTAMP('2012-04-20 11:57:49.000') ORDER BY B;
a	b
2	2012-04-21 11:44:53
20160319132251	2016-03-19 13:22:51
SELECT * FROM T1 WHERE B != TIMESTAMP('2012-04-20 11:57:49.000') ORDER BY B;
a	b
1	1980-12-03 01:08:01
-19920102235132	1992-01-02 23:51:32
26	1995-12-02 22:30:27
20060331144532	2006-03-31 14:45:32
20060809032051	2006-08-09 03:20:51
20101203160303	2010-12-03 16:03:03
2	2012-04-21 11:44:53
20160319132251	2016-03-19 13:22:51
TRUNCATE TABLE T1;
insert into t1 values(12,'2021-07-07 11:57:49.000001');
insert into t1 values(13,'2021-07-07 11:57:49.00002');
SELECT * FROM T1 WHERE B <= TIMESTAMP('2021-07-07 11:57:49.001') ORDER BY B;
a	b
12	2021-07-07 11:57:49
13	2021-07-07 11:57:49
SELECT * FROM T1 WHERE B > TIMESTAMP('2021-07-07 11:57:49.001') ORDER BY B;
a	b
SELECT * FROM T1 WHERE B < TIMESTAMP('2021-07-07 11:57:49.000001') ORDER BY B;
a	b
12	2021-07-07 11:57:49
13	2021-07-07 11:57:49
SELECT * FROM T1 WHERE B = TIMESTAMP('2021-07-07 11:57:49.000001') ORDER BY B;
a	b
SELECT * FROM T1 WHERE B = TIMESTAMP('2021-07-07 11:57:49') ORDER BY B;
a	b
12	2021-07-07 11:57:49
13	2021-07-07 11:57:49
SET TIMESTAMP=1626061421;
SELECT TIMESTAMP((DATE_ADD(current_timestamp(), INTERVAL '01 05:05:65.000065' DAY_MICROSECOND)));
TIMESTAMP((DATE_ADD(current_timestamp(), INTERVAL '01 05:05:65.000065' DAY_MICROSECOND)))
2021-07-13 16:49:46.000065
SELECT TIMESTAMP(b * 10) FROM t1 ;
TIMESTAMP(b * 10)
NULL
NULL
SELECT TIMESTAMP(b + 1500) FROM t1 ;
TIMESTAMP(b + 1500)
NULL
NULL
SELECT TIMESTAMP(b - 1000) FROM t1;
TIMESTAMP(b - 1000)
2021-07-07 11:47:49
2021-07-07 11:47:49
SELECT TIMESTAMP(b / 1500) FROM t1 ;
TIMESTAMP(b / 1500)
NULL
NULL
SELECT TIMESTAMP(b / 1500 * 10) FROM t1;
TIMESTAMP(b / 1500 * 10)
NULL
NULL
SELECT TIMESTAMP(b * 10 - 0.1) FROM t1;
TIMESTAMP(b * 10 - 0.1)
NULL
NULL
SELECT TIMESTAMP(b * 0.221 - 0.1) FROM t1 ;
TIMESTAMP(b * 0.221 - 0.1)
NULL
NULL
SELECT TIMESTAMP(b % 3) FROM t1 ;
TIMESTAMP(b % 3)
NULL
NULL
SELECT TIMESTAMP(b * 0) FROM t1 ;
TIMESTAMP(b * 0)
0000-00-00 00:00:00
0000-00-00 00:00:00
SELECT TIMESTAMP(b * NULL) FROM t1 ;
TIMESTAMP(b * NULL)
NULL
NULL
SELECT TIMESTAMP(b - 0.111) FROM t1 ;
TIMESTAMP(b - 0.111)
2021-07-07 11:57:48.889
2021-07-07 11:57:48.889
SELECT TIMESTAMP('2003-12-31 12:00:00.000001') > TIMESTAMP('2003-12-31 12:00:00.000002') FROM DUAL;
TIMESTAMP('2003-12-31 12:00:00.000001') > TIMESTAMP('2003-12-31 12:00:00.000002')
0
SELECT TIMESTAMP('2003-12-31 12:00:00.000001','1500') > TIMESTAMP('2003-12-31 12:00:00.000002','1500.1') FROM DUAL;
TIMESTAMP('2003-12-31 12:00:00.000001','1500') > TIMESTAMP('2003-12-31 12:00:00.000002','1500.1')
0
SELECT TIMESTAMP('2003-12-31 12:00:00.000001','1500') < TIMESTAMP('2003-12-31 12:00:00.000002','1500.1') FROM DUAL;
TIMESTAMP('2003-12-31 12:00:00.000001','1500') < TIMESTAMP('2003-12-31 12:00:00.000002','1500.1')
1
SELECT TIMESTAMP('2003-12-31 12:00:00.000001') < TIMESTAMP('2003-12-31 12:00:00.000002') FROM DUAL;
TIMESTAMP('2003-12-31 12:00:00.000001') < TIMESTAMP('2003-12-31 12:00:00.000002')
1
SELECT TIMESTAMP('2003-12-31 12:00:00.000001') = TIMESTAMP('2003-12-31 12:00:00.000002') FROM DUAL;
TIMESTAMP('2003-12-31 12:00:00.000001') = TIMESTAMP('2003-12-31 12:00:00.000002')
0
SELECT TIMESTAMP('2003-12-31 12:00:00.000001') > TIMESTAMP('2003-12-31 12:00:00.0000002') FROM DUAL;
TIMESTAMP('2003-12-31 12:00:00.000001') > TIMESTAMP('2003-12-31 12:00:00.0000002')
1
SELECT TIMESTAMP('2003-12-31 12:00:00.000001') = TIMESTAMP('2003-12-31 12:00:00.0000002') FROM DUAL;
TIMESTAMP('2003-12-31 12:00:00.000001') = TIMESTAMP('2003-12-31 12:00:00.0000002')
0
SELECT TIMESTAMP('2003-12-31 12:00:00.000001') < TIMESTAMP('2003-12-31 12:00:00.0000002') FROM DUAL;
TIMESTAMP('2003-12-31 12:00:00.000001') < TIMESTAMP('2003-12-31 12:00:00.0000002')
0
SELECT TIMESTAMP('2003-12-31 12:00:00.000001',NULL) <=> TIMESTAMP(NULL)  FROM DUAL;
TIMESTAMP('2003-12-31 12:00:00.000001',NULL) <=> TIMESTAMP(NULL)
1
SELECT TIMESTAMP(NULL,'2003-12-31 12:00:00.000001') <=> TIMESTAMP(NULL)  FROM DUAL;
TIMESTAMP(NULL,'2003-12-31 12:00:00.000001') <=> TIMESTAMP(NULL)
1
SELECT TIMESTAMP('2003-12-31 12:00:00.000001') <=> TIMESTAMP(NULL)  FROM DUAL;
TIMESTAMP('2003-12-31 12:00:00.000001') <=> TIMESTAMP(NULL)
0
SELECT TIMESTAMP(null) <=> TIMESTAMP(NULL)  FROM DUAL;
TIMESTAMP(null) <=> TIMESTAMP(NULL)
1
SELECT '2013-12-31 12:00:00' BETWEEN TIMESTAMP('2003-12-31 12:00:00.000001') AND TIMESTAMP('2023-12-31 12:00:00.000001') FROM DUAL;
'2013-12-31 12:00:00' BETWEEN TIMESTAMP('2003-12-31 12:00:00.000001') AND TIMESTAMP('2023-12-31 12:00:00.000001')
1
SELECT '2013-12-31' BETWEEN TIMESTAMP('2003-12-31 12:00:00.000001') AND TIMESTAMP('2023-12-31 12:00:00.000001') FROM DUAL;
'2013-12-31' BETWEEN TIMESTAMP('2003-12-31 12:00:00.000001') AND TIMESTAMP('2023-12-31 12:00:00.000001')
1
SELECT '2013-12-31 12:00:00' BETWEEN TIMESTAMP('2003-12-31') AND TIMESTAMP('2023-12-31') FROM DUAL;
'2013-12-31 12:00:00' BETWEEN TIMESTAMP('2003-12-31') AND TIMESTAMP('2023-12-31')
1
SELECT TIMESTAMP('09:10:05') OR TIMESTAMP('09:10:06') FROM DUAL;
TIMESTAMP('09:10:05') OR TIMESTAMP('09:10:06')
1
SELECT TIMESTAMP('09:10:05') OR TIMESTAMP(201) FROM DUAL;
TIMESTAMP('09:10:05') OR TIMESTAMP(201)
1
SELECT TIMESTAMP(201) or TIMESTAMP('09:10:05') FROM DUAL;
TIMESTAMP(201) or TIMESTAMP('09:10:05')
1
SELECT TIMESTAMP(NULL) or TIMESTAMP('09:10:05') FROM DUAL;
TIMESTAMP(NULL) or TIMESTAMP('09:10:05')
1
SELECT TIMESTAMP(NULL) and TIMESTAMP('09:10:05') FROM DUAL;
TIMESTAMP(NULL) and TIMESTAMP('09:10:05')
NULL
SELECT TIMESTAMP('09:10:05') and TIMESTAMP(NULL) FROM DUAL;
TIMESTAMP('09:10:05') and TIMESTAMP(NULL)
NULL
SELECT TIMESTAMP(301) OR TIMESTAMP(201) FROM DUAL;
TIMESTAMP(301) OR TIMESTAMP(201)
1
SELECT NOT TIMESTAMP(301) FROM DUAL;
NOT TIMESTAMP(301)
0
SELECT NOT TIMESTAMP(NULL) FROM DUAL;
NOT TIMESTAMP(NULL)
NULL
SELECT NOT TIMESTAMP(0) FROM DUAL;
NOT TIMESTAMP(0)
1
SELECT !TIMESTAMP(0) FROM DUAL;
!TIMESTAMP(0)
1
SELECT !TIMESTAMP(301) FROM DUAL;
!TIMESTAMP(301)
0
SELECT !TIMESTAMP('2003-12-31 12:00:00') FROM DUAL;
!TIMESTAMP('2003-12-31 12:00:00')
0
SELECT TIMESTAMP('2003-12-31 12:00:00') xor TIMESTAMP('2003-12-31 12:00:00') FROM DUAL;
TIMESTAMP('2003-12-31 12:00:00') xor TIMESTAMP('2003-12-31 12:00:00')
0
SELECT TIMESTAMP('2003-12-31 12:00:00') xor TIMESTAMP(null) FROM DUAL;
TIMESTAMP('2003-12-31 12:00:00') xor TIMESTAMP(null)
NULL
SELECT TIMESTAMP(201) xor TIMESTAMP('2003-12-31 12:00:00') FROM DUAL;
TIMESTAMP(201) xor TIMESTAMP('2003-12-31 12:00:00')
0
SELECT TIMESTAMP('2003-12-31 12:00:00') xor TIMESTAMP(0) FROM DUAL;
TIMESTAMP('2003-12-31 12:00:00') xor TIMESTAMP(0)
1
SELECT (TIMESTAMP('2003-12-31 12:00:00')) ^ (TIMESTAMP(0)) FROM DUAL;
(TIMESTAMP('2003-12-31 12:00:00')) ^ (TIMESTAMP(0))
20031231120000
SELECT TIMESTAMP('2003-12-31 12:00:00') ^ TIMESTAMP(201) FROM DUAL;
TIMESTAMP('2003-12-31 12:00:00') ^ TIMESTAMP(201)
31315334848
SELECT TIMESTAMP('2003-12-31 12:00:00') ^ TIMESTAMP('2012-04-20 11:57:49.000') FROM DUAL;
TIMESTAMP('2003-12-31 12:00:00') ^ TIMESTAMP('2012-04-20 11:57:49.000')
529423153061
SELECT TIMESTAMP('2003-12-31 12:00:00') >> TIMESTAMP(201) FROM DUAL;
TIMESTAMP('2003-12-31 12:00:00') >> TIMESTAMP(201)
0
SELECT TIMESTAMP('2003-12-31 12:00:00') << TIMESTAMP(201) FROM DUAL;
TIMESTAMP('2003-12-31 12:00:00') << TIMESTAMP(201)
0
SELECT ~TIMESTAMP(201) FROM DUAL;
~TIMESTAMP(201)
18446724073508551615
SELECT ~TIMESTAMP('2003-12-31 12:00:00') FROM DUAL;
~TIMESTAMP('2003-12-31 12:00:00')
18446724042478431615
SELECT ~TIMESTAMP(0) FROM DUAL;
~TIMESTAMP(0)
18446744073709551615
SELECT TIMESTAMP('09:10:05') > TIMESTAMP('09:10:06') FROM DUAL;
TIMESTAMP('09:10:05') > TIMESTAMP('09:10:06')
0
SELECT TIMESTAMP('09:10:05') < TIMESTAMP('09:10:06') FROM DUAL;
TIMESTAMP('09:10:05') < TIMESTAMP('09:10:06')
1
SELECT TIMESTAMP('09:10:05') <> TIMESTAMP('09:10:06') FROM DUAL;
TIMESTAMP('09:10:05') <> TIMESTAMP('09:10:06')
1
SELECT TIMESTAMP('09:10:05') + 123456 FROM DUAL;
TIMESTAMP('09:10:05') + 123456
20091005123456.000000
SELECT TIMESTAMP('09:10:05') - 133444 FROM DUAL;
TIMESTAMP('09:10:05') - 133444
20091004866556.000000
SELECT TIMESTAMP('09:10:05') - 123.456 FROM dual;
TIMESTAMP('09:10:05') - 123.456
20091004999876.544000
SELECT TIMESTAMP('09:10:05') - 123456 FROM dual;
TIMESTAMP('09:10:05') - 123456
20091004876544.000000
SELECT TIMESTAMP('2003-12-31 12:00:00') * 1024 FROM DUAL;
TIMESTAMP('2003-12-31 12:00:00') * 1024
20511980666880000.000000
SELECT TIMESTAMP('2003-12-31 12:00:00') - 1.175494351E-38 FROM DUAL;
TIMESTAMP('2003-12-31 12:00:00') - 1.175494351E-38
20031231120000
SELECT 1.175494351E-38 - TIMESTAMP('2003-12-31 12:00:00') FROM DUAL;
1.175494351E-38 - TIMESTAMP('2003-12-31 12:00:00')
-20031231120000
SELECT -3.402823466E+38 - TIMESTAMP('2003-12-31 12:00:00') FROM DUAL;
-3.402823466E+38 - TIMESTAMP('2003-12-31 12:00:00')
-3.402823466e38
SELECT 2.2250738585072014E-308  - TIMESTAMP('2003-12-31 12:00:00') FROM DUAL;
2.2250738585072014E-308  - TIMESTAMP('2003-12-31 12:00:00')
-20031231120000
SELECT TIMESTAMP('2003-12-31 12:00:00') + 1.7976931348623157E+308 FROM DUAL;
TIMESTAMP('2003-12-31 12:00:00') + 1.7976931348623157E+308
1.7976931348623157e308
SELECT TIMESTAMP('2003-12-31 12:00:00') + '0000-12-25' FROM DUAL;
TIMESTAMP('2003-12-31 12:00:00') + '0000-12-25'
20031231120000
Warnings:
Warning	1292	Truncated incorrect DOUBLE value: '0000-12-25'
SELECT TIMESTAMP('09:10:05') -  TIME('2003-12-31 01:02:03') FROM dual;
TIMESTAMP('09:10:05') -  TIME('2003-12-31 01:02:03')
20091004989797.000000
# timestamp-5-mysql
DROP TABLE t1;
CREATE TABLE t1 ( a datetime PRIMARY KEY, b int);
INSERT INTO t1 VALUES (TIMESTAMP('2003-12-31 12:00:00'),1);
INSERT INTO t1 VALUES (TIMESTAMP(201),2);
INSERT INTO t1 VALUES (TIMESTAMP('09:10:05'),3);
INSERT INTO t1 VALUES (TIMESTAMP('09:10:05'),4);
INSERT INTO t1 select timestamp('2006-02-11 11:22:13'), timestamp(0)FROM dual;
INSERT INTO t1 VALUES (TIMESTAMP('2003-12-31 12:00:00.10'),6);
INSERT INTO t1 VALUES (TIMESTAMP('2003-12-31 12:00:00.10'),7);
INSERT INTO t1 VALUES (TIMESTAMP('2003-12-31 12:00:00.11'),8);
DROP TABLE t1;
CREATE TABLE t1 ( a VARCHAR(255) unique, b int);
INSERT INTO T1 VALUES(ABS(timestamp('2010-12-03 16:03:03')),1);
INSERT INTO T1 VALUES(ABS(timestamp(201)),2);
INSERT INTO T1 VALUES(ABS(timestamp('2010-12-03 16:03:03.11')),3);
INSERT INTO T1 VALUES(ABS(timestamp('2010-12-03 16:03:03.12')),4);
DROP TABLE t1;
CREATE TABLE t1(a int PRIMARY KEY, b timestamp(2) UNIQUE);
INSERT INTO T1 VALUES(1, ABS(timestamp('2010-12-03 16:03:03.11')));
INSERT INTO T1 VALUES(2, ABS(timestamp('2010-12-03 16:03:03.11')));
INSERT INTO T1 VALUES(3, ABS(timestamp('2010-12-03 16:03:03.12')));
DROP TABLE T2;
CREATE TABLE T2(
t2_b timestamp(3),
CONSTRAINT T2_FK FOREIGN KEY (t2_b) REFERENCES T1(b)
);
INSERT INTO T2 VALUES( ABS(timestamp('2010-12-03 16:03:03.11')));
INSERT INTO T2 VALUES( ABS(timestamp('2010-12-03 16:03:03.12')));
DROP TABLE T2;
DROP TABLE T1;
# Clean up users
drop database obwmjtest;
drop user wmj456@'%' ;
