result_format: 4
drop table if exists t1,t2;

create table t1(c1 int primary key, c2 int) partition by hash(c1) partitions 13;
create table t2(c1 int primary key, c2 int) partition by hash(c1) partitions 13;

insert into t1 values(1,1),(13,13),(0,0),(4,4);
insert into t2 values(1,1);

explain basic SELECT /*+no_use_px*/ * FROM (SELECT * FROM t1 WHERE c1 IN (0, 1, 13, 4)) t3 UNION SELECT * FROM t2 WHERE c1 in (1);
Query Plan
===============================================
|ID|OPERATOR                         |NAME    |
-----------------------------------------------
|0 |PX COORDINATOR                   |        |
|1 |└─EXCHANGE OUT DISTR             |:EX10001|
|2 |  └─HASH UNION DISTINCT          |        |
|3 |    ├─PX PARTITION ITERATOR      |        |
|4 |    │ └─TABLE GET                |t1      |
|5 |    └─EXCHANGE IN DISTR          |        |
|6 |      └─EXCHANGE OUT DISTR (PKEY)|:EX10000|
|7 |        └─TABLE GET              |t2      |
===============================================
Outputs & filters:
-------------------------------------
  0 - output([INTERNAL_FUNCTION(UNION([1]), UNION([2]))]), filter(nil), rowset=16
  1 - output([INTERNAL_FUNCTION(UNION([1]), UNION([2]))]), filter(nil), rowset=16
      dop=1
  2 - output([UNION([1])], [UNION([2])]), filter(nil), rowset=16
  3 - output([t1.c1], [t1.c2]), filter(nil), rowset=16
      affinitize, force partition granule
  4 - output([t1.c1], [t1.c2]), filter(nil), rowset=16
      access([t1.c1], [t1.c2]), partitions(p[0-1], p4)
      is_index_back=false, is_global_index=false, 
      range_key([t1.c1]), range[0 ; 0], [1 ; 1], [13 ; 13], [4 ; 4], 
      range_cond([t1.c1 IN (0, 1, 13, 4)])
  5 - output([t2.c1], [t2.c2]), filter(nil), rowset=16
  6 - output([t2.c1], [t2.c2]), filter(nil), rowset=16
      (#keys=1, [t2.c1]), is_single, dop=1
  7 - output([t2.c1], [t2.c2]), filter(nil), rowset=16
      access([t2.c1], [t2.c2]), partitions(p1)
      is_index_back=false, is_global_index=false, 
      range_key([t2.c1]), range[1 ; 1], 
      range_cond([t2.c1 = 1])
SELECT /*+no_use_px*/ * FROM (SELECT * FROM t1 WHERE c1 IN (0, 1, 13, 4)) t3 UNION SELECT * FROM t2 WHERE c1 in (1);
+----+------+
| c1 | c2   |
+----+------+
|  0 |    0 |
|  1 |    1 |
|  4 |    4 |
| 13 |   13 |
+----+------+
explain basic SELECT * FROM (SELECT * FROM t1 WHERE c1 IN (0, 1, 13, 4)) t3 UNION SELECT * FROM t2 WHERE c1 in (1);
Query Plan
===============================================
|ID|OPERATOR                         |NAME    |
-----------------------------------------------
|0 |PX COORDINATOR                   |        |
|1 |└─EXCHANGE OUT DISTR             |:EX10001|
|2 |  └─HASH UNION DISTINCT          |        |
|3 |    ├─PX PARTITION ITERATOR      |        |
|4 |    │ └─TABLE GET                |t1      |
|5 |    └─EXCHANGE IN DISTR          |        |
|6 |      └─EXCHANGE OUT DISTR (PKEY)|:EX10000|
|7 |        └─TABLE GET              |t2      |
===============================================
Outputs & filters:
-------------------------------------
  0 - output([INTERNAL_FUNCTION(UNION([1]), UNION([2]))]), filter(nil), rowset=16
  1 - output([INTERNAL_FUNCTION(UNION([1]), UNION([2]))]), filter(nil), rowset=16
      dop=1
  2 - output([UNION([1])], [UNION([2])]), filter(nil), rowset=16
  3 - output([t1.c1], [t1.c2]), filter(nil), rowset=16
      affinitize, force partition granule
  4 - output([t1.c1], [t1.c2]), filter(nil), rowset=16
      access([t1.c1], [t1.c2]), partitions(p[0-1], p4)
      is_index_back=false, is_global_index=false, 
      range_key([t1.c1]), range[0 ; 0], [1 ; 1], [13 ; 13], [4 ; 4], 
      range_cond([t1.c1 IN (0, 1, 13, 4)])
  5 - output([t2.c1], [t2.c2]), filter(nil), rowset=16
  6 - output([t2.c1], [t2.c2]), filter(nil), rowset=16
      (#keys=1, [t2.c1]), is_single, dop=1
  7 - output([t2.c1], [t2.c2]), filter(nil), rowset=16
      access([t2.c1], [t2.c2]), partitions(p1)
      is_index_back=false, is_global_index=false, 
      range_key([t2.c1]), range[1 ; 1], 
      range_cond([t2.c1 = 1])
SELECT * FROM (SELECT * FROM t1 WHERE c1 IN (0, 1, 13, 4)) t3 UNION SELECT * FROM t2 WHERE c1 in (1);
+----+------+
| c1 | c2   |
+----+------+
|  0 |    0 |
|  1 |    1 |
|  4 |    4 |
| 13 |   13 |
+----+------+

delete from t1;
delete from t2;
insert into t1 values(1,1),(13,13),(0,0),(4,4),(14,14);
insert into t2 values(1,1),(14,14);
explain basic select /*+no_use_px*/ * from t1,t2 where t1.c1 = t2.c2 and t1.c1 in (0,14,1,3,4) order by t1.c1 desc;
Query Plan
====================================================
|ID|OPERATOR                           |NAME       |
----------------------------------------------------
|0 |PX COORDINATOR MERGE SORT          |           |
|1 |└─EXCHANGE OUT DISTR               |:EX10001   |
|2 |  └─SORT                           |           |
|3 |    └─NESTED-LOOP JOIN             |           |
|4 |      ├─EXCHANGE IN DISTR          |           |
|5 |      │ └─EXCHANGE OUT DISTR (PKEY)|:EX10000   |
|6 |      │   └─PX PARTITION ITERATOR  |           |
|7 |      │     └─TABLE FULL SCAN      |t2         |
|8 |      └─PX PARTITION ITERATOR      |           |
|9 |        └─TABLE GET                |t1(Reverse)|
====================================================
Outputs & filters:
-------------------------------------
  0 - output([INTERNAL_FUNCTION(t1.c1, t1.c2, t2.c1, t2.c2)]), filter(nil), rowset=16
      sort_keys([t1.c1, DESC])
  1 - output([t1.c1], [INTERNAL_FUNCTION(t1.c1, t1.c2, t2.c1, t2.c2)]), filter(nil), rowset=16
      dop=1
  2 - output([t1.c1], [t2.c2], [t2.c1], [t1.c2]), filter(nil), rowset=16
      sort_keys([t1.c1, DESC])
  3 - output([t1.c1], [t2.c2], [t2.c1], [t1.c2]), filter(nil), rowset=16
      conds(nil), nl_params_([t2.c2(:0)]), use_batch=false
  4 - output([PARTITION_ID], [t2.c2], [t2.c1]), filter(nil), rowset=16
  5 - output([PARTITION_ID], [t2.c2], [t2.c1]), filter(nil), rowset=16
      (#keys=1, [t2.c2]), dop=1
  6 - output([t2.c1], [t2.c2]), filter(nil), rowset=16
      force partition granule
  7 - output([t2.c1], [t2.c2]), filter([t2.c2 IN (0, 14, 1, 3, 4)]), rowset=16
      access([t2.c1], [t2.c2]), partitions(p[0-12])
      is_index_back=false, is_global_index=false, filter_before_indexback[false], 
      range_key([t2.c1]), range(MIN ; MAX)always true
  8 - output([t1.c1], [t1.c2]), filter(nil), rowset=16
      affinitize, force partition granule
  9 - output([t1.c1], [t1.c2]), filter(nil), rowset=16
      access([t1.c1], [t1.c2]), partitions(p[0-1], p[3-4])
      is_index_back=false, is_global_index=false, 
      range_key([t1.c1]), range(MIN ; MAX), 
      range_cond([t1.c1 = :0])
select /*+no_use_px*/ * from t1,t2 where t1.c1 = t2.c2 and t1.c1 in (0,14,1,3,4) order by t1.c1 desc;
+----+------+----+------+
| c1 | c2   | c1 | c2   |
+----+------+----+------+
|  1 |    1 |  1 |    1 |
| 14 |   14 | 14 |   14 |
+----+------+----+------+
explain basic select * from t1,t2 where t1.c1 = t2.c2 and t1.c1 in (0,14,1,3,4) order by t1.c1 desc;
Query Plan
====================================================
|ID|OPERATOR                           |NAME       |
----------------------------------------------------
|0 |PX COORDINATOR MERGE SORT          |           |
|1 |└─EXCHANGE OUT DISTR               |:EX10001   |
|2 |  └─SORT                           |           |
|3 |    └─NESTED-LOOP JOIN             |           |
|4 |      ├─EXCHANGE IN DISTR          |           |
|5 |      │ └─EXCHANGE OUT DISTR (PKEY)|:EX10000   |
|6 |      │   └─PX PARTITION ITERATOR  |           |
|7 |      │     └─TABLE FULL SCAN      |t2         |
|8 |      └─PX PARTITION ITERATOR      |           |
|9 |        └─TABLE GET                |t1(Reverse)|
====================================================
Outputs & filters:
-------------------------------------
  0 - output([INTERNAL_FUNCTION(t1.c1, t1.c2, t2.c1, t2.c2)]), filter(nil), rowset=16
      sort_keys([t1.c1, DESC])
  1 - output([t1.c1], [INTERNAL_FUNCTION(t1.c1, t1.c2, t2.c1, t2.c2)]), filter(nil), rowset=16
      dop=1
  2 - output([t1.c1], [t2.c2], [t2.c1], [t1.c2]), filter(nil), rowset=16
      sort_keys([t1.c1, DESC])
  3 - output([t1.c1], [t2.c2], [t2.c1], [t1.c2]), filter(nil), rowset=16
      conds(nil), nl_params_([t2.c2(:0)]), use_batch=false
  4 - output([PARTITION_ID], [t2.c2], [t2.c1]), filter(nil), rowset=16
  5 - output([PARTITION_ID], [t2.c2], [t2.c1]), filter(nil), rowset=16
      (#keys=1, [t2.c2]), dop=1
  6 - output([t2.c1], [t2.c2]), filter(nil), rowset=16
      force partition granule
  7 - output([t2.c1], [t2.c2]), filter([t2.c2 IN (0, 14, 1, 3, 4)]), rowset=16
      access([t2.c1], [t2.c2]), partitions(p[0-12])
      is_index_back=false, is_global_index=false, filter_before_indexback[false], 
      range_key([t2.c1]), range(MIN ; MAX)always true
  8 - output([t1.c1], [t1.c2]), filter(nil), rowset=16
      affinitize, force partition granule
  9 - output([t1.c1], [t1.c2]), filter(nil), rowset=16
      access([t1.c1], [t1.c2]), partitions(p[0-1], p[3-4])
      is_index_back=false, is_global_index=false, 
      range_key([t1.c1]), range(MIN ; MAX), 
      range_cond([t1.c1 = :0])
select * from t1,t2 where t1.c1 = t2.c2 and t1.c1 in (0,14,1,3,4) order by t1.c1 desc;
+----+------+----+------+
| c1 | c2   | c1 | c2   |
+----+------+----+------+
|  1 |    1 |  1 |    1 |
| 14 |   14 | 14 |   14 |
+----+------+----+------+

drop table if exists t0,t1;
DROP DATABASE IF EXISTS database46;
CREATE DATABASE database46;
USE database46;
CREATE TABLE t0(c0 FLOAT  PRIMARY KEY COMMENT 'asdf' )  PARTITION BY KEY (c0) partitions 15;
CREATE TABLE t1 LIKE t0;
CREATE UNIQUE INDEX i390 ON t0(c0) VISIBLE;
TRUNCATE TABLE t0;
UPDATE t0 SET c0= EXISTS (SELECT 1 from dual wHERE FALSE);
CREATE INDEX i410 ON t0(c0);
DELETE FROM t1;
DELETE FROM t0 WHERE (BIT_COUNT(BIT_COUNT(-1691812103))) AND ((-1691812103) || (((+ ((t0.c0) || (t0.c0)))) IS NOT TRUE));
ALTER TABLE t0 COMPRESSION 'NONE';
CREATE INDEX i710 ON t0(c0);
CREATE UNIQUE INDEX i759 ON t0(c0);

explain basic SELECT /*+  parallel(10)  */ t1.c0 AS ref0 FROM t1 WHERE (((-1691812103) IS NOT UNKNOWN) IS UNKNOWN) = (t1.c0) UNION ALL SELECT /*+  parallel(10)  */ t1.c0 AS ref0 FROM t1 WHERE (NOT ((((-1691812103) IS NOT UNKNOWN) IS NULL) = (t1.c0))) UNION ALL SELECT /*+  parallel(10)  */ ALL t1.c0 AS ref0 FROM t1 WHERE ((((-1691812103) IS NOT NULL) IS UNKNOWN) = (t1.c0)) IS NULL;
Query Plan
======================================
|ID|OPERATOR                |NAME    |
--------------------------------------
|0 |PX COORDINATOR          |        |
|1 |└─EXCHANGE OUT DISTR    |:EX10000|
|2 |  └─UNION ALL           |        |
|3 |    ├─PX BLOCK ITERATOR |        |
|4 |    │ └─TABLE RANGE SCAN|t1      |
|5 |    ├─PX BLOCK ITERATOR |        |
|6 |    │ └─TABLE RANGE SCAN|t1      |
|7 |    └─PX BLOCK ITERATOR |        |
|8 |      └─TABLE FULL SCAN |t1      |
======================================
Outputs & filters:
-------------------------------------
  0 - output([INTERNAL_FUNCTION(UNION([1]))]), filter(nil), rowset=16
  1 - output([INTERNAL_FUNCTION(UNION([1]))]), filter(nil), rowset=16
      dop=10
  2 - output([UNION([1])]), filter(nil), rowset=16
  3 - output([t1.c0]), filter(nil), rowset=16
  4 - output([t1.c0]), filter(nil), rowset=16
      access([t1.c0]), partitions(p11)
      is_index_back=false, is_global_index=false, 
      range_key([t1.c0]), range[0 ; 0], 
      range_cond([cast(-1691812103 IS NOT NULL IS NULL, DOUBLE(-1, -1)) = cast(t1.c0, DOUBLE(-1, -1))])
  5 - output([t1.c0]), filter(nil), rowset=16
  6 - output([t1.c0]), filter(nil), rowset=16
      access([t1.c0]), partitions(p[0-14])
      is_index_back=false, is_global_index=false, 
      range_key([t1.c0]), range(NULL ; 0), (0 ; MAX), 
      range_cond([cast(-1691812103 IS NOT NULL IS NULL, DOUBLE(-1, -1)) != cast(t1.c0, DOUBLE(-1, -1))])
  7 - output([t1.c0]), filter(nil), rowset=16
  8 - output([t1.c0]), filter([cast(-1691812103 IS NOT NULL IS NULL, DOUBLE(-1, -1)) = cast(t1.c0, DOUBLE(-1, -1)) IS NULL]), rowset=16
      access([t1.c0]), partitions(p[0-14])
      is_index_back=false, is_global_index=false, filter_before_indexback[false], 
      range_key([t1.c0]), range(MIN ; MAX)always true
SELECT /*+  parallel(10)  */ t1.c0 AS ref0 FROM t1 WHERE (((-1691812103) IS NOT UNKNOWN) IS UNKNOWN) = (t1.c0) UNION ALL SELECT /*+  parallel(10)  */ t1.c0 AS ref0 FROM t1 WHERE (NOT ((((-1691812103) IS NOT UNKNOWN) IS NULL) = (t1.c0))) UNION ALL SELECT /*+  parallel(10)  */ ALL t1.c0 AS ref0 FROM t1 WHERE ((((-1691812103) IS NOT NULL) IS UNKNOWN) = (t1.c0)) IS NULL;
+------+
| ref0 |
+------+
+------+
