drop table tt1;
drop table tt2;
create table tt1(c1 int) partition by hash(c1) partitions 8;
create table tt2(c1 int) partition by hash(c1) partitions 8;
insert into tt1 values(1),(2),(3),(4),(5),(6),(7),(8),(9),(10);
insert into tt2 select c1 from tt1;
insert into tt2 select 20*c1 from tt1;
insert into tt2 select 30*c1 from tt1;
explain basic select /*+parallel(2) leading(tt1 tt2)  use_hash(tt2) px_join_filter(tt2) pq_distribute(tt2 none none) no_px_part_join_filter(tt2)*/ * from tt1 join tt2 on tt1.c1=tt2.c1;
Query Plan
========================================
|ID|OPERATOR                  |NAME    |
----------------------------------------
|0 |PX COORDINATOR            |        |
|1 |└─EXCHANGE OUT DISTR      |:EX10000|
|2 |  └─PX PARTITION ITERATOR |        |
|3 |    └─HASH JOIN           |        |
|4 |      ├─JOIN FILTER CREATE|:RF0000 |
|5 |      │ └─TABLE FULL SCAN |tt1     |
|6 |      └─JOIN FILTER USE   |:RF0000 |
|7 |        └─TABLE FULL SCAN |tt2     |
========================================
Outputs & filters:
-------------------------------------
  0 - output([INTERNAL_FUNCTION(tt1.c1, tt2.c1)]), filter(nil), rowset=16
  1 - output([INTERNAL_FUNCTION(tt1.c1, tt2.c1)]), filter(nil), rowset=16
      dop=2
  2 - output([tt1.c1], [tt2.c1]), filter(nil), rowset=16
      partition wise, force partition granule
  3 - output([tt1.c1], [tt2.c1]), filter(nil), rowset=16
      equal_conds([tt1.c1 = tt2.c1]), other_conds(nil)
  4 - output([tt1.c1]), filter(nil), rowset=16
      RF_TYPE(in, range, bloom), RF_EXPR[tt1.c1]
  5 - output([tt1.c1]), filter(nil), rowset=16
      access([tt1.c1]), partitions(p[0-7])
      is_index_back=false, is_global_index=false, 
      range_key([tt1.__pk_increment]), range(MIN ; MAX)always true
  6 - output([tt2.c1]), filter(nil), rowset=16
  7 - output([tt2.c1]), filter([RF_IN_FILTER(tt2.c1)], [RF_RANGE_FILTER(tt2.c1)], [RF_BLOOM_FILTER(tt2.c1)]), rowset=16
      access([tt2.c1]), partitions(p[0-7])
      is_index_back=false, is_global_index=false, filter_before_indexback[false,false,false], 
      range_key([tt2.__pk_increment]), range(MIN ; MAX)always true
explain basic select /*+parallel(2) leading(tt1 tt2)  use_hash(tt2) px_join_filter(tt2) pq_distribute(tt2 partition none) no_px_part_join_filter(tt2)*/ * from tt1 join tt2 on tt1.c1=tt2.c1;
Query Plan
=================================================
|ID|OPERATOR                           |NAME    |
-------------------------------------------------
|0 |PX COORDINATOR                     |        |
|1 |└─EXCHANGE OUT DISTR               |:EX10001|
|2 |  └─HASH JOIN                      |        |
|3 |    ├─JOIN FILTER CREATE           |:RF0000 |
|4 |    │ └─EXCHANGE IN DISTR          |        |
|5 |    │   └─EXCHANGE OUT DISTR (PKEY)|:EX10000|
|6 |    │     └─PX BLOCK ITERATOR      |        |
|7 |    │       └─TABLE FULL SCAN      |tt1     |
|8 |    └─JOIN FILTER USE              |:RF0000 |
|9 |      └─PX PARTITION ITERATOR      |        |
|10|        └─TABLE FULL SCAN          |tt2     |
=================================================
Outputs & filters:
-------------------------------------
  0 - output([INTERNAL_FUNCTION(tt1.c1, tt2.c1)]), filter(nil), rowset=16
  1 - output([INTERNAL_FUNCTION(tt1.c1, tt2.c1)]), filter(nil), rowset=16
      dop=2
  2 - output([tt1.c1], [tt2.c1]), filter(nil), rowset=16
      equal_conds([tt1.c1 = tt2.c1]), other_conds(nil)
  3 - output([tt1.c1]), filter(nil), rowset=16
      RF_TYPE(in, range, bloom), RF_EXPR[tt1.c1]
  4 - output([tt1.c1]), filter(nil), rowset=16
  5 - output([tt1.c1]), filter(nil), rowset=16
      (#keys=1, [tt1.c1]), dop=2
  6 - output([tt1.c1]), filter(nil), rowset=16
  7 - output([tt1.c1]), filter(nil), rowset=16
      access([tt1.c1]), partitions(p[0-7])
      is_index_back=false, is_global_index=false, 
      range_key([tt1.__pk_increment]), range(MIN ; MAX)always true
  8 - output([tt2.c1]), filter(nil), rowset=16
  9 - output([tt2.c1]), filter(nil), rowset=16
      affinitize
 10 - output([tt2.c1]), filter([RF_IN_FILTER(tt2.c1)], [RF_RANGE_FILTER(tt2.c1)], [RF_BLOOM_FILTER(tt2.c1)]), rowset=16
      access([tt2.c1]), partitions(p[0-7])
      is_index_back=false, is_global_index=false, filter_before_indexback[false,false,false], 
      range_key([tt2.__pk_increment]), range(MIN ; MAX)always true
explain basic select /*+parallel(2) leading(tt1 tt2)  use_hash(tt2) px_join_filter(tt2) pq_distribute(tt2 bc2host none) no_px_part_join_filter(tt2)*/ * from tt1 join tt2 on tt1.c1=tt2.c1;
Query Plan
====================================================
|ID|OPERATOR                              |NAME    |
----------------------------------------------------
|0 |PX COORDINATOR                        |        |
|1 |└─EXCHANGE OUT DISTR                  |:EX10001|
|2 |  └─SHARED HASH JOIN                  |        |
|3 |    ├─JOIN FILTER CREATE              |:RF0000 |
|4 |    │ └─EXCHANGE IN DISTR             |        |
|5 |    │   └─EXCHANGE OUT DISTR (BC2HOST)|:EX10000|
|6 |    │     └─PX BLOCK ITERATOR         |        |
|7 |    │       └─TABLE FULL SCAN         |tt1     |
|8 |    └─JOIN FILTER USE                 |:RF0000 |
|9 |      └─PX BLOCK ITERATOR             |        |
|10|        └─TABLE FULL SCAN             |tt2     |
====================================================
Outputs & filters:
-------------------------------------
  0 - output([INTERNAL_FUNCTION(tt1.c1, tt2.c1)]), filter(nil), rowset=16
  1 - output([INTERNAL_FUNCTION(tt1.c1, tt2.c1)]), filter(nil), rowset=16
      dop=2
  2 - output([tt1.c1], [tt2.c1]), filter(nil), rowset=16
      equal_conds([tt1.c1 = tt2.c1]), other_conds(nil)
  3 - output([tt1.c1]), filter(nil), rowset=16
      RF_TYPE(in, range, bloom), RF_EXPR[tt1.c1]
  4 - output([tt1.c1]), filter(nil), rowset=16
  5 - output([tt1.c1]), filter(nil), rowset=16
      dop=2
  6 - output([tt1.c1]), filter(nil), rowset=16
  7 - output([tt1.c1]), filter(nil), rowset=16
      access([tt1.c1]), partitions(p[0-7])
      is_index_back=false, is_global_index=false, 
      range_key([tt1.__pk_increment]), range(MIN ; MAX)always true
  8 - output([tt2.c1]), filter(nil), rowset=16
  9 - output([tt2.c1]), filter(nil), rowset=16
 10 - output([tt2.c1]), filter([RF_IN_FILTER(tt2.c1)], [RF_RANGE_FILTER(tt2.c1)], [RF_BLOOM_FILTER(tt2.c1)]), rowset=16
      access([tt2.c1]), partitions(p[0-7])
      is_index_back=false, is_global_index=false, filter_before_indexback[false,false,false], 
      range_key([tt2.__pk_increment]), range(MIN ; MAX)always true
explain basic select /*+parallel(2) leading(tt1 tt2)  use_hash(tt2) px_join_filter(tt2) pq_distribute(tt2 hash hash) no_px_part_join_filter(tt2)*/ * from tt1 join tt2 on tt1.c1=tt2.c1;
Query Plan
=================================================
|ID|OPERATOR                           |NAME    |
-------------------------------------------------
|0 |PX COORDINATOR                     |        |
|1 |└─EXCHANGE OUT DISTR               |:EX10002|
|2 |  └─HASH JOIN                      |        |
|3 |    ├─JOIN FILTER CREATE           |:RF0000 |
|4 |    │ └─EXCHANGE IN DISTR          |        |
|5 |    │   └─EXCHANGE OUT DISTR (HASH)|:EX10000|
|6 |    │     └─PX BLOCK ITERATOR      |        |
|7 |    │       └─TABLE FULL SCAN      |tt1     |
|8 |    └─EXCHANGE IN DISTR            |        |
|9 |      └─EXCHANGE OUT DISTR (HASH)  |:EX10001|
|10|        └─JOIN FILTER USE          |:RF0000 |
|11|          └─PX BLOCK ITERATOR      |        |
|12|            └─TABLE FULL SCAN      |tt2     |
=================================================
Outputs & filters:
-------------------------------------
  0 - output([INTERNAL_FUNCTION(tt1.c1, tt2.c1)]), filter(nil), rowset=16
  1 - output([INTERNAL_FUNCTION(tt1.c1, tt2.c1)]), filter(nil), rowset=16
      dop=2
  2 - output([tt1.c1], [tt2.c1]), filter(nil), rowset=16
      equal_conds([tt1.c1 = tt2.c1]), other_conds(nil)
  3 - output([tt1.c1]), filter(nil), rowset=16
      RF_TYPE(in, range, bloom), RF_EXPR[tt1.c1]
  4 - output([tt1.c1]), filter(nil), rowset=16
  5 - output([tt1.c1]), filter(nil), rowset=16
      (#keys=1, [tt1.c1]), dop=2
  6 - output([tt1.c1]), filter(nil), rowset=16
  7 - output([tt1.c1]), filter(nil), rowset=16
      access([tt1.c1]), partitions(p[0-7])
      is_index_back=false, is_global_index=false, 
      range_key([tt1.__pk_increment]), range(MIN ; MAX)always true
  8 - output([tt2.c1]), filter(nil), rowset=16
  9 - output([tt2.c1]), filter(nil), rowset=16
      (#keys=1, [tt2.c1]), dop=2
 10 - output([tt2.c1]), filter(nil), rowset=16
 11 - output([tt2.c1]), filter(nil), rowset=16
 12 - output([tt2.c1]), filter([RF_IN_FILTER(tt2.c1)], [RF_RANGE_FILTER(tt2.c1)], [RF_BLOOM_FILTER(tt2.c1)]), rowset=16
      access([tt2.c1]), partitions(p[0-7])
      is_index_back=false, is_global_index=false, filter_before_indexback[false,false,false], 
      range_key([tt2.__pk_increment]), range(MIN ; MAX)always true
explain basic select /*+parallel(2) leading(tt1 tt2)  use_hash(tt2) px_join_filter(tt2) pq_distribute(tt2 none partition) no_px_part_join_filter(tt2)*/ * from tt1 join tt2 on tt1.c1=tt2.c1;
Query Plan
===============================================
|ID|OPERATOR                         |NAME    |
-----------------------------------------------
|0 |PX COORDINATOR                   |        |
|1 |└─EXCHANGE OUT DISTR             |:EX10001|
|2 |  └─HASH JOIN                    |        |
|3 |    ├─JOIN FILTER CREATE         |:RF0000 |
|4 |    │ └─PX PARTITION ITERATOR    |        |
|5 |    │   └─TABLE FULL SCAN        |tt1     |
|6 |    └─EXCHANGE IN DISTR          |        |
|7 |      └─EXCHANGE OUT DISTR (PKEY)|:EX10000|
|8 |        └─JOIN FILTER USE        |:RF0000 |
|9 |          └─PX BLOCK ITERATOR    |        |
|10|            └─TABLE FULL SCAN    |tt2     |
===============================================
Outputs & filters:
-------------------------------------
  0 - output([INTERNAL_FUNCTION(tt1.c1, tt2.c1)]), filter(nil), rowset=16
  1 - output([INTERNAL_FUNCTION(tt1.c1, tt2.c1)]), filter(nil), rowset=16
      dop=2
  2 - output([tt1.c1], [tt2.c1]), filter(nil), rowset=16
      equal_conds([tt1.c1 = tt2.c1]), other_conds(nil)
  3 - output([tt1.c1]), filter(nil), rowset=16
      RF_TYPE(in, range, bloom), RF_EXPR[tt1.c1]
  4 - output([tt1.c1]), filter(nil), rowset=16
      affinitize
  5 - output([tt1.c1]), filter(nil), rowset=16
      access([tt1.c1]), partitions(p[0-7])
      is_index_back=false, is_global_index=false, 
      range_key([tt1.__pk_increment]), range(MIN ; MAX)always true
  6 - output([tt2.c1]), filter(nil), rowset=16
  7 - output([tt2.c1]), filter(nil), rowset=16
      (#keys=1, [tt2.c1]), dop=2
  8 - output([tt2.c1]), filter(nil), rowset=16
  9 - output([tt2.c1]), filter(nil), rowset=16
 10 - output([tt2.c1]), filter([RF_IN_FILTER(tt2.c1)], [RF_RANGE_FILTER(tt2.c1)], [RF_BLOOM_FILTER(tt2.c1)]), rowset=16
      access([tt2.c1]), partitions(p[0-7])
      is_index_back=false, is_global_index=false, filter_before_indexback[false,false,false], 
      range_key([tt2.__pk_increment]), range(MIN ; MAX)always true
select /*+parallel(2) leading(tt1 tt2)  use_hash(tt2) px_join_filter(tt2) pq_distribute(tt2 none none) no_px_part_join_filter(tt2)*/ * from tt1 join tt2 on tt1.c1=tt2.c1;
c1	c1
1	1
10	10
2	2
3	3
4	4
5	5
6	6
7	7
8	8
9	9
select /*+parallel(2) leading(tt1 tt2)  use_hash(tt2) px_join_filter(tt2) pq_distribute(tt2 partition none) no_px_part_join_filter(tt2)*/ * from tt1 join tt2 on tt1.c1=tt2.c1;
c1	c1
1	1
10	10
2	2
3	3
4	4
5	5
6	6
7	7
8	8
9	9
select /*+parallel(2) leading(tt1 tt2)  use_hash(tt2) px_join_filter(tt2) pq_distribute(tt2 bc2host none) no_px_part_join_filter(tt2)*/ * from tt1 join tt2 on tt1.c1=tt2.c1;
c1	c1
1	1
10	10
2	2
3	3
4	4
5	5
6	6
7	7
8	8
9	9
select /*+parallel(2) leading(tt1 tt2)  use_hash(tt2) px_join_filter(tt2) pq_distribute(tt2 hash hash) no_px_part_join_filter(tt2)*/ * from tt1 join tt2 on tt1.c1=tt2.c1;
c1	c1
1	1
10	10
2	2
3	3
4	4
5	5
6	6
7	7
8	8
9	9
select /*+parallel(2) leading(tt1 tt2)  use_hash(tt2) px_join_filter(tt2) pq_distribute(tt2 none partition) no_px_part_join_filter(tt2)*/ * from tt1 join tt2 on tt1.c1=tt2.c1;
c1	c1
1	1
10	10
2	2
3	3
4	4
5	5
6	6
7	7
8	8
9	9
drop table tt1;
drop table tt2;
drop table t1;
drop table t2;
drop table t3;
create table t1(c1 int, c2 int);
create table t2(c1 int, c2 int);
create table t3(c1 int, c2 int);
insert into t1 values(1,1),(2,2),(3,3),(4,4),(5,5),(6,6),(7,7),(8,8),(9,9),(10,10);
insert into t2 select c1,c2 from t1;
insert into t2 select 20*c1,20*c2 from t1;
insert into t2 select 30*c1,30*c2 from t1;
insert into t3 select c1,c2 from t1;
insert into t3 select 20*c1,20*c2 from t1;
insert into t3 select 30*c1,30*c2 from t1;
delete from t2;
delete from t3;
insert into t2 select c1, c2 from t1 where c1 < 6;
insert into t2 select c1 + 100, c2 + 100 from t1;
insert into t3 select c1 + 5, c2 + 5 from t1 where c1 < 6;
insert into t3 select c1 + 200, c2 + 200 from t1;
explain basic select 
/*+
BEGIN_OUTLINE_DATA
LEADING(@"SEL$1" ("TEST"."T1"@"SEL$1" "TT"@"SEL$1"))
USE_HASH(@"SEL$1" "TT"@"SEL$1")
PX_JOIN_FILTER(@"SEL$1" "TT"@"SEL$1" "TEST"."T1"@"SEL$1" "TEST"."T2"@"SEL$2")
PX_JOIN_FILTER(@"SEL$1" "TT"@"SEL$1" "TEST"."T1"@"SEL$1" "TEST"."T3"@"SEL$3")
PQ_DISTRIBUTE(@"SEL$1" "TT"@"SEL$1" BC2HOST NONE) 
PARALLEL(@"SEL$1" "TEST"."T1"@"SEL$1" 8)
FULL(@"SEL$1" "TEST"."T1"@"SEL$1")
PQ_SET(@"SET$1"  NONE RANDOM)
PARALLEL(@"SEL$2" "TEST"."T2"@"SEL$2" 8)
FULL(@"SEL$2" "TEST"."T2"@"SEL$2")
PARALLEL(@"SEL$3" "TEST"."T3"@"SEL$3" 8)
FULL(@"SEL$3" "TEST"."T3"@"SEL$3")
PARALLEL(8)
OPTIMIZER_FEATURES_ENABLE('')
END_OUTLINE_DATA
*/
* from t1, (select c1 from t2 union all select c1 from t3) tt where t1.c1=tt.c1;
Query Plan
======================================================
|ID|OPERATOR                                |NAME    |
------------------------------------------------------
|0 |PX COORDINATOR                          |        |
|1 |└─EXCHANGE OUT DISTR                    |:EX10002|
|2 |  └─SHARED HASH JOIN                    |        |
|3 |    ├─JOIN FILTER CREATE                |:RF0001 |
|4 |    │ └─JOIN FILTER CREATE              |:RF0000 |
|5 |    │   └─EXCHANGE IN DISTR             |        |
|6 |    │     └─EXCHANGE OUT DISTR (BC2HOST)|:EX10000|
|7 |    │       └─PX BLOCK ITERATOR         |        |
|8 |    │         └─TABLE FULL SCAN         |t1      |
|9 |    └─SUBPLAN SCAN                      |tt      |
|10|      └─UNION ALL                       |        |
|11|        ├─JOIN FILTER USE               |:RF0000 |
|12|        │ └─PX BLOCK ITERATOR           |        |
|13|        │   └─TABLE FULL SCAN           |t2      |
|14|        └─EXCHANGE IN DISTR             |        |
|15|          └─EXCHANGE OUT DISTR (RANDOM) |:EX10001|
|16|            └─JOIN FILTER USE           |:RF0001 |
|17|              └─PX BLOCK ITERATOR       |        |
|18|                └─TABLE FULL SCAN       |t3      |
======================================================
Outputs & filters:
-------------------------------------
  0 - output([INTERNAL_FUNCTION(t1.c1, t1.c2, tt.c1)]), filter(nil), rowset=16
  1 - output([INTERNAL_FUNCTION(t1.c1, t1.c2, tt.c1)]), filter(nil), rowset=16
      dop=8
  2 - output([t1.c1], [tt.c1], [t1.c2]), filter(nil), rowset=16
      equal_conds([t1.c1 = tt.c1]), other_conds(nil)
  3 - output([t1.c1], [t1.c2]), filter(nil), rowset=16
      RF_TYPE(in, range, bloom), RF_EXPR[t1.c1]
  4 - output([t1.c1], [t1.c2]), filter(nil), rowset=16
      RF_TYPE(in, range, bloom), RF_EXPR[t1.c1]
  5 - output([t1.c1], [t1.c2]), filter(nil), rowset=16
  6 - output([t1.c1], [t1.c2]), filter(nil), rowset=16
      dop=8
  7 - output([t1.c1], [t1.c2]), filter(nil), rowset=16
  8 - output([t1.c1], [t1.c2]), filter(nil), rowset=16
      access([t1.c1], [t1.c2]), partitions(p0)
      is_index_back=false, is_global_index=false, 
      range_key([t1.__pk_increment]), range(MIN ; MAX)always true
  9 - output([tt.c1]), filter(nil), rowset=16
      access([tt.c1])
 10 - output([UNION([1])]), filter(nil), rowset=16
 11 - output([t2.c1]), filter(nil), rowset=16
 12 - output([t2.c1]), filter(nil), rowset=16
 13 - output([t2.c1]), filter([RF_IN_FILTER(t2.c1)], [RF_RANGE_FILTER(t2.c1)], [RF_BLOOM_FILTER(t2.c1)]), rowset=16
      access([t2.c1]), partitions(p0)
      is_index_back=false, is_global_index=false, filter_before_indexback[false,false,false], 
      range_key([t2.__pk_increment]), range(MIN ; MAX)always true
 14 - output([t3.c1]), filter(nil), rowset=16
 15 - output([t3.c1]), filter(nil), rowset=16
      dop=8
 16 - output([t3.c1]), filter(nil), rowset=16
 17 - output([t3.c1]), filter(nil), rowset=16
 18 - output([t3.c1]), filter([RF_IN_FILTER(t3.c1)], [RF_RANGE_FILTER(t3.c1)], [RF_BLOOM_FILTER(t3.c1)]), rowset=16
      access([t3.c1]), partitions(p0)
      is_index_back=false, is_global_index=false, filter_before_indexback[false,false,false], 
      range_key([t3.__pk_increment]), range(MIN ; MAX)always true
select 
/*+
BEGIN_OUTLINE_DATA
LEADING(@"SEL$1" ("TEST"."T1"@"SEL$1" "TT"@"SEL$1"))
USE_HASH(@"SEL$1" "TT"@"SEL$1")
PX_JOIN_FILTER(@"SEL$1" "TT"@"SEL$1" "TEST"."T1"@"SEL$1" "TEST"."T2"@"SEL$2")
PX_JOIN_FILTER(@"SEL$1" "TT"@"SEL$1" "TEST"."T1"@"SEL$1" "TEST"."T3"@"SEL$3")
PQ_DISTRIBUTE(@"SEL$1" "TT"@"SEL$1" BC2HOST NONE) 
PARALLEL(@"SEL$1" "TEST"."T1"@"SEL$1" 8)
FULL(@"SEL$1" "TEST"."T1"@"SEL$1")
PQ_SET(@"SET$1"  NONE RANDOM)
PARALLEL(@"SEL$2" "TEST"."T2"@"SEL$2" 8)
FULL(@"SEL$2" "TEST"."T2"@"SEL$2")
PARALLEL(@"SEL$3" "TEST"."T3"@"SEL$3" 8)
FULL(@"SEL$3" "TEST"."T3"@"SEL$3")
PARALLEL(8)
OPTIMIZER_FEATURES_ENABLE('')
END_OUTLINE_DATA
*/
* from t1, (select c1 from t2 union all select c1 from t3) tt where t1.c1=tt.c1;
c1	c2	c1
1	1	1
10	10	10
2	2	2
3	3	3
4	4	4
5	5	5
6	6	6
7	7	7
8	8	8
9	9	9
drop table t1;
drop table t2;
drop table t3;
create table t1(c1 int, c2 int);
create table t2(c1 int, c2 int);
create table t3(c1 int, c2 int) partition by hash(c2) partitions 20;
insert into t1 values(1,1),(2,2),(3,3),(4,4),(5,5),(6,6),(7,7),(8,8),(9,9),(10,10);
insert into t2 select c1,c2 from t1;
insert into t2 select 20*c1,20*c2 from t1;
insert into t2 select 30*c1,30*c2 from t1;
insert into t3 select c1,c2 from t1;
insert into t3 select 20*c1,20*c2 from t1;
insert into t3 select 30*c1,30*c2 from t1;
drop table t1;
drop table t2;
drop table t3;
create table t1 (c1 bigint) partition by hash(c1) partitions 32;
create table t2 (c1 bigint) partition by hash(c1) partitions 32;
create table t3 (c1 bigint, c2 varchar(128));
insert into t1 values(1), (2), (3);
insert into t2 values(1), (2), (3);
insert /*+query_timeout(100000000)*/into t3 select random(123), randstr(123, random(456)) from table(generator(1000000));
explain basic select /*+parallel(10) leading(t1 (t2 t3)) pq_distribute((t2 t3) none none) pq_distribute(t3 none partition) px_join_filter(t3) dynamic_sampling(0)*/ * from t1 join (select t2.*, t3.c2 from t2 join t3 on t2.c1=t3.c1) as view1 on t1.c1=view1.c1;
Query Plan
=================================================
|ID|OPERATOR                           |NAME    |
-------------------------------------------------
|0 |PX COORDINATOR                     |        |
|1 |└─EXCHANGE OUT DISTR               |:EX10001|
|2 |  └─HASH JOIN                      |        |
|3 |    ├─PX PARTITION ITERATOR        |        |
|4 |    │ └─TABLE FULL SCAN            |t1      |
|5 |    └─HASH JOIN                    |        |
|6 |      ├─JOIN FILTER CREATE         |:RF0000 |
|7 |      │ └─PX PARTITION ITERATOR    |        |
|8 |      │   └─TABLE FULL SCAN        |t2      |
|9 |      └─EXCHANGE IN DISTR          |        |
|10|        └─EXCHANGE OUT DISTR (PKEY)|:EX10000|
|11|          └─JOIN FILTER USE        |:RF0000 |
|12|            └─PX BLOCK ITERATOR    |        |
|13|              └─TABLE FULL SCAN    |t3      |
=================================================
Outputs & filters:
-------------------------------------
  0 - output([INTERNAL_FUNCTION(t1.c1, t2.c1, t3.c2)]), filter(nil), rowset=256
  1 - output([INTERNAL_FUNCTION(t1.c1, t2.c1, t3.c2)]), filter(nil), rowset=256
      dop=10
  2 - output([t1.c1], [t2.c1], [t3.c2]), filter(nil), rowset=256
      equal_conds([t1.c1 = t2.c1]), other_conds(nil)
  3 - output([t1.c1]), filter(nil), rowset=256
      affinitize, partition wise, force partition granule
  4 - output([t1.c1]), filter(nil), rowset=256
      access([t1.c1]), partitions(p[0-31])
      is_index_back=false, is_global_index=false, 
      range_key([t1.__pk_increment]), range(MIN ; MAX)always true
  5 - output([t2.c1], [t3.c2]), filter(nil), rowset=256
      equal_conds([t2.c1 = t3.c1]), other_conds(nil)
  6 - output([t2.c1]), filter(nil), rowset=256
      RF_TYPE(in, range, bloom), RF_EXPR[t2.c1]
  7 - output([t2.c1]), filter(nil), rowset=256
      affinitize, partition wise, force partition granule
  8 - output([t2.c1]), filter(nil), rowset=256
      access([t2.c1]), partitions(p[0-31])
      is_index_back=false, is_global_index=false, 
      range_key([t2.__pk_increment]), range(MIN ; MAX)always true
  9 - output([t3.c1], [t3.c2]), filter(nil), rowset=256
 10 - output([t3.c1], [t3.c2]), filter(nil), rowset=256
      (#keys=1, [t3.c1]), dop=10
 11 - output([t3.c1], [t3.c2]), filter(nil), rowset=256
 12 - output([t3.c1], [t3.c2]), filter(nil), rowset=256
 13 - output([t3.c1], [t3.c2]), filter([RF_IN_FILTER(t3.c1)], [RF_RANGE_FILTER(t3.c1)], [RF_BLOOM_FILTER(t3.c1)]), rowset=256
      access([t3.c1], [t3.c2]), partitions(p0)
      is_index_back=false, is_global_index=false, filter_before_indexback[false,false,false], 
      range_key([t3.__pk_increment]), range(MIN ; MAX)always true
select /*+parallel(10) leading(t1 (t2 t3)) pq_distribute((t2 t3) none none) pq_distribute(t3 none partition) px_join_filter(t3) dynamic_sampling(0)*/ * from t1 join (select t2.*, t3.c2 from t2 join t3 on t2.c1=t3.c1) as view1 on t1.c1=view1.c1;
c1	c1	c2
select if (ELAPSED_TIME < 1500000, 'True', 'False') from oceanbase.gv$ob_sql_audit where trace_id=(select last_trace_id() from dual) and query_sql != '' order by ELAPSED_TIME desc limit 1;
if (ELAPSED_TIME < 1500000, 'True', 'False')
True
select /*+parallel(10) OPT_PARAM('enable_rich_vector_format', 'FALSE') leading(t1 (t2 t3)) pq_distribute((t2 t3) none none) pq_distribute(t3 none partition) px_join_filter(t3) dynamic_sampling(0)*/ * from t1 join (select t2.*, t3.c2 from t2 join t3 on t2.c1=t3.c1) as view1 on t1.c1=view1.c1;
c1	c1	c2
select if (ELAPSED_TIME < 1500000, 'True', 'False') from oceanbase.gv$ob_sql_audit where trace_id=(select last_trace_id() from dual) and query_sql != '' order by ELAPSED_TIME desc limit 1;
if (ELAPSED_TIME < 1500000, 'True', 'False')
True
drop table if exists t1, t2, t3;
