result_format: 4
drop table if exists s,p,p4,no_p,temp_s,temp_p,temp_p4,temp_p5;

create table s(c1 int primary key, c2 int ,c3 int);
create table p(c1 int primary key, c2 int ,c3 int) partition by hash(c1)  partitions 4;
create table p4(c1 int primary key, c2 int ,c3 int) partition by hash(c1)  partitions 4;
create table no_p(c1 int, c2 int ,c3 int) partition by hash(c1)  partitions 4;
create table temp_s(c1 int, c2 int, c3 int);
create table temp_p(c1 int, c2 int ,c3 int) partition by hash(c1)  partitions 4;
create table temp_p4(c1 int, c2 int ,c3 int) partition by hash(c1)  partitions 4;
create table temp_p5(c1 int, c2 int ,c3 int) partition by hash(c1)  partitions 5;

## replace
explain basic replace /*+use_px,parallel(10)*/ into p values(1,2,3);
Query Plan
=============================
|ID|OPERATOR           |NAME|
-----------------------------
|0 |DISTRIBUTED REPLACE|    |
|1 |└─EXPRESSION       |    |
=============================
Outputs & filters:
-------------------------------------
  0 - output(nil), filter(nil)
      columns([{p: ({p: (p.c1, p.c2, p.c3)})}]), 
      column_values([column_conv(INT,PS:(11,0),NOT NULL,__values.c1)], [column_conv(INT,PS:(11,0),NULL,__values.c2)], [column_conv(INT,PS:(11,0),NULL,__values.c3)])
  1 - output([__values.c1], [__values.c2], [__values.c3]), filter(nil)
      values({1, 2, 3})
replace /*+use_px,parallel(10)*/ into p values(1,2,3);
select * from p order by c1;
+----+------+------+
| c1 | c2   | c3   |
+----+------+------+
|  1 |    2 |    3 |
+----+------+------+
delete from p;

insert into temp_p(c1,c2) values(1,1),(2,2),(3,3),(4,4),(5,5),(6,6),(7,7),(8,8),(9,9),(10,10);
insert into temp_s(c1,c3) values(1,1),(2,2),(3,3),(4,4),(5,5),(6,6),(7,7),(8,8),(9,9),(10,10);
insert into temp_p4(c1,c2) values(1,1),(2,2),(3,3),(4,4),(5,5),(6,6),(7,7),(8,8),(9,9),(10,10);
insert into temp_p5(c1,c2) values(1,1),(2,2),(3,3),(4,4),(5,5),(6,6),(7,7),(8,8),(9,9),(10,10);

explain basic replace /*+no_use_px*/ into s select * from temp_s;
Query Plan
========================================
|ID|OPERATOR           |NAME           |
----------------------------------------
|0 |REPLACE            |               |
|1 |└─SUBPLAN SCAN     |ANONYMOUS_VIEW1|
|2 |  └─TABLE FULL SCAN|temp_s         |
========================================
Outputs & filters:
-------------------------------------
  0 - output(nil), filter(nil)
      columns([{s: ({s: (s.c1, s.c2, s.c3)})}]), partitions(p0), 
      column_values([column_conv(INT,PS:(11,0),NOT NULL,ANONYMOUS_VIEW1.c1)], [column_conv(INT,PS:(11,0),NULL,ANONYMOUS_VIEW1.c2)], [column_conv(INT,PS:(11,
      0),NULL,ANONYMOUS_VIEW1.c3)])
  1 - output([ANONYMOUS_VIEW1.c1], [ANONYMOUS_VIEW1.c2], [ANONYMOUS_VIEW1.c3]), filter(nil), rowset=16
      access([ANONYMOUS_VIEW1.c1], [ANONYMOUS_VIEW1.c2], [ANONYMOUS_VIEW1.c3])
  2 - output([temp_s.c1], [temp_s.c2], [temp_s.c3]), filter(nil), rowset=16
      access([temp_s.c1], [temp_s.c2], [temp_s.c3]), partitions(p0)
      is_index_back=false, is_global_index=false, 
      range_key([temp_s.__pk_increment]), range(MIN ; MAX)always true
explain basic replace /*+use_px*/ into s select * from temp_s;
Query Plan
========================================
|ID|OPERATOR           |NAME           |
----------------------------------------
|0 |REPLACE            |               |
|1 |└─SUBPLAN SCAN     |ANONYMOUS_VIEW1|
|2 |  └─TABLE FULL SCAN|temp_s         |
========================================
Outputs & filters:
-------------------------------------
  0 - output(nil), filter(nil)
      columns([{s: ({s: (s.c1, s.c2, s.c3)})}]), partitions(p0), 
      column_values([column_conv(INT,PS:(11,0),NOT NULL,ANONYMOUS_VIEW1.c1)], [column_conv(INT,PS:(11,0),NULL,ANONYMOUS_VIEW1.c2)], [column_conv(INT,PS:(11,
      0),NULL,ANONYMOUS_VIEW1.c3)])
  1 - output([ANONYMOUS_VIEW1.c1], [ANONYMOUS_VIEW1.c2], [ANONYMOUS_VIEW1.c3]), filter(nil), rowset=16
      access([ANONYMOUS_VIEW1.c1], [ANONYMOUS_VIEW1.c2], [ANONYMOUS_VIEW1.c3])
  2 - output([temp_s.c1], [temp_s.c2], [temp_s.c3]), filter(nil), rowset=16
      access([temp_s.c1], [temp_s.c2], [temp_s.c3]), partitions(p0)
      is_index_back=false, is_global_index=false, 
      range_key([temp_s.__pk_increment]), range(MIN ; MAX)always true
replace /*+use_px*/ into s select * from temp_s;
select * from s order by c1;
+----+------+------+
| c1 | c2   | c3   |
+----+------+------+
|  1 | NULL |    1 |
|  2 | NULL |    2 |
|  3 | NULL |    3 |
|  4 | NULL |    4 |
|  5 | NULL |    5 |
|  6 | NULL |    6 |
|  7 | NULL |    7 |
|  8 | NULL |    8 |
|  9 | NULL |    9 |
| 10 | NULL |   10 |
+----+------+------+
delete from s;

explain basic replace /*+no_use_px,parallel(10)*/ into s select * from temp_s;
Query Plan
==============================================
|ID|OPERATOR                 |NAME           |
----------------------------------------------
|0 |REPLACE                  |               |
|1 |└─PX COORDINATOR         |               |
|2 |  └─EXCHANGE OUT DISTR   |:EX10000       |
|3 |    └─SUBPLAN SCAN       |ANONYMOUS_VIEW1|
|4 |      └─PX BLOCK ITERATOR|               |
|5 |        └─TABLE FULL SCAN|temp_s         |
==============================================
Outputs & filters:
-------------------------------------
  0 - output(nil), filter(nil)
      columns([{s: ({s: (s.c1, s.c2, s.c3)})}]), partitions(p0), 
      column_values([column_conv(INT,PS:(11,0),NOT NULL,ANONYMOUS_VIEW1.c1)], [column_conv(INT,PS:(11,0),NULL,ANONYMOUS_VIEW1.c2)], [column_conv(INT,PS:(11,
      0),NULL,ANONYMOUS_VIEW1.c3)])
  1 - output([ANONYMOUS_VIEW1.c1], [ANONYMOUS_VIEW1.c2], [ANONYMOUS_VIEW1.c3]), filter(nil), rowset=16
  2 - output([ANONYMOUS_VIEW1.c1], [ANONYMOUS_VIEW1.c2], [ANONYMOUS_VIEW1.c3]), filter(nil), rowset=16
      dop=10
  3 - output([ANONYMOUS_VIEW1.c1], [ANONYMOUS_VIEW1.c2], [ANONYMOUS_VIEW1.c3]), filter(nil), rowset=16
      access([ANONYMOUS_VIEW1.c1], [ANONYMOUS_VIEW1.c2], [ANONYMOUS_VIEW1.c3])
  4 - output([temp_s.c1], [temp_s.c2], [temp_s.c3]), filter(nil), rowset=16
  5 - output([temp_s.c1], [temp_s.c2], [temp_s.c3]), filter(nil), rowset=16
      access([temp_s.c1], [temp_s.c2], [temp_s.c3]), partitions(p0)
      is_index_back=false, is_global_index=false, 
      range_key([temp_s.__pk_increment]), range(MIN ; MAX)always true
explain basic replace /*+use_px,parallel(10)*/ into s select * from temp_s;
Query Plan
==============================================
|ID|OPERATOR                 |NAME           |
----------------------------------------------
|0 |REPLACE                  |               |
|1 |└─PX COORDINATOR         |               |
|2 |  └─EXCHANGE OUT DISTR   |:EX10000       |
|3 |    └─SUBPLAN SCAN       |ANONYMOUS_VIEW1|
|4 |      └─PX BLOCK ITERATOR|               |
|5 |        └─TABLE FULL SCAN|temp_s         |
==============================================
Outputs & filters:
-------------------------------------
  0 - output(nil), filter(nil)
      columns([{s: ({s: (s.c1, s.c2, s.c3)})}]), partitions(p0), 
      column_values([column_conv(INT,PS:(11,0),NOT NULL,ANONYMOUS_VIEW1.c1)], [column_conv(INT,PS:(11,0),NULL,ANONYMOUS_VIEW1.c2)], [column_conv(INT,PS:(11,
      0),NULL,ANONYMOUS_VIEW1.c3)])
  1 - output([ANONYMOUS_VIEW1.c1], [ANONYMOUS_VIEW1.c2], [ANONYMOUS_VIEW1.c3]), filter(nil), rowset=16
  2 - output([ANONYMOUS_VIEW1.c1], [ANONYMOUS_VIEW1.c2], [ANONYMOUS_VIEW1.c3]), filter(nil), rowset=16
      dop=10
  3 - output([ANONYMOUS_VIEW1.c1], [ANONYMOUS_VIEW1.c2], [ANONYMOUS_VIEW1.c3]), filter(nil), rowset=16
      access([ANONYMOUS_VIEW1.c1], [ANONYMOUS_VIEW1.c2], [ANONYMOUS_VIEW1.c3])
  4 - output([temp_s.c1], [temp_s.c2], [temp_s.c3]), filter(nil), rowset=16
  5 - output([temp_s.c1], [temp_s.c2], [temp_s.c3]), filter(nil), rowset=16
      access([temp_s.c1], [temp_s.c2], [temp_s.c3]), partitions(p0)
      is_index_back=false, is_global_index=false, 
      range_key([temp_s.__pk_increment]), range(MIN ; MAX)always true
replace /*+use_px,parallel(10)*/ into s select * from temp_s;
select * from s order by c1;
+----+------+------+
| c1 | c2   | c3   |
+----+------+------+
|  1 | NULL |    1 |
|  2 | NULL |    2 |
|  3 | NULL |    3 |
|  4 | NULL |    4 |
|  5 | NULL |    5 |
|  6 | NULL |    6 |
|  7 | NULL |    7 |
|  8 | NULL |    8 |
|  9 | NULL |    9 |
| 10 | NULL |   10 |
+----+------+------+
delete from s;

explain basic replace /*+no_use_px,parallel(10)*/ into s select * from temp_p where temp_p.c2 >= 5;
Query Plan
==============================================
|ID|OPERATOR                 |NAME           |
----------------------------------------------
|0 |REPLACE                  |               |
|1 |└─PX COORDINATOR         |               |
|2 |  └─EXCHANGE OUT DISTR   |:EX10000       |
|3 |    └─SUBPLAN SCAN       |ANONYMOUS_VIEW1|
|4 |      └─PX BLOCK ITERATOR|               |
|5 |        └─TABLE FULL SCAN|temp_p         |
==============================================
Outputs & filters:
-------------------------------------
  0 - output(nil), filter(nil)
      columns([{s: ({s: (s.c1, s.c2, s.c3)})}]), partitions(p0), 
      column_values([column_conv(INT,PS:(11,0),NOT NULL,ANONYMOUS_VIEW1.c1)], [column_conv(INT,PS:(11,0),NULL,ANONYMOUS_VIEW1.c2)], [column_conv(INT,PS:(11,
      0),NULL,ANONYMOUS_VIEW1.c3)])
  1 - output([ANONYMOUS_VIEW1.c1], [ANONYMOUS_VIEW1.c2], [ANONYMOUS_VIEW1.c3]), filter(nil), rowset=16
  2 - output([ANONYMOUS_VIEW1.c1], [ANONYMOUS_VIEW1.c2], [ANONYMOUS_VIEW1.c3]), filter(nil), rowset=16
      dop=10
  3 - output([ANONYMOUS_VIEW1.c1], [ANONYMOUS_VIEW1.c2], [ANONYMOUS_VIEW1.c3]), filter(nil), rowset=16
      access([ANONYMOUS_VIEW1.c1], [ANONYMOUS_VIEW1.c2], [ANONYMOUS_VIEW1.c3])
  4 - output([temp_p.c1], [temp_p.c2], [temp_p.c3]), filter(nil), rowset=16
  5 - output([temp_p.c1], [temp_p.c2], [temp_p.c3]), filter([temp_p.c2 >= 5]), rowset=16
      access([temp_p.c1], [temp_p.c2], [temp_p.c3]), partitions(p[0-3])
      is_index_back=false, is_global_index=false, filter_before_indexback[false], 
      range_key([temp_p.__pk_increment]), range(MIN ; MAX)always true
explain basic replace /*+use_px,parallel(10)*/ into s select * from temp_p where temp_p.c2 >= 5;
Query Plan
==============================================
|ID|OPERATOR                 |NAME           |
----------------------------------------------
|0 |REPLACE                  |               |
|1 |└─PX COORDINATOR         |               |
|2 |  └─EXCHANGE OUT DISTR   |:EX10000       |
|3 |    └─SUBPLAN SCAN       |ANONYMOUS_VIEW1|
|4 |      └─PX BLOCK ITERATOR|               |
|5 |        └─TABLE FULL SCAN|temp_p         |
==============================================
Outputs & filters:
-------------------------------------
  0 - output(nil), filter(nil)
      columns([{s: ({s: (s.c1, s.c2, s.c3)})}]), partitions(p0), 
      column_values([column_conv(INT,PS:(11,0),NOT NULL,ANONYMOUS_VIEW1.c1)], [column_conv(INT,PS:(11,0),NULL,ANONYMOUS_VIEW1.c2)], [column_conv(INT,PS:(11,
      0),NULL,ANONYMOUS_VIEW1.c3)])
  1 - output([ANONYMOUS_VIEW1.c1], [ANONYMOUS_VIEW1.c2], [ANONYMOUS_VIEW1.c3]), filter(nil), rowset=16
  2 - output([ANONYMOUS_VIEW1.c1], [ANONYMOUS_VIEW1.c2], [ANONYMOUS_VIEW1.c3]), filter(nil), rowset=16
      dop=10
  3 - output([ANONYMOUS_VIEW1.c1], [ANONYMOUS_VIEW1.c2], [ANONYMOUS_VIEW1.c3]), filter(nil), rowset=16
      access([ANONYMOUS_VIEW1.c1], [ANONYMOUS_VIEW1.c2], [ANONYMOUS_VIEW1.c3])
  4 - output([temp_p.c1], [temp_p.c2], [temp_p.c3]), filter(nil), rowset=16
  5 - output([temp_p.c1], [temp_p.c2], [temp_p.c3]), filter([temp_p.c2 >= 5]), rowset=16
      access([temp_p.c1], [temp_p.c2], [temp_p.c3]), partitions(p[0-3])
      is_index_back=false, is_global_index=false, filter_before_indexback[false], 
      range_key([temp_p.__pk_increment]), range(MIN ; MAX)always true
replace /*+use_px,parallel(10)*/ into s select * from temp_p where temp_p.c2 >= 5;
select * from s order by c1;
+----+------+------+
| c1 | c2   | c3   |
+----+------+------+
|  5 |    5 | NULL |
|  6 |    6 | NULL |
|  7 |    7 | NULL |
|  8 |    8 | NULL |
|  9 |    9 | NULL |
| 10 |   10 | NULL |
+----+------+------+
delete from s;

explain basic replace /*+no_use_px,parallel(10)*/ into s select temp_p.c1,temp_p.c2,temp_s.c3 from temp_p,temp_s where temp_p.c1 = temp_s.c1;
Query Plan
=============================================================
|ID|OPERATOR                                |NAME           |
-------------------------------------------------------------
|0 |REPLACE                                 |               |
|1 |└─PX COORDINATOR                        |               |
|2 |  └─EXCHANGE OUT DISTR                  |:EX10001       |
|3 |    └─SUBPLAN SCAN                      |ANONYMOUS_VIEW1|
|4 |      └─SHARED HASH JOIN                |               |
|5 |        ├─EXCHANGE IN DISTR             |               |
|6 |        │ └─EXCHANGE OUT DISTR (BC2HOST)|:EX10000       |
|7 |        │   └─PX BLOCK ITERATOR         |               |
|8 |        │     └─TABLE FULL SCAN         |temp_p         |
|9 |        └─PX BLOCK ITERATOR             |               |
|10|          └─TABLE FULL SCAN             |temp_s         |
=============================================================
Outputs & filters:
-------------------------------------
  0 - output(nil), filter(nil)
      columns([{s: ({s: (s.c1, s.c2, s.c3)})}]), partitions(p0), 
      column_values([column_conv(INT,PS:(11,0),NOT NULL,ANONYMOUS_VIEW1.c1)], [column_conv(INT,PS:(11,0),NULL,ANONYMOUS_VIEW1.c2)], [column_conv(INT,PS:(11,
      0),NULL,ANONYMOUS_VIEW1.c3)])
  1 - output([ANONYMOUS_VIEW1.c1], [ANONYMOUS_VIEW1.c2], [ANONYMOUS_VIEW1.c3]), filter(nil), rowset=16
  2 - output([ANONYMOUS_VIEW1.c1], [ANONYMOUS_VIEW1.c2], [ANONYMOUS_VIEW1.c3]), filter(nil), rowset=16
      dop=10
  3 - output([ANONYMOUS_VIEW1.c1], [ANONYMOUS_VIEW1.c2], [ANONYMOUS_VIEW1.c3]), filter(nil), rowset=16
      access([ANONYMOUS_VIEW1.c1], [ANONYMOUS_VIEW1.c2], [ANONYMOUS_VIEW1.c3])
  4 - output([temp_p.c1], [temp_p.c2], [temp_s.c3]), filter(nil), rowset=16
      equal_conds([temp_p.c1 = temp_s.c1]), other_conds(nil)
  5 - output([temp_p.c1], [temp_p.c2]), filter(nil), rowset=16
  6 - output([temp_p.c1], [temp_p.c2]), filter(nil), rowset=16
      dop=10
  7 - output([temp_p.c1], [temp_p.c2]), filter(nil), rowset=16
  8 - output([temp_p.c1], [temp_p.c2]), filter(nil), rowset=16
      access([temp_p.c1], [temp_p.c2]), partitions(p[0-3])
      is_index_back=false, is_global_index=false, 
      range_key([temp_p.__pk_increment]), range(MIN ; MAX)always true
  9 - output([temp_s.c1], [temp_s.c3]), filter(nil), rowset=16
 10 - output([temp_s.c1], [temp_s.c3]), filter(nil), rowset=16
      access([temp_s.c1], [temp_s.c3]), partitions(p0)
      is_index_back=false, is_global_index=false, 
      range_key([temp_s.__pk_increment]), range(MIN ; MAX)always true
explain basic replace /*+use_px,parallel(10)*/ into s select temp_p.c1,temp_p.c2,temp_s.c3 from temp_p,temp_s where temp_p.c1 = temp_s.c1;
Query Plan
=============================================================
|ID|OPERATOR                                |NAME           |
-------------------------------------------------------------
|0 |REPLACE                                 |               |
|1 |└─PX COORDINATOR                        |               |
|2 |  └─EXCHANGE OUT DISTR                  |:EX10001       |
|3 |    └─SUBPLAN SCAN                      |ANONYMOUS_VIEW1|
|4 |      └─SHARED HASH JOIN                |               |
|5 |        ├─EXCHANGE IN DISTR             |               |
|6 |        │ └─EXCHANGE OUT DISTR (BC2HOST)|:EX10000       |
|7 |        │   └─PX BLOCK ITERATOR         |               |
|8 |        │     └─TABLE FULL SCAN         |temp_p         |
|9 |        └─PX BLOCK ITERATOR             |               |
|10|          └─TABLE FULL SCAN             |temp_s         |
=============================================================
Outputs & filters:
-------------------------------------
  0 - output(nil), filter(nil)
      columns([{s: ({s: (s.c1, s.c2, s.c3)})}]), partitions(p0), 
      column_values([column_conv(INT,PS:(11,0),NOT NULL,ANONYMOUS_VIEW1.c1)], [column_conv(INT,PS:(11,0),NULL,ANONYMOUS_VIEW1.c2)], [column_conv(INT,PS:(11,
      0),NULL,ANONYMOUS_VIEW1.c3)])
  1 - output([ANONYMOUS_VIEW1.c1], [ANONYMOUS_VIEW1.c2], [ANONYMOUS_VIEW1.c3]), filter(nil), rowset=16
  2 - output([ANONYMOUS_VIEW1.c1], [ANONYMOUS_VIEW1.c2], [ANONYMOUS_VIEW1.c3]), filter(nil), rowset=16
      dop=10
  3 - output([ANONYMOUS_VIEW1.c1], [ANONYMOUS_VIEW1.c2], [ANONYMOUS_VIEW1.c3]), filter(nil), rowset=16
      access([ANONYMOUS_VIEW1.c1], [ANONYMOUS_VIEW1.c2], [ANONYMOUS_VIEW1.c3])
  4 - output([temp_p.c1], [temp_p.c2], [temp_s.c3]), filter(nil), rowset=16
      equal_conds([temp_p.c1 = temp_s.c1]), other_conds(nil)
  5 - output([temp_p.c1], [temp_p.c2]), filter(nil), rowset=16
  6 - output([temp_p.c1], [temp_p.c2]), filter(nil), rowset=16
      dop=10
  7 - output([temp_p.c1], [temp_p.c2]), filter(nil), rowset=16
  8 - output([temp_p.c1], [temp_p.c2]), filter(nil), rowset=16
      access([temp_p.c1], [temp_p.c2]), partitions(p[0-3])
      is_index_back=false, is_global_index=false, 
      range_key([temp_p.__pk_increment]), range(MIN ; MAX)always true
  9 - output([temp_s.c1], [temp_s.c3]), filter(nil), rowset=16
 10 - output([temp_s.c1], [temp_s.c3]), filter(nil), rowset=16
      access([temp_s.c1], [temp_s.c3]), partitions(p0)
      is_index_back=false, is_global_index=false, 
      range_key([temp_s.__pk_increment]), range(MIN ; MAX)always true
replace /*+use_px,parallel(10)*/ into s select temp_p.c1,temp_p.c2,temp_s.c3 from temp_p,temp_s where temp_p.c1 = temp_s.c1;
select * from s order by c1;
+----+------+------+
| c1 | c2   | c3   |
+----+------+------+
|  1 |    1 |    1 |
|  2 |    2 |    2 |
|  3 |    3 |    3 |
|  4 |    4 |    4 |
|  5 |    5 |    5 |
|  6 |    6 |    6 |
|  7 |    7 |    7 |
|  8 |    8 |    8 |
|  9 |    9 |    9 |
| 10 |   10 |   10 |
+----+------+------+
delete from s;

explain basic replace /*+no_use_px,parallel(10)*/ into p select * from temp_s;
Query Plan
==============================================
|ID|OPERATOR                 |NAME           |
----------------------------------------------
|0 |DISTRIBUTED REPLACE      |               |
|1 |└─PX COORDINATOR         |               |
|2 |  └─EXCHANGE OUT DISTR   |:EX10000       |
|3 |    └─SUBPLAN SCAN       |ANONYMOUS_VIEW1|
|4 |      └─PX BLOCK ITERATOR|               |
|5 |        └─TABLE FULL SCAN|temp_s         |
==============================================
Outputs & filters:
-------------------------------------
  0 - output(nil), filter(nil)
      columns([{p: ({p: (p.c1, p.c2, p.c3)})}]), partitions(p[0-3]), 
      column_values([column_conv(INT,PS:(11,0),NOT NULL,ANONYMOUS_VIEW1.c1)], [column_conv(INT,PS:(11,0),NULL,ANONYMOUS_VIEW1.c2)], [column_conv(INT,PS:(11,
      0),NULL,ANONYMOUS_VIEW1.c3)])
  1 - output([ANONYMOUS_VIEW1.c1], [ANONYMOUS_VIEW1.c2], [ANONYMOUS_VIEW1.c3]), filter(nil), rowset=16
  2 - output([ANONYMOUS_VIEW1.c1], [ANONYMOUS_VIEW1.c2], [ANONYMOUS_VIEW1.c3]), filter(nil), rowset=16
      dop=10
  3 - output([ANONYMOUS_VIEW1.c1], [ANONYMOUS_VIEW1.c2], [ANONYMOUS_VIEW1.c3]), filter(nil), rowset=16
      access([ANONYMOUS_VIEW1.c1], [ANONYMOUS_VIEW1.c2], [ANONYMOUS_VIEW1.c3])
  4 - output([temp_s.c1], [temp_s.c2], [temp_s.c3]), filter(nil), rowset=16
  5 - output([temp_s.c1], [temp_s.c2], [temp_s.c3]), filter(nil), rowset=16
      access([temp_s.c1], [temp_s.c2], [temp_s.c3]), partitions(p0)
      is_index_back=false, is_global_index=false, 
      range_key([temp_s.__pk_increment]), range(MIN ; MAX)always true
explain basic replace /*+use_px,parallel(10)*/ into p select * from temp_s;
Query Plan
==============================================
|ID|OPERATOR                 |NAME           |
----------------------------------------------
|0 |DISTRIBUTED REPLACE      |               |
|1 |└─PX COORDINATOR         |               |
|2 |  └─EXCHANGE OUT DISTR   |:EX10000       |
|3 |    └─SUBPLAN SCAN       |ANONYMOUS_VIEW1|
|4 |      └─PX BLOCK ITERATOR|               |
|5 |        └─TABLE FULL SCAN|temp_s         |
==============================================
Outputs & filters:
-------------------------------------
  0 - output(nil), filter(nil)
      columns([{p: ({p: (p.c1, p.c2, p.c3)})}]), partitions(p[0-3]), 
      column_values([column_conv(INT,PS:(11,0),NOT NULL,ANONYMOUS_VIEW1.c1)], [column_conv(INT,PS:(11,0),NULL,ANONYMOUS_VIEW1.c2)], [column_conv(INT,PS:(11,
      0),NULL,ANONYMOUS_VIEW1.c3)])
  1 - output([ANONYMOUS_VIEW1.c1], [ANONYMOUS_VIEW1.c2], [ANONYMOUS_VIEW1.c3]), filter(nil), rowset=16
  2 - output([ANONYMOUS_VIEW1.c1], [ANONYMOUS_VIEW1.c2], [ANONYMOUS_VIEW1.c3]), filter(nil), rowset=16
      dop=10
  3 - output([ANONYMOUS_VIEW1.c1], [ANONYMOUS_VIEW1.c2], [ANONYMOUS_VIEW1.c3]), filter(nil), rowset=16
      access([ANONYMOUS_VIEW1.c1], [ANONYMOUS_VIEW1.c2], [ANONYMOUS_VIEW1.c3])
  4 - output([temp_s.c1], [temp_s.c2], [temp_s.c3]), filter(nil), rowset=16
  5 - output([temp_s.c1], [temp_s.c2], [temp_s.c3]), filter(nil), rowset=16
      access([temp_s.c1], [temp_s.c2], [temp_s.c3]), partitions(p0)
      is_index_back=false, is_global_index=false, 
      range_key([temp_s.__pk_increment]), range(MIN ; MAX)always true
replace /*+use_px,parallel(10)*/ into p select * from temp_s;
select * from p order by c1;
+----+------+------+
| c1 | c2   | c3   |
+----+------+------+
|  1 | NULL |    1 |
|  2 | NULL |    2 |
|  3 | NULL |    3 |
|  4 | NULL |    4 |
|  5 | NULL |    5 |
|  6 | NULL |    6 |
|  7 | NULL |    7 |
|  8 | NULL |    8 |
|  9 | NULL |    9 |
| 10 | NULL |   10 |
+----+------+------+
delete from p;

explain basic replace /*+no_use_px,parallel(10)*/ into p select * from temp_p;
Query Plan
==============================================
|ID|OPERATOR                 |NAME           |
----------------------------------------------
|0 |PX COORDINATOR           |               |
|1 |└─EXCHANGE OUT DISTR     |:EX10000       |
|2 |  └─PX PARTITION ITERATOR|               |
|3 |    └─REPLACE            |               |
|4 |      └─SUBPLAN SCAN     |ANONYMOUS_VIEW1|
|5 |        └─TABLE FULL SCAN|temp_p         |
==============================================
Outputs & filters:
-------------------------------------
  0 - output(nil), filter(nil), rowset=16
  1 - output(nil), filter(nil), rowset=16
      dop=10
  2 - output(nil), filter(nil), rowset=16
      partition wise, force partition granule
  3 - output(nil), filter(nil)
      columns([{p: ({p: (p.c1, p.c2, p.c3)})}]), partitions(p[0-3]), 
      column_values([column_conv(INT,PS:(11,0),NOT NULL,ANONYMOUS_VIEW1.c1)], [column_conv(INT,PS:(11,0),NULL,ANONYMOUS_VIEW1.c2)], [column_conv(INT,PS:(11,
      0),NULL,ANONYMOUS_VIEW1.c3)])
  4 - output([ANONYMOUS_VIEW1.c1], [ANONYMOUS_VIEW1.c2], [ANONYMOUS_VIEW1.c3]), filter(nil), rowset=16
      access([ANONYMOUS_VIEW1.c1], [ANONYMOUS_VIEW1.c2], [ANONYMOUS_VIEW1.c3])
  5 - output([temp_p.c1], [temp_p.c2], [temp_p.c3]), filter(nil), rowset=16
      access([temp_p.c1], [temp_p.c2], [temp_p.c3]), partitions(p[0-3])
      is_index_back=false, is_global_index=false, 
      range_key([temp_p.__pk_increment]), range(MIN ; MAX)always true
explain basic replace /*+use_px,parallel(10)*/ into p select * from temp_p;
Query Plan
==============================================
|ID|OPERATOR                 |NAME           |
----------------------------------------------
|0 |PX COORDINATOR           |               |
|1 |└─EXCHANGE OUT DISTR     |:EX10000       |
|2 |  └─PX PARTITION ITERATOR|               |
|3 |    └─REPLACE            |               |
|4 |      └─SUBPLAN SCAN     |ANONYMOUS_VIEW1|
|5 |        └─TABLE FULL SCAN|temp_p         |
==============================================
Outputs & filters:
-------------------------------------
  0 - output(nil), filter(nil), rowset=16
  1 - output(nil), filter(nil), rowset=16
      dop=10
  2 - output(nil), filter(nil), rowset=16
      partition wise, force partition granule
  3 - output(nil), filter(nil)
      columns([{p: ({p: (p.c1, p.c2, p.c3)})}]), partitions(p[0-3]), 
      column_values([column_conv(INT,PS:(11,0),NOT NULL,ANONYMOUS_VIEW1.c1)], [column_conv(INT,PS:(11,0),NULL,ANONYMOUS_VIEW1.c2)], [column_conv(INT,PS:(11,
      0),NULL,ANONYMOUS_VIEW1.c3)])
  4 - output([ANONYMOUS_VIEW1.c1], [ANONYMOUS_VIEW1.c2], [ANONYMOUS_VIEW1.c3]), filter(nil), rowset=16
      access([ANONYMOUS_VIEW1.c1], [ANONYMOUS_VIEW1.c2], [ANONYMOUS_VIEW1.c3])
  5 - output([temp_p.c1], [temp_p.c2], [temp_p.c3]), filter(nil), rowset=16
      access([temp_p.c1], [temp_p.c2], [temp_p.c3]), partitions(p[0-3])
      is_index_back=false, is_global_index=false, 
      range_key([temp_p.__pk_increment]), range(MIN ; MAX)always true
replace /*+use_px,parallel(10)*/ into p select * from temp_p;
select * from p order by c1;
+----+------+------+
| c1 | c2   | c3   |
+----+------+------+
|  1 |    1 | NULL |
|  2 |    2 | NULL |
|  3 |    3 | NULL |
|  4 |    4 | NULL |
|  5 |    5 | NULL |
|  6 |    6 | NULL |
|  7 |    7 | NULL |
|  8 |    8 | NULL |
|  9 |    9 | NULL |
| 10 |   10 | NULL |
+----+------+------+
delete from temp_p;
insert into temp_p(c1,c3) values(1,1),(2,2),(3,3),(4,4),(5,5),(6,6),(7,7),(8,8),(9,9),(10,10);
replace /*+use_px,parallel(10)*/ into p select * from temp_p;
select * from p order by c1;
+----+------+------+
| c1 | c2   | c3   |
+----+------+------+
|  1 | NULL |    1 |
|  2 | NULL |    2 |
|  3 | NULL |    3 |
|  4 | NULL |    4 |
|  5 | NULL |    5 |
|  6 | NULL |    6 |
|  7 | NULL |    7 |
|  8 | NULL |    8 |
|  9 | NULL |    9 |
| 10 | NULL |   10 |
+----+------+------+
delete from temp_p;
insert into temp_p(c1,c2) values(1,1),(2,2),(3,3),(4,4),(5,5),(6,6),(7,7),(8,8),(9,9),(10,10);

explain basic replace /*+no_use_px, parallel(10)*/ into p select temp_p.c1,temp_p.c2,temp_p.c3 from temp_p,temp_p5 where temp_p.c1 = temp_p5.c1;
Query Plan
=============================================================
|ID|OPERATOR                                |NAME           |
-------------------------------------------------------------
|0 |DISTRIBUTED REPLACE                     |               |
|1 |└─PX COORDINATOR                        |               |
|2 |  └─EXCHANGE OUT DISTR                  |:EX10001       |
|3 |    └─SUBPLAN SCAN                      |ANONYMOUS_VIEW1|
|4 |      └─SHARED HASH JOIN                |               |
|5 |        ├─EXCHANGE IN DISTR             |               |
|6 |        │ └─EXCHANGE OUT DISTR (BC2HOST)|:EX10000       |
|7 |        │   └─PX BLOCK ITERATOR         |               |
|8 |        │     └─TABLE FULL SCAN         |temp_p         |
|9 |        └─PX BLOCK ITERATOR             |               |
|10|          └─TABLE FULL SCAN             |temp_p5        |
=============================================================
Outputs & filters:
-------------------------------------
  0 - output(nil), filter(nil)
      columns([{p: ({p: (p.c1, p.c2, p.c3)})}]), partitions(p[0-3]), 
      column_values([column_conv(INT,PS:(11,0),NOT NULL,ANONYMOUS_VIEW1.c1)], [column_conv(INT,PS:(11,0),NULL,ANONYMOUS_VIEW1.c2)], [column_conv(INT,PS:(11,
      0),NULL,ANONYMOUS_VIEW1.c3)])
  1 - output([ANONYMOUS_VIEW1.c1], [ANONYMOUS_VIEW1.c2], [ANONYMOUS_VIEW1.c3]), filter(nil), rowset=16
  2 - output([ANONYMOUS_VIEW1.c1], [ANONYMOUS_VIEW1.c2], [ANONYMOUS_VIEW1.c3]), filter(nil), rowset=16
      dop=10
  3 - output([ANONYMOUS_VIEW1.c1], [ANONYMOUS_VIEW1.c2], [ANONYMOUS_VIEW1.c3]), filter(nil), rowset=16
      access([ANONYMOUS_VIEW1.c1], [ANONYMOUS_VIEW1.c2], [ANONYMOUS_VIEW1.c3])
  4 - output([temp_p.c1], [temp_p.c2], [temp_p.c3]), filter(nil), rowset=16
      equal_conds([temp_p.c1 = temp_p5.c1]), other_conds(nil)
  5 - output([temp_p.c1], [temp_p.c2], [temp_p.c3]), filter(nil), rowset=16
  6 - output([temp_p.c1], [temp_p.c2], [temp_p.c3]), filter(nil), rowset=16
      dop=10
  7 - output([temp_p.c1], [temp_p.c2], [temp_p.c3]), filter(nil), rowset=16
  8 - output([temp_p.c1], [temp_p.c2], [temp_p.c3]), filter(nil), rowset=16
      access([temp_p.c1], [temp_p.c2], [temp_p.c3]), partitions(p[0-3])
      is_index_back=false, is_global_index=false, 
      range_key([temp_p.__pk_increment]), range(MIN ; MAX)always true
  9 - output([temp_p5.c1]), filter(nil), rowset=16
 10 - output([temp_p5.c1]), filter(nil), rowset=16
      access([temp_p5.c1]), partitions(p[0-4])
      is_index_back=false, is_global_index=false, 
      range_key([temp_p5.__pk_increment]), range(MIN ; MAX)always true
explain basic replace /*+use_px, parallel(10)*/ into p select temp_p.c1,temp_p.c2,temp_p.c3 from temp_p,temp_p5 where temp_p.c1 = temp_p5.c1;
Query Plan
=============================================================
|ID|OPERATOR                                |NAME           |
-------------------------------------------------------------
|0 |DISTRIBUTED REPLACE                     |               |
|1 |└─PX COORDINATOR                        |               |
|2 |  └─EXCHANGE OUT DISTR                  |:EX10001       |
|3 |    └─SUBPLAN SCAN                      |ANONYMOUS_VIEW1|
|4 |      └─SHARED HASH JOIN                |               |
|5 |        ├─EXCHANGE IN DISTR             |               |
|6 |        │ └─EXCHANGE OUT DISTR (BC2HOST)|:EX10000       |
|7 |        │   └─PX BLOCK ITERATOR         |               |
|8 |        │     └─TABLE FULL SCAN         |temp_p         |
|9 |        └─PX BLOCK ITERATOR             |               |
|10|          └─TABLE FULL SCAN             |temp_p5        |
=============================================================
Outputs & filters:
-------------------------------------
  0 - output(nil), filter(nil)
      columns([{p: ({p: (p.c1, p.c2, p.c3)})}]), partitions(p[0-3]), 
      column_values([column_conv(INT,PS:(11,0),NOT NULL,ANONYMOUS_VIEW1.c1)], [column_conv(INT,PS:(11,0),NULL,ANONYMOUS_VIEW1.c2)], [column_conv(INT,PS:(11,
      0),NULL,ANONYMOUS_VIEW1.c3)])
  1 - output([ANONYMOUS_VIEW1.c1], [ANONYMOUS_VIEW1.c2], [ANONYMOUS_VIEW1.c3]), filter(nil), rowset=16
  2 - output([ANONYMOUS_VIEW1.c1], [ANONYMOUS_VIEW1.c2], [ANONYMOUS_VIEW1.c3]), filter(nil), rowset=16
      dop=10
  3 - output([ANONYMOUS_VIEW1.c1], [ANONYMOUS_VIEW1.c2], [ANONYMOUS_VIEW1.c3]), filter(nil), rowset=16
      access([ANONYMOUS_VIEW1.c1], [ANONYMOUS_VIEW1.c2], [ANONYMOUS_VIEW1.c3])
  4 - output([temp_p.c1], [temp_p.c2], [temp_p.c3]), filter(nil), rowset=16
      equal_conds([temp_p.c1 = temp_p5.c1]), other_conds(nil)
  5 - output([temp_p.c1], [temp_p.c2], [temp_p.c3]), filter(nil), rowset=16
  6 - output([temp_p.c1], [temp_p.c2], [temp_p.c3]), filter(nil), rowset=16
      dop=10
  7 - output([temp_p.c1], [temp_p.c2], [temp_p.c3]), filter(nil), rowset=16
  8 - output([temp_p.c1], [temp_p.c2], [temp_p.c3]), filter(nil), rowset=16
      access([temp_p.c1], [temp_p.c2], [temp_p.c3]), partitions(p[0-3])
      is_index_back=false, is_global_index=false, 
      range_key([temp_p.__pk_increment]), range(MIN ; MAX)always true
  9 - output([temp_p5.c1]), filter(nil), rowset=16
 10 - output([temp_p5.c1]), filter(nil), rowset=16
      access([temp_p5.c1]), partitions(p[0-4])
      is_index_back=false, is_global_index=false, 
      range_key([temp_p5.__pk_increment]), range(MIN ; MAX)always true
replace /*+use_px, parallel(10)*/ into p select temp_p.c1,temp_p.c2,temp_p.c3 from temp_p,temp_p5 where temp_p.c1 = temp_p5.c1;
select * from p order by c1;
+----+------+------+
| c1 | c2   | c3   |
+----+------+------+
|  1 |    1 | NULL |
|  2 |    2 | NULL |
|  3 |    3 | NULL |
|  4 |    4 | NULL |
|  5 |    5 | NULL |
|  6 |    6 | NULL |
|  7 |    7 | NULL |
|  8 |    8 | NULL |
|  9 |    9 | NULL |
| 10 |   10 | NULL |
+----+------+------+
delete from p;

explain basic replace /*+use_px, parallel(10)*/ into p select temp_p.c1,temp_p.c2,temp_p.c3 from temp_p,temp_p5 where temp_p.c1 = temp_p5.c1 and temp_p.c1 = 3;
Query Plan
===============================================================
|ID|OPERATOR                                  |NAME           |
---------------------------------------------------------------
|0 |REPLACE                                   |               |
|1 |└─PX COORDINATOR                          |               |
|2 |  └─EXCHANGE OUT DISTR                    |:EX10001       |
|3 |    └─SUBPLAN SCAN                        |ANONYMOUS_VIEW1|
|4 |      └─NESTED-LOOP JOIN CARTESIAN        |               |
|5 |        ├─EXCHANGE IN DISTR               |               |
|6 |        │ └─EXCHANGE OUT DISTR (BROADCAST)|:EX10000       |
|7 |        │   └─PX BLOCK ITERATOR           |               |
|8 |        │     └─TABLE FULL SCAN           |temp_p5        |
|9 |        └─MATERIAL                        |               |
|10|          └─PX BLOCK ITERATOR             |               |
|11|            └─TABLE FULL SCAN             |temp_p         |
===============================================================
Outputs & filters:
-------------------------------------
  0 - output(nil), filter(nil)
      columns([{p: ({p: (p.c1, p.c2, p.c3)})}]), partitions(p3), 
      column_values([column_conv(INT,PS:(11,0),NOT NULL,ANONYMOUS_VIEW1.c1)], [column_conv(INT,PS:(11,0),NULL,ANONYMOUS_VIEW1.c2)], [column_conv(INT,PS:(11,
      0),NULL,ANONYMOUS_VIEW1.c3)])
  1 - output([ANONYMOUS_VIEW1.c1], [ANONYMOUS_VIEW1.c2], [ANONYMOUS_VIEW1.c3]), filter(nil), rowset=16
  2 - output([ANONYMOUS_VIEW1.c1], [ANONYMOUS_VIEW1.c2], [ANONYMOUS_VIEW1.c3]), filter(nil), rowset=16
      dop=10
  3 - output([ANONYMOUS_VIEW1.c1], [ANONYMOUS_VIEW1.c2], [ANONYMOUS_VIEW1.c3]), filter(nil), rowset=16
      access([ANONYMOUS_VIEW1.c1], [ANONYMOUS_VIEW1.c2], [ANONYMOUS_VIEW1.c3])
  4 - output([temp_p.c1], [temp_p.c2], [temp_p.c3]), filter(nil), rowset=16
      conds(nil), nl_params_(nil), use_batch=false
  5 - output(nil), filter(nil), rowset=16
  6 - output(nil), filter(nil), rowset=16
      dop=10
  7 - output(nil), filter(nil), rowset=16
  8 - output(nil), filter([3 = temp_p5.c1]), rowset=16
      access([temp_p5.c1]), partitions(p3)
      is_index_back=false, is_global_index=false, filter_before_indexback[false], 
      range_key([temp_p5.__pk_increment]), range(MIN ; MAX)always true
  9 - output([temp_p.c1], [temp_p.c2], [temp_p.c3]), filter(nil), rowset=16
 10 - output([temp_p.c1], [temp_p.c2], [temp_p.c3]), filter(nil), rowset=16
 11 - output([temp_p.c1], [temp_p.c2], [temp_p.c3]), filter([temp_p.c1 = 3]), rowset=16
      access([temp_p.c1], [temp_p.c2], [temp_p.c3]), partitions(p3)
      is_index_back=false, is_global_index=false, filter_before_indexback[false], 
      range_key([temp_p.__pk_increment]), range(MIN ; MAX)always true
replace /*+use_px, parallel(10)*/ into p select temp_p.c1,temp_p.c2,temp_p.c3 from temp_p,temp_p5 where temp_p.c1 = temp_p5.c1 and temp_p.c1 = 3;
select * from p order by c1;
+----+------+------+
| c1 | c2   | c3   |
+----+------+------+
|  3 |    3 | NULL |
+----+------+------+
delete from p;

explain basic replace /*+use_px, parallel(10)*/ into p select  temp_p.c1, temp_p.c2, temp_p.c3 from temp_p, temp_p4 where temp_p.c1 = temp_p4.c1;
Query Plan
==================================================================
|ID|OPERATOR                                     |NAME           |
------------------------------------------------------------------
|0 |DISTRIBUTED REPLACE                          |               |
|1 |└─PX COORDINATOR                             |               |
|2 |  └─EXCHANGE OUT DISTR                       |:EX10002       |
|3 |    └─SUBPLAN SCAN                           |ANONYMOUS_VIEW1|
|4 |      └─MERGE JOIN                           |               |
|5 |        ├─SORT                               |               |
|6 |        │ └─EXCHANGE IN DISTR                |               |
|7 |        │   └─EXCHANGE OUT DISTR (HASH LOCAL)|:EX10000       |
|8 |        │     └─PX BLOCK ITERATOR            |               |
|9 |        │       └─TABLE FULL SCAN            |temp_p4        |
|10|        └─SORT                               |               |
|11|          └─EXCHANGE IN DISTR                |               |
|12|            └─EXCHANGE OUT DISTR (HASH LOCAL)|:EX10001       |
|13|              └─PX BLOCK ITERATOR            |               |
|14|                └─TABLE FULL SCAN            |temp_p         |
==================================================================
Outputs & filters:
-------------------------------------
  0 - output(nil), filter(nil)
      columns([{p: ({p: (p.c1, p.c2, p.c3)})}]), partitions(p[0-3]), 
      column_values([column_conv(INT,PS:(11,0),NOT NULL,ANONYMOUS_VIEW1.c1)], [column_conv(INT,PS:(11,0),NULL,ANONYMOUS_VIEW1.c2)], [column_conv(INT,PS:(11,
      0),NULL,ANONYMOUS_VIEW1.c3)])
  1 - output([ANONYMOUS_VIEW1.c1], [ANONYMOUS_VIEW1.c2], [ANONYMOUS_VIEW1.c3]), filter(nil), rowset=16
  2 - output([ANONYMOUS_VIEW1.c1], [ANONYMOUS_VIEW1.c2], [ANONYMOUS_VIEW1.c3]), filter(nil), rowset=16
      dop=10
  3 - output([ANONYMOUS_VIEW1.c1], [ANONYMOUS_VIEW1.c2], [ANONYMOUS_VIEW1.c3]), filter(nil), rowset=16
      access([ANONYMOUS_VIEW1.c1], [ANONYMOUS_VIEW1.c2], [ANONYMOUS_VIEW1.c3])
  4 - output([temp_p.c1], [temp_p.c2], [temp_p.c3]), filter(nil), rowset=16
      equal_conds([temp_p.c1 = temp_p4.c1]), other_conds(nil)
      merge_directions([ASC])
  5 - output([temp_p4.c1]), filter(nil), rowset=16
      sort_keys([temp_p4.c1, ASC])
  6 - output([temp_p4.c1]), filter(nil), rowset=16
  7 - output([temp_p4.c1]), filter(nil), rowset=16
      (#keys=1, [temp_p4.c1]), dop=10
  8 - output([temp_p4.c1]), filter(nil), rowset=16
  9 - output([temp_p4.c1]), filter(nil), rowset=16
      access([temp_p4.c1]), partitions(p[0-3])
      is_index_back=false, is_global_index=false, 
      range_key([temp_p4.__pk_increment]), range(MIN ; MAX)always true
 10 - output([temp_p.c1], [temp_p.c2], [temp_p.c3]), filter(nil), rowset=16
      sort_keys([temp_p.c1, ASC])
 11 - output([temp_p.c1], [temp_p.c2], [temp_p.c3]), filter(nil), rowset=16
 12 - output([temp_p.c1], [temp_p.c2], [temp_p.c3]), filter(nil), rowset=16
      (#keys=1, [temp_p.c1]), dop=10
 13 - output([temp_p.c1], [temp_p.c2], [temp_p.c3]), filter(nil), rowset=16
 14 - output([temp_p.c1], [temp_p.c2], [temp_p.c3]), filter(nil), rowset=16
      access([temp_p.c1], [temp_p.c2], [temp_p.c3]), partitions(p[0-3])
      is_index_back=false, is_global_index=false, 
      range_key([temp_p.__pk_increment]), range(MIN ; MAX)always true
replace /*+use_px, parallel(10)*/ into p select  temp_p.c1, temp_p.c2, temp_p.c3 from temp_p, temp_p4 where temp_p.c1 = temp_p4.c1;
select * from p order by c1;
+----+------+------+
| c1 | c2   | c3   |
+----+------+------+
|  1 |    1 | NULL |
|  2 |    2 | NULL |
|  3 |    3 | NULL |
|  4 |    4 | NULL |
|  5 |    5 | NULL |
|  6 |    6 | NULL |
|  7 |    7 | NULL |
|  8 |    8 | NULL |
|  9 |    9 | NULL |
| 10 |   10 | NULL |
+----+------+------+
delete from p;

explain basic replace /*+no_use_px,parallel(10)*/ into p select temp_p.c1,temp_p.c2,temp_s.c3 from temp_p,temp_s where temp_p.c1 = temp_s.c1;
Query Plan
=============================================================
|ID|OPERATOR                                |NAME           |
-------------------------------------------------------------
|0 |DISTRIBUTED REPLACE                     |               |
|1 |└─PX COORDINATOR                        |               |
|2 |  └─EXCHANGE OUT DISTR                  |:EX10001       |
|3 |    └─SUBPLAN SCAN                      |ANONYMOUS_VIEW1|
|4 |      └─SHARED HASH JOIN                |               |
|5 |        ├─EXCHANGE IN DISTR             |               |
|6 |        │ └─EXCHANGE OUT DISTR (BC2HOST)|:EX10000       |
|7 |        │   └─PX BLOCK ITERATOR         |               |
|8 |        │     └─TABLE FULL SCAN         |temp_p         |
|9 |        └─PX BLOCK ITERATOR             |               |
|10|          └─TABLE FULL SCAN             |temp_s         |
=============================================================
Outputs & filters:
-------------------------------------
  0 - output(nil), filter(nil)
      columns([{p: ({p: (p.c1, p.c2, p.c3)})}]), partitions(p[0-3]), 
      column_values([column_conv(INT,PS:(11,0),NOT NULL,ANONYMOUS_VIEW1.c1)], [column_conv(INT,PS:(11,0),NULL,ANONYMOUS_VIEW1.c2)], [column_conv(INT,PS:(11,
      0),NULL,ANONYMOUS_VIEW1.c3)])
  1 - output([ANONYMOUS_VIEW1.c1], [ANONYMOUS_VIEW1.c2], [ANONYMOUS_VIEW1.c3]), filter(nil), rowset=16
  2 - output([ANONYMOUS_VIEW1.c1], [ANONYMOUS_VIEW1.c2], [ANONYMOUS_VIEW1.c3]), filter(nil), rowset=16
      dop=10
  3 - output([ANONYMOUS_VIEW1.c1], [ANONYMOUS_VIEW1.c2], [ANONYMOUS_VIEW1.c3]), filter(nil), rowset=16
      access([ANONYMOUS_VIEW1.c1], [ANONYMOUS_VIEW1.c2], [ANONYMOUS_VIEW1.c3])
  4 - output([temp_p.c1], [temp_p.c2], [temp_s.c3]), filter(nil), rowset=16
      equal_conds([temp_p.c1 = temp_s.c1]), other_conds(nil)
  5 - output([temp_p.c1], [temp_p.c2]), filter(nil), rowset=16
  6 - output([temp_p.c1], [temp_p.c2]), filter(nil), rowset=16
      dop=10
  7 - output([temp_p.c1], [temp_p.c2]), filter(nil), rowset=16
  8 - output([temp_p.c1], [temp_p.c2]), filter(nil), rowset=16
      access([temp_p.c1], [temp_p.c2]), partitions(p[0-3])
      is_index_back=false, is_global_index=false, 
      range_key([temp_p.__pk_increment]), range(MIN ; MAX)always true
  9 - output([temp_s.c1], [temp_s.c3]), filter(nil), rowset=16
 10 - output([temp_s.c1], [temp_s.c3]), filter(nil), rowset=16
      access([temp_s.c1], [temp_s.c3]), partitions(p0)
      is_index_back=false, is_global_index=false, 
      range_key([temp_s.__pk_increment]), range(MIN ; MAX)always true
explain basic replace /*+use_px,parallel(10)*/ into p select temp_p.c1,temp_p.c2,temp_s.c3 from temp_p,temp_s where temp_p.c1 = temp_s.c1;
Query Plan
=============================================================
|ID|OPERATOR                                |NAME           |
-------------------------------------------------------------
|0 |DISTRIBUTED REPLACE                     |               |
|1 |└─PX COORDINATOR                        |               |
|2 |  └─EXCHANGE OUT DISTR                  |:EX10001       |
|3 |    └─SUBPLAN SCAN                      |ANONYMOUS_VIEW1|
|4 |      └─SHARED HASH JOIN                |               |
|5 |        ├─EXCHANGE IN DISTR             |               |
|6 |        │ └─EXCHANGE OUT DISTR (BC2HOST)|:EX10000       |
|7 |        │   └─PX BLOCK ITERATOR         |               |
|8 |        │     └─TABLE FULL SCAN         |temp_p         |
|9 |        └─PX BLOCK ITERATOR             |               |
|10|          └─TABLE FULL SCAN             |temp_s         |
=============================================================
Outputs & filters:
-------------------------------------
  0 - output(nil), filter(nil)
      columns([{p: ({p: (p.c1, p.c2, p.c3)})}]), partitions(p[0-3]), 
      column_values([column_conv(INT,PS:(11,0),NOT NULL,ANONYMOUS_VIEW1.c1)], [column_conv(INT,PS:(11,0),NULL,ANONYMOUS_VIEW1.c2)], [column_conv(INT,PS:(11,
      0),NULL,ANONYMOUS_VIEW1.c3)])
  1 - output([ANONYMOUS_VIEW1.c1], [ANONYMOUS_VIEW1.c2], [ANONYMOUS_VIEW1.c3]), filter(nil), rowset=16
  2 - output([ANONYMOUS_VIEW1.c1], [ANONYMOUS_VIEW1.c2], [ANONYMOUS_VIEW1.c3]), filter(nil), rowset=16
      dop=10
  3 - output([ANONYMOUS_VIEW1.c1], [ANONYMOUS_VIEW1.c2], [ANONYMOUS_VIEW1.c3]), filter(nil), rowset=16
      access([ANONYMOUS_VIEW1.c1], [ANONYMOUS_VIEW1.c2], [ANONYMOUS_VIEW1.c3])
  4 - output([temp_p.c1], [temp_p.c2], [temp_s.c3]), filter(nil), rowset=16
      equal_conds([temp_p.c1 = temp_s.c1]), other_conds(nil)
  5 - output([temp_p.c1], [temp_p.c2]), filter(nil), rowset=16
  6 - output([temp_p.c1], [temp_p.c2]), filter(nil), rowset=16
      dop=10
  7 - output([temp_p.c1], [temp_p.c2]), filter(nil), rowset=16
  8 - output([temp_p.c1], [temp_p.c2]), filter(nil), rowset=16
      access([temp_p.c1], [temp_p.c2]), partitions(p[0-3])
      is_index_back=false, is_global_index=false, 
      range_key([temp_p.__pk_increment]), range(MIN ; MAX)always true
  9 - output([temp_s.c1], [temp_s.c3]), filter(nil), rowset=16
 10 - output([temp_s.c1], [temp_s.c3]), filter(nil), rowset=16
      access([temp_s.c1], [temp_s.c3]), partitions(p0)
      is_index_back=false, is_global_index=false, 
      range_key([temp_s.__pk_increment]), range(MIN ; MAX)always true
replace /*+use_px,parallel(10)*/ into p select temp_p.c1,temp_p.c2,temp_s.c3 from temp_p,temp_s where temp_p.c1 = temp_s.c1;
select * from p order by c1;
+----+------+------+
| c1 | c2   | c3   |
+----+------+------+
|  1 |    1 |    1 |
|  2 |    2 |    2 |
|  3 |    3 |    3 |
|  4 |    4 |    4 |
|  5 |    5 |    5 |
|  6 |    6 |    6 |
|  7 |    7 |    7 |
|  8 |    8 |    8 |
|  9 |    9 |    9 |
| 10 |   10 |   10 |
+----+------+------+
delete from p;

## insert update
explain basic insert /*+use_px,parallel(10)*/ into p select * from temp_p on duplicate key update c3 = 2;
Query Plan
==============================================
|ID|OPERATOR                 |NAME           |
----------------------------------------------
|0 |PX COORDINATOR           |               |
|1 |└─EXCHANGE OUT DISTR     |:EX10000       |
|2 |  └─PX PARTITION ITERATOR|               |
|3 |    └─INSERT_UP          |               |
|4 |      └─SUBPLAN SCAN     |ANONYMOUS_VIEW1|
|5 |        └─TABLE FULL SCAN|temp_p         |
==============================================
Outputs & filters:
-------------------------------------
  0 - output(nil), filter(nil), rowset=16
  1 - output(nil), filter(nil), rowset=16
      dop=10
  2 - output(nil), filter(nil), rowset=16
      partition wise, force partition granule
  3 - output(nil), filter(nil)
      columns([{p: ({p: (p.c1, p.c2, p.c3)})}]), partitions(p[0-3]), 
      column_values([column_conv(INT,PS:(11,0),NOT NULL,ANONYMOUS_VIEW1.c1)], [column_conv(INT,PS:(11,0),NULL,ANONYMOUS_VIEW1.c2)], [column_conv(INT,PS:(11,
      0),NULL,ANONYMOUS_VIEW1.c3)]),
      update([p.c3=column_conv(INT,PS:(11,0),NULL,2)])
  4 - output([ANONYMOUS_VIEW1.c1], [ANONYMOUS_VIEW1.c2], [ANONYMOUS_VIEW1.c3]), filter(nil), rowset=16
      access([ANONYMOUS_VIEW1.c1], [ANONYMOUS_VIEW1.c2], [ANONYMOUS_VIEW1.c3])
  5 - output([temp_p.c1], [temp_p.c2], [temp_p.c3]), filter(nil), rowset=16
      access([temp_p.c1], [temp_p.c2], [temp_p.c3]), partitions(p[0-3])
      is_index_back=false, is_global_index=false, 
      range_key([temp_p.__pk_increment]), range(MIN ; MAX)always true

drop table if exists s,p,p4,no_p,temp_s,temp_p,temp_p4,temp_p5;
