drop table if exists t1;
create table t1 (c1 int primary key, c2 int);
select * from t1;
c1	c2
1	2
2	3
3	4
4	5
5	6
6	7
7	8
8	9
9	10
10	11
alter system minor freeze tenant = sys;
alter system minor freeze tenant = all_user;
alter system minor freeze tenant = all_meta;
update t1 set c2=222 where c1=2;
update t1 set c2=888 where c1=8;
select * from t1 where c1=2;
c1	c2
2	222
select * from t1 where c1=8;
c1	c2
8	888
alter system minor freeze;
select * from t1 where c1=8;
c1	c2
8	888
update t1 set c2=1111 where c1=1;
update t1 set c2=8888 where c1=8;
select * from t1 where c1=1;
c1	c2
1	1111
select * from t1 where c1=8;
c1	c2
8	8888
alter system minor freeze tenant = sys;
alter system minor freeze tenant = all_user;
alter system minor freeze tenant = all_meta;
update t1 set c2=33333 where c1=3;
update t1 set c2=88888 where c1=8;
alter system minor freeze tenant = sys;
alter system minor freeze tenant = all_user;
alter system minor freeze tenant = all_meta;
select * from t1 where c1=3;
c1	c2
3	4
select * from t1 where c1=8;
c1	c2
8	8888
commit;
select * from t1 where c1=3;
c1	c2
3	33333
select * from t1 where c1=8;
c1	c2
8	88888
alter system minor freeze tenant = sys;
alter system minor freeze tenant = all_user;
alter system minor freeze tenant = all_meta;
select * from t1 where c1=3;
c1	c2
3	33333
select * from t1 where c1=8;
c1	c2
8	88888
