ob1=OBI(cluster=1:2:2,proxy_num=0,init_unit_cpu=5);
ob1.reboot;
ob1.mysql alter system set enable_rebalance = 'false';
ob1.mysql alter system set default_compress_func = 'none';
ob1.mysql alter system set debug_sync_timeout = '100000s';
ob1.mysql alter system set undo_retention = 0;
ob1.mysql set global recyclebin = OFF;
ob1.mysql alter system set ob_compaction_schedule_interval = '10s' tenant obtest;
ob1.mysql alter system set merger_check_interval = '10s' tenant obtest;
create table t1(c1 int, c2 int, primary key (c1)) with column group (all columns, each column);
create table t2(c1 int, c2 int, c3 int, c4 int, c5 int, c6 int, c7 int, primary key (c1)) with column group (all columns, each column);
create sequence seq1 cache 100000 noorder;
create sequence seq2 cache 100000 noorder;
check major sstable status for 't1' in tenant 'obtest' in observer 1
count(1)
1
TABLE_TYPE
CO_MAJOR
check major sstable status for 't2' in tenant 'obtest' in observer 1
count(1)
1
TABLE_TYPE
CO_MAJOR
Start check empty tables
ob1.mysql alter system major freeze tenant obtest;
ob1.check_until_timeout select count(*) from oceanbase.CDB_OB_MAJOR_COMPACTION where tenant_id = $tenant_id and LAST_SCN != GLOBAL_BROADCAST_SCN and GLOBAL_BROADCAST_SCN = $frozen_scn, 0, 1200;
check major sstable status for 't1' in tenant 'obtest' in observer 1
count(1)
1
TABLE_TYPE
CO_MAJOR
check major sstable status for 't2' in tenant 'obtest' in observer 1
count(1)
1
TABLE_TYPE
CO_MAJOR
Start insert into tables1 t1, t2 for 500 lines
INSERT INTO t1 select seq1.nextval, seq1.nextval + 1 from table(generator(500));
INSERT INTO t2 select seq2.nextval, seq2.nextval + 1, seq2.nextval + 2, seq2.nextval + 3, seq2.nextval + 4, seq2.nextval + 5, seq2.nextval + 6 from table(generator(500));
select count(*) from t1;
count(*)
500
select count(*) from t2;
count(*)
500
Start major freeze for 500 lines
ob1.mysql alter system major freeze tenant obtest;
ob1.check_until_timeout select count(*) from oceanbase.CDB_OB_MAJOR_COMPACTION where tenant_id = $tenant_id and LAST_SCN != GLOBAL_BROADCAST_SCN and GLOBAL_BROADCAST_SCN = $frozen_scn, 0, 1200;
check major sstable status for 't1' in tenant 'obtest' in observer 1
count(1)
1
TABLE_TYPE
CO_MAJOR
check major sstable status for 't2' in tenant 'obtest' in observer 1
count(1)
1
TABLE_TYPE
CO_MAJOR
select * from t1 limit 1;
c1	c2
1	2
select * from t2 limit 1;
c1	c2	c3	c4	c5	c6	c7
1	2	3	4	5	6	7
Start insert into tables1 t1, t2 for 14500 lines
INSERT INTO t1 select seq1.nextval, seq1.nextval + 1 from table(generator(14500));
INSERT INTO t2 select seq2.nextval, seq2.nextval + 1, seq2.nextval + 2, seq2.nextval + 3, seq2.nextval + 4, seq2.nextval + 5, seq2.nextval + 6 from table(generator(14500));
select count(*) from t1;
count(*)
15000
select count(*) from t2;
count(*)
15000
Start major freeze for 15000 lines
ob1.mysql alter system major freeze tenant obtest;
ob1.check_until_timeout select count(*) from oceanbase.CDB_OB_MAJOR_COMPACTION where tenant_id = $tenant_id and LAST_SCN != GLOBAL_BROADCAST_SCN and GLOBAL_BROADCAST_SCN = $frozen_scn, 0, 1200;
check major sstable status for 't1' in tenant 'obtest' in observer 1
count(1)
1
TABLE_TYPE
CO_MAJOR
check major sstable status for 't2' in tenant 'obtest' in observer 1
count(1)
8
TABLE_TYPE
CO_MAJOR
NORMAL_CG
NORMAL_CG
NORMAL_CG
NORMAL_CG
NORMAL_CG
NORMAL_CG
NORMAL_CG
select * from t1 limit 1;
c1	c2
1	2
select * from t2 limit 1;
c1	c2	c3	c4	c5	c6	c7
1	2	3	4	5	6	7
Start insert into tables1 t1, t2 for 10000 lines
INSERT INTO t1 select seq1.nextval, seq1.nextval + 1 from table(generator(10000));
INSERT INTO t2 select seq2.nextval, seq2.nextval + 1, seq2.nextval + 2, seq2.nextval + 3, seq2.nextval + 4, seq2.nextval + 5, seq2.nextval + 6 from table(generator(10000));
select count(*) from t1;
count(*)
25000
select count(*) from t2;
count(*)
25000
Start major freeze for 25000 lines
ob1.mysql alter system major freeze tenant obtest;
ob1.check_until_timeout select count(*) from oceanbase.CDB_OB_MAJOR_COMPACTION where tenant_id = $tenant_id and LAST_SCN != GLOBAL_BROADCAST_SCN and GLOBAL_BROADCAST_SCN = $frozen_scn, 0, 1200;
check major sstable status for 't1' in tenant 'obtest' in observer 1
count(1)
1
TABLE_TYPE
CO_MAJOR
check major sstable status for 't2' in tenant 'obtest' in observer 1
count(1)
8
TABLE_TYPE
CO_MAJOR
NORMAL_CG
NORMAL_CG
NORMAL_CG
NORMAL_CG
NORMAL_CG
NORMAL_CG
NORMAL_CG
select * from t1 limit 1;
c1	c2
1	2
select * from t2 limit 1;
c1	c2	c3	c4	c5	c6	c7
1	2	3	4	5	6	7
delete from t1 where c1 > 5000;
delete from t2 where c1 > 5000;
select count(*) from t1;
count(*)
5000
select count(*) from t2;
count(*)
5000
Start major freeze after delete 20000 lines(remain 5000)
ob1.mysql alter system major freeze tenant obtest;
ob1.check_until_timeout select count(*) from oceanbase.CDB_OB_MAJOR_COMPACTION where tenant_id = $tenant_id and LAST_SCN != GLOBAL_BROADCAST_SCN and GLOBAL_BROADCAST_SCN = $frozen_scn, 0, 1200;
check major sstable status for 't1' in tenant 'obtest' in observer 1
count(1)
1
TABLE_TYPE
CO_MAJOR
check major sstable status for 't2' in tenant 'obtest' in observer 1
count(1)
8
TABLE_TYPE
CO_MAJOR
NORMAL_CG
NORMAL_CG
NORMAL_CG
NORMAL_CG
NORMAL_CG
NORMAL_CG
NORMAL_CG
select * from t1 limit 1;
c1	c2
1	2
select * from t2 limit 1;
c1	c2	c3	c4	c5	c6	c7
1	2	3	4	5	6	7
delete from t1 where c1 > 2500;
delete from t2 where c1 > 2500;
select count(*) from t1;
count(*)
2500
select count(*) from t2;
count(*)
2500
Start major freeze after delete 2500 lines(remain 2500)
ob1.mysql alter system major freeze tenant obtest;
ob1.check_until_timeout select count(*) from oceanbase.CDB_OB_MAJOR_COMPACTION where tenant_id = $tenant_id and LAST_SCN != GLOBAL_BROADCAST_SCN and GLOBAL_BROADCAST_SCN = $frozen_scn, 0, 1200;
check major sstable status for 't1' in tenant 'obtest' in observer 1
count(1)
1
TABLE_TYPE
CO_MAJOR
check major sstable status for 't2' in tenant 'obtest' in observer 1
count(1)
1
TABLE_TYPE
CO_MAJOR
select * from t1 limit 1;
c1	c2
1	2
select * from t2 limit 1;
c1	c2	c3	c4	c5	c6	c7
1	2	3	4	5	6	7
ob1.mysql alter system set_tp tp_no = 736, error_code = 4016, frequency = 1;
Start check errsim for estimate row count failed
ob1.mysql alter system major freeze tenant obtest;
ob1.z1.obs0.check_log_until_success -c "ERRSIM EN_COMPACTION_ESTIMATE_ROW_FAILED";
ob1.check_until_timeout select count(*) from oceanbase.CDB_OB_MAJOR_COMPACTION where tenant_id = $tenant_id and LAST_SCN != GLOBAL_BROADCAST_SCN , 0, 1200;
check major sstable status for 't1' in tenant 'obtest' in observer 1
count(1)
3
TABLE_TYPE
CO_MAJOR
NORMAL_CG
NORMAL_CG
check major sstable status for 't2' in tenant 'obtest' in observer 1
count(1)
8
TABLE_TYPE
CO_MAJOR
NORMAL_CG
NORMAL_CG
NORMAL_CG
NORMAL_CG
NORMAL_CG
NORMAL_CG
NORMAL_CG
ob1.mysql alter system set_tp tp_no = 736, error_code = 4016, frequency = 0;
select count(*) from t1;
count(*)
2500
select count(*) from t2;
count(*)
2500
select * from t1 limit 1;
c1	c2
1	2
select * from t2 limit 1;
c1	c2	c3	c4	c5	c6	c7
1	2	3	4	5	6	7
Start check after errsim, should return back row store
ob1.mysql alter system major freeze tenant obtest;
ob1.check_until_timeout select count(*) from oceanbase.CDB_OB_MAJOR_COMPACTION where tenant_id = $tenant_id and LAST_SCN != GLOBAL_BROADCAST_SCN and GLOBAL_BROADCAST_SCN = $frozen_scn, 0, 1200;
check major sstable status for 't1' in tenant 'obtest' in observer 1
count(1)
1
TABLE_TYPE
CO_MAJOR
check major sstable status for 't2' in tenant 'obtest' in observer 1
count(1)
1
TABLE_TYPE
CO_MAJOR
select count(*) from t1;
count(*)
2500
select count(*) from t2;
count(*)
2500
select * from t1 limit 1;
c1	c2
1	2
select * from t2 limit 1;
c1	c2	c3	c4	c5	c6	c7
1	2	3	4	5	6	7
ob1.mysql alter system migrate unit $unit_id destination "$dst";
ob1.check_until_timeout SELECT COUNT(*) as cnt FROM oceanbase.__all_rootservice_job WHERE unit_id = $unit_id AND job_type = "MIGRATE_UNIT" AND job_status = "SUCCESS", 1, 600;
ob1.check_until_timeout select count(1) from oceanbase.__all_virtual_ls_meta_table where tenant_id = $tenant_id and ls_id = $ls_id and svr_port = '$dst_port' and replica_status = 'NORMAL', 1, 100;
ob1.check_until_timeout select count(*) as cnt from oceanbase.GV\$OB_UNITS where unit_id = $unit_id and svr_ip = '$ip' and svr_port = $port, 0, 100;
check major sstable status for 't1' in tenant 'obtest' in observer 1
count(1)
1
TABLE_TYPE
CO_MAJOR
check major sstable status for 't2' in tenant 'obtest' in observer 1
count(1)
1
TABLE_TYPE
CO_MAJOR
select count(*) from t1;
count(*)
2500
select count(*) from t2;
count(*)
2500
select * from t1 limit 1;
c1	c2
1	2
select * from t2 limit 1;
c1	c2	c3	c4	c5	c6	c7
1	2	3	4	5	6	7
ob1.mysql alter system set_tp tp_no = 736, error_code = 4016, frequency = 1;
Start check errsim for estimate row count failed
ob1.mysql alter system major freeze tenant obtest;
ob1.z1.obs0.check_log_until_success -c "ERRSIM EN_COMPACTION_ESTIMATE_ROW_FAILED";
ob1.check_until_timeout select count(*) from oceanbase.CDB_OB_MAJOR_COMPACTION where tenant_id = $tenant_id and LAST_SCN != GLOBAL_BROADCAST_SCN , 0, 1200;
check major sstable status for 't1' in tenant 'obtest' in observer 1
count(1)
3
TABLE_TYPE
CO_MAJOR
NORMAL_CG
NORMAL_CG
check major sstable status for 't2' in tenant 'obtest' in observer 1
count(1)
8
TABLE_TYPE
CO_MAJOR
NORMAL_CG
NORMAL_CG
NORMAL_CG
NORMAL_CG
NORMAL_CG
NORMAL_CG
NORMAL_CG
ob1.mysql alter system set_tp tp_no = 736, error_code = 4016, frequency = 0;
select count(*) from t1;
count(*)
2500
select count(*) from t2;
count(*)
2500
select * from t1 limit 1;
c1	c2
1	2
select * from t2 limit 1;
c1	c2	c3	c4	c5	c6	c7
1	2	3	4	5	6	7
ob1.mysql alter system migrate unit $unit_id destination "$dst";
ob1.check_until_timeout SELECT COUNT(*) as cnt FROM oceanbase.__all_rootservice_job WHERE unit_id = $unit_id AND job_type = "MIGRATE_UNIT" AND job_status = "SUCCESS", 1, 600;
ob1.check_until_timeout select count(1) from oceanbase.__all_virtual_ls_meta_table where tenant_id = $tenant_id and ls_id = $ls_id and svr_port = '$dst_port' and replica_status = 'NORMAL', 1, 100;
ob1.check_until_timeout select count(*) as cnt from oceanbase.GV\$OB_UNITS where unit_id = $unit_id and svr_ip = '$ip' and svr_port = $port, 0, 200;
check major sstable status for 't1' in tenant 'obtest' in observer 1
count(1)
3
TABLE_TYPE
CO_MAJOR
NORMAL_CG
NORMAL_CG
check major sstable status for 't2' in tenant 'obtest' in observer 1
count(1)
8
TABLE_TYPE
CO_MAJOR
NORMAL_CG
NORMAL_CG
NORMAL_CG
NORMAL_CG
NORMAL_CG
NORMAL_CG
NORMAL_CG
select count(*) from t1;
count(*)
2500
select count(*) from t2;
count(*)
2500
select * from t1 limit 1;
c1	c2
1	2
select * from t2 limit 1;
c1	c2	c3	c4	c5	c6	c7
1	2	3	4	5	6	7
Start check after errsim, should return back row store
ob1.mysql alter system major freeze tenant obtest;
ob1.check_until_timeout select count(*) from oceanbase.CDB_OB_MAJOR_COMPACTION where tenant_id = $tenant_id and LAST_SCN != GLOBAL_BROADCAST_SCN and GLOBAL_BROADCAST_SCN = $frozen_scn, 0, 1200;
check major sstable status for 't1' in tenant 'obtest' in observer 1
count(1)
1
TABLE_TYPE
CO_MAJOR
check major sstable status for 't2' in tenant 'obtest' in observer 1
count(1)
1
TABLE_TYPE
CO_MAJOR
select count(*) from t1;
count(*)
2500
select count(*) from t2;
count(*)
2500
select * from t1 limit 1;
c1	c2
1	2
select * from t2 limit 1;
c1	c2	c3	c4	c5	c6	c7
1	2	3	4	5	6	7
