result_format: 4
drop table if exists t1;
drop table if exists t2;
drop view if exists v1;
drop view if exists v2;
drop table if exists a;
drop table if exists b;
drop table if exists c;
drop view if exists v;
drop view if exists vv;
drop view if exists vvv;
create table a (a1 int primary key, a2 int, a3 int);
create table b (b1 int primary key, b2 int, b3 int);
create table c (c1 int primary key, c2 int, c3 int);
create table t1 (c1 int primary key, c2 int, c3 int);
create table t2 (c1 int primary key, c2 int, c3 int);
insert into t1 (c1, c2, c3) values (1, 1, 1);
insert into t2 (c1, c2, c3) values (1, 1, 1);
create view v1 as select * from t1;
create view v2 as select t1.c1 c1, t1.c2 c2, t1.c3 c3, t2.c1 c4, t2.c2 c5, t2.c3 c6 from t1, t2 where t1.c1 = t2.c1;

insert into v1 (c1, c2, c3) values (2, 2, 2);
select * from t1;
+----+------+------+
| c1 | c2   | c3   |
+----+------+------+
|  1 |    1 |    1 |
|  2 |    2 |    2 |
+----+------+------+
insert into v2 (c4, c5, c6) values (2, 2, 2);
select * from t2;
+----+------+------+
| c1 | c2   | c3   |
+----+------+------+
|  1 |    1 |    1 |
|  2 |    2 |    2 |
+----+------+------+
replace into v2 (c4, c5, c6) values (2, 3, 3);
select * from t2;
+----+------+------+
| c1 | c2   | c3   |
+----+------+------+
|  1 |    1 |    1 |
|  2 |    3 |    3 |
+----+------+------+
insert into v2 (c4, c5, c6) values (2, 3, 3) on duplicate key update c5 = 5, c6 = 6;
select * from t2;
+----+------+------+
| c1 | c2   | c3   |
+----+------+------+
|  1 |    1 |    1 |
|  2 |    5 |    6 |
+----+------+------+
insert into v2 (c4, c5, c6) values (2, 3, 3) on duplicate key update c5 = values (c5);
select * from t2;
+----+------+------+
| c1 | c2   | c3   |
+----+------+------+
|  1 |    1 |    1 |
|  2 |    3 |    6 |
+----+------+------+

drop table t1;
create table t1 (c1 int, c2 int, c3 int);
create view v as select * from t1;
insert into v (c1, c2, c3) values (1, 1, 1);
insert into v (c1, c2, c3) values (1, 1, 1);
insert into v (c1, c2, c3) values (1, 1, 1);
insert into v (c1, c2, c3) values (2, 2, 2);
insert into v (c1, c2, c3) values (2, 2, 2);
select * from v order by c1, c2, c3;
+------+------+------+
| c1   | c2   | c3   |
+------+------+------+
|    1 |    1 |    1 |
|    1 |    1 |    1 |
|    1 |    1 |    1 |
|    2 |    2 |    2 |
|    2 |    2 |    2 |
+------+------+------+
update v set c2 = 3;
select * from v order by c1, c2, c3;
+------+------+------+
| c1   | c2   | c3   |
+------+------+------+
|    1 |    3 |    1 |
|    1 |    3 |    1 |
|    1 |    3 |    1 |
|    2 |    3 |    2 |
|    2 |    3 |    2 |
+------+------+------+
delete from v;
select * from v order by c1, c2, c3;
+------+------+------+
| c1   | c2   | c3   |
+------+------+------+
+------+------+------+

drop table t1;
drop view v;

create table t1 (c1 int, c2 int, c3 int) partition by hash(c2) partitions 2;
create view v as select * from t1;
insert into v (c1, c2, c3) values (1, 1, 1);
insert into v (c1, c2, c3) values (1, 1, 1);
insert into v (c1, c2, c3) values (1, 1, 1);
insert into v (c1, c2, c3) values (2, 2, 2);
insert into v (c1, c2, c3) values (2, 2, 2);
select * from v order by c1, c2, c3;
+------+------+------+
| c1   | c2   | c3   |
+------+------+------+
|    1 |    1 |    1 |
|    1 |    1 |    1 |
|    1 |    1 |    1 |
|    2 |    2 |    2 |
|    2 |    2 |    2 |
+------+------+------+
update v set c2 = 3;
select * from v order by c1, c2, c3;
+------+------+------+
| c1   | c2   | c3   |
+------+------+------+
|    1 |    3 |    1 |
|    1 |    3 |    1 |
|    1 |    3 |    1 |
|    2 |    3 |    2 |
|    2 |    3 |    2 |
+------+------+------+
delete from v;
select * from v order by c1, c2, c3;
+------+------+------+
| c1   | c2   | c3   |
+------+------+------+
+------+------+------+
drop view v;

drop table t1;
create table t1 (c1 int, c2 int, c3 int) partition by hash (c1) partitions 2;
create view v as select * from t1 partition(p0);
insert into v (c1, c2, c3) values (0, 0, 0);
insert into v (c1, c2, c3) values (1, 0, 0);
ERROR HY000: Found a row not matching the given partition set
drop view v;

drop table t1;
create table t1 (c1 int primary key, c2 int, c3 int, c4 int, c5 int, unique index i1 (c2) global, index i2(c3) global) partition by hash (c1) partitions 4;
create unique index i3 on t1(c4) partition by key(c4) partitions 2;
create index i4 on t1(c5, c3) partition by key(c5) partitions 2;
create view v as select * from t1;

insert into v (c1, c2, c3, c4, c5) values (1, 1, 1, 1, 1), (2, 2, 2, 2, 2);
select * from v order by c1;
+----+------+------+------+------+
| c1 | c2   | c3   | c4   | c5   |
+----+------+------+------+------+
|  1 |    1 |    1 |    1 |    1 |
|  2 |    2 |    2 |    2 |    2 |
+----+------+------+------+------+
update v set c3 = 4, c5 = 6 where c2 = 1;
select * from v order by c1;
+----+------+------+------+------+
| c1 | c2   | c3   | c4   | c5   |
+----+------+------+------+------+
|  1 |    1 |    4 |    1 |    6 |
|  2 |    2 |    2 |    2 |    2 |
+----+------+------+------+------+
delete from v where c5 = 2;
select * from v order by c1;
+----+------+------+------+------+
| c1 | c2   | c3   | c4   | c5   |
+----+------+------+------+------+
|  1 |    1 |    4 |    1 |    6 |
+----+------+------+------+------+
update v set c1 = 3 where c5 = 6;
select * from v;
+----+------+------+------+------+
| c1 | c2   | c3   | c4   | c5   |
+----+------+------+------+------+
|  3 |    1 |    4 |    1 |    6 |
+----+------+------+------+------+

drop view v;
drop table t1;

### error code
create view v as select a1 + 1 c1, a2 + 1 c2, a2 + 3 c3 from a;
insert into v (c1, c2, c3) values (1, 1, 1);
ERROR HY000: Column 'c1' is not updatable
replace into v (c1, c2, c3) values (1, 1, 1);
ERROR HY000: Column 'c1' is not updatable
drop view v;
create view v as select a1, a2, a3, 1 a4 from a;
insert into v (a1, a2, a3) values (1, 1,1 );
ERROR HY000: The target table v of the INSERT is not insertable-into
drop view v;
create view v as select a1, a2, a3,  1 < (select 3 from dual limit 1) x from a;
insert into v (a1, a2, a3) values (1, 1,1 );
ERROR HY000: The target table v of the INSERT is not insertable-into
drop view v;

create view v as select a1, a1 a2, a3 from a;
insert into v (a1, a2, a3) values (1, 1, 1);
ERROR HY000: The target table v of the INSERT is not insertable-into
insert into v (a1, a3) values (1, 1);
ERROR HY000: The target table v of the INSERT is not insertable-into
replace into v (a1, a3) values (1, 1);
ERROR HY000: The target table v of the INSERT is not insertable-into

create view vv as select a1, a3 from v;
insert into vv (a1, a3) values (1, 1);
drop view vv;
create view vv as select a1, a2 from v;
insert into vv (a1, a2) values (1, 1);
ERROR HY000: The target table vv of the INSERT is not insertable-into
drop view v;
drop view vv;

create view v as select a1, a2, a3, b1, b2, b3 from a, b where a1 = b1;
delete from a;
insert into v (a1, a2, a3) values (1, 1, 1);
insert into v (a1, b2, a3) values (1, 1, 1);
ERROR HY000: Can not modify more than one base table through a join view 'test.v'
insert into v (a1, a2, a3) values (1, 1, 1) on duplicate key update a2 = b2 + b3;
ERROR HY000: Can not modify more than one base table through a join view 'test.v'
drop view v;

create view v as select a.* from a, b where a1 = b1 and a2 > (select max(b3) from b);
delete from a;
insert into v (a1, a2, a3) values (1, 1, 1);
delete from a;
drop view v;
create view v as select a.* from a where  a2 > (select max(b3) from b where b2 > a2);
insert into v (a1, a2, a3) values (1, 1, 1);
delete from a;
drop view v;
create view v as select a.* from a, b where a1 = b1 and a2 > (select max(a3) from a);
insert into v (a1, a2, a3) values (1, 1, 1);
ERROR HY000: The target table v of the INSERT is not insertable-into
drop view v;
create view vv as select * from a;
create view vvv as select * from a;
create view v as select vv.* from vv, b where a1 = b1 and a2 > (select max(a3) from vvv);
insert into v (a1, a2, a3) values (1, 1, 1);
ERROR HY000: The target table v of the INSERT is not insertable-into
insert into v (a1, a2, a3) values (1, 1, 1) on duplicate key update a2 = 2;
ERROR HY000: The target table v of the INSERT is not insertable-into
drop view v;
drop view vv;
drop view vvv;

create view vv as select b.* from b inner join c on b2 = c2;
create view v as select a.* from a, vv where a1 = b1;
insert into v (a1, a2, a3) values (1, 1, 1);
delete from a;
drop view vv;
create view vv as select b.* from b left join c on b2 = c2;
insert into v (a1, a2, a3) values (1, 1, 1);
ERROR HY000: The target table v of the INSERT is not insertable-into
drop view vv;

create view vv as select b.* from b, a where b2 = a2;
insert into v (a1, a2, a3) values (1, 1, 1);
ERROR HY000: The target table v of the INSERT is not insertable-into
drop view vv;
create view vv as select * from b where b1 > (select max(a2) from a where a3 > b3);
insert into v (a1, a2, a3) values (1, 1, 1);
ERROR HY000: The target table v of the INSERT is not insertable-into

drop view vv;
create view vv as select b1, b1 b2, b3 from b;
insert into v (a1, a2, a3) values (1, 1, 1);
delete from a;

drop view vv;
create view vv as select b1 + 1 as b1, b2 + 1 as b2, b3 + 3 as b3 from b;
insert into v (a1, a2, a3) values (1, 1, 1);
delete from a;

drop view vv;
create view vv as select b1 + 1 as b1, b2 + 2 as b2, b3 + 3 as b3 from b inner join c on b3 = c3;
insert into v (a1, a2, a3) values (1, 1, 1);
delete from a;

drop view vv;
create view vv as select b.* from b left join c on b3 = c3;
insert into v (a1, a2, a3) values (1, 1, 1);
ERROR HY000: The target table v of the INSERT is not insertable-into

drop view vv;
create view vvv as select distinct c1, c2, c3 from c;
create view vv as select b.* from b, vvv where b3 = c3;
insert into v (a1, a2, a3) values (1, 1, 1);
ERROR HY000: The target table v of the INSERT is not insertable-into

drop view vvv;
drop view vv;
create view vv as select b.* from b, (select distinct c1, c2, c3 from c) x where b3 = c3;
insert into v (a1, a2, a3) values (1, 1, 1);
ERROR HY000: The target table v of the INSERT is not insertable-into

drop view vv;
create view vv as select b.* from b, (select c1, c2, c3 from c) x where b3 = c3;
insert into v (a1, a2, a3) values (1, 1, 1);
ERROR HY000: The target table v of the INSERT is not insertable-into

drop view vv;
drop view v;

drop table if exists t;
drop view if exists v1;
drop view if exists v2;
drop view if exists v3;
drop view if exists vv1;
drop view if exists vv2;
drop view if exists vv3;
create table t(c1 int, c2 int, c3 int, c4 int generated always as (c1+c2));
create view v1 as select a.c1,a.c2,a.c3,a.c4 from t a;
create view v2(vc1,vc2,vc3,vc4) as select c1,c2,c3,c4 from t;
create view v3 as select c1,c2,c3 from t;
create view vv1(vvc1,vvc2) as select a.c1,a.c2 from v1 a;
create view vv2 as select vc1,vc2,vc3 from v2;
create view vv3 as select c1 from v3;
insert into t(c1,c2,c3) values(1,1,1);
insert into v1 values(2,2,2);
ERROR 21S01: Column count doesn't match value count at row 1
insert into v1 values(2,2,2,4);
ERROR HY000: The value specified for generated column 'c4' in table 'v1' is not allowed
insert into v1(c1,c2,c3,c4) values(2,2,2,4);
ERROR HY000: The value specified for generated column 'c4' in table 'v1' is not allowed
insert into v1(c1,c2,c3) values(2,2,2);
insert into v2(vc1,vc2,vc3) values(3,3,3);
insert into v3(c1,c2) values(4,4);
insert into vv1(vvc1) values(5);
insert into vv2 values(6,6,6);
insert into vv3 values(7);
select * from t;
+------+------+------+------+
| c1   | c2   | c3   | c4   |
+------+------+------+------+
|    1 |    1 |    1 |    2 |
|    2 |    2 |    2 |    4 |
|    3 |    3 |    3 |    6 |
|    4 |    4 | NULL |    8 |
|    5 | NULL | NULL | NULL |
|    6 |    6 |    6 |   12 |
|    7 | NULL | NULL | NULL |
+------+------+------+------+

drop table t;
drop view v1;
drop view v2;
drop view v3;
drop view vv1;
drop view vv2;
drop view vv3;
##partition table, with index
create table t(c1 int, c2 int, c3 int) partition by hash(c1);
create view v1 as select a.c1,a.c2,a.c3 from t a;
create view v2(vc1,vc2,vc3) as select c1,c2,c3 from t;
create view v3 as select c1,c2,c3 from t;
create view vv1(vvc1,vvc2) as select a.c1,a.c2 from v1 a;
create view vv2 as select vc1,vc2,vc3 from v2;
create view vv3 as select c1 from v3;
create index t_idx on t(c1) global;
create index t_idx1 on t(c1) partition by hash(c1);
create index t_idx2 on t(c1) global;
create index t_idx3 on t(c1) global partition by hash(c1);
explain_protocol: 1
EXPLAIN BASIC insert into t values(1, 1, 1);
Query Plan
============================
|ID|OPERATOR          |NAME|
----------------------------
|0 |DISTRIBUTED INSERT|    |
|1 |└─EXPRESSION      |    |
============================
Outputs & filters:
-------------------------------------
  0 - output(nil), filter(nil)
      columns([{t: ({t: (t.__pk_increment, t.c1, t.c2, t.c3)}, {t_idx: (t.c1, t.__pk_increment)}, {t_idx1: (t.c1, t.__pk_increment)}, {t_idx2: (t.c1, t.__pk_increment)},
       {t_idx3: (t.c1, t.__pk_increment)})}]), 
      column_values([T_HIDDEN_PK], [column_conv(INT,PS:(11,0),NULL,__values.c1)], [column_conv(INT,PS:(11,0),NULL,__values.c2)], [column_conv(INT,PS:(11,
      0),NULL,__values.c3)])
  1 - output([__values.c1], [__values.c2], [__values.c3]), filter(nil)
      values({1, 1, 1})
insert into t values(1, 1, 1);
EXPLAIN BASIC insert /*+ no_rewrite */ into t values(1, 1, 2);
Query Plan
============================
|ID|OPERATOR          |NAME|
----------------------------
|0 |DISTRIBUTED INSERT|    |
|1 |└─EXPRESSION      |    |
============================
Outputs & filters:
-------------------------------------
  0 - output(nil), filter(nil)
      columns([{t: ({t: (t.__pk_increment, t.c1, t.c2, t.c3)}, {t_idx: (t.c1, t.__pk_increment)}, {t_idx1: (t.c1, t.__pk_increment)}, {t_idx2: (t.c1, t.__pk_increment)},
       {t_idx3: (t.c1, t.__pk_increment)})}]), 
      column_values([T_HIDDEN_PK], [column_conv(INT,PS:(11,0),NULL,__values.c1)], [column_conv(INT,PS:(11,0),NULL,__values.c2)], [column_conv(INT,PS:(11,
      0),NULL,__values.c3)])
  1 - output([__values.c1], [__values.c2], [__values.c3]), filter(nil)
      values({1, 1, 2})
insert /*+ no_rewrite */ into t values(1, 1, 2);
EXPLAIN BASIC insert into v1 values(2, 1, 1);
Query Plan
============================
|ID|OPERATOR          |NAME|
----------------------------
|0 |DISTRIBUTED INSERT|    |
|1 |└─EXPRESSION      |    |
============================
Outputs & filters:
-------------------------------------
  0 - output(nil), filter(nil)
      columns([{v1: ({t: (v1.a.__pk_increment, v1.c1, v1.c2, v1.c3)}, {t_idx: (v1.c1, v1.a.__pk_increment)}, {t_idx1: (v1.c1, v1.a.__pk_increment)}, {t_idx2: 
      (v1.c1, v1.a.__pk_increment)}, {t_idx3: (v1.c1, v1.a.__pk_increment)})}]), 
      column_values([T_HIDDEN_PK], [column_conv(INT,PS:(11,0),NULL,__values.c1)], [column_conv(INT,PS:(11,0),NULL,__values.c2)], [column_conv(INT,PS:(11,
      0),NULL,__values.c3)])
  1 - output([__values.c1], [__values.c2], [__values.c3]), filter(nil)
      values({2, 1, 1})
insert into v1 values(2, 1, 1);
EXPLAIN BASIC insert /*+ no_rewrite */ into v1 values(2, 1, 2);
Query Plan
============================
|ID|OPERATOR          |NAME|
----------------------------
|0 |DISTRIBUTED INSERT|    |
|1 |└─EXPRESSION      |    |
============================
Outputs & filters:
-------------------------------------
  0 - output(nil), filter(nil)
      columns([{v1: ({t: (v1.a.__pk_increment, v1.c1, v1.c2, v1.c3)}, {t_idx: (v1.c1, v1.a.__pk_increment)}, {t_idx1: (v1.c1, v1.a.__pk_increment)}, {t_idx2: 
      (v1.c1, v1.a.__pk_increment)}, {t_idx3: (v1.c1, v1.a.__pk_increment)})}]), 
      column_values([T_HIDDEN_PK], [column_conv(INT,PS:(11,0),NULL,__values.c1)], [column_conv(INT,PS:(11,0),NULL,__values.c2)], [column_conv(INT,PS:(11,
      0),NULL,__values.c3)])
  1 - output([__values.c1], [__values.c2], [__values.c3]), filter(nil)
      values({2, 1, 2})
insert /*+ no_rewrite */ into v1 values(2, 1, 2);
EXPLAIN BASIC insert into v2 values(3, 1, 1);
Query Plan
============================
|ID|OPERATOR          |NAME|
----------------------------
|0 |DISTRIBUTED INSERT|    |
|1 |└─EXPRESSION      |    |
============================
Outputs & filters:
-------------------------------------
  0 - output(nil), filter(nil)
      columns([{v2: ({t: (v2.t.__pk_increment, v2.vc1, v2.vc2, v2.vc3)}, {t_idx: (v2.vc1, v2.t.__pk_increment)}, {t_idx1: (v2.vc1, v2.t.__pk_increment)},
       {t_idx2: (v2.vc1, v2.t.__pk_increment)}, {t_idx3: (v2.vc1, v2.t.__pk_increment)})}]), 
      column_values([T_HIDDEN_PK], [column_conv(INT,PS:(11,0),NULL,__values.vc1)], [column_conv(INT,PS:(11,0),NULL,__values.vc2)], [column_conv(INT,PS:(11,
      0),NULL,__values.vc3)])
  1 - output([__values.vc1], [__values.vc2], [__values.vc3]), filter(nil)
      values({3, 1, 1})
insert into v2 values(3, 1, 1);
EXPLAIN BASIC insert /*+ no_rewrite */ into v2 values(3, 1, 2);
Query Plan
============================
|ID|OPERATOR          |NAME|
----------------------------
|0 |DISTRIBUTED INSERT|    |
|1 |└─EXPRESSION      |    |
============================
Outputs & filters:
-------------------------------------
  0 - output(nil), filter(nil)
      columns([{v2: ({t: (v2.t.__pk_increment, v2.vc1, v2.vc2, v2.vc3)}, {t_idx: (v2.vc1, v2.t.__pk_increment)}, {t_idx1: (v2.vc1, v2.t.__pk_increment)},
       {t_idx2: (v2.vc1, v2.t.__pk_increment)}, {t_idx3: (v2.vc1, v2.t.__pk_increment)})}]), 
      column_values([T_HIDDEN_PK], [column_conv(INT,PS:(11,0),NULL,__values.vc1)], [column_conv(INT,PS:(11,0),NULL,__values.vc2)], [column_conv(INT,PS:(11,
      0),NULL,__values.vc3)])
  1 - output([__values.vc1], [__values.vc2], [__values.vc3]), filter(nil)
      values({3, 1, 2})
insert /*+ no_rewrite */ into v2 values(3, 1, 2);
EXPLAIN BASIC insert into v3 values(4, 1, 1);
Query Plan
============================
|ID|OPERATOR          |NAME|
----------------------------
|0 |DISTRIBUTED INSERT|    |
|1 |└─EXPRESSION      |    |
============================
Outputs & filters:
-------------------------------------
  0 - output(nil), filter(nil)
      columns([{v3: ({t: (v3.t.__pk_increment, v3.c1, v3.c2, v3.c3)}, {t_idx: (v3.c1, v3.t.__pk_increment)}, {t_idx1: (v3.c1, v3.t.__pk_increment)}, {t_idx2: 
      (v3.c1, v3.t.__pk_increment)}, {t_idx3: (v3.c1, v3.t.__pk_increment)})}]), 
      column_values([T_HIDDEN_PK], [column_conv(INT,PS:(11,0),NULL,__values.c1)], [column_conv(INT,PS:(11,0),NULL,__values.c2)], [column_conv(INT,PS:(11,
      0),NULL,__values.c3)])
  1 - output([__values.c1], [__values.c2], [__values.c3]), filter(nil)
      values({4, 1, 1})
insert into v3 values(4, 1, 1);
EXPLAIN BASIC insert /*+ no_rewrite */ into v3 values(4, 1, 2);
Query Plan
============================
|ID|OPERATOR          |NAME|
----------------------------
|0 |DISTRIBUTED INSERT|    |
|1 |└─EXPRESSION      |    |
============================
Outputs & filters:
-------------------------------------
  0 - output(nil), filter(nil)
      columns([{v3: ({t: (v3.t.__pk_increment, v3.c1, v3.c2, v3.c3)}, {t_idx: (v3.c1, v3.t.__pk_increment)}, {t_idx1: (v3.c1, v3.t.__pk_increment)}, {t_idx2: 
      (v3.c1, v3.t.__pk_increment)}, {t_idx3: (v3.c1, v3.t.__pk_increment)})}]), 
      column_values([T_HIDDEN_PK], [column_conv(INT,PS:(11,0),NULL,__values.c1)], [column_conv(INT,PS:(11,0),NULL,__values.c2)], [column_conv(INT,PS:(11,
      0),NULL,__values.c3)])
  1 - output([__values.c1], [__values.c2], [__values.c3]), filter(nil)
      values({4, 1, 2})
insert /*+ no_rewrite */ into v3 values(4, 1, 2);
EXPLAIN BASIC insert into vv1 values(5, 1);
Query Plan
============================
|ID|OPERATOR          |NAME|
----------------------------
|0 |DISTRIBUTED INSERT|    |
|1 |└─EXPRESSION      |    |
============================
Outputs & filters:
-------------------------------------
  0 - output(nil), filter(nil)
      columns([{vv1: ({t: (vv1.a.a.__pk_increment, vv1.vvc1, vv1.vvc2, vv1.a.c3)}, {t_idx: (vv1.vvc1, vv1.a.a.__pk_increment)}, {t_idx1: (vv1.vvc1, vv1.a.a.__pk_increment)},
       {t_idx2: (vv1.vvc1, vv1.a.a.__pk_increment)}, {t_idx3: (vv1.vvc1, vv1.a.a.__pk_increment)})}]), 
      column_values([T_HIDDEN_PK], [column_conv(INT,PS:(11,0),NULL,__values.vvc1)], [column_conv(INT,PS:(11,0),NULL,__values.vvc2)], [column_conv(INT,PS:(11,
      0),NULL,cast(NULL, INT(11, 0)))])
  1 - output([__values.vvc1], [__values.vvc2]), filter(nil)
      values({5, 1})
insert into vv1 values(5, 1);
EXPLAIN BASIC insert /*+ no_rewrite */ into vv1 values(5, 2);
Query Plan
============================
|ID|OPERATOR          |NAME|
----------------------------
|0 |DISTRIBUTED INSERT|    |
|1 |└─EXPRESSION      |    |
============================
Outputs & filters:
-------------------------------------
  0 - output(nil), filter(nil)
      columns([{vv1: ({t: (vv1.a.a.__pk_increment, vv1.vvc1, vv1.vvc2, vv1.a.c3)}, {t_idx: (vv1.vvc1, vv1.a.a.__pk_increment)}, {t_idx1: (vv1.vvc1, vv1.a.a.__pk_increment)},
       {t_idx2: (vv1.vvc1, vv1.a.a.__pk_increment)}, {t_idx3: (vv1.vvc1, vv1.a.a.__pk_increment)})}]), 
      column_values([T_HIDDEN_PK], [column_conv(INT,PS:(11,0),NULL,__values.vvc1)], [column_conv(INT,PS:(11,0),NULL,__values.vvc2)], [column_conv(INT,PS:(11,
      0),NULL,cast(NULL, INT(11, 0)))])
  1 - output([__values.vvc1], [__values.vvc2]), filter(nil)
      values({5, 2})
insert /*+ no_rewrite */ into vv1 values(5, 2);
EXPLAIN BASIC insert into vv2 values(6, 1, 1);
Query Plan
============================
|ID|OPERATOR          |NAME|
----------------------------
|0 |DISTRIBUTED INSERT|    |
|1 |└─EXPRESSION      |    |
============================
Outputs & filters:
-------------------------------------
  0 - output(nil), filter(nil)
      columns([{vv2: ({t: (vv2.v2.t.__pk_increment, vv2.vc1, vv2.vc2, vv2.vc3)}, {t_idx: (vv2.vc1, vv2.v2.t.__pk_increment)}, {t_idx1: (vv2.vc1, vv2.v2.t.__pk_increment)},
       {t_idx2: (vv2.vc1, vv2.v2.t.__pk_increment)}, {t_idx3: (vv2.vc1, vv2.v2.t.__pk_increment)})}]), 
      column_values([T_HIDDEN_PK], [column_conv(INT,PS:(11,0),NULL,__values.vc1)], [column_conv(INT,PS:(11,0),NULL,__values.vc2)], [column_conv(INT,PS:(11,
      0),NULL,__values.vc3)])
  1 - output([__values.vc1], [__values.vc2], [__values.vc3]), filter(nil)
      values({6, 1, 1})
insert into vv2 values(6, 1, 1);
EXPLAIN BASIC insert /*+ no_rewrite */ into vv2 values(6, 1, 2);
Query Plan
============================
|ID|OPERATOR          |NAME|
----------------------------
|0 |DISTRIBUTED INSERT|    |
|1 |└─EXPRESSION      |    |
============================
Outputs & filters:
-------------------------------------
  0 - output(nil), filter(nil)
      columns([{vv2: ({t: (vv2.v2.t.__pk_increment, vv2.vc1, vv2.vc2, vv2.vc3)}, {t_idx: (vv2.vc1, vv2.v2.t.__pk_increment)}, {t_idx1: (vv2.vc1, vv2.v2.t.__pk_increment)},
       {t_idx2: (vv2.vc1, vv2.v2.t.__pk_increment)}, {t_idx3: (vv2.vc1, vv2.v2.t.__pk_increment)})}]), 
      column_values([T_HIDDEN_PK], [column_conv(INT,PS:(11,0),NULL,__values.vc1)], [column_conv(INT,PS:(11,0),NULL,__values.vc2)], [column_conv(INT,PS:(11,
      0),NULL,__values.vc3)])
  1 - output([__values.vc1], [__values.vc2], [__values.vc3]), filter(nil)
      values({6, 1, 2})
insert /*+ no_rewrite */ into vv2 values(6, 1, 2);
EXPLAIN BASIC insert into vv3 values(7);
Query Plan
============================
|ID|OPERATOR          |NAME|
----------------------------
|0 |DISTRIBUTED INSERT|    |
|1 |└─EXPRESSION      |    |
============================
Outputs & filters:
-------------------------------------
  0 - output(nil), filter(nil)
      columns([{vv3: ({t: (vv3.v3.t.__pk_increment, vv3.c1, vv3.v3.c2, vv3.v3.c3)}, {t_idx: (vv3.c1, vv3.v3.t.__pk_increment)}, {t_idx1: (vv3.c1, vv3.v3.t.__pk_increment)},
       {t_idx2: (vv3.c1, vv3.v3.t.__pk_increment)}, {t_idx3: (vv3.c1, vv3.v3.t.__pk_increment)})}]), 
      column_values([T_HIDDEN_PK], [column_conv(INT,PS:(11,0),NULL,__values.c1)], [column_conv(INT,PS:(11,0),NULL,cast(NULL, INT(11, 0)))], [column_conv(INT,
      PS:(11,0),NULL,cast(NULL, INT(11, 0)))])
  1 - output([__values.c1]), filter(nil)
      values({7})
insert into vv3 values(7);
EXPLAIN BASIC insert /*+ no_rewrite */ into vv3 values(7);
Query Plan
============================
|ID|OPERATOR          |NAME|
----------------------------
|0 |DISTRIBUTED INSERT|    |
|1 |└─EXPRESSION      |    |
============================
Outputs & filters:
-------------------------------------
  0 - output(nil), filter(nil)
      columns([{vv3: ({t: (vv3.v3.t.__pk_increment, vv3.c1, vv3.v3.c2, vv3.v3.c3)}, {t_idx: (vv3.c1, vv3.v3.t.__pk_increment)}, {t_idx1: (vv3.c1, vv3.v3.t.__pk_increment)},
       {t_idx2: (vv3.c1, vv3.v3.t.__pk_increment)}, {t_idx3: (vv3.c1, vv3.v3.t.__pk_increment)})}]), 
      column_values([T_HIDDEN_PK], [column_conv(INT,PS:(11,0),NULL,__values.c1)], [column_conv(INT,PS:(11,0),NULL,cast(NULL, INT(11, 0)))], [column_conv(INT,
      PS:(11,0),NULL,cast(NULL, INT(11, 0)))])
  1 - output([__values.c1]), filter(nil)
      values({7})
insert /*+ no_rewrite */ into vv3 values(7);
EXPLAIN BASIC select * from t;
Query Plan
=========================
|ID|OPERATOR       |NAME|
-------------------------
|0 |TABLE FULL SCAN|t   |
=========================
Outputs & filters:
-------------------------------------
  0 - output([t.c1], [t.c2], [t.c3]), filter(nil), rowset=16
      access([t.c1], [t.c2], [t.c3]), partitions(p0)
      is_index_back=false, is_global_index=false, 
      range_key([t.__pk_increment]), range(MIN ; MAX)always true
select * from t;
+------+------+------+
| c1   | c2   | c3   |
+------+------+------+
|    1 |    1 |    1 |
|    1 |    1 |    2 |
|    2 |    1 |    1 |
|    2 |    1 |    2 |
|    3 |    1 |    1 |
|    3 |    1 |    2 |
|    4 |    1 |    1 |
|    4 |    1 |    2 |
|    5 |    1 | NULL |
|    5 |    2 | NULL |
|    6 |    1 |    1 |
|    6 |    1 |    2 |
|    7 | NULL | NULL |
|    7 | NULL | NULL |
+------+------+------+

EXPLAIN BASIC insert into t values(1, 1, 1);
Query Plan
============================
|ID|OPERATOR          |NAME|
----------------------------
|0 |DISTRIBUTED INSERT|    |
|1 |└─EXPRESSION      |    |
============================
Outputs & filters:
-------------------------------------
  0 - output(nil), filter(nil)
      columns([{t: ({t: (t.__pk_increment, t.c1, t.c2, t.c3)}, {t_idx1: (t.c1, t.__pk_increment)}, {t_idx3: (t.c1, t.__pk_increment)})}]), 
      column_values([T_HIDDEN_PK], [column_conv(INT,PS:(11,0),NULL,__values.c1)], [column_conv(INT,PS:(11,0),NULL,__values.c2)], [column_conv(INT,PS:(11,
      0),NULL,__values.c3)])
  1 - output([__values.c1], [__values.c2], [__values.c3]), filter(nil)
      values({1, 1, 1})
insert into t values(1, 1, 1);
EXPLAIN BASIC insert /*+ no_rewrite */ into t values(1, 1, 2);
Query Plan
============================
|ID|OPERATOR          |NAME|
----------------------------
|0 |DISTRIBUTED INSERT|    |
|1 |└─EXPRESSION      |    |
============================
Outputs & filters:
-------------------------------------
  0 - output(nil), filter(nil)
      columns([{t: ({t: (t.__pk_increment, t.c1, t.c2, t.c3)}, {t_idx1: (t.c1, t.__pk_increment)}, {t_idx3: (t.c1, t.__pk_increment)})}]), 
      column_values([T_HIDDEN_PK], [column_conv(INT,PS:(11,0),NULL,__values.c1)], [column_conv(INT,PS:(11,0),NULL,__values.c2)], [column_conv(INT,PS:(11,
      0),NULL,__values.c3)])
  1 - output([__values.c1], [__values.c2], [__values.c3]), filter(nil)
      values({1, 1, 2})
insert /*+ no_rewrite */ into t values(1, 1, 2);
EXPLAIN BASIC insert into v1 values(2, 1, 1);
Query Plan
============================
|ID|OPERATOR          |NAME|
----------------------------
|0 |DISTRIBUTED INSERT|    |
|1 |└─EXPRESSION      |    |
============================
Outputs & filters:
-------------------------------------
  0 - output(nil), filter(nil)
      columns([{v1: ({t: (v1.a.__pk_increment, v1.c1, v1.c2, v1.c3)}, {t_idx1: (v1.c1, v1.a.__pk_increment)}, {t_idx3: (v1.c1, v1.a.__pk_increment)})}]),
       
      column_values([T_HIDDEN_PK], [column_conv(INT,PS:(11,0),NULL,__values.c1)], [column_conv(INT,PS:(11,0),NULL,__values.c2)], [column_conv(INT,PS:(11,
      0),NULL,__values.c3)])
  1 - output([__values.c1], [__values.c2], [__values.c3]), filter(nil)
      values({2, 1, 1})
insert into v1 values(2, 1, 1);
EXPLAIN BASIC insert /*+ no_rewrite */ into v1 values(2, 1, 2);
Query Plan
============================
|ID|OPERATOR          |NAME|
----------------------------
|0 |DISTRIBUTED INSERT|    |
|1 |└─EXPRESSION      |    |
============================
Outputs & filters:
-------------------------------------
  0 - output(nil), filter(nil)
      columns([{v1: ({t: (v1.a.__pk_increment, v1.c1, v1.c2, v1.c3)}, {t_idx1: (v1.c1, v1.a.__pk_increment)}, {t_idx3: (v1.c1, v1.a.__pk_increment)})}]),
       
      column_values([T_HIDDEN_PK], [column_conv(INT,PS:(11,0),NULL,__values.c1)], [column_conv(INT,PS:(11,0),NULL,__values.c2)], [column_conv(INT,PS:(11,
      0),NULL,__values.c3)])
  1 - output([__values.c1], [__values.c2], [__values.c3]), filter(nil)
      values({2, 1, 2})
insert /*+ no_rewrite */ into v1 values(2, 1, 2);
EXPLAIN BASIC insert into v2 values(3, 1, 1);
Query Plan
============================
|ID|OPERATOR          |NAME|
----------------------------
|0 |DISTRIBUTED INSERT|    |
|1 |└─EXPRESSION      |    |
============================
Outputs & filters:
-------------------------------------
  0 - output(nil), filter(nil)
      columns([{v2: ({t: (v2.t.__pk_increment, v2.vc1, v2.vc2, v2.vc3)}, {t_idx1: (v2.vc1, v2.t.__pk_increment)}, {t_idx3: (v2.vc1, v2.t.__pk_increment)})}]),
       
      column_values([T_HIDDEN_PK], [column_conv(INT,PS:(11,0),NULL,__values.vc1)], [column_conv(INT,PS:(11,0),NULL,__values.vc2)], [column_conv(INT,PS:(11,
      0),NULL,__values.vc3)])
  1 - output([__values.vc1], [__values.vc2], [__values.vc3]), filter(nil)
      values({3, 1, 1})
insert into v2 values(3, 1, 1);
EXPLAIN BASIC insert /*+ no_rewrite */ into v2 values(3, 1, 2);
Query Plan
============================
|ID|OPERATOR          |NAME|
----------------------------
|0 |DISTRIBUTED INSERT|    |
|1 |└─EXPRESSION      |    |
============================
Outputs & filters:
-------------------------------------
  0 - output(nil), filter(nil)
      columns([{v2: ({t: (v2.t.__pk_increment, v2.vc1, v2.vc2, v2.vc3)}, {t_idx1: (v2.vc1, v2.t.__pk_increment)}, {t_idx3: (v2.vc1, v2.t.__pk_increment)})}]),
       
      column_values([T_HIDDEN_PK], [column_conv(INT,PS:(11,0),NULL,__values.vc1)], [column_conv(INT,PS:(11,0),NULL,__values.vc2)], [column_conv(INT,PS:(11,
      0),NULL,__values.vc3)])
  1 - output([__values.vc1], [__values.vc2], [__values.vc3]), filter(nil)
      values({3, 1, 2})
insert /*+ no_rewrite */ into v2 values(3, 1, 2);
EXPLAIN BASIC insert into v3 values(4, 1, 1);
Query Plan
============================
|ID|OPERATOR          |NAME|
----------------------------
|0 |DISTRIBUTED INSERT|    |
|1 |└─EXPRESSION      |    |
============================
Outputs & filters:
-------------------------------------
  0 - output(nil), filter(nil)
      columns([{v3: ({t: (v3.t.__pk_increment, v3.c1, v3.c2, v3.c3)}, {t_idx1: (v3.c1, v3.t.__pk_increment)}, {t_idx3: (v3.c1, v3.t.__pk_increment)})}]),
       
      column_values([T_HIDDEN_PK], [column_conv(INT,PS:(11,0),NULL,__values.c1)], [column_conv(INT,PS:(11,0),NULL,__values.c2)], [column_conv(INT,PS:(11,
      0),NULL,__values.c3)])
  1 - output([__values.c1], [__values.c2], [__values.c3]), filter(nil)
      values({4, 1, 1})
insert into v3 values(4, 1, 1);
EXPLAIN BASIC insert /*+ no_rewrite */ into v3 values(4, 1, 2);
Query Plan
============================
|ID|OPERATOR          |NAME|
----------------------------
|0 |DISTRIBUTED INSERT|    |
|1 |└─EXPRESSION      |    |
============================
Outputs & filters:
-------------------------------------
  0 - output(nil), filter(nil)
      columns([{v3: ({t: (v3.t.__pk_increment, v3.c1, v3.c2, v3.c3)}, {t_idx1: (v3.c1, v3.t.__pk_increment)}, {t_idx3: (v3.c1, v3.t.__pk_increment)})}]),
       
      column_values([T_HIDDEN_PK], [column_conv(INT,PS:(11,0),NULL,__values.c1)], [column_conv(INT,PS:(11,0),NULL,__values.c2)], [column_conv(INT,PS:(11,
      0),NULL,__values.c3)])
  1 - output([__values.c1], [__values.c2], [__values.c3]), filter(nil)
      values({4, 1, 2})
insert /*+ no_rewrite */ into v3 values(4, 1, 2);
EXPLAIN BASIC insert into vv1 values(5, 1);
Query Plan
============================
|ID|OPERATOR          |NAME|
----------------------------
|0 |DISTRIBUTED INSERT|    |
|1 |└─EXPRESSION      |    |
============================
Outputs & filters:
-------------------------------------
  0 - output(nil), filter(nil)
      columns([{vv1: ({t: (vv1.a.a.__pk_increment, vv1.vvc1, vv1.vvc2, vv1.a.c3)}, {t_idx1: (vv1.vvc1, vv1.a.a.__pk_increment)}, {t_idx3: (vv1.vvc1, vv1.a.a.__pk_increment)})}]),
       
      column_values([T_HIDDEN_PK], [column_conv(INT,PS:(11,0),NULL,__values.vvc1)], [column_conv(INT,PS:(11,0),NULL,__values.vvc2)], [column_conv(INT,PS:(11,
      0),NULL,cast(NULL, INT(11, 0)))])
  1 - output([__values.vvc1], [__values.vvc2]), filter(nil)
      values({5, 1})
insert into vv1 values(5, 1);
EXPLAIN BASIC insert /*+ no_rewrite */ into vv1 values(5, 2);
Query Plan
============================
|ID|OPERATOR          |NAME|
----------------------------
|0 |DISTRIBUTED INSERT|    |
|1 |└─EXPRESSION      |    |
============================
Outputs & filters:
-------------------------------------
  0 - output(nil), filter(nil)
      columns([{vv1: ({t: (vv1.a.a.__pk_increment, vv1.vvc1, vv1.vvc2, vv1.a.c3)}, {t_idx1: (vv1.vvc1, vv1.a.a.__pk_increment)}, {t_idx3: (vv1.vvc1, vv1.a.a.__pk_increment)})}]),
       
      column_values([T_HIDDEN_PK], [column_conv(INT,PS:(11,0),NULL,__values.vvc1)], [column_conv(INT,PS:(11,0),NULL,__values.vvc2)], [column_conv(INT,PS:(11,
      0),NULL,cast(NULL, INT(11, 0)))])
  1 - output([__values.vvc1], [__values.vvc2]), filter(nil)
      values({5, 2})
insert /*+ no_rewrite */ into vv1 values(5, 2);
EXPLAIN BASIC insert into vv2 values(6, 1, 1);
Query Plan
============================
|ID|OPERATOR          |NAME|
----------------------------
|0 |DISTRIBUTED INSERT|    |
|1 |└─EXPRESSION      |    |
============================
Outputs & filters:
-------------------------------------
  0 - output(nil), filter(nil)
      columns([{vv2: ({t: (vv2.v2.t.__pk_increment, vv2.vc1, vv2.vc2, vv2.vc3)}, {t_idx1: (vv2.vc1, vv2.v2.t.__pk_increment)}, {t_idx3: (vv2.vc1, vv2.v2.t.__pk_increment)})}]),
       
      column_values([T_HIDDEN_PK], [column_conv(INT,PS:(11,0),NULL,__values.vc1)], [column_conv(INT,PS:(11,0),NULL,__values.vc2)], [column_conv(INT,PS:(11,
      0),NULL,__values.vc3)])
  1 - output([__values.vc1], [__values.vc2], [__values.vc3]), filter(nil)
      values({6, 1, 1})
insert into vv2 values(6, 1, 1);
EXPLAIN BASIC insert /*+ no_rewrite */ into vv2 values(6, 1, 2);
Query Plan
============================
|ID|OPERATOR          |NAME|
----------------------------
|0 |DISTRIBUTED INSERT|    |
|1 |└─EXPRESSION      |    |
============================
Outputs & filters:
-------------------------------------
  0 - output(nil), filter(nil)
      columns([{vv2: ({t: (vv2.v2.t.__pk_increment, vv2.vc1, vv2.vc2, vv2.vc3)}, {t_idx1: (vv2.vc1, vv2.v2.t.__pk_increment)}, {t_idx3: (vv2.vc1, vv2.v2.t.__pk_increment)})}]),
       
      column_values([T_HIDDEN_PK], [column_conv(INT,PS:(11,0),NULL,__values.vc1)], [column_conv(INT,PS:(11,0),NULL,__values.vc2)], [column_conv(INT,PS:(11,
      0),NULL,__values.vc3)])
  1 - output([__values.vc1], [__values.vc2], [__values.vc3]), filter(nil)
      values({6, 1, 2})
insert /*+ no_rewrite */ into vv2 values(6, 1, 2);
EXPLAIN BASIC insert into vv3 values(7);
Query Plan
============================
|ID|OPERATOR          |NAME|
----------------------------
|0 |DISTRIBUTED INSERT|    |
|1 |└─EXPRESSION      |    |
============================
Outputs & filters:
-------------------------------------
  0 - output(nil), filter(nil)
      columns([{vv3: ({t: (vv3.v3.t.__pk_increment, vv3.c1, vv3.v3.c2, vv3.v3.c3)}, {t_idx1: (vv3.c1, vv3.v3.t.__pk_increment)}, {t_idx3: (vv3.c1, vv3.v3.t.__pk_increment)})}]),
       
      column_values([T_HIDDEN_PK], [column_conv(INT,PS:(11,0),NULL,__values.c1)], [column_conv(INT,PS:(11,0),NULL,cast(NULL, INT(11, 0)))], [column_conv(INT,
      PS:(11,0),NULL,cast(NULL, INT(11, 0)))])
  1 - output([__values.c1]), filter(nil)
      values({7})
insert into vv3 values(7);
EXPLAIN BASIC insert /*+ no_rewrite */ into vv3 values(7);
Query Plan
============================
|ID|OPERATOR          |NAME|
----------------------------
|0 |DISTRIBUTED INSERT|    |
|1 |└─EXPRESSION      |    |
============================
Outputs & filters:
-------------------------------------
  0 - output(nil), filter(nil)
      columns([{vv3: ({t: (vv3.v3.t.__pk_increment, vv3.c1, vv3.v3.c2, vv3.v3.c3)}, {t_idx1: (vv3.c1, vv3.v3.t.__pk_increment)}, {t_idx3: (vv3.c1, vv3.v3.t.__pk_increment)})}]),
       
      column_values([T_HIDDEN_PK], [column_conv(INT,PS:(11,0),NULL,__values.c1)], [column_conv(INT,PS:(11,0),NULL,cast(NULL, INT(11, 0)))], [column_conv(INT,
      PS:(11,0),NULL,cast(NULL, INT(11, 0)))])
  1 - output([__values.c1]), filter(nil)
      values({7})
insert /*+ no_rewrite */ into vv3 values(7);
EXPLAIN BASIC select * from t;
Query Plan
=========================
|ID|OPERATOR       |NAME|
-------------------------
|0 |TABLE FULL SCAN|t   |
=========================
Outputs & filters:
-------------------------------------
  0 - output([t.c1], [t.c2], [t.c3]), filter(nil), rowset=16
      access([t.c1], [t.c2], [t.c3]), partitions(p0)
      is_index_back=false, is_global_index=false, 
      range_key([t.__pk_increment]), range(MIN ; MAX)always true
select * from t;
+------+------+------+
| c1   | c2   | c3   |
+------+------+------+
|    1 |    1 |    1 |
|    1 |    1 |    2 |
|    2 |    1 |    1 |
|    2 |    1 |    2 |
|    3 |    1 |    1 |
|    3 |    1 |    2 |
|    4 |    1 |    1 |
|    4 |    1 |    2 |
|    5 |    1 | NULL |
|    5 |    2 | NULL |
|    6 |    1 |    1 |
|    6 |    1 |    2 |
|    7 | NULL | NULL |
|    7 | NULL | NULL |
+------+------+------+

explain_protocol: 0
##bugfix: 
create table t(c1 int, c2 int) partition by hash(c1) partitions 3;
create view v as select * from t;
insert into t values(1, 1);
insert into t values(2, 2);
insert into t values(3, 3);
select * from t partition (p0);
+------+------+
| c1   | c2   |
+------+------+
|    3 |    3 |
+------+------+
select * from t partition (p1);
+------+------+
| c1   | c2   |
+------+------+
|    1 |    1 |
+------+------+
select * from t partition (p2);
+------+------+
| c1   | c2   |
+------+------+
|    2 |    2 |
+------+------+
select * from t partition (p3);
ERROR HY000: Unkown partition 'p3' in table 't'

select * from v partition (p0);
+------+------+
| c1   | c2   |
+------+------+
|    3 |    3 |
|    1 |    1 |
|    2 |    2 |
+------+------+
select * from v partition (p1);
+------+------+
| c1   | c2   |
+------+------+
|    3 |    3 |
|    1 |    1 |
|    2 |    2 |
+------+------+
select * from v partition (p2);
+------+------+
| c1   | c2   |
+------+------+
|    3 |    3 |
|    1 |    1 |
|    2 |    2 |
+------+------+
select * from v partition (p3);
+------+------+
| c1   | c2   |
+------+------+
|    3 |    3 |
|    1 |    1 |
|    2 |    2 |
+------+------+

insert into t partition(p0) values(1, 1);
ERROR HY000: Found a row not matching the given partition set
insert into v partition(p0) values(1, 1);

insert into t partition(p5) values(0,0);
ERROR HY000: Unkown partition 'p5' in table 't'
insert into v partition(p5) values(0,0);

update t partition (p5) set c2 = c1 + 1;
ERROR HY000: Unkown partition 'p5' in table 't'
update v partition (p5) set c2 = c1 + 1;

##bugfix: 
## test view based on virtual table
set sql_mode='';
drop view if exists `mysql`.`host`;
CREATE VIEW `mysql`.`host` AS select `mysql`.`db`.`host` AS `HOST` from `mysql`.`db`;
insert into mysql.host values(1);
ERROR 0A000: DML operation on Virtual Table/Temporary Table not supported
update mysql.host set host = 1;
ERROR 0A000: DML operation on Virtual Table/Temporary Table not supported
delete from mysql.host;
ERROR 0A000: DML operation on Virtual Table/Temporary Table not supported
drop view `mysql`.`host`;

drop view v;
create view v as select `mysql`.`db`.`host` AS `HOST` from `mysql`.`db`;
create view vv as select * from v;
insert into v values(1);
ERROR 0A000: DML operation on Virtual Table/Temporary Table not supported
insert into vv values(1);
ERROR 0A000: DML operation on Virtual Table/Temporary Table not supported
update v set host = 1;
ERROR 0A000: DML operation on Virtual Table/Temporary Table not supported
update vv set host = 1;
ERROR 0A000: DML operation on Virtual Table/Temporary Table not supported
delete from v;
ERROR 0A000: DML operation on Virtual Table/Temporary Table not supported
delete from vv;
ERROR 0A000: DML operation on Virtual Table/Temporary Table not supported
drop view v, vv;
