result_format: 4
drop table if exists t1;
drop table if exists t2;
drop table if exists t3;
drop table if exists a;
drop table if exists b;
drop table if exists c;
drop view if exists v1;
drop view if exists v2;
drop view if exists v3;
drop view if exists v;
drop view if exists vv;
drop view if exists vvv;
create table t1 (c1 int primary key, c2 int, c3 int);
create table t2 (c1 int primary key, c2 int, c3 int);
insert into t1 (c1, c2, c3) values (1, 1, 1);
insert into t2 (c1, c2, c3) values (1, 1, 1);
create view v1 as select * from t1;
create view v2 as select t1.c1 c1, t1.c2 c2, t1.c3 c3, t2.c1 c4, t2.c2 c5, t2.c3 c6 from t1, t2 where t1.c1 = t2.c1;

create table a (a1 int primary key, a2 int, a3 int);
create table b (b1 int primary key, b2 int, b3 int);
create table c (c1 int primary key, c2 int, c3 int);

explain update v1 set c3 = 4;
Query Plan
=================================================
|ID|OPERATOR         |NAME|EST.ROWS|EST.TIME(us)|
-------------------------------------------------
|0 |UPDATE           |    |1       |34          |
|1 |└─TABLE FULL SCAN|t1  |1       |3           |
=================================================
Outputs & filters:
-------------------------------------
  0 - output(nil), filter(nil)
      table_columns([{t1: ({t1: (t1.c1, t1.c2, t1.c3)})}]),
      update([t1.c3=column_conv(INT,PS:(11,0),NULL,4)])
  1 - output([t1.c1], [t1.c2], [t1.c3]), filter(nil), rowset=16
      access([t1.c1], [t1.c2], [t1.c3]), partitions(p0)
      is_index_back=false, is_global_index=false, 
      range_key([t1.c1]), range(MIN ; MAX)always true
update v1 set c3 = 4;
select * from t1;
+----+------+------+
| c1 | c2   | c3   |
+----+------+------+
|  1 |    1 |    4 |
+----+------+------+

explain update v2 set c2 = 3 where c4 = 1;
Query Plan
=============================================================
|ID|OPERATOR                     |NAME|EST.ROWS|EST.TIME(us)|
-------------------------------------------------------------
|0 |UPDATE                       |    |1       |42          |
|1 |└─NESTED-LOOP JOIN CARTESIAN |    |1       |10          |
|2 |  ├─TABLE GET                |t1  |1       |5           |
|3 |  └─TABLE GET                |t2  |1       |5           |
=============================================================
Outputs & filters:
-------------------------------------
  0 - output(nil), filter(nil)
      table_columns([{t1: ({t1: (t1.c1, t1.c2, t1.c3)})}]),
      update([t1.c2=column_conv(INT,PS:(11,0),NULL,3)])
  1 - output([t1.c1], [t1.c2], [t1.c3]), filter(nil), rowset=16
      conds(nil), nl_params_(nil), use_batch=false
  2 - output([t1.c1], [t1.c2], [t1.c3]), filter(nil), rowset=16
      access([t1.c1], [t1.c2], [t1.c3]), partitions(p0)
      is_index_back=false, is_global_index=false, 
      range_key([t1.c1]), range[1 ; 1], 
      range_cond([t1.c1 = 1])
  3 - output(nil), filter(nil), rowset=16
      access(nil), partitions(p0)
      is_index_back=false, is_global_index=false, 
      range_key([t2.c1]), range[1 ; 1], 
      range_cond([t2.c1 = 1])
update v2 set c2 = 3 where c4 = 1;
select * from v2;
+----+------+------+----+------+------+
| c1 | c2   | c3   | c4 | c5   | c6   |
+----+------+------+----+------+------+
|  1 |    3 |    4 |  1 |    1 |    1 |
+----+------+------+----+------+------+

update t2, v1 set t2.c2 = 3 where t2.c1 = v1.c1;
select * from t2;
+----+------+------+
| c1 | c2   | c3   |
+----+------+------+
|  1 |    3 |    1 |
+----+------+------+

create table t3 (c1 int primary key, c2 int auto_increment, c3 timestamp(6) null DEFAULT CURRENT_TIMESTAMP(6) ON UPDATE CURRENT_TIMESTAMP(6), c4 int);
create view v3 as select * from t3;

insert into v3 (c1, c4) values (1, 1);
select c1, c2, c4 from v3;
+----+----+------+
| c1 | c2 | c4   |
+----+----+------+
|  1 |  1 |    1 |
+----+----+------+

update v3 set c4 = 2;
select c1, c2, c4 from v3;
+----+----+------+
| c1 | c2 | c4   |
+----+----+------+
|  1 |  1 |    2 |
+----+----+------+

+------------+
| time_equal |
+------------+
|          0 |
+------------+
### error code
create view v as select a1, a2 + 1 x from a;
create view vv as select a1, x y from v;
update vv set y = 1;
ERROR HY000: Column 'y' is not updatable
update vv set a1 = 1, y = 1;
ERROR HY000: Column 'y' is not updatable
drop view v;
drop view vv;

create view v as select * from a, b where a1 = b1;
create view vv as select * from v;
update vv set a1 = 1, b1 = 1;
ERROR HY000: Can not modify more than one base table through a join view 'test.vv'
drop view v;
drop view vv;

create view v as select * from a, b where a1 = b1;
create view vv as select * from v;
delete from vv;
ERROR HY000: Can not delete from join view 'test.vv'
drop view v;
drop view vv;

create view v as select 1 a;
create view vv as select * from v;

delete from vv;
ERROR HY000: The target table vv of the DELETE is not updatable
update vv set a = 1;
ERROR HY000: The target table vv of the UPDATE is not updatable
insert into vv set a = 1;
ERROR HY000: The target table vv of the INSERT is not insertable-into
insert into v (a) values (1) on duplicate key update a = 1;
ERROR HY000: The target table v of the INSERT is not insertable-into

drop view v;
drop view vv;

create view v as select a1, a2, a3, count(*) from a;
update v set a2 = 1;
ERROR HY000: The target table v of the UPDATE is not updatable
delete from v;
ERROR HY000: The target table v of the DELETE is not updatable
insert into v (a1, a2, a3) values (1, 1, 1);
ERROR HY000: The target table v of the INSERT is not insertable-into

drop view v;
create view v as select a1, a2, a3, count(*) from a group by 1, 2, 3;
update v set a2 = 1;
ERROR HY000: The target table v of the UPDATE is not updatable
delete from v;
ERROR HY000: The target table v of the DELETE is not updatable
insert into v (a1, a2, a3) values (1, 1, 1);
ERROR HY000: The target table v of the INSERT is not insertable-into

drop view v;
create view v as select a1, a2, a3 from a having count(*) > 2;
update v set a2 = 1;
ERROR HY000: The target table v of the UPDATE is not updatable
delete from v;
ERROR HY000: The target table v of the DELETE is not updatable
insert into v (a1, a2, a3) values (1, 1, 1);
ERROR HY000: The target table v of the INSERT is not insertable-into

drop view v;

create view v as select distinct a1, a2, a3 from a;
update v set a2 = 1;
ERROR HY000: The target table v of the UPDATE is not updatable
delete from v;
ERROR HY000: The target table v of the DELETE is not updatable
insert into v (a1, a2, a3) values (1, 1, 1);
ERROR HY000: The target table v of the INSERT is not insertable-into

drop view v;

create view v as select * from a union select * from b;
update v set a2 = 1;
ERROR HY000: The target table v of the UPDATE is not updatable
delete from v;
ERROR HY000: The target table v of the DELETE is not updatable
insert into v (a1, a2, a3) values (1, 1, 1);
ERROR HY000: The target table v of the INSERT is not insertable-into
drop view v;
create view v as select * from a union all select * from b;
update v set a2 = 1;
ERROR HY000: The target table v of the UPDATE is not updatable
delete from v;
ERROR HY000: The target table v of the DELETE is not updatable
insert into v (a1, a2, a3) values (1, 1, 1);
ERROR HY000: The target table v of the INSERT is not insertable-into

drop view v;

create view v as select * from a limit 2;
update v set a2 = 1;
ERROR HY000: The target table v of the UPDATE is not updatable
delete from v;
ERROR HY000: The target table v of the DELETE is not updatable
insert into v (a1, a2, a3) values (1, 1, 1);
ERROR HY000: The target table v of the INSERT is not insertable-into

drop view v;

## dependent subquery
create view v as select a1, a2, a3,  1 < (select 1 from dual where 3 > b2) x from a, b where a1 = b1;
update v set a2 = 1;
ERROR HY000: The target table v of the UPDATE is not updatable
drop view v;
## nondependent subquery is OK
create view v as select a1, a2, a3,  1 < (select a1 from a limit 1) x from a;
update v set a2 = 1;
drop view v;

create view v as select a.* from a, b where a1 = b1 and a2 > (select max(a3) from a);
update v set a2 = 1;
ERROR HY000: The target table v of the UPDATE is not updatable
drop view v;
create view v as select a.* from a where  a2 > (select max(b3) from b where b2 > a2);
update v set a2 = 1;
drop view v;
create view v as select a.* from a, b where a1 = b1 and a2 > (select max(b3) from b);
update v set a2 = 1;
drop view v;
create view v as select * from a;
create view vv as select * from a;
create view vvv as select v.* from v, b where a1 = b1 and a2 > (select max(a3) from vv);
update vvv set a2 = 1;
ERROR HY000: The target table vvv of the UPDATE is not updatable
drop view vvv;
drop view vv;
drop view v;

create view v as select a.* from a inner join b on a1 = b1 left join c on b2 = c2;
update v set a2 = 1;
ERROR HY000: The target table v of the UPDATE is not updatable
drop view v;
create view v as select b.* from b left join c on b1 = c1;
create view vv as select a.* from a, v where a1 = b1;
update vv set a2 = 1;
drop view v;
drop view vv;
create view v as select a.* from a, b;
update v set a2 = 1;
drop view v;
create view v as select a.* from a, (select * from b)x where a2 = b2;
update v set a2 = 2;
drop view v;

drop table if exists t1;
drop table if exists t2;
drop view if exists v1;
drop view if exists v2;
drop view if exists vv1;
drop view if exists vv2;
create table t1(c1 int, c2 int, c3 int, c4 int generated always as (c1+c2));
create table t2(c1 int, c2 int, c3 int, c4 int generated always as (c1+c2));
create view v1 as select a.c1,a.c2,a.c3,a.c4 from t1 a;
create view v2(vc1,vc2,vc3,vc4) as select c1,c2,c3,c4 from t2;
create view vv1(vvc1,vvc2) as select a.c1,a.c2 from v1 a;
create view vv2 as select vc1,vc2,vc3,vc4 from v2;
insert into t1(c1,c2,c3) values(1,2,3);
insert into t2(c1,c2,c3) values(0,0,0);
update t1,vv2 set t1.c1=10,vv2.vc1 = 1;
select * from t1;
+------+------+------+------+
| c1   | c2   | c3   | c4   |
+------+------+------+------+
|   10 |    2 |    3 |   12 |
+------+------+------+------+
select * from t2;
+------+------+------+------+
| c1   | c2   | c3   | c4   |
+------+------+------+------+
|    1 |    0 |    0 |    1 |
+------+------+------+------+
update vv1 a,v2 b set a.vvc2=20,b.vc2 = 1;
select * from t1;
+------+------+------+------+
| c1   | c2   | c3   | c4   |
+------+------+------+------+
|   10 |   20 |    3 |   30 |
+------+------+------+------+
select * from t2;
+------+------+------+------+
| c1   | c2   | c3   | c4   |
+------+------+------+------+
|    1 |    1 |    0 |    2 |
+------+------+------+------+
update v1 set c4 = 1;
ERROR HY000: The value specified for generated column 'c4' in table 'v1' is not allowed
update v2 set vc4 = 1;
ERROR HY000: The value specified for generated column 'vc4' in table 'v2' is not allowed
update vv2 set vc4 = 1;
ERROR HY000: The value specified for generated column 'vc4' in table 'vv2' is not allowed
drop table t1;
drop table t2;
drop view v1;
drop view v2;
drop view vv1;
drop view vv2;

drop table if exists t;
drop view if exists v3;
drop view if exists vv3;
##partition table, with index
explain_protocol: 1
EXPLAIN BASIC update v1 set c1 = c1 + 1;
Query Plan
============================
|ID|OPERATOR          |NAME|
----------------------------
|0 |DISTRIBUTED UPDATE|    |
|1 |└─TABLE FULL SCAN |a   |
============================
Outputs & filters:
-------------------------------------
  0 - output(nil), filter(nil)
      table_columns([{a: ({t: (a.__pk_increment, a.c1, a.c2, a.c3)}, {t_idx: (a.c1, a.__pk_increment)}, {t_idx1: (a.c1, a.__pk_increment)}, {t_idx2: (a.c1,
       a.__pk_increment)}, {t_idx3: (a.c1, a.__pk_increment)})}]),
      update([a.c1=column_conv(INT,PS:(11,0),NULL,cast(a.c1 + 1, INT(-1, 0)))], [a.__pk_increment=T_HIDDEN_PK])
  1 - output([a.__pk_increment], [a.c1], [a.c2], [a.c3]), filter(nil), rowset=16
      access([a.__pk_increment], [a.c1], [a.c2], [a.c3]), partitions(p0)
      is_index_back=false, is_global_index=false, 
      range_key([a.__pk_increment]), range(MIN ; MAX)always true
update v1 set c1 = c1 + 1;
EXPLAIN BASIC update /*+ no_rewrite */ v1 set c1 = c1 + 1;
Query Plan
=============================
|ID|OPERATOR           |NAME|
-----------------------------
|0 |DISTRIBUTED UPDATE |    |
|1 |└─SUBPLAN SCAN     |v1  |
|2 |  └─TABLE FULL SCAN|a   |
=============================
Outputs & filters:
-------------------------------------
  0 - output(nil), filter(nil)
      table_columns([{v1: ({t: (v1.a.__pk_increment, v1.c1, v1.c2, v1.c3)}, {t_idx: (v1.c1, v1.a.__pk_increment)}, {t_idx1: (v1.c1, v1.a.__pk_increment)},
       {t_idx2: (v1.c1, v1.a.__pk_increment)}, {t_idx3: (v1.c1, v1.a.__pk_increment)}), hash_distinct}]),
      update([v1.c1=column_conv(INT,PS:(11,0),NULL,cast(v1.c1 + 1, INT(-1, 0)))], [v1.a.__pk_increment=T_HIDDEN_PK])
  1 - output([v1.c1], [v1.c2], [v1.c3], [v1.a.__pk_increment]), filter(nil), rowset=16
      access([v1.c1], [v1.c2], [v1.c3], [v1.a.__pk_increment])
  2 - output([a.c1], [a.c2], [a.c3], [a.__pk_increment]), filter(nil), rowset=16
      access([a.__pk_increment], [a.c1], [a.c2], [a.c3]), partitions(p0)
      is_index_back=false, is_global_index=false, 
      range_key([a.__pk_increment]), range(MIN ; MAX)always true
update /*+ no_rewrite */ v1 set c1 = c1 + 1;
EXPLAIN BASIC update v2 set vc2 = vc2 + 1;
Query Plan
===========================
|ID|OPERATOR         |NAME|
---------------------------
|0 |UPDATE           |    |
|1 |└─TABLE FULL SCAN|t   |
===========================
Outputs & filters:
-------------------------------------
  0 - output(nil), filter(nil)
      table_columns([{t: ({t: (t.__pk_increment, t.c1, t.c2, t.c3)})}]),
      update([t.c2=column_conv(INT,PS:(11,0),NULL,cast(t.c2 + 1, INT(-1, 0)))])
  1 - output([t.__pk_increment], [t.c1], [t.c2], [t.c3]), filter(nil), rowset=16
      access([t.__pk_increment], [t.c1], [t.c2], [t.c3]), partitions(p0)
      is_index_back=false, is_global_index=false, 
      range_key([t.__pk_increment]), range(MIN ; MAX)always true
update v2 set vc2 = vc2 + 1;
EXPLAIN BASIC update /*+ no_rewrite */ v2 set vc2 = vc2 + 1;
Query Plan
=============================
|ID|OPERATOR           |NAME|
-----------------------------
|0 |UPDATE             |    |
|1 |└─SUBPLAN SCAN     |v2  |
|2 |  └─TABLE FULL SCAN|t   |
=============================
Outputs & filters:
-------------------------------------
  0 - output(nil), filter(nil)
      table_columns([{v2: ({t: (v2.t.__pk_increment, v2.vc1, v2.vc2, v2.vc3)}), hash_distinct}]),
      update([v2.vc2=column_conv(INT,PS:(11,0),NULL,cast(v2.vc2 + 1, INT(-1, 0)))])
  1 - output([v2.vc2], [v2.vc1], [v2.vc3], [v2.t.__pk_increment]), filter(nil), rowset=16
      access([v2.vc2], [v2.vc1], [v2.vc3], [v2.t.__pk_increment])
  2 - output([t.c1], [t.c2], [t.c3], [t.__pk_increment]), filter(nil), rowset=16
      access([t.__pk_increment], [t.c1], [t.c2], [t.c3]), partitions(p0)
      is_index_back=false, is_global_index=false, 
      range_key([t.__pk_increment]), range(MIN ; MAX)always true
update /*+ no_rewrite */ v2 set vc2 = vc2 + 1;
EXPLAIN BASIC update v3 set c3 = c3 + 1;
Query Plan
===========================
|ID|OPERATOR         |NAME|
---------------------------
|0 |UPDATE           |    |
|1 |└─TABLE FULL SCAN|t   |
===========================
Outputs & filters:
-------------------------------------
  0 - output(nil), filter(nil)
      table_columns([{t: ({t: (t.__pk_increment, t.c1, t.c2, t.c3)})}]),
      update([t.c3=column_conv(INT,PS:(11,0),NULL,cast(t.c3 + 1, INT(-1, 0)))])
  1 - output([t.__pk_increment], [t.c1], [t.c2], [t.c3]), filter(nil), rowset=16
      access([t.__pk_increment], [t.c1], [t.c2], [t.c3]), partitions(p0)
      is_index_back=false, is_global_index=false, 
      range_key([t.__pk_increment]), range(MIN ; MAX)always true
update v3 set c3 = c3 + 1;
EXPLAIN BASIC update /*+ no_rewrite */ v3 set c3 = c3 + 1;
Query Plan
=============================
|ID|OPERATOR           |NAME|
-----------------------------
|0 |UPDATE             |    |
|1 |└─SUBPLAN SCAN     |v3  |
|2 |  └─TABLE FULL SCAN|t   |
=============================
Outputs & filters:
-------------------------------------
  0 - output(nil), filter(nil)
      table_columns([{v3: ({t: (v3.t.__pk_increment, v3.c1, v3.c2, v3.c3)}), hash_distinct}]),
      update([v3.c3=column_conv(INT,PS:(11,0),NULL,cast(v3.c3 + 1, INT(-1, 0)))])
  1 - output([v3.c3], [v3.c1], [v3.c2], [v3.t.__pk_increment]), filter(nil), rowset=16
      access([v3.c3], [v3.c1], [v3.c2], [v3.t.__pk_increment])
  2 - output([t.c1], [t.c2], [t.c3], [t.__pk_increment]), filter(nil), rowset=16
      access([t.__pk_increment], [t.c1], [t.c2], [t.c3]), partitions(p0)
      is_index_back=false, is_global_index=false, 
      range_key([t.__pk_increment]), range(MIN ; MAX)always true
update /*+ no_rewrite */ v3 set c3 = c3 + 1;
EXPLAIN BASIC update vv1 set vvc1 = vvc1 * 2;
Query Plan
============================
|ID|OPERATOR          |NAME|
----------------------------
|0 |DISTRIBUTED UPDATE|    |
|1 |└─TABLE FULL SCAN |a   |
============================
Outputs & filters:
-------------------------------------
  0 - output(nil), filter(nil)
      table_columns([{a: ({t: (a.__pk_increment, a.c1, a.c2, a.c3)}, {t_idx: (a.c1, a.__pk_increment)}, {t_idx1: (a.c1, a.__pk_increment)}, {t_idx2: (a.c1,
       a.__pk_increment)}, {t_idx3: (a.c1, a.__pk_increment)})}]),
      update([a.c1=column_conv(INT,PS:(11,0),NULL,cast(a.c1 * 2, INT(-1, 0)))], [a.__pk_increment=T_HIDDEN_PK])
  1 - output([a.__pk_increment], [a.c1], [a.c2], [a.c3]), filter(nil), rowset=16
      access([a.__pk_increment], [a.c1], [a.c2], [a.c3]), partitions(p0)
      is_index_back=false, is_global_index=false, 
      range_key([a.__pk_increment]), range(MIN ; MAX)always true
update vv1 set vvc1 = vvc1 * 2;
EXPLAIN BASIC update /*+ no_rewrite */ vv1 set vvc1 = vvc1 * 2;
Query Plan
=============================
|ID|OPERATOR           |NAME|
-----------------------------
|0 |DISTRIBUTED UPDATE |    |
|1 |└─SUBPLAN SCAN     |vv1 |
|2 |  └─TABLE FULL SCAN|a   |
=============================
Outputs & filters:
-------------------------------------
  0 - output(nil), filter(nil)
      table_columns([{vv1: ({t: (vv1.a.a.__pk_increment, vv1.vvc1, vv1.vvc2, vv1.a.c3)}, {t_idx: (vv1.vvc1, vv1.a.a.__pk_increment)}, {t_idx1: (vv1.vvc1,
       vv1.a.a.__pk_increment)}, {t_idx2: (vv1.vvc1, vv1.a.a.__pk_increment)}, {t_idx3: (vv1.vvc1, vv1.a.a.__pk_increment)}), hash_distinct}]),
      update([vv1.vvc1=column_conv(INT,PS:(11,0),NULL,cast(vv1.vvc1 * 2, INT(-1, 0)))], [vv1.a.a.__pk_increment=T_HIDDEN_PK])
  1 - output([vv1.vvc1], [vv1.vvc2], [vv1.a.c3], [vv1.a.a.__pk_increment]), filter(nil), rowset=16
      access([vv1.vvc1], [vv1.vvc2], [vv1.a.c3], [vv1.a.a.__pk_increment])
  2 - output([a.c1], [a.c2], [a.c3], [a.__pk_increment]), filter(nil), rowset=16
      access([a.__pk_increment], [a.c1], [a.c2], [a.c3]), partitions(p0)
      is_index_back=false, is_global_index=false, 
      range_key([a.__pk_increment]), range(MIN ; MAX)always true
update /*+ no_rewrite */ vv1 set vvc1 = vvc1 * 2;
EXPLAIN BASIC update vv2 set vc2 = vc2 * 2;
Query Plan
===========================
|ID|OPERATOR         |NAME|
---------------------------
|0 |UPDATE           |    |
|1 |└─TABLE FULL SCAN|t   |
===========================
Outputs & filters:
-------------------------------------
  0 - output(nil), filter(nil)
      table_columns([{t: ({t: (t.__pk_increment, t.c1, t.c2, t.c3)})}]),
      update([t.c2=column_conv(INT,PS:(11,0),NULL,cast(t.c2 * 2, INT(-1, 0)))])
  1 - output([t.__pk_increment], [t.c1], [t.c2], [t.c3]), filter(nil), rowset=16
      access([t.__pk_increment], [t.c1], [t.c2], [t.c3]), partitions(p0)
      is_index_back=false, is_global_index=false, 
      range_key([t.__pk_increment]), range(MIN ; MAX)always true
update vv2 set vc2 = vc2 * 2;
EXPLAIN BASIC update /*+ no_rewrite */ vv2 set vc2 = vc2 * 2;
Query Plan
=============================
|ID|OPERATOR           |NAME|
-----------------------------
|0 |UPDATE             |    |
|1 |└─SUBPLAN SCAN     |vv2 |
|2 |  └─TABLE FULL SCAN|t   |
=============================
Outputs & filters:
-------------------------------------
  0 - output(nil), filter(nil)
      table_columns([{vv2: ({t: (vv2.v2.t.__pk_increment, vv2.vc1, vv2.vc2, vv2.vc3)}), hash_distinct}]),
      update([vv2.vc2=column_conv(INT,PS:(11,0),NULL,cast(vv2.vc2 * 2, INT(-1, 0)))])
  1 - output([vv2.vc2], [vv2.vc1], [vv2.vc3], [vv2.v2.t.__pk_increment]), filter(nil), rowset=16
      access([vv2.vc2], [vv2.vc1], [vv2.vc3], [vv2.v2.t.__pk_increment])
  2 - output([t.c1], [t.c2], [t.c3], [t.__pk_increment]), filter(nil), rowset=16
      access([t.__pk_increment], [t.c1], [t.c2], [t.c3]), partitions(p0)
      is_index_back=false, is_global_index=false, 
      range_key([t.__pk_increment]), range(MIN ; MAX)always true
update /*+ no_rewrite */ vv2 set vc2 = vc2 * 2;
EXPLAIN BASIC update vv3 set c3 = c3 * 2;
Query Plan
===========================
|ID|OPERATOR         |NAME|
---------------------------
|0 |UPDATE           |    |
|1 |└─TABLE FULL SCAN|t   |
===========================
Outputs & filters:
-------------------------------------
  0 - output(nil), filter(nil)
      table_columns([{t: ({t: (t.__pk_increment, t.c1, t.c2, t.c3)})}]),
      update([t.c3=column_conv(INT,PS:(11,0),NULL,cast(t.c3 * 2, INT(-1, 0)))])
  1 - output([t.__pk_increment], [t.c1], [t.c2], [t.c3]), filter(nil), rowset=16
      access([t.__pk_increment], [t.c1], [t.c2], [t.c3]), partitions(p0)
      is_index_back=false, is_global_index=false, 
      range_key([t.__pk_increment]), range(MIN ; MAX)always true
update vv3 set c3 = c3 * 2;
EXPLAIN BASIC update /*+ no_rewrite */ vv3 set c3 = c3 * 2;
Query Plan
=============================
|ID|OPERATOR           |NAME|
-----------------------------
|0 |UPDATE             |    |
|1 |└─SUBPLAN SCAN     |vv3 |
|2 |  └─TABLE FULL SCAN|t   |
=============================
Outputs & filters:
-------------------------------------
  0 - output(nil), filter(nil)
      table_columns([{vv3: ({t: (vv3.v3.t.__pk_increment, vv3.v3.c1, vv3.v3.c2, vv3.c3)}), hash_distinct}]),
      update([vv3.c3=column_conv(INT,PS:(11,0),NULL,cast(vv3.c3 * 2, INT(-1, 0)))])
  1 - output([vv3.c3], [vv3.v3.c1], [vv3.v3.c2], [vv3.v3.t.__pk_increment]), filter(nil), rowset=16
      access([vv3.c3], [vv3.v3.c1], [vv3.v3.c2], [vv3.v3.t.__pk_increment])
  2 - output([t.c3], [t.c1], [t.c2], [t.__pk_increment]), filter(nil), rowset=16
      access([t.__pk_increment], [t.c1], [t.c2], [t.c3]), partitions(p0)
      is_index_back=false, is_global_index=false, 
      range_key([t.__pk_increment]), range(MIN ; MAX)always true
update /*+ no_rewrite */ vv3 set c3 = c3 * 2;
EXPLAIN BASIC select * from t;
Query Plan
=========================
|ID|OPERATOR       |NAME|
-------------------------
|0 |TABLE FULL SCAN|t   |
=========================
Outputs & filters:
-------------------------------------
  0 - output([t.c1], [t.c2], [t.c3]), filter(nil), rowset=16
      access([t.c1], [t.c2], [t.c3]), partitions(p0)
      is_index_back=false, is_global_index=false, 
      range_key([t.__pk_increment]), range(MIN ; MAX)always true
select * from t;
+------+------+------+
| c1   | c2   | c3   |
+------+------+------+
|   12 |   12 |   12 |
+------+------+------+

EXPLAIN BASIC update v1 set c1 = c1 + 1;
Query Plan
============================
|ID|OPERATOR          |NAME|
----------------------------
|0 |DISTRIBUTED UPDATE|    |
|1 |└─TABLE FULL SCAN |a   |
============================
Outputs & filters:
-------------------------------------
  0 - output(nil), filter(nil)
      table_columns([{a: ({t: (a.__pk_increment, a.c1, a.c2, a.c3)}, {t_idx1: (a.c1, a.__pk_increment)}, {t_idx3: (a.c1, a.__pk_increment)})}]),
      update([a.c1=column_conv(INT,PS:(11,0),NULL,cast(a.c1 + 1, INT(-1, 0)))])
  1 - output([a.__pk_increment], [a.c1], [a.c2], [a.c3]), filter(nil), rowset=16
      access([a.__pk_increment], [a.c1], [a.c2], [a.c3]), partitions(p0)
      is_index_back=false, is_global_index=false, 
      range_key([a.__pk_increment]), range(MIN ; MAX)always true
update v1 set c1 = c1 + 1;
EXPLAIN BASIC update /*+ no_rewrite */ v1 set c1 = c1 + 1;
Query Plan
=============================
|ID|OPERATOR           |NAME|
-----------------------------
|0 |DISTRIBUTED UPDATE |    |
|1 |└─SUBPLAN SCAN     |v1  |
|2 |  └─TABLE FULL SCAN|a   |
=============================
Outputs & filters:
-------------------------------------
  0 - output(nil), filter(nil)
      table_columns([{v1: ({t: (v1.a.__pk_increment, v1.c1, v1.c2, v1.c3)}, {t_idx1: (v1.c1, v1.a.__pk_increment)}, {t_idx3: (v1.c1, v1.a.__pk_increment)})}]),
      
      update([v1.c1=column_conv(INT,PS:(11,0),NULL,cast(v1.c1 + 1, INT(-1, 0)))])
  1 - output([v1.c1], [v1.c2], [v1.c3], [v1.a.__pk_increment]), filter(nil), rowset=16
      access([v1.c1], [v1.c2], [v1.c3], [v1.a.__pk_increment])
  2 - output([a.c1], [a.c2], [a.c3], [a.__pk_increment]), filter(nil), rowset=16
      access([a.__pk_increment], [a.c1], [a.c2], [a.c3]), partitions(p0)
      is_index_back=false, is_global_index=false, 
      range_key([a.__pk_increment]), range(MIN ; MAX)always true
update /*+ no_rewrite */ v1 set c1 = c1 + 1;
EXPLAIN BASIC update v2 set vc2 = vc2 + 1;
Query Plan
===========================
|ID|OPERATOR         |NAME|
---------------------------
|0 |UPDATE           |    |
|1 |└─TABLE FULL SCAN|t   |
===========================
Outputs & filters:
-------------------------------------
  0 - output(nil), filter(nil)
      table_columns([{t: ({t: (t.__pk_increment, t.c1, t.c2, t.c3)})}]),
      update([t.c2=column_conv(INT,PS:(11,0),NULL,cast(t.c2 + 1, INT(-1, 0)))])
  1 - output([t.__pk_increment], [t.c1], [t.c2], [t.c3]), filter(nil), rowset=16
      access([t.__pk_increment], [t.c1], [t.c2], [t.c3]), partitions(p0)
      is_index_back=false, is_global_index=false, 
      range_key([t.__pk_increment]), range(MIN ; MAX)always true
update v2 set vc2 = vc2 + 1;
EXPLAIN BASIC update /*+ no_rewrite */ v2 set vc2 = vc2 + 1;
Query Plan
=============================
|ID|OPERATOR           |NAME|
-----------------------------
|0 |UPDATE             |    |
|1 |└─SUBPLAN SCAN     |v2  |
|2 |  └─TABLE FULL SCAN|t   |
=============================
Outputs & filters:
-------------------------------------
  0 - output(nil), filter(nil)
      table_columns([{v2: ({t: (v2.t.__pk_increment, v2.vc1, v2.vc2, v2.vc3)})}]),
      update([v2.vc2=column_conv(INT,PS:(11,0),NULL,cast(v2.vc2 + 1, INT(-1, 0)))])
  1 - output([v2.vc2], [v2.vc1], [v2.vc3], [v2.t.__pk_increment]), filter(nil), rowset=16
      access([v2.vc2], [v2.vc1], [v2.vc3], [v2.t.__pk_increment])
  2 - output([t.c1], [t.c2], [t.c3], [t.__pk_increment]), filter(nil), rowset=16
      access([t.__pk_increment], [t.c1], [t.c2], [t.c3]), partitions(p0)
      is_index_back=false, is_global_index=false, 
      range_key([t.__pk_increment]), range(MIN ; MAX)always true
update /*+ no_rewrite */ v2 set vc2 = vc2 + 1;
EXPLAIN BASIC update v3 set c3 = c3 + 1;
Query Plan
===========================
|ID|OPERATOR         |NAME|
---------------------------
|0 |UPDATE           |    |
|1 |└─TABLE FULL SCAN|t   |
===========================
Outputs & filters:
-------------------------------------
  0 - output(nil), filter(nil)
      table_columns([{t: ({t: (t.__pk_increment, t.c1, t.c2, t.c3)})}]),
      update([t.c3=column_conv(INT,PS:(11,0),NULL,cast(t.c3 + 1, INT(-1, 0)))])
  1 - output([t.__pk_increment], [t.c1], [t.c2], [t.c3]), filter(nil), rowset=16
      access([t.__pk_increment], [t.c1], [t.c2], [t.c3]), partitions(p0)
      is_index_back=false, is_global_index=false, 
      range_key([t.__pk_increment]), range(MIN ; MAX)always true
update v3 set c3 = c3 + 1;
EXPLAIN BASIC update /*+ no_rewrite */ v3 set c3 = c3 + 1;
Query Plan
=============================
|ID|OPERATOR           |NAME|
-----------------------------
|0 |UPDATE             |    |
|1 |└─SUBPLAN SCAN     |v3  |
|2 |  └─TABLE FULL SCAN|t   |
=============================
Outputs & filters:
-------------------------------------
  0 - output(nil), filter(nil)
      table_columns([{v3: ({t: (v3.t.__pk_increment, v3.c1, v3.c2, v3.c3)})}]),
      update([v3.c3=column_conv(INT,PS:(11,0),NULL,cast(v3.c3 + 1, INT(-1, 0)))])
  1 - output([v3.c3], [v3.c1], [v3.c2], [v3.t.__pk_increment]), filter(nil), rowset=16
      access([v3.c3], [v3.c1], [v3.c2], [v3.t.__pk_increment])
  2 - output([t.c1], [t.c2], [t.c3], [t.__pk_increment]), filter(nil), rowset=16
      access([t.__pk_increment], [t.c1], [t.c2], [t.c3]), partitions(p0)
      is_index_back=false, is_global_index=false, 
      range_key([t.__pk_increment]), range(MIN ; MAX)always true
update /*+ no_rewrite */ v3 set c3 = c3 + 1;
EXPLAIN BASIC update vv1 set vvc1 = vvc1 * 2;
Query Plan
============================
|ID|OPERATOR          |NAME|
----------------------------
|0 |DISTRIBUTED UPDATE|    |
|1 |└─TABLE FULL SCAN |a   |
============================
Outputs & filters:
-------------------------------------
  0 - output(nil), filter(nil)
      table_columns([{a: ({t: (a.__pk_increment, a.c1, a.c2, a.c3)}, {t_idx1: (a.c1, a.__pk_increment)}, {t_idx3: (a.c1, a.__pk_increment)})}]),
      update([a.c1=column_conv(INT,PS:(11,0),NULL,cast(a.c1 * 2, INT(-1, 0)))])
  1 - output([a.__pk_increment], [a.c1], [a.c2], [a.c3]), filter(nil), rowset=16
      access([a.__pk_increment], [a.c1], [a.c2], [a.c3]), partitions(p0)
      is_index_back=false, is_global_index=false, 
      range_key([a.__pk_increment]), range(MIN ; MAX)always true
update vv1 set vvc1 = vvc1 * 2;
EXPLAIN BASIC update /*+ no_rewrite */ vv1 set vvc1 = vvc1 * 2;
Query Plan
=============================
|ID|OPERATOR           |NAME|
-----------------------------
|0 |DISTRIBUTED UPDATE |    |
|1 |└─SUBPLAN SCAN     |vv1 |
|2 |  └─TABLE FULL SCAN|a   |
=============================
Outputs & filters:
-------------------------------------
  0 - output(nil), filter(nil)
      table_columns([{vv1: ({t: (vv1.a.a.__pk_increment, vv1.vvc1, vv1.vvc2, vv1.a.c3)}, {t_idx1: (vv1.vvc1, vv1.a.a.__pk_increment)}, {t_idx3: (vv1.vvc1,
       vv1.a.a.__pk_increment)})}]),
      update([vv1.vvc1=column_conv(INT,PS:(11,0),NULL,cast(vv1.vvc1 * 2, INT(-1, 0)))])
  1 - output([vv1.vvc1], [vv1.vvc2], [vv1.a.c3], [vv1.a.a.__pk_increment]), filter(nil), rowset=16
      access([vv1.vvc1], [vv1.vvc2], [vv1.a.c3], [vv1.a.a.__pk_increment])
  2 - output([a.c1], [a.c2], [a.c3], [a.__pk_increment]), filter(nil), rowset=16
      access([a.__pk_increment], [a.c1], [a.c2], [a.c3]), partitions(p0)
      is_index_back=false, is_global_index=false, 
      range_key([a.__pk_increment]), range(MIN ; MAX)always true
update /*+ no_rewrite */ vv1 set vvc1 = vvc1 * 2;
EXPLAIN BASIC update vv2 set vc2 = vc2 * 2;
Query Plan
===========================
|ID|OPERATOR         |NAME|
---------------------------
|0 |UPDATE           |    |
|1 |└─TABLE FULL SCAN|t   |
===========================
Outputs & filters:
-------------------------------------
  0 - output(nil), filter(nil)
      table_columns([{t: ({t: (t.__pk_increment, t.c1, t.c2, t.c3)})}]),
      update([t.c2=column_conv(INT,PS:(11,0),NULL,cast(t.c2 * 2, INT(-1, 0)))])
  1 - output([t.__pk_increment], [t.c1], [t.c2], [t.c3]), filter(nil), rowset=16
      access([t.__pk_increment], [t.c1], [t.c2], [t.c3]), partitions(p0)
      is_index_back=false, is_global_index=false, 
      range_key([t.__pk_increment]), range(MIN ; MAX)always true
update vv2 set vc2 = vc2 * 2;
EXPLAIN BASIC update /*+ no_rewrite */ vv2 set vc2 = vc2 * 2;
Query Plan
=============================
|ID|OPERATOR           |NAME|
-----------------------------
|0 |UPDATE             |    |
|1 |└─SUBPLAN SCAN     |vv2 |
|2 |  └─TABLE FULL SCAN|t   |
=============================
Outputs & filters:
-------------------------------------
  0 - output(nil), filter(nil)
      table_columns([{vv2: ({t: (vv2.v2.t.__pk_increment, vv2.vc1, vv2.vc2, vv2.vc3)})}]),
      update([vv2.vc2=column_conv(INT,PS:(11,0),NULL,cast(vv2.vc2 * 2, INT(-1, 0)))])
  1 - output([vv2.vc2], [vv2.vc1], [vv2.vc3], [vv2.v2.t.__pk_increment]), filter(nil), rowset=16
      access([vv2.vc2], [vv2.vc1], [vv2.vc3], [vv2.v2.t.__pk_increment])
  2 - output([t.c1], [t.c2], [t.c3], [t.__pk_increment]), filter(nil), rowset=16
      access([t.__pk_increment], [t.c1], [t.c2], [t.c3]), partitions(p0)
      is_index_back=false, is_global_index=false, 
      range_key([t.__pk_increment]), range(MIN ; MAX)always true
update /*+ no_rewrite */ vv2 set vc2 = vc2 * 2;
EXPLAIN BASIC update vv3 set c3 = c3 * 2;
Query Plan
===========================
|ID|OPERATOR         |NAME|
---------------------------
|0 |UPDATE           |    |
|1 |└─TABLE FULL SCAN|t   |
===========================
Outputs & filters:
-------------------------------------
  0 - output(nil), filter(nil)
      table_columns([{t: ({t: (t.__pk_increment, t.c1, t.c2, t.c3)})}]),
      update([t.c3=column_conv(INT,PS:(11,0),NULL,cast(t.c3 * 2, INT(-1, 0)))])
  1 - output([t.__pk_increment], [t.c1], [t.c2], [t.c3]), filter(nil), rowset=16
      access([t.__pk_increment], [t.c1], [t.c2], [t.c3]), partitions(p0)
      is_index_back=false, is_global_index=false, 
      range_key([t.__pk_increment]), range(MIN ; MAX)always true
update vv3 set c3 = c3 * 2;
EXPLAIN BASIC update /*+ no_rewrite */ vv3 set c3 = c3 * 2;
Query Plan
=============================
|ID|OPERATOR           |NAME|
-----------------------------
|0 |UPDATE             |    |
|1 |└─SUBPLAN SCAN     |vv3 |
|2 |  └─TABLE FULL SCAN|t   |
=============================
Outputs & filters:
-------------------------------------
  0 - output(nil), filter(nil)
      table_columns([{vv3: ({t: (vv3.v3.t.__pk_increment, vv3.v3.c1, vv3.v3.c2, vv3.c3)})}]),
      update([vv3.c3=column_conv(INT,PS:(11,0),NULL,cast(vv3.c3 * 2, INT(-1, 0)))])
  1 - output([vv3.c3], [vv3.v3.c1], [vv3.v3.c2], [vv3.v3.t.__pk_increment]), filter(nil), rowset=16
      access([vv3.c3], [vv3.v3.c1], [vv3.v3.c2], [vv3.v3.t.__pk_increment])
  2 - output([t.c3], [t.c1], [t.c2], [t.__pk_increment]), filter(nil), rowset=16
      access([t.__pk_increment], [t.c1], [t.c2], [t.c3]), partitions(p0)
      is_index_back=false, is_global_index=false, 
      range_key([t.__pk_increment]), range(MIN ; MAX)always true
update /*+ no_rewrite */ vv3 set c3 = c3 * 2;
EXPLAIN BASIC select * from t;
Query Plan
=========================
|ID|OPERATOR       |NAME|
-------------------------
|0 |TABLE FULL SCAN|t   |
=========================
Outputs & filters:
-------------------------------------
  0 - output([t.c1], [t.c2], [t.c3]), filter(nil), rowset=16
      access([t.c1], [t.c2], [t.c3]), partitions(p0)
      is_index_back=false, is_global_index=false, 
      range_key([t.__pk_increment]), range(MIN ; MAX)always true
select * from t;
+------+------+------+
| c1   | c2   | c3   |
+------+------+------+
|   12 |   12 |   12 |
+------+------+------+

