drop database with_check_option;
create database with_check_option;
use with_check_option;
######################  insert  ##################################
create table t(c1 int, c2 int);
insert into t values(1, 1);
insert into t values(2, 2);
insert into t values(3, 3);
create or replace view v as select * from t with check option;
insert into v values(0, 0);
insert into v values(100, 100);
create or replace view v as select * from t where c1 > 2 with check option;
insert into v values(3, 3);
insert into v values(2, 2);
ERROR HY000: CHECK OPTION failed
insert into v select 3, 3 from dual;
insert into v select 2, 2 from dual;
ERROR HY000: CHECK OPTION failed
create or replace view v as select * from t where c1 + c2 > 5 with check option;
insert into v values(3, 3);
insert into v values(2, 2);
ERROR HY000: CHECK OPTION failed
insert into v select 3, 3 from dual;
insert into v select 2, 2 from dual;
ERROR HY000: CHECK OPTION failed
create or replace view v as select * from t A where c1 > 2 with check option;
insert into v values(3, 3);
insert into v values(2, 2);
ERROR HY000: CHECK OPTION failed
create or replace view v as select * from (select * from t) A where c1 > 2 with check option;
insert into v values(3, 3);
ERROR HY000: The target table v of the INSERT is not insertable-into
create or replace view v as select * from t where 1 > 2 with check option;
insert into v values(0, 0);
ERROR HY000: CHECK OPTION failed
insert into v values(100, 100);
ERROR HY000: CHECK OPTION failed
######################  update  ##################################
delete from t;
insert into t values(1, 1);
insert into t values(2, 2);
insert into t values(3, 3);
create or replace view v as select * from t with check option;
update v set c2 = c2 + 1;
create or replace view v as select * from t where c2 < 3 with check option;
select * from t;
c1	c2
1	2
2	3
3	4
update v set c2 = c2 + 1;
ERROR HY000: CHECK OPTION failed
select * from t;
c1	c2
1	2
2	3
3	4
update v set c2 = c2 - 1;
create or replace view v as select * from t where c1 + c2 < 5 with check option;
delete from t;
insert into t values(1, 1);
insert into t values(2, 2);
insert into t values(3, 3);
update v set c2 = c2 + 1;
ERROR HY000: CHECK OPTION failed
update v set c2 = c2 - 1;
select * from t;
c1	c2
1	0
2	1
3	3
create or replace view v as select * from t A where c2 < 3 with check option;
update v set c2 = 3;
ERROR HY000: CHECK OPTION failed
update v set c2 = 2;
update (select * from t) set c2 = 3;
ERROR HY000: The target table ANONYMOUS_VIEW1 of the UPDATE is not updatable
update (select * from t) A set c2 = 2;
ERROR HY000: The target table A of the UPDATE is not updatable
update (select * from v) set c2 = 3;
ERROR HY000: The target table ANONYMOUS_VIEW1 of the UPDATE is not updatable
update (select * from v) A set c2 = 3;
ERROR HY000: The target table A of the UPDATE is not updatable
update (select * from v A) set c2 = 3;
ERROR HY000: The target table ANONYMOUS_VIEW1 of the UPDATE is not updatable
create or replace view v as select * from (select * from t) A where c2 > 1 with check option;
update v set c2 = 3;
update v set c2 = 0;
ERROR HY000: CHECK OPTION failed
######################  replace  #################################
delete from t;
replace into t values(1, 1);
replace into t values(2, 2);
replace into t values(3, 3);
create or replace view v as select * from t with check option;
replace into v values(0, 0);
replace into v values(100, 100);
create or replace view v as select * from t where c2 > 2 with check option;
replace into v values(3, 3);
replace into v values(2, 2);
ERROR HY000: CHECK OPTION failed
replace into v select 3, 3;
replace into v select 2, 2;
ERROR HY000: CHECK OPTION failed
create or replace view v as select * from t where c1 + c2 > 5 with check option;
replace into v values(3, 3);
replace into v values(2, 2);
ERROR HY000: CHECK OPTION failed
replace into v select 3, 3;
replace into v select 2, 2;
ERROR HY000: CHECK OPTION failed
create or replace view v as select * from t A where c2 > 2 with check option;
replace into v values(3, 3);
replace into v values(2, 2);
ERROR HY000: CHECK OPTION failed
create or replace view v as select * from (select * from t) A where c2 > 2 with check option;
replace into v values(3, 3);
ERROR HY000: The target table v of the INSERT is not insertable-into
create or replace view v as select * from t where 1 > 2 with check option;
replace into v values(0, 0);
ERROR HY000: CHECK OPTION failed
replace into v values(100, 100);
ERROR HY000: CHECK OPTION failed
######################  generated column  ##############################
drop table t;
create table t(c1 int, c2 int, c3 int generated always as (c1 + c2));
insert into t(c1, c2) values(1, 1);
insert into t(c1, c2) values(2, 2);
insert into t(c1, c2) values(3, 3);
create or replace view v as select * from t where c3 > 3 with check option;
insert into v(c1, c2) values(1, 1);
ERROR HY000: CHECK OPTION failed
insert into v(c1, c2) values(2, 2);
update v set c2 = 0;
ERROR HY000: CHECK OPTION failed
update v set c2 = 3;
replace into v(c1, c2) values(1, 1);
ERROR HY000: CHECK OPTION failed
replace into v(c1, c2) values(2, 2);
######################  nested view  ###############################
create table t1(a int);
insert into t1 values(0), (1), (2), (3);
CREATE OR REPLACE VIEW v1 AS SELECT * FROM t1 WHERE a < 3;
CREATE OR REPLACE VIEW v2 AS SELECT * FROM v1 WHERE a < 3 WITH CHECK OPTION;
CREATE OR REPLACE VIEW v1_1 AS SELECT * FROM v1 WHERE a > 0 WITH LOCAL CHECK OPTION;
CREATE OR REPLACE VIEW v1_2 AS SELECT * FROM v1 WHERE a > 0 WITH CHECK OPTION;
CREATE OR REPLACE VIEW v1_3 AS SELECT * FROM v1 WHERE a > 0;
insert into v1_1 values(-1);
ERROR HY000: CHECK OPTION failed
insert into v1_1 values(1);
insert into v1_1 values(3);
insert into v1_2 values(-1);
ERROR HY000: CHECK OPTION failed
insert into v1_2 values(1);
insert into v1_2 values(3);
ERROR HY000: CHECK OPTION failed
insert into v1_3 values(-1);
insert into v1_3 values(1);
insert into v1_3 values(3);
CREATE OR REPLACE VIEW v1_1_1 AS SELECT * FROM v1_1 WHERE a != 1 WITH LOCAL CHECK OPTION;
CREATE OR REPLACE VIEW v1_1_2 AS SELECT * FROM v1_1 WHERE a != 1 WITH CHECK OPTION;
CREATE OR REPLACE VIEW v1_1_3 AS SELECT * FROM v1_1 WHERE a != 1;
insert into v1_1_1 values(-1);
ERROR HY000: CHECK OPTION failed
insert into v1_1_1 values(1);
ERROR HY000: CHECK OPTION failed
insert into v1_1_1 values(3);
insert into v1_1_2 values(-1);
ERROR HY000: CHECK OPTION failed
insert into v1_1_2 values(1);
ERROR HY000: CHECK OPTION failed
insert into v1_1_2 values(3);
ERROR HY000: CHECK OPTION failed
insert into v1_1_3 values(-1);
ERROR HY000: CHECK OPTION failed
insert into v1_1_3 values(1);
insert into v1_1_3 values(3);
CREATE OR REPLACE VIEW v1_2_1 AS SELECT * FROM v1_2 WHERE a != 1 WITH LOCAL CHECK OPTION;
CREATE OR REPLACE VIEW v1_2_2 AS SELECT * FROM v1_2 WHERE a != 1 WITH CHECK OPTION;
CREATE OR REPLACE VIEW v1_2_3 AS SELECT * FROM v1_2 WHERE a != 1;
insert into v1_2_1 values(-1);
ERROR HY000: CHECK OPTION failed
insert into v1_2_1 values(1);
ERROR HY000: CHECK OPTION failed
insert into v1_2_1 values(3);
ERROR HY000: CHECK OPTION failed
insert into v1_2_2 values(-1);
ERROR HY000: CHECK OPTION failed
insert into v1_2_2 values(1);
ERROR HY000: CHECK OPTION failed
insert into v1_2_2 values(3);
ERROR HY000: CHECK OPTION failed
insert into v1_2_3 values(-1);
ERROR HY000: CHECK OPTION failed
insert into v1_2_3 values(1);
insert into v1_2_3 values(3);
ERROR HY000: CHECK OPTION failed
CREATE OR REPLACE VIEW v1_3_1 AS SELECT * FROM v1_3 WHERE a != 1 WITH LOCAL CHECK OPTION;
CREATE OR REPLACE VIEW v1_3_2 AS SELECT * FROM v1_3 WHERE a != 1 WITH CHECK OPTION;
CREATE OR REPLACE VIEW v1_3_3 AS SELECT * FROM v1_3 WHERE a != 1;
insert into v1_3_1 values(-1);
insert into v1_3_1 values(1);
ERROR HY000: CHECK OPTION failed
insert into v1_3_1 values(3);
insert into v1_3_2 values(-1);
ERROR HY000: CHECK OPTION failed
insert into v1_3_2 values(1);
ERROR HY000: CHECK OPTION failed
insert into v1_3_2 values(3);
ERROR HY000: CHECK OPTION failed
insert into v1_3_3 values(-1);
insert into v1_3_3 values(1);
insert into v1_3_3 values(3);
CREATE OR REPLACE VIEW v2_1 AS SELECT * FROM v2 WHERE a > 0 WITH LOCAL CHECK OPTION;
CREATE OR REPLACE VIEW v2_2 AS SELECT * FROM v2 WHERE a > 0 WITH CHECK OPTION;
CREATE OR REPLACE VIEW v2_3 AS SELECT * FROM v2 WHERE a > 0;
insert into v2_1 values(-1);
ERROR HY000: CHECK OPTION failed
insert into v2_1 values(1);
insert into v2_1 values(3);
ERROR HY000: CHECK OPTION failed
insert into v2_2 values(-1);
ERROR HY000: CHECK OPTION failed
insert into v2_2 values(1);
insert into v2_2 values(3);
ERROR HY000: CHECK OPTION failed
insert into v2_3 values(-1);
insert into v2_3 values(1);
insert into v2_3 values(3);
ERROR HY000: CHECK OPTION failed
CREATE OR REPLACE VIEW v2_1_1 AS SELECT * FROM v2_1 WHERE a != 1 WITH LOCAL CHECK OPTION;
CREATE OR REPLACE VIEW v2_1_2 AS SELECT * FROM v2_1 WHERE a != 1 WITH CHECK OPTION;
CREATE OR REPLACE VIEW v2_1_3 AS SELECT * FROM v2_1 WHERE a != 1;
insert into v2_1_1 values(-1);
ERROR HY000: CHECK OPTION failed
insert into v2_1_1 values(1);
ERROR HY000: CHECK OPTION failed
insert into v2_1_1 values(3);
ERROR HY000: CHECK OPTION failed
insert into v2_1_2 values(-1);
ERROR HY000: CHECK OPTION failed
insert into v2_1_2 values(1);
ERROR HY000: CHECK OPTION failed
insert into v2_1_2 values(3);
ERROR HY000: CHECK OPTION failed
insert into v2_1_3 values(-1);
ERROR HY000: CHECK OPTION failed
insert into v2_1_3 values(1);
insert into v2_1_3 values(3);
ERROR HY000: CHECK OPTION failed
CREATE OR REPLACE VIEW v2_2_1 AS SELECT * FROM v2_2 WHERE a != 1 WITH LOCAL CHECK OPTION;
CREATE OR REPLACE VIEW v2_2_2 AS SELECT * FROM v2_2 WHERE a != 1 WITH CHECK OPTION;
CREATE OR REPLACE VIEW v2_2_3 AS SELECT * FROM v2_2 WHERE a != 1;
insert into v2_2_1 values(-1);
ERROR HY000: CHECK OPTION failed
insert into v2_2_1 values(1);
ERROR HY000: CHECK OPTION failed
insert into v2_2_1 values(3);
ERROR HY000: CHECK OPTION failed
insert into v2_2_2 values(-1);
ERROR HY000: CHECK OPTION failed
insert into v2_2_2 values(1);
ERROR HY000: CHECK OPTION failed
insert into v2_2_2 values(3);
ERROR HY000: CHECK OPTION failed
insert into v2_2_3 values(-1);
ERROR HY000: CHECK OPTION failed
insert into v2_2_3 values(1);
insert into v2_2_3 values(3);
ERROR HY000: CHECK OPTION failed
CREATE OR REPLACE VIEW v2_3_1 AS SELECT * FROM v2_3 WHERE a != 1 WITH LOCAL CHECK OPTION;
CREATE OR REPLACE VIEW v2_3_2 AS SELECT * FROM v2_3 WHERE a != 1 WITH CHECK OPTION;
CREATE OR REPLACE VIEW v2_3_3 AS SELECT * FROM v2_3 WHERE a != 1;
insert into v2_3_1 values(-1);
insert into v2_3_1 values(1);
ERROR HY000: CHECK OPTION failed
insert into v2_3_1 values(3);
ERROR HY000: CHECK OPTION failed
insert into v2_3_2 values(-1);
ERROR HY000: CHECK OPTION failed
insert into v2_3_2 values(1);
ERROR HY000: CHECK OPTION failed
insert into v2_3_2 values(3);
ERROR HY000: CHECK OPTION failed
insert into v2_3_3 values(-1);
insert into v2_3_3 values(1);
insert into v2_3_3 values(3);
ERROR HY000: CHECK OPTION failed
######################  non-updatable view  ############################
drop table t1;
create table t1(c1 int, c2 int);
create table t2(c1 int, c2 int);
insert into t1 values(2, 2);
create or replace view v1 as select max(c1) from t1 with check option;
ERROR HY000: CHECK OPTION on non-updatable view
create or replace view v1 as select c1 from t1 group by c1 with check option;
ERROR 42000: You have an error in your SQL syntax; check the manual that corresponds to your OceanBase version for the right syntax to use near 'check option' at line 1
create or replace view v1 as select * from (select c1 from t1 group by c1) with check option;
ERROR HY000: CHECK OPTION on non-updatable view
create or replace view v1 as select c1 from t1 having c1 > 0 with check option;
ERROR HY000: CHECK OPTION on non-updatable view
create or replace view v1 as select distinct c1 from t1 with check option;
ERROR HY000: CHECK OPTION on non-updatable view
create or replace view v1 as select c1 from t1 union select c1 from t1 with check option;
ERROR HY000: CHECK OPTION on non-updatable view
create or replace view v1 as select c1 from t1 limit 5 with check option;
ERROR HY000: CHECK OPTION on non-updatable view
create or replace view v1 as select t1.c1, t2.c2 from t1, t2 where t1.c1 = t2.c1 with check option;
ERROR HY000: join view with check option not allowed
create or replace view v1 as select c1 from t1 where c1 = (select max(c2) from t1) with check option;
ERROR HY000: view with subquery in condition with check option not allowed
create or replace view v1 as select max(c1) from t1;
create or replace view v2 as select * from v1 with check option;
ERROR HY000: CHECK OPTION on non-updatable view
create or replace view v1 as select distinct c1 from t1;
create or replace view v2 as select * from v1 with check option;
ERROR HY000: CHECK OPTION on non-updatable view
create or replace view v1 as select c1 from t1 union select c1 from t1;
create or replace view v2 as select * from v1 with check option;
ERROR HY000: CHECK OPTION on non-updatable view
create or replace view v1 as select c1 from t1 limit 5;
create or replace view v2 as select * from v1 with check option;
ERROR HY000: CHECK OPTION on non-updatable view
create or replace view v1 as select t1.c1, t2.c2 from t1, t2 where t1.c1 = t2.c1;
create or replace view v2 as select * from v1 with check option;
ERROR HY000: join view with check option not allowed
create or replace view v1 as select c1 from t1 where c1 = (select max(c2) from t1);
create or replace view v2 as select * from v1 with check option;
ERROR HY000: view with subquery in condition with check option not allowed
drop table t1;
######################  partition table and index ############################
create table t1(c1 int, c2 int, c3 int generated always as (c1 + c2)) partition by hash(c1) partitions 3;
create or replace view v1 as select * from t1 where c1 > 0 and c3 < 5 with check option;
insert into v1(c1, c2) values(1, 2);
insert into v1(c1, c2) values(0, 3);
ERROR HY000: CHECK OPTION failed
insert into v1(c1, c2) values(1, 4);
ERROR HY000: CHECK OPTION failed
replace into v1(c1, c2) values(1, 2);
replace into v1(c1, c2) values(0, 3);
ERROR HY000: CHECK OPTION failed
replace into v1(c1, c2) values(1, 4);
ERROR HY000: CHECK OPTION failed
update v1 set c1 = 0;
ERROR HY000: CHECK OPTION failed
update v1 set c1 = 2;
update v1 set c1 = 3;
ERROR HY000: CHECK OPTION failed
select * from v1;
c1	c2	c3
2	2	4
2	2	4
drop table t1;
create table t1(c1 int, c2 int, c3 int generated always as (c1 + c2));
create index idx_t1_c1 on t1(c1);
create index idx_t1_c2 on t1(c2);
create index idx_t1_c3 on t1(c3);
create or replace view v1 as select * from t1 where c1 > 0 and c3 < 5 with check option;
insert into v1(c1, c2) values(1, 2);
insert into v1(c1, c2) values(0, 3);
ERROR HY000: CHECK OPTION failed
insert into v1(c1, c2) values(1, 4);
ERROR HY000: CHECK OPTION failed
replace into v1(c1, c2) values(1, 2);
replace into v1(c1, c2) values(0, 3);
ERROR HY000: CHECK OPTION failed
replace into v1(c1, c2) values(1, 4);
ERROR HY000: CHECK OPTION failed
update v1 set c1 = 0;
ERROR HY000: CHECK OPTION failed
update v1 set c1 = 2;
update v1 set c1 = 3;
ERROR HY000: CHECK OPTION failed
select * from v1;
c1	c2	c3
2	2	4
2	2	4
create table test1(a1 int primary key AUTO_INCREMENT,name varchar(20),chinese BIGINT,math BIGINT,english INTEGER);
insert into test1(name,chinese,math,english) values('小明',101,115,113);
insert into test1(name,chinese,math,english) values('小王',103,125,115);
insert into test1(name,chinese,math,english) values('小超',107,135,108);
insert into test1(name,chinese,math,english) values('小李',119,145,100);
create or REPLACE view v1 as SELECT * from test1 where chinese<=121 and math>=100 and english<120 WITH CHECK OPTION;
SELECT * from test1 order by a1 asc;
a1	name	chinese	math	english
1	小明	101	115	113
2	小王	103	125	115
3	小超	107	135	108
4	小李	119	145	100
SELECT * from v1 order by a1 asc;
a1	name	chinese	math	english
1	小明	101	115	113
2	小王	103	125	115
3	小超	107	135	108
4	小李	119	145	100
update v1 set english=english*sin(asin(81));
ERROR HY000: CHECK OPTION failed
create table test3(id int,chinese BIGINT,math BIGINT,english INTEGER);
create or REPLACE view v3 as SELECT * from test3 where chinese<=10 and math>=15 and english<30 WITH CHECK OPTION;
replace into v3 values(4,SIN(60)+cos(25),ASIN(30)+ACOS(20),TAN(1)+ATAN(2));
ERROR HY000: CHECK OPTION failed
drop database with_check_option;
set _force_parallel_dml_dop = 3;
drop database with_check_option;
create database with_check_option;
use with_check_option;
######################  insert  ##################################
create table t(c1 int, c2 int);
insert into t values(1, 1);
insert into t values(2, 2);
insert into t values(3, 3);
create or replace view v as select * from t with check option;
insert into v values(0, 0);
insert into v values(100, 100);
create or replace view v as select * from t where c1 > 2 with check option;
insert into v values(3, 3);
insert into v values(2, 2);
ERROR HY000: CHECK OPTION failed
insert into v select 3, 3 from dual;
insert into v select 2, 2 from dual;
ERROR HY000: CHECK OPTION failed
create or replace view v as select * from t where c1 + c2 > 5 with check option;
insert into v values(3, 3);
insert into v values(2, 2);
ERROR HY000: CHECK OPTION failed
insert into v select 3, 3 from dual;
insert into v select 2, 2 from dual;
ERROR HY000: CHECK OPTION failed
create or replace view v as select * from t A where c1 > 2 with check option;
insert into v values(3, 3);
insert into v values(2, 2);
ERROR HY000: CHECK OPTION failed
create or replace view v as select * from (select * from t) A where c1 > 2 with check option;
insert into v values(3, 3);
ERROR HY000: The target table v of the INSERT is not insertable-into
create or replace view v as select * from t where 1 > 2 with check option;
insert into v values(0, 0);
ERROR HY000: CHECK OPTION failed
insert into v values(100, 100);
ERROR HY000: CHECK OPTION failed
######################  update  ##################################
delete from t;
insert into t values(1, 1);
insert into t values(2, 2);
insert into t values(3, 3);
create or replace view v as select * from t with check option;
update v set c2 = c2 + 1;
create or replace view v as select * from t where c2 < 3 with check option;
select * from t;
c1	c2
1	2
2	3
3	4
update v set c2 = c2 + 1;
ERROR HY000: CHECK OPTION failed
select * from t;
c1	c2
1	2
2	3
3	4
update v set c2 = c2 - 1;
create or replace view v as select * from t where c1 + c2 < 5 with check option;
delete from t;
insert into t values(1, 1);
insert into t values(2, 2);
insert into t values(3, 3);
update v set c2 = c2 + 1;
ERROR HY000: CHECK OPTION failed
update v set c2 = c2 - 1;
select * from t;
c1	c2
1	0
2	1
3	3
create or replace view v as select * from t A where c2 < 3 with check option;
update v set c2 = 3;
ERROR HY000: CHECK OPTION failed
update v set c2 = 2;
update (select * from t) set c2 = 3;
ERROR HY000: The target table ANONYMOUS_VIEW1 of the UPDATE is not updatable
update (select * from t) A set c2 = 2;
ERROR HY000: The target table A of the UPDATE is not updatable
update (select * from v) set c2 = 3;
ERROR HY000: The target table ANONYMOUS_VIEW1 of the UPDATE is not updatable
update (select * from v) A set c2 = 3;
ERROR HY000: The target table A of the UPDATE is not updatable
update (select * from v A) set c2 = 3;
ERROR HY000: The target table ANONYMOUS_VIEW1 of the UPDATE is not updatable
create or replace view v as select * from (select * from t) A where c2 > 1 with check option;
update v set c2 = 3;
update v set c2 = 0;
ERROR HY000: CHECK OPTION failed
######################  replace  #################################
delete from t;
replace into t values(1, 1);
replace into t values(2, 2);
replace into t values(3, 3);
create or replace view v as select * from t with check option;
replace into v values(0, 0);
replace into v values(100, 100);
create or replace view v as select * from t where c2 > 2 with check option;
replace into v values(3, 3);
replace into v values(2, 2);
ERROR HY000: CHECK OPTION failed
replace into v select 3, 3;
replace into v select 2, 2;
ERROR HY000: CHECK OPTION failed
create or replace view v as select * from t where c1 + c2 > 5 with check option;
replace into v values(3, 3);
replace into v values(2, 2);
ERROR HY000: CHECK OPTION failed
replace into v select 3, 3;
replace into v select 2, 2;
ERROR HY000: CHECK OPTION failed
create or replace view v as select * from t A where c2 > 2 with check option;
replace into v values(3, 3);
replace into v values(2, 2);
ERROR HY000: CHECK OPTION failed
create or replace view v as select * from (select * from t) A where c2 > 2 with check option;
replace into v values(3, 3);
ERROR HY000: The target table v of the INSERT is not insertable-into
create or replace view v as select * from t where 1 > 2 with check option;
replace into v values(0, 0);
ERROR HY000: CHECK OPTION failed
replace into v values(100, 100);
ERROR HY000: CHECK OPTION failed
######################  generated column  ##############################
drop table t;
create table t(c1 int, c2 int, c3 int generated always as (c1 + c2));
insert into t(c1, c2) values(1, 1);
insert into t(c1, c2) values(2, 2);
insert into t(c1, c2) values(3, 3);
create or replace view v as select * from t where c3 > 3 with check option;
insert into v(c1, c2) values(1, 1);
ERROR HY000: CHECK OPTION failed
insert into v(c1, c2) values(2, 2);
update v set c2 = 0;
ERROR HY000: CHECK OPTION failed
update v set c2 = 3;
replace into v(c1, c2) values(1, 1);
ERROR HY000: CHECK OPTION failed
replace into v(c1, c2) values(2, 2);
######################  nested view  ###############################
create table t1(a int);
insert into t1 values(0), (1), (2), (3);
CREATE OR REPLACE VIEW v1 AS SELECT * FROM t1 WHERE a < 3;
CREATE OR REPLACE VIEW v2 AS SELECT * FROM v1 WHERE a < 3 WITH CHECK OPTION;
CREATE OR REPLACE VIEW v1_1 AS SELECT * FROM v1 WHERE a > 0 WITH LOCAL CHECK OPTION;
CREATE OR REPLACE VIEW v1_2 AS SELECT * FROM v1 WHERE a > 0 WITH CHECK OPTION;
CREATE OR REPLACE VIEW v1_3 AS SELECT * FROM v1 WHERE a > 0;
insert into v1_1 values(-1);
ERROR HY000: CHECK OPTION failed
insert into v1_1 values(1);
insert into v1_1 values(3);
insert into v1_2 values(-1);
ERROR HY000: CHECK OPTION failed
insert into v1_2 values(1);
insert into v1_2 values(3);
ERROR HY000: CHECK OPTION failed
insert into v1_3 values(-1);
insert into v1_3 values(1);
insert into v1_3 values(3);
CREATE OR REPLACE VIEW v1_1_1 AS SELECT * FROM v1_1 WHERE a != 1 WITH LOCAL CHECK OPTION;
CREATE OR REPLACE VIEW v1_1_2 AS SELECT * FROM v1_1 WHERE a != 1 WITH CHECK OPTION;
CREATE OR REPLACE VIEW v1_1_3 AS SELECT * FROM v1_1 WHERE a != 1;
insert into v1_1_1 values(-1);
ERROR HY000: CHECK OPTION failed
insert into v1_1_1 values(1);
ERROR HY000: CHECK OPTION failed
insert into v1_1_1 values(3);
insert into v1_1_2 values(-1);
ERROR HY000: CHECK OPTION failed
insert into v1_1_2 values(1);
ERROR HY000: CHECK OPTION failed
insert into v1_1_2 values(3);
ERROR HY000: CHECK OPTION failed
insert into v1_1_3 values(-1);
ERROR HY000: CHECK OPTION failed
insert into v1_1_3 values(1);
insert into v1_1_3 values(3);
CREATE OR REPLACE VIEW v1_2_1 AS SELECT * FROM v1_2 WHERE a != 1 WITH LOCAL CHECK OPTION;
CREATE OR REPLACE VIEW v1_2_2 AS SELECT * FROM v1_2 WHERE a != 1 WITH CHECK OPTION;
CREATE OR REPLACE VIEW v1_2_3 AS SELECT * FROM v1_2 WHERE a != 1;
insert into v1_2_1 values(-1);
ERROR HY000: CHECK OPTION failed
insert into v1_2_1 values(1);
ERROR HY000: CHECK OPTION failed
insert into v1_2_1 values(3);
ERROR HY000: CHECK OPTION failed
insert into v1_2_2 values(-1);
ERROR HY000: CHECK OPTION failed
insert into v1_2_2 values(1);
ERROR HY000: CHECK OPTION failed
insert into v1_2_2 values(3);
ERROR HY000: CHECK OPTION failed
insert into v1_2_3 values(-1);
ERROR HY000: CHECK OPTION failed
insert into v1_2_3 values(1);
insert into v1_2_3 values(3);
ERROR HY000: CHECK OPTION failed
CREATE OR REPLACE VIEW v1_3_1 AS SELECT * FROM v1_3 WHERE a != 1 WITH LOCAL CHECK OPTION;
CREATE OR REPLACE VIEW v1_3_2 AS SELECT * FROM v1_3 WHERE a != 1 WITH CHECK OPTION;
CREATE OR REPLACE VIEW v1_3_3 AS SELECT * FROM v1_3 WHERE a != 1;
insert into v1_3_1 values(-1);
insert into v1_3_1 values(1);
ERROR HY000: CHECK OPTION failed
insert into v1_3_1 values(3);
insert into v1_3_2 values(-1);
ERROR HY000: CHECK OPTION failed
insert into v1_3_2 values(1);
ERROR HY000: CHECK OPTION failed
insert into v1_3_2 values(3);
ERROR HY000: CHECK OPTION failed
insert into v1_3_3 values(-1);
insert into v1_3_3 values(1);
insert into v1_3_3 values(3);
CREATE OR REPLACE VIEW v2_1 AS SELECT * FROM v2 WHERE a > 0 WITH LOCAL CHECK OPTION;
CREATE OR REPLACE VIEW v2_2 AS SELECT * FROM v2 WHERE a > 0 WITH CHECK OPTION;
CREATE OR REPLACE VIEW v2_3 AS SELECT * FROM v2 WHERE a > 0;
insert into v2_1 values(-1);
ERROR HY000: CHECK OPTION failed
insert into v2_1 values(1);
insert into v2_1 values(3);
ERROR HY000: CHECK OPTION failed
insert into v2_2 values(-1);
ERROR HY000: CHECK OPTION failed
insert into v2_2 values(1);
insert into v2_2 values(3);
ERROR HY000: CHECK OPTION failed
insert into v2_3 values(-1);
insert into v2_3 values(1);
insert into v2_3 values(3);
ERROR HY000: CHECK OPTION failed
CREATE OR REPLACE VIEW v2_1_1 AS SELECT * FROM v2_1 WHERE a != 1 WITH LOCAL CHECK OPTION;
CREATE OR REPLACE VIEW v2_1_2 AS SELECT * FROM v2_1 WHERE a != 1 WITH CHECK OPTION;
CREATE OR REPLACE VIEW v2_1_3 AS SELECT * FROM v2_1 WHERE a != 1;
insert into v2_1_1 values(-1);
ERROR HY000: CHECK OPTION failed
insert into v2_1_1 values(1);
ERROR HY000: CHECK OPTION failed
insert into v2_1_1 values(3);
ERROR HY000: CHECK OPTION failed
insert into v2_1_2 values(-1);
ERROR HY000: CHECK OPTION failed
insert into v2_1_2 values(1);
ERROR HY000: CHECK OPTION failed
insert into v2_1_2 values(3);
ERROR HY000: CHECK OPTION failed
insert into v2_1_3 values(-1);
ERROR HY000: CHECK OPTION failed
insert into v2_1_3 values(1);
insert into v2_1_3 values(3);
ERROR HY000: CHECK OPTION failed
CREATE OR REPLACE VIEW v2_2_1 AS SELECT * FROM v2_2 WHERE a != 1 WITH LOCAL CHECK OPTION;
CREATE OR REPLACE VIEW v2_2_2 AS SELECT * FROM v2_2 WHERE a != 1 WITH CHECK OPTION;
CREATE OR REPLACE VIEW v2_2_3 AS SELECT * FROM v2_2 WHERE a != 1;
insert into v2_2_1 values(-1);
ERROR HY000: CHECK OPTION failed
insert into v2_2_1 values(1);
ERROR HY000: CHECK OPTION failed
insert into v2_2_1 values(3);
ERROR HY000: CHECK OPTION failed
insert into v2_2_2 values(-1);
ERROR HY000: CHECK OPTION failed
insert into v2_2_2 values(1);
ERROR HY000: CHECK OPTION failed
insert into v2_2_2 values(3);
ERROR HY000: CHECK OPTION failed
insert into v2_2_3 values(-1);
ERROR HY000: CHECK OPTION failed
insert into v2_2_3 values(1);
insert into v2_2_3 values(3);
ERROR HY000: CHECK OPTION failed
CREATE OR REPLACE VIEW v2_3_1 AS SELECT * FROM v2_3 WHERE a != 1 WITH LOCAL CHECK OPTION;
CREATE OR REPLACE VIEW v2_3_2 AS SELECT * FROM v2_3 WHERE a != 1 WITH CHECK OPTION;
CREATE OR REPLACE VIEW v2_3_3 AS SELECT * FROM v2_3 WHERE a != 1;
insert into v2_3_1 values(-1);
insert into v2_3_1 values(1);
ERROR HY000: CHECK OPTION failed
insert into v2_3_1 values(3);
ERROR HY000: CHECK OPTION failed
insert into v2_3_2 values(-1);
ERROR HY000: CHECK OPTION failed
insert into v2_3_2 values(1);
ERROR HY000: CHECK OPTION failed
insert into v2_3_2 values(3);
ERROR HY000: CHECK OPTION failed
insert into v2_3_3 values(-1);
insert into v2_3_3 values(1);
insert into v2_3_3 values(3);
ERROR HY000: CHECK OPTION failed
######################  non-updatable view  ############################
drop table t1;
create table t1(c1 int, c2 int);
create table t2(c1 int, c2 int);
insert into t1 values(2, 2);
create or replace view v1 as select max(c1) from t1 with check option;
ERROR HY000: CHECK OPTION on non-updatable view
create or replace view v1 as select c1 from t1 group by c1 with check option;
ERROR 42000: You have an error in your SQL syntax; check the manual that corresponds to your OceanBase version for the right syntax to use near 'check option' at line 1
create or replace view v1 as select * from (select c1 from t1 group by c1) with check option;
ERROR HY000: CHECK OPTION on non-updatable view
create or replace view v1 as select c1 from t1 having c1 > 0 with check option;
ERROR HY000: CHECK OPTION on non-updatable view
create or replace view v1 as select distinct c1 from t1 with check option;
ERROR HY000: CHECK OPTION on non-updatable view
create or replace view v1 as select c1 from t1 union select c1 from t1 with check option;
ERROR HY000: CHECK OPTION on non-updatable view
create or replace view v1 as select c1 from t1 limit 5 with check option;
ERROR HY000: CHECK OPTION on non-updatable view
create or replace view v1 as select t1.c1, t2.c2 from t1, t2 where t1.c1 = t2.c1 with check option;
ERROR HY000: join view with check option not allowed
create or replace view v1 as select c1 from t1 where c1 = (select max(c2) from t1) with check option;
ERROR HY000: view with subquery in condition with check option not allowed
create or replace view v1 as select max(c1) from t1;
create or replace view v2 as select * from v1 with check option;
ERROR HY000: CHECK OPTION on non-updatable view
create or replace view v1 as select distinct c1 from t1;
create or replace view v2 as select * from v1 with check option;
ERROR HY000: CHECK OPTION on non-updatable view
create or replace view v1 as select c1 from t1 union select c1 from t1;
create or replace view v2 as select * from v1 with check option;
ERROR HY000: CHECK OPTION on non-updatable view
create or replace view v1 as select c1 from t1 limit 5;
create or replace view v2 as select * from v1 with check option;
ERROR HY000: CHECK OPTION on non-updatable view
create or replace view v1 as select t1.c1, t2.c2 from t1, t2 where t1.c1 = t2.c1;
create or replace view v2 as select * from v1 with check option;
ERROR HY000: join view with check option not allowed
create or replace view v1 as select c1 from t1 where c1 = (select max(c2) from t1);
create or replace view v2 as select * from v1 with check option;
ERROR HY000: view with subquery in condition with check option not allowed
drop table t1;
######################  partition table and index ############################
create table t1(c1 int, c2 int, c3 int generated always as (c1 + c2)) partition by hash(c1) partitions 3;
create or replace view v1 as select * from t1 where c1 > 0 and c3 < 5 with check option;
insert into v1(c1, c2) values(1, 2);
insert into v1(c1, c2) values(0, 3);
ERROR HY000: CHECK OPTION failed
insert into v1(c1, c2) values(1, 4);
ERROR HY000: CHECK OPTION failed
replace into v1(c1, c2) values(1, 2);
replace into v1(c1, c2) values(0, 3);
ERROR HY000: CHECK OPTION failed
replace into v1(c1, c2) values(1, 4);
ERROR HY000: CHECK OPTION failed
update v1 set c1 = 0;
ERROR HY000: CHECK OPTION failed
update v1 set c1 = 2;
update v1 set c1 = 3;
ERROR HY000: CHECK OPTION failed
select * from v1;
c1	c2	c3
2	2	4
2	2	4
drop table t1;
create table t1(c1 int, c2 int, c3 int generated always as (c1 + c2));
create index idx_t1_c1 on t1(c1);
create index idx_t1_c2 on t1(c2);
create index idx_t1_c3 on t1(c3);
create or replace view v1 as select * from t1 where c1 > 0 and c3 < 5 with check option;
insert into v1(c1, c2) values(1, 2);
insert into v1(c1, c2) values(0, 3);
ERROR HY000: CHECK OPTION failed
insert into v1(c1, c2) values(1, 4);
ERROR HY000: CHECK OPTION failed
replace into v1(c1, c2) values(1, 2);
replace into v1(c1, c2) values(0, 3);
ERROR HY000: CHECK OPTION failed
replace into v1(c1, c2) values(1, 4);
ERROR HY000: CHECK OPTION failed
update v1 set c1 = 0;
ERROR HY000: CHECK OPTION failed
update v1 set c1 = 2;
update v1 set c1 = 3;
ERROR HY000: CHECK OPTION failed
select * from v1;
c1	c2	c3
2	2	4
2	2	4
create table test1(a1 int primary key AUTO_INCREMENT,name varchar(20),chinese BIGINT,math BIGINT,english INTEGER);
insert into test1(name,chinese,math,english) values('小明',101,115,113);
insert into test1(name,chinese,math,english) values('小王',103,125,115);
insert into test1(name,chinese,math,english) values('小超',107,135,108);
insert into test1(name,chinese,math,english) values('小李',119,145,100);
create or REPLACE view v1 as SELECT * from test1 where chinese<=121 and math>=100 and english<120 WITH CHECK OPTION;
SELECT * from test1 order by a1 asc;
a1	name	chinese	math	english
1	小明	101	115	113
2	小王	103	125	115
3	小超	107	135	108
4	小李	119	145	100
SELECT * from v1 order by a1 asc;
a1	name	chinese	math	english
1	小明	101	115	113
2	小王	103	125	115
3	小超	107	135	108
4	小李	119	145	100
update v1 set english=english*sin(asin(81));
ERROR HY000: CHECK OPTION failed
create table test3(id int,chinese BIGINT,math BIGINT,english INTEGER);
create or REPLACE view v3 as SELECT * from test3 where chinese<=10 and math>=15 and english<30 WITH CHECK OPTION;
replace into v3 values(4,SIN(60)+cos(25),ASIN(30)+ACOS(20),TAN(1)+ATAN(2));
ERROR HY000: CHECK OPTION failed
drop database with_check_option;
set _force_parallel_dml_dop = 1;
