result_format: 4
##创建测试用户
drop user CHI_ALTER_PROCEDURE cascade;
create user CHI_ALTER_PROCEDURE IDENTIFIED BY CHI_ALTER_PROCEDURE;
grant all on *.* to CHI_ALTER_PROCEDURE WITH GRANT OPTION;
grant dba to CHI_ALTER_PROCEDURE;
####包头部分COMPILE PACKAGE####
DROP TABLE ff01;
CREATE TABLE ff01(a NUMBER,b varchar(10),c char(10));
CREATE OR REPLACE PACKAGE pac01 AS
	var ff01.a%type;
	CURSOR CUR01 IS SELECT * FROM ff01;
END;
//
CREATE OR REPLACE PACKAGE body pac01 AS
BEGIN
	NULL;
END;
//
ALTER PACKAGE pac01 compile;
ALTER PACKAGE pac01 compile PACKAGE;
ALTER PACKAGE pac01 compile body;
select name, type, line, position, text, message_number from all_errors where name = 'PAC01';
+------+------+------+----------+------+----------------+
| NAME | TYPE | LINE | POSITION | TEXT | MESSAGE_NUMBER |
+------+------+------+----------+------+----------------+
+------+------+------+----------+------+----------------+
##数据类型##
CREATE OR REPLACE PACKAGE pac01 AS
	var ff01%rowtype;
END;
//
ALTER TABLE ff01 ADD d DATE;
ALTER PACKAGE pac01 compile;
select name, type, line, position, text, message_number from all_errors where name = 'PAC01';
+------+------+------+----------+------+----------------+
| NAME | TYPE | LINE | POSITION | TEXT | MESSAGE_NUMBER |
+------+------+------+----------+------+----------------+
+------+------+------+----------+------+----------------+
ALTER TABLE ff01 DROP (d);
ALTER PACKAGE pac01 compile;
select name, type, line, position, text, message_number from all_errors where name = 'PAC01';
+------+------+------+----------+------+----------------+
| NAME | TYPE | LINE | POSITION | TEXT | MESSAGE_NUMBER |
+------+------+------+----------+------+----------------+
+------+------+------+----------+------+----------------+
CREATE INDEX in_a ON ff01(a);
ALTER PACKAGE pac01 compile;
select name, type, line, position, text, message_number from all_errors where name = 'PAC01';
+------+------+------+----------+------+----------------+
| NAME | TYPE | LINE | POSITION | TEXT | MESSAGE_NUMBER |
+------+------+------+----------+------+----------------+
+------+------+------+----------+------+----------------+
DROP TABLE ff01;
ALTER PACKAGE pac01 compile;
select name, type, line, position, text, message_number from all_errors where name = 'PAC01';
+-------+--------------+------+----------+-----------------------------------------------+----------------+
| NAME  | TYPE         | LINE | POSITION | TEXT                                          | MESSAGE_NUMBER |
+-------+--------------+------+----------+-----------------------------------------------+----------------+
| PAC01 | PACKAGE BODY |    2 |        3 | PLS-00201: identifier 'FF01' must be declared |          -5543 |
+-------+--------------+------+----------+-----------------------------------------------+----------------+
CREATE TABLE ff01(a NUMBER,b varchar(10),c char(10));
CREATE OR REPLACE PACKAGE pac01 AS
	var01 ff01.a%type;
	var02 ff01.b%TYPE;
END;
//
ALTER PACKAGE pac01 compile;
select name, type, line, position, text, message_number from all_errors where name = 'PAC01';
+------+------+------+----------+------+----------------+
| NAME | TYPE | LINE | POSITION | TEXT | MESSAGE_NUMBER |
+------+------+------+----------+------+----------------+
+------+------+------+----------+------+----------------+
CREATE INDEX in_a ON ff01(a);
ALTER PACKAGE pac01 compile;
select name, type, line, position, text, message_number from all_errors where name = 'PAC01';
+------+------+------+----------+------+----------------+
| NAME | TYPE | LINE | POSITION | TEXT | MESSAGE_NUMBER |
+------+------+------+----------+------+----------------+
+------+------+------+----------+------+----------------+
ALTER TABLE ff01 MODIFY b varchar2(66);
ALTER PACKAGE pac01 compile;
select name, type, line, position, text, message_number from all_errors where name = 'PAC01';
+------+------+------+----------+------+----------------+
| NAME | TYPE | LINE | POSITION | TEXT | MESSAGE_NUMBER |
+------+------+------+----------+------+----------------+
+------+------+------+----------+------+----------------+
ALTER TABLE ff01 RENAME COLUMN a TO a1;
ALTER PACKAGE pac01 compile;
select name, type, line, position, text, message_number from all_errors where name = 'PAC01';
+-------+--------------+------+----------+--------------------------------------------+----------------+
| NAME  | TYPE         | LINE | POSITION | TEXT                                       | MESSAGE_NUMBER |
+-------+--------------+------+----------+--------------------------------------------+----------------+
| PAC01 | PACKAGE BODY |    2 |        3 | PLS-00201: identifier 'A' must be declared |          -5543 |
+-------+--------------+------+----------+--------------------------------------------+----------------+
DROP TABLE ff01;
ALTER PACKAGE pac01 compile;
select name, type, line, position, text, message_number from all_errors where name = 'PAC01';
+-------+--------------+------+----------+-----------------------------------------------+----------------+
| NAME  | TYPE         | LINE | POSITION | TEXT                                          | MESSAGE_NUMBER |
+-------+--------------+------+----------+-----------------------------------------------+----------------+
| PAC01 | PACKAGE BODY |    3 |        3 | PLS-00201: identifier 'FF01' must be declared |          -5543 |
+-------+--------------+------+----------+-----------------------------------------------+----------------+
##VIEW##
CREATE TABLE ff01(a NUMBER,b varchar(10),c char(10));
DROP VIEW vv01;
CREATE VIEW vv01 AS SELECT * FROM ff01;
CREATE OR REPLACE PACKAGE pac01 AS
	var01 vv01.a%type;
	var02 vv01%rowTYPE;
END;
//
DROP TABLE ff01;
ALTER PACKAGE pac01 compile;
select name, type, line, position, text, message_number from all_errors where name = 'PAC01';
+-------+--------------+------+----------+-------------------------+----------------+
| NAME  | TYPE         | LINE | POSITION | TEXT                    | MESSAGE_NUMBER |
+-------+--------------+------+----------+-------------------------+----------------+
| PAC01 | PACKAGE BODY |    2 |        3 | OBE-04063: view invalid |          -5231 |
+-------+--------------+------+----------+-------------------------+----------------+
##TYPE##
CREATE TABLE ff01(a NUMBER,b varchar(10),c char(10));
CREATE OR REPLACE PACKAGE pac01 AS
	TYPE t1 IS TABLE OF ff01%rowtype;
	var t1;
END;
//
DROP TABLE ff01;
ALTER PACKAGE pac01 compile;
select name, type, line, position, text, message_number from all_errors where name = 'PAC01';
+-------+--------------+------+----------+-----------------------------------------------------------------------+----------------+
| NAME  | TYPE         | LINE | POSITION | TEXT                                                                  | MESSAGE_NUMBER |
+-------+--------------+------+----------+-----------------------------------------------------------------------+----------------+
| PAC01 | PACKAGE BODY |    3 |        3 | OBE-00600: internal error code, arguments: -5544, Undeclared type: T1 |          -5544 |
+-------+--------------+------+----------+-----------------------------------------------------------------------+----------------+
CREATE TABLE ff01(a NUMBER,b varchar(10),c char(10));
CREATE OR REPLACE PACKAGE pac01 AS
	TYPE t1 IS TABLE OF ff01.a%type;
	var t1;
END;
//
ALTER TABLE ff01 RENAME COLUMN a TO a1;
ALTER PACKAGE pac01 compile;
select name, type, line, position, text, message_number from all_errors where name = 'PAC01';
+-------+--------------+------+----------+-----------------------------------------------------------------------+----------------+
| NAME  | TYPE         | LINE | POSITION | TEXT                                                                  | MESSAGE_NUMBER |
+-------+--------------+------+----------+-----------------------------------------------------------------------+----------------+
| PAC01 | PACKAGE BODY |    3 |        3 | OBE-00600: internal error code, arguments: -5544, Undeclared type: T1 |          -5544 |
+-------+--------------+------+----------+-----------------------------------------------------------------------+----------------+
CREATE OR REPLACE TYPE t1 AS TABLE OF int;
//
CREATE OR REPLACE PACKAGE pac01 AS
	var t1;
END;
//
DROP type t1 ;
ALTER PACKAGE pac01 compile;
select name, type, line, position, text, message_number from all_errors where name = 'PAC01';
+-------+--------------+------+----------+-----------------------------------------------------------------------+----------------+
| NAME  | TYPE         | LINE | POSITION | TEXT                                                                  | MESSAGE_NUMBER |
+-------+--------------+------+----------+-----------------------------------------------------------------------+----------------+
| PAC01 | PACKAGE BODY |    2 |        3 | OBE-00600: internal error code, arguments: -5544, Undeclared type: T1 |          -5544 |
+-------+--------------+------+----------+-----------------------------------------------------------------------+----------------+
DROP TABLE ff01;
CREATE TABLE ff01(a NUMBER,b varchar(10),c char(10));
CREATE OR REPLACE PACKAGE pac01 AS
	TYPE t1 is VARRAY(5) OF ff01%rowtype;
	var t1;
END;
//
DROP TABLE ff01;
ALTER PACKAGE pac01 compile;
ALTER PACKAGE pac01 compile body;
select name, type, line, position, text, message_number from all_errors where name = 'PAC01';
+-------+--------------+------+----------+-----------------------------------------------------------------------+----------------+
| NAME  | TYPE         | LINE | POSITION | TEXT                                                                  | MESSAGE_NUMBER |
+-------+--------------+------+----------+-----------------------------------------------------------------------+----------------+
| PAC01 | PACKAGE BODY |    3 |        3 | OBE-00600: internal error code, arguments: -5544, Undeclared type: T1 |          -5544 |
+-------+--------------+------+----------+-----------------------------------------------------------------------+----------------+
CREATE TABLE ff01(a NUMBER,b varchar(10),c char(10));
CREATE OR REPLACE tYPE t1 is VARRAY(1) OF int;
//
CREATE OR REPLACE PACKAGE pac01 AS
	var t1;
END;
//
DROP TYPE t1;
ALTER PACKAGE pac01 compile;
ALTER PACKAGE pac01 compile body;
select name, type, line, position, text, message_number from all_errors where name = 'PAC01';
+-------+--------------+------+----------+-----------------------------------------------------------------------+----------------+
| NAME  | TYPE         | LINE | POSITION | TEXT                                                                  | MESSAGE_NUMBER |
+-------+--------------+------+----------+-----------------------------------------------------------------------+----------------+
| PAC01 | PACKAGE BODY |    2 |        3 | OBE-00600: internal error code, arguments: -5544, Undeclared type: T1 |          -5544 |
+-------+--------------+------+----------+-----------------------------------------------------------------------+----------------+
CREATE OR REPLACE PACKAGE pac01 AS
	TYPE t1 is TABLE OF ff01%rowtype INDEX BY varchar(10);
	var t1;
END;
//
DROP TABLE ff01;
ALTER PACKAGE pac01 compile;
ALTER PACKAGE pac01 compile body;
select name, type, line, position, text, message_number from all_errors where name = 'PAC01';
+-------+--------------+------+----------+-----------------------------------------------------------------------+----------------+
| NAME  | TYPE         | LINE | POSITION | TEXT                                                                  | MESSAGE_NUMBER |
+-------+--------------+------+----------+-----------------------------------------------------------------------+----------------+
| PAC01 | PACKAGE BODY |    3 |        3 | OBE-00600: internal error code, arguments: -5544, Undeclared type: T1 |          -5544 |
+-------+--------------+------+----------+-----------------------------------------------------------------------+----------------+
CREATE TABLE ff01(a NUMBER,b varchar(10),c char(10));
CREATE OR REPLACE PACKAGE pac01 AS
	TYPE t1 IS RECORD(a ff01.a%TYPE,b ff01.b%type);
	var t1;
END;
//
ALTER TABLE ff01 DROP COLUMN b;
ALTER PACKAGE pac01 compile;
ALTER PACKAGE pac01 compile body;
select name, type, line, position, text, message_number from all_errors where name = 'PAC01';
+-------+--------------+------+----------+-----------------------------------------------------------------------+----------------+
| NAME  | TYPE         | LINE | POSITION | TEXT                                                                  | MESSAGE_NUMBER |
+-------+--------------+------+----------+-----------------------------------------------------------------------+----------------+
| PAC01 | PACKAGE BODY |    3 |        3 | OBE-00600: internal error code, arguments: -5544, Undeclared type: T1 |          -5544 |
+-------+--------------+------+----------+-----------------------------------------------------------------------+----------------+
DROP TABLE ff01;
ALTER PACKAGE pac01 compile;
ALTER PACKAGE pac01 compile body;
select name, type, line, position, text, message_number from all_errors where name = 'PAC01';
+-------+--------------+------+----------+-----------------------------------------------------------------------+----------------+
| NAME  | TYPE         | LINE | POSITION | TEXT                                                                  | MESSAGE_NUMBER |
+-------+--------------+------+----------+-----------------------------------------------------------------------+----------------+
| PAC01 | PACKAGE BODY |    3 |        3 | OBE-00600: internal error code, arguments: -5544, Undeclared type: T1 |          -5544 |
+-------+--------------+------+----------+-----------------------------------------------------------------------+----------------+
CREATE TABLE ff01(a NUMBER,b varchar(10),c char(10));
CREATE OR REPLACE TYPE t1 AS TABLE OF int;
//
CREATE OR REPLACE PACKAGE pac01 AS
	subtype sub01 IS t1;
	var sub01;
END;
//
DROP type t1;
ALTER PACKAGE pac01 compile;
ALTER PACKAGE pac01 compile body;
select name, type, line, position, text, message_number from all_errors where name = 'PAC01';
+-------+--------------+------+----------+--------------------------------------------------------------------------+----------------+
| NAME  | TYPE         | LINE | POSITION | TEXT                                                                     | MESSAGE_NUMBER |
+-------+--------------+------+----------+--------------------------------------------------------------------------+----------------+
| PAC01 | PACKAGE BODY |    3 |        3 | OBE-00600: internal error code, arguments: -5544, Undeclared type: SUB01 |          -5544 |
+-------+--------------+------+----------+--------------------------------------------------------------------------+----------------+
CREATE OR REPLACE TYPE t1 AS TABLE OF NUMBER;
//
CREATE OR REPLACE FUNCTION FUN01 RETURN T1 AS
	FUN_B T1;
BEGIN
	FOR I IN (SELECT B FROM FF01) LOOP
		FUN_B := T1(I.b);
	END LOOP ;
	RETURN FUN_B;
END;
//
CREATE OR REPLACE PACKAGE pac01 AS
	subtype sub01 IS t1 NOT NULL;
	var sub01 := fun01();
	FUNCTION FUN01 RETURN T1;
END;
//
CREATE OR REPLACE PACKAGE body pac01 AS
FUNCTION fun01 RETURN T1 IS
	fun_a T1;
BEGIN
	FOR I IN (SELECT A FROM FF01) LOOP
		FUN_A := T1(I.A);
	END LOOP;
	RETURN FUN_A;
END fun01;
BEGIN
	NULL;
END;
//
DROP TABLE ff01;
ALTER PACKAGE pac01 compile;
ALTER PACKAGE pac01 compile body;
select name, type, line, position, text, message_number from all_errors where name = 'PAC01';
+-------+--------------+------+----------+--------------------------------------------------------------------+----------------+
| NAME  | TYPE         | LINE | POSITION | TEXT                                                               | MESSAGE_NUMBER |
+-------+--------------+------+----------+--------------------------------------------------------------------+----------------+
| PAC01 | PACKAGE BODY |    5 |        3 | OBE-00942: table or view 'CHI_ALTER_PROCEDURE.FF01' does not exist |          -5019 |
+-------+--------------+------+----------+--------------------------------------------------------------------+----------------+
##默认值##
DROP TABLE ff01;
CREATE TABLE ff01(a NUMBER,b varchar(10),c char(10));
DROP PACKAGE pac01;
CREATE OR REPLACE PACKAGE pac01 AS
	FUNCTION FUN01 RETURN NUMBER;
	var ff01.a%type;
END;
//
CREATE OR REPLACE PACKAGE BODY pac01 AS
	FUNCTION FUN01 RETURN NUMBER AS
	BEGIN
		RETURN 1;
	END FUN01;
BEGIN
	NULL;
END;
//
DROP TABLE ff01;
ALTER PACKAGE pac01 compile;
ALTER PACKAGE pac01 compile body;
select name, type, line, position, text, message_number from all_errors where name = 'PAC01';
+-------+--------------+------+----------+-----------------------------------------------+----------------+
| NAME  | TYPE         | LINE | POSITION | TEXT                                          | MESSAGE_NUMBER |
+-------+--------------+------+----------+-----------------------------------------------+----------------+
| PAC01 | PACKAGE BODY |    3 |        3 | PLS-00201: identifier 'FF01' must be declared |          -5543 |
+-------+--------------+------+----------+-----------------------------------------------+----------------+
CREATE OR REPLACE FUNCTION fun01 RETURN NUMBER AS
BEGIN
	RETURN 1;
END;
//
CREATE OR REPLACE PACKAGE pac02 AS
	var02 NUMBER := fun01();
END;
//
CREATE OR REPLACE PACKAGE pac01 AS
	var NUMBER := pac02.var02;
END;
//
DROP FUNCTION fun01;
ALTER PACKAGE pac01 compile;
select name, type, line, position, text, message_number from all_errors where name = 'PAC01';
+-------+--------------+------+----------+------------------------------------------------+----------------+
| NAME  | TYPE         | LINE | POSITION | TEXT                                           | MESSAGE_NUMBER |
+-------+--------------+------+----------+------------------------------------------------+----------------+
| PAC01 | PACKAGE BODY |    2 |       15 | PLS-00201: identifier 'VAR02' must be declared |          -5543 |
+-------+--------------+------+----------+------------------------------------------------+----------------+
DROP PACKAGE pac02;
ALTER PACKAGE pac01 compile;
select name, type, line, position, text, message_number from all_errors where name = 'PAC01';
+-------+--------------+------+----------+------------------------------------------------+----------------+
| NAME  | TYPE         | LINE | POSITION | TEXT                                           | MESSAGE_NUMBER |
+-------+--------------+------+----------+------------------------------------------------+----------------+
| PAC01 | PACKAGE BODY |    2 |       15 | PLS-00201: identifier 'VAR02' must be declared |          -5543 |
+-------+--------------+------+----------+------------------------------------------------+----------------+
DROP TABLE ff01;
CREATE TABLE ff01(a NUMBER,b varchar(10),c char(10));
CREATE OR REPLACE FUNCTION fun01 RETURN varchar IS
	fun_a NUMBER;
BEGIN
	SELECT a INTO fun_a FROM ff01 WHERE rownum=1;
	RETURN fun_a;
END;
//
CREATE OR REPLACE PACKAGE pac01 AS
	var NUMBER := fun01();
END;
//
ALTER PACKAGE pac01 compile;
select name, type, line, position, text, message_number from all_errors where name = 'PAC01';
+------+------+------+----------+------+----------------+
| NAME | TYPE | LINE | POSITION | TEXT | MESSAGE_NUMBER |
+------+------+------+----------+------+----------------+
+------+------+------+----------+------+----------------+
DROP FUNCTION fun01;
ALTER PACKAGE pac01 compile;
select name, type, line, position, text, message_number from all_errors where name = 'PAC01';
+-------+--------------+------+----------+---------------------------------------------------------------------------------+----------------+
| NAME  | TYPE         | LINE | POSITION | TEXT                                                                            | MESSAGE_NUMBER |
+-------+--------------+------+----------+---------------------------------------------------------------------------------+----------------+
| PAC01 | PACKAGE BODY |    2 |       15 | OBE-00600: internal error code, arguments: -5055, FUNCTION FUN01 does not exist |          -5055 |
+-------+--------------+------+----------+---------------------------------------------------------------------------------+----------------+
##CURSOR##
DROP TABLE ff01;
CREATE TABLE ff01(a NUMBER,b varchar(10),c char(10));
CREATE OR REPLACE PACKAGE pac01 AS
	CURSOR cur01 IS SELECT a FROM ff01 ;
END;
//
ALTER TABLE ff01 ADD d DATE;
ALTER PACKAGE pac01 compile;
select name, type, line, position, text, message_number from all_errors where name = 'PAC01';
+------+------+------+----------+------+----------------+
| NAME | TYPE | LINE | POSITION | TEXT | MESSAGE_NUMBER |
+------+------+------+----------+------+----------------+
+------+------+------+----------+------+----------------+
DROP TABLE ff01 ;
ALTER PACKAGE pac01 compile;
select name, type, line, position, text, message_number from all_errors where name = 'PAC01';
+-------+--------------+------+----------+--------------------------------------------------------------------+----------------+
| NAME  | TYPE         | LINE | POSITION | TEXT                                                               | MESSAGE_NUMBER |
+-------+--------------+------+----------+--------------------------------------------------------------------+----------------+
| PAC01 | PACKAGE BODY |    2 |        3 | OBE-00942: table or view 'CHI_ALTER_PROCEDURE.FF01' does not exist |          -5019 |
+-------+--------------+------+----------+--------------------------------------------------------------------+----------------+
##FUNCTION##
CREATE TABLE ff01(a NUMBER,b varchar(10),c char(10));
CREATE OR REPLACE PACKAGE pac01 AS
	FUNCTION fun01 RETURN ff01%rowtype;
END;
//
CREATE OR REPLACE PACKAGE body pac01 IS
	FUNCTION fun01 RETURN ff01%rowtype IS
		fun_a ff01%rowtype;
	BEGIN
		fun_a.a :=1;
		RETURN fun_a;
	END fun01;
END;
//
ALTER TABLE ff01 RENAME COLUMN a TO a1;
ALTER PACKAGE pac01 compile body;
select name, type, line, position, text, message_number from all_errors where name = 'PAC01';
+-------+--------------+------+----------+--------------------------------------------+----------------+
| NAME  | TYPE         | LINE | POSITION | TEXT                                       | MESSAGE_NUMBER |
+-------+--------------+------+----------+--------------------------------------------+----------------+
| PAC01 | PACKAGE BODY |    5 |        4 | PLS-00201: identifier 'A' must be declared |          -5543 |
+-------+--------------+------+----------+--------------------------------------------+----------------+
DROP TABLE ff01 ;
ALTER PACKAGE pac01 compile;
select name, type, line, position, text, message_number from all_errors where name = 'PAC01';
+-------+--------------+------+----------+-----------------------------------------------+----------------+
| NAME  | TYPE         | LINE | POSITION | TEXT                                          | MESSAGE_NUMBER |
+-------+--------------+------+----------+-----------------------------------------------+----------------+
| PAC01 | PACKAGE BODY |    2 |       25 | PLS-00201: identifier 'FF01' must be declared |          -5543 |
+-------+--------------+------+----------+-----------------------------------------------+----------------+
DROP VIEW vv01;
CREATE TABLE ff01(a NUMBER,b varchar(10),c char(10));
CREATE VIEW vv01 as SELECT * FROM ff01;
CREATE OR REPLACE PACKAGE pac01 AS
	FUNCTION fun01 RETURN vv01%rowtype;
END;
//
CREATE OR REPLACE PACKAGE body pac01 IS
	FUNCTION fun01 RETURN vv01%rowtype IS
		fun_a vv01%rowtype;
	BEGIN
		RETURN fun_a;
	END fun01;
END;
//
ALTER TABLE ff01 ADD d date;
ALTER PACKAGE pac01 compile;
select name, type, line, position, text, message_number from all_errors where name = 'PAC01';
+------+------+------+----------+------+----------------+
| NAME | TYPE | LINE | POSITION | TEXT | MESSAGE_NUMBER |
+------+------+------+----------+------+----------------+
+------+------+------+----------+------+----------------+
ALTER TABLE ff01 DROP COLUMN a;
ALTER PACKAGE pac01 compile;
select name, type, line, position, text, message_number from all_errors where name = 'PAC01';
+-------+--------------+------+----------+-------------------------+----------------+
| NAME  | TYPE         | LINE | POSITION | TEXT                    | MESSAGE_NUMBER |
+-------+--------------+------+----------+-------------------------+----------------+
| PAC01 | PACKAGE BODY |    2 |        3 | OBE-04063: view invalid |          -5231 |
+-------+--------------+------+----------+-------------------------+----------------+
DROP TABLE ff01;
ALTER PACKAGE pac01 compile;
select name, type, line, position, text, message_number from all_errors where name = 'PAC01';
+-------+--------------+------+----------+-------------------------+----------------+
| NAME  | TYPE         | LINE | POSITION | TEXT                    | MESSAGE_NUMBER |
+-------+--------------+------+----------+-------------------------+----------------+
| PAC01 | PACKAGE BODY |    2 |        3 | OBE-04063: view invalid |          -5231 |
+-------+--------------+------+----------+-------------------------+----------------+
CREATE OR REPLACE TYPE t1 IS TABLE OF int;
//
CREATE OR REPLACE PACKAGE pac01 AS
	FUNCTION fun01 RETURN t1;
END;
//
CREATE OR REPLACE PACKAGE body pac01 IS
	FUNCTION fun01 RETURN t1 IS
		fun_a t1;
	BEGIN
		RETURN fun_a;
	END fun01;
END;
//
DROP TYPE t1;
ALTER PACKAGE pac01 compile;
select name, type, line, position, text, message_number from all_errors where name = 'PAC01';
+-------+--------------+------+----------+-----------------------------------------------------------------------+----------------+
| NAME  | TYPE         | LINE | POSITION | TEXT                                                                  | MESSAGE_NUMBER |
+-------+--------------+------+----------+-----------------------------------------------------------------------+----------------+
| PAC01 | PACKAGE BODY |    3 |        4 | OBE-00600: internal error code, arguments: -5544, Undeclared type: T1 |          -5544 |
+-------+--------------+------+----------+-----------------------------------------------------------------------+----------------+
CREATE TABLE ff01(a NUMBER,b varchar(10),c char(10));
CREATE OR REPLACE PACKAGE pac01 AS
	TYPE t1 IS TABLE OF ff01.a%TYPE;
	FUNCTION fun01 RETURN t1;
END;
//
CREATE OR REPLACE PACKAGE body pac01 IS
	FUNCTION fun01 RETURN t1 IS
		fun_a t1;
	BEGIN
		RETURN fun_a;
	END fun01;
END;
//
DROP TABLE ff01 ;
ALTER PACKAGE pac01 compile;
select name, type, line, position, text, message_number from all_errors where name = 'PAC01';
+-------+--------------+------+----------+-----------------------------------------------------------------------+----------------+
| NAME  | TYPE         | LINE | POSITION | TEXT                                                                  | MESSAGE_NUMBER |
+-------+--------------+------+----------+-----------------------------------------------------------------------+----------------+
| PAC01 | PACKAGE BODY |    2 |        3 | OBE-00600: internal error code, arguments: -5544, Undeclared type: T1 |          -5544 |
+-------+--------------+------+----------+-----------------------------------------------------------------------+----------------+
CREATE OR REPLACE TYPE t1 IS varray(5) OF int;
//
CREATE OR REPLACE PACKAGE pac01 AS
	subtype sub01 IS t1;
	FUNCTION fun01 RETURN sub01;
END;
//
CREATE OR REPLACE PACKAGE body pac01 IS
	FUNCTION fun01 RETURN sub01 IS
		fun_a sub01;
	BEGIN
		RETURN fun_a;
	END fun01;
END;
//
DROP TYPE t1;
ALTER PACKAGE pac01 compile;
select name, type, line, position, text, message_number from all_errors where name = 'PAC01';
+-------+--------------+------+----------+--------------------------------------------------------------------------+----------------+
| NAME  | TYPE         | LINE | POSITION | TEXT                                                                     | MESSAGE_NUMBER |
+-------+--------------+------+----------+--------------------------------------------------------------------------+----------------+
| PAC01 | PACKAGE BODY |    2 |        3 | OBE-00600: internal error code, arguments: -5544, Undeclared type: SUB01 |          -5544 |
+-------+--------------+------+----------+--------------------------------------------------------------------------+----------------+
CREATE TABLE ff01(a NUMBER,b varchar(10),c char(10));
CREATE OR REPLACE PACKAGE pac01 AS
	FUNCTION fun01 (fun_a ff01%rowtype) RETURN NUMBER ;
END;
//
CREATE OR REPLACE PACKAGE body pac01 AS
	FUNCTION fun01 (fun_a ff01%rowtype) RETURN NUMBER IS
	BEGIN
		RETURN 1;
	END;
END;
//
DROP TABLE ff01 ;
ALTER PACKAGE pac01 compile;
select name, type, line, position, text, message_number from all_errors where name = 'PAC01';
+-------+--------------+------+----------+-------------------------------------------------------------------+----------------+
| NAME  | TYPE         | LINE | POSITION | TEXT                                                              | MESSAGE_NUMBER |
+-------+--------------+------+----------+-------------------------------------------------------------------+----------------+
| PAC01 | PACKAGE BODY |    2 |       25 | OBE-00600: internal error code, arguments: -5544, Undeclared type |          -5544 |
+-------+--------------+------+----------+-------------------------------------------------------------------+----------------+
DROP VIEW vv01;
CREATE TABLE ff01(a NUMBER,b varchar(10),c char(10));
CREATE TABLE ff02(x int,y char,z date);
CREATE VIEW vv01 AS SELECT * FROM ff01,ff02;
CREATE OR REPLACE PACKAGE pac01 AS
	FUNCTION fun01 (fun_a vv01%rowtype) RETURN NUMBER ;
END;
//
CREATE OR REPLACE PACKAGE body pac01 AS
	FUNCTION fun01 (fun_a vv01%rowtype) RETURN NUMBER IS
	BEGIN
		RETURN NULL;
	END;
END;
//
ALTER TABLE ff02 DROP COLUMN y;
ALTER PACKAGE pac01 compile;
select name, type, line, position, text, message_number from all_errors where name = 'PAC01';
+-------+--------------+------+----------+-------------------------+----------------+
| NAME  | TYPE         | LINE | POSITION | TEXT                    | MESSAGE_NUMBER |
+-------+--------------+------+----------+-------------------------+----------------+
| PAC01 | PACKAGE BODY |    2 |        3 | OBE-04063: view invalid |          -5231 |
+-------+--------------+------+----------+-------------------------+----------------+
DROP VIEW vv01;
CREATE VIEW vv01 AS SELECT * FROM ff01,ff02;
ALTER PACKAGE pac01 compile;
select name, type, line, position, text, message_number from all_errors where name = 'PAC01';
+------+------+------+----------+------+----------------+
| NAME | TYPE | LINE | POSITION | TEXT | MESSAGE_NUMBER |
+------+------+------+----------+------+----------------+
+------+------+------+----------+------+----------------+
DROP TABLE ff02;
ALTER PACKAGE pac01 compile;
select name, type, line, position, text, message_number from all_errors where name = 'PAC01';
+-------+--------------+------+----------+-------------------------+----------------+
| NAME  | TYPE         | LINE | POSITION | TEXT                    | MESSAGE_NUMBER |
+-------+--------------+------+----------+-------------------------+----------------+
| PAC01 | PACKAGE BODY |    2 |        3 | OBE-04063: view invalid |          -5231 |
+-------+--------------+------+----------+-------------------------+----------------+
DROP VIEW vv01;
DROP TABLE ff01;
CREATE OR REPLACE TYPE t1 IS TABLE OF int;
//
CREATE OR REPLACE PACKAGE pac01 AS
	FUNCTION fun01 (fun_a t1) RETURN NUMBER ;
END;
//
CREATE OR REPLACE PACKAGE body pac01 AS
	FUNCTION fun01 (fun_a t1) RETURN NUMBER IS
	BEGIN
		RETURN NULL;
	END;
END;
//
DROP TYPE t1;
ALTER PACKAGE pac01 compile;
select name, type, line, position, text, message_number from all_errors where name = 'PAC01';
+-------+--------------+------+----------+-----------------------------------------------------------------------+----------------+
| NAME  | TYPE         | LINE | POSITION | TEXT                                                                  | MESSAGE_NUMBER |
+-------+--------------+------+----------+-----------------------------------------------------------------------+----------------+
| PAC01 | PACKAGE BODY |    2 |        3 | OBE-00600: internal error code, arguments: -5544, Undeclared type: T1 |          -5544 |
+-------+--------------+------+----------+-----------------------------------------------------------------------+----------------+
CREATE OR REPLACE TYPE t1 IS varray(5) OF char;
//
CREATE OR REPLACE TYPE t2 IS OBJECT (a int);
//
CREATE OR REPLACE PACKAGE pac01 AS
	FUNCTION fun01 (fun_a t1,fun_b t2) RETURN NUMBER ;
END;
//
CREATE OR REPLACE PACKAGE body pac01 AS
	FUNCTION fun01 (fun_a t1,fun_b t2) RETURN NUMBER IS
	BEGIN
		RETURN NULL;
	END;
END;
//
DROP TYPE t2;
ALTER PACKAGE pac01 compile;
select name, type, line, position, text, message_number from all_errors where name = 'PAC01';
+-------+--------------+------+----------+-----------------------------------------------------------------------+----------------+
| NAME  | TYPE         | LINE | POSITION | TEXT                                                                  | MESSAGE_NUMBER |
+-------+--------------+------+----------+-----------------------------------------------------------------------+----------------+
| PAC01 | PACKAGE BODY |    2 |        3 | OBE-00600: internal error code, arguments: -5544, Undeclared type: T2 |          -5544 |
+-------+--------------+------+----------+-----------------------------------------------------------------------+----------------+
DROP TABLE ff01;
CREATE TABLE ff01(a NUMBER,b varchar(10),c char(10));
CREATE OR REPLACE PACKAGE pac02 AS
	var02 ff01.a%type ;
	FUNCTION fun02 RETURN NUMBER ;
END;
//
CREATE OR REPLACE PACKAGE body pac02 AS
BEGIN
	NULL;
END;
//
CREATE OR REPLACE PACKAGE pac01 AS
	FUNCTION fun01 (fun_a NUMBER := pac02.var02) RETURN NUMBER;
END;
//
CREATE OR REPLACE PACKAGE body pac01 AS
	FUNCTION fun01 (fun_a NUMBER := pac02.var02) RETURN NUMBER AS
	BEGIN
		RETURN NULL;
	END fun01;
END;
//
DROP TABLE ff01;
ALTER PACKAGE pac01 compile;
select name, type, line, position, text, message_number from all_errors where name = 'PAC01';
+-------+--------------+------+----------+------------------------------------------------+----------------+
| NAME  | TYPE         | LINE | POSITION | TEXT                                           | MESSAGE_NUMBER |
+-------+--------------+------+----------+------------------------------------------------+----------------+
| PAC01 | PACKAGE BODY |    2 |       33 | PLS-00201: identifier 'VAR02' must be declared |          -5543 |
+-------+--------------+------+----------+------------------------------------------------+----------------+
##PROCEDURE##
DROP TABLE ff01;
CREATE TABLE ff01(a NUMBER,b varchar(10),c char(10));
CREATE OR REPLACE PACKAGE pac01 AS
	PROCEDURE pro01 (pro_a in ff01.a%type);
END;
//
CREATE OR REPLACE PACKAGE body pac01 AS
	PROCEDURE pro01 (pro_a ff01.a%type) AS
	BEGIN
		NULL;
	END;
END;
//
CREATE OR REPLACE PACKAGE pac02 AS
	PROCEDURE pro02 (pro_a OUT ff01.a%type);
END;
//
CREATE OR REPLACE PACKAGE body pac02 AS
	PROCEDURE pro02 (pro_a OUT ff01.a%type) AS
	BEGIN
		NULL;
	END;
END;
//
DROP TABLE ff01 ;
ALTER PACKAGE pac01 compile;
ALTER PACKAGE pac02 compile;
select name, type, line, position, text, message_number from all_errors where name = 'PAC01';
+-------+--------------+------+----------+-------------------------------------------------------------------+----------------+
| NAME  | TYPE         | LINE | POSITION | TEXT                                                              | MESSAGE_NUMBER |
+-------+--------------+------+----------+-------------------------------------------------------------------+----------------+
| PAC01 | PACKAGE BODY |    2 |        3 | OBE-00600: internal error code, arguments: -5544, Undeclared type |          -5544 |
+-------+--------------+------+----------+-------------------------------------------------------------------+----------------+
select name, type, line, position, text, message_number from all_errors where name = 'PAC02';
+-------+--------------+------+----------+-------------------------------------------------------------------+----------------+
| NAME  | TYPE         | LINE | POSITION | TEXT                                                              | MESSAGE_NUMBER |
+-------+--------------+------+----------+-------------------------------------------------------------------+----------------+
| PAC02 | PACKAGE BODY |    2 |        3 | OBE-00600: internal error code, arguments: -5544, Undeclared type |          -5544 |
+-------+--------------+------+----------+-------------------------------------------------------------------+----------------+
DROP TABLE ff01;
CREATE TABLE ff01(a NUMBER,b varchar(10),c char(10));
CREATE OR REPLACE PACKAGE pac03 AS
	TYPE t1 IS TABLE OF ff01.a%TYPE;
END;
//
CREATE OR REPLACE PACKAGE pac04 AS
	subtype t1 IS pac03.t1;
END;
//
CREATE OR REPLACE PACKAGE pac01 AS
	PROCEDURE pro01 (pro_a pac04.t1);
END ;
//
CREATE OR REPLACE PACKAGE body pac01 AS
	PROCEDURE pro01 (pro_a pac04.t1) AS
	BEGIN
		NULL;
	END;
END;
//
CREATE OR REPLACE PACKAGE pac02 AS
	PROCEDURE pro01 (pro_a out pac04.t1);
END ;
//
CREATE OR REPLACE PACKAGE body pac02 AS
	PROCEDURE pro01 (pro_a out pac04.t1) AS
	BEGIN
		NULL;
	END;
END;
//
DROP TABLE ff01;
ALTER PACKAGE pac01 compile;
ALTER PACKAGE pac02 compile;
select name, type, line, position, text, message_number from all_errors where name = 'PAC01';
+-------+--------------+------+----------+-------------------------------------------------------------------+----------------+
| NAME  | TYPE         | LINE | POSITION | TEXT                                                              | MESSAGE_NUMBER |
+-------+--------------+------+----------+-------------------------------------------------------------------+----------------+
| PAC01 | PACKAGE BODY |    2 |        3 | OBE-00600: internal error code, arguments: -5544, Undeclared type |          -5544 |
+-------+--------------+------+----------+-------------------------------------------------------------------+----------------+
select name, type, line, position, text, message_number from all_errors where name = 'PAC02';
+-------+--------------+------+----------+-------------------------------------------------------------------+----------------+
| NAME  | TYPE         | LINE | POSITION | TEXT                                                              | MESSAGE_NUMBER |
+-------+--------------+------+----------+-------------------------------------------------------------------+----------------+
| PAC02 | PACKAGE BODY |    2 |        3 | OBE-00600: internal error code, arguments: -5544, Undeclared type |          -5544 |
+-------+--------------+------+----------+-------------------------------------------------------------------+----------------+
CREATE OR REPLACE PACKAGE pac02 AS
	var NUMBER;
END;
//
CREATE OR REPLACE PACKAGE pac01 AS
	PROCEDURE pro01(pro_a NUMBER := pac02.var) ;
END;
//
CREATE OR REPLACE PACKAGE body pac01 AS
	PROCEDURE pro01(pro_a NUMBER := pac02.var) AS
	BEGIN
		NULL;
	END pro01;
END;
//
DROP PACKAGE pac02;
ALTER PACKAGE pac01 compile;
select name, type, line, position, text, message_number from all_errors where name = 'PAC01';
+-------+--------------+------+----------+----------------------------------------------+----------------+
| NAME  | TYPE         | LINE | POSITION | TEXT                                         | MESSAGE_NUMBER |
+-------+--------------+------+----------+----------------------------------------------+----------------+
| PAC01 | PACKAGE BODY |    2 |       33 | PLS-00201: identifier 'VAR' must be declared |          -5543 |
+-------+--------------+------+----------+----------------------------------------------+----------------+
###################包体部分COMPILE BODY####################
####声明####
##%rowtype##
DROP TABLE ff01;
CREATE TABLE ff01(a NUMBER,b varchar(10),c char(10));
CREATE OR REPLACE PACKAGE pac01 AS
	var01 NUMBER :=1;
END;
//
CREATE OR REPLACE PACKAGE body pac01 AS
	var02 NUMBER :=2;
END;
//
CREATE OR REPLACE PROCEDURE pro01 (a varchar,b varchar) AS
BEGIN
	EXECUTE IMMEDIATE 'alter package '||a||' compile';
	EXECUTE IMMEDIATE CONCAT('alter package ',b||' compile');
END;
//
CALL pro01('pac01','pac01');
CALL pro01(CONCAT('pac','01'),'pac'||'01');
CREATE OR REPLACE PACKAGE pac01 AS
	var01 ff01.a%type;
END;
//
CREATE OR REPLACE PACKAGE body pac01 AS
	var02 ff01.b%type;
END;
//
CREATE OR REPLACE PROCEDURE pro01 (a varchar) AS
BEGIN
	EXECUTE IMMEDIATE 'alter package '||a||' compile';
	EXECUTE IMMEDIATE CONCAT('alter package ',a||' compile');
END;
//
DROP TABLE ff01;
CALL pro01('pac01');
ALTER PACKAGE pac01 compile;
select name, type, line, position, text, message_number from all_errors where name = 'PAC01';
+-------+--------------+------+----------+-----------------------------------------------+----------------+
| NAME  | TYPE         | LINE | POSITION | TEXT                                          | MESSAGE_NUMBER |
+-------+--------------+------+----------+-----------------------------------------------+----------------+
| PAC01 | PACKAGE BODY |    2 |        3 | PLS-00201: identifier 'FF01' must be declared |          -5543 |
+-------+--------------+------+----------+-----------------------------------------------+----------------+
DROP VIEW vv01;
CREATE OR REPLACE PACKAGE pac01 AS
	var01 vv01.a%type;
END;
//
CREATE OR REPLACE PACKAGE body pac01 AS
	var02 vv01.b%type;
END;
//
CREATE TABLE ff01(a NUMBER,b varchar(10),c char(10));
CREATE VIEW vv01 AS SELECT * FROM ff01;
CALL pro01('pac01');
ALTER PACKAGE pac01 compile;
select name, type, line, position, text, message_number from all_errors where name = 'PAC01';
+------+------+------+----------+------+----------------+
| NAME | TYPE | LINE | POSITION | TEXT | MESSAGE_NUMBER |
+------+------+------+----------+------+----------------+
+------+------+------+----------+------+----------------+
CREATE OR REPLACE PACKAGE body pac01 AS
	var02 subt1 ;
END;
//
CREATE OR REPLACE PACKAGE pac01 AS
	var01 NUMBER;
	subtype subt1 IS int;
END;
//
CALL pro01('pac01');
ALTER PACKAGE pac01 compile;
select name, type, line, position, text, message_number from all_errors where name = 'PAC01';
+------+------+------+----------+------+----------------+
| NAME | TYPE | LINE | POSITION | TEXT | MESSAGE_NUMBER |
+------+------+------+----------+------+----------------+
+------+------+------+----------+------+----------------+
CREATE OR REPLACE TYPE t1 IS TABLE OF int;
//
CREATE OR REPLACE PACKAGE pac01 AS
	var01 NUMBER;
	subtype t1 IS varchar(10);
END;
//
CREATE OR REPLACE PACKAGE body pac01 AS
	var02 t1 ;
END;
//
DROP TYPE t1;
CALL pro01('pac01');
ALTER PACKAGE pac01 compile;
select name, type, line, position, text, message_number from all_errors where name = 'PAC01';
+------+------+------+----------+------+----------------+
| NAME | TYPE | LINE | POSITION | TEXT | MESSAGE_NUMBER |
+------+------+------+----------+------+----------------+
+------+------+------+----------+------+----------------+
CREATE OR REPLACE PACKAGE pac01 AS
	var01 NUMBER;
END;
//
CALL pro01('pac01');
ALTER PACKAGE pac01 compile;
select name, type, line, position, text, message_number from all_errors where name = 'PAC01';
+-------+--------------+------+----------+-----------------------------------------------------------------------+----------------+
| NAME  | TYPE         | LINE | POSITION | TEXT                                                                  | MESSAGE_NUMBER |
+-------+--------------+------+----------+-----------------------------------------------------------------------+----------------+
| PAC01 | PACKAGE BODY |    2 |        3 | OBE-00600: internal error code, arguments: -5544, Undeclared type: T1 |          -5544 |
+-------+--------------+------+----------+-----------------------------------------------------------------------+----------------+
CREATE OR REPLACE PACKAGE pac01 AS
	var01 NUMBER;
END;
//
CREATE OR REPLACE PACKAGE body pac01 AS
	TYPE t1 IS TABLE OF ff01.A%type;
	var01 t1;
BEGIN
	VAR01(1) :=1;
END;
//
CREATE OR REPLACE PACKAGE pac01 AS
	var02 NUMBER;
END;
//
ALTER PACKAGE pac01 compile;
select name, type, line, position, text, message_number from all_errors where name = 'PAC01';
+------+------+------+----------+------+----------------+
| NAME | TYPE | LINE | POSITION | TEXT | MESSAGE_NUMBER |
+------+------+------+----------+------+----------------+
+------+------+------+----------+------+----------------+
DROP TABLE ff01;
ALTER PACKAGE pac01 compile;
select name, type, line, position, text, message_number from all_errors where name = 'PAC01';
+-------+--------------+------+----------+-----------------------------------------------+----------------+
| NAME  | TYPE         | LINE | POSITION | TEXT                                          | MESSAGE_NUMBER |
+-------+--------------+------+----------+-----------------------------------------------+----------------+
| PAC01 | PACKAGE BODY |    2 |        3 | PLS-00201: identifier 'FF01' must be declared |          -5543 |
+-------+--------------+------+----------+-----------------------------------------------+----------------+
CREATE OR REPLACE PACKAGE body pac01 AS
	TYPE t1 IS RECORD(a ff01.a%TYPE,b ff01.b%type);
	var t1;
END;
//
CREATE TABLE ff01(a NUMBER,b varchar(10),c char(10));
ALTER PACKAGE pac01 compile;
select name, type, line, position, text, message_number from all_errors where name = 'PAC01';
+------+------+------+----------+------+----------------+
| NAME | TYPE | LINE | POSITION | TEXT | MESSAGE_NUMBER |
+------+------+------+----------+------+----------------+
+------+------+------+----------+------+----------------+
DROP TABLE ff01;
ALTER PACKAGE pac01 compile;
select name, type, line, position, text, message_number from all_errors where name = 'PAC01';
+-------+--------------+------+----------+-----------------------------------------------+----------------+
| NAME  | TYPE         | LINE | POSITION | TEXT                                          | MESSAGE_NUMBER |
+-------+--------------+------+----------+-----------------------------------------------+----------------+
| PAC01 | PACKAGE BODY |    2 |        3 | PLS-00201: identifier 'FF01' must be declared |          -5543 |
+-------+--------------+------+----------+-----------------------------------------------+----------------+
##默认值##
CREATE OR REPLACE PACKAGE pac01 AS
	var01 NUMBER :=1;
END;
//
CREATE OR REPLACE PACKAGE body pac01 AS
	var02 NUMBER :=var01;
END;
//
CREATE OR REPLACE PACKAGE pac01 AS
	var03 NUMBER :=1;
END;
//
ALTER PACKAGE pac01 compile;
select name, type, line, position, text, message_number from all_errors where name = 'PAC01';
+-------+--------------+------+----------+------------------------------------------------+----------------+
| NAME  | TYPE         | LINE | POSITION | TEXT                                           | MESSAGE_NUMBER |
+-------+--------------+------+----------+------------------------------------------------+----------------+
| PAC01 | PACKAGE BODY |    2 |       17 | PLS-00201: identifier 'VAR01' must be declared |          -5543 |
+-------+--------------+------+----------+------------------------------------------------+----------------+
CREATE OR REPLACE PACKAGE pac02 AS
	var01 NUMBER :=1;
END;
//
CREATE OR REPLACE PACKAGE body pac01 AS
	var02 NUMBER :=pac02.var01;
END;
//
DROP PACKAGE pac02;
ALTER PACKAGE pac01 compile;
select name, type, line, position, text, message_number from all_errors where name = 'PAC01';
+-------+--------------+------+----------+------------------------------------------------+----------------+
| NAME  | TYPE         | LINE | POSITION | TEXT                                           | MESSAGE_NUMBER |
+-------+--------------+------+----------+------------------------------------------------+----------------+
| PAC01 | PACKAGE BODY |    2 |       17 | PLS-00201: identifier 'VAR01' must be declared |          -5543 |
+-------+--------------+------+----------+------------------------------------------------+----------------+
CREATE OR REPLACE FUNCTION fun01 RETURN NUMBER AS
BEGIN
	RETURN 1;
END;
//
CREATE OR REPLACE PACKAGE pac01 AS
	var01 NUMBER :=1;
	FUNCTION fun01 RETURN NUMBER ;
END;
//
CREATE OR REPLACE PACKAGE body pac01 AS
	var02 NUMBER := fun01();
	FUNCTION fun01 RETURN NUMBER AS
	BEGIN
		RETURN 2;
	END;
END;
//
DROP FUNCTION fun01;
ALTER PACKAGE pac01 compile;
select name, type, line, position, text, message_number from all_errors where name = 'PAC01';
+------+------+------+----------+------+----------------+
| NAME | TYPE | LINE | POSITION | TEXT | MESSAGE_NUMBER |
+------+------+------+----------+------+----------------+
+------+------+------+----------+------+----------------+
DROP TABLE ff01;
CREATE TABLE ff01(a NUMBER,b varchar(10),c char(10));
CREATE OR REPLACE FUNCTION fun01 RETURN NUMBER AS
	fun_a NUMBER ;
BEGIN
	SELECT a INTO fun_a FROM ff01 WHERE rownum=1;
	RETURN fun_a;
END;
//
CREATE OR REPLACE PACKAGE pac01 AS
	var01 NUMBER :=fun01();
END;
//
CREATE OR REPLACE PACKAGE body pac01 AS
	var02 NUMBER := 1;
END;
//
DROP TABLE ff01 ;
ALTER PACKAGE pac01 compile;
select name, type, line, position, text, message_number from all_errors where name = 'PAC01';
+------+------+------+----------+------+----------------+
| NAME | TYPE | LINE | POSITION | TEXT | MESSAGE_NUMBER |
+------+------+------+----------+------+----------------+
+------+------+------+----------+------+----------------+
##CURSOR##
CREATE TABLE ff01(a NUMBER,b varchar(10),c char(10));
CREATE OR REPLACE PACKAGE pac01 AS
	var number;
END;
//
CREATE OR REPLACE PACKAGE body pac01 AS
	CURSOR cur01 IS SELECT * FROM ff01;
END;
//
DROP TABLE ff01;
ALTER PACKAGE pac01 compile;
ALTER PACKAGE pac01 compile body;
select name, type, line, position, text, message_number from all_errors where name = 'PAC01';
+-------+--------------+------+----------+--------------------------------------------------------------------+----------------+
| NAME  | TYPE         | LINE | POSITION | TEXT                                                               | MESSAGE_NUMBER |
+-------+--------------+------+----------+--------------------------------------------------------------------+----------------+
| PAC01 | PACKAGE BODY |    2 |        3 | OBE-00942: table or view 'CHI_ALTER_PROCEDURE.FF01' does not exist |          -5019 |
+-------+--------------+------+----------+--------------------------------------------------------------------+----------------+
####PROCEDURE####
##参数##
CREATE OR REPLACE PACKAGE pac01 AS
	PROCEDURE pro01(PRO_A FF01.A%TYPE);
END;
//
CREATE OR REPLACE PACKAGE body pac01 AS
	PROCEDURE pro01 (pro_a ff01.a%type) AS
	BEGIN
		NULL;
	END;
END;
//
CREATE TABLE ff01(a NUMBER,b varchar(10),c char(10));
ALTER PACKAGE pac01 compile;
ALTER PACKAGE pac01 compile body;
select name, type, line, position, text, message_number from all_errors where name = 'PAC01';
+------+------+------+----------+------+----------------+
| NAME | TYPE | LINE | POSITION | TEXT | MESSAGE_NUMBER |
+------+------+------+----------+------+----------------+
+------+------+------+----------+------+----------------+
CREATE OR REPLACE PACKAGE pac01 AS
	SUBTYPE T1 IS FF01.A%TYPE;
	PROCEDURE pro01(PRO_A T1);
END;
//
CREATE OR REPLACE PACKAGE body pac01 AS
	PROCEDURE pro01 (pro_a T1) AS
	BEGIN
		NULL;
	END;
END;
//
DROP TABLE FF01;
ALTER PACKAGE pac01 compile;
ALTER PACKAGE pac01 compile body;
select name, type, line, position, text, message_number from all_errors where name = 'PAC01';
+-------+--------------+------+----------+-----------------------------------------------------------------------+----------------+
| NAME  | TYPE         | LINE | POSITION | TEXT                                                                  | MESSAGE_NUMBER |
+-------+--------------+------+----------+-----------------------------------------------------------------------+----------------+
| PAC01 | PACKAGE BODY |    2 |        3 | OBE-00600: internal error code, arguments: -5544, Undeclared type: T1 |          -5544 |
+-------+--------------+------+----------+-----------------------------------------------------------------------+----------------+
##AS##
DROP TABLE ff01;
CREATE TABLE ff01(a NUMBER,b varchar(10),c char(10));
CREATE OR REPLACE PACKAGE pac01 AS
	PROCEDURE pro01 ;
END;
//
CREATE OR REPLACE PACKAGE body pac01 AS
	PROCEDURE pro01 AS
		pro_a ff01.a%TYPE;
	BEGIN
		NULL;
	END;
END;
//
DROP TABLE ff01 ;
ALTER PACKAGE pac01 compile;
ALTER PACKAGE pac01 compile body;
select name, type, line, position, text, message_number from all_errors where name = 'PAC01';
+-------+--------------+------+----------+-----------------------------------------------+----------------+
| NAME  | TYPE         | LINE | POSITION | TEXT                                          | MESSAGE_NUMBER |
+-------+--------------+------+----------+-----------------------------------------------+----------------+
| PAC01 | PACKAGE BODY |    3 |        4 | PLS-00201: identifier 'FF01' must be declared |          -5543 |
+-------+--------------+------+----------+-----------------------------------------------+----------------+
DROP VIEW vv01;
CREATE TABLE ff01(a NUMBER,b varchar(10),c char(10));
CREATE VIEW vv01 AS SELECT * FROM ff01;
CREATE OR REPLACE PACKAGE body pac01 AS
	PROCEDURE pro01 AS
		pro_a vv01.a%TYPE;
	BEGIN
		NULL;
	END;
END;
//
DROP TABLE ff01 ;
ALTER PACKAGE pac01 compile;
ALTER PACKAGE pac01 compile body;
select name, type, line, position, text, message_number from all_errors where name = 'PAC01';
+-------+--------------+------+----------+-------------------------+----------------+
| NAME  | TYPE         | LINE | POSITION | TEXT                    | MESSAGE_NUMBER |
+-------+--------------+------+----------+-------------------------+----------------+
| PAC01 | PACKAGE BODY |    3 |        4 | OBE-04063: view invalid |          -5231 |
+-------+--------------+------+----------+-------------------------+----------------+
CREATE OR REPLACE PACKAGE pac01 AS
	PROCEDURE pro01 ;
	subtype t1 IS NUMBER;
END;
//
CREATE OR REPLACE PACKAGE body pac01 AS
	PROCEDURE pro01 AS
		pro_a t1;
	BEGIN
		NULL;
	END;
END;
//
CREATE OR REPLACE PACKAGE pac01 AS
	PROCEDURE pro01 ;
	subtype t2 IS NUMBER;
END;
//
ALTER PACKAGE pac01 compile;
ALTER PACKAGE pac01 compile body;
select name, type, line, position, text, message_number from all_errors where name = 'PAC01';
+-------+--------------+------+----------+-----------------------------------------------------------------------+----------------+
| NAME  | TYPE         | LINE | POSITION | TEXT                                                                  | MESSAGE_NUMBER |
+-------+--------------+------+----------+-----------------------------------------------------------------------+----------------+
| PAC01 | PACKAGE BODY |    3 |        4 | OBE-00600: internal error code, arguments: -5544, Undeclared type: T1 |          -5544 |
+-------+--------------+------+----------+-----------------------------------------------------------------------+----------------+
CREATE OR REPLACE PACKAGE pac01 AS
	PROCEDURE pro01 ;
	TYPE t1 IS varray(10) OF NUMBER;
END;
//
CREATE OR REPLACE PACKAGE body pac01 AS
	PROCEDURE pro01 AS
		pro_a t1;
	BEGIN
		NULL;
	END;
END;
//
CREATE OR REPLACE PACKAGE pac01 AS
	PROCEDURE pro01 ;
	type t1 IS TABLE OF varchar(10);
END;
//
CREATE OR REPLACE TYPE t1 IS TABLE OF int;
//
DROP TYPE t1;
ALTER PACKAGE pac01 compile;
ALTER PACKAGE pac01 compile body;
select name, type, line, position, text, message_number from all_errors where name = 'PAC01';
+------+------+------+----------+------+----------------+
| NAME | TYPE | LINE | POSITION | TEXT | MESSAGE_NUMBER |
+------+------+------+----------+------+----------------+
+------+------+------+----------+------+----------------+
CREATE OR REPLACE PACKAGE pac02 AS
	var NUMBER;
END;
//
CREATE OR REPLACE PACKAGE pac01 AS
	PROCEDURE pro01;
END;
//
CREATE OR REPLACE PACKAGE body pac01 AS
	PROCEDURE pro01 AS
		pro_a NUMBER := pac02.var;
	BEGIN
		NULL;
	END;
END;
//
DROP PACKAGE pac02 ;
ALTER PACKAGE pac01 compile;
ALTER PACKAGE pac01 compile body;
select name, type, line, position, text, message_number from all_errors where name = 'PAC01';
+-------+--------------+------+----------+----------------------------------------------+----------------+
| NAME  | TYPE         | LINE | POSITION | TEXT                                         | MESSAGE_NUMBER |
+-------+--------------+------+----------+----------------------------------------------+----------------+
| PAC01 | PACKAGE BODY |    3 |       18 | PLS-00201: identifier 'VAR' must be declared |          -5543 |
+-------+--------------+------+----------+----------------------------------------------+----------------+
CREATE OR REPLACE PACKAGE pac01 AS
	PROCEDURE pro01;
	var NUMBER;
END;
//
CREATE OR REPLACE PACKAGE body pac01 AS
	PROCEDURE pro01 AS
		pro_a NUMBER := var;
	BEGIN
		NULL;
	END;
END;
//
CREATE OR REPLACE PACKAGE pac01 AS
	PROCEDURE pro01;
END;
//
ALTER PACKAGE pac01 compile;
ALTER PACKAGE pac01 compile body;
select name, type, line, position, text, message_number from all_errors where name = 'PAC01';
+-------+--------------+------+----------+----------------------------------------------+----------------+
| NAME  | TYPE         | LINE | POSITION | TEXT                                         | MESSAGE_NUMBER |
+-------+--------------+------+----------+----------------------------------------------+----------------+
| PAC01 | PACKAGE BODY |    3 |       18 | PLS-00201: identifier 'VAR' must be declared |          -5543 |
+-------+--------------+------+----------+----------------------------------------------+----------------+
DROP TABLE ff01;
CREATE TABLE ff01(a NUMBER,b varchar(10),c char(10));
CREATE OR REPLACE PACKAGE pac01 AS
	PROCEDURE pro01;
	FUNCTION fun01 RETURN NUMBER;
END;
//
CREATE OR REPLACE PACKAGE body pac01 AS
	PROCEDURE pro01 AS
		pro_a NUMBER := fun01();
	BEGIN
		NULL;
	END;
	FUNCTION fun01 RETURN NUMBER AS
		fun_a NUMBER;
	BEGIN
		SELECT a INTO fun_a FROM ff01 WHERE rownum=1;
		RETURN fun_a;
	END;
END;
//
DROP TABLE ff01;
ALTER PACKAGE pac01 compile;
ALTER PACKAGE pac01 compile body;
select name, type, line, position, text, message_number from all_errors where name = 'PAC01';
+-------+--------------+------+----------+--------------------------------------------------------------------+----------------+
| NAME  | TYPE         | LINE | POSITION | TEXT                                                               | MESSAGE_NUMBER |
+-------+--------------+------+----------+--------------------------------------------------------------------+----------------+
| PAC01 | PACKAGE BODY |   10 |        4 | OBE-00942: table or view 'CHI_ALTER_PROCEDURE.FF01' does not exist |          -5019 |
+-------+--------------+------+----------+--------------------------------------------------------------------+----------------+
CREATE OR REPLACE PACKAGE pac01 AS
	PROCEDURE pro01;
END;
//
CREATE OR REPLACE PACKAGE body pac01 AS
	PROCEDURE pro01 AS
		pro_a NUMBER := fun01();
	BEGIN
		NULL;
	END;
	FUNCTION fun01 RETURN NUMBER AS
	BEGIN
		RETURN 1;
	END;
END;
//
CREATE OR REPLACE FUNCTION fun01 RETURN NUMBER AS
	fun_a NUMBER;
BEGIN
	fun_a := 2;
	RETURN fun_a;
END;
//
DROP FUNCTION fun01 ;
ALTER PACKAGE pac01 compile;
ALTER PACKAGE pac01 compile body;
select name, type, line, position, text, message_number from all_errors where name = 'PAC01';
+-------+--------------+------+----------+---------------------------------------------------------------------------------+----------------+
| NAME  | TYPE         | LINE | POSITION | TEXT                                                                            | MESSAGE_NUMBER |
+-------+--------------+------+----------+---------------------------------------------------------------------------------+----------------+
| PAC01 | PACKAGE BODY |    3 |       18 | OBE-00600: internal error code, arguments: -5055, FUNCTION FUN01 does not exist |          -5055 |
+-------+--------------+------+----------+---------------------------------------------------------------------------------+----------------+
##cursor##
DROP TABLE ff01;
CREATE TABLE ff01(a NUMBER,b varchar(10),c char(10));
CREATE OR REPLACE PACKAGE pac01 AS
	PROCEDURE pro01;
END;
//
CREATE OR REPLACE PACKAGE body pac01 AS
	PROCEDURE pro01 AS
		CURSOR cur01 is SELECT * FROM ff01;
	BEGIN
		NULL;
	END;
END;
//
DROP TABLE ff01;
ALTER PACKAGE pac01 compile;
ALTER PACKAGE pac01 compile body;
select name, type, line, position, text, message_number from all_errors where name = 'PAC01';
+-------+--------------+------+----------+--------------------------------------------------------------------+----------------+
| NAME  | TYPE         | LINE | POSITION | TEXT                                                               | MESSAGE_NUMBER |
+-------+--------------+------+----------+--------------------------------------------------------------------+----------------+
| PAC01 | PACKAGE BODY |    3 |        4 | OBE-00942: table or view 'CHI_ALTER_PROCEDURE.FF01' does not exist |          -5019 |
+-------+--------------+------+----------+--------------------------------------------------------------------+----------------+
CREATE TABLE ff01(a NUMBER,b varchar(10),c char(10));
CREATE OR REPLACE FUNCTION fun01 RETURN NUMBER AS
	fun_a NUMBER;
BEGIN
	SELECT a INTO fun_a FROM ff01 WHERE rownum=1;
	RETURN fun_a;
END;
//
CREATE OR REPLACE PACKAGE pac01 AS
	PROCEDURE pro01;
END;
//
CREATE OR REPLACE PACKAGE body pac01 AS
	PROCEDURE pro01 AS
		CURSOR cur01 is SELECT FUN01() FROM DUAL;
	BEGIN
		NULL;
	END;
END;
//
DROP TABLE ff01;
ALTER PACKAGE pac01 compile;
ALTER PACKAGE pac01 compile body;
select name, type, line, position, text, message_number from all_errors where name = 'PAC01';
+------+------+------+----------+------+----------------+
| NAME | TYPE | LINE | POSITION | TEXT | MESSAGE_NUMBER |
+------+------+------+----------+------+----------------+
+------+------+------+----------+------+----------------+
####执行部分####
##execute immediate##
DROP PACKAGE pac02;
CREATE OR REPLACE PACKAGE PAC01 AS
	PROCEDURE pro01;
END;
//
CREATE OR REPLACE PACKAGE BODY PAC01 AS
	PROCEDURE PRO01 AS
	BEGIN
		execute IMMEDIATE 'alter package pac02 compile';
	END;
END;
//
ALTER PACKAGE pac01 compile;
select name, type, line, position, text, message_number from all_errors where name = 'PAC01';
+------+------+------+----------+------+----------------+
| NAME | TYPE | LINE | POSITION | TEXT | MESSAGE_NUMBER |
+------+------+------+----------+------+----------------+
+------+------+------+----------+------+----------------+
##dml##
DROP TABLE ff01;
CREATE TABLE ff01(a NUMBER,b varchar(10),c char(10));
CREATE OR REPLACE PACKAGE BODY PAC01 AS
	PROCEDURE PRO01 AS
	BEGIN
		INSERT INTO ff01(a) VALUES (1);
	END;
END;
//
DROP TABLE ff01;
ALTER PACKAGE pac01 compile;
ALTER PACKAGE pac01 compile body;
select name, type, line, position, text, message_number from all_errors where name = 'PAC01';
+-------+--------------+------+----------+--------------------------------------------------------------------+----------------+
| NAME  | TYPE         | LINE | POSITION | TEXT                                                               | MESSAGE_NUMBER |
+-------+--------------+------+----------+--------------------------------------------------------------------+----------------+
| PAC01 | PACKAGE BODY |    4 |        4 | OBE-00942: table or view 'CHI_ALTER_PROCEDURE.FF01' does not exist |          -5019 |
+-------+--------------+------+----------+--------------------------------------------------------------------+----------------+
DROP VIEW vv01;
CREATE TABLE ff01(a NUMBER,b varchar(10),c char(10));
CREATE VIEW vv01 AS SELECT * FROM ff01;
CREATE OR REPLACE PACKAGE BODY PAC01 AS
	PROCEDURE PRO01 AS
	BEGIN
		DELETE FROM vv01;
	END;
END;
//
DROP TABLE ff01;
ALTER PACKAGE pac01 compile;
ALTER PACKAGE pac01 compile body;
select name, type, line, position, text, message_number from all_errors where name = 'PAC01';
+-------+--------------+------+----------+-------------------------------------------------------+----------------+
| NAME  | TYPE         | LINE | POSITION | TEXT                                                  | MESSAGE_NUMBER |
+-------+--------------+------+----------+-------------------------------------------------------+----------------+
| PAC01 | PACKAGE BODY |    4 |        4 | OBE-04063: view 'CHI_ALTER_PROCEDURE.VV01' has errors |          -5231 |
+-------+--------------+------+----------+-------------------------------------------------------+----------------+
DROP VIEW vv01;
##SELECT INTO##
CREATE TABLE ff01(a NUMBER,b varchar(10),c char(10));
CREATE OR REPLACE PACKAGE BODY PAC01 AS
	PROCEDURE PRO01 AS
		pro_a NUMBER;
	BEGIN
		SELECT a INTO pro_a FROM ff01 WHERE rownum=1;
	END;
END;
//
DROP TABLE ff01;
ALTER PACKAGE pac01 compile;
ALTER PACKAGE pac01 compile body;
select name, type, line, position, text, message_number from all_errors where name = 'PAC01';
+-------+--------------+------+----------+--------------------------------------------------------------------+----------------+
| NAME  | TYPE         | LINE | POSITION | TEXT                                                               | MESSAGE_NUMBER |
+-------+--------------+------+----------+--------------------------------------------------------------------+----------------+
| PAC01 | PACKAGE BODY |    5 |        4 | OBE-00942: table or view 'CHI_ALTER_PROCEDURE.FF01' does not exist |          -5019 |
+-------+--------------+------+----------+--------------------------------------------------------------------+----------------+
CREATE TABLE ff01(a NUMBER,b varchar(10),c char(10));
CREATE OR REPLACE PACKAGE pac02 AS
	var ff01.a%type;
END;
//
CREATE OR REPLACE PACKAGE BODY PAC01 AS
	PROCEDURE PRO01 AS
	BEGIN
		SELECT 1 INTO pac02.var FROM dual;
	END;
END;
//
DROP TABLE ff01;
ALTER PACKAGE pac01 compile;
ALTER PACKAGE pac01 compile body;
select name, type, line, position, text, message_number from all_errors where name = 'PAC01';
+-------+--------------+------+----------+----------------------------------------------+----------------+
| NAME  | TYPE         | LINE | POSITION | TEXT                                         | MESSAGE_NUMBER |
+-------+--------------+------+----------+----------------------------------------------+----------------+
| PAC01 | PACKAGE BODY |    4 |        4 | PLS-00201: identifier 'VAR' must be declared |          -5543 |
+-------+--------------+------+----------+----------------------------------------------+----------------+
##subprogram##
CREATE TABLE ff01(a NUMBER,b varchar(10),c char(10));
CREATE OR REPLACE PROCEDURE pro02 AS
BEGIN
	DELETE FROM ff01;
END;
//
CREATE OR REPLACE PACKAGE BODY PAC01 AS
	PROCEDURE PRO01 AS
	BEGIN
		pro02();
	END;
END;
//
DROP PROCEDURE pro02;
ALTER PACKAGE pac01 compile;
ALTER PACKAGE pac01 compile body;
select name, type, line, position, text, message_number from all_errors where name = 'PAC01';
+-------+--------------+------+----------+----------------------------------------------------------------------------------+----------------+
| NAME  | TYPE         | LINE | POSITION | TEXT                                                                             | MESSAGE_NUMBER |
+-------+--------------+------+----------+----------------------------------------------------------------------------------+----------------+
| PAC01 | PACKAGE BODY |    4 |        4 | OBE-00600: internal error code, arguments: -5055, PROCEDURE PRO02 does not exist |          -5055 |
+-------+--------------+------+----------+----------------------------------------------------------------------------------+----------------+
CREATE OR REPLACE FUNCTION fun01 RETURN NUMBER AS
	fun_a NUMBER;
BEGIN
	SELECT a INTO fun_a FROM ff01 WHERE rownum=1;
END;
//
CREATE OR REPLACE PACKAGE BODY PAC01 AS
	PROCEDURE PRO01 AS
		pro_a NUMBER;
	BEGIN
		pro_a := fun01();
	END;
END;
//
DROP FUNCTION fun01;
ALTER PACKAGE pac01 compile;
ALTER PACKAGE pac01 compile body;
select name, type, line, position, text, message_number from all_errors where name = 'PAC01';
+-------+--------------+------+----------+---------------------------------------------------------------------------------+----------------+
| NAME  | TYPE         | LINE | POSITION | TEXT                                                                            | MESSAGE_NUMBER |
+-------+--------------+------+----------+---------------------------------------------------------------------------------+----------------+
| PAC01 | PACKAGE BODY |    5 |       11 | OBE-00600: internal error code, arguments: -5055, FUNCTION FUN01 does not exist |          -5055 |
+-------+--------------+------+----------+---------------------------------------------------------------------------------+----------------+
##CURSOR##
CREATE OR REPLACE PACKAGE pac02 IS
	var NUMBER;
	CURSOR CUR01 IS SELECT * FROM ff01;
END;
//
CREATE OR REPLACE PACKAGE pac01 AS
	PROCEDURE pro01;
END;
//
CREATE OR REPLACE PACKAGE body pac01 AS
	PROCEDURE pro01 AS
	BEGIN
		FOR i IN pac02.cur01 LOOP
			dbms_output.put_line(i.a);
		END LOOP;
	END;
END;
//
DROP TABLE ff01 ;
ALTER PACKAGE pac01 compile;
ALTER PACKAGE pac01 compile body;
select name, type, line, position, text, message_number from all_errors where name = 'PAC01';
+-------+--------------+------+----------+--------------------------------------------------------------------+----------------+
| NAME  | TYPE         | LINE | POSITION | TEXT                                                               | MESSAGE_NUMBER |
+-------+--------------+------+----------+--------------------------------------------------------------------+----------------+
| PAC01 | PACKAGE BODY |    3 |        3 | OBE-00942: table or view 'CHI_ALTER_PROCEDURE.FF01' does not exist |          -5019 |
+-------+--------------+------+----------+--------------------------------------------------------------------+----------------+
####function####
##AS##
DROP TABLE ff01;
CREATE TABLE ff01(a NUMBER,b varchar(10),c char(10));
CREATE OR REPLACE PACKAGE pac01 AS
	FUNCTION fun01 RETURN number;
END;
//
CREATE OR REPLACE PACKAGE body pac01 AS
	FUNCTION fun01 RETURN NUMBER AS
		fun_a ff01.a%TYPE;
	BEGIN
		RETURN 1;
	END;
END;
//
DROP TABLE ff01;
ALTER PACKAGE pac01 compile;
ALTER PACKAGE pac01 compile body;
select name, type, line, position, text, message_number from all_errors where name = 'PAC01';
+-------+--------------+------+----------+-----------------------------------------------+----------------+
| NAME  | TYPE         | LINE | POSITION | TEXT                                          | MESSAGE_NUMBER |
+-------+--------------+------+----------+-----------------------------------------------+----------------+
| PAC01 | PACKAGE BODY |    3 |        4 | PLS-00201: identifier 'FF01' must be declared |          -5543 |
+-------+--------------+------+----------+-----------------------------------------------+----------------+
CREATE OR REPLACE TYPE t1 AS TABLE OF int;
//
CREATE OR REPLACE PACKAGE body pac01 AS
	FUNCTION fun01 RETURN NUMBER AS
		fun_a t1;
	BEGIN
		RETURN 1;
	END;
END;
//
DROP TYPE t1;
ALTER PACKAGE pac01 compile;
ALTER PACKAGE pac01 compile body;
select name, type, line, position, text, message_number from all_errors where name = 'PAC01';
+-------+--------------+------+----------+-----------------------------------------------------------------------+----------------+
| NAME  | TYPE         | LINE | POSITION | TEXT                                                                  | MESSAGE_NUMBER |
+-------+--------------+------+----------+-----------------------------------------------------------------------+----------------+
| PAC01 | PACKAGE BODY |    3 |        4 | OBE-00600: internal error code, arguments: -5544, Undeclared type: T1 |          -5544 |
+-------+--------------+------+----------+-----------------------------------------------------------------------+----------------+
CREATE OR REPLACE PACKAGE pac02 AS
	var NUMBER;
END;
//
CREATE OR REPLACE PACKAGE body pac01 AS
	FUNCTION fun01 RETURN NUMBER AS
		fun_a NUMBER:= pac02.var;
	BEGIN
		RETURN 1;
	END;
END;
//
DROP PACKAGE pac02;
ALTER PACKAGE pac01 compile;
ALTER PACKAGE pac01 compile body;
select name, type, line, position, text, message_number from all_errors where name = 'PAC01';
+-------+--------------+------+----------+----------------------------------------------+----------------+
| NAME  | TYPE         | LINE | POSITION | TEXT                                         | MESSAGE_NUMBER |
+-------+--------------+------+----------+----------------------------------------------+----------------+
| PAC01 | PACKAGE BODY |    3 |       17 | PLS-00201: identifier 'VAR' must be declared |          -5543 |
+-------+--------------+------+----------+----------------------------------------------+----------------+
DROP TABLE ff01;
CREATE TABLE ff01(a NUMBER,b varchar(10),c char(10));
CREATE OR REPLACE FUNCTION fun02 RETURN NUMBER AS
	fun_a ff01.a%type;
BEGIN
	RETURN 1;
END;
//
CREATE OR REPLACE PACKAGE body pac01 AS
	FUNCTION fun01 RETURN NUMBER AS
		fun_a NUMBER:= fun02();
	BEGIN
		RETURN 1;
	END;
END;
//
DROP FUNCTION fun02;
ALTER PACKAGE pac01 compile;
ALTER PACKAGE pac01 compile body;
select name, type, line, position, text, message_number from all_errors where name = 'PAC01';
+-------+--------------+------+----------+---------------------------------------------------------------------------------+----------------+
| NAME  | TYPE         | LINE | POSITION | TEXT                                                                            | MESSAGE_NUMBER |
+-------+--------------+------+----------+---------------------------------------------------------------------------------+----------------+
| PAC01 | PACKAGE BODY |    3 |       17 | OBE-00600: internal error code, arguments: -5055, FUNCTION FUN02 does not exist |          -5055 |
+-------+--------------+------+----------+---------------------------------------------------------------------------------+----------------+
DROP TABLE ff01;
CREATE TABLE ff01(a NUMBER,b varchar(10),c char(10));
CREATE OR REPLACE PACKAGE body pac01 AS
	FUNCTION fun01 RETURN NUMBER AS
		subtype t1 IS ff01.a%type;
	BEGIN
		RETURN 1;
	END;
END;
//
CREATE OR REPLACE PACKAGE pac02 AS
	FUNCTION fun02 RETURN varchar;
END;
//
CREATE OR REPLACE PACKAGE body pac02 AS
	FUNCTION fun02 RETURN varchar AS
		TYPE t1 is TABLE OF ff01.a%TYPE;
	BEGIN
		RETURN '1';
	END;
END;
//
DROP TABLE ff01;
ALTER PACKAGE pac01 compile;
ALTER PACKAGE pac02 compile;
select name, type, line, position, text, message_number from all_errors where name = 'PAC01';
+-------+--------------+------+----------+-----------------------------------------------+----------------+
| NAME  | TYPE         | LINE | POSITION | TEXT                                          | MESSAGE_NUMBER |
+-------+--------------+------+----------+-----------------------------------------------+----------------+
| PAC01 | PACKAGE BODY |    3 |        4 | PLS-00201: identifier 'FF01' must be declared |          -5543 |
+-------+--------------+------+----------+-----------------------------------------------+----------------+
CREATE TABLE ff01(a NUMBER,b varchar(10),c char(10));
CREATE OR REPLACE PACKAGE body pac01 AS
	FUNCTION fun01 RETURN NUMBER AS
		CURSOR cur01 is SELECT * FROM ff01;
	BEGIN
		RETURN 1;
	END;
END;
//
CREATE OR REPLACE FUNCTION fun02 RETURN NUMBER AS
	fun_a ff01.a%type;
BEGIN
	RETURN 1;
END;
//
CREATE OR REPLACE PACKAGE body pac02 AS
	FUNCTION fun02 RETURN varchar AS
		CURSOR cur01 is SELECT fun02() FROM dual;
	BEGIN
		RETURN 1;
	END;
END;
//
DROP TABLE ff01;
ALTER PACKAGE pac01 compile;
ALTER PACKAGE pac02 compile;
select name, type, line, position, text, message_number from all_errors where name = 'PAC01';
+-------+--------------+------+----------+--------------------------------------------------------------------+----------------+
| NAME  | TYPE         | LINE | POSITION | TEXT                                                               | MESSAGE_NUMBER |
+-------+--------------+------+----------+--------------------------------------------------------------------+----------------+
| PAC01 | PACKAGE BODY |    3 |        4 | OBE-00942: table or view 'CHI_ALTER_PROCEDURE.FF01' does not exist |          -5019 |
+-------+--------------+------+----------+--------------------------------------------------------------------+----------------+
##BEGIN##
CREATE TABLE ff01(a NUMBER,b varchar(10),c char(10));
CREATE OR REPLACE PROCEDURE pro01 AS
BEGIN
	DELETE FROM ff01;
END;
//
CREATE OR REPLACE FUNCTION fun01 RETURN varchar AS
	fun_a VARCHAR(10);
BEGIN
	SELECT b INTO fun_a FROM ff01 WHERE rownum=1;
	RETURN fun_a;
END;
//
CREATE OR REPLACE PACKAGE pac_test AS
	var_test NUMBER ;
	CURSOR cur_test IS SELECT * FROM ff01;
END;
//
CREATE OR REPLACE PACKAGE body pac01 AS
	FUNCTION fun01 RETURN NUMBER AS
	BEGIN
		pro01();
		RETURN 1;
	END;
END;
//
CREATE OR REPLACE PACKAGE body pac02 AS
	FUNCTION fun02 RETURN varchar AS
	BEGIN
		RETURN fun01();
	END;
END;
//
CREATE OR REPLACE PACKAGE pac03 AS
	FUNCTION fun03 RETURN NUMBER ;
END;
//
CREATE OR REPLACE PACKAGE body pac03 AS
	FUNCTION fun03 RETURN NUMBER AS
		fun03_a NUMBER;
	BEGIN
		OPEN pac_test.cur_test;
		CLOSE pac_test.cur_test;
	END;
END;
//
CREATE OR REPLACE PACKAGE pac04 AS
	FUNCTION fun04 RETURN NUMBER ;
END;
//
CREATE OR REPLACE PACKAGE body pac04 AS
	FUNCTION fun04 RETURN NUMBER AS
		fun04_a NUMBER;
	BEGIN
		fun04_a := pac_test.var_test;
		RETURN fun04_a;
	END;
END;
//
DROP TABLE ff01;
ALTER PACKAGE pac01 compile;
select name, type, line, position, text, message_number from all_errors where name = 'PAC01';
+------+------+------+----------+------+----------------+
| NAME | TYPE | LINE | POSITION | TEXT | MESSAGE_NUMBER |
+------+------+------+----------+------+----------------+
+------+------+------+----------+------+----------------+
ALTER PACKAGE pac02 compile;
select name, type, line, position, text, message_number from all_errors where name = 'PAC02';
+------+------+------+----------+------+----------------+
| NAME | TYPE | LINE | POSITION | TEXT | MESSAGE_NUMBER |
+------+------+------+----------+------+----------------+
+------+------+------+----------+------+----------------+
ALTER PACKAGE pac03 compile;
select name, type, line, position, text, message_number from all_errors where name = 'PAC03';
+-------+--------------+------+----------+--------------------------------------------------------------------+----------------+
| NAME  | TYPE         | LINE | POSITION | TEXT                                                               | MESSAGE_NUMBER |
+-------+--------------+------+----------+--------------------------------------------------------------------+----------------+
| PAC03 | PACKAGE BODY |    3 |        3 | OBE-00942: table or view 'CHI_ALTER_PROCEDURE.FF01' does not exist |          -5019 |
+-------+--------------+------+----------+--------------------------------------------------------------------+----------------+
ALTER PACKAGE pac04 compile;
select name, type, line, position, text, message_number from all_errors where name = 'PAC04';
+-------+--------------+------+----------+-----------------------------------------+----------------+
| NAME  | TYPE         | LINE | POSITION | TEXT                                    | MESSAGE_NUMBER |
+-------+--------------+------+----------+-----------------------------------------+----------------+
| PAC04 | PACKAGE BODY |    5 |       13 | OBE-00942: table or view does not exist |          -5019 |
+-------+--------------+------+----------+-----------------------------------------+----------------+
####异常####
DROP TABLE ff01;
CREATE TABLE ff01(a NUMBER,b varchar(10),c char(10));
CREATE OR REPLACE PACKAGE pac01 AS
	exc01 EXCEPTION;
END;
//
CREATE OR REPLACE PACKAGE body pac01 AS
BEGIN
	NULL;
EXCEPTION
	WHEN exc01 THEN
		DELETE FROM ff01;
	WHEN OTHERS THEN
		DBMS_OUTPUT.PUT_LINE('error');
END;
//
DROP TABLE ff01;
ALTER PACKAGE pac01 compile;
select name, type, line, position, text, message_number from all_errors where name = 'PAC01';
+-------+--------------+------+----------+--------------------------------------------------------------------+----------------+
| NAME  | TYPE         | LINE | POSITION | TEXT                                                               | MESSAGE_NUMBER |
+-------+--------------+------+----------+--------------------------------------------------------------------+----------------+
| PAC01 | PACKAGE BODY |    6 |        4 | OBE-00942: table or view 'CHI_ALTER_PROCEDURE.FF01' does not exist |          -5019 |
+-------+--------------+------+----------+--------------------------------------------------------------------+----------------+
CREATE TABLE ff01(a NUMBER,b varchar(10),c char(10));
CREATE OR REPLACE PACKAGE pac02 AS
	exc02 EXCEPTION;
END;
//
CREATE OR REPLACE PACKAGE BODY pac02 AS
BEGIN
	NULL;
EXCEPTION
	WHEN exc02 THEN
		DELETE FROM ff01;
END;
//
CREATE OR REPLACE PACKAGE body pac01 AS
BEGIN
	raise pac02.exc02;
EXCEPTION
	WHEN OTHERS THEN
		DBMS_OUTPUT.PUT_LINE('error');
END;
//
DROP TABLE ff01;
ALTER PACKAGE pac01 compile;
select name, type, line, position, text, message_number from all_errors where name = 'PAC01';
+------+------+------+----------+------+----------------+
| NAME | TYPE | LINE | POSITION | TEXT | MESSAGE_NUMBER |
+------+------+------+----------+------+----------------+
+------+------+------+----------+------+----------------+
drop user CHI_ALTER_PROCEDURE cascade;
