purge recyclebin;
drop user ljh cascade;
# 创建用户并使用
create user ljh IDENTIFIED BY ljh;
grant all on *.* to ljh WITH GRANT OPTION;
grant dba to ljh;
SET wait_timeout=30000000;
SET ob_trx_timeout = 30000000;
SET ob_query_timeout = 30000000;
alter session set nls_date_format ='YYYY-MM-DD HH24:MI:SS';
alter session set nls_timestamp_format='YYYY-MM-DD HH24:MI:SS.FF';
alter session set nls_timestamp_tz_format='YYYY-MM-DD HH24:MI:SS.FF TZR TZD';
alter session set time_zone='+08:00';
drop materialized view log on t1;
drop materialized view log on t2;
drop materialized view log on mv1;
drop materialized view log on mv2;
drop materialized view mv1;
drop materialized view mv2;
drop table t1;
drop table t2;
##增加多表join增量刷新的case
##两表内连接
create table t1 (c1 number(10) primary key,c2 number(10), c3 number, c4 number);
create table t2 (a1 number(10) primary key,a2 number(10), a3 number, a4 number);
create materialized view log on t1 parallel 2 with primary key, rowid, sequence (c2,c3,c4) including new values;
create materialized view log on t2 parallel 2 with primary key, rowid, sequence (a2,a3,a4) including new values;
create materialized view mv1  parallel 2 refresh fast on demand  as select c1 as c1,a1 as a1 from t1,t2 where t1.c1 = t2.a1 ;
insert into t1 values(1,2,3,4);
insert into t2 values(1,1,3,4);
CALL DBMS_MVIEW.REFRESH('mv1','f');
select * from mv1;
C1	A1
1	1
drop materialized view mv1;
##使用union all/union
DROP materialized view mv1;
DROP materialized view mv2;
DROP MATERIALIZED VIEW LOG ON t1;
DROP MATERIALIZED VIEW LOG ON t2;
DROP TABLE t1;
DROP TABLE t2;
create table t1 (c1 number(10) primary key,c2 number(10), c3 number, c4 number);
create table t2 (a1 number(10) primary key,a2 number(10), a3 number, a4 number);
create materialized view log on t1 parallel 2 with primary key, rowid, sequence (c2,c3,c4) including new values;
create materialized view log on t2 parallel 2 with primary key, rowid, sequence (a2,a3,a4) including new values;
create materialized view mv1  parallel 2 refresh fast on demand  as select c1 as c1 from t1 union all select a1 as a1  from t2;
ERROR HY000: cannot fast refresh materialized view MV1: UNION ALL query without valid marker select item
create materialized view mv1  parallel 2 refresh fast on demand  as select c1 as c1 from t1 union  select a1 as a1  from t2;
ERROR HY000: cannot fast refresh materialized view MV1: query with set operators UNION/INTERSECT/EXCEPT/MINUS is not supported
##验证存在不兼容点 
##包含group by
DROP MATERIALIZED VIEW LOG ON t1;
DROP MATERIALIZED VIEW LOG ON t2;
DROP TABLE t1;
DROP TABLE t2;
create table t1 (c1 number(10) primary key,c2 number(10), c3 number, c4 number);
create table t2 (a1 number(10) primary key,a2 number(10), a3 number, a4 number);
create materialized view log on t1 parallel 2 with primary key, rowid, sequence (c2,c3,c4) including new values;
create materialized view log on t2 parallel 2 with primary key, rowid, sequence (a2,a3,a4) including new values;
create materialized view mv1  parallel 2 refresh fast on demand  as select c1 as c1,a1 as a1, count(*) from t1,t2 group by c1,a1;
ERROR 0A000: internal error code, arguments: -4007, expression without a column alias not supported
##连接表不具备主键
DROP MATERIALIZED VIEW LOG ON t1;
DROP MATERIALIZED VIEW LOG ON t2;
DROP TABLE t1;
DROP TABLE t2;
create table t1 (c1 number(10),c2 number(10), c3 number, c4 number);
create table t2 (a1 number(10),a2 number(10), a3 number, a4 number);
create materialized view log on t1 parallel 2 with primary key, rowid, sequence (c1,c2,c3,c4) including new values;
create materialized view log on t2 parallel 2 with primary key, rowid, sequence (a1,a2,a3,a4) including new values;
create materialized view mv1  parallel 9 refresh fast on demand  as select c1 as c1,a1 as a1 from t1,t2 where t1.c1 = t2.a1 ;
ERROR HY000: cannot fast refresh materialized view MV1: primary keys of all base tables are required in the select item list
##内联视图
DROP MATERIALIZED VIEW LOG ON t1;
DROP MATERIALIZED VIEW LOG ON t2;
DROP TABLE t1;
DROP TABLE t2;
create table t1 (c1 number(10) ,c2 number(10), c3 number, c4 number,primary key(c1));
create table t2 (a1 number(10) ,a2 number(10), a3 number, a4 number,primary key(a1));
create materialized view log on t1 parallel 2 with primary key, rowid, sequence (c2,c3,c4) including new values;
create materialized view log on t2 parallel 2 with primary key, rowid, sequence (a2,a3,a4) including new values;
create materialized view mv1 refresh fast on demand as select c1 as c1 ,a.a1 as a1 from (select a1 from t2)a,t1 where  t1.c1 = a.a1 ;
ERROR HY000: cannot fast refresh materialized view MV1: query has invalid table type(GENERATED_TABLE). only basic table and materialized view are supported
create materialized view mv2 refresh fast on demand as select count(c2) cnt_c1, sum(c2) sum_c1 from t1,(select a1 from t2)a;
ERROR HY000: cannot fast refresh materialized view MV2: query has invalid table type(GENERATED_TABLE). only basic table and materialized view are supported
##rt_mv上存在函数索引
DROP MATERIALIZED VIEW LOG ON t1;
DROP TABLE t1;
create table t1 (c1 number(10) primary key,c2 number(10), c3 number, c4 number);
create materialized view log on t1 parallel 9 with primary key, rowid, sequence (c2,c3,c4) including new values;
create materialized view mv1  parallel 9 refresh fast on demand enable on query  computation as select c1 as c1,count(*) cnt from t1 group by c1;
create index idx1 on mv1(abs(c1));
ERROR 0A000: internal error code, arguments: -4007, use functional index on materialized view not supported
select * from mv1 order by c1;
C1	CNT
##存在列运算
DROP MATERIALIZED VIEW LOG ON t1;
DROP TABLE t1;
drop materialized view mv1;
create table t1 (c1 number(10) primary key,c2 number(10), c3 number, c4 number);
insert into t1 values(1,2,1,-1);
insert into t1 values(-1,1,1,1);
insert into t1 values(2,1,3,1);
create materialized view log on t1 parallel 2 with primary key, rowid, sequence (c2,c4) including new values;
create materialized view mv1  parallel 2 refresh fast on demand enable on query  computation  as select a.c1 as ac1,b.c1 as bc1,a.c1+b.c2 cc from t1 a,t1 b where a.c1 = b.c1;
select * from mv1 order by ac1;
AC1	BC1	CC
-1	-1	0
1	1	3
2	2	3
DROP MATERIALIZED VIEW LOG ON t1;
DROP TABLE t1;
drop materialized view mv1;
create table t1 (c1 number(10) primary key,c2 number(10), c3 number, c4 number);
insert into t1 values(1,2,1,-1);
insert into t1 values(-1,null,1,1);
insert into t1 values(2,null,3,1);
create materialized view log on t1 parallel 2 with primary key, rowid, sequence (c2,c4) including new values;
create materialized view mv1  parallel 2 refresh fast on demand enable on query  computation  as select a.c1 as ac1,b.c1 as bc1,a.c2 as c2,b.c4 as cc from t1 a,t1 b where a.c1 = b.c1;
update t1 set c1 =(select max(ac1) from mv1) where c3 =3;
delete from t1 where c2 in (select cc from mv1 where ac1<>1);
select * from mv1 order by ac1;
AC1	BC1	C2	CC
-1	-1	NULL	1
1	1	2	-1
2	2	NULL	1
##单表简单查询
DROP MATERIALIZED VIEW LOG ON t1;
DROP TABLE t1;
drop materialized view mv1;
create table t1 (c1 number(10) ,c2 number(10), c3 number, c4 number);
create materialized view log on t1 parallel 9 with rowid, sequence (c1,c2,c3,c4) including new values;
create materialized view mv1  parallel 9 refresh fast on demand enable on query  computation as select c1 as c1, count(*) cnt from t1 group by c1;
insert into t1 values(1,1,1,1);
insert into t1 values(null,1,1,1);
CALL DBMS_MVIEW.REFRESH('mv1','f');
select c1 *12-1/1 from mv1 order by c1;
C1*12-1/1
11
NULL
select max(c1) * max(c1)* max(c1)from mv1;
MAX(C1)*MAX(C1)*MAX(C1)
1
select min(c1) * min(c1)* min(c1)from mv1;
MIN(C1)*MIN(C1)*MIN(C1)
1
select avg(c1) * avg(c1)* avg(c1)from mv1;
AVG(C1)*AVG(C1)*AVG(C1)
1
select sum(c1) * sum(c1)* sum(c1)from mv1;
SUM(C1)*SUM(C1)*SUM(C1)
1
select count(c1) * count(c1) * count(c1)from mv1;
COUNT(C1)*COUNT(C1)*COUNT(C1)
1
##增加start with
##验证刷新时间
DROP MATERIALIZED VIEW LOG ON t1;
DROP TABLE t1;
drop materialized view mv1;
create table t1 (c1 int ,c2 int, c3 int, c4 int);
create materialized view log on t1 parallel 9 with rowid, sequence (c1,c2,c3,c4) including new values;
insert into t1 values(1,1,1,1);
insert into t1 values(null,1,1,1);
insert into t1 values(2,1,1,1);
insert into t1 values(3,1,1,1);
create materialized view mv1  parallel 9 refresh fast on demand  enable on query  computation as select c1 as c1, count(*) cnt from t1 group by c1;
select * from mv1 order by c1;
C1	CNT
1	1
2	1
3	1
NULL	1
insert into t1 values(4,1,1,1);
insert into t1 values(5,1,1,1);
insert into t1 values(6,1,1,1);
select * from mv1 order by c1;
C1	CNT
1	1
2	1
3	1
4	1
5	1
6	1
NULL	1
##不加including new values
DROP MATERIALIZED VIEW LOG ON t1;
DROP TABLE t1;
drop materialized view mv1;
create table t1 (c1 number(10) ,c2 number(10), c3 number, c4 number);
create materialized view log on t1 parallel 9 with rowid, sequence (c1,c2,c3,c4) ;
create materialized view mv1  parallel 9 refresh fast on demand enable on query  computation as select c1 as c1, count(*) cnt from t1 group by c1;
insert into t1 values(1,1,1,1);
insert into t1 values(null,1,1,1);
select * from mv1 order by c1;
C1	CNT
1	1
NULL	1
select * from t1 order by c1;
C1	C2	C3	C4
1	1	1	1
NULL	1	1	1
##增加外键
DROP MATERIALIZED VIEW LOG ON t1;
DROP TABLE t1;
drop materialized view mv1;
create table t1 (c1 number(10) primary key,c2 number(10), c3 number, c4 number);
create materialized view log on t1 parallel 9 with rowid, sequence (c2,c3,c4) including new values;
create materialized view mv1  parallel 9 refresh fast on demand enable on query  computation as select c1 as c1, count(*) cnt from t1 group by c1;
insert into t1 values(1,1,1,1);
insert into t1 values(2,1,1,1);
insert into t1 values(3,3,1,1);
insert into t1 values(4,2,1,1);
insert into t1 values(5,4,1,1);
insert into t1 values(6,null,1,1);
ALTER TABLE t1 ADD CONSTRAINT fk_c2 FOREIGN KEY (c2) REFERENCES t1(c1);
select * from mv1 a,t1 b  where a.c1=b.c2 and b.c2 is not null order by a.c1,b.c1;
C1	CNT	C1	C2	C3	C4
1	1	1	1	1	1
1	1	2	1	1	1
2	1	4	2	1	1
3	1	3	3	1	1
4	1	5	4	1	1
select count(*) from mv1 a,t1 b  where a.c1!=b.c2;
COUNT(*)
25
select count(*) from mv1 a,t1 b  where a.c1>b.c2;
COUNT(*)
19
select count(*) from mv1 a,t1 b  where a.c1<b.c2;
COUNT(*)
6
select count(*) from mv1 a,t1 b  where a.c1<>b.c2;
COUNT(*)
25
select count(*) from mv1 a,t1 b  where a.c1=b.c2;
COUNT(*)
5
ALTER TABLE t1 DROP  CONSTRAINT fk_c2 ;
##插入值验证
DROP MATERIALIZED VIEW LOG ON t1;
DROP TABLE t1;
drop materialized view mv1;
create table t1 (c1 number(10) ,c2 number(10), c3 number, c4 number);
create materialized view log on t1 parallel 9 with rowid, sequence (c1,c2,c3,c4) including new values;
create materialized view mv1  parallel 9 refresh fast on demand enable on query  computation as select c1 as c1, count(*) cnt from t1 group by c1;
create materialized view mv2  parallel 9 refresh fast on demand enable on query  computation as select c1 as c1, count(*) cnt from t1 group by c1;
insert into t1 values(2,1,2,1);
insert into t1 values(null,1,4,1);
INSERT INTO t1 SELECT c1 + 4, c1,cnt,c1+1 FROM mv1;
SELECT * FROM mv1 a JOIN mv2 b ON a.c1=b.c1 ORDER BY a.c1;
C1	CNT	C1	CNT
2	1	2	1
6	1	6	1
SELECT * FROM mv1 a JOIN mv2 b ON a.c1=b.c1 where a.c1= ''or b.c1=1 ORDER BY a.c1;
C1	CNT	C1	CNT
SELECT * FROM mv1 a JOIN mv2 b ON a.c1>b.c1 ORDER BY a.c1;
C1	CNT	C1	CNT
6	1	2	1
SELECT * FROM mv1 a JOIN mv2 b ON a.c1<b.c1 ORDER BY a.c1;
C1	CNT	C1	CNT
2	1	6	1
SELECT * FROM mv1 a JOIN mv2 b ON a.c1<=>b.c1 ORDER BY a.c1,b.c1;
C1	CNT	C1	CNT
2	1	2	1
6	1	6	1
NULL	2	NULL	2
SELECT * FROM mv1, mv1 mv2, mv1 mv3  WHERE ((mv1.c1 = 5 AND mv3.c1 <> mv1.c1) OR mv1.c1 > 0) AND mv3.c1 < mv2.c1 order by 1,2,3;
C1	CNT	C1	CNT	C1	CNT
2	1	6	1	2	1
6	1	6	1	2	1
##两个不同数据类型
DROP MATERIALIZED VIEW LOG ON t1;
DROP TABLE t1;
drop materialized view mv1;
drop materialized view mv2;
create table t1 (c1 number(10) ,c2 varchar2(120), c3 date, c4 varchar2(120));
insert into t1 values(1,'as',to_Date('2024-03-25'),'{"name": "John", "age": 30, "city": "New York"}');
insert into t1 values(null,'qqw中',to_Date('2022-03-25'),'{"name": "John", "age": 30, "city": "New York"}');
create materialized view log on t1 parallel 9 with rowid, sequence (c1,c2,c3) including new values;
create materialized view mv1  parallel 9 refresh fast on demand enable on query  computation as select c1 as c1, count(*) cnt from t1 group by c1;
create materialized view mv2  parallel 9 refresh fast on demand enable on query  computation as select c2 as c2, count(*) cnt from t1 group by c2;
create materialized view mv3  parallel 9 refresh fast on demand enable on query  computation as select c3 as c3, count(*) cnt from t1 group by c3;
select count(*) from mv1,mv2 ;
COUNT(*)
4
select count(*) from mv2,mv3 ;
COUNT(*)
4
select count(*) from mv3,mv1 ;
COUNT(*)
4
select count(*) from mv3,t1 where t1.c4=mv3.c3;
ERROR HY000: a non-numeric character was found where a numeric was expected
select count(*) from mv2,t1 where t1.c4=mv2.c2;
COUNT(*)
0
select count(*) from mv1,t1 where t1.c4=mv1.c1;
ERROR 42000: invalid number
select count(*) from mv1,t1 ;
COUNT(*)
4
select count(*) from mv2,t1 ;
COUNT(*)
4
##复合主键
DROP MATERIALIZED VIEW LOG ON t1;
DROP TABLE t1;
drop materialized view mv1;
create table t1 (c1 number(10) ,c2 varchar2(120) check (c2 is json), c3 date, c4 number(10) not null,c5 varchar2(120),c6 number(10));
ALTER TABLE t1 ADD CONSTRAINT constraint_name PRIMARY KEY (c2,c3);
create materialized view log on t1 parallel 9 with PRIMARY KEY,rowid, sequence(c1,c4,c5,c6)  including new values;
create materialized view mv1  parallel 9 refresh fast on demand enable on query  computation  as select c2 as c2, count(*) cnt from t1 group by c2;
insert into t1 values(1,'{"name": "John", "age": 30, "city": "New York"}',to_Date('2024-03-25'),2,4,6);
insert into t1 values(null,'{"name": "John", "age": 31, "city": "New York"}',to_Date('2022-03-25'),1,3,5);
select mv1.c2,count(*) from mv1,t1,mlog$_t1 where t1.c2=mv1.c2 and mv1.c2=mlog$_t1.c2 group by mv1.c2 order by c2;
C2	COUNT(*)
{"name": "John", "age": 30, "city": "New York"}	1
{"name": "John", "age": 31, "city": "New York"}	1
select mv1.c2,count(*) from mv1,mlog$_t1 where  mv1.cnt=mlog$_t1.c1 group by mv1.c2 order by c2;
C2	COUNT(*)
{"name": "John", "age": 30, "city": "New York"}	1
{"name": "John", "age": 31, "city": "New York"}	1
select mv1.c2,count(*) from mv1,mlog$_t1 where  mv1.c2<>mlog$_t1.c5 group by mv1.c2 order by c2;
C2	COUNT(*)
{"name": "John", "age": 30, "city": "New York"}	2
{"name": "John", "age": 31, "city": "New York"}	2
select mv1.c2,count(*) from mv1,t1 where  mv1.c2<>t1.c5 group by mv1.c2 order by c2;
C2	COUNT(*)
{"name": "John", "age": 30, "city": "New York"}	2
{"name": "John", "age": 31, "city": "New York"}	2
##not null
DROP MATERIALIZED VIEW LOG ON t1;
DROP TABLE t1;
drop materialized view mv1;
create table t1 (c1 number(10) ,c2 varchar2(120), c3 date, c4 number(10) not null);
create materialized view log on t1 parallel 9 with rowid, sequence (c1,c2,c3,c4) including new values;
create materialized view mv1  parallel 9 refresh fast on demand enable on query  computation  as select c4 as c4, count(*) cnt from t1 group by c4;
insert into t1 values(1,'as',to_Date('2024-03-25'),2);
insert into t1 values(null,'qqw中',to_Date('2022-03-25'),1);
select * from mv1 order by c4;
C4	CNT
1	1
2	1
##存在check约束
DROP MATERIALIZED VIEW LOG ON t1;
DROP TABLE t1;
drop materialized view mv1;
create table t1 (c1 number(10) ,c2 varchar2(120), c3 date, c4 number(10) check(c4 >1));
create materialized view log on t1 parallel 9 with rowid, sequence (c2,c3,c4) including new values;
create materialized view mv1  parallel 9 refresh fast on demand enable on query  computation  as select c4 as c4, count(*) cnt from t1 group by c4;
insert into t1 values(1,'as',to_Date('2024-03-25'),2);
update t1 set c4=3 where c1 =1;
select * from mv1 order by c4;
C4	CNT
3	1
##复合查询，UNION 和 UNION ALL 运算符
DROP MATERIALIZED VIEW LOG ON t1;
DROP TABLE t1;
drop materialized view mv1;
create table t1 (c1 number(10) ,c2 number(10), c3 number, c4 number);
create materialized view log on t1 parallel 9 with rowid, sequence (c1,c2,c3,c4) including new values;
create materialized view mv1  parallel 9 refresh fast on demand enable on query  computation as select c1 as c1, count(*) cnt from t1 group by c1;
insert into t1 values(1,1,1,1);
select c1 from mv1 union select cnt from mv1 order by c1;
C1
1
select c1 from mv1 union all select cnt from mv1 order by c1;
C1
1
1
select c1 from mv1 union select cnt from mv1 order by c1;
C1
1
select c1 from mv1 union all select cnt from mv1 order by c1;
C1
1
1
select c1 from mv1 union select null from dual order by c1;
C1
1
NULL
select c1 from mv1 union all select null from dual order by c1;
C1
1
NULL
##子查询（select子句,where子句,having子句）
DROP MATERIALIZED VIEW LOG ON t1;
DROP TABLE t1;
drop materialized view mv1;
create table t1 (c1 number(10) ,c2 number(10), c3 number, c4 number);
create materialized view log on t1 parallel 9 with rowid, sequence (c1,c2,c3,c4) including new values;
create materialized view mv1  parallel 9 refresh fast on demand enable on query  computation as select c1 as c1, count(*) cnt from t1 group by c1;
insert into t1 values(1,1,1,1);
insert into t1 values(3,1,11,1);
insert into t1 values(122,1,'',1);
insert into t1 values(100,1,1,1);
select a.c1,(select t1.c1 from t1 where t1.c1 =1)b from mv1 a order by a.c1;
C1	B
1	1
3	1
100	1
122	1
select a.c1,(select t1.c3 from t1 where t1.c3 is null)b from mv1 a order by a.c1;
C1	B
1	NULL
3	NULL
100	NULL
122	NULL
select a.c1,(select mlog$_t1.c3 from mlog$_t1 where mlog$_t1.c3 > 10)b from mv1 a order by a.c1;
C1	B
1	11
3	11
100	11
122	11
select a.c1 from mv1 a where cnt < (select avg(c1) from t1)order by a.c1;
C1
1
3
100
122
select a.c1 from mv1 a where cnt < (select avg(c3) from t1)order by a.c1;
C1
1
3
100
122
select a.c1 from mv1 a where cnt > (select avg(c1) from mlog$_t1)order by a.c1;
C1
select a.c1 from mv1 a where exists (select avg(c1) from mlog$_t1)order by a.c1;
C1
1
3
100
122
select a.c1 from mv1 a where cnt in (select avg(c1) from mlog$_t1)order by a.c1;
C1
select c1,avg(cnt) from mv1 group by c1 having avg(cnt) >1 order by c1;
C1	AVG(CNT)
select c1,avg(cnt) from mv1 group by c1 having avg(cnt) is not null order by c1;
C1	AVG(CNT)
1	1
3	1
100	1
122	1
##SELECT FOR UPDATE
SET AUTOCOMMIT=1;
DROP MATERIALIZED VIEW LOG ON t1;
DROP TABLE t1;
drop materialized view mv1;
create table t1 (c1 number(10) ,c2 number(10), c3 number, c4 number);
insert into t1 values(1,1,1,1);
insert into t1 values(3,1,11,1);
insert into t1 values(122,1,'',1);
insert into t1 values(100,1,1,1);
create materialized view log on t1 parallel 9 with rowid, sequence (c1,c2,c3,c4) including new values;
create materialized view mv1  parallel 9 refresh fast on demand enable on query  computation as select c1 as c1, count(*) cnt from t1 group by c1;
SET AUTOCOMMIT=0;
select c1 from mv1 where c1 =1 for update;
C1
1
update t1 set c1=99 where c1 =1;
commit;
select * from mv1 order by c1;
C1	CNT
3	1
99	1
100	1
122	1
##rt_mv和基表join
DROP MATERIALIZED VIEW LOG ON t1;
DROP MATERIALIZED VIEW LOG ON t2;
DROP TABLE t1;
DROP TABLE t2;
drop materialized view mv1;
create table t1 (c1 number(10) ,c2 number(10), c3 number, c4 number);
create materialized view log on t1 parallel 9 with rowid, sequence (c1,c2,c3,c4) including new values;
create materialized view mv1  parallel 9 refresh fast on demand enable on query  computation as select c1 as c1, count(*) cnt from t1 group by c1;
insert into t1 values(1,1,1,1);
create table t2 (c1 number(10) ,c2 number(10), c3 number, c4 number);
insert into t2 values(1,null,null,null);
select * from t1, mv1 order by t1.c1,t1.c2;
C1	C2	C3	C4	C1	CNT
1	1	1	1	1	1
select * from t1 left join mv1 on t1.c1=mv1.c1 order by t1.c1,t1.c2;
C1	C2	C3	C4	C1	CNT
1	1	1	1	1	1
select * from t2 left join mv1 on t2.c1=mv1.c1 order by t2.c1,t2.c2;
C1	C2	C3	C4	C1	CNT
1	NULL	NULL	NULL	1	1
select * from t1 right join mv1 on t1.c1=mv1.c1 order by t1.c1,t1.c2;
C1	C2	C3	C4	C1	CNT
1	1	1	1	1	1
select * from t1 inner join mv1 on t1.c1=mv1.c1 order by t1.c1,t1.c2;
C1	C2	C3	C4	C1	CNT
1	1	1	1	1	1
##连接视图
DROP MATERIALIZED VIEW LOG ON t1;
DROP TABLE t1;
DROP TABLE t2;
drop materialized view mv1;
create table t1 (c1 number(10) ,c2 number(10), c3 number, c4 number);
create view v1 as select * from t1;
create materialized view log on t1 parallel 9 with rowid, sequence (c1,c2,c3,c4) including new values;
create materialized view mv1  parallel 9 refresh fast on demand enable on query  computation as select c1 as c1, count(*) cnt from t1 group by c1;
insert into t1 values(1,1,1,1);
select * from mv1,v1;
C1	CNT	C1	C2	C3	C4
1	1	1	1	1	1
select * from mv1,(select 1 from v1);
C1	CNT	1
1	1	1
##基表创建同义词连接
DROP MATERIALIZED VIEW LOG ON t1;
DROP TABLE t1;
DROP view v1;
drop materialized view mv1;
create table t1 (c1 number(10) ,c2 number(10), c3 number, c4 number);
create view v1 as select * from t1;
create materialized view log on t1 parallel 9 with rowid, sequence (c1,c2,c3,c4) including new values;
create materialized view mv1  parallel 9 refresh fast on demand enable on query  computation as select c1 as c1, count(*) cnt from t1 group by c1;
insert into t1 values(1,1,1,1);
CREATE or replace SYNONYM sy1 FOR t1;
select * from mv1,sy1;
C1	CNT	C1	C2	C3	C4
1	1	1	1	1	1
DROP MATERIALIZED VIEW LOG ON t1;
drop SYNONYM sy1;
DROP TABLE t1;
drop materialized view mv1;
drop materialized view mv2;
create table t1 (c1 number(10) ,c2 number(10), c3 number, c4 number);
insert into t1 values(0,1,1,1);
insert into t1 values(2,1,1,1);
create materialized view log on t1 parallel 9 with rowid, sequence (c1,c2,c3,c4) including new values;
create materialized view mv1  parallel 9 refresh fast on demand enable on query  computation   as select c1 as c1, count(*) cnt from t1 group by c1;
create materialized view mv2  parallel 9 refresh fast on demand enable on query  computation   as select c1 as c1, count(*) cnt from t1 group by c1;
CREATE  SYNONYM sy1 FOR mv1;
CREATE  SYNONYM sy2 FOR mv2;
select * from sy1,sy2 order by 1,2,3;
C1	CNT	C1	CNT
0	1	0	1
0	1	2	1
2	1	0	1
2	1	2	1
select * from mv1 order by 1;
C1	CNT
0	1
2	1
select * from t1 order by 1;
C1	C2	C3	C4
0	1	1	1
2	1	1	1
select * from sy1 order by 1;
C1	CNT
0	1
2	1
##连接虚拟表
DROP MATERIALIZED VIEW LOG ON t1;
DROP TABLE t1;
drop materialized view mv1;
create table t1 (c1 number(10) ,c2 number(10), c3 number, c4 number);
create materialized view log on t1 parallel 9 with rowid, sequence (c1,c2,c3,c4) including new values;
create materialized view mv1  parallel 9 refresh fast on demand enable on query  computation as select c1 as c1, count(*) cnt from t1 group by c1;
insert into t1 values(1,1,1,1);
insert into t1 values(null,1,1,1);
insert into t1 values(2,1,1,1);
insert into t1 values(3,1,1,1);
select * from mv1,(select null from dual)a order by 1,2,3;
C1	CNT	NULL
1	1	NULL
2	1	NULL
3	1	NULL
NULL	1	NULL
select * from (select null from dual)a,mv1 order by 1,2,3;
NULL	C1	CNT
NULL	1	1
NULL	2	1
NULL	3	1
NULL	NULL	1
select * from mv1,(select 1 from dual)a order by 1,2,3;
C1	CNT	1
1	1	1
2	1	1
3	1	1
NULL	1	1
select * from mv1,(select 1,1,1,1 from dual)a order by 1,2,3;
C1	CNT	1	1	1	1
1	1	1	1	1	1
2	1	1	1	1	1
3	1	1	1	1	1
NULL	1	1	1	1	1
##五表连接
DROP MATERIALIZED VIEW LOG ON t1;
DROP TABLE t1;
drop materialized view mv1;
drop materialized view mv2;
drop materialized view mv3;
purge recyclebin;
create table t1 (c1 number(10) primary key,c2 number(10), c3 number, c4 number);
create table t2 (a1 number(10) primary key,a2 number(10), a3 number, a4 number);
create table t3 (b1 number(10) primary key,b2 number(10), b3 number, b4 number);
create table t4 (d1 number(10) primary key,d2 number(10), d3 number, d4 number);
create table t5 (h1 number(10) primary key,h2 number(10), h3 number, h4 number);
create materialized view log on t1 parallel 9 with rowid, sequence (c2,c3,c4) including new values;
create materialized view log on t2 parallel 9 with rowid, sequence (a2,a3,a4) including new values;
create materialized view log on t3 parallel 9 with rowid, sequence (b2,b3,b4) including new values;
create materialized view log on t4 parallel 9 with rowid, sequence (d2,d3,d4) including new values;
create materialized view log on t5 parallel 9 with rowid, sequence (h2,h3,h4) including new values;
create materialized view mv1 refresh fast on demand enable on query  computation as select c1 as c1 ,a1 as a1,b1 as b1,d1 as d1,h1 as h1 from t1,t2,t3,t4,t5 where c1=a1 and a1=b1 and b1=d1 and d1=h1;
create materialized view mv2 refresh fast on demand enable on query  computation as select c1 as c1, a1 as a1 from t1, t2 where c1=a1;
insert into t1 values(1,null,1,1);
insert into t2 values(1,null,2,2);
insert into t3 values(1,null,3,3);
insert into t4 values(1,null,4,4);
insert into t5 values(1,null,5,5);
select * from mv1;
C1	A1	B1	D1	H1
1	1	1	1	1
select * from mv2;
C1	A1
1	1
CREATE INDEX idx ON mv1 (c1,a1,b1,d1,h1) parallel 10;
alter index idx parallel 2;
drop index idx;
##rt_mv连接不同rt_mv
##使用普通视图
DROP MATERIALIZED VIEW LOG ON t1;
drop table t1;
drop view v1;
drop materialized view mv1;
create table t1 (c1 number , c2 varchar(200));
create view v1 as select c2 as c2, count(*) cnt from t1 group by c2;
INSERT INTO t1 VALUES (1, '{"name": "John Doe", "age": 30}');
INSERT INTO t1 VALUES (null, '{"name": "John Doe", "age": 30}');
create materialized view log on t1  with rowid, sequence(c2) including new values;
create materialized view mv1  parallel 9 refresh fast on demand enable on query  computation   as select c2 as c2, count(*) cnt from t1 group by c2;
select * from mv1,v1,t1 order by 1,2,3,4,5,6;
C2	CNT	C2	CNT	C1	C2
{"name": "John Doe", "age": 30}	2	{"name": "John Doe", "age": 30}	2	1	{"name": "John Doe", "age": 30}
{"name": "John Doe", "age": 30}	2	{"name": "John Doe", "age": 30}	2	NULL	{"name": "John Doe", "age": 30}
##验证增加check约束
DROP MATERIALIZED VIEW LOG ON t1;
DROP MATERIALIZED VIEW LOG ON t2;
DROP TABLE t1;
DROP TABLE t2;
drop materialized view mv1;
create table t1 (c1 number(10) ,c2 number(10), c3 number, c4 number);
create materialized view log on t1 parallel 9 with rowid, sequence (c1,c2,c3,c4) including new values;
create materialized view mv1  parallel 9 refresh fast on demand  enable on query  computation    as select c1 as c1, count(*) cnt from t1 group by c1;
ALTER TABLE mv1 ADD CONSTRAINT check1 CHECK (c1>1);
ALTER TABLE mv1 drop CONSTRAINT check1 ;
ERROR HY000: Cannot drop constraint  - nonexistent constraint
insert into t1 values(0,1,1,1);
select * from mv1;
C1	CNT
0	1
select * from t1;
C1	C2	C3	C4
0	1	1	1
##连接子查询
DROP MATERIALIZED VIEW LOG ON t1;
DROP TABLE t1;
drop materialized view mv1;
create table t1 (c1 number(10) ,c2 number(10), c3 number, c4 number);
create materialized view log on t1 parallel 9 with rowid, sequence (c1,c2,c3,c4) including new values;
create materialized view mv1  parallel 9 refresh fast on demand enable on query  computation  as select c1 as c1, count(*) cnt from t1 group by c1;
insert into t1 values(1,1,1,1);
select * from mv1 left join (select c1 from mv1)a on a.c1=mv1.c1 ;
C1	CNT	C1
1	1	1
select * from mv1 right join (select c1 from mv1)a on a.c1=mv1.c1 ;
C1	CNT	C1
1	1	1
select * from mv1 inner join (select c1 from mv1)a on a.c1=mv1.c1 ;
C1	CNT	C1
1	1	1
##rt_mv连接rt_mv
DROP MATERIALIZED VIEW LOG ON t1;
DROP TABLE t1;
drop materialized view mv1;
create table t1 (c1 number(10) ,c2 number(10), c3 number, c4 number);
create materialized view log on t1 parallel 9 with rowid, sequence (c1,c2,c3,c4) including new values;
create materialized view mv1  parallel 9 refresh fast on demand enable on query  computation as select c1 as c1, count(*) cnt from t1 group by c1;
insert into t1 values(1,1,1,1);
select * from mv1 a left join mv1 b on a.cnt=b.c1 ;
C1	CNT	C1	CNT
1	1	1	1
select * from mv1 right join (select c1 from mv1)a on a.c1=mv1.c1 ;
C1	CNT	C1
1	1	1
select * from mv1 inner join (select c1 from mv1)a on a.c1=mv1.c1 ;
C1	CNT	C1
1	1	1
##正交分区表
DROP MATERIALIZED VIEW LOG ON t1;
DROP TABLE t1;
drop materialized view mv1;
create table t1 (c1 number(10) ,c2 number(10), c3 number, c4 number);
insert into t1 values(1,1,1,1);
create materialized view log on t1 parallel 9 with rowid, sequence (c1,c2,c3,c4) including new values;
create materialized view mv1  parallel 9 refresh complete on demand enable on query  computation as select c1 as c1, count(*) cnt from t1 group by c1;
CREATE TABLE t2 (c1 int PRIMARY KEY, c2 VARCHAR(999) not null) PARTITION BY HASH(c1) PARTITIONS 8;
select * from mv1 a left join  t2 b on a.cnt=b.c1 ;
C1	CNT	C1	C2
1	1	NULL	NULL
select * from mv1 a right join  t2 b on a.cnt=b.c1 ;
C1	CNT	C1	C2
select * from mv1 a inner join  t2 b on a.cnt=b.c1 ;
C1	CNT	C1	C2
##使用聚合函数
DROP MATERIALIZED VIEW LOG ON t1;
DROP TABLE t1;
drop materialized view mv1;
create table t1 (c1 number(10) ,c2 number(10), c3 number, c4 number);
create materialized view log on t1 parallel 9 with rowid, sequence (c1,c2,c3,c4) including new values;
create materialized view mv1  parallel 9 refresh fast on demand enable on query  computation as select c1 as c1, count(*) cnt from t1 group by c1;
insert into t1 values(1,1,1,1);
CALL DBMS_MVIEW.REFRESH('mv1','f');
select count(distinct c1) a ,c1 from mv1 group by c1;
A	C1
1	1
select sum(c1+cnt),c1,cnt from mv1 group by c1,cnt;
SUM(C1+CNT)	C1	CNT
2	1	1
select avg(c1+cnt),c1,cnt from mv1 group by c1,cnt;
AVG(C1+CNT)	C1	CNT
2	1	1
select min(c1+cnt),c1,cnt from mv1 group by c1,cnt;
MIN(C1+CNT)	C1	CNT
2	1	1
select max(c1+cnt)+max(c1+cnt),c1,cnt from mv1 group by c1,cnt;
MAX(C1+CNT)+MAX(C1+CNT)	C1	CNT
4	1	1
select * from mv1 group by c1,cnt order by c1;
C1	CNT
1	1
##使用group by
DROP MATERIALIZED VIEW LOG ON t1;
DROP TABLE t1;
DROP TABLE t2;
drop materialized view mv1;
create table t1 (c1 number(10) ,c2 number(10), c3 number, c4 number);
create materialized view log on t1 parallel 9 with rowid, sequence (c1,c2,c3,c4) including new values;
insert into t1 values(1,5,8,12);
insert into t1 values(2,3,3,3);
create materialized view mv1  parallel 9 refresh fast on demand enable on query  computation as select c1 as c1, count(*) cnt from t1 group by c1;
select c1 a,c1 b,cnt,1 from mv1 order by c1;
A	B	CNT	1
1	1	1	1
2	2	1	1
##事务中使用
DROP MATERIALIZED VIEW LOG ON t1;
DROP TABLE t1;
drop materialized view mv1;
create table t1 (c1 number(10) ,c2 number(10), c3 number, c4 number);
create materialized view log on t1 parallel 9 with rowid, sequence (c1,c2,c3,c4) including new values;
create materialized view mv1  parallel 9 refresh fast on demand enable on query  computation as select c1 as c1, count(*) cnt from t1 group by c1;
START TRANSACTION;
insert into t1 values(1,4,8,12);
insert into t1 values(3,5,3,12);
SAVEPOINT my_savepoint1;
update t1 set c1=11 where c2=5;
insert into t1 values(2,3,3,3);
SAVEPOINT my_savepoint2;
delete from t1 where c1=1;
SAVEPOINT my_savepoint3;
select * from mv1 order by c1;
C1	CNT
2	1
11	1
select * from t1 order by c1;
C1	C2	C3	C4
2	3	3	3
11	5	3	12
ROLLBACK TO my_savepoint3;
select * from t1 order by c1;
C1	C2	C3	C4
2	3	3	3
11	5	3	12
select * from mv1 order by c1;
C1	CNT
2	1
11	1
ROLLBACK TO my_savepoint2;
select * from t1 order by c1;
C1	C2	C3	C4
1	4	8	12
2	3	3	3
11	5	3	12
select * from mv1 order by c1;
C1	CNT
1	1
2	1
11	1
ROLLBACK TO my_savepoint1;
select * from t1 order by c1;
C1	C2	C3	C4
1	4	8	12
3	5	3	12
select * from mv1 order by c1;
C1	CNT
1	1
3	1
##数据类型验证
##char
DROP MATERIALIZED VIEW LOG ON t1;
drop table t1;
drop materialized view mv1;
drop materialized view mv2;
create table t1 (c1 char(20) primary key, c2 char(20));
create materialized view log on t1 parallel 9 with PRIMARY KEY,rowid,sequence(c2) including new values  ;
create materialized view mv1  parallel 9 refresh fast on demand enable on query  computation as select c1 as c1, count(*) cnt from t1 group by c1;
insert into t1 values('null','中文ing123');
insert into t1 values('false','999abc');
insert into t1 values('蘩騠字','21311111111111111111');
update t1 set c2='' where c1='null';
delete from t1 where c1 is null;
select * from mv1 a,t1 b where a.c1=b.c1 order by 1,2,3,4;
C1	CNT	C1	C2
false               	1	false               	999abc              
null                	1	null                	NULL
蘩騠字           	1	蘩騠字           	21311111111111111111
select * from mv1 a,mv1 b where a.c1=b.cnt;
ERROR 42000: invalid number
##VARCHAR2
DROP MATERIALIZED VIEW LOG ON t1;
drop table t1;
drop materialized view mv1;
create table t1 (c1 VARCHAR2(20) primary key, c2 VARCHAR2(20));
create materialized view log on t1 parallel 9 with PRIMARY KEY,rowid,sequence(c2) including new values  ;
create materialized view mv1  parallel 9 refresh fast on demand enable on query  computation as select c1 as c1, count(*) cnt from t1 group by c1;
insert into t1 values('null','中文ing123');
insert into t1 values('false','999abc');
insert into t1 values('蘩騠字','21311111111111111111');
update t1 set c2='' where c1='null';
delete from t1 where c1 is null;
select * from mv1 order by c1;
C1	CNT
false	1
null	1
蘩騠字	1
select * from mv1 a,t1 b where a.c1=b.c1 order by 1,2,3,4;
C1	CNT	C1	C2
false	1	false	999abc
null	1	null	NULL
蘩騠字	1	蘩騠字	21311111111111111111
##NCHAR
DROP MATERIALIZED VIEW LOG ON t1;
drop table t1;
drop materialized view mv1;
create table t1 (c1 NCHAR(20) primary key, c2 NCHAR(20));
create materialized view log on t1 parallel 9 with PRIMARY KEY,rowid,sequence(c2) including new values  ;
create materialized view mv1  parallel 9 refresh fast on demand enable on query  computation as select c1 as c1, count(*) cnt from t1 group by c1;
insert into t1 values('null','中文ing123');
insert into t1 values('false','999abc');
insert into t1 values('蘩騠字','21311111111111111111');
update t1 set c2='' where c1='null';
delete from t1 where c1 is null;
select * from mv1 order by c1;
C1	CNT
false               	1
null                	1
蘩騠字                 	1
select * from mv1 a,t1 b where a.c1=b.c1 order by 1,2,3,4;
C1	CNT	C1	C2
false               	1	false               	999abc              
null                	1	null                	NULL
蘩騠字                 	1	蘩騠字                 	21311111111111111111
##NVARCHAR2
DROP MATERIALIZED VIEW LOG ON t1;
drop table t1;
drop materialized view mv1;
create table t1 (c1 NVARCHAR2(20) primary key, c2 NVARCHAR2(20));
create materialized view log on t1 parallel 9 with PRIMARY KEY,rowid,sequence(c2) including new values  ;
create materialized view mv1  parallel 9 refresh fast on demand enable on query  computation as select c1 as c1, count(*) cnt from t1 group by c1;
insert into t1 values('null','中文ing123');
insert into t1 values('false','999abc');
insert into t1 values('蘩騠字','21311111111111111111');
update t1 set c2='' where c1='null';
delete from t1 where c1 is null;
select * from mv1 order by c1;
C1	CNT
false	1
null	1
蘩騠字	1
select * from mv1 a,t1 b where a.c1=b.c1 order by 1,2,3,4;
C1	CNT	C1	C2
false	1	false	999abc
null	1	null	NULL
蘩騠字	1	蘩騠字	21311111111111111111
##DATE
DROP MATERIALIZED VIEW LOG ON t1;
drop table t1;
drop materialized view mv1;
create table t1 (c1 DATE primary key, c2 DATE);
INSERT INTO t1 (c1, c2) VALUES (TO_DATE('2022-01-01', 'YYYY-MM-DD'), TO_DATE('2022-01-01', 'YYYY-MM-DD'));
INSERT INTO t1 (c1, c2) VALUES (TO_DATE('2022-01-02', 'YYYY-MM-DD'), TO_DATE('2022-01-02', 'YYYY-MM-DD'));
UPDATE t1 SET c2 = TO_DATE('2022-01-03', 'YYYY-MM-DD') WHERE c1 = TO_DATE('2022-01-01', 'YYYY-MM-DD');
DELETE FROM t1 WHERE c1 = TO_DATE('2022-01-02', 'YYYY-MM-DD');
create materialized view log on t1 parallel 9 with PRIMARY KEY,rowid,sequence(c2) including new values  ;
create materialized view mv1  parallel 9 refresh fast on demand enable on query  computation as select c1 as c1, count(*) cnt from t1 group by c1;
select * from mv1 order by c1;
C1	CNT
2022-01-01 00:00:00	1
select * from mv1 a,t1 b where a.c1=b.c1;
C1	CNT	C1	C2
2022-01-01 00:00:00	1	2022-01-01 00:00:00	2022-01-03 00:00:00
select * from mv1 a,mv1 b where a.c1=b.cnt;
ERROR 22000: inconsistent datatypes
##timestamp
DROP MATERIALIZED VIEW LOG ON t1;
drop table t1;
drop materialized view mv1;
create table t1 (c1 timestamp primary key, c2 timestamp);
INSERT INTO t1 (c1, c2) VALUES (TIMESTAMP '2022-01-01 00:00:00', TIMESTAMP '2022-01-01 00:00:00');
INSERT INTO t1 (c1, c2) VALUES (TIMESTAMP '2022-01-02 00:00:00', TIMESTAMP '2022-01-02 00:00:00');
UPDATE t1 SET c2 = TIMESTAMP '2022-01-03 00:00:00' WHERE c1 = TIMESTAMP '2022-01-01 00:00:00';
DELETE FROM t1 WHERE c1 = TIMESTAMP '2022-01-02 00:00:00';
create materialized view log on t1 parallel 9 with PRIMARY KEY,rowid,sequence(c2) including new values ;
create materialized view mv1  parallel 9 refresh fast on demand enable on query  computation as select c1 as c1, count(*) cnt from t1 group by c1;
select * from mv1 order by c1;
C1	CNT
2022-01-01 00:00:00.000000	1
select * from mv1 a,t1 b where a.c1=b.c1;
C1	CNT	C1	C2
2022-01-01 00:00:00.000000	1	2022-01-01 00:00:00.000000	2022-01-03 00:00:00.000000
##TIMESTAMP WITH TIMEZONE
DROP MATERIALIZED VIEW LOG ON t1;
drop table t1;
drop materialized view mv1;
create table t1 (c1 TIMESTAMP WITH TIME ZONE , c2 TIMESTAMP WITH TIME ZONE);
create materialized view log on t1 parallel 9 with PRIMARY KEY,rowid,sequence(c1,c2) including new values  ;
create materialized view mv1  parallel 9 refresh fast on demand enable on query  computation as select c1 as c1, count(*) cnt from t1 group by c1;
INSERT INTO t1 (c1, c2) VALUES (TIMESTAMP '2022-01-01 00:00:00 +00:00', TIMESTAMP '2022-01-01 00:00:00 +00:00');
INSERT INTO t1 (c1, c2) VALUES (TIMESTAMP '2022-01-02 00:00:00 +00:00', TIMESTAMP '2022-01-02 00:00:00 +00:00');
UPDATE t1 SET c2 = TIMESTAMP '2022-01-03 00:00:00 +00:00' WHERE c1 = TIMESTAMP '2022-01-01 00:00:00 +00:00';
DELETE FROM t1 WHERE c1 = TIMESTAMP '2022-01-02 00:00:00 +00:00';
select * from mv1 order by c1;
C1	CNT
2022-01-01 00:00:00.000000 +00:00 	1
select * from mv1 a,t1 b where a.c1=b.c1;
C1	CNT	C1	C2
2022-01-01 00:00:00.000000 +00:00 	1	2022-01-01 00:00:00.000000 +00:00 	2022-01-03 00:00:00.000000 +00:00 
##INTERVAL DAY TO SECOND
DROP MATERIALIZED VIEW LOG ON t1;
drop table t1;
drop materialized view mv1;
create table t1 (c1 INTERVAL DAY TO SECOND , c2 INTERVAL DAY TO SECOND);
create materialized view log on t1 parallel 9 with PRIMARY KEY,rowid,sequence(c1,c2) including new values ;
create materialized view mv1  parallel 9 refresh fast on demand enable on query  computation as select c1 as c1, count(*) cnt from t1 group by c1;
INSERT INTO t1 (c1, c2) VALUES (INTERVAL '2' DAY, INTERVAL '3' DAY);
INSERT INTO t1 (c1, c2) VALUES (INTERVAL '4' DAY, INTERVAL '5' DAY);
UPDATE t1 SET c2 = INTERVAL '6' DAY WHERE c1 = INTERVAL '2' DAY;
DELETE FROM t1 WHERE c1 = INTERVAL '4' DAY;
select * from mv1 order by c1;
C1	CNT
+02 00:00:00.000000	1
select * from mv1 a,t1 b where a.c1=b.c1;
C1	CNT	C1	C2
+02 00:00:00.000000	1	+02 00:00:00.000000	+06 00:00:00.000000
##INTERVAL DAY TO MONTH
DROP MATERIALIZED VIEW LOG ON t1;
drop table t1;
drop materialized view mv1;
create table t1 (c1 INTERVAL YEAR(2) TO MONTH , c2 INTERVAL YEAR(2) TO MONTH);
create materialized view log on t1 parallel 9 with PRIMARY KEY,rowid,sequence(c1,c2) including new values ;
create materialized view mv1  parallel 9 refresh fast on demand enable on query  computation as select c1 as c1, count(*) cnt from t1 group by c1;
INSERT INTO t1 (c1, c2) VALUES (INTERVAL '2-3' YEAR TO MONTH, INTERVAL '4-5' YEAR TO MONTH);
INSERT INTO t1 (c1, c2) VALUES (INTERVAL '6-7' YEAR TO MONTH, INTERVAL '8-9' YEAR TO MONTH);
UPDATE t1 SET c2 = INTERVAL '10-11' YEAR TO MONTH WHERE c1 = INTERVAL '2-3' YEAR TO MONTH;
DELETE FROM t1 WHERE c1 = INTERVAL '6-7' YEAR TO MONTH;
select * from mv1 order by c1;
C1	CNT
+02-03	1
select * from mv1 a,t1 b where a.c1=b.c1;
C1	CNT	C1	C2
+02-03	1	+02-03	+10-11
##binary_float
DROP MATERIALIZED VIEW LOG ON t1;
drop table t1;
drop materialized view mv1;
create table t1 (c1 binary_float primary key, c2 binary_float);
create materialized view log on t1 parallel 9 with PRIMARY KEY,rowid,sequence(c2) including new values ;
create materialized view mv1  parallel 9 refresh fast on demand enable on query  computation as select c1 as c1, count(*) cnt from t1 group by c1;
INSERT INTO t1 (c1, c2) VALUES (1.23, 4.56);
INSERT INTO t1 (c1, c2) VALUES (7.89, 10.11);
UPDATE t1 SET c2 = 12.34 WHERE c1 = 7.89;
DELETE FROM t1 WHERE c1 = 1.23;
select * from mv1 order by c1;
C1	CNT
7.88999987E+000	1
select * from mv1 a,t1 b where a.c1=b.c1;
C1	CNT	C1	C2
7.88999987E+000	1	7.88999987E+000	1.23400002E+001
##binary_double
DROP MATERIALIZED VIEW LOG ON t1;
drop table t1;
drop materialized view mv1;
create table t1 (c1 binary_double primary key, c2 binary_double);
create materialized view log on t1 parallel 9 with PRIMARY KEY,rowid,sequence(c2) including new values ;
create materialized view mv1  parallel 9 refresh fast on demand enable on query  computation as select c1 as c1, count(*) cnt from t1 group by c1;
INSERT INTO t1 (c1, c2) VALUES (1.23, 4.56);
INSERT INTO t1 (c1, c2) VALUES (7.89, 10.11);
UPDATE t1 SET c2 = 12.34 WHERE c1 = 7.89;
DELETE FROM t1 WHERE c1 = 1.23;
select * from mv1 order by c1;
C1	CNT
7.8899999999999997E+000	1
select * from mv1 a,t1 b where a.c1=b.c1;
C1	CNT	C1	C2
7.8899999999999997E+000	1	7.8899999999999997E+000	1.234E+001
##number
DROP MATERIALIZED VIEW LOG ON t1;
drop table t1;
drop materialized view mv1;
create table t1 (c1 number(20) primary key, c2 number(20));
create materialized view log on t1 parallel 9 with PRIMARY KEY,rowid,sequence(c2) including new values;
create materialized view mv1  parallel 9 refresh fast on demand enable on query  computation as select c1 as c1, count(*) cnt from t1 group by c1;
INSERT INTO t1 (c1, c2) VALUES (12345678901234567890, 98765432109876543210);
INSERT INTO t1 (c1, c2) VALUES (11111111111111111111, 22222222222222222222);
UPDATE t1 SET c2 = 33333333333333333333 WHERE c1 = 11111111111111111111;
DELETE FROM t1 WHERE c1 = 12345678901234567890;
select * from mv1 order by c1;
C1	CNT
11111111111111111111	1
select * from mv1 a,t1 b where a.c1=b.c1;
C1	CNT	C1	C2
11111111111111111111	1	11111111111111111111	33333333333333333333
##FLOAT
DROP MATERIALIZED VIEW LOG ON t1;
drop table t1;
drop materialized view mv1;
create table t1 (c1 FLOAT(20) primary key, c2 FLOAT(20));
create materialized view log on t1 parallel 9 with PRIMARY KEY,rowid,sequence(c2) including new values  ;
create materialized view mv1  parallel 9 refresh fast on demand enable on query  computation as select c1 as c1, count(*) cnt from t1 group by c1;
INSERT INTO t1 (c1, c2) VALUES (1.23, 4.56);
INSERT INTO t1 (c1, c2) VALUES (7.89, 10.11);
UPDATE t1 SET c2 = 12.34 WHERE c1 = 7.89;
DELETE FROM t1 WHERE c1 = 1.23;
select * from mv1 order by c1;
C1	CNT
7.89	1
select * from mv1 a,t1 b where a.c1=b.c1;
C1	CNT	C1	C2
7.89	1	7.89	12.34
##RAW
DROP MATERIALIZED VIEW LOG ON t1;
drop table t1;
drop materialized view mv1;
create table t1 (c1 RAW(20) primary key, c2 RAW(20));
create materialized view log on t1 parallel 9 with PRIMARY KEY,rowid,sequence(c2) including new values ;
create materialized view mv1  parallel 9 refresh fast on demand enable on query  computation as select c1 as c1, count(*) cnt from t1 group by c1;
INSERT INTO t1 (c1, c2) VALUES ('FF0A1B2C3D', 'AABBCCDDEE');
INSERT INTO t1 (c1, c2) VALUES ('1122334455', '66778899AA');
UPDATE t1 SET c2 = 'BBCCDDEEFF' WHERE c1 = '1122334455';
DELETE FROM t1 WHERE c1 = 'FF0A1B2C3D';
select * from mv1 order by c1;
C1	CNT
1122334455	1
select * from mv1 a,t1 b where a.c1=b.c1;
C1	CNT	C1	C2
1122334455	1	1122334455	BBCCDDEEFF
##多数据类型验证
DROP MATERIALIZED VIEW LOG ON t1;
drop table t1;
drop materialized view mv1;
CREATE TABLE t1 (
c1 INT PRIMARY KEY,
c2 INT,
c3 FLOAT,
c4 DECIMAL(10, 2),
c5 CHAR(10),
c6 VARCHAR(50),
c7 DATE
);
INSERT INTO t1  VALUES (1, 100, 123.456, 789.01, 'Text1    ', 'Sample text', '2023-04-01');
INSERT INTO t1  VALUES (2, 200, 654.321, 210.98, 'Text2    ', 'Another sample', '2023-04-02');
create materialized view log on t1 parallel 9 with PRIMARY KEY,rowid,sequence(c2,c3,c4,c6,c7) including new values ;
create materialized view mv1  parallel 9 refresh fast on demand enable on query  computation as select sum(c2 * c3) sum_c, count(c2 * c3) count, count(*) as c, c6 from t1 group by c6;
INSERT INTO t1  VALUES (3, 200, 654.321, 210.98, 'Text2    ', 'Another sample', '2023-04-02');
delete from t1 where c1 =2;
select * from mv1 order by SUM_C;
SUM_C	COUNT	C	C6
12345.6	1	1	Sample text
130864.2	1	1	Another sample
select * from mv1 a,t1 b where a.c6=b.c6 order by 1,2,3,4,5,6;
SUM_C	COUNT	C	C6	C1	C2	C3	C4	C5	C6	C7
12345.6	1	1	Sample text	1	100	123.456	789.01	Text1     	Sample text	2023-04-01 00:00:00
130864.2	1	1	Another sample	3	200	654.321	210.98	Text2     	Another sample	2023-04-02 00:00:00
DROP MATERIALIZED VIEW LOG ON t1;
drop table t1;
drop materialized view mv1;
CREATE TABLE t1 (
c1 INT PRIMARY KEY,
c2 INT,
c3 FLOAT,
c4 DECIMAL(10, 2),
c5 CHAR(10),
c6 VARCHAR(50),
c7 DATE
);
INSERT INTO t1  VALUES (1, 100, 123.456, 789.01, 'Text1    ', 'Sample text', '2023-04-01');
INSERT INTO t1  VALUES (2, 200, 654.321, 210.98, 'Text2    ', 'Another sample', '2023-04-02');
create materialized view log on t1 parallel 9 with PRIMARY KEY,rowid,sequence(c2,c3,c4,c6,c7) including new values ;
create materialized view mv1  parallel 9 refresh fast on demand enable on query  computation as select sum(c2 * c3) sum_c, count(c2 * c3) count, count(*) as c, c6 from t1 group by c6;
update t1 set c2=300 where c6='Another sample';
select * from mv1 order by SUM_C;
SUM_C	COUNT	C	C6
12345.6	1	1	Sample text
196296.3	1	1	Another sample
select * from mv1 a,t1 b where a.c6=b.c6 order by 1,2,3,4,5,6;
SUM_C	COUNT	C	C6	C1	C2	C3	C4	C5	C6	C7
12345.6	1	1	Sample text	1	100	123.456	789.01	Text1     	Sample text	2023-04-01 00:00:00
196296.3	1	1	Another sample	2	300	654.321	210.98	Text2     	Another sample	2023-04-02 00:00:00
##正交函数
##cast
DROP MATERIALIZED VIEW LOG ON t1;
DROP TABLE t1;
drop materialized view mv1;
create table t1 (c1 varchar(20) ,c2 varchar(20), c3 varchar(20), c4 varchar(20));
insert into t1 values('1','2541','155','21');
create materialized view log on t1 parallel 9 with rowid, sequence (c1,c2,c3,c4) including new values;
create materialized view mv1  parallel 9 refresh fast on demand enable on query  computation  as select c1 as c1, count(*) cnt,CAST(c1 AS json) cst from t1 group by c1;
create materialized view mv2  parallel 9 refresh fast on demand enable on query  computation  as select c1 as c1, count(*) cnt,CAST(c1 AS NCHAR(12)) cst from t1 group by c1;
insert into t1 values('123','152','15','中文');
insert into t1 values(null,'152','15','中文');
insert into t1 values('a','152','15','中文');
CALL DBMS_MVIEW.REFRESH('mv2','f');
SELECT * from mv1;
ERROR 22032: JSON syntax error
SELECT * from mv2 order by 1,2,3;
C1	CNT	CST
1	1	1           
123	1	123         
a	1	a           
NULL	1	NULL
# Clean up users
drop user ljh cascade;
purge recyclebin;
