#Environmental cleaning
drop user hjw@'%';
create user hjw identified by 'hjw';
grant all on *.* to hjw WITH GRANT OPTION;
#foreign_key-9      创建父表引用列带有约束
#foreign_key-10	 创建父表引用列带有索引
#foreign_key-11     DML 执 行
#foreign_key-9      创建父表引用列带有约束
#foreign_key-9-1    非空约束 (not null)
set FOREIGN_KEY_CHECKS = on;
drop table   test2;
drop table   test1;
create table test1(c1 int PRIMARY key not null);
create table test2(id int,h1 bigint,CONSTRAINT wj FOREIGN KEY (id) REFERENCES test1 (c1));
desc test1;
Field	Type	Null	Key	Default	Extra
c1	int(11)	NO	PRI	NULL	
desc test2;
Field	Type	Null	Key	Default	Extra
id	int(11)	YES		NULL	
h1	bigint(20)	YES		NULL	
ALTER TABLE test1 CHANGE COLUMN c1 c1 int NULL;
ERROR 42000: All parts of a PRIMARY KEY must be NOT NULL; if you need NULL in a key, use UNIQUE instead
desc test1;
Field	Type	Null	Key	Default	Extra
c1	int(11)	NO	PRI	NULL	
ALTER TABLE test2 CHANGE COLUMN id id int NOT NULL;
desc test2;
Field	Type	Null	Key	Default	Extra
id	int(11)	NO		NULL	
h1	bigint(20)	YES		NULL	
insert into test1 values(null);
insert into test2 values(null,12);
insert into test1 values(1);
insert into test2 values(1,15);
drop table   test2;
drop table   test1;
create table test1(c1 int UNIQUE not null);
create table test2(id int,h1 bigint,CONSTRAINT wj FOREIGN KEY (id) REFERENCES test1 (c1));
desc test1;
Field	Type	Null	Key	Default	Extra
c1	int(11)	NO	UNI	NULL	
desc test2;
Field	Type	Null	Key	Default	Extra
id	int(11)	YES		NULL	
h1	bigint(20)	YES		NULL	
ALTER TABLE test1 CHANGE COLUMN c1 c1 int NULL;
desc test1;
Field	Type	Null	Key	Default	Extra
c1	int(11)	YES	UNI	NULL	
ALTER TABLE test2 CHANGE COLUMN id id int NOT NULL;
desc test2;
Field	Type	Null	Key	Default	Extra
id	int(11)	NO		NULL	
h1	bigint(20)	YES		NULL	
insert into test1 values(null);
insert into test2 values(null,12);
insert into test1 values(1);
insert into test2 values(1,15);
drop table   test2;
drop table   test1;
#foreign_key-9-2    唯一性约束 (unique)
set FOREIGN_KEY_CHECKS = on;
drop table   test2;
drop table   test1;
create table test1(c1 int PRIMARY key unique);
create table test2(id int,h1 bigint,CONSTRAINT wj FOREIGN KEY (id) REFERENCES test1 (c1));
desc test1;
Field	Type	Null	Key	Default	Extra
c1	int(11)	NO	PRI	NULL	
desc test2;
Field	Type	Null	Key	Default	Extra
id	int(11)	YES		NULL	
h1	bigint(20)	YES		NULL	
insert into test1 values(011);
insert into test1 values(011);
insert into test2 values(011,12);
insert into test2 values(012,13);
ALTER TABLE test1 DROP INDEX c1;
insert into test1 values(011);
insert into test2 values(012,13);
alter table test1 add unique(c1);
drop table   test2;
drop table   test1;
#foreign_key-9-3    默认值约束 (Default)
set FOREIGN_KEY_CHECKS = on;
drop table   test2;
drop table   test1;
create table test1(c1 int PRIMARY key Default 1);
create table test2(id int,h1 bigint,CONSTRAINT wj FOREIGN KEY (id) REFERENCES test1 (c1));
desc test1;
Field	Type	Null	Key	Default	Extra
c1	int(11)	NO	PRI	1	
desc test2;
Field	Type	Null	Key	Default	Extra
id	int(11)	YES		NULL	
h1	bigint(20)	YES		NULL	
insert into test1 values(011);
insert into test1 values(011);
insert into test2 values(011,12);
insert into test2 values(012,13);
insert into test1 values( );
insert into test2 values( );
ALTER TABLE test2 CHANGE COLUMN id id int DEFAULT 2;
desc test1;
Field	Type	Null	Key	Default	Extra
c1	int(11)	NO	PRI	1	
desc test2;
Field	Type	Null	Key	Default	Extra
id	int(11)	YES		2	
h1	bigint(20)	YES		NULL	
insert into test2 values( );
ALTER TABLE test2 CHANGE COLUMN id id int DEFAULT NULL;
desc test2;
Field	Type	Null	Key	Default	Extra
id	int(11)	YES		NULL	
h1	bigint(20)	YES		NULL	
ALTER TABLE test1 CHANGE COLUMN c1 c1 int DEFAULT NULL;
drop table   test2;
drop table   test1;
create table test1(c1 int UNIQUE Default 1);
create table test2(id int,h1 bigint,CONSTRAINT wj FOREIGN KEY (id) REFERENCES test1 (c1));
desc test1;
Field	Type	Null	Key	Default	Extra
c1	int(11)	YES	UNI	1	
desc test2;
Field	Type	Null	Key	Default	Extra
id	int(11)	YES		NULL	
h1	bigint(20)	YES		NULL	
insert into test1 values(011);
insert into test1 values(011);
insert into test2 values(011,12);
insert into test2 values(012,13);
insert into test1 values( );
insert into test2 values( );
ALTER TABLE test2 CHANGE COLUMN id id int DEFAULT 2;
desc test1;
Field	Type	Null	Key	Default	Extra
c1	int(11)	YES	UNI	1	
desc test2;
Field	Type	Null	Key	Default	Extra
id	int(11)	YES		2	
h1	bigint(20)	YES		NULL	
insert into test2 values( );
ALTER TABLE test2 CHANGE COLUMN id id int DEFAULT NULL;
desc test2;
Field	Type	Null	Key	Default	Extra
id	int(11)	YES		NULL	
h1	bigint(20)	YES		NULL	
ALTER TABLE test1 CHANGE COLUMN c1 c1 int DEFAULT NULL;
drop table   test2;
drop table   test1;
#foreign_key-9-4    自增约束 (AUTO_INCREMENT)
set FOREIGN_KEY_CHECKS = on;
drop table   test2;
drop table   test1;
create table test1(c1 int PRIMARY key AUTO_INCREMENT,c2 bigint);
create table test2(id int,h1 bigint,CONSTRAINT wj FOREIGN KEY (id) REFERENCES test1 (c1));
desc test1;
Field	Type	Null	Key	Default	Extra
c1	int(11)	NO	PRI	NULL	auto_increment
c2	bigint(20)	YES		NULL	
desc test2;
Field	Type	Null	Key	Default	Extra
id	int(11)	YES		NULL	
h1	bigint(20)	YES		NULL	
insert into test1(c2) values(2);
insert into test2(h1) values(4);
desc test1;
Field	Type	Null	Key	Default	Extra
c1	int(11)	NO	PRI	NULL	auto_increment
c2	bigint(20)	YES		NULL	
desc test2;
Field	Type	Null	Key	Default	Extra
id	int(11)	YES		NULL	
h1	bigint(20)	YES		NULL	
alter table test2 modify id int auto_increment;
ALTER TABLE test1 MODIFY c1 INT;
drop table   test2;
drop table   test1;
create table test1(c1 int UNIQUE AUTO_INCREMENT,c2 bigint);
create table test2(id int,h1 bigint,CONSTRAINT wj FOREIGN KEY (id) REFERENCES test1 (c1));
desc test1;
Field	Type	Null	Key	Default	Extra
c1	int(11)	NO	UNI	NULL	auto_increment
c2	bigint(20)	YES		NULL	
desc test2;
Field	Type	Null	Key	Default	Extra
id	int(11)	YES		NULL	
h1	bigint(20)	YES		NULL	
insert into test1(c2) values(2);
insert into test2(h1) values(4);
desc test1;
Field	Type	Null	Key	Default	Extra
c1	int(11)	NO	UNI	NULL	auto_increment
c2	bigint(20)	YES		NULL	
desc test2;
Field	Type	Null	Key	Default	Extra
id	int(11)	YES		NULL	
h1	bigint(20)	YES		NULL	
alter table test2 modify id int auto_increment;
ALTER TABLE test1 MODIFY c1 INT;
desc test1;
Field	Type	Null	Key	Default	Extra
c1	int(11)	YES	UNI	NULL	
c2	bigint(20)	YES		NULL	
alter table test2 drop CONSTRAINT wj;
desc test1;
Field	Type	Null	Key	Default	Extra
c1	int(11)	YES	UNI	NULL	
c2	bigint(20)	YES		NULL	
alter table test1 modify c1 int auto_increment;
alter table test2 modify id int auto_increment;
drop table   test2;
drop table   test1;
#foreign_key-10	 创建父表引用列带有索引
#foreign_key-10-1     普  通   索   引     
set FOREIGN_KEY_CHECKS = on;
drop table   test2;
drop table   test1;
create table test1(c1 int PRIMARY key ,c2 bigint,index index_1(c1));
create table test2(id int,h1 bigint,CONSTRAINT wj FOREIGN KEY (id) REFERENCES test1 (c1));
desc test1;
Field	Type	Null	Key	Default	Extra
c1	int(11)	NO	PRI	NULL	
c2	bigint(20)	YES		NULL	
desc test2;
Field	Type	Null	Key	Default	Extra
id	int(11)	YES		NULL	
h1	bigint(20)	YES		NULL	
DROP TABLE test1;
set FOREIGN_KEY_CHECKS = off;
DROP TABLE test1;
create table test1(c1 int PRIMARY key ,c2 bigint,index index_1(c1));
drop table   test2;
drop table   test1;
create table test1(c1 int PRIMARY key ,c2 bigint);
create table test2(id int,h1 bigint,CONSTRAINT wj FOREIGN KEY (id) REFERENCES test1 (c1));
create index index_1 on test1(c1);
drop table   test2;
drop table   test1;
set FOREIGN_KEY_CHECKS = on;
#foreign_key-10-2	   唯  一   索   引
set FOREIGN_KEY_CHECKS = on;
drop table   test2;
drop table   test1;
create table test1(c1 int PRIMARY key ,c2 bigint,UNIQUE index index_1(c1));
create table test2(id int,h1 bigint,CONSTRAINT wj FOREIGN KEY (id) REFERENCES test1 (c1));
desc test1;
Field	Type	Null	Key	Default	Extra
c1	int(11)	NO	PRI	NULL	
c2	bigint(20)	YES		NULL	
desc test2;
Field	Type	Null	Key	Default	Extra
id	int(11)	YES		NULL	
h1	bigint(20)	YES		NULL	
show index from test1;
Table	Non_unique	Key_name	Seq_in_index	Column_name	Collation	Cardinality	Sub_part	Packed	Null	Index_type	Comment	Index_comment	Visible	Expression
test1	0	PRIMARY	1	c1	A	NULL	NULL	NULL		BTREE	available		YES	NULL
test1	0	index_1	1	c1	A	NULL	NULL	NULL		BTREE	available		YES	NULL
DROP TABLE test1;
set FOREIGN_KEY_CHECKS = off;
DROP TABLE test1;
create table test1(c1 int PRIMARY key ,c2 bigint,UNIQUE index index_1(c1));
drop table   test2;
drop table   test1;
create table test1(c1 int PRIMARY key ,c2 bigint);
create table test2(id int,h1 bigint,CONSTRAINT wj FOREIGN KEY (id) REFERENCES test1 (c1));
create UNIQUE index index_1 on test1(c1);
drop table   test2;
drop table   test1;
set FOREIGN_KEY_CHECKS = on;
#foreign_key-10-3     组  合   索   引
set FOREIGN_KEY_CHECKS = on;
drop table   test2;
drop table   test1;
create table test1(c1 int PRIMARY key ,c2 bigint,index index_1(c1,c2));
create table test2(id int,h1 bigint,CONSTRAINT wj FOREIGN KEY (id) REFERENCES test1 (c1));
desc test1;
Field	Type	Null	Key	Default	Extra
c1	int(11)	NO	PRI	NULL	
c2	bigint(20)	YES		NULL	
desc test2;
Field	Type	Null	Key	Default	Extra
id	int(11)	YES		NULL	
h1	bigint(20)	YES		NULL	
show index from test1;
Table	Non_unique	Key_name	Seq_in_index	Column_name	Collation	Cardinality	Sub_part	Packed	Null	Index_type	Comment	Index_comment	Visible	Expression
test1	0	PRIMARY	1	c1	A	NULL	NULL	NULL		BTREE	available		YES	NULL
test1	1	index_1	1	c1	A	NULL	NULL	NULL		BTREE	available		YES	NULL
test1	1	index_1	2	c2	A	NULL	NULL	NULL	YES	BTREE	available		YES	NULL
DROP TABLE test1;
set FOREIGN_KEY_CHECKS = off;
DROP TABLE test1;
create table test1(c1 int PRIMARY key ,c2 bigint, index index_1(c1,c2));
drop table   test2;
drop table   test1;
create table test1(c1 int PRIMARY key ,c2 bigint UNIQUE);
create table test2(id int,h1 bigint,CONSTRAINT wj FOREIGN KEY (id) REFERENCES test1 (c1));
create index index_1 on test1(c1,c2);
alter table test2 drop foreign key wj;
ALTER TABLE test2 ADD CONSTRAINT wj FOREIGN KEY (id) REFERENCES test1(c2);
drop table   test2;
drop table   test1;
set FOREIGN_KEY_CHECKS = on;
#foreign_key-11     DML 执 行
#foreign_key-11-1     删除父表后设置为on
set FOREIGN_KEY_CHECKS = off;
drop table   test2;
drop table   test1;
create table test1(c1 int PRIMARY key ,c2 bigint UNIQUE,c3 char(8),c4 time);
create table test2(id int,h1 bigint,h2 varchar(10),h3 date,
CONSTRAINT wj FOREIGN KEY (id) REFERENCES test1 (c1));
desc test1;
Field	Type	Null	Key	Default	Extra
c1	int(11)	NO	PRI	NULL	
c2	bigint(20)	YES	UNI	NULL	
c3	char(8)	YES		NULL	
c4	time	YES		NULL	
desc test2;
Field	Type	Null	Key	Default	Extra
id	int(11)	YES		NULL	
h1	bigint(20)	YES		NULL	
h2	varchar(10)	YES		NULL	
h3	date	YES		NULL	
insert into test1 values(5,6,'bbb','22:36:59');
insert into test2 values(5,6,'aaaa','2222-06-20');
drop table   test1;
set FOREIGN_KEY_CHECKS = on;
insert into test2 values(1,1,'aaaa','2022-6-28');
insert into test2 values(null,1,'aaaa','2022-6-28');
insert into test2 values(2,1,'aaaa','2022-6-28');
select * from test2;
id	h1	h2	h3
5	6	aaaa	2222-06-20
insert into test2 select * from test2;
insert into test2(id,h1) select id,h1 from test2;
update test2 set id=6 where id=5;
update test2 set h1=5 where h1=6;
select * from test2;
id	h1	h2	h3
5	6	aaaa	2222-06-20
update test2 set id=6 where h2='aaaa';
delete from test2 where id=5;
drop table   test2;
drop table   test1;
#foreign_key-11-2     删除父表的约束字段后设置为on
set FOREIGN_KEY_CHECKS = off;
drop table   test2;
drop table   test1;
create table test1(c1 int PRIMARY key ,c2 bigint UNIQUE,c3 char(8),c4 time);
create table test2(id int,h1 bigint,h2 varchar(10),h3 date,
CONSTRAINT wj FOREIGN KEY (id) REFERENCES test1 (c1));
desc test1;
Field	Type	Null	Key	Default	Extra
c1	int(11)	NO	PRI	NULL	
c2	bigint(20)	YES	UNI	NULL	
c3	char(8)	YES		NULL	
c4	time	YES		NULL	
desc test2;
Field	Type	Null	Key	Default	Extra
id	int(11)	YES		NULL	
h1	bigint(20)	YES		NULL	
h2	varchar(10)	YES		NULL	
h3	date	YES		NULL	
insert into test1 values(5,6,'bbb','22:36:59');
insert into test2 values(5,6,'aaaa','2222-06-20');
ALTER TABLE test1 DROP COLUMN c1;
ALTER TABLE test1 DROP COLUMN c2;
ALTER TABLE test2 DROP COLUMN id;
set FOREIGN_KEY_CHECKS = on;
drop table   test2;
drop table   test1;
#foreign_key-11-3	   删除父表后设置为off(报错)
set FOREIGN_KEY_CHECKS = on;
drop table   test2;
drop table   test1;
create table test1(c1 int PRIMARY key ,c2 bigint UNIQUE,c3 char(8),c4 time);
create table test2(id int,h1 bigint,h2 varchar(10),h3 date,
CONSTRAINT wj FOREIGN KEY (id) REFERENCES test1 (c1));
drop table   test1;
set FOREIGN_KEY_CHECKS = off;
drop table   test2;
drop table   test1;
#foreign_key-11-4     删除父表的约束字段后设置为off(报错)
set FOREIGN_KEY_CHECKS = on;
drop table   test2;
drop table   test1;
create table test1(c1 int PRIMARY key ,c2 bigint UNIQUE,c3 char(8),c4 time);
create table test2(id int,h1 bigint,h2 varchar(10),h3 date,
CONSTRAINT wj FOREIGN KEY (id) REFERENCES test1 (c1));
ALTER TABLE test1 DROP COLUMN c1;
ALTER TABLE test2 DROP COLUMN id;
set FOREIGN_KEY_CHECKS = off;
drop table   test2;
drop table   test1;
#foreign_key-11-5     设   置  为  off
#对子表进行dml操作
set FOREIGN_KEY_CHECKS = off;
drop table   test2;
drop table   test1;
create table test1(c1 int PRIMARY key ,c2 bigint UNIQUE,c3 char(8),c4 time);
create table test2(id int,h1 bigint,h2 varchar(10),h3 date,
CONSTRAINT wj FOREIGN KEY (id) REFERENCES test1 (c1));
insert into test1 values(10,20,'aaaaa','24:00:00');
insert into test2 values(10,15,'ccccc','2022-06-29');
insert into test2(id,h1) select c2,c2 from test1;
insert into test2 values(13,15,'ccccc','2022-06-29');
update test2 set id =26 where id =13;
update test2 set id =10/5 where id =10;
DELETE from test2 where id=20 and 26;
drop table   test2;
drop table   test1;
#对父表进行dml操作
set FOREIGN_KEY_CHECKS = off;
drop table   test2;
drop table   test1;
create table test1(c1 int PRIMARY key ,c2 bigint UNIQUE,c3 char(8),c4 time);
create table test2(id int,h1 bigint,h2 varchar(10),h3 date,
CONSTRAINT wj FOREIGN KEY (id) REFERENCES test1 (c1));
insert into test1 values(10,20,'aaaaa','24:00:00');
insert into test2 values(10,15,'ccccc','2022-06-29');
insert into test1(c1,c2,c3) select id,h1,h2 from test2;
insert into test1(c1,c2,c3) select id+1,h1,h2 from test2;
insert into test1(c1,c2,c3) select id,h1,h2 from test2;
insert into test1(c1,c2,c3) values(null,null,null);
update test1 set c1=10 where c1=11;
update test1 set c1=12 where c1=10;
update test1 set c1=null where c1=12;
delete from test1 where c1=12;
delete from test1 where c1=11;
ALTER TABLE test1 DROP COLUMN c1;
drop table   test2;
drop table   test1;
set FOREIGN_KEY_CHECKS = off;
drop table   tf2;
drop table   t2;
create table tf2(c1 int primary key, c2 int, foreign key (c1) references t2 (c1));
create table t2 (c1 int primary key);
drop table t2;
flashback table t2 to before drop rename to tt2;
set FOREIGN_KEY_CHECKS = on;
drop table tt2;
drop table tf2;
# Clean up users
drop user hjw@'%' ;
