#环境清理
drop database if exists db1;
create database db1;
use db1;
#join类型
# 不加任何条件进行join
create table t1(c1 int,c2 int);
create table t2(a1 int,a2 int);
create table t3(b1 int,b2 int);
insert into t1 values(1,1);
insert into t1 values(2,2);
insert into t1 values(3,3);
insert into t1 values(4,6);
insert into t2 values(1,2);
insert into t2 values(2,2);
insert into t2 values(3,4);
insert into t2 values(5,7);
insert into t3 values(1,null);
insert into t3 values(null,1);
insert into t3 values(null,null);
#无条件连接 
select /*+use_hash(t2,t3)*/ count(*)  from t2 natural join t3 order by t2.a1;
count(*)
12
select /*+parallel(6) use_hash(t2,t3)*/ count(*)  from t2 natural join t3 order by t2.a1;
count(*)
12
select /*+use_hash(t1,t2)*/ count(*)  from t1,t2 where t1.c2> t2.a2;
count(*)
5
select /*+parallel(6) use_hash(t1,t2)*/ count(*)  from t1,t2 where t1.c2> t2.a2;
count(*)
5
select /*+use_hash(t1,t2)*/ count(*)  from t1,t2 where t1.c2> t2.a2 order by t1.c1 desc;
count(*)
5
select /*+parallel(6) use_hash(t1,t2)*/ count(*)  from t1,t2 where t1.c2> t2.a2 order by t1.c1 desc;
count(*)
5
select count(*)  from (select * from t1,t2)a,(select * from t2,t3)b order by c1 asc,b1 desc;
count(*)
192
select /*+parallel(2) */ count(*)  from (select /*+parallel(2) use_hash(t1,t2)*/ * from t1,t2)a ,(select /*+parallel(2) use_hash(t2,t3)*/ * from t2,t3)b order by c1 asc,b1 desc;
count(*)
192
select count(*)  from (select * from t1 natural join t2)a natural join (select * from t2 natural join t3)b order by c1 asc,b1 desc;
count(*)
48
select /*+parallel(2) */ count(*) from (select /*+parallel(2)*/ * from t1 natural join t2)a natural join (select /*+parallel(2)*/ * from t2 natural join t3)b order by c1 asc,b1 desc;
count(*)
48
select /*+parallel(2) */ count(*) from (select /*+parallel(2)*/ * from t1 natural join t2)a natural join (select /*+parallel(2)*/ * from t2 natural join t3)b order by c1 asc,b1 desc;
count(*)
48
# 总结得出,针对于无条件连接即使指定了hint也还是会走nested loop join ;
# 内连接
select /*+use_hash(t1,t2)*/ * from t1,t2 where t1.c1=t2.a1 order by t1.c1;
c1	c2	a1	a2
1	1	1	2
2	2	2	2
3	3	3	4
select /*+parallel(6) use_hash(t1,t2)*/ * from t1,t2 where t1.c1=t2.a1 order by t1.c1;
c1	c2	a1	a2
1	1	1	2
2	2	2	2
3	3	3	4
select /*+use_hash(t2,t3)*/ * from t2,t3 where t2.a1=t3.b1 order by t2.a1;
a1	a2	b1	b2
1	2	1	NULL
select /*+parallel(6) use_hash(t2,t3)*/ * from t2,t3 where t2.a1=t3.b1 order by t2.a1;
a1	a2	b1	b2
1	2	1	NULL
select /*+use_hash(t1,t2)*/ * from t1,t2 where t1.c1=t2.a1 order by t1.c1 desc;
c1	c2	a1	a2
3	3	3	4
2	2	2	2
1	1	1	2
select /*+parallel(6) use_hash(t1,t2)*/ * from t1,t2 where t1.c1=t2.a1 order by t1.c1 desc;
c1	c2	a1	a2
3	3	3	4
2	2	2	2
1	1	1	2
select /*+use_hash(t1,t2)*/ distinct t2.a2 from t1,t2 where t1.c1=t2.a1 order by t1.c1;
a2
2
4
select /*+parallel(6) use_hash(t1,t2)*/ distinct t2.a2 from t1,t2 where t1.c1=t2.a1 order by t1.c1;
a2
2
4
select /*+use_hash(t1,t2)*/ distinct t2.a2 from t1,t2 where t1.c1=t2.a1 order by t2.a2 desc;
a2
4
2
select /*+parallel(6) use_hash(t1,t2)*/ distinct t2.a2 from t1,t2 where t1.c1=t2.a1 order by t2.a2 desc;
a2
4
2
#left join
select /*+use_hash(t1,t2)*/ * from t1 left join  t2 on t1.c1=t2.a1;
c1	c2	a1	a2
1	1	1	2
2	2	2	2
3	3	3	4
4	6	NULL	NULL
select /*+parallel(6) use_hash(t1,t2)*/ * from t1 left join  t2 on t1.c1=t2.a1;
c1	c2	a1	a2
1	1	1	2
2	2	2	2
3	3	3	4
4	6	NULL	NULL
select /*+use_hash(t2,t3)*/ * from t2 left join t3 on t2.a1=t3.b1;
a1	a2	b1	b2
1	2	1	NULL
2	2	NULL	NULL
3	4	NULL	NULL
5	7	NULL	NULL
select /*+parallel(6) use_hash(t2,t3)*/ * from t2 left join t3 on t2.a1=t3.b1;
a1	a2	b1	b2
1	2	1	NULL
2	2	NULL	NULL
3	4	NULL	NULL
5	7	NULL	NULL
select /*+use_hash(t1,t2)*/ * from t1 left join  t2 on t1.c1=t2.a1 order by t1.c2 desc;
c1	c2	a1	a2
4	6	NULL	NULL
3	3	3	4
2	2	2	2
1	1	1	2
select /*+parallel(6) use_hash(t1,t2)*/ * from t1 left join  t2 on t1.c1=t2.a1 order by t1.c2 desc;
c1	c2	a1	a2
4	6	NULL	NULL
3	3	3	4
2	2	2	2
1	1	1	2
select /*+use_hash(t1,t2)*/ count(*) from t1 left join  t2 on t1.c1=t2.a1 order by t1.c2 desc;
count(*)
4
select /*+parallel(6) use_hash(t1,t2)*/ count(*) from t1 left join  t2 on t1.c1=t2.a1 order by t1.c2 desc;
count(*)
4
#right join
select /*+use_hash(t1,t2)*/ * from t1 right join  t2 on t1.c1=t2.a1;
c1	c2	a1	a2
1	1	1	2
2	2	2	2
3	3	3	4
NULL	NULL	5	7
select /*+parallel(6) use_hash(t1,t2)*/ * from t1 right join  t2 on t1.c1=t2.a1;
c1	c2	a1	a2
1	1	1	2
2	2	2	2
3	3	3	4
NULL	NULL	5	7
select /*+use_hash(t2,t3)*/ * from t2 right join  t3 on t2.a1=t3.b1;
a1	a2	b1	b2
1	2	1	NULL
NULL	NULL	NULL	NULL
NULL	NULL	NULL	1
select /*+parallel(6) use_hash(t2,t3)*/ * from t2 right join  t3 on t2.a1=t3.b1;
a1	a2	b1	b2
1	2	1	NULL
NULL	NULL	NULL	1
NULL	NULL	NULL	NULL
select /*+use_hash(t1,t2)*/ * from t1 right join  t2 on t1.c1=t2.a1 order by t2.a2 desc;
c1	c2	a1	a2
NULL	NULL	5	7
3	3	3	4
1	1	1	2
2	2	2	2
select /*+parallel(6) use_hash(t1,t2)*/ * from t1 right join  t2 on t1.c1=t2.a1 order by t2.a2 desc;
c1	c2	a1	a2
NULL	NULL	5	7
3	3	3	4
1	1	1	2
2	2	2	2
select /*+use_hash(t1,t2)*/ count(*) from t1 right join  t2 on t1.c1=t2.a1 ;
count(*)
4
select /*+parallel(6) use_hash(t1,t2)*/ count(*) from t1 right join  t2 on t1.c1=t2.a1 ;
count(*)
4
#full join
select /*+use_hash(t1,t2)*/ * from t1 full join  t2 on t1.c1=t2.a1;
c1	c2	a1	a2
1	1	1	2
2	2	2	2
3	3	3	4
NULL	NULL	5	7
4	6	NULL	NULL
select /*+parallel(6) use_hash(t1,t2)*/ * from t1 full join  t2 on t1.c1=t2.a1 order by t1.c1;
c1	c2	a1	a2
NULL	NULL	5	7
1	1	1	2
2	2	2	2
3	3	3	4
4	6	NULL	NULL
select /*+use_hash(t1,t2)*/ * from t1 full outer join  t2 on t1.c1=t2.a1 order by t1.c1;
c1	c2	a1	a2
NULL	NULL	5	7
1	1	1	2
2	2	2	2
3	3	3	4
4	6	NULL	NULL
select /*+parallel(6) use_hash(t1,t2)*/ * from t1 full outer join  t2 on t1.c1=t2.a1 order by t1.c1;
c1	c2	a1	a2
NULL	NULL	5	7
1	1	1	2
2	2	2	2
3	3	3	4
4	6	NULL	NULL
select /*+use_hash(t1,t2)*/ * from t1 full outer join  t2 on t1.c1=t2.a1 where t1.c1 is null or t2.a1 is null order by t1.c1;
c1	c2	a1	a2
NULL	NULL	5	7
4	6	NULL	NULL
select /*+parallel(6) use_hash(t1,t2)*/ * from t1 full outer join  t2 on t1.c1=t2.a1 where t1.c1 is null or t2.a1 is null order by t1.c1;
c1	c2	a1	a2
NULL	NULL	5	7
4	6	NULL	NULL
#半连接
#semi join
select /*+use_hash(t1,t2)*/ * from t1  where c1 in(select a1 from t2);
c1	c2
1	1
2	2
3	3
select /*+parallel(6) use_hash(t1,t2)*/ * from t1  where c1 in(select a1 from t2);
c1	c2
1	1
2	2
3	3
select /*+use_hash(t1,t2)*/ * from t1  where c1 = any(select a1 from t2);
c1	c2
1	1
2	2
3	3
select /*+parallel(6) use_hash(t1,t2)*/ * from t1  where c1 = any(select a1 from t2);
c1	c2
1	1
2	2
3	3
#反链接
#anti join
select /*+use_hash(t1,t2)*/ * from t1  where c1 not in(select a1 from t2);
c1	c2
4	6
select /*+parallel(6) use_hash(t1,t2)*/ * from t1  where c1 not in(select a1 from t2);
c1	c2
4	6
select /*+use_hash(t1,t2)*/ * from t1  where c1 != all(select a1 from t2);
c1	c2
4	6
select /*+parallel(6) use_hash(t1,t2)*/ * from t1  where c1 != all(select a1 from t2);
c1	c2
4	6
select /*+use_hash(t1,t2)*/ * from t1 left join  t2 on t1.c1=t2.a1 where t2.a1 is null;
c1	c2	a1	a2
4	6	NULL	NULL
select /*+parallel(6) use_hash(t1,t2)*/ * from t1 left join  t2 on t1.c1=t2.a1 where t2.a1 is null;
c1	c2	a1	a2
4	6	NULL	NULL
select /*+use_hash(t1,t2)*/ * from t1 right join  t2 on t1.c1=t2.a1 where t1.c1 is null;
c1	c2	a1	a2
NULL	NULL	5	7
select /*+parallel(6) use_hash(t1,t2)*/ * from t1 right join  t2 on t1.c1=t2.a1 where t1.c1 is null;
c1	c2	a1	a2
NULL	NULL	5	7
drop table t1;
drop table t2;
drop table t3;
#case when
create table t1(sid int(1),sname char(20),age int(1),sex int(1));
create table t2(sid int(1),cid char(5),grade char(20)) ;
create table t3(cid char(5),cname char(20),teacher char(20));
insert into t1(sid,sname,age,sex)values
(1111,'david',28,1),
(1112,'dany',23,0),
(1113,'tom',38,1),
(1114,'lily',20,0);
insert into t2(sid,cid,grade)values
(1113,'c1','38'),
(1112,'c2','80'),
(1112,'c3','67'),
(1111,'c4','88'),
(1114,'c4','66');
insert into t3(cid,cname,teacher)values
('c4','maths','zhangsan'),
('c3','english','lisi'),
('c2','chinese','wangwu'),
('c1','computer','zhaoliu');
select /*+parallel(6) use_hash(t1,t2)*/ distinct t1.sid,sname,(case sex when '0' then '女' when '1' then '男' else '其他' end) from t1 inner join t2 on t1.sid=t2.sid inner join t3 on t3.cid=t2.cid order by t1.sid limit 2;
sid	sname	(case sex when '0' then '女' when '1' then '男' else '其他' end)
1111	david	男
1112	dany	女
select /*+parallel(6) use_hash(t1,t2)*/ sname,(case when grade between 60 and 80  then '良好' when grade >80  then '优秀' else '不及格' end) from t1 inner join t2 on t1.sid=t2.sid inner join t3 on t3.cid=t2.cid  order by t2.grade desc limit 2;
sname	(case when grade between 60 and 80  then '良好' when grade >80  then '优秀' else '不及格' end)
david	优秀
dany	良好
# 聚合函数
# count，avg，min，max，sum
drop table if exists t1;
drop procedure if exists pro1;
drop table if exists t2;
drop procedure if exists pro2;
CREATE TABLE t1(  
c1 int primary key,  
c2 DECIMAL(5,2) DEFAULT null, 
c3 VARCHAR(100)
);
CREATE  PROCEDURE pro1(in j int)
begin
DECLARE i int;
set i = 1;
while i <= j DO
insert into t1(c1,c2,c3) values(i,null, concat("李",i));
set i = i + 1;
end WHILE;
end;
//
call pro1(2000);
CREATE TABLE t2(  
a1 int primary key,  
a2 DECIMAL(5,2) DEFAULT null, 
a3 VARCHAR(100)
);
CREATE  PROCEDURE pro2(in j int)
begin
DECLARE i int;
set i = 2;
while i <= j DO
insert into t2(a1,a2,a3) values(i,null, concat("黄",i));
set i = i + 1;
end WHILE;
end;
//
call pro2(2000);
select /*+parallel(6) use_hash(t1,t2)*/min(c1)  from t1,t2 where t1.c1=t2.a1 order by c1 ;
min(c1)
2
select /*+parallel(6) use_hash(t1,t2)*/min(c1)  from t1 inner join t2 on t1.c1=t2.a1 order by c1 ;
min(c1)
2
select /*+parallel(6) use_hash(t1,t2)*/min(c1) from t1,(select * from t2)a where t1.c1=a.a1 order by c1 ;
min(c1)
2
select /*+parallel(6) use_hash(t1,t2)*/count(c1)  from t1,t2 where t1.c1=t2.a1 order by c1 ;
count(c1)
1999
select /*+parallel(6) use_hash(t1,t2)*/count(c1)  from t1 inner join t2 on t1.c1=t2.a1 order by c1 ;
count(c1)
1999
select /*+parallel(6) use_hash(t1,t2)*/count(c1) from t1,(select * from t2)a where t1.c1=a.a1 order by c1 ;
count(c1)
1999
select /*+parallel(6) use_hash(t1,t2)*/max(c1)  from t1,t2 where t1.c1=t2.a1 order by c1 ;
max(c1)
2000
select /*+parallel(6) use_hash(t1,t2)*/max(c1)  from t1 inner join t2 on t1.c1=t2.a1 order by c1 ;
max(c1)
2000
select /*+parallel(6) use_hash(t1,t2)*/max(c1) from t1,(select * from t2)a where t1.c1=a.a1 order by c1 ;
max(c1)
2000
select /*+parallel(6) use_hash(t1,t2)*/avg(c1)  from t1,t2 where t1.c1=t2.a1 order by c1 ;
avg(c1)
1001.0000
select /*+parallel(6) use_hash(t1,t2)*/avg(c1)  from t1 inner join t2 on t1.c1=t2.a1 order by c1 ;
avg(c1)
1001.0000
select /*+parallel(6) use_hash(t1,t2)*/avg(c1) from t1,(select * from t2)a where t1.c1=a.a1 order by c1 ;
avg(c1)
1001.0000
select /*+parallel(6) use_hash(t1,t2)*/sum(c1)  from t1,t2 where t1.c1=t2.a1 order by c1 ;
sum(c1)
2000999
select /*+parallel(6) use_hash(t1,t2)*/sum(c1)  from t1 inner join t2 on t1.c1=t2.a1 order by c1 ;
sum(c1)
2000999
select /*+parallel(6) use_hash(t1,t2)*/sum(c1) from t1,(select * from t2)a where t1.c1=a.a1 order by c1 ;
sum(c1)
2000999
drop table t1;
drop procedure pro1;
drop table t2;
drop procedure pro2;
CREATE TABLE t1(  
c1 int primary key,  
c2 DECIMAL(5,2) DEFAULT null, 
c3 VARCHAR(100)
);
CREATE  PROCEDURE pro1(in j int)
begin
DECLARE i int;
set i = 1;
while i <= j DO
insert into t1(c1,c2,c3) values(i,null, concat("李",i));
set i = i + 1;
end WHILE;
end;
//
call pro1(2000);
CREATE TABLE t2(  
a1 int primary key,  
a2 DECIMAL(5,2) DEFAULT null, 
a3 VARCHAR(100)
);
CREATE  PROCEDURE pro2(in j int)
begin
DECLARE i int;
set i = 2;
while i <= j DO
insert into t2(a1,a2,a3) values(i,null, concat("黄",i));
set i = i + 1;
end WHILE;
end;
//
call pro2(3000);
#运算符
# MySQL不支持LIMIT&IN/ALL/ANY/SOME子查询
# in
select /*+parallel(6) use_hash(t1,t2)*/ * from t1 inner join (select /*+parallel(6) use_hash(t1,t2)*/ * from t2 limit 100,10)a on t1.c1=a.a1 where c1 in (select c1 from t1);
c1	c2	c3	a1	a2	a3
102	NULL	李102	102	NULL	黄102
103	NULL	李103	103	NULL	黄103
104	NULL	李104	104	NULL	黄104
105	NULL	李105	105	NULL	黄105
106	NULL	李106	106	NULL	黄106
107	NULL	李107	107	NULL	黄107
108	NULL	李108	108	NULL	黄108
109	NULL	李109	109	NULL	黄109
110	NULL	李110	110	NULL	黄110
111	NULL	李111	111	NULL	黄111
select /*+parallel(6) use_hash(t1,t2)*/ * from t2 left join (select /*+parallel(6) use_hash(t1,t2)*/ * from t1 limit 100,10)a on a.c1=t2.a1 where c1 in (select c1 from t1);
a1	a2	a3	c1	c2	c3
101	NULL	黄101	101	NULL	李101
102	NULL	黄102	102	NULL	李102
103	NULL	黄103	103	NULL	李103
104	NULL	黄104	104	NULL	李104
105	NULL	黄105	105	NULL	李105
106	NULL	黄106	106	NULL	李106
107	NULL	黄107	107	NULL	李107
108	NULL	黄108	108	NULL	李108
109	NULL	黄109	109	NULL	李109
110	NULL	黄110	110	NULL	李110
select /*+parallel(6) use_hash(t1,t2)*/ * from t1 right join (select /*+parallel(6) use_hash(t1,t2)*/ * from t2 limit 100,10)a on t1.c1=a.a1 where c1 in (select c1 from t1);
c1	c2	c3	a1	a2	a3
102	NULL	李102	102	NULL	黄102
103	NULL	李103	103	NULL	黄103
104	NULL	李104	104	NULL	黄104
105	NULL	李105	105	NULL	黄105
106	NULL	李106	106	NULL	黄106
107	NULL	李107	107	NULL	黄107
108	NULL	李108	108	NULL	黄108
109	NULL	李109	109	NULL	黄109
110	NULL	李110	110	NULL	黄110
111	NULL	李111	111	NULL	黄111
# all
select /*+parallel(6) use_hash(t1,t2)*/ * from t1 inner join t2 on t1.c1=t2.a1 where c1 >= all(select c1 from t1);
c1	c2	c3	a1	a2	a3
2000	NULL	李2000	2000	NULL	黄2000
select /*+parallel(6) use_hash(t1,t2)*/ * from t1  inner join (select * from t2)a on t1.c1=a.a1 where c1 >= all(select c1 from t1);
c1	c2	c3	a1	a2	a3
2000	NULL	李2000	2000	NULL	黄2000
select /*+parallel(6) use_hash(t1,t2)*/ * from t1 left join t2 on t1.c1=t2.a1 where c1 >= all(select c1 from t1);
c1	c2	c3	a1	a2	a3
2000	NULL	李2000	2000	NULL	黄2000
select /*+parallel(6) use_hash(t1,t2)*/ * from t1  left join (select * from t2)a on t1.c1=a.a1 where c1 >= all(select c1 from t1);
c1	c2	c3	a1	a2	a3
2000	NULL	李2000	2000	NULL	黄2000
#ob超时，待修复
# exists and not exists
select /*+parallel(6) use_hash(t1,t2)*/ * from t1 inner join (select /*+parallel(6) use_hash(t1,t2)*/ * from t2 limit 100,10)a on t1.c1=a.a1 where  exists (select c1 from t1);
c1	c2	c3	a1	a2	a3
102	NULL	李102	102	NULL	黄102
103	NULL	李103	103	NULL	黄103
104	NULL	李104	104	NULL	黄104
105	NULL	李105	105	NULL	黄105
106	NULL	李106	106	NULL	黄106
107	NULL	李107	107	NULL	黄107
108	NULL	李108	108	NULL	黄108
109	NULL	李109	109	NULL	黄109
110	NULL	李110	110	NULL	黄110
111	NULL	李111	111	NULL	黄111
select /*+parallel(6) use_hash(t1,t2)*/ * from t1 inner join (select /*+parallel(6) use_hash(t1,t2)*/ * from t2 limit 100,10)a on t1.c1=a.a1 where not exists (select c1 from t1);
c1	c2	c3	a1	a2	a3
select /*+parallel(6) use_hash(t1,t2)*/ count(*) from t1 left join (select /*+parallel(6) use_hash(t1,t2)*/ * from t2 limit 100,10)a on t1.c1=a.a1 where  exists (select c1 from t1);
count(*)
2000
select /*+parallel(6) use_hash(t1,t2)*/ count(*) from t1 left join (select /*+parallel(6) use_hash(t1,t2)*/ * from t2 limit 100,10)a on t1.c1=a.a1 where not exists (select c1 from t1);
count(*)
0
select /*+parallel(6) use_hash(t1,t2)*/ count(*) from t1 right join (select /*+parallel(6) use_hash(t1,t2)*/ * from t2 limit 100,10)a on t1.c1=a.a1 where  exists (select c1 from t1);
count(*)
10
select /*+parallel(6) use_hash(t1,t2)*/ * from t1 right join (select /*+parallel(6) use_hash(t1,t2)*/ * from t2 limit 100,10)a on t1.c1=a.a1 where not exists (select c1 from t1);
c1	c2	c3	a1	a2	a3
# not in
select /*+parallel(6) use_hash(t1,t2)*/ * from t1 inner join (select /*+parallel(6) use_hash(t1,t2)*/ * from t2 )a on t1.c1=a.a1 where a1 not in (select a1 from t2 where a1 >2);
c1	c2	c3	a1	a2	a3
2	NULL	李2	2	NULL	黄2
select /*+parallel(6) use_hash(t1,t2)*/ * from t1 inner join (select /*+parallel(6) use_hash(t1,t2)*/ * from t2 limit 100,10)a on t1.c1=a.a1 where a1 not in (select c1 from t1);
c1	c2	c3	a1	a2	a3
select /*+parallel(6) use_hash(t1,t2)*/ * from t1 left join (select /*+parallel(6) use_hash(t1,t2)*/ * from t2 )a on t1.c1=a.a1 where a1 not in (select a1 from t2 where a1 >2);
c1	c2	c3	a1	a2	a3
2	NULL	李2	2	NULL	黄2
select /*+parallel(6) use_hash(t1,t2)*/ count(*) from t1 left join (select /*+parallel(6) use_hash(t1,t2)*/ * from t2 limit 100,10)a on t1.c1=a.a1 where a1 not in  (select c1 from t1);
count(*)
0
select /*+parallel(6) use_hash(t1,t2)*/ * from t1 right join (select /*+parallel(6) use_hash(t1,t2)*/ * from t2 )a on t1.c1=a.a1 where a1 not in (select a1 from t2 where a1 >2);
c1	c2	c3	a1	a2	a3
2	NULL	李2	2	NULL	黄2
select /*+parallel(6) use_hash(t1,t2)*/ count(*) from t1 right join (select /*+parallel(6) use_hash(t1,t2)*/ * from t2 limit 100,10)a on t1.c1=a.a1 where a1 not in (select c1 from t1);
count(*)
0
#比较运算符 
select /*+parallel(6) use_hash(t1,t2)*/ count(*) from t1,t2 where  t1.c1=t2.a1;
count(*)
1999
select /*+parallel(6) use_hash(t1,t2)*/count(*) from t1 inner join t2 on t1.c1=t2.a1 where a1 >19995 ;
count(*)
0
select /*+parallel(6) use_hash(t1,t2)*/count(*) from t1 inner join (select * from t2)a on t1.c1=a.a1 where c1 >19995 ;
count(*)
0
select /*+parallel(6) use_hash(t1,t2)*/count(*) from t1 left join t2 on t1.c1=t2.a1 where a1 >19995 ;
count(*)
0
select /*+parallel(6) use_hash(t1,t2)*/count(*) from t2 left join (select * from t1)a on a.c1=t2.a1 where c1 >19995 ;
count(*)
0
select /*+parallel(6) use_hash(t1,t2)*/count(*) from t2 right join t1 on t1.c1=t2.a1 where a1 >19995 ;
count(*)
0
select /*+parallel(6) use_hash(t1,t2)*/count(*) from t1 right join (select * from t2)a on t1.c1=a.a1 where c1 >19995 ;
count(*)
0
select /*+parallel(6) use_hash(t1,t2)*/count(*) from t1 inner join t2 on t1.c1=t2.a1 where a1 >=19995 ;
count(*)
0
select /*+parallel(6) use_hash(t1,t2)*/count(*) from t1 inner join (select * from t2)a on t1.c1=a.a1 where c1 >=19995 ;
count(*)
0
select /*+parallel(6) use_hash(t1,t2)*/count(*) from t1 left join t2 on t1.c1=t2.a1 where a1 >=19995 ;
count(*)
0
select /*+parallel(6) use_hash(t1,t2)*/count(*) from t2 left join (select * from t1)a on a.c1=t2.a1 where c1 >=19995 ;
count(*)
0
select /*+parallel(6) use_hash(t1,t2)*/count(*) from t2 right join t1 on t1.c1=t2.a1 where a1 >=19995 ;
count(*)
0
select /*+parallel(6) use_hash(t1,t2)*/count(*) from t1 right join (select * from t2)a on t1.c1=a.a1 where c1 >=19995 ;
count(*)
0
select /*+parallel(6) use_hash(t1,t2)*/count(*) from t1 inner join t2 on t1.c1=t2.a1 where a1 <5 ;
count(*)
3
select /*+parallel(6) use_hash(t1,t2)*/count(*) from t1 inner join (select * from t2)a on t1.c1=a.a1 where a1 <5 ;
count(*)
3
select /*+parallel(6) use_hash(t1,t2)*/count(*) from t1 left join t2 on t1.c1=t2.a1 where a1 <5 ;
count(*)
3
select /*+parallel(6) use_hash(t1,t2)*/count(*) from t1 left join (select * from t2)a on t1.c1=a.a1 where a1 <5 ;
count(*)
3
select /*+parallel(6) use_hash(t1,t2)*/count(*) from t2 right join t1 on t1.c1=t2.a1 where a1 <5  ;
count(*)
3
select /*+parallel(6) use_hash(t1,t2)*/count(*) from t2 right join (select * from t1)a on a.c1=t2.a1 where a1 <5  ;
count(*)
3
select /*+parallel(6) use_hash(t1,t2)*/count(*) from t1 inner join t2 on t1.c1=t2.a1 where a1 <=5 ;
count(*)
4
select /*+parallel(6) use_hash(t1,t2)*/count(*) from t1 inner join (select * from t2)a on t1.c1=a.a1 where a1 <=5 ;
count(*)
4
select /*+parallel(6) use_hash(t1,t2)*/count(*) from t1 left join t2 on t1.c1=t2.a1 where a1 <=5 ;
count(*)
4
select /*+parallel(6) use_hash(t1,t2)*/count(*) from t1 left join (select * from t2)a on t1.c1=a.a1 where a1 <=5 ;
count(*)
4
select /*+parallel(6) use_hash(t1,t2)*/count(*) from t2 right join t1 on t1.c1=t2.a1 where a1 <=5  ;
count(*)
4
select /*+parallel(6) use_hash(t1,t2)*/count(*) from t2 right join (select * from t1)a on a.c1=t2.a1 where a1 <=5  ;
count(*)
4
select /*+parallel(6) use_hash(t1,t2)*/count(*) from t1 inner join t2 on t1.c1=t2.a1 where a1 <>5 ;
count(*)
1998
select /*+parallel(6) use_hash(t1,t2)*/count(*) from t1 inner join (select * from t2)a on t1.c1=a.a1 where a1 <>5 ;
count(*)
1998
select /*+parallel(6) use_hash(t1,t2)*/count(*) from t1 left join t2 on t1.c1=t2.a1 where a1 <>5 ;
count(*)
1998
select /*+parallel(6) use_hash(t1,t2)*/count(*) from t1 left join (select * from t2)a on t1.c1=a.a1 where a1 <>5 ;
count(*)
1998
select /*+parallel(6) use_hash(t1,t2)*/count(*) from t2 right join t1 on t1.c1=t2.a1 where a1 <>5  ;
count(*)
1998
select /*+parallel(6) use_hash(t1,t2)*/count(*) from t2 right join (select * from t1)a on a.c1=t2.a1 where a1 <>5  ;
count(*)
1998
select /*+parallel(6) use_hash(t1,t2)*/count(*) from t1 inner join t2 on t1.c1=t2.a1 where a1 !=5 ;
count(*)
1998
select /*+parallel(6) use_hash(t1,t2)*/count(*) from t1 inner join (select * from t2)a on t1.c1=a.a1 where a1 !=5 ;
count(*)
1998
select /*+parallel(6) use_hash(t1,t2)*/count(*) from t1 left join t2 on t1.c1=t2.a1 where a1 !=5 ;
count(*)
1998
select /*+parallel(6) use_hash(t1,t2)*/count(*) from t1 left join (select * from t2)a on t1.c1=a.a1 where a1 !=5 ;
count(*)
1998
select /*+parallel(6) use_hash(t1,t2)*/count(*) from t2 right join t1 on t1.c1=t2.a1 where a1 !=5  ;
count(*)
1998
select /*+parallel(6) use_hash(t1,t2)*/count(*) from t2 right join (select * from t1)a on a.c1=t2.a1 where a1 !=5  ;
count(*)
1998
#order by子句
select /*+parallel(6) use_hash(t1,t2)*/ * from t1 inner join t2 on t1.c1=t2.a1 where a1 <5 order by a1 desc  ;
c1	c2	c3	a1	a2	a3
4	NULL	李4	4	NULL	黄4
3	NULL	李3	3	NULL	黄3
2	NULL	李2	2	NULL	黄2
select /*+parallel(6) use_hash(t1,t2)*/ * from t1 inner join (select * from t2)a on t1.c1=a.a1 where a1 <5 order by a1 desc  ;
c1	c2	c3	a1	a2	a3
4	NULL	李4	4	NULL	黄4
3	NULL	李3	3	NULL	黄3
2	NULL	李2	2	NULL	黄2
select /*+parallel(6) use_hash(t1,t2)*/ * from t1 left join t2 on t1.c1=t2.a1 where a1 <5 order by a1 desc  ;
c1	c2	c3	a1	a2	a3
4	NULL	李4	4	NULL	黄4
3	NULL	李3	3	NULL	黄3
2	NULL	李2	2	NULL	黄2
select /*+parallel(6) use_hash(t1,t2)*/ * from t1 left join (select * from t2)a on t1.c1=a.a1 where a1 <5 order by a1 desc ;
c1	c2	c3	a1	a2	a3
4	NULL	李4	4	NULL	黄4
3	NULL	李3	3	NULL	黄3
2	NULL	李2	2	NULL	黄2
select /*+parallel(6) use_hash(t1,t2)*/ * from t2 right join t1 on t1.c1=t2.a1 where a1 <5 order by a1 desc  ;
a1	a2	a3	c1	c2	c3
4	NULL	黄4	4	NULL	李4
3	NULL	黄3	3	NULL	李3
2	NULL	黄2	2	NULL	李2
select /*+parallel(6) use_hash(t1,t2)*/ * from t2 right join (select * from t1)a on a.c1=t2.a1 where a1 <5 order by a1 desc  ;
a1	a2	a3	c1	c2	c3
4	NULL	黄4	4	NULL	李4
3	NULL	黄3	3	NULL	李3
2	NULL	黄2	2	NULL	李2
# distinct
select /*+parallel(6) use_hash(t1,t2)*/ distinct(a2) from t1 inner join t2 on t1.c1=t2.a1 where a1 <5 order by a1 desc  ;
a2
NULL
select /*+parallel(6) use_hash(t1,t2)*/ distinct(a2) from t1 inner join (select * from t2)a on t1.c1=a.a1 where a1 <5 order by a1 desc  ;
a2
NULL
select /*+parallel(6) use_hash(t1,t2)*/ distinct(a2) from t1 left join t2 on t1.c1=t2.a1 where a1 <5 order by a1 desc  ;
a2
NULL
select /*+parallel(6) use_hash(t1,t2)*/ distinct(a2) from t1 left join (select * from t2)a on t1.c1=a.a1 where a1 <5 order by a1 desc ;
a2
NULL
select /*+parallel(6) use_hash(t1,t2)*/ distinct(a2) from t2 right join t1 on t1.c1=t2.a1 where a1 <5 order by a1 desc  ;
a2
NULL
select /*+parallel(6) use_hash(t1,t2)*/ distinct(a2) from t2 right join (select * from t1)a on a.c1=t2.a1 where a1 <5 order by a1 desc  ;
a2
NULL
# group by having子句
select /*+parallel(6) use_hash(t1,t2)*/ count(*) from t1 inner join t2 on t1.c1=t2.a1 group by c2 having max(c1) ;
count(*)
1999
select /*+parallel(6) use_hash(t1,t2)*/ count(*) from t1 inner join (select * from t2)a on t1.c1=a.a1 group by c2 having max(c1) ;
count(*)
1999
select /*+parallel(6) use_hash(t1,t2)*/ * from t1 left join t2 on t1.c1=t2.a1 group by c2 having max(c1) ;
c1	c2	c3	a1	a2	a3
1	NULL	李1	NULL	NULL	NULL
select /*+parallel(6) use_hash(t1,t2)*/ * from t1 left join (select * from t2)a on t1.c1=a.a1 group by c2 having max(c1) ;
c1	c2	c3	a1	a2	a3
1	NULL	李1	NULL	NULL	NULL
select /*+parallel(6) use_hash(t1,t2)*/ * from t2 right join t1 on t1.c1=t2.a1 group by c2 having max(c1) ;
a1	a2	a3	c1	c2	c3
NULL	NULL	NULL	1	NULL	李1
select /*+parallel(6) use_hash(t1,t2)*/ * from t2 right join (select * from t1)a on a.c1=t2.a1 group by c2 having max(c1) ;
a1	a2	a3	c1	c2	c3
NULL	NULL	NULL	1	NULL	李1
#with as
with a as(select * from t1 where c1 <10000 ),b as(select * from t2 where a1 <20000 )select /*+parallel(6) use_hash(t1,t2)*/count(*) from a,b where a.c1=b.a1 ;
count(*)
1999
with a as(select * from t1 where c1 <10000 ),b as(select * from t2 where a1 <20000 )select /*+parallel(6) use_hash(t1,t2)*/count(*) from a inner join b on a.c1=b.a1 ;
count(*)
1999
#单列多列
select /*+parallel(6) use_hash(t1,t2)*/ count(c1) from t1 inner join t2 on t1.c1=t2.a1 group by c2 having max(c1) ;
count(c1)
1999
select /*+parallel(6) use_hash(t1,t2)*/ count(c1),c2 from t1 inner join (select * from t2)a on t1.c1=a.a1 group by c2 having max(c1) ;
count(c1)	c2
1999	NULL
select /*+parallel(6) use_hash(t1,t2)*/ count(c1),c2,c3 from t1 inner join (select * from t2)a on t1.c1=a.a1 group by c2 having max(c1) ;
count(c1)	c2	c3
1999	NULL	李2
drop table t1 ;
drop procedure pro1;
drop table t2 ;
drop procedure pro2;
CREATE TABLE t1(  
c1 int ,  
c2 DECIMAL(5,2) DEFAULT null, 
c3 VARCHAR(100)
);
CREATE  PROCEDURE pro1(in j int)
begin
DECLARE i int;
set i = 1;
while i <= j DO
insert into t1(c1,c2,c3) values(i,null, concat("李",i));
set i = i + 1;
end WHILE;
end;
//
call pro1(2000);
CREATE TABLE t2(  
a1 int ,  
a2 DECIMAL(5,2) DEFAULT null, 
a3 VARCHAR(100)
);
CREATE  PROCEDURE pro2(in j int)
begin
DECLARE i int;
set i = 2;
while i <= j DO
insert into t2(a1,a2,a3) values(i,null, concat("黄",i));
set i = i + 1;
end WHILE;
end;
//
call pro2(3000);
#update
update /*+parallel(6) use_hash(t1,t2)*/t1 inner join t2 on t1.c1=t2.a1 set t1.c2=6,t2.a2=7  where t1.c1 =(select c1 from(select c1 from t1 order by c1 limit 6,1)as tt );
update /*+parallel(6) use_hash(t1,t2)*/t2 left join t1 on t1.c1=t2.a1 set t1.c2=6,t2.a2=7  where t1.c1 =(select c1 from(select c1 from t1 order by c1 limit 6,1)as tt );
update /*+parallel(6) use_hash(t1,t2)*/t1 right join t2 on t1.c1=t2.a1 set t1.c2=6,t2.a2=7  where t1.c1 =(select c1 from(select c1 from t1 order by c1 limit 6,1)as tt );
update /*+parallel(6) use_hash(t1,t2)*/t1 inner join t2 on t1.c1=t2.a1 set t1.c1=2,t2.a1=3 where t1.c3="李6";
update /*+parallel(6) use_hash(t1,t2)*/t2 left join t1 on t1.c1=t2.a1 set t1.c1=2,t2.a1=3 where t1.c3="李6";
update /*+parallel(6) use_hash(t1,t2)*/t1 right join t2 on t1.c1=t2.a1 set t1.c1=2,t2.a1=3 where t1.c3="李6";
#insert
insert into t2 select /*+parallel(6) use_hash(t1,t2)*/a1,a2,a3  from t1 inner join t2 on t1.c1=t2.a1 order by c1 limit 1;
insert into t2 select /*+parallel(6) use_hash(t1,t2)*/a1,a2,a3  from t2 left join t1 on t1.c1=t2.a1 order by c1 limit 1;
insert into t2 select /*+parallel(6) use_hash(t1,t2)*/a1,a2,a3  from t1 right join t2 on t1.c1=t2.a1 order by c1 limit 1;
insert into t1 select /*+parallel(6) use_hash(t1,t2)*/ * from t1  where c1 in(select a1 from t2) limit 1;
select count(*) from t1 ;
count(*)
2001
select count(*) from t2 ;
count(*)
3002
insert into t1 select /*+parallel(6) use_hash(t1,t2)*/ * from t1  where c1 not in(select a1 from t2) limit 1;
select count(*) from t1 ;
count(*)
2002
select count(*) from t2 ;
count(*)
3002
#delete
delete from t1 where c1= (select /*+parallel(6) use_hash(t1,t2)*/c1 from (select * from t1 inner join t2 on t1.c1=t2.a1 order by c1 limit 1) as tt) ;
#mysql无法查询，ob正常执行;
drop table t1 ;
drop procedure pro1;
drop table t2 ;
drop procedure pro2;
create table t1(c1 int primary key,c2 int);
create table t2(a1 int primary key,a2 int);
insert into t1 values(1,1);
insert into t1 values(2,2);
insert into t1 values(3,3);
insert into t1 values(4,6);
insert into t2 values(1,2);
insert into t2 values(2,2);
insert into t2 values(3,4);
insert into t2 values(5,7);
insert into t2 values(6,8);
#replace into
replace into t2 select /*+parallel(6) use_hash(t1,t2)*/a1,a2 from t1 inner join t2 on t1.c1=t2.a1 order by c1 limit 1;
select * from t1 ;
c1	c2
1	1
2	2
3	3
4	6
select * from t2 ;
a1	a2
1	2
2	2
3	4
5	7
6	8
replace into t2 select /*+parallel(6) use_hash(t1,t2)*/a1,a2 from t2 left join t1 on t1.c1=t2.a1 order by c1 limit 1;
select * from t1 ;
c1	c2
1	1
2	2
3	3
4	6
select * from t2 ;
a1	a2
1	2
2	2
3	4
5	7
6	8
replace into t2 select /*+parallel(6) use_hash(t1,t2)*/a1,a2 from t1 right join t2 on t1.c1=t2.a1 order by c1 limit 1;
select * from t1 ;
c1	c2
1	1
2	2
3	3
4	6
select * from t2 ;
a1	a2
1	2
2	2
3	4
5	7
6	8
replace into t1 select /*+parallel(6) use_hash(t1,t2)*/ * from t1  where c1 in(select a1 from t2) limit 1;
select * from t1 ;
c1	c2
1	1
2	2
3	3
4	6
select * from t2 ;
a1	a2
1	2
2	2
3	4
5	7
6	8
replace into t1 select /*+parallel(6) use_hash(t1,t2)*/ * from t1  where c1 not in(select a1 from t2) limit 1;
select * from t1 ;
c1	c2
1	1
2	2
3	3
4	6
select * from t2 ;
a1	a2
1	2
2	2
3	4
5	7
6	8
drop table t1;
drop table t2;
drop database db1;
