alter system set_tp tp_no = 313, error_code = 6, frequency = 1;
alter system set _enable_parallel_das_dml='true';
DROP TABLE IF EXISTS t1;
DROP TABLE IF EXISTS t2;
DROP TABLE IF EXISTS t3;
DROP TABLE IF EXISTS t4;
DROP TABLE IF EXISTS t5;
create table t1(c1 int, c2 int, c3 int, primary key(c1,c2)) partition by hash(c1) partitions 6;
insert /*+enable_parallel_das_dml enable_parallel_dml parallel(10)*/ into t1 values(1,1,1),(2,2,2),(3,3,3),(4,4,4),(5,5,5),(6,6,6),(7,7,7),(8,8,8),(9,9,9);
insert /*+enable_parallel_das_dml enable_parallel_dml parallel(5)*/ into t1 values(11,11,11),(12,12,12),(13,13,13),(14,14,14),(5,5,5);
ERROR 23000: Duplicate entry '5-5' for key 'PRIMARY'
select * from t1 order by c1;
c1	c2	c3
1	1	1
2	2	2
3	3	3
4	4	4
5	5	5
6	6	6
7	7	7
8	8	8
9	9	9
explain update /*+enable_parallel_das_dml enable_parallel_dml parallel(10)*/  t1 set c1 = c1 + 1;
Query Plan
===========================================================
|ID|OPERATOR               |NAME    |EST.ROWS|EST.TIME(us)|
-----------------------------------------------------------
|0 |DISTRIBUTED UPDATE     |        |9       |99          |
|1 |└─PX COORDINATOR       |        |9       |7           |
|2 |  └─EXCHANGE OUT DISTR |:EX10000|9       |3           |
|3 |    └─PX BLOCK ITERATOR|        |9       |2           |
|4 |      └─TABLE FULL SCAN|t1      |9       |2           |
===========================================================
Outputs & filters:
-------------------------------------
  0 - output(nil), filter(nil)
      table_columns([{t1: ({t1: (t1.c1, t1.c2, t1.c3)})}]),
      update([t1.c1=column_conv(INT,PS:(11,0),NOT NULL,cast(t1.c1 + 1, INT(-1, 0)))]), das_dop=10
  1 - output([t1.c1], [t1.c2], [t1.c3]), filter(nil), rowset=16
  2 - output([t1.c1], [t1.c2], [t1.c3]), filter(nil), rowset=16
      dop=10
  3 - output([t1.c1], [t1.c2], [t1.c3]), filter(nil), rowset=16
  4 - output([t1.c1], [t1.c2], [t1.c3]), filter(nil), rowset=16
      access([t1.c1], [t1.c2], [t1.c3]), partitions(p[0-5])
      is_index_back=false, is_global_index=false, 
      range_key([t1.c1], [t1.c2]), range(MIN,MIN ; MAX,MAX)always true
update /*+enable_parallel_das_dml enable_parallel_dml parallel(10)*/  t1 set c1 = c1 + 1;
select * from t1 order by c1;
c1	c2	c3
2	1	1
3	2	2
4	3	3
5	4	4
6	5	5
7	6	6
8	7	7
9	8	8
10	9	9
delete /*+enable_parallel_das_dml enable_parallel_dml parallel(10)*/  from t1;
drop table t1;
create table t1(c1 int, c2 int, c3 varchar(20), primary key(c1,c2)) partition by hash(c1) partitions 8;
insert /*+enable_parallel_das_dml enable_parallel_dml parallel(10)*/ into t1 values(1,1,'1'),(2,2,'2'),(3,3,'3'),(4,4,'4'),(5,5,'5'),(6,6,'6'),(7,7,'7'),(8,8,'8'),(9,9,'9');
insert /*+enable_parallel_das_dml enable_parallel_dml parallel(10)*/ into t1 values(11,11,'11'),(12,12,'12'),(13,13,'13'),(14,14,'14'),(15,15,'15'),(6,6,'6');
ERROR 23000: Duplicate entry '6-6' for key 'PRIMARY'
select * from t1 order by c1;
c1	c2	c3
1	1	1
2	2	2
3	3	3
4	4	4
5	5	5
6	6	6
7	7	7
8	8	8
9	9	9
update /*+enable_parallel_das_dml enable_parallel_dml parallel(10)*/  t1 set c1 = c1 + 1;
update /*+enable_parallel_das_dml enable_parallel_dml parallel(10)*/  t1 set c3 = 'new_c3';
select * from t1 order by c1;
c1	c2	c3
2	1	new_c3
3	2	new_c3
4	3	new_c3
5	4	new_c3
6	5	new_c3
7	6	new_c3
8	7	new_c3
9	8	new_c3
10	9	new_c3
drop table t1;
create table t1(c1 int, c2 int, c3 int, primary key(c1)) partition by hash(c1) partitions 8;
create unique index t1_idx_01 on t1(c3) global;
insert /*+enable_parallel_das_dml enable_parallel_dml parallel(10)*/ into t1 values(1,1,1),(2,2,2),(3,3,3),(4,4,4),(5,5,5),(6,6,6),(7,7,7),(8,8,8),(9,9,9);
insert /*+enable_parallel_das_dml enable_parallel_dml parallel(10)*/ into t1 values(11,11,11),(12,12,12),(13,13,13),(4,4,4),(18,18,18),(19,19,19);
ERROR 23000: Duplicate entry '4' for key 't1_idx_01'
select * from t1 order by c1;
c1	c2	c3
1	1	1
2	2	2
3	3	3
4	4	4
5	5	5
6	6	6
7	7	7
8	8	8
9	9	9
update /*+enable_parallel_das_dml enable_parallel_dml parallel(10)*/ t1 set c3 = c3 + 10 where c3 > 5;
select * from t1 order by c1;
c1	c2	c3
1	1	1
2	2	2
3	3	3
4	4	4
5	5	5
6	6	16
7	7	17
8	8	18
9	9	19
drop table t1;
create table t1(c1 int primary key, c2 int, c3 int) partition by hash(c1) partitions 8;
create table t2(c1 int , c2 int, c3 int);
insert /*+enable_parallel_das_dml enable_parallel_dml parallel(10)*/ into t2 values(1,1,1),(2,2,2),(3,3,3),(4,4,4),(5,5,5),(6,6,6),(7,7,7),(8,8,8),(9,9,9),(10,10,10),(11,11,11),(12,12,12),(13,13,13),(14,14,14),(15,15,15),(16,16,16),(17,17,17),(18,18,18),(19,19,19),(20,20,20),(21,21,21),(22,22,22),(23,23,23),(24,24,24),(25,25,25),(26,26,26);
replace /*+enable_parallel_das_dml enable_parallel_dml parallel(10)*/ into t1 select * from t2;
replace /*+enable_parallel_das_dml enable_parallel_dml parallel(10)*/ into t1 select * from t2;
replace /*+enable_parallel_das_dml enable_parallel_dml parallel(10)*/ into t1 values (11,11,11),(12,12,12),(13,13,13),(14,14,14),(15,15,15),(31,31,31),(32,32,32),(33,33,13),(34,34,34),(35,35,35),(22,22,22),(23,23,23),(24,24,24),(11,11,11),(12,12,12),(13,13,13),(14,14,14),(15,15,15);
replace /*+enable_parallel_das_dml enable_parallel_dml parallel(10)*/ into t1 values (51,51,51),(52,52,52),(51,51,51),(52,52,52),(53,53,53),(54,54,54),(55,55,55),(56,56,56);
select * from t1 order by c1;
c1	c2	c3
1	1	1
2	2	2
3	3	3
4	4	4
5	5	5
6	6	6
7	7	7
8	8	8
9	9	9
10	10	10
11	11	11
12	12	12
13	13	13
14	14	14
15	15	15
16	16	16
17	17	17
18	18	18
19	19	19
20	20	20
21	21	21
22	22	22
23	23	23
24	24	24
25	25	25
26	26	26
31	31	31
32	32	32
33	33	13
34	34	34
35	35	35
51	51	51
52	52	52
53	53	53
54	54	54
55	55	55
56	56	56
delete from t1;
insert /*+enable_parallel_das_dml enable_parallel_dml parallel(10)*/ into t1 select * from t2 on duplicate key update c2 = c2 + 1, c3 = c3 + 1;
insert /*+enable_parallel_das_dml enable_parallel_dml parallel(10)*/ into t1 select * from t2 on duplicate key update c2 = c2 + 1, c3 = c3 + 1;
insert /*+enable_parallel_das_dml enable_parallel_dml parallel(10)*/ into t1 values (11,11,11),(12,12,12),(13,13,13),(14,14,14),(15,15,15),(31,31,31),(32,32,32),(33,33,13),(34,34,34),(35,35,35),(22,22,22),(23,23,23),(24,24,24),(11,11,11),(12,12,12),(13,13,13),(14,14,14),(15,15,15) on duplicate key update c2 = c2 + 1, c3 = c3 + 1;
insert /*+enable_parallel_das_dml enable_parallel_dml parallel(10)*/ into t1 values (51,51,51),(52,52,52),(51,51,51),(52,52,52),(53,53,53),(54,54,54),(55,55,55),(56,56,56) on duplicate key update c2 = c2 + 1, c3 = c3 + 1;
select * from t1 order by c1;
c1	c2	c3
1	2	2
2	3	3
3	4	4
4	5	5
5	6	6
6	7	7
7	8	8
8	9	9
9	10	10
10	11	11
11	14	14
12	15	15
13	16	16
14	17	17
15	18	18
16	17	17
17	18	18
18	19	19
19	20	20
20	21	21
21	22	22
22	24	24
23	25	25
24	26	26
25	26	26
26	27	27
31	31	31
32	32	32
33	33	13
34	34	34
35	35	35
51	52	52
52	53	53
53	53	53
54	54	54
55	55	55
56	56	56
drop table t1;
drop table t2;
alter system set _enable_parallel_das_dml='false';
