result_format: 4
alter system set_tp tp_no = 302, error_code = 1, frequency = 1;
affected rows: 0
DROP TABLE IF EXISTS t1;
affected rows: 0
create table t1(a int primary key, b int) partition by hash(a) partitions 3;
affected rows: 0
insert into t1 values(1, 1), (2, 2);
affected rows: 2
info: Records: 2  Duplicates: 0  Warnings: 0
update t1 set b=b+1 where a>0;
affected rows: 2
info: Rows matched: 2  Changed: 2  Warnings: 0
select * from t1;
+---+------+
| a | b    |
+---+------+
| 1 |    2 |
| 2 |    3 |
+---+------+
affected rows: 2
drop table t1;
affected rows: 0

DROP TABLE IF EXISTS t1, t2;
affected rows: 0
create table t1(a int primary key, b int) partition by hash(a) partitions 2;
affected rows: 0
create table t2(a int primary key, b int) partition by hash(a) partitions 2;
affected rows: 0
insert into t1 values(1, 1);
affected rows: 1
insert into t2 values(1, 1);
affected rows: 1
## test update change t2.b, not change t1.b
update t1, t2 set t1.b=1, t2.b=2 where t1.a=t2.a and t1.a=1;
affected rows: 1
info: Rows matched: 2  Changed: 1  Warnings: 0
select * from t1;
+---+------+
| a | b    |
+---+------+
| 1 |    1 |
+---+------+
affected rows: 1
select * from t2;
+---+------+
| a | b    |
+---+------+
| 1 |    2 |
+---+------+
affected rows: 1
update t1, t2 set t1.a=1, t2.a=2 where t1.a=t2.a and t1.a=1;
affected rows: 1
info: Rows matched: 2  Changed: 1  Warnings: 0
select * from t1;
+---+------+
| a | b    |
+---+------+
| 1 |    1 |
+---+------+
affected rows: 1
select * from t2;
+---+------+
| a | b    |
+---+------+
| 2 |    2 |
+---+------+
affected rows: 1
delete t1, t2 from t1, t2;
affected rows: 2
insert into t1 values(1, 1);
affected rows: 1
insert into t2 values(1, 1);
affected rows: 1
## test update change t1.b, not change t2.b
update t1, t2 set t1.b=2, t2.b=1 where t1.a=t2.a and t1.a=1;
affected rows: 1
info: Rows matched: 2  Changed: 1  Warnings: 0
select * from t1;
+---+------+
| a | b    |
+---+------+
| 1 |    2 |
+---+------+
affected rows: 1
select * from t2;
+---+------+
| a | b    |
+---+------+
| 1 |    1 |
+---+------+
affected rows: 1
update t1, t2 set t1.a=2, t2.a=1 where t1.a=t2.a and t1.a=1;
affected rows: 1
info: Rows matched: 2  Changed: 1  Warnings: 0
select * from t1;
+---+------+
| a | b    |
+---+------+
| 2 |    2 |
+---+------+
affected rows: 1
select * from t2;
+---+------+
| a | b    |
+---+------+
| 1 |    1 |
+---+------+
affected rows: 1
delete t1, t2 from t1, t2;
affected rows: 2
insert into t1 values(1, 1);
affected rows: 1
insert into t2 values(1, 1);
affected rows: 1
## test update change t1.b and t2.b
update t1, t2 set t1.b=2, t2.b=2 where t1.a=t2.a and t1.a=1;
affected rows: 2
info: Rows matched: 2  Changed: 2  Warnings: 0
select * from t1;
+---+------+
| a | b    |
+---+------+
| 1 |    2 |
+---+------+
affected rows: 1
select * from t2;
+---+------+
| a | b    |
+---+------+
| 1 |    2 |
+---+------+
affected rows: 1
delete t1, t2 from t1, t2;
affected rows: 2

create index i1 on t1(b);
affected rows: 0
create index i1 on t2(b);
affected rows: 0
insert into t1 values(1, 1);
affected rows: 1
## test update main table change t1.a across partition but t1.b does not
update t1 set a=a+1, b=b+1 where a=1;
affected rows: 1
info: Rows matched: 1  Changed: 1  Warnings: 0
select * from t1;
+---+------+
| a | b    |
+---+------+
| 2 |    2 |
+---+------+
affected rows: 1
insert into t2 select * from t1;
affected rows: 1
## test update t2 change across partition but t1 does not
update t1, t2 set t1.a=2, t2.a=3 where t1.a=2 and t1.a=t2.a;
affected rows: 1
info: Rows matched: 2  Changed: 1  Warnings: 0
select * from t1;
+---+------+
| a | b    |
+---+------+
| 2 |    2 |
+---+------+
affected rows: 1
select * from t2;
+---+------+
| a | b    |
+---+------+
| 3 |    2 |
+---+------+
affected rows: 1
drop table t1, t2;
affected rows: 0

create table t1(a int primary key, b int, c int, d timestamp(6) NULL DEFAULT CURRENT_TIMESTAMP(6) ON UPDATE CURRENT_TIMESTAMP(6)) partition by hash(a) partitions 2;
affected rows: 0
create index idx on t1(c, d) global;
affected rows: 0
insert into t1 values(1, 1, 1, now());
affected rows: 1
update t1 set b=2, c=1 where a=1;
affected rows: 1
info: Rows matched: 1  Changed: 1  Warnings: 0
select /*+index(t1 primary)*/ a, c, d from t1;
+---+------+----------------------------+
| a | c    | d                          |
+---+------+----------------------------+
| 1 |    1 | TIMESTAMP                  |
+---+------+----------------------------+
affected rows: 1
select /*+index(t1 idx)*/ a, c, d from t1;
+---+------+----------------------------+
| a | c    | d                          |
+---+------+----------------------------+
| 1 |    1 | TIMESTAMP                  |
+---+------+----------------------------+
affected rows: 1
update t1 set b=2, c=2 where a=1;
affected rows: 1
info: Rows matched: 1  Changed: 1  Warnings: 0
select /*+index(t1 primary)*/ a, c, d from t1;
+---+------+----------------------------+
| a | c    | d                          |
+---+------+----------------------------+
| 1 |    2 | TIMESTAMP                  |
+---+------+----------------------------+
affected rows: 1
select /*+index(t1 idx)*/ a, c, d from t1;
+---+------+----------------------------+
| a | c    | d                          |
+---+------+----------------------------+
| 1 |    2 | TIMESTAMP                  |
+---+------+----------------------------+
affected rows: 1
drop table t1;
affected rows: 0

DROP TABLE IF EXISTS t1, t2, t3;
affected rows: 0
CREATE TABLE t1 (a int not null,b int not null);
affected rows: 0
CREATE TABLE t2 (a int not null, b int not null, primary key (a,b));
affected rows: 0
CREATE TABLE t3 (a int not null, b int not null, primary key (a,b));
affected rows: 0
insert into t1 values (1,1),(2,1),(1,3);
affected rows: 3
info: Records: 3  Duplicates: 0  Warnings: 0
insert into t2 values (1,1),(2,2),(3,3);
affected rows: 3
info: Records: 3  Duplicates: 0  Warnings: 0
insert into t3 values (1,1),(2,1),(1,3);
affected rows: 3
info: Records: 3  Duplicates: 0  Warnings: 0
delete t2.*,t3.* from t1,t2,t3 where t1.a=t2.a AND t2.b=t3.a and t1.b=t3.b;
affected rows: 5
drop table t1, t2, t3;
affected rows: 0

create table t1(a int primary key, b int, c int, d int) partition by hash(a) partitions 2;
affected rows: 0
create index idx on t1(b, c) partition by hash(b) partitions 2;
affected rows: 0
insert into t1 values(1, 1, 1, 1), (2, 2, 2, 2), (3, 3, 3, 3), (4, 4, 4, 4);
affected rows: 4
info: Records: 4  Duplicates: 0  Warnings: 0
select /*+index(t1 primary)*/ * from t1;
+---+------+------+------+
| a | b    | c    | d    |
+---+------+------+------+
| 1 |    1 |    1 |    1 |
| 2 |    2 |    2 |    2 |
| 3 |    3 |    3 |    3 |
| 4 |    4 |    4 |    4 |
+---+------+------+------+
affected rows: 4
select /*+index(t1 idx)*/ a, b, c from t1;
+---+------+------+
| a | b    | c    |
+---+------+------+
| 1 |    1 |    1 |
| 2 |    2 |    2 |
| 3 |    3 |    3 |
| 4 |    4 |    4 |
+---+------+------+
affected rows: 4
## test primary index update the partition key, global index don't update the partition key
## when update row one by one, this case will throw error 1062
update t1 set a=a+1, c=c+1;
select /*+index(t1 primary)*/ * from t1;
+---+------+------+------+
| a | b    | c    | d    |
+---+------+------+------+
| 1 |    1 |    1 |    1 |
| 2 |    2 |    2 |    2 |
| 3 |    3 |    3 |    3 |
| 4 |    4 |    4 |    4 |
+---+------+------+------+
affected rows: 4
select /*+index(t1 idx)*/ a, b, c from t1;
+---+------+------+
| a | b    | c    |
+---+------+------+
| 1 |    1 |    1 |
| 2 |    2 |    2 |
| 3 |    3 |    3 |
| 4 |    4 |    4 |
+---+------+------+
affected rows: 4
## test primary index don't update part key, global index update part key
update t1 set b=b+1;
affected rows: 4
info: Rows matched: 4  Changed: 4  Warnings: 0
select /*+index(t1 primary)*/ * from t1;
+---+------+------+------+
| a | b    | c    | d    |
+---+------+------+------+
| 1 |    2 |    1 |    1 |
| 2 |    3 |    2 |    2 |
| 3 |    4 |    3 |    3 |
| 4 |    5 |    4 |    4 |
+---+------+------+------+
affected rows: 4
select /*+index(t1 idx)*/ a, b, c from t1;
+---+------+------+
| a | b    | c    |
+---+------+------+
| 1 |    2 |    1 |
| 2 |    3 |    2 |
| 3 |    4 |    3 |
| 4 |    5 |    4 |
+---+------+------+
affected rows: 4
## test primary index update across partitions, global index don't across partitions
## when update row one by one, this case will throw error 1062
update t1 set a=a+5, b=b+6 where a in (2, 4);
affected rows: 2
info: Rows matched: 2  Changed: 2  Warnings: 0
select /*+index(t1 primary)*/ * from t1;
+---+------+------+------+
| a | b    | c    | d    |
+---+------+------+------+
| 1 |    2 |    1 |    1 |
| 3 |    4 |    3 |    3 |
| 7 |    9 |    2 |    2 |
| 9 |   11 |    4 |    4 |
+---+------+------+------+
affected rows: 4
select /*+index(t1 idx)*/ a, b, c from t1;
+---+------+------+
| a | b    | c    |
+---+------+------+
| 1 |    2 |    1 |
| 3 |    4 |    3 |
| 7 |    9 |    2 |
| 9 |   11 |    4 |
+---+------+------+
affected rows: 4
## test primary index update don't across partitions, global index across partition
update t1 set a=a+6, b=b+5 where b in (8, 10);
affected rows: 0
info: Rows matched: 0  Changed: 0  Warnings: 0
select /*+index(t1 primary)*/ * from t1;
+---+------+------+------+
| a | b    | c    | d    |
+---+------+------+------+
| 1 |    2 |    1 |    1 |
| 3 |    4 |    3 |    3 |
| 7 |    9 |    2 |    2 |
| 9 |   11 |    4 |    4 |
+---+------+------+------+
affected rows: 4
select /*+index(t1 idx)*/ a, b, c from t1;
+---+------+------+
| a | b    | c    |
+---+------+------+
| 1 |    2 |    1 |
| 3 |    4 |    3 |
| 7 |    9 |    2 |
| 9 |   11 |    4 |
+---+------+------+
affected rows: 4
delete from t1;
affected rows: 4
insert into t1 values(1, 1, 1, 1), (2, 2, 2, 2), (3, 3, 3, 3), (4, 4, 4, 4);
affected rows: 4
info: Records: 4  Duplicates: 0  Warnings: 0
## test primary index row not changed
update t1 set b=a;
affected rows: 0
info: Rows matched: 4  Changed: 0  Warnings: 0
update t1 set a=b, b=a, c=d;
affected rows: 0
info: Rows matched: 4  Changed: 0  Warnings: 0
select /*+index(t1 primary)*/ * from t1;
+---+------+------+------+
| a | b    | c    | d    |
+---+------+------+------+
| 1 |    1 |    1 |    1 |
| 2 |    2 |    2 |    2 |
| 3 |    3 |    3 |    3 |
| 4 |    4 |    4 |    4 |
+---+------+------+------+
affected rows: 4
select /*+index(t1 idx)*/ a, b, c from t1;
+---+------+------+
| a | b    | c    |
+---+------+------+
| 1 |    1 |    1 |
| 2 |    2 |    2 |
| 3 |    3 |    3 |
| 4 |    4 |    4 |
+---+------+------+
affected rows: 4
drop table t1;
affected rows: 0

alter system set_tp tp_no = 302, error_code = 4, frequency = 1;
affected rows: 0
DROP TABLE IF EXISTS t1;
affected rows: 0
create table t1(a int primary key, b int) partition by hash(a) partitions 3;
affected rows: 0
insert into t1 values(1, 1), (2, 2);
affected rows: 2
info: Records: 2  Duplicates: 0  Warnings: 0
update t1 set b=b+1 where a>0;
affected rows: 2
info: Rows matched: 2  Changed: 2  Warnings: 0
select * from t1;
+---+------+
| a | b    |
+---+------+
| 1 |    2 |
| 2 |    3 |
+---+------+
affected rows: 2
drop table t1;
affected rows: 0

DROP TABLE IF EXISTS t1, t2;
affected rows: 0
create table t1(a int primary key, b int) partition by hash(a) partitions 2;
affected rows: 0
create table t2(a int primary key, b int) partition by hash(a) partitions 2;
affected rows: 0
insert into t1 values(1, 1);
affected rows: 1
insert into t2 values(1, 1);
affected rows: 1
## test update change t2.b, not change t1.b
update t1, t2 set t1.b=1, t2.b=2 where t1.a=t2.a and t1.a=1;
affected rows: 1
info: Rows matched: 2  Changed: 1  Warnings: 0
select * from t1;
+---+------+
| a | b    |
+---+------+
| 1 |    1 |
+---+------+
affected rows: 1
select * from t2;
+---+------+
| a | b    |
+---+------+
| 1 |    2 |
+---+------+
affected rows: 1
update t1, t2 set t1.a=1, t2.a=2 where t1.a=t2.a and t1.a=1;
affected rows: 1
info: Rows matched: 2  Changed: 1  Warnings: 0
select * from t1;
+---+------+
| a | b    |
+---+------+
| 1 |    1 |
+---+------+
affected rows: 1
select * from t2;
+---+------+
| a | b    |
+---+------+
| 2 |    2 |
+---+------+
affected rows: 1
delete t1, t2 from t1, t2;
affected rows: 2
insert into t1 values(1, 1);
affected rows: 1
insert into t2 values(1, 1);
affected rows: 1
## test update change t1.b, not change t2.b
update t1, t2 set t1.b=2, t2.b=1 where t1.a=t2.a and t1.a=1;
affected rows: 1
info: Rows matched: 2  Changed: 1  Warnings: 0
select * from t1;
+---+------+
| a | b    |
+---+------+
| 1 |    2 |
+---+------+
affected rows: 1
select * from t2;
+---+------+
| a | b    |
+---+------+
| 1 |    1 |
+---+------+
affected rows: 1
update t1, t2 set t1.a=2, t2.a=1 where t1.a=t2.a and t1.a=1;
affected rows: 1
info: Rows matched: 2  Changed: 1  Warnings: 0
select * from t1;
+---+------+
| a | b    |
+---+------+
| 2 |    2 |
+---+------+
affected rows: 1
select * from t2;
+---+------+
| a | b    |
+---+------+
| 1 |    1 |
+---+------+
affected rows: 1
delete t1, t2 from t1, t2;
affected rows: 2
insert into t1 values(1, 1);
affected rows: 1
insert into t2 values(1, 1);
affected rows: 1
## test update change t1.b and t2.b
update t1, t2 set t1.b=2, t2.b=2 where t1.a=t2.a and t1.a=1;
affected rows: 2
info: Rows matched: 2  Changed: 2  Warnings: 0
select * from t1;
+---+------+
| a | b    |
+---+------+
| 1 |    2 |
+---+------+
affected rows: 1
select * from t2;
+---+------+
| a | b    |
+---+------+
| 1 |    2 |
+---+------+
affected rows: 1
delete t1, t2 from t1, t2;
affected rows: 2

create index i1 on t1(b);
affected rows: 0
create index i1 on t2(b);
affected rows: 0
insert into t1 values(1, 1);
affected rows: 1
## test update main table change t1.a across partition but t1.b does not
update t1 set a=a+1, b=b+1 where a=1;
affected rows: 1
info: Rows matched: 1  Changed: 1  Warnings: 0
select * from t1;
+---+------+
| a | b    |
+---+------+
| 2 |    2 |
+---+------+
affected rows: 1
insert into t2 select * from t1;
affected rows: 1
## test update t2 change across partition but t1 does not
update t1, t2 set t1.a=2, t2.a=3 where t1.a=2 and t1.a=t2.a;
affected rows: 1
info: Rows matched: 2  Changed: 1  Warnings: 0
select * from t1;
+---+------+
| a | b    |
+---+------+
| 2 |    2 |
+---+------+
affected rows: 1
select * from t2;
+---+------+
| a | b    |
+---+------+
| 3 |    2 |
+---+------+
affected rows: 1
drop table t1, t2;
affected rows: 0

create table t1(a int primary key, b int, c int, d timestamp(6) NULL DEFAULT CURRENT_TIMESTAMP(6) ON UPDATE CURRENT_TIMESTAMP(6)) partition by hash(a) partitions 2;
affected rows: 0
create index idx on t1(c, d) global;
affected rows: 0
insert into t1 values(1, 1, 1, now());
affected rows: 1
update t1 set b=2, c=1 where a=1;
affected rows: 1
info: Rows matched: 1  Changed: 1  Warnings: 0
select /*+index(t1 primary)*/ a, c, d from t1;
+---+------+----------------------------+
| a | c    | d                          |
+---+------+----------------------------+
| 1 |    1 | TIMESTAMP                  |
+---+------+----------------------------+
affected rows: 1
select /*+index(t1 idx)*/ a, c, d from t1;
+---+------+----------------------------+
| a | c    | d                          |
+---+------+----------------------------+
| 1 |    1 | TIMESTAMP                  |
+---+------+----------------------------+
affected rows: 1
update t1 set b=2, c=2 where a=1;
affected rows: 1
info: Rows matched: 1  Changed: 1  Warnings: 0
select /*+index(t1 primary)*/ a, c, d from t1;
+---+------+----------------------------+
| a | c    | d                          |
+---+------+----------------------------+
| 1 |    2 | TIMESTAMP                  |
+---+------+----------------------------+
affected rows: 1
select /*+index(t1 idx)*/ a, c, d from t1;
+---+------+----------------------------+
| a | c    | d                          |
+---+------+----------------------------+
| 1 |    2 | TIMESTAMP                  |
+---+------+----------------------------+
affected rows: 1
drop table t1;
affected rows: 0

DROP TABLE IF EXISTS t1, t2, t3;
affected rows: 0
CREATE TABLE t1 (a int not null,b int not null);
affected rows: 0
CREATE TABLE t2 (a int not null, b int not null, primary key (a,b));
affected rows: 0
CREATE TABLE t3 (a int not null, b int not null, primary key (a,b));
affected rows: 0
insert into t1 values (1,1),(2,1),(1,3);
affected rows: 3
info: Records: 3  Duplicates: 0  Warnings: 0
insert into t2 values (1,1),(2,2),(3,3);
affected rows: 3
info: Records: 3  Duplicates: 0  Warnings: 0
insert into t3 values (1,1),(2,1),(1,3);
affected rows: 3
info: Records: 3  Duplicates: 0  Warnings: 0
delete t2.*,t3.* from t1,t2,t3 where t1.a=t2.a AND t2.b=t3.a and t1.b=t3.b;
affected rows: 5
drop table t1, t2, t3;
affected rows: 0

create table t1(a int primary key, b int, c int, d int) partition by hash(a) partitions 2;
affected rows: 0
create index idx on t1(b, c) partition by hash(b) partitions 2;
affected rows: 0
insert into t1 values(1, 1, 1, 1), (2, 2, 2, 2), (3, 3, 3, 3), (4, 4, 4, 4);
affected rows: 4
info: Records: 4  Duplicates: 0  Warnings: 0
select /*+index(t1 primary)*/ * from t1;
+---+------+------+------+
| a | b    | c    | d    |
+---+------+------+------+
| 1 |    1 |    1 |    1 |
| 2 |    2 |    2 |    2 |
| 3 |    3 |    3 |    3 |
| 4 |    4 |    4 |    4 |
+---+------+------+------+
affected rows: 4
select /*+index(t1 idx)*/ a, b, c from t1;
+---+------+------+
| a | b    | c    |
+---+------+------+
| 1 |    1 |    1 |
| 2 |    2 |    2 |
| 3 |    3 |    3 |
| 4 |    4 |    4 |
+---+------+------+
affected rows: 4
## test primary index update the partition key, global index don't update the partition key
## when update row one by one, this case will throw error 1062
update t1 set a=a+1, c=c+1;
select /*+index(t1 primary)*/ * from t1;
+---+------+------+------+
| a | b    | c    | d    |
+---+------+------+------+
| 1 |    1 |    1 |    1 |
| 2 |    2 |    2 |    2 |
| 3 |    3 |    3 |    3 |
| 4 |    4 |    4 |    4 |
+---+------+------+------+
affected rows: 4
select /*+index(t1 idx)*/ a, b, c from t1;
+---+------+------+
| a | b    | c    |
+---+------+------+
| 1 |    1 |    1 |
| 2 |    2 |    2 |
| 3 |    3 |    3 |
| 4 |    4 |    4 |
+---+------+------+
affected rows: 4
## test primary index don't update part key, global index update part key
update t1 set b=b+1;
affected rows: 4
info: Rows matched: 4  Changed: 4  Warnings: 0
select /*+index(t1 primary)*/ * from t1;
+---+------+------+------+
| a | b    | c    | d    |
+---+------+------+------+
| 1 |    2 |    1 |    1 |
| 2 |    3 |    2 |    2 |
| 3 |    4 |    3 |    3 |
| 4 |    5 |    4 |    4 |
+---+------+------+------+
affected rows: 4
select /*+index(t1 idx)*/ a, b, c from t1;
+---+------+------+
| a | b    | c    |
+---+------+------+
| 1 |    2 |    1 |
| 2 |    3 |    2 |
| 3 |    4 |    3 |
| 4 |    5 |    4 |
+---+------+------+
affected rows: 4
## test primary index update across partitions, global index don't across partitions
## when update row one by one, this case will throw error 1062
update t1 set a=a+5, b=b+6 where a in (2, 4);
affected rows: 2
info: Rows matched: 2  Changed: 2  Warnings: 0
select /*+index(t1 primary)*/ * from t1;
+---+------+------+------+
| a | b    | c    | d    |
+---+------+------+------+
| 1 |    2 |    1 |    1 |
| 3 |    4 |    3 |    3 |
| 7 |    9 |    2 |    2 |
| 9 |   11 |    4 |    4 |
+---+------+------+------+
affected rows: 4
select /*+index(t1 idx)*/ a, b, c from t1;
+---+------+------+
| a | b    | c    |
+---+------+------+
| 1 |    2 |    1 |
| 3 |    4 |    3 |
| 7 |    9 |    2 |
| 9 |   11 |    4 |
+---+------+------+
affected rows: 4
## test primary index update don't across partitions, global index across partition
update t1 set a=a+6, b=b+5 where b in (8, 10);
affected rows: 0
info: Rows matched: 0  Changed: 0  Warnings: 0
select /*+index(t1 primary)*/ * from t1;
+---+------+------+------+
| a | b    | c    | d    |
+---+------+------+------+
| 1 |    2 |    1 |    1 |
| 3 |    4 |    3 |    3 |
| 7 |    9 |    2 |    2 |
| 9 |   11 |    4 |    4 |
+---+------+------+------+
affected rows: 4
select /*+index(t1 idx)*/ a, b, c from t1;
+---+------+------+
| a | b    | c    |
+---+------+------+
| 1 |    2 |    1 |
| 3 |    4 |    3 |
| 7 |    9 |    2 |
| 9 |   11 |    4 |
+---+------+------+
affected rows: 4
delete from t1;
affected rows: 4
insert into t1 values(1, 1, 1, 1), (2, 2, 2, 2), (3, 3, 3, 3), (4, 4, 4, 4);
affected rows: 4
info: Records: 4  Duplicates: 0  Warnings: 0
## test primary index row not changed
update t1 set b=a;
affected rows: 0
info: Rows matched: 4  Changed: 0  Warnings: 0
update t1 set a=b, b=a, c=d;
affected rows: 0
info: Rows matched: 4  Changed: 0  Warnings: 0
select /*+index(t1 primary)*/ * from t1;
+---+------+------+------+
| a | b    | c    | d    |
+---+------+------+------+
| 1 |    1 |    1 |    1 |
| 2 |    2 |    2 |    2 |
| 3 |    3 |    3 |    3 |
| 4 |    4 |    4 |    4 |
+---+------+------+------+
affected rows: 4
select /*+index(t1 idx)*/ a, b, c from t1;
+---+------+------+
| a | b    | c    |
+---+------+------+
| 1 |    1 |    1 |
| 2 |    2 |    2 |
| 3 |    3 |    3 |
| 4 |    4 |    4 |
+---+------+------+
affected rows: 4
drop table t1;
affected rows: 0

alter system set_tp tp_no = 302, error_code = 0, frequency = 1;
affected rows: 0
alter system set_tp tp_no = 304, error_code = 1, frequency = 1;
affected rows: 0
DROP TABLE IF EXISTS t1;
affected rows: 0
create table t1(a int primary key, b int) partition by hash(a) partitions 3;
affected rows: 0
insert into t1 values(1, 1), (2, 2);
affected rows: 2
info: Records: 2  Duplicates: 0  Warnings: 0
update t1 set b=b+1 where a>0;
affected rows: 2
info: Rows matched: 2  Changed: 2  Warnings: 0
select * from t1;
+---+------+
| a | b    |
+---+------+
| 1 |    2 |
| 2 |    3 |
+---+------+
affected rows: 2
drop table t1;
affected rows: 0

DROP TABLE IF EXISTS t1, t2;
affected rows: 0
create table t1(a int primary key, b int) partition by hash(a) partitions 2;
affected rows: 0
create table t2(a int primary key, b int) partition by hash(a) partitions 2;
affected rows: 0
insert into t1 values(1, 1);
affected rows: 1
insert into t2 values(1, 1);
affected rows: 1
## test update change t2.b, not change t1.b
update t1, t2 set t1.b=1, t2.b=2 where t1.a=t2.a and t1.a=1;
affected rows: 1
info: Rows matched: 2  Changed: 1  Warnings: 0
select * from t1;
+---+------+
| a | b    |
+---+------+
| 1 |    1 |
+---+------+
affected rows: 1
select * from t2;
+---+------+
| a | b    |
+---+------+
| 1 |    2 |
+---+------+
affected rows: 1
update t1, t2 set t1.a=1, t2.a=2 where t1.a=t2.a and t1.a=1;
affected rows: 1
info: Rows matched: 2  Changed: 1  Warnings: 0
select * from t1;
+---+------+
| a | b    |
+---+------+
| 1 |    1 |
+---+------+
affected rows: 1
select * from t2;
+---+------+
| a | b    |
+---+------+
| 2 |    2 |
+---+------+
affected rows: 1
delete t1, t2 from t1, t2;
affected rows: 2
insert into t1 values(1, 1);
affected rows: 1
insert into t2 values(1, 1);
affected rows: 1
## test update change t1.b, not change t2.b
update t1, t2 set t1.b=2, t2.b=1 where t1.a=t2.a and t1.a=1;
affected rows: 1
info: Rows matched: 2  Changed: 1  Warnings: 0
select * from t1;
+---+------+
| a | b    |
+---+------+
| 1 |    2 |
+---+------+
affected rows: 1
select * from t2;
+---+------+
| a | b    |
+---+------+
| 1 |    1 |
+---+------+
affected rows: 1
update t1, t2 set t1.a=2, t2.a=1 where t1.a=t2.a and t1.a=1;
affected rows: 1
info: Rows matched: 2  Changed: 1  Warnings: 0
select * from t1;
+---+------+
| a | b    |
+---+------+
| 2 |    2 |
+---+------+
affected rows: 1
select * from t2;
+---+------+
| a | b    |
+---+------+
| 1 |    1 |
+---+------+
affected rows: 1
delete t1, t2 from t1, t2;
affected rows: 2
insert into t1 values(1, 1);
affected rows: 1
insert into t2 values(1, 1);
affected rows: 1
## test update change t1.b and t2.b
update t1, t2 set t1.b=2, t2.b=2 where t1.a=t2.a and t1.a=1;
affected rows: 2
info: Rows matched: 2  Changed: 2  Warnings: 0
select * from t1;
+---+------+
| a | b    |
+---+------+
| 1 |    2 |
+---+------+
affected rows: 1
select * from t2;
+---+------+
| a | b    |
+---+------+
| 1 |    2 |
+---+------+
affected rows: 1
delete t1, t2 from t1, t2;
affected rows: 2

create index i1 on t1(b);
affected rows: 0
create index i1 on t2(b);
affected rows: 0
insert into t1 values(1, 1);
affected rows: 1
## test update main table change t1.a across partition but t1.b does not
update t1 set a=a+1, b=b+1 where a=1;
affected rows: 1
info: Rows matched: 1  Changed: 1  Warnings: 0
select * from t1;
+---+------+
| a | b    |
+---+------+
| 2 |    2 |
+---+------+
affected rows: 1
insert into t2 select * from t1;
affected rows: 1
## test update t2 change across partition but t1 does not
update t1, t2 set t1.a=2, t2.a=3 where t1.a=2 and t1.a=t2.a;
affected rows: 1
info: Rows matched: 2  Changed: 1  Warnings: 0
select * from t1;
+---+------+
| a | b    |
+---+------+
| 2 |    2 |
+---+------+
affected rows: 1
select * from t2;
+---+------+
| a | b    |
+---+------+
| 3 |    2 |
+---+------+
affected rows: 1
drop table t1, t2;
affected rows: 0

create table t1(a int primary key, b int, c int, d timestamp(6) NULL DEFAULT CURRENT_TIMESTAMP(6) ON UPDATE CURRENT_TIMESTAMP(6)) partition by hash(a) partitions 2;
affected rows: 0
create index idx on t1(c, d) global;
affected rows: 0
insert into t1 values(1, 1, 1, now());
affected rows: 1
update t1 set b=2, c=1 where a=1;
affected rows: 1
info: Rows matched: 1  Changed: 1  Warnings: 0
select /*+index(t1 primary)*/ a, c, d from t1;
+---+------+----------------------------+
| a | c    | d                          |
+---+------+----------------------------+
| 1 |    1 | TIMESTAMP                  |
+---+------+----------------------------+
affected rows: 1
select /*+index(t1 idx)*/ a, c, d from t1;
+---+------+----------------------------+
| a | c    | d                          |
+---+------+----------------------------+
| 1 |    1 | TIMESTAMP                  |
+---+------+----------------------------+
affected rows: 1
update t1 set b=2, c=2 where a=1;
affected rows: 1
info: Rows matched: 1  Changed: 1  Warnings: 0
select /*+index(t1 primary)*/ a, c, d from t1;
+---+------+----------------------------+
| a | c    | d                          |
+---+------+----------------------------+
| 1 |    2 | TIMESTAMP                  |
+---+------+----------------------------+
affected rows: 1
select /*+index(t1 idx)*/ a, c, d from t1;
+---+------+----------------------------+
| a | c    | d                          |
+---+------+----------------------------+
| 1 |    2 | TIMESTAMP                  |
+---+------+----------------------------+
affected rows: 1
drop table t1;
affected rows: 0

DROP TABLE IF EXISTS t1, t2, t3;
affected rows: 0
CREATE TABLE t1 (a int not null,b int not null);
affected rows: 0
CREATE TABLE t2 (a int not null, b int not null, primary key (a,b));
affected rows: 0
CREATE TABLE t3 (a int not null, b int not null, primary key (a,b));
affected rows: 0
insert into t1 values (1,1),(2,1),(1,3);
affected rows: 3
info: Records: 3  Duplicates: 0  Warnings: 0
insert into t2 values (1,1),(2,2),(3,3);
affected rows: 3
info: Records: 3  Duplicates: 0  Warnings: 0
insert into t3 values (1,1),(2,1),(1,3);
affected rows: 3
info: Records: 3  Duplicates: 0  Warnings: 0
delete t2.*,t3.* from t1,t2,t3 where t1.a=t2.a AND t2.b=t3.a and t1.b=t3.b;
affected rows: 5
drop table t1, t2, t3;
affected rows: 0

create table t1(a int primary key, b int, c int, d int) partition by hash(a) partitions 2;
affected rows: 0
create index idx on t1(b, c) partition by hash(b) partitions 2;
affected rows: 0
insert into t1 values(1, 1, 1, 1), (2, 2, 2, 2), (3, 3, 3, 3), (4, 4, 4, 4);
affected rows: 4
info: Records: 4  Duplicates: 0  Warnings: 0
select /*+index(t1 primary)*/ * from t1;
+---+------+------+------+
| a | b    | c    | d    |
+---+------+------+------+
| 1 |    1 |    1 |    1 |
| 2 |    2 |    2 |    2 |
| 3 |    3 |    3 |    3 |
| 4 |    4 |    4 |    4 |
+---+------+------+------+
affected rows: 4
select /*+index(t1 idx)*/ a, b, c from t1;
+---+------+------+
| a | b    | c    |
+---+------+------+
| 1 |    1 |    1 |
| 2 |    2 |    2 |
| 3 |    3 |    3 |
| 4 |    4 |    4 |
+---+------+------+
affected rows: 4
## test primary index update the partition key, global index don't update the partition key
## when update row one by one, this case will throw error 1062
update t1 set a=a+1, c=c+1;
affected rows: 4
info: Rows matched: 4  Changed: 4  Warnings: 0
select /*+index(t1 primary)*/ * from t1;
+---+------+------+------+
| a | b    | c    | d    |
+---+------+------+------+
| 2 |    1 |    2 |    1 |
| 3 |    2 |    3 |    2 |
| 4 |    3 |    4 |    3 |
| 5 |    4 |    5 |    4 |
+---+------+------+------+
affected rows: 4
select /*+index(t1 idx)*/ a, b, c from t1;
+---+------+------+
| a | b    | c    |
+---+------+------+
| 2 |    1 |    2 |
| 3 |    2 |    3 |
| 4 |    3 |    4 |
| 5 |    4 |    5 |
+---+------+------+
affected rows: 4
## test primary index don't update part key, global index update part key
update t1 set b=b+1;
affected rows: 4
info: Rows matched: 4  Changed: 4  Warnings: 0
select /*+index(t1 primary)*/ * from t1;
+---+------+------+------+
| a | b    | c    | d    |
+---+------+------+------+
| 2 |    2 |    2 |    1 |
| 3 |    3 |    3 |    2 |
| 4 |    4 |    4 |    3 |
| 5 |    5 |    5 |    4 |
+---+------+------+------+
affected rows: 4
select /*+index(t1 idx)*/ a, b, c from t1;
+---+------+------+
| a | b    | c    |
+---+------+------+
| 2 |    2 |    2 |
| 3 |    3 |    3 |
| 4 |    4 |    4 |
| 5 |    5 |    5 |
+---+------+------+
affected rows: 4
## test primary index update across partitions, global index don't across partitions
## when update row one by one, this case will throw error 1062
update t1 set a=a+5, b=b+6 where a in (2, 4);
affected rows: 2
info: Rows matched: 2  Changed: 2  Warnings: 0
select /*+index(t1 primary)*/ * from t1;
+---+------+------+------+
| a | b    | c    | d    |
+---+------+------+------+
| 3 |    3 |    3 |    2 |
| 5 |    5 |    5 |    4 |
| 7 |    8 |    2 |    1 |
| 9 |   10 |    4 |    3 |
+---+------+------+------+
affected rows: 4
select /*+index(t1 idx)*/ a, b, c from t1;
+---+------+------+
| a | b    | c    |
+---+------+------+
| 3 |    3 |    3 |
| 5 |    5 |    5 |
| 7 |    8 |    2 |
| 9 |   10 |    4 |
+---+------+------+
affected rows: 4
## test primary index update don't across partitions, global index across partition
update t1 set a=a+6, b=b+5 where b in (8, 10);
affected rows: 2
info: Rows matched: 2  Changed: 2  Warnings: 0
select /*+index(t1 primary)*/ * from t1;
+----+------+------+------+
| a  | b    | c    | d    |
+----+------+------+------+
|  3 |    3 |    3 |    2 |
|  5 |    5 |    5 |    4 |
| 13 |   13 |    2 |    1 |
| 15 |   15 |    4 |    3 |
+----+------+------+------+
affected rows: 4
select /*+index(t1 idx)*/ a, b, c from t1;
+----+------+------+
| a  | b    | c    |
+----+------+------+
|  3 |    3 |    3 |
|  5 |    5 |    5 |
| 13 |   13 |    2 |
| 15 |   15 |    4 |
+----+------+------+
affected rows: 4
delete from t1;
affected rows: 4
insert into t1 values(1, 1, 1, 1), (2, 2, 2, 2), (3, 3, 3, 3), (4, 4, 4, 4);
affected rows: 4
info: Records: 4  Duplicates: 0  Warnings: 0
## test primary index row not changed
update t1 set b=a;
affected rows: 0
info: Rows matched: 4  Changed: 0  Warnings: 0
update t1 set a=b, b=a, c=d;
affected rows: 0
info: Rows matched: 4  Changed: 0  Warnings: 0
select /*+index(t1 primary)*/ * from t1;
+---+------+------+------+
| a | b    | c    | d    |
+---+------+------+------+
| 1 |    1 |    1 |    1 |
| 2 |    2 |    2 |    2 |
| 3 |    3 |    3 |    3 |
| 4 |    4 |    4 |    4 |
+---+------+------+------+
affected rows: 4
select /*+index(t1 idx)*/ a, b, c from t1;
+---+------+------+
| a | b    | c    |
+---+------+------+
| 1 |    1 |    1 |
| 2 |    2 |    2 |
| 3 |    3 |    3 |
| 4 |    4 |    4 |
+---+------+------+
affected rows: 4
drop table t1;
affected rows: 0

alter system set_tp tp_no = 302, error_code = 0, frequency = 1;
affected rows: 0
alter system set_tp tp_no = 304, error_code = 0, frequency = 1;
affected rows: 0
