drop table if exists thezj;
drop table if exists t1;
show variables like 'auto_increment_%';
Variable_name	Value
auto_increment_cache_size	1000000
auto_increment_increment	1
auto_increment_offset	1
"Test alter command to reduce auto_increment"
"basic"
create table t1 (c1 bigint auto_increment primary key);
insert into t1 values (), (), (), ();
show create table t1;
Table	Create Table
t1	CREATE TABLE `t1` (
  `c1` bigint(20) NOT NULL AUTO_INCREMENT,
  PRIMARY KEY (`c1`)
) ORGANIZATION INDEX AUTO_INCREMENT = 5 AUTO_INCREMENT_MODE = 'ORDER' DEFAULT CHARSET = utf8mb4 ROW_FORMAT = DYNAMIC COMPRESSION = 'zstd_1.3.8' REPLICA_NUM = 1 BLOCK_SIZE = 16384 USE_BLOOM_FILTER = FALSE ENABLE_MACRO_BLOCK_BLOOM_FILTER = FALSE TABLET_SIZE = 134217728 PCTFREE = 0
delete from t1;
alter table t1 set auto_increment = 1;
show create table t1;
Table	Create Table
t1	CREATE TABLE `t1` (
  `c1` bigint(20) NOT NULL AUTO_INCREMENT,
  PRIMARY KEY (`c1`)
) ORGANIZATION INDEX AUTO_INCREMENT = 1 AUTO_INCREMENT_MODE = 'ORDER' DEFAULT CHARSET = utf8mb4 ROW_FORMAT = DYNAMIC COMPRESSION = 'zstd_1.3.8' REPLICA_NUM = 1 BLOCK_SIZE = 16384 USE_BLOOM_FILTER = FALSE ENABLE_MACRO_BLOCK_BLOOM_FILTER = FALSE TABLET_SIZE = 134217728 PCTFREE = 0
insert into t1 values (), (), (), ();
select * from t1;
c1
1
2
3
4
drop table t1;
create table t1 (c1 bigint auto_increment);
insert into t1 values (), (), (), ();
insert into t1 values (100);
show create table t1;
Table	Create Table
t1	CREATE TABLE `t1` (
  `c1` bigint(20) NOT NULL AUTO_INCREMENT
) ORGANIZATION INDEX AUTO_INCREMENT = 101 AUTO_INCREMENT_MODE = 'ORDER' DEFAULT CHARSET = utf8mb4 ROW_FORMAT = DYNAMIC COMPRESSION = 'zstd_1.3.8' REPLICA_NUM = 1 BLOCK_SIZE = 16384 USE_BLOOM_FILTER = FALSE ENABLE_MACRO_BLOCK_BLOOM_FILTER = FALSE TABLET_SIZE = 134217728 PCTFREE = 0
alter table t1 set auto_increment = 200;
show create table t1;
Table	Create Table
t1	CREATE TABLE `t1` (
  `c1` bigint(20) NOT NULL AUTO_INCREMENT
) ORGANIZATION INDEX AUTO_INCREMENT = 200 AUTO_INCREMENT_MODE = 'ORDER' DEFAULT CHARSET = utf8mb4 ROW_FORMAT = DYNAMIC COMPRESSION = 'zstd_1.3.8' REPLICA_NUM = 1 BLOCK_SIZE = 16384 USE_BLOOM_FILTER = FALSE ENABLE_MACRO_BLOCK_BLOOM_FILTER = FALSE TABLET_SIZE = 134217728 PCTFREE = 0
insert into t1 values ();
select * from t1;
c1
1
2
3
4
100
200
delete from t1 where c1 >= 100;
alter table t1 set auto_increment = 50;
show create table t1;
Table	Create Table
t1	CREATE TABLE `t1` (
  `c1` bigint(20) NOT NULL AUTO_INCREMENT
) ORGANIZATION INDEX AUTO_INCREMENT = 50 AUTO_INCREMENT_MODE = 'ORDER' DEFAULT CHARSET = utf8mb4 ROW_FORMAT = DYNAMIC COMPRESSION = 'zstd_1.3.8' REPLICA_NUM = 1 BLOCK_SIZE = 16384 USE_BLOOM_FILTER = FALSE ENABLE_MACRO_BLOCK_BLOOM_FILTER = FALSE TABLET_SIZE = 134217728 PCTFREE = 0
alter table t1 set auto_increment = 2;
show create table t1;
Table	Create Table
t1	CREATE TABLE `t1` (
  `c1` bigint(20) NOT NULL AUTO_INCREMENT
) ORGANIZATION INDEX AUTO_INCREMENT = 5 AUTO_INCREMENT_MODE = 'ORDER' DEFAULT CHARSET = utf8mb4 ROW_FORMAT = DYNAMIC COMPRESSION = 'zstd_1.3.8' REPLICA_NUM = 1 BLOCK_SIZE = 16384 USE_BLOOM_FILTER = FALSE ENABLE_MACRO_BLOCK_BLOOM_FILTER = FALSE TABLET_SIZE = 134217728 PCTFREE = 0
insert into t1 values ();
select * from t1;
c1
1
2
3
4
5
drop table t1;
"unsigned types"
create table t1 (c1 bigint unsigned auto_increment);
insert into t1 values (18446744073709551615);
show create table t1;
Table	Create Table
t1	CREATE TABLE `t1` (
  `c1` bigint(20) unsigned NOT NULL AUTO_INCREMENT
) ORGANIZATION INDEX AUTO_INCREMENT = 18446744073709551615 AUTO_INCREMENT_MODE = 'ORDER' DEFAULT CHARSET = utf8mb4 ROW_FORMAT = DYNAMIC COMPRESSION = 'zstd_1.3.8' REPLICA_NUM = 1 BLOCK_SIZE = 16384 USE_BLOOM_FILTER = FALSE ENABLE_MACRO_BLOCK_BLOOM_FILTER = FALSE TABLET_SIZE = 134217728 PCTFREE = 0
insert into t1 values ();
ERROR HY000: Failed to read auto-increment value from storage engine
select * from t1;
c1
18446744073709551615
alter table t1 set auto_increment = 2;
show create table t1;
Table	Create Table
t1	CREATE TABLE `t1` (
  `c1` bigint(20) unsigned NOT NULL AUTO_INCREMENT
) ORGANIZATION INDEX AUTO_INCREMENT = 18446744073709551615 AUTO_INCREMENT_MODE = 'ORDER' DEFAULT CHARSET = utf8mb4 ROW_FORMAT = DYNAMIC COMPRESSION = 'zstd_1.3.8' REPLICA_NUM = 1 BLOCK_SIZE = 16384 USE_BLOOM_FILTER = FALSE ENABLE_MACRO_BLOCK_BLOOM_FILTER = FALSE TABLET_SIZE = 134217728 PCTFREE = 0
insert into t1 values ();
ERROR HY000: Failed to read auto-increment value from storage engine
select * from t1;
c1
18446744073709551615
drop table t1;
"signed type with negative value"
create table t1 (c1 bigint auto_increment);
insert into t1 values (-1000);
insert into t1 values (-100);
alter table t1 set auto_increment = 1;
show create table t1;
Table	Create Table
t1	CREATE TABLE `t1` (
  `c1` bigint(20) NOT NULL AUTO_INCREMENT
) ORGANIZATION INDEX AUTO_INCREMENT = 1 AUTO_INCREMENT_MODE = 'ORDER' DEFAULT CHARSET = utf8mb4 ROW_FORMAT = DYNAMIC COMPRESSION = 'zstd_1.3.8' REPLICA_NUM = 1 BLOCK_SIZE = 16384 USE_BLOOM_FILTER = FALSE ENABLE_MACRO_BLOCK_BLOOM_FILTER = FALSE TABLET_SIZE = 134217728 PCTFREE = 0
insert into t1 values ();
drop table t1;
"noorder mode"
create table t1 (c1 bigint auto_increment primary key) auto_increment_mode = 'NOORDER';
insert into t1 values (), (), (), ();
show create table t1;
Table	Create Table
t1	CREATE TABLE `t1` (
  `c1` bigint(20) NOT NULL AUTO_INCREMENT,
  PRIMARY KEY (`c1`)
) ORGANIZATION INDEX AUTO_INCREMENT = 1000001 AUTO_INCREMENT_MODE = 'NOORDER' DEFAULT CHARSET = utf8mb4 ROW_FORMAT = DYNAMIC COMPRESSION = 'zstd_1.3.8' REPLICA_NUM = 1 BLOCK_SIZE = 16384 USE_BLOOM_FILTER = FALSE ENABLE_MACRO_BLOCK_BLOOM_FILTER = FALSE TABLET_SIZE = 134217728 PCTFREE = 0
delete from t1;
alter table t1 set auto_increment = 1;
show create table t1;
Table	Create Table
t1	CREATE TABLE `t1` (
  `c1` bigint(20) NOT NULL AUTO_INCREMENT,
  PRIMARY KEY (`c1`)
) ORGANIZATION INDEX AUTO_INCREMENT = 1 AUTO_INCREMENT_MODE = 'NOORDER' DEFAULT CHARSET = utf8mb4 ROW_FORMAT = DYNAMIC COMPRESSION = 'zstd_1.3.8' REPLICA_NUM = 1 BLOCK_SIZE = 16384 USE_BLOOM_FILTER = FALSE ENABLE_MACRO_BLOCK_BLOOM_FILTER = FALSE TABLET_SIZE = 134217728 PCTFREE = 0
insert into t1 values (), (), (), ();
select * from t1;
c1
1
2
3
4
drop table t1;
