>> alter existing column
drop table if exists t1;
create table t1 (a int , b varchar(20));
alter table t1 modify a int auto_increment;
show create table t1;
Table	Create Table
t1	CREATE TABLE `t1` (
  `a` int(11) NOT NULL AUTO_INCREMENT,
  `b` varchar(20) DEFAULT NULL
) ORGANIZATION INDEX AUTO_INCREMENT = 1 AUTO_INCREMENT_MODE = 'ORDER' DEFAULT CHARSET = utf8mb4 COMPRESSION = 'lz4_1.0' REPLICA_NUM = NUM BLOCK_SIZE = SIZE USE_BLOOM_FILTER = FALSE ENABLE_MACRO_BLOCK_BLOOM_FILTER = FALSE TABLET_SIZE = SIZE PCTFREE = 10
insert into t1 values(null,'');
select * from t1;
a	b
1	
alter table t1 modify a int;
show create table t1;
Table	Create Table
t1	CREATE TABLE `t1` (
  `a` int(11) DEFAULT NULL,
  `b` varchar(20) DEFAULT NULL
) ORGANIZATION INDEX DEFAULT CHARSET = utf8mb4 COMPRESSION = 'lz4_1.0' REPLICA_NUM = NUM BLOCK_SIZE = SIZE USE_BLOOM_FILTER = FALSE ENABLE_MACRO_BLOCK_BLOOM_FILTER = FALSE TABLET_SIZE = SIZE PCTFREE = 10
insert into t1 values(null,'');
select * from t1;
a	b
1	
NULL	
>> add new table with auto_increment
drop table if exists t1;
create table t1(b varchar(20));
show create table t1;
Table	Create Table
t1	CREATE TABLE `t1` (
  `b` varchar(20) DEFAULT NULL
) ORGANIZATION INDEX DEFAULT CHARSET = utf8mb4 COMPRESSION = 'lz4_1.0' REPLICA_NUM = NUM BLOCK_SIZE = SIZE USE_BLOOM_FILTER = FALSE ENABLE_MACRO_BLOCK_BLOOM_FILTER = FALSE TABLET_SIZE = SIZE PCTFREE = 10
insert into t1 values('');
select * from t1;
b

alter table t1 add a int auto_increment;
show create table t1;
Table	Create Table
t1	CREATE TABLE `t1` (
  `b` varchar(20) DEFAULT NULL,
  `a` int(11) NOT NULL AUTO_INCREMENT
) ORGANIZATION INDEX AUTO_INCREMENT = 2 AUTO_INCREMENT_MODE = 'ORDER' DEFAULT CHARSET = utf8mb4 COMPRESSION = 'lz4_1.0' REPLICA_NUM = NUM BLOCK_SIZE = SIZE USE_BLOOM_FILTER = FALSE ENABLE_MACRO_BLOCK_BLOOM_FILTER = FALSE TABLET_SIZE = SIZE PCTFREE = 10
insert into t1 values('',null);
select * from t1;
b	a
	1
	2
alter table t1 set auto_increment = 10240000;
delete from t1;
show create table t1;
Table	Create Table
t1	CREATE TABLE `t1` (
  `b` varchar(20) DEFAULT NULL,
  `a` int(11) NOT NULL AUTO_INCREMENT
) ORGANIZATION INDEX AUTO_INCREMENT = 10240000 AUTO_INCREMENT_MODE = 'ORDER' DEFAULT CHARSET = utf8mb4 ROW_FORMAT = DYNAMIC COMPRESSION = 'zstd_1.3.8' REPLICA_NUM = 1 BLOCK_SIZE = 16384 USE_BLOOM_FILTER = FALSE ENABLE_MACRO_BLOCK_BLOOM_FILTER = FALSE TABLET_SIZE = 134217728 PCTFREE = 0
insert into t1 values('',null);
select * from t1;
b	a
	10240000
alter table t1 set auto_increment = 1024000000;
show create table t1;
Table	Create Table
t1	CREATE TABLE `t1` (
  `b` varchar(20) DEFAULT NULL,
  `a` int(11) NOT NULL AUTO_INCREMENT
) ORGANIZATION INDEX AUTO_INCREMENT = 1024000000 AUTO_INCREMENT_MODE = 'ORDER' DEFAULT CHARSET = utf8mb4 ROW_FORMAT = DYNAMIC COMPRESSION = 'zstd_1.3.8' REPLICA_NUM = 1 BLOCK_SIZE = 16384 USE_BLOOM_FILTER = FALSE ENABLE_MACRO_BLOCK_BLOOM_FILTER = FALSE TABLET_SIZE = 134217728 PCTFREE = 0
alter table t1 set auto_increment = 1024;
show create table t1;
Table	Create Table
t1	CREATE TABLE `t1` (
  `b` varchar(20) DEFAULT NULL,
  `a` int(11) NOT NULL AUTO_INCREMENT
) ORGANIZATION INDEX AUTO_INCREMENT = 10240001 AUTO_INCREMENT_MODE = 'ORDER' DEFAULT CHARSET = utf8mb4 ROW_FORMAT = DYNAMIC COMPRESSION = 'zstd_1.3.8' REPLICA_NUM = 1 BLOCK_SIZE = 16384 USE_BLOOM_FILTER = FALSE ENABLE_MACRO_BLOCK_BLOOM_FILTER = FALSE TABLET_SIZE = 134217728 PCTFREE = 0
