>>dml + null
drop table if exists t1;
create table t1 (a int primary key auto_increment, b varchar(20));
insert into t1 values(null,'1_null'),(null,'2_null'),(null,'3_null'),(null,'4_null');
insert into t1(b) values('5_no'),('6_no'),('7_no'),('8_no');
replace into t1 values(null,'9_null'),(null,'10_null'),(null,'11_null'),(null,'12_null');
replace into t1(b) values('13_no'),('14_no'),('15_no'),('16_no');
select * from t1;
a	b
1	1_null
2	2_null
3	3_null
4	4_null
5	5_no
6	6_no
7	7_no
8	8_no
9	9_null
10	10_null
11	11_null
12	12_null
13	13_no
14	14_no
15	15_no
16	16_no
update t1 set a=a+100 where a=10;
insert into t1 values(null,'17_insert');
select * from t1 where b='17_insert';
a	b
17	17_insert
delete from t1 where a=3;
insert into t1 values(null,'18_insert');
select * from t1 where b='18_insert';
a	b
18	18_insert
>>dml + 0
drop table if exists t1;
create table t1 (a int primary key auto_increment, b varchar(20));
insert into t1 values(0,'1_0'),(0,'2_0'),(0,'3_0'),(0,'4_0');
insert into t1(b) values('5_no'),('6_no'),('7_no'),('8_no');
replace into t1 values(0,'9_0'),(0,'10_0'),(0,'11_0'),(0,'12_0');
replace into t1(b) values('13_no'),('14_no'),('15_no'),('16_no');
select * from t1;
a	b
1	1_0
2	2_0
3	3_0
4	4_0
5	5_no
6	6_no
7	7_no
8	8_no
9	9_0
10	10_0
11	11_0
12	12_0
13	13_no
14	14_no
15	15_no
16	16_no
update t1 set a=a+100 where a=10;
insert into t1 values(0,'17_insert');
select * from t1 where b='17_insert';
a	b
17	17_insert
delete from t1 where a=3;
insert into t1 values(0,'18_insert');
select * from t1 where b='18_insert';
a	b
18	18_insert
>>update will not update auto_increment, may introduce duplicate key
insert into t1 values(110,'');
ERROR 23000: Duplicate entry '110' for key 'PRIMARY'
>> There can be duplidate value in auto_increment field when this field is not in primary key or unique index
drop table if exists t1;
create table t1 (a int auto_increment, b varchar(20));
insert into t1 values(1,1),(1,1);
select * from t1;
a	b
1	1
1	1
>> The influence of sql mode and ignore.
drop table if exists t1;
create table t1 (a int primary key auto_increment, b int) auto_increment = 1000;
delete from t1;
set sql_mode='STRICT_TRANS_TABLES';
insert into t1 values ('abc', 1), (null, 2), (0, 3);
ERROR HY000: Incorrect integer value for column 'a' at row 1
select * from t1 order by b;
a	b
delete from t1;
set sql_mode='STRICT_TRANS_TABLES';
insert ignore into t1 values ('abc', 1), (null, 2), (0, 3);
select * from t1 order by b;
a	b
1000	1
1001	2
1002	3
DROP TABLE if exists `cool_deal`;
CREATE TABLE `cool_deal` (
`deal_id` int(11) NOT NULL AUTO_INCREMENT COMMENT '交易流水ID',
`cash_fee` decimal(10,2) NOT NULL COMMENT '实际支付',
PRIMARY KEY (`deal_id`)
) AUTO_INCREMENT = 8178461;
delete from cool_deal;
set sql_mode='strict_all_tables';
INSERT INTO cool_deal (deal_id,cash_fee) values('',10);
ERROR HY000: Incorrect integer value for column 'deal_id' at row 1
INSERT INTO cool_deal (deal_id,cash_fee) values('',20),(null,30),(NULL,40),(' ',50),('\t',60),('\n',70);
ERROR HY000: Incorrect integer value for column 'deal_id' at row 1
select * from cool_deal order by cash_fee;
deal_id	cash_fee
delete from cool_deal;
set sql_mode='strict_all_tables';
INSERT IGNORE INTO cool_deal (deal_id,cash_fee) values('',10);
INSERT IGNORE INTO cool_deal (deal_id,cash_fee) values('',20),(null,30),(NULL,40),(' ',50),('\t',60),('\n',70);
select * from cool_deal order by cash_fee;
deal_id	cash_fee
8178461	10.00
8178462	20.00
8178463	30.00
8178464	40.00
8178465	50.00
8178466	60.00
8178467	70.00
drop table if exists t1;
drop table if exists cool_deal;
