drop table if exists t1;
create table t1 (a int primary key auto_increment, b varchar(20));
>> insert/replace should change last_insert_id()
insert into t1 values(0,''),(0,''),(null,''),(null,'');
select last_insert_id();
last_insert_id()
1
select `auto_increment` from information_schema.tables where table_schema='test' and table_name='t1';
auto_increment
NULL
insert into t1 values(-1,'');
select last_insert_id();
last_insert_id()
1
select `auto_increment` from information_schema.tables where table_schema='test' and table_name='t1';
auto_increment
NULL
insert into t1 values(10,'');
select last_insert_id();
last_insert_id()
1
select `auto_increment` from information_schema.tables where table_schema='test' and table_name='t1';
auto_increment
NULL
replace into t1 values(0,''),(0,''),(null,''),(null,'');
select last_insert_id();
last_insert_id()
11
select `auto_increment` from information_schema.tables where table_schema='test' and table_name='t1';
auto_increment
NULL
>> update doesn't change last_insert_id()
update t1 set a=16 where a=1;
select last_insert_id();
last_insert_id()
11
select `auto_increment` from information_schema.tables where table_schema='test' and table_name='t1';
auto_increment
NULL
insert into t1 values(null,'');
select last_insert_id();
last_insert_id()
15
>> delete doesn't change last_insert_id()
insert into t1 values(30,'');
select last_insert_id();
last_insert_id()
15
insert into t1 values(null,''),(null,'');
select last_insert_id();
last_insert_id()
31
select `auto_increment` from information_schema.tables where table_schema='test' and table_name='t1';
auto_increment
NULL
delete from t1 where a=32;
select last_insert_id();
last_insert_id()
31
select `auto_increment` from information_schema.tables where table_schema='test' and table_name='t1';
auto_increment
NULL
>> last_insert_id() returns undef if the last stmt fails
insert into t1 values(30,'');
ERROR 23000: Duplicate entry '30' for key 'PRIMARY'
select last_insert_id();
last_insert_id()
31
>> last_insert_id() returns undef after rollback
set autocommit=0;
begin;
insert into t1 values(null,'');
rollback;
select last_insert_id();
last_insert_id()
33
>> auto_increment is reset to 1 after delete and define the new table
drop table t1;
create table t1 (a int primary key auto_increment, b varchar(20));
select `auto_increment` from information_schema.tables where table_schema='test' and table_name='t1';
auto_increment
NULL
select last_insert_id();
last_insert_id()
33
>> auto_increment should be reset to 1 after drop and add of the auto_increment field
drop table t1;
create table t1 (a int auto_increment, b int, primary key(b), unique index(a));
insert into t1 values(0,1),(0,2);
select `auto_increment` from information_schema.tables where table_schema='test' and table_name='t1';
auto_increment
NULL
select last_insert_id();
last_insert_id()
1
>> auto_increment should be null if auto_increment field is modified to not auto_increment
drop table t1;
create table t1 (a int auto_increment, b int, primary key(b), unique index(a));
select `auto_increment` from information_schema.tables where table_schema='test' and table_name='t1';
auto_increment
NULL
select last_insert_id();
last_insert_id()
1
alter table t1 modify a int;
select `auto_increment` from information_schema.tables where table_schema='test' and table_name='t1';
auto_increment
NULL
select last_insert_id();
last_insert_id()
1
>> auto_increment remains not changed if remove auto_increment and then add auto_increment on the same field
drop table t1;
create table t1 (a int auto_increment, b int, primary key(b));
select `auto_increment` from information_schema.tables where table_schema='test' and table_name='t1';
auto_increment
NULL
select last_insert_id();
last_insert_id()
1
insert into t1 values(0,1),(0,2);
select `auto_increment` from information_schema.tables where table_schema='test' and table_name='t1';
auto_increment
NULL
select last_insert_id();
last_insert_id()
1
alter table t1 modify a int;
alter table t1 modify a int auto_increment;
select `auto_increment` from information_schema.tables where table_schema='test' and table_name='t1';
auto_increment
NULL
select last_insert_id();
last_insert_id()
1
>> add a new auto_increment field, check the old data
drop table t1;
create table t1 (a int primary key);
insert into t1 values(1),(2),(3);
select * from t1;
a
1
2
3
alter table t1 add column b int auto_increment;
insert into t1 values(4,null),(5,null);
select * from t1;
a	b
1	1
2	2
3	3
4	4
5	5
drop table t1;
create table t1 (a int primary key);
insert into t1 values(1),(2),(3);
select * from t1;
a
1
2
3
alter table t1 add column b int auto_increment;
insert into t1 values(4,null),(5,null);
select * from t1;
a	b
1	1
2	2
3	3
4	4
5	5
>> test auto_increment value after manual update (not automatic)
drop table t1;
create table t1 (a int auto_increment primary key, b varchar(20));
insert into t1 values(0,''),(0,''),(0,''),(0,'');
select `auto_increment` from information_schema.tables where table_schema='test' and table_name='t1';
auto_increment
NULL
select last_insert_id();
last_insert_id()
1
insert into t1 values(-1,'');
select `auto_increment` from information_schema.tables where table_schema='test' and table_name='t1';
auto_increment
NULL
select last_insert_id();
last_insert_id()
1
replace into t1 values(-2,'');
select `auto_increment` from information_schema.tables where table_schema='test' and table_name='t1';
auto_increment
NULL
select last_insert_id();
last_insert_id()
1
insert into t1 values(10,'');
select `auto_increment` from information_schema.tables where table_schema='test' and table_name='t1';
auto_increment
NULL
select last_insert_id();
last_insert_id()
1
replace into t1 values(20,'');
select `auto_increment` from information_schema.tables where table_schema='test' and table_name='t1';
auto_increment
NULL
select last_insert_id();
last_insert_id()
1
update t1 set a=100 where a=1;
select `auto_increment` from information_schema.tables where table_schema='test' and table_name='t1';
auto_increment
NULL
select last_insert_id();
last_insert_id()
1
