drop table if exists t1;
#
select last_insert_id(3) from dual;
last_insert_id(3)
3
select last_insert_id(-3) from dual;
last_insert_id(-3)
18446744073709551613
select last_insert_id(2) from dual;
last_insert_id(2)
2
select last_insert_id(-2) from dual;
last_insert_id(-2)
18446744073709551614
select last_insert_id(9223372036854775807) from dual;
last_insert_id(9223372036854775807)
9223372036854775807
select last_insert_id(-9223372036854775808) from dual;
last_insert_id(-9223372036854775808)
9223372036854775808
select last_insert_id(18446744073709551615) from dual;
last_insert_id(18446744073709551615)
18446744073709551615
select last_insert_id(-18446744073709551615) from dual;
last_insert_id(-18446744073709551615)
9223372036854775808
select last_insert_id(18446744073709551616) from dual;
last_insert_id(18446744073709551616)
9223372036854775807
select last_insert_id(184467440737095516164324324) from dual;
last_insert_id(184467440737095516164324324)
9223372036854775807
select last_insert_id(-184467440737095516164324324) from dual;
last_insert_id(-184467440737095516164324324)
9223372036854775808
#
select last_insert_id(0) from dual;
last_insert_id(0)
0
create table t1 (c1 int);
insert into t1 values (7);
select last_insert_id() from dual;
last_insert_id()
0
update t1 set c1 =1 where 1 in (select last_insert_id(9) from dual);
select last_insert_id() from dual;
last_insert_id()
9
delete from t1 where 1 in (select last_insert_id(19) from dual);
select last_insert_id() from dual;
last_insert_id()
19
insert into t1 (select last_insert_id(29) from dual);
select last_insert_id() from dual;
last_insert_id()
19
select last_insert_id(0) from dual;
last_insert_id(0)
0
drop table t1;
