drop table if exists t1;
CREATE TABLE t1 (c1 BIGINT PRIMARY KEY AUTO_INCREMENT, c2 VARCHAR(10)) ;
INSERT INTO t1 VALUES (9223372036854775807, null);
INSERT INTO t1 (c2) VALUES ('innodb');
ERROR 23000: Duplicate entry '9223372036854775807' for key 'PRIMARY'
SELECT * FROM t1;
c1	c2
9223372036854775807	NULL
DROP TABLE t1;
CREATE TABLE t1 (c1 TINYINT PRIMARY KEY AUTO_INCREMENT, c2 VARCHAR(10)) ;
INSERT INTO t1 VALUES (127, null);
INSERT INTO t1 (c2) VALUES ('innodb');
ERROR 23000: Duplicate entry '127' for key 'PRIMARY'
SELECT * FROM t1;
c1	c2
127	NULL
DROP TABLE t1;
CREATE TABLE t1 (c1 TINYINT UNSIGNED PRIMARY KEY AUTO_INCREMENT, c2 VARCHAR(10)) ;
INSERT INTO t1 VALUES (255, null);
INSERT INTO t1 (c2) VALUES ('innodb');
ERROR 23000: Duplicate entry '255' for key 'PRIMARY'
SELECT * FROM t1;
c1	c2
255	NULL
DROP TABLE t1;
CREATE TABLE t1 (c1 SMALLINT PRIMARY KEY AUTO_INCREMENT, c2 VARCHAR(10)) ;
INSERT INTO t1 VALUES (32767, null);
INSERT INTO t1 (c2) VALUES ('innodb');
ERROR 23000: Duplicate entry '32767' for key 'PRIMARY'
SELECT * FROM t1;
c1	c2
32767	NULL
DROP TABLE t1;
CREATE TABLE t1 (c1 SMALLINT UNSIGNED PRIMARY KEY AUTO_INCREMENT, c2 VARCHAR(10)) ;
INSERT INTO t1 VALUES (65535, null);
INSERT INTO t1 (c2) VALUES ('innodb');
ERROR 23000: Duplicate entry '65535' for key 'PRIMARY'
SELECT * FROM t1;
c1	c2
65535	NULL
DROP TABLE t1;
CREATE TABLE t1 (c1 MEDIUMINT PRIMARY KEY AUTO_INCREMENT, c2 VARCHAR(10)) ;
INSERT INTO t1 VALUES (8388607, null);
INSERT INTO t1 (c2) VALUES ('innodb');
ERROR 23000: Duplicate entry '8388607' for key 'PRIMARY'
SELECT * FROM t1;
c1	c2
8388607	NULL
DROP TABLE t1;
CREATE TABLE t1 (c1 MEDIUMINT UNSIGNED PRIMARY KEY AUTO_INCREMENT, c2 VARCHAR(10)) ;
INSERT INTO t1 VALUES (16777215, null);
INSERT INTO t1 (c2) VALUES ('innodb');
ERROR 23000: Duplicate entry '16777215' for key 'PRIMARY'
SELECT * FROM t1;
c1	c2
16777215	NULL
DROP TABLE t1;
CREATE TABLE t1 (c1 INT PRIMARY KEY AUTO_INCREMENT, c2 VARCHAR(10)) ;
INSERT INTO t1 VALUES (2147483647, null);
INSERT INTO t1 (c2) VALUES ('innodb');
ERROR 23000: Duplicate entry '2147483647' for key 'PRIMARY'
SELECT * FROM t1;
c1	c2
2147483647	NULL
DROP TABLE t1;
CREATE TABLE t1 (c1 INT UNSIGNED PRIMARY KEY AUTO_INCREMENT, c2 VARCHAR(10)) ;
INSERT INTO t1 VALUES (4294967295, null);
INSERT INTO t1 (c2) VALUES ('innodb');
ERROR 23000: Duplicate entry '4294967295' for key 'PRIMARY'
SELECT * FROM t1;
c1	c2
4294967295	NULL
DROP TABLE t1;
CREATE TABLE t1 (c1 BIGINT PRIMARY KEY AUTO_INCREMENT, c2 VARCHAR(10)) ;
INSERT INTO t1 VALUES (9223372036854775807, null);
INSERT INTO t1 (c2) VALUES ('innodb');
ERROR 23000: Duplicate entry '9223372036854775807' for key 'PRIMARY'
SELECT * FROM t1;
c1	c2
9223372036854775807	NULL
DROP TABLE t1;
CREATE TABLE t1 (c1 BIGINT UNSIGNED PRIMARY KEY AUTO_INCREMENT, c2 VARCHAR(10)) ;
INSERT INTO t1 VALUES (18446744073709551615, null);
INSERT INTO t1 (c2) VALUES ('innodb');
ERROR HY000: Failed to read auto-increment value from storage engine
SELECT * FROM t1;
c1	c2
18446744073709551615	NULL
DROP TABLE t1;
CREATE TABLE t1(c1 INT PRIMARY KEY AUTO_INCREMENT) ;
INSERT INTO t1 VALUES (1), (2), (3);
INSERT INTO t1 VALUES (NULL), (NULL), (NULL);
SELECT c1 FROM t1;
c1
1
2
3
4
5
6
show create table t1;
Table	Create Table
t1	CREATE TABLE `t1` (
  `c1` int(11) NOT NULL AUTO_INCREMENT,
  PRIMARY KEY (`c1`)
) ORGANIZATION INDEX AUTO_INCREMENT = 7 AUTO_INCREMENT_MODE = 'ORDER' DEFAULT CHARSET = utf8mb4 COMPRESSION = 'lz4_1.0' REPLICA_NUM = NUM BLOCK_SIZE = SIZE USE_BLOOM_FILTER = FALSE ENABLE_MACRO_BLOCK_BLOOM_FILTER = FALSE TABLET_SIZE = SIZE PCTFREE = 10
DROP TABLE t1;
show create table t1;
ERROR 42S02: Table 'test.t1' doesn't exist
INSERT INTO t1 VALUES (1), (2), (3);
ERROR 42S02: Table 'test.t1' doesn't exist
INSERT INTO t1 VALUES (NULL), (NULL), (NULL);
ERROR 42S02: Table 'test.t1' doesn't exist
SELECT c1 FROM t1;
ERROR 42S02: Table 'test.t1' doesn't exist
show create table t1;
ERROR 42S02: Table 'test.t1' doesn't exist
DROP TABLE t1;
ERROR 42S02: Unknown table 'test.t1'
CREATE TABLE t1(c1 INT PRIMARY KEY AUTO_INCREMENT) ;
INSERT INTO t1 VALUES (1), (2), (3);
INSERT INTO t1 VALUES (NULL), (NULL), (NULL);
SELECT c1 FROM t1;
c1
1
2
3
4
5
6
show create table t1;
Table	Create Table
t1	CREATE TABLE `t1` (
  `c1` int(11) NOT NULL AUTO_INCREMENT,
  PRIMARY KEY (`c1`)
) ORGANIZATION INDEX AUTO_INCREMENT = 7 AUTO_INCREMENT_MODE = 'ORDER' DEFAULT CHARSET = utf8mb4 COMPRESSION = 'lz4_1.0' REPLICA_NUM = NUM BLOCK_SIZE = SIZE USE_BLOOM_FILTER = FALSE ENABLE_MACRO_BLOCK_BLOOM_FILTER = FALSE TABLET_SIZE = SIZE PCTFREE = 10
DELETE FROM t1;
show create table t1;
Table	Create Table
t1	CREATE TABLE `t1` (
  `c1` int(11) NOT NULL AUTO_INCREMENT,
  PRIMARY KEY (`c1`)
) ORGANIZATION INDEX AUTO_INCREMENT = 7 AUTO_INCREMENT_MODE = 'ORDER' DEFAULT CHARSET = utf8mb4 COMPRESSION = 'lz4_1.0' REPLICA_NUM = NUM BLOCK_SIZE = SIZE USE_BLOOM_FILTER = FALSE ENABLE_MACRO_BLOCK_BLOOM_FILTER = FALSE TABLET_SIZE = SIZE PCTFREE = 10
INSERT INTO t1 VALUES (1), (2), (3);
INSERT INTO t1 VALUES (NULL), (NULL), (NULL);
SELECT c1 FROM t1;
c1
1
2
3
7
8
9
show create table t1;
Table	Create Table
t1	CREATE TABLE `t1` (
  `c1` int(11) NOT NULL AUTO_INCREMENT,
  PRIMARY KEY (`c1`)
) ORGANIZATION INDEX AUTO_INCREMENT = 10 AUTO_INCREMENT_MODE = 'ORDER' DEFAULT CHARSET = utf8mb4 COMPRESSION = 'lz4_1.0' REPLICA_NUM = NUM BLOCK_SIZE = SIZE USE_BLOOM_FILTER = FALSE ENABLE_MACRO_BLOCK_BLOOM_FILTER = FALSE TABLET_SIZE = SIZE PCTFREE = 10
DROP TABLE t1;
DROP TABLE IF EXISTS t1;
CREATE TABLE t1 (c1 INT AUTO_INCREMENT, c2 INT, PRIMARY KEY(c1)) ;
INSERT INTO t1 VALUES (NULL, 1);
DELETE FROM t1 WHERE c1 = 1;
INSERT INTO t1 VALUES (2,1);
INSERT INTO t1 VALUES (NULL,8);
SELECT * FROM t1;
c1	c2
2	1
3	8
DROP TABLE t1;
DROP TABLE IF EXISTS t1;
CREATE TABLE t1 (c1 INT AUTO_INCREMENT, c2 INT, PRIMARY KEY(c1)) ;
INSERT INTO t1 VALUES (NULL, 1);
DELETE FROM t1 WHERE c1 = 1;
INSERT INTO t1 VALUES (2,1), (NULL, 8);
INSERT INTO t1 VALUES (NULL,9);
SELECT * FROM t1;
c1	c2
2	1
3	8
5	9
DROP TABLE t1;
SET @@SESSION.AUTO_INCREMENT_INCREMENT=100, @@SESSION.AUTO_INCREMENT_OFFSET=10;
SHOW VARIABLES LIKE "%auto_inc%";
Variable_name	Value
auto_increment_cache_size	1000000
auto_increment_increment	100
auto_increment_offset	10
group_replication_auto_increment_increment	7
DROP TABLE IF EXISTS t1;
CREATE TABLE t1 (c1 INT AUTO_INCREMENT, PRIMARY KEY(c1)) ;
INSERT INTO t1 VALUES (NULL),(5),(NULL);
INSERT INTO t1 VALUES (250),(NULL);
SELECT * FROM t1;
c1
5
10
110
250
310
INSERT INTO t1 VALUES (1000);
INSERT INTO t1 VALUES(NULL),(NULL);
SELECT * FROM t1;
c1
5
10
110
250
310
1000
1010
1110
DROP TABLE t1;
SET @@SESSION.AUTO_INCREMENT_INCREMENT=1, @@SESSION.AUTO_INCREMENT_OFFSET=1;
SHOW VARIABLES LIKE "%auto_inc%";
Variable_name	Value
auto_increment_cache_size	1000000
auto_increment_increment	1
auto_increment_offset	1
group_replication_auto_increment_increment	7
DROP TABLE IF EXISTS t1;
CREATE TABLE t1 (c1 INT AUTO_INCREMENT, PRIMARY KEY(c1)) ;
INSERT INTO t1 VALUES(0);
SELECT * FROM t1;
c1
1
SET @@SESSION.AUTO_INCREMENT_INCREMENT=100, @@SESSION.AUTO_INCREMENT_OFFSET=10;
INSERT INTO t1 VALUES (-1), (NULL),(2),(NULL);
INSERT INTO t1 VALUES (250),(NULL);
SELECT * FROM t1;
c1
-1
1
2
10
110
250
410
INSERT INTO t1 VALUES(NULL),(NULL);
SELECT * FROM t1;
c1
-1
1
2
10
110
250
410
610
710
DROP TABLE t1;
SET @@SESSION.AUTO_INCREMENT_INCREMENT=1, @@SESSION.AUTO_INCREMENT_OFFSET=1;
SHOW VARIABLES LIKE "%auto_inc%";
Variable_name	Value
auto_increment_cache_size	1000000
auto_increment_increment	1
auto_increment_offset	1
group_replication_auto_increment_increment	7
DROP TABLE IF EXISTS t1;
CREATE TABLE t1 (c1 INT AUTO_INCREMENT, PRIMARY KEY(c1)) ;
INSERT INTO t1 VALUES(-1);
SELECT * FROM t1;
c1
-1
SET @@SESSION.AUTO_INCREMENT_INCREMENT=100, @@SESSION.AUTO_INCREMENT_OFFSET=10;
SHOW VARIABLES LIKE "%auto_inc%";
Variable_name	Value
auto_increment_cache_size	1000000
auto_increment_increment	100
auto_increment_offset	10
group_replication_auto_increment_increment	7
INSERT INTO t1 VALUES (-2), (NULL),(2),(NULL);
INSERT INTO t1 VALUES (250),(NULL);
SELECT * FROM t1;
c1
-2
-1
2
10
110
250
410
INSERT INTO t1 VALUES (1000);
INSERT INTO t1 VALUES(NULL),(NULL);
SELECT * FROM t1;
c1
-2
-1
2
10
110
250
410
1000
1010
1110
DROP TABLE t1;
SET @@SESSION.AUTO_INCREMENT_INCREMENT=1, @@SESSION.AUTO_INCREMENT_OFFSET=1;
SHOW VARIABLES LIKE "%auto_inc%";
Variable_name	Value
auto_increment_cache_size	1000000
auto_increment_increment	1
auto_increment_offset	1
group_replication_auto_increment_increment	7
DROP TABLE IF EXISTS t1;
CREATE TABLE t1 (c1 INT UNSIGNED AUTO_INCREMENT, PRIMARY KEY(c1)) ;
INSERT INTO t1 VALUES(1);
SELECT * FROM t1;
c1
1
SET @@SESSION.AUTO_INCREMENT_INCREMENT=100, @@SESSION.AUTO_INCREMENT_OFFSET=10;
SHOW VARIABLES LIKE "%auto_inc%";
Variable_name	Value
auto_increment_cache_size	1000000
auto_increment_increment	100
auto_increment_offset	10
group_replication_auto_increment_increment	7
INSERT INTO t1 VALUES (2);
INSERT INTO t1 VALUES (NULL);
INSERT INTO t1 VALUES (4);
INSERT INTO t1 VALUES (NULL);
INSERT INTO t1 VALUES (250);
INSERT INTO t1 VALUES (NULL);
SELECT * FROM t1;
c1
1
2
4
10
110
250
310
INSERT INTO t1 VALUES (1000);
INSERT INTO t1 VALUES(NULL);
INSERT INTO t1 VALUES(NULL);
SELECT * FROM t1;
c1
1
2
4
10
110
250
310
1000
1010
1110
DROP TABLE t1;
SET @@SESSION.AUTO_INCREMENT_INCREMENT=1, @@SESSION.AUTO_INCREMENT_OFFSET=1;
SHOW VARIABLES LIKE "%auto_inc%";
Variable_name	Value
auto_increment_cache_size	1000000
auto_increment_increment	1
auto_increment_offset	1
group_replication_auto_increment_increment	7
DROP TABLE IF EXISTS t1;
CREATE TABLE t1 (c1 INT UNSIGNED AUTO_INCREMENT, PRIMARY KEY(c1)) ;
INSERT INTO t1 VALUES(1);
SELECT * FROM t1;
c1
1
SET @@SESSION.AUTO_INCREMENT_INCREMENT=100, @@SESSION.AUTO_INCREMENT_OFFSET=10;
SHOW VARIABLES LIKE "%auto_inc%";
Variable_name	Value
auto_increment_cache_size	1000000
auto_increment_increment	100
auto_increment_offset	10
group_replication_auto_increment_increment	7
INSERT INTO t1 VALUES (2),(NULL),(4),(NULL);
INSERT INTO t1 VALUES (250),(NULL);
SELECT * FROM t1;
c1
1
2
4
10
110
250
410
INSERT INTO t1 VALUES (1000);
INSERT INTO t1 VALUES(NULL),(NULL);
SELECT * FROM t1;
c1
1
2
4
10
110
250
410
1000
1010
1110
DROP TABLE t1;
SET @@SESSION.AUTO_INCREMENT_INCREMENT=1, @@SESSION.AUTO_INCREMENT_OFFSET=1;
SHOW VARIABLES LIKE "%auto_inc%";
Variable_name	Value
auto_increment_cache_size	1000000
auto_increment_increment	1
auto_increment_offset	1
group_replication_auto_increment_increment	7
DROP TABLE IF EXISTS t1;
CREATE TABLE t1 (c1 BIGINT AUTO_INCREMENT, PRIMARY KEY(c1)) ;
INSERT INTO t1 VALUES(NULL);
INSERT INTO t1 VALUES (9223372036854775794);
SELECT * FROM t1;
c1
1
9223372036854775794
SET @@SESSION.AUTO_INCREMENT_INCREMENT=2, @@SESSION.AUTO_INCREMENT_OFFSET=10;
SHOW VARIABLES LIKE "%auto_inc%";
Variable_name	Value
auto_increment_cache_size	1000000
auto_increment_increment	2
auto_increment_offset	10
group_replication_auto_increment_increment	7
INSERT INTO t1 VALUES (NULL),(NULL),(NULL),(NULL),(NULL),(NULL);
SELECT * FROM t1;
c1
1
9223372036854775794
9223372036854775796
9223372036854775798
9223372036854775800
9223372036854775802
9223372036854775804
9223372036854775806
INSERT INTO t1 VALUES (NULL);
ERROR 23000: Duplicate entry '9223372036854775806' for key 'PRIMARY'
DROP TABLE t1;
SET @@SESSION.AUTO_INCREMENT_INCREMENT=1, @@SESSION.AUTO_INCREMENT_OFFSET=1;
SHOW VARIABLES LIKE "%auto_inc%";
Variable_name	Value
auto_increment_cache_size	1000000
auto_increment_increment	1
auto_increment_offset	1
group_replication_auto_increment_increment	7
DROP TABLE IF EXISTS t1;
CREATE TABLE t1 (c1 BIGINT UNSIGNED AUTO_INCREMENT, PRIMARY KEY(c1)) ;
INSERT INTO t1 VALUES(NULL);
INSERT INTO t1 VALUES (18446744073709551603);
SELECT * FROM t1;
c1
1
18446744073709551603
SET @@SESSION.AUTO_INCREMENT_INCREMENT=2, @@SESSION.AUTO_INCREMENT_OFFSET=10;
SHOW VARIABLES LIKE "%auto_inc%";
Variable_name	Value
auto_increment_cache_size	1000000
auto_increment_increment	2
auto_increment_offset	10
group_replication_auto_increment_increment	7
INSERT INTO t1 VALUES (NULL),(NULL),(NULL),(NULL),(NULL),(NULL),(NULL);
ERROR HY000: Failed to read auto-increment value from storage engine
SELECT * FROM t1;
c1
1
18446744073709551603
DROP TABLE t1;
SET @@SESSION.AUTO_INCREMENT_INCREMENT=1, @@SESSION.AUTO_INCREMENT_OFFSET=1;
SHOW VARIABLES LIKE "%auto_inc%";
Variable_name	Value
auto_increment_cache_size	1000000
auto_increment_increment	1
auto_increment_offset	1
group_replication_auto_increment_increment	7
DROP TABLE IF EXISTS t1;
CREATE TABLE t1 (c1 BIGINT UNSIGNED AUTO_INCREMENT, PRIMARY KEY(c1)) ;
INSERT INTO t1 VALUES(NULL);
INSERT INTO t1 VALUES (18446744073709551603);
SELECT * FROM t1;
c1
1
18446744073709551603
SET @@SESSION.AUTO_INCREMENT_INCREMENT=5, @@SESSION.AUTO_INCREMENT_OFFSET=7;
SHOW VARIABLES LIKE "%auto_inc%";
Variable_name	Value
auto_increment_cache_size	1000000
auto_increment_increment	5
auto_increment_offset	7
group_replication_auto_increment_increment	7
INSERT INTO t1 VALUES (NULL),(NULL), (NULL);
ERROR HY000: Failed to read auto-increment value from storage engine
SELECT * FROM t1;
c1
1
18446744073709551603
DROP TABLE t1;
SET @@SESSION.AUTO_INCREMENT_INCREMENT=1, @@SESSION.AUTO_INCREMENT_OFFSET=1;
SHOW VARIABLES LIKE "%auto_inc%";
Variable_name	Value
auto_increment_cache_size	1000000
auto_increment_increment	1
auto_increment_offset	1
group_replication_auto_increment_increment	7
DROP TABLE IF EXISTS t1;
CREATE TABLE t1 (c1 BIGINT AUTO_INCREMENT, PRIMARY KEY(c1)) ;
INSERT INTO t1 VALUES(NULL);
INSERT INTO t1 VALUES(-9223372036854775806);
INSERT INTO t1 VALUES(-9223372036854775807);
INSERT INTO t1 VALUES(-9223372036854775808);
SELECT * FROM t1;
c1
-9223372036854775808
-9223372036854775807
-9223372036854775806
1
SET @@SESSION.AUTO_INCREMENT_INCREMENT=3, @@SESSION.AUTO_INCREMENT_OFFSET=3;
SHOW VARIABLES LIKE "%auto_inc%";
Variable_name	Value
auto_increment_cache_size	1000000
auto_increment_increment	3
auto_increment_offset	3
group_replication_auto_increment_increment	7
INSERT INTO t1 VALUES (NULL),(NULL), (NULL);
SELECT * FROM t1;
c1
-9223372036854775808
-9223372036854775807
-9223372036854775806
1
3
6
9
DROP TABLE t1;
SET @@SESSION.AUTO_INCREMENT_INCREMENT=1, @@SESSION.AUTO_INCREMENT_OFFSET=1;
SHOW VARIABLES LIKE "%auto_inc%";
Variable_name	Value
auto_increment_cache_size	1000000
auto_increment_increment	1
auto_increment_offset	1
group_replication_auto_increment_increment	7
DROP TABLE IF EXISTS t1;
CREATE TABLE t1 (c1 BIGINT UNSIGNED AUTO_INCREMENT, PRIMARY KEY(c1)) ;
INSERT INTO t1 VALUES(NULL);
INSERT INTO t1 VALUES (18446744073709551614);
SELECT * FROM t1;
c1
1
18446744073709551614
SET @SAVED_SQL_MODE = @@SESSION.SQL_MODE;
SELECT @SAVED_SQL_MODE;
@SAVED_SQL_MODE
STRICT_ALL_TABLES,NO_ZERO_IN_DATE,NO_AUTO_CREATE_USER
SET @@SESSION.SQL_MODE = '';
SELECT @@SESSION.SQL_MODE;
@@SESSION.SQL_MODE

SET @@SESSION.AUTO_INCREMENT_INCREMENT=1152921504606846976, @@SESSION.AUTO_INCREMENT_OFFSET=1152921504606846976;
Warnings:
Warning	1292	Truncated incorrect auto_increment_increment value: '1152921504606846976'
Warning	1292	Truncated incorrect auto_increment_offset value: '1152921504606846976'
SET @@SESSION.SQL_MODE = @SAVED_SQL_MODE;
SELECT @@SESSION.SQL_MODE;
@@SESSION.SQL_MODE
STRICT_ALL_TABLES,NO_ZERO_IN_DATE,NO_AUTO_CREATE_USER
SHOW VARIABLES LIKE "%auto_inc%";
Variable_name	Value
auto_increment_cache_size	1000000
auto_increment_increment	65535
auto_increment_offset	65535
group_replication_auto_increment_increment	7
INSERT INTO t1 VALUES (NULL),(NULL);
ERROR HY000: Failed to read auto-increment value from storage engine
SELECT * FROM t1;
c1
1
18446744073709551614
DROP TABLE t1;
SET @@SESSION.AUTO_INCREMENT_INCREMENT=1, @@SESSION.AUTO_INCREMENT_OFFSET=1;
SHOW VARIABLES LIKE "%auto_inc%";
Variable_name	Value
auto_increment_cache_size	1000000
auto_increment_increment	1
auto_increment_offset	1
group_replication_auto_increment_increment	7
CREATE TABLE t1 (c1 DOUBLE NOT NULL AUTO_INCREMENT, c2 INT, PRIMARY KEY (c1)) ;
INSERT INTO t1 VALUES(NULL, 1);
INSERT INTO t1 VALUES(NULL, 2);
SELECT * FROM t1;
c1	c2
1	1
2	2
ALTER TABLE t1 CHANGE c1 c1 BIGINT UNSIGNED NOT NULL AUTO_INCREMENT UNIQUE;
SELECT * FROM t1;
c1	c2
1	1
2	2
INSERT INTO t1 VALUES(NULL, 3);
INSERT INTO t1 VALUES(NULL, 4);
SELECT * FROM t1;
c1	c2
1	1
2	2
3	3
4	4
DROP TABLE IF EXISTS t1;
CREATE TABLE t1 (c1 FLOAT NOT NULL AUTO_INCREMENT, c2 INT, PRIMARY KEY (c1)) ;
INSERT INTO t1 VALUES(NULL, 1);
INSERT INTO t1 VALUES(NULL, 2);
SELECT * FROM t1;
c1	c2
1	1
2	2
ALTER TABLE t1 CHANGE c1 c1 BIGINT UNSIGNED NOT NULL AUTO_INCREMENT UNIQUE;
SELECT * FROM t1;
c1	c2
1	1
2	2
INSERT INTO t1 VALUES(NULL, 3);
INSERT INTO t1 VALUES(NULL, 4);
SELECT * FROM t1;
c1	c2
1	1
2	2
3	3
4	4
DROP TABLE t1;
SET @@SESSION.AUTO_INCREMENT_INCREMENT=1, @@SESSION.AUTO_INCREMENT_OFFSET=5;
DROP TABLE IF EXISTS t1;
DROP TABLE IF EXISTS t2;
CREATE TABLE t1 (
a INT(11) UNSIGNED NOT NULL AUTO_INCREMENT,
b INT(10) UNSIGNED NOT NULL,
c CHAR(20) DEFAULT NULL,
PRIMARY KEY (a)) ;
CREATE TABLE t2 (
m INT(11) UNSIGNED NOT NULL AUTO_INCREMENT,
n INT(10) UNSIGNED NOT NULL,
o CHAR(20) DEFAULT NULL,
PRIMARY KEY (m)) ;
INSERT INTO t2 (n,o) VALUES
(1 , 'true'), (1 , 'false'), (2 , 'true'), (2 , 'false'), (3 , 'true'),
(3 , 'false'), (4 , 'true'), (4 , 'false'), (5 , 'true'), (5 , 'false');
show create table t2;
Table	Create Table
t2	CREATE TABLE `t2` (
  `m` int(11) unsigned NOT NULL AUTO_INCREMENT,
  `n` int(10) unsigned NOT NULL,
  `o` char(20) DEFAULT NULL,
  PRIMARY KEY (`m`)
) ORGANIZATION INDEX AUTO_INCREMENT = 11 AUTO_INCREMENT_MODE = 'ORDER' DEFAULT CHARSET = utf8mb4 COMPRESSION = 'lz4_1.0' REPLICA_NUM = NUM BLOCK_SIZE = SIZE USE_BLOOM_FILTER = FALSE ENABLE_MACRO_BLOCK_BLOOM_FILTER = FALSE TABLET_SIZE = SIZE PCTFREE = 10
show create table t1;
Table	Create Table
t1	CREATE TABLE `t1` (
  `a` int(11) unsigned NOT NULL AUTO_INCREMENT,
  `b` int(10) unsigned NOT NULL,
  `c` char(20) DEFAULT NULL,
  PRIMARY KEY (`a`)
) ORGANIZATION INDEX AUTO_INCREMENT = 1 AUTO_INCREMENT_MODE = 'ORDER' DEFAULT CHARSET = utf8mb4 COMPRESSION = 'lz4_1.0' REPLICA_NUM = NUM BLOCK_SIZE = SIZE USE_BLOOM_FILTER = FALSE ENABLE_MACRO_BLOCK_BLOOM_FILTER = FALSE TABLET_SIZE = SIZE PCTFREE = 10
SELECT * FROM t1;
a	b	c
show create table t1;
Table	Create Table
t1	CREATE TABLE `t1` (
  `a` int(11) unsigned NOT NULL AUTO_INCREMENT,
  `b` int(10) unsigned NOT NULL,
  `c` char(20) DEFAULT NULL,
  PRIMARY KEY (`a`)
) ORGANIZATION INDEX AUTO_INCREMENT = 1 AUTO_INCREMENT_MODE = 'ORDER' DEFAULT CHARSET = utf8mb4 COMPRESSION = 'lz4_1.0' REPLICA_NUM = NUM BLOCK_SIZE = SIZE USE_BLOOM_FILTER = FALSE ENABLE_MACRO_BLOCK_BLOOM_FILTER = FALSE TABLET_SIZE = SIZE PCTFREE = 10
SELECT * FROM t1;
a	b	c
show create table t1;
Table	Create Table
t1	CREATE TABLE `t1` (
  `a` int(11) unsigned NOT NULL AUTO_INCREMENT,
  `b` int(10) unsigned NOT NULL,
  `c` char(20) DEFAULT NULL,
  PRIMARY KEY (`a`)
) ORGANIZATION INDEX AUTO_INCREMENT = 1 AUTO_INCREMENT_MODE = 'ORDER' DEFAULT CHARSET = utf8mb4 COMPRESSION = 'lz4_1.0' REPLICA_NUM = NUM BLOCK_SIZE = SIZE USE_BLOOM_FILTER = FALSE ENABLE_MACRO_BLOCK_BLOOM_FILTER = FALSE TABLET_SIZE = SIZE PCTFREE = 10
SELECT * FROM t1;
a	b	c
show create table t1;
Table	Create Table
t1	CREATE TABLE `t1` (
  `a` int(11) unsigned NOT NULL AUTO_INCREMENT,
  `b` int(10) unsigned NOT NULL,
  `c` char(20) DEFAULT NULL,
  PRIMARY KEY (`a`)
) ORGANIZATION INDEX AUTO_INCREMENT = 1 AUTO_INCREMENT_MODE = 'ORDER' DEFAULT CHARSET = utf8mb4 COMPRESSION = 'lz4_1.0' REPLICA_NUM = NUM BLOCK_SIZE = SIZE USE_BLOOM_FILTER = FALSE ENABLE_MACRO_BLOCK_BLOOM_FILTER = FALSE TABLET_SIZE = SIZE PCTFREE = 10
show create table t1;
Table	Create Table
t1	CREATE TABLE `t1` (
  `a` int(11) unsigned NOT NULL AUTO_INCREMENT,
  `b` int(10) unsigned NOT NULL,
  `c` char(20) DEFAULT NULL,
  PRIMARY KEY (`a`)
) ORGANIZATION INDEX AUTO_INCREMENT = 1 AUTO_INCREMENT_MODE = 'ORDER' DEFAULT CHARSET = utf8mb4 COMPRESSION = 'lz4_1.0' REPLICA_NUM = NUM BLOCK_SIZE = SIZE USE_BLOOM_FILTER = FALSE ENABLE_MACRO_BLOCK_BLOOM_FILTER = FALSE TABLET_SIZE = SIZE PCTFREE = 10
show create table t1;
Table	Create Table
t1	CREATE TABLE `t1` (
  `a` int(11) unsigned NOT NULL AUTO_INCREMENT,
  `b` int(10) unsigned NOT NULL,
  `c` char(20) DEFAULT NULL,
  PRIMARY KEY (`a`)
) ORGANIZATION INDEX AUTO_INCREMENT = 1 AUTO_INCREMENT_MODE = 'ORDER' DEFAULT CHARSET = utf8mb4 COMPRESSION = 'lz4_1.0' REPLICA_NUM = NUM BLOCK_SIZE = SIZE USE_BLOOM_FILTER = FALSE ENABLE_MACRO_BLOCK_BLOOM_FILTER = FALSE TABLET_SIZE = SIZE PCTFREE = 10
SELECT * FROM t1;
a	b	c
show create table t1;
Table	Create Table
t1	CREATE TABLE `t1` (
  `a` int(11) unsigned NOT NULL AUTO_INCREMENT,
  `b` int(10) unsigned NOT NULL,
  `c` char(20) DEFAULT NULL,
  PRIMARY KEY (`a`)
) ORGANIZATION INDEX AUTO_INCREMENT = 1 AUTO_INCREMENT_MODE = 'ORDER' DEFAULT CHARSET = utf8mb4 COMPRESSION = 'lz4_1.0' REPLICA_NUM = NUM BLOCK_SIZE = SIZE USE_BLOOM_FILTER = FALSE ENABLE_MACRO_BLOCK_BLOOM_FILTER = FALSE TABLET_SIZE = SIZE PCTFREE = 10
DROP TABLE t1;
DROP TABLE t2;
DROP TABLE IF EXISTS t1;
DROP TABLE IF EXISTS t2;
CREATE TABLE t1(
c1 INT(10) UNSIGNED NOT NULL AUTO_INCREMENT
PRIMARY KEY) ;
INSERT INTO t1 VALUES (NULL),(NULL),(NULL),(NULL),(NULL),(NULL),(NULL),(NULL),(NULL),(NULL),(NULL),(NULL),(NULL),(NULL),(NULL),(NULL),(NULL),(NULL),(NULL),(NULL),(NULL),(NULL),(NULL),(NULL),(NULL),(NULL),(NULL),(NULL),(NULL),(NULL),(NULL),(NULL),(NULL),(NULL),(NULL),(NULL),(NULL),(NULL),(NULL),(NULL),(NULL),(NULL),(NULL),(NULL),(NULL),(NULL),(NULL),(NULL),(NULL),(NULL),(NULL),(NULL),(NULL),(NULL),(NULL),(NULL),(NULL),(NULL),(NULL),(NULL),(NULL),(NULL),(NULL),(NULL),(NULL),(NULL),(NULL),(NULL),(NULL),(NULL),(NULL),(NULL),(NULL),(NULL),(NULL),(NULL),(NULL),(NULL),(NULL),(NULL),(NULL),(NULL),(NULL),(NULL),(NULL),(NULL),(NULL),(NULL),(NULL),(NULL),(NULL),(NULL),(NULL),(NULL),(NULL),(NULL),(NULL),(NULL),(NULL),(NULL),(NULL),(NULL),(NULL),(NULL),(NULL),(NULL),(NULL),(NULL),(NULL),(NULL),(NULL),(NULL),(NULL),(NULL),(NULL),(NULL),(NULL),(NULL),(NULL),(NULL),(NULL),(NULL),(NULL),(NULL),(NULL),(NULL),(NULL),(NULL),(NULL),(NULL),(NULL),(NULL),(NULL),(NULL),(NULL),(NULL),(NULL),(NULL),(NULL),(NULL),(NULL),(NULL),(NULL),(NULL),(NULL),(NULL),(NULL),(NULL),(NULL),(NULL),(NULL),(NULL),(NULL),(NULL),(NULL),(NULL),(NULL),(NULL),(NULL),(NULL),(NULL),(NULL),(NULL),(NULL),(NULL),(NULL),(NULL),(NULL),(NULL),(NULL),(NULL),(NULL),(NULL),(NULL),(NULL),(NULL),(NULL),(NULL),(NULL),(NULL),(NULL),(NULL),(NULL),(NULL),(NULL),(NULL),(NULL),(NULL),(NULL),(NULL),(NULL),(NULL),(NULL),(NULL),(NULL),(NULL),(NULL),(NULL),(NULL),(NULL),(NULL),(NULL),(NULL),(NULL),(NULL),(NULL),(NULL),(NULL),(NULL),(NULL),(NULL),(NULL),(NULL),(NULL),(NULL),(NULL),(NULL),(NULL),(NULL),(NULL),(NULL),(NULL),(NULL),(NULL),(NULL),(NULL),(NULL),(NULL),(NULL),(NULL),(NULL),(NULL),(NULL),(NULL),(NULL),(NULL),(NULL),(NULL),(NULL),(NULL),(NULL),(NULL),(NULL),(NULL),(NULL),(NULL),(NULL),(NULL),(NULL),(NULL),(NULL),(NULL),(NULL),(NULL),(NULL),(NULL);
CREATE TABLE t2(
c1 TINYINT(3) UNSIGNED NOT NULL AUTO_INCREMENT
PRIMARY KEY) ;
DROP TABLE t1;
DROP TABLE t2;
SET @@SESSION.AUTO_INCREMENT_INCREMENT=1, @@SESSION.AUTO_INCREMENT_OFFSET=1;
SHOW VARIABLES LIKE "%auto_inc%";
Variable_name	Value
auto_increment_cache_size	1000000
auto_increment_increment	1
auto_increment_offset	1
group_replication_auto_increment_increment	7
CREATE TABLE t1 (c1 TINYINT PRIMARY KEY AUTO_INCREMENT, c2 VARCHAR(10)) ;
INSERT INTO t1 VALUES (1, NULL);
INSERT INTO t1 VALUES (-1, 'innodb');
INSERT INTO t1 VALUES (-127, 'innodb');
INSERT INTO t1 VALUES (NULL, NULL);
show create table t1;
Table	Create Table
t1	CREATE TABLE `t1` (
  `c1` tinyint(4) NOT NULL AUTO_INCREMENT,
  `c2` varchar(10) DEFAULT NULL,
  PRIMARY KEY (`c1`)
) ORGANIZATION INDEX AUTO_INCREMENT = 3 AUTO_INCREMENT_MODE = 'ORDER' DEFAULT CHARSET = utf8mb4 COMPRESSION = 'lz4_1.0' REPLICA_NUM = NUM BLOCK_SIZE = SIZE USE_BLOOM_FILTER = FALSE ENABLE_MACRO_BLOCK_BLOOM_FILTER = FALSE TABLET_SIZE = SIZE PCTFREE = 10
SELECT * FROM t1;
c1	c2
-127	innodb
-1	innodb
1	NULL
2	NULL
DROP TABLE t1;
CREATE TABLE t1 (c1 TINYINT UNSIGNED PRIMARY KEY AUTO_INCREMENT, c2 VARCHAR(10)) ;
INSERT INTO t1 VALUES (1, NULL);
INSERT INTO t1 VALUES (-1, 'innodb');
ERROR 22003: Out of range value for column 'c1' at row 1
INSERT INTO t1 VALUES (-127, 'innodb');
ERROR 22003: Out of range value for column 'c1' at row 1
INSERT INTO t1 VALUES (NULL, NULL);
show create table t1;
Table	Create Table
t1	CREATE TABLE `t1` (
  `c1` tinyint(3) unsigned NOT NULL AUTO_INCREMENT,
  `c2` varchar(10) DEFAULT NULL,
  PRIMARY KEY (`c1`)
) ORGANIZATION INDEX AUTO_INCREMENT = 3 AUTO_INCREMENT_MODE = 'ORDER' DEFAULT CHARSET = utf8mb4 COMPRESSION = 'lz4_1.0' REPLICA_NUM = NUM BLOCK_SIZE = SIZE USE_BLOOM_FILTER = FALSE ENABLE_MACRO_BLOCK_BLOOM_FILTER = FALSE TABLET_SIZE = SIZE PCTFREE = 10
SELECT * FROM t1;
c1	c2
1	NULL
2	NULL
DROP TABLE t1;
CREATE TABLE t1 (c1 SMALLINT PRIMARY KEY AUTO_INCREMENT, c2 VARCHAR(10)) ;
INSERT INTO t1 VALUES (1, NULL);
INSERT INTO t1 VALUES (-1, 'innodb');
INSERT INTO t1 VALUES (-32767, 'innodb');
INSERT INTO t1 VALUES (NULL, NULL);
show create table t1;
Table	Create Table
t1	CREATE TABLE `t1` (
  `c1` smallint(6) NOT NULL AUTO_INCREMENT,
  `c2` varchar(10) DEFAULT NULL,
  PRIMARY KEY (`c1`)
) ORGANIZATION INDEX AUTO_INCREMENT = 3 AUTO_INCREMENT_MODE = 'ORDER' DEFAULT CHARSET = utf8mb4 COMPRESSION = 'lz4_1.0' REPLICA_NUM = NUM BLOCK_SIZE = SIZE USE_BLOOM_FILTER = FALSE ENABLE_MACRO_BLOCK_BLOOM_FILTER = FALSE TABLET_SIZE = SIZE PCTFREE = 10
SELECT * FROM t1;
c1	c2
-32767	innodb
-1	innodb
1	NULL
2	NULL
DROP TABLE t1;
CREATE TABLE t1 (c1 SMALLINT UNSIGNED PRIMARY KEY AUTO_INCREMENT, c2 VARCHAR(10)) ;
INSERT INTO t1 VALUES (1, NULL);
INSERT INTO t1 VALUES (-1, 'innodb');
ERROR 22003: Out of range value for column 'c1' at row 1
INSERT INTO t1 VALUES (-32757, 'innodb');
ERROR 22003: Out of range value for column 'c1' at row 1
INSERT INTO t1 VALUES (NULL, NULL);
show create table t1;
Table	Create Table
t1	CREATE TABLE `t1` (
  `c1` smallint(5) unsigned NOT NULL AUTO_INCREMENT,
  `c2` varchar(10) DEFAULT NULL,
  PRIMARY KEY (`c1`)
) ORGANIZATION INDEX AUTO_INCREMENT = 3 AUTO_INCREMENT_MODE = 'ORDER' DEFAULT CHARSET = utf8mb4 COMPRESSION = 'lz4_1.0' REPLICA_NUM = NUM BLOCK_SIZE = SIZE USE_BLOOM_FILTER = FALSE ENABLE_MACRO_BLOCK_BLOOM_FILTER = FALSE TABLET_SIZE = SIZE PCTFREE = 10
SELECT * FROM t1;
c1	c2
1	NULL
2	NULL
DROP TABLE t1;
CREATE TABLE t1 (c1 MEDIUMINT PRIMARY KEY AUTO_INCREMENT, c2 VARCHAR(10)) ;
INSERT INTO t1 VALUES (1, NULL);
INSERT INTO t1 VALUES (-1, 'innodb');
INSERT INTO t1 VALUES (-8388607, 'innodb');
INSERT INTO t1 VALUES (NULL, NULL);
show create table t1;
Table	Create Table
t1	CREATE TABLE `t1` (
  `c1` mediumint(9) NOT NULL AUTO_INCREMENT,
  `c2` varchar(10) DEFAULT NULL,
  PRIMARY KEY (`c1`)
) ORGANIZATION INDEX AUTO_INCREMENT = 3 AUTO_INCREMENT_MODE = 'ORDER' DEFAULT CHARSET = utf8mb4 COMPRESSION = 'lz4_1.0' REPLICA_NUM = NUM BLOCK_SIZE = SIZE USE_BLOOM_FILTER = FALSE ENABLE_MACRO_BLOCK_BLOOM_FILTER = FALSE TABLET_SIZE = SIZE PCTFREE = 10
SELECT * FROM t1;
c1	c2
-8388607	innodb
-1	innodb
1	NULL
2	NULL
DROP TABLE t1;
CREATE TABLE t1 (c1 MEDIUMINT UNSIGNED PRIMARY KEY AUTO_INCREMENT, c2 VARCHAR(10)) ;
INSERT INTO t1 VALUES (1, NULL);
INSERT INTO t1 VALUES (-1, 'innodb');
ERROR 22003: Out of range value for column 'c1' at row 1
INSERT INTO t1 VALUES (-8388607, 'innodb');
ERROR 22003: Out of range value for column 'c1' at row 1
INSERT INTO t1 VALUES (NULL, NULL);
show create table t1;
Table	Create Table
t1	CREATE TABLE `t1` (
  `c1` mediumint(8) unsigned NOT NULL AUTO_INCREMENT,
  `c2` varchar(10) DEFAULT NULL,
  PRIMARY KEY (`c1`)
) ORGANIZATION INDEX AUTO_INCREMENT = 3 AUTO_INCREMENT_MODE = 'ORDER' DEFAULT CHARSET = utf8mb4 COMPRESSION = 'lz4_1.0' REPLICA_NUM = NUM BLOCK_SIZE = SIZE USE_BLOOM_FILTER = FALSE ENABLE_MACRO_BLOCK_BLOOM_FILTER = FALSE TABLET_SIZE = SIZE PCTFREE = 10
SELECT * FROM t1;
c1	c2
1	NULL
2	NULL
DROP TABLE t1;
CREATE TABLE t1 (c1 INT PRIMARY KEY AUTO_INCREMENT, c2 VARCHAR(10)) ;
INSERT INTO t1 VALUES (1, NULL);
INSERT INTO t1 VALUES (-1, 'innodb');
INSERT INTO t1 VALUES (-2147483647, 'innodb');
INSERT INTO t1 VALUES (NULL, NULL);
show create table t1;
Table	Create Table
t1	CREATE TABLE `t1` (
  `c1` int(11) NOT NULL AUTO_INCREMENT,
  `c2` varchar(10) DEFAULT NULL,
  PRIMARY KEY (`c1`)
) ORGANIZATION INDEX AUTO_INCREMENT = 3 AUTO_INCREMENT_MODE = 'ORDER' DEFAULT CHARSET = utf8mb4 COMPRESSION = 'lz4_1.0' REPLICA_NUM = NUM BLOCK_SIZE = SIZE USE_BLOOM_FILTER = FALSE ENABLE_MACRO_BLOCK_BLOOM_FILTER = FALSE TABLET_SIZE = SIZE PCTFREE = 10
SELECT * FROM t1;
c1	c2
-2147483647	innodb
-1	innodb
1	NULL
2	NULL
DROP TABLE t1;
CREATE TABLE t1 (c1 INT UNSIGNED PRIMARY KEY AUTO_INCREMENT, c2 VARCHAR(10)) ;
INSERT INTO t1 VALUES (1, NULL);
INSERT INTO t1 VALUES (-1, 'innodb');
ERROR 22003: Out of range value for column 'c1' at row 1
INSERT INTO t1 VALUES (-2147483647, 'innodb');
ERROR 22003: Out of range value for column 'c1' at row 1
INSERT INTO t1 VALUES (NULL, NULL);
show create table t1;
Table	Create Table
t1	CREATE TABLE `t1` (
  `c1` int(10) unsigned NOT NULL AUTO_INCREMENT,
  `c2` varchar(10) DEFAULT NULL,
  PRIMARY KEY (`c1`)
) ORGANIZATION INDEX AUTO_INCREMENT = 3 AUTO_INCREMENT_MODE = 'ORDER' DEFAULT CHARSET = utf8mb4 COMPRESSION = 'lz4_1.0' REPLICA_NUM = NUM BLOCK_SIZE = SIZE USE_BLOOM_FILTER = FALSE ENABLE_MACRO_BLOCK_BLOOM_FILTER = FALSE TABLET_SIZE = SIZE PCTFREE = 10
SELECT * FROM t1;
c1	c2
1	NULL
2	NULL
DROP TABLE t1;
CREATE TABLE t1 (c1 BIGINT PRIMARY KEY AUTO_INCREMENT, c2 VARCHAR(10)) ;
INSERT INTO t1 VALUES (1, NULL);
INSERT INTO t1 VALUES (-1, 'innodb');
INSERT INTO t1 VALUES (-9223372036854775807, 'innodb');
INSERT INTO t1 VALUES (NULL, NULL);
show create table t1;
Table	Create Table
t1	CREATE TABLE `t1` (
  `c1` bigint(20) NOT NULL AUTO_INCREMENT,
  `c2` varchar(10) DEFAULT NULL,
  PRIMARY KEY (`c1`)
) ORGANIZATION INDEX AUTO_INCREMENT = 3 AUTO_INCREMENT_MODE = 'ORDER' DEFAULT CHARSET = utf8mb4 COMPRESSION = 'lz4_1.0' REPLICA_NUM = NUM BLOCK_SIZE = SIZE USE_BLOOM_FILTER = FALSE ENABLE_MACRO_BLOCK_BLOOM_FILTER = FALSE TABLET_SIZE = SIZE PCTFREE = 10
SELECT * FROM t1;
c1	c2
-9223372036854775807	innodb
-1	innodb
1	NULL
2	NULL
DROP TABLE t1;
CREATE TABLE t1 (c1 BIGINT UNSIGNED PRIMARY KEY AUTO_INCREMENT, c2 VARCHAR(10)) ;
INSERT INTO t1 VALUES (1, NULL);
INSERT INTO t1 VALUES (-1, 'innodb');
ERROR 22003: Out of range value for column 'c1' at row 1
INSERT INTO t1 VALUES (-9223372036854775807, 'innodb');
ERROR 22003: Out of range value for column 'c1' at row 1
INSERT INTO t1 VALUES (NULL, NULL);
show create table t1;
Table	Create Table
t1	CREATE TABLE `t1` (
  `c1` bigint(20) unsigned NOT NULL AUTO_INCREMENT,
  `c2` varchar(10) DEFAULT NULL,
  PRIMARY KEY (`c1`)
) ORGANIZATION INDEX AUTO_INCREMENT = 3 AUTO_INCREMENT_MODE = 'ORDER' DEFAULT CHARSET = utf8mb4 COMPRESSION = 'lz4_1.0' REPLICA_NUM = NUM BLOCK_SIZE = SIZE USE_BLOOM_FILTER = FALSE ENABLE_MACRO_BLOCK_BLOOM_FILTER = FALSE TABLET_SIZE = SIZE PCTFREE = 10
SELECT * FROM t1;
c1	c2
1	NULL
2	NULL
DROP TABLE t1;
CREATE TABLE t1 (c1 INT AUTO_INCREMENT, c2 INT, PRIMARY KEY(c1)) AUTO_INCREMENT=10 ;
CREATE INDEX i1 on t1(c2);
show create table t1;
Table	Create Table
t1	CREATE TABLE `t1` (
  `c1` int(11) NOT NULL AUTO_INCREMENT,
  `c2` int(11) DEFAULT NULL,
  PRIMARY KEY (`c1`),
  KEY `i1` (`c2`) BLOCK_SIZE 16384 LOCAL
) ORGANIZATION INDEX AUTO_INCREMENT = 10 AUTO_INCREMENT_MODE = 'ORDER' DEFAULT CHARSET = utf8mb4 COMPRESSION = 'lz4_1.0' REPLICA_NUM = NUM BLOCK_SIZE = SIZE USE_BLOOM_FILTER = FALSE ENABLE_MACRO_BLOCK_BLOOM_FILTER = FALSE TABLET_SIZE = SIZE PCTFREE = 10
INSERT INTO t1 (c2) values (0);
SELECT * FROM t1;
c1	c2
10	0
DROP TABLE t1;
DROP TABLE IF EXISTS t1;
CREATE TABLE t1(C1 DOUBLE AUTO_INCREMENT PRIMARY KEY, C2 CHAR(10)) ;
INSERT INTO t1(C1, C2) VALUES (1, 'innodb'), (3, 'innodb');
INSERT INTO t1(C2) VALUES ('innodb');
show create table t1;
Table	Create Table
t1	CREATE TABLE `t1` (
  `C1` double NOT NULL AUTO_INCREMENT,
  `C2` char(10) DEFAULT NULL,
  PRIMARY KEY (`C1`)
) ORGANIZATION INDEX AUTO_INCREMENT = 5 AUTO_INCREMENT_MODE = 'ORDER' DEFAULT CHARSET = utf8mb4 COMPRESSION = 'lz4_1.0' REPLICA_NUM = NUM BLOCK_SIZE = SIZE USE_BLOOM_FILTER = FALSE ENABLE_MACRO_BLOCK_BLOOM_FILTER = FALSE TABLET_SIZE = SIZE PCTFREE = 10
DROP TABLE t1;
CREATE TABLE t1(C1 FLOAT AUTO_INCREMENT PRIMARY KEY, C2 CHAR(10)) ;
INSERT INTO t1(C1, C2) VALUES (1, 'innodb'), (3, 'innodb');
INSERT INTO t1(C2) VALUES ('innodb');
show create table t1;
Table	Create Table
t1	CREATE TABLE `t1` (
  `C1` float NOT NULL AUTO_INCREMENT,
  `C2` char(10) DEFAULT NULL,
  PRIMARY KEY (`C1`)
) ORGANIZATION INDEX AUTO_INCREMENT = 5 AUTO_INCREMENT_MODE = 'ORDER' DEFAULT CHARSET = utf8mb4 COMPRESSION = 'lz4_1.0' REPLICA_NUM = NUM BLOCK_SIZE = SIZE USE_BLOOM_FILTER = FALSE ENABLE_MACRO_BLOCK_BLOOM_FILTER = FALSE TABLET_SIZE = SIZE PCTFREE = 10
DROP TABLE t1;
DROP TABLE IF EXISTS t1;
CREATE TABLE t1 (c1 INT AUTO_INCREMENT PRIMARY KEY) ;
show create table t1;
Table	Create Table
t1	CREATE TABLE `t1` (
  `c1` int(11) NOT NULL AUTO_INCREMENT,
  PRIMARY KEY (`c1`)
) ORGANIZATION INDEX AUTO_INCREMENT = 1 AUTO_INCREMENT_MODE = 'ORDER' DEFAULT CHARSET = utf8mb4 COMPRESSION = 'lz4_1.0' REPLICA_NUM = NUM BLOCK_SIZE = SIZE USE_BLOOM_FILTER = FALSE ENABLE_MACRO_BLOCK_BLOOM_FILTER = FALSE TABLET_SIZE = SIZE PCTFREE = 10
SELECT * FROM t1;
c1
show create table t1;
Table	Create Table
t1	CREATE TABLE `t1` (
  `c1` int(11) NOT NULL AUTO_INCREMENT,
  PRIMARY KEY (`c1`)
) ORGANIZATION INDEX AUTO_INCREMENT = 1 AUTO_INCREMENT_MODE = 'ORDER' DEFAULT CHARSET = utf8mb4 COMPRESSION = 'lz4_1.0' REPLICA_NUM = NUM BLOCK_SIZE = SIZE USE_BLOOM_FILTER = FALSE ENABLE_MACRO_BLOCK_BLOOM_FILTER = FALSE TABLET_SIZE = SIZE PCTFREE = 10
REPLACE INTO t1 VALUES (-1);
SELECT * FROM t1;
c1
-1
show create table t1;
Table	Create Table
t1	CREATE TABLE `t1` (
  `c1` int(11) NOT NULL AUTO_INCREMENT,
  PRIMARY KEY (`c1`)
) ORGANIZATION INDEX AUTO_INCREMENT = 1 AUTO_INCREMENT_MODE = 'ORDER' DEFAULT CHARSET = utf8mb4 COMPRESSION = 'lz4_1.0' REPLICA_NUM = NUM BLOCK_SIZE = SIZE USE_BLOOM_FILTER = FALSE ENABLE_MACRO_BLOCK_BLOOM_FILTER = FALSE TABLET_SIZE = SIZE PCTFREE = 10
DROP TABLE t1;
DROP TABLE IF EXISTS t1;
CREATE TABLE t1  (c1 INTEGER AUTO_INCREMENT, PRIMARY KEY (c1)) ;
INSERT INTO  t1 VALUES (-685113344), (1), (NULL), (NULL);
SELECT * FROM t1;
c1
-685113344
1
2
3
show create table t1;
Table	Create Table
t1	CREATE TABLE `t1` (
  `c1` int(11) NOT NULL AUTO_INCREMENT,
  PRIMARY KEY (`c1`)
) ORGANIZATION INDEX AUTO_INCREMENT = 6 AUTO_INCREMENT_MODE = 'ORDER' DEFAULT CHARSET = utf8mb4 COMPRESSION = 'lz4_1.0' REPLICA_NUM = NUM BLOCK_SIZE = SIZE USE_BLOOM_FILTER = FALSE ENABLE_MACRO_BLOCK_BLOOM_FILTER = FALSE TABLET_SIZE = SIZE PCTFREE = 10
DROP TABLE t1;
CREATE TABLE t1  (c1 INTEGER AUTO_INCREMENT, PRIMARY KEY (c1)) ;
INSERT INTO  t1 VALUES (-685113344), (2), (NULL), (NULL);
SELECT * FROM t1;
c1
-685113344
2
3
4
show create table t1;
Table	Create Table
t1	CREATE TABLE `t1` (
  `c1` int(11) NOT NULL AUTO_INCREMENT,
  PRIMARY KEY (`c1`)
) ORGANIZATION INDEX AUTO_INCREMENT = 7 AUTO_INCREMENT_MODE = 'ORDER' DEFAULT CHARSET = utf8mb4 COMPRESSION = 'lz4_1.0' REPLICA_NUM = NUM BLOCK_SIZE = SIZE USE_BLOOM_FILTER = FALSE ENABLE_MACRO_BLOCK_BLOOM_FILTER = FALSE TABLET_SIZE = SIZE PCTFREE = 10
DROP TABLE t1;
CREATE TABLE t1  (c1 INTEGER AUTO_INCREMENT, PRIMARY KEY (c1)) ;
INSERT INTO  t1 VALUES (NULL), (2), (-685113344), (NULL);
INSERT INTO  t1 VALUES (5), (6), (7), (NULL);
SELECT * FROM t1;
c1
-685113344
1
2
3
5
6
7
8
show create table t1;
Table	Create Table
t1	CREATE TABLE `t1` (
  `c1` int(11) NOT NULL AUTO_INCREMENT,
  PRIMARY KEY (`c1`)
) ORGANIZATION INDEX AUTO_INCREMENT = 12 AUTO_INCREMENT_MODE = 'ORDER' DEFAULT CHARSET = utf8mb4 COMPRESSION = 'lz4_1.0' REPLICA_NUM = NUM BLOCK_SIZE = SIZE USE_BLOOM_FILTER = FALSE ENABLE_MACRO_BLOCK_BLOOM_FILTER = FALSE TABLET_SIZE = SIZE PCTFREE = 10
DROP TABLE t1;
CREATE TABLE t1  (c1 INTEGER AUTO_INCREMENT, PRIMARY KEY (c1)) ;
INSERT INTO  t1 VALUES (NULL), (2), (-685113344), (5);
SELECT * FROM t1;
c1
-685113344
1
2
5
show create table t1;
Table	Create Table
t1	CREATE TABLE `t1` (
  `c1` int(11) NOT NULL AUTO_INCREMENT,
  PRIMARY KEY (`c1`)
) ORGANIZATION INDEX AUTO_INCREMENT = 6 AUTO_INCREMENT_MODE = 'ORDER' DEFAULT CHARSET = utf8mb4 COMPRESSION = 'lz4_1.0' REPLICA_NUM = NUM BLOCK_SIZE = SIZE USE_BLOOM_FILTER = FALSE ENABLE_MACRO_BLOCK_BLOOM_FILTER = FALSE TABLET_SIZE = SIZE PCTFREE = 10
DROP TABLE t1;
CREATE TABLE t1  (c1 INTEGER AUTO_INCREMENT, PRIMARY KEY (c1)) ;
INSERT INTO  t1 VALUES (1), (2), (-685113344), (NULL);
SELECT * FROM t1;
c1
-685113344
1
2
3
show create table t1;
Table	Create Table
t1	CREATE TABLE `t1` (
  `c1` int(11) NOT NULL AUTO_INCREMENT,
  PRIMARY KEY (`c1`)
) ORGANIZATION INDEX AUTO_INCREMENT = 7 AUTO_INCREMENT_MODE = 'ORDER' DEFAULT CHARSET = utf8mb4 COMPRESSION = 'lz4_1.0' REPLICA_NUM = NUM BLOCK_SIZE = SIZE USE_BLOOM_FILTER = FALSE ENABLE_MACRO_BLOCK_BLOOM_FILTER = FALSE TABLET_SIZE = SIZE PCTFREE = 10
DROP TABLE t1;
DROP TABLE IF EXISTS t1;
CREATE TABLE t1(c1 BIGINT UNSIGNED NOT NULL AUTO_INCREMENT PRIMARY KEY) ;
INSERT INTO t1 VALUES (NULL);
INSERT INTO t1 VALUES (18446744073709551615);
show create table t1;
Table	Create Table
t1	CREATE TABLE `t1` (
  `c1` bigint(20) unsigned NOT NULL AUTO_INCREMENT,
  PRIMARY KEY (`c1`)
) ORGANIZATION INDEX AUTO_INCREMENT = 18446744073709551615 AUTO_INCREMENT_MODE = 'ORDER' DEFAULT CHARSET = utf8mb4 COMPRESSION = 'lz4_1.0' REPLICA_NUM = NUM BLOCK_SIZE = SIZE USE_BLOOM_FILTER = FALSE ENABLE_MACRO_BLOCK_BLOOM_FILTER = FALSE TABLET_SIZE = SIZE PCTFREE = 10
DROP TABLE t1;
SET @@SESSION.AUTO_INCREMENT_INCREMENT=1, @@SESSION.AUTO_INCREMENT_OFFSET=256;
SHOW VARIABLES LIKE "%auto_inc%";
Variable_name	Value
auto_increment_cache_size	1000000
auto_increment_increment	1
auto_increment_offset	256
group_replication_auto_increment_increment	7
CREATE TABLE t1 (c1 TINYINT PRIMARY KEY AUTO_INCREMENT, c2 VARCHAR(10)) ;
INSERT INTO t1 VALUES (1, NULL);
show create table t1;
Table	Create Table
t1	CREATE TABLE `t1` (
  `c1` tinyint(4) NOT NULL AUTO_INCREMENT,
  `c2` varchar(10) DEFAULT NULL,
  PRIMARY KEY (`c1`)
) ORGANIZATION INDEX AUTO_INCREMENT = 2 AUTO_INCREMENT_MODE = 'ORDER' DEFAULT CHARSET = utf8mb4 COMPRESSION = 'lz4_1.0' REPLICA_NUM = NUM BLOCK_SIZE = SIZE USE_BLOOM_FILTER = FALSE ENABLE_MACRO_BLOCK_BLOOM_FILTER = FALSE TABLET_SIZE = SIZE PCTFREE = 10
SELECT * FROM t1;
c1	c2
1	NULL
DROP TABLE t1;
SET @@SESSION.AUTO_INCREMENT_INCREMENT=1, @@SESSION.AUTO_INCREMENT_OFFSET=1;
SHOW VARIABLES LIKE "%auto_inc%";
Variable_name	Value
auto_increment_cache_size	1000000
auto_increment_increment	1
auto_increment_offset	1
group_replication_auto_increment_increment	7
CREATE TABLE t1 (c1 INT UNSIGNED PRIMARY KEY AUTO_INCREMENT, c2 VARCHAR(10)) ;
INSERT INTO t1 VALUES (2147483648, 'a');
show create table t1;
Table	Create Table
t1	CREATE TABLE `t1` (
  `c1` int(10) unsigned NOT NULL AUTO_INCREMENT,
  `c2` varchar(10) DEFAULT NULL,
  PRIMARY KEY (`c1`)
) ORGANIZATION INDEX AUTO_INCREMENT = 2147483649 AUTO_INCREMENT_MODE = 'ORDER' DEFAULT CHARSET = utf8mb4 COMPRESSION = 'lz4_1.0' REPLICA_NUM = NUM BLOCK_SIZE = SIZE USE_BLOOM_FILTER = FALSE ENABLE_MACRO_BLOCK_BLOOM_FILTER = FALSE TABLET_SIZE = SIZE PCTFREE = 10
SELECT * FROM t1;
c1	c2
2147483648	a
ALTER TABLE t1 CHANGE c1 c1 INT;
ERROR 22003: Out of range value for column
show create table t1;
Table	Create Table
t1	CREATE TABLE `t1` (
  `c1` int(10) unsigned NOT NULL AUTO_INCREMENT,
  `c2` varchar(10) DEFAULT NULL,
  PRIMARY KEY (`c1`)
) ORGANIZATION INDEX AUTO_INCREMENT = 2147483649 AUTO_INCREMENT_MODE = 'ORDER' DEFAULT CHARSET = utf8mb4 COMPRESSION = 'lz4_1.0' REPLICA_NUM = NUM BLOCK_SIZE = SIZE USE_BLOOM_FILTER = FALSE ENABLE_MACRO_BLOCK_BLOOM_FILTER = FALSE TABLET_SIZE = SIZE PCTFREE = 10
INSERT INTO t1(c2) VALUES('b');
SELECT * FROM t1;
c1	c2
2147483648	a
2147483649	b
show create table t1;
Table	Create Table
t1	CREATE TABLE `t1` (
  `c1` int(10) unsigned NOT NULL AUTO_INCREMENT,
  `c2` varchar(10) DEFAULT NULL,
  PRIMARY KEY (`c1`)
) ORGANIZATION INDEX AUTO_INCREMENT = 2147483650 AUTO_INCREMENT_MODE = 'ORDER' DEFAULT CHARSET = utf8mb4 COMPRESSION = 'lz4_1.0' REPLICA_NUM = NUM BLOCK_SIZE = SIZE USE_BLOOM_FILTER = FALSE ENABLE_MACRO_BLOCK_BLOOM_FILTER = FALSE TABLET_SIZE = SIZE PCTFREE = 10
DROP TABLE t1;
CREATE TABLE t1 (c1 INT AUTO_INCREMENT PRIMARY KEY, c2 INT) ;
INSERT INTO t1 (c1) VALUES (NULL), (-290783232), (NULL);
show create table t1;
Table	Create Table
t1	CREATE TABLE `t1` (
  `c1` int(11) NOT NULL AUTO_INCREMENT,
  `c2` int(11) DEFAULT NULL,
  PRIMARY KEY (`c1`)
) ORGANIZATION INDEX AUTO_INCREMENT = 4 AUTO_INCREMENT_MODE = 'ORDER' DEFAULT CHARSET = utf8mb4 COMPRESSION = 'lz4_1.0' REPLICA_NUM = NUM BLOCK_SIZE = SIZE USE_BLOOM_FILTER = FALSE ENABLE_MACRO_BLOCK_BLOOM_FILTER = FALSE TABLET_SIZE = SIZE PCTFREE = 10
SELECT * FROM t1;
c1	c2
-290783232	NULL
1	NULL
2	NULL
SELECT * FROM t1;
c1	c2
-290783232	NULL
1	NULL
2	NULL
show create table t1;
Table	Create Table
t1	CREATE TABLE `t1` (
  `c1` int(11) NOT NULL AUTO_INCREMENT,
  `c2` int(11) DEFAULT NULL,
  PRIMARY KEY (`c1`)
) ORGANIZATION INDEX AUTO_INCREMENT = 4 AUTO_INCREMENT_MODE = 'ORDER' DEFAULT CHARSET = utf8mb4 COMPRESSION = 'lz4_1.0' REPLICA_NUM = NUM BLOCK_SIZE = SIZE USE_BLOOM_FILTER = FALSE ENABLE_MACRO_BLOCK_BLOOM_FILTER = FALSE TABLET_SIZE = SIZE PCTFREE = 10
REPLACE INTO t1 (c2 ) VALUES (0);
SELECT * FROM t1;
c1	c2
-290783232	NULL
1	NULL
2	NULL
4	0
DROP TABLE t1;
CREATE TABLE t1 (c1 DOUBLE NOT NULL PRIMARY KEY AUTO_INCREMENT)
AUTO_INCREMENT=10000000000000000000;
SELECT * FROM t1;
c1
show create table t1;
Table	Create Table
t1	CREATE TABLE `t1` (
  `c1` double NOT NULL AUTO_INCREMENT,
  PRIMARY KEY (`c1`)
) ORGANIZATION INDEX AUTO_INCREMENT = 10000000000000000000 AUTO_INCREMENT_MODE = 'ORDER' DEFAULT CHARSET = utf8mb4 COMPRESSION = 'lz4_1.0' REPLICA_NUM = NUM BLOCK_SIZE = SIZE USE_BLOOM_FILTER = FALSE ENABLE_MACRO_BLOCK_BLOOM_FILTER = FALSE TABLET_SIZE = SIZE PCTFREE = 10
INSERT INTO t1 VALUES ();
ERROR HY000: Failed to read auto-increment value from storage engine
DROP TABLE t1;
#
# Bug #14049391	 INNODB MISCALCULATES AUTO-INCREMENT
#	AFTER CHANGING AUTO_INCREMENT_INCREMEMENT
#
CREATE TABLE t1 ( i INT AUTO_INCREMENT, KEY(i) ) ;
SET auto_increment_increment = 300;
INSERT INTO t1 VALUES (NULL), (NULL);
show create table t1;
Table	Create Table
t1	CREATE TABLE `t1` (
  `i` int(11) NOT NULL AUTO_INCREMENT,
  KEY `i` (`i`) BLOCK_SIZE 16384 LOCAL
) ORGANIZATION INDEX AUTO_INCREMENT = 601 AUTO_INCREMENT_MODE = 'ORDER' DEFAULT CHARSET = utf8mb4 COMPRESSION = 'lz4_1.0' REPLICA_NUM = NUM BLOCK_SIZE = SIZE USE_BLOOM_FILTER = FALSE ENABLE_MACRO_BLOCK_BLOOM_FILTER = FALSE TABLET_SIZE = SIZE PCTFREE = 10
SET auto_increment_increment = 50;
INSERT INTO t1 VALUES (NULL);
SELECT * FROM t1;
i
1
301
601
show create table t1;
Table	Create Table
t1	CREATE TABLE `t1` (
  `i` int(11) NOT NULL AUTO_INCREMENT,
  KEY `i` (`i`) BLOCK_SIZE 16384 LOCAL
) ORGANIZATION INDEX AUTO_INCREMENT = 651 AUTO_INCREMENT_MODE = 'ORDER' DEFAULT CHARSET = utf8mb4 COMPRESSION = 'lz4_1.0' REPLICA_NUM = NUM BLOCK_SIZE = SIZE USE_BLOOM_FILTER = FALSE ENABLE_MACRO_BLOCK_BLOOM_FILTER = FALSE TABLET_SIZE = SIZE PCTFREE = 10
DROP TABLE t1;
