result_format: 4
drop table if exists seq;
set global auto_increment_cache_size = 1000000;

create table seq (c1 int primary key auto_increment, c2 int unique, c3 int);
insert into seq (c2,c3) values (1,2);
insert into seq (c1,c2,c3) values (9,4,3) on duplicate key update c2 = 31;
insert into seq (c2,c3) values (6,6);
select * from seq;
+----+------+------+
| c1 | c2   | c3   |
+----+------+------+
|  1 |    1 |    2 |
|  9 |    4 |    3 |
| 10 |    6 |    6 |
+----+------+------+

drop table seq;
create table seq (c1 int primary key auto_increment, c2 int unique, c3 int);
insert into seq (c2,c3) values (1,2);
insert into seq (c2,c3) values (4,3) on duplicate key update c2 = 31;
insert into seq (c2,c3) values (6,6);
select * from seq;
+----+------+------+
| c1 | c2   | c3   |
+----+------+------+
|  1 |    1 |    2 |
|  2 |    4 |    3 |
|  3 |    6 |    6 |
+----+------+------+

drop table seq;
create table seq (c1 int primary key auto_increment, c2 int unique, c3 int);
insert into seq (c2,c3) values (1,1);
insert into seq (c2,c3) values (2,2);
update seq set c1 = 5 where c2 = 2;
select * from seq;
+----+------+------+
| c1 | c2   | c3   |
+----+------+------+
|  1 |    1 |    1 |
|  5 |    2 |    2 |
+----+------+------+
insert into seq (c2,c3) values (2,2) on duplicate key update c2 = 31;
insert into seq (c2,c3) values (3,3);
select * from seq;
+----+------+------+
| c1 | c2   | c3   |
+----+------+------+
|  1 |    1 |    1 |
|  4 |    3 |    3 |
|  5 |   31 |    2 |
+----+------+------+
insert into seq (c2,c3) values (5,5);
ERROR 23000: Duplicate entry '5' for key 'PRIMARY'
insert into seq (c2,c3) values (6,6);
select * from seq;
+----+------+------+
| c1 | c2   | c3   |
+----+------+------+
|  1 |    1 |    1 |
|  4 |    3 |    3 |
|  5 |   31 |    2 |
|  6 |    6 |    6 |
+----+------+------+

drop table seq;
create table seq (c1 int primary key auto_increment, c2 int unique, c3 int);
insert into seq (c2,c3) values (1,2);
select * from seq;
+----+------+------+
| c1 | c2   | c3   |
+----+------+------+
|  1 |    1 |    2 |
+----+------+------+
insert into seq (c2,c3) values (4,3) on duplicate key update c2 = 31;
select * from seq;
+----+------+------+
| c1 | c2   | c3   |
+----+------+------+
|  1 |    1 |    2 |
|  2 |    4 |    3 |
+----+------+------+
insert into seq (c2,c3) values (4,3) on duplicate key update c2 = 32;
select * from seq;
+----+------+------+
| c1 | c2   | c3   |
+----+------+------+
|  1 |    1 |    2 |
|  2 |   32 |    3 |
+----+------+------+
insert into seq (c2,c3) values (4,3) on duplicate key update c2 = 33;
select * from seq;
+----+------+------+
| c1 | c2   | c3   |
+----+------+------+
|  1 |    1 |    2 |
|  2 |   32 |    3 |
|  4 |    4 |    3 |
+----+------+------+
insert into seq (c2,c3) values (4,3) on duplicate key update c2 = 34;
select * from seq;
+----+------+------+
| c1 | c2   | c3   |
+----+------+------+
|  1 |    1 |    2 |
|  2 |   32 |    3 |
|  4 |   34 |    3 |
+----+------+------+
insert into seq (c2,c3) values (4,3) on duplicate key update c2 = 35;
select * from seq;
+----+------+------+
| c1 | c2   | c3   |
+----+------+------+
|  1 |    1 |    2 |
|  2 |   32 |    3 |
|  4 |   34 |    3 |
|  6 |    4 |    3 |
+----+------+------+
insert into seq (c2,c3) values (4,3) on duplicate key update c2 = 36;
select * from seq;
+----+------+------+
| c1 | c2   | c3   |
+----+------+------+
|  1 |    1 |    2 |
|  2 |   32 |    3 |
|  4 |   34 |    3 |
|  6 |   36 |    3 |
+----+------+------+
insert into seq (c2,c3) values (4,3) on duplicate key update c2 = 37;
select * from seq;
+----+------+------+
| c1 | c2   | c3   |
+----+------+------+
|  1 |    1 |    2 |
|  2 |   32 |    3 |
|  4 |   34 |    3 |
|  6 |   36 |    3 |
|  8 |    4 |    3 |
+----+------+------+
insert into seq (c2,c3) values (4,3) on duplicate key update c2 = 38;
select * from seq;
+----+------+------+
| c1 | c2   | c3   |
+----+------+------+
|  1 |    1 |    2 |
|  2 |   32 |    3 |
|  4 |   34 |    3 |
|  6 |   36 |    3 |
|  8 |   38 |    3 |
+----+------+------+
insert into seq (c2,c3) values (4,3) on duplicate key update c2 = 39;
select * from seq;
+----+------+------+
| c1 | c2   | c3   |
+----+------+------+
|  1 |    1 |    2 |
|  2 |   32 |    3 |
|  4 |   34 |    3 |
|  6 |   36 |    3 |
|  8 |   38 |    3 |
| 10 |    4 |    3 |
+----+------+------+
insert into seq (c2,c3) values (4,3) on duplicate key update c2 = 40;
select * from seq;
+----+------+------+
| c1 | c2   | c3   |
+----+------+------+
|  1 |    1 |    2 |
|  2 |   32 |    3 |
|  4 |   34 |    3 |
|  6 |   36 |    3 |
|  8 |   38 |    3 |
| 10 |   40 |    3 |
+----+------+------+
insert into seq (c2,c3) values (4,3) on duplicate key update c2 = 41;
select * from seq;
+----+------+------+
| c1 | c2   | c3   |
+----+------+------+
|  1 |    1 |    2 |
|  2 |   32 |    3 |
|  4 |   34 |    3 |
|  6 |   36 |    3 |
|  8 |   38 |    3 |
| 10 |   40 |    3 |
| 12 |    4 |    3 |
+----+------+------+
insert into seq (c2,c3) values (4,3) on duplicate key update c2 = 42;
select * from seq;
+----+------+------+
| c1 | c2   | c3   |
+----+------+------+
|  1 |    1 |    2 |
|  2 |   32 |    3 |
|  4 |   34 |    3 |
|  6 |   36 |    3 |
|  8 |   38 |    3 |
| 10 |   40 |    3 |
| 12 |   42 |    3 |
+----+------+------+
insert into seq (c2,c3) values (6,6);
insert into seq (c2,c3) values (7,7);
select * from seq;
+----+------+------+
| c1 | c2   | c3   |
+----+------+------+
|  1 |    1 |    2 |
|  2 |   32 |    3 |
|  4 |   34 |    3 |
|  6 |   36 |    3 |
|  8 |   38 |    3 |
| 10 |   40 |    3 |
| 12 |   42 |    3 |
| 14 |    6 |    6 |
| 15 |    7 |    7 |
+----+------+------+



drop table seq;
create table seq (c1 int primary key auto_increment, c2 int unique, c3 int);
insert into seq (c2,c3) values (1,2);
select * from seq;
+----+------+------+
| c1 | c2   | c3   |
+----+------+------+
|  1 |    1 |    2 |
+----+------+------+
insert into seq (c2,c3) values (4,3) on duplicate key update c2 = 31;
select * from seq;
+----+------+------+
| c1 | c2   | c3   |
+----+------+------+
|  1 |    1 |    2 |
|  2 |    4 |    3 |
+----+------+------+
insert into seq (c2,c3) values (4,3) on duplicate key update c2 = 32;
select * from seq;
+----+------+------+
| c1 | c2   | c3   |
+----+------+------+
|  1 |    1 |    2 |
|  2 |   32 |    3 |
+----+------+------+
insert into seq (c2,c3) values (4,3) on duplicate key update c2 = 33;
select * from seq;
+----+------+------+
| c1 | c2   | c3   |
+----+------+------+
|  1 |    1 |    2 |
|  2 |   32 |    3 |
|  4 |    4 |    3 |
+----+------+------+
insert into seq (c2,c3) values (4,3) on duplicate key update c2 = 34;
select * from seq;
+----+------+------+
| c1 | c2   | c3   |
+----+------+------+
|  1 |    1 |    2 |
|  2 |   32 |    3 |
|  4 |   34 |    3 |
+----+------+------+
insert into seq (c2,c3) values (4,3) on duplicate key update c2 = 35;
select * from seq;
+----+------+------+
| c1 | c2   | c3   |
+----+------+------+
|  1 |    1 |    2 |
|  2 |   32 |    3 |
|  4 |   34 |    3 |
|  6 |    4 |    3 |
+----+------+------+
insert into seq (c2,c3) values (4,3) on duplicate key update c2 = 36;
select * from seq;
+----+------+------+
| c1 | c2   | c3   |
+----+------+------+
|  1 |    1 |    2 |
|  2 |   32 |    3 |
|  4 |   34 |    3 |
|  6 |   36 |    3 |
+----+------+------+
insert into seq (c1,c2,c3) values (18, 6,6);
select * from seq;
+----+------+------+
| c1 | c2   | c3   |
+----+------+------+
|  1 |    1 |    2 |
|  2 |   32 |    3 |
|  4 |   34 |    3 |
|  6 |   36 |    3 |
| 18 |    6 |    6 |
+----+------+------+
insert into seq (c2,c3) values (4,3) on duplicate key update c2 = 37;
select * from seq;
+----+------+------+
| c1 | c2   | c3   |
+----+------+------+
|  1 |    1 |    2 |
|  2 |   32 |    3 |
|  4 |   34 |    3 |
|  6 |   36 |    3 |
| 18 |    6 |    6 |
| 19 |    4 |    3 |
+----+------+------+
insert into seq (c2,c3) values (4,3) on duplicate key update c2 = 38;
select * from seq;
+----+------+------+
| c1 | c2   | c3   |
+----+------+------+
|  1 |    1 |    2 |
|  2 |   32 |    3 |
|  4 |   34 |    3 |
|  6 |   36 |    3 |
| 18 |    6 |    6 |
| 19 |   38 |    3 |
+----+------+------+
insert into seq (c2,c3) values (4,3) on duplicate key update c2 = 39;
select * from seq;
+----+------+------+
| c1 | c2   | c3   |
+----+------+------+
|  1 |    1 |    2 |
|  2 |   32 |    3 |
|  4 |   34 |    3 |
|  6 |   36 |    3 |
| 18 |    6 |    6 |
| 19 |   38 |    3 |
| 21 |    4 |    3 |
+----+------+------+
insert into seq (c2,c3) values (4,3) on duplicate key update c2 = 40;
select * from seq;
+----+------+------+
| c1 | c2   | c3   |
+----+------+------+
|  1 |    1 |    2 |
|  2 |   32 |    3 |
|  4 |   34 |    3 |
|  6 |   36 |    3 |
| 18 |    6 |    6 |
| 19 |   38 |    3 |
| 21 |   40 |    3 |
+----+------+------+
insert into seq (c2,c3) values (4,3) on duplicate key update c2 = 41;
select * from seq;
+----+------+------+
| c1 | c2   | c3   |
+----+------+------+
|  1 |    1 |    2 |
|  2 |   32 |    3 |
|  4 |   34 |    3 |
|  6 |   36 |    3 |
| 18 |    6 |    6 |
| 19 |   38 |    3 |
| 21 |   40 |    3 |
| 23 |    4 |    3 |
+----+------+------+
insert into seq (c2,c3) values (4,3) on duplicate key update c2 = 42;
select * from seq;
+----+------+------+
| c1 | c2   | c3   |
+----+------+------+
|  1 |    1 |    2 |
|  2 |   32 |    3 |
|  4 |   34 |    3 |
|  6 |   36 |    3 |
| 18 |    6 |    6 |
| 19 |   38 |    3 |
| 21 |   40 |    3 |
| 23 |   42 |    3 |
+----+------+------+
select * from seq;
+----+------+------+
| c1 | c2   | c3   |
+----+------+------+
|  1 |    1 |    2 |
|  2 |   32 |    3 |
|  4 |   34 |    3 |
|  6 |   36 |    3 |
| 18 |    6 |    6 |
| 19 |   38 |    3 |
| 21 |   40 |    3 |
| 23 |   42 |    3 |
+----+------+------+

drop table seq;
