drop table if exists t1;
CREATE TABLE t1 (
gesuchnr int(11) DEFAULT '0' NOT NULL,
benutzer_id int(11) DEFAULT '0' NOT NULL,
PRIMARY KEY (gesuchnr,benutzer_id)
);
replace into t1 (gesuchnr,benutzer_id) values (2,1);
replace into t1 (gesuchnr,benutzer_id) values (1,1);
replace into t1 (gesuchnr,benutzer_id) values (1,1);
replace into t1 (gesuchnr,benutzer_id) values (1,1);
drop table t1;
create table t1 (a tinyint not null auto_increment primary key, b char(20) default "default_value");
insert into t1 values (126,"first"),(63, "middle"),(0,"last");
insert into t1 values (0,"error");
ERROR 23000: Duplicate entry '127' for key 'PRIMARY'
replace into t1 values (0,"error");
replace into t1 values (127,"error");
replace into t1 values (126,"first updated");
replace into t1 values (63,default);
select * from t1;
a	b
63	default_value
126	first updated
127	error
drop table t1;
drop table if exists t1;
drop view if exists v1;
CREATE TABLE t1 (f1 INT primary key);
CREATE VIEW v1 AS SELECT f1 FROM t1 WHERE f1 = 0;
REPLACE INTO t1 (f1) VALUES (1);
select * from v1;
f1
DROP TABLE t1;
DROP VIEW v1;
drop table if exists t1,t2;
create table t1(c1 int primary key, c2 int, c3 int);
replace into t1 set c1 = 3, c2=c1+2, c3=c2+11;
replace into t1 set c3 = 1, c1=c2+3;
ERROR 23000: Column cannot be null
replace into t1 set c3 = 1, c1=c3+3;
select * from t1;
c1	c2	c3
3	5	16
4	NULL	1
create table t2(c1 int primary key, c2 int, c3 int);
replace into t2 select * from t1;
select * from t2;
c1	c2	c3
3	5	16
4	NULL	1
replace into t2 select * from t1;
select * from t2;
c1	c2	c3
3	5	16
4	NULL	1
delete from t2;
replace into t2 (c2,c1) select c1, c1+2 from t1;
select * from t2;
c1	c2	c3
5	3	NULL
6	4	NULL
drop table t1,t2;
