purge recyclebin;
result_format: 4
### 测试环境准备
drop user whh@'%';
drop database whh1;
create user whh identified by 'whh';
create database whh1;
grant all on *.* to whh with grant option;


set @@sql_mode='STRICT_ALL_TABLES';
----------------------------------------------------------------------------------
-------------------------- 标签：schema-1  参数 ----------------------------------
----------------------------------------------------------------------------------
drop table schema_table1;
ERROR 42S02: Unknown table 'whh1.schema_table1'
create table schema_table1(
  id int,
  bases varchar(200),
  txt varchar(200)
);
insert into schema_table1 values(1,'database1','default1'),(2,'database2','default2'),(3,'database3','default3');
### 标签：schema-1-1  参数个数
### 0个参数
select schema(),database();
+----------+------------+
| schema() | database() |
+----------+------------+
| whh1     | whh1       |
+----------+------------+
select schema(),database() from dual;
+----------+------------+
| schema() | database() |
+----------+------------+
| whh1     | whh1       |
+----------+------------+
select schema(),database() from schema_table1;
+----------+------------+
| schema() | database() |
+----------+------------+
| whh1     | whh1       |
| whh1     | whh1       |
| whh1     | whh1       |
+----------+------------+
select schema() database1,database() database2;
+-----------+-----------+
| database1 | database2 |
+-----------+-----------+
| whh1      | whh1      |
+-----------+-----------+
select schema() as database1,database() as database2 from dual;
+-----------+-----------+
| database1 | database2 |
+-----------+-----------+
| whh1      | whh1      |
+-----------+-----------+
select schema(

);
+------------+
| schema(

) |
+------------+
| whh1       |
+------------+
select schema(
) from dual;
+-----------+
| schema(
) |
+-----------+
| whh1      |
+-----------+
select schema;
ERROR 42000: You have an error in your SQL syntax; check the manual that corresponds to your OceanBase version for the right syntax to use near 'schema' at line 1
select schema from dual;
ERROR 42000: You have an error in your SQL syntax; check the manual that corresponds to your OceanBase version for the right syntax to use near 'from dual' at line 1
## 1个参数
select schema(null),database(null) from dual;
ERROR 42000: Incorrect parameter count in the call to native function 'database'
select schema('null'),database('null') from dual;
ERROR 42000: Incorrect parameter count in the call to native function 'database'
select schema('Null'),database('Null') from dual;
ERROR 42000: Incorrect parameter count in the call to native function 'database'
select schema('') from dual;
ERROR 42000: Incorrect parameter count in the call to native function 'database'
select schema(' ') from dual;
ERROR 42000: Incorrect parameter count in the call to native function 'database'
select schema('　') from dual;
ERROR 42000: Incorrect parameter count in the call to native function 'database'
select schema([*()$%]) from dual;
ERROR 42000: You have an error in your SQL syntax; check the manual that corresponds to your OceanBase version for the right syntax to use near '*()$%]) from dual' at line 1
select schema('!@#$%^&*''()_+-=?:;"<>/\{}[]~') from dual;
ERROR 42000: Incorrect parameter count in the call to native function 'database'
select schema(true) from dual;
ERROR 42000: Incorrect parameter count in the call to native function 'database'
select schema(false) from dual;
ERROR 42000: Incorrect parameter count in the call to native function 'database'
select schema('true') from dual;
ERROR 42000: Incorrect parameter count in the call to native function 'database'
select schema('false') from dual;
ERROR 42000: Incorrect parameter count in the call to native function 'database'
select schema(' a王 ') from dual;
ERROR 42000: Incorrect parameter count in the call to native function 'database'
select schema(' ａ王 ') from dual;
ERROR 42000: Incorrect parameter count in the call to native function 'database'
select schema(' 123 ') from dual;
ERROR 42000: Incorrect parameter count in the call to native function 'database'
select schema(' １２３ ') from dual;
ERROR 42000: Incorrect parameter count in the call to native function 'database'
select schema('▲▼●◆■★????????????♂??????√▉▓') from dual;
ERROR 42000: Incorrect parameter count in the call to native function 'database'
select schema('
') from dual;
ERROR 42000: Incorrect parameter count in the call to native function 'database'
select schema('\n') from dual;
ERROR 42000: Incorrect parameter count in the call to native function 'database'
select schema('\r') from dual;
ERROR 42000: Incorrect parameter count in the call to native function 'database'
select schema('\t') from dual;
ERROR 42000: Incorrect parameter count in the call to native function 'database'
select schema(中国) from dual;
ERROR 42000: Incorrect parameter count in the call to native function 'database'
select schema("中国") from dual;
ERROR 42000: Incorrect parameter count in the call to native function 'database'
select schema("中國") from dual;
ERROR 42000: Incorrect parameter count in the call to native function 'database'
select schema(rpad('1',10,'good')) from dual;
ERROR 42000: Incorrect parameter count in the call to native function 'database'
select schema('https://dev.mysql.com/doc/refman/5.7/en/drop-index.html') from dual;
ERROR 42000: Incorrect parameter count in the call to native function 'database'
select schema(' abcd ') from dual;
ERROR 42000: Incorrect parameter count in the call to native function 'database'
select schema(' ABCD ') from dual;
ERROR 42000: Incorrect parameter count in the call to native function 'database'
select schema('wanghuanhuan 1994')from dual;
ERROR 42000: Incorrect parameter count in the call to native function 'database'
select schema(abc123),schema(abc123) from dual;
ERROR 42000: Incorrect parameter count in the call to native function 'database'
select schema(0) from dual;
ERROR 42000: Incorrect parameter count in the call to native function 'database'
select schema(123) from dual;
ERROR 42000: Incorrect parameter count in the call to native function 'database'
select schema(3.1415926) from dual;
ERROR 42000: Incorrect parameter count in the call to native function 'database'
select schema(-123456) from dual;
ERROR 42000: Incorrect parameter count in the call to native function 'database'
select schema("-123456.789456465") from dual;
ERROR 42000: Incorrect parameter count in the call to native function 'database'
select schema('1.99714E13') from dual;
ERROR 42000: Incorrect parameter count in the call to native function 'database'
select schema(1.99714E13) from dual;
ERROR 42000: Incorrect parameter count in the call to native function 'database'
select schema(-1.23-1) from dual;
ERROR 42000: Incorrect parameter count in the call to native function 'database'
select schema(+1.23-1) from dual;
ERROR 42000: Incorrect parameter count in the call to native function 'database'
select schema(10) from dual;
ERROR 42000: Incorrect parameter count in the call to native function 'database'
select schema(1+2+3+4) from dual;
ERROR 42000: Incorrect parameter count in the call to native function 'database'
select schema(11-1) from dual;
ERROR 42000: Incorrect parameter count in the call to native function 'database'
select schema(2*5) from dual;
ERROR 42000: Incorrect parameter count in the call to native function 'database'
select schema(20/2) from dual;
ERROR 42000: Incorrect parameter count in the call to native function 'database'
select schema(1 & 2 | !3 ) from dual;
ERROR 42000: Incorrect parameter count in the call to native function 'database'
select schema('2022-03-11 15:32:22') from dual;
ERROR 42000: Incorrect parameter count in the call to native function 'database'
select schema(sysdate()) from dual;
ERROR 42000: Incorrect parameter count in the call to native function 'database'
select schema('こんにちは') from dual;
ERROR 42000: Incorrect parameter count in the call to native function 'database'
select schema('안녕하세요') from dual;
ERROR 42000: Incorrect parameter count in the call to native function 'database'
## 多个参数
select schema(,1) from dual;
ERROR 42000: You have an error in your SQL syntax; check the manual that corresponds to your OceanBase version for the right syntax to use near ',1) from dual' at line 1
select schema(1,2) from dual;
ERROR 42000: Incorrect parameter count in the call to native function 'database'
select schema('1','2','3') from dual;
ERROR 42000: Incorrect parameter count in the call to native function 'database'
select schema(1,2,3,4) from dual;
ERROR 42000: Incorrect parameter count in the call to native function 'database'
### 标签：schema-1-2 参数类型
## 数值类型
DROP TABLE schema_table1;
CREATE TABLE schema_table1( 
  c1 tinyint, 
  c2 smallint,
  c3 mediumint, 
  c4 int, 
  c5 bigint, 
  c6 float, 
  c7 double, 
  c8 DECIMAL(5,2), 
  c9 bit(10)
);
select schema(c1) from schema_table1;
ERROR 42000: Incorrect parameter count in the call to native function 'database'
select schema(c2) from schema_table1;
ERROR 42000: Incorrect parameter count in the call to native function 'database'
select schema(c3) from schema_table1;
ERROR 42000: Incorrect parameter count in the call to native function 'database'
select schema(c4) from schema_table1;
ERROR 42000: Incorrect parameter count in the call to native function 'database'
select schema(c5) from schema_table1;
ERROR 42000: Incorrect parameter count in the call to native function 'database'
select schema(c6) from schema_table1;
ERROR 42000: Incorrect parameter count in the call to native function 'database'
select schema(c7) from schema_table1;
ERROR 42000: Incorrect parameter count in the call to native function 'database'
select schema(c8) from schema_table1;
ERROR 42000: Incorrect parameter count in the call to native function 'database'
select schema(c9) from schema_table1;
ERROR 42000: Incorrect parameter count in the call to native function 'database'
insert into schema_table1 values(127,32767,8388607,2147483647,12345678912345678,1.1111,123.1231123,1.1,b'1000001');
select schema(c1) from schema_table1;
ERROR 42000: Incorrect parameter count in the call to native function 'database'
select schema(c2) from schema_table1;
ERROR 42000: Incorrect parameter count in the call to native function 'database'
select schema(c3) from schema_table1;
ERROR 42000: Incorrect parameter count in the call to native function 'database'
select schema(c4) from schema_table1;
ERROR 42000: Incorrect parameter count in the call to native function 'database'
select schema(c5) from schema_table1;
ERROR 42000: Incorrect parameter count in the call to native function 'database'
select schema(c6) from schema_table1;
ERROR 42000: Incorrect parameter count in the call to native function 'database'
select schema(c7) from schema_table1;
ERROR 42000: Incorrect parameter count in the call to native function 'database'
select schema(c8) from schema_table1;
ERROR 42000: Incorrect parameter count in the call to native function 'database'
select schema(c9) from schema_table1;
ERROR 42000: Incorrect parameter count in the call to native function 'database'
insert into schema_table1 values(null,null,null,null,null,null,null,null,null);
insert into schema_table1 values(0,0,0,0,0,0,0,0,0);
insert into schema_table1 values(-128,-32768,-8388608,-2147483648,-2147483648,0.0,0.00,0.0,0);
insert into schema_table1 values(1,32000,8388601,2147483641,12345678912345671,1.1111,123.1231121,1.1,b'11');
insert into schema_table1 values(2,32001,8388602,2147483642,12345678912345672,1.1112,123.1231122,1.2,b'10');
insert into schema_table1 values(3,32002,8388603,2147483643,12345678912345673,1.1113,123.1231123,1.3,b'01');
insert into schema_table1 values(4,32003,8388604,2147483644,12345678912345674,1.1114,123.1231124,1.4,b'1000001');
select schema(c1) from schema_table1;
ERROR 42000: Incorrect parameter count in the call to native function 'database'
select schema(c2) from schema_table1;
ERROR 42000: Incorrect parameter count in the call to native function 'database'
select schema(c3) from schema_table1;
ERROR 42000: Incorrect parameter count in the call to native function 'database'
select schema(c4) from schema_table1;
ERROR 42000: Incorrect parameter count in the call to native function 'database'
select schema(c5) from schema_table1;
ERROR 42000: Incorrect parameter count in the call to native function 'database'
select schema(c6) from schema_table1;
ERROR 42000: Incorrect parameter count in the call to native function 'database'
select schema(c7) from schema_table1;
ERROR 42000: Incorrect parameter count in the call to native function 'database'
select schema(c8) from schema_table1;
ERROR 42000: Incorrect parameter count in the call to native function 'database'
select schema(c9) from schema_table1;
ERROR 42000: Incorrect parameter count in the call to native function 'database'
### 标签：schema-1-1，schema-1-2  schema(str)/schema1(str), schema2(str, hash_length)
## 参数 - 参数类型 - 字符串类型
DROP TABLE schema_table1;
CREATE TABLE schema_table1( 
  c1 CHAR(10), 
  c2 VARCHAR(100), 
  c3 BLOB(100), 
  c4 TEXT, 
  c5 BINARY(100),
  c6 VARBINARY(100), 
  c7 ENUM('星期一', '星期二', '星期三', '星期四', '星期五', '星期六'), 
  c8 SET('a', 'b', 'c', 'd', 'e')
)default character set = 'utf8mb4';
select schema(c1) from schema_table1;
ERROR 42000: Incorrect parameter count in the call to native function 'database'
select schema(c2) from schema_table1;
ERROR 42000: Incorrect parameter count in the call to native function 'database'
select schema(c3) from schema_table1;
ERROR 42000: Incorrect parameter count in the call to native function 'database'
select schema(c4) from schema_table1;
ERROR 42000: Incorrect parameter count in the call to native function 'database'
select schema(c5) from schema_table1;
ERROR 42000: Incorrect parameter count in the call to native function 'database'
select schema(c6) from schema_table1;
ERROR 42000: Incorrect parameter count in the call to native function 'database'
select schema(c7) from schema_table1;
ERROR 42000: Incorrect parameter count in the call to native function 'database'
select schema(c8) from schema_table1;
ERROR 42000: Incorrect parameter count in the call to native function 'database'
insert into schema_table1 values('char-类型','VARCHAR-类型',0x01020304FFFFFFFF0000000CAACB0000,'TEXT-类型','BINARY-类型','VARBINARY-类型','星期一','a,b,c');
select schema(c1) from schema_table1;
ERROR 42000: Incorrect parameter count in the call to native function 'database'
select schema(c2) from schema_table1;
ERROR 42000: Incorrect parameter count in the call to native function 'database'
select schema(c3) from schema_table1;
ERROR 42000: Incorrect parameter count in the call to native function 'database'
select schema(c4) from schema_table1;
ERROR 42000: Incorrect parameter count in the call to native function 'database'
select schema(c5) from schema_table1;
ERROR 42000: Incorrect parameter count in the call to native function 'database'
select schema(c6) from schema_table1;
ERROR 42000: Incorrect parameter count in the call to native function 'database'
select schema(c7) from schema_table1;
ERROR 42000: Incorrect parameter count in the call to native function 'database'
select schema(c8) from schema_table1;
ERROR 42000: Incorrect parameter count in the call to native function 'database'
insert into schema_table1 values(null,null,null,null,null,null,null,null);
insert into schema_table1 values(0,0,0,0,0,0,'星期四',0);
insert into schema_table1 values(' 杭州',' 西湖asdfghjkl',0x01020304FFFFFFFF0000000CAACB0001,' TEXT-类型：函数schema测试-数据类型用例编写',' BINARY-类型:自动化测试',' VARBINARY-类型: 等价类划分','星期二','a,b');
insert into schema_table1 values('杭 州','西湖 asdfghjkl',0x01020304FFFFFFFF0000000CAACB0002,'TEXT-类型： 函数schema测试-数据类型用例编写','BINARY-类型: 自动化测试','VARBINARY -类型: 等价类划分','星期三','a,c');
insert into schema_table1 values('杭州 ','西湖asdfghjkl ',0x01020304FFFFFFFF0000000CAACB0003,'TEXT-类型：函数schema测试-数据类型用例编写 ','BINARY-类型:自动化测试 ','VARBINARY-类型: 等价类划分 ','星期四','a,b,c');
insert into schema_table1 values('杭州!@$%','西湖asdfghjkl!@#$%',0x01020304FFFFFFFF0000000CAACB0004,'TEXT-类型：函数schema测试-数据类型用例编写！@#￥%……','BINARY-类型:自动化测试!@#$%^','VARBINARY-类型: 等价类划分{}：“《》？*&……%￥','星期五','b,c');
insert into schema_table1 values('杭州^&*(','西湖asdfghjkl^&*()_+',0x01020304FFFFFFFF0000000CAACB0005,'TEXT-类型：函数schema测试-数据类型用例编写，。、；【】','BINARY-类型:自动化测试&*()_+','VARBINARY-类型: 等价类划分^%#@#*&','星期六','a,b,c,d');
select schema(c1) from schema_table1;
ERROR 42000: Incorrect parameter count in the call to native function 'database'
select schema(c2) from schema_table1;
ERROR 42000: Incorrect parameter count in the call to native function 'database'
select schema(c3) from schema_table1;
ERROR 42000: Incorrect parameter count in the call to native function 'database'
select schema(c4) from schema_table1;
ERROR 42000: Incorrect parameter count in the call to native function 'database'
select schema(c5) from schema_table1;
ERROR 42000: Incorrect parameter count in the call to native function 'database'
select schema(c6) from schema_table1;
ERROR 42000: Incorrect parameter count in the call to native function 'database'
select schema(c7) from schema_table1;
ERROR 42000: Incorrect parameter count in the call to native function 'database'
select schema(c8) from schema_table1;
ERROR 42000: Incorrect parameter count in the call to native function 'database'
### 标签：schema-1-2 参数类型
## 参数 - 参数类型 - 日期时间类型
DROP TABLE schema_table1;
CREATE TABLE schema_table1( 
  c1 date, 
  c2 time, 
  c3 year, 
  c4 datetime, 
  c5 timestamp, 
  c6 json
);
select schema(c1) from schema_table1;
ERROR 42000: Incorrect parameter count in the call to native function 'database'
select schema(c2) from schema_table1;
ERROR 42000: Incorrect parameter count in the call to native function 'database'
select schema(c3) from schema_table1;
ERROR 42000: Incorrect parameter count in the call to native function 'database'
select schema(c4) from schema_table1;
ERROR 42000: Incorrect parameter count in the call to native function 'database'
select schema(c5) from schema_table1;
ERROR 42000: Incorrect parameter count in the call to native function 'database'
select schema(c6) from schema_table1;
ERROR 42000: Incorrect parameter count in the call to native function 'database'
insert into schema_table1 values('9999-12-31','23:59:59.99999999','2022','2022-12-31 23:59:59.999999','2022-01-01 03:26:07.999999','{"a":1,"b":1}');
select schema(c1) from schema_table1;
ERROR 42000: Incorrect parameter count in the call to native function 'database'
select schema(c2) from schema_table1;
ERROR 42000: Incorrect parameter count in the call to native function 'database'
select schema(c3) from schema_table1;
ERROR 42000: Incorrect parameter count in the call to native function 'database'
select schema(c4) from schema_table1;
ERROR 42000: Incorrect parameter count in the call to native function 'database'
select schema(c5) from schema_table1;
ERROR 42000: Incorrect parameter count in the call to native function 'database'
select schema(c6) from schema_table1;
ERROR 42000: Incorrect parameter count in the call to native function 'database'
insert into schema_table1 values(null,null,null,null,null,null);
insert into schema_table1 values(0,0,0,0,0,'"hello"');
insert into schema_table1 values('2018-12-31','10:59:59.000000','2018','2018-12-31 23:59:59.999999','2018-01-19 03:14:07.999999','{"a":2,"b":2}');
insert into schema_table1 values('2019-12-31','11:59:59.000000','2019','2019-12-31 23:59:59.999999','2019-01-19 03:14:07.999999','{"a":3,"b":3}');
insert into schema_table1 values('2020-12-31','12:59:59.000000','2020','2020-12-31 23:59:59.999999','2020-01-19 03:14:07.999999','{"a":4,"b":4}');
insert into schema_table1 values('2021-12-31','13:59:59.000000','2021','2021-12-31 23:59:59.999999','2021-01-19 03:14:07.999999','{"a":5,"b":5}');
insert into schema_table1 values('2022-12-31','14:59:59.000000','2022','2022-12-31 23:59:59.999999','2022-01-19 03:14:07.999999','{"a":6,"b":6}');
select schema(c1) from schema_table1;
ERROR 42000: Incorrect parameter count in the call to native function 'database'
select schema(c2) from schema_table1;
ERROR 42000: Incorrect parameter count in the call to native function 'database'
select schema(c3) from schema_table1;
ERROR 42000: Incorrect parameter count in the call to native function 'database'
select schema(c4) from schema_table1;
ERROR 42000: Incorrect parameter count in the call to native function 'database'
select schema(c5) from schema_table1;
ERROR 42000: Incorrect parameter count in the call to native function 'database'
select schema(c6) from schema_table1;
ERROR 42000: Incorrect parameter count in the call to native function 'database'
### 标签：schema-1-3 字符集
## binary
alter database whh1 charset=binary;
select schema() from dual;
+----------+
| schema() |
+----------+
| whh1     |
+----------+
drop table schema_table1;
create table schema_table1(
  id int,
  database1 varchar(200)
)default character set = 'binary';
insert into schema_table1 values(1, null ),( 2,0 ),(3,schema());
select * from schema_table1;
+------+-----------+
| id   | database1 |
+------+-----------+
|    1 | NULL      |
|    2 | 0         |
|    3 | whh1      |
+------+-----------+
## utf8mb4
alter database whh1 charset=utf8mb4;
select schema() from dual;
+----------+
| schema() |
+----------+
| whh1     |
+----------+
drop table schema_table1;
create table schema_table1(
  id int,
  database1 varchar(200)
)default character set = 'utf8mb4';
insert into schema_table1 values(1, null ),( 2,0 ),(3,schema());
select * from schema_table1;
+------+-----------+
| id   | database1 |
+------+-----------+
|    1 | NULL      |
|    2 | 0         |
|    3 | whh1      |
+------+-----------+
## gbk
alter database whh1 charset=gbk;
select schema() from dual;
+----------+
| schema() |
+----------+
| whh1     |
+----------+
drop table schema_table1;
create table schema_table1(
  id int,
  database1 varchar(200)
)default character set = 'gbk';
insert into schema_table1 values(1, null ),( 2,0 ),(3,schema());
select * from schema_table1;
+------+-----------+
| id   | database1 |
+------+-----------+
|    1 | NULL      |
|    2 | 0         |
|    3 | whh1      |
+------+-----------+
## gb18030
alter database whh1 charset=gb18030;
select schema() from dual;
+----------+
| schema() |
+----------+
| whh1     |
+----------+
drop table schema_table1;
create table schema_table1(
  id int,
  database1 varchar(200)
)default character set = 'gb18030';
insert into schema_table1 values(1, null ),( 2,0 ),(3,schema());
select * from schema_table1;
+------+-----------+
| id   | database1 |
+------+-----------+
|    1 | NULL      |
|    2 | 0         |
|    3 | whh1      |
+------+-----------+
------------------------------------------------------------------------------------------
-------------------------- 用例：schema-2  sql -------------------------------------------
------------------------------------------------------------------------------------------
drop table schema_table1;
create table schema_table1(
  id int, 
  name varchar(100), 
  database1 varchar(100),
  primary key (id)
);
insert into schema_table1 values(1,'洋洋','whh1'),(2,'慧慧','whh2'),(3,'萌萌','whh3'),(4,'洋洋','whh1');
insert into schema_table1 values(5,'康康','whhtest'),(6,'宁宁','whhtest1'),(7,'洋洋','whhtest2'),(8,'康康','whhtest');
drop table schema_table2;
create table schema_table2(
  id int,
  fun varchar(200)
);
insert into schema_table2 values(1,'schema()'),(2,'sha()'),(3,'compress()');
insert into schema_table2 values(4,'year()'),(5,'week()'),(6,'to_data()');
### 标签：schema-2-1 select
##多列/单列
select  schema() from schema_table1 order by id;
+----------+
| schema() |
+----------+
| whh1     |
| whh1     |
| whh1     |
| whh1     |
| whh1     |
| whh1     |
| whh1     |
| whh1     |
+----------+
select concat(schema(),id,name) from schema_table1 order by id;
+--------------------------+
| concat(schema(),id,name) |
+--------------------------+
| whh11洋洋                |
| whh12慧慧                |
| whh13萌萌                |
| whh14洋洋                |
| whh15康康                |
| whh16宁宁                |
| whh17洋洋                |
| whh18康康                |
+--------------------------+
##from 表 - 分区表(schema()函数作为分区键)
drop table schema_table5;
create table schema_table5 (
  n0 tinyint, 
  n1 int, 
  n2 varchar(200)
)
partition by range (schema())
(partition p0 values less than (1),
 partition p1 values less than (2),
 partition p2 values less than maxvalue);
ERROR HY000: Constant or random or timezone-dependent expressions in (sub)partitioning function are not allowed
##from 表 - 分区表(schema()函数作为list分区范围值)
drop table schema_table5;
create table schema_table5 (
  n0 tinyint, 
  n1 int, 
  n2 varchar(200)
)
partition by list (n1)
(partition p0 values in (schema()),
 partition p1 values in (1,3,5),
 partition p2 values in (2,4,6));
ERROR HY000: This partition function is not allowed
##from 表 - 分区表
drop table schema_table5;
create table schema_table5 (
  n0 tinyint, 
  n1 int, 
  n2 varchar(200)
)
partition by list (n1)
(partition p0 values in (7),
 partition p1 values in (1,3,5),
 partition p2 values in (2,4,6));
insert into schema_table5 values(1,2,'分区表1'),(3,4,'分区表1');
select schema() from schema_table5 order by n0;
+----------+
| schema() |
+----------+
| whh1     |
| whh1     |
+----------+
##from 表 - 虚拟表
select schema() from dual;
+----------+
| schema() |
+----------+
| whh1     |
+----------+
select schema() from dual where schema() != '';
+----------+
| schema() |
+----------+
| whh1     |
+----------+
##from 表 - 普通表 - schema()作为表中字段的default默认值 (mysql 8.0支持列default值为表达式，ob目前只有oracle模式支持，mysql模式不支持的。)
drop table schema_default;
create table schema_default(
  id int,
  bases varchar(200) default (database()),
  txt varchar(200)
);
insert into schema_default(id) values(1),(2),(3),(4);
select * from schema_default order by id;
+------+-------+------+
| id   | bases | txt  |
+------+-------+------+
|    1 | whh1  | NULL |
|    2 | whh1  | NULL |
|    3 | whh1  | NULL |
|    4 | whh1  | NULL |
+------+-------+------+
##from 表 - 普通表
select id,name,database1,schema() from schema_table1;
+----+--------+-----------+----------+
| id | name   | database1 | schema() |
+----+--------+-----------+----------+
|  1 | 洋洋   | whh1      | whh1     |
|  2 | 慧慧   | whh2      | whh1     |
|  3 | 萌萌   | whh3      | whh1     |
|  4 | 洋洋   | whh1      | whh1     |
|  5 | 康康   | whhtest   | whh1     |
|  6 | 宁宁   | whhtest1  | whh1     |
|  7 | 洋洋   | whhtest2  | whh1     |
|  8 | 康康   | whhtest   | whh1     |
+----+--------+-----------+----------+
select id,name,database1,schema() from schema_table1 where database1 like schema() order by id;
+----+--------+-----------+----------+
| id | name   | database1 | schema() |
+----+--------+-----------+----------+
|  1 | 洋洋   | whh1      | whh1     |
|  4 | 洋洋   | whh1      | whh1     |
+----+--------+-----------+----------+
##where 子句
select id,name,database1,schema() from schema_table1 where database1 >= schema() order by id;
+----+--------+-----------+----------+
| id | name   | database1 | schema() |
+----+--------+-----------+----------+
|  1 | 洋洋   | whh1      | whh1     |
|  2 | 慧慧   | whh2      | whh1     |
|  3 | 萌萌   | whh3      | whh1     |
|  4 | 洋洋   | whh1      | whh1     |
|  5 | 康康   | whhtest   | whh1     |
|  6 | 宁宁   | whhtest1  | whh1     |
|  7 | 洋洋   | whhtest2  | whh1     |
|  8 | 康康   | whhtest   | whh1     |
+----+--------+-----------+----------+
select id,name,database1,schema() from schema_table1 where database1 like schema() order by id;
+----+--------+-----------+----------+
| id | name   | database1 | schema() |
+----+--------+-----------+----------+
|  1 | 洋洋   | whh1      | whh1     |
|  4 | 洋洋   | whh1      | whh1     |
+----+--------+-----------+----------+
##order by 子句
select id,name,database1,schema() from schema_table1 where database1 >= schema() order by schema() asc,id;
+----+--------+-----------+----------+
| id | name   | database1 | schema() |
+----+--------+-----------+----------+
|  1 | 洋洋   | whh1      | whh1     |
|  2 | 慧慧   | whh2      | whh1     |
|  3 | 萌萌   | whh3      | whh1     |
|  4 | 洋洋   | whh1      | whh1     |
|  5 | 康康   | whhtest   | whh1     |
|  6 | 宁宁   | whhtest1  | whh1     |
|  7 | 洋洋   | whhtest2  | whh1     |
|  8 | 康康   | whhtest   | whh1     |
+----+--------+-----------+----------+
select id,name,database1,schema() from schema_table1 where database1 >= schema() order by schema() desc,id;
+----+--------+-----------+----------+
| id | name   | database1 | schema() |
+----+--------+-----------+----------+
|  1 | 洋洋   | whh1      | whh1     |
|  2 | 慧慧   | whh2      | whh1     |
|  3 | 萌萌   | whh3      | whh1     |
|  4 | 洋洋   | whh1      | whh1     |
|  5 | 康康   | whhtest   | whh1     |
|  6 | 宁宁   | whhtest1  | whh1     |
|  7 | 洋洋   | whhtest2  | whh1     |
|  8 | 康康   | whhtest   | whh1     |
+----+--------+-----------+----------+
##group by having 子句
select id,name,database1,schema() from schema_table1 where database1 <= schema() group by schema() order by id ;
+----+--------+-----------+----------+
| id | name   | database1 | schema() |
+----+--------+-----------+----------+
|  1 | 洋洋   | whh1      | whh1     |
+----+--------+-----------+----------+
select id,name,database1,schema() from schema_table1 where database1 <= schema() group by schema(),id having database1 >= schema() order by id;
+----+--------+-----------+----------+
| id | name   | database1 | schema() |
+----+--------+-----------+----------+
|  1 | 洋洋   | whh1      | whh1     |
|  4 | 洋洋   | whh1      | whh1     |
+----+--------+-----------+----------+
#distinct
select distinct schema(),id,name,database1 from schema_table1 order by id;
+----------+----+--------+-----------+
| schema() | id | name   | database1 |
+----------+----+--------+-----------+
| whh1     |  1 | 洋洋   | whh1      |
| whh1     |  2 | 慧慧   | whh2      |
| whh1     |  3 | 萌萌   | whh3      |
| whh1     |  4 | 洋洋   | whh1      |
| whh1     |  5 | 康康   | whhtest   |
| whh1     |  6 | 宁宁   | whhtest1  |
| whh1     |  7 | 洋洋   | whhtest2  |
| whh1     |  8 | 康康   | whhtest   |
+----------+----+--------+-----------+
select distinct schema(),id,name,database1 from schema_table1 where database1 != schema() order by id;
+----------+----+--------+-----------+
| schema() | id | name   | database1 |
+----------+----+--------+-----------+
| whh1     |  2 | 慧慧   | whh2      |
| whh1     |  3 | 萌萌   | whh3      |
| whh1     |  5 | 康康   | whhtest   |
| whh1     |  6 | 宁宁   | whhtest1  |
| whh1     |  7 | 洋洋   | whhtest2  |
| whh1     |  8 | 康康   | whhtest   |
+----------+----+--------+-----------+
#case when
select id,name,database1,schema(),case when database1 < schema() then 'database1 < schema()' else 'database1 >= schema()' end case_when from schema_table1 order by id;
+----+--------+-----------+----------+-----------------------+
| id | name   | database1 | schema() | case_when             |
+----+--------+-----------+----------+-----------------------+
|  1 | 洋洋   | whh1      | whh1     | database1 >= schema() |
|  2 | 慧慧   | whh2      | whh1     | database1 >= schema() |
|  3 | 萌萌   | whh3      | whh1     | database1 >= schema() |
|  4 | 洋洋   | whh1      | whh1     | database1 >= schema() |
|  5 | 康康   | whhtest   | whh1     | database1 >= schema() |
|  6 | 宁宁   | whhtest1  | whh1     | database1 >= schema() |
|  7 | 洋洋   | whhtest2  | whh1     | database1 >= schema() |
|  8 | 康康   | whhtest   | whh1     | database1 >= schema() |
+----+--------+-----------+----------+-----------------------+
select id,name,database1,schema(),case database1 when schema() then 'database1 = schema()' else 'database1 != schema()' end case_when from schema_table1 order by id;
+----+--------+-----------+----------+-----------------------+
| id | name   | database1 | schema() | case_when             |
+----+--------+-----------+----------+-----------------------+
|  1 | 洋洋   | whh1      | whh1     | database1 = schema()  |
|  2 | 慧慧   | whh2      | whh1     | database1 != schema() |
|  3 | 萌萌   | whh3      | whh1     | database1 != schema() |
|  4 | 洋洋   | whh1      | whh1     | database1 = schema()  |
|  5 | 康康   | whhtest   | whh1     | database1 != schema() |
|  6 | 宁宁   | whhtest1  | whh1     | database1 != schema() |
|  7 | 洋洋   | whhtest2  | whh1     | database1 != schema() |
|  8 | 康康   | whhtest   | whh1     | database1 != schema() |
+----+--------+-----------+----------+-----------------------+
#select ...into 
select schema() into @p1 from dual;
select concat(id,name,database1,schema()) into @p2 from schema_table1 where database1 = schema() limit 1;
select schema() into @p3 from schema_table1 where database1 < schema() and id < 2 order by id;
select @p1,@p2,@p3;
+------+-----------------+------+
| @p1  | @p2             | @p3  |
+------+-----------------+------+
| whh1 | 1洋洋whh1whh1   | NULL |
+------+-----------------+------+
##连接查询
select e.id,e.name,e.database1,p.fun,schema() from schema_table1 e, schema_table2 p where e.id = p.id and e.database1 >= schema() order by e.id desc;
+----+--------+-----------+------------+----------+
| id | name   | database1 | fun        | schema() |
+----+--------+-----------+------------+----------+
|  6 | 宁宁   | whhtest1  | to_data()  | whh1     |
|  5 | 康康   | whhtest   | week()     | whh1     |
|  4 | 洋洋   | whh1      | year()     | whh1     |
|  3 | 萌萌   | whh3      | compress() | whh1     |
|  2 | 慧慧   | whh2      | sha()      | whh1     |
|  1 | 洋洋   | whh1      | schema()   | whh1     |
+----+--------+-----------+------------+----------+
select e.id,e.name,e.database1,p.fun,schema() from schema_table1 e left join schema_table2 p on e.id = p.id where e.database1 >= schema() order by e.id desc;
+----+--------+-----------+------------+----------+
| id | name   | database1 | fun        | schema() |
+----+--------+-----------+------------+----------+
|  8 | 康康   | whhtest   | NULL       | whh1     |
|  7 | 洋洋   | whhtest2  | NULL       | whh1     |
|  6 | 宁宁   | whhtest1  | to_data()  | whh1     |
|  5 | 康康   | whhtest   | week()     | whh1     |
|  4 | 洋洋   | whh1      | year()     | whh1     |
|  3 | 萌萌   | whh3      | compress() | whh1     |
|  2 | 慧慧   | whh2      | sha()      | whh1     |
|  1 | 洋洋   | whh1      | schema()   | whh1     |
+----+--------+-----------+------------+----------+
select e.id,e.name,e.database1,p.fun,schema() from schema_table1 e right join schema_table2 p on e.id = p.id where e.database1 >= schema() order by e.id desc;
+----+--------+-----------+------------+----------+
| id | name   | database1 | fun        | schema() |
+----+--------+-----------+------------+----------+
|  6 | 宁宁   | whhtest1  | to_data()  | whh1     |
|  5 | 康康   | whhtest   | week()     | whh1     |
|  4 | 洋洋   | whh1      | year()     | whh1     |
|  3 | 萌萌   | whh3      | compress() | whh1     |
|  2 | 慧慧   | whh2      | sha()      | whh1     |
|  1 | 洋洋   | whh1      | schema()   | whh1     |
+----+--------+-----------+------------+----------+
select e.id,e.name,e.database1,p.fun,schema() from schema_table1 e inner join schema_table2 p on e.id = p.id where e.database1 >= schema() order by e.id desc;
+----+--------+-----------+------------+----------+
| id | name   | database1 | fun        | schema() |
+----+--------+-----------+------------+----------+
|  6 | 宁宁   | whhtest1  | to_data()  | whh1     |
|  5 | 康康   | whhtest   | week()     | whh1     |
|  4 | 洋洋   | whh1      | year()     | whh1     |
|  3 | 萌萌   | whh3      | compress() | whh1     |
|  2 | 慧慧   | whh2      | sha()      | whh1     |
|  1 | 洋洋   | whh1      | schema()   | whh1     |
+----+--------+-----------+------------+----------+
##select嵌套
#SELECT
select t.id,t.name,t.database1,t.fun,schema() from (select e.id,e.name,e.database1,p.fun,schema() from schema_table1 e, schema_table2 p where e.id = p.id) t order by t.id;
+----+--------+-----------+------------+----------+
| id | name   | database1 | fun        | schema() |
+----+--------+-----------+------------+----------+
|  1 | 洋洋   | whh1      | schema()   | whh1     |
|  2 | 慧慧   | whh2      | sha()      | whh1     |
|  3 | 萌萌   | whh3      | compress() | whh1     |
|  4 | 洋洋   | whh1      | year()     | whh1     |
|  5 | 康康   | whhtest   | week()     | whh1     |
|  6 | 宁宁   | whhtest1  | to_data()  | whh1     |
+----+--------+-----------+------------+----------+
select t.id,t.name,t.database1,schema() from schema_table1 t where t.database1 in (select e.database1 from schema_table1 e, schema_table2 p where e.id = p.id) order by t.id;
+----+--------+-----------+----------+
| id | name   | database1 | schema() |
+----+--------+-----------+----------+
|  1 | 洋洋   | whh1      | whh1     |
|  2 | 慧慧   | whh2      | whh1     |
|  3 | 萌萌   | whh3      | whh1     |
|  4 | 洋洋   | whh1      | whh1     |
|  5 | 康康   | whhtest   | whh1     |
|  6 | 宁宁   | whhtest1  | whh1     |
|  8 | 康康   | whhtest   | whh1     |
+----+--------+-----------+----------+
#EXISTS AND NOT EXISTS
select id,name,database1,schema() from schema_table1 e where exists (select e.id,e.name,e.database1,p.fun,schema() from schema_table1 e inner join schema_table2 p on e.id = p.id where e.database1 >= schema()) order by id;
+----+--------+-----------+----------+
| id | name   | database1 | schema() |
+----+--------+-----------+----------+
|  1 | 洋洋   | whh1      | whh1     |
|  2 | 慧慧   | whh2      | whh1     |
|  3 | 萌萌   | whh3      | whh1     |
|  4 | 洋洋   | whh1      | whh1     |
|  5 | 康康   | whhtest   | whh1     |
|  6 | 宁宁   | whhtest1  | whh1     |
|  7 | 洋洋   | whhtest2  | whh1     |
|  8 | 康康   | whhtest   | whh1     |
+----+--------+-----------+----------+
select id,name,database1,schema() from schema_table1 e where not exists (select e.id,e.name,e.database1,p.fun,schema() from schema_table1 e inner join schema_table2 p on e.id = p.id where e.database1 = schema() and e.id < 2) order by id;
+----+------+-----------+----------+
| id | name | database1 | schema() |
+----+------+-----------+----------+
+----+------+-----------+----------+
#any
select id,name,database1,schema() from schema_table1 e where schema() = any (select distinct e.database1 from schema_table1 e left join schema_table2 p on e.id = p.id where e.database1 >= schema()) order by e.id;
+----+--------+-----------+----------+
| id | name   | database1 | schema() |
+----+--------+-----------+----------+
|  1 | 洋洋   | whh1      | whh1     |
|  2 | 慧慧   | whh2      | whh1     |
|  3 | 萌萌   | whh3      | whh1     |
|  4 | 洋洋   | whh1      | whh1     |
|  5 | 康康   | whhtest   | whh1     |
|  6 | 宁宁   | whhtest1  | whh1     |
|  7 | 洋洋   | whhtest2  | whh1     |
|  8 | 康康   | whhtest   | whh1     |
+----+--------+-----------+----------+
select id,name,database1,schema() from schema_table1 e where schema() < any (select distinct e.database1 from schema_table1 e left join schema_table2 p on e.id = p.id where e.database1 >= schema()) order by e.id;
+----+--------+-----------+----------+
| id | name   | database1 | schema() |
+----+--------+-----------+----------+
|  1 | 洋洋   | whh1      | whh1     |
|  2 | 慧慧   | whh2      | whh1     |
|  3 | 萌萌   | whh3      | whh1     |
|  4 | 洋洋   | whh1      | whh1     |
|  5 | 康康   | whhtest   | whh1     |
|  6 | 宁宁   | whhtest1  | whh1     |
|  7 | 洋洋   | whhtest2  | whh1     |
|  8 | 康康   | whhtest   | whh1     |
+----+--------+-----------+----------+
select id,name,database1,schema() from schema_table1 e where schema() > any (select distinct e.database1 from schema_table1 e left join schema_table2 p on e.id = p.id where e.database1 >= schema()) order by e.id;
+----+------+-----------+----------+
| id | name | database1 | schema() |
+----+------+-----------+----------+
+----+------+-----------+----------+
#all                                                                                    
select id,name,database1,schema() from schema_table1 e where schema() = all (select distinct e.database1 from schema_table1 e left join schema_table2 p on e.id = p.id where e.database1 >= schema()) order by e.id;
+----+------+-----------+----------+
| id | name | database1 | schema() |
+----+------+-----------+----------+
+----+------+-----------+----------+
select id,name,database1,schema() from schema_table1 e where schema() < all (select distinct e.database1 from schema_table1 e left join schema_table2 p on e.id = p.id where e.database1 >= schema()) order by e.id;
+----+------+-----------+----------+
| id | name | database1 | schema() |
+----+------+-----------+----------+
+----+------+-----------+----------+
select id,name,database1,schema() from schema_table1 e where schema() > all (select distinct e.database1 from schema_table1 e left join schema_table2 p on e.id = p.id where e.database1 >= schema()) order by e.id;
+----+------+-----------+----------+
| id | name | database1 | schema() |
+----+------+-----------+----------+
+----+------+-----------+----------+
#create as
drop table schema_table3;
create table schema_table3 as select id,name,database1,schema() from schema_table1 where database1>schema();
select * from schema_table3 order by id;
+----+--------+-----------+----------+
| id | name   | database1 | schema() |
+----+--------+-----------+----------+
|  2 | 慧慧   | whh2      | whh1     |
|  3 | 萌萌   | whh3      | whh1     |
|  5 | 康康   | whhtest   | whh1     |
|  6 | 宁宁   | whhtest1  | whh1     |
|  7 | 洋洋   | whhtest2  | whh1     |
|  8 | 康康   | whhtest   | whh1     |
+----+--------+-----------+----------+
#insert into select
insert into schema_table3 select id,name,database1,schema() from schema_table1 where database1=schema();
select * from schema_table3 order by id;
+----+--------+-----------+----------+
| id | name   | database1 | schema() |
+----+--------+-----------+----------+
|  1 | 洋洋   | whh1      | whh1     |
|  2 | 慧慧   | whh2      | whh1     |
|  3 | 萌萌   | whh3      | whh1     |
|  4 | 洋洋   | whh1      | whh1     |
|  5 | 康康   | whhtest   | whh1     |
|  6 | 宁宁   | whhtest1  | whh1     |
|  7 | 洋洋   | whhtest2  | whh1     |
|  8 | 康康   | whhtest   | whh1     |
+----+--------+-----------+----------+
#update set
update schema_table3 e inner join schema_table2 p on e.id = p.id set e.database1=schema() where e.id = 6;
select * from schema_table3 order by id;
+----+--------+-----------+----------+
| id | name   | database1 | schema() |
+----+--------+-----------+----------+
|  1 | 洋洋   | whh1      | whh1     |
|  2 | 慧慧   | whh2      | whh1     |
|  3 | 萌萌   | whh3      | whh1     |
|  4 | 洋洋   | whh1      | whh1     |
|  5 | 康康   | whhtest   | whh1     |
|  6 | 宁宁   | whh1      | whh1     |
|  7 | 洋洋   | whhtest2  | whh1     |
|  8 | 康康   | whhtest   | whh1     |
+----+--------+-----------+----------+
#with as的select
with a as (select e.id,e.name,e.database1,p.fun,schema() from schema_table1 e inner join schema_table2 p on e.id = p.id ) select a.id,a.name,a.database1,a.fun from a order by a.id;
+----+--------+-----------+------------+
| id | name   | database1 | fun        |
+----+--------+-----------+------------+
|  1 | 洋洋   | whh1      | schema()   |
|  2 | 慧慧   | whh2      | sha()      |
|  3 | 萌萌   | whh3      | compress() |
|  4 | 洋洋   | whh1      | year()     |
|  5 | 康康   | whhtest   | week()     |
|  6 | 宁宁   | whhtest1  | to_data()  |
+----+--------+-----------+------------+
with a as (select e.id,e.name,e.database1,p.fun,schema() from schema_table1 e inner join schema_table2 p on e.id = p.id where e.database1 >= schema()) select a.id,a.name,a.database1,a.fun from a order by a.id;
+----+--------+-----------+------------+
| id | name   | database1 | fun        |
+----+--------+-----------+------------+
|  1 | 洋洋   | whh1      | schema()   |
|  2 | 慧慧   | whh2      | sha()      |
|  3 | 萌萌   | whh3      | compress() |
|  4 | 洋洋   | whh1      | year()     |
|  5 | 康康   | whhtest   | week()     |
|  6 | 宁宁   | whhtest1  | to_data()  |
+----+--------+-----------+------------+
#模糊查询like 
select id,name,database1,schema() from schema_table1 where database1 like (select e.database1 from schema_table1 e inner join schema_table2 p on e.id = p.id where e.database1 >= schema() limit 1) order by id;
+----+--------+-----------+----------+
| id | name   | database1 | schema() |
+----+--------+-----------+----------+
|  1 | 洋洋   | whh1      | whh1     |
|  4 | 洋洋   | whh1      | whh1     |
+----+--------+-----------+----------+
select e.id,e.name,e.database1,schema() from schema_table1 e left join schema_table2 p on e.id = p.id where schema() like '%whh%' order by e.id;
+----+--------+-----------+----------+
| id | name   | database1 | schema() |
+----+--------+-----------+----------+
|  1 | 洋洋   | whh1      | whh1     |
|  2 | 慧慧   | whh2      | whh1     |
|  3 | 萌萌   | whh3      | whh1     |
|  4 | 洋洋   | whh1      | whh1     |
|  5 | 康康   | whhtest   | whh1     |
|  6 | 宁宁   | whhtest1  | whh1     |
|  7 | 洋洋   | whhtest2  | whh1     |
|  8 | 康康   | whhtest   | whh1     |
+----+--------+-----------+----------+
### 标签：schema-2-2 insert
drop table schema_table4;
create table schema_table4(
  id int primary key, 
  name varchar(100), 
  database1 varchar(100),
  cur_schema varchar(100)
);
##values
insert into schema_table4 values(1,'insert1',schema(),schema()),(2,'insert2',concat(schema(),schema()),schema());
select * from  schema_table4 order by id;
+----+---------+-----------+------------+
| id | name    | database1 | cur_schema |
+----+---------+-----------+------------+
|  1 | insert1 | whh1      | whh1       |
|  2 | insert2 | whh1whh1  | whh1       |
+----+---------+-----------+------------+
##insert ... select 语句
insert into schema_table4 select id,name,database1,schema() from schema_table1 where database1 like '%2%' and id != 2;
insert into schema_table4 select id,name,database1,schema() from schema_table1 where database1 > schema() and database1 not like '%2%' order by schema(),id desc;
insert into schema_table4 select id+1,name,database1,schema() from schema_table1 where database1 != schema() group by schema(),id having database1 like '%3%';
select * from  schema_table4 order by id;
+----+---------+-----------+------------+
| id | name    | database1 | cur_schema |
+----+---------+-----------+------------+
|  1 | insert1 | whh1      | whh1       |
|  2 | insert2 | whh1whh1  | whh1       |
|  3 | 萌萌    | whh3      | whh1       |
|  4 | 萌萌    | whh3      | whh1       |
|  5 | 康康    | whhtest   | whh1       |
|  6 | 宁宁    | whhtest1  | whh1       |
|  7 | 洋洋    | whhtest2  | whh1       |
|  8 | 康康    | whhtest   | whh1       |
+----+---------+-----------+------------+
##insert ... on duplicate key update 语句
insert into schema_table4 values (1,'insert1',schema(),schema()) on duplicate key update database1=concat('duplicate-',schema());
select * from  schema_table4 order by id;
+----+---------+----------------+------------+
| id | name    | database1      | cur_schema |
+----+---------+----------------+------------+
|  1 | insert1 | duplicate-whh1 | whh1       |
|  2 | insert2 | whh1whh1       | whh1       |
|  3 | 萌萌    | whh3           | whh1       |
|  4 | 萌萌    | whh3           | whh1       |
|  5 | 康康    | whhtest        | whh1       |
|  6 | 宁宁    | whhtest1       | whh1       |
|  7 | 洋洋    | whhtest2       | whh1       |
|  8 | 康康    | whhtest        | whh1       |
+----+---------+----------------+------------+
##insert delayed 语句 (ob(32x)暂不支持)
insert delayed into schema_table4 values(4,'insert4',schema(),schema());
ERROR 42000: You have an error in your SQL syntax; check the manual that corresponds to your OceanBase version for the right syntax to use near 'delayed into schema_table4 values(4,'insert4',schema(),schema())' at line 1
select * from  schema_table4 order by id;
+----+---------+----------------+------------+
| id | name    | database1      | cur_schema |
+----+---------+----------------+------------+
|  1 | insert1 | duplicate-whh1 | whh1       |
|  2 | insert2 | whh1whh1       | whh1       |
|  3 | 萌萌    | whh3           | whh1       |
|  4 | 萌萌    | whh3           | whh1       |
|  5 | 康康    | whhtest        | whh1       |
|  6 | 宁宁    | whhtest1       | whh1       |
|  7 | 洋洋    | whhtest2       | whh1       |
|  8 | 康康    | whhtest        | whh1       |
+----+---------+----------------+------------+
### 标签：schema-2-3 update
update schema_table1 set database1 = concat('update-',schema()) where database1 = schema() order by schema(),id desc;
update schema_table1 set database1 = (select concat(fun,schema()) from schema_table2 group by schema(),id having id = 1 order by schema(),id )where id = 1 ;
select * from  schema_table1 order by id;
+----+--------+--------------+
| id | name   | database1    |
+----+--------+--------------+
|  1 | 洋洋   | schema()whh1 |
|  2 | 慧慧   | whh2         |
|  3 | 萌萌   | whh3         |
|  4 | 洋洋   | update-whh1  |
|  5 | 康康   | whhtest      |
|  6 | 宁宁   | whhtest1     |
|  7 | 洋洋   | whhtest2     |
|  8 | 康康   | whhtest      |
+----+--------+--------------+
### 标签：schema-2-4 delete
select * from  schema_table4 order by id;
+----+---------+----------------+------------+
| id | name    | database1      | cur_schema |
+----+---------+----------------+------------+
|  1 | insert1 | duplicate-whh1 | whh1       |
|  2 | insert2 | whh1whh1       | whh1       |
|  3 | 萌萌    | whh3           | whh1       |
|  4 | 萌萌    | whh3           | whh1       |
|  5 | 康康    | whhtest        | whh1       |
|  6 | 宁宁    | whhtest1       | whh1       |
|  7 | 洋洋    | whhtest2       | whh1       |
|  8 | 康康    | whhtest        | whh1       |
+----+---------+----------------+------------+
delete from schema_table4 where database1 < schema() order by schema(),id desc;
select * from  schema_table4 order by id;
+----+---------+-----------+------------+
| id | name    | database1 | cur_schema |
+----+---------+-----------+------------+
|  2 | insert2 | whh1whh1  | whh1       |
|  3 | 萌萌    | whh3      | whh1       |
|  4 | 萌萌    | whh3      | whh1       |
|  5 | 康康    | whhtest   | whh1       |
|  6 | 宁宁    | whhtest1  | whh1       |
|  7 | 洋洋    | whhtest2  | whh1       |
|  8 | 康康    | whhtest   | whh1       |
+----+---------+-----------+------------+
### 标签：schema-2-5 replace   
replace into schema_table1 values(5,'replace',concat('replace-',schema()));
select * from schema_table1 where id = 5;
+----+---------+--------------+
| id | name    | database1    |
+----+---------+--------------+
|  5 | replace | replace-whh1 |
+----+---------+--------------+
### 标签：schema-2-6 prepare   
prepare stmt_name from 'select id,name,database1,schema() from schema_table1 e where database1 >= ? order by id';
set @q = schema();
execute stmt_name using @q;
+----+--------+-----------+----------+
| id | name   | database1 | schema() |
+----+--------+-----------+----------+
|  2 | 慧慧   | whh2      | whh1     |
|  3 | 萌萌   | whh3      | whh1     |
|  6 | 宁宁   | whhtest1  | whh1     |
|  7 | 洋洋   | whhtest2  | whh1     |
|  8 | 康康   | whhtest   | whh1     |
+----+--------+-----------+----------+
drop prepare stmt_name;
### 标签：schema-2-7 do 语句  (ob(32x)暂不支持)
do schema(),database();
### 标签：schema-2-8 handler  语句 (ob(32x)暂不支持)
drop table schema_table1;
create table schema_table1(
  id int,
  bases varchar(200),
  txt varchar(200)
);
create index handler_index on schema_table1(bases);
insert into schema_table1 values(1,'whh','default1'),(2,'whh1','default2'),(3,'whh2','default3');
handler schema_table1 open as p;
ERROR 42000: You have an error in your SQL syntax; check the manual that corresponds to your OceanBase version for the right syntax to use near 'as p' at line 1
handler p read handler_index = (schema());
Warnings:
Warning	1235	This statement is not supported
handler p close;
Warnings:
Warning	1235	This statement is not supported
# Clean up users
drop user whh@'%';
