#Environmental cleaning
DROP USER wmj456@'%';
DROP DATABASE obwmjtest;
DROP DATABASE obwmjtest2;
CREATE DATABASE obwmjtest;
CREATE USER wmj456 IDENTIFIED BY 'wmj456';
GRANT ALL ON *.* TO wmj456 WITH GRANT OPTION;
DROP TABLE t1;
DROP TABLE t2;
DROP TABLE t3;
DROP TABLE t4;
DROP TABLE t5;
DROP TABLE t6;
DROP TABLE t7;
DROP TABLE t8;
SET sql_mode='ERROR_FOR_DIVISION_BY_ZERO,STRICT_ALL_TABLES';
SELECT 10/0;
10/0
NULL
SELECT 0/0;
0/0
NULL
SELECT 1.0/0;
1.0/0
NULL
SELECT -3.0/0;
-3.0/0
NULL
SELECT -3.0/0.1;
-3.0/0.1
-30.00000
SELECT 1.175494351E-38/0;
1.175494351E-38/0
NULL
SELECT -3.402823466E+38/0;
-3.402823466E+38/0
NULL
SELECT -1.7976931348623157E+308/0;
-1.7976931348623157E+308/0
NULL
SELECT 1100111011110101111010000000111000111/0;
1100111011110101111010000000111000111/0
NULL
SELECT 0000-12-25/0;
0000-12-25/0
NULL
SELECT cast(20.3456 as decimal(10, 2))/0;
cast(20.3456 as decimal(10, 2))/0
NULL
SELECT cast('2019-03-08 15:31:26' as datetime )/0;
cast('2019-03-08 15:31:26' as datetime )/0
NULL
SELECT cast('2019-03-08 15:31:26' as date )/0;
cast('2019-03-08 15:31:26' as date )/0
NULL
SELECT cast('2015-11-03 15:31:26' as signed)/0;
cast('2015-11-03 15:31:26' as signed)/0
NULL
Warnings:
Warning	1292	Truncated incorrect INTEGER value: '2015-11-03 15:31:26'
SELECT sign(1.175494351E-38)/0 From dual;
sign(1.175494351E-38)/0
NULL
SELECT sign(1.175494351E-38/0 )From dual;
sign(1.175494351E-38/0 )
NULL
SELECT sign(-3.402823466E+38)/0 From dual;
sign(-3.402823466E+38)/0
NULL
SELECT sign(-3.402823466E+38/0) From dual;
sign(-3.402823466E+38/0)
NULL
SELECT sign(-1.7976931348623157E+308/0) From dual;
sign(-1.7976931348623157E+308/0)
NULL
SET sql_mode='ERROR_FOR_DIVISION_BY_ZERO,STRICT_ALL_TABLES';
SELECT ASCII(10/0) A, ASCII(0/10) a, ASCII(0) space FROM DUAL;
A	a	space
NULL	48	48
SELECT LENGTH(10/0) FROM DUAL;
LENGTH(10/0)
NULL
SELECT concat(10/0,'XXXX') FROM DUAL;
concat(10/0,'XXXX')
NULL
SELECT concat(10/0,'XXXX') FROM DUAL;
concat(10/0,'XXXX')
NULL
SELECT ABS(5/0) FROM DUAL;
ABS(5/0)
NULL
SELECT ABS(0/0) FROM DUAL;
ABS(0/0)
NULL
SELECT ABS(0/1) FROM DUAL;
ABS(0/1)
0.0000
SELECT ACOS(-10/0) FROM DUAL;
ACOS(-10/0)
NULL
SELECT ACOS(-0/0) FROM DUAL;
ACOS(-0/0)
NULL
SELECT ASIN(-1/0) FROM DUAL;
ASIN(-1/0)
NULL
SELECT BIT_COUNT(42/0) FROM DUAL;
BIT_COUNT(42/0)
NULL
SELECT BIT_COUNT(b'1010')/0 FROM DUAL;
BIT_COUNT(b'1010')/0
NULL
SELECT CEIL(1.2) FROM DUAL;
CEIL(1.2)
2
SELECT CEILING(1.23)/0 FROM DUAL;
CEILING(1.23)/0
NULL
SELECT CONV(9223372036854775807,10,2)/0 FROM DUAL;
CONV(9223372036854775807,10,2)/0
NULL
SELECT COS(PI())/0 FROM DUAL;
COS(PI())/0
NULL
SELECT COS(0)/0 FROM DUAL;
COS(0)/0
NULL
SELECT COT(-10/0) FROM DUAL;
COT(-10/0)
NULL
SELECT EXP(2/0) FROM DUAL;
EXP(2/0)
NULL
SELECT FLOOR(1.2/0) FROM DUAL;
FLOOR(1.2/0)
NULL
SELECT LN(-10/0) FROM DUAL;
LN(-10/0)
NULL
SELECT LOG(-10/0) FROM DUAL;
LOG(-10/0)
NULL
SELECT LOG10(-10/0) FROM DUAL;
LOG10(-10/0)
NULL
SELECT LOG2(-10/0) FROM DUAL;
LOG2(-10/0)
NULL
SELECT MOD(29,0) FROM DUAL;
MOD(29,0)
NULL
SELECT MOD(cast('0000-00-00 15:31:26' as datetime ),0) FROM DUAL;
MOD(cast('0000-00-00 15:31:26' as datetime ),0)
NULL
SELECT 29 MOD 0 FROM DUAL;
29 MOD 0
NULL
SELECT 29 % 0 FROM DUAL;
29 % 0
NULL
SELECT NEG(1)/0 FROM DUAL;
NEG(1)/0
NULL
SELECT NEG(1/0) FROM DUAL;
NEG(1/0)
NULL
SELECT POW(4,0) FROM DUAL;
POW(4,0)
1
SELECT POW(1,NULL) FROM DUAL;
POW(1,NULL)
NULL
SELECT RADIANS(-10/0) FROM DUAL;
RADIANS(-10/0)
NULL
SELECT RAND(2/0) FROM DUAL;
RAND(2/0)
0.15522042769493574
SELECT ROUND(2.15/0,0) FROM DUAL;
ROUND(2.15/0,0)
NULL
SELECT SIGN(-32/0) FROM DUAL;
SIGN(-32/0)
NULL
SELECT TRUNCATE(3.27/0,1) FROM DUAL;
TRUNCATE(3.27/0,1)
NULL
SELECT IF (5>6, 1, 1/0) FROM DUAL;
IF (5>6, 1, 1/0)
NULL
SELECT IF (5>6, 1/0, 0) FROM DUAL;
IF (5>6, 1/0, 0)
0.0000
SELECT IF (5/6>0, 1/0, 0) FROM DUAL;
IF (5/6>0, 1/0, 0)
NULL
SELECT CASE 2/1 WHEN 2 THEN 2 WHEN 1/0 THEN 0 END FROM DUAL;
CASE 2/1 WHEN 2 THEN 2 WHEN 1/0 THEN 0 END
2
SELECT CASE 2/1 WHEN 1 THEN 2 WHEN 1/0 THEN 0 END FROM DUAL;
CASE 2/1 WHEN 1 THEN 2 WHEN 1/0 THEN 0 END
NULL
SELECT CASE 2/1 WHEN 1 THEN 2 WHEN 1/0 THEN 0 ELSE 2/0 END FROM DUAL;
CASE 2/1 WHEN 1 THEN 2 WHEN 1/0 THEN 0 ELSE 2/0 END
NULL
SELECT IFNULL(2/0, 'ABC') FROM DUAL;
IFNULL(2/0, 'ABC')
ABC
SELECT IFNULL(NULL, 2/0) FROM DUAL;
IFNULL(NULL, 2/0)
NULL
SELECT NULLIF(null, 123/0) FROM DUAL;
NULLIF(null, 123/0)
NULL
SELECT NULLIF(2/0, 123/0) FROM DUAL;
NULLIF(2/0, 123/0)
NULL
SELECT NULLIF(2/0, 123) FROM DUAL;
NULLIF(2/0, 123)
NULL
SELECT ORA_DECODE(1,1,'lala',2/0,'mua') FROM DUAL;
ORA_DECODE(1,1,'lala',2/0,'mua')
lala
SELECT ORA_DECODE(1,1/0,'lala',2/0,'mua') FROM DUAL;
ORA_DECODE(1,1/0,'lala',2/0,'mua')
NULL
SET sql_mode='ERROR_FOR_DIVISION_BY_ZERO,STRICT_ALL_TABLES';
CREATE TABLE t1 (id1 int ,age1 varchar(20));
INSERT INTO t1 values (56/0,-451);
INSERT INTO t1 values (56,-451/0);
SELECT * FROM t1;
id1	age1
DROP TABLE t1;
CREATE TABLE t2 (id2 tinyint ,age2 smallint);
INSERT INTO t2 values (56/0,-451);
INSERT INTO t2 values (56,-451/0);
SELECT * FROM t2;
id2	age2
DROP TABLE t2;
CREATE TABLE t3 (id3 mediumint, age3 bigint);
INSERT INTO t3 values (56/0,-451);
INSERT INTO t3 values (56,-451/0);
SELECT * FROM t3;
id3	age3
DROP TABLE t3;
CREATE TABLE t4 (id4 float, age4 double);
INSERT INTO t4 values (56/0,-451);
INSERT INTO t4 values (56,-451/0);
SELECT * FROM t4;
id4	age4
DROP TABLE t4;
SET sql_mode='ERROR_FOR_DIVISION_BY_ZERO,STRICT_ALL_TABLES';
CREATE TABLE t1 (id1 int ,age1 varchar(20));
INSERT IGNORE INTO t1 values (56/0,-451);
INSERT IGNORE INTO t1 values (56,-451/0);
SELECT * FROM t1;
id1	age1
NULL	-451
56	NULL
DROP TABLE t1;
CREATE TABLE t2 (id2 tinyint ,age2 smallint);
INSERT IGNORE INTO t2 values (56/0,-451);
INSERT IGNORE INTO t2 values (56,-451/0);
SELECT * FROM t2;
id2	age2
NULL	-451
56	NULL
DROP TABLE t2;
CREATE TABLE t3 (id3 mediumint, age3 bigint);
INSERT IGNORE INTO t3 values (56/0,-451);
INSERT IGNORE INTO t3 values (56,-451/0);
SELECT * FROM t3;
id3	age3
NULL	-451
56	NULL
DROP TABLE t3;
CREATE TABLE t4 (id4 float, age4 double);
INSERT IGNORE INTO t4 values (56/0,-451);
INSERT IGNORE INTO t4 values (56,-451/0);
SELECT * FROM t4;
id4	age4
NULL	-451
56	NULL
DROP TABLE t4;
CREATE TABLE t5(c date);
INSERT INTO t5 VALUES('2020-01-12');
INSERT IGNORE INTO t5 VALUES(0000-00-00/0);
INSERT IGNORE INTO t5 VALUES('00-00-00'/0);
INSERT IGNORE INTO t5 VALUES('0000:00:00'/0);
SELECT * FROM t5;
c
2020-01-12
NULL
NULL
NULL
DROP TABLE t5;
CREATE TABLE t6(c1 time);
INSERT IGNORE INTO t6 VALUES('00-00-00'/0);
INSERT IGNORE INTO t6 VALUES('0000.00.00'/0);
INSERT IGNORE INTO t6 VALUES('0000:00:00'/0);
INSERT IGNORE INTO t6 VALUES('00:00:00'/0);
INSERT IGNORE INTO t6 VALUES('00.00.00'/0);
SELECT * FROM t6;
c1
NULL
NULL
NULL
NULL
NULL
DROP TABLE t6;
CREATE TABLE t7(c2 datetime);
INSERT IGNORE INTO t7 VALUES('2020-01-23 21:29:31'/0);
INSERT IGNORE INTO t7 VALUES('00-00-00 21:29:31'/0);
INSERT IGNORE INTO t7 VALUES('0000-00-00 21:29:31'/0);
INSERT IGNORE INTO t7 VALUES('59-00-00 21:29:31'/0);
SELECT * FROM t7;
c2
NULL
NULL
NULL
NULL
DROP TABLE t7;
CREATE TABLE t8(c3 timestamp);
INSERT IGNORE INTO t8 VALUES('2020-01-13 21:29:31'/0);
INSERT IGNORE INTO t8 VALUES('00-00-00 21:29:31'/0);
INSERT IGNORE INTO t8 VALUES('00.00.00 21:29:31'/0);
SELECT * FROM t8;
c3
NULL
NULL
NULL
DROP TABLE t8;
SET sql_mode='ERROR_FOR_DIVISION_BY_ZERO,STRICT_ALL_TABLES';
CREATE TABLE t1 (id1 int ,age1 varchar(20));
INSERT INTO t1 values (56,-451);
UPDATE t1 SET id1=56/0;
INSERT INTO t1 values (56,-452);
UPDATE t1 SET age1=56/0;
SELECT * FROM t1;
id1	age1
56	-451
56	-452
DROP TABLE t1;
CREATE TABLE t2 (id2 tinyint ,age2 smallint);
INSERT  INTO t2 values (56,-451);
UPDATE t2 SET id2=56/0;
INSERT IGNORE INTO t2 values (56,-451);
UPDATE t2 SET age2=56/0;
SELECT * FROM t2;
id2	age2
56	-451
56	-451
DROP TABLE t2;
CREATE TABLE t3 (id3 mediumint, age3 bigint);
INSERT  INTO t3 values (56,-451);
UPDATE t3 SET id3=56/0;
INSERT  INTO t3 values (56,-451);
UPDATE t3 SET age3=56/0;
SELECT * FROM t3;
id3	age3
56	-451
56	-451
DROP TABLE t3;
CREATE TABLE t4 (id4 float, age4 double);
INSERT  INTO t4 values (56,-451);
UPDATE t4 SET id4=56/0;
INSERT  INTO t4 values (56,-452);
UPDATE t4 SET age4=56/0;
SELECT * FROM t4;
id4	age4
56	-451
56	-452
DROP TABLE t4;
SET sql_mode='ERROR_FOR_DIVISION_BY_ZERO,STRICT_ALL_TABLES';
CREATE TABLE t1 (id1 int ,age1 varchar(20));
INSERT INTO t1 values (56,-451);
UPDATE IGNORE t1 SET id1=56/0;
INSERT INTO t1 values (56,-452);
UPDATE IGNORE t1 SET age1=56/0;
SELECT * FROM t1;
id1	age1
NULL	NULL
56	NULL
DROP TABLE t1;
CREATE TABLE t2 (id2 tinyint ,age2 smallint);
INSERT  INTO t2 values (56,-451);
UPDATE IGNORE t2 SET id2=56/0;
INSERT  INTO t2 values (57,-452);
UPDATE IGNORE t2 SET age2=56/0;
SELECT * FROM t2;
id2	age2
NULL	NULL
57	NULL
DROP TABLE t2;
CREATE TABLE t3 (id3 mediumint, age3 bigint);
INSERT  INTO t3 values (56,-451);
UPDATE IGNORE t3 SET id3=56/0;
INSERT  INTO t3 values (56,-451);
UPDATE IGNORE t3 SET age3=56/0;
SELECT * FROM t3;
id3	age3
NULL	NULL
56	NULL
DROP TABLE t3;
CREATE TABLE t4 (id4 float, age4 double);
INSERT  INTO t4 values (56,-451);
UPDATE IGNORE t4 SET id4=56/0;
INSERT IGNORE INTO t4 values (56,-451/0);
UPDATE IGNORE t4 SET age4=56/0;
SELECT * FROM t4;
id4	age4
NULL	NULL
56	NULL
DROP TABLE t4;
SET sql_mode='ERROR_FOR_DIVISION_BY_ZERO,STRICT_ALL_TABLES';
CREATE TABLE t1 (  
id BIGINT UNSIGNED DEFAULT 0,  
AGE INT DEFAULT '2/0'
);
CREATE TABLE t1 (  
id BIGINT UNSIGNED DEFAULT 0,  
AGE tinyint DEFAULT '2/0'
);
CREATE TABLE t1(
a bigint,
b INT
)partition by range columns(b) 
( 
partition part_1 values less than (1),
partition part_2 values less than (MOD(3,0)),
partition part_3 values less than (4)
);
CREATE TABLE t1(
a bigint,
b INT
)partition by range columns(b) 
( 
partition part_1 values less than (5),
partition part_2 values less than (10),
partition part_3 values less than (20)
);
INSERT IGNORE INTO t1 VALUES(1, MOD(3,0));
INSERT INTO t1 VALUES(2, IFNULL(NULL, 2/0));
SELECT * FROM t1;
a	b
1	NULL
DROP TABLE t1;
CREATE TABLE t1 (
id INT,
data date
) PARTITION BY LIST(id) (
PARTITION p0 VALUES IN (5, MOD(3,0), 15),
PARTITION p1 VALUES IN (6, 12, 18)
);
INSERT IGNORE INTO t1 VALUES(MOD(3,0),'2020-01-23 21:29:31');
INSERT INTO t1 VALUES(IFNULL(NULL, 2/0), '2020-01-23 21:29:31');
SELECT * FROM t1;
id	data
NULL	2020-01-23
DROP TABLE t1;
CREATE TABLE t1 (
id INT,
signed DATETIME
) PARTITION BY HASH( MOD(id,0) )
PARTITIONS 2;
INSERT IGNORE INTO t1 VALUES(1,'0000-00-00 21:29:31');
INSERT  INTO t1 VALUES(2,'0000-00-00 21:29:31');
ERROR 22012: Divided by zero
SELECT * FROM t1;
id	signed
1	0000-00-00 21:29:31
DROP TABLE t1;
CREATE TABLE t1(
a INT,
c_time DATE,
d_a int GENERATED ALWAYS AS (mod(a,0)) 
);
INSERT IGNORE INTO t1(a, c_time) VALUES(1,'2022-01-03');
INSERT IGNORE INTO t1(a, c_time) VALUES(2,'2023-03-11');
UPDATE IGNORE t1 SET a=56/0;
SELECT * FROM t1;
a	c_time	d_a
NULL	2022-01-03	NULL
NULL	2023-03-11	NULL
DROP TABLE t1;
CREATE TABLE t1(
a INT,
c_time DATE,
d_a varchar(30) GENERATED ALWAYS AS (mod(a,0)) 
);
INSERT IGNORE INTO t1(a, c_time) VALUES(1,'2022-01-03');
INSERT IGNORE INTO t1(a, c_time) VALUES(2,'2023-03-11');
UPDATE IGNORE t1 SET a=56/0;
SELECT * FROM t1;
a	c_time	d_a
NULL	2022-01-03	NULL
NULL	2023-03-11	NULL
DROP TABLE t1;
create table t1(c1 tinyint);
SET sql_mode='STRICT_ALL_TABLES,ERROR_FOR_DIVISION_BY_ZERO';
INSERT INTO t1 SET c1 = 1/0;
ERROR 22012: Divided by zero
drop table t1;
# Clean up users
drop user wmj456@'%' ;
