purge recyclebin;
drop database IF EXISTS oblrp;
create database oblrp character set gbk;
use oblrp;
set names gbk;
set timestamp = 1600000000;
set ob_trx_timeout = 10000000000;
set ob_query_timeout = 10000000000;
SET SESSION group_concat_max_len = 100000000;
result_format: 4
drop table tt1;
create table tt1(id int primary key,c1 array(int), c2 array(varchar(256)), c3 array(tinyint), c4 array(bigint), c5 array(float), c6 array(double), c7 array(smallint),v array(vector(2))) character set gbk;
insert into tt1 values(1,[-2147483648,0, 2147483647],['test'],[127,0,-128],[9223372036854775807,1,-922337203685477581],[5.4E+2,-67E-4,1.584,false,0],
[1.7976931348623157E+308,0, 2.2250738585072014E-308],[-32768,0,32767],[[1,2]]);
insert into tt1 values(4,[-2147483648,0, 2147483647],['test'],[127,0,-128],[-1,9223372036854775805,775,808,2,0],[5.4E+2,-67E-4,1.584,false,0],
[1.7976931348623157E+308,0, 2.2250738585072014E-308],[-32768,0,32767],[[1,2]]);
insert into tt1 values(2,[-2147483648,0,true, 2147483647,4],['test',false],[127,0,-128,6,77,true],[-9223372036854775801,true,9223372036854775807,775,808,2,0,1],[3.402,false, 0, 1.175,4],
[-1.7976931348623157E+30,1.2,2.2250738585072014E-308,false],[-32768,0,32767,0],[[89.5,-78E-1]]);
insert into tt1 values(3,null,null,null,null,null,null,null,null);
insert into tt1 values(5,'[]','[]','[]','[]','[]','[]','[]','[[]]');
insert into tt1(id) values(6);
drop view vtt1;
create view vtt1 as select * from tt1;
drop table tt2;
create table tt2(id int ,c1 array(int unsigned), c2 array(varchar(256)), c3 array(tinyint unsigned), c4 array(bigint unsigned), c5 array(float unsigned), c6 array(double unsigned), c7 array(smallint unsigned),v array(vector(2)))
character set gbk
PARTITION BY range COLUMNS(id)(
PARTITION p0 values less than(19),
PARTITION p1 values less than(25),
PARTITION p2 values less than(30)
) ;
insert into tt2 values(1,[1,0, 2147483647],['test'],[127,0,2],[9223372036854775808,9223372036854775809,9223372036854775811],[5.4E+2,1.584,false,0],
[1.7976931348623157E+308,0, 2.2250738585072014E-308],[1,0,32767],[[1,2]]);
insert into tt2 values(27,[1,0,true, 2147483647,4],['test',false],[127,0,1,6,77,true],[1,true,9223372036854775807,775,808,2,0,1],[3.402,false, 0, 1.175,4],
[1.7976931348623157E+30,1.2,2.2250738585072014E-308,false],[1,0,32767,0],[[89.5,-78E-1]]);
insert into tt2 values(20,null,null,null,null,null,null,null,null);
insert into tt2 values(5,'[]','[]','[]','[]','[]','[]','[]','[[]]');
insert into tt2(id) values(6);
drop view vtt2;
create view vtt2 as select * from tt2;
select id, array_difference(c1) from tt1 order by id;
+----+-----------------------------------------+
| id | array_difference(c1)                    |
+----+-----------------------------------------+
|  1 | [0,2147483648,2147483647]               |
|  2 | [0,2147483648,1,2147483646,-2147483643] |
|  3 | NULL                                    |
|  4 | [0,2147483648,2147483647]               |
|  5 | []                                      |
|  6 | NULL                                    |
+----+-----------------------------------------+
select id, array_difference(c2) from tt1 order by id;
ERROR 0A000: array_difference with non-numeric type not supported
select id, c3, array_difference(c3) from tt1 order by id;
+----+---------------------+--------------------------+
| id | c3                  | array_difference(c3)     |
+----+---------------------+--------------------------+
|  1 | [127,0,-128]        | [0,-127,-128]            |
|  2 | [127,0,-128,6,77,1] | [0,-127,-128,134,71,-76] |
|  3 | NULL                | NULL                     |
|  4 | [127,0,-128]        | [0,-127,-128]            |
|  5 | []                  | []                       |
|  6 | NULL                | NULL                     |
+----+---------------------+--------------------------+
select id, c4, array_difference(c4) from tt1 order by id;
+----+------------------------------------------------------------+-------------------------------------------------------------------------------+
| id | c4                                                         | array_difference(c4)                                                          |
+----+------------------------------------------------------------+-------------------------------------------------------------------------------+
|  1 | [9223372036854775807,1,-922337203685477581]                | [0,-9223372036854775806,-922337203685477582]                                  |
|  2 | [-9223372036854775801,1,9223372036854775807,775,808,2,0,1] | [0,9223372036854775802,9223372036854775806,-9223372036854775032,33,-806,-2,1] |
|  3 | NULL                                                       | NULL                                                                          |
|  4 | [-1,9223372036854775805,775,808,2,0]                       | [0,9223372036854775806,-9223372036854775030,33,-806,-2]                       |
|  5 | []                                                         | []                                                                            |
|  6 | NULL                                                       | NULL                                                                          |
+----+------------------------------------------------------------+-------------------------------------------------------------------------------+
select id, c5 ,array_difference(c5) from tt1 order by id;
+----+-------------------------+------------------------------+
| id | c5                      | array_difference(c5)         |
+----+-------------------------+------------------------------+
|  1 | [540,-0.0067,1.584,0,0] | [0,-540.007,1.5907,-1.584,0] |
|  2 | [3.402,0,0,1.175,4]     | [0,-3.402,0,1.175,2.825]     |
|  3 | NULL                    | NULL                         |
|  4 | [540,-0.0067,1.584,0,0] | [0,-540.007,1.5907,-1.584,0] |
|  5 | []                      | []                           |
|  6 | NULL                    | NULL                         |
+----+-------------------------+------------------------------+
select id, c6, array_difference(c6) a from tt1 order by id;
+----+--------------------------------------------------------+---------------------------------------------------------+
| id | c6                                                     | a                                                       |
+----+--------------------------------------------------------+---------------------------------------------------------+
|  1 | [1.7976931348623157e308,0,2.2250738585072014e-308]     | [0,-1.7976931348623157e308,2.2250738585072014e-308]     |
|  2 | [-1.7976931348623158e30,1.2,2.2250738585072014e-308,0] | [0,1.7976931348623158e30,-1.2,-2.2250738585072014e-308] |
|  3 | NULL                                                   | NULL                                                    |
|  4 | [1.7976931348623157e308,0,2.2250738585072014e-308]     | [0,-1.7976931348623157e308,2.2250738585072014e-308]     |
|  5 | []                                                     | []                                                      |
|  6 | NULL                                                   | NULL                                                    |
+----+--------------------------------------------------------+---------------------------------------------------------+
select id, c7, array_difference(c7) a from tt1 order by id;
+----+--------------------+------------------------+
| id | c7                 | a                      |
+----+--------------------+------------------------+
|  1 | [-32768,0,32767]   | [0,32768,32767]        |
|  2 | [-32768,0,32767,0] | [0,32768,32767,-32767] |
|  3 | NULL               | NULL                   |
|  4 | [-32768,0,32767]   | [0,32768,32767]        |
|  5 | []                 | []                     |
|  6 | NULL               | NULL                   |
+----+--------------------+------------------------+
select id, v, array_difference(v) a from tt1 order by id;
ERROR 0A000: array_difference with multi-dimension array not supported
select id, /*+enable_parallel_dml parallel(2)*/ array_difference(c1) from tt1 order by id;
+----+-----------------------------------------+
| id | array_difference(c1)                    |
+----+-----------------------------------------+
|  1 | [0,2147483648,2147483647]               |
|  2 | [0,2147483648,1,2147483646,-2147483643] |
|  3 | NULL                                    |
|  4 | [0,2147483648,2147483647]               |
|  5 | []                                      |
|  6 | NULL                                    |
+----+-----------------------------------------+
select id, /*+enable_parallel_dml parallel(2)*/ array_difference(c2) from  tt1 order by id;
ERROR 0A000: array_difference with non-numeric type not supported
select id, c3,/*+enable_parallel_dml parallel(2)*/ array_difference(c3) from tt1 order by id;
+----+---------------------+--------------------------+
| id | c3                  | array_difference(c3)     |
+----+---------------------+--------------------------+
|  1 | [127,0,-128]        | [0,-127,-128]            |
|  2 | [127,0,-128,6,77,1] | [0,-127,-128,134,71,-76] |
|  3 | NULL                | NULL                     |
|  4 | [127,0,-128]        | [0,-127,-128]            |
|  5 | []                  | []                       |
|  6 | NULL                | NULL                     |
+----+---------------------+--------------------------+
select id, c4,/*+enable_parallel_dml parallel(2)*/ array_difference(c4) from tt1 order by id;
+----+------------------------------------------------------------+-------------------------------------------------------------------------------+
| id | c4                                                         | array_difference(c4)                                                          |
+----+------------------------------------------------------------+-------------------------------------------------------------------------------+
|  1 | [9223372036854775807,1,-922337203685477581]                | [0,-9223372036854775806,-922337203685477582]                                  |
|  2 | [-9223372036854775801,1,9223372036854775807,775,808,2,0,1] | [0,9223372036854775802,9223372036854775806,-9223372036854775032,33,-806,-2,1] |
|  3 | NULL                                                       | NULL                                                                          |
|  4 | [-1,9223372036854775805,775,808,2,0]                       | [0,9223372036854775806,-9223372036854775030,33,-806,-2]                       |
|  5 | []                                                         | []                                                                            |
|  6 | NULL                                                       | NULL                                                                          |
+----+------------------------------------------------------------+-------------------------------------------------------------------------------+
select id, c5 ,/*+enable_parallel_dml parallel(2)*/ array_difference(c5) from tt1 order by id;
+----+-------------------------+------------------------------+
| id | c5                      | array_difference(c5)         |
+----+-------------------------+------------------------------+
|  1 | [540,-0.0067,1.584,0,0] | [0,-540.007,1.5907,-1.584,0] |
|  2 | [3.402,0,0,1.175,4]     | [0,-3.402,0,1.175,2.825]     |
|  3 | NULL                    | NULL                         |
|  4 | [540,-0.0067,1.584,0,0] | [0,-540.007,1.5907,-1.584,0] |
|  5 | []                      | []                           |
|  6 | NULL                    | NULL                         |
+----+-------------------------+------------------------------+
select id, c6,/*+enable_parallel_dml parallel(2)*/ array_difference(c6) a from tt1 order by id;
+----+--------------------------------------------------------+---------------------------------------------------------+
| id | c6                                                     | a                                                       |
+----+--------------------------------------------------------+---------------------------------------------------------+
|  1 | [1.7976931348623157e308,0,2.2250738585072014e-308]     | [0,-1.7976931348623157e308,2.2250738585072014e-308]     |
|  2 | [-1.7976931348623158e30,1.2,2.2250738585072014e-308,0] | [0,1.7976931348623158e30,-1.2,-2.2250738585072014e-308] |
|  3 | NULL                                                   | NULL                                                    |
|  4 | [1.7976931348623157e308,0,2.2250738585072014e-308]     | [0,-1.7976931348623157e308,2.2250738585072014e-308]     |
|  5 | []                                                     | []                                                      |
|  6 | NULL                                                   | NULL                                                    |
+----+--------------------------------------------------------+---------------------------------------------------------+
select id, c7,/*+enable_parallel_dml parallel(2)*/ array_difference(c7) a from tt1 order by id;
+----+--------------------+------------------------+
| id | c7                 | a                      |
+----+--------------------+------------------------+
|  1 | [-32768,0,32767]   | [0,32768,32767]        |
|  2 | [-32768,0,32767,0] | [0,32768,32767,-32767] |
|  3 | NULL               | NULL                   |
|  4 | [-32768,0,32767]   | [0,32768,32767]        |
|  5 | []                 | []                     |
|  6 | NULL               | NULL                   |
+----+--------------------+------------------------+
select id, v,/*+enable_parallel_dml parallel(2)*/ array_difference(v) a from tt1 order by id;
ERROR 0A000: array_difference with multi-dimension array not supported
select id, /*+read_consistency(weak) */ array_difference(c1) from tt1 order by id;
+----+-----------------------------------------+
| id | array_difference(c1)                    |
+----+-----------------------------------------+
|  1 | [0,2147483648,2147483647]               |
|  2 | [0,2147483648,1,2147483646,-2147483643] |
|  3 | NULL                                    |
|  4 | [0,2147483648,2147483647]               |
|  5 | []                                      |
|  6 | NULL                                    |
+----+-----------------------------------------+
select id, /*+read_consistency(weak) */ array_difference(c2) from  tt1 order by id;
ERROR 0A000: array_difference with non-numeric type not supported
select id, c3,/*+read_consistency(weak) */ array_difference(c3) from tt1 order by id;
+----+---------------------+--------------------------+
| id | c3                  | array_difference(c3)     |
+----+---------------------+--------------------------+
|  1 | [127,0,-128]        | [0,-127,-128]            |
|  2 | [127,0,-128,6,77,1] | [0,-127,-128,134,71,-76] |
|  3 | NULL                | NULL                     |
|  4 | [127,0,-128]        | [0,-127,-128]            |
|  5 | []                  | []                       |
|  6 | NULL                | NULL                     |
+----+---------------------+--------------------------+
select id, c4,/*+read_consistency(weak) */ array_difference(c4) from tt1 order by id;
+----+------------------------------------------------------------+-------------------------------------------------------------------------------+
| id | c4                                                         | array_difference(c4)                                                          |
+----+------------------------------------------------------------+-------------------------------------------------------------------------------+
|  1 | [9223372036854775807,1,-922337203685477581]                | [0,-9223372036854775806,-922337203685477582]                                  |
|  2 | [-9223372036854775801,1,9223372036854775807,775,808,2,0,1] | [0,9223372036854775802,9223372036854775806,-9223372036854775032,33,-806,-2,1] |
|  3 | NULL                                                       | NULL                                                                          |
|  4 | [-1,9223372036854775805,775,808,2,0]                       | [0,9223372036854775806,-9223372036854775030,33,-806,-2]                       |
|  5 | []                                                         | []                                                                            |
|  6 | NULL                                                       | NULL                                                                          |
+----+------------------------------------------------------------+-------------------------------------------------------------------------------+
select id, c5 ,/*+read_consistency(weak) */ array_difference(c5) from tt1 order by id;
+----+-------------------------+------------------------------+
| id | c5                      | array_difference(c5)         |
+----+-------------------------+------------------------------+
|  1 | [540,-0.0067,1.584,0,0] | [0,-540.007,1.5907,-1.584,0] |
|  2 | [3.402,0,0,1.175,4]     | [0,-3.402,0,1.175,2.825]     |
|  3 | NULL                    | NULL                         |
|  4 | [540,-0.0067,1.584,0,0] | [0,-540.007,1.5907,-1.584,0] |
|  5 | []                      | []                           |
|  6 | NULL                    | NULL                         |
+----+-------------------------+------------------------------+
select id, c6,/*+read_consistency(weak) */ array_difference(c6) a from tt1 order by id;
+----+--------------------------------------------------------+---------------------------------------------------------+
| id | c6                                                     | a                                                       |
+----+--------------------------------------------------------+---------------------------------------------------------+
|  1 | [1.7976931348623157e308,0,2.2250738585072014e-308]     | [0,-1.7976931348623157e308,2.2250738585072014e-308]     |
|  2 | [-1.7976931348623158e30,1.2,2.2250738585072014e-308,0] | [0,1.7976931348623158e30,-1.2,-2.2250738585072014e-308] |
|  3 | NULL                                                   | NULL                                                    |
|  4 | [1.7976931348623157e308,0,2.2250738585072014e-308]     | [0,-1.7976931348623157e308,2.2250738585072014e-308]     |
|  5 | []                                                     | []                                                      |
|  6 | NULL                                                   | NULL                                                    |
+----+--------------------------------------------------------+---------------------------------------------------------+
select id, c7,/*+read_consistency(weak) */ array_difference(c7) a from tt1 order by id;
+----+--------------------+------------------------+
| id | c7                 | a                      |
+----+--------------------+------------------------+
|  1 | [-32768,0,32767]   | [0,32768,32767]        |
|  2 | [-32768,0,32767,0] | [0,32768,32767,-32767] |
|  3 | NULL               | NULL                   |
|  4 | [-32768,0,32767]   | [0,32768,32767]        |
|  5 | []                 | []                     |
|  6 | NULL               | NULL                   |
+----+--------------------+------------------------+
select id, v,/*+read_consistency(weak) */ array_difference(v) a from tt1 order by id;
ERROR 0A000: array_difference with multi-dimension array not supported
select id, /*+ OPT_PARAM('enable_rich_vector_format', 'FALSE') */ array_difference(c1) from tt1 order by id;
+----+-----------------------------------------+
| id | array_difference(c1)                    |
+----+-----------------------------------------+
|  1 | [0,2147483648,2147483647]               |
|  2 | [0,2147483648,1,2147483646,-2147483643] |
|  3 | NULL                                    |
|  4 | [0,2147483648,2147483647]               |
|  5 | []                                      |
|  6 | NULL                                    |
+----+-----------------------------------------+
select id, /*+ OPT_PARAM('enable_rich_vector_format', 'FALSE') */ array_difference(c2) from  tt1 order by id;
ERROR 0A000: array_difference with non-numeric type not supported
select id, c3,/*+ OPT_PARAM('enable_rich_vector_format', 'FALSE') */ array_difference(c3) from tt1 order by id;
+----+---------------------+--------------------------+
| id | c3                  | array_difference(c3)     |
+----+---------------------+--------------------------+
|  1 | [127,0,-128]        | [0,-127,-128]            |
|  2 | [127,0,-128,6,77,1] | [0,-127,-128,134,71,-76] |
|  3 | NULL                | NULL                     |
|  4 | [127,0,-128]        | [0,-127,-128]            |
|  5 | []                  | []                       |
|  6 | NULL                | NULL                     |
+----+---------------------+--------------------------+
select id, c4,/*+ OPT_PARAM('enable_rich_vector_format', 'FALSE') */ array_difference(c4) from tt1 order by id;
+----+------------------------------------------------------------+-------------------------------------------------------------------------------+
| id | c4                                                         | array_difference(c4)                                                          |
+----+------------------------------------------------------------+-------------------------------------------------------------------------------+
|  1 | [9223372036854775807,1,-922337203685477581]                | [0,-9223372036854775806,-922337203685477582]                                  |
|  2 | [-9223372036854775801,1,9223372036854775807,775,808,2,0,1] | [0,9223372036854775802,9223372036854775806,-9223372036854775032,33,-806,-2,1] |
|  3 | NULL                                                       | NULL                                                                          |
|  4 | [-1,9223372036854775805,775,808,2,0]                       | [0,9223372036854775806,-9223372036854775030,33,-806,-2]                       |
|  5 | []                                                         | []                                                                            |
|  6 | NULL                                                       | NULL                                                                          |
+----+------------------------------------------------------------+-------------------------------------------------------------------------------+
select id, c5 ,/*+ OPT_PARAM('enable_rich_vector_format', 'FALSE') */ array_difference(c5) from tt1 order by id;
+----+-------------------------+------------------------------+
| id | c5                      | array_difference(c5)         |
+----+-------------------------+------------------------------+
|  1 | [540,-0.0067,1.584,0,0] | [0,-540.007,1.5907,-1.584,0] |
|  2 | [3.402,0,0,1.175,4]     | [0,-3.402,0,1.175,2.825]     |
|  3 | NULL                    | NULL                         |
|  4 | [540,-0.0067,1.584,0,0] | [0,-540.007,1.5907,-1.584,0] |
|  5 | []                      | []                           |
|  6 | NULL                    | NULL                         |
+----+-------------------------+------------------------------+
select id, c6,/*+ OPT_PARAM('enable_rich_vector_format', 'FALSE') */ array_difference(c6) a from tt1 order by id;
+----+--------------------------------------------------------+---------------------------------------------------------+
| id | c6                                                     | a                                                       |
+----+--------------------------------------------------------+---------------------------------------------------------+
|  1 | [1.7976931348623157e308,0,2.2250738585072014e-308]     | [0,-1.7976931348623157e308,2.2250738585072014e-308]     |
|  2 | [-1.7976931348623158e30,1.2,2.2250738585072014e-308,0] | [0,1.7976931348623158e30,-1.2,-2.2250738585072014e-308] |
|  3 | NULL                                                   | NULL                                                    |
|  4 | [1.7976931348623157e308,0,2.2250738585072014e-308]     | [0,-1.7976931348623157e308,2.2250738585072014e-308]     |
|  5 | []                                                     | []                                                      |
|  6 | NULL                                                   | NULL                                                    |
+----+--------------------------------------------------------+---------------------------------------------------------+
select id, c7,/*+read_consistency(weak) */ array_difference(c7) a from tt1 order by id;
+----+--------------------+------------------------+
| id | c7                 | a                      |
+----+--------------------+------------------------+
|  1 | [-32768,0,32767]   | [0,32768,32767]        |
|  2 | [-32768,0,32767,0] | [0,32768,32767,-32767] |
|  3 | NULL               | NULL                   |
|  4 | [-32768,0,32767]   | [0,32768,32767]        |
|  5 | []                 | []                     |
|  6 | NULL               | NULL                   |
+----+--------------------+------------------------+
select id, v,/*+ OPT_PARAM('enable_rich_vector_format', 'FALSE') */ array_difference(v) a from tt1 order by id;
ERROR 0A000: array_difference with multi-dimension array not supported
select id, /*+ OPT_PARAM('rowsets_enabled', 'FALSE') */ array_difference(c1) from tt1 order by id;
+----+-----------------------------------------+
| id | array_difference(c1)                    |
+----+-----------------------------------------+
|  1 | [0,2147483648,2147483647]               |
|  2 | [0,2147483648,1,2147483646,-2147483643] |
|  3 | NULL                                    |
|  4 | [0,2147483648,2147483647]               |
|  5 | []                                      |
|  6 | NULL                                    |
+----+-----------------------------------------+
select id, /*+ OPT_PARAM('rowsets_enabled', 'FALSE') */ array_difference(c2) from  tt1 order by id;
ERROR 0A000: array_difference with non-numeric type not supported
select id, c3,/*+ OPT_PARAM('rowsets_enabled', 'FALSE') */ array_difference(c3) from tt1 order by id;
+----+---------------------+--------------------------+
| id | c3                  | array_difference(c3)     |
+----+---------------------+--------------------------+
|  1 | [127,0,-128]        | [0,-127,-128]            |
|  2 | [127,0,-128,6,77,1] | [0,-127,-128,134,71,-76] |
|  3 | NULL                | NULL                     |
|  4 | [127,0,-128]        | [0,-127,-128]            |
|  5 | []                  | []                       |
|  6 | NULL                | NULL                     |
+----+---------------------+--------------------------+
select id, c4,/*+ OPT_PARAM('rowsets_enabled', 'FALSE') */ array_difference(c4) from tt1 order by id;
+----+------------------------------------------------------------+-------------------------------------------------------------------------------+
| id | c4                                                         | array_difference(c4)                                                          |
+----+------------------------------------------------------------+-------------------------------------------------------------------------------+
|  1 | [9223372036854775807,1,-922337203685477581]                | [0,-9223372036854775806,-922337203685477582]                                  |
|  2 | [-9223372036854775801,1,9223372036854775807,775,808,2,0,1] | [0,9223372036854775802,9223372036854775806,-9223372036854775032,33,-806,-2,1] |
|  3 | NULL                                                       | NULL                                                                          |
|  4 | [-1,9223372036854775805,775,808,2,0]                       | [0,9223372036854775806,-9223372036854775030,33,-806,-2]                       |
|  5 | []                                                         | []                                                                            |
|  6 | NULL                                                       | NULL                                                                          |
+----+------------------------------------------------------------+-------------------------------------------------------------------------------+
select id, c5 ,/*+ OPT_PARAM('rowsets_enabled', 'FALSE') */ array_difference(c5) from tt1 order by id;
+----+-------------------------+------------------------------+
| id | c5                      | array_difference(c5)         |
+----+-------------------------+------------------------------+
|  1 | [540,-0.0067,1.584,0,0] | [0,-540.007,1.5907,-1.584,0] |
|  2 | [3.402,0,0,1.175,4]     | [0,-3.402,0,1.175,2.825]     |
|  3 | NULL                    | NULL                         |
|  4 | [540,-0.0067,1.584,0,0] | [0,-540.007,1.5907,-1.584,0] |
|  5 | []                      | []                           |
|  6 | NULL                    | NULL                         |
+----+-------------------------+------------------------------+
select id, c6,/*+ OPT_PARAM('rowsets_enabled', 'FALSE') */ array_difference(c6) a from tt1 order by id;
+----+--------------------------------------------------------+---------------------------------------------------------+
| id | c6                                                     | a                                                       |
+----+--------------------------------------------------------+---------------------------------------------------------+
|  1 | [1.7976931348623157e308,0,2.2250738585072014e-308]     | [0,-1.7976931348623157e308,2.2250738585072014e-308]     |
|  2 | [-1.7976931348623158e30,1.2,2.2250738585072014e-308,0] | [0,1.7976931348623158e30,-1.2,-2.2250738585072014e-308] |
|  3 | NULL                                                   | NULL                                                    |
|  4 | [1.7976931348623157e308,0,2.2250738585072014e-308]     | [0,-1.7976931348623157e308,2.2250738585072014e-308]     |
|  5 | []                                                     | []                                                      |
|  6 | NULL                                                   | NULL                                                    |
+----+--------------------------------------------------------+---------------------------------------------------------+
select id, c7,/*+ OPT_PARAM('rowsets_enabled', 'FALSE') */array_difference(c7) a from tt1 order by id;
+----+--------------------+------------------------+
| id | c7                 | a                      |
+----+--------------------+------------------------+
|  1 | [-32768,0,32767]   | [0,32768,32767]        |
|  2 | [-32768,0,32767,0] | [0,32768,32767,-32767] |
|  3 | NULL               | NULL                   |
|  4 | [-32768,0,32767]   | [0,32768,32767]        |
|  5 | []                 | []                     |
|  6 | NULL               | NULL                   |
+----+--------------------+------------------------+
select id, v,/*+ OPT_PARAM('rowsets_enabled', 'FALSE') */ array_difference(v) a from tt1 order by id;
ERROR 0A000: array_difference with multi-dimension array not supported
select id, array_difference(c1) from tt1 order by id;
+----+-----------------------------------------+
| id | array_difference(c1)                    |
+----+-----------------------------------------+
|  1 | [0,2147483648,2147483647]               |
|  2 | [0,2147483648,1,2147483646,-2147483643] |
|  3 | NULL                                    |
|  4 | [0,2147483648,2147483647]               |
|  5 | []                                      |
|  6 | NULL                                    |
+----+-----------------------------------------+
select id, array_difference(c2) from tt1 order by id;
ERROR 0A000: array_difference with non-numeric type not supported
select id, c3, array_difference(c3) from tt1 order by id;
+----+---------------------+--------------------------+
| id | c3                  | array_difference(c3)     |
+----+---------------------+--------------------------+
|  1 | [127,0,-128]        | [0,-127,-128]            |
|  2 | [127,0,-128,6,77,1] | [0,-127,-128,134,71,-76] |
|  3 | NULL                | NULL                     |
|  4 | [127,0,-128]        | [0,-127,-128]            |
|  5 | []                  | []                       |
|  6 | NULL                | NULL                     |
+----+---------------------+--------------------------+
select id, c4, array_difference(c4) from tt1 order by id;
+----+------------------------------------------------------------+-------------------------------------------------------------------------------+
| id | c4                                                         | array_difference(c4)                                                          |
+----+------------------------------------------------------------+-------------------------------------------------------------------------------+
|  1 | [9223372036854775807,1,-922337203685477581]                | [0,-9223372036854775806,-922337203685477582]                                  |
|  2 | [-9223372036854775801,1,9223372036854775807,775,808,2,0,1] | [0,9223372036854775802,9223372036854775806,-9223372036854775032,33,-806,-2,1] |
|  3 | NULL                                                       | NULL                                                                          |
|  4 | [-1,9223372036854775805,775,808,2,0]                       | [0,9223372036854775806,-9223372036854775030,33,-806,-2]                       |
|  5 | []                                                         | []                                                                            |
|  6 | NULL                                                       | NULL                                                                          |
+----+------------------------------------------------------------+-------------------------------------------------------------------------------+
select id, c5 ,array_difference(c5) from tt1 order by id;
+----+-------------------------+------------------------------+
| id | c5                      | array_difference(c5)         |
+----+-------------------------+------------------------------+
|  1 | [540,-0.0067,1.584,0,0] | [0,-540.007,1.5907,-1.584,0] |
|  2 | [3.402,0,0,1.175,4]     | [0,-3.402,0,1.175,2.825]     |
|  3 | NULL                    | NULL                         |
|  4 | [540,-0.0067,1.584,0,0] | [0,-540.007,1.5907,-1.584,0] |
|  5 | []                      | []                           |
|  6 | NULL                    | NULL                         |
+----+-------------------------+------------------------------+
select id, c6, array_difference(c6) a from tt1 order by id;
+----+--------------------------------------------------------+---------------------------------------------------------+
| id | c6                                                     | a                                                       |
+----+--------------------------------------------------------+---------------------------------------------------------+
|  1 | [1.7976931348623157e308,0,2.2250738585072014e-308]     | [0,-1.7976931348623157e308,2.2250738585072014e-308]     |
|  2 | [-1.7976931348623158e30,1.2,2.2250738585072014e-308,0] | [0,1.7976931348623158e30,-1.2,-2.2250738585072014e-308] |
|  3 | NULL                                                   | NULL                                                    |
|  4 | [1.7976931348623157e308,0,2.2250738585072014e-308]     | [0,-1.7976931348623157e308,2.2250738585072014e-308]     |
|  5 | []                                                     | []                                                      |
|  6 | NULL                                                   | NULL                                                    |
+----+--------------------------------------------------------+---------------------------------------------------------+
select id, c7, array_difference(c7) a from tt1 order by id;
+----+--------------------+------------------------+
| id | c7                 | a                      |
+----+--------------------+------------------------+
|  1 | [-32768,0,32767]   | [0,32768,32767]        |
|  2 | [-32768,0,32767,0] | [0,32768,32767,-32767] |
|  3 | NULL               | NULL                   |
|  4 | [-32768,0,32767]   | [0,32768,32767]        |
|  5 | []                 | []                     |
|  6 | NULL               | NULL                   |
+----+--------------------+------------------------+
select id, v, array_difference(v) a from tt1 order by id;
ERROR 0A000: array_difference with multi-dimension array not supported
select id, /*+enable_parallel_dml parallel(2)*/ array_difference(c1) from vtt1 order by id;
+----+-----------------------------------------+
| id | array_difference(c1)                    |
+----+-----------------------------------------+
|  1 | [0,2147483648,2147483647]               |
|  2 | [0,2147483648,1,2147483646,-2147483643] |
|  3 | NULL                                    |
|  4 | [0,2147483648,2147483647]               |
|  5 | []                                      |
|  6 | NULL                                    |
+----+-----------------------------------------+
select id, /*+enable_parallel_dml parallel(2)*/ array_difference(c2) from  vtt1 order by id;
ERROR 0A000: array_difference with non-numeric type not supported
select id, c3,/*+enable_parallel_dml parallel(2)*/ array_difference(c3) from vtt1 order by id;
+----+---------------------+--------------------------+
| id | c3                  | array_difference(c3)     |
+----+---------------------+--------------------------+
|  1 | [127,0,-128]        | [0,-127,-128]            |
|  2 | [127,0,-128,6,77,1] | [0,-127,-128,134,71,-76] |
|  3 | NULL                | NULL                     |
|  4 | [127,0,-128]        | [0,-127,-128]            |
|  5 | []                  | []                       |
|  6 | NULL                | NULL                     |
+----+---------------------+--------------------------+
select id, c4,/*+enable_parallel_dml parallel(2)*/ array_difference(c4) from vtt1 order by id;
+----+------------------------------------------------------------+-------------------------------------------------------------------------------+
| id | c4                                                         | array_difference(c4)                                                          |
+----+------------------------------------------------------------+-------------------------------------------------------------------------------+
|  1 | [9223372036854775807,1,-922337203685477581]                | [0,-9223372036854775806,-922337203685477582]                                  |
|  2 | [-9223372036854775801,1,9223372036854775807,775,808,2,0,1] | [0,9223372036854775802,9223372036854775806,-9223372036854775032,33,-806,-2,1] |
|  3 | NULL                                                       | NULL                                                                          |
|  4 | [-1,9223372036854775805,775,808,2,0]                       | [0,9223372036854775806,-9223372036854775030,33,-806,-2]                       |
|  5 | []                                                         | []                                                                            |
|  6 | NULL                                                       | NULL                                                                          |
+----+------------------------------------------------------------+-------------------------------------------------------------------------------+
select id, c5 ,/*+enable_parallel_dml parallel(2)*/ array_difference(c5) from vtt1 order by id;
+----+-------------------------+------------------------------+
| id | c5                      | array_difference(c5)         |
+----+-------------------------+------------------------------+
|  1 | [540,-0.0067,1.584,0,0] | [0,-540.007,1.5907,-1.584,0] |
|  2 | [3.402,0,0,1.175,4]     | [0,-3.402,0,1.175,2.825]     |
|  3 | NULL                    | NULL                         |
|  4 | [540,-0.0067,1.584,0,0] | [0,-540.007,1.5907,-1.584,0] |
|  5 | []                      | []                           |
|  6 | NULL                    | NULL                         |
+----+-------------------------+------------------------------+
select id, c6,/*+enable_parallel_dml parallel(2)*/ array_difference(c6) a from vtt1 order by id;
+----+--------------------------------------------------------+---------------------------------------------------------+
| id | c6                                                     | a                                                       |
+----+--------------------------------------------------------+---------------------------------------------------------+
|  1 | [1.7976931348623157e308,0,2.2250738585072014e-308]     | [0,-1.7976931348623157e308,2.2250738585072014e-308]     |
|  2 | [-1.7976931348623158e30,1.2,2.2250738585072014e-308,0] | [0,1.7976931348623158e30,-1.2,-2.2250738585072014e-308] |
|  3 | NULL                                                   | NULL                                                    |
|  4 | [1.7976931348623157e308,0,2.2250738585072014e-308]     | [0,-1.7976931348623157e308,2.2250738585072014e-308]     |
|  5 | []                                                     | []                                                      |
|  6 | NULL                                                   | NULL                                                    |
+----+--------------------------------------------------------+---------------------------------------------------------+
select id, c7,/*+enable_parallel_dml parallel(2)*/ array_difference(c7) a from vtt1 order by id;
+----+--------------------+------------------------+
| id | c7                 | a                      |
+----+--------------------+------------------------+
|  1 | [-32768,0,32767]   | [0,32768,32767]        |
|  2 | [-32768,0,32767,0] | [0,32768,32767,-32767] |
|  3 | NULL               | NULL                   |
|  4 | [-32768,0,32767]   | [0,32768,32767]        |
|  5 | []                 | []                     |
|  6 | NULL               | NULL                   |
+----+--------------------+------------------------+
select id, v,/*+enable_parallel_dml parallel(2)*/ array_difference(v) a from vtt1 order by id;
ERROR 0A000: array_difference with multi-dimension array not supported
select id, /*+read_consistency(weak) */ array_difference(c1) from vtt1 order by id;
+----+-----------------------------------------+
| id | array_difference(c1)                    |
+----+-----------------------------------------+
|  1 | [0,2147483648,2147483647]               |
|  2 | [0,2147483648,1,2147483646,-2147483643] |
|  3 | NULL                                    |
|  4 | [0,2147483648,2147483647]               |
|  5 | []                                      |
|  6 | NULL                                    |
+----+-----------------------------------------+
select id, /*+read_consistency(weak) */ array_difference(c2) from  vtt1 order by id;
ERROR 0A000: array_difference with non-numeric type not supported
select id, c3,/*+read_consistency(weak) */ array_difference(c3) from vtt1 order by id;
+----+---------------------+--------------------------+
| id | c3                  | array_difference(c3)     |
+----+---------------------+--------------------------+
|  1 | [127,0,-128]        | [0,-127,-128]            |
|  2 | [127,0,-128,6,77,1] | [0,-127,-128,134,71,-76] |
|  3 | NULL                | NULL                     |
|  4 | [127,0,-128]        | [0,-127,-128]            |
|  5 | []                  | []                       |
|  6 | NULL                | NULL                     |
+----+---------------------+--------------------------+
select id, c4,/*+read_consistency(weak) */ array_difference(c4) from vtt1 order by id;
+----+------------------------------------------------------------+-------------------------------------------------------------------------------+
| id | c4                                                         | array_difference(c4)                                                          |
+----+------------------------------------------------------------+-------------------------------------------------------------------------------+
|  1 | [9223372036854775807,1,-922337203685477581]                | [0,-9223372036854775806,-922337203685477582]                                  |
|  2 | [-9223372036854775801,1,9223372036854775807,775,808,2,0,1] | [0,9223372036854775802,9223372036854775806,-9223372036854775032,33,-806,-2,1] |
|  3 | NULL                                                       | NULL                                                                          |
|  4 | [-1,9223372036854775805,775,808,2,0]                       | [0,9223372036854775806,-9223372036854775030,33,-806,-2]                       |
|  5 | []                                                         | []                                                                            |
|  6 | NULL                                                       | NULL                                                                          |
+----+------------------------------------------------------------+-------------------------------------------------------------------------------+
select id, c5 ,/*+read_consistency(weak) */ array_difference(c5) from vtt1 order by id;
+----+-------------------------+------------------------------+
| id | c5                      | array_difference(c5)         |
+----+-------------------------+------------------------------+
|  1 | [540,-0.0067,1.584,0,0] | [0,-540.007,1.5907,-1.584,0] |
|  2 | [3.402,0,0,1.175,4]     | [0,-3.402,0,1.175,2.825]     |
|  3 | NULL                    | NULL                         |
|  4 | [540,-0.0067,1.584,0,0] | [0,-540.007,1.5907,-1.584,0] |
|  5 | []                      | []                           |
|  6 | NULL                    | NULL                         |
+----+-------------------------+------------------------------+
select id, c6,/*+read_consistency(weak) */ array_difference(c6) a from vtt1 order by id;
+----+--------------------------------------------------------+---------------------------------------------------------+
| id | c6                                                     | a                                                       |
+----+--------------------------------------------------------+---------------------------------------------------------+
|  1 | [1.7976931348623157e308,0,2.2250738585072014e-308]     | [0,-1.7976931348623157e308,2.2250738585072014e-308]     |
|  2 | [-1.7976931348623158e30,1.2,2.2250738585072014e-308,0] | [0,1.7976931348623158e30,-1.2,-2.2250738585072014e-308] |
|  3 | NULL                                                   | NULL                                                    |
|  4 | [1.7976931348623157e308,0,2.2250738585072014e-308]     | [0,-1.7976931348623157e308,2.2250738585072014e-308]     |
|  5 | []                                                     | []                                                      |
|  6 | NULL                                                   | NULL                                                    |
+----+--------------------------------------------------------+---------------------------------------------------------+
select id, c7,/*+read_consistency(weak) */ array_difference(c7) a from vtt1 order by id;
+----+--------------------+------------------------+
| id | c7                 | a                      |
+----+--------------------+------------------------+
|  1 | [-32768,0,32767]   | [0,32768,32767]        |
|  2 | [-32768,0,32767,0] | [0,32768,32767,-32767] |
|  3 | NULL               | NULL                   |
|  4 | [-32768,0,32767]   | [0,32768,32767]        |
|  5 | []                 | []                     |
|  6 | NULL               | NULL                   |
+----+--------------------+------------------------+
select id, v,/*+read_consistency(weak) */ array_difference(v) a from vtt1 order by id;
ERROR 0A000: array_difference with multi-dimension array not supported
select id, /*+ OPT_PARAM('enable_rich_vector_format', 'FALSE') */ array_difference(c1) from vtt1 order by id;
+----+-----------------------------------------+
| id | array_difference(c1)                    |
+----+-----------------------------------------+
|  1 | [0,2147483648,2147483647]               |
|  2 | [0,2147483648,1,2147483646,-2147483643] |
|  3 | NULL                                    |
|  4 | [0,2147483648,2147483647]               |
|  5 | []                                      |
|  6 | NULL                                    |
+----+-----------------------------------------+
select id, /*+ OPT_PARAM('enable_rich_vector_format', 'FALSE') */ array_difference(c2) from  tt1 order by id;
ERROR 0A000: array_difference with non-numeric type not supported
select id, c3,/*+ OPT_PARAM('enable_rich_vector_format', 'FALSE') */ array_difference(c3) from tt1 order by id;
+----+---------------------+--------------------------+
| id | c3                  | array_difference(c3)     |
+----+---------------------+--------------------------+
|  1 | [127,0,-128]        | [0,-127,-128]            |
|  2 | [127,0,-128,6,77,1] | [0,-127,-128,134,71,-76] |
|  3 | NULL                | NULL                     |
|  4 | [127,0,-128]        | [0,-127,-128]            |
|  5 | []                  | []                       |
|  6 | NULL                | NULL                     |
+----+---------------------+--------------------------+
select id, c4,/*+ OPT_PARAM('enable_rich_vector_format', 'FALSE') */ array_difference(c4) from vtt1 order by id;
+----+------------------------------------------------------------+-------------------------------------------------------------------------------+
| id | c4                                                         | array_difference(c4)                                                          |
+----+------------------------------------------------------------+-------------------------------------------------------------------------------+
|  1 | [9223372036854775807,1,-922337203685477581]                | [0,-9223372036854775806,-922337203685477582]                                  |
|  2 | [-9223372036854775801,1,9223372036854775807,775,808,2,0,1] | [0,9223372036854775802,9223372036854775806,-9223372036854775032,33,-806,-2,1] |
|  3 | NULL                                                       | NULL                                                                          |
|  4 | [-1,9223372036854775805,775,808,2,0]                       | [0,9223372036854775806,-9223372036854775030,33,-806,-2]                       |
|  5 | []                                                         | []                                                                            |
|  6 | NULL                                                       | NULL                                                                          |
+----+------------------------------------------------------------+-------------------------------------------------------------------------------+
select id, c5 ,/*+ OPT_PARAM('enable_rich_vector_format', 'FALSE') */ array_difference(c5) from vtt1 order by id;
+----+-------------------------+------------------------------+
| id | c5                      | array_difference(c5)         |
+----+-------------------------+------------------------------+
|  1 | [540,-0.0067,1.584,0,0] | [0,-540.007,1.5907,-1.584,0] |
|  2 | [3.402,0,0,1.175,4]     | [0,-3.402,0,1.175,2.825]     |
|  3 | NULL                    | NULL                         |
|  4 | [540,-0.0067,1.584,0,0] | [0,-540.007,1.5907,-1.584,0] |
|  5 | []                      | []                           |
|  6 | NULL                    | NULL                         |
+----+-------------------------+------------------------------+
select id, c6,/*+ OPT_PARAM('enable_rich_vector_format', 'FALSE') */ array_difference(c6) a from vtt1 order by id;
+----+--------------------------------------------------------+---------------------------------------------------------+
| id | c6                                                     | a                                                       |
+----+--------------------------------------------------------+---------------------------------------------------------+
|  1 | [1.7976931348623157e308,0,2.2250738585072014e-308]     | [0,-1.7976931348623157e308,2.2250738585072014e-308]     |
|  2 | [-1.7976931348623158e30,1.2,2.2250738585072014e-308,0] | [0,1.7976931348623158e30,-1.2,-2.2250738585072014e-308] |
|  3 | NULL                                                   | NULL                                                    |
|  4 | [1.7976931348623157e308,0,2.2250738585072014e-308]     | [0,-1.7976931348623157e308,2.2250738585072014e-308]     |
|  5 | []                                                     | []                                                      |
|  6 | NULL                                                   | NULL                                                    |
+----+--------------------------------------------------------+---------------------------------------------------------+
select id, c7,/*+read_consistency(weak) */ array_difference(c7) a from vtt1 order by id;
+----+--------------------+------------------------+
| id | c7                 | a                      |
+----+--------------------+------------------------+
|  1 | [-32768,0,32767]   | [0,32768,32767]        |
|  2 | [-32768,0,32767,0] | [0,32768,32767,-32767] |
|  3 | NULL               | NULL                   |
|  4 | [-32768,0,32767]   | [0,32768,32767]        |
|  5 | []                 | []                     |
|  6 | NULL               | NULL                   |
+----+--------------------+------------------------+
select id, v,/*+ OPT_PARAM('enable_rich_vector_format', 'FALSE') */ array_difference(v) a from vtt1 order by id;
ERROR 0A000: array_difference with multi-dimension array not supported
select id, /*+ OPT_PARAM('rowsets_enabled', 'FALSE') */ array_difference(c1) from vtt1 order by id;
+----+-----------------------------------------+
| id | array_difference(c1)                    |
+----+-----------------------------------------+
|  1 | [0,2147483648,2147483647]               |
|  2 | [0,2147483648,1,2147483646,-2147483643] |
|  3 | NULL                                    |
|  4 | [0,2147483648,2147483647]               |
|  5 | []                                      |
|  6 | NULL                                    |
+----+-----------------------------------------+
select id, /*+ OPT_PARAM('rowsets_enabled', 'FALSE') */ array_difference(c2) from  vtt1 order by id;
ERROR 0A000: array_difference with non-numeric type not supported
select id, c3,/*+ OPT_PARAM('rowsets_enabled', 'FALSE') */ array_difference(c3) from vtt1 order by id;
+----+---------------------+--------------------------+
| id | c3                  | array_difference(c3)     |
+----+---------------------+--------------------------+
|  1 | [127,0,-128]        | [0,-127,-128]            |
|  2 | [127,0,-128,6,77,1] | [0,-127,-128,134,71,-76] |
|  3 | NULL                | NULL                     |
|  4 | [127,0,-128]        | [0,-127,-128]            |
|  5 | []                  | []                       |
|  6 | NULL                | NULL                     |
+----+---------------------+--------------------------+
select id, c4,/*+ OPT_PARAM('rowsets_enabled', 'FALSE') */ array_difference(c4) from vtt1 order by id;
+----+------------------------------------------------------------+-------------------------------------------------------------------------------+
| id | c4                                                         | array_difference(c4)                                                          |
+----+------------------------------------------------------------+-------------------------------------------------------------------------------+
|  1 | [9223372036854775807,1,-922337203685477581]                | [0,-9223372036854775806,-922337203685477582]                                  |
|  2 | [-9223372036854775801,1,9223372036854775807,775,808,2,0,1] | [0,9223372036854775802,9223372036854775806,-9223372036854775032,33,-806,-2,1] |
|  3 | NULL                                                       | NULL                                                                          |
|  4 | [-1,9223372036854775805,775,808,2,0]                       | [0,9223372036854775806,-9223372036854775030,33,-806,-2]                       |
|  5 | []                                                         | []                                                                            |
|  6 | NULL                                                       | NULL                                                                          |
+----+------------------------------------------------------------+-------------------------------------------------------------------------------+
select id, c5 ,/*+ OPT_PARAM('rowsets_enabled', 'FALSE') */ array_difference(c5) from vtt1 order by id;
+----+-------------------------+------------------------------+
| id | c5                      | array_difference(c5)         |
+----+-------------------------+------------------------------+
|  1 | [540,-0.0067,1.584,0,0] | [0,-540.007,1.5907,-1.584,0] |
|  2 | [3.402,0,0,1.175,4]     | [0,-3.402,0,1.175,2.825]     |
|  3 | NULL                    | NULL                         |
|  4 | [540,-0.0067,1.584,0,0] | [0,-540.007,1.5907,-1.584,0] |
|  5 | []                      | []                           |
|  6 | NULL                    | NULL                         |
+----+-------------------------+------------------------------+
select id, c6,/*+ OPT_PARAM('rowsets_enabled', 'FALSE') */ array_difference(c6) a from vtt1 order by id;
+----+--------------------------------------------------------+---------------------------------------------------------+
| id | c6                                                     | a                                                       |
+----+--------------------------------------------------------+---------------------------------------------------------+
|  1 | [1.7976931348623157e308,0,2.2250738585072014e-308]     | [0,-1.7976931348623157e308,2.2250738585072014e-308]     |
|  2 | [-1.7976931348623158e30,1.2,2.2250738585072014e-308,0] | [0,1.7976931348623158e30,-1.2,-2.2250738585072014e-308] |
|  3 | NULL                                                   | NULL                                                    |
|  4 | [1.7976931348623157e308,0,2.2250738585072014e-308]     | [0,-1.7976931348623157e308,2.2250738585072014e-308]     |
|  5 | []                                                     | []                                                      |
|  6 | NULL                                                   | NULL                                                    |
+----+--------------------------------------------------------+---------------------------------------------------------+
select id, c7,/*+ OPT_PARAM('rowsets_enabled', 'FALSE') */array_difference(c7) a from vtt1 order by id;
+----+--------------------+------------------------+
| id | c7                 | a                      |
+----+--------------------+------------------------+
|  1 | [-32768,0,32767]   | [0,32768,32767]        |
|  2 | [-32768,0,32767,0] | [0,32768,32767,-32767] |
|  3 | NULL               | NULL                   |
|  4 | [-32768,0,32767]   | [0,32768,32767]        |
|  5 | []                 | []                     |
|  6 | NULL               | NULL                   |
+----+--------------------+------------------------+
select id, v,/*+ OPT_PARAM('rowsets_enabled', 'FALSE') */ array_difference(v) a from vtt1 order by id;
ERROR 0A000: array_difference with multi-dimension array not supported
select id, array_difference(c1) from tt2 order by id;
+------+---------------------------------+
| id   | array_difference(c1)            |
+------+---------------------------------+
|    1 | [0,-1,2147483647]               |
|    5 | []                              |
|    6 | NULL                            |
|   20 | NULL                            |
|   27 | [0,-1,1,2147483646,-2147483643] |
+------+---------------------------------+
select id, array_difference(c2) from tt2 order by id;
ERROR 0A000: array_difference with non-numeric type not supported
select id, c3, array_difference(c3) from tt2 order by id;
+------+------------------+----------------------+
| id   | c3               | array_difference(c3) |
+------+------------------+----------------------+
|    1 | [127,0,2]        | [0,-127,2]           |
|    5 | []               | []                   |
|    6 | NULL             | NULL                 |
|   20 | NULL             | NULL                 |
|   27 | [127,0,1,6,77,1] | [0,-127,1,5,71,-76]  |
+------+------------------+----------------------+
select id, c4, array_difference(c4) from tt2 order by id;
+------+---------------------------------------------------------------+-------------------------------------------------------------+
| id   | c4                                                            | array_difference(c4)                                        |
+------+---------------------------------------------------------------+-------------------------------------------------------------+
|    1 | [9223372036854775808,9223372036854775809,9223372036854775811] | [0,1,2]                                                     |
|    5 | []                                                            | []                                                          |
|    6 | NULL                                                          | NULL                                                        |
|   20 | NULL                                                          | NULL                                                        |
|   27 | [1,1,9223372036854775807,775,808,2,0,1]                       | [0,0,9223372036854775806,-9223372036854775032,33,-806,-2,1] |
+------+---------------------------------------------------------------+-------------------------------------------------------------+
select id, c5 ,array_difference(c5) from tt2 order by id;
+------+---------------------+--------------------------+
| id   | c5                  | array_difference(c5)     |
+------+---------------------+--------------------------+
|    1 | [540,1.584,0,0]     | [0,-538.416,-1.584,0]    |
|    5 | []                  | []                       |
|    6 | NULL                | NULL                     |
|   20 | NULL                | NULL                     |
|   27 | [3.402,0,0,1.175,4] | [0,-3.402,0,1.175,2.825] |
+------+---------------------+--------------------------+
select id, c6, array_difference(c6) a from tt2 order by id;
+------+-------------------------------------------------------+----------------------------------------------------------+
| id   | c6                                                    | a                                                        |
+------+-------------------------------------------------------+----------------------------------------------------------+
|    1 | [1.7976931348623157e308,0,2.2250738585072014e-308]    | [0,-1.7976931348623157e308,2.2250738585072014e-308]      |
|    5 | []                                                    | []                                                       |
|    6 | NULL                                                  | NULL                                                     |
|   20 | NULL                                                  | NULL                                                     |
|   27 | [1.7976931348623158e30,1.2,2.2250738585072014e-308,0] | [0,-1.7976931348623158e30,-1.2,-2.2250738585072014e-308] |
+------+-------------------------------------------------------+----------------------------------------------------------+
select id, c7, array_difference(c7) a from tt2 order by id;
+------+---------------+---------------------+
| id   | c7            | a                   |
+------+---------------+---------------------+
|    1 | [1,0,32767]   | [0,-1,32767]        |
|    5 | []            | []                  |
|    6 | NULL          | NULL                |
|   20 | NULL          | NULL                |
|   27 | [1,0,32767,0] | [0,-1,32767,-32767] |
+------+---------------+---------------------+
select id, v, array_difference(v) a from tt2 order by id;
ERROR 0A000: array_difference with multi-dimension array not supported
select id, /*+enable_parallel_dml parallel(2)*/ array_difference(c1) from tt2 order by id;
+------+---------------------------------+
| id   | array_difference(c1)            |
+------+---------------------------------+
|    1 | [0,-1,2147483647]               |
|    5 | []                              |
|    6 | NULL                            |
|   20 | NULL                            |
|   27 | [0,-1,1,2147483646,-2147483643] |
+------+---------------------------------+
select id, /*+enable_parallel_dml parallel(2)*/ array_difference(c2) from  tt2 order by id;
ERROR 0A000: array_difference with non-numeric type not supported
select id, c3,/*+enable_parallel_dml parallel(2)*/ array_difference(c3) from tt2 order by id;
+------+------------------+----------------------+
| id   | c3               | array_difference(c3) |
+------+------------------+----------------------+
|    1 | [127,0,2]        | [0,-127,2]           |
|    5 | []               | []                   |
|    6 | NULL             | NULL                 |
|   20 | NULL             | NULL                 |
|   27 | [127,0,1,6,77,1] | [0,-127,1,5,71,-76]  |
+------+------------------+----------------------+
select id, c4,/*+enable_parallel_dml parallel(2)*/ array_difference(c4) from tt2 order by id;
+------+---------------------------------------------------------------+-------------------------------------------------------------+
| id   | c4                                                            | array_difference(c4)                                        |
+------+---------------------------------------------------------------+-------------------------------------------------------------+
|    1 | [9223372036854775808,9223372036854775809,9223372036854775811] | [0,1,2]                                                     |
|    5 | []                                                            | []                                                          |
|    6 | NULL                                                          | NULL                                                        |
|   20 | NULL                                                          | NULL                                                        |
|   27 | [1,1,9223372036854775807,775,808,2,0,1]                       | [0,0,9223372036854775806,-9223372036854775032,33,-806,-2,1] |
+------+---------------------------------------------------------------+-------------------------------------------------------------+
select id, c5 ,/*+enable_parallel_dml parallel(2)*/ array_difference(c5) from tt2 order by id;
+------+---------------------+--------------------------+
| id   | c5                  | array_difference(c5)     |
+------+---------------------+--------------------------+
|    1 | [540,1.584,0,0]     | [0,-538.416,-1.584,0]    |
|    5 | []                  | []                       |
|    6 | NULL                | NULL                     |
|   20 | NULL                | NULL                     |
|   27 | [3.402,0,0,1.175,4] | [0,-3.402,0,1.175,2.825] |
+------+---------------------+--------------------------+
select id, c6,/*+enable_parallel_dml parallel(2)*/ array_difference(c6) a from tt2 order by id;
+------+-------------------------------------------------------+----------------------------------------------------------+
| id   | c6                                                    | a                                                        |
+------+-------------------------------------------------------+----------------------------------------------------------+
|    1 | [1.7976931348623157e308,0,2.2250738585072014e-308]    | [0,-1.7976931348623157e308,2.2250738585072014e-308]      |
|    5 | []                                                    | []                                                       |
|    6 | NULL                                                  | NULL                                                     |
|   20 | NULL                                                  | NULL                                                     |
|   27 | [1.7976931348623158e30,1.2,2.2250738585072014e-308,0] | [0,-1.7976931348623158e30,-1.2,-2.2250738585072014e-308] |
+------+-------------------------------------------------------+----------------------------------------------------------+
select id, c7,/*+enable_parallel_dml parallel(2)*/ array_difference(c7) a from tt2 order by id;
+------+---------------+---------------------+
| id   | c7            | a                   |
+------+---------------+---------------------+
|    1 | [1,0,32767]   | [0,-1,32767]        |
|    5 | []            | []                  |
|    6 | NULL          | NULL                |
|   20 | NULL          | NULL                |
|   27 | [1,0,32767,0] | [0,-1,32767,-32767] |
+------+---------------+---------------------+
select id, v,/*+enable_parallel_dml parallel(2)*/ array_difference(v) a from tt2 order by id;
ERROR 0A000: array_difference with multi-dimension array not supported
select id, /*+read_consistency(weak) */ array_difference(c1) from tt2 order by id;
+------+---------------------------------+
| id   | array_difference(c1)            |
+------+---------------------------------+
|    1 | [0,-1,2147483647]               |
|    5 | []                              |
|    6 | NULL                            |
|   20 | NULL                            |
|   27 | [0,-1,1,2147483646,-2147483643] |
+------+---------------------------------+
select id, /*+read_consistency(weak) */ array_difference(c2) from  tt2 order by id;
ERROR 0A000: array_difference with non-numeric type not supported
select id, c3,/*+read_consistency(weak) */ array_difference(c3) from tt2 order by id;
+------+------------------+----------------------+
| id   | c3               | array_difference(c3) |
+------+------------------+----------------------+
|    1 | [127,0,2]        | [0,-127,2]           |
|    5 | []               | []                   |
|    6 | NULL             | NULL                 |
|   20 | NULL             | NULL                 |
|   27 | [127,0,1,6,77,1] | [0,-127,1,5,71,-76]  |
+------+------------------+----------------------+
select id, c4,/*+read_consistency(weak) */ array_difference(c4) from tt2 order by id;
+------+---------------------------------------------------------------+-------------------------------------------------------------+
| id   | c4                                                            | array_difference(c4)                                        |
+------+---------------------------------------------------------------+-------------------------------------------------------------+
|    1 | [9223372036854775808,9223372036854775809,9223372036854775811] | [0,1,2]                                                     |
|    5 | []                                                            | []                                                          |
|    6 | NULL                                                          | NULL                                                        |
|   20 | NULL                                                          | NULL                                                        |
|   27 | [1,1,9223372036854775807,775,808,2,0,1]                       | [0,0,9223372036854775806,-9223372036854775032,33,-806,-2,1] |
+------+---------------------------------------------------------------+-------------------------------------------------------------+
select id, c5 ,/*+read_consistency(weak) */ array_difference(c5) from tt2 order by id;
+------+---------------------+--------------------------+
| id   | c5                  | array_difference(c5)     |
+------+---------------------+--------------------------+
|    1 | [540,1.584,0,0]     | [0,-538.416,-1.584,0]    |
|    5 | []                  | []                       |
|    6 | NULL                | NULL                     |
|   20 | NULL                | NULL                     |
|   27 | [3.402,0,0,1.175,4] | [0,-3.402,0,1.175,2.825] |
+------+---------------------+--------------------------+
select id, c6,/*+read_consistency(weak) */ array_difference(c6) a from tt2 order by id;
+------+-------------------------------------------------------+----------------------------------------------------------+
| id   | c6                                                    | a                                                        |
+------+-------------------------------------------------------+----------------------------------------------------------+
|    1 | [1.7976931348623157e308,0,2.2250738585072014e-308]    | [0,-1.7976931348623157e308,2.2250738585072014e-308]      |
|    5 | []                                                    | []                                                       |
|    6 | NULL                                                  | NULL                                                     |
|   20 | NULL                                                  | NULL                                                     |
|   27 | [1.7976931348623158e30,1.2,2.2250738585072014e-308,0] | [0,-1.7976931348623158e30,-1.2,-2.2250738585072014e-308] |
+------+-------------------------------------------------------+----------------------------------------------------------+
select id, c7,/*+read_consistency(weak) */ array_difference(c7) a from tt2 order by id;
+------+---------------+---------------------+
| id   | c7            | a                   |
+------+---------------+---------------------+
|    1 | [1,0,32767]   | [0,-1,32767]        |
|    5 | []            | []                  |
|    6 | NULL          | NULL                |
|   20 | NULL          | NULL                |
|   27 | [1,0,32767,0] | [0,-1,32767,-32767] |
+------+---------------+---------------------+
select id, v,/*+read_consistency(weak) */ array_difference(v) a from tt2 order by id;
ERROR 0A000: array_difference with multi-dimension array not supported
select id, /*+ OPT_PARAM('enable_rich_vector_format', 'FALSE') */ array_difference(c1) from tt2 order by id;
+------+---------------------------------+
| id   | array_difference(c1)            |
+------+---------------------------------+
|    1 | [0,-1,2147483647]               |
|    5 | []                              |
|    6 | NULL                            |
|   20 | NULL                            |
|   27 | [0,-1,1,2147483646,-2147483643] |
+------+---------------------------------+
select id, /*+ OPT_PARAM('enable_rich_vector_format', 'FALSE') */ array_difference(c2) from  tt2 order by id;
ERROR 0A000: array_difference with non-numeric type not supported
select id, c3,/*+ OPT_PARAM('enable_rich_vector_format', 'FALSE') */ array_difference(c3) from tt2 order by id;
+------+------------------+----------------------+
| id   | c3               | array_difference(c3) |
+------+------------------+----------------------+
|    1 | [127,0,2]        | [0,-127,2]           |
|    5 | []               | []                   |
|    6 | NULL             | NULL                 |
|   20 | NULL             | NULL                 |
|   27 | [127,0,1,6,77,1] | [0,-127,1,5,71,-76]  |
+------+------------------+----------------------+
select id, c4,/*+ OPT_PARAM('enable_rich_vector_format', 'FALSE') */ array_difference(c4) from tt2 order by id;
+------+---------------------------------------------------------------+-------------------------------------------------------------+
| id   | c4                                                            | array_difference(c4)                                        |
+------+---------------------------------------------------------------+-------------------------------------------------------------+
|    1 | [9223372036854775808,9223372036854775809,9223372036854775811] | [0,1,2]                                                     |
|    5 | []                                                            | []                                                          |
|    6 | NULL                                                          | NULL                                                        |
|   20 | NULL                                                          | NULL                                                        |
|   27 | [1,1,9223372036854775807,775,808,2,0,1]                       | [0,0,9223372036854775806,-9223372036854775032,33,-806,-2,1] |
+------+---------------------------------------------------------------+-------------------------------------------------------------+
select id, c5 ,/*+ OPT_PARAM('enable_rich_vector_format', 'FALSE') */ array_difference(c5) from tt2 order by id;
+------+---------------------+--------------------------+
| id   | c5                  | array_difference(c5)     |
+------+---------------------+--------------------------+
|    1 | [540,1.584,0,0]     | [0,-538.416,-1.584,0]    |
|    5 | []                  | []                       |
|    6 | NULL                | NULL                     |
|   20 | NULL                | NULL                     |
|   27 | [3.402,0,0,1.175,4] | [0,-3.402,0,1.175,2.825] |
+------+---------------------+--------------------------+
select id, c6,/*+ OPT_PARAM('enable_rich_vector_format', 'FALSE') */ array_difference(c6) a from tt2 order by id;
+------+-------------------------------------------------------+----------------------------------------------------------+
| id   | c6                                                    | a                                                        |
+------+-------------------------------------------------------+----------------------------------------------------------+
|    1 | [1.7976931348623157e308,0,2.2250738585072014e-308]    | [0,-1.7976931348623157e308,2.2250738585072014e-308]      |
|    5 | []                                                    | []                                                       |
|    6 | NULL                                                  | NULL                                                     |
|   20 | NULL                                                  | NULL                                                     |
|   27 | [1.7976931348623158e30,1.2,2.2250738585072014e-308,0] | [0,-1.7976931348623158e30,-1.2,-2.2250738585072014e-308] |
+------+-------------------------------------------------------+----------------------------------------------------------+
select id, c7,/*+read_consistency(weak) */ array_difference(c7) a from tt2 order by id;
+------+---------------+---------------------+
| id   | c7            | a                   |
+------+---------------+---------------------+
|    1 | [1,0,32767]   | [0,-1,32767]        |
|    5 | []            | []                  |
|    6 | NULL          | NULL                |
|   20 | NULL          | NULL                |
|   27 | [1,0,32767,0] | [0,-1,32767,-32767] |
+------+---------------+---------------------+
select id, v,/*+ OPT_PARAM('enable_rich_vector_format', 'FALSE') */ array_difference(v) a from tt2 order by id;
ERROR 0A000: array_difference with multi-dimension array not supported
select id, /*+ OPT_PARAM('rowsets_enabled', 'FALSE') */ array_difference(c1) from tt2 order by id;
+------+---------------------------------+
| id   | array_difference(c1)            |
+------+---------------------------------+
|    1 | [0,-1,2147483647]               |
|    5 | []                              |
|    6 | NULL                            |
|   20 | NULL                            |
|   27 | [0,-1,1,2147483646,-2147483643] |
+------+---------------------------------+
select id, /*+ OPT_PARAM('rowsets_enabled', 'FALSE') */ array_difference(c2) from  tt2 order by id;
ERROR 0A000: array_difference with non-numeric type not supported
select id, c3,/*+ OPT_PARAM('rowsets_enabled', 'FALSE') */ array_difference(c3) from tt2 order by id;
+------+------------------+----------------------+
| id   | c3               | array_difference(c3) |
+------+------------------+----------------------+
|    1 | [127,0,2]        | [0,-127,2]           |
|    5 | []               | []                   |
|    6 | NULL             | NULL                 |
|   20 | NULL             | NULL                 |
|   27 | [127,0,1,6,77,1] | [0,-127,1,5,71,-76]  |
+------+------------------+----------------------+
select id, c4,/*+ OPT_PARAM('rowsets_enabled', 'FALSE') */ array_difference(c4) from tt2 order by id;
+------+---------------------------------------------------------------+-------------------------------------------------------------+
| id   | c4                                                            | array_difference(c4)                                        |
+------+---------------------------------------------------------------+-------------------------------------------------------------+
|    1 | [9223372036854775808,9223372036854775809,9223372036854775811] | [0,1,2]                                                     |
|    5 | []                                                            | []                                                          |
|    6 | NULL                                                          | NULL                                                        |
|   20 | NULL                                                          | NULL                                                        |
|   27 | [1,1,9223372036854775807,775,808,2,0,1]                       | [0,0,9223372036854775806,-9223372036854775032,33,-806,-2,1] |
+------+---------------------------------------------------------------+-------------------------------------------------------------+
select id, c5 ,/*+ OPT_PARAM('rowsets_enabled', 'FALSE') */ array_difference(c5) from tt2 order by id;
+------+---------------------+--------------------------+
| id   | c5                  | array_difference(c5)     |
+------+---------------------+--------------------------+
|    1 | [540,1.584,0,0]     | [0,-538.416,-1.584,0]    |
|    5 | []                  | []                       |
|    6 | NULL                | NULL                     |
|   20 | NULL                | NULL                     |
|   27 | [3.402,0,0,1.175,4] | [0,-3.402,0,1.175,2.825] |
+------+---------------------+--------------------------+
select id, c6,/*+ OPT_PARAM('rowsets_enabled', 'FALSE') */ array_difference(c6) a from tt2 order by id;
+------+-------------------------------------------------------+----------------------------------------------------------+
| id   | c6                                                    | a                                                        |
+------+-------------------------------------------------------+----------------------------------------------------------+
|    1 | [1.7976931348623157e308,0,2.2250738585072014e-308]    | [0,-1.7976931348623157e308,2.2250738585072014e-308]      |
|    5 | []                                                    | []                                                       |
|    6 | NULL                                                  | NULL                                                     |
|   20 | NULL                                                  | NULL                                                     |
|   27 | [1.7976931348623158e30,1.2,2.2250738585072014e-308,0] | [0,-1.7976931348623158e30,-1.2,-2.2250738585072014e-308] |
+------+-------------------------------------------------------+----------------------------------------------------------+
select id, c7,/*+ OPT_PARAM('rowsets_enabled', 'FALSE') */array_difference(c7) a from tt2 order by id;
+------+---------------+---------------------+
| id   | c7            | a                   |
+------+---------------+---------------------+
|    1 | [1,0,32767]   | [0,-1,32767]        |
|    5 | []            | []                  |
|    6 | NULL          | NULL                |
|   20 | NULL          | NULL                |
|   27 | [1,0,32767,0] | [0,-1,32767,-32767] |
+------+---------------+---------------------+
select id, v,/*+ OPT_PARAM('rowsets_enabled', 'FALSE') */ array_difference(v) a from tt2 order by id;
ERROR 0A000: array_difference with multi-dimension array not supported
select id, array_difference(c1) from vtt2 order by id;
+------+---------------------------------+
| id   | array_difference(c1)            |
+------+---------------------------------+
|    1 | [0,-1,2147483647]               |
|    5 | []                              |
|    6 | NULL                            |
|   20 | NULL                            |
|   27 | [0,-1,1,2147483646,-2147483643] |
+------+---------------------------------+
select id, array_difference(c2) from vtt2 order by id;
ERROR 0A000: array_difference with non-numeric type not supported
select id, c3, array_difference(c3) from vtt2 order by id;
+------+------------------+----------------------+
| id   | c3               | array_difference(c3) |
+------+------------------+----------------------+
|    1 | [127,0,2]        | [0,-127,2]           |
|    5 | []               | []                   |
|    6 | NULL             | NULL                 |
|   20 | NULL             | NULL                 |
|   27 | [127,0,1,6,77,1] | [0,-127,1,5,71,-76]  |
+------+------------------+----------------------+
select id, c4, array_difference(c4) from vtt2 order by id;
+------+---------------------------------------------------------------+-------------------------------------------------------------+
| id   | c4                                                            | array_difference(c4)                                        |
+------+---------------------------------------------------------------+-------------------------------------------------------------+
|    1 | [9223372036854775808,9223372036854775809,9223372036854775811] | [0,1,2]                                                     |
|    5 | []                                                            | []                                                          |
|    6 | NULL                                                          | NULL                                                        |
|   20 | NULL                                                          | NULL                                                        |
|   27 | [1,1,9223372036854775807,775,808,2,0,1]                       | [0,0,9223372036854775806,-9223372036854775032,33,-806,-2,1] |
+------+---------------------------------------------------------------+-------------------------------------------------------------+
select id, c5 ,array_difference(c5) from vtt2 order by id;
+------+---------------------+--------------------------+
| id   | c5                  | array_difference(c5)     |
+------+---------------------+--------------------------+
|    1 | [540,1.584,0,0]     | [0,-538.416,-1.584,0]    |
|    5 | []                  | []                       |
|    6 | NULL                | NULL                     |
|   20 | NULL                | NULL                     |
|   27 | [3.402,0,0,1.175,4] | [0,-3.402,0,1.175,2.825] |
+------+---------------------+--------------------------+
select id, c6, array_difference(c6) a from vtt2 order by id;
+------+-------------------------------------------------------+----------------------------------------------------------+
| id   | c6                                                    | a                                                        |
+------+-------------------------------------------------------+----------------------------------------------------------+
|    1 | [1.7976931348623157e308,0,2.2250738585072014e-308]    | [0,-1.7976931348623157e308,2.2250738585072014e-308]      |
|    5 | []                                                    | []                                                       |
|    6 | NULL                                                  | NULL                                                     |
|   20 | NULL                                                  | NULL                                                     |
|   27 | [1.7976931348623158e30,1.2,2.2250738585072014e-308,0] | [0,-1.7976931348623158e30,-1.2,-2.2250738585072014e-308] |
+------+-------------------------------------------------------+----------------------------------------------------------+
select id, c7, array_difference(c7) a from vtt2 order by id;
+------+---------------+---------------------+
| id   | c7            | a                   |
+------+---------------+---------------------+
|    1 | [1,0,32767]   | [0,-1,32767]        |
|    5 | []            | []                  |
|    6 | NULL          | NULL                |
|   20 | NULL          | NULL                |
|   27 | [1,0,32767,0] | [0,-1,32767,-32767] |
+------+---------------+---------------------+
select id, c7, array_difference([[[[[[c7]]]]]]) a from vtt2 order by id;
ERROR 0A000: Not supported feature or function
select id, v, array_difference(v) a from vtt2 order by id;
ERROR 0A000: array_difference with multi-dimension array not supported
select id, /*+enable_parallel_dml parallel(2)*/ array_difference(c1) from vtt2 order by id;
+------+---------------------------------+
| id   | array_difference(c1)            |
+------+---------------------------------+
|    1 | [0,-1,2147483647]               |
|    5 | []                              |
|    6 | NULL                            |
|   20 | NULL                            |
|   27 | [0,-1,1,2147483646,-2147483643] |
+------+---------------------------------+
select id, /*+enable_parallel_dml parallel(2)*/ array_difference(c2) from  vtt2 order by id;
ERROR 0A000: array_difference with non-numeric type not supported
select id, c3,/*+enable_parallel_dml parallel(2)*/ array_difference(c3) from vtt2 order by id;
+------+------------------+----------------------+
| id   | c3               | array_difference(c3) |
+------+------------------+----------------------+
|    1 | [127,0,2]        | [0,-127,2]           |
|    5 | []               | []                   |
|    6 | NULL             | NULL                 |
|   20 | NULL             | NULL                 |
|   27 | [127,0,1,6,77,1] | [0,-127,1,5,71,-76]  |
+------+------------------+----------------------+
select id, c4,/*+enable_parallel_dml parallel(2)*/ array_difference(c4) from vtt2 order by id;
+------+---------------------------------------------------------------+-------------------------------------------------------------+
| id   | c4                                                            | array_difference(c4)                                        |
+------+---------------------------------------------------------------+-------------------------------------------------------------+
|    1 | [9223372036854775808,9223372036854775809,9223372036854775811] | [0,1,2]                                                     |
|    5 | []                                                            | []                                                          |
|    6 | NULL                                                          | NULL                                                        |
|   20 | NULL                                                          | NULL                                                        |
|   27 | [1,1,9223372036854775807,775,808,2,0,1]                       | [0,0,9223372036854775806,-9223372036854775032,33,-806,-2,1] |
+------+---------------------------------------------------------------+-------------------------------------------------------------+
select id, c5 ,/*+enable_parallel_dml parallel(2)*/ array_difference(c5) from vtt2 order by id;
+------+---------------------+--------------------------+
| id   | c5                  | array_difference(c5)     |
+------+---------------------+--------------------------+
|    1 | [540,1.584,0,0]     | [0,-538.416,-1.584,0]    |
|    5 | []                  | []                       |
|    6 | NULL                | NULL                     |
|   20 | NULL                | NULL                     |
|   27 | [3.402,0,0,1.175,4] | [0,-3.402,0,1.175,2.825] |
+------+---------------------+--------------------------+
select id, c6,/*+enable_parallel_dml parallel(2)*/ array_difference(c6) a from vtt2 order by id;
+------+-------------------------------------------------------+----------------------------------------------------------+
| id   | c6                                                    | a                                                        |
+------+-------------------------------------------------------+----------------------------------------------------------+
|    1 | [1.7976931348623157e308,0,2.2250738585072014e-308]    | [0,-1.7976931348623157e308,2.2250738585072014e-308]      |
|    5 | []                                                    | []                                                       |
|    6 | NULL                                                  | NULL                                                     |
|   20 | NULL                                                  | NULL                                                     |
|   27 | [1.7976931348623158e30,1.2,2.2250738585072014e-308,0] | [0,-1.7976931348623158e30,-1.2,-2.2250738585072014e-308] |
+------+-------------------------------------------------------+----------------------------------------------------------+
select id, c7,/*+enable_parallel_dml parallel(2)*/ array_difference(c7) a from vtt2 order by id;
+------+---------------+---------------------+
| id   | c7            | a                   |
+------+---------------+---------------------+
|    1 | [1,0,32767]   | [0,-1,32767]        |
|    5 | []            | []                  |
|    6 | NULL          | NULL                |
|   20 | NULL          | NULL                |
|   27 | [1,0,32767,0] | [0,-1,32767,-32767] |
+------+---------------+---------------------+
select id, v,/*+enable_parallel_dml parallel(2)*/ array_difference(v) a from vtt2 order by id;
ERROR 0A000: array_difference with multi-dimension array not supported
select id, /*+read_consistency(weak) */ array_difference(c1) from vtt2 order by id;
+------+---------------------------------+
| id   | array_difference(c1)            |
+------+---------------------------------+
|    1 | [0,-1,2147483647]               |
|    5 | []                              |
|    6 | NULL                            |
|   20 | NULL                            |
|   27 | [0,-1,1,2147483646,-2147483643] |
+------+---------------------------------+
select id, /*+read_consistency(weak) */ array_difference(c2) from  vtt2 order by id;
ERROR 0A000: array_difference with non-numeric type not supported
select id, c3,/*+read_consistency(weak) */ array_difference(c3) from vtt2 order by id;
+------+------------------+----------------------+
| id   | c3               | array_difference(c3) |
+------+------------------+----------------------+
|    1 | [127,0,2]        | [0,-127,2]           |
|    5 | []               | []                   |
|    6 | NULL             | NULL                 |
|   20 | NULL             | NULL                 |
|   27 | [127,0,1,6,77,1] | [0,-127,1,5,71,-76]  |
+------+------------------+----------------------+
select id, c4,/*+read_consistency(weak) */ array_difference(c4) from vtt2 order by id;
+------+---------------------------------------------------------------+-------------------------------------------------------------+
| id   | c4                                                            | array_difference(c4)                                        |
+------+---------------------------------------------------------------+-------------------------------------------------------------+
|    1 | [9223372036854775808,9223372036854775809,9223372036854775811] | [0,1,2]                                                     |
|    5 | []                                                            | []                                                          |
|    6 | NULL                                                          | NULL                                                        |
|   20 | NULL                                                          | NULL                                                        |
|   27 | [1,1,9223372036854775807,775,808,2,0,1]                       | [0,0,9223372036854775806,-9223372036854775032,33,-806,-2,1] |
+------+---------------------------------------------------------------+-------------------------------------------------------------+
select id, c5 ,/*+read_consistency(weak) */ array_difference(c5) from vtt2 order by id;
+------+---------------------+--------------------------+
| id   | c5                  | array_difference(c5)     |
+------+---------------------+--------------------------+
|    1 | [540,1.584,0,0]     | [0,-538.416,-1.584,0]    |
|    5 | []                  | []                       |
|    6 | NULL                | NULL                     |
|   20 | NULL                | NULL                     |
|   27 | [3.402,0,0,1.175,4] | [0,-3.402,0,1.175,2.825] |
+------+---------------------+--------------------------+
select id, c6,/*+read_consistency(weak) */ array_difference(c6) a from vtt2 order by id;
+------+-------------------------------------------------------+----------------------------------------------------------+
| id   | c6                                                    | a                                                        |
+------+-------------------------------------------------------+----------------------------------------------------------+
|    1 | [1.7976931348623157e308,0,2.2250738585072014e-308]    | [0,-1.7976931348623157e308,2.2250738585072014e-308]      |
|    5 | []                                                    | []                                                       |
|    6 | NULL                                                  | NULL                                                     |
|   20 | NULL                                                  | NULL                                                     |
|   27 | [1.7976931348623158e30,1.2,2.2250738585072014e-308,0] | [0,-1.7976931348623158e30,-1.2,-2.2250738585072014e-308] |
+------+-------------------------------------------------------+----------------------------------------------------------+
select id, c7,/*+read_consistency(weak) */ array_difference(c7) a from vtt2 order by id;
+------+---------------+---------------------+
| id   | c7            | a                   |
+------+---------------+---------------------+
|    1 | [1,0,32767]   | [0,-1,32767]        |
|    5 | []            | []                  |
|    6 | NULL          | NULL                |
|   20 | NULL          | NULL                |
|   27 | [1,0,32767,0] | [0,-1,32767,-32767] |
+------+---------------+---------------------+
select id, v,/*+read_consistency(weak) */ array_difference(v) a from vtt2 order by id;
ERROR 0A000: array_difference with multi-dimension array not supported
select id, /*+ OPT_PARAM('enable_rich_vector_format', 'FALSE') */ array_difference(c1) from vtt2 order by id;
+------+---------------------------------+
| id   | array_difference(c1)            |
+------+---------------------------------+
|    1 | [0,-1,2147483647]               |
|    5 | []                              |
|    6 | NULL                            |
|   20 | NULL                            |
|   27 | [0,-1,1,2147483646,-2147483643] |
+------+---------------------------------+
select id, /*+ OPT_PARAM('enable_rich_vector_format', 'FALSE') */ array_difference(c2) from  vtt2 order by id;
ERROR 0A000: array_difference with non-numeric type not supported
select id, c3,/*+ OPT_PARAM('enable_rich_vector_format', 'FALSE') */ array_difference(c3) from vtt2 order by id;
+------+------------------+----------------------+
| id   | c3               | array_difference(c3) |
+------+------------------+----------------------+
|    1 | [127,0,2]        | [0,-127,2]           |
|    5 | []               | []                   |
|    6 | NULL             | NULL                 |
|   20 | NULL             | NULL                 |
|   27 | [127,0,1,6,77,1] | [0,-127,1,5,71,-76]  |
+------+------------------+----------------------+
select id, c4,/*+ OPT_PARAM('enable_rich_vector_format', 'FALSE') */ array_difference(c4) from vtt2 order by id;
+------+---------------------------------------------------------------+-------------------------------------------------------------+
| id   | c4                                                            | array_difference(c4)                                        |
+------+---------------------------------------------------------------+-------------------------------------------------------------+
|    1 | [9223372036854775808,9223372036854775809,9223372036854775811] | [0,1,2]                                                     |
|    5 | []                                                            | []                                                          |
|    6 | NULL                                                          | NULL                                                        |
|   20 | NULL                                                          | NULL                                                        |
|   27 | [1,1,9223372036854775807,775,808,2,0,1]                       | [0,0,9223372036854775806,-9223372036854775032,33,-806,-2,1] |
+------+---------------------------------------------------------------+-------------------------------------------------------------+
select id, c5 ,/*+ OPT_PARAM('enable_rich_vector_format', 'FALSE') */ array_difference(c5) from vtt2 order by id;
+------+---------------------+--------------------------+
| id   | c5                  | array_difference(c5)     |
+------+---------------------+--------------------------+
|    1 | [540,1.584,0,0]     | [0,-538.416,-1.584,0]    |
|    5 | []                  | []                       |
|    6 | NULL                | NULL                     |
|   20 | NULL                | NULL                     |
|   27 | [3.402,0,0,1.175,4] | [0,-3.402,0,1.175,2.825] |
+------+---------------------+--------------------------+
select id, c6,/*+ OPT_PARAM('enable_rich_vector_format', 'FALSE') */ array_difference(c6) a from vtt2 order by id;
+------+-------------------------------------------------------+----------------------------------------------------------+
| id   | c6                                                    | a                                                        |
+------+-------------------------------------------------------+----------------------------------------------------------+
|    1 | [1.7976931348623157e308,0,2.2250738585072014e-308]    | [0,-1.7976931348623157e308,2.2250738585072014e-308]      |
|    5 | []                                                    | []                                                       |
|    6 | NULL                                                  | NULL                                                     |
|   20 | NULL                                                  | NULL                                                     |
|   27 | [1.7976931348623158e30,1.2,2.2250738585072014e-308,0] | [0,-1.7976931348623158e30,-1.2,-2.2250738585072014e-308] |
+------+-------------------------------------------------------+----------------------------------------------------------+
select id, c7,/*+read_consistency(weak) */ array_difference(c7) a from vtt2 order by id;
+------+---------------+---------------------+
| id   | c7            | a                   |
+------+---------------+---------------------+
|    1 | [1,0,32767]   | [0,-1,32767]        |
|    5 | []            | []                  |
|    6 | NULL          | NULL                |
|   20 | NULL          | NULL                |
|   27 | [1,0,32767,0] | [0,-1,32767,-32767] |
+------+---------------+---------------------+
select id, v,/*+ OPT_PARAM('enable_rich_vector_format', 'FALSE') */ array_difference(v) a from vtt2 order by id;
ERROR 0A000: array_difference with multi-dimension array not supported
select id, /*+ OPT_PARAM('rowsets_enabled', 'FALSE') */ array_difference(c1) from vtt2 order by id;
+------+---------------------------------+
| id   | array_difference(c1)            |
+------+---------------------------------+
|    1 | [0,-1,2147483647]               |
|    5 | []                              |
|    6 | NULL                            |
|   20 | NULL                            |
|   27 | [0,-1,1,2147483646,-2147483643] |
+------+---------------------------------+
select id, /*+ OPT_PARAM('rowsets_enabled', 'FALSE') */ array_difference(c2) from  vtt2 order by id;
ERROR 0A000: array_difference with non-numeric type not supported
select id, c3,/*+ OPT_PARAM('rowsets_enabled', 'FALSE') */ array_difference(c3) from vtt2 order by id;
+------+------------------+----------------------+
| id   | c3               | array_difference(c3) |
+------+------------------+----------------------+
|    1 | [127,0,2]        | [0,-127,2]           |
|    5 | []               | []                   |
|    6 | NULL             | NULL                 |
|   20 | NULL             | NULL                 |
|   27 | [127,0,1,6,77,1] | [0,-127,1,5,71,-76]  |
+------+------------------+----------------------+
select id, c4,/*+ OPT_PARAM('rowsets_enabled', 'FALSE') */ array_difference(c4) from vtt2 order by id;
+------+---------------------------------------------------------------+-------------------------------------------------------------+
| id   | c4                                                            | array_difference(c4)                                        |
+------+---------------------------------------------------------------+-------------------------------------------------------------+
|    1 | [9223372036854775808,9223372036854775809,9223372036854775811] | [0,1,2]                                                     |
|    5 | []                                                            | []                                                          |
|    6 | NULL                                                          | NULL                                                        |
|   20 | NULL                                                          | NULL                                                        |
|   27 | [1,1,9223372036854775807,775,808,2,0,1]                       | [0,0,9223372036854775806,-9223372036854775032,33,-806,-2,1] |
+------+---------------------------------------------------------------+-------------------------------------------------------------+
select id, c5 ,/*+ OPT_PARAM('rowsets_enabled', 'FALSE') */ array_difference(c5) from vtt2 order by id;
+------+---------------------+--------------------------+
| id   | c5                  | array_difference(c5)     |
+------+---------------------+--------------------------+
|    1 | [540,1.584,0,0]     | [0,-538.416,-1.584,0]    |
|    5 | []                  | []                       |
|    6 | NULL                | NULL                     |
|   20 | NULL                | NULL                     |
|   27 | [3.402,0,0,1.175,4] | [0,-3.402,0,1.175,2.825] |
+------+---------------------+--------------------------+
select id, c6,/*+ OPT_PARAM('rowsets_enabled', 'FALSE') */ array_difference(c6) a from vtt2 order by id;
+------+-------------------------------------------------------+----------------------------------------------------------+
| id   | c6                                                    | a                                                        |
+------+-------------------------------------------------------+----------------------------------------------------------+
|    1 | [1.7976931348623157e308,0,2.2250738585072014e-308]    | [0,-1.7976931348623157e308,2.2250738585072014e-308]      |
|    5 | []                                                    | []                                                       |
|    6 | NULL                                                  | NULL                                                     |
|   20 | NULL                                                  | NULL                                                     |
|   27 | [1.7976931348623158e30,1.2,2.2250738585072014e-308,0] | [0,-1.7976931348623158e30,-1.2,-2.2250738585072014e-308] |
+------+-------------------------------------------------------+----------------------------------------------------------+
select id, c7,/*+ OPT_PARAM('rowsets_enabled', 'FALSE') */array_difference(c7) a from vtt2 order by id;
+------+---------------+---------------------+
| id   | c7            | a                   |
+------+---------------+---------------------+
|    1 | [1,0,32767]   | [0,-1,32767]        |
|    5 | []            | []                  |
|    6 | NULL          | NULL                |
|   20 | NULL          | NULL                |
|   27 | [1,0,32767,0] | [0,-1,32767,-32767] |
+------+---------------+---------------------+
select id, v,/*+ OPT_PARAM('rowsets_enabled', 'FALSE') */ array_difference(v) a from vtt2 order by id;
ERROR 0A000: array_difference with multi-dimension array not supported
select array_difference([-9223372036854775808]);
+------------------------------------------+
| array_difference([-9223372036854775808]) |
+------------------------------------------+
| [0]                                      |
+------------------------------------------+
select array_difference([-9223372036854775809]);
+------------------------------------------+
| array_difference([-9223372036854775809]) |
+------------------------------------------+
| [0]                                      |
+------------------------------------------+
select array_difference([18446744073709551615]);
+------------------------------------------+
| array_difference([18446744073709551615]) |
+------------------------------------------+
| [0]                                      |
+------------------------------------------+
select array_difference([9223372036854775809]);
+-----------------------------------------+
| array_difference([9223372036854775809]) |
+-----------------------------------------+
| [0]                                     |
+-----------------------------------------+
select array_difference([18446744073709551616]);
+------------------------------------------+
| array_difference([18446744073709551616]) |
+------------------------------------------+
| [0]                                      |
+------------------------------------------+
select array_difference([18446744073709551616]);
+------------------------------------------+
| array_difference([18446744073709551616]) |
+------------------------------------------+
| [0]                                      |
+------------------------------------------+
select array_difference([1,18446744073709551614]);
+--------------------------------------------+
| array_difference([1,18446744073709551614]) |
+--------------------------------------------+
| [0,9223372036854775806]                    |
+--------------------------------------------+
select array_difference([0]);
+-----------------------+
| array_difference([0]) |
+-----------------------+
| [0]                   |
+-----------------------+
select array_difference([-0]);
+------------------------+
| array_difference([-0]) |
+------------------------+
| [0]                    |
+------------------------+
select array_difference([-1]);
+------------------------+
| array_difference([-1]) |
+------------------------+
| [0]                    |
+------------------------+
select array_difference([-9223372036854775808,0]);
ERROR 22003: Array value is out of range in 'BIGINT'
select array_difference([-9223372036854775807,0]);
+--------------------------------------------+
| array_difference([-9223372036854775807,0]) |
+--------------------------------------------+
| [0,9223372036854775807]                    |
+--------------------------------------------+
select array_difference([1,1,1,1,1,1,1,1,1,1,1,1,1]);
+-----------------------------------------------+
| array_difference([1,1,1,1,1,1,1,1,1,1,1,1,1]) |
+-----------------------------------------------+
| [0,0,0,0,0,0,0,0,0,0,0,0,0]                   |
+-----------------------------------------------+
select array_difference([-100000,-100000,-100000,-100000,-100000,-100000,-100000,-100000,-100000,-100000,-100000,-100000,-100000]);
+-----------------------------------------------------------------------------------------------------------------------------+
| array_difference([-100000,-100000,-100000,-100000,-100000,-100000,-100000,-100000,-100000,-100000,-100000,-100000,-100000]) |
+-----------------------------------------------------------------------------------------------------------------------------+
| [0,0,0,0,0,0,0,0,0,0,0,0,0]                                                                                                 |
+-----------------------------------------------------------------------------------------------------------------------------+
select array_difference([-100000,-100000,-100000,-100000,-100000,-100000,-100000,-100000,-100000,-100000,-100000,-100000,-100000]);
+-----------------------------------------------------------------------------------------------------------------------------+
| array_difference([-100000,-100000,-100000,-100000,-100000,-100000,-100000,-100000,-100000,-100000,-100000,-100000,-100000]) |
+-----------------------------------------------------------------------------------------------------------------------------+
| [0,0,0,0,0,0,0,0,0,0,0,0,0]                                                                                                 |
+-----------------------------------------------------------------------------------------------------------------------------+
select array_difference([-9223372036854775808,18446744073709551615]);
ERROR 22003: Array value is out of range in 'BIGINT'
select array_difference([-92233720368547758,18446744073709551616]);
ERROR 22003: Array value is out of range in 'BIGINT'
select array_difference([10,-1,1000,7754,-50,34688,-102834888,737434787,73463,-5532545,10,-1,1000,7754,-50,34688,-102834888,737434787,73463,-5532545,10,-1,1000,7754,-50,34688,-102834888,737434787,73463,-5532545]);
+------------------------------------------------------------------------------------------------------------------------------------------------------------------------------------------------------------------------------+
| array_difference([10,-1,1000,7754,-50,34688,-102834888,737434787,73463,-5532545,10,-1,1000,7754,-50,34688,-102834888,737434787,73463,-5532545,10,-1,1000,7754,-50,34688,-102834888,737434787,73463,-5532545])                |
+------------------------------------------------------------------------------------------------------------------------------------------------------------------------------------------------------------------------------+
| [0,-11,1001,6754,-7804,34738,-102869576,840269675,-737361324,-5606008,5532555,-11,1001,6754,-7804,34738,-102869576,840269675,-737361324,-5606008,5532555,-11,1001,6754,-7804,34738,-102869576,840269675,-737361324,-5606008] |
+------------------------------------------------------------------------------------------------------------------------------------------------------------------------------------------------------------------------------+
select array_difference([[10,-1,1000,7754,-50,34688,-102834888,737434787,73463,-5532545,10,-1,1000,7754,-50,34688,-102834888,737434787,73463,-5532545,10,-1,1000,7754,-50,34688,-102834888,737434787,73463,-5532545]]);
ERROR 0A000: array_difference with multi-dimension array not supported
select array_difference([true,false,10,true,false]) from dual;
+----------------------------------------------+
| array_difference([true,false,10,true,false]) |
+----------------------------------------------+
| [0,-1,10,-9,-1]                              |
+----------------------------------------------+
select array_difference([1,18446744073709551615]);
+--------------------------------------------+
| array_difference([1,18446744073709551615]) |
+--------------------------------------------+
| [0,9223372036854775806]                    |
+--------------------------------------------+
select array_difference([-922,9223372036854775807]);
ERROR 22003: Array value is out of range in 'BIGINT'
select array_difference([10,-9223372036854775707]);
+---------------------------------------------+
| array_difference([10,-9223372036854775707]) |
+---------------------------------------------+
| [0,-9223372036854775717]                    |
+---------------------------------------------+
select array_difference([-1,9223372036854775806]);
+--------------------------------------------+
| array_difference([-1,9223372036854775806]) |
+--------------------------------------------+
| [0,9223372036854775807]                    |
+--------------------------------------------+
select array_difference([-1,9223372036854775706,-10]);
+------------------------------------------------+
| array_difference([-1,9223372036854775706,-10]) |
+------------------------------------------------+
| [0,9223372036854775707,-9223372036854775716]   |
+------------------------------------------------+
select array_difference([9223372036854775807,-2,0]);
ERROR 22003: Array value is out of range in 'BIGINT'
select array_difference([null,10]);
ERROR 0A000: array_difference with array contains null element not supported
select array_difference([-1.7976931348623157E+308]);
+----------------------------------------------+
| array_difference([-1.7976931348623157E+308]) |
+----------------------------------------------+
| [0]                                          |
+----------------------------------------------+
select array_difference([-2.7976931348623157E+308]);
ERROR 22007: Illegal double '2.7976931348623157E+308' value found during parsing
select array_difference([-2.2250738585072014E-308]);
+----------------------------------------------+
| array_difference([-2.2250738585072014E-308]) |
+----------------------------------------------+
| [0]                                          |
+----------------------------------------------+
select array_difference([1.7976931348623157E+308]);
+---------------------------------------------+
| array_difference([1.7976931348623157E+308]) |
+---------------------------------------------+
| [0]                                         |
+---------------------------------------------+
select array_difference([1.8976931348623157E+308]);
ERROR 22007: Illegal double '1.8976931348623157E+308' value found during parsing
select array_difference([2.2250738585072014E-308]);
+---------------------------------------------+
| array_difference([2.2250738585072014E-308]) |
+---------------------------------------------+
| [0]                                         |
+---------------------------------------------+
select array_difference([1.2]);
+-------------------------+
| array_difference([1.2]) |
+-------------------------+
| [0]                     |
+-------------------------+
select array_difference([521.9866]);
+------------------------------+
| array_difference([521.9866]) |
+------------------------------+
| [0]                          |
+------------------------------+
select array_difference([-1.7976931348623157E+308, -2.2250738585072014E-308,2.2250738585072014E-308,1.7976931348623157E+308]);
+------------------------------------------------------------------------------------------------------------------------+
| array_difference([-1.7976931348623157E+308, -2.2250738585072014E-308,2.2250738585072014E-308,1.7976931348623157E+308]) |
+------------------------------------------------------------------------------------------------------------------------+
| [0,1.7976931348623157e308,4.450147717014403e-308,1.7976931348623157e308]                                               |
+------------------------------------------------------------------------------------------------------------------------+
select array_difference([-1.7976931348623157E+308, -2.2250738585072014E-308,2.2250738585072014E-308,1.7976931348623157E+308,0,1]);
+----------------------------------------------------------------------------------------------------------------------------+
| array_difference([-1.7976931348623157E+308, -2.2250738585072014E-308,2.2250738585072014E-308,1.7976931348623157E+308,0,1]) |
+----------------------------------------------------------------------------------------------------------------------------+
| [0,1.7976931348623157e308,4.450147717014403e-308,1.7976931348623157e308,-1.7976931348623157e308,1]                         |
+----------------------------------------------------------------------------------------------------------------------------+
select array_difference([-2.2250738585072014E-308,2.2250738585072014E-308]);
+----------------------------------------------------------------------+
| array_difference([-2.2250738585072014E-308,2.2250738585072014E-308]) |
+----------------------------------------------------------------------+
| [0,4.450147717014403e-308]                                           |
+----------------------------------------------------------------------+
select array_difference([3.2250738585072014E-308,4.2250738585072014E-308]);
+---------------------------------------------------------------------+
| array_difference([3.2250738585072014E-308,4.2250738585072014E-308]) |
+---------------------------------------------------------------------+
| [0,1e-308]                                                          |
+---------------------------------------------------------------------+
select array_difference([1783746E+5,1,-1,45E-1]);
+-------------------------------------------+
| array_difference([1783746E+5,1,-1,45E-1]) |
+-------------------------------------------+
| [0,-178374599999,-2,5.5]                  |
+-------------------------------------------+
select array_difference([1.25,-5.76,8.598,1.25,-5.76,8.598,1.25,-5.76,8.598,1.25,-5.76,8.598]);
+------------------------------------------------------------------------------------------------------------------+
| array_difference([1.25,-5.76,8.598,1.25,-5.76,8.598,1.25,-5.76,8.598,1.25,-5.76,8.598])                          |
+------------------------------------------------------------------------------------------------------------------+
| [0,-7.01,14.358,-7.348000000000001,-7.01,14.358,-7.348000000000001,-7.01,14.358,-7.348000000000001,-7.01,14.358] |
+------------------------------------------------------------------------------------------------------------------+
select array_difference([1.25,-5.76,8.598,1.25,-5.76,8.598,1.25,-5.76,8.598,1.25,-5.76,8.598,1584,true,58E-2,45.534636E+5]);
+-----------------------------------------------------------------------------------------------------------------------------------------------------------------+
| array_difference([1.25,-5.76,8.598,1.25,-5.76,8.598,1.25,-5.76,8.598,1.25,-5.76,8.598,1584,true,58E-2,45.534636E+5])                                            |
+-----------------------------------------------------------------------------------------------------------------------------------------------------------------+
| [0,-7.01,14.358,-7.348000000000001,-7.01,14.358,-7.348000000000001,-7.01,14.358,-7.348000000000001,-7.01,14.358,1575.402,-1583,-0.42000000000000004,4553463.02] |
+-----------------------------------------------------------------------------------------------------------------------------------------------------------------+
select array_difference([-2.7976931348623157E+308,1]);
ERROR 22007: Illegal double '2.7976931348623157E+308' value found during parsing
select array_difference([3.2250738585072014E+308,7.97,87E-1]);
ERROR 22007: Illegal double '3.2250738585072014E+308' value found during parsing
select array_difference([1783746E+5,1,-1,45E-1,1,3,TRUE,FALSE]);
+----------------------------------------------------------+
| array_difference([1783746E+5,1,-1,45E-1,1,3,TRUE,FALSE]) |
+----------------------------------------------------------+
| [0,-178374599999,-2,5.5,-3.5,2,-2,-1]                    |
+----------------------------------------------------------+
select array_difference([-3,1.7976931348623157E+308]);
+------------------------------------------------+
| array_difference([-3,1.7976931348623157E+308]) |
+------------------------------------------------+
| [0,1.7976931348623157e308]                     |
+------------------------------------------------+
select array_difference([-1.1E+300,1.7976931348623157E+308]);
ERROR 22003: Array value is out of range in 'DOUBLE'
select array_difference([-10000000000,1.7976931348623157E+308]);
+----------------------------------------------------------+
| array_difference([-10000000000,1.7976931348623157E+308]) |
+----------------------------------------------------------+
| [0,1.7976931348623157e308]                               |
+----------------------------------------------------------+
select array_difference(['1',1]);
ERROR 0A000: array_difference with non-numeric type not supported
select array_difference(['1E+10',1]);
ERROR 0A000: array_difference with non-numeric type not supported
select array_difference(['1']);
ERROR 0A000: array_difference with non-numeric type not supported
select array_difference(['1','2']);
ERROR 0A000: array_difference with non-numeric type not supported
select array_difference(['eeestestest']);
ERROR 0A000: array_difference with non-numeric type not supported
select array_difference(['eeestestest','eestestsatestewtaeswts','eestewte!#$%^']);
ERROR 0A000: array_difference with non-numeric type not supported
select array_difference(['eeestestest',true,null]);
ERROR 0A000: array_difference with non-numeric type not supported
select array_difference(['中文']);
ERROR 0A000: array_difference with non-numeric type not supported
drop table if exists tt3;
Warnings:
Note	1051	Unknown table 'oblrp.tt3'
create table tt3(id int primary key,id1 int,a float, v vector(2));
drop view if exists vtt3;
Warnings:
Note	1051	Unknown table 'oblrp.vtt3'
create view vtt3 as select * from tt3;
insert into tt3 values(1,1,1.2,[89,97]);
insert into tt3 values(2,2,452.454E-2,[1.2,84.89]);
insert into tt3 values(3,2,452.454E-2,[-1,3]);
insert into tt3 values(4,2,452.454E-2,[-3.402823466E+1,3.402823466E+38]);
select array_difference(v) from tt3;
+---------------------+
| array_difference(v) |
+---------------------+
| [0,8]               |
| [0,83.69]           |
| [0,4]               |
| [0,3.40282e38]      |
+---------------------+
select array_difference(v) from vtt3 order by id;
+---------------------+
| array_difference(v) |
+---------------------+
| [0,8]               |
| [0,83.69]           |
| [0,4]               |
| [0,3.40282e38]      |
+---------------------+
select array_difference([v]) from tt3;
ERROR 0A000: array_difference with multi-dimension array not supported
select array_difference([id,a]) from tt3;
+--------------------------+
| array_difference([id,a]) |
+--------------------------+
| [0,0.20000004768371582]  |
| [0,2.5245399475097656]   |
| [0,1.5245399475097656]   |
| [0,0.5245399475097656]   |
+--------------------------+
select array_difference([id,a,v]) from tt3;
ERROR 22000: Invalid data type for the operation
select array_difference([null]);
ERROR 0A000: array_difference with array contains null element not supported
select array_difference([null,1]);
ERROR 0A000: array_difference with array contains null element not supported
select array_difference([null,true,false]);
ERROR 0A000: array_difference with array contains null element not supported
select array_difference([true,false,true,false]);
+-------------------------------------------+
| array_difference([true,false,true,false]) |
+-------------------------------------------+
| [0,-1,1,-1]                               |
+-------------------------------------------+
select array_difference([true,False]);
+--------------------------------+
| array_difference([true,False]) |
+--------------------------------+
| [0,-1]                         |
+--------------------------------+
select array_difference([true,false,1,4,-5088,5.866,-1.175494351E-38,3.402823466E+38]);
+---------------------------------------------------------------------------------+
| array_difference([true,false,1,4,-5088,5.866,-1.175494351E-38,3.402823466E+38]) |
+---------------------------------------------------------------------------------+
| [0,-1,1,3,-5092,5093.866,-5.866,3.402823466e38]                                 |
+---------------------------------------------------------------------------------+
select array_difference(array_range(1000000));
select array_difference(array_range(1800000));
select array_difference(array_range(1900000));
ERROR HY000: Size overflow
select array_difference([[12,3,4,5]]);
ERROR 0A000: array_difference with multi-dimension array not supported
select array_difference([[12.2,3,4,5],[1,2,3,5]]);
ERROR 0A000: array_difference with multi-dimension array not supported
select array_difference([[[[12,3,4,5]]]]);
ERROR 0A000: array_difference with multi-dimension array not supported
select array_difference([[[[null]]]]);
ERROR 0A000: array_difference with multi-dimension array not supported
select array_difference([[[['xiaolai']]]]);
ERROR 0A000: array_difference with multi-dimension array not supported
select array_difference([[1],[1]]);
ERROR 0A000: array_difference with multi-dimension array not supported
select array_difference(array_remove([1],1));
+---------------------------------------+
| array_difference(array_remove([1],1)) |
+---------------------------------------+
| []                                    |
+---------------------------------------+
select array_difference([[12,3,4,5],1]);
ERROR 22000: Invalid data type for the operation
select array_difference([[12,3,4,5],null]);
ERROR 0A000: array_difference with multi-dimension array not supported
select array_difference('[1,23,4]');
ERROR 22000: invalid obj type for type promotion: left_type=ARRAY right_type=VARCHAR
select array_difference('[1,2,3]');
ERROR 22000: invalid obj type for type promotion: left_type=ARRAY right_type=VARCHAR
select array_difference('1');
ERROR 22000: invalid obj type for type promotion: left_type=ARRAY right_type=VARCHAR
select array_difference('test');
ERROR 22000: invalid obj type for type promotion: left_type=ARRAY right_type=VARCHAR
select array_difference(null);
+------------------------+
| array_difference(null) |
+------------------------+
|                   NULL |
+------------------------+
select array_difference(false);
ERROR 22000: invalid obj type for type promotion: left_type=ARRAY right_type=TINYINT
select array_difference(true);
ERROR 22000: invalid obj type for type promotion: left_type=ARRAY right_type=TINYINT
select array_difference(12345);
ERROR 22000: invalid obj type for type promotion: left_type=ARRAY right_type=BIGINT
select array_difference(cast('[1,2,4,5,6]' as json));
ERROR 22000: invalid obj type for type promotion: left_type=ARRAY right_type=JSON
select array_difference(cast('10' as signed));
ERROR 22000: invalid obj type for type promotion: left_type=ARRAY right_type=BIGINT
select array_difference(cast('10' as unsigned));
ERROR 22000: invalid obj type for type promotion: left_type=ARRAY right_type=BIGINT UNSIGNED
select array_difference(cast('10' as float));
ERROR 22000: invalid obj type for type promotion: left_type=ARRAY right_type=FLOAT
select array_difference(cast('10' as unsigned));
ERROR 22000: invalid obj type for type promotion: left_type=ARRAY right_type=BIGINT UNSIGNED
select array_difference(cast('10' as double));
ERROR 22000: invalid obj type for type promotion: left_type=ARRAY right_type=DOUBLE
select array_difference(cast(2011 as year));
ERROR 22000: invalid obj type for type promotion: left_type=ARRAY right_type=YEAR
select array_difference([1,2,34]);
+----------------------------+
| array_difference([1,2,34]) |
+----------------------------+
| [0,1,32]                   |
+----------------------------+
select array_difference(b'11100');
ERROR 22000: invalid obj type for type promotion: left_type=ARRAY right_type=HEX_STRING
select array_difference(rb_from_string('1,2,3'));
ERROR 22000: invalid obj type for type promotion: left_type=ARRAY right_type=ROARINGBITMAP
select array_difference(st_geomfromtext('LINESTRING(0 0, 10 10, 20 25, 50 60)'));
ERROR 22000: invalid obj type for type promotion: left_type=ARRAY right_type=GEOMETRY
drop table if exists tt3;
create table tt3(id int primary key,a0 varchar(50),a1 char(10),a2 binary(10),a3 varbinary(10));
drop view if exists vtt3;
create view vtt3 as select * from tt3;
insert into tt3 values(1,'[1,2,3,4]','[1,2,3,4]','[1,2,3,4]','[1,2,3,4]');
insert into tt3 values(2,'test','test','test','test');
select array_difference(a0) from tt3 where id=1;
ERROR 22000: invalid obj type for type promotion: left_type=ARRAY right_type=VARCHAR
select array_difference(a1) from vtt3 where id=1;
ERROR 22000: invalid obj type for type promotion: left_type=ARRAY right_type=CHAR
select array_difference(a2) from vtt3 where id=1;
ERROR 22000: invalid obj type for type promotion: left_type=ARRAY right_type=CHAR
select array_difference(a3) from tt3 where id=1;
ERROR 22000: invalid obj type for type promotion: left_type=ARRAY right_type=VARCHAR
select array_difference([id,a0]) from tt3 where id=2;
ERROR 0A000: array_difference with non-numeric type not supported
drop table if exists tt3;
create table tt3(id int primary key,a0 TINYTEXT,a1 TEXT,a2 MEDIUMTEXT,a3 LONGTEXT);
drop view if exists vtt3;
create view vtt3 as select * from tt3;
insert into tt3 values(1,'[1,2,3,4]','[1,2,3,4]','[1,2,3,4]','[1,2,3,4]');
insert into tt3 values(2,'test','test','test','test');
select array_difference(a0) from tt3 where id=1;
ERROR 22000: invalid obj type for type promotion: left_type=ARRAY right_type=TINYTEXT
select array_difference(a1) from vtt3 where id=1;
ERROR 22000: invalid obj type for type promotion: left_type=ARRAY right_type=TEXT
select array_difference(a2) from vtt3 where id=1;
ERROR 22000: invalid obj type for type promotion: left_type=ARRAY right_type=MEDIUMTEXT
select array_difference(a3) from tt3 where id=1;
ERROR 22000: invalid obj type for type promotion: left_type=ARRAY right_type=LONGTEXT
drop table if exists tt3;
create table tt3(id int primary key,a0 TINYBLOB,a1 BLOB,a2 MEDIUMBLOB,a3 LONGBLOB);
drop view if exists vtt3;
create view vtt3 as select * from tt3;
insert into tt3 values(1,'[1,2,3,4]','[1,2,3,4]','[1,2,3,4]','[1,2,3,4]');
insert into tt3 values(2,'test','test','test','test');
select array_difference(a0) from tt3 where id=1;
ERROR 22000: invalid obj type for type promotion: left_type=ARRAY right_type=TINYTEXT
select array_difference(a1) from vtt3 where id=1;
ERROR 22000: invalid obj type for type promotion: left_type=ARRAY right_type=TEXT
select array_difference(a2) from vtt3 where id=1;
ERROR 22000: invalid obj type for type promotion: left_type=ARRAY right_type=MEDIUMTEXT
select array_difference(a3) from tt3 where id=1;
ERROR 22000: invalid obj type for type promotion: left_type=ARRAY right_type=LONGTEXT
drop table if exists tt3;
create table tt3(id int unsigned primary key,a0 BOOL,a1 BOOLEAN ,a2 TINYINT,a3 SMALLINT,a4 MEDIUMINT, a5 INT,a6 BIGINT,a7 SERIAL);
drop view if exists vtt3;
create view vtt3 as select * from tt3;
insert into tt3 values(1,2,1,3,5,5,8,9,10);
insert into tt3 values(2,-2,-2,-2,-2,-2,-2,-2,11);
select array_difference(a0) from tt3 where id=1;
ERROR 22000: invalid obj type for type promotion: left_type=ARRAY right_type=TINYINT
select array_difference(a1) from vtt3 ;
ERROR 22000: invalid obj type for type promotion: left_type=ARRAY right_type=TINYINT
select array_difference(a2) from vtt3 ;
ERROR 22000: invalid obj type for type promotion: left_type=ARRAY right_type=TINYINT
select array_difference(a3) from tt3 ;
ERROR 22000: invalid obj type for type promotion: left_type=ARRAY right_type=SMALLINT
select array_difference(id) from tt3;
ERROR 22000: invalid obj type for type promotion: left_type=ARRAY right_type=INT UNSIGNED
select array_difference(a4) from tt3 ;
ERROR 22000: invalid obj type for type promotion: left_type=ARRAY right_type=MEDIUMINT
select array_difference(a5) from tt3;
ERROR 22000: invalid obj type for type promotion: left_type=ARRAY right_type=INT
select array_difference(a6) from tt3 ;
ERROR 22000: invalid obj type for type promotion: left_type=ARRAY right_type=BIGINT
select array_difference(a7) from tt3 ;
ERROR 22000: invalid obj type for type promotion: left_type=ARRAY right_type=BIGINT UNSIGNED
select array_difference([id,a0,a1,a2,a3,a5,a6,a7]) from tt3 ;
+---------------------------------------------+
| array_difference([id,a0,a1,a2,a3,a5,a6,a7]) |
+---------------------------------------------+
| [0,1,-1,2,2,3,1,1]                          |
| [0,-4,0,0,0,0,0,13]                         |
+---------------------------------------------+
drop table if exists tt3;
create table tt3(id int  primary key,a0 BOOL ,a1 BOOLEAN ,a2 TINYINT unsigned,a3 SMALLINT unsigned,a4 MEDIUMINT unsigned, a5 INTEGER unsigned,a6 BIGINT unsigned,a7 SERIAL );
drop view if exists vtt3;
create view vtt3 as select * from tt3;
insert into tt3 values(1,2,1,3,5,5,8,9,10);
insert into tt3 values(2,2,2,2,2,2,2,2,11);
select array_difference(a0) from tt3 where id=1;
ERROR 22000: invalid obj type for type promotion: left_type=ARRAY right_type=TINYINT
select array_difference(a1) from vtt3 ;
ERROR 22000: invalid obj type for type promotion: left_type=ARRAY right_type=TINYINT
select array_difference(a2) from vtt3 ;
ERROR 22000: invalid obj type for type promotion: left_type=ARRAY right_type=TINYINT UNSIGNED
select array_difference(a3) from tt3 ;
ERROR 22000: invalid obj type for type promotion: left_type=ARRAY right_type=SMALLINT UNSIGNED
select array_difference(id) from tt3;
ERROR 22000: invalid obj type for type promotion: left_type=ARRAY right_type=INT
select array_difference(a4) from tt3 ;
ERROR 22000: invalid obj type for type promotion: left_type=ARRAY right_type=MEDIUMINT UNSIGNED
select array_difference(a5) from tt3;
ERROR 22000: invalid obj type for type promotion: left_type=ARRAY right_type=INT UNSIGNED
select array_difference(a6) from tt3 ;
ERROR 22000: invalid obj type for type promotion: left_type=ARRAY right_type=BIGINT UNSIGNED
select array_difference(a7) from tt3 ;
ERROR 22000: invalid obj type for type promotion: left_type=ARRAY right_type=BIGINT UNSIGNED
select array_difference([a0,a1,a2,a3,a5,a6,a7]) from tt3 ;
+------------------------------------------+
| array_difference([a0,a1,a2,a3,a5,a6,a7]) |
+------------------------------------------+
| [0,-1,2,2,3,1,1]                         |
| [0,0,0,0,0,0,9]                          |
+------------------------------------------+
select array_difference([id,a0,a1,a2,a3,a5,a6,a7]) from vtt3 ;
+---------------------------------------------+
| array_difference([id,a0,a1,a2,a3,a5,a6,a7]) |
+---------------------------------------------+
| [0,1,-1,2,2,3,1,1]                          |
| [0,0,0,0,0,0,0,9]                           |
+---------------------------------------------+
drop table if exists tt3;
create table tt3(id int  primary key,a0 DECIMAL,a1 NUMERIC(10,5),a2 FIXED unsigned ,a3 DEC(10,5) unsigned);
drop view if exists vtt3;
create view vtt3 as select * from tt3;
insert into tt3 values(1,-2.5,-1.8,5,89.97656);
Warnings:
Warning	1265	Data truncated for column 'a0' at row 1
insert into tt3 values(2,2,2,2,2);
select array_difference(a0) from tt3 ;
ERROR 22000: invalid obj type for type promotion: left_type=ARRAY right_type=DECIMAL
select array_difference(a1) from tt3 ;
ERROR 22000: invalid obj type for type promotion: left_type=ARRAY right_type=DECIMAL
select array_difference(a2) from tt3 ;
ERROR 22000: invalid obj type for type promotion: left_type=ARRAY right_type=DECIMAL UNSIGNED
select array_difference(a3) from tt3 ;
ERROR 22000: invalid obj type for type promotion: left_type=ARRAY right_type=DECIMAL UNSIGNED
select array_difference([id,a0,a1,a2,a3]) from tt3 ;
+------------------------------------+
| array_difference([id,a0,a1,a2,a3]) |
+------------------------------------+
| [0,-4,1.2,6.8,84.97656]            |
| [0,0,0,0,0]                        |
+------------------------------------+
select array_difference([id,a0,a1,a2,a3]) from vtt3 ;
+------------------------------------+
| array_difference([id,a0,a1,a2,a3]) |
+------------------------------------+
| [0,-4,1.2,6.8,84.97656]            |
| [0,0,0,0,0]                        |
+------------------------------------+
drop table if exists tt3;
create table tt3(id int  primary key,a0 FLOAT,a1 FLOAT unsigned,a2 double  ,a3 double unsigned);
drop view if exists vtt3;
create view vtt3 as select * from tt3;
insert into tt3 values(1,-25.787,85E+2,-1.7976931348623157E+30,1.7976931348623157E+308);
select array_difference(a0) from tt3 ;
ERROR 22000: invalid obj type for type promotion: left_type=ARRAY right_type=FLOAT
select array_difference(a1) from tt3 ;
ERROR 22000: invalid obj type for type promotion: left_type=ARRAY right_type=FLOAT UNSIGNED
select array_difference(a2) from tt3 ;
ERROR 22000: invalid obj type for type promotion: left_type=ARRAY right_type=DOUBLE
select array_difference(a3) from tt3 ;
ERROR 22000: invalid obj type for type promotion: left_type=ARRAY right_type=DOUBLE UNSIGNED
select array_difference([a0,a1,a2,a3]) from tt3 ;
+---------------------------------------------------------------------+
| array_difference([a0,a1,a2,a3])                                     |
+---------------------------------------------------------------------+
| [0,8525.787000656128,-1.7976931348623158e30,1.7976931348623157e308] |
+---------------------------------------------------------------------+
select array_difference([id,a0,a1,a2,a3]) from vtt3 ;
+----------------------------------------------------------------------------------------+
| array_difference([id,a0,a1,a2,a3])                                                     |
+----------------------------------------------------------------------------------------+
| [0,-26.78700065612793,8525.787000656128,-1.7976931348623158e30,1.7976931348623157e308] |
+----------------------------------------------------------------------------------------+
select array_difference([id,a0,a1,a2,a3,1,true]) from tt3 ;
+------------------------------------------------------------------------------------------------------------------+
| array_difference([id,a0,a1,a2,a3,1,true])                                                                        |
+------------------------------------------------------------------------------------------------------------------+
| [0,-26.78700065612793,8525.787000656128,-1.7976931348623158e30,1.7976931348623157e308,-1.7976931348623157e308,0] |
+------------------------------------------------------------------------------------------------------------------+
drop table if exists tt3;
create table tt3(id int  primary key,a0 BIT(10));
drop view if exists vtt3;
create view vtt3 as select * from tt3;
insert into tt3 values(1,b'111');
select array_difference(a0) from tt3 ;
ERROR 22000: invalid obj type for type promotion: left_type=ARRAY right_type=BIT
drop table if exists tt3;
create table tt3(id int  primary key,a0 DATE,a1 DATETIME,a2 TIMESTAMP,a3 time,a4 year);
drop view if exists vtt3;
create view vtt3 as select * from tt3;
insert into tt3 values(1,'2010-10-10','2010-10-10 14:14:55','9999-12-31 23:59:59.999999','14"14:14','2011');
select array_difference(a0) from tt3 ;
ERROR 22000: invalid obj type for type promotion: left_type=ARRAY right_type=MYSQL_DATE
select array_difference(a1) from tt3 ;
ERROR 22000: invalid obj type for type promotion: left_type=ARRAY right_type=MYSQL_DATETIME
select array_difference(a2) from tt3 ;
ERROR 22000: invalid obj type for type promotion: left_type=ARRAY right_type=TIMESTAMP
select array_difference(a3) from tt3 ;
ERROR 22000: invalid obj type for type promotion: left_type=ARRAY right_type=TIME
drop table if exists tt3;
create table tt3(id int  primary key,a0 ENUM('1,2'),a1 SET('1','2'));
drop view if exists vtt3;
create view vtt3 as select * from tt3;
insert into tt3 values(1,1,2);
select array_difference(a0) from tt3 ;
ERROR 22000: invalid obj type for type promotion: left_type=ARRAY right_type=ENUM
select array_difference(a1) from tt3 ;
ERROR 22000: invalid obj type for type promotion: left_type=ARRAY right_type=SET
drop table if exists tt3;
create table tt3(id int  primary key,a0 JSON ,a1 POINT,a2 RoaringBitmap);
drop view if exists vtt3;
create view vtt3 as select * from tt3;
select array_difference(a0) from tt3 ;
ERROR 22000: invalid obj type for type promotion: left_type=ARRAY right_type=JSON
select array_difference(a1) from tt3 ;
ERROR 22000: invalid obj type for type promotion: left_type=ARRAY right_type=GEOMETRY
select array_difference(a2) from tt3 ;
ERROR 22000: invalid obj type for type promotion: left_type=ARRAY right_type=ROARINGBITMAP
select array_difference();
ERROR 42000: Incorrect parameter count in the call to native function 'array_difference'
select array_difference([1],[1]);
ERROR 42000: Incorrect parameter count in the call to native function 'array_difference'
drop table if exists tt3;
CREATE TABLE tt3 (id int primary key, d varchar(50), c2 int[],c3 array(float),c4 varchar(256)[][],v vector(2)) partition by hash(id);
insert into tt3 values(1,1,[1,2,3,5],[2.123,2.123,3.123,4.123],[['中文ing123',1,'1']],[1,23]);
insert into tt3 values(2,2,[2,3,4,5],[2.123,2.123,3.123,4.123],[[null,'a','sss']],[1,23]);
insert into tt3 values(3,3,[3,3,3,3],[3.123,2.123,3.123,4.123],[['null','a','sss'],null],[1,23]);
insert into tt3 values(4,4,[2,3,4,5],[4.123,2.123,3.123,4.123],[[2,3,4,5],null],[1,23]);
insert into tt3 values(5,null,null,null,null,null);
insert into tt3(id) values(7);
insert into tt3 values(8,8,'[]','[]','[[]]','[1,2]');
insert into tt3 values(9,9,'[-12,7347]','[1,2,5,6]',[[1,'test'],[2,3,NULL],NULL],'[25,-50]');
drop view if exists vtt3;
create view vtt3 as select * from tt3;
select array_difference(c2) c2,array_difference(c3) c3,array_difference(v) v from tt3 where id  in (1,2,3,4,5,7,8);
+-----------+------------+--------+
| c2        | c3         | v      |
+-----------+------------+--------+
| [0,1,1,2] | [0,0,1,1]  | [0,22] |
| [0,1,1,1] | [0,0,1,1]  | [0,22] |
| [0,0,0,0] | [0,-1,1,1] | [0,22] |
| [0,1,1,1] | [0,-2,1,1] | [0,22] |
| NULL      | NULL       | NULL   |
| NULL      | NULL       | NULL   |
| []        | []         | [0,1]  |
+-----------+------------+--------+
select *,array_difference(c2) c2,array_difference(c3) c3,array_difference(v) v from vtt3 where id  in (1,2,3,4,5,7,8);
+----+------+-----------+---------------------------+----------------------------+--------+-----------+------------+--------+
| id | d    | c2        | c3                        | c4                         | v      | c2        | c3         | v      |
+----+------+-----------+---------------------------+----------------------------+--------+-----------+------------+--------+
|  1 | 1    | [1,2,3,5] | [2.123,2.123,3.123,4.123] | [["中文ing123","1","1"]]   | [1,23] | [0,1,1,2] | [0,0,1,1]  | [0,22] |
|  2 | 2    | [2,3,4,5] | [2.123,2.123,3.123,4.123] | [[NULL,"a","sss"]]         | [1,23] | [0,1,1,1] | [0,0,1,1]  | [0,22] |
|  3 | 3    | [3,3,3,3] | [3.123,2.123,3.123,4.123] | [["null","a","sss"],NULL]  | [1,23] | [0,0,0,0] | [0,-1,1,1] | [0,22] |
|  4 | 4    | [2,3,4,5] | [4.123,2.123,3.123,4.123] | [["2","3","4","5"],NULL]   | [1,23] | [0,1,1,1] | [0,-2,1,1] | [0,22] |
|  5 | NULL | NULL      | NULL                      | NULL                       | NULL   | NULL      | NULL       | NULL   |
|  7 | NULL | NULL      | NULL                      | NULL                       | NULL   | NULL      | NULL       | NULL   |
|  8 | 8    | []        | []                        | [[]]                       | [1,2]  | []        | []         | [0,1]  |
+----+------+-----------+---------------------------+----------------------------+--------+-----------+------------+--------+
select *,array_difference(c2) c2,array_difference(c3) c3,array_difference(v) v from tt3 where id  in (1,2,3,4,5,7,8) ORDER BY array_difference(c2);
ERROR 22000: Invalid data type for the operation
select *,array_difference(c2) c2,array_difference(c3) c3,array_difference(v) v from vtt3 where id  in (1,2,3,4,5,7,8) ORDER BY array_difference(c2) desc;
ERROR 22000: Invalid data type for the operation
select *,array_difference(c2) c2,array_difference(c3) c3,array_difference(v) v from tt3 where id  in (1,2,3,4,5,7,8) ORDER BY array_difference([1,2,3,4]) desc;
+----+------+-----------+---------------------------+----------------------------+--------+-----------+------------+--------+
| id | d    | c2        | c3                        | c4                         | v      | c2        | c3         | v      |
+----+------+-----------+---------------------------+----------------------------+--------+-----------+------------+--------+
|  1 | 1    | [1,2,3,5] | [2.123,2.123,3.123,4.123] | [["中文ing123","1","1"]]   | [1,23] | [0,1,1,2] | [0,0,1,1]  | [0,22] |
|  2 | 2    | [2,3,4,5] | [2.123,2.123,3.123,4.123] | [[NULL,"a","sss"]]         | [1,23] | [0,1,1,1] | [0,0,1,1]  | [0,22] |
|  3 | 3    | [3,3,3,3] | [3.123,2.123,3.123,4.123] | [["null","a","sss"],NULL]  | [1,23] | [0,0,0,0] | [0,-1,1,1] | [0,22] |
|  4 | 4    | [2,3,4,5] | [4.123,2.123,3.123,4.123] | [["2","3","4","5"],NULL]   | [1,23] | [0,1,1,1] | [0,-2,1,1] | [0,22] |
|  5 | NULL | NULL      | NULL                      | NULL                       | NULL   | NULL      | NULL       | NULL   |
|  7 | NULL | NULL      | NULL                      | NULL                       | NULL   | NULL      | NULL       | NULL   |
|  8 | 8    | []        | []                        | [[]]                       | [1,2]  | []        | []         | [0,1]  |
+----+------+-----------+---------------------------+----------------------------+--------+-----------+------------+--------+
bug 2024121300106464859   《[obmysql_array]order by 两列 含有array类型，ob未判断校验》
select *,array_difference(c2) cc2,array_difference(c3) c3,array_difference(v) v from tt3 where id  in (1,2,3,4,5,7,8) ORDER BY d desc ,c2 asc;
ERROR 22000: Invalid data type for the operation
select *,array_difference(c2) ,array_difference(c3) ,array_difference(v)  from tt3 where id  in (1,2,3,4,5,7,8) group by array_difference(c2);
ERROR 22000: Invalid data type for the operation
select *,array_difference(c2) ,array_difference(c3) ,array_difference(v)  from tt3 where id  in (1,2,3,4,5,7,8) group by array_difference(c2) ,c3;
ERROR 22000: Invalid data type for the operation
select *,array_difference(c2) ,array_difference(c3) ,array_difference(v)  from tt3 where id  in (1,2,3,4,5,7,8) group by id,d;
+----+------+-----------+---------------------------+----------------------------+--------+----------------------+----------------------+---------------------+
| id | d    | c2        | c3                        | c4                         | v      | array_difference(c2) | array_difference(c3) | array_difference(v) |
+----+------+-----------+---------------------------+----------------------------+--------+----------------------+----------------------+---------------------+
|  1 | 1    | [1,2,3,5] | [2.123,2.123,3.123,4.123] | [["中文ing123","1","1"]]   | [1,23] | [0,1,1,2]            | [0,0,1,1]            | [0,22]              |
|  2 | 2    | [2,3,4,5] | [2.123,2.123,3.123,4.123] | [[NULL,"a","sss"]]         | [1,23] | [0,1,1,1]            | [0,0,1,1]            | [0,22]              |
|  3 | 3    | [3,3,3,3] | [3.123,2.123,3.123,4.123] | [["null","a","sss"],NULL]  | [1,23] | [0,0,0,0]            | [0,-1,1,1]           | [0,22]              |
|  4 | 4    | [2,3,4,5] | [4.123,2.123,3.123,4.123] | [["2","3","4","5"],NULL]   | [1,23] | [0,1,1,1]            | [0,-2,1,1]           | [0,22]              |
|  5 | NULL | NULL      | NULL                      | NULL                       | NULL   | NULL                 | NULL                 | NULL                |
|  7 | NULL | NULL      | NULL                      | NULL                       | NULL   | NULL                 | NULL                 | NULL                |
|  8 | 8    | []        | []                        | [[]]                       | [1,2]  | []                   | []                   | [0,1]               |
+----+------+-----------+---------------------------+----------------------------+--------+----------------------+----------------------+---------------------+
select *,array_difference(c2) ,array_difference(c3) ,array_difference(v)  from tt3 where id  in (1,2,3,4,5,7,8) group by id,d having  array_difference(c3)>array_difference(c3);
ERROR 22000: Invalid data type for the operation
bug 2024121300106464859   《[obmysql_array]order by 两列 含有array类型，ob未判断校验》
select *,array_difference(c2) ,array_difference(c3) ,array_difference(v)  from tt3  where id  in (1,2,3,4,5,7,8)  group by id,d order by d,c2 ;
ERROR 22000: Invalid data type for the operation
bug 2024121300106464859   《[obmysql_array]order by 两列 含有array类型，ob未判断校验》
select *,array_difference(c2) ,array_difference(c3) ,array_difference(v)  from vtt3  where id  in (1,2,3,4,5,7,8)  group by id,d order by d,c2 ;
ERROR 22000: Invalid data type for the operation
select distinct array_difference(c2)  from tt3 where id  in (1,2,3,4,5,7,8) ;
ERROR 22000: Invalid data type for the operation
select distinct array_difference(c2)  from vtt3 where id  in (1,2,3,4,5,7,8) ;
ERROR 22000: Invalid data type for the operation
select distinct array_difference(t1.v) b from tt3 t1 inner join tt3 t2 on array_difference(t1.c2) =array_difference(t2.c2);
ERROR 22000: Invalid data type for the operation
select *, array_difference(c2) b from tt3 limit 1;
+----+------+-----------+---------------------------+----------------------------+--------+-----------+
| id | d    | c2        | c3                        | c4                         | v      | b         |
+----+------+-----------+---------------------------+----------------------------+--------+-----------+
|  1 | 1    | [1,2,3,5] | [2.123,2.123,3.123,4.123] | [["中文ing123","1","1"]]   | [1,23] | [0,1,1,2] |
+----+------+-----------+---------------------------+----------------------------+--------+-----------+
select *, array_difference(t1.v) b from tt3 t1 inner join tt3 t2 on array_difference(t1.c2) =array_difference(t2.c2)  limit 2;
+----+------+-----------+---------------------------+----------------------------+--------+----+------+-----------+---------------------------+----------------------------+--------+--------+
| id | d    | c2        | c3                        | c4                         | v      | id | d    | c2        | c3                        | c4                         | v      | b      |
+----+------+-----------+---------------------------+----------------------------+--------+----+------+-----------+---------------------------+----------------------------+--------+--------+
|  1 | 1    | [1,2,3,5] | [2.123,2.123,3.123,4.123] | [["中文ing123","1","1"]]   | [1,23] |  1 | 1    | [1,2,3,5] | [2.123,2.123,3.123,4.123] | [["中文ing123","1","1"]]   | [1,23] | [0,22] |
|  4 | 4    | [2,3,4,5] | [4.123,2.123,3.123,4.123] | [["2","3","4","5"],NULL]   | [1,23] |  2 | 2    | [2,3,4,5] | [2.123,2.123,3.123,4.123] | [[NULL,"a","sss"]]         | [1,23] | [0,22] |
+----+------+-----------+---------------------------+----------------------------+--------+----+------+-----------+---------------------------+----------------------------+--------+--------+
WITH Alice_Students AS (
 select *, array_difference(c2) b from tt3
)
SELECT * FROM Alice_Students;
+----+------+------------+---------------------------+------------------------------------+----------+-----------+
| id | d    | c2         | c3                        | c4                                 | v        | b         |
+----+------+------------+---------------------------+------------------------------------+----------+-----------+
|  1 | 1    | [1,2,3,5]  | [2.123,2.123,3.123,4.123] | [["中文ing123","1","1"]]           | [1,23]   | [0,1,1,2] |
|  2 | 2    | [2,3,4,5]  | [2.123,2.123,3.123,4.123] | [[NULL,"a","sss"]]                 | [1,23]   | [0,1,1,1] |
|  3 | 3    | [3,3,3,3]  | [3.123,2.123,3.123,4.123] | [["null","a","sss"],NULL]          | [1,23]   | [0,0,0,0] |
|  4 | 4    | [2,3,4,5]  | [4.123,2.123,3.123,4.123] | [["2","3","4","5"],NULL]           | [1,23]   | [0,1,1,1] |
|  5 | NULL | NULL       | NULL                      | NULL                               | NULL     | NULL      |
|  7 | NULL | NULL       | NULL                      | NULL                               | NULL     | NULL      |
|  8 | 8    | []         | []                        | [[]]                               | [1,2]    | []        |
|  9 | 9    | [-12,7347] | [1,2,5,6]                 | [["1","test"],["2","3",NULL],NULL] | [25,-50] | [0,7359]  |
+----+------+------------+---------------------------+------------------------------------+----------+-----------+
WITH Alice_Students AS (
 select *, array_difference(v) b from vtt3
)
SELECT * FROM Alice_Students;
+----+------+------------+---------------------------+------------------------------------+----------+---------+
| id | d    | c2         | c3                        | c4                                 | v        | b       |
+----+------+------------+---------------------------+------------------------------------+----------+---------+
|  1 | 1    | [1,2,3,5]  | [2.123,2.123,3.123,4.123] | [["中文ing123","1","1"]]           | [1,23]   | [0,22]  |
|  2 | 2    | [2,3,4,5]  | [2.123,2.123,3.123,4.123] | [[NULL,"a","sss"]]                 | [1,23]   | [0,22]  |
|  3 | 3    | [3,3,3,3]  | [3.123,2.123,3.123,4.123] | [["null","a","sss"],NULL]          | [1,23]   | [0,22]  |
|  4 | 4    | [2,3,4,5]  | [4.123,2.123,3.123,4.123] | [["2","3","4","5"],NULL]           | [1,23]   | [0,22]  |
|  5 | NULL | NULL       | NULL                      | NULL                               | NULL     | NULL    |
|  7 | NULL | NULL       | NULL                      | NULL                               | NULL     | NULL    |
|  8 | 8    | []         | []                        | [[]]                               | [1,2]    | [0,1]   |
|  9 | 9    | [-12,7347] | [1,2,5,6]                 | [["1","test"],["2","3",NULL],NULL] | [25,-50] | [0,-75] |
+----+------+------------+---------------------------+------------------------------------+----------+---------+
WITH Alice_Students AS (
select  array_difference(t1.v) b from tt3 t1 inner join tt3 t2 on array_difference(t1.c2) =array_difference(t2.c2)
)
SELECT * FROM Alice_Students;
+---------+
| b       |
+---------+
| [0,22]  |
| [0,22]  |
| [0,22]  |
| [0,22]  |
| [0,1]   |
| [0,-75] |
| [0,22]  |
| [0,22]  |
+---------+
WITH Alice_Students AS (
 select *, array_difference([1,2,3,4,5,6,7,8]) b from vtt3
)
SELECT * FROM Alice_Students;
+----+------+------------+---------------------------+------------------------------------+----------+-------------------+
| id | d    | c2         | c3                        | c4                                 | v        | b                 |
+----+------+------------+---------------------------+------------------------------------+----------+-------------------+
|  1 | 1    | [1,2,3,5]  | [2.123,2.123,3.123,4.123] | [["中文ing123","1","1"]]           | [1,23]   | [0,1,1,1,1,1,1,1] |
|  2 | 2    | [2,3,4,5]  | [2.123,2.123,3.123,4.123] | [[NULL,"a","sss"]]                 | [1,23]   | [0,1,1,1,1,1,1,1] |
|  3 | 3    | [3,3,3,3]  | [3.123,2.123,3.123,4.123] | [["null","a","sss"],NULL]          | [1,23]   | [0,1,1,1,1,1,1,1] |
|  4 | 4    | [2,3,4,5]  | [4.123,2.123,3.123,4.123] | [["2","3","4","5"],NULL]           | [1,23]   | [0,1,1,1,1,1,1,1] |
|  5 | NULL | NULL       | NULL                      | NULL                               | NULL     | [0,1,1,1,1,1,1,1] |
|  7 | NULL | NULL       | NULL                      | NULL                               | NULL     | [0,1,1,1,1,1,1,1] |
|  8 | 8    | []         | []                        | [[]]                               | [1,2]    | [0,1,1,1,1,1,1,1] |
|  9 | 9    | [-12,7347] | [1,2,5,6]                 | [["1","test"],["2","3",NULL],NULL] | [25,-50] | [0,1,1,1,1,1,1,1] |
+----+------+------------+---------------------------+------------------------------------+----------+-------------------+
SELECT CASE array_difference(t1.c2) WHEN array_difference(t1.c2) THEN  array_difference(t1.c2) WHEN  array_difference(t1.c3)  THEN  array_difference(t1.c3) END from tt3 t1;
+----------------------------------------------------------------------------------------------------------------------------------------------------------+
| CASE array_difference(t1.c2) WHEN array_difference(t1.c2) THEN  array_difference(t1.c2) WHEN  array_difference(t1.c3)  THEN  array_difference(t1.c3) END |
+----------------------------------------------------------------------------------------------------------------------------------------------------------+
| [0,1,1,2]                                                                                                                                                |
| [0,1,1,1]                                                                                                                                                |
| [0,0,0,0]                                                                                                                                                |
| [0,1,1,1]                                                                                                                                                |
| NULL                                                                                                                                                     |
| NULL                                                                                                                                                     |
| []                                                                                                                                                       |
| [0,7359]                                                                                                                                                 |
+----------------------------------------------------------------------------------------------------------------------------------------------------------+
SELECT CASE array_difference(t1.c2) WHEN array_difference(t1.c2) THEN  array_difference(t1.c2) WHEN  array_difference(t1.c3)  THEN  array_difference(t1.c3) else array_difference([1,2,3,4,5]) END from tt3 t1;
+---------------------------------------------------------------------------------------------------------------------------------------------------------------------------------------------+
| CASE array_difference(t1.c2) WHEN array_difference(t1.c2) THEN  array_difference(t1.c2) WHEN  array_difference(t1.c3)  THEN  array_difference(t1.c3) else array_difference([1,2,3,4,5]) END |
+---------------------------------------------------------------------------------------------------------------------------------------------------------------------------------------------+
| [0,1,1,2]                                                                                                                                                                                   |
| [0,1,1,1]                                                                                                                                                                                   |
| [0,0,0,0]                                                                                                                                                                                   |
| [0,1,1,1]                                                                                                                                                                                   |
| [0,1,1,1,1]                                                                                                                                                                                 |
| [0,1,1,1,1]                                                                                                                                                                                 |
| []                                                                                                                                                                                          |
| [0,7359]                                                                                                                                                                                    |
+---------------------------------------------------------------------------------------------------------------------------------------------------------------------------------------------+
SELECT CASE 'test' WHEN 'test' THEN  array_difference(array_difference([1,2,3,4,59])) WHEN  'test1'  THEN  array_difference(array_range(20)) else array_difference(array_range(30)) END;
+----------------------------------------------------------------------------------------------------------------------------------------------------------------------------------+
| CASE 'test' WHEN 'test' THEN  array_difference(array_difference([1,2,3,4,59])) WHEN  'test1'  THEN  array_difference(array_range(20)) else array_difference(array_range(30)) END |
+----------------------------------------------------------------------------------------------------------------------------------------------------------------------------------+
| [0,1,0,0,54]                                                                                                                                                                     |
+----------------------------------------------------------------------------------------------------------------------------------------------------------------------------------+
SELECT CASE array_difference(array_range(t1.id)) WHEN array_difference(array_range(t1.id)) THEN  array_difference(array_range(t1.id)) WHEN  array_difference(array_range(t1.id))  THEN  array_difference(array_range(t1.id)) END from tt3 t1;
+---------------------------------------------------------------------------------------------------------------------------------------------------------------------------------------------------------------------------+
| CASE array_difference(array_range(t1.id)) WHEN array_difference(array_range(t1.id)) THEN  array_difference(array_range(t1.id)) WHEN  array_difference(array_range(t1.id))  THEN  array_difference(array_range(t1.id)) END |
+---------------------------------------------------------------------------------------------------------------------------------------------------------------------------------------------------------------------------+
| [0]                                                                                                                                                                                                                       |
| [0,1]                                                                                                                                                                                                                     |
| [0,1,1]                                                                                                                                                                                                                   |
| [0,1,1,1]                                                                                                                                                                                                                 |
| [0,1,1,1,1]                                                                                                                                                                                                               |
| [0,1,1,1,1,1,1]                                                                                                                                                                                                           |
| [0,1,1,1,1,1,1,1]                                                                                                                                                                                                         |
| [0,1,1,1,1,1,1,1,1]                                                                                                                                                                                                       |
+---------------------------------------------------------------------------------------------------------------------------------------------------------------------------------------------------------------------------+
SELECT CASE array_difference(array_range(t2.id)) WHEN array_difference(array_range(t1.id)) THEN  array_difference(array_range(t2.id))
 WHEN  array_difference(array_range(t1.id))  THEN  array_difference(array_range(t2.id)) END from tt3 t1 ,tt3 t2;
+----------------------------------------------------------------------------------------------------------------------------------------------------------------------------------------------------------------------------+
| CASE array_difference(array_range(t2.id)) WHEN array_difference(array_range(t1.id)) THEN  array_difference(array_range(t2.id))
 WHEN  array_difference(array_range(t1.id))  THEN  array_difference(array_range(t2.id)) END |
+----------------------------------------------------------------------------------------------------------------------------------------------------------------------------------------------------------------------------+
| [0]                                                                                                                                                                                                                        |
| NULL                                                                                                                                                                                                                       |
| NULL                                                                                                                                                                                                                       |
| NULL                                                                                                                                                                                                                       |
| NULL                                                                                                                                                                                                                       |
| NULL                                                                                                                                                                                                                       |
| NULL                                                                                                                                                                                                                       |
| NULL                                                                                                                                                                                                                       |
| NULL                                                                                                                                                                                                                       |
| [0,1]                                                                                                                                                                                                                      |
| NULL                                                                                                                                                                                                                       |
| NULL                                                                                                                                                                                                                       |
| NULL                                                                                                                                                                                                                       |
| NULL                                                                                                                                                                                                                       |
| NULL                                                                                                                                                                                                                       |
| NULL                                                                                                                                                                                                                       |
| NULL                                                                                                                                                                                                                       |
| NULL                                                                                                                                                                                                                       |
| [0,1,1]                                                                                                                                                                                                                    |
| NULL                                                                                                                                                                                                                       |
| NULL                                                                                                                                                                                                                       |
| NULL                                                                                                                                                                                                                       |
| NULL                                                                                                                                                                                                                       |
| NULL                                                                                                                                                                                                                       |
| NULL                                                                                                                                                                                                                       |
| NULL                                                                                                                                                                                                                       |
| NULL                                                                                                                                                                                                                       |
| [0,1,1,1]                                                                                                                                                                                                                  |
| NULL                                                                                                                                                                                                                       |
| NULL                                                                                                                                                                                                                       |
| NULL                                                                                                                                                                                                                       |
| NULL                                                                                                                                                                                                                       |
| NULL                                                                                                                                                                                                                       |
| NULL                                                                                                                                                                                                                       |
| NULL                                                                                                                                                                                                                       |
| NULL                                                                                                                                                                                                                       |
| [0,1,1,1,1]                                                                                                                                                                                                                |
| NULL                                                                                                                                                                                                                       |
| NULL                                                                                                                                                                                                                       |
| NULL                                                                                                                                                                                                                       |
| NULL                                                                                                                                                                                                                       |
| NULL                                                                                                                                                                                                                       |
| NULL                                                                                                                                                                                                                       |
| NULL                                                                                                                                                                                                                       |
| NULL                                                                                                                                                                                                                       |
| [0,1,1,1,1,1,1]                                                                                                                                                                                                            |
| NULL                                                                                                                                                                                                                       |
| NULL                                                                                                                                                                                                                       |
| NULL                                                                                                                                                                                                                       |
| NULL                                                                                                                                                                                                                       |
| NULL                                                                                                                                                                                                                       |
| NULL                                                                                                                                                                                                                       |
| NULL                                                                                                                                                                                                                       |
| NULL                                                                                                                                                                                                                       |
| [0,1,1,1,1,1,1,1]                                                                                                                                                                                                          |
| NULL                                                                                                                                                                                                                       |
| NULL                                                                                                                                                                                                                       |
| NULL                                                                                                                                                                                                                       |
| NULL                                                                                                                                                                                                                       |
| NULL                                                                                                                                                                                                                       |
| NULL                                                                                                                                                                                                                       |
| NULL                                                                                                                                                                                                                       |
| NULL                                                                                                                                                                                                                       |
| [0,1,1,1,1,1,1,1,1]                                                                                                                                                                                                        |
+----------------------------------------------------------------------------------------------------------------------------------------------------------------------------------------------------------------------------+
SELECT CASE array_difference(array_range(t1.id)) WHEN array_difference(array_range(t1.id)) THEN  array_difference(array_range(t2.id))
 WHEN  array_difference(array_range(t1.id))  THEN  array_difference(array_range(t2.id)) END from tt3 t1 ,tt3 t2;
+----------------------------------------------------------------------------------------------------------------------------------------------------------------------------------------------------------------------------+
| CASE array_difference(array_range(t1.id)) WHEN array_difference(array_range(t1.id)) THEN  array_difference(array_range(t2.id))
 WHEN  array_difference(array_range(t1.id))  THEN  array_difference(array_range(t2.id)) END |
+----------------------------------------------------------------------------------------------------------------------------------------------------------------------------------------------------------------------------+
| [0]                                                                                                                                                                                                                        |
| [0,1]                                                                                                                                                                                                                      |
| [0,1,1]                                                                                                                                                                                                                    |
| [0,1,1,1]                                                                                                                                                                                                                  |
| [0,1,1,1,1]                                                                                                                                                                                                                |
| [0,1,1,1,1,1,1]                                                                                                                                                                                                            |
| [0,1,1,1,1,1,1,1]                                                                                                                                                                                                          |
| [0,1,1,1,1,1,1,1,1]                                                                                                                                                                                                        |
| [0]                                                                                                                                                                                                                        |
| [0,1]                                                                                                                                                                                                                      |
| [0,1,1]                                                                                                                                                                                                                    |
| [0,1,1,1]                                                                                                                                                                                                                  |
| [0,1,1,1,1]                                                                                                                                                                                                                |
| [0,1,1,1,1,1,1]                                                                                                                                                                                                            |
| [0,1,1,1,1,1,1,1]                                                                                                                                                                                                          |
| [0,1,1,1,1,1,1,1,1]                                                                                                                                                                                                        |
| [0]                                                                                                                                                                                                                        |
| [0,1]                                                                                                                                                                                                                      |
| [0,1,1]                                                                                                                                                                                                                    |
| [0,1,1,1]                                                                                                                                                                                                                  |
| [0,1,1,1,1]                                                                                                                                                                                                                |
| [0,1,1,1,1,1,1]                                                                                                                                                                                                            |
| [0,1,1,1,1,1,1,1]                                                                                                                                                                                                          |
| [0,1,1,1,1,1,1,1,1]                                                                                                                                                                                                        |
| [0]                                                                                                                                                                                                                        |
| [0,1]                                                                                                                                                                                                                      |
| [0,1,1]                                                                                                                                                                                                                    |
| [0,1,1,1]                                                                                                                                                                                                                  |
| [0,1,1,1,1]                                                                                                                                                                                                                |
| [0,1,1,1,1,1,1]                                                                                                                                                                                                            |
| [0,1,1,1,1,1,1,1]                                                                                                                                                                                                          |
| [0,1,1,1,1,1,1,1,1]                                                                                                                                                                                                        |
| [0]                                                                                                                                                                                                                        |
| [0,1]                                                                                                                                                                                                                      |
| [0,1,1]                                                                                                                                                                                                                    |
| [0,1,1,1]                                                                                                                                                                                                                  |
| [0,1,1,1,1]                                                                                                                                                                                                                |
| [0,1,1,1,1,1,1]                                                                                                                                                                                                            |
| [0,1,1,1,1,1,1,1]                                                                                                                                                                                                          |
| [0,1,1,1,1,1,1,1,1]                                                                                                                                                                                                        |
| [0]                                                                                                                                                                                                                        |
| [0,1]                                                                                                                                                                                                                      |
| [0,1,1]                                                                                                                                                                                                                    |
| [0,1,1,1]                                                                                                                                                                                                                  |
| [0,1,1,1,1]                                                                                                                                                                                                                |
| [0,1,1,1,1,1,1]                                                                                                                                                                                                            |
| [0,1,1,1,1,1,1,1]                                                                                                                                                                                                          |
| [0,1,1,1,1,1,1,1,1]                                                                                                                                                                                                        |
| [0]                                                                                                                                                                                                                        |
| [0,1]                                                                                                                                                                                                                      |
| [0,1,1]                                                                                                                                                                                                                    |
| [0,1,1,1]                                                                                                                                                                                                                  |
| [0,1,1,1,1]                                                                                                                                                                                                                |
| [0,1,1,1,1,1,1]                                                                                                                                                                                                            |
| [0,1,1,1,1,1,1,1]                                                                                                                                                                                                          |
| [0,1,1,1,1,1,1,1,1]                                                                                                                                                                                                        |
| [0]                                                                                                                                                                                                                        |
| [0,1]                                                                                                                                                                                                                      |
| [0,1,1]                                                                                                                                                                                                                    |
| [0,1,1,1]                                                                                                                                                                                                                  |
| [0,1,1,1,1]                                                                                                                                                                                                                |
| [0,1,1,1,1,1,1]                                                                                                                                                                                                            |
| [0,1,1,1,1,1,1,1]                                                                                                                                                                                                          |
| [0,1,1,1,1,1,1,1,1]                                                                                                                                                                                                        |
+----------------------------------------------------------------------------------------------------------------------------------------------------------------------------------------------------------------------------+
drop table if exists tt3;
CREATE TABLE tt3 (id int primary key, d varchar(50), c2 int[],c3 array(float),c4 varchar(256)[][],v vector(2)) partition by hash(id);
insert into tt3 values(1,1,[1,2,3,5],[2.123,2.123,3.123,4.123],[['中文ing123',1,'1']],[1,23]);
insert into tt3 values(2,2,[2,3,4,5],[2.123,2.123,3.123,4.123],[[null,'a','sss']],[1,23]);
insert into tt3 values(3,3,[3,3,3,3],[3.123,2.123,3.123,4.123],[['null','a','sss'],null],[1,23]);
insert into tt3 values(4,4,[2,3,4,5],[4.123,2.123,3.123,4.123],[[2,3,4,5],null],[1,23]);
insert into tt3 values(5,null,null,null,null,null);
insert into tt3 values(6,null,[null,null],[null],[[null]],[1,23]);
insert into tt3(id) values(7);
insert into tt3 values(8,8,'[]','[]','[[]]','[1,2]');
insert into tt3 values(9,9,'[-12,7347]','[1,2,5,6]',[[1,'test'],[2,3,NULL],NULL],'[25,-50]');
insert into tt3 values(10,10,'[null,null]','[]','[null,[],[1],["test",null],[null],[]]','[1,3]');
drop view if exists vtt3;
create view vtt3 as select * from tt3;
select array_difference([1,2,3,4,5,5]) a from (select array_difference([1,2,3,4,5,5]) b);
+---------------+
| a             |
+---------------+
| [0,1,1,1,1,0] |
+---------------+
select array_difference([1,2,3,4,5,5]) a from  dual where array_difference([1,2,3,4,5,5]) in (select array_difference([1,2,3,4,5,5]) b);
ERROR 22000: Invalid data type for the operation
select (select array_difference(c2) from tt3 where id=1);
+---------------------------------------------------+
| (select array_difference(c2) from tt3 where id=1) |
+---------------------------------------------------+
| [0,1,1,2]                                         |
+---------------------------------------------------+
SELECT (SELECT array_difference(c2) FROM tt3 where id=1) FROM dual;
+---------------------------------------------------+
| (SELECT array_difference(c2) FROM tt3 where id=1) |
+---------------------------------------------------+
| [0,1,1,2]                                         |
+---------------------------------------------------+
SELECT array_difference([1,2,3,4,5,5])  FROM dual WHERE array_difference([1,2,3,4,5,5])= (SELECT array_difference([1,2,3,4,5,5]) FROM dual);
+---------------------------------+
| array_difference([1,2,3,4,5,5]) |
+---------------------------------+
| [0,1,1,1,1,0]                   |
+---------------------------------+
SELECT * FROM tt1
 WHERE ROW(c1,c2) = (SELECT array_difference(c1), array_difference(c2) FROM tt2 WHERE id = 1);
ERROR 0A000: array_difference with non-numeric type not supported
drop table if exists tt3;
create table tt3(id int primary key,id1 bigint unsigned,a int[]);
drop view if exists vtt3;
create view vtt3 as select * from tt3;
insert into tt3 values(1,241,[1,3,4]);
insert into tt3 values(2,211,[12,3]);
drop table if exists tt4;
Warnings:
Note	1051	Unknown table 'oblrp.tt4'
create table tt4(id int ,id1 bigint unsigned,a bigint[]);
drop view if exists vtt4;
Warnings:
Note	1051	Unknown table 'oblrp.vtt4'
create view vtt4 as select * from tt4;
insert into tt4 values(1,241,[1,2,3,4,5]);
insert into tt4 values(2,211,[12,3]);
select t3.*,array_difference(t3.a) from tt3 t3 inner join tt4 t4 on array_difference(t3.a)=array_difference(t4.a);
+----+------+--------+------------------------+
| id | id1  | a      | array_difference(t3.a) |
+----+------+--------+------------------------+
|  2 |  211 | [12,3] | [0,-9]                 |
+----+------+--------+------------------------+
select t3.*,array_difference(t3.a) from tt3 t3 right join tt4 t4 on  array_difference(t3.a)=array_difference(t4.a);
+----+------+--------+------------------------+
| id | id1  | a      | array_difference(t3.a) |
+----+------+--------+------------------------+
|  2 |  211 | [12,3] | [0,-9]                 |
| NULL | NULL | NULL   | NULL                   |
+----+------+--------+------------------------+
select t3.*,array_difference(t3.a) from tt3 t3 left join tt4 t4 on  array_difference(t3.a)=array_difference(t4.a);
+----+------+---------+------------------------+
| id | id1  | a       | array_difference(t3.a) |
+----+------+---------+------------------------+
|  1 |  241 | [1,3,4] | [0,2,1]                |
|  2 |  211 | [12,3]  | [0,-9]                 |
+----+------+---------+------------------------+
select t3.*,array_difference(t3.a) from tt3 t3  join tt4 t4 on  array_difference(t3.a)=array_difference(t4.a);
+----+------+--------+------------------------+
| id | id1  | a      | array_difference(t3.a) |
+----+------+--------+------------------------+
|  2 |  211 | [12,3] | [0,-9]                 |
+----+------+--------+------------------------+
select t3.*,array_difference(t3.a) from tt3 t3 inner join tt4 t4 on array_difference(t3.a)=array_difference(t4.a) union select t3.*,array_difference(t3.a) from tt3 t3 inner join tt4 t4 on array_difference(t3.a)=array_difference(t4.a);
+----+------+--------+------------------------+
| id | id1  | a      | array_difference(t3.a) |
+----+------+--------+------------------------+
|  2 |  211 | [12,3] | [0,-9]                 |
+----+------+--------+------------------------+
select t3.*,array_difference(t3.a) from tt3 t3 right join tt4 t4 on  array_difference(t3.a)=array_difference(t4.a) MINUS select t3.*,array_difference(t3.a) from tt3 t3 right join tt4 t4 on  array_difference(t3.a)=array_difference(t4.a);
+------+------+------+------------------------+
| id   | id1  | a    | array_difference(t3.a) |
+------+------+------+------------------------+
+------+------+------+------------------------+
select t3.*,array_difference(t3.a) from tt3 t3 left join tt4 t4 on  array_difference(t3.a)=array_difference(t4.a) UNION ALL select t3.*,array_difference(t3.a) from tt3 t3 left join tt4 t4 on  array_difference(t3.a)=array_difference(t4.a);
+----+------+---------+------------------------+
| id | id1  | a       | array_difference(t3.a) |
+----+------+---------+------------------------+
|  1 |  241 | [1,3,4] | [0,2,1]                |
|  2 |  211 | [12,3]  | [0,-9]                 |
|  1 |  241 | [1,3,4] | [0,2,1]                |
|  2 |  211 | [12,3]  | [0,-9]                 |
+----+------+---------+------------------------+
select t3.*,array_difference(t3.a) from tt3 t3  join tt4 t4 on  array_difference(t3.a)=array_difference(t4.a) INTERSECT select t3.*,array_difference(t3.a) from tt3 t3  join tt4 t4 on  array_difference(t3.a)=array_difference(t4.a);
+----+------+--------+------------------------+
| id | id1  | a      | array_difference(t3.a) |
+----+------+--------+------------------------+
|  2 |  211 | [12,3] | [0,-9]                 |
+----+------+--------+------------------------+
drop table if exists tt3;
CREATE TABLE tt3 (id int primary key, d varchar(50), c2 int[],c3 array(float),c4 varchar(256)[][],v vector(2)) partition by hash(id);
insert into tt3 values(1,1,[1,2,3,5],[2.123,2.123,3.123,4.123],[['中文ing123',1,'1']],[1,23]);
insert into tt3 values(2,2,[2,3,4,5],[2.123,2.123,3.123,4.123],[[null,'a','sss']],[1,23]);
insert into tt3 values(3,3,[3,3,3,3],[3.123,2.123,3.123,4.123],[['null','a','sss'],null],[1,23]);
insert into tt3 values(4,4,[2,3,4,5],[4.123,2.123,3.123,4.123],[[2,3,4,5],null],[1,23]);
insert into tt3 values(5,null,null,null,null,null);
insert into tt3 values(6,null,[null,null],[null],[[null]],[1,23]);
insert into tt3(id) values(7);
insert into tt3 values(8,8,'[]','[]','[[]]','[1,2]');
insert into tt3 values(9,9,'[-12,7347]','[1,2,5,6]',[[1,'test'],[2,3,NULL],NULL],'[25,-50]');
insert into tt3 values(10,10,'[null,null]','[]','[null,[],[1],["test",null],[null],[]]','[1,3]');
drop view if exists vtt3;
create view vtt3 as select * from tt3;
select * from tt3 where array_difference(c2)=array_difference(c2) and id=1;
+----+------+-----------+---------------------------+----------------------------+--------+
| id | d    | c2        | c3                        | c4                         | v      |
+----+------+-----------+---------------------------+----------------------------+--------+
|  1 | 1    | [1,2,3,5] | [2.123,2.123,3.123,4.123] | [["中文ing123","1","1"]]   | [1,23] |
+----+------+-----------+---------------------------+----------------------------+--------+
select * from tt3 where array_difference(c2)<>array_difference(c2) and id=1;
+----+------+------+------+------+------+
| id | d    | c2   | c3   | c4   | v    |
+----+------+------+------+------+------+
+----+------+------+------+------+------+
select * from tt3 where array_difference(c2)!=array_difference(c2) and id=1;
+----+------+------+------+------+------+
| id | d    | c2   | c3   | c4   | v    |
+----+------+------+------+------+------+
+----+------+------+------+------+------+
select * from tt3 where array_difference([1,2,3,4,59])<=array_difference([1,2,3,4,59]);
ERROR 22000: Invalid data type for the operation
select * from tt3 where array_difference([1,2,3,4,59]) in (array_difference([1,2,3,4,59]));
+----+------+-------------+---------------------------+-----------------------------------------+----------+
| id | d    | c2          | c3                        | c4                                      | v        |
+----+------+-------------+---------------------------+-----------------------------------------+----------+
|  1 | 1    | [1,2,3,5]   | [2.123,2.123,3.123,4.123] | [["中文ing123","1","1"]]                | [1,23]   |
|  2 | 2    | [2,3,4,5]   | [2.123,2.123,3.123,4.123] | [[NULL,"a","sss"]]                      | [1,23]   |
|  3 | 3    | [3,3,3,3]   | [3.123,2.123,3.123,4.123] | [["null","a","sss"],NULL]               | [1,23]   |
|  4 | 4    | [2,3,4,5]   | [4.123,2.123,3.123,4.123] | [["2","3","4","5"],NULL]                | [1,23]   |
|  5 | NULL | NULL        | NULL                      | NULL                                    | NULL     |
|  6 | NULL | [NULL,NULL] | [NULL]                    | [[NULL]]                                | [1,23]   |
|  7 | NULL | NULL        | NULL                      | NULL                                    | NULL     |
|  8 | 8    | []          | []                        | [[]]                                    | [1,2]    |
|  9 | 9    | [-12,7347]  | [1,2,5,6]                 | [["1","test"],["2","3",NULL],NULL]      | [25,-50] |
| 10 | 10   | [NULL,NULL] | []                        | [NULL,[],["1"],["test",NULL],[NULL],[]] | [1,3]    |
+----+------+-------------+---------------------------+-----------------------------------------+----------+
select * from tt3 where array_difference([1,2,3,4,59]) not in (array_difference([1,2,3,4,59]));
+----+------+------+------+------+------+
| id | d    | c2   | c3   | c4   | v    |
+----+------+------+------+------+------+
+----+------+------+------+------+------+
select * from tt3 where array_difference([1,2,3,4,59]) BETWEEN array_difference([1,2,3,4,59]) AND array_difference([1,2,3,4,59]);
ERROR 22000: Invalid data type for the operation
select * from tt3 where array_difference([1,2,3,4,59]) not  BETWEEN array_difference([1,2,3,4,59]) AND array_difference([1,2,3,4,59]);
ERROR 22000: Invalid data type for the operation
select * from tt3 where array_difference([1,2,3,4,59]) like array_difference([1,2,3,4,59]);
ERROR 22000: Invalid data type for the operation
select * from tt3 where array_difference([1,2,3,4,59]) not like array_difference([1,2,3,4,59]);
ERROR 22000: Invalid data type for the operation
select * from tt3 where array_difference([1,2,3,4,59]) is true;
ERROR 22000: Invalid data type for the operation
select * from tt3 where array_difference([1,2,3,4,59])  is not true;
ERROR 22000: Invalid data type for the operation
select * from tt3 where array_difference([1,2,3,4,59])  is false;
ERROR 22000: Invalid data type for the operation
select * from tt3 where array_difference([1,2,3,4,59]) is not false;
ERROR 22000: Invalid data type for the operation
select * from tt3 where array_difference([1,2,3,4,59])  is null;
+----+------+------+------+------+------+
| id | d    | c2   | c3   | c4   | v    |
+----+------+------+------+------+------+
+----+------+------+------+------+------+
select * from tt3 where array_difference([1,2,3,4,59])  is not null;
+----+------+-------------+---------------------------+-----------------------------------------+----------+
| id | d    | c2          | c3                        | c4                                      | v        |
+----+------+-------------+---------------------------+-----------------------------------------+----------+
|  1 | 1    | [1,2,3,5]   | [2.123,2.123,3.123,4.123] | [["中文ing123","1","1"]]                | [1,23]   |
|  2 | 2    | [2,3,4,5]   | [2.123,2.123,3.123,4.123] | [[NULL,"a","sss"]]                      | [1,23]   |
|  3 | 3    | [3,3,3,3]   | [3.123,2.123,3.123,4.123] | [["null","a","sss"],NULL]               | [1,23]   |
|  4 | 4    | [2,3,4,5]   | [4.123,2.123,3.123,4.123] | [["2","3","4","5"],NULL]                | [1,23]   |
|  5 | NULL | NULL        | NULL                      | NULL                                    | NULL     |
|  6 | NULL | [NULL,NULL] | [NULL]                    | [[NULL]]                                | [1,23]   |
|  7 | NULL | NULL        | NULL                      | NULL                                    | NULL     |
|  8 | 8    | []          | []                        | [[]]                                    | [1,2]    |
|  9 | 9    | [-12,7347]  | [1,2,5,6]                 | [["1","test"],["2","3",NULL],NULL]      | [25,-50] |
| 10 | 10   | [NULL,NULL] | []                        | [NULL,[],["1"],["test",NULL],[NULL],[]] | [1,3]    |
+----+------+-------------+---------------------------+-----------------------------------------+----------+
select +array_difference([1,2,3,4,59]);
+---------------------------------+
| +array_difference([1,2,3,4,59]) |
+---------------------------------+
| [0,1,1,1,55]                    |
+---------------------------------+
select -array_difference([1,2,3,4,59]);
ERROR 22000: Invalid data type for the operation
select array_difference([1,2,3,4,59])+array_difference([1,2,3,4,59]);
+---------------------------------------------------------------+
| array_difference([1,2,3,4,59])+array_difference([1,2,3,4,59]) |
+---------------------------------------------------------------+
| [0,2,2,2,110]                                                 |
+---------------------------------------------------------------+
select array_difference([1,2,3,4,59])-array_difference([1,2,3,4,59]);
+---------------------------------------------------------------+
| array_difference([1,2,3,4,59])-array_difference([1,2,3,4,59]) |
+---------------------------------------------------------------+
| [0,0,0,0,0]                                                   |
+---------------------------------------------------------------+
select array_difference([1,2,3,4,59])*array_difference([1,2,3,4,59]);
+---------------------------------------------------------------+
| array_difference([1,2,3,4,59])*array_difference([1,2,3,4,59]) |
+---------------------------------------------------------------+
| [0,1,1,1,3025]                                                |
+---------------------------------------------------------------+
select array_difference([1,2,3,4,59])*array_difference([1,2,3,4,59,58]);
ERROR 22000: Invalid dimension for vector.
select array_difference([1,2,3,4,59])/array_difference([1,2,3,4,59]);
ERROR 22000: Invalid data type for the operation
select array_difference([1,2,3,4,59])+array_difference([1,2,3,4,59,0]);
ERROR 22000: array type mismatch found between definition and data
select (array_difference([1,2,3,4,59]))div(array_difference([1,2,3,4,59]));
ERROR 22000: Invalid data type for the operation
select (array_difference([1,2,3,4,59])) mod (array_difference([1,2,3,4,59]));
ERROR 22000: Invalid data type for the operation
select array_difference([1,2,3,4,59])&array_difference([1,2,3,4,59]);
ERROR 22000: Invalid data type for the operation
select array_difference([1,2,3,4,59])|array_difference([1,2,3,4,59]);
ERROR 22000: Invalid data type for the operation
select array_difference([1,2,3,4,59])& ~array_difference([1,2,3,4,59]);
ERROR 22000: Invalid data type for the operation
select array_difference([1,2,3,4,59])^array_difference([1,2,3,4,59]);
ERROR 22000: Invalid data type for the operation
select array_difference([1,2,3,4,59])<<array_difference([1,2,3,4,59]);
ERROR 22000: Invalid data type for the operation
select array_difference([1,2,3,4,59])>>array_difference([1,2,3,4,59]);
ERROR 22000: Invalid data type for the operation
select array_difference([1,2,3,4,59]) is true ;
ERROR 22000: Invalid data type for the operation
select array_difference([1,2,3,4,59]) in (array_difference([1,2,3,4,59])) from dual;
+--------------------------------------------------------------------+
| array_difference([1,2,3,4,59]) in (array_difference([1,2,3,4,59])) |
+--------------------------------------------------------------------+
|                                                                  1 |
+--------------------------------------------------------------------+
select array_difference([1,2,3,4,59]) like (array_difference([1,2,3,4,59])) from tt3;
ERROR 22000: Invalid data type for the operation
select  array_difference([1,2,3,4,59])  BETWEEN array_difference([1,2,3,4,59]) and array_difference([1,2,3,4,59]) from tt3;
ERROR 22000: Invalid data type for the operation
select  array_difference([1,2,3,4,59])  is null from tt3;
+-----------------------------------------+
| array_difference([1,2,3,4,59])  is null |
+-----------------------------------------+
|                                       0 |
|                                       0 |
|                                       0 |
|                                       0 |
|                                       0 |
|                                       0 |
|                                       0 |
|                                       0 |
|                                       0 |
|                                       0 |
+-----------------------------------------+
select  array_difference([1,2,3,4,59]) is false from tt3;
ERROR 22000: Invalid data type for the operation
select not array_difference([1,2,3,4,59]) from tt3;
ERROR 22000: Invalid data type for the operation
select  array_difference([1,2,3,4,59]) and array_difference([1,2,3,4,59])  from tt3;
ERROR 22000: Invalid data type for the operation
select  array_difference([1,2,3,4,59]) && array_difference([1,2,3,4,59])  from tt3;
ERROR 22000: Invalid data type for the operation
select  array_difference([1,2,3,4,59]) or array_difference([1,2,3,4,59]) from tt3;
ERROR 22000: Invalid data type for the operation
select  array_difference([1,2,3,4,59]) || array_difference([1,2,3,4,59])  from tt3;
ERROR 22000: Invalid data type for the operation
select  array_difference([1,2,3,4,59]) || 1 from tt3;
ERROR 22000: Invalid data type for the operation
select  array_difference([1,2,3,4,59]) XOR array_difference([1,2,3,4,59])  from tt3;
ERROR 22000: Invalid data type for the operation
select  array_difference([1,2,3,4,59]) XOR 1 from tt3;
ERROR 22000: Invalid data type for the operation
select  'test' XOR array_difference([1,2,3,4,59]) from tt3;
ERROR 22000: Invalid data type for the operation
SELECT BINARY array_difference([1,2,3,4,59]) = array_difference([1,2,3,4,59]);
ERROR 22000: Invalid data type for the operation
select CONVERT(array_difference([1,2,3,4,59]) USING BINARY);
ERROR 22000: Invalid data type for the operation
drop table if exists tt3;
create table tt3(id int primary key,id1 bigint unsigned,a int[],b bigint unsigned[]);
drop view if exists vtt3;
create view vtt3 as select * from tt3;
insert into tt3 values(1,3,array_difference([1,2,3,4,59]),array_difference([1,2,3,4,59]));
replace into tt3 values(1,3,array_difference([1,2,3,4,59]),array_difference([1,2,3,4,59]));
replace into tt3 values(2,3,array_difference([1,2,3,4,59]),array_difference([1,2,3,4,59]));
insert into tt3 values(2,3,array_difference([1,2,3,4,59]),array_difference([1,2,3,4,59])) ON DUPLICATE KEY UPDATE  a=array_difference([1,2,3,4,59,60]),b=array_difference([1,2,3,4,59,80]);
insert into tt3 values(3,3,array_difference([1,2,3,4,59]),array_difference([1,2,3,4,59])) ON DUPLICATE KEY UPDATE  a=array_difference([1,2,3,4]),b=array_difference([1,2,3,4]);
insert /*+ OPT_PARAM('enable_rich_vector_format', 'FALSE') */ into tt3 values(4,3,array_difference([1,2,3,4,59]),array_difference([1,2,3,4,59]));
insert /*+ OPT_PARAM('enable_rich_vector_format', 'FALSE') */ into tt3 values(5,3,(select array_difference([1,2,3,4,59]) from dual),(select array_difference([1,2,3,4,59]) from dual));
insert /*+ OPT_PARAM('rowsets_enabled', 'FALSE') */ into tt3 values(6,3,array_difference([1,2,3,4,59]),array_difference([1,2,3,4,59,100]));
insert /*+ OPT_PARAM('rowsets_enabled', 'FALSE') */ into tt3 values(7,3,(select array_difference([1,2,3,4,59]) from dual),(select array_difference([1,2,3,4,59,100]) from dual));
insert /*+enable_parallel_dml parallel(2) */ into tt3 values(8,3,array_difference([1,2,3,4,59]),array_difference([1,2,3,4,59,80]));
insert /*+enable_parallel_dml parallel(2) */ into tt3 values(9,3,(select array_difference([1,2,3,4,59]) from dual),(select array_difference([1,2,3,4,59,100]) from dual));
insert /*+read_consistency(weak) */ into tt3 values(10,3,array_difference([1,2,3,4,59]),array_difference([1,2,3,4,59,100]));
insert /*+read_consistency(weak) */ into tt3 values(11,3,(select array_difference([1,2,3,4,59]) from dual),(select array_difference([1,2,3,4,59,100]) from dual));
insert /*+read_consistency(weak) OPT_PARAM('enable_rich_vector_format', 'FALSE') OPT_PARAM('rowsets_enabled', 'FALSE')  enable_parallel_dml parallel(2) */ into tt3 values(120,3,array_difference([1,2,3,4,59]),array_difference([1,2,3,4,59,100]));
insert /*+read_consistency(weak) OPT_PARAM('enable_rich_vector_format', 'FALSE') OPT_PARAM('rowsets_enabled', 'FALSE')  enable_parallel_dml parallel(2) */ into tt3 values(130,3,(select array_difference([1,2,3,4,59]) from dual),(select array_difference([1,2,3,4,59,100]) from dual));
replace /*+ OPT_PARAM('enable_rich_vector_format', 'FALSE') */ into tt3 values(111,3,array_difference([1,2,3,4,59]),array_difference([1,2,3,4,59,100]));
replace /*+ OPT_PARAM('enable_rich_vector_format', 'FALSE') */ into tt3 values(111,3,(select array_difference([1,2,3,4,59]) from dual),(select array_difference([1,2,3,4,59,100]) from dual));
replace /*+ OPT_PARAM('rowsets_enabled', 'FALSE') */ into tt3 values(12,3,array_difference([1,2,3,4,59]),array_difference([1,2,3,4,59,100]));
replace /*+ OPT_PARAM('rowsets_enabled', 'FALSE') */ into tt3 values(12,3,(select array_difference([1,2,3,4,59]) from dual),(select array_difference([1,2,3,4,59,100]) from dual));
replace /*+enable_parallel_dml parallel(2) */ into tt3 values(13,3,array_difference([1,2,3,4,59]),array_difference([1,2,3,4,59,100]));
replace /*+enable_parallel_dml parallel(2) */ into tt3 values(13,3,(select array_difference([1,2,3,4,59]) from dual),(select array_difference([1,2,3,4,59,100]) from dual));
replace /*+read_consistency(weak) */ into tt3 values(14,3,array_difference([1,2,3,4,59]),array_difference([1,2,3,4,59,100]));
replace /*+read_consistency(weak) */ into tt3 values(14,3,(select array_difference([1,2,3,4,59]) from dual),(select array_difference([1,2,3,4,59,100]) from dual));
replace /*+read_consistency(weak) OPT_PARAM('enable_rich_vector_format', 'FALSE') OPT_PARAM('rowsets_enabled', 'FALSE')  enable_parallel_dml parallel(2) */ into tt3 values(15,3,array_difference([1,2,3,4,59]),array_difference([1,2,3,4,59,100]));
replace /*+read_consistency(weak) OPT_PARAM('enable_rich_vector_format', 'FALSE') OPT_PARAM('rowsets_enabled', 'FALSE')  enable_parallel_dml parallel(2) */ into tt3 values(15,3,(select array_difference([1,2,3,4,59]) from dual),(select array_difference([1,2,3,4,59,100]) from dual));
insert /*+read_consistency(weak) OPT_PARAM('enable_rich_vector_format', 'FALSE') OPT_PARAM('rowsets_enabled', 'FALSE')  enable_parallel_dml parallel(2) */ into tt3 values(16,16,array_difference(array_range(20)),array_difference(array_range(50))) ON DUPLICATE KEY UPDATE  a=array_difference(array_range(30)),b=array_difference(array_range(40));
insert /*+read_consistency(weak) OPT_PARAM('enable_rich_vector_format', 'FALSE') OPT_PARAM('rowsets_enabled', 'FALSE')  enable_parallel_dml parallel(2) */ into tt3 values(16,16,(select array_range(3) from dual),(select array_range(5) from dual)) ON DUPLICATE KEY UPDATE  a=(select array_range(4)),b=(select array_difference([1,2,3,4,59]));
select * from tt3;
+-----+------+----------------+-----------------+
| id  | id1  | a              | b               |
+-----+------+----------------+-----------------+
|   1 |    3 | [0,1,1,1,55]   | [0,1,1,1,55]    |
|   2 |    3 | [0,1,1,1,55,1] | [0,1,1,1,55,21] |
|   3 |    3 | [0,1,1,1,55]   | [0,1,1,1,55]    |
|   4 |    3 | [0,1,1,1,55]   | [0,1,1,1,55]    |
|   5 |    3 | [0,1,1,1,55]   | [0,1,1,1,55]    |
|   6 |    3 | [0,1,1,1,55]   | [0,1,1,1,55,41] |
|   7 |    3 | [0,1,1,1,55]   | [0,1,1,1,55,41] |
|   8 |    3 | [0,1,1,1,55]   | [0,1,1,1,55,21] |
|   9 |    3 | [0,1,1,1,55]   | [0,1,1,1,55,41] |
|  10 |    3 | [0,1,1,1,55]   | [0,1,1,1,55,41] |
|  11 |    3 | [0,1,1,1,55]   | [0,1,1,1,55,41] |
|  12 |    3 | [0,1,1,1,55]   | [0,1,1,1,55,41] |
|  13 |    3 | [0,1,1,1,55]   | [0,1,1,1,55,41] |
|  14 |    3 | [0,1,1,1,55]   | [0,1,1,1,55,41] |
|  15 |    3 | [0,1,1,1,55]   | [0,1,1,1,55,41] |
|  16 |   16 | [0,1,2,3]      | [0,1,1,1,55]    |
| 111 |    3 | [0,1,1,1,55]   | [0,1,1,1,55,41] |
| 120 |    3 | [0,1,1,1,55]   | [0,1,1,1,55,41] |
| 130 |    3 | [0,1,1,1,55]   | [0,1,1,1,55,41] |
+-----+------+----------------+-----------------+
delete /*+enable_parallel_dml parallel(2) */ from tt3 where id=1;
delete /*+OPT_PARAM('enable_rich_vector_format', 'FALSE')*/ from tt3 where id=2;
delete /*+OPT_PARAM('rowsets_enabled', 'FALSE')*/ from tt3 where id in(3,4);
delete /*+read_consistency(weak)*/ from tt3 where id in(5,6,7,8);
delete /*+read_consistency(weak) OPT_PARAM('enable_rich_vector_format', 'FALSE') OPT_PARAM('rowsets_enabled', 'FALSE')  enable_parallel_dml parallel(2) */ from tt3;
select * from tt3;
+----+------+------+------+
| id | id1  | a    | b    |
+----+------+------+------+
+----+------+------+------+
insert into tt3 values(1,3,array_difference([1,2,3,4,59]),array_difference([1,2,3,4,59,100])),(2,3,array_difference([1,2,3,4,59]),array_difference([1,2,3,4,59,100])),(3,3,array_difference([1,2,3,4,59]),array_difference([1,2,3,4,59,100])),(4,3,array_difference([1,2,3,4,59]),array_difference([1,2,3,4,59,100]));
select * from tt3;
+----+------+--------------+-----------------+
| id | id1  | a            | b               |
+----+------+--------------+-----------------+
|  1 |    3 | [0,1,1,1,55] | [0,1,1,1,55,41] |
|  2 |    3 | [0,1,1,1,55] | [0,1,1,1,55,41] |
|  3 |    3 | [0,1,1,1,55] | [0,1,1,1,55,41] |
|  4 |    3 | [0,1,1,1,55] | [0,1,1,1,55,41] |
+----+------+--------------+-----------------+
delete from vtt3;
insert into vtt3 values(1,3,array_difference([1,2,3,4,59]),array_difference([1,2,3,4,59,100]));
replace into vtt3 values(1,3,array_range(20),array_range(50));
replace into vtt3 values(2,3,array_range(20),array_range(50));
insert into vtt3 values(2,3,array_range(20),array_range(50)) ON DUPLICATE KEY UPDATE  a=array_range(25),b=array_range(25);
insert into vtt3 values(3,3,array_range(20),array_range(50)) ON DUPLICATE KEY UPDATE  a=array_range(25),b=array_range(25);
insert /*+ OPT_PARAM('enable_rich_vector_format', 'FALSE') */ into vtt3 values(4,3,array_difference([1,2,3,4,59]),array_difference([1,2,3,4,59,100]));
insert /*+ OPT_PARAM('enable_rich_vector_format', 'FALSE') */ into vtt3 values(5,3,(select array_difference([1,2,3,4,59]) from dual),(select array_difference([1,2,3,4,59,100]) from dual));
insert /*+ OPT_PARAM('rowsets_enabled', 'FALSE') */ into vtt3 values(6,3,array_difference([1,2,3,4,59]),array_difference([1,2,3,4,59,100]));
insert /*+ OPT_PARAM('rowsets_enabled', 'FALSE') */ into vtt3 values(7,3,(select array_difference([1,2,3,4,59]) from dual),(select array_difference([1,2,3,4,59,100]) from dual));
insert /*+enable_parallel_dml parallel(2) */ into vtt3 values(8,3,array_difference([1,2,3,4,59]),array_difference([1,2,3,4,59,100]));
insert /*+enable_parallel_dml parallel(2) */ into vtt3 values(9,3,(select array_difference([1,2,3,4,59]) from dual),(select array_difference([1,2,3,4,59,100]) from dual));
insert /*+read_consistency(weak) */ into vtt3 values(10,3,array_difference([1,2,3,4,59]),array_difference([1,2,3,4,59,100]));
insert /*+read_consistency(weak) */ into vtt3 values(11,3,(select array_difference([1,2,3,4,59]) from dual),(select array_difference([1,2,3,4,59,100]) from dual));
insert /*+read_consistency(weak) OPT_PARAM('enable_rich_vector_format', 'FALSE') OPT_PARAM('rowsets_enabled', 'FALSE')  enable_parallel_dml parallel(2) */ into vtt3 values(120,3,array_difference([1,2,3,4,59]),array_difference([1,2,3,4,59,100]));
insert /*+read_consistency(weak) OPT_PARAM('enable_rich_vector_format', 'FALSE') OPT_PARAM('rowsets_enabled', 'FALSE')  enable_parallel_dml parallel(2) */ into vtt3 values(130,3,(select array_difference([1,2,3,4,59]) from dual),(select array_difference([1,2,3,4,59,100]) from dual));
replace /*+ OPT_PARAM('enable_rich_vector_format', 'FALSE') */ into vtt3 values(111,3,array_difference([1,2,3,4,59]),array_difference([1,2,3,4,59,100]));
replace /*+ OPT_PARAM('enable_rich_vector_format', 'FALSE') */ into vtt3 values(111,3,(select array_difference([1,2,3,4,59]) from dual),(select array_difference([1,2,3,4,59,100]) from dual));
replace /*+ OPT_PARAM('rowsets_enabled', 'FALSE') */ into vtt3 values(12,3,array_difference([1,2,3,4,59]),array_difference([1,2,3,4,59,100]));
replace /*+ OPT_PARAM('rowsets_enabled', 'FALSE') */ into vtt3 values(12,3,(select array_difference([1,2,3,4,59]) from dual),(select array_difference([1,2,3,4,59,100]) from dual));
replace /*+enable_parallel_dml parallel(2) */ into vtt3 values(13,3,array_difference([1,2,3,4,59]),array_difference([1,2,3,4,59,100]));
replace /*+enable_parallel_dml parallel(2) */ into vtt3 values(13,3,(select array_difference([1,2,3,4,59]) from dual),(select array_difference([1,2,3,4,59,100]) from dual));
replace /*+read_consistency(weak) */ into vtt3 values(14,3,array_difference([1,2,3,4,59]),array_difference([1,2,3,4,59,100]));
replace /*+read_consistency(weak) */ into vtt3 values(14,3,(select array_difference([1,2,3,4,59]) from dual),(select array_difference([1,2,3,4,59,100]) from dual));
replace /*+read_consistency(weak) OPT_PARAM('enable_rich_vector_format', 'FALSE') OPT_PARAM('rowsets_enabled', 'FALSE')  enable_parallel_dml parallel(2) */ into vtt3 values(15,3,array_difference([1,2,3,4,59]),array_difference([1,2,3,4,59,100]));
replace /*+read_consistency(weak) OPT_PARAM('enable_rich_vector_format', 'FALSE') OPT_PARAM('rowsets_enabled', 'FALSE')  enable_parallel_dml parallel(2) */ into vtt3 values(15,3,(select array_difference([1,2,3,4,59]) from dual),(select array_difference([1,2,3,4,59,100]) from dual));
insert /*+read_consistency(weak) OPT_PARAM('enable_rich_vector_format', 'FALSE') OPT_PARAM('rowsets_enabled', 'FALSE')  enable_parallel_dml parallel(2) */ into vtt3 values(16,16,array_difference(array_range(20)),array_difference(array_range(50))) ON DUPLICATE KEY UPDATE  a=array_difference(array_range(30)),b=array_difference(array_range(40));
insert /*+read_consistency(weak) OPT_PARAM('enable_rich_vector_format', 'FALSE') OPT_PARAM('rowsets_enabled', 'FALSE')  enable_parallel_dml parallel(2) */ into vtt3 values(16,16,(select array_difference(array_range(3)) from dual),(select array_difference(array_range(5)) from dual)) ON DUPLICATE KEY UPDATE  a=(select array_difference(array_range(4))),b=(select array_difference([1,2,3,4,59]));
select * from vtt3;
+-----+------+--------------------------------------------------------------------+-----------------------------------------------------------------------------------------------------------------------------------------------+
| id  | id1  | a                                                                  | b                                                                                                                                             |
+-----+------+--------------------------------------------------------------------+-----------------------------------------------------------------------------------------------------------------------------------------------+
|   1 |    3 | [0,1,2,3,4,5,6,7,8,9,10,11,12,13,14,15,16,17,18,19]                | [0,1,2,3,4,5,6,7,8,9,10,11,12,13,14,15,16,17,18,19,20,21,22,23,24,25,26,27,28,29,30,31,32,33,34,35,36,37,38,39,40,41,42,43,44,45,46,47,48,49] |
|   2 |    3 | [0,1,2,3,4,5,6,7,8,9,10,11,12,13,14,15,16,17,18,19,20,21,22,23,24] | [0,1,2,3,4,5,6,7,8,9,10,11,12,13,14,15,16,17,18,19,20,21,22,23,24]                                                                            |
|   3 |    3 | [0,1,2,3,4,5,6,7,8,9,10,11,12,13,14,15,16,17,18,19]                | [0,1,2,3,4,5,6,7,8,9,10,11,12,13,14,15,16,17,18,19,20,21,22,23,24,25,26,27,28,29,30,31,32,33,34,35,36,37,38,39,40,41,42,43,44,45,46,47,48,49] |
|   4 |    3 | [0,1,1,1,55]                                                       | [0,1,1,1,55,41]                                                                                                                               |
|   5 |    3 | [0,1,1,1,55]                                                       | [0,1,1,1,55,41]                                                                                                                               |
|   6 |    3 | [0,1,1,1,55]                                                       | [0,1,1,1,55,41]                                                                                                                               |
|   7 |    3 | [0,1,1,1,55]                                                       | [0,1,1,1,55,41]                                                                                                                               |
|   8 |    3 | [0,1,1,1,55]                                                       | [0,1,1,1,55,41]                                                                                                                               |
|   9 |    3 | [0,1,1,1,55]                                                       | [0,1,1,1,55,41]                                                                                                                               |
|  10 |    3 | [0,1,1,1,55]                                                       | [0,1,1,1,55,41]                                                                                                                               |
|  11 |    3 | [0,1,1,1,55]                                                       | [0,1,1,1,55,41]                                                                                                                               |
|  12 |    3 | [0,1,1,1,55]                                                       | [0,1,1,1,55,41]                                                                                                                               |
|  13 |    3 | [0,1,1,1,55]                                                       | [0,1,1,1,55,41]                                                                                                                               |
|  14 |    3 | [0,1,1,1,55]                                                       | [0,1,1,1,55,41]                                                                                                                               |
|  15 |    3 | [0,1,1,1,55]                                                       | [0,1,1,1,55,41]                                                                                                                               |
|  16 |   16 | [0,1,1,1]                                                          | [0,1,1,1,55]                                                                                                                                  |
| 111 |    3 | [0,1,1,1,55]                                                       | [0,1,1,1,55,41]                                                                                                                               |
| 120 |    3 | [0,1,1,1,55]                                                       | [0,1,1,1,55,41]                                                                                                                               |
| 130 |    3 | [0,1,1,1,55]                                                       | [0,1,1,1,55,41]                                                                                                                               |
+-----+------+--------------------------------------------------------------------+-----------------------------------------------------------------------------------------------------------------------------------------------+
insert into tt3 values(array_difference([1,2,3,4,59]),array_difference([1,2,3,4,59]),array_difference([1,2,3,4,59]),array_difference([1,2,3,4,59,100]));
ERROR 0A000: type casting not supported
replace into tt3 values(array_difference([1,2,3,4,59]),array_difference([1,2,3,4,59]),array_difference([1,2,3,4,59]),array_difference([1,2,3,4,59,100]));
ERROR 0A000: type casting not supported
update tt3 set a=array_difference([1,2,3,4,59]),b=array_difference(array_range(15));
update tt3 set a=array_difference(array_range(11)),b=array_difference(array_range(11)) limit 2 ;
update /*+read_consistency(weak) OPT_PARAM('enable_rich_vector_format', 'FALSE') OPT_PARAM('rowsets_enabled', 'FALSE')  enable_parallel_dml parallel(2) */ tt3 set a=array_difference(array_range(20)),b=array_difference(array_range(20)) ;
update tt3 set a=(select array_difference(array_range(2,10))),b=(select array_difference(array_range(3,10)));
update /*+read_consistency(weak) OPT_PARAM('enable_rich_vector_format', 'FALSE') OPT_PARAM('rowsets_enabled', 'FALSE')  enable_parallel_dml parallel(2) */ tt3 set a=(select array_difference(array_range(5,10))),b=(select array_difference(array_range(6,10)));
update /*+enable_parallel_dml parallel(2) */ tt3 set a=array_difference(array_range(11)),b=array_difference(array_range(16));
update /*+read_consistency(weak) */ tt3 set a=array_range(13),b=array_range(17);
update /*+ OPT_PARAM('enable_rich_vector_format', 'FALSE') */ tt3 set a=array_difference(array_range(25)),b=array_difference([1,2,3,4,59]);
update /*+ OPT_PARAM('rowsets_enabled', 'FALSE') */ tt3 set a=array_difference(array_range(21)),b=array_difference(array_range(11));
select * from tt3;
+-----+------+---------------------------------------------+-------------------------+
| id  | id1  | a                                           | b                       |
+-----+------+---------------------------------------------+-------------------------+
|   1 |    3 | [0,1,1,1,1,1,1,1,1,1,1,1,1,1,1,1,1,1,1,1,1] | [0,1,1,1,1,1,1,1,1,1,1] |
|   2 |    3 | [0,1,1,1,1,1,1,1,1,1,1,1,1,1,1,1,1,1,1,1,1] | [0,1,1,1,1,1,1,1,1,1,1] |
|   3 |    3 | [0,1,1,1,1,1,1,1,1,1,1,1,1,1,1,1,1,1,1,1,1] | [0,1,1,1,1,1,1,1,1,1,1] |
|   4 |    3 | [0,1,1,1,1,1,1,1,1,1,1,1,1,1,1,1,1,1,1,1,1] | [0,1,1,1,1,1,1,1,1,1,1] |
|   5 |    3 | [0,1,1,1,1,1,1,1,1,1,1,1,1,1,1,1,1,1,1,1,1] | [0,1,1,1,1,1,1,1,1,1,1] |
|   6 |    3 | [0,1,1,1,1,1,1,1,1,1,1,1,1,1,1,1,1,1,1,1,1] | [0,1,1,1,1,1,1,1,1,1,1] |
|   7 |    3 | [0,1,1,1,1,1,1,1,1,1,1,1,1,1,1,1,1,1,1,1,1] | [0,1,1,1,1,1,1,1,1,1,1] |
|   8 |    3 | [0,1,1,1,1,1,1,1,1,1,1,1,1,1,1,1,1,1,1,1,1] | [0,1,1,1,1,1,1,1,1,1,1] |
|   9 |    3 | [0,1,1,1,1,1,1,1,1,1,1,1,1,1,1,1,1,1,1,1,1] | [0,1,1,1,1,1,1,1,1,1,1] |
|  10 |    3 | [0,1,1,1,1,1,1,1,1,1,1,1,1,1,1,1,1,1,1,1,1] | [0,1,1,1,1,1,1,1,1,1,1] |
|  11 |    3 | [0,1,1,1,1,1,1,1,1,1,1,1,1,1,1,1,1,1,1,1,1] | [0,1,1,1,1,1,1,1,1,1,1] |
|  12 |    3 | [0,1,1,1,1,1,1,1,1,1,1,1,1,1,1,1,1,1,1,1,1] | [0,1,1,1,1,1,1,1,1,1,1] |
|  13 |    3 | [0,1,1,1,1,1,1,1,1,1,1,1,1,1,1,1,1,1,1,1,1] | [0,1,1,1,1,1,1,1,1,1,1] |
|  14 |    3 | [0,1,1,1,1,1,1,1,1,1,1,1,1,1,1,1,1,1,1,1,1] | [0,1,1,1,1,1,1,1,1,1,1] |
|  15 |    3 | [0,1,1,1,1,1,1,1,1,1,1,1,1,1,1,1,1,1,1,1,1] | [0,1,1,1,1,1,1,1,1,1,1] |
|  16 |   16 | [0,1,1,1,1,1,1,1,1,1,1,1,1,1,1,1,1,1,1,1,1] | [0,1,1,1,1,1,1,1,1,1,1] |
| 111 |    3 | [0,1,1,1,1,1,1,1,1,1,1,1,1,1,1,1,1,1,1,1,1] | [0,1,1,1,1,1,1,1,1,1,1] |
| 120 |    3 | [0,1,1,1,1,1,1,1,1,1,1,1,1,1,1,1,1,1,1,1,1] | [0,1,1,1,1,1,1,1,1,1,1] |
| 130 |    3 | [0,1,1,1,1,1,1,1,1,1,1,1,1,1,1,1,1,1,1,1,1] | [0,1,1,1,1,1,1,1,1,1,1] |
+-----+------+---------------------------------------------+-------------------------+
update vtt3 set a=array_difference(array_range(100)),b=array_difference(array_range(150));
update vtt3 set a=array_difference(array_range(11)),b=array_difference(array_range(11)) limit 2 ;
update /*+read_consistency(weak) OPT_PARAM('enable_rich_vector_format', 'FALSE') OPT_PARAM('rowsets_enabled', 'FALSE')  enable_parallel_dml parallel(2) */ vtt3 set a=array_difference(array_range(20)),b=array_difference(array_range(20)) ;
update vtt3 set a=array_difference(array_range(11)),b=array_difference(array_range(11)) limit 2 ;
update tt3 set a=(select array_difference(array_range(2,10))),b=(select array_difference(array_range(3,10)));
update /*+read_consistency(weak) OPT_PARAM('enable_rich_vector_format', 'FALSE') OPT_PARAM('rowsets_enabled', 'FALSE')  enable_parallel_dml parallel(2) */ vtt3 set a=(select array_difference(array_range(5,10))),b=(select array_difference(array_range(6,10)));
update /*+enable_parallel_dml parallel(2) */ vtt3 set a=array_difference(array_range(11)),b=array_difference(array_range(16));
update /*+read_consistency(weak) */ vtt3 set a=array_difference(array_range(13)),b=array_difference(array_range(17));
update /*+ OPT_PARAM('enable_rich_vector_format', 'FALSE') */ vtt3 set a=array_difference(array_range(25)),b=array_difference(array_difference([1,2,3,4,59]));
update /*+ OPT_PARAM('rowsets_enabled', 'FALSE') */ vtt3 set a=array_difference(array_range(21)),b=array_difference(array_range(11));
select * from vtt3;
+-----+------+---------------------------------------------+-------------------------+
| id  | id1  | a                                           | b                       |
+-----+------+---------------------------------------------+-------------------------+
|   1 |    3 | [0,1,1,1,1,1,1,1,1,1,1,1,1,1,1,1,1,1,1,1,1] | [0,1,1,1,1,1,1,1,1,1,1] |
|   2 |    3 | [0,1,1,1,1,1,1,1,1,1,1,1,1,1,1,1,1,1,1,1,1] | [0,1,1,1,1,1,1,1,1,1,1] |
|   3 |    3 | [0,1,1,1,1,1,1,1,1,1,1,1,1,1,1,1,1,1,1,1,1] | [0,1,1,1,1,1,1,1,1,1,1] |
|   4 |    3 | [0,1,1,1,1,1,1,1,1,1,1,1,1,1,1,1,1,1,1,1,1] | [0,1,1,1,1,1,1,1,1,1,1] |
|   5 |    3 | [0,1,1,1,1,1,1,1,1,1,1,1,1,1,1,1,1,1,1,1,1] | [0,1,1,1,1,1,1,1,1,1,1] |
|   6 |    3 | [0,1,1,1,1,1,1,1,1,1,1,1,1,1,1,1,1,1,1,1,1] | [0,1,1,1,1,1,1,1,1,1,1] |
|   7 |    3 | [0,1,1,1,1,1,1,1,1,1,1,1,1,1,1,1,1,1,1,1,1] | [0,1,1,1,1,1,1,1,1,1,1] |
|   8 |    3 | [0,1,1,1,1,1,1,1,1,1,1,1,1,1,1,1,1,1,1,1,1] | [0,1,1,1,1,1,1,1,1,1,1] |
|   9 |    3 | [0,1,1,1,1,1,1,1,1,1,1,1,1,1,1,1,1,1,1,1,1] | [0,1,1,1,1,1,1,1,1,1,1] |
|  10 |    3 | [0,1,1,1,1,1,1,1,1,1,1,1,1,1,1,1,1,1,1,1,1] | [0,1,1,1,1,1,1,1,1,1,1] |
|  11 |    3 | [0,1,1,1,1,1,1,1,1,1,1,1,1,1,1,1,1,1,1,1,1] | [0,1,1,1,1,1,1,1,1,1,1] |
|  12 |    3 | [0,1,1,1,1,1,1,1,1,1,1,1,1,1,1,1,1,1,1,1,1] | [0,1,1,1,1,1,1,1,1,1,1] |
|  13 |    3 | [0,1,1,1,1,1,1,1,1,1,1,1,1,1,1,1,1,1,1,1,1] | [0,1,1,1,1,1,1,1,1,1,1] |
|  14 |    3 | [0,1,1,1,1,1,1,1,1,1,1,1,1,1,1,1,1,1,1,1,1] | [0,1,1,1,1,1,1,1,1,1,1] |
|  15 |    3 | [0,1,1,1,1,1,1,1,1,1,1,1,1,1,1,1,1,1,1,1,1] | [0,1,1,1,1,1,1,1,1,1,1] |
|  16 |   16 | [0,1,1,1,1,1,1,1,1,1,1,1,1,1,1,1,1,1,1,1,1] | [0,1,1,1,1,1,1,1,1,1,1] |
| 111 |    3 | [0,1,1,1,1,1,1,1,1,1,1,1,1,1,1,1,1,1,1,1,1] | [0,1,1,1,1,1,1,1,1,1,1] |
| 120 |    3 | [0,1,1,1,1,1,1,1,1,1,1,1,1,1,1,1,1,1,1,1,1] | [0,1,1,1,1,1,1,1,1,1,1] |
| 130 |    3 | [0,1,1,1,1,1,1,1,1,1,1,1,1,1,1,1,1,1,1,1,1] | [0,1,1,1,1,1,1,1,1,1,1] |
+-----+------+---------------------------------------------+-------------------------+
update vtt3 set id=array_difference(array_range(100)),b=array_difference(array_range(150));
ERROR 22000: Invalid data type for the operation
drop table if exists tt4;
create table tt4(id int primary key,id1 bigint unsigned,a int[],b bigint unsigned[]);
drop view if exists vtt4;
create view vtt4 as select * from tt4;
insert into tt4 values(1,1,[1,2,3,4,5],[1,2,3,4,5]);
insert into tt4 values(2,2,[1,2,3,4,5],[1,2,3,4,5]);
insert overwrite tt3 select 1,1,array_difference(array_range(35)),array_difference(array_range(25)) ;
insert /*+read_consistency(weak) OPT_PARAM('enable_rich_vector_format', 'FALSE') OPT_PARAM('rowsets_enabled', 'FALSE')  enable_parallel_dml parallel(2) */ overwrite tt3 select 1,1,array_difference(array_range(30)),array_difference(array_range(20)) ;
select * from tt3;
+----+------+---------------------------------------------------------------+-------------------------------------------+
| id | id1  | a                                                             | b                                         |
+----+------+---------------------------------------------------------------+-------------------------------------------+
|  1 |    1 | [0,1,1,1,1,1,1,1,1,1,1,1,1,1,1,1,1,1,1,1,1,1,1,1,1,1,1,1,1,1] | [0,1,1,1,1,1,1,1,1,1,1,1,1,1,1,1,1,1,1,1] |
+----+------+---------------------------------------------------------------+-------------------------------------------+
insert overwrite tt3 select id,1,array_difference(a),array_difference(b)  from tt4 ;
select * from tt3;
+----+------+-------------+-------------+
| id | id1  | a           | b           |
+----+------+-------------+-------------+
|  1 |    1 | [0,1,1,1,1] | [0,1,1,1,1] |
|  2 |    1 | [0,1,1,1,1] | [0,1,1,1,1] |
+----+------+-------------+-------------+
truncate tt3;
select * from tt3;
+----+------+------+------+
| id | id1  | a    | b    |
+----+------+------+------+
+----+------+------+------+
drop table if exists tt3;
create table tt3(id int primary key ,c1 array(int), c2 array(varchar(256)), c3 array(tinyint), c4 array(bigint), c5 array(float), c8 array(double), c7 array(smallint),c6 array(array(int)));
insert into tt3 values(5,[-2147483648,0, 2147483647],['test'],[127,0,-128],[-9223372036854775808,9223372036854775807,775,808,2,0],[3.402, 0, 1.175],
[1.7976931348623157E+308,0, 2.2250738585072014E-308],[-32768,0,32767],[[1,2,3],[1,2,3,4]]);
drop view if exists vtt3;
create view vtt3 as select * from tt3;
drop table if exists tt4;
create table tt4(id int primary key,a array(int));
insert into tt4 select 1,array_agg(1);
insert  /*+ direct(true,100,'inc') enable_parallel_dml parallel(2)*/ into tt4 select 2,array_difference([1,2,3,4,59]);
insert  /*+ direct(true,100) enable_parallel_dml parallel(2) append*/ into tt4 select 3,array_difference([1,2,3,4,59]);
replace into tt4 select 1,array_range(4);
replace  /*+ direct(true,100) enable_parallel_dml parallel(2) append*/ into tt4 select 1,array_difference([1,2,3,4,59]);
replace  /*+ direct(true,100,'inc') enable_parallel_dml parallel(2)*/ into tt4 select 2,array_difference([1,2,3,4,59]);
delete from tt4;
insert into tt4 select 1,array_agg(id) from tt3;
insert  /*+ direct(true,100,'inc') enable_parallel_dml parallel(2)*/ into tt4 select 2,array_difference(array_range(id)) from tt3;
insert  /*+ direct(true,100) enable_parallel_dml parallel(2) append*/ into tt4 select 3,array_difference(array_range(id)) from tt3;
replace into tt4 select 1,array_range(id) from tt3;
replace  /*+ direct(true,100) enable_parallel_dml parallel(2) append*/ into tt4 select 1,array_difference(array_range(id)) from tt3;
replace  /*+ direct(true,100,'inc') enable_parallel_dml parallel(2)*/ into tt4 select 1,array_difference(array_range(id)) from tt3;
insert  /*+ direct(true,100,'inc') enable_parallel_dml parallel(2)*/ into tt4 select 6,array_difference(array_range(0));
insert  /*+ direct(true,100) enable_parallel_dml parallel(2) append*/ into tt4 select 7,array_difference(array_range(0));
select * from tt4;
+----+-------------+
| id | a           |
+----+-------------+
|  1 | [0,1,1,1,1] |
|  2 | [0,1,1,1,1] |
|  3 | [0,1,1,1,1] |
|  6 | []          |
|  7 | []          |
+----+-------------+
select [[array_difference([1,2,3,4])],[array_difference([1,2,3,4,2100,-100E-1])]];
+----------------------------------------------------------------------------+
| [[array_difference([1,2,3,4])],[array_difference([1,2,3,4,2100,-100E-1])]] |
+----------------------------------------------------------------------------+
| [[[0,1,1,1]],[[0,1,1,1,2096,-2110]]]                                       |
+----------------------------------------------------------------------------+
select array_difference(array(1,2));
+------------------------------+
| array_difference(array(1,2)) |
+------------------------------+
| [0,1]                        |
+------------------------------+
select array(array_difference([1,2,3,4,5,-6]),array_difference([6765E-4,9875E+5]),array_difference(null));
+----------------------------------------------------------------------------------------------------+
| array(array_difference([1,2,3,4,5,-6]),array_difference([6765E-4,9875E+5]),array_difference(null)) |
+----------------------------------------------------------------------------------------------------+
| [[0,1,1,1,1,-11],[0,987499999.3235],NULL]                                                          |
+----------------------------------------------------------------------------------------------------+
select array_difference(array_difference([1,2,3,4,5]));
+-------------------------------------------------+
| array_difference(array_difference([1,2,3,4,5])) |
+-------------------------------------------------+
| [0,1,0,0,0]                                     |
+-------------------------------------------------+
select array_difference(Array_contains([21,1,3], 3));
ERROR 22000: invalid obj type for type promotion: left_type=ARRAY right_type=INT
select Array_contains([['test','test']],array_difference([1,2,3,4]));
+---------------------------------------------------------------+
| Array_contains([['test','test']],array_difference([1,2,3,4])) |
+---------------------------------------------------------------+
|                                                             0 |
+---------------------------------------------------------------+
select Array_contains([[2]],array_difference([1,2,3]));
+-------------------------------------------------+
| Array_contains([[2]],array_difference([1,2,3])) |
+-------------------------------------------------+
|                                               0 |
+-------------------------------------------------+
select Array_contains([[6.2]],array_difference([1,2,3.2]));
+-----------------------------------------------------+
| Array_contains([[6.2]],array_difference([1,2,3.2])) |
+-----------------------------------------------------+
|                                                   0 |
+-----------------------------------------------------+
select Array_contains([array_remove([1],1)],array_difference([1,2,3.4]));
+-------------------------------------------------------------------+
| Array_contains([array_remove([1],1)],array_difference([1,2,3.4])) |
+-------------------------------------------------------------------+
|                                                                 0 |
+-------------------------------------------------------------------+
select array_difference(1= ANY([1]));
ERROR 22000: invalid obj type for type promotion: left_type=ARRAY right_type=INT
select array_difference(null=ANY(array_remove([1],1)));
ERROR 22000: invalid obj type for type promotion: left_type=ARRAY right_type=INT
select  array_append([[1,2,34]], array_difference([1,2,3]));
+-----------------------------------------------------+
| array_append([[1,2,34]], array_difference([1,2,3])) |
+-----------------------------------------------------+
| [[1,2,34],[0,1,1]]                                  |
+-----------------------------------------------------+
select array_difference(array_append([1,2,34], 1));
+---------------------------------------------+
| array_difference(array_append([1,2,34], 1)) |
+---------------------------------------------+
| [0,1,32,-33]                                |
+---------------------------------------------+
select  array_distinct(array_difference([1.2,1,2,3,3]));
+-------------------------------------------------+
| array_distinct(array_difference([1.2,1,2,3,3])) |
+-------------------------------------------------+
| [0,-0.19999999999999996,1]                      |
+-------------------------------------------------+
select array_difference(array_distinct(null));
+----------------------------------------+
| array_difference(array_distinct(null)) |
+----------------------------------------+
|                                   NULL |
+----------------------------------------+
select array_difference(array_distinct([1,2,3,6,6.5]));
+-------------------------------------------------+
| array_difference(array_distinct([1,2,3,6,6.5])) |
+-------------------------------------------------+
| [0,1,1,3,0.5]                                   |
+-------------------------------------------------+
select array_map(x ->(x), array_difference([1,2,6,7]));
+-------------------------------------------------+
| array_map(x ->(x), array_difference([1,2,6,7])) |
+-------------------------------------------------+
| [0,1,4,1]                                       |
+-------------------------------------------------+
select array_map(x ->(array_difference([x])), [1,2,3]);
+-------------------------------------------------+
| array_map(x ->(array_difference([x])), [1,2,3]) |
+-------------------------------------------------+
| [[0],[0],[0]]                                   |
+-------------------------------------------------+
select array_map(x ->(array_difference([x])), [1.3,2E-1,3]);
+------------------------------------------------------+
| array_map(x ->(array_difference([x])), [1.3,2E-1,3]) |
+------------------------------------------------------+
| [[0],[0],[0]]                                        |
+------------------------------------------------------+
select array_difference(array_map(x ->(x), array_difference([1,2,6,7])));
+-------------------------------------------------------------------+
| array_difference(array_map(x ->(x), array_difference([1,2,6,7]))) |
+-------------------------------------------------------------------+
| [0,1,3,-3]                                                        |
+-------------------------------------------------------------------+
select array_difference(array_map(x ->(array_difference([x])), [1,2,3]));
ERROR 0A000: array_difference with multi-dimension array not supported
select array_difference(array_remove([1,2,3],1));
+-------------------------------------------+
| array_difference(array_remove([1,2,3],1)) |
+-------------------------------------------+
| [0,1]                                     |
+-------------------------------------------+
select array_difference(array_remove(NULL,1));
+----------------------------------------+
| array_difference(array_remove(NULL,1)) |
+----------------------------------------+
|                                   NULL |
+----------------------------------------+
select array_remove(array_difference([1,2,3,4,5,6]),5);
+-------------------------------------------------+
| array_remove(array_difference([1,2,3,4,5,6]),5) |
+-------------------------------------------------+
| [0,1,1,1,1,1]                                   |
+-------------------------------------------------+
select array_remove([[1,2,3,5]],array_difference([1]));
+-------------------------------------------------+
| array_remove([[1,2,3,5]],array_difference([1])) |
+-------------------------------------------------+
| [[1,2,3,5]]                                     |
+-------------------------------------------------+
select array_remove([[1.1,2,3,5]],array_difference([1.1,2,3,5]));
+-----------------------------------------------------------+
| array_remove([[1.1,2,3,5]],array_difference([1.1,2,3,5])) |
+-----------------------------------------------------------+
| [[1.1,2,3,5]]                                             |
+-----------------------------------------------------------+
select array_remove([[[1.1,'2',3,5]]],array_difference([[1.1,'2',3,5]]));
ERROR 0A000: array_difference with multi-dimension array not supported
select  array_to_string(array_difference(array_range(0)),'-','a');
+-----------------------------------------------------------+
| array_to_string(array_difference(array_range(0)),'-','a') |
+-----------------------------------------------------------+
|                                                           |
+-----------------------------------------------------------+
select  array_to_string(array_difference(array_range(10)),'-','a');
+------------------------------------------------------------+
| array_to_string(array_difference(array_range(10)),'-','a') |
+------------------------------------------------------------+
| 0-1-1-1-1-1-1-1-1-1                                        |
+------------------------------------------------------------+
select  array_difference(array_to_string(array_range(0),'-','a'));
ERROR 22000: invalid obj type for type promotion: left_type=ARRAY right_type=LONGTEXT
select ARRAY_AGG(array_difference(array_range(0)));
+---------------------------------------------+
| ARRAY_AGG(array_difference(array_range(0))) |
+---------------------------------------------+
| [[]]                                        |
+---------------------------------------------+
select ARRAY_AGG(array_difference(array_range(10)));
+----------------------------------------------+
| ARRAY_AGG(array_difference(array_range(10))) |
+----------------------------------------------+
| [[0,1,1,1,1,1,1,1,1,1]]                      |
+----------------------------------------------+
select array_difference(ARRAY_AGG(null));
ERROR 0A000: array_difference with array contains null element not supported
select * from unnest(array_difference(array_range(0)));
+--------+
| unnest |
+--------+
+--------+
select * from unnest(array_difference(array_range(0)),array_difference(array_range(10)));
+--------+--------+
| unnest | unnest |
+--------+--------+
|   NULL |      0 |
|   NULL |      1 |
|   NULL |      1 |
|   NULL |      1 |
|   NULL |      1 |
|   NULL |      1 |
|   NULL |      1 |
|   NULL |      1 |
|   NULL |      1 |
|   NULL |      1 |
+--------+--------+
select array_difference(c2) from unnest([array_range(10)],[array_range(9)]) as a(c1,c2);
+----------------------+
| array_difference(c2) |
+----------------------+
| [0,1,1,1,1,1,1,1,1]  |
+----------------------+
select element_at(array_difference(array_range(0)),1);
+------------------------------------------------+
| element_at(array_difference(array_range(0)),1) |
+------------------------------------------------+
|                                           NULL |
+------------------------------------------------+
select element_at(array_difference(array_range(10)),3);
+-------------------------------------------------+
| element_at(array_difference(array_range(10)),3) |
+-------------------------------------------------+
|                                               1 |
+-------------------------------------------------+
select array_difference(element_at(array_range(10),3));
ERROR 22000: invalid obj type for type promotion: left_type=ARRAY right_type=BIGINT
select string_to_array('1and2and3and', array_difference(array_range(10)));
ERROR 22000: invalid obj type for type promotion: left_type=VARCHAR right_type=ARRAY
select string_to_array(array_difference(array_range(10)),'1');
ERROR 22000: invalid obj type for type promotion: left_type=VARCHAR right_type=ARRAY
select array_difference(string_to_array('1and2and3and', 'and'));
ERROR 0A000: array_difference with non-numeric type not supported
select cardinality(array_difference([1,2,3,3]));
+------------------------------------------+
| cardinality(array_difference([1,2,3,3])) |
+------------------------------------------+
|                                        4 |
+------------------------------------------+
select array_difference(cardinality(array_range(10)));
ERROR 22000: invalid obj type for type promotion: left_type=ARRAY right_type=INT UNSIGNED
select rb_to_string(rb_build(array_difference([1,2,3,5])));
+-----------------------------------------------------+
| rb_to_string(rb_build(array_difference([1,2,3,5]))) |
+-----------------------------------------------------+
| 0,1,2                                               |
+-----------------------------------------------------+
select array_difference(rb_build(array_difference([12,3,4])));
ERROR 22000: invalid obj type for type promotion: left_type=ARRAY right_type=ROARINGBITMAP
select array_overlaps(array_difference([1,2,3,4]),array_difference([1,2,3,4]));
+-------------------------------------------------------------------------+
| array_overlaps(array_difference([1,2,3,4]),array_difference([1,2,3,4])) |
+-------------------------------------------------------------------------+
|                                                                       1 |
+-------------------------------------------------------------------------+
select array_difference(array_overlaps(array_difference([1,2,3,4]),array_difference([1,2,3,4])));
ERROR 22000: invalid obj type for type promotion: left_type=ARRAY right_type=INT
select array_contains_all(array_difference([1,2,3,4]),array_difference([1,2,3,4]));
+-----------------------------------------------------------------------------+
| array_contains_all(array_difference([1,2,3,4]),array_difference([1,2,3,4])) |
+-----------------------------------------------------------------------------+
|                                                                           1 |
+-----------------------------------------------------------------------------+
select array_difference(array_contains_all(array_difference([1,2,3,4]),array_difference([1,2,3,4])));
ERROR 22000: invalid obj type for type promotion: left_type=ARRAY right_type=INT
select  array_prepend(array_difference([1,2,3,54,6]), 1);
+--------------------------------------------------+
| array_prepend(array_difference([1,2,3,54,6]), 1) |
+--------------------------------------------------+
| [1,0,1,1,51,-48]                                 |
+--------------------------------------------------+
select  array_prepend([array_difference([1,2,3,54,6])], array_difference([1,2,3,54,6]));
+---------------------------------------------------------------------------------+
| array_prepend([array_difference([1,2,3,54,6])], array_difference([1,2,3,54,6])) |
+---------------------------------------------------------------------------------+
| [[0,1,1,51,-48],[0,1,1,51,-48]]                                                 |
+---------------------------------------------------------------------------------+
select  array_difference(array_prepend(array_difference([1,2,3,54,6]), 1));
+--------------------------------------------------------------------+
| array_difference(array_prepend(array_difference([1,2,3,54,6]), 1)) |
+--------------------------------------------------------------------+
| [0,-1,1,0,50,-99]                                                  |
+--------------------------------------------------------------------+
select array_difference(array_concat(array_difference([1,2,3,54,6]),array_difference([1,2,3,54,6])));
+-----------------------------------------------------------------------------------------------+
| array_difference(array_concat(array_difference([1,2,3,54,6]),array_difference([1,2,3,54,6]))) |
+-----------------------------------------------------------------------------------------------+
| [0,1,0,50,-99,48,1,0,50,-99]                                                                  |
+-----------------------------------------------------------------------------------------------+
select array_concat(array_difference([1,2,3,54,6]),array_difference([1,2,3,54,6]),null);
+----------------------------------------------------------------------------------+
| array_concat(array_difference([1,2,3,54,6]),array_difference([1,2,3,54,6]),null) |
+----------------------------------------------------------------------------------+
|                                                                             NULL |
+----------------------------------------------------------------------------------+
select array_compact(array_difference([1,2,3,54,6]));
+-----------------------------------------------+
| array_compact(array_difference([1,2,3,54,6])) |
+-----------------------------------------------+
| [0,1,51,-48]                                  |
+-----------------------------------------------+
select array_difference( array_compact(array_difference([1,2,3,54,6])));
+------------------------------------------------------------------+
| array_difference( array_compact(array_difference([1,2,3,54,6]))) |
+------------------------------------------------------------------+
| [0,1,50,-99]                                                     |
+------------------------------------------------------------------+
select array_filter((x) ->(x),array_difference([1,2,3,54,6]));
+--------------------------------------------------------+
| array_filter((x) ->(x),array_difference([1,2,3,54,6])) |
+--------------------------------------------------------+
| [1,1,51,-48]                                           |
+--------------------------------------------------------+
select array_difference( array_filter((x) ->(x),array_difference([1,2,3,54,6])));
+---------------------------------------------------------------------------+
| array_difference( array_filter((x) ->(x),array_difference([1,2,3,54,6]))) |
+---------------------------------------------------------------------------+
| [0,0,50,-99]                                                              |
+---------------------------------------------------------------------------+
select array_sort(array_difference([1,2,3,54,6]));
+--------------------------------------------+
| array_sort(array_difference([1,2,3,54,6])) |
+--------------------------------------------+
| [-48,0,1,1,51]                             |
+--------------------------------------------+
select array_difference(array_sort(array_difference([1,2,3,54,6])));
+--------------------------------------------------------------+
| array_difference(array_sort(array_difference([1,2,3,54,6]))) |
+--------------------------------------------------------------+
| [0,48,1,0,50]                                                |
+--------------------------------------------------------------+
select array_sortby(x ->(x), array_difference([1,2,3,54,6]));
+-------------------------------------------------------+
| array_sortby(x ->(x), array_difference([1,2,3,54,6])) |
+-------------------------------------------------------+
| [-48,0,1,1,51]                                        |
+-------------------------------------------------------+
select array_difference(array_sortby(x ->(x), array_difference([1,2,3,54,6])));
+-------------------------------------------------------------------------+
| array_difference(array_sortby(x ->(x), array_difference([1,2,3,54,6]))) |
+-------------------------------------------------------------------------+
| [0,48,1,0,50]                                                           |
+-------------------------------------------------------------------------+
select array_sortby(x ->(array_difference(x)), [array_difference([1,2,3,54,6])]);
ERROR 22000: Invalid data type for the operation
select array_length(array_difference([1,2,3,54,6]));
+----------------------------------------------+
| array_length(array_difference([1,2,3,54,6])) |
+----------------------------------------------+
|                                            5 |
+----------------------------------------------+
select array_difference(array_length(array_range(10)));
ERROR 22000: invalid obj type for type promotion: left_type=ARRAY right_type=INT UNSIGNED
select array_sum(array_difference([1,2,3,54,6]));
+-------------------------------------------+
| array_sum(array_difference([1,2,3,54,6])) |
+-------------------------------------------+
|                                         5 |
+-------------------------------------------+
select array_difference(array_sum(array_range(10)));
ERROR 22000: invalid obj type for type promotion: left_type=ARRAY right_type=BIGINT
select array_first((x) ->(array_difference(x)),[[1,2,3,4]]);
ERROR 22000: Invalid data type for the operation
select array_first(x ->(x),array_difference([0,2,3,54,6]));
+-----------------------------------------------------+
| array_first(x ->(x),array_difference([0,2,3,54,6])) |
+-----------------------------------------------------+
|                                                   2 |
+-----------------------------------------------------+
select array_difference(array_first(x ->(x),array_range(10)));
ERROR 22000: invalid obj type for type promotion: left_type=ARRAY right_type=BIGINT
select array_difference(array_difference([1,2,3,54,6]));
+--------------------------------------------------+
| array_difference(array_difference([1,2,3,54,6])) |
+--------------------------------------------------+
| [0,1,0,50,-99]                                   |
+--------------------------------------------------+
select array_difference(array_difference([1,2,3.3,54.5,6]));
+------------------------------------------------------+
| array_difference(array_difference([1,2,3.3,54.5,6])) |
+------------------------------------------------------+
| [0,1,0.2999999999999998,49.900000000000006,-99.7]    |
+------------------------------------------------------+
select array_difference(array_difference(array_difference([1,2,3.3,54.5,6])));
+------------------------------------------------------------------------+
| array_difference(array_difference(array_difference([1,2,3.3,54.5,6]))) |
+------------------------------------------------------------------------+
| [0,1,-0.7000000000000002,49.60000000000001,-149.60000000000002]        |
+------------------------------------------------------------------------+
select array_min(array_difference([1,2,3,54,6]));
+-------------------------------------------+
| array_min(array_difference([1,2,3,54,6])) |
+-------------------------------------------+
|                                       -48 |
+-------------------------------------------+
select array_difference(array_min(array_difference([1,2,3,54,6])));
ERROR 22000: invalid obj type for type promotion: left_type=ARRAY right_type=BIGINT
select array_max(array_difference([1,2,3,54,6]));
+-------------------------------------------+
| array_max(array_difference([1,2,3,54,6])) |
+-------------------------------------------+
|                                        51 |
+-------------------------------------------+
select array_difference(array_max(array_difference([1,2,3,54,6])));
ERROR 22000: invalid obj type for type promotion: left_type=ARRAY right_type=BIGINT
select array_avg(array_difference([1,2,3,54,6]));
+-------------------------------------------+
| array_avg(array_difference([1,2,3,54,6])) |
+-------------------------------------------+
|                                         1 |
+-------------------------------------------+
select array_difference(array_avg(array_difference([1,2,3,54,6])));
ERROR 22000: invalid obj type for type promotion: left_type=ARRAY right_type=DOUBLE
select array_position(array_difference([1,2,3,54,6]),null);
+-----------------------------------------------------+
| array_position(array_difference([1,2,3,54,6]),null) |
+-----------------------------------------------------+
|                                                   0 |
+-----------------------------------------------------+
select array_position(array_difference([1,2,3,54,6]),6);
+--------------------------------------------------+
| array_position(array_difference([1,2,3,54,6]),6) |
+--------------------------------------------------+
|                                                0 |
+--------------------------------------------------+
select array_difference(array_position(array_difference([1,2,3,54,6]),9));
ERROR 22000: invalid obj type for type promotion: left_type=ARRAY right_type=BIGINT
select array_difference(array_range(0));
+----------------------------------+
| array_difference(array_range(0)) |
+----------------------------------+
| []                               |
+----------------------------------+
select array_difference(array_range(10));
+-----------------------------------+
| array_difference(array_range(10)) |
+-----------------------------------+
| [0,1,1,1,1,1,1,1,1,1]             |
+-----------------------------------+
select reverse(array_difference([1,2,3,54,6]));
+-----------------------------------------+
| reverse(array_difference([1,2,3,54,6])) |
+-----------------------------------------+
| [-48,51,1,1,0]                          |
+-----------------------------------------+
select reverse(array_difference([1,2,3,'54',6]));
ERROR 0A000: array_difference with non-numeric type not supported
select array_difference(reverse(array_difference([1,2,3E-1,54,6])));
+--------------------------------------------------------------+
| array_difference(reverse(array_difference([1,2,3E-1,54,6]))) |
+--------------------------------------------------------------+
| [0,101.7,-55.400000000000006,2.7,-1]                         |
+--------------------------------------------------------------+
drop table if exists tt3;
create table tt3(id int  primary key,a0 int[],a1 float[],a2 double[],v vector(4));
drop view if exists vtt3;
create view vtt3 as select * from tt3;
insert into tt3 values(1,'[1,2,4,5]','[1.2,5456E-3]','[-1.2,5456E-3]',[1,2,3,4]);
insert into tt3 values(2,'[1,2,4,5]','[1.2,5456E-3]','[-1.2,5456E-3]',[1,2,3,4]);
insert into tt3 values(3,null,null,null,null);
insert into tt3(id) values(4);
insert into tt3 values(5,'[]','[]','[]','[1,2,3,5]');
select array_difference(a0),array_difference(a1),array_difference(a2),array_difference(v) from tt3;
+----------------------+----------------------+-----------------------+---------------------+
| array_difference(a0) | array_difference(a1) | array_difference(a2)  | array_difference(v) |
+----------------------+----------------------+-----------------------+---------------------+
| [0,1,2,1]            | [0,4.256]            | [0,6.656000000000001] | [0,1,1,1]           |
| [0,1,2,1]            | [0,4.256]            | [0,6.656000000000001] | [0,1,1,1]           |
| NULL                 | NULL                 | NULL                  | NULL                |
| NULL                 | NULL                 | NULL                  | NULL                |
| []                   | []                   | []                    | [0,1,1,2]           |
+----------------------+----------------------+-----------------------+---------------------+
drop table if exists tt4;
create table tt4 as select array_difference([100,160,-200]) a;
desc tt4;
+-------+---------------+------+-----+---------+-------+
| Field | Type          | Null | Key | Default | Extra |
+-------+---------------+------+-----+---------+-------+
| a     | ARRAY(BIGINT) | YES  |     | NULL    |       |
+-------+---------------+------+-----+---------+-------+
insert into tt4 values([1,2,46,-8]);
select * from tt4;
+-------------+
| a           |
+-------------+
| [0,60,-360] |
| [1,2,46,-8] |
+-------------+
delete from tt4;
truncate tt4;
drop table if exists tt4;
create table tt4 as select array_difference(a0) a0,array_difference(a1) a1,array_difference(a2) a2 ,array_difference(v) v from tt3 ;
desc tt4;
+-------+---------------+------+-----+---------+-------+
| Field | Type          | Null | Key | Default | Extra |
+-------+---------------+------+-----+---------+-------+
| a0    | ARRAY(BIGINT) | YES  |     | NULL    |       |
| a1    | ARRAY(FLOAT)  | YES  |     | NULL    |       |
| a2    | ARRAY(DOUBLE) | YES  |     | NULL    |       |
| v     | ARRAY(FLOAT)  | YES  |     | NULL    |       |
+-------+---------------+------+-----+---------+-------+
insert into tt4 values('[1,2,4,5]','[1.2,5456E-3]','[-1.2,5456E-3]',[1,2,3,4]);
select * from tt4;
+-----------+-------------+-----------------------+-----------+
| a0        | a1          | a2                    | v         |
+-----------+-------------+-----------------------+-----------+
| [0,1,2,1] | [0,4.256]   | [0,6.656000000000001] | [0,1,1,1] |
| [0,1,2,1] | [0,4.256]   | [0,6.656000000000001] | [0,1,1,1] |
| NULL      | NULL        | NULL                  | NULL      |
| NULL      | NULL        | NULL                  | NULL      |
| []        | []          | []                    | [0,1,1,2] |
| [1,2,4,5] | [1.2,5.456] | [-1.2,5.456]          | [1,2,3,4] |
+-----------+-------------+-----------------------+-----------+
delete from tt4;
truncate tt4;
drop view if exists vtt4;
create view vtt4 as select array_difference([100,160,-200]) a;
2024111200105070974   《[obmysql_array]array 表达式参数为使用到 array(1,2)或[1,2]或[id]，创建起来的视图,desc 查询不了该视图》
desc vtt4;
+-------+---------------+------+-----+---------+-------+
| Field | Type          | Null | Key | Default | Extra |
+-------+---------------+------+-----+---------+-------+
| a     | ARRAY(BIGINT) | NO   |     |         |       |
+-------+---------------+------+-----+---------+-------+
insert into vtt4 values([1,2,46,-8]);
ERROR HY000: The target table vtt4 of the INSERT is not insertable-into
select * from vtt4;
+-------------+
| a           |
+-------------+
| [0,60,-360] |
+-------------+
drop view if exists vtt4;
create view vtt4 as select array_difference(a0) a0,array_difference(a1) a1,array_difference(a2) a2 ,array_difference(v) v from tt3 ;
desc vtt4;
+-------+---------------+------+-----+---------+-------+
| Field | Type          | Null | Key | Default | Extra |
+-------+---------------+------+-----+---------+-------+
| a0    | ARRAY(BIGINT) | YES  |     | NULL    |       |
| a1    | ARRAY(FLOAT)  | YES  |     | NULL    |       |
| a2    | ARRAY(DOUBLE) | YES  |     | NULL    |       |
| v     | ARRAY(FLOAT)  | YES  |     | NULL    |       |
+-------+---------------+------+-----+---------+-------+
insert into vtt4 values('[1,2,4,5]','[1.2,5456E-3]','[-1.2,5456E-3]',[1,2,3,4]);
ERROR HY000: Column 'a0' is not updatable
select * from vtt4;
+-----------+-----------+-----------------------+-----------+
| a0        | a1        | a2                    | v         |
+-----------+-----------+-----------------------+-----------+
| [0,1,2,1] | [0,4.256] | [0,6.656000000000001] | [0,1,1,1] |
| [0,1,2,1] | [0,4.256] | [0,6.656000000000001] | [0,1,1,1] |
| NULL      | NULL      | NULL                  | NULL      |
| NULL      | NULL      | NULL                  | NULL      |
| []        | []        | []                    | [0,1,1,2] |
+-----------+-----------+-----------------------+-----------+
delete from vtt4;
drop table if exists tt4;
create table tt4(id int, a bigint[] default (array_difference(1,2,3,4,5)));
ERROR 42000: BLOB, TEXT, GEOMETRY or JSON column 'a' can't have a default value
drop table if exists tt4;
Warnings:
Note	1051	Unknown table 'oblrp.tt4'
create table tt4(id int,a int[], r array(bigint) as (array_difference(a)) STORED);
desc tt4;
+-------+---------------+------+-----+-----------------------+------------------+
| Field | Type          | Null | Key | Default               | Extra            |
+-------+---------------+------+-----+-----------------------+------------------+
| id    | int(11)       | YES  |     | NULL                  |                  |
| a     | ARRAY(INT)    | YES  |     | NULL                  |                  |
| r     | ARRAY(BIGINT) | YES  |     | array_difference(`a`) | STORED GENERATED |
+-------+---------------+------+-----+-----------------------+------------------+
insert into tt4(id,a) values(2,[1,2,3,4]);
select * from tt4;
+------+-----------+-----------+
| id   | a         | r         |
+------+-----------+-----------+
|    2 | [1,2,3,4] | [0,1,1,1] |
+------+-----------+-----------+
delete from tt4;
drop table if exists tt4;
create table tt4(id int primary key,a float[]);
alter table tt4 add COLUMN b array(float) as (array_difference(a)) STORED;
desc tt4;
+-------+--------------+------+-----+-----------------------+------------------+
| Field | Type         | Null | Key | Default               | Extra            |
+-------+--------------+------+-----+-----------------------+------------------+
| id    | int(11)      | NO   | PRI | NULL                  |                  |
| a     | ARRAY(FLOAT) | YES  |     | NULL                  |                  |
| b     | ARRAY(FLOAT) | YES  |     | array_difference(`a`) | STORED GENERATED |
+-------+--------------+------+-----+-----------------------+------------------+
insert into tt4(id,a) values(2,[1,2,3,6]);
select * from tt4;
+----+-----------+-----------+
| id | a         | b         |
+----+-----------+-----------+
|  2 | [1,2,3,6] | [0,1,1,3] |
+----+-----------+-----------+
delete from tt4;
select * from tt4;
+----+------+------+
| id | a    | b    |
+----+------+------+
+----+------+------+
drop table if exists tt4;
create table tt4(id int primary key,a float[]);
alter table tt4 add COLUMN b array(varchar(20)) as (array_difference(a)) STORED;
desc tt4;
+-------+--------------------+------+-----+-----------------------+------------------+
| Field | Type               | Null | Key | Default               | Extra            |
+-------+--------------------+------+-----+-----------------------+------------------+
| id    | int(11)            | NO   | PRI | NULL                  |                  |
| a     | ARRAY(FLOAT)       | YES  |     | NULL                  |                  |
| b     | ARRAY(VARCHAR(20)) | YES  |     | array_difference(`a`) | STORED GENERATED |
+-------+--------------------+------+-----+-----------------------+------------------+
insert into tt4(id,a) values(2,[1,2,3,6]);
select * from tt4;
+----+-----------+-------------------+
| id | a         | b                 |
+----+-----------+-------------------+
|  2 | [1,2,3,6] | ["0","1","1","3"] |
+----+-----------+-------------------+
delete from tt4;
select * from tt4;
+----+------+------+
| id | a    | b    |
+----+------+------+
+----+------+------+
drop table if exists tt4;
create table tt4(id int,a double[], r array(double) as (array_difference(a)) VIRTUAL);
desc tt4;
+-------+---------------+------+-----+-----------------------+-------------------+
| Field | Type          | Null | Key | Default               | Extra             |
+-------+---------------+------+-----+-----------------------+-------------------+
| id    | int(11)       | YES  |     | NULL                  |                   |
| a     | ARRAY(DOUBLE) | YES  |     | NULL                  |                   |
| r     | ARRAY(DOUBLE) | YES  |     | array_difference(`a`) | VIRTUAL GENERATED |
+-------+---------------+------+-----+-----------------------+-------------------+
insert into tt4(id) values(2);
select * from tt4;
+------+------+------+
| id   | a    | r    |
+------+------+------+
|    2 | NULL | NULL |
+------+------+------+
delete from tt4;
drop table if exists tt4;
create table tt4(id int primary key,a int[]);
alter table tt4 add COLUMN b bigint[] as (array_difference(a)) VIRTUAL;
desc tt4;
+-------+---------------+------+-----+-----------------------+-------------------+
| Field | Type          | Null | Key | Default               | Extra             |
+-------+---------------+------+-----+-----------------------+-------------------+
| id    | int(11)       | NO   | PRI | NULL                  |                   |
| a     | ARRAY(INT)    | YES  |     | NULL                  |                   |
| b     | ARRAY(BIGINT) | YES  |     | array_difference(`a`) | VIRTUAL GENERATED |
+-------+---------------+------+-----+-----------------------+-------------------+
insert into tt4(id,a) values(2,[1,2,3,4]);
select * from tt4;
+----+-----------+-----------+
| id | a         | b         |
+----+-----------+-----------+
|  2 | [1,2,3,4] | [0,1,1,1] |
+----+-----------+-----------+
delete from tt4;
select * from tt4;
+----+------+------+
| id | a    | b    |
+----+------+------+
+----+------+------+
drop table if exists tt4;
create table tt4(id int primary key,a vector(2));
alter table tt4 add COLUMN b vector(2) as (array_difference(a)) STORED;
insert into tt4(id,a) values(2,[3,4]);
select * from tt4;
+----+-------+-------+
| id | a     | b     |
+----+-------+-------+
|  2 | [3,4] | [0,1] |
+----+-------+-------+
delete from tt4;
select * from tt4;
+----+------+------+
| id | a    | b    |
+----+------+------+
+----+------+------+
drop table if exists tt4;
create table tt4(id int primary key);
alter table tt4 add COLUMN a array(varchar(50)) as (array_difference(array_range(1,3))) STORED;
insert into tt4(id) values(2);
select * from tt4;
+----+-----------+
| id | a         |
+----+-----------+
|  2 | ["0","1"] |
+----+-----------+
delete from tt4;
select * from tt4;
+----+------+
| id | a    |
+----+------+
+----+------+
drop table if exists tt4;
create table tt4(id int primary key);
alter table tt4 add COLUMN a array(int) as (array_difference(array_range(0))) VIRTUAL;
insert into tt4(id) values(2);
select * from tt4;
+----+------+
| id | a    |
+----+------+
|  2 | []   |
+----+------+
delete from tt4;
select * from tt4;
+----+------+
| id | a    |
+----+------+
+----+------+
drop table if exists tt4;
create table tt4(id int primary key);
alter table tt4 add COLUMN a bigint as (array_difference(array_range(10))) VIRTUAL;
ERROR 22000: Invalid data type for the operation
drop table if exists tt4;
create table tt4(id int primary key);
alter table tt4 add COLUMN a varchar(50) as (array_difference(array_range(1,3))) STORED;
ERROR 22000: Invalid data type for the operation
drop table if exists tt4;
create table tt4(id int[],a varchar(50),INDEX index_1((array_difference(id))));
ERROR HY000: Functional index on a column is not supported. Consider using a regular index instead.
drop table if exists tt4;
Warnings:
Note	1051	Unknown table 'oblrp.tt4'
create table tt4(id int,a varchar(50));
alter table tt4 add index index_1((array_difference(array_range(id))));
ERROR HY000: Functional index on a column is not supported. Consider using a regular index instead.
create UNIQUE index index_1 on tt4((array_difference(array_range(id))));
ERROR HY000: Functional index on a column is not supported. Consider using a regular index instead.
drop table if exists tt3;
create table tt3(id int  primary key,a0 int[],a1 float[],a2 double[],v vector(4));
drop view if exists vtt3;
create view vtt3 as select * from tt3;
insert into tt3 values(1,'[1,2,4,5]','[1.2,5456E-3]','[-1.2,5456E-3]',[1,2,3,4]);
insert into tt3 values(2,'[1,2,4,5]','[1.2,5456E-3]','[-1.2,5456E-3]',[1,2,3,4]);
insert into tt3 values(3,null,null,null,null);
insert into tt3(id) values(4);
insert into tt3 values(5,'[]','[]','[]','[1,2,3,5]');
drop table if exists tt4;
create table tt4(id int  primary key,a0 int[],a1 float[],a2 double[],v vector(4));
drop view if exists vtt4;
create view vtt4 as select * from tt4;
insert into tt4 values(1,'[1,2,4,5]','[1.2,5456E-3]','[-1.2,5456E-3]',[1,2,3,4]);
insert into tt4 values(2,'[1,2,4,5]','[1.2,5456E-3]','[-1.2,5456E-3]',[1,2,3,4]);
insert into tt4 values(3,null,null,null,null);
insert into tt4(id) values(4);
insert into tt4 values(5,'[]','[]','[]','[1,2,3,5]');
DROP MATERIALIZED VIEW  mv1;
create materialized view mv1 (PRIMARY KEY (id)) as select id,array_difference(a0) a0,array_difference(a1) a1,array_difference(a2) a2,array_difference(v) v from tt3;
desc mv1;
+-------+---------------+------+-----+---------+-------+
| Field | Type          | Null | Key | Default | Extra |
+-------+---------------+------+-----+---------+-------+
| id    | int(11)       | NO   | PRI | NULL    |       |
| a0    | ARRAY(BIGINT) | YES  |     | NULL    |       |
| a1    | ARRAY(FLOAT)  | YES  |     | NULL    |       |
| a2    | ARRAY(DOUBLE) | YES  |     | NULL    |       |
| v     | ARRAY(FLOAT)  | YES  |     | NULL    |       |
+-------+---------------+------+-----+---------+-------+
select *,array_difference(a0),array_difference(a1),array_difference(a2),array_difference(v) from mv1 order by id;
+----+-----------+-----------+-----------------------+-----------+----------------------+----------------------+-----------------------+---------------------+
| id | a0        | a1        | a2                    | v         | array_difference(a0) | array_difference(a1) | array_difference(a2)  | array_difference(v) |
+----+-----------+-----------+-----------------------+-----------+----------------------+----------------------+-----------------------+---------------------+
|  1 | [0,1,2,1] | [0,4.256] | [0,6.656000000000001] | [0,1,1,1] | [0,1,1,-1]           | [0,4.256]            | [0,6.656000000000001] | [0,1,0,0]           |
|  2 | [0,1,2,1] | [0,4.256] | [0,6.656000000000001] | [0,1,1,1] | [0,1,1,-1]           | [0,4.256]            | [0,6.656000000000001] | [0,1,0,0]           |
|  3 | NULL      | NULL      | NULL                  | NULL      | NULL                 | NULL                 | NULL                  | NULL                |
|  4 | NULL      | NULL      | NULL                  | NULL      | NULL                 | NULL                 | NULL                  | NULL                |
|  5 | []        | []        | []                    | [0,1,1,2] | []                   | []                   | []                    | [0,1,0,1]           |
+----+-----------+-----------+-----------------------+-----------+----------------------+----------------------+-----------------------+---------------------+
insert into tt3 values(6,'[1,2,4,5]','[1.2,5456E-3]','[-1.2,5456E-3]',[1,2,3,4]);
call DBMS_MVIEW.REFRESH('mv1','c');
insert into tt3 values(7,'[1,2,4,5]','[1.2,5456E-3]','[-1.2,5456E-3]',[1,2,3,4]);
call DBMS_MVIEW.REFRESH('mv1','A');
insert into tt3 values(8,'[1,2,4,5]','[1.2,5456E-3]','[-1.2,5456E-3]',[1,2,3,4]);
call DBMS_MVIEW.REFRESH('mv1','?');
insert into tt3 values(9,'[1,2,4,5]','[1.2,5456E-3]','[-1.2,5456E-3]',[1,2,3,4]);
DROP MATERIALIZED VIEW  mv2;
create materialized view mv2  as select array_difference(a0) a0,array_difference(a1) a1,array_difference(a2) a2,array_difference(v) v from mv1 order by id;
desc mv2;
+-------+---------------+------+-----+---------+-------+
| Field | Type          | Null | Key | Default | Extra |
+-------+---------------+------+-----+---------+-------+
| a0    | ARRAY(BIGINT) | YES  |     | NULL    |       |
| a1    | ARRAY(FLOAT)  | YES  |     | NULL    |       |
| a2    | ARRAY(DOUBLE) | YES  |     | NULL    |       |
| v     | ARRAY(FLOAT)  | YES  |     | NULL    |       |
+-------+---------------+------+-----+---------+-------+
insert into mv2 values('[1,2,3,4]','[1,2,3]','[1,2,3]','[4,5,6]');
ERROR 0A000: DML operation on materialized view (log) is not supported
call DBMS_MVIEW.REFRESH('mv2','c');
call DBMS_MVIEW.REFRESH('mv2','C');
call DBMS_MVIEW.REFRESH('mv2','a');
CALL DBMS_MVIEW.REFRESH('mv2', refresh_parallel => 8);
select *, array_difference(mv1.a1) from mv2 inner join mv1 on mv2.a0=mv1.a0;
+------+------+------+-----------+----+------+------+------+-----------+--------------------------+
| a0   | a1   | a2   | v         | id | a0   | a1   | a2   | v         | array_difference(mv1.a1) |
+------+------+------+-----------+----+------+------+------+-----------+--------------------------+
| []   | []   | []   | [0,1,0,1] |  5 | []   | []   | []   | [0,1,1,2] | []                       |
+------+------+------+-----------+----+------+------+------+-----------+--------------------------+
DROP MATERIALIZED VIEW LOG ON tt4;
CREATE MATERIALIZED VIEW LOG ON tt4 WITH PRIMARY KEY, ROWID,SEQUENCE(a0,a1,a2,v) INCLUDING NEW VALUES;
DROP MATERIALIZED VIEW  mv1;
create materialized view mv1  REFRESH FAST  as 
select t1.id as id1,t2.id as id2 ,array_difference(t1.a0) a0,array_difference(t1.a1) a1,array_difference(t1.a2) a2,array_difference(t2.v) v from tt4 t1 inner join tt4 t2 on array_difference(t1.a0)=array_difference(t2.a0);
bug 2025022500107329596   《[obmysql_array3]outlow 存储，创建物化视图后，写入array等数据到基本表中,ob报1235》
insert into tt4 values(6,'[]','[]','[]','[1,2,3,5]');
call DBMS_MVIEW.REFRESH('mv1','f');
call DBMS_MVIEW.REFRESH('mv1','F');
########清空回收站，删除测试数据库，表等 ##########
drop database  IF EXISTS  oblrp;
purge recyclebin;
