purge recyclebin;
drop database IF EXISTS oblrp;
create database oblrp;
use oblrp;
set timestamp = 1600000000;
set ob_trx_timeout = 10000000000;
set ob_query_timeout = 10000000000;
SET SESSION group_concat_max_len = 100000000;
set ob_default_lob_inrow_threshold = 0;
result_format: 4
drop table tt5;
create table tt5(id int primary key,id1 bigint, a varchar(100),d double,a1 array(float unsigned),a2 int[]);
insert into tt5 values(1,1,'test','1.2E-2',[1,525.12E-2],[1,2,3,4,5]);
insert into tt5 values(2,1,'test1','1.5E-2',[1,523.12E-2],[1,2,3,4,5]);
insert into tt5 values(3,1,'test2','1.5E-2',[1,523.12E-2],[1,2,3,4,5]);
insert into tt5 values(4,2,'test3','142143144.5E-7',[1,523.12E-2],[1,6,3,4,5]);
insert into tt5 values(5,2,'test4','142143144.5E-7',[1,523.12E-2],[1,2,3,4,5]);
insert into tt5 values(6,null,'test4','142143144.5E-7',[1,523.12E-2],[5,2,3,4,5]);
insert into tt5 values(7,null,'test5','142143144.5E-7',[1,523.12E-2],[1,2,3,4,5]);
insert into tt5 values(8,3,'test6','142143144.5E-7',[1,523.12E+2,1,6,9],[1,2,3,4,5]);
insert into tt5 values(9,3,'test6','142143144.5E-7',null,[1,2,3,4,5]);
insert into tt5 values(10,3,null,'142143144.5E-7',null,[1,2,3,4,6]);
drop PROCEDURE p_test01;
CREATE  PROCEDURE p_test01()
begin
declare  a int;
declare  b double;
select array_sum([1,2,4,5,5]);
select array_sum([1,2,4,5,5]) into a;
select a;
select array_sum(a1) into b from tt5 where id=1;
select b;
end;
//
call p_test01();
+------------------------+
| array_sum([1,2,4,5,5]) |
+------------------------+
+------+
| a    |
+------+
+-------------------+
| b                 |
+-------------------+
|                     17 |
|   17 |
| 6.251200199127197 |
+------------------------+
+------+
+-------------------+
drop table tt3;
drop PROCEDURE p_test01;
CREATE  PROCEDURE p_test01()
begin
create table tt3(id int,d double);
insert  into tt3 values(array_sum([1,23,4]),array_sum([100E+2,25E-1]));
select * from tt3;
end;
//
call p_test01();
+------+---------+
| id   | d       |
+------+---------+
|   28 | 10002.5 |
+------+---------+
drop PROCEDURE p_test01;
CREATE  PROCEDURE p_test01()
begin
if array_sum([1,2,4,5,6,10])=array_sum([1,2,4,5,6,5,5]) then
select array_sum([1,2,4,5,6,10]);
end if;
end;
//
bug 2024121300106457444   《[obmysql_array二期]array 表达式在存储过程/触发器中，ob报4006》
call p_test01();
ERROR HY000: The object is not initialized
drop PROCEDURE p_test01;
CREATE  PROCEDURE p_test01()
begin
if array_sum([1,2,4,5,6,10])!=array_sum([1,2,4,5,6,5,5]) then
select 1;
end if;
end;
//
bug 2024121300106457444   《[obmysql_array二期]array 表达式在存储过程/触发器中，ob报4006》
call p_test01();
ERROR HY000: The object is not initialized
drop PROCEDURE p_test01;
CREATE  PROCEDURE p_test01()
begin
declare a double;
DECLARE cur1 CURSOR FOR select array_sum(a1) as a from tt5;
open cur1;
  FETCH cur1 INTO a;
  select a;
  CLOSE cur1;
end;
//
call p_test01();
+-------------------+
| a                 |
+-------------------+
| 6.251200199127197 |
+-------------------+
drop PROCEDURE p_test01;
CREATE  PROCEDURE p_test01()
begin
declare a int;
DECLARE cur1 CURSOR FOR select array_sum(a2) as a from tt5;
open cur1;
  FETCH cur1 INTO a;
  select a;
  CLOSE cur1;
end;
//
call p_test01();
+------+
| a    |
+------+
|   15 |
+------+
drop PROCEDURE p_test01;
CREATE  PROCEDURE p_test01()
begin
WHILE array_sum([0]) DO
       select 1;
     END WHILE;
end;
//
bug 2024121300106457444   《[obmysql_array二期]array 表达式在存储过程/触发器中，ob报4006》
call p_test01();
ERROR HY000: The object is not initialized
drop PROCEDURE p_test01;
CREATE  PROCEDURE p_test01(in i int,d double)
begin
select i;
end;
//
bug 2024121300106457444   《[obmysql_array二期]array 表达式在存储过程/触发器中，ob报4006》
call p_test01(array_sum([1,2]),array_sum([1E+2,2]));
ERROR HY000: The object is not initialized
drop PROCEDURE p_test01;
CREATE  PROCEDURE p_test01()
begin
select array_difference([1,2,3,4,5,9]);
select array_range(2,10,2);
select reverse([1,2,3,4,5]);
select array_slice([1,2,3,4,5],1);
select array_position([1,3,4,5],3);
end;
//
call p_test01();
+---------------------------------+
| array_difference([1,2,3,4,5,9]) |
+---------------------------------+
+---------------------+
| array_range(2,10,2) |
+---------------------+
+----------------------+
| reverse([1,2,3,4,5]) |
+----------------------+
+----------------------------+
| array_slice([1,2,3,4,5],1) |
+----------------------------+
+-----------------------------+
| array_position([1,3,4,5],3) |
+-----------------------------+
| [0,1,1,1,1,4]                   |
| [2,4,6,8]           |
| [5,4,3,2,1]          |
| [1,2,3,4,5]                |
|                           2 |
+---------------------------------+
+---------------------+
+----------------------+
+----------------------------+
+-----------------------------+
drop PROCEDURE p_test01;
CREATE  PROCEDURE p_test01()
begin
select array_difference([1,2,3,4,5,9]);
select array_range(2,10,2);
select reverse([[1,2,3,4,5],['gdxg']]);
select array_slice([1,2,3,4,5],1);
select array_position([1,3,4,5],3);
end;
//
call p_test01();
+---------------------------------+
| array_difference([1,2,3,4,5,9]) |
+---------------------------------+
+---------------------+
| array_range(2,10,2) |
+---------------------+
+----------------------------------+
| reverse([[1,2,3,4,5],['gdxg']])  |
+----------------------------------+
+----------------------------+
| array_slice([1,2,3,4,5],1) |
+----------------------------+
+-----------------------------+
| array_position([1,3,4,5],3) |
+-----------------------------+
| [0,1,1,1,1,4]                   |
| [2,4,6,8]           |
| [["gdxg"],["1","2","3","4","5"]] |
| [1,2,3,4,5]                |
|                           2 |
+---------------------------------+
+---------------------+
+----------------------------------+
+----------------------------+
+-----------------------------+
drop PROCEDURE p_test01;
CREATE  PROCEDURE p_test01()
begin
declare a int;
DECLARE cur1 CURSOR FOR select array_position([1,3,4,5],3) as a ;
open cur1;
  FETCH cur1 INTO a;
  select a;
  CLOSE cur1;
end;
//
call p_test01();
+------+
| a    |
+------+
|    2 |
+------+
drop PROCEDURE p_test01;
CREATE  PROCEDURE p_test01()
begin
if array_difference([1,2,3,4,5,9])=array_difference([1,2,3,4,5,9]) then
select 1;
end if;
end;
//
bug 2024121300106457444   《[obmysql_array二期]array 表达式在存储过程/触发器中，ob报4006》
call p_test01();
ERROR HY000: The object is not initialized
drop PROCEDURE p_test01;
CREATE  PROCEDURE p_test01()
begin
WHILE array_range(2,10,2)!=array_range(2,10,2) DO
       select 1;
     END WHILE;
end;
//
bug 2024121300106457444   《[obmysql_array二期]array 表达式在存储过程/触发器中，ob报4006》
call p_test01();
ERROR HY000: The object is not initialized
drop PROCEDURE p_test01;
CREATE PROCEDURE p_test01()
   BEGIN
     CASE reverse([1,2,3,4,5])
       WHEN  reverse([1,2,3,4,5]) THEN SELECT reverse([1,2,3,4,5]) ;
       WHEN array_slice([1,2,3,4,5],1) THEN SELECT array_slice([1,2,3,4,5],1);
       ELSE
         BEGIN
         END;
     END CASE;
   END //
bug 2024121300106457444   《[obmysql_array二期]array 表达式在存储过程/触发器中，ob报4006》
call p_test01();
ERROR HY000: The object is not initialized
drop PROCEDURE p_test01;
CREATE  PROCEDURE p_test01(in i int,d double)
begin
select i;
end;
//
bug 2024121300106457444   《[obmysql_array二期]array 表达式在存储过程/触发器中，ob报4006》
call p_test01(array_position([1,3,4,5],3),array_position([1,3,4,5],3));
ERROR HY000: The object is not initialized
drop PROCEDURE p_test01;
CREATE PROCEDURE p_test01()
   BEGIN
     CASE array_position([1,3,4,5],3)
       WHEN  array_position([1,3,4,5],3) THEN  select array_position([1,3,4,5],3) ;
       WHEN array_position([1,2,4,5],3) THEN SELECT array_position([1,2,4,5],3) ;
       ELSE
         BEGIN
         END;
     END CASE;
   END //
bug 2024121300106457444   《[obmysql_array二期]array 表达式在存储过程/触发器中，ob报4006》
call p_test01();
ERROR HY000: The object is not initialized
drop table tt3;
create table tt3(id int,a1 int[], d double[],c varchar(50)[]);
drop function fun_test;
create function fun_test()
returns int
begin
declare i int;
return  array_sum([1,2,3]);
end;
//
bug 2024121300106455565   《[obmysql_array 二期]pl函数return cardinality表达式，报4016》
select fun_test();
ERROR HY000: The object is not initialized
drop function fun_test;
create function fun_test( i int)
returns float
begin
declare r float;
select i into r;
return  r;
end;
//
select fun_test(array_sum([1.3,5.7]));
+--------------------------------+
| fun_test(array_sum([1.3,5.7])) |
+--------------------------------+
|                              7 |
+--------------------------------+
drop function fun_test;
create function fun_test( i double)
returns double
begin
declare r double;
select i into r;
return  r;
end;
//
select fun_test(array_sum([80E+2]));
+------------------------------+
| fun_test(array_sum([80E+2])) |
+------------------------------+
|                         8000 |
+------------------------------+
drop function fun_test;
create function fun_test()
returns int
   BEGIN
     CASE array_sum([1])
       WHEN array_sum([1]) THEN  return 1;
       WHEN array_sum([[1,2,34]]) THEN  return 0;
       ELSE
         BEGIN
         END;
           return 1;
     END CASE;
      return 1;
   END //
Warnings:
Warning	5002	Resolve error
bug 2024121300106455565   《[obmysql_array 二期]pl函数 array表达式 ,报4016》
select fun_test();
ERROR 0A000: array_sum with multi-dimension array not supported
drop function fun_test;
create function fun_test( i int)
returns float
begin
declare r float;
select i into r;
return  r;
end;
//
select fun_test(array_position([1,3,4,5],3));
+---------------------------------------+
| fun_test(array_position([1,3,4,5],3)) |
+---------------------------------------+
|                                     2 |
+---------------------------------------+
drop function fun_test;
create function fun_test( i double)
returns double
begin
declare r double;
select array_position([1,3,4,5],3) into r;
return  r;
end;
//
select fun_test(array_position([1,3,4,5],3));
+---------------------------------------+
| fun_test(array_position([1,3,4,5],3)) |
+---------------------------------------+
|                                     2 |
+---------------------------------------+
drop function fun_test;
create function fun_test()
returns double
begin
declare i int;
declare i1 int;
select  array_sum([1,2,34]) into i;
select  array_position([['test'],['test1']],['test1']) into i1;
insert into tt3 values(array_sum([1,2,3]),array_difference([1,2,3,4,5,6,6]),array_slice([29233E-4,2.3],1),reverse(['test','test1']));
replace into tt3 values(array_position([1,2,3],3),array_range(10),reverse([765.87,98E-1]),array_slice(['tettest','test8384893'],1));
return  i;
end;
//
select fun_test();
+------------+
| fun_test() |
+------------+
|         37 |
+------------+
select * from tt3;
+------+-----------------------+--------------+---------------------------+
| id   | a1                    | d            | c                         |
+------+-----------------------+--------------+---------------------------+
|    6 | [0,1,1,1,1,1,0]       | [2.9233,2.3] | ["test1","test"]          |
|    3 | [0,1,2,3,4,5,6,7,8,9] | [9.8,765.87] | ["tettest","test8384893"] |
+------+-----------------------+--------------+---------------------------+
drop function fun_test;
create function fun_test()
returns int
begin
declare r int;
declare a int;
DECLARE cur1 CURSOR FOR select array_position([[1,2,34],[445,845455]],[445,845455]) as a;
open cur1;
  FETCH cur1 INTO a;
  CLOSE cur1;
return  a;
end;
//
select fun_test();
+------------+
| fun_test() |
+------------+
|          2 |
+------------+
drop function fun_test;
create function fun_test()
returns int
begin
declare r int;
select 1 into r;
return  array_range(10);
end;
//
Warnings:
Warning	5002	Resolve error
select fun_test();
ERROR 22000: Invalid data type for the operation
drop function fun_test;
create function fun_test()
returns int
begin
declare r int;
select 1 into r;
return  array_range(10);
end;
//
Warnings:
Warning	5002	Resolve error
select fun_test();
ERROR 22000: Invalid data type for the operation
drop function fun_test;
create function fun_test()
returns int
begin
declare r int;
select 1 into r;
return  array_range(10);
end;
//
Warnings:
Warning	5002	Resolve error
select fun_test();
ERROR 22000: Invalid data type for the operation
drop function fun_test;
create function fun_test()
returns int
begin
declare r int;
if  array_slice([1,2,3],1)=reverse([1,2,3]) then
     set r=1;
        end if;
return  r;
end;
//
bug 2024121300106455565   《[obmysql_array 二期]pl函数return cardinality表达式，报4016》
select fun_test();
ERROR HY000: The object is not initialized
drop function fun_test;
create function fun_test()
returns int
begin
declare i int;
set i=0;
WHILE !array_difference([1,2,3,4]) and 0=1 DO
       select 1 into  i;
     END WHILE;
return i;
end;
//
Warnings:
Warning	5002	Resolve error
bug 2024121300106455565   《[obmysql_array 二期]pl函数return cardinality表达式，报4016》
select fun_test();
ERROR 22000: Invalid data type for the operation
drop table tt3;
create table tt3(id int,a1 int[], d double[],c varchar(50)[]);
drop table tt4;
create table tt4(id int,a1 int[], d double[],c varchar(50)[]);
drop trigger tr_test;
CREATE  trigger tr_test after insert on tt4
for each row 
BEGIN
declare i int;
declare i1 int;
select  array_sum([1,2,34]) into i;
select  array_position([['test'],['test1']],['test1']) into i1;
insert into tt3 values(array_sum([1,2,3]),array_difference([1,2,3,4,5,6,6]),array_slice([29233E-4,2.3],1),reverse(['test','test1']));
replace into tt3 values(array_position([1,2,3],3),array_range(10),reverse([765.87,98E-1]),array_slice(['tettest','test8384893'],1));
end;
//
insert into tt4 values(array_sum([1,2,3]),array_difference([1,2,3,4,5,6,6]),array_slice([29233E-4,2.3],1),reverse(['test','test1']));
select * from tt4;
+------+-----------------+--------------+------------------+
| id   | a1              | d            | c                |
+------+-----------------+--------------+------------------+
|    6 | [0,1,1,1,1,1,0] | [2.9233,2.3] | ["test1","test"] |
+------+-----------------+--------------+------------------+
select * from tt3;
+------+-----------------------+--------------+---------------------------+
| id   | a1                    | d            | c                         |
+------+-----------------------+--------------+---------------------------+
|    6 | [0,1,1,1,1,1,0]       | [2.9233,2.3] | ["test1","test"]          |
|    3 | [0,1,2,3,4,5,6,7,8,9] | [9.8,765.87] | ["tettest","test8384893"] |
+------+-----------------------+--------------+---------------------------+
drop trigger tr_test;
CREATE  trigger tr_test after update on tt4
for each row 
BEGIN
declare i int;
declare i1 int;
select  array_sum([1,2,34]) into i;
select  array_position([['test'],['test1']],['test1']) into i1;
insert into tt3 values(array_sum([1,2,3]),array_difference([1,2,3,4,5,6,6]),array_slice([29233E-4,2.3],1),reverse(['test','test1']));
replace into tt3 values(array_position([1,2,3],3),array_range(10),reverse([765.87,98E-1]),array_slice(['tettest','test8384893'],1));
end;
//
update tt4 set a1=array_difference([-1,2,3,4,-5,6,-6]),d= reverse([8.8]),c=array_slice(['tettest2','test8384896'],3);
select * from tt3;
+------+-----------------------+--------------+---------------------------+
| id   | a1                    | d            | c                         |
+------+-----------------------+--------------+---------------------------+
|    6 | [0,1,1,1,1,1,0]       | [2.9233,2.3] | ["test1","test"]          |
|    3 | [0,1,2,3,4,5,6,7,8,9] | [9.8,765.87] | ["tettest","test8384893"] |
|    6 | [0,1,1,1,1,1,0]       | [2.9233,2.3] | ["test1","test"]          |
|    3 | [0,1,2,3,4,5,6,7,8,9] | [9.8,765.87] | ["tettest","test8384893"] |
+------+-----------------------+--------------+---------------------------+
select * from tt4;
+------+---------------------+-------+------+
| id   | a1                  | d     | c    |
+------+---------------------+-------+------+
|    6 | [0,3,1,1,-9,11,-12] | [8.8] | []   |
+------+---------------------+-------+------+
drop trigger tr_test;
CREATE  trigger tr_test before delete on tt4
for each row 
BEGIN
declare i int;
declare i1 int;
select  array_sum([1,2,34]) into i;
select  array_position([['test'],['test1']],['test1']) into i1;
insert into tt3 values(array_sum([1,2,3]),array_difference([1,2,3,4,5,6,6]),array_slice([29233E-4,2.3],1),reverse(['test','test1']));
replace into tt3 values(array_position([1,2,3],3),array_range(10),reverse([765.87,98E-1]),array_slice(['tettest','test8384893'],1));
end;
//
delete from tt4;
select * from tt3;
+------+-----------------------+--------------+---------------------------+
| id   | a1                    | d            | c                         |
+------+-----------------------+--------------+---------------------------+
|    6 | [0,1,1,1,1,1,0]       | [2.9233,2.3] | ["test1","test"]          |
|    3 | [0,1,2,3,4,5,6,7,8,9] | [9.8,765.87] | ["tettest","test8384893"] |
|    6 | [0,1,1,1,1,1,0]       | [2.9233,2.3] | ["test1","test"]          |
|    3 | [0,1,2,3,4,5,6,7,8,9] | [9.8,765.87] | ["tettest","test8384893"] |
|    6 | [0,1,1,1,1,1,0]       | [2.9233,2.3] | ["test1","test"]          |
|    3 | [0,1,2,3,4,5,6,7,8,9] | [9.8,765.87] | ["tettest","test8384893"] |
+------+-----------------------+--------------+---------------------------+
select * from tt4;
+------+------+------+------+
| id   | a1   | d    | c    |
+------+------+------+------+
+------+------+------+------+
########清空回收站，删除测试数据库，表等 ##########
drop database  IF EXISTS  oblrp;
purge recyclebin;
