create sequence seq1 order cache 100;
alter sequence seq1 noorder cache 30;
drop sequence seq1;
create sequence testx nomaxvalue maxvalue 1;
ERROR HY000: conflicting MAXVALUE/NOMAXVALUE specifications
create sequence testx nominvalue minvalue 1;
ERROR HY000: conflicting MINVALUE/NOMINVALUE specifications
create sequence testx cycle nocycle;
ERROR HY000: conflicting CYCLE/NOCYCLE specifications
create sequence testx cache 20 nocache;
ERROR HY000: conflicting CACHE/NOCACHE specifications
create sequence testx order noorder;
ERROR HY000: conflicting ORDER/NOORDER specifications
create sequence testx cache 20 cache 30;
ERROR HY000: duplicate CACHE/NOCACHE specifications
create sequence testx nocache nocache;
ERROR HY000: duplicate CACHE/NOCACHE specifications
create sequence testx nocache noorder noorder;
ERROR HY000: duplicate ORDER/NOORDER specifications
create sequence testx noorder noorder cache 10;
ERROR HY000: duplicate ORDER/NOORDER specifications
create sequence testx increment by 1 increment by 2;
ERROR HY000: duplicate INCREMENT BY specifications
create sequence testx start with 1 start with 2;
ERROR HY000: duplicate START WITH specifications
create sequence s1 minvalue 100 maxvalue 100;
ERROR HY000: MINVALUE must be less than MAXVALUE
create sequence s1  maxvalue -30  increment by 1;
ERROR HY000: MINVALUE must be less than MAXVALUE
create sequence s1  maxvalue 0  increment by 1;
ERROR HY000: MINVALUE must be less than MAXVALUE
create sequence s1  maxvalue 1  increment by 1;
ERROR HY000: MINVALUE must be less than MAXVALUE
create sequence s1  minvalue 3 increment by -1;
ERROR HY000: MINVALUE must be less than MAXVALUE
create sequence s1  minvalue 1 increment by -1;
ERROR HY000: MINVALUE must be less than MAXVALUE
create sequence s1  minvalue -1 increment by -1;
ERROR HY000: MINVALUE must be less than MAXVALUE
create sequence s1  maxvalue -30;
ERROR HY000: MINVALUE must be less than MAXVALUE
create sequence s1  maxvalue -30 nominvalue;
ERROR HY000: MINVALUE must be less than MAXVALUE
create sequence s1  maxvalue 1 nominvalue;
ERROR HY000: MINVALUE must be less than MAXVALUE
create sequence s1  minvalue -1 increment by -1 start with 10;
ERROR HY000: MINVALUE must be less than MAXVALUE
create sequence s1 minvalue 1 maxvalue 10 start with 1 increment by 10;
ERROR HY000: INCREMENT must be less than MAXVALUE minus MINVALUE
create sequence s1 minvalue 1 maxvalue 10 start with 1 increment by 11;
ERROR HY000: INCREMENT must be less than MAXVALUE minus MINVALUE
create sequence s1 minvalue 1 maxvalue 10 start with 1 increment by -10;
ERROR HY000: INCREMENT must be less than MAXVALUE minus MINVALUE
create sequence s1 minvalue 1 maxvalue 10 start with 1 increment by -11;
ERROR HY000: INCREMENT must be less than MAXVALUE minus MINVALUE
create sequence s1 increment by 0;
ERROR HY000: INCREMENT must be a nonzero integer
create sequence a4 minvalue -3 cycle increment by -1;
ERROR HY000: number to CACHE must be less than one cycle
create sequence a4 nominvalue cycle increment by -1;
ERROR HY000: descending sequences that CYCLE must specify MINVALUE
create sequence a4 minvalue -3 cycle increment by 1 cache 2;
ERROR HY000: ascending sequences that CYCLE must specify MAXVALUE
create sequence a4 start with 10 minvalue 11;
ERROR HY000: START WITH cannot be less than MINVALUE
create sequence a4 start with 10 maxvalue 9;
ERROR HY000: START WITH cannot be more than MAXVALUE
create sequence a4 minvalue 0 maxvalue 10 cache -1;
ERROR HY000: the number of values to CACHE must be greater than 1
create sequence a5 minvalue 1 maxvalue 6 cache 4 increment by 1 nocycle;
select a5.nextval from dual;
nextval
1
select a5.nextval from dual;
nextval
2
select a5.nextval from dual;
nextval
3
select a5.nextval from dual;
nextval
4
select a5.nextval from dual;
nextval
5
select a5.nextval from dual;
nextval
6
select a5.nextval from dual;
ERROR HY000: sequence exceeds MAXVALUE and cannot be instantiated
select a5.nextval from dual;
ERROR HY000: sequence exceeds MAXVALUE and cannot be instantiated
create sequence ok start with 1 cache 1 minvalue 0 maxvalue 100;
ERROR HY000: the number of values to CACHE must be greater than 1
create sequence ok start with 1 order minvalue 0 maxvalue 100;
create table t_s (i int primary key, j int);
create table t_p (i int primary key, j int) partition by hash(i) partitions 3;
select ok.nextval, ok.currval, ok.nextval from t_s order by 1;
ERROR HY000: sequence number not allowed here
select * from t_s order by ok.nextval;
ERROR HY000: sequence number not allowed here
select * from t_s where i = ok.nextval;
ERROR HY000: sequence number not allowed here
select * from t_s group by i + ok.nextval;
ERROR HY000: sequence number not allowed here
select * from t_s where i in (select ok.nextval from t_p);
ERROR HY000: sequence number not allowed here
create view nextval_view as select ok.nextval from dual;
ERROR HY000: sequence number not allowed here
insert into t_s values (ok.nextval, 1);
insert into t_s values (ok.nextval, 2);
insert into t_p values (ok.nextval, 1);
insert into t_p values (ok.nextval, 2);
insert into t_p values (100, ok.nextval);
insert into t_p values (101, ok.nextval);
update t_s set i = ok.nextval, j = ok.currval;
update t_p set i = ok.nextval, j = ok.currval;
select * from t_s order by 1;
i	j
7	7
8	8
select * from t_p order by 1;
i	j
9	9
10	10
11	11
12	12
select ok.nextval from dual;
nextval
13
select ok.nextval from dual;
nextval
14
select ok.nextval from dual;
nextval
15
select ok.nextval, ok.currval, ok.nextval from dual;
nextval	currval	nextval
16	16	16
select ok.nextval from t_s;
nextval
17
18
explain basic select ok.nextval, i from t_p;
Query Plan
=========================================
|ID|OPERATOR                   |NAME    |
-----------------------------------------
|0 |SEQUENCE                   |        |
|1 |└─PX COORDINATOR           |        |
|2 |  └─EXCHANGE OUT DISTR     |:EX10000|
|3 |    └─PX PARTITION ITERATOR|        |
|4 |      └─TABLE FULL SCAN    |t_p     |
=========================================
Outputs & filters:
-------------------------------------
  0 - output([ok.nextval], [t_p.i]), filter(nil)
  1 - output([t_p.i]), filter(nil), rowset=16
  2 - output([t_p.i]), filter(nil), rowset=16
      dop=1
  3 - output([t_p.i]), filter(nil), rowset=16
      force partition granule
  4 - output([t_p.i]), filter(nil), rowset=16
      access([t_p.i]), partitions(p[0-2])
      is_index_back=false, is_global_index=false, 
      range_key([t_p.i]), range(MIN ; MAX)always true
explain basic select ok.currval, i from t_p;
Query Plan
=========================================
|ID|OPERATOR                   |NAME    |
-----------------------------------------
|0 |SEQUENCE                   |        |
|1 |└─PX COORDINATOR           |        |
|2 |  └─EXCHANGE OUT DISTR     |:EX10000|
|3 |    └─PX PARTITION ITERATOR|        |
|4 |      └─TABLE FULL SCAN    |t_p     |
=========================================
Outputs & filters:
-------------------------------------
  0 - output([ok.currval], [t_p.i]), filter(nil)
  1 - output([t_p.i]), filter(nil), rowset=16
  2 - output([t_p.i]), filter(nil), rowset=16
      dop=1
  3 - output([t_p.i]), filter(nil), rowset=16
      force partition granule
  4 - output([t_p.i]), filter(nil), rowset=16
      access([t_p.i]), partitions(p[0-2])
      is_index_back=false, is_global_index=false, 
      range_key([t_p.i]), range(MIN ; MAX)always true
drop sequence large_seq_ok_1;
drop sequence large_seq_ok_2;
drop sequence large_seq_ok_3;
drop sequence large_seq_ok_4;
drop sequence large_seq1;
drop sequence large_seq2;
create sequence large_seq_ok_1 minvalue -999999999999999999999999999 maxvalue 9999999999999999999999999999;
create sequence large_seq_ok_2 minvalue -99999999999999999999999999 increment by -1;
create sequence large_seq_ok_3 maxvalue -999999999999999999999999999 increment by 1;
ERROR HY000: MINVALUE must be less than MAXVALUE
create sequence large_seq_ok_4 minvalue -999999999999999999999999999999 maxvalue 9999999999999999999999999999999 cache 99999999999999999999999999999999 increment by 99999999999999999999999999999999;
create sequence large_seq1 minvalue -4611686018427387904 increment by -1;
create sequence large_seq2 maxvalue 4611686018427387903 increment by 1;
alter sequence large_seq1 minvalue -4611686018427387904 increment by -1;
alter sequence large_seq2 maxvalue 4611686018427387903 increment by 1;
create sequence non_integer_seq increment by 1.1;
ERROR HY000: sequence parameter INCREMENT must be an integer
create sequence non_integer_seq start with 1.1;
ERROR HY000: sequence parameter START WITH must be an integer
create sequence non_integer_seq minvalue 1.1;
ERROR HY000: sequence parameter MINVALUE must be an integer
create sequence non_integer_seq maxvalue 1.1;
ERROR HY000: sequence parameter MAXVALUE must be an integer
create sequence non_integer_seq cache 21.1;
ERROR HY000: sequence parameter CACHE must be an integer
drop sequence no_cache_seq;
create sequence no_cache_seq minvalue 0 maxvalue 3 increment by 3 nocache;
select no_cache_seq.nextval from dual;
nextval
0
select no_cache_seq.nextval from dual;
nextval
3
select no_cache_seq.nextval from dual;
ERROR HY000: sequence exceeds MAXVALUE and cannot be instantiated
drop database if exists db_sequence1;
create database db_sequence1;
create sequence db_sequence1.s1;
select db_sequence1.s1.nextval from dual;
nextval
1
drop sequence db_sequence1.s1;
drop database db_sequence1;
