drop user 'yyl_lnnvl_mysql'@'%';
create user 'yyl_lnnvl_mysql'@'%' IDENTIFIED BY 'yyl_lnnvl_mysql';
grant all on *.* to 'yyl_lnnvl_mysql'@'%' WITH GRANT OPTION;
#lnnvl-5	静态sql
#lnnvl-5-1	select
DROP TABLE test1;
CREATE TABLE test1(f1 int,f2 double(5,3),f3 varchar(5),f4 date);
INSERT INTO test1 VALUES(1,1.555,'abc','20151212');
INSERT INTO test1 VALUES(2,2.555,'bcd','20161212');
INSERT INTO test1 VALUES(3,3.555,'cde','20171212');
INSERT INTO test1 VALUES(NULL,NULL,NULL,NULL);
#lnnvl-5-1-1	select
SELECT lnnvl(f1<3),lnnvl(f2<3),lnnvl(f3>'a'),lnnvl(f4 IS NULL) FROM test1;
lnnvl(f1<3)	lnnvl(f2<3)	lnnvl(f3>'a')	lnnvl(f4 IS NULL)
0	0	0	1
0	0	0	1
1	1	0	1
1	1	1	0
#lnnvl-5-1-2	from
SELECT * FROM (SELECT * FROM test1 WHERE lnnvl(f1<3) AND lnnvl(f2<3) AND NOT lnnvl(f3='abc') OR lnnvl(f4 IS NULL)) t1 WHERE lnnvl(f1!=2) ORDER BY 2 desc;
f1	f2	f3	f4
2	2.555	bcd	2016-12-12
#lnnvl-5-1-3	where
SELECT * FROM test1 WHERE lnnvl(f1<3) AND lnnvl(f2<3) AND NOT lnnvl(f3='abc') OR lnnvl(f4 IS NOT NULL);
f1	f2	f3	f4
NULL	NULL	NULL	NULL
#lnnvl-5-1-5	having
SELECT f2,f3 FROM test1 WHERE lnnvl(f1>2.5) GROUP BY f2,f3 HAVING lnnvl(f3='abc') OR lnnvl(f3='bcd');
f2	f3
1.555	abc
2.555	bcd
NULL	NULL
#lnnvl-5-1-7	case when
SELECT (CASE WHEN lnnvl(f1>2) THEN f1 ELSE f1+1 END) FROM test1;
(CASE WHEN lnnvl(f1>2) THEN f1 ELSE f1+1 END)
1
2
4
NULL
SELECT (CASE WHEN lnnvl(f1 IS NULL) THEN f1 ELSE 2 END) FROM test1;
(CASE WHEN lnnvl(f1 IS NULL) THEN f1 ELSE 2 END)
1
2
3
2
SELECT (CASE lnnvl(f1 IS NULL) WHEN 1 THEN f1 WHEN NULL THEN 2 ELSE 3 END) FROM test1;
(CASE lnnvl(f1 IS NULL) WHEN 1 THEN f1 WHEN NULL THEN 2 ELSE 3 END)
1
2
3
3
#lnnvl-5-1-8	distinct
SELECT DISTINCT lnnvl(f1 IS NOT NULL) FROM test1;
lnnvl(f1 IS NOT NULL)
0
1
#lnnvl-5-2	insert
#lnnvl-5-2-1	values
#lnnvl-5-2-1-1	直接嵌套被测函数
DELETE FROM test1 WHERE 1=1;
INSERT INTO test1(f1) VALUES(lnnvl(1=1));
INSERT INTO test1(f2) VALUES(lnnvl(2.5!=4));
INSERT INTO test1(f3) VALUES(lnnvl('abf'>'a'));
INSERT INTO test1(f4) VALUES(lnnvl('20191212'!='20191212'));
ERROR 22007: Incorrect datetime value for column 'f4' at row 1
INSERT INTO test1 VALUES(lnnvl(1=1),lnnvl(2.5!=4),lnnvl('abf'>'a'),'20191212');
SELECT * FROM test1;
f1	f2	f3	f4
0	NULL	NULL	NULL
NULL	0.000	NULL	NULL
NULL	NULL	0	NULL
0	0.000	0	2019-12-12
#lnnvl-5-2-1-2	嵌套包含被测函数的select语句
DELETE FROM test1 WHERE 1=1;
INSERT INTO test1 VALUES(1,1.555,'abc','20151212');
INSERT INTO test1 VALUES(2,2.555,'bcd','20161212');
INSERT INTO test1 VALUES(3,3.555,'cde','20171212');
INSERT INTO test1 VALUES(NULL,NULL,NULL,NULL);
DROP TABLE test2;
CREATE TABLE test2 AS SELECT * FROM test1 WHERE 1=0;
INSERT INTO test2(f1) VALUES((SELECT min(f1) FROM test1 WHERE lnnvl(f2 IS NULL)));
SELECT * FROM test2;
f1	f2	f3	f4
1	NULL	NULL	NULL
DELETE FROM test2 WHERE 1=1;
INSERT INTO test2(f3) VALUES((SELECT f1 FROM test1 WHERE lnnvl(f2 IS NULL) GROUP BY f1 HAVING lnnvl(f1<3)));
SELECT * FROM test2;
f1	f2	f3	f4
NULL	NULL	3	NULL
DELETE FROM test2 WHERE 1=1;
INSERT INTO test2(f4) VALUES((SELECT '20171212' FROM test1 WHERE lnnvl(f2 IS NULL) GROUP BY f1 HAVING lnnvl(f1<3)));
SELECT * FROM test2;
f1	f2	f3	f4
NULL	NULL	NULL	2017-12-12
DELETE FROM test2 WHERE 1=1;
INSERT INTO test2 VALUES((SELECT min(f1) FROM test1 WHERE lnnvl(f2 IS NULL)),NULL,(SELECT f1 FROM test1 WHERE lnnvl(f2 IS NULL) GROUP BY f1 HAVING lnnvl(f1<3)),(SELECT '20171212' FROM test1 WHERE lnnvl(f2 IS NULL) GROUP BY f1 HAVING lnnvl(f1<3)));
SELECT * FROM test2;
f1	f2	f3	f4
1	NULL	3	2017-12-12
#lnnvl-5-2-2	insert into ... 后直接跟包含被测函数的select语句
DELETE FROM test2 WHERE 1=1;
INSERT INTO test2 SELECT * FROM test1 WHERE lnnvl(f2 IS NULL);
SELECT * FROM test2;
f1	f2	f3	f4
1	1.555	abc	2015-12-12
2	2.555	bcd	2016-12-12
3	3.555	cde	2017-12-12
DELETE FROM test2 WHERE 1=1;
INSERT INTO test2(f2) SELECT f1 FROM test1 WHERE lnnvl(f2 IS NULL) GROUP BY f1 HAVING lnnvl(f1<3);
SELECT * FROM test2;
f1	f2	f3	f4
NULL	3.000	NULL	NULL
#lnnvl-5-3	update
#lnnvl-5-3-1	set
#lnnvl-5-3-1-1	直接嵌套被测函数
DROP TABLE test2;
CREATE TABLE test2 AS SELECT * FROM test1 WHERE 1=1;
UPDATE test2 SET f1=lnnvl(f1>2) WHERE f1 IS NOT NULL;
SELECT * FROM test2;
f1	f2	f3	f4
1	1.555	abc	2015-12-12
1	2.555	bcd	2016-12-12
0	3.555	cde	2017-12-12
NULL	NULL	NULL	NULL
#lnnvl-5-3-1-2	嵌套包含被测函数的select语句
UPDATE test2 SET f1=(SELECT max(f2) FROM test1 WHERE lnnvl(f1>2)) WHERE f2 IS NOT NULL;
SELECT * FROM test2;
f1	f2	f3	f4
3	1.555	abc	2015-12-12
3	2.555	bcd	2016-12-12
3	3.555	cde	2017-12-12
NULL	NULL	NULL	NULL
UPDATE test2 SET f2=(SELECT avg(m) FROM (SELECT f2||'5.5544' m FROM test1 WHERE lnnvl(f1>2) GROUP BY f2 HAVING lnnvl(f2>=2) OR lnnvl(f2<=2) ORDER BY 1) t1 limit 1) WHERE f2 IS NULL;
SELECT * FROM test2;
f1	f2	f3	f4
3	1.555	abc	2015-12-12
3	2.555	bcd	2016-12-12
3	3.555	cde	2017-12-12
NULL	1.000	NULL	NULL
#lnnvl-5-3-2	where
#lnnvl-5-3-2-1	直接嵌套被测函数
UPDATE test2 SET f1='5' WHERE lnnvl(f3<'c') AND f1 IS NOT NULL;
SELECT * FROM test2;
f1	f2	f3	f4
3	1.555	abc	2015-12-12
3	2.555	bcd	2016-12-12
5	3.555	cde	2017-12-12
NULL	1.000	NULL	NULL
#lnnvl-5-3-2-2	嵌套包含被测函数的select语句
UPDATE test2 SET f1='6' WHERE f2 = (SELECT max(f2) FROM test1 WHERE lnnvl(f1>2));
SELECT * FROM test2;
f1	f2	f3	f4
3	1.555	abc	2015-12-12
6	2.555	bcd	2016-12-12
5	3.555	cde	2017-12-12
NULL	1.000	NULL	NULL
UPDATE test2 SET f1='7' WHERE f2+9.9 < (SELECT avg(m) FROM (SELECT 10+f2 m FROM test1 WHERE lnnvl(f1>4) GROUP BY f2 HAVING lnnvl(f2>=2) OR lnnvl(f2<=2) ORDER BY 1) t1 limit 1) AND lnnvl(f1 IS NULL);
SELECT * FROM test2;
f1	f2	f3	f4
7	1.555	abc	2015-12-12
7	2.555	bcd	2016-12-12
5	3.555	cde	2017-12-12
NULL	1.000	NULL	NULL
UPDATE test2 SET f1='6' WHERE lnnvl((SELECT max(f2) FROM test1 WHERE lnnvl(f1>2)) IS NULL);
SELECT * FROM test2;
f1	f2	f3	f4
6	1.555	abc	2015-12-12
6	2.555	bcd	2016-12-12
6	3.555	cde	2017-12-12
6	1.000	NULL	NULL
UPDATE test2 SET f1='7' WHERE lnnvl(f2+9.9<(SELECT avg(m)||12 FROM (SELECT 10+f2 m FROM test1 WHERE lnnvl(f1>4) GROUP BY f2 HAVING lnnvl(f2>=2) OR lnnvl(f2<=2) ORDER BY 1) t1 limit 1));
SELECT * FROM test2;
f1	f2	f3	f4
7	1.555	abc	2015-12-12
7	2.555	bcd	2016-12-12
7	3.555	cde	2017-12-12
7	1.000	NULL	NULL
#lnnvl-5-4	delete
#lnnvl-5-4-1	where
#lnnvl-5-4-1-1	直接嵌套被测函数
DELETE FROM test2 WHERE 1=1;
INSERT INTO test2 VALUES(1,1.555,'abc','20151212');
INSERT INTO test2 VALUES(2,2.555,'bcd','20161212');
INSERT INTO test2 VALUES(3,3.555,'cde','20171212');
INSERT INTO test2 VALUES(NULL,NULL,NULL,NULL);
DELETE FROM test2 WHERE lnnvl(lnnvl(f4>'20161212'));
SELECT * FROM test2;
f1	f2	f3	f4
1	1.555	abc	2015-12-12
2	2.555	bcd	2016-12-12
NULL	NULL	NULL	NULL
#lnnvl-5-4-1-2	嵌套包含被测函数的select语句
DELETE FROM test2 WHERE f3>(SELECT f3 FROM test1 WHERE lnnvl(f2>2) AND f3 IS NOT NULL);
SELECT * FROM test2;
f1	f2	f3	f4
1	1.555	abc	2015-12-12
NULL	NULL	NULL	NULL
INSERT INTO test2 VALUES(2,2.555,'bcd','20161212');
INSERT INTO test2 VALUES(3,3.555,'cde','20171212');
DELETE FROM test2 WHERE f3 BETWEEN (SELECT f3 FROM test1 WHERE lnnvl(f2>2) AND f3 IS NOT NULL) AND (SELECT max(f3) FROM test1 WHERE lnnvl(f2<2) AND f3 IS NOT NULL);
SELECT * FROM test2;
f1	f2	f3	f4
NULL	NULL	NULL	NULL
INSERT INTO test2 VALUES(1,1.555,'abc','20151212');
INSERT INTO test2 VALUES(2,2.555,'bcd','20161212');
INSERT INTO test2 VALUES(3,3.555,'cde','20171212');
DELETE FROM test2 WHERE f2+9.9 < (SELECT avg(m) FROM (SELECT 10+f2 m FROM test1 WHERE lnnvl(f1>4) GROUP BY f2 HAVING lnnvl(f2>=2) OR lnnvl(f2<=2) ORDER BY 1) t1 limit 1) AND lnnvl(f1 IS NULL);
SELECT * FROM test2;
f1	f2	f3	f4
NULL	NULL	NULL	NULL
3	3.555	cde	2017-12-12
DELETE FROM test2 WHERE lnnvl((SELECT max(f2) FROM test1 WHERE lnnvl(f1>2)) IS NULL);
SELECT * FROM test2;
f1	f2	f3	f4
INSERT INTO test2 VALUES(1,1.555,'abc','20151212');
INSERT INTO test2 VALUES(2,2.555,'bcd','20161212');
INSERT INTO test2 VALUES(3,3.555,'cde','20171212');
INSERT INTO test2 VALUES(NULL,NULL,NULL,NULL);
DELETE FROM test2 WHERE lnnvl(f2+9.9<(SELECT avg(m)+12 FROM (SELECT 10+f2 m FROM test1 WHERE lnnvl(f1>4) GROUP BY f2 HAVING lnnvl(f2>=2) OR lnnvl(f2<=2) ORDER BY 1) t1 limit 1));
SELECT * FROM test2;
f1	f2	f3	f4
1	1.555	abc	2015-12-12
2	2.555	bcd	2016-12-12
3	3.555	cde	2017-12-12
drop user 'yyl_lnnvl_mysql'@'%';
