drop user 'yyl_lnnvl_mysql'@'%';
create user 'yyl_lnnvl_mysql'@'%' IDENTIFIED BY 'yyl_lnnvl_mysql';
grant all on *.* to 'yyl_lnnvl_mysql'@'%' WITH GRANT OPTION;
#lnnvl-7	视图、约束、索引
#lnnvl-7-1	视图
#lnnvl-7-1-1	select
DROP TABLE test1;
CREATE TABLE test1(f1 int,f2 float,f3 varchar(5),f4 date);
INSERT INTO test1 VALUES(1,1.555,'abc','20151212');
INSERT INTO test1 VALUES(2,2.555,'bcd','20161212');
INSERT INTO test1 VALUES(3,3.555,'cde','20171212');
INSERT INTO test1 VALUES(NULL,NULL,NULL,NULL);
CREATE OR REPLACE VIEW v1 AS SELECT * FROM test1;
#select
SELECT lnnvl(f1<3),lnnvl(f2<3),lnnvl(f3>'a'),lnnvl(f4 IS NULL) FROM v1;
lnnvl(f1<3)	lnnvl(f2<3)	lnnvl(f3>'a')	lnnvl(f4 IS NULL)
0	0	0	1
0	0	0	1
1	1	0	1
1	1	1	0
#from
SELECT * FROM (SELECT * FROM v1 WHERE lnnvl(f1<3) AND lnnvl(f2<3) AND NOT lnnvl(f3='abc') OR lnnvl(f4 IS NULL)) t1 WHERE lnnvl(f1!=2) ORDER BY 2 desc;
f1	f2	f3	f4
2	2.555	bcd	2016-12-12
#where
SELECT * FROM v1 WHERE lnnvl(f1<3) AND lnnvl(f2<3) AND NOT lnnvl(f3='abc') OR lnnvl(f4 IS NOT NULL);
f1	f2	f3	f4
NULL	NULL	NULL	NULL
#having
SELECT f2,f3 FROM v1 WHERE lnnvl(f1>2.5) GROUP BY f2,f3 HAVING lnnvl(f3='abc') OR lnnvl(f3='bcd');
f2	f3
1.555	abc
2.555	bcd
NULL	NULL
#case when
SELECT (CASE WHEN lnnvl(f1>2) THEN f1 ELSE f1+1 END) FROM v1;
(CASE WHEN lnnvl(f1>2) THEN f1 ELSE f1+1 END)
1
2
4
NULL
SELECT (CASE WHEN lnnvl(f1 IS NULL) THEN f1 ELSE 2 END) FROM v1;
(CASE WHEN lnnvl(f1 IS NULL) THEN f1 ELSE 2 END)
1
2
3
2
SELECT (CASE lnnvl(f1 IS NULL) WHEN 1 THEN f1 WHEN NULL THEN 2 ELSE 3 END) FROM v1;
(CASE lnnvl(f1 IS NULL) WHEN 1 THEN f1 WHEN NULL THEN 2 ELSE 3 END)
1
2
3
3
#distinct
SELECT DISTINCT lnnvl(f1 IS NOT NULL) FROM v1;
lnnvl(f1 IS NOT NULL)
0
1
#lnnvl-7-1-2	insert
#values直接嵌套被测函数
DELETE FROM test1 WHERE 1=1;
INSERT INTO v1(f1) VALUES(lnnvl(1=1));
INSERT INTO v1(f2) VALUES(lnnvl(2.5!=4));
INSERT INTO v1(f3) VALUES(lnnvl('abf'>'a'));
INSERT INTO v1(f4) VALUES(lnnvl('20191212'!='20191212'));
ERROR 22007: Incorrect datetime value for column 'f4' at row 1
INSERT INTO v1 VALUES(lnnvl(1=1),lnnvl(2.5!=4),lnnvl('abf'>'a'),'20191212');
SELECT * FROM v1;
f1	f2	f3	f4
0	NULL	NULL	NULL
NULL	0	NULL	NULL
NULL	NULL	0	NULL
0	0	0	2019-12-12
#values嵌套包含被测函数的select语句
DELETE FROM test1 WHERE 1=1;
INSERT INTO test1 VALUES(1,1.555,'abc','20151212');
INSERT INTO test1 VALUES(2,2.555,'bcd','20161212');
INSERT INTO test1 VALUES(3,3.555,'cde','20171212');
INSERT INTO test1 VALUES(NULL,NULL,NULL,NULL);
DROP TABLE test2;
CREATE TABLE test2 AS SELECT * FROM test1 WHERE 1=0;
CREATE OR REPLACE VIEW v2 AS SELECT * FROM test2;
INSERT INTO v2(f1) VALUES((SELECT min(f1) FROM v1 WHERE lnnvl(f2 IS NULL)));
SELECT * FROM test2;
f1	f2	f3	f4
1	NULL	NULL	NULL
DELETE FROM test2 WHERE 1=1;
INSERT INTO v2(f3) VALUES((SELECT f1 FROM v1 WHERE lnnvl(f2 IS NULL) GROUP BY f1 HAVING lnnvl(f1<3)));
SELECT * FROM test2;
f1	f2	f3	f4
NULL	NULL	3	NULL
DELETE FROM test2 WHERE 1=1;
INSERT INTO v2(f4) VALUES((SELECT '20171212' FROM v1 WHERE lnnvl(f2 IS NULL) GROUP BY f1 HAVING lnnvl(f1<3)));
SELECT * FROM test2;
f1	f2	f3	f4
NULL	NULL	NULL	2017-12-12
DELETE FROM test2 WHERE 1=1;
INSERT INTO v2 VALUES((SELECT min(f1) FROM v1 WHERE lnnvl(f2 IS NULL)),NULL,(SELECT f1 FROM v1 WHERE lnnvl(f2 IS NULL) GROUP BY f1 HAVING lnnvl(f1<3)),(SELECT '20171212' FROM v1 WHERE lnnvl(f2 IS NULL) GROUP BY f1 HAVING lnnvl(f1<3)));
SELECT * FROM v2;
f1	f2	f3	f4
1	NULL	3	2017-12-12
#insert into ... 后直接跟包含被测函数的select语句
DELETE FROM test2 WHERE 1=1;
INSERT INTO v2 SELECT * FROM v1 WHERE lnnvl(f2 IS NULL);
SELECT * FROM test2;
f1	f2	f3	f4
1	1.555	abc	2015-12-12
2	2.555	bcd	2016-12-12
3	3.555	cde	2017-12-12
DELETE FROM test2 WHERE 1=1;
INSERT INTO v2(f2) SELECT f1 FROM v1 WHERE lnnvl(f2 IS NULL) GROUP BY f1 HAVING lnnvl(f1<3);
SELECT * FROM v2;
f1	f2	f3	f4
NULL	3	NULL	NULL
#lnnvl-7-1-3	update
#set直接嵌套被测函数
DELETE FROM test2 WHERE 1=1;
INSERT INTO test2 VALUES(1,1.555,'abc','20151212');
INSERT INTO test2 VALUES(2,2.555,'bcd','20161212');
INSERT INTO test2 VALUES(3,3.555,'cde','20171212');
INSERT INTO test2 VALUES(NULL,NULL,NULL,NULL);
UPDATE v2 SET f1=lnnvl(f1>2) WHERE f1 IS NOT NULL;
SELECT * FROM v2;
f1	f2	f3	f4
1	1.555	abc	2015-12-12
1	2.555	bcd	2016-12-12
0	3.555	cde	2017-12-12
NULL	NULL	NULL	NULL
#set嵌套包含被测函数的select语句
UPDATE v2 SET f1=(SELECT max(f2) FROM v1 WHERE lnnvl(f1>2)) WHERE f2 IS NOT NULL;
SELECT * FROM v2;
f1	f2	f3	f4
3	1.555	abc	2015-12-12
3	2.555	bcd	2016-12-12
3	3.555	cde	2017-12-12
NULL	NULL	NULL	NULL
UPDATE v2 SET f2=(SELECT avg(m) FROM (SELECT f2||'5.5544' m FROM v1 WHERE lnnvl(f1>2) GROUP BY f2 HAVING lnnvl(f2>=2) OR lnnvl(f2<=2) ORDER BY 1) t1 limit 1) WHERE f2 IS NULL;
SELECT * FROM v2;
f1	f2	f3	f4
3	1.555	abc	2015-12-12
3	2.555	bcd	2016-12-12
3	3.555	cde	2017-12-12
NULL	1	NULL	NULL
#where直接嵌套被测函数
UPDATE v2 SET f1='5' WHERE lnnvl(f3<'c') AND f1 IS NOT NULL;
SELECT * FROM v2;
f1	f2	f3	f4
3	1.555	abc	2015-12-12
3	2.555	bcd	2016-12-12
5	3.555	cde	2017-12-12
NULL	1	NULL	NULL
#where嵌套包含被测函数的select语句
UPDATE v2 SET f1='6' WHERE f2 = (SELECT max(f2) FROM v1 WHERE lnnvl(f1>2));
SELECT * FROM v2;
f1	f2	f3	f4
3	1.555	abc	2015-12-12
6	2.555	bcd	2016-12-12
5	3.555	cde	2017-12-12
NULL	1	NULL	NULL
UPDATE v2 SET f1='7' WHERE f2+9.9 < (SELECT avg(m) FROM (SELECT 10+f2 m FROM v1 WHERE lnnvl(f1>4) GROUP BY f2 HAVING lnnvl(f2>=2) OR lnnvl(f2<=2) ORDER BY 1) t1 limit 1) AND lnnvl(f1 IS NULL);
SELECT * FROM v2;
f1	f2	f3	f4
7	1.555	abc	2015-12-12
7	2.555	bcd	2016-12-12
5	3.555	cde	2017-12-12
NULL	1	NULL	NULL
UPDATE v2 SET f1='6' WHERE lnnvl((SELECT max(f2) FROM v1 WHERE lnnvl(f1>2)) IS NULL);
SELECT * FROM v2;
f1	f2	f3	f4
6	1.555	abc	2015-12-12
6	2.555	bcd	2016-12-12
6	3.555	cde	2017-12-12
6	1	NULL	NULL
UPDATE v2 SET f1='7' WHERE lnnvl(f2+9.9<(SELECT avg(m)||12 FROM (SELECT 10+f2 m FROM v1 WHERE lnnvl(f1>4) GROUP BY f2 HAVING lnnvl(f2>=2) OR lnnvl(f2<=2) ORDER BY 1) t1 limit 1));
SELECT * FROM v2;
f1	f2	f3	f4
7	1.555	abc	2015-12-12
7	2.555	bcd	2016-12-12
7	3.555	cde	2017-12-12
7	1	NULL	NULL
#lnnvl-7-1-4	delete
#where直接嵌套被测函数
DELETE FROM test2 WHERE 1=1;
INSERT INTO test2 VALUES(1,1.555,'abc','20151212');
INSERT INTO test2 VALUES(2,2.555,'bcd','20161212');
INSERT INTO test2 VALUES(3,3.555,'cde','20171212');
INSERT INTO test2 VALUES(NULL,NULL,NULL,NULL);
DELETE FROM v2 WHERE lnnvl(lnnvl(f4>'20161212'));
SELECT * FROM v2;
f1	f2	f3	f4
1	1.555	abc	2015-12-12
2	2.555	bcd	2016-12-12
NULL	NULL	NULL	NULL
#where嵌套包含被测函数的select语句
DELETE FROM v2 WHERE f3>(SELECT f3 FROM v1 WHERE lnnvl(f2>2) AND f3 IS NOT NULL);
SELECT * FROM v2;
f1	f2	f3	f4
1	1.555	abc	2015-12-12
NULL	NULL	NULL	NULL
INSERT INTO test2 VALUES(2,2.555,'bcd','20161212');
INSERT INTO test2 VALUES(3,3.555,'cde','20171212');
DELETE FROM v2 WHERE f3 BETWEEN (SELECT f3 FROM v1 WHERE lnnvl(f2>2) AND f3 IS NOT NULL) AND (SELECT max(f3) FROM v1 WHERE lnnvl(f2<2) AND f3 IS NOT NULL);
SELECT * FROM v2;
f1	f2	f3	f4
NULL	NULL	NULL	NULL
INSERT INTO test2 VALUES(1,1.555,'abc','20151212');
INSERT INTO test2 VALUES(2,2.555,'bcd','20161212');
INSERT INTO test2 VALUES(3,3.555,'cde','20171212');
DELETE FROM v2 WHERE f2+9.9 < (SELECT avg(m) FROM (SELECT 10+f2 m FROM v1 WHERE lnnvl(f1>4) GROUP BY f2 HAVING lnnvl(f2>=2) OR lnnvl(f2<=2) ORDER BY 1) t1 limit 1) AND lnnvl(f1 IS NULL);
SELECT * FROM v2;
f1	f2	f3	f4
NULL	NULL	NULL	NULL
3	3.555	cde	2017-12-12
DELETE FROM v2 WHERE lnnvl((SELECT max(f2) FROM v1 WHERE lnnvl(f1>2)) IS NULL);
SELECT * FROM v2;
f1	f2	f3	f4
INSERT INTO test2 VALUES(1,1.555,'abc','20151212');
INSERT INTO test2 VALUES(2,2.555,'bcd','20161212');
INSERT INTO test2 VALUES(3,3.555,'cde','20171212');
INSERT INTO test2 VALUES(NULL,NULL,NULL,NULL);
DELETE FROM v2 WHERE lnnvl(f2+9.9<(SELECT avg(m)+12 FROM (SELECT 10+f2 m FROM v1 WHERE lnnvl(f1>4) GROUP BY f2 HAVING lnnvl(f2>=2) OR lnnvl(f2<=2) ORDER BY 1) t1 limit 1));
SELECT * FROM v2;
f1	f2	f3	f4
1	1.555	abc	2015-12-12
2	2.555	bcd	2016-12-12
3	3.555	cde	2017-12-12
#lnnvl-7-2	约束：存在约束时进行dml操作
DROP TABLE test1;
CREATE TABLE test1(f1 decimal(5,1) UNIQUE, f2 decimal(5,1) UNIQUE);
INSERT INTO test1(f1) SELECT 5 FROM dual WHERE lnnvl(1!=1);
SELECT * FROM test1;
f1	f2
5.0	NULL
INSERT INTO test1(f1) SELECT 1 FROM dual WHERE lnnvl(1!=1);
INSERT INTO test1(f1) SELECT 1 FROM dual WHERE lnnvl(1!=1);
ERROR 23000: Duplicate entry '1.0' for key 'f1'
UPDATE test1 SET f1 = (SELECT 6 FROM dual WHERE lnnvl(1!=1)) WHERE lnnvl(f2 IS NOT NULL);
ERROR 23000: Duplicate entry '6.0' for key 'f1'
DELETE FROM test1 WHERE f1=1;
UPDATE test1 SET f1 = (SELECT 11 FROM dual WHERE lnnvl(1!=1)) WHERE lnnvl(f2 IS NOT NULL);
SELECT * FROM test1;
f1	f2
11.0	NULL
SELECT * FROM test1 WHERE lnnvl(f2=3);
f1	f2
11.0	NULL
DELETE FROM test1 WHERE lnnvl(f2=3);
SELECT * FROM test1;
f1	f2
#lnnvl-7-3	索引：存在索引时进行dml操作
DROP TABLE test1;
CREATE TABLE test1(f1 decimal(5,1), f2 decimal(5,1));
CREATE INDEX index_test1 ON test1(f1);
CREATE INDEX index_test2 ON test1(f2);
INSERT INTO test1(f1) SELECT 5 FROM dual WHERE lnnvl(1!=1);
SELECT * FROM test1;
f1	f2
5.0	NULL
UPDATE test1 SET f1 = (SELECT 6 FROM dual WHERE lnnvl(1!=1)) WHERE lnnvl(f2 IS NOT NULL);
SELECT * FROM test1;
f1	f2
6.0	NULL
SELECT * FROM test1 WHERE lnnvl(f2=3);
f1	f2
6.0	NULL
DELETE FROM test1 WHERE lnnvl(f2=3);
SELECT * FROM test1;
f1	f2
drop user 'yyl_lnnvl_mysql'@'%';
