drop user 'zc_subquery_mysql'@'%';
create user 'zc_subquery_mysql'@'%' IDENTIFIED BY 'zc_subquery_mysql';
grant all on *.* to 'zc_subquery_mysql'@'%' WITH GRANT OPTION;
drop TABLE if EXISTS A;
Warnings:
Note	1051	Unknown table 'test.a'
CREATE TABLE A(A_0 INT,A_1 INT,A_2 VARCHAR(20),A_3 FLOAT,A_4 DATE);
INSERT INTO A VALUES(1,1,'A',1.23,'1999-09-09'),(2,-1,'nb',3.21,'1111-11-11'),(3,0,'#',6666.6666,'11-11-11'),(4,NULL,NULL,NULL,NULL);
INSERT INTO A(A_0,A_1) VALUES (5,EXPORT_SET(1,1,1,1,5));
SELECT A_1 FROM A ;
A_1
1
-1
0
NULL
111111111
UPDATE A SET A_1=EXPORT_SET(4,6,5,2,5) WHERE A_0=5;
SELECT A_1 FROM A ;
A_1
1
-1
0
NULL
525262525
DELETE FROM A WHERE A_1=EXPORT_SET(4,6,5,2,5);
SELECT A_1 FROM A;
A_1
1
-1
0
NULL
INSERT INTO A(A_0,A_1) VALUES (5,(SELECT EXPORT_SET(1,1,1,1,5) FROM DUAL));
SELECT A_1 FROM A ;
A_1
1
-1
0
NULL
111111111
UPDATE A SET A_1=(SELECT EXPORT_SET(4,6,5,2,5) FROM DUAL) WHERE A_0=(SELECT EXPORT_SET(1,5,5,5,1) FROM DUAL);
SELECT A_1 FROM A ;
A_1
1
-1
0
NULL
525262525
DELETE FROM A WHERE A_1=(SELECT EXPORT_SET(4,6,5,2,5) FROM DUAL);
SELECT A_1 FROM A ;
A_1
1
-1
0
NULL
INSERT INTO A(A_0,A_2) VALUES (5,EXPORT_SET(6,'a','b',1,5));
SELECT A_2 FROM A ;
A_2
A
nb
#
NULL
b1a1a1b1b
UPDATE A SET A_2=EXPORT_SET(7,'abc','xyz',' ',5) WHERE A_0=5;
SELECT A_2 FROM A ;
A_2
A
nb
#
NULL
abc abc abc xyz xyz
DELETE FROM A WHERE A_2=EXPORT_SET(7,'abc','xyz',' ',5);
SELECT A_2 FROM A;
A_2
A
nb
#
NULL
INSERT INTO A(A_0,A_2) VALUES (5,(SELECT EXPORT_SET(6,'a','b',1,5) FROM DUAL));
SELECT A_2 FROM A ;
A_2
A
nb
#
NULL
b1a1a1b1b
UPDATE A SET A_2=(SELECT EXPORT_SET(7,'abc','xyz',' ',5) FROM DUAL) WHERE A_0=(SELECT EXPORT_SET(1,5,5,5,1) FROM DUAL);
SELECT A_2 FROM A ;
A_2
A
nb
#
NULL
abc abc abc xyz xyz
DELETE FROM A WHERE A_2=(SELECT EXPORT_SET(7,'abc','xyz',' ',5) FROM DUAL);
SELECT A_2 FROM A ;
A_2
A
nb
#
NULL
INSERT INTO A(A_0,A_4) VALUES (5,EXPORT_SET(6,1,12,'-',3));
SELECT A_4 FROM A ;
A_4
1999-09-09
1111-11-11
2011-11-11
NULL
2012-01-01
UPDATE A SET A_4=EXPORT_SET(2.2,12,12,'-',3) WHERE A_0=5;
SELECT A_4 FROM A ;
A_4
1999-09-09
1111-11-11
2011-11-11
NULL
2012-12-12
DELETE FROM A WHERE A_4=EXPORT_SET(2.2,12,12,'-',3);
SELECT A_4 FROM A;
A_4
1999-09-09
1111-11-11
2011-11-11
NULL
INSERT INTO A(A_0,A_4) VALUES (5,(SELECT EXPORT_SET(6,1,12,'-',3) FROM DUAL));
SELECT A_4 FROM A ;
A_4
1999-09-09
1111-11-11
2011-11-11
NULL
2012-01-01
UPDATE A SET A_4=(SELECT EXPORT_SET(2.2,12,12,'-',3) FROM DUAL) WHERE A_0=(SELECT EXPORT_SET(1,5,5,5,1) FROM DUAL);
SELECT A_4 FROM A ;
A_4
1999-09-09
1111-11-11
2011-11-11
NULL
2012-12-12
DELETE FROM A WHERE A_4=(SELECT EXPORT_SET(2.2,12,12,'-',3) FROM DUAL);
SELECT A_4 FROM A ;
A_4
1999-09-09
1111-11-11
2011-11-11
NULL
drop TABLE if EXISTS A;
drop user 'zc_subquery_mysql'@'%';
