drop user 'zc_subquery_mysql'@'%';
create user 'zc_subquery_mysql'@'%' IDENTIFIED BY 'zc_subquery_mysql';
grant all on *.* to 'zc_subquery_mysql'@'%' WITH GRANT OPTION;
drop TABLE if EXISTS A;
Warnings:
Note	1051	Unknown table 'test.a'
CREATE TABLE A(A_0 INT,A_1 BIGINT,A_2 VARCHAR(39),A_3 VARBINARY(32));
INSERT INTO A VALUES(1,0,'222.222.222.222','0A000509'),(2,1,'::','0000'),(3,4294967040,'::192.168.111.222','FFFF'),(4,-1,'::FFFF:196.126.99.88','-FF'),
(5,167773449,'FFFF:FFFF:FFFF:FFFF:FFFF:FFFF:FFFF:FFFF','FFFFFFFFFFFFFFFFFFFFFFFFFFFFFFFF'),(6,NULL,NULL,NULL);
SELECT * FROM A ;
A_0	A_1	A_2	A_3
1	0	222.222.222.222	0A000509
2	1	::	0000
3	4294967040	::192.168.111.222	FFFF
4	-1	::FFFF:196.126.99.88	-FF
5	167773449	FFFF:FFFF:FFFF:FFFF:FFFF:FFFF:FFFF:FFFF	FFFFFFFFFFFFFFFFFFFFFFFFFFFFFFFF
6	NULL	NULL	NULL
INSERT INTO A(A_0,A_1) VALUES (7,INET_ATON('255.255.255.255'));
SELECT A_1 FROM A WHERE A_0=7;
A_1
4294967295
UPDATE A SET A_1=INET_ATON('000.000.000.250') WHERE A_0=7;
SELECT A_1 FROM A WHERE A_0=7;
A_1
250
DELETE FROM A WHERE A_1=INET_ATON('000.000.000.250');
SELECT * FROM A;
A_0	A_1	A_2	A_3
1	0	222.222.222.222	0A000509
2	1	::	0000
3	4294967040	::192.168.111.222	FFFF
4	-1	::FFFF:196.126.99.88	-FF
5	167773449	FFFF:FFFF:FFFF:FFFF:FFFF:FFFF:FFFF:FFFF	FFFFFFFFFFFFFFFFFFFFFFFFFFFFFFFF
6	NULL	NULL	NULL
INSERT INTO A(A_0,A_1) VALUES (7,(SELECT INET_ATON('255.255.255.255') FROM DUAL));
SELECT A_1 FROM A WHERE A_0=7;
A_1
4294967295
UPDATE A SET A_1=(SELECT INET_ATON('000.000.000.250') FROM DUAL) WHERE A_0=7;
SELECT A_1 FROM A WHERE A_0=7;
A_1
250
DELETE FROM A WHERE A_1=(SELECT INET_ATON('000.000.000.250') FROM DUAL);
SELECT * FROM A ;
A_0	A_1	A_2	A_3
1	0	222.222.222.222	0A000509
2	1	::	0000
3	4294967040	::192.168.111.222	FFFF
4	-1	::FFFF:196.126.99.88	-FF
5	167773449	FFFF:FFFF:FFFF:FFFF:FFFF:FFFF:FFFF:FFFF	FFFFFFFFFFFFFFFFFFFFFFFFFFFFFFFF
6	NULL	NULL	NULL
INSERT INTO A(A_0,A_3) VALUES (7,HEX(INET6_ATON('fdfe::5a55:caff:fefa:9089')));
SELECT A_3 FROM A WHERE A_0=7;
A_3
FDFE0000000000005A55CAFFFEFA9089
UPDATE A SET A_3=HEX(INET6_ATON('::1111')) WHERE A_0=7;
SELECT A_3 FROM A WHERE A_0=7;
A_3
00000000000000000000000000001111
DELETE FROM A WHERE A_3=HEX(INET6_ATON('::1111'));
SELECT * FROM A;
A_0	A_1	A_2	A_3
1	0	222.222.222.222	0A000509
2	1	::	0000
3	4294967040	::192.168.111.222	FFFF
4	-1	::FFFF:196.126.99.88	-FF
5	167773449	FFFF:FFFF:FFFF:FFFF:FFFF:FFFF:FFFF:FFFF	FFFFFFFFFFFFFFFFFFFFFFFFFFFFFFFF
6	NULL	NULL	NULL
INSERT INTO A(A_0,A_3) VALUES (7,(SELECT HEX(INET6_ATON('fdfe::5a55:caff:fefa:9089')) FROM DUAL));
SELECT A_3 FROM A WHERE A_0=7;
A_3
FDFE0000000000005A55CAFFFEFA9089
UPDATE A SET A_3=(SELECT HEX(INET6_ATON('::1111')) FROM DUAL) WHERE A_0=7;
SELECT A_3 FROM A WHERE A_0=7;
A_3
00000000000000000000000000001111
DELETE FROM A WHERE A_3=(SELECT HEX(INET6_ATON('::1111')) FROM DUAL);
SELECT * FROM A ;
A_0	A_1	A_2	A_3
1	0	222.222.222.222	0A000509
2	1	::	0000
3	4294967040	::192.168.111.222	FFFF
4	-1	::FFFF:196.126.99.88	-FF
5	167773449	FFFF:FFFF:FFFF:FFFF:FFFF:FFFF:FFFF:FFFF	FFFFFFFFFFFFFFFFFFFFFFFFFFFFFFFF
6	NULL	NULL	NULL
INSERT INTO A(A_0,A_2) VALUES (7,INET_NTOA(4294967040));
SELECT A_2 FROM A WHERE A_0=7;
A_2
255.255.255.0
UPDATE A SET A_2=INET_NTOA('4294967040') WHERE A_0=7;
SELECT A_2 FROM A WHERE A_0=7;
A_2
255.255.255.0
DELETE FROM A WHERE A_2=INET_NTOA('4294967040');
SELECT * FROM A;
A_0	A_1	A_2	A_3
1	0	222.222.222.222	0A000509
2	1	::	0000
3	4294967040	::192.168.111.222	FFFF
4	-1	::FFFF:196.126.99.88	-FF
5	167773449	FFFF:FFFF:FFFF:FFFF:FFFF:FFFF:FFFF:FFFF	FFFFFFFFFFFFFFFFFFFFFFFFFFFFFFFF
6	NULL	NULL	NULL
INSERT INTO A(A_0,A_2) VALUES (7,(SELECT INET_NTOA(4294967040) FROM DUAL));
SELECT A_2 FROM A WHERE A_0=7;
A_2
255.255.255.0
UPDATE A SET A_2=(SELECT INET_NTOA('4294967040') FROM DUAL) WHERE A_0=7;
SELECT A_2 FROM A WHERE A_0=7;
A_2
255.255.255.0
DELETE FROM A WHERE A_2=(SELECT INET_NTOA('4294967040') FROM DUAL);
SELECT * FROM A ;
A_0	A_1	A_2	A_3
1	0	222.222.222.222	0A000509
2	1	::	0000
3	4294967040	::192.168.111.222	FFFF
4	-1	::FFFF:196.126.99.88	-FF
5	167773449	FFFF:FFFF:FFFF:FFFF:FFFF:FFFF:FFFF:FFFF	FFFFFFFFFFFFFFFFFFFFFFFFFFFFFFFF
6	NULL	NULL	NULL
INSERT INTO A(A_0,A_2) VALUES (7,INET6_NTOA(UNHEX('FDFE0000000000005A55CAFFFEFA9089')));
SELECT A_2 FROM A WHERE A_0=7;
A_2
fdfe::5a55:caff:fefa:9089
UPDATE A SET A_2=INET6_NTOA(UNHEX('FFFFFFFFFFFFFFFFFFFFFFFFFFFFFFFF')) WHERE A_0=7;
SELECT A_2 FROM A WHERE A_0=7;
A_2
ffff:ffff:ffff:ffff:ffff:ffff:ffff:ffff
DELETE FROM A WHERE A_2=INET6_NTOA(UNHEX('FFFFFFFFFFFFFFFFFFFFFFFFFFFFFFFF'));
SELECT * FROM A;
A_0	A_1	A_2	A_3
1	0	222.222.222.222	0A000509
2	1	::	0000
3	4294967040	::192.168.111.222	FFFF
4	-1	::FFFF:196.126.99.88	-FF
6	NULL	NULL	NULL
INSERT INTO A(A_0,A_2) VALUES (7,(SELECT INET6_NTOA(UNHEX('FDFE0000000000005A55CAFFFEFA9089')) FROM DUAL));
SELECT A_2 FROM A WHERE A_0=7;
A_2
fdfe::5a55:caff:fefa:9089
UPDATE A SET A_2=(SELECT INET6_NTOA(UNHEX('FFFFFFFFFFFFFFFFFFFFFFFFFFFFFFFF')) FROM DUAL) WHERE A_0=7;
SELECT A_2 FROM A WHERE A_0=7;
A_2
ffff:ffff:ffff:ffff:ffff:ffff:ffff:ffff
DELETE FROM A WHERE A_2=(SELECT INET6_NTOA(UNHEX('FFFFFFFFFFFFFFFFFFFFFFFFFFFFFFFF')) FROM DUAL);
SELECT * FROM A ;
A_0	A_1	A_2	A_3
1	0	222.222.222.222	0A000509
2	1	::	0000
3	4294967040	::192.168.111.222	FFFF
4	-1	::FFFF:196.126.99.88	-FF
6	NULL	NULL	NULL
INSERT INTO A(A_0,A_1) VALUES (7,IS_IPV4('196.126.99.88'));
SELECT A_1 FROM A WHERE A_0=7;
A_1
1
UPDATE A SET A_1=IS_IPV4('196') WHERE A_0=7;
SELECT A_1 FROM A WHERE A_0=7;
A_1
0
DELETE FROM A WHERE A_1=IS_IPV4('196');
SELECT * FROM A;
A_0	A_1	A_2	A_3
2	1	::	0000
3	4294967040	::192.168.111.222	FFFF
4	-1	::FFFF:196.126.99.88	-FF
6	NULL	NULL	NULL
INSERT INTO A(A_0,A_1) VALUES (7,(SELECT IS_IPV4('196.126.99.88') FROM DUAL));
SELECT A_1 FROM A WHERE A_0=7;
A_1
1
UPDATE A SET A_1=(SELECT IS_IPV4('196') FROM DUAL) WHERE A_0=7;
SELECT A_1 FROM A WHERE A_0=7;
A_1
0
DELETE FROM A WHERE A_1=(SELECT IS_IPV4('196') FROM DUAL);
SELECT * FROM A ;
A_0	A_1	A_2	A_3
2	1	::	0000
3	4294967040	::192.168.111.222	FFFF
4	-1	::FFFF:196.126.99.88	-FF
6	NULL	NULL	NULL
INSERT INTO A(A_0,A_1) VALUES (7,IS_IPV6('::196.126.99.88'));
SELECT A_1 FROM A WHERE A_0=7;
A_1
1
UPDATE A SET A_1=IS_IPV6('196') WHERE A_0=7;
SELECT A_1 FROM A WHERE A_0=7;
A_1
0
DELETE FROM A WHERE A_1=IS_IPV6('196');
SELECT * FROM A;
A_0	A_1	A_2	A_3
2	1	::	0000
3	4294967040	::192.168.111.222	FFFF
4	-1	::FFFF:196.126.99.88	-FF
6	NULL	NULL	NULL
INSERT INTO A(A_0,A_1) VALUES (7,(SELECT IS_IPV6('196') FROM DUAL));
SELECT A_1 FROM A WHERE A_0=7;
A_1
0
UPDATE A SET A_1=(SELECT IS_IPV6('::196.126.99.88') FROM DUAL) WHERE A_0=7;
SELECT A_1 FROM A WHERE A_0=7;
A_1
1
DELETE FROM A WHERE A_1=(SELECT IS_IPV6('::196.126.99.88') FROM DUAL);
SELECT * FROM A ;
A_0	A_1	A_2	A_3
3	4294967040	::192.168.111.222	FFFF
4	-1	::FFFF:196.126.99.88	-FF
6	NULL	NULL	NULL
INSERT INTO A(A_0,A_1) VALUES (7,IS_IPV4_MAPPED(INET6_ATON('::196.126.99.88')));
SELECT A_1 FROM A WHERE A_0=7;
A_1
0
UPDATE A SET A_1=IS_IPV4_MAPPED(INET6_ATON('::FFFF:196.126.99.88')) WHERE A_0=7;
SELECT A_1 FROM A WHERE A_0=7;
A_1
1
DELETE FROM A WHERE A_1=IS_IPV4_MAPPED(INET6_ATON('::FFFF:196.126.99.88'));
SELECT * FROM A;
A_0	A_1	A_2	A_3
3	4294967040	::192.168.111.222	FFFF
4	-1	::FFFF:196.126.99.88	-FF
6	NULL	NULL	NULL
INSERT INTO A(A_0,A_1) VALUES (7,(SELECT IS_IPV4_MAPPED(INET6_ATON('::FFFF:196.126.99.88')) FROM DUAL));
SELECT A_1 FROM A WHERE A_0=7;
A_1
1
UPDATE A SET A_1=(SELECT IS_IPV4_MAPPED(INET6_ATON('::196.126.99.88')) FROM DUAL) WHERE A_0=7;
SELECT A_1 FROM A WHERE A_0=7;
A_1
0
DELETE FROM A WHERE A_1=(SELECT IS_IPV4_MAPPED(INET6_ATON('::196.126.99.88')) FROM DUAL);
SELECT * FROM A ;
A_0	A_1	A_2	A_3
3	4294967040	::192.168.111.222	FFFF
4	-1	::FFFF:196.126.99.88	-FF
6	NULL	NULL	NULL
INSERT INTO A(A_0,A_1) VALUES (7,IS_IPV4_COMPAT(INET6_ATON('::196.126.99.88')));
SELECT A_1 FROM A WHERE A_0=7;
A_1
1
UPDATE A SET A_1=IS_IPV4_COMPAT(INET6_ATON('::FFFF:196.126.99.88')) WHERE A_0=7;
SELECT A_1 FROM A WHERE A_0=7;
A_1
0
DELETE FROM A WHERE A_1=IS_IPV4_COMPAT(INET6_ATON('::FFFF:196.126.99.88'));
SELECT * FROM A;
A_0	A_1	A_2	A_3
3	4294967040	::192.168.111.222	FFFF
4	-1	::FFFF:196.126.99.88	-FF
6	NULL	NULL	NULL
INSERT INTO A(A_0,A_1) VALUES (7,(SELECT IS_IPV4_COMPAT(INET6_ATON('::FFFF:196.126.99.88')) FROM DUAL));
SELECT A_1 FROM A WHERE A_0=7;
A_1
0
UPDATE A SET A_1=(SELECT IS_IPV4_COMPAT(INET6_ATON('::196.126.99.88')) FROM DUAL) WHERE A_0=7;
SELECT A_1 FROM A WHERE A_0=7;
A_1
1
DELETE FROM A WHERE A_1=(SELECT IS_IPV4_COMPAT(INET6_ATON('::196.126.99.88')) FROM DUAL);
SELECT * FROM A ;
A_0	A_1	A_2	A_3
3	4294967040	::192.168.111.222	FFFF
4	-1	::FFFF:196.126.99.88	-FF
6	NULL	NULL	NULL
drop TABLE if EXISTS A;
drop user 'zc_subquery_mysql'@'%';
