result_format: 4
drop user WCY@'%';
create user WCY identified by 'WCY';
grant all on *.* to WCY WITH GRANT OPTION;





DROP TABLE W0CASE;
DROP TABLE W1CASE;
#该文档下放置，load对应索引和约束的表，验证对应索引，约束的情况下，load的执行情况
#obmysql_mysql_load_1_3_4
#obmysql_mysql_load_1_3_4_1
#主键
CREATE TABLE W0CASE ( W0_TEST0 INT PRIMARY KEY , W0_TEST1 DATE , W0_TEST2 VARCHAR(100) );
LOAD DATA INFILE 'data_for_mysqltest_loaddata/Load_Table_IC_mysql/A0.txt' INTO TABLE W0CASE FIELDS TERMINATED BY ',' LINES TERMINATED BY '/' ;
SELECT * FROM W0CASE ORDER BY W0_TEST0 DESC , W0_TEST1 DESC , W0_TEST2 DESC ;
+----------+------------+----------+
| W0_TEST0 | W0_TEST1   | W0_TEST2 |
+----------+------------+----------+
       |
       |
       |
       |
|        1 | 2020-02-20 | A
|        2 | 2020-02-21 | B
|        3 | 2020-02-22 | C
|        4 | 2020-02-23 | D
+----------+------------+----------+
LOAD DATA INFILE 'data_for_mysqltest_loaddata/Load_Table_IC_mysql/A1.txt' INTO TABLE W0CASE FIELDS TERMINATED BY ',' LINES TERMINATED BY '/' ;
ERROR 23000: Duplicated primary key
DROP TABLE W0CASE;

CREATE TABLE W0CASE ( W0_TEST0 INT  , W0_TEST1 DATE PRIMARY KEY , W0_TEST2 VARCHAR(100) );
LOAD DATA INFILE 'data_for_mysqltest_loaddata/Load_Table_IC_mysql/A0.txt' INTO TABLE W0CASE FIELDS TERMINATED BY ',' LINES TERMINATED BY '/' ;
SELECT * FROM W0CASE ORDER BY W0_TEST0 DESC , W0_TEST1 DESC , W0_TEST2 DESC ;
+----------+------------+----------+
| W0_TEST0 | W0_TEST1   | W0_TEST2 |
+----------+------------+----------+
       |
       |
       |
       |
|        1 | 2020-02-20 | A
|        2 | 2020-02-21 | B
|        3 | 2020-02-22 | C
|        4 | 2020-02-23 | D
+----------+------------+----------+
LOAD DATA INFILE 'data_for_mysqltest_loaddata/Load_Table_IC_mysql/A1.txt' INTO TABLE W0CASE FIELDS TERMINATED BY ',' LINES TERMINATED BY '/' ;
ERROR 23000: Duplicated primary key
DROP TABLE W0CASE;

CREATE TABLE W0CASE ( W0_TEST0 INT  , W0_TEST1 DATE , W0_TEST2 VARCHAR(100) PRIMARY KEY );
LOAD DATA INFILE 'data_for_mysqltest_loaddata/Load_Table_IC_mysql/A0.txt' INTO TABLE W0CASE FIELDS TERMINATED BY ',' LINES TERMINATED BY '/' ;
SELECT * FROM W0CASE ORDER BY W0_TEST0 DESC , W0_TEST1 DESC , W0_TEST2 DESC ;
+----------+------------+----------+
| W0_TEST0 | W0_TEST1   | W0_TEST2 |
+----------+------------+----------+
       |
       |
       |
       |
|        1 | 2020-02-20 | A
|        2 | 2020-02-21 | B
|        3 | 2020-02-22 | C
|        4 | 2020-02-23 | D
+----------+------------+----------+
LOAD DATA INFILE 'data_for_mysqltest_loaddata/Load_Table_IC_mysql/A1.txt' INTO TABLE W0CASE FIELDS TERMINATED BY ',' LINES TERMINATED BY '/' ;
ERROR 23000: Duplicated primary key
DROP TABLE W0CASE;

CREATE TABLE W0CASE ( W0_TEST0 VARCHAR(100)  , W0_TEST1 DATE , W0_TEST2 VARCHAR(100) PRIMARY KEY );
LOAD DATA INFILE 'data_for_mysqltest_loaddata/Load_Table_IC_mysql/A2.txt' INTO TABLE W0CASE FIELDS TERMINATED BY ',' LINES TERMINATED BY '/' ;
SELECT * FROM W0CASE ORDER BY W0_TEST0 DESC , W0_TEST1 DESC , W0_TEST2 DESC ;
+----------+------------+----------+
| W0_TEST0 | W0_TEST1   | W0_TEST2 |
+----------+------------+----------+
       |
2       | 2020-02-21 | B        |
3       | 2020-02-22 | C        |
4       | 2020-02-23 | D
4       | 2020-02-23 | D        |
| 
| 
| 
| 
| 1        | 2020-02-20 | A        |
+----------+------------+----------+
DROP TABLE W0CASE;

CREATE TABLE W0CASE ( W0_TEST0 VARCHAR(100)  , W0_TEST1 DATE , W0_TEST2 VARCHAR(100) , PRIMARY KEY (W0_TEST0,W0_TEST1,W0_TEST2) );
LOAD DATA INFILE 'data_for_mysqltest_loaddata/Load_Table_IC_mysql/A2.txt' INTO TABLE W0CASE FIELDS TERMINATED BY ',' LINES TERMINATED BY '/' ;
SELECT * FROM W0CASE ORDER BY W0_TEST0 DESC , W0_TEST1 DESC , W0_TEST2 DESC ;
+----------+------------+----------+
| W0_TEST0 | W0_TEST1   | W0_TEST2 |
+----------+------------+----------+
       |
2       | 2020-02-21 | B        |
3       | 2020-02-22 | C        |
4       | 2020-02-23 | D
4       | 2020-02-23 | D        |
| 
| 
| 
| 
| 1        | 2020-02-20 | A        |
+----------+------------+----------+
DROP TABLE W0CASE;

CREATE TABLE W0CASE ( W0_TEST0 INT , W0_TEST1 DATE , W0_TEST2 VARCHAR(100) , PRIMARY KEY (W0_TEST0,W0_TEST1,W0_TEST2) );
LOAD DATA INFILE 'data_for_mysqltest_loaddata/Load_Table_IC_mysql/A3.txt' REPLACE INTO TABLE W0CASE FIELDS TERMINATED BY ','  ;
SELECT * FROM W0CASE ORDER BY W0_TEST0 DESC , W0_TEST1 DESC , W0_TEST2 DESC ;
+----------+------------+----------+
| W0_TEST0 | W0_TEST1   | W0_TEST2 |
+----------+------------+----------+
|        1 | 2020-02-20 | A        |
|        2 | 2020-02-21 | B        |
|        3 | 2020-02-22 | C        |
|        4 | 2020-02-23 | D        |
+----------+------------+----------+
DROP TABLE W0CASE;

CREATE TABLE W0CASE ( W0_TEST0 INT , W0_TEST1 DATE , W0_TEST2 VARCHAR(100) , PRIMARY KEY (W0_TEST0,W0_TEST1,W0_TEST2) );
LOAD DATA INFILE 'data_for_mysqltest_loaddata/Load_Table_IC_mysql/A4.txt' REPLACE INTO TABLE W0CASE FIELDS TERMINATED BY ',' ENCLOSED BY '\'' ;
SELECT * FROM W0CASE ORDER BY W0_TEST0 DESC , W0_TEST1 DESC , W0_TEST2 DESC ;
+----------+------------+----------+
| W0_TEST0 | W0_TEST1   | W0_TEST2 |
+----------+------------+----------+
|        1 | 2020-02-20 | A        |
|        2 | 2020-02-21 | B        |
|        3 | 2020-02-22 | C        |
|        4 | 2020-02-23 | D        |
+----------+------------+----------+
DROP TABLE W0CASE;

CREATE TABLE W0CASE ( W0_TEST0 INT , W0_TEST1 DATE , W0_TEST2 VARCHAR(100) , PRIMARY KEY (W0_TEST0,W0_TEST1,W0_TEST2) );
LOAD DATA INFILE 'data_for_mysqltest_loaddata/Load_Table_IC_mysql/A5.txt' INTO TABLE W0CASE COLUMNS TERMINATED BY ',' ENCLOSED BY '\'' ESCAPED BY '\\' ;
SELECT * FROM W0CASE ORDER BY W0_TEST0 DESC , W0_TEST1 DESC , W0_TEST2 DESC ;
+----------+------------+----------+
| W0_TEST0 | W0_TEST1   | W0_TEST2 |
+----------+------------+----------+
       |
|        1 | 2020-02-20 | A        |
|        2 | 2020-02-21 | B        |
|        3 | 2020-02-22 | C        |
|        4 | 2020-02-23 | D
|        4 | 2020-02-23 | D        |
+----------+------------+----------+
DROP TABLE W0CASE;

CREATE TABLE W0CASE ( W0_TEST0 INT , W0_TEST1 DATE , W0_TEST2 VARCHAR(100) , PRIMARY KEY (W0_TEST0,W0_TEST1,W0_TEST2) );
LOAD DATA INFILE 'data_for_mysqltest_loaddata/Load_Table_IC_mysql/A5.txt' INTO TABLE W0CASE COLUMNS TERMINATED BY ',' ENCLOSED BY '\'' ESCAPED BY '\\' IGNORE 1 LINES ;
SELECT * FROM W0CASE ORDER BY W0_TEST0 DESC , W0_TEST1 DESC , W0_TEST2 DESC ;
+----------+------------+----------+
| W0_TEST0 | W0_TEST1   | W0_TEST2 |
+----------+------------+----------+
       |
|        2 | 2020-02-21 | B        |
|        3 | 2020-02-22 | C        |
|        4 | 2020-02-23 | D
|        4 | 2020-02-23 | D        |
+----------+------------+----------+
DROP TABLE W0CASE;

CREATE TABLE W0CASE ( W0_TEST0 INT , W0_TEST1 DATE , W0_TEST2 VARCHAR(100) , PRIMARY KEY (W0_TEST0,W0_TEST1,W0_TEST2) );
LOAD DATA INFILE 'data_for_mysqltest_loaddata/Load_Table_IC_mysql/A5.txt' INTO TABLE W0CASE COLUMNS TERMINATED BY ',' ENCLOSED BY '\'' ESCAPED BY '\\' LINES TERMINATED BY '/' IGNORE 1 LINES ;
SELECT * FROM W0CASE ORDER BY W0_TEST0 DESC , W0_TEST1 DESC , W0_TEST2 DESC ;
+----------+----------+----------+
| W0_TEST0 | W0_TEST1 | W0_TEST2 |
+----------+----------+----------+
+----------+----------+----------+
DROP TABLE W0CASE;

CREATE TABLE W0CASE ( W0_TEST0 INT , W0_TEST1 DATE , W0_TEST2 VARCHAR(100) , PRIMARY KEY (W0_TEST0,W0_TEST1,W0_TEST2) );
LOAD DATA INFILE 'data_for_mysqltest_loaddata/Load_Table_IC_mysql/A6.txt' INTO TABLE W0CASE COLUMNS TERMINATED BY ',' ENCLOSED BY '\'' ESCAPED BY '\\' LINES TERMINATED BY '/' IGNORE 1 LINES ;
SELECT * FROM W0CASE ORDER BY W0_TEST0 DESC , W0_TEST1 DESC , W0_TEST2 DESC ;
+----------+------------+-------------------------------------------------------+
| W0_TEST0 | W0_TEST1   | W0_TEST2                                              |
+----------+------------+-------------------------------------------------------+
 |
/3,2020-02-22,C
/4,2020-02-23,D
/4,2020-02-23,D/
|        2 | 2020-02-21 | 'B'
+----------+------------+-------------------------------------------------------+
DROP TABLE W0CASE;

CREATE TABLE W0CASE ( W0_TEST0 INT , W0_TEST1 DATE , W0_TEST2 VARCHAR(100) , PRIMARY KEY (W0_TEST0,W0_TEST1,W0_TEST2) );
LOAD DATA INFILE 'data_for_mysqltest_loaddata/Load_Table_IC_mysql/A6.txt' INTO TABLE W0CASE COLUMNS TERMINATED BY ',' ENCLOSED BY '\'' ESCAPED BY '\\' LINES TERMINATED BY '/' IGNORE 1 LINES ;
SELECT * FROM W0CASE ORDER BY W0_TEST0 DESC , W0_TEST1 DESC , W0_TEST2 DESC ;
+----------+------------+-------------------------------------------------------+
| W0_TEST0 | W0_TEST1   | W0_TEST2                                              |
+----------+------------+-------------------------------------------------------+
 |
/3,2020-02-22,C
/4,2020-02-23,D
/4,2020-02-23,D/
|        2 | 2020-02-21 | 'B'
+----------+------------+-------------------------------------------------------+
DROP TABLE W0CASE;

CREATE TABLE W0CASE ( W0_TEST0 INT , W0_TEST1 DATE , W0_TEST2 VARCHAR(100) , PRIMARY KEY (W0_TEST0,W0_TEST1,W0_TEST2) );
LOAD DATA INFILE 'data_for_mysqltest_loaddata/Load_Table_IC_mysql/A7.txt' INTO TABLE W0CASE COLUMNS TERMINATED BY ',' ENCLOSED BY '\'' ESCAPED BY '\\' LINES TERMINATED BY '/' IGNORE 1 LINES ;
SELECT * FROM W0CASE ORDER BY W0_TEST0 DESC , W0_TEST1 DESC , W0_TEST2 DESC ;
+----------+------------+----------+
| W0_TEST0 | W0_TEST1   | W0_TEST2 |
+----------+------------+----------+
       |
|        3 | 2020-02-22 | C
+----------+------------+----------+
DROP TABLE W0CASE;

CREATE TABLE W0CASE ( W0_TEST0 INT , W0_TEST1 DATE PRIMARY KEY , W0_TEST2 VARCHAR(100)  );
LOAD DATA INFILE 'data_for_mysqltest_loaddata/Load_Table_IC_mysql/A8.txt' INTO TABLE W0CASE COLUMNS TERMINATED BY ',' ( W0_TEST0, W0_TEST1, W0_TEST2 ) ;
ERROR 23000: Duplicated primary key
SELECT * FROM W0CASE ORDER BY W0_TEST0 DESC , W0_TEST1 DESC , W0_TEST2 DESC ;
+----------+----------+----------+
| W0_TEST0 | W0_TEST1 | W0_TEST2 |
+----------+----------+----------+
+----------+----------+----------+
DROP TABLE W0CASE;

CREATE TABLE W0CASE ( W0_TEST0 INT , W0_TEST1 DATE PRIMARY KEY , W0_TEST2 VARCHAR(100)  );
#BUGFIX: 
LOAD DATA INFILE 'data_for_mysqltest_loaddata/Load_Table_IC_mysql/A9.txt' INTO TABLE W0CASE COLUMNS TERMINATED BY ',' ( W0_TEST0, W0_TEST2 ) ;
ERROR HY000: Field doesn't have a default value
SELECT * FROM W0CASE ORDER BY W0_TEST0 DESC , W0_TEST1 DESC , W0_TEST2 DESC ;
+----------+----------+----------+
| W0_TEST0 | W0_TEST1 | W0_TEST2 |
+----------+----------+----------+
+----------+----------+----------+
DROP TABLE W0CASE;

CREATE TABLE W0CASE ( W0_TEST0 INT , W0_TEST1 DATE PRIMARY KEY , W0_TEST2 VARCHAR(100)  );
LOAD DATA INFILE 'data_for_mysqltest_loaddata/Load_Table_IC_mysql/A10.txt' INTO TABLE W0CASE COLUMNS TERMINATED BY ',' ( W0_TEST0, W0_TEST1, W0_TEST2 ) ;
ERROR 23000: Duplicated primary key
SELECT * FROM W0CASE ORDER BY W0_TEST0 DESC , W0_TEST1 DESC , W0_TEST2 DESC ;
+----------+----------+----------+
| W0_TEST0 | W0_TEST1 | W0_TEST2 |
+----------+----------+----------+
+----------+----------+----------+
DROP TABLE W0CASE;

CREATE TABLE W0CASE ( W0_TEST0 INT , W0_TEST1 DATE PRIMARY KEY , W0_TEST2 VARCHAR(100)  );
LOAD DATA INFILE 'data_for_mysqltest_loaddata/Load_Table_IC_mysql/A11.txt' INTO TABLE W0CASE COLUMNS TERMINATED BY ',' IGNORE 1 LINES ( W0_TEST0, W0_TEST1, W0_TEST2 ) ;
SELECT * FROM W0CASE ORDER BY W0_TEST0 DESC , W0_TEST1 DESC , W0_TEST2 DESC ;
+----------+------------+----------+
| W0_TEST0 | W0_TEST1   | W0_TEST2 |
+----------+------------+----------+
|        1 | 2020-02-20 | A        |
|        2 | 2020-02-21 | B        |
|        3 | 2020-02-22 | C        |
|        4 | 2020-02-23 | D        |
+----------+------------+----------+
DROP TABLE W0CASE;

CREATE TABLE W0CASE ( W0_TEST0 INT , W0_TEST1 DATE PRIMARY KEY , W0_TEST2 VARCHAR(100)  );
LOAD DATA INFILE 'data_for_mysqltest_loaddata/Load_Table_IC_mysql/A12.txt' INTO TABLE W0CASE COLUMNS TERMINATED BY ',' IGNORE 1 LINES ( W0_TEST0, W0_TEST1, W0_TEST2 ) SET W0_TEST1 = 20200221;
SELECT * FROM W0CASE ORDER BY W0_TEST0 DESC , W0_TEST1 DESC , W0_TEST2 DESC ;
+----------+------------+----------+
| W0_TEST0 | W0_TEST1   | W0_TEST2 |
+----------+------------+----------+
|        1 | 2020-02-21 | A        |
+----------+------------+----------+
DROP TABLE W0CASE;

CREATE TABLE W0CASE ( W0_TEST0 INT , W0_TEST1 DATE PRIMARY KEY , W0_TEST2 VARCHAR(100)  );
#BUG: 
LOAD DATA INFILE 'data_for_mysqltest_loaddata/Load_Table_IC_mysql/A13.txt' INTO TABLE W0CASE COLUMNS TERMINATED BY ',' OPTIONALLY ENCLOSED BY '\''  ( W0_TEST0, W0_TEST1, W0_TEST2 ) SET  W0_TEST2 = '\'abd\'';
SELECT * FROM W0CASE ORDER BY W0_TEST0 DESC , W0_TEST1 DESC , W0_TEST2 DESC ;
+----------+------------+----------+
| W0_TEST0 | W0_TEST1   | W0_TEST2 |
+----------+------------+----------+
|        5 | 2020-02-20 | 'abd'    |
+----------+------------+----------+
DROP TABLE W0CASE;

#obmysql_mysql_load_1_3_4_2
CREATE TABLE W0CASE ( W0_TEST0 REAL , W0_TEST1 TIME UNIQUE , W0_TEST2 MEDIUMTEXT  );
LOAD DATA INFILE 'data_for_mysqltest_loaddata/Load_Table_IC_mysql/A14.txt' INTO TABLE W0CASE COLUMNS TERMINATED BY ','  ;
SELECT * FROM W0CASE ORDER BY W0_TEST0 DESC , W0_TEST1 DESC , W0_TEST2 DESC ;
+----------+----------+----------+
| W0_TEST0 | W0_TEST1 | W0_TEST2 |
+----------+----------+----------+
|    1.234 | 00:00:00 | ASDC     |
+----------+----------+----------+
DROP TABLE W0CASE;

CREATE TABLE W0CASE ( W0_TEST0 REAL UNIQUE , W0_TEST1 TIME UNIQUE , W0_TEST2 CHAR(100) UNIQUE  );
LOAD DATA INFILE 'data_for_mysqltest_loaddata/Load_Table_IC_mysql/A14.txt' INTO TABLE W0CASE COLUMNS TERMINATED BY ','  ;
SELECT * FROM W0CASE ORDER BY W0_TEST0 DESC , W0_TEST1 DESC , W0_TEST2 DESC ;
+----------+----------+----------+
| W0_TEST0 | W0_TEST1 | W0_TEST2 |
+----------+----------+----------+
|    1.234 | 00:00:00 | ASDC     |
+----------+----------+----------+
DROP TABLE W0CASE;

CREATE TABLE W0CASE ( W0_TEST0 REAL UNIQUE , W0_TEST1 TIME UNIQUE , W0_TEST2 CHAR(100) UNIQUE  );
LOAD DATA INFILE 'data_for_mysqltest_loaddata/Load_Table_IC_mysql/A15.txt' INTO TABLE W0CASE COLUMNS TERMINATED BY ','  ;
SELECT * FROM W0CASE ORDER BY W0_TEST0 DESC , W0_TEST1 DESC , W0_TEST2 DESC ;
+----------+----------+----------+
| W0_TEST0 | W0_TEST1 | W0_TEST2 |
+----------+----------+----------+
|    1.213 | 00:10:00 | A        |
|    2.324 | 00:20:00 | B        |
|    3.213 | 00:31:00 | C        |
+----------+----------+----------+
DROP TABLE W0CASE;

CREATE TABLE W0CASE ( W0_TEST0 REAL UNIQUE , W0_TEST1 TIME UNIQUE , W0_TEST2 CHAR(100) UNIQUE  );
LOAD DATA INFILE 'data_for_mysqltest_loaddata/Load_Table_IC_mysql/A16.txt' INTO TABLE W0CASE COLUMNS TERMINATED BY ','  ;
ERROR 23000: Duplicated primary key
SELECT * FROM W0CASE ORDER BY W0_TEST0 DESC , W0_TEST1 DESC , W0_TEST2 DESC ;
+----------+----------+----------+
| W0_TEST0 | W0_TEST1 | W0_TEST2 |
+----------+----------+----------+
+----------+----------+----------+
DROP TABLE W0CASE;

CREATE TABLE W0CASE ( W0_TEST0 REAL UNIQUE , W0_TEST1 TIME UNIQUE , W0_TEST2 CHAR(100) UNIQUE );
LOAD DATA INFILE 'data_for_mysqltest_loaddata/Load_Table_IC_mysql/A17.txt' INTO TABLE W0CASE COLUMNS TERMINATED BY ',' OPTIONALLY ENCLOSED BY '\'' ;
SELECT * FROM W0CASE ORDER BY W0_TEST0 DESC , W0_TEST1 DESC , W0_TEST2 DESC ;
+----------+----------+----------+
| W0_TEST0 | W0_TEST1 | W0_TEST2 |
+----------+----------+----------+
    |
|    1.213 | 00:10:00 | A'       |
|    2.324 | 00:20:00 | B        |
|    3.213 | 00:31:00 | C        |
|   21.213 | 01:10:00 | 'A''
+----------+----------+----------+
DROP TABLE W0CASE;

CREATE TABLE W0CASE ( W0_TEST0 REAL UNIQUE , W0_TEST1 TIME UNIQUE , W0_TEST2 CHAR(100) UNIQUE );
LOAD DATA INFILE 'data_for_mysqltest_loaddata/Load_Table_IC_mysql/A18.txt' INTO TABLE W0CASE COLUMNS TERMINATED BY ',' OPTIONALLY ENCLOSED BY '\''  ESCAPED BY '\\';
SELECT * FROM W0CASE ORDER BY W0_TEST0 DESC , W0_TEST1 DESC , W0_TEST2 DESC ;
+----------+----------+----------+
| W0_TEST0 | W0_TEST1 | W0_TEST2 |
+----------+----------+----------+
|    1.213 | 00:10:00 | A'       |
|    2.324 | 00:20:00 | B        |
|    3.213 | 00:31:00 | C\       |
|   21.213 | 01:10:00 | A/'      |
+----------+----------+----------+
DROP TABLE W0CASE;

CREATE TABLE W0CASE ( W0_TEST0 REAL UNIQUE , W0_TEST1 TIME UNIQUE , W0_TEST2 CHAR(100) UNIQUE );
LOAD DATA INFILE 'data_for_mysqltest_loaddata/Load_Table_IC_mysql/A19.txt' INTO TABLE W0CASE COLUMNS TERMINATED BY ',' OPTIONALLY ENCLOSED BY '\''  ESCAPED BY '\\' ( W0_TEST1, W0_TEST2 );
SELECT * FROM W0CASE ORDER BY W0_TEST0 DESC , W0_TEST1 DESC , W0_TEST2 DESC ;
+----------+----------+----------+
| W0_TEST0 | W0_TEST1 | W0_TEST2 |
+----------+----------+----------+
|     NULL | 00:10:00 | A'       |
|     NULL | 00:20:00 | B        |
|     NULL | 00:31:00 | C\       |
|     NULL | 01:10:00 | A/'      |
+----------+----------+----------+
DROP TABLE W0CASE;

CREATE TABLE W0CASE ( W0_TEST0 REAL UNIQUE , W0_TEST1 TIME UNIQUE , W0_TEST2 CHAR(100) UNIQUE );
LOAD DATA INFILE 'data_for_mysqltest_loaddata/Load_Table_IC_mysql/A20.txt' INTO TABLE W0CASE COLUMNS TERMINATED BY ',' ( W0_TEST1, W0_TEST2 ) ;
SELECT * FROM W0CASE ORDER BY W0_TEST0 DESC , W0_TEST1 DESC , W0_TEST2 DESC ;
+----------+----------+----------+
| W0_TEST0 | W0_TEST1 | W0_TEST2 |
+----------+----------+----------+
|     NULL | 01:00:00 | a        |
+----------+----------+----------+
DROP TABLE W0CASE;

CREATE TABLE W0CASE ( W0_TEST0 REAL UNIQUE , W0_TEST1 TIME UNIQUE , W0_TEST2 CHAR(100) UNIQUE );
LOAD DATA INFILE 'data_for_mysqltest_loaddata/Load_Table_IC_mysql/A21.txt' INTO TABLE W0CASE COLUMNS TERMINATED BY ',' ( W0_TEST1, W0_TEST2 ) SET W0_TEST0 = 123 ,W0_TEST1 = 000000 , W0_TEST2 = '-A-';
ERROR 23000: Duplicated primary key
SELECT * FROM W0CASE ORDER BY W0_TEST0 DESC , W0_TEST1 DESC , W0_TEST2 DESC ;
+----------+----------+----------+
| W0_TEST0 | W0_TEST1 | W0_TEST2 |
+----------+----------+----------+
+----------+----------+----------+
DROP TABLE W0CASE;

CREATE TABLE W0CASE ( W0_TEST0 REAL UNIQUE , W0_TEST1 TIME UNIQUE , W0_TEST2 CHAR(100) UNIQUE );
#BUG: 
LOAD DATA INFILE 'data_for_mysqltest_loaddata/Load_Table_IC_mysql/A22.txt' INTO TABLE W0CASE COLUMNS TERMINATED BY ',' OPTIONALLY ENCLOSED BY '\''  ESCAPED BY '\\' ( W0_TEST1, W0_TEST2 ) SET W0_TEST0 = 123 ,W0_TEST1 = 000000 , W0_TEST2 = '-A-';
SELECT * FROM W0CASE ORDER BY W0_TEST0 DESC , W0_TEST1 DESC , W0_TEST2 DESC ;
+----------+----------+----------+
| W0_TEST0 | W0_TEST1 | W0_TEST2 |
+----------+----------+----------+
|      123 | 00:00:00 | -A-      |
+----------+----------+----------+
DROP TABLE W0CASE;

CREATE TABLE W0CASE ( W0_TEST0 REAL UNIQUE , W0_TEST1 TIME UNIQUE , W0_TEST2 CHAR(100) UNIQUE );
LOAD DATA INFILE 'data_for_mysqltest_loaddata/Load_Table_IC_mysql/A23.txt' INTO TABLE W0CASE COLUMNS TERMINATED BY ',' OPTIONALLY ENCLOSED BY '\''  ESCAPED BY '\\'  ( W0_TEST1, W0_TEST2 ) SET W0_TEST0 = 123 ,W0_TEST1 = 000000 , W0_TEST2 = '-A-';
SELECT * FROM W0CASE ORDER BY W0_TEST0 DESC , W0_TEST1 DESC , W0_TEST2 DESC ;
+----------+----------+----------+
| W0_TEST0 | W0_TEST1 | W0_TEST2 |
+----------+----------+----------+
|      123 | 00:00:00 | -A-      |
+----------+----------+----------+
DROP TABLE W0CASE;

#obmysql_mysql_load_1_3_4_3
CREATE TABLE W0CASE (W0_TEST0 TEXT NOT NULL , W0_TEST1 YEAR NOT NULL , W0_TEST2 BOOL NOT NULL);
LOAD DATA INFILE 'data_for_mysqltest_loaddata/Load_Table_IC_mysql/A24.txt' INTO TABLE W0CASE COLUMNS TERMINATED BY ',' ;
ERROR HY000: Incorrect integer value
SELECT * FROM W0CASE ORDER BY W0_TEST0 DESC , W0_TEST1 DESC , W0_TEST2 DESC ;
+----------+----------+----------+
| W0_TEST0 | W0_TEST1 | W0_TEST2 |
+----------+----------+----------+
+----------+----------+----------+
DROP TABLE W0CASE;

CREATE TABLE W0CASE (W0_TEST0 TEXT NOT NULL , W0_TEST1 YEAR NOT NULL , W0_TEST2 BOOL NOT NULL);
LOAD DATA INFILE 'data_for_mysqltest_loaddata/Load_Table_IC_mysql/A24.txt' INTO TABLE W0CASE COLUMNS TERMINATED BY ','  SET W0_TEST0 = NULL, W0_TEST1 = NULL, W0_TEST2 = NULL;
ERROR 23000: Column cannot be null
SELECT * FROM W0CASE ORDER BY W0_TEST0 DESC , W0_TEST1 DESC , W0_TEST2 DESC ;
+----------+----------+----------+
| W0_TEST0 | W0_TEST1 | W0_TEST2 |
+----------+----------+----------+
+----------+----------+----------+
DROP TABLE W0CASE;

SET @A = NULL;

CREATE TABLE W0CASE (W0_TEST0 TEXT NOT NULL , W0_TEST1 YEAR NOT NULL , W0_TEST2 BOOL NOT NULL);
#BUGFIX: 
LOAD DATA INFILE 'data_for_mysqltest_loaddata/Load_Table_IC_mysql/A24.txt' INTO TABLE W0CASE COLUMNS TERMINATED BY ','  (@A,@A,@A);
ERROR HY000: Field doesn't have a default value
SELECT * FROM W0CASE ORDER BY W0_TEST0 DESC , W0_TEST1 DESC , W0_TEST2 DESC ;
+----------+----------+----------+
| W0_TEST0 | W0_TEST1 | W0_TEST2 |
+----------+----------+----------+
+----------+----------+----------+
DROP TABLE W0CASE;

CREATE TABLE W0CASE (W0_TEST0 TEXT NOT NULL , W0_TEST1 YEAR  , W0_TEST2 BOOL );
LOAD DATA INFILE 'data_for_mysqltest_loaddata/Load_Table_IC_mysql/A25.txt' INTO TABLE W0CASE COLUMNS TERMINATED BY ','  (W0_TEST0 , W0_TEST1 , W0_TEST2);
SELECT * FROM W0CASE ORDER BY W0_TEST0 DESC , W0_TEST1 DESC , W0_TEST2 DESC ;
+----------+----------+----------+
| W0_TEST0 | W0_TEST1 | W0_TEST2 |
+----------+----------+----------+
|          |     2000 |        2 |
| a        |     1999 |        1 |
| c        |     2001 |        3 |
+----------+----------+----------+
DROP TABLE W0CASE;

CREATE TABLE W0CASE (W0_TEST0 TEXT NOT NULL , W0_TEST1 YEAR  , W0_TEST2 BOOL );
LOAD DATA INFILE 'data_for_mysqltest_loaddata/Load_Table_IC_mysql/A25.txt' INTO TABLE W0CASE COLUMNS TERMINATED BY ','  (W0_TEST0 , W0_TEST1 , W0_TEST2) ;
SELECT * FROM W0CASE ORDER BY W0_TEST0 DESC , W0_TEST1 DESC , W0_TEST2 DESC ;
+----------+----------+----------+
| W0_TEST0 | W0_TEST1 | W0_TEST2 |
+----------+----------+----------+
|          |     2000 |        2 |
| a        |     1999 |        1 |
| c        |     2001 |        3 |
+----------+----------+----------+
DROP TABLE W0CASE;

CREATE TABLE W0CASE (W0_TEST0 CHAR(10) NOT NULL , W0_TEST1 YEAR  , W0_TEST2 BOOL );
LOAD DATA INFILE 'data_for_mysqltest_loaddata/Load_Table_IC_mysql/A26.txt' INTO TABLE W0CASE COLUMNS TERMINATED BY ','  ( W0_TEST1 , W0_TEST2) ;
ERROR HY000: Field doesn't have a default value
SELECT * FROM W0CASE ORDER BY W0_TEST0 DESC , W0_TEST1 DESC , W0_TEST2 DESC ;
+----------+----------+----------+
| W0_TEST0 | W0_TEST1 | W0_TEST2 |
+----------+----------+----------+
+----------+----------+----------+
DROP TABLE W0CASE;

#obmysql_mysql_load_1_3_4_5
CREATE TABLE W0CASE (W0_TEST0 CHAR(10) , W0_TEST1 YEAR  , W0_TEST2 FLOAT ,  PRIMARY KEY (W0_TEST2));
CREATE TABLE W1CASE (W1_TEST0 CHAR(10) , W1_TEST1 YEAR  , W1_TEST2 FLOAT , FOREIGN KEY (W1_TEST2) REFERENCES W0CASE (W0_TEST2)  );
LOAD DATA INFILE 'data_for_mysqltest_loaddata/Load_Table_IC_mysql/A27.txt' INTO TABLE W0CASE COLUMNS TERMINATED BY ','  ;
LOAD DATA INFILE 'data_for_mysqltest_loaddata/Load_Table_IC_mysql/A27.txt' INTO TABLE W1CASE COLUMNS TERMINATED BY ','  ;
SELECT * FROM W1CASE ORDER BY W1_TEST0 DESC , W1_TEST1 DESC , W1_TEST2 DESC;
+----------+----------+----------+
| W1_TEST0 | W1_TEST1 | W1_TEST2 |
+----------+----------+----------+
| A        |     1999 |        1 |
| B        |     2000 |        2 |
| C        |     2001 |        3 |
+----------+----------+----------+
LOAD DATA INFILE 'data_for_mysqltest_loaddata/Load_Table_IC_mysql/A28.txt' INTO TABLE W1CASE COLUMNS TERMINATED BY ',' (W1_TEST0 , W1_TEST1) ;
SELECT * FROM W1CASE ORDER BY W1_TEST0 DESC , W1_TEST1 DESC , W1_TEST2 DESC;
+----------+----------+----------+
| W1_TEST0 | W1_TEST1 | W1_TEST2 |
+----------+----------+----------+
| A        |     1999 |        1 |
| A        |     1999 |     NULL |
| B        |     2000 |        2 |
| B        |     2000 |     NULL |
| C        |     2001 |        3 |
| C        |     2001 |     NULL |
+----------+----------+----------+
LOAD DATA INFILE 'data_for_mysqltest_loaddata/Load_Table_IC_mysql/A28.txt' INTO TABLE W1CASE COLUMNS TERMINATED BY ',' (W1_TEST0 , W1_TEST1) SET W1_TEST2 = NULL;
SELECT * FROM W1CASE ORDER BY W1_TEST0 DESC , W1_TEST1 DESC , W1_TEST2 DESC;
+----------+----------+----------+
| W1_TEST0 | W1_TEST1 | W1_TEST2 |
+----------+----------+----------+
| A        |     1999 |        1 |
| A        |     1999 |     NULL |
| A        |     1999 |     NULL |
| B        |     2000 |        2 |
| B        |     2000 |     NULL |
| B        |     2000 |     NULL |
| C        |     2001 |        3 |
| C        |     2001 |     NULL |
| C        |     2001 |     NULL |
+----------+----------+----------+
LOAD DATA INFILE 'data_for_mysqltest_loaddata/Load_Table_IC_mysql/A28.txt' INTO TABLE W1CASE COLUMNS TERMINATED BY ',' (W1_TEST0 , W1_TEST1) SET W1_TEST2 = 4;
ERROR 23000: Cannot add or update a child row: a foreign key constraint fails
SELECT * FROM W1CASE ORDER BY W1_TEST0 DESC , W1_TEST1 DESC , W1_TEST2 DESC;
+----------+----------+----------+
| W1_TEST0 | W1_TEST1 | W1_TEST2 |
+----------+----------+----------+
| A        |     1999 |        1 |
| A        |     1999 |     NULL |
| A        |     1999 |     NULL |
| B        |     2000 |        2 |
| B        |     2000 |     NULL |
| B        |     2000 |     NULL |
| C        |     2001 |        3 |
| C        |     2001 |     NULL |
| C        |     2001 |     NULL |
+----------+----------+----------+
DROP TABLE W1CASE;
DROP TABLE W0CASE;

CREATE TABLE W0CASE (W0_TEST0 CHAR(10) , W0_TEST1 YEAR  , W0_TEST2 FLOAT ,  PRIMARY KEY (W0_TEST2));
CREATE TABLE W1CASE (W1_TEST0 CHAR(10) , W1_TEST1 YEAR  , W1_TEST2 FLOAT , FOREIGN KEY (W1_TEST2) REFERENCES W0CASE (W0_TEST2)  );
LOAD DATA INFILE 'data_for_mysqltest_loaddata/Load_Table_IC_mysql/A27.txt' INTO TABLE W0CASE FIELDS TERMINATED BY ',' ;
LOAD DATA INFILE 'data_for_mysqltest_loaddata/Load_Table_IC_mysql/A29.txt' INTO TABLE W1CASE FIELDS TERMINATED BY ',' OPTIONALLY ENCLOSED BY '\''  ;
SELECT * FROM W1CASE ORDER BY W1_TEST0 DESC , W1_TEST1 DESC , W1_TEST2 DESC;
+----------+----------+----------+
| W1_TEST0 | W1_TEST1 | W1_TEST2 |
+----------+----------+----------+
| A        |     1999 |        1 |
| B        |     2000 |        2 |
| C        |     2001 |        3 |
+----------+----------+----------+
LOAD DATA INFILE 'data_for_mysqltest_loaddata/Load_Table_IC_mysql/A30.txt' INTO TABLE W1CASE FIELDS TERMINATED BY ',' OPTIONALLY ENCLOSED BY '\'' ESCAPED BY '\\' ;
SELECT * FROM W1CASE ORDER BY W1_TEST0 DESC , W1_TEST1 DESC , W1_TEST2 DESC;
+----------+----------+----------+
| W1_TEST0 | W1_TEST1 | W1_TEST2 |
+----------+----------+----------+
| A        |     1999 |        1 |
| A\       |     1999 |        1 |
| B        |     2000 |        2 |
| B        |     2000 |        2 |
| C        |     2001 |        3 |
| C        |     2001 |        3 |
+----------+----------+----------+
LOAD DATA INFILE 'data_for_mysqltest_loaddata/Load_Table_IC_mysql/A31.txt' INTO TABLE W1CASE FIELDS TERMINATED BY ',' OPTIONALLY ENCLOSED BY '\'' ESCAPED BY '\\' ;
ERROR 01000: Data truncated for argument
SELECT * FROM W1CASE ORDER BY W1_TEST0 DESC , W1_TEST1 DESC , W1_TEST2 DESC;
+----------+----------+----------+
| W1_TEST0 | W1_TEST1 | W1_TEST2 |
+----------+----------+----------+
| A        |     1999 |        1 |
| A\       |     1999 |        1 |
| B        |     2000 |        2 |
| B        |     2000 |        2 |
| C        |     2001 |        3 |
| C        |     2001 |        3 |
+----------+----------+----------+
DROP TABLE W1CASE;
DROP TABLE W0CASE;

CREATE TABLE W0CASE ( W0_TEST0 INT AUTO_INCREMENT PRIMARY KEY, W0_TEST1 CHAR(10) , W0_TEST2 TIME );
LOAD DATA INFILE 'data_for_mysqltest_loaddata/Load_Table_IC_mysql/A32.txt' INTO TABLE W0CASE FIELDS TERMINATED BY ',' ( W0_TEST1,W0_TEST2 );
SELECT * FROM W0CASE ORDER BY W0_TEST0 DESC , W0_TEST1 DESC , W0_TEST2 DESC;
+----------+----------+----------+
| W0_TEST0 | W0_TEST1 | W0_TEST2 |
+----------+----------+----------+
|        1 | A        | 00:00:00 |
|        2 | A        | 00:00:00 |
|        3 | A        | 00:00:00 |
|        4 | A        | 00:00:00 |
|        5 | A        | 00:00:00 |
|        6 | A        | 00:00:00 |
|        7 | A        | 00:00:00 |
+----------+----------+----------+
DELETE FROM W0CASE;
LOAD DATA INFILE 'data_for_mysqltest_loaddata/Load_Table_IC_mysql/A33.txt' INTO TABLE W0CASE FIELDS TERMINATED BY ',' ;
SELECT * FROM W0CASE ORDER BY W0_TEST0 DESC , W0_TEST1 DESC , W0_TEST2 DESC;
+----------+----------+----------+
| W0_TEST0 | W0_TEST1 | W0_TEST2 |
+----------+----------+----------+
|       11 | A        | 00:00:00 |
+----------+----------+----------+
LOAD DATA INFILE 'data_for_mysqltest_loaddata/Load_Table_IC_mysql/A33.txt' INTO TABLE W0CASE FIELDS TERMINATED BY ','  SET W0_TEST0 = 10;
SELECT * FROM W0CASE ORDER BY W0_TEST0 DESC , W0_TEST1 DESC , W0_TEST2 DESC;
+----------+----------+----------+
| W0_TEST0 | W0_TEST1 | W0_TEST2 |
+----------+----------+----------+
|       10 | A        | 00:00:00 |
|       11 | A        | 00:00:00 |
+----------+----------+----------+
DROP TABLE W0CASE;

#obmysql_mysql_load_3_1
#obmysql_mysql_load_3_1_1
CREATE TABLE W0CASE ( W0_TEST0 INT , W0_TEST1 CHAR(10) , W0_TEST2 TIME );
CREATE INDEX IN0 ON W0CASE (W0_TEST0, W0_TEST1, W0_TEST2);
LOAD DATA INFILE 'data_for_mysqltest_loaddata/Load_Table_IC_mysql/A33.txt' INTO TABLE W0CASE FIELDS TERMINATED BY ','  SET W0_TEST0 = 10;
SELECT * FROM W0CASE ORDER BY W0_TEST0 DESC , W0_TEST1 DESC , W0_TEST2 DESC;
+----------+----------+----------+
| W0_TEST0 | W0_TEST1 | W0_TEST2 |
+----------+----------+----------+
|       10 | A        | 00:00:00 |
+----------+----------+----------+
DELETE FROM W0CASE;
CREATE INDEX IN1 ON W0CASE (W0_TEST0 , W0_TEST2);
LOAD DATA INFILE 'data_for_mysqltest_loaddata/Load_Table_IC_mysql/A34.txt' INTO TABLE W0CASE FIELDS TERMINATED BY ','  (W0_TEST1 , W0_TEST2 , W0_TEST0);
SELECT * FROM W0CASE ORDER BY W0_TEST0 DESC , W0_TEST1 DESC , W0_TEST2 DESC;
+----------+----------+----------+
| W0_TEST0 | W0_TEST1 | W0_TEST2 |
+----------+----------+----------+
|        0 | 000000   | 00:00:00 |
|        1 | A        | 00:00:01 |
|     1100 | B        | 01:01:01 |
+----------+----------+----------+
DROP TABLE W0CASE;

CREATE TABLE W0CASE ( W0_TEST0 CHAR(100) , W0_TEST1 VARCHAR(100) , W0_TEST2 INT , INDEX IN0 ( W0_TEST0 )  );
LOAD DATA INFILE 'data_for_mysqltest_loaddata/Load_Table_IC_mysql/A34.txt' INTO TABLE W0CASE FIELDS TERMINATED BY ','  (W0_TEST1 , W0_TEST2 , W0_TEST0);
SELECT * FROM W0CASE ORDER BY W0_TEST0 DESC , W0_TEST1 DESC , W0_TEST2 DESC;
+----------+----------+----------+
| W0_TEST0 | W0_TEST1 | W0_TEST2 |
+----------+----------+----------+
| 000000   | 000000   |        0 |
| 000001   | A        |        1 |
| 001100   | B        |    10101 |
+----------+----------+----------+
CREATE INDEX IN1 ON W0CASE (W0_TEST0) ;
LOAD DATA INFILE 'data_for_mysqltest_loaddata/Load_Table_IC_mysql/A34.txt' INTO TABLE W0CASE FIELDS TERMINATED BY ','  (W0_TEST1 , W0_TEST2 , W0_TEST0);
SELECT * FROM W0CASE ORDER BY W0_TEST0 DESC , W0_TEST1 DESC , W0_TEST2 DESC;
+----------+----------+----------+
| W0_TEST0 | W0_TEST1 | W0_TEST2 |
+----------+----------+----------+
| 000000   | 000000   |        0 |
| 000000   | 000000   |        0 |
| 000001   | A        |        1 |
| 000001   | A        |        1 |
| 001100   | B        |    10101 |
| 001100   | B        |    10101 |
+----------+----------+----------+
CREATE INDEX IN2 ON W0CASE (W0_TEST0) ;
LOAD DATA INFILE 'data_for_mysqltest_loaddata/Load_Table_IC_mysql/A34.txt' REPLACE INTO TABLE W0CASE FIELDS TERMINATED BY ','  (W0_TEST1 , W0_TEST2 , W0_TEST0);
SELECT * FROM W0CASE ORDER BY W0_TEST0 DESC , W0_TEST1 DESC , W0_TEST2 DESC;
+----------+----------+----------+
| W0_TEST0 | W0_TEST1 | W0_TEST2 |
+----------+----------+----------+
| 000000   | 000000   |        0 |
| 000000   | 000000   |        0 |
| 000000   | 000000   |        0 |
| 000001   | A        |        1 |
| 000001   | A        |        1 |
| 000001   | A        |        1 |
| 001100   | B        |    10101 |
| 001100   | B        |    10101 |
| 001100   | B        |    10101 |
+----------+----------+----------+
CREATE INDEX IN3 ON W0CASE ( W0_TEST0 , W0_TEST1 ) ;
LOAD DATA INFILE 'data_for_mysqltest_loaddata/Load_Table_IC_mysql/A34.txt' REPLACE INTO TABLE W0CASE FIELDS TERMINATED BY ',' IGNORE 4 LINES  (W0_TEST1 , W0_TEST2 , W0_TEST0)  SET W0_TEST0 = 1;
SELECT * FROM W0CASE ORDER BY W0_TEST0 DESC , W0_TEST1 DESC , W0_TEST2 DESC;
+----------+----------+----------+
| W0_TEST0 | W0_TEST1 | W0_TEST2 |
+----------+----------+----------+
| 000000   | 000000   |        0 |
| 000000   | 000000   |        0 |
| 000000   | 000000   |        0 |
| 000001   | A        |        1 |
| 000001   | A        |        1 |
| 000001   | A        |        1 |
| 001100   | B        |    10101 |
| 001100   | B        |    10101 |
| 001100   | B        |    10101 |
+----------+----------+----------+
DROP TABLE W0CASE;

CREATE TABLE W0CASE ( W0_TEST0 REAL , W0_TEST1 CHAR(10) , W0_TEST2 DATE , INDEX IN0 ( W0_TEST2 , W0_TEST1 , W0_TEST0 ) );
LOAD DATA INFILE 'data_for_mysqltest_loaddata/Load_Table_IC_mysql/A35.txt' REPLACE INTO TABLE W0CASE FIELDS TERMINATED BY ',' OPTIONALLY ENCLOSED BY '\'';
ERROR 22007: Incorrect value
SELECT * FROM W0CASE ORDER BY W0_TEST0 DESC , W0_TEST1 DESC , W0_TEST2 DESC;
+----------+----------+----------+
| W0_TEST0 | W0_TEST1 | W0_TEST2 |
+----------+----------+----------+
+----------+----------+----------+
LOAD DATA INFILE 'data_for_mysqltest_loaddata/Load_Table_IC_mysql/A35.txt' REPLACE INTO TABLE W0CASE FIELDS TERMINATED BY ',' OPTIONALLY ENCLOSED BY '\'' ESCAPED BY '\'';
ERROR 22007: Incorrect value
SELECT * FROM W0CASE ORDER BY W0_TEST0 DESC , W0_TEST1 DESC , W0_TEST2 DESC;
+----------+----------+----------+
| W0_TEST0 | W0_TEST1 | W0_TEST2 |
+----------+----------+----------+
+----------+----------+----------+
LOAD DATA INFILE 'data_for_mysqltest_loaddata/Load_Table_IC_mysql/A36.txt' REPLACE INTO TABLE W0CASE FIELDS TERMINATED BY ',' OPTIONALLY ENCLOSED BY '\\' ESCAPED BY '\\' (W0_TEST0 , W0_TEST1 , W0_TEST2)  SET W0_TEST0 = 0;
ERROR 22007: Incorrect value
SELECT * FROM W0CASE ORDER BY W0_TEST0 DESC , W0_TEST1 DESC , W0_TEST2 DESC;
+----------+----------+----------+
| W0_TEST0 | W0_TEST1 | W0_TEST2 |
+----------+----------+----------+
+----------+----------+----------+
DROP TABLE W0CASE;

#obmysql_mysql_load_3_1_2
CREATE TABLE W0CASE ( W0_TEST0 INT AUTO_INCREMENT PRIMARY KEY , W0_TEST1 YEAR , W0_TEST2 CHAR(10)  );
LOAD DATA INFILE 'data_for_mysqltest_loaddata/Load_Table_IC_mysql/A37.txt' REPLACE INTO TABLE W0CASE FIELDS TERMINATED BY ','   (W0_TEST0 , W0_TEST1 , W0_TEST2) ;
SELECT * FROM W0CASE ORDER BY W0_TEST0 DESC , W0_TEST1 DESC , W0_TEST2 DESC;
+----------+----------+----------+
| W0_TEST0 | W0_TEST1 | W0_TEST2 |
+----------+----------+----------+
|        1 |     1999 | 'A'      |
|        2 |     2000 | 'B'      |
+----------+----------+----------+
#BUG: 
LOAD DATA INFILE 'data_for_mysqltest_loaddata/Load_Table_IC_mysql/A37.txt' REPLACE INTO TABLE W0CASE FIELDS TERMINATED BY ','   (W0_TEST0 , W0_TEST1 , W0_TEST2)  SET W0_TEST0 = 0;
SELECT * FROM W0CASE ORDER BY W0_TEST0 DESC , W0_TEST1 DESC , W0_TEST2 DESC;
+----------+----------+----------+
| W0_TEST0 | W0_TEST1 | W0_TEST2 |
+----------+----------+----------+
|        1 |     1999 | 'A'      |
|        2 |     2000 | 'B'      |
|        3 |     1999 | 'A'      |
|        4 |     2000 | 'B'      |
+----------+----------+----------+
DROP TABLE W0CASE;

CREATE TABLE W0CASE ( W0_TEST0 INT AUTO_INCREMENT PRIMARY KEY , W0_TEST1 CHAR(100) UNIQUE , W0_TEST2 VARCHAR(100) NOT NULL );
LOAD DATA INFILE 'data_for_mysqltest_loaddata/Load_Table_IC_mysql/A38.txt' REPLACE INTO TABLE W0CASE FIELDS TERMINATED BY ','   ( W0_TEST1 , W0_TEST2) ;
SELECT * FROM W0CASE ORDER BY W0_TEST0 DESC , W0_TEST1 DESC , W0_TEST2 DESC;
+----------+----------+----------+
| W0_TEST0 | W0_TEST1 | W0_TEST2 |
+----------+----------+----------+
|        1 | 1999     | 'A'      |
|        2 | 2000     | 'B'      |
+----------+----------+----------+
CREATE INDEX IN0 ON W0CASE (W0_TEST0);
DELETE FROM W0CASE;
LOAD DATA INFILE 'data_for_mysqltest_loaddata/Load_Table_IC_mysql/A38.txt' REPLACE INTO TABLE W0CASE FIELDS TERMINATED BY ',' IGNORE 3  ROWS;
SELECT * FROM W0CASE ORDER BY W0_TEST0 DESC , W0_TEST1 DESC , W0_TEST2 DESC;
+----------+----------+----------+
| W0_TEST0 | W0_TEST1 | W0_TEST2 |
+----------+----------+----------+
+----------+----------+----------+
LOAD DATA INFILE 'data_for_mysqltest_loaddata/Load_Table_IC_mysql/A38.txt' REPLACE INTO TABLE W0CASE FIELDS TERMINATED BY ',' IGNORE 1  ROWS;
ERROR 23000: Column cannot be null
SELECT * FROM W0CASE ORDER BY W0_TEST0 DESC , W0_TEST1 DESC , W0_TEST2 DESC;
+----------+----------+----------+
| W0_TEST0 | W0_TEST1 | W0_TEST2 |
+----------+----------+----------+
+----------+----------+----------+
LOAD DATA INFILE 'data_for_mysqltest_loaddata/Load_Table_IC_mysql/A39.txt' REPLACE INTO TABLE W0CASE FIELDS TERMINATED BY ',' IGNORE 2  ROWS SET W0_TEST0 = 0 , W0_TEST1 = 'A' , W0_TEST2 = 'B';
SELECT * FROM W0CASE ORDER BY W0_TEST0 DESC , W0_TEST1 DESC , W0_TEST2 DESC;
+----------+----------+----------+
| W0_TEST0 | W0_TEST1 | W0_TEST2 |
+----------+----------+----------+
+----------+----------+----------+
DROP TABLE W0CASE;

DROP TABLE W0CASE;
DROP TABLE W1CASE;

drop user WCY@'%' ;
