result_format: 4
drop user WCY@'%';
create user WCY identified by 'WCY';
grant all on *.* to WCY WITH GRANT OPTION;





DROP TABLE W0CASE;
DROP TABLE W1CASE;
#该文档中，放置的case为load对应表，仅带set和col_name_or_user_var的部分，主要来load对应表的一般处理，同时这些表不带有主键，索引等约束。
#obmysql_mysql_load_1
#obmysql_mysql_load_1_1
#CHAR, VARCHAR,TINYTEXT,TEXT,MEDIUMTEXT,LONGTEXT,ENUM,SET
CREATE TABLE W0CASE (W0_TEST0 CHAR(10), W0_TEST1 VARCHAR(10),W0_TEST2 TINYTEXT,W0_TEST3 TEXT, W0_TEST4 MEDIUMTEXT, W0_TEST5 LONGTEXT, W0_TEST6 ENUM('1','g'), W0_TEST7 SET('2','h'));
LOAD DATA INFILE 'data_for_mysqltest_loaddata/Load_Table_DM_mysql/A0.txt' INTO TABLE W0CASE FIELDS TERMINATED BY ',' (W0_TEST0);
SELECT * FROM W0CASE;
+----------+----------+----------+----------+----------+----------+----------+----------+
| W0_TEST0 | W0_TEST1 | W0_TEST2 | W0_TEST3 | W0_TEST4 | W0_TEST5 | W0_TEST6 | W0_TEST7 |
+----------+----------+----------+----------+----------+----------+----------+----------+
| A0       | NULL     | NULL     | NULL     | NULL     | NULL     | NULL     | NULL     |
| A0       | NULL     | NULL     | NULL     | NULL     | NULL     | NULL     | NULL     |
| A0       | NULL     | NULL     | NULL     | NULL     | NULL     | NULL     | NULL     |
+----------+----------+----------+----------+----------+----------+----------+----------+
DROP TABLE W0CASE ;

CREATE TABLE W0CASE (W0_TEST0 CHAR(10), W0_TEST1 VARCHAR(10),W0_TEST2 TINYTEXT,W0_TEST3 TEXT, W0_TEST4 MEDIUMTEXT, W0_TEST5 LONGTEXT, W0_TEST6 ENUM('1','g'), W0_TEST7 SET('2','h'));
LOAD DATA INFILE 'data_for_mysqltest_loaddata/Load_Table_DM_mysql/A0.txt' INTO TABLE W0CASE FIELDS TERMINATED BY ',' (W0_TEST0,W0_TEST1,W0_TEST2,W0_TEST3,W0_TEST4,W0_TEST5,W0_TEST6,W0_TEST7);
SELECT * FROM W0CASE;
+----------+----------+----------+----------+----------+----------+----------+----------+
| W0_TEST0 | W0_TEST1 | W0_TEST2 | W0_TEST3 | W0_TEST4 | W0_TEST5 | W0_TEST6 | W0_TEST7 |
+----------+----------+----------+----------+----------+----------+----------+----------+
| A0       | A1       | A2       | A3       | A4       | A5       | 1        | 2        |
| A0       | A1       | A2       | A3       | A4       | A5       | g        | 2        |
| A0       | A1       | A2       | A3       | A4       | A5       | g        | h        |
+----------+----------+----------+----------+----------+----------+----------+----------+
DROP TABLE W0CASE ;

SET @AA0 = 'A0A';

CREATE TABLE W0CASE (W0_TEST0 CHAR(10), W0_TEST1 VARCHAR(10),W0_TEST2 TINYTEXT,W0_TEST3 TEXT, W0_TEST4 MEDIUMTEXT, W0_TEST5 LONGTEXT, W0_TEST6 ENUM('1','g'), W0_TEST7 SET('2','h'));
LOAD DATA INFILE 'data_for_mysqltest_loaddata/Load_Table_DM_mysql/A0.txt' INTO TABLE W0CASE FIELDS TERMINATED BY ',' (@AA0,W0_TEST1,W0_TEST2,W0_TEST3,W0_TEST4,W0_TEST5,W0_TEST6,W0_TEST7);
SELECT * FROM W0CASE;
+----------+----------+----------+----------+----------+----------+----------+----------+
| W0_TEST0 | W0_TEST1 | W0_TEST2 | W0_TEST3 | W0_TEST4 | W0_TEST5 | W0_TEST6 | W0_TEST7 |
+----------+----------+----------+----------+----------+----------+----------+----------+
| NULL     | A1       | A2       | A3       | A4       | A5       | 1        | 2        |
| NULL     | A1       | A2       | A3       | A4       | A5       | g        | 2        |
| NULL     | A1       | A2       | A3       | A4       | A5       | g        | h        |
+----------+----------+----------+----------+----------+----------+----------+----------+
DROP TABLE W0CASE ;

CREATE TABLE W0CASE (W0_TEST0 CHAR(10), W0_TEST1 VARCHAR(10),W0_TEST2 TINYTEXT,W0_TEST3 TEXT, W0_TEST4 MEDIUMTEXT, W0_TEST5 LONGTEXT, W0_TEST6 ENUM('1','g'), W0_TEST7 SET('2','h'));
LOAD DATA INFILE 'data_for_mysqltest_loaddata/Load_Table_DM_mysql/A0.txt' INTO TABLE W0CASE FIELDS TERMINATED BY ',' (@AA0,W0_TEST1,W0_TEST2,W0_TEST3,W0_TEST4,W0_TEST5,W0_TEST6,@AA0);
SELECT * FROM W0CASE;
+----------+----------+----------+----------+----------+----------+----------+----------+
| W0_TEST0 | W0_TEST1 | W0_TEST2 | W0_TEST3 | W0_TEST4 | W0_TEST5 | W0_TEST6 | W0_TEST7 |
+----------+----------+----------+----------+----------+----------+----------+----------+
| NULL     | A1       | A2       | A3       | A4       | A5       | 1        | NULL     |
| NULL     | A1       | A2       | A3       | A4       | A5       | g        | NULL     |
| NULL     | A1       | A2       | A3       | A4       | A5       | g        | NULL     |
+----------+----------+----------+----------+----------+----------+----------+----------+
DROP TABLE W0CASE ;

SET @AA0 = 2;
SET @AA1 = @AA0 * @AA0;

CREATE TABLE W0CASE (W0_TEST0 CHAR(10), W0_TEST1 VARCHAR(10),W0_TEST2 TINYTEXT,W0_TEST3 TEXT, W0_TEST4 MEDIUMTEXT, W0_TEST5 LONGTEXT, W0_TEST6 ENUM('1','g'), W0_TEST7 SET('2','h'));
LOAD DATA INFILE 'data_for_mysqltest_loaddata/Load_Table_DM_mysql/A0.txt' INTO TABLE W0CASE FIELDS TERMINATED BY ',' (@AA2,W0_TEST1,W0_TEST2,W0_TEST3,W0_TEST4,W0_TEST5,W0_TEST6,@AA0);
SELECT * FROM W0CASE;
+----------+----------+----------+----------+----------+----------+----------+----------+
| W0_TEST0 | W0_TEST1 | W0_TEST2 | W0_TEST3 | W0_TEST4 | W0_TEST5 | W0_TEST6 | W0_TEST7 |
+----------+----------+----------+----------+----------+----------+----------+----------+
| NULL     | A1       | A2       | A3       | A4       | A5       | 1        | NULL     |
| NULL     | A1       | A2       | A3       | A4       | A5       | g        | NULL     |
| NULL     | A1       | A2       | A3       | A4       | A5       | g        | NULL     |
+----------+----------+----------+----------+----------+----------+----------+----------+
DROP TABLE W0CASE ;

#BUGFIX: 
CREATE TABLE W0CASE (W0_TEST0 CHAR(10), W0_TEST1 VARCHAR(10),W0_TEST2 TINYTEXT,W0_TEST3 TEXT, W0_TEST4 MEDIUMTEXT, W0_TEST5 LONGTEXT, W0_TEST6 ENUM('1','g'), W0_TEST7 SET('2','h'));
LOAD DATA INFILE 'data_for_mysqltest_loaddata/Load_Table_DM_mysql/A0.txt' INTO TABLE W0CASE FIELDS TERMINATED BY ',' (W0_TEST1,W0_TEST1,W0_TEST2,W0_TEST3,W0_TEST4,W0_TEST5,W0_TEST6,@AA0);
ERROR 42000: Column 'W0_TEST1' specified twice
SELECT * FROM W0CASE;
+----------+----------+----------+----------+----------+----------+----------+----------+
| W0_TEST0 | W0_TEST1 | W0_TEST2 | W0_TEST3 | W0_TEST4 | W0_TEST5 | W0_TEST6 | W0_TEST7 |
+----------+----------+----------+----------+----------+----------+----------+----------+
+----------+----------+----------+----------+----------+----------+----------+----------+
DROP TABLE W0CASE ;

CREATE TABLE W0CASE (W0_TEST0 CHAR(10), W0_TEST1 VARCHAR(10),W0_TEST2 TINYTEXT,W0_TEST3 TEXT, W0_TEST4 MEDIUMTEXT, W0_TEST5 LONGTEXT, W0_TEST6 ENUM('1','g'), W0_TEST7 SET('2','h'));
LOAD DATA INFILE 'data_for_mysqltest_loaddata/Load_Table_DM_mysql/A1.txt' INTO TABLE W0CASE FIELDS TERMINATED BY ',' (W0_TEST1,W0_TEST0,W0_TEST4,W0_TEST3,W0_TEST2,W0_TEST5,W0_TEST7,W0_TEST6);
SELECT * FROM W0CASE;
+----------+----------+----------+----------+----------+----------+----------+----------+
| W0_TEST0 | W0_TEST1 | W0_TEST2 | W0_TEST3 | W0_TEST4 | W0_TEST5 | W0_TEST6 | W0_TEST7 |
+----------+----------+----------+----------+----------+----------+----------+----------+
| A1       | A0       | A4       | A3       | A2       | A5       | 1        | 2        |
| A1       | A0       | A4       | A3       | A2       | A5       | g        | 2        |
| A1       | A0       | A4       | A3       | A2       | A5       | g        | h        |
+----------+----------+----------+----------+----------+----------+----------+----------+
DROP TABLE W0CASE ;

CREATE TABLE W0CASE (W0_TEST0 CHAR(10), W0_TEST1 VARCHAR(10), W0_TEST2 ENUM('1','g'), W0_TEST3 SET('2','h'));
LOAD DATA INFILE 'data_for_mysqltest_loaddata/Load_Table_DM_mysql/A2.txt' INTO TABLE W0CASE FIELDS TERMINATED BY ',' (W0_TEST1,W0_TEST2,W0_TEST3);
SELECT * FROM W0CASE;
+----------+----------+----------+----------+
| W0_TEST0 | W0_TEST1 | W0_TEST2 | W0_TEST3 |
+----------+----------+----------+----------+
| NULL     | a        | 1        | 2        |
+----------+----------+----------+----------+
DROP TABLE W0CASE ;

CREATE TABLE W0CASE (W0_TEST0 CHAR(10), W0_TEST1 VARCHAR(10), W0_TEST2 ENUM('1','g'), W0_TEST3 SET('2','h'));
LOAD DATA INFILE 'data_for_mysqltest_loaddata/Load_Table_DM_mysql/A3.txt' INTO TABLE W0CASE FIELDS TERMINATED BY ',' LINES TERMINATED BY '/' (W0_TEST1,W0_TEST3);
ERROR 01000: Data truncated for argument
SELECT * FROM W0CASE;
+----------+----------+----------+----------+
| W0_TEST0 | W0_TEST1 | W0_TEST2 | W0_TEST3 |
+----------+----------+----------+----------+
+----------+----------+----------+----------+
DROP TABLE W0CASE ;

CREATE TABLE W0CASE (W0_TEST0 CHAR(10), W0_TEST1 VARCHAR(10), W0_TEST2 ENUM('1','g'), W0_TEST3 SET('2','h'));
LOAD DATA INFILE 'data_for_mysqltest_loaddata/Load_Table_DM_mysql/A4.txt' INTO TABLE W0CASE FIELDS TERMINATED BY ',' LINES TERMINATED BY '/' (W0_TEST1) SET W0_TEST3 = 'h';
SELECT * FROM W0CASE ORDER BY W0_TEST0 DESC , W0_TEST1 DESC , W0_TEST3 DESC;
+----------+----------+----------+----------+
| W0_TEST0 | W0_TEST1 | W0_TEST2 | W0_TEST3 |
+----------+----------+----------+----------+
      | NULL     | h        |
      | NULL     | h        |
b       | NULL     | h        |
c
e      | NULL     | h        |
f
| NULL     | 
| NULL     | 
| NULL     | 
| NULL     | a        | NULL     | h        |
| NULL     | d
+----------+----------+----------+----------+
DROP TABLE W0CASE ;

CREATE TABLE W0CASE (W0_TEST0 CHAR(10));
LOAD DATA INFILE 'data_for_mysqltest_loaddata/Load_Table_DM_mysql/A5.txt' INTO TABLE W0CASE FIELDS TERMINATED BY ',' LINES TERMINATED BY '/' (W0_TEST0) ;
SELECT * FROM W0CASE ORDER BY W0_TEST0 DESC ;
+----------+
| W0_TEST0 |
+----------+
        |
2       |
| 
| 
| 2        |
+----------+
SELECT LENGTH(W0_TEST0) FROM W0CASE ORDER BY W0_TEST0 DESC ;
+------------------+
| LENGTH(W0_TEST0) |
+------------------+
|                1 |
|                1 |
|                2 |
+------------------+
LOAD DATA INFILE 'data_for_mysqltest_loaddata/Load_Table_DM_mysql/A5.txt' INTO TABLE W0CASE FIELDS TERMINATED BY ',' LINES TERMINATED BY '/' (W0_TEST0) SET W0_TEST0 = 2;
SELECT * FROM W0CASE ORDER BY W0_TEST0 DESC ;
+----------+
| W0_TEST0 |
+----------+
        |
2       |
| 
| 
| 2        |
| 2        |
| 2        |
| 2        |
+----------+
SELECT LENGTH(W0_TEST0) FROM W0CASE ORDER BY W0_TEST0 DESC ;
+------------------+
| LENGTH(W0_TEST0) |
+------------------+
|                1 |
|                1 |
|                1 |
|                1 |
|                1 |
|                2 |
+------------------+
DROP TABLE W0CASE ;

CREATE TABLE W0CASE (W0_TEST0 INT);
LOAD DATA INFILE 'data_for_mysqltest_loaddata/Load_Table_DM_mysql/A6.txt' INTO TABLE W0CASE FIELDS TERMINATED BY ',' LINES TERMINATED BY '/' (W0_TEST0) ;
SELECT * FROM W0CASE ORDER BY W0_TEST0 DESC ;
+----------+
| W0_TEST0 |
+----------+
|        2 |
|        2 |
+----------+
SELECT LENGTH(W0_TEST0) FROM W0CASE;
+------------------+
| LENGTH(W0_TEST0) |
+------------------+
|                1 |
|                1 |
+------------------+
LOAD DATA INFILE 'data_for_mysqltest_loaddata/Load_Table_DM_mysql/A6.txt' INTO TABLE W0CASE FIELDS TERMINATED BY ',' LINES TERMINATED BY '/' (W0_TEST0) SET W0_TEST0 = 2;
SELECT * FROM W0CASE ORDER BY W0_TEST0 DESC ;
+----------+
| W0_TEST0 |
+----------+
|        2 |
|        2 |
|        2 |
|        2 |
+----------+
SELECT LENGTH(W0_TEST0) FROM W0CASE;
+------------------+
| LENGTH(W0_TEST0) |
+------------------+
|                1 |
|                1 |
|                1 |
|                1 |
+------------------+
DROP TABLE W0CASE ;

CREATE TABLE W0CASE (W0_TEST0 CHAR(10), W0_TEST1 VARCHAR(10), W0_TEST2 ENUM('1','g'), W0_TEST3 SET('2','h'));
LOAD DATA INFILE 'data_for_mysqltest_loaddata/Load_Table_DM_mysql/A7.txt' INTO TABLE W0CASE FIELDS TERMINATED BY ',' LINES TERMINATED BY '/' (W0_TEST1) SET W0_TEST3 = 'h';
SELECT * FROM W0CASE ORDER BY W0_TEST0 DESC , W0_TEST1 DESC , W0_TEST3 DESC;
+----------+----------+----------+----------+
| W0_TEST0 | W0_TEST1 | W0_TEST2 | W0_TEST3 |
+----------+----------+----------+----------+
| NULL     | 2        | NULL     | h        |
| NULL     | h        | NULL     | h        |
+----------+----------+----------+----------+
DROP TABLE W0CASE ;

CREATE TABLE W0CASE (W0_TEST0 CHAR(10), W0_TEST1 VARCHAR(10), W0_TEST2 ENUM('1','g'), W0_TEST3 SET('2','h'));
LOAD DATA INFILE 'data_for_mysqltest_loaddata/Load_Table_DM_mysql/A7.txt' INTO TABLE W0CASE FIELDS TERMINATED BY ',' LINES TERMINATED BY '/' (W0_TEST3) SET W0_TEST3 = 'h';
SELECT * FROM W0CASE ORDER BY W0_TEST0 DESC , W0_TEST1 DESC , W0_TEST3 DESC;
+----------+----------+----------+----------+
| W0_TEST0 | W0_TEST1 | W0_TEST2 | W0_TEST3 |
+----------+----------+----------+----------+
| NULL     | NULL     | NULL     | h        |
| NULL     | NULL     | NULL     | h        |
+----------+----------+----------+----------+
DROP TABLE W0CASE ;

SET @AA2 = 10;

CREATE TABLE W0CASE (W0_TEST0 CHAR(10), W0_TEST1 VARCHAR(10), W0_TEST2 ENUM('1','g'), W0_TEST3 SET('2','h'));
LOAD DATA INFILE 'data_for_mysqltest_loaddata/Load_Table_DM_mysql/A7.txt' INTO TABLE W0CASE FIELDS TERMINATED BY ',' LINES TERMINATED BY '/' (@AA2,W0_TEST3) SET W0_TEST3 = 'h';
SELECT * FROM W0CASE ORDER BY W0_TEST0 DESC , W0_TEST1 DESC , W0_TEST3 DESC;
+----------+----------+----------+----------+
| W0_TEST0 | W0_TEST1 | W0_TEST2 | W0_TEST3 |
+----------+----------+----------+----------+
| NULL     | NULL     | NULL     | h        |
| NULL     | NULL     | NULL     | h        |
+----------+----------+----------+----------+
DROP TABLE W0CASE ;

CREATE TABLE W0CASE (W0_TEST0 CHAR(10), W0_TEST1 TIME, W0_TEST2 REAL, W0_TEST3 SET('2','h'));
#BUG: 
LOAD DATA INFILE 'data_for_mysqltest_loaddata/Load_Table_DM_mysql/A8.txt' INTO TABLE W0CASE FIELDS TERMINATED BY ',' LINES TERMINATED BY '/' (@AA2,W0_TEST3,@AA2,@AA2) SET W0_TEST3 = 'h';
SELECT * FROM W0CASE ORDER BY W0_TEST0 DESC , W0_TEST1 DESC , W0_TEST3 DESC;
+----------+----------+----------+----------+
| W0_TEST0 | W0_TEST1 | W0_TEST2 | W0_TEST3 |
+----------+----------+----------+----------+
| NULL     | NULL     |     NULL | h        |
+----------+----------+----------+----------+
DROP TABLE W0CASE ;

#和上面一样的set的问题
CREATE TABLE W0CASE (W0_TEST0 CHAR(10), W0_TEST1 TIME, W0_TEST2 REAL, W0_TEST3 TIME);
LOAD DATA INFILE 'data_for_mysqltest_loaddata/Load_Table_DM_mysql/A9.txt' INTO TABLE W0CASE FIELDS TERMINATED BY ',' LINES TERMINATED BY '/' (@AA2,W0_TEST3,@AA2,@AA2) SET W0_TEST3 = '001000';
SELECT * FROM W0CASE ORDER BY W0_TEST0 DESC , W0_TEST1 DESC , W0_TEST3 DESC;
+----------+----------+----------+----------+
| W0_TEST0 | W0_TEST1 | W0_TEST2 | W0_TEST3 |
+----------+----------+----------+----------+
| NULL     | NULL     |     NULL | 00:10:00 |
+----------+----------+----------+----------+
DROP TABLE W0CASE ;

#和上面一样的set的问题
CREATE TABLE W0CASE (W0_TEST0 CHAR(10), W0_TEST1 TIME, W0_TEST2 REAL, W0_TEST3 TIME);
LOAD DATA INFILE 'data_for_mysqltest_loaddata/Load_Table_DM_mysql/A9.txt' INTO TABLE W0CASE FIELDS TERMINATED BY ',' LINES TERMINATED BY '/' (W0_TEST0,@AA2,W0_TEST3,@AA2) SET W0_TEST3 = '001000';
SELECT * FROM W0CASE;
+----------+----------+----------+----------+
| W0_TEST0 | W0_TEST1 | W0_TEST2 | W0_TEST3 |
+----------+----------+----------+----------+
| 啊       | NULL     |     NULL | 00:10:00 |
+----------+----------+----------+----------+
DROP TABLE W0CASE ;

CREATE TABLE W0CASE (W0_TEST0 CHAR(10), W0_TEST1 TIME, W0_TEST2 REAL, W0_TEST3 TIME);
LOAD DATA INFILE 'data_for_mysqltest_loaddata/Load_Table_DM_mysql/A9.txt' INTO TABLE W0CASE FIELDS TERMINATED BY ',' LINES TERMINATED BY '/' (W0_TEST0,@AA2,W0_TEST3,@AA2) SET W0_TEST3 = DEFAULT;
SELECT * FROM W0CASE;
+----------+----------+----------+----------+
| W0_TEST0 | W0_TEST1 | W0_TEST2 | W0_TEST3 |
+----------+----------+----------+----------+
| 啊       | NULL     |     NULL | NULL     |
+----------+----------+----------+----------+
DROP TABLE W0CASE ;

CREATE TABLE W0CASE (W0_TEST0 CHAR(10), W0_TEST1 TIME, W0_TEST2 DATETIME, W0_TEST3 YEAR);
LOAD DATA INFILE 'data_for_mysqltest_loaddata/Load_Table_DM_mysql/A10.txt' INTO TABLE W0CASE FIELDS TERMINATED BY ',' LINES TERMINATED BY '/' (W0_TEST0,@AA2,@AA2,W0_TEST3) SET W0_TEST3 = YEAR(1999);
SELECT * FROM W0CASE;
+----------+----------+----------+----------+
| W0_TEST0 | W0_TEST1 | W0_TEST2 | W0_TEST3 |
+----------+----------+----------+----------+
| AA       | NULL     | NULL     |     NULL |
+----------+----------+----------+----------+
DROP TABLE W0CASE ;

#obmysql_mysql_load_1_3_3
#obmysql_mysql_load_1_3_3_1
CREATE TABLE W0CASE ( W0_TEST0 CHAR(100), W0_TEST1 CHAR(100) GENERATED ALWAYS AS (W0_TEST0), W0_TEST2 INT  );
LOAD DATA INFILE 'data_for_mysqltest_loaddata/Load_Table_DM_mysql/A11.txt' INTO TABLE W0CASE FIELDS TERMINATED BY ',' LINES TERMINATED BY '/' (W0_TEST0,W0_TEST2) ;
SELECT * FROM W0CASE;
+----------+----------+----------+
| W0_TEST0 | W0_TEST1 | W0_TEST2 |
+----------+----------+----------+
| a，      | a，      |      123 |
+----------+----------+----------+
DROP TABLE W0CASE ;

#BUG: 
CREATE TABLE W0CASE ( W0_TEST0 CHAR(100), W0_TEST1 CHAR(100) GENERATED ALWAYS AS (W0_TEST0), W0_TEST2 INT  );
LOAD DATA INFILE 'data_for_mysqltest_loaddata/Load_Table_DM_mysql/A11.txt' INTO TABLE W0CASE FIELDS TERMINATED BY ',' LINES TERMINATED BY '/' (W0_TEST0,W0_TEST2) SET W0_TEST0 = POWER(1999,1);
SELECT * FROM W0CASE;
+----------+----------+----------+
| W0_TEST0 | W0_TEST1 | W0_TEST2 |
+----------+----------+----------+
| 1999     | 1999     |      123 |
+----------+----------+----------+
DROP TABLE W0CASE ;

#对虚拟列的支持程度
CREATE TABLE W0CASE ( W0_TEST0 CHAR(100), W0_TEST1 CHAR(100) GENERATED ALWAYS AS (W0_TEST0), W0_TEST2 INT  );
LOAD DATA INFILE 'data_for_mysqltest_loaddata/Load_Table_DM_mysql/A11.txt' INTO TABLE W0CASE FIELDS TERMINATED BY ',' LINES TERMINATED BY '/' (W0_TEST0,W0_TEST2) SET W0_TEST1 = POWER(1999,1);
ERROR HY000: The value specified for generated column 'W0_TEST1' in table 'w0case' is not allowed
SELECT * FROM W0CASE;
+----------+----------+----------+
| W0_TEST0 | W0_TEST1 | W0_TEST2 |
+----------+----------+----------+
+----------+----------+----------+
DROP TABLE W0CASE ;

#对虚拟列的支持程度
CREATE TABLE W0CASE ( W0_TEST0 CHAR(100), W0_TEST1 CHAR(100) GENERATED ALWAYS AS (W0_TEST0), W0_TEST2 INT  );
LOAD DATA INFILE 'data_for_mysqltest_loaddata/Load_Table_DM_mysql/A11.txt' INTO TABLE W0CASE FIELDS TERMINATED BY ',' LINES TERMINATED BY '/' (W0_TEST1,W0_TEST2) SET W0_TEST1 = POWER(1999,1);
ERROR HY000: The value specified for generated column 'W0_TEST1' in table 'w0case' is not allowed
SELECT * FROM W0CASE;
+----------+----------+----------+
| W0_TEST0 | W0_TEST1 | W0_TEST2 |
+----------+----------+----------+
+----------+----------+----------+
DROP TABLE W0CASE ;

#对虚拟列的支持程度
CREATE TABLE W0CASE ( W0_TEST0 CHAR(100), W0_TEST1 CHAR(100) GENERATED ALWAYS AS (W0_TEST0), W0_TEST2 INT  );
LOAD DATA INFILE 'data_for_mysqltest_loaddata/Load_Table_DM_mysql/A11.txt' INTO TABLE W0CASE FIELDS TERMINATED BY ',' LINES TERMINATED BY '/' (@AA2,@AA2,@AA2) SET W0_TEST1 = POWER(1999,1);
ERROR HY000: The value specified for generated column 'W0_TEST1' in table 'w0case' is not allowed
SELECT * FROM W0CASE;
+----------+----------+----------+
| W0_TEST0 | W0_TEST1 | W0_TEST2 |
+----------+----------+----------+
+----------+----------+----------+
DROP TABLE W0CASE ;

#obmysql_mysql_load_1_2_1_1
CREATE TABLE W0CASE (W0_TEST0 CHAR(100), W0_TEST1 MEDIUMINT );
#set的设定函数的问题
LOAD DATA INFILE 'data_for_mysqltest_loaddata/Load_Table_DM_mysql/A12.txt' INTO TABLE W0CASE FIELDS TERMINATED BY ',' LINES TERMINATED BY '/' (W0_TEST0,W0_TEST1) SET W0_TEST1 = POWER(1999,1);
SELECT * FROM W0CASE;
+----------+----------+
| W0_TEST0 | W0_TEST1 |
+----------+----------+
| A        |     1999 |
+----------+----------+
ALTER TABLE W0CASE ADD W0_TEST00 CHAR(100) FIRST;
LOAD DATA INFILE 'data_for_mysqltest_loaddata/Load_Table_DM_mysql/A13.txt' INTO TABLE W0CASE FIELDS TERMINATED BY ',' LINES TERMINATED BY '/' (W0_TEST00 , W0_TEST0 , W0_TEST1) ;
SELECT * FROM W0CASE;
+-----------+----------+----------+
| W0_TEST00 | W0_TEST0 | W0_TEST1 |
+-----------+----------+----------+
| 1         | 2        |        3 |
| NULL      | A        |     1999 |
+-----------+----------+----------+
LOAD DATA INFILE 'data_for_mysqltest_loaddata/Load_Table_DM_mysql/A13.txt' INTO TABLE W0CASE FIELDS TERMINATED BY ',' LINES TERMINATED BY '/' (W0_TEST00 , W0_TEST0 , W0_TEST1) SET W0_TEST00 = 123;
SELECT * FROM W0CASE;
+-----------+----------+----------+
| W0_TEST00 | W0_TEST0 | W0_TEST1 |
+-----------+----------+----------+
| 1         | 2        |        3 |
| 123       | 2        |        3 |
| NULL      | A        |     1999 |
+-----------+----------+----------+
DROP TABLE W0CASE ;

CREATE TABLE W0CASE (W0_TEST0 INT, W0_TEST1 VARCHAR(100) );
LOAD DATA INFILE 'data_for_mysqltest_loaddata/Load_Table_DM_mysql/A14.txt' INTO TABLE W0CASE FIELDS TERMINATED BY ',' LINES TERMINATED BY '/' (W0_TEST0,W0_TEST1) SET W0_TEST1 = POWER(1999,1);
SELECT * FROM W0CASE;
+----------+----------+
| W0_TEST0 | W0_TEST1 |
+----------+----------+
|        1 | 1999     |
+----------+----------+
ALTER TABLE W0CASE ADD W0_TEST00 TIME FIRST;
LOAD DATA INFILE 'data_for_mysqltest_loaddata/Load_Table_DM_mysql/A15.txt' INTO TABLE W0CASE FIELDS TERMINATED BY ',' LINES TERMINATED BY '/' (W0_TEST00 , W0_TEST0 , W0_TEST1) ;
SELECT * FROM W0CASE;
+-----------+----------+----------+
| W0_TEST00 | W0_TEST0 | W0_TEST1 |
+-----------+----------+----------+
     |
| 00:20:00  |        1 | AAA
| NULL      |        1 | 1999     |
+-----------+----------+----------+
LOAD DATA INFILE 'data_for_mysqltest_loaddata/Load_Table_DM_mysql/A15.txt' INTO TABLE W0CASE FIELDS TERMINATED BY ',' LINES TERMINATED BY '/' (W0_TEST00 , W0_TEST0 , W0_TEST1) SET W0_TEST00 = '005900';
SELECT * FROM W0CASE;
+-----------+----------+----------+
| W0_TEST00 | W0_TEST0 | W0_TEST1 |
+-----------+----------+----------+
     |
     |
| 00:20:00  |        1 | AAA
| 00:59:00  |        1 | AAA
| NULL      |        1 | 1999     |
+-----------+----------+----------+
DROP TABLE W0CASE ;

CREATE TABLE W0CASE (W0_TEST0 INT, W0_TEST1 VARCHAR(100), W0_TEST2 TIME );
#BUG: 
LOAD DATA INFILE 'data_for_mysqltest_loaddata/Load_Table_DM_mysql/A16.txt' INTO TABLE W0CASE FIELDS TERMINATED BY ',' LINES TERMINATED BY '/' (W0_TEST0 , W0_TEST1 , W0_TEST2) ;
SELECT * FROM W0CASE;
+----------+----------+----------+
| W0_TEST0 | W0_TEST1 | W0_TEST2 |
+----------+----------+----------+
|        1 | AAA      | 00:10:00 |
|        2 | BB       | 00:11:00 |
+----------+----------+----------+
ALTER TABLE W0CASE DROP W0_TEST0;
LOAD DATA INFILE 'data_for_mysqltest_loaddata/Load_Table_DM_mysql/A17.txt' INTO TABLE W0CASE FIELDS TERMINATED BY ',' LINES TERMINATED BY '/' ( W0_TEST1 , W0_TEST2) ;
SELECT * FROM W0CASE;
+----------+----------+
| W0_TEST1 | W0_TEST2 |
+----------+----------+
| AAA      | 00:10:00 |
| BB       | 00:11:00 |
| CCC      | 00:21:00 |
| DDDDD    | 00:32:00 |
+----------+----------+
LOAD DATA INFILE 'data_for_mysqltest_loaddata/Load_Table_DM_mysql/A17.txt' INTO TABLE W0CASE FIELDS TERMINATED BY ',' LINES TERMINATED BY '/' ( W0_TEST1 , W0_TEST2) SET W0_TEST1 = 'FFF';
SELECT * FROM W0CASE;
+----------+----------+
| W0_TEST1 | W0_TEST2 |
+----------+----------+
| AAA      | 00:10:00 |
| BB       | 00:11:00 |
| CCC      | 00:21:00 |
| DDDDD    | 00:32:00 |
| FFF      | 00:21:00 |
| FFF      | 00:32:00 |
+----------+----------+
DROP TABLE W0CASE ;

#obmysql_mysql_load_1_2_1_2
CREATE TABLE W0CASE ( W0_TEST0 INT , W0_TEST1 VARCHAR(100) , W0_TEST2 DATE );
LOAD DATA INFILE 'data_for_mysqltest_loaddata/Load_Table_DM_mysql/A18.txt' INTO TABLE W0CASE FIELDS TERMINATED BY ',' LINES TERMINATED BY '/' (W0_TEST0 , W0_TEST1 , W0_TEST2) ;
SELECT * FROM W0CASE ORDER BY W0_TEST0 DESC , W0_TEST1 DESC ,W0_TEST2 DESC;
+----------+----------+------------+
| W0_TEST0 | W0_TEST1 | W0_TEST2   |
+----------+----------+------------+
|        1 | AAA      | 2020-02-20 |
|        2 | BBB      | 2020-12-21 |
+----------+----------+------------+
ALTER TABLE W0CASE DROP W0_TEST2;
LOAD DATA INFILE 'data_for_mysqltest_loaddata/Load_Table_DM_mysql/A18.txt' INTO TABLE W0CASE FIELDS TERMINATED BY ',' LINES TERMINATED BY '/' (W0_TEST0 , W0_TEST1) ;
LOAD DATA INFILE 'data_for_mysqltest_loaddata/Load_Table_DM_mysql/A19.txt' INTO TABLE W0CASE FIELDS TERMINATED BY ',' LINES TERMINATED BY '/' (W0_TEST0 , W0_TEST1) ;
SELECT * FROM W0CASE ORDER BY W0_TEST0 DESC , W0_TEST1 DESC ;
+----------+----------+
| W0_TEST0 | W0_TEST1 |
+----------+----------+

     |
    |
|        1 | AAA      |
|        1 | AAA      |
|        2 | BBB      |
|        2 | BBB      |
|        3 | CCC
|        4 | DDD
+----------+----------+
DELETE FROM W0CASE;
LOAD DATA INFILE 'data_for_mysqltest_loaddata/Load_Table_DM_mysql/A19.txt' INTO TABLE W0CASE FIELDS TERMINATED BY ',' LINES TERMINATED BY '/' (W0_TEST0 , W0_TEST1) SET W0_TEST0 = 5, W0_TEST1 = 'FFF';
SELECT * FROM W0CASE ORDER BY W0_TEST0 DESC , W0_TEST1 DESC ;
+----------+----------+
| W0_TEST0 | W0_TEST1 |
+----------+----------+
|        5 | FFF      |
|        5 | FFF      |
+----------+----------+
DROP TABLE W0CASE ;

CREATE TABLE W0CASE ( W0_TEST0 INT , W0_TEST1 VARCHAR(100) );
LOAD DATA INFILE 'data_for_mysqltest_loaddata/Load_Table_DM_mysql/A19.txt' INTO TABLE W0CASE FIELDS TERMINATED BY ',' LINES TERMINATED BY '/' (W0_TEST0 , W0_TEST1) SET W0_TEST0 = 5, W0_TEST1 = 'FFF';
SELECT * FROM W0CASE ORDER BY W0_TEST0 DESC , W0_TEST1 DESC;
+----------+----------+
| W0_TEST0 | W0_TEST1 |
+----------+----------+
|        5 | FFF      |
|        5 | FFF      |
+----------+----------+
ALTER TABLE W0CASE ADD W0_TEST2 DATE ;
LOAD DATA INFILE 'data_for_mysqltest_loaddata/Load_Table_DM_mysql/A18.txt' INTO TABLE W0CASE FIELDS TERMINATED BY ',' LINES TERMINATED BY '/' (W0_TEST0 , W0_TEST1 , W0_TEST2) ;
SELECT * FROM W0CASE ORDER BY W0_TEST0 DESC , W0_TEST1 DESC;
+----------+----------+------------+
| W0_TEST0 | W0_TEST1 | W0_TEST2   |
+----------+----------+------------+
|        1 | AAA      | 2020-02-20 |
|        2 | BBB      | 2020-12-21 |
|        5 | FFF      | NULL       |
|        5 | FFF      | NULL       |
+----------+----------+------------+
DELETE FROM W0CASE;
LOAD DATA INFILE 'data_for_mysqltest_loaddata/Load_Table_DM_mysql/A18.txt' INTO TABLE W0CASE FIELDS TERMINATED BY ',' LINES TERMINATED BY '/' (W0_TEST0 , W0_TEST1 , W0_TEST2) SET W0_TEST0 = 4, W0_TEST1 = 'ABCD', W0_TEST2 = '2020-12-21';
SELECT * FROM W0CASE ORDER BY W0_TEST0 DESC , W0_TEST1 DESC;
+----------+----------+------------+
| W0_TEST0 | W0_TEST1 | W0_TEST2   |
+----------+----------+------------+
|        4 | ABCD     | 2020-12-21 |
|        4 | ABCD     | 2020-12-21 |
+----------+----------+------------+
DROP TABLE W0CASE ;

#obmysql_mysql_load_1_2_1_3
CREATE TABLE W0CASE ( W0_TEST0 INT , W0_TEST1 VARCHAR(100) );
LOAD DATA INFILE 'data_for_mysqltest_loaddata/Load_Table_DM_mysql/A20.txt' INTO TABLE W0CASE FIELDS TERMINATED BY ',' LINES TERMINATED BY '/' (W0_TEST0 , W0_TEST1 ) ;
SELECT * FROM W0CASE ORDER BY W0_TEST0 DESC , W0_TEST1 DESC ;
+----------+----------+
| W0_TEST0 | W0_TEST1 |
+----------+----------+
       |
       |
       |
|        1 | A
|        2 | B
|        3 | C
+----------+----------+
ALTER TABLE W0CASE ADD W0_TEST01 TIME DEFAULT '003300' AFTER W0_TEST0;
DELETE FROM W0CASE;
LOAD DATA INFILE 'data_for_mysqltest_loaddata/Load_Table_DM_mysql/A21.txt' INTO TABLE W0CASE FIELDS TERMINATED BY ',' LINES TERMINATED BY '/' (W0_TEST0 , @AA2 , W0_TEST1 ) ;
SELECT * FROM W0CASE ORDER BY W0_TEST0 DESC , W0_TEST1 DESC ;
+----------+-----------+----------+
| W0_TEST0 | W0_TEST01 | W0_TEST1 |
+----------+-----------+----------+
       |
       |
|        4 | 00:33:00  | D
|        5 | 00:33:00  | E
+----------+-----------+----------+
DELETE FROM W0CASE;
LOAD DATA INFILE 'data_for_mysqltest_loaddata/Load_Table_DM_mysql/A21.txt' INTO TABLE W0CASE FIELDS TERMINATED BY ',' LINES TERMINATED BY '/' (W0_TEST0 , W0_TEST01 , W0_TEST1 ) ;
SELECT * FROM W0CASE ORDER BY W0_TEST0 DESC , W0_TEST1 DESC ;
+----------+-----------+----------+
| W0_TEST0 | W0_TEST01 | W0_TEST1 |
+----------+-----------+----------+
       |
       |
|        4 | 00:40:00  | D
|        5 | 00:50:01  | E
+----------+-----------+----------+
DELETE FROM W0CASE;
LOAD DATA INFILE 'data_for_mysqltest_loaddata/Load_Table_DM_mysql/A21.txt' INTO TABLE W0CASE FIELDS TERMINATED BY ',' LINES TERMINATED BY '/' (W0_TEST0 , W0_TEST01 , W0_TEST1 ) SET W0_TEST01 = '100101';
SELECT * FROM W0CASE ORDER BY W0_TEST0 DESC , W0_TEST1 DESC ;
+----------+-----------+----------+
| W0_TEST0 | W0_TEST01 | W0_TEST1 |
+----------+-----------+----------+
       |
       |
|        4 | 10:01:01  | D
|        5 | 10:01:01  | E
+----------+-----------+----------+
DROP TABLE W0CASE ;

CREATE TABLE W0CASE ( W0_TEST0 INT , W0_TEST1 VARCHAR(100) );
LOAD DATA INFILE 'data_for_mysqltest_loaddata/Load_Table_DM_mysql/A20.txt' INTO TABLE W0CASE FIELDS TERMINATED BY ',' LINES TERMINATED BY '/' (W0_TEST0 , W0_TEST1 ) ;
SELECT * FROM W0CASE ORDER BY W0_TEST0 DESC , W0_TEST1 DESC;
+----------+----------+
| W0_TEST0 | W0_TEST1 |
+----------+----------+
       |
       |
       |
|        1 | A
|        2 | B
|        3 | C
+----------+----------+
ALTER TABLE W0CASE ADD W0_TEST02 TIME DEFAULT '003300' AFTER W0_TEST0;
ALTER TABLE W0CASE ADD W0_TEST01 CHAR(100) DEFAULT 'W0_TEST01' AFTER W0_TEST0;
SELECT * FROM W0CASE ORDER BY W0_TEST0 DESC , W0_TEST1 DESC;
+----------+-----------+-----------+----------+
| W0_TEST0 | W0_TEST01 | W0_TEST02 | W0_TEST1 |
+----------+-----------+-----------+----------+
       |
       |
       |
|        1 | W0_TEST01 | 00:33:00  | A
|        2 | W0_TEST01 | 00:33:00  | B
|        3 | W0_TEST01 | 00:33:00  | C
+----------+-----------+-----------+----------+
DELETE FROM W0CASE;
LOAD DATA INFILE 'data_for_mysqltest_loaddata/Load_Table_DM_mysql/A22.txt' INTO TABLE W0CASE FIELDS TERMINATED BY ',' LINES TERMINATED BY '/' (W0_TEST0 , @AA2 , @AA2 , W0_TEST1 ) ;
SELECT * FROM W0CASE ORDER BY W0_TEST0 DESC , W0_TEST1 DESC;
+----------+-----------+-----------+----------+
| W0_TEST0 | W0_TEST01 | W0_TEST02 | W0_TEST1 |
+----------+-----------+-----------+----------+
       |
       |
|        1 | W0_TEST01 | 00:33:00  | D
|        2 | W0_TEST01 | 00:33:00  | E
+----------+-----------+-----------+----------+
DELETE FROM W0CASE;
LOAD DATA INFILE 'data_for_mysqltest_loaddata/Load_Table_DM_mysql/A22.txt' INTO TABLE W0CASE FIELDS TERMINATED BY ',' LINES TERMINATED BY '/' (W0_TEST0 , W0_TEST01 , W0_TEST02 , W0_TEST1 ) SET W0_TEST01 = 'W0_TEST00001', W0_TEST02 = '005911';
SELECT * FROM W0CASE ORDER BY W0_TEST0 DESC , W0_TEST1 DESC;
+----------+--------------+-----------+----------+
| W0_TEST0 | W0_TEST01    | W0_TEST02 | W0_TEST1 |
+----------+--------------+-----------+----------+
       |
       |
|        1 | W0_TEST00001 | 00:59:11  | D
|        2 | W0_TEST00001 | 00:59:11  | E
+----------+--------------+-----------+----------+
ALTER TABLE W0CASE DROP W0_TEST02;
LOAD DATA INFILE 'data_for_mysqltest_loaddata/Load_Table_DM_mysql/A23.txt' INTO TABLE W0CASE FIELDS TERMINATED BY ',' LINES TERMINATED BY '/' (W0_TEST0 , W0_TEST01 , W0_TEST1 ) SET W0_TEST01 = 'W0_TEST00001';
SELECT * FROM W0CASE ORDER BY W0_TEST0 DESC , W0_TEST1 DESC;
+----------+--------------+----------+
| W0_TEST0 | W0_TEST01    | W0_TEST1 |
+----------+--------------+----------+
       |
       |
       |
|        1 | W0_TEST00001 | D
|        2 | W0_TEST00001 | E
|        4 | W0_TEST00001 | G
+----------+--------------+----------+
DELETE FROM W0CASE;
LOAD DATA INFILE 'data_for_mysqltest_loaddata/Load_Table_DM_mysql/A23.txt' INTO TABLE W0CASE FIELDS TERMINATED BY ',' LINES TERMINATED BY '/' (W0_TEST0 , W0_TEST01 , W0_TEST1 ) SET W0_TEST01 = 'W0_TEST00001' , W0_TEST0 = 10, W0_TEST1 = 'SAD';
SELECT * FROM W0CASE ORDER BY W0_TEST0 DESC , W0_TEST1 DESC;
+----------+--------------+----------+
| W0_TEST0 | W0_TEST01    | W0_TEST1 |
+----------+--------------+----------+
|       10 | W0_TEST00001 | SAD      |
+----------+--------------+----------+
DROP TABLE W0CASE ;

#obmysql_mysql_load_1_3_2
#obmysql_mysql_load_1_3_2_1
#obmysql_mysql_load_1_3_2_1_1
CREATE TABLE W0CASE ( W0_TEST0 INT , W0_TEST1 CHAR(100) )
            PARTITION BY RANGE COLUMNS (W0_TEST0)
            ( PARTITION P0 VALUES LESS THAN (10), PARTITION P1 VALUES LESS THAN (20) );
LOAD DATA INFILE 'data_for_mysqltest_loaddata/Load_Table_DM_mysql/A24.txt' INTO TABLE W0CASE FIELDS TERMINATED BY ',' LINES TERMINATED BY '/' (W0_TEST0 , W0_TEST1 ) ;
ERROR HY000: Table has no partition for value
SELECT * FROM W0CASE;
+----------+----------+
| W0_TEST0 | W0_TEST1 |
+----------+----------+
+----------+----------+
LOAD DATA INFILE 'data_for_mysqltest_loaddata/Load_Table_DM_mysql/A25.txt' INTO TABLE W0CASE FIELDS TERMINATED BY ',' LINES TERMINATED BY '/' (W0_TEST0 , W0_TEST1 ) SET W0_TEST0 = 21;
ERROR HY000: Table has no partition for value
SELECT * FROM W0CASE;
+----------+----------+
| W0_TEST0 | W0_TEST1 |
+----------+----------+
+----------+----------+
LOAD DATA INFILE 'data_for_mysqltest_loaddata/Load_Table_DM_mysql/A25.txt' INTO TABLE W0CASE FIELDS TERMINATED BY ',' LINES TERMINATED BY '/' (W0_TEST0 , W0_TEST1 );
SELECT * FROM W0CASE PARTITION (P0) ORDER BY W0_TEST0 DESC , W0_TEST1 DESC;
+----------+----------+
| W0_TEST0 | W0_TEST1 |
+----------+----------+
       |
|        1 | A
+----------+----------+
SELECT * FROM W0CASE PARTITION (P1) ORDER BY W0_TEST0 DESC , W0_TEST1 DESC;
+----------+----------+
| W0_TEST0 | W0_TEST1 |
+----------+----------+
       |
|       11 | B
+----------+----------+
DELETE FROM W0CASE;
#BUG: 
LOAD DATA INFILE 'data_for_mysqltest_loaddata/Load_Table_DM_mysql/A25.txt' INTO TABLE W0CASE FIELDS TERMINATED BY ',' LINES TERMINATED BY '/' (W0_TEST0 , W0_TEST1 ) SET W0_TEST0 = 12;
SELECT * FROM W0CASE PARTITION (P0) ORDER BY W0_TEST0 DESC , W0_TEST1 DESC;
+----------+----------+
| W0_TEST0 | W0_TEST1 |
+----------+----------+
+----------+----------+
SELECT * FROM W0CASE PARTITION (P1) ORDER BY W0_TEST0 DESC , W0_TEST1 DESC;
+----------+----------+
| W0_TEST0 | W0_TEST1 |
+----------+----------+
       |
       |
|       12 | A
|       12 | B
+----------+----------+
DELETE FROM W0CASE;
LOAD DATA INFILE 'data_for_mysqltest_loaddata/Load_Table_DM_mysql/A25.txt' INTO TABLE W0CASE FIELDS TERMINATED BY ',' LINES TERMINATED BY '/' (@AA1, W0_TEST1 ) ;
SELECT * FROM W0CASE PARTITION (P0) ORDER BY W0_TEST0 DESC , W0_TEST1 DESC;
+----------+----------+
| W0_TEST0 | W0_TEST1 |
+----------+----------+
       |
       |
|     NULL | A
|     NULL | B
+----------+----------+
SELECT * FROM W0CASE PARTITION (P1) ORDER BY W0_TEST0 DESC , W0_TEST1 DESC;
+----------+----------+
| W0_TEST0 | W0_TEST1 |
+----------+----------+
+----------+----------+
DELETE FROM W0CASE;
LOAD DATA INFILE 'data_for_mysqltest_loaddata/Load_Table_DM_mysql/A26.txt' INTO TABLE W0CASE FIELDS TERMINATED BY ',' LINES TERMINATED BY '/' (W0_TEST0, W0_TEST1 ) ;
SELECT * FROM W0CASE PARTITION (P0) ORDER BY W0_TEST0 DESC , W0_TEST1 DESC;
+----------+-----------+
| W0_TEST0 | W0_TEST1  |
+----------+-----------+
        |
     |
    |
 |
|        1 | A
|        2 | DATE
|        3 | W0_TEST0
|        7 | DATE1
+----------+-----------+
SELECT * FROM W0CASE PARTITION (P1) ORDER BY W0_TEST0 DESC , W0_TEST1 DESC;
+----------+----------+
| W0_TEST0 | W0_TEST1 |
+----------+----------+
       |
       |
    |
    |
|       11 | B
|       13 | DATE
|       18 | SDAD
|       19 | C
+----------+----------+
DROP TABLE W0CASE ;

#obmysql_mysql_load_1_3_2_1_2
CREATE TABLE W0CASE ( W0_TEST0 INT , W0_TEST1 CHAR(100) )
            PARTITION BY LIST COLUMNS (W0_TEST0)
            ( PARTITION P0 VALUES IN (0,1,2,3,4,5,6,7,8,9), PARTITION P1 VALUES IN (10,11,12,13,14,15,16,17,18,19,20) );
LOAD DATA INFILE 'data_for_mysqltest_loaddata/Load_Table_DM_mysql/A27.txt' INTO TABLE W0CASE FIELDS TERMINATED BY ',' LINES TERMINATED BY '/' (W0_TEST0, W0_TEST1 ) ;
SELECT * FROM W0CASE PARTITION (P0) ORDER BY W0_TEST0 DESC ;
+----------+----------+
| W0_TEST0 | W0_TEST1 |
+----------+----------+
       |
|        0 | A
+----------+----------+
SELECT * FROM W0CASE PARTITION (P1) ORDER BY W0_TEST0 DESC ;
+----------+----------+
| W0_TEST0 | W0_TEST1 |
+----------+----------+
       |
|       10 | B
+----------+----------+
LOAD DATA INFILE 'data_for_mysqltest_loaddata/Load_Table_DM_mysql/A27.txt' INTO TABLE W0CASE FIELDS TERMINATED BY ',' LINES TERMINATED BY '/' (W0_TEST0, W0_TEST1 ) SET W0_TEST0 = 11 , W0_TEST1 = 'C';
SELECT * FROM W0CASE PARTITION (P0) ORDER BY W0_TEST0 DESC ;
+----------+----------+
| W0_TEST0 | W0_TEST1 |
+----------+----------+
       |
|        0 | A
+----------+----------+
SELECT * FROM W0CASE PARTITION (P1) ORDER BY W0_TEST0 DESC ;
+----------+----------+
| W0_TEST0 | W0_TEST1 |
+----------+----------+
       |
|       10 | B
|       11 | C        |
|       11 | C        |
+----------+----------+
DELETE FROM W0CASE ;
LOAD DATA INFILE 'data_for_mysqltest_loaddata/Load_Table_DM_mysql/A28.txt' INTO TABLE W0CASE FIELDS TERMINATED BY ',' LINES TERMINATED BY '/' (W0_TEST0, W0_TEST1 ) ;
SELECT * FROM W0CASE PARTITION (P0) ORDER BY W0_TEST0 DESC ;
+----------+----------+
| W0_TEST0 | W0_TEST1 |
+----------+----------+
       |
  |
|        0 | A
|        6 | EWQEQW
+----------+----------+
SELECT * FROM W0CASE PARTITION (P1) ORDER BY W0_TEST0 DESC ;
+----------+-----------+
| W0_TEST0 | W0_TEST1  |
+----------+-----------+
       |
     |
  |
 |
|       11 | BEGI
|       14 | BETWEEN
|       15 | CASCADED
|       20 | DF
+----------+-----------+
DROP TABLE W0CASE ;

#obmysql_mysql_load_1_3_2_1_3
CREATE TABLE W0CASE ( W0_TEST0 INT , W0_TEST1 CHAR(100) )
            PARTITION BY HASH ( W0_TEST0 + 1 )
            (PARTITION P0 , PARTITION P1 );
LOAD DATA INFILE 'data_for_mysqltest_loaddata/Load_Table_DM_mysql/A28.txt' INTO TABLE W0CASE FIELDS TERMINATED BY ',' LINES TERMINATED BY '/' (W0_TEST0, W0_TEST1 ) ;
SELECT * FROM W0CASE PARTITION (P0) ORDER BY W0_TEST0 DESC;
+----------+-----------+
| W0_TEST0 | W0_TEST1  |
+----------+-----------+
     |
 |
|       11 | BEGI
|       15 | CASCADED
+----------+-----------+
SELECT * FROM W0CASE PARTITION (P1) ORDER BY W0_TEST0 DESC;
+----------+----------+
| W0_TEST0 | W0_TEST1 |
+----------+----------+
       |
      |
  |
 |
|        0 | A
|        6 | EWQEQW
|       14 | BETWEEN
|       20 | DF
+----------+----------+
DELETE FROM W0CASE;
LOAD DATA INFILE 'data_for_mysqltest_loaddata/Load_Table_DM_mysql/A28.txt' INTO TABLE W0CASE FIELDS TERMINATED BY ',' LINES TERMINATED BY '/' (W0_TEST0, W0_TEST1 ) SET W0_TEST0 = 100, W0_TEST1 = 'DASDD';
SELECT * FROM W0CASE PARTITION (P0) ORDER BY W0_TEST0 DESC;
+----------+----------+
| W0_TEST0 | W0_TEST1 |
+----------+----------+
+----------+----------+
SELECT * FROM W0CASE PARTITION (P1) ORDER BY W0_TEST0 DESC;
+----------+----------+
| W0_TEST0 | W0_TEST1 |
+----------+----------+
|      100 | DASDD    |
|      100 | DASDD    |
|      100 | DASDD    |
|      100 | DASDD    |
|      100 | DASDD    |
|      100 | DASDD    |
+----------+----------+
DROP TABLE W0CASE ;

CREATE TABLE W0CASE ( W0_TEST0 INT , W0_TEST1 CHAR(100) )
            PARTITION BY KEY ( W0_TEST0 )
            (PARTITION P0 , PARTITION P1 );
LOAD DATA INFILE 'data_for_mysqltest_loaddata/Load_Table_DM_mysql/A28.txt' INTO TABLE W0CASE FIELDS TERMINATED BY ',' LINES TERMINATED BY '/' (W0_TEST0, W0_TEST1 ) ;
SELECT * FROM W0CASE PARTITION (P0) ORDER BY W0_TEST0 DESC;
+----------+----------+
| W0_TEST0 | W0_TEST1 |
+----------+----------+
      |
  |
 |
|        6 | EWQEQW
|       14 | BETWEEN
|       20 | DF
+----------+----------+
SELECT * FROM W0CASE PARTITION (P1) ORDER BY W0_TEST0 DESC;
+----------+-----------+
| W0_TEST0 | W0_TEST1  |
+----------+-----------+
        |
     |
 |
|        0 | A
|       11 | BEGI
|       15 | CASCADED
+----------+-----------+
DELETE FROM W0CASE;
LOAD DATA INFILE 'data_for_mysqltest_loaddata/Load_Table_DM_mysql/A28.txt' INTO TABLE W0CASE FIELDS TERMINATED BY ',' LINES TERMINATED BY '/' (W0_TEST0, W0_TEST1 ) SET W0_TEST0 = 100, W0_TEST1 = 'DASDD';
SELECT * FROM W0CASE PARTITION (P0) ORDER BY W0_TEST0 DESC;
+----------+----------+
| W0_TEST0 | W0_TEST1 |
+----------+----------+
|      100 | DASDD    |
|      100 | DASDD    |
|      100 | DASDD    |
|      100 | DASDD    |
|      100 | DASDD    |
|      100 | DASDD    |
+----------+----------+
SELECT * FROM W0CASE PARTITION (P1) ORDER BY W0_TEST0 DESC;
+----------+----------+
| W0_TEST0 | W0_TEST1 |
+----------+----------+
+----------+----------+
DROP TABLE W0CASE ;

#obmysql_mysql_load_1_3_2_2
CREATE TABLE W0CASE ( W0_TEST0 INT , W0_TEST1 CHAR(100) )
            PARTITION BY RANGE COLUMNS ( W0_TEST0 )
            SUBPARTITION BY HASH (W0_TEST0 + 1)
            ( PARTITION P0 VALUES LESS THAN (10) ( SUBPARTITION P00 , SUBPARTITION P01 ) , PARTITION P1 VALUES LESS THAN (30) ( SUBPARTITION P10 , SUBPARTITION P11));
LOAD DATA INFILE 'data_for_mysqltest_loaddata/Load_Table_DM_mysql/A28.txt' INTO TABLE W0CASE FIELDS TERMINATED BY ',' LINES TERMINATED BY '/' (W0_TEST0, W0_TEST1 ) ;
SELECT * FROM W0CASE PARTITION (P0) ORDER BY W0_TEST0 DESC;
+----------+----------+
| W0_TEST0 | W0_TEST1 |
+----------+----------+
       |
  |
|        0 | A
|        6 | EWQEQW
+----------+----------+
SELECT * FROM W0CASE PARTITION (P1) ORDER BY W0_TEST0 DESC;
+----------+-----------+
| W0_TEST0 | W0_TEST1  |
+----------+-----------+
       |
     |
  |
 |
|       11 | BEGI
|       14 | BETWEEN
|       15 | CASCADED
|       20 | DF
+----------+-----------+
SELECT * FROM W0CASE PARTITION (P00) ORDER BY W0_TEST0 DESC;
+----------+----------+
| W0_TEST0 | W0_TEST1 |
+----------+----------+
+----------+----------+
SELECT * FROM W0CASE PARTITION (P01) ORDER BY W0_TEST0 DESC;
+----------+----------+
| W0_TEST0 | W0_TEST1 |
+----------+----------+
       |
  |
|        0 | A
|        6 | EWQEQW
+----------+----------+
SELECT * FROM W0CASE PARTITION (P10) ORDER BY W0_TEST0 DESC;
+----------+-----------+
| W0_TEST0 | W0_TEST1  |
+----------+-----------+
     |
 |
|       11 | BEGI
|       15 | CASCADED
+----------+-----------+
SELECT * FROM W0CASE PARTITION (P11) ORDER BY W0_TEST0 DESC;
+----------+----------+
| W0_TEST0 | W0_TEST1 |
+----------+----------+
      |
 |
|       14 | BETWEEN
|       20 | DF
+----------+----------+
DELETE FROM W0CASE;
LOAD DATA INFILE 'data_for_mysqltest_loaddata/Load_Table_DM_mysql/A28.txt' INTO TABLE W0CASE FIELDS TERMINATED BY ',' LINES TERMINATED BY '/' (W0_TEST0, W0_TEST1 ) SET W0_TEST0 = 20, W0_TEST1 = 'DASDD';
SELECT * FROM W0CASE PARTITION (P0) ORDER BY W0_TEST0 DESC;
+----------+----------+
| W0_TEST0 | W0_TEST1 |
+----------+----------+
+----------+----------+
SELECT * FROM W0CASE PARTITION (P1) ORDER BY W0_TEST0 DESC;
+----------+----------+
| W0_TEST0 | W0_TEST1 |
+----------+----------+
|       20 | DASDD    |
|       20 | DASDD    |
|       20 | DASDD    |
|       20 | DASDD    |
|       20 | DASDD    |
|       20 | DASDD    |
+----------+----------+
SELECT * FROM W0CASE PARTITION (P00) ORDER BY W0_TEST0 DESC;
+----------+----------+
| W0_TEST0 | W0_TEST1 |
+----------+----------+
+----------+----------+
SELECT * FROM W0CASE PARTITION (P01) ORDER BY W0_TEST0 DESC;
+----------+----------+
| W0_TEST0 | W0_TEST1 |
+----------+----------+
+----------+----------+
SELECT * FROM W0CASE PARTITION (P10) ORDER BY W0_TEST0 DESC;
+----------+----------+
| W0_TEST0 | W0_TEST1 |
+----------+----------+
+----------+----------+
SELECT * FROM W0CASE PARTITION (P11) ORDER BY W0_TEST0 DESC;
+----------+----------+
| W0_TEST0 | W0_TEST1 |
+----------+----------+
|       20 | DASDD    |
|       20 | DASDD    |
|       20 | DASDD    |
|       20 | DASDD    |
|       20 | DASDD    |
|       20 | DASDD    |
+----------+----------+
DROP TABLE W0CASE ;

CREATE TABLE W0CASE ( W0_TEST0 INT , W0_TEST1 CHAR(100) )
            PARTITION BY RANGE COLUMNS ( W0_TEST0 )
            SUBPARTITION BY KEY (W0_TEST0)
            ( PARTITION P0 VALUES LESS THAN (10) ( SUBPARTITION P00 , SUBPARTITION P01 ) , PARTITION P1 VALUES LESS THAN (30) ( SUBPARTITION P10 , SUBPARTITION P11));
LOAD DATA INFILE 'data_for_mysqltest_loaddata/Load_Table_DM_mysql/A28.txt' INTO TABLE W0CASE FIELDS TERMINATED BY ',' LINES TERMINATED BY '/' (W0_TEST0, W0_TEST1 ) ;
SELECT * FROM W0CASE PARTITION (P0) ORDER BY W0_TEST0 DESC;
+----------+----------+
| W0_TEST0 | W0_TEST1 |
+----------+----------+
       |
  |
|        0 | A
|        6 | EWQEQW
+----------+----------+
SELECT * FROM W0CASE PARTITION (P1) ORDER BY W0_TEST0 DESC;
+----------+-----------+
| W0_TEST0 | W0_TEST1  |
+----------+-----------+
       |
     |
  |
 |
|       11 | BEGI
|       14 | BETWEEN
|       15 | CASCADED
|       20 | DF
+----------+-----------+
SELECT * FROM W0CASE PARTITION (P00) ORDER BY W0_TEST0 DESC;
+----------+----------+
| W0_TEST0 | W0_TEST1 |
+----------+----------+
  |
|        6 | EWQEQW
+----------+----------+
SELECT * FROM W0CASE PARTITION (P01) ORDER BY W0_TEST0 DESC;
+----------+----------+
| W0_TEST0 | W0_TEST1 |
+----------+----------+
       |
|        0 | A
+----------+----------+
SELECT * FROM W0CASE PARTITION (P10) ORDER BY W0_TEST0 DESC;
+----------+----------+
| W0_TEST0 | W0_TEST1 |
+----------+----------+
      |
 |
|       14 | BETWEEN
|       20 | DF
+----------+----------+
SELECT * FROM W0CASE PARTITION (P11) ORDER BY W0_TEST0 DESC;
+----------+-----------+
| W0_TEST0 | W0_TEST1  |
+----------+-----------+
     |
 |
|       11 | BEGI
|       15 | CASCADED
+----------+-----------+
DELETE FROM W0CASE;
LOAD DATA INFILE 'data_for_mysqltest_loaddata/Load_Table_DM_mysql/A28.txt' INTO TABLE W0CASE FIELDS TERMINATED BY ',' LINES TERMINATED BY '/' (W0_TEST0, W0_TEST1 ) SET W0_TEST0 = 20, W0_TEST1 = 'DASDD';
SELECT * FROM W0CASE PARTITION (P0) ORDER BY W0_TEST0 DESC;
+----------+----------+
| W0_TEST0 | W0_TEST1 |
+----------+----------+
+----------+----------+
SELECT * FROM W0CASE PARTITION (P1) ORDER BY W0_TEST0 DESC;
+----------+----------+
| W0_TEST0 | W0_TEST1 |
+----------+----------+
|       20 | DASDD    |
|       20 | DASDD    |
|       20 | DASDD    |
|       20 | DASDD    |
|       20 | DASDD    |
|       20 | DASDD    |
+----------+----------+
SELECT * FROM W0CASE PARTITION (P00) ORDER BY W0_TEST0 DESC;
+----------+----------+
| W0_TEST0 | W0_TEST1 |
+----------+----------+
+----------+----------+
SELECT * FROM W0CASE PARTITION (P01) ORDER BY W0_TEST0 DESC;
+----------+----------+
| W0_TEST0 | W0_TEST1 |
+----------+----------+
+----------+----------+
SELECT * FROM W0CASE PARTITION (P10) ORDER BY W0_TEST0 DESC;
+----------+----------+
| W0_TEST0 | W0_TEST1 |
+----------+----------+
|       20 | DASDD    |
|       20 | DASDD    |
|       20 | DASDD    |
|       20 | DASDD    |
|       20 | DASDD    |
|       20 | DASDD    |
+----------+----------+
SELECT * FROM W0CASE PARTITION (P11) ORDER BY W0_TEST0 DESC;
+----------+----------+
| W0_TEST0 | W0_TEST1 |
+----------+----------+
+----------+----------+
DROP TABLE W0CASE ;


DROP TABLE W0CASE;
DROP TABLE W1CASE;

drop user WCY@'%' ;

