result_format: 4
drop user WCY@'%';
create user WCY identified by 'WCY';
grant all on *.* to WCY WITH GRANT OPTION;





DROP TABLE W0CASE;
DROP TABLE W1CASE;
#该文档中，放置的case为load对应表，不带set和col_name_or_user_var的部分，主要来load对应表的一般处理，同时这些表不带有主键，索引等约束。
#obmysql_mysql_load_1
#obmysql_mysql_load_1_1
#CHAR, VARCHAR,TINYTEXT,TEXT,MEDIUMTEXT,LONGTEXT,ENUM,SET
CREATE TABLE W0CASE (W0_TEST0 CHAR(10), W0_TEST1 VARCHAR(10),W0_TEST2 TINYTEXT,W0_TEST3 TEXT, W0_TEST4 MEDIUMTEXT, W0_TEST5 LONGTEXT, W0_TEST6 ENUM('1','g'), W0_TEST7 SET('2','h'));
LOAD DATA INFILE 'data_for_mysqltest_loaddata/Load_Table_Com_mysql/A0.txt' INTO TABLE W0CASE FIELDS TERMINATED BY ',';
SELECT * FROM W0CASE;
+----------+----------+----------+----------+----------+----------+----------+----------+
| W0_TEST0 | W0_TEST1 | W0_TEST2 | W0_TEST3 | W0_TEST4 | W0_TEST5 | W0_TEST6 | W0_TEST7 |
+----------+----------+----------+----------+----------+----------+----------+----------+
| a0       | a1       | a2       | a3       | a4       | a5       | 1        | 2        |
| b0       | b1       | b2       | b3       | b4       | b5       | g        | h        |
| c0       | c1       | c2       | c3       | c4       | c5       | 1        | h        |
| d0       | d1       | d2       | d3       | d4       | d5       | g        | 2        |
+----------+----------+----------+----------+----------+----------+----------+----------+
DROP TABLE W0CASE ;

CREATE TABLE W0CASE ( W0_TEST0 ENUM('1','g',''), W0_TEST1 SET('2','h',''));
#BUG: 
LOAD DATA INFILE 'data_for_mysqltest_loaddata/Load_Table_Com_mysql/A1_error.txt' INTO TABLE W0CASE FIELDS TERMINATED BY ',';
SELECT * FROM W0CASE;
+----------+----------+
| W0_TEST0 | W0_TEST1 |
+----------+----------+
|          | NULL     |
| 1        | 2        |
+----------+----------+
DROP TABLE W0CASE ;

CREATE TABLE W0CASE ( W0_TEST0 ENUM('1','g',''), W0_TEST1 MEDIUMTEXT);
#BUG: 
LOAD DATA INFILE 'data_for_mysqltest_loaddata/Load_Table_Com_mysql/A2.txt' INTO TABLE W0CASE FIELDS TERMINATED BY ',' LINES TERMINATED BY '\.0';
ERROR 01000: Data truncated for argument
SELECT * FROM W0CASE;
+----------+----------+
| W0_TEST0 | W0_TEST1 |
+----------+----------+
+----------+----------+
DROP TABLE W0CASE ;

CREATE TABLE W0CASE ( W0_TEST0 CHAR(10), W0_TEST1 MEDIUMTEXT);
LOAD DATA INFILE 'data_for_mysqltest_loaddata/Load_Table_Com_mysql/A3.txt' REPLACE INTO TABLE W0CASE FIELDS TERMINATED BY ',' LINES TERMINATED BY '\.0';
SELECT * FROM W0CASE ORDER BY W0_TEST0 DESC;
+----------+----------+
| W0_TEST0 | W0_TEST1 |
+----------+----------+
       |
1       | 2
A0      | A1       |
A0      | A2       |
A0      | A2       |
A1      | A2       |
A1      | A3       |
A1      | A4       |
A6      | A7       |
A6      | A7       |
A6      | A8       |
| 
| 
| 
| 
| 
| 
| 
| 
| 
| 
| A0       | A2       |
+----------+----------+
DROP TABLE W0CASE ;

CREATE TABLE W0CASE ( W0_TEST0 CHAR(100), W0_TEST1 MEDIUMTEXT);
#BUG: 
LOAD DATA INFILE 'data_for_mysqltest_loaddata/Load_Table_Com_mysql/A4.txt' REPLACE INTO TABLE W0CASE FIELDS TERMINATED BY ',' ENCLOSED BY '"' LINES TERMINATED BY '\.0';
SELECT * FROM W0CASE ORDER BY W0_TEST0 DESC;
+----------+------------+
| W0_TEST0 | W0_TEST1   |
+----------+------------+


        |
        | 
| 
| a "b"    | ab "ss" dd |
+----------+------------+
DROP TABLE W0CASE ;

CREATE TABLE W0CASE ( W0_TEST0 CHAR(100), W0_TEST1 MEDIUMTEXT);
LOAD DATA INFILE 'data_for_mysqltest_loaddata/Load_Table_Com_mysql/A5.txt' REPLACE INTO TABLE W0CASE FIELDS TERMINATED BY ',' ESCAPED BY '\\' LINES TERMINATED BY '\.0';
SELECT * FROM W0CASE ORDER BY W0_TEST0 DESC;
+----------+----------+
| W0_TEST0 | W0_TEST1 |
+----------+----------+
 |
'aa'    | 'b\\'    |
'aaaa', | 'bbb'/,
| 
| 
| 'a'      | 'b'      |
+----------+----------+
DROP TABLE W0CASE ;

CREATE TABLE W0CASE ( W0_TEST0 CHAR(100), W0_TEST1 MEDIUMTEXT);
LOAD DATA INFILE 'data_for_mysqltest_loaddata/Load_Table_Com_mysql/A6.txt' REPLACE INTO TABLE W0CASE FIELDS TERMINATED BY ',' ESCAPED BY '\\' LINES TERMINATED BY '\.0' IGNORE 1 LINES;
SELECT * FROM W0CASE ORDER BY W0_TEST0 DESC;
+----------+---------------+
| W0_TEST0 | W0_TEST1      |
+----------+---------------+
      |
asdasd  | das\\         |
das     | dasdadsa\dasd |
das23   | 34dsada
| 
| 
| 
+----------+---------------+
DELETE FROM W0CASE;
LOAD DATA INFILE 'data_for_mysqltest_loaddata/Load_Table_Com_mysql/A6.txt' REPLACE INTO TABLE W0CASE FIELDS TERMINATED BY ',' ESCAPED BY '\\' LINES TERMINATED BY '\.0' IGNORE 1 ROWS;
SELECT * FROM W0CASE ORDER BY W0_TEST0 DESC;
+----------+---------------+
| W0_TEST0 | W0_TEST1      |
+----------+---------------+
      |
asdasd  | das\\         |
das     | dasdadsa\dasd |
das23   | 34dsada
| 
| 
| 
+----------+---------------+
DROP TABLE W0CASE ;

#DATE, TIME, DATETIME, TIMESTAMP, YEAR
CREATE TABLE W0CASE (W0_TEST0 DATE, W0_TEST1 TIME, W0_TEST2 DATETIME, W0_TEST3 TIMESTAMP, W0_TEST4 YEAR);
LOAD DATA INFILE 'data_for_mysqltest_loaddata/Load_Table_Com_mysql/A7.txt' INTO TABLE W0CASE FIELDS TERMINATED BY ',' ;
SELECT * FROM W0CASE;
+------------+----------+---------------------+---------------------+----------+
| W0_TEST0   | W0_TEST1 | W0_TEST2            | W0_TEST3            | W0_TEST4 |
+------------+----------+---------------------+---------------------+----------+
| 2000-02-20 | 00:20:00 | 2020-02-20 00:00:00 | 2020-02-20 00:00:00 |     1997 |
| 3030-03-03 | 00:31:00 | 3030-03-10 00:00:00 | 2030-12-30 00:00:00 |     2011 |
+------------+----------+---------------------+---------------------+----------+
DROP TABLE W0CASE ;

CREATE TABLE W0CASE (W0_TEST0 DATE, W0_TEST1 TIME, W0_TEST2 DATETIME, W0_TEST3 TIMESTAMP, W0_TEST4 YEAR);
LOAD DATA INFILE 'data_for_mysqltest_loaddata/Load_Table_Com_mysql/A8.txt' INTO TABLE W0CASE FIELDS TERMINATED BY ',' ;
SELECT * FROM W0CASE;
+------------+----------+---------------------+---------------------+----------+
| W0_TEST0   | W0_TEST1 | W0_TEST2            | W0_TEST3            | W0_TEST4 |
+------------+----------+---------------------+---------------------+----------+
| 2000-02-20 | 00:20:00 | 2020-02-20 00:00:00 | 2020-02-20 00:00:00 |     1997 |
| 2000-02-20 | 00:20:00 | 2020-02-20 00:00:00 | 2020-02-20 00:00:00 |     2014 |
| 2000-02-20 | 00:20:00 | 2020-02-20 00:00:00 | 2020-02-20 00:00:00 |     2015 |
| 2000-02-20 | 00:20:00 | 2020-02-20 00:00:00 | 2020-02-20 00:00:00 |     2015 |
| 3030-03-03 | 00:31:00 | 3030-03-10 00:00:00 | 2030-12-30 00:00:00 |     2011 |
| 3030-03-10 | 00:31:00 | 3030-03-03 00:00:00 | 2030-12-30 00:00:00 |     2012 |
| 3030-03-10 | 00:31:00 | 3030-03-03 00:00:00 | 2030-12-30 00:00:00 |     2013 |
+------------+----------+---------------------+---------------------+----------+
DROP TABLE W0CASE ;

CREATE TABLE W0CASE (W0_TEST0 DATE, W0_TEST1 TIME, W0_TEST2 DATETIME, W0_TEST3 TIMESTAMP, W0_TEST4 YEAR);
LOAD DATA INFILE 'data_for_mysqltest_loaddata/Load_Table_Com_mysql/A9.txt' IGNORE INTO TABLE W0CASE FIELDS TERMINATED BY ',' ;
SELECT * FROM W0CASE;
+------------+----------+---------------------+---------------------+----------+
| W0_TEST0   | W0_TEST1 | W0_TEST2            | W0_TEST3            | W0_TEST4 |
+------------+----------+---------------------+---------------------+----------+
| 2000-02-20 | 00:20:00 | 2020-02-20 00:00:00 | 2020-02-20 00:00:00 |     1997 |
| 2000-02-20 | 00:20:00 | 2020-02-20 00:00:00 | 2020-02-20 00:00:00 |     1997 |
| 2000-02-20 | 00:20:00 | 2020-02-20 00:00:00 | 2020-02-20 00:00:00 |     1997 |
| 2000-02-20 | 00:20:00 | 2020-02-20 00:00:00 | 2020-02-20 00:00:00 |     1997 |
| 2000-02-20 | 00:20:00 | 2020-02-20 00:00:00 | 2020-02-20 00:00:00 |     1997 |
| 2000-02-20 | 00:20:00 | 2020-02-20 00:00:00 | 2020-02-20 00:00:00 |     1998 |
+------------+----------+---------------------+---------------------+----------+
DROP TABLE W0CASE ;

CREATE TABLE W0CASE (W0_TEST0 DATE, W0_TEST1 TIME, W0_TEST2 DATETIME, W0_TEST3 TIMESTAMP, W0_TEST4 YEAR);
LOAD DATA INFILE 'data_for_mysqltest_loaddata/Load_Table_Com_mysql/A10.txt' IGNORE INTO TABLE W0CASE FIELDS TERMINATED BY ',' IGNORE 2 ROWS ;
SELECT * FROM W0CASE;
+----------+----------+----------+----------+----------+
| W0_TEST0 | W0_TEST1 | W0_TEST2 | W0_TEST3 | W0_TEST4 |
+----------+----------+----------+----------+----------+
+----------+----------+----------+----------+----------+
LOAD DATA INFILE 'data_for_mysqltest_loaddata/Load_Table_Com_mysql/A10.txt' IGNORE INTO TABLE W0CASE FIELDS TERMINATED BY ',' IGNORE 2 LINES ;
SELECT * FROM W0CASE;
+----------+----------+----------+----------+----------+
| W0_TEST0 | W0_TEST1 | W0_TEST2 | W0_TEST3 | W0_TEST4 |
+----------+----------+----------+----------+----------+
+----------+----------+----------+----------+----------+
DROP TABLE W0CASE ;

CREATE TABLE W0CASE (W0_TEST0 DATE, W0_TEST1 TIME, W0_TEST2 DATETIME, W0_TEST3 TIMESTAMP, W0_TEST4 YEAR);
LOAD DATA INFILE 'data_for_mysqltest_loaddata/Load_Table_Com_mysql/A11.txt' IGNORE INTO TABLE W0CASE FIELDS TERMINATED BY ',' IGNORE 2 ROWS ;
SELECT * FROM W0CASE;
+------------+----------+---------------------+---------------------+----------+
| W0_TEST0   | W0_TEST1 | W0_TEST2            | W0_TEST3            | W0_TEST4 |
+------------+----------+---------------------+---------------------+----------+
| 2000-02-20 | 00:20:00 | 2020-02-20 00:00:00 | 2020-02-20 00:00:00 |     1997 |
+------------+----------+---------------------+---------------------+----------+
DROP TABLE W0CASE ;

CREATE TABLE W0CASE (W0_TEST0 DATE, W0_TEST1 TIME, W0_TEST2 DATETIME, W0_TEST3 TIMESTAMP, W0_TEST4 YEAR);
#BUG: 
LOAD DATA INFILE 'data_for_mysqltest_loaddata/Load_Table_Com_mysql/A12.txt' IGNORE INTO TABLE W0CASE FIELDS TERMINATED BY ','  ;
SELECT * FROM W0CASE;
+------------+----------+---------------------+---------------------+----------+
| W0_TEST0   | W0_TEST1 | W0_TEST2            | W0_TEST3            | W0_TEST4 |
+------------+----------+---------------------+---------------------+----------+
| 0000-00-00 | 00:20:00 | 0000-00-00 00:00:00 | 0000-00-00 00:00:00 |     2011 |
+------------+----------+---------------------+---------------------+----------+
DROP TABLE W0CASE ;

CREATE TABLE W0CASE (W0_TEST0 DATE, W0_TEST1 TIME, W0_TEST2 DATETIME, W0_TEST3 TIMESTAMP, W0_TEST4 YEAR);
LOAD DATA INFILE 'data_for_mysqltest_loaddata/Load_Table_Com_mysql/A13.txt' IGNORE INTO TABLE W0CASE FIELDS TERMINATED BY ',' LINES TERMINATED BY '//' ;
SELECT * FROM W0CASE ORDER BY W0_TEST0 DESC;
+------------+----------+---------------------+---------------------+----------+
| W0_TEST0   | W0_TEST1 | W0_TEST2            | W0_TEST3            | W0_TEST4 |
+------------+----------+---------------------+---------------------+----------+
| 0000-00-00 | NULL     | NULL                | NULL                |     NULL |
| 2000-02-20 | 00:20:00 | 2020-02-20 00:00:00 | 2020-02-20 00:00:00 |     1997 |
| 2000-02-20 | 00:20:00 | 2020-02-20 00:00:00 | 2020-02-20 00:00:00 |     1997 |
| 2000-02-20 | 00:20:00 | 2020-02-20 00:00:00 | 2020-02-20 00:00:00 |     1997 |
| 2000-02-20 | 00:20:00 | 2020-02-20 00:00:00 | 2020-02-20 00:00:00 |     1997 |
| 2000-02-20 | 00:20:00 | 2020-02-20 00:00:00 | 2020-02-20 00:00:00 |     1997 |
| 2000-02-20 | 00:20:00 | 2020-02-20 00:00:00 | 2020-02-20 00:00:00 |     1997 |
| 2000-02-20 | 00:20:00 | 2020-02-20 00:00:00 | 2020-02-20 00:00:00 |     1997 |
| 2000-02-20 | 00:20:00 | 2020-02-20 00:00:00 | 2020-02-20 00:00:00 |     1997 |
| 2000-02-20 | 00:20:00 | 2020-02-20 00:00:00 | 2020-02-20 00:00:00 |     1997 |
| 2000-02-20 | 00:20:00 | 2020-02-20 00:00:00 | 2020-02-20 00:00:00 |     1997 |
| 2000-02-20 | 00:20:00 | 2020-02-20 00:00:00 | 2020-02-20 00:00:00 |     1997 |
| 2000-02-20 | 00:20:00 | 2020-02-20 00:00:00 | 2020-02-20 00:00:00 |     1997 |
+------------+----------+---------------------+---------------------+----------+
DROP TABLE W0CASE ;

CREATE TABLE W0CASE (W0_TEST0 DATE, W0_TEST1 TIME, W0_TEST2 DATETIME, W0_TEST3 TIMESTAMP, W0_TEST4 YEAR);
#BUG: 
LOAD DATA INFILE 'data_for_mysqltest_loaddata/Load_Table_Com_mysql/A14.txt' IGNORE INTO TABLE W0CASE FIELDS TERMINATED BY ','  ;
SELECT * FROM W0CASE;
+------------+----------+---------------------+---------------------+----------+
| W0_TEST0   | W0_TEST1 | W0_TEST2            | W0_TEST3            | W0_TEST4 |
+------------+----------+---------------------+---------------------+----------+
| 0000-00-00 | 00:00:00 | 0000-00-00 00:00:00 | 0000-00-00 00:00:00 |     NULL |
+------------+----------+---------------------+---------------------+----------+
DELETE FROM W0CASE;
LOAD DATA INFILE 'data_for_mysqltest_loaddata/Load_Table_Com_mysql/A14.txt' IGNORE INTO TABLE W0CASE FIELDS TERMINATED BY ',' LINES TERMINATED BY '//' ;
SELECT * FROM W0CASE;
+------------+----------+---------------------+---------------------+----------+
| W0_TEST0   | W0_TEST1 | W0_TEST2            | W0_TEST3            | W0_TEST4 |
+------------+----------+---------------------+---------------------+----------+
| 0000-00-00 | 00:00:00 | 0000-00-00 00:00:00 | 0000-00-00 00:00:00 |     0000 |
+------------+----------+---------------------+---------------------+----------+
DROP TABLE W0CASE ;

CREATE TABLE W0CASE (W0_TEST0 DATE, W0_TEST1 TIME, W0_TEST2 DATETIME, W0_TEST3 TIMESTAMP, W0_TEST4 YEAR);
LOAD DATA INFILE 'data_for_mysqltest_loaddata/Load_Table_Com_mysql/A15.txt' IGNORE INTO TABLE W0CASE FIELDS TERMINATED BY ',' LINES TERMINATED BY '//' ;
SELECT * FROM W0CASE ORDER BY W0_TEST0 DESC;
+------------+----------+---------------------+---------------------+----------+
| W0_TEST0   | W0_TEST1 | W0_TEST2            | W0_TEST3            | W0_TEST4 |
+------------+----------+---------------------+---------------------+----------+
| 0000-00-00 | NULL     | NULL                | NULL                |     NULL |
| 2000-02-20 | 00:20:00 | 2020-02-20 00:00:00 | 2020-02-20 00:00:00 |     1997 |
| 3030-03-03 | 00:31:00 | 3030-03-10 00:00:00 | 2030-12-30 00:00:00 |     2011 |
+------------+----------+---------------------+---------------------+----------+
DROP TABLE W0CASE ;

CREATE TABLE W0CASE (W0_TEST0 DATE, W0_TEST1 TIME, W0_TEST2 DATETIME, W0_TEST3 TIMESTAMP, W0_TEST4 YEAR);
LOAD DATA INFILE 'data_for_mysqltest_loaddata/Load_Table_Com_mysql/A16.txt' IGNORE INTO TABLE W0CASE FIELDS TERMINATED BY ',' ENCLOSED BY '/' LINES TERMINATED BY '//' ;
SELECT * FROM W0CASE ORDER BY W0_TEST0 DESC;
+------------+----------+---------------------+---------------------+----------+
| W0_TEST0   | W0_TEST1 | W0_TEST2            | W0_TEST3            | W0_TEST4 |
+------------+----------+---------------------+---------------------+----------+
| 2000-02-20 | 00:20:00 | 2020-02-20 00:00:00 | 2020-02-20 00:00:00 |     1997 |
+------------+----------+---------------------+---------------------+----------+
DELETE FROM W0CASE;
LOAD DATA INFILE 'data_for_mysqltest_loaddata/Load_Table_Com_mysql/A16.txt' IGNORE INTO TABLE W0CASE FIELDS TERMINATED BY ',' OPTIONALLY ENCLOSED BY '/' LINES TERMINATED BY '//' ;
SELECT * FROM W0CASE ORDER BY W0_TEST0 DESC;
+------------+----------+---------------------+---------------------+----------+
| W0_TEST0   | W0_TEST1 | W0_TEST2            | W0_TEST3            | W0_TEST4 |
+------------+----------+---------------------+---------------------+----------+
| 2000-02-20 | 00:20:00 | 2020-02-20 00:00:00 | 2020-02-20 00:00:00 |     1997 |
+------------+----------+---------------------+---------------------+----------+
DROP TABLE W0CASE ;

CREATE TABLE W0CASE (W0_TEST0 DATE, W0_TEST1 TIME, W0_TEST2 DATETIME, W0_TEST3 TIMESTAMP, W0_TEST4 YEAR);
LOAD DATA INFILE 'data_for_mysqltest_loaddata/Load_Table_Com_mysql/A17.txt' IGNORE INTO TABLE W0CASE FIELDS TERMINATED BY ',' ENCLOSED BY '/' ESCAPED BY '\\' LINES TERMINATED BY '//' ;
SELECT * FROM W0CASE ORDER BY W0_TEST0 DESC;
+------------+----------+---------------------+---------------------+----------+
| W0_TEST0   | W0_TEST1 | W0_TEST2            | W0_TEST3            | W0_TEST4 |
+------------+----------+---------------------+---------------------+----------+
| 2000-02-20 | 00:20:00 | 2020-02-20 00:00:00 | 2020-02-20 00:00:00 |     1997 |
+------------+----------+---------------------+---------------------+----------+
DELETE FROM W0CASE;
LOAD DATA INFILE 'data_for_mysqltest_loaddata/Load_Table_Com_mysql/A17.txt' IGNORE INTO TABLE W0CASE FIELDS TERMINATED BY ',' OPTIONALLY ENCLOSED BY '/' ESCAPED BY '\\' LINES TERMINATED BY '//' ;
SELECT * FROM W0CASE ORDER BY W0_TEST0 DESC;
+------------+----------+---------------------+---------------------+----------+
| W0_TEST0   | W0_TEST1 | W0_TEST2            | W0_TEST3            | W0_TEST4 |
+------------+----------+---------------------+---------------------+----------+
| 2000-02-20 | 00:20:00 | 2020-02-20 00:00:00 | 2020-02-20 00:00:00 |     1997 |
+------------+----------+---------------------+---------------------+----------+
DROP TABLE W0CASE ;

CREATE TABLE W0CASE (W0_TEST0 DATE, W0_TEST1 TIME, W0_TEST2 DATETIME, W0_TEST3 TIMESTAMP, W0_TEST4 YEAR);
# 这里的W0_TEST4有问题，不知道是不是上面的一个BUG导致的，先放置后面再来处理++++++++++++++++++++++++++++++++++++++++++++++++++++++++++++++++++++++++++++++++++++++++++++++++++++++++++++++++++++++++++++++
LOAD DATA INFILE 'data_for_mysqltest_loaddata/Load_Table_Com_mysql/A18.txt' IGNORE INTO TABLE W0CASE FIELDS TERMINATED BY ',' ENCLOSED BY '/' ESCAPED BY '' ;
SELECT * FROM W0CASE ORDER BY W0_TEST0 DESC;
+------------+----------+---------------------+---------------------+----------+
| W0_TEST0   | W0_TEST1 | W0_TEST2            | W0_TEST3            | W0_TEST4 |
+------------+----------+---------------------+---------------------+----------+
| 2000-02-20 | 00:20:00 | 2020-02-20 00:00:00 | 0000-00-00 00:00:00 |     0000 |
+------------+----------+---------------------+---------------------+----------+
DROP TABLE W0CASE ;

#TINYINT,BOOL,BOOLEAN,SMALLINT,MEDIUMINT,INT,INTEGER,BIGINT,DECIMAL,DEC,FLOAT,NUMERIC,DOUBLE,DOUBLE PRECISION,REAL
CREATE TABLE W0CASE ( W0_TEST0 TINYINT, W0_TEST1 BOOL, W0_TEST2 BOOLEAN, W0_TEST3 SMALLINT, W0_TEST4 MEDIUMINT, W0_TEST5 INT, W0_TEST6 INTEGER,
                    W0_TEST7 BIGINT, W0_TEST8 DECIMAL, W0_TEST9 DEC, W0_TEST10 FLOAT, W0_TEST11 NUMERIC, W0_TEST12 DOUBLE, W0_TEST13 DOUBLE PRECISION, W0_TEST14 REAL);
LOAD DATA INFILE 'data_for_mysqltest_loaddata/Load_Table_Com_mysql/A19.txt' INTO TABLE W0CASE FIELDS TERMINATED BY ',';
SELECT * FROM W0CASE;
+----------+----------+----------+----------+----------+----------+----------+----------+----------+----------+-----------+-----------+-----------+-----------+-----------+
| W0_TEST0 | W0_TEST1 | W0_TEST2 | W0_TEST3 | W0_TEST4 | W0_TEST5 | W0_TEST6 | W0_TEST7 | W0_TEST8 | W0_TEST9 | W0_TEST10 | W0_TEST11 | W0_TEST12 | W0_TEST13 | W0_TEST14 |
+----------+----------+----------+----------+----------+----------+----------+----------+----------+----------+-----------+-----------+-----------+-----------+-----------+
|        1 |        2 |        3 |        4 |        5 |        6 |        7 |        8 |        9 |       10 |        11 |        12 |        13 |        14 |        15 |
|        1 |        2 |        3 |        4 |        5 |        6 |        7 |        8 |        9 |       10 |        11 |        12 |        13 |        14 |        15 |
|        1 |        2 |        3 |        4 |        5 |        6 |        7 |        8 |        9 |       10 |        11 |        12 |        13 |        14 |        15 |
|        1 |        2 |        3 |        4 |        5 |        6 |        7 |        8 |        9 |       10 |        11 |        12 |        13 |        14 |        15 |
+----------+----------+----------+----------+----------+----------+----------+----------+----------+----------+-----------+-----------+-----------+-----------+-----------+
DROP TABLE W0CASE ;

CREATE TABLE W0CASE ( W0_TEST0 TINYINT, W0_TEST1 BOOL, W0_TEST2 BOOLEAN);
LOAD DATA INFILE 'data_for_mysqltest_loaddata/Load_Table_Com_mysql/A20.txt' INTO TABLE W0CASE FIELDS TERMINATED BY ',' LINES TERMINATED BY '\.0A' ;
SELECT * FROM W0CASE;
+----------+----------+----------+
| W0_TEST0 | W0_TEST1 | W0_TEST2 |
+----------+----------+----------+
|        1 |        2 |        3 |
|        1 |        2 |        3 |
+----------+----------+----------+
DROP TABLE W0CASE ;

CREATE TABLE W0CASE ( W0_TEST0 TINYINT, W0_TEST1 NUMERIC, W0_TEST2 REAL);
LOAD DATA INFILE 'data_for_mysqltest_loaddata/Load_Table_Com_mysql/A21.txt' INTO TABLE W0CASE FIELDS TERMINATED BY ',' LINES TERMINATED BY '//' ;
SELECT * FROM W0CASE ORDER BY W0_TEST0 DESC, W0_TEST2 DESC;
+----------+----------+----------+
| W0_TEST0 | W0_TEST1 | W0_TEST2 |
+----------+----------+----------+
|        1 |        2 |       10 |
|        1 |        2 |       11 |
+----------+----------+----------+
DROP TABLE W0CASE ;

CREATE TABLE W0CASE ( W0_TEST0 INTEGER, W0_TEST1 FLOAT, W0_TEST2 BOOL);
LOAD DATA INFILE 'data_for_mysqltest_loaddata/Load_Table_Com_mysql/A21.txt' INTO TABLE W0CASE FIELDS TERMINATED BY ',' LINES TERMINATED BY '//' ;
SELECT * FROM W0CASE ORDER BY W0_TEST0 DESC , W0_TEST2 DESC;
+----------+----------+----------+
| W0_TEST0 | W0_TEST1 | W0_TEST2 |
+----------+----------+----------+
|        1 |        2 |       10 |
|        1 |        2 |       11 |
+----------+----------+----------+
DROP TABLE W0CASE ;

CREATE TABLE W0CASE ( W0_TEST0 MEDIUMINT, W0_TEST1 DOUBLE PRECISION, W0_TEST2 BOOL);
LOAD DATA INFILE 'data_for_mysqltest_loaddata/Load_Table_Com_mysql/A22.txt' INTO TABLE W0CASE FIELDS TERMINATED BY ',' LINES TERMINATED BY '//' ;
SELECT * FROM W0CASE ORDER BY W0_TEST0 DESC , W0_TEST2 DESC;
+----------+----------+----------+
| W0_TEST0 | W0_TEST1 | W0_TEST2 |
+----------+----------+----------+
|        0 |       -2 |        3 |
|        0 |      0.2 |        0 |
+----------+----------+----------+
DROP TABLE W0CASE ;

CREATE TABLE W0CASE ( W0_TEST0 MEDIUMINT, W0_TEST1 DOUBLE PRECISION, W0_TEST2 BOOL);
LOAD DATA INFILE 'data_for_mysqltest_loaddata/Load_Table_Com_mysql/A23.txt' REPLACE INTO TABLE W0CASE FIELDS TERMINATED BY ',' LINES TERMINATED BY '//' ;
ERROR HY000: Incorrect integer value
SELECT * FROM W0CASE;
+----------+----------+----------+
| W0_TEST0 | W0_TEST1 | W0_TEST2 |
+----------+----------+----------+
+----------+----------+----------+
DROP TABLE W0CASE ;

CREATE TABLE W0CASE ( W0_TEST0 MEDIUMINT, W0_TEST1 DOUBLE PRECISION, W0_TEST2 BOOL);
LOAD DATA INFILE 'data_for_mysqltest_loaddata/Load_Table_Com_mysql/A23.txt' REPLACE INTO TABLE W0CASE FIELDS TERMINATED BY ',' LINES TERMINATED BY '//' IGNORE 1 LINES ;
SELECT * FROM W0CASE;
+----------+----------+----------+
| W0_TEST0 | W0_TEST1 | W0_TEST2 |
+----------+----------+----------+
|        0 |       -2 |        3 |
|        1 |        2 |       -3 |
|        1 |      0.2 |        3 |
+----------+----------+----------+
DROP TABLE W0CASE ;

CREATE TABLE W0CASE ( W0_TEST0 MEDIUMINT, W0_TEST1 DOUBLE PRECISION, W0_TEST2 BOOL);
LOAD DATA INFILE 'data_for_mysqltest_loaddata/Load_Table_Com_mysql/A24.txt' REPLACE INTO TABLE W0CASE FIELDS TERMINATED BY ',' ENCLOSED BY '|' LINES TERMINATED BY '//' IGNORE 1 LINES ;
SELECT * FROM W0CASE;
+----------+----------+----------+
| W0_TEST0 | W0_TEST1 | W0_TEST2 |
+----------+----------+----------+
|        1 |        2 |        3 |
|        1 |      0.2 |        3 |
+----------+----------+----------+
DROP TABLE W0CASE ;

CREATE TABLE W0CASE ( W0_TEST0 MEDIUMINT, W0_TEST1 DOUBLE PRECISION, W0_TEST2 BOOL);
LOAD DATA INFILE 'data_for_mysqltest_loaddata/Load_Table_Com_mysql/A25.txt' REPLACE INTO TABLE W0CASE FIELDS TERMINATED BY ',' ENCLOSED BY '|' ESCAPED BY '\\' LINES TERMINATED BY '//' IGNORE 1 LINES ;
SELECT * FROM W0CASE;
+----------+----------+----------+
| W0_TEST0 | W0_TEST1 | W0_TEST2 |
+----------+----------+----------+
|        1 |      0.2 |       -3 |
+----------+----------+----------+
DROP TABLE W0CASE ;

#obmysql_mysql_load_1_2
#obmysql_mysql_load_1_2_1
#obmysql_mysql_load_1_2_1_1
#obmysql_mysql_load_1_2_1_1_1
#增加（删除）列在开头
CREATE TABLE W0CASE (W0_TEST0 CHAR(100), W0_TEST1 MEDIUMINT );
LOAD DATA INFILE 'data_for_mysqltest_loaddata/Load_Table_Com_mysql/A26.txt' REPLACE INTO TABLE W0CASE FIELDS TERMINATED BY ',' ;
ALTER TABLE W0CASE ADD W0_TEST00 CHAR(100) FIRST;
SELECT * FROM W0CASE;
+-----------+----------+----------+
| W0_TEST00 | W0_TEST0 | W0_TEST1 |
+-----------+----------+----------+
| NULL      | A        |        1 |
| NULL      | B        |        2 |
| NULL      | C        |        3 |
+-----------+----------+----------+
DELETE FROM W0CASE;
#BUG: 
LOAD DATA INFILE 'data_for_mysqltest_loaddata/Load_Table_Com_mysql/A27.txt' INTO TABLE W0CASE FIELDS TERMINATED BY ',' ;
SELECT * FROM W0CASE;
+-----------+----------+----------+
| W0_TEST00 | W0_TEST0 | W0_TEST1 |
+-----------+----------+----------+
| 0         | 1        |        2 |
+-----------+----------+----------+
DELETE FROM W0CASE;
DROP TABLE W0CASE ;

CREATE TABLE W0CASE ( W0_TEST0 CHAR(100) , W0_TEST1 TIME, W0_TEST2 BOOL );
ALTER TABLE W0CASE DROP W0_TEST0;
LOAD DATA INFILE 'data_for_mysqltest_loaddata/Load_Table_Com_mysql/A28.txt' INTO TABLE W0CASE FIELDS TERMINATED BY ',' ;
SELECT * FROM W0CASE;
+----------+----------+
| W0_TEST1 | W0_TEST2 |
+----------+----------+
| 00:20:00 |        1 |
+----------+----------+
DROP TABLE W0CASE ;

#obmysql_mysql_load_1_2_1_2
CREATE TABLE W0CASE ( W0_TEST0 CHAR(100) , W0_TEST1 TIME );
LOAD DATA INFILE 'data_for_mysqltest_loaddata/Load_Table_Com_mysql/A29.txt' INTO TABLE W0CASE FIELDS TERMINATED BY ',' ;
SELECT * FROM W0CASE;
+----------+----------+
| W0_TEST0 | W0_TEST1 |
+----------+----------+
| A        | 00:20:00 |
+----------+----------+
ALTER TABLE W0CASE ADD W0_TEST00 BOOL;
LOAD DATA INFILE 'data_for_mysqltest_loaddata/Load_Table_Com_mysql/A30.txt' INTO TABLE W0CASE FIELDS TERMINATED BY ',' ;
SELECT * FROM W0CASE;
+----------+----------+-----------+
| W0_TEST0 | W0_TEST1 | W0_TEST00 |
+----------+----------+-----------+
| A        | 00:20:00 |      NULL |
| B        | 00:21:00 |         1 |
+----------+----------+-----------+
ALTER TABLE W0CASE DROP W0_TEST00 ;
LOAD DATA INFILE 'data_for_mysqltest_loaddata/Load_Table_Com_mysql/A29.txt' INTO TABLE W0CASE FIELDS TERMINATED BY ',' ;
SELECT * FROM W0CASE;
+----------+----------+
| W0_TEST0 | W0_TEST1 |
+----------+----------+
| A        | 00:20:00 |
| A        | 00:20:00 |
| B        | 00:21:00 |
+----------+----------+
DROP TABLE W0CASE ;

#obmysql_mysql_load_1_2_1_3
CREATE TABLE W0CASE ( W0_TEST0 INT , W0_TEST1 REAL , W0_TEST2 TIME , W0_TEST3 CHAR(100)  );
LOAD DATA INFILE 'data_for_mysqltest_loaddata/Load_Table_Com_mysql/A31.txt' INTO TABLE W0CASE FIELDS TERMINATED BY ',' ;
SELECT * FROM W0CASE;
+----------+----------+----------+----------+
| W0_TEST0 | W0_TEST1 | W0_TEST2 | W0_TEST3 |
+----------+----------+----------+----------+
|        1 |       12 | 00:00:00 | A        |
|        2 |       23 | 00:10:00 | B        |
+----------+----------+----------+----------+
ALTER TABLE W0CASE ADD W0_TEST10 CHAR(100) AFTER W0_TEST1;
#通过添加列来loal还是有相同的问题
LOAD DATA INFILE 'data_for_mysqltest_loaddata/Load_Table_Com_mysql/A32.txt' INTO TABLE W0CASE FIELDS TERMINATED BY ',' ;
SELECT * FROM W0CASE;
+----------+----------+-----------+----------+----------+
| W0_TEST0 | W0_TEST1 | W0_TEST10 | W0_TEST2 | W0_TEST3 |
+----------+----------+-----------+----------+----------+
|        1 |       12 | NULL      | 00:00:00 | A        |
|        1 |       12 | 啊啊      | 00:00:00 | A        |
|        2 |       23 | NULL      | 00:10:00 | B        |
|        2 |       23 | 啊啊1     | 00:10:00 | B        |
+----------+----------+-----------+----------+----------+
DELETE FROM W0CASE;
ALTER TABLE W0CASE DROP W0_TEST10 ;
LOAD DATA INFILE 'data_for_mysqltest_loaddata/Load_Table_Com_mysql/A31.txt' INTO TABLE W0CASE FIELDS TERMINATED BY ',' ;
SELECT * FROM W0CASE;
+----------+----------+----------+----------+
| W0_TEST0 | W0_TEST1 | W0_TEST2 | W0_TEST3 |
+----------+----------+----------+----------+
|        1 |       12 | 00:00:00 | A        |
|        2 |       23 | 00:10:00 | B        |
+----------+----------+----------+----------+
DROP TABLE W0CASE ;

#obmysql_mysql_load_1_3
#obmysql_mysql_load_1_3_3
#obmysql_mysql_load_1_3_3_1
CREATE TABLE W0CASE ( W0_TEST0 CHAR(100), W0_TEST1 CHAR(100) GENERATED ALWAYS AS (W0_TEST0), W0_TEST2 INT  );
#BUG: 
LOAD DATA INFILE 'data_for_mysqltest_loaddata/Load_Table_Com_mysql/A33.txt' INTO TABLE W0CASE FIELDS TERMINATED BY ',' ;
SELECT * FROM W0CASE;
+----------+----------+----------+
| W0_TEST0 | W0_TEST1 | W0_TEST2 |
+----------+----------+----------+
| A        | A        |        1 |
+----------+----------+----------+
DROP TABLE W0CASE ;

CREATE TABLE W0CASE ( W0_TEST0 CHAR(100), W0_TEST1 CHAR(100) GENERATED ALWAYS AS (W0_TEST0)  );
LOAD DATA INFILE 'data_for_mysqltest_loaddata/Load_Table_Com_mysql/A34.txt' INTO TABLE W0CASE FIELDS TERMINATED BY ',' ;
SELECT * FROM W0CASE;
+----------+----------+
| W0_TEST0 | W0_TEST1 |
+----------+----------+
| A        | A        |
+----------+----------+
DROP TABLE W0CASE ;

#obmysql_mysql_load_1_3_2
#obmysql_mysql_load_1_3_2_1
#obmysql_mysql_load_1_3_2_1_1
CREATE TABLE W0CASE (W0_TEST0 INT, W0_TEST1 TIME )
            PARTITION BY RANGE COLUMNS ( W0_TEST0 )
            ( PARTITION P0 VALUES LESS THAN (10) , PARTITION P1 VALUES LESS THAN (20));
LOAD DATA INFILE 'data_for_mysqltest_loaddata/Load_Table_Com_mysql/A35.txt' INTO TABLE W0CASE FIELDS TERMINATED BY ',' ;
SELECT * FROM W0CASE PARTITION (P0) ORDER BY W0_TEST0 DESC;
+----------+----------+
| W0_TEST0 | W0_TEST1 |
+----------+----------+
|        1 | 00:11:00 |
|        2 | 00:20:00 |
+----------+----------+
SELECT * FROM W0CASE PARTITION (P1) ORDER BY W0_TEST0 DESC;
+----------+----------+
| W0_TEST0 | W0_TEST1 |
+----------+----------+
|       11 | 00:42:00 |
+----------+----------+
DROP TABLE W0CASE ;

CREATE TABLE W0CASE (W0_TEST0 INT, W0_TEST1 CHAR(100) )
            PARTITION BY RANGE COLUMNS ( W0_TEST0 , W0_TEST1 )
            ( PARTITION P0 VALUES LESS THAN (10,'003000') , PARTITION P1 VALUES LESS THAN (20,'005000'));
LOAD DATA INFILE 'data_for_mysqltest_loaddata/Load_Table_Com_mysql/A35.txt' INTO TABLE W0CASE FIELDS TERMINATED BY ',' ;
SELECT * FROM W0CASE PARTITION (P0) ORDER BY W0_TEST0 DESC;
+----------+----------+
| W0_TEST0 | W0_TEST1 |
+----------+----------+
|        1 | 001100   |
|        2 | 002000   |
+----------+----------+
SELECT * FROM W0CASE PARTITION (P1) ORDER BY W0_TEST0 DESC;
+----------+----------+
| W0_TEST0 | W0_TEST1 |
+----------+----------+
|       11 | 004200   |
+----------+----------+
DROP TABLE W0CASE ;

CREATE TABLE W0CASE ( W0_TEST00 TIME , W0_TEST0 INT, W0_TEST1 CHAR(100) )
            PARTITION BY RANGE COLUMNS ( W0_TEST0 , W0_TEST1 )
            ( PARTITION P0 VALUES LESS THAN (10,'003000') , PARTITION P1 VALUES LESS THAN (20,'005000'));
LOAD DATA INFILE 'data_for_mysqltest_loaddata/Load_Table_Com_mysql/A36.txt' INTO TABLE W0CASE FIELDS TERMINATED BY ',' ;
SELECT * FROM W0CASE PARTITION (P0) ORDER BY W0_TEST0 DESC;
+-----------+----------+----------+
| W0_TEST00 | W0_TEST0 | W0_TEST1 |
+-----------+----------+----------+
| 00:01:00  |        0 | 000000   |
| 00:02:00  |       10 | 001000   |
| 00:12:00  |       10 | 002000   |
+-----------+----------+----------+
SELECT * FROM W0CASE PARTITION (P1) ORDER BY W0_TEST0 DESC;
+-----------+----------+----------+
| W0_TEST00 | W0_TEST0 | W0_TEST1 |
+-----------+----------+----------+
| 00:20:00  |       14 | 004000   |
+-----------+----------+----------+
DROP TABLE W0CASE ;

CREATE TABLE W0CASE ( W0_TEST00 YEAR , W0_TEST0 INT, W0_TEST1 VARCHAR(100) )
            PARTITION BY RANGE COLUMNS ( W0_TEST0 , W0_TEST1 )
            ( PARTITION P0 VALUES LESS THAN (10,'003000') , PARTITION P1 VALUES LESS THAN (20,'005000'));
LOAD DATA INFILE 'data_for_mysqltest_loaddata/Load_Table_Com_mysql/A37.txt' INTO TABLE W0CASE FIELDS TERMINATED BY ',' ;
SELECT * FROM W0CASE PARTITION (P0) ORDER BY W0_TEST0 DESC;
+-----------+----------+----------+
| W0_TEST00 | W0_TEST0 | W0_TEST1 |
+-----------+----------+----------+
|      2000 |        1 | 001000   |
|      2001 |        5 | 003000   |
|      2003 |        6 | 002900   |
|      2007 |        9 | 000100   |
+-----------+----------+----------+
SELECT * FROM W0CASE PARTITION (P1) ORDER BY W0_TEST0 DESC;
+-----------+----------+----------+
| W0_TEST00 | W0_TEST0 | W0_TEST1 |
+-----------+----------+----------+
|      1999 |       19 | 004000   |
|      2002 |       11 | 001000   |
|      2004 |       15 | 006000   |
|      2006 |       17 | 005000   |
+-----------+----------+----------+
DROP TABLE W0CASE ;

CREATE TABLE W0CASE ( W0_TEST00 YEAR , W0_TEST0 INT, W0_TEST1 VARCHAR(100) )
            PARTITION BY RANGE COLUMNS ( W0_TEST0 , W0_TEST1 )
            ( PARTITION P0 VALUES LESS THAN (10,'003000') , PARTITION P1 VALUES LESS THAN (20,'005000'));
LOAD DATA INFILE 'data_for_mysqltest_loaddata/Load_Table_Com_mysql/A37.txt' REPLACE INTO TABLE W0CASE FIELDS TERMINATED BY ',' ;
SELECT * FROM W0CASE PARTITION (P0) ORDER BY W0_TEST0 DESC;
+-----------+----------+----------+
| W0_TEST00 | W0_TEST0 | W0_TEST1 |
+-----------+----------+----------+
|      2000 |        1 | 001000   |
|      2001 |        5 | 003000   |
|      2003 |        6 | 002900   |
|      2007 |        9 | 000100   |
+-----------+----------+----------+
SELECT * FROM W0CASE PARTITION (P1) ORDER BY W0_TEST0 DESC;
+-----------+----------+----------+
| W0_TEST00 | W0_TEST0 | W0_TEST1 |
+-----------+----------+----------+
|      1999 |       19 | 004000   |
|      2002 |       11 | 001000   |
|      2004 |       15 | 006000   |
|      2006 |       17 | 005000   |
+-----------+----------+----------+
DROP TABLE W0CASE ;

CREATE TABLE W0CASE ( W0_TEST00 YEAR , W0_TEST0 INT, W0_TEST1 VARCHAR(100) )
            PARTITION BY RANGE COLUMNS ( W0_TEST0 , W0_TEST1 )
            ( PARTITION P0 VALUES LESS THAN (10,'003000') , PARTITION P1 VALUES LESS THAN (20,'005000'));
LOAD DATA INFILE 'data_for_mysqltest_loaddata/Load_Table_Com_mysql/A37.txt' REPLACE INTO TABLE W0CASE FIELDS TERMINATED BY ',' IGNORE 3 LINES;
SELECT * FROM W0CASE PARTITION (P0) ORDER BY W0_TEST0 DESC;
+-----------+----------+----------+
| W0_TEST00 | W0_TEST0 | W0_TEST1 |
+-----------+----------+----------+
|      2003 |        6 | 002900   |
|      2007 |        9 | 000100   |
+-----------+----------+----------+
SELECT * FROM W0CASE PARTITION (P1) ORDER BY W0_TEST0 DESC;
+-----------+----------+----------+
| W0_TEST00 | W0_TEST0 | W0_TEST1 |
+-----------+----------+----------+
|      2002 |       11 | 001000   |
|      2004 |       15 | 006000   |
|      2006 |       17 | 005000   |
+-----------+----------+----------+
DROP TABLE W0CASE ;

CREATE TABLE W0CASE ( W0_TEST00 YEAR , W0_TEST0 INT, W0_TEST1 VARCHAR(100) )
            PARTITION BY RANGE COLUMNS ( W0_TEST0 , W0_TEST1 )
            ( PARTITION P0 VALUES LESS THAN (10,'003000') , PARTITION P1 VALUES LESS THAN (20,'005000'));
LOAD DATA INFILE 'data_for_mysqltest_loaddata/Load_Table_Com_mysql/A37.txt' REPLACE INTO TABLE W0CASE FIELDS TERMINATED BY ',' IGNORE 3 LINES;
SELECT * FROM W0CASE PARTITION (P0) ORDER BY W0_TEST0 DESC;
+-----------+----------+----------+
| W0_TEST00 | W0_TEST0 | W0_TEST1 |
+-----------+----------+----------+
|      2003 |        6 | 002900   |
|      2007 |        9 | 000100   |
+-----------+----------+----------+
SELECT * FROM W0CASE PARTITION (P1) ORDER BY W0_TEST0 DESC;
+-----------+----------+----------+
| W0_TEST00 | W0_TEST0 | W0_TEST1 |
+-----------+----------+----------+
|      2002 |       11 | 001000   |
|      2004 |       15 | 006000   |
|      2006 |       17 | 005000   |
+-----------+----------+----------+
DROP TABLE W0CASE ;

CREATE TABLE W0CASE ( W0_TEST00 REAL , W0_TEST0 INT, W0_TEST1 VARCHAR(100) )
            PARTITION BY RANGE COLUMNS ( W0_TEST0 , W0_TEST1 )
            ( PARTITION P0 VALUES LESS THAN (10,'003000') , PARTITION P1 VALUES LESS THAN (20,'005000'));
LOAD DATA INFILE 'data_for_mysqltest_loaddata/Load_Table_Com_mysql/A38.txt' REPLACE INTO TABLE W0CASE FIELDS TERMINATED BY ',' LINES TERMINATED BY '/' IGNORE 0 LINES;
SELECT * FROM W0CASE PARTITION (P0) ORDER BY W0_TEST0 DESC;
+-----------+----------+----------+
| W0_TEST00 | W0_TEST0 | W0_TEST1 |
+-----------+----------+----------+
  |
|         2 |        1 | 003100
+-----------+----------+----------+
SELECT * FROM W0CASE PARTITION (P1) ORDER BY W0_TEST0 DESC;
+-----------+----------+----------+
| W0_TEST00 | W0_TEST0 | W0_TEST1 |
+-----------+----------+----------+
      |
  |
|         1 |       11 | 001000
|         3 |       12 | 一
+-----------+----------+----------+
DROP TABLE W0CASE ;

CREATE TABLE W0CASE ( W0_TEST00 REAL , W0_TEST0 INT, W0_TEST1 VARCHAR(100) )
            PARTITION BY RANGE COLUMNS ( W0_TEST0 , W0_TEST1 )
            ( PARTITION P0 VALUES LESS THAN (10,'003000') , PARTITION P1 VALUES LESS THAN (20,'005000'));
LOAD DATA INFILE 'data_for_mysqltest_loaddata/Load_Table_Com_mysql/A39.txt' REPLACE INTO TABLE W0CASE FIELDS TERMINATED BY ',' OPTIONALLY ENCLOSED BY '''' ESCAPED BY '\\' LINES TERMINATED BY '/' IGNORE 0 LINES;
SELECT * FROM W0CASE PARTITION (P0) ORDER BY W0_TEST0 DESC;
+-----------+----------+---------------------+
| W0_TEST00 | W0_TEST0 | W0_TEST1            |
+-----------+----------+---------------------+
 |
/2,11,' 040'
|         1 |        2 | ''0''
+-----------+----------+---------------------+
SELECT * FROM W0CASE PARTITION (P1) ORDER BY W0_TEST0 DESC;
+-----------+----------+----------+
| W0_TEST00 | W0_TEST0 | W0_TEST1 |
+-----------+----------+----------+
+-----------+----------+----------+
DROP TABLE W0CASE ;

CREATE TABLE W0CASE ( W0_TEST00 REAL , W0_TEST0 INT, W0_TEST1 VARCHAR(100) )
            PARTITION BY RANGE COLUMNS ( W0_TEST0 , W0_TEST1 )
            ( PARTITION P0 VALUES LESS THAN (10,'003000') , PARTITION P1 VALUES LESS THAN (20,'005000'));
LOAD DATA INFILE 'data_for_mysqltest_loaddata/Load_Table_Com_mysql/A40.txt' REPLACE INTO TABLE W0CASE FIELDS TERMINATED BY ',' OPTIONALLY ENCLOSED BY '/' ESCAPED BY '\\' LINES TERMINATED BY '/' IGNORE 1 LINES;
SELECT * FROM W0CASE PARTITION (P0) ORDER BY W0_TEST0 DESC;
+-----------+----------+----------+
| W0_TEST00 | W0_TEST0 | W0_TEST1 |
+-----------+----------+----------+
+-----------+----------+----------+
SELECT * FROM W0CASE PARTITION (P1) ORDER BY W0_TEST0 DESC;
+-----------+----------+----------+
| W0_TEST00 | W0_TEST0 | W0_TEST1 |
+-----------+----------+----------+
+-----------+----------+----------+
DROP TABLE W0CASE ;

CREATE TABLE W0CASE ( W0_TEST00 REAL , W0_TEST0 INT, W0_TEST1 VARCHAR(100) )
            PARTITION BY RANGE COLUMNS ( W0_TEST0 , W0_TEST1 )
            ( PARTITION P0 VALUES LESS THAN (10,'003000') , PARTITION P1 VALUES LESS THAN (20,'005000'));
LOAD DATA INFILE 'data_for_mysqltest_loaddata/Load_Table_Com_mysql/A41.txt' REPLACE INTO TABLE W0CASE FIELDS TERMINATED BY ',' OPTIONALLY ENCLOSED BY '/' ESCAPED BY '\\' LINES TERMINATED BY '/' IGNORE 1 LINES;
SELECT * FROM W0CASE PARTITION (P0) ORDER BY W0_TEST0 DESC;
+-----------+----------+----------+
| W0_TEST00 | W0_TEST0 | W0_TEST1 |
+-----------+----------+----------+
+-----------+----------+----------+
SELECT * FROM W0CASE PARTITION (P1) ORDER BY W0_TEST0 DESC;
+-----------+----------+----------+
| W0_TEST00 | W0_TEST0 | W0_TEST1 |
+-----------+----------+----------+
+-----------+----------+----------+
DROP TABLE W0CASE ;

CREATE TABLE W0CASE ( W0_TEST0 INT , W0_TEST1 CHAR(100) )
            PARTITION BY RANGE ( W0_TEST0 + 1 )
            (PARTITION P0 VALUES LESS THAN (10), PARTITION P1 VALUES LESS THAN (100));
LOAD DATA INFILE 'data_for_mysqltest_loaddata/Load_Table_Com_mysql/A42.txt' REPLACE INTO TABLE W0CASE FIELDS TERMINATED BY ',' OPTIONALLY ENCLOSED BY '/' ESCAPED BY '\\' LINES TERMINATED BY '/' IGNORE 0 LINES;
SELECT * FROM W0CASE PARTITION (P0) ORDER BY W0_TEST0 DESC;
+----------+----------+
| W0_TEST0 | W0_TEST1 |
+----------+----------+
+----------+----------+
SELECT * FROM W0CASE PARTITION (P1) ORDER BY W0_TEST0 DESC;
+----------+----------+
| W0_TEST0 | W0_TEST1 |
+----------+----------+
//1/ |
|       12 | aaa
+----------+----------+
DROP TABLE W0CASE ;

CREATE TABLE W0CASE ( W0_TEST0 INT , W0_TEST1 CHAR(100) )
            PARTITION BY LIST ( W0_TEST0 + 1 )
            (PARTITION P0 VALUES IN (1,2,3,4), PARTITION P1 VALUES IN (5,6,7,8,9,10));
LOAD DATA INFILE 'data_for_mysqltest_loaddata/Load_Table_Com_mysql/A43.txt' REPLACE INTO TABLE W0CASE FIELDS TERMINATED BY ',' OPTIONALLY ENCLOSED BY '/' ESCAPED BY '\\' LINES TERMINATED BY '/' IGNORE 0 LINES;
SELECT * FROM W0CASE PARTITION (P0) ORDER BY W0_TEST0 DESC;
+----------+----------+
| W0_TEST0 | W0_TEST1 |
+----------+----------+
/1     |
|        0 | A
+----------+----------+
SELECT * FROM W0CASE PARTITION (P1) ORDER BY W0_TEST0 DESC;
+----------+----------+
| W0_TEST0 | W0_TEST1 |
+----------+----------+
+----------+----------+
DROP TABLE W0CASE ;

CREATE TABLE W0CASE ( W0_TEST0 INT , W0_TEST1 CHAR(100) )
            PARTITION BY LIST COLUMNS ( W0_TEST0 )
            (PARTITION P0 VALUES IN (1,2,3,4), PARTITION P1 VALUES IN (5,6,7,8,9,10));
LOAD DATA INFILE 'data_for_mysqltest_loaddata/Load_Table_Com_mysql/A44.txt' REPLACE INTO TABLE W0CASE FIELDS TERMINATED BY ',' OPTIONALLY ENCLOSED BY '/' ESCAPED BY '\\' LINES TERMINATED BY '/' IGNORE 0 LINES;
SELECT * FROM W0CASE PARTITION (P0) ORDER BY W0_TEST0 DESC;
+----------+----------+
| W0_TEST0 | W0_TEST1 |
+----------+----------+
/2    |
|        1 | aa
+----------+----------+
SELECT * FROM W0CASE PARTITION (P1) ORDER BY W0_TEST0 DESC;
+----------+----------+
| W0_TEST0 | W0_TEST1 |
+----------+----------+
+----------+----------+
DROP TABLE W0CASE ;

CREATE TABLE W0CASE ( W0_TEST0 INT , W0_TEST1 CHAR(100) )
            PARTITION BY HASH ( W0_TEST0 + 1 )
            (PARTITION P0 , PARTITION P1 );
LOAD DATA INFILE 'data_for_mysqltest_loaddata/Load_Table_Com_mysql/A45.txt' REPLACE INTO TABLE W0CASE FIELDS TERMINATED BY ',' OPTIONALLY ENCLOSED BY '/' ESCAPED BY '\\' LINES TERMINATED BY '/' IGNORE 1 LINES;
SELECT * FROM W0CASE PARTITION (P0) ORDER BY W0_TEST0 DESC;
+----------+----------+
| W0_TEST0 | W0_TEST1 |
+----------+----------+
+----------+----------+
SELECT * FROM W0CASE PARTITION (P1) ORDER BY W0_TEST0 DESC;
+----------+----------+
| W0_TEST0 | W0_TEST1 |
+----------+----------+
+----------+----------+
DROP TABLE W0CASE ;

CREATE TABLE W0CASE ( W0_TEST0 INT , W0_TEST1 CHAR(100) )
            PARTITION BY KEY ( W0_TEST0 )
            (PARTITION P0 , PARTITION P1 );
LOAD DATA INFILE 'data_for_mysqltest_loaddata/Load_Table_Com_mysql/A45.txt' REPLACE INTO TABLE W0CASE FIELDS TERMINATED BY ',' OPTIONALLY ENCLOSED BY '/' ESCAPED BY '\\' LINES TERMINATED BY '/' IGNORE 0 LINES;
SELECT * FROM W0CASE PARTITION (P0) ORDER BY W0_TEST0 DESC;
+----------+----------+
| W0_TEST0 | W0_TEST1 |
+----------+----------+
/2  |
|        1 | asde
+----------+----------+
SELECT * FROM W0CASE PARTITION (P1) ORDER BY W0_TEST0 DESC;
+----------+----------+
| W0_TEST0 | W0_TEST1 |
+----------+----------+
+----------+----------+
DROP TABLE W0CASE ;

#obmysql_mysql_load_1_3_2_2
CREATE TABLE W0CASE ( W0_TEST0 INT , W0_TEST1 CHAR(100) )
            PARTITION BY RANGE COLUMNS ( W0_TEST0 )
            SUBPARTITION BY HASH (W0_TEST0 + 1)
            ( PARTITION P0 VALUES LESS THAN (10) ( SUBPARTITION P00 , SUBPARTITION P01 ) , PARTITION P1 VALUES LESS THAN (20) ( SUBPARTITION P10 , SUBPARTITION P11));
LOAD DATA INFILE 'data_for_mysqltest_loaddata/Load_Table_Com_mysql/A45.txt' REPLACE INTO TABLE W0CASE FIELDS TERMINATED BY ',' OPTIONALLY ENCLOSED BY '/' ESCAPED BY '\\' LINES TERMINATED BY '/' IGNORE 0 LINES;
SELECT * FROM W0CASE PARTITION (P0) ORDER BY W0_TEST0 DESC;
+----------+----------+
| W0_TEST0 | W0_TEST1 |
+----------+----------+
/2  |
|        1 | asde
+----------+----------+
SELECT * FROM W0CASE PARTITION (P1) ORDER BY W0_TEST0 DESC;
+----------+----------+
| W0_TEST0 | W0_TEST1 |
+----------+----------+
+----------+----------+
SELECT * FROM W0CASE PARTITION (P00) ORDER BY W0_TEST0 DESC;
+----------+----------+
| W0_TEST0 | W0_TEST1 |
+----------+----------+
/2  |
|        1 | asde
+----------+----------+
SELECT * FROM W0CASE PARTITION (P01) ORDER BY W0_TEST0 DESC;
+----------+----------+
| W0_TEST0 | W0_TEST1 |
+----------+----------+
+----------+----------+
SELECT * FROM W0CASE PARTITION (P10) ORDER BY W0_TEST0 DESC;
+----------+----------+
| W0_TEST0 | W0_TEST1 |
+----------+----------+
+----------+----------+
SELECT * FROM W0CASE PARTITION (P11) ORDER BY W0_TEST0 DESC;
+----------+----------+
| W0_TEST0 | W0_TEST1 |
+----------+----------+
+----------+----------+
DROP TABLE W0CASE ;

CREATE TABLE W0CASE ( W0_TEST0 INT , W0_TEST1 CHAR(100) )
            PARTITION BY RANGE COLUMNS ( W0_TEST0 )
            SUBPARTITION BY KEY (W0_TEST0)
            ( PARTITION P0 VALUES LESS THAN (10) ( SUBPARTITION P00 , SUBPARTITION P01 ) , PARTITION P1 VALUES LESS THAN (20) ( SUBPARTITION P10 , SUBPARTITION P11));
LOAD DATA INFILE 'data_for_mysqltest_loaddata/Load_Table_Com_mysql/A45.txt' REPLACE INTO TABLE W0CASE FIELDS TERMINATED BY ',' OPTIONALLY ENCLOSED BY '/' ESCAPED BY '\\' LINES TERMINATED BY '/' IGNORE 0 LINES;
SELECT * FROM W0CASE PARTITION (P0) ORDER BY W0_TEST0 DESC;
+----------+----------+
| W0_TEST0 | W0_TEST1 |
+----------+----------+
/2  |
|        1 | asde
+----------+----------+
SELECT * FROM W0CASE PARTITION (P1) ORDER BY W0_TEST0 DESC;
+----------+----------+
| W0_TEST0 | W0_TEST1 |
+----------+----------+
+----------+----------+
SELECT * FROM W0CASE PARTITION (P00) ORDER BY W0_TEST0 DESC;
+----------+----------+
| W0_TEST0 | W0_TEST1 |
+----------+----------+
/2  |
|        1 | asde
+----------+----------+
SELECT * FROM W0CASE PARTITION (P01) ORDER BY W0_TEST0 DESC;
+----------+----------+
| W0_TEST0 | W0_TEST1 |
+----------+----------+
+----------+----------+
SELECT * FROM W0CASE PARTITION (P10) ORDER BY W0_TEST0 DESC;
+----------+----------+
| W0_TEST0 | W0_TEST1 |
+----------+----------+
+----------+----------+
SELECT * FROM W0CASE PARTITION (P11) ORDER BY W0_TEST0 DESC;
+----------+----------+
| W0_TEST0 | W0_TEST1 |
+----------+----------+
+----------+----------+
DROP TABLE W0CASE ;

DROP TABLE W0CASE;
DROP TABLE W1CASE;

drop user WCY@'%' ;

