#Environmental cleaning
drop user longpy@'%';
create user longpy identified by 'longpy';
grant all on *.* to longpy WITH GRANT OPTION;
DROP TABLE t1;
DROP TABLE t2;
DROP TABLE t3;
CREATE TABLE t1(id int,consumer char(20), brand varchar(20),sal int);
INSERT INTO t1 VALUES(1,'书局','apple',5000);
INSERT INTO t1 VALUES(2,'微山','xiaomi',4000);
INSERT INTO t1 VALUES(3,'深咖','oppo',3000);
INSERT INTO t1 VALUES(4,'流苏','huawei',6000);
CREATE TABLE t2(id int,model varchar(200),Price int);
INSERT INTO t2 VALUES(1,'apple 12',7000);
INSERT INTO t2 VALUES(2,'xiaomi 9',5000);
INSERT INTO t2 VALUES(3,'oppo findx',6000);
INSERT INTO t2 VALUES(4,'huawei mata30',8000);
obmysql-greatest-3
obmysql-greatest-3-1
SELECT GREATEST(e.id,e.consumer,e.brand,e.sal) FROM t1 e;
GREATEST(e.id,e.consumer,e.brand,e.sal)
5000
4000
3000
6000
SELECT GREATEST(e.consumer,e.id,e.brand,e.sal) FROM t1 e;
GREATEST(e.consumer,e.id,e.brand,e.sal)
5000
4000
3000
6000
SELECT GREATEST(e.sal,p.price) money,GREATEST(e.brand,p.model) model FROM t1 e LEFT JOIN t2 p ON e.id = p.id ORDER BY e.id DESC;
money	model
8000	huawei mata30
6000	oppo findx
5000	xiaomi 9
7000	apple 12
SELECT GREATEST(e.sal,p.price) money,GREATEST(e.brand,p.model) model FROM t1 e RIGHT JOIN t2 p ON e.id = p.id ORDER BY e.id DESC;
money	model
8000	huawei mata30
6000	oppo findx
5000	xiaomi 9
7000	apple 12
SELECT GREATEST(e.sal,p.price) money,GREATEST(e.brand,p.model) model FROM t1 e INNER JOIN t2 p ON e.id = p.id ORDER BY e.id DESC;
money	model
8000	huawei mata30
6000	oppo findx
5000	xiaomi 9
7000	apple 12
SELECT * FROM (SELECT e.id,GREATEST(e.sal,p.price) price,GREATEST(e.brand,p.model)model FROM t1 e LEFT JOIN t2 p ON e.id = p.id ) e ORDER BY e.id;
id	price	model
1	7000	apple 12
2	5000	xiaomi 9
3	6000	oppo findx
4	8000	huawei mata30
SELECT *  FROM t1 e WHERE GREATEST(e.id,e.sal) = ANY (SELECT GREATEST(p.id,p.price) FROM t2 p ) ORDER BY e.id;
id	consumer	brand	sal
1	书局	apple	5000
4	流苏	huawei	6000
SELECT *  FROM t1 e WHERE GREATEST(e.id,e.sal) < ANY (SELECT GREATEST(p.id,p.price) FROM t2 p) ORDER BY e.id;
id	consumer	brand	sal
1	书局	apple	5000
2	微山	xiaomi	4000
3	深咖	oppo	3000
4	流苏	huawei	6000
SELECT *  FROM t1 e WHERE GREATEST(e.consumer,e.brand,e.sal) > ANY (SELECT GREATEST(p.model,p.price) FROM t2 p) ORDER BY e.id;
id	consumer	brand	sal
4	流苏	huawei	6000
SELECT *  FROM t1 e WHERE GREATEST(e.id,e.sal) < ALL (SELECT GREATEST(p.id,p.price) FROM t2 p) ORDER BY e.id;
id	consumer	brand	sal
2	微山	xiaomi	4000
3	深咖	oppo	3000
SELECT *  FROM t1 e WHERE GREATEST(e.consumer,e.brand,e.sal) > ALL (SELECT GREATEST(p.model,p.price) FROM t2 p) ORDER BY e.id;
id	consumer	brand	sal
SELECT *  FROM t1 e WHERE GREATEST(e.id,e.sal) = ALL (SELECT GREATEST(p.id,p.price) FROM t2 p WHERE p.model = 'oppo findx') ORDER BY e.id;
id	consumer	brand	sal
4	流苏	huawei	6000
SELECT *  FROM t1 e WHERE EXISTS (SELECT GREATEST(p.id,p.price) FROM t2 p ) ORDER BY e.id;
id	consumer	brand	sal
1	书局	apple	5000
2	微山	xiaomi	4000
3	深咖	oppo	3000
4	流苏	huawei	6000
SELECT *  FROM t1 e WHERE EXISTS (SELECT GREATEST(p.model,p.price) FROM t2 p) ORDER BY e.id;
id	consumer	brand	sal
1	书局	apple	5000
2	微山	xiaomi	4000
3	深咖	oppo	3000
4	流苏	huawei	6000
SELECT *  FROM t1 e WHERE EXISTS (SELECT GREATEST(p.model,p.id,p.price) FROM t2 p) ORDER BY e.id;
id	consumer	brand	sal
1	书局	apple	5000
2	微山	xiaomi	4000
3	深咖	oppo	3000
4	流苏	huawei	6000
SELECT GREATEST(e.consumer,e.brand,e.sal)  FROM t1 e WHERE NOT EXISTS (SELECT p.id,p.price FROM t2 p WHERE GREATEST(p.id,p.price) = 7500 ) ORDER BY e.id;
GREATEST(e.consumer,e.brand,e.sal)
5000
4000
3000
6000
SELECT GREATEST(e.consumer,e.brand,e.sal)  FROM t1 e WHERE NOT EXISTS (SELECT p.id,p.price FROM t2 p WHERE GREATEST(p.model,p.price) = 'apple 12' ) ORDER BY e.id;
GREATEST(e.consumer,e.brand,e.sal)
5000
4000
3000
6000
SELECT GREATEST(e.consumer,e.brand,e.sal)  FROM t1 e WHERE NOT EXISTS (SELECT p.id,p.price FROM t2 p WHERE GREATEST(p.model,p.price) = 'apple 12 ' ) ORDER BY e.id;
GREATEST(e.consumer,e.brand,e.sal)
5000
4000
3000
6000
CREATE TABLE t3 AS SELECT GREATEST(e.consumer,e.brand)  FROM t1 e WHERE GREATEST(e.id,e.sal) = 6000;
select * from t3;
GREATEST(e.consumer,e.brand)
流苏
drop table t3;
CREATE TABLE t3 AS SELECT GREATEST(e.consumer,e.brand)name  FROM t1 e WHERE GREATEST(e.id,e.sal) = 6000;
SELECT *  FROM t3;
name
流苏
SELECT GREATEST(e.brand,e.consumer) FROM t1 e WHERE GREATEST(e.brand,e.consumer) LIKE '%山%';
GREATEST(e.brand,e.consumer)
微山
SELECT GREATEST(e.sal,p.price) FROM t1 e LEFT JOIN t2 p ON e.id = p.id WHERE GREATEST(e.sal,p.price) LIKE '%00%';
GREATEST(e.sal,p.price)
7000
5000
6000
8000
SELECT * FROM t1 e WHERE GREATEST(e.consumer,e.brand) = '书局';
id	consumer	brand	sal
1	书局	apple	5000
SELECT * FROM t1 e WHERE GREATEST(e.consumer,e.brand) = '书局                ';
id	consumer	brand	sal
1	书局	apple	5000
SELECT * FROM t1 e WHERE GREATEST(e.id,e.sal) > 4000 ORDER BY e.id;
id	consumer	brand	sal
1	书局	apple	5000
4	流苏	huawei	6000
SELECT * FROM t1 e WHERE GREATEST(e.id,e.sal) < 5000 ORDER BY e.id;
id	consumer	brand	sal
2	微山	xiaomi	4000
3	深咖	oppo	3000
SELECT * FROM t1 e WHERE GREATEST(e.id,e.sal) = 3000 ORDER BY e.id;
id	consumer	brand	sal
3	深咖	oppo	3000
SELECT e.id,GREATEST(e.brand,e.consumer) FROM t1 e WHERE GREATEST(e.id,e.sal) > 4000 ORDER BY GREATEST(e.id,e.sal);
id	GREATEST(e.brand,e.consumer)
1	书局
4	流苏
SELECT e.id,GREATEST(e.brand,e.consumer) FROM t1 e WHERE GREATEST(e.id,e.sal) > 4000 ORDER BY GREATEST(e.id,e.sal) DESC;
id	GREATEST(e.brand,e.consumer)
4	流苏
1	书局
SELECT e.id,GREATEST(e.brand,e.consumer) FROM t1 e WHERE GREATEST(e.id,e.sal) > 4000 ORDER BY GREATEST(e.brand,e.consumer);
id	GREATEST(e.brand,e.consumer)
1	书局
4	流苏
SELECT e.id,GREATEST(e.brand,e.consumer) FROM t1 e WHERE GREATEST(e.id,e.sal) > 4000 ORDER BY GREATEST(e.brand,e.consumer) DESC;
id	GREATEST(e.brand,e.consumer)
4	流苏
1	书局
SELECT SUM(GREATEST(e.sal,p.price)) FROM t1 e LEFT JOIN t2 p ON e.id = p.id GROUP BY GREATEST(e.sal,p.price),e.id ORDER BY e.id ;
SUM(GREATEST(e.sal,p.price))
7000
5000
6000
8000
SELECT SUM(GREATEST(e.sal,p.price)) FROM t1 e LEFT JOIN t2 p ON e.id = p.id GROUP BY GREATEST(e.sal,p.price),e.id HAVING SUM(GREATEST(e.sal,p.price)) > 6000 ORDER BY e.id;
SUM(GREATEST(e.sal,p.price))
7000
8000
SELECT id,GREATEST(consumer,brand,CASE WHEN sal < 4000 THEN NULL ELSE sal END) name FROM t1 ORDER BY id;
id	name
1	5000
2	4000
3	NULL
4	6000
SELECT id,CASE GREATEST(id,sal) WHEN 3000 THEN '低' WHEN 4000 THEN '一般' ELSE '高' END FROM t1 ORDER BY id;
id	CASE GREATEST(id,sal) WHEN 3000 THEN '低' WHEN 4000 THEN '一般' ELSE '高' END
1	高
2	一般
3	低
4	高
SELECT (CASE GREATEST(id,sal) WHEN 3000 THEN '低' WHEN 4000 THEN '一般' ELSE '高' END) FROM t1 GROUP BY (CASE GREATEST(id,sal) WHEN 3000 THEN '低' WHEN 4000 THEN '一般' ELSE '高' END),id ORDER BY id ;
(CASE GREATEST(id,sal) WHEN 3000 THEN '低' WHEN 4000 THEN '一般' ELSE '高' END)
高
一般
低
高
obmysql-greatest-3-2
INSERT INTO t2 SELECT *  FROM t2 WHERE GREATEST(id,price) = 5000;
SELECT COUNT(*) FROM t2;
COUNT(*)
5
INSERT INTO t2 SELECT *  FROM t2 WHERE GREATEST(id,price) > 6000;
SELECT COUNT(*) FROM t2;
COUNT(*)
7
INSERT INTO t3 SELECT GREATEST(model,price) FROM t2 WHERE price > 7000 ORDER BY GREATEST(model,price) DESC;
SELECT *  FROM  t3;
name
流苏
obmysql-greatest-3-3
UPDATE t2 SET MODEL = 'xiaomi 10' WHERE GREATEST(id,price) = 5000;
SELECT model FROM t2;
model
apple 12
xiaomi 10
oppo findx
huawei mata30
xiaomi 10
apple 12
huawei mata30
UPDATE t2 SET price = '9000' WHERE GREATEST(id,price) < 7000;
SELECT price FROM t2;
price
7000
9000
9000
8000
9000
7000
8000
UPDATE t2 SET price = (SELECT GREATEST(id,sal) FROM t1 WHERE GREATEST(id,sal) > 5000) WHERE id = 1 ;
SELECT price FROM t2;
price
6000
9000
9000
8000
9000
6000
8000
obmysql-greatest-3-4
DELETE FROM t2 WHERE GREATEST(model,price) = 'oppo findx';
SELECT COUNT(*) FROM t2;
COUNT(*)
7
DELETE FROM t2 WHERE GREATEST(id,price) = 9000;
SELECT COUNT(*) FROM t2;
COUNT(*)
4
DELETE FROM t2 WHERE GREATEST(id,price) <= 8000 ;
SELECT COUNT(*) FROM t2;
COUNT(*)
0
DROP TABLE t1;
DROP TABLE t2;
DROP TABLE t3;
obmysql-greatest-5
obmysql-greatest-5-1
DROP TABLE t1;
DROP TABLE t2;
DROP TABLE t3;
DROP VIEW t1_view;
DROP VIEW t2_view;
CREATE TABLE t1(id int,consumer char(20), brand varchar(20),sal int);
INSERT INTO t1 VALUES(1,'书局','apple',5000);
INSERT INTO t1 VALUES(2,'微山','xiaomi',4000);
INSERT INTO t1 VALUES(3,'深咖','oppo',3000);
INSERT INTO t1 VALUES(4,'流苏','huawei',6000);
CREATE TABLE t2(id int,model varchar(200),Price int);
INSERT INTO t2 VALUES(1,'apple 12',7000);
INSERT INTO t2 VALUES(2,'xiaomi 9',5000);
INSERT INTO t2 VALUES(3,'oppo findx',6000);
INSERT INTO t2 VALUES(4,'huawei mata30',8000);
CREATE VIEW t1_view AS SELECT *  FROM t1;
CREATE VIEW t2_view AS SELECT *  FROM t2;
SELECT GREATEST(e.id,e.consumer,e.brand,e.sal) FROM t1_view e;
GREATEST(e.id,e.consumer,e.brand,e.sal)
5000
4000
3000
6000
SELECT GREATEST(e.consumer,e.id,e.brand,e.sal) FROM t1_view e;
GREATEST(e.consumer,e.id,e.brand,e.sal)
5000
4000
3000
6000
SELECT GREATEST(e.sal,p.price) money,GREATEST(e.brand,p.model) model FROM t1_view e LEFT JOIN t2_view p ON e.id = p.id ORDER BY e.id DESC;
money	model
8000	huawei mata30
6000	oppo findx
5000	xiaomi 9
7000	apple 12
SELECT GREATEST(e.sal,p.price) money,GREATEST(e.brand,p.model) model FROM t1_view e RIGHT JOIN t2_view p ON e.id = p.id ORDER BY e.id DESC;
money	model
8000	huawei mata30
6000	oppo findx
5000	xiaomi 9
7000	apple 12
SELECT GREATEST(e.sal,p.price) money,GREATEST(e.brand,p.model) model FROM t1_view e INNER JOIN t2_view p ON e.id = p.id ORDER BY e.id DESC;
money	model
8000	huawei mata30
6000	oppo findx
5000	xiaomi 9
7000	apple 12
SELECT * FROM (SELECT e.id,GREATEST(e.sal,p.price) price,GREATEST(e.brand,p.model)model FROM t1_view e LEFT JOIN t2_view p ON e.id = p.id ) e ORDER BY e.id;
id	price	model
1	7000	apple 12
2	5000	xiaomi 9
3	6000	oppo findx
4	8000	huawei mata30
SELECT *  FROM t1_view e WHERE GREATEST(e.id,e.sal) < ANY (SELECT GREATEST(p.id,p.price) FROM t2_view p) ORDER BY e.id;
id	consumer	brand	sal
1	书局	apple	5000
2	微山	xiaomi	4000
3	深咖	oppo	3000
4	流苏	huawei	6000
SELECT *  FROM t1_view e WHERE GREATEST(e.id,e.sal) = ANY (SELECT GREATEST(p.id,p.price) FROM t2_view p ) ORDER BY e.id;
id	consumer	brand	sal
1	书局	apple	5000
4	流苏	huawei	6000
SELECT *  FROM t1_view e WHERE GREATEST(e.consumer,e.brand,e.sal) > ANY (SELECT GREATEST(p.model,p.price) FROM t2_view p) ORDER BY e.id;
id	consumer	brand	sal
4	流苏	huawei	6000
SELECT *  FROM t1_view e WHERE GREATEST(e.id,e.sal) < ALL (SELECT GREATEST(p.id,p.price) FROM t2_view p) ORDER BY e.id;
id	consumer	brand	sal
2	微山	xiaomi	4000
3	深咖	oppo	3000
SELECT *  FROM t1_view e WHERE GREATEST(e.consumer,e.brand,e.sal) > ALL (SELECT GREATEST(p.model,p.price) FROM t2_view p) ORDER BY e.id;
id	consumer	brand	sal
SELECT *  FROM t1_view e WHERE GREATEST(e.id,e.sal) = ALL (SELECT GREATEST(p.id,p.price) FROM t2_view p WHERE p.model = 'oppo findx') ORDER BY e.id;
id	consumer	brand	sal
4	流苏	huawei	6000
SELECT *  FROM t1_view e WHERE EXISTS (SELECT GREATEST(p.id,p.price) FROM t2_view p ) ORDER BY e.id;
id	consumer	brand	sal
1	书局	apple	5000
2	微山	xiaomi	4000
3	深咖	oppo	3000
4	流苏	huawei	6000
SELECT *  FROM t1_view e WHERE EXISTS (SELECT GREATEST(p.model,p.price) FROM t2_view p) ORDER BY e.id;
id	consumer	brand	sal
1	书局	apple	5000
2	微山	xiaomi	4000
3	深咖	oppo	3000
4	流苏	huawei	6000
SELECT *  FROM t1_view e WHERE EXISTS (SELECT GREATEST(p.model,p.id,p.price) FROM t2_view p) ORDER BY e.id;
id	consumer	brand	sal
1	书局	apple	5000
2	微山	xiaomi	4000
3	深咖	oppo	3000
4	流苏	huawei	6000
SELECT GREATEST(e.consumer,e.brand,e.sal)  FROM t1_view e WHERE NOT EXISTS (SELECT p.id,p.price FROM t2_view p WHERE GREATEST(p.id,p.price) = 7500 ) ORDER BY e.id;
GREATEST(e.consumer,e.brand,e.sal)
5000
4000
3000
6000
SELECT GREATEST(e.consumer,e.brand,e.sal)  FROM t1_view e WHERE NOT EXISTS (SELECT p.id,p.price FROM t2_view p WHERE GREATEST(p.model,p.price) = 'apple 12' ) ORDER BY e.id;
GREATEST(e.consumer,e.brand,e.sal)
5000
4000
3000
6000
SELECT GREATEST(e.consumer,e.brand,e.sal)  FROM t1_view e WHERE NOT EXISTS (SELECT p.id,p.price FROM t2_view p WHERE GREATEST(p.model,p.price) = 'apple 12 ' ) ORDER BY e.id;
GREATEST(e.consumer,e.brand,e.sal)
5000
4000
3000
6000
CREATE TABLE t3 AS SELECT GREATEST(e.consumer,e.brand)  FROM t1_view e WHERE GREATEST(e.id,e.sal) = 6000;
SELECT *  FROM t3;
GREATEST(e.consumer,e.brand)
流苏
drop table t3;
CREATE TABLE t3 AS SELECT GREATEST(e.consumer,e.brand)name  FROM t1_view e WHERE GREATEST(e.id,e.sal) = 6000;
SELECT *  FROM t3;
name
流苏
SELECT GREATEST(e.brand,e.consumer) FROM t1_view e WHERE GREATEST(e.brand,e.consumer) LIKE '%山%';
GREATEST(e.brand,e.consumer)
微山
SELECT GREATEST(e.sal,p.price) FROM t1_view e LEFT JOIN t2_view p ON e.id = p.id WHERE GREATEST(e.sal,p.price) LIKE '%00%';
GREATEST(e.sal,p.price)
7000
5000
6000
8000
SELECT * FROM t1_view e WHERE GREATEST(e.consumer,e.brand) = '书局';
id	consumer	brand	sal
1	书局	apple	5000
SELECT * FROM t1_view e WHERE GREATEST(e.consumer,e.brand) = '书局                ';
id	consumer	brand	sal
1	书局	apple	5000
SELECT * FROM t1_view e WHERE GREATEST(e.id,e.sal) > 4000 ORDER BY e.id;
id	consumer	brand	sal
1	书局	apple	5000
4	流苏	huawei	6000
SELECT * FROM t1_view e WHERE GREATEST(e.id,e.sal) < 5000 ORDER BY e.id;
id	consumer	brand	sal
2	微山	xiaomi	4000
3	深咖	oppo	3000
SELECT * FROM t1_view e WHERE GREATEST(e.id,e.sal) = 3000 ORDER BY e.id;
id	consumer	brand	sal
3	深咖	oppo	3000
SELECT e.id,GREATEST(e.brand,e.consumer) FROM t1_view e WHERE GREATEST(e.id,e.sal) > 4000 ORDER BY GREATEST(e.id,e.sal);
id	GREATEST(e.brand,e.consumer)
1	书局
4	流苏
SELECT e.id,GREATEST(e.brand,e.consumer) FROM t1_view e WHERE GREATEST(e.id,e.sal) > 4000 ORDER BY GREATEST(e.id,e.sal) DESC;
id	GREATEST(e.brand,e.consumer)
4	流苏
1	书局
SELECT e.id,GREATEST(e.brand,e.consumer) FROM t1_view e WHERE GREATEST(e.id,e.sal) > 4000 ORDER BY GREATEST(e.brand,e.consumer);
id	GREATEST(e.brand,e.consumer)
1	书局
4	流苏
SELECT e.id,GREATEST(e.brand,e.consumer) FROM t1_view e WHERE GREATEST(e.id,e.sal) > 4000 ORDER BY GREATEST(e.brand,e.consumer) DESC;
id	GREATEST(e.brand,e.consumer)
4	流苏
1	书局
SELECT SUM(GREATEST(e.sal,p.price)) FROM t1_view e LEFT JOIN t2_view p ON e.id = p.id GROUP BY GREATEST(e.sal,p.price),e.id ORDER BY e.id;
SUM(GREATEST(e.sal,p.price))
7000
5000
6000
8000
SELECT SUM(GREATEST(e.sal,p.price)) FROM t1_view e LEFT JOIN t2_view p ON e.id = p.id GROUP BY GREATEST(e.sal,p.price),e.id HAVING SUM(GREATEST(e.sal,p.price)) > 6000 ORDER BY e.id;
SUM(GREATEST(e.sal,p.price))
7000
8000
SELECT id,GREATEST(consumer,brand,CASE WHEN sal < 4000 THEN NULL ELSE sal END) name FROM t1_view ORDER BY id;
id	name
1	5000
2	4000
3	NULL
4	6000
SELECT id,CASE GREATEST(id,sal) WHEN 3000 THEN '低' WHEN 4000 THEN '一般' ELSE '高' END FROM t1_view ORDER BY id;
id	CASE GREATEST(id,sal) WHEN 3000 THEN '低' WHEN 4000 THEN '一般' ELSE '高' END
1	高
2	一般
3	低
4	高
SELECT (CASE GREATEST(id,sal) WHEN 3000 THEN '低' WHEN 4000 THEN '一般' ELSE '高' END) FROM t1_view GROUP BY (CASE GREATEST(id,sal) WHEN 3000 THEN '低' WHEN 4000 THEN '一般' ELSE '高' END),id ORDER BY id;
(CASE GREATEST(id,sal) WHEN 3000 THEN '低' WHEN 4000 THEN '一般' ELSE '高' END)
高
一般
低
高
INSERT INTO t2 SELECT *  FROM t2_view WHERE GREATEST(id,price) = 5000;
SELECT COUNT(*) FROM t2;
COUNT(*)
5
INSERT INTO t2 SELECT *  FROM t2_view WHERE GREATEST(id,price) > 6000;
SELECT COUNT(*) FROM t2;
COUNT(*)
7
INSERT INTO t3 SELECT GREATEST(model,price) FROM t2_view WHERE price > 7000 ORDER BY GREATEST(model,price) DESC;
SELECT *  FROM  t3;
name
流苏
UPDATE t2_view SET MODEL = 'xiaomi 10' WHERE GREATEST(id,price) = 5000;
SELECT model FROM t2_view;
model
apple 12
xiaomi 10
oppo findx
huawei mata30
xiaomi 10
apple 12
huawei mata30
UPDATE t2_view SET price = '9000' WHERE GREATEST(id,price) < 7000;
SELECT price FROM t2_view;
price
7000
9000
9000
8000
9000
7000
8000
UPDATE t2_view SET price = (SELECT GREATEST(id,sal) FROM t1 WHERE GREATEST(id,sal) > 5000) WHERE id = 1 ;
SELECT price FROM t2_view;
price
6000
9000
9000
8000
9000
6000
8000
DELETE FROM t2_view WHERE GREATEST(model,price) = 'oppo findx';
SELECT COUNT(*) FROM t2_view;
COUNT(*)
7
DELETE FROM t2_view WHERE GREATEST(id,price) = 9000;
SELECT COUNT(*) FROM t2_view;
COUNT(*)
4
DELETE FROM t2_view WHERE GREATEST(id,price) <= 8000 ;
SELECT COUNT(*) FROM t2_view;
COUNT(*)
0
obmysql-greatest-5-2
DROP TABLE t1;
CREATE TABLE t1(id int,consumer char(20), price varchar(20),sal int,datetime1 DATE,datetime2 bigint);
INSERT INTO t1 VALUES(1,'书局','7000',5000,'2020-09-22',20200923121200);
INSERT INTO t1 VALUES(2,'微山','3000',4000,'2020-09-21',20200921101159);
INSERT INTO t1 VALUES(3,'深咖','5000',3000,'2020-08-21',20190821101159);
INSERT INTO t1 VALUES(4,'流苏','9111',10000,'2020-02-29',20200228101159);
CREATE INDEX index_test ON t1(sal);
CREATE INDEX index_test1 ON t1(price);
CREATE INDEX index_test2 ON t1(consumer);
CREATE INDEX index_test3 ON t1(datetime1);
CREATE INDEX index_test4 ON t1(datetime2);
SELECT GREATEST(consumer,datetime1,datetime2)name,GREATEST(price,sal)sal FROM t1;
name	sal
20200923121200	7000
20200921101159	4000
20200821	5000
20200229	10000
SELECT id,consumer,GREATEST(price,sal) FROM t1 WHERE GREATEST(price,sal) = 7000 ORDER BY id DESC;
id	consumer	GREATEST(price,sal)
1	书局	7000
SELECT id,consumer,GREATEST(price,sal) FROM t1 WHERE GREATEST(price,sal) > 5000 ORDER BY GREATEST(price,sal);
id	consumer	GREATEST(price,sal)
1	书局	7000
4	流苏	10000
SELECT id,SUM(GREATEST(price,sal)) FROM t1 WHERE  GREATEST(price,sal) > 5000 GROUP BY id HAVING SUM(GREATEST(price,sal)) > 5000 ORDER BY id;
id	SUM(GREATEST(price,sal))
1	7000
4	10000
UPDATE t1 SET sal = GREATEST(1000,5665,9000,7000) WHERE GREATEST(price,sal) = 7000 ;
SELECT sal FROM t1;
sal
9000
4000
3000
10000
UPDATE t1 SET sal = (SELECT GREATEST(price,sal) FROM t1 WHERE GREATEST(price,sal) = 4000) WHERE GREATEST(price,sal) = 5000;
SELECT sal  FROM t1;
sal
9000
4000
4000
10000
INSERT INTO t1 SELECT *  FROM t1 WHERE GREATEST(price,sal) = 4000;
SELECT COUNT(*) FROM t1;
COUNT(*)
5
INSERT INTO t1 VALUES(8,'流苏','9111',GREATEST(555,6789,7988),'2020-02-29 10:11:59',20200228101159);
INSERT INTO t1 VALUES(7,GREATEST('化火凤凰','哈哈哈','咳咳咳'),'5000',3000,'2020-08-21 10:11:59',20190821101159);
SELECT COUNT(*)  FROM t1;
COUNT(*)
7
DELETE FROM t1 WHERE GREATEST(price,sal) = 4000;
SELECT COUNT(*)  FROM t1;
COUNT(*)
5
obmysql-greatest-5-3
DROP TABLE t1;
CREATE TABLE t1(id int PRIMARY KEY,consumer char(20) NOT NULL, price varchar(20),sal int  ,datetime1 DATE,datetime2 bigint,CONSTRAINT t1_name_uk UNIQUE(price));
INSERT INTO t1 VALUES(1,'书局','7000',5000,'2020-09-22 12:11:59',20200923121200);
INSERT INTO t1 VALUES(2,'微山','3000',4000,'2020-09-21 10:11:59',20200921101159);
INSERT INTO t1 VALUES(3,'深咖','5000',3000,'2020-08-21 10:11:59',20190821101159);
INSERT INTO t1 VALUES(4,'流苏','9111',10000,'2020-02-29 10:11:59',20200228101159);
SELECT GREATEST(id,price,sal),GREATEST(consumer,datetime1,datetime2) FROM t1;
GREATEST(id,price,sal)	GREATEST(consumer,datetime1,datetime2)
7000	20200923121200
4000	20200921101159
5000	20200821
10000	20200229
SELECT GREATEST(consumer,datetime1,datetime2)name,GREATEST(price,sal)sal FROM t1;
name	sal
20200923121200	7000
20200921101159	4000
20200821	5000
20200229	10000
SELECT id,consumer,GREATEST(price,sal) FROM t1 WHERE GREATEST(price,sal) = 7000 ORDER BY id DESC;
id	consumer	GREATEST(price,sal)
1	书局	7000
SELECT id,consumer,GREATEST(price,sal) FROM t1 WHERE GREATEST(price,sal) > 5000 ORDER BY GREATEST(price,sal);
id	consumer	GREATEST(price,sal)
1	书局	7000
4	流苏	10000
SELECT id,SUM(GREATEST(price,sal)) FROM t1 WHERE  GREATEST(price,sal) > 5000 GROUP BY id HAVING SUM(GREATEST(price,sal)) > 5000 ORDER BY id;
id	SUM(GREATEST(price,sal))
1	7000
4	10000
UPDATE t1 SET sal = GREATEST(1000,5665,9000,7000) WHERE GREATEST(price,sal) = 7000 ;
SELECT sal FROM t1;
sal
9000
4000
3000
10000
UPDATE t1 SET sal = (SELECT GREATEST(price,sal) FROM t1 WHERE GREATEST(price,sal) = 4000) WHERE GREATEST(price,sal) = 5000;
SELECT sal  FROM t1;
sal
9000
4000
4000
10000
INSERT INTO t1 VALUES(8,'流苏','8111',GREATEST(555,6789,7988),'2020-02-29 10:11:59',20200228101159);
INSERT INTO t1 VALUES(7,GREATEST('化火凤凰','哈哈哈','咳咳咳'),'11110',3000,'2020-08-21 10:11:59',20190821101159);
SELECT COUNT(*)  FROM t1;
COUNT(*)
6
DELETE FROM t1 WHERE GREATEST(price,sal) = 4000;
SELECT COUNT(*)  FROM t1;
COUNT(*)
5
DROP VIEW t2_view;
DROP VIEW t1_view;
DROP TABLE t1;
DROP TABLE t2;
DROP TABLE t3;
DROP TABLE t1;
CREATE TABLE t1(id int,consumer char(20), price varchar(20),sal int,datetime1 DATE,datetime2 bigint);
INSERT INTO t1 VALUES(1,'书局','7000',5000,'2020-09-22 12:11:59',20200923121200);
INSERT INTO t1 VALUES(2,'微山','3000',4000,'2020-09-21 10:11:59',20200921101159);
INSERT INTO t1 VALUES(3,'深咖','5000',3000,'2020-08-21 10:11:59',20190821101159);
INSERT INTO t1 VALUES(4,'流苏','9111',10000,'2020-02-29 10:11:59',20200228101159);
obmysql-greatest-6
obmysql-greatest-6-1
SELECT GREATEST(GREATEST(consumer,price),datetime1) FROM t1;
GREATEST(GREATEST(consumer,price),datetime1)
2020-09-22
2020-09-21
2020-08-21
2020-02-29
SELECT GREATEST(GREATEST(GREATEST(consumer,price),datetime1),datetime2) FROM t1;
GREATEST(GREATEST(GREATEST(consumer,price),datetime1),datetime2)
20200923121200
20200921101159
20190821101159
20200228101159
SELECT SUM(GREATEST(price,sal)) FROM t1 ORDER BY id;
SUM(GREATEST(price,sal))
26000
SELECT GREATEST(sal,SUM(price)) FROM t1 ORDER BY id;
GREATEST(sal,SUM(price))
24111
SELECT GREATEST(SUM(sal),SUM(price)) FROM t1 ORDER BY id;
GREATEST(SUM(sal),SUM(price))
24111
SELECT COUNT(GREATEST(price,sal)) FROM t1 ORDER BY id;
COUNT(GREATEST(price,sal))
4
SELECT GREATEST(COUNT(sal),COUNT(price)) FROM t1 ORDER BY id;
GREATEST(COUNT(sal),COUNT(price))
4
SELECT MAX(GREATEST(price,sal)) FROM t1 ORDER BY id;
MAX(GREATEST(price,sal))
10000
SELECT GREATEST(MAX(sal),MAX(price)) FROM t1 ORDER BY id;
GREATEST(MAX(sal),MAX(price))
10000
SELECT MIN(GREATEST(price,sal)) FROM t1 ORDER BY id;
MIN(GREATEST(price,sal))
4000
SELECT GREATEST(MIN(sal),MIN(price)) FROM t1 ORDER BY id;
GREATEST(MIN(sal),MIN(price))
3000
SELECT AVG(GREATEST(price,sal)) FROM t1 ORDER BY id;
AVG(GREATEST(price,sal))
6500
SELECT GREATEST(AVG(sal),AVG(price)) FROM t1 ORDER BY id;
GREATEST(AVG(sal),AVG(price))
6027.75
SELECT ABS(GREATEST(price,sal)) FROM t1 ORDER BY id;
ABS(GREATEST(price,sal))
7000
4000
5000
10000
SELECT GREATEST(ABS(sal),ABS(price)) FROM t1 ORDER BY id;
GREATEST(ABS(sal),ABS(price))
7000
4000
5000
10000
SELECT CEIL(GREATEST(price,sal)) FROM t1 ORDER BY id;
CEIL(GREATEST(price,sal))
7000
4000
5000
10000
SELECT GREATEST(CEIL(sal),CEIL(price)) FROM t1 ORDER BY id;
GREATEST(CEIL(sal),CEIL(price))
7000
4000
5000
10000
SELECT FLOOR(GREATEST(price,sal)) FROM t1 ORDER BY id;
FLOOR(GREATEST(price,sal))
7000
4000
5000
10000
SELECT GREATEST(FLOOR(sal),FLOOR(price)) FROM t1 ORDER BY id;
GREATEST(FLOOR(sal),FLOOR(price))
7000
4000
5000
10000
SELECT MOD(GREATEST(price,sal),33) FROM t1 ORDER BY id;
MOD(GREATEST(price,sal),33)
4
7
17
1
SELECT GREATEST(MOD(sal,3),MOD(price,7)) FROM t1 ORDER BY id;
GREATEST(MOD(sal,3),MOD(price,7))
2
4
2
4
SELECT LENGTH(GREATEST(consumer,datetime1)) FROM t1;
LENGTH(GREATEST(consumer,datetime1))
10
10
10
10
SELECT GREATEST(LENGTH(consumer),LENGTH(datetime1)) FROM t1;
GREATEST(LENGTH(consumer),LENGTH(datetime1))
10
10
10
10
SELECT INSTR(GREATEST(consumer,datetime1),'书') FROM t1;
INSTR(GREATEST(consumer,datetime1),'书')
0
0
0
0
SELECT GREATEST(INSTR(consumer,'书'),INSTR(datetime1,'2')) FROM t1;
GREATEST(INSTR(consumer,'书'),INSTR(datetime1,'2'))
1
1
1
1
SELECT GREATEST(consumer,CAST(datetime1 AS CHAR(200))) FROM t1;
GREATEST(consumer,CAST(datetime1 AS CHAR(200)))
书局
微山
深咖
流苏
SELECT CAST(GREATEST(consumer,datetime1) AS CHAR(200)) FROM t1;
CAST(GREATEST(consumer,datetime1) AS CHAR(200))
2020-09-22
2020-09-21
2020-08-21
2020-02-29
obmysql-greatest-7
obmysql-greatest-7-1
SELECT GREATEST(price * 10,sal / 21) FROM t1;
GREATEST(price * 10,sal / 21)
70000
30000
50000
91110
SELECT GREATEST(price + 1500,sal - 1000) FROM t1;
GREATEST(price + 1500,sal - 1000)
8500
4500
6500
10611
SELECT GREATEST(price + 1500 * 10,sal - 1000 *20) FROM t1;
GREATEST(price + 1500 * 10,sal - 1000 *20)
22000
18000
20000
24111
SELECT GREATEST(price * 10 - 10000,sal / 21 + 1000) FROM t1;
GREATEST(price * 10 - 10000,sal / 21 + 1000)
60000
20000
40000
81110
SELECT GREATEST(consumer||price, datetime1 || datetime2) FROM t1;
GREATEST(consumer||price, datetime1 || datetime2)
1
1
1
1
obmysql-greatest-7-2
SELECT GREATEST(price,sal) FROM t1;
GREATEST(price,sal)
7000
4000
5000
10000
SELECT GREATEST(consumer,datetime1) FROM t1;
GREATEST(consumer,datetime1)
2020-09-22
2020-09-21
2020-08-21
2020-02-29
SELECT id,sal,datetime1 FROM t1 WHERE GREATEST(price,sal) = 7000;
id	sal	datetime1
1	5000	2020-09-22
SELECT id,sal,datetime1 FROM t1 WHERE GREATEST(price,sal) < 7000;
id	sal	datetime1
2	4000	2020-09-21
3	3000	2020-08-21
SELECT id,sal,datetime1 FROM t1 WHERE GREATEST(price,sal) > 7000;
id	sal	datetime1
4	10000	2020-02-29
SELECT id,sal,datetime1 FROM t1 WHERE GREATEST(price,sal) >= 7000;
id	sal	datetime1
1	5000	2020-09-22
4	10000	2020-02-29
SELECT id,sal,datetime1 FROM t1 WHERE GREATEST(price,sal) <= 7000;
id	sal	datetime1
1	5000	2020-09-22
2	4000	2020-09-21
3	3000	2020-08-21
SELECT id,sal,datetime1 FROM t1 WHERE GREATEST(price,sal) != 7000;
id	sal	datetime1
2	4000	2020-09-21
3	3000	2020-08-21
4	10000	2020-02-29
SELECT id,sal,datetime1 FROM t1 WHERE GREATEST(price,sal) <> 7000;
id	sal	datetime1
2	4000	2020-09-21
3	3000	2020-08-21
4	10000	2020-02-29
obmysql-greatest-7-3
SELECT id,sal,datetime1 FROM t1 WHERE GREATEST(price,sal) = 7000 OR  GREATEST(consumer,datetime1) = '深咖                ';
id	sal	datetime1
1	5000	2020-09-22
SELECT id,sal,datetime1 FROM t1 WHERE GREATEST(price,sal) = 7000 AND GREATEST(consumer,datetime1) = '书局                ';
id	sal	datetime1
SELECT id,sal,datetime1 FROM t1 WHERE GREATEST(price,sal) = 7000  OR  GREATEST(consumer,datetime1) = '深咖                ' AND GREATEST(consumer,datetime1) = '书局                ';
id	sal	datetime1
1	5000	2020-09-22
drop table t1;
# Clean up users
drop user longpy@'%' ;
