#Environmental cleaning
drop user longpy@'%';
create user longpy identified by 'longpy';
grant all on *.* to longpy WITH GRANT OPTION;
drop table t1;
create table t1 (name varchar(20),sal varchar(20));
insert into t1 values('Smith','4500'),('MarTin','3900'),('Clark','5200'),('ScotT','3500'),('TurNeR','4785'),('JaMeS','7856');
obmysql-upper-1-6
obmysql-upper-1-6-1
select upper(e.sal*5-200) / upper(e.sal/5-500) from t1 e;
upper(e.sal*5-200) / upper(e.sal/5-500)
36.482449589245704
47.77777777777778
51.91466083150985
55.75
68.92857142857143
86.5
select upper(e.sal+1000) + upper(e.sal-100*2) sal from t1 e;
sal
10370
11200
16512
7800
8600
9800
select upper(e.sal*5-500/2) - upper(e.sal * 2) sal from t1 e;
sal
10250
11450
13250
14105
15350
23318
select upper(e.sal-1000) * 2 - upper(e.sal + 800) sal from t1 e;
sal
1100
1700
1985
2400
5056
700
select upper(e.sal+1000/2*1.5) + upper(e.sal-100*5+2) from t1 e;
upper(e.sal+1000/2*1.5) + upper(e.sal-100*5+2)
10652
15964
7252
8052
9252
9822
select upper(e.sal/50-1000) * upper(e.sal/100-30) sal from t1 e;
sal
-13650
-16141.755000000001
-19712
-40930.2528
-4650
-8298
select upper(e.name)name,upper(e.sal)sal from t1 e where upper(e.sal) > 5000;
name	sal
CLARK	5200
JAMES	7856
select upper(e.name)name,upper(e.sal)sal from t1 e where upper(e.sal) >= 4500;
name	sal
CLARK	5200
JAMES	7856
SMITH	4500
TURNER	4785
select upper(e.name)name,upper(e.sal)sal from t1 e where upper(e.sal) < 5000;
name	sal
MARTIN	3900
SCOTT	3500
SMITH	4500
TURNER	4785
select upper(e.name)name,upper(e.sal)sal from t1 e where upper(e.sal) <= 4000;
name	sal
MARTIN	3900
SCOTT	3500
select upper(e.name)name,upper(e.sal)sal from t1 e where upper(e.name) = 'JAMES';
name	sal
JAMES	7856
select upper(e.name)name,upper(e.sal)sal from t1 e where upper(e.name) != 'CLARK';
name	sal
JAMES	7856
MARTIN	3900
SCOTT	3500
SMITH	4500
TURNER	4785
select upper(e.name)name,upper(e.sal)sal from t1 e where upper(e.name) <> 'SCOTT';
name	sal
CLARK	5200
JAMES	7856
MARTIN	3900
SMITH	4500
TURNER	4785
select upper(e.name)name,upper(e.sal)sal from t1 e where upper(e.name) in ('SMITH','CLARK');
name	sal
CLARK	5200
SMITH	4500
select upper(e.name)name,upper(e.sal)sal from t1 e where upper(e.name) not in ('SMITH','CLARK');
name	sal
JAMES	7856
MARTIN	3900
SCOTT	3500
TURNER	4785
select upper(e.name)name,upper(e.sal)sal from t1 e where upper(e.name) = 'SMITH' and upper(e.sal) = 4500;
name	sal
SMITH	4500
select upper(e.name)name,upper(e.sal)sal from t1 e where upper(e.name) = 'SMITH' or upper(e.sal) = 3900;
name	sal
MARTIN	3900
SMITH	4500
select upper(e.name)name,upper(e.sal)sal from t1 e where upper(e.name) = 'SMITH' or upper(e.name) = 'CLARK';
name	sal
CLARK	5200
SMITH	4500
select sum(upper(e.sal))sal from t1 e;
sal
29741
select upper(sum(e.sal))sal from t1 e;
sal
29741
select avg(upper(e.sal))sal from t1 e;
sal
4956.833333333333
select upper(avg(e.sal))sal from t1 e;
sal
4956.833333333333
select abs(upper(e.sal))sal from t1 e;
sal
3500
3900
4500
4785
5200
7856
select upper(abs(e.sal))sal from t1 e;
sal
3500
3900
4500
4785
5200
7856
select ceil(upper(e.sal))sal from t1 e;
sal
3500
3900
4500
4785
5200
7856
select upper(ceil(e.sal))sal from t1 e;
sal
3500
3900
4500
4785
5200
7856
select floor(upper(e.sal))sal from t1 e;
sal
3500
3900
4500
4785
5200
7856
select upper(floor(e.sal))sal from t1 e;
sal
3500
3900
4500
4785
5200
7856
select mod(upper(e.sal),7)sal from t1 e;
sal
0
1
2
4
6
6
select upper(mod(e.sal,7))sal from t1 e;
sal
0
1
2
4
6
6
select length(upper(e.name))name from t1 e;
name
5
5
5
5
6
6
select upper(length(e.name))name from t1 e;
name
5
5
5
5
6
6
select instr(upper(e.name),'T')name from t1 e;
name
0
0
1
4
4
4
select upper(instr(e.name,'t'))name from t1 e;
name
0
0
1
4
4
4
select max(upper(e.sal))sal from t1 e;
sal
7856
select upper(max(e.sal))sal from t1 e;
sal
7856
select min(upper(e.sal))sal from t1 e;
sal
3500
select upper(min(e.sal))sal from t1 e;
sal
3500
select cast(upper(e.name) as char(20)) from t1 e;
cast(upper(e.name) as char(20))
CLARK
JAMES
MARTIN
SCOTT
SMITH
TURNER
select upper(cast(e.name as char(20))) from t1 e;
upper(cast(e.name as char(20)))
CLARK
JAMES
MARTIN
SCOTT
SMITH
TURNER
select upper(concat(e.name,e.sal)) from t1 e;
upper(concat(e.name,e.sal))
CLARK5200
JAMES7856
MARTIN3900
SCOTT3500
SMITH4500
TURNER4785
select concat(upper(e.name),upper(e.sal))sal from t1 e;
sal
CLARK5200
JAMES7856
MARTIN3900
SCOTT3500
SMITH4500
TURNER4785
select convert(upper(e.name) using gbk) from t1 e;
convert(upper(e.name) using gbk)
CLARK
JAMES
MARTIN
SCOTT
SMITH
TURNER
select convert(upper(e.name) using utf16) from t1 e;
convert(upper(e.name) using utf16)
CLARK
JAMES
MARTIN
SCOTT
SMITH
TURNER
select convert(upper(e.name) using utf8mb4) from t1 e;
convert(upper(e.name) using utf8mb4)
CLARK
JAMES
MARTIN
SCOTT
SMITH
TURNER
select convert(upper(e.name) using gb18030) from t1 e;
convert(upper(e.name) using gb18030)
CLARK
JAMES
MARTIN
SCOTT
SMITH
TURNER
select upper(convert(e.name using gbk)) from t1 e ;
upper(convert(e.name using gbk))
CLARK
JAMES
MARTIN
SCOTT
SMITH
TURNER
select upper(convert(e.name using utf16)) from t1 e;
upper(convert(e.name using utf16))
CLARK
JAMES
MARTIN
SCOTT
SMITH
TURNER
select upper(convert(e.name using utf8mb4)) from t1 e ;
upper(convert(e.name using utf8mb4))
CLARK
JAMES
MARTIN
SCOTT
SMITH
TURNER
select upper(convert(e.name using gb18030)) from t1 e;
upper(convert(e.name using gb18030))
CLARK
JAMES
MARTIN
SCOTT
SMITH
TURNER
select upper(trim(e.name)) from t1 e;
upper(trim(e.name))
CLARK
JAMES
MARTIN
SCOTT
SMITH
TURNER
select trim(upper(e.name)) from t1 e;
trim(upper(e.name))
CLARK
JAMES
MARTIN
SCOTT
SMITH
TURNER
select upper(rtrim(e.name)) from t1 e;
upper(rtrim(e.name))
CLARK
JAMES
MARTIN
SCOTT
SMITH
TURNER
select rtrim(upper(e.name)) from t1 e;
rtrim(upper(e.name))
CLARK
JAMES
MARTIN
SCOTT
SMITH
TURNER
select upper(ltrim(e.name)) from t1 e;
upper(ltrim(e.name))
CLARK
JAMES
MARTIN
SCOTT
SMITH
TURNER
select ltrim(upper(e.name)) from t1 e;
ltrim(upper(e.name))
CLARK
JAMES
MARTIN
SCOTT
SMITH
TURNER
select upper(upper(upper(upper(e.name)))) from t1 e;
upper(upper(upper(upper(e.name))))
CLARK
JAMES
MARTIN
SCOTT
SMITH
TURNER
select upper(lower(upper(lower(e.name)))) from t1 e;
upper(lower(upper(lower(e.name))))
CLARK
JAMES
MARTIN
SCOTT
SMITH
TURNER
obmysql-upper-1-7
obmysql-upper-1-7-1
select lower(e.sal*5-200) / lower(e.sal/5-500) from t1 e;
lower(e.sal*5-200) / lower(e.sal/5-500)
36.482449589245704
47.77777777777778
51.91466083150985
55.75
68.92857142857143
86.5
select lower(e.sal+1000) + lower(e.sal-100*2) sal from t1 e;
sal
10370
11200
16512
7800
8600
9800
select lower(e.sal*5-500/2) - lower(e.sal * 2) sal from t1 e;
sal
10250
11450
13250
14105
15350
23318
select lower(e.sal-1000) * 2 - lower(e.sal + 800) sal from t1 e;
sal
1100
1700
1985
2400
5056
700
select lower(e.sal+1000/2*1.5) + lower(e.sal-100*5+2) from t1 e;
lower(e.sal+1000/2*1.5) + lower(e.sal-100*5+2)
10652
15964
7252
8052
9252
9822
select lower(e.sal/50-1000) * lower(e.sal/100-30) sal from t1 e;
sal
-13650
-16141.755000000001
-19712
-40930.2528
-4650
-8298
obmysql-upper-1-7-2
select lower(e.name)name,lower(e.sal)sal from t1 e where lower(e.sal) > 5000;
name	sal
clark	5200
james	7856
select lower(e.name)name,lower(e.sal)sal from t1 e where lower(e.sal) >= 4500;
name	sal
clark	5200
james	7856
smith	4500
turner	4785
select lower(e.name)name,lower(e.sal)sal from t1 e where lower(e.sal) < 5000;
name	sal
martin	3900
scott	3500
smith	4500
turner	4785
select lower(e.name)name,lower(e.sal)sal from t1 e where lower(e.sal) <= 4000;
name	sal
martin	3900
scott	3500
select lower(e.name)name,lower(e.sal)sal from t1 e where lower(e.name) = 'james';
name	sal
james	7856
select lower(e.name)name,lower(e.sal)sal from t1 e where lower(e.name) != 'clark';
name	sal
james	7856
martin	3900
scott	3500
smith	4500
turner	4785
select lower(e.name)name,lower(e.sal)sal from t1 e where lower(e.name) <> 'scott';
name	sal
clark	5200
james	7856
martin	3900
smith	4500
turner	4785
obmysql-upper-1-7-3
select lower(e.name)name,lower(e.sal)sal from t1 e where lower(e.name) in ('smith','clark');
name	sal
clark	5200
smith	4500
select lower(e.name)name,lower(e.sal)sal from t1 e where lower(e.name) not in ('smith','clark');
name	sal
james	7856
martin	3900
scott	3500
turner	4785
select lower(e.name)name,lower(e.sal)sal from t1 e where lower(e.name) = 'smith' and lower(e.sal) = 4500;
name	sal
smith	4500
select lower(e.name)name,lower(e.sal)sal from t1 e where lower(e.name) = 'smith' or lower(e.sal) = 3900;
name	sal
martin	3900
smith	4500
select lower(e.name)name,lower(e.sal)sal from t1 e where lower(e.name) = 'smith' or lower(e.name) = 'clark';
name	sal
clark	5200
smith	4500
select sum(lower(e.sal))sal from t1 e;
sal
29741
select lower(sum(e.sal))sal from t1 e;
sal
29741
select avg(lower(e.sal))sal from t1 e;
sal
4956.833333333333
select lower(avg(e.sal))sal from t1 e;
sal
4956.833333333333
select abs(lower(e.sal))sal from t1 e;
sal
3500
3900
4500
4785
5200
7856
select lower(abs(e.sal))sal from t1 e;
sal
3500
3900
4500
4785
5200
7856
select ceil(lower(e.sal))sal from t1 e;
sal
3500
3900
4500
4785
5200
7856
select lower(ceil(e.sal))sal from t1 e;
sal
3500
3900
4500
4785
5200
7856
select floor(lower(e.sal))sal from t1 e;
sal
3500
3900
4500
4785
5200
7856
select lower(floor(e.sal))sal from t1 e;
sal
3500
3900
4500
4785
5200
7856
select mod(lower(e.sal),7)sal from t1 e;
sal
0
1
2
4
6
6
select lower(mod(e.sal,7))sal from t1 e;
sal
0
1
2
4
6
6
select length(lower(e.name))name from t1 e;
name
5
5
5
5
6
6
select lower(length(e.name))name from t1 e;
name
5
5
5
5
6
6
select instr(lower(e.name),'t')name from t1 e;
name
0
0
1
4
4
4
select lower(instr(e.name,'t'))name from t1 e;
name
0
0
1
4
4
4
select max(lower(e.sal))sal from t1 e;
sal
7856
select lower(max(e.sal))sal from t1 e;
sal
7856
select min(lower(e.sal))sal from t1 e;
sal
3500
select lower(min(e.sal))sal from t1 e;
sal
3500
select cast(lower(e.name) as char(20)) from t1 e;
cast(lower(e.name) as char(20))
clark
james
martin
scott
smith
turner
select lower(cast(e.name as char(20))) from t1 e;
lower(cast(e.name as char(20)))
clark
james
martin
scott
smith
turner
select lower(concat(e.name,e.sal)) from t1 e;
lower(concat(e.name,e.sal))
clark5200
james7856
martin3900
scott3500
smith4500
turner4785
select concat(lower(e.name),lower(e.sal))sal from t1 e;
sal
clark5200
james7856
martin3900
scott3500
smith4500
turner4785
select convert(lower(e.name) using gbk) from t1 e;
convert(lower(e.name) using gbk)
clark
james
martin
scott
smith
turner
select convert(lower(e.name) using utf16) from t1 e;
convert(lower(e.name) using utf16)
clark
james
martin
scott
smith
turner
select convert(lower(e.name) using utf8mb4) from t1 e;
convert(lower(e.name) using utf8mb4)
clark
james
martin
scott
smith
turner
select convert(lower(e.name) using gb18030) from t1 e;
convert(lower(e.name) using gb18030)
clark
james
martin
scott
smith
turner
select lower(convert(e.name using gbk)) from t1 e ;
lower(convert(e.name using gbk))
clark
james
martin
scott
smith
turner
select lower(convert(e.name using utf16)) from t1 e;
lower(convert(e.name using utf16))
clark
james
martin
scott
smith
turner
select lower(convert(e.name using utf8mb4)) from t1 e ;
lower(convert(e.name using utf8mb4))
clark
james
martin
scott
smith
turner
select lower(convert(e.name using gb18030)) from t1 e;
lower(convert(e.name using gb18030))
clark
james
martin
scott
smith
turner
select lower(trim(e.name)) from t1 e;
lower(trim(e.name))
clark
james
martin
scott
smith
turner
select trim(lower(e.name)) from t1 e;
trim(lower(e.name))
clark
james
martin
scott
smith
turner
select lower(rtrim(e.name)) from t1 e;
lower(rtrim(e.name))
clark
james
martin
scott
smith
turner
select rtrim(lower(e.name)) from t1 e;
rtrim(lower(e.name))
clark
james
martin
scott
smith
turner
select lower(ltrim(e.name)) from t1 e;
lower(ltrim(e.name))
clark
james
martin
scott
smith
turner
select ltrim(lower(e.name)) from t1 e;
ltrim(lower(e.name))
clark
james
martin
scott
smith
turner
select lower(lower(lower(lower(e.name)))) from t1 e;
lower(lower(lower(lower(e.name))))
clark
james
martin
scott
smith
turner
select lower(upper(lower(upper(e.name)))) from t1 e;
lower(upper(lower(upper(e.name))))
clark
james
martin
scott
smith
turner
drop table t1;
drop table t2;
CREATE TABLE t1(DEPTNO decimal(2) PRIMARY KEY,DNAME VARCHAR(14),LOC VARCHAR(13)) ;
CREATE TABLE t2(EMPNO decimal(4) PRIMARY KEY,ENAME VARCHAR(10),JOB VARCHAR(9),MGR decimal(4),HIREDATE DATE,SAL decimal(7,2),COMM decimal(7,2),DEPTNO decimal(2));
INSERT INTO t1 VALUES(10,'AccounTing','New York'),(20,'ReSeaRch','DallAs'),(30,'SaLeS','ChiCaGo'),(40,'OperaTions','BoSton');
INSERT INTO t2 VALUES(7369,'Smith','Clerk',7902,'1980-12-17',800,100,20),(7499,'Allen','SaLesMan',7698,'1981-02-20',1600,300,30),(7521,'WaRd','SaLeSman',7698,'1981-2-22',1250,500,30),(7566,'Jones','MaNaGer',7839,'1981-04-02',2975,358.69,20),
(7654,'MarTin','SaleSman',7698,'1981-09-28',1250,1400,30),(7698,'Blake','ManaGer',7839,'1981-05-01',2850,-2100,30),(7782,'Clark','ManaGer',7839,'1981-06-09',2450,744.9,10),(7788,'ScotT','AnalysT',7566,'1987-04-13',3000,-200,20),(7839,'King','PresiDent',NULL,'1981-11-17',5000,-196.7,10),
(7844,'TurNeR','SaLeSmaN',7698,'1981-09-08',1500,0,30),(7876,'Adams','ClerK',7788,'1987-05-13',1100,-99.9,20),(7900,'JaMeS','CLerK',7698,'1981-12-03',950,-1808,30),(7902,'ForD','AnalyST',7566,'1981-12-03',3000,753.9,20),(7934,'MIller','Clerk',7782,'1982-01-23',1300,729,10);
obmysql-upper-1-3
obmysql-upper-1-3-1
SELECT UPPER(e.dname),UPPER(e.loc) FROM t1 e;
UPPER(e.dname)	UPPER(e.loc)
ACCOUNTING	NEW YORK
OPERATIONS	BOSTON
RESEARCH	DALLAS
SALES	CHICAGO
SELECT LOWER(e.dname),LOWER(e.loc) FROM t1 e;
LOWER(e.dname)	LOWER(e.loc)
accounting	new york
operations	boston
research	dallas
sales	chicago
SELECT UPPER(e.ename),UPPER(e.job) FROM t2 e limit 5;
UPPER(e.ename)	UPPER(e.job)
ALLEN	SALESMAN
JONES	MANAGER
MARTIN	SALESMAN
SMITH	CLERK
WARD	SALESMAN
SELECT LOWER(e.ename)ename,LOWER(e.job)job FROM t2 e limit 5;
ename	job
allen	salesman
jones	manager
martin	salesman
smith	clerk
ward	salesman
SELECT * FROM (SELECT DISTINCT UPPER(e.job)job,e.deptno FROM t2 e ORDER BY e.deptno) e limit 5;
job	deptno
ANALYST	20
CLERK	10
CLERK	20
MANAGER	10
PRESIDENT	10
SELECT * FROM (SELECT UPPER(e.ename)ename,UPPER(e.job)job FROM t2 e WHERE UPPER(e.ename) = 'JAMES' ORDER BY e.empno) e;
ename	job
JAMES	CLERK
SELECT * FROM (SELECT UPPER(e.ename)ename,UPPER(e.job)job FROM t2 e WHERE UPPER(e.ename) = 'WARD' AND UPPER(e.job) = 'SALESMAN' ORDER BY e.empno) e;
ename	job
WARD	SALESMAN
SELECT * FROM (SELECT UPPER(e.ename)ename,UPPER(e.job)job FROM t2 e WHERE UPPER(e.ename) = 'WARD' OR UPPER(e.job) = 'MANAGER' ORDER BY e.empno) e;
ename	job
BLAKE	MANAGER
CLARK	MANAGER
JONES	MANAGER
WARD	SALESMAN
SELECT * FROM (SELECT UPPER(e.ename)ename,UPPER(e.job)job FROM t2 e WHERE UPPER(e.ename) IN ('WARD','JAMES') ORDER BY e.empno) e;
ename	job
JAMES	CLERK
WARD	SALESMAN
SELECT * FROM (SELECT UPPER(e.ename)ename,UPPER(e.job)job FROM t2 e WHERE UPPER(e.job) NOT IN ('SALESMAN','CLERK','MANAGER') ORDER BY e.empno) e;
ename	job
FORD	ANALYST
KING	PRESIDENT
SCOTT	ANALYST
SELECT * FROM (SELECT DISTINCT LOWER(e.job)job,e.deptno FROM t2 e ORDER BY e.deptno) e limit 5;
job	deptno
analyst	20
clerk	10
clerk	20
manager	10
president	10
SELECT * FROM (SELECT LOWER(e.ename)ename,LOWER(e.job)job FROM t2 e WHERE LOWER(e.ename) = 'james' ORDER BY e.empno) e;
ename	job
james	clerk
SELECT * FROM (SELECT LOWER(e.ename)ename,LOWER(e.job)job FROM t2 e WHERE LOWER(e.ename) = 'ward' AND LOWER(e.job) = 'salesman' ORDER BY e.empno) e;
ename	job
ward	salesman
SELECT * FROM (SELECT LOWER(e.ename)ename,LOWER(e.job)job FROM t2 e WHERE LOWER(e.ename) = 'ward' OR LOWER(e.job) = 'manager' ORDER BY e.empno) e;
ename	job
blake	manager
clark	manager
jones	manager
ward	salesman
SELECT * FROM (SELECT LOWER(e.ename)ename,LOWER(e.job)job FROM t2 e WHERE LOWER(e.ename) IN ('ward','james') ORDER BY e.empno) e;
ename	job
james	clerk
ward	salesman
SELECT * FROM (SELECT LOWER(e.ename)ename,LOWER(e.job)job FROM t2 e WHERE LOWER(e.job) NOT IN ('salesman','clerk','analyst') ORDER BY e.empno) e;
ename	job
blake	manager
clark	manager
jones	manager
king	president
SELECT * FROM (SELECT UPPER(e.ename)ename,UPPER(e.job)job FROM t2 e WHERE EXISTS (SELECT * FROM t1 p WHERE UPPER(p.dname) = 'ACCOUNTING') AND UPPER(e.job) = 'SALESMAN' ORDER BY e.empno) e;
ename	job
ALLEN	SALESMAN
MARTIN	SALESMAN
TURNER	SALESMAN
WARD	SALESMAN
SELECT * FROM (SELECT UPPER(e.ename)ename,UPPER(e.job)job FROM t2 e WHERE NOT EXISTS (SELECT * FROM t1 p WHERE UPPER(p.dname) = 'ACCOUNTING' AND UPPER(p.loc) = 'DALLAS') AND UPPER(e.job) = 'SALESMAN' ORDER BY e.empno) e;
ename	job
ALLEN	SALESMAN
MARTIN	SALESMAN
TURNER	SALESMAN
WARD	SALESMAN
SELECT * FROM (SELECT LOWER(e.ename)ename,LOWER(e.job)job FROM t2 e WHERE EXISTS (SELECT * FROM t1 p WHERE LOWER(p.dname) = 'accounting') AND LOWER(e.job) = 'salesman' ORDER BY e.empno) e;
ename	job
allen	salesman
martin	salesman
turner	salesman
ward	salesman
SELECT * FROM (SELECT LOWER(e.ename)ename,LOWER(e.job)job FROM t2 e WHERE NOT EXISTS (SELECT * FROM t1 p WHERE LOWER(p.dname) = 'accounting' AND LOWER(p.loc) = 'dallas') AND LOWER(e.job) = 'salesman' ORDER BY e.empno) e;
ename	job
allen	salesman
martin	salesman
turner	salesman
ward	salesman
SELECT * FROM (SELECT UPPER(e.ename)ename,UPPER(e.job)job FROM t2 e WHERE e.deptno > ALL (SELECT p.deptno FROM t1 p WHERE UPPER(p.dname) = 'RESEARCH' AND UPPER(p.loc) = 'DALLAS') ORDER BY e.empno ) e;
ename	job
ALLEN	SALESMAN
BLAKE	MANAGER
JAMES	CLERK
MARTIN	SALESMAN
TURNER	SALESMAN
WARD	SALESMAN
SELECT * FROM (SELECT UPPER(e.ename)ename,UPPER(e.job)job FROM t2 e WHERE e.deptno = ALL (SELECT p.deptno FROM t1 p WHERE UPPER(p.dname) = 'RESEARCH' AND UPPER(p.loc) = 'DALLAS') ORDER BY e.empno ) e;
ename	job
ADAMS	CLERK
FORD	ANALYST
JONES	MANAGER
SCOTT	ANALYST
SMITH	CLERK
SELECT * FROM (SELECT UPPER(e.ename)ename,UPPER(e.job)job FROM t2 e WHERE e.deptno < ALL (SELECT p.deptno FROM t1 p WHERE UPPER(p.dname) = 'RESEARCH' AND UPPER(p.loc) = 'DALLAS') ORDER BY e.empno ) e;
ename	job
CLARK	MANAGER
KING	PRESIDENT
MILLER	CLERK
SELECT * FROM (SELECT UPPER(e.ename)ename,UPPER(e.job)job FROM t2 e WHERE e.deptno >= ALL (SELECT p.deptno FROM t1 p WHERE UPPER(p.dname) = 'RESEARCH' AND UPPER(p.loc) = 'DALLAS') ORDER BY e.empno ) e;
ename	job
ADAMS	CLERK
ALLEN	SALESMAN
BLAKE	MANAGER
FORD	ANALYST
JAMES	CLERK
JONES	MANAGER
MARTIN	SALESMAN
SCOTT	ANALYST
SMITH	CLERK
TURNER	SALESMAN
WARD	SALESMAN
SELECT * FROM (SELECT UPPER(e.ename)ename,UPPER(e.job)job FROM t2 e WHERE e.deptno <= ALL (SELECT p.deptno FROM t1 p WHERE UPPER(p.dname) = 'RESEARCH' AND UPPER(p.loc) = 'DALLAS') ORDER BY e.empno ) e;
ename	job
ADAMS	CLERK
CLARK	MANAGER
FORD	ANALYST
JONES	MANAGER
KING	PRESIDENT
MILLER	CLERK
SCOTT	ANALYST
SMITH	CLERK
SELECT * FROM (SELECT UPPER(e.ename)ename,UPPER(e.job)job FROM t2 e WHERE e.deptno <> ALL (SELECT p.deptno FROM t1 p WHERE UPPER(p.dname) = 'RESEARCH' AND UPPER(p.loc) = 'DALLAS') ORDER BY e.empno ) e;
ename	job
ALLEN	SALESMAN
BLAKE	MANAGER
CLARK	MANAGER
JAMES	CLERK
KING	PRESIDENT
MARTIN	SALESMAN
MILLER	CLERK
TURNER	SALESMAN
WARD	SALESMAN
SELECT * FROM (SELECT UPPER(e.ename)ename,UPPER(e.job)job FROM t2 e WHERE e.deptno != ALL (SELECT p.deptno FROM t1 p WHERE UPPER(p.dname) = 'RESEARCH' AND UPPER(p.loc) = 'DALLAS') ORDER BY e.empno ) e;
ename	job
ALLEN	SALESMAN
BLAKE	MANAGER
CLARK	MANAGER
JAMES	CLERK
KING	PRESIDENT
MARTIN	SALESMAN
MILLER	CLERK
TURNER	SALESMAN
WARD	SALESMAN
SELECT * FROM (SELECT LOWER(e.ename)ename,LOWER(e.job)job FROM t2 e WHERE e.deptno > ALL (SELECT p.deptno FROM t1 p WHERE LOWER(p.dname) = 'research' AND LOWER(p.loc) = 'dallas') ORDER BY e.empno ) e;
ename	job
allen	salesman
blake	manager
james	clerk
martin	salesman
turner	salesman
ward	salesman
SELECT * FROM (SELECT LOWER(e.ename)ename,LOWER(e.job)job FROM t2 e WHERE e.deptno = ALL (SELECT p.deptno FROM t1 p WHERE LOWER(p.dname) = 'research' AND LOWER(p.loc) = 'dallas') ORDER BY e.empno ) e;
ename	job
adams	clerk
ford	analyst
jones	manager
scott	analyst
smith	clerk
SELECT * FROM (SELECT LOWER(e.ename)ename,LOWER(e.job)job FROM t2 e WHERE e.deptno < ALL (SELECT p.deptno FROM t1 p WHERE LOWER(p.dname) = 'research' AND LOWER(p.loc) = 'dallas') ORDER BY e.empno ) e;
ename	job
clark	manager
king	president
miller	clerk
SELECT * FROM (SELECT LOWER(e.ename)ename,LOWER(e.job)job FROM t2 e WHERE e.deptno >= ALL (SELECT p.deptno FROM t1 p WHERE LOWER(p.dname) = 'research' AND LOWER(p.loc) = 'dallas') ORDER BY e.empno )e;
ename	job
adams	clerk
allen	salesman
blake	manager
ford	analyst
james	clerk
jones	manager
martin	salesman
scott	analyst
smith	clerk
turner	salesman
ward	salesman
SELECT * FROM (SELECT LOWER(e.ename)ename,LOWER(e.job)job FROM t2 e WHERE e.deptno <= ALL (SELECT p.deptno FROM t1 p WHERE LOWER(p.dname) = 'research' AND LOWER(p.loc) = 'dallas') ORDER BY e.empno )e;
ename	job
adams	clerk
clark	manager
ford	analyst
jones	manager
king	president
miller	clerk
scott	analyst
smith	clerk
SELECT * FROM (SELECT LOWER(e.ename)ename,LOWER(e.job)job FROM t2 e WHERE e.deptno <> ALL (SELECT p.deptno FROM t1 p WHERE LOWER(p.dname) = 'research' AND LOWER(p.loc) = 'dallas') ORDER BY e.empno )e;
ename	job
allen	salesman
blake	manager
clark	manager
james	clerk
king	president
martin	salesman
miller	clerk
turner	salesman
ward	salesman
SELECT * FROM (SELECT LOWER(e.ename)ename,LOWER(e.job)job FROM t2 e WHERE e.deptno != ALL (SELECT p.deptno FROM t1 p WHERE LOWER(p.dname) = 'research' AND LOWER(p.loc) = 'dallas') ORDER BY e.empno )e;
ename	job
allen	salesman
blake	manager
clark	manager
james	clerk
king	president
martin	salesman
miller	clerk
turner	salesman
ward	salesman
SELECT * FROM (SELECT UPPER(e.ename)ename,UPPER(e.job)job FROM t2 e WHERE e.deptno = SOME (SELECT p.deptno FROM t1 p WHERE UPPER(p.dname) = 'RESEARCH' AND UPPER(p.loc) = 'DALLAS') ORDER BY e.empno)e;
ename	job
ADAMS	CLERK
FORD	ANALYST
JONES	MANAGER
SCOTT	ANALYST
SMITH	CLERK
SELECT * FROM (SELECT UPPER(e.ename)ename,UPPER(e.job)job FROM t2 e WHERE e.deptno > SOME (SELECT p.deptno FROM t1 p WHERE UPPER(p.dname) = 'RESEARCH' AND UPPER(p.loc) = 'DALLAS') ORDER BY e.empno)e;
ename	job
ALLEN	SALESMAN
BLAKE	MANAGER
JAMES	CLERK
MARTIN	SALESMAN
TURNER	SALESMAN
WARD	SALESMAN
SELECT * FROM (SELECT UPPER(e.ename)ename,UPPER(e.job)job FROM t2 e WHERE e.deptno < SOME (SELECT p.deptno FROM t1 p WHERE UPPER(p.dname) = 'RESEARCH' AND UPPER(p.loc) = 'DALLAS') ORDER BY e.empno)e;
ename	job
CLARK	MANAGER
KING	PRESIDENT
MILLER	CLERK
SELECT * FROM (SELECT UPPER(e.ename)ename,UPPER(e.job)job FROM t2 e WHERE e.deptno >= SOME (SELECT p.deptno FROM t1 p WHERE UPPER(p.dname) = 'RESEARCH' AND UPPER(p.loc) = 'DALLAS') ORDER BY e.empno)e;
ename	job
ADAMS	CLERK
ALLEN	SALESMAN
BLAKE	MANAGER
FORD	ANALYST
JAMES	CLERK
JONES	MANAGER
MARTIN	SALESMAN
SCOTT	ANALYST
SMITH	CLERK
TURNER	SALESMAN
WARD	SALESMAN
SELECT * FROM (SELECT UPPER(e.ename)ename,UPPER(e.job)job FROM t2 e WHERE e.deptno <= SOME (SELECT p.deptno FROM t1 p WHERE UPPER(p.dname) = 'RESEARCH' AND UPPER(p.loc) = 'DALLAS') ORDER BY e.empno)e;
ename	job
ADAMS	CLERK
CLARK	MANAGER
FORD	ANALYST
JONES	MANAGER
KING	PRESIDENT
MILLER	CLERK
SCOTT	ANALYST
SMITH	CLERK
SELECT * FROM (SELECT UPPER(e.ename)ename,UPPER(e.job)job FROM t2 e WHERE e.deptno <> SOME (SELECT p.deptno FROM t1 p WHERE UPPER(p.dname) = 'RESEARCH' AND UPPER(p.loc) = 'DALLAS') ORDER BY e.empno)e;
ename	job
ALLEN	SALESMAN
BLAKE	MANAGER
CLARK	MANAGER
JAMES	CLERK
KING	PRESIDENT
MARTIN	SALESMAN
MILLER	CLERK
TURNER	SALESMAN
WARD	SALESMAN
SELECT * FROM (SELECT UPPER(e.ename)ename,UPPER(e.job)job FROM t2 e WHERE e.deptno != SOME (SELECT p.deptno FROM t1 p WHERE UPPER(p.dname) = 'RESEARCH' AND UPPER(p.loc) = 'DALLAS') ORDER BY e.empno)e;
ename	job
ALLEN	SALESMAN
BLAKE	MANAGER
CLARK	MANAGER
JAMES	CLERK
KING	PRESIDENT
MARTIN	SALESMAN
MILLER	CLERK
TURNER	SALESMAN
WARD	SALESMAN
SELECT * FROM (SELECT LOWER(e.ename)ename,LOWER(e.job)job FROM t2 e WHERE e.deptno > SOME (SELECT p.deptno FROM t1 p WHERE LOWER(p.dname) = 'research' AND LOWER(p.loc) = 'dallas') ORDER BY e.empno )e;
ename	job
allen	salesman
blake	manager
james	clerk
martin	salesman
turner	salesman
ward	salesman
SELECT * FROM (SELECT LOWER(e.ename)ename,LOWER(e.job)job FROM t2 e WHERE e.deptno = SOME (SELECT p.deptno FROM t1 p WHERE LOWER(p.dname) = 'research' AND LOWER(p.loc) = 'dallas') ORDER BY e.empno )e;
ename	job
adams	clerk
ford	analyst
jones	manager
scott	analyst
smith	clerk
SELECT * FROM (SELECT LOWER(e.ename)ename,LOWER(e.job)job FROM t2 e WHERE e.deptno < SOME (SELECT p.deptno FROM t1 p WHERE LOWER(p.dname) = 'research' AND LOWER(p.loc) = 'dallas') ORDER BY e.empno )e;
ename	job
clark	manager
king	president
miller	clerk
SELECT * FROM (SELECT LOWER(e.ename)ename,LOWER(e.job)job FROM t2 e WHERE e.deptno >= SOME (SELECT p.deptno FROM t1 p WHERE LOWER(p.dname) = 'research' AND LOWER(p.loc) = 'dallas') ORDER BY e.empno )e;
ename	job
adams	clerk
allen	salesman
blake	manager
ford	analyst
james	clerk
jones	manager
martin	salesman
scott	analyst
smith	clerk
turner	salesman
ward	salesman
SELECT * FROM (SELECT LOWER(e.ename)ename,LOWER(e.job)job FROM t2 e WHERE e.deptno <= SOME (SELECT p.deptno FROM t1 p WHERE LOWER(p.dname) = 'research' AND LOWER(p.loc) = 'dallas') ORDER BY e.empno )e;
ename	job
adams	clerk
clark	manager
ford	analyst
jones	manager
king	president
miller	clerk
scott	analyst
smith	clerk
SELECT * FROM (SELECT LOWER(e.ename)ename,LOWER(e.job)job FROM t2 e WHERE e.deptno <> SOME (SELECT p.deptno FROM t1 p WHERE LOWER(p.dname) = 'research' AND LOWER(p.loc) = 'dallas') ORDER BY e.empno )e;
ename	job
allen	salesman
blake	manager
clark	manager
james	clerk
king	president
martin	salesman
miller	clerk
turner	salesman
ward	salesman
SELECT * FROM (SELECT LOWER(e.ename)ename,LOWER(e.job)job FROM t2 e WHERE e.deptno != SOME (SELECT p.deptno FROM t1 p WHERE LOWER(p.dname) = 'research' AND LOWER(p.loc) = 'dallas') ORDER BY e.empno )e;
ename	job
allen	salesman
blake	manager
clark	manager
james	clerk
king	president
martin	salesman
miller	clerk
turner	salesman
ward	salesman
SELECT * FROM (SELECT UPPER(e.ename)ename,UPPER(e.job)job FROM t2 e WHERE e.deptno = ANY (SELECT p.deptno FROM t1 p WHERE UPPER(p.dname) = 'RESEARCH' AND UPPER(p.loc) = 'DALLAS') ORDER BY e.empno)e;
ename	job
ADAMS	CLERK
FORD	ANALYST
JONES	MANAGER
SCOTT	ANALYST
SMITH	CLERK
SELECT * FROM (SELECT UPPER(e.ename)ename,UPPER(e.job)job FROM t2 e WHERE e.deptno > ANY (SELECT p.deptno FROM t1 p WHERE UPPER(p.dname) = 'RESEARCH' AND UPPER(p.loc) = 'DALLAS') ORDER BY e.empno)e;
ename	job
ALLEN	SALESMAN
BLAKE	MANAGER
JAMES	CLERK
MARTIN	SALESMAN
TURNER	SALESMAN
WARD	SALESMAN
SELECT * FROM (SELECT UPPER(e.ename)ename,UPPER(e.job)job FROM t2 e WHERE e.deptno < ANY (SELECT p.deptno FROM t1 p WHERE UPPER(p.dname) = 'RESEARCH' AND UPPER(p.loc) = 'DALLAS') ORDER BY e.empno)e;
ename	job
CLARK	MANAGER
KING	PRESIDENT
MILLER	CLERK
SELECT * FROM (SELECT UPPER(e.ename)ename,UPPER(e.job)job FROM t2 e WHERE e.deptno >= ANY (SELECT p.deptno FROM t1 p WHERE UPPER(p.dname) = 'RESEARCH' AND UPPER(p.loc) = 'DALLAS') ORDER BY e.empno)e;
ename	job
ADAMS	CLERK
ALLEN	SALESMAN
BLAKE	MANAGER
FORD	ANALYST
JAMES	CLERK
JONES	MANAGER
MARTIN	SALESMAN
SCOTT	ANALYST
SMITH	CLERK
TURNER	SALESMAN
WARD	SALESMAN
SELECT * FROM (SELECT UPPER(e.ename)ename,UPPER(e.job)job FROM t2 e WHERE e.deptno <= ANY (SELECT p.deptno FROM t1 p WHERE UPPER(p.dname) = 'RESEARCH' AND UPPER(p.loc) = 'DALLAS') ORDER BY e.empno)e;
ename	job
ADAMS	CLERK
CLARK	MANAGER
FORD	ANALYST
JONES	MANAGER
KING	PRESIDENT
MILLER	CLERK
SCOTT	ANALYST
SMITH	CLERK
SELECT * FROM (SELECT UPPER(e.ename)ename,UPPER(e.job)job FROM t2 e WHERE e.deptno <> ANY (SELECT p.deptno FROM t1 p WHERE UPPER(p.dname) = 'RESEARCH' AND UPPER(p.loc) = 'DALLAS') ORDER BY e.empno)e;
ename	job
ALLEN	SALESMAN
BLAKE	MANAGER
CLARK	MANAGER
JAMES	CLERK
KING	PRESIDENT
MARTIN	SALESMAN
MILLER	CLERK
TURNER	SALESMAN
WARD	SALESMAN
SELECT * FROM (SELECT UPPER(e.ename)ename,UPPER(e.job)job FROM t2 e WHERE e.deptno != ANY (SELECT p.deptno FROM t1 p WHERE UPPER(p.dname) = 'RESEARCH' AND UPPER(p.loc) = 'DALLAS') ORDER BY e.empno)e;
ename	job
ALLEN	SALESMAN
BLAKE	MANAGER
CLARK	MANAGER
JAMES	CLERK
KING	PRESIDENT
MARTIN	SALESMAN
MILLER	CLERK
TURNER	SALESMAN
WARD	SALESMAN
SELECT * FROM (SELECT LOWER(e.ename)ename,LOWER(e.job)job FROM t2 e WHERE e.deptno > ANY (SELECT p.deptno FROM t1 p WHERE LOWER(p.dname) = 'research' AND LOWER(p.loc) = 'dallas') ORDER BY e.empno )e;
ename	job
allen	salesman
blake	manager
james	clerk
martin	salesman
turner	salesman
ward	salesman
SELECT * FROM (SELECT LOWER(e.ename)ename,LOWER(e.job)job FROM t2 e WHERE e.deptno = ANY (SELECT p.deptno FROM t1 p WHERE LOWER(p.dname) = 'research' AND LOWER(p.loc) = 'dallas') ORDER BY e.empno )e;
ename	job
adams	clerk
ford	analyst
jones	manager
scott	analyst
smith	clerk
SELECT * FROM (SELECT LOWER(e.ename)ename,LOWER(e.job)job FROM t2 e WHERE e.deptno < ANY (SELECT p.deptno FROM t1 p WHERE LOWER(p.dname) = 'research' AND LOWER(p.loc) = 'dallas') ORDER BY e.empno )e;
ename	job
clark	manager
king	president
miller	clerk
SELECT * FROM (SELECT LOWER(e.ename)ename,LOWER(e.job)job FROM t2 e WHERE e.deptno >= ANY (SELECT p.deptno FROM t1 p WHERE LOWER(p.dname) = 'research' AND LOWER(p.loc) = 'dallas') ORDER BY e.empno )e;
ename	job
adams	clerk
allen	salesman
blake	manager
ford	analyst
james	clerk
jones	manager
martin	salesman
scott	analyst
smith	clerk
turner	salesman
ward	salesman
SELECT * FROM (SELECT LOWER(e.ename)ename,LOWER(e.job)job FROM t2 e WHERE e.deptno <= ANY (SELECT p.deptno FROM t1 p WHERE LOWER(p.dname) = 'research' AND LOWER(p.loc) = 'dallas') ORDER BY e.empno )e;
ename	job
adams	clerk
clark	manager
ford	analyst
jones	manager
king	president
miller	clerk
scott	analyst
smith	clerk
SELECT * FROM (SELECT LOWER(e.ename)ename,LOWER(e.job)job FROM t2 e WHERE e.deptno <> ANY (SELECT p.deptno FROM t1 p WHERE LOWER(p.dname) = 'research' AND LOWER(p.loc) = 'dallas') ORDER BY e.empno )e;
ename	job
allen	salesman
blake	manager
clark	manager
james	clerk
king	president
martin	salesman
miller	clerk
turner	salesman
ward	salesman
SELECT * FROM (SELECT LOWER(e.ename)ename,LOWER(e.job)job FROM t2 e WHERE e.deptno != ANY (SELECT p.deptno FROM t1 p WHERE LOWER(p.dname) = 'research' AND LOWER(p.loc) = 'dallas') ORDER BY e.empno )e;
ename	job
allen	salesman
blake	manager
clark	manager
james	clerk
king	president
martin	salesman
miller	clerk
turner	salesman
ward	salesman
DROP TABLE t3;
CREATE TABLE t3 AS SELECT UPPER(e.ename)ename,UPPER(e.job)job FROM t2 e WHERE UPPER(e.job) = 'SALESMAN' OR UPPER(e.job) = 'PRESIDENT';
SELECT *  FROM t3;
ename	job
ALLEN	SALESMAN
KING	PRESIDENT
MARTIN	SALESMAN
TURNER	SALESMAN
WARD	SALESMAN
DROP TABLE t3;
CREATE TABLE t3 AS SELECT UPPER(e.ename)ename,UPPER(p.loc)loc,UPPER(e.job)job FROM t2 e LEFT JOIN t1 p ON e.deptno = p.deptno WHERE UPPER(e.job) = 'SALESMAN' OR UPPER(p.loc) = 'NEW YORK' order by e.empno;
SELECT * FROM t3;
ename	loc	job
ALLEN	CHICAGO	SALESMAN
CLARK	NEW YORK	MANAGER
KING	NEW YORK	PRESIDENT
MARTIN	CHICAGO	SALESMAN
MILLER	NEW YORK	CLERK
TURNER	CHICAGO	SALESMAN
WARD	CHICAGO	SALESMAN
DROP TABLE t3;
CREATE TABLE t3 AS SELECT LOWER(e.ename)ename,LOWER(e.job)job FROM t2 e WHERE LOWER(e.job) = 'salesman' OR LOWER(e.job) = 'president' order by e.empno;
SELECT * FROM t3;
ename	job
allen	salesman
king	president
martin	salesman
turner	salesman
ward	salesman
DROP TABLE t3;
CREATE TABLE t3 AS SELECT LOWER(e.ename)ename,LOWER(p.loc)loc,LOWER(e.job)job FROM t2 e LEFT JOIN t1 p ON e.deptno = p.deptno WHERE LOWER(e.job) = 'salesman' OR LOWER(p.loc) = 'new york' order by e.empno;
SELECT * FROM t3;
ename	loc	job
allen	chicago	salesman
clark	new york	manager
king	new york	president
martin	chicago	salesman
miller	new york	clerk
turner	chicago	salesman
ward	chicago	salesman
DROP TABLE t3;
CREATE TABLE t3 AS SELECT UPPER(e.ename)ename,LOWER(e.job)job FROM t2 e WHERE UPPER(e.job) = 'SALESMAN' OR LOWER(e.job) = 'president' order by e.empno;
SELECT *  FROM t3;
ename	job
ALLEN	salesman
KING	president
MARTIN	salesman
TURNER	salesman
WARD	salesman
DROP TABLE t3;
CREATE TABLE t3 AS SELECT UPPER(e.ename)ename,UPPER(e.job)job,LOWER(p.dname)danme,LOWER(p.loc)loc FROM t2 e LEFT JOIN t1 p ON e.deptno = p.deptno WHERE UPPER(e.job) = 'CLERK' OR LOWER(p.loc) = 'chicago' order by e.empno;
SELECT *  FROM t3;
ename	job	danme	loc
ADAMS	CLERK	research	dallas
ALLEN	SALESMAN	sales	chicago
BLAKE	MANAGER	sales	chicago
JAMES	CLERK	sales	chicago
MARTIN	SALESMAN	sales	chicago
MILLER	CLERK	accounting	new york
SMITH	CLERK	research	dallas
TURNER	SALESMAN	sales	chicago
WARD	SALESMAN	sales	chicago
SELECT UPPER(e.ename)ename,UPPER(e.job)job FROM t2 e WHERE UPPER(e.ename) LIKE '%C%' ORDER BY e.empno;
ename	job
CLARK	MANAGER
SCOTT	ANALYST
SELECT UPPER(e.ename)ename,UPPER(e.job)job FROM t2 e WHERE UPPER(e.ename) LIKE 'S%' ORDER BY e.empno;
ename	job
SCOTT	ANALYST
SMITH	CLERK
SELECT UPPER(e.ename)ename,UPPER(e.job)job FROM t2 e WHERE UPPER(e.ename) LIKE '%K' ORDER BY e.empno;
ename	job
CLARK	MANAGER
SELECT UPPER(e.ename)ename,UPPER(e.job)job FROM t2 e WHERE UPPER(e.ename) LIKE '_A%' ORDER BY e.empno;
ename	job
JAMES	CLERK
MARTIN	SALESMAN
WARD	SALESMAN
SELECT UPPER(e.ename)ename,UPPER(e.job)job FROM t2 e WHERE UPPER(e.ename) LIKE '%R_' ORDER BY e.empno;
ename	job
CLARK	MANAGER
FORD	ANALYST
WARD	SALESMAN
SELECT UPPER(e.ename)ename,UPPER(e.job)job FROM t2 e WHERE UPPER(e.ename) LIKE '%C%' AND UPPER(e.job) LIKE '_A%' ORDER BY e.empno;
ename	job
CLARK	MANAGER
SELECT LOWER(e.ename)ename,LOWER(e.job)job FROM t2 e WHERE LOWER(e.ename) LIKE '%c%' ORDER BY e.empno;
ename	job
clark	manager
scott	analyst
SELECT LOWER(e.ename)ename,LOWER(e.job)job FROM t2 e WHERE LOWER(e.ename) LIKE 's%' ORDER BY e.empno;
ename	job
scott	analyst
smith	clerk
SELECT LOWER(e.ename)ename,LOWER(e.job)job FROM t2 e WHERE LOWER(e.ename) LIKE '%k' ORDER BY e.empno;
ename	job
clark	manager
SELECT LOWER(e.ename)ename,LOWER(e.job)job FROM t2 e WHERE LOWER(e.ename) LIKE '_a%' ORDER BY e.empno;
ename	job
james	clerk
martin	salesman
ward	salesman
SELECT LOWER(e.ename)ename,LOWER(e.job)job FROM t2 e WHERE LOWER(e.ename) LIKE '%r_' ORDER BY e.empno;
ename	job
clark	manager
ford	analyst
ward	salesman
SELECT LOWER(e.ename)ename,LOWER(e.job)job FROM t2 e WHERE LOWER(e.ename) LIKE '%c%' AND LOWER(e.job) LIKE '_a%' ORDER BY e.empno;
ename	job
clark	manager
SELECT UPPER(e.ename)ename,UPPER(e.job)job FROM t2 e WHERE  UPPER(e.ename) = 'MARTIN' OR UPPER(e.job) = 'PRESIDENT' ORDER BY e.empno;
ename	job
KING	PRESIDENT
MARTIN	SALESMAN
SELECT UPPER(e.ename) || UPPER(e.job) ejob FROM t2 e WHERE  UPPER(e.ename) = 'MARTIN' OR UPPER(e.job) = 'PRESIDENT' ORDER BY e.empno;
ejob
0
0
Warnings:
Warning	1292	Truncated incorrect DOUBLE value: 'MARTIN'
Warning	1292	Truncated incorrect DOUBLE value: 'KING'
Warning	1292	Truncated incorrect DOUBLE value: 'SALESMAN'
Warning	1292	Truncated incorrect DOUBLE value: 'PRESIDENT'
SELECT LOWER(e.ename)ename,LOWER(e.job)job FROM t2 e WHERE  LOWER(e.ename) = 'martin' OR LOWER(e.job) = 'president' ORDER BY e.empno;
ename	job
king	president
martin	salesman
SELECT LOWER(e.ename) || LOWER(e.job) ejob FROM t2 e WHERE  LOWER(e.ename) = 'martin' OR LOWER(e.job) = 'president' ORDER BY e.empno;
ejob
0
0
Warnings:
Warning	1292	Truncated incorrect DOUBLE value: 'martin'
Warning	1292	Truncated incorrect DOUBLE value: 'king'
Warning	1292	Truncated incorrect DOUBLE value: 'salesman'
Warning	1292	Truncated incorrect DOUBLE value: 'president'
SELECT UPPER(e.ename)ename,UPPER(e.job)job FROM t2 e WHERE UPPER(e.job) = 'ANALYST' ORDER BY e.empno;
ename	job
FORD	ANALYST
SCOTT	ANALYST
SELECT UPPER(e.ename)ename,UPPER(e.job)job FROM t2 e WHERE 1 = 1 AND UPPER(mgr) IS NULL ORDER BY e.empno;
ename	job
KING	PRESIDENT
SELECT UPPER(e.ename)ename,UPPER(e.job)job FROM t2 e WHERE UPPER(e.job) IN ('SALESMAN','CLERK') ORDER BY e.empno;
ename	job
ADAMS	CLERK
ALLEN	SALESMAN
JAMES	CLERK
MARTIN	SALESMAN
MILLER	CLERK
SMITH	CLERK
TURNER	SALESMAN
WARD	SALESMAN
SELECT UPPER(e.ename)ename,UPPER(e.job)job FROM t2 e WHERE 1 = 1 AND UPPER(e.deptno) BETWEEN 10 AND 20 ORDER BY e.empno;
ename	job
ADAMS	CLERK
CLARK	MANAGER
FORD	ANALYST
JONES	MANAGER
KING	PRESIDENT
MILLER	CLERK
SCOTT	ANALYST
SMITH	CLERK
SELECT UPPER(e.ename)ename,UPPER(e.job)job FROM t2 e WHERE 1 = 1 AND UPPER(e.job) = 'CLERK' OR UPPER(e.ename) = 'JONES' ORDER BY e.empno;
ename	job
ADAMS	CLERK
JAMES	CLERK
JONES	MANAGER
MILLER	CLERK
SMITH	CLERK
SELECT UPPER(e.ename)ename,UPPER(e.job)job FROM t2 e WHERE 1 = 1 AND UPPER(e.ename) = (SELECT UPPER(p.ename) FROM t2 p WHERE UPPER(p.ename)='JAMES' )ORDER BY e.empno;
ename	job
JAMES	CLERK
SELECT LOWER(e.ename)ename,LOWER(e.job)job FROM t2 e WHERE LOWER(e.job) = 'analyst' ORDER BY e.empno;
ename	job
ford	analyst
scott	analyst
SELECT LOWER(e.ename)ename,LOWER(e.job)job FROM t2 e WHERE 1 = 1 AND LOWER(mgr) IS NULL ORDER BY e.empno;
ename	job
king	president
SELECT LOWER(e.ename)ename,LOWER(e.job)job FROM t2 e WHERE LOWER(e.job) IN ('salesman','clerk') ORDER BY e.empno;
ename	job
adams	clerk
allen	salesman
james	clerk
martin	salesman
miller	clerk
smith	clerk
turner	salesman
ward	salesman
SELECT LOWER(e.ename)ename,LOWER(e.job)job FROM t2 e WHERE 1 = 1 AND LOWER(e.deptno) BETWEEN 10 AND 20 ORDER BY e.empno;
ename	job
adams	clerk
clark	manager
ford	analyst
jones	manager
king	president
miller	clerk
scott	analyst
smith	clerk
SELECT LOWER(e.ename)ename,LOWER(e.job)job FROM t2 e WHERE 1 = 1 AND LOWER(e.job) = 'clerk' OR LOWER(e.ename) = 'jones' ORDER BY e.empno;
ename	job
adams	clerk
james	clerk
jones	manager
miller	clerk
smith	clerk
SELECT LOWER(e.ename)ename,LOWER(e.job)job FROM t2 e WHERE 1 = 1 AND LOWER(e.ename) = (SELECT LOWER(p.ename) FROM t2 p WHERE LOWER(p.ename)='james' )ORDER BY e.empno;
ename	job
james	clerk
SELECT UPPER(e.ename)ename,UPPER(e.job)job FROM t2 e WHERE UPPER(e.job) = 'SALESMAN' ORDER BY 1;
ename	job
ALLEN	SALESMAN
MARTIN	SALESMAN
TURNER	SALESMAN
WARD	SALESMAN
SELECT UPPER(e.ename)ename,UPPER(e.job)job FROM t2 e WHERE UPPER(e.job) = 'SALESMAN' ORDER BY UPPER(e.ename);
ename	job
ALLEN	SALESMAN
MARTIN	SALESMAN
TURNER	SALESMAN
WARD	SALESMAN
SELECT UPPER(e.ename)ename,UPPER(e.job)job FROM t2 e WHERE UPPER(e.job) = 'SALESMAN' ORDER BY UPPER(e.ename) ASC;
ename	job
ALLEN	SALESMAN
MARTIN	SALESMAN
TURNER	SALESMAN
WARD	SALESMAN
SELECT UPPER(e.ename)ename,UPPER(e.job)job FROM t2 e WHERE UPPER(e.job) = 'SALESMAN' ORDER BY UPPER(e.ename) DESC;
ename	job
ALLEN	SALESMAN
MARTIN	SALESMAN
TURNER	SALESMAN
WARD	SALESMAN
SELECT LOWER(e.ename)ename,LOWER(e.job)job FROM t2 e WHERE LOWER(e.job) = 'salesman' ORDER BY 1;
ename	job
allen	salesman
martin	salesman
turner	salesman
ward	salesman
SELECT LOWER(e.ename)ename,LOWER(e.job)job FROM t2 e WHERE LOWER(e.job) = 'salesman' ORDER BY LOWER(e.ename);
ename	job
allen	salesman
martin	salesman
turner	salesman
ward	salesman
SELECT LOWER(e.ename)ename,LOWER(e.job)job FROM t2 e WHERE LOWER(e.job) = 'salesman' ORDER BY LOWER(e.ename) ASC;
ename	job
allen	salesman
martin	salesman
turner	salesman
ward	salesman
SELECT LOWER(e.ename)ename,LOWER(e.job)job FROM t2 e WHERE LOWER(e.job) = 'salesman' ORDER BY LOWER(e.ename) DESC;
ename	job
allen	salesman
martin	salesman
turner	salesman
ward	salesman
SELECT e.deptno,COUNT(UPPER(e.job))job FROM t2 e WHERE UPPER(e.job) = 'SALESMAN' OR UPPER(e.job) = 'ANALYST' GROUP BY e.deptno ORDER BY e.deptno;
deptno	job
20	2
30	4
SELECT COUNT(UPPER(e.job))job FROM t2 e WHERE UPPER(e.job) = 'SALESMAN' OR UPPER(e.job) = 'ANALYST' GROUP BY UPPER(e.job) ORDER BY COUNT(UPPER(e.job));
job
2
4
SELECT e.deptno,COUNT(UPPER(e.job))job FROM t2 e WHERE UPPER(e.job) = 'SALESMAN' OR UPPER(e.job) = 'ANALYST' GROUP BY UPPER(e.job),e.deptno ORDER BY e.deptno;
deptno	job
20	2
30	4
SELECT e.deptno,COUNT(UPPER(e.job))job FROM t2 e WHERE UPPER(e.job) = 'SALESMAN' OR UPPER(e.job) = 'ANALYST' GROUP BY UPPER(e.job),e.deptno HAVING COUNT(UPPER(e.job)) > 2 ORDER BY e.deptno;
deptno	job
30	4
SELECT e.deptno,COUNT(LOWER(e.job))job FROM t2 e WHERE LOWER(e.job) = 'salesman' OR LOWER(e.job) = 'analyst' GROUP BY e.deptno ORDER BY e.deptno;
deptno	job
20	2
30	4
SELECT COUNT(LOWER(e.job))job FROM t2 e WHERE LOWER(e.job) = 'salesman' OR LOWER(e.job) = 'analyst' GROUP BY LOWER(e.job) ORDER BY COUNT(LOWER(e.job));
job
2
4
SELECT e.deptno,COUNT(LOWER(e.job))job FROM t2 e WHERE LOWER(e.job) = 'salesman' OR LOWER(e.job) = 'analyst' GROUP BY LOWER(e.job),e.deptno ORDER BY e.deptno;
deptno	job
20	2
30	4
SELECT e.deptno,COUNT(LOWER(e.job))job FROM t2 e WHERE LOWER(e.job) = 'salesman' OR LOWER(e.job) = 'analyst' GROUP BY LOWER(e.job),e.deptno HAVING COUNT(LOWER(e.job)) > 2 ORDER BY e.deptno;
deptno	job
30	4
SELECT UPPER(e.ename),(CASE UPPER(e.job) WHEN 'SALESMAN' THEN '1' WHEN 'CLERK' THEN '2' WHEN 'MANAGER' THEN '3' WHEN 'PRESIDENT' THEN '4' ELSE '5' END)job FROM t2 e limit 5;
UPPER(e.ename)	job
ALLEN	1
JONES	3
MARTIN	1
SMITH	2
WARD	1
SELECT UPPER(e.ename),UPPER(CASE WHEN e.sal < 2000 THEN NULL ELSE 'HighSalary' END )sal FROM  t2 e WHERE UPPER(CASE WHEN e.sal < 2000 THEN NULL ELSE 'HighSalary' END ) IS NOT NULL ORDER BY e.empno;
UPPER(e.ename)	sal
BLAKE	HIGHSALARY
CLARK	HIGHSALARY
FORD	HIGHSALARY
JONES	HIGHSALARY
KING	HIGHSALARY
SCOTT	HIGHSALARY
SELECT LOWER(e.ename),(CASE LOWER(e.job) WHEN 'salesman' THEN '1' WHEN 'clerk' THEN '2' WHEN 'manager' THEN '3' WHEN 'president' THEN '4' ELSE '5' END)job FROM t2 e limit 5;
LOWER(e.ename)	job
allen	1
jones	3
martin	1
smith	2
ward	1
SELECT LOWER(e.ename),LOWER(CASE WHEN e.sal < 2000 THEN NULL ELSE 'HighSalary' END )sal FROM  t2 e WHERE LOWER(CASE WHEN e.sal < 2000 THEN NULL ELSE 'HighSalary' END ) IS NOT NULL ORDER BY e.empno;
LOWER(e.ename)	sal
blake	highsalary
clark	highsalary
ford	highsalary
jones	highsalary
king	highsalary
scott	highsalary
obmysql-upper-1-3-2
INSERT INTO t3(ename,job) VALUES(UPPER('KoBe'),UPPER('Athletes'));
INSERT INTO t3 VALUES(UPPER('Letbrother'),UPPER('Athletes'),UPPER('12fkk'),UPPER('shangHAI1111'));
INSERT INTO t3(loc) SELECT UPPER(e.loc) FROM t1 e WHERE e.deptno = 30;
INSERT INTO t3  SELECT UPPER(e.ename),UPPER(e.job),UPPER(p.dname),UPPER(p.loc) FROM t2 e LEFT JOIN t1 p ON e.deptno = p.deptno WHERE UPPER(e.job) =  'ANALYST' ORDER BY e.empno;
SELECT * FROM t3;
ename	job	danme	loc
ADAMS	CLERK	research	dallas
ALLEN	SALESMAN	sales	chicago
BLAKE	MANAGER	sales	chicago
FORD	ANALYST	RESEARCH	DALLAS
JAMES	CLERK	sales	chicago
KOBE	ATHLETES	NULL	NULL
LETBROTHER	ATHLETES	12FKK	SHANGHAI1111
MARTIN	SALESMAN	sales	chicago
MILLER	CLERK	accounting	new york
NULL	NULL	NULL	CHICAGO
SCOTT	ANALYST	RESEARCH	DALLAS
SMITH	CLERK	research	dallas
TURNER	SALESMAN	sales	chicago
WARD	SALESMAN	sales	chicago
INSERT INTO t3(ename,job) VALUES(LOWER('KoBe'),LOWER('Athletes'));
INSERT INTO t3 VALUES(LOWER('Letbrother'),LOWER('Athletes'),LOWER('12fkk'),LOWER('shangHAI1111'));
INSERT INTO t3(loc) SELECT LOWER(e.loc) FROM t1 e WHERE e.deptno = 30;
INSERT INTO t3  SELECT LOWER(e.ename),LOWER(e.job),LOWER(p.dname),LOWER(p.loc) FROM t2 e LEFT JOIN t1 p ON e.deptno = p.deptno WHERE LOWER(e.job) =  'analyst' ORDER BY e.empno;
SELECT *  FROM t3;
ename	job	danme	loc
ADAMS	CLERK	research	dallas
ALLEN	SALESMAN	sales	chicago
BLAKE	MANAGER	sales	chicago
FORD	ANALYST	RESEARCH	DALLAS
JAMES	CLERK	sales	chicago
KOBE	ATHLETES	NULL	NULL
LETBROTHER	ATHLETES	12FKK	SHANGHAI1111
MARTIN	SALESMAN	sales	chicago
MILLER	CLERK	accounting	new york
NULL	NULL	NULL	CHICAGO
NULL	NULL	NULL	chicago
SCOTT	ANALYST	RESEARCH	DALLAS
SMITH	CLERK	research	dallas
TURNER	SALESMAN	sales	chicago
WARD	SALESMAN	sales	chicago
ford	analyst	research	dallas
kobe	athletes	NULL	NULL
letbrother	athletes	12fkk	shanghai1111
scott	analyst	research	dallas
obmysql-upper-1-3-3
UPDATE t3 SET job = UPPER('aThLeTes') WHERE job IS NULL;
UPDATE t3 SET job = UPPER('aThLeTes') WHERE job = UPPER('Clerk');
UPDATE t3 SET loc = (SELECT UPPER(e.loc) FROM t1 e WHERE deptno = 20 ) WHERE loc IS NULL;
SELECT *  FROM t3;
ename	job	danme	loc
ADAMS	ATHLETES	research	dallas
ALLEN	SALESMAN	sales	chicago
BLAKE	MANAGER	sales	chicago
FORD	ANALYST	RESEARCH	DALLAS
JAMES	ATHLETES	sales	chicago
KOBE	ATHLETES	NULL	DALLAS
LETBROTHER	ATHLETES	12FKK	SHANGHAI1111
MARTIN	SALESMAN	sales	chicago
MILLER	ATHLETES	accounting	new york
NULL	ATHLETES	NULL	CHICAGO
NULL	ATHLETES	NULL	chicago
SCOTT	ANALYST	RESEARCH	DALLAS
SMITH	ATHLETES	research	dallas
TURNER	SALESMAN	sales	chicago
WARD	SALESMAN	sales	chicago
ford	analyst	research	dallas
kobe	athletes	NULL	DALLAS
letbrother	athletes	12fkk	shanghai1111
scott	analyst	research	dallas
UPDATE t3 SET job = LOWER('KoBe') WHERE ename IS NULL;
UPDATE t3 SET job = LOWER('aThLeTes') WHERE job = LOWER('Clerk');
UPDATE t3 SET loc = (SELECT LOWER(e.dname) FROM t1 e WHERE deptno = 20 ) WHERE danme IS NULL;
SELECT *  FROM t3;
ename	job	danme	loc
ADAMS	ATHLETES	research	dallas
ALLEN	SALESMAN	sales	chicago
BLAKE	MANAGER	sales	chicago
FORD	ANALYST	RESEARCH	DALLAS
JAMES	ATHLETES	sales	chicago
KOBE	ATHLETES	NULL	research
LETBROTHER	ATHLETES	12FKK	SHANGHAI1111
MARTIN	SALESMAN	sales	chicago
MILLER	ATHLETES	accounting	new york
NULL	kobe	NULL	research
NULL	kobe	NULL	research
SCOTT	ANALYST	RESEARCH	DALLAS
SMITH	ATHLETES	research	dallas
TURNER	SALESMAN	sales	chicago
WARD	SALESMAN	sales	chicago
ford	analyst	research	dallas
kobe	athletes	NULL	research
letbrother	athletes	12fkk	shanghai1111
scott	analyst	research	dallas
obmysql-upper-1-3-4
DELETE FROM t3 WHERE UPPER(job) = 'SALESMAN';
DELETE FROM t3 WHERE loc IN (SELECT UPPER(e.loc) FROM t1 e WHERE e.deptno = 20 );
DELETE FROM t3 WHERE LOWER(ename) = 'kobe';
DELETE FROM t3 WHERE danme IN (SELECT LOWER(e.dname) FROM t1 e WHERE e.deptno = 30);
DELETE FROM t1 WHERE LOWER('SaLeS') = 'sales';
DELETE FROM t3 WHERE UPPER('AthLeTes') = 'ATHLETES';
SELECT *  FROM t3;
ename	job	danme	loc
SELECT *  FROM t1;
DEPTNO	DNAME	LOC
DROP TABLE t1;
DROP TABLE t2;
DROP TABLE t3;
drop table t1;
drop table t2;
drop table t3;
drop view t1_view;
drop view t2_view;
drop view t3_view;
CREATE TABLE t1(DEPTNO decimal(2) PRIMARY KEY,DNAME VARCHAR(14),LOC VARCHAR(13)) ;
CREATE TABLE t2(EMPNO decimal(4) PRIMARY KEY,ENAME VARCHAR(10),JOB VARCHAR(9),MGR decimal(4),HIREDATE DATE,SAL decimal(7,2),COMM decimal(7,2),DEPTNO decimal(2));
INSERT INTO t1 VALUES(10,'AccounTing','New York'),(20,'ReSeaRch','DallAs'),(30,'SaLeS','ChiCaGo'),(40,'OperaTions','BoSton');
INSERT INTO t2 VALUES(7369,'Smith','Clerk',7902,'1980-12-17',800,100,20),(7499,'Allen','SaLesMan',7698,'1981-02-20',1600,300,30),(7521,'WaRd','SaLeSman',7698,'1981-2-22',1250,500,30),(7566,'Jones','MaNaGer',7839,'1981-04-02',2975,358.69,20),
(7654,'MarTin','SaleSman',7698,'1981-09-28',1250,1400,30),(7698,'Blake','ManaGer',7839,'1981-05-01',2850,-2100,30),(7782,'Clark','ManaGer',7839,'1981-06-09',2450,744.9,10),(7788,'ScotT','AnalysT',7566,'1987-04-13',3000,-200,20),(7839,'King','PresiDent',NULL,'1981-11-17',5000,-196.7,10),
(7844,'TurNeR','SaLeSmaN',7698,'1981-09-08',1500,0,30),(7876,'Adams','ClerK',7788,'1987-05-13',1100,-99.9,20),(7900,'JaMeS','CLerK',7698,'1981-12-03',950,-1808,30),(7902,'ForD','AnalyST',7566,'1981-12-03',3000,753.9,20),(7934,'MIller','Clerk',7782,'1982-01-23',1300,729,10);
create view t1_view as select *  from t1;
create view t2_view as select *  from t2;
obmysql-upper-1-5
obmysql-upper-1-5-1
obmysql-upper-1-5-1-1
SELECT UPPER(e.dname),UPPER(e.loc) FROM t1_view e;
UPPER(e.dname)	UPPER(e.loc)
ACCOUNTING	NEW YORK
OPERATIONS	BOSTON
RESEARCH	DALLAS
SALES	CHICAGO
SELECT LOWER(e.dname),LOWER(e.loc) FROM t1_view e;
LOWER(e.dname)	LOWER(e.loc)
accounting	new york
operations	boston
research	dallas
sales	chicago
SELECT UPPER(e.ename),UPPER(e.job) FROM t2_view e limit 5;
UPPER(e.ename)	UPPER(e.job)
ALLEN	SALESMAN
JONES	MANAGER
MARTIN	SALESMAN
SMITH	CLERK
WARD	SALESMAN
SELECT LOWER(e.ename)ename,LOWER(e.job)job FROM t2_view e limit 5;
ename	job
allen	salesman
jones	manager
martin	salesman
smith	clerk
ward	salesman
SELECT * FROM (SELECT DISTINCT UPPER(e.job)job,e.deptno FROM t2_view e ORDER BY e.deptno) e;
job	deptno
ANALYST	20
CLERK	10
CLERK	20
CLERK	30
MANAGER	10
MANAGER	20
MANAGER	30
PRESIDENT	10
SALESMAN	30
SELECT * FROM (SELECT UPPER(e.ename)ename,UPPER(e.job)job FROM t2_view e WHERE UPPER(e.ename) = 'JAMES' ORDER BY e.empno) e;
ename	job
JAMES	CLERK
SELECT * FROM (SELECT UPPER(e.ename)ename,UPPER(e.job)job FROM t2_view e WHERE UPPER(e.ename) = 'WARD' AND UPPER(e.job) = 'SALESMAN' ORDER BY e.empno) e;
ename	job
WARD	SALESMAN
SELECT * FROM (SELECT UPPER(e.ename)ename,UPPER(e.job)job FROM t2_view e WHERE UPPER(e.ename) = 'WARD' OR UPPER(e.job) = 'MANAGER' ORDER BY e.empno) e;
ename	job
BLAKE	MANAGER
CLARK	MANAGER
JONES	MANAGER
WARD	SALESMAN
SELECT * FROM (SELECT UPPER(e.ename)ename,UPPER(e.job)job FROM t2_view e WHERE UPPER(e.ename) IN ('WARD','JAMES') ORDER BY e.empno) e;
ename	job
JAMES	CLERK
WARD	SALESMAN
SELECT * FROM (SELECT UPPER(e.ename)ename,UPPER(e.job)job FROM t2_view e WHERE UPPER(e.job) NOT IN ('SALESMAN','CLERK','MANAGER') ORDER BY e.empno) e;
ename	job
FORD	ANALYST
KING	PRESIDENT
SCOTT	ANALYST
SELECT * FROM (SELECT DISTINCT LOWER(e.job)job,e.deptno FROM t2_view e ORDER BY e.deptno) e;
job	deptno
analyst	20
clerk	10
clerk	20
clerk	30
manager	10
manager	20
manager	30
president	10
salesman	30
SELECT * FROM (SELECT LOWER(e.ename)ename,LOWER(e.job)job FROM t2_view e WHERE LOWER(e.ename) = 'james' ORDER BY e.empno) e;
ename	job
james	clerk
SELECT * FROM (SELECT LOWER(e.ename)ename,LOWER(e.job)job FROM t2_view e WHERE LOWER(e.ename) = 'ward' AND LOWER(e.job) = 'salesman' ORDER BY e.empno) e;
ename	job
ward	salesman
SELECT * FROM (SELECT LOWER(e.ename)ename,LOWER(e.job)job FROM t2_view e WHERE LOWER(e.ename) = 'ward' OR LOWER(e.job) = 'manager' ORDER BY e.empno) e;
ename	job
blake	manager
clark	manager
jones	manager
ward	salesman
SELECT * FROM (SELECT LOWER(e.ename)ename,LOWER(e.job)job FROM t2_view e WHERE LOWER(e.ename) IN ('ward','james') ORDER BY e.empno) e;
ename	job
james	clerk
ward	salesman
SELECT * FROM (SELECT LOWER(e.ename)ename,LOWER(e.job)job FROM t2_view e WHERE LOWER(e.job) NOT IN ('salesman','clerk','analyst') ORDER BY e.empno) e;
ename	job
blake	manager
clark	manager
jones	manager
king	president
SELECT * FROM (SELECT UPPER(e.ename)ename,UPPER(e.job)job FROM t2_view e WHERE EXISTS (SELECT * FROM t1_view p WHERE UPPER(p.dname) = 'ACCOUNTING') AND UPPER(e.job) = 'SALESMAN' ORDER BY e.empno) e;
ename	job
ALLEN	SALESMAN
MARTIN	SALESMAN
TURNER	SALESMAN
WARD	SALESMAN
SELECT * FROM (SELECT UPPER(e.ename)ename,UPPER(e.job)job FROM t2_view e WHERE NOT EXISTS (SELECT * FROM t1_view p WHERE UPPER(p.dname) = 'ACCOUNTING' AND UPPER(p.loc) = 'DALLAS') AND UPPER(e.job) = 'SALESMAN' ORDER BY e.empno) e;
ename	job
ALLEN	SALESMAN
MARTIN	SALESMAN
TURNER	SALESMAN
WARD	SALESMAN
SELECT * FROM (SELECT LOWER(e.ename)ename,LOWER(e.job)job FROM t2_view e WHERE EXISTS (SELECT * FROM t1_view p WHERE LOWER(p.dname) = 'accounting') AND LOWER(e.job) = 'salesman' ORDER BY e.empno) e;
ename	job
allen	salesman
martin	salesman
turner	salesman
ward	salesman
SELECT * FROM (SELECT LOWER(e.ename)ename,LOWER(e.job)job FROM t2_view e WHERE NOT EXISTS (SELECT * FROM t1_view p WHERE LOWER(p.dname) = 'accounting' AND LOWER(p.loc) = 'dallas') AND LOWER(e.job) = 'salesman' ORDER BY e.empno) e;
ename	job
allen	salesman
martin	salesman
turner	salesman
ward	salesman
SELECT * FROM (SELECT UPPER(e.ename)ename,UPPER(e.job)job FROM t2_view e WHERE e.deptno > ALL (SELECT p.deptno FROM t1_view p WHERE UPPER(p.dname) = 'RESEARCH' AND UPPER(p.loc) = 'DALLAS') ORDER BY e.empno ) e;
ename	job
ALLEN	SALESMAN
BLAKE	MANAGER
JAMES	CLERK
MARTIN	SALESMAN
TURNER	SALESMAN
WARD	SALESMAN
SELECT * FROM (SELECT UPPER(e.ename)ename,UPPER(e.job)job FROM t2_view e WHERE e.deptno = ALL (SELECT p.deptno FROM t1_view p WHERE UPPER(p.dname) = 'RESEARCH' AND UPPER(p.loc) = 'DALLAS') ORDER BY e.empno ) e;
ename	job
ADAMS	CLERK
FORD	ANALYST
JONES	MANAGER
SCOTT	ANALYST
SMITH	CLERK
SELECT * FROM (SELECT UPPER(e.ename)ename,UPPER(e.job)job FROM t2_view e WHERE e.deptno < ALL (SELECT p.deptno FROM t1_view p WHERE UPPER(p.dname) = 'RESEARCH' AND UPPER(p.loc) = 'DALLAS') ORDER BY e.empno ) e;
ename	job
CLARK	MANAGER
KING	PRESIDENT
MILLER	CLERK
SELECT * FROM (SELECT UPPER(e.ename)ename,UPPER(e.job)job FROM t2_view e WHERE e.deptno >= ALL (SELECT p.deptno FROM t1_view p WHERE UPPER(p.dname) = 'RESEARCH' AND UPPER(p.loc) = 'DALLAS') ORDER BY e.empno ) e;
ename	job
ADAMS	CLERK
ALLEN	SALESMAN
BLAKE	MANAGER
FORD	ANALYST
JAMES	CLERK
JONES	MANAGER
MARTIN	SALESMAN
SCOTT	ANALYST
SMITH	CLERK
TURNER	SALESMAN
WARD	SALESMAN
SELECT * FROM (SELECT UPPER(e.ename)ename,UPPER(e.job)job FROM t2_view e WHERE e.deptno <= ALL (SELECT p.deptno FROM t1_view p WHERE UPPER(p.dname) = 'RESEARCH' AND UPPER(p.loc) = 'DALLAS') ORDER BY e.empno ) e;
ename	job
ADAMS	CLERK
CLARK	MANAGER
FORD	ANALYST
JONES	MANAGER
KING	PRESIDENT
MILLER	CLERK
SCOTT	ANALYST
SMITH	CLERK
SELECT * FROM (SELECT UPPER(e.ename)ename,UPPER(e.job)job FROM t2_view e WHERE e.deptno <> ALL (SELECT p.deptno FROM t1_view p WHERE UPPER(p.dname) = 'RESEARCH' AND UPPER(p.loc) = 'DALLAS') ORDER BY e.empno ) e;
ename	job
ALLEN	SALESMAN
BLAKE	MANAGER
CLARK	MANAGER
JAMES	CLERK
KING	PRESIDENT
MARTIN	SALESMAN
MILLER	CLERK
TURNER	SALESMAN
WARD	SALESMAN
SELECT * FROM (SELECT UPPER(e.ename)ename,UPPER(e.job)job FROM t2_view e WHERE e.deptno != ALL (SELECT p.deptno FROM t1_view p WHERE UPPER(p.dname) = 'RESEARCH' AND UPPER(p.loc) = 'DALLAS') ORDER BY e.empno ) e;
ename	job
ALLEN	SALESMAN
BLAKE	MANAGER
CLARK	MANAGER
JAMES	CLERK
KING	PRESIDENT
MARTIN	SALESMAN
MILLER	CLERK
TURNER	SALESMAN
WARD	SALESMAN
SELECT * FROM (SELECT LOWER(e.ename)ename,LOWER(e.job)job FROM t2_view e WHERE e.deptno > ALL (SELECT p.deptno FROM t1_view p WHERE LOWER(p.dname) = 'research' AND LOWER(p.loc) = 'dallas') ORDER BY e.empno ) e;
ename	job
allen	salesman
blake	manager
james	clerk
martin	salesman
turner	salesman
ward	salesman
SELECT * FROM (SELECT LOWER(e.ename)ename,LOWER(e.job)job FROM t2_view e WHERE e.deptno = ALL (SELECT p.deptno FROM t1_view p WHERE LOWER(p.dname) = 'research' AND LOWER(p.loc) = 'dallas') ORDER BY e.empno ) e;
ename	job
adams	clerk
ford	analyst
jones	manager
scott	analyst
smith	clerk
SELECT * FROM (SELECT LOWER(e.ename)ename,LOWER(e.job)job FROM t2_view e WHERE e.deptno < ALL (SELECT p.deptno FROM t1_view p WHERE LOWER(p.dname) = 'research' AND LOWER(p.loc) = 'dallas') ORDER BY e.empno ) e;
ename	job
clark	manager
king	president
miller	clerk
SELECT * FROM (SELECT LOWER(e.ename)ename,LOWER(e.job)job FROM t2_view e WHERE e.deptno >= ALL (SELECT p.deptno FROM t1_view p WHERE LOWER(p.dname) = 'research' AND LOWER(p.loc) = 'dallas') ORDER BY e.empno )e;
ename	job
adams	clerk
allen	salesman
blake	manager
ford	analyst
james	clerk
jones	manager
martin	salesman
scott	analyst
smith	clerk
turner	salesman
ward	salesman
SELECT * FROM (SELECT LOWER(e.ename)ename,LOWER(e.job)job FROM t2_view e WHERE e.deptno <= ALL (SELECT p.deptno FROM t1_view p WHERE LOWER(p.dname) = 'research' AND LOWER(p.loc) = 'dallas') ORDER BY e.empno )e;
ename	job
adams	clerk
clark	manager
ford	analyst
jones	manager
king	president
miller	clerk
scott	analyst
smith	clerk
SELECT * FROM (SELECT LOWER(e.ename)ename,LOWER(e.job)job FROM t2_view e WHERE e.deptno <> ALL (SELECT p.deptno FROM t1_view p WHERE LOWER(p.dname) = 'research' AND LOWER(p.loc) = 'dallas') ORDER BY e.empno )e;
ename	job
allen	salesman
blake	manager
clark	manager
james	clerk
king	president
martin	salesman
miller	clerk
turner	salesman
ward	salesman
SELECT * FROM (SELECT LOWER(e.ename)ename,LOWER(e.job)job FROM t2_view e WHERE e.deptno != ALL (SELECT p.deptno FROM t1_view p WHERE LOWER(p.dname) = 'research' AND LOWER(p.loc) = 'dallas') ORDER BY e.empno )e;
ename	job
allen	salesman
blake	manager
clark	manager
james	clerk
king	president
martin	salesman
miller	clerk
turner	salesman
ward	salesman
SELECT * FROM (SELECT UPPER(e.ename)ename,UPPER(e.job)job FROM t2_view e WHERE e.deptno = SOME (SELECT p.deptno FROM t1_view p WHERE UPPER(p.dname) = 'RESEARCH' AND UPPER(p.loc) = 'DALLAS') ORDER BY e.empno)e;
ename	job
ADAMS	CLERK
FORD	ANALYST
JONES	MANAGER
SCOTT	ANALYST
SMITH	CLERK
SELECT * FROM (SELECT UPPER(e.ename)ename,UPPER(e.job)job FROM t2_view e WHERE e.deptno > SOME (SELECT p.deptno FROM t1_view p WHERE UPPER(p.dname) = 'RESEARCH' AND UPPER(p.loc) = 'DALLAS') ORDER BY e.empno)e;
ename	job
ALLEN	SALESMAN
BLAKE	MANAGER
JAMES	CLERK
MARTIN	SALESMAN
TURNER	SALESMAN
WARD	SALESMAN
SELECT * FROM (SELECT UPPER(e.ename)ename,UPPER(e.job)job FROM t2_view e WHERE e.deptno < SOME (SELECT p.deptno FROM t1_view p WHERE UPPER(p.dname) = 'RESEARCH' AND UPPER(p.loc) = 'DALLAS') ORDER BY e.empno)e;
ename	job
CLARK	MANAGER
KING	PRESIDENT
MILLER	CLERK
SELECT * FROM (SELECT UPPER(e.ename)ename,UPPER(e.job)job FROM t2_view e WHERE e.deptno >= SOME (SELECT p.deptno FROM t1_view p WHERE UPPER(p.dname) = 'RESEARCH' AND UPPER(p.loc) = 'DALLAS') ORDER BY e.empno)e;
ename	job
ADAMS	CLERK
ALLEN	SALESMAN
BLAKE	MANAGER
FORD	ANALYST
JAMES	CLERK
JONES	MANAGER
MARTIN	SALESMAN
SCOTT	ANALYST
SMITH	CLERK
TURNER	SALESMAN
WARD	SALESMAN
SELECT * FROM (SELECT UPPER(e.ename)ename,UPPER(e.job)job FROM t2_view e WHERE e.deptno <= SOME (SELECT p.deptno FROM t1_view p WHERE UPPER(p.dname) = 'RESEARCH' AND UPPER(p.loc) = 'DALLAS') ORDER BY e.empno)e;
ename	job
ADAMS	CLERK
CLARK	MANAGER
FORD	ANALYST
JONES	MANAGER
KING	PRESIDENT
MILLER	CLERK
SCOTT	ANALYST
SMITH	CLERK
SELECT * FROM (SELECT UPPER(e.ename)ename,UPPER(e.job)job FROM t2_view e WHERE e.deptno <> SOME (SELECT p.deptno FROM t1_view p WHERE UPPER(p.dname) = 'RESEARCH' AND UPPER(p.loc) = 'DALLAS') ORDER BY e.empno)e;
ename	job
ALLEN	SALESMAN
BLAKE	MANAGER
CLARK	MANAGER
JAMES	CLERK
KING	PRESIDENT
MARTIN	SALESMAN
MILLER	CLERK
TURNER	SALESMAN
WARD	SALESMAN
SELECT * FROM (SELECT UPPER(e.ename)ename,UPPER(e.job)job FROM t2_view e WHERE e.deptno != SOME (SELECT p.deptno FROM t1_view p WHERE UPPER(p.dname) = 'RESEARCH' AND UPPER(p.loc) = 'DALLAS') ORDER BY e.empno)e;
ename	job
ALLEN	SALESMAN
BLAKE	MANAGER
CLARK	MANAGER
JAMES	CLERK
KING	PRESIDENT
MARTIN	SALESMAN
MILLER	CLERK
TURNER	SALESMAN
WARD	SALESMAN
SELECT * FROM (SELECT LOWER(e.ename)ename,LOWER(e.job)job FROM t2_view e WHERE e.deptno > SOME (SELECT p.deptno FROM t1_view p WHERE LOWER(p.dname) = 'research' AND LOWER(p.loc) = 'dallas') ORDER BY e.empno )e;
ename	job
allen	salesman
blake	manager
james	clerk
martin	salesman
turner	salesman
ward	salesman
SELECT * FROM (SELECT LOWER(e.ename)ename,LOWER(e.job)job FROM t2_view e WHERE e.deptno = SOME (SELECT p.deptno FROM t1_view p WHERE LOWER(p.dname) = 'research' AND LOWER(p.loc) = 'dallas') ORDER BY e.empno )e;
ename	job
adams	clerk
ford	analyst
jones	manager
scott	analyst
smith	clerk
SELECT * FROM (SELECT LOWER(e.ename)ename,LOWER(e.job)job FROM t2_view e WHERE e.deptno < SOME (SELECT p.deptno FROM t1_view p WHERE LOWER(p.dname) = 'research' AND LOWER(p.loc) = 'dallas') ORDER BY e.empno )e;
ename	job
clark	manager
king	president
miller	clerk
SELECT * FROM (SELECT LOWER(e.ename)ename,LOWER(e.job)job FROM t2_view e WHERE e.deptno >= SOME (SELECT p.deptno FROM t1_view p WHERE LOWER(p.dname) = 'research' AND LOWER(p.loc) = 'dallas') ORDER BY e.empno )e;
ename	job
adams	clerk
allen	salesman
blake	manager
ford	analyst
james	clerk
jones	manager
martin	salesman
scott	analyst
smith	clerk
turner	salesman
ward	salesman
SELECT * FROM (SELECT LOWER(e.ename)ename,LOWER(e.job)job FROM t2_view e WHERE e.deptno <= SOME (SELECT p.deptno FROM t1_view p WHERE LOWER(p.dname) = 'research' AND LOWER(p.loc) = 'dallas') ORDER BY e.empno )e;
ename	job
adams	clerk
clark	manager
ford	analyst
jones	manager
king	president
miller	clerk
scott	analyst
smith	clerk
SELECT * FROM (SELECT LOWER(e.ename)ename,LOWER(e.job)job FROM t2_view e WHERE e.deptno <> SOME (SELECT p.deptno FROM t1_view p WHERE LOWER(p.dname) = 'research' AND LOWER(p.loc) = 'dallas') ORDER BY e.empno )e;
ename	job
allen	salesman
blake	manager
clark	manager
james	clerk
king	president
martin	salesman
miller	clerk
turner	salesman
ward	salesman
SELECT * FROM (SELECT LOWER(e.ename)ename,LOWER(e.job)job FROM t2_view e WHERE e.deptno != SOME (SELECT p.deptno FROM t1_view p WHERE LOWER(p.dname) = 'research' AND LOWER(p.loc) = 'dallas') ORDER BY e.empno )e;
ename	job
allen	salesman
blake	manager
clark	manager
james	clerk
king	president
martin	salesman
miller	clerk
turner	salesman
ward	salesman
SELECT * FROM (SELECT UPPER(e.ename)ename,UPPER(e.job)job FROM t2_view e WHERE e.deptno = ANY (SELECT p.deptno FROM t1_view p WHERE UPPER(p.dname) = 'RESEARCH' AND UPPER(p.loc) = 'DALLAS') ORDER BY e.empno)e;
ename	job
ADAMS	CLERK
FORD	ANALYST
JONES	MANAGER
SCOTT	ANALYST
SMITH	CLERK
SELECT * FROM (SELECT UPPER(e.ename)ename,UPPER(e.job)job FROM t2_view e WHERE e.deptno > ANY (SELECT p.deptno FROM t1_view p WHERE UPPER(p.dname) = 'RESEARCH' AND UPPER(p.loc) = 'DALLAS') ORDER BY e.empno)e;
ename	job
ALLEN	SALESMAN
BLAKE	MANAGER
JAMES	CLERK
MARTIN	SALESMAN
TURNER	SALESMAN
WARD	SALESMAN
SELECT * FROM (SELECT UPPER(e.ename)ename,UPPER(e.job)job FROM t2_view e WHERE e.deptno < ANY (SELECT p.deptno FROM t1_view p WHERE UPPER(p.dname) = 'RESEARCH' AND UPPER(p.loc) = 'DALLAS') ORDER BY e.empno)e;
ename	job
CLARK	MANAGER
KING	PRESIDENT
MILLER	CLERK
SELECT * FROM (SELECT UPPER(e.ename)ename,UPPER(e.job)job FROM t2_view e WHERE e.deptno >= ANY (SELECT p.deptno FROM t1_view p WHERE UPPER(p.dname) = 'RESEARCH' AND UPPER(p.loc) = 'DALLAS') ORDER BY e.empno)e;
ename	job
ADAMS	CLERK
ALLEN	SALESMAN
BLAKE	MANAGER
FORD	ANALYST
JAMES	CLERK
JONES	MANAGER
MARTIN	SALESMAN
SCOTT	ANALYST
SMITH	CLERK
TURNER	SALESMAN
WARD	SALESMAN
SELECT * FROM (SELECT UPPER(e.ename)ename,UPPER(e.job)job FROM t2_view e WHERE e.deptno <= ANY (SELECT p.deptno FROM t1_view p WHERE UPPER(p.dname) = 'RESEARCH' AND UPPER(p.loc) = 'DALLAS') ORDER BY e.empno)e;
ename	job
ADAMS	CLERK
CLARK	MANAGER
FORD	ANALYST
JONES	MANAGER
KING	PRESIDENT
MILLER	CLERK
SCOTT	ANALYST
SMITH	CLERK
SELECT * FROM (SELECT UPPER(e.ename)ename,UPPER(e.job)job FROM t2_view e WHERE e.deptno <> ANY (SELECT p.deptno FROM t1_view p WHERE UPPER(p.dname) = 'RESEARCH' AND UPPER(p.loc) = 'DALLAS') ORDER BY e.empno)e;
ename	job
ALLEN	SALESMAN
BLAKE	MANAGER
CLARK	MANAGER
JAMES	CLERK
KING	PRESIDENT
MARTIN	SALESMAN
MILLER	CLERK
TURNER	SALESMAN
WARD	SALESMAN
SELECT * FROM (SELECT UPPER(e.ename)ename,UPPER(e.job)job FROM t2_view e WHERE e.deptno != ANY (SELECT p.deptno FROM t1_view p WHERE UPPER(p.dname) = 'RESEARCH' AND UPPER(p.loc) = 'DALLAS') ORDER BY e.empno)e;
ename	job
ALLEN	SALESMAN
BLAKE	MANAGER
CLARK	MANAGER
JAMES	CLERK
KING	PRESIDENT
MARTIN	SALESMAN
MILLER	CLERK
TURNER	SALESMAN
WARD	SALESMAN
SELECT * FROM (SELECT LOWER(e.ename)ename,LOWER(e.job)job FROM t2_view e WHERE e.deptno > ANY (SELECT p.deptno FROM t1_view p WHERE LOWER(p.dname) = 'research' AND LOWER(p.loc) = 'dallas') ORDER BY e.empno )e;
ename	job
allen	salesman
blake	manager
james	clerk
martin	salesman
turner	salesman
ward	salesman
SELECT * FROM (SELECT LOWER(e.ename)ename,LOWER(e.job)job FROM t2_view e WHERE e.deptno = ANY (SELECT p.deptno FROM t1_view p WHERE LOWER(p.dname) = 'research' AND LOWER(p.loc) = 'dallas') ORDER BY e.empno )e;
ename	job
adams	clerk
ford	analyst
jones	manager
scott	analyst
smith	clerk
SELECT * FROM (SELECT LOWER(e.ename)ename,LOWER(e.job)job FROM t2_view e WHERE e.deptno < ANY (SELECT p.deptno FROM t1_view p WHERE LOWER(p.dname) = 'research' AND LOWER(p.loc) = 'dallas') ORDER BY e.empno )e;
ename	job
clark	manager
king	president
miller	clerk
SELECT * FROM (SELECT LOWER(e.ename)ename,LOWER(e.job)job FROM t2_view e WHERE e.deptno >= ANY (SELECT p.deptno FROM t1_view p WHERE LOWER(p.dname) = 'research' AND LOWER(p.loc) = 'dallas') ORDER BY e.empno )e;
ename	job
adams	clerk
allen	salesman
blake	manager
ford	analyst
james	clerk
jones	manager
martin	salesman
scott	analyst
smith	clerk
turner	salesman
ward	salesman
SELECT * FROM (SELECT LOWER(e.ename)ename,LOWER(e.job)job FROM t2_view e WHERE e.deptno <= ANY (SELECT p.deptno FROM t1_view p WHERE LOWER(p.dname) = 'research' AND LOWER(p.loc) = 'dallas') ORDER BY e.empno )e;
ename	job
adams	clerk
clark	manager
ford	analyst
jones	manager
king	president
miller	clerk
scott	analyst
smith	clerk
SELECT * FROM (SELECT LOWER(e.ename)ename,LOWER(e.job)job FROM t2_view e WHERE e.deptno <> ANY (SELECT p.deptno FROM t1_view p WHERE LOWER(p.dname) = 'research' AND LOWER(p.loc) = 'dallas') ORDER BY e.empno )e;
ename	job
allen	salesman
blake	manager
clark	manager
james	clerk
king	president
martin	salesman
miller	clerk
turner	salesman
ward	salesman
SELECT * FROM (SELECT LOWER(e.ename)ename,LOWER(e.job)job FROM t2_view e WHERE e.deptno != ANY (SELECT p.deptno FROM t1_view p WHERE LOWER(p.dname) = 'research' AND LOWER(p.loc) = 'dallas') ORDER BY e.empno )e;
ename	job
allen	salesman
blake	manager
clark	manager
james	clerk
king	president
martin	salesman
miller	clerk
turner	salesman
ward	salesman
DROP view t3_view;
CREATE view t3_view AS SELECT UPPER(e.ename)ename,UPPER(e.job)job FROM t2_view e WHERE UPPER(e.job) = 'SALESMAN' OR UPPER(e.job) = 'PRESIDENT' order by e.empno;
SELECT *  FROM t3_view;
ename	job
ALLEN	SALESMAN
KING	PRESIDENT
MARTIN	SALESMAN
TURNER	SALESMAN
WARD	SALESMAN
DROP view t3_view;
CREATE view t3_view AS SELECT UPPER(e.ename)ename,UPPER(p.loc)loc,UPPER(e.job)job FROM t2_view e LEFT JOIN t1_view p ON e.deptno = p.deptno WHERE UPPER(e.job) = 'SALESMAN' OR UPPER(p.loc) = 'NEW YORK' order by e.empno;
SELECT * FROM t3_view;
ename	loc	job
ALLEN	CHICAGO	SALESMAN
CLARK	NEW YORK	MANAGER
KING	NEW YORK	PRESIDENT
MARTIN	CHICAGO	SALESMAN
MILLER	NEW YORK	CLERK
TURNER	CHICAGO	SALESMAN
WARD	CHICAGO	SALESMAN
DROP view t3_view;
CREATE view t3_view AS SELECT LOWER(e.ename)ename,LOWER(e.job)job FROM t2_view e WHERE LOWER(e.job) = 'salesman' OR LOWER(e.job) = 'president' order by e.empno;
SELECT * FROM t3_view;
ename	job
allen	salesman
king	president
martin	salesman
turner	salesman
ward	salesman
DROP view t3_view;
CREATE view t3_view AS SELECT LOWER(e.ename)ename,LOWER(p.loc)loc,LOWER(e.job)job FROM t2_view e LEFT JOIN t1_view p ON e.deptno = p.deptno WHERE LOWER(e.job) = 'salesman' OR LOWER(p.loc) = 'new york' order by e.empno;
SELECT * FROM t3_view;
ename	loc	job
allen	chicago	salesman
clark	new york	manager
king	new york	president
martin	chicago	salesman
miller	new york	clerk
turner	chicago	salesman
ward	chicago	salesman
DROP view t3_view;
CREATE view t3_view AS SELECT UPPER(e.ename)ename,LOWER(e.job)job FROM t2_view e WHERE UPPER(e.job) = 'SALESMAN' OR LOWER(e.job) = 'president' order by e.empno;
SELECT *  FROM t3_view;
ename	job
ALLEN	salesman
KING	president
MARTIN	salesman
TURNER	salesman
WARD	salesman
DROP table t3;
CREATE table t3 AS SELECT UPPER(e.ename)ename,UPPER(e.job)job,LOWER(p.dname)danme,LOWER(p.loc)loc FROM t2_view e LEFT JOIN t1_view p ON e.deptno = p.deptno WHERE UPPER(e.job) = 'CLERK' OR LOWER(p.loc) = 'chicago';
SELECT *  FROM t3;
ename	job	danme	loc
ADAMS	CLERK	research	dallas
ALLEN	SALESMAN	sales	chicago
BLAKE	MANAGER	sales	chicago
JAMES	CLERK	sales	chicago
MARTIN	SALESMAN	sales	chicago
MILLER	CLERK	accounting	new york
SMITH	CLERK	research	dallas
TURNER	SALESMAN	sales	chicago
WARD	SALESMAN	sales	chicago
SELECT UPPER(e.ename)ename,UPPER(e.job)job FROM t2_view e WHERE UPPER(e.ename) LIKE '%C%' ORDER BY e.empno;
ename	job
CLARK	MANAGER
SCOTT	ANALYST
SELECT UPPER(e.ename)ename,UPPER(e.job)job FROM t2_view e WHERE UPPER(e.ename) LIKE 'S%' ORDER BY e.empno;
ename	job
SCOTT	ANALYST
SMITH	CLERK
SELECT UPPER(e.ename)ename,UPPER(e.job)job FROM t2_view e WHERE UPPER(e.ename) LIKE '%K' ORDER BY e.empno;
ename	job
CLARK	MANAGER
SELECT UPPER(e.ename)ename,UPPER(e.job)job FROM t2_view e WHERE UPPER(e.ename) LIKE '_A%' ORDER BY e.empno;
ename	job
JAMES	CLERK
MARTIN	SALESMAN
WARD	SALESMAN
SELECT UPPER(e.ename)ename,UPPER(e.job)job FROM t2_view e WHERE UPPER(e.ename) LIKE '%R_' ORDER BY e.empno;
ename	job
CLARK	MANAGER
FORD	ANALYST
WARD	SALESMAN
SELECT UPPER(e.ename)ename,UPPER(e.job)job FROM t2_view e WHERE UPPER(e.ename) LIKE '%C%' AND UPPER(e.job) LIKE '_A%' ORDER BY e.empno;
ename	job
CLARK	MANAGER
SELECT LOWER(e.ename)ename,LOWER(e.job)job FROM t2_view e WHERE LOWER(e.ename) LIKE '%c%' ORDER BY e.empno;
ename	job
clark	manager
scott	analyst
SELECT LOWER(e.ename)ename,LOWER(e.job)job FROM t2_view e WHERE LOWER(e.ename) LIKE 's%' ORDER BY e.empno;
ename	job
scott	analyst
smith	clerk
SELECT LOWER(e.ename)ename,LOWER(e.job)job FROM t2_view e WHERE LOWER(e.ename) LIKE '%k' ORDER BY e.empno;
ename	job
clark	manager
SELECT LOWER(e.ename)ename,LOWER(e.job)job FROM t2_view e WHERE LOWER(e.ename) LIKE '_a%' ORDER BY e.empno;
ename	job
james	clerk
martin	salesman
ward	salesman
SELECT LOWER(e.ename)ename,LOWER(e.job)job FROM t2_view e WHERE LOWER(e.ename) LIKE '%r_' ORDER BY e.empno;
ename	job
clark	manager
ford	analyst
ward	salesman
SELECT LOWER(e.ename)ename,LOWER(e.job)job FROM t2_view e WHERE LOWER(e.ename) LIKE '%c%' AND LOWER(e.job) LIKE '_a%' ORDER BY e.empno;
ename	job
clark	manager
SELECT UPPER(e.ename)ename,UPPER(e.job)job FROM t2_view e WHERE  UPPER(e.ename) = 'MARTIN' OR UPPER(e.job) = 'PRESIDENT' ORDER BY e.empno;
ename	job
KING	PRESIDENT
MARTIN	SALESMAN
SELECT UPPER(e.ename) || UPPER(e.job) ejob FROM t2_view e WHERE  UPPER(e.ename) = 'MARTIN' OR UPPER(e.job) = 'PRESIDENT' ORDER BY e.empno;
ejob
0
0
Warnings:
Warning	1292	Truncated incorrect DOUBLE value: 'MARTIN'
Warning	1292	Truncated incorrect DOUBLE value: 'KING'
Warning	1292	Truncated incorrect DOUBLE value: 'SALESMAN'
Warning	1292	Truncated incorrect DOUBLE value: 'PRESIDENT'
SELECT LOWER(e.ename)ename,LOWER(e.job)job FROM t2_view e WHERE  LOWER(e.ename) = 'martin' OR LOWER(e.job) = 'president' ORDER BY e.empno;
ename	job
king	president
martin	salesman
SELECT LOWER(e.ename) || LOWER(e.job) ejob FROM t2_view e WHERE  LOWER(e.ename) = 'martin' OR LOWER(e.job) = 'president' ORDER BY e.empno;
ejob
0
0
Warnings:
Warning	1292	Truncated incorrect DOUBLE value: 'martin'
Warning	1292	Truncated incorrect DOUBLE value: 'king'
Warning	1292	Truncated incorrect DOUBLE value: 'salesman'
Warning	1292	Truncated incorrect DOUBLE value: 'president'
SELECT UPPER(e.ename)ename,UPPER(e.job)job FROM t2_view e WHERE UPPER(e.job) = 'ANALYST' ORDER BY e.empno;
ename	job
FORD	ANALYST
SCOTT	ANALYST
SELECT UPPER(e.ename)ename,UPPER(e.job)job FROM t2_view e WHERE 1 = 1 AND UPPER(mgr) IS NULL ORDER BY e.empno;
ename	job
KING	PRESIDENT
SELECT UPPER(e.ename)ename,UPPER(e.job)job FROM t2_view e WHERE UPPER(e.job) IN ('SALESMAN','CLERK') ORDER BY e.empno;
ename	job
ADAMS	CLERK
ALLEN	SALESMAN
JAMES	CLERK
MARTIN	SALESMAN
MILLER	CLERK
SMITH	CLERK
TURNER	SALESMAN
WARD	SALESMAN
SELECT UPPER(e.ename)ename,UPPER(e.job)job FROM t2_view e WHERE 1 = 1 AND UPPER(e.deptno) BETWEEN 10 AND 20 ORDER BY e.empno;
ename	job
ADAMS	CLERK
CLARK	MANAGER
FORD	ANALYST
JONES	MANAGER
KING	PRESIDENT
MILLER	CLERK
SCOTT	ANALYST
SMITH	CLERK
SELECT UPPER(e.ename)ename,UPPER(e.job)job FROM t2_view e WHERE 1 = 1 AND UPPER(e.job) = 'CLERK' OR UPPER(e.ename) = 'JONES' ORDER BY e.empno;
ename	job
ADAMS	CLERK
JAMES	CLERK
JONES	MANAGER
MILLER	CLERK
SMITH	CLERK
SELECT UPPER(e.ename)ename,UPPER(e.job)job FROM t2_view e WHERE 1 = 1 AND UPPER(e.ename) = (SELECT UPPER(p.ename) FROM t2_view p WHERE UPPER(p.ename)='JAMES' )ORDER BY e.empno;
ename	job
JAMES	CLERK
SELECT LOWER(e.ename)ename,LOWER(e.job)job FROM t2_view e WHERE LOWER(e.job) = 'analyst' ORDER BY e.empno;
ename	job
ford	analyst
scott	analyst
SELECT LOWER(e.ename)ename,LOWER(e.job)job FROM t2_view e WHERE 1 = 1 AND LOWER(mgr) IS NULL ORDER BY e.empno;
ename	job
king	president
SELECT LOWER(e.ename)ename,LOWER(e.job)job FROM t2_view e WHERE LOWER(e.job) IN ('salesman','clerk') ORDER BY e.empno;
ename	job
adams	clerk
allen	salesman
james	clerk
martin	salesman
miller	clerk
smith	clerk
turner	salesman
ward	salesman
SELECT LOWER(e.ename)ename,LOWER(e.job)job FROM t2_view e WHERE 1 = 1 AND LOWER(e.deptno) BETWEEN 10 AND 20 ORDER BY e.empno;
ename	job
adams	clerk
clark	manager
ford	analyst
jones	manager
king	president
miller	clerk
scott	analyst
smith	clerk
SELECT LOWER(e.ename)ename,LOWER(e.job)job FROM t2_view e WHERE 1 = 1 AND LOWER(e.job) = 'clerk' OR LOWER(e.ename) = 'jones' ORDER BY e.empno;
ename	job
adams	clerk
james	clerk
jones	manager
miller	clerk
smith	clerk
SELECT LOWER(e.ename)ename,LOWER(e.job)job FROM t2_view e WHERE 1 = 1 AND LOWER(e.ename) = (SELECT LOWER(p.ename) FROM t2_view p WHERE LOWER(p.ename)='james' )ORDER BY e.empno;
ename	job
james	clerk
SELECT UPPER(e.ename)ename,UPPER(e.job)job FROM t2_view e WHERE UPPER(e.job) = 'SALESMAN' ORDER BY 1;
ename	job
ALLEN	SALESMAN
MARTIN	SALESMAN
TURNER	SALESMAN
WARD	SALESMAN
SELECT UPPER(e.ename)ename,UPPER(e.job)job FROM t2_view e WHERE UPPER(e.job) = 'SALESMAN' ORDER BY UPPER(e.ename);
ename	job
ALLEN	SALESMAN
MARTIN	SALESMAN
TURNER	SALESMAN
WARD	SALESMAN
SELECT UPPER(e.ename)ename,UPPER(e.job)job FROM t2_view e WHERE UPPER(e.job) = 'SALESMAN' ORDER BY UPPER(e.ename) ASC;
ename	job
ALLEN	SALESMAN
MARTIN	SALESMAN
TURNER	SALESMAN
WARD	SALESMAN
SELECT UPPER(e.ename)ename,UPPER(e.job)job FROM t2_view e WHERE UPPER(e.job) = 'SALESMAN' ORDER BY UPPER(e.ename) DESC;
ename	job
ALLEN	SALESMAN
MARTIN	SALESMAN
TURNER	SALESMAN
WARD	SALESMAN
SELECT LOWER(e.ename)ename,LOWER(e.job)job FROM t2_view e WHERE LOWER(e.job) = 'salesman' ORDER BY 1;
ename	job
allen	salesman
martin	salesman
turner	salesman
ward	salesman
SELECT LOWER(e.ename)ename,LOWER(e.job)job FROM t2_view e WHERE LOWER(e.job) = 'salesman' ORDER BY LOWER(e.ename);
ename	job
allen	salesman
martin	salesman
turner	salesman
ward	salesman
SELECT LOWER(e.ename)ename,LOWER(e.job)job FROM t2_view e WHERE LOWER(e.job) = 'salesman' ORDER BY LOWER(e.ename) ASC;
ename	job
allen	salesman
martin	salesman
turner	salesman
ward	salesman
SELECT LOWER(e.ename)ename,LOWER(e.job)job FROM t2_view e WHERE LOWER(e.job) = 'salesman' ORDER BY LOWER(e.ename) DESC;
ename	job
allen	salesman
martin	salesman
turner	salesman
ward	salesman
SELECT e.deptno,COUNT(UPPER(e.job))job FROM t2_view e WHERE UPPER(e.job) = 'SALESMAN' OR UPPER(e.job) = 'ANALYST' GROUP BY e.deptno ORDER BY e.deptno;
deptno	job
20	2
30	4
SELECT COUNT(UPPER(e.job))job FROM t2_view e WHERE UPPER(e.job) = 'SALESMAN' OR UPPER(e.job) = 'ANALYST' GROUP BY UPPER(e.job) ORDER BY COUNT(UPPER(e.job));
job
2
4
SELECT e.deptno,COUNT(UPPER(e.job))job FROM t2_view e WHERE UPPER(e.job) = 'SALESMAN' OR UPPER(e.job) = 'ANALYST' GROUP BY UPPER(e.job),e.deptno ORDER BY e.deptno;
deptno	job
20	2
30	4
SELECT e.deptno,COUNT(UPPER(e.job))job FROM t2_view e WHERE UPPER(e.job) = 'SALESMAN' OR UPPER(e.job) = 'ANALYST' GROUP BY UPPER(e.job),e.deptno HAVING COUNT(UPPER(e.job)) > 2 ORDER BY e.deptno;
deptno	job
30	4
SELECT e.deptno,COUNT(LOWER(e.job))job FROM t2_view e WHERE LOWER(e.job) = 'salesman' OR LOWER(e.job) = 'analyst' GROUP BY e.deptno ORDER BY e.deptno;
deptno	job
20	2
30	4
SELECT COUNT(LOWER(e.job))job FROM t2_view e WHERE LOWER(e.job) = 'salesman' OR LOWER(e.job) = 'analyst' GROUP BY LOWER(e.job) ORDER BY COUNT(LOWER(e.job));
job
2
4
SELECT e.deptno,COUNT(LOWER(e.job))job FROM t2_view e WHERE LOWER(e.job) = 'salesman' OR LOWER(e.job) = 'analyst' GROUP BY LOWER(e.job),e.deptno ORDER BY e.deptno;
deptno	job
20	2
30	4
SELECT e.deptno,COUNT(LOWER(e.job))job FROM t2_view e WHERE LOWER(e.job) = 'salesman' OR LOWER(e.job) = 'analyst' GROUP BY LOWER(e.job),e.deptno HAVING COUNT(LOWER(e.job)) > 2 ORDER BY e.deptno;
deptno	job
30	4
SELECT UPPER(e.ename),(CASE UPPER(e.job) WHEN 'SALESMAN' THEN '1' WHEN 'CLERK' THEN '2' WHEN 'MANAGER' THEN '3' WHEN 'PRESIDENT' THEN '4' ELSE '5' END)job FROM t2_view e limit 5;
UPPER(e.ename)	job
ALLEN	1
JONES	3
MARTIN	1
SMITH	2
WARD	1
SELECT UPPER(e.ename),UPPER(CASE WHEN e.sal < 2000 THEN NULL ELSE 'HighSalary' END )sal FROM  t2_view e WHERE UPPER(CASE WHEN e.sal < 2000 THEN NULL ELSE 'HighSalary' END ) IS NOT NULL ORDER BY e.empno;
UPPER(e.ename)	sal
BLAKE	HIGHSALARY
CLARK	HIGHSALARY
FORD	HIGHSALARY
JONES	HIGHSALARY
KING	HIGHSALARY
SCOTT	HIGHSALARY
SELECT LOWER(e.ename),(CASE LOWER(e.job) WHEN 'salesman' THEN '1' WHEN 'clerk' THEN '2' WHEN 'manager' THEN '3' WHEN 'president' THEN '4' ELSE '5' END)job FROM t2_view e limit 5;
LOWER(e.ename)	job
allen	1
jones	3
martin	1
smith	2
ward	1
SELECT LOWER(e.ename),LOWER(CASE WHEN e.sal < 2000 THEN NULL ELSE 'HighSalary' END )sal FROM  t2_view e WHERE LOWER(CASE WHEN e.sal < 2000 THEN NULL ELSE 'HighSalary' END ) IS NOT NULL ORDER BY e.empno;
LOWER(e.ename)	sal
blake	highsalary
clark	highsalary
ford	highsalary
jones	highsalary
king	highsalary
scott	highsalary
INSERT INTO t3(ename,job) VALUES(UPPER('KoBe'),UPPER('Athletes'));
INSERT INTO t3 VALUES(UPPER('Letbrother'),UPPER('Athletes'),UPPER('12fkk'),UPPER('shangHAI1111'));
INSERT INTO t3(loc) SELECT UPPER(e.loc) FROM t1_view e WHERE e.deptno = 30;
INSERT INTO t3  SELECT UPPER(e.ename),UPPER(e.job),UPPER(p.dname),UPPER(p.loc) FROM t2_view e LEFT JOIN t1_view p ON e.deptno = p.deptno WHERE UPPER(e.job) =  'ANALYST' ORDER BY e.empno;
SELECT * FROM t3;
ename	job	danme	loc
ADAMS	CLERK	research	dallas
ALLEN	SALESMAN	sales	chicago
BLAKE	MANAGER	sales	chicago
FORD	ANALYST	RESEARCH	DALLAS
JAMES	CLERK	sales	chicago
KOBE	ATHLETES	NULL	NULL
LETBROTHER	ATHLETES	12FKK	SHANGHAI1111
MARTIN	SALESMAN	sales	chicago
MILLER	CLERK	accounting	new york
NULL	NULL	NULL	CHICAGO
SCOTT	ANALYST	RESEARCH	DALLAS
SMITH	CLERK	research	dallas
TURNER	SALESMAN	sales	chicago
WARD	SALESMAN	sales	chicago
INSERT INTO t3(ename,job) VALUES(LOWER('KoBe'),LOWER('Athletes'));
INSERT INTO t3 VALUES(LOWER('Letbrother'),LOWER('Athletes'),LOWER('12fkk'),LOWER('shangHAI1111'));
INSERT INTO t3(loc) SELECT LOWER(e.loc) FROM t1_view e WHERE e.deptno = 30;
INSERT INTO t3  SELECT LOWER(e.ename),LOWER(e.job),LOWER(p.dname),LOWER(p.loc) FROM t2_view e LEFT JOIN t1_view p ON e.deptno = p.deptno WHERE LOWER(e.job) =  'analyst' ORDER BY e.empno;
SELECT *  FROM t3;
ename	job	danme	loc
ADAMS	CLERK	research	dallas
ALLEN	SALESMAN	sales	chicago
BLAKE	MANAGER	sales	chicago
FORD	ANALYST	RESEARCH	DALLAS
JAMES	CLERK	sales	chicago
KOBE	ATHLETES	NULL	NULL
LETBROTHER	ATHLETES	12FKK	SHANGHAI1111
MARTIN	SALESMAN	sales	chicago
MILLER	CLERK	accounting	new york
NULL	NULL	NULL	CHICAGO
NULL	NULL	NULL	chicago
SCOTT	ANALYST	RESEARCH	DALLAS
SMITH	CLERK	research	dallas
TURNER	SALESMAN	sales	chicago
WARD	SALESMAN	sales	chicago
ford	analyst	research	dallas
kobe	athletes	NULL	NULL
letbrother	athletes	12fkk	shanghai1111
scott	analyst	research	dallas
obmysql-upper-1-5-1-2
UPDATE t3 SET job = UPPER('aThLeTes') WHERE job IS NULL;
UPDATE t3 SET job = UPPER('aThLeTes') WHERE job = UPPER('Clerk');
UPDATE t3 SET loc = (SELECT UPPER(e.loc) FROM t1_view e WHERE deptno = 20 ) WHERE loc IS NULL;
SELECT *  FROM t3 order by loc,ename;
ename	job	danme	loc
ADAMS	ATHLETES	research	dallas
ALLEN	SALESMAN	sales	chicago
BLAKE	MANAGER	sales	chicago
FORD	ANALYST	RESEARCH	DALLAS
JAMES	ATHLETES	sales	chicago
KOBE	ATHLETES	NULL	DALLAS
LETBROTHER	ATHLETES	12FKK	SHANGHAI1111
MARTIN	SALESMAN	sales	chicago
MILLER	ATHLETES	accounting	new york
NULL	ATHLETES	NULL	CHICAGO
NULL	ATHLETES	NULL	chicago
SCOTT	ANALYST	RESEARCH	DALLAS
SMITH	ATHLETES	research	dallas
TURNER	SALESMAN	sales	chicago
WARD	SALESMAN	sales	chicago
ford	analyst	research	dallas
kobe	athletes	NULL	DALLAS
letbrother	athletes	12fkk	shanghai1111
scott	analyst	research	dallas
UPDATE t3 SET job = LOWER('KoBe') WHERE ename IS NULL;
UPDATE t3 SET job = LOWER('aThLeTes') WHERE job = LOWER('Clerk');
UPDATE t3 SET loc = (SELECT LOWER(e.dname) FROM t1_view e WHERE deptno = 20 ) WHERE danme IS NULL;
SELECT *  FROM t3 order by loc,ename;
ename	job	danme	loc
ADAMS	ATHLETES	research	dallas
ALLEN	SALESMAN	sales	chicago
BLAKE	MANAGER	sales	chicago
FORD	ANALYST	RESEARCH	DALLAS
JAMES	ATHLETES	sales	chicago
KOBE	ATHLETES	NULL	research
LETBROTHER	ATHLETES	12FKK	SHANGHAI1111
MARTIN	SALESMAN	sales	chicago
MILLER	ATHLETES	accounting	new york
NULL	kobe	NULL	research
NULL	kobe	NULL	research
SCOTT	ANALYST	RESEARCH	DALLAS
SMITH	ATHLETES	research	dallas
TURNER	SALESMAN	sales	chicago
WARD	SALESMAN	sales	chicago
ford	analyst	research	dallas
kobe	athletes	NULL	research
letbrother	athletes	12fkk	shanghai1111
scott	analyst	research	dallas
obmysql-upper-1-5-1-3
DELETE FROM t3 WHERE UPPER(job) = 'SALESMAN';
DELETE FROM t3 WHERE loc IN (SELECT UPPER(e.loc) FROM t1_view e WHERE e.deptno = 20 );
DELETE FROM t3 WHERE LOWER(ename) = 'kobe';
DELETE FROM t3 WHERE danme IN (SELECT LOWER(e.dname) FROM t1_view e WHERE e.deptno = 30);
DELETE FROM t3 WHERE LOWER('SaLeS') = 'sales';
DELETE FROM t1 WHERE UPPER('AthLeTes') = 'ATHLETES';
SELECT *  FROM t3;
ename	job	danme	loc
SELECT *  FROM t1;
DEPTNO	DNAME	LOC
DROP TABLE t1;
DROP TABLE t2;
DROP TABLE t3;
DROP view t3_view;
DROP view t2_view;
DROP view t1_view;
drop table t1;
create table t1(EMPNO decimal(4) primary key,ENAME VARCHAR(10),JOB VARCHAR(9)not null,MGR decimal(4),HIREDATE DATE,SAL decimal(7,2),COMM decimal(7,2),DEPTNO decimal(2),constraint uq unique(ename));
insert into t1 values(7369,'Smith','Clerk',7902,'1980-12-17',800,100,20),(7499,'Allen','SaLesMan',7698,'1981-02-20',1600,300,30),(7521,'WaRd','SaLeSman',7698,'1981-2-22',1250,500,30),(7566,'Jones','MaNaGer',7839,'1981-04-02',2975,358.69,20),
(7654,'MarTin','SaleSman',7698,'1981-09-28',1250,1400,30),(7698,'Blake','ManaGer',7839,'1981-05-01',2850,-2100,30),(7782,'Clark','ManaGer',7839,'1981-06-09',2450,744.9,10),(7788,'ScotT','AnalysT',7566,'1987-04-13',3000,-200,20),(7839,'King','PresiDent',NULL,'1981-11-17',5000,-196.7,10),
(7844,'TurNeR','SaLeSmaN',7698,'1981-09-08',1500,0,30),(7876,'Adams','ClerK',7788,'1987-05-13',1100,-99.9,20),(7900,'JaMeS','CLerK',7698,'1981-12-03',950,-1808,30),(7902,'ForD','AnalyST',7566,'1981-12-03',3000,753.9,20),(7934,'MIller','Clerk',7782,'1982-01-23',1300,729,10);
obmysql-upper-1-5-2
select UPPER(e.empno)empno,UPPER(e.job)job,UPPER(e.ename)ename,UPPER(e.sal)sal from t1 e order by e.empno;
empno	job	ename	sal
7369	CLERK	SMITH	800.00
7499	SALESMAN	ALLEN	1600.00
7521	SALESMAN	WARD	1250.00
7566	MANAGER	JONES	2975.00
7654	SALESMAN	MARTIN	1250.00
7698	MANAGER	BLAKE	2850.00
7782	MANAGER	CLARK	2450.00
7788	ANALYST	SCOTT	3000.00
7839	PRESIDENT	KING	5000.00
7844	SALESMAN	TURNER	1500.00
7876	CLERK	ADAMS	1100.00
7900	CLERK	JAMES	950.00
7902	ANALYST	FORD	3000.00
7934	CLERK	MILLER	1300.00
select * from t1 e where UPPER(e.job) = 'CLERK' and UPPER(e.ename) = 'SMITH' order by e.empno;
EMPNO	ENAME	JOB	MGR	HIREDATE	SAL	COMM	DEPTNO
7369	Smith	Clerk	7902	1980-12-17	800.00	100.00	20
select * from t1 e where UPPER(e.job) = 'MANAGER' or UPPER(e.sal) > 3000 order by e.empno;
EMPNO	ENAME	JOB	MGR	HIREDATE	SAL	COMM	DEPTNO
7566	Jones	MaNaGer	7839	1981-04-02	2975.00	358.69	20
7698	Blake	ManaGer	7839	1981-05-01	2850.00	-2100.00	30
7782	Clark	ManaGer	7839	1981-06-09	2450.00	744.90	10
7839	King	PresiDent	NULL	1981-11-17	5000.00	-196.70	10
select SUM(UPPER(e.sal))sal,UPPER(e.ename)ename from t1 e where UPPER(e.job) = 'CLERK' group by UPPER(e.ename),empno order by e.empno;
sal	ename
1100	ADAMS
1300	MILLER
800	SMITH
950	JAMES
select LOWER(e.empno)empno,LOWER(e.job)job,LOWER(e.ename)ename,LOWER(e.sal)sal from t1 e order by e.empno;
empno	job	ename	sal
7369	clerk	smith	800.00
7499	salesman	allen	1600.00
7521	salesman	ward	1250.00
7566	manager	jones	2975.00
7654	salesman	martin	1250.00
7698	manager	blake	2850.00
7782	manager	clark	2450.00
7788	analyst	scott	3000.00
7839	president	king	5000.00
7844	salesman	turner	1500.00
7876	clerk	adams	1100.00
7900	clerk	james	950.00
7902	analyst	ford	3000.00
7934	clerk	miller	1300.00
select * from t1 e where LOWER(e.job) = 'clerk' and LOWER(e.ename) = 'smith' order by e.empno;
EMPNO	ENAME	JOB	MGR	HIREDATE	SAL	COMM	DEPTNO
7369	Smith	Clerk	7902	1980-12-17	800.00	100.00	20
select * from t1 e where LOWER(e.job) = 'manager' or LOWER(e.sal) > 3000 order by e.empno;
EMPNO	ENAME	JOB	MGR	HIREDATE	SAL	COMM	DEPTNO
7566	Jones	MaNaGer	7839	1981-04-02	2975.00	358.69	20
7698	Blake	ManaGer	7839	1981-05-01	2850.00	-2100.00	30
7782	Clark	ManaGer	7839	1981-06-09	2450.00	744.90	10
7839	King	PresiDent	NULL	1981-11-17	5000.00	-196.70	10
select SUM(LOWER(e.sal))sal,LOWER(e.ename)ename from t1 e where LOWER(e.job) = 'clerk' group by LOWER(e.ename),e.empno order by e.empno;
sal	ename
1100	adams
1300	miller
800	smith
950	james
insert into  t1 values(7999,UPPER('KoBe'),UPPER('Clerk'),7735,'1982-12-06',7300,500,20);
select COUNT(*)  from t1;
COUNT(*)
15
insert into t1 values(7949,LOWER('Kuli'),LOWER('Clerk'),7735,'1980-3-15',7300,500,20);
select COUNT(*)  from t1;
COUNT(*)
16
update t1 SET ename = UPPER('yM') where UPPER(ename) = 'KULI';
update t1 SET sal = UPPER('8599')  where sal = 2975;
update t1 SET job = UPPER('Athletes') where UPPER(job) = 'ANALYST';
update t1 SET empno = UPPER('7354')  where  UPPER(empno) = 7566;
select *  from t1;
EMPNO	ENAME	JOB	MGR	HIREDATE	SAL	COMM	DEPTNO
7354	Jones	MaNaGer	7839	1981-04-02	8599.00	358.69	20
7369	Smith	Clerk	7902	1980-12-17	800.00	100.00	20
7499	Allen	SaLesMan	7698	1981-02-20	1600.00	300.00	30
7521	WaRd	SaLeSman	7698	1981-02-22	1250.00	500.00	30
7654	MarTin	SaleSman	7698	1981-09-28	1250.00	1400.00	30
7698	Blake	ManaGer	7839	1981-05-01	2850.00	-2100.00	30
7782	Clark	ManaGer	7839	1981-06-09	2450.00	744.90	10
7788	ScotT	ATHLETES	7566	1987-04-13	3000.00	-200.00	20
7839	King	PresiDent	NULL	1981-11-17	5000.00	-196.70	10
7844	TurNeR	SaLeSmaN	7698	1981-09-08	1500.00	0.00	30
7876	Adams	ClerK	7788	1987-05-13	1100.00	-99.90	20
7900	JaMeS	CLerK	7698	1981-12-03	950.00	-1808.00	30
7902	ForD	ATHLETES	7566	1981-12-03	3000.00	753.90	20
7934	MIller	Clerk	7782	1982-01-23	1300.00	729.00	10
7949	YM	clerk	7735	1980-03-15	7300.00	500.00	20
7999	KOBE	CLERK	7735	1982-12-06	7300.00	500.00	20
update t1 SET ename = LOWER('Ow') where LOWER(ename) = 'kobe';
update t1 SET sal = LOWER('3075')  where sal = 1250;
update t1 SET job = LOWER('Athletes') where LOWER(job) = 'clerk';
update t1 SET empno = LOWER('7254')  where LOWER(empno) = 7499;
select *  from t1;
EMPNO	ENAME	JOB	MGR	HIREDATE	SAL	COMM	DEPTNO
7254	Allen	SaLesMan	7698	1981-02-20	1600.00	300.00	30
7354	Jones	MaNaGer	7839	1981-04-02	8599.00	358.69	20
7369	Smith	athletes	7902	1980-12-17	800.00	100.00	20
7521	WaRd	SaLeSman	7698	1981-02-22	3075.00	500.00	30
7654	MarTin	SaleSman	7698	1981-09-28	3075.00	1400.00	30
7698	Blake	ManaGer	7839	1981-05-01	2850.00	-2100.00	30
7782	Clark	ManaGer	7839	1981-06-09	2450.00	744.90	10
7788	ScotT	ATHLETES	7566	1987-04-13	3000.00	-200.00	20
7839	King	PresiDent	NULL	1981-11-17	5000.00	-196.70	10
7844	TurNeR	SaLeSmaN	7698	1981-09-08	1500.00	0.00	30
7876	Adams	athletes	7788	1987-05-13	1100.00	-99.90	20
7900	JaMeS	athletes	7698	1981-12-03	950.00	-1808.00	30
7902	ForD	ATHLETES	7566	1981-12-03	3000.00	753.90	20
7934	MIller	athletes	7782	1982-01-23	1300.00	729.00	10
7949	YM	athletes	7735	1980-03-15	7300.00	500.00	20
7999	ow	athletes	7735	1982-12-06	7300.00	500.00	20
delete from t1 where UPPER(ename) = 'SMITH';
delete from t1 where UPPER(sal) = 8599;
delete from t1 where UPPER(job) = 'ATHLETES';
delete from t1 where UPPER(empno) = 7254;
select COUNT(*)  from t1;
COUNT(*)
6
delete from t1 where LOWER(ename) = 'king';
delete from t1 where LOWER(sal) = 1500;
delete from t1 where LOWER(job) = 'salesman';
delete from t1 where LOWER(empno) = 7782;
select COUNT(*)  from t1;
COUNT(*)
1
drop table t1;
drop table t1;
create table t1(EMPNO decimal(4) primary key,ENAME VARCHAR(10),JOB VARCHAR(9),MGR decimal(4),HIREDATE DATE,SAL decimal(7,2),COMM decimal(7,2),DEPTNO decimal(2));
insert into t1 values(7369,'Smith','Clerk',7902,'1980-12-17',800,100,20),(7499,'Allen','SaLesMan',7698,'1981-02-20',1600,300,30),(7521,'WaRd','SaLeSman',7698,'1981-2-22',1250,500,30),(7566,'Jones','MaNaGer',7839,'1981-04-02',2975,358.69,20),
(7654,'MarTin','SaleSman',7698,'1981-09-28',1250,1400,30),(7698,'Blake','ManaGer',7839,'1981-05-01',2850,-2100,30),(7782,'Clark','ManaGer',7839,'1981-06-09',2450,744.9,10),(7788,'ScotT','AnalysT',7566,'1987-04-13',3000,-200,20),(7839,'King','PresiDent',NULL,'1981-11-17',5000,-196.7,10),
(7844,'TurNeR','SaLeSmaN',7698,'1981-09-08',1500,0,30),(7876,'Adams','ClerK',7788,'1987-05-13',1100,-99.9,20),(7900,'JaMeS','CLerK',7698,'1981-12-03',950,-1808,30),(7902,'ForD','AnalyST',7566,'1981-12-03',3000,753.9,20),(7934,'MIller','Clerk',7782,'1982-01-23',1300,729,10);
obmysql-upper-1-5-3
ALTER TABLE t1 ADD INDEX t1_index (sal,job,empno,ename);
select UPPER(e.empno)empno,UPPER(e.job)job,UPPER(e.ename)ename,UPPER(e.sal)sal from t1 e order by e.empno;
empno	job	ename	sal
7369	CLERK	SMITH	800.00
7499	SALESMAN	ALLEN	1600.00
7521	SALESMAN	WARD	1250.00
7566	MANAGER	JONES	2975.00
7654	SALESMAN	MARTIN	1250.00
7698	MANAGER	BLAKE	2850.00
7782	MANAGER	CLARK	2450.00
7788	ANALYST	SCOTT	3000.00
7839	PRESIDENT	KING	5000.00
7844	SALESMAN	TURNER	1500.00
7876	CLERK	ADAMS	1100.00
7900	CLERK	JAMES	950.00
7902	ANALYST	FORD	3000.00
7934	CLERK	MILLER	1300.00
select * from t1 e where UPPER(e.job) = 'CLERK' and UPPER(e.ename) = 'SMITH' order by e.empno;
EMPNO	ENAME	JOB	MGR	HIREDATE	SAL	COMM	DEPTNO
7369	Smith	Clerk	7902	1980-12-17	800.00	100.00	20
select * from t1 e where UPPER(e.job) = 'MANAGER' or UPPER(e.sal) > 3000 order by e.empno;
EMPNO	ENAME	JOB	MGR	HIREDATE	SAL	COMM	DEPTNO
7566	Jones	MaNaGer	7839	1981-04-02	2975.00	358.69	20
7698	Blake	ManaGer	7839	1981-05-01	2850.00	-2100.00	30
7782	Clark	ManaGer	7839	1981-06-09	2450.00	744.90	10
7839	King	PresiDent	NULL	1981-11-17	5000.00	-196.70	10
select SUM(UPPER(e.sal))sal,UPPER(e.ename)ename from t1 e where UPPER(e.job) = 'CLERK' group by UPPER(e.ename),e.empno order by e.empno;
sal	ename
1100	ADAMS
1300	MILLER
800	SMITH
950	JAMES
select LOWER(e.empno)empno,LOWER(e.job)job,LOWER(e.ename)ename,LOWER(e.sal)sal from t1 e order by e.empno;
empno	job	ename	sal
7369	clerk	smith	800.00
7499	salesman	allen	1600.00
7521	salesman	ward	1250.00
7566	manager	jones	2975.00
7654	salesman	martin	1250.00
7698	manager	blake	2850.00
7782	manager	clark	2450.00
7788	analyst	scott	3000.00
7839	president	king	5000.00
7844	salesman	turner	1500.00
7876	clerk	adams	1100.00
7900	clerk	james	950.00
7902	analyst	ford	3000.00
7934	clerk	miller	1300.00
select * from t1 e where LOWER(e.job) = 'clerk' and LOWER(e.ename) = 'smith' order by e.empno;
EMPNO	ENAME	JOB	MGR	HIREDATE	SAL	COMM	DEPTNO
7369	Smith	Clerk	7902	1980-12-17	800.00	100.00	20
select * from t1 e where LOWER(e.job) = 'manager' or LOWER(e.sal) > 3000 order by e.empno;
EMPNO	ENAME	JOB	MGR	HIREDATE	SAL	COMM	DEPTNO
7566	Jones	MaNaGer	7839	1981-04-02	2975.00	358.69	20
7698	Blake	ManaGer	7839	1981-05-01	2850.00	-2100.00	30
7782	Clark	ManaGer	7839	1981-06-09	2450.00	744.90	10
7839	King	PresiDent	NULL	1981-11-17	5000.00	-196.70	10
select SUM(LOWER(e.sal))sal,LOWER(e.ename)ename from t1 e where LOWER(e.job) = 'clerk' group by LOWER(e.ename),e.empno order by e.empno;
sal	ename
1100	adams
1300	miller
800	smith
950	james
insert into  t1 values(7999,UPPER('KoBe'),UPPER('Clerk'),7735,'1982-12-06',7300,500,20);
select COUNT(*)  from t1;
COUNT(*)
15
insert into t1 values(7949,LOWER('Kuli'),LOWER('Clerk'),7735,'1980-3-15',7300,500,20);
select COUNT(*)  from t1;
COUNT(*)
16
update t1 SET ename = UPPER('yM') where UPPER(ename) = 'KULI';
update t1 SET sal = UPPER('8599')  where sal = 2975;
update t1 SET job = UPPER('Athletes') where UPPER(job) = 'ANALYST';
update t1 SET empno = UPPER('7354')  where  UPPER(empno) = 7566;
select *  from t1;
EMPNO	ENAME	JOB	MGR	HIREDATE	SAL	COMM	DEPTNO
7354	Jones	MaNaGer	7839	1981-04-02	8599.00	358.69	20
7369	Smith	Clerk	7902	1980-12-17	800.00	100.00	20
7499	Allen	SaLesMan	7698	1981-02-20	1600.00	300.00	30
7521	WaRd	SaLeSman	7698	1981-02-22	1250.00	500.00	30
7654	MarTin	SaleSman	7698	1981-09-28	1250.00	1400.00	30
7698	Blake	ManaGer	7839	1981-05-01	2850.00	-2100.00	30
7782	Clark	ManaGer	7839	1981-06-09	2450.00	744.90	10
7788	ScotT	ATHLETES	7566	1987-04-13	3000.00	-200.00	20
7839	King	PresiDent	NULL	1981-11-17	5000.00	-196.70	10
7844	TurNeR	SaLeSmaN	7698	1981-09-08	1500.00	0.00	30
7876	Adams	ClerK	7788	1987-05-13	1100.00	-99.90	20
7900	JaMeS	CLerK	7698	1981-12-03	950.00	-1808.00	30
7902	ForD	ATHLETES	7566	1981-12-03	3000.00	753.90	20
7934	MIller	Clerk	7782	1982-01-23	1300.00	729.00	10
7949	YM	clerk	7735	1980-03-15	7300.00	500.00	20
7999	KOBE	CLERK	7735	1982-12-06	7300.00	500.00	20
update t1 SET ename = LOWER('Ow') where LOWER(ename) = 'kobe';
update t1 SET sal = LOWER('3075')  where sal = 1250;
update t1 SET job = LOWER('Athletes') where LOWER(job) = 'clerk';
update t1 SET empno = LOWER('7254')  where LOWER(empno) = 7499;
select *  from t1;
EMPNO	ENAME	JOB	MGR	HIREDATE	SAL	COMM	DEPTNO
7254	Allen	SaLesMan	7698	1981-02-20	1600.00	300.00	30
7354	Jones	MaNaGer	7839	1981-04-02	8599.00	358.69	20
7369	Smith	athletes	7902	1980-12-17	800.00	100.00	20
7521	WaRd	SaLeSman	7698	1981-02-22	3075.00	500.00	30
7654	MarTin	SaleSman	7698	1981-09-28	3075.00	1400.00	30
7698	Blake	ManaGer	7839	1981-05-01	2850.00	-2100.00	30
7782	Clark	ManaGer	7839	1981-06-09	2450.00	744.90	10
7788	ScotT	ATHLETES	7566	1987-04-13	3000.00	-200.00	20
7839	King	PresiDent	NULL	1981-11-17	5000.00	-196.70	10
7844	TurNeR	SaLeSmaN	7698	1981-09-08	1500.00	0.00	30
7876	Adams	athletes	7788	1987-05-13	1100.00	-99.90	20
7900	JaMeS	athletes	7698	1981-12-03	950.00	-1808.00	30
7902	ForD	ATHLETES	7566	1981-12-03	3000.00	753.90	20
7934	MIller	athletes	7782	1982-01-23	1300.00	729.00	10
7949	YM	athletes	7735	1980-03-15	7300.00	500.00	20
7999	ow	athletes	7735	1982-12-06	7300.00	500.00	20
delete from t1 where UPPER(ename) = 'SMITH';
delete from t1 where UPPER(sal) = 8599;
delete from t1 where UPPER(job) = 'ATHLETES';
delete from t1 where UPPER(empno) = 7254;
select COUNT(*)  from t1;
COUNT(*)
6
delete from t1 where LOWER(ename) = 'king';
delete from t1 where LOWER(sal) = 1500;
delete from t1 where LOWER(job) = 'salesman';
delete from t1 where LOWER(empno) = 7782;
select COUNT(*)  from t1;
COUNT(*)
1
drop table t1;
# Clean up users
drop user longpy@'%' ;
