result_format: 4
create external table ex_t1 (
id NUMBER  as (metadata$filecol1),
name varchar(50) as (metadata$filecol2),
mon VARCHAR(50) as (metadata$filecol3),
age VARCHAR(50) as (metadata$filecol4),
tel_number VARCHAR(50) as (metadata$filecol5),
bir date as (metadata$filecol6)
)
location='#OSS_HOST#:#OSS_ACCESS_ID#@#OSS_ACCESS_KEY#/antsys-antsys-oceanbase-rd-sql/jim.wjh/mysqltest_regression_data/zhch_external_table_data/basic_data/'
format (
    type = 'csv'
	FIELD_DELIMITER = ','
	FIELD_OPTIONALLY_ENCLOSED_BY = char(34)
	ENCODING = 'UTF8MB4'
	EMPTY_FIELD_AS_NULL = true
)
PATTERN = 'test05.csv';
select * from ex_t1;
+------+------+----------+------+-------------+------------+
| id   | name | mon      | age  | tel_number  | bir        |
+------+------+----------+------+-------------+------------+
| NULL | NULL | NULL     | NULL | NULL        | NULL       |
|    1 | wxm  | 3500.00  | 25   | 13000000000 | 1990-01-01 |
|    2 | ldp  | 3000.01  | 30   | 13000000001 | 1991-02-02 |
|    3 | zhx  | 6000.05  | 28   | 13000000002 | 1992-03-03 |
| NULL | NULL | NULL     | NULL | NULL        | NULL       |
|    4 | zff  | 4500.123 | 35   | 13000000003 | 1993-04-04 |
|    5 | dyl  | -4000    | 40   | 13000000004 | 1994-05-05 |
+------+------+----------+------+-------------+------------+
CREATE TABLE T1 AS SELECT ID,NAME,MON FROM EX_T1;
SELECT * FROM T1;
+------+------+----------+
| ID   | NAME | MON      |
+------+------+----------+
| NULL | NULL | NULL     |
|    1 | wxm  | 3500.00  |
|    2 | ldp  | 3000.01  |
|    3 | zhx  | 6000.05  |
| NULL | NULL | NULL     |
|    4 | zff  | 4500.123 |
|    5 | dyl  | -4000    |
+------+------+----------+
##PL内查表##
DROP PROCEDURE IF EXISTS EX_PRO;
CREATE PROCEDURE EX_PRO()
BEGIN
  SELECT * FROM EX_T1;
END
//
CALL EX_PRO();
+------+------+----------+------+-------------+------------+
| id   | name | mon      | age  | tel_number  | bir        |
+------+------+----------+------+-------------+------------+
| NULL | NULL | NULL     | NULL | NULL        | NULL       |
|    1 | wxm  | 3500.00  | 25   | 13000000000 | 1990-01-01 |
|    2 | ldp  | 3000.01  | 30   | 13000000001 | 1991-02-02 |
|    3 | zhx  | 6000.05  | 28   | 13000000002 | 1992-03-03 |
| NULL | NULL | NULL     | NULL | NULL        | NULL       |
|    4 | zff  | 4500.123 | 35   | 13000000003 | 1993-04-04 |
|    5 | dyl  | -4000    | 40   | 13000000004 | 1994-05-05 |
+------+------+----------+------+-------------+------------+
DROP PROCEDURE IF EXISTS EX_PRO;
CREATE PROCEDURE EX_PRO(IN TABLE_NAME VARCHAR(50))
BEGIN
  SET @SQL = CONCAT('SELECT * FROM ',TABLE_NAME);
  PREPARE stmt FROM @sql;
  EXECUTE stmt;
  DEALLOCATE PREPARE stmt;
END
//
CALL EX_PRO('EX_T1');
+------+------+----------+------+-------------+------------+
| id   | name | mon      | age  | tel_number  | bir        |
+------+------+----------+------+-------------+------------+
| NULL | NULL | NULL     | NULL | NULL        | NULL       |
|    1 | wxm  | 3500.00  | 25   | 13000000000 | 1990-01-01 |
|    2 | ldp  | 3000.01  | 30   | 13000000001 | 1991-02-02 |
|    3 | zhx  | 6000.05  | 28   | 13000000002 | 1992-03-03 |
| NULL | NULL | NULL     | NULL | NULL        | NULL       |
|    4 | zff  | 4500.123 | 35   | 13000000003 | 1993-04-04 |
|    5 | dyl  | -4000    | 40   | 13000000004 | 1994-05-05 |
+------+------+----------+------+-------------+------------+
DROP FUNCTION IF EXISTS EX_FUN;
CREATE FUNCTION EX_FUN() RETURNS VARCHAR(10)
BEGIN
  DECLARE A VARCHAR(10);
  SELECT  NAME INTO A FROM EX_T1 WHERE ID = 1;
  RETURN A;
END
//
SELECT EX_FUN();
+----------+
| EX_FUN() |
+----------+
| wxm      |
+----------+
##PREPARE##
DROP TABLE IF EXISTS EX_T1;
PREPARE STMT1 FROM 'create external table EX_T1 (
id NUMBER  as (metadata$filecol1),
name varchar(50) as (metadata$filecol2),
mon VARCHAR(50) as (metadata$filecol3),
age VARCHAR(50) as (metadata$filecol4),
tel_number VARCHAR(50) as (metadata$filecol5),
bir date as (metadata$filecol6)
)
location=\'#OSS_HOST#:#OSS_ACCESS_ID#@#OSS_ACCESS_KEY#/antsys-antsys-oceanbase-rd-sql/jim.wjh/mysqltest_regression_data/zhch_external_table_data/basic_data/\'
format (
    type = \'csv\'
	FIELD_DELIMITER = \',\'
	FIELD_OPTIONALLY_ENCLOSED_BY = char(34)
	ENCODING = \'UTF8MB4\'
	EMPTY_FIELD_AS_NULL = true
)
PATTERN = \'test05.csv\'';
EXECUTE STMT1 ;
DEALLOCATE PREPARE STMT1;
PREPARE STMT2 FROM 'SELECT * FROM EX_T1 WHERE ID = ?';
SET @A = 2;
EXECUTE STMT2 USING @A ;
+------+------+---------+------+-------------+------------+
| id   | name | mon     | age  | tel_number  | bir        |
+------+------+---------+------+-------------+------------+
|    2 | ldp  | 3000.01 | 30   | 13000000001 | 1991-02-02 |
+------+------+---------+------+-------------+------------+
DEALLOCATE PREPARE STMT2;
PREPARE STMT1 FROM 'CREATE INDEX IN_A ON EX_T1(ID)';
ERROR 0A000: operation on external table not supported
PREPARE STMT1 FROM 'INSERT INTO EX_T1(ID) VALUES(6) ';
ERROR 0A000: insert into external table with values, replace, ignore, returning, update not supported
PREPARE STMT1 FROM 'ALTER TABLE EX_T1 ADD SEX VARCHAR(10)';
ERROR 0A000: alter table type not supported
##pl内对外表进行ddl，dml##
##DDL##
DROP PROCEDURE IF EXISTS EX_PRO;
CREATE PROCEDURE EX_PRO()
BEGIN
  DROP TABLE IF EXISTS EX_T1;
  create external table ex_t1 (
  id NUMBER  as (metadata$filecol1),
  name varchar(50) as (metadata$filecol2),
  mon VARCHAR(50) as (metadata$filecol3),
  age VARCHAR(50) as (metadata$filecol4),
  tel_number VARCHAR(50) as (metadata$filecol5),
  bir date as (metadata$filecol6)
  )
  location='#OSS_HOST#:#OSS_ACCESS_ID#@#OSS_ACCESS_KEY#/antsys-antsys-oceanbase-rd-sql/jim.wjh/mysqltest_regression_data/zhch_external_table_data/basic_data/'
  format (
    type = 'csv'
	FIELD_DELIMITER = ','
	FIELD_OPTIONALLY_ENCLOSED_BY = char(34)
	ENCODING = 'UTF8MB4'
	EMPTY_FIELD_AS_NULL = true
  )
  PATTERN = 'test05.csv';
END
//
ERROR 42000: You have an error in your SQL syntax; check the manual that corresponds to your OceanBase version for the right syntax to use near 'external' at line 4
DROP PROCEDURE IF EXISTS EX_PRO;
CREATE PROCEDURE EX_PRO()
BEGIN
  DROP TABLE IF EXISTS EX_T1;
  PREPARE STMT1 FROM 'create external table EX_T1 (
id NUMBER  as (metadata$filecol1),
name varchar(50) as (metadata$filecol2),
mon VARCHAR(50) as (metadata$filecol3),
age VARCHAR(50) as (metadata$filecol4),
tel_number VARCHAR(50) as (metadata$filecol5),
bir date as (metadata$filecol6)
)
location=\'#OSS_HOST#:#OSS_ACCESS_ID#@#OSS_ACCESS_KEY#/antsys-antsys-oceanbase-rd-sql/jim.wjh/mysqltest_regression_data/zhch_external_table_data/basic_data/\'
format (
    type = \'csv\'
	FIELD_DELIMITER = \',\'
	FIELD_OPTIONALLY_ENCLOSED_BY = char(34)
	ENCODING = \'UTF8MB4\'
	EMPTY_FIELD_AS_NULL = true
)
PATTERN = \'test05.csv\'';
EXECUTE STMT1 ;
DEALLOCATE PREPARE STMT1;
END
//
CALL EX_PRO();
DROP PROCEDURE IF EXISTS EX_PRO;
CREATE PROCEDURE EX_PRO()
BEGIN
  CREATE INDEX IN_A ON EX_T1(ID);
END
//
CALL EX_PRO();
ERROR 0A000: operation on external table not supported
DROP PROCEDURE IF EXISTS EX_PRO;
CREATE PROCEDURE EX_PRO()
BEGIN
  ALTER TABLE EX_T1 ADD SEX VARCHAR(10);
END
//
CALL EX_PRO();
ERROR 0A000: alter table type not supported
##DML##
DROP PROCEDURE IF EXISTS EX_PRO;
CREATE PROCEDURE EX_PRO()
BEGIN
  DECLARE V_ID INT DEFAULT 6;
  INSERT INTO EX_T1(ID) VALUES (V_ID);
END
//
CALL EX_PRO();
ERROR 0A000: insert into external table with values, replace, ignore, returning, update not supported
DROP PROCEDURE IF EXISTS EX_PRO;
CREATE PROCEDURE EX_PRO()
BEGIN
  UPDATE EX_T1 SET ID = 6;
END
//
CALL EX_PRO();
ERROR HY000: The value specified for generated column 'id' in table 'ex_t1' is not allowed
DROP PROCEDURE IF EXISTS EX_PRO;
CREATE PROCEDURE EX_PRO()
BEGIN
  DELETE FROM EX_T1;
END
//
CALL EX_PRO();
ERROR 0A000: DML operation on External Table not supported
DROP PROCEDURE IF EXISTS EX_PRO;
##CURSOR##
DROP PROCEDURE IF EXISTS EX_PRO;
CREATE PROCEDURE EX_PRO()
BEGIN
  DECLARE DONE INT DEFAULT FALSE;
  DECLARE cur_name varchar(20);
  DECLARE ex_cur CURSOR FOR SELECT name FROM EX_T1;
  DECLARE CONTINUE HANDLER FOR NOT FOUND SET DONE = TRUE;
  OPEN ex_cur;
  READ_LOOP:LOOP
   IF DONE THEN
    LEAVE READ_LOOP;
   END IF;
   FETCH ex_cur INTO cur_name;
   SELECT cur_name;
  END LOOP;
  CLOSE EX_CUR;
END
//
CALL EX_PRO();
+----------+
| cur_name |
+----------+
+----------+
| cur_name |
+----------+
+----------+
| cur_name |
+----------+
+----------+
| cur_name |
+----------+
+----------+
| cur_name |
+----------+
+----------+
| cur_name |
+----------+
+----------+
| cur_name |
+----------+
+----------+
| cur_name |
+----------+
| NULL     |
| wxm      |
| ldp      |
| zhx      |
| NULL     |
| zff      |
| dyl      |
| dyl      |
+----------+
+----------+
+----------+
+----------+
+----------+
+----------+
+----------+
+----------+
##TRIGGER##
CREATE TRIGGER EX_TRI AFTER INSERT ON T1 FOR EACH ROW
BEGIN
	INSERT INTO EX_T1(ID) VALUES(NEW.ID);
END;
//
INSERT INTO T1(ID) VALUES (6);
ERROR 0A000: insert into external table with values, replace, ignore, returning, update not supported
DROP TRIGGER IF EXISTS EX_TRI;
CREATE TRIGGER EX_TRI BEFORE INSERT ON T1 FOR EACH ROW
BEGIN
	DELETE FROM EX_T1;
END;
//
INSERT INTO T1(ID) VALUES (6);
ERROR 0A000: DML operation on External Table not supported
DROP TRIGGER IF EXISTS EX_TRI;
CREATE TRIGGER EX_TRI BEFORE INSERT ON EX_T1 FOR EACH ROW
BEGIN
	DELETE FROM T1;
END;
//
ERROR 0A000: simple dml trigger isn't used on user table not supported
CREATE TRIGGER EX_TRI AFTER INSERT ON EX_T1 FOR EACH ROW
BEGIN
	DELETE FROM T1;
END;
//
ERROR 0A000: simple dml trigger isn't used on user table not supported
CREATE TRIGGER EX_TRI BEFORE UPDATE ON EX_T1 FOR EACH ROW
BEGIN
	DELETE FROM T1;
END;
//
ERROR 0A000: simple dml trigger isn't used on user table not supported
CREATE TRIGGER EX_TRI AFTER UPDATE ON EX_T1 FOR EACH ROW
BEGIN
	DELETE FROM T1;
END;
//
ERROR 0A000: simple dml trigger isn't used on user table not supported
CREATE TRIGGER EX_TRI AFTER DELETE ON EX_T1 FOR EACH ROW
BEGIN
	DELETE FROM T1;
END;
//
ERROR 0A000: simple dml trigger isn't used on user table not supported
