create sequence s1 start with 1 increment by 1 cache 30;
create sequence s2 start with 4;
create table t1 (i int primary key, j int);
create table t2 (i int primary key, j int);
insert into t2 values (999, 0);
insert into t2 values (1000, 1);
insert into t2 values (1001, 2);
insert into t1 values (s1.nextval, s1.nextval);
insert into t1 values (s1.nextval, s2.nextval);
insert into t1 (i, j)  select s1.currval, s1.nextval from t2;
insert into t1 (i, j)  select s1.nextval, s1.currval from t2;
insert into t1 (i, j)  select s1.nextval, i from t2;
select * from t1;
I	J
1	1
2	4
31	31
32	32
33	33
34	34
35	35
36	36
37	999
38	1000
39	1001
update t1 set j = s1.nextval where i > 0;
select * from t1;
I	J
1	3
2	4
31	5
32	6
33	7
34	8
35	9
36	10
37	11
38	12
39	13
insert into t1 (i, j)  select s1.currval, s1.currval from dual;
insert into t1 (i, j)  select s1.currval, s1.currval from dual;
Got one of the listed errors
by design, remote execute session has no curval to get
insert into t1 (i, j)  select s1.currval, i from t2;
Got one of the listed errors
