result_format: 4
drop database if exists global_index;
affected rows: 0
create database global_index;
affected rows: 1
use global_index;
affected rows: 0


create table das_t1(a int primary key, b int, c int) partition by hash(a) partitions 1;
affected rows: 0
create index idx on das_t1(b) global;
affected rows: 0
insert into das_t1 values(1, 1, 1);
affected rows: 1
select * from das_t1;
+---+------+------+
| a | b    | c    |
+---+------+------+
| 1 |    1 |    1 |
+---+------+------+
affected rows: 1
update das_t1 set b=2 where a=1;
affected rows: 1
info: Rows matched: 1  Changed: 1  Warnings: 0
select * from das_t1;
+---+------+------+
| a | b    | c    |
+---+------+------+
| 1 |    2 |    1 |
+---+------+------+
affected rows: 1
update das_t1 set a=2 where a=1;
affected rows: 1
info: Rows matched: 1  Changed: 1  Warnings: 0
select * from das_t1;
+---+------+------+
| a | b    | c    |
+---+------+------+
| 2 |    2 |    1 |
+---+------+------+
affected rows: 1
delete from das_t1 where a=2;
affected rows: 1
select * from das_t1;
+---+------+------+
| a | b    | c    |
+---+------+------+
+---+------+------+
affected rows: 0
insert into das_t1 values(1, 1, 1);
affected rows: 1
affected rows: 0
select /*+index(das_t1 idx)*/ * from das_t1 where b=1;
+---+------+------+
| a | b    | c    |
+---+------+------+
| 1 |    1 |    1 |
+---+------+------+
affected rows: 1
drop table das_t1;
affected rows: 0

create table das_t1(a int primary key, b int, c int) partition by hash(a) partitions 2;
affected rows: 0
create unique index idx on das_t1(b) global;
affected rows: 0
insert into das_t1 values(1, 1, 1);
affected rows: 1
insert into das_t1 values(2, 1, 1);
ERROR 23000: Duplicate entry '1' for key 'idx'
insert into das_t1 values(2, 2, 1);
affected rows: 1
update das_t1 set b=1 where a=2;
ERROR 23000: Duplicate entry '1' for key 'idx'
update das_t1 set a=3 where a=2;
affected rows: 1
info: Rows matched: 1  Changed: 1  Warnings: 0
update das_t1 set b=3 where a=3;
affected rows: 1
info: Rows matched: 1  Changed: 1  Warnings: 0
select * from das_t1 partition(p0);
+---+------+------+
| a | b    | c    |
+---+------+------+
+---+------+------+
affected rows: 0
select * from das_t1 partition(p1);
+---+------+------+
| a | b    | c    |
+---+------+------+
| 1 |    1 |    1 |
| 3 |    3 |    1 |
+---+------+------+
affected rows: 2
delete from das_t1 where a=3;
affected rows: 1
select * from das_t1 where a=3;
+---+------+------+
| a | b    | c    |
+---+------+------+
+---+------+------+
affected rows: 0
select * from das_t1 where b=3;
+---+------+------+
| a | b    | c    |
+---+------+------+
+---+------+------+
affected rows: 0
drop table das_t1;
affected rows: 0

explain_protocol: 1
create table t1(a int primary key, b int, c int) partition by hash(a) partitions 4;
affected rows: 0
EXPLAIN BASIC insert into t1 values(1, 1, 1), (2, 2, 2), (3, 3, 3), (4, 4, 4);
Query Plan
============================
|ID|OPERATOR          |NAME|
----------------------------
|0 |DISTRIBUTED INSERT|    |
|1 |└─EXPRESSION      |    |
============================
Outputs & filters:
-------------------------------------
  0 - output(nil), filter(nil)
      columns([{t1: ({t1: (t1.a, t1.b, t1.c)})}]), 
      column_values([column_conv(INT,PS:(11,0),NOT NULL,__values.a)], [column_conv(INT,PS:(11,0),NULL,__values.b)], [column_conv(INT,PS:(11,0),NULL,__values.c)])
  1 - output([__values.a], [__values.b], [__values.c]), filter(nil)
      values({1, 1, 1}, {2, 2, 2}, {3, 3, 3}, {4, 4, 4})
affected rows: 13
insert into t1 values(1, 1, 1), (2, 2, 2), (3, 3, 3), (4, 4, 4);
affected rows: 4
info: Records: 4  Duplicates: 0  Warnings: 0
create index i1 on t1(b) global partition by hash(b) partitions 4;
affected rows: 0
EXPLAIN BASIC select /*+index(t1 i1)*/ * from t1;
Query Plan
=======================================
|ID|OPERATOR                   |NAME  |
---------------------------------------
|0 |DISTRIBUTED TABLE FULL SCAN|t1(i1)|
=======================================
Outputs & filters:
-------------------------------------
  0 - output([t1.a], [t1.b], [t1.c]), filter(nil), rowset=16
      access([t1.a], [t1.b], [t1.c]), partitions(p[0-3])
      is_index_back=true, is_global_index=true, 
      range_key([t1.b], [t1.a]), range(MIN,MIN ; MAX,MAX)always true
affected rows: 11
select /*+index(t1 i1)*/ * from t1;
+---+------+------+
| a | b    | c    |
+---+------+------+
| 1 |    1 |    1 |
| 2 |    2 |    2 |
| 3 |    3 |    3 |
| 4 |    4 |    4 |
+---+------+------+
affected rows: 4
EXPLAIN BASIC select /*+index(t1 i1)*/ * from t1 where a=1;
Query Plan
=======================================
|ID|OPERATOR                   |NAME  |
---------------------------------------
|0 |DISTRIBUTED TABLE FULL SCAN|t1(i1)|
=======================================
Outputs & filters:
-------------------------------------
  0 - output([t1.a], [t1.b], [t1.c]), filter([t1.a = 1]), rowset=16
      access([t1.a], [t1.b], [t1.c]), partitions(p[0-3])
      is_index_back=true, is_global_index=true, filter_before_indexback[true], 
      range_key([t1.b], [t1.a]), range(MIN,MIN ; MAX,MAX)always true
affected rows: 11
select /*+index(t1 i1)*/ * from t1 where a=1;
+---+------+------+
| a | b    | c    |
+---+------+------+
| 1 |    1 |    1 |
+---+------+------+
affected rows: 1
EXPLAIN BASIC select /*+index(t1 i1)*/ * from t1 where a=2;
Query Plan
=======================================
|ID|OPERATOR                   |NAME  |
---------------------------------------
|0 |DISTRIBUTED TABLE FULL SCAN|t1(i1)|
=======================================
Outputs & filters:
-------------------------------------
  0 - output([t1.a], [t1.b], [t1.c]), filter([t1.a = 2]), rowset=16
      access([t1.a], [t1.b], [t1.c]), partitions(p[0-3])
      is_index_back=true, is_global_index=true, filter_before_indexback[true], 
      range_key([t1.b], [t1.a]), range(MIN,MIN ; MAX,MAX)always true
affected rows: 11
select /*+index(t1 i1)*/ * from t1 where a=2;
+---+------+------+
| a | b    | c    |
+---+------+------+
| 2 |    2 |    2 |
+---+------+------+
affected rows: 1
EXPLAIN BASIC select /*+index(t1 i1)*/ * from t1 where a>=2 and a<=3;
Query Plan
=======================================
|ID|OPERATOR                   |NAME  |
---------------------------------------
|0 |DISTRIBUTED TABLE FULL SCAN|t1(i1)|
=======================================
Outputs & filters:
-------------------------------------
  0 - output([t1.a], [t1.b], [t1.c]), filter([t1.a >= 2], [t1.a <= 3]), rowset=16
      access([t1.a], [t1.b], [t1.c]), partitions(p[0-3])
      is_index_back=true, is_global_index=true, filter_before_indexback[true,true], 
      range_key([t1.b], [t1.a]), range(MIN,MIN ; MAX,MAX)always true
affected rows: 11
select /*+index(t1 i1)*/ * from t1 where a>=2 and a<=3;
+---+------+------+
| a | b    | c    |
+---+------+------+
| 2 |    2 |    2 |
| 3 |    3 |    3 |
+---+------+------+
affected rows: 2
EXPLAIN BASIC select /*+index(t1 i1)*/ * from t1 where a>4;
Query Plan
=======================================
|ID|OPERATOR                   |NAME  |
---------------------------------------
|0 |DISTRIBUTED TABLE FULL SCAN|t1(i1)|
=======================================
Outputs & filters:
-------------------------------------
  0 - output([t1.a], [t1.b], [t1.c]), filter([t1.a > 4]), rowset=16
      access([t1.a], [t1.b], [t1.c]), partitions(p[0-3])
      is_index_back=true, is_global_index=true, filter_before_indexback[true], 
      range_key([t1.b], [t1.a]), range(MIN,MIN ; MAX,MAX)always true
affected rows: 11
select /*+index(t1 i1)*/ * from t1 where a>4;
+---+------+------+
| a | b    | c    |
+---+------+------+
+---+------+------+
affected rows: 0
EXPLAIN BASIC select /*+index(t1 i1)*/ * from t1 where b=1;
Query Plan
========================================
|ID|OPERATOR                    |NAME  |
----------------------------------------
|0 |DISTRIBUTED TABLE RANGE SCAN|t1(i1)|
========================================
Outputs & filters:
-------------------------------------
  0 - output([t1.a], [t1.b], [t1.c]), filter(nil), rowset=16
      access([t1.a], [t1.b], [t1.c]), partitions(p1)
      is_index_back=true, is_global_index=true, 
      range_key([t1.b], [t1.a]), range(1,MIN ; 1,MAX), 
      range_cond([t1.b = 1])
affected rows: 12
select /*+index(t1 i1)*/ * from t1 where b=1;
+---+------+------+
| a | b    | c    |
+---+------+------+
| 1 |    1 |    1 |
+---+------+------+
affected rows: 1
EXPLAIN BASIC select /*+index(t1 i1)*/ * from t1 where b in (1, 2, 3);
Query Plan
========================================
|ID|OPERATOR                    |NAME  |
----------------------------------------
|0 |DISTRIBUTED TABLE RANGE SCAN|t1(i1)|
========================================
Outputs & filters:
-------------------------------------
  0 - output([t1.a], [t1.b], [t1.c]), filter(nil), rowset=16
      access([t1.a], [t1.b], [t1.c]), partitions(p[1-3])
      is_index_back=true, is_global_index=true, 
      range_key([t1.b], [t1.a]), range(1,MIN ; 1,MAX), (2,MIN ; 2,MAX), (3,MIN ; 3,MAX), 
      range_cond([t1.b IN (1, 2, 3)])
affected rows: 12
select /*+index(t1 i1)*/ * from t1 where b in (1, 2, 3);
+---+------+------+
| a | b    | c    |
+---+------+------+
| 1 |    1 |    1 |
| 2 |    2 |    2 |
| 3 |    3 |    3 |
+---+------+------+
affected rows: 3
EXPLAIN BASIC select /*+index(t1 i1)*/ * from t1 where b>=2 and b<=3;
Query Plan
========================================
|ID|OPERATOR                    |NAME  |
----------------------------------------
|0 |DISTRIBUTED TABLE RANGE SCAN|t1(i1)|
========================================
Outputs & filters:
-------------------------------------
  0 - output([t1.a], [t1.b], [t1.c]), filter(nil), rowset=16
      access([t1.a], [t1.b], [t1.c]), partitions(p[2-3])
      is_index_back=true, is_global_index=true, 
      range_key([t1.b], [t1.a]), range(2,MIN ; 3,MAX), 
      range_cond([t1.b >= 2], [t1.b <= 3])
affected rows: 12
select /*+index(t1 i1)*/ * from t1 where b>=2 and b<=3;
+---+------+------+
| a | b    | c    |
+---+------+------+
| 2 |    2 |    2 |
| 3 |    3 |    3 |
+---+------+------+
affected rows: 2
drop table t1;
affected rows: 0

alter tenant sys set primary_zone='zone1';
affected rows: 0

create table t1(a int primary key, b int, c int) partition by hash(a) partitions 4;
affected rows: 0
create index i1 on t1(b) global partition by hash(b) partitions 4;
affected rows: 0
create table t2(a int primary key, b int, c int) partition by hash(a) partitions 2;
create index i1 on t2(b) global;

alter system set_tp tp_no = 301, error_code = 1, frequency = 1;
affected rows: 0
set session ob_query_timeout = 100000000;
affected rows: 0
EXPLAIN BASIC select /*+index(t1 i1), index(t2 i1), use_nl(t1 t2)*/ t1.* from t1 join t2 where t1.b>2 and t1.b<10000 and t1.b=t2.b order by t1.a limit 100;
Query Plan
============================================
|ID|OPERATOR                        |NAME  |
--------------------------------------------
|0 |TOP-N SORT                      |      |
|1 |└─NESTED-LOOP JOIN              |      |
|2 |  ├─TABLE RANGE SCAN            |t2(i1)|
|3 |  └─DISTRIBUTED TABLE RANGE SCAN|t1(i1)|
============================================
Outputs & filters:
-------------------------------------
  0 - output([t1.a], [t1.b], [t1.c]), filter(nil), rowset=256
      sort_keys([t1.a, ASC]), topn(100)
  1 - output([t1.a], [t1.b], [t1.c]), filter(nil), rowset=256
      conds(nil), nl_params_([t2.b(:0)]), use_batch=true
  2 - output([t2.b]), filter(nil), rowset=256
      access([t2.b]), partitions(p0)
      is_index_back=false, is_global_index=true, 
      range_key([t2.b], [t2.a]), range(2,MAX ; 10000,MIN), 
      range_cond([t2.b < 10000], [t2.b > 2])
  3 - output([t1.a], [t1.b], [t1.c]), filter(nil), rowset=256
      access([GROUP_ID], [t1.a], [t1.b], [t1.c]), partitions(p[0-3])
      is_index_back=true, is_global_index=true, 
      range_key([t1.b], [t1.a]), range(MIN ; MAX), 
      range_cond([t1.b = :0])
affected rows: 24
select /*+index(t1 i1), index(t2 i1), use_nl(t1 t2)*/ t1.* from t1 join t2 where t1.b>2 and t1.b<10000 and t1.b=t2.b order by t1.a limit 100;
+-----+------+------+
| a   | b    | c    |
+-----+------+------+
|   2 |    3 |    4 |
|   3 |    4 |    5 |
|   4 |    5 |    6 |
|   5 |    6 |    7 |
|   6 |    7 |    8 |
|   7 |    8 |    9 |
|   8 |    9 |   10 |
|   9 |   10 |   11 |
|  10 |   11 |   12 |
|  11 |   12 |   13 |
|  12 |   13 |   14 |
|  13 |   14 |   15 |
|  14 |   15 |   16 |
|  15 |   16 |   17 |
|  16 |   17 |   18 |
|  17 |   18 |   19 |
|  18 |   19 |   20 |
|  19 |   20 |   21 |
|  20 |   21 |   22 |
|  21 |   22 |   23 |
|  22 |   23 |   24 |
|  23 |   24 |   25 |
|  24 |   25 |   26 |
|  25 |   26 |   27 |
|  26 |   27 |   28 |
|  27 |   28 |   29 |
|  28 |   29 |   30 |
|  29 |   30 |   31 |
|  30 |   31 |   32 |
|  31 |   32 |   33 |
|  32 |   33 |   34 |
|  33 |   34 |   35 |
|  34 |   35 |   36 |
|  35 |   36 |   37 |
|  36 |   37 |   38 |
|  37 |   38 |   39 |
|  38 |   39 |   40 |
|  39 |   40 |   41 |
|  40 |   41 |   42 |
|  41 |   42 |   43 |
|  42 |   43 |   44 |
|  43 |   44 |   45 |
|  44 |   45 |   46 |
|  45 |   46 |   47 |
|  46 |   47 |   48 |
|  47 |   48 |   49 |
|  48 |   49 |   50 |
|  49 |   50 |   51 |
|  50 |   51 |   52 |
|  51 |   52 |   53 |
|  52 |   53 |   54 |
|  53 |   54 |   55 |
|  54 |   55 |   56 |
|  55 |   56 |   57 |
|  56 |   57 |   58 |
|  57 |   58 |   59 |
|  58 |   59 |   60 |
|  59 |   60 |   61 |
|  60 |   61 |   62 |
|  61 |   62 |   63 |
|  62 |   63 |   64 |
|  63 |   64 |   65 |
|  64 |   65 |   66 |
|  65 |   66 |   67 |
|  66 |   67 |   68 |
|  67 |   68 |   69 |
|  68 |   69 |   70 |
|  69 |   70 |   71 |
|  70 |   71 |   72 |
|  71 |   72 |   73 |
|  72 |   73 |   74 |
|  73 |   74 |   75 |
|  74 |   75 |   76 |
|  75 |   76 |   77 |
|  76 |   77 |   78 |
|  77 |   78 |   79 |
|  78 |   79 |   80 |
|  79 |   80 |   81 |
|  80 |   81 |   82 |
|  81 |   82 |   83 |
|  82 |   83 |   84 |
|  83 |   84 |   85 |
|  84 |   85 |   86 |
|  85 |   86 |   87 |
|  86 |   87 |   88 |
|  87 |   88 |   89 |
|  88 |   89 |   90 |
|  89 |   90 |   91 |
|  90 |   91 |   92 |
|  91 |   92 |   93 |
|  92 |   93 |   94 |
|  93 |   94 |   95 |
|  94 |   95 |   96 |
|  95 |   96 |   97 |
|  96 |   97 |   98 |
|  97 |   98 |   99 |
|  98 |   99 |  100 |
|  99 |  100 |  101 |
| 100 |  101 |  102 |
| 101 |  102 |  103 |
+-----+------+------+
affected rows: 100
alter system set_tp tp_no = 301, error_code = 0, frequency = 1;
affected rows: 0

EXPLAIN BASIC select /*+index(t1 i1), index(t2 i1), use_nl(t1 t2)*/ count(1) from t1 join t2 where t1.b>2 and t1.b<10000 and t1.b=t2.b;
Query Plan
============================================
|ID|OPERATOR                        |NAME  |
--------------------------------------------
|0 |SCALAR GROUP BY                 |      |
|1 |└─NESTED-LOOP JOIN              |      |
|2 |  ├─TABLE RANGE SCAN            |t2(i1)|
|3 |  └─DISTRIBUTED TABLE RANGE SCAN|t1(i1)|
============================================
Outputs & filters:
-------------------------------------
  0 - output([T_FUN_COUNT(*)]), filter(nil), rowset=256
      group(nil), agg_func([T_FUN_COUNT(*)])
  1 - output(nil), filter(nil), rowset=256
      conds(nil), nl_params_([t2.b(:0)]), use_batch=true
  2 - output([t2.b]), filter(nil), rowset=256
      access([t2.b]), partitions(p0)
      is_index_back=false, is_global_index=true, 
      range_key([t2.b], [t2.a]), range(2,MAX ; 10000,MIN), 
      range_cond([t2.b < 10000], [t2.b > 2])
  3 - output(nil), filter(nil), rowset=256
      access([GROUP_ID]), partitions(p[0-3])
      is_index_back=false, is_global_index=true, 
      range_key([t1.b], [t1.a]), range(MIN ; MAX), 
      range_cond([t1.b = :0])
affected rows: 24
select /*+index(t1 i1), index(t2 i1), use_nl(t1 t2)*/ count(1) from t1 join t2 where t1.b>2 and t1.b<10000 and t1.b=t2.b;
+----------+
| count(1) |
+----------+
|     9997 |
+----------+
affected rows: 1
EXPLAIN BASIC select /*+index(t1 i1), index(t2 i1), use_nl(t1 t2)*/ count(1) from t1 join t2 where t1.b>2 and t1.b<10000 and t1.b=t2.b;
Query Plan
============================================
|ID|OPERATOR                        |NAME  |
--------------------------------------------
|0 |SCALAR GROUP BY                 |      |
|1 |└─NESTED-LOOP JOIN              |      |
|2 |  ├─TABLE RANGE SCAN            |t2(i1)|
|3 |  └─DISTRIBUTED TABLE RANGE SCAN|t1(i1)|
============================================
Outputs & filters:
-------------------------------------
  0 - output([T_FUN_COUNT(*)]), filter(nil), rowset=256
      group(nil), agg_func([T_FUN_COUNT(*)])
  1 - output(nil), filter(nil), rowset=256
      conds(nil), nl_params_([t2.b(:0)]), use_batch=true
  2 - output([t2.b]), filter(nil), rowset=256
      access([t2.b]), partitions(p0)
      is_index_back=false, is_global_index=true, 
      range_key([t2.b], [t2.a]), range(2,MAX ; 10000,MIN), 
      range_cond([t2.b < 10000], [t2.b > 2])
  3 - output(nil), filter(nil), rowset=256
      access([GROUP_ID]), partitions(p[0-3])
      is_index_back=false, is_global_index=true, 
      range_key([t1.b], [t1.a]), range(MIN ; MAX), 
      range_cond([t1.b = :0])
affected rows: 24
select /*+index(t1 i1), index(t2 i1), use_nl(t1 t2)*/ count(1) from t1 join t2 where t1.b>2 and t1.b<10000 and t1.b=t2.b;
+----------+
| count(1) |
+----------+
|     9997 |
+----------+
affected rows: 1
SET _NLJ_BATCHING_ENABLED=false;
affected rows: 0
EXPLAIN BASIC select /*+index(t1 i1), index(t2 i1), use_nl(t1 t2)*/ t1.* from t1 join t2 where t1.b>2 and t1.b<10 and t1.b=t2.b order by t1.a;
Query Plan
=================================================
|ID|OPERATOR                           |NAME    |
-------------------------------------------------
|0 |PX COORDINATOR MERGE SORT          |        |
|1 |└─EXCHANGE OUT DISTR               |:EX10001|
|2 |  └─SORT                           |        |
|3 |    └─NESTED-LOOP JOIN             |        |
|4 |      ├─EXCHANGE IN DISTR          |        |
|5 |      │ └─EXCHANGE OUT DISTR (PKEY)|:EX10000|
|6 |      │   └─TABLE RANGE SCAN       |t2(i1)  |
|7 |      └─PX PARTITION ITERATOR      |        |
|8 |        └─TABLE RANGE SCAN         |t1(i1)  |
=================================================
Outputs & filters:
-------------------------------------
  0 - output([INTERNAL_FUNCTION(t1.a, t1.b, t1.c)]), filter(nil), rowset=16
      sort_keys([t1.a, ASC])
  1 - output([t1.a], [INTERNAL_FUNCTION(t1.a, t1.b, t1.c)]), filter(nil), rowset=16
      dop=1
  2 - output([t1.a], [t1.b], [t1.c]), filter(nil), rowset=16
      sort_keys([t1.a, ASC])
  3 - output([t1.a], [t1.b], [t1.c]), filter(nil), rowset=16
      conds(nil), nl_params_([t2.b(:0)]), use_batch=false
  4 - output([PARTITION_ID], [t2.b]), filter(nil), rowset=16
  5 - output([PARTITION_ID], [t2.b]), filter(nil), rowset=16
      (#keys=1, [t2.b]), is_single, dop=1
  6 - output([t2.b]), filter(nil), rowset=16
      access([t2.b]), partitions(p0)
      is_index_back=false, is_global_index=true, 
      range_key([t2.b], [t2.a]), range(2,MAX ; 10,MIN), 
      range_cond([t2.b < 10], [t2.b > 2])
  7 - output([t1.a], [t1.b], [t1.c]), filter(nil), rowset=16
      affinitize, force partition granule
  8 - output([t1.a], [t1.b], [t1.c]), filter(nil), rowset=16
      access([t1.a], [t1.b], [t1.c]), partitions(p[0-3])
      is_index_back=true, is_global_index=true, 
      range_key([t1.b], [t1.a]), range(MIN ; MAX), 
      range_cond([t1.b = :0])
affected rows: 38
select /*+index(t1 i1), index(t2 i1), use_nl(t1 t2)*/ t1.* from t1 join t2 where t1.b>2 and t1.b<10 and t1.b=t2.b order by t1.a;
+---+------+------+
| a | b    | c    |
+---+------+------+
| 2 |    3 |    4 |
| 3 |    4 |    5 |
| 4 |    5 |    6 |
| 5 |    6 |    7 |
| 6 |    7 |    8 |
| 7 |    8 |    9 |
| 8 |    9 |   10 |
+---+------+------+
affected rows: 7
SET _NLJ_BATCHING_ENABLED=true;
affected rows: 0
EXPLAIN BASIC select /*+index(t1 i1), index(t2 i1), use_nl(t1 t2)*/ * from t1 join t2 where t1.b>2 and t1.b<10000 and t1.b=t2.b order by t1.a, t2.a limit 100;
Query Plan
============================================
|ID|OPERATOR                        |NAME  |
--------------------------------------------
|0 |TOP-N SORT                      |      |
|1 |└─NESTED-LOOP JOIN              |      |
|2 |  ├─DISTRIBUTED TABLE RANGE SCAN|t2(i1)|
|3 |  └─DISTRIBUTED TABLE RANGE SCAN|t1(i1)|
============================================
Outputs & filters:
-------------------------------------
  0 - output([t1.a], [t1.b], [t1.c], [t2.a], [t2.b], [t2.c]), filter(nil), rowset=256
      sort_keys([t1.a, ASC], [t2.a, ASC]), topn(100)
  1 - output([t1.a], [t2.a], [t1.b], [t1.c], [t2.b], [t2.c]), filter(nil), rowset=256
      conds(nil), nl_params_([t2.b(:0)]), use_batch=true
  2 - output([t2.a], [t2.b], [t2.c]), filter(nil), rowset=256
      access([t2.a], [t2.b], [t2.c]), partitions(p0)
      is_index_back=true, is_global_index=true, 
      range_key([t2.b], [t2.a]), range(2,MAX ; 10000,MIN), 
      range_cond([t2.b < 10000], [t2.b > 2])
  3 - output([t1.a], [t1.b], [t1.c]), filter(nil), rowset=256
      access([GROUP_ID], [t1.a], [t1.b], [t1.c]), partitions(p[0-3])
      is_index_back=true, is_global_index=true, 
      range_key([t1.b], [t1.a]), range(MIN ; MAX), 
      range_cond([t1.b = :0])
affected rows: 24
select /*+index(t1 i1), index(t2 i1), use_nl(t1 t2)*/ * from t1 join t2 where t1.b>2 and t1.b<10000 and t1.b=t2.b order by t1.a, t2.a limit 100;
+-----+------+------+-----+------+------+
| a   | b    | c    | a   | b    | c    |
+-----+------+------+-----+------+------+
|   2 |    3 |    4 |   2 |    3 |    4 |
|   3 |    4 |    5 |   3 |    4 |    5 |
|   4 |    5 |    6 |   4 |    5 |    6 |
|   5 |    6 |    7 |   5 |    6 |    7 |
|   6 |    7 |    8 |   6 |    7 |    8 |
|   7 |    8 |    9 |   7 |    8 |    9 |
|   8 |    9 |   10 |   8 |    9 |   10 |
|   9 |   10 |   11 |   9 |   10 |   11 |
|  10 |   11 |   12 |  10 |   11 |   12 |
|  11 |   12 |   13 |  11 |   12 |   13 |
|  12 |   13 |   14 |  12 |   13 |   14 |
|  13 |   14 |   15 |  13 |   14 |   15 |
|  14 |   15 |   16 |  14 |   15 |   16 |
|  15 |   16 |   17 |  15 |   16 |   17 |
|  16 |   17 |   18 |  16 |   17 |   18 |
|  17 |   18 |   19 |  17 |   18 |   19 |
|  18 |   19 |   20 |  18 |   19 |   20 |
|  19 |   20 |   21 |  19 |   20 |   21 |
|  20 |   21 |   22 |  20 |   21 |   22 |
|  21 |   22 |   23 |  21 |   22 |   23 |
|  22 |   23 |   24 |  22 |   23 |   24 |
|  23 |   24 |   25 |  23 |   24 |   25 |
|  24 |   25 |   26 |  24 |   25 |   26 |
|  25 |   26 |   27 |  25 |   26 |   27 |
|  26 |   27 |   28 |  26 |   27 |   28 |
|  27 |   28 |   29 |  27 |   28 |   29 |
|  28 |   29 |   30 |  28 |   29 |   30 |
|  29 |   30 |   31 |  29 |   30 |   31 |
|  30 |   31 |   32 |  30 |   31 |   32 |
|  31 |   32 |   33 |  31 |   32 |   33 |
|  32 |   33 |   34 |  32 |   33 |   34 |
|  33 |   34 |   35 |  33 |   34 |   35 |
|  34 |   35 |   36 |  34 |   35 |   36 |
|  35 |   36 |   37 |  35 |   36 |   37 |
|  36 |   37 |   38 |  36 |   37 |   38 |
|  37 |   38 |   39 |  37 |   38 |   39 |
|  38 |   39 |   40 |  38 |   39 |   40 |
|  39 |   40 |   41 |  39 |   40 |   41 |
|  40 |   41 |   42 |  40 |   41 |   42 |
|  41 |   42 |   43 |  41 |   42 |   43 |
|  42 |   43 |   44 |  42 |   43 |   44 |
|  43 |   44 |   45 |  43 |   44 |   45 |
|  44 |   45 |   46 |  44 |   45 |   46 |
|  45 |   46 |   47 |  45 |   46 |   47 |
|  46 |   47 |   48 |  46 |   47 |   48 |
|  47 |   48 |   49 |  47 |   48 |   49 |
|  48 |   49 |   50 |  48 |   49 |   50 |
|  49 |   50 |   51 |  49 |   50 |   51 |
|  50 |   51 |   52 |  50 |   51 |   52 |
|  51 |   52 |   53 |  51 |   52 |   53 |
|  52 |   53 |   54 |  52 |   53 |   54 |
|  53 |   54 |   55 |  53 |   54 |   55 |
|  54 |   55 |   56 |  54 |   55 |   56 |
|  55 |   56 |   57 |  55 |   56 |   57 |
|  56 |   57 |   58 |  56 |   57 |   58 |
|  57 |   58 |   59 |  57 |   58 |   59 |
|  58 |   59 |   60 |  58 |   59 |   60 |
|  59 |   60 |   61 |  59 |   60 |   61 |
|  60 |   61 |   62 |  60 |   61 |   62 |
|  61 |   62 |   63 |  61 |   62 |   63 |
|  62 |   63 |   64 |  62 |   63 |   64 |
|  63 |   64 |   65 |  63 |   64 |   65 |
|  64 |   65 |   66 |  64 |   65 |   66 |
|  65 |   66 |   67 |  65 |   66 |   67 |
|  66 |   67 |   68 |  66 |   67 |   68 |
|  67 |   68 |   69 |  67 |   68 |   69 |
|  68 |   69 |   70 |  68 |   69 |   70 |
|  69 |   70 |   71 |  69 |   70 |   71 |
|  70 |   71 |   72 |  70 |   71 |   72 |
|  71 |   72 |   73 |  71 |   72 |   73 |
|  72 |   73 |   74 |  72 |   73 |   74 |
|  73 |   74 |   75 |  73 |   74 |   75 |
|  74 |   75 |   76 |  74 |   75 |   76 |
|  75 |   76 |   77 |  75 |   76 |   77 |
|  76 |   77 |   78 |  76 |   77 |   78 |
|  77 |   78 |   79 |  77 |   78 |   79 |
|  78 |   79 |   80 |  78 |   79 |   80 |
|  79 |   80 |   81 |  79 |   80 |   81 |
|  80 |   81 |   82 |  80 |   81 |   82 |
|  81 |   82 |   83 |  81 |   82 |   83 |
|  82 |   83 |   84 |  82 |   83 |   84 |
|  83 |   84 |   85 |  83 |   84 |   85 |
|  84 |   85 |   86 |  84 |   85 |   86 |
|  85 |   86 |   87 |  85 |   86 |   87 |
|  86 |   87 |   88 |  86 |   87 |   88 |
|  87 |   88 |   89 |  87 |   88 |   89 |
|  88 |   89 |   90 |  88 |   89 |   90 |
|  89 |   90 |   91 |  89 |   90 |   91 |
|  90 |   91 |   92 |  90 |   91 |   92 |
|  91 |   92 |   93 |  91 |   92 |   93 |
|  92 |   93 |   94 |  92 |   93 |   94 |
|  93 |   94 |   95 |  93 |   94 |   95 |
|  94 |   95 |   96 |  94 |   95 |   96 |
|  95 |   96 |   97 |  95 |   96 |   97 |
|  96 |   97 |   98 |  96 |   97 |   98 |
|  97 |   98 |   99 |  97 |   98 |   99 |
|  98 |   99 |  100 |  98 |   99 |  100 |
|  99 |  100 |  101 |  99 |  100 |  101 |
| 100 |  101 |  102 | 100 |  101 |  102 |
| 101 |  102 |  103 | 101 |  102 |  103 |
+-----+------+------+-----+------+------+
affected rows: 100
EXPLAIN BASIC select /*+index(t1 i1), index(t2 i1), use_nl(t1 t2)*/ t1.a, t1.c, t2.a, t2.c from t1 join t2 where t1.b>2 and t1.b<10000 and t1.b=t2.b order by t1.a, t2.a limit 100;
Query Plan
============================================
|ID|OPERATOR                        |NAME  |
--------------------------------------------
|0 |TOP-N SORT                      |      |
|1 |└─NESTED-LOOP JOIN              |      |
|2 |  ├─DISTRIBUTED TABLE RANGE SCAN|t2(i1)|
|3 |  └─DISTRIBUTED TABLE RANGE SCAN|t1(i1)|
============================================
Outputs & filters:
-------------------------------------
  0 - output([t1.a], [t1.c], [t2.a], [t2.c]), filter(nil), rowset=256
      sort_keys([t1.a, ASC], [t2.a, ASC]), topn(100)
  1 - output([t1.a], [t2.a], [t1.c], [t2.c]), filter(nil), rowset=256
      conds(nil), nl_params_([t2.b(:0)]), use_batch=true
  2 - output([t2.a], [t2.b], [t2.c]), filter(nil), rowset=256
      access([t2.a], [t2.b], [t2.c]), partitions(p0)
      is_index_back=true, is_global_index=true, 
      range_key([t2.b], [t2.a]), range(2,MAX ; 10000,MIN), 
      range_cond([t2.b < 10000], [t2.b > 2])
  3 - output([t1.a], [t1.c]), filter(nil), rowset=256
      access([GROUP_ID], [t1.a], [t1.c]), partitions(p[0-3])
      is_index_back=true, is_global_index=true, 
      range_key([t1.b], [t1.a]), range(MIN ; MAX), 
      range_cond([t1.b = :0])
affected rows: 24
select /*+index(t1 i1), index(t2 i1), use_nl(t1 t2)*/ t1.a, t1.c, t2.a, t2.c from t1 join t2 where t1.b>2 and t1.b<10000 and t1.b=t2.b order by t1.a, t2.a limit 100;
+-----+------+-----+------+
| a   | c    | a   | c    |
+-----+------+-----+------+
|   2 |    4 |   2 |    4 |
|   3 |    5 |   3 |    5 |
|   4 |    6 |   4 |    6 |
|   5 |    7 |   5 |    7 |
|   6 |    8 |   6 |    8 |
|   7 |    9 |   7 |    9 |
|   8 |   10 |   8 |   10 |
|   9 |   11 |   9 |   11 |
|  10 |   12 |  10 |   12 |
|  11 |   13 |  11 |   13 |
|  12 |   14 |  12 |   14 |
|  13 |   15 |  13 |   15 |
|  14 |   16 |  14 |   16 |
|  15 |   17 |  15 |   17 |
|  16 |   18 |  16 |   18 |
|  17 |   19 |  17 |   19 |
|  18 |   20 |  18 |   20 |
|  19 |   21 |  19 |   21 |
|  20 |   22 |  20 |   22 |
|  21 |   23 |  21 |   23 |
|  22 |   24 |  22 |   24 |
|  23 |   25 |  23 |   25 |
|  24 |   26 |  24 |   26 |
|  25 |   27 |  25 |   27 |
|  26 |   28 |  26 |   28 |
|  27 |   29 |  27 |   29 |
|  28 |   30 |  28 |   30 |
|  29 |   31 |  29 |   31 |
|  30 |   32 |  30 |   32 |
|  31 |   33 |  31 |   33 |
|  32 |   34 |  32 |   34 |
|  33 |   35 |  33 |   35 |
|  34 |   36 |  34 |   36 |
|  35 |   37 |  35 |   37 |
|  36 |   38 |  36 |   38 |
|  37 |   39 |  37 |   39 |
|  38 |   40 |  38 |   40 |
|  39 |   41 |  39 |   41 |
|  40 |   42 |  40 |   42 |
|  41 |   43 |  41 |   43 |
|  42 |   44 |  42 |   44 |
|  43 |   45 |  43 |   45 |
|  44 |   46 |  44 |   46 |
|  45 |   47 |  45 |   47 |
|  46 |   48 |  46 |   48 |
|  47 |   49 |  47 |   49 |
|  48 |   50 |  48 |   50 |
|  49 |   51 |  49 |   51 |
|  50 |   52 |  50 |   52 |
|  51 |   53 |  51 |   53 |
|  52 |   54 |  52 |   54 |
|  53 |   55 |  53 |   55 |
|  54 |   56 |  54 |   56 |
|  55 |   57 |  55 |   57 |
|  56 |   58 |  56 |   58 |
|  57 |   59 |  57 |   59 |
|  58 |   60 |  58 |   60 |
|  59 |   61 |  59 |   61 |
|  60 |   62 |  60 |   62 |
|  61 |   63 |  61 |   63 |
|  62 |   64 |  62 |   64 |
|  63 |   65 |  63 |   65 |
|  64 |   66 |  64 |   66 |
|  65 |   67 |  65 |   67 |
|  66 |   68 |  66 |   68 |
|  67 |   69 |  67 |   69 |
|  68 |   70 |  68 |   70 |
|  69 |   71 |  69 |   71 |
|  70 |   72 |  70 |   72 |
|  71 |   73 |  71 |   73 |
|  72 |   74 |  72 |   74 |
|  73 |   75 |  73 |   75 |
|  74 |   76 |  74 |   76 |
|  75 |   77 |  75 |   77 |
|  76 |   78 |  76 |   78 |
|  77 |   79 |  77 |   79 |
|  78 |   80 |  78 |   80 |
|  79 |   81 |  79 |   81 |
|  80 |   82 |  80 |   82 |
|  81 |   83 |  81 |   83 |
|  82 |   84 |  82 |   84 |
|  83 |   85 |  83 |   85 |
|  84 |   86 |  84 |   86 |
|  85 |   87 |  85 |   87 |
|  86 |   88 |  86 |   88 |
|  87 |   89 |  87 |   89 |
|  88 |   90 |  88 |   90 |
|  89 |   91 |  89 |   91 |
|  90 |   92 |  90 |   92 |
|  91 |   93 |  91 |   93 |
|  92 |   94 |  92 |   94 |
|  93 |   95 |  93 |   95 |
|  94 |   96 |  94 |   96 |
|  95 |   97 |  95 |   97 |
|  96 |   98 |  96 |   98 |
|  97 |   99 |  97 |   99 |
|  98 |  100 |  98 |  100 |
|  99 |  101 |  99 |  101 |
| 100 |  102 | 100 |  102 |
| 101 |  103 | 101 |  103 |
+-----+------+-----+------+
affected rows: 100

create index i2 on t1(b) global partition by key(b) partitions 17;
affected rows: 0
## enable parallel dml
set _force_parallel_dml_dop = 3;
affected rows: 0
EXPLAIN BASIC delete /*+index(t1 i1)*/ from t1 where b = 1;
Query Plan
====================================================================
|ID|OPERATOR                                              |NAME    |
--------------------------------------------------------------------
|0 |PX COORDINATOR                                        |        |
|1 |└─EXCHANGE OUT DISTR                                  |:EX10003|
|2 |  └─INDEX DELETE                                      |t1(i2)  |
|3 |    └─EXCHANGE IN DISTR                               |        |
|4 |      └─EXCHANGE OUT DISTR (PKEY HASH)                |:EX10002|
|5 |        └─MATERIAL                                    |        |
|6 |          └─INDEX DELETE                              |t1(i1)  |
|7 |            └─EXCHANGE IN DISTR                       |        |
|8 |              └─EXCHANGE OUT DISTR (PKEY HASH)        |:EX10001|
|9 |                └─MATERIAL                            |        |
|10|                  └─DELETE                            |        |
|11|                    └─EXCHANGE IN DISTR               |        |
|12|                      └─EXCHANGE OUT DISTR (PKEY HASH)|:EX10000|
|13|                        └─PX BLOCK ITERATOR           |        |
|14|                          └─TABLE RANGE SCAN          |t1(i1)  |
====================================================================
Outputs & filters:
-------------------------------------
  0 - output(nil), filter(nil), rowset=16
  1 - output(nil), filter(nil), rowset=16
      dop=3
  2 - output(nil), filter(nil)
      table_columns([{t1: ({i2: (t1.b, t1.a)})}])
  3 - output([PARTITION_ID], [t1.b], [t1.a]), filter(nil), rowset=16
  4 - output([PARTITION_ID], [t1.b], [t1.a]), filter(nil), rowset=16
      (#keys=1, [t1.b]), dop=3
  5 - output([t1.b], [t1.a]), filter(nil), rowset=16
  6 - output([t1.b], [t1.a]), filter(nil)
      table_columns([{t1: ({i1: (t1.b, t1.a)})}])
  7 - output([t1.b], [t1.a], [PARTITION_ID]), filter(nil), rowset=16
  8 - output([t1.b], [t1.a], [PARTITION_ID]), filter(nil), rowset=16
      (#keys=1, [t1.b]), dop=3
  9 - output([t1.b], [t1.a]), filter(nil), rowset=16
 10 - output([t1.b], [t1.a]), filter(nil)
      table_columns([{t1: ({t1: (t1.a, t1.b, t1.c)})}])
 11 - output([t1.b], [t1.a], [PARTITION_ID], [t1.c]), filter(nil), rowset=16
 12 - output([t1.b], [t1.a], [PARTITION_ID], [t1.c]), filter(nil), rowset=16
      (#keys=1, [t1.a]), dop=3
 13 - output([t1.a], [t1.b], [t1.c]), filter(nil), rowset=16
 14 - output([t1.a], [t1.b], [t1.c]), filter(nil), rowset=16
      access([t1.a], [t1.b], [t1.c]), partitions(p1)
      is_index_back=true, is_global_index=true, 
      range_key([t1.b], [t1.a]), range(1,MIN ; 1,MAX), 
      range_cond([t1.b = 1])
affected rows: 47
delete /*+index(t1 i1)*/ from t1 where b = 1;
affected rows: 0
## enable parallel query
set _force_parallel_query_dop = 3;
affected rows: 0
EXPLAIN BASIC select /*+index(t1 i1)*/ * from t1 where b>1 and b <10;
Query Plan
====================================
|ID|OPERATOR              |NAME    |
------------------------------------
|0 |PX COORDINATOR        |        |
|1 |└─EXCHANGE OUT DISTR  |:EX10000|
|2 |  └─PX BLOCK ITERATOR |        |
|3 |    └─TABLE RANGE SCAN|t1(i1)  |
====================================
Outputs & filters:
-------------------------------------
  0 - output([INTERNAL_FUNCTION(t1.a, t1.b, t1.c)]), filter(nil), rowset=16
  1 - output([INTERNAL_FUNCTION(t1.a, t1.b, t1.c)]), filter(nil), rowset=16
      dop=3
  2 - output([t1.a], [t1.b], [t1.c]), filter(nil), rowset=16
  3 - output([t1.a], [t1.b], [t1.c]), filter(nil), rowset=16
      access([t1.a], [t1.b], [t1.c]), partitions(p[0-3])
      is_index_back=true, is_global_index=true, 
      range_key([t1.b], [t1.a]), range(1,MAX ; 10,MIN), 
      range_cond([t1.b > 1], [t1.b < 10])
affected rows: 19
select /*+index(t1 i1)*/ * from t1 where b>1 and b <10;
+---+------+------+
| a | b    | c    |
+---+------+------+
| 1 |    2 |    3 |
| 2 |    3 |    4 |
| 3 |    4 |    5 |
| 4 |    5 |    6 |
| 5 |    6 |    7 |
| 6 |    7 |    8 |
| 7 |    8 |    9 |
| 8 |    9 |   10 |
+---+------+------+
affected rows: 8
## enable parallel query through parallel hint
set _force_parallel_query_dop = 1;
affected rows: 0
EXPLAIN BASIC select /*+index(t1 i1), parallel(3)*/ * from t1 where b>1 and b<10;
Query Plan
====================================
|ID|OPERATOR              |NAME    |
------------------------------------
|0 |PX COORDINATOR        |        |
|1 |└─EXCHANGE OUT DISTR  |:EX10000|
|2 |  └─PX BLOCK ITERATOR |        |
|3 |    └─TABLE RANGE SCAN|t1(i1)  |
====================================
Outputs & filters:
-------------------------------------
  0 - output([INTERNAL_FUNCTION(t1.a, t1.b, t1.c)]), filter(nil), rowset=16
  1 - output([INTERNAL_FUNCTION(t1.a, t1.b, t1.c)]), filter(nil), rowset=16
      dop=3
  2 - output([t1.a], [t1.b], [t1.c]), filter(nil), rowset=16
  3 - output([t1.a], [t1.b], [t1.c]), filter(nil), rowset=16
      access([t1.a], [t1.b], [t1.c]), partitions(p[0-3])
      is_index_back=true, is_global_index=true, 
      range_key([t1.b], [t1.a]), range(1,MAX ; 10,MIN), 
      range_cond([t1.b > 1], [t1.b < 10])
affected rows: 19
select /*+index(t1 i1), parallel(3)*/ * from t1 where b>1 and b<10;
+---+------+------+
| a | b    | c    |
+---+------+------+
| 1 |    2 |    3 |
| 2 |    3 |    4 |
| 3 |    4 |    5 |
| 4 |    5 |    6 |
| 5 |    6 |    7 |
| 6 |    7 |    8 |
| 7 |    8 |    9 |
| 8 |    9 |   10 |
+---+------+------+
affected rows: 8
drop database global_index;
affected rows: 5
