result_format: 4
explain_protocol: 1
drop database if exists global_index;
affected rows: 0
create database global_index;
affected rows: 1
use global_index;
affected rows: 0

## build tables
set ob_query_timeout=30000000;
affected rows: 0
create table t1 (c1 int, c2 int, c3 int, c4 int, primary key (c1)) partition by hash(c1) partitions 4;
affected rows: 0
EXPLAIN BASIC insert into t1 values (1,1,1,1),(2,2,2,2),(3,3,3,3),(4,4,4,4);
Query Plan
============================
|ID|OPERATOR          |NAME|
----------------------------
|0 |DISTRIBUTED INSERT|    |
|1 |└─EXPRESSION      |    |
============================
Outputs & filters:
-------------------------------------
  0 - output(nil), filter(nil)
      columns([{t1: ({t1: (t1.c1, t1.c2, t1.c3, t1.c4)})}]), 
      column_values([column_conv(INT,PS:(11,0),NOT NULL,__values.c1)], [column_conv(INT,PS:(11,0),NULL,__values.c2)], [column_conv(INT,PS:(11,0),NULL,__values.c3)],
       [column_conv(INT,PS:(11,0),NULL,__values.c4)])
  1 - output([__values.c1], [__values.c2], [__values.c3], [__values.c4]), filter(nil)
      values({1, 1, 1, 1}, {2, 2, 2, 2}, {3, 3, 3, 3}, {4, 4, 4, 4})
affected rows: 14
insert into t1 values (1,1,1,1),(2,2,2,2),(3,3,3,3),(4,4,4,4);
affected rows: 4
info: Records: 4  Duplicates: 0  Warnings: 0
create index gkey on t1(c2,c3,c4) global;
affected rows: 0

create table t2 (c1 int, c2 int, c3 int, c4 int, primary key (c1)) partition by hash(c1) partitions 4;
affected rows: 0
EXPLAIN BASIC insert into t2 values (1,1,1,1),(2,2,2,2),(3,3,3,3),(4,4,4,4),(5,5,5,5);
Query Plan
============================
|ID|OPERATOR          |NAME|
----------------------------
|0 |DISTRIBUTED INSERT|    |
|1 |└─EXPRESSION      |    |
============================
Outputs & filters:
-------------------------------------
  0 - output(nil), filter(nil)
      columns([{t2: ({t2: (t2.c1, t2.c2, t2.c3, t2.c4)})}]), 
      column_values([column_conv(INT,PS:(11,0),NOT NULL,__values.c1)], [column_conv(INT,PS:(11,0),NULL,__values.c2)], [column_conv(INT,PS:(11,0),NULL,__values.c3)],
       [column_conv(INT,PS:(11,0),NULL,__values.c4)])
  1 - output([__values.c1], [__values.c2], [__values.c3], [__values.c4]), filter(nil)
      values({1, 1, 1, 1}, {2, 2, 2, 2}, {3, 3, 3, 3}, {4, 4, 4, 4}, {5, 5, 5, 5})
affected rows: 14
insert into t2 values (1,1,1,1),(2,2,2,2),(3,3,3,3),(4,4,4,4),(5,5,5,5);
affected rows: 5
info: Records: 5  Duplicates: 0  Warnings: 0
create index gkey on t2(c2,c3,c4) global partition by hash(c2) partitions 5;
affected rows: 0

create table t3(c1 int, c2 int, c3 int, c4 int, primary key(c1, c2)) partition by hash(c1)  subpartition by range columns(c2)  subpartition template ( subpartition p0 values less than (5),   subpartition p1 values less than (100)) partitions 2;
affected rows: 0
create index i1 on t3(c3) global partition by hash(c3) partitions 2;
affected rows: 0
EXPLAIN BASIC insert into t3 values(1, 1, 1, 1), (2, 2, 2, 2), (3, 3, 3, 3);
Query Plan
============================
|ID|OPERATOR          |NAME|
----------------------------
|0 |DISTRIBUTED INSERT|    |
|1 |└─EXPRESSION      |    |
============================
Outputs & filters:
-------------------------------------
  0 - output(nil), filter(nil)
      columns([{t3: ({t3: (t3.c1, t3.c2, t3.c3, t3.c4)}, {i1: (t3.c3, t3.c1, t3.c2)})}]), 
      column_values([column_conv(INT,PS:(11,0),NOT NULL,__values.c1)], [column_conv(INT,PS:(11,0),NOT NULL,__values.c2)], [column_conv(INT,PS:(11,0),NULL,
      __values.c3)], [column_conv(INT,PS:(11,0),NULL,__values.c4)])
  1 - output([__values.c1], [__values.c2], [__values.c3], [__values.c4]), filter(nil)
      values({1, 1, 1, 1}, {2, 2, 2, 2}, {3, 3, 3, 3})
affected rows: 14
insert into t3 values(1, 1, 1, 1), (2, 2, 2, 2), (3, 3, 3, 3);
affected rows: 3
info: Records: 3  Duplicates: 0  Warnings: 0

create table t4(c1 int, c2 int, c3 int, c4 int, primary key(c1, c2)) partition by hash(c1)  subpartition by range columns(c2)  subpartition template ( subpartition p0 values less than (5),   subpartition p1 values less than (100)) partitions 2;
affected rows: 0
EXPLAIN BASIC insert into t4 values(1, 1, 1, 1), (2, 2, 2, 2), (3, 3, 3, 3);
Query Plan
============================
|ID|OPERATOR          |NAME|
----------------------------
|0 |DISTRIBUTED INSERT|    |
|1 |└─EXPRESSION      |    |
============================
Outputs & filters:
-------------------------------------
  0 - output(nil), filter(nil)
      columns([{t4: ({t4: (t4.c1, t4.c2, t4.c3, t4.c4)})}]), 
      column_values([column_conv(INT,PS:(11,0),NOT NULL,__values.c1)], [column_conv(INT,PS:(11,0),NOT NULL,__values.c2)], [column_conv(INT,PS:(11,0),NULL,
      __values.c3)], [column_conv(INT,PS:(11,0),NULL,__values.c4)])
  1 - output([__values.c1], [__values.c2], [__values.c3], [__values.c4]), filter(nil)
      values({1, 1, 1, 1}, {2, 2, 2, 2}, {3, 3, 3, 3})
affected rows: 14
insert into t4 values(1, 1, 1, 1), (2, 2, 2, 2), (3, 3, 3, 3);
affected rows: 3
info: Records: 3  Duplicates: 0  Warnings: 0
create index i1 on t4(c3) global partition by hash(c3) partitions 2;
affected rows: 0

create table t5(a int, b int, c int, primary key(a)) partition by hash(a) partitions 5;
affected rows: 0
create index gkey on t5(b) global;
affected rows: 0
EXPLAIN BASIC insert into t5 values(1, 5, 1), (2, 4, 2), (3, 3, 3), (4, 2, 4), (5, 1, 5);
Query Plan
============================
|ID|OPERATOR          |NAME|
----------------------------
|0 |DISTRIBUTED INSERT|    |
|1 |└─EXPRESSION      |    |
============================
Outputs & filters:
-------------------------------------
  0 - output(nil), filter(nil)
      columns([{t5: ({t5: (t5.a, t5.b, t5.c)}, {gkey: (t5.b, t5.a)})}]), 
      column_values([column_conv(INT,PS:(11,0),NOT NULL,__values.a)], [column_conv(INT,PS:(11,0),NULL,__values.b)], [column_conv(INT,PS:(11,0),NULL,__values.c)])
  1 - output([__values.a], [__values.b], [__values.c]), filter(nil)
      values({1, 5, 1}, {2, 4, 2}, {3, 3, 3}, {4, 2, 4}, {5, 1, 5})
affected rows: 13
insert into t5 values(1, 5, 1), (2, 4, 2), (3, 3, 3), (4, 2, 4), (5, 1, 5);
affected rows: 5
info: Records: 5  Duplicates: 0  Warnings: 0

create table t6(a int, b int, c int, primary key(a)) partition by hash(a) partitions 5;
affected rows: 0
create index gkey on t6(b) global;
affected rows: 0
EXPLAIN BASIC insert into t6 values(1, 5, 1), (2, 4, 2), (3, 3, 3), (4, 2, 4), (5, 1, 5);
Query Plan
============================
|ID|OPERATOR          |NAME|
----------------------------
|0 |DISTRIBUTED INSERT|    |
|1 |└─EXPRESSION      |    |
============================
Outputs & filters:
-------------------------------------
  0 - output(nil), filter(nil)
      columns([{t6: ({t6: (t6.a, t6.b, t6.c)}, {gkey: (t6.b, t6.a)})}]), 
      column_values([column_conv(INT,PS:(11,0),NOT NULL,__values.a)], [column_conv(INT,PS:(11,0),NULL,__values.b)], [column_conv(INT,PS:(11,0),NULL,__values.c)])
  1 - output([__values.a], [__values.b], [__values.c]), filter(nil)
      values({1, 5, 1}, {2, 4, 2}, {3, 3, 3}, {4, 2, 4}, {5, 1, 5})
affected rows: 13
insert into t6 values(1, 5, 1), (2, 4, 2), (3, 3, 3), (4, 2, 4), (5, 1, 5);
affected rows: 5
info: Records: 5  Duplicates: 0  Warnings: 0

create table t7(a int, b int, c int, primary key(a));
affected rows: 0
create index gkey on t7(b) global partition by hash(b) partitions 5;
affected rows: 0
EXPLAIN BASIC insert into t7 values(1, 5, 1), (2, 4, 2), (3, 3, 3), (4, 2, 4), (5, 1, 5);
Query Plan
============================
|ID|OPERATOR          |NAME|
----------------------------
|0 |DISTRIBUTED INSERT|    |
|1 |└─EXPRESSION      |    |
============================
Outputs & filters:
-------------------------------------
  0 - output(nil), filter(nil)
      columns([{t7: ({t7: (t7.a, t7.b, t7.c)}, {gkey: (t7.b, t7.a)})}]), 
      column_values([column_conv(INT,PS:(11,0),NOT NULL,__values.a)], [column_conv(INT,PS:(11,0),NULL,__values.b)], [column_conv(INT,PS:(11,0),NULL,__values.c)])
  1 - output([__values.a], [__values.b], [__values.c]), filter(nil)
      values({1, 5, 1}, {2, 4, 2}, {3, 3, 3}, {4, 2, 4}, {5, 1, 5})
affected rows: 13
insert into t7 values(1, 5, 1), (2, 4, 2), (3, 3, 3), (4, 2, 4), (5, 1, 5);
affected rows: 5
info: Records: 5  Duplicates: 0  Warnings: 0

create table t8(a int, b int, c int, primary key(a));
affected rows: 0
create unique index guk on t8(b) global partition by hash(b) partitions 5;
affected rows: 0
EXPLAIN BASIC insert into t8 values(1, 5, 1), (2, 4, 2), (3, 3, 3), (4, 2, 4), (5, 1, 5);
Query Plan
============================
|ID|OPERATOR          |NAME|
----------------------------
|0 |DISTRIBUTED INSERT|    |
|1 |└─EXPRESSION      |    |
============================
Outputs & filters:
-------------------------------------
  0 - output(nil), filter(nil)
      columns([{t8: ({t8: (t8.a, t8.b, t8.c)}, {guk: (t8.b, t8.a)})}]), 
      column_values([column_conv(INT,PS:(11,0),NOT NULL,__values.a)], [column_conv(INT,PS:(11,0),NULL,__values.b)], [column_conv(INT,PS:(11,0),NULL,__values.c)])
  1 - output([__values.a], [__values.b], [__values.c]), filter(nil)
      values({1, 5, 1}, {2, 4, 2}, {3, 3, 3}, {4, 2, 4}, {5, 1, 5})
affected rows: 13
insert into t8 values(1, 5, 1), (2, 4, 2), (3, 3, 3), (4, 2, 4), (5, 1, 5);
affected rows: 5
info: Records: 5  Duplicates: 0  Warnings: 0

create table t9 (c1 int, c2 int, c3 int, c4 int, primary key (c1)) partition by hash(c1) partitions 4;
affected rows: 0
create index gkey on t9(c2,c3) global partition by hash(c2) partitions 5;
affected rows: 0
EXPLAIN BASIC insert into t9 values (1,1,1,1),(2,2,2,2),(3,3,3,3),(4,4,4,4),(5,5,5,5);
Query Plan
============================
|ID|OPERATOR          |NAME|
----------------------------
|0 |DISTRIBUTED INSERT|    |
|1 |└─EXPRESSION      |    |
============================
Outputs & filters:
-------------------------------------
  0 - output(nil), filter(nil)
      columns([{t9: ({t9: (t9.c1, t9.c2, t9.c3, t9.c4)}, {gkey: (t9.c2, t9.c3, t9.c1)})}]), 
      column_values([column_conv(INT,PS:(11,0),NOT NULL,__values.c1)], [column_conv(INT,PS:(11,0),NULL,__values.c2)], [column_conv(INT,PS:(11,0),NULL,__values.c3)],
       [column_conv(INT,PS:(11,0),NULL,__values.c4)])
  1 - output([__values.c1], [__values.c2], [__values.c3], [__values.c4]), filter(nil)
      values({1, 1, 1, 1}, {2, 2, 2, 2}, {3, 3, 3, 3}, {4, 4, 4, 4}, {5, 5, 5, 5})
affected rows: 14
insert into t9 values (1,1,1,1),(2,2,2,2),(3,3,3,3),(4,4,4,4),(5,5,5,5);
affected rows: 5
info: Records: 5  Duplicates: 0  Warnings: 0

create table t10 (c1 int, c2 int, c3 int, c4 int, primary key (c1)) partition by hash(c1) partitions 4;
affected rows: 0
create index gkey on t10(c2,c3) global;
affected rows: 0
EXPLAIN BASIC insert into t10 values (1,1,1,1),(2,2,2,2),(3,3,3,3),(4,4,4,4);
Query Plan
============================
|ID|OPERATOR          |NAME|
----------------------------
|0 |DISTRIBUTED INSERT|    |
|1 |└─EXPRESSION      |    |
============================
Outputs & filters:
-------------------------------------
  0 - output(nil), filter(nil)
      columns([{t10: ({t10: (t10.c1, t10.c2, t10.c3, t10.c4)}, {gkey: (t10.c2, t10.c3, t10.c1)})}]), 
      column_values([column_conv(INT,PS:(11,0),NOT NULL,__values.c1)], [column_conv(INT,PS:(11,0),NULL,__values.c2)], [column_conv(INT,PS:(11,0),NULL,__values.c3)],
       [column_conv(INT,PS:(11,0),NULL,__values.c4)])
  1 - output([__values.c1], [__values.c2], [__values.c3], [__values.c4]), filter(nil)
      values({1, 1, 1, 1}, {2, 2, 2, 2}, {3, 3, 3, 3}, {4, 4, 4, 4})
affected rows: 14
insert into t10 values (1,1,1,1),(2,2,2,2),(3,3,3,3),(4,4,4,4);
affected rows: 4
info: Records: 4  Duplicates: 0  Warnings: 0

create table t11 (c1 int, c2 int, c3 int, c4 int, primary key (c1)) partition by range columns(c1) (partition p0 values less than (1), partition p1 values less than (100));
affected rows: 0
create index gkey on t11(c2,c3) global partition by hash(c2) partitions 5;
affected rows: 0
EXPLAIN BASIC insert into t11 values (1,1,1,1),(2,2,2,2),(3,3,3,3),(4,4,4,4),(5,5,5,5);
Query Plan
============================
|ID|OPERATOR          |NAME|
----------------------------
|0 |DISTRIBUTED INSERT|    |
|1 |└─EXPRESSION      |    |
============================
Outputs & filters:
-------------------------------------
  0 - output(nil), filter(nil)
      columns([{t11: ({t11: (t11.c1, t11.c2, t11.c3, t11.c4)}, {gkey: (t11.c2, t11.c3, t11.c1)})}]), 
      column_values([column_conv(INT,PS:(11,0),NOT NULL,__values.c1)], [column_conv(INT,PS:(11,0),NULL,__values.c2)], [column_conv(INT,PS:(11,0),NULL,__values.c3)],
       [column_conv(INT,PS:(11,0),NULL,__values.c4)])
  1 - output([__values.c1], [__values.c2], [__values.c3], [__values.c4]), filter(nil)
      values({1, 1, 1, 1}, {2, 2, 2, 2}, {3, 3, 3, 3}, {4, 4, 4, 4}, {5, 5, 5, 5})
affected rows: 14
insert into t11 values (1,1,1,1),(2,2,2,2),(3,3,3,3),(4,4,4,4),(5,5,5,5);
affected rows: 5
info: Records: 5  Duplicates: 0  Warnings: 0

create table t12 (c1 int, c2 int, c3 int, c4 int, primary key (c1)) partition by key(c1) partitions 4;
affected rows: 0
create index gkey on t12(c2,c3) global partition by key(c2) partitions 5;
affected rows: 0
EXPLAIN BASIC insert into t12 values (1,1,1,1),(2,2,2,2),(3,3,3,3),(4,4,4,4),(5,5,5,5);
Query Plan
============================
|ID|OPERATOR          |NAME|
----------------------------
|0 |DISTRIBUTED INSERT|    |
|1 |└─EXPRESSION      |    |
============================
Outputs & filters:
-------------------------------------
  0 - output(nil), filter(nil)
      columns([{t12: ({t12: (t12.c1, t12.c2, t12.c3, t12.c4)}, {gkey: (t12.c2, t12.c3, t12.c1)})}]), 
      column_values([column_conv(INT,PS:(11,0),NOT NULL,__values.c1)], [column_conv(INT,PS:(11,0),NULL,__values.c2)], [column_conv(INT,PS:(11,0),NULL,__values.c3)],
       [column_conv(INT,PS:(11,0),NULL,__values.c4)])
  1 - output([__values.c1], [__values.c2], [__values.c3], [__values.c4]), filter(nil)
      values({1, 1, 1, 1}, {2, 2, 2, 2}, {3, 3, 3, 3}, {4, 4, 4, 4}, {5, 5, 5, 5})
affected rows: 14
insert into t12 values (1,1,1,1),(2,2,2,2),(3,3,3,3),(4,4,4,4),(5,5,5,5);
affected rows: 5
info: Records: 5  Duplicates: 0  Warnings: 0

create table t13 (c1 int, c2 int, c3 int, c4 int, primary key (c1)) partition by list(c1+1) (partition p0 values in (1,2,3), partition p1 values in (default));
affected rows: 0
create index gkey on t13(c2,c3) global partition by key(c2) partitions 5;
affected rows: 0
EXPLAIN BASIC insert into t13 values (1,1,1,1),(2,2,2,2),(3,3,3,3),(4,4,4,4),(5,5,5,5);
Query Plan
============================
|ID|OPERATOR          |NAME|
----------------------------
|0 |DISTRIBUTED INSERT|    |
|1 |└─EXPRESSION      |    |
============================
Outputs & filters:
-------------------------------------
  0 - output(nil), filter(nil)
      columns([{t13: ({t13: (t13.c1, t13.c2, t13.c3, t13.c4)}, {gkey: (t13.c2, t13.c3, t13.c1)})}]), 
      column_values([column_conv(INT,PS:(11,0),NOT NULL,__values.c1)], [column_conv(INT,PS:(11,0),NULL,__values.c2)], [column_conv(INT,PS:(11,0),NULL,__values.c3)],
       [column_conv(INT,PS:(11,0),NULL,__values.c4)])
  1 - output([__values.c1], [__values.c2], [__values.c3], [__values.c4]), filter(nil)
      values({1, 1, 1, 1}, {2, 2, 2, 2}, {3, 3, 3, 3}, {4, 4, 4, 4}, {5, 5, 5, 5})
affected rows: 14
insert into t13 values (1,1,1,1),(2,2,2,2),(3,3,3,3),(4,4,4,4),(5,5,5,5);
affected rows: 5
info: Records: 5  Duplicates: 0  Warnings: 0

create table t14(a int, b int, primary key(a)) partition by hash(a) partitions 5;
affected rows: 0
create table t15(a int, b int, primary key(a)) partition by hash(a) partitions 5;
affected rows: 0
EXPLAIN BASIC insert into t14 values(1, 1), (2, 2), (3, 3), (4, 4);
Query Plan
============================
|ID|OPERATOR          |NAME|
----------------------------
|0 |DISTRIBUTED INSERT|    |
|1 |└─EXPRESSION      |    |
============================
Outputs & filters:
-------------------------------------
  0 - output(nil), filter(nil)
      columns([{t14: ({t14: (t14.a, t14.b)})}]), 
      column_values([column_conv(INT,PS:(11,0),NOT NULL,__values.a)], [column_conv(INT,PS:(11,0),NULL,__values.b)])
  1 - output([__values.a], [__values.b]), filter(nil)
      values({1, 1}, {2, 2}, {3, 3}, {4, 4})
affected rows: 13
insert into t14 values(1, 1), (2, 2), (3, 3), (4, 4);
affected rows: 4
info: Records: 4  Duplicates: 0  Warnings: 0
EXPLAIN BASIC insert into t15 values(1, 1), (2, 2), (3, 3);
Query Plan
============================
|ID|OPERATOR          |NAME|
----------------------------
|0 |DISTRIBUTED INSERT|    |
|1 |└─EXPRESSION      |    |
============================
Outputs & filters:
-------------------------------------
  0 - output(nil), filter(nil)
      columns([{t15: ({t15: (t15.a, t15.b)})}]), 
      column_values([column_conv(INT,PS:(11,0),NOT NULL,__values.a)], [column_conv(INT,PS:(11,0),NULL,__values.b)])
  1 - output([__values.a], [__values.b]), filter(nil)
      values({1, 1}, {2, 2}, {3, 3})
affected rows: 13
insert into t15 values(1, 1), (2, 2), (3, 3);
affected rows: 3
info: Records: 3  Duplicates: 0  Warnings: 0

create table t16(a int, b int, primary key(a)) partition by hash(a) partitions 5;
affected rows: 0
create table t17(a int, b int, primary key(a));
affected rows: 0
EXPLAIN BASIC insert into t16 values(1, 1), (2, 2), (3, 3), (4, 4);
Query Plan
============================
|ID|OPERATOR          |NAME|
----------------------------
|0 |DISTRIBUTED INSERT|    |
|1 |└─EXPRESSION      |    |
============================
Outputs & filters:
-------------------------------------
  0 - output(nil), filter(nil)
      columns([{t16: ({t16: (t16.a, t16.b)})}]), 
      column_values([column_conv(INT,PS:(11,0),NOT NULL,__values.a)], [column_conv(INT,PS:(11,0),NULL,__values.b)])
  1 - output([__values.a], [__values.b]), filter(nil)
      values({1, 1}, {2, 2}, {3, 3}, {4, 4})
affected rows: 13
insert into t16 values(1, 1), (2, 2), (3, 3), (4, 4);
affected rows: 4
info: Records: 4  Duplicates: 0  Warnings: 0
EXPLAIN BASIC insert into t17 values(1, 1), (2, 2), (3, 3);
Query Plan
============================
|ID|OPERATOR          |NAME|
----------------------------
|0 |DISTRIBUTED INSERT|    |
|1 |└─EXPRESSION      |    |
============================
Outputs & filters:
-------------------------------------
  0 - output(nil), filter(nil)
      columns([{t17: ({t17: (t17.a, t17.b)})}]), 
      column_values([column_conv(INT,PS:(11,0),NOT NULL,__values.a)], [column_conv(INT,PS:(11,0),NULL,__values.b)])
  1 - output([__values.a], [__values.b]), filter(nil)
      values({1, 1}, {2, 2}, {3, 3})
affected rows: 13
insert into t17 values(1, 1), (2, 2), (3, 3);
affected rows: 3
info: Records: 3  Duplicates: 0  Warnings: 0

create table t18(a int primary key, b int, c int);
affected rows: 0
create unique index idx on t18(b) global partition by hash(b) partitions 5;
affected rows: 0
create unique index idx2 on t18(c) local;
affected rows: 0
EXPLAIN BASIC insert into t18 values(1, 1, 1);
Query Plan
============================
|ID|OPERATOR          |NAME|
----------------------------
|0 |DISTRIBUTED INSERT|    |
|1 |└─EXPRESSION      |    |
============================
Outputs & filters:
-------------------------------------
  0 - output(nil), filter(nil)
      columns([{t18: ({t18: (t18.a, t18.b, t18.c)}, {idx: (t18.b, t18.a)})}]), 
      column_values([column_conv(INT,PS:(11,0),NOT NULL,__values.a)], [column_conv(INT,PS:(11,0),NULL,__values.b)], [column_conv(INT,PS:(11,0),NULL,__values.c)])
  1 - output([__values.a], [__values.b], [__values.c]), filter(nil)
      values({1, 1, 1})
affected rows: 13
insert into t18 values(1, 1, 1);
affected rows: 1
EXPLAIN BASIC insert into t18 values(2, 2, 2);
Query Plan
============================
|ID|OPERATOR          |NAME|
----------------------------
|0 |DISTRIBUTED INSERT|    |
|1 |└─EXPRESSION      |    |
============================
Outputs & filters:
-------------------------------------
  0 - output(nil), filter(nil)
      columns([{t18: ({t18: (t18.a, t18.b, t18.c)}, {idx: (t18.b, t18.a)})}]), 
      column_values([column_conv(INT,PS:(11,0),NOT NULL,__values.a)], [column_conv(INT,PS:(11,0),NULL,__values.b)], [column_conv(INT,PS:(11,0),NULL,__values.c)])
  1 - output([__values.a], [__values.b], [__values.c]), filter(nil)
      values({2, 2, 2})
affected rows: 13
insert into t18 values(2, 2, 2);
affected rows: 1
EXPLAIN BASIC insert into t18 values(3, 3, 3);
Query Plan
============================
|ID|OPERATOR          |NAME|
----------------------------
|0 |DISTRIBUTED INSERT|    |
|1 |└─EXPRESSION      |    |
============================
Outputs & filters:
-------------------------------------
  0 - output(nil), filter(nil)
      columns([{t18: ({t18: (t18.a, t18.b, t18.c)}, {idx: (t18.b, t18.a)})}]), 
      column_values([column_conv(INT,PS:(11,0),NOT NULL,__values.a)], [column_conv(INT,PS:(11,0),NULL,__values.b)], [column_conv(INT,PS:(11,0),NULL,__values.c)])
  1 - output([__values.a], [__values.b], [__values.c]), filter(nil)
      values({3, 3, 3})
affected rows: 13
insert into t18 values(3, 3, 3);
affected rows: 1

create table t19(a int primary key, b int, c int);
affected rows: 0
create unique index idx on t19(b) global partition by hash(b) partitions 5;
affected rows: 0

create table t20 (c1 int, c2 int, c3 int, primary key(c1));
affected rows: 0
create index idx on t20(c2) global partition by hash(c2) partitions 2;
affected rows: 0
EXPLAIN BASIC insert into t20 values(1, 2, 3), (2, 3, 4), (3, 4, 5);
Query Plan
============================
|ID|OPERATOR          |NAME|
----------------------------
|0 |DISTRIBUTED INSERT|    |
|1 |└─EXPRESSION      |    |
============================
Outputs & filters:
-------------------------------------
  0 - output(nil), filter(nil)
      columns([{t20: ({t20: (t20.c1, t20.c2, t20.c3)}, {idx: (t20.c2, t20.c1)})}]), 
      column_values([column_conv(INT,PS:(11,0),NOT NULL,__values.c1)], [column_conv(INT,PS:(11,0),NULL,__values.c2)], [column_conv(INT,PS:(11,0),NULL,__values.c3)])
  1 - output([__values.c1], [__values.c2], [__values.c3]), filter(nil)
      values({1, 2, 3}, {2, 3, 4}, {3, 4, 5})
affected rows: 13
insert into t20 values(1, 2, 3), (2, 3, 4), (3, 4, 5);
affected rows: 3
info: Records: 3  Duplicates: 0  Warnings: 0
EXPLAIN BASIC insert into t20 values(1, 2, 3), (2, 3, 4), (3, 4, 5) on duplicate key update c2=c2+1;
Query Plan
===============================
|ID|OPERATOR             |NAME|
-------------------------------
|0 |DISTRIBUTED INSERT_UP|    |
|1 |└─EXPRESSION         |    |
===============================
Outputs & filters:
-------------------------------------
  0 - output(nil), filter(nil)
      columns([{t20: ({t20: (t20.c1, t20.c2, t20.c3)}, {idx: (t20.c2, t20.c1)})}]), 
      column_values([column_conv(INT,PS:(11,0),NOT NULL,__values.c1)], [column_conv(INT,PS:(11,0),NULL,__values.c2)], [column_conv(INT,PS:(11,0),NULL,__values.c3)]),
      
      update([t20.c2=column_conv(INT,PS:(11,0),NULL,cast(t20.c2 + 1, INT(-1, 0)))])
  1 - output([__values.c1], [__values.c2], [__values.c3]), filter(nil)
      values({1, 2, 3}, {2, 3, 4}, {3, 4, 5})
affected rows: 15
insert into t20 values(1, 2, 3), (2, 3, 4), (3, 4, 5) on duplicate key update c2=c2+1;
affected rows: 6
info: Records: 3  Duplicates: 3  Warnings: 0

create table t21(a int auto_increment, b int, c int, primary key(b));
affected rows: 0
create unique index idx on t21(b) global partition by hash(b) partitions 5;
affected rows: 0

create table t22(a int primary key, b int, c int, d timestamp(6) NULL DEFAULT CURRENT_TIMESTAMP(6) ON UPDATE CURRENT_TIMESTAMP(6)) partition by hash(a) partitions 5;
affected rows: 0
create index idx on t22(c, d) global;
affected rows: 0

create table t23(a int primary key, b int, c int, d timestamp(6) NULL DEFAULT CURRENT_TIMESTAMP(6) ON UPDATE CURRENT_TIMESTAMP(6)) partition by hash(a) partitions 5;
affected rows: 0
create index idx on t23(c, d) global;
affected rows: 0

create table t24(a int primary key, b int, c int);
affected rows: 0
create index idx on t24(b) global partition by hash(b) partitions 2;
affected rows: 0

drop table if exists t26;
affected rows: 0
create table t26 (c1 int primary key, c2 int, c3 int, c4 int) partition by hash(c1) partitions 2;
affected rows: 0
create index yuming_global_i1 on t26 (c2) global partition by hash(c2) partitions 2;
affected rows: 0
create index yuming_global_i2 on t26 (c3) global partition by hash(c3) partitions 2;
affected rows: 0

create table t27 (c1 int primary key, c2 int, c3 varchar(10));
affected rows: 0
create index idx27_1 on t27(c2) global partition by list(c2)
(
  partition p0 values in (1,2,3,4,5),
  partition p1 values in (6,7,8,9,10),
  partition p2 values in (default)
);
affected rows: 0
create unique index idx27_2 on t27(c3) global partition by list columns(c3)
(
  partition p0 values in ('0A','0B','0C','0D','0E'),
  partition p1 values in ('1A','1B','1C','1D','1E'),
  partition p2 values in (default)
);
affected rows: 0
EXPLAIN BASIC insert into t27 values (1,1,'0A'), (2,2,'0B'), (3,3,'0C'), (4,4,'0D'),
                       (6,6,'1A'), (7,7,'1B'), (8,8,'1C'), (9,9,'1D'),
                       (11,11,'2A'), (12,12,'2B'), (13,13,'2C'), (14,14,'2D');
Query Plan
============================
|ID|OPERATOR          |NAME|
----------------------------
|0 |DISTRIBUTED INSERT|    |
|1 |└─EXPRESSION      |    |
============================
Outputs & filters:
-------------------------------------
  0 - output(nil), filter(nil)
      columns([{t27: ({t27: (t27.c1, t27.c2, t27.c3)}, {idx27_1: (t27.c2, t27.c1)}, {idx27_2: (t27.c3, t27.c1)})}]), 
      column_values([column_conv(INT,PS:(11,0),NOT NULL,__values.c1)], [column_conv(INT,PS:(11,0),NULL,__values.c2)], [column_conv(VARCHAR,utf8mb4_general_ci,
      length:10,NULL,__values.c3)])
  1 - output([__values.c1], [__values.c2], [__values.c3]), filter(nil)
      values({1, 1, '0A'}, {2, 2, '0B'}, {3, 3, '0C'}, {4, 4, '0D'}, {6, 6, '1A'}, {7, 7, '1B'}, {8, 8, '1C'}, {9, 9, '1D'}, {11, 11, '2A'}, {12, 12, '2B'},
       {13, 13, '2C'}, {14, 14, '2D'})
affected rows: 15
insert into t27 values (1,1,'0A'), (2,2,'0B'), (3,3,'0C'), (4,4,'0D'),
                       (6,6,'1A'), (7,7,'1B'), (8,8,'1C'), (9,9,'1D'),
                       (11,11,'2A'), (12,12,'2B'), (13,13,'2C'), (14,14,'2D');
affected rows: 12
info: Records: 12  Duplicates: 0  Warnings: 0

create table t28 (c1 int primary key, c2 int, c3 varchar(10));
affected rows: 0
create unique index idx28_1 on t28(c2, c3) global partition by list columns(c2,c3)
(
  partition p0 values in ((1,'0A'),(2,'0B'),(3,'0C'),(4,'0D'),(5,'0E')),
  partition p1 values in ((6,'1A'),(7,'1B'),(8,'1C'),(9,'1D'),(10,'1E')),
  partition p2 values in (default)
);
affected rows: 0
EXPLAIN BASIC insert into t28 values (1,1,'0A'), (2,2,'0B'), (3,3,'0C'), (4,4,'0D'),
                       (6,6,'1A'), (7,7,'1B'), (8,8,'1C'), (9,9,'1D'),
                       (11,11,'2A'), (12,12,'2B'), (13,13,'2C'), (14,14,'2D');
Query Plan
============================
|ID|OPERATOR          |NAME|
----------------------------
|0 |DISTRIBUTED INSERT|    |
|1 |└─EXPRESSION      |    |
============================
Outputs & filters:
-------------------------------------
  0 - output(nil), filter(nil)
      columns([{t28: ({t28: (t28.c1, t28.c2, t28.c3)}, {idx28_1: (t28.c2, t28.c3, t28.c1)})}]), 
      column_values([column_conv(INT,PS:(11,0),NOT NULL,__values.c1)], [column_conv(INT,PS:(11,0),NULL,__values.c2)], [column_conv(VARCHAR,utf8mb4_general_ci,
      length:10,NULL,__values.c3)])
  1 - output([__values.c1], [__values.c2], [__values.c3]), filter(nil)
      values({1, 1, '0A'}, {2, 2, '0B'}, {3, 3, '0C'}, {4, 4, '0D'}, {6, 6, '1A'}, {7, 7, '1B'}, {8, 8, '1C'}, {9, 9, '1D'}, {11, 11, '2A'}, {12, 12, '2B'},
       {13, 13, '2C'}, {14, 14, '2D'})
affected rows: 15
insert into t28 values (1,1,'0A'), (2,2,'0B'), (3,3,'0C'), (4,4,'0D'),
                       (6,6,'1A'), (7,7,'1B'), (8,8,'1C'), (9,9,'1D'),
                       (11,11,'2A'), (12,12,'2B'), (13,13,'2C'), (14,14,'2D');
affected rows: 12
info: Records: 12  Duplicates: 0  Warnings: 0
## test selection from global index which has only one partition
EXPLAIN BASIC select /*+index(t1 gkey)*/ c2,c3,c4 from t1;
Query Plan
===================================
|ID|OPERATOR             |NAME    |
-----------------------------------
|0 |EXCHANGE IN REMOTE   |        |
|1 |└─EXCHANGE OUT REMOTE|        |
|2 |  └─TABLE FULL SCAN  |t1(gkey)|
===================================
Outputs & filters:
-------------------------------------
  0 - output([t1.c2], [t1.c3], [t1.c4]), filter(nil)
  1 - output([t1.c2], [t1.c3], [t1.c4]), filter(nil)
  2 - output([t1.c2], [t1.c3], [t1.c4]), filter(nil), rowset=16
      access([t1.c2], [t1.c3], [t1.c4]), partitions(p0)
      is_index_back=false, is_global_index=true, 
      range_key([t1.c2], [t1.c3], [t1.c4], [t1.c1]), range(MIN,MIN,MIN,MIN ; MAX,MAX,MAX,MAX)always true
affected rows: 15
select /*+index(t1 gkey)*/ c2,c3,c4 from t1;
+------+------+------+
| c2   | c3   | c4   |
+------+------+------+
|    1 |    1 |    1 |
|    2 |    2 |    2 |
|    3 |    3 |    3 |
|    4 |    4 |    4 |
+------+------+------+
affected rows: 4
EXPLAIN BASIC select /*+index(t1 gkey)*/ c2,c3,c4 from t1 where c2 = 1 or c3 = 2;
Query Plan
===================================
|ID|OPERATOR             |NAME    |
-----------------------------------
|0 |EXCHANGE IN REMOTE   |        |
|1 |└─EXCHANGE OUT REMOTE|        |
|2 |  └─TABLE FULL SCAN  |t1(gkey)|
===================================
Outputs & filters:
-------------------------------------
  0 - output([t1.c2], [t1.c3], [t1.c4]), filter(nil)
  1 - output([t1.c2], [t1.c3], [t1.c4]), filter(nil)
  2 - output([t1.c2], [t1.c3], [t1.c4]), filter([t1.c2 = 1 OR t1.c3 = 2]), rowset=16
      access([t1.c2], [t1.c3], [t1.c4]), partitions(p0)
      is_index_back=false, is_global_index=true, filter_before_indexback[false], 
      range_key([t1.c2], [t1.c3], [t1.c4], [t1.c1]), range(MIN,MIN,MIN,MIN ; MAX,MAX,MAX,MAX)always true
affected rows: 15
select /*+index(t1 gkey)*/ c2,c3,c4 from t1 where c2 = 1 or c3 = 2;
+------+------+------+
| c2   | c3   | c4   |
+------+------+------+
|    1 |    1 |    1 |
|    2 |    2 |    2 |
+------+------+------+
affected rows: 2
EXPLAIN BASIC select /*+index(t1 gkey)*/ c2,c3,c4 from t1 where c2 = 1 or c3 = 2 or c4 = 4;
Query Plan
===================================
|ID|OPERATOR             |NAME    |
-----------------------------------
|0 |EXCHANGE IN REMOTE   |        |
|1 |└─EXCHANGE OUT REMOTE|        |
|2 |  └─TABLE FULL SCAN  |t1(gkey)|
===================================
Outputs & filters:
-------------------------------------
  0 - output([t1.c2], [t1.c3], [t1.c4]), filter(nil)
  1 - output([t1.c2], [t1.c3], [t1.c4]), filter(nil)
  2 - output([t1.c2], [t1.c3], [t1.c4]), filter([(T_OP_OR, t1.c2 = 1, t1.c3 = 2, t1.c4 = 4)]), rowset=16
      access([t1.c2], [t1.c3], [t1.c4]), partitions(p0)
      is_index_back=false, is_global_index=true, filter_before_indexback[false], 
      range_key([t1.c2], [t1.c3], [t1.c4], [t1.c1]), range(MIN,MIN,MIN,MIN ; MAX,MAX,MAX,MAX)always true
affected rows: 15
select /*+index(t1 gkey)*/ c2,c3,c4 from t1 where c2 = 1 or c3 = 2 or c4 = 4;
+------+------+------+
| c2   | c3   | c4   |
+------+------+------+
|    1 |    1 |    1 |
|    2 |    2 |    2 |
|    4 |    4 |    4 |
+------+------+------+
affected rows: 3

## test selection from global index which has more than on partition
EXPLAIN BASIC select /*+index(t2 gkey)*/ c2,c3,c4 from t2;
Query Plan
=======================================
|ID|OPERATOR                 |NAME    |
---------------------------------------
|0 |PX COORDINATOR           |        |
|1 |└─EXCHANGE OUT DISTR     |:EX10000|
|2 |  └─PX PARTITION ITERATOR|        |
|3 |    └─TABLE FULL SCAN    |t2(gkey)|
=======================================
Outputs & filters:
-------------------------------------
  0 - output([INTERNAL_FUNCTION(t2.c2, t2.c3, t2.c4)]), filter(nil), rowset=16
  1 - output([INTERNAL_FUNCTION(t2.c2, t2.c3, t2.c4)]), filter(nil), rowset=16
      dop=1
  2 - output([t2.c2], [t2.c3], [t2.c4]), filter(nil), rowset=16
      force partition granule
  3 - output([t2.c2], [t2.c3], [t2.c4]), filter(nil), rowset=16
      access([t2.c2], [t2.c3], [t2.c4]), partitions(p[0-4])
      is_index_back=false, is_global_index=true, 
      range_key([t2.c2], [t2.c3], [t2.c4], [t2.c1]), range(MIN,MIN,MIN,MIN ; MAX,MAX,MAX,MAX)always true
affected rows: 19
select /*+index(t2 gkey)*/ c2,c3,c4 from t2;
+------+------+------+
| c2   | c3   | c4   |
+------+------+------+
|    5 |    5 |    5 |
|    1 |    1 |    1 |
|    2 |    2 |    2 |
|    3 |    3 |    3 |
|    4 |    4 |    4 |
+------+------+------+
affected rows: 5
EXPLAIN BASIC select /*+index(t2 gkey)*/ c2,c3,c4 from t2 where c2 = 1;
Query Plan
===================================
|ID|OPERATOR             |NAME    |
-----------------------------------
|0 |EXCHANGE IN REMOTE   |        |
|1 |└─EXCHANGE OUT REMOTE|        |
|2 |  └─TABLE RANGE SCAN |t2(gkey)|
===================================
Outputs & filters:
-------------------------------------
  0 - output([t2.c2], [t2.c3], [t2.c4]), filter(nil)
  1 - output([t2.c2], [t2.c3], [t2.c4]), filter(nil)
  2 - output([t2.c2], [t2.c3], [t2.c4]), filter(nil), rowset=16
      access([t2.c2], [t2.c3], [t2.c4]), partitions(p1)
      is_index_back=false, is_global_index=true, 
      range_key([t2.c2], [t2.c3], [t2.c4], [t2.c1]), range(1,MIN,MIN,MIN ; 1,MAX,MAX,MAX), 
      range_cond([t2.c2 = 1])
affected rows: 16
select /*+index(t2 gkey)*/ c2,c3,c4 from t2 where c2 = 1;
+------+------+------+
| c2   | c3   | c4   |
+------+------+------+
|    1 |    1 |    1 |
+------+------+------+
affected rows: 1
EXPLAIN BASIC select /*+index(t2 gkey)*/ c2,c3,c4 from t2 where c2 = 1 or c2 = 2;
Query Plan
=======================================
|ID|OPERATOR                 |NAME    |
---------------------------------------
|0 |PX COORDINATOR           |        |
|1 |└─EXCHANGE OUT DISTR     |:EX10000|
|2 |  └─PX PARTITION ITERATOR|        |
|3 |    └─TABLE RANGE SCAN   |t2(gkey)|
=======================================
Outputs & filters:
-------------------------------------
  0 - output([INTERNAL_FUNCTION(t2.c2, t2.c3, t2.c4)]), filter(nil), rowset=16
  1 - output([INTERNAL_FUNCTION(t2.c2, t2.c3, t2.c4)]), filter(nil), rowset=16
      dop=1
  2 - output([t2.c2], [t2.c3], [t2.c4]), filter(nil), rowset=16
      force partition granule
  3 - output([t2.c2], [t2.c3], [t2.c4]), filter(nil), rowset=16
      access([t2.c2], [t2.c3], [t2.c4]), partitions(p[1-2])
      is_index_back=false, is_global_index=true, 
      range_key([t2.c2], [t2.c3], [t2.c4], [t2.c1]), range(1,MIN,MIN,MIN ; 1,MAX,MAX,MAX), (2,MIN,MIN,MIN ; 2,MAX,MAX,MAX), 
      range_cond([t2.c2 = 1 OR t2.c2 = 2])
affected rows: 20
select /*+index(t2 gkey)*/ c2,c3,c4 from t2 where c2 = 1 or c2 = 2;
+------+------+------+
| c2   | c3   | c4   |
+------+------+------+
|    1 |    1 |    1 |
|    2 |    2 |    2 |
+------+------+------+
affected rows: 2
EXPLAIN BASIC select /*+index(t2 gkey)*/ c2,c3,c4 from t2 where c2 = 1 or c3 = 2;
Query Plan
=======================================
|ID|OPERATOR                 |NAME    |
---------------------------------------
|0 |PX COORDINATOR           |        |
|1 |└─EXCHANGE OUT DISTR     |:EX10000|
|2 |  └─PX PARTITION ITERATOR|        |
|3 |    └─TABLE FULL SCAN    |t2(gkey)|
=======================================
Outputs & filters:
-------------------------------------
  0 - output([INTERNAL_FUNCTION(t2.c2, t2.c3, t2.c4)]), filter(nil), rowset=16
  1 - output([INTERNAL_FUNCTION(t2.c2, t2.c3, t2.c4)]), filter(nil), rowset=16
      dop=1
  2 - output([t2.c2], [t2.c3], [t2.c4]), filter(nil), rowset=16
      force partition granule
  3 - output([t2.c2], [t2.c3], [t2.c4]), filter([t2.c2 = 1 OR t2.c3 = 2]), rowset=16
      access([t2.c2], [t2.c3], [t2.c4]), partitions(p[0-4])
      is_index_back=false, is_global_index=true, filter_before_indexback[false], 
      range_key([t2.c2], [t2.c3], [t2.c4], [t2.c1]), range(MIN,MIN,MIN,MIN ; MAX,MAX,MAX,MAX)always true
affected rows: 19
select /*+index(t2 gkey)*/ c2,c3,c4 from t2 where c2 = 1 or c3 = 2;
+------+------+------+
| c2   | c3   | c4   |
+------+------+------+
|    1 |    1 |    1 |
|    2 |    2 |    2 |
+------+------+------+
affected rows: 2
EXPLAIN BASIC select /*+index(t2 gkey)*/ c2,c3,c4 from t2 where c2 = 1 or c3 = 2 or c4 = 4;
Query Plan
=======================================
|ID|OPERATOR                 |NAME    |
---------------------------------------
|0 |PX COORDINATOR           |        |
|1 |└─EXCHANGE OUT DISTR     |:EX10000|
|2 |  └─PX PARTITION ITERATOR|        |
|3 |    └─TABLE FULL SCAN    |t2(gkey)|
=======================================
Outputs & filters:
-------------------------------------
  0 - output([INTERNAL_FUNCTION(t2.c2, t2.c3, t2.c4)]), filter(nil), rowset=16
  1 - output([INTERNAL_FUNCTION(t2.c2, t2.c3, t2.c4)]), filter(nil), rowset=16
      dop=1
  2 - output([t2.c2], [t2.c3], [t2.c4]), filter(nil), rowset=16
      force partition granule
  3 - output([t2.c2], [t2.c3], [t2.c4]), filter([(T_OP_OR, t2.c2 = 1, t2.c3 = 2, t2.c4 = 4)]), rowset=16
      access([t2.c2], [t2.c3], [t2.c4]), partitions(p[0-4])
      is_index_back=false, is_global_index=true, filter_before_indexback[false], 
      range_key([t2.c2], [t2.c3], [t2.c4], [t2.c1]), range(MIN,MIN,MIN,MIN ; MAX,MAX,MAX,MAX)always true
affected rows: 19
select /*+index(t2 gkey)*/ c2,c3,c4 from t2 where c2 = 1 or c3 = 2 or c4 = 4;
+------+------+------+
| c2   | c3   | c4   |
+------+------+------+
|    1 |    1 |    1 |
|    2 |    2 |    2 |
|    4 |    4 |    4 |
+------+------+------+
affected rows: 3

## build global index table with subpartition
EXPLAIN BASIC select /*+index(t3 primary)*/ * from t3;
Query Plan
=======================================
|ID|OPERATOR                 |NAME    |
---------------------------------------
|0 |PX COORDINATOR           |        |
|1 |└─EXCHANGE OUT DISTR     |:EX10000|
|2 |  └─PX PARTITION ITERATOR|        |
|3 |    └─TABLE FULL SCAN    |t3      |
=======================================
Outputs & filters:
-------------------------------------
  0 - output([INTERNAL_FUNCTION(t3.c1, t3.c2, t3.c3, t3.c4)]), filter(nil), rowset=16
  1 - output([INTERNAL_FUNCTION(t3.c1, t3.c2, t3.c3, t3.c4)]), filter(nil), rowset=16
      dop=1
  2 - output([t3.c1], [t3.c2], [t3.c3], [t3.c4]), filter(nil), rowset=16
      force partition granule
  3 - output([t3.c1], [t3.c2], [t3.c3], [t3.c4]), filter(nil), rowset=16
      access([t3.c1], [t3.c2], [t3.c3], [t3.c4]), partitions(p0sp[0-1], p1sp[0-1])
      is_index_back=false, is_global_index=false, 
      range_key([t3.c1], [t3.c2]), range(MIN,MIN ; MAX,MAX)always true
affected rows: 19
select /*+index(t3 primary)*/ * from t3;
+----+----+------+------+
| c1 | c2 | c3   | c4   |
+----+----+------+------+
|  2 |  2 |    2 |    2 |
|  1 |  1 |    1 |    1 |
|  3 |  3 |    3 |    3 |
+----+----+------+------+
affected rows: 3
EXPLAIN BASIC select /*+index(t3 i1)*/ * from t3;
Query Plan
=======================================
|ID|OPERATOR                   |NAME  |
---------------------------------------
|0 |DISTRIBUTED TABLE FULL SCAN|t3(i1)|
=======================================
Outputs & filters:
-------------------------------------
  0 - output([t3.c1], [t3.c2], [t3.c3], [t3.c4]), filter(nil), rowset=16
      access([t3.c1], [t3.c2], [t3.c3], [t3.c4]), partitions(p[0-1])
      is_index_back=true, is_global_index=true, 
      range_key([t3.c3], [t3.c1], [t3.c2]), range(MIN,MIN,MIN ; MAX,MAX,MAX)always true
affected rows: 11
select /*+index(t3 i1)*/ * from t3;
+----+----+------+------+
| c1 | c2 | c3   | c4   |
+----+----+------+------+
|  2 |  2 |    2 |    2 |
|  1 |  1 |    1 |    1 |
|  3 |  3 |    3 |    3 |
+----+----+------+------+
affected rows: 3
drop table t3;
affected rows: 0

EXPLAIN BASIC select /*+index(t4 primary)*/ * from t4;
Query Plan
=======================================
|ID|OPERATOR                 |NAME    |
---------------------------------------
|0 |PX COORDINATOR           |        |
|1 |└─EXCHANGE OUT DISTR     |:EX10000|
|2 |  └─PX PARTITION ITERATOR|        |
|3 |    └─TABLE FULL SCAN    |t4      |
=======================================
Outputs & filters:
-------------------------------------
  0 - output([INTERNAL_FUNCTION(t4.c1, t4.c2, t4.c3, t4.c4)]), filter(nil), rowset=16
  1 - output([INTERNAL_FUNCTION(t4.c1, t4.c2, t4.c3, t4.c4)]), filter(nil), rowset=16
      dop=1
  2 - output([t4.c1], [t4.c2], [t4.c3], [t4.c4]), filter(nil), rowset=16
      force partition granule
  3 - output([t4.c1], [t4.c2], [t4.c3], [t4.c4]), filter(nil), rowset=16
      access([t4.c1], [t4.c2], [t4.c3], [t4.c4]), partitions(p0sp[0-1], p1sp[0-1])
      is_index_back=false, is_global_index=false, 
      range_key([t4.c1], [t4.c2]), range(MIN,MIN ; MAX,MAX)always true
affected rows: 19
select /*+index(t4 primary)*/ * from t4;
+----+----+------+------+
| c1 | c2 | c3   | c4   |
+----+----+------+------+
|  2 |  2 |    2 |    2 |
|  1 |  1 |    1 |    1 |
|  3 |  3 |    3 |    3 |
+----+----+------+------+
affected rows: 3
EXPLAIN BASIC select /*+index(t4 i1)*/ * from t4;
Query Plan
=======================================
|ID|OPERATOR                   |NAME  |
---------------------------------------
|0 |DISTRIBUTED TABLE FULL SCAN|t4(i1)|
=======================================
Outputs & filters:
-------------------------------------
  0 - output([t4.c1], [t4.c2], [t4.c3], [t4.c4]), filter(nil), rowset=16
      access([t4.c1], [t4.c2], [t4.c3], [t4.c4]), partitions(p[0-1])
      is_index_back=true, is_global_index=true, 
      range_key([t4.c3], [t4.c1], [t4.c2]), range(MIN,MIN,MIN ; MAX,MAX,MAX)always true
affected rows: 11
select /*+index(t4 i1)*/ * from t4;
+----+----+------+------+
| c1 | c2 | c3   | c4   |
+----+----+------+------+
|  2 |  2 |    2 |    2 |
|  1 |  1 |    1 |    1 |
|  3 |  3 |    3 |    3 |
+----+----+------+------+
affected rows: 3
drop table t4;
affected rows: 0

## update global index
EXPLAIN BASIC select /*+index(t5 primary)*/ * from t5;
Query Plan
=======================================
|ID|OPERATOR                 |NAME    |
---------------------------------------
|0 |PX COORDINATOR           |        |
|1 |└─EXCHANGE OUT DISTR     |:EX10000|
|2 |  └─PX PARTITION ITERATOR|        |
|3 |    └─TABLE FULL SCAN    |t5      |
=======================================
Outputs & filters:
-------------------------------------
  0 - output([INTERNAL_FUNCTION(t5.a, t5.b, t5.c)]), filter(nil), rowset=16
  1 - output([INTERNAL_FUNCTION(t5.a, t5.b, t5.c)]), filter(nil), rowset=16
      dop=1
  2 - output([t5.a], [t5.b], [t5.c]), filter(nil), rowset=16
      force partition granule
  3 - output([t5.a], [t5.b], [t5.c]), filter(nil), rowset=16
      access([t5.a], [t5.b], [t5.c]), partitions(p[0-4])
      is_index_back=false, is_global_index=false, 
      range_key([t5.a]), range(MIN ; MAX)always true
affected rows: 19
select /*+index(t5 primary)*/ * from t5;
+---+------+------+
| a | b    | c    |
+---+------+------+
| 5 |    1 |    5 |
| 1 |    5 |    1 |
| 2 |    4 |    2 |
| 3 |    3 |    3 |
| 4 |    2 |    4 |
+---+------+------+
affected rows: 5
EXPLAIN BASIC update t5 set b=7, c=3 where a=2;
Query Plan
====================================
|ID|OPERATOR              |NAME    |
------------------------------------
|0 |DISTRIBUTED UPDATE    |        |
|1 |└─PX COORDINATOR      |        |
|2 |  └─EXCHANGE OUT DISTR|:EX10000|
|3 |    └─TABLE GET       |t5      |
====================================
Outputs & filters:
-------------------------------------
  0 - output(nil), filter(nil)
      table_columns([{t5: ({t5: (t5.a, t5.b, t5.c)}, {gkey: (t5.b, t5.a)})}]),
      update([t5.b=column_conv(INT,PS:(11,0),NULL,7)], [t5.c=column_conv(INT,PS:(11,0),NULL,3)])
  1 - output([t5.a], [t5.b], [t5.c]), filter(nil), rowset=16
  2 - output([t5.a], [t5.b], [t5.c]), filter(nil), rowset=16
      is_single, dop=1
  3 - output([t5.a], [t5.b], [t5.c]), filter(nil), rowset=16
      access([t5.a], [t5.b], [t5.c]), partitions(p2)
      is_index_back=false, is_global_index=false, 
      range_key([t5.a]), range[2 ; 2], 
      range_cond([t5.a = 2])
affected rows: 21
update t5 set b=7, c=3 where a=2;
affected rows: 1
info: Rows matched: 1  Changed: 1  Warnings: 0
EXPLAIN BASIC select /*+index(t5 gkey)*/ a, b from t5;
Query Plan
===================================
|ID|OPERATOR             |NAME    |
-----------------------------------
|0 |EXCHANGE IN REMOTE   |        |
|1 |└─EXCHANGE OUT REMOTE|        |
|2 |  └─TABLE FULL SCAN  |t5(gkey)|
===================================
Outputs & filters:
-------------------------------------
  0 - output([t5.a], [t5.b]), filter(nil)
  1 - output([t5.a], [t5.b]), filter(nil)
  2 - output([t5.a], [t5.b]), filter(nil), rowset=16
      access([t5.a], [t5.b]), partitions(p0)
      is_index_back=false, is_global_index=true, 
      range_key([t5.b], [t5.a]), range(MIN,MIN ; MAX,MAX)always true
affected rows: 15
select /*+index(t5 gkey)*/ a, b from t5;
+---+------+
| a | b    |
+---+------+
| 5 |    1 |
| 4 |    2 |
| 3 |    3 |
| 1 |    5 |
| 2 |    7 |
+---+------+
affected rows: 5
EXPLAIN BASIC select /*+index(t5 primary)*/ a, b, c from t5;
Query Plan
=======================================
|ID|OPERATOR                 |NAME    |
---------------------------------------
|0 |PX COORDINATOR           |        |
|1 |└─EXCHANGE OUT DISTR     |:EX10000|
|2 |  └─PX PARTITION ITERATOR|        |
|3 |    └─TABLE FULL SCAN    |t5      |
=======================================
Outputs & filters:
-------------------------------------
  0 - output([INTERNAL_FUNCTION(t5.a, t5.b, t5.c)]), filter(nil), rowset=16
  1 - output([INTERNAL_FUNCTION(t5.a, t5.b, t5.c)]), filter(nil), rowset=16
      dop=1
  2 - output([t5.a], [t5.b], [t5.c]), filter(nil), rowset=16
      force partition granule
  3 - output([t5.a], [t5.b], [t5.c]), filter(nil), rowset=16
      access([t5.a], [t5.b], [t5.c]), partitions(p[0-4])
      is_index_back=false, is_global_index=false, 
      range_key([t5.a]), range(MIN ; MAX)always true
affected rows: 19
select /*+index(t5 primary)*/ a, b, c from t5;
+---+------+------+
| a | b    | c    |
+---+------+------+
| 5 |    1 |    5 |
| 1 |    5 |    1 |
| 2 |    7 |    3 |
| 3 |    3 |    3 |
| 4 |    2 |    4 |
+---+------+------+
affected rows: 5
EXPLAIN BASIC update t5 set b=6, c=4 where a>0 and a<2;
Query Plan
====================================
|ID|OPERATOR              |NAME    |
------------------------------------
|0 |DISTRIBUTED UPDATE    |        |
|1 |└─PX COORDINATOR      |        |
|2 |  └─EXCHANGE OUT DISTR|:EX10000|
|3 |    └─TABLE RANGE SCAN|t5      |
====================================
Outputs & filters:
-------------------------------------
  0 - output(nil), filter(nil)
      table_columns([{t5: ({t5: (t5.a, t5.b, t5.c)}, {gkey: (t5.b, t5.a)})}]),
      update([t5.b=column_conv(INT,PS:(11,0),NULL,6)], [t5.c=column_conv(INT,PS:(11,0),NULL,4)])
  1 - output([t5.a], [t5.b], [t5.c]), filter(nil), rowset=16
  2 - output([t5.a], [t5.b], [t5.c]), filter(nil), rowset=16
      is_single, dop=1
  3 - output([t5.a], [t5.b], [t5.c]), filter(nil), rowset=16
      access([t5.a], [t5.b], [t5.c]), partitions(p1)
      is_index_back=false, is_global_index=false, 
      range_key([t5.a]), range(0 ; 2), 
      range_cond([t5.a > 0], [t5.a < 2])
affected rows: 21
update t5 set b=6, c=4 where a>0 and a<2;
affected rows: 1
info: Rows matched: 1  Changed: 1  Warnings: 0
EXPLAIN BASIC select /*+index(t5 gkey)*/ a, b from t5;
Query Plan
===================================
|ID|OPERATOR             |NAME    |
-----------------------------------
|0 |EXCHANGE IN REMOTE   |        |
|1 |└─EXCHANGE OUT REMOTE|        |
|2 |  └─TABLE FULL SCAN  |t5(gkey)|
===================================
Outputs & filters:
-------------------------------------
  0 - output([t5.a], [t5.b]), filter(nil)
  1 - output([t5.a], [t5.b]), filter(nil)
  2 - output([t5.a], [t5.b]), filter(nil), rowset=16
      access([t5.a], [t5.b]), partitions(p0)
      is_index_back=false, is_global_index=true, 
      range_key([t5.b], [t5.a]), range(MIN,MIN ; MAX,MAX)always true
affected rows: 15
select /*+index(t5 gkey)*/ a, b from t5;
+---+------+
| a | b    |
+---+------+
| 5 |    1 |
| 4 |    2 |
| 3 |    3 |
| 1 |    6 |
| 2 |    7 |
+---+------+
affected rows: 5
EXPLAIN BASIC select /*+index(t5 primary)*/ a, b, c from t5;
Query Plan
=======================================
|ID|OPERATOR                 |NAME    |
---------------------------------------
|0 |PX COORDINATOR           |        |
|1 |└─EXCHANGE OUT DISTR     |:EX10000|
|2 |  └─PX PARTITION ITERATOR|        |
|3 |    └─TABLE FULL SCAN    |t5      |
=======================================
Outputs & filters:
-------------------------------------
  0 - output([INTERNAL_FUNCTION(t5.a, t5.b, t5.c)]), filter(nil), rowset=16
  1 - output([INTERNAL_FUNCTION(t5.a, t5.b, t5.c)]), filter(nil), rowset=16
      dop=1
  2 - output([t5.a], [t5.b], [t5.c]), filter(nil), rowset=16
      force partition granule
  3 - output([t5.a], [t5.b], [t5.c]), filter(nil), rowset=16
      access([t5.a], [t5.b], [t5.c]), partitions(p[0-4])
      is_index_back=false, is_global_index=false, 
      range_key([t5.a]), range(MIN ; MAX)always true
affected rows: 19
select /*+index(t5 primary)*/ a, b, c from t5;
+---+------+------+
| a | b    | c    |
+---+------+------+
| 5 |    1 |    5 |
| 1 |    6 |    4 |
| 2 |    7 |    3 |
| 3 |    3 |    3 |
| 4 |    2 |    4 |
+---+------+------+
affected rows: 5
EXPLAIN BASIC insert into t5 values(8, 9, 10);
Query Plan
============================
|ID|OPERATOR          |NAME|
----------------------------
|0 |DISTRIBUTED INSERT|    |
|1 |└─EXPRESSION      |    |
============================
Outputs & filters:
-------------------------------------
  0 - output(nil), filter(nil)
      columns([{t5: ({t5: (t5.a, t5.b, t5.c)}, {gkey: (t5.b, t5.a)})}]), 
      column_values([column_conv(INT,PS:(11,0),NOT NULL,__values.a)], [column_conv(INT,PS:(11,0),NULL,__values.b)], [column_conv(INT,PS:(11,0),NULL,__values.c)])
  1 - output([__values.a], [__values.b], [__values.c]), filter(nil)
      values({8, 9, 10})
affected rows: 13
insert into t5 values(8, 9, 10);
affected rows: 1
EXPLAIN BASIC select /*+index(t5 primary)*/ * from t5;
Query Plan
=======================================
|ID|OPERATOR                 |NAME    |
---------------------------------------
|0 |PX COORDINATOR           |        |
|1 |└─EXCHANGE OUT DISTR     |:EX10000|
|2 |  └─PX PARTITION ITERATOR|        |
|3 |    └─TABLE FULL SCAN    |t5      |
=======================================
Outputs & filters:
-------------------------------------
  0 - output([INTERNAL_FUNCTION(t5.a, t5.b, t5.c)]), filter(nil), rowset=16
  1 - output([INTERNAL_FUNCTION(t5.a, t5.b, t5.c)]), filter(nil), rowset=16
      dop=1
  2 - output([t5.a], [t5.b], [t5.c]), filter(nil), rowset=16
      force partition granule
  3 - output([t5.a], [t5.b], [t5.c]), filter(nil), rowset=16
      access([t5.a], [t5.b], [t5.c]), partitions(p[0-4])
      is_index_back=false, is_global_index=false, 
      range_key([t5.a]), range(MIN ; MAX)always true
affected rows: 19
select /*+index(t5 primary)*/ * from t5;
+---+------+------+
| a | b    | c    |
+---+------+------+
| 5 |    1 |    5 |
| 1 |    6 |    4 |
| 2 |    7 |    3 |
| 3 |    3 |    3 |
| 8 |    9 |   10 |
| 4 |    2 |    4 |
+---+------+------+
affected rows: 6
EXPLAIN BASIC update t5 set b=7, c=3 where a=2;
Query Plan
====================================
|ID|OPERATOR              |NAME    |
------------------------------------
|0 |DISTRIBUTED UPDATE    |        |
|1 |└─PX COORDINATOR      |        |
|2 |  └─EXCHANGE OUT DISTR|:EX10000|
|3 |    └─TABLE GET       |t5      |
====================================
Outputs & filters:
-------------------------------------
  0 - output(nil), filter(nil)
      table_columns([{t5: ({t5: (t5.a, t5.b, t5.c)}, {gkey: (t5.b, t5.a)})}]),
      update([t5.b=column_conv(INT,PS:(11,0),NULL,7)], [t5.c=column_conv(INT,PS:(11,0),NULL,3)])
  1 - output([t5.a], [t5.b], [t5.c]), filter(nil), rowset=16
  2 - output([t5.a], [t5.b], [t5.c]), filter(nil), rowset=16
      is_single, dop=1
  3 - output([t5.a], [t5.b], [t5.c]), filter(nil), rowset=16
      access([t5.a], [t5.b], [t5.c]), partitions(p2)
      is_index_back=false, is_global_index=false, 
      range_key([t5.a]), range[2 ; 2], 
      range_cond([t5.a = 2])
affected rows: 21
update t5 set b=7, c=3 where a=2;
affected rows: 0
info: Rows matched: 1  Changed: 0  Warnings: 0
EXPLAIN BASIC update t5 set b=7 where b=5 or b=9;
Query Plan
============================================
|ID|OPERATOR                      |NAME    |
--------------------------------------------
|0 |DISTRIBUTED UPDATE            |        |
|1 |└─DISTRIBUTED TABLE RANGE SCAN|t5(gkey)|
============================================
Outputs & filters:
-------------------------------------
  0 - output(nil), filter(nil)
      table_columns([{t5: ({t5: (t5.a, t5.b, t5.c)}, {gkey: (t5.b, t5.a)})}]),
      update([t5.b=column_conv(INT,PS:(11,0),NULL,7)])
  1 - output([t5.a], [t5.b], [t5.c]), filter(nil), rowset=16
      access([t5.a], [t5.b], [t5.c]), partitions(p0)
      is_index_back=true, is_global_index=true, 
      range_key([t5.b], [t5.a]), range(5,MIN ; 5,MAX), (9,MIN ; 9,MAX), 
      range_cond([t5.b = 5 OR t5.b = 9])
affected rows: 16
update t5 set b=7 where b=5 or b=9;
affected rows: 1
info: Rows matched: 1  Changed: 1  Warnings: 0
EXPLAIN BASIC select /*+index(t5 gkey)*/ a, b from t5;
Query Plan
===================================
|ID|OPERATOR             |NAME    |
-----------------------------------
|0 |EXCHANGE IN REMOTE   |        |
|1 |└─EXCHANGE OUT REMOTE|        |
|2 |  └─TABLE FULL SCAN  |t5(gkey)|
===================================
Outputs & filters:
-------------------------------------
  0 - output([t5.a], [t5.b]), filter(nil)
  1 - output([t5.a], [t5.b]), filter(nil)
  2 - output([t5.a], [t5.b]), filter(nil), rowset=16
      access([t5.a], [t5.b]), partitions(p0)
      is_index_back=false, is_global_index=true, 
      range_key([t5.b], [t5.a]), range(MIN,MIN ; MAX,MAX)always true
affected rows: 15
select /*+index(t5 gkey)*/ a, b from t5;
+---+------+
| a | b    |
+---+------+
| 5 |    1 |
| 4 |    2 |
| 3 |    3 |
| 1 |    6 |
| 2 |    7 |
| 8 |    7 |
+---+------+
affected rows: 6
EXPLAIN BASIC select /*+index(t5 primary)*/ a, b, c from t5;
Query Plan
=======================================
|ID|OPERATOR                 |NAME    |
---------------------------------------
|0 |PX COORDINATOR           |        |
|1 |└─EXCHANGE OUT DISTR     |:EX10000|
|2 |  └─PX PARTITION ITERATOR|        |
|3 |    └─TABLE FULL SCAN    |t5      |
=======================================
Outputs & filters:
-------------------------------------
  0 - output([INTERNAL_FUNCTION(t5.a, t5.b, t5.c)]), filter(nil), rowset=16
  1 - output([INTERNAL_FUNCTION(t5.a, t5.b, t5.c)]), filter(nil), rowset=16
      dop=1
  2 - output([t5.a], [t5.b], [t5.c]), filter(nil), rowset=16
      force partition granule
  3 - output([t5.a], [t5.b], [t5.c]), filter(nil), rowset=16
      access([t5.a], [t5.b], [t5.c]), partitions(p[0-4])
      is_index_back=false, is_global_index=false, 
      range_key([t5.a]), range(MIN ; MAX)always true
affected rows: 19
select /*+index(t5 primary)*/ a, b, c from t5;
+---+------+------+
| a | b    | c    |
+---+------+------+
| 5 |    1 |    5 |
| 1 |    6 |    4 |
| 2 |    7 |    3 |
| 3 |    3 |    3 |
| 8 |    7 |   10 |
| 4 |    2 |    4 |
+---+------+------+
affected rows: 6
EXPLAIN BASIC update t5 set b=10 where b>4 and b<9;
Query Plan
============================================
|ID|OPERATOR                      |NAME    |
--------------------------------------------
|0 |DISTRIBUTED UPDATE            |        |
|1 |└─DISTRIBUTED TABLE RANGE SCAN|t5(gkey)|
============================================
Outputs & filters:
-------------------------------------
  0 - output(nil), filter(nil)
      table_columns([{t5: ({t5: (t5.a, t5.b, t5.c)}, {gkey: (t5.b, t5.a)})}]),
      update([t5.b=column_conv(INT,PS:(11,0),NULL,10)])
  1 - output([t5.a], [t5.b], [t5.c]), filter(nil), rowset=16
      access([t5.a], [t5.b], [t5.c]), partitions(p0)
      is_index_back=true, is_global_index=true, 
      range_key([t5.b], [t5.a]), range(4,MAX ; 9,MIN), 
      range_cond([t5.b > 4], [t5.b < 9])
affected rows: 16
update t5 set b=10 where b>4 and b<9;
affected rows: 3
info: Rows matched: 3  Changed: 3  Warnings: 0
EXPLAIN BASIC select /*+index(t5 gkey)*/ a, b from t5;
Query Plan
===================================
|ID|OPERATOR             |NAME    |
-----------------------------------
|0 |EXCHANGE IN REMOTE   |        |
|1 |└─EXCHANGE OUT REMOTE|        |
|2 |  └─TABLE FULL SCAN  |t5(gkey)|
===================================
Outputs & filters:
-------------------------------------
  0 - output([t5.a], [t5.b]), filter(nil)
  1 - output([t5.a], [t5.b]), filter(nil)
  2 - output([t5.a], [t5.b]), filter(nil), rowset=16
      access([t5.a], [t5.b]), partitions(p0)
      is_index_back=false, is_global_index=true, 
      range_key([t5.b], [t5.a]), range(MIN,MIN ; MAX,MAX)always true
affected rows: 15
select /*+index(t5 gkey)*/ a, b from t5;
+---+------+
| a | b    |
+---+------+
| 5 |    1 |
| 4 |    2 |
| 3 |    3 |
| 1 |   10 |
| 2 |   10 |
| 8 |   10 |
+---+------+
affected rows: 6
EXPLAIN BASIC select /*+index(t5 primary)*/ a, b, c from t5;
Query Plan
=======================================
|ID|OPERATOR                 |NAME    |
---------------------------------------
|0 |PX COORDINATOR           |        |
|1 |└─EXCHANGE OUT DISTR     |:EX10000|
|2 |  └─PX PARTITION ITERATOR|        |
|3 |    └─TABLE FULL SCAN    |t5      |
=======================================
Outputs & filters:
-------------------------------------
  0 - output([INTERNAL_FUNCTION(t5.a, t5.b, t5.c)]), filter(nil), rowset=16
  1 - output([INTERNAL_FUNCTION(t5.a, t5.b, t5.c)]), filter(nil), rowset=16
      dop=1
  2 - output([t5.a], [t5.b], [t5.c]), filter(nil), rowset=16
      force partition granule
  3 - output([t5.a], [t5.b], [t5.c]), filter(nil), rowset=16
      access([t5.a], [t5.b], [t5.c]), partitions(p[0-4])
      is_index_back=false, is_global_index=false, 
      range_key([t5.a]), range(MIN ; MAX)always true
affected rows: 19
select /*+index(t5 primary)*/ a, b, c from t5;
+---+------+------+
| a | b    | c    |
+---+------+------+
| 5 |    1 |    5 |
| 1 |   10 |    4 |
| 2 |   10 |    3 |
| 3 |    3 |    3 |
| 8 |   10 |   10 |
| 4 |    2 |    4 |
+---+------+------+
affected rows: 6
EXPLAIN BASIC update t5 set b=10;
Query Plan
=========================================
|ID|OPERATOR                   |NAME    |
-----------------------------------------
|0 |DISTRIBUTED UPDATE         |        |
|1 |└─PX COORDINATOR           |        |
|2 |  └─EXCHANGE OUT DISTR     |:EX10000|
|3 |    └─PX PARTITION ITERATOR|        |
|4 |      └─TABLE FULL SCAN    |t5      |
=========================================
Outputs & filters:
-------------------------------------
  0 - output(nil), filter(nil)
      table_columns([{t5: ({t5: (t5.a, t5.b, t5.c)}, {gkey: (t5.b, t5.a)})}]),
      update([t5.b=column_conv(INT,PS:(11,0),NULL,10)])
  1 - output([t5.a], [t5.b], [t5.c]), filter(nil), rowset=16
  2 - output([t5.a], [t5.b], [t5.c]), filter(nil), rowset=16
      dop=1
  3 - output([t5.a], [t5.b], [t5.c]), filter(nil), rowset=16
      force partition granule
  4 - output([t5.a], [t5.b], [t5.c]), filter(nil), rowset=16
      access([t5.a], [t5.b], [t5.c]), partitions(p[0-4])
      is_index_back=false, is_global_index=false, 
      range_key([t5.a]), range(MIN ; MAX)always true
affected rows: 23
update t5 set b=10;
affected rows: 3
info: Rows matched: 6  Changed: 3  Warnings: 0
EXPLAIN BASIC select /*+index(t5 gkey)*/ a, b from t5;
Query Plan
===================================
|ID|OPERATOR             |NAME    |
-----------------------------------
|0 |EXCHANGE IN REMOTE   |        |
|1 |└─EXCHANGE OUT REMOTE|        |
|2 |  └─TABLE FULL SCAN  |t5(gkey)|
===================================
Outputs & filters:
-------------------------------------
  0 - output([t5.a], [t5.b]), filter(nil)
  1 - output([t5.a], [t5.b]), filter(nil)
  2 - output([t5.a], [t5.b]), filter(nil), rowset=16
      access([t5.a], [t5.b]), partitions(p0)
      is_index_back=false, is_global_index=true, 
      range_key([t5.b], [t5.a]), range(MIN,MIN ; MAX,MAX)always true
affected rows: 15
select /*+index(t5 gkey)*/ a, b from t5;
+---+------+
| a | b    |
+---+------+
| 1 |   10 |
| 2 |   10 |
| 3 |   10 |
| 4 |   10 |
| 5 |   10 |
| 8 |   10 |
+---+------+
affected rows: 6
EXPLAIN BASIC select /*+index(t5 primary)*/ a, b, c from t5;
Query Plan
=======================================
|ID|OPERATOR                 |NAME    |
---------------------------------------
|0 |PX COORDINATOR           |        |
|1 |└─EXCHANGE OUT DISTR     |:EX10000|
|2 |  └─PX PARTITION ITERATOR|        |
|3 |    └─TABLE FULL SCAN    |t5      |
=======================================
Outputs & filters:
-------------------------------------
  0 - output([INTERNAL_FUNCTION(t5.a, t5.b, t5.c)]), filter(nil), rowset=16
  1 - output([INTERNAL_FUNCTION(t5.a, t5.b, t5.c)]), filter(nil), rowset=16
      dop=1
  2 - output([t5.a], [t5.b], [t5.c]), filter(nil), rowset=16
      force partition granule
  3 - output([t5.a], [t5.b], [t5.c]), filter(nil), rowset=16
      access([t5.a], [t5.b], [t5.c]), partitions(p[0-4])
      is_index_back=false, is_global_index=false, 
      range_key([t5.a]), range(MIN ; MAX)always true
affected rows: 19
select /*+index(t5 primary)*/ a, b, c from t5;
+---+------+------+
| a | b    | c    |
+---+------+------+
| 5 |   10 |    5 |
| 1 |   10 |    4 |
| 2 |   10 |    3 |
| 3 |   10 |    3 |
| 8 |   10 |   10 |
| 4 |   10 |    4 |
+---+------+------+
affected rows: 6
drop table t5;
affected rows: 0

##delete global index
EXPLAIN BASIC select /*+index(t6 primary)*/ * from t6;
Query Plan
=======================================
|ID|OPERATOR                 |NAME    |
---------------------------------------
|0 |PX COORDINATOR           |        |
|1 |└─EXCHANGE OUT DISTR     |:EX10000|
|2 |  └─PX PARTITION ITERATOR|        |
|3 |    └─TABLE FULL SCAN    |t6      |
=======================================
Outputs & filters:
-------------------------------------
  0 - output([INTERNAL_FUNCTION(t6.a, t6.b, t6.c)]), filter(nil), rowset=16
  1 - output([INTERNAL_FUNCTION(t6.a, t6.b, t6.c)]), filter(nil), rowset=16
      dop=1
  2 - output([t6.a], [t6.b], [t6.c]), filter(nil), rowset=16
      force partition granule
  3 - output([t6.a], [t6.b], [t6.c]), filter(nil), rowset=16
      access([t6.a], [t6.b], [t6.c]), partitions(p[0-4])
      is_index_back=false, is_global_index=false, 
      range_key([t6.a]), range(MIN ; MAX)always true
affected rows: 19
select /*+index(t6 primary)*/ * from t6;
+---+------+------+
| a | b    | c    |
+---+------+------+
| 5 |    1 |    5 |
| 1 |    5 |    1 |
| 2 |    4 |    2 |
| 3 |    3 |    3 |
| 4 |    2 |    4 |
+---+------+------+
affected rows: 5
EXPLAIN BASIC insert into t6 values(10, 100, 10);
Query Plan
============================
|ID|OPERATOR          |NAME|
----------------------------
|0 |DISTRIBUTED INSERT|    |
|1 |└─EXPRESSION      |    |
============================
Outputs & filters:
-------------------------------------
  0 - output(nil), filter(nil)
      columns([{t6: ({t6: (t6.a, t6.b, t6.c)}, {gkey: (t6.b, t6.a)})}]), 
      column_values([column_conv(INT,PS:(11,0),NOT NULL,__values.a)], [column_conv(INT,PS:(11,0),NULL,__values.b)], [column_conv(INT,PS:(11,0),NULL,__values.c)])
  1 - output([__values.a], [__values.b], [__values.c]), filter(nil)
      values({10, 100, 10})
affected rows: 13
insert into t6 values(10, 100, 10);
affected rows: 1
EXPLAIN BASIC update t6 set b=7 where a=1;
Query Plan
====================================
|ID|OPERATOR              |NAME    |
------------------------------------
|0 |DISTRIBUTED UPDATE    |        |
|1 |└─PX COORDINATOR      |        |
|2 |  └─EXCHANGE OUT DISTR|:EX10000|
|3 |    └─TABLE GET       |t6      |
====================================
Outputs & filters:
-------------------------------------
  0 - output(nil), filter(nil)
      table_columns([{t6: ({t6: (t6.a, t6.b, t6.c)}, {gkey: (t6.b, t6.a)})}]),
      update([t6.b=column_conv(INT,PS:(11,0),NULL,7)])
  1 - output([t6.a], [t6.b], [t6.c]), filter(nil), rowset=16
  2 - output([t6.a], [t6.b], [t6.c]), filter(nil), rowset=16
      is_single, dop=1
  3 - output([t6.a], [t6.b], [t6.c]), filter(nil), rowset=16
      access([t6.a], [t6.b], [t6.c]), partitions(p1)
      is_index_back=false, is_global_index=false, 
      range_key([t6.a]), range[1 ; 1], 
      range_cond([t6.a = 1])
affected rows: 21
update t6 set b=7 where a=1;
affected rows: 1
info: Rows matched: 1  Changed: 1  Warnings: 0
EXPLAIN BASIC select /*+index(t6 gkey)*/ a, b from t6;
Query Plan
===================================
|ID|OPERATOR             |NAME    |
-----------------------------------
|0 |EXCHANGE IN REMOTE   |        |
|1 |└─EXCHANGE OUT REMOTE|        |
|2 |  └─TABLE FULL SCAN  |t6(gkey)|
===================================
Outputs & filters:
-------------------------------------
  0 - output([t6.a], [t6.b]), filter(nil)
  1 - output([t6.a], [t6.b]), filter(nil)
  2 - output([t6.a], [t6.b]), filter(nil), rowset=16
      access([t6.a], [t6.b]), partitions(p0)
      is_index_back=false, is_global_index=true, 
      range_key([t6.b], [t6.a]), range(MIN,MIN ; MAX,MAX)always true
affected rows: 15
select /*+index(t6 gkey)*/ a, b from t6;
+----+------+
| a  | b    |
+----+------+
|  5 |    1 |
|  4 |    2 |
|  3 |    3 |
|  2 |    4 |
|  1 |    7 |
| 10 |  100 |
+----+------+
affected rows: 6
EXPLAIN BASIC update t6 set a=100 where b=2;
Query Plan
============================================
|ID|OPERATOR                      |NAME    |
--------------------------------------------
|0 |DISTRIBUTED UPDATE            |        |
|1 |└─DISTRIBUTED TABLE RANGE SCAN|t6(gkey)|
============================================
Outputs & filters:
-------------------------------------
  0 - output(nil), filter(nil)
      table_columns([{t6: ({t6: (t6.a, t6.b, t6.c)}, {gkey: (t6.b, t6.a)})}]),
      update([t6.a=column_conv(INT,PS:(11,0),NOT NULL,100)])
  1 - output([t6.a], [t6.b], [t6.c]), filter(nil), rowset=16
      access([t6.a], [t6.b], [t6.c]), partitions(p0)
      is_index_back=true, is_global_index=true, 
      range_key([t6.b], [t6.a]), range(2,MIN ; 2,MAX), 
      range_cond([t6.b = 2])
affected rows: 16
update t6 set a=100 where b=2;
affected rows: 1
info: Rows matched: 1  Changed: 1  Warnings: 0
EXPLAIN BASIC update t6 set b=19 where b=1;
Query Plan
============================================
|ID|OPERATOR                      |NAME    |
--------------------------------------------
|0 |DISTRIBUTED UPDATE            |        |
|1 |└─DISTRIBUTED TABLE RANGE SCAN|t6(gkey)|
============================================
Outputs & filters:
-------------------------------------
  0 - output(nil), filter(nil)
      table_columns([{t6: ({t6: (t6.a, t6.b, t6.c)}, {gkey: (t6.b, t6.a)})}]),
      update([t6.b=column_conv(INT,PS:(11,0),NULL,19)])
  1 - output([t6.a], [t6.b], [t6.c]), filter(nil), rowset=16
      access([t6.a], [t6.b], [t6.c]), partitions(p0)
      is_index_back=true, is_global_index=true, 
      range_key([t6.b], [t6.a]), range(1,MIN ; 1,MAX), 
      range_cond([t6.b = 1])
affected rows: 16
update t6 set b=19 where b=1;
affected rows: 1
info: Rows matched: 1  Changed: 1  Warnings: 0
EXPLAIN BASIC select /*+index(t6 gkey)*/ a, b from t6;
Query Plan
===================================
|ID|OPERATOR             |NAME    |
-----------------------------------
|0 |EXCHANGE IN REMOTE   |        |
|1 |└─EXCHANGE OUT REMOTE|        |
|2 |  └─TABLE FULL SCAN  |t6(gkey)|
===================================
Outputs & filters:
-------------------------------------
  0 - output([t6.a], [t6.b]), filter(nil)
  1 - output([t6.a], [t6.b]), filter(nil)
  2 - output([t6.a], [t6.b]), filter(nil), rowset=16
      access([t6.a], [t6.b]), partitions(p0)
      is_index_back=false, is_global_index=true, 
      range_key([t6.b], [t6.a]), range(MIN,MIN ; MAX,MAX)always true
affected rows: 15
select /*+index(t6 gkey)*/ a, b from t6;
+-----+------+
| a   | b    |
+-----+------+
| 100 |    2 |
|   3 |    3 |
|   2 |    4 |
|   1 |    7 |
|   5 |   19 |
|  10 |  100 |
+-----+------+
affected rows: 6
EXPLAIN BASIC update t6 set c=100 where b>=10;
Query Plan
============================================
|ID|OPERATOR                      |NAME    |
--------------------------------------------
|0 |DISTRIBUTED UPDATE            |        |
|1 |└─DISTRIBUTED TABLE RANGE SCAN|t6(gkey)|
============================================
Outputs & filters:
-------------------------------------
  0 - output(nil), filter(nil)
      table_columns([{t6: ({t6: (t6.a, t6.b, t6.c)})}]),
      update([t6.c=column_conv(INT,PS:(11,0),NULL,100)])
  1 - output([t6.a], [t6.c], [t6.b]), filter(nil), rowset=16
      access([t6.a], [t6.c], [t6.b]), partitions(p0)
      is_index_back=true, is_global_index=true, 
      range_key([t6.b], [t6.a]), range(10,MIN ; MAX,MAX), 
      range_cond([t6.b >= 10])
affected rows: 16
update t6 set c=100 where b>=10;
affected rows: 2
info: Rows matched: 2  Changed: 2  Warnings: 0
EXPLAIN BASIC select /*+index(t6 gkey)*/ a, b from t6;
Query Plan
===================================
|ID|OPERATOR             |NAME    |
-----------------------------------
|0 |EXCHANGE IN REMOTE   |        |
|1 |└─EXCHANGE OUT REMOTE|        |
|2 |  └─TABLE FULL SCAN  |t6(gkey)|
===================================
Outputs & filters:
-------------------------------------
  0 - output([t6.a], [t6.b]), filter(nil)
  1 - output([t6.a], [t6.b]), filter(nil)
  2 - output([t6.a], [t6.b]), filter(nil), rowset=16
      access([t6.a], [t6.b]), partitions(p0)
      is_index_back=false, is_global_index=true, 
      range_key([t6.b], [t6.a]), range(MIN,MIN ; MAX,MAX)always true
affected rows: 15
select /*+index(t6 gkey)*/ a, b from t6;
+-----+------+
| a   | b    |
+-----+------+
| 100 |    2 |
|   3 |    3 |
|   2 |    4 |
|   1 |    7 |
|   5 |   19 |
|  10 |  100 |
+-----+------+
affected rows: 6
EXPLAIN BASIC delete from t6 where a=1;
Query Plan
====================================
|ID|OPERATOR              |NAME    |
------------------------------------
|0 |DISTRIBUTED DELETE    |        |
|1 |└─PX COORDINATOR      |        |
|2 |  └─EXCHANGE OUT DISTR|:EX10000|
|3 |    └─TABLE GET       |t6      |
====================================
Outputs & filters:
-------------------------------------
  0 - output(nil), filter(nil)
      table_columns([{t6: ({t6: (t6.a, t6.b, t6.c)}, {gkey: (t6.b, t6.a)})}])
  1 - output([t6.a], [t6.b], [t6.c]), filter(nil), rowset=16
  2 - output([t6.a], [t6.b], [t6.c]), filter(nil), rowset=16
      is_single, dop=1
  3 - output([t6.a], [t6.b], [t6.c]), filter(nil), rowset=16
      access([t6.a], [t6.b], [t6.c]), partitions(p1)
      is_index_back=false, is_global_index=false, 
      range_key([t6.a]), range[1 ; 1], 
      range_cond([t6.a = 1])
affected rows: 20
delete from t6 where a=1;
affected rows: 1
EXPLAIN BASIC select /*+index(t6 gkey)*/ a, b from t6;
Query Plan
===================================
|ID|OPERATOR             |NAME    |
-----------------------------------
|0 |EXCHANGE IN REMOTE   |        |
|1 |└─EXCHANGE OUT REMOTE|        |
|2 |  └─TABLE FULL SCAN  |t6(gkey)|
===================================
Outputs & filters:
-------------------------------------
  0 - output([t6.a], [t6.b]), filter(nil)
  1 - output([t6.a], [t6.b]), filter(nil)
  2 - output([t6.a], [t6.b]), filter(nil), rowset=16
      access([t6.a], [t6.b]), partitions(p0)
      is_index_back=false, is_global_index=true, 
      range_key([t6.b], [t6.a]), range(MIN,MIN ; MAX,MAX)always true
affected rows: 15
select /*+index(t6 gkey)*/ a, b from t6;
+-----+------+
| a   | b    |
+-----+------+
| 100 |    2 |
|   3 |    3 |
|   2 |    4 |
|   5 |   19 |
|  10 |  100 |
+-----+------+
affected rows: 5
EXPLAIN BASIC delete from t6 where a=2 or a=3;
Query Plan
=========================================
|ID|OPERATOR                   |NAME    |
-----------------------------------------
|0 |DISTRIBUTED DELETE         |        |
|1 |└─PX COORDINATOR           |        |
|2 |  └─EXCHANGE OUT DISTR     |:EX10000|
|3 |    └─PX PARTITION ITERATOR|        |
|4 |      └─TABLE GET          |t6      |
=========================================
Outputs & filters:
-------------------------------------
  0 - output(nil), filter(nil)
      table_columns([{t6: ({t6: (t6.a, t6.b, t6.c)}, {gkey: (t6.b, t6.a)})}])
  1 - output([t6.a], [t6.b], [t6.c]), filter(nil), rowset=16
  2 - output([t6.a], [t6.b], [t6.c]), filter(nil), rowset=16
      dop=1
  3 - output([t6.a], [t6.b], [t6.c]), filter(nil), rowset=16
      force partition granule
  4 - output([t6.a], [t6.b], [t6.c]), filter(nil), rowset=16
      access([t6.a], [t6.b], [t6.c]), partitions(p[2-3])
      is_index_back=false, is_global_index=false, 
      range_key([t6.a]), range[2 ; 2], [3 ; 3], 
      range_cond([t6.a = 2 OR t6.a = 3])
affected rows: 23
delete from t6 where a=2 or a=3;
affected rows: 2
EXPLAIN BASIC select /*+index(t6 gkey)*/ a, b from t6;
Query Plan
===================================
|ID|OPERATOR             |NAME    |
-----------------------------------
|0 |EXCHANGE IN REMOTE   |        |
|1 |└─EXCHANGE OUT REMOTE|        |
|2 |  └─TABLE FULL SCAN  |t6(gkey)|
===================================
Outputs & filters:
-------------------------------------
  0 - output([t6.a], [t6.b]), filter(nil)
  1 - output([t6.a], [t6.b]), filter(nil)
  2 - output([t6.a], [t6.b]), filter(nil), rowset=16
      access([t6.a], [t6.b]), partitions(p0)
      is_index_back=false, is_global_index=true, 
      range_key([t6.b], [t6.a]), range(MIN,MIN ; MAX,MAX)always true
affected rows: 15
select /*+index(t6 gkey)*/ a, b from t6;
+-----+------+
| a   | b    |
+-----+------+
| 100 |    2 |
|   5 |   19 |
|  10 |  100 |
+-----+------+
affected rows: 3
EXPLAIN BASIC delete from t6 where b>=100;
Query Plan
============================================
|ID|OPERATOR                      |NAME    |
--------------------------------------------
|0 |DISTRIBUTED DELETE            |        |
|1 |└─DISTRIBUTED TABLE RANGE SCAN|t6(gkey)|
============================================
Outputs & filters:
-------------------------------------
  0 - output(nil), filter(nil)
      table_columns([{t6: ({t6: (t6.a, t6.b, t6.c)}, {gkey: (t6.b, t6.a)})}])
  1 - output([t6.a], [t6.b], [t6.c]), filter(nil), rowset=16
      access([t6.a], [t6.b], [t6.c]), partitions(p0)
      is_index_back=true, is_global_index=true, 
      range_key([t6.b], [t6.a]), range(100,MIN ; MAX,MAX), 
      range_cond([t6.b >= 100])
affected rows: 15
delete from t6 where b>=100;
affected rows: 1
EXPLAIN BASIC select /*+index(t6 gkey)*/ a, b from t6;
Query Plan
===================================
|ID|OPERATOR             |NAME    |
-----------------------------------
|0 |EXCHANGE IN REMOTE   |        |
|1 |└─EXCHANGE OUT REMOTE|        |
|2 |  └─TABLE FULL SCAN  |t6(gkey)|
===================================
Outputs & filters:
-------------------------------------
  0 - output([t6.a], [t6.b]), filter(nil)
  1 - output([t6.a], [t6.b]), filter(nil)
  2 - output([t6.a], [t6.b]), filter(nil), rowset=16
      access([t6.a], [t6.b]), partitions(p0)
      is_index_back=false, is_global_index=true, 
      range_key([t6.b], [t6.a]), range(MIN,MIN ; MAX,MAX)always true
affected rows: 15
select /*+index(t6 gkey)*/ a, b from t6;
+-----+------+
| a   | b    |
+-----+------+
| 100 |    2 |
|   5 |   19 |
+-----+------+
affected rows: 2
EXPLAIN BASIC delete from t6;
Query Plan
=========================================
|ID|OPERATOR                   |NAME    |
-----------------------------------------
|0 |DISTRIBUTED DELETE         |        |
|1 |└─PX COORDINATOR           |        |
|2 |  └─EXCHANGE OUT DISTR     |:EX10000|
|3 |    └─PX PARTITION ITERATOR|        |
|4 |      └─TABLE FULL SCAN    |t6      |
=========================================
Outputs & filters:
-------------------------------------
  0 - output(nil), filter(nil)
      table_columns([{t6: ({t6: (t6.a, t6.b, t6.c)}, {gkey: (t6.b, t6.a)})}])
  1 - output([t6.a], [t6.b], [t6.c]), filter(nil), rowset=16
  2 - output([t6.a], [t6.b], [t6.c]), filter(nil), rowset=16
      dop=1
  3 - output([t6.a], [t6.b], [t6.c]), filter(nil), rowset=16
      force partition granule
  4 - output([t6.a], [t6.b], [t6.c]), filter(nil), rowset=16
      access([t6.a], [t6.b], [t6.c]), partitions(p[0-4])
      is_index_back=false, is_global_index=false, 
      range_key([t6.a]), range(MIN ; MAX)always true
affected rows: 22
delete from t6;
affected rows: 2
EXPLAIN BASIC select /*+index(t6 primary)*/ * from t6;
Query Plan
=======================================
|ID|OPERATOR                 |NAME    |
---------------------------------------
|0 |PX COORDINATOR           |        |
|1 |└─EXCHANGE OUT DISTR     |:EX10000|
|2 |  └─PX PARTITION ITERATOR|        |
|3 |    └─TABLE FULL SCAN    |t6      |
=======================================
Outputs & filters:
-------------------------------------
  0 - output([INTERNAL_FUNCTION(t6.a, t6.b, t6.c)]), filter(nil), rowset=16
  1 - output([INTERNAL_FUNCTION(t6.a, t6.b, t6.c)]), filter(nil), rowset=16
      dop=1
  2 - output([t6.a], [t6.b], [t6.c]), filter(nil), rowset=16
      force partition granule
  3 - output([t6.a], [t6.b], [t6.c]), filter(nil), rowset=16
      access([t6.a], [t6.b], [t6.c]), partitions(p[0-4])
      is_index_back=false, is_global_index=false, 
      range_key([t6.a]), range(MIN ; MAX)always true
affected rows: 19
select /*+index(t6 primary)*/ * from t6;
+---+------+------+
| a | b    | c    |
+---+------+------+
+---+------+------+
affected rows: 0
EXPLAIN BASIC insert into t6 values(1, 1, 1), (5, 6, 2), (4, 2, 1);
Query Plan
============================
|ID|OPERATOR          |NAME|
----------------------------
|0 |DISTRIBUTED INSERT|    |
|1 |└─EXPRESSION      |    |
============================
Outputs & filters:
-------------------------------------
  0 - output(nil), filter(nil)
      columns([{t6: ({t6: (t6.a, t6.b, t6.c)}, {gkey: (t6.b, t6.a)})}]), 
      column_values([column_conv(INT,PS:(11,0),NOT NULL,__values.a)], [column_conv(INT,PS:(11,0),NULL,__values.b)], [column_conv(INT,PS:(11,0),NULL,__values.c)])
  1 - output([__values.a], [__values.b], [__values.c]), filter(nil)
      values({1, 1, 1}, {5, 6, 2}, {4, 2, 1})
affected rows: 13
insert into t6 values(1, 1, 1), (5, 6, 2), (4, 2, 1);
affected rows: 3
info: Records: 3  Duplicates: 0  Warnings: 0
EXPLAIN BASIC select /*+index(t6 primary)*/ * from t6;
Query Plan
=======================================
|ID|OPERATOR                 |NAME    |
---------------------------------------
|0 |PX COORDINATOR           |        |
|1 |└─EXCHANGE OUT DISTR     |:EX10000|
|2 |  └─PX PARTITION ITERATOR|        |
|3 |    └─TABLE FULL SCAN    |t6      |
=======================================
Outputs & filters:
-------------------------------------
  0 - output([INTERNAL_FUNCTION(t6.a, t6.b, t6.c)]), filter(nil), rowset=16
  1 - output([INTERNAL_FUNCTION(t6.a, t6.b, t6.c)]), filter(nil), rowset=16
      dop=1
  2 - output([t6.a], [t6.b], [t6.c]), filter(nil), rowset=16
      force partition granule
  3 - output([t6.a], [t6.b], [t6.c]), filter(nil), rowset=16
      access([t6.a], [t6.b], [t6.c]), partitions(p[0-4])
      is_index_back=false, is_global_index=false, 
      range_key([t6.a]), range(MIN ; MAX)always true
affected rows: 19
select /*+index(t6 primary)*/ * from t6;
+---+------+------+
| a | b    | c    |
+---+------+------+
| 5 |    6 |    2 |
| 1 |    1 |    1 |
| 4 |    2 |    1 |
+---+------+------+
affected rows: 3
EXPLAIN BASIC delete from t6 where b < 7 and b >1;
Query Plan
============================================
|ID|OPERATOR                      |NAME    |
--------------------------------------------
|0 |DISTRIBUTED DELETE            |        |
|1 |└─DISTRIBUTED TABLE RANGE SCAN|t6(gkey)|
============================================
Outputs & filters:
-------------------------------------
  0 - output(nil), filter(nil)
      table_columns([{t6: ({t6: (t6.a, t6.b, t6.c)}, {gkey: (t6.b, t6.a)})}])
  1 - output([t6.a], [t6.b], [t6.c]), filter(nil), rowset=16
      access([t6.a], [t6.b], [t6.c]), partitions(p0)
      is_index_back=true, is_global_index=true, 
      range_key([t6.b], [t6.a]), range(1,MAX ; 7,MIN), 
      range_cond([t6.b < 7], [t6.b > 1])
affected rows: 15
delete from t6 where b < 7 and b >1;
affected rows: 2
EXPLAIN BASIC select /*+index(t6 gkey)*/ a, b from t6;
Query Plan
===================================
|ID|OPERATOR             |NAME    |
-----------------------------------
|0 |EXCHANGE IN REMOTE   |        |
|1 |└─EXCHANGE OUT REMOTE|        |
|2 |  └─TABLE FULL SCAN  |t6(gkey)|
===================================
Outputs & filters:
-------------------------------------
  0 - output([t6.a], [t6.b]), filter(nil)
  1 - output([t6.a], [t6.b]), filter(nil)
  2 - output([t6.a], [t6.b]), filter(nil), rowset=16
      access([t6.a], [t6.b]), partitions(p0)
      is_index_back=false, is_global_index=true, 
      range_key([t6.b], [t6.a]), range(MIN,MIN ; MAX,MAX)always true
affected rows: 15
select /*+index(t6 gkey)*/ a, b from t6;
+---+------+
| a | b    |
+---+------+
| 1 |    1 |
+---+------+
affected rows: 1
EXPLAIN BASIC select /*+index(t6 primary)*/ a, b, c from t6;
Query Plan
=======================================
|ID|OPERATOR                 |NAME    |
---------------------------------------
|0 |PX COORDINATOR           |        |
|1 |└─EXCHANGE OUT DISTR     |:EX10000|
|2 |  └─PX PARTITION ITERATOR|        |
|3 |    └─TABLE FULL SCAN    |t6      |
=======================================
Outputs & filters:
-------------------------------------
  0 - output([INTERNAL_FUNCTION(t6.a, t6.b, t6.c)]), filter(nil), rowset=16
  1 - output([INTERNAL_FUNCTION(t6.a, t6.b, t6.c)]), filter(nil), rowset=16
      dop=1
  2 - output([t6.a], [t6.b], [t6.c]), filter(nil), rowset=16
      force partition granule
  3 - output([t6.a], [t6.b], [t6.c]), filter(nil), rowset=16
      access([t6.a], [t6.b], [t6.c]), partitions(p[0-4])
      is_index_back=false, is_global_index=false, 
      range_key([t6.a]), range(MIN ; MAX)always true
affected rows: 19
select /*+index(t6 primary)*/ a, b, c from t6;
+---+------+------+
| a | b    | c    |
+---+------+------+
| 1 |    1 |    1 |
+---+------+------+
affected rows: 1
drop table t6;
affected rows: 0

##update global index across global index partition
EXPLAIN BASIC select /*+index(t7 primary)*/ * from t7;
Query Plan
===============================
|ID|OPERATOR             |NAME|
-------------------------------
|0 |EXCHANGE IN REMOTE   |    |
|1 |└─EXCHANGE OUT REMOTE|    |
|2 |  └─TABLE FULL SCAN  |t7  |
===============================
Outputs & filters:
-------------------------------------
  0 - output([t7.a], [t7.b], [t7.c]), filter(nil)
  1 - output([t7.a], [t7.b], [t7.c]), filter(nil)
  2 - output([t7.a], [t7.b], [t7.c]), filter(nil), rowset=16
      access([t7.a], [t7.b], [t7.c]), partitions(p0)
      is_index_back=false, is_global_index=false, 
      range_key([t7.a]), range(MIN ; MAX)always true
affected rows: 15
select /*+index(t7 primary)*/ * from t7;
+---+------+------+
| a | b    | c    |
+---+------+------+
| 1 |    5 |    1 |
| 2 |    4 |    2 |
| 3 |    3 |    3 |
| 4 |    2 |    4 |
| 5 |    1 |    5 |
+---+------+------+
affected rows: 5
EXPLAIN BASIC update t7 set b=4;
Query Plan
====================================
|ID|OPERATOR              |NAME    |
------------------------------------
|0 |DISTRIBUTED UPDATE    |        |
|1 |└─PX COORDINATOR      |        |
|2 |  └─EXCHANGE OUT DISTR|:EX10000|
|3 |    └─TABLE FULL SCAN |t7      |
====================================
Outputs & filters:
-------------------------------------
  0 - output(nil), filter(nil)
      table_columns([{t7: ({t7: (t7.a, t7.b, t7.c)}, {gkey: (t7.b, t7.a)})}]),
      update([t7.b=column_conv(INT,PS:(11,0),NULL,4)])
  1 - output([t7.a], [t7.b], [t7.c]), filter(nil), rowset=16
  2 - output([t7.a], [t7.b], [t7.c]), filter(nil), rowset=16
      is_single, dop=1
  3 - output([t7.a], [t7.b], [t7.c]), filter(nil), rowset=16
      access([t7.a], [t7.b], [t7.c]), partitions(p0)
      is_index_back=false, is_global_index=false, 
      range_key([t7.a]), range(MIN ; MAX)always true
affected rows: 20
update t7 set b=4;
affected rows: 4
info: Rows matched: 5  Changed: 4  Warnings: 0
EXPLAIN BASIC select /*+index(t7 gkey)*/ a, b from t7;
Query Plan
=======================================
|ID|OPERATOR                 |NAME    |
---------------------------------------
|0 |PX COORDINATOR           |        |
|1 |└─EXCHANGE OUT DISTR     |:EX10000|
|2 |  └─PX PARTITION ITERATOR|        |
|3 |    └─TABLE FULL SCAN    |t7(gkey)|
=======================================
Outputs & filters:
-------------------------------------
  0 - output([INTERNAL_FUNCTION(t7.a, t7.b)]), filter(nil), rowset=16
  1 - output([INTERNAL_FUNCTION(t7.a, t7.b)]), filter(nil), rowset=16
      dop=1
  2 - output([t7.a], [t7.b]), filter(nil), rowset=16
      force partition granule
  3 - output([t7.a], [t7.b]), filter(nil), rowset=16
      access([t7.a], [t7.b]), partitions(p[0-4])
      is_index_back=false, is_global_index=true, 
      range_key([t7.b], [t7.a]), range(MIN,MIN ; MAX,MAX)always true
affected rows: 19
select /*+index(t7 gkey)*/ a, b from t7;
+---+------+
| a | b    |
+---+------+
| 1 |    4 |
| 2 |    4 |
| 3 |    4 |
| 4 |    4 |
| 5 |    4 |
+---+------+
affected rows: 5
EXPLAIN BASIC select /*+index(t7 primary)*/ a, b, c from t7;
Query Plan
===============================
|ID|OPERATOR             |NAME|
-------------------------------
|0 |EXCHANGE IN REMOTE   |    |
|1 |└─EXCHANGE OUT REMOTE|    |
|2 |  └─TABLE FULL SCAN  |t7  |
===============================
Outputs & filters:
-------------------------------------
  0 - output([t7.a], [t7.b], [t7.c]), filter(nil)
  1 - output([t7.a], [t7.b], [t7.c]), filter(nil)
  2 - output([t7.a], [t7.b], [t7.c]), filter(nil), rowset=16
      access([t7.a], [t7.b], [t7.c]), partitions(p0)
      is_index_back=false, is_global_index=false, 
      range_key([t7.a]), range(MIN ; MAX)always true
affected rows: 15
select /*+index(t7 primary)*/ a, b, c from t7;
+---+------+------+
| a | b    | c    |
+---+------+------+
| 1 |    4 |    1 |
| 2 |    4 |    2 |
| 3 |    4 |    3 |
| 4 |    4 |    4 |
| 5 |    4 |    5 |
+---+------+------+
affected rows: 5
drop table t7;
affected rows: 0

EXPLAIN BASIC select /*+index(t8 primary)*/ * from t8;
Query Plan
===============================
|ID|OPERATOR             |NAME|
-------------------------------
|0 |EXCHANGE IN REMOTE   |    |
|1 |└─EXCHANGE OUT REMOTE|    |
|2 |  └─TABLE FULL SCAN  |t8  |
===============================
Outputs & filters:
-------------------------------------
  0 - output([t8.a], [t8.b], [t8.c]), filter(nil)
  1 - output([t8.a], [t8.b], [t8.c]), filter(nil)
  2 - output([t8.a], [t8.b], [t8.c]), filter(nil), rowset=16
      access([t8.a], [t8.b], [t8.c]), partitions(p0)
      is_index_back=false, is_global_index=false, 
      range_key([t8.a]), range(MIN ; MAX)always true
affected rows: 15
select /*+index(t8 primary)*/ * from t8;
+---+------+------+
| a | b    | c    |
+---+------+------+
| 1 |    5 |    1 |
| 2 |    4 |    2 |
| 3 |    3 |    3 |
| 4 |    2 |    4 |
| 5 |    1 |    5 |
+---+------+------+
affected rows: 5
EXPLAIN BASIC update t8 set b=4 where b=4;
Query Plan
====================================
|ID|OPERATOR               |NAME   |
------------------------------------
|0 |DISTRIBUTED UPDATE     |       |
|1 |└─DISTRIBUTED TABLE GET|t8(guk)|
====================================
Outputs & filters:
-------------------------------------
  0 - output(nil), filter(nil)
      table_columns([{t8: ({t8: (t8.a, t8.b, t8.c)}, {guk: (t8.b, t8.a)})}]),
      update([t8.b=column_conv(INT,PS:(11,0),NULL,4)])
  1 - output([t8.a], [t8.b], [t8.c]), filter(nil), rowset=16
      access([t8.a], [t8.b], [t8.c]), partitions(p4)
      is_index_back=true, is_global_index=true, 
      range_key([t8.b], [t8.shadow_pk_0]), range[4,NULL ; 4,NULL], 
      range_cond([t8.b = 4])
affected rows: 16
update t8 set b=4 where b=4;
affected rows: 0
info: Rows matched: 1  Changed: 0  Warnings: 0
EXPLAIN BASIC select /*+index(t8 guk)*/ a, b from t8;
Query Plan
=======================================
|ID|OPERATOR                 |NAME    |
---------------------------------------
|0 |PX COORDINATOR           |        |
|1 |└─EXCHANGE OUT DISTR     |:EX10000|
|2 |  └─PX PARTITION ITERATOR|        |
|3 |    └─TABLE FULL SCAN    |t8(guk) |
=======================================
Outputs & filters:
-------------------------------------
  0 - output([INTERNAL_FUNCTION(t8.a, t8.b)]), filter(nil), rowset=16
  1 - output([INTERNAL_FUNCTION(t8.a, t8.b)]), filter(nil), rowset=16
      dop=1
  2 - output([t8.a], [t8.b]), filter(nil), rowset=16
      force partition granule
  3 - output([t8.a], [t8.b]), filter(nil), rowset=16
      access([t8.a], [t8.b]), partitions(p[0-4])
      is_index_back=false, is_global_index=true, 
      range_key([t8.b], [t8.shadow_pk_0]), range(MIN,MIN ; MAX,MAX)always true
affected rows: 19
select /*+index(t8 guk)*/ a, b from t8;
+---+------+
| a | b    |
+---+------+
| 1 |    5 |
| 5 |    1 |
| 4 |    2 |
| 3 |    3 |
| 2 |    4 |
+---+------+
affected rows: 5
EXPLAIN BASIC update t8 set b=10 where b=5;
Query Plan
====================================
|ID|OPERATOR               |NAME   |
------------------------------------
|0 |DISTRIBUTED UPDATE     |       |
|1 |└─DISTRIBUTED TABLE GET|t8(guk)|
====================================
Outputs & filters:
-------------------------------------
  0 - output(nil), filter(nil)
      table_columns([{t8: ({t8: (t8.a, t8.b, t8.c)}, {guk: (t8.b, t8.a)})}]),
      update([t8.b=column_conv(INT,PS:(11,0),NULL,10)])
  1 - output([t8.a], [t8.b], [t8.c]), filter(nil), rowset=16
      access([t8.a], [t8.b], [t8.c]), partitions(p0)
      is_index_back=true, is_global_index=true, 
      range_key([t8.b], [t8.shadow_pk_0]), range[5,NULL ; 5,NULL], 
      range_cond([t8.b = 5])
affected rows: 16
update t8 set b=10 where b=5;
affected rows: 1
info: Rows matched: 1  Changed: 1  Warnings: 0
EXPLAIN BASIC select /*+index(t8 guk)*/ a, b from t8;
Query Plan
=======================================
|ID|OPERATOR                 |NAME    |
---------------------------------------
|0 |PX COORDINATOR           |        |
|1 |└─EXCHANGE OUT DISTR     |:EX10000|
|2 |  └─PX PARTITION ITERATOR|        |
|3 |    └─TABLE FULL SCAN    |t8(guk) |
=======================================
Outputs & filters:
-------------------------------------
  0 - output([INTERNAL_FUNCTION(t8.a, t8.b)]), filter(nil), rowset=16
  1 - output([INTERNAL_FUNCTION(t8.a, t8.b)]), filter(nil), rowset=16
      dop=1
  2 - output([t8.a], [t8.b]), filter(nil), rowset=16
      force partition granule
  3 - output([t8.a], [t8.b]), filter(nil), rowset=16
      access([t8.a], [t8.b]), partitions(p[0-4])
      is_index_back=false, is_global_index=true, 
      range_key([t8.b], [t8.shadow_pk_0]), range(MIN,MIN ; MAX,MAX)always true
affected rows: 19
select /*+index(t8 guk)*/ a, b from t8;
+---+------+
| a | b    |
+---+------+
| 1 |   10 |
| 5 |    1 |
| 4 |    2 |
| 3 |    3 |
| 2 |    4 |
+---+------+
affected rows: 5
EXPLAIN BASIC update t8 set b=0 where a=1;
Query Plan
====================================
|ID|OPERATOR              |NAME    |
------------------------------------
|0 |DISTRIBUTED UPDATE    |        |
|1 |└─PX COORDINATOR      |        |
|2 |  └─EXCHANGE OUT DISTR|:EX10000|
|3 |    └─TABLE GET       |t8      |
====================================
Outputs & filters:
-------------------------------------
  0 - output(nil), filter(nil)
      table_columns([{t8: ({t8: (t8.a, t8.b, t8.c)}, {guk: (t8.b, t8.a)})}]),
      update([t8.b=column_conv(INT,PS:(11,0),NULL,0)])
  1 - output([t8.a], [t8.b], [t8.c]), filter(nil), rowset=16
  2 - output([t8.a], [t8.b], [t8.c]), filter(nil), rowset=16
      is_single, dop=1
  3 - output([t8.a], [t8.b], [t8.c]), filter(nil), rowset=16
      access([t8.a], [t8.b], [t8.c]), partitions(p0)
      is_index_back=false, is_global_index=false, 
      range_key([t8.a]), range[1 ; 1], 
      range_cond([t8.a = 1])
affected rows: 21
update t8 set b=0 where a=1;
affected rows: 1
info: Rows matched: 1  Changed: 1  Warnings: 0
EXPLAIN BASIC select /*+index(t8 guk)*/ a, b from t8;
Query Plan
=======================================
|ID|OPERATOR                 |NAME    |
---------------------------------------
|0 |PX COORDINATOR           |        |
|1 |└─EXCHANGE OUT DISTR     |:EX10000|
|2 |  └─PX PARTITION ITERATOR|        |
|3 |    └─TABLE FULL SCAN    |t8(guk) |
=======================================
Outputs & filters:
-------------------------------------
  0 - output([INTERNAL_FUNCTION(t8.a, t8.b)]), filter(nil), rowset=16
  1 - output([INTERNAL_FUNCTION(t8.a, t8.b)]), filter(nil), rowset=16
      dop=1
  2 - output([t8.a], [t8.b]), filter(nil), rowset=16
      force partition granule
  3 - output([t8.a], [t8.b]), filter(nil), rowset=16
      access([t8.a], [t8.b]), partitions(p[0-4])
      is_index_back=false, is_global_index=true, 
      range_key([t8.b], [t8.shadow_pk_0]), range(MIN,MIN ; MAX,MAX)always true
affected rows: 19
select /*+index(t8 guk)*/ a, b from t8;
+---+------+
| a | b    |
+---+------+
| 1 |    0 |
| 5 |    1 |
| 4 |    2 |
| 3 |    3 |
| 2 |    4 |
+---+------+
affected rows: 5
EXPLAIN BASIC update t8 set b=10 where b=4;
Query Plan
====================================
|ID|OPERATOR               |NAME   |
------------------------------------
|0 |DISTRIBUTED UPDATE     |       |
|1 |└─DISTRIBUTED TABLE GET|t8(guk)|
====================================
Outputs & filters:
-------------------------------------
  0 - output(nil), filter(nil)
      table_columns([{t8: ({t8: (t8.a, t8.b, t8.c)}, {guk: (t8.b, t8.a)})}]),
      update([t8.b=column_conv(INT,PS:(11,0),NULL,10)])
  1 - output([t8.a], [t8.b], [t8.c]), filter(nil), rowset=16
      access([t8.a], [t8.b], [t8.c]), partitions(p4)
      is_index_back=true, is_global_index=true, 
      range_key([t8.b], [t8.shadow_pk_0]), range[4,NULL ; 4,NULL], 
      range_cond([t8.b = 4])
affected rows: 16
update t8 set b=10 where b=4;
affected rows: 1
info: Rows matched: 1  Changed: 1  Warnings: 0
EXPLAIN BASIC delete from t8 where b=5 or b =0;
Query Plan
====================================
|ID|OPERATOR               |NAME   |
------------------------------------
|0 |DISTRIBUTED DELETE     |       |
|1 |└─DISTRIBUTED TABLE GET|t8(guk)|
====================================
Outputs & filters:
-------------------------------------
  0 - output(nil), filter(nil)
      table_columns([{t8: ({t8: (t8.a, t8.b, t8.c)}, {guk: (t8.b, t8.a)})}])
  1 - output([t8.a], [t8.b], [t8.c]), filter(nil), rowset=16
      access([t8.a], [t8.b], [t8.c]), partitions(p0)
      is_index_back=true, is_global_index=true, 
      range_key([t8.b], [t8.shadow_pk_0]), range[5,NULL ; 5,NULL], [0,NULL ; 0,NULL], 
      range_cond([t8.b = 5 OR t8.b = 0])
affected rows: 15
delete from t8 where b=5 or b =0;
affected rows: 1
EXPLAIN BASIC select /*+index(t8 guk)*/ a, b from t8;
Query Plan
=======================================
|ID|OPERATOR                 |NAME    |
---------------------------------------
|0 |PX COORDINATOR           |        |
|1 |└─EXCHANGE OUT DISTR     |:EX10000|
|2 |  └─PX PARTITION ITERATOR|        |
|3 |    └─TABLE FULL SCAN    |t8(guk) |
=======================================
Outputs & filters:
-------------------------------------
  0 - output([INTERNAL_FUNCTION(t8.a, t8.b)]), filter(nil), rowset=16
  1 - output([INTERNAL_FUNCTION(t8.a, t8.b)]), filter(nil), rowset=16
      dop=1
  2 - output([t8.a], [t8.b]), filter(nil), rowset=16
      force partition granule
  3 - output([t8.a], [t8.b]), filter(nil), rowset=16
      access([t8.a], [t8.b]), partitions(p[0-4])
      is_index_back=false, is_global_index=true, 
      range_key([t8.b], [t8.shadow_pk_0]), range(MIN,MIN ; MAX,MAX)always true
affected rows: 19
select /*+index(t8 guk)*/ a, b from t8;
+---+------+
| a | b    |
+---+------+
| 2 |   10 |
| 5 |    1 |
| 4 |    2 |
| 3 |    3 |
+---+------+
affected rows: 4
EXPLAIN BASIC delete from t8 where a=2;
Query Plan
====================================
|ID|OPERATOR              |NAME    |
------------------------------------
|0 |DISTRIBUTED DELETE    |        |
|1 |└─PX COORDINATOR      |        |
|2 |  └─EXCHANGE OUT DISTR|:EX10000|
|3 |    └─TABLE GET       |t8      |
====================================
Outputs & filters:
-------------------------------------
  0 - output(nil), filter(nil)
      table_columns([{t8: ({t8: (t8.a, t8.b, t8.c)}, {guk: (t8.b, t8.a)})}])
  1 - output([t8.a], [t8.b], [t8.c]), filter(nil), rowset=16
  2 - output([t8.a], [t8.b], [t8.c]), filter(nil), rowset=16
      is_single, dop=1
  3 - output([t8.a], [t8.b], [t8.c]), filter(nil), rowset=16
      access([t8.a], [t8.b], [t8.c]), partitions(p0)
      is_index_back=false, is_global_index=false, 
      range_key([t8.a]), range[2 ; 2], 
      range_cond([t8.a = 2])
affected rows: 20
delete from t8 where a=2;
affected rows: 1
EXPLAIN BASIC select /*+index(t8 guk)*/ a, b from t8;
Query Plan
=======================================
|ID|OPERATOR                 |NAME    |
---------------------------------------
|0 |PX COORDINATOR           |        |
|1 |└─EXCHANGE OUT DISTR     |:EX10000|
|2 |  └─PX PARTITION ITERATOR|        |
|3 |    └─TABLE FULL SCAN    |t8(guk) |
=======================================
Outputs & filters:
-------------------------------------
  0 - output([INTERNAL_FUNCTION(t8.a, t8.b)]), filter(nil), rowset=16
  1 - output([INTERNAL_FUNCTION(t8.a, t8.b)]), filter(nil), rowset=16
      dop=1
  2 - output([t8.a], [t8.b]), filter(nil), rowset=16
      force partition granule
  3 - output([t8.a], [t8.b]), filter(nil), rowset=16
      access([t8.a], [t8.b]), partitions(p[0-4])
      is_index_back=false, is_global_index=true, 
      range_key([t8.b], [t8.shadow_pk_0]), range(MIN,MIN ; MAX,MAX)always true
affected rows: 19
select /*+index(t8 guk)*/ a, b from t8;
+---+------+
| a | b    |
+---+------+
| 5 |    1 |
| 4 |    2 |
| 3 |    3 |
+---+------+
affected rows: 3
EXPLAIN BASIC insert into t8 values(2, 100, 1);
Query Plan
============================
|ID|OPERATOR          |NAME|
----------------------------
|0 |DISTRIBUTED INSERT|    |
|1 |└─EXPRESSION      |    |
============================
Outputs & filters:
-------------------------------------
  0 - output(nil), filter(nil)
      columns([{t8: ({t8: (t8.a, t8.b, t8.c)}, {guk: (t8.b, t8.a)})}]), 
      column_values([column_conv(INT,PS:(11,0),NOT NULL,__values.a)], [column_conv(INT,PS:(11,0),NULL,__values.b)], [column_conv(INT,PS:(11,0),NULL,__values.c)])
  1 - output([__values.a], [__values.b], [__values.c]), filter(nil)
      values({2, 100, 1})
affected rows: 13
insert into t8 values(2, 100, 1);
affected rows: 1
EXPLAIN BASIC select /*+index(t8 guk)*/ a, b from t8;
Query Plan
=======================================
|ID|OPERATOR                 |NAME    |
---------------------------------------
|0 |PX COORDINATOR           |        |
|1 |└─EXCHANGE OUT DISTR     |:EX10000|
|2 |  └─PX PARTITION ITERATOR|        |
|3 |    └─TABLE FULL SCAN    |t8(guk) |
=======================================
Outputs & filters:
-------------------------------------
  0 - output([INTERNAL_FUNCTION(t8.a, t8.b)]), filter(nil), rowset=16
  1 - output([INTERNAL_FUNCTION(t8.a, t8.b)]), filter(nil), rowset=16
      dop=1
  2 - output([t8.a], [t8.b]), filter(nil), rowset=16
      force partition granule
  3 - output([t8.a], [t8.b]), filter(nil), rowset=16
      access([t8.a], [t8.b]), partitions(p[0-4])
      is_index_back=false, is_global_index=true, 
      range_key([t8.b], [t8.shadow_pk_0]), range(MIN,MIN ; MAX,MAX)always true
affected rows: 19
select /*+index(t8 guk)*/ a, b from t8;
+---+------+
| a | b    |
+---+------+
| 2 |  100 |
| 5 |    1 |
| 4 |    2 |
| 3 |    3 |
+---+------+
affected rows: 4
EXPLAIN BASIC select /*+index(t8 primary)*/ * from t8;
Query Plan
===============================
|ID|OPERATOR             |NAME|
-------------------------------
|0 |EXCHANGE IN REMOTE   |    |
|1 |└─EXCHANGE OUT REMOTE|    |
|2 |  └─TABLE FULL SCAN  |t8  |
===============================
Outputs & filters:
-------------------------------------
  0 - output([t8.a], [t8.b], [t8.c]), filter(nil)
  1 - output([t8.a], [t8.b], [t8.c]), filter(nil)
  2 - output([t8.a], [t8.b], [t8.c]), filter(nil), rowset=16
      access([t8.a], [t8.b], [t8.c]), partitions(p0)
      is_index_back=false, is_global_index=false, 
      range_key([t8.a]), range(MIN ; MAX)always true
affected rows: 15
select /*+index(t8 primary)*/ * from t8;
+---+------+------+
| a | b    | c    |
+---+------+------+
| 2 |  100 |    1 |
| 3 |    3 |    3 |
| 4 |    2 |    4 |
| 5 |    1 |    5 |
+---+------+------+
affected rows: 4
EXPLAIN BASIC insert into t8 values(20, null, null);
Query Plan
============================
|ID|OPERATOR          |NAME|
----------------------------
|0 |DISTRIBUTED INSERT|    |
|1 |└─EXPRESSION      |    |
============================
Outputs & filters:
-------------------------------------
  0 - output(nil), filter(nil)
      columns([{t8: ({t8: (t8.a, t8.b, t8.c)}, {guk: (t8.b, t8.a)})}]), 
      column_values([column_conv(INT,PS:(11,0),NOT NULL,__values.a)], [column_conv(INT,PS:(11,0),NULL,__values.b)], [column_conv(INT,PS:(11,0),NULL,__values.c)])
  1 - output([__values.a], [__values.b], [__values.c]), filter(nil)
      values({20, NULL, NULL})
affected rows: 13
insert into t8 values(20, null, null);
affected rows: 1
EXPLAIN BASIC insert into t8 values(30, null, null);
Query Plan
============================
|ID|OPERATOR          |NAME|
----------------------------
|0 |DISTRIBUTED INSERT|    |
|1 |└─EXPRESSION      |    |
============================
Outputs & filters:
-------------------------------------
  0 - output(nil), filter(nil)
      columns([{t8: ({t8: (t8.a, t8.b, t8.c)}, {guk: (t8.b, t8.a)})}]), 
      column_values([column_conv(INT,PS:(11,0),NOT NULL,__values.a)], [column_conv(INT,PS:(11,0),NULL,__values.b)], [column_conv(INT,PS:(11,0),NULL,__values.c)])
  1 - output([__values.a], [__values.b], [__values.c]), filter(nil)
      values({30, NULL, NULL})
affected rows: 13
insert into t8 values(30, null, null);
affected rows: 1
EXPLAIN BASIC insert into t8 values(40, null, 1), (50, null, 2), (60, null, 3), (70, null, 4);
Query Plan
============================
|ID|OPERATOR          |NAME|
----------------------------
|0 |DISTRIBUTED INSERT|    |
|1 |└─EXPRESSION      |    |
============================
Outputs & filters:
-------------------------------------
  0 - output(nil), filter(nil)
      columns([{t8: ({t8: (t8.a, t8.b, t8.c)}, {guk: (t8.b, t8.a)})}]), 
      column_values([column_conv(INT,PS:(11,0),NOT NULL,__values.a)], [column_conv(INT,PS:(11,0),NULL,__values.b)], [column_conv(INT,PS:(11,0),NULL,__values.c)])
  1 - output([__values.a], [__values.b], [__values.c]), filter(nil)
      values({40, NULL, 1}, {50, NULL, 2}, {60, NULL, 3}, {70, NULL, 4})
affected rows: 13
insert into t8 values(40, null, 1), (50, null, 2), (60, null, 3), (70, null, 4);
affected rows: 4
info: Records: 4  Duplicates: 0  Warnings: 0
EXPLAIN BASIC select /*+index(t8 guk)*/ a, b from t8;
Query Plan
=======================================
|ID|OPERATOR                 |NAME    |
---------------------------------------
|0 |PX COORDINATOR           |        |
|1 |└─EXCHANGE OUT DISTR     |:EX10000|
|2 |  └─PX PARTITION ITERATOR|        |
|3 |    └─TABLE FULL SCAN    |t8(guk) |
=======================================
Outputs & filters:
-------------------------------------
  0 - output([INTERNAL_FUNCTION(t8.a, t8.b)]), filter(nil), rowset=16
  1 - output([INTERNAL_FUNCTION(t8.a, t8.b)]), filter(nil), rowset=16
      dop=1
  2 - output([t8.a], [t8.b]), filter(nil), rowset=16
      force partition granule
  3 - output([t8.a], [t8.b]), filter(nil), rowset=16
      access([t8.a], [t8.b]), partitions(p[0-4])
      is_index_back=false, is_global_index=true, 
      range_key([t8.b], [t8.shadow_pk_0]), range(MIN,MIN ; MAX,MAX)always true
affected rows: 19
select /*+index(t8 guk)*/ a, b from t8;
+----+------+
| a  | b    |
+----+------+
| 20 | NULL |
| 30 | NULL |
| 40 | NULL |
| 50 | NULL |
| 60 | NULL |
| 70 | NULL |
|  2 |  100 |
|  5 |    1 |
|  4 |    2 |
|  3 |    3 |
+----+------+
affected rows: 10
EXPLAIN BASIC select /*+index(t8 guk)*/ a, b from t8 where a=null;
Query Plan
========================================
|ID|OPERATOR                   |NAME   |
----------------------------------------
|0 |DISTRIBUTED TABLE FULL SCAN|t8(guk)|
========================================
Outputs & filters:
-------------------------------------
  0 - output([t8.a], [t8.b]), filter(nil), startup_filter([0]), rowset=16
      access([t8.a], [t8.b]), partitions(p0)
      is_index_back=false, is_global_index=true, 
      range_key([t8.b], [t8.shadow_pk_0]), range(MIN,MIN ; MAX,MAX)always true
affected rows: 11
select /*+index(t8 guk)*/ a, b from t8 where a=null;
+---+------+
| a | b    |
+---+------+
+---+------+
affected rows: 0
EXPLAIN BASIC select /*+index(t8 guk)*/ a, b from t8 where a is null;
Query Plan
========================================
|ID|OPERATOR                   |NAME   |
----------------------------------------
|0 |DISTRIBUTED TABLE FULL SCAN|t8(guk)|
========================================
Outputs & filters:
-------------------------------------
  0 - output([t8.a], [t8.b]), filter(nil), startup_filter([0]), rowset=16
      access([t8.a], [t8.b]), partitions(p0)
      is_index_back=false, is_global_index=true, 
      range_key([t8.b], [t8.shadow_pk_0]), range(MIN,MIN ; MAX,MAX)always true
affected rows: 11
select /*+index(t8 guk)*/ a, b from t8 where a is null;
+---+------+
| a | b    |
+---+------+
+---+------+
affected rows: 0
drop table t8;
affected rows: 0

EXPLAIN BASIC select /*+index(t9 gkey)*/ c2,c3,c4 from t9;
Query Plan
=========================================
|ID|OPERATOR                   |NAME    |
-----------------------------------------
|0 |DISTRIBUTED TABLE FULL SCAN|t9(gkey)|
=========================================
Outputs & filters:
-------------------------------------
  0 - output([t9.c2], [t9.c3], [t9.c4]), filter(nil), rowset=16
      access([t9.c1], [t9.c2], [t9.c3], [t9.c4]), partitions(p[0-4])
      is_index_back=true, is_global_index=true, 
      range_key([t9.c2], [t9.c3], [t9.c1]), range(MIN,MIN,MIN ; MAX,MAX,MAX)always true
affected rows: 11
select /*+index(t9 gkey)*/ c2,c3,c4 from t9;
+------+------+------+
| c2   | c3   | c4   |
+------+------+------+
|    1 |    1 |    1 |
|    2 |    2 |    2 |
|    3 |    3 |    3 |
|    4 |    4 |    4 |
|    5 |    5 |    5 |
+------+------+------+
affected rows: 5
drop table t9;
affected rows: 0

EXPLAIN BASIC select /*+index(t10 gkey)*/ c2,c3,c4 from t10;
Query Plan
==========================================
|ID|OPERATOR                   |NAME     |
------------------------------------------
|0 |DISTRIBUTED TABLE FULL SCAN|t10(gkey)|
==========================================
Outputs & filters:
-------------------------------------
  0 - output([t10.c2], [t10.c3], [t10.c4]), filter(nil), rowset=16
      access([t10.c1], [t10.c2], [t10.c3], [t10.c4]), partitions(p0)
      is_index_back=true, is_global_index=true, 
      range_key([t10.c2], [t10.c3], [t10.c1]), range(MIN,MIN,MIN ; MAX,MAX,MAX)always true
affected rows: 11
select /*+index(t10 gkey)*/ c2,c3,c4 from t10;
+------+------+------+
| c2   | c3   | c4   |
+------+------+------+
|    1 |    1 |    1 |
|    2 |    2 |    2 |
|    3 |    3 |    3 |
|    4 |    4 |    4 |
+------+------+------+
affected rows: 4
drop table t10;
affected rows: 0

EXPLAIN BASIC select /*+index(t11 gkey)*/ c2,c3,c4 from t11;
Query Plan
==========================================
|ID|OPERATOR                   |NAME     |
------------------------------------------
|0 |DISTRIBUTED TABLE FULL SCAN|t11(gkey)|
==========================================
Outputs & filters:
-------------------------------------
  0 - output([t11.c2], [t11.c3], [t11.c4]), filter(nil), rowset=16
      access([t11.c1], [t11.c2], [t11.c3], [t11.c4]), partitions(p[0-4])
      is_index_back=true, is_global_index=true, 
      range_key([t11.c2], [t11.c3], [t11.c1]), range(MIN,MIN,MIN ; MAX,MAX,MAX)always true
affected rows: 11
select /*+index(t11 gkey)*/ c2,c3,c4 from t11;
+------+------+------+
| c2   | c3   | c4   |
+------+------+------+
|    5 |    5 |    5 |
|    1 |    1 |    1 |
|    2 |    2 |    2 |
|    3 |    3 |    3 |
|    4 |    4 |    4 |
+------+------+------+
affected rows: 5
drop table t11;
affected rows: 0

EXPLAIN BASIC select /*+index(t12 gkey)*/ c2,c3,c4 from t12;
Query Plan
==========================================
|ID|OPERATOR                   |NAME     |
------------------------------------------
|0 |DISTRIBUTED TABLE FULL SCAN|t12(gkey)|
==========================================
Outputs & filters:
-------------------------------------
  0 - output([t12.c2], [t12.c3], [t12.c4]), filter(nil), rowset=16
      access([t12.c1], [t12.c2], [t12.c3], [t12.c4]), partitions(p[0-4])
      is_index_back=true, is_global_index=true, 
      range_key([t12.c2], [t12.c3], [t12.c1]), range(MIN,MIN,MIN ; MAX,MAX,MAX)always true
affected rows: 11
select /*+index(t12 gkey)*/ c2,c3,c4 from t12;
+------+------+------+
| c2   | c3   | c4   |
+------+------+------+
|    5 |    5 |    5 |
|    1 |    1 |    1 |
|    4 |    4 |    4 |
|    2 |    2 |    2 |
|    3 |    3 |    3 |
+------+------+------+
affected rows: 5
drop table t12;
affected rows: 0

EXPLAIN BASIC select /*+index(t13 gkey)*/ c2,c3,c4 from t13;
Query Plan
==========================================
|ID|OPERATOR                   |NAME     |
------------------------------------------
|0 |DISTRIBUTED TABLE FULL SCAN|t13(gkey)|
==========================================
Outputs & filters:
-------------------------------------
  0 - output([t13.c2], [t13.c3], [t13.c4]), filter(nil), rowset=16
      access([t13.c1], [t13.c2], [t13.c3], [t13.c4]), partitions(p[0-4])
      is_index_back=true, is_global_index=true, 
      range_key([t13.c2], [t13.c3], [t13.c1]), range(MIN,MIN,MIN ; MAX,MAX,MAX)always true
affected rows: 11
select /*+index(t13 gkey)*/ c2,c3,c4 from t13;
+------+------+------+
| c2   | c3   | c4   |
+------+------+------+
|    5 |    5 |    5 |
|    4 |    4 |    4 |
|    3 |    3 |    3 |
|    1 |    1 |    1 |
|    2 |    2 |    2 |
+------+------+------+
affected rows: 5
drop table t13;
affected rows: 0

EXPLAIN BASIC select * from t14;
Query Plan
=======================================
|ID|OPERATOR                 |NAME    |
---------------------------------------
|0 |PX COORDINATOR           |        |
|1 |└─EXCHANGE OUT DISTR     |:EX10000|
|2 |  └─PX PARTITION ITERATOR|        |
|3 |    └─TABLE FULL SCAN    |t14     |
=======================================
Outputs & filters:
-------------------------------------
  0 - output([INTERNAL_FUNCTION(t14.a, t14.b)]), filter(nil), rowset=16
  1 - output([INTERNAL_FUNCTION(t14.a, t14.b)]), filter(nil), rowset=16
      dop=1
  2 - output([t14.a], [t14.b]), filter(nil), rowset=16
      force partition granule
  3 - output([t14.a], [t14.b]), filter(nil), rowset=16
      access([t14.a], [t14.b]), partitions(p[0-4])
      is_index_back=false, is_global_index=false, 
      range_key([t14.a]), range(MIN ; MAX)always true
affected rows: 19
select * from t14;
+---+------+
| a | b    |
+---+------+
| 1 |    1 |
| 2 |    2 |
| 3 |    3 |
| 4 |    4 |
+---+------+
affected rows: 4
EXPLAIN BASIC select * from t15;
Query Plan
=======================================
|ID|OPERATOR                 |NAME    |
---------------------------------------
|0 |PX COORDINATOR           |        |
|1 |└─EXCHANGE OUT DISTR     |:EX10000|
|2 |  └─PX PARTITION ITERATOR|        |
|3 |    └─TABLE FULL SCAN    |t15     |
=======================================
Outputs & filters:
-------------------------------------
  0 - output([INTERNAL_FUNCTION(t15.a, t15.b)]), filter(nil), rowset=16
  1 - output([INTERNAL_FUNCTION(t15.a, t15.b)]), filter(nil), rowset=16
      dop=1
  2 - output([t15.a], [t15.b]), filter(nil), rowset=16
      force partition granule
  3 - output([t15.a], [t15.b]), filter(nil), rowset=16
      access([t15.a], [t15.b]), partitions(p[0-4])
      is_index_back=false, is_global_index=false, 
      range_key([t15.a]), range(MIN ; MAX)always true
affected rows: 19
select * from t15;
+---+------+
| a | b    |
+---+------+
| 1 |    1 |
| 2 |    2 |
| 3 |    3 |
+---+------+
affected rows: 3
EXPLAIN BASIC update t14 set b=100 where a in (select a from t15);
Query Plan
=======================================
|ID|OPERATOR                 |NAME    |
---------------------------------------
|0 |PX COORDINATOR           |        |
|1 |└─EXCHANGE OUT DISTR     |:EX10000|
|2 |  └─PX PARTITION ITERATOR|        |
|3 |    └─UPDATE             |        |
|4 |      └─MERGE JOIN       |        |
|5 |        ├─TABLE FULL SCAN|t15     |
|6 |        └─TABLE FULL SCAN|t14     |
=======================================
Outputs & filters:
-------------------------------------
  0 - output(nil), filter(nil), rowset=16
  1 - output(nil), filter(nil), rowset=16
      dop=1
  2 - output(nil), filter(nil), rowset=16
      partition wise, force partition granule
  3 - output(nil), filter(nil)
      table_columns([{t14: ({t14: (t14.a, t14.b)})}]),
      update([t14.b=column_conv(INT,PS:(11,0),NULL,100)])
  4 - output([t14.a], [t14.b]), filter(nil), rowset=16
      equal_conds([t14.a = t15.a]), other_conds(nil)
      merge_directions([ASC])
  5 - output([t15.a]), filter(nil), rowset=16
      access([t15.a]), partitions(p[0-4])
      is_index_back=false, is_global_index=false, 
      range_key([t15.a]), range(MIN ; MAX)always true
  6 - output([t14.a], [t14.b]), filter(nil), rowset=16
      access([t14.a], [t14.b]), partitions(p[0-4])
      is_index_back=false, is_global_index=false, 
      range_key([t14.a]), range(MIN ; MAX)always true
affected rows: 32
update t14 set b=100 where a in (select a from t15);
affected rows: 3
info: Rows matched: 3  Changed: 3  Warnings: 0
EXPLAIN BASIC select * from t14;
Query Plan
=======================================
|ID|OPERATOR                 |NAME    |
---------------------------------------
|0 |PX COORDINATOR           |        |
|1 |└─EXCHANGE OUT DISTR     |:EX10000|
|2 |  └─PX PARTITION ITERATOR|        |
|3 |    └─TABLE FULL SCAN    |t14     |
=======================================
Outputs & filters:
-------------------------------------
  0 - output([INTERNAL_FUNCTION(t14.a, t14.b)]), filter(nil), rowset=16
  1 - output([INTERNAL_FUNCTION(t14.a, t14.b)]), filter(nil), rowset=16
      dop=1
  2 - output([t14.a], [t14.b]), filter(nil), rowset=16
      force partition granule
  3 - output([t14.a], [t14.b]), filter(nil), rowset=16
      access([t14.a], [t14.b]), partitions(p[0-4])
      is_index_back=false, is_global_index=false, 
      range_key([t14.a]), range(MIN ; MAX)always true
affected rows: 19
select * from t14;
+---+------+
| a | b    |
+---+------+
| 1 |  100 |
| 2 |  100 |
| 3 |  100 |
| 4 |    4 |
+---+------+
affected rows: 4
EXPLAIN BASIC update t14 set b=b-10 where a in (select a from t15 where t14.a=1);
Query Plan
===========================================
|ID|OPERATOR                         |NAME|
-------------------------------------------
|0 |EXCHANGE IN REMOTE               |    |
|1 |└─EXCHANGE OUT REMOTE            |    |
|2 |  └─UPDATE                       |    |
|3 |    └─NESTED-LOOP JOIN CARTESIAN |    |
|4 |      ├─TABLE GET                |t14 |
|5 |      └─TABLE GET                |t15 |
===========================================
Outputs & filters:
-------------------------------------
  0 - output(nil), filter(nil)
  1 - output(nil), filter(nil)
  2 - output(nil), filter(nil)
      table_columns([{t14: ({t14: (t14.a, t14.b)})}]),
      update([t14.b=column_conv(INT,PS:(11,0),NULL,cast(t14.b + -10, INT(-1, 0)))])
  3 - output([t14.a], [t14.b]), filter(nil), rowset=16
      conds(nil), nl_params_(nil), use_batch=false
  4 - output([t14.a], [t14.b]), filter(nil), rowset=16
      access([t14.a], [t14.b]), partitions(p1)
      is_index_back=false, is_global_index=false, 
      range_key([t14.a]), range[1 ; 1], 
      range_cond([t14.a = 1])
  5 - output(nil), filter(nil), rowset=16
      access(nil), partitions(p1)
      is_index_back=false, is_global_index=false, 
      range_key([t15.a]), range[1 ; 1], 
      range_cond([t15.a = 1])
affected rows: 29
update t14 set b=b-10 where a in (select a from t15 where t14.a=1);
affected rows: 1
info: Rows matched: 1  Changed: 1  Warnings: 0
EXPLAIN BASIC select * from t14;
Query Plan
=======================================
|ID|OPERATOR                 |NAME    |
---------------------------------------
|0 |PX COORDINATOR           |        |
|1 |└─EXCHANGE OUT DISTR     |:EX10000|
|2 |  └─PX PARTITION ITERATOR|        |
|3 |    └─TABLE FULL SCAN    |t14     |
=======================================
Outputs & filters:
-------------------------------------
  0 - output([INTERNAL_FUNCTION(t14.a, t14.b)]), filter(nil), rowset=16
  1 - output([INTERNAL_FUNCTION(t14.a, t14.b)]), filter(nil), rowset=16
      dop=1
  2 - output([t14.a], [t14.b]), filter(nil), rowset=16
      force partition granule
  3 - output([t14.a], [t14.b]), filter(nil), rowset=16
      access([t14.a], [t14.b]), partitions(p[0-4])
      is_index_back=false, is_global_index=false, 
      range_key([t14.a]), range(MIN ; MAX)always true
affected rows: 19
select * from t14;
+---+------+
| a | b    |
+---+------+
| 1 |   90 |
| 2 |  100 |
| 3 |  100 |
| 4 |    4 |
+---+------+
affected rows: 4
EXPLAIN BASIC update t14 set b=(select b from t15 where t14.b=t15.b+86) where a in (select a from t15);
Query Plan
===================================================
|ID|OPERATOR                             |NAME    |
---------------------------------------------------
|0 |PX COORDINATOR                       |        |
|1 |└─EXCHANGE OUT DISTR                 |:EX10000|
|2 |  └─PX PARTITION ITERATOR            |        |
|3 |    └─UPDATE                         |        |
|4 |      └─SUBPLAN FILTER               |        |
|5 |        ├─MERGE JOIN                 |        |
|6 |        │ ├─TABLE FULL SCAN          |t15     |
|7 |        │ └─TABLE FULL SCAN          |t14     |
|8 |        └─DISTRIBUTED TABLE FULL SCAN|t15     |
===================================================
Outputs & filters:
-------------------------------------
  0 - output(nil), filter(nil), rowset=16
  1 - output(nil), filter(nil), rowset=16
      dop=1
  2 - output(nil), filter(nil), rowset=16
      partition wise, force partition granule
  3 - output(nil), filter(nil)
      table_columns([{t14: ({t14: (t14.a, t14.b)})}]),
      update([t14.b=column_conv(INT,PS:(11,0),NULL,subquery(1))])
  4 - output([t14.a], [t14.b], [subquery(1)]), filter(nil), rowset=16
      exec_params_([t14.b(:0)]), onetime_exprs_(nil), init_plan_idxs_(nil), use_batch=false
  5 - output([t14.a], [t14.b]), filter(nil), rowset=16
      equal_conds([t14.a = t15.a]), other_conds(nil)
      merge_directions([ASC])
  6 - output([t15.a]), filter(nil), rowset=16
      access([t15.a]), partitions(p[0-4])
      is_index_back=false, is_global_index=false, 
      range_key([t15.a]), range(MIN ; MAX)always true
  7 - output([t14.a], [t14.b]), filter(nil), rowset=16
      access([t14.a], [t14.b]), partitions(p[0-4])
      is_index_back=false, is_global_index=false, 
      range_key([t14.a]), range(MIN ; MAX)always true
  8 - output([t15.b]), filter([:0 = t15.b + 86]), rowset=16
      access([t15.b]), partitions(p[0-4])
      is_index_back=false, is_global_index=false, filter_before_indexback[false], 
      range_key([t15.a]), range(MIN ; MAX)always true
affected rows: 40
update t14 set b=(select b from t15 where t14.b=t15.b+86) where a in (select a from t15);
affected rows: 3
info: Rows matched: 3  Changed: 3  Warnings: 0
EXPLAIN BASIC update t14 set b=(select b from t15 where t15.b=4) where a in (select a from t15);
Query Plan
===========================================
|ID|OPERATOR                     |NAME    |
-------------------------------------------
|0 |DISTRIBUTED UPDATE           |        |
|1 |└─SUBPLAN FILTER             |        |
|2 |  ├─PX COORDINATOR           |        |
|3 |  │ └─EXCHANGE OUT DISTR     |:EX10000|
|4 |  │   └─PX PARTITION ITERATOR|        |
|5 |  │     └─MERGE JOIN         |        |
|6 |  │       ├─TABLE FULL SCAN  |t15     |
|7 |  │       └─TABLE FULL SCAN  |t14     |
|8 |  └─PX COORDINATOR           |        |
|9 |    └─EXCHANGE OUT DISTR     |:EX20000|
|10|      └─PX PARTITION ITERATOR|        |
|11|        └─TABLE FULL SCAN    |t15     |
===========================================
Outputs & filters:
-------------------------------------
  0 - output(nil), filter(nil)
      table_columns([{t14: ({t14: (t14.a, t14.b)})}]),
      update([t14.b=column_conv(INT,PS:(11,0),NULL,:0)])
  1 - output([t14.a], [t14.b], [:0]), filter(nil), rowset=16
      exec_params_(nil), onetime_exprs_([subquery(1)(:0)]), init_plan_idxs_(nil), use_batch=false
  2 - output([t14.a], [t14.b]), filter(nil), rowset=16
  3 - output([t14.a], [t14.b]), filter(nil), rowset=16
      dop=1
  4 - output([t14.a], [t14.b]), filter(nil), rowset=16
      partition wise, force partition granule
  5 - output([t14.a], [t14.b]), filter(nil), rowset=16
      equal_conds([t14.a = t15.a]), other_conds(nil)
      merge_directions([ASC])
  6 - output([t15.a]), filter(nil), rowset=16
      access([t15.a]), partitions(p[0-4])
      is_index_back=false, is_global_index=false, 
      range_key([t15.a]), range(MIN ; MAX)always true
  7 - output([t14.a], [t14.b]), filter(nil), rowset=16
      access([t14.a], [t14.b]), partitions(p[0-4])
      is_index_back=false, is_global_index=false, 
      range_key([t14.a]), range(MIN ; MAX)always true
  8 - output([t15.b]), filter(nil), rowset=16
  9 - output([t15.b]), filter(nil), rowset=16
      dop=1
 10 - output([t15.b]), filter(nil), rowset=16
      force partition granule
 11 - output([t15.b]), filter([t15.b = 4]), rowset=16
      access([t15.b]), partitions(p[0-4])
      is_index_back=false, is_global_index=false, filter_before_indexback[false], 
      range_key([t15.a]), range(MIN ; MAX)always true
affected rows: 48
update t14 set b=(select b from t15 where t15.b=4) where a in (select a from t15);
affected rows: 0
info: Rows matched: 3  Changed: 0  Warnings: 0
EXPLAIN BASIC select * from t14;
Query Plan
=======================================
|ID|OPERATOR                 |NAME    |
---------------------------------------
|0 |PX COORDINATOR           |        |
|1 |└─EXCHANGE OUT DISTR     |:EX10000|
|2 |  └─PX PARTITION ITERATOR|        |
|3 |    └─TABLE FULL SCAN    |t14     |
=======================================
Outputs & filters:
-------------------------------------
  0 - output([INTERNAL_FUNCTION(t14.a, t14.b)]), filter(nil), rowset=16
  1 - output([INTERNAL_FUNCTION(t14.a, t14.b)]), filter(nil), rowset=16
      dop=1
  2 - output([t14.a], [t14.b]), filter(nil), rowset=16
      force partition granule
  3 - output([t14.a], [t14.b]), filter(nil), rowset=16
      access([t14.a], [t14.b]), partitions(p[0-4])
      is_index_back=false, is_global_index=false, 
      range_key([t14.a]), range(MIN ; MAX)always true
affected rows: 19
select * from t14;
+---+------+
| a | b    |
+---+------+
| 1 | NULL |
| 2 | NULL |
| 3 | NULL |
| 4 |    4 |
+---+------+
affected rows: 4
EXPLAIN BASIC update /*+use_nl(t14), leading(VIEW1)*/ t14 set a=100 where a in (select b from t14);
Query Plan
=================================================
|ID|OPERATOR                           |NAME    |
-------------------------------------------------
|0 |DISTRIBUTED UPDATE                 |        |
|1 |└─PX COORDINATOR                   |        |
|2 |  └─EXCHANGE OUT DISTR             |:EX10001|
|3 |    └─HASH RIGHT SEMI JOIN         |        |
|4 |      ├─EXCHANGE IN DISTR          |        |
|5 |      │ └─EXCHANGE OUT DISTR (PKEY)|:EX10000|
|6 |      │   └─PX PARTITION ITERATOR  |        |
|7 |      │     └─TABLE FULL SCAN      |t14     |
|8 |      └─PX PARTITION ITERATOR      |        |
|9 |        └─TABLE FULL SCAN          |t14     |
=================================================
Outputs & filters:
-------------------------------------
  0 - output(nil), filter(nil)
      table_columns([{t14: ({t14: (t14.a, t14.b)})}]),
      update([t14.a=column_conv(INT,PS:(11,0),NOT NULL,100)])
  1 - output([t14.a], [t14.b]), filter(nil), rowset=16
  2 - output([t14.a], [t14.b]), filter(nil), rowset=16
      dop=1
  3 - output([t14.a], [t14.b]), filter(nil), rowset=16
      equal_conds([t14.a = t14.b]), other_conds(nil)
  4 - output([t14.b]), filter(nil), rowset=16
  5 - output([t14.b]), filter(nil), rowset=16
      (#keys=1, [t14.b]), dop=1
  6 - output([t14.b]), filter(nil), rowset=16
      force partition granule
  7 - output([t14.b]), filter(nil), rowset=16
      access([t14.b]), partitions(p[0-4])
      is_index_back=false, is_global_index=false, 
      range_key([t14.a]), range(MIN ; MAX)always true
  8 - output([t14.a], [t14.b]), filter(nil), rowset=16
      affinitize, force partition granule
  9 - output([t14.a], [t14.b]), filter(nil), rowset=16
      access([t14.a], [t14.b]), partitions(p[0-4])
      is_index_back=false, is_global_index=false, 
      range_key([t14.a]), range(MIN ; MAX)always true
affected rows: 39
update /*+use_nl(t14), leading(VIEW1)*/ t14 set a=100 where a in (select b from t14);
affected rows: 1
info: Rows matched: 1  Changed: 1  Warnings: 0
EXPLAIN BASIC update /*+use_nl(t15), leading(t14)*/ t14 set a=a+1 where a in (select a from t15);
Query Plan
=========================================
|ID|OPERATOR                   |NAME    |
-----------------------------------------
|0 |DISTRIBUTED UPDATE         |        |
|1 |└─PX COORDINATOR           |        |
|2 |  └─EXCHANGE OUT DISTR     |:EX10000|
|3 |    └─PX PARTITION ITERATOR|        |
|4 |      └─NESTED-LOOP JOIN   |        |
|5 |        ├─TABLE FULL SCAN  |t14     |
|6 |        └─TABLE GET        |t15     |
=========================================
Outputs & filters:
-------------------------------------
  0 - output(nil), filter(nil)
      table_columns([{t14: ({t14: (t14.a, t14.b)})}]),
      update([t14.a=column_conv(INT,PS:(11,0),NOT NULL,cast(t14.a + 1, INT(-1, 0)))])
  1 - output([t14.a], [t14.b]), filter(nil), rowset=16
  2 - output([t14.a], [t14.b]), filter(nil), rowset=16
      dop=1
  3 - output([t14.a], [t14.b]), filter(nil), rowset=16
      partition wise, force partition granule
  4 - output([t14.a], [t14.b]), filter(nil), rowset=16
      conds(nil), nl_params_([t14.a(:0)]), use_batch=true
  5 - output([t14.a], [t14.b]), filter(nil), rowset=16
      access([t14.a], [t14.b]), partitions(p[0-4])
      is_index_back=false, is_global_index=false, 
      range_key([t14.a]), range(MIN ; MAX)always true
  6 - output(nil), filter(nil), rowset=16
      access([GROUP_ID]), partitions(p[0-4])
      is_index_back=false, is_global_index=false, 
      range_key([t15.a]), range(MIN ; MAX), 
      range_cond([:0 = t15.a])
affected rows: 32
update /*+use_nl(t15), leading(t14)*/ t14 set a=a+1 where a in (select a from t15);
affected rows: 3
info: Rows matched: 3  Changed: 3  Warnings: 0
EXPLAIN BASIC select * from t14;
Query Plan
=======================================
|ID|OPERATOR                 |NAME    |
---------------------------------------
|0 |PX COORDINATOR           |        |
|1 |└─EXCHANGE OUT DISTR     |:EX10000|
|2 |  └─PX PARTITION ITERATOR|        |
|3 |    └─TABLE FULL SCAN    |t14     |
=======================================
Outputs & filters:
-------------------------------------
  0 - output([INTERNAL_FUNCTION(t14.a, t14.b)]), filter(nil), rowset=16
  1 - output([INTERNAL_FUNCTION(t14.a, t14.b)]), filter(nil), rowset=16
      dop=1
  2 - output([t14.a], [t14.b]), filter(nil), rowset=16
      force partition granule
  3 - output([t14.a], [t14.b]), filter(nil), rowset=16
      access([t14.a], [t14.b]), partitions(p[0-4])
      is_index_back=false, is_global_index=false, 
      range_key([t14.a]), range(MIN ; MAX)always true
affected rows: 19
select * from t14;
+-----+------+
| a   | b    |
+-----+------+
|   2 | NULL |
|   3 | NULL |
|   4 | NULL |
| 100 |    4 |
+-----+------+
affected rows: 4
update t14 set a=a+1, b=20 where a in (select a from t15);
ERROR 23000: Duplicate entry '4' for key 'PRIMARY'
EXPLAIN BASIC select * from t14;
Query Plan
=======================================
|ID|OPERATOR                 |NAME    |
---------------------------------------
|0 |PX COORDINATOR           |        |
|1 |└─EXCHANGE OUT DISTR     |:EX10000|
|2 |  └─PX PARTITION ITERATOR|        |
|3 |    └─TABLE FULL SCAN    |t14     |
=======================================
Outputs & filters:
-------------------------------------
  0 - output([INTERNAL_FUNCTION(t14.a, t14.b)]), filter(nil), rowset=16
  1 - output([INTERNAL_FUNCTION(t14.a, t14.b)]), filter(nil), rowset=16
      dop=1
  2 - output([t14.a], [t14.b]), filter(nil), rowset=16
      force partition granule
  3 - output([t14.a], [t14.b]), filter(nil), rowset=16
      access([t14.a], [t14.b]), partitions(p[0-4])
      is_index_back=false, is_global_index=false, 
      range_key([t14.a]), range(MIN ; MAX)always true
affected rows: 19
select * from t14;
+-----+------+
| a   | b    |
+-----+------+
|   2 | NULL |
|   3 | NULL |
|   4 | NULL |
| 100 |    4 |
+-----+------+
affected rows: 4
EXPLAIN BASIC delete from t14 where a in (select b from t14);
Query Plan
=================================================
|ID|OPERATOR                           |NAME    |
-------------------------------------------------
|0 |DISTRIBUTED DELETE                 |        |
|1 |└─PX COORDINATOR                   |        |
|2 |  └─EXCHANGE OUT DISTR             |:EX10001|
|3 |    └─HASH RIGHT SEMI JOIN         |        |
|4 |      ├─EXCHANGE IN DISTR          |        |
|5 |      │ └─EXCHANGE OUT DISTR (PKEY)|:EX10000|
|6 |      │   └─PX PARTITION ITERATOR  |        |
|7 |      │     └─TABLE FULL SCAN      |t14     |
|8 |      └─PX PARTITION ITERATOR      |        |
|9 |        └─TABLE FULL SCAN          |t14     |
=================================================
Outputs & filters:
-------------------------------------
  0 - output(nil), filter(nil)
      table_columns([{t14: ({t14: (t14.a, t14.b)})}])
  1 - output([t14.a], [t14.b]), filter(nil), rowset=16
  2 - output([t14.a], [t14.b]), filter(nil), rowset=16
      dop=1
  3 - output([t14.a], [t14.b]), filter(nil), rowset=16
      equal_conds([t14.a = t14.b]), other_conds(nil)
  4 - output([t14.b]), filter(nil), rowset=16
  5 - output([t14.b]), filter(nil), rowset=16
      (#keys=1, [t14.b]), dop=1
  6 - output([t14.b]), filter(nil), rowset=16
      force partition granule
  7 - output([t14.b]), filter(nil), rowset=16
      access([t14.b]), partitions(p[0-4])
      is_index_back=false, is_global_index=false, 
      range_key([t14.a]), range(MIN ; MAX)always true
  8 - output([t14.a], [t14.b]), filter(nil), rowset=16
      affinitize, force partition granule
  9 - output([t14.a], [t14.b]), filter(nil), rowset=16
      access([t14.a], [t14.b]), partitions(p[0-4])
      is_index_back=false, is_global_index=false, 
      range_key([t14.a]), range(MIN ; MAX)always true
affected rows: 38
delete from t14 where a in (select b from t14);
affected rows: 1
EXPLAIN BASIC select * from t14;
Query Plan
=======================================
|ID|OPERATOR                 |NAME    |
---------------------------------------
|0 |PX COORDINATOR           |        |
|1 |└─EXCHANGE OUT DISTR     |:EX10000|
|2 |  └─PX PARTITION ITERATOR|        |
|3 |    └─TABLE FULL SCAN    |t14     |
=======================================
Outputs & filters:
-------------------------------------
  0 - output([INTERNAL_FUNCTION(t14.a, t14.b)]), filter(nil), rowset=16
  1 - output([INTERNAL_FUNCTION(t14.a, t14.b)]), filter(nil), rowset=16
      dop=1
  2 - output([t14.a], [t14.b]), filter(nil), rowset=16
      force partition granule
  3 - output([t14.a], [t14.b]), filter(nil), rowset=16
      access([t14.a], [t14.b]), partitions(p[0-4])
      is_index_back=false, is_global_index=false, 
      range_key([t14.a]), range(MIN ; MAX)always true
affected rows: 19
select * from t14;
+-----+------+
| a   | b    |
+-----+------+
|   2 | NULL |
|   3 | NULL |
| 100 |    4 |
+-----+------+
affected rows: 3
EXPLAIN BASIC delete from t14 where a in (select a+2 from t15);
Query Plan
=================================================
|ID|OPERATOR                           |NAME    |
-------------------------------------------------
|0 |DISTRIBUTED DELETE                 |        |
|1 |└─PX COORDINATOR                   |        |
|2 |  └─EXCHANGE OUT DISTR             |:EX10001|
|3 |    └─HASH RIGHT SEMI JOIN         |        |
|4 |      ├─EXCHANGE IN DISTR          |        |
|5 |      │ └─EXCHANGE OUT DISTR (PKEY)|:EX10000|
|6 |      │   └─PX PARTITION ITERATOR  |        |
|7 |      │     └─TABLE FULL SCAN      |t15     |
|8 |      └─PX PARTITION ITERATOR      |        |
|9 |        └─TABLE FULL SCAN          |t14     |
=================================================
Outputs & filters:
-------------------------------------
  0 - output(nil), filter(nil)
      table_columns([{t14: ({t14: (t14.a, t14.b)})}])
  1 - output([t14.a], [t14.b]), filter(nil), rowset=16
  2 - output([t14.a], [t14.b]), filter(nil), rowset=16
      dop=1
  3 - output([t14.a], [t14.b]), filter(nil), rowset=16
      equal_conds([t14.a = t15.a + 2]), other_conds(nil)
  4 - output([t15.a + 2]), filter(nil), rowset=16
  5 - output([t15.a + 2]), filter(nil), rowset=16
      (#keys=1, [t15.a + 2]), dop=1
  6 - output([t15.a]), filter(nil), rowset=16
      force partition granule
  7 - output([t15.a]), filter(nil), rowset=16
      access([t15.a]), partitions(p[0-4])
      is_index_back=false, is_global_index=false, 
      range_key([t15.a]), range(MIN ; MAX)always true
  8 - output([t14.a], [t14.b]), filter(nil), rowset=16
      affinitize, force partition granule
  9 - output([t14.a], [t14.b]), filter(nil), rowset=16
      access([t14.a], [t14.b]), partitions(p[0-4])
      is_index_back=false, is_global_index=false, 
      range_key([t14.a]), range(MIN ; MAX)always true
affected rows: 38
delete from t14 where a in (select a+2 from t15);
affected rows: 1
EXPLAIN BASIC select * from t14;
Query Plan
=======================================
|ID|OPERATOR                 |NAME    |
---------------------------------------
|0 |PX COORDINATOR           |        |
|1 |└─EXCHANGE OUT DISTR     |:EX10000|
|2 |  └─PX PARTITION ITERATOR|        |
|3 |    └─TABLE FULL SCAN    |t14     |
=======================================
Outputs & filters:
-------------------------------------
  0 - output([INTERNAL_FUNCTION(t14.a, t14.b)]), filter(nil), rowset=16
  1 - output([INTERNAL_FUNCTION(t14.a, t14.b)]), filter(nil), rowset=16
      dop=1
  2 - output([t14.a], [t14.b]), filter(nil), rowset=16
      force partition granule
  3 - output([t14.a], [t14.b]), filter(nil), rowset=16
      access([t14.a], [t14.b]), partitions(p[0-4])
      is_index_back=false, is_global_index=false, 
      range_key([t14.a]), range(MIN ; MAX)always true
affected rows: 19
select * from t14;
+-----+------+
| a   | b    |
+-----+------+
|   2 | NULL |
| 100 |    4 |
+-----+------+
affected rows: 2
EXPLAIN BASIC delete from t14 where b in (select 1 from t15);
Query Plan
===================================================
|ID|OPERATOR                             |NAME    |
---------------------------------------------------
|0 |DISTRIBUTED DELETE                   |        |
|1 |└─NESTED-LOOP JOIN CARTESIAN         |        |
|2 |  ├─PX COORDINATOR                   |        |
|3 |  │ └─EXCHANGE OUT DISTR             |:EX10000|
|4 |  │   └─PX PARTITION ITERATOR        |        |
|5 |  │     └─TABLE FULL SCAN            |t14     |
|6 |  └─MATERIAL                         |        |
|7 |    └─SUBPLAN SCAN                   |VIEW1   |
|8 |      └─LIMIT                        |        |
|9 |        └─PX COORDINATOR             |        |
|10|          └─EXCHANGE OUT DISTR       |:EX20000|
|11|            └─LIMIT                  |        |
|12|              └─PX PARTITION ITERATOR|        |
|13|                └─TABLE FULL SCAN    |t15     |
===================================================
Outputs & filters:
-------------------------------------
  0 - output(nil), filter(nil)
      table_columns([{t14: ({t14: (t14.a, t14.b)}), hash_distinct}])
  1 - output([t14.a], [t14.b]), filter(nil), rowset=16
      conds(nil), nl_params_(nil), use_batch=false
  2 - output([t14.a], [t14.b]), filter(nil), rowset=16
  3 - output([t14.a], [t14.b]), filter(nil), rowset=16
      dop=1
  4 - output([t14.a], [t14.b]), filter(nil), rowset=16
      force partition granule
  5 - output([t14.a], [t14.b]), filter([t14.b = 1]), rowset=16
      access([t14.a], [t14.b]), partitions(p[0-4])
      is_index_back=false, is_global_index=false, filter_before_indexback[false], 
      range_key([t14.a]), range(MIN ; MAX)always true
  6 - output(nil), filter(nil), rowset=16
  7 - output(nil), filter(nil), rowset=16
      access(nil)
  8 - output([1]), filter(nil), rowset=16
      limit(1), offset(nil)
  9 - output(nil), filter(nil), rowset=16
 10 - output(nil), filter(nil), rowset=16
      dop=1
 11 - output(nil), filter(nil), rowset=16
      limit(1), offset(nil)
 12 - output(nil), filter(nil), rowset=16
      force partition granule
 13 - output(nil), filter(nil), rowset=16
      access(nil), partitions(p[0-4])
      limit(1), offset(nil), is_index_back=false, is_global_index=false, 
      range_key([t15.a]), range(MIN ; MAX)always true
affected rows: 49
delete from t14 where b in (select 1 from t15);
affected rows: 0
EXPLAIN BASIC delete from t14 where b in (select a from t15);
Query Plan
=================================================
|ID|OPERATOR                           |NAME    |
-------------------------------------------------
|0 |DISTRIBUTED DELETE                 |        |
|1 |└─PX COORDINATOR                   |        |
|2 |  └─EXCHANGE OUT DISTR             |:EX10001|
|3 |    └─HASH JOIN                    |        |
|4 |      ├─EXCHANGE IN DISTR          |        |
|5 |      │ └─EXCHANGE OUT DISTR (PKEY)|:EX10000|
|6 |      │   └─PX PARTITION ITERATOR  |        |
|7 |      │     └─TABLE FULL SCAN      |t14     |
|8 |      └─PX PARTITION ITERATOR      |        |
|9 |        └─TABLE FULL SCAN          |t15     |
=================================================
Outputs & filters:
-------------------------------------
  0 - output(nil), filter(nil)
      table_columns([{t14: ({t14: (t14.a, t14.b)})}])
  1 - output([t14.a], [t14.b]), filter(nil), rowset=16
  2 - output([t14.a], [t14.b]), filter(nil), rowset=16
      dop=1
  3 - output([t14.a], [t14.b]), filter(nil), rowset=16
      equal_conds([t14.b = t15.a]), other_conds(nil)
  4 - output([t14.a], [t14.b]), filter(nil), rowset=16
  5 - output([t14.a], [t14.b]), filter(nil), rowset=16
      (#keys=1, [t14.b]), dop=1
  6 - output([t14.a], [t14.b]), filter(nil), rowset=16
      force partition granule
  7 - output([t14.a], [t14.b]), filter(nil), rowset=16
      access([t14.a], [t14.b]), partitions(p[0-4])
      is_index_back=false, is_global_index=false, 
      range_key([t14.a]), range(MIN ; MAX)always true
  8 - output([t15.a]), filter(nil), rowset=16
      affinitize, force partition granule
  9 - output([t15.a]), filter(nil), rowset=16
      access([t15.a]), partitions(p[0-4])
      is_index_back=false, is_global_index=false, 
      range_key([t15.a]), range(MIN ; MAX)always true
affected rows: 38
delete from t14 where b in (select a from t15);
affected rows: 0
EXPLAIN BASIC delete from t14 where a in (select a from t15);
Query Plan
=======================================
|ID|OPERATOR                 |NAME    |
---------------------------------------
|0 |PX COORDINATOR           |        |
|1 |└─EXCHANGE OUT DISTR     |:EX10000|
|2 |  └─PX PARTITION ITERATOR|        |
|3 |    └─DELETE             |        |
|4 |      └─MERGE JOIN       |        |
|5 |        ├─TABLE FULL SCAN|t15     |
|6 |        └─TABLE FULL SCAN|t14     |
=======================================
Outputs & filters:
-------------------------------------
  0 - output(nil), filter(nil), rowset=16
  1 - output(nil), filter(nil), rowset=16
      dop=1
  2 - output(nil), filter(nil), rowset=16
      partition wise, force partition granule
  3 - output(nil), filter(nil)
      table_columns([{t14: ({t14: (t14.a, t14.b)})}])
  4 - output([t14.a], [t14.b]), filter(nil), rowset=16
      equal_conds([t14.a = t15.a]), other_conds(nil)
      merge_directions([ASC])
  5 - output([t15.a]), filter(nil), rowset=16
      access([t15.a]), partitions(p[0-4])
      is_index_back=false, is_global_index=false, 
      range_key([t15.a]), range(MIN ; MAX)always true
  6 - output([t14.a], [t14.b]), filter(nil), rowset=16
      access([t14.a], [t14.b]), partitions(p[0-4])
      is_index_back=false, is_global_index=false, 
      range_key([t14.a]), range(MIN ; MAX)always true
affected rows: 31
delete from t14 where a in (select a from t15);
affected rows: 1
EXPLAIN BASIC select * from t14;
Query Plan
=======================================
|ID|OPERATOR                 |NAME    |
---------------------------------------
|0 |PX COORDINATOR           |        |
|1 |└─EXCHANGE OUT DISTR     |:EX10000|
|2 |  └─PX PARTITION ITERATOR|        |
|3 |    └─TABLE FULL SCAN    |t14     |
=======================================
Outputs & filters:
-------------------------------------
  0 - output([INTERNAL_FUNCTION(t14.a, t14.b)]), filter(nil), rowset=16
  1 - output([INTERNAL_FUNCTION(t14.a, t14.b)]), filter(nil), rowset=16
      dop=1
  2 - output([t14.a], [t14.b]), filter(nil), rowset=16
      force partition granule
  3 - output([t14.a], [t14.b]), filter(nil), rowset=16
      access([t14.a], [t14.b]), partitions(p[0-4])
      is_index_back=false, is_global_index=false, 
      range_key([t14.a]), range(MIN ; MAX)always true
affected rows: 19
select * from t14;
+-----+------+
| a   | b    |
+-----+------+
| 100 |    4 |
+-----+------+
affected rows: 1
drop table t14, t15;
affected rows: 0

EXPLAIN BASIC select * from t16;
Query Plan
=======================================
|ID|OPERATOR                 |NAME    |
---------------------------------------
|0 |PX COORDINATOR           |        |
|1 |└─EXCHANGE OUT DISTR     |:EX10000|
|2 |  └─PX PARTITION ITERATOR|        |
|3 |    └─TABLE FULL SCAN    |t16     |
=======================================
Outputs & filters:
-------------------------------------
  0 - output([INTERNAL_FUNCTION(t16.a, t16.b)]), filter(nil), rowset=16
  1 - output([INTERNAL_FUNCTION(t16.a, t16.b)]), filter(nil), rowset=16
      dop=1
  2 - output([t16.a], [t16.b]), filter(nil), rowset=16
      force partition granule
  3 - output([t16.a], [t16.b]), filter(nil), rowset=16
      access([t16.a], [t16.b]), partitions(p[0-4])
      is_index_back=false, is_global_index=false, 
      range_key([t16.a]), range(MIN ; MAX)always true
affected rows: 19
select * from t16;
+---+------+
| a | b    |
+---+------+
| 1 |    1 |
| 2 |    2 |
| 3 |    3 |
| 4 |    4 |
+---+------+
affected rows: 4
EXPLAIN BASIC select * from t17;
Query Plan
===============================
|ID|OPERATOR             |NAME|
-------------------------------
|0 |EXCHANGE IN REMOTE   |    |
|1 |└─EXCHANGE OUT REMOTE|    |
|2 |  └─TABLE FULL SCAN  |t17 |
===============================
Outputs & filters:
-------------------------------------
  0 - output([t17.a], [t17.b]), filter(nil)
  1 - output([t17.a], [t17.b]), filter(nil)
  2 - output([t17.a], [t17.b]), filter(nil), rowset=16
      access([t17.a], [t17.b]), partitions(p0)
      is_index_back=false, is_global_index=false, 
      range_key([t17.a]), range(MIN ; MAX)always true
affected rows: 15
select * from t17;
+---+------+
| a | b    |
+---+------+
| 1 |    1 |
| 2 |    2 |
| 3 |    3 |
+---+------+
affected rows: 3
EXPLAIN BASIC update t16 set a=a+1;
Query Plan
=========================================
|ID|OPERATOR                   |NAME    |
-----------------------------------------
|0 |DISTRIBUTED UPDATE         |        |
|1 |└─PX COORDINATOR           |        |
|2 |  └─EXCHANGE OUT DISTR     |:EX10000|
|3 |    └─PX PARTITION ITERATOR|        |
|4 |      └─TABLE FULL SCAN    |t16     |
=========================================
Outputs & filters:
-------------------------------------
  0 - output(nil), filter(nil)
      table_columns([{t16: ({t16: (t16.a, t16.b)})}]),
      update([t16.a=column_conv(INT,PS:(11,0),NOT NULL,cast(t16.a + 1, INT(-1, 0)))])
  1 - output([t16.a], [t16.b]), filter(nil), rowset=16
  2 - output([t16.a], [t16.b]), filter(nil), rowset=16
      dop=1
  3 - output([t16.a], [t16.b]), filter(nil), rowset=16
      force partition granule
  4 - output([t16.a], [t16.b]), filter(nil), rowset=16
      access([t16.a], [t16.b]), partitions(p[0-4])
      is_index_back=false, is_global_index=false, 
      range_key([t16.a]), range(MIN ; MAX)always true
affected rows: 23
update t16 set a=a+1;
affected rows: 4
info: Rows matched: 4  Changed: 4  Warnings: 0
EXPLAIN BASIC select * from t16;
Query Plan
=======================================
|ID|OPERATOR                 |NAME    |
---------------------------------------
|0 |PX COORDINATOR           |        |
|1 |└─EXCHANGE OUT DISTR     |:EX10000|
|2 |  └─PX PARTITION ITERATOR|        |
|3 |    └─TABLE FULL SCAN    |t16     |
=======================================
Outputs & filters:
-------------------------------------
  0 - output([INTERNAL_FUNCTION(t16.a, t16.b)]), filter(nil), rowset=16
  1 - output([INTERNAL_FUNCTION(t16.a, t16.b)]), filter(nil), rowset=16
      dop=1
  2 - output([t16.a], [t16.b]), filter(nil), rowset=16
      force partition granule
  3 - output([t16.a], [t16.b]), filter(nil), rowset=16
      access([t16.a], [t16.b]), partitions(p[0-4])
      is_index_back=false, is_global_index=false, 
      range_key([t16.a]), range(MIN ; MAX)always true
affected rows: 19
select * from t16;
+---+------+
| a | b    |
+---+------+
| 2 |    1 |
| 3 |    2 |
| 4 |    3 |
| 5 |    4 |
+---+------+
affected rows: 4
EXPLAIN BASIC update t16 set b=100 where a in (select a from t17);
Query Plan
=================================================
|ID|OPERATOR                           |NAME    |
-------------------------------------------------
|0 |DISTRIBUTED UPDATE                 |        |
|1 |└─PX COORDINATOR                   |        |
|2 |  └─EXCHANGE OUT DISTR             |:EX10001|
|3 |    └─HASH JOIN                    |        |
|4 |      ├─EXCHANGE IN DISTR          |        |
|5 |      │ └─EXCHANGE OUT DISTR (PKEY)|:EX10000|
|6 |      │   └─TABLE FULL SCAN        |t17     |
|7 |      └─PX PARTITION ITERATOR      |        |
|8 |        └─TABLE FULL SCAN          |t16     |
=================================================
Outputs & filters:
-------------------------------------
  0 - output(nil), filter(nil)
      table_columns([{t16: ({t16: (t16.a, t16.b)})}]),
      update([t16.b=column_conv(INT,PS:(11,0),NULL,100)])
  1 - output([t16.a], [t16.b]), filter(nil), rowset=16
  2 - output([t16.a], [t16.b]), filter(nil), rowset=16
      dop=1
  3 - output([t16.a], [t16.b]), filter(nil), rowset=16
      equal_conds([t16.a = t17.a]), other_conds(nil)
  4 - output([t17.a]), filter(nil), rowset=16
  5 - output([t17.a]), filter(nil), rowset=16
      (#keys=1, [t17.a]), is_single, dop=1
  6 - output([t17.a]), filter(nil), rowset=16
      access([t17.a]), partitions(p0)
      is_index_back=false, is_global_index=false, 
      range_key([t17.a]), range(MIN ; MAX)always true
  7 - output([t16.a], [t16.b]), filter(nil), rowset=16
      affinitize, force partition granule
  8 - output([t16.a], [t16.b]), filter(nil), rowset=16
      access([t16.a], [t16.b]), partitions(p[0-4])
      is_index_back=false, is_global_index=false, 
      range_key([t16.a]), range(MIN ; MAX)always true
affected rows: 36
update t16 set b=100 where a in (select a from t17);
affected rows: 2
info: Rows matched: 2  Changed: 2  Warnings: 0
EXPLAIN BASIC select * from t16;
Query Plan
=======================================
|ID|OPERATOR                 |NAME    |
---------------------------------------
|0 |PX COORDINATOR           |        |
|1 |└─EXCHANGE OUT DISTR     |:EX10000|
|2 |  └─PX PARTITION ITERATOR|        |
|3 |    └─TABLE FULL SCAN    |t16     |
=======================================
Outputs & filters:
-------------------------------------
  0 - output([INTERNAL_FUNCTION(t16.a, t16.b)]), filter(nil), rowset=16
  1 - output([INTERNAL_FUNCTION(t16.a, t16.b)]), filter(nil), rowset=16
      dop=1
  2 - output([t16.a], [t16.b]), filter(nil), rowset=16
      force partition granule
  3 - output([t16.a], [t16.b]), filter(nil), rowset=16
      access([t16.a], [t16.b]), partitions(p[0-4])
      is_index_back=false, is_global_index=false, 
      range_key([t16.a]), range(MIN ; MAX)always true
affected rows: 19
select * from t16;
+---+------+
| a | b    |
+---+------+
| 2 |  100 |
| 3 |  100 |
| 4 |    3 |
| 5 |    4 |
+---+------+
affected rows: 4
EXPLAIN BASIC update t16 set b=b-10 where a in (select a from t17 where t16.a=1);
Query Plan
===========================================
|ID|OPERATOR                         |NAME|
-------------------------------------------
|0 |EXCHANGE IN REMOTE               |    |
|1 |└─EXCHANGE OUT REMOTE            |    |
|2 |  └─UPDATE                       |    |
|3 |    └─NESTED-LOOP JOIN CARTESIAN |    |
|4 |      ├─TABLE GET                |t16 |
|5 |      └─TABLE GET                |t17 |
===========================================
Outputs & filters:
-------------------------------------
  0 - output(nil), filter(nil)
  1 - output(nil), filter(nil)
  2 - output(nil), filter(nil)
      table_columns([{t16: ({t16: (t16.a, t16.b)})}]),
      update([t16.b=column_conv(INT,PS:(11,0),NULL,cast(t16.b + -10, INT(-1, 0)))])
  3 - output([t16.a], [t16.b]), filter(nil), rowset=16
      conds(nil), nl_params_(nil), use_batch=false
  4 - output([t16.a], [t16.b]), filter(nil), rowset=16
      access([t16.a], [t16.b]), partitions(p1)
      is_index_back=false, is_global_index=false, 
      range_key([t16.a]), range[1 ; 1], 
      range_cond([t16.a = 1])
  5 - output(nil), filter(nil), rowset=16
      access(nil), partitions(p0)
      is_index_back=false, is_global_index=false, 
      range_key([t17.a]), range[1 ; 1], 
      range_cond([t17.a = 1])
affected rows: 29
update t16 set b=b-10 where a in (select a from t17 where t16.a=1);
affected rows: 0
info: Rows matched: 0  Changed: 0  Warnings: 0
EXPLAIN BASIC select * from t16;
Query Plan
=======================================
|ID|OPERATOR                 |NAME    |
---------------------------------------
|0 |PX COORDINATOR           |        |
|1 |└─EXCHANGE OUT DISTR     |:EX10000|
|2 |  └─PX PARTITION ITERATOR|        |
|3 |    └─TABLE FULL SCAN    |t16     |
=======================================
Outputs & filters:
-------------------------------------
  0 - output([INTERNAL_FUNCTION(t16.a, t16.b)]), filter(nil), rowset=16
  1 - output([INTERNAL_FUNCTION(t16.a, t16.b)]), filter(nil), rowset=16
      dop=1
  2 - output([t16.a], [t16.b]), filter(nil), rowset=16
      force partition granule
  3 - output([t16.a], [t16.b]), filter(nil), rowset=16
      access([t16.a], [t16.b]), partitions(p[0-4])
      is_index_back=false, is_global_index=false, 
      range_key([t16.a]), range(MIN ; MAX)always true
affected rows: 19
select * from t16;
+---+------+
| a | b    |
+---+------+
| 2 |  100 |
| 3 |  100 |
| 4 |    3 |
| 5 |    4 |
+---+------+
affected rows: 4
EXPLAIN BASIC update t16 set b=(select b from t17 where t16.b=t17.b+86) where a in (select a from t17);
Query Plan
===================================================
|ID|OPERATOR                             |NAME    |
---------------------------------------------------
|0 |DISTRIBUTED UPDATE                   |        |
|1 |└─PX COORDINATOR                     |        |
|2 |  └─EXCHANGE OUT DISTR               |:EX10001|
|3 |    └─SUBPLAN FILTER                 |        |
|4 |      ├─HASH JOIN                    |        |
|5 |      │ ├─EXCHANGE IN DISTR          |        |
|6 |      │ │ └─EXCHANGE OUT DISTR (PKEY)|:EX10000|
|7 |      │ │   └─TABLE FULL SCAN        |t17     |
|8 |      │ └─PX PARTITION ITERATOR      |        |
|9 |      │   └─TABLE FULL SCAN          |t16     |
|10|      └─DISTRIBUTED TABLE FULL SCAN  |t17     |
===================================================
Outputs & filters:
-------------------------------------
  0 - output(nil), filter(nil)
      table_columns([{t16: ({t16: (t16.a, t16.b)})}]),
      update([t16.b=column_conv(INT,PS:(11,0),NULL,subquery(1))])
  1 - output([t16.a], [t16.b], [subquery(1)]), filter(nil), rowset=16
  2 - output([t16.a], [t16.b], [subquery(1)]), filter(nil), rowset=16
      dop=1
  3 - output([t16.a], [t16.b], [subquery(1)]), filter(nil), rowset=16
      exec_params_([t16.b(:0)]), onetime_exprs_(nil), init_plan_idxs_(nil), use_batch=false
  4 - output([t16.a], [t16.b]), filter(nil), rowset=16
      equal_conds([t16.a = t17.a]), other_conds(nil)
  5 - output([t17.a]), filter(nil), rowset=16
  6 - output([t17.a]), filter(nil), rowset=16
      (#keys=1, [t17.a]), is_single, dop=1
  7 - output([t17.a]), filter(nil), rowset=16
      access([t17.a]), partitions(p0)
      is_index_back=false, is_global_index=false, 
      range_key([t17.a]), range(MIN ; MAX)always true
  8 - output([t16.a], [t16.b]), filter(nil), rowset=16
      affinitize, force partition granule
  9 - output([t16.a], [t16.b]), filter(nil), rowset=16
      access([t16.a], [t16.b]), partitions(p[0-4])
      is_index_back=false, is_global_index=false, 
      range_key([t16.a]), range(MIN ; MAX)always true
 10 - output([t17.b]), filter([:0 = t17.b + 86]), rowset=16
      access([t17.b]), partitions(p0)
      is_index_back=false, is_global_index=false, filter_before_indexback[false], 
      range_key([t17.a]), range(MIN ; MAX)always true
affected rows: 44
update t16 set b=(select b from t17 where t16.b=t17.b+86) where a in (select a from t17);
affected rows: 2
info: Rows matched: 2  Changed: 2  Warnings: 0
EXPLAIN BASIC select * from t16;
Query Plan
=======================================
|ID|OPERATOR                 |NAME    |
---------------------------------------
|0 |PX COORDINATOR           |        |
|1 |└─EXCHANGE OUT DISTR     |:EX10000|
|2 |  └─PX PARTITION ITERATOR|        |
|3 |    └─TABLE FULL SCAN    |t16     |
=======================================
Outputs & filters:
-------------------------------------
  0 - output([INTERNAL_FUNCTION(t16.a, t16.b)]), filter(nil), rowset=16
  1 - output([INTERNAL_FUNCTION(t16.a, t16.b)]), filter(nil), rowset=16
      dop=1
  2 - output([t16.a], [t16.b]), filter(nil), rowset=16
      force partition granule
  3 - output([t16.a], [t16.b]), filter(nil), rowset=16
      access([t16.a], [t16.b]), partitions(p[0-4])
      is_index_back=false, is_global_index=false, 
      range_key([t16.a]), range(MIN ; MAX)always true
affected rows: 19
select * from t16;
+---+------+
| a | b    |
+---+------+
| 2 | NULL |
| 3 | NULL |
| 4 |    3 |
| 5 |    4 |
+---+------+
affected rows: 4
update t16 set a=100 where a in (select b from t16);
ERROR 23000: Duplicate entry '100' for key 'PRIMARY'
EXPLAIN BASIC update t16 set a=a+10 where a in (select a from t17);
Query Plan
=================================================
|ID|OPERATOR                           |NAME    |
-------------------------------------------------
|0 |DISTRIBUTED UPDATE                 |        |
|1 |└─PX COORDINATOR                   |        |
|2 |  └─EXCHANGE OUT DISTR             |:EX10001|
|3 |    └─HASH JOIN                    |        |
|4 |      ├─EXCHANGE IN DISTR          |        |
|5 |      │ └─EXCHANGE OUT DISTR (PKEY)|:EX10000|
|6 |      │   └─TABLE FULL SCAN        |t17     |
|7 |      └─PX PARTITION ITERATOR      |        |
|8 |        └─TABLE FULL SCAN          |t16     |
=================================================
Outputs & filters:
-------------------------------------
  0 - output(nil), filter(nil)
      table_columns([{t16: ({t16: (t16.a, t16.b)})}]),
      update([t16.a=column_conv(INT,PS:(11,0),NOT NULL,cast(t16.a + 10, INT(-1, 0)))])
  1 - output([t16.a], [t16.b]), filter(nil), rowset=16
  2 - output([t16.a], [t16.b]), filter(nil), rowset=16
      dop=1
  3 - output([t16.a], [t16.b]), filter(nil), rowset=16
      equal_conds([t16.a = t17.a]), other_conds(nil)
  4 - output([t17.a]), filter(nil), rowset=16
  5 - output([t17.a]), filter(nil), rowset=16
      (#keys=1, [t17.a]), is_single, dop=1
  6 - output([t17.a]), filter(nil), rowset=16
      access([t17.a]), partitions(p0)
      is_index_back=false, is_global_index=false, 
      range_key([t17.a]), range(MIN ; MAX)always true
  7 - output([t16.a], [t16.b]), filter(nil), rowset=16
      affinitize, force partition granule
  8 - output([t16.a], [t16.b]), filter(nil), rowset=16
      access([t16.a], [t16.b]), partitions(p[0-4])
      is_index_back=false, is_global_index=false, 
      range_key([t16.a]), range(MIN ; MAX)always true
affected rows: 36
update t16 set a=a+10 where a in (select a from t17);
affected rows: 2
info: Rows matched: 2  Changed: 2  Warnings: 0
EXPLAIN BASIC select * from t16;
Query Plan
=======================================
|ID|OPERATOR                 |NAME    |
---------------------------------------
|0 |PX COORDINATOR           |        |
|1 |└─EXCHANGE OUT DISTR     |:EX10000|
|2 |  └─PX PARTITION ITERATOR|        |
|3 |    └─TABLE FULL SCAN    |t16     |
=======================================
Outputs & filters:
-------------------------------------
  0 - output([INTERNAL_FUNCTION(t16.a, t16.b)]), filter(nil), rowset=16
  1 - output([INTERNAL_FUNCTION(t16.a, t16.b)]), filter(nil), rowset=16
      dop=1
  2 - output([t16.a], [t16.b]), filter(nil), rowset=16
      force partition granule
  3 - output([t16.a], [t16.b]), filter(nil), rowset=16
      access([t16.a], [t16.b]), partitions(p[0-4])
      is_index_back=false, is_global_index=false, 
      range_key([t16.a]), range(MIN ; MAX)always true
affected rows: 19
select * from t16;
+----+------+
| a  | b    |
+----+------+
|  4 |    3 |
|  5 |    4 |
| 12 | NULL |
| 13 | NULL |
+----+------+
affected rows: 4
EXPLAIN BASIC update t16 set a=a+1, b=20 where a in (select a from t17);
Query Plan
=================================================
|ID|OPERATOR                           |NAME    |
-------------------------------------------------
|0 |DISTRIBUTED UPDATE                 |        |
|1 |└─PX COORDINATOR                   |        |
|2 |  └─EXCHANGE OUT DISTR             |:EX10001|
|3 |    └─HASH JOIN                    |        |
|4 |      ├─EXCHANGE IN DISTR          |        |
|5 |      │ └─EXCHANGE OUT DISTR (PKEY)|:EX10000|
|6 |      │   └─TABLE FULL SCAN        |t17     |
|7 |      └─PX PARTITION ITERATOR      |        |
|8 |        └─TABLE FULL SCAN          |t16     |
=================================================
Outputs & filters:
-------------------------------------
  0 - output(nil), filter(nil)
      table_columns([{t16: ({t16: (t16.a, t16.b)})}]),
      update([t16.a=column_conv(INT,PS:(11,0),NOT NULL,cast(t16.a + 1, INT(-1, 0)))], [t16.b=column_conv(INT,PS:(11,0),NULL,20)])
  1 - output([t16.a], [t16.b]), filter(nil), rowset=16
  2 - output([t16.a], [t16.b]), filter(nil), rowset=16
      dop=1
  3 - output([t16.a], [t16.b]), filter(nil), rowset=16
      equal_conds([t16.a = t17.a]), other_conds(nil)
  4 - output([t17.a]), filter(nil), rowset=16
  5 - output([t17.a]), filter(nil), rowset=16
      (#keys=1, [t17.a]), is_single, dop=1
  6 - output([t17.a]), filter(nil), rowset=16
      access([t17.a]), partitions(p0)
      is_index_back=false, is_global_index=false, 
      range_key([t17.a]), range(MIN ; MAX)always true
  7 - output([t16.a], [t16.b]), filter(nil), rowset=16
      affinitize, force partition granule
  8 - output([t16.a], [t16.b]), filter(nil), rowset=16
      access([t16.a], [t16.b]), partitions(p[0-4])
      is_index_back=false, is_global_index=false, 
      range_key([t16.a]), range(MIN ; MAX)always true
affected rows: 36
update t16 set a=a+1, b=20 where a in (select a from t17);
affected rows: 0
info: Rows matched: 0  Changed: 0  Warnings: 0
EXPLAIN BASIC select * from t16;
Query Plan
=======================================
|ID|OPERATOR                 |NAME    |
---------------------------------------
|0 |PX COORDINATOR           |        |
|1 |└─EXCHANGE OUT DISTR     |:EX10000|
|2 |  └─PX PARTITION ITERATOR|        |
|3 |    └─TABLE FULL SCAN    |t16     |
=======================================
Outputs & filters:
-------------------------------------
  0 - output([INTERNAL_FUNCTION(t16.a, t16.b)]), filter(nil), rowset=16
  1 - output([INTERNAL_FUNCTION(t16.a, t16.b)]), filter(nil), rowset=16
      dop=1
  2 - output([t16.a], [t16.b]), filter(nil), rowset=16
      force partition granule
  3 - output([t16.a], [t16.b]), filter(nil), rowset=16
      access([t16.a], [t16.b]), partitions(p[0-4])
      is_index_back=false, is_global_index=false, 
      range_key([t16.a]), range(MIN ; MAX)always true
affected rows: 19
select * from t16;
+----+------+
| a  | b    |
+----+------+
|  4 |    3 |
|  5 |    4 |
| 12 | NULL |
| 13 | NULL |
+----+------+
affected rows: 4
EXPLAIN BASIC delete from t16 where a in (select b from t16);
Query Plan
=================================================
|ID|OPERATOR                           |NAME    |
-------------------------------------------------
|0 |DISTRIBUTED DELETE                 |        |
|1 |└─PX COORDINATOR                   |        |
|2 |  └─EXCHANGE OUT DISTR             |:EX10001|
|3 |    └─HASH RIGHT SEMI JOIN         |        |
|4 |      ├─EXCHANGE IN DISTR          |        |
|5 |      │ └─EXCHANGE OUT DISTR (PKEY)|:EX10000|
|6 |      │   └─PX PARTITION ITERATOR  |        |
|7 |      │     └─TABLE FULL SCAN      |t16     |
|8 |      └─PX PARTITION ITERATOR      |        |
|9 |        └─TABLE FULL SCAN          |t16     |
=================================================
Outputs & filters:
-------------------------------------
  0 - output(nil), filter(nil)
      table_columns([{t16: ({t16: (t16.a, t16.b)})}])
  1 - output([t16.a], [t16.b]), filter(nil), rowset=16
  2 - output([t16.a], [t16.b]), filter(nil), rowset=16
      dop=1
  3 - output([t16.a], [t16.b]), filter(nil), rowset=16
      equal_conds([t16.a = t16.b]), other_conds(nil)
  4 - output([t16.b]), filter(nil), rowset=16
  5 - output([t16.b]), filter(nil), rowset=16
      (#keys=1, [t16.b]), dop=1
  6 - output([t16.b]), filter(nil), rowset=16
      force partition granule
  7 - output([t16.b]), filter(nil), rowset=16
      access([t16.b]), partitions(p[0-4])
      is_index_back=false, is_global_index=false, 
      range_key([t16.a]), range(MIN ; MAX)always true
  8 - output([t16.a], [t16.b]), filter(nil), rowset=16
      affinitize, force partition granule
  9 - output([t16.a], [t16.b]), filter(nil), rowset=16
      access([t16.a], [t16.b]), partitions(p[0-4])
      is_index_back=false, is_global_index=false, 
      range_key([t16.a]), range(MIN ; MAX)always true
affected rows: 38
delete from t16 where a in (select b from t16);
affected rows: 1
EXPLAIN BASIC select * from t16;
Query Plan
=======================================
|ID|OPERATOR                 |NAME    |
---------------------------------------
|0 |PX COORDINATOR           |        |
|1 |└─EXCHANGE OUT DISTR     |:EX10000|
|2 |  └─PX PARTITION ITERATOR|        |
|3 |    └─TABLE FULL SCAN    |t16     |
=======================================
Outputs & filters:
-------------------------------------
  0 - output([INTERNAL_FUNCTION(t16.a, t16.b)]), filter(nil), rowset=16
  1 - output([INTERNAL_FUNCTION(t16.a, t16.b)]), filter(nil), rowset=16
      dop=1
  2 - output([t16.a], [t16.b]), filter(nil), rowset=16
      force partition granule
  3 - output([t16.a], [t16.b]), filter(nil), rowset=16
      access([t16.a], [t16.b]), partitions(p[0-4])
      is_index_back=false, is_global_index=false, 
      range_key([t16.a]), range(MIN ; MAX)always true
affected rows: 19
select * from t16;
+----+------+
| a  | b    |
+----+------+
|  5 |    4 |
| 12 | NULL |
| 13 | NULL |
+----+------+
affected rows: 3
EXPLAIN BASIC delete from t16 where a in (select a+2 from t17);
Query Plan
=================================================
|ID|OPERATOR                           |NAME    |
-------------------------------------------------
|0 |DISTRIBUTED DELETE                 |        |
|1 |└─PX COORDINATOR                   |        |
|2 |  └─EXCHANGE OUT DISTR             |:EX10001|
|3 |    └─HASH RIGHT SEMI JOIN         |        |
|4 |      ├─EXCHANGE IN DISTR          |        |
|5 |      │ └─EXCHANGE OUT DISTR (PKEY)|:EX10000|
|6 |      │   └─TABLE FULL SCAN        |t17     |
|7 |      └─PX PARTITION ITERATOR      |        |
|8 |        └─TABLE FULL SCAN          |t16     |
=================================================
Outputs & filters:
-------------------------------------
  0 - output(nil), filter(nil)
      table_columns([{t16: ({t16: (t16.a, t16.b)})}])
  1 - output([t16.a], [t16.b]), filter(nil), rowset=16
  2 - output([t16.a], [t16.b]), filter(nil), rowset=16
      dop=1
  3 - output([t16.a], [t16.b]), filter(nil), rowset=16
      equal_conds([t16.a = t17.a + 2]), other_conds(nil)
  4 - output([t17.a + 2]), filter(nil), rowset=16
  5 - output([t17.a + 2]), filter(nil), rowset=16
      (#keys=1, [t17.a + 2]), is_single, dop=1
  6 - output([t17.a]), filter(nil), rowset=16
      access([t17.a]), partitions(p0)
      is_index_back=false, is_global_index=false, 
      range_key([t17.a]), range(MIN ; MAX)always true
  7 - output([t16.a], [t16.b]), filter(nil), rowset=16
      affinitize, force partition granule
  8 - output([t16.a], [t16.b]), filter(nil), rowset=16
      access([t16.a], [t16.b]), partitions(p[0-4])
      is_index_back=false, is_global_index=false, 
      range_key([t16.a]), range(MIN ; MAX)always true
affected rows: 35
delete from t16 where a in (select a+2 from t17);
affected rows: 1
EXPLAIN BASIC select * from t16;
Query Plan
=======================================
|ID|OPERATOR                 |NAME    |
---------------------------------------
|0 |PX COORDINATOR           |        |
|1 |└─EXCHANGE OUT DISTR     |:EX10000|
|2 |  └─PX PARTITION ITERATOR|        |
|3 |    └─TABLE FULL SCAN    |t16     |
=======================================
Outputs & filters:
-------------------------------------
  0 - output([INTERNAL_FUNCTION(t16.a, t16.b)]), filter(nil), rowset=16
  1 - output([INTERNAL_FUNCTION(t16.a, t16.b)]), filter(nil), rowset=16
      dop=1
  2 - output([t16.a], [t16.b]), filter(nil), rowset=16
      force partition granule
  3 - output([t16.a], [t16.b]), filter(nil), rowset=16
      access([t16.a], [t16.b]), partitions(p[0-4])
      is_index_back=false, is_global_index=false, 
      range_key([t16.a]), range(MIN ; MAX)always true
affected rows: 19
select * from t16;
+----+------+
| a  | b    |
+----+------+
| 12 | NULL |
| 13 | NULL |
+----+------+
affected rows: 2
EXPLAIN BASIC delete from t16 where b in (select 1 from t17);
Query Plan
===========================================
|ID|OPERATOR                     |NAME    |
-------------------------------------------
|0 |DISTRIBUTED DELETE           |        |
|1 |└─NESTED-LOOP JOIN CARTESIAN |        |
|2 |  ├─PX COORDINATOR           |        |
|3 |  │ └─EXCHANGE OUT DISTR     |:EX10000|
|4 |  │   └─PX PARTITION ITERATOR|        |
|5 |  │     └─TABLE FULL SCAN    |t16     |
|6 |  └─MATERIAL                 |        |
|7 |    └─PX COORDINATOR         |        |
|8 |      └─EXCHANGE OUT DISTR   |:EX20000|
|9 |        └─SUBPLAN SCAN       |VIEW1   |
|10|          └─TABLE FULL SCAN  |t17     |
===========================================
Outputs & filters:
-------------------------------------
  0 - output(nil), filter(nil)
      table_columns([{t16: ({t16: (t16.a, t16.b)}), hash_distinct}])
  1 - output([t16.a], [t16.b]), filter(nil), rowset=16
      conds(nil), nl_params_(nil), use_batch=false
  2 - output([t16.a], [t16.b]), filter(nil), rowset=16
  3 - output([t16.a], [t16.b]), filter(nil), rowset=16
      dop=1
  4 - output([t16.a], [t16.b]), filter(nil), rowset=16
      force partition granule
  5 - output([t16.a], [t16.b]), filter([t16.b = 1]), rowset=16
      access([t16.a], [t16.b]), partitions(p[0-4])
      is_index_back=false, is_global_index=false, filter_before_indexback[false], 
      range_key([t16.a]), range(MIN ; MAX)always true
  6 - output(nil), filter(nil), rowset=16
  7 - output(nil), filter(nil), rowset=16
  8 - output(nil), filter(nil), rowset=16
      is_single, dop=1
  9 - output(nil), filter(nil), rowset=16
      access(nil)
 10 - output([1]), filter(nil), rowset=16
      access(nil), partitions(p0)
      limit(1), offset(nil), is_index_back=false, is_global_index=false, 
      range_key([t17.a]), range(MIN ; MAX)always true
affected rows: 40
delete from t16 where b in (select 1 from t17);
affected rows: 0
EXPLAIN BASIC delete from t16 where b in (select a from t17);
Query Plan
===========================================
|ID|OPERATOR                     |NAME    |
-------------------------------------------
|0 |DISTRIBUTED DELETE           |        |
|1 |└─HASH JOIN                  |        |
|2 |  ├─PX COORDINATOR           |        |
|3 |  │ └─EXCHANGE OUT DISTR     |:EX10000|
|4 |  │   └─PX PARTITION ITERATOR|        |
|5 |  │     └─TABLE FULL SCAN    |t16     |
|6 |  └─PX COORDINATOR           |        |
|7 |    └─EXCHANGE OUT DISTR     |:EX20000|
|8 |      └─TABLE FULL SCAN      |t17     |
===========================================
Outputs & filters:
-------------------------------------
  0 - output(nil), filter(nil)
      table_columns([{t16: ({t16: (t16.a, t16.b)})}])
  1 - output([t16.a], [t16.b]), filter(nil), rowset=16
      equal_conds([t16.b = t17.a]), other_conds(nil)
  2 - output([t16.a], [t16.b]), filter(nil), rowset=16
  3 - output([t16.a], [t16.b]), filter(nil), rowset=16
      dop=1
  4 - output([t16.a], [t16.b]), filter(nil), rowset=16
      force partition granule
  5 - output([t16.a], [t16.b]), filter(nil), rowset=16
      access([t16.a], [t16.b]), partitions(p[0-4])
      is_index_back=false, is_global_index=false, 
      range_key([t16.a]), range(MIN ; MAX)always true
  6 - output([t17.a]), filter(nil), rowset=16
  7 - output([t17.a]), filter(nil), rowset=16
      is_single, dop=1
  8 - output([t17.a]), filter(nil), rowset=16
      access([t17.a]), partitions(p0)
      is_index_back=false, is_global_index=false, 
      range_key([t17.a]), range(MIN ; MAX)always true
affected rows: 35
delete from t16 where b in (select a from t17);
affected rows: 0
EXPLAIN BASIC delete from t16 where a in (select a from t17);
Query Plan
=================================================
|ID|OPERATOR                           |NAME    |
-------------------------------------------------
|0 |DISTRIBUTED DELETE                 |        |
|1 |└─PX COORDINATOR                   |        |
|2 |  └─EXCHANGE OUT DISTR             |:EX10001|
|3 |    └─HASH JOIN                    |        |
|4 |      ├─PX PARTITION ITERATOR      |        |
|5 |      │ └─TABLE FULL SCAN          |t16     |
|6 |      └─EXCHANGE IN DISTR          |        |
|7 |        └─EXCHANGE OUT DISTR (PKEY)|:EX10000|
|8 |          └─TABLE FULL SCAN        |t17     |
=================================================
Outputs & filters:
-------------------------------------
  0 - output(nil), filter(nil)
      table_columns([{t16: ({t16: (t16.a, t16.b)})}])
  1 - output([t16.a], [t16.b]), filter(nil), rowset=16
  2 - output([t16.a], [t16.b]), filter(nil), rowset=16
      dop=1
  3 - output([t16.a], [t16.b]), filter(nil), rowset=16
      equal_conds([t16.a = t17.a]), other_conds(nil)
  4 - output([t16.a], [t16.b]), filter(nil), rowset=16
      affinitize, force partition granule
  5 - output([t16.a], [t16.b]), filter(nil), rowset=16
      access([t16.a], [t16.b]), partitions(p[0-4])
      is_index_back=false, is_global_index=false, 
      range_key([t16.a]), range(MIN ; MAX)always true
  6 - output([t17.a]), filter(nil), rowset=16
  7 - output([t17.a]), filter(nil), rowset=16
      (#keys=1, [t17.a]), is_single, dop=1
  8 - output([t17.a]), filter(nil), rowset=16
      access([t17.a]), partitions(p0)
      is_index_back=false, is_global_index=false, 
      range_key([t17.a]), range(MIN ; MAX)always true
affected rows: 35
delete from t16 where a in (select a from t17);
affected rows: 0
EXPLAIN BASIC select * from t16;
Query Plan
=======================================
|ID|OPERATOR                 |NAME    |
---------------------------------------
|0 |PX COORDINATOR           |        |
|1 |└─EXCHANGE OUT DISTR     |:EX10000|
|2 |  └─PX PARTITION ITERATOR|        |
|3 |    └─TABLE FULL SCAN    |t16     |
=======================================
Outputs & filters:
-------------------------------------
  0 - output([INTERNAL_FUNCTION(t16.a, t16.b)]), filter(nil), rowset=16
  1 - output([INTERNAL_FUNCTION(t16.a, t16.b)]), filter(nil), rowset=16
      dop=1
  2 - output([t16.a], [t16.b]), filter(nil), rowset=16
      force partition granule
  3 - output([t16.a], [t16.b]), filter(nil), rowset=16
      access([t16.a], [t16.b]), partitions(p[0-4])
      is_index_back=false, is_global_index=false, 
      range_key([t16.a]), range(MIN ; MAX)always true
affected rows: 19
select * from t16;
+----+------+
| a  | b    |
+----+------+
| 12 | NULL |
| 13 | NULL |
+----+------+
affected rows: 2
drop table t16, t17;
affected rows: 0

EXPLAIN BASIC replace into t18 values(1, 2, 3);
Query Plan
=============================
|ID|OPERATOR           |NAME|
-----------------------------
|0 |DISTRIBUTED REPLACE|    |
|1 |└─EXPRESSION       |    |
=============================
Outputs & filters:
-------------------------------------
  0 - output(nil), filter(nil)
      columns([{t18: ({t18: (t18.a, t18.b, t18.c)}, {idx: (t18.b, t18.a)})}]), 
      column_values([column_conv(INT,PS:(11,0),NOT NULL,__values.a)], [column_conv(INT,PS:(11,0),NULL,__values.b)], [column_conv(INT,PS:(11,0),NULL,__values.c)])
  1 - output([__values.a], [__values.b], [__values.c]), filter(nil)
      values({1, 2, 3})
affected rows: 13
replace into t18 values(1, 2, 3);
affected rows: 4
EXPLAIN BASIC select * from t18;
Query Plan
===============================
|ID|OPERATOR             |NAME|
-------------------------------
|0 |EXCHANGE IN REMOTE   |    |
|1 |└─EXCHANGE OUT REMOTE|    |
|2 |  └─TABLE FULL SCAN  |t18 |
===============================
Outputs & filters:
-------------------------------------
  0 - output([t18.a], [t18.b], [t18.c]), filter(nil)
  1 - output([t18.a], [t18.b], [t18.c]), filter(nil)
  2 - output([t18.a], [t18.b], [t18.c]), filter(nil), rowset=16
      access([t18.a], [t18.b], [t18.c]), partitions(p0)
      is_index_back=false, is_global_index=false, 
      range_key([t18.a]), range(MIN ; MAX)always true
affected rows: 15
select * from t18;
+---+------+------+
| a | b    | c    |
+---+------+------+
| 1 |    2 |    3 |
+---+------+------+
affected rows: 1
drop table t18;
affected rows: 0

EXPLAIN BASIC insert into t19 values(1, 1, 1), (2, 2, 2), (3, 3, 3), (4, 4, 4), (5, 5, 5);
Query Plan
============================
|ID|OPERATOR          |NAME|
----------------------------
|0 |DISTRIBUTED INSERT|    |
|1 |└─EXPRESSION      |    |
============================
Outputs & filters:
-------------------------------------
  0 - output(nil), filter(nil)
      columns([{t19: ({t19: (t19.a, t19.b, t19.c)}, {idx: (t19.b, t19.a)})}]), 
      column_values([column_conv(INT,PS:(11,0),NOT NULL,__values.a)], [column_conv(INT,PS:(11,0),NULL,__values.b)], [column_conv(INT,PS:(11,0),NULL,__values.c)])
  1 - output([__values.a], [__values.b], [__values.c]), filter(nil)
      values({1, 1, 1}, {2, 2, 2}, {3, 3, 3}, {4, 4, 4}, {5, 5, 5})
affected rows: 13
insert into t19 values(1, 1, 1), (2, 2, 2), (3, 3, 3), (4, 4, 4), (5, 5, 5);
affected rows: 5
info: Records: 5  Duplicates: 0  Warnings: 0
EXPLAIN BASIC select * from t19;
Query Plan
===============================
|ID|OPERATOR             |NAME|
-------------------------------
|0 |EXCHANGE IN REMOTE   |    |
|1 |└─EXCHANGE OUT REMOTE|    |
|2 |  └─TABLE FULL SCAN  |t19 |
===============================
Outputs & filters:
-------------------------------------
  0 - output([t19.a], [t19.b], [t19.c]), filter(nil)
  1 - output([t19.a], [t19.b], [t19.c]), filter(nil)
  2 - output([t19.a], [t19.b], [t19.c]), filter(nil), rowset=16
      access([t19.a], [t19.b], [t19.c]), partitions(p0)
      is_index_back=false, is_global_index=false, 
      range_key([t19.a]), range(MIN ; MAX)always true
affected rows: 15
select * from t19;
+---+------+------+
| a | b    | c    |
+---+------+------+
| 1 |    1 |    1 |
| 2 |    2 |    2 |
| 3 |    3 |    3 |
| 4 |    4 |    4 |
| 5 |    5 |    5 |
+---+------+------+
affected rows: 5
EXPLAIN BASIC insert into t19 values(1, 1, 1), (2, 2, 2), (3, 3, 3), (4, 4, 4), (5, 5, 5) on duplicate key update b=values(b);
Query Plan
===============================
|ID|OPERATOR             |NAME|
-------------------------------
|0 |DISTRIBUTED INSERT_UP|    |
|1 |└─EXPRESSION         |    |
===============================
Outputs & filters:
-------------------------------------
  0 - output(nil), filter(nil)
      columns([{t19: ({t19: (t19.a, t19.b, t19.c)}, {idx: (t19.b, t19.a)})}]), 
      column_values([column_conv(INT,PS:(11,0),NOT NULL,__values.a)], [column_conv(INT,PS:(11,0),NULL,__values.b)], [column_conv(INT,PS:(11,0),NULL,__values.c)]),
      
      update([t19.b=column_conv(INT,PS:(11,0),NULL,values(column_conv(INT,PS:(11,0),NULL,__values.b)))])
  1 - output([__values.a], [__values.b], [__values.c]), filter(nil)
      values({1, 1, 1}, {2, 2, 2}, {3, 3, 3}, {4, 4, 4}, {5, 5, 5})
affected rows: 15
insert into t19 values(1, 1, 1), (2, 2, 2), (3, 3, 3), (4, 4, 4), (5, 5, 5) on duplicate key update b=values(b);
affected rows: 0
info: Records: 5  Duplicates: 0  Warnings: 0
EXPLAIN BASIC select * from t19;
Query Plan
===============================
|ID|OPERATOR             |NAME|
-------------------------------
|0 |EXCHANGE IN REMOTE   |    |
|1 |└─EXCHANGE OUT REMOTE|    |
|2 |  └─TABLE FULL SCAN  |t19 |
===============================
Outputs & filters:
-------------------------------------
  0 - output([t19.a], [t19.b], [t19.c]), filter(nil)
  1 - output([t19.a], [t19.b], [t19.c]), filter(nil)
  2 - output([t19.a], [t19.b], [t19.c]), filter(nil), rowset=16
      access([t19.a], [t19.b], [t19.c]), partitions(p0)
      is_index_back=false, is_global_index=false, 
      range_key([t19.a]), range(MIN ; MAX)always true
affected rows: 15
select * from t19;
+---+------+------+
| a | b    | c    |
+---+------+------+
| 1 |    1 |    1 |
| 2 |    2 |    2 |
| 3 |    3 |    3 |
| 4 |    4 |    4 |
| 5 |    5 |    5 |
+---+------+------+
affected rows: 5
drop table t19;
affected rows: 0

EXPLAIN BASIC select * from t20;
Query Plan
===============================
|ID|OPERATOR             |NAME|
-------------------------------
|0 |EXCHANGE IN REMOTE   |    |
|1 |└─EXCHANGE OUT REMOTE|    |
|2 |  └─TABLE FULL SCAN  |t20 |
===============================
Outputs & filters:
-------------------------------------
  0 - output([t20.c1], [t20.c2], [t20.c3]), filter(nil)
  1 - output([t20.c1], [t20.c2], [t20.c3]), filter(nil)
  2 - output([t20.c1], [t20.c2], [t20.c3]), filter(nil), rowset=16
      access([t20.c1], [t20.c2], [t20.c3]), partitions(p0)
      is_index_back=false, is_global_index=false, 
      range_key([t20.c1]), range(MIN ; MAX)always true
affected rows: 15
select * from t20;
+----+------+------+
| c1 | c2   | c3   |
+----+------+------+
|  1 |    3 |    3 |
|  2 |    4 |    4 |
|  3 |    5 |    5 |
+----+------+------+
affected rows: 3
drop table t20;
affected rows: 0

EXPLAIN BASIC insert into t21(b, c) values(1, 1), (2, 2), (3, 3);
Query Plan
============================
|ID|OPERATOR          |NAME|
----------------------------
|0 |DISTRIBUTED INSERT|    |
|1 |└─EXPRESSION      |    |
============================
Outputs & filters:
-------------------------------------
  0 - output(nil), filter(nil)
      columns([{t21: ({t21: (t21.b, t21.a, t21.c)}, {idx: (t21.b)})}]), 
      column_values([column_conv(INT,PS:(11,0),NOT NULL,__values.b)], [column_conv(INT,PS:(11,0),NOT NULL,cast(t21.a.nextval(), INT(-1, 0)))], [column_conv(INT,
      PS:(11,0),NULL,__values.c)])
  1 - output([__values.b], [__values.c]), filter(nil)
      values({1, 1}, {2, 2}, {3, 3})
affected rows: 14
insert into t21(b, c) values(1, 1), (2, 2), (3, 3);
affected rows: 3
info: Records: 3  Duplicates: 0  Warnings: 0
EXPLAIN BASIC select * from t21;
Query Plan
auto_increment
auto_increment
auto_increment
auto_increment
auto_increment
auto_increment
auto_increment
auto_increment
auto_increment
auto_increment
auto_increment
auto_increment
auto_increment
auto_increment
auto_increment
affected rows: 15
select * from t21;
+---+---+------+
| a | b | c    |
+---+---+------+
| auto_increment | 1 |    1 |
| auto_increment | 2 |    2 |
| auto_increment | 3 |    3 |
+---+---+------+
affected rows: 3
EXPLAIN BASIC insert into t21(b, c) values(1, 1), (2, 2), (3, 3), (4, 4) on duplicate key update b=values(b)+10;
Query Plan
===============================
|ID|OPERATOR             |NAME|
-------------------------------
|0 |DISTRIBUTED INSERT_UP|    |
|1 |└─EXPRESSION         |    |
===============================
Outputs & filters:
-------------------------------------
  0 - output(nil), filter(nil)
      columns([{t21: ({t21: (t21.b, t21.a, t21.c)}, {idx: (t21.b)})}]), 
      column_values([column_conv(INT,PS:(11,0),NOT NULL,__values.b)], [column_conv(INT,PS:(11,0),NOT NULL,cast(t21.a.nextval(), INT(-1, 0)))], [column_conv(INT,
      PS:(11,0),NULL,__values.c)]),
      update([t21.b=column_conv(INT,PS:(11,0),NOT NULL,cast(values(column_conv(INT,PS:(11,0),NOT NULL,__values.b)) + 10, INT(-1, 0)))])
  1 - output([__values.b], [__values.c]), filter(nil)
      values({1, 1}, {2, 2}, {3, 3}, {4, 4})
affected rows: 15
insert into t21(b, c) values(1, 1), (2, 2), (3, 3), (4, 4) on duplicate key update b=values(b)+10;
affected rows: 7
info: Records: 4  Duplicates: 3  Warnings: 0
EXPLAIN BASIC select * from t21;
Query Plan
auto_increment
auto_increment
auto_increment
auto_increment
auto_increment
auto_increment
auto_increment
auto_increment
auto_increment
auto_increment
auto_increment
auto_increment
auto_increment
auto_increment
auto_increment
affected rows: 15
select * from t21;
+---+----+------+
| a | b  | c    |
+---+----+------+
| auto_increment |  4 |    4 |
| auto_increment | 11 |    1 |
| auto_increment | 12 |    2 |
| auto_increment | 13 |    3 |
+---+----+------+
affected rows: 4
EXPLAIN BASIC replace into t21(b, c) values(1, 1), (2, 2), (3, 3), (4, 5);
Query Plan
=============================
|ID|OPERATOR           |NAME|
-----------------------------
|0 |DISTRIBUTED REPLACE|    |
|1 |└─EXPRESSION       |    |
=============================
Outputs & filters:
-------------------------------------
  0 - output(nil), filter(nil)
      columns([{t21: ({t21: (t21.b, t21.a, t21.c)}, {idx: (t21.b)})}]), 
      column_values([column_conv(INT,PS:(11,0),NOT NULL,__values.b)], [column_conv(INT,PS:(11,0),NOT NULL,cast(t21.a.nextval(), INT(-1, 0)))], [column_conv(INT,
      PS:(11,0),NULL,__values.c)])
  1 - output([__values.b], [__values.c]), filter(nil)
      values({1, 1}, {2, 2}, {3, 3}, {4, 5})
affected rows: 14
replace into t21(b, c) values(1, 1), (2, 2), (3, 3), (4, 5);
affected rows: 5
info: Records: 4  Duplicates: 1  Warnings: 0
EXPLAIN BASIC select * from t21;
Query Plan
auto_increment
auto_increment
auto_increment
auto_increment
auto_increment
auto_increment
auto_increment
auto_increment
auto_increment
auto_increment
auto_increment
auto_increment
auto_increment
auto_increment
auto_increment
affected rows: 15
select * from t21;
+----+----+------+
| a  | b  | c    |
+----+----+------+
| auto_increment |  1 |    1 |
| auto_increment |  2 |    2 |
| auto_increment |  3 |    3 |
| auto_increment |  4 |    5 |
| auto_increment | 11 |    1 |
| auto_increment | 12 |    2 |
| auto_increment | 13 |    3 |
+----+----+------+
affected rows: 7
drop table t21;
affected rows: 0

EXPLAIN BASIC insert into t22 values(1, 1, 1, now());
Query Plan
============================
|ID|OPERATOR          |NAME|
----------------------------
|0 |DISTRIBUTED INSERT|    |
|1 |└─EXPRESSION      |    |
============================
Outputs & filters:
-------------------------------------
  0 - output(nil), filter(nil)
      columns([{t22: ({t22: (t22.a, t22.b, t22.c, t22.d)}, {idx: (t22.c, t22.d, t22.a)})}]), 
      column_values([column_conv(INT,PS:(11,0),NOT NULL,__values.a)], [column_conv(INT,PS:(11,0),NULL,__values.b)], [column_conv(INT,PS:(11,0),NULL,__values.c)],
       [column_conv(TIMESTAMP,PS:(25,6),NULL,__values.d)])
  1 - output([__values.a], [__values.b], [__values.c], [__values.d]), filter(nil)
      values({1, 1, 1, current_timestamp()})
affected rows: 14
insert into t22 values(1, 1, 1, now());
affected rows: 1
EXPLAIN BASIC select * from t22;
Query Plan
=======================================
|ID|OPERATOR                 |NAME    |
---------------------------------------
|0 |PX COORDINATOR           |        |
|1 |└─EXCHANGE OUT DISTR     |:EX10000|
|2 |  └─PX PARTITION ITERATOR|        |
|3 |    └─TABLE FULL SCAN    |t22     |
=======================================
Outputs & filters:
-------------------------------------
  0 - output([INTERNAL_FUNCTION(t22.a, t22.b, t22.c, t22.d)]), filter(nil), rowset=16
  1 - output([INTERNAL_FUNCTION(t22.a, t22.b, t22.c, t22.d)]), filter(nil), rowset=16
      dop=1
  2 - output([t22.a], [t22.b], [t22.c], [t22.d]), filter(nil), rowset=16
      force partition granule
  3 - output([t22.a], [t22.b], [t22.c], [t22.d]), filter(nil), rowset=16
      access([t22.a], [t22.b], [t22.c], [t22.d]), partitions(p[0-4])
      is_index_back=false, is_global_index=false, 
      range_key([t22.a]), range(MIN ; MAX)always true
affected rows: 19
select * from t22;
+---+------+------+----------------------------+
| a | b    | c    | d                          |
+---+------+------+----------------------------+
| 1 |    1 |    1 | TIMESTAMP                  |
+---+------+------+----------------------------+
affected rows: 1
EXPLAIN BASIC update t22 set b=2, c=1 where a=1;
Query Plan
====================================
|ID|OPERATOR              |NAME    |
------------------------------------
|0 |DISTRIBUTED UPDATE    |        |
|1 |└─PX COORDINATOR      |        |
|2 |  └─EXCHANGE OUT DISTR|:EX10000|
|3 |    └─TABLE GET       |t22     |
====================================
Outputs & filters:
-------------------------------------
  0 - output(nil), filter(nil)
      table_columns([{t22: ({t22: (t22.a, t22.b, t22.c, t22.d)}, {idx: (t22.c, t22.d, t22.a)})}]),
      update([t22.b=column_conv(INT,PS:(11,0),NULL,2)], [t22.c=column_conv(INT,PS:(11,0),NULL,1)], [t22.d=column_conv(TIMESTAMP,PS:(25,6),NULL,cast(current_timestamp(),
       TIMESTAMP(25, 6)))])
  1 - output([t22.a], [t22.b], [t22.c], [t22.d]), filter(nil), rowset=16
  2 - output([t22.a], [t22.b], [t22.c], [t22.d]), filter(nil), rowset=16
      is_single, dop=1
  3 - output([t22.a], [t22.b], [t22.c], [t22.d]), filter(nil), rowset=16
      access([t22.a], [t22.b], [t22.c], [t22.d]), partitions(p1)
      is_index_back=false, is_global_index=false, 
      range_key([t22.a]), range[1 ; 1], 
      range_cond([t22.a = 1])
affected rows: 22
update t22 set b=2, c=1 where a=1;
affected rows: 1
info: Rows matched: 1  Changed: 1  Warnings: 0
EXPLAIN BASIC select /*+index(t22 primary)*/ a, c, d from t22;
Query Plan
=======================================
|ID|OPERATOR                 |NAME    |
---------------------------------------
|0 |PX COORDINATOR           |        |
|1 |└─EXCHANGE OUT DISTR     |:EX10000|
|2 |  └─PX PARTITION ITERATOR|        |
|3 |    └─TABLE FULL SCAN    |t22     |
=======================================
Outputs & filters:
-------------------------------------
  0 - output([INTERNAL_FUNCTION(t22.a, t22.c, t22.d)]), filter(nil), rowset=16
  1 - output([INTERNAL_FUNCTION(t22.a, t22.c, t22.d)]), filter(nil), rowset=16
      dop=1
  2 - output([t22.a], [t22.c], [t22.d]), filter(nil), rowset=16
      force partition granule
  3 - output([t22.a], [t22.c], [t22.d]), filter(nil), rowset=16
      access([t22.a], [t22.c], [t22.d]), partitions(p[0-4])
      is_index_back=false, is_global_index=false, 
      range_key([t22.a]), range(MIN ; MAX)always true
affected rows: 19
select /*+index(t22 primary)*/ a, c, d from t22;
+---+------+----------------------------+
| a | c    | d                          |
+---+------+----------------------------+
| 1 |    1 | TIMESTAMP                  |
+---+------+----------------------------+
affected rows: 1
EXPLAIN BASIC select /*+index(t22 idx)*/ a, c, d from t22;
Query Plan
===================================
|ID|OPERATOR             |NAME    |
-----------------------------------
|0 |EXCHANGE IN REMOTE   |        |
|1 |└─EXCHANGE OUT REMOTE|        |
|2 |  └─TABLE FULL SCAN  |t22(idx)|
===================================
Outputs & filters:
-------------------------------------
  0 - output([t22.a], [t22.c], [t22.d]), filter(nil)
  1 - output([t22.a], [t22.c], [t22.d]), filter(nil)
  2 - output([t22.a], [t22.c], [t22.d]), filter(nil), rowset=16
      access([t22.a], [t22.c], [t22.d]), partitions(p0)
      is_index_back=false, is_global_index=true, 
      range_key([t22.c], [t22.d], [t22.a]), range(MIN,MIN,MIN ; MAX,MAX,MAX)always true
affected rows: 15
select /*+index(t22 idx)*/ a, c, d from t22;
+---+------+----------------------------+
| a | c    | d                          |
+---+------+----------------------------+
| 1 |    1 | TIMESTAMP                  |
+---+------+----------------------------+
affected rows: 1
EXPLAIN BASIC update t22 set b=2, c=2 where a=1;
Query Plan
====================================
|ID|OPERATOR              |NAME    |
------------------------------------
|0 |DISTRIBUTED UPDATE    |        |
|1 |└─PX COORDINATOR      |        |
|2 |  └─EXCHANGE OUT DISTR|:EX10000|
|3 |    └─TABLE GET       |t22     |
====================================
Outputs & filters:
-------------------------------------
  0 - output(nil), filter(nil)
      table_columns([{t22: ({t22: (t22.a, t22.b, t22.c, t22.d)}, {idx: (t22.c, t22.d, t22.a)})}]),
      update([t22.b=column_conv(INT,PS:(11,0),NULL,2)], [t22.c=column_conv(INT,PS:(11,0),NULL,2)], [t22.d=column_conv(TIMESTAMP,PS:(25,6),NULL,cast(current_timestamp(),
       TIMESTAMP(25, 6)))])
  1 - output([t22.a], [t22.b], [t22.c], [t22.d]), filter(nil), rowset=16
  2 - output([t22.a], [t22.b], [t22.c], [t22.d]), filter(nil), rowset=16
      is_single, dop=1
  3 - output([t22.a], [t22.b], [t22.c], [t22.d]), filter(nil), rowset=16
      access([t22.a], [t22.b], [t22.c], [t22.d]), partitions(p1)
      is_index_back=false, is_global_index=false, 
      range_key([t22.a]), range[1 ; 1], 
      range_cond([t22.a = 1])
affected rows: 22
update t22 set b=2, c=2 where a=1;
affected rows: 1
info: Rows matched: 1  Changed: 1  Warnings: 0
EXPLAIN BASIC select /*+index(t22 primary)*/ a, c, d from t22;
Query Plan
=======================================
|ID|OPERATOR                 |NAME    |
---------------------------------------
|0 |PX COORDINATOR           |        |
|1 |└─EXCHANGE OUT DISTR     |:EX10000|
|2 |  └─PX PARTITION ITERATOR|        |
|3 |    └─TABLE FULL SCAN    |t22     |
=======================================
Outputs & filters:
-------------------------------------
  0 - output([INTERNAL_FUNCTION(t22.a, t22.c, t22.d)]), filter(nil), rowset=16
  1 - output([INTERNAL_FUNCTION(t22.a, t22.c, t22.d)]), filter(nil), rowset=16
      dop=1
  2 - output([t22.a], [t22.c], [t22.d]), filter(nil), rowset=16
      force partition granule
  3 - output([t22.a], [t22.c], [t22.d]), filter(nil), rowset=16
      access([t22.a], [t22.c], [t22.d]), partitions(p[0-4])
      is_index_back=false, is_global_index=false, 
      range_key([t22.a]), range(MIN ; MAX)always true
affected rows: 19
select /*+index(t22 primary)*/ a, c, d from t22;
+---+------+----------------------------+
| a | c    | d                          |
+---+------+----------------------------+
| 1 |    2 | TIMESTAMP                  |
+---+------+----------------------------+
affected rows: 1
EXPLAIN BASIC select /*+index(t22 idx)*/ a, c, d from t22;
Query Plan
===================================
|ID|OPERATOR             |NAME    |
-----------------------------------
|0 |EXCHANGE IN REMOTE   |        |
|1 |└─EXCHANGE OUT REMOTE|        |
|2 |  └─TABLE FULL SCAN  |t22(idx)|
===================================
Outputs & filters:
-------------------------------------
  0 - output([t22.a], [t22.c], [t22.d]), filter(nil)
  1 - output([t22.a], [t22.c], [t22.d]), filter(nil)
  2 - output([t22.a], [t22.c], [t22.d]), filter(nil), rowset=16
      access([t22.a], [t22.c], [t22.d]), partitions(p0)
      is_index_back=false, is_global_index=true, 
      range_key([t22.c], [t22.d], [t22.a]), range(MIN,MIN,MIN ; MAX,MAX,MAX)always true
affected rows: 15
select /*+index(t22 idx)*/ a, c, d from t22;
+---+------+----------------------------+
| a | c    | d                          |
+---+------+----------------------------+
| 1 |    2 | TIMESTAMP                  |
+---+------+----------------------------+
affected rows: 1
drop table t22;
affected rows: 0

EXPLAIN BASIC insert into t23 values(1, 1, 1, now());
Query Plan
============================
|ID|OPERATOR          |NAME|
----------------------------
|0 |DISTRIBUTED INSERT|    |
|1 |└─EXPRESSION      |    |
============================
Outputs & filters:
-------------------------------------
  0 - output(nil), filter(nil)
      columns([{t23: ({t23: (t23.a, t23.b, t23.c, t23.d)}, {idx: (t23.c, t23.d, t23.a)})}]), 
      column_values([column_conv(INT,PS:(11,0),NOT NULL,__values.a)], [column_conv(INT,PS:(11,0),NULL,__values.b)], [column_conv(INT,PS:(11,0),NULL,__values.c)],
       [column_conv(TIMESTAMP,PS:(25,6),NULL,__values.d)])
  1 - output([__values.a], [__values.b], [__values.c], [__values.d]), filter(nil)
      values({1, 1, 1, current_timestamp()})
affected rows: 14
insert into t23 values(1, 1, 1, now());
affected rows: 1
EXPLAIN BASIC select * from t23;
Query Plan
=======================================
|ID|OPERATOR                 |NAME    |
---------------------------------------
|0 |PX COORDINATOR           |        |
|1 |└─EXCHANGE OUT DISTR     |:EX10000|
|2 |  └─PX PARTITION ITERATOR|        |
|3 |    └─TABLE FULL SCAN    |t23     |
=======================================
Outputs & filters:
-------------------------------------
  0 - output([INTERNAL_FUNCTION(t23.a, t23.b, t23.c, t23.d)]), filter(nil), rowset=16
  1 - output([INTERNAL_FUNCTION(t23.a, t23.b, t23.c, t23.d)]), filter(nil), rowset=16
      dop=1
  2 - output([t23.a], [t23.b], [t23.c], [t23.d]), filter(nil), rowset=16
      force partition granule
  3 - output([t23.a], [t23.b], [t23.c], [t23.d]), filter(nil), rowset=16
      access([t23.a], [t23.b], [t23.c], [t23.d]), partitions(p[0-4])
      is_index_back=false, is_global_index=false, 
      range_key([t23.a]), range(MIN ; MAX)always true
affected rows: 19
select * from t23;
+---+------+------+----------------------------+
| a | b    | c    | d                          |
+---+------+------+----------------------------+
| 1 |    1 |    1 | TIMESTAMP                  |
+---+------+------+----------------------------+
affected rows: 1
EXPLAIN BASIC insert into t23 values(1, 1, 1, now()) on duplicate key update b=1, c=1;
Query Plan
===============================
|ID|OPERATOR             |NAME|
-------------------------------
|0 |DISTRIBUTED INSERT_UP|    |
|1 |└─EXPRESSION         |    |
===============================
Outputs & filters:
-------------------------------------
  0 - output(nil), filter(nil)
      columns([{t23: ({t23: (t23.a, t23.b, t23.c, t23.d)}, {idx: (t23.c, t23.d, t23.a)})}]), 
      column_values([column_conv(INT,PS:(11,0),NOT NULL,__values.a)], [column_conv(INT,PS:(11,0),NULL,__values.b)], [column_conv(INT,PS:(11,0),NULL,__values.c)],
       [column_conv(TIMESTAMP,PS:(25,6),NULL,__values.d)]),
      update([t23.b=column_conv(INT,PS:(11,0),NULL,1)], [t23.c=column_conv(INT,PS:(11,0),NULL,1)], [t23.d=column_conv(TIMESTAMP,PS:(25,6),NULL,cast(current_timestamp(),
       TIMESTAMP(25, 6)))])
  1 - output([__values.a], [__values.b], [__values.c], [__values.d]), filter(nil)
      values({1, 1, 1, current_timestamp()})
affected rows: 16
insert into t23 values(1, 1, 1, now()) on duplicate key update b=1, c=1;
affected rows: 0
EXPLAIN BASIC select /*+index(t23 primary)*/ a, c, d from t23;
Query Plan
=======================================
|ID|OPERATOR                 |NAME    |
---------------------------------------
|0 |PX COORDINATOR           |        |
|1 |└─EXCHANGE OUT DISTR     |:EX10000|
|2 |  └─PX PARTITION ITERATOR|        |
|3 |    └─TABLE FULL SCAN    |t23     |
=======================================
Outputs & filters:
-------------------------------------
  0 - output([INTERNAL_FUNCTION(t23.a, t23.c, t23.d)]), filter(nil), rowset=16
  1 - output([INTERNAL_FUNCTION(t23.a, t23.c, t23.d)]), filter(nil), rowset=16
      dop=1
  2 - output([t23.a], [t23.c], [t23.d]), filter(nil), rowset=16
      force partition granule
  3 - output([t23.a], [t23.c], [t23.d]), filter(nil), rowset=16
      access([t23.a], [t23.c], [t23.d]), partitions(p[0-4])
      is_index_back=false, is_global_index=false, 
      range_key([t23.a]), range(MIN ; MAX)always true
affected rows: 19
select /*+index(t23 primary)*/ a, c, d from t23;
+---+------+----------------------------+
| a | c    | d                          |
+---+------+----------------------------+
| 1 |    1 | TIMESTAMP                  |
+---+------+----------------------------+
affected rows: 1
EXPLAIN BASIC select /*+index(t23 idx)*/ a, c, d from t23;
Query Plan
===================================
|ID|OPERATOR             |NAME    |
-----------------------------------
|0 |EXCHANGE IN REMOTE   |        |
|1 |└─EXCHANGE OUT REMOTE|        |
|2 |  └─TABLE FULL SCAN  |t23(idx)|
===================================
Outputs & filters:
-------------------------------------
  0 - output([t23.a], [t23.c], [t23.d]), filter(nil)
  1 - output([t23.a], [t23.c], [t23.d]), filter(nil)
  2 - output([t23.a], [t23.c], [t23.d]), filter(nil), rowset=16
      access([t23.a], [t23.c], [t23.d]), partitions(p0)
      is_index_back=false, is_global_index=true, 
      range_key([t23.c], [t23.d], [t23.a]), range(MIN,MIN,MIN ; MAX,MAX,MAX)always true
affected rows: 15
select /*+index(t23 idx)*/ a, c, d from t23;
+---+------+----------------------------+
| a | c    | d                          |
+---+------+----------------------------+
| 1 |    1 | TIMESTAMP                  |
+---+------+----------------------------+
affected rows: 1
"OK! timestamp is the same"
EXPLAIN BASIC insert into t23 values(1, 1, 1, now()) on duplicate key update b=2, c=1;
Query Plan
===============================
|ID|OPERATOR             |NAME|
-------------------------------
|0 |DISTRIBUTED INSERT_UP|    |
|1 |└─EXPRESSION         |    |
===============================
Outputs & filters:
-------------------------------------
  0 - output(nil), filter(nil)
      columns([{t23: ({t23: (t23.a, t23.b, t23.c, t23.d)}, {idx: (t23.c, t23.d, t23.a)})}]), 
      column_values([column_conv(INT,PS:(11,0),NOT NULL,__values.a)], [column_conv(INT,PS:(11,0),NULL,__values.b)], [column_conv(INT,PS:(11,0),NULL,__values.c)],
       [column_conv(TIMESTAMP,PS:(25,6),NULL,__values.d)]),
      update([t23.b=column_conv(INT,PS:(11,0),NULL,2)], [t23.c=column_conv(INT,PS:(11,0),NULL,1)], [t23.d=column_conv(TIMESTAMP,PS:(25,6),NULL,cast(current_timestamp(),
       TIMESTAMP(25, 6)))])
  1 - output([__values.a], [__values.b], [__values.c], [__values.d]), filter(nil)
      values({1, 1, 1, current_timestamp()})
affected rows: 16
insert into t23 values(1, 1, 1, now()) on duplicate key update b=2, c=1;
affected rows: 2
EXPLAIN BASIC select /*+index(t23 primary)*/ a, c, d from t23;
Query Plan
=======================================
|ID|OPERATOR                 |NAME    |
---------------------------------------
|0 |PX COORDINATOR           |        |
|1 |└─EXCHANGE OUT DISTR     |:EX10000|
|2 |  └─PX PARTITION ITERATOR|        |
|3 |    └─TABLE FULL SCAN    |t23     |
=======================================
Outputs & filters:
-------------------------------------
  0 - output([INTERNAL_FUNCTION(t23.a, t23.c, t23.d)]), filter(nil), rowset=16
  1 - output([INTERNAL_FUNCTION(t23.a, t23.c, t23.d)]), filter(nil), rowset=16
      dop=1
  2 - output([t23.a], [t23.c], [t23.d]), filter(nil), rowset=16
      force partition granule
  3 - output([t23.a], [t23.c], [t23.d]), filter(nil), rowset=16
      access([t23.a], [t23.c], [t23.d]), partitions(p[0-4])
      is_index_back=false, is_global_index=false, 
      range_key([t23.a]), range(MIN ; MAX)always true
affected rows: 19
select /*+index(t23 primary)*/ a, c, d from t23;
+---+------+----------------------------+
| a | c    | d                          |
+---+------+----------------------------+
| 1 |    1 | TIMESTAMP                  |
+---+------+----------------------------+
affected rows: 1
EXPLAIN BASIC select /*+index(t23 idx)*/ a, c, d from t23;
Query Plan
===================================
|ID|OPERATOR             |NAME    |
-----------------------------------
|0 |EXCHANGE IN REMOTE   |        |
|1 |└─EXCHANGE OUT REMOTE|        |
|2 |  └─TABLE FULL SCAN  |t23(idx)|
===================================
Outputs & filters:
-------------------------------------
  0 - output([t23.a], [t23.c], [t23.d]), filter(nil)
  1 - output([t23.a], [t23.c], [t23.d]), filter(nil)
  2 - output([t23.a], [t23.c], [t23.d]), filter(nil), rowset=16
      access([t23.a], [t23.c], [t23.d]), partitions(p0)
      is_index_back=false, is_global_index=true, 
      range_key([t23.c], [t23.d], [t23.a]), range(MIN,MIN,MIN ; MAX,MAX,MAX)always true
affected rows: 15
select /*+index(t23 idx)*/ a, c, d from t23;
+---+------+----------------------------+
| a | c    | d                          |
+---+------+----------------------------+
| 1 |    1 | TIMESTAMP                  |
+---+------+----------------------------+
affected rows: 1
EXPLAIN BASIC insert into t23 values(1, 1, 1, now()) on duplicate key update b=2, c=2;
Query Plan
===============================
|ID|OPERATOR             |NAME|
-------------------------------
|0 |DISTRIBUTED INSERT_UP|    |
|1 |└─EXPRESSION         |    |
===============================
Outputs & filters:
-------------------------------------
  0 - output(nil), filter(nil)
      columns([{t23: ({t23: (t23.a, t23.b, t23.c, t23.d)}, {idx: (t23.c, t23.d, t23.a)})}]), 
      column_values([column_conv(INT,PS:(11,0),NOT NULL,__values.a)], [column_conv(INT,PS:(11,0),NULL,__values.b)], [column_conv(INT,PS:(11,0),NULL,__values.c)],
       [column_conv(TIMESTAMP,PS:(25,6),NULL,__values.d)]),
      update([t23.b=column_conv(INT,PS:(11,0),NULL,2)], [t23.c=column_conv(INT,PS:(11,0),NULL,2)], [t23.d=column_conv(TIMESTAMP,PS:(25,6),NULL,cast(current_timestamp(),
       TIMESTAMP(25, 6)))])
  1 - output([__values.a], [__values.b], [__values.c], [__values.d]), filter(nil)
      values({1, 1, 1, current_timestamp()})
affected rows: 16
insert into t23 values(1, 1, 1, now()) on duplicate key update b=2, c=2;
affected rows: 2
EXPLAIN BASIC select /*+index(t23 primary)*/ a, c, d from t23;
Query Plan
=======================================
|ID|OPERATOR                 |NAME    |
---------------------------------------
|0 |PX COORDINATOR           |        |
|1 |└─EXCHANGE OUT DISTR     |:EX10000|
|2 |  └─PX PARTITION ITERATOR|        |
|3 |    └─TABLE FULL SCAN    |t23     |
=======================================
Outputs & filters:
-------------------------------------
  0 - output([INTERNAL_FUNCTION(t23.a, t23.c, t23.d)]), filter(nil), rowset=16
  1 - output([INTERNAL_FUNCTION(t23.a, t23.c, t23.d)]), filter(nil), rowset=16
      dop=1
  2 - output([t23.a], [t23.c], [t23.d]), filter(nil), rowset=16
      force partition granule
  3 - output([t23.a], [t23.c], [t23.d]), filter(nil), rowset=16
      access([t23.a], [t23.c], [t23.d]), partitions(p[0-4])
      is_index_back=false, is_global_index=false, 
      range_key([t23.a]), range(MIN ; MAX)always true
affected rows: 19
select /*+index(t23 primary)*/ a, c, d from t23;
+---+------+----------------------------+
| a | c    | d                          |
+---+------+----------------------------+
| 1 |    2 | TIMESTAMP                  |
+---+------+----------------------------+
affected rows: 1
EXPLAIN BASIC select /*+index(t23 idx)*/ a, c, d from t23;
Query Plan
===================================
|ID|OPERATOR             |NAME    |
-----------------------------------
|0 |EXCHANGE IN REMOTE   |        |
|1 |└─EXCHANGE OUT REMOTE|        |
|2 |  └─TABLE FULL SCAN  |t23(idx)|
===================================
Outputs & filters:
-------------------------------------
  0 - output([t23.a], [t23.c], [t23.d]), filter(nil)
  1 - output([t23.a], [t23.c], [t23.d]), filter(nil)
  2 - output([t23.a], [t23.c], [t23.d]), filter(nil), rowset=16
      access([t23.a], [t23.c], [t23.d]), partitions(p0)
      is_index_back=false, is_global_index=true, 
      range_key([t23.c], [t23.d], [t23.a]), range(MIN,MIN,MIN ; MAX,MAX,MAX)always true
affected rows: 15
select /*+index(t23 idx)*/ a, c, d from t23;
+---+------+----------------------------+
| a | c    | d                          |
+---+------+----------------------------+
| 1 |    2 | TIMESTAMP                  |
+---+------+----------------------------+
affected rows: 1
drop table t23;
affected rows: 0

EXPLAIN BASIC replace into t24 select * from t24;
Query Plan
============================================
|ID|OPERATOR               |NAME           |
--------------------------------------------
|0 |DISTRIBUTED REPLACE    |               |
|1 |└─PX COORDINATOR       |               |
|2 |  └─EXCHANGE OUT DISTR |:EX10000       |
|3 |    └─SUBPLAN SCAN     |ANONYMOUS_VIEW1|
|4 |      └─TABLE FULL SCAN|t24            |
============================================
Outputs & filters:
-------------------------------------
  0 - output(nil), filter(nil)
      columns([{t24: ({t24: (t24.a, t24.b, t24.c)}, {idx: (t24.b, t24.a)})}]), partitions(p0), 
      column_values([column_conv(INT,PS:(11,0),NOT NULL,ANONYMOUS_VIEW1.a)], [column_conv(INT,PS:(11,0),NULL,ANONYMOUS_VIEW1.b)], [column_conv(INT,PS:(11,
      0),NULL,ANONYMOUS_VIEW1.c)])
  1 - output([ANONYMOUS_VIEW1.a], [ANONYMOUS_VIEW1.b], [ANONYMOUS_VIEW1.c]), filter(nil), rowset=16
  2 - output([ANONYMOUS_VIEW1.a], [ANONYMOUS_VIEW1.b], [ANONYMOUS_VIEW1.c]), filter(nil), rowset=16
      is_single, dop=1
  3 - output([ANONYMOUS_VIEW1.a], [ANONYMOUS_VIEW1.b], [ANONYMOUS_VIEW1.c]), filter(nil), rowset=16
      access([ANONYMOUS_VIEW1.a], [ANONYMOUS_VIEW1.b], [ANONYMOUS_VIEW1.c])
  4 - output([t24.a], [t24.b], [t24.c]), filter(nil), rowset=16
      access([t24.a], [t24.b], [t24.c]), partitions(p0)
      is_index_back=false, is_global_index=false, 
      range_key([t24.a]), range(MIN ; MAX)always true
affected rows: 24
replace into t24 select * from t24;
affected rows: 0
EXPLAIN BASIC insert into t24 select * from t24 on duplicate key update t24.c=1;
Query Plan
============================================
|ID|OPERATOR               |NAME           |
--------------------------------------------
|0 |DISTRIBUTED INSERT_UP  |               |
|1 |└─PX COORDINATOR       |               |
|2 |  └─EXCHANGE OUT DISTR |:EX10000       |
|3 |    └─SUBPLAN SCAN     |ANONYMOUS_VIEW1|
|4 |      └─TABLE FULL SCAN|t24            |
============================================
Outputs & filters:
-------------------------------------
  0 - output(nil), filter(nil)
      columns([{t24: ({t24: (t24.a, t24.b, t24.c)}, {idx: (t24.b, t24.a)})}]), partitions(p0), 
      column_values([column_conv(INT,PS:(11,0),NOT NULL,ANONYMOUS_VIEW1.a)], [column_conv(INT,PS:(11,0),NULL,ANONYMOUS_VIEW1.b)], [column_conv(INT,PS:(11,
      0),NULL,ANONYMOUS_VIEW1.c)]),
      update([t24.c=column_conv(INT,PS:(11,0),NULL,1)])
  1 - output([ANONYMOUS_VIEW1.a], [ANONYMOUS_VIEW1.b], [ANONYMOUS_VIEW1.c]), filter(nil), rowset=16
  2 - output([ANONYMOUS_VIEW1.a], [ANONYMOUS_VIEW1.b], [ANONYMOUS_VIEW1.c]), filter(nil), rowset=16
      is_single, dop=1
  3 - output([ANONYMOUS_VIEW1.a], [ANONYMOUS_VIEW1.b], [ANONYMOUS_VIEW1.c]), filter(nil), rowset=16
      access([ANONYMOUS_VIEW1.a], [ANONYMOUS_VIEW1.b], [ANONYMOUS_VIEW1.c])
  4 - output([t24.a], [t24.b], [t24.c]), filter(nil), rowset=16
      access([t24.a], [t24.b], [t24.c]), partitions(p0)
      is_index_back=false, is_global_index=false, 
      range_key([t24.a]), range(MIN ; MAX)always true
affected rows: 25
insert into t24 select * from t24 on duplicate key update t24.c=1;
affected rows: 0
EXPLAIN BASIC select * from t24;
Query Plan
===============================
|ID|OPERATOR             |NAME|
-------------------------------
|0 |EXCHANGE IN REMOTE   |    |
|1 |└─EXCHANGE OUT REMOTE|    |
|2 |  └─TABLE FULL SCAN  |t24 |
===============================
Outputs & filters:
-------------------------------------
  0 - output([t24.a], [t24.b], [t24.c]), filter(nil)
  1 - output([t24.a], [t24.b], [t24.c]), filter(nil)
  2 - output([t24.a], [t24.b], [t24.c]), filter(nil), rowset=16
      access([t24.a], [t24.b], [t24.c]), partitions(p0)
      is_index_back=false, is_global_index=false, 
      range_key([t24.a]), range(MIN ; MAX)always true
affected rows: 15
select * from t24;
+---+------+------+
| a | b    | c    |
+---+------+------+
+---+------+------+
affected rows: 0
drop table t24;
affected rows: 0

EXPLAIN BASIC select /*+index(t27 idx27_1)*/ * from t27 where c2 in (2,4,6,8,10,12);
Query Plan
==============================================
|ID|OPERATOR                    |NAME        |
----------------------------------------------
|0 |DISTRIBUTED TABLE RANGE SCAN|t27(idx27_1)|
==============================================
Outputs & filters:
-------------------------------------
  0 - output([t27.c1], [t27.c2], [t27.c3]), filter(nil), rowset=16
      access([t27.c1], [t27.c2], [t27.c3]), partitions(p[0-2])
      is_index_back=true, is_global_index=true, 
      range_key([t27.c2], [t27.c1]), range(2,MIN ; 2,MAX), (4,MIN ; 4,MAX), (6,MIN ; 6,MAX), (8,MIN ; 8,MAX), (10,MIN ; 10,MAX), (12,MIN ; 12,MAX), 
      range_cond([t27.c2 IN (2, 4, 6, 8, 10, 12)])
affected rows: 12
select /*+index(t27 idx27_1)*/ * from t27 where c2 in (2,4,6,8,10,12);
+----+------+------+
| c1 | c2   | c3   |
+----+------+------+
|  2 |    2 | 0B   |
|  4 |    4 | 0D   |
|  6 |    6 | 1A   |
|  8 |    8 | 1C   |
| 12 |   12 | 2B   |
+----+------+------+
affected rows: 5
EXPLAIN BASIC select /*+index(t27 idx27_2)*/ * from t27 where c3 in ('0A','1B','2C');
Query Plan
=======================================
|ID|OPERATOR             |NAME        |
---------------------------------------
|0 |DISTRIBUTED TABLE GET|t27(idx27_2)|
=======================================
Outputs & filters:
-------------------------------------
  0 - output([t27.c1], [t27.c2], [t27.c3]), filter(nil), rowset=16
      access([t27.c1], [t27.c2], [t27.c3]), partitions(p[0-2])
      is_index_back=true, is_global_index=true, 
      range_key([t27.c3], [t27.shadow_pk_0]), range[0A,NULL ; 0A,NULL], [1B,NULL ; 1B,NULL], [2C,NULL ; 2C,NULL], 
      range_cond([t27.c3 IN ('0A', '1B', '2C')])
affected rows: 12
select /*+index(t27 idx27_2)*/ * from t27 where c3 in ('0A','1B','2C');
+----+------+------+
| c1 | c2   | c3   |
+----+------+------+
|  1 |    1 | 0A   |
|  7 |    7 | 1B   |
| 13 |   13 | 2C   |
+----+------+------+
affected rows: 3
EXPLAIN BASIC update t27 set c2 = 10 where c2 = 9;
Query Plan
================================================
|ID|OPERATOR                      |NAME        |
------------------------------------------------
|0 |DISTRIBUTED UPDATE            |            |
|1 |└─DISTRIBUTED TABLE RANGE SCAN|t27(idx27_1)|
================================================
Outputs & filters:
-------------------------------------
  0 - output(nil), filter(nil)
      table_columns([{t27: ({t27: (t27.c1, t27.c2, t27.c3)}, {idx27_1: (t27.c2, t27.c1)})}]),
      update([t27.c2=column_conv(INT,PS:(11,0),NULL,10)])
  1 - output([t27.c1], [t27.c2], [t27.c3]), filter(nil), rowset=16
      access([t27.c1], [t27.c2], [t27.c3]), partitions(p1)
      is_index_back=true, is_global_index=true, 
      range_key([t27.c2], [t27.c1]), range(9,MIN ; 9,MAX), 
      range_cond([t27.c2 = 9])
affected rows: 16
update t27 set c2 = 10 where c2 = 9;
affected rows: 1
info: Rows matched: 1  Changed: 1  Warnings: 0
EXPLAIN BASIC update t27 set c3 = '0E' where c3 = '0D';
Query Plan
=========================================
|ID|OPERATOR               |NAME        |
-----------------------------------------
|0 |DISTRIBUTED UPDATE     |            |
|1 |└─DISTRIBUTED TABLE GET|t27(idx27_2)|
=========================================
Outputs & filters:
-------------------------------------
  0 - output(nil), filter(nil)
      table_columns([{t27: ({t27: (t27.c1, t27.c2, t27.c3)}, {idx27_2: (t27.c3, t27.c1)})}]),
      update([t27.c3=column_conv(VARCHAR,utf8mb4_general_ci,length:10,NULL,'0E')])
  1 - output([t27.c1], [t27.c2], [t27.c3]), filter(nil), rowset=16
      access([t27.c1], [t27.c2], [t27.c3]), partitions(p0)
      is_index_back=true, is_global_index=true, 
      range_key([t27.c3], [t27.shadow_pk_0]), range[0D,NULL ; 0D,NULL], 
      range_cond([t27.c3 = '0D'])
affected rows: 16
update t27 set c3 = '0E' where c3 = '0D';
affected rows: 1
info: Rows matched: 1  Changed: 1  Warnings: 0
EXPLAIN BASIC select * from t27;
Query Plan
===============================
|ID|OPERATOR             |NAME|
-------------------------------
|0 |EXCHANGE IN REMOTE   |    |
|1 |└─EXCHANGE OUT REMOTE|    |
|2 |  └─TABLE FULL SCAN  |t27 |
===============================
Outputs & filters:
-------------------------------------
  0 - output([t27.c1], [t27.c2], [t27.c3]), filter(nil)
  1 - output([t27.c1], [t27.c2], [t27.c3]), filter(nil)
  2 - output([t27.c1], [t27.c2], [t27.c3]), filter(nil), rowset=16
      access([t27.c1], [t27.c2], [t27.c3]), partitions(p0)
      is_index_back=false, is_global_index=false, 
      range_key([t27.c1]), range(MIN ; MAX)always true
affected rows: 15
select * from t27;
+----+------+------+
| c1 | c2   | c3   |
+----+------+------+
|  1 |    1 | 0A   |
|  2 |    2 | 0B   |
|  3 |    3 | 0C   |
|  4 |    4 | 0E   |
|  6 |    6 | 1A   |
|  7 |    7 | 1B   |
|  8 |    8 | 1C   |
|  9 |   10 | 1D   |
| 11 |   11 | 2A   |
| 12 |   12 | 2B   |
| 13 |   13 | 2C   |
| 14 |   14 | 2D   |
+----+------+------+
affected rows: 12
EXPLAIN BASIC insert into t27 values(5, NULL, '0D');
Query Plan
============================
|ID|OPERATOR          |NAME|
----------------------------
|0 |DISTRIBUTED INSERT|    |
|1 |└─EXPRESSION      |    |
============================
Outputs & filters:
-------------------------------------
  0 - output(nil), filter(nil)
      columns([{t27: ({t27: (t27.c1, t27.c2, t27.c3)}, {idx27_1: (t27.c2, t27.c1)}, {idx27_2: (t27.c3, t27.c1)})}]), 
      column_values([column_conv(INT,PS:(11,0),NOT NULL,__values.c1)], [column_conv(INT,PS:(11,0),NULL,__values.c2)], [column_conv(VARCHAR,utf8mb4_general_ci,
      length:10,NULL,__values.c3)])
  1 - output([__values.c1], [__values.c2], [__values.c3]), filter(nil)
      values({5, NULL, '0D'})
affected rows: 14
insert into t27 values(5, NULL, '0D');
affected rows: 1
EXPLAIN BASIC insert into t27 values(10, 10, NULL);
Query Plan
============================
|ID|OPERATOR          |NAME|
----------------------------
|0 |DISTRIBUTED INSERT|    |
|1 |└─EXPRESSION      |    |
============================
Outputs & filters:
-------------------------------------
  0 - output(nil), filter(nil)
      columns([{t27: ({t27: (t27.c1, t27.c2, t27.c3)}, {idx27_1: (t27.c2, t27.c1)}, {idx27_2: (t27.c3, t27.c1)})}]), 
      column_values([column_conv(INT,PS:(11,0),NOT NULL,__values.c1)], [column_conv(INT,PS:(11,0),NULL,__values.c2)], [column_conv(VARCHAR,utf8mb4_general_ci,
      length:10,NULL,__values.c3)])
  1 - output([__values.c1], [__values.c2], [__values.c3]), filter(nil)
      values({10, 10, NULL})
affected rows: 14
insert into t27 values(10, 10, NULL);
affected rows: 1
EXPLAIN BASIC insert into t27 values(15, 15, NULL);
Query Plan
============================
|ID|OPERATOR          |NAME|
----------------------------
|0 |DISTRIBUTED INSERT|    |
|1 |└─EXPRESSION      |    |
============================
Outputs & filters:
-------------------------------------
  0 - output(nil), filter(nil)
      columns([{t27: ({t27: (t27.c1, t27.c2, t27.c3)}, {idx27_1: (t27.c2, t27.c1)}, {idx27_2: (t27.c3, t27.c1)})}]), 
      column_values([column_conv(INT,PS:(11,0),NOT NULL,__values.c1)], [column_conv(INT,PS:(11,0),NULL,__values.c2)], [column_conv(VARCHAR,utf8mb4_general_ci,
      length:10,NULL,__values.c3)])
  1 - output([__values.c1], [__values.c2], [__values.c3]), filter(nil)
      values({15, 15, NULL})
affected rows: 14
insert into t27 values(15, 15, NULL);
affected rows: 1
EXPLAIN BASIC insert into t27 values(16, 16, NULL);
Query Plan
============================
|ID|OPERATOR          |NAME|
----------------------------
|0 |DISTRIBUTED INSERT|    |
|1 |└─EXPRESSION      |    |
============================
Outputs & filters:
-------------------------------------
  0 - output(nil), filter(nil)
      columns([{t27: ({t27: (t27.c1, t27.c2, t27.c3)}, {idx27_1: (t27.c2, t27.c1)}, {idx27_2: (t27.c3, t27.c1)})}]), 
      column_values([column_conv(INT,PS:(11,0),NOT NULL,__values.c1)], [column_conv(INT,PS:(11,0),NULL,__values.c2)], [column_conv(VARCHAR,utf8mb4_general_ci,
      length:10,NULL,__values.c3)])
  1 - output([__values.c1], [__values.c2], [__values.c3]), filter(nil)
      values({16, 16, NULL})
affected rows: 14
insert into t27 values(16, 16, NULL);
affected rows: 1
EXPLAIN BASIC select * from t27;
Query Plan
===============================
|ID|OPERATOR             |NAME|
-------------------------------
|0 |EXCHANGE IN REMOTE   |    |
|1 |└─EXCHANGE OUT REMOTE|    |
|2 |  └─TABLE FULL SCAN  |t27 |
===============================
Outputs & filters:
-------------------------------------
  0 - output([t27.c1], [t27.c2], [t27.c3]), filter(nil)
  1 - output([t27.c1], [t27.c2], [t27.c3]), filter(nil)
  2 - output([t27.c1], [t27.c2], [t27.c3]), filter(nil), rowset=256
      access([t27.c1], [t27.c2], [t27.c3]), partitions(p0)
      is_index_back=false, is_global_index=false, 
      range_key([t27.c1]), range(MIN ; MAX)always true
affected rows: 15
select * from t27;
+----+------+------+
| c1 | c2   | c3   |
+----+------+------+
|  1 |    1 | 0A   |
|  2 |    2 | 0B   |
|  3 |    3 | 0C   |
|  4 |    4 | 0E   |
|  5 | NULL | 0D   |
|  6 |    6 | 1A   |
|  7 |    7 | 1B   |
|  8 |    8 | 1C   |
|  9 |   10 | 1D   |
| 10 |   10 | NULL |
| 11 |   11 | 2A   |
| 12 |   12 | 2B   |
| 13 |   13 | 2C   |
| 14 |   14 | 2D   |
| 15 |   15 | NULL |
| 16 |   16 | NULL |
+----+------+------+
affected rows: 16
EXPLAIN BASIC delete from t27 where c2 = 2;
Query Plan
================================================
|ID|OPERATOR                      |NAME        |
------------------------------------------------
|0 |DISTRIBUTED DELETE            |            |
|1 |└─DISTRIBUTED TABLE RANGE SCAN|t27(idx27_1)|
================================================
Outputs & filters:
-------------------------------------
  0 - output(nil), filter(nil)
      table_columns([{t27: ({t27: (t27.c1, t27.c2, t27.c3)}, {idx27_1: (t27.c2, t27.c1)}, {idx27_2: (t27.c3, t27.c1)})}])
  1 - output([t27.c1], [t27.c2], [t27.c3]), filter(nil), rowset=16
      access([t27.c1], [t27.c2], [t27.c3]), partitions(p0)
      is_index_back=true, is_global_index=true, 
      range_key([t27.c2], [t27.c1]), range(2,MIN ; 2,MAX), 
      range_cond([t27.c2 = 2])
affected rows: 15
delete from t27 where c2 = 2;
affected rows: 1
EXPLAIN BASIC delete from t27 where c3 = '1B';
Query Plan
=========================================
|ID|OPERATOR               |NAME        |
-----------------------------------------
|0 |DISTRIBUTED DELETE     |            |
|1 |└─DISTRIBUTED TABLE GET|t27(idx27_2)|
=========================================
Outputs & filters:
-------------------------------------
  0 - output(nil), filter(nil)
      table_columns([{t27: ({t27: (t27.c1, t27.c2, t27.c3)}, {idx27_1: (t27.c2, t27.c1)}, {idx27_2: (t27.c3, t27.c1)})}])
  1 - output([t27.c1], [t27.c2], [t27.c3]), filter(nil), rowset=16
      access([t27.c1], [t27.c2], [t27.c3]), partitions(p1)
      is_index_back=true, is_global_index=true, 
      range_key([t27.c3], [t27.shadow_pk_0]), range[1B,NULL ; 1B,NULL], 
      range_cond([t27.c3 = '1B'])
affected rows: 15
delete from t27 where c3 = '1B';
affected rows: 1
EXPLAIN BASIC delete from t27 where c3 is NULL;
Query Plan
================================================
|ID|OPERATOR                      |NAME        |
------------------------------------------------
|0 |DISTRIBUTED DELETE            |            |
|1 |└─DISTRIBUTED TABLE RANGE SCAN|t27(idx27_2)|
================================================
Outputs & filters:
-------------------------------------
  0 - output(nil), filter(nil)
      table_columns([{t27: ({t27: (t27.c1, t27.c2, t27.c3)}, {idx27_1: (t27.c2, t27.c1)}, {idx27_2: (t27.c3, t27.c1)})}])
  1 - output([t27.c1], [t27.c2], [t27.c3]), filter(nil), rowset=16
      access([t27.c1], [t27.c2], [t27.c3]), partitions(p2)
      is_index_back=true, is_global_index=true, 
      range_key([t27.c3], [t27.shadow_pk_0]), range(NULL,MIN ; NULL,MAX), 
      range_cond([t27.c3 IS NULL])
affected rows: 15
delete from t27 where c3 is NULL;
affected rows: 3
EXPLAIN BASIC select * from t27;
Query Plan
===============================
|ID|OPERATOR             |NAME|
-------------------------------
|0 |EXCHANGE IN REMOTE   |    |
|1 |└─EXCHANGE OUT REMOTE|    |
|2 |  └─TABLE FULL SCAN  |t27 |
===============================
Outputs & filters:
-------------------------------------
  0 - output([t27.c1], [t27.c2], [t27.c3]), filter(nil)
  1 - output([t27.c1], [t27.c2], [t27.c3]), filter(nil)
  2 - output([t27.c1], [t27.c2], [t27.c3]), filter(nil), rowset=16
      access([t27.c1], [t27.c2], [t27.c3]), partitions(p0)
      is_index_back=false, is_global_index=false, 
      range_key([t27.c1]), range(MIN ; MAX)always true
affected rows: 15
select * from t27;
+----+------+------+
| c1 | c2   | c3   |
+----+------+------+
|  1 |    1 | 0A   |
|  3 |    3 | 0C   |
|  4 |    4 | 0E   |
|  5 | NULL | 0D   |
|  6 |    6 | 1A   |
|  8 |    8 | 1C   |
|  9 |   10 | 1D   |
| 11 |   11 | 2A   |
| 12 |   12 | 2B   |
| 13 |   13 | 2C   |
| 14 |   14 | 2D   |
+----+------+------+
affected rows: 11
drop table t27;
affected rows: 0

EXPLAIN BASIC select /*+index(t28 idx28_1)*/ * from t28 where (c2,c3) = (1, '0A');
Query Plan
=======================================
|ID|OPERATOR             |NAME        |
---------------------------------------
|0 |EXCHANGE IN REMOTE   |            |
|1 |└─EXCHANGE OUT REMOTE|            |
|2 |  └─TABLE GET        |t28(idx28_1)|
=======================================
Outputs & filters:
-------------------------------------
  0 - output([t28.c1], [t28.c2], [t28.c3]), filter(nil)
  1 - output([t28.c1], [t28.c2], [t28.c3]), filter(nil)
  2 - output([t28.c1], [t28.c2], [t28.c3]), filter(nil), rowset=16
      access([t28.c1], [t28.c2], [t28.c3]), partitions(p0)
      is_index_back=false, is_global_index=true, 
      range_key([t28.c2], [t28.c3], [t28.shadow_pk_0]), range[1,0A,NULL ; 1,0A,NULL], 
      range_cond([t28.c2 = 1], [t28.c3 = '0A'])
affected rows: 16
select /*+index(t28 idx28_1)*/ * from t28 where (c2,c3) = (1, '0A');
+----+------+------+
| c1 | c2   | c3   |
+----+------+------+
|  1 |    1 | 0A   |
+----+------+------+
affected rows: 1
EXPLAIN BASIC update t28 set c2 = 10, c3 = '1E' where c2 = 9 and c3 = '1D';
Query Plan
========================================
|ID|OPERATOR              |NAME        |
----------------------------------------
|0 |DISTRIBUTED UPDATE    |            |
|1 |└─PX COORDINATOR      |            |
|2 |  └─EXCHANGE OUT DISTR|:EX10000    |
|3 |    └─TABLE GET       |t28(idx28_1)|
========================================
Outputs & filters:
-------------------------------------
  0 - output(nil), filter(nil)
      table_columns([{t28: ({t28: (t28.c1, t28.c2, t28.c3)}, {idx28_1: (t28.c2, t28.c3, t28.c1)})}]),
      update([t28.c2=column_conv(INT,PS:(11,0),NULL,10)], [t28.c3=column_conv(VARCHAR,utf8mb4_general_ci,length:10,NULL,'1E')])
  1 - output([t28.c1], [t28.c2], [t28.c3]), filter(nil), rowset=16
  2 - output([t28.c1], [t28.c2], [t28.c3]), filter(nil), rowset=16
      is_single, dop=1
  3 - output([t28.c1], [t28.c2], [t28.c3]), filter(nil), rowset=16
      access([t28.c1], [t28.c2], [t28.c3]), partitions(p1)
      is_index_back=false, is_global_index=true, 
      range_key([t28.c2], [t28.c3], [t28.shadow_pk_0]), range[9,1D,NULL ; 9,1D,NULL], 
      range_cond([t28.c2 = 9], [t28.c3 = '1D'])
affected rows: 21
update t28 set c2 = 10, c3 = '1E' where c2 = 9 and c3 = '1D';
affected rows: 1
info: Rows matched: 1  Changed: 1  Warnings: 0
EXPLAIN BASIC select * from t28;
Query Plan
===============================
|ID|OPERATOR             |NAME|
-------------------------------
|0 |EXCHANGE IN REMOTE   |    |
|1 |└─EXCHANGE OUT REMOTE|    |
|2 |  └─TABLE FULL SCAN  |t28 |
===============================
Outputs & filters:
-------------------------------------
  0 - output([t28.c1], [t28.c2], [t28.c3]), filter(nil)
  1 - output([t28.c1], [t28.c2], [t28.c3]), filter(nil)
  2 - output([t28.c1], [t28.c2], [t28.c3]), filter(nil), rowset=16
      access([t28.c1], [t28.c2], [t28.c3]), partitions(p0)
      is_index_back=false, is_global_index=false, 
      range_key([t28.c1]), range(MIN ; MAX)always true
affected rows: 15
select * from t28;
+----+------+------+
| c1 | c2   | c3   |
+----+------+------+
|  1 |    1 | 0A   |
|  2 |    2 | 0B   |
|  3 |    3 | 0C   |
|  4 |    4 | 0D   |
|  6 |    6 | 1A   |
|  7 |    7 | 1B   |
|  8 |    8 | 1C   |
|  9 |   10 | 1E   |
| 11 |   11 | 2A   |
| 12 |   12 | 2B   |
| 13 |   13 | 2C   |
| 14 |   14 | 2D   |
+----+------+------+
affected rows: 12
EXPLAIN BASIC insert into t28 values(16, NULL, '0D');
Query Plan
============================
|ID|OPERATOR          |NAME|
----------------------------
|0 |DISTRIBUTED INSERT|    |
|1 |└─EXPRESSION      |    |
============================
Outputs & filters:
-------------------------------------
  0 - output(nil), filter(nil)
      columns([{t28: ({t28: (t28.c1, t28.c2, t28.c3)}, {idx28_1: (t28.c2, t28.c3, t28.c1)})}]), 
      column_values([column_conv(INT,PS:(11,0),NOT NULL,__values.c1)], [column_conv(INT,PS:(11,0),NULL,__values.c2)], [column_conv(VARCHAR,utf8mb4_general_ci,
      length:10,NULL,__values.c3)])
  1 - output([__values.c1], [__values.c2], [__values.c3]), filter(nil)
      values({16, NULL, '0D'})
affected rows: 14
insert into t28 values(16, NULL, '0D');
affected rows: 1
EXPLAIN BASIC insert into t28 values(17, NULL, '0D');
Query Plan
============================
|ID|OPERATOR          |NAME|
----------------------------
|0 |DISTRIBUTED INSERT|    |
|1 |└─EXPRESSION      |    |
============================
Outputs & filters:
-------------------------------------
  0 - output(nil), filter(nil)
      columns([{t28: ({t28: (t28.c1, t28.c2, t28.c3)}, {idx28_1: (t28.c2, t28.c3, t28.c1)})}]), 
      column_values([column_conv(INT,PS:(11,0),NOT NULL,__values.c1)], [column_conv(INT,PS:(11,0),NULL,__values.c2)], [column_conv(VARCHAR,utf8mb4_general_ci,
      length:10,NULL,__values.c3)])
  1 - output([__values.c1], [__values.c2], [__values.c3]), filter(nil)
      values({17, NULL, '0D'})
affected rows: 14
insert into t28 values(17, NULL, '0D');
affected rows: 1
EXPLAIN BASIC insert into t28 values(18, 10, NULL);
Query Plan
============================
|ID|OPERATOR          |NAME|
----------------------------
|0 |DISTRIBUTED INSERT|    |
|1 |└─EXPRESSION      |    |
============================
Outputs & filters:
-------------------------------------
  0 - output(nil), filter(nil)
      columns([{t28: ({t28: (t28.c1, t28.c2, t28.c3)}, {idx28_1: (t28.c2, t28.c3, t28.c1)})}]), 
      column_values([column_conv(INT,PS:(11,0),NOT NULL,__values.c1)], [column_conv(INT,PS:(11,0),NULL,__values.c2)], [column_conv(VARCHAR,utf8mb4_general_ci,
      length:10,NULL,__values.c3)])
  1 - output([__values.c1], [__values.c2], [__values.c3]), filter(nil)
      values({18, 10, NULL})
affected rows: 14
insert into t28 values(18, 10, NULL);
affected rows: 1
EXPLAIN BASIC insert into t28 values(19, 10, NULL);
Query Plan
============================
|ID|OPERATOR          |NAME|
----------------------------
|0 |DISTRIBUTED INSERT|    |
|1 |└─EXPRESSION      |    |
============================
Outputs & filters:
-------------------------------------
  0 - output(nil), filter(nil)
      columns([{t28: ({t28: (t28.c1, t28.c2, t28.c3)}, {idx28_1: (t28.c2, t28.c3, t28.c1)})}]), 
      column_values([column_conv(INT,PS:(11,0),NOT NULL,__values.c1)], [column_conv(INT,PS:(11,0),NULL,__values.c2)], [column_conv(VARCHAR,utf8mb4_general_ci,
      length:10,NULL,__values.c3)])
  1 - output([__values.c1], [__values.c2], [__values.c3]), filter(nil)
      values({19, 10, NULL})
affected rows: 14
insert into t28 values(19, 10, NULL);
affected rows: 1
EXPLAIN BASIC insert into t28 values(20, NULL, NULL);
Query Plan
============================
|ID|OPERATOR          |NAME|
----------------------------
|0 |DISTRIBUTED INSERT|    |
|1 |└─EXPRESSION      |    |
============================
Outputs & filters:
-------------------------------------
  0 - output(nil), filter(nil)
      columns([{t28: ({t28: (t28.c1, t28.c2, t28.c3)}, {idx28_1: (t28.c2, t28.c3, t28.c1)})}]), 
      column_values([column_conv(INT,PS:(11,0),NOT NULL,__values.c1)], [column_conv(INT,PS:(11,0),NULL,__values.c2)], [column_conv(VARCHAR,utf8mb4_general_ci,
      length:10,NULL,__values.c3)])
  1 - output([__values.c1], [__values.c2], [__values.c3]), filter(nil)
      values({20, NULL, NULL})
affected rows: 14
insert into t28 values(20, NULL, NULL);
affected rows: 1
EXPLAIN BASIC insert into t28 values(21, NULL, NULL);
Query Plan
============================
|ID|OPERATOR          |NAME|
----------------------------
|0 |DISTRIBUTED INSERT|    |
|1 |└─EXPRESSION      |    |
============================
Outputs & filters:
-------------------------------------
  0 - output(nil), filter(nil)
      columns([{t28: ({t28: (t28.c1, t28.c2, t28.c3)}, {idx28_1: (t28.c2, t28.c3, t28.c1)})}]), 
      column_values([column_conv(INT,PS:(11,0),NOT NULL,__values.c1)], [column_conv(INT,PS:(11,0),NULL,__values.c2)], [column_conv(VARCHAR,utf8mb4_general_ci,
      length:10,NULL,__values.c3)])
  1 - output([__values.c1], [__values.c2], [__values.c3]), filter(nil)
      values({21, NULL, NULL})
affected rows: 14
insert into t28 values(21, NULL, NULL);
affected rows: 1
EXPLAIN BASIC select * from t28;
Query Plan
===============================
|ID|OPERATOR             |NAME|
-------------------------------
|0 |EXCHANGE IN REMOTE   |    |
|1 |└─EXCHANGE OUT REMOTE|    |
|2 |  └─TABLE FULL SCAN  |t28 |
===============================
Outputs & filters:
-------------------------------------
  0 - output([t28.c1], [t28.c2], [t28.c3]), filter(nil)
  1 - output([t28.c1], [t28.c2], [t28.c3]), filter(nil)
  2 - output([t28.c1], [t28.c2], [t28.c3]), filter(nil), rowset=256
      access([t28.c1], [t28.c2], [t28.c3]), partitions(p0)
      is_index_back=false, is_global_index=false, 
      range_key([t28.c1]), range(MIN ; MAX)always true
affected rows: 15
select * from t28;
+----+------+------+
| c1 | c2   | c3   |
+----+------+------+
|  1 |    1 | 0A   |
|  2 |    2 | 0B   |
|  3 |    3 | 0C   |
|  4 |    4 | 0D   |
|  6 |    6 | 1A   |
|  7 |    7 | 1B   |
|  8 |    8 | 1C   |
|  9 |   10 | 1E   |
| 11 |   11 | 2A   |
| 12 |   12 | 2B   |
| 13 |   13 | 2C   |
| 14 |   14 | 2D   |
| 16 | NULL | 0D   |
| 17 | NULL | 0D   |
| 18 |   10 | NULL |
| 19 |   10 | NULL |
| 20 | NULL | NULL |
| 21 | NULL | NULL |
+----+------+------+
affected rows: 18
EXPLAIN BASIC delete from t28 where c2 = 7 and c3 = '1B';
Query Plan
========================================
|ID|OPERATOR              |NAME        |
----------------------------------------
|0 |DISTRIBUTED DELETE    |            |
|1 |└─PX COORDINATOR      |            |
|2 |  └─EXCHANGE OUT DISTR|:EX10000    |
|3 |    └─TABLE GET       |t28(idx28_1)|
========================================
Outputs & filters:
-------------------------------------
  0 - output(nil), filter(nil)
      table_columns([{t28: ({t28: (t28.c1, t28.c2, t28.c3)}, {idx28_1: (t28.c2, t28.c3, t28.c1)})}])
  1 - output([t28.c1], [t28.c2], [t28.c3]), filter(nil), rowset=16
  2 - output([t28.c1], [t28.c2], [t28.c3]), filter(nil), rowset=16
      is_single, dop=1
  3 - output([t28.c1], [t28.c2], [t28.c3]), filter(nil), rowset=16
      access([t28.c1], [t28.c2], [t28.c3]), partitions(p1)
      is_index_back=false, is_global_index=true, 
      range_key([t28.c2], [t28.c3], [t28.shadow_pk_0]), range[7,1B,NULL ; 7,1B,NULL], 
      range_cond([t28.c2 = 7], [t28.c3 = '1B'])
affected rows: 20
delete from t28 where c2 = 7 and c3 = '1B';
affected rows: 1
EXPLAIN BASIC delete from t28 where c2 is NULL;
Query Plan
========================================
|ID|OPERATOR              |NAME        |
----------------------------------------
|0 |DISTRIBUTED DELETE    |            |
|1 |└─PX COORDINATOR      |            |
|2 |  └─EXCHANGE OUT DISTR|:EX10000    |
|3 |    └─TABLE RANGE SCAN|t28(idx28_1)|
========================================
Outputs & filters:
-------------------------------------
  0 - output(nil), filter(nil)
      table_columns([{t28: ({t28: (t28.c1, t28.c2, t28.c3)}, {idx28_1: (t28.c2, t28.c3, t28.c1)})}])
  1 - output([t28.c1], [t28.c2], [t28.c3]), filter(nil), rowset=16
  2 - output([t28.c1], [t28.c2], [t28.c3]), filter(nil), rowset=16
      is_single, dop=1
  3 - output([t28.c1], [t28.c2], [t28.c3]), filter(nil), rowset=16
      access([t28.c1], [t28.c2], [t28.c3]), partitions(p2)
      is_index_back=false, is_global_index=true, 
      range_key([t28.c2], [t28.c3], [t28.shadow_pk_0]), range(NULL,MIN,MIN ; NULL,MAX,MAX), 
      range_cond([t28.c2 IS NULL])
affected rows: 20
delete from t28 where c2 is NULL;
affected rows: 4
EXPLAIN BASIC select * from t28;
Query Plan
===============================
|ID|OPERATOR             |NAME|
-------------------------------
|0 |EXCHANGE IN REMOTE   |    |
|1 |└─EXCHANGE OUT REMOTE|    |
|2 |  └─TABLE FULL SCAN  |t28 |
===============================
Outputs & filters:
-------------------------------------
  0 - output([t28.c1], [t28.c2], [t28.c3]), filter(nil)
  1 - output([t28.c1], [t28.c2], [t28.c3]), filter(nil)
  2 - output([t28.c1], [t28.c2], [t28.c3]), filter(nil), rowset=16
      access([t28.c1], [t28.c2], [t28.c3]), partitions(p0)
      is_index_back=false, is_global_index=false, 
      range_key([t28.c1]), range(MIN ; MAX)always true
affected rows: 15
select * from t28;
+----+------+------+
| c1 | c2   | c3   |
+----+------+------+
|  1 |    1 | 0A   |
|  2 |    2 | 0B   |
|  3 |    3 | 0C   |
|  4 |    4 | 0D   |
|  6 |    6 | 1A   |
|  8 |    8 | 1C   |
|  9 |   10 | 1E   |
| 11 |   11 | 2A   |
| 12 |   12 | 2B   |
| 13 |   13 | 2C   |
| 14 |   14 | 2D   |
| 18 |   10 | NULL |
| 19 |   10 | NULL |
+----+------+------+
affected rows: 13
drop table t28;
affected rows: 0

CREATE TABLE `test5` (
    `c1` int(11) NOT NULL AUTO_INCREMENT,
    `c2` int(11) NOT NULL,
    `c3` int(255) DEFAULT NULL,
    `c4` int(11) DEFAULT NULL,
    `c5` varchar(100) DEFAULT '五百公里外的家很遥远',
    `c6` varchar(30) DEFAULT '五百公里外的家很遥远',
    `c7` char(100) DEFAULT '五百英里外的家贾斯汀timberlake3848',
    `c8` binary(100) DEFAULT '??????????timberlake3848',
    PRIMARY KEY (`c2`)
    ) AUTO_INCREMENT = 12000012 DEFAULT CHARSET = utf8mb4
partition by key(c2) partitions 2;
affected rows: 0
create index c1 on test5(`c1`, `c2`, `c3`) global;
affected rows: 0
EXPLAIN BASIC insert into test5 (c2) values (1);
Query Plan
============================
|ID|OPERATOR          |NAME|
----------------------------
|0 |DISTRIBUTED INSERT|    |
|1 |└─EXPRESSION      |    |
============================
Outputs & filters:
-------------------------------------
  0 - output(nil), filter(nil)
      columns([{test5: ({test5: (test5.c2, test5.c1, test5.c3, test5.c4, test5.c5, test5.c6, test5.c7, test5.c8)}, {c1: (test5.c1, test5.c2, test5.c3)})}]),
       
      column_values([column_conv(INT,PS:(11,0),NOT NULL,__values.c2)], [column_conv(INT,PS:(11,0),NOT NULL,cast(test5.c1.nextval(), INT(-1, 0)))], [column_conv(INT,
      PS:(255,0),NULL,cast(NULL, INT(255, 0)))], [column_conv(INT,PS:(11,0),NULL,cast(NULL, INT(11, 0)))], [column_conv(VARCHAR,utf8mb4_general_ci,length:100,
      NULL,'五百公里外的家很遥远')], [column_conv(VARCHAR,utf8mb4_general_ci,length:30,NULL,'五百公里外的家很遥远')], [column_conv(CHAR,utf8mb4_general_ci,
      length:100,NULL,'五百英里外的家贾斯汀timberlake3848')], [column_conv(CHAR,binary,length:100,NULL,cast(pad(cast(X'3F3F3F3F3F3F3F3F3F3F74696D6265726C616B6533383438',
       VARCHAR(1048576)), X'00', 100), CHAR(1048576)))])
  1 - output([__values.c2]), filter(nil)
      values({1})
affected rows: 18
insert into test5 (c2) values (1);
affected rows: 1
EXPLAIN BASIC select * from test5;
Query Plan
auto_increment
auto_increment
auto_increment
auto_increment
auto_increment
auto_increment
auto_increment
auto_increment
auto_increment
auto_increment
auto_increment
auto_increment
auto_increment
auto_increment
auto_increment
auto_increment
auto_increment
auto_increment
auto_increment
affected rows: 19
select * from test5;
+----------+----+------+------+--------------------------------+--------------------------------+----------------------------------------------+------------------------------------------------------------------------------------------------------+
| c1       | c2 | c3   | c4   | c5                             | c6                             | c7                                           | c8                                                                                                   |
+----------+----+------+------+--------------------------------+--------------------------------+----------------------------------------------+------------------------------------------------------------------------------------------------------+
| auto_increment |  1 | NULL | NULL | 五百公里外的家很遥远           | 五百公里外的家很遥远           | 五百英里外的家贾斯汀timberlake3848           | ??????????timberlake3848                                                                             |
+----------+----+------+------+--------------------------------+--------------------------------+----------------------------------------------+------------------------------------------------------------------------------------------------------+
affected rows: 1
drop table test5;
affected rows: 0

drop table if exists bmsql_oorder;
affected rows: 0
CREATE TABLE `bmsql_oorder` (
  `o_w_id` int(11) NOT NULL,
  `o_d_id` int(11) NOT NULL,
  `o_id` int(11) NOT NULL,
  `o_c_id` int(11) DEFAULT NULL,
  `o_carrier_id` int(11) DEFAULT NULL,
  `o_ol_cnt` decimal(2,0) DEFAULT NULL,
  `o_all_local` decimal(1,0) DEFAULT NULL,
  `o_entry_d` timestamp NULL DEFAULT NULL,
  PRIMARY KEY (`o_w_id`, `o_d_id`, `o_id`),
  KEY `o_w_id` (`o_w_id`, `o_d_id`, `o_c_id`, `o_id`) GLOBAL,
  KEY `o_w_id_2` (`o_w_id`, `o_d_id`, `o_ol_cnt`) GLOBAL
) DEFAULT CHARSET = utf8mb4
 partition by hash(o_w_id) partitions 2;
affected rows: 0
EXPLAIN BASIC insert into bmsql_oorder(o_w_id,o_d_id,o_id,o_c_id,o_carrier_id) values(36,7,1,169,1);
Query Plan
============================
|ID|OPERATOR          |NAME|
----------------------------
|0 |DISTRIBUTED INSERT|    |
|1 |└─EXPRESSION      |    |
============================
Outputs & filters:
-------------------------------------
  0 - output(nil), filter(nil)
      columns([{bmsql_oorder: ({bmsql_oorder: (bmsql_oorder.o_w_id, bmsql_oorder.o_d_id, bmsql_oorder.o_id, bmsql_oorder.o_c_id, bmsql_oorder.o_carrier_id,
       bmsql_oorder.o_ol_cnt, bmsql_oorder.o_all_local, bmsql_oorder.o_entry_d)}, {o_w_id: (bmsql_oorder.o_w_id, bmsql_oorder.o_d_id, bmsql_oorder.o_c_id, bmsql_oorder.o_id)},
       {o_w_id_2: (bmsql_oorder.o_w_id, bmsql_oorder.o_d_id, bmsql_oorder.o_ol_cnt, bmsql_oorder.o_id)})}]), 
      column_values([column_conv(INT,PS:(11,0),NOT NULL,__values.o_w_id)], [column_conv(INT,PS:(11,0),NOT NULL,__values.o_d_id)], [column_conv(INT,PS:(11,
      0),NOT NULL,__values.o_id)], [column_conv(INT,PS:(11,0),NULL,__values.o_c_id)], [column_conv(INT,PS:(11,0),NULL,__values.o_carrier_id)], [column_conv(DECIMAL_INT,
      PS:(2,0),NULL,cast(NULL, DECIMAL_INT(2, 0)))], [column_conv(DECIMAL_INT,PS:(1,0),NULL,cast(NULL, DECIMAL_INT(1, 0)))], [column_conv(TIMESTAMP,PS:(19,0),
      NULL,cast(NULL, TIMESTAMP(-1, -1)))])
  1 - output([__values.o_w_id], [__values.o_d_id], [__values.o_id], [__values.o_c_id], [__values.o_carrier_id]), filter(nil)
      values({36, 7, 1, 169, 1})
affected rows: 18
insert into bmsql_oorder(o_w_id,o_d_id,o_id,o_c_id,o_carrier_id) values(36,7,1,169,1);
affected rows: 1
EXPLAIN BASIC select /*+index(bmsql_oorder primary)*/ * from bmsql_oorder;
Query Plan
===========================================
|ID|OPERATOR                 |NAME        |
-------------------------------------------
|0 |PX COORDINATOR           |            |
|1 |└─EXCHANGE OUT DISTR     |:EX10000    |
|2 |  └─PX PARTITION ITERATOR|            |
|3 |    └─TABLE FULL SCAN    |bmsql_oorder|
===========================================
Outputs & filters:
-------------------------------------
  0 - output([INTERNAL_FUNCTION(bmsql_oorder.o_w_id, bmsql_oorder.o_d_id, bmsql_oorder.o_id, bmsql_oorder.o_c_id, bmsql_oorder.o_carrier_id, bmsql_oorder.o_ol_cnt,
       bmsql_oorder.o_all_local, bmsql_oorder.o_entry_d)]), filter(nil), rowset=16
  1 - output([INTERNAL_FUNCTION(bmsql_oorder.o_w_id, bmsql_oorder.o_d_id, bmsql_oorder.o_id, bmsql_oorder.o_c_id, bmsql_oorder.o_carrier_id, bmsql_oorder.o_ol_cnt,
       bmsql_oorder.o_all_local, bmsql_oorder.o_entry_d)]), filter(nil), rowset=16
      dop=1
  2 - output([bmsql_oorder.o_w_id], [bmsql_oorder.o_d_id], [bmsql_oorder.o_id], [bmsql_oorder.o_c_id], [bmsql_oorder.o_carrier_id], [bmsql_oorder.o_ol_cnt],
       [bmsql_oorder.o_all_local], [bmsql_oorder.o_entry_d]), filter(nil), rowset=16
      force partition granule
  3 - output([bmsql_oorder.o_w_id], [bmsql_oorder.o_d_id], [bmsql_oorder.o_id], [bmsql_oorder.o_c_id], [bmsql_oorder.o_carrier_id], [bmsql_oorder.o_ol_cnt],
       [bmsql_oorder.o_all_local], [bmsql_oorder.o_entry_d]), filter(nil), rowset=16
      access([bmsql_oorder.o_w_id], [bmsql_oorder.o_d_id], [bmsql_oorder.o_id], [bmsql_oorder.o_c_id], [bmsql_oorder.o_carrier_id], [bmsql_oorder.o_ol_cnt],
       [bmsql_oorder.o_all_local], [bmsql_oorder.o_entry_d]), partitions(p[0-1])
      is_index_back=false, is_global_index=false, 
      range_key([bmsql_oorder.o_w_id], [bmsql_oorder.o_d_id], [bmsql_oorder.o_id]), range(MIN,MIN,MIN ; MAX,MAX,MAX)always true
affected rows: 24
select /*+index(bmsql_oorder primary)*/ * from bmsql_oorder;
+--------+--------+------+--------+--------------+----------+-------------+-----------+
| o_w_id | o_d_id | o_id | o_c_id | o_carrier_id | o_ol_cnt | o_all_local | o_entry_d |
+--------+--------+------+--------+--------------+----------+-------------+-----------+
|     36 |      7 |    1 |    169 |            1 |     NULL |        NULL | NULL      |
+--------+--------+------+--------+--------------+----------+-------------+-----------+
affected rows: 1
EXPLAIN BASIC select /*+index(bmsql_oorder o_w_id)*/ `o_w_id`, `o_d_id`, `o_c_id`, `o_id` from bmsql_oorder;
Query Plan
===============================================
|ID|OPERATOR             |NAME                |
-----------------------------------------------
|0 |EXCHANGE IN REMOTE   |                    |
|1 |└─EXCHANGE OUT REMOTE|                    |
|2 |  └─TABLE FULL SCAN  |bmsql_oorder(o_w_id)|
===============================================
Outputs & filters:
-------------------------------------
  0 - output([bmsql_oorder.o_w_id], [bmsql_oorder.o_d_id], [bmsql_oorder.o_c_id], [bmsql_oorder.o_id]), filter(nil)
  1 - output([bmsql_oorder.o_w_id], [bmsql_oorder.o_d_id], [bmsql_oorder.o_c_id], [bmsql_oorder.o_id]), filter(nil)
  2 - output([bmsql_oorder.o_w_id], [bmsql_oorder.o_d_id], [bmsql_oorder.o_c_id], [bmsql_oorder.o_id]), filter(nil), rowset=16
      access([bmsql_oorder.o_w_id], [bmsql_oorder.o_d_id], [bmsql_oorder.o_id], [bmsql_oorder.o_c_id]), partitions(p0)
      is_index_back=false, is_global_index=true, 
      range_key([bmsql_oorder.o_w_id], [bmsql_oorder.o_d_id], [bmsql_oorder.o_c_id], [bmsql_oorder.o_id]), range(MIN,MIN,MIN,MIN ; MAX,MAX,MAX,MAX)always 
      true
affected rows: 16
select /*+index(bmsql_oorder o_w_id)*/ `o_w_id`, `o_d_id`, `o_c_id`, `o_id` from bmsql_oorder;
+--------+--------+--------+------+
| o_w_id | o_d_id | o_c_id | o_id |
+--------+--------+--------+------+
|     36 |      7 |    169 |    1 |
+--------+--------+--------+------+
affected rows: 1
EXPLAIN BASIC select /*+index(bmsql_oorder o_w_id_2)*/ `o_w_id`, `o_d_id`, `o_ol_cnt`, `o_id` from bmsql_oorder;
Query Plan
=================================================
|ID|OPERATOR             |NAME                  |
-------------------------------------------------
|0 |EXCHANGE IN REMOTE   |                      |
|1 |└─EXCHANGE OUT REMOTE|                      |
|2 |  └─TABLE FULL SCAN  |bmsql_oorder(o_w_id_2)|
=================================================
Outputs & filters:
-------------------------------------
  0 - output([bmsql_oorder.o_w_id], [bmsql_oorder.o_d_id], [bmsql_oorder.o_ol_cnt], [bmsql_oorder.o_id]), filter(nil)
  1 - output([bmsql_oorder.o_w_id], [bmsql_oorder.o_d_id], [bmsql_oorder.o_ol_cnt], [bmsql_oorder.o_id]), filter(nil)
  2 - output([bmsql_oorder.o_w_id], [bmsql_oorder.o_d_id], [bmsql_oorder.o_ol_cnt], [bmsql_oorder.o_id]), filter(nil), rowset=16
      access([bmsql_oorder.o_w_id], [bmsql_oorder.o_d_id], [bmsql_oorder.o_id], [bmsql_oorder.o_ol_cnt]), partitions(p0)
      is_index_back=false, is_global_index=true, 
      range_key([bmsql_oorder.o_w_id], [bmsql_oorder.o_d_id], [bmsql_oorder.o_ol_cnt], [bmsql_oorder.o_id]), range(MIN,MIN,MIN,MIN ; MAX,MAX,MAX,MAX)always 
      true
affected rows: 16
select /*+index(bmsql_oorder o_w_id_2)*/ `o_w_id`, `o_d_id`, `o_ol_cnt`, `o_id` from bmsql_oorder;
+--------+--------+----------+------+
| o_w_id | o_d_id | o_ol_cnt | o_id |
+--------+--------+----------+------+
|     36 |      7 |     NULL |    1 |
+--------+--------+----------+------+
affected rows: 1
drop table bmsql_oorder;
affected rows: 0

drop table if exists t25;
affected rows: 0
create table t25(a int, b int, c int, d int, primary key(a, b)) partition by hash(a) partitions 2;
affected rows: 0
create unique index uk_t25 on t25(a, c, d) global;
affected rows: 0
EXPLAIN BASIC insert into t25 values(1, 1, 1, 1);
Query Plan
============================
|ID|OPERATOR          |NAME|
----------------------------
|0 |DISTRIBUTED INSERT|    |
|1 |└─EXPRESSION      |    |
============================
Outputs & filters:
-------------------------------------
  0 - output(nil), filter(nil)
      columns([{t25: ({t25: (t25.a, t25.b, t25.c, t25.d)}, {uk_t25: (t25.a, t25.c, t25.d, t25.b)})}]), 
      column_values([column_conv(INT,PS:(11,0),NOT NULL,__values.a)], [column_conv(INT,PS:(11,0),NOT NULL,__values.b)], [column_conv(INT,PS:(11,0),NULL,
      __values.c)], [column_conv(INT,PS:(11,0),NULL,__values.d)])
  1 - output([__values.a], [__values.b], [__values.c], [__values.d]), filter(nil)
      values({1, 1, 1, 1})
affected rows: 14
insert into t25 values(1, 1, 1, 1);
affected rows: 1
EXPLAIN BASIC replace into t25 values(1, 2, 1, 1);
Query Plan
=============================
|ID|OPERATOR           |NAME|
-----------------------------
|0 |DISTRIBUTED REPLACE|    |
|1 |└─EXPRESSION       |    |
=============================
Outputs & filters:
-------------------------------------
  0 - output(nil), filter(nil)
      columns([{t25: ({t25: (t25.a, t25.b, t25.c, t25.d)}, {uk_t25: (t25.a, t25.c, t25.d, t25.b)})}]), 
      column_values([column_conv(INT,PS:(11,0),NOT NULL,__values.a)], [column_conv(INT,PS:(11,0),NOT NULL,__values.b)], [column_conv(INT,PS:(11,0),NULL,
      __values.c)], [column_conv(INT,PS:(11,0),NULL,__values.d)])
  1 - output([__values.a], [__values.b], [__values.c], [__values.d]), filter(nil)
      values({1, 2, 1, 1})
affected rows: 14
replace into t25 values(1, 2, 1, 1);
affected rows: 2
EXPLAIN BASIC select * from t25 order by a, b;
Query Plan
======================================
|ID|OPERATOR             |NAME       |
--------------------------------------
|0 |EXCHANGE IN REMOTE   |           |
|1 |└─EXCHANGE OUT REMOTE|           |
|2 |  └─SORT             |           |
|3 |    └─TABLE FULL SCAN|t25(uk_t25)|
======================================
Outputs & filters:
-------------------------------------
  0 - output([t25.a], [t25.b], [t25.c], [t25.d]), filter(nil)
  1 - output([t25.a], [t25.b], [t25.c], [t25.d]), filter(nil)
  2 - output([t25.a], [t25.b], [t25.c], [t25.d]), filter(nil), rowset=16
      sort_keys([t25.a, ASC], [t25.b, ASC]), prefix_pos(1)
  3 - output([t25.a], [t25.b], [t25.c], [t25.d]), filter(nil), rowset=16
      access([t25.a], [t25.b], [t25.c], [t25.d]), partitions(p0)
      is_index_back=false, is_global_index=true, 
      range_key([t25.a], [t25.c], [t25.d], [t25.shadow_pk_0], [t25.shadow_pk_1]), range(MIN,MIN,MIN,MIN,MIN ; MAX,MAX,MAX,MAX,MAX)always true
affected rows: 18
select * from t25 order by a, b;
+---+---+------+------+
| a | b | c    | d    |
+---+---+------+------+
| 1 | 2 |    1 |    1 |
+---+---+------+------+
affected rows: 1
EXPLAIN BASIC replace into t25 values(2, 3, 1, 1);
Query Plan
=============================
|ID|OPERATOR           |NAME|
-----------------------------
|0 |DISTRIBUTED REPLACE|    |
|1 |└─EXPRESSION       |    |
=============================
Outputs & filters:
-------------------------------------
  0 - output(nil), filter(nil)
      columns([{t25: ({t25: (t25.a, t25.b, t25.c, t25.d)}, {uk_t25: (t25.a, t25.c, t25.d, t25.b)})}]), 
      column_values([column_conv(INT,PS:(11,0),NOT NULL,__values.a)], [column_conv(INT,PS:(11,0),NOT NULL,__values.b)], [column_conv(INT,PS:(11,0),NULL,
      __values.c)], [column_conv(INT,PS:(11,0),NULL,__values.d)])
  1 - output([__values.a], [__values.b], [__values.c], [__values.d]), filter(nil)
      values({2, 3, 1, 1})
affected rows: 14
replace into t25 values(2, 3, 1, 1);
affected rows: 1
EXPLAIN BASIC select * from t25 order by a, b;
Query Plan
======================================
|ID|OPERATOR             |NAME       |
--------------------------------------
|0 |EXCHANGE IN REMOTE   |           |
|1 |└─EXCHANGE OUT REMOTE|           |
|2 |  └─SORT             |           |
|3 |    └─TABLE FULL SCAN|t25(uk_t25)|
======================================
Outputs & filters:
-------------------------------------
  0 - output([t25.a], [t25.b], [t25.c], [t25.d]), filter(nil)
  1 - output([t25.a], [t25.b], [t25.c], [t25.d]), filter(nil)
  2 - output([t25.a], [t25.b], [t25.c], [t25.d]), filter(nil), rowset=16
      sort_keys([t25.a, ASC], [t25.b, ASC]), prefix_pos(1)
  3 - output([t25.a], [t25.b], [t25.c], [t25.d]), filter(nil), rowset=16
      access([t25.a], [t25.b], [t25.c], [t25.d]), partitions(p0)
      is_index_back=false, is_global_index=true, 
      range_key([t25.a], [t25.c], [t25.d], [t25.shadow_pk_0], [t25.shadow_pk_1]), range(MIN,MIN,MIN,MIN,MIN ; MAX,MAX,MAX,MAX,MAX)always true
affected rows: 18
select * from t25 order by a, b;
+---+---+------+------+
| a | b | c    | d    |
+---+---+------+------+
| 1 | 2 |    1 |    1 |
| 2 | 3 |    1 |    1 |
+---+---+------+------+
affected rows: 2
drop table t25;
affected rows: 0

EXPLAIN BASIC insert into t26 values(1, 2, 3, 4), (4, 2, 3, 1), (3, 3, 1, 2), (2, 10, 9, 8);
Query Plan
============================
|ID|OPERATOR          |NAME|
----------------------------
|0 |DISTRIBUTED INSERT|    |
|1 |└─EXPRESSION      |    |
============================
Outputs & filters:
-------------------------------------
  0 - output(nil), filter(nil)
      columns([{t26: ({t26: (t26.c1, t26.c2, t26.c3, t26.c4)}, {yuming_global_i1: (t26.c2, t26.c1)}, {yuming_global_i2: (t26.c3, t26.c1)})}]), 
      column_values([column_conv(INT,PS:(11,0),NOT NULL,__values.c1)], [column_conv(INT,PS:(11,0),NULL,__values.c2)], [column_conv(INT,PS:(11,0),NULL,__values.c3)],
       [column_conv(INT,PS:(11,0),NULL,__values.c4)])
  1 - output([__values.c1], [__values.c2], [__values.c3], [__values.c4]), filter(nil)
      values({1, 2, 3, 4}, {4, 2, 3, 1}, {3, 3, 1, 2}, {2, 10, 9, 8})
affected rows: 14
insert into t26 values(1, 2, 3, 4), (4, 2, 3, 1), (3, 3, 1, 2), (2, 10, 9, 8);
affected rows: 4
info: Records: 4  Duplicates: 0  Warnings: 0
set ob_enable_index_direct_select = on;
affected rows: 0
explain_protocol: 0
+----+------+
| c1 | c2   |
+----+------+
|  1 |    2 |
|  4 |    2 |
|  3 |    3 |
|  2 |   10 |
+----+------+
affected rows: 4
+----+------+
| c1 | c3   |
+----+------+
|  3 |    1 |
|  1 |    3 |
|  4 |    3 |
|  2 |    9 |
+----+------+
affected rows: 4
explain_protocol: 1
EXPLAIN BASIC select * from t26 order by c1;
Query Plan
=========================================
|ID|OPERATOR                   |NAME    |
-----------------------------------------
|0 |PX COORDINATOR MERGE SORT  |        |
|1 |└─EXCHANGE OUT DISTR       |:EX10000|
|2 |  └─SORT                   |        |
|3 |    └─PX PARTITION ITERATOR|        |
|4 |      └─TABLE FULL SCAN    |t26     |
=========================================
Outputs & filters:
-------------------------------------
  0 - output([INTERNAL_FUNCTION(t26.c1, t26.c2, t26.c3, t26.c4)]), filter(nil), rowset=16
      sort_keys([t26.c1, ASC])
  1 - output([t26.c1], [INTERNAL_FUNCTION(t26.c1, t26.c2, t26.c3, t26.c4)]), filter(nil), rowset=16
      dop=1
  2 - output([t26.c1], [t26.c2], [t26.c3], [t26.c4]), filter(nil), rowset=16
      sort_keys([t26.c1, ASC]), local merge sort
  3 - output([t26.c1], [t26.c2], [t26.c3], [t26.c4]), filter(nil), rowset=16
      force partition granule
  4 - output([t26.c1], [t26.c2], [t26.c3], [t26.c4]), filter(nil), rowset=16
      access([t26.c1], [t26.c2], [t26.c3], [t26.c4]), partitions(p[0-1])
      is_index_back=false, is_global_index=false, 
      range_key([t26.c1]), range(MIN ; MAX)always true
affected rows: 23
select * from t26 order by c1;
+----+------+------+------+
| c1 | c2   | c3   | c4   |
+----+------+------+------+
|  1 |    2 |    3 |    4 |
|  2 |   10 |    9 |    8 |
|  3 |    3 |    1 |    2 |
|  4 |    2 |    3 |    1 |
+----+------+------+------+
affected rows: 4
drop table t26;
affected rows: 0

set ob_query_timeout = 30000000;
affected rows: 0
drop table if exists gf_ar_mthly_bill;
affected rows: 0
CREATE TABLE `gf_ar_mthly_bill` (
   `tnt_inst_id` varchar(8) COLLATE utf8mb4_bin NOT NULL COMMENT '租户机构id',
   `bill_no` varchar(64) COLLATE utf8mb4_bin NOT NULL COMMENT '账单号',
   `ip_id` varchar(32) COLLATE utf8mb4_bin NOT NULL COMMENT '结算对象ipid',
   `ip_role_id` varchar(32) COLLATE utf8mb4_bin NOT NULL COMMENT '结算对象pid',
   `inst_id` varchar(32) COLLATE utf8mb4_bin NOT NULL COMMENT '分支机构',
   `pd_code` varchar(64) COLLATE utf8mb4_bin DEFAULT NULL COMMENT '产品码',
   `ar_no` varchar(34) COLLATE utf8mb4_bin DEFAULT NULL COMMENT '合约号',
   `bill_tp` varchar(2) COLLATE utf8mb4_bin NOT NULL COMMENT '账单类型',
   `setl_tp` varchar(2) COLLATE utf8mb4_bin NOT NULL COMMENT '结算方式',
   `bill_st` varchar(2) COLLATE utf8mb4_bin NOT NULL COMMENT '核销状态',
   `bill_strt_dt` varchar(8) COLLATE utf8mb4_bin NOT NULL COMMENT '账单开始日期',
   `bill_end_dt` varchar(8) COLLATE utf8mb4_bin NOT NULL COMMENT '账单结束日期',
   `bill_mth` varchar(6) COLLATE utf8mb4_bin NOT NULL COMMENT '账单月份',
   `acrd_dt` varchar(8) COLLATE utf8mb4_bin DEFAULT NULL COMMENT '应收日期',
   `gmt_pay` timestamp(6) NULL DEFAULT NULL COMMENT '付款时间',
   `payee_ac` varchar(34) COLLATE utf8mb4_bin DEFAULT NULL COMMENT '收款方账号',
   `payer_ac` varchar(34) COLLATE utf8mb4_bin DEFAULT NULL COMMENT '付款方账号',
   `pay_way` varchar(2) COLLATE utf8mb4_bin DEFAULT NULL COMMENT '支付方式',
   `pay_orig` varchar(2) COLLATE utf8mb4_bin DEFAULT NULL COMMENT '支付来源',
   `clcn_bsc_amt` decimal(25,4) DEFAULT NULL COMMENT '计算交易量',
   `clcn_bsc_tp` varchar(2) COLLATE utf8mb4_bin DEFAULT NULL COMMENT '计算依据',
   `clcn_mthd` varchar(2) COLLATE utf8mb4_bin DEFAULT NULL COMMENT '计算方法',
   `chrg_itm_code` varchar(64) COLLATE utf8mb4_bin DEFAULT NULL COMMENT '收费项编码',
   `ccy` varchar(3) COLLATE utf8mb4_bin NOT NULL COMMENT '币种',
   `bill_amt` bigint(20) NOT NULL COMMENT '账单金额',
   `adj_amt` bigint(20) NOT NULL COMMENT '调整金额',
   `rcvd_amt` bigint(20) NOT NULL COMMENT '已收金额',
   `tax_tp` varchar(16) COLLATE utf8mb4_bin NOT NULL COMMENT '税种 01:增值税 02:营业税',
   `tax_rate` decimal(10,8) NOT NULL COMMENT '税率',
   `tax_amt` bigint(20) NOT NULL COMMENT '税额',
   `exn_inf` varchar(4000) COLLATE utf8mb4_bin DEFAULT NULL COMMENT '扩展信息',
   `anl_dmsn1` varchar(1000) COLLATE utf8mb4_bin DEFAULT NULL COMMENT '分析维度1',
   `anl_dmsn2` varchar(1000) COLLATE utf8mb4_bin DEFAULT NULL COMMENT '分析维度2',
   `anl_dmsn3` varchar(1000) COLLATE utf8mb4_bin DEFAULT NULL COMMENT '分析维度3',
   `anl_dmsn4` varchar(1000) COLLATE utf8mb4_bin DEFAULT NULL COMMENT '分析维度4',
   `wrtof_dtl_cnt` bigint(20) DEFAULT NULL COMMENT '已核销明细数量',
   `to_wrtof_dtl_cnt` bigint(20) DEFAULT NULL COMMENT '待核销明细数量',
   `rcrd_id` varchar(64) COLLATE utf8mb4_bin NOT NULL COMMENT '数据唯一ID',
   `last_moder` varchar(32) COLLATE utf8mb4_bin NOT NULL COMMENT '最近修改人',
   `gmt_create` timestamp(6) NOT NULL COMMENT '创建时间',
   `gmt_modified` timestamp(6) NOT NULL COMMENT '修改时间',
   `charge_tp` varchar(32) COLLATE utf8mb4_bin DEFAULT NULL COMMENT '计收费环境类型 01 主站云计收费 02 主站离线计收费 03 主站老计收费',
   `stl_ip_role_id` varchar(32) COLLATE utf8mb4_bin DEFAULT NULL COMMENT '结算对象',
   `svc_amt` bigint(20) DEFAULT NULL COMMENT '交易金额',
   `inved_amt` bigint(20) DEFAULT NULL COMMENT '已开票金额',
   `chk_st` varchar(2) COLLATE utf8mb4_bin DEFAULT NULL COMMENT '出账状态 01 初始化 02 待确认出账 03 已出账 04 客户已对账 05 对账差异',
   `acnt_day` varchar(14) COLLATE utf8mb4_bin DEFAULT NULL COMMENT '出账日',
   `inv_amt` bigint(20) DEFAULT NULL COMMENT '可开票金额',
   `rel_inv_amt` bigint(20) DEFAULT NULL COMMENT '已关联发票金额',
   `tp` varchar(2) COLLATE utf8mb4_bin DEFAULT NULL COMMENT '应收1 返点2',
   `payer_ip_role_id` varchar(32) COLLATE utf8mb4_bin DEFAULT NULL COMMENT '扣款对象pid',
   `sgn_ip_id` varchar(32) COLLATE utf8mb4_bin DEFAULT NULL COMMENT '签约对象ipid',
   `sgn_ip_role_id` varchar(32) COLLATE utf8mb4_bin DEFAULT NULL COMMENT '签约对象pid',
   `chking_amt` bigint(20) DEFAULT '0' COMMENT '出账中金额',
   `frz_amt` bigint(20) DEFAULT '0' COMMENT '冻结金额（用于控制流程上互斥的业务）',
   `chked_amt` bigint(20) DEFAULT '0' COMMENT '已出账金额',
   `writingoff_amt` bigint(20) DEFAULT '0' COMMENT '核销中金额',
   `svc_bill_amt` bigint(20) DEFAULT NULL COMMENT '账单计费金额，计收费计费时生成的中间金额',
   `svc_ccy` varchar(3) COLLATE utf8mb4_bin DEFAULT NULL COMMENT '账单计费币种',
   `env_source` varchar(16) COLLATE utf8mb4_bin DEFAULT NULL COMMENT '环境标识',
   `metadata_source` varchar(1024) COLLATE utf8mb4_bin DEFAULT NULL COMMENT '元数据来源标识，包括(用户、商户、产品、合约、计费)来源',
   `setl_time_zone` varchar(12) COLLATE utf8mb4_bin DEFAULT NULL COMMENT '账单结算时区',
   `actg_time_zone` varchar(12) COLLATE utf8mb4_bin DEFAULT NULL COMMENT '账单核算时区',
   `inter_trade_flag` varchar(1) COLLATE utf8mb4_bin DEFAULT NULL COMMENT 'Y: 是关联交易 N: 不是关联交易',
   `actg_bill_mth` varchar(6) COLLATE utf8mb4_bin DEFAULT NULL COMMENT '核算时区账单月份',
   `auto_writeoff_group_no` varchar(64) COLLATE utf8mb4_bin DEFAULT NULL COMMENT '自动核销关联组号',
   `partition_id` varchar(4) COLLATE utf8mb4_bin GENERATED ALWAYS AS (substr(`bill_no`,23,2)) VIRTUAL,
   PRIMARY KEY (`tnt_inst_id`, `bill_no`),
   UNIQUE KEY `uk_tnt_inst_id_rcrd_id` (`tnt_inst_id`, `rcrd_id`) GLOBAL  BLOCK_SIZE 16384,
   KEY `idx_tnt_inst_id_acnt_day_chk_st_gmt_create` (`tnt_inst_id`, `acnt_day`, `chk_st`, `gmt_create`) GLOBAL  BLOCK_SIZE 16384,
   KEY `idx_tnt_inst_id_acnt_day_chk_st` (`tnt_inst_id`, `acnt_day`, `chk_st`) GLOBAL  BLOCK_SIZE 16384,
   KEY `idx_tnt_inst_id_ip_role_id` (`tnt_inst_id`, `ip_role_id`) LOCAL  BLOCK_SIZE 16384,
   KEY `idx_tnt_inst_id_setl_tp_bill_st` (`tnt_inst_id`, `setl_tp`, `bill_st`) GLOBAL  BLOCK_SIZE 16384,
   KEY `idx_tnt_inst_id_ar_no` (`tnt_inst_id`, `ar_no`) GLOBAL  BLOCK_SIZE 16384,
   KEY `idx_tnt_inst_id_bill_mth` (`tnt_inst_id`, `bill_mth`) GLOBAL  BLOCK_SIZE 16384,
   KEY `idx_ip_role_id_bill_mth` (`tnt_inst_id`, `ip_role_id`, `bill_mth`) LOCAL  BLOCK_SIZE 16384,
   KEY `idx_tnt_inst_id_ip_id` (`tnt_inst_id`, `ip_id`, `bill_mth`, `setl_tp`) GLOBAL  BLOCK_SIZE 16384,
   KEY `idx_acrd_dt_setl_tp_bill_st` (`tnt_inst_id`, `acrd_dt`, `setl_tp`, `bill_st`) GLOBAL  BLOCK_SIZE 16384,
   KEY `idx_tnt_inst_id_ip_role_id_bill_mth_setl_tp` (`tnt_inst_id`, `ip_role_id`, `bill_mth`, `setl_tp`) LOCAL  BLOCK_SIZE 16384,
   KEY `idx_bill_mth` (`bill_mth`, `tnt_inst_id`) GLOBAL  BLOCK_SIZE 16384,
   KEY `idx_payer_ip_role_id_bill_mth` (`tnt_inst_id`, `payer_ip_role_id`, `bill_mth`) GLOBAL  BLOCK_SIZE 16384,
   KEY `idx_ip_id_bill_mth` (`tnt_inst_id`, `ip_id`, `bill_mth`) GLOBAL  BLOCK_SIZE 16384,
   KEY `idx_policy_id_bill_mth_inst_id_type` (`tnt_inst_id`, `inst_id`, `bill_mth`, `tp`, `anl_dmsn2`) GLOBAL  BLOCK_SIZE 16384,
   KEY `idx_tnt_inst_id_inst_id_tp_anl_dmsn_1_bill_mth` (`tnt_inst_id`, `inst_id`, `tp`, `anl_dmsn1`, `bill_mth`) GLOBAL  BLOCK_SIZE 16384,
   KEY `idx_tnt_inst_id_inst_id_tp_anl_dmsn_3_bill_mth` (`tnt_inst_id`, `inst_id`, `tp`, `anl_dmsn3`, `bill_mth`) GLOBAL  BLOCK_SIZE 16384,
   KEY `idx_tnt_inst_id_inst_id_tp_anl_dmsn_4_bill_mth` (`tnt_inst_id`, `inst_id`, `tp`, `anl_dmsn4`, `bill_mth`) GLOBAL  BLOCK_SIZE 16384,
   KEY `idx_tnt_inst_id_inst_id_tp_anl_dmsn_2_bill_mth` (`tnt_inst_id`, `inst_id`, `tp`, `anl_dmsn2`, `bill_mth`) GLOBAL  BLOCK_SIZE 16384,
   CONSTRAINT `cst1` CHECK ((`partition_id` = substr(`ip_role_id`,-3,2)))
 ) partition by list columns(partition_id)
 (partition p0 values in ('00'),
 partition p80 values in ('80'),
 partition p81 values in ('81'),
 partition p82 values in ('82'),
 partition p95 values in ('95'),
 partition p96 values in ('96'),
 partition p97 values in ('97'),
 partition p98 values in ('98'),
 partition p99 values in ('99'));
affected rows: 0

EXPLAIN BASIC INSERT INTO GF_AR_MTHLY_BILL (tnt_inst_id, bill_no, ip_id, ip_role_id, inst_id, pd_code, ar_no, bill_tp, setl_tp, bill_st, bill_strt_dt, bill_end_dt, bill_mth, acrd_dt, gmt_pay, payee_ac, payer_ac, pay_way, pay_orig, clcn_bsc_amt, clcn_bsc_tp, clcn_mthd, chrg_itm_code, ccy, bill_amt, adj_amt, rcvd_amt, tax_tp, tax_rate, tax_amt, exn_inf, anl_dmsn1, anl_dmsn2, anl_dmsn3, anl_dmsn4, wrtof_dtl_cnt, to_wrtof_dtl_cnt, rcrd_id, last_moder, gmt_create, gmt_modified, charge_tp, stl_ip_role_id, svc_amt, inved_amt, chk_st, sgn_ip_id, acnt_day, inv_amt, rel_inv_amt, sgn_ip_role_id, tp, payer_ip_role_id, writingoff_amt, chking_amt, frz_amt, chked_amt, svc_bill_amt, svc_ccy, env_source, setl_time_zone, actg_time_zone, metadata_source, actg_bill_mth, inter_trade_flag, auto_writeoff_group_no) VALUES ('ylctest', '2018090310122000040400820033834415', '308703', '2088301666708823', 'Z84', 'INSURANCE_FREIGHT_SELLER', '20170731F0120101149389088708', '21', '09', '03', '20180901', '20180930', '201809', null, null, '20889110933587190156', '27100000110648200156', '1', null, 2556597446, '01', '02', 'TECHNICAL_FEE', '156', 449961152, -125083343, 324877809, '01', 0.06, 18389308, 'isCloudAr=Y,P_PAYMENT_ID//&2018093010002001690218722636,cloudPdCode//&F0120100001000002258,CHARGE_SHADING_ID//&2088000000000010,formulaCode//&SCENCE_RISK_TEMP,P_SETTLE_INSURANCE//&运费险,arVersion//&3,IsContractDebitAccount//&Y,feeItemCode//&TECHNICAL_FEE,feeItemId//&736379,priceVersion//&3,priceCode//&20170731F0120101149389088708$create_batch_id=1#38624606af04b0ef5dcb2c33a5a3965c$opposite_inst_id=$auto_chargeOff_flag=Y$bill_relation_orderno=2019011410122000061100820000074381$charge_type=03$bill_end_dt=20180930$bill_strt_dt=20180901$insert_flag=Y$actg_batch_info=["2019011410122000060200820008908698|-125083343|156|20180930|AR_CREATE_WITH_TAX|Y| |I|UNFINISHED"]$bill_mth=201809$finAdjustType=$arrangement_source=01$create_date=20181001$handleType=02$immediate_actg_flag=$trading_partner_type=', null, null, null, null, 31, 0, '6faa3f33919a618d3052eb17dbc8ddd1', 'system', '2018-09-03 04:40:25.79317', '2019-01-15 16:25:01.571369', '03', '2088301666708823', null, 0, '05', '308703', '20181002 00:00', 324877809, 0, '2088221648654619', '1', '2088301666708823', 0, 0, 0, 0, null, null, null, null, null, null, null, null, null);
Query Plan
============================
|ID|OPERATOR          |NAME|
----------------------------
|0 |DISTRIBUTED INSERT|    |
|1 |└─EXPRESSION      |    |
============================
Outputs & filters:
-------------------------------------
  0 - output(nil), filter(nil)
      columns([{gf_ar_mthly_bill: ({gf_ar_mthly_bill: (gf_ar_mthly_bill.tnt_inst_id, gf_ar_mthly_bill.bill_no, gf_ar_mthly_bill.ip_id, gf_ar_mthly_bill.ip_role_id,
       gf_ar_mthly_bill.inst_id, gf_ar_mthly_bill.pd_code, gf_ar_mthly_bill.ar_no, gf_ar_mthly_bill.bill_tp, gf_ar_mthly_bill.setl_tp, gf_ar_mthly_bill.bill_st,
       gf_ar_mthly_bill.bill_strt_dt, gf_ar_mthly_bill.bill_end_dt, gf_ar_mthly_bill.bill_mth, gf_ar_mthly_bill.acrd_dt, gf_ar_mthly_bill.gmt_pay, gf_ar_mthly_bill.payee_ac,
       gf_ar_mthly_bill.payer_ac, gf_ar_mthly_bill.pay_way, gf_ar_mthly_bill.pay_orig, gf_ar_mthly_bill.clcn_bsc_amt, gf_ar_mthly_bill.clcn_bsc_tp, gf_ar_mthly_bill.clcn_mthd,
       gf_ar_mthly_bill.chrg_itm_code, gf_ar_mthly_bill.ccy, gf_ar_mthly_bill.bill_amt, gf_ar_mthly_bill.adj_amt, gf_ar_mthly_bill.rcvd_amt, gf_ar_mthly_bill.tax_tp,
       gf_ar_mthly_bill.tax_rate, gf_ar_mthly_bill.tax_amt, gf_ar_mthly_bill.exn_inf, gf_ar_mthly_bill.anl_dmsn1, gf_ar_mthly_bill.anl_dmsn2, gf_ar_mthly_bill.anl_dmsn3,
       gf_ar_mthly_bill.anl_dmsn4, gf_ar_mthly_bill.wrtof_dtl_cnt, gf_ar_mthly_bill.to_wrtof_dtl_cnt, gf_ar_mthly_bill.rcrd_id, gf_ar_mthly_bill.last_moder, gf_ar_mthly_bill.gmt_create,
       gf_ar_mthly_bill.gmt_modified, gf_ar_mthly_bill.charge_tp, gf_ar_mthly_bill.stl_ip_role_id, gf_ar_mthly_bill.svc_amt, gf_ar_mthly_bill.inved_amt, gf_ar_mthly_bill.chk_st,
       gf_ar_mthly_bill.acnt_day, gf_ar_mthly_bill.inv_amt, gf_ar_mthly_bill.rel_inv_amt, gf_ar_mthly_bill.tp, gf_ar_mthly_bill.payer_ip_role_id, gf_ar_mthly_bill.sgn_ip_id,
       gf_ar_mthly_bill.sgn_ip_role_id, gf_ar_mthly_bill.chking_amt, gf_ar_mthly_bill.frz_amt, gf_ar_mthly_bill.chked_amt, gf_ar_mthly_bill.writingoff_amt, gf_ar_mthly_bill.svc_bill_amt,
       gf_ar_mthly_bill.svc_ccy, gf_ar_mthly_bill.env_source, gf_ar_mthly_bill.metadata_source, gf_ar_mthly_bill.setl_time_zone, gf_ar_mthly_bill.actg_time_zone,
       gf_ar_mthly_bill.inter_trade_flag, gf_ar_mthly_bill.actg_bill_mth, gf_ar_mthly_bill.auto_writeoff_group_no, gf_ar_mthly_bill.partition_id)}, {uk_tnt_inst_id_rcrd_id: 
      (gf_ar_mthly_bill.tnt_inst_id, gf_ar_mthly_bill.rcrd_id, gf_ar_mthly_bill.bill_no)}, {idx_tnt_inst_id_acnt_day_chk_st_gmt_create: (gf_ar_mthly_bill.tnt_inst_id,
       gf_ar_mthly_bill.acnt_day, gf_ar_mthly_bill.chk_st, gf_ar_mthly_bill.gmt_create, gf_ar_mthly_bill.bill_no)}, {idx_tnt_inst_id_acnt_day_chk_st: (gf_ar_mthly_bill.tnt_inst_id,
       gf_ar_mthly_bill.acnt_day, gf_ar_mthly_bill.chk_st, gf_ar_mthly_bill.bill_no)}, {idx_tnt_inst_id_setl_tp_bill_st: (gf_ar_mthly_bill.tnt_inst_id, gf_ar_mthly_bill.setl_tp,
       gf_ar_mthly_bill.bill_st, gf_ar_mthly_bill.bill_no)}, {idx_tnt_inst_id_ar_no: (gf_ar_mthly_bill.tnt_inst_id, gf_ar_mthly_bill.ar_no, gf_ar_mthly_bill.bill_no)},
       {idx_tnt_inst_id_bill_mth: (gf_ar_mthly_bill.tnt_inst_id, gf_ar_mthly_bill.bill_mth, gf_ar_mthly_bill.bill_no)}, {idx_tnt_inst_id_ip_id: (gf_ar_mthly_bill.tnt_inst_id,
       gf_ar_mthly_bill.ip_id, gf_ar_mthly_bill.bill_mth, gf_ar_mthly_bill.setl_tp, gf_ar_mthly_bill.bill_no)}, {idx_acrd_dt_setl_tp_bill_st: (gf_ar_mthly_bill.tnt_inst_id,
       gf_ar_mthly_bill.acrd_dt, gf_ar_mthly_bill.setl_tp, gf_ar_mthly_bill.bill_st, gf_ar_mthly_bill.bill_no)}, {idx_bill_mth: (gf_ar_mthly_bill.bill_mth, gf_ar_mthly_bill.tnt_inst_id,
       gf_ar_mthly_bill.bill_no)}, {idx_payer_ip_role_id_bill_mth: (gf_ar_mthly_bill.tnt_inst_id, gf_ar_mthly_bill.payer_ip_role_id, gf_ar_mthly_bill.bill_mth,
       gf_ar_mthly_bill.bill_no)}, {idx_ip_id_bill_mth: (gf_ar_mthly_bill.tnt_inst_id, gf_ar_mthly_bill.ip_id, gf_ar_mthly_bill.bill_mth, gf_ar_mthly_bill.bill_no)},
       {idx_policy_id_bill_mth_inst_id_type: (gf_ar_mthly_bill.tnt_inst_id, gf_ar_mthly_bill.inst_id, gf_ar_mthly_bill.bill_mth, gf_ar_mthly_bill.tp, gf_ar_mthly_bill.anl_dmsn2,
       gf_ar_mthly_bill.bill_no)}, {idx_tnt_inst_id_inst_id_tp_anl_dmsn_1_bill_mth: (gf_ar_mthly_bill.tnt_inst_id, gf_ar_mthly_bill.inst_id, gf_ar_mthly_bill.tp,
       gf_ar_mthly_bill.anl_dmsn1, gf_ar_mthly_bill.bill_mth, gf_ar_mthly_bill.bill_no)}, {idx_tnt_inst_id_inst_id_tp_anl_dmsn_3_bill_mth: (gf_ar_mthly_bill.tnt_inst_id,
       gf_ar_mthly_bill.inst_id, gf_ar_mthly_bill.tp, gf_ar_mthly_bill.anl_dmsn3, gf_ar_mthly_bill.bill_mth, gf_ar_mthly_bill.bill_no)}, {idx_tnt_inst_id_inst_id_tp_anl_dmsn_4_bill_mth: 
      (gf_ar_mthly_bill.tnt_inst_id, gf_ar_mthly_bill.inst_id, gf_ar_mthly_bill.tp, gf_ar_mthly_bill.anl_dmsn4, gf_ar_mthly_bill.bill_mth, gf_ar_mthly_bill.bill_no)},
       {idx_tnt_inst_id_inst_id_tp_anl_dmsn_2_bill_mth: (gf_ar_mthly_bill.tnt_inst_id, gf_ar_mthly_bill.inst_id, gf_ar_mthly_bill.tp, gf_ar_mthly_bill.anl_dmsn2,
       gf_ar_mthly_bill.bill_mth, gf_ar_mthly_bill.bill_no)})}]), 
      column_values([column_conv(VARCHAR,utf8mb4_bin,length:8,NOT NULL,__values.tnt_inst_id)], [column_conv(VARCHAR,utf8mb4_bin,length:64,NOT NULL,__values.bill_no)],
       [column_conv(VARCHAR,utf8mb4_bin,length:32,NOT NULL,__values.ip_id)], [column_conv(VARCHAR,utf8mb4_bin,length:32,NOT NULL,__values.ip_role_id)], [column_conv(VARCHAR,
      utf8mb4_bin,length:32,NOT NULL,__values.inst_id)], [column_conv(VARCHAR,utf8mb4_bin,length:64,NULL,__values.pd_code)], [column_conv(VARCHAR,utf8mb4_bin,
      length:34,NULL,__values.ar_no)], [column_conv(VARCHAR,utf8mb4_bin,length:2,NOT NULL,__values.bill_tp)], [column_conv(VARCHAR,utf8mb4_bin,length:2,NOT NULL,
      __values.setl_tp)], [column_conv(VARCHAR,utf8mb4_bin,length:2,NOT NULL,__values.bill_st)], [column_conv(VARCHAR,utf8mb4_bin,length:8,NOT NULL,__values.bill_strt_dt)],
       [column_conv(VARCHAR,utf8mb4_bin,length:8,NOT NULL,__values.bill_end_dt)], [column_conv(VARCHAR,utf8mb4_bin,length:6,NOT NULL,__values.bill_mth)], [column_conv(VARCHAR,
      utf8mb4_bin,length:8,NULL,__values.acrd_dt)], [column_conv(TIMESTAMP,PS:(25,6),NULL,__values.gmt_pay)], [column_conv(VARCHAR,utf8mb4_bin,length:34,NULL,
      __values.payee_ac)], [column_conv(VARCHAR,utf8mb4_bin,length:34,NULL,__values.payer_ac)], [column_conv(VARCHAR,utf8mb4_bin,length:2,NULL,__values.pay_way)],
       [column_conv(VARCHAR,utf8mb4_bin,length:2,NULL,__values.pay_orig)], [column_conv(DECIMAL_INT,PS:(25,4),NULL,__values.clcn_bsc_amt)], [column_conv(VARCHAR,
      utf8mb4_bin,length:2,NULL,__values.clcn_bsc_tp)], [column_conv(VARCHAR,utf8mb4_bin,length:2,NULL,__values.clcn_mthd)], [column_conv(VARCHAR,utf8mb4_bin,
      length:64,NULL,__values.chrg_itm_code)], [column_conv(VARCHAR,utf8mb4_bin,length:3,NOT NULL,__values.ccy)], [column_conv(BIGINT,PS:(20,0),NOT NULL,__values.bill_amt)],
       [column_conv(BIGINT,PS:(20,0),NOT NULL,__values.adj_amt)], [column_conv(BIGINT,PS:(20,0),NOT NULL,__values.rcvd_amt)], [column_conv(VARCHAR,utf8mb4_bin,
      length:16,NOT NULL,__values.tax_tp)], [column_conv(DECIMAL_INT,PS:(10,8),NOT NULL,__values.tax_rate)], [column_conv(BIGINT,PS:(20,0),NOT NULL,__values.tax_amt)],
       [column_conv(VARCHAR,utf8mb4_bin,length:4000,NULL,__values.exn_inf)], [column_conv(VARCHAR,utf8mb4_bin,length:1000,NULL,__values.anl_dmsn1)], [column_conv(VARCHAR,
      utf8mb4_bin,length:1000,NULL,__values.anl_dmsn2)], [column_conv(VARCHAR,utf8mb4_bin,length:1000,NULL,__values.anl_dmsn3)], [column_conv(VARCHAR,utf8mb4_bin,
      length:1000,NULL,__values.anl_dmsn4)], [column_conv(BIGINT,PS:(20,0),NULL,__values.wrtof_dtl_cnt)], [column_conv(BIGINT,PS:(20,0),NULL,__values.to_wrtof_dtl_cnt)],
       [column_conv(VARCHAR,utf8mb4_bin,length:64,NOT NULL,__values.rcrd_id)], [column_conv(VARCHAR,utf8mb4_bin,length:32,NOT NULL,__values.last_moder)], [column_conv(TIMESTAMP,
      PS:(25,6),NOT NULL,timestamp_nvl(__values.gmt_create, cast(current_timestamp(), TIMESTAMP(25, 6))))], [column_conv(TIMESTAMP,PS:(25,6),NOT NULL,timestamp_nvl(__values.gmt_modified,
       cast(current_timestamp(), TIMESTAMP(25, 6))))], [column_conv(VARCHAR,utf8mb4_bin,length:32,NULL,__values.charge_tp)], [column_conv(VARCHAR,utf8mb4_bin,
      length:32,NULL,__values.stl_ip_role_id)], [column_conv(BIGINT,PS:(20,0),NULL,__values.svc_amt)], [column_conv(BIGINT,PS:(20,0),NULL,__values.inved_amt)],
       [column_conv(VARCHAR,utf8mb4_bin,length:2,NULL,__values.chk_st)], [column_conv(VARCHAR,utf8mb4_bin,length:14,NULL,__values.acnt_day)], [column_conv(BIGINT,
      PS:(20,0),NULL,__values.inv_amt)], [column_conv(BIGINT,PS:(20,0),NULL,__values.rel_inv_amt)], [column_conv(VARCHAR,utf8mb4_bin,length:2,NULL,__values.tp)],
       [column_conv(VARCHAR,utf8mb4_bin,length:32,NULL,__values.payer_ip_role_id)], [column_conv(VARCHAR,utf8mb4_bin,length:32,NULL,__values.sgn_ip_id)], [column_conv(VARCHAR,
      utf8mb4_bin,length:32,NULL,__values.sgn_ip_role_id)], [column_conv(BIGINT,PS:(20,0),NULL,__values.chking_amt)], [column_conv(BIGINT,PS:(20,0),NULL,__values.frz_amt)],
       [column_conv(BIGINT,PS:(20,0),NULL,__values.chked_amt)], [column_conv(BIGINT,PS:(20,0),NULL,__values.writingoff_amt)], [column_conv(BIGINT,PS:(20,0),NULL,
      __values.svc_bill_amt)], [column_conv(VARCHAR,utf8mb4_bin,length:3,NULL,__values.svc_ccy)], [column_conv(VARCHAR,utf8mb4_bin,length:16,NULL,__values.env_source)],
       [column_conv(VARCHAR,utf8mb4_bin,length:1024,NULL,__values.metadata_source)], [column_conv(VARCHAR,utf8mb4_bin,length:12,NULL,__values.setl_time_zone)],
       [column_conv(VARCHAR,utf8mb4_bin,length:12,NULL,__values.actg_time_zone)], [column_conv(VARCHAR,utf8mb4_bin,length:1,NULL,__values.inter_trade_flag)], 
      [column_conv(VARCHAR,utf8mb4_bin,length:6,NULL,__values.actg_bill_mth)], [column_conv(VARCHAR,utf8mb4_bin,length:64,NULL,__values.auto_writeoff_group_no)],
       [column_conv(VARCHAR,utf8mb4_bin,length:4,NULL,column_conv(VARCHAR,utf8mb4_bin,length:4,NULL,substr(column_conv(VARCHAR,utf8mb4_bin,length:64,NOT NULL,
      __values.bill_no), 23, 2)))])
  1 - output([__values.tnt_inst_id], [__values.bill_no], [__values.ip_id], [__values.ip_role_id], [__values.inst_id], [__values.pd_code], [__values.ar_no],
       [__values.bill_tp], [__values.setl_tp], [__values.bill_st], [__values.bill_strt_dt], [__values.bill_end_dt], [__values.bill_mth], [__values.acrd_dt], [__values.gmt_pay],
       [__values.payee_ac], [__values.payer_ac], [__values.pay_way], [__values.pay_orig], [__values.clcn_bsc_amt], [__values.clcn_bsc_tp], [__values.clcn_mthd],
       [__values.chrg_itm_code], [__values.ccy], [__values.bill_amt], [__values.adj_amt], [__values.rcvd_amt], [__values.tax_tp], [__values.tax_rate], [__values.tax_amt],
       [__values.exn_inf], [__values.anl_dmsn1], [__values.anl_dmsn2], [__values.anl_dmsn3], [__values.anl_dmsn4], [__values.wrtof_dtl_cnt], [__values.to_wrtof_dtl_cnt],
       [__values.rcrd_id], [__values.last_moder], [__values.gmt_create], [__values.gmt_modified], [__values.charge_tp], [__values.stl_ip_role_id], [__values.svc_amt],
       [__values.inved_amt], [__values.chk_st], [__values.sgn_ip_id], [__values.acnt_day], [__values.inv_amt], [__values.rel_inv_amt], [__values.sgn_ip_role_id],
       [__values.tp], [__values.payer_ip_role_id], [__values.writingoff_amt], [__values.chking_amt], [__values.frz_amt], [__values.chked_amt], [__values.svc_bill_amt],
       [__values.svc_ccy], [__values.env_source], [__values.setl_time_zone], [__values.actg_time_zone], [__values.metadata_source], [__values.actg_bill_mth], 
      [__values.inter_trade_flag], [__values.auto_writeoff_group_no]), filter(nil)
      values({'ylctest', '2018090310122000040400820033834415', '308703', '2088301666708823', 'Z84', 'INSURANCE_FREIGHT_SELLER', '20170731F0120101149389088708',
       '21', '09', '03', '20180901', '20180930', '201809', NULL, NULL, '20889110933587190156', '27100000110648200156', '1', NULL, 2556597446, '01', '02', 'TECHNICAL_FEE',
       '156', 449961152, -125083343, 324877809, '01', 0.06, 18389308, 'isCloudAr=Y,P_PAYMENT_ID//&2018093010002001690218722636,cloudPdCode//&F0120100001000002258,
      CHARGE_SHADING_ID//&2088000000000010,formulaCode//&SCENCE_RISK_TEMP,P_SETTLE_INSURANCE//&运费险,arVersion//&3,IsContractDebitAccount//&Y,feeItemCode//&TECHNICAL_FEE,
      feeItemId//&736379,priceVersion//&3,priceCode//&20170731F0120101149389088708$create_batch_id=1#38624606af04b0ef5dcb2c33a5a3965c$opposite_inst_id=$auto_chargeOff_flag=Y$bill_relation_orderno=20190114101
      22000061100820000074381$charge_type=03$bill_end_dt=20180930$bill_strt_dt=20180901$insert_flag=Y$actg_batch_info=[\"2019011410122000060200820008908698|-125083343|156|20180930|AR_CREATE_WITH_TAX|Y| 
      |I|UNFINISHED\"]$bill_mth=201809$finAdjustType=$arrangement_source=01$create_date=20181001$handleType=02$immediate_actg_flag=$trading_partner_type=', NULL,
       NULL, NULL, NULL, 31, 0, '6faa3f33919a618d3052eb17dbc8ddd1', 'system', '2018-09-03 04:40:25.79317', '2019-01-15 16:25:01.571369', '03', '2088301666708823',
       NULL, 0, '05', '308703', '20181002 00:00', 324877809, 0, '2088221648654619', '1', '2088301666708823', 0, 0, 0, 0, NULL, NULL, NULL, NULL, NULL, NULL, NULL,
       NULL, NULL})
affected rows: 88
INSERT INTO GF_AR_MTHLY_BILL (tnt_inst_id, bill_no, ip_id, ip_role_id, inst_id, pd_code, ar_no, bill_tp, setl_tp, bill_st, bill_strt_dt, bill_end_dt, bill_mth, acrd_dt, gmt_pay, payee_ac, payer_ac, pay_way, pay_orig, clcn_bsc_amt, clcn_bsc_tp, clcn_mthd, chrg_itm_code, ccy, bill_amt, adj_amt, rcvd_amt, tax_tp, tax_rate, tax_amt, exn_inf, anl_dmsn1, anl_dmsn2, anl_dmsn3, anl_dmsn4, wrtof_dtl_cnt, to_wrtof_dtl_cnt, rcrd_id, last_moder, gmt_create, gmt_modified, charge_tp, stl_ip_role_id, svc_amt, inved_amt, chk_st, sgn_ip_id, acnt_day, inv_amt, rel_inv_amt, sgn_ip_role_id, tp, payer_ip_role_id, writingoff_amt, chking_amt, frz_amt, chked_amt, svc_bill_amt, svc_ccy, env_source, setl_time_zone, actg_time_zone, metadata_source, actg_bill_mth, inter_trade_flag, auto_writeoff_group_no) VALUES ('ylctest', '2018090310122000040400820033834415', '308703', '2088301666708823', 'Z84', 'INSURANCE_FREIGHT_SELLER', '20170731F0120101149389088708', '21', '09', '03', '20180901', '20180930', '201809', null, null, '20889110933587190156', '27100000110648200156', '1', null, 2556597446, '01', '02', 'TECHNICAL_FEE', '156', 449961152, -125083343, 324877809, '01', 0.06, 18389308, 'isCloudAr=Y,P_PAYMENT_ID//&2018093010002001690218722636,cloudPdCode//&F0120100001000002258,CHARGE_SHADING_ID//&2088000000000010,formulaCode//&SCENCE_RISK_TEMP,P_SETTLE_INSURANCE//&运费险,arVersion//&3,IsContractDebitAccount//&Y,feeItemCode//&TECHNICAL_FEE,feeItemId//&736379,priceVersion//&3,priceCode//&20170731F0120101149389088708$create_batch_id=1#38624606af04b0ef5dcb2c33a5a3965c$opposite_inst_id=$auto_chargeOff_flag=Y$bill_relation_orderno=2019011410122000061100820000074381$charge_type=03$bill_end_dt=20180930$bill_strt_dt=20180901$insert_flag=Y$actg_batch_info=["2019011410122000060200820008908698|-125083343|156|20180930|AR_CREATE_WITH_TAX|Y| |I|UNFINISHED"]$bill_mth=201809$finAdjustType=$arrangement_source=01$create_date=20181001$handleType=02$immediate_actg_flag=$trading_partner_type=', null, null, null, null, 31, 0, '6faa3f33919a618d3052eb17dbc8ddd1', 'system', '2018-09-03 04:40:25.79317', '2019-01-15 16:25:01.571369', '03', '2088301666708823', null, 0, '05', '308703', '20181002 00:00', 324877809, 0, '2088221648654619', '1', '2088301666708823', 0, 0, 0, 0, null, null, null, null, null, null, null, null, null);
affected rows: 1
EXPLAIN BASIC select * from GF_AR_MTHLY_BILL;
Query Plan
=========================================================================
|ID|OPERATOR                   |NAME                                    |
-------------------------------------------------------------------------
|0 |DISTRIBUTED TABLE FULL SCAN|gf_ar_mthly_bill(uk_tnt_inst_id_rcrd_id)|
=========================================================================
Outputs & filters:
-------------------------------------
  0 - output([gf_ar_mthly_bill.tnt_inst_id], [gf_ar_mthly_bill.bill_no], [gf_ar_mthly_bill.ip_id], [gf_ar_mthly_bill.ip_role_id], [gf_ar_mthly_bill.inst_id],
       [gf_ar_mthly_bill.pd_code], [gf_ar_mthly_bill.ar_no], [gf_ar_mthly_bill.bill_tp], [gf_ar_mthly_bill.setl_tp], [gf_ar_mthly_bill.bill_st], [gf_ar_mthly_bill.bill_strt_dt],
       [gf_ar_mthly_bill.bill_end_dt], [gf_ar_mthly_bill.bill_mth], [gf_ar_mthly_bill.acrd_dt], [gf_ar_mthly_bill.gmt_pay], [gf_ar_mthly_bill.payee_ac], [gf_ar_mthly_bill.payer_ac],
       [gf_ar_mthly_bill.pay_way], [gf_ar_mthly_bill.pay_orig], [gf_ar_mthly_bill.clcn_bsc_amt], [gf_ar_mthly_bill.clcn_bsc_tp], [gf_ar_mthly_bill.clcn_mthd],
       [gf_ar_mthly_bill.chrg_itm_code], [gf_ar_mthly_bill.ccy], [gf_ar_mthly_bill.bill_amt], [gf_ar_mthly_bill.adj_amt], [gf_ar_mthly_bill.rcvd_amt], [gf_ar_mthly_bill.tax_tp],
       [gf_ar_mthly_bill.tax_rate], [gf_ar_mthly_bill.tax_amt], [gf_ar_mthly_bill.exn_inf], [gf_ar_mthly_bill.anl_dmsn1], [gf_ar_mthly_bill.anl_dmsn2], [gf_ar_mthly_bill.anl_dmsn3],
       [gf_ar_mthly_bill.anl_dmsn4], [gf_ar_mthly_bill.wrtof_dtl_cnt], [gf_ar_mthly_bill.to_wrtof_dtl_cnt], [gf_ar_mthly_bill.rcrd_id], [gf_ar_mthly_bill.last_moder],
       [gf_ar_mthly_bill.gmt_create], [gf_ar_mthly_bill.gmt_modified], [gf_ar_mthly_bill.charge_tp], [gf_ar_mthly_bill.stl_ip_role_id], [gf_ar_mthly_bill.svc_amt],
       [gf_ar_mthly_bill.inved_amt], [gf_ar_mthly_bill.chk_st], [gf_ar_mthly_bill.acnt_day], [gf_ar_mthly_bill.inv_amt], [gf_ar_mthly_bill.rel_inv_amt], [gf_ar_mthly_bill.tp],
       [gf_ar_mthly_bill.payer_ip_role_id], [gf_ar_mthly_bill.sgn_ip_id], [gf_ar_mthly_bill.sgn_ip_role_id], [gf_ar_mthly_bill.chking_amt], [gf_ar_mthly_bill.frz_amt],
       [gf_ar_mthly_bill.chked_amt], [gf_ar_mthly_bill.writingoff_amt], [gf_ar_mthly_bill.svc_bill_amt], [gf_ar_mthly_bill.svc_ccy], [gf_ar_mthly_bill.env_source],
       [gf_ar_mthly_bill.metadata_source], [gf_ar_mthly_bill.setl_time_zone], [gf_ar_mthly_bill.actg_time_zone], [gf_ar_mthly_bill.inter_trade_flag], [gf_ar_mthly_bill.actg_bill_mth],
       [gf_ar_mthly_bill.auto_writeoff_group_no], [column_conv(VARCHAR,utf8mb4_bin,length:4,NULL,substr(gf_ar_mthly_bill.bill_no, 23, 2))]), filter(nil), rowset=16
      access([gf_ar_mthly_bill.tnt_inst_id], [gf_ar_mthly_bill.bill_no], [gf_ar_mthly_bill.ip_role_id], [gf_ar_mthly_bill.ip_id], [gf_ar_mthly_bill.inst_id],
       [gf_ar_mthly_bill.pd_code], [gf_ar_mthly_bill.ar_no], [gf_ar_mthly_bill.bill_tp], [gf_ar_mthly_bill.setl_tp], [gf_ar_mthly_bill.bill_st], [gf_ar_mthly_bill.bill_strt_dt],
       [gf_ar_mthly_bill.bill_end_dt], [gf_ar_mthly_bill.bill_mth], [gf_ar_mthly_bill.acrd_dt], [gf_ar_mthly_bill.gmt_pay], [gf_ar_mthly_bill.payee_ac], [gf_ar_mthly_bill.payer_ac],
       [gf_ar_mthly_bill.pay_way], [gf_ar_mthly_bill.pay_orig], [gf_ar_mthly_bill.clcn_bsc_amt], [gf_ar_mthly_bill.clcn_bsc_tp], [gf_ar_mthly_bill.clcn_mthd],
       [gf_ar_mthly_bill.chrg_itm_code], [gf_ar_mthly_bill.ccy], [gf_ar_mthly_bill.bill_amt], [gf_ar_mthly_bill.adj_amt], [gf_ar_mthly_bill.rcvd_amt], [gf_ar_mthly_bill.tax_tp],
       [gf_ar_mthly_bill.tax_rate], [gf_ar_mthly_bill.tax_amt], [gf_ar_mthly_bill.exn_inf], [gf_ar_mthly_bill.anl_dmsn1], [gf_ar_mthly_bill.anl_dmsn2], [gf_ar_mthly_bill.anl_dmsn3],
       [gf_ar_mthly_bill.anl_dmsn4], [gf_ar_mthly_bill.wrtof_dtl_cnt], [gf_ar_mthly_bill.to_wrtof_dtl_cnt], [gf_ar_mthly_bill.rcrd_id], [gf_ar_mthly_bill.last_moder],
       [gf_ar_mthly_bill.gmt_create], [gf_ar_mthly_bill.gmt_modified], [gf_ar_mthly_bill.charge_tp], [gf_ar_mthly_bill.stl_ip_role_id], [gf_ar_mthly_bill.svc_amt],
       [gf_ar_mthly_bill.inved_amt], [gf_ar_mthly_bill.chk_st], [gf_ar_mthly_bill.acnt_day], [gf_ar_mthly_bill.inv_amt], [gf_ar_mthly_bill.rel_inv_amt], [gf_ar_mthly_bill.tp],
       [gf_ar_mthly_bill.payer_ip_role_id], [gf_ar_mthly_bill.sgn_ip_id], [gf_ar_mthly_bill.sgn_ip_role_id], [gf_ar_mthly_bill.chking_amt], [gf_ar_mthly_bill.frz_amt],
       [gf_ar_mthly_bill.chked_amt], [gf_ar_mthly_bill.writingoff_amt], [gf_ar_mthly_bill.svc_bill_amt], [gf_ar_mthly_bill.svc_ccy], [gf_ar_mthly_bill.env_source],
       [gf_ar_mthly_bill.metadata_source], [gf_ar_mthly_bill.setl_time_zone], [gf_ar_mthly_bill.actg_time_zone], [gf_ar_mthly_bill.inter_trade_flag], [gf_ar_mthly_bill.actg_bill_mth],
       [gf_ar_mthly_bill.auto_writeoff_group_no]), partitions(p0)
      is_index_back=true, is_global_index=true, 
      range_key([gf_ar_mthly_bill.tnt_inst_id], [gf_ar_mthly_bill.rcrd_id], [gf_ar_mthly_bill.shadow_pk_0], [gf_ar_mthly_bill.shadow_pk_1]), range(MIN,MIN,
      MIN,MIN ; MAX,MAX,MAX,MAX)always true
affected rows: 36
select * from GF_AR_MTHLY_BILL;
+-------------+------------------------------------+--------+------------------+---------+--------------------------+------------------------------+---------+---------+---------+--------------+-------------+----------+---------+---------+----------------------+----------------------+---------+----------+-----------------+-------------+-----------+---------------+-----+-----------+------------+-----------+--------+------------+----------+-----------------------------------------------------------------------------------------------------------------------------------------------------------------------------------------------------------------------------------------------------------------------------------------------------------------------------------------------------------------------------------------------------------------------------------------------------------------------------------------------------------------------------------------------------------------------------------------------------------------------------------------------------------------------------------------------------------------------------------------------------------------------------------------------------------------------------------+-----------+-----------+-----------+-----------+---------------+------------------+----------------------------------+------------+----------------------------+----------------------------+-----------+------------------+---------+-----------+--------+----------------+-----------+-------------+------+------------------+-----------+------------------+------------+---------+-----------+----------------+--------------+---------+------------+-----------------+----------------+----------------+------------------+---------------+------------------------+--------------+
| tnt_inst_id | bill_no                            | ip_id  | ip_role_id       | inst_id | pd_code                  | ar_no                        | bill_tp | setl_tp | bill_st | bill_strt_dt | bill_end_dt | bill_mth | acrd_dt | gmt_pay | payee_ac             | payer_ac             | pay_way | pay_orig | clcn_bsc_amt    | clcn_bsc_tp | clcn_mthd | chrg_itm_code | ccy | bill_amt  | adj_amt    | rcvd_amt  | tax_tp | tax_rate   | tax_amt  | exn_inf                                                                                                                                                                                                                                                                                                                                                                                                                                                                                                                                                                                                                                                                                                                                                                                                                           | anl_dmsn1 | anl_dmsn2 | anl_dmsn3 | anl_dmsn4 | wrtof_dtl_cnt | to_wrtof_dtl_cnt | rcrd_id                          | last_moder | gmt_create                 | gmt_modified               | charge_tp | stl_ip_role_id   | svc_amt | inved_amt | chk_st | acnt_day       | inv_amt   | rel_inv_amt | tp   | payer_ip_role_id | sgn_ip_id | sgn_ip_role_id   | chking_amt | frz_amt | chked_amt | writingoff_amt | svc_bill_amt | svc_ccy | env_source | metadata_source | setl_time_zone | actg_time_zone | inter_trade_flag | actg_bill_mth | auto_writeoff_group_no | partition_id |
+-------------+------------------------------------+--------+------------------+---------+--------------------------+------------------------------+---------+---------+---------+--------------+-------------+----------+---------+---------+----------------------+----------------------+---------+----------+-----------------+-------------+-----------+---------------+-----+-----------+------------+-----------+--------+------------+----------+-----------------------------------------------------------------------------------------------------------------------------------------------------------------------------------------------------------------------------------------------------------------------------------------------------------------------------------------------------------------------------------------------------------------------------------------------------------------------------------------------------------------------------------------------------------------------------------------------------------------------------------------------------------------------------------------------------------------------------------------------------------------------------------------------------------------------------------+-----------+-----------+-----------+-----------+---------------+------------------+----------------------------------+------------+----------------------------+----------------------------+-----------+------------------+---------+-----------+--------+----------------+-----------+-------------+------+------------------+-----------+------------------+------------+---------+-----------+----------------+--------------+---------+------------+-----------------+----------------+----------------+------------------+---------------+------------------------+--------------+
| ylctest     | 2018090310122000040400820033834415 | 308703 | 2088301666708823 | Z84     | INSURANCE_FREIGHT_SELLER | 20170731F0120101149389088708 | 21      | 09      | 03      | 20180901     | 20180930    | 201809   | NULL    | NULL    | 20889110933587190156 | 27100000110648200156 | 1       | NULL     | 2556597446.0000 | 01          | 02        | TECHNICAL_FEE | 156 | 449961152 | -125083343 | 324877809 | 01     | 0.06000000 | 18389308 | isCloudAr=Y,P_PAYMENT_ID//&2018093010002001690218722636,cloudPdCode//&F0120100001000002258,CHARGE_SHADING_ID//&2088000000000010,formulaCode//&SCENCE_RISK_TEMP,P_SETTLE_INSURANCE//&运费险,arVersion//&3,IsContractDebitAccount//&Y,feeItemCode//&TECHNICAL_FEE,feeItemId//&736379,priceVersion//&3,priceCode//&20170731F0120101149389088708$create_batch_id=1#38624606af04b0ef5dcb2c33a5a3965c$opposite_inst_id=$auto_chargeOff_flag=Y$bill_relation_orderno=2019011410122000061100820000074381$charge_type=03$bill_end_dt=20180930$bill_strt_dt=20180901$insert_flag=Y$actg_batch_info=["2019011410122000060200820008908698|-125083343|156|20180930|AR_CREATE_WITH_TAX|Y| |I|UNFINISHED"]$bill_mth=201809$finAdjustType=$arrangement_source=01$create_date=20181001$handleType=02$immediate_actg_flag=$trading_partner_type=    | NULL      | NULL      | NULL      | NULL      |            31 |                0 | 6faa3f33919a618d3052eb17dbc8ddd1 | system     | 2018-09-03 04:40:25.793170 | 2019-01-15 16:25:01.571369 | 03        | 2088301666708823 |    NULL |         0 | 05     | 20181002 00:00 | 324877809 |           0 | 1    | 2088301666708823 | 308703    | 2088221648654619 |          0 |       0 |         0 |              0 |         NULL | NULL    | NULL       | NULL            | NULL           | NULL           | NULL             | NULL          | NULL                   | 82           |
+-------------+------------------------------------+--------+------------------+---------+--------------------------+------------------------------+---------+---------+---------+--------------+-------------+----------+---------+---------+----------------------+----------------------+---------+----------+-----------------+-------------+-----------+---------------+-----+-----------+------------+-----------+--------+------------+----------+-----------------------------------------------------------------------------------------------------------------------------------------------------------------------------------------------------------------------------------------------------------------------------------------------------------------------------------------------------------------------------------------------------------------------------------------------------------------------------------------------------------------------------------------------------------------------------------------------------------------------------------------------------------------------------------------------------------------------------------------------------------------------------------------------------------------------------------+-----------+-----------+-----------+-----------+---------------+------------------+----------------------------------+------------+----------------------------+----------------------------+-----------+------------------+---------+-----------+--------+----------------+-----------+-------------+------+------------------+-----------+------------------+------------+---------+-----------+----------------+--------------+---------+------------+-----------------+----------------+----------------+------------------+---------------+------------------------+--------------+
affected rows: 1

EXPLAIN BASIC update gf_ar_mthly_bill                     
  set bill_st='01',
  gmt_pay=now(6),
  clcn_bsc_amt='123.12',
  bill_amt=1,
  rcvd_amt=2,
  tax_amt=3,
  exn_inf='123456',
  anl_dmsn1='123456',
  anl_dmsn2='234567',
  anl_dmsn3='345678',
  anl_dmsn4='456789',
  last_moder='ylc',
  adj_amt=4,
  svc_amt = 5,
  chk_st = '06',
  inv_amt = 6,
  writingoff_amt = 7,
  wrtof_dtl_cnt = 9 ,
  to_wrtof_dtl_cnt = 8,
  chking_amt=10,
  chked_amt=11,
  frz_amt=12,
  svc_bill_amt=13,
  gmt_modified=now(6)                     
  where 
  tnt_inst_id='ylctest' 
  and 
  bill_no='2018090310122000040400820033834415';
Query Plan
============================================
|ID|OPERATOR              |NAME            |
--------------------------------------------
|0 |DISTRIBUTED UPDATE    |                |
|1 |└─PX COORDINATOR      |                |
|2 |  └─EXCHANGE OUT DISTR|:EX10000        |
|3 |    └─TABLE GET       |gf_ar_mthly_bill|
============================================
Outputs & filters:
-------------------------------------
  0 - output(nil), filter(nil)
      table_columns([{gf_ar_mthly_bill: ({gf_ar_mthly_bill: (gf_ar_mthly_bill.tnt_inst_id, gf_ar_mthly_bill.bill_no, gf_ar_mthly_bill.ip_id, gf_ar_mthly_bill.ip_role_id,
       gf_ar_mthly_bill.inst_id, gf_ar_mthly_bill.pd_code, gf_ar_mthly_bill.ar_no, gf_ar_mthly_bill.bill_tp, gf_ar_mthly_bill.setl_tp, gf_ar_mthly_bill.bill_st,
       gf_ar_mthly_bill.bill_strt_dt, gf_ar_mthly_bill.bill_end_dt, gf_ar_mthly_bill.bill_mth, gf_ar_mthly_bill.acrd_dt, gf_ar_mthly_bill.gmt_pay, gf_ar_mthly_bill.payee_ac,
       gf_ar_mthly_bill.payer_ac, gf_ar_mthly_bill.pay_way, gf_ar_mthly_bill.pay_orig, gf_ar_mthly_bill.clcn_bsc_amt, gf_ar_mthly_bill.clcn_bsc_tp, gf_ar_mthly_bill.clcn_mthd,
       gf_ar_mthly_bill.chrg_itm_code, gf_ar_mthly_bill.ccy, gf_ar_mthly_bill.bill_amt, gf_ar_mthly_bill.adj_amt, gf_ar_mthly_bill.rcvd_amt, gf_ar_mthly_bill.tax_tp,
       gf_ar_mthly_bill.tax_rate, gf_ar_mthly_bill.tax_amt, gf_ar_mthly_bill.exn_inf, gf_ar_mthly_bill.anl_dmsn1, gf_ar_mthly_bill.anl_dmsn2, gf_ar_mthly_bill.anl_dmsn3,
       gf_ar_mthly_bill.anl_dmsn4, gf_ar_mthly_bill.wrtof_dtl_cnt, gf_ar_mthly_bill.to_wrtof_dtl_cnt, gf_ar_mthly_bill.rcrd_id, gf_ar_mthly_bill.last_moder, gf_ar_mthly_bill.gmt_create,
       gf_ar_mthly_bill.gmt_modified, gf_ar_mthly_bill.charge_tp, gf_ar_mthly_bill.stl_ip_role_id, gf_ar_mthly_bill.svc_amt, gf_ar_mthly_bill.inved_amt, gf_ar_mthly_bill.chk_st,
       gf_ar_mthly_bill.acnt_day, gf_ar_mthly_bill.inv_amt, gf_ar_mthly_bill.rel_inv_amt, gf_ar_mthly_bill.tp, gf_ar_mthly_bill.payer_ip_role_id, gf_ar_mthly_bill.sgn_ip_id,
       gf_ar_mthly_bill.sgn_ip_role_id, gf_ar_mthly_bill.chking_amt, gf_ar_mthly_bill.frz_amt, gf_ar_mthly_bill.chked_amt, gf_ar_mthly_bill.writingoff_amt, gf_ar_mthly_bill.svc_bill_amt,
       gf_ar_mthly_bill.svc_ccy, gf_ar_mthly_bill.env_source, gf_ar_mthly_bill.metadata_source, gf_ar_mthly_bill.setl_time_zone, gf_ar_mthly_bill.actg_time_zone,
       gf_ar_mthly_bill.inter_trade_flag, gf_ar_mthly_bill.actg_bill_mth, gf_ar_mthly_bill.auto_writeoff_group_no, gf_ar_mthly_bill.partition_id)}, {idx_tnt_inst_id_acnt_day_chk_st_gmt_create: 
      (gf_ar_mthly_bill.tnt_inst_id, gf_ar_mthly_bill.acnt_day, gf_ar_mthly_bill.chk_st, gf_ar_mthly_bill.gmt_create, gf_ar_mthly_bill.bill_no)}, {idx_tnt_inst_id_acnt_day_chk_st: 
      (gf_ar_mthly_bill.tnt_inst_id, gf_ar_mthly_bill.acnt_day, gf_ar_mthly_bill.chk_st, gf_ar_mthly_bill.bill_no)}, {idx_tnt_inst_id_setl_tp_bill_st: (gf_ar_mthly_bill.tnt_inst_id,
       gf_ar_mthly_bill.setl_tp, gf_ar_mthly_bill.bill_st, gf_ar_mthly_bill.bill_no)}, {idx_acrd_dt_setl_tp_bill_st: (gf_ar_mthly_bill.tnt_inst_id, gf_ar_mthly_bill.acrd_dt,
       gf_ar_mthly_bill.setl_tp, gf_ar_mthly_bill.bill_st, gf_ar_mthly_bill.bill_no)}, {idx_policy_id_bill_mth_inst_id_type: (gf_ar_mthly_bill.tnt_inst_id, gf_ar_mthly_bill.inst_id,
       gf_ar_mthly_bill.bill_mth, gf_ar_mthly_bill.tp, gf_ar_mthly_bill.anl_dmsn2, gf_ar_mthly_bill.bill_no)}, {idx_tnt_inst_id_inst_id_tp_anl_dmsn_1_bill_mth: 
      (gf_ar_mthly_bill.tnt_inst_id, gf_ar_mthly_bill.inst_id, gf_ar_mthly_bill.tp, gf_ar_mthly_bill.anl_dmsn1, gf_ar_mthly_bill.bill_mth, gf_ar_mthly_bill.bill_no)},
       {idx_tnt_inst_id_inst_id_tp_anl_dmsn_3_bill_mth: (gf_ar_mthly_bill.tnt_inst_id, gf_ar_mthly_bill.inst_id, gf_ar_mthly_bill.tp, gf_ar_mthly_bill.anl_dmsn3,
       gf_ar_mthly_bill.bill_mth, gf_ar_mthly_bill.bill_no)}, {idx_tnt_inst_id_inst_id_tp_anl_dmsn_4_bill_mth: (gf_ar_mthly_bill.tnt_inst_id, gf_ar_mthly_bill.inst_id,
       gf_ar_mthly_bill.tp, gf_ar_mthly_bill.anl_dmsn4, gf_ar_mthly_bill.bill_mth, gf_ar_mthly_bill.bill_no)}, {idx_tnt_inst_id_inst_id_tp_anl_dmsn_2_bill_mth: 
      (gf_ar_mthly_bill.tnt_inst_id, gf_ar_mthly_bill.inst_id, gf_ar_mthly_bill.tp, gf_ar_mthly_bill.anl_dmsn2, gf_ar_mthly_bill.bill_mth, gf_ar_mthly_bill.bill_no)})}]),
      
      update([gf_ar_mthly_bill.bill_st=column_conv(VARCHAR,utf8mb4_bin,length:2,NOT NULL,'01')], [gf_ar_mthly_bill.gmt_pay=column_conv(TIMESTAMP,PS:(25,
      6),NULL,cast(current_timestamp(), TIMESTAMP(-1, 6)))], [gf_ar_mthly_bill.clcn_bsc_amt=column_conv(DECIMAL_INT,PS:(25,4),NULL,'123.12')], [gf_ar_mthly_bill.bill_amt=column_conv(BIGINT,
      PS:(20,0),NOT NULL,1)], [gf_ar_mthly_bill.rcvd_amt=column_conv(BIGINT,PS:(20,0),NOT NULL,2)], [gf_ar_mthly_bill.tax_amt=column_conv(BIGINT,PS:(20,0),NOT 
      NULL,3)], [gf_ar_mthly_bill.exn_inf=column_conv(VARCHAR,utf8mb4_bin,length:4000,NULL,'123456')], [gf_ar_mthly_bill.anl_dmsn1=column_conv(VARCHAR,utf8mb4_bin,
      length:1000,NULL,'123456')], [gf_ar_mthly_bill.anl_dmsn2=column_conv(VARCHAR,utf8mb4_bin,length:1000,NULL,'234567')], [gf_ar_mthly_bill.anl_dmsn3=column_conv(VARCHAR,
      utf8mb4_bin,length:1000,NULL,'345678')], [gf_ar_mthly_bill.anl_dmsn4=column_conv(VARCHAR,utf8mb4_bin,length:1000,NULL,'456789')], [gf_ar_mthly_bill.last_moder=column_conv(VARCHAR,
      utf8mb4_bin,length:32,NOT NULL,'ylc')], [gf_ar_mthly_bill.adj_amt=column_conv(BIGINT,PS:(20,0),NOT NULL,4)], [gf_ar_mthly_bill.svc_amt=column_conv(BIGINT,
      PS:(20,0),NULL,5)], [gf_ar_mthly_bill.chk_st=column_conv(VARCHAR,utf8mb4_bin,length:2,NULL,'06')], [gf_ar_mthly_bill.inv_amt=column_conv(BIGINT,PS:(20,0),
      NULL,6)], [gf_ar_mthly_bill.writingoff_amt=column_conv(BIGINT,PS:(20,0),NULL,7)], [gf_ar_mthly_bill.wrtof_dtl_cnt=column_conv(BIGINT,PS:(20,0),NULL,9)],
       [gf_ar_mthly_bill.to_wrtof_dtl_cnt=column_conv(BIGINT,PS:(20,0),NULL,8)], [gf_ar_mthly_bill.chking_amt=column_conv(BIGINT,PS:(20,0),NULL,10)], [gf_ar_mthly_bill.chked_amt=column_conv(BIGINT,
      PS:(20,0),NULL,11)], [gf_ar_mthly_bill.frz_amt=column_conv(BIGINT,PS:(20,0),NULL,12)], [gf_ar_mthly_bill.svc_bill_amt=column_conv(BIGINT,PS:(20,0),NULL,
      13)], [gf_ar_mthly_bill.gmt_modified=column_conv(TIMESTAMP,PS:(25,6),NOT NULL,timestamp_nvl(cast(current_timestamp(), TIMESTAMP(-1, 6)), cast(current_timestamp(),
       TIMESTAMP(25, 6))))])
  1 - output([gf_ar_mthly_bill.tnt_inst_id], [gf_ar_mthly_bill.bill_no], [gf_ar_mthly_bill.ip_id], [gf_ar_mthly_bill.ip_role_id], [gf_ar_mthly_bill.inst_id],
       [gf_ar_mthly_bill.pd_code], [gf_ar_mthly_bill.ar_no], [gf_ar_mthly_bill.bill_tp], [gf_ar_mthly_bill.setl_tp], [gf_ar_mthly_bill.bill_st], [gf_ar_mthly_bill.bill_strt_dt],
       [gf_ar_mthly_bill.bill_end_dt], [gf_ar_mthly_bill.bill_mth], [gf_ar_mthly_bill.acrd_dt], [gf_ar_mthly_bill.gmt_pay], [gf_ar_mthly_bill.payee_ac], [gf_ar_mthly_bill.payer_ac],
       [gf_ar_mthly_bill.pay_way], [gf_ar_mthly_bill.pay_orig], [gf_ar_mthly_bill.clcn_bsc_amt], [gf_ar_mthly_bill.clcn_bsc_tp], [gf_ar_mthly_bill.clcn_mthd],
       [gf_ar_mthly_bill.chrg_itm_code], [gf_ar_mthly_bill.ccy], [gf_ar_mthly_bill.bill_amt], [gf_ar_mthly_bill.adj_amt], [gf_ar_mthly_bill.rcvd_amt], [gf_ar_mthly_bill.tax_tp],
       [gf_ar_mthly_bill.tax_rate], [gf_ar_mthly_bill.tax_amt], [gf_ar_mthly_bill.exn_inf], [gf_ar_mthly_bill.anl_dmsn1], [gf_ar_mthly_bill.anl_dmsn2], [gf_ar_mthly_bill.anl_dmsn3],
       [gf_ar_mthly_bill.anl_dmsn4], [gf_ar_mthly_bill.wrtof_dtl_cnt], [gf_ar_mthly_bill.to_wrtof_dtl_cnt], [gf_ar_mthly_bill.rcrd_id], [gf_ar_mthly_bill.last_moder],
       [gf_ar_mthly_bill.gmt_create], [gf_ar_mthly_bill.gmt_modified], [gf_ar_mthly_bill.charge_tp], [gf_ar_mthly_bill.stl_ip_role_id], [gf_ar_mthly_bill.svc_amt],
       [gf_ar_mthly_bill.inved_amt], [gf_ar_mthly_bill.chk_st], [gf_ar_mthly_bill.acnt_day], [gf_ar_mthly_bill.inv_amt], [gf_ar_mthly_bill.rel_inv_amt], [gf_ar_mthly_bill.tp],
       [gf_ar_mthly_bill.payer_ip_role_id], [gf_ar_mthly_bill.sgn_ip_id], [gf_ar_mthly_bill.sgn_ip_role_id], [gf_ar_mthly_bill.chking_amt], [gf_ar_mthly_bill.frz_amt],
       [gf_ar_mthly_bill.chked_amt], [gf_ar_mthly_bill.writingoff_amt], [gf_ar_mthly_bill.svc_bill_amt], [gf_ar_mthly_bill.svc_ccy], [gf_ar_mthly_bill.env_source],
       [gf_ar_mthly_bill.metadata_source], [gf_ar_mthly_bill.setl_time_zone], [gf_ar_mthly_bill.actg_time_zone], [gf_ar_mthly_bill.inter_trade_flag], [gf_ar_mthly_bill.actg_bill_mth],
       [gf_ar_mthly_bill.auto_writeoff_group_no], [column_conv(VARCHAR,utf8mb4_bin,length:4,NULL,substr(gf_ar_mthly_bill.bill_no, 23, 2))]), filter(nil), rowset=16
  2 - output([gf_ar_mthly_bill.tnt_inst_id], [gf_ar_mthly_bill.bill_no], [gf_ar_mthly_bill.ip_id], [gf_ar_mthly_bill.ip_role_id], [gf_ar_mthly_bill.inst_id],
       [gf_ar_mthly_bill.pd_code], [gf_ar_mthly_bill.ar_no], [gf_ar_mthly_bill.bill_tp], [gf_ar_mthly_bill.setl_tp], [gf_ar_mthly_bill.bill_st], [gf_ar_mthly_bill.bill_strt_dt],
       [gf_ar_mthly_bill.bill_end_dt], [gf_ar_mthly_bill.bill_mth], [gf_ar_mthly_bill.acrd_dt], [gf_ar_mthly_bill.gmt_pay], [gf_ar_mthly_bill.payee_ac], [gf_ar_mthly_bill.payer_ac],
       [gf_ar_mthly_bill.pay_way], [gf_ar_mthly_bill.pay_orig], [gf_ar_mthly_bill.clcn_bsc_amt], [gf_ar_mthly_bill.clcn_bsc_tp], [gf_ar_mthly_bill.clcn_mthd],
       [gf_ar_mthly_bill.chrg_itm_code], [gf_ar_mthly_bill.ccy], [gf_ar_mthly_bill.bill_amt], [gf_ar_mthly_bill.adj_amt], [gf_ar_mthly_bill.rcvd_amt], [gf_ar_mthly_bill.tax_tp],
       [gf_ar_mthly_bill.tax_rate], [gf_ar_mthly_bill.tax_amt], [gf_ar_mthly_bill.exn_inf], [gf_ar_mthly_bill.anl_dmsn1], [gf_ar_mthly_bill.anl_dmsn2], [gf_ar_mthly_bill.anl_dmsn3],
       [gf_ar_mthly_bill.anl_dmsn4], [gf_ar_mthly_bill.wrtof_dtl_cnt], [gf_ar_mthly_bill.to_wrtof_dtl_cnt], [gf_ar_mthly_bill.rcrd_id], [gf_ar_mthly_bill.last_moder],
       [gf_ar_mthly_bill.gmt_create], [gf_ar_mthly_bill.gmt_modified], [gf_ar_mthly_bill.charge_tp], [gf_ar_mthly_bill.stl_ip_role_id], [gf_ar_mthly_bill.svc_amt],
       [gf_ar_mthly_bill.inved_amt], [gf_ar_mthly_bill.chk_st], [gf_ar_mthly_bill.acnt_day], [gf_ar_mthly_bill.inv_amt], [gf_ar_mthly_bill.rel_inv_amt], [gf_ar_mthly_bill.tp],
       [gf_ar_mthly_bill.payer_ip_role_id], [gf_ar_mthly_bill.sgn_ip_id], [gf_ar_mthly_bill.sgn_ip_role_id], [gf_ar_mthly_bill.chking_amt], [gf_ar_mthly_bill.frz_amt],
       [gf_ar_mthly_bill.chked_amt], [gf_ar_mthly_bill.writingoff_amt], [gf_ar_mthly_bill.svc_bill_amt], [gf_ar_mthly_bill.svc_ccy], [gf_ar_mthly_bill.env_source],
       [gf_ar_mthly_bill.metadata_source], [gf_ar_mthly_bill.setl_time_zone], [gf_ar_mthly_bill.actg_time_zone], [gf_ar_mthly_bill.inter_trade_flag], [gf_ar_mthly_bill.actg_bill_mth],
       [gf_ar_mthly_bill.auto_writeoff_group_no], [column_conv(VARCHAR,utf8mb4_bin,length:4,NULL,substr(gf_ar_mthly_bill.bill_no, 23, 2))]), filter(nil), rowset=16
      is_single, dop=1
  3 - output([gf_ar_mthly_bill.tnt_inst_id], [gf_ar_mthly_bill.bill_no], [column_conv(VARCHAR,utf8mb4_bin,length:4,NULL,substr(gf_ar_mthly_bill.bill_no,
       23, 2))], [gf_ar_mthly_bill.ip_role_id], [gf_ar_mthly_bill.bill_st], [gf_ar_mthly_bill.gmt_pay], [gf_ar_mthly_bill.clcn_bsc_amt], [gf_ar_mthly_bill.bill_amt],
       [gf_ar_mthly_bill.rcvd_amt], [gf_ar_mthly_bill.tax_amt], [gf_ar_mthly_bill.exn_inf], [gf_ar_mthly_bill.anl_dmsn1], [gf_ar_mthly_bill.anl_dmsn2], [gf_ar_mthly_bill.anl_dmsn3],
       [gf_ar_mthly_bill.anl_dmsn4], [gf_ar_mthly_bill.last_moder], [gf_ar_mthly_bill.adj_amt], [gf_ar_mthly_bill.svc_amt], [gf_ar_mthly_bill.chk_st], [gf_ar_mthly_bill.inv_amt],
       [gf_ar_mthly_bill.writingoff_amt], [gf_ar_mthly_bill.wrtof_dtl_cnt], [gf_ar_mthly_bill.to_wrtof_dtl_cnt], [gf_ar_mthly_bill.chking_amt], [gf_ar_mthly_bill.chked_amt],
       [gf_ar_mthly_bill.frz_amt], [gf_ar_mthly_bill.svc_bill_amt], [gf_ar_mthly_bill.gmt_modified], [gf_ar_mthly_bill.ip_id], [gf_ar_mthly_bill.inst_id], [gf_ar_mthly_bill.pd_code],
       [gf_ar_mthly_bill.ar_no], [gf_ar_mthly_bill.bill_tp], [gf_ar_mthly_bill.setl_tp], [gf_ar_mthly_bill.bill_strt_dt], [gf_ar_mthly_bill.bill_end_dt], [gf_ar_mthly_bill.bill_mth],
       [gf_ar_mthly_bill.acrd_dt], [gf_ar_mthly_bill.payee_ac], [gf_ar_mthly_bill.payer_ac], [gf_ar_mthly_bill.pay_way], [gf_ar_mthly_bill.pay_orig], [gf_ar_mthly_bill.clcn_bsc_tp],
       [gf_ar_mthly_bill.clcn_mthd], [gf_ar_mthly_bill.chrg_itm_code], [gf_ar_mthly_bill.ccy], [gf_ar_mthly_bill.tax_tp], [gf_ar_mthly_bill.tax_rate], [gf_ar_mthly_bill.rcrd_id],
       [gf_ar_mthly_bill.gmt_create], [gf_ar_mthly_bill.charge_tp], [gf_ar_mthly_bill.stl_ip_role_id], [gf_ar_mthly_bill.inved_amt], [gf_ar_mthly_bill.acnt_day],
       [gf_ar_mthly_bill.rel_inv_amt], [gf_ar_mthly_bill.tp], [gf_ar_mthly_bill.payer_ip_role_id], [gf_ar_mthly_bill.sgn_ip_id], [gf_ar_mthly_bill.sgn_ip_role_id],
       [gf_ar_mthly_bill.svc_ccy], [gf_ar_mthly_bill.env_source], [gf_ar_mthly_bill.metadata_source], [gf_ar_mthly_bill.setl_time_zone], [gf_ar_mthly_bill.actg_time_zone],
       [gf_ar_mthly_bill.inter_trade_flag], [gf_ar_mthly_bill.actg_bill_mth], [gf_ar_mthly_bill.auto_writeoff_group_no]), filter(nil), rowset=16
      access([gf_ar_mthly_bill.tnt_inst_id], [gf_ar_mthly_bill.bill_no], [gf_ar_mthly_bill.ip_role_id], [gf_ar_mthly_bill.bill_st], [gf_ar_mthly_bill.gmt_pay],
       [gf_ar_mthly_bill.clcn_bsc_amt], [gf_ar_mthly_bill.bill_amt], [gf_ar_mthly_bill.rcvd_amt], [gf_ar_mthly_bill.tax_amt], [gf_ar_mthly_bill.exn_inf], [gf_ar_mthly_bill.anl_dmsn1],
       [gf_ar_mthly_bill.anl_dmsn2], [gf_ar_mthly_bill.anl_dmsn3], [gf_ar_mthly_bill.anl_dmsn4], [gf_ar_mthly_bill.last_moder], [gf_ar_mthly_bill.adj_amt], [gf_ar_mthly_bill.svc_amt],
       [gf_ar_mthly_bill.chk_st], [gf_ar_mthly_bill.inv_amt], [gf_ar_mthly_bill.writingoff_amt], [gf_ar_mthly_bill.wrtof_dtl_cnt], [gf_ar_mthly_bill.to_wrtof_dtl_cnt],
       [gf_ar_mthly_bill.chking_amt], [gf_ar_mthly_bill.chked_amt], [gf_ar_mthly_bill.frz_amt], [gf_ar_mthly_bill.svc_bill_amt], [gf_ar_mthly_bill.gmt_modified],
       [gf_ar_mthly_bill.ip_id], [gf_ar_mthly_bill.inst_id], [gf_ar_mthly_bill.pd_code], [gf_ar_mthly_bill.ar_no], [gf_ar_mthly_bill.bill_tp], [gf_ar_mthly_bill.setl_tp],
       [gf_ar_mthly_bill.bill_strt_dt], [gf_ar_mthly_bill.bill_end_dt], [gf_ar_mthly_bill.bill_mth], [gf_ar_mthly_bill.acrd_dt], [gf_ar_mthly_bill.payee_ac], 
      [gf_ar_mthly_bill.payer_ac], [gf_ar_mthly_bill.pay_way], [gf_ar_mthly_bill.pay_orig], [gf_ar_mthly_bill.clcn_bsc_tp], [gf_ar_mthly_bill.clcn_mthd], [gf_ar_mthly_bill.chrg_itm_code],
       [gf_ar_mthly_bill.ccy], [gf_ar_mthly_bill.tax_tp], [gf_ar_mthly_bill.tax_rate], [gf_ar_mthly_bill.rcrd_id], [gf_ar_mthly_bill.gmt_create], [gf_ar_mthly_bill.charge_tp],
       [gf_ar_mthly_bill.stl_ip_role_id], [gf_ar_mthly_bill.inved_amt], [gf_ar_mthly_bill.acnt_day], [gf_ar_mthly_bill.rel_inv_amt], [gf_ar_mthly_bill.tp], [gf_ar_mthly_bill.payer_ip_role_id],
       [gf_ar_mthly_bill.sgn_ip_id], [gf_ar_mthly_bill.sgn_ip_role_id], [gf_ar_mthly_bill.svc_ccy], [gf_ar_mthly_bill.env_source], [gf_ar_mthly_bill.metadata_source],
       [gf_ar_mthly_bill.setl_time_zone], [gf_ar_mthly_bill.actg_time_zone], [gf_ar_mthly_bill.inter_trade_flag], [gf_ar_mthly_bill.actg_bill_mth], [gf_ar_mthly_bill.auto_writeoff_group_no]), partitions(p3)
      is_index_back=false, is_global_index=false, 
      range_key([gf_ar_mthly_bill.tnt_inst_id], [gf_ar_mthly_bill.bill_no]), range[ylctest,2018090310122000040400820033834415 ; ylctest,2018090310122000040400820033834415],
       
      range_cond([gf_ar_mthly_bill.tnt_inst_id = cast('ylctest', VARCHAR(1048576))], [gf_ar_mthly_bill.bill_no = cast('2018090310122000040400820033834415',
       VARCHAR(1048576))])
affected rows: 104
update gf_ar_mthly_bill                     
  set bill_st='01',
  gmt_pay=now(6),
  clcn_bsc_amt='123.12',
  bill_amt=1,
  rcvd_amt=2,
  tax_amt=3,
  exn_inf='123456',
  anl_dmsn1='123456',
  anl_dmsn2='234567',
  anl_dmsn3='345678',
  anl_dmsn4='456789',
  last_moder='ylc',
  adj_amt=4,
  svc_amt = 5,
  chk_st = '06',
  inv_amt = 6,
  writingoff_amt = 7,
  wrtof_dtl_cnt = 9 ,
  to_wrtof_dtl_cnt = 8,
  chking_amt=10,
  chked_amt=11,
  frz_amt=12,
  svc_bill_amt=13,
  gmt_modified=now(6)                     
  where 
  tnt_inst_id='ylctest' 
  and 
  bill_no='2018090310122000040400820033834415';
affected rows: 1
info: Rows matched: 1  Changed: 1  Warnings: 0
EXPLAIN BASIC select * from gf_ar_mthly_bill;
Query Plan
=========================================================================
|ID|OPERATOR                   |NAME                                    |
-------------------------------------------------------------------------
|0 |DISTRIBUTED TABLE FULL SCAN|gf_ar_mthly_bill(uk_tnt_inst_id_rcrd_id)|
=========================================================================
Outputs & filters:
-------------------------------------
  0 - output([gf_ar_mthly_bill.tnt_inst_id], [gf_ar_mthly_bill.bill_no], [gf_ar_mthly_bill.ip_id], [gf_ar_mthly_bill.ip_role_id], [gf_ar_mthly_bill.inst_id],
       [gf_ar_mthly_bill.pd_code], [gf_ar_mthly_bill.ar_no], [gf_ar_mthly_bill.bill_tp], [gf_ar_mthly_bill.setl_tp], [gf_ar_mthly_bill.bill_st], [gf_ar_mthly_bill.bill_strt_dt],
       [gf_ar_mthly_bill.bill_end_dt], [gf_ar_mthly_bill.bill_mth], [gf_ar_mthly_bill.acrd_dt], [gf_ar_mthly_bill.gmt_pay], [gf_ar_mthly_bill.payee_ac], [gf_ar_mthly_bill.payer_ac],
       [gf_ar_mthly_bill.pay_way], [gf_ar_mthly_bill.pay_orig], [gf_ar_mthly_bill.clcn_bsc_amt], [gf_ar_mthly_bill.clcn_bsc_tp], [gf_ar_mthly_bill.clcn_mthd],
       [gf_ar_mthly_bill.chrg_itm_code], [gf_ar_mthly_bill.ccy], [gf_ar_mthly_bill.bill_amt], [gf_ar_mthly_bill.adj_amt], [gf_ar_mthly_bill.rcvd_amt], [gf_ar_mthly_bill.tax_tp],
       [gf_ar_mthly_bill.tax_rate], [gf_ar_mthly_bill.tax_amt], [gf_ar_mthly_bill.exn_inf], [gf_ar_mthly_bill.anl_dmsn1], [gf_ar_mthly_bill.anl_dmsn2], [gf_ar_mthly_bill.anl_dmsn3],
       [gf_ar_mthly_bill.anl_dmsn4], [gf_ar_mthly_bill.wrtof_dtl_cnt], [gf_ar_mthly_bill.to_wrtof_dtl_cnt], [gf_ar_mthly_bill.rcrd_id], [gf_ar_mthly_bill.last_moder],
       [gf_ar_mthly_bill.gmt_create], [gf_ar_mthly_bill.gmt_modified], [gf_ar_mthly_bill.charge_tp], [gf_ar_mthly_bill.stl_ip_role_id], [gf_ar_mthly_bill.svc_amt],
       [gf_ar_mthly_bill.inved_amt], [gf_ar_mthly_bill.chk_st], [gf_ar_mthly_bill.acnt_day], [gf_ar_mthly_bill.inv_amt], [gf_ar_mthly_bill.rel_inv_amt], [gf_ar_mthly_bill.tp],
       [gf_ar_mthly_bill.payer_ip_role_id], [gf_ar_mthly_bill.sgn_ip_id], [gf_ar_mthly_bill.sgn_ip_role_id], [gf_ar_mthly_bill.chking_amt], [gf_ar_mthly_bill.frz_amt],
       [gf_ar_mthly_bill.chked_amt], [gf_ar_mthly_bill.writingoff_amt], [gf_ar_mthly_bill.svc_bill_amt], [gf_ar_mthly_bill.svc_ccy], [gf_ar_mthly_bill.env_source],
       [gf_ar_mthly_bill.metadata_source], [gf_ar_mthly_bill.setl_time_zone], [gf_ar_mthly_bill.actg_time_zone], [gf_ar_mthly_bill.inter_trade_flag], [gf_ar_mthly_bill.actg_bill_mth],
       [gf_ar_mthly_bill.auto_writeoff_group_no], [column_conv(VARCHAR,utf8mb4_bin,length:4,NULL,substr(gf_ar_mthly_bill.bill_no, 23, 2))]), filter(nil), rowset=16
      access([gf_ar_mthly_bill.tnt_inst_id], [gf_ar_mthly_bill.bill_no], [gf_ar_mthly_bill.ip_role_id], [gf_ar_mthly_bill.ip_id], [gf_ar_mthly_bill.inst_id],
       [gf_ar_mthly_bill.pd_code], [gf_ar_mthly_bill.ar_no], [gf_ar_mthly_bill.bill_tp], [gf_ar_mthly_bill.setl_tp], [gf_ar_mthly_bill.bill_st], [gf_ar_mthly_bill.bill_strt_dt],
       [gf_ar_mthly_bill.bill_end_dt], [gf_ar_mthly_bill.bill_mth], [gf_ar_mthly_bill.acrd_dt], [gf_ar_mthly_bill.gmt_pay], [gf_ar_mthly_bill.payee_ac], [gf_ar_mthly_bill.payer_ac],
       [gf_ar_mthly_bill.pay_way], [gf_ar_mthly_bill.pay_orig], [gf_ar_mthly_bill.clcn_bsc_amt], [gf_ar_mthly_bill.clcn_bsc_tp], [gf_ar_mthly_bill.clcn_mthd],
       [gf_ar_mthly_bill.chrg_itm_code], [gf_ar_mthly_bill.ccy], [gf_ar_mthly_bill.bill_amt], [gf_ar_mthly_bill.adj_amt], [gf_ar_mthly_bill.rcvd_amt], [gf_ar_mthly_bill.tax_tp],
       [gf_ar_mthly_bill.tax_rate], [gf_ar_mthly_bill.tax_amt], [gf_ar_mthly_bill.exn_inf], [gf_ar_mthly_bill.anl_dmsn1], [gf_ar_mthly_bill.anl_dmsn2], [gf_ar_mthly_bill.anl_dmsn3],
       [gf_ar_mthly_bill.anl_dmsn4], [gf_ar_mthly_bill.wrtof_dtl_cnt], [gf_ar_mthly_bill.to_wrtof_dtl_cnt], [gf_ar_mthly_bill.rcrd_id], [gf_ar_mthly_bill.last_moder],
       [gf_ar_mthly_bill.gmt_create], [gf_ar_mthly_bill.gmt_modified], [gf_ar_mthly_bill.charge_tp], [gf_ar_mthly_bill.stl_ip_role_id], [gf_ar_mthly_bill.svc_amt],
       [gf_ar_mthly_bill.inved_amt], [gf_ar_mthly_bill.chk_st], [gf_ar_mthly_bill.acnt_day], [gf_ar_mthly_bill.inv_amt], [gf_ar_mthly_bill.rel_inv_amt], [gf_ar_mthly_bill.tp],
       [gf_ar_mthly_bill.payer_ip_role_id], [gf_ar_mthly_bill.sgn_ip_id], [gf_ar_mthly_bill.sgn_ip_role_id], [gf_ar_mthly_bill.chking_amt], [gf_ar_mthly_bill.frz_amt],
       [gf_ar_mthly_bill.chked_amt], [gf_ar_mthly_bill.writingoff_amt], [gf_ar_mthly_bill.svc_bill_amt], [gf_ar_mthly_bill.svc_ccy], [gf_ar_mthly_bill.env_source],
       [gf_ar_mthly_bill.metadata_source], [gf_ar_mthly_bill.setl_time_zone], [gf_ar_mthly_bill.actg_time_zone], [gf_ar_mthly_bill.inter_trade_flag], [gf_ar_mthly_bill.actg_bill_mth],
       [gf_ar_mthly_bill.auto_writeoff_group_no]), partitions(p0)
      is_index_back=true, is_global_index=true, 
      range_key([gf_ar_mthly_bill.tnt_inst_id], [gf_ar_mthly_bill.rcrd_id], [gf_ar_mthly_bill.shadow_pk_0], [gf_ar_mthly_bill.shadow_pk_1]), range(MIN,MIN,
      MIN,MIN ; MAX,MAX,MAX,MAX)always true
affected rows: 36
select * from gf_ar_mthly_bill;
+-------------+------------------------------------+--------+------------------+---------+--------------------------+------------------------------+---------+---------+---------+--------------+-------------+----------+---------+----------------------------+----------------------+----------------------+---------+----------+--------------+-------------+-----------+---------------+-----+----------+---------+----------+--------+------------+---------+---------+-----------+-----------+-----------+-----------+---------------+------------------+----------------------------------+------------+----------------------------+----------------------------+-----------+------------------+---------+-----------+--------+----------------+---------+-------------+------+------------------+-----------+------------------+------------+---------+-----------+----------------+--------------+---------+------------+-----------------+----------------+----------------+------------------+---------------+------------------------+--------------+
| tnt_inst_id | bill_no                            | ip_id  | ip_role_id       | inst_id | pd_code                  | ar_no                        | bill_tp | setl_tp | bill_st | bill_strt_dt | bill_end_dt | bill_mth | acrd_dt | gmt_pay                    | payee_ac             | payer_ac             | pay_way | pay_orig | clcn_bsc_amt | clcn_bsc_tp | clcn_mthd | chrg_itm_code | ccy | bill_amt | adj_amt | rcvd_amt | tax_tp | tax_rate   | tax_amt | exn_inf | anl_dmsn1 | anl_dmsn2 | anl_dmsn3 | anl_dmsn4 | wrtof_dtl_cnt | to_wrtof_dtl_cnt | rcrd_id                          | last_moder | gmt_create                 | gmt_modified               | charge_tp | stl_ip_role_id   | svc_amt | inved_amt | chk_st | acnt_day       | inv_amt | rel_inv_amt | tp   | payer_ip_role_id | sgn_ip_id | sgn_ip_role_id   | chking_amt | frz_amt | chked_amt | writingoff_amt | svc_bill_amt | svc_ccy | env_source | metadata_source | setl_time_zone | actg_time_zone | inter_trade_flag | actg_bill_mth | auto_writeoff_group_no | partition_id |
+-------------+------------------------------------+--------+------------------+---------+--------------------------+------------------------------+---------+---------+---------+--------------+-------------+----------+---------+----------------------------+----------------------+----------------------+---------+----------+--------------+-------------+-----------+---------------+-----+----------+---------+----------+--------+------------+---------+---------+-----------+-----------+-----------+-----------+---------------+------------------+----------------------------------+------------+----------------------------+----------------------------+-----------+------------------+---------+-----------+--------+----------------+---------+-------------+------+------------------+-----------+------------------+------------+---------+-----------+----------------+--------------+---------+------------+-----------------+----------------+----------------+------------------+---------------+------------------------+--------------+
| ylctest     | 2018090310122000040400820033834415 | 308703 | 2088301666708823 | Z84     | INSURANCE_FREIGHT_SELLER | 20170731F0120101149389088708 | 21      | 09      | 01      | 20180901     | 20180930    | 201809   | NULL    | now                        | 20889110933587190156 | 27100000110648200156 | 1       | NULL     |     123.1200 | 01          | 02        | TECHNICAL_FEE | 156 |        1 |       4 |        2 | 01     | 0.06000000 |       3 | 123456  | 123456    | 234567    | 345678    | 456789    |             9 |                8 | 6faa3f33919a618d3052eb17dbc8ddd1 | ylc        | 2018-09-03 04:40:25.793170 | now                        | 03        | 2088301666708823 |       5 |         0 | 06     | 20181002 00:00 |       6 |           0 | 1    | 2088301666708823 | 308703    | 2088221648654619 |         10 |      12 |        11 |              7 |           13 | NULL    | NULL       | NULL            | NULL           | NULL           | NULL             | NULL          | NULL                   | 82           |
+-------------+------------------------------------+--------+------------------+---------+--------------------------+------------------------------+---------+---------+---------+--------------+-------------+----------+---------+----------------------------+----------------------+----------------------+---------+----------+--------------+-------------+-----------+---------------+-----+----------+---------+----------+--------+------------+---------+---------+-----------+-----------+-----------+-----------+---------------+------------------+----------------------------------+------------+----------------------------+----------------------------+-----------+------------------+---------+-----------+--------+----------------+---------+-------------+------+------------------+-----------+------------------+------------+---------+-----------+----------------+--------------+---------+------------+-----------------+----------------+----------------+------------------+---------------+------------------------+--------------+
affected rows: 1
drop table gf_ar_mthly_bill;
affected rows: 0

bug:
drop table if exists t;
affected rows: 0
create table t(c1 int, c2 int,c3 int generated always as (c1+c2) virtual, index idx(c1) global) partition by hash(c3) partitions 3;
affected rows: 0
EXPLAIN BASIC insert into t(c1,c2) values (1,2);
Query Plan
============================
|ID|OPERATOR          |NAME|
----------------------------
|0 |DISTRIBUTED INSERT|    |
|1 |└─EXPRESSION      |    |
============================
Outputs & filters:
-------------------------------------
  0 - output(nil), filter(nil)
      columns([{t: ({t: (t.__pk_increment, t.c1, t.c2, t.c3)}, {idx: (t.c1, t.__pk_increment, t.c3, t.c2)})}]), 
      column_values([T_HIDDEN_PK], [column_conv(INT,PS:(11,0),NULL,__values.c1)], [column_conv(INT,PS:(11,0),NULL,__values.c2)], [column_conv(INT,PS:(11,
      0),NULL,column_conv(INT,PS:(11,0),NULL,cast(column_conv(INT,PS:(11,0),NULL,__values.c1) + column_conv(INT,PS:(11,0),NULL,__values.c2), INT(-1, 0))))])
  1 - output([__values.c1], [__values.c2]), filter(nil)
      values({1, 2})
affected rows: 14
insert into t(c1,c2) values (1,2);
affected rows: 1
EXPLAIN BASIC select /*+ index(t idx) */ * from t;
Query Plan
=================================
|ID|OPERATOR             |NAME  |
---------------------------------
|0 |EXCHANGE IN REMOTE   |      |
|1 |└─EXCHANGE OUT REMOTE|      |
|2 |  └─TABLE FULL SCAN  |t(idx)|
=================================
Outputs & filters:
-------------------------------------
  0 - output([t.c1], [t.c2], [t.c3]), filter(nil)
  1 - output([t.c1], [t.c2], [t.c3]), filter(nil)
  2 - output([t.c1], [t.c2], [t.c3]), filter(nil), rowset=16
      access([t.c1], [t.c2], [t.c3]), partitions(p0)
      is_index_back=false, is_global_index=true, 
      range_key([t.c1], [t.__pk_increment], [t.c3], [t.c2]), range(MIN,MIN,MIN,MIN ; MAX,MAX,MAX,MAX)always true
affected rows: 15
select /*+ index(t idx) */ * from t;
+------+------+------+
| c1   | c2   | c3   |
+------+------+------+
|    1 |    2 |    3 |
+------+------+------+
affected rows: 1
drop table t;
affected rows: 0

drop table if exists t0;
affected rows: 0
create table t0(c0 tinyint(3) zerofill, c1 varchar(500), c2 float unique key primary key comment 'asdf' not null);
affected rows: 0
EXPLAIN BASIC insert into t0 values(1,'a',1);
Query Plan
============================
|ID|OPERATOR          |NAME|
----------------------------
|0 |DISTRIBUTED INSERT|    |
|1 |└─EXPRESSION      |    |
============================
Outputs & filters:
-------------------------------------
  0 - output(nil), filter(nil)
      columns([{t0: ({t0: (t0.c2, t0.c0, t0.c1)})}]), 
      column_values([column_conv(FLOAT,PS:(-1,-1),NOT NULL,__values.c2)], [column_conv(TINYINT UNSIGNED,PS:(3,0),NULL,__values.c0)], [column_conv(VARCHAR,
      utf8mb4_general_ci,length:500,NULL,__values.c1)])
  1 - output([__values.c0], [__values.c1], [__values.c2]), filter(nil)
      values({1, 'a', 1})
affected rows: 14
insert into t0 values(1,'a',1);
affected rows: 1
create index i480 using btree on t0(c1(4), c2, c0) global partition by key(c0) partitions 1;
affected rows: 0
drop table t0;
affected rows: 0

drop database if exists global_index;
affected rows: 4
set ob_query_timeout=10000000;
affected rows: 0

