explain_protocol: 1
drop table if exists aa;
drop table if exists bb;
drop table if exists cc;
create table aa(a1 int primary key, a2 int, a3 int) partition by hash(a1) partitions 2;
create index i1 on aa(a2, a3) global;
create table bb(b1 int primary key, b2 int, b3 int) partition by hash(b1) partitions 2;
create index i2 on bb(b2, b3) global;
create table cc(c1 int primary key, c2 int, c3 int) partition by hash(c1) partitions 2;
create index i3 on cc(c2, c3) global;
EXPLAIN BASIC delete from aa;
Query Plan
==============================
|ID|OPERATOR          |NAME  |
------------------------------
|0 |DISTRIBUTED DELETE|      |
|1 |└─TABLE FULL SCAN |aa(i1)|
==============================
Outputs & filters:
-------------------------------------
  0 - output(nil), filter(nil)
      table_columns([{aa: ({aa: (aa.a1, aa.a2, aa.a3)}, {i1: (aa.a2, aa.a3, aa.a1)})}])
  1 - output([aa.a1], [aa.a2], [aa.a3]), filter(nil), rowset=16
      access([aa.a1], [aa.a2], [aa.a3]), partitions(p0)
      is_index_back=false, is_global_index=true, 
      range_key([aa.a2], [aa.a3], [aa.a1]), range(MIN,MIN,MIN ; MAX,MAX,MAX)always true
delete from aa;
EXPLAIN BASIC insert into aa(a1, a2, a3) values (1, 10, 15), (2, 10, 14), (3, 10, 12), (4, 11, 13), (5, 12, 12), (6, 12, 10);
Query Plan
============================
|ID|OPERATOR          |NAME|
----------------------------
|0 |DISTRIBUTED INSERT|    |
|1 |└─EXPRESSION      |    |
============================
Outputs & filters:
-------------------------------------
  0 - output(nil), filter(nil)
      columns([{aa: ({aa: (aa.a1, aa.a2, aa.a3)}, {i1: (aa.a2, aa.a3, aa.a1)})}]), 
      column_values([column_conv(INT,PS:(11,0),NOT NULL,__values.a1)], [column_conv(INT,PS:(11,0),NULL,__values.a2)], [column_conv(INT,PS:(11,0),NULL,__values.a3)])
  1 - output([__values.a1], [__values.a2], [__values.a3]), filter(nil)
      values({1, 10, 15}, {2, 10, 14}, {3, 10, 12}, {4, 11, 13}, {5, 12, 12}, {6, 12, 10})
insert into aa(a1, a2, a3) values (1, 10, 15), (2, 10, 14), (3, 10, 12), (4, 11, 13), (5, 12, 12), (6, 12, 10);
EXPLAIN BASIC delete from bb;
Query Plan
==============================
|ID|OPERATOR          |NAME  |
------------------------------
|0 |DISTRIBUTED DELETE|      |
|1 |└─TABLE FULL SCAN |bb(i2)|
==============================
Outputs & filters:
-------------------------------------
  0 - output(nil), filter(nil)
      table_columns([{bb: ({bb: (bb.b1, bb.b2, bb.b3)}, {i2: (bb.b2, bb.b3, bb.b1)})}])
  1 - output([bb.b1], [bb.b2], [bb.b3]), filter(nil), rowset=16
      access([bb.b1], [bb.b2], [bb.b3]), partitions(p0)
      is_index_back=false, is_global_index=true, 
      range_key([bb.b2], [bb.b3], [bb.b1]), range(MIN,MIN,MIN ; MAX,MAX,MAX)always true
delete from bb;
EXPLAIN BASIC insert into bb(b1, b2, b3) values (1, 10, 14), (2, 11, 14), (3, 11, 13), (4, 12, 11), (5, 12, 10);
Query Plan
============================
|ID|OPERATOR          |NAME|
----------------------------
|0 |DISTRIBUTED INSERT|    |
|1 |└─EXPRESSION      |    |
============================
Outputs & filters:
-------------------------------------
  0 - output(nil), filter(nil)
      columns([{bb: ({bb: (bb.b1, bb.b2, bb.b3)}, {i2: (bb.b2, bb.b3, bb.b1)})}]), 
      column_values([column_conv(INT,PS:(11,0),NOT NULL,__values.b1)], [column_conv(INT,PS:(11,0),NULL,__values.b2)], [column_conv(INT,PS:(11,0),NULL,__values.b3)])
  1 - output([__values.b1], [__values.b2], [__values.b3]), filter(nil)
      values({1, 10, 14}, {2, 11, 14}, {3, 11, 13}, {4, 12, 11}, {5, 12, 10})
insert into bb(b1, b2, b3) values (1, 10, 14), (2, 11, 14), (3, 11, 13), (4, 12, 11), (5, 12, 10);
EXPLAIN BASIC select /*+ use_merge(aa, bb) */ a2, b3 from aa, bb where a2 = b2 and a3 = b3 and a2>0 and a3>0 order by a2, a3;
Query Plan
==============================
|ID|OPERATOR          |NAME  |
------------------------------
|0 |MERGE JOIN        |      |
|1 |├─TABLE RANGE SCAN|bb(i2)|
|2 |└─TABLE RANGE SCAN|aa(i1)|
==============================
Outputs & filters:
-------------------------------------
  0 - output([aa.a2], [bb.b3]), filter(nil), rowset=16
      equal_conds([aa.a2 = bb.b2], [aa.a3 = bb.b3]), other_conds(nil)
      merge_directions([ASC], [ASC])
  1 - output([bb.b2], [bb.b3]), filter([bb.b3 > 0]), rowset=16
      access([bb.b2], [bb.b3]), partitions(p0)
      is_index_back=false, is_global_index=true, filter_before_indexback[false], 
      range_key([bb.b2], [bb.b3], [bb.b1]), range(0,MAX,MAX ; MAX,MAX,MAX), 
      range_cond([bb.b2 > 0])
  2 - output([aa.a2], [aa.a3]), filter([aa.a3 > 0]), rowset=16
      access([aa.a2], [aa.a3]), partitions(p0)
      is_index_back=false, is_global_index=true, filter_before_indexback[false], 
      range_key([aa.a2], [aa.a3], [aa.a1]), range(0,MAX,MAX ; MAX,MAX,MAX), 
      range_cond([aa.a2 > 0])
select /*+ use_merge(aa, bb) */ a2, b3 from aa, bb where a2 = b2 and a3 = b3 and a2>0 and a3>0 order by a2, a3;
a2	b3
10	14
11	13
12	10
EXPLAIN BASIC select /*+ use_merge(aa, bb) */ a2, b3 from aa, bb where a2 = b2 and a3 = b3 and a2>0 and a3>0 order by a2, a3 desc;
Query Plan
================================
|ID|OPERATOR            |NAME  |
--------------------------------
|0 |SORT                |      |
|1 |└─MERGE JOIN        |      |
|2 |  ├─TABLE RANGE SCAN|bb(i2)|
|3 |  └─TABLE RANGE SCAN|aa(i1)|
================================
Outputs & filters:
-------------------------------------
  0 - output([aa.a2], [bb.b3]), filter(nil), rowset=16
      sort_keys([aa.a2, ASC], [aa.a3, DESC]), prefix_pos(1)
  1 - output([aa.a2], [aa.a3], [bb.b3]), filter(nil), rowset=16
      equal_conds([aa.a2 = bb.b2], [aa.a3 = bb.b3]), other_conds(nil)
      merge_directions([ASC], [ASC])
  2 - output([bb.b2], [bb.b3]), filter([bb.b3 > 0]), rowset=16
      access([bb.b2], [bb.b3]), partitions(p0)
      is_index_back=false, is_global_index=true, filter_before_indexback[false], 
      range_key([bb.b2], [bb.b3], [bb.b1]), range(0,MAX,MAX ; MAX,MAX,MAX), 
      range_cond([bb.b2 > 0])
  3 - output([aa.a2], [aa.a3]), filter([aa.a3 > 0]), rowset=16
      access([aa.a2], [aa.a3]), partitions(p0)
      is_index_back=false, is_global_index=true, filter_before_indexback[false], 
      range_key([aa.a2], [aa.a3], [aa.a1]), range(0,MAX,MAX ; MAX,MAX,MAX), 
      range_cond([aa.a2 > 0])
select /*+ use_merge(aa, bb) */ a2, b3 from aa, bb where a2 = b2 and a3 = b3 and a2>0 and a3>0 order by a2, a3 desc;
a2	b3
10	14
11	13
12	10
EXPLAIN BASIC select /*+ use_merge(aa, bb) */ a2, b3 from aa, bb where a2 = b2 and a3 = b3 and a2>0 and a3>0 order by a2 desc, a3;
Query Plan
========================================
|ID|OPERATOR            |NAME          |
----------------------------------------
|0 |SORT                |              |
|1 |└─MERGE JOIN        |              |
|2 |  ├─TABLE RANGE SCAN|bb(i2,Reverse)|
|3 |  └─TABLE RANGE SCAN|aa(i1,Reverse)|
========================================
Outputs & filters:
-------------------------------------
  0 - output([aa.a2], [bb.b3]), filter(nil), rowset=16
      sort_keys([aa.a2, DESC], [aa.a3, ASC]), prefix_pos(1)
  1 - output([aa.a2], [aa.a3], [bb.b3]), filter(nil), rowset=16
      equal_conds([aa.a2 = bb.b2], [aa.a3 = bb.b3]), other_conds(nil)
      merge_directions([DESC], [DESC])
  2 - output([bb.b2], [bb.b3]), filter([bb.b3 > 0]), rowset=16
      access([bb.b2], [bb.b3]), partitions(p0)
      is_index_back=false, is_global_index=true, filter_before_indexback[false], 
      range_key([bb.b2], [bb.b3], [bb.b1]), range(0,MAX,MAX ; MAX,MAX,MAX), 
      range_cond([bb.b2 > 0])
  3 - output([aa.a2], [aa.a3]), filter([aa.a3 > 0]), rowset=16
      access([aa.a2], [aa.a3]), partitions(p0)
      is_index_back=false, is_global_index=true, filter_before_indexback[false], 
      range_key([aa.a2], [aa.a3], [aa.a1]), range(0,MAX,MAX ; MAX,MAX,MAX), 
      range_cond([aa.a2 > 0])
select /*+ use_merge(aa, bb) */ a2, b3 from aa, bb where a2 = b2 and a3 = b3 and a2>0 and a3>0 order by a2 desc, a3;
a2	b3
12	10
11	13
10	14
EXPLAIN BASIC select /*+ use_merge(aa, bb) */ a2, b3 from aa, bb where a2 = b2 and a3 = b3 and a2>0 and a3>0 order by a2 desc, a3 desc;
Query Plan
======================================
|ID|OPERATOR          |NAME          |
--------------------------------------
|0 |MERGE JOIN        |              |
|1 |├─TABLE RANGE SCAN|bb(i2,Reverse)|
|2 |└─TABLE RANGE SCAN|aa(i1,Reverse)|
======================================
Outputs & filters:
-------------------------------------
  0 - output([aa.a2], [bb.b3]), filter(nil), rowset=16
      equal_conds([aa.a2 = bb.b2], [aa.a3 = bb.b3]), other_conds(nil)
      merge_directions([DESC], [DESC])
  1 - output([bb.b2], [bb.b3]), filter([bb.b3 > 0]), rowset=16
      access([bb.b2], [bb.b3]), partitions(p0)
      is_index_back=false, is_global_index=true, filter_before_indexback[false], 
      range_key([bb.b2], [bb.b3], [bb.b1]), range(0,MAX,MAX ; MAX,MAX,MAX), 
      range_cond([bb.b2 > 0])
  2 - output([aa.a2], [aa.a3]), filter([aa.a3 > 0]), rowset=16
      access([aa.a2], [aa.a3]), partitions(p0)
      is_index_back=false, is_global_index=true, filter_before_indexback[false], 
      range_key([aa.a2], [aa.a3], [aa.a1]), range(0,MAX,MAX ; MAX,MAX,MAX), 
      range_cond([aa.a2 > 0])
select /*+ use_merge(aa, bb) */ a2, b3 from aa, bb where a2 = b2 and a3 = b3 and a2>0 and a3>0 order by a2 desc, a3 desc;
a2	b3
12	10
11	13
10	14
EXPLAIN BASIC delete from aa;
Query Plan
==============================
|ID|OPERATOR          |NAME  |
------------------------------
|0 |DISTRIBUTED DELETE|      |
|1 |└─TABLE FULL SCAN |aa(i1)|
==============================
Outputs & filters:
-------------------------------------
  0 - output(nil), filter(nil)
      table_columns([{aa: ({aa: (aa.a1, aa.a2, aa.a3)}, {i1: (aa.a2, aa.a3, aa.a1)})}])
  1 - output([aa.a1], [aa.a2], [aa.a3]), filter(nil), rowset=16
      access([aa.a1], [aa.a2], [aa.a3]), partitions(p0)
      is_index_back=false, is_global_index=true, 
      range_key([aa.a2], [aa.a3], [aa.a1]), range(MIN,MIN,MIN ; MAX,MAX,MAX)always true
delete from aa;
EXPLAIN BASIC insert into aa(a1, a2, a3) values (1, 10, 15), (2, 10, 14), (3, 10, 12), (4, 11, 13), (5, 12, 12),(6, 12, 10);
Query Plan
============================
|ID|OPERATOR          |NAME|
----------------------------
|0 |DISTRIBUTED INSERT|    |
|1 |└─EXPRESSION      |    |
============================
Outputs & filters:
-------------------------------------
  0 - output(nil), filter(nil)
      columns([{aa: ({aa: (aa.a1, aa.a2, aa.a3)}, {i1: (aa.a2, aa.a3, aa.a1)})}]), 
      column_values([column_conv(INT,PS:(11,0),NOT NULL,__values.a1)], [column_conv(INT,PS:(11,0),NULL,__values.a2)], [column_conv(INT,PS:(11,0),NULL,__values.a3)])
  1 - output([__values.a1], [__values.a2], [__values.a3]), filter(nil)
      values({1, 10, 15}, {2, 10, 14}, {3, 10, 12}, {4, 11, 13}, {5, 12, 12}, {6, 12, 10})
insert into aa(a1, a2, a3) values (1, 10, 15), (2, 10, 14), (3, 10, 12), (4, 11, 13), (5, 12, 12),(6, 12, 10);
EXPLAIN BASIC delete from bb;
Query Plan
==============================
|ID|OPERATOR          |NAME  |
------------------------------
|0 |DISTRIBUTED DELETE|      |
|1 |└─TABLE FULL SCAN |bb(i2)|
==============================
Outputs & filters:
-------------------------------------
  0 - output(nil), filter(nil)
      table_columns([{bb: ({bb: (bb.b1, bb.b2, bb.b3)}, {i2: (bb.b2, bb.b3, bb.b1)})}])
  1 - output([bb.b1], [bb.b2], [bb.b3]), filter(nil), rowset=16
      access([bb.b1], [bb.b2], [bb.b3]), partitions(p0)
      is_index_back=false, is_global_index=true, 
      range_key([bb.b2], [bb.b3], [bb.b1]), range(MIN,MIN,MIN ; MAX,MAX,MAX)always true
delete from bb;
EXPLAIN BASIC insert into bb(b1, b2, b3) values (1, 10, 14), (2, 11, 14), (3, 11, 13), (4, 12, 11), (5, 12, 10);
Query Plan
============================
|ID|OPERATOR          |NAME|
----------------------------
|0 |DISTRIBUTED INSERT|    |
|1 |└─EXPRESSION      |    |
============================
Outputs & filters:
-------------------------------------
  0 - output(nil), filter(nil)
      columns([{bb: ({bb: (bb.b1, bb.b2, bb.b3)}, {i2: (bb.b2, bb.b3, bb.b1)})}]), 
      column_values([column_conv(INT,PS:(11,0),NOT NULL,__values.b1)], [column_conv(INT,PS:(11,0),NULL,__values.b2)], [column_conv(INT,PS:(11,0),NULL,__values.b3)])
  1 - output([__values.b1], [__values.b2], [__values.b3]), filter(nil)
      values({1, 10, 14}, {2, 11, 14}, {3, 11, 13}, {4, 12, 11}, {5, 12, 10})
insert into bb(b1, b2, b3) values (1, 10, 14), (2, 11, 14), (3, 11, 13), (4, 12, 11), (5, 12, 10);
EXPLAIN BASIC select /*+ use_merge(aa, bb) */ a2, b3 from aa, bb where a2 = b2 and a3 = b3 and a2>0 and a3>0 order by a2, a3;
Query Plan
==============================
|ID|OPERATOR          |NAME  |
------------------------------
|0 |MERGE JOIN        |      |
|1 |├─TABLE RANGE SCAN|bb(i2)|
|2 |└─TABLE RANGE SCAN|aa(i1)|
==============================
Outputs & filters:
-------------------------------------
  0 - output([aa.a2], [bb.b3]), filter(nil), rowset=16
      equal_conds([aa.a2 = bb.b2], [aa.a3 = bb.b3]), other_conds(nil)
      merge_directions([ASC], [ASC])
  1 - output([bb.b2], [bb.b3]), filter([bb.b3 > 0]), rowset=16
      access([bb.b2], [bb.b3]), partitions(p0)
      is_index_back=false, is_global_index=true, filter_before_indexback[false], 
      range_key([bb.b2], [bb.b3], [bb.b1]), range(0,MAX,MAX ; MAX,MAX,MAX), 
      range_cond([bb.b2 > 0])
  2 - output([aa.a2], [aa.a3]), filter([aa.a3 > 0]), rowset=16
      access([aa.a2], [aa.a3]), partitions(p0)
      is_index_back=false, is_global_index=true, filter_before_indexback[false], 
      range_key([aa.a2], [aa.a3], [aa.a1]), range(0,MAX,MAX ; MAX,MAX,MAX), 
      range_cond([aa.a2 > 0])
select /*+ use_merge(aa, bb) */ a2, b3 from aa, bb where a2 = b2 and a3 = b3 and a2>0 and a3>0 order by a2, a3;
a2	b3
10	14
11	13
12	10
EXPLAIN BASIC select /*+ use_merge(aa, bb) */ a2, b3 from aa, bb where a2 = b2 and a3 = b3 and a2>0 and a3>0 order by a2, a3 desc;
Query Plan
================================
|ID|OPERATOR            |NAME  |
--------------------------------
|0 |SORT                |      |
|1 |└─MERGE JOIN        |      |
|2 |  ├─TABLE RANGE SCAN|bb(i2)|
|3 |  └─TABLE RANGE SCAN|aa(i1)|
================================
Outputs & filters:
-------------------------------------
  0 - output([aa.a2], [bb.b3]), filter(nil), rowset=16
      sort_keys([aa.a2, ASC], [aa.a3, DESC]), prefix_pos(1)
  1 - output([aa.a2], [aa.a3], [bb.b3]), filter(nil), rowset=16
      equal_conds([aa.a2 = bb.b2], [aa.a3 = bb.b3]), other_conds(nil)
      merge_directions([ASC], [ASC])
  2 - output([bb.b2], [bb.b3]), filter([bb.b3 > 0]), rowset=16
      access([bb.b2], [bb.b3]), partitions(p0)
      is_index_back=false, is_global_index=true, filter_before_indexback[false], 
      range_key([bb.b2], [bb.b3], [bb.b1]), range(0,MAX,MAX ; MAX,MAX,MAX), 
      range_cond([bb.b2 > 0])
  3 - output([aa.a2], [aa.a3]), filter([aa.a3 > 0]), rowset=16
      access([aa.a2], [aa.a3]), partitions(p0)
      is_index_back=false, is_global_index=true, filter_before_indexback[false], 
      range_key([aa.a2], [aa.a3], [aa.a1]), range(0,MAX,MAX ; MAX,MAX,MAX), 
      range_cond([aa.a2 > 0])
select /*+ use_merge(aa, bb) */ a2, b3 from aa, bb where a2 = b2 and a3 = b3 and a2>0 and a3>0 order by a2, a3 desc;
a2	b3
10	14
11	13
12	10
EXPLAIN BASIC select /*+ use_merge(aa, bb) */ a2, b3 from aa, bb where a2 = b2 and a3 = b3 and a2>0 and a3>0 order by a2 desc, a3;
Query Plan
========================================
|ID|OPERATOR            |NAME          |
----------------------------------------
|0 |SORT                |              |
|1 |└─MERGE JOIN        |              |
|2 |  ├─TABLE RANGE SCAN|bb(i2,Reverse)|
|3 |  └─TABLE RANGE SCAN|aa(i1,Reverse)|
========================================
Outputs & filters:
-------------------------------------
  0 - output([aa.a2], [bb.b3]), filter(nil), rowset=16
      sort_keys([aa.a2, DESC], [aa.a3, ASC]), prefix_pos(1)
  1 - output([aa.a2], [aa.a3], [bb.b3]), filter(nil), rowset=16
      equal_conds([aa.a2 = bb.b2], [aa.a3 = bb.b3]), other_conds(nil)
      merge_directions([DESC], [DESC])
  2 - output([bb.b2], [bb.b3]), filter([bb.b3 > 0]), rowset=16
      access([bb.b2], [bb.b3]), partitions(p0)
      is_index_back=false, is_global_index=true, filter_before_indexback[false], 
      range_key([bb.b2], [bb.b3], [bb.b1]), range(0,MAX,MAX ; MAX,MAX,MAX), 
      range_cond([bb.b2 > 0])
  3 - output([aa.a2], [aa.a3]), filter([aa.a3 > 0]), rowset=16
      access([aa.a2], [aa.a3]), partitions(p0)
      is_index_back=false, is_global_index=true, filter_before_indexback[false], 
      range_key([aa.a2], [aa.a3], [aa.a1]), range(0,MAX,MAX ; MAX,MAX,MAX), 
      range_cond([aa.a2 > 0])
select /*+ use_merge(aa, bb) */ a2, b3 from aa, bb where a2 = b2 and a3 = b3 and a2>0 and a3>0 order by a2 desc, a3;
a2	b3
12	10
11	13
10	14
EXPLAIN BASIC select /*+ use_merge(aa, bb) */ a2, b3 from aa, bb where a2 = b2 and a3 = b3 and a2>0 and a3>0 order by a2 desc, a3 desc;
Query Plan
======================================
|ID|OPERATOR          |NAME          |
--------------------------------------
|0 |MERGE JOIN        |              |
|1 |├─TABLE RANGE SCAN|bb(i2,Reverse)|
|2 |└─TABLE RANGE SCAN|aa(i1,Reverse)|
======================================
Outputs & filters:
-------------------------------------
  0 - output([aa.a2], [bb.b3]), filter(nil), rowset=16
      equal_conds([aa.a2 = bb.b2], [aa.a3 = bb.b3]), other_conds(nil)
      merge_directions([DESC], [DESC])
  1 - output([bb.b2], [bb.b3]), filter([bb.b3 > 0]), rowset=16
      access([bb.b2], [bb.b3]), partitions(p0)
      is_index_back=false, is_global_index=true, filter_before_indexback[false], 
      range_key([bb.b2], [bb.b3], [bb.b1]), range(0,MAX,MAX ; MAX,MAX,MAX), 
      range_cond([bb.b2 > 0])
  2 - output([aa.a2], [aa.a3]), filter([aa.a3 > 0]), rowset=16
      access([aa.a2], [aa.a3]), partitions(p0)
      is_index_back=false, is_global_index=true, filter_before_indexback[false], 
      range_key([aa.a2], [aa.a3], [aa.a1]), range(0,MAX,MAX ; MAX,MAX,MAX), 
      range_cond([aa.a2 > 0])
select /*+ use_merge(aa, bb) */ a2, b3 from aa, bb where a2 = b2 and a3 = b3 and a2>0 and a3>0 order by a2 desc, a3 desc;
a2	b3
12	10
11	13
10	14
EXPLAIN BASIC delete from cc;
Query Plan
==============================
|ID|OPERATOR          |NAME  |
------------------------------
|0 |DISTRIBUTED DELETE|      |
|1 |└─TABLE FULL SCAN |cc(i3)|
==============================
Outputs & filters:
-------------------------------------
  0 - output(nil), filter(nil)
      table_columns([{cc: ({cc: (cc.c1, cc.c2, cc.c3)}, {i3: (cc.c2, cc.c3, cc.c1)})}])
  1 - output([cc.c1], [cc.c2], [cc.c3]), filter(nil), rowset=16
      access([cc.c1], [cc.c2], [cc.c3]), partitions(p0)
      is_index_back=false, is_global_index=true, 
      range_key([cc.c2], [cc.c3], [cc.c1]), range(MIN,MIN,MIN ; MAX,MAX,MAX)always true
delete from cc;
EXPLAIN BASIC insert into cc(c1, c2, c3) values (1, 10, 15), (2, 10, 14), (3, 10, 12), (4, 12, 10);
Query Plan
============================
|ID|OPERATOR          |NAME|
----------------------------
|0 |DISTRIBUTED INSERT|    |
|1 |└─EXPRESSION      |    |
============================
Outputs & filters:
-------------------------------------
  0 - output(nil), filter(nil)
      columns([{cc: ({cc: (cc.c1, cc.c2, cc.c3)}, {i3: (cc.c2, cc.c3, cc.c1)})}]), 
      column_values([column_conv(INT,PS:(11,0),NOT NULL,__values.c1)], [column_conv(INT,PS:(11,0),NULL,__values.c2)], [column_conv(INT,PS:(11,0),NULL,__values.c3)])
  1 - output([__values.c1], [__values.c2], [__values.c3]), filter(nil)
      values({1, 10, 15}, {2, 10, 14}, {3, 10, 12}, {4, 12, 10})
insert into cc(c1, c2, c3) values (1, 10, 15), (2, 10, 14), (3, 10, 12), (4, 12, 10);
EXPLAIN BASIC select /*+ leading(aa bb cc) use_merge(aa, bb, cc) */ c2, a3 from aa, bb, cc where a2 = b2 and a3 = b3 and b2 = c2 and b3 = c3 and a2>0 and a3>0 order by c2, c3 desc;
Query Plan
==================================
|ID|OPERATOR              |NAME  |
----------------------------------
|0 |SORT                  |      |
|1 |└─MERGE JOIN          |      |
|2 |  ├─MERGE JOIN        |      |
|3 |  │ ├─TABLE RANGE SCAN|aa(i1)|
|4 |  │ └─TABLE RANGE SCAN|bb(i2)|
|5 |  └─TABLE RANGE SCAN  |cc(i3)|
==================================
Outputs & filters:
-------------------------------------
  0 - output([cc.c2], [aa.a3]), filter(nil), rowset=16
      sort_keys([cc.c2, ASC], [cc.c3, DESC]), prefix_pos(1)
  1 - output([cc.c2], [cc.c3], [aa.a3]), filter(nil), rowset=16
      equal_conds([aa.a2 = cc.c2], [bb.b3 = cc.c3]), other_conds(nil)
      merge_directions([ASC], [ASC])
  2 - output([aa.a3], [aa.a2], [bb.b3]), filter(nil), rowset=16
      equal_conds([aa.a2 = bb.b2], [aa.a3 = bb.b3]), other_conds(nil)
      merge_directions([ASC], [ASC])
  3 - output([aa.a2], [aa.a3]), filter([aa.a3 > 0]), rowset=16
      access([aa.a2], [aa.a3]), partitions(p0)
      is_index_back=false, is_global_index=true, filter_before_indexback[false], 
      range_key([aa.a2], [aa.a3], [aa.a1]), range(0,MAX,MAX ; MAX,MAX,MAX), 
      range_cond([aa.a2 > 0])
  4 - output([bb.b2], [bb.b3]), filter([bb.b3 > 0]), rowset=16
      access([bb.b2], [bb.b3]), partitions(p0)
      is_index_back=false, is_global_index=true, filter_before_indexback[false], 
      range_key([bb.b2], [bb.b3], [bb.b1]), range(0,MAX,MAX ; MAX,MAX,MAX), 
      range_cond([bb.b2 > 0])
  5 - output([cc.c2], [cc.c3]), filter([cc.c3 > 0]), rowset=16
      access([cc.c2], [cc.c3]), partitions(p0)
      is_index_back=false, is_global_index=true, filter_before_indexback[false], 
      range_key([cc.c2], [cc.c3], [cc.c1]), range(0,MAX,MAX ; MAX,MAX,MAX), 
      range_cond([cc.c2 > 0])
select /*+ leading(aa bb cc) use_merge(aa, bb, cc) */ c2, a3 from aa, bb, cc where a2 = b2 and a3 = b3 and b2 = c2 and b3 = c3 and a2>0 and a3>0 order by c2, c3 desc;
c2	a3
10	14
12	10
EXPLAIN BASIC select /*+ leading(aa bb cc) use_merge(aa, bb, cc) */ c2, a3 from aa, bb, cc where a2 = b2 and a3 = b3 and a2 = c2 and b3 = c3 and a2>0 and a3>0 order by c2, c3 desc;
Query Plan
==================================
|ID|OPERATOR              |NAME  |
----------------------------------
|0 |SORT                  |      |
|1 |└─MERGE JOIN          |      |
|2 |  ├─MERGE JOIN        |      |
|3 |  │ ├─TABLE RANGE SCAN|aa(i1)|
|4 |  │ └─TABLE RANGE SCAN|bb(i2)|
|5 |  └─TABLE RANGE SCAN  |cc(i3)|
==================================
Outputs & filters:
-------------------------------------
  0 - output([cc.c2], [aa.a3]), filter(nil), rowset=16
      sort_keys([cc.c2, ASC], [cc.c3, DESC]), prefix_pos(1)
  1 - output([cc.c2], [cc.c3], [aa.a3]), filter(nil), rowset=16
      equal_conds([aa.a2 = cc.c2], [bb.b3 = cc.c3]), other_conds(nil)
      merge_directions([ASC], [ASC])
  2 - output([aa.a3], [aa.a2], [bb.b3]), filter(nil), rowset=16
      equal_conds([aa.a2 = bb.b2], [aa.a3 = bb.b3]), other_conds(nil)
      merge_directions([ASC], [ASC])
  3 - output([aa.a2], [aa.a3]), filter([aa.a3 > 0]), rowset=16
      access([aa.a2], [aa.a3]), partitions(p0)
      is_index_back=false, is_global_index=true, filter_before_indexback[false], 
      range_key([aa.a2], [aa.a3], [aa.a1]), range(0,MAX,MAX ; MAX,MAX,MAX), 
      range_cond([aa.a2 > 0])
  4 - output([bb.b2], [bb.b3]), filter([bb.b3 > 0]), rowset=16
      access([bb.b2], [bb.b3]), partitions(p0)
      is_index_back=false, is_global_index=true, filter_before_indexback[false], 
      range_key([bb.b2], [bb.b3], [bb.b1]), range(0,MAX,MAX ; MAX,MAX,MAX), 
      range_cond([bb.b2 > 0])
  5 - output([cc.c2], [cc.c3]), filter([cc.c3 > 0]), rowset=16
      access([cc.c2], [cc.c3]), partitions(p0)
      is_index_back=false, is_global_index=true, filter_before_indexback[false], 
      range_key([cc.c2], [cc.c3], [cc.c1]), range(0,MAX,MAX ; MAX,MAX,MAX), 
      range_cond([cc.c2 > 0])
select /*+ leading(aa bb cc) use_merge(aa, bb, cc) */ c2, a3 from aa, bb, cc where a2 = b2 and a3 = b3 and a2 = c2 and b3 = c3 and a2>0 and a3>0 order by c2, c3 desc;
c2	a3
10	14
12	10
drop table if exists tt1,tt2;
CREATE TABLE `tt1` (
`a` int(11) NOT NULL,
`b` int(11) DEFAULT NULL,
`c` varchar(20) DEFAULT NULL,
`d` datetime NOT NULL,
PRIMARY KEY (`a`)
) partition by hash(a) partitions 2;
create index i1 on tt1(d) global;
create index i2 on tt1(c) global;
CREATE TABLE `tt2` (
`a` int(11) NOT NULL,
`b` int(11) DEFAULT NULL,
`c` varchar(20) DEFAULT NULL,
`d` datetime NOT NULL,
PRIMARY KEY (`a`)
) partition by hash(a) partitions 2;
create index i1 on tt2(d) global;
create index i2 on tt2(c) global;
EXPLAIN BASIC select /*+ use_merge(tt1, tt2) */ * from tt1,tt2 where tt1.a=tt2.a order by tt1.d desc;
Query Plan
=========================================
|ID|OPERATOR                   |NAME    |
-----------------------------------------
|0 |PX COORDINATOR MERGE SORT  |        |
|1 |└─EXCHANGE OUT DISTR       |:EX10000|
|2 |  └─SORT                   |        |
|3 |    └─PX PARTITION ITERATOR|        |
|4 |      └─MERGE JOIN         |        |
|5 |        ├─TABLE FULL SCAN  |tt1     |
|6 |        └─TABLE FULL SCAN  |tt2     |
=========================================
Outputs & filters:
-------------------------------------
  0 - output([INTERNAL_FUNCTION(tt1.a, tt1.b, tt1.c, tt1.d, tt2.a, tt2.b, tt2.c, tt2.d)]), filter(nil), rowset=16
      sort_keys([tt1.d, DESC])
  1 - output([tt1.d], [INTERNAL_FUNCTION(tt1.a, tt1.b, tt1.c, tt1.d, tt2.a, tt2.b, tt2.c, tt2.d)]), filter(nil), rowset=16
      dop=1
  2 - output([tt1.d], [tt1.a], [tt2.a], [tt1.b], [tt1.c], [tt2.b], [tt2.c], [tt2.d]), filter(nil), rowset=16
      sort_keys([tt1.d, DESC])
  3 - output([tt1.d], [tt1.a], [tt2.a], [tt1.b], [tt1.c], [tt2.b], [tt2.c], [tt2.d]), filter(nil), rowset=16
      partition wise, force partition granule
  4 - output([tt1.d], [tt1.a], [tt2.a], [tt1.b], [tt1.c], [tt2.b], [tt2.c], [tt2.d]), filter(nil), rowset=16
      equal_conds([tt1.a = tt2.a]), other_conds(nil)
      merge_directions([ASC])
  5 - output([tt1.a], [tt1.b], [tt1.c], [tt1.d]), filter(nil), rowset=16
      access([tt1.a], [tt1.b], [tt1.c], [tt1.d]), partitions(p[0-1])
      is_index_back=false, is_global_index=false, 
      range_key([tt1.a]), range(MIN ; MAX)always true
  6 - output([tt2.a], [tt2.b], [tt2.c], [tt2.d]), filter(nil), rowset=16
      access([tt2.a], [tt2.b], [tt2.c], [tt2.d]), partitions(p[0-1])
      is_index_back=false, is_global_index=false, 
      range_key([tt2.a]), range(MIN ; MAX)always true
select /*+ use_merge(tt1, tt2) */ * from tt1,tt2 where tt1.a=tt2.a order by tt1.d desc;
a	b	c	d	a	b	c	d
EXPLAIN BASIC select /*+ use_merge(tt1, tt2) */ * from tt1,tt2 where tt1.a=tt2.a order by tt1.a desc;
Query Plan
=============================================
|ID|OPERATOR                   |NAME        |
---------------------------------------------
|0 |PX COORDINATOR MERGE SORT  |            |
|1 |└─EXCHANGE OUT DISTR       |:EX10000    |
|2 |  └─SORT                   |            |
|3 |    └─PX PARTITION ITERATOR|            |
|4 |      └─MERGE JOIN         |            |
|5 |        ├─TABLE FULL SCAN  |tt1(Reverse)|
|6 |        └─TABLE FULL SCAN  |tt2(Reverse)|
=============================================
Outputs & filters:
-------------------------------------
  0 - output([INTERNAL_FUNCTION(tt1.a, tt1.b, tt1.c, tt1.d, tt2.a, tt2.b, tt2.c, tt2.d)]), filter(nil), rowset=16
      sort_keys([tt1.a, DESC])
  1 - output([tt1.a], [INTERNAL_FUNCTION(tt1.a, tt1.b, tt1.c, tt1.d, tt2.a, tt2.b, tt2.c, tt2.d)]), filter(nil), rowset=16
      dop=1
  2 - output([tt1.a], [tt2.a], [tt1.b], [tt1.c], [tt1.d], [tt2.b], [tt2.c], [tt2.d]), filter(nil), rowset=16
      sort_keys([tt1.a, DESC]), local merge sort
  3 - output([tt1.a], [tt2.a], [tt1.b], [tt1.c], [tt1.d], [tt2.b], [tt2.c], [tt2.d]), filter(nil), rowset=16
      partition wise, force partition granule
  4 - output([tt1.a], [tt2.a], [tt1.b], [tt1.c], [tt1.d], [tt2.b], [tt2.c], [tt2.d]), filter(nil), rowset=16
      equal_conds([tt1.a = tt2.a]), other_conds(nil)
      merge_directions([DESC])
  5 - output([tt1.a], [tt1.b], [tt1.c], [tt1.d]), filter(nil), rowset=16
      access([tt1.a], [tt1.b], [tt1.c], [tt1.d]), partitions(p[0-1])
      is_index_back=false, is_global_index=false, 
      range_key([tt1.a]), range(MIN ; MAX)always true
  6 - output([tt2.a], [tt2.b], [tt2.c], [tt2.d]), filter(nil), rowset=16
      access([tt2.a], [tt2.b], [tt2.c], [tt2.d]), partitions(p[0-1])
      is_index_back=false, is_global_index=false, 
      range_key([tt2.a]), range(MIN ; MAX)always true
select /*+ use_merge(tt1, tt2) */ * from tt1,tt2 where tt1.a=tt2.a order by tt1.a desc;
a	b	c	d	a	b	c	d
EXPLAIN BASIC select /*+ use_merge(tt1, tt2) */ * from tt1,tt2 where tt1.a=tt2.a order by tt1.c desc;
Query Plan
=========================================
|ID|OPERATOR                   |NAME    |
-----------------------------------------
|0 |PX COORDINATOR MERGE SORT  |        |
|1 |└─EXCHANGE OUT DISTR       |:EX10000|
|2 |  └─SORT                   |        |
|3 |    └─PX PARTITION ITERATOR|        |
|4 |      └─MERGE JOIN         |        |
|5 |        ├─TABLE FULL SCAN  |tt1     |
|6 |        └─TABLE FULL SCAN  |tt2     |
=========================================
Outputs & filters:
-------------------------------------
  0 - output([INTERNAL_FUNCTION(tt1.a, tt1.b, tt1.c, tt1.d, tt2.a, tt2.b, tt2.c, tt2.d)]), filter(nil), rowset=16
      sort_keys([tt1.c, DESC])
  1 - output([tt1.c], [INTERNAL_FUNCTION(tt1.a, tt1.b, tt1.c, tt1.d, tt2.a, tt2.b, tt2.c, tt2.d)]), filter(nil), rowset=16
      dop=1
  2 - output([tt1.c], [tt1.a], [tt2.a], [tt1.b], [tt1.d], [tt2.b], [tt2.c], [tt2.d]), filter(nil), rowset=16
      sort_keys([tt1.c, DESC])
  3 - output([tt1.c], [tt1.a], [tt2.a], [tt1.b], [tt1.d], [tt2.b], [tt2.c], [tt2.d]), filter(nil), rowset=16
      partition wise, force partition granule
  4 - output([tt1.c], [tt1.a], [tt2.a], [tt1.b], [tt1.d], [tt2.b], [tt2.c], [tt2.d]), filter(nil), rowset=16
      equal_conds([tt1.a = tt2.a]), other_conds(nil)
      merge_directions([ASC])
  5 - output([tt1.a], [tt1.b], [tt1.c], [tt1.d]), filter(nil), rowset=16
      access([tt1.a], [tt1.b], [tt1.c], [tt1.d]), partitions(p[0-1])
      is_index_back=false, is_global_index=false, 
      range_key([tt1.a]), range(MIN ; MAX)always true
  6 - output([tt2.a], [tt2.b], [tt2.c], [tt2.d]), filter(nil), rowset=16
      access([tt2.a], [tt2.b], [tt2.c], [tt2.d]), partitions(p[0-1])
      is_index_back=false, is_global_index=false, 
      range_key([tt2.a]), range(MIN ; MAX)always true
select /*+ use_merge(tt1, tt2) */ * from tt1,tt2 where tt1.a=tt2.a order by tt1.c desc;
a	b	c	d	a	b	c	d
drop table if exists tt1,tt2;
== test partitioned table merge join ==
drop table if exists aa;
drop table if exists bb;
drop table if exists cc;
create table aa(a1 int primary key, a2 int, a3 int) partition by hash(a1) partitions 5;
create index i1 on aa(a2, a3) global;
create table bb(b1 int primary key, b2 int, b3 int) partition by hash(b1) partitions 5;
create index i2 on bb(b2, b3) global;
create table cc(c1 int primary key, c2 int, c3 int) partition by hash(c1) partitions 5;
create index i3 on cc(c2, c3) global;
EXPLAIN BASIC delete from aa;
Query Plan
==============================
|ID|OPERATOR          |NAME  |
------------------------------
|0 |DISTRIBUTED DELETE|      |
|1 |└─TABLE FULL SCAN |aa(i1)|
==============================
Outputs & filters:
-------------------------------------
  0 - output(nil), filter(nil)
      table_columns([{aa: ({aa: (aa.a1, aa.a2, aa.a3)}, {i1: (aa.a2, aa.a3, aa.a1)})}])
  1 - output([aa.a1], [aa.a2], [aa.a3]), filter(nil), rowset=16
      access([aa.a1], [aa.a2], [aa.a3]), partitions(p0)
      is_index_back=false, is_global_index=true, 
      range_key([aa.a2], [aa.a3], [aa.a1]), range(MIN,MIN,MIN ; MAX,MAX,MAX)always true
delete from aa;
EXPLAIN BASIC insert into aa values (1, 10, 15), (2, 10, 14), (3, 10, 12), (4, 11, 13), (5, 12, 12), (6, 12, 10);
Query Plan
============================
|ID|OPERATOR          |NAME|
----------------------------
|0 |DISTRIBUTED INSERT|    |
|1 |└─EXPRESSION      |    |
============================
Outputs & filters:
-------------------------------------
  0 - output(nil), filter(nil)
      columns([{aa: ({aa: (aa.a1, aa.a2, aa.a3)}, {i1: (aa.a2, aa.a3, aa.a1)})}]), 
      column_values([column_conv(INT,PS:(11,0),NOT NULL,__values.a1)], [column_conv(INT,PS:(11,0),NULL,__values.a2)], [column_conv(INT,PS:(11,0),NULL,__values.a3)])
  1 - output([__values.a1], [__values.a2], [__values.a3]), filter(nil)
      values({1, 10, 15}, {2, 10, 14}, {3, 10, 12}, {4, 11, 13}, {5, 12, 12}, {6, 12, 10})
insert into aa values (1, 10, 15), (2, 10, 14), (3, 10, 12), (4, 11, 13), (5, 12, 12), (6, 12, 10);
EXPLAIN BASIC delete from bb;
Query Plan
==============================
|ID|OPERATOR          |NAME  |
------------------------------
|0 |DISTRIBUTED DELETE|      |
|1 |└─TABLE FULL SCAN |bb(i2)|
==============================
Outputs & filters:
-------------------------------------
  0 - output(nil), filter(nil)
      table_columns([{bb: ({bb: (bb.b1, bb.b2, bb.b3)}, {i2: (bb.b2, bb.b3, bb.b1)})}])
  1 - output([bb.b1], [bb.b2], [bb.b3]), filter(nil), rowset=16
      access([bb.b1], [bb.b2], [bb.b3]), partitions(p0)
      is_index_back=false, is_global_index=true, 
      range_key([bb.b2], [bb.b3], [bb.b1]), range(MIN,MIN,MIN ; MAX,MAX,MAX)always true
delete from bb;
EXPLAIN BASIC insert into bb values (1, 10, 14), (2, 11, 14), (3, 11, 13), (4, 12, 11), (5, 12, 10);
Query Plan
============================
|ID|OPERATOR          |NAME|
----------------------------
|0 |DISTRIBUTED INSERT|    |
|1 |└─EXPRESSION      |    |
============================
Outputs & filters:
-------------------------------------
  0 - output(nil), filter(nil)
      columns([{bb: ({bb: (bb.b1, bb.b2, bb.b3)}, {i2: (bb.b2, bb.b3, bb.b1)})}]), 
      column_values([column_conv(INT,PS:(11,0),NOT NULL,__values.b1)], [column_conv(INT,PS:(11,0),NULL,__values.b2)], [column_conv(INT,PS:(11,0),NULL,__values.b3)])
  1 - output([__values.b1], [__values.b2], [__values.b3]), filter(nil)
      values({1, 10, 14}, {2, 11, 14}, {3, 11, 13}, {4, 12, 11}, {5, 12, 10})
insert into bb values (1, 10, 14), (2, 11, 14), (3, 11, 13), (4, 12, 11), (5, 12, 10);
EXPLAIN BASIC select /*+ use_merge(aa, bb) */ a2, b3 from aa, bb where a2 = b2 and a3 = b3 and a2>0 and a3>0 order by a2, a3;
Query Plan
==============================
|ID|OPERATOR          |NAME  |
------------------------------
|0 |MERGE JOIN        |      |
|1 |├─TABLE RANGE SCAN|bb(i2)|
|2 |└─TABLE RANGE SCAN|aa(i1)|
==============================
Outputs & filters:
-------------------------------------
  0 - output([aa.a2], [bb.b3]), filter(nil), rowset=16
      equal_conds([aa.a2 = bb.b2], [aa.a3 = bb.b3]), other_conds(nil)
      merge_directions([ASC], [ASC])
  1 - output([bb.b2], [bb.b3]), filter([bb.b3 > 0]), rowset=16
      access([bb.b2], [bb.b3]), partitions(p0)
      is_index_back=false, is_global_index=true, filter_before_indexback[false], 
      range_key([bb.b2], [bb.b3], [bb.b1]), range(0,MAX,MAX ; MAX,MAX,MAX), 
      range_cond([bb.b2 > 0])
  2 - output([aa.a2], [aa.a3]), filter([aa.a3 > 0]), rowset=16
      access([aa.a2], [aa.a3]), partitions(p0)
      is_index_back=false, is_global_index=true, filter_before_indexback[false], 
      range_key([aa.a2], [aa.a3], [aa.a1]), range(0,MAX,MAX ; MAX,MAX,MAX), 
      range_cond([aa.a2 > 0])
select /*+ use_merge(aa, bb) */ a2, b3 from aa, bb where a2 = b2 and a3 = b3 and a2>0 and a3>0 order by a2, a3;
a2	b3
10	14
11	13
12	10
EXPLAIN BASIC select /*+ use_merge(aa, bb) */ a2, b3 from aa, bb where a2 = b2 and a3 = b3 and a2>0 and a3>0 order by a2, a3 desc;
Query Plan
================================
|ID|OPERATOR            |NAME  |
--------------------------------
|0 |SORT                |      |
|1 |└─MERGE JOIN        |      |
|2 |  ├─TABLE RANGE SCAN|bb(i2)|
|3 |  └─TABLE RANGE SCAN|aa(i1)|
================================
Outputs & filters:
-------------------------------------
  0 - output([aa.a2], [bb.b3]), filter(nil), rowset=16
      sort_keys([aa.a2, ASC], [aa.a3, DESC]), prefix_pos(1)
  1 - output([aa.a2], [aa.a3], [bb.b3]), filter(nil), rowset=16
      equal_conds([aa.a2 = bb.b2], [aa.a3 = bb.b3]), other_conds(nil)
      merge_directions([ASC], [ASC])
  2 - output([bb.b2], [bb.b3]), filter([bb.b3 > 0]), rowset=16
      access([bb.b2], [bb.b3]), partitions(p0)
      is_index_back=false, is_global_index=true, filter_before_indexback[false], 
      range_key([bb.b2], [bb.b3], [bb.b1]), range(0,MAX,MAX ; MAX,MAX,MAX), 
      range_cond([bb.b2 > 0])
  3 - output([aa.a2], [aa.a3]), filter([aa.a3 > 0]), rowset=16
      access([aa.a2], [aa.a3]), partitions(p0)
      is_index_back=false, is_global_index=true, filter_before_indexback[false], 
      range_key([aa.a2], [aa.a3], [aa.a1]), range(0,MAX,MAX ; MAX,MAX,MAX), 
      range_cond([aa.a2 > 0])
select /*+ use_merge(aa, bb) */ a2, b3 from aa, bb where a2 = b2 and a3 = b3 and a2>0 and a3>0 order by a2, a3 desc;
a2	b3
10	14
11	13
12	10
EXPLAIN BASIC select /*+ use_merge(aa, bb) */ a2, b3 from aa, bb where a2 = b2 and a3 = b3 and a2>0 and a3>0 order by a2 desc, a3;
Query Plan
========================================
|ID|OPERATOR            |NAME          |
----------------------------------------
|0 |SORT                |              |
|1 |└─MERGE JOIN        |              |
|2 |  ├─TABLE RANGE SCAN|bb(i2,Reverse)|
|3 |  └─TABLE RANGE SCAN|aa(i1,Reverse)|
========================================
Outputs & filters:
-------------------------------------
  0 - output([aa.a2], [bb.b3]), filter(nil), rowset=16
      sort_keys([aa.a2, DESC], [aa.a3, ASC]), prefix_pos(1)
  1 - output([aa.a2], [aa.a3], [bb.b3]), filter(nil), rowset=16
      equal_conds([aa.a2 = bb.b2], [aa.a3 = bb.b3]), other_conds(nil)
      merge_directions([DESC], [DESC])
  2 - output([bb.b2], [bb.b3]), filter([bb.b3 > 0]), rowset=16
      access([bb.b2], [bb.b3]), partitions(p0)
      is_index_back=false, is_global_index=true, filter_before_indexback[false], 
      range_key([bb.b2], [bb.b3], [bb.b1]), range(0,MAX,MAX ; MAX,MAX,MAX), 
      range_cond([bb.b2 > 0])
  3 - output([aa.a2], [aa.a3]), filter([aa.a3 > 0]), rowset=16
      access([aa.a2], [aa.a3]), partitions(p0)
      is_index_back=false, is_global_index=true, filter_before_indexback[false], 
      range_key([aa.a2], [aa.a3], [aa.a1]), range(0,MAX,MAX ; MAX,MAX,MAX), 
      range_cond([aa.a2 > 0])
select /*+ use_merge(aa, bb) */ a2, b3 from aa, bb where a2 = b2 and a3 = b3 and a2>0 and a3>0 order by a2 desc, a3;
a2	b3
12	10
11	13
10	14
EXPLAIN BASIC select /*+ use_merge(aa, bb) */ a2, b3 from aa, bb where a2 = b2 and a3 = b3 and a2>0 and a3>0 order by a2 desc, a3 desc;
Query Plan
======================================
|ID|OPERATOR          |NAME          |
--------------------------------------
|0 |MERGE JOIN        |              |
|1 |├─TABLE RANGE SCAN|bb(i2,Reverse)|
|2 |└─TABLE RANGE SCAN|aa(i1,Reverse)|
======================================
Outputs & filters:
-------------------------------------
  0 - output([aa.a2], [bb.b3]), filter(nil), rowset=16
      equal_conds([aa.a2 = bb.b2], [aa.a3 = bb.b3]), other_conds(nil)
      merge_directions([DESC], [DESC])
  1 - output([bb.b2], [bb.b3]), filter([bb.b3 > 0]), rowset=16
      access([bb.b2], [bb.b3]), partitions(p0)
      is_index_back=false, is_global_index=true, filter_before_indexback[false], 
      range_key([bb.b2], [bb.b3], [bb.b1]), range(0,MAX,MAX ; MAX,MAX,MAX), 
      range_cond([bb.b2 > 0])
  2 - output([aa.a2], [aa.a3]), filter([aa.a3 > 0]), rowset=16
      access([aa.a2], [aa.a3]), partitions(p0)
      is_index_back=false, is_global_index=true, filter_before_indexback[false], 
      range_key([aa.a2], [aa.a3], [aa.a1]), range(0,MAX,MAX ; MAX,MAX,MAX), 
      range_cond([aa.a2 > 0])
select /*+ use_merge(aa, bb) */ a2, b3 from aa, bb where a2 = b2 and a3 = b3 and a2>0 and a3>0 order by a2 desc, a3 desc;
a2	b3
12	10
11	13
10	14
EXPLAIN BASIC delete from aa;
Query Plan
==============================
|ID|OPERATOR          |NAME  |
------------------------------
|0 |DISTRIBUTED DELETE|      |
|1 |└─TABLE FULL SCAN |aa(i1)|
==============================
Outputs & filters:
-------------------------------------
  0 - output(nil), filter(nil)
      table_columns([{aa: ({aa: (aa.a1, aa.a2, aa.a3)}, {i1: (aa.a2, aa.a3, aa.a1)})}])
  1 - output([aa.a1], [aa.a2], [aa.a3]), filter(nil), rowset=16
      access([aa.a1], [aa.a2], [aa.a3]), partitions(p0)
      is_index_back=false, is_global_index=true, 
      range_key([aa.a2], [aa.a3], [aa.a1]), range(MIN,MIN,MIN ; MAX,MAX,MAX)always true
delete from aa;
EXPLAIN BASIC insert into aa values (1, 10, 15), (2, 10, 14), (3, 10, 12), (4, 11, 13), (5, 12, 12), (6, 12, 10);
Query Plan
============================
|ID|OPERATOR          |NAME|
----------------------------
|0 |DISTRIBUTED INSERT|    |
|1 |└─EXPRESSION      |    |
============================
Outputs & filters:
-------------------------------------
  0 - output(nil), filter(nil)
      columns([{aa: ({aa: (aa.a1, aa.a2, aa.a3)}, {i1: (aa.a2, aa.a3, aa.a1)})}]), 
      column_values([column_conv(INT,PS:(11,0),NOT NULL,__values.a1)], [column_conv(INT,PS:(11,0),NULL,__values.a2)], [column_conv(INT,PS:(11,0),NULL,__values.a3)])
  1 - output([__values.a1], [__values.a2], [__values.a3]), filter(nil)
      values({1, 10, 15}, {2, 10, 14}, {3, 10, 12}, {4, 11, 13}, {5, 12, 12}, {6, 12, 10})
insert into aa values (1, 10, 15), (2, 10, 14), (3, 10, 12), (4, 11, 13), (5, 12, 12), (6, 12, 10);
EXPLAIN BASIC delete from bb;
Query Plan
==============================
|ID|OPERATOR          |NAME  |
------------------------------
|0 |DISTRIBUTED DELETE|      |
|1 |└─TABLE FULL SCAN |bb(i2)|
==============================
Outputs & filters:
-------------------------------------
  0 - output(nil), filter(nil)
      table_columns([{bb: ({bb: (bb.b1, bb.b2, bb.b3)}, {i2: (bb.b2, bb.b3, bb.b1)})}])
  1 - output([bb.b1], [bb.b2], [bb.b3]), filter(nil), rowset=16
      access([bb.b1], [bb.b2], [bb.b3]), partitions(p0)
      is_index_back=false, is_global_index=true, 
      range_key([bb.b2], [bb.b3], [bb.b1]), range(MIN,MIN,MIN ; MAX,MAX,MAX)always true
delete from bb;
EXPLAIN BASIC insert into bb values (1, 10, 14), (2, 11, 14), (3, 11, 13), (4, 12, 11), (5, 12, 10);
Query Plan
============================
|ID|OPERATOR          |NAME|
----------------------------
|0 |DISTRIBUTED INSERT|    |
|1 |└─EXPRESSION      |    |
============================
Outputs & filters:
-------------------------------------
  0 - output(nil), filter(nil)
      columns([{bb: ({bb: (bb.b1, bb.b2, bb.b3)}, {i2: (bb.b2, bb.b3, bb.b1)})}]), 
      column_values([column_conv(INT,PS:(11,0),NOT NULL,__values.b1)], [column_conv(INT,PS:(11,0),NULL,__values.b2)], [column_conv(INT,PS:(11,0),NULL,__values.b3)])
  1 - output([__values.b1], [__values.b2], [__values.b3]), filter(nil)
      values({1, 10, 14}, {2, 11, 14}, {3, 11, 13}, {4, 12, 11}, {5, 12, 10})
insert into bb values (1, 10, 14), (2, 11, 14), (3, 11, 13), (4, 12, 11), (5, 12, 10);
EXPLAIN BASIC select /*+ use_merge(aa, bb) */ a2, b3 from aa, bb where a2 = b2 and a3 = b3 and a2>0 and a3>0 order by a2, a3;
Query Plan
==============================
|ID|OPERATOR          |NAME  |
------------------------------
|0 |MERGE JOIN        |      |
|1 |├─TABLE RANGE SCAN|bb(i2)|
|2 |└─TABLE RANGE SCAN|aa(i1)|
==============================
Outputs & filters:
-------------------------------------
  0 - output([aa.a2], [bb.b3]), filter(nil), rowset=16
      equal_conds([aa.a2 = bb.b2], [aa.a3 = bb.b3]), other_conds(nil)
      merge_directions([ASC], [ASC])
  1 - output([bb.b2], [bb.b3]), filter([bb.b3 > 0]), rowset=16
      access([bb.b2], [bb.b3]), partitions(p0)
      is_index_back=false, is_global_index=true, filter_before_indexback[false], 
      range_key([bb.b2], [bb.b3], [bb.b1]), range(0,MAX,MAX ; MAX,MAX,MAX), 
      range_cond([bb.b2 > 0])
  2 - output([aa.a2], [aa.a3]), filter([aa.a3 > 0]), rowset=16
      access([aa.a2], [aa.a3]), partitions(p0)
      is_index_back=false, is_global_index=true, filter_before_indexback[false], 
      range_key([aa.a2], [aa.a3], [aa.a1]), range(0,MAX,MAX ; MAX,MAX,MAX), 
      range_cond([aa.a2 > 0])
select /*+ use_merge(aa, bb) */ a2, b3 from aa, bb where a2 = b2 and a3 = b3 and a2>0 and a3>0 order by a2, a3;
a2	b3
10	14
11	13
12	10
EXPLAIN BASIC select /*+ use_merge(aa, bb) */ a2, b3 from aa, bb where a2 = b2 and a3 = b3 and a2>0 and a3>0 order by a2, a3 desc;
Query Plan
================================
|ID|OPERATOR            |NAME  |
--------------------------------
|0 |SORT                |      |
|1 |└─MERGE JOIN        |      |
|2 |  ├─TABLE RANGE SCAN|bb(i2)|
|3 |  └─TABLE RANGE SCAN|aa(i1)|
================================
Outputs & filters:
-------------------------------------
  0 - output([aa.a2], [bb.b3]), filter(nil), rowset=16
      sort_keys([aa.a2, ASC], [aa.a3, DESC]), prefix_pos(1)
  1 - output([aa.a2], [aa.a3], [bb.b3]), filter(nil), rowset=16
      equal_conds([aa.a2 = bb.b2], [aa.a3 = bb.b3]), other_conds(nil)
      merge_directions([ASC], [ASC])
  2 - output([bb.b2], [bb.b3]), filter([bb.b3 > 0]), rowset=16
      access([bb.b2], [bb.b3]), partitions(p0)
      is_index_back=false, is_global_index=true, filter_before_indexback[false], 
      range_key([bb.b2], [bb.b3], [bb.b1]), range(0,MAX,MAX ; MAX,MAX,MAX), 
      range_cond([bb.b2 > 0])
  3 - output([aa.a2], [aa.a3]), filter([aa.a3 > 0]), rowset=16
      access([aa.a2], [aa.a3]), partitions(p0)
      is_index_back=false, is_global_index=true, filter_before_indexback[false], 
      range_key([aa.a2], [aa.a3], [aa.a1]), range(0,MAX,MAX ; MAX,MAX,MAX), 
      range_cond([aa.a2 > 0])
select /*+ use_merge(aa, bb) */ a2, b3 from aa, bb where a2 = b2 and a3 = b3 and a2>0 and a3>0 order by a2, a3 desc;
a2	b3
10	14
11	13
12	10
EXPLAIN BASIC select /*+ use_merge(aa, bb) */ a2, b3 from aa, bb where a2 = b2 and a3 = b3 and a2>0 and a3>0 order by a2 desc, a3;
Query Plan
========================================
|ID|OPERATOR            |NAME          |
----------------------------------------
|0 |SORT                |              |
|1 |└─MERGE JOIN        |              |
|2 |  ├─TABLE RANGE SCAN|bb(i2,Reverse)|
|3 |  └─TABLE RANGE SCAN|aa(i1,Reverse)|
========================================
Outputs & filters:
-------------------------------------
  0 - output([aa.a2], [bb.b3]), filter(nil), rowset=16
      sort_keys([aa.a2, DESC], [aa.a3, ASC]), prefix_pos(1)
  1 - output([aa.a2], [aa.a3], [bb.b3]), filter(nil), rowset=16
      equal_conds([aa.a2 = bb.b2], [aa.a3 = bb.b3]), other_conds(nil)
      merge_directions([DESC], [DESC])
  2 - output([bb.b2], [bb.b3]), filter([bb.b3 > 0]), rowset=16
      access([bb.b2], [bb.b3]), partitions(p0)
      is_index_back=false, is_global_index=true, filter_before_indexback[false], 
      range_key([bb.b2], [bb.b3], [bb.b1]), range(0,MAX,MAX ; MAX,MAX,MAX), 
      range_cond([bb.b2 > 0])
  3 - output([aa.a2], [aa.a3]), filter([aa.a3 > 0]), rowset=16
      access([aa.a2], [aa.a3]), partitions(p0)
      is_index_back=false, is_global_index=true, filter_before_indexback[false], 
      range_key([aa.a2], [aa.a3], [aa.a1]), range(0,MAX,MAX ; MAX,MAX,MAX), 
      range_cond([aa.a2 > 0])
select /*+ use_merge(aa, bb) */ a2, b3 from aa, bb where a2 = b2 and a3 = b3 and a2>0 and a3>0 order by a2 desc, a3;
a2	b3
12	10
11	13
10	14
EXPLAIN BASIC select /*+ use_merge(aa, bb) */ a2, b3 from aa, bb where a2 = b2 and a3 = b3 and a2>0 and a3>0 order by a2 desc, a3 desc;
Query Plan
======================================
|ID|OPERATOR          |NAME          |
--------------------------------------
|0 |MERGE JOIN        |              |
|1 |├─TABLE RANGE SCAN|bb(i2,Reverse)|
|2 |└─TABLE RANGE SCAN|aa(i1,Reverse)|
======================================
Outputs & filters:
-------------------------------------
  0 - output([aa.a2], [bb.b3]), filter(nil), rowset=16
      equal_conds([aa.a2 = bb.b2], [aa.a3 = bb.b3]), other_conds(nil)
      merge_directions([DESC], [DESC])
  1 - output([bb.b2], [bb.b3]), filter([bb.b3 > 0]), rowset=16
      access([bb.b2], [bb.b3]), partitions(p0)
      is_index_back=false, is_global_index=true, filter_before_indexback[false], 
      range_key([bb.b2], [bb.b3], [bb.b1]), range(0,MAX,MAX ; MAX,MAX,MAX), 
      range_cond([bb.b2 > 0])
  2 - output([aa.a2], [aa.a3]), filter([aa.a3 > 0]), rowset=16
      access([aa.a2], [aa.a3]), partitions(p0)
      is_index_back=false, is_global_index=true, filter_before_indexback[false], 
      range_key([aa.a2], [aa.a3], [aa.a1]), range(0,MAX,MAX ; MAX,MAX,MAX), 
      range_cond([aa.a2 > 0])
select /*+ use_merge(aa, bb) */ a2, b3 from aa, bb where a2 = b2 and a3 = b3 and a2>0 and a3>0 order by a2 desc, a3 desc;
a2	b3
12	10
11	13
10	14
EXPLAIN BASIC delete from cc;
Query Plan
==============================
|ID|OPERATOR          |NAME  |
------------------------------
|0 |DISTRIBUTED DELETE|      |
|1 |└─TABLE FULL SCAN |cc(i3)|
==============================
Outputs & filters:
-------------------------------------
  0 - output(nil), filter(nil)
      table_columns([{cc: ({cc: (cc.c1, cc.c2, cc.c3)}, {i3: (cc.c2, cc.c3, cc.c1)})}])
  1 - output([cc.c1], [cc.c2], [cc.c3]), filter(nil), rowset=16
      access([cc.c1], [cc.c2], [cc.c3]), partitions(p0)
      is_index_back=false, is_global_index=true, 
      range_key([cc.c2], [cc.c3], [cc.c1]), range(MIN,MIN,MIN ; MAX,MAX,MAX)always true
delete from cc;
EXPLAIN BASIC insert into cc values (1, 10, 15), (2, 10, 14), (3, 10, 12), (4, 12, 10);
Query Plan
============================
|ID|OPERATOR          |NAME|
----------------------------
|0 |DISTRIBUTED INSERT|    |
|1 |└─EXPRESSION      |    |
============================
Outputs & filters:
-------------------------------------
  0 - output(nil), filter(nil)
      columns([{cc: ({cc: (cc.c1, cc.c2, cc.c3)}, {i3: (cc.c2, cc.c3, cc.c1)})}]), 
      column_values([column_conv(INT,PS:(11,0),NOT NULL,__values.c1)], [column_conv(INT,PS:(11,0),NULL,__values.c2)], [column_conv(INT,PS:(11,0),NULL,__values.c3)])
  1 - output([__values.c1], [__values.c2], [__values.c3]), filter(nil)
      values({1, 10, 15}, {2, 10, 14}, {3, 10, 12}, {4, 12, 10})
insert into cc values (1, 10, 15), (2, 10, 14), (3, 10, 12), (4, 12, 10);
EXPLAIN BASIC select /*+ leading(aa bb cc) use_merge(aa, bb, cc) */ c2, a3 from aa, bb, cc where a2 = b2 and a3 = b3 and b2 = c2 and b3 = c3 and a2>0 and a3>0 order by c2, c3 desc;
Query Plan
==================================
|ID|OPERATOR              |NAME  |
----------------------------------
|0 |SORT                  |      |
|1 |└─MERGE JOIN          |      |
|2 |  ├─MERGE JOIN        |      |
|3 |  │ ├─TABLE RANGE SCAN|aa(i1)|
|4 |  │ └─TABLE RANGE SCAN|bb(i2)|
|5 |  └─TABLE RANGE SCAN  |cc(i3)|
==================================
Outputs & filters:
-------------------------------------
  0 - output([cc.c2], [aa.a3]), filter(nil), rowset=16
      sort_keys([cc.c2, ASC], [cc.c3, DESC]), prefix_pos(1)
  1 - output([cc.c2], [cc.c3], [aa.a3]), filter(nil), rowset=16
      equal_conds([aa.a2 = cc.c2], [bb.b3 = cc.c3]), other_conds(nil)
      merge_directions([ASC], [ASC])
  2 - output([aa.a3], [aa.a2], [bb.b3]), filter(nil), rowset=16
      equal_conds([aa.a2 = bb.b2], [aa.a3 = bb.b3]), other_conds(nil)
      merge_directions([ASC], [ASC])
  3 - output([aa.a2], [aa.a3]), filter([aa.a3 > 0]), rowset=16
      access([aa.a2], [aa.a3]), partitions(p0)
      is_index_back=false, is_global_index=true, filter_before_indexback[false], 
      range_key([aa.a2], [aa.a3], [aa.a1]), range(0,MAX,MAX ; MAX,MAX,MAX), 
      range_cond([aa.a2 > 0])
  4 - output([bb.b2], [bb.b3]), filter([bb.b3 > 0]), rowset=16
      access([bb.b2], [bb.b3]), partitions(p0)
      is_index_back=false, is_global_index=true, filter_before_indexback[false], 
      range_key([bb.b2], [bb.b3], [bb.b1]), range(0,MAX,MAX ; MAX,MAX,MAX), 
      range_cond([bb.b2 > 0])
  5 - output([cc.c2], [cc.c3]), filter([cc.c3 > 0]), rowset=16
      access([cc.c2], [cc.c3]), partitions(p0)
      is_index_back=false, is_global_index=true, filter_before_indexback[false], 
      range_key([cc.c2], [cc.c3], [cc.c1]), range(0,MAX,MAX ; MAX,MAX,MAX), 
      range_cond([cc.c2 > 0])
select /*+ leading(aa bb cc) use_merge(aa, bb, cc) */ c2, a3 from aa, bb, cc where a2 = b2 and a3 = b3 and b2 = c2 and b3 = c3 and a2>0 and a3>0 order by c2, c3 desc;
c2	a3
10	14
12	10
EXPLAIN BASIC select /*+ leading(aa bb cc) use_merge(aa, bb, cc) */ c2, a3 from aa, bb, cc where a2 = b2 and a3 = b3 and a2 = c2 and b3 = c3 and a2>0 and a3>0 order by c2, c3 desc;
Query Plan
==================================
|ID|OPERATOR              |NAME  |
----------------------------------
|0 |SORT                  |      |
|1 |└─MERGE JOIN          |      |
|2 |  ├─MERGE JOIN        |      |
|3 |  │ ├─TABLE RANGE SCAN|aa(i1)|
|4 |  │ └─TABLE RANGE SCAN|bb(i2)|
|5 |  └─TABLE RANGE SCAN  |cc(i3)|
==================================
Outputs & filters:
-------------------------------------
  0 - output([cc.c2], [aa.a3]), filter(nil), rowset=16
      sort_keys([cc.c2, ASC], [cc.c3, DESC]), prefix_pos(1)
  1 - output([cc.c2], [cc.c3], [aa.a3]), filter(nil), rowset=16
      equal_conds([aa.a2 = cc.c2], [bb.b3 = cc.c3]), other_conds(nil)
      merge_directions([ASC], [ASC])
  2 - output([aa.a3], [aa.a2], [bb.b3]), filter(nil), rowset=16
      equal_conds([aa.a2 = bb.b2], [aa.a3 = bb.b3]), other_conds(nil)
      merge_directions([ASC], [ASC])
  3 - output([aa.a2], [aa.a3]), filter([aa.a3 > 0]), rowset=16
      access([aa.a2], [aa.a3]), partitions(p0)
      is_index_back=false, is_global_index=true, filter_before_indexback[false], 
      range_key([aa.a2], [aa.a3], [aa.a1]), range(0,MAX,MAX ; MAX,MAX,MAX), 
      range_cond([aa.a2 > 0])
  4 - output([bb.b2], [bb.b3]), filter([bb.b3 > 0]), rowset=16
      access([bb.b2], [bb.b3]), partitions(p0)
      is_index_back=false, is_global_index=true, filter_before_indexback[false], 
      range_key([bb.b2], [bb.b3], [bb.b1]), range(0,MAX,MAX ; MAX,MAX,MAX), 
      range_cond([bb.b2 > 0])
  5 - output([cc.c2], [cc.c3]), filter([cc.c3 > 0]), rowset=16
      access([cc.c2], [cc.c3]), partitions(p0)
      is_index_back=false, is_global_index=true, filter_before_indexback[false], 
      range_key([cc.c2], [cc.c3], [cc.c1]), range(0,MAX,MAX ; MAX,MAX,MAX), 
      range_cond([cc.c2 > 0])
select /*+ leading(aa bb cc) use_merge(aa, bb, cc) */ c2, a3 from aa, bb, cc where a2 = b2 and a3 = b3 and a2 = c2 and b3 = c3 and a2>0 and a3>0 order by c2, c3 desc;
c2	a3
10	14
12	10
drop table if exists aa;
drop table if exists bb;
drop table if exists cc;
drop table if exists t_r4_01_20;
create table t_r4_01_20(a int, b int, c datetime, primary key (a,b))
partition by range columns(a)
(
partition p6 values less than (6),
partition p11 values less than (11),
partition p16 values less than (16),
partition pm values less than (MAXVALUE)
);
create index i1 on t_r4_01_20(b) global;
EXPLAIN BASIC insert into t_r4_01_20 values ( 1,  1, 20161101), ( 2,  2, 20161102), ( 3,  3, 20161103), ( 4,  4, 20161104),
( 5,  5, 20161105), ( 6,  6, 20161106), ( 7,  7, 20161107), ( 8,  8, 20161108),
( 9,  9, 20161109), (10, 10, 20161110), (11, 11, 20161111), (12, 12, 20161112),
(13, 13, 20161113), (14, 14, 20161114), (15, 15, 20161115), (16, 16, 20161116),
(17, 17, 20161117), (18, 18, 20161118), (19, 19, 20161119), (20, 20, 20161120);
Query Plan
============================
|ID|OPERATOR          |NAME|
----------------------------
|0 |DISTRIBUTED INSERT|    |
|1 |└─EXPRESSION      |    |
============================
Outputs & filters:
-------------------------------------
  0 - output(nil), filter(nil)
      columns([{t_r4_01_20: ({t_r4_01_20: (t_r4_01_20.a, t_r4_01_20.b, t_r4_01_20.c)}, {i1: (t_r4_01_20.b, t_r4_01_20.a)})}]), 
      column_values([column_conv(INT,PS:(11,0),NOT NULL,__values.a)], [column_conv(INT,PS:(11,0),NOT NULL,__values.b)], [column_conv(MYSQL_DATETIME,PS:(19,
      0),NULL,__values.c)])
  1 - output([__values.a], [__values.b], [__values.c]), filter(nil)
      values({1, 1, 20161101}, {2, 2, 20161102}, {3, 3, 20161103}, {4, 4, 20161104}, {5, 5, 20161105}, {6, 6, 20161106}, {7, 7, 20161107}, {8, 8, 20161108},
       {9, 9, 20161109}, {10, 10, 20161110}, {11, 11, 20161111}, {12, 12, 20161112}, {13, 13, 20161113}, {14, 14, 20161114}, {15, 15, 20161115}, {16, 16, 20161116},
       {17, 17, 20161117}, {18, 18, 20161118}, {19, 19, 20161119}, {20, 20, 20161120})
insert into t_r4_01_20 values ( 1,  1, 20161101), ( 2,  2, 20161102), ( 3,  3, 20161103), ( 4,  4, 20161104),
( 5,  5, 20161105), ( 6,  6, 20161106), ( 7,  7, 20161107), ( 8,  8, 20161108),
( 9,  9, 20161109), (10, 10, 20161110), (11, 11, 20161111), (12, 12, 20161112),
(13, 13, 20161113), (14, 14, 20161114), (15, 15, 20161115), (16, 16, 20161116),
(17, 17, 20161117), (18, 18, 20161118), (19, 19, 20161119), (20, 20, 20161120);
EXPLAIN BASIC select /*+use_merge(t1 t2)*/ t1.a, t2.a from t_r4_01_20 t1 inner join t_r4_01_20 t2 on t1.a = t2.a where t1.b>0 order by t1.a desc, t2.a desc;
Query Plan
================================
|ID|OPERATOR            |NAME  |
--------------------------------
|0 |MERGE JOIN          |      |
|1 |├─SORT              |      |
|2 |│ └─TABLE FULL SCAN |t2(i1)|
|3 |└─SORT              |      |
|4 |  └─TABLE RANGE SCAN|t1(i1)|
================================
Outputs & filters:
-------------------------------------
  0 - output([t1.a], [t2.a]), filter(nil), rowset=256
      equal_conds([t1.a = t2.a]), other_conds(nil)
      merge_directions([DESC])
  1 - output([t2.a]), filter(nil), rowset=256
      sort_keys([t2.a, DESC])
  2 - output([t2.a]), filter(nil), rowset=256
      access([t2.a]), partitions(p0)
      is_index_back=false, is_global_index=true, 
      range_key([t2.b], [t2.a]), range(MIN,MIN ; MAX,MAX)always true
  3 - output([t1.a]), filter(nil), rowset=256
      sort_keys([t1.a, DESC])
  4 - output([t1.a]), filter(nil), rowset=256
      access([t1.a]), partitions(p0)
      is_index_back=false, is_global_index=true, 
      range_key([t1.b], [t1.a]), range(0,MAX ; MAX,MAX), 
      range_cond([t1.b > 0])
select /*+use_merge(t1 t2)*/ t1.a, t2.a from t_r4_01_20 t1 inner join t_r4_01_20 t2 on t1.a = t2.a where t1.b>0 order by t1.a desc, t2.a desc;
a	a
20	20
19	19
18	18
17	17
16	16
15	15
14	14
13	13
12	12
11	11
10	10
9	9
8	8
7	7
6	6
5	5
4	4
3	3
2	2
1	1
EXPLAIN BASIC select /*+use_merge(t1 t2)*/ t1.a, t2.a from t_r4_01_20 t1 inner join t_r4_01_20 t2 on t1.a = t2.a where t1.b>0 order by t1.a asc, t2.a asc;
Query Plan
================================
|ID|OPERATOR            |NAME  |
--------------------------------
|0 |MERGE JOIN          |      |
|1 |├─SORT              |      |
|2 |│ └─TABLE FULL SCAN |t2(i1)|
|3 |└─SORT              |      |
|4 |  └─TABLE RANGE SCAN|t1(i1)|
================================
Outputs & filters:
-------------------------------------
  0 - output([t1.a], [t2.a]), filter(nil), rowset=256
      equal_conds([t1.a = t2.a]), other_conds(nil)
      merge_directions([ASC])
  1 - output([t2.a]), filter(nil), rowset=256
      sort_keys([t2.a, ASC])
  2 - output([t2.a]), filter(nil), rowset=256
      access([t2.a]), partitions(p0)
      is_index_back=false, is_global_index=true, 
      range_key([t2.b], [t2.a]), range(MIN,MIN ; MAX,MAX)always true
  3 - output([t1.a]), filter(nil), rowset=256
      sort_keys([t1.a, ASC])
  4 - output([t1.a]), filter(nil), rowset=256
      access([t1.a]), partitions(p0)
      is_index_back=false, is_global_index=true, 
      range_key([t1.b], [t1.a]), range(0,MAX ; MAX,MAX), 
      range_cond([t1.b > 0])
select /*+use_merge(t1 t2)*/ t1.a, t2.a from t_r4_01_20 t1 inner join t_r4_01_20 t2 on t1.a = t2.a where t1.b>0 order by t1.a asc, t2.a asc;
a	a
1	1
2	2
3	3
4	4
5	5
6	6
7	7
8	8
9	9
10	10
11	11
12	12
13	13
14	14
15	15
16	16
17	17
18	18
19	19
20	20
drop table if exists t_r4_01_20;
drop table if exists t2, t7;
create table t2(a int, b varchar(20), c decimal(20,10), primary key(a, b)) partition by hash(a) partitions 2;
create index i2 on t2(b, c) global;
create table t7(a int(10), b varchar(10), c char(20), d decimal(20,10), primary key(a, b)) partition by hash(a) partitions 2;
create index i7 on t7(b, c) global;
EXPLAIN BASIC insert into t2 values(1, "222", 3.33),(2,"222",3.33),(2,"333",2.22),(3,"3333",1.11), (5, "555", 5.55), (6, "6666", 5.5),(1, '1', 1), (1, '2', 2), (2, '2.00', 2.00001), (3, '3.0', 3.00001), (4, "A", 4.33), (5, "B", 5), (6, "AB", 6);
Query Plan
============================
|ID|OPERATOR          |NAME|
----------------------------
|0 |DISTRIBUTED INSERT|    |
|1 |└─EXPRESSION      |    |
============================
Outputs & filters:
-------------------------------------
  0 - output(nil), filter(nil)
      columns([{t2: ({t2: (t2.a, t2.b, t2.c)}, {i2: (t2.b, t2.c, t2.a)})}]), 
      column_values([column_conv(INT,PS:(11,0),NOT NULL,__values.a)], [column_conv(VARCHAR,utf8mb4_general_ci,length:20,NOT NULL,__values.b)], [column_conv(DECIMAL_INT,
      PS:(20,10),NULL,__values.c)])
  1 - output([__values.a], [__values.b], [__values.c]), filter(nil)
      values({1, '222', 3.33}, {2, '222', 3.33}, {2, '333', 2.22}, {3, '3333', 1.11}, {5, '555', 5.55}, {6, '6666', 5.5}, {1, '1', 1}, {1, '2', 2}, {2, 
      '2.00', 2.00001}, {3, '3.0', 3.00001}, {4, 'A', 4.33}, {5, 'B', 5}, {6, 'AB', 6})
insert into t2 values(1, "222", 3.33),(2,"222",3.33),(2,"333",2.22),(3,"3333",1.11), (5, "555", 5.55), (6, "6666", 5.5),(1, '1', 1), (1, '2', 2), (2, '2.00', 2.00001), (3, '3.0', 3.00001), (4, "A", 4.33), (5, "B", 5), (6, "AB", 6);
EXPLAIN BASIC insert into t7 values(65, '222', '333', 5), (65, '444', '5.550', 1), (66, '3.0', '555', 3.00001), (66, '2', 'B', 2), (67, 'A', '1', 1);
Query Plan
============================
|ID|OPERATOR          |NAME|
----------------------------
|0 |DISTRIBUTED INSERT|    |
|1 |└─EXPRESSION      |    |
============================
Outputs & filters:
-------------------------------------
  0 - output(nil), filter(nil)
      columns([{t7: ({t7: (t7.a, t7.b, t7.c, t7.d)}, {i7: (t7.b, t7.c, t7.a)})}]), 
      column_values([column_conv(INT,PS:(10,0),NOT NULL,__values.a)], [column_conv(VARCHAR,utf8mb4_general_ci,length:10,NOT NULL,__values.b)], [column_conv(CHAR,
      utf8mb4_general_ci,length:20,NULL,__values.c)], [column_conv(DECIMAL_INT,PS:(20,10),NULL,__values.d)])
  1 - output([__values.a], [__values.b], [__values.c], [__values.d]), filter(nil)
      values({65, '222', '333', 5}, {65, '444', '5.550', 1}, {66, '3.0', '555', 3.00001}, {66, '2', 'B', 2}, {67, 'A', '1', 1})
insert into t7 values(65, '222', '333', 5), (65, '444', '5.550', 1), (66, '3.0', '555', 3.00001), (66, '2', 'B', 2), (67, 'A', '1', 1);
drop table if exists t8, t9;
create table t8(a int primary key, b int, c int, index idx(b,c) global) partition by hash(a) partitions 2;
create table t9(a int primary key, b int, c int, index idx(b,c) global) partition by hash(a) partitions 2;
Query Plan
============================
|ID|OPERATOR          |NAME|
----------------------------
|0 |DISTRIBUTED INSERT|    |
|1 |└─EXPRESSION      |    |
============================
Outputs & filters:
-------------------------------------
  0 - output(nil), filter(nil)
      columns([{t8: ({t8: (t8.a, t8.b, t8.c)}, {idx: (t8.b, t8.c, t8.a)})}]), 
      column_values([column_conv(INT,PS:(11,0),NOT NULL,__values.a)], [column_conv(INT,PS:(11,0),NULL,__values.b)], [column_conv(INT,PS:(11,0),NULL,__values.c)])
  1 - output([__values.a], [__values.b], [__values.c]), filter(nil)
      values({1, 2, 1})
Query Plan
============================
|ID|OPERATOR          |NAME|
----------------------------
|0 |DISTRIBUTED INSERT|    |
|1 |└─EXPRESSION      |    |
============================
Outputs & filters:
-------------------------------------
  0 - output(nil), filter(nil)
      columns([{t8: ({t8: (t8.a, t8.b, t8.c)}, {idx: (t8.b, t8.c, t8.a)})}]), 
      column_values([column_conv(INT,PS:(11,0),NOT NULL,__values.a)], [column_conv(INT,PS:(11,0),NULL,__values.b)], [column_conv(INT,PS:(11,0),NULL,__values.c)])
  1 - output([__values.a], [__values.b], [__values.c]), filter(nil)
      values({2, 2, 2})
Query Plan
============================
|ID|OPERATOR          |NAME|
----------------------------
|0 |DISTRIBUTED INSERT|    |
|1 |└─EXPRESSION      |    |
============================
Outputs & filters:
-------------------------------------
  0 - output(nil), filter(nil)
      columns([{t8: ({t8: (t8.a, t8.b, t8.c)}, {idx: (t8.b, t8.c, t8.a)})}]), 
      column_values([column_conv(INT,PS:(11,0),NOT NULL,__values.a)], [column_conv(INT,PS:(11,0),NULL,__values.b)], [column_conv(INT,PS:(11,0),NULL,__values.c)])
  1 - output([__values.a], [__values.b], [__values.c]), filter(nil)
      values({3, 2, 3})
Query Plan
============================
|ID|OPERATOR          |NAME|
----------------------------
|0 |DISTRIBUTED INSERT|    |
|1 |└─EXPRESSION      |    |
============================
Outputs & filters:
-------------------------------------
  0 - output(nil), filter(nil)
      columns([{t8: ({t8: (t8.a, t8.b, t8.c)}, {idx: (t8.b, t8.c, t8.a)})}]), 
      column_values([column_conv(INT,PS:(11,0),NOT NULL,__values.a)], [column_conv(INT,PS:(11,0),NULL,__values.b)], [column_conv(INT,PS:(11,0),NULL,__values.c)])
  1 - output([__values.a], [__values.b], [__values.c]), filter(nil)
      values({4, 4, 1})
Query Plan
============================
|ID|OPERATOR          |NAME|
----------------------------
|0 |DISTRIBUTED INSERT|    |
|1 |└─EXPRESSION      |    |
============================
Outputs & filters:
-------------------------------------
  0 - output(nil), filter(nil)
      columns([{t8: ({t8: (t8.a, t8.b, t8.c)}, {idx: (t8.b, t8.c, t8.a)})}]), 
      column_values([column_conv(INT,PS:(11,0),NOT NULL,__values.a)], [column_conv(INT,PS:(11,0),NULL,__values.b)], [column_conv(INT,PS:(11,0),NULL,__values.c)])
  1 - output([__values.a], [__values.b], [__values.c]), filter(nil)
      values({5, 4, 2})
Query Plan
============================
|ID|OPERATOR          |NAME|
----------------------------
|0 |DISTRIBUTED INSERT|    |
|1 |└─EXPRESSION      |    |
============================
Outputs & filters:
-------------------------------------
  0 - output(nil), filter(nil)
      columns([{t8: ({t8: (t8.a, t8.b, t8.c)}, {idx: (t8.b, t8.c, t8.a)})}]), 
      column_values([column_conv(INT,PS:(11,0),NOT NULL,__values.a)], [column_conv(INT,PS:(11,0),NULL,__values.b)], [column_conv(INT,PS:(11,0),NULL,__values.c)])
  1 - output([__values.a], [__values.b], [__values.c]), filter(nil)
      values({6, 4, 3})
Query Plan
============================
|ID|OPERATOR          |NAME|
----------------------------
|0 |DISTRIBUTED INSERT|    |
|1 |└─EXPRESSION      |    |
============================
Outputs & filters:
-------------------------------------
  0 - output(nil), filter(nil)
      columns([{t9: ({t9: (t9.a, t9.b, t9.c)}, {idx: (t9.b, t9.c, t9.a)})}]), 
      column_values([column_conv(INT,PS:(11,0),NOT NULL,__values.a)], [column_conv(INT,PS:(11,0),NULL,__values.b)], [column_conv(INT,PS:(11,0),NULL,__values.c)])
  1 - output([__values.a], [__values.b], [__values.c]), filter(nil)
      values({1, 2, 1})
Query Plan
============================
|ID|OPERATOR          |NAME|
----------------------------
|0 |DISTRIBUTED INSERT|    |
|1 |└─EXPRESSION      |    |
============================
Outputs & filters:
-------------------------------------
  0 - output(nil), filter(nil)
      columns([{t9: ({t9: (t9.a, t9.b, t9.c)}, {idx: (t9.b, t9.c, t9.a)})}]), 
      column_values([column_conv(INT,PS:(11,0),NOT NULL,__values.a)], [column_conv(INT,PS:(11,0),NULL,__values.b)], [column_conv(INT,PS:(11,0),NULL,__values.c)])
  1 - output([__values.a], [__values.b], [__values.c]), filter(nil)
      values({2, 2, 2})
Query Plan
============================
|ID|OPERATOR          |NAME|
----------------------------
|0 |DISTRIBUTED INSERT|    |
|1 |└─EXPRESSION      |    |
============================
Outputs & filters:
-------------------------------------
  0 - output(nil), filter(nil)
      columns([{t9: ({t9: (t9.a, t9.b, t9.c)}, {idx: (t9.b, t9.c, t9.a)})}]), 
      column_values([column_conv(INT,PS:(11,0),NOT NULL,__values.a)], [column_conv(INT,PS:(11,0),NULL,__values.b)], [column_conv(INT,PS:(11,0),NULL,__values.c)])
  1 - output([__values.a], [__values.b], [__values.c]), filter(nil)
      values({3, 2, 3})
Query Plan
============================
|ID|OPERATOR          |NAME|
----------------------------
|0 |DISTRIBUTED INSERT|    |
|1 |└─EXPRESSION      |    |
============================
Outputs & filters:
-------------------------------------
  0 - output(nil), filter(nil)
      columns([{t9: ({t9: (t9.a, t9.b, t9.c)}, {idx: (t9.b, t9.c, t9.a)})}]), 
      column_values([column_conv(INT,PS:(11,0),NOT NULL,__values.a)], [column_conv(INT,PS:(11,0),NULL,__values.b)], [column_conv(INT,PS:(11,0),NULL,__values.c)])
  1 - output([__values.a], [__values.b], [__values.c]), filter(nil)
      values({4, 3, 1})
Query Plan
============================
|ID|OPERATOR          |NAME|
----------------------------
|0 |DISTRIBUTED INSERT|    |
|1 |└─EXPRESSION      |    |
============================
Outputs & filters:
-------------------------------------
  0 - output(nil), filter(nil)
      columns([{t9: ({t9: (t9.a, t9.b, t9.c)}, {idx: (t9.b, t9.c, t9.a)})}]), 
      column_values([column_conv(INT,PS:(11,0),NOT NULL,__values.a)], [column_conv(INT,PS:(11,0),NULL,__values.b)], [column_conv(INT,PS:(11,0),NULL,__values.c)])
  1 - output([__values.a], [__values.b], [__values.c]), filter(nil)
      values({5, 4, 1})
Query Plan
============================
|ID|OPERATOR          |NAME|
----------------------------
|0 |DISTRIBUTED INSERT|    |
|1 |└─EXPRESSION      |    |
============================
Outputs & filters:
-------------------------------------
  0 - output(nil), filter(nil)
      columns([{t9: ({t9: (t9.a, t9.b, t9.c)}, {idx: (t9.b, t9.c, t9.a)})}]), 
      column_values([column_conv(INT,PS:(11,0),NOT NULL,__values.a)], [column_conv(INT,PS:(11,0),NULL,__values.b)], [column_conv(INT,PS:(11,0),NULL,__values.c)])
  1 - output([__values.a], [__values.b], [__values.c]), filter(nil)
      values({6, 4, 2})
Query Plan
============================
|ID|OPERATOR          |NAME|
----------------------------
|0 |DISTRIBUTED INSERT|    |
|1 |└─EXPRESSION      |    |
============================
Outputs & filters:
-------------------------------------
  0 - output(nil), filter(nil)
      columns([{t9: ({t9: (t9.a, t9.b, t9.c)}, {idx: (t9.b, t9.c, t9.a)})}]), 
      column_values([column_conv(INT,PS:(11,0),NOT NULL,__values.a)], [column_conv(INT,PS:(11,0),NULL,__values.b)], [column_conv(INT,PS:(11,0),NULL,__values.c)])
  1 - output([__values.a], [__values.b], [__values.c]), filter(nil)
      values({7, 4, 3})

************ 测试full join
EXPLAIN BASIC select /*+use_merge(t2,t7)*/* from t2 full join t7 on t2.b = t7.a and t2.c = t7.d order by t2.a,t2.b,t7.a,t7.b;
Query Plan
=============================================
|ID|OPERATOR                       |NAME    |
---------------------------------------------
|0 |SORT                           |        |
|1 |└─MERGE FULL OUTER JOIN        |        |
|2 |  ├─PX COORDINATOR MERGE SORT  |        |
|3 |  │ └─EXCHANGE OUT DISTR       |:EX10000|
|4 |  │   └─SORT                   |        |
|5 |  │     └─PX PARTITION ITERATOR|        |
|6 |  │       └─TABLE FULL SCAN    |t7      |
|7 |  └─SORT                       |        |
|8 |    └─TABLE FULL SCAN          |t2(i2)  |
=============================================
Outputs & filters:
-------------------------------------
  0 - output([t2.a], [t2.b], [t2.c], [t7.a], [t7.b], [t7.c], [t7.d]), filter(nil), rowset=16
      sort_keys([t2.a, ASC], [t2.b, ASC], [t7.a, ASC], [t7.b, ASC])
  1 - output([t2.a], [t2.b], [t7.a], [t7.b], [t2.c], [t7.c], [t7.d]), filter(nil), rowset=16
      equal_conds([cast(t2.b, DECIMAL(-1, -1)) = cast(t7.a, DECIMAL(10, 0))], [t2.c = t7.d]), other_conds(nil)
      merge_directions([ASC], [ASC])
  2 - output([t7.a], [t7.b], [t7.c], [t7.d], [cast(t7.a, DECIMAL(10, 0))]), filter(nil), rowset=16
      sort_keys([cast(t7.a, DECIMAL(10, 0)), ASC], [t7.d, ASC])
  3 - output([t7.a], [t7.b], [t7.c], [t7.d], [cast(t7.a, DECIMAL(10, 0))]), filter(nil), rowset=16
      dop=1
  4 - output([t7.a], [t7.b], [t7.c], [t7.d], [cast(t7.a, DECIMAL(10, 0))]), filter(nil), rowset=16
      sort_keys([cast(t7.a, DECIMAL(10, 0)), ASC], [t7.d, ASC])
  5 - output([t7.a], [t7.b], [t7.d], [t7.c], [cast(t7.a, DECIMAL(10, 0))]), filter(nil), rowset=16
      force partition granule
  6 - output([t7.a], [t7.b], [t7.d], [t7.c], [cast(t7.a, DECIMAL(10, 0))]), filter(nil), rowset=16
      access([t7.a], [t7.b], [t7.d], [t7.c]), partitions(p[0-1])
      is_index_back=false, is_global_index=false, 
      range_key([t7.a], [t7.b]), range(MIN,MIN ; MAX,MAX)always true
  7 - output([t2.a], [t2.b], [t2.c], [cast(t2.b, DECIMAL(-1, -1))]), filter(nil), rowset=16
      sort_keys([cast(t2.b, DECIMAL(-1, -1)), ASC], [t2.c, ASC])
  8 - output([t2.a], [t2.b], [t2.c], [cast(t2.b, DECIMAL(-1, -1))]), filter(nil), rowset=16
      access([t2.a], [t2.b], [t2.c]), partitions(p0)
      is_index_back=false, is_global_index=true, 
      range_key([t2.b], [t2.c], [t2.a]), range(MIN,MIN,MIN ; MAX,MAX,MAX)always true
select /*+use_merge(t2,t7)*/* from t2 full join t7 on t2.b = t7.a and t2.c = t7.d order by t2.a,t2.b,t7.a,t7.b;
a	b	c	a	b	c	d
NULL	NULL	NULL	65	222	333	5.0000000000
NULL	NULL	NULL	65	444	5.550	1.0000000000
NULL	NULL	NULL	66	2	B	2.0000000000
NULL	NULL	NULL	66	3.0	555	3.0000100000
NULL	NULL	NULL	67	A	1	1.0000000000
1	1	1.0000000000	NULL	NULL	NULL	NULL
1	2	2.0000000000	NULL	NULL	NULL	NULL
1	222	3.3300000000	NULL	NULL	NULL	NULL
2	2.00	2.0000100000	NULL	NULL	NULL	NULL
2	222	3.3300000000	NULL	NULL	NULL	NULL
2	333	2.2200000000	NULL	NULL	NULL	NULL
3	3.0	3.0000100000	NULL	NULL	NULL	NULL
3	3333	1.1100000000	NULL	NULL	NULL	NULL
4	A	4.3300000000	NULL	NULL	NULL	NULL
5	555	5.5500000000	NULL	NULL	NULL	NULL
5	B	5.0000000000	NULL	NULL	NULL	NULL
6	6666	5.5000000000	NULL	NULL	NULL	NULL
6	AB	6.0000000000	NULL	NULL	NULL	NULL
Warnings:
Warning	1292	Truncated incorrect DECIMAL value: 'A'
Warning	1292	Truncated incorrect DECIMAL value: 'AB'
Warning	1292	Truncated incorrect DECIMAL value: 'B'

EXPLAIN BASIC select /*+use_hash(t2,t7)*/* from t2 full join t7 on t2.b = t7.a and t2.c = t7.d order by t2.a,t2.b,t7.a,t7.b;
Query Plan
===========================================
|ID|OPERATOR                     |NAME    |
-------------------------------------------
|0 |SORT                         |        |
|1 |└─HASH FULL OUTER JOIN       |        |
|2 |  ├─PX COORDINATOR           |        |
|3 |  │ └─EXCHANGE OUT DISTR     |:EX10000|
|4 |  │   └─PX PARTITION ITERATOR|        |
|5 |  │     └─TABLE FULL SCAN    |t7      |
|6 |  └─TABLE FULL SCAN          |t2(i2)  |
===========================================
Outputs & filters:
-------------------------------------
  0 - output([t2.a], [t2.b], [t2.c], [t7.a], [t7.b], [t7.c], [t7.d]), filter(nil), rowset=16
      sort_keys([t2.a, ASC], [t2.b, ASC], [t7.a, ASC], [t7.b, ASC])
  1 - output([t2.a], [t2.b], [t7.a], [t7.b], [t2.c], [t7.c], [t7.d]), filter(nil), rowset=16
      equal_conds([cast(t2.b, DECIMAL(-1, -1)) = cast(t7.a, DECIMAL(10, 0))], [t2.c = t7.d]), other_conds(nil)
  2 - output([t7.a], [t7.b], [t7.c], [t7.d]), filter(nil), rowset=16
  3 - output([t7.a], [t7.b], [t7.c], [t7.d]), filter(nil), rowset=16
      dop=1
  4 - output([t7.a], [t7.b], [t7.d], [t7.c]), filter(nil), rowset=16
      force partition granule
  5 - output([t7.a], [t7.b], [t7.d], [t7.c]), filter(nil), rowset=16
      access([t7.a], [t7.b], [t7.d], [t7.c]), partitions(p[0-1])
      is_index_back=false, is_global_index=false, 
      range_key([t7.a], [t7.b]), range(MIN,MIN ; MAX,MAX)always true
  6 - output([t2.a], [t2.b], [t2.c]), filter(nil), rowset=16
      access([t2.a], [t2.b], [t2.c]), partitions(p0)
      is_index_back=false, is_global_index=true, 
      range_key([t2.b], [t2.c], [t2.a]), range(MIN,MIN,MIN ; MAX,MAX,MAX)always true
select /*+use_hash(t2,t7)*/* from t2 full join t7 on t2.b = t7.a and t2.c = t7.d order by t2.a,t2.b,t7.a,t7.b;
a	b	c	a	b	c	d
NULL	NULL	NULL	65	222	333	5.0000000000
NULL	NULL	NULL	65	444	5.550	1.0000000000
NULL	NULL	NULL	66	2	B	2.0000000000
NULL	NULL	NULL	66	3.0	555	3.0000100000
NULL	NULL	NULL	67	A	1	1.0000000000
1	1	1.0000000000	NULL	NULL	NULL	NULL
1	2	2.0000000000	NULL	NULL	NULL	NULL
1	222	3.3300000000	NULL	NULL	NULL	NULL
2	2.00	2.0000100000	NULL	NULL	NULL	NULL
2	222	3.3300000000	NULL	NULL	NULL	NULL
2	333	2.2200000000	NULL	NULL	NULL	NULL
3	3.0	3.0000100000	NULL	NULL	NULL	NULL
3	3333	1.1100000000	NULL	NULL	NULL	NULL
4	A	4.3300000000	NULL	NULL	NULL	NULL
5	555	5.5500000000	NULL	NULL	NULL	NULL
5	B	5.0000000000	NULL	NULL	NULL	NULL
6	6666	5.5000000000	NULL	NULL	NULL	NULL
6	AB	6.0000000000	NULL	NULL	NULL	NULL
Warnings:
Warning	1292	Truncated incorrect DECIMAL value: 'A'
Warning	1292	Truncated incorrect DECIMAL value: 'AB'
Warning	1292	Truncated incorrect DECIMAL value: 'B'

EXPLAIN BASIC select /*+use_nl(t2,t7)*/* from t2 full join t7 on t2.b = t7.a and t2.c = t7.d order by t2.a,t2.b,t7.a,t7.b;
Query Plan
===========================================
|ID|OPERATOR                     |NAME    |
-------------------------------------------
|0 |SORT                         |        |
|1 |└─HASH FULL OUTER JOIN       |        |
|2 |  ├─PX COORDINATOR           |        |
|3 |  │ └─EXCHANGE OUT DISTR     |:EX10000|
|4 |  │   └─PX PARTITION ITERATOR|        |
|5 |  │     └─TABLE FULL SCAN    |t7      |
|6 |  └─TABLE FULL SCAN          |t2(i2)  |
===========================================
Outputs & filters:
-------------------------------------
  0 - output([t2.a], [t2.b], [t2.c], [t7.a], [t7.b], [t7.c], [t7.d]), filter(nil), rowset=16
      sort_keys([t2.a, ASC], [t2.b, ASC], [t7.a, ASC], [t7.b, ASC])
  1 - output([t2.a], [t2.b], [t7.a], [t7.b], [t2.c], [t7.c], [t7.d]), filter(nil), rowset=16
      equal_conds([cast(t2.b, DECIMAL(-1, -1)) = cast(t7.a, DECIMAL(10, 0))], [t2.c = t7.d]), other_conds(nil)
  2 - output([t7.a], [t7.b], [t7.c], [t7.d]), filter(nil), rowset=16
  3 - output([t7.a], [t7.b], [t7.c], [t7.d]), filter(nil), rowset=16
      dop=1
  4 - output([t7.a], [t7.b], [t7.d], [t7.c]), filter(nil), rowset=16
      force partition granule
  5 - output([t7.a], [t7.b], [t7.d], [t7.c]), filter(nil), rowset=16
      access([t7.a], [t7.b], [t7.d], [t7.c]), partitions(p[0-1])
      is_index_back=false, is_global_index=false, 
      range_key([t7.a], [t7.b]), range(MIN,MIN ; MAX,MAX)always true
  6 - output([t2.a], [t2.b], [t2.c]), filter(nil), rowset=16
      access([t2.a], [t2.b], [t2.c]), partitions(p0)
      is_index_back=false, is_global_index=true, 
      range_key([t2.b], [t2.c], [t2.a]), range(MIN,MIN,MIN ; MAX,MAX,MAX)always true
select /*+use_nl(t2,t7)*/* from t2 full join t7 on t2.b = t7.a and t2.c = t7.d order by t2.a,t2.b,t7.a,t7.b;
a	b	c	a	b	c	d
NULL	NULL	NULL	65	222	333	5.0000000000
NULL	NULL	NULL	65	444	5.550	1.0000000000
NULL	NULL	NULL	66	2	B	2.0000000000
NULL	NULL	NULL	66	3.0	555	3.0000100000
NULL	NULL	NULL	67	A	1	1.0000000000
1	1	1.0000000000	NULL	NULL	NULL	NULL
1	2	2.0000000000	NULL	NULL	NULL	NULL
1	222	3.3300000000	NULL	NULL	NULL	NULL
2	2.00	2.0000100000	NULL	NULL	NULL	NULL
2	222	3.3300000000	NULL	NULL	NULL	NULL
2	333	2.2200000000	NULL	NULL	NULL	NULL
3	3.0	3.0000100000	NULL	NULL	NULL	NULL
3	3333	1.1100000000	NULL	NULL	NULL	NULL
4	A	4.3300000000	NULL	NULL	NULL	NULL
5	555	5.5500000000	NULL	NULL	NULL	NULL
5	B	5.0000000000	NULL	NULL	NULL	NULL
6	6666	5.5000000000	NULL	NULL	NULL	NULL
6	AB	6.0000000000	NULL	NULL	NULL	NULL
Warnings:
Warning	1292	Truncated incorrect DECIMAL value: 'A'
Warning	1292	Truncated incorrect DECIMAL value: 'AB'
Warning	1292	Truncated incorrect DECIMAL value: 'B'
************ 测试right join

EXPLAIN BASIC select /*+use_merge(t2,t7)*/* from t2 right join t7 on t2.b = t7.a and t2.c = t7.d order by t2.a,t2.b,t7.a,t7.b;
Query Plan
=============================================
|ID|OPERATOR                       |NAME    |
---------------------------------------------
|0 |SORT                           |        |
|1 |└─MERGE OUTER JOIN             |        |
|2 |  ├─PX COORDINATOR MERGE SORT  |        |
|3 |  │ └─EXCHANGE OUT DISTR       |:EX10000|
|4 |  │   └─SORT                   |        |
|5 |  │     └─PX PARTITION ITERATOR|        |
|6 |  │       └─TABLE FULL SCAN    |t7      |
|7 |  └─SORT                       |        |
|8 |    └─TABLE FULL SCAN          |t2(i2)  |
=============================================
Outputs & filters:
-------------------------------------
  0 - output([t2.a], [t2.b], [t2.c], [t7.a], [t7.b], [t7.c], [t7.d]), filter(nil), rowset=16
      sort_keys([t2.a, ASC], [t2.b, ASC], [t7.a, ASC], [t7.b, ASC])
  1 - output([t2.a], [t2.b], [t7.a], [t7.b], [t2.c], [t7.c], [t7.d]), filter(nil), rowset=16
      equal_conds([cast(t2.b, DECIMAL(-1, -1)) = cast(t7.a, DECIMAL(10, 0))], [t2.c = t7.d]), other_conds(nil)
      merge_directions([ASC], [ASC])
  2 - output([t7.a], [t7.b], [t7.c], [t7.d], [cast(t7.a, DECIMAL(10, 0))]), filter(nil), rowset=16
      sort_keys([cast(t7.a, DECIMAL(10, 0)), ASC], [t7.d, ASC])
  3 - output([t7.a], [t7.b], [t7.c], [t7.d], [cast(t7.a, DECIMAL(10, 0))]), filter(nil), rowset=16
      dop=1
  4 - output([t7.a], [t7.b], [t7.c], [t7.d], [cast(t7.a, DECIMAL(10, 0))]), filter(nil), rowset=16
      sort_keys([cast(t7.a, DECIMAL(10, 0)), ASC], [t7.d, ASC])
  5 - output([t7.a], [t7.b], [t7.d], [t7.c], [cast(t7.a, DECIMAL(10, 0))]), filter(nil), rowset=16
      force partition granule
  6 - output([t7.a], [t7.b], [t7.d], [t7.c], [cast(t7.a, DECIMAL(10, 0))]), filter(nil), rowset=16
      access([t7.a], [t7.b], [t7.d], [t7.c]), partitions(p[0-1])
      is_index_back=false, is_global_index=false, 
      range_key([t7.a], [t7.b]), range(MIN,MIN ; MAX,MAX)always true
  7 - output([t2.a], [t2.b], [t2.c], [cast(t2.b, DECIMAL(-1, -1))]), filter(nil), rowset=16
      sort_keys([cast(t2.b, DECIMAL(-1, -1)), ASC], [t2.c, ASC])
  8 - output([t2.a], [t2.b], [t2.c], [cast(t2.b, DECIMAL(-1, -1))]), filter(nil), rowset=16
      access([t2.a], [t2.b], [t2.c]), partitions(p0)
      is_index_back=false, is_global_index=true, 
      range_key([t2.b], [t2.c], [t2.a]), range(MIN,MIN,MIN ; MAX,MAX,MAX)always true
select /*+use_merge(t2,t7)*/* from t2 right join t7 on t2.b = t7.a and t2.c = t7.d order by t2.a,t2.b,t7.a,t7.b;
a	b	c	a	b	c	d
NULL	NULL	NULL	65	222	333	5.0000000000
NULL	NULL	NULL	65	444	5.550	1.0000000000
NULL	NULL	NULL	66	2	B	2.0000000000
NULL	NULL	NULL	66	3.0	555	3.0000100000
NULL	NULL	NULL	67	A	1	1.0000000000
Warnings:
Warning	1292	Truncated incorrect DECIMAL value: 'A'
Warning	1292	Truncated incorrect DECIMAL value: 'AB'
Warning	1292	Truncated incorrect DECIMAL value: 'B'

EXPLAIN BASIC select /*+use_hash(t2,t7)*/* from t2 right join t7 on t2.b = t7.a and t2.c = t7.d order by t2.a,t2.b,t7.a,t7.b;
Query Plan
===========================================
|ID|OPERATOR                     |NAME    |
-------------------------------------------
|0 |SORT                         |        |
|1 |└─HASH OUTER JOIN            |        |
|2 |  ├─PX COORDINATOR           |        |
|3 |  │ └─EXCHANGE OUT DISTR     |:EX10000|
|4 |  │   └─PX PARTITION ITERATOR|        |
|5 |  │     └─TABLE FULL SCAN    |t7      |
|6 |  └─TABLE FULL SCAN          |t2(i2)  |
===========================================
Outputs & filters:
-------------------------------------
  0 - output([t2.a], [t2.b], [t2.c], [t7.a], [t7.b], [t7.c], [t7.d]), filter(nil), rowset=16
      sort_keys([t2.a, ASC], [t2.b, ASC], [t7.a, ASC], [t7.b, ASC])
  1 - output([t2.a], [t2.b], [t7.a], [t7.b], [t2.c], [t7.c], [t7.d]), filter(nil), rowset=16
      equal_conds([cast(t2.b, DECIMAL(-1, -1)) = cast(t7.a, DECIMAL(10, 0))], [t2.c = t7.d]), other_conds(nil)
  2 - output([t7.a], [t7.b], [t7.c], [t7.d]), filter(nil), rowset=16
  3 - output([t7.a], [t7.b], [t7.c], [t7.d]), filter(nil), rowset=16
      dop=1
  4 - output([t7.a], [t7.b], [t7.d], [t7.c]), filter(nil), rowset=16
      force partition granule
  5 - output([t7.a], [t7.b], [t7.d], [t7.c]), filter(nil), rowset=16
      access([t7.a], [t7.b], [t7.d], [t7.c]), partitions(p[0-1])
      is_index_back=false, is_global_index=false, 
      range_key([t7.a], [t7.b]), range(MIN,MIN ; MAX,MAX)always true
  6 - output([t2.a], [t2.b], [t2.c]), filter(nil), rowset=16
      access([t2.a], [t2.b], [t2.c]), partitions(p0)
      is_index_back=false, is_global_index=true, 
      range_key([t2.b], [t2.c], [t2.a]), range(MIN,MIN,MIN ; MAX,MAX,MAX)always true
select /*+use_hash(t2,t7)*/* from t2 right join t7 on t2.b = t7.a and t2.c = t7.d order by t2.a,t2.b,t7.a,t7.b;
a	b	c	a	b	c	d
NULL	NULL	NULL	65	222	333	5.0000000000
NULL	NULL	NULL	65	444	5.550	1.0000000000
NULL	NULL	NULL	66	2	B	2.0000000000
NULL	NULL	NULL	66	3.0	555	3.0000100000
NULL	NULL	NULL	67	A	1	1.0000000000
Warnings:
Warning	1292	Truncated incorrect DECIMAL value: 'A'
Warning	1292	Truncated incorrect DECIMAL value: 'AB'
Warning	1292	Truncated incorrect DECIMAL value: 'B'

EXPLAIN BASIC select /*+use_nl(t2,t7)*/* from t2 right join t7 on t2.b = t7.a and t2.c = t7.d order by t2.a,t2.b,t7.a,t7.b;
Query Plan
===========================================
|ID|OPERATOR                     |NAME    |
-------------------------------------------
|0 |SORT                         |        |
|1 |└─NESTED-LOOP OUTER JOIN     |        |
|2 |  ├─PX COORDINATOR           |        |
|3 |  │ └─EXCHANGE OUT DISTR     |:EX10000|
|4 |  │   └─PX PARTITION ITERATOR|        |
|5 |  │     └─TABLE FULL SCAN    |t7      |
|6 |  └─MATERIAL                 |        |
|7 |    └─TABLE FULL SCAN        |t2(i2)  |
===========================================
Outputs & filters:
-------------------------------------
  0 - output([t2.a], [t2.b], [t2.c], [t7.a], [t7.b], [t7.c], [t7.d]), filter(nil), rowset=16
      sort_keys([t2.a, ASC], [t2.b, ASC], [t7.a, ASC], [t7.b, ASC])
  1 - output([t2.a], [t2.b], [t7.a], [t7.b], [t2.c], [t7.c], [t7.d]), filter(nil), rowset=16
      conds([t2.c = t7.d], [cast(t2.b, DECIMAL(-1, -1)) = cast(t7.a, DECIMAL(10, 0))]), nl_params_(nil), use_batch=false
  2 - output([t7.a], [t7.b], [t7.c], [t7.d]), filter(nil), rowset=16
  3 - output([t7.a], [t7.b], [t7.c], [t7.d]), filter(nil), rowset=16
      dop=1
  4 - output([t7.a], [t7.b], [t7.d], [t7.c]), filter(nil), rowset=16
      force partition granule
  5 - output([t7.a], [t7.b], [t7.d], [t7.c]), filter(nil), rowset=16
      access([t7.a], [t7.b], [t7.d], [t7.c]), partitions(p[0-1])
      is_index_back=false, is_global_index=false, 
      range_key([t7.a], [t7.b]), range(MIN,MIN ; MAX,MAX)always true
  6 - output([t2.a], [t2.b], [t2.c]), filter(nil), rowset=16
  7 - output([t2.a], [t2.b], [t2.c]), filter(nil), rowset=16
      access([t2.a], [t2.b], [t2.c]), partitions(p0)
      is_index_back=false, is_global_index=true, 
      range_key([t2.b], [t2.c], [t2.a]), range(MIN,MIN,MIN ; MAX,MAX,MAX)always true
select /*+use_nl(t2,t7)*/* from t2 right join t7 on t2.b = t7.a and t2.c = t7.d order by t2.a,t2.b,t7.a,t7.b;
a	b	c	a	b	c	d
NULL	NULL	NULL	65	222	333	5.0000000000
NULL	NULL	NULL	65	444	5.550	1.0000000000
NULL	NULL	NULL	66	2	B	2.0000000000
NULL	NULL	NULL	66	3.0	555	3.0000100000
NULL	NULL	NULL	67	A	1	1.0000000000
Warnings:
Warning	1292	Truncated incorrect DECIMAL value: 'B'
EXPLAIN BASIC select /*+leading(t8, t9)*/ t8.b,t8.c,t9.b,t9.c from t8 right join t9 on t8.b = t9.b;
Query Plan
====================================
|ID|OPERATOR               |NAME   |
------------------------------------
|0 |MERGE RIGHT OUTER JOIN |       |
|1 |├─TABLE FULL SCAN      |t8(idx)|
|2 |└─TABLE FULL SCAN      |t9(idx)|
====================================
Outputs & filters:
-------------------------------------
  0 - output([t8.b], [t8.c], [t9.b], [t9.c]), filter(nil), rowset=16
      equal_conds([t8.b = t9.b]), other_conds(nil)
      merge_directions([ASC])
  1 - output([t8.b], [t8.c]), filter(nil), rowset=16
      access([t8.b], [t8.c]), partitions(p0)
      is_index_back=false, is_global_index=true, 
      range_key([t8.b], [t8.c], [t8.a]), range(MIN,MIN,MIN ; MAX,MAX,MAX)always true
  2 - output([t9.b], [t9.c]), filter(nil), rowset=16
      access([t9.b], [t9.c]), partitions(p0)
      is_index_back=false, is_global_index=true, 
      range_key([t9.b], [t9.c], [t9.a]), range(MIN,MIN,MIN ; MAX,MAX,MAX)always true
select /*+leading(t8, t9)*/ t8.b,t8.c,t9.b,t9.c from t8 right join t9 on t8.b = t9.b;
b	c	b	c
2	1	2	1
2	2	2	1
2	3	2	1
2	1	2	2
2	2	2	2
2	3	2	2
2	1	2	3
2	2	2	3
2	3	2	3
NULL	NULL	3	1
4	1	4	1
4	2	4	1
4	3	4	1
4	1	4	2
4	2	4	2
4	3	4	2
4	1	4	3
4	2	4	3
4	3	4	3
************ 测试left join

EXPLAIN BASIC select /*+use_merge(t2,t7)*/* from t2 left join t7 on t2.b = t7.a and t2.c = t7.d order by t2.a,t2.b,t7.a,t7.b;
Query Plan
=============================================
|ID|OPERATOR                       |NAME    |
---------------------------------------------
|0 |SORT                           |        |
|1 |└─MERGE RIGHT OUTER JOIN       |        |
|2 |  ├─PX COORDINATOR MERGE SORT  |        |
|3 |  │ └─EXCHANGE OUT DISTR       |:EX10000|
|4 |  │   └─SORT                   |        |
|5 |  │     └─PX PARTITION ITERATOR|        |
|6 |  │       └─TABLE FULL SCAN    |t7      |
|7 |  └─SORT                       |        |
|8 |    └─TABLE FULL SCAN          |t2(i2)  |
=============================================
Outputs & filters:
-------------------------------------
  0 - output([t2.a], [t2.b], [t2.c], [t7.a], [t7.b], [t7.c], [t7.d]), filter(nil), rowset=16
      sort_keys([t2.a, ASC], [t2.b, ASC], [t7.a, ASC], [t7.b, ASC])
  1 - output([t2.a], [t2.b], [t7.a], [t7.b], [t2.c], [t7.c], [t7.d]), filter(nil), rowset=16
      equal_conds([cast(t2.b, DECIMAL(-1, -1)) = cast(t7.a, DECIMAL(10, 0))], [t2.c = t7.d]), other_conds(nil)
      merge_directions([ASC], [ASC])
  2 - output([t7.a], [t7.b], [t7.c], [t7.d], [cast(t7.a, DECIMAL(10, 0))]), filter(nil), rowset=16
      sort_keys([cast(t7.a, DECIMAL(10, 0)), ASC], [t7.d, ASC])
  3 - output([t7.a], [t7.b], [t7.c], [t7.d], [cast(t7.a, DECIMAL(10, 0))]), filter(nil), rowset=16
      dop=1
  4 - output([t7.a], [t7.b], [t7.c], [t7.d], [cast(t7.a, DECIMAL(10, 0))]), filter(nil), rowset=16
      sort_keys([cast(t7.a, DECIMAL(10, 0)), ASC], [t7.d, ASC])
  5 - output([t7.a], [t7.b], [t7.d], [t7.c], [cast(t7.a, DECIMAL(10, 0))]), filter(nil), rowset=16
      force partition granule
  6 - output([t7.a], [t7.b], [t7.d], [t7.c], [cast(t7.a, DECIMAL(10, 0))]), filter(nil), rowset=16
      access([t7.a], [t7.b], [t7.d], [t7.c]), partitions(p[0-1])
      is_index_back=false, is_global_index=false, 
      range_key([t7.a], [t7.b]), range(MIN,MIN ; MAX,MAX)always true
  7 - output([t2.a], [t2.b], [t2.c], [cast(t2.b, DECIMAL(-1, -1))]), filter(nil), rowset=16
      sort_keys([cast(t2.b, DECIMAL(-1, -1)), ASC], [t2.c, ASC])
  8 - output([t2.a], [t2.b], [t2.c], [cast(t2.b, DECIMAL(-1, -1))]), filter(nil), rowset=16
      access([t2.a], [t2.b], [t2.c]), partitions(p0)
      is_index_back=false, is_global_index=true, 
      range_key([t2.b], [t2.c], [t2.a]), range(MIN,MIN,MIN ; MAX,MAX,MAX)always true
select /*+use_merge(t2,t7)*/* from t2 left join t7 on t2.b = t7.a and t2.c = t7.d order by t2.a,t2.b,t7.a,t7.b;
a	b	c	a	b	c	d
1	1	1.0000000000	NULL	NULL	NULL	NULL
1	2	2.0000000000	NULL	NULL	NULL	NULL
1	222	3.3300000000	NULL	NULL	NULL	NULL
2	2.00	2.0000100000	NULL	NULL	NULL	NULL
2	222	3.3300000000	NULL	NULL	NULL	NULL
2	333	2.2200000000	NULL	NULL	NULL	NULL
3	3.0	3.0000100000	NULL	NULL	NULL	NULL
3	3333	1.1100000000	NULL	NULL	NULL	NULL
4	A	4.3300000000	NULL	NULL	NULL	NULL
5	555	5.5500000000	NULL	NULL	NULL	NULL
5	B	5.0000000000	NULL	NULL	NULL	NULL
6	6666	5.5000000000	NULL	NULL	NULL	NULL
6	AB	6.0000000000	NULL	NULL	NULL	NULL
Warnings:
Warning	1292	Truncated incorrect DECIMAL value: 'A'
Warning	1292	Truncated incorrect DECIMAL value: 'AB'
Warning	1292	Truncated incorrect DECIMAL value: 'B'

EXPLAIN BASIC select /*+use_hash(t2,t7)*/* from t2 left join t7 on t2.b = t7.a and t2.c = t7.d order by t2.a,t2.b,t7.a,t7.b;
Query Plan
===========================================
|ID|OPERATOR                     |NAME    |
-------------------------------------------
|0 |SORT                         |        |
|1 |└─HASH RIGHT OUTER JOIN      |        |
|2 |  ├─PX COORDINATOR           |        |
|3 |  │ └─EXCHANGE OUT DISTR     |:EX10000|
|4 |  │   └─PX PARTITION ITERATOR|        |
|5 |  │     └─TABLE FULL SCAN    |t7      |
|6 |  └─TABLE FULL SCAN          |t2(i2)  |
===========================================
Outputs & filters:
-------------------------------------
  0 - output([t2.a], [t2.b], [t2.c], [t7.a], [t7.b], [t7.c], [t7.d]), filter(nil), rowset=16
      sort_keys([t2.a, ASC], [t2.b, ASC], [t7.a, ASC], [t7.b, ASC])
  1 - output([t2.a], [t2.b], [t7.a], [t7.b], [t2.c], [t7.c], [t7.d]), filter(nil), rowset=16
      equal_conds([cast(t2.b, DECIMAL(-1, -1)) = cast(t7.a, DECIMAL(10, 0))], [t2.c = t7.d]), other_conds(nil)
  2 - output([t7.a], [t7.b], [t7.c], [t7.d]), filter(nil), rowset=16
  3 - output([t7.a], [t7.b], [t7.c], [t7.d]), filter(nil), rowset=16
      dop=1
  4 - output([t7.a], [t7.b], [t7.d], [t7.c]), filter(nil), rowset=16
      force partition granule
  5 - output([t7.a], [t7.b], [t7.d], [t7.c]), filter(nil), rowset=16
      access([t7.a], [t7.b], [t7.d], [t7.c]), partitions(p[0-1])
      is_index_back=false, is_global_index=false, 
      range_key([t7.a], [t7.b]), range(MIN,MIN ; MAX,MAX)always true
  6 - output([t2.a], [t2.b], [t2.c]), filter(nil), rowset=16
      access([t2.a], [t2.b], [t2.c]), partitions(p0)
      is_index_back=false, is_global_index=true, 
      range_key([t2.b], [t2.c], [t2.a]), range(MIN,MIN,MIN ; MAX,MAX,MAX)always true
select /*+use_hash(t2,t7)*/* from t2 left join t7 on t2.b = t7.a and t2.c = t7.d order by t2.a,t2.b,t7.a,t7.b;
a	b	c	a	b	c	d
1	1	1.0000000000	NULL	NULL	NULL	NULL
1	2	2.0000000000	NULL	NULL	NULL	NULL
1	222	3.3300000000	NULL	NULL	NULL	NULL
2	2.00	2.0000100000	NULL	NULL	NULL	NULL
2	222	3.3300000000	NULL	NULL	NULL	NULL
2	333	2.2200000000	NULL	NULL	NULL	NULL
3	3.0	3.0000100000	NULL	NULL	NULL	NULL
3	3333	1.1100000000	NULL	NULL	NULL	NULL
4	A	4.3300000000	NULL	NULL	NULL	NULL
5	555	5.5500000000	NULL	NULL	NULL	NULL
5	B	5.0000000000	NULL	NULL	NULL	NULL
6	6666	5.5000000000	NULL	NULL	NULL	NULL
6	AB	6.0000000000	NULL	NULL	NULL	NULL
Warnings:
Warning	1292	Truncated incorrect DECIMAL value: 'A'
Warning	1292	Truncated incorrect DECIMAL value: 'AB'
Warning	1292	Truncated incorrect DECIMAL value: 'B'

EXPLAIN BASIC select /*+use_nl(t2,t7)*/* from t2 left join t7 on t2.b = t7.a and t2.c = t7.d order by t2.a,t2.b,t7.a,t7.b;
Query Plan
============================================
|ID|OPERATOR                        |NAME  |
--------------------------------------------
|0 |SORT                            |      |
|1 |└─NESTED-LOOP OUTER JOIN        |      |
|2 |  ├─TABLE FULL SCAN             |t2(i2)|
|3 |  └─DISTRIBUTED TABLE RANGE SCAN|t7    |
============================================
Outputs & filters:
-------------------------------------
  0 - output([t2.a], [t2.b], [t2.c], [t7.a], [t7.b], [t7.c], [t7.d]), filter(nil), rowset=16
      sort_keys([t2.a, ASC], [t2.b, ASC], [t7.a, ASC], [t7.b, ASC])
  1 - output([t2.a], [t2.b], [t7.a], [t7.b], [t2.c], [t7.c], [t7.d]), filter(nil), rowset=16
      conds(nil), nl_params_([t2.b(:0)], [t2.c(:1)]), use_batch=true
  2 - output([t2.a], [t2.b], [t2.c]), filter(nil), rowset=16
      access([t2.a], [t2.b], [t2.c]), partitions(p0)
      is_index_back=false, is_global_index=true, 
      range_key([t2.b], [t2.c], [t2.a]), range(MIN,MIN,MIN ; MAX,MAX,MAX)always true
  3 - output([t7.a], [t7.b], [t7.d], [t7.c]), filter([:1 = t7.d]), rowset=16
      access([GROUP_ID], [t7.a], [t7.b], [t7.d], [t7.c]), partitions(p[0-1])
      is_index_back=false, is_global_index=false, filter_before_indexback[false], 
      range_key([t7.a], [t7.b]), range(MIN ; MAX), 
      range_cond([cast(:0, DECIMAL(-1, -1)) = cast(t7.a, DECIMAL(10, 0))])
select /*+use_nl(t2,t7)*/* from t2 left join t7 on t2.b = t7.a and t2.c = t7.d order by t2.a,t2.b,t7.a,t7.b;
a	b	c	a	b	c	d
1	1	1.0000000000	NULL	NULL	NULL	NULL
1	2	2.0000000000	NULL	NULL	NULL	NULL
1	222	3.3300000000	NULL	NULL	NULL	NULL
2	2.00	2.0000100000	NULL	NULL	NULL	NULL
2	222	3.3300000000	NULL	NULL	NULL	NULL
2	333	2.2200000000	NULL	NULL	NULL	NULL
3	3.0	3.0000100000	NULL	NULL	NULL	NULL
3	3333	1.1100000000	NULL	NULL	NULL	NULL
4	A	4.3300000000	NULL	NULL	NULL	NULL
5	555	5.5500000000	NULL	NULL	NULL	NULL
5	B	5.0000000000	NULL	NULL	NULL	NULL
6	6666	5.5000000000	NULL	NULL	NULL	NULL
6	AB	6.0000000000	NULL	NULL	NULL	NULL
Warnings:
Warning	1292	Truncated incorrect DECIMAL value: 'A'
Warning	1292	Truncated incorrect DECIMAL value: 'A'
Warning	1292	Truncated incorrect DECIMAL value: 'A'
Warning	1292	Truncated incorrect DECIMAL value: 'A'
Warning	1292	Truncated incorrect DECIMAL value: 'A'
Warning	1292	Truncated incorrect DECIMAL value: 'AB'
Warning	1292	Truncated incorrect DECIMAL value: 'AB'
Warning	1292	Truncated incorrect DECIMAL value: 'AB'
Warning	1292	Truncated incorrect DECIMAL value: 'AB'
Warning	1292	Truncated incorrect DECIMAL value: 'AB'
Warning	1292	Truncated incorrect DECIMAL value: 'B'
Warning	1292	Truncated incorrect DECIMAL value: 'B'
Warning	1292	Truncated incorrect DECIMAL value: 'B'
Warning	1292	Truncated incorrect DECIMAL value: 'B'
Warning	1292	Truncated incorrect DECIMAL value: 'B'
********** join condition 必须和 ordering 排序一致
EXPLAIN BASIC select /*+use_merge(t8 t9)*/ * from t8 join t9 on t8.c = t9.c and t8.b = t9.b;
Query Plan
==============================
|ID|OPERATOR         |NAME   |
------------------------------
|0 |MERGE JOIN       |       |
|1 |├─TABLE FULL SCAN|t8(idx)|
|2 |└─TABLE FULL SCAN|t9(idx)|
==============================
Outputs & filters:
-------------------------------------
  0 - output([t8.a], [t8.b], [t8.c], [t9.a], [t9.b], [t9.c]), filter(nil), rowset=16
      equal_conds([t8.b = t9.b], [t8.c = t9.c]), other_conds(nil)
      merge_directions([ASC], [ASC])
  1 - output([t8.a], [t8.c], [t8.b]), filter(nil), rowset=16
      access([t8.a], [t8.c], [t8.b]), partitions(p0)
      is_index_back=false, is_global_index=true, 
      range_key([t8.b], [t8.c], [t8.a]), range(MIN,MIN,MIN ; MAX,MAX,MAX)always true
  2 - output([t9.a], [t9.c], [t9.b]), filter(nil), rowset=16
      access([t9.a], [t9.c], [t9.b]), partitions(p0)
      is_index_back=false, is_global_index=true, 
      range_key([t9.b], [t9.c], [t9.a]), range(MIN,MIN,MIN ; MAX,MAX,MAX)always true
select /*+use_merge(t8 t9)*/ * from t8 join t9 on t8.c = t9.c and t8.b = t9.b;
a	b	c	a	b	c
1	2	1	1	2	1
2	2	2	2	2	2
3	2	3	3	2	3
4	4	1	5	4	1
5	4	2	6	4	2
6	4	3	7	4	3
EXPLAIN BASIC select /*+index(t8 idx), index(t9 idx), use_merge(t8 t9)*/ * from t8 join t9 on t8.a = t9.b and t8.b = t9.a;
Query Plan
================================
|ID|OPERATOR           |NAME   |
--------------------------------
|0 |MERGE JOIN         |       |
|1 |├─SORT             |       |
|2 |│ └─TABLE FULL SCAN|t8(idx)|
|3 |└─SORT             |       |
|4 |  └─TABLE FULL SCAN|t9(idx)|
================================
Outputs & filters:
-------------------------------------
  0 - output([t8.a], [t8.b], [t8.c], [t9.a], [t9.b], [t9.c]), filter(nil), rowset=16
      equal_conds([t8.b = t9.a], [t8.a = t9.b]), other_conds(nil)
      merge_directions([ASC], [ASC])
  1 - output([t8.a], [t8.b], [t8.c]), filter(nil), rowset=16
      sort_keys([t8.b, ASC], [t8.a, ASC]), prefix_pos(1)
  2 - output([t8.a], [t8.b], [t8.c]), filter(nil), rowset=16
      access([t8.a], [t8.b], [t8.c]), partitions(p0)
      is_index_back=false, is_global_index=true, 
      range_key([t8.b], [t8.c], [t8.a]), range(MIN,MIN,MIN ; MAX,MAX,MAX)always true
  3 - output([t9.a], [t9.b], [t9.c]), filter(nil), rowset=16
      sort_keys([t9.a, ASC])
  4 - output([t9.a], [t9.b], [t9.c]), filter(nil), rowset=16
      access([t9.a], [t9.b], [t9.c]), partitions(p0)
      is_index_back=false, is_global_index=true, 
      range_key([t9.b], [t9.c], [t9.a]), range(MIN,MIN,MIN ; MAX,MAX,MAX)always true
select /*+index(t8 idx), index(t9 idx), use_merge(t8 t9)*/ * from t8 join t9 on t8.a = t9.b and t8.b = t9.a;
a	b	c	a	b	c
2	2	2	2	2	2
EXPLAIN BASIC select /*+use_merge(t8 t9)*/ * from t8 left join t9 on t8.c = t9.c and t8.b = t9.b;
Query Plan
==============================
|ID|OPERATOR         |NAME   |
------------------------------
|0 |MERGE OUTER JOIN |       |
|1 |├─TABLE FULL SCAN|t8(idx)|
|2 |└─TABLE FULL SCAN|t9(idx)|
==============================
Outputs & filters:
-------------------------------------
  0 - output([t8.a], [t8.b], [t8.c], [t9.a], [t9.b], [t9.c]), filter(nil), rowset=16
      equal_conds([t8.b = t9.b], [t8.c = t9.c]), other_conds(nil)
      merge_directions([ASC], [ASC])
  1 - output([t8.a], [t8.c], [t8.b]), filter(nil), rowset=16
      access([t8.a], [t8.c], [t8.b]), partitions(p0)
      is_index_back=false, is_global_index=true, 
      range_key([t8.b], [t8.c], [t8.a]), range(MIN,MIN,MIN ; MAX,MAX,MAX)always true
  2 - output([t9.a], [t9.c], [t9.b]), filter(nil), rowset=16
      access([t9.a], [t9.c], [t9.b]), partitions(p0)
      is_index_back=false, is_global_index=true, 
      range_key([t9.b], [t9.c], [t9.a]), range(MIN,MIN,MIN ; MAX,MAX,MAX)always true
select /*+use_merge(t8 t9)*/ * from t8 left join t9 on t8.c = t9.c and t8.b = t9.b;
a	b	c	a	b	c
1	2	1	1	2	1
2	2	2	2	2	2
3	2	3	3	2	3
4	4	1	5	4	1
5	4	2	6	4	2
6	4	3	7	4	3
EXPLAIN BASIC select /*+index(t8 idx), index(t9 idx), use_merge(t8 t9)*/ * from t8 left join t9 on t8.a = t9.b and t8.b = t9.a;
Query Plan
================================
|ID|OPERATOR           |NAME   |
--------------------------------
|0 |MERGE OUTER JOIN   |       |
|1 |├─SORT             |       |
|2 |│ └─TABLE FULL SCAN|t8(idx)|
|3 |└─SORT             |       |
|4 |  └─TABLE FULL SCAN|t9(idx)|
================================
Outputs & filters:
-------------------------------------
  0 - output([t8.a], [t8.b], [t8.c], [t9.a], [t9.b], [t9.c]), filter(nil), rowset=16
      equal_conds([t8.b = t9.a], [t8.a = t9.b]), other_conds(nil)
      merge_directions([ASC], [ASC])
  1 - output([t8.a], [t8.b], [t8.c]), filter(nil), rowset=16
      sort_keys([t8.b, ASC], [t8.a, ASC]), prefix_pos(1)
  2 - output([t8.a], [t8.b], [t8.c]), filter(nil), rowset=16
      access([t8.a], [t8.b], [t8.c]), partitions(p0)
      is_index_back=false, is_global_index=true, 
      range_key([t8.b], [t8.c], [t8.a]), range(MIN,MIN,MIN ; MAX,MAX,MAX)always true
  3 - output([t9.a], [t9.b], [t9.c]), filter(nil), rowset=16
      sort_keys([t9.a, ASC])
  4 - output([t9.a], [t9.b], [t9.c]), filter(nil), rowset=16
      access([t9.a], [t9.b], [t9.c]), partitions(p0)
      is_index_back=false, is_global_index=true, 
      range_key([t9.b], [t9.c], [t9.a]), range(MIN,MIN,MIN ; MAX,MAX,MAX)always true
select /*+index(t8 idx), index(t9 idx), use_merge(t8 t9)*/ * from t8 left join t9 on t8.a = t9.b and t8.b = t9.a;
a	b	c	a	b	c
1	2	1	NULL	NULL	NULL
2	2	2	2	2	2
3	2	3	NULL	NULL	NULL
4	4	1	NULL	NULL	NULL
5	4	2	NULL	NULL	NULL
6	4	3	NULL	NULL	NULL
EXPLAIN BASIC select /*+use_merge(t8 t9)*/ * from t8 right join t9 on t8.c = t9.c and t8.b = t9.b;
Query Plan
====================================
|ID|OPERATOR               |NAME   |
------------------------------------
|0 |MERGE RIGHT OUTER JOIN |       |
|1 |├─TABLE FULL SCAN      |t8(idx)|
|2 |└─TABLE FULL SCAN      |t9(idx)|
====================================
Outputs & filters:
-------------------------------------
  0 - output([t8.a], [t8.b], [t8.c], [t9.a], [t9.b], [t9.c]), filter(nil), rowset=16
      equal_conds([t8.b = t9.b], [t8.c = t9.c]), other_conds(nil)
      merge_directions([ASC], [ASC])
  1 - output([t8.a], [t8.c], [t8.b]), filter(nil), rowset=16
      access([t8.a], [t8.c], [t8.b]), partitions(p0)
      is_index_back=false, is_global_index=true, 
      range_key([t8.b], [t8.c], [t8.a]), range(MIN,MIN,MIN ; MAX,MAX,MAX)always true
  2 - output([t9.a], [t9.c], [t9.b]), filter(nil), rowset=16
      access([t9.a], [t9.c], [t9.b]), partitions(p0)
      is_index_back=false, is_global_index=true, 
      range_key([t9.b], [t9.c], [t9.a]), range(MIN,MIN,MIN ; MAX,MAX,MAX)always true
select /*+use_merge(t8 t9)*/ * from t8 right join t9 on t8.c = t9.c and t8.b = t9.b;
a	b	c	a	b	c
1	2	1	1	2	1
2	2	2	2	2	2
3	2	3	3	2	3
NULL	NULL	NULL	4	3	1
4	4	1	5	4	1
5	4	2	6	4	2
6	4	3	7	4	3
EXPLAIN BASIC select /*+index(t8 idx), index(t9 idx), use_merge(t8 t9)*/ * from t8 right join t9 on t8.a = t9.b and t8.b = t9.a;
Query Plan
====================================
|ID|OPERATOR               |NAME   |
------------------------------------
|0 |MERGE RIGHT OUTER JOIN |       |
|1 |├─SORT                 |       |
|2 |│ └─TABLE FULL SCAN    |t8(idx)|
|3 |└─SORT                 |       |
|4 |  └─TABLE FULL SCAN    |t9(idx)|
====================================
Outputs & filters:
-------------------------------------
  0 - output([t8.a], [t8.b], [t8.c], [t9.a], [t9.b], [t9.c]), filter(nil), rowset=16
      equal_conds([t8.b = t9.a], [t8.a = t9.b]), other_conds(nil)
      merge_directions([ASC], [ASC])
  1 - output([t8.a], [t8.b], [t8.c]), filter(nil), rowset=16
      sort_keys([t8.b, ASC], [t8.a, ASC]), prefix_pos(1)
  2 - output([t8.a], [t8.b], [t8.c]), filter(nil), rowset=16
      access([t8.a], [t8.b], [t8.c]), partitions(p0)
      is_index_back=false, is_global_index=true, 
      range_key([t8.b], [t8.c], [t8.a]), range(MIN,MIN,MIN ; MAX,MAX,MAX)always true
  3 - output([t9.a], [t9.b], [t9.c]), filter(nil), rowset=16
      sort_keys([t9.a, ASC])
  4 - output([t9.a], [t9.b], [t9.c]), filter(nil), rowset=16
      access([t9.a], [t9.b], [t9.c]), partitions(p0)
      is_index_back=false, is_global_index=true, 
      range_key([t9.b], [t9.c], [t9.a]), range(MIN,MIN,MIN ; MAX,MAX,MAX)always true
select /*+index(t8 idx), index(t9 idx), use_merge(t8 t9)*/ * from t8 right join t9 on t8.a = t9.b and t8.b = t9.a;
a	b	c	a	b	c
NULL	NULL	NULL	1	2	1
2	2	2	2	2	2
NULL	NULL	NULL	3	2	3
NULL	NULL	NULL	4	3	1
NULL	NULL	NULL	5	4	1
NULL	NULL	NULL	6	4	2
NULL	NULL	NULL	7	4	3
EXPLAIN BASIC select /*+use_merge(t8 t9)*/ * from t8 right join t9 on t8.c = t9.c and t8.b = t9.b;
Query Plan
====================================
|ID|OPERATOR               |NAME   |
------------------------------------
|0 |MERGE RIGHT OUTER JOIN |       |
|1 |├─TABLE FULL SCAN      |t8(idx)|
|2 |└─TABLE FULL SCAN      |t9(idx)|
====================================
Outputs & filters:
-------------------------------------
  0 - output([t8.a], [t8.b], [t8.c], [t9.a], [t9.b], [t9.c]), filter(nil), rowset=16
      equal_conds([t8.b = t9.b], [t8.c = t9.c]), other_conds(nil)
      merge_directions([ASC], [ASC])
  1 - output([t8.a], [t8.c], [t8.b]), filter(nil), rowset=16
      access([t8.a], [t8.c], [t8.b]), partitions(p0)
      is_index_back=false, is_global_index=true, 
      range_key([t8.b], [t8.c], [t8.a]), range(MIN,MIN,MIN ; MAX,MAX,MAX)always true
  2 - output([t9.a], [t9.c], [t9.b]), filter(nil), rowset=16
      access([t9.a], [t9.c], [t9.b]), partitions(p0)
      is_index_back=false, is_global_index=true, 
      range_key([t9.b], [t9.c], [t9.a]), range(MIN,MIN,MIN ; MAX,MAX,MAX)always true
select /*+use_merge(t8 t9)*/ * from t8 right join t9 on t8.c = t9.c and t8.b = t9.b;
a	b	c	a	b	c
1	2	1	1	2	1
2	2	2	2	2	2
3	2	3	3	2	3
NULL	NULL	NULL	4	3	1
4	4	1	5	4	1
5	4	2	6	4	2
6	4	3	7	4	3
EXPLAIN BASIC select /*+index(t8 idx), index(t9 idx), use_merge(t8 t9)*/ * from t8 full join t9 on t8.a = t9.b and t8.b = t9.a;
Query Plan
===================================
|ID|OPERATOR              |NAME   |
-----------------------------------
|0 |MERGE FULL OUTER JOIN |       |
|1 |├─SORT                |       |
|2 |│ └─TABLE FULL SCAN   |t8(idx)|
|3 |└─SORT                |       |
|4 |  └─TABLE FULL SCAN   |t9(idx)|
===================================
Outputs & filters:
-------------------------------------
  0 - output([t8.a], [t8.b], [t8.c], [t9.a], [t9.b], [t9.c]), filter(nil), rowset=16
      equal_conds([t8.b = t9.a], [t8.a = t9.b]), other_conds(nil)
      merge_directions([ASC], [ASC])
  1 - output([t8.a], [t8.b], [t8.c]), filter(nil), rowset=16
      sort_keys([t8.b, ASC], [t8.a, ASC]), prefix_pos(1)
  2 - output([t8.a], [t8.b], [t8.c]), filter(nil), rowset=16
      access([t8.a], [t8.b], [t8.c]), partitions(p0)
      is_index_back=false, is_global_index=true, 
      range_key([t8.b], [t8.c], [t8.a]), range(MIN,MIN,MIN ; MAX,MAX,MAX)always true
  3 - output([t9.a], [t9.b], [t9.c]), filter(nil), rowset=16
      sort_keys([t9.a, ASC])
  4 - output([t9.a], [t9.b], [t9.c]), filter(nil), rowset=16
      access([t9.a], [t9.b], [t9.c]), partitions(p0)
      is_index_back=false, is_global_index=true, 
      range_key([t9.b], [t9.c], [t9.a]), range(MIN,MIN,MIN ; MAX,MAX,MAX)always true
select /*+index(t8 idx), index(t9 idx), use_merge(t8 t9)*/ * from t8 full join t9 on t8.a = t9.b and t8.b = t9.a;
a	b	c	a	b	c
NULL	NULL	NULL	1	2	1
1	2	1	NULL	NULL	NULL
2	2	2	2	2	2
3	2	3	NULL	NULL	NULL
NULL	NULL	NULL	3	2	3
NULL	NULL	NULL	4	3	1
4	4	1	NULL	NULL	NULL
5	4	2	NULL	NULL	NULL
6	4	3	NULL	NULL	NULL
NULL	NULL	NULL	5	4	1
NULL	NULL	NULL	6	4	2
NULL	NULL	NULL	7	4	3
drop table if exists BB,CC;
CREATE TABLE BB ( col_varchar_key varchar (1), col_varchar_10 varchar(10), col_varchar varchar (1), col_int_key int, col_varchar_10_key varchar(10), col_varchar_20_key varchar(20), col_int int, col_varchar_20 varchar(20), pk int, /*Indices*/ key idx3(pk, col_varchar_key ), key idx1(pk, col_int_key ), key idx5(pk, col_varchar_10_key ), key idx7(pk, col_varchar_20_key ), primary key (pk) ) partition by hash(pk) partitions 2;
CREATE TABLE CC ( col_varchar_key varchar (1), col_varchar_20_key varchar(20), col_varchar_20 varchar(20), col_int_key int, col_int int, pk int, col_varchar_10 varchar(10), col_varchar_10_key varchar(10), col_varchar varchar (1), /*Indices*/ key idx3(pk, col_varchar_key ), key idx7(pk, col_varchar_20_key ), key idx1(pk, col_int_key ), primary key (pk) , key idx5(pk, col_varchar_10_key )) partition by hash(pk) partitions 2;
Query Plan
============================
|ID|OPERATOR          |NAME|
----------------------------
|0 |DISTRIBUTED INSERT|    |
|1 |└─EXPRESSION      |    |
============================
Outputs & filters:
-------------------------------------
  0 - output(nil), filter(nil)
      columns([{bb: ({bb: (bb.pk, bb.col_varchar_key, bb.col_varchar_10, bb.col_varchar, bb.col_int_key, bb.col_varchar_10_key, bb.col_varchar_20_key, bb.col_int,
       bb.col_varchar_20)})}]), 
      column_values([column_conv(INT,PS:(11,0),NOT NULL,__values.pk)], [column_conv(VARCHAR,utf8mb4_general_ci,length:1,NULL,__values.col_varchar_key)],
       [column_conv(VARCHAR,utf8mb4_general_ci,length:10,NULL,__values.col_varchar_10)], [column_conv(VARCHAR,utf8mb4_general_ci,length:1,NULL,__values.col_varchar)],
       [column_conv(INT,PS:(11,0),NULL,__values.col_int_key)], [column_conv(VARCHAR,utf8mb4_general_ci,length:10,NULL,__values.col_varchar_10_key)], [column_conv(VARCHAR,
      utf8mb4_general_ci,length:20,NULL,__values.col_varchar_20_key)], [column_conv(INT,PS:(11,0),NULL,__values.col_int)], [column_conv(VARCHAR,utf8mb4_general_ci,
      length:20,NULL,__values.col_varchar_20)])
  1 - output([__values.col_varchar_key], [__values.col_varchar_10], [__values.col_varchar], [__values.col_int_key], [__values.col_varchar_10_key], [__values.col_varchar_20_key],
       [__values.col_int], [__values.col_varchar_20], [__values.pk]), filter(nil)
      values({'d', 'n', NULL, NULL, 'm', 'p', 2, 'v', 1}, {NULL, 'i', 'w', 6, 'n', 'r', 9, 'f', 2}, {'k', NULL, 'a', 8, 'p', NULL, NULL, 'j', 3}, {NULL,
       NULL, NULL, 4, 'b', 'b', 4, 'o', 4}, {'b', 'u', 'z', 7, 'k', 'e', 9, 'z', 5}, {'n', 'm', 's', 5, NULL, 'p', 6, 'y', 6}, {'f', 'e', 'f', 9, 'o', 'i', 9,
       't', 7}, {'a', 'u', 's', NULL, 'l', 'g', 6, 'k', 8}, {'s', 'd', NULL, 1, 'r', 'g', NULL, 'j', 9}, {'y', NULL, 'j', 8, 'u', 'v', 7, 'b', 10}, {'w', 'i',
       NULL, 1, 'v', NULL, 1, NULL, 11}, {'t', NULL, NULL, 6, 'v', 'b', 3, NULL, 12}, {'m', 'i', 'd', 6, 'l', NULL, 3, 't', 13}, {'m', 'l', 'z', 6, 'a', 'b', 
      NULL, 'b', 14}, {'d', 'y', 'c', 9, NULL, 'e', 7, 'g', 15}, {'e', 'm', 'w', 4, 'c', 'u', 6, 'a', 16}, {'a', NULL, 'j', 8, 'd', 'z', NULL, 's', 17}, {'h',
       'u', NULL, 5, 't', 'p', 4, NULL, 18}, {'p', 'l', 'u', 8, 'e', 's', 6, 'm', 19}, {'l', 'l', 'h', 1, 'b', 'i', 8, 'z', 20}, {'i', 'f', NULL, NULL, 'g', 'e',
       NULL, 'p', 21}, {'l', 'w', 'p', 9, 'g', 'b', 4, 'k', 22}, {'j', 'd', 'l', 4, 'x', 'z', NULL, 'u', 23}, {'t', 'a', 'y', 8, 'o', 'e', 8, 'a', 24}, {NULL,
       'a', 'a', 0, NULL, 'd', 9, 'm', 25}, {NULL, 'b', NULL, 3, 'i', 'r', NULL, 'i', 26}, {'s', 'v', NULL, 4, 'w', NULL, NULL, 'p', 27}, {'m', 'x', 'y', 0, 'n',
       'i', 6, 'k', 28})
Query Plan
============================
|ID|OPERATOR          |NAME|
----------------------------
|0 |DISTRIBUTED INSERT|    |
|1 |└─EXPRESSION      |    |
============================
Outputs & filters:
-------------------------------------
  0 - output(nil), filter(nil)
      columns([{cc: ({cc: (cc.pk, cc.col_varchar_key, cc.col_varchar_20_key, cc.col_varchar_20, cc.col_int_key, cc.col_int, cc.col_varchar_10, cc.col_varchar_10_key,
       cc.col_varchar)})}]), 
      column_values([column_conv(INT,PS:(11,0),NOT NULL,__values.pk)], [column_conv(VARCHAR,utf8mb4_general_ci,length:1,NULL,__values.col_varchar_key)],
       [column_conv(VARCHAR,utf8mb4_general_ci,length:20,NULL,__values.col_varchar_20_key)], [column_conv(VARCHAR,utf8mb4_general_ci,length:20,NULL,__values.col_varchar_20)],
       [column_conv(INT,PS:(11,0),NULL,__values.col_int_key)], [column_conv(INT,PS:(11,0),NULL,__values.col_int)], [column_conv(VARCHAR,utf8mb4_general_ci,length:10,
      NULL,__values.col_varchar_10)], [column_conv(VARCHAR,utf8mb4_general_ci,length:10,NULL,__values.col_varchar_10_key)], [column_conv(VARCHAR,utf8mb4_general_ci,
      length:1,NULL,__values.col_varchar)])
  1 - output([__values.col_varchar_key], [__values.col_varchar_20_key], [__values.col_varchar_20], [__values.col_int_key], [__values.col_int], [__values.pk],
       [__values.col_varchar_10], [__values.col_varchar_10_key], [__values.col_varchar]), filter(nil)
      values({'x', 'r', 'v', 7, 8, 1, 't', 'j', 't'}, {NULL, 'b', 'z', 2, 9, 2, 'p', 'u', 'y'}, {NULL, 'q', 'e', 6, NULL, 3, 'u', 's', 'j'}, {'d', NULL,
       'n', 4, 3, 4, 'n', NULL, 'm'}, {'y', 'u', 'b', 8, NULL, 5, 'z', NULL, 't'}, {'p', 'f', 'm', 7, 1, 6, NULL, 'k', 'w'}, {'m', 'w', 'f', 2, 9, 7, 't', 'w',
       'g'}, {'w', 'n', 'm', 3, 8, 8, NULL, 't', 'z'}, {'o', 'g', 'i', 5, 0, 9, 't', 'a', NULL}, {'m', 'v', 'm', NULL, 7, 10, NULL, 'h', NULL}, {'u', 'm', 'j',
       3, 4, 11, 'f', NULL, 'q'}, {'h', 'y', NULL, 7, 4, 12, 'k', 't', NULL}, {NULL, 'h', 'g', NULL, 6, 13, 'v', 'd', 'u'}, {NULL, NULL, NULL, 4, 5, 14, NULL,
       'v', 'm'}, {'f', 'x', 'm', 4, 8, 15, 'd', NULL, NULL}, {'s', 'f', 'x', 0, 2, 16, 'l', NULL, 'f'}, {'t', 'o', 's', NULL, 8, 17, 'r', NULL, 'r'}, {'h', 's',
       NULL, NULL, 3, 18, 'd', 'r', 'k'}, {'u', 'w', 'r', 7, NULL, 19, 'w', NULL, 'c'}, {'i', 'o', NULL, 8, 0, 20, 'n', 'i', 'y'}, {NULL, NULL, NULL, 9, NULL,
       21, 'm', NULL, 'm'}, {'p', 'g', 'k', 9, NULL, 22, 'g', 'x', 'v'}, {NULL, 'q', NULL, NULL, 2, 23, 'f', 'g', 's'}, {NULL, NULL, 'p', 9, 0, 24, 'e', NULL,
       'v'}, {NULL, 'q', 'm', 3, 9, 25, 'w', 'i', 'm'}, {'e', NULL, 'e', 5, NULL, 26, NULL, 'k', 'f'}, {'i', 'm', 'n', 0, 4, 27, 'g', NULL, 'a'}, {'r', 'g', 'o',
       2, NULL, 28, 'c', NULL, 'u'}, {'y', NULL, 'o', 2, NULL, 29, 'h', 'n', 'o'})
EXPLAIN BASIC SELECT /*+no_rewrite,leading(table1 table2),use_merge(table1 table2)*/   table1 . col_varchar_10_key AS field1  FROM    BB AS table1, CC AS table2    WHERE  table1 . `col_int_key` = table2 . `pk`  and table2 . `col_int_key` = table1 . `pk` ORDER BY table1 . col_int_key DESC;
Query Plan
===============================================================
|ID|OPERATOR                             |NAME                |
---------------------------------------------------------------
|0 |PX COORDINATOR MERGE SORT            |                    |
|1 |└─EXCHANGE OUT DISTR                 |:EX10001            |
|2 |  └─SORT                             |                    |
|3 |    └─MERGE JOIN                     |                    |
|4 |      ├─SORT                         |                    |
|5 |      │ └─PX PARTITION ITERATOR      |                    |
|6 |      │   └─TABLE FULL SCAN          |table1              |
|7 |      └─SORT                         |                    |
|8 |        └─EXCHANGE IN DISTR          |                    |
|9 |          └─EXCHANGE OUT DISTR (PKEY)|:EX10000            |
|10|            └─PX PARTITION ITERATOR  |                    |
|11|              └─TABLE FULL SCAN      |table2(idx1,Reverse)|
===============================================================
Outputs & filters:
-------------------------------------
  0 - output([INTERNAL_FUNCTION(table1.col_varchar_10_key)]), filter(nil), rowset=256
      sort_keys([table1.col_int_key, DESC])
  1 - output([table1.col_int_key], [INTERNAL_FUNCTION(table1.col_varchar_10_key)]), filter(nil), rowset=256
      dop=1
  2 - output([table1.col_int_key], [table1.col_varchar_10_key]), filter(nil), rowset=256
      sort_keys([table1.col_int_key, DESC])
  3 - output([table1.col_int_key], [table1.col_varchar_10_key]), filter(nil), rowset=256
      equal_conds([table2.col_int_key = table1.pk], [table1.col_int_key = table2.pk]), other_conds(nil)
      merge_directions([ASC], [ASC])
  4 - output([table1.col_int_key], [table1.pk], [table1.col_varchar_10_key]), filter(nil), rowset=256
      sort_keys([table1.pk, ASC]), local merge sort
  5 - output([table1.pk], [table1.col_int_key], [table1.col_varchar_10_key]), filter(nil), rowset=256
      affinitize, force partition granule
  6 - output([table1.pk], [table1.col_int_key], [table1.col_varchar_10_key]), filter(nil), rowset=256
      access([table1.pk], [table1.col_int_key], [table1.col_varchar_10_key]), partitions(p[0-1])
      is_index_back=false, is_global_index=false, 
      range_key([table1.pk]), range(MIN ; MAX)always true
  7 - output([table2.col_int_key], [table2.pk]), filter(nil), rowset=256
      sort_keys([table2.col_int_key, ASC], [table2.pk, ASC])
  8 - output([table2.col_int_key], [table2.pk]), filter(nil), rowset=256
  9 - output([table2.col_int_key], [table2.pk]), filter(nil), rowset=256
      (#keys=1, [table2.col_int_key]), dop=1
 10 - output([table2.pk], [table2.col_int_key]), filter(nil), rowset=256
      force partition granule
 11 - output([table2.pk], [table2.col_int_key]), filter(nil), rowset=256
      access([table2.pk], [table2.col_int_key]), partitions(p[0-1])
      is_index_back=false, is_global_index=false, 
      range_key([table2.pk], [table2.col_int_key]), range(MIN,MIN ; MAX,MAX)always true
SELECT /*+no_rewrite,leading(table1 table2),use_merge(table1 table2)*/   table1 . col_varchar_10_key AS field1  FROM    BB AS table1, CC AS table2    WHERE  table1 . `col_int_key` = table2 . `pk`  and table2 . `col_int_key` = table1 . `pk` ORDER BY table1 . col_int_key DESC;
field1
p
b
drop table if exists t2, t7, t8, t9, BB, CC;
