result_format: 4

alter system flush plan cache global;

set ob_trx_timeout = 10000000000;

drop table if exists t;
create table t (pk int primary key, a int);
insert into t values (1, 1);
insert into t values  (2, 2);


select 1 from dual;//
+---+
| 1 |
+---+
| 1 |
+---+
select 1 from dual;//
+---+
| 1 |
+---+
| 1 |
+---+

select hit_count, statement from oceanbase.GV$OB_PLAN_CACHE_PLAN_STAT where statement like 'select ? from dual;'//
+-----------+---------------------+
| hit_count | statement           |
+-----------+---------------------+
|         1 | select ? from dual; |
+-----------+---------------------+
alter system set ob_enable_batched_multi_statement = true;//
select 1 from dual;//
+---+
| 1 |
+---+
| 1 |
+---+
select 1 from dual;//
+---+
| 1 |
+---+
| 1 |
+---+

select hit_count, statement from oceanbase.GV$OB_PLAN_CACHE_PLAN_STAT where statement like 'select ? from dual%'//
+-----------+---------------------+
| hit_count | statement           |
+-----------+---------------------+
|         3 | select ? from dual; |
+-----------+---------------------+
update t set a = 1 where pk = 1;update t set a = 2 where pk = 2;//
update t set a = 1 where pk = 1;update t set a = 2 where pk = 2;//
update t set a = 1 where pk = 3  ;update t set a = 2 where pk = 2     ;//

// expect 2
select hit_count, is_batched_multi_stmt, statement from oceanbase.GV$OB_PLAN_CACHE_PLAN_STAT where statement like 'update t set a%'//
+-----------+-----------------------+---------------------------------+
| hit_count | is_batched_multi_stmt | statement                       |
+-----------+-----------------------+---------------------------------+
|         2 |                     1 | update t set a = ? where pk = ? |
+-----------+-----------------------+---------------------------------+
drop table t//

select 1;select  ; select 2;//
+---+
| 1 |
+---+
| 1 |
+---+
ERROR 42000: You have an error in your SQL syntax; check the manual that corresponds to your OceanBase version for the right syntax to use near ';' at line 1

select 1;   ; select 2;//
+---+
| 1 |
+---+
| 1 |
+---+
ERROR 42000: Query was empty



