result_format: 4

alter system set large_query_threshold = '1s';
alter system set enable_auto_leader_switch=false;
alter system set resource_hard_limit = 500;

alter system flush plan cache global;
**************************************** Single Table Dist Plan ****************************************

=============================== single table select ===============================

select * from case1_t_1;
select * from case1_t_1;


explain select * from case1_t_1;
Query Plan
=====================================================
|ID|OPERATOR               |NAME     |EST. ROWS|COST|
-----------------------------------------------------
|0 |PX COORDINATOR         |         |1        |92  |
|1 | EXCHANGE OUT DISTR    |:EX10000 |1        |92  |
|2 |  PX PARTITION ITERATOR|         |1        |92  |
|3 |   TABLE SCAN          |case1_t_1|1        |92  |
=====================================================

Outputs & filters: 
-------------------------------------
  0 - output([INTERNAL_FUNCTION(case1_t_1.pk1, case1_t_1.a1)]), filter(nil)
  1 - output([INTERNAL_FUNCTION(case1_t_1.pk1, case1_t_1.a1)]), filter(nil), dop=1
  2 - output([case1_t_1.pk1], [case1_t_1.a1]), filter(nil)
  3 - output([case1_t_1.pk1], [case1_t_1.a1]), filter(nil), 
      access([case1_t_1.pk1], [case1_t_1.a1]), partitions(p[0-1])



// expect hit_count = 1
select hit_count = 1 from oceanbase.V$OB_PLAN_CACHE_PLAN_STAT where statement like 'select * from case1_t_1';
+---------------+
| hit_count = 1 |
+---------------+
|             1 |
+---------------+


// alter system switch replica part1 to backup server

select * from case1_t_1;


// expect same single table dist plan
explain select * from case1_t_1;
Query Plan
=====================================================
|ID|OPERATOR               |NAME     |EST. ROWS|COST|
-----------------------------------------------------
|0 |PX COORDINATOR         |         |1        |92  |
|1 | EXCHANGE OUT DISTR    |:EX10000 |1        |92  |
|2 |  PX PARTITION ITERATOR|         |1        |92  |
|3 |   TABLE SCAN          |case1_t_1|1        |92  |
=====================================================

Outputs & filters: 
-------------------------------------
  0 - output([INTERNAL_FUNCTION(case1_t_1.pk1, case1_t_1.a1)]), filter(nil)
  1 - output([INTERNAL_FUNCTION(case1_t_1.pk1, case1_t_1.a1)]), filter(nil), dop=1
  2 - output([case1_t_1.pk1], [case1_t_1.a1]), filter(nil)
  3 - output([case1_t_1.pk1], [case1_t_1.a1]), filter(nil), 
      access([case1_t_1.pk1], [case1_t_1.a1]), partitions(p[0-1])



// expect hit_count = 2
select hit_count from oceanbase.V$OB_PLAN_CACHE_PLAN_STAT where statement like 'select * from case1_t_1';
+-----------+
| hit_count |
+-----------+
|         2 |
+-----------+

**************************************** Case 2 Delete Dist Plans ****************************************
## case #2
## delete分布式计划，delete现在只支持单表的删除，但是子查询可以有分布式查
## 对于delete from t1 where pk in (select pk in t2)，如果要删除的数据是跨分区的，那么分区必须必须在同一个server上，否则报错

=============================== single table delete ===============================

delete from case2_t_1 where pk1 in (1, 2);
delete from case2_t_1 where pk1 in (2, 3);

explain delete from case2_t_1 where pk1 in (2, 3);
Query Plan
=====================================================
|ID|OPERATOR               |NAME     |EST. ROWS|COST|
-----------------------------------------------------
|0 |PX COORDINATOR         |         |2        |110 |
|1 | EXCHANGE OUT DISTR    |:EX10000 |2        |110 |
|2 |  PX PARTITION ITERATOR|         |2        |110 |
|3 |   DELETE              |         |2        |110 |
|4 |    TABLE GET          |case2_t_1|2        |93  |
=====================================================

Outputs & filters: 
-------------------------------------
  0 - output(nil), filter(nil)
  1 - output(nil), filter(nil), dop=1
  2 - output(nil), filter(nil)
  3 - output(nil), filter(nil), table_columns([{case2_t_1: ({case2_t_1: (case2_t_1.pk1, case2_t_1.a1)})}])
  4 - output([case2_t_1.pk1], [case2_t_1.a1]), filter(nil), 
      access([case2_t_1.pk1], [case2_t_1.a1]), partitions(p[0-1])



// expect to be 1 plan in plan stat
select hit_count from oceanbase.V$OB_PLAN_CACHE_PLAN_STAT where statement like 'delete from case2_t_1 where pk1 in (?, ?)';
+-----------+
| hit_count |
+-----------+
|         1 |
+-----------+


// switch replica leader, part0 in backup, part1 in main

delete from case2_t_1 where pk1 in (3, 4);

explain delete from case2_t_1 where pk1 in (3, 4);
Query Plan
=====================================================
|ID|OPERATOR               |NAME     |EST. ROWS|COST|
-----------------------------------------------------
|0 |PX COORDINATOR         |         |2        |110 |
|1 | EXCHANGE OUT DISTR    |:EX10000 |2        |110 |
|2 |  PX PARTITION ITERATOR|         |2        |110 |
|3 |   DELETE              |         |2        |110 |
|4 |    TABLE GET          |case2_t_1|2        |93  |
=====================================================

Outputs & filters: 
-------------------------------------
  0 - output(nil), filter(nil)
  1 - output(nil), filter(nil), dop=1
  2 - output(nil), filter(nil)
  3 - output(nil), filter(nil), table_columns([{case2_t_1: ({case2_t_1: (case2_t_1.pk1, case2_t_1.a1)})}])
  4 - output([case2_t_1.pk1], [case2_t_1.a1]), filter(nil), 
      access([case2_t_1.pk1], [case2_t_1.a1]), partitions(p[0-1])


// hit the same plan, hit_count == 2
select hit_count from oceanbase.V$OB_PLAN_CACHE_PLAN_STAT where statement like 'delete from case2_t_1 where pk1 in (?, ?)';
+-----------+
| hit_count |
+-----------+
|         1 |
+-----------+

============================ delete with subquery  ============================


delete from case2_t_2 where pk2 in (select pk3 from case2_t_3);
delete from case2_t_2 where pk2 in (select pk3 from case2_t_3);

explain delete from case2_t_2 where pk2 in (select pk3 from case2_t_3);
Query Plan
=====================================================
|ID|OPERATOR               |NAME     |EST. ROWS|COST|
-----------------------------------------------------
|0 |PX COORDINATOR         |         |1        |112 |
|1 | EXCHANGE OUT DISTR    |:EX10000 |1        |111 |
|2 |  PX PARTITION ITERATOR|         |1        |111 |
|3 |   DELETE              |         |1        |111 |
|4 |    NESTED-LOOP JOIN   |         |1        |100 |
|5 |     TABLE SCAN        |case2_t_3|1        |92  |
|6 |     TABLE GET         |case2_t_2|1        |14  |
=====================================================

Outputs & filters: 
-------------------------------------
  0 - output(nil), filter(nil)
  1 - output(nil), filter(nil), dop=1
  2 - output(nil), filter(nil)
  3 - output(nil), filter(nil), table_columns([{case2_t_2: ({case2_t_2: (case2_t_2.pk2, case2_t_2.a2)})}])
  4 - output([case2_t_2.pk2], [case2_t_2.a2]), filter(nil), 
      conds(nil), nl_params_([case2_t_3.pk3])
  5 - output([case2_t_3.pk3]), filter(nil), 
      access([case2_t_3.pk3]), partitions(p[0-1])
  6 - output([case2_t_2.pk2], [case2_t_2.a2]), filter(nil), 
      access([case2_t_2.pk2], [case2_t_2.a2]), partitions(p[0-1])



// expect 1
select hit_count from oceanbase.V$OB_PLAN_CACHE_PLAN_STAT where statement like 'delete from case2_t_2 where pk2 in (select pk3 from case2_t_3)';
+-----------+
| hit_count |
+-----------+
|         1 |
+-----------+


// switch replica leader for case2_t_2, part0 in backup, part1 in main

delete from case2_t_2 where pk2 in (select pk3 from case2_t_3);
delete from case2_t_2 where pk2 in (select pk3 from case2_t_3);

explain delete from case2_t_2 where pk2 in (select pk3 from case2_t_3);
Query Plan
============================================================
|ID|OPERATOR                      |NAME     |EST. ROWS|COST|
------------------------------------------------------------
|0 |DISTRIBUTED DELETE            |         |1        |112 |
|1 | PX COORDINATOR               |         |1        |100 |
|2 |  EXCHANGE OUT DISTR          |:EX10001 |1        |100 |
|3 |   NESTED-LOOP JOIN           |         |1        |100 |
|4 |    EXCHANGE IN DISTR         |         |1        |92  |
|5 |     EXCHANGE OUT DISTR (PKEY)|:EX10000 |1        |92  |
|6 |      PX PARTITION ITERATOR   |         |1        |92  |
|7 |       TABLE SCAN             |case2_t_3|1        |92  |
|8 |    PX PARTITION ITERATOR     |         |1        |14  |
|9 |     TABLE GET                |case2_t_2|1        |14  |
============================================================

Outputs & filters: 
-------------------------------------
  0 - output(nil), filter(nil), table_columns([{case2_t_2: ({case2_t_2: (case2_t_2.pk2, case2_t_2.a2)})}])
  1 - output([case2_t_2.pk2], [case2_t_2.a2]), filter(nil)
  2 - output([case2_t_2.pk2], [case2_t_2.a2]), filter(nil), dop=1
  3 - output([case2_t_2.pk2], [case2_t_2.a2]), filter(nil), 
      conds(nil), nl_params_([case2_t_3.pk3])
  4 - output([PARTITION_ID], [case2_t_3.pk3]), filter(nil)
  5 - (#keys=1, [case2_t_3.pk3]), output([PARTITION_ID], [case2_t_3.pk3]), filter(nil), dop=1
  6 - output([case2_t_3.pk3]), filter(nil)
  7 - output([case2_t_3.pk3]), filter(nil), 
      access([case2_t_3.pk3]), partitions(p[0-1])
  8 - output([case2_t_2.pk2], [case2_t_2.a2]), filter(nil)
  9 - output([case2_t_2.pk2], [case2_t_2.a2]), filter(nil), 
      access([case2_t_2.pk2], [case2_t_2.a2]), partitions(p[0-1])



// expect 1, 1
select hit_count from oceanbase.V$OB_PLAN_CACHE_PLAN_STAT where statement like 'delete from case2_t_2 where pk2 in (select pk3 from case2_t_3)';
+-----------+
| hit_count |
+-----------+
|         1 |
|         1 |
+-----------+


// switch replica leader for case2_t_3, part0 in backup, part1 in main
// now t3_part0 and t2_part0 in backup, t3_part1 and t2_part1 are in main

delete from case2_t_2 where pk2 in (select pk3 from case2_t_3);

// hit the old plan, expect 1, 2, 单分区无主重试导致计划执行成功
select hit_count from oceanbase.V$OB_PLAN_CACHE_PLAN_STAT where statement like 'delete from case2_t_2 where pk2 in (select pk3 from case2_t_3)';
+-----------+
| hit_count |
+-----------+
|         2 |
|         1 |
+-----------+


delete from case2_t_2 where pk2 in (select pk3 from case2_t_3);

explain delete from case2_t_2 where pk2 in (select pk3 from case2_t_3);
Query Plan
=====================================================
|ID|OPERATOR               |NAME     |EST. ROWS|COST|
-----------------------------------------------------
|0 |PX COORDINATOR         |         |1        |112 |
|1 | EXCHANGE OUT DISTR    |:EX10000 |1        |111 |
|2 |  PX PARTITION ITERATOR|         |1        |111 |
|3 |   DELETE              |         |1        |111 |
|4 |    NESTED-LOOP JOIN   |         |1        |100 |
|5 |     TABLE SCAN        |case2_t_3|1        |92  |
|6 |     TABLE GET         |case2_t_2|1        |14  |
=====================================================

Outputs & filters: 
-------------------------------------
  0 - output(nil), filter(nil)
  1 - output(nil), filter(nil), dop=1
  2 - output(nil), filter(nil)
  3 - output(nil), filter(nil), table_columns([{case2_t_2: ({case2_t_2: (case2_t_2.pk2, case2_t_2.a2)})}])
  4 - output([case2_t_2.pk2], [case2_t_2.a2]), filter(nil), 
      conds(nil), nl_params_([case2_t_3.pk3])
  5 - output([case2_t_3.pk3]), filter(nil), 
      access([case2_t_3.pk3]), partitions(p[0-1])
  6 - output([case2_t_2.pk2], [case2_t_2.a2]), filter(nil), 
      access([case2_t_2.pk2], [case2_t_2.a2]), partitions(p[0-1])


// hit the old plan, expect 2, 2, location cache in plan cache is updated
select hit_count from oceanbase.V$OB_PLAN_CACHE_PLAN_STAT where statement like 'delete from case2_t_2 where pk2 in (select pk3 from case2_t_3)';
+-----------+
| hit_count |
+-----------+
|         3 |
|         1 |
+-----------+


**************************************** Case 3 Update Dist Plans ****************************************

======================= single table update ===========================

update case3_t_1 set a1 = 2;
update case3_t_1 set a1 = 3;

explain update case3_t_1 set a1 = 3;
Query Plan
=====================================================
|ID|OPERATOR               |NAME     |EST. ROWS|COST|
-----------------------------------------------------
|0 |PX COORDINATOR         |         |1        |124 |
|1 | EXCHANGE OUT DISTR    |:EX10000 |1        |124 |
|2 |  PX PARTITION ITERATOR|         |1        |124 |
|3 |   UPDATE              |         |1        |124 |
|4 |    TABLE SCAN         |case3_t_1|1        |92  |
=====================================================

Outputs & filters: 
-------------------------------------
  0 - output(nil), filter(nil)
  1 - output(nil), filter(nil), dop=1
  2 - output(nil), filter(nil)
  3 - output(nil), filter(nil), table_columns([{case3_t_1: ({case3_t_1: (case3_t_1.pk1, case3_t_1.a1)})}]),
      update([case3_t_1.a1=?])
  4 - output([case3_t_1.pk1], [case3_t_1.a1]), filter(nil), 
      access([case3_t_1.pk1], [case3_t_1.a1]), partitions(p[0-1])



// expect 1
select hit_count from oceanbase.V$OB_PLAN_CACHE_PLAN_STAT where statement like 'update case3_t_1 set a1 = ?';
+-----------+
| hit_count |
+-----------+
|         1 |
+-----------+


// switch replica leader for case3_tbl_1, part0 in backup, part1 in main

update case3_t_1 set a1 = 4;

explain update case3_t_1 set a1 = 4;
Query Plan
=====================================================
|ID|OPERATOR               |NAME     |EST. ROWS|COST|
-----------------------------------------------------
|0 |PX COORDINATOR         |         |1        |124 |
|1 | EXCHANGE OUT DISTR    |:EX10000 |1        |124 |
|2 |  PX PARTITION ITERATOR|         |1        |124 |
|3 |   UPDATE              |         |1        |124 |
|4 |    TABLE SCAN         |case3_t_1|1        |92  |
=====================================================

Outputs & filters: 
-------------------------------------
  0 - output(nil), filter(nil)
  1 - output(nil), filter(nil), dop=1
  2 - output(nil), filter(nil)
  3 - output(nil), filter(nil), table_columns([{case3_t_1: ({case3_t_1: (case3_t_1.pk1, case3_t_1.a1)})}]),
      update([case3_t_1.a1=?])
  4 - output([case3_t_1.pk1], [case3_t_1.a1]), filter(nil), 
      access([case3_t_1.pk1], [case3_t_1.a1]), partitions(p[0-1])



// expect 2
select hit_count from oceanbase.V$OB_PLAN_CACHE_PLAN_STAT where statement like 'update case3_t_1 set a1 = ?';
+-----------+
| hit_count |
+-----------+
|         1 |
+-----------+

======================= update with subquery ==================================

// all the partitition of case3_t_2 should stay in the same server
update case3_t_2 set a2 = 2 where pk2 in (select pk3 from case3_t_3);
update case3_t_2 set a2 = 2 where pk2 in (select pk3 from case3_t_3);

explain update case3_t_2 set a2 = 2 where pk2 in (select pk3 from case3_t_3);
Query Plan
=====================================================
|ID|OPERATOR               |NAME     |EST. ROWS|COST|
-----------------------------------------------------
|0 |PX COORDINATOR         |         |1        |131 |
|1 | EXCHANGE OUT DISTR    |:EX10000 |1        |131 |
|2 |  PX PARTITION ITERATOR|         |1        |131 |
|3 |   UPDATE              |         |1        |131 |
|4 |    NESTED-LOOP JOIN   |         |1        |100 |
|5 |     TABLE SCAN        |case3_t_3|1        |92  |
|6 |     TABLE GET         |case3_t_2|1        |14  |
=====================================================

Outputs & filters: 
-------------------------------------
  0 - output(nil), filter(nil)
  1 - output(nil), filter(nil), dop=1
  2 - output(nil), filter(nil)
  3 - output(nil), filter(nil), table_columns([{case3_t_2: ({case3_t_2: (case3_t_2.pk2, case3_t_2.a2)})}]),
      update([case3_t_2.a2=?])
  4 - output([case3_t_2.pk2], [case3_t_2.a2]), filter(nil), 
      conds(nil), nl_params_([case3_t_3.pk3])
  5 - output([case3_t_3.pk3]), filter(nil), 
      access([case3_t_3.pk3]), partitions(p[0-1])
  6 - output([case3_t_2.pk2], [case3_t_2.a2]), filter(nil), 
      access([case3_t_2.pk2], [case3_t_2.a2]), partitions(p[0-1])



// expect 1
select hit_count from oceanbase.V$OB_PLAN_CACHE_PLAN_STAT where statement like 'update case3_t_2 set a2 = ? where pk2 in (select pk3 from case3_t_3)';
+-----------+
| hit_count |
+-----------+
|         1 |
+-----------+


// switch replica leader for case3_t_3, part0 in backup, part1 in main

update case3_t_2 set a2 = 3 where pk2 in (select pk3 from case3_t_3);
update case3_t_2 set a2 = 3 where pk2 in (select pk3 from case3_t_3);

explain update case3_t_2 set a2 = 3 where pk2 in (select pk3 from case3_t_3);
Query Plan
============================================================
|ID|OPERATOR                      |NAME     |EST. ROWS|COST|
------------------------------------------------------------
|0 |DISTRIBUTED UPDATE            |         |1        |132 |
|1 | PX COORDINATOR               |         |1        |100 |
|2 |  EXCHANGE OUT DISTR          |:EX10001 |1        |100 |
|3 |   NESTED-LOOP JOIN           |         |1        |100 |
|4 |    EXCHANGE IN DISTR         |         |1        |92  |
|5 |     EXCHANGE OUT DISTR (PKEY)|:EX10000 |1        |92  |
|6 |      PX PARTITION ITERATOR   |         |1        |92  |
|7 |       TABLE SCAN             |case3_t_3|1        |92  |
|8 |    PX PARTITION ITERATOR     |         |1        |14  |
|9 |     TABLE GET                |case3_t_2|1        |14  |
============================================================

Outputs & filters: 
-------------------------------------
  0 - output(nil), filter(nil), table_columns([{case3_t_2: ({case3_t_2: (case3_t_2.pk2, case3_t_2.a2)})}]),
      update([case3_t_2.a2=?])
  1 - output([case3_t_2.pk2], [case3_t_2.a2]), filter(nil)
  2 - output([case3_t_2.pk2], [case3_t_2.a2]), filter(nil), dop=1
  3 - output([case3_t_2.pk2], [case3_t_2.a2]), filter(nil), 
      conds(nil), nl_params_([case3_t_3.pk3])
  4 - output([PARTITION_ID], [case3_t_3.pk3]), filter(nil)
  5 - (#keys=1, [case3_t_3.pk3]), output([PARTITION_ID], [case3_t_3.pk3]), filter(nil), dop=1
  6 - output([case3_t_3.pk3]), filter(nil)
  7 - output([case3_t_3.pk3]), filter(nil), 
      access([case3_t_3.pk3]), partitions(p[0-1])
  8 - output([case3_t_2.pk2], [case3_t_2.a2]), filter(nil)
  9 - output([case3_t_2.pk2], [case3_t_2.a2]), filter(nil), 
      access([case3_t_2.pk2], [case3_t_2.a2]), partitions(p[0-1])


// expect 1, 1
select hit_count from oceanbase.V$OB_PLAN_CACHE_PLAN_STAT where statement like 'update case3_t_2 set a2 = ? where pk2 in (select pk3 from case3_t_3)';
+-----------+
| hit_count |
+-----------+
|         1 |
|         0 |
+-----------+


// switch replica leader for case3_t_3, part0 in main, part1 in main

update case3_t_2 set a2 = 5 where pk2 in (select pk3 from case3_t_3);


// expect 1, 2
select hit_count from oceanbase.V$OB_PLAN_CACHE_PLAN_STAT where statement like 'update case3_t_2 set a2 = ? where pk2 in (select pk3 from case3_t_3)';
+-----------+
| hit_count |
+-----------+
|         2 |
|         0 |
+-----------+


update case3_t_2 set a2 = 5 where pk2 in (select pk3 from case3_t_3);

explain update case3_t_2 set a2 = 5 where pk2 in (select pk3 from case3_t_3);
Query Plan
=====================================================
|ID|OPERATOR               |NAME     |EST. ROWS|COST|
-----------------------------------------------------
|0 |PX COORDINATOR         |         |1        |131 |
|1 | EXCHANGE OUT DISTR    |:EX10000 |1        |131 |
|2 |  PX PARTITION ITERATOR|         |1        |131 |
|3 |   UPDATE              |         |1        |131 |
|4 |    NESTED-LOOP JOIN   |         |1        |100 |
|5 |     TABLE SCAN        |case3_t_3|1        |92  |
|6 |     TABLE GET         |case3_t_2|1        |14  |
=====================================================

Outputs & filters: 
-------------------------------------
  0 - output(nil), filter(nil)
  1 - output(nil), filter(nil), dop=1
  2 - output(nil), filter(nil)
  3 - output(nil), filter(nil), table_columns([{case3_t_2: ({case3_t_2: (case3_t_2.pk2, case3_t_2.a2)})}]),
      update([case3_t_2.a2=?])
  4 - output([case3_t_2.pk2], [case3_t_2.a2]), filter(nil), 
      conds(nil), nl_params_([case3_t_3.pk3])
  5 - output([case3_t_3.pk3]), filter(nil), 
      access([case3_t_3.pk3]), partitions(p[0-1])
  6 - output([case3_t_2.pk2], [case3_t_2.a2]), filter(nil), 
      access([case3_t_2.pk2], [case3_t_2.a2]), partitions(p[0-1])


// expect 2, 2
select hit_count from oceanbase.V$OB_PLAN_CACHE_PLAN_STAT where statement like 'update case3_t_2 set a2 = ? where pk2 in (select pk3 from case3_t_3)';
+-----------+
| hit_count |
+-----------+
|         3 |
|         0 |
+-----------+

**************************************** Case 4 Select Dist Plans ****************************************

======================================= select with 2 tables ===========================================

select * from case4_t_1 join case4_t_2 on case4_t_1.pk1 = case4_t_2.pk2;
select * from case4_t_1 join case4_t_2 on case4_t_1.pk1 = case4_t_2.pk2;

explain select * from case4_t_1 join case4_t_2 on case4_t_1.pk1 = case4_t_2.pk2;
Query Plan
=====================================================
|ID|OPERATOR               |NAME     |EST. ROWS|COST|
-----------------------------------------------------
|0 |PX COORDINATOR         |         |1        |100 |
|1 | EXCHANGE OUT DISTR    |:EX10000 |1        |100 |
|2 |  PX PARTITION ITERATOR|         |1        |100 |
|3 |   NESTED-LOOP JOIN    |         |1        |100 |
|4 |    TABLE SCAN         |case4_t_1|1        |92  |
|5 |    TABLE GET          |case4_t_2|1        |14  |
=====================================================

Outputs & filters: 
-------------------------------------
  0 - output([INTERNAL_FUNCTION(case4_t_1.pk1, case4_t_1.a1, case4_t_2.pk2, case4_t_2.a2)]), filter(nil)
  1 - output([INTERNAL_FUNCTION(case4_t_1.pk1, case4_t_1.a1, case4_t_2.pk2, case4_t_2.a2)]), filter(nil), dop=1
  2 - output([case4_t_1.pk1], [case4_t_1.a1], [case4_t_2.pk2], [case4_t_2.a2]), filter(nil)
  3 - output([case4_t_1.pk1], [case4_t_1.a1], [case4_t_2.pk2], [case4_t_2.a2]), filter(nil), 
      conds(nil), nl_params_([case4_t_1.pk1])
  4 - output([case4_t_1.pk1], [case4_t_1.a1]), filter(nil), 
      access([case4_t_1.pk1], [case4_t_1.a1]), partitions(p[0-1])
  5 - output([case4_t_2.pk2], [case4_t_2.a2]), filter(nil), 
      access([case4_t_2.pk2], [case4_t_2.a2]), partitions(p[0-1])



// expect 1
select hit_count from oceanbase.V$OB_PLAN_CACHE_PLAN_STAT where statement like 'select * from case4_t_1 join case4_t_2 on case4_t_1.pk1 = case4_t_2.pk2';
+-----------+
| hit_count |
+-----------+
|         1 |
+-----------+


// switch replica leader for case4_t_1, part0 in backup, part1 in main

select * from case4_t_1 join case4_t_2 on case4_t_1.pk1 = case4_t_2.pk2;
select * from case4_t_1 join case4_t_2 on case4_t_1.pk1 = case4_t_2.pk2;


explain select * from case4_t_1 join case4_t_2 on case4_t_1.pk1 = case4_t_2.pk2;
Query Plan
===========================================================
|ID|OPERATOR                     |NAME     |EST. ROWS|COST|
-----------------------------------------------------------
|0 |PX COORDINATOR               |         |1        |100 |
|1 | EXCHANGE OUT DISTR          |:EX10001 |1        |100 |
|2 |  NESTED-LOOP JOIN           |         |1        |100 |
|3 |   EXCHANGE IN DISTR         |         |1        |92  |
|4 |    EXCHANGE OUT DISTR (PKEY)|:EX10000 |1        |92  |
|5 |     PX PARTITION ITERATOR   |         |1        |92  |
|6 |      TABLE SCAN             |case4_t_1|1        |92  |
|7 |   PX PARTITION ITERATOR     |         |1        |14  |
|8 |    TABLE GET                |case4_t_2|1        |14  |
===========================================================

Outputs & filters: 
-------------------------------------
  0 - output([INTERNAL_FUNCTION(case4_t_1.pk1, case4_t_1.a1, case4_t_2.pk2, case4_t_2.a2)]), filter(nil)
  1 - output([INTERNAL_FUNCTION(case4_t_1.pk1, case4_t_1.a1, case4_t_2.pk2, case4_t_2.a2)]), filter(nil), dop=1
  2 - output([case4_t_1.pk1], [case4_t_1.a1], [case4_t_2.pk2], [case4_t_2.a2]), filter(nil), 
      conds(nil), nl_params_([case4_t_1.pk1])
  3 - output([case4_t_1.pk1], [PARTITION_ID], [case4_t_1.a1]), filter(nil)
  4 - (#keys=1, [case4_t_1.pk1]), output([case4_t_1.pk1], [PARTITION_ID], [case4_t_1.a1]), filter(nil), dop=1
  5 - output([case4_t_1.pk1], [case4_t_1.a1]), filter(nil)
  6 - output([case4_t_1.pk1], [case4_t_1.a1]), filter(nil), 
      access([case4_t_1.pk1], [case4_t_1.a1]), partitions(p[0-1])
  7 - output([case4_t_2.pk2], [case4_t_2.a2]), filter(nil)
  8 - output([case4_t_2.pk2], [case4_t_2.a2]), filter(nil), 
      access([case4_t_2.pk2], [case4_t_2.a2]), partitions(p[0-1])



// new plan was generated, count(hit_count) == 2, expect 1, 1
select hit_count from oceanbase.V$OB_PLAN_CACHE_PLAN_STAT where statement like 'select * from case4_t_1 join case4_t_2 on case4_t_1.pk1 = case4_t_2.pk2';
+-----------+
| hit_count |
+-----------+
|         1 |
|         1 |
+-----------+


// switch replica for case4_t_1, part0 in main, part1 in main

select * from case4_t_1 join case4_t_2 on case4_t_1.pk1 = case4_t_2.pk2;


// expect 1, 2
select hit_count from oceanbase.V$OB_PLAN_CACHE_PLAN_STAT where statement like 'select * from case4_t_1 join case4_t_2 on case4_t_1.pk1 = case4_t_2.pk2';
+-----------+
| hit_count |
+-----------+
|         2 |
|         1 |
+-----------+


select * from case4_t_1 join case4_t_2 on case4_t_1.pk1 = case4_t_2.pk2;

explain select * from case4_t_1 join case4_t_2 on case4_t_1.pk1 = case4_t_2.pk2;
Query Plan
=====================================================
|ID|OPERATOR               |NAME     |EST. ROWS|COST|
-----------------------------------------------------
|0 |PX COORDINATOR         |         |1        |100 |
|1 | EXCHANGE OUT DISTR    |:EX10000 |1        |100 |
|2 |  PX PARTITION ITERATOR|         |1        |100 |
|3 |   NESTED-LOOP JOIN    |         |1        |100 |
|4 |    TABLE SCAN         |case4_t_1|1        |92  |
|5 |    TABLE GET          |case4_t_2|1        |14  |
=====================================================

Outputs & filters: 
-------------------------------------
  0 - output([INTERNAL_FUNCTION(case4_t_1.pk1, case4_t_1.a1, case4_t_2.pk2, case4_t_2.a2)]), filter(nil)
  1 - output([INTERNAL_FUNCTION(case4_t_1.pk1, case4_t_1.a1, case4_t_2.pk2, case4_t_2.a2)]), filter(nil), dop=1
  2 - output([case4_t_1.pk1], [case4_t_1.a1], [case4_t_2.pk2], [case4_t_2.a2]), filter(nil)
  3 - output([case4_t_1.pk1], [case4_t_1.a1], [case4_t_2.pk2], [case4_t_2.a2]), filter(nil), 
      conds(nil), nl_params_([case4_t_1.pk1])
  4 - output([case4_t_1.pk1], [case4_t_1.a1]), filter(nil), 
      access([case4_t_1.pk1], [case4_t_1.a1]), partitions(p[0-1])
  5 - output([case4_t_2.pk2], [case4_t_2.a2]), filter(nil), 
      access([case4_t_2.pk2], [case4_t_2.a2]), partitions(p[0-1])


// expect 2, 2
select hit_count from oceanbase.V$OB_PLAN_CACHE_PLAN_STAT where statement like 'select * from case4_t_1 join case4_t_2 on case4_t_1.pk1 = case4_t_2.pk2';
+-----------+
| hit_count |
+-----------+
|         3 |
|         1 |
+-----------+


=========================== select xxx from t join select 1, etc ================================

select pk3 from case4_t_3 left join (select 1 v1 from dual) tmp_t on tmp_t.v1 = case4_t_3.pk3;

explain select pk3 from case4_t_3 left join (select 1 v1 from dual) tmp_t on tmp_t.v1 = case4_t_3.pk3;
Query Plan
=====================================================
|ID|OPERATOR               |NAME     |EST. ROWS|COST|
-----------------------------------------------------
|0 |PX COORDINATOR         |         |1        |92  |
|1 | EXCHANGE OUT DISTR    |:EX10000 |1        |92  |
|2 |  PX PARTITION ITERATOR|         |1        |92  |
|3 |   TABLE SCAN          |case4_t_3|1        |92  |
=====================================================

Outputs & filters: 
-------------------------------------
  0 - output([INTERNAL_FUNCTION(case4_t_3.pk3)]), filter(nil)
  1 - output([INTERNAL_FUNCTION(case4_t_3.pk3)]), filter(nil), dop=1
  2 - output([case4_t_3.pk3]), filter(nil)
  3 - output([case4_t_3.pk3]), filter(nil), 
      access([case4_t_3.pk3]), partitions(p[0-1])



// hit_count == 0
select hit_count from oceanbase.V$OB_PLAN_CACHE_PLAN_STAT where statement like 'select pk3 from case4_t_3 left join (select ? v1 from dual) tmp_t on tmp_t.v1 = case4_t_3.pk3';
+-----------+
| hit_count |
+-----------+
|         0 |
+-----------+


// switch replica leader for case4_t_3, part0 in backup, part1 in main

select pk3 from case4_t_3 left join (select 1 v1 from dual) tmp_t on tmp_t.v1 = case4_t_3.pk3;

explain select pk3 from case4_t_3 left join (select 1 v1 from dual) tmp_t on tmp_t.v1 = case4_t_3.pk3;
Query Plan
=====================================================
|ID|OPERATOR               |NAME     |EST. ROWS|COST|
-----------------------------------------------------
|0 |PX COORDINATOR         |         |1        |92  |
|1 | EXCHANGE OUT DISTR    |:EX10000 |1        |92  |
|2 |  PX PARTITION ITERATOR|         |1        |92  |
|3 |   TABLE SCAN          |case4_t_3|1        |92  |
=====================================================

Outputs & filters: 
-------------------------------------
  0 - output([INTERNAL_FUNCTION(case4_t_3.pk3)]), filter(nil)
  1 - output([INTERNAL_FUNCTION(case4_t_3.pk3)]), filter(nil), dop=1
  2 - output([case4_t_3.pk3]), filter(nil)
  3 - output([case4_t_3.pk3]), filter(nil), 
      access([case4_t_3.pk3]), partitions(p[0-1])



// hit the same plan, expect 1
select hit_count from oceanbase.V$OB_PLAN_CACHE_PLAN_STAT where statement like 'select pk3 from case4_t_3 left join (select ? v1 from dual) tmp_t on tmp_t.v1 = case4_t_3.pk3';
+-----------+
| hit_count |
+-----------+
|         1 |
+-----------+


==================================== select with 3 tables ====================================

select * from case4_t_4, case4_t_5, case4_t_6 where pk4 = pk5 and pk5 = pk6;
select * from case4_t_4, case4_t_5, case4_t_6 where pk4 = pk5 and pk5 = pk6;

explain select * from case4_t_4, case4_t_5, case4_t_6 where pk4 = pk5 and pk5 = pk6;
Query Plan
=====================================================
|ID|OPERATOR               |NAME     |EST. ROWS|COST|
-----------------------------------------------------
|0 |PX COORDINATOR         |         |1        |108 |
|1 | EXCHANGE OUT DISTR    |:EX10000 |1        |108 |
|2 |  PX PARTITION ITERATOR|         |1        |107 |
|3 |   NESTED-LOOP JOIN    |         |1        |107 |
|4 |    NESTED-LOOP JOIN   |         |1        |100 |
|5 |     TABLE SCAN        |case4_t_4|1        |92  |
|6 |     TABLE GET         |case4_t_5|1        |14  |
|7 |    TABLE GET          |case4_t_6|1        |14  |
=====================================================

Outputs & filters: 
-------------------------------------
  0 - output([INTERNAL_FUNCTION(case4_t_4.pk4, case4_t_4.a4, case4_t_5.pk5, case4_t_5.a5, case4_t_6.pk6, case4_t_6.a6)]), filter(nil)
  1 - output([INTERNAL_FUNCTION(case4_t_4.pk4, case4_t_4.a4, case4_t_5.pk5, case4_t_5.a5, case4_t_6.pk6, case4_t_6.a6)]), filter(nil), dop=1
  2 - output([case4_t_5.pk5], [case4_t_4.pk4], [case4_t_4.a4], [case4_t_5.a5], [case4_t_6.pk6], [case4_t_6.a6]), filter(nil)
  3 - output([case4_t_5.pk5], [case4_t_4.pk4], [case4_t_4.a4], [case4_t_5.a5], [case4_t_6.pk6], [case4_t_6.a6]), filter(nil), 
      conds(nil), nl_params_([case4_t_5.pk5])
  4 - output([case4_t_5.pk5], [case4_t_4.pk4], [case4_t_4.a4], [case4_t_5.a5]), filter(nil), 
      conds(nil), nl_params_([case4_t_4.pk4])
  5 - output([case4_t_4.pk4], [case4_t_4.a4]), filter(nil), 
      access([case4_t_4.pk4], [case4_t_4.a4]), partitions(p[0-1])
  6 - output([case4_t_5.pk5], [case4_t_5.a5]), filter(nil), 
      access([case4_t_5.pk5], [case4_t_5.a5]), partitions(p[0-1])
  7 - output([case4_t_6.pk6], [case4_t_6.a6]), filter(nil), 
      access([case4_t_6.pk6], [case4_t_6.a6]), partitions(p[0-1])



// new plan was genenered, expect 1
select hit_count from oceanbase.V$OB_PLAN_CACHE_PLAN_STAT where statement like 'select * from case4_t_4, case4_t_5, case4_t_6 where pk4 = pk5 and pk5 = pk6';
+-----------+
| hit_count |
+-----------+
|         1 |
+-----------+


// switch replica leader for case4_t_4, part0 in backup, part1 in main

select * from case4_t_4, case4_t_5, case4_t_6 where pk4 = pk5 and pk5 = pk6;
select * from case4_t_4, case4_t_5, case4_t_6 where pk4 = pk5 and pk5 = pk6;

explain select * from case4_t_4, case4_t_5, case4_t_6 where pk4 = pk5 and pk5 = pk6;
Query Plan
============================================================
|ID|OPERATOR                      |NAME     |EST. ROWS|COST|
------------------------------------------------------------
|0 |PX COORDINATOR                |         |1        |108 |
|1 | EXCHANGE OUT DISTR           |:EX10001 |1        |108 |
|2 |  NESTED-LOOP JOIN            |         |1        |108 |
|3 |   NESTED-LOOP JOIN           |         |1        |100 |
|4 |    EXCHANGE IN DISTR         |         |1        |92  |
|5 |     EXCHANGE OUT DISTR (PKEY)|:EX10000 |1        |92  |
|6 |      PX PARTITION ITERATOR   |         |1        |92  |
|7 |       TABLE SCAN             |case4_t_4|1        |92  |
|8 |    PX PARTITION ITERATOR     |         |1        |14  |
|9 |     TABLE GET                |case4_t_5|1        |14  |
|10|   PX PARTITION ITERATOR      |         |1        |14  |
|11|    TABLE GET                 |case4_t_6|1        |14  |
============================================================

Outputs & filters: 
-------------------------------------
  0 - output([INTERNAL_FUNCTION(case4_t_4.pk4, case4_t_4.a4, case4_t_5.pk5, case4_t_5.a5, case4_t_6.pk6, case4_t_6.a6)]), filter(nil)
  1 - output([INTERNAL_FUNCTION(case4_t_4.pk4, case4_t_4.a4, case4_t_5.pk5, case4_t_5.a5, case4_t_6.pk6, case4_t_6.a6)]), filter(nil), dop=1
  2 - output([case4_t_5.pk5], [case4_t_4.pk4], [case4_t_4.a4], [case4_t_5.a5], [case4_t_6.pk6], [case4_t_6.a6]), filter(nil), 
      conds(nil), nl_params_([case4_t_5.pk5])
  3 - output([case4_t_5.pk5], [case4_t_4.pk4], [case4_t_4.a4], [case4_t_5.a5]), filter(nil), 
      conds(nil), nl_params_([case4_t_4.pk4])
  4 - output([case4_t_4.pk4], [PARTITION_ID], [case4_t_4.a4]), filter(nil)
  5 - (#keys=1, [case4_t_4.pk4]), output([case4_t_4.pk4], [PARTITION_ID], [case4_t_4.a4]), filter(nil), dop=1
  6 - output([case4_t_4.pk4], [case4_t_4.a4]), filter(nil)
  7 - output([case4_t_4.pk4], [case4_t_4.a4]), filter(nil), 
      access([case4_t_4.pk4], [case4_t_4.a4]), partitions(p[0-1])
  8 - output([case4_t_5.pk5], [case4_t_5.a5]), filter(nil)
  9 - output([case4_t_5.pk5], [case4_t_5.a5]), filter(nil), 
      access([case4_t_5.pk5], [case4_t_5.a5]), partitions(p[0-1])
  10 - output([case4_t_6.pk6], [case4_t_6.a6]), filter(nil)
  11 - output([case4_t_6.pk6], [case4_t_6.a6]), filter(nil), 
      access([case4_t_6.pk6], [case4_t_6.a6]), partitions(p[0-1])



// expect 1, 1
select hit_count from oceanbase.V$OB_PLAN_CACHE_PLAN_STAT where statement like 'select * from case4_t_4, case4_t_5, case4_t_6 where pk4 = pk5 and pk5 = pk6';
+-----------+
| hit_count |
+-----------+
|         1 |
|         1 |
+-----------+


// switch replica leader for case4_t_5, part0 in backup, part1 in main

select * from case4_t_4, case4_t_5, case4_t_6 where pk4 = pk5 and pk5 = pk6;
select * from case4_t_4, case4_t_5, case4_t_6 where pk4 = pk5 and pk5 = pk6;


explain select * from case4_t_4, case4_t_5, case4_t_6 where pk4 = pk5 and pk5 = pk6;
Query Plan
============================================================
|ID|OPERATOR                      |NAME     |EST. ROWS|COST|
------------------------------------------------------------
|0 |PX COORDINATOR                |         |1        |108 |
|1 | EXCHANGE OUT DISTR           |:EX10001 |1        |108 |
|2 |  NESTED-LOOP JOIN            |         |1        |108 |
|3 |   NESTED-LOOP JOIN           |         |1        |100 |
|4 |    EXCHANGE IN DISTR         |         |1        |92  |
|5 |     EXCHANGE OUT DISTR (PKEY)|:EX10000 |1        |92  |
|6 |      PX PARTITION ITERATOR   |         |1        |92  |
|7 |       TABLE SCAN             |case4_t_6|1        |92  |
|8 |    PX PARTITION ITERATOR     |         |1        |14  |
|9 |     TABLE GET                |case4_t_4|1        |14  |
|10|   PX PARTITION ITERATOR      |         |1        |14  |
|11|    TABLE GET                 |case4_t_5|1        |14  |
============================================================

Outputs & filters: 
-------------------------------------
  0 - output([INTERNAL_FUNCTION(case4_t_4.pk4, case4_t_4.a4, case4_t_5.pk5, case4_t_5.a5, case4_t_6.pk6, case4_t_6.a6)]), filter(nil)
  1 - output([INTERNAL_FUNCTION(case4_t_4.pk4, case4_t_4.a4, case4_t_5.pk5, case4_t_5.a5, case4_t_6.pk6, case4_t_6.a6)]), filter(nil), dop=1
  2 - output([case4_t_4.pk4], [case4_t_6.pk6], [case4_t_6.a6], [case4_t_4.a4], [case4_t_5.pk5], [case4_t_5.a5]), filter(nil), 
      conds(nil), nl_params_([case4_t_4.pk4])
  3 - output([case4_t_4.pk4], [case4_t_6.pk6], [case4_t_6.a6], [case4_t_4.a4]), filter(nil), 
      conds(nil), nl_params_([case4_t_6.pk6])
  4 - output([case4_t_6.pk6], [PARTITION_ID], [case4_t_6.a6]), filter(nil)
  5 - (#keys=1, [case4_t_6.pk6]), output([case4_t_6.pk6], [PARTITION_ID], [case4_t_6.a6]), filter(nil), dop=1
  6 - output([case4_t_6.pk6], [case4_t_6.a6]), filter(nil)
  7 - output([case4_t_6.pk6], [case4_t_6.a6]), filter(nil), 
      access([case4_t_6.pk6], [case4_t_6.a6]), partitions(p[0-1])
  8 - output([case4_t_4.pk4], [case4_t_4.a4]), filter(nil)
  9 - output([case4_t_4.pk4], [case4_t_4.a4]), filter(nil), 
      access([case4_t_4.pk4], [case4_t_4.a4]), partitions(p[0-1])
  10 - output([case4_t_5.pk5], [case4_t_5.a5]), filter(nil)
  11 - output([case4_t_5.pk5], [case4_t_5.a5]), filter(nil), 
      access([case4_t_5.pk5], [case4_t_5.a5]), partitions(p[0-1])



// new plan expect 1, 1, 1
select hit_count from oceanbase.V$OB_PLAN_CACHE_PLAN_STAT where statement like 'select * from case4_t_4, case4_t_5, case4_t_6 where pk4 = pk5 and pk5 = pk6';
+-----------+
| hit_count |
+-----------+
|         1 |
|         1 |
|         1 |
+-----------+


// switch replica leader for case4_t_6, part0 in backup, part1 in main

select * from case4_t_4, case4_t_5, case4_t_6 where pk4 = pk5 and pk5 = pk6;

// expect 1, 1, 2
select hit_count from oceanbase.V$OB_PLAN_CACHE_PLAN_STAT where statement like 'select * from case4_t_4, case4_t_5, case4_t_6 where pk4 = pk5 and pk5 = pk6';
+-----------+
| hit_count |
+-----------+
|         2 |
|         1 |
|         1 |
+-----------+

select * from case4_t_4, case4_t_5, case4_t_6 where pk4 = pk5 and pk5 = pk6;
+-----+------+-----+------+-----+------+
| pk4 | a4   | pk5 | a5   | pk6 | a6   |
+-----+------+-----+------+-----+------+
|   1 |    1 |   1 |    1 |   1 |    1 |
|   2 |    2 |   2 |    2 |   2 |    2 |
+-----+------+-----+------+-----+------+

explain select * from case4_t_4, case4_t_5, case4_t_6 where pk4 = pk5 and pk5 = pk6;
Query Plan
=====================================================
|ID|OPERATOR               |NAME     |EST. ROWS|COST|
-----------------------------------------------------
|0 |PX COORDINATOR         |         |1        |108 |
|1 | EXCHANGE OUT DISTR    |:EX10000 |1        |108 |
|2 |  PX PARTITION ITERATOR|         |1        |107 |
|3 |   NESTED-LOOP JOIN    |         |1        |107 |
|4 |    NESTED-LOOP JOIN   |         |1        |100 |
|5 |     TABLE SCAN        |case4_t_4|1        |92  |
|6 |     TABLE GET         |case4_t_5|1        |14  |
|7 |    TABLE GET          |case4_t_6|1        |14  |
=====================================================

Outputs & filters: 
-------------------------------------
  0 - output([INTERNAL_FUNCTION(case4_t_4.pk4, case4_t_4.a4, case4_t_5.pk5, case4_t_5.a5, case4_t_6.pk6, case4_t_6.a6)]), filter(nil)
  1 - output([INTERNAL_FUNCTION(case4_t_4.pk4, case4_t_4.a4, case4_t_5.pk5, case4_t_5.a5, case4_t_6.pk6, case4_t_6.a6)]), filter(nil), dop=1
  2 - output([case4_t_5.pk5], [case4_t_4.pk4], [case4_t_4.a4], [case4_t_5.a5], [case4_t_6.pk6], [case4_t_6.a6]), filter(nil)
  3 - output([case4_t_5.pk5], [case4_t_4.pk4], [case4_t_4.a4], [case4_t_5.a5], [case4_t_6.pk6], [case4_t_6.a6]), filter(nil), 
      conds(nil), nl_params_([case4_t_5.pk5])
  4 - output([case4_t_5.pk5], [case4_t_4.pk4], [case4_t_4.a4], [case4_t_5.a5]), filter(nil), 
      conds(nil), nl_params_([case4_t_4.pk4])
  5 - output([case4_t_4.pk4], [case4_t_4.a4]), filter(nil), 
      access([case4_t_4.pk4], [case4_t_4.a4]), partitions(p[0-1])
  6 - output([case4_t_5.pk5], [case4_t_5.a5]), filter(nil), 
      access([case4_t_5.pk5], [case4_t_5.a5]), partitions(p[0-1])
  7 - output([case4_t_6.pk6], [case4_t_6.a6]), filter(nil), 
      access([case4_t_6.pk6], [case4_t_6.a6]), partitions(p[0-1])


// expect 2, 1, 2
select hit_count from oceanbase.V$OB_PLAN_CACHE_PLAN_STAT where statement like 'select * from case4_t_4, case4_t_5, case4_t_6 where pk4 = pk5 and pk5 = pk6';
+-----------+
| hit_count |
+-----------+
|         3 |
|         1 |
|         1 |
+-----------+

==================================== Case#5 insert dist plan ====================================
insert into case5_t_1 values (1, 1), (2, 2);
insert into case5_t_1 values (3, 3), (4, 4);

// expect 1
select hit_count from oceanbase.V$OB_PLAN_CACHE_PLAN_STAT where statement like 'insert into case5_t_1 values (?, ?), (?, ?)';
+-----------+
| hit_count |
+-----------+
|         1 |
+-----------+

switch case5_t_1 part0 to backup, now part0 in backup, part1 in main
insert into case5_t_1 values (5, 5), (6, 6);

explain insert into case5_t_1 values (5, 5), (6, 6);
Query Plan
===========================================
|ID|OPERATOR          |NAME|EST. ROWS|COST|
-------------------------------------------
|0 |DISTRIBUTED INSERT|    |2        |20  |
|1 | EXPRESSION       |    |2        |1   |
===========================================

Outputs & filters: 
-------------------------------------
  0 - output(nil), filter(nil), 
      columns([{case5_t_1: ({case5_t_1: (case5_t_1.pk, case5_t_1.a)})}]), partitions(p[0-1]), 
      column_values([column_conv(INT,PS:(11,0),NOT NULL,__values.pk)], [column_conv(INT,PS:(11,0),NULL,__values.a)])
  1 - output([__values.pk], [__values.a]), filter(nil)
      values({5, 5}, {6, 6})

// expect 2
select hit_count from oceanbase.V$OB_PLAN_CACHE_PLAN_STAT where statement like 'insert into case5_t_1 values (?, ?), (?, ?)';
+-----------+
| hit_count |
+-----------+
|         2 |
+-----------+

// select result for debug
select * from case5_t_1 order by pk;
+----+------+
| pk | a    |
+----+------+
|  1 |    1 |
|  2 |    2 |
|  3 |    3 |
|  4 |    4 |
|  5 |    5 |
|  6 |    6 |
+----+------+


// Insert into select
insert into case5_t_2 (select * from case5_t_1);
explain insert into case5_t_2 (select * from case5_t_1);
Query Plan
=======================================================
|ID|OPERATOR                 |NAME     |EST. ROWS|COST|
-------------------------------------------------------
|0 |DISTRIBUTED INSERT       |         |1        |105 |
|1 | PX COORDINATOR          |         |1        |92  |
|2 |  EXCHANGE OUT DISTR     |:EX10000 |1        |92  |
|3 |   SUBPLAN SCAN          |VIEW1    |1        |92  |
|4 |    PX PARTITION ITERATOR|         |1        |92  |
|5 |     TABLE SCAN          |case5_t_1|1        |92  |
=======================================================

Outputs & filters: 
-------------------------------------
  0 - output(nil), filter(nil), 
      columns([{case5_t_2: ({case5_t_2: (case5_t_2.pk, case5_t_2.a)})}]), partitions(p[0-1]), 
      column_values([column_conv(INT,PS:(11,0),NOT NULL,VIEW1.pk)], [column_conv(INT,PS:(11,0),NULL,VIEW1.a)])
  1 - output([VIEW1.pk], [VIEW1.a]), filter(nil)
  2 - output([VIEW1.pk], [VIEW1.a]), filter(nil), dop=1
  3 - output([VIEW1.pk], [VIEW1.a]), filter(nil), 
      access([VIEW1.pk], [VIEW1.a])
  4 - output([case5_t_1.pk], [case5_t_1.a]), filter(nil)
  5 - output([case5_t_1.pk], [case5_t_1.a]), filter(nil), 
      access([case5_t_1.pk], [case5_t_1.a]), partitions(p[0-1])


// expect hit_count = 0
select hit_count from oceanbase.V$OB_PLAN_CACHE_PLAN_STAT where statement like 'insert into case5_t_2 (select * from case5_t_1)';
+-----------+
| hit_count |
+-----------+
|         0 |
+-----------+

delete from case5_t_2;

switch case5_t_1 part0 to main, now part0 in main, part1 in main
insert into case5_t_2 (select * from case5_t_1);
explain insert into case5_t_2 (select * from case5_t_1);
Query Plan
=====================================================
|ID|OPERATOR               |NAME     |EST. ROWS|COST|
-----------------------------------------------------
|0 |PX COORDINATOR         |         |1        |105 |
|1 | EXCHANGE OUT DISTR    |:EX10000 |1        |105 |
|2 |  PX PARTITION ITERATOR|         |1        |105 |
|3 |   INSERT              |         |1        |105 |
|4 |    SUBPLAN SCAN       |VIEW1    |1        |92  |
|5 |     TABLE SCAN        |case5_t_1|1        |92  |
=====================================================

Outputs & filters: 
-------------------------------------
  0 - output(nil), filter(nil)
  1 - output(nil), filter(nil), dop=1
  2 - output(nil), filter(nil)
  3 - output(nil), filter(nil), 
      columns([{case5_t_2: ({case5_t_2: (case5_t_2.pk, case5_t_2.a)})}]), partitions(p[0-1]), 
      column_values([column_conv(INT,PS:(11,0),NOT NULL,VIEW1.pk)], [column_conv(INT,PS:(11,0),NULL,VIEW1.a)])
  4 - output([VIEW1.pk], [VIEW1.a]), filter(nil), 
      access([VIEW1.pk], [VIEW1.a])
  5 - output([case5_t_1.pk], [case5_t_1.a]), filter(nil), 
      access([case5_t_1.pk], [case5_t_1.a]), partitions(p[0-1])


// expect hit_count = 1
select hit_count from oceanbase.V$OB_PLAN_CACHE_PLAN_STAT where statement like 'insert into case5_t_2 (select * from case5_t_1)';
+-----------+
| hit_count |
+-----------+
|         1 |
+-----------+

// select result for debug
select * from case5_t_2 order by pk;
+----+------+
| pk | a    |
+----+------+
|  1 |    1 |
|  2 |    2 |
|  3 |    3 |
|  4 |    4 |
|  5 |    5 |
|  6 |    6 |
+----+------+

****************************** cleanup ******************************
