result_format: 4

alter system flush plan cache global;
alter system set enable_auto_leader_switch=false;

set ob_trx_timeout = 100000000000;
// >>>>>>>>>>>>>>>>>>>>>>>>> CASE#1 MULTI PART INSERT
insert /*+index(cz_t1 idx_t1_a)*/into cz_t1 values (1, 1, 1, 1, 1, 1), (2, 2, 2, 2, 2, 2);
insert /*+index(cz_t1 idx_t1_a)*/into cz_t1 values (3, 3, 3, 3, 3, 3), (4, 4, 4, 4, 4, 4);
explain insert /*+index(cz_t1 idx_t1_a)*/into cz_t1 values (3, 3, 3, 3, 3, 3), (4, 4, 4, 4, 4, 4);
Query Plan
===========================================
|ID|OPERATOR          |NAME|EST. ROWS|COST|
-------------------------------------------
|0 |DISTRIBUTED INSERT|    |2        |26  |
|1 | EXPRESSION       |    |2        |1   |
===========================================

Outputs & filters: 
-------------------------------------
  0 - output(nil), filter(nil), 
      columns([{cz_t1: ({cz_t1: (cz_t1.pk, cz_t1.a, cz_t1.b, cz_t1.c, cz_t1.e, cz_t1.d)}, {idx_t1_a: (cz_t1.a, cz_t1.pk)})}]), partitions(p[0-1]), 
      column_values([column_conv(INT,PS:(11,0),NOT NULL,__values.pk)], [column_conv(INT,PS:(11,0),NULL,__values.a)], [column_conv(INT,PS:(11,0),NULL,__values.b)], [column_conv(INT,PS:(11,0),NULL,__values.c)], [column_conv(INT,PS:(11,0),NULL,__values.e)], [column_conv(INT,PS:(11,0),NULL,__values.d)])
  1 - output([__values.pk], [__values.a], [__values.b], [__values.c], [__values.e], [__values.d]), filter(nil)
      values({3, 3, 3, 3, 3, 3}, {4, 4, 4, 4, 4, 4})

// expect hit_count = 1
select hit_count, type from oceanbase.V$OB_PLAN_CACHE_PLAN_STAT where statement like 'insert /*+index(cz_t1 idx_t1_a)*/into cz_t1 values (?, ?, ?, ?, ?, ?), (?, ?, ?, ?, ?, ?)';
+-----------+------+
| hit_count | type |
+-----------+------+
|         1 |    1 |
+-----------+------+

// switch cz_t1 part1 to backup
insert /*+index(cz_t1 idx_t1_a)*/into cz_t1 values (5, 5, 5, 5, 5, 5), (6, 6, 6, 6, 6, 6);
explain /*+index(cz_t1 idx_t1_a)*/insert into cz_t1 values (5, 5, 5, 5, 5, 5), (6, 6, 6, 6, 6, 6);
Query Plan
===========================================
|ID|OPERATOR          |NAME|EST. ROWS|COST|
-------------------------------------------
|0 |DISTRIBUTED INSERT|    |2        |26  |
|1 | EXPRESSION       |    |2        |1   |
===========================================

Outputs & filters: 
-------------------------------------
  0 - output(nil), filter(nil), 
      columns([{cz_t1: ({cz_t1: (cz_t1.pk, cz_t1.a, cz_t1.b, cz_t1.c, cz_t1.e, cz_t1.d)}, {idx_t1_a: (cz_t1.a, cz_t1.pk)})}]), partitions(p[0-1]), 
      column_values([column_conv(INT,PS:(11,0),NOT NULL,__values.pk)], [column_conv(INT,PS:(11,0),NULL,__values.a)], [column_conv(INT,PS:(11,0),NULL,__values.b)], [column_conv(INT,PS:(11,0),NULL,__values.c)], [column_conv(INT,PS:(11,0),NULL,__values.e)], [column_conv(INT,PS:(11,0),NULL,__values.d)])
  1 - output([__values.pk], [__values.a], [__values.b], [__values.c], [__values.e], [__values.d]), filter(nil)
      values({5, 5, 5, 5, 5, 5}, {6, 6, 6, 6, 6, 6})

// expect hit_count = 2
select hit_count, type from oceanbase.V$OB_PLAN_CACHE_PLAN_STAT where statement like 'insert /*+index(cz_t1 idx_t1_a)*/into cz_t1 values (?, ?, ?, ?, ?, ?), (?, ?, ?, ?, ?, ?)';
+-----------+------+
| hit_count | type |
+-----------+------+
|         2 |    1 |
+-----------+------+

delete from cz_t1;

insert into src_t values (2, 2, 2, 2, 2, 2);
insert into cz_t1 (select * from src_t where pk = 2);
delete from src_t;
insert into src_t values (4, 4, 4, 4, 4, 4);
insert into cz_t1 (select * from src_t where pk = 4);

explain insert into cz_t1 (select * from src_t where pk = 4);
Query Plan
============================================
|ID|OPERATOR          |NAME |EST. ROWS|COST|
--------------------------------------------
|0 |DISTRIBUTED INSERT|     |1        |65  |
|1 | SUBPLAN SCAN     |VIEW1|1        |46  |
|2 |  TABLE GET       |src_t|1        |46  |
============================================

Outputs & filters: 
-------------------------------------
  0 - output(nil), filter(nil), 
      columns([{cz_t1: ({cz_t1: (cz_t1.pk, cz_t1.a, cz_t1.b, cz_t1.c, cz_t1.e, cz_t1.d)}, {idx_t1_a: (cz_t1.a, cz_t1.pk)})}]), partitions(p0), 
      column_values([column_conv(INT,PS:(11,0),NOT NULL,VIEW1.pk)], [column_conv(INT,PS:(11,0),NULL,VIEW1.a)], [column_conv(INT,PS:(11,0),NULL,VIEW1.b)], [column_conv(INT,PS:(11,0),NULL,VIEW1.c)], [column_conv(INT,PS:(11,0),NULL,VIEW1.e)], [column_conv(INT,PS:(11,0),NULL,VIEW1.d)])
  1 - output([VIEW1.pk], [VIEW1.a], [VIEW1.b], [VIEW1.c], [VIEW1.e], [VIEW1.d]), filter(nil), 
      access([VIEW1.pk], [VIEW1.a], [VIEW1.b], [VIEW1.c], [VIEW1.e], [VIEW1.d])
  2 - output([src_t.pk], [src_t.a], [src_t.b], [src_t.c], [src_t.e], [src_t.d]), filter(nil), 
      access([src_t.pk], [src_t.a], [src_t.b], [src_t.c], [src_t.e], [src_t.d]), partitions(p0)


// hit_count = 1, type = 1
select hit_count, type from oceanbase.V$OB_PLAN_CACHE_PLAN_STAT where statement like 'insert into cz_t1 (select * from src_t where pk = ?)';
+-----------+------+
| hit_count | type |
+-----------+------+
|         1 |    3 |
+-----------+------+

// switch src_t part1 to backup
delete from src_t;
insert into src_t values (6, 6, 6, 6, 6, 6);
insert into cz_t1 (select * from src_t where pk = 6);
delete from src_t;
insert into src_t values (8, 8, 8, 8, 8, 8);
insert into cz_t1 (select * from src_t where pk = 8);

explain insert into cz_t1 (select * from src_t where pk = 8);
Query Plan
=================================================
|ID|OPERATOR            |NAME    |EST. ROWS|COST|
-------------------------------------------------
|0 |DISTRIBUTED INSERT  |        |1        |66  |
|1 | PX COORDINATOR     |        |1        |47  |
|2 |  EXCHANGE OUT DISTR|:EX10000|1        |46  |
|3 |   SUBPLAN SCAN     |VIEW1   |1        |46  |
|4 |    TABLE GET       |src_t   |1        |46  |
=================================================

Outputs & filters: 
-------------------------------------
  0 - output(nil), filter(nil), 
      columns([{cz_t1: ({cz_t1: (cz_t1.pk, cz_t1.a, cz_t1.b, cz_t1.c, cz_t1.e, cz_t1.d)}, {idx_t1_a: (cz_t1.a, cz_t1.pk)})}]), partitions(p0), 
      column_values([column_conv(INT,PS:(11,0),NOT NULL,VIEW1.pk)], [column_conv(INT,PS:(11,0),NULL,VIEW1.a)], [column_conv(INT,PS:(11,0),NULL,VIEW1.b)], [column_conv(INT,PS:(11,0),NULL,VIEW1.c)], [column_conv(INT,PS:(11,0),NULL,VIEW1.e)], [column_conv(INT,PS:(11,0),NULL,VIEW1.d)])
  1 - output([VIEW1.pk], [VIEW1.a], [VIEW1.b], [VIEW1.c], [VIEW1.e], [VIEW1.d]), filter(nil)
  2 - output([VIEW1.pk], [VIEW1.a], [VIEW1.b], [VIEW1.c], [VIEW1.e], [VIEW1.d]), filter(nil), is_single, dop=1
  3 - output([VIEW1.pk], [VIEW1.a], [VIEW1.b], [VIEW1.c], [VIEW1.e], [VIEW1.d]), filter(nil), 
      access([VIEW1.pk], [VIEW1.a], [VIEW1.b], [VIEW1.c], [VIEW1.e], [VIEW1.d])
  4 - output([src_t.pk], [src_t.a], [src_t.b], [src_t.c], [src_t.e], [src_t.d]), filter(nil), 
      access([src_t.pk], [src_t.a], [src_t.b], [src_t.c], [src_t.e], [src_t.d]), partitions(p0)

// expect hit_count = 1, 1, new plan is generated and hit
select hit_count, type from oceanbase.V$OB_PLAN_CACHE_PLAN_STAT where statement like 'insert into cz_t1 (select * from src_t where pk = ?)';
+-----------+------+
| hit_count | type |
+-----------+------+
|         1 |    3 |
|         1 |    3 |
+-----------+------+

// switch src_t part1 to main
// switch cz_t1 part1 to main
// >>>>>>>>>>>>>>>>>>>>>>>>> CASE#2 OR EXPANSION WITH LOCAL INDEX
// insert 10000 rows into cz_t2
select /*+use_concat*/* from cz_t2 where a = 1 or b = 2;
+----+------+------+------+------+------+
| pk | a    | b    | c    | e    | d    |
+----+------+------+------+------+------+
|  1 |    1 |    1 |    1 |    1 |    1 |
|  2 |    2 |    2 |    2 |    2 |    2 |
+----+------+------+------+------+------+
select /*+use_concat*/* from cz_t2 where a = 2 or b = 3;
+----+------+------+------+------+------+
| pk | a    | b    | c    | e    | d    |
+----+------+------+------+------+------+
|  2 |    2 |    2 |    2 |    2 |    2 |
|  3 |    3 |    3 |    3 |    3 |    3 |
+----+------+------+------+------+------+
explain select /*+use_concat*/* from cz_t2 where a = 2 or b = 3;
Query Plan
===============================================
|ID|OPERATOR   |NAME           |EST. ROWS|COST|
-----------------------------------------------
|0 |UNION ALL  |               |2        |182 |
|1 | TABLE SCAN|cz_t2(idx_t2_a)|1        |91  |
|2 | TABLE SCAN|cz_t2(idx_t2_b)|1        |91  |
===============================================

Outputs & filters: 
-------------------------------------
  0 - output([UNION([1])], [UNION([2])], [UNION([3])], [UNION([4])], [UNION([5])], [UNION([6])]), filter(nil)
  1 - output([cz_t2.pk], [2], [cz_t2.b], [cz_t2.c], [cz_t2.e], [cz_t2.d]), filter(nil), 
      access([cz_t2.pk], [cz_t2.b], [cz_t2.c], [cz_t2.e], [cz_t2.d]), partitions(p0)
  2 - output([cz_t2.pk], [cz_t2.a], [3], [cz_t2.c], [cz_t2.e], [cz_t2.d]), filter([lnnvl(cast(cz_t2.a = 2, TINYINT(-1, 0)))]), 
      access([cz_t2.pk], [cz_t2.a], [cz_t2.c], [cz_t2.e], [cz_t2.d]), partitions(p0)

// hit_count = 1
select hit_count from oceanbase.V$OB_PLAN_CACHE_PLAN_STAT where statement = 'select /*+use_concat*/* from cz_t2 where a = ? or b = ?';
+-----------+
| hit_count |
+-----------+
|         1 |
+-----------+

// switch cz_t2 part1 to backup
select /*+use_concat*/* from cz_t2 where a = 3 or b = 4;
+----+------+------+------+------+------+
| pk | a    | b    | c    | e    | d    |
+----+------+------+------+------+------+
|  3 |    3 |    3 |    3 |    3 |    3 |
|  4 |    4 |    4 |    4 |    4 |    4 |
+----+------+------+------+------+------+
select /*+use_concat*/* from cz_t2 where a = 4 or b = 5;
+----+------+------+------+------+------+
| pk | a    | b    | c    | e    | d    |
+----+------+------+------+------+------+
|  4 |    4 |    4 |    4 |    4 |    4 |
|  5 |    5 |    5 |    5 |    5 |    5 |
+----+------+------+------+------+------+
explain select /*+use_concat*/* from cz_t2 where a = 3 or b = 4;
Query Plan
========================================================
|ID|OPERATOR            |NAME           |EST. ROWS|COST|
--------------------------------------------------------
|0 |EXCHANGE IN REMOTE  |               |2        |183 |
|1 | EXCHANGE OUT REMOTE|               |2        |183 |
|2 |  UNION ALL         |               |2        |182 |
|3 |   TABLE SCAN       |cz_t2(idx_t2_a)|1        |91  |
|4 |   TABLE SCAN       |cz_t2(idx_t2_b)|1        |91  |
========================================================

Outputs & filters: 
-------------------------------------
  0 - output([UNION([1])], [UNION([2])], [UNION([3])], [UNION([4])], [UNION([5])], [UNION([6])]), filter(nil)
  1 - output([UNION([1])], [UNION([2])], [UNION([3])], [UNION([4])], [UNION([5])], [UNION([6])]), filter(nil)
  2 - output([UNION([1])], [UNION([2])], [UNION([3])], [UNION([4])], [UNION([5])], [UNION([6])]), filter(nil)
  3 - output([cz_t2.pk], [3], [cz_t2.b], [cz_t2.c], [cz_t2.e], [cz_t2.d]), filter(nil), 
      access([cz_t2.pk], [cz_t2.b], [cz_t2.c], [cz_t2.e], [cz_t2.d]), partitions(p0)
  4 - output([cz_t2.pk], [cz_t2.a], [4], [cz_t2.c], [cz_t2.e], [cz_t2.d]), filter([lnnvl(cast(cz_t2.a = 3, TINYINT(-1, 0)))]), 
      access([cz_t2.pk], [cz_t2.a], [cz_t2.c], [cz_t2.e], [cz_t2.d]), partitions(p0)


// hit_count = 1, 1
select hit_count from oceanbase.V$OB_PLAN_CACHE_PLAN_STAT where statement = 'select /*+use_concat*/* from cz_t2 where a = ? or b = ?';
+-----------+
| hit_count |
+-----------+
|         1 |
|         1 |
+-----------+

// >>>>>>>>>>>>>>>>>>>>>>>>> CASE#3 OR EXPANSION WITH GLOBAL INDEX
// insert 10000 rows into cz_t3
select /*+use_concat*/* from cz_t3 where a = 1 or b = 2;
+----+------+------+------+------+------+
| pk | a    | b    | c    | e    | d    |
+----+------+------+------+------+------+
|  1 |    1 |    1 |    1 |    1 |    1 |
|  2 |    2 |    2 |    2 |    2 |    2 |
+----+------+------+------+------+------+
select /*+use_concat*/* from cz_t3 where a = 2 or b = 3;
+----+------+------+------+------+------+
| pk | a    | b    | c    | e    | d    |
+----+------+------+------+------+------+
|  2 |    2 |    2 |    2 |    2 |    2 |
|  3 |    3 |    3 |    3 |    3 |    3 |
+----+------+------+------+------+------+
explain select /*+use_concat*/* from cz_t3 where a = 2 or b = 3;
Query Plan
============================================================
|ID|OPERATOR                |NAME           |EST. ROWS|COST|
------------------------------------------------------------
|0 |UNION ALL               |               |2        |229 |
|1 | TABLE LOOKUP           |cz_t3          |1        |115 |
|2 |  DISTRIBUTED TABLE SCAN|cz_t3(idx_t3_a)|1        |46  |
|3 | TABLE LOOKUP           |cz_t3          |1        |115 |
|4 |  DISTRIBUTED TABLE SCAN|cz_t3(idx_t3_b)|1        |46  |
============================================================

Outputs & filters: 
-------------------------------------
  0 - output([UNION([1])], [UNION([2])], [UNION([3])], [UNION([4])], [UNION([5])], [UNION([6])]), filter(nil)
  1 - output([cz_t3.pk], [2], [cz_t3.b], [cz_t3.c], [cz_t3.e], [cz_t3.d]), filter(nil), 
      partitions(p0)
  2 - output([cz_t3.pk]), filter(nil), 
      access([cz_t3.pk]), partitions(p0)
  3 - output([cz_t3.pk], [cz_t3.a], [3], [cz_t3.c], [cz_t3.e], [cz_t3.d]), filter([lnnvl(cast(cz_t3.a = 2, TINYINT(-1, 0)))]), 
      partitions(p0)
  4 - output([cz_t3.pk]), filter(nil), 
      access([cz_t3.pk]), partitions(p1)


// hit_count = 1
select hit_count from oceanbase.V$OB_PLAN_CACHE_PLAN_STAT where statement = 'select /*+use_concat*/* from cz_t3 where a = ? or b = ?';
+-----------+
| hit_count |
+-----------+
|         1 |
+-----------+

// switch idx_t3_a part1 to backup
select /*+use_concat*/* from cz_t3 where a = 2 or b = 4;
+----+------+------+------+------+------+
| pk | a    | b    | c    | e    | d    |
+----+------+------+------+------+------+
|  2 |    2 |    2 |    2 |    2 |    2 |
|  4 |    4 |    4 |    4 |    4 |    4 |
+----+------+------+------+------+------+
select /*+use_concat*/* from cz_t3 where a = 4 or b = 6;
+----+------+------+------+------+------+
| pk | a    | b    | c    | e    | d    |
+----+------+------+------+------+------+
|  4 |    4 |    4 |    4 |    4 |    4 |
|  6 |    6 |    6 |    6 |    6 |    6 |
+----+------+------+------+------+------+
select /*+use_concat*/* from cz_t3 where a = 3 or b = 6;
+----+------+------+------+------+------+
| pk | a    | b    | c    | e    | d    |
+----+------+------+------+------+------+
|  3 |    3 |    3 |    3 |    3 |    3 |
|  6 |    6 |    6 |    6 |    6 |    6 |
+----+------+------+------+------+------+
explain select /*+use_concat*/* from cz_t3 where a = 4 or b = 5;
Query Plan
============================================================
|ID|OPERATOR                |NAME           |EST. ROWS|COST|
------------------------------------------------------------
|0 |UNION ALL               |               |2        |229 |
|1 | TABLE LOOKUP           |cz_t3          |1        |115 |
|2 |  DISTRIBUTED TABLE SCAN|cz_t3(idx_t3_a)|1        |46  |
|3 | TABLE LOOKUP           |cz_t3          |1        |115 |
|4 |  DISTRIBUTED TABLE SCAN|cz_t3(idx_t3_b)|1        |46  |
============================================================

Outputs & filters: 
-------------------------------------
  0 - output([UNION([1])], [UNION([2])], [UNION([3])], [UNION([4])], [UNION([5])], [UNION([6])]), filter(nil)
  1 - output([cz_t3.pk], [4], [cz_t3.b], [cz_t3.c], [cz_t3.e], [cz_t3.d]), filter(nil), 
      partitions(p0)
  2 - output([cz_t3.pk]), filter(nil), 
      access([cz_t3.pk]), partitions(p0)
  3 - output([cz_t3.pk], [cz_t3.a], [5], [cz_t3.c], [cz_t3.e], [cz_t3.d]), filter([lnnvl(cast(cz_t3.a = 4, TINYINT(-1, 0)))]), 
      partitions(p0)
  4 - output([cz_t3.pk]), filter(nil), 
      access([cz_t3.pk]), partitions(p1)

explain select /*+use_concat*/* from cz_t3 where a = 3 or b = 6;
Query Plan
============================================================
|ID|OPERATOR                |NAME           |EST. ROWS|COST|
------------------------------------------------------------
|0 |UNION ALL               |               |2        |229 |
|1 | TABLE LOOKUP           |cz_t3          |1        |115 |
|2 |  DISTRIBUTED TABLE SCAN|cz_t3(idx_t3_a)|1        |46  |
|3 | TABLE LOOKUP           |cz_t3          |1        |115 |
|4 |  DISTRIBUTED TABLE SCAN|cz_t3(idx_t3_b)|1        |46  |
============================================================

Outputs & filters: 
-------------------------------------
  0 - output([UNION([1])], [UNION([2])], [UNION([3])], [UNION([4])], [UNION([5])], [UNION([6])]), filter(nil)
  1 - output([cz_t3.pk], [3], [cz_t3.b], [cz_t3.c], [cz_t3.e], [cz_t3.d]), filter(nil), 
      partitions(p0)
  2 - output([cz_t3.pk]), filter(nil), 
      access([cz_t3.pk]), partitions(p1)
  3 - output([cz_t3.pk], [cz_t3.a], [6], [cz_t3.c], [cz_t3.e], [cz_t3.d]), filter([lnnvl(cast(cz_t3.a = 3, TINYINT(-1, 0)))]), 
      partitions(p0)
  4 - output([cz_t3.pk]), filter(nil), 
      access([cz_t3.pk]), partitions(p0)


// hit_count = 1, 2
select hit_count from oceanbase.V$OB_PLAN_CACHE_PLAN_STAT where statement = 'select /*+use_concat*/* from cz_t3 where a = ? or b = ?';
+-----------+
| hit_count |
+-----------+
|         4 |
+-----------+

// switch idx_t3_b part1 to backup
select /*+use_concat*/* from cz_t3 where a = 6 or b = 8;
+----+------+------+------+------+------+
| pk | a    | b    | c    | e    | d    |
+----+------+------+------+------+------+
|  6 |    6 |    6 |    6 |    6 |    6 |
|  8 |    8 |    8 |    8 |    8 |    8 |
+----+------+------+------+------+------+
select /*+use_concat*/* from cz_t3 where a = 8 or b = 10;
+----+------+------+------+------+------+
| pk | a    | b    | c    | e    | d    |
+----+------+------+------+------+------+
|  8 |    8 |    8 |    8 |    8 |    8 |
| 10 |   10 |   10 |   10 |   10 |   10 |
+----+------+------+------+------+------+
select /*+use_concat*/* from cz_t3 where a = 7 or b = 9;
+----+------+------+------+------+------+
| pk | a    | b    | c    | e    | d    |
+----+------+------+------+------+------+
|  7 |    7 |    7 |    7 |    7 |    7 |
|  9 |    9 |    9 |    9 |    9 |    9 |
+----+------+------+------+------+------+
select /*+use_concat*/* from cz_t3 where a = 7 or b = 8;
+----+------+------+------+------+------+
| pk | a    | b    | c    | e    | d    |
+----+------+------+------+------+------+
|  7 |    7 |    7 |    7 |    7 |    7 |
|  8 |    8 |    8 |    8 |    8 |    8 |
+----+------+------+------+------+------+
explain select /*+use_concat*/* from cz_t3 where a = 6 or b = 8;
Query Plan
============================================================
|ID|OPERATOR                |NAME           |EST. ROWS|COST|
------------------------------------------------------------
|0 |UNION ALL               |               |2        |229 |
|1 | TABLE LOOKUP           |cz_t3          |1        |115 |
|2 |  DISTRIBUTED TABLE SCAN|cz_t3(idx_t3_a)|1        |46  |
|3 | TABLE LOOKUP           |cz_t3          |1        |115 |
|4 |  DISTRIBUTED TABLE SCAN|cz_t3(idx_t3_b)|1        |46  |
============================================================

Outputs & filters: 
-------------------------------------
  0 - output([UNION([1])], [UNION([2])], [UNION([3])], [UNION([4])], [UNION([5])], [UNION([6])]), filter(nil)
  1 - output([cz_t3.pk], [6], [cz_t3.b], [cz_t3.c], [cz_t3.e], [cz_t3.d]), filter(nil), 
      partitions(p0)
  2 - output([cz_t3.pk]), filter(nil), 
      access([cz_t3.pk]), partitions(p0)
  3 - output([cz_t3.pk], [cz_t3.a], [8], [cz_t3.c], [cz_t3.e], [cz_t3.d]), filter([lnnvl(cast(cz_t3.a = 6, TINYINT(-1, 0)))]), 
      partitions(p0)
  4 - output([cz_t3.pk]), filter(nil), 
      access([cz_t3.pk]), partitions(p0)

explain select /*+use_concat*/* from cz_t3 where a = 6 or b = 7;
Query Plan
============================================================
|ID|OPERATOR                |NAME           |EST. ROWS|COST|
------------------------------------------------------------
|0 |UNION ALL               |               |2        |229 |
|1 | TABLE LOOKUP           |cz_t3          |1        |115 |
|2 |  DISTRIBUTED TABLE SCAN|cz_t3(idx_t3_a)|1        |46  |
|3 | TABLE LOOKUP           |cz_t3          |1        |115 |
|4 |  DISTRIBUTED TABLE SCAN|cz_t3(idx_t3_b)|1        |46  |
============================================================

Outputs & filters: 
-------------------------------------
  0 - output([UNION([1])], [UNION([2])], [UNION([3])], [UNION([4])], [UNION([5])], [UNION([6])]), filter(nil)
  1 - output([cz_t3.pk], [6], [cz_t3.b], [cz_t3.c], [cz_t3.e], [cz_t3.d]), filter(nil), 
      partitions(p0)
  2 - output([cz_t3.pk]), filter(nil), 
      access([cz_t3.pk]), partitions(p0)
  3 - output([cz_t3.pk], [cz_t3.a], [7], [cz_t3.c], [cz_t3.e], [cz_t3.d]), filter([lnnvl(cast(cz_t3.a = 6, TINYINT(-1, 0)))]), 
      partitions(p0)
  4 - output([cz_t3.pk]), filter(nil), 
      access([cz_t3.pk]), partitions(p1)

explain select /*+use_concat*/* from cz_t3 where a = 7 or b = 9;
Query Plan
============================================================
|ID|OPERATOR                |NAME           |EST. ROWS|COST|
------------------------------------------------------------
|0 |UNION ALL               |               |2        |229 |
|1 | TABLE LOOKUP           |cz_t3          |1        |115 |
|2 |  DISTRIBUTED TABLE SCAN|cz_t3(idx_t3_a)|1        |46  |
|3 | TABLE LOOKUP           |cz_t3          |1        |115 |
|4 |  DISTRIBUTED TABLE SCAN|cz_t3(idx_t3_b)|1        |46  |
============================================================

Outputs & filters: 
-------------------------------------
  0 - output([UNION([1])], [UNION([2])], [UNION([3])], [UNION([4])], [UNION([5])], [UNION([6])]), filter(nil)
  1 - output([cz_t3.pk], [7], [cz_t3.b], [cz_t3.c], [cz_t3.e], [cz_t3.d]), filter(nil), 
      partitions(p0)
  2 - output([cz_t3.pk]), filter(nil), 
      access([cz_t3.pk]), partitions(p1)
  3 - output([cz_t3.pk], [cz_t3.a], [9], [cz_t3.c], [cz_t3.e], [cz_t3.d]), filter([lnnvl(cast(cz_t3.a = 7, TINYINT(-1, 0)))]), 
      partitions(p0)
  4 - output([cz_t3.pk]), filter(nil), 
      access([cz_t3.pk]), partitions(p1)

explain select /*+use_concat*/* from cz_t3 where a = 7 or b = 8;
Query Plan
============================================================
|ID|OPERATOR                |NAME           |EST. ROWS|COST|
------------------------------------------------------------
|0 |UNION ALL               |               |2        |229 |
|1 | TABLE LOOKUP           |cz_t3          |1        |115 |
|2 |  DISTRIBUTED TABLE SCAN|cz_t3(idx_t3_a)|1        |46  |
|3 | TABLE LOOKUP           |cz_t3          |1        |115 |
|4 |  DISTRIBUTED TABLE SCAN|cz_t3(idx_t3_b)|1        |46  |
============================================================

Outputs & filters: 
-------------------------------------
  0 - output([UNION([1])], [UNION([2])], [UNION([3])], [UNION([4])], [UNION([5])], [UNION([6])]), filter(nil)
  1 - output([cz_t3.pk], [7], [cz_t3.b], [cz_t3.c], [cz_t3.e], [cz_t3.d]), filter(nil), 
      partitions(p0)
  2 - output([cz_t3.pk]), filter(nil), 
      access([cz_t3.pk]), partitions(p1)
  3 - output([cz_t3.pk], [cz_t3.a], [8], [cz_t3.c], [cz_t3.e], [cz_t3.d]), filter([lnnvl(cast(cz_t3.a = 7, TINYINT(-1, 0)))]), 
      partitions(p0)
  4 - output([cz_t3.pk]), filter(nil), 
      access([cz_t3.pk]), partitions(p0)


// hit_count = 0, 1, 2, 3, 
select hit_count from oceanbase.V$OB_PLAN_CACHE_PLAN_STAT where statement = 'select /*+use_concat*/* from cz_t3 where a = ? or b = ?';
+-----------+
| hit_count |
+-----------+
|         8 |
+-----------+

//   >>>>>>>>>>>>>>>>>>>>>>> GLOBAL INDEX, LOCAL INDEX Mixed Up
drop table if exists t31;
create table t31 (pk int primary key, a int, b int, c int, d int, e int) partition by hash(pk) partitions 2;
create index idx_a_t31 on t31(a) local;
create index idx_b_t31 on t31(b) global partition by hash(b) partitions 2;

select /*+use_concat*/* from t31 where a = 6 or b = 8;
+----+------+------+------+------+------+
| pk | a    | b    | c    | d    | e    |
+----+------+------+------+------+------+
|  6 |    6 |    6 |    6 |    6 |    6 |
|  8 |    8 |    8 |    8 |    8 |    8 |
+----+------+------+------+------+------+
select /*+use_concat*/* from t31 where a = 8 or b = 10;
+----+------+------+------+------+------+
| pk | a    | b    | c    | d    | e    |
+----+------+------+------+------+------+
|  8 |    8 |    8 |    8 |    8 |    8 |
| 10 |   10 |   10 |   10 |   10 |   10 |
+----+------+------+------+------+------+
explain select /*+use_concat*/* from t31 where a = 8 or b = 10;
Query Plan
===========================================================
|ID|OPERATOR                |NAME          |EST. ROWS|COST|
-----------------------------------------------------------
|0 |UNION ALL               |              |3        |297 |
|1 | PX COORDINATOR         |              |2        |183 |
|2 |  EXCHANGE OUT DISTR    |:EX10000      |2        |183 |
|3 |   PX PARTITION ITERATOR|              |2        |182 |
|4 |    TABLE SCAN          |t31(idx_a_t31)|2        |182 |
|5 | TABLE LOOKUP           |t31           |1        |115 |
|6 |  DISTRIBUTED TABLE SCAN|t31(idx_b_t31)|1        |46  |
===========================================================

Outputs & filters: 
-------------------------------------
  0 - output([UNION([1])], [UNION([2])], [UNION([3])], [UNION([4])], [UNION([5])], [UNION([6])]), filter(nil)
  1 - output([t31.pk], [8], [t31.b], [t31.c], [t31.d], [t31.e]), filter(nil)
  2 - output([t31.pk], [t31.b], [t31.c], [t31.d], [t31.e]), filter(nil), dop=1
  3 - output([t31.pk], [t31.b], [t31.c], [t31.d], [t31.e]), filter(nil)
  4 - output([t31.pk], [t31.b], [t31.c], [t31.d], [t31.e]), filter(nil), 
      access([t31.pk], [t31.b], [t31.c], [t31.d], [t31.e]), partitions(p[0-1])
  5 - output([t31.pk], [t31.a], [10], [t31.c], [t31.d], [t31.e]), filter([lnnvl(cast(t31.a = 8, TINYINT(-1, 0)))]), 
      partitions(p[0-1])
  6 - output([t31.pk]), filter(nil), 
      access([t31.pk]), partitions(p0)


select hit_count from oceanbase.V$OB_PLAN_CACHE_PLAN_STAT where statement = 'select /*+use_concat*/* from t31 where a = ? or b = ?';
+-----------+
| hit_count |
+-----------+
|         0 |
+-----------+


// switch t31 part0 to backup
select /*+use_concat*/* from t31 where a = 6 or b = 8;
+----+------+------+------+------+------+
| pk | a    | b    | c    | d    | e    |
+----+------+------+------+------+------+
|  6 |    6 |    6 |    6 |    6 |    6 |
|  8 |    8 |    8 |    8 |    8 |    8 |
+----+------+------+------+------+------+
select /*+use_concat*/* from t31 where a = 8 or b = 10;
+----+------+------+------+------+------+
| pk | a    | b    | c    | d    | e    |
+----+------+------+------+------+------+
|  8 |    8 |    8 |    8 |    8 |    8 |
| 10 |   10 |   10 |   10 |   10 |   10 |
+----+------+------+------+------+------+
explain select /*+use_concat*/* from t31 where a = 8 or b = 10;
Query Plan
===========================================================
|ID|OPERATOR                |NAME          |EST. ROWS|COST|
-----------------------------------------------------------
|0 |UNION ALL               |              |3        |297 |
|1 | PX COORDINATOR         |              |2        |183 |
|2 |  EXCHANGE OUT DISTR    |:EX10000      |2        |183 |
|3 |   PX PARTITION ITERATOR|              |2        |182 |
|4 |    TABLE SCAN          |t31(idx_a_t31)|2        |182 |
|5 | TABLE LOOKUP           |t31           |1        |115 |
|6 |  DISTRIBUTED TABLE SCAN|t31(idx_b_t31)|1        |46  |
===========================================================

Outputs & filters: 
-------------------------------------
  0 - output([UNION([1])], [UNION([2])], [UNION([3])], [UNION([4])], [UNION([5])], [UNION([6])]), filter(nil)
  1 - output([t31.pk], [8], [t31.b], [t31.c], [t31.d], [t31.e]), filter(nil)
  2 - output([t31.pk], [t31.b], [t31.c], [t31.d], [t31.e]), filter(nil), dop=1
  3 - output([t31.pk], [t31.b], [t31.c], [t31.d], [t31.e]), filter(nil)
  4 - output([t31.pk], [t31.b], [t31.c], [t31.d], [t31.e]), filter(nil), 
      access([t31.pk], [t31.b], [t31.c], [t31.d], [t31.e]), partitions(p[0-1])
  5 - output([t31.pk], [t31.a], [10], [t31.c], [t31.d], [t31.e]), filter([lnnvl(cast(t31.a = 8, TINYINT(-1, 0)))]), 
      partitions(p[0-1])
  6 - output([t31.pk]), filter(nil), 
      access([t31.pk]), partitions(p0)


select hit_count from oceanbase.V$OB_PLAN_CACHE_PLAN_STAT where statement = 'select /*+use_concat*/* from t31 where a = ? or b = ?';
+-----------+
| hit_count |
+-----------+
|         0 |
+-----------+

// switch idx_b_t31 part0 to backup
select /*+use_concat*/* from t31 where a = 6 or b = 8;
+----+------+------+------+------+------+
| pk | a    | b    | c    | d    | e    |
+----+------+------+------+------+------+
|  6 |    6 |    6 |    6 |    6 |    6 |
|  8 |    8 |    8 |    8 |    8 |    8 |
+----+------+------+------+------+------+
select /*+use_concat*/* from t31 where a = 8 or b = 10;
+----+------+------+------+------+------+
| pk | a    | b    | c    | d    | e    |
+----+------+------+------+------+------+
|  8 |    8 |    8 |    8 |    8 |    8 |
| 10 |   10 |   10 |   10 |   10 |   10 |
+----+------+------+------+------+------+

explain select /*+use_concat*/* from t31 where a = 8 or b = 10;
Query Plan
===========================================================
|ID|OPERATOR                |NAME          |EST. ROWS|COST|
-----------------------------------------------------------
|0 |UNION ALL               |              |3        |297 |
|1 | PX COORDINATOR         |              |2        |183 |
|2 |  EXCHANGE OUT DISTR    |:EX10000      |2        |183 |
|3 |   PX PARTITION ITERATOR|              |2        |182 |
|4 |    TABLE SCAN          |t31(idx_a_t31)|2        |182 |
|5 | TABLE LOOKUP           |t31           |1        |115 |
|6 |  DISTRIBUTED TABLE SCAN|t31(idx_b_t31)|1        |46  |
===========================================================

Outputs & filters: 
-------------------------------------
  0 - output([UNION([1])], [UNION([2])], [UNION([3])], [UNION([4])], [UNION([5])], [UNION([6])]), filter(nil)
  1 - output([t31.pk], [8], [t31.b], [t31.c], [t31.d], [t31.e]), filter(nil)
  2 - output([t31.pk], [t31.b], [t31.c], [t31.d], [t31.e]), filter(nil), dop=1
  3 - output([t31.pk], [t31.b], [t31.c], [t31.d], [t31.e]), filter(nil)
  4 - output([t31.pk], [t31.b], [t31.c], [t31.d], [t31.e]), filter(nil), 
      access([t31.pk], [t31.b], [t31.c], [t31.d], [t31.e]), partitions(p[0-1])
  5 - output([t31.pk], [t31.a], [10], [t31.c], [t31.d], [t31.e]), filter([lnnvl(cast(t31.a = 8, TINYINT(-1, 0)))]), 
      partitions(p[0-1])
  6 - output([t31.pk]), filter(nil), 
      access([t31.pk]), partitions(p0)


select hit_count from oceanbase.V$OB_PLAN_CACHE_PLAN_STAT where statement = 'select /*+use_concat*/* from t31 where a = ? or b = ?';
+-----------+
| hit_count |
+-----------+
|         0 |
+-----------+

drop table t31;
// >>>>>>>>>>>>>>>>>>>>>>>>> CASE#4 LATE MATERIALIZATION
// insert values into cz_t4
select /*+USE_LATE_MATERIALIZATION*/* from cz_t4 order by a limit 5;
+----+------+------+------+------+------+
| pk | a    | b    | c    | e    | d    |
+----+------+------+------+------+------+
|  1 |    1 |    1 |    1 |    1 |    1 |
|  2 |    2 |    2 |    2 |    2 |    2 |
|  3 |    3 |    3 |    3 |    3 |    3 |
|  4 |    4 |    4 |    4 |    4 |    4 |
|  5 |    5 |    5 |    5 |    5 |    5 |
+----+------+------+------+------+------+
select /*+USE_LATE_MATERIALIZATION*/* from cz_t4 order by a limit 5;
+----+------+------+------+------+------+
| pk | a    | b    | c    | e    | d    |
+----+------+------+------+------+------+
|  1 |    1 |    1 |    1 |    1 |    1 |
|  2 |    2 |    2 |    2 |    2 |    2 |
|  3 |    3 |    3 |    3 |    3 |    3 |
|  4 |    4 |    4 |    4 |    4 |    4 |
|  5 |    5 |    5 |    5 |    5 |    5 |
+----+------+------+------+------+------+
explain select /*+USE_LATE_MATERIALIZATION*/* from cz_t4 order by a limit 5;
Query Plan
===============================================
|ID|OPERATOR   |NAME           |EST. ROWS|COST|
-----------------------------------------------
|0 |LIMIT      |               |5        |182 |
|1 | TABLE SCAN|cz_t4(idx_t4_a)|5        |182 |
===============================================

Outputs & filters: 
-------------------------------------
  0 - output([cz_t4.pk], [cz_t4.a], [cz_t4.b], [cz_t4.c], [cz_t4.e], [cz_t4.d]), filter(nil), limit(5), offset(nil)
  1 - output([cz_t4.pk], [cz_t4.a], [cz_t4.b], [cz_t4.c], [cz_t4.e], [cz_t4.d]), filter(nil), 
      access([cz_t4.pk], [cz_t4.a], [cz_t4.b], [cz_t4.c], [cz_t4.e], [cz_t4.d]), partitions(p0)


// expect hit_count = 1
select hit_count from oceanbase.V$OB_PLAN_CACHE_PLAN_STAT where statement like 'select /*+USE_LATE_MATERIALIZATION*/* from cz_t4 order by a limit 5';
+-----------+
| hit_count |
+-----------+
|         1 |
+-----------+

// switch cz_t4 part1 to backup
select /*+USE_LATE_MATERIALIZATION*/* from cz_t4 order by a limit 5;
+----+------+------+------+------+------+
| pk | a    | b    | c    | e    | d    |
+----+------+------+------+------+------+
|  1 |    1 |    1 |    1 |    1 |    1 |
|  2 |    2 |    2 |    2 |    2 |    2 |
|  3 |    3 |    3 |    3 |    3 |    3 |
|  4 |    4 |    4 |    4 |    4 |    4 |
|  5 |    5 |    5 |    5 |    5 |    5 |
+----+------+------+------+------+------+
select /*+USE_LATE_MATERIALIZATION*/* from cz_t4 order by a limit 5;
+----+------+------+------+------+------+
| pk | a    | b    | c    | e    | d    |
+----+------+------+------+------+------+
|  1 |    1 |    1 |    1 |    1 |    1 |
|  2 |    2 |    2 |    2 |    2 |    2 |
|  3 |    3 |    3 |    3 |    3 |    3 |
|  4 |    4 |    4 |    4 |    4 |    4 |
|  5 |    5 |    5 |    5 |    5 |    5 |
+----+------+------+------+------+------+
explain select /*+USE_LATE_MATERIALIZATION*/* from cz_t4 order by a limit 5;
Query Plan
========================================================
|ID|OPERATOR            |NAME           |EST. ROWS|COST|
--------------------------------------------------------
|0 |EXCHANGE IN REMOTE  |               |5        |186 |
|1 | EXCHANGE OUT REMOTE|               |5        |184 |
|2 |  LIMIT             |               |5        |182 |
|3 |   TABLE SCAN       |cz_t4(idx_t4_a)|5        |182 |
========================================================

Outputs & filters: 
-------------------------------------
  0 - output([cz_t4.pk], [cz_t4.a], [cz_t4.b], [cz_t4.c], [cz_t4.e], [cz_t4.d]), filter(nil)
  1 - output([cz_t4.pk], [cz_t4.a], [cz_t4.b], [cz_t4.c], [cz_t4.e], [cz_t4.d]), filter(nil)
  2 - output([cz_t4.pk], [cz_t4.a], [cz_t4.b], [cz_t4.c], [cz_t4.e], [cz_t4.d]), filter(nil), limit(5), offset(nil)
  3 - output([cz_t4.pk], [cz_t4.a], [cz_t4.b], [cz_t4.c], [cz_t4.e], [cz_t4.d]), filter(nil), 
      access([cz_t4.pk], [cz_t4.a], [cz_t4.b], [cz_t4.c], [cz_t4.e], [cz_t4.d]), partitions(p0)


// hit_count = 1, 1
select hit_count from oceanbase.V$OB_PLAN_CACHE_PLAN_STAT where statement like 'select /*+USE_LATE_MATERIALIZATION*/* from cz_t4 order by a limit 5';
+-----------+
| hit_count |
+-----------+
|         0 |
|         1 |
+-----------+

// >>>>>>>>>>>>>>>>>>>>>>>>> CASE#5 TABLE LOOKUP
// reset cz_t1, and src_t
insert into cz_t1 values (1, 1, 1, 1, 1, 1);
insert into cz_t1 values (2, 2, 1, 1, 1, 1);
insert into cz_t1 values (3, 3, 1, 1, 1, 1);
insert into src_t (select * from cz_t1);

// single table select with lookup
select /*+index(cz_t1 idx_t1_a)*/* from cz_t1 where a = 2;
+----+------+------+------+------+------+
| pk | a    | b    | c    | e    | d    |
+----+------+------+------+------+------+
|  2 |    2 |    1 |    1 |    1 |    1 |
+----+------+------+------+------+------+
select /*+index(cz_t1 idx_t1_a)*/* from cz_t1 where a = 2;
+----+------+------+------+------+------+
| pk | a    | b    | c    | e    | d    |
+----+------+------+------+------+------+
|  2 |    2 |    1 |    1 |    1 |    1 |
+----+------+------+------+------+------+
explain select /*+index(cz_t1 idx_t1_a)*/* from cz_t1 where a = 2;
Query Plan
===========================================================
|ID|OPERATOR               |NAME           |EST. ROWS|COST|
-----------------------------------------------------------
|0 |TABLE LOOKUP           |cz_t1          |1        |115 |
|1 | DISTRIBUTED TABLE SCAN|cz_t1(idx_t1_a)|1        |46  |
===========================================================

Outputs & filters: 
-------------------------------------
  0 - output([cz_t1.pk], [cz_t1.a], [cz_t1.b], [cz_t1.c], [cz_t1.e], [cz_t1.d]), filter(nil), 
      partitions(p[0-1])
  1 - output([cz_t1.pk]), filter(nil), 
      access([cz_t1.pk]), partitions(p0)

// hit_count = 1, type = 1
select hit_count, type from oceanbase.V$OB_PLAN_CACHE_PLAN_STAT where statement like 'select /*+index(cz_t1 idx_t1_a)*/* from cz_t1 where a = ?';
+-----------+------+
| hit_count | type |
+-----------+------+
|         1 |    1 |
+-----------+------+

// switch cz_t1 part1 to backup
select /*+index(cz_t1 idx_t1_a)*/* from cz_t1 where a = 2;
+----+------+------+------+------+------+
| pk | a    | b    | c    | e    | d    |
+----+------+------+------+------+------+
|  2 |    2 |    1 |    1 |    1 |    1 |
+----+------+------+------+------+------+
explain select /*+index(cz_t1 idx_t1_a)*/* from cz_t1 where a = 2;
Query Plan
===========================================================
|ID|OPERATOR               |NAME           |EST. ROWS|COST|
-----------------------------------------------------------
|0 |TABLE LOOKUP           |cz_t1          |1        |115 |
|1 | DISTRIBUTED TABLE SCAN|cz_t1(idx_t1_a)|1        |46  |
===========================================================

Outputs & filters: 
-------------------------------------
  0 - output([cz_t1.pk], [cz_t1.a], [cz_t1.b], [cz_t1.c], [cz_t1.e], [cz_t1.d]), filter(nil), 
      partitions(p[0-1])
  1 - output([cz_t1.pk]), filter(nil), 
      access([cz_t1.pk]), partitions(p0)


// hit_count = 2, type = 1
select hit_count, type from oceanbase.V$OB_PLAN_CACHE_PLAN_STAT where statement like 'select /*+index(cz_t1 idx_t1_a)*/* from cz_t1 where a = ?';
+-----------+------+
| hit_count | type |
+-----------+------+
|         2 |    1 |
+-----------+------+

// switch idx_t1_a part1 to backup
select /*+index(cz_t1 idx_t1_a)*/* from cz_t1 where a = 2;
+----+------+------+------+------+------+
| pk | a    | b    | c    | e    | d    |
+----+------+------+------+------+------+
|  2 |    2 |    1 |    1 |    1 |    1 |
+----+------+------+------+------+------+
select /*+index(cz_t1 idx_t1_a)*/* from cz_t1 where a = 2;
+----+------+------+------+------+------+
| pk | a    | b    | c    | e    | d    |
+----+------+------+------+------+------+
|  2 |    2 |    1 |    1 |    1 |    1 |
+----+------+------+------+------+------+
explain select /*+index(cz_t1 idx_t1_a)*/* from cz_t1 where a = 2;
Query Plan
===========================================================
|ID|OPERATOR               |NAME           |EST. ROWS|COST|
-----------------------------------------------------------
|0 |TABLE LOOKUP           |cz_t1          |1        |115 |
|1 | DISTRIBUTED TABLE SCAN|cz_t1(idx_t1_a)|1        |46  |
===========================================================

Outputs & filters: 
-------------------------------------
  0 - output([cz_t1.pk], [cz_t1.a], [cz_t1.b], [cz_t1.c], [cz_t1.e], [cz_t1.d]), filter(nil), 
      partitions(p[0-1])
  1 - output([cz_t1.pk]), filter(nil), 
      access([cz_t1.pk]), partitions(p0)


// hit_count = 1, 2, type = 3, 1
select hit_count, type from oceanbase.V$OB_PLAN_CACHE_PLAN_STAT where statement like 'select /*+index(cz_t1 idx_t1_a)*/* from cz_t1 where a = ?';
+-----------+------+
| hit_count | type |
+-----------+------+
|         4 |    1 |
+-----------+------+

// join table
select /*+index(cz_t5 idx_t5_a) index(cz_t6 idx_t6_a)*/cz_t5.b as b1, cz_t6.b as b2 from cz_t5 join cz_t6 on cz_t5.pk = cz_t6.pk where cz_t5.a = 1 and cz_t6.a = 1;
+------+------+
| b1   | b2   |
+------+------+
|    1 |    1 |
+------+------+
select /*+index(cz_t5 idx_t5_a) index(cz_t6 idx_t6_a)*/cz_t5.b as b1, cz_t6.b as b2 from cz_t5 join cz_t6 on cz_t5.pk = cz_t6.pk where cz_t5.a = 1 and cz_t6.a = 1;
+------+------+
| b1   | b2   |
+------+------+
|    1 |    1 |
+------+------+
explain select /*+index(cz_t5 idx_t5_a) index(cz_t6 idx_t6_a)*/cz_t5.b as b1, cz_t6.b as b2 from cz_t5 join cz_t6 on cz_t5.pk = cz_t6.pk where cz_t5.a = 1 and cz_t6.a = 1;
Query Plan
============================================================
|ID|OPERATOR                |NAME           |EST. ROWS|COST|
------------------------------------------------------------
|0 |NESTED-LOOP JOIN        |               |1        |149 |
|1 | TABLE LOOKUP           |cz_t5          |1        |115 |
|2 |  DISTRIBUTED TABLE SCAN|cz_t5(idx_t5_a)|1        |46  |
|3 | TABLE LOOKUP           |cz_t6          |1        |33  |
|4 |  DISTRIBUTED TABLE GET |cz_t6(idx_t6_a)|1        |7   |
============================================================

Outputs & filters: 
-------------------------------------
  0 - output([cz_t5.b], [cz_t6.b]), filter(nil), 
      conds(nil), nl_params_([cz_t5.pk])
  1 - output([cz_t5.pk], [cz_t5.b]), filter(nil), 
      partitions(p[0-1])
  2 - output([cz_t5.pk]), filter(nil), 
      access([cz_t5.pk]), partitions(p1)
  3 - output([cz_t6.b]), filter(nil), 
      partitions(p[0-1])
  4 - output([cz_t6.pk]), filter(nil), 
      access([cz_t6.pk]), partitions(p1)


// expect hit_count = 1
select hit_count, type from oceanbase.V$OB_PLAN_CACHE_PLAN_STAT where statement like 'select /*+index(cz_t5 idx_t5_a) index(cz_t6 idx_t6_a)*/cz_t5.b as b1, cz_t6.b as b2 from cz_t5 join cz_t6 on cz_t5.pk = cz_t6.pk where cz_t5.a = ? and cz_t6.a = ?';
+-----------+------+
| hit_count | type |
+-----------+------+
|         1 |    1 |
+-----------+------+

// switch idx_t5_a part2 to backup
select /*+index(cz_t5 idx_t5_a) index(cz_t6 idx_t6_a)*/cz_t5.b as b1, cz_t6.b as b2 from cz_t5 join cz_t6 on cz_t5.pk = cz_t6.pk where cz_t5.a = 1 and cz_t6.a = 1;
+------+------+
| b1   | b2   |
+------+------+
|    1 |    1 |
+------+------+
select /*+index(cz_t5 idx_t5_a) index(cz_t6 idx_t6_a)*/cz_t5.b as b1, cz_t6.b as b2 from cz_t5 join cz_t6 on cz_t5.pk = cz_t6.pk where cz_t5.a = 1 and cz_t6.a = 1;
+------+------+
| b1   | b2   |
+------+------+
|    1 |    1 |
+------+------+
explain select /*+index(cz_t5 idx_t5_a) index(cz_t6 idx_t6_a)*/cz_t5.b as b1, cz_t6.b as b2 from cz_t5 join cz_t6 on cz_t5.pk = cz_t6.pk where cz_t5.a = 1 and cz_t6.a = 1;
Query Plan
============================================================
|ID|OPERATOR                |NAME           |EST. ROWS|COST|
------------------------------------------------------------
|0 |NESTED-LOOP JOIN        |               |1        |149 |
|1 | TABLE LOOKUP           |cz_t5          |1        |115 |
|2 |  DISTRIBUTED TABLE SCAN|cz_t5(idx_t5_a)|1        |46  |
|3 | TABLE LOOKUP           |cz_t6          |1        |33  |
|4 |  DISTRIBUTED TABLE GET |cz_t6(idx_t6_a)|1        |7   |
============================================================

Outputs & filters: 
-------------------------------------
  0 - output([cz_t5.b], [cz_t6.b]), filter(nil), 
      conds(nil), nl_params_([cz_t5.pk])
  1 - output([cz_t5.pk], [cz_t5.b]), filter(nil), 
      partitions(p[0-1])
  2 - output([cz_t5.pk]), filter(nil), 
      access([cz_t5.pk]), partitions(p1)
  3 - output([cz_t6.b]), filter(nil), 
      partitions(p[0-1])
  4 - output([cz_t6.pk]), filter(nil), 
      access([cz_t6.pk]), partitions(p1)


// expect hit_count = 1, 1
select hit_count, type from oceanbase.V$OB_PLAN_CACHE_PLAN_STAT where statement like 'select /*+index(cz_t5 idx_t5_a) index(cz_t6 idx_t6_a)*/cz_t5.b as b1, cz_t6.b as b2 from cz_t5 join cz_t6 on cz_t5.pk = cz_t6.pk where cz_t5.a = ? and cz_t6.a = ?';
+-----------+------+
| hit_count | type |
+-----------+------+
|         3 |    1 |
+-----------+------+

// switch idx_t6_a part2 to backup
select /*+index(cz_t5 idx_t5_a) index(cz_t6 idx_t6_a)*/cz_t5.b as b1, cz_t6.b as b2 from cz_t5 join cz_t6 on cz_t5.pk = cz_t6.pk where cz_t5.a = 1 and cz_t6.a = 1;
+------+------+
| b1   | b2   |
+------+------+
|    1 |    1 |
+------+------+
select /*+index(cz_t5 idx_t5_a) index(cz_t6 idx_t6_a)*/cz_t5.b as b1, cz_t6.b as b2 from cz_t5 join cz_t6 on cz_t5.pk = cz_t6.pk where cz_t5.a = 1 and cz_t6.a = 1;
+------+------+
| b1   | b2   |
+------+------+
|    1 |    1 |
+------+------+
explain select /*+index(cz_t5 idx_t5_a) index(cz_t6 idx_t6_a)*/cz_t5.b as b1, cz_t6.b as b2 from cz_t5 join cz_t6 on cz_t5.pk = cz_t6.pk where cz_t5.a = 1 and cz_t6.a = 1;
Query Plan
============================================================
|ID|OPERATOR                |NAME           |EST. ROWS|COST|
------------------------------------------------------------
|0 |NESTED-LOOP JOIN        |               |1        |149 |
|1 | TABLE LOOKUP           |cz_t5          |1        |115 |
|2 |  DISTRIBUTED TABLE SCAN|cz_t5(idx_t5_a)|1        |46  |
|3 | TABLE LOOKUP           |cz_t6          |1        |33  |
|4 |  DISTRIBUTED TABLE GET |cz_t6(idx_t6_a)|1        |7   |
============================================================

Outputs & filters: 
-------------------------------------
  0 - output([cz_t5.b], [cz_t6.b]), filter(nil), 
      conds(nil), nl_params_([cz_t5.pk])
  1 - output([cz_t5.pk], [cz_t5.b]), filter(nil), 
      partitions(p[0-1])
  2 - output([cz_t5.pk]), filter(nil), 
      access([cz_t5.pk]), partitions(p1)
  3 - output([cz_t6.b]), filter(nil), 
      partitions(p[0-1])
  4 - output([cz_t6.pk]), filter(nil), 
      access([cz_t6.pk]), partitions(p1)


// expect hit_count = 1, 1, 1
select hit_count, type from oceanbase.V$OB_PLAN_CACHE_PLAN_STAT where statement like 'select /*+index(cz_t5 idx_t5_a) index(cz_t6 idx_t6_a)*/cz_t5.b as b1, cz_t6.b as b2 from cz_t5 join cz_t6 on cz_t5.pk = cz_t6.pk where cz_t5.a = ? and cz_t6.a = ?';
+-----------+------+
| hit_count | type |
+-----------+------+
|         5 |    1 |
+-----------+------+
// >>>>>>>>>>>>>>>>>>>>>>>>> CASE#6 TABLE LOOKUP WITH PARTITION WISE join
drop table if exists t1, t2, t_insert;
create table t1 (pk int primary key, a int, b int) partition by hash(pk) partitions 2;
create table t2 (pk int primary key, a int, b int);
create table t_insert (pk int primary key, a int, b int) partition by hash(pk) partitions 2;

create index case_idx_t1 on t1(a) partition by hash(a) partitions 2;
create index case_idx_t_insert on t_insert(a) partition by hash(a) partitions 2;

insert into t1 values (1, 1, 1), (2, 2, 2), (4, 4, 4), (3, 3, 3), (5, 5, 5);
insert into t2 values (1, 1, 1), (2, 2, 2), (4, 4, 4), (3, 3, 3), (5, 5, 5);

insert into t_insert select /*+index(t1 case_idx_t1)*/t1.* from t1 join t2 where t1.a = t2.a and t1.a = 5;
explain insert into t_insert select /*+index(t1 case_idx_t1)*/t1.* from t1 join t2 where t1.a = t2.a and t1.a = 5;
Query Plan
================================================================
|ID|OPERATOR                    |NAME           |EST. ROWS|COST|
----------------------------------------------------------------
|0 |DISTRIBUTED INSERT          |               |1        |180 |
|1 | SUBPLAN SCAN               |VIEW1          |1        |160 |
|2 |  NESTED-LOOP JOIN CARTESIAN|               |1        |160 |
|3 |   TABLE LOOKUP             |t1             |1        |115 |
|4 |    DISTRIBUTED TABLE SCAN  |t1(case_idx_t1)|1        |46  |
|5 |   MATERIAL                 |               |1        |46  |
|6 |    TABLE SCAN              |t2             |1        |46  |
================================================================

Outputs & filters: 
-------------------------------------
  0 - output(nil), filter(nil), 
      columns([{t_insert: ({t_insert: (t_insert.pk, t_insert.a, t_insert.b)}, {case_idx_t_insert: (t_insert.a, t_insert.pk)})}]), partitions(p[0-1]), 
      column_values([column_conv(INT,PS:(11,0),NOT NULL,VIEW1.pk)], [column_conv(INT,PS:(11,0),NULL,VIEW1.a)], [column_conv(INT,PS:(11,0),NULL,VIEW1.b)])
  1 - output([VIEW1.pk], [VIEW1.a], [VIEW1.b]), filter(nil), 
      access([VIEW1.pk], [VIEW1.a], [VIEW1.b])
  2 - output([t1.pk], [t1.a], [t1.b]), filter(nil), 
      conds(nil), nl_params_(nil)
  3 - output([t1.pk], [t1.a], [t1.b]), filter(nil), 
      partitions(p[0-1])
  4 - output([t1.pk]), filter(nil), 
      access([t1.pk]), partitions(p1)
  5 - output(nil), filter(nil)
  6 - output(nil), filter([5 = t2.a]), 
      access([t2.a]), partitions(p0)





// switch t2 to backup, case_idx_t1's part0 to backup

insert into t_insert select /*+index(t1 case_idx_t1)*/t1.* from t1 join t2 where t1.a = t2.a and t1.a = 2;
insert into t_insert select /*+index(t1 case_idx_t1)*/t1.* from t1 join t2 where t1.a = t2.a and t1.a = 4;

// should be a different plan
insert into t_insert select /*+index(t1 case_idx_t1)*/t1.* from t1 join t2 where t1.a = t2.a and t1.a = 1;
insert into t_insert select /*+index(t1 case_idx_t1)*/t1.* from t1 join t2 where t1.a = t2.a and t1.a = 3;

explain insert into t_insert select /*+index(t1 case_idx_t1)*/t1.* from t1 join t2 where t1.a = t2.a and t1.a = 4;
Query Plan
================================================================
|ID|OPERATOR                    |NAME           |EST. ROWS|COST|
----------------------------------------------------------------
|0 |DISTRIBUTED INSERT          |               |1        |180 |
|1 | SUBPLAN SCAN               |VIEW1          |1        |160 |
|2 |  NESTED-LOOP JOIN CARTESIAN|               |1        |160 |
|3 |   TABLE LOOKUP             |t1             |1        |115 |
|4 |    DISTRIBUTED TABLE SCAN  |t1(case_idx_t1)|1        |46  |
|5 |   MATERIAL                 |               |1        |46  |
|6 |    PX COORDINATOR          |               |1        |46  |
|7 |     EXCHANGE OUT DISTR     |:EX10000       |1        |46  |
|8 |      TABLE SCAN            |t2             |1        |46  |
================================================================

Outputs & filters: 
-------------------------------------
  0 - output(nil), filter(nil), 
      columns([{t_insert: ({t_insert: (t_insert.pk, t_insert.a, t_insert.b)}, {case_idx_t_insert: (t_insert.a, t_insert.pk)})}]), partitions(p[0-1]), 
      column_values([column_conv(INT,PS:(11,0),NOT NULL,VIEW1.pk)], [column_conv(INT,PS:(11,0),NULL,VIEW1.a)], [column_conv(INT,PS:(11,0),NULL,VIEW1.b)])
  1 - output([VIEW1.pk], [VIEW1.a], [VIEW1.b]), filter(nil), 
      access([VIEW1.pk], [VIEW1.a], [VIEW1.b])
  2 - output([t1.pk], [t1.a], [t1.b]), filter(nil), 
      conds(nil), nl_params_(nil)
  3 - output([t1.pk], [t1.a], [t1.b]), filter(nil), 
      partitions(p[0-1])
  4 - output([t1.pk]), filter(nil), 
      access([t1.pk]), partitions(p0)
  5 - output(nil), filter(nil)
  6 - output(nil), filter(nil)
  7 - output(nil), filter(nil), is_single, dop=1
  8 - output(nil), filter([4 = t2.a]), 
      access([t2.a]), partitions(p0)


explain insert into t_insert select /*+index(t1 case_idx_t1)*/t1.* from t1 join t2 where t1.a = t2.a and t1.a = 3;
Query Plan
================================================================
|ID|OPERATOR                    |NAME           |EST. ROWS|COST|
----------------------------------------------------------------
|0 |DISTRIBUTED INSERT          |               |1        |180 |
|1 | SUBPLAN SCAN               |VIEW1          |1        |160 |
|2 |  NESTED-LOOP JOIN CARTESIAN|               |1        |160 |
|3 |   TABLE LOOKUP             |t1             |1        |115 |
|4 |    DISTRIBUTED TABLE SCAN  |t1(case_idx_t1)|1        |46  |
|5 |   MATERIAL                 |               |1        |46  |
|6 |    PX COORDINATOR          |               |1        |46  |
|7 |     EXCHANGE OUT DISTR     |:EX10000       |1        |46  |
|8 |      TABLE SCAN            |t2             |1        |46  |
================================================================

Outputs & filters: 
-------------------------------------
  0 - output(nil), filter(nil), 
      columns([{t_insert: ({t_insert: (t_insert.pk, t_insert.a, t_insert.b)}, {case_idx_t_insert: (t_insert.a, t_insert.pk)})}]), partitions(p[0-1]), 
      column_values([column_conv(INT,PS:(11,0),NOT NULL,VIEW1.pk)], [column_conv(INT,PS:(11,0),NULL,VIEW1.a)], [column_conv(INT,PS:(11,0),NULL,VIEW1.b)])
  1 - output([VIEW1.pk], [VIEW1.a], [VIEW1.b]), filter(nil), 
      access([VIEW1.pk], [VIEW1.a], [VIEW1.b])
  2 - output([t1.pk], [t1.a], [t1.b]), filter(nil), 
      conds(nil), nl_params_(nil)
  3 - output([t1.pk], [t1.a], [t1.b]), filter(nil), 
      partitions(p[0-1])
  4 - output([t1.pk]), filter(nil), 
      access([t1.pk]), partitions(p1)
  5 - output(nil), filter(nil)
  6 - output(nil), filter(nil)
  7 - output(nil), filter(nil), is_single, dop=1
  8 - output(nil), filter([3 = t2.a]), 
      access([t2.a]), partitions(p0)

select hit_count, type from oceanbase.V$OB_PLAN_CACHE_PLAN_STAT where statement like 'insert into t_insert select /*+index(t1 case_idx_t1)*/t1.* from t1 join t2 where t1.a = t2.a and t1.a = ?';
+-----------+------+
| hit_count | type |
+-----------+------+
|         0 |    1 |
|         0 |    3 |
+-----------+------+
drop table t1, t2, t_insert;
// >>>>>>>>>>>>>>>>>>>>>>>>> CLEANUP
drop table cz_t1, cz_t2, cz_t3, cz_t4, src_t, cz_t5, cz_t6;
commit;

alter system flush plan cache global;

set _ob_use_parallel_execution = false;
alter system flush plan cache global;
drop table if exists cz_t1, cz_t2, cz_t3, cz_t4, src_t, cz_t5, cz_t6;
create table cz_t1 (pk int primary key, a int, b int, c int, e int, d int) partition by hash(pk) partitions 2;
create table cz_t2 (pk int primary key, a int, b int, c int, e int, d int);
create table cz_t3 (pk int primary key, a int, b int, c int, e int, d int);
create table cz_t4 (pk int primary key, a int, b int, c int, e int, d int);
create table src_t (pk int primary key, a int, b int, c int, e int, d int) partition by hash(pk) partitions 2;
create table cz_t5 (pk int primary key, a int, b int) partition by hash(pk) partitions 2;
create table cz_t6 (pk int primary key, a int, b int) partition by hash(pk) partitions 2;

create index idx_t1_a on cz_t1(a) global partition by hash(a) partitions 2;
create index idx_t2_a on cz_t2(a) local;
create index idx_t2_b on cz_t2(b) local;

create index idx_t3_a on cz_t3(a) global partition by hash(a) partitions 2;
create index idx_t3_b on cz_t3(b) global partition by hash(b) partitions 2;
create index idx_t4_a on cz_t4(a) local;
create index idx_t5_a on cz_t5(a) global partition by hash(a) partitions 2;
create index idx_t6_a on cz_t6(a) global partition by hash(a) partitions 2;













alter system set _enable_partition_level_retry=True;
// >>>>>>>>>>>>>>>>>>>>>>>>> CASE#1 MULTI PART INSERT
insert /*+index(cz_t1 idx_t1_a)*/into cz_t1 values (1, 1, 1, 1, 1, 1), (2, 2, 2, 2, 2, 2);
insert /*+index(cz_t1 idx_t1_a)*/into cz_t1 values (3, 3, 3, 3, 3, 3), (4, 4, 4, 4, 4, 4);
explain insert /*+index(cz_t1 idx_t1_a)*/into cz_t1 values (3, 3, 3, 3, 3, 3), (4, 4, 4, 4, 4, 4);
Query Plan
===========================================
|ID|OPERATOR          |NAME|EST. ROWS|COST|
-------------------------------------------
|0 |DISTRIBUTED INSERT|    |2        |26  |
|1 | EXPRESSION       |    |2        |1   |
===========================================

Outputs & filters: 
-------------------------------------
  0 - output(nil), filter(nil), 
      columns([{cz_t1: ({cz_t1: (cz_t1.pk, cz_t1.a, cz_t1.b, cz_t1.c, cz_t1.e, cz_t1.d)}, {idx_t1_a: (cz_t1.a, cz_t1.pk)})}]), partitions(p[0-1]), 
      column_values([column_conv(INT,PS:(11,0),NOT NULL,__values.pk)], [column_conv(INT,PS:(11,0),NULL,__values.a)], [column_conv(INT,PS:(11,0),NULL,__values.b)], [column_conv(INT,PS:(11,0),NULL,__values.c)], [column_conv(INT,PS:(11,0),NULL,__values.e)], [column_conv(INT,PS:(11,0),NULL,__values.d)])
  1 - output([__values.pk], [__values.a], [__values.b], [__values.c], [__values.e], [__values.d]), filter(nil)
      values({3, 3, 3, 3, 3, 3}, {4, 4, 4, 4, 4, 4})

// expect hit_count = 1
select hit_count, type from oceanbase.V$OB_PLAN_CACHE_PLAN_STAT where statement like 'insert /*+index(cz_t1 idx_t1_a)*/into cz_t1 values (?, ?, ?, ?, ?, ?), (?, ?, ?, ?, ?, ?)';
+-----------+------+
| hit_count | type |
+-----------+------+
|         1 |    1 |
+-----------+------+

// switch cz_t1 part1 to backup
insert /*+index(cz_t1 idx_t1_a)*/into cz_t1 values (5, 5, 5, 5, 5, 5), (6, 6, 6, 6, 6, 6);
explain /*+index(cz_t1 idx_t1_a)*/insert into cz_t1 values (5, 5, 5, 5, 5, 5), (6, 6, 6, 6, 6, 6);
Query Plan
===========================================
|ID|OPERATOR          |NAME|EST. ROWS|COST|
-------------------------------------------
|0 |DISTRIBUTED INSERT|    |2        |26  |
|1 | EXPRESSION       |    |2        |1   |
===========================================

Outputs & filters: 
-------------------------------------
  0 - output(nil), filter(nil), 
      columns([{cz_t1: ({cz_t1: (cz_t1.pk, cz_t1.a, cz_t1.b, cz_t1.c, cz_t1.e, cz_t1.d)}, {idx_t1_a: (cz_t1.a, cz_t1.pk)})}]), partitions(p[0-1]), 
      column_values([column_conv(INT,PS:(11,0),NOT NULL,__values.pk)], [column_conv(INT,PS:(11,0),NULL,__values.a)], [column_conv(INT,PS:(11,0),NULL,__values.b)], [column_conv(INT,PS:(11,0),NULL,__values.c)], [column_conv(INT,PS:(11,0),NULL,__values.e)], [column_conv(INT,PS:(11,0),NULL,__values.d)])
  1 - output([__values.pk], [__values.a], [__values.b], [__values.c], [__values.e], [__values.d]), filter(nil)
      values({5, 5, 5, 5, 5, 5}, {6, 6, 6, 6, 6, 6})

// expect hit_count = 2
select hit_count, type from oceanbase.V$OB_PLAN_CACHE_PLAN_STAT where statement like 'insert /*+index(cz_t1 idx_t1_a)*/into cz_t1 values (?, ?, ?, ?, ?, ?), (?, ?, ?, ?, ?, ?)';
+-----------+------+
| hit_count | type |
+-----------+------+
|         2 |    1 |
+-----------+------+

delete from cz_t1;

insert into src_t values (2, 2, 2, 2, 2, 2);
insert into cz_t1 (select * from src_t where pk = 2);
delete from src_t;
insert into src_t values (4, 4, 4, 4, 4, 4);
insert into cz_t1 (select * from src_t where pk = 4);

explain insert into cz_t1 (select * from src_t where pk = 4);
Query Plan
============================================
|ID|OPERATOR          |NAME |EST. ROWS|COST|
--------------------------------------------
|0 |DISTRIBUTED INSERT|     |1        |65  |
|1 | SUBPLAN SCAN     |VIEW1|1        |46  |
|2 |  TABLE GET       |src_t|1        |46  |
============================================

Outputs & filters: 
-------------------------------------
  0 - output(nil), filter(nil), 
      columns([{cz_t1: ({cz_t1: (cz_t1.pk, cz_t1.a, cz_t1.b, cz_t1.c, cz_t1.e, cz_t1.d)}, {idx_t1_a: (cz_t1.a, cz_t1.pk)})}]), partitions(p0), 
      column_values([column_conv(INT,PS:(11,0),NOT NULL,VIEW1.pk)], [column_conv(INT,PS:(11,0),NULL,VIEW1.a)], [column_conv(INT,PS:(11,0),NULL,VIEW1.b)], [column_conv(INT,PS:(11,0),NULL,VIEW1.c)], [column_conv(INT,PS:(11,0),NULL,VIEW1.e)], [column_conv(INT,PS:(11,0),NULL,VIEW1.d)])
  1 - output([VIEW1.pk], [VIEW1.a], [VIEW1.b], [VIEW1.c], [VIEW1.e], [VIEW1.d]), filter(nil), 
      access([VIEW1.pk], [VIEW1.a], [VIEW1.b], [VIEW1.c], [VIEW1.e], [VIEW1.d])
  2 - output([src_t.pk], [src_t.a], [src_t.b], [src_t.c], [src_t.e], [src_t.d]), filter(nil), 
      access([src_t.pk], [src_t.a], [src_t.b], [src_t.c], [src_t.e], [src_t.d]), partitions(p0)


// hit_count = 1, type = 1
select hit_count, type from oceanbase.V$OB_PLAN_CACHE_PLAN_STAT where statement like 'insert into cz_t1 (select * from src_t where pk = ?)';
+-----------+------+
| hit_count | type |
+-----------+------+
|         1 |    3 |
+-----------+------+

// switch src_t part1 to backup
delete from src_t;
insert into src_t values (6, 6, 6, 6, 6, 6);
insert into cz_t1 (select * from src_t where pk = 6);
delete from src_t;
insert into src_t values (8, 8, 8, 8, 8, 8);
insert into cz_t1 (select * from src_t where pk = 8);

explain insert into cz_t1 (select * from src_t where pk = 8);
Query Plan
=================================================
|ID|OPERATOR            |NAME    |EST. ROWS|COST|
-------------------------------------------------
|0 |DISTRIBUTED INSERT  |        |1        |66  |
|1 | PX COORDINATOR     |        |1        |47  |
|2 |  EXCHANGE OUT DISTR|:EX10000|1        |46  |
|3 |   SUBPLAN SCAN     |VIEW1   |1        |46  |
|4 |    TABLE GET       |src_t   |1        |46  |
=================================================

Outputs & filters: 
-------------------------------------
  0 - output(nil), filter(nil), 
      columns([{cz_t1: ({cz_t1: (cz_t1.pk, cz_t1.a, cz_t1.b, cz_t1.c, cz_t1.e, cz_t1.d)}, {idx_t1_a: (cz_t1.a, cz_t1.pk)})}]), partitions(p0), 
      column_values([column_conv(INT,PS:(11,0),NOT NULL,VIEW1.pk)], [column_conv(INT,PS:(11,0),NULL,VIEW1.a)], [column_conv(INT,PS:(11,0),NULL,VIEW1.b)], [column_conv(INT,PS:(11,0),NULL,VIEW1.c)], [column_conv(INT,PS:(11,0),NULL,VIEW1.e)], [column_conv(INT,PS:(11,0),NULL,VIEW1.d)])
  1 - output([VIEW1.pk], [VIEW1.a], [VIEW1.b], [VIEW1.c], [VIEW1.e], [VIEW1.d]), filter(nil)
  2 - output([VIEW1.pk], [VIEW1.a], [VIEW1.b], [VIEW1.c], [VIEW1.e], [VIEW1.d]), filter(nil), is_single, dop=1
  3 - output([VIEW1.pk], [VIEW1.a], [VIEW1.b], [VIEW1.c], [VIEW1.e], [VIEW1.d]), filter(nil), 
      access([VIEW1.pk], [VIEW1.a], [VIEW1.b], [VIEW1.c], [VIEW1.e], [VIEW1.d])
  4 - output([src_t.pk], [src_t.a], [src_t.b], [src_t.c], [src_t.e], [src_t.d]), filter(nil), 
      access([src_t.pk], [src_t.a], [src_t.b], [src_t.c], [src_t.e], [src_t.d]), partitions(p0)

// expect hit_count = 1, 1, new plan is generated and hit
select hit_count, type from oceanbase.V$OB_PLAN_CACHE_PLAN_STAT where statement like 'insert into cz_t1 (select * from src_t where pk = ?)';
+-----------+------+
| hit_count | type |
+-----------+------+
|         1 |    3 |
|         1 |    3 |
+-----------+------+

// switch src_t part1 to main
// switch cz_t1 part1 to main
// >>>>>>>>>>>>>>>>>>>>>>>>> CASE#2 OR EXPANSION WITH LOCAL INDEX
// insert 10000 rows into cz_t2
select /*+use_concat*/* from cz_t2 where a = 1 or b = 2;
+----+------+------+------+------+------+
| pk | a    | b    | c    | e    | d    |
+----+------+------+------+------+------+
|  1 |    1 |    1 |    1 |    1 |    1 |
|  2 |    2 |    2 |    2 |    2 |    2 |
+----+------+------+------+------+------+
select /*+use_concat*/* from cz_t2 where a = 2 or b = 3;
+----+------+------+------+------+------+
| pk | a    | b    | c    | e    | d    |
+----+------+------+------+------+------+
|  2 |    2 |    2 |    2 |    2 |    2 |
|  3 |    3 |    3 |    3 |    3 |    3 |
+----+------+------+------+------+------+
explain select /*+use_concat*/* from cz_t2 where a = 2 or b = 3;
Query Plan
===============================================
|ID|OPERATOR   |NAME           |EST. ROWS|COST|
-----------------------------------------------
|0 |UNION ALL  |               |2        |182 |
|1 | TABLE SCAN|cz_t2(idx_t2_a)|1        |91  |
|2 | TABLE SCAN|cz_t2(idx_t2_b)|1        |91  |
===============================================

Outputs & filters: 
-------------------------------------
  0 - output([UNION([1])], [UNION([2])], [UNION([3])], [UNION([4])], [UNION([5])], [UNION([6])]), filter(nil)
  1 - output([cz_t2.pk], [2], [cz_t2.b], [cz_t2.c], [cz_t2.e], [cz_t2.d]), filter(nil), 
      access([cz_t2.pk], [cz_t2.b], [cz_t2.c], [cz_t2.e], [cz_t2.d]), partitions(p0)
  2 - output([cz_t2.pk], [cz_t2.a], [3], [cz_t2.c], [cz_t2.e], [cz_t2.d]), filter([lnnvl(cast(cz_t2.a = 2, TINYINT(-1, 0)))]), 
      access([cz_t2.pk], [cz_t2.a], [cz_t2.c], [cz_t2.e], [cz_t2.d]), partitions(p0)

// hit_count = 1
select hit_count from oceanbase.V$OB_PLAN_CACHE_PLAN_STAT where statement = 'select /*+use_concat*/* from cz_t2 where a = ? or b = ?';
+-----------+
| hit_count |
+-----------+
|         1 |
+-----------+

// switch cz_t2 part1 to backup
select /*+use_concat*/* from cz_t2 where a = 3 or b = 4;
+----+------+------+------+------+------+
| pk | a    | b    | c    | e    | d    |
+----+------+------+------+------+------+
|  3 |    3 |    3 |    3 |    3 |    3 |
|  4 |    4 |    4 |    4 |    4 |    4 |
+----+------+------+------+------+------+
select /*+use_concat*/* from cz_t2 where a = 4 or b = 5;
+----+------+------+------+------+------+
| pk | a    | b    | c    | e    | d    |
+----+------+------+------+------+------+
|  4 |    4 |    4 |    4 |    4 |    4 |
|  5 |    5 |    5 |    5 |    5 |    5 |
+----+------+------+------+------+------+
explain select /*+use_concat*/* from cz_t2 where a = 3 or b = 4;
Query Plan
========================================================
|ID|OPERATOR            |NAME           |EST. ROWS|COST|
--------------------------------------------------------
|0 |EXCHANGE IN REMOTE  |               |2        |183 |
|1 | EXCHANGE OUT REMOTE|               |2        |183 |
|2 |  UNION ALL         |               |2        |182 |
|3 |   TABLE SCAN       |cz_t2(idx_t2_a)|1        |91  |
|4 |   TABLE SCAN       |cz_t2(idx_t2_b)|1        |91  |
========================================================

Outputs & filters: 
-------------------------------------
  0 - output([UNION([1])], [UNION([2])], [UNION([3])], [UNION([4])], [UNION([5])], [UNION([6])]), filter(nil)
  1 - output([UNION([1])], [UNION([2])], [UNION([3])], [UNION([4])], [UNION([5])], [UNION([6])]), filter(nil)
  2 - output([UNION([1])], [UNION([2])], [UNION([3])], [UNION([4])], [UNION([5])], [UNION([6])]), filter(nil)
  3 - output([cz_t2.pk], [3], [cz_t2.b], [cz_t2.c], [cz_t2.e], [cz_t2.d]), filter(nil), 
      access([cz_t2.pk], [cz_t2.b], [cz_t2.c], [cz_t2.e], [cz_t2.d]), partitions(p0)
  4 - output([cz_t2.pk], [cz_t2.a], [4], [cz_t2.c], [cz_t2.e], [cz_t2.d]), filter([lnnvl(cast(cz_t2.a = 3, TINYINT(-1, 0)))]), 
      access([cz_t2.pk], [cz_t2.a], [cz_t2.c], [cz_t2.e], [cz_t2.d]), partitions(p0)


// hit_count = 1, 1
select hit_count from oceanbase.V$OB_PLAN_CACHE_PLAN_STAT where statement = 'select /*+use_concat*/* from cz_t2 where a = ? or b = ?';
+-----------+
| hit_count |
+-----------+
|         0 |
|         1 |
+-----------+

// >>>>>>>>>>>>>>>>>>>>>>>>> CASE#3 OR EXPANSION WITH GLOBAL INDEX
// insert 10000 rows into cz_t3
select /*+use_concat*/* from cz_t3 where a = 1 or b = 2;
+----+------+------+------+------+------+
| pk | a    | b    | c    | e    | d    |
+----+------+------+------+------+------+
|  1 |    1 |    1 |    1 |    1 |    1 |
|  2 |    2 |    2 |    2 |    2 |    2 |
+----+------+------+------+------+------+
select /*+use_concat*/* from cz_t3 where a = 2 or b = 3;
+----+------+------+------+------+------+
| pk | a    | b    | c    | e    | d    |
+----+------+------+------+------+------+
|  2 |    2 |    2 |    2 |    2 |    2 |
|  3 |    3 |    3 |    3 |    3 |    3 |
+----+------+------+------+------+------+
explain select /*+use_concat*/* from cz_t3 where a = 2 or b = 3;
Query Plan
============================================================
|ID|OPERATOR                |NAME           |EST. ROWS|COST|
------------------------------------------------------------
|0 |UNION ALL               |               |2        |229 |
|1 | TABLE LOOKUP           |cz_t3          |1        |115 |
|2 |  DISTRIBUTED TABLE SCAN|cz_t3(idx_t3_a)|1        |46  |
|3 | TABLE LOOKUP           |cz_t3          |1        |115 |
|4 |  DISTRIBUTED TABLE SCAN|cz_t3(idx_t3_b)|1        |46  |
============================================================

Outputs & filters: 
-------------------------------------
  0 - output([UNION([1])], [UNION([2])], [UNION([3])], [UNION([4])], [UNION([5])], [UNION([6])]), filter(nil)
  1 - output([cz_t3.pk], [2], [cz_t3.b], [cz_t3.c], [cz_t3.e], [cz_t3.d]), filter(nil), 
      partitions(p0)
  2 - output([cz_t3.pk]), filter(nil), 
      access([cz_t3.pk]), partitions(p0)
  3 - output([cz_t3.pk], [cz_t3.a], [3], [cz_t3.c], [cz_t3.e], [cz_t3.d]), filter([lnnvl(cast(cz_t3.a = 2, TINYINT(-1, 0)))]), 
      partitions(p0)
  4 - output([cz_t3.pk]), filter(nil), 
      access([cz_t3.pk]), partitions(p1)


// hit_count = 1
select hit_count from oceanbase.V$OB_PLAN_CACHE_PLAN_STAT where statement = 'select /*+use_concat*/* from cz_t3 where a = ? or b = ?';
+-----------+
| hit_count |
+-----------+
|         1 |
+-----------+

// switch idx_t3_a part1 to backup
select /*+use_concat*/* from cz_t3 where a = 2 or b = 4;
+----+------+------+------+------+------+
| pk | a    | b    | c    | e    | d    |
+----+------+------+------+------+------+
|  2 |    2 |    2 |    2 |    2 |    2 |
|  4 |    4 |    4 |    4 |    4 |    4 |
+----+------+------+------+------+------+
select /*+use_concat*/* from cz_t3 where a = 4 or b = 6;
+----+------+------+------+------+------+
| pk | a    | b    | c    | e    | d    |
+----+------+------+------+------+------+
|  4 |    4 |    4 |    4 |    4 |    4 |
|  6 |    6 |    6 |    6 |    6 |    6 |
+----+------+------+------+------+------+
select /*+use_concat*/* from cz_t3 where a = 3 or b = 6;
+----+------+------+------+------+------+
| pk | a    | b    | c    | e    | d    |
+----+------+------+------+------+------+
|  3 |    3 |    3 |    3 |    3 |    3 |
|  6 |    6 |    6 |    6 |    6 |    6 |
+----+------+------+------+------+------+
explain select /*+use_concat*/* from cz_t3 where a = 4 or b = 5;
Query Plan
============================================================
|ID|OPERATOR                |NAME           |EST. ROWS|COST|
------------------------------------------------------------
|0 |UNION ALL               |               |2        |229 |
|1 | TABLE LOOKUP           |cz_t3          |1        |115 |
|2 |  DISTRIBUTED TABLE SCAN|cz_t3(idx_t3_a)|1        |46  |
|3 | TABLE LOOKUP           |cz_t3          |1        |115 |
|4 |  DISTRIBUTED TABLE SCAN|cz_t3(idx_t3_b)|1        |46  |
============================================================

Outputs & filters: 
-------------------------------------
  0 - output([UNION([1])], [UNION([2])], [UNION([3])], [UNION([4])], [UNION([5])], [UNION([6])]), filter(nil)
  1 - output([cz_t3.pk], [4], [cz_t3.b], [cz_t3.c], [cz_t3.e], [cz_t3.d]), filter(nil), 
      partitions(p0)
  2 - output([cz_t3.pk]), filter(nil), 
      access([cz_t3.pk]), partitions(p0)
  3 - output([cz_t3.pk], [cz_t3.a], [5], [cz_t3.c], [cz_t3.e], [cz_t3.d]), filter([lnnvl(cast(cz_t3.a = 4, TINYINT(-1, 0)))]), 
      partitions(p0)
  4 - output([cz_t3.pk]), filter(nil), 
      access([cz_t3.pk]), partitions(p1)

explain select /*+use_concat*/* from cz_t3 where a = 3 or b = 6;
Query Plan
============================================================
|ID|OPERATOR                |NAME           |EST. ROWS|COST|
------------------------------------------------------------
|0 |UNION ALL               |               |2        |229 |
|1 | TABLE LOOKUP           |cz_t3          |1        |115 |
|2 |  DISTRIBUTED TABLE SCAN|cz_t3(idx_t3_a)|1        |46  |
|3 | TABLE LOOKUP           |cz_t3          |1        |115 |
|4 |  DISTRIBUTED TABLE SCAN|cz_t3(idx_t3_b)|1        |46  |
============================================================

Outputs & filters: 
-------------------------------------
  0 - output([UNION([1])], [UNION([2])], [UNION([3])], [UNION([4])], [UNION([5])], [UNION([6])]), filter(nil)
  1 - output([cz_t3.pk], [3], [cz_t3.b], [cz_t3.c], [cz_t3.e], [cz_t3.d]), filter(nil), 
      partitions(p0)
  2 - output([cz_t3.pk]), filter(nil), 
      access([cz_t3.pk]), partitions(p1)
  3 - output([cz_t3.pk], [cz_t3.a], [6], [cz_t3.c], [cz_t3.e], [cz_t3.d]), filter([lnnvl(cast(cz_t3.a = 3, TINYINT(-1, 0)))]), 
      partitions(p0)
  4 - output([cz_t3.pk]), filter(nil), 
      access([cz_t3.pk]), partitions(p0)


// hit_count = 1, 2
select hit_count from oceanbase.V$OB_PLAN_CACHE_PLAN_STAT where statement = 'select /*+use_concat*/* from cz_t3 where a = ? or b = ?';
+-----------+
| hit_count |
+-----------+
|         4 |
+-----------+

// switch idx_t3_b part1 to backup
select /*+use_concat*/* from cz_t3 where a = 6 or b = 8;
+----+------+------+------+------+------+
| pk | a    | b    | c    | e    | d    |
+----+------+------+------+------+------+
|  6 |    6 |    6 |    6 |    6 |    6 |
|  8 |    8 |    8 |    8 |    8 |    8 |
+----+------+------+------+------+------+
select /*+use_concat*/* from cz_t3 where a = 8 or b = 10;
+----+------+------+------+------+------+
| pk | a    | b    | c    | e    | d    |
+----+------+------+------+------+------+
|  8 |    8 |    8 |    8 |    8 |    8 |
| 10 |   10 |   10 |   10 |   10 |   10 |
+----+------+------+------+------+------+
select /*+use_concat*/* from cz_t3 where a = 7 or b = 9;
+----+------+------+------+------+------+
| pk | a    | b    | c    | e    | d    |
+----+------+------+------+------+------+
|  7 |    7 |    7 |    7 |    7 |    7 |
|  9 |    9 |    9 |    9 |    9 |    9 |
+----+------+------+------+------+------+
select /*+use_concat*/* from cz_t3 where a = 7 or b = 8;
+----+------+------+------+------+------+
| pk | a    | b    | c    | e    | d    |
+----+------+------+------+------+------+
|  7 |    7 |    7 |    7 |    7 |    7 |
|  8 |    8 |    8 |    8 |    8 |    8 |
+----+------+------+------+------+------+
explain select /*+use_concat*/* from cz_t3 where a = 6 or b = 8;
Query Plan
============================================================
|ID|OPERATOR                |NAME           |EST. ROWS|COST|
------------------------------------------------------------
|0 |UNION ALL               |               |2        |229 |
|1 | TABLE LOOKUP           |cz_t3          |1        |115 |
|2 |  DISTRIBUTED TABLE SCAN|cz_t3(idx_t3_a)|1        |46  |
|3 | TABLE LOOKUP           |cz_t3          |1        |115 |
|4 |  DISTRIBUTED TABLE SCAN|cz_t3(idx_t3_b)|1        |46  |
============================================================

Outputs & filters: 
-------------------------------------
  0 - output([UNION([1])], [UNION([2])], [UNION([3])], [UNION([4])], [UNION([5])], [UNION([6])]), filter(nil)
  1 - output([cz_t3.pk], [6], [cz_t3.b], [cz_t3.c], [cz_t3.e], [cz_t3.d]), filter(nil), 
      partitions(p0)
  2 - output([cz_t3.pk]), filter(nil), 
      access([cz_t3.pk]), partitions(p0)
  3 - output([cz_t3.pk], [cz_t3.a], [8], [cz_t3.c], [cz_t3.e], [cz_t3.d]), filter([lnnvl(cast(cz_t3.a = 6, TINYINT(-1, 0)))]), 
      partitions(p0)
  4 - output([cz_t3.pk]), filter(nil), 
      access([cz_t3.pk]), partitions(p0)

explain select /*+use_concat*/* from cz_t3 where a = 6 or b = 7;
Query Plan
============================================================
|ID|OPERATOR                |NAME           |EST. ROWS|COST|
------------------------------------------------------------
|0 |UNION ALL               |               |2        |229 |
|1 | TABLE LOOKUP           |cz_t3          |1        |115 |
|2 |  DISTRIBUTED TABLE SCAN|cz_t3(idx_t3_a)|1        |46  |
|3 | TABLE LOOKUP           |cz_t3          |1        |115 |
|4 |  DISTRIBUTED TABLE SCAN|cz_t3(idx_t3_b)|1        |46  |
============================================================

Outputs & filters: 
-------------------------------------
  0 - output([UNION([1])], [UNION([2])], [UNION([3])], [UNION([4])], [UNION([5])], [UNION([6])]), filter(nil)
  1 - output([cz_t3.pk], [6], [cz_t3.b], [cz_t3.c], [cz_t3.e], [cz_t3.d]), filter(nil), 
      partitions(p0)
  2 - output([cz_t3.pk]), filter(nil), 
      access([cz_t3.pk]), partitions(p0)
  3 - output([cz_t3.pk], [cz_t3.a], [7], [cz_t3.c], [cz_t3.e], [cz_t3.d]), filter([lnnvl(cast(cz_t3.a = 6, TINYINT(-1, 0)))]), 
      partitions(p0)
  4 - output([cz_t3.pk]), filter(nil), 
      access([cz_t3.pk]), partitions(p1)

explain select /*+use_concat*/* from cz_t3 where a = 7 or b = 9;
Query Plan
============================================================
|ID|OPERATOR                |NAME           |EST. ROWS|COST|
------------------------------------------------------------
|0 |UNION ALL               |               |2        |229 |
|1 | TABLE LOOKUP           |cz_t3          |1        |115 |
|2 |  DISTRIBUTED TABLE SCAN|cz_t3(idx_t3_a)|1        |46  |
|3 | TABLE LOOKUP           |cz_t3          |1        |115 |
|4 |  DISTRIBUTED TABLE SCAN|cz_t3(idx_t3_b)|1        |46  |
============================================================

Outputs & filters: 
-------------------------------------
  0 - output([UNION([1])], [UNION([2])], [UNION([3])], [UNION([4])], [UNION([5])], [UNION([6])]), filter(nil)
  1 - output([cz_t3.pk], [7], [cz_t3.b], [cz_t3.c], [cz_t3.e], [cz_t3.d]), filter(nil), 
      partitions(p0)
  2 - output([cz_t3.pk]), filter(nil), 
      access([cz_t3.pk]), partitions(p1)
  3 - output([cz_t3.pk], [cz_t3.a], [9], [cz_t3.c], [cz_t3.e], [cz_t3.d]), filter([lnnvl(cast(cz_t3.a = 7, TINYINT(-1, 0)))]), 
      partitions(p0)
  4 - output([cz_t3.pk]), filter(nil), 
      access([cz_t3.pk]), partitions(p1)

explain select /*+use_concat*/* from cz_t3 where a = 7 or b = 8;
Query Plan
============================================================
|ID|OPERATOR                |NAME           |EST. ROWS|COST|
------------------------------------------------------------
|0 |UNION ALL               |               |2        |229 |
|1 | TABLE LOOKUP           |cz_t3          |1        |115 |
|2 |  DISTRIBUTED TABLE SCAN|cz_t3(idx_t3_a)|1        |46  |
|3 | TABLE LOOKUP           |cz_t3          |1        |115 |
|4 |  DISTRIBUTED TABLE SCAN|cz_t3(idx_t3_b)|1        |46  |
============================================================

Outputs & filters: 
-------------------------------------
  0 - output([UNION([1])], [UNION([2])], [UNION([3])], [UNION([4])], [UNION([5])], [UNION([6])]), filter(nil)
  1 - output([cz_t3.pk], [7], [cz_t3.b], [cz_t3.c], [cz_t3.e], [cz_t3.d]), filter(nil), 
      partitions(p0)
  2 - output([cz_t3.pk]), filter(nil), 
      access([cz_t3.pk]), partitions(p1)
  3 - output([cz_t3.pk], [cz_t3.a], [8], [cz_t3.c], [cz_t3.e], [cz_t3.d]), filter([lnnvl(cast(cz_t3.a = 7, TINYINT(-1, 0)))]), 
      partitions(p0)
  4 - output([cz_t3.pk]), filter(nil), 
      access([cz_t3.pk]), partitions(p0)


// hit_count = 0, 1, 2, 3, 
select hit_count from oceanbase.V$OB_PLAN_CACHE_PLAN_STAT where statement = 'select /*+use_concat*/* from cz_t3 where a = ? or b = ?';
+-----------+
| hit_count |
+-----------+
|         8 |
+-----------+

//   >>>>>>>>>>>>>>>>>>>>>>> GLOBAL INDEX, LOCAL INDEX Mixed Up
drop table if exists t31;
create table t31 (pk int primary key, a int, b int, c int, d int, e int) partition by hash(pk) partitions 2;
create index idx_a_t31 on t31(a) local;
create index idx_b_t31 on t31(b) global partition by hash(b) partitions 2;

select /*+use_concat*/* from t31 where a = 6 or b = 8;
+----+------+------+------+------+------+
| pk | a    | b    | c    | d    | e    |
+----+------+------+------+------+------+
|  6 |    6 |    6 |    6 |    6 |    6 |
|  8 |    8 |    8 |    8 |    8 |    8 |
+----+------+------+------+------+------+
select /*+use_concat*/* from t31 where a = 8 or b = 10;
+----+------+------+------+------+------+
| pk | a    | b    | c    | d    | e    |
+----+------+------+------+------+------+
|  8 |    8 |    8 |    8 |    8 |    8 |
| 10 |   10 |   10 |   10 |   10 |   10 |
+----+------+------+------+------+------+
explain select /*+use_concat*/* from t31 where a = 8 or b = 10;
Query Plan
===========================================================
|ID|OPERATOR                |NAME          |EST. ROWS|COST|
-----------------------------------------------------------
|0 |UNION ALL               |              |3        |297 |
|1 | PX COORDINATOR         |              |2        |183 |
|2 |  EXCHANGE OUT DISTR    |:EX10000      |2        |183 |
|3 |   PX PARTITION ITERATOR|              |2        |182 |
|4 |    TABLE SCAN          |t31(idx_a_t31)|2        |182 |
|5 | TABLE LOOKUP           |t31           |1        |115 |
|6 |  DISTRIBUTED TABLE SCAN|t31(idx_b_t31)|1        |46  |
===========================================================

Outputs & filters: 
-------------------------------------
  0 - output([UNION([1])], [UNION([2])], [UNION([3])], [UNION([4])], [UNION([5])], [UNION([6])]), filter(nil)
  1 - output([t31.pk], [8], [t31.b], [t31.c], [t31.d], [t31.e]), filter(nil)
  2 - output([t31.pk], [t31.b], [t31.c], [t31.d], [t31.e]), filter(nil), dop=1
  3 - output([t31.pk], [t31.b], [t31.c], [t31.d], [t31.e]), filter(nil)
  4 - output([t31.pk], [t31.b], [t31.c], [t31.d], [t31.e]), filter(nil), 
      access([t31.pk], [t31.b], [t31.c], [t31.d], [t31.e]), partitions(p[0-1])
  5 - output([t31.pk], [t31.a], [10], [t31.c], [t31.d], [t31.e]), filter([lnnvl(cast(t31.a = 8, TINYINT(-1, 0)))]), 
      partitions(p[0-1])
  6 - output([t31.pk]), filter(nil), 
      access([t31.pk]), partitions(p0)


select hit_count from oceanbase.V$OB_PLAN_CACHE_PLAN_STAT where statement = 'select /*+use_concat*/* from t31 where a = ? or b = ?';
+-----------+
| hit_count |
+-----------+
|         0 |
+-----------+


// switch t31 part0 to backup
select /*+use_concat*/* from t31 where a = 6 or b = 8;
+----+------+------+------+------+------+
| pk | a    | b    | c    | d    | e    |
+----+------+------+------+------+------+
|  6 |    6 |    6 |    6 |    6 |    6 |
|  8 |    8 |    8 |    8 |    8 |    8 |
+----+------+------+------+------+------+
select /*+use_concat*/* from t31 where a = 8 or b = 10;
+----+------+------+------+------+------+
| pk | a    | b    | c    | d    | e    |
+----+------+------+------+------+------+
|  8 |    8 |    8 |    8 |    8 |    8 |
| 10 |   10 |   10 |   10 |   10 |   10 |
+----+------+------+------+------+------+
explain select /*+use_concat*/* from t31 where a = 8 or b = 10;
Query Plan
===========================================================
|ID|OPERATOR                |NAME          |EST. ROWS|COST|
-----------------------------------------------------------
|0 |UNION ALL               |              |3        |297 |
|1 | PX COORDINATOR         |              |2        |183 |
|2 |  EXCHANGE OUT DISTR    |:EX10000      |2        |183 |
|3 |   PX PARTITION ITERATOR|              |2        |182 |
|4 |    TABLE SCAN          |t31(idx_a_t31)|2        |182 |
|5 | TABLE LOOKUP           |t31           |1        |115 |
|6 |  DISTRIBUTED TABLE SCAN|t31(idx_b_t31)|1        |46  |
===========================================================

Outputs & filters: 
-------------------------------------
  0 - output([UNION([1])], [UNION([2])], [UNION([3])], [UNION([4])], [UNION([5])], [UNION([6])]), filter(nil)
  1 - output([t31.pk], [8], [t31.b], [t31.c], [t31.d], [t31.e]), filter(nil)
  2 - output([t31.pk], [t31.b], [t31.c], [t31.d], [t31.e]), filter(nil), dop=1
  3 - output([t31.pk], [t31.b], [t31.c], [t31.d], [t31.e]), filter(nil)
  4 - output([t31.pk], [t31.b], [t31.c], [t31.d], [t31.e]), filter(nil), 
      access([t31.pk], [t31.b], [t31.c], [t31.d], [t31.e]), partitions(p[0-1])
  5 - output([t31.pk], [t31.a], [10], [t31.c], [t31.d], [t31.e]), filter([lnnvl(cast(t31.a = 8, TINYINT(-1, 0)))]), 
      partitions(p[0-1])
  6 - output([t31.pk]), filter(nil), 
      access([t31.pk]), partitions(p0)


select hit_count from oceanbase.V$OB_PLAN_CACHE_PLAN_STAT where statement = 'select /*+use_concat*/* from t31 where a = ? or b = ?';
+-----------+
| hit_count |
+-----------+
|         0 |
+-----------+

// switch idx_b_t31 part0 to backup
select /*+use_concat*/* from t31 where a = 6 or b = 8;
+----+------+------+------+------+------+
| pk | a    | b    | c    | d    | e    |
+----+------+------+------+------+------+
|  6 |    6 |    6 |    6 |    6 |    6 |
|  8 |    8 |    8 |    8 |    8 |    8 |
+----+------+------+------+------+------+
select /*+use_concat*/* from t31 where a = 8 or b = 10;
+----+------+------+------+------+------+
| pk | a    | b    | c    | d    | e    |
+----+------+------+------+------+------+
|  8 |    8 |    8 |    8 |    8 |    8 |
| 10 |   10 |   10 |   10 |   10 |   10 |
+----+------+------+------+------+------+

explain select /*+use_concat*/* from t31 where a = 8 or b = 10;
Query Plan
===========================================================
|ID|OPERATOR                |NAME          |EST. ROWS|COST|
-----------------------------------------------------------
|0 |UNION ALL               |              |3        |297 |
|1 | PX COORDINATOR         |              |2        |183 |
|2 |  EXCHANGE OUT DISTR    |:EX10000      |2        |183 |
|3 |   PX PARTITION ITERATOR|              |2        |182 |
|4 |    TABLE SCAN          |t31(idx_a_t31)|2        |182 |
|5 | TABLE LOOKUP           |t31           |1        |115 |
|6 |  DISTRIBUTED TABLE SCAN|t31(idx_b_t31)|1        |46  |
===========================================================

Outputs & filters: 
-------------------------------------
  0 - output([UNION([1])], [UNION([2])], [UNION([3])], [UNION([4])], [UNION([5])], [UNION([6])]), filter(nil)
  1 - output([t31.pk], [8], [t31.b], [t31.c], [t31.d], [t31.e]), filter(nil)
  2 - output([t31.pk], [t31.b], [t31.c], [t31.d], [t31.e]), filter(nil), dop=1
  3 - output([t31.pk], [t31.b], [t31.c], [t31.d], [t31.e]), filter(nil)
  4 - output([t31.pk], [t31.b], [t31.c], [t31.d], [t31.e]), filter(nil), 
      access([t31.pk], [t31.b], [t31.c], [t31.d], [t31.e]), partitions(p[0-1])
  5 - output([t31.pk], [t31.a], [10], [t31.c], [t31.d], [t31.e]), filter([lnnvl(cast(t31.a = 8, TINYINT(-1, 0)))]), 
      partitions(p[0-1])
  6 - output([t31.pk]), filter(nil), 
      access([t31.pk]), partitions(p0)


select hit_count from oceanbase.V$OB_PLAN_CACHE_PLAN_STAT where statement = 'select /*+use_concat*/* from t31 where a = ? or b = ?';
+-----------+
| hit_count |
+-----------+
|         0 |
+-----------+

drop table t31;
// >>>>>>>>>>>>>>>>>>>>>>>>> CASE#4 LATE MATERIALIZATION
// insert values into cz_t4
select /*+USE_LATE_MATERIALIZATION*/* from cz_t4 order by a limit 5;
+----+------+------+------+------+------+
| pk | a    | b    | c    | e    | d    |
+----+------+------+------+------+------+
|  1 |    1 |    1 |    1 |    1 |    1 |
|  2 |    2 |    2 |    2 |    2 |    2 |
|  3 |    3 |    3 |    3 |    3 |    3 |
|  4 |    4 |    4 |    4 |    4 |    4 |
|  5 |    5 |    5 |    5 |    5 |    5 |
+----+------+------+------+------+------+
select /*+USE_LATE_MATERIALIZATION*/* from cz_t4 order by a limit 5;
+----+------+------+------+------+------+
| pk | a    | b    | c    | e    | d    |
+----+------+------+------+------+------+
|  1 |    1 |    1 |    1 |    1 |    1 |
|  2 |    2 |    2 |    2 |    2 |    2 |
|  3 |    3 |    3 |    3 |    3 |    3 |
|  4 |    4 |    4 |    4 |    4 |    4 |
|  5 |    5 |    5 |    5 |    5 |    5 |
+----+------+------+------+------+------+
explain select /*+USE_LATE_MATERIALIZATION*/* from cz_t4 order by a limit 5;
Query Plan
===============================================
|ID|OPERATOR   |NAME           |EST. ROWS|COST|
-----------------------------------------------
|0 |LIMIT      |               |5        |182 |
|1 | TABLE SCAN|cz_t4(idx_t4_a)|5        |182 |
===============================================

Outputs & filters: 
-------------------------------------
  0 - output([cz_t4.pk], [cz_t4.a], [cz_t4.b], [cz_t4.c], [cz_t4.e], [cz_t4.d]), filter(nil), limit(5), offset(nil)
  1 - output([cz_t4.pk], [cz_t4.a], [cz_t4.b], [cz_t4.c], [cz_t4.e], [cz_t4.d]), filter(nil), 
      access([cz_t4.pk], [cz_t4.a], [cz_t4.b], [cz_t4.c], [cz_t4.e], [cz_t4.d]), partitions(p0)


// expect hit_count = 1
select hit_count from oceanbase.V$OB_PLAN_CACHE_PLAN_STAT where statement like 'select /*+USE_LATE_MATERIALIZATION*/* from cz_t4 order by a limit 5';
+-----------+
| hit_count |
+-----------+
|         1 |
+-----------+

// switch cz_t4 part1 to backup
select /*+USE_LATE_MATERIALIZATION*/* from cz_t4 order by a limit 5;
+----+------+------+------+------+------+
| pk | a    | b    | c    | e    | d    |
+----+------+------+------+------+------+
|  1 |    1 |    1 |    1 |    1 |    1 |
|  2 |    2 |    2 |    2 |    2 |    2 |
|  3 |    3 |    3 |    3 |    3 |    3 |
|  4 |    4 |    4 |    4 |    4 |    4 |
|  5 |    5 |    5 |    5 |    5 |    5 |
+----+------+------+------+------+------+
select /*+USE_LATE_MATERIALIZATION*/* from cz_t4 order by a limit 5;
+----+------+------+------+------+------+
| pk | a    | b    | c    | e    | d    |
+----+------+------+------+------+------+
|  1 |    1 |    1 |    1 |    1 |    1 |
|  2 |    2 |    2 |    2 |    2 |    2 |
|  3 |    3 |    3 |    3 |    3 |    3 |
|  4 |    4 |    4 |    4 |    4 |    4 |
|  5 |    5 |    5 |    5 |    5 |    5 |
+----+------+------+------+------+------+
explain select /*+USE_LATE_MATERIALIZATION*/* from cz_t4 order by a limit 5;
Query Plan
========================================================
|ID|OPERATOR            |NAME           |EST. ROWS|COST|
--------------------------------------------------------
|0 |EXCHANGE IN REMOTE  |               |5        |186 |
|1 | EXCHANGE OUT REMOTE|               |5        |184 |
|2 |  LIMIT             |               |5        |182 |
|3 |   TABLE SCAN       |cz_t4(idx_t4_a)|5        |182 |
========================================================

Outputs & filters: 
-------------------------------------
  0 - output([cz_t4.pk], [cz_t4.a], [cz_t4.b], [cz_t4.c], [cz_t4.e], [cz_t4.d]), filter(nil)
  1 - output([cz_t4.pk], [cz_t4.a], [cz_t4.b], [cz_t4.c], [cz_t4.e], [cz_t4.d]), filter(nil)
  2 - output([cz_t4.pk], [cz_t4.a], [cz_t4.b], [cz_t4.c], [cz_t4.e], [cz_t4.d]), filter(nil), limit(5), offset(nil)
  3 - output([cz_t4.pk], [cz_t4.a], [cz_t4.b], [cz_t4.c], [cz_t4.e], [cz_t4.d]), filter(nil), 
      access([cz_t4.pk], [cz_t4.a], [cz_t4.b], [cz_t4.c], [cz_t4.e], [cz_t4.d]), partitions(p0)


// hit_count = 1, 1
select hit_count from oceanbase.V$OB_PLAN_CACHE_PLAN_STAT where statement like 'select /*+USE_LATE_MATERIALIZATION*/* from cz_t4 order by a limit 5';
+-----------+
| hit_count |
+-----------+
|         0 |
|         1 |
+-----------+

// >>>>>>>>>>>>>>>>>>>>>>>>> CASE#5 TABLE LOOKUP
// reset cz_t1, and src_t
insert into cz_t1 values (1, 1, 1, 1, 1, 1);
insert into cz_t1 values (2, 2, 1, 1, 1, 1);
insert into cz_t1 values (3, 3, 1, 1, 1, 1);
insert into src_t (select * from cz_t1);

// single table select with lookup
select /*+index(cz_t1 idx_t1_a)*/* from cz_t1 where a = 2;
+----+------+------+------+------+------+
| pk | a    | b    | c    | e    | d    |
+----+------+------+------+------+------+
|  2 |    2 |    1 |    1 |    1 |    1 |
+----+------+------+------+------+------+
select /*+index(cz_t1 idx_t1_a)*/* from cz_t1 where a = 2;
+----+------+------+------+------+------+
| pk | a    | b    | c    | e    | d    |
+----+------+------+------+------+------+
|  2 |    2 |    1 |    1 |    1 |    1 |
+----+------+------+------+------+------+
explain select /*+index(cz_t1 idx_t1_a)*/* from cz_t1 where a = 2;
Query Plan
===========================================================
|ID|OPERATOR               |NAME           |EST. ROWS|COST|
-----------------------------------------------------------
|0 |TABLE LOOKUP           |cz_t1          |1        |115 |
|1 | DISTRIBUTED TABLE SCAN|cz_t1(idx_t1_a)|1        |46  |
===========================================================

Outputs & filters: 
-------------------------------------
  0 - output([cz_t1.pk], [cz_t1.a], [cz_t1.b], [cz_t1.c], [cz_t1.e], [cz_t1.d]), filter(nil), 
      partitions(p[0-1])
  1 - output([cz_t1.pk]), filter(nil), 
      access([cz_t1.pk]), partitions(p0)

// hit_count = 1, type = 1
select hit_count, type from oceanbase.V$OB_PLAN_CACHE_PLAN_STAT where statement like 'select /*+index(cz_t1 idx_t1_a)*/* from cz_t1 where a = ?';
+-----------+------+
| hit_count | type |
+-----------+------+
|         1 |    1 |
+-----------+------+

// switch cz_t1 part1 to backup
select /*+index(cz_t1 idx_t1_a)*/* from cz_t1 where a = 2;
+----+------+------+------+------+------+
| pk | a    | b    | c    | e    | d    |
+----+------+------+------+------+------+
|  2 |    2 |    1 |    1 |    1 |    1 |
+----+------+------+------+------+------+
explain select /*+index(cz_t1 idx_t1_a)*/* from cz_t1 where a = 2;
Query Plan
===========================================================
|ID|OPERATOR               |NAME           |EST. ROWS|COST|
-----------------------------------------------------------
|0 |TABLE LOOKUP           |cz_t1          |1        |115 |
|1 | DISTRIBUTED TABLE SCAN|cz_t1(idx_t1_a)|1        |46  |
===========================================================

Outputs & filters: 
-------------------------------------
  0 - output([cz_t1.pk], [cz_t1.a], [cz_t1.b], [cz_t1.c], [cz_t1.e], [cz_t1.d]), filter(nil), 
      partitions(p[0-1])
  1 - output([cz_t1.pk]), filter(nil), 
      access([cz_t1.pk]), partitions(p0)


// hit_count = 2, type = 1
select hit_count, type from oceanbase.V$OB_PLAN_CACHE_PLAN_STAT where statement like 'select /*+index(cz_t1 idx_t1_a)*/* from cz_t1 where a = ?';
+-----------+------+
| hit_count | type |
+-----------+------+
|         2 |    1 |
+-----------+------+

// switch idx_t1_a part1 to backup
select /*+index(cz_t1 idx_t1_a)*/* from cz_t1 where a = 2;
+----+------+------+------+------+------+
| pk | a    | b    | c    | e    | d    |
+----+------+------+------+------+------+
|  2 |    2 |    1 |    1 |    1 |    1 |
+----+------+------+------+------+------+
select /*+index(cz_t1 idx_t1_a)*/* from cz_t1 where a = 2;
+----+------+------+------+------+------+
| pk | a    | b    | c    | e    | d    |
+----+------+------+------+------+------+
|  2 |    2 |    1 |    1 |    1 |    1 |
+----+------+------+------+------+------+
explain select /*+index(cz_t1 idx_t1_a)*/* from cz_t1 where a = 2;
Query Plan
===========================================================
|ID|OPERATOR               |NAME           |EST. ROWS|COST|
-----------------------------------------------------------
|0 |TABLE LOOKUP           |cz_t1          |1        |115 |
|1 | DISTRIBUTED TABLE SCAN|cz_t1(idx_t1_a)|1        |46  |
===========================================================

Outputs & filters: 
-------------------------------------
  0 - output([cz_t1.pk], [cz_t1.a], [cz_t1.b], [cz_t1.c], [cz_t1.e], [cz_t1.d]), filter(nil), 
      partitions(p[0-1])
  1 - output([cz_t1.pk]), filter(nil), 
      access([cz_t1.pk]), partitions(p0)


// hit_count = 1, 2, type = 3, 1
select hit_count, type from oceanbase.V$OB_PLAN_CACHE_PLAN_STAT where statement like 'select /*+index(cz_t1 idx_t1_a)*/* from cz_t1 where a = ?';
+-----------+------+
| hit_count | type |
+-----------+------+
|         4 |    1 |
+-----------+------+

// join table
select /*+index(cz_t5 idx_t5_a) index(cz_t6 idx_t6_a)*/cz_t5.b as b1, cz_t6.b as b2 from cz_t5 join cz_t6 on cz_t5.pk = cz_t6.pk where cz_t5.a = 1 and cz_t6.a = 1;
+------+------+
| b1   | b2   |
+------+------+
|    1 |    1 |
+------+------+
select /*+index(cz_t5 idx_t5_a) index(cz_t6 idx_t6_a)*/cz_t5.b as b1, cz_t6.b as b2 from cz_t5 join cz_t6 on cz_t5.pk = cz_t6.pk where cz_t5.a = 1 and cz_t6.a = 1;
+------+------+
| b1   | b2   |
+------+------+
|    1 |    1 |
+------+------+
explain select /*+index(cz_t5 idx_t5_a) index(cz_t6 idx_t6_a)*/cz_t5.b as b1, cz_t6.b as b2 from cz_t5 join cz_t6 on cz_t5.pk = cz_t6.pk where cz_t5.a = 1 and cz_t6.a = 1;
Query Plan
============================================================
|ID|OPERATOR                |NAME           |EST. ROWS|COST|
------------------------------------------------------------
|0 |NESTED-LOOP JOIN        |               |1        |149 |
|1 | TABLE LOOKUP           |cz_t5          |1        |115 |
|2 |  DISTRIBUTED TABLE SCAN|cz_t5(idx_t5_a)|1        |46  |
|3 | TABLE LOOKUP           |cz_t6          |1        |33  |
|4 |  DISTRIBUTED TABLE GET |cz_t6(idx_t6_a)|1        |7   |
============================================================

Outputs & filters: 
-------------------------------------
  0 - output([cz_t5.b], [cz_t6.b]), filter(nil), 
      conds(nil), nl_params_([cz_t5.pk])
  1 - output([cz_t5.pk], [cz_t5.b]), filter(nil), 
      partitions(p[0-1])
  2 - output([cz_t5.pk]), filter(nil), 
      access([cz_t5.pk]), partitions(p1)
  3 - output([cz_t6.b]), filter(nil), 
      partitions(p[0-1])
  4 - output([cz_t6.pk]), filter(nil), 
      access([cz_t6.pk]), partitions(p1)


// expect hit_count = 1
select hit_count, type from oceanbase.V$OB_PLAN_CACHE_PLAN_STAT where statement like 'select /*+index(cz_t5 idx_t5_a) index(cz_t6 idx_t6_a)*/cz_t5.b as b1, cz_t6.b as b2 from cz_t5 join cz_t6 on cz_t5.pk = cz_t6.pk where cz_t5.a = ? and cz_t6.a = ?';
+-----------+------+
| hit_count | type |
+-----------+------+
|         1 |    1 |
+-----------+------+

// switch idx_t5_a part2 to backup
select /*+index(cz_t5 idx_t5_a) index(cz_t6 idx_t6_a)*/cz_t5.b as b1, cz_t6.b as b2 from cz_t5 join cz_t6 on cz_t5.pk = cz_t6.pk where cz_t5.a = 1 and cz_t6.a = 1;
+------+------+
| b1   | b2   |
+------+------+
|    1 |    1 |
+------+------+
select /*+index(cz_t5 idx_t5_a) index(cz_t6 idx_t6_a)*/cz_t5.b as b1, cz_t6.b as b2 from cz_t5 join cz_t6 on cz_t5.pk = cz_t6.pk where cz_t5.a = 1 and cz_t6.a = 1;
+------+------+
| b1   | b2   |
+------+------+
|    1 |    1 |
+------+------+
explain select /*+index(cz_t5 idx_t5_a) index(cz_t6 idx_t6_a)*/cz_t5.b as b1, cz_t6.b as b2 from cz_t5 join cz_t6 on cz_t5.pk = cz_t6.pk where cz_t5.a = 1 and cz_t6.a = 1;
Query Plan
============================================================
|ID|OPERATOR                |NAME           |EST. ROWS|COST|
------------------------------------------------------------
|0 |NESTED-LOOP JOIN        |               |1        |149 |
|1 | TABLE LOOKUP           |cz_t5          |1        |115 |
|2 |  DISTRIBUTED TABLE SCAN|cz_t5(idx_t5_a)|1        |46  |
|3 | TABLE LOOKUP           |cz_t6          |1        |33  |
|4 |  DISTRIBUTED TABLE GET |cz_t6(idx_t6_a)|1        |7   |
============================================================

Outputs & filters: 
-------------------------------------
  0 - output([cz_t5.b], [cz_t6.b]), filter(nil), 
      conds(nil), nl_params_([cz_t5.pk])
  1 - output([cz_t5.pk], [cz_t5.b]), filter(nil), 
      partitions(p[0-1])
  2 - output([cz_t5.pk]), filter(nil), 
      access([cz_t5.pk]), partitions(p1)
  3 - output([cz_t6.b]), filter(nil), 
      partitions(p[0-1])
  4 - output([cz_t6.pk]), filter(nil), 
      access([cz_t6.pk]), partitions(p1)


// expect hit_count = 1, 1
select hit_count, type from oceanbase.V$OB_PLAN_CACHE_PLAN_STAT where statement like 'select /*+index(cz_t5 idx_t5_a) index(cz_t6 idx_t6_a)*/cz_t5.b as b1, cz_t6.b as b2 from cz_t5 join cz_t6 on cz_t5.pk = cz_t6.pk where cz_t5.a = ? and cz_t6.a = ?';
+-----------+------+
| hit_count | type |
+-----------+------+
|         3 |    1 |
+-----------+------+

// switch idx_t6_a part2 to backup
select /*+index(cz_t5 idx_t5_a) index(cz_t6 idx_t6_a)*/cz_t5.b as b1, cz_t6.b as b2 from cz_t5 join cz_t6 on cz_t5.pk = cz_t6.pk where cz_t5.a = 1 and cz_t6.a = 1;
+------+------+
| b1   | b2   |
+------+------+
|    1 |    1 |
+------+------+
select /*+index(cz_t5 idx_t5_a) index(cz_t6 idx_t6_a)*/cz_t5.b as b1, cz_t6.b as b2 from cz_t5 join cz_t6 on cz_t5.pk = cz_t6.pk where cz_t5.a = 1 and cz_t6.a = 1;
+------+------+
| b1   | b2   |
+------+------+
|    1 |    1 |
+------+------+
explain select /*+index(cz_t5 idx_t5_a) index(cz_t6 idx_t6_a)*/cz_t5.b as b1, cz_t6.b as b2 from cz_t5 join cz_t6 on cz_t5.pk = cz_t6.pk where cz_t5.a = 1 and cz_t6.a = 1;
Query Plan
============================================================
|ID|OPERATOR                |NAME           |EST. ROWS|COST|
------------------------------------------------------------
|0 |NESTED-LOOP JOIN        |               |1        |149 |
|1 | TABLE LOOKUP           |cz_t5          |1        |115 |
|2 |  DISTRIBUTED TABLE SCAN|cz_t5(idx_t5_a)|1        |46  |
|3 | TABLE LOOKUP           |cz_t6          |1        |33  |
|4 |  DISTRIBUTED TABLE GET |cz_t6(idx_t6_a)|1        |7   |
============================================================

Outputs & filters: 
-------------------------------------
  0 - output([cz_t5.b], [cz_t6.b]), filter(nil), 
      conds(nil), nl_params_([cz_t5.pk])
  1 - output([cz_t5.pk], [cz_t5.b]), filter(nil), 
      partitions(p[0-1])
  2 - output([cz_t5.pk]), filter(nil), 
      access([cz_t5.pk]), partitions(p1)
  3 - output([cz_t6.b]), filter(nil), 
      partitions(p[0-1])
  4 - output([cz_t6.pk]), filter(nil), 
      access([cz_t6.pk]), partitions(p1)


// expect hit_count = 1, 1, 1
select hit_count, type from oceanbase.V$OB_PLAN_CACHE_PLAN_STAT where statement like 'select /*+index(cz_t5 idx_t5_a) index(cz_t6 idx_t6_a)*/cz_t5.b as b1, cz_t6.b as b2 from cz_t5 join cz_t6 on cz_t5.pk = cz_t6.pk where cz_t5.a = ? and cz_t6.a = ?';
+-----------+------+
| hit_count | type |
+-----------+------+
|         5 |    1 |
+-----------+------+
// >>>>>>>>>>>>>>>>>>>>>>>>> CASE#6 TABLE LOOKUP WITH PARTITION WISE join
drop table if exists t1, t2, t_insert;
create table t1 (pk int primary key, a int, b int) partition by hash(pk) partitions 2;
create table t2 (pk int primary key, a int, b int);
create table t_insert (pk int primary key, a int, b int) partition by hash(pk) partitions 2;

create index case_idx_t1 on t1(a) partition by hash(a) partitions 2;
create index case_idx_t_insert on t_insert(a) partition by hash(a) partitions 2;

insert into t1 values (1, 1, 1), (2, 2, 2), (4, 4, 4), (3, 3, 3), (5, 5, 5);
insert into t2 values (1, 1, 1), (2, 2, 2), (4, 4, 4), (3, 3, 3), (5, 5, 5);

insert into t_insert select /*+index(t1 case_idx_t1)*/t1.* from t1 join t2 where t1.a = t2.a and t1.a = 5;
explain insert into t_insert select /*+index(t1 case_idx_t1)*/t1.* from t1 join t2 where t1.a = t2.a and t1.a = 5;
Query Plan
================================================================
|ID|OPERATOR                    |NAME           |EST. ROWS|COST|
----------------------------------------------------------------
|0 |DISTRIBUTED INSERT          |               |1        |180 |
|1 | SUBPLAN SCAN               |VIEW1          |1        |160 |
|2 |  NESTED-LOOP JOIN CARTESIAN|               |1        |160 |
|3 |   TABLE LOOKUP             |t1             |1        |115 |
|4 |    DISTRIBUTED TABLE SCAN  |t1(case_idx_t1)|1        |46  |
|5 |   MATERIAL                 |               |1        |46  |
|6 |    TABLE SCAN              |t2             |1        |46  |
================================================================

Outputs & filters: 
-------------------------------------
  0 - output(nil), filter(nil), 
      columns([{t_insert: ({t_insert: (t_insert.pk, t_insert.a, t_insert.b)}, {case_idx_t_insert: (t_insert.a, t_insert.pk)})}]), partitions(p[0-1]), 
      column_values([column_conv(INT,PS:(11,0),NOT NULL,VIEW1.pk)], [column_conv(INT,PS:(11,0),NULL,VIEW1.a)], [column_conv(INT,PS:(11,0),NULL,VIEW1.b)])
  1 - output([VIEW1.pk], [VIEW1.a], [VIEW1.b]), filter(nil), 
      access([VIEW1.pk], [VIEW1.a], [VIEW1.b])
  2 - output([t1.pk], [t1.a], [t1.b]), filter(nil), 
      conds(nil), nl_params_(nil)
  3 - output([t1.pk], [t1.a], [t1.b]), filter(nil), 
      partitions(p[0-1])
  4 - output([t1.pk]), filter(nil), 
      access([t1.pk]), partitions(p1)
  5 - output(nil), filter(nil)
  6 - output(nil), filter([5 = t2.a]), 
      access([t2.a]), partitions(p0)





// switch t2 to backup, case_idx_t1's part0 to backup

insert into t_insert select /*+index(t1 case_idx_t1)*/t1.* from t1 join t2 where t1.a = t2.a and t1.a = 2;
insert into t_insert select /*+index(t1 case_idx_t1)*/t1.* from t1 join t2 where t1.a = t2.a and t1.a = 4;

// should be a different plan
insert into t_insert select /*+index(t1 case_idx_t1)*/t1.* from t1 join t2 where t1.a = t2.a and t1.a = 1;
insert into t_insert select /*+index(t1 case_idx_t1)*/t1.* from t1 join t2 where t1.a = t2.a and t1.a = 3;

explain insert into t_insert select /*+index(t1 case_idx_t1)*/t1.* from t1 join t2 where t1.a = t2.a and t1.a = 4;
Query Plan
================================================================
|ID|OPERATOR                    |NAME           |EST. ROWS|COST|
----------------------------------------------------------------
|0 |DISTRIBUTED INSERT          |               |1        |180 |
|1 | SUBPLAN SCAN               |VIEW1          |1        |160 |
|2 |  NESTED-LOOP JOIN CARTESIAN|               |1        |160 |
|3 |   TABLE LOOKUP             |t1             |1        |115 |
|4 |    DISTRIBUTED TABLE SCAN  |t1(case_idx_t1)|1        |46  |
|5 |   MATERIAL                 |               |1        |46  |
|6 |    PX COORDINATOR          |               |1        |46  |
|7 |     EXCHANGE OUT DISTR     |:EX10000       |1        |46  |
|8 |      TABLE SCAN            |t2             |1        |46  |
================================================================

Outputs & filters: 
-------------------------------------
  0 - output(nil), filter(nil), 
      columns([{t_insert: ({t_insert: (t_insert.pk, t_insert.a, t_insert.b)}, {case_idx_t_insert: (t_insert.a, t_insert.pk)})}]), partitions(p[0-1]), 
      column_values([column_conv(INT,PS:(11,0),NOT NULL,VIEW1.pk)], [column_conv(INT,PS:(11,0),NULL,VIEW1.a)], [column_conv(INT,PS:(11,0),NULL,VIEW1.b)])
  1 - output([VIEW1.pk], [VIEW1.a], [VIEW1.b]), filter(nil), 
      access([VIEW1.pk], [VIEW1.a], [VIEW1.b])
  2 - output([t1.pk], [t1.a], [t1.b]), filter(nil), 
      conds(nil), nl_params_(nil)
  3 - output([t1.pk], [t1.a], [t1.b]), filter(nil), 
      partitions(p[0-1])
  4 - output([t1.pk]), filter(nil), 
      access([t1.pk]), partitions(p0)
  5 - output(nil), filter(nil)
  6 - output(nil), filter(nil)
  7 - output(nil), filter(nil), is_single, dop=1
  8 - output(nil), filter([4 = t2.a]), 
      access([t2.a]), partitions(p0)


explain insert into t_insert select /*+index(t1 case_idx_t1)*/t1.* from t1 join t2 where t1.a = t2.a and t1.a = 3;
Query Plan
================================================================
|ID|OPERATOR                    |NAME           |EST. ROWS|COST|
----------------------------------------------------------------
|0 |DISTRIBUTED INSERT          |               |1        |180 |
|1 | SUBPLAN SCAN               |VIEW1          |1        |160 |
|2 |  NESTED-LOOP JOIN CARTESIAN|               |1        |160 |
|3 |   TABLE LOOKUP             |t1             |1        |115 |
|4 |    DISTRIBUTED TABLE SCAN  |t1(case_idx_t1)|1        |46  |
|5 |   MATERIAL                 |               |1        |46  |
|6 |    PX COORDINATOR          |               |1        |46  |
|7 |     EXCHANGE OUT DISTR     |:EX10000       |1        |46  |
|8 |      TABLE SCAN            |t2             |1        |46  |
================================================================

Outputs & filters: 
-------------------------------------
  0 - output(nil), filter(nil), 
      columns([{t_insert: ({t_insert: (t_insert.pk, t_insert.a, t_insert.b)}, {case_idx_t_insert: (t_insert.a, t_insert.pk)})}]), partitions(p[0-1]), 
      column_values([column_conv(INT,PS:(11,0),NOT NULL,VIEW1.pk)], [column_conv(INT,PS:(11,0),NULL,VIEW1.a)], [column_conv(INT,PS:(11,0),NULL,VIEW1.b)])
  1 - output([VIEW1.pk], [VIEW1.a], [VIEW1.b]), filter(nil), 
      access([VIEW1.pk], [VIEW1.a], [VIEW1.b])
  2 - output([t1.pk], [t1.a], [t1.b]), filter(nil), 
      conds(nil), nl_params_(nil)
  3 - output([t1.pk], [t1.a], [t1.b]), filter(nil), 
      partitions(p[0-1])
  4 - output([t1.pk]), filter(nil), 
      access([t1.pk]), partitions(p1)
  5 - output(nil), filter(nil)
  6 - output(nil), filter(nil)
  7 - output(nil), filter(nil), is_single, dop=1
  8 - output(nil), filter([3 = t2.a]), 
      access([t2.a]), partitions(p0)

select hit_count, type from oceanbase.V$OB_PLAN_CACHE_PLAN_STAT where statement like 'insert into t_insert select /*+index(t1 case_idx_t1)*/t1.* from t1 join t2 where t1.a = t2.a and t1.a = ?';
+-----------+------+
| hit_count | type |
+-----------+------+
|         0 |    1 |
|         0 |    3 |
+-----------+------+
drop table t1, t2, t_insert;
// >>>>>>>>>>>>>>>>>>>>>>>>> CLEANUP
drop table cz_t1, cz_t2, cz_t3, cz_t4, src_t, cz_t5, cz_t6;

alter system flush plan cache global;
alter system set enable_auto_leader_switch=true;
