ob1=OBI(cluster=1:1,proxy_num=0,init_unit_cpu=5);
ob1.reboot;
ob1.mysql alter system set enable_auto_leader_switch=false;
set ob_query_timeout=90000000;
set ob_trx_timeout=1200000000;
create database obtest;
use obtest;
create table t1(id1 int, id2 int) primary_zone='z1';
desc t1;
Field	Type	Null	Key	Default	Extra
id1	int(11)	YES		NULL	
id2	int(11)	YES		NULL	
start transaction;
insert into t1 values(1, 10);
update t1 set id2=11 where id1 = 1;
ob1.z2.obs0.switch_partition obtest:obtest:t1;
select * from t1;
id1	id2
1	11
update t1 set id2=12 where id1 = 1;
select * from t1;
id1	id2
1	12
ob1.z1.obs0.switch_partition obtest:obtest:t1;
select * from t1;
id1	id2
1	12
update t1 set id2=13 where id1 = 1;
select * from t1;
id1	id2
1	13
ob1.z1.obs0.switch_partition obtest:obtest:t1;
select * from t1;
id1	id2
1	13
update t1 set id2=14 where id1 = 1;
select * from t1;
id1	id2
1	14
commit;
select * from t1;
id1	id2
1	14
start transaction;
update t1 set id2=15 where id1 = 1;
ob1.z1.obs0.switch_partition obtest:obtest:t1;
commit;
select * from t1;
id1	id2
1	15
start transaction;
update t1 set id2=16 where id1 = 1;
ob1.z1.obs0.switch_partition obtest:obtest:t1;
rollback;
select * from t1;
id1	id2
1	15
ob1.mysql alter system major freeze;
select * from t1;
id1	id2
1	15
drop table t1;
