DROP DATABASE IF EXISTS database2;
CREATE DATABASE database2;
USE database2;
CREATE TABLE t0(c0 FLOAT ZEROFILL  COMMENT 'asdf' , c1 DECIMAL ZEROFILL  UNIQUE, c2 DOUBLE  UNIQUE NULL , c3 DOUBLE ZEROFILL  ) ;
CREATE TABLE t1 LIKE t0;
select TABLE_NAME, 'InnoDB' from information_schema.TABLES where table_schema = 'database2' order by table_name;
TABLE_NAME	InnoDB
t0	InnoDB
t1	InnoDB
select TABLE_NAME, 'InnoDB' from information_schema.TABLES where table_schema = 'database2' order by table_name;
TABLE_NAME	InnoDB
t0	InnoDB
t1	InnoDB
INSERT  INTO t0(c1) VALUES(-0.0);
DELETE FROM t0;
CREATE INDEX i220 USING BTREE ON t0(c3, c1, c2, c0) INVISIBLE;
select TABLE_NAME, 'InnoDB' from information_schema.TABLES where table_schema = 'database2' order by table_name;
TABLE_NAME	InnoDB
t0	InnoDB
t1	InnoDB
DROP INDEX c1 ON t0;
select TABLE_NAME, 'InnoDB' from information_schema.TABLES where table_schema = 'database2' order by table_name;
TABLE_NAME	InnoDB
t0	InnoDB
t1	InnoDB
CREATE UNIQUE INDEX i850 ON t1(c2);
select TABLE_NAME, 'InnoDB' from information_schema.TABLES where table_schema = 'database2' order by table_name;
TABLE_NAME	InnoDB
t0	InnoDB
t1	InnoDB
DELETE FROM t0 WHERE t0.c1;
select TABLE_NAME, 'InnoDB' from information_schema.TABLES where table_schema = 'database2' order by table_name;
TABLE_NAME	InnoDB
t0	InnoDB
t1	InnoDB
select TABLE_NAME, 'InnoDB' from information_schema.TABLES where table_schema = 'database2' order by table_name;
TABLE_NAME	InnoDB
t0	InnoDB
t1	InnoDB
select TABLE_NAME, 'InnoDB' from information_schema.TABLES where table_schema = 'database2' order by table_name;
TABLE_NAME	InnoDB
t0	InnoDB
t1	InnoDB
DELETE FROM t1;
CREATE INDEX i4487 ON t1(c3, c2, c0, c1) INVISIBLE;
result_format: 4
explain_protocol: 2
EXPLAIN SELECT /*+ NO_MERGE (t1, t0) */ ALL t1.c0 AS ref0 FROM t1, t0 WHERE ( EXISTS (SELECT 1)) IN (NULL, CAST(NULL AS SIGNED)) 
UNION ALL 
SELECT /*+ NO_MERGE (t1, t0) */ ALL t1.c0 AS ref0 FROM t1, t0 WHERE (NOT (( EXISTS (SELECT 1)) IN (NULL, CAST(NULL AS SIGNED)))) 
UNION ALL
SELECT /*+ NO_MERGE (t1, t0) */ ALL t1.c0 AS ref0 FROM t1, t0 WHERE (( EXISTS (SELECT 1)) IN (NULL, CAST(NULL AS SIGNED))) IS UNKNOWN;
Query Plan
=============================================================
|ID|OPERATOR                   |NAME  |EST.ROWS|EST.TIME(us)|
-------------------------------------------------------------
|0 |NESTED-LOOP JOIN CARTESIAN |      |1       |5           |
|1 |├─TABLE FULL SCAN          |t1    |1       |3           |
|2 |└─MATERIAL                 |      |1       |3           |
|3 |  └─TABLE FULL SCAN        |t0(c2)|1       |3           |
=============================================================
Outputs & filters:
-------------------------------------
  0 - output([t1.c0]), filter(nil), rowset=16
      conds(nil), nl_params_(nil), use_batch=false
  1 - output([t1.c0]), filter(nil), rowset=16
      access([t1.c0]), partitions(p0)
      is_index_back=false, is_global_index=false, 
      range_key([t1.__pk_increment]), range(MIN ; MAX)always true
  2 - output(nil), filter(nil), rowset=16
  3 - output(nil), filter(nil), rowset=16
      access(nil), partitions(p0)
      is_index_back=false, is_global_index=false, 
      range_key([t0.c2], [t0.shadow_pk_0]), range(MIN,MIN ; MAX,MAX)always true
SELECT /*+ NO_MERGE (t1, t0) */ ALL t1.c0 AS ref0 FROM t1, t0 WHERE ( EXISTS (SELECT 1)) IN (NULL, CAST(NULL AS SIGNED)) 
UNION ALL 
SELECT /*+ NO_MERGE (t1, t0) */ ALL t1.c0 AS ref0 FROM t1, t0 WHERE (NOT (( EXISTS (SELECT 1)) IN (NULL, CAST(NULL AS SIGNED)))) 
UNION ALL
SELECT /*+ NO_MERGE (t1, t0) */ ALL t1.c0 AS ref0 FROM t1, t0 WHERE (( EXISTS (SELECT 1)) IN (NULL, CAST(NULL AS SIGNED))) IS UNKNOWN;
+------+
| ref0 |
+------+
+------+

DROP DATABASE database2;
