result_format: 4
explain_protocol: 2
set ob_query_timeout = 60000000;

**************  测试非分布式场景
use opt_tpch;
******* basic test TPCH Q17 可改写*****
EXPLAIN SELECT SUM(L_EXTENDEDPRICE)/7.0 AS AVG_YEARLY FROM LINEITEM, PART WHERE P_PARTKEY = L_PARTKEY AND P_BRAND != 'Brand#23' AND P_CONTAINER = 'MED BOX' AND L_QUANTITY < (SELECT 0.2*AVG(L_QUANTITY) FROM LINEITEM WHERE L_PARTKEY = P_PARTKEY);
Query Plan
=============================================================
|ID|OPERATOR                 |NAME    |EST.ROWS|EST.TIME(us)|
-------------------------------------------------------------
|0 |SCALAR GROUP BY          |        |1       |2279        |
|1 |└─SUBPLAN SCAN           |VIEW1   |15      |2279        |
|2 |  └─WINDOW FUNCTION      |        |285     |2274        |
|3 |    └─PARTITION SORT     |        |285     |1869        |
|4 |      └─HASH JOIN        |        |285     |1814        |
|5 |        ├─TABLE FULL SCAN|part    |11      |23          |
|6 |        └─TABLE FULL SCAN|lineitem|11957   |779         |
=============================================================
Outputs & filters:
-------------------------------------
  0 - output([cast(T_FUN_SUM(VIEW1.lineitem.l_extendedprice), DECIMAL_INT(46, 16)) / 7.0]), filter(nil), rowset=256
      group(nil), agg_func([T_FUN_SUM(VIEW1.lineitem.l_extendedprice)])
  1 - output([VIEW1.lineitem.l_extendedprice]), filter([cast(VIEW1.lineitem.l_quantity, DECIMAL(20, 0)) < VIEW1.0.2*AVG(L_QUANTITY)]), rowset=256
      access([VIEW1.0.2*AVG(L_QUANTITY)], [VIEW1.lineitem.l_quantity], [VIEW1.lineitem.l_extendedprice])
  2 - output([cast(0.2, DECIMAL(2, 1)) * cast(cast(T_FUN_SUM(lineitem.l_quantity), DECIMAL_INT(74, 32)) / cast(T_FUN_COUNT(lineitem.l_quantity), DECIMAL_INT(20,
       0)), DECIMAL(24, 4))], [lineitem.l_quantity], [lineitem.l_extendedprice]), filter(nil), rowset=256
      win_expr(T_FUN_SUM(lineitem.l_quantity)), partition_by([lineitem.l_partkey]), order_by(nil), window_type(RANGE), upper(UNBOUNDED PRECEDING), lower(UNBOUNDED 
      FOLLOWING)
      win_expr(T_FUN_COUNT(lineitem.l_quantity)), partition_by([lineitem.l_partkey]), order_by(nil), window_type(RANGE), upper(UNBOUNDED PRECEDING), lower(UNBOUNDED 
      FOLLOWING)
  3 - output([lineitem.l_quantity], [lineitem.l_partkey], [lineitem.l_extendedprice]), filter(nil), rowset=256
      sort_keys([HASH(lineitem.l_partkey), ASC], [lineitem.l_partkey, ASC])
  4 - output([lineitem.l_quantity], [lineitem.l_partkey], [lineitem.l_extendedprice]), filter(nil), rowset=256
      equal_conds([lineitem.l_partkey = part.p_partkey]), other_conds(nil)
  5 - output([part.p_partkey]), filter([part.p_container = 'MED BOX'], [part.p_brand != 'Brand#23']), rowset=256
      access([part.p_partkey], [part.p_brand], [part.p_container]), partitions(p0)
      is_index_back=false, is_global_index=false, filter_before_indexback[false,false], 
      range_key([part.p_partkey]), range(MIN ; MAX)always true
  6 - output([lineitem.l_partkey], [lineitem.l_quantity], [lineitem.l_extendedprice]), filter(nil), rowset=256
      access([lineitem.l_partkey], [lineitem.l_quantity], [lineitem.l_extendedprice]), partitions(p0)
      is_index_back=false, is_global_index=false, 
      range_key([lineitem.l_orderkey], [lineitem.l_linenumber]), range(MIN,MIN ; MAX,MAX)always true
SELECT SUM(L_EXTENDEDPRICE)/7.0 AS AVG_YEARLY FROM LINEITEM, PART WHERE P_PARTKEY = L_PARTKEY AND P_BRAND != 'Brand#23' AND P_CONTAINER = 'MED BOX' AND L_QUANTITY < (SELECT 0.2*AVG(L_QUANTITY) FROM LINEITEM WHERE L_PARTKEY = P_PARTKEY);
+-------------+
| AVG_YEARLY  |
+-------------+
| 4668.630000 |
+-------------+

EXPLAIN SELECT /*+NO_REWRITE*/ SUM(L_EXTENDEDPRICE)/7.0 AS AVG_YEARLY FROM LINEITEM, PART WHERE P_PARTKEY = L_PARTKEY AND P_BRAND != 'Brand#23' AND P_CONTAINER = 'MED BOX' AND L_QUANTITY < (SELECT 0.2*AVG(L_QUANTITY) FROM LINEITEM WHERE L_PARTKEY = P_PARTKEY);
Query Plan
=====================================================================
|ID|OPERATOR                         |NAME    |EST.ROWS|EST.TIME(us)|
---------------------------------------------------------------------
|0 |SCALAR GROUP BY                  |        |1       |119722      |
|1 |└─SUBPLAN FILTER                 |        |95      |119720      |
|2 |  ├─HASH JOIN                    |        |285     |1814        |
|3 |  │ ├─TABLE FULL SCAN            |part    |11      |23          |
|4 |  │ └─TABLE FULL SCAN            |lineitem|11957   |779         |
|5 |  └─SCALAR GROUP BY              |        |1       |415         |
|6 |    └─DISTRIBUTED TABLE FULL SCAN|lineitem|29      |414         |
=====================================================================
Outputs & filters:
-------------------------------------
  0 - output([cast(T_FUN_SUM(lineitem.l_extendedprice), DECIMAL_INT(46, 16)) / 7.0]), filter(nil), rowset=256
      group(nil), agg_func([T_FUN_SUM(lineitem.l_extendedprice)])
  1 - output([lineitem.l_extendedprice]), filter([cast(lineitem.l_quantity, DECIMAL(20, 0)) < subquery(1)]), rowset=256
      exec_params_([part.p_partkey(:0)]), onetime_exprs_(nil), init_plan_idxs_(nil), use_batch=false
  2 - output([part.p_partkey], [lineitem.l_quantity], [lineitem.l_extendedprice]), filter(nil), rowset=256
      equal_conds([part.p_partkey = lineitem.l_partkey]), other_conds(nil)
  3 - output([part.p_partkey]), filter([part.p_container = 'MED BOX'], [part.p_brand != 'Brand#23']), rowset=256
      access([part.p_partkey], [part.p_brand], [part.p_container]), partitions(p0)
      is_index_back=false, is_global_index=false, filter_before_indexback[false,false], 
      range_key([part.p_partkey]), range(MIN ; MAX)always true
  4 - output([lineitem.l_partkey], [lineitem.l_quantity], [lineitem.l_extendedprice]), filter(nil), rowset=256
      access([lineitem.l_partkey], [lineitem.l_quantity], [lineitem.l_extendedprice]), partitions(p0)
      is_index_back=false, is_global_index=false, 
      range_key([lineitem.l_orderkey], [lineitem.l_linenumber]), range(MIN,MIN ; MAX,MAX)always true
  5 - output([cast(0.2, DECIMAL(2, 1)) * cast(cast(T_FUN_SUM(T_FUN_SUM(lineitem.l_quantity)), DECIMAL_INT(74, 32)) / cast(T_FUN_COUNT_SUM(T_FUN_COUNT(lineitem.l_quantity)),
       DECIMAL_INT(20, 0)), DECIMAL(24, 4))]), filter(nil), rowset=256
      group(nil), agg_func([T_FUN_SUM(T_FUN_SUM(lineitem.l_quantity))], [T_FUN_COUNT_SUM(T_FUN_COUNT(lineitem.l_quantity))])
  6 - output([T_FUN_SUM(lineitem.l_quantity)], [T_FUN_COUNT(lineitem.l_quantity)]), filter([lineitem.l_partkey = :0]), rowset=256
      access([lineitem.l_partkey], [lineitem.l_quantity]), partitions(p0)
      is_index_back=false, is_global_index=false, filter_before_indexback[false], 
      range_key([lineitem.l_orderkey], [lineitem.l_linenumber]), range(MIN,MIN ; MAX,MAX)always true, 
      pushdown_aggregation([T_FUN_SUM(lineitem.l_quantity)], [T_FUN_COUNT(lineitem.l_quantity)])
SELECT /*+NO_REWRITE*/ SUM(L_EXTENDEDPRICE)/7.0 AS AVG_YEARLY FROM LINEITEM, PART WHERE P_PARTKEY = L_PARTKEY AND P_BRAND != 'Brand#23' AND P_CONTAINER = 'MED BOX' AND L_QUANTITY < (SELECT 0.2*AVG(L_QUANTITY) FROM LINEITEM WHERE L_PARTKEY = P_PARTKEY);
+-------------+
| AVG_YEARLY  |
+-------------+
| 4668.630000 |
+-------------+
******* basic test end*****

******** parent stmt含其他相关表达式, 可改写 *****
EXPLAIN SELECT SUM(L_EXTENDEDPRICE)/7.0 AS AVG_YEARLY FROM LINEITEM, PART WHERE P_PARTKEY = L_PARTKEY AND L_QUANTITY > P_SIZE AND P_CONTAINER = 'MED BOX' AND L_QUANTITY < (SELECT SUM(L_QUANTITY) FROM LINEITEM WHERE P_PARTKEY = L_PARTKEY);
Query Plan
=============================================================
|ID|OPERATOR                 |NAME    |EST.ROWS|EST.TIME(us)|
-------------------------------------------------------------
|0 |SCALAR GROUP BY          |        |1       |2122        |
|1 |└─SUBPLAN SCAN           |VIEW1   |11      |2121        |
|2 |  └─WINDOW FUNCTION      |        |291     |2116        |
|3 |    └─PARTITION SORT     |        |291     |1880        |
|4 |      └─HASH JOIN        |        |291     |1812        |
|5 |        ├─TABLE FULL SCAN|part    |11      |20          |
|6 |        └─TABLE FULL SCAN|lineitem|11957   |779         |
=============================================================
Outputs & filters:
-------------------------------------
  0 - output([cast(T_FUN_SUM(VIEW1.lineitem.l_extendedprice), DECIMAL_INT(46, 16)) / 7.0]), filter(nil), rowset=256
      group(nil), agg_func([T_FUN_SUM(VIEW1.lineitem.l_extendedprice)])
  1 - output([VIEW1.lineitem.l_extendedprice]), filter([cast(VIEW1.lineitem.l_quantity, DECIMAL_INT(42, 0)) < VIEW1.SUM(L_QUANTITY)], [VIEW1.lineitem.l_quantity 
      > VIEW1.part.p_size]), rowset=256
      access([VIEW1.SUM(L_QUANTITY)], [VIEW1.lineitem.l_quantity], [VIEW1.lineitem.l_extendedprice], [VIEW1.part.p_size])
  2 - output([T_FUN_SUM(lineitem.l_quantity)], [lineitem.l_quantity], [lineitem.l_extendedprice], [part.p_size]), filter(nil), rowset=256
      win_expr(T_FUN_SUM(lineitem.l_quantity)), partition_by([lineitem.l_partkey]), order_by(nil), window_type(RANGE), upper(UNBOUNDED PRECEDING), lower(UNBOUNDED 
      FOLLOWING)
  3 - output([lineitem.l_quantity], [lineitem.l_extendedprice], [part.p_size], [lineitem.l_partkey]), filter(nil), rowset=256
      sort_keys([HASH(lineitem.l_partkey), ASC], [lineitem.l_partkey, ASC])
  4 - output([lineitem.l_quantity], [lineitem.l_extendedprice], [part.p_size], [lineitem.l_partkey]), filter(nil), rowset=256
      equal_conds([lineitem.l_partkey = part.p_partkey]), other_conds(nil)
  5 - output([part.p_partkey], [part.p_size]), filter([part.p_container = 'MED BOX']), rowset=256
      access([part.p_partkey], [part.p_size], [part.p_container]), partitions(p0)
      is_index_back=false, is_global_index=false, filter_before_indexback[false], 
      range_key([part.p_partkey]), range(MIN ; MAX)always true
  6 - output([lineitem.l_partkey], [lineitem.l_quantity], [lineitem.l_extendedprice]), filter(nil), rowset=256
      access([lineitem.l_partkey], [lineitem.l_quantity], [lineitem.l_extendedprice]), partitions(p0)
      is_index_back=false, is_global_index=false, 
      range_key([lineitem.l_orderkey], [lineitem.l_linenumber]), range(MIN,MIN ; MAX,MAX)always true
SELECT SUM(L_EXTENDEDPRICE)/7.0 AS AVG_YEARLY FROM LINEITEM, PART WHERE P_PARTKEY = L_PARTKEY AND L_QUANTITY > P_SIZE AND P_CONTAINER = 'MED BOX' AND L_QUANTITY < (SELECT SUM(L_QUANTITY) FROM LINEITEM WHERE P_PARTKEY = L_PARTKEY);
+---------------+
| AVG_YEARLY    |
+---------------+
| 232165.422857 |
+---------------+

EXPLAIN SELECT /*+NO_REWRITE*/ SUM(L_EXTENDEDPRICE)/7.0 AS AVG_YEARLY FROM LINEITEM, PART WHERE P_PARTKEY = L_PARTKEY AND L_QUANTITY > P_SIZE AND P_CONTAINER = 'MED BOX' AND L_QUANTITY < (SELECT SUM(L_QUANTITY) FROM LINEITEM WHERE P_PARTKEY = L_PARTKEY);
Query Plan
=====================================================================
|ID|OPERATOR                         |NAME    |EST.ROWS|EST.TIME(us)|
---------------------------------------------------------------------
|0 |SCALAR GROUP BY                  |        |1       |61917       |
|1 |└─SUBPLAN FILTER                 |        |49      |61916       |
|2 |  ├─HASH JOIN                    |        |146     |1811        |
|3 |  │ ├─TABLE FULL SCAN            |part    |11      |20          |
|4 |  │ └─TABLE FULL SCAN            |lineitem|11957   |779         |
|5 |  └─SCALAR GROUP BY              |        |1       |414         |
|6 |    └─DISTRIBUTED TABLE FULL SCAN|lineitem|29      |414         |
=====================================================================
Outputs & filters:
-------------------------------------
  0 - output([cast(T_FUN_SUM(lineitem.l_extendedprice), DECIMAL_INT(46, 16)) / 7.0]), filter(nil), rowset=256
      group(nil), agg_func([T_FUN_SUM(lineitem.l_extendedprice)])
  1 - output([lineitem.l_extendedprice]), filter([cast(lineitem.l_quantity, DECIMAL_INT(42, 0)) < subquery(1)]), rowset=256
      exec_params_([part.p_partkey(:0)]), onetime_exprs_(nil), init_plan_idxs_(nil), use_batch=false
  2 - output([part.p_partkey], [lineitem.l_quantity], [lineitem.l_extendedprice]), filter(nil), rowset=256
      equal_conds([part.p_partkey = lineitem.l_partkey]), other_conds([lineitem.l_quantity > part.p_size])
  3 - output([part.p_partkey], [part.p_size]), filter([part.p_container = 'MED BOX']), rowset=256
      access([part.p_partkey], [part.p_size], [part.p_container]), partitions(p0)
      is_index_back=false, is_global_index=false, filter_before_indexback[false], 
      range_key([part.p_partkey]), range(MIN ; MAX)always true
  4 - output([lineitem.l_partkey], [lineitem.l_quantity], [lineitem.l_extendedprice]), filter(nil), rowset=256
      access([lineitem.l_partkey], [lineitem.l_quantity], [lineitem.l_extendedprice]), partitions(p0)
      is_index_back=false, is_global_index=false, 
      range_key([lineitem.l_orderkey], [lineitem.l_linenumber]), range(MIN,MIN ; MAX,MAX)always true
  5 - output([T_FUN_SUM(T_FUN_SUM(lineitem.l_quantity))]), filter(nil), rowset=256
      group(nil), agg_func([T_FUN_SUM(T_FUN_SUM(lineitem.l_quantity))])
  6 - output([T_FUN_SUM(lineitem.l_quantity)]), filter([:0 = lineitem.l_partkey]), rowset=256
      access([lineitem.l_partkey], [lineitem.l_quantity]), partitions(p0)
      is_index_back=false, is_global_index=false, filter_before_indexback[false], 
      range_key([lineitem.l_orderkey], [lineitem.l_linenumber]), range(MIN,MIN ; MAX,MAX)always true, 
      pushdown_aggregation([T_FUN_SUM(lineitem.l_quantity)])
SELECT /*+NO_REWRITE*/ SUM(L_EXTENDEDPRICE)/7.0 AS AVG_YEARLY FROM LINEITEM, PART WHERE P_PARTKEY = L_PARTKEY AND L_QUANTITY > P_SIZE AND P_CONTAINER = 'MED BOX' AND L_QUANTITY < (SELECT SUM(L_QUANTITY) FROM LINEITEM WHERE P_PARTKEY = L_PARTKEY);
+---------------+
| AVG_YEARLY    |
+---------------+
| 232165.422857 |
+---------------+
******** parent stmt含其他相关表达式, 可改写 end *****

****************外部query有多个表的情况 可改写*****
EXPLAIN SELECT SUM(L_EXTENDEDPRICE)/7.0 AS AVG_YEARLY FROM LINEITEM, PART, CUSTOMER WHERE P_PARTKEY = L_PARTKEY AND C_CUSTKEY = L_QUANTITY AND P_BRAND != 'Brand#23' AND P_CONTAINER = 'MED BOX' AND L_QUANTITY < (SELECT 0.2*AVG(L_QUANTITY) FROM LINEITEM WHERE L_PARTKEY = P_PARTKEY);
Query Plan
==============================================================================
|ID|OPERATOR                     |NAME                 |EST.ROWS|EST.TIME(us)|
------------------------------------------------------------------------------
|0 |SCALAR GROUP BY              |                     |1       |2306        |
|1 |└─MERGE JOIN                 |                     |15      |2305        |
|2 |  ├─TABLE FULL SCAN          |customer(i_c_custkey)|300     |10          |
|3 |  └─SORT                     |                     |15      |2282        |
|4 |    └─SUBPLAN SCAN           |VIEW1                |15      |2279        |
|5 |      └─WINDOW FUNCTION      |                     |285     |2274        |
|6 |        └─PARTITION SORT     |                     |285     |1869        |
|7 |          └─HASH JOIN        |                     |285     |1814        |
|8 |            ├─TABLE FULL SCAN|part                 |11      |23          |
|9 |            └─TABLE FULL SCAN|lineitem             |11957   |779         |
==============================================================================
Outputs & filters:
-------------------------------------
  0 - output([cast(T_FUN_SUM(VIEW1.lineitem.l_extendedprice), DECIMAL_INT(46, 16)) / 7.0]), filter(nil), rowset=256
      group(nil), agg_func([T_FUN_SUM(VIEW1.lineitem.l_extendedprice)])
  1 - output([VIEW1.lineitem.l_extendedprice]), filter(nil), rowset=256
      equal_conds([customer.c_custkey = VIEW1.lineitem.l_quantity]), other_conds(nil)
      merge_directions([ASC])
  2 - output([customer.c_custkey]), filter(nil), rowset=256
      access([customer.c_custkey]), partitions(p0)
      is_index_back=false, is_global_index=false, 
      range_key([customer.c_custkey], [customer.shadow_pk_0]), range(MIN,MIN ; MAX,MAX)always true
  3 - output([VIEW1.lineitem.l_quantity], [VIEW1.lineitem.l_extendedprice]), filter(nil), rowset=256
      sort_keys([VIEW1.lineitem.l_quantity, ASC])
  4 - output([VIEW1.lineitem.l_quantity], [VIEW1.lineitem.l_extendedprice]), filter([cast(VIEW1.lineitem.l_quantity, DECIMAL(20, 0)) < VIEW1.0.2*AVG(L_QUANTITY)]), rowset=256
      access([VIEW1.0.2*AVG(L_QUANTITY)], [VIEW1.lineitem.l_quantity], [VIEW1.lineitem.l_extendedprice])
  5 - output([cast(0.2, DECIMAL(2, 1)) * cast(cast(T_FUN_SUM(lineitem.l_quantity), DECIMAL_INT(74, 32)) / cast(T_FUN_COUNT(lineitem.l_quantity), DECIMAL_INT(20,
       0)), DECIMAL(24, 4))], [lineitem.l_quantity], [lineitem.l_extendedprice]), filter(nil), rowset=256
      win_expr(T_FUN_SUM(lineitem.l_quantity)), partition_by([lineitem.l_partkey]), order_by(nil), window_type(RANGE), upper(UNBOUNDED PRECEDING), lower(UNBOUNDED 
      FOLLOWING)
      win_expr(T_FUN_COUNT(lineitem.l_quantity)), partition_by([lineitem.l_partkey]), order_by(nil), window_type(RANGE), upper(UNBOUNDED PRECEDING), lower(UNBOUNDED 
      FOLLOWING)
  6 - output([lineitem.l_quantity], [lineitem.l_partkey], [lineitem.l_extendedprice]), filter(nil), rowset=256
      sort_keys([HASH(lineitem.l_partkey), ASC], [lineitem.l_partkey, ASC])
  7 - output([lineitem.l_quantity], [lineitem.l_partkey], [lineitem.l_extendedprice]), filter(nil), rowset=256
      equal_conds([lineitem.l_partkey = part.p_partkey]), other_conds(nil)
  8 - output([part.p_partkey]), filter([part.p_container = 'MED BOX'], [part.p_brand != 'Brand#23']), rowset=256
      access([part.p_partkey], [part.p_brand], [part.p_container]), partitions(p0)
      is_index_back=false, is_global_index=false, filter_before_indexback[false,false], 
      range_key([part.p_partkey]), range(MIN ; MAX)always true
  9 - output([lineitem.l_partkey], [lineitem.l_quantity], [lineitem.l_extendedprice]), filter(nil), rowset=256
      access([lineitem.l_partkey], [lineitem.l_quantity], [lineitem.l_extendedprice]), partitions(p0)
      is_index_back=false, is_global_index=false, 
      range_key([lineitem.l_orderkey], [lineitem.l_linenumber]), range(MIN,MIN ; MAX,MAX)always true
SELECT SUM(L_EXTENDEDPRICE)/7.0 AS AVG_YEARLY FROM LINEITEM, PART, CUSTOMER WHERE P_PARTKEY = L_PARTKEY AND C_CUSTKEY = L_QUANTITY AND P_BRAND != 'Brand#23' AND P_CONTAINER = 'MED BOX' AND L_QUANTITY < (SELECT 0.2*AVG(L_QUANTITY) FROM LINEITEM WHERE L_PARTKEY = P_PARTKEY);
+-------------+
| AVG_YEARLY  |
+-------------+
| 4668.630000 |
+-------------+

EXPLAIN SELECT /*+NO_REWRITE*/ SUM(L_EXTENDEDPRICE)/7.0 AS AVG_YEARLY FROM LINEITEM, PART, CUSTOMER WHERE P_PARTKEY = L_PARTKEY AND C_CUSTKEY = L_QUANTITY AND P_BRAND != 'Brand#23' AND P_CONTAINER = 'MED BOX' AND L_QUANTITY < (SELECT 0.2*AVG(L_QUANTITY) FROM LINEITEM WHERE L_PARTKEY = P_PARTKEY);
Query Plan
==================================================================================
|ID|OPERATOR                         |NAME                 |EST.ROWS|EST.TIME(us)|
----------------------------------------------------------------------------------
|0 |SCALAR GROUP BY                  |                     |1       |119816      |
|1 |└─SUBPLAN FILTER                 |                     |95      |119814      |
|2 |  ├─MERGE JOIN                   |                     |285     |1908        |
|3 |  │ ├─TABLE FULL SCAN            |customer(i_c_custkey)|300     |10          |
|4 |  │ └─SORT                       |                     |285     |1875        |
|5 |  │   └─HASH JOIN                |                     |285     |1814        |
|6 |  │     ├─TABLE FULL SCAN        |part                 |11      |23          |
|7 |  │     └─TABLE FULL SCAN        |lineitem             |11957   |779         |
|8 |  └─SCALAR GROUP BY              |                     |1       |415         |
|9 |    └─DISTRIBUTED TABLE FULL SCAN|lineitem             |29      |414         |
==================================================================================
Outputs & filters:
-------------------------------------
  0 - output([cast(T_FUN_SUM(lineitem.l_extendedprice), DECIMAL_INT(46, 16)) / 7.0]), filter(nil), rowset=256
      group(nil), agg_func([T_FUN_SUM(lineitem.l_extendedprice)])
  1 - output([lineitem.l_extendedprice]), filter([cast(lineitem.l_quantity, DECIMAL(20, 0)) < subquery(1)]), rowset=256
      exec_params_([part.p_partkey(:0)]), onetime_exprs_(nil), init_plan_idxs_(nil), use_batch=false
  2 - output([part.p_partkey], [lineitem.l_quantity], [lineitem.l_extendedprice]), filter(nil), rowset=256
      equal_conds([customer.c_custkey = lineitem.l_quantity]), other_conds(nil)
      merge_directions([ASC])
  3 - output([customer.c_custkey]), filter(nil), rowset=256
      access([customer.c_custkey]), partitions(p0)
      is_index_back=false, is_global_index=false, 
      range_key([customer.c_custkey], [customer.shadow_pk_0]), range(MIN,MIN ; MAX,MAX)always true
  4 - output([part.p_partkey], [lineitem.l_quantity], [lineitem.l_extendedprice]), filter(nil), rowset=256
      sort_keys([lineitem.l_quantity, ASC])
  5 - output([part.p_partkey], [lineitem.l_quantity], [lineitem.l_extendedprice]), filter(nil), rowset=256
      equal_conds([part.p_partkey = lineitem.l_partkey]), other_conds(nil)
  6 - output([part.p_partkey]), filter([part.p_container = 'MED BOX'], [part.p_brand != 'Brand#23']), rowset=256
      access([part.p_partkey], [part.p_brand], [part.p_container]), partitions(p0)
      is_index_back=false, is_global_index=false, filter_before_indexback[false,false], 
      range_key([part.p_partkey]), range(MIN ; MAX)always true
  7 - output([lineitem.l_partkey], [lineitem.l_quantity], [lineitem.l_extendedprice]), filter(nil), rowset=256
      access([lineitem.l_partkey], [lineitem.l_quantity], [lineitem.l_extendedprice]), partitions(p0)
      is_index_back=false, is_global_index=false, 
      range_key([lineitem.l_orderkey], [lineitem.l_linenumber]), range(MIN,MIN ; MAX,MAX)always true
  8 - output([cast(0.2, DECIMAL(2, 1)) * cast(cast(T_FUN_SUM(T_FUN_SUM(lineitem.l_quantity)), DECIMAL_INT(74, 32)) / cast(T_FUN_COUNT_SUM(T_FUN_COUNT(lineitem.l_quantity)),
       DECIMAL_INT(20, 0)), DECIMAL(24, 4))]), filter(nil), rowset=256
      group(nil), agg_func([T_FUN_SUM(T_FUN_SUM(lineitem.l_quantity))], [T_FUN_COUNT_SUM(T_FUN_COUNT(lineitem.l_quantity))])
  9 - output([T_FUN_SUM(lineitem.l_quantity)], [T_FUN_COUNT(lineitem.l_quantity)]), filter([lineitem.l_partkey = :0]), rowset=256
      access([lineitem.l_partkey], [lineitem.l_quantity]), partitions(p0)
      is_index_back=false, is_global_index=false, filter_before_indexback[false], 
      range_key([lineitem.l_orderkey], [lineitem.l_linenumber]), range(MIN,MIN ; MAX,MAX)always true, 
      pushdown_aggregation([T_FUN_SUM(lineitem.l_quantity)], [T_FUN_COUNT(lineitem.l_quantity)])
SELECT /*+NO_REWRITE*/ SUM(L_EXTENDEDPRICE)/7.0 AS AVG_YEARLY FROM LINEITEM, PART, CUSTOMER WHERE P_PARTKEY = L_PARTKEY AND C_CUSTKEY = L_QUANTITY AND P_BRAND != 'Brand#23' AND P_CONTAINER = 'MED BOX' AND L_QUANTITY < (SELECT 0.2*AVG(L_QUANTITY) FROM LINEITEM WHERE L_PARTKEY = P_PARTKEY);
+-------------+
| AVG_YEARLY  |
+-------------+
| 4668.630000 |
+-------------+
****************end 外部query有多个表的情况 可改写*****

****************外部query有多个相关join的情况 可改写*****
EXPLAIN SELECT SUM(L_EXTENDEDPRICE)/7.0 AS AVG_YEARLY FROM LINEITEM, PART, CUSTOMER WHERE P_PARTKEY = L_PARTKEY AND P_SIZE = l_linenumber AND C_CUSTKEY = L_QUANTITY AND P_BRAND != 'Brand#23' AND P_CONTAINER = 'MED BOX' AND L_QUANTITY < (SELECT 0.2*AVG(L_QUANTITY) FROM LINEITEM WHERE L_PARTKEY = P_PARTKEY);
Query Plan
==============================================================================
|ID|OPERATOR                     |NAME                 |EST.ROWS|EST.TIME(us)|
------------------------------------------------------------------------------
|0 |SCALAR GROUP BY              |                     |1       |2625        |
|1 |└─MERGE JOIN                 |                     |5       |2625        |
|2 |  ├─TABLE FULL SCAN          |customer(i_c_custkey)|300     |10          |
|3 |  └─SORT                     |                     |5       |2602        |
|4 |    └─SUBPLAN SCAN           |VIEW1                |5       |2601        |
|5 |      └─WINDOW FUNCTION      |                     |285     |2597        |
|6 |        └─PARTITION SORT     |                     |285     |2169        |
|7 |          └─HASH JOIN        |                     |285     |2091        |
|8 |            ├─TABLE FULL SCAN|part                 |11      |23          |
|9 |            └─TABLE FULL SCAN|lineitem             |11957   |1056        |
==============================================================================
Outputs & filters:
-------------------------------------
  0 - output([cast(T_FUN_SUM(VIEW1.lineitem.l_extendedprice), DECIMAL_INT(46, 16)) / 7.0]), filter(nil), rowset=256
      group(nil), agg_func([T_FUN_SUM(VIEW1.lineitem.l_extendedprice)])
  1 - output([VIEW1.lineitem.l_extendedprice]), filter(nil), rowset=256
      equal_conds([customer.c_custkey = VIEW1.lineitem.l_quantity]), other_conds(nil)
      merge_directions([ASC])
  2 - output([customer.c_custkey]), filter(nil), rowset=256
      access([customer.c_custkey]), partitions(p0)
      is_index_back=false, is_global_index=false, 
      range_key([customer.c_custkey], [customer.shadow_pk_0]), range(MIN,MIN ; MAX,MAX)always true
  3 - output([VIEW1.lineitem.l_quantity], [VIEW1.lineitem.l_extendedprice]), filter(nil), rowset=256
      sort_keys([VIEW1.lineitem.l_quantity, ASC])
  4 - output([VIEW1.lineitem.l_quantity], [VIEW1.lineitem.l_extendedprice]), filter([VIEW1.part.p_size = VIEW1.lineitem.l_linenumber], [cast(VIEW1.lineitem.l_quantity,
       DECIMAL(20, 0)) < VIEW1.0.2*AVG(L_QUANTITY)]), rowset=256
      access([VIEW1.0.2*AVG(L_QUANTITY)], [VIEW1.lineitem.l_linenumber], [VIEW1.lineitem.l_quantity], [VIEW1.lineitem.l_extendedprice], [VIEW1.part.p_size])
  5 - output([cast(0.2, DECIMAL(2, 1)) * cast(cast(T_FUN_SUM(lineitem.l_quantity), DECIMAL_INT(74, 32)) / cast(T_FUN_COUNT(lineitem.l_quantity), DECIMAL_INT(20,
       0)), DECIMAL(24, 4))], [lineitem.l_linenumber], [lineitem.l_quantity], [lineitem.l_extendedprice], [part.p_size]), filter(nil), rowset=256
      win_expr(T_FUN_SUM(lineitem.l_quantity)), partition_by([lineitem.l_partkey]), order_by(nil), window_type(RANGE), upper(UNBOUNDED PRECEDING), lower(UNBOUNDED 
      FOLLOWING)
      win_expr(T_FUN_COUNT(lineitem.l_quantity)), partition_by([lineitem.l_partkey]), order_by(nil), window_type(RANGE), upper(UNBOUNDED PRECEDING), lower(UNBOUNDED 
      FOLLOWING)
  6 - output([lineitem.l_quantity], [lineitem.l_partkey], [lineitem.l_linenumber], [lineitem.l_extendedprice], [part.p_size]), filter(nil), rowset=256
      sort_keys([HASH(lineitem.l_partkey), ASC], [lineitem.l_partkey, ASC])
  7 - output([lineitem.l_quantity], [lineitem.l_partkey], [lineitem.l_linenumber], [lineitem.l_extendedprice], [part.p_size]), filter(nil), rowset=256
      equal_conds([lineitem.l_partkey = part.p_partkey]), other_conds(nil)
  8 - output([part.p_partkey], [part.p_size]), filter([part.p_container = 'MED BOX'], [part.p_brand != 'Brand#23']), rowset=256
      access([part.p_partkey], [part.p_size], [part.p_brand], [part.p_container]), partitions(p0)
      is_index_back=false, is_global_index=false, filter_before_indexback[false,false], 
      range_key([part.p_partkey]), range(MIN ; MAX)always true
  9 - output([lineitem.l_linenumber], [lineitem.l_partkey], [lineitem.l_quantity], [lineitem.l_extendedprice]), filter(nil), rowset=256
      access([lineitem.l_linenumber], [lineitem.l_partkey], [lineitem.l_quantity], [lineitem.l_extendedprice]), partitions(p0)
      is_index_back=false, is_global_index=false, 
      range_key([lineitem.l_orderkey], [lineitem.l_linenumber]), range(MIN,MIN ; MAX,MAX)always true
SELECT SUM(L_EXTENDEDPRICE)/7.0 AS AVG_YEARLY FROM LINEITEM, PART, CUSTOMER WHERE P_PARTKEY = L_PARTKEY AND P_SIZE = l_linenumber AND C_CUSTKEY = L_QUANTITY AND P_BRAND != 'Brand#23' AND P_CONTAINER = 'MED BOX' AND L_QUANTITY < (SELECT 0.2*AVG(L_QUANTITY) FROM LINEITEM WHERE L_PARTKEY = P_PARTKEY);
+------------+
| AVG_YEARLY |
+------------+
|       NULL |
+------------+

EXPLAIN SELECT /*+NO_REWRITE*/ SUM(L_EXTENDEDPRICE)/7.0 AS AVG_YEARLY FROM LINEITEM, PART, CUSTOMER WHERE P_PARTKEY = L_PARTKEY AND P_SIZE = l_linenumber AND C_CUSTKEY = L_QUANTITY AND P_BRAND != 'Brand#23' AND P_CONTAINER = 'MED BOX' AND L_QUANTITY < (SELECT 0.2*AVG(L_QUANTITY) FROM LINEITEM WHERE L_PARTKEY = P_PARTKEY);
Query Plan
==================================================================================
|ID|OPERATOR                         |NAME                 |EST.ROWS|EST.TIME(us)|
----------------------------------------------------------------------------------
|0 |SCALAR GROUP BY                  |                     |1       |19265       |
|1 |└─SUBPLAN FILTER                 |                     |14      |19265       |
|2 |  ├─MERGE JOIN                   |                     |42      |2205        |
|3 |  │ ├─TABLE FULL SCAN            |customer(i_c_custkey)|300     |10          |
|4 |  │ └─SORT                       |                     |42      |2180        |
|5 |  │   └─HASH JOIN                |                     |42      |2172        |
|6 |  │     ├─TABLE FULL SCAN        |part                 |11      |23          |
|7 |  │     └─TABLE FULL SCAN        |lineitem             |11957   |1056        |
|8 |  └─SCALAR GROUP BY              |                     |1       |415         |
|9 |    └─DISTRIBUTED TABLE FULL SCAN|lineitem             |29      |414         |
==================================================================================
Outputs & filters:
-------------------------------------
  0 - output([cast(T_FUN_SUM(lineitem.l_extendedprice), DECIMAL_INT(46, 16)) / 7.0]), filter(nil), rowset=256
      group(nil), agg_func([T_FUN_SUM(lineitem.l_extendedprice)])
  1 - output([lineitem.l_extendedprice]), filter([cast(lineitem.l_quantity, DECIMAL(20, 0)) < subquery(1)]), rowset=256
      exec_params_([part.p_partkey(:0)]), onetime_exprs_(nil), init_plan_idxs_(nil), use_batch=false
  2 - output([part.p_partkey], [lineitem.l_quantity], [lineitem.l_extendedprice]), filter(nil), rowset=256
      equal_conds([customer.c_custkey = lineitem.l_quantity]), other_conds(nil)
      merge_directions([ASC])
  3 - output([customer.c_custkey]), filter(nil), rowset=256
      access([customer.c_custkey]), partitions(p0)
      is_index_back=false, is_global_index=false, 
      range_key([customer.c_custkey], [customer.shadow_pk_0]), range(MIN,MIN ; MAX,MAX)always true
  4 - output([part.p_partkey], [lineitem.l_quantity], [lineitem.l_extendedprice]), filter(nil), rowset=256
      sort_keys([lineitem.l_quantity, ASC])
  5 - output([part.p_partkey], [lineitem.l_quantity], [lineitem.l_extendedprice]), filter(nil), rowset=256
      equal_conds([part.p_partkey = lineitem.l_partkey], [part.p_size = lineitem.l_linenumber]), other_conds(nil)
  6 - output([part.p_partkey], [part.p_size]), filter([part.p_container = 'MED BOX'], [part.p_brand != 'Brand#23']), rowset=256
      access([part.p_partkey], [part.p_size], [part.p_brand], [part.p_container]), partitions(p0)
      is_index_back=false, is_global_index=false, filter_before_indexback[false,false], 
      range_key([part.p_partkey]), range(MIN ; MAX)always true
  7 - output([lineitem.l_linenumber], [lineitem.l_partkey], [lineitem.l_quantity], [lineitem.l_extendedprice]), filter(nil), rowset=256
      access([lineitem.l_linenumber], [lineitem.l_partkey], [lineitem.l_quantity], [lineitem.l_extendedprice]), partitions(p0)
      is_index_back=false, is_global_index=false, 
      range_key([lineitem.l_orderkey], [lineitem.l_linenumber]), range(MIN,MIN ; MAX,MAX)always true
  8 - output([cast(0.2, DECIMAL(2, 1)) * cast(cast(T_FUN_SUM(T_FUN_SUM(lineitem.l_quantity)), DECIMAL_INT(74, 32)) / cast(T_FUN_COUNT_SUM(T_FUN_COUNT(lineitem.l_quantity)),
       DECIMAL_INT(20, 0)), DECIMAL(24, 4))]), filter(nil), rowset=256
      group(nil), agg_func([T_FUN_SUM(T_FUN_SUM(lineitem.l_quantity))], [T_FUN_COUNT_SUM(T_FUN_COUNT(lineitem.l_quantity))])
  9 - output([T_FUN_SUM(lineitem.l_quantity)], [T_FUN_COUNT(lineitem.l_quantity)]), filter([lineitem.l_partkey = :0]), rowset=256
      access([lineitem.l_partkey], [lineitem.l_quantity]), partitions(p0)
      is_index_back=false, is_global_index=false, filter_before_indexback[false], 
      range_key([lineitem.l_orderkey], [lineitem.l_linenumber]), range(MIN,MIN ; MAX,MAX)always true, 
      pushdown_aggregation([T_FUN_SUM(lineitem.l_quantity)], [T_FUN_COUNT(lineitem.l_quantity)])
SELECT /*+NO_REWRITE*/ SUM(L_EXTENDEDPRICE)/7.0 AS AVG_YEARLY FROM LINEITEM, PART, CUSTOMER WHERE P_PARTKEY = L_PARTKEY AND P_SIZE = l_linenumber AND C_CUSTKEY = L_QUANTITY AND P_BRAND != 'Brand#23' AND P_CONTAINER = 'MED BOX' AND L_QUANTITY < (SELECT 0.2*AVG(L_QUANTITY) FROM LINEITEM WHERE L_PARTKEY = P_PARTKEY);
+------------+
| AVG_YEARLY |
+------------+
|       NULL |
+------------+
****************end 外部query有多个相关join表的情况 可改写*****

**********************不同AGG函数可改写 *****

>>>>>>>>>>>>>>>>>>>>>>>>>>>>> AVG()
EXPLAIN SELECT SUM(L_EXTENDEDPRICE)/7.0 AS AVG_YEARLY FROM LINEITEM, PART WHERE P_PARTKEY = L_PARTKEY AND P_BRAND != 'Brand#23' AND P_CONTAINER = 'MED BOX' AND L_QUANTITY < (SELECT 0.2*AVG(L_QUANTITY) FROM LINEITEM WHERE P_PARTKEY=L_PARTKEY);
Query Plan
=============================================================
|ID|OPERATOR                 |NAME    |EST.ROWS|EST.TIME(us)|
-------------------------------------------------------------
|0 |SCALAR GROUP BY          |        |1       |2279        |
|1 |└─SUBPLAN SCAN           |VIEW1   |15      |2279        |
|2 |  └─WINDOW FUNCTION      |        |285     |2274        |
|3 |    └─PARTITION SORT     |        |285     |1869        |
|4 |      └─HASH JOIN        |        |285     |1814        |
|5 |        ├─TABLE FULL SCAN|part    |11      |23          |
|6 |        └─TABLE FULL SCAN|lineitem|11957   |779         |
=============================================================
Outputs & filters:
-------------------------------------
  0 - output([cast(T_FUN_SUM(VIEW1.lineitem.l_extendedprice), DECIMAL_INT(46, 16)) / 7.0]), filter(nil), rowset=256
      group(nil), agg_func([T_FUN_SUM(VIEW1.lineitem.l_extendedprice)])
  1 - output([VIEW1.lineitem.l_extendedprice]), filter([cast(VIEW1.lineitem.l_quantity, DECIMAL(20, 0)) < VIEW1.0.2*AVG(L_QUANTITY)]), rowset=256
      access([VIEW1.0.2*AVG(L_QUANTITY)], [VIEW1.lineitem.l_quantity], [VIEW1.lineitem.l_extendedprice])
  2 - output([cast(0.2, DECIMAL(2, 1)) * cast(cast(T_FUN_SUM(lineitem.l_quantity), DECIMAL_INT(74, 32)) / cast(T_FUN_COUNT(lineitem.l_quantity), DECIMAL_INT(20,
       0)), DECIMAL(24, 4))], [lineitem.l_quantity], [lineitem.l_extendedprice]), filter(nil), rowset=256
      win_expr(T_FUN_SUM(lineitem.l_quantity)), partition_by([lineitem.l_partkey]), order_by(nil), window_type(RANGE), upper(UNBOUNDED PRECEDING), lower(UNBOUNDED 
      FOLLOWING)
      win_expr(T_FUN_COUNT(lineitem.l_quantity)), partition_by([lineitem.l_partkey]), order_by(nil), window_type(RANGE), upper(UNBOUNDED PRECEDING), lower(UNBOUNDED 
      FOLLOWING)
  3 - output([lineitem.l_quantity], [lineitem.l_partkey], [lineitem.l_extendedprice]), filter(nil), rowset=256
      sort_keys([HASH(lineitem.l_partkey), ASC], [lineitem.l_partkey, ASC])
  4 - output([lineitem.l_quantity], [lineitem.l_partkey], [lineitem.l_extendedprice]), filter(nil), rowset=256
      equal_conds([lineitem.l_partkey = part.p_partkey]), other_conds(nil)
  5 - output([part.p_partkey]), filter([part.p_container = 'MED BOX'], [part.p_brand != 'Brand#23']), rowset=256
      access([part.p_partkey], [part.p_brand], [part.p_container]), partitions(p0)
      is_index_back=false, is_global_index=false, filter_before_indexback[false,false], 
      range_key([part.p_partkey]), range(MIN ; MAX)always true
  6 - output([lineitem.l_partkey], [lineitem.l_quantity], [lineitem.l_extendedprice]), filter(nil), rowset=256
      access([lineitem.l_partkey], [lineitem.l_quantity], [lineitem.l_extendedprice]), partitions(p0)
      is_index_back=false, is_global_index=false, 
      range_key([lineitem.l_orderkey], [lineitem.l_linenumber]), range(MIN,MIN ; MAX,MAX)always true
SELECT SUM(L_EXTENDEDPRICE)/7.0 AS AVG_YEARLY FROM LINEITEM, PART WHERE P_PARTKEY = L_PARTKEY AND P_BRAND != 'Brand#23' AND P_CONTAINER = 'MED BOX' AND L_QUANTITY < (SELECT 0.2*AVG(L_QUANTITY) FROM LINEITEM WHERE P_PARTKEY=L_PARTKEY);
+-------------+
| AVG_YEARLY  |
+-------------+
| 4668.630000 |
+-------------+
EXPLAIN SELECT /*+NO_REWRITE*/ SUM(L_EXTENDEDPRICE)/7.0 AS AVG_YEARLY FROM LINEITEM, PART WHERE P_PARTKEY = L_PARTKEY AND P_BRAND != 'Brand#23' AND P_CONTAINER = 'MED BOX' AND L_QUANTITY < (SELECT 0.2*AVG(L_QUANTITY) FROM LINEITEM WHERE P_PARTKEY=L_PARTKEY);
Query Plan
=====================================================================
|ID|OPERATOR                         |NAME    |EST.ROWS|EST.TIME(us)|
---------------------------------------------------------------------
|0 |SCALAR GROUP BY                  |        |1       |119722      |
|1 |└─SUBPLAN FILTER                 |        |95      |119720      |
|2 |  ├─HASH JOIN                    |        |285     |1814        |
|3 |  │ ├─TABLE FULL SCAN            |part    |11      |23          |
|4 |  │ └─TABLE FULL SCAN            |lineitem|11957   |779         |
|5 |  └─SCALAR GROUP BY              |        |1       |415         |
|6 |    └─DISTRIBUTED TABLE FULL SCAN|lineitem|29      |414         |
=====================================================================
Outputs & filters:
-------------------------------------
  0 - output([cast(T_FUN_SUM(lineitem.l_extendedprice), DECIMAL_INT(46, 16)) / 7.0]), filter(nil), rowset=256
      group(nil), agg_func([T_FUN_SUM(lineitem.l_extendedprice)])
  1 - output([lineitem.l_extendedprice]), filter([cast(lineitem.l_quantity, DECIMAL(20, 0)) < subquery(1)]), rowset=256
      exec_params_([part.p_partkey(:0)]), onetime_exprs_(nil), init_plan_idxs_(nil), use_batch=false
  2 - output([part.p_partkey], [lineitem.l_quantity], [lineitem.l_extendedprice]), filter(nil), rowset=256
      equal_conds([part.p_partkey = lineitem.l_partkey]), other_conds(nil)
  3 - output([part.p_partkey]), filter([part.p_container = 'MED BOX'], [part.p_brand != 'Brand#23']), rowset=256
      access([part.p_partkey], [part.p_brand], [part.p_container]), partitions(p0)
      is_index_back=false, is_global_index=false, filter_before_indexback[false,false], 
      range_key([part.p_partkey]), range(MIN ; MAX)always true
  4 - output([lineitem.l_partkey], [lineitem.l_quantity], [lineitem.l_extendedprice]), filter(nil), rowset=256
      access([lineitem.l_partkey], [lineitem.l_quantity], [lineitem.l_extendedprice]), partitions(p0)
      is_index_back=false, is_global_index=false, 
      range_key([lineitem.l_orderkey], [lineitem.l_linenumber]), range(MIN,MIN ; MAX,MAX)always true
  5 - output([cast(0.2, DECIMAL(2, 1)) * cast(cast(T_FUN_SUM(T_FUN_SUM(lineitem.l_quantity)), DECIMAL_INT(74, 32)) / cast(T_FUN_COUNT_SUM(T_FUN_COUNT(lineitem.l_quantity)),
       DECIMAL_INT(20, 0)), DECIMAL(24, 4))]), filter(nil), rowset=256
      group(nil), agg_func([T_FUN_SUM(T_FUN_SUM(lineitem.l_quantity))], [T_FUN_COUNT_SUM(T_FUN_COUNT(lineitem.l_quantity))])
  6 - output([T_FUN_SUM(lineitem.l_quantity)], [T_FUN_COUNT(lineitem.l_quantity)]), filter([:0 = lineitem.l_partkey]), rowset=256
      access([lineitem.l_partkey], [lineitem.l_quantity]), partitions(p0)
      is_index_back=false, is_global_index=false, filter_before_indexback[false], 
      range_key([lineitem.l_orderkey], [lineitem.l_linenumber]), range(MIN,MIN ; MAX,MAX)always true, 
      pushdown_aggregation([T_FUN_SUM(lineitem.l_quantity)], [T_FUN_COUNT(lineitem.l_quantity)])
SELECT /*+NO_REWRITE*/ SUM(L_EXTENDEDPRICE)/7.0 AS AVG_YEARLY FROM LINEITEM, PART WHERE P_PARTKEY = L_PARTKEY AND P_BRAND != 'Brand#23' AND P_CONTAINER = 'MED BOX' AND L_QUANTITY < (SELECT 0.2*AVG(L_QUANTITY) FROM LINEITEM WHERE P_PARTKEY=L_PARTKEY);
+-------------+
| AVG_YEARLY  |
+-------------+
| 4668.630000 |
+-------------+


>>>>>>>>>>>>>>>>>>>>>>>>>>>>> SUM()
EXPLAIN SELECT  SUM(L_EXTENDEDPRICE)/7.0 AS AVG_YEARLY FROM LINEITEM, PART WHERE P_PARTKEY = L_PARTKEY AND P_BRAND != 'Brand#23' AND P_CONTAINER = 'MED BOX' AND L_QUANTITY < (SELECT 0.1*SUM(L_QUANTITY)+1 FROM LINEITEM WHERE P_PARTKEY=L_PARTKEY);
Query Plan
=============================================================
|ID|OPERATOR                 |NAME    |EST.ROWS|EST.TIME(us)|
-------------------------------------------------------------
|0 |SCALAR GROUP BY          |        |1       |2095        |
|1 |└─SUBPLAN SCAN           |VIEW1   |15      |2094        |
|2 |  └─WINDOW FUNCTION      |        |285     |2090        |
|3 |    └─PARTITION SORT     |        |285     |1869        |
|4 |      └─HASH JOIN        |        |285     |1814        |
|5 |        ├─TABLE FULL SCAN|part    |11      |23          |
|6 |        └─TABLE FULL SCAN|lineitem|11957   |779         |
=============================================================
Outputs & filters:
-------------------------------------
  0 - output([cast(T_FUN_SUM(VIEW1.lineitem.l_extendedprice), DECIMAL_INT(46, 16)) / 7.0]), filter(nil), rowset=256
      group(nil), agg_func([T_FUN_SUM(VIEW1.lineitem.l_extendedprice)])
  1 - output([VIEW1.lineitem.l_extendedprice]), filter([cast(VIEW1.lineitem.l_quantity, DECIMAL_INT(45, 1)) < VIEW1.0.1*SUM(L_QUANTITY)+1]), rowset=256
      access([VIEW1.0.1*SUM(L_QUANTITY)+1], [VIEW1.lineitem.l_quantity], [VIEW1.lineitem.l_extendedprice])
  2 - output([0.1 * T_FUN_SUM(lineitem.l_quantity) + cast(1, DECIMAL_INT(45, 1))], [lineitem.l_quantity], [lineitem.l_extendedprice]), filter(nil), rowset=256
      win_expr(T_FUN_SUM(lineitem.l_quantity)), partition_by([lineitem.l_partkey]), order_by(nil), window_type(RANGE), upper(UNBOUNDED PRECEDING), lower(UNBOUNDED 
      FOLLOWING)
  3 - output([lineitem.l_quantity], [lineitem.l_extendedprice], [lineitem.l_partkey]), filter(nil), rowset=256
      sort_keys([HASH(lineitem.l_partkey), ASC], [lineitem.l_partkey, ASC])
  4 - output([lineitem.l_quantity], [lineitem.l_extendedprice], [lineitem.l_partkey]), filter(nil), rowset=256
      equal_conds([lineitem.l_partkey = part.p_partkey]), other_conds(nil)
  5 - output([part.p_partkey]), filter([part.p_container = 'MED BOX'], [part.p_brand != 'Brand#23']), rowset=256
      access([part.p_partkey], [part.p_brand], [part.p_container]), partitions(p0)
      is_index_back=false, is_global_index=false, filter_before_indexback[false,false], 
      range_key([part.p_partkey]), range(MIN ; MAX)always true
  6 - output([lineitem.l_partkey], [lineitem.l_quantity], [lineitem.l_extendedprice]), filter(nil), rowset=256
      access([lineitem.l_partkey], [lineitem.l_quantity], [lineitem.l_extendedprice]), partitions(p0)
      is_index_back=false, is_global_index=false, 
      range_key([lineitem.l_orderkey], [lineitem.l_linenumber]), range(MIN,MIN ; MAX,MAX)always true
SELECT  SUM(L_EXTENDEDPRICE)/7.0 AS AVG_YEARLY FROM LINEITEM, PART WHERE P_PARTKEY = L_PARTKEY AND P_BRAND != 'Brand#23' AND P_CONTAINER = 'MED BOX' AND L_QUANTITY < (SELECT 0.1*SUM(L_QUANTITY)+1 FROM LINEITEM WHERE P_PARTKEY=L_PARTKEY);
+---------------+
| AVG_YEARLY    |
+---------------+
| 254701.234286 |
+---------------+
EXPLAIN SELECT /*+NO_REWRITE*/ SUM(L_EXTENDEDPRICE)/7.0 AS AVG_YEARLY FROM LINEITEM, PART WHERE P_PARTKEY = L_PARTKEY AND P_BRAND != 'Brand#23' AND P_CONTAINER = 'MED BOX' AND L_QUANTITY < (SELECT 0.1*SUM(L_QUANTITY)+1 FROM LINEITEM WHERE P_PARTKEY=L_PARTKEY);
Query Plan
=====================================================================
|ID|OPERATOR                         |NAME    |EST.ROWS|EST.TIME(us)|
---------------------------------------------------------------------
|0 |SCALAR GROUP BY                  |        |1       |119597      |
|1 |└─SUBPLAN FILTER                 |        |95      |119595      |
|2 |  ├─HASH JOIN                    |        |285     |1814        |
|3 |  │ ├─TABLE FULL SCAN            |part    |11      |23          |
|4 |  │ └─TABLE FULL SCAN            |lineitem|11957   |779         |
|5 |  └─SCALAR GROUP BY              |        |1       |414         |
|6 |    └─DISTRIBUTED TABLE FULL SCAN|lineitem|29      |414         |
=====================================================================
Outputs & filters:
-------------------------------------
  0 - output([cast(T_FUN_SUM(lineitem.l_extendedprice), DECIMAL_INT(46, 16)) / 7.0]), filter(nil), rowset=256
      group(nil), agg_func([T_FUN_SUM(lineitem.l_extendedprice)])
  1 - output([lineitem.l_extendedprice]), filter([cast(lineitem.l_quantity, DECIMAL_INT(45, 1)) < subquery(1)]), rowset=256
      exec_params_([part.p_partkey(:0)]), onetime_exprs_(nil), init_plan_idxs_(nil), use_batch=false
  2 - output([part.p_partkey], [lineitem.l_quantity], [lineitem.l_extendedprice]), filter(nil), rowset=256
      equal_conds([part.p_partkey = lineitem.l_partkey]), other_conds(nil)
  3 - output([part.p_partkey]), filter([part.p_container = 'MED BOX'], [part.p_brand != 'Brand#23']), rowset=256
      access([part.p_partkey], [part.p_brand], [part.p_container]), partitions(p0)
      is_index_back=false, is_global_index=false, filter_before_indexback[false,false], 
      range_key([part.p_partkey]), range(MIN ; MAX)always true
  4 - output([lineitem.l_partkey], [lineitem.l_quantity], [lineitem.l_extendedprice]), filter(nil), rowset=256
      access([lineitem.l_partkey], [lineitem.l_quantity], [lineitem.l_extendedprice]), partitions(p0)
      is_index_back=false, is_global_index=false, 
      range_key([lineitem.l_orderkey], [lineitem.l_linenumber]), range(MIN,MIN ; MAX,MAX)always true
  5 - output([0.1 * T_FUN_SUM(T_FUN_SUM(lineitem.l_quantity)) + cast(1, DECIMAL_INT(45, 1))]), filter(nil), rowset=256
      group(nil), agg_func([T_FUN_SUM(T_FUN_SUM(lineitem.l_quantity))])
  6 - output([T_FUN_SUM(lineitem.l_quantity)]), filter([:0 = lineitem.l_partkey]), rowset=256
      access([lineitem.l_partkey], [lineitem.l_quantity]), partitions(p0)
      is_index_back=false, is_global_index=false, filter_before_indexback[false], 
      range_key([lineitem.l_orderkey], [lineitem.l_linenumber]), range(MIN,MIN ; MAX,MAX)always true, 
      pushdown_aggregation([T_FUN_SUM(lineitem.l_quantity)])
SELECT /*+NO_REWRITE*/ SUM(L_EXTENDEDPRICE)/7.0 AS AVG_YEARLY FROM LINEITEM, PART WHERE P_PARTKEY = L_PARTKEY AND P_BRAND != 'Brand#23' AND P_CONTAINER = 'MED BOX' AND L_QUANTITY < (SELECT 0.1*SUM(L_QUANTITY)+1 FROM LINEITEM WHERE P_PARTKEY=L_PARTKEY);
+---------------+
| AVG_YEARLY    |
+---------------+
| 254701.234286 |
+---------------+


>>>>>>>>>>>>>>>>>>>>>>>>>>>>> COUNT()
EXPLAIN SELECT SUM(L_EXTENDEDPRICE)/7.0 AS AVG_YEARLY FROM LINEITEM, PART WHERE P_PARTKEY = L_PARTKEY AND P_BRAND != 'Brand#23' AND P_CONTAINER = 'MED BOX' AND L_QUANTITY < (SELECT 10*COUNT(L_PARTKEY) FROM LINEITEM WHERE P_PARTKEY=L_PARTKEY);
Query Plan
=============================================================
|ID|OPERATOR                 |NAME    |EST.ROWS|EST.TIME(us)|
-------------------------------------------------------------
|0 |SCALAR GROUP BY          |        |1       |3425        |
|1 |└─HASH JOIN              |        |149     |3422        |
|2 |  ├─HASH OUTER JOIN      |        |16      |1628        |
|3 |  │ ├─TABLE FULL SCAN    |part    |11      |23          |
|4 |  │ └─SUBPLAN SCAN       |VIEW1   |422     |1567        |
|5 |  │   └─HASH GROUP BY    |        |422     |1566        |
|6 |  │     └─TABLE FULL SCAN|lineitem|11957   |311         |
|7 |  └─TABLE FULL SCAN      |lineitem|11957   |779         |
=============================================================
Outputs & filters:
-------------------------------------
  0 - output([cast(T_FUN_SUM(lineitem.l_extendedprice), DECIMAL_INT(46, 16)) / 7.0]), filter(nil), rowset=256
      group(nil), agg_func([T_FUN_SUM(lineitem.l_extendedprice)])
  1 - output([lineitem.l_extendedprice]), filter(nil), rowset=256
      equal_conds([part.p_partkey = lineitem.l_partkey]), other_conds([lineitem.l_quantity < CASE WHEN VIEW1.lineitem.l_partkey IS NOT NULL THEN VIEW1.10*COUNT(L_PARTKEY) 
      ELSE 10 * 0 END])
  2 - output([part.p_partkey], [VIEW1.lineitem.l_partkey], [VIEW1.10*COUNT(L_PARTKEY)]), filter(nil), rowset=256
      equal_conds([part.p_partkey = VIEW1.lineitem.l_partkey]), other_conds(nil)
  3 - output([part.p_partkey]), filter([part.p_container = 'MED BOX'], [part.p_brand != 'Brand#23']), rowset=256
      access([part.p_partkey], [part.p_brand], [part.p_container]), partitions(p0)
      is_index_back=false, is_global_index=false, filter_before_indexback[false,false], 
      range_key([part.p_partkey]), range(MIN ; MAX)always true
  4 - output([VIEW1.10*COUNT(L_PARTKEY)], [VIEW1.lineitem.l_partkey]), filter(nil), rowset=256
      access([VIEW1.10*COUNT(L_PARTKEY)], [VIEW1.lineitem.l_partkey])
  5 - output([10 * T_FUN_COUNT(lineitem.l_partkey)], [lineitem.l_partkey]), filter(nil), rowset=256
      group([lineitem.l_partkey]), agg_func([T_FUN_COUNT(lineitem.l_partkey)])
  6 - output([lineitem.l_partkey]), filter(nil), rowset=256
      access([lineitem.l_partkey]), partitions(p0)
      is_index_back=false, is_global_index=false, 
      range_key([lineitem.l_orderkey], [lineitem.l_linenumber]), range(MIN,MIN ; MAX,MAX)always true
  7 - output([lineitem.l_partkey], [lineitem.l_quantity], [lineitem.l_extendedprice]), filter(nil), rowset=256
      access([lineitem.l_partkey], [lineitem.l_quantity], [lineitem.l_extendedprice]), partitions(p0)
      is_index_back=false, is_global_index=false, 
      range_key([lineitem.l_orderkey], [lineitem.l_linenumber]), range(MIN,MIN ; MAX,MAX)always true
SELECT SUM(L_EXTENDEDPRICE)/7.0 AS AVG_YEARLY FROM LINEITEM, PART WHERE P_PARTKEY = L_PARTKEY AND P_BRAND != 'Brand#23' AND P_CONTAINER = 'MED BOX' AND L_QUANTITY < (SELECT 10*COUNT(L_PARTKEY) FROM LINEITEM WHERE P_PARTKEY=L_PARTKEY);
+---------------+
| AVG_YEARLY    |
+---------------+
| 254701.234286 |
+---------------+
EXPLAIN SELECT /*+NO_REWRITE*/ SUM(L_EXTENDEDPRICE)/7.0 AS AVG_YEARLY FROM LINEITEM, PART WHERE P_PARTKEY = L_PARTKEY AND P_BRAND != 'Brand#23' AND P_CONTAINER = 'MED BOX' AND L_QUANTITY < (SELECT 10*COUNT(L_PARTKEY) FROM LINEITEM WHERE P_PARTKEY=L_PARTKEY);
Query Plan
=====================================================================
|ID|OPERATOR                         |NAME    |EST.ROWS|EST.TIME(us)|
---------------------------------------------------------------------
|0 |SCALAR GROUP BY                  |        |1       |119410      |
|1 |└─SUBPLAN FILTER                 |        |95      |119409      |
|2 |  ├─HASH JOIN                    |        |285     |1814        |
|3 |  │ ├─TABLE FULL SCAN            |part    |11      |23          |
|4 |  │ └─TABLE FULL SCAN            |lineitem|11957   |779         |
|5 |  └─SCALAR GROUP BY              |        |1       |413         |
|6 |    └─DISTRIBUTED TABLE FULL SCAN|lineitem|29      |413         |
=====================================================================
Outputs & filters:
-------------------------------------
  0 - output([cast(T_FUN_SUM(lineitem.l_extendedprice), DECIMAL_INT(46, 16)) / 7.0]), filter(nil), rowset=256
      group(nil), agg_func([T_FUN_SUM(lineitem.l_extendedprice)])
  1 - output([lineitem.l_extendedprice]), filter([lineitem.l_quantity < subquery(1)]), rowset=256
      exec_params_([part.p_partkey(:0)]), onetime_exprs_(nil), init_plan_idxs_(nil), use_batch=false
  2 - output([part.p_partkey], [lineitem.l_quantity], [lineitem.l_extendedprice]), filter(nil), rowset=256
      equal_conds([part.p_partkey = lineitem.l_partkey]), other_conds(nil)
  3 - output([part.p_partkey]), filter([part.p_container = 'MED BOX'], [part.p_brand != 'Brand#23']), rowset=256
      access([part.p_partkey], [part.p_brand], [part.p_container]), partitions(p0)
      is_index_back=false, is_global_index=false, filter_before_indexback[false,false], 
      range_key([part.p_partkey]), range(MIN ; MAX)always true
  4 - output([lineitem.l_partkey], [lineitem.l_quantity], [lineitem.l_extendedprice]), filter(nil), rowset=256
      access([lineitem.l_partkey], [lineitem.l_quantity], [lineitem.l_extendedprice]), partitions(p0)
      is_index_back=false, is_global_index=false, 
      range_key([lineitem.l_orderkey], [lineitem.l_linenumber]), range(MIN,MIN ; MAX,MAX)always true
  5 - output([10 * T_FUN_COUNT_SUM(T_FUN_COUNT(lineitem.l_partkey))]), filter(nil), rowset=256
      group(nil), agg_func([T_FUN_COUNT_SUM(T_FUN_COUNT(lineitem.l_partkey))])
  6 - output([T_FUN_COUNT(lineitem.l_partkey)]), filter([:0 = lineitem.l_partkey]), rowset=256
      access([lineitem.l_partkey]), partitions(p0)
      is_index_back=false, is_global_index=false, filter_before_indexback[false], 
      range_key([lineitem.l_orderkey], [lineitem.l_linenumber]), range(MIN,MIN ; MAX,MAX)always true, 
      pushdown_aggregation([T_FUN_COUNT(lineitem.l_partkey)])
SELECT /*+NO_REWRITE*/ SUM(L_EXTENDEDPRICE)/7.0 AS AVG_YEARLY FROM LINEITEM, PART WHERE P_PARTKEY = L_PARTKEY AND P_BRAND != 'Brand#23' AND P_CONTAINER = 'MED BOX' AND L_QUANTITY < (SELECT 10*COUNT(L_PARTKEY) FROM LINEITEM WHERE P_PARTKEY=L_PARTKEY);
+---------------+
| AVG_YEARLY    |
+---------------+
| 254701.234286 |
+---------------+


>>>>>>>>>>>>>>>>>>>>>>>>>>>>> MIN()
EXPLAIN SELECT  SUM(L_EXTENDEDPRICE)/7.0 AS AVG_YEARLY FROM LINEITEM, PART WHERE P_PARTKEY = L_PARTKEY AND P_BRAND != 'Brand#23' AND P_CONTAINER = 'MED BOX' AND L_QUANTITY < (SELECT  5*MIN(L_QUANTITY) FROM LINEITEM WHERE P_PARTKEY=L_PARTKEY);
Query Plan
=============================================================
|ID|OPERATOR                 |NAME    |EST.ROWS|EST.TIME(us)|
-------------------------------------------------------------
|0 |SCALAR GROUP BY          |        |1       |2093        |
|1 |└─SUBPLAN SCAN           |VIEW1   |15      |2093        |
|2 |  └─WINDOW FUNCTION      |        |285     |2090        |
|3 |    └─PARTITION SORT     |        |285     |1869        |
|4 |      └─HASH JOIN        |        |285     |1814        |
|5 |        ├─TABLE FULL SCAN|part    |11      |23          |
|6 |        └─TABLE FULL SCAN|lineitem|11957   |779         |
=============================================================
Outputs & filters:
-------------------------------------
  0 - output([cast(T_FUN_SUM(VIEW1.lineitem.l_extendedprice), DECIMAL_INT(46, 16)) / 7.0]), filter(nil), rowset=256
      group(nil), agg_func([T_FUN_SUM(VIEW1.lineitem.l_extendedprice)])
  1 - output([VIEW1.lineitem.l_extendedprice]), filter([VIEW1.lineitem.l_quantity < VIEW1.5*MIN(L_QUANTITY)]), rowset=256
      access([VIEW1.5*MIN(L_QUANTITY)], [VIEW1.lineitem.l_quantity], [VIEW1.lineitem.l_extendedprice])
  2 - output([5 * T_FUN_MIN(lineitem.l_quantity)], [lineitem.l_quantity], [lineitem.l_extendedprice]), filter(nil), rowset=256
      win_expr(T_FUN_MIN(lineitem.l_quantity)), partition_by([lineitem.l_partkey]), order_by(nil), window_type(RANGE), upper(UNBOUNDED PRECEDING), lower(UNBOUNDED 
      FOLLOWING)
  3 - output([lineitem.l_quantity], [lineitem.l_extendedprice], [lineitem.l_partkey]), filter(nil), rowset=256
      sort_keys([HASH(lineitem.l_partkey), ASC], [lineitem.l_partkey, ASC])
  4 - output([lineitem.l_quantity], [lineitem.l_extendedprice], [lineitem.l_partkey]), filter(nil), rowset=256
      equal_conds([lineitem.l_partkey = part.p_partkey]), other_conds(nil)
  5 - output([part.p_partkey]), filter([part.p_container = 'MED BOX'], [part.p_brand != 'Brand#23']), rowset=256
      access([part.p_partkey], [part.p_brand], [part.p_container]), partitions(p0)
      is_index_back=false, is_global_index=false, filter_before_indexback[false,false], 
      range_key([part.p_partkey]), range(MIN ; MAX)always true
  6 - output([lineitem.l_partkey], [lineitem.l_quantity], [lineitem.l_extendedprice]), filter(nil), rowset=256
      access([lineitem.l_partkey], [lineitem.l_quantity], [lineitem.l_extendedprice]), partitions(p0)
      is_index_back=false, is_global_index=false, 
      range_key([lineitem.l_orderkey], [lineitem.l_linenumber]), range(MIN,MIN ; MAX,MAX)always true
SELECT  SUM(L_EXTENDEDPRICE)/7.0 AS AVG_YEARLY FROM LINEITEM, PART WHERE P_PARTKEY = L_PARTKEY AND P_BRAND != 'Brand#23' AND P_CONTAINER = 'MED BOX' AND L_QUANTITY < (SELECT  5*MIN(L_QUANTITY) FROM LINEITEM WHERE P_PARTKEY=L_PARTKEY);
+--------------+
| AVG_YEARLY   |
+--------------+
| 10890.518571 |
+--------------+
EXPLAIN SELECT /*+NO_REWRITE*/ SUM(L_EXTENDEDPRICE)/7.0 AS AVG_YEARLY FROM LINEITEM, PART WHERE P_PARTKEY = L_PARTKEY AND P_BRAND != 'Brand#23' AND P_CONTAINER = 'MED BOX' AND L_QUANTITY < (SELECT  5*MIN(L_QUANTITY) FROM LINEITEM WHERE P_PARTKEY=L_PARTKEY);
Query Plan
=====================================================================
|ID|OPERATOR                         |NAME    |EST.ROWS|EST.TIME(us)|
---------------------------------------------------------------------
|0 |SCALAR GROUP BY                  |        |1       |119597      |
|1 |└─SUBPLAN FILTER                 |        |95      |119595      |
|2 |  ├─HASH JOIN                    |        |285     |1814        |
|3 |  │ ├─TABLE FULL SCAN            |part    |11      |23          |
|4 |  │ └─TABLE FULL SCAN            |lineitem|11957   |779         |
|5 |  └─SCALAR GROUP BY              |        |1       |414         |
|6 |    └─DISTRIBUTED TABLE FULL SCAN|lineitem|29      |414         |
=====================================================================
Outputs & filters:
-------------------------------------
  0 - output([cast(T_FUN_SUM(lineitem.l_extendedprice), DECIMAL_INT(46, 16)) / 7.0]), filter(nil), rowset=256
      group(nil), agg_func([T_FUN_SUM(lineitem.l_extendedprice)])
  1 - output([lineitem.l_extendedprice]), filter([lineitem.l_quantity < subquery(1)]), rowset=256
      exec_params_([part.p_partkey(:0)]), onetime_exprs_(nil), init_plan_idxs_(nil), use_batch=false
  2 - output([part.p_partkey], [lineitem.l_quantity], [lineitem.l_extendedprice]), filter(nil), rowset=256
      equal_conds([part.p_partkey = lineitem.l_partkey]), other_conds(nil)
  3 - output([part.p_partkey]), filter([part.p_container = 'MED BOX'], [part.p_brand != 'Brand#23']), rowset=256
      access([part.p_partkey], [part.p_brand], [part.p_container]), partitions(p0)
      is_index_back=false, is_global_index=false, filter_before_indexback[false,false], 
      range_key([part.p_partkey]), range(MIN ; MAX)always true
  4 - output([lineitem.l_partkey], [lineitem.l_quantity], [lineitem.l_extendedprice]), filter(nil), rowset=256
      access([lineitem.l_partkey], [lineitem.l_quantity], [lineitem.l_extendedprice]), partitions(p0)
      is_index_back=false, is_global_index=false, 
      range_key([lineitem.l_orderkey], [lineitem.l_linenumber]), range(MIN,MIN ; MAX,MAX)always true
  5 - output([5 * T_FUN_MIN(T_FUN_MIN(lineitem.l_quantity))]), filter(nil), rowset=256
      group(nil), agg_func([T_FUN_MIN(T_FUN_MIN(lineitem.l_quantity))])
  6 - output([T_FUN_MIN(lineitem.l_quantity)]), filter([:0 = lineitem.l_partkey]), rowset=256
      access([lineitem.l_partkey], [lineitem.l_quantity]), partitions(p0)
      is_index_back=false, is_global_index=false, filter_before_indexback[false], 
      range_key([lineitem.l_orderkey], [lineitem.l_linenumber]), range(MIN,MIN ; MAX,MAX)always true, 
      pushdown_aggregation([T_FUN_MIN(lineitem.l_quantity)])
SELECT /*+NO_REWRITE*/ SUM(L_EXTENDEDPRICE)/7.0 AS AVG_YEARLY FROM LINEITEM, PART WHERE P_PARTKEY = L_PARTKEY AND P_BRAND != 'Brand#23' AND P_CONTAINER = 'MED BOX' AND L_QUANTITY < (SELECT  5*MIN(L_QUANTITY) FROM LINEITEM WHERE P_PARTKEY=L_PARTKEY);
+--------------+
| AVG_YEARLY   |
+--------------+
| 10890.518571 |
+--------------+


>>>>>>>>>>>>>>>>>>>>>>>>>>>>> MAX()
EXPLAIN SELECT  SUM(L_EXTENDEDPRICE)/7.0 AS AVG_YEARLY FROM LINEITEM, PART WHERE P_PARTKEY = L_PARTKEY AND P_BRAND != 'Brand#23' AND P_CONTAINER = 'MED BOX' AND L_QUANTITY < (SELECT  0.1*MAX(L_QUANTITY) FROM LINEITEM WHERE P_PARTKEY=L_PARTKEY);
Query Plan
=============================================================
|ID|OPERATOR                 |NAME    |EST.ROWS|EST.TIME(us)|
-------------------------------------------------------------
|0 |SCALAR GROUP BY          |        |1       |2095        |
|1 |└─SUBPLAN SCAN           |VIEW1   |15      |2094        |
|2 |  └─WINDOW FUNCTION      |        |285     |2090        |
|3 |    └─PARTITION SORT     |        |285     |1869        |
|4 |      └─HASH JOIN        |        |285     |1814        |
|5 |        ├─TABLE FULL SCAN|part    |11      |23          |
|6 |        └─TABLE FULL SCAN|lineitem|11957   |779         |
=============================================================
Outputs & filters:
-------------------------------------
  0 - output([cast(T_FUN_SUM(VIEW1.lineitem.l_extendedprice), DECIMAL_INT(46, 16)) / 7.0]), filter(nil), rowset=256
      group(nil), agg_func([T_FUN_SUM(VIEW1.lineitem.l_extendedprice)])
  1 - output([VIEW1.lineitem.l_extendedprice]), filter([cast(VIEW1.lineitem.l_quantity, DECIMAL_INT(22, 1)) < VIEW1.0.1*MAX(L_QUANTITY)]), rowset=256
      access([VIEW1.0.1*MAX(L_QUANTITY)], [VIEW1.lineitem.l_quantity], [VIEW1.lineitem.l_extendedprice])
  2 - output([0.1 * cast(T_FUN_MAX(lineitem.l_quantity), DECIMAL_INT(20, 0))], [lineitem.l_quantity], [lineitem.l_extendedprice]), filter(nil), rowset=256
      win_expr(T_FUN_MAX(lineitem.l_quantity)), partition_by([lineitem.l_partkey]), order_by(nil), window_type(RANGE), upper(UNBOUNDED PRECEDING), lower(UNBOUNDED 
      FOLLOWING)
  3 - output([lineitem.l_quantity], [lineitem.l_extendedprice], [lineitem.l_partkey]), filter(nil), rowset=256
      sort_keys([HASH(lineitem.l_partkey), ASC], [lineitem.l_partkey, ASC])
  4 - output([lineitem.l_quantity], [lineitem.l_extendedprice], [lineitem.l_partkey]), filter(nil), rowset=256
      equal_conds([lineitem.l_partkey = part.p_partkey]), other_conds(nil)
  5 - output([part.p_partkey]), filter([part.p_container = 'MED BOX'], [part.p_brand != 'Brand#23']), rowset=256
      access([part.p_partkey], [part.p_brand], [part.p_container]), partitions(p0)
      is_index_back=false, is_global_index=false, filter_before_indexback[false,false], 
      range_key([part.p_partkey]), range(MIN ; MAX)always true
  6 - output([lineitem.l_partkey], [lineitem.l_quantity], [lineitem.l_extendedprice]), filter(nil), rowset=256
      access([lineitem.l_partkey], [lineitem.l_quantity], [lineitem.l_extendedprice]), partitions(p0)
      is_index_back=false, is_global_index=false, 
      range_key([lineitem.l_orderkey], [lineitem.l_linenumber]), range(MIN,MIN ; MAX,MAX)always true
SELECT  SUM(L_EXTENDEDPRICE)/7.0 AS AVG_YEARLY FROM LINEITEM, PART WHERE P_PARTKEY = L_PARTKEY AND P_BRAND != 'Brand#23' AND P_CONTAINER = 'MED BOX' AND L_QUANTITY < (SELECT  0.1*MAX(L_QUANTITY) FROM LINEITEM WHERE P_PARTKEY=L_PARTKEY);
+-------------+
| AVG_YEARLY  |
+-------------+
| 2319.651429 |
+-------------+
EXPLAIN SELECT /*+NO_REWRITE*/ SUM(L_EXTENDEDPRICE)/7.0 AS AVG_YEARLY FROM LINEITEM, PART WHERE P_PARTKEY = L_PARTKEY AND P_BRAND != 'Brand#23' AND P_CONTAINER = 'MED BOX' AND L_QUANTITY < (SELECT  0.1*MAX(L_QUANTITY) FROM LINEITEM WHERE P_PARTKEY=L_PARTKEY);
Query Plan
=====================================================================
|ID|OPERATOR                         |NAME    |EST.ROWS|EST.TIME(us)|
---------------------------------------------------------------------
|0 |SCALAR GROUP BY                  |        |1       |119597      |
|1 |└─SUBPLAN FILTER                 |        |95      |119595      |
|2 |  ├─HASH JOIN                    |        |285     |1814        |
|3 |  │ ├─TABLE FULL SCAN            |part    |11      |23          |
|4 |  │ └─TABLE FULL SCAN            |lineitem|11957   |779         |
|5 |  └─SCALAR GROUP BY              |        |1       |414         |
|6 |    └─DISTRIBUTED TABLE FULL SCAN|lineitem|29      |414         |
=====================================================================
Outputs & filters:
-------------------------------------
  0 - output([cast(T_FUN_SUM(lineitem.l_extendedprice), DECIMAL_INT(46, 16)) / 7.0]), filter(nil), rowset=256
      group(nil), agg_func([T_FUN_SUM(lineitem.l_extendedprice)])
  1 - output([lineitem.l_extendedprice]), filter([cast(lineitem.l_quantity, DECIMAL_INT(22, 1)) < subquery(1)]), rowset=256
      exec_params_([part.p_partkey(:0)]), onetime_exprs_(nil), init_plan_idxs_(nil), use_batch=false
  2 - output([part.p_partkey], [lineitem.l_quantity], [lineitem.l_extendedprice]), filter(nil), rowset=256
      equal_conds([part.p_partkey = lineitem.l_partkey]), other_conds(nil)
  3 - output([part.p_partkey]), filter([part.p_container = 'MED BOX'], [part.p_brand != 'Brand#23']), rowset=256
      access([part.p_partkey], [part.p_brand], [part.p_container]), partitions(p0)
      is_index_back=false, is_global_index=false, filter_before_indexback[false,false], 
      range_key([part.p_partkey]), range(MIN ; MAX)always true
  4 - output([lineitem.l_partkey], [lineitem.l_quantity], [lineitem.l_extendedprice]), filter(nil), rowset=256
      access([lineitem.l_partkey], [lineitem.l_quantity], [lineitem.l_extendedprice]), partitions(p0)
      is_index_back=false, is_global_index=false, 
      range_key([lineitem.l_orderkey], [lineitem.l_linenumber]), range(MIN,MIN ; MAX,MAX)always true
  5 - output([0.1 * cast(T_FUN_MAX(T_FUN_MAX(lineitem.l_quantity)), DECIMAL_INT(20, 0))]), filter(nil), rowset=256
      group(nil), agg_func([T_FUN_MAX(T_FUN_MAX(lineitem.l_quantity))])
  6 - output([T_FUN_MAX(lineitem.l_quantity)]), filter([:0 = lineitem.l_partkey]), rowset=256
      access([lineitem.l_partkey], [lineitem.l_quantity]), partitions(p0)
      is_index_back=false, is_global_index=false, filter_before_indexback[false], 
      range_key([lineitem.l_orderkey], [lineitem.l_linenumber]), range(MIN,MIN ; MAX,MAX)always true, 
      pushdown_aggregation([T_FUN_MAX(lineitem.l_quantity)])
SELECT /*+NO_REWRITE*/ SUM(L_EXTENDEDPRICE)/7.0 AS AVG_YEARLY FROM LINEITEM, PART WHERE P_PARTKEY = L_PARTKEY AND P_BRAND != 'Brand#23' AND P_CONTAINER = 'MED BOX' AND L_QUANTITY < (SELECT  0.1*MAX(L_QUANTITY) FROM LINEITEM WHERE P_PARTKEY=L_PARTKEY);
+-------------+
| AVG_YEARLY  |
+-------------+
| 2319.651429 |
+-------------+


>>>>>>>>>>>>>>>>>>>>>>>>>>>>> APPROX_COUNT_DISTINCT()
EXPLAIN SELECT SUM(L_EXTENDEDPRICE)/7.0 AS AVG_YEARLY FROM LINEITEM, PART WHERE P_PARTKEY = L_PARTKEY AND P_BRAND != 'Brand#23' AND P_CONTAINER = 'MED BOX' AND L_QUANTITY < (SELECT 0.1*APPROX_COUNT_DISTINCT(L_QUANTITY) FROM LINEITEM WHERE P_PARTKEY=L_PARTKEY);
Query Plan
=====================================================================
|ID|OPERATOR                         |NAME    |EST.ROWS|EST.TIME(us)|
---------------------------------------------------------------------
|0 |SCALAR GROUP BY                  |        |1       |119597      |
|1 |└─SUBPLAN FILTER                 |        |95      |119595      |
|2 |  ├─HASH JOIN                    |        |285     |1814        |
|3 |  │ ├─TABLE FULL SCAN            |part    |11      |23          |
|4 |  │ └─TABLE FULL SCAN            |lineitem|11957   |779         |
|5 |  └─SCALAR GROUP BY              |        |1       |414         |
|6 |    └─DISTRIBUTED TABLE FULL SCAN|lineitem|29      |414         |
=====================================================================
Outputs & filters:
-------------------------------------
  0 - output([cast(T_FUN_SUM(lineitem.l_extendedprice), DECIMAL_INT(46, 16)) / 7.0]), filter(nil), rowset=256
      group(nil), agg_func([T_FUN_SUM(lineitem.l_extendedprice)])
  1 - output([lineitem.l_extendedprice]), filter([cast(lineitem.l_quantity, DECIMAL_INT(22, 1)) < subquery(1)]), rowset=256
      exec_params_([part.p_partkey(:0)]), onetime_exprs_(nil), init_plan_idxs_(nil), use_batch=false
  2 - output([part.p_partkey], [lineitem.l_quantity], [lineitem.l_extendedprice]), filter(nil), rowset=256
      equal_conds([part.p_partkey = lineitem.l_partkey]), other_conds(nil)
  3 - output([part.p_partkey]), filter([part.p_container = 'MED BOX'], [part.p_brand != 'Brand#23']), rowset=256
      access([part.p_partkey], [part.p_brand], [part.p_container]), partitions(p0)
      is_index_back=false, is_global_index=false, filter_before_indexback[false,false], 
      range_key([part.p_partkey]), range(MIN ; MAX)always true
  4 - output([lineitem.l_partkey], [lineitem.l_quantity], [lineitem.l_extendedprice]), filter(nil), rowset=256
      access([lineitem.l_partkey], [lineitem.l_quantity], [lineitem.l_extendedprice]), partitions(p0)
      is_index_back=false, is_global_index=false, 
      range_key([lineitem.l_orderkey], [lineitem.l_linenumber]), range(MIN,MIN ; MAX,MAX)always true
  5 - output([0.1 * cast(ESTIMATE_NDV(T_FUN_APPROX_COUNT_DISTINCT_SYNOPSIS_MERGE(T_FUN_APPROX_COUNT_DISTINCT_SYNOPSIS(lineitem.l_quantity))), DECIMAL_INT(20,
       0))]), filter(nil), rowset=256
      group(nil), agg_func([T_FUN_APPROX_COUNT_DISTINCT_SYNOPSIS_MERGE(T_FUN_APPROX_COUNT_DISTINCT_SYNOPSIS(lineitem.l_quantity))])
  6 - output([T_FUN_APPROX_COUNT_DISTINCT_SYNOPSIS(lineitem.l_quantity)]), filter([:0 = lineitem.l_partkey]), rowset=256
      access([lineitem.l_partkey], [lineitem.l_quantity]), partitions(p0)
      is_index_back=false, is_global_index=false, filter_before_indexback[false], 
      range_key([lineitem.l_orderkey], [lineitem.l_linenumber]), range(MIN,MIN ; MAX,MAX)always true, 
      pushdown_aggregation([T_FUN_APPROX_COUNT_DISTINCT_SYNOPSIS(lineitem.l_quantity)])
SELECT SUM(L_EXTENDEDPRICE)/7.0 AS AVG_YEARLY FROM LINEITEM, PART WHERE P_PARTKEY = L_PARTKEY AND P_BRAND != 'Brand#23' AND P_CONTAINER = 'MED BOX' AND L_QUANTITY < (SELECT 0.1*APPROX_COUNT_DISTINCT(L_QUANTITY) FROM LINEITEM WHERE P_PARTKEY=L_PARTKEY);
+-------------+
| AVG_YEARLY  |
+-------------+
| 1227.334286 |
+-------------+
EXPLAIN SELECT /*+NO_REWRITE*/ SUM(L_EXTENDEDPRICE)/7.0 AS AVG_YEARLY FROM LINEITEM, PART WHERE P_PARTKEY = L_PARTKEY AND P_BRAND != 'Brand#23' AND P_CONTAINER = 'MED BOX' AND L_QUANTITY < (SELECT 0.1*APPROX_COUNT_DISTINCT(L_QUANTITY) FROM LINEITEM WHERE P_PARTKEY=L_PARTKEY);
Query Plan
=====================================================================
|ID|OPERATOR                         |NAME    |EST.ROWS|EST.TIME(us)|
---------------------------------------------------------------------
|0 |SCALAR GROUP BY                  |        |1       |119597      |
|1 |└─SUBPLAN FILTER                 |        |95      |119595      |
|2 |  ├─HASH JOIN                    |        |285     |1814        |
|3 |  │ ├─TABLE FULL SCAN            |part    |11      |23          |
|4 |  │ └─TABLE FULL SCAN            |lineitem|11957   |779         |
|5 |  └─SCALAR GROUP BY              |        |1       |414         |
|6 |    └─DISTRIBUTED TABLE FULL SCAN|lineitem|29      |414         |
=====================================================================
Outputs & filters:
-------------------------------------
  0 - output([cast(T_FUN_SUM(lineitem.l_extendedprice), DECIMAL_INT(46, 16)) / 7.0]), filter(nil), rowset=256
      group(nil), agg_func([T_FUN_SUM(lineitem.l_extendedprice)])
  1 - output([lineitem.l_extendedprice]), filter([cast(lineitem.l_quantity, DECIMAL_INT(22, 1)) < subquery(1)]), rowset=256
      exec_params_([part.p_partkey(:0)]), onetime_exprs_(nil), init_plan_idxs_(nil), use_batch=false
  2 - output([part.p_partkey], [lineitem.l_quantity], [lineitem.l_extendedprice]), filter(nil), rowset=256
      equal_conds([part.p_partkey = lineitem.l_partkey]), other_conds(nil)
  3 - output([part.p_partkey]), filter([part.p_container = 'MED BOX'], [part.p_brand != 'Brand#23']), rowset=256
      access([part.p_partkey], [part.p_brand], [part.p_container]), partitions(p0)
      is_index_back=false, is_global_index=false, filter_before_indexback[false,false], 
      range_key([part.p_partkey]), range(MIN ; MAX)always true
  4 - output([lineitem.l_partkey], [lineitem.l_quantity], [lineitem.l_extendedprice]), filter(nil), rowset=256
      access([lineitem.l_partkey], [lineitem.l_quantity], [lineitem.l_extendedprice]), partitions(p0)
      is_index_back=false, is_global_index=false, 
      range_key([lineitem.l_orderkey], [lineitem.l_linenumber]), range(MIN,MIN ; MAX,MAX)always true
  5 - output([0.1 * cast(ESTIMATE_NDV(T_FUN_APPROX_COUNT_DISTINCT_SYNOPSIS_MERGE(T_FUN_APPROX_COUNT_DISTINCT_SYNOPSIS(lineitem.l_quantity))), DECIMAL_INT(20,
       0))]), filter(nil), rowset=256
      group(nil), agg_func([T_FUN_APPROX_COUNT_DISTINCT_SYNOPSIS_MERGE(T_FUN_APPROX_COUNT_DISTINCT_SYNOPSIS(lineitem.l_quantity))])
  6 - output([T_FUN_APPROX_COUNT_DISTINCT_SYNOPSIS(lineitem.l_quantity)]), filter([:0 = lineitem.l_partkey]), rowset=256
      access([lineitem.l_partkey], [lineitem.l_quantity]), partitions(p0)
      is_index_back=false, is_global_index=false, filter_before_indexback[false], 
      range_key([lineitem.l_orderkey], [lineitem.l_linenumber]), range(MIN,MIN ; MAX,MAX)always true, 
      pushdown_aggregation([T_FUN_APPROX_COUNT_DISTINCT_SYNOPSIS(lineitem.l_quantity)])
SELECT /*+NO_REWRITE*/ SUM(L_EXTENDEDPRICE)/7.0 AS AVG_YEARLY FROM LINEITEM, PART WHERE P_PARTKEY = L_PARTKEY AND P_BRAND != 'Brand#23' AND P_CONTAINER = 'MED BOX' AND L_QUANTITY < (SELECT 0.1*APPROX_COUNT_DISTINCT(L_QUANTITY) FROM LINEITEM WHERE P_PARTKEY=L_PARTKEY);
+-------------+
| AVG_YEARLY  |
+-------------+
| 1227.334286 |
+-------------+


>>>>>>>>>>>>>>>>>>>>>>>>>>>>> APPROX_COUNT_DISTINCT_SYNOPSIS()
EXPLAIN SELECT SUM(L_EXTENDEDPRICE)/7.0 AS AVG_YEARLY FROM LINEITEM, PART WHERE P_PARTKEY = L_PARTKEY AND P_BRAND != 'Brand#23' AND P_CONTAINER = 'MED BOX' AND L_QUANTITY < (SELECT APPROX_COUNT_DISTINCT_SYNOPSIS(L_QUANTITY) - 10  FROM LINEITEM WHERE P_PARTKEY=L_PARTKEY);
Query Plan
=====================================================================
|ID|OPERATOR                         |NAME    |EST.ROWS|EST.TIME(us)|
---------------------------------------------------------------------
|0 |SCALAR GROUP BY                  |        |1       |119597      |
|1 |└─SUBPLAN FILTER                 |        |95      |119595      |
|2 |  ├─HASH JOIN                    |        |285     |1814        |
|3 |  │ ├─TABLE FULL SCAN            |part    |11      |23          |
|4 |  │ └─TABLE FULL SCAN            |lineitem|11957   |779         |
|5 |  └─SCALAR GROUP BY              |        |1       |414         |
|6 |    └─DISTRIBUTED TABLE FULL SCAN|lineitem|29      |414         |
=====================================================================
Outputs & filters:
-------------------------------------
  0 - output([cast(T_FUN_SUM(lineitem.l_extendedprice), DECIMAL_INT(46, 16)) / 7.0]), filter(nil), rowset=256
      group(nil), agg_func([T_FUN_SUM(lineitem.l_extendedprice)])
  1 - output([lineitem.l_extendedprice]), filter([cast(lineitem.l_quantity, DOUBLE(-1, -1)) < subquery(1)]), rowset=256
      exec_params_([part.p_partkey(:0)]), onetime_exprs_(nil), init_plan_idxs_(nil), use_batch=false
  2 - output([part.p_partkey], [lineitem.l_quantity], [lineitem.l_extendedprice]), filter(nil), rowset=256
      equal_conds([part.p_partkey = lineitem.l_partkey]), other_conds(nil)
  3 - output([part.p_partkey]), filter([part.p_container = 'MED BOX'], [part.p_brand != 'Brand#23']), rowset=256
      access([part.p_partkey], [part.p_brand], [part.p_container]), partitions(p0)
      is_index_back=false, is_global_index=false, filter_before_indexback[false,false], 
      range_key([part.p_partkey]), range(MIN ; MAX)always true
  4 - output([lineitem.l_partkey], [lineitem.l_quantity], [lineitem.l_extendedprice]), filter(nil), rowset=256
      access([lineitem.l_partkey], [lineitem.l_quantity], [lineitem.l_extendedprice]), partitions(p0)
      is_index_back=false, is_global_index=false, 
      range_key([lineitem.l_orderkey], [lineitem.l_linenumber]), range(MIN,MIN ; MAX,MAX)always true
  5 - output([cast(T_FUN_APPROX_COUNT_DISTINCT_SYNOPSIS_MERGE(T_FUN_APPROX_COUNT_DISTINCT_SYNOPSIS(lineitem.l_quantity)), DOUBLE(-1, -1)) + cast(-10, DOUBLE(-1,
       -1))]), filter(nil), rowset=256
      group(nil), agg_func([T_FUN_APPROX_COUNT_DISTINCT_SYNOPSIS_MERGE(T_FUN_APPROX_COUNT_DISTINCT_SYNOPSIS(lineitem.l_quantity))])
  6 - output([T_FUN_APPROX_COUNT_DISTINCT_SYNOPSIS(lineitem.l_quantity)]), filter([:0 = lineitem.l_partkey]), rowset=256
      access([lineitem.l_partkey], [lineitem.l_quantity]), partitions(p0)
      is_index_back=false, is_global_index=false, filter_before_indexback[false], 
      range_key([lineitem.l_orderkey], [lineitem.l_linenumber]), range(MIN,MIN ; MAX,MAX)always true, 
      pushdown_aggregation([T_FUN_APPROX_COUNT_DISTINCT_SYNOPSIS(lineitem.l_quantity)])
SELECT SUM(L_EXTENDEDPRICE)/7.0 AS AVG_YEARLY FROM LINEITEM, PART WHERE P_PARTKEY = L_PARTKEY AND P_BRAND != 'Brand#23' AND P_CONTAINER = 'MED BOX' AND L_QUANTITY < (SELECT APPROX_COUNT_DISTINCT_SYNOPSIS(L_QUANTITY) - 10  FROM LINEITEM WHERE P_PARTKEY=L_PARTKEY);
+------------+
| AVG_YEARLY |
+------------+
|       NULL |
+------------+
Warnings:
Warning	1292	Truncated incorrect DOUBLE value: ''
Warning	1292	Truncated incorrect DOUBLE value: ''
EXPLAIN SELECT /*+NO_REWRITE*/ SUM(L_EXTENDEDPRICE)/7.0 AS AVG_YEARLY FROM LINEITEM, PART WHERE P_PARTKEY = L_PARTKEY AND P_BRAND != 'Brand#23' AND P_CONTAINER = 'MED BOX' AND L_QUANTITY < (SELECT APPROX_COUNT_DISTINCT_SYNOPSIS(L_QUANTITY) - 10  FROM LINEITEM WHERE P_PARTKEY=L_PARTKEY);
Query Plan
=====================================================================
|ID|OPERATOR                         |NAME    |EST.ROWS|EST.TIME(us)|
---------------------------------------------------------------------
|0 |SCALAR GROUP BY                  |        |1       |119597      |
|1 |└─SUBPLAN FILTER                 |        |95      |119595      |
|2 |  ├─HASH JOIN                    |        |285     |1814        |
|3 |  │ ├─TABLE FULL SCAN            |part    |11      |23          |
|4 |  │ └─TABLE FULL SCAN            |lineitem|11957   |779         |
|5 |  └─SCALAR GROUP BY              |        |1       |414         |
|6 |    └─DISTRIBUTED TABLE FULL SCAN|lineitem|29      |414         |
=====================================================================
Outputs & filters:
-------------------------------------
  0 - output([cast(T_FUN_SUM(lineitem.l_extendedprice), DECIMAL_INT(46, 16)) / 7.0]), filter(nil), rowset=256
      group(nil), agg_func([T_FUN_SUM(lineitem.l_extendedprice)])
  1 - output([lineitem.l_extendedprice]), filter([cast(lineitem.l_quantity, DOUBLE(-1, -1)) < subquery(1)]), rowset=256
      exec_params_([part.p_partkey(:0)]), onetime_exprs_(nil), init_plan_idxs_(nil), use_batch=false
  2 - output([part.p_partkey], [lineitem.l_quantity], [lineitem.l_extendedprice]), filter(nil), rowset=256
      equal_conds([part.p_partkey = lineitem.l_partkey]), other_conds(nil)
  3 - output([part.p_partkey]), filter([part.p_container = 'MED BOX'], [part.p_brand != 'Brand#23']), rowset=256
      access([part.p_partkey], [part.p_brand], [part.p_container]), partitions(p0)
      is_index_back=false, is_global_index=false, filter_before_indexback[false,false], 
      range_key([part.p_partkey]), range(MIN ; MAX)always true
  4 - output([lineitem.l_partkey], [lineitem.l_quantity], [lineitem.l_extendedprice]), filter(nil), rowset=256
      access([lineitem.l_partkey], [lineitem.l_quantity], [lineitem.l_extendedprice]), partitions(p0)
      is_index_back=false, is_global_index=false, 
      range_key([lineitem.l_orderkey], [lineitem.l_linenumber]), range(MIN,MIN ; MAX,MAX)always true
  5 - output([cast(T_FUN_APPROX_COUNT_DISTINCT_SYNOPSIS_MERGE(T_FUN_APPROX_COUNT_DISTINCT_SYNOPSIS(lineitem.l_quantity)), DOUBLE(-1, -1)) + cast(-10, DOUBLE(-1,
       -1))]), filter(nil), rowset=256
      group(nil), agg_func([T_FUN_APPROX_COUNT_DISTINCT_SYNOPSIS_MERGE(T_FUN_APPROX_COUNT_DISTINCT_SYNOPSIS(lineitem.l_quantity))])
  6 - output([T_FUN_APPROX_COUNT_DISTINCT_SYNOPSIS(lineitem.l_quantity)]), filter([:0 = lineitem.l_partkey]), rowset=256
      access([lineitem.l_partkey], [lineitem.l_quantity]), partitions(p0)
      is_index_back=false, is_global_index=false, filter_before_indexback[false], 
      range_key([lineitem.l_orderkey], [lineitem.l_linenumber]), range(MIN,MIN ; MAX,MAX)always true, 
      pushdown_aggregation([T_FUN_APPROX_COUNT_DISTINCT_SYNOPSIS(lineitem.l_quantity)])
SELECT /*+NO_REWRITE*/ SUM(L_EXTENDEDPRICE)/7.0 AS AVG_YEARLY FROM LINEITEM, PART WHERE P_PARTKEY = L_PARTKEY AND P_BRAND != 'Brand#23' AND P_CONTAINER = 'MED BOX' AND L_QUANTITY < (SELECT APPROX_COUNT_DISTINCT_SYNOPSIS(L_QUANTITY) - 10  FROM LINEITEM WHERE P_PARTKEY=L_PARTKEY);
+------------+
| AVG_YEARLY |
+------------+
|       NULL |
+------------+
Warnings:
Warning	1292	Truncated incorrect DOUBLE value: ''
Warning	1292	Truncated incorrect DOUBLE value: ''

********************** end 不同AGG函数可改写 *****

********************* 不可改写测试 *******

>>>>>>>>条件2.1 Operator不为指定类型 不可改写
EXPLAIN SELECT SUM(L_EXTENDEDPRICE)/7.0 AS AVG_YEARLY FROM LINEITEM, PART WHERE P_PARTKEY = L_PARTKEY AND P_BRAND != 'Brand#23' AND P_CONTAINER = 'MED BOX' AND L_QUANTITY in (SELECT 0.2*AVG(L_QUANTITY) FROM LINEITEM WHERE L_PARTKEY = P_PARTKEY);
Query Plan
=============================================================
|ID|OPERATOR                 |NAME    |EST.ROWS|EST.TIME(us)|
-------------------------------------------------------------
|0 |SCALAR GROUP BY          |        |1       |2280        |
|1 |└─SUBPLAN SCAN           |VIEW1   |51      |2279        |
|2 |  └─WINDOW FUNCTION      |        |285     |2274        |
|3 |    └─PARTITION SORT     |        |285     |1869        |
|4 |      └─HASH JOIN        |        |285     |1814        |
|5 |        ├─TABLE FULL SCAN|part    |11      |23          |
|6 |        └─TABLE FULL SCAN|lineitem|11957   |779         |
=============================================================
Outputs & filters:
-------------------------------------
  0 - output([cast(T_FUN_SUM(VIEW1.lineitem.l_extendedprice), DECIMAL_INT(46, 16)) / 7.0]), filter(nil), rowset=256
      group(nil), agg_func([T_FUN_SUM(VIEW1.lineitem.l_extendedprice)])
  1 - output([VIEW1.lineitem.l_extendedprice]), filter([cast(VIEW1.lineitem.l_quantity, DECIMAL(20, 0)) = VIEW1.0.2*AVG(L_QUANTITY)]), rowset=256
      access([VIEW1.0.2*AVG(L_QUANTITY)], [VIEW1.lineitem.l_quantity], [VIEW1.lineitem.l_extendedprice])
  2 - output([cast(0.2, DECIMAL(2, 1)) * cast(cast(T_FUN_SUM(lineitem.l_quantity), DECIMAL_INT(74, 32)) / cast(T_FUN_COUNT(lineitem.l_quantity), DECIMAL_INT(20,
       0)), DECIMAL(24, 4))], [lineitem.l_quantity], [lineitem.l_extendedprice]), filter(nil), rowset=256
      win_expr(T_FUN_SUM(lineitem.l_quantity)), partition_by([lineitem.l_partkey]), order_by(nil), window_type(RANGE), upper(UNBOUNDED PRECEDING), lower(UNBOUNDED 
      FOLLOWING)
      win_expr(T_FUN_COUNT(lineitem.l_quantity)), partition_by([lineitem.l_partkey]), order_by(nil), window_type(RANGE), upper(UNBOUNDED PRECEDING), lower(UNBOUNDED 
      FOLLOWING)
  3 - output([lineitem.l_quantity], [lineitem.l_partkey], [lineitem.l_extendedprice]), filter(nil), rowset=256
      sort_keys([HASH(lineitem.l_partkey), ASC], [lineitem.l_partkey, ASC])
  4 - output([lineitem.l_quantity], [lineitem.l_partkey], [lineitem.l_extendedprice]), filter(nil), rowset=256
      equal_conds([lineitem.l_partkey = part.p_partkey]), other_conds(nil)
  5 - output([part.p_partkey]), filter([part.p_container = 'MED BOX'], [part.p_brand != 'Brand#23']), rowset=256
      access([part.p_partkey], [part.p_brand], [part.p_container]), partitions(p0)
      is_index_back=false, is_global_index=false, filter_before_indexback[false,false], 
      range_key([part.p_partkey]), range(MIN ; MAX)always true
  6 - output([lineitem.l_partkey], [lineitem.l_quantity], [lineitem.l_extendedprice]), filter(nil), rowset=256
      access([lineitem.l_partkey], [lineitem.l_quantity], [lineitem.l_extendedprice]), partitions(p0)
      is_index_back=false, is_global_index=false, 
      range_key([lineitem.l_orderkey], [lineitem.l_linenumber]), range(MIN,MIN ; MAX,MAX)always true
SELECT SUM(L_EXTENDEDPRICE)/7.0 AS AVG_YEARLY FROM LINEITEM, PART WHERE P_PARTKEY = L_PARTKEY AND P_BRAND != 'Brand#23' AND P_CONTAINER = 'MED BOX' AND L_QUANTITY in (SELECT 0.2*AVG(L_QUANTITY) FROM LINEITEM WHERE L_PARTKEY = P_PARTKEY);
+------------+
| AVG_YEARLY |
+------------+
|       NULL |
+------------+


>>>>>>>>条件2 Operator左边不为column
EXPLAIN SELECT SUM(L_EXTENDEDPRICE)/7.0 AS AVG_YEARLY FROM LINEITEM, PART WHERE P_PARTKEY = L_PARTKEY AND P_BRAND != 'Brand#23' AND P_CONTAINER = 'MED BOX' AND 1 < (SELECT 0.2*AVG(L_QUANTITY) FROM LINEITEM WHERE L_PARTKEY = P_PARTKEY);
Query Plan
=============================================================
|ID|OPERATOR                 |NAME    |EST.ROWS|EST.TIME(us)|
-------------------------------------------------------------
|0 |SCALAR GROUP BY          |        |1       |2280        |
|1 |└─SUBPLAN SCAN           |VIEW1   |29      |2279        |
|2 |  └─WINDOW FUNCTION      |        |285     |2274        |
|3 |    └─PARTITION SORT     |        |285     |1869        |
|4 |      └─HASH JOIN        |        |285     |1814        |
|5 |        ├─TABLE FULL SCAN|part    |11      |23          |
|6 |        └─TABLE FULL SCAN|lineitem|11957   |779         |
=============================================================
Outputs & filters:
-------------------------------------
  0 - output([cast(T_FUN_SUM(VIEW1.lineitem.l_extendedprice), DECIMAL_INT(46, 16)) / 7.0]), filter(nil), rowset=256
      group(nil), agg_func([T_FUN_SUM(VIEW1.lineitem.l_extendedprice)])
  1 - output([VIEW1.lineitem.l_extendedprice]), filter([cast(1, DECIMAL(20, 0)) < VIEW1.0.2*AVG(L_QUANTITY)]), rowset=256
      access([VIEW1.0.2*AVG(L_QUANTITY)], [VIEW1.lineitem.l_extendedprice])
  2 - output([cast(0.2, DECIMAL(2, 1)) * cast(cast(T_FUN_SUM(lineitem.l_quantity), DECIMAL_INT(74, 32)) / cast(T_FUN_COUNT(lineitem.l_quantity), DECIMAL_INT(20,
       0)), DECIMAL(24, 4))], [lineitem.l_extendedprice]), filter(nil), rowset=256
      win_expr(T_FUN_SUM(lineitem.l_quantity)), partition_by([lineitem.l_partkey]), order_by(nil), window_type(RANGE), upper(UNBOUNDED PRECEDING), lower(UNBOUNDED 
      FOLLOWING)
      win_expr(T_FUN_COUNT(lineitem.l_quantity)), partition_by([lineitem.l_partkey]), order_by(nil), window_type(RANGE), upper(UNBOUNDED PRECEDING), lower(UNBOUNDED 
      FOLLOWING)
  3 - output([lineitem.l_quantity], [lineitem.l_partkey], [lineitem.l_extendedprice]), filter(nil), rowset=256
      sort_keys([HASH(lineitem.l_partkey), ASC], [lineitem.l_partkey, ASC])
  4 - output([lineitem.l_quantity], [lineitem.l_partkey], [lineitem.l_extendedprice]), filter(nil), rowset=256
      equal_conds([lineitem.l_partkey = part.p_partkey]), other_conds(nil)
  5 - output([part.p_partkey]), filter([part.p_container = 'MED BOX'], [part.p_brand != 'Brand#23']), rowset=256
      access([part.p_partkey], [part.p_brand], [part.p_container]), partitions(p0)
      is_index_back=false, is_global_index=false, filter_before_indexback[false,false], 
      range_key([part.p_partkey]), range(MIN ; MAX)always true
  6 - output([lineitem.l_partkey], [lineitem.l_quantity], [lineitem.l_extendedprice]), filter(nil), rowset=256
      access([lineitem.l_partkey], [lineitem.l_quantity], [lineitem.l_extendedprice]), partitions(p0)
      is_index_back=false, is_global_index=false, 
      range_key([lineitem.l_orderkey], [lineitem.l_linenumber]), range(MIN,MIN ; MAX,MAX)always true
SELECT SUM(L_EXTENDEDPRICE)/7.0 AS AVG_YEARLY FROM LINEITEM, PART WHERE P_PARTKEY = L_PARTKEY AND P_BRAND != 'Brand#23' AND P_CONTAINER = 'MED BOX' AND 1 < (SELECT 0.2*AVG(L_QUANTITY) FROM LINEITEM WHERE L_PARTKEY = P_PARTKEY);
+---------------+
| AVG_YEARLY    |
+---------------+
| 254701.234286 |
+---------------+


>>>>>>>>条件3.1 subquery含limit，不可改写
EXPLAIN SELECT SUM(L_EXTENDEDPRICE)/7.0 AS AVG_YEARLY FROM LINEITEM, PART WHERE P_PARTKEY = L_PARTKEY AND P_BRAND != 'Brand#23' AND P_CONTAINER = 'MED BOX' AND L_QUANTITY < (SELECT 0.2*AVG(L_QUANTITY) FROM LINEITEM WHERE L_PARTKEY = P_PARTKEY limit 10);
Query Plan
=============================================================
|ID|OPERATOR                 |NAME    |EST.ROWS|EST.TIME(us)|
-------------------------------------------------------------
|0 |SCALAR GROUP BY          |        |1       |2279        |
|1 |└─SUBPLAN SCAN           |VIEW1   |15      |2279        |
|2 |  └─WINDOW FUNCTION      |        |285     |2274        |
|3 |    └─PARTITION SORT     |        |285     |1869        |
|4 |      └─HASH JOIN        |        |285     |1814        |
|5 |        ├─TABLE FULL SCAN|part    |11      |23          |
|6 |        └─TABLE FULL SCAN|lineitem|11957   |779         |
=============================================================
Outputs & filters:
-------------------------------------
  0 - output([cast(T_FUN_SUM(VIEW1.lineitem.l_extendedprice), DECIMAL_INT(46, 16)) / 7.0]), filter(nil), rowset=256
      group(nil), agg_func([T_FUN_SUM(VIEW1.lineitem.l_extendedprice)])
  1 - output([VIEW1.lineitem.l_extendedprice]), filter([cast(VIEW1.lineitem.l_quantity, DECIMAL(20, 0)) < VIEW1.0.2*AVG(L_QUANTITY)]), rowset=256
      access([VIEW1.0.2*AVG(L_QUANTITY)], [VIEW1.lineitem.l_quantity], [VIEW1.lineitem.l_extendedprice])
  2 - output([cast(0.2, DECIMAL(2, 1)) * cast(cast(T_FUN_SUM(lineitem.l_quantity), DECIMAL_INT(74, 32)) / cast(T_FUN_COUNT(lineitem.l_quantity), DECIMAL_INT(20,
       0)), DECIMAL(24, 4))], [lineitem.l_quantity], [lineitem.l_extendedprice]), filter(nil), rowset=256
      win_expr(T_FUN_SUM(lineitem.l_quantity)), partition_by([lineitem.l_partkey]), order_by(nil), window_type(RANGE), upper(UNBOUNDED PRECEDING), lower(UNBOUNDED 
      FOLLOWING)
      win_expr(T_FUN_COUNT(lineitem.l_quantity)), partition_by([lineitem.l_partkey]), order_by(nil), window_type(RANGE), upper(UNBOUNDED PRECEDING), lower(UNBOUNDED 
      FOLLOWING)
  3 - output([lineitem.l_quantity], [lineitem.l_partkey], [lineitem.l_extendedprice]), filter(nil), rowset=256
      sort_keys([HASH(lineitem.l_partkey), ASC], [lineitem.l_partkey, ASC])
  4 - output([lineitem.l_quantity], [lineitem.l_partkey], [lineitem.l_extendedprice]), filter(nil), rowset=256
      equal_conds([lineitem.l_partkey = part.p_partkey]), other_conds(nil)
  5 - output([part.p_partkey]), filter([part.p_container = 'MED BOX'], [part.p_brand != 'Brand#23']), rowset=256
      access([part.p_partkey], [part.p_brand], [part.p_container]), partitions(p0)
      is_index_back=false, is_global_index=false, filter_before_indexback[false,false], 
      range_key([part.p_partkey]), range(MIN ; MAX)always true
  6 - output([lineitem.l_partkey], [lineitem.l_quantity], [lineitem.l_extendedprice]), filter(nil), rowset=256
      access([lineitem.l_partkey], [lineitem.l_quantity], [lineitem.l_extendedprice]), partitions(p0)
      is_index_back=false, is_global_index=false, 
      range_key([lineitem.l_orderkey], [lineitem.l_linenumber]), range(MIN,MIN ; MAX,MAX)always true
SELECT SUM(L_EXTENDEDPRICE)/7.0 AS AVG_YEARLY FROM LINEITEM, PART WHERE P_PARTKEY = L_PARTKEY AND P_BRAND != 'Brand#23' AND P_CONTAINER = 'MED BOX' AND L_QUANTITY < (SELECT 0.2*AVG(L_QUANTITY) FROM LINEITEM WHERE L_PARTKEY = P_PARTKEY limit 10);
+-------------+
| AVG_YEARLY  |
+-------------+
| 4668.630000 |
+-------------+


>>>>>>>>条件3.1 subquery含group by，不可改写
EXPLAIN SELECT SUM(L_EXTENDEDPRICE)/7.0 AS AVG_YEARLY FROM LINEITEM, PART WHERE P_PARTKEY = L_PARTKEY AND P_BRAND != 'Brand#23' AND P_CONTAINER = 'MED BOX' AND L_QUANTITY < (SELECT 0.2*AVG(L_QUANTITY) FROM LINEITEM WHERE L_PARTKEY = P_PARTKEY group by P_PARTKEY);
Query Plan
=============================================================
|ID|OPERATOR                 |NAME    |EST.ROWS|EST.TIME(us)|
-------------------------------------------------------------
|0 |SCALAR GROUP BY          |        |1       |2279        |
|1 |└─SUBPLAN SCAN           |VIEW1   |15      |2279        |
|2 |  └─WINDOW FUNCTION      |        |285     |2274        |
|3 |    └─PARTITION SORT     |        |285     |1869        |
|4 |      └─HASH JOIN        |        |285     |1814        |
|5 |        ├─TABLE FULL SCAN|part    |11      |23          |
|6 |        └─TABLE FULL SCAN|lineitem|11957   |779         |
=============================================================
Outputs & filters:
-------------------------------------
  0 - output([cast(T_FUN_SUM(VIEW1.lineitem.l_extendedprice), DECIMAL_INT(46, 16)) / 7.0]), filter(nil), rowset=256
      group(nil), agg_func([T_FUN_SUM(VIEW1.lineitem.l_extendedprice)])
  1 - output([VIEW1.lineitem.l_extendedprice]), filter([cast(VIEW1.lineitem.l_quantity, DECIMAL(20, 0)) < VIEW1.0.2*AVG(L_QUANTITY)]), rowset=256
      access([VIEW1.0.2*AVG(L_QUANTITY)], [VIEW1.lineitem.l_quantity], [VIEW1.lineitem.l_extendedprice])
  2 - output([cast(0.2, DECIMAL(2, 1)) * cast(cast(T_FUN_SUM(lineitem.l_quantity), DECIMAL_INT(74, 32)) / cast(T_FUN_COUNT(lineitem.l_quantity), DECIMAL_INT(20,
       0)), DECIMAL(24, 4))], [lineitem.l_quantity], [lineitem.l_extendedprice]), filter(nil), rowset=256
      win_expr(T_FUN_SUM(lineitem.l_quantity)), partition_by([lineitem.l_partkey]), order_by(nil), window_type(RANGE), upper(UNBOUNDED PRECEDING), lower(UNBOUNDED 
      FOLLOWING)
      win_expr(T_FUN_COUNT(lineitem.l_quantity)), partition_by([lineitem.l_partkey]), order_by(nil), window_type(RANGE), upper(UNBOUNDED PRECEDING), lower(UNBOUNDED 
      FOLLOWING)
  3 - output([lineitem.l_quantity], [lineitem.l_partkey], [lineitem.l_extendedprice]), filter(nil), rowset=256
      sort_keys([HASH(lineitem.l_partkey), ASC], [lineitem.l_partkey, ASC])
  4 - output([lineitem.l_quantity], [lineitem.l_partkey], [lineitem.l_extendedprice]), filter(nil), rowset=256
      equal_conds([lineitem.l_partkey = part.p_partkey]), other_conds(nil)
  5 - output([part.p_partkey]), filter([part.p_container = 'MED BOX'], [part.p_brand != 'Brand#23']), rowset=256
      access([part.p_partkey], [part.p_brand], [part.p_container]), partitions(p0)
      is_index_back=false, is_global_index=false, filter_before_indexback[false,false], 
      range_key([part.p_partkey]), range(MIN ; MAX)always true
  6 - output([lineitem.l_partkey], [lineitem.l_quantity], [lineitem.l_extendedprice]), filter(nil), rowset=256
      access([lineitem.l_partkey], [lineitem.l_quantity], [lineitem.l_extendedprice]), partitions(p0)
      is_index_back=false, is_global_index=false, 
      range_key([lineitem.l_orderkey], [lineitem.l_linenumber]), range(MIN,MIN ; MAX,MAX)always true
SELECT SUM(L_EXTENDEDPRICE)/7.0 AS AVG_YEARLY FROM LINEITEM, PART WHERE P_PARTKEY = L_PARTKEY AND P_BRAND != 'Brand#23' AND P_CONTAINER = 'MED BOX' AND L_QUANTITY < (SELECT 0.2*AVG(L_QUANTITY) FROM LINEITEM WHERE L_PARTKEY = P_PARTKEY group by P_PARTKEY);
+-------------+
| AVG_YEARLY  |
+-------------+
| 4668.630000 |
+-------------+


>>>>>>>>条件3.1 subquery含having，不可改写
EXPLAIN SELECT SUM(L_EXTENDEDPRICE)/7.0 AS AVG_YEARLY FROM LINEITEM, PART WHERE P_PARTKEY = L_PARTKEY AND P_BRAND != 'Brand#23' AND P_CONTAINER = 'MED BOX' AND L_QUANTITY < (SELECT 0.2*AVG(L_QUANTITY) as l_avg FROM LINEITEM WHERE L_PARTKEY = P_PARTKEY having l_avg > 1);
Query Plan
=====================================================================
|ID|OPERATOR                         |NAME    |EST.ROWS|EST.TIME(us)|
---------------------------------------------------------------------
|0 |SCALAR GROUP BY                  |        |1       |119721      |
|1 |└─SUBPLAN FILTER                 |        |95      |119720      |
|2 |  ├─HASH JOIN                    |        |285     |1814        |
|3 |  │ ├─TABLE FULL SCAN            |part    |11      |23          |
|4 |  │ └─TABLE FULL SCAN            |lineitem|11957   |779         |
|5 |  └─SCALAR GROUP BY              |        |1       |415         |
|6 |    └─DISTRIBUTED TABLE FULL SCAN|lineitem|29      |414         |
=====================================================================
Outputs & filters:
-------------------------------------
  0 - output([cast(T_FUN_SUM(lineitem.l_extendedprice), DECIMAL_INT(46, 16)) / 7.0]), filter(nil), rowset=256
      group(nil), agg_func([T_FUN_SUM(lineitem.l_extendedprice)])
  1 - output([lineitem.l_extendedprice]), filter([cast(lineitem.l_quantity, DECIMAL(20, 0)) < subquery(1)]), rowset=256
      exec_params_([part.p_partkey(:0)]), onetime_exprs_(nil), init_plan_idxs_(nil), use_batch=false
  2 - output([part.p_partkey], [lineitem.l_quantity], [lineitem.l_extendedprice]), filter(nil), rowset=256
      equal_conds([part.p_partkey = lineitem.l_partkey]), other_conds(nil)
  3 - output([part.p_partkey]), filter([part.p_container = 'MED BOX'], [part.p_brand != 'Brand#23']), rowset=256
      access([part.p_partkey], [part.p_brand], [part.p_container]), partitions(p0)
      is_index_back=false, is_global_index=false, filter_before_indexback[false,false], 
      range_key([part.p_partkey]), range(MIN ; MAX)always true
  4 - output([lineitem.l_partkey], [lineitem.l_quantity], [lineitem.l_extendedprice]), filter(nil), rowset=256
      access([lineitem.l_partkey], [lineitem.l_quantity], [lineitem.l_extendedprice]), partitions(p0)
      is_index_back=false, is_global_index=false, 
      range_key([lineitem.l_orderkey], [lineitem.l_linenumber]), range(MIN,MIN ; MAX,MAX)always true
  5 - output([cast(0.2, DECIMAL(2, 1)) * cast(cast(T_FUN_SUM(T_FUN_SUM(lineitem.l_quantity)), DECIMAL_INT(74, 32)) / cast(T_FUN_COUNT_SUM(T_FUN_COUNT(lineitem.l_quantity)),
       DECIMAL_INT(20, 0)), DECIMAL(24, 4))]), filter([cast(0.2, DECIMAL(2, 1)) * cast(cast(T_FUN_SUM(T_FUN_SUM(lineitem.l_quantity)), DECIMAL_INT(74, 32)) / 
      cast(T_FUN_COUNT_SUM(T_FUN_COUNT(lineitem.l_quantity)), DECIMAL_INT(20, 0)), DECIMAL(24, 4)) > cast(1, DECIMAL(20, 0))]), rowset=256
      group(nil), agg_func([T_FUN_SUM(T_FUN_SUM(lineitem.l_quantity))], [T_FUN_COUNT_SUM(T_FUN_COUNT(lineitem.l_quantity))])
  6 - output([T_FUN_SUM(lineitem.l_quantity)], [T_FUN_COUNT(lineitem.l_quantity)]), filter([lineitem.l_partkey = :0]), rowset=256
      access([lineitem.l_partkey], [lineitem.l_quantity]), partitions(p0)
      is_index_back=false, is_global_index=false, filter_before_indexback[false], 
      range_key([lineitem.l_orderkey], [lineitem.l_linenumber]), range(MIN,MIN ; MAX,MAX)always true, 
      pushdown_aggregation([T_FUN_SUM(lineitem.l_quantity)], [T_FUN_COUNT(lineitem.l_quantity)])
SELECT SUM(L_EXTENDEDPRICE)/7.0 AS AVG_YEARLY FROM LINEITEM, PART WHERE P_PARTKEY = L_PARTKEY AND P_BRAND != 'Brand#23' AND P_CONTAINER = 'MED BOX' AND L_QUANTITY < (SELECT 0.2*AVG(L_QUANTITY) as l_avg FROM LINEITEM WHERE L_PARTKEY = P_PARTKEY having l_avg > 1);
+-------------+
| AVG_YEARLY  |
+-------------+
| 4668.630000 |
+-------------+


>>>>>>>>条件3.2 subquery select item中无AGG，不可改写
EXPLAIN SELECT SUM(L_EXTENDEDPRICE)/7.0 AS AVG_YEARLY FROM LINEITEM, PART WHERE P_PARTKEY = L_PARTKEY AND P_BRAND != 'Brand#23' AND P_CONTAINER = 'MED BOX' AND L_QUANTITY < (SELECT DISTINCT P_PARTKEY FROM LINEITEM WHERE L_PARTKEY = P_PARTKEY);
Query Plan
===================================================================
|ID|OPERATOR                       |NAME    |EST.ROWS|EST.TIME(us)|
-------------------------------------------------------------------
|0 |SCALAR GROUP BY                |        |1       |119264      |
|1 |└─SUBPLAN FILTER               |        |95      |119263      |
|2 |  ├─HASH JOIN                  |        |285     |1814        |
|3 |  │ ├─TABLE FULL SCAN          |part    |11      |23          |
|4 |  │ └─TABLE FULL SCAN          |lineitem|11957   |779         |
|5 |  └─DISTRIBUTED TABLE FULL SCAN|lineitem|1       |413         |
===================================================================
Outputs & filters:
-------------------------------------
  0 - output([cast(T_FUN_SUM(lineitem.l_extendedprice), DECIMAL_INT(46, 16)) / 7.0]), filter(nil), rowset=256
      group(nil), agg_func([T_FUN_SUM(lineitem.l_extendedprice)])
  1 - output([lineitem.l_extendedprice]), filter([lineitem.l_quantity < subquery(1)]), rowset=256
      exec_params_([part.p_partkey(:0)]), onetime_exprs_(nil), init_plan_idxs_(nil), use_batch=false
  2 - output([part.p_partkey], [lineitem.l_quantity], [lineitem.l_extendedprice]), filter(nil), rowset=256
      equal_conds([part.p_partkey = lineitem.l_partkey]), other_conds(nil)
  3 - output([part.p_partkey]), filter([part.p_container = 'MED BOX'], [part.p_brand != 'Brand#23']), rowset=256
      access([part.p_partkey], [part.p_brand], [part.p_container]), partitions(p0)
      is_index_back=false, is_global_index=false, filter_before_indexback[false,false], 
      range_key([part.p_partkey]), range(MIN ; MAX)always true
  4 - output([lineitem.l_partkey], [lineitem.l_quantity], [lineitem.l_extendedprice]), filter(nil), rowset=256
      access([lineitem.l_partkey], [lineitem.l_quantity], [lineitem.l_extendedprice]), partitions(p0)
      is_index_back=false, is_global_index=false, 
      range_key([lineitem.l_orderkey], [lineitem.l_linenumber]), range(MIN,MIN ; MAX,MAX)always true
  5 - output([:0]), filter([lineitem.l_partkey = :0]), rowset=256
      access([lineitem.l_partkey]), partitions(p0)
      limit(1), offset(nil), is_index_back=false, is_global_index=false, filter_before_indexback[false], 
      range_key([lineitem.l_orderkey], [lineitem.l_linenumber]), range(MIN,MIN ; MAX,MAX)always true
SELECT SUM(L_EXTENDEDPRICE)/7.0 AS AVG_YEARLY FROM LINEITEM, PART WHERE P_PARTKEY = L_PARTKEY AND P_BRAND != 'Brand#23' AND P_CONTAINER = 'MED BOX' AND L_QUANTITY < (SELECT DISTINCT P_PARTKEY FROM LINEITEM WHERE L_PARTKEY = P_PARTKEY);
+---------------+
| AVG_YEARLY    |
+---------------+
| 254701.234286 |
+---------------+


>>>>>>>>条件3.3 subquery 中table 在parent stmt中不存在，不可改写
EXPLAIN SELECT SUM(L_EXTENDEDPRICE)/7.0 AS AVG_YEARLY FROM LINEITEM, PART WHERE P_PARTKEY = L_PARTKEY AND P_BRAND != 'Brand#23' AND P_CONTAINER = 'MED BOX' AND L_QUANTITY < (SELECT AVG(c_nationkey) FROM CUSTOMER WHERE C_CUSTKEY = P_PARTKEY);
Query Plan
=========================================================
|ID|OPERATOR             |NAME    |EST.ROWS|EST.TIME(us)|
---------------------------------------------------------
|0 |SCALAR GROUP BY      |        |1       |1834        |
|1 |└─HASH JOIN          |        |95      |1832        |
|2 |  ├─MERGE JOIN       |        |11      |42          |
|3 |  │ ├─TABLE FULL SCAN|part    |11      |23          |
|4 |  │ └─TABLE FULL SCAN|customer|300     |17          |
|5 |  └─TABLE FULL SCAN  |lineitem|11957   |779         |
=========================================================
Outputs & filters:
-------------------------------------
  0 - output([cast(T_FUN_SUM(lineitem.l_extendedprice), DECIMAL_INT(46, 16)) / 7.0]), filter(nil), rowset=256
      group(nil), agg_func([T_FUN_SUM(lineitem.l_extendedprice)])
  1 - output([lineitem.l_extendedprice]), filter(nil), rowset=256
      equal_conds([part.p_partkey = lineitem.l_partkey]), other_conds([cast(lineitem.l_quantity, DECIMAL(20, 0)) < cast(cast(cast(customer.c_nationkey, 
      DECIMAL_INT(42, 0)), DECIMAL_INT(74, 32)) / cast(CASE WHEN customer.c_nationkey IS NOT NULL THEN 1 ELSE 0 END, DECIMAL_INT(20, 0)), DECIMAL(24, 4))])
  2 - output([part.p_partkey], [customer.c_nationkey]), filter(nil), rowset=256
      equal_conds([customer.c_custkey = part.p_partkey]), other_conds(nil)
      merge_directions([ASC])
  3 - output([part.p_partkey]), filter([part.p_container = 'MED BOX'], [part.p_brand != 'Brand#23']), rowset=256
      access([part.p_partkey], [part.p_brand], [part.p_container]), partitions(p0)
      is_index_back=false, is_global_index=false, filter_before_indexback[false,false], 
      range_key([part.p_partkey]), range(MIN ; MAX)always true
  4 - output([customer.c_custkey], [customer.c_nationkey]), filter(nil), rowset=256
      access([customer.c_custkey], [customer.c_nationkey]), partitions(p0)
      is_index_back=false, is_global_index=false, 
      range_key([customer.c_custkey]), range(MIN ; MAX)always true
  5 - output([lineitem.l_partkey], [lineitem.l_quantity], [lineitem.l_extendedprice]), filter(nil), rowset=256
      access([lineitem.l_partkey], [lineitem.l_quantity], [lineitem.l_extendedprice]), partitions(p0)
      is_index_back=false, is_global_index=false, 
      range_key([lineitem.l_orderkey], [lineitem.l_linenumber]), range(MIN,MIN ; MAX,MAX)always true
SELECT SUM(L_EXTENDEDPRICE)/7.0 AS AVG_YEARLY FROM LINEITEM, PART WHERE P_PARTKEY = L_PARTKEY AND P_BRAND != 'Brand#23' AND P_CONTAINER = 'MED BOX' AND L_QUANTITY < (SELECT AVG(c_nationkey) FROM CUSTOMER WHERE C_CUSTKEY = P_PARTKEY);
+--------------+
| AVG_YEARLY   |
+--------------+
| 11078.100000 |
+--------------+


>>>>>>>>条件3.4 subquery 中condition expr在parent condition exprs中不存在，不可改写
EXPLAIN SELECT SUM(L_EXTENDEDPRICE)/7.0 AS AVG_YEARLY FROM LINEITEM, PART WHERE P_PARTKEY = L_PARTKEY AND P_BRAND != 'Brand#23' AND P_CONTAINER = 'MED BOX' AND L_QUANTITY < (SELECT SUM(L_QUANTITY) FROM LINEITEM WHERE L_PARTKEY = P_PARTKEY and L_QUANTITY = 10);
Query Plan
=============================================================
|ID|OPERATOR                 |NAME    |EST.ROWS|EST.TIME(us)|
-------------------------------------------------------------
|0 |SCALAR GROUP BY          |        |1       |2317        |
|1 |└─HASH JOIN              |        |17      |2316        |
|2 |  ├─HASH JOIN            |        |12      |526         |
|3 |  │ ├─TABLE FULL SCAN    |part    |11      |23          |
|4 |  │ └─SUBPLAN SCAN       |VIEW1   |184     |485         |
|5 |  │   └─HASH GROUP BY    |        |184     |485         |
|6 |  │     └─TABLE FULL SCAN|lineitem|240     |423         |
|7 |  └─TABLE FULL SCAN      |lineitem|11957   |779         |
=============================================================
Outputs & filters:
-------------------------------------
  0 - output([cast(T_FUN_SUM(lineitem.l_extendedprice), DECIMAL_INT(46, 16)) / 7.0]), filter(nil), rowset=256
      group(nil), agg_func([T_FUN_SUM(lineitem.l_extendedprice)])
  1 - output([lineitem.l_extendedprice]), filter(nil), rowset=256
      equal_conds([part.p_partkey = lineitem.l_partkey]), other_conds([cast(lineitem.l_quantity, DECIMAL_INT(42, 0)) < VIEW1.SUM(L_QUANTITY)])
  2 - output([part.p_partkey], [VIEW1.SUM(L_QUANTITY)]), filter(nil), rowset=256
      equal_conds([VIEW1.lineitem.l_partkey = part.p_partkey]), other_conds(nil)
  3 - output([part.p_partkey]), filter([part.p_container = 'MED BOX'], [part.p_brand != 'Brand#23']), rowset=256
      access([part.p_partkey], [part.p_brand], [part.p_container]), partitions(p0)
      is_index_back=false, is_global_index=false, filter_before_indexback[false,false], 
      range_key([part.p_partkey]), range(MIN ; MAX)always true
  4 - output([VIEW1.SUM(L_QUANTITY)], [VIEW1.lineitem.l_partkey]), filter(nil), rowset=256
      access([VIEW1.SUM(L_QUANTITY)], [VIEW1.lineitem.l_partkey])
  5 - output([T_FUN_SUM(cast(10, BIGINT(20, 0)))], [lineitem.l_partkey]), filter(nil), rowset=256
      group([lineitem.l_partkey]), agg_func([T_FUN_SUM(cast(10, BIGINT(20, 0)))])
  6 - output([lineitem.l_partkey]), filter([lineitem.l_quantity = 10]), rowset=256
      access([lineitem.l_partkey], [lineitem.l_quantity]), partitions(p0)
      is_index_back=false, is_global_index=false, filter_before_indexback[false], 
      range_key([lineitem.l_orderkey], [lineitem.l_linenumber]), range(MIN,MIN ; MAX,MAX)always true
  7 - output([lineitem.l_partkey], [lineitem.l_quantity], [lineitem.l_extendedprice]), filter(nil), rowset=256
      access([lineitem.l_partkey], [lineitem.l_quantity], [lineitem.l_extendedprice]), partitions(p0)
      is_index_back=false, is_global_index=false, 
      range_key([lineitem.l_orderkey], [lineitem.l_linenumber]), range(MIN,MIN ; MAX,MAX)always true
SELECT SUM(L_EXTENDEDPRICE)/7.0 AS AVG_YEARLY FROM LINEITEM, PART WHERE P_PARTKEY = L_PARTKEY AND P_BRAND != 'Brand#23' AND P_CONTAINER = 'MED BOX' AND L_QUANTITY < (SELECT SUM(L_QUANTITY) FROM LINEITEM WHERE L_PARTKEY = P_PARTKEY and L_QUANTITY = 10);
+------------+
| AVG_YEARLY |
+------------+
|       NULL |
+------------+


>>>>>>>>条件3.4 subquery 中相关表达式不为equal表达式，不可改写
EXPLAIN SELECT SUM(L_EXTENDEDPRICE)/7.0 AS AVG_YEARLY FROM LINEITEM, PART WHERE P_PARTKEY > L_PARTKEY AND P_BRAND = 'Brand#23' AND P_CONTAINER = 'MED BOX' AND L_QUANTITY < (SELECT SUM(L_QUANTITY) FROM LINEITEM WHERE P_PARTKEY > L_PARTKEY);
Query Plan
==============================================================
|ID|OPERATOR                  |NAME    |EST.ROWS|EST.TIME(us)|
--------------------------------------------------------------
|0 |SCALAR GROUP BY           |        |1       |11850974    |
|1 |└─SUBPLAN SCAN            |VIEW1   |994     |11850956    |
|2 |  └─HASH GROUP BY         |        |994     |11850953    |
|3 |    └─NESTED-LOOP JOIN    |        |73317872|3482570     |
|4 |      ├─NESTED-LOOP JOIN  |        |12264   |194134      |
|5 |      │ ├─TABLE FULL SCAN |lineitem|11957   |1333        |
|6 |      │ └─TABLE RANGE SCAN|part    |2       |16          |
|7 |      └─MATERIAL          |        |11957   |1541        |
|8 |        └─TABLE FULL SCAN |lineitem|11957   |588         |
==============================================================
Outputs & filters:
-------------------------------------
  0 - output([cast(T_FUN_SUM(VIEW1.lineitem.l_extendedprice), DECIMAL_INT(46, 16)) / 7.0]), filter(nil), rowset=256
      group(nil), agg_func([T_FUN_SUM(VIEW1.lineitem.l_extendedprice)])
  1 - output([VIEW1.lineitem.l_extendedprice]), filter(nil), rowset=256
      access([VIEW1.lineitem.l_extendedprice])
  2 - output([lineitem.l_extendedprice]), filter([cast(lineitem.l_quantity, DECIMAL_INT(42, 0)) < T_FUN_SUM(lineitem.l_quantity)]), rowset=256
      group([lineitem.l_orderkey], [lineitem.l_linenumber], [part.p_partkey]), agg_func([T_FUN_SUM(lineitem.l_quantity)])
  3 - output([lineitem.l_orderkey], [lineitem.l_linenumber], [part.p_partkey], [lineitem.l_extendedprice], [lineitem.l_quantity], [lineitem.l_quantity]), filter(nil), rowset=256
      conds([part.p_partkey > lineitem.l_partkey]), nl_params_(nil), use_batch=false
  4 - output([lineitem.l_orderkey], [lineitem.l_linenumber], [part.p_partkey], [lineitem.l_extendedprice], [lineitem.l_quantity]), filter(nil), rowset=256
      conds(nil), nl_params_([lineitem.l_partkey(:0)]), use_batch=true
  5 - output([lineitem.l_orderkey], [lineitem.l_linenumber], [lineitem.l_partkey], [lineitem.l_quantity], [lineitem.l_extendedprice]), filter(nil), rowset=256
      access([lineitem.l_orderkey], [lineitem.l_linenumber], [lineitem.l_partkey], [lineitem.l_quantity], [lineitem.l_extendedprice]), partitions(p0)
      is_index_back=false, is_global_index=false, 
      range_key([lineitem.l_orderkey], [lineitem.l_linenumber]), range(MIN,MIN ; MAX,MAX)always true
  6 - output([part.p_partkey]), filter([part.p_container = 'MED BOX'], [part.p_brand = 'Brand#23']), rowset=256
      access([GROUP_ID], [part.p_partkey], [part.p_brand], [part.p_container]), partitions(p0)
      is_index_back=false, is_global_index=false, filter_before_indexback[false,false], 
      range_key([part.p_partkey]), range(MIN ; MAX), 
      range_cond([part.p_partkey > :0])
  7 - output([lineitem.l_partkey], [lineitem.l_quantity]), filter(nil), rowset=256
  8 - output([lineitem.l_partkey], [lineitem.l_quantity]), filter(nil), rowset=256
      access([lineitem.l_partkey], [lineitem.l_quantity]), partitions(p0)
      is_index_back=false, is_global_index=false, 
      range_key([lineitem.l_orderkey], [lineitem.l_linenumber]), range(MIN,MIN ; MAX,MAX)always true
SELECT SUM(L_EXTENDEDPRICE)/7.0 AS AVG_YEARLY FROM LINEITEM, PART WHERE P_PARTKEY > L_PARTKEY AND P_BRAND = 'Brand#23' AND P_CONTAINER = 'MED BOX' AND L_QUANTITY < (SELECT SUM(L_QUANTITY) FROM LINEITEM WHERE P_PARTKEY > L_PARTKEY);
+------------+
| AVG_YEARLY |
+------------+
|       NULL |
+------------+


>>>>>>>>条件3.4 相关表达式涉及到parent stmt中的column，没有唯一性约束
EXPLAIN SELECT SUM(L_EXTENDEDPRICE)/7.0 AS AVG_YEARLY FROM LINEITEM, PART WHERE P_SIZE = L_PARTKEY AND P_BRAND != 'Brand#23' AND P_CONTAINER = 'MED BOX' AND L_QUANTITY < (SELECT SUM(L_QUANTITY) FROM LINEITEM WHERE P_SIZE = L_PARTKEY);
Query Plan
=============================================================
|ID|OPERATOR                 |NAME    |EST.ROWS|EST.TIME(us)|
-------------------------------------------------------------
|0 |SCALAR GROUP BY          |        |1       |3716        |
|1 |└─HASH JOIN              |        |23      |3716        |
|2 |  ├─HASH JOIN            |        |16      |1922        |
|3 |  │ ├─TABLE FULL SCAN    |part    |11      |23          |
|4 |  │ └─SUBPLAN SCAN       |VIEW1   |422     |1861        |
|5 |  │   └─HASH GROUP BY    |        |422     |1860        |
|6 |  │     └─TABLE FULL SCAN|lineitem|11957   |588         |
|7 |  └─TABLE FULL SCAN      |lineitem|11957   |779         |
=============================================================
Outputs & filters:
-------------------------------------
  0 - output([cast(T_FUN_SUM(lineitem.l_extendedprice), DECIMAL_INT(46, 16)) / 7.0]), filter(nil), rowset=256
      group(nil), agg_func([T_FUN_SUM(lineitem.l_extendedprice)])
  1 - output([lineitem.l_extendedprice]), filter(nil), rowset=256
      equal_conds([part.p_size = lineitem.l_partkey]), other_conds([cast(lineitem.l_quantity, DECIMAL_INT(42, 0)) < VIEW1.SUM(L_QUANTITY)])
  2 - output([part.p_size], [VIEW1.SUM(L_QUANTITY)]), filter(nil), rowset=256
      equal_conds([part.p_size = VIEW1.lineitem.l_partkey]), other_conds(nil)
  3 - output([part.p_size]), filter([part.p_container = 'MED BOX'], [part.p_brand != 'Brand#23']), rowset=256
      access([part.p_size], [part.p_brand], [part.p_container]), partitions(p0)
      is_index_back=false, is_global_index=false, filter_before_indexback[false,false], 
      range_key([part.p_partkey]), range(MIN ; MAX)always true
  4 - output([VIEW1.SUM(L_QUANTITY)], [VIEW1.lineitem.l_partkey]), filter(nil), rowset=256
      access([VIEW1.SUM(L_QUANTITY)], [VIEW1.lineitem.l_partkey])
  5 - output([T_FUN_SUM(lineitem.l_quantity)], [lineitem.l_partkey]), filter(nil), rowset=256
      group([lineitem.l_partkey]), agg_func([T_FUN_SUM(lineitem.l_quantity)])
  6 - output([lineitem.l_partkey], [lineitem.l_quantity]), filter(nil), rowset=256
      access([lineitem.l_partkey], [lineitem.l_quantity]), partitions(p0)
      is_index_back=false, is_global_index=false, 
      range_key([lineitem.l_orderkey], [lineitem.l_linenumber]), range(MIN,MIN ; MAX,MAX)always true
  7 - output([lineitem.l_partkey], [lineitem.l_quantity], [lineitem.l_extendedprice]), filter(nil), rowset=256
      access([lineitem.l_partkey], [lineitem.l_quantity], [lineitem.l_extendedprice]), partitions(p0)
      is_index_back=false, is_global_index=false, 
      range_key([lineitem.l_orderkey], [lineitem.l_linenumber]), range(MIN,MIN ; MAX,MAX)always true
SELECT SUM(L_EXTENDEDPRICE)/7.0 AS AVG_YEARLY FROM LINEITEM, PART WHERE P_SIZE = L_PARTKEY AND P_BRAND != 'Brand#23' AND P_CONTAINER = 'MED BOX' AND L_QUANTITY < (SELECT SUM(L_QUANTITY) FROM LINEITEM WHERE P_SIZE = L_PARTKEY);
+---------------+
| AVG_YEARLY    |
+---------------+
| 242402.647143 |
+---------------+

**************  子查询from item不是基表情况
use test;
## bug: 
drop table if exists t1,t2;
create table t1 (c1 int, c2 int);
create table t2 (c1 int, c2 int);
insert/*insert trace*/ into t1 values(1,2),(3,3),(4,5);
insert/*insert trace*/ into t2 values(1,2),(3,3),(4,5);
EXPLAIN select * from t2 where c1 < (select sum(c1) from t1 right join t2 using (c1));
Query Plan
========================================================
|ID|OPERATOR               |NAME |EST.ROWS|EST.TIME(us)|
--------------------------------------------------------
|0 |NESTED-LOOP JOIN       |     |1       |9           |
|1 |├─SUBPLAN SCAN         |VIEW1|1       |6           |
|2 |│ └─SCALAR GROUP BY    |     |1       |6           |
|3 |│   └─HASH OUTER JOIN  |     |3       |6           |
|4 |│     ├─TABLE FULL SCAN|t2   |3       |3           |
|5 |│     └─TABLE FULL SCAN|t1   |3       |3           |
|6 |└─TABLE FULL SCAN      |t2   |3       |3           |
========================================================
Outputs & filters:
-------------------------------------
  0 - output([t2.c1], [t2.c2]), filter(nil), rowset=16
      conds([cast(t2.c1, DECIMAL_INT(33, 0)) < VIEW1.sum(c1)]), nl_params_(nil), use_batch=false
  1 - output([VIEW1.sum(c1)]), filter(nil), rowset=16
      access([VIEW1.sum(c1)])
  2 - output([T_FUN_SUM(t2.c1)]), filter(nil), rowset=16
      group(nil), agg_func([T_FUN_SUM(t2.c1)])
  3 - output([t2.c1]), filter(nil), rowset=16
      equal_conds([t1.c1 = t2.c1]), other_conds(nil)
  4 - output([t2.c1]), filter(nil), rowset=16
      access([t2.c1]), partitions(p0)
      is_index_back=false, is_global_index=false, 
      range_key([t2.__pk_increment]), range(MIN ; MAX)always true
  5 - output([t1.c1]), filter(nil), rowset=16
      access([t1.c1]), partitions(p0)
      is_index_back=false, is_global_index=false, 
      range_key([t1.__pk_increment]), range(MIN ; MAX)always true
  6 - output([t2.c1], [t2.c2]), filter(nil), rowset=16
      access([t2.c1], [t2.c2]), partitions(p0)
      is_index_back=false, is_global_index=false, 
      range_key([t2.__pk_increment]), range(MIN ; MAX)always true
select * from t2 where c1 < (select sum(c1) from t1 right join t2 using (c1));
+------+------+
| c1   | c2   |
+------+------+
|    1 |    2 |
|    3 |    3 |
|    4 |    5 |
+------+------+
EXPLAIN select * from t2 where c1 < (select sum(c1) from (select * from t1 order by c1 limit 10) as t);
Query Plan
==========================================================
|ID|OPERATOR                 |NAME |EST.ROWS|EST.TIME(us)|
----------------------------------------------------------
|0 |NESTED-LOOP JOIN         |     |1       |6           |
|1 |├─SUBPLAN SCAN           |VIEW1|1       |3           |
|2 |│ └─SCALAR GROUP BY      |     |1       |3           |
|3 |│   └─SUBPLAN SCAN       |t    |3       |3           |
|4 |│     └─TOP-N SORT       |     |3       |3           |
|5 |│       └─TABLE FULL SCAN|t1   |3       |3           |
|6 |└─TABLE FULL SCAN        |t2   |3       |3           |
==========================================================
Outputs & filters:
-------------------------------------
  0 - output([t2.c1], [t2.c2]), filter(nil), rowset=16
      conds([cast(t2.c1, DECIMAL_INT(33, 0)) < VIEW1.sum(c1)]), nl_params_(nil), use_batch=false
  1 - output([VIEW1.sum(c1)]), filter(nil), rowset=16
      access([VIEW1.sum(c1)])
  2 - output([T_FUN_SUM(t.c1)]), filter(nil), rowset=16
      group(nil), agg_func([T_FUN_SUM(t.c1)])
  3 - output([t.c1]), filter(nil), rowset=16
      access([t.c1])
  4 - output([t1.c1]), filter(nil), rowset=16
      sort_keys([t1.c1, ASC]), topn(10)
  5 - output([t1.c1]), filter(nil), rowset=16
      access([t1.c1]), partitions(p0)
      is_index_back=false, is_global_index=false, 
      range_key([t1.__pk_increment]), range(MIN ; MAX)always true
  6 - output([t2.c1], [t2.c2]), filter(nil), rowset=16
      access([t2.c1], [t2.c2]), partitions(p0)
      is_index_back=false, is_global_index=false, 
      range_key([t2.__pk_increment]), range(MIN ; MAX)always true
select * from t2 where c1 < (select sum(c1) from (select * from t1 order by c1 limit 10) as t);
+------+------+
| c1   | c2   |
+------+------+
|    1 |    2 |
|    3 |    3 |
|    4 |    5 |
+------+------+

drop table t1,t2;
USE OPT_WISCONSIN;
drop table if exists tmp;
create table tmp (c1 int);

set autocommit = 0;
## 外层的表和内层的表是相同的
EXPLAIN select avg(a1.thousand) from t2_100 a1 where a1.hundred >= (select avg(a2.hundred) from t2_100 a2 where a1.unique1 = a2.unique1);
Query Plan
=================================================
|ID|OPERATOR         |NAME|EST.ROWS|EST.TIME(us)|
-------------------------------------------------
|0 |SCALAR GROUP BY  |    |1       |8           |
|1 |└─TABLE FULL SCAN|a1  |34      |7           |
=================================================
Outputs & filters:
-------------------------------------
  0 - output([cast(cast(T_FUN_SUM(T_FUN_SUM(a1.THOUSAND)), DECIMAL_INT(64, 32)) / cast(T_FUN_COUNT_SUM(T_FUN_COUNT(a1.THOUSAND)), DECIMAL_INT(20, 0)), DECIMAL(14,
       4))]), filter(nil), rowset=256
      group(nil), agg_func([T_FUN_SUM(T_FUN_SUM(a1.THOUSAND))], [T_FUN_COUNT_SUM(T_FUN_COUNT(a1.THOUSAND))])
  1 - output([T_FUN_SUM(a1.THOUSAND)], [T_FUN_COUNT(a1.THOUSAND)]), filter([cast(a1.HUNDRED, DECIMAL(10, 0)) >= cast(cast(cast(a1.HUNDRED, DECIMAL_INT(32,
       0)), DECIMAL_INT(64, 32)) / cast(CASE WHEN a1.HUNDRED IS NOT NULL THEN 1 ELSE 0 END, DECIMAL_INT(20, 0)), DECIMAL(14, 4))]), rowset=256
      access([a1.HUNDRED], [a1.THOUSAND]), partitions(p0)
      is_index_back=false, is_global_index=false, filter_before_indexback[false], 
      range_key([a1.__pk_increment]), range(MIN ; MAX)always true, 
      pushdown_aggregation([T_FUN_SUM(a1.THOUSAND)], [T_FUN_COUNT(a1.THOUSAND)])
select avg(a1.thousand) from t2_100 a1 where a1.hundred >= (select avg(a2.hundred) from t2_100 a2 where a1.unique1 = a2.unique1);
+------------------+
| avg(a1.thousand) |
+------------------+
|          49.5000 |
+------------------+
EXPLAIN select /*+no_unnest(@qb1)*/ avg(a1.thousand) from t2_100 a1 where a1.hundred >= (select /*+qb_name(qb1)*/avg(a2.hundred) from t2_100 a2 where a1.unique1 = a2.unique1);
Query Plan
=================================================================
|ID|OPERATOR           |NAME              |EST.ROWS|EST.TIME(us)|
-----------------------------------------------------------------
|0 |SCALAR GROUP BY    |                  |1       |2262        |
|1 |└─SUBPLAN FILTER   |                  |34      |2261        |
|2 |  ├─TABLE FULL SCAN|a1                |100     |8           |
|3 |  └─SCALAR GROUP BY|                  |1       |23          |
|4 |    └─TABLE GET    |a2(T2_100_UNIQUE1)|1       |23          |
=================================================================
Outputs & filters:
-------------------------------------
  0 - output([cast(cast(T_FUN_SUM(a1.THOUSAND), DECIMAL_INT(64, 32)) / cast(T_FUN_COUNT(a1.THOUSAND), DECIMAL_INT(20, 0)), DECIMAL(14, 4))]), filter(nil), rowset=256
      group(nil), agg_func([T_FUN_SUM(a1.THOUSAND)], [T_FUN_COUNT(a1.THOUSAND)])
  1 - output([a1.THOUSAND]), filter([cast(a1.HUNDRED, DECIMAL(10, 0)) >= subquery(1)]), rowset=256
      exec_params_([a1.UNIQUE1(:0)]), onetime_exprs_(nil), init_plan_idxs_(nil), use_batch=false
  2 - output([a1.UNIQUE1], [a1.HUNDRED], [a1.THOUSAND]), filter(nil), rowset=256
      access([a1.UNIQUE1], [a1.HUNDRED], [a1.THOUSAND]), partitions(p0)
      is_index_back=false, is_global_index=false, 
      range_key([a1.__pk_increment]), range(MIN ; MAX)always true
  3 - output([cast(cast(T_FUN_SUM(a2.HUNDRED), DECIMAL_INT(64, 32)) / cast(T_FUN_COUNT(a2.HUNDRED), DECIMAL_INT(20, 0)), DECIMAL(14, 4))]), filter(nil), rowset=256
      group(nil), agg_func([T_FUN_SUM(a2.HUNDRED)], [T_FUN_COUNT(a2.HUNDRED)])
  4 - output([a2.HUNDRED]), filter(nil), rowset=256
      access([a2.__pk_increment], [a2.HUNDRED]), partitions(p0)
      is_index_back=true, is_global_index=false, 
      range_key([a2.UNIQUE1], [a2.shadow_pk_0]), range(MIN,MIN ; MAX,MAX)always true, 
      range_cond([:0 = a2.UNIQUE1])
select /*+no_unnest(@qb1)*/ avg(a1.thousand) from t2_100 a1 where a1.hundred >= (select /*+qb_name(qb1)*/avg(a2.hundred) from t2_100 a2 where a1.unique1 = a2.unique1);
+------------------+
| avg(a1.thousand) |
+------------------+
|          49.5000 |
+------------------+

EXPLAIN update t2_100 a1 set a1.thousand = a1.unique1 where a1.hundred >= (select avg(a2.hundred) from t2_100 a2 where a1.unique1 = a2.unique1);
Query Plan
=================================================
|ID|OPERATOR         |NAME|EST.ROWS|EST.TIME(us)|
-------------------------------------------------
|0 |UPDATE           |    |34      |290         |
|1 |└─TABLE FULL SCAN|a1  |34      |14          |
=================================================
Outputs & filters:
-------------------------------------
  0 - output(nil), filter(nil)
      table_columns([{a1: ({t2_100: (a1.__pk_increment, a1.UNIQUE1, a1.UNIQUE2, a1.UNIQUE3, a1.TEN, a1.HUNDRED, a1.THOUSAND, a1.HUND_CLUST, a1.HUND_NULL,
       a1.CHAR_UNIQUE, a1.CHAR_HUND, a1.VCHAR_UNIQUE, a1.VCHAR_HUND, a1.DATE_UNIQUE, a1.DATE_HUND, a1.ALL_NULL, a1.NUMERIC)})}]),
      update([a1.THOUSAND=column_conv(DECIMAL_INT,PS:(10,0),NULL,a1.UNIQUE1)])
  1 - output([a1.__pk_increment], [a1.THOUSAND], [a1.UNIQUE1], [a1.UNIQUE2], [a1.UNIQUE3], [a1.TEN], [a1.HUNDRED], [a1.HUND_CLUST], [a1.HUND_NULL], [a1.CHAR_UNIQUE],
       [a1.CHAR_HUND], [a1.VCHAR_UNIQUE], [a1.VCHAR_HUND], [a1.DATE_UNIQUE], [a1.DATE_HUND], [a1.ALL_NULL], [a1.NUMERIC]), filter([cast(a1.HUNDRED, DECIMAL(10,
       0)) >= cast(cast(cast(a1.HUNDRED, DECIMAL_INT(32, 0)), DECIMAL_INT(64, 32)) / cast(CASE WHEN a1.HUNDRED IS NOT NULL THEN 1 ELSE 0 END, DECIMAL_INT(20, 
      0)), DECIMAL(14, 4))]), rowset=256
      access([a1.__pk_increment], [a1.THOUSAND], [a1.UNIQUE1], [a1.UNIQUE2], [a1.UNIQUE3], [a1.TEN], [a1.HUNDRED], [a1.HUND_CLUST], [a1.HUND_NULL], [a1.CHAR_UNIQUE],
       [a1.CHAR_HUND], [a1.VCHAR_UNIQUE], [a1.VCHAR_HUND], [a1.DATE_UNIQUE], [a1.DATE_HUND], [a1.ALL_NULL], [a1.NUMERIC]), partitions(p0)
      is_index_back=false, is_global_index=false, filter_before_indexback[false], 
      range_key([a1.__pk_increment]), range(MIN ; MAX)always true
update t2_100 a1 set a1.thousand = a1.unique1 where a1.hundred >= (select avg(a2.hundred) from t2_100 a2 where a1.unique1 = a2.unique1);
select/*no explain*/sum(thousand), stddev(thousand) from t2_100;
+---------------+-------------------+
| sum(thousand) | stddev(thousand)  |
+---------------+-------------------+
|          4950 | 28.86607004772212 |
+---------------+-------------------+
rollback;
EXPLAIN update t2_100 a1 set a1.thousand = (select avg(a2.hundred) from t2_100 a2 where a1.unique1 = a2.unique1);
Query Plan
========================================================
|ID|OPERATOR                |NAME|EST.ROWS|EST.TIME(us)|
--------------------------------------------------------
|0 |UPDATE                  |    |100     |847         |
|1 |└─HASH RIGHT OUTER JOIN |    |100     |66          |
|2 |  ├─TABLE FULL SCAN     |a2  |100     |6           |
|3 |  └─TABLE FULL SCAN     |a1  |100     |26          |
========================================================
Outputs & filters:
-------------------------------------
  0 - output(nil), filter(nil)
      table_columns([{a1: ({t2_100: (a1.__pk_increment, a1.UNIQUE1, a1.UNIQUE2, a1.UNIQUE3, a1.TEN, a1.HUNDRED, a1.THOUSAND, a1.HUND_CLUST, a1.HUND_NULL,
       a1.CHAR_UNIQUE, a1.CHAR_HUND, a1.VCHAR_UNIQUE, a1.VCHAR_HUND, a1.DATE_UNIQUE, a1.DATE_HUND, a1.ALL_NULL, a1.NUMERIC)})}]),
      update([a1.THOUSAND=column_conv(DECIMAL_INT,PS:(10,0),NULL,cast(cast(cast(cast(a2.HUNDRED, DECIMAL_INT(32, 0)), DECIMAL_INT(64, 32)) / cast(CASE WHEN 
      a2.HUNDRED IS NOT NULL THEN 1 ELSE 0 END, DECIMAL_INT(20, 0)), DECIMAL(14, 4)), DECIMAL_INT(10, 0)))])
  1 - output([a1.__pk_increment], [a1.UNIQUE1], [a1.UNIQUE2], [a1.UNIQUE3], [a1.TEN], [a1.HUNDRED], [a1.THOUSAND], [a1.HUND_CLUST], [a1.HUND_NULL], [a1.CHAR_UNIQUE],
       [a1.CHAR_HUND], [a1.VCHAR_UNIQUE], [a1.VCHAR_HUND], [a1.DATE_UNIQUE], [a1.DATE_HUND], [a1.ALL_NULL], [a1.NUMERIC], [a2.HUNDRED]), filter(nil), rowset=256
      equal_conds([a1.UNIQUE1 = a2.UNIQUE1]), other_conds(nil)
  2 - output([a2.UNIQUE1], [a2.HUNDRED]), filter(nil), rowset=256
      access([a2.UNIQUE1], [a2.HUNDRED]), partitions(p0)
      is_index_back=false, is_global_index=false, 
      range_key([a2.__pk_increment]), range(MIN ; MAX)always true
  3 - output([a1.__pk_increment], [a1.THOUSAND], [a1.UNIQUE1], [a1.UNIQUE2], [a1.UNIQUE3], [a1.TEN], [a1.HUNDRED], [a1.HUND_CLUST], [a1.HUND_NULL], [a1.CHAR_UNIQUE],
       [a1.CHAR_HUND], [a1.VCHAR_UNIQUE], [a1.VCHAR_HUND], [a1.DATE_UNIQUE], [a1.DATE_HUND], [a1.ALL_NULL], [a1.NUMERIC]), filter(nil), rowset=256
      access([a1.__pk_increment], [a1.THOUSAND], [a1.UNIQUE1], [a1.UNIQUE2], [a1.UNIQUE3], [a1.TEN], [a1.HUNDRED], [a1.HUND_CLUST], [a1.HUND_NULL], [a1.CHAR_UNIQUE],
       [a1.CHAR_HUND], [a1.VCHAR_UNIQUE], [a1.VCHAR_HUND], [a1.DATE_UNIQUE], [a1.DATE_HUND], [a1.ALL_NULL], [a1.NUMERIC]), partitions(p0)
      is_index_back=false, is_global_index=false, 
      range_key([a1.__pk_increment]), range(MIN ; MAX)always true
update t2_100 a1 set a1.thousand = (select avg(a2.hundred) from t2_100 a2 where a1.unique1 = a2.unique1);
select/*no explain*/sum(thousand), stddev(thousand) from t2_100;
+---------------+-------------------+
| sum(thousand) | stddev(thousand)  |
+---------------+-------------------+
|          4950 | 28.86607004772212 |
+---------------+-------------------+
rollback;
EXPLAIN delete from t2_100 a1 where a1.hundred >= (select avg(a2.hundred) from t2_100 a2 where a1.unique1 = a2.unique1);
Query Plan
=================================================
|ID|OPERATOR         |NAME|EST.ROWS|EST.TIME(us)|
-------------------------------------------------
|0 |DELETE           |    |34      |188         |
|1 |└─TABLE FULL SCAN|a1  |34      |14          |
=================================================
Outputs & filters:
-------------------------------------
  0 - output(nil), filter(nil)
      table_columns([{a1: ({t2_100: (a1.__pk_increment, a1.UNIQUE1, a1.UNIQUE2, a1.UNIQUE3, a1.TEN, a1.HUNDRED, a1.THOUSAND, a1.HUND_CLUST, a1.HUND_NULL,
       a1.CHAR_UNIQUE, a1.CHAR_HUND, a1.VCHAR_UNIQUE, a1.VCHAR_HUND, a1.DATE_UNIQUE, a1.DATE_HUND, a1.ALL_NULL, a1.NUMERIC)})}])
  1 - output([a1.__pk_increment], [a1.UNIQUE1], [a1.UNIQUE2], [a1.UNIQUE3], [a1.TEN], [a1.HUNDRED], [a1.THOUSAND], [a1.HUND_CLUST], [a1.HUND_NULL], [a1.CHAR_UNIQUE],
       [a1.CHAR_HUND], [a1.VCHAR_UNIQUE], [a1.VCHAR_HUND], [a1.DATE_UNIQUE], [a1.DATE_HUND], [a1.ALL_NULL], [a1.NUMERIC]), filter([cast(a1.HUNDRED, DECIMAL(10,
       0)) >= cast(cast(cast(a1.HUNDRED, DECIMAL_INT(32, 0)), DECIMAL_INT(64, 32)) / cast(CASE WHEN a1.HUNDRED IS NOT NULL THEN 1 ELSE 0 END, DECIMAL_INT(20, 
      0)), DECIMAL(14, 4))]), rowset=256
      access([a1.__pk_increment], [a1.UNIQUE1], [a1.UNIQUE2], [a1.UNIQUE3], [a1.TEN], [a1.HUNDRED], [a1.THOUSAND], [a1.HUND_CLUST], [a1.HUND_NULL], [a1.CHAR_UNIQUE],
       [a1.CHAR_HUND], [a1.VCHAR_UNIQUE], [a1.VCHAR_HUND], [a1.DATE_UNIQUE], [a1.DATE_HUND], [a1.ALL_NULL], [a1.NUMERIC]), partitions(p0)
      is_index_back=false, is_global_index=false, filter_before_indexback[false], 
      range_key([a1.__pk_increment]), range(MIN ; MAX)always true
delete from t2_100 a1 where a1.hundred >= (select avg(a2.hundred) from t2_100 a2 where a1.unique1 = a2.unique1);
select/*no explain*/count(*), stddev(thousand) from t2_100;
+----------+------------------+
| count(*) | stddev(thousand) |
+----------+------------------+
|        0 |             NULL |
+----------+------------------+
rollback;
EXPLAIN insert into tmp select avg(a1.thousand) from t2_100 a1 where a1.hundred >= (select avg(a2.hundred) from t2_100 a2 where a1.unique1 = a2.unique1);
Query Plan
================================================================
|ID|OPERATOR             |NAME           |EST.ROWS|EST.TIME(us)|
----------------------------------------------------------------
|0 |INSERT               |               |1       |21          |
|1 |└─SUBPLAN SCAN       |ANONYMOUS_VIEW1|1       |8           |
|2 |  └─SCALAR GROUP BY  |               |1       |8           |
|3 |    └─TABLE FULL SCAN|a1             |34      |7           |
================================================================
Outputs & filters:
-------------------------------------
  0 - output(nil), filter(nil)
      columns([{tmp: ({tmp: (tmp.__pk_increment, tmp.c1)})}]), partitions(p0), 
      column_values([T_HIDDEN_PK], [column_conv(INT,PS:(11,0),NULL,cast(ANONYMOUS_VIEW1.avg(a1.thousand), INT(-1, 0)))])
  1 - output([ANONYMOUS_VIEW1.avg(a1.thousand)]), filter(nil), rowset=256
      access([ANONYMOUS_VIEW1.avg(a1.thousand)])
  2 - output([cast(cast(T_FUN_SUM(T_FUN_SUM(a1.THOUSAND)), DECIMAL_INT(64, 32)) / cast(T_FUN_COUNT_SUM(T_FUN_COUNT(a1.THOUSAND)), DECIMAL_INT(20, 0)), DECIMAL(14,
       4))]), filter(nil), rowset=256
      group(nil), agg_func([T_FUN_SUM(T_FUN_SUM(a1.THOUSAND))], [T_FUN_COUNT_SUM(T_FUN_COUNT(a1.THOUSAND))])
  3 - output([T_FUN_SUM(a1.THOUSAND)], [T_FUN_COUNT(a1.THOUSAND)]), filter([cast(a1.HUNDRED, DECIMAL(10, 0)) >= cast(cast(cast(a1.HUNDRED, DECIMAL_INT(32,
       0)), DECIMAL_INT(64, 32)) / cast(CASE WHEN a1.HUNDRED IS NOT NULL THEN 1 ELSE 0 END, DECIMAL_INT(20, 0)), DECIMAL(14, 4))]), rowset=256
      access([a1.HUNDRED], [a1.THOUSAND]), partitions(p0)
      is_index_back=false, is_global_index=false, filter_before_indexback[false], 
      range_key([a1.__pk_increment]), range(MIN ; MAX)always true, 
      pushdown_aggregation([T_FUN_SUM(a1.THOUSAND)], [T_FUN_COUNT(a1.THOUSAND)])
insert into tmp select avg(a1.thousand) from t2_100 a1 where a1.hundred >= (select avg(a2.hundred) from t2_100 a2 where a1.unique1 = a2.unique1);
select/*no explain*/* from tmp;
+------+
| c1   |
+------+
|   50 |
+------+
rollback;

EXPLAIN select avg(a1.thousand) from t2_100 a1 where a1.hundred >= (select avg(a2.hundred) from t2_100 a2 where a1.ten = a2.ten);
Query Plan
========================================================
|ID|OPERATOR               |NAME |EST.ROWS|EST.TIME(us)|
--------------------------------------------------------
|0 |SCALAR GROUP BY        |     |1       |41          |
|1 |└─HASH JOIN            |     |10      |41          |
|2 |  ├─SUBPLAN SCAN       |VIEW1|10      |20          |
|3 |  │ └─HASH GROUP BY    |     |10      |20          |
|4 |  │   └─TABLE FULL SCAN|a2   |100     |6           |
|5 |  └─TABLE FULL SCAN    |a1   |100     |8           |
========================================================
Outputs & filters:
-------------------------------------
  0 - output([cast(cast(T_FUN_SUM(a1.THOUSAND), DECIMAL_INT(64, 32)) / cast(T_FUN_COUNT(a1.THOUSAND), DECIMAL_INT(20, 0)), DECIMAL(14, 4))]), filter(nil), rowset=256
      group(nil), agg_func([T_FUN_SUM(a1.THOUSAND)], [T_FUN_COUNT(a1.THOUSAND)])
  1 - output([a1.THOUSAND]), filter(nil), rowset=256
      equal_conds([a1.TEN = VIEW1.a2.TEN]), other_conds([cast(a1.HUNDRED, DECIMAL(10, 0)) >= VIEW1.avg(a2.hundred)])
  2 - output([VIEW1.avg(a2.hundred)], [VIEW1.a2.TEN]), filter(nil), rowset=256
      access([VIEW1.avg(a2.hundred)], [VIEW1.a2.TEN])
  3 - output([cast(cast(T_FUN_SUM(a2.HUNDRED), DECIMAL_INT(64, 32)) / cast(T_FUN_COUNT(a2.HUNDRED), DECIMAL_INT(20, 0)), DECIMAL(14, 4))], [a2.TEN]), filter(nil), rowset=256
      group([a2.TEN]), agg_func([T_FUN_SUM(a2.HUNDRED)], [T_FUN_COUNT(a2.HUNDRED)])
  4 - output([a2.TEN], [a2.HUNDRED]), filter(nil), rowset=256
      access([a2.TEN], [a2.HUNDRED]), partitions(p0)
      is_index_back=false, is_global_index=false, 
      range_key([a2.__pk_increment]), range(MIN ; MAX)always true
  5 - output([a1.TEN], [a1.HUNDRED], [a1.THOUSAND]), filter(nil), rowset=256
      access([a1.TEN], [a1.HUNDRED], [a1.THOUSAND]), partitions(p0)
      is_index_back=false, is_global_index=false, 
      range_key([a1.__pk_increment]), range(MIN ; MAX)always true
select avg(a1.thousand) from t2_100 a1 where a1.hundred >= (select avg(a2.hundred) from t2_100 a2 where a1.ten = a2.ten);
+------------------+
| avg(a1.thousand) |
+------------------+
|          74.5000 |
+------------------+
EXPLAIN select /*+no_unnest(@qb1)*/ avg(a1.thousand) from t2_100 a1 where a1.hundred >= (select /*+qb_name(qb1)*/avg(a2.hundred) from t2_100 a2 where a1.ten = a2.ten);
Query Plan
================================================================
|ID|OPERATOR              |NAME          |EST.ROWS|EST.TIME(us)|
----------------------------------------------------------------
|0 |SCALAR GROUP BY       |              |1       |4518        |
|1 |└─SUBPLAN FILTER      |              |34      |4517        |
|2 |  ├─TABLE FULL SCAN   |a1            |100     |8           |
|3 |  └─SCALAR GROUP BY   |              |1       |46          |
|4 |    └─TABLE RANGE SCAN|a2(T2_100_TEN)|10      |45          |
================================================================
Outputs & filters:
-------------------------------------
  0 - output([cast(cast(T_FUN_SUM(a1.THOUSAND), DECIMAL_INT(64, 32)) / cast(T_FUN_COUNT(a1.THOUSAND), DECIMAL_INT(20, 0)), DECIMAL(14, 4))]), filter(nil), rowset=256
      group(nil), agg_func([T_FUN_SUM(a1.THOUSAND)], [T_FUN_COUNT(a1.THOUSAND)])
  1 - output([a1.THOUSAND]), filter([cast(a1.HUNDRED, DECIMAL(10, 0)) >= subquery(1)]), rowset=256
      exec_params_([a1.TEN(:0)]), onetime_exprs_(nil), init_plan_idxs_(nil), use_batch=false
  2 - output([a1.TEN], [a1.HUNDRED], [a1.THOUSAND]), filter(nil), rowset=256
      access([a1.TEN], [a1.HUNDRED], [a1.THOUSAND]), partitions(p0)
      is_index_back=false, is_global_index=false, 
      range_key([a1.__pk_increment]), range(MIN ; MAX)always true
  3 - output([cast(cast(T_FUN_SUM(a2.HUNDRED), DECIMAL_INT(64, 32)) / cast(T_FUN_COUNT(a2.HUNDRED), DECIMAL_INT(20, 0)), DECIMAL(14, 4))]), filter(nil), rowset=256
      group(nil), agg_func([T_FUN_SUM(a2.HUNDRED)], [T_FUN_COUNT(a2.HUNDRED)])
  4 - output([a2.HUNDRED]), filter(nil), rowset=256
      access([a2.__pk_increment], [a2.HUNDRED]), partitions(p0)
      is_index_back=true, is_global_index=false, 
      range_key([a2.TEN], [a2.__pk_increment]), range(MIN,MIN ; MAX,MAX)always true, 
      range_cond([:0 = a2.TEN])
select /*+no_unnest(@qb1)*/ avg(a1.thousand) from t2_100 a1 where a1.hundred >= (select /*+qb_name(qb1)*/avg(a2.hundred) from t2_100 a2 where a1.ten = a2.ten);
+------------------+
| avg(a1.thousand) |
+------------------+
|          74.5000 |
+------------------+

EXPLAIN update t2_100 a1 set a1.thousand = a1.unique1 where a1.hundred >= (select avg(a2.hundred) from t2_100 a2 where a1.ten = a2.ten);
Query Plan
========================================================
|ID|OPERATOR               |NAME |EST.ROWS|EST.TIME(us)|
--------------------------------------------------------
|0 |UPDATE                 |     |10      |159         |
|1 |└─HASH JOIN            |     |10      |59          |
|2 |  ├─SUBPLAN SCAN       |VIEW1|10      |20          |
|3 |  │ └─HASH GROUP BY    |     |10      |20          |
|4 |  │   └─TABLE FULL SCAN|a2   |100     |6           |
|5 |  └─TABLE FULL SCAN    |a1   |100     |26          |
========================================================
Outputs & filters:
-------------------------------------
  0 - output(nil), filter(nil)
      table_columns([{a1: ({t2_100: (a1.__pk_increment, a1.UNIQUE1, a1.UNIQUE2, a1.UNIQUE3, a1.TEN, a1.HUNDRED, a1.THOUSAND, a1.HUND_CLUST, a1.HUND_NULL,
       a1.CHAR_UNIQUE, a1.CHAR_HUND, a1.VCHAR_UNIQUE, a1.VCHAR_HUND, a1.DATE_UNIQUE, a1.DATE_HUND, a1.ALL_NULL, a1.NUMERIC)})}]),
      update([a1.THOUSAND=column_conv(DECIMAL_INT,PS:(10,0),NULL,a1.UNIQUE1)])
  1 - output([a1.__pk_increment], [a1.UNIQUE1], [a1.UNIQUE2], [a1.UNIQUE3], [a1.TEN], [a1.HUNDRED], [a1.THOUSAND], [a1.HUND_CLUST], [a1.HUND_NULL], [a1.CHAR_UNIQUE],
       [a1.CHAR_HUND], [a1.VCHAR_UNIQUE], [a1.VCHAR_HUND], [a1.DATE_UNIQUE], [a1.DATE_HUND], [a1.ALL_NULL], [a1.NUMERIC]), filter(nil), rowset=256
      equal_conds([a1.TEN = VIEW1.a2.TEN]), other_conds([cast(a1.HUNDRED, DECIMAL(10, 0)) >= VIEW1.avg(a2.hundred)])
  2 - output([VIEW1.avg(a2.hundred)], [VIEW1.a2.TEN]), filter(nil), rowset=256
      access([VIEW1.avg(a2.hundred)], [VIEW1.a2.TEN])
  3 - output([cast(cast(T_FUN_SUM(a2.HUNDRED), DECIMAL_INT(64, 32)) / cast(T_FUN_COUNT(a2.HUNDRED), DECIMAL_INT(20, 0)), DECIMAL(14, 4))], [a2.TEN]), filter(nil), rowset=256
      group([a2.TEN]), agg_func([T_FUN_SUM(a2.HUNDRED)], [T_FUN_COUNT(a2.HUNDRED)])
  4 - output([a2.TEN], [a2.HUNDRED]), filter(nil), rowset=256
      access([a2.TEN], [a2.HUNDRED]), partitions(p0)
      is_index_back=false, is_global_index=false, 
      range_key([a2.__pk_increment]), range(MIN ; MAX)always true
  5 - output([a1.__pk_increment], [a1.THOUSAND], [a1.UNIQUE1], [a1.UNIQUE2], [a1.UNIQUE3], [a1.TEN], [a1.HUNDRED], [a1.HUND_CLUST], [a1.HUND_NULL], [a1.CHAR_UNIQUE],
       [a1.CHAR_HUND], [a1.VCHAR_UNIQUE], [a1.VCHAR_HUND], [a1.DATE_UNIQUE], [a1.DATE_HUND], [a1.ALL_NULL], [a1.NUMERIC]), filter(nil), rowset=256
      access([a1.__pk_increment], [a1.THOUSAND], [a1.UNIQUE1], [a1.UNIQUE2], [a1.UNIQUE3], [a1.TEN], [a1.HUNDRED], [a1.HUND_CLUST], [a1.HUND_NULL], [a1.CHAR_UNIQUE],
       [a1.CHAR_HUND], [a1.VCHAR_UNIQUE], [a1.VCHAR_HUND], [a1.DATE_UNIQUE], [a1.DATE_HUND], [a1.ALL_NULL], [a1.NUMERIC]), partitions(p0)
      is_index_back=false, is_global_index=false, 
      range_key([a1.__pk_increment]), range(MIN ; MAX)always true
update t2_100 a1 set a1.thousand = a1.unique1 where a1.hundred >= (select avg(a2.hundred) from t2_100 a2 where a1.ten = a2.ten);
select/*no explain*/sum(thousand), stddev(thousand) from t2_100;
+---------------+-------------------+
| sum(thousand) | stddev(thousand)  |
+---------------+-------------------+
|          4950 | 28.86607004772212 |
+---------------+-------------------+
rollback;
EXPLAIN update t2_100 a1 set a1.thousand = (select avg(a2.hundred) from t2_100 a2 where a1.ten = a2.ten);
Query Plan
=========================================================
|ID|OPERATOR                |NAME |EST.ROWS|EST.TIME(us)|
---------------------------------------------------------
|0 |UPDATE                  |     |100     |840         |
|1 |└─HASH RIGHT OUTER JOIN |     |100     |60          |
|2 |  ├─SUBPLAN SCAN        |VIEW1|10      |20          |
|3 |  │ └─HASH GROUP BY     |     |10      |20          |
|4 |  │   └─TABLE FULL SCAN |a2   |100     |6           |
|5 |  └─TABLE FULL SCAN     |a1   |100     |26          |
=========================================================
Outputs & filters:
-------------------------------------
  0 - output(nil), filter(nil)
      table_columns([{a1: ({t2_100: (a1.__pk_increment, a1.UNIQUE1, a1.UNIQUE2, a1.UNIQUE3, a1.TEN, a1.HUNDRED, a1.THOUSAND, a1.HUND_CLUST, a1.HUND_NULL,
       a1.CHAR_UNIQUE, a1.CHAR_HUND, a1.VCHAR_UNIQUE, a1.VCHAR_HUND, a1.DATE_UNIQUE, a1.DATE_HUND, a1.ALL_NULL, a1.NUMERIC)})}]),
      update([a1.THOUSAND=column_conv(DECIMAL_INT,PS:(10,0),NULL,cast(VIEW1.avg(a2.hundred), DECIMAL_INT(10, 0)))])
  1 - output([a1.__pk_increment], [a1.UNIQUE1], [a1.UNIQUE2], [a1.UNIQUE3], [a1.TEN], [a1.HUNDRED], [a1.THOUSAND], [a1.HUND_CLUST], [a1.HUND_NULL], [a1.CHAR_UNIQUE],
       [a1.CHAR_HUND], [a1.VCHAR_UNIQUE], [a1.VCHAR_HUND], [a1.DATE_UNIQUE], [a1.DATE_HUND], [a1.ALL_NULL], [a1.NUMERIC], [VIEW1.avg(a2.hundred)]), filter(nil), rowset=256
      equal_conds([a1.TEN = VIEW1.a2.TEN]), other_conds(nil)
  2 - output([VIEW1.avg(a2.hundred)], [VIEW1.a2.TEN]), filter(nil), rowset=256
      access([VIEW1.avg(a2.hundred)], [VIEW1.a2.TEN])
  3 - output([cast(cast(T_FUN_SUM(a2.HUNDRED), DECIMAL_INT(64, 32)) / cast(T_FUN_COUNT(a2.HUNDRED), DECIMAL_INT(20, 0)), DECIMAL(14, 4))], [a2.TEN]), filter(nil), rowset=256
      group([a2.TEN]), agg_func([T_FUN_SUM(a2.HUNDRED)], [T_FUN_COUNT(a2.HUNDRED)])
  4 - output([a2.TEN], [a2.HUNDRED]), filter(nil), rowset=256
      access([a2.TEN], [a2.HUNDRED]), partitions(p0)
      is_index_back=false, is_global_index=false, 
      range_key([a2.__pk_increment]), range(MIN ; MAX)always true
  5 - output([a1.__pk_increment], [a1.THOUSAND], [a1.TEN], [a1.UNIQUE1], [a1.UNIQUE2], [a1.UNIQUE3], [a1.HUNDRED], [a1.HUND_CLUST], [a1.HUND_NULL], [a1.CHAR_UNIQUE],
       [a1.CHAR_HUND], [a1.VCHAR_UNIQUE], [a1.VCHAR_HUND], [a1.DATE_UNIQUE], [a1.DATE_HUND], [a1.ALL_NULL], [a1.NUMERIC]), filter(nil), rowset=256
      access([a1.__pk_increment], [a1.THOUSAND], [a1.TEN], [a1.UNIQUE1], [a1.UNIQUE2], [a1.UNIQUE3], [a1.HUNDRED], [a1.HUND_CLUST], [a1.HUND_NULL], [a1.CHAR_UNIQUE],
       [a1.CHAR_HUND], [a1.VCHAR_UNIQUE], [a1.VCHAR_HUND], [a1.DATE_UNIQUE], [a1.DATE_HUND], [a1.ALL_NULL], [a1.NUMERIC]), partitions(p0)
      is_index_back=false, is_global_index=false, 
      range_key([a1.__pk_increment]), range(MIN ; MAX)always true
update t2_100 a1 set a1.thousand = (select avg(a2.hundred) from t2_100 a2 where a1.ten = a2.ten);
select/*no explain*/sum(thousand), stddev(thousand) from t2_100;
+---------------+--------------------+
| sum(thousand) | stddev(thousand)   |
+---------------+--------------------+
|          4950 | 2.8722813232690143 |
+---------------+--------------------+
rollback;
EXPLAIN delete from t2_100 a1 where a1.hundred >= (select avg(a2.hundred) from t2_100 a2 where a1.ten = a2.ten);
Query Plan
========================================================
|ID|OPERATOR               |NAME |EST.ROWS|EST.TIME(us)|
--------------------------------------------------------
|0 |DELETE                 |     |10      |116         |
|1 |└─HASH JOIN            |     |10      |59          |
|2 |  ├─SUBPLAN SCAN       |VIEW1|10      |20          |
|3 |  │ └─HASH GROUP BY    |     |10      |20          |
|4 |  │   └─TABLE FULL SCAN|a2   |100     |6           |
|5 |  └─TABLE FULL SCAN    |a1   |100     |26          |
========================================================
Outputs & filters:
-------------------------------------
  0 - output(nil), filter(nil)
      table_columns([{a1: ({t2_100: (a1.__pk_increment, a1.UNIQUE1, a1.UNIQUE2, a1.UNIQUE3, a1.TEN, a1.HUNDRED, a1.THOUSAND, a1.HUND_CLUST, a1.HUND_NULL,
       a1.CHAR_UNIQUE, a1.CHAR_HUND, a1.VCHAR_UNIQUE, a1.VCHAR_HUND, a1.DATE_UNIQUE, a1.DATE_HUND, a1.ALL_NULL, a1.NUMERIC)})}])
  1 - output([a1.__pk_increment], [a1.UNIQUE1], [a1.UNIQUE2], [a1.UNIQUE3], [a1.TEN], [a1.HUNDRED], [a1.THOUSAND], [a1.HUND_CLUST], [a1.HUND_NULL], [a1.CHAR_UNIQUE],
       [a1.CHAR_HUND], [a1.VCHAR_UNIQUE], [a1.VCHAR_HUND], [a1.DATE_UNIQUE], [a1.DATE_HUND], [a1.ALL_NULL], [a1.NUMERIC]), filter(nil), rowset=256
      equal_conds([a1.TEN = VIEW1.a2.TEN]), other_conds([cast(a1.HUNDRED, DECIMAL(10, 0)) >= VIEW1.avg(a2.hundred)])
  2 - output([VIEW1.avg(a2.hundred)], [VIEW1.a2.TEN]), filter(nil), rowset=256
      access([VIEW1.avg(a2.hundred)], [VIEW1.a2.TEN])
  3 - output([cast(cast(T_FUN_SUM(a2.HUNDRED), DECIMAL_INT(64, 32)) / cast(T_FUN_COUNT(a2.HUNDRED), DECIMAL_INT(20, 0)), DECIMAL(14, 4))], [a2.TEN]), filter(nil), rowset=256
      group([a2.TEN]), agg_func([T_FUN_SUM(a2.HUNDRED)], [T_FUN_COUNT(a2.HUNDRED)])
  4 - output([a2.TEN], [a2.HUNDRED]), filter(nil), rowset=256
      access([a2.TEN], [a2.HUNDRED]), partitions(p0)
      is_index_back=false, is_global_index=false, 
      range_key([a2.__pk_increment]), range(MIN ; MAX)always true
  5 - output([a1.__pk_increment], [a1.UNIQUE1], [a1.UNIQUE2], [a1.UNIQUE3], [a1.TEN], [a1.HUNDRED], [a1.THOUSAND], [a1.HUND_CLUST], [a1.HUND_NULL], [a1.CHAR_UNIQUE],
       [a1.CHAR_HUND], [a1.VCHAR_UNIQUE], [a1.VCHAR_HUND], [a1.DATE_UNIQUE], [a1.DATE_HUND], [a1.ALL_NULL], [a1.NUMERIC]), filter(nil), rowset=256
      access([a1.__pk_increment], [a1.UNIQUE1], [a1.UNIQUE2], [a1.UNIQUE3], [a1.TEN], [a1.HUNDRED], [a1.THOUSAND], [a1.HUND_CLUST], [a1.HUND_NULL], [a1.CHAR_UNIQUE],
       [a1.CHAR_HUND], [a1.VCHAR_UNIQUE], [a1.VCHAR_HUND], [a1.DATE_UNIQUE], [a1.DATE_HUND], [a1.ALL_NULL], [a1.NUMERIC]), partitions(p0)
      is_index_back=false, is_global_index=false, 
      range_key([a1.__pk_increment]), range(MIN ; MAX)always true
delete from t2_100 a1 where a1.hundred >= (select avg(a2.hundred) from t2_100 a2 where a1.ten = a2.ten);
select/*no explain*/count(*), stddev(thousand) from t2_100;
+----------+--------------------+
| count(*) | stddev(thousand)   |
+----------+--------------------+
|       50 | 14.430869689661812 |
+----------+--------------------+
rollback;
EXPLAIN insert into tmp select avg(a1.thousand) from t2_100 a1 where a1.hundred >= (select avg(a2.hundred) from t2_100 a2 where a1.ten = a2.ten);
Query Plan
======================================================================
|ID|OPERATOR                   |NAME           |EST.ROWS|EST.TIME(us)|
----------------------------------------------------------------------
|0 |INSERT                     |               |1       |54          |
|1 |└─SUBPLAN SCAN             |ANONYMOUS_VIEW1|1       |41          |
|2 |  └─SCALAR GROUP BY        |               |1       |41          |
|3 |    └─HASH JOIN            |               |10      |41          |
|4 |      ├─SUBPLAN SCAN       |VIEW1          |10      |20          |
|5 |      │ └─HASH GROUP BY    |               |10      |20          |
|6 |      │   └─TABLE FULL SCAN|a2             |100     |6           |
|7 |      └─TABLE FULL SCAN    |a1             |100     |8           |
======================================================================
Outputs & filters:
-------------------------------------
  0 - output(nil), filter(nil)
      columns([{tmp: ({tmp: (tmp.__pk_increment, tmp.c1)})}]), partitions(p0), 
      column_values([T_HIDDEN_PK], [column_conv(INT,PS:(11,0),NULL,cast(ANONYMOUS_VIEW1.avg(a1.thousand), INT(-1, 0)))])
  1 - output([ANONYMOUS_VIEW1.avg(a1.thousand)]), filter(nil), rowset=256
      access([ANONYMOUS_VIEW1.avg(a1.thousand)])
  2 - output([cast(cast(T_FUN_SUM(a1.THOUSAND), DECIMAL_INT(64, 32)) / cast(T_FUN_COUNT(a1.THOUSAND), DECIMAL_INT(20, 0)), DECIMAL(14, 4))]), filter(nil), rowset=256
      group(nil), agg_func([T_FUN_SUM(a1.THOUSAND)], [T_FUN_COUNT(a1.THOUSAND)])
  3 - output([a1.THOUSAND]), filter(nil), rowset=256
      equal_conds([a1.TEN = VIEW1.a2.TEN]), other_conds([cast(a1.HUNDRED, DECIMAL(10, 0)) >= VIEW1.avg(a2.hundred)])
  4 - output([VIEW1.avg(a2.hundred)], [VIEW1.a2.TEN]), filter(nil), rowset=256
      access([VIEW1.avg(a2.hundred)], [VIEW1.a2.TEN])
  5 - output([cast(cast(T_FUN_SUM(a2.HUNDRED), DECIMAL_INT(64, 32)) / cast(T_FUN_COUNT(a2.HUNDRED), DECIMAL_INT(20, 0)), DECIMAL(14, 4))], [a2.TEN]), filter(nil), rowset=256
      group([a2.TEN]), agg_func([T_FUN_SUM(a2.HUNDRED)], [T_FUN_COUNT(a2.HUNDRED)])
  6 - output([a2.TEN], [a2.HUNDRED]), filter(nil), rowset=256
      access([a2.TEN], [a2.HUNDRED]), partitions(p0)
      is_index_back=false, is_global_index=false, 
      range_key([a2.__pk_increment]), range(MIN ; MAX)always true
  7 - output([a1.TEN], [a1.HUNDRED], [a1.THOUSAND]), filter(nil), rowset=256
      access([a1.TEN], [a1.HUNDRED], [a1.THOUSAND]), partitions(p0)
      is_index_back=false, is_global_index=false, 
      range_key([a1.__pk_increment]), range(MIN ; MAX)always true
insert into tmp select avg(a1.thousand) from t2_100 a1 where a1.hundred >= (select avg(a2.hundred) from t2_100 a2 where a1.ten = a2.ten);
select/*no explain*/* from tmp;
+------+
| c1   |
+------+
|   75 |
+------+
rollback;

EXPLAIN select avg(a1.thousand) from t2_100 a1 where a1.hundred >= (select avg(a2.hundred) from t2_100 a2 where a1.unique1 = a2.ten);
Query Plan
========================================================
|ID|OPERATOR               |NAME |EST.ROWS|EST.TIME(us)|
--------------------------------------------------------
|0 |SCALAR GROUP BY        |     |1       |39          |
|1 |└─HASH JOIN            |     |10      |38          |
|2 |  ├─SUBPLAN SCAN       |VIEW1|10      |20          |
|3 |  │ └─HASH GROUP BY    |     |10      |20          |
|4 |  │   └─TABLE FULL SCAN|a2   |100     |6           |
|5 |  └─TABLE FULL SCAN    |a1   |100     |8           |
========================================================
Outputs & filters:
-------------------------------------
  0 - output([cast(cast(T_FUN_SUM(a1.THOUSAND), DECIMAL_INT(64, 32)) / cast(T_FUN_COUNT(a1.THOUSAND), DECIMAL_INT(20, 0)), DECIMAL(14, 4))]), filter(nil), rowset=256
      group(nil), agg_func([T_FUN_SUM(a1.THOUSAND)], [T_FUN_COUNT(a1.THOUSAND)])
  1 - output([a1.THOUSAND]), filter(nil), rowset=256
      equal_conds([a1.UNIQUE1 = VIEW1.a2.TEN]), other_conds([cast(a1.HUNDRED, DECIMAL(10, 0)) >= VIEW1.avg(a2.hundred)])
  2 - output([VIEW1.avg(a2.hundred)], [VIEW1.a2.TEN]), filter(nil), rowset=256
      access([VIEW1.avg(a2.hundred)], [VIEW1.a2.TEN])
  3 - output([cast(cast(T_FUN_SUM(a2.HUNDRED), DECIMAL_INT(64, 32)) / cast(T_FUN_COUNT(a2.HUNDRED), DECIMAL_INT(20, 0)), DECIMAL(14, 4))], [a2.TEN]), filter(nil), rowset=256
      group([a2.TEN]), agg_func([T_FUN_SUM(a2.HUNDRED)], [T_FUN_COUNT(a2.HUNDRED)])
  4 - output([a2.TEN], [a2.HUNDRED]), filter(nil), rowset=256
      access([a2.TEN], [a2.HUNDRED]), partitions(p0)
      is_index_back=false, is_global_index=false, 
      range_key([a2.__pk_increment]), range(MIN ; MAX)always true
  5 - output([a1.UNIQUE1], [a1.HUNDRED], [a1.THOUSAND]), filter(nil), rowset=256
      access([a1.UNIQUE1], [a1.HUNDRED], [a1.THOUSAND]), partitions(p0)
      is_index_back=false, is_global_index=false, 
      range_key([a1.__pk_increment]), range(MIN ; MAX)always true
select avg(a1.thousand) from t2_100 a1 where a1.hundred >= (select avg(a2.hundred) from t2_100 a2 where a1.unique1 = a2.ten);
+------------------+
| avg(a1.thousand) |
+------------------+
|             NULL |
+------------------+
EXPLAIN select /*+no_unnest(@qb1)*/ avg(a1.thousand) from t2_100 a1 where a1.hundred >= (select /*+qb_name(qb1)*/avg(a2.hundred) from t2_100 a2 where a1.unique1 = a2.ten);
Query Plan
================================================================
|ID|OPERATOR              |NAME          |EST.ROWS|EST.TIME(us)|
----------------------------------------------------------------
|0 |SCALAR GROUP BY       |              |1       |4518        |
|1 |└─SUBPLAN FILTER      |              |34      |4517        |
|2 |  ├─TABLE FULL SCAN   |a1            |100     |8           |
|3 |  └─SCALAR GROUP BY   |              |1       |46          |
|4 |    └─TABLE RANGE SCAN|a2(T2_100_TEN)|10      |45          |
================================================================
Outputs & filters:
-------------------------------------
  0 - output([cast(cast(T_FUN_SUM(a1.THOUSAND), DECIMAL_INT(64, 32)) / cast(T_FUN_COUNT(a1.THOUSAND), DECIMAL_INT(20, 0)), DECIMAL(14, 4))]), filter(nil), rowset=256
      group(nil), agg_func([T_FUN_SUM(a1.THOUSAND)], [T_FUN_COUNT(a1.THOUSAND)])
  1 - output([a1.THOUSAND]), filter([cast(a1.HUNDRED, DECIMAL(10, 0)) >= subquery(1)]), rowset=256
      exec_params_([a1.UNIQUE1(:0)]), onetime_exprs_(nil), init_plan_idxs_(nil), use_batch=false
  2 - output([a1.UNIQUE1], [a1.HUNDRED], [a1.THOUSAND]), filter(nil), rowset=256
      access([a1.UNIQUE1], [a1.HUNDRED], [a1.THOUSAND]), partitions(p0)
      is_index_back=false, is_global_index=false, 
      range_key([a1.__pk_increment]), range(MIN ; MAX)always true
  3 - output([cast(cast(T_FUN_SUM(a2.HUNDRED), DECIMAL_INT(64, 32)) / cast(T_FUN_COUNT(a2.HUNDRED), DECIMAL_INT(20, 0)), DECIMAL(14, 4))]), filter(nil), rowset=256
      group(nil), agg_func([T_FUN_SUM(a2.HUNDRED)], [T_FUN_COUNT(a2.HUNDRED)])
  4 - output([a2.HUNDRED]), filter(nil), rowset=256
      access([a2.__pk_increment], [a2.HUNDRED]), partitions(p0)
      is_index_back=true, is_global_index=false, 
      range_key([a2.TEN], [a2.__pk_increment]), range(MIN,MIN ; MAX,MAX)always true, 
      range_cond([:0 = a2.TEN])
select /*+no_unnest(@qb1)*/ avg(a1.thousand) from t2_100 a1 where a1.hundred >= (select /*+qb_name(qb1)*/avg(a2.hundred) from t2_100 a2 where a1.unique1 = a2.ten);
+------------------+
| avg(a1.thousand) |
+------------------+
|             NULL |
+------------------+

EXPLAIN update t2_100 a1 set a1.thousand = a1.unique1 where a1.hundred >= (select avg(a2.hundred) from t2_100 a2 where a1.unique1 = a2.ten);
Query Plan
========================================================
|ID|OPERATOR               |NAME |EST.ROWS|EST.TIME(us)|
--------------------------------------------------------
|0 |UPDATE                 |     |10      |156         |
|1 |└─HASH JOIN            |     |10      |56          |
|2 |  ├─SUBPLAN SCAN       |VIEW1|10      |20          |
|3 |  │ └─HASH GROUP BY    |     |10      |20          |
|4 |  │   └─TABLE FULL SCAN|a2   |100     |6           |
|5 |  └─TABLE FULL SCAN    |a1   |100     |26          |
========================================================
Outputs & filters:
-------------------------------------
  0 - output(nil), filter(nil)
      table_columns([{a1: ({t2_100: (a1.__pk_increment, a1.UNIQUE1, a1.UNIQUE2, a1.UNIQUE3, a1.TEN, a1.HUNDRED, a1.THOUSAND, a1.HUND_CLUST, a1.HUND_NULL,
       a1.CHAR_UNIQUE, a1.CHAR_HUND, a1.VCHAR_UNIQUE, a1.VCHAR_HUND, a1.DATE_UNIQUE, a1.DATE_HUND, a1.ALL_NULL, a1.NUMERIC)})}]),
      update([a1.THOUSAND=column_conv(DECIMAL_INT,PS:(10,0),NULL,a1.UNIQUE1)])
  1 - output([a1.__pk_increment], [a1.UNIQUE1], [a1.UNIQUE2], [a1.UNIQUE3], [a1.TEN], [a1.HUNDRED], [a1.THOUSAND], [a1.HUND_CLUST], [a1.HUND_NULL], [a1.CHAR_UNIQUE],
       [a1.CHAR_HUND], [a1.VCHAR_UNIQUE], [a1.VCHAR_HUND], [a1.DATE_UNIQUE], [a1.DATE_HUND], [a1.ALL_NULL], [a1.NUMERIC]), filter(nil), rowset=256
      equal_conds([a1.UNIQUE1 = VIEW1.a2.TEN]), other_conds([cast(a1.HUNDRED, DECIMAL(10, 0)) >= VIEW1.avg(a2.hundred)])
  2 - output([VIEW1.avg(a2.hundred)], [VIEW1.a2.TEN]), filter(nil), rowset=256
      access([VIEW1.avg(a2.hundred)], [VIEW1.a2.TEN])
  3 - output([cast(cast(T_FUN_SUM(a2.HUNDRED), DECIMAL_INT(64, 32)) / cast(T_FUN_COUNT(a2.HUNDRED), DECIMAL_INT(20, 0)), DECIMAL(14, 4))], [a2.TEN]), filter(nil), rowset=256
      group([a2.TEN]), agg_func([T_FUN_SUM(a2.HUNDRED)], [T_FUN_COUNT(a2.HUNDRED)])
  4 - output([a2.TEN], [a2.HUNDRED]), filter(nil), rowset=256
      access([a2.TEN], [a2.HUNDRED]), partitions(p0)
      is_index_back=false, is_global_index=false, 
      range_key([a2.__pk_increment]), range(MIN ; MAX)always true
  5 - output([a1.__pk_increment], [a1.THOUSAND], [a1.UNIQUE1], [a1.UNIQUE2], [a1.UNIQUE3], [a1.TEN], [a1.HUNDRED], [a1.HUND_CLUST], [a1.HUND_NULL], [a1.CHAR_UNIQUE],
       [a1.CHAR_HUND], [a1.VCHAR_UNIQUE], [a1.VCHAR_HUND], [a1.DATE_UNIQUE], [a1.DATE_HUND], [a1.ALL_NULL], [a1.NUMERIC]), filter(nil), rowset=256
      access([a1.__pk_increment], [a1.THOUSAND], [a1.UNIQUE1], [a1.UNIQUE2], [a1.UNIQUE3], [a1.TEN], [a1.HUNDRED], [a1.HUND_CLUST], [a1.HUND_NULL], [a1.CHAR_UNIQUE],
       [a1.CHAR_HUND], [a1.VCHAR_UNIQUE], [a1.VCHAR_HUND], [a1.DATE_UNIQUE], [a1.DATE_HUND], [a1.ALL_NULL], [a1.NUMERIC]), partitions(p0)
      is_index_back=false, is_global_index=false, 
      range_key([a1.__pk_increment]), range(MIN ; MAX)always true
update t2_100 a1 set a1.thousand = a1.unique1 where a1.hundred >= (select avg(a2.hundred) from t2_100 a2 where a1.unique1 = a2.ten);
select/*no explain*/sum(thousand), stddev(thousand) from t2_100;
+---------------+-------------------+
| sum(thousand) | stddev(thousand)  |
+---------------+-------------------+
|          4950 | 28.86607004772212 |
+---------------+-------------------+
rollback;
EXPLAIN delete from t2_100 a1 where a1.hundred >= (select avg(a2.hundred) from t2_100 a2 where a1.unique1 = a2.ten);
Query Plan
========================================================
|ID|OPERATOR               |NAME |EST.ROWS|EST.TIME(us)|
--------------------------------------------------------
|0 |DELETE                 |     |10      |113         |
|1 |└─HASH JOIN            |     |10      |56          |
|2 |  ├─SUBPLAN SCAN       |VIEW1|10      |20          |
|3 |  │ └─HASH GROUP BY    |     |10      |20          |
|4 |  │   └─TABLE FULL SCAN|a2   |100     |6           |
|5 |  └─TABLE FULL SCAN    |a1   |100     |26          |
========================================================
Outputs & filters:
-------------------------------------
  0 - output(nil), filter(nil)
      table_columns([{a1: ({t2_100: (a1.__pk_increment, a1.UNIQUE1, a1.UNIQUE2, a1.UNIQUE3, a1.TEN, a1.HUNDRED, a1.THOUSAND, a1.HUND_CLUST, a1.HUND_NULL,
       a1.CHAR_UNIQUE, a1.CHAR_HUND, a1.VCHAR_UNIQUE, a1.VCHAR_HUND, a1.DATE_UNIQUE, a1.DATE_HUND, a1.ALL_NULL, a1.NUMERIC)})}])
  1 - output([a1.__pk_increment], [a1.UNIQUE1], [a1.UNIQUE2], [a1.UNIQUE3], [a1.TEN], [a1.HUNDRED], [a1.THOUSAND], [a1.HUND_CLUST], [a1.HUND_NULL], [a1.CHAR_UNIQUE],
       [a1.CHAR_HUND], [a1.VCHAR_UNIQUE], [a1.VCHAR_HUND], [a1.DATE_UNIQUE], [a1.DATE_HUND], [a1.ALL_NULL], [a1.NUMERIC]), filter(nil), rowset=256
      equal_conds([a1.UNIQUE1 = VIEW1.a2.TEN]), other_conds([cast(a1.HUNDRED, DECIMAL(10, 0)) >= VIEW1.avg(a2.hundred)])
  2 - output([VIEW1.avg(a2.hundred)], [VIEW1.a2.TEN]), filter(nil), rowset=256
      access([VIEW1.avg(a2.hundred)], [VIEW1.a2.TEN])
  3 - output([cast(cast(T_FUN_SUM(a2.HUNDRED), DECIMAL_INT(64, 32)) / cast(T_FUN_COUNT(a2.HUNDRED), DECIMAL_INT(20, 0)), DECIMAL(14, 4))], [a2.TEN]), filter(nil), rowset=256
      group([a2.TEN]), agg_func([T_FUN_SUM(a2.HUNDRED)], [T_FUN_COUNT(a2.HUNDRED)])
  4 - output([a2.TEN], [a2.HUNDRED]), filter(nil), rowset=256
      access([a2.TEN], [a2.HUNDRED]), partitions(p0)
      is_index_back=false, is_global_index=false, 
      range_key([a2.__pk_increment]), range(MIN ; MAX)always true
  5 - output([a1.__pk_increment], [a1.UNIQUE1], [a1.UNIQUE2], [a1.UNIQUE3], [a1.TEN], [a1.HUNDRED], [a1.THOUSAND], [a1.HUND_CLUST], [a1.HUND_NULL], [a1.CHAR_UNIQUE],
       [a1.CHAR_HUND], [a1.VCHAR_UNIQUE], [a1.VCHAR_HUND], [a1.DATE_UNIQUE], [a1.DATE_HUND], [a1.ALL_NULL], [a1.NUMERIC]), filter(nil), rowset=256
      access([a1.__pk_increment], [a1.UNIQUE1], [a1.UNIQUE2], [a1.UNIQUE3], [a1.TEN], [a1.HUNDRED], [a1.THOUSAND], [a1.HUND_CLUST], [a1.HUND_NULL], [a1.CHAR_UNIQUE],
       [a1.CHAR_HUND], [a1.VCHAR_UNIQUE], [a1.VCHAR_HUND], [a1.DATE_UNIQUE], [a1.DATE_HUND], [a1.ALL_NULL], [a1.NUMERIC]), partitions(p0)
      is_index_back=false, is_global_index=false, 
      range_key([a1.__pk_increment]), range(MIN ; MAX)always true
delete from t2_100 a1 where a1.hundred >= (select avg(a2.hundred) from t2_100 a2 where a1.unique1 = a2.ten);
select/*no explain*/count(*), stddev(thousand) from t2_100;
+----------+-------------------+
| count(*) | stddev(thousand)  |
+----------+-------------------+
|      100 | 28.86607004772212 |
+----------+-------------------+
rollback;
EXPLAIN insert into tmp select avg(a1.thousand) from t2_100 a1 where a1.hundred >= (select avg(a2.hundred) from t2_100 a2 where a1.unique1 = a2.ten);
Query Plan
======================================================================
|ID|OPERATOR                   |NAME           |EST.ROWS|EST.TIME(us)|
----------------------------------------------------------------------
|0 |INSERT                     |               |1       |52          |
|1 |└─SUBPLAN SCAN             |ANONYMOUS_VIEW1|1       |39          |
|2 |  └─SCALAR GROUP BY        |               |1       |39          |
|3 |    └─HASH JOIN            |               |10      |38          |
|4 |      ├─SUBPLAN SCAN       |VIEW1          |10      |20          |
|5 |      │ └─HASH GROUP BY    |               |10      |20          |
|6 |      │   └─TABLE FULL SCAN|a2             |100     |6           |
|7 |      └─TABLE FULL SCAN    |a1             |100     |8           |
======================================================================
Outputs & filters:
-------------------------------------
  0 - output(nil), filter(nil)
      columns([{tmp: ({tmp: (tmp.__pk_increment, tmp.c1)})}]), partitions(p0), 
      column_values([T_HIDDEN_PK], [column_conv(INT,PS:(11,0),NULL,cast(ANONYMOUS_VIEW1.avg(a1.thousand), INT(-1, 0)))])
  1 - output([ANONYMOUS_VIEW1.avg(a1.thousand)]), filter(nil), rowset=256
      access([ANONYMOUS_VIEW1.avg(a1.thousand)])
  2 - output([cast(cast(T_FUN_SUM(a1.THOUSAND), DECIMAL_INT(64, 32)) / cast(T_FUN_COUNT(a1.THOUSAND), DECIMAL_INT(20, 0)), DECIMAL(14, 4))]), filter(nil), rowset=256
      group(nil), agg_func([T_FUN_SUM(a1.THOUSAND)], [T_FUN_COUNT(a1.THOUSAND)])
  3 - output([a1.THOUSAND]), filter(nil), rowset=256
      equal_conds([a1.UNIQUE1 = VIEW1.a2.TEN]), other_conds([cast(a1.HUNDRED, DECIMAL(10, 0)) >= VIEW1.avg(a2.hundred)])
  4 - output([VIEW1.avg(a2.hundred)], [VIEW1.a2.TEN]), filter(nil), rowset=256
      access([VIEW1.avg(a2.hundred)], [VIEW1.a2.TEN])
  5 - output([cast(cast(T_FUN_SUM(a2.HUNDRED), DECIMAL_INT(64, 32)) / cast(T_FUN_COUNT(a2.HUNDRED), DECIMAL_INT(20, 0)), DECIMAL(14, 4))], [a2.TEN]), filter(nil), rowset=256
      group([a2.TEN]), agg_func([T_FUN_SUM(a2.HUNDRED)], [T_FUN_COUNT(a2.HUNDRED)])
  6 - output([a2.TEN], [a2.HUNDRED]), filter(nil), rowset=256
      access([a2.TEN], [a2.HUNDRED]), partitions(p0)
      is_index_back=false, is_global_index=false, 
      range_key([a2.__pk_increment]), range(MIN ; MAX)always true
  7 - output([a1.UNIQUE1], [a1.HUNDRED], [a1.THOUSAND]), filter(nil), rowset=256
      access([a1.UNIQUE1], [a1.HUNDRED], [a1.THOUSAND]), partitions(p0)
      is_index_back=false, is_global_index=false, 
      range_key([a1.__pk_increment]), range(MIN ; MAX)always true
insert into tmp select avg(a1.thousand) from t2_100 a1 where a1.hundred >= (select avg(a2.hundred) from t2_100 a2 where a1.unique1 = a2.ten);
select/*no explain*/* from tmp;
+------+
| c1   |
+------+
| NULL |
+------+
rollback;

EXPLAIN select avg(a1.thousand) from t2_100 a1 where a1.hundred >= (select avg(a2.hundred) from t2_100 a2 where a1.ten + 2 = a2.ten + 2);
Query Plan
========================================================
|ID|OPERATOR               |NAME |EST.ROWS|EST.TIME(us)|
--------------------------------------------------------
|0 |SCALAR GROUP BY        |     |1       |42          |
|1 |└─HASH JOIN            |     |10      |42          |
|2 |  ├─SUBPLAN SCAN       |VIEW1|10      |20          |
|3 |  │ └─HASH GROUP BY    |     |10      |20          |
|4 |  │   └─TABLE FULL SCAN|a2   |100     |6           |
|5 |  └─TABLE FULL SCAN    |a1   |100     |8           |
========================================================
Outputs & filters:
-------------------------------------
  0 - output([cast(cast(T_FUN_SUM(a1.THOUSAND), DECIMAL_INT(64, 32)) / cast(T_FUN_COUNT(a1.THOUSAND), DECIMAL_INT(20, 0)), DECIMAL(14, 4))]), filter(nil), rowset=256
      group(nil), agg_func([T_FUN_SUM(a1.THOUSAND)], [T_FUN_COUNT(a1.THOUSAND)])
  1 - output([a1.THOUSAND]), filter(nil), rowset=256
      equal_conds([a1.TEN + cast(2, DECIMAL_INT(11, 0)) = VIEW1.a2.TEN + cast(2, DECIMAL_INT(11, 0))]), other_conds([cast(a1.HUNDRED, DECIMAL(10, 0)) >= 
      VIEW1.avg(a2.hundred)])
  2 - output([VIEW1.avg(a2.hundred)], [VIEW1.a2.TEN + cast(2, DECIMAL_INT(11, 0))]), filter(nil), rowset=256
      access([VIEW1.avg(a2.hundred)], [VIEW1.a2.TEN + cast(2, DECIMAL_INT(11, 0))])
  3 - output([cast(cast(T_FUN_SUM(a2.HUNDRED), DECIMAL_INT(64, 32)) / cast(T_FUN_COUNT(a2.HUNDRED), DECIMAL_INT(20, 0)), DECIMAL(14, 4))], [a2.TEN + cast(2,
       DECIMAL_INT(11, 0))]), filter(nil), rowset=256
      group([a2.TEN + cast(2, DECIMAL_INT(11, 0))]), agg_func([T_FUN_SUM(a2.HUNDRED)], [T_FUN_COUNT(a2.HUNDRED)])
  4 - output([a2.TEN], [a2.HUNDRED]), filter(nil), rowset=256
      access([a2.TEN], [a2.HUNDRED]), partitions(p0)
      is_index_back=false, is_global_index=false, 
      range_key([a2.__pk_increment]), range(MIN ; MAX)always true
  5 - output([a1.TEN], [a1.HUNDRED], [a1.THOUSAND]), filter(nil), rowset=256
      access([a1.TEN], [a1.HUNDRED], [a1.THOUSAND]), partitions(p0)
      is_index_back=false, is_global_index=false, 
      range_key([a1.__pk_increment]), range(MIN ; MAX)always true
select avg(a1.thousand) from t2_100 a1 where a1.hundred >= (select avg(a2.hundred) from t2_100 a2 where a1.ten + 2 = a2.ten + 2);
+------------------+
| avg(a1.thousand) |
+------------------+
|          74.5000 |
+------------------+
EXPLAIN select /*+no_unnest(@qb1)*/ avg(a1.thousand) from t2_100 a1 where a1.hundred >= (select /*+qb_name(qb1)*/avg(a2.hundred) from t2_100 a2 where a1.ten + 2 = a2.ten + 2);
Query Plan
=====================================================
|ID|OPERATOR             |NAME|EST.ROWS|EST.TIME(us)|
-----------------------------------------------------
|0 |SCALAR GROUP BY      |    |1       |1835        |
|1 |└─SUBPLAN FILTER     |    |34      |1834        |
|2 |  ├─TABLE FULL SCAN  |a1  |100     |8           |
|3 |  └─SCALAR GROUP BY  |    |1       |19          |
|4 |    └─TABLE FULL SCAN|a2  |10      |18          |
=====================================================
Outputs & filters:
-------------------------------------
  0 - output([cast(cast(T_FUN_SUM(a1.THOUSAND), DECIMAL_INT(64, 32)) / cast(T_FUN_COUNT(a1.THOUSAND), DECIMAL_INT(20, 0)), DECIMAL(14, 4))]), filter(nil), rowset=256
      group(nil), agg_func([T_FUN_SUM(a1.THOUSAND)], [T_FUN_COUNT(a1.THOUSAND)])
  1 - output([a1.THOUSAND]), filter([cast(a1.HUNDRED, DECIMAL(10, 0)) >= subquery(1)]), rowset=256
      exec_params_([a1.TEN(:0)]), onetime_exprs_(nil), init_plan_idxs_(nil), use_batch=false
  2 - output([a1.TEN], [a1.HUNDRED], [a1.THOUSAND]), filter(nil), rowset=256
      access([a1.TEN], [a1.HUNDRED], [a1.THOUSAND]), partitions(p0)
      is_index_back=false, is_global_index=false, 
      range_key([a1.__pk_increment]), range(MIN ; MAX)always true
  3 - output([cast(cast(T_FUN_SUM(T_FUN_SUM(a2.HUNDRED)), DECIMAL_INT(64, 32)) / cast(T_FUN_COUNT_SUM(T_FUN_COUNT(a2.HUNDRED)), DECIMAL_INT(20, 0)), DECIMAL(14,
       4))]), filter(nil), rowset=256
      group(nil), agg_func([T_FUN_SUM(T_FUN_SUM(a2.HUNDRED))], [T_FUN_COUNT_SUM(T_FUN_COUNT(a2.HUNDRED))])
  4 - output([T_FUN_SUM(a2.HUNDRED)], [T_FUN_COUNT(a2.HUNDRED)]), filter([:0 + cast(2, DECIMAL_INT(11, 0)) = a2.TEN + cast(2, DECIMAL_INT(11, 0))]), rowset=256
      access([a2.TEN], [a2.HUNDRED]), partitions(p0)
      is_index_back=false, is_global_index=false, filter_before_indexback[false], 
      range_key([a2.__pk_increment]), range(MIN ; MAX)always true, 
      pushdown_aggregation([T_FUN_SUM(a2.HUNDRED)], [T_FUN_COUNT(a2.HUNDRED)])
select /*+no_unnest(@qb1)*/ avg(a1.thousand) from t2_100 a1 where a1.hundred >= (select /*+qb_name(qb1)*/avg(a2.hundred) from t2_100 a2 where a1.ten + 2 = a2.ten + 2);
+------------------+
| avg(a1.thousand) |
+------------------+
|          74.5000 |
+------------------+

EXPLAIN update t2_100 a1 set a1.thousand = a1.unique1 where a1.hundred >= (select avg(a2.hundred) from t2_100 a2 where a1.ten + 2 = a2.ten + 2);
Query Plan
========================================================
|ID|OPERATOR               |NAME |EST.ROWS|EST.TIME(us)|
--------------------------------------------------------
|0 |UPDATE                 |     |10      |160         |
|1 |└─HASH JOIN            |     |10      |60          |
|2 |  ├─SUBPLAN SCAN       |VIEW1|10      |20          |
|3 |  │ └─HASH GROUP BY    |     |10      |20          |
|4 |  │   └─TABLE FULL SCAN|a2   |100     |6           |
|5 |  └─TABLE FULL SCAN    |a1   |100     |26          |
========================================================
Outputs & filters:
-------------------------------------
  0 - output(nil), filter(nil)
      table_columns([{a1: ({t2_100: (a1.__pk_increment, a1.UNIQUE1, a1.UNIQUE2, a1.UNIQUE3, a1.TEN, a1.HUNDRED, a1.THOUSAND, a1.HUND_CLUST, a1.HUND_NULL,
       a1.CHAR_UNIQUE, a1.CHAR_HUND, a1.VCHAR_UNIQUE, a1.VCHAR_HUND, a1.DATE_UNIQUE, a1.DATE_HUND, a1.ALL_NULL, a1.NUMERIC)})}]),
      update([a1.THOUSAND=column_conv(DECIMAL_INT,PS:(10,0),NULL,a1.UNIQUE1)])
  1 - output([a1.__pk_increment], [a1.UNIQUE1], [a1.UNIQUE2], [a1.UNIQUE3], [a1.TEN], [a1.HUNDRED], [a1.THOUSAND], [a1.HUND_CLUST], [a1.HUND_NULL], [a1.CHAR_UNIQUE],
       [a1.CHAR_HUND], [a1.VCHAR_UNIQUE], [a1.VCHAR_HUND], [a1.DATE_UNIQUE], [a1.DATE_HUND], [a1.ALL_NULL], [a1.NUMERIC]), filter(nil), rowset=256
      equal_conds([a1.TEN + cast(2, DECIMAL_INT(11, 0)) = VIEW1.a2.TEN + cast(2, DECIMAL_INT(11, 0))]), other_conds([cast(a1.HUNDRED, DECIMAL(10, 0)) >= 
      VIEW1.avg(a2.hundred)])
  2 - output([VIEW1.avg(a2.hundred)], [VIEW1.a2.TEN + cast(2, DECIMAL_INT(11, 0))]), filter(nil), rowset=256
      access([VIEW1.avg(a2.hundred)], [VIEW1.a2.TEN + cast(2, DECIMAL_INT(11, 0))])
  3 - output([cast(cast(T_FUN_SUM(a2.HUNDRED), DECIMAL_INT(64, 32)) / cast(T_FUN_COUNT(a2.HUNDRED), DECIMAL_INT(20, 0)), DECIMAL(14, 4))], [a2.TEN + cast(2,
       DECIMAL_INT(11, 0))]), filter(nil), rowset=256
      group([a2.TEN + cast(2, DECIMAL_INT(11, 0))]), agg_func([T_FUN_SUM(a2.HUNDRED)], [T_FUN_COUNT(a2.HUNDRED)])
  4 - output([a2.TEN], [a2.HUNDRED]), filter(nil), rowset=256
      access([a2.TEN], [a2.HUNDRED]), partitions(p0)
      is_index_back=false, is_global_index=false, 
      range_key([a2.__pk_increment]), range(MIN ; MAX)always true
  5 - output([a1.__pk_increment], [a1.THOUSAND], [a1.UNIQUE1], [a1.UNIQUE2], [a1.UNIQUE3], [a1.TEN], [a1.HUNDRED], [a1.HUND_CLUST], [a1.HUND_NULL], [a1.CHAR_UNIQUE],
       [a1.CHAR_HUND], [a1.VCHAR_UNIQUE], [a1.VCHAR_HUND], [a1.DATE_UNIQUE], [a1.DATE_HUND], [a1.ALL_NULL], [a1.NUMERIC]), filter(nil), rowset=256
      access([a1.__pk_increment], [a1.THOUSAND], [a1.UNIQUE1], [a1.UNIQUE2], [a1.UNIQUE3], [a1.TEN], [a1.HUNDRED], [a1.HUND_CLUST], [a1.HUND_NULL], [a1.CHAR_UNIQUE],
       [a1.CHAR_HUND], [a1.VCHAR_UNIQUE], [a1.VCHAR_HUND], [a1.DATE_UNIQUE], [a1.DATE_HUND], [a1.ALL_NULL], [a1.NUMERIC]), partitions(p0)
      is_index_back=false, is_global_index=false, 
      range_key([a1.__pk_increment]), range(MIN ; MAX)always true
update t2_100 a1 set a1.thousand = a1.unique1 where a1.hundred >= (select avg(a2.hundred) from t2_100 a2 where a1.ten + 2 = a2.ten + 2);
select/*no explain*/sum(thousand), stddev(thousand) from t2_100;
+---------------+-------------------+
| sum(thousand) | stddev(thousand)  |
+---------------+-------------------+
|          4950 | 28.86607004772212 |
+---------------+-------------------+
rollback;
EXPLAIN delete from t2_100 a1 where a1.hundred >= (select avg(a2.hundred) from t2_100 a2 where a1.ten + 2 = a2.ten + 2);
Query Plan
========================================================
|ID|OPERATOR               |NAME |EST.ROWS|EST.TIME(us)|
--------------------------------------------------------
|0 |DELETE                 |     |10      |117         |
|1 |└─HASH JOIN            |     |10      |60          |
|2 |  ├─SUBPLAN SCAN       |VIEW1|10      |20          |
|3 |  │ └─HASH GROUP BY    |     |10      |20          |
|4 |  │   └─TABLE FULL SCAN|a2   |100     |6           |
|5 |  └─TABLE FULL SCAN    |a1   |100     |26          |
========================================================
Outputs & filters:
-------------------------------------
  0 - output(nil), filter(nil)
      table_columns([{a1: ({t2_100: (a1.__pk_increment, a1.UNIQUE1, a1.UNIQUE2, a1.UNIQUE3, a1.TEN, a1.HUNDRED, a1.THOUSAND, a1.HUND_CLUST, a1.HUND_NULL,
       a1.CHAR_UNIQUE, a1.CHAR_HUND, a1.VCHAR_UNIQUE, a1.VCHAR_HUND, a1.DATE_UNIQUE, a1.DATE_HUND, a1.ALL_NULL, a1.NUMERIC)})}])
  1 - output([a1.__pk_increment], [a1.UNIQUE1], [a1.UNIQUE2], [a1.UNIQUE3], [a1.TEN], [a1.HUNDRED], [a1.THOUSAND], [a1.HUND_CLUST], [a1.HUND_NULL], [a1.CHAR_UNIQUE],
       [a1.CHAR_HUND], [a1.VCHAR_UNIQUE], [a1.VCHAR_HUND], [a1.DATE_UNIQUE], [a1.DATE_HUND], [a1.ALL_NULL], [a1.NUMERIC]), filter(nil), rowset=256
      equal_conds([a1.TEN + cast(2, DECIMAL_INT(11, 0)) = VIEW1.a2.TEN + cast(2, DECIMAL_INT(11, 0))]), other_conds([cast(a1.HUNDRED, DECIMAL(10, 0)) >= 
      VIEW1.avg(a2.hundred)])
  2 - output([VIEW1.avg(a2.hundred)], [VIEW1.a2.TEN + cast(2, DECIMAL_INT(11, 0))]), filter(nil), rowset=256
      access([VIEW1.avg(a2.hundred)], [VIEW1.a2.TEN + cast(2, DECIMAL_INT(11, 0))])
  3 - output([cast(cast(T_FUN_SUM(a2.HUNDRED), DECIMAL_INT(64, 32)) / cast(T_FUN_COUNT(a2.HUNDRED), DECIMAL_INT(20, 0)), DECIMAL(14, 4))], [a2.TEN + cast(2,
       DECIMAL_INT(11, 0))]), filter(nil), rowset=256
      group([a2.TEN + cast(2, DECIMAL_INT(11, 0))]), agg_func([T_FUN_SUM(a2.HUNDRED)], [T_FUN_COUNT(a2.HUNDRED)])
  4 - output([a2.TEN], [a2.HUNDRED]), filter(nil), rowset=256
      access([a2.TEN], [a2.HUNDRED]), partitions(p0)
      is_index_back=false, is_global_index=false, 
      range_key([a2.__pk_increment]), range(MIN ; MAX)always true
  5 - output([a1.__pk_increment], [a1.UNIQUE1], [a1.UNIQUE2], [a1.UNIQUE3], [a1.TEN], [a1.HUNDRED], [a1.THOUSAND], [a1.HUND_CLUST], [a1.HUND_NULL], [a1.CHAR_UNIQUE],
       [a1.CHAR_HUND], [a1.VCHAR_UNIQUE], [a1.VCHAR_HUND], [a1.DATE_UNIQUE], [a1.DATE_HUND], [a1.ALL_NULL], [a1.NUMERIC]), filter(nil), rowset=256
      access([a1.__pk_increment], [a1.UNIQUE1], [a1.UNIQUE2], [a1.UNIQUE3], [a1.TEN], [a1.HUNDRED], [a1.THOUSAND], [a1.HUND_CLUST], [a1.HUND_NULL], [a1.CHAR_UNIQUE],
       [a1.CHAR_HUND], [a1.VCHAR_UNIQUE], [a1.VCHAR_HUND], [a1.DATE_UNIQUE], [a1.DATE_HUND], [a1.ALL_NULL], [a1.NUMERIC]), partitions(p0)
      is_index_back=false, is_global_index=false, 
      range_key([a1.__pk_increment]), range(MIN ; MAX)always true
delete from t2_100 a1 where a1.hundred >= (select avg(a2.hundred) from t2_100 a2 where a1.ten + 2 = a2.ten + 2);
select/*no explain*/count(*), stddev(thousand) from t2_100;
+----------+--------------------+
| count(*) | stddev(thousand)   |
+----------+--------------------+
|       50 | 14.430869689661812 |
+----------+--------------------+
rollback;
EXPLAIN insert into tmp select avg(a1.thousand) from t2_100 a1 where a1.hundred >= (select avg(a2.hundred) from t2_100 a2 where a1.ten + 2 = a2.ten + 2);
Query Plan
======================================================================
|ID|OPERATOR                   |NAME           |EST.ROWS|EST.TIME(us)|
----------------------------------------------------------------------
|0 |INSERT                     |               |1       |55          |
|1 |└─SUBPLAN SCAN             |ANONYMOUS_VIEW1|1       |42          |
|2 |  └─SCALAR GROUP BY        |               |1       |42          |
|3 |    └─HASH JOIN            |               |10      |42          |
|4 |      ├─SUBPLAN SCAN       |VIEW1          |10      |20          |
|5 |      │ └─HASH GROUP BY    |               |10      |20          |
|6 |      │   └─TABLE FULL SCAN|a2             |100     |6           |
|7 |      └─TABLE FULL SCAN    |a1             |100     |8           |
======================================================================
Outputs & filters:
-------------------------------------
  0 - output(nil), filter(nil)
      columns([{tmp: ({tmp: (tmp.__pk_increment, tmp.c1)})}]), partitions(p0), 
      column_values([T_HIDDEN_PK], [column_conv(INT,PS:(11,0),NULL,cast(ANONYMOUS_VIEW1.avg(a1.thousand), INT(-1, 0)))])
  1 - output([ANONYMOUS_VIEW1.avg(a1.thousand)]), filter(nil), rowset=256
      access([ANONYMOUS_VIEW1.avg(a1.thousand)])
  2 - output([cast(cast(T_FUN_SUM(a1.THOUSAND), DECIMAL_INT(64, 32)) / cast(T_FUN_COUNT(a1.THOUSAND), DECIMAL_INT(20, 0)), DECIMAL(14, 4))]), filter(nil), rowset=256
      group(nil), agg_func([T_FUN_SUM(a1.THOUSAND)], [T_FUN_COUNT(a1.THOUSAND)])
  3 - output([a1.THOUSAND]), filter(nil), rowset=256
      equal_conds([a1.TEN + cast(2, DECIMAL_INT(11, 0)) = VIEW1.a2.TEN + cast(2, DECIMAL_INT(11, 0))]), other_conds([cast(a1.HUNDRED, DECIMAL(10, 0)) >= 
      VIEW1.avg(a2.hundred)])
  4 - output([VIEW1.avg(a2.hundred)], [VIEW1.a2.TEN + cast(2, DECIMAL_INT(11, 0))]), filter(nil), rowset=256
      access([VIEW1.avg(a2.hundred)], [VIEW1.a2.TEN + cast(2, DECIMAL_INT(11, 0))])
  5 - output([cast(cast(T_FUN_SUM(a2.HUNDRED), DECIMAL_INT(64, 32)) / cast(T_FUN_COUNT(a2.HUNDRED), DECIMAL_INT(20, 0)), DECIMAL(14, 4))], [a2.TEN + cast(2,
       DECIMAL_INT(11, 0))]), filter(nil), rowset=256
      group([a2.TEN + cast(2, DECIMAL_INT(11, 0))]), agg_func([T_FUN_SUM(a2.HUNDRED)], [T_FUN_COUNT(a2.HUNDRED)])
  6 - output([a2.TEN], [a2.HUNDRED]), filter(nil), rowset=256
      access([a2.TEN], [a2.HUNDRED]), partitions(p0)
      is_index_back=false, is_global_index=false, 
      range_key([a2.__pk_increment]), range(MIN ; MAX)always true
  7 - output([a1.TEN], [a1.HUNDRED], [a1.THOUSAND]), filter(nil), rowset=256
      access([a1.TEN], [a1.HUNDRED], [a1.THOUSAND]), partitions(p0)
      is_index_back=false, is_global_index=false, 
      range_key([a1.__pk_increment]), range(MIN ; MAX)always true
insert into tmp select avg(a1.thousand) from t2_100 a1 where a1.hundred >= (select avg(a2.hundred) from t2_100 a2 where a1.ten + 2 = a2.ten + 2);
select/*no explain*/* from tmp;
+------+
| c1   |
+------+
|   75 |
+------+
rollback;

EXPLAIN select avg(a1.thousand) from t2_100 a1 where a1.hundred >= (select avg(a2.hundred) from t2_100 a2 where a1.ten + a1.unique1 = a2.ten + a2.unique1);
Query Plan
========================================================
|ID|OPERATOR               |NAME |EST.ROWS|EST.TIME(us)|
--------------------------------------------------------
|0 |SCALAR GROUP BY        |     |1       |90          |
|1 |└─HASH JOIN            |     |100     |87          |
|2 |  ├─SUBPLAN SCAN       |VIEW1|100     |45          |
|3 |  │ └─HASH GROUP BY    |     |100     |44          |
|4 |  │   └─TABLE FULL SCAN|a2   |100     |8           |
|5 |  └─TABLE FULL SCAN    |a1   |100     |9           |
========================================================
Outputs & filters:
-------------------------------------
  0 - output([cast(cast(T_FUN_SUM(a1.THOUSAND), DECIMAL_INT(64, 32)) / cast(T_FUN_COUNT(a1.THOUSAND), DECIMAL_INT(20, 0)), DECIMAL(14, 4))]), filter(nil), rowset=256
      group(nil), agg_func([T_FUN_SUM(a1.THOUSAND)], [T_FUN_COUNT(a1.THOUSAND)])
  1 - output([a1.THOUSAND]), filter(nil), rowset=256
      equal_conds([a1.TEN + a1.UNIQUE1 = VIEW1.a2.TEN + a2.UNIQUE1]), other_conds([cast(a1.HUNDRED, DECIMAL(10, 0)) >= VIEW1.avg(a2.hundred)])
  2 - output([VIEW1.avg(a2.hundred)], [VIEW1.a2.TEN + a2.UNIQUE1]), filter(nil), rowset=256
      access([VIEW1.avg(a2.hundred)], [VIEW1.a2.TEN + a2.UNIQUE1])
  3 - output([cast(cast(T_FUN_SUM(a2.HUNDRED), DECIMAL_INT(64, 32)) / cast(T_FUN_COUNT(a2.HUNDRED), DECIMAL_INT(20, 0)), DECIMAL(14, 4))], [a2.TEN + a2.UNIQUE1]), filter(nil), rowset=256
      group([a2.TEN + a2.UNIQUE1]), agg_func([T_FUN_SUM(a2.HUNDRED)], [T_FUN_COUNT(a2.HUNDRED)])
  4 - output([a2.TEN], [a2.UNIQUE1], [a2.HUNDRED]), filter(nil), rowset=256
      access([a2.TEN], [a2.UNIQUE1], [a2.HUNDRED]), partitions(p0)
      is_index_back=false, is_global_index=false, 
      range_key([a2.__pk_increment]), range(MIN ; MAX)always true
  5 - output([a1.TEN], [a1.UNIQUE1], [a1.HUNDRED], [a1.THOUSAND]), filter(nil), rowset=256
      access([a1.TEN], [a1.UNIQUE1], [a1.HUNDRED], [a1.THOUSAND]), partitions(p0)
      is_index_back=false, is_global_index=false, 
      range_key([a1.__pk_increment]), range(MIN ; MAX)always true
select avg(a1.thousand) from t2_100 a1 where a1.hundred >= (select avg(a2.hundred) from t2_100 a2 where a1.ten + a1.unique1 = a2.ten + a2.unique1);
+------------------+
| avg(a1.thousand) |
+------------------+
|          51.5455 |
+------------------+
EXPLAIN select /*+no_unnest(@qb1)*/ avg(a1.thousand) from t2_100 a1 where a1.hundred >= (select /*+qb_name(qb1)*/avg(a2.hundred) from t2_100 a2 where a1.ten + a1.unique1 = a2.ten + a2.unique1);
Query Plan
=====================================================
|ID|OPERATOR             |NAME|EST.ROWS|EST.TIME(us)|
-----------------------------------------------------
|0 |SCALAR GROUP BY      |    |1       |1806        |
|1 |└─SUBPLAN FILTER     |    |34      |1805        |
|2 |  ├─TABLE FULL SCAN  |a1  |100     |9           |
|3 |  └─SCALAR GROUP BY  |    |1       |18          |
|4 |    └─TABLE FULL SCAN|a2  |1       |18          |
=====================================================
Outputs & filters:
-------------------------------------
  0 - output([cast(cast(T_FUN_SUM(a1.THOUSAND), DECIMAL_INT(64, 32)) / cast(T_FUN_COUNT(a1.THOUSAND), DECIMAL_INT(20, 0)), DECIMAL(14, 4))]), filter(nil), rowset=256
      group(nil), agg_func([T_FUN_SUM(a1.THOUSAND)], [T_FUN_COUNT(a1.THOUSAND)])
  1 - output([a1.THOUSAND]), filter([cast(a1.HUNDRED, DECIMAL(10, 0)) >= subquery(1)]), rowset=256
      exec_params_([a1.TEN(:0)], [a1.UNIQUE1(:1)]), onetime_exprs_(nil), init_plan_idxs_(nil), use_batch=false
  2 - output([a1.TEN], [a1.UNIQUE1], [a1.HUNDRED], [a1.THOUSAND]), filter(nil), rowset=256
      access([a1.TEN], [a1.UNIQUE1], [a1.HUNDRED], [a1.THOUSAND]), partitions(p0)
      is_index_back=false, is_global_index=false, 
      range_key([a1.__pk_increment]), range(MIN ; MAX)always true
  3 - output([cast(cast(T_FUN_SUM(T_FUN_SUM(a2.HUNDRED)), DECIMAL_INT(64, 32)) / cast(T_FUN_COUNT_SUM(T_FUN_COUNT(a2.HUNDRED)), DECIMAL_INT(20, 0)), DECIMAL(14,
       4))]), filter(nil), rowset=256
      group(nil), agg_func([T_FUN_SUM(T_FUN_SUM(a2.HUNDRED))], [T_FUN_COUNT_SUM(T_FUN_COUNT(a2.HUNDRED))])
  4 - output([T_FUN_SUM(a2.HUNDRED)], [T_FUN_COUNT(a2.HUNDRED)]), filter([:0 + :1 = a2.TEN + a2.UNIQUE1]), rowset=256
      access([a2.TEN], [a2.UNIQUE1], [a2.HUNDRED]), partitions(p0)
      is_index_back=false, is_global_index=false, filter_before_indexback[false], 
      range_key([a2.__pk_increment]), range(MIN ; MAX)always true, 
      pushdown_aggregation([T_FUN_SUM(a2.HUNDRED)], [T_FUN_COUNT(a2.HUNDRED)])
select /*+no_unnest(@qb1)*/ avg(a1.thousand) from t2_100 a1 where a1.hundred >= (select /*+qb_name(qb1)*/avg(a2.hundred) from t2_100 a2 where a1.ten + a1.unique1 = a2.ten + a2.unique1);
+------------------+
| avg(a1.thousand) |
+------------------+
|          51.5455 |
+------------------+

EXPLAIN update t2_100 a1 set a1.thousand = a1.unique1 where a1.hundred >= (select avg(a2.hundred) from t2_100 a2 where a1.ten + a1.unique1 = a2.ten + a2.unique1);
Query Plan
========================================================
|ID|OPERATOR               |NAME |EST.ROWS|EST.TIME(us)|
--------------------------------------------------------
|0 |UPDATE                 |     |3       |190         |
|1 |└─SUBPLAN SCAN         |VIEW1|3       |147         |
|2 |  └─WINDOW FUNCTION    |     |50      |146         |
|3 |    └─PARTITION SORT   |     |50      |52          |
|4 |      └─TABLE FULL SCAN|a2   |50      |19          |
========================================================
Outputs & filters:
-------------------------------------
  0 - output(nil), filter(nil)
      table_columns([{VIEW1: ({t2_100: (VIEW1.a2.__pk_increment, VIEW1.a2.UNIQUE1, VIEW1.a2.UNIQUE2, VIEW1.a2.UNIQUE3, VIEW1.a2.TEN, VIEW1.a2.HUNDRED, VIEW1.a2.THOUSAND,
       VIEW1.a2.HUND_CLUST, VIEW1.a2.HUND_NULL, VIEW1.a2.CHAR_UNIQUE, VIEW1.a2.CHAR_HUND, VIEW1.a2.VCHAR_UNIQUE, VIEW1.a2.VCHAR_HUND, VIEW1.a2.DATE_UNIQUE, VIEW1.a2.DATE_HUND,
       VIEW1.a2.ALL_NULL, VIEW1.a2.NUMERIC)})}]),
      update([VIEW1.a2.THOUSAND=column_conv(DECIMAL_INT,PS:(10,0),NULL,VIEW1.a2.UNIQUE1)])
  1 - output([VIEW1.a2.__pk_increment], [VIEW1.a2.THOUSAND], [VIEW1.a2.UNIQUE1], [VIEW1.a2.UNIQUE2], [VIEW1.a2.UNIQUE3], [VIEW1.a2.TEN], [VIEW1.a2.HUNDRED],
       [VIEW1.a2.HUND_CLUST], [VIEW1.a2.HUND_NULL], [VIEW1.a2.CHAR_UNIQUE], [VIEW1.a2.CHAR_HUND], [VIEW1.a2.VCHAR_UNIQUE], [VIEW1.a2.VCHAR_HUND], [VIEW1.a2.DATE_UNIQUE],
       [VIEW1.a2.DATE_HUND], [VIEW1.a2.ALL_NULL], [VIEW1.a2.NUMERIC]), filter([cast(VIEW1.a2.HUNDRED, DECIMAL(10, 0)) >= VIEW1.avg(a2.hundred)], [VIEW1.a2.TEN 
      + VIEW1.a2.UNIQUE1 = VIEW1.a2.TEN + a2.UNIQUE1]), rowset=256
      access([VIEW1.avg(a2.hundred)], [VIEW1.a2.TEN + a2.UNIQUE1], [VIEW1.a2.__pk_increment], [VIEW1.a2.THOUSAND], [VIEW1.a2.UNIQUE1], [VIEW1.a2.UNIQUE2],
       [VIEW1.a2.UNIQUE3], [VIEW1.a2.TEN], [VIEW1.a2.HUNDRED], [VIEW1.a2.HUND_CLUST], [VIEW1.a2.HUND_NULL], [VIEW1.a2.CHAR_UNIQUE], [VIEW1.a2.CHAR_HUND], [VIEW1.a2.VCHAR_UNIQUE],
       [VIEW1.a2.VCHAR_HUND], [VIEW1.a2.DATE_UNIQUE], [VIEW1.a2.DATE_HUND], [VIEW1.a2.ALL_NULL], [VIEW1.a2.NUMERIC])
  2 - output([cast(cast(T_FUN_SUM(a2.HUNDRED), DECIMAL_INT(64, 32)) / cast(T_FUN_COUNT(a2.HUNDRED), DECIMAL_INT(20, 0)), DECIMAL(14, 4))], [a2.TEN + a2.UNIQUE1],
       [a2.__pk_increment], [a2.THOUSAND], [a2.UNIQUE1], [a2.UNIQUE2], [a2.UNIQUE3], [a2.TEN], [a2.HUNDRED], [a2.HUND_CLUST], [a2.HUND_NULL], [a2.CHAR_UNIQUE],
       [a2.CHAR_HUND], [a2.VCHAR_UNIQUE], [a2.VCHAR_HUND], [a2.DATE_UNIQUE], [a2.DATE_HUND], [a2.ALL_NULL], [a2.NUMERIC]), filter(nil), rowset=256
      win_expr(T_FUN_SUM(a2.HUNDRED)), partition_by([a2.TEN + a2.UNIQUE1]), order_by(nil), window_type(RANGE), upper(UNBOUNDED PRECEDING), lower(UNBOUNDED 
      FOLLOWING)
      win_expr(T_FUN_COUNT(a2.HUNDRED)), partition_by([a2.TEN + a2.UNIQUE1]), order_by(nil), window_type(RANGE), upper(UNBOUNDED PRECEDING), lower(UNBOUNDED 
      FOLLOWING)
  3 - output([a2.HUNDRED], [a2.TEN + a2.UNIQUE1], [a2.__pk_increment], [a2.THOUSAND], [a2.UNIQUE1], [a2.UNIQUE2], [a2.UNIQUE3], [a2.TEN], [a2.HUND_CLUST],
       [a2.HUND_NULL], [a2.CHAR_UNIQUE], [a2.CHAR_HUND], [a2.VCHAR_UNIQUE], [a2.VCHAR_HUND], [a2.DATE_UNIQUE], [a2.DATE_HUND], [a2.ALL_NULL], [a2.NUMERIC]), filter(nil), rowset=256
      sort_keys([HASH(a2.TEN + a2.UNIQUE1), ASC], [a2.TEN + a2.UNIQUE1, ASC])
  4 - output([a2.__pk_increment], [a2.TEN], [a2.UNIQUE1], [a2.HUNDRED], [a2.THOUSAND], [a2.UNIQUE2], [a2.UNIQUE3], [a2.HUND_CLUST], [a2.HUND_NULL], [a2.CHAR_UNIQUE],
       [a2.CHAR_HUND], [a2.VCHAR_UNIQUE], [a2.VCHAR_HUND], [a2.DATE_UNIQUE], [a2.DATE_HUND], [a2.ALL_NULL], [a2.NUMERIC], [a2.TEN + a2.UNIQUE1]), filter([a2.TEN 
      + a2.UNIQUE1 IS NOT NULL]), rowset=256
      access([a2.__pk_increment], [a2.TEN], [a2.UNIQUE1], [a2.HUNDRED], [a2.THOUSAND], [a2.UNIQUE2], [a2.UNIQUE3], [a2.HUND_CLUST], [a2.HUND_NULL], [a2.CHAR_UNIQUE],
       [a2.CHAR_HUND], [a2.VCHAR_UNIQUE], [a2.VCHAR_HUND], [a2.DATE_UNIQUE], [a2.DATE_HUND], [a2.ALL_NULL], [a2.NUMERIC]), partitions(p0)
      is_index_back=false, is_global_index=false, filter_before_indexback[false], 
      range_key([a2.__pk_increment]), range(MIN ; MAX)always true
update t2_100 a1 set a1.thousand = a1.unique1 where a1.hundred >= (select avg(a2.hundred) from t2_100 a2 where a1.ten + a1.unique1 = a2.ten + a2.unique1);
select/*no explain*/sum(thousand), stddev(thousand) from t2_100;
+---------------+-------------------+
| sum(thousand) | stddev(thousand)  |
+---------------+-------------------+
|          4950 | 28.86607004772212 |
+---------------+-------------------+
rollback;
EXPLAIN delete from t2_100 a1 where a1.hundred >= (select avg(a2.hundred) from t2_100 a2 where a1.ten + a1.unique1 = a2.ten + a2.unique1);
Query Plan
========================================================
|ID|OPERATOR               |NAME |EST.ROWS|EST.TIME(us)|
--------------------------------------------------------
|0 |DELETE                 |     |3       |166         |
|1 |└─SUBPLAN SCAN         |VIEW1|3       |147         |
|2 |  └─WINDOW FUNCTION    |     |50      |146         |
|3 |    └─PARTITION SORT   |     |50      |52          |
|4 |      └─TABLE FULL SCAN|a2   |50      |19          |
========================================================
Outputs & filters:
-------------------------------------
  0 - output(nil), filter(nil)
      table_columns([{VIEW1: ({t2_100: (VIEW1.a2.__pk_increment, VIEW1.a2.UNIQUE1, VIEW1.a2.UNIQUE2, VIEW1.a2.UNIQUE3, VIEW1.a2.TEN, VIEW1.a2.HUNDRED, VIEW1.a2.THOUSAND,
       VIEW1.a2.HUND_CLUST, VIEW1.a2.HUND_NULL, VIEW1.a2.CHAR_UNIQUE, VIEW1.a2.CHAR_HUND, VIEW1.a2.VCHAR_UNIQUE, VIEW1.a2.VCHAR_HUND, VIEW1.a2.DATE_UNIQUE, VIEW1.a2.DATE_HUND,
       VIEW1.a2.ALL_NULL, VIEW1.a2.NUMERIC)})}])
  1 - output([VIEW1.a2.__pk_increment], [VIEW1.a2.UNIQUE1], [VIEW1.a2.UNIQUE2], [VIEW1.a2.UNIQUE3], [VIEW1.a2.TEN], [VIEW1.a2.HUNDRED], [VIEW1.a2.THOUSAND],
       [VIEW1.a2.HUND_CLUST], [VIEW1.a2.HUND_NULL], [VIEW1.a2.CHAR_UNIQUE], [VIEW1.a2.CHAR_HUND], [VIEW1.a2.VCHAR_UNIQUE], [VIEW1.a2.VCHAR_HUND], [VIEW1.a2.DATE_UNIQUE],
       [VIEW1.a2.DATE_HUND], [VIEW1.a2.ALL_NULL], [VIEW1.a2.NUMERIC]), filter([cast(VIEW1.a2.HUNDRED, DECIMAL(10, 0)) >= VIEW1.avg(a2.hundred)], [VIEW1.a2.TEN 
      + VIEW1.a2.UNIQUE1 = VIEW1.a2.TEN + a2.UNIQUE1]), rowset=256
      access([VIEW1.avg(a2.hundred)], [VIEW1.a2.TEN + a2.UNIQUE1], [VIEW1.a2.__pk_increment], [VIEW1.a2.UNIQUE1], [VIEW1.a2.UNIQUE2], [VIEW1.a2.UNIQUE3],
       [VIEW1.a2.TEN], [VIEW1.a2.HUNDRED], [VIEW1.a2.THOUSAND], [VIEW1.a2.HUND_CLUST], [VIEW1.a2.HUND_NULL], [VIEW1.a2.CHAR_UNIQUE], [VIEW1.a2.CHAR_HUND], [VIEW1.a2.VCHAR_UNIQUE],
       [VIEW1.a2.VCHAR_HUND], [VIEW1.a2.DATE_UNIQUE], [VIEW1.a2.DATE_HUND], [VIEW1.a2.ALL_NULL], [VIEW1.a2.NUMERIC])
  2 - output([cast(cast(T_FUN_SUM(a2.HUNDRED), DECIMAL_INT(64, 32)) / cast(T_FUN_COUNT(a2.HUNDRED), DECIMAL_INT(20, 0)), DECIMAL(14, 4))], [a2.TEN + a2.UNIQUE1],
       [a2.__pk_increment], [a2.UNIQUE1], [a2.UNIQUE2], [a2.UNIQUE3], [a2.TEN], [a2.HUNDRED], [a2.THOUSAND], [a2.HUND_CLUST], [a2.HUND_NULL], [a2.CHAR_UNIQUE],
       [a2.CHAR_HUND], [a2.VCHAR_UNIQUE], [a2.VCHAR_HUND], [a2.DATE_UNIQUE], [a2.DATE_HUND], [a2.ALL_NULL], [a2.NUMERIC]), filter(nil), rowset=256
      win_expr(T_FUN_SUM(a2.HUNDRED)), partition_by([a2.TEN + a2.UNIQUE1]), order_by(nil), window_type(RANGE), upper(UNBOUNDED PRECEDING), lower(UNBOUNDED 
      FOLLOWING)
      win_expr(T_FUN_COUNT(a2.HUNDRED)), partition_by([a2.TEN + a2.UNIQUE1]), order_by(nil), window_type(RANGE), upper(UNBOUNDED PRECEDING), lower(UNBOUNDED 
      FOLLOWING)
  3 - output([a2.HUNDRED], [a2.TEN + a2.UNIQUE1], [a2.__pk_increment], [a2.UNIQUE1], [a2.UNIQUE2], [a2.UNIQUE3], [a2.TEN], [a2.THOUSAND], [a2.HUND_CLUST],
       [a2.HUND_NULL], [a2.CHAR_UNIQUE], [a2.CHAR_HUND], [a2.VCHAR_UNIQUE], [a2.VCHAR_HUND], [a2.DATE_UNIQUE], [a2.DATE_HUND], [a2.ALL_NULL], [a2.NUMERIC]), filter(nil), rowset=256
      sort_keys([HASH(a2.TEN + a2.UNIQUE1), ASC], [a2.TEN + a2.UNIQUE1, ASC])
  4 - output([a2.__pk_increment], [a2.TEN], [a2.UNIQUE1], [a2.HUNDRED], [a2.UNIQUE2], [a2.UNIQUE3], [a2.THOUSAND], [a2.HUND_CLUST], [a2.HUND_NULL], [a2.CHAR_UNIQUE],
       [a2.CHAR_HUND], [a2.VCHAR_UNIQUE], [a2.VCHAR_HUND], [a2.DATE_UNIQUE], [a2.DATE_HUND], [a2.ALL_NULL], [a2.NUMERIC], [a2.TEN + a2.UNIQUE1]), filter([a2.TEN 
      + a2.UNIQUE1 IS NOT NULL]), rowset=256
      access([a2.__pk_increment], [a2.TEN], [a2.UNIQUE1], [a2.HUNDRED], [a2.UNIQUE2], [a2.UNIQUE3], [a2.THOUSAND], [a2.HUND_CLUST], [a2.HUND_NULL], [a2.CHAR_UNIQUE],
       [a2.CHAR_HUND], [a2.VCHAR_UNIQUE], [a2.VCHAR_HUND], [a2.DATE_UNIQUE], [a2.DATE_HUND], [a2.ALL_NULL], [a2.NUMERIC]), partitions(p0)
      is_index_back=false, is_global_index=false, filter_before_indexback[false], 
      range_key([a2.__pk_increment]), range(MIN ; MAX)always true
delete from t2_100 a1 where a1.hundred >= (select avg(a2.hundred) from t2_100 a2 where a1.ten + a1.unique1 = a2.ten + a2.unique1);
select/*no explain*/count(*), stddev(thousand) from t2_100;
+----------+--------------------+
| count(*) | stddev(thousand)   |
+----------+--------------------+
|       45 | 25.858589804292627 |
+----------+--------------------+
rollback;
EXPLAIN insert into tmp select avg(a1.thousand) from t2_100 a1 where a1.hundred >= (select avg(a2.hundred) from t2_100 a2 where a1.ten + a1.unique1 = a2.ten + a2.unique1);
Query Plan
======================================================================
|ID|OPERATOR                   |NAME           |EST.ROWS|EST.TIME(us)|
----------------------------------------------------------------------
|0 |INSERT                     |               |1       |103         |
|1 |└─SUBPLAN SCAN             |ANONYMOUS_VIEW1|1       |90          |
|2 |  └─SCALAR GROUP BY        |               |1       |90          |
|3 |    └─HASH JOIN            |               |100     |87          |
|4 |      ├─SUBPLAN SCAN       |VIEW1          |100     |45          |
|5 |      │ └─HASH GROUP BY    |               |100     |44          |
|6 |      │   └─TABLE FULL SCAN|a2             |100     |8           |
|7 |      └─TABLE FULL SCAN    |a1             |100     |9           |
======================================================================
Outputs & filters:
-------------------------------------
  0 - output(nil), filter(nil)
      columns([{tmp: ({tmp: (tmp.__pk_increment, tmp.c1)})}]), partitions(p0), 
      column_values([T_HIDDEN_PK], [column_conv(INT,PS:(11,0),NULL,cast(ANONYMOUS_VIEW1.avg(a1.thousand), INT(-1, 0)))])
  1 - output([ANONYMOUS_VIEW1.avg(a1.thousand)]), filter(nil), rowset=256
      access([ANONYMOUS_VIEW1.avg(a1.thousand)])
  2 - output([cast(cast(T_FUN_SUM(a1.THOUSAND), DECIMAL_INT(64, 32)) / cast(T_FUN_COUNT(a1.THOUSAND), DECIMAL_INT(20, 0)), DECIMAL(14, 4))]), filter(nil), rowset=256
      group(nil), agg_func([T_FUN_SUM(a1.THOUSAND)], [T_FUN_COUNT(a1.THOUSAND)])
  3 - output([a1.THOUSAND]), filter(nil), rowset=256
      equal_conds([a1.TEN + a1.UNIQUE1 = VIEW1.a2.TEN + a2.UNIQUE1]), other_conds([cast(a1.HUNDRED, DECIMAL(10, 0)) >= VIEW1.avg(a2.hundred)])
  4 - output([VIEW1.avg(a2.hundred)], [VIEW1.a2.TEN + a2.UNIQUE1]), filter(nil), rowset=256
      access([VIEW1.avg(a2.hundred)], [VIEW1.a2.TEN + a2.UNIQUE1])
  5 - output([cast(cast(T_FUN_SUM(a2.HUNDRED), DECIMAL_INT(64, 32)) / cast(T_FUN_COUNT(a2.HUNDRED), DECIMAL_INT(20, 0)), DECIMAL(14, 4))], [a2.TEN + a2.UNIQUE1]), filter(nil), rowset=256
      group([a2.TEN + a2.UNIQUE1]), agg_func([T_FUN_SUM(a2.HUNDRED)], [T_FUN_COUNT(a2.HUNDRED)])
  6 - output([a2.TEN], [a2.UNIQUE1], [a2.HUNDRED]), filter(nil), rowset=256
      access([a2.TEN], [a2.UNIQUE1], [a2.HUNDRED]), partitions(p0)
      is_index_back=false, is_global_index=false, 
      range_key([a2.__pk_increment]), range(MIN ; MAX)always true
  7 - output([a1.TEN], [a1.UNIQUE1], [a1.HUNDRED], [a1.THOUSAND]), filter(nil), rowset=256
      access([a1.TEN], [a1.UNIQUE1], [a1.HUNDRED], [a1.THOUSAND]), partitions(p0)
      is_index_back=false, is_global_index=false, 
      range_key([a1.__pk_increment]), range(MIN ; MAX)always true
insert into tmp select avg(a1.thousand) from t2_100 a1 where a1.hundred >= (select avg(a2.hundred) from t2_100 a2 where a1.ten + a1.unique1 = a2.ten + a2.unique1);
select/*no explain*/* from tmp;
+------+
| c1   |
+------+
|   52 |
+------+
rollback;

EXPLAIN select avg(a1.thousand) from t2_100 a1 where a1.hundred >= (select avg(a2.hundred) from t2_100 a2 where a1.ten + a2.unique1 = a2.ten + a1.unique1);
Query Plan
==========================================================
|ID|OPERATOR                 |NAME |EST.ROWS|EST.TIME(us)|
----------------------------------------------------------
|0 |SCALAR GROUP BY          |     |1       |205         |
|1 |└─SUBPLAN SCAN           |VIEW1|1       |205         |
|2 |  └─MERGE GROUP BY       |     |1       |205         |
|3 |    └─NESTED-LOOP JOIN   |     |20      |204         |
|4 |      ├─TABLE FULL SCAN  |a1   |100     |12          |
|5 |      └─MATERIAL         |     |100     |20          |
|6 |        └─TABLE FULL SCAN|a2   |100     |8           |
==========================================================
Outputs & filters:
-------------------------------------
  0 - output([cast(cast(T_FUN_SUM(VIEW1.a1.THOUSAND), DECIMAL_INT(64, 32)) / cast(T_FUN_COUNT(VIEW1.a1.THOUSAND), DECIMAL_INT(20, 0)), DECIMAL(14, 4))]), filter(nil), rowset=256
      group(nil), agg_func([T_FUN_SUM(VIEW1.a1.THOUSAND)], [T_FUN_COUNT(VIEW1.a1.THOUSAND)])
  1 - output([VIEW1.a1.THOUSAND]), filter(nil), rowset=256
      access([VIEW1.a1.THOUSAND])
  2 - output([a1.THOUSAND]), filter([cast(a1.HUNDRED, DECIMAL(10, 0)) >= cast(cast(T_FUN_SUM(a2.HUNDRED), DECIMAL_INT(64, 32)) / cast(T_FUN_COUNT(a2.HUNDRED),
       DECIMAL_INT(20, 0)), DECIMAL(14, 4))]), rowset=256
      group([a1.__pk_increment]), agg_func([T_FUN_SUM(a2.HUNDRED)], [T_FUN_COUNT(a2.HUNDRED)])
  3 - output([a1.__pk_increment], [a2.HUNDRED], [a1.THOUSAND], [a1.HUNDRED]), filter(nil), rowset=256
      conds([a1.TEN + a2.UNIQUE1 = a2.TEN + a1.UNIQUE1]), nl_params_(nil), use_batch=false
  4 - output([a1.__pk_increment], [a1.TEN], [a1.UNIQUE1], [a1.HUNDRED], [a1.THOUSAND]), filter(nil), rowset=256
      access([a1.__pk_increment], [a1.TEN], [a1.UNIQUE1], [a1.HUNDRED], [a1.THOUSAND]), partitions(p0)
      is_index_back=false, is_global_index=false, 
      range_key([a1.__pk_increment]), range(MIN ; MAX)always true
  5 - output([a2.HUNDRED], [a2.UNIQUE1], [a2.TEN]), filter(nil), rowset=256
  6 - output([a2.UNIQUE1], [a2.TEN], [a2.HUNDRED]), filter(nil), rowset=256
      access([a2.UNIQUE1], [a2.TEN], [a2.HUNDRED]), partitions(p0)
      is_index_back=false, is_global_index=false, 
      range_key([a2.__pk_increment]), range(MIN ; MAX)always true
select avg(a1.thousand) from t2_100 a1 where a1.hundred >= (select avg(a2.hundred) from t2_100 a2 where a1.ten + a2.unique1 = a2.ten + a1.unique1);
+------------------+
| avg(a1.thousand) |
+------------------+
|          52.0000 |
+------------------+
EXPLAIN select /*+no_unnest(@qb1)*/ avg(a1.thousand) from t2_100 a1 where a1.hundred >= (select /*+qb_name(qb1)*/avg(a2.hundred) from t2_100 a2 where a1.ten + a2.unique1 = a2.ten + a1.unique1);
Query Plan
=====================================================
|ID|OPERATOR             |NAME|EST.ROWS|EST.TIME(us)|
-----------------------------------------------------
|0 |SCALAR GROUP BY      |    |1       |1837        |
|1 |└─SUBPLAN FILTER     |    |34      |1835        |
|2 |  ├─TABLE FULL SCAN  |a1  |100     |9           |
|3 |  └─SCALAR GROUP BY  |    |1       |19          |
|4 |    └─TABLE FULL SCAN|a2  |10      |18          |
=====================================================
Outputs & filters:
-------------------------------------
  0 - output([cast(cast(T_FUN_SUM(a1.THOUSAND), DECIMAL_INT(64, 32)) / cast(T_FUN_COUNT(a1.THOUSAND), DECIMAL_INT(20, 0)), DECIMAL(14, 4))]), filter(nil), rowset=256
      group(nil), agg_func([T_FUN_SUM(a1.THOUSAND)], [T_FUN_COUNT(a1.THOUSAND)])
  1 - output([a1.THOUSAND]), filter([cast(a1.HUNDRED, DECIMAL(10, 0)) >= subquery(1)]), rowset=256
      exec_params_([a1.TEN(:0)], [a1.UNIQUE1(:1)]), onetime_exprs_(nil), init_plan_idxs_(nil), use_batch=false
  2 - output([a1.TEN], [a1.UNIQUE1], [a1.HUNDRED], [a1.THOUSAND]), filter(nil), rowset=256
      access([a1.TEN], [a1.UNIQUE1], [a1.HUNDRED], [a1.THOUSAND]), partitions(p0)
      is_index_back=false, is_global_index=false, 
      range_key([a1.__pk_increment]), range(MIN ; MAX)always true
  3 - output([cast(cast(T_FUN_SUM(T_FUN_SUM(a2.HUNDRED)), DECIMAL_INT(64, 32)) / cast(T_FUN_COUNT_SUM(T_FUN_COUNT(a2.HUNDRED)), DECIMAL_INT(20, 0)), DECIMAL(14,
       4))]), filter(nil), rowset=256
      group(nil), agg_func([T_FUN_SUM(T_FUN_SUM(a2.HUNDRED))], [T_FUN_COUNT_SUM(T_FUN_COUNT(a2.HUNDRED))])
  4 - output([T_FUN_SUM(a2.HUNDRED)], [T_FUN_COUNT(a2.HUNDRED)]), filter([:0 + a2.UNIQUE1 = a2.TEN + :1]), rowset=256
      access([a2.UNIQUE1], [a2.TEN], [a2.HUNDRED]), partitions(p0)
      is_index_back=false, is_global_index=false, filter_before_indexback[false], 
      range_key([a2.__pk_increment]), range(MIN ; MAX)always true, 
      pushdown_aggregation([T_FUN_SUM(a2.HUNDRED)], [T_FUN_COUNT(a2.HUNDRED)])
select /*+no_unnest(@qb1)*/ avg(a1.thousand) from t2_100 a1 where a1.hundred >= (select /*+qb_name(qb1)*/avg(a2.hundred) from t2_100 a2 where a1.ten + a2.unique1 = a2.ten + a1.unique1);
+------------------+
| avg(a1.thousand) |
+------------------+
|          52.0000 |
+------------------+

EXPLAIN update t2_100 a1 set a1.thousand = a1.unique1 where a1.hundred >= (select avg(a2.hundred) from t2_100 a2 where a1.ten + a2.unique1 = a2.ten + a1.unique1);
Query Plan
==========================================================
|ID|OPERATOR                 |NAME |EST.ROWS|EST.TIME(us)|
----------------------------------------------------------
|0 |UPDATE                   |     |1       |244         |
|1 |└─SUBPLAN SCAN           |VIEW1|1       |219         |
|2 |  └─MERGE GROUP BY       |     |1       |219         |
|3 |    └─NESTED-LOOP JOIN   |     |20      |218         |
|4 |      ├─TABLE FULL SCAN  |a1   |100     |26          |
|5 |      └─MATERIAL         |     |100     |20          |
|6 |        └─TABLE FULL SCAN|a2   |100     |8           |
==========================================================
Outputs & filters:
-------------------------------------
  0 - output(nil), filter(nil)
      table_columns([{VIEW1: ({t2_100: (VIEW1.a1.__pk_increment, VIEW1.a1.UNIQUE1, VIEW1.a1.UNIQUE2, VIEW1.a1.UNIQUE3, VIEW1.a1.TEN, VIEW1.a1.HUNDRED, VIEW1.a1.THOUSAND,
       VIEW1.a1.HUND_CLUST, VIEW1.a1.HUND_NULL, VIEW1.a1.CHAR_UNIQUE, VIEW1.a1.CHAR_HUND, VIEW1.a1.VCHAR_UNIQUE, VIEW1.a1.VCHAR_HUND, VIEW1.a1.DATE_UNIQUE, VIEW1.a1.DATE_HUND,
       VIEW1.a1.ALL_NULL, VIEW1.a1.NUMERIC)})}]),
      update([VIEW1.a1.THOUSAND=column_conv(DECIMAL_INT,PS:(10,0),NULL,VIEW1.a1.UNIQUE1)])
  1 - output([VIEW1.a1.__pk_increment], [VIEW1.a1.UNIQUE1], [VIEW1.a1.UNIQUE2], [VIEW1.a1.UNIQUE3], [VIEW1.a1.TEN], [VIEW1.a1.HUNDRED], [VIEW1.a1.THOUSAND],
       [VIEW1.a1.HUND_CLUST], [VIEW1.a1.HUND_NULL], [VIEW1.a1.CHAR_UNIQUE], [VIEW1.a1.CHAR_HUND], [VIEW1.a1.VCHAR_UNIQUE], [VIEW1.a1.VCHAR_HUND], [VIEW1.a1.DATE_UNIQUE],
       [VIEW1.a1.DATE_HUND], [VIEW1.a1.ALL_NULL], [VIEW1.a1.NUMERIC]), filter(nil), rowset=256
      access([VIEW1.a1.__pk_increment], [VIEW1.a1.UNIQUE1], [VIEW1.a1.UNIQUE2], [VIEW1.a1.UNIQUE3], [VIEW1.a1.TEN], [VIEW1.a1.HUNDRED], [VIEW1.a1.THOUSAND],
       [VIEW1.a1.HUND_CLUST], [VIEW1.a1.HUND_NULL], [VIEW1.a1.CHAR_UNIQUE], [VIEW1.a1.CHAR_HUND], [VIEW1.a1.VCHAR_UNIQUE], [VIEW1.a1.VCHAR_HUND], [VIEW1.a1.DATE_UNIQUE],
       [VIEW1.a1.DATE_HUND], [VIEW1.a1.ALL_NULL], [VIEW1.a1.NUMERIC])
  2 - output([a1.__pk_increment], [a1.UNIQUE1], [a1.UNIQUE2], [a1.UNIQUE3], [a1.TEN], [a1.HUNDRED], [a1.THOUSAND], [a1.HUND_CLUST], [a1.HUND_NULL], [a1.CHAR_UNIQUE],
       [a1.CHAR_HUND], [a1.VCHAR_UNIQUE], [a1.VCHAR_HUND], [a1.DATE_UNIQUE], [a1.DATE_HUND], [a1.ALL_NULL], [a1.NUMERIC]), filter([cast(a1.HUNDRED, DECIMAL(10,
       0)) >= cast(cast(T_FUN_SUM(a2.HUNDRED), DECIMAL_INT(64, 32)) / cast(T_FUN_COUNT(a2.HUNDRED), DECIMAL_INT(20, 0)), DECIMAL(14, 4))]), rowset=256
      group([a1.__pk_increment]), agg_func([T_FUN_SUM(a2.HUNDRED)], [T_FUN_COUNT(a2.HUNDRED)])
  3 - output([a1.__pk_increment], [a2.HUNDRED], [a1.UNIQUE1], [a1.UNIQUE2], [a1.UNIQUE3], [a1.TEN], [a1.HUNDRED], [a1.THOUSAND], [a1.HUND_CLUST], [a1.HUND_NULL],
       [a1.CHAR_UNIQUE], [a1.CHAR_HUND], [a1.VCHAR_UNIQUE], [a1.VCHAR_HUND], [a1.DATE_UNIQUE], [a1.DATE_HUND], [a1.ALL_NULL], [a1.NUMERIC]), filter(nil), rowset=256
      conds([a1.TEN + a2.UNIQUE1 = a2.TEN + a1.UNIQUE1]), nl_params_(nil), use_batch=false
  4 - output([a1.__pk_increment], [a1.THOUSAND], [a1.UNIQUE1], [a1.UNIQUE2], [a1.UNIQUE3], [a1.TEN], [a1.HUNDRED], [a1.HUND_CLUST], [a1.HUND_NULL], [a1.CHAR_UNIQUE],
       [a1.CHAR_HUND], [a1.VCHAR_UNIQUE], [a1.VCHAR_HUND], [a1.DATE_UNIQUE], [a1.DATE_HUND], [a1.ALL_NULL], [a1.NUMERIC]), filter(nil), rowset=256
      access([a1.__pk_increment], [a1.THOUSAND], [a1.UNIQUE1], [a1.UNIQUE2], [a1.UNIQUE3], [a1.TEN], [a1.HUNDRED], [a1.HUND_CLUST], [a1.HUND_NULL], [a1.CHAR_UNIQUE],
       [a1.CHAR_HUND], [a1.VCHAR_UNIQUE], [a1.VCHAR_HUND], [a1.DATE_UNIQUE], [a1.DATE_HUND], [a1.ALL_NULL], [a1.NUMERIC]), partitions(p0)
      is_index_back=false, is_global_index=false, 
      range_key([a1.__pk_increment]), range(MIN ; MAX)always true
  5 - output([a2.HUNDRED], [a2.UNIQUE1], [a2.TEN]), filter(nil), rowset=256
  6 - output([a2.UNIQUE1], [a2.TEN], [a2.HUNDRED]), filter(nil), rowset=256
      access([a2.UNIQUE1], [a2.TEN], [a2.HUNDRED]), partitions(p0)
      is_index_back=false, is_global_index=false, 
      range_key([a2.__pk_increment]), range(MIN ; MAX)always true
update t2_100 a1 set a1.thousand = a1.unique1 where a1.hundred >= (select avg(a2.hundred) from t2_100 a2 where a1.ten + a2.unique1 = a2.ten + a1.unique1);
select/*no explain*/sum(thousand), stddev(thousand) from t2_100;
+---------------+-------------------+
| sum(thousand) | stddev(thousand)  |
+---------------+-------------------+
|          4950 | 28.86607004772212 |
+---------------+-------------------+
rollback;
EXPLAIN delete from t2_100 a1 where a1.hundred >= (select avg(a2.hundred) from t2_100 a2 where a1.ten + a2.unique1 = a2.ten + a1.unique1);
Query Plan
==========================================================
|ID|OPERATOR                 |NAME |EST.ROWS|EST.TIME(us)|
----------------------------------------------------------
|0 |DELETE                   |     |1       |226         |
|1 |└─SUBPLAN SCAN           |VIEW1|1       |219         |
|2 |  └─MERGE GROUP BY       |     |1       |219         |
|3 |    └─NESTED-LOOP JOIN   |     |20      |218         |
|4 |      ├─TABLE FULL SCAN  |a1   |100     |26          |
|5 |      └─MATERIAL         |     |100     |20          |
|6 |        └─TABLE FULL SCAN|a2   |100     |8           |
==========================================================
Outputs & filters:
-------------------------------------
  0 - output(nil), filter(nil)
      table_columns([{VIEW1: ({t2_100: (VIEW1.a1.__pk_increment, VIEW1.a1.UNIQUE1, VIEW1.a1.UNIQUE2, VIEW1.a1.UNIQUE3, VIEW1.a1.TEN, VIEW1.a1.HUNDRED, VIEW1.a1.THOUSAND,
       VIEW1.a1.HUND_CLUST, VIEW1.a1.HUND_NULL, VIEW1.a1.CHAR_UNIQUE, VIEW1.a1.CHAR_HUND, VIEW1.a1.VCHAR_UNIQUE, VIEW1.a1.VCHAR_HUND, VIEW1.a1.DATE_UNIQUE, VIEW1.a1.DATE_HUND,
       VIEW1.a1.ALL_NULL, VIEW1.a1.NUMERIC)})}])
  1 - output([VIEW1.a1.__pk_increment], [VIEW1.a1.UNIQUE1], [VIEW1.a1.UNIQUE2], [VIEW1.a1.UNIQUE3], [VIEW1.a1.TEN], [VIEW1.a1.HUNDRED], [VIEW1.a1.THOUSAND],
       [VIEW1.a1.HUND_CLUST], [VIEW1.a1.HUND_NULL], [VIEW1.a1.CHAR_UNIQUE], [VIEW1.a1.CHAR_HUND], [VIEW1.a1.VCHAR_UNIQUE], [VIEW1.a1.VCHAR_HUND], [VIEW1.a1.DATE_UNIQUE],
       [VIEW1.a1.DATE_HUND], [VIEW1.a1.ALL_NULL], [VIEW1.a1.NUMERIC]), filter(nil), rowset=256
      access([VIEW1.a1.__pk_increment], [VIEW1.a1.UNIQUE1], [VIEW1.a1.UNIQUE2], [VIEW1.a1.UNIQUE3], [VIEW1.a1.TEN], [VIEW1.a1.HUNDRED], [VIEW1.a1.THOUSAND],
       [VIEW1.a1.HUND_CLUST], [VIEW1.a1.HUND_NULL], [VIEW1.a1.CHAR_UNIQUE], [VIEW1.a1.CHAR_HUND], [VIEW1.a1.VCHAR_UNIQUE], [VIEW1.a1.VCHAR_HUND], [VIEW1.a1.DATE_UNIQUE],
       [VIEW1.a1.DATE_HUND], [VIEW1.a1.ALL_NULL], [VIEW1.a1.NUMERIC])
  2 - output([a1.__pk_increment], [a1.UNIQUE1], [a1.UNIQUE2], [a1.UNIQUE3], [a1.TEN], [a1.HUNDRED], [a1.THOUSAND], [a1.HUND_CLUST], [a1.HUND_NULL], [a1.CHAR_UNIQUE],
       [a1.CHAR_HUND], [a1.VCHAR_UNIQUE], [a1.VCHAR_HUND], [a1.DATE_UNIQUE], [a1.DATE_HUND], [a1.ALL_NULL], [a1.NUMERIC]), filter([cast(a1.HUNDRED, DECIMAL(10,
       0)) >= cast(cast(T_FUN_SUM(a2.HUNDRED), DECIMAL_INT(64, 32)) / cast(T_FUN_COUNT(a2.HUNDRED), DECIMAL_INT(20, 0)), DECIMAL(14, 4))]), rowset=256
      group([a1.__pk_increment]), agg_func([T_FUN_SUM(a2.HUNDRED)], [T_FUN_COUNT(a2.HUNDRED)])
  3 - output([a1.__pk_increment], [a2.HUNDRED], [a1.UNIQUE1], [a1.UNIQUE2], [a1.UNIQUE3], [a1.TEN], [a1.HUNDRED], [a1.THOUSAND], [a1.HUND_CLUST], [a1.HUND_NULL],
       [a1.CHAR_UNIQUE], [a1.CHAR_HUND], [a1.VCHAR_UNIQUE], [a1.VCHAR_HUND], [a1.DATE_UNIQUE], [a1.DATE_HUND], [a1.ALL_NULL], [a1.NUMERIC]), filter(nil), rowset=256
      conds([a1.TEN + a2.UNIQUE1 = a2.TEN + a1.UNIQUE1]), nl_params_(nil), use_batch=false
  4 - output([a1.__pk_increment], [a1.UNIQUE1], [a1.UNIQUE2], [a1.UNIQUE3], [a1.TEN], [a1.HUNDRED], [a1.THOUSAND], [a1.HUND_CLUST], [a1.HUND_NULL], [a1.CHAR_UNIQUE],
       [a1.CHAR_HUND], [a1.VCHAR_UNIQUE], [a1.VCHAR_HUND], [a1.DATE_UNIQUE], [a1.DATE_HUND], [a1.ALL_NULL], [a1.NUMERIC]), filter(nil), rowset=256
      access([a1.__pk_increment], [a1.UNIQUE1], [a1.UNIQUE2], [a1.UNIQUE3], [a1.TEN], [a1.HUNDRED], [a1.THOUSAND], [a1.HUND_CLUST], [a1.HUND_NULL], [a1.CHAR_UNIQUE],
       [a1.CHAR_HUND], [a1.VCHAR_UNIQUE], [a1.VCHAR_HUND], [a1.DATE_UNIQUE], [a1.DATE_HUND], [a1.ALL_NULL], [a1.NUMERIC]), partitions(p0)
      is_index_back=false, is_global_index=false, 
      range_key([a1.__pk_increment]), range(MIN ; MAX)always true
  5 - output([a2.HUNDRED], [a2.UNIQUE1], [a2.TEN]), filter(nil), rowset=256
  6 - output([a2.UNIQUE1], [a2.TEN], [a2.HUNDRED]), filter(nil), rowset=256
      access([a2.UNIQUE1], [a2.TEN], [a2.HUNDRED]), partitions(p0)
      is_index_back=false, is_global_index=false, 
      range_key([a2.__pk_increment]), range(MIN ; MAX)always true
delete from t2_100 a1 where a1.hundred >= (select avg(a2.hundred) from t2_100 a2 where a1.ten + a2.unique1 = a2.ten + a1.unique1);
select/*no explain*/count(*), stddev(thousand) from t2_100;
+----------+-------------------+
| count(*) | stddev(thousand)  |
+----------+-------------------+
|       50 | 28.75760768909681 |
+----------+-------------------+
rollback;
EXPLAIN insert into tmp select avg(a1.thousand) from t2_100 a1 where a1.hundred >= (select avg(a2.hundred) from t2_100 a2 where a1.ten + a2.unique1 = a2.ten + a1.unique1);
Query Plan
========================================================================
|ID|OPERATOR                     |NAME           |EST.ROWS|EST.TIME(us)|
------------------------------------------------------------------------
|0 |INSERT                       |               |1       |218         |
|1 |└─SUBPLAN SCAN               |ANONYMOUS_VIEW1|1       |205         |
|2 |  └─SCALAR GROUP BY          |               |1       |205         |
|3 |    └─SUBPLAN SCAN           |VIEW1          |1       |205         |
|4 |      └─MERGE GROUP BY       |               |1       |205         |
|5 |        └─NESTED-LOOP JOIN   |               |20      |204         |
|6 |          ├─TABLE FULL SCAN  |a1             |100     |12          |
|7 |          └─MATERIAL         |               |100     |20          |
|8 |            └─TABLE FULL SCAN|a2             |100     |8           |
========================================================================
Outputs & filters:
-------------------------------------
  0 - output(nil), filter(nil)
      columns([{tmp: ({tmp: (tmp.__pk_increment, tmp.c1)})}]), partitions(p0), 
      column_values([T_HIDDEN_PK], [column_conv(INT,PS:(11,0),NULL,cast(ANONYMOUS_VIEW1.avg(a1.thousand), INT(-1, 0)))])
  1 - output([ANONYMOUS_VIEW1.avg(a1.thousand)]), filter(nil), rowset=256
      access([ANONYMOUS_VIEW1.avg(a1.thousand)])
  2 - output([cast(cast(T_FUN_SUM(VIEW1.a1.THOUSAND), DECIMAL_INT(64, 32)) / cast(T_FUN_COUNT(VIEW1.a1.THOUSAND), DECIMAL_INT(20, 0)), DECIMAL(14, 4))]), filter(nil), rowset=256
      group(nil), agg_func([T_FUN_SUM(VIEW1.a1.THOUSAND)], [T_FUN_COUNT(VIEW1.a1.THOUSAND)])
  3 - output([VIEW1.a1.THOUSAND]), filter(nil), rowset=256
      access([VIEW1.a1.THOUSAND])
  4 - output([a1.THOUSAND]), filter([cast(a1.HUNDRED, DECIMAL(10, 0)) >= cast(cast(T_FUN_SUM(a2.HUNDRED), DECIMAL_INT(64, 32)) / cast(T_FUN_COUNT(a2.HUNDRED),
       DECIMAL_INT(20, 0)), DECIMAL(14, 4))]), rowset=256
      group([a1.__pk_increment]), agg_func([T_FUN_SUM(a2.HUNDRED)], [T_FUN_COUNT(a2.HUNDRED)])
  5 - output([a1.__pk_increment], [a2.HUNDRED], [a1.THOUSAND], [a1.HUNDRED]), filter(nil), rowset=256
      conds([a1.TEN + a2.UNIQUE1 = a2.TEN + a1.UNIQUE1]), nl_params_(nil), use_batch=false
  6 - output([a1.__pk_increment], [a1.TEN], [a1.UNIQUE1], [a1.HUNDRED], [a1.THOUSAND]), filter(nil), rowset=256
      access([a1.__pk_increment], [a1.TEN], [a1.UNIQUE1], [a1.HUNDRED], [a1.THOUSAND]), partitions(p0)
      is_index_back=false, is_global_index=false, 
      range_key([a1.__pk_increment]), range(MIN ; MAX)always true
  7 - output([a2.HUNDRED], [a2.UNIQUE1], [a2.TEN]), filter(nil), rowset=256
  8 - output([a2.UNIQUE1], [a2.TEN], [a2.HUNDRED]), filter(nil), rowset=256
      access([a2.UNIQUE1], [a2.TEN], [a2.HUNDRED]), partitions(p0)
      is_index_back=false, is_global_index=false, 
      range_key([a2.__pk_increment]), range(MIN ; MAX)always true
insert into tmp select avg(a1.thousand) from t2_100 a1 where a1.hundred >= (select avg(a2.hundred) from t2_100 a2 where a1.ten + a2.unique1 = a2.ten + a1.unique1);
select/*no explain*/* from tmp;
+------+
| c1   |
+------+
|   52 |
+------+
rollback;

EXPLAIN select avg(a1.thousand) from t2_100 a1 where a1.unique1 > 0 and a1.hundred >= (select avg(a2.hundred) from t2_100 a2 where a1.ten = a2.ten);
Query Plan
========================================================
|ID|OPERATOR               |NAME |EST.ROWS|EST.TIME(us)|
--------------------------------------------------------
|0 |SCALAR GROUP BY        |     |1       |185         |
|1 |└─SUBPLAN SCAN         |VIEW1|34      |184         |
|2 |  └─WINDOW FUNCTION    |     |100     |182         |
|3 |    └─PARTITION SORT   |     |100     |36          |
|4 |      └─TABLE FULL SCAN|a2   |100     |12          |
========================================================
Outputs & filters:
-------------------------------------
  0 - output([cast(cast(T_FUN_SUM(VIEW1.a2.THOUSAND), DECIMAL_INT(64, 32)) / cast(T_FUN_COUNT(VIEW1.a2.THOUSAND), DECIMAL_INT(20, 0)), DECIMAL(14, 4))]), filter(nil), rowset=256
      group(nil), agg_func([T_FUN_SUM(VIEW1.a2.THOUSAND)], [T_FUN_COUNT(VIEW1.a2.THOUSAND)])
  1 - output([VIEW1.a2.THOUSAND]), filter([cast(VIEW1.a2.HUNDRED, DECIMAL(10, 0)) >= cast(cast(VIEW1.T_FUN_SUM(a2.HUNDRED), DECIMAL_INT(64, 32)) / cast(VIEW1.T_FUN_COUNT(a2.HUNDRED),
       DECIMAL_INT(20, 0)), DECIMAL(14, 4))], [VIEW1.a2.UNIQUE1 > cast(0, DECIMAL_INT(10, 0))]), rowset=256
      access([VIEW1.a2.UNIQUE1], [VIEW1.a2.HUNDRED], [VIEW1.a2.THOUSAND], [VIEW1.T_FUN_SUM(a2.HUNDRED)], [VIEW1.T_FUN_COUNT(a2.HUNDRED)])
  2 - output([a2.UNIQUE1], [a2.HUNDRED], [a2.THOUSAND], [T_FUN_SUM(a2.HUNDRED)], [T_FUN_COUNT(a2.HUNDRED)]), filter(nil), rowset=256
      win_expr(T_FUN_SUM(a2.HUNDRED)), partition_by([a2.TEN]), order_by(nil), window_type(RANGE), upper(UNBOUNDED PRECEDING), lower(UNBOUNDED FOLLOWING)
      win_expr(T_FUN_COUNT(a2.HUNDRED)), partition_by([a2.TEN]), order_by(nil), window_type(RANGE), upper(UNBOUNDED PRECEDING), lower(UNBOUNDED FOLLOWING)
  3 - output([a2.HUNDRED], [a2.TEN], [a2.UNIQUE1], [a2.THOUSAND]), filter(nil), rowset=256
      sort_keys([HASH(a2.TEN), ASC], [a2.TEN, ASC])
  4 - output([a2.TEN], [a2.HUNDRED], [a2.UNIQUE1], [a2.THOUSAND]), filter([a2.TEN IS NOT NULL]), rowset=256
      access([a2.TEN], [a2.HUNDRED], [a2.UNIQUE1], [a2.THOUSAND]), partitions(p0)
      is_index_back=false, is_global_index=false, filter_before_indexback[false], 
      range_key([a2.__pk_increment]), range(MIN ; MAX)always true
select avg(a1.thousand) from t2_100 a1 where a1.unique1 > 0 and a1.hundred >= (select avg(a2.hundred) from t2_100 a2 where a1.ten = a2.ten);
+------------------+
| avg(a1.thousand) |
+------------------+
|          74.5000 |
+------------------+
EXPLAIN select /*+no_unnest(@qb1)*/ avg(a1.thousand) from t2_100 a1 where a1.unique1 > 0 and a1.hundred >= (select /*+qb_name(qb1)*/avg(a2.hundred) from t2_100 a2 where a1.ten = a2.ten);
Query Plan
====================================================================
|ID|OPERATOR              |NAME              |EST.ROWS|EST.TIME(us)|
--------------------------------------------------------------------
|0 |SCALAR GROUP BY       |                  |1       |4734        |
|1 |└─SUBPLAN FILTER      |                  |33      |4733        |
|2 |  ├─TABLE RANGE SCAN  |a1(T2_100_UNIQUE1)|99      |269         |
|3 |  └─SCALAR GROUP BY   |                  |1       |46          |
|4 |    └─TABLE RANGE SCAN|a2(T2_100_TEN)    |10      |45          |
====================================================================
Outputs & filters:
-------------------------------------
  0 - output([cast(cast(T_FUN_SUM(a1.THOUSAND), DECIMAL_INT(64, 32)) / cast(T_FUN_COUNT(a1.THOUSAND), DECIMAL_INT(20, 0)), DECIMAL(14, 4))]), filter(nil), rowset=256
      group(nil), agg_func([T_FUN_SUM(a1.THOUSAND)], [T_FUN_COUNT(a1.THOUSAND)])
  1 - output([a1.THOUSAND]), filter([cast(a1.HUNDRED, DECIMAL(10, 0)) >= subquery(1)]), rowset=256
      exec_params_([a1.TEN(:0)]), onetime_exprs_(nil), init_plan_idxs_(nil), use_batch=false
  2 - output([a1.TEN], [a1.HUNDRED], [a1.THOUSAND]), filter(nil), rowset=256
      access([a1.__pk_increment], [a1.TEN], [a1.HUNDRED], [a1.THOUSAND]), partitions(p0)
      is_index_back=true, is_global_index=false, 
      range_key([a1.UNIQUE1], [a1.shadow_pk_0]), range(0,MAX ; MAX,MAX), 
      range_cond([a1.UNIQUE1 > cast(0, DECIMAL_INT(10, 0))])
  3 - output([cast(cast(T_FUN_SUM(a2.HUNDRED), DECIMAL_INT(64, 32)) / cast(T_FUN_COUNT(a2.HUNDRED), DECIMAL_INT(20, 0)), DECIMAL(14, 4))]), filter(nil), rowset=256
      group(nil), agg_func([T_FUN_SUM(a2.HUNDRED)], [T_FUN_COUNT(a2.HUNDRED)])
  4 - output([a2.HUNDRED]), filter(nil), rowset=256
      access([a2.__pk_increment], [a2.HUNDRED]), partitions(p0)
      is_index_back=true, is_global_index=false, 
      range_key([a2.TEN], [a2.__pk_increment]), range(MIN,MIN ; MAX,MAX)always true, 
      range_cond([:0 = a2.TEN])
select /*+no_unnest(@qb1)*/ avg(a1.thousand) from t2_100 a1 where a1.unique1 > 0 and a1.hundred >= (select /*+qb_name(qb1)*/avg(a2.hundred) from t2_100 a2 where a1.ten = a2.ten);
+------------------+
| avg(a1.thousand) |
+------------------+
|          74.5000 |
+------------------+

EXPLAIN update t2_100 a1 set a1.thousand = a1.unique1 where a1.unique1 > 0 and a1.hundred >= (select avg(a2.hundred) from t2_100 a2 where a1.ten = a2.ten);
Query Plan
========================================================
|ID|OPERATOR               |NAME |EST.ROWS|EST.TIME(us)|
--------------------------------------------------------
|0 |UPDATE                 |     |5       |345         |
|1 |└─SUBPLAN SCAN         |VIEW1|5       |283         |
|2 |  └─WINDOW FUNCTION    |     |100     |282         |
|3 |    └─PARTITION SORT   |     |100     |94          |
|4 |      └─TABLE FULL SCAN|a2   |100     |29          |
========================================================
Outputs & filters:
-------------------------------------
  0 - output(nil), filter(nil)
      table_columns([{VIEW1: ({t2_100: (VIEW1.a2.__pk_increment, VIEW1.a2.UNIQUE1, VIEW1.a2.UNIQUE2, VIEW1.a2.UNIQUE3, VIEW1.a2.TEN, VIEW1.a2.HUNDRED, VIEW1.a2.THOUSAND,
       VIEW1.a2.HUND_CLUST, VIEW1.a2.HUND_NULL, VIEW1.a2.CHAR_UNIQUE, VIEW1.a2.CHAR_HUND, VIEW1.a2.VCHAR_UNIQUE, VIEW1.a2.VCHAR_HUND, VIEW1.a2.DATE_UNIQUE, VIEW1.a2.DATE_HUND,
       VIEW1.a2.ALL_NULL, VIEW1.a2.NUMERIC)})}]),
      update([VIEW1.a2.THOUSAND=column_conv(DECIMAL_INT,PS:(10,0),NULL,VIEW1.a2.UNIQUE1)])
  1 - output([VIEW1.a2.TEN], [VIEW1.a2.__pk_increment], [VIEW1.a2.THOUSAND], [VIEW1.a2.UNIQUE1], [VIEW1.a2.UNIQUE2], [VIEW1.a2.UNIQUE3], [VIEW1.a2.HUNDRED],
       [VIEW1.a2.HUND_CLUST], [VIEW1.a2.HUND_NULL], [VIEW1.a2.CHAR_UNIQUE], [VIEW1.a2.CHAR_HUND], [VIEW1.a2.VCHAR_UNIQUE], [VIEW1.a2.VCHAR_HUND], [VIEW1.a2.DATE_UNIQUE],
       [VIEW1.a2.DATE_HUND], [VIEW1.a2.ALL_NULL], [VIEW1.a2.NUMERIC]), filter([cast(VIEW1.a2.HUNDRED, DECIMAL(10, 0)) >= VIEW1.avg(a2.hundred)], [VIEW1.a2.UNIQUE1 
      > cast(0, DECIMAL_INT(10, 0))]), rowset=256
      access([VIEW1.avg(a2.hundred)], [VIEW1.a2.TEN], [VIEW1.a2.__pk_increment], [VIEW1.a2.THOUSAND], [VIEW1.a2.UNIQUE1], [VIEW1.a2.UNIQUE2], [VIEW1.a2.UNIQUE3],
       [VIEW1.a2.HUNDRED], [VIEW1.a2.HUND_CLUST], [VIEW1.a2.HUND_NULL], [VIEW1.a2.CHAR_UNIQUE], [VIEW1.a2.CHAR_HUND], [VIEW1.a2.VCHAR_UNIQUE], [VIEW1.a2.VCHAR_HUND],
       [VIEW1.a2.DATE_UNIQUE], [VIEW1.a2.DATE_HUND], [VIEW1.a2.ALL_NULL], [VIEW1.a2.NUMERIC])
  2 - output([cast(cast(T_FUN_SUM(a2.HUNDRED), DECIMAL_INT(64, 32)) / cast(T_FUN_COUNT(a2.HUNDRED), DECIMAL_INT(20, 0)), DECIMAL(14, 4))], [a2.TEN], [a2.__pk_increment],
       [a2.THOUSAND], [a2.UNIQUE1], [a2.UNIQUE2], [a2.UNIQUE3], [a2.HUNDRED], [a2.HUND_CLUST], [a2.HUND_NULL], [a2.CHAR_UNIQUE], [a2.CHAR_HUND], [a2.VCHAR_UNIQUE],
       [a2.VCHAR_HUND], [a2.DATE_UNIQUE], [a2.DATE_HUND], [a2.ALL_NULL], [a2.NUMERIC]), filter(nil), rowset=256
      win_expr(T_FUN_SUM(a2.HUNDRED)), partition_by([a2.TEN]), order_by(nil), window_type(RANGE), upper(UNBOUNDED PRECEDING), lower(UNBOUNDED FOLLOWING)
      win_expr(T_FUN_COUNT(a2.HUNDRED)), partition_by([a2.TEN]), order_by(nil), window_type(RANGE), upper(UNBOUNDED PRECEDING), lower(UNBOUNDED FOLLOWING)
  3 - output([a2.HUNDRED], [a2.TEN], [a2.__pk_increment], [a2.THOUSAND], [a2.UNIQUE1], [a2.UNIQUE2], [a2.UNIQUE3], [a2.HUND_CLUST], [a2.HUND_NULL], [a2.CHAR_UNIQUE],
       [a2.CHAR_HUND], [a2.VCHAR_UNIQUE], [a2.VCHAR_HUND], [a2.DATE_UNIQUE], [a2.DATE_HUND], [a2.ALL_NULL], [a2.NUMERIC]), filter(nil), rowset=256
      sort_keys([HASH(a2.TEN), ASC], [a2.TEN, ASC])
  4 - output([a2.__pk_increment], [a2.TEN], [a2.HUNDRED], [a2.THOUSAND], [a2.UNIQUE1], [a2.UNIQUE2], [a2.UNIQUE3], [a2.HUND_CLUST], [a2.HUND_NULL], [a2.CHAR_UNIQUE],
       [a2.CHAR_HUND], [a2.VCHAR_UNIQUE], [a2.VCHAR_HUND], [a2.DATE_UNIQUE], [a2.DATE_HUND], [a2.ALL_NULL], [a2.NUMERIC]), filter([a2.TEN IS NOT NULL]), rowset=256
      access([a2.__pk_increment], [a2.TEN], [a2.HUNDRED], [a2.THOUSAND], [a2.UNIQUE1], [a2.UNIQUE2], [a2.UNIQUE3], [a2.HUND_CLUST], [a2.HUND_NULL], [a2.CHAR_UNIQUE],
       [a2.CHAR_HUND], [a2.VCHAR_UNIQUE], [a2.VCHAR_HUND], [a2.DATE_UNIQUE], [a2.DATE_HUND], [a2.ALL_NULL], [a2.NUMERIC]), partitions(p0)
      is_index_back=false, is_global_index=false, filter_before_indexback[false], 
      range_key([a2.__pk_increment]), range(MIN ; MAX)always true
update t2_100 a1 set a1.thousand = a1.unique1 where a1.unique1 > 0 and a1.hundred >= (select avg(a2.hundred) from t2_100 a2 where a1.ten = a2.ten);
select/*no explain*/sum(thousand), stddev(thousand) from t2_100;
+---------------+-------------------+
| sum(thousand) | stddev(thousand)  |
+---------------+-------------------+
|          4950 | 28.86607004772212 |
+---------------+-------------------+
rollback;
EXPLAIN delete from t2_100 a1 where a1.unique1 > 0 and a1.hundred >= (select avg(a2.hundred) from t2_100 a2 where a1.ten = a2.ten);
Query Plan
========================================================
|ID|OPERATOR               |NAME |EST.ROWS|EST.TIME(us)|
--------------------------------------------------------
|0 |DELETE                 |     |5       |315         |
|1 |└─SUBPLAN SCAN         |VIEW1|5       |283         |
|2 |  └─WINDOW FUNCTION    |     |100     |282         |
|3 |    └─PARTITION SORT   |     |100     |94          |
|4 |      └─TABLE FULL SCAN|a2   |100     |29          |
========================================================
Outputs & filters:
-------------------------------------
  0 - output(nil), filter(nil)
      table_columns([{VIEW1: ({t2_100: (VIEW1.a2.__pk_increment, VIEW1.a2.UNIQUE1, VIEW1.a2.UNIQUE2, VIEW1.a2.UNIQUE3, VIEW1.a2.TEN, VIEW1.a2.HUNDRED, VIEW1.a2.THOUSAND,
       VIEW1.a2.HUND_CLUST, VIEW1.a2.HUND_NULL, VIEW1.a2.CHAR_UNIQUE, VIEW1.a2.CHAR_HUND, VIEW1.a2.VCHAR_UNIQUE, VIEW1.a2.VCHAR_HUND, VIEW1.a2.DATE_UNIQUE, VIEW1.a2.DATE_HUND,
       VIEW1.a2.ALL_NULL, VIEW1.a2.NUMERIC)})}])
  1 - output([VIEW1.a2.TEN], [VIEW1.a2.__pk_increment], [VIEW1.a2.UNIQUE1], [VIEW1.a2.UNIQUE2], [VIEW1.a2.UNIQUE3], [VIEW1.a2.HUNDRED], [VIEW1.a2.THOUSAND],
       [VIEW1.a2.HUND_CLUST], [VIEW1.a2.HUND_NULL], [VIEW1.a2.CHAR_UNIQUE], [VIEW1.a2.CHAR_HUND], [VIEW1.a2.VCHAR_UNIQUE], [VIEW1.a2.VCHAR_HUND], [VIEW1.a2.DATE_UNIQUE],
       [VIEW1.a2.DATE_HUND], [VIEW1.a2.ALL_NULL], [VIEW1.a2.NUMERIC]), filter([cast(VIEW1.a2.HUNDRED, DECIMAL(10, 0)) >= VIEW1.avg(a2.hundred)], [VIEW1.a2.UNIQUE1 
      > cast(0, DECIMAL_INT(10, 0))]), rowset=256
      access([VIEW1.avg(a2.hundred)], [VIEW1.a2.TEN], [VIEW1.a2.__pk_increment], [VIEW1.a2.UNIQUE1], [VIEW1.a2.UNIQUE2], [VIEW1.a2.UNIQUE3], [VIEW1.a2.HUNDRED],
       [VIEW1.a2.THOUSAND], [VIEW1.a2.HUND_CLUST], [VIEW1.a2.HUND_NULL], [VIEW1.a2.CHAR_UNIQUE], [VIEW1.a2.CHAR_HUND], [VIEW1.a2.VCHAR_UNIQUE], [VIEW1.a2.VCHAR_HUND],
       [VIEW1.a2.DATE_UNIQUE], [VIEW1.a2.DATE_HUND], [VIEW1.a2.ALL_NULL], [VIEW1.a2.NUMERIC])
  2 - output([cast(cast(T_FUN_SUM(a2.HUNDRED), DECIMAL_INT(64, 32)) / cast(T_FUN_COUNT(a2.HUNDRED), DECIMAL_INT(20, 0)), DECIMAL(14, 4))], [a2.TEN], [a2.__pk_increment],
       [a2.UNIQUE1], [a2.UNIQUE2], [a2.UNIQUE3], [a2.HUNDRED], [a2.THOUSAND], [a2.HUND_CLUST], [a2.HUND_NULL], [a2.CHAR_UNIQUE], [a2.CHAR_HUND], [a2.VCHAR_UNIQUE],
       [a2.VCHAR_HUND], [a2.DATE_UNIQUE], [a2.DATE_HUND], [a2.ALL_NULL], [a2.NUMERIC]), filter(nil), rowset=256
      win_expr(T_FUN_SUM(a2.HUNDRED)), partition_by([a2.TEN]), order_by(nil), window_type(RANGE), upper(UNBOUNDED PRECEDING), lower(UNBOUNDED FOLLOWING)
      win_expr(T_FUN_COUNT(a2.HUNDRED)), partition_by([a2.TEN]), order_by(nil), window_type(RANGE), upper(UNBOUNDED PRECEDING), lower(UNBOUNDED FOLLOWING)
  3 - output([a2.HUNDRED], [a2.TEN], [a2.__pk_increment], [a2.UNIQUE1], [a2.UNIQUE2], [a2.UNIQUE3], [a2.THOUSAND], [a2.HUND_CLUST], [a2.HUND_NULL], [a2.CHAR_UNIQUE],
       [a2.CHAR_HUND], [a2.VCHAR_UNIQUE], [a2.VCHAR_HUND], [a2.DATE_UNIQUE], [a2.DATE_HUND], [a2.ALL_NULL], [a2.NUMERIC]), filter(nil), rowset=256
      sort_keys([HASH(a2.TEN), ASC], [a2.TEN, ASC])
  4 - output([a2.__pk_increment], [a2.TEN], [a2.HUNDRED], [a2.UNIQUE1], [a2.UNIQUE2], [a2.UNIQUE3], [a2.THOUSAND], [a2.HUND_CLUST], [a2.HUND_NULL], [a2.CHAR_UNIQUE],
       [a2.CHAR_HUND], [a2.VCHAR_UNIQUE], [a2.VCHAR_HUND], [a2.DATE_UNIQUE], [a2.DATE_HUND], [a2.ALL_NULL], [a2.NUMERIC]), filter([a2.TEN IS NOT NULL]), rowset=256
      access([a2.__pk_increment], [a2.TEN], [a2.HUNDRED], [a2.UNIQUE1], [a2.UNIQUE2], [a2.UNIQUE3], [a2.THOUSAND], [a2.HUND_CLUST], [a2.HUND_NULL], [a2.CHAR_UNIQUE],
       [a2.CHAR_HUND], [a2.VCHAR_UNIQUE], [a2.VCHAR_HUND], [a2.DATE_UNIQUE], [a2.DATE_HUND], [a2.ALL_NULL], [a2.NUMERIC]), partitions(p0)
      is_index_back=false, is_global_index=false, filter_before_indexback[false], 
      range_key([a2.__pk_increment]), range(MIN ; MAX)always true
delete from t2_100 a1 where a1.unique1 > 0 and a1.hundred >= (select avg(a2.hundred) from t2_100 a2 where a1.ten = a2.ten);
select/*no explain*/count(*), stddev(thousand) from t2_100;
+----------+--------------------+
| count(*) | stddev(thousand)   |
+----------+--------------------+
|       50 | 14.430869689661812 |
+----------+--------------------+
rollback;
EXPLAIN insert into tmp select avg(a1.thousand) from t2_100 a1 where a1.unique1 > 0 and a1.hundred >= (select avg(a2.hundred) from t2_100 a2 where a1.ten = a2.ten);
Query Plan
======================================================================
|ID|OPERATOR                   |NAME           |EST.ROWS|EST.TIME(us)|
----------------------------------------------------------------------
|0 |INSERT                     |               |1       |198         |
|1 |└─SUBPLAN SCAN             |ANONYMOUS_VIEW1|1       |185         |
|2 |  └─SCALAR GROUP BY        |               |1       |185         |
|3 |    └─SUBPLAN SCAN         |VIEW1          |34      |184         |
|4 |      └─WINDOW FUNCTION    |               |100     |182         |
|5 |        └─PARTITION SORT   |               |100     |36          |
|6 |          └─TABLE FULL SCAN|a2             |100     |12          |
======================================================================
Outputs & filters:
-------------------------------------
  0 - output(nil), filter(nil)
      columns([{tmp: ({tmp: (tmp.__pk_increment, tmp.c1)})}]), partitions(p0), 
      column_values([T_HIDDEN_PK], [column_conv(INT,PS:(11,0),NULL,cast(ANONYMOUS_VIEW1.avg(a1.thousand), INT(-1, 0)))])
  1 - output([ANONYMOUS_VIEW1.avg(a1.thousand)]), filter(nil), rowset=256
      access([ANONYMOUS_VIEW1.avg(a1.thousand)])
  2 - output([cast(cast(T_FUN_SUM(VIEW1.a2.THOUSAND), DECIMAL_INT(64, 32)) / cast(T_FUN_COUNT(VIEW1.a2.THOUSAND), DECIMAL_INT(20, 0)), DECIMAL(14, 4))]), filter(nil), rowset=256
      group(nil), agg_func([T_FUN_SUM(VIEW1.a2.THOUSAND)], [T_FUN_COUNT(VIEW1.a2.THOUSAND)])
  3 - output([VIEW1.a2.THOUSAND]), filter([cast(VIEW1.a2.HUNDRED, DECIMAL(10, 0)) >= cast(cast(VIEW1.T_FUN_SUM(a2.HUNDRED), DECIMAL_INT(64, 32)) / cast(VIEW1.T_FUN_COUNT(a2.HUNDRED),
       DECIMAL_INT(20, 0)), DECIMAL(14, 4))], [VIEW1.a2.UNIQUE1 > cast(0, DECIMAL_INT(10, 0))]), rowset=256
      access([VIEW1.a2.UNIQUE1], [VIEW1.a2.HUNDRED], [VIEW1.a2.THOUSAND], [VIEW1.T_FUN_SUM(a2.HUNDRED)], [VIEW1.T_FUN_COUNT(a2.HUNDRED)])
  4 - output([a2.UNIQUE1], [a2.HUNDRED], [a2.THOUSAND], [T_FUN_SUM(a2.HUNDRED)], [T_FUN_COUNT(a2.HUNDRED)]), filter(nil), rowset=256
      win_expr(T_FUN_SUM(a2.HUNDRED)), partition_by([a2.TEN]), order_by(nil), window_type(RANGE), upper(UNBOUNDED PRECEDING), lower(UNBOUNDED FOLLOWING)
      win_expr(T_FUN_COUNT(a2.HUNDRED)), partition_by([a2.TEN]), order_by(nil), window_type(RANGE), upper(UNBOUNDED PRECEDING), lower(UNBOUNDED FOLLOWING)
  5 - output([a2.HUNDRED], [a2.TEN], [a2.UNIQUE1], [a2.THOUSAND]), filter(nil), rowset=256
      sort_keys([HASH(a2.TEN), ASC], [a2.TEN, ASC])
  6 - output([a2.TEN], [a2.HUNDRED], [a2.UNIQUE1], [a2.THOUSAND]), filter([a2.TEN IS NOT NULL]), rowset=256
      access([a2.TEN], [a2.HUNDRED], [a2.UNIQUE1], [a2.THOUSAND]), partitions(p0)
      is_index_back=false, is_global_index=false, filter_before_indexback[false], 
      range_key([a2.__pk_increment]), range(MIN ; MAX)always true
insert into tmp select avg(a1.thousand) from t2_100 a1 where a1.unique1 > 0 and a1.hundred >= (select avg(a2.hundred) from t2_100 a2 where a1.ten = a2.ten);
select/*no explain*/* from tmp;
+------+
| c1   |
+------+
|   75 |
+------+
rollback;

EXPLAIN select avg(a1.thousand) from t2_100 a1 where a1.hundred >= (select avg(a2.hundred) from t2_100 a2 where a1.ten = a2.ten and a2.unique1 > 0);
Query Plan
======================================================================
|ID|OPERATOR                |NAME              |EST.ROWS|EST.TIME(us)|
----------------------------------------------------------------------
|0 |SCALAR GROUP BY         |                  |1       |296         |
|1 |└─HASH JOIN             |                  |10      |295         |
|2 |  ├─SUBPLAN SCAN        |VIEW1             |10      |274         |
|3 |  │ └─HASH GROUP BY     |                  |10      |274         |
|4 |  │   └─TABLE RANGE SCAN|a2(T2_100_UNIQUE1)|99      |260         |
|5 |  └─TABLE FULL SCAN     |a1                |100     |8           |
======================================================================
Outputs & filters:
-------------------------------------
  0 - output([cast(cast(T_FUN_SUM(a1.THOUSAND), DECIMAL_INT(64, 32)) / cast(T_FUN_COUNT(a1.THOUSAND), DECIMAL_INT(20, 0)), DECIMAL(14, 4))]), filter(nil), rowset=256
      group(nil), agg_func([T_FUN_SUM(a1.THOUSAND)], [T_FUN_COUNT(a1.THOUSAND)])
  1 - output([a1.THOUSAND]), filter(nil), rowset=256
      equal_conds([a1.TEN = VIEW1.a2.TEN]), other_conds([cast(a1.HUNDRED, DECIMAL(10, 0)) >= VIEW1.avg(a2.hundred)])
  2 - output([VIEW1.avg(a2.hundred)], [VIEW1.a2.TEN]), filter(nil), rowset=256
      access([VIEW1.avg(a2.hundred)], [VIEW1.a2.TEN])
  3 - output([cast(cast(T_FUN_SUM(a2.HUNDRED), DECIMAL_INT(64, 32)) / cast(T_FUN_COUNT(a2.HUNDRED), DECIMAL_INT(20, 0)), DECIMAL(14, 4))], [a2.TEN]), filter(nil), rowset=256
      group([a2.TEN]), agg_func([T_FUN_SUM(a2.HUNDRED)], [T_FUN_COUNT(a2.HUNDRED)])
  4 - output([a2.TEN], [a2.HUNDRED]), filter(nil), rowset=256
      access([a2.__pk_increment], [a2.TEN], [a2.HUNDRED]), partitions(p0)
      is_index_back=true, is_global_index=false, 
      range_key([a2.UNIQUE1], [a2.shadow_pk_0]), range(0,MAX ; MAX,MAX), 
      range_cond([a2.UNIQUE1 > cast(0, DECIMAL_INT(10, 0))])
  5 - output([a1.TEN], [a1.HUNDRED], [a1.THOUSAND]), filter(nil), rowset=256
      access([a1.TEN], [a1.HUNDRED], [a1.THOUSAND]), partitions(p0)
      is_index_back=false, is_global_index=false, 
      range_key([a1.__pk_increment]), range(MIN ; MAX)always true
select avg(a1.thousand) from t2_100 a1 where a1.hundred >= (select avg(a2.hundred) from t2_100 a2 where a1.ten = a2.ten and a2.unique1 > 0);
+------------------+
| avg(a1.thousand) |
+------------------+
|          74.5000 |
+------------------+
EXPLAIN select /*+no_unnest(@qb1)*/ avg(a1.thousand) from t2_100 a1 where a1.hundred >= (select /*+qb_name(qb1)*/avg(a2.hundred) from t2_100 a2 where a1.ten = a2.ten and a2.unique1 > 0);
Query Plan
================================================================
|ID|OPERATOR              |NAME          |EST.ROWS|EST.TIME(us)|
----------------------------------------------------------------
|0 |SCALAR GROUP BY       |              |1       |4709        |
|1 |└─SUBPLAN FILTER      |              |34      |4708        |
|2 |  ├─TABLE FULL SCAN   |a1            |100     |8           |
|3 |  └─SCALAR GROUP BY   |              |1       |47          |
|4 |    └─TABLE RANGE SCAN|a2(T2_100_TEN)|10      |47          |
================================================================
Outputs & filters:
-------------------------------------
  0 - output([cast(cast(T_FUN_SUM(a1.THOUSAND), DECIMAL_INT(64, 32)) / cast(T_FUN_COUNT(a1.THOUSAND), DECIMAL_INT(20, 0)), DECIMAL(14, 4))]), filter(nil), rowset=256
      group(nil), agg_func([T_FUN_SUM(a1.THOUSAND)], [T_FUN_COUNT(a1.THOUSAND)])
  1 - output([a1.THOUSAND]), filter([cast(a1.HUNDRED, DECIMAL(10, 0)) >= subquery(1)]), rowset=256
      exec_params_([a1.TEN(:0)]), onetime_exprs_(nil), init_plan_idxs_(nil), use_batch=false
  2 - output([a1.TEN], [a1.HUNDRED], [a1.THOUSAND]), filter(nil), rowset=256
      access([a1.TEN], [a1.HUNDRED], [a1.THOUSAND]), partitions(p0)
      is_index_back=false, is_global_index=false, 
      range_key([a1.__pk_increment]), range(MIN ; MAX)always true
  3 - output([cast(cast(T_FUN_SUM(a2.HUNDRED), DECIMAL_INT(64, 32)) / cast(T_FUN_COUNT(a2.HUNDRED), DECIMAL_INT(20, 0)), DECIMAL(14, 4))]), filter(nil), rowset=256
      group(nil), agg_func([T_FUN_SUM(a2.HUNDRED)], [T_FUN_COUNT(a2.HUNDRED)])
  4 - output([a2.HUNDRED]), filter([a2.UNIQUE1 > cast(0, DECIMAL_INT(10, 0))]), rowset=256
      access([a2.__pk_increment], [a2.UNIQUE1], [a2.HUNDRED]), partitions(p0)
      is_index_back=true, is_global_index=false, filter_before_indexback[false], 
      range_key([a2.TEN], [a2.__pk_increment]), range(MIN,MIN ; MAX,MAX)always true, 
      range_cond([:0 = a2.TEN])
select /*+no_unnest(@qb1)*/ avg(a1.thousand) from t2_100 a1 where a1.hundred >= (select /*+qb_name(qb1)*/avg(a2.hundred) from t2_100 a2 where a1.ten = a2.ten and a2.unique1 > 0);
+------------------+
| avg(a1.thousand) |
+------------------+
|          74.5000 |
+------------------+

EXPLAIN update t2_100 a1 set a1.thousand = a1.unique1 where a1.hundred >= (select avg(a2.hundred) from t2_100 a2 where a1.ten = a2.ten and a2.unique1 > 0);
Query Plan
======================================================================
|ID|OPERATOR                |NAME              |EST.ROWS|EST.TIME(us)|
----------------------------------------------------------------------
|0 |UPDATE                  |                  |10      |413         |
|1 |└─HASH JOIN             |                  |10      |313         |
|2 |  ├─SUBPLAN SCAN        |VIEW1             |10      |274         |
|3 |  │ └─HASH GROUP BY     |                  |10      |274         |
|4 |  │   └─TABLE RANGE SCAN|a2(T2_100_UNIQUE1)|99      |260         |
|5 |  └─TABLE FULL SCAN     |a1                |100     |26          |
======================================================================
Outputs & filters:
-------------------------------------
  0 - output(nil), filter(nil)
      table_columns([{a1: ({t2_100: (a1.__pk_increment, a1.UNIQUE1, a1.UNIQUE2, a1.UNIQUE3, a1.TEN, a1.HUNDRED, a1.THOUSAND, a1.HUND_CLUST, a1.HUND_NULL,
       a1.CHAR_UNIQUE, a1.CHAR_HUND, a1.VCHAR_UNIQUE, a1.VCHAR_HUND, a1.DATE_UNIQUE, a1.DATE_HUND, a1.ALL_NULL, a1.NUMERIC)})}]),
      update([a1.THOUSAND=column_conv(DECIMAL_INT,PS:(10,0),NULL,a1.UNIQUE1)])
  1 - output([a1.__pk_increment], [a1.UNIQUE1], [a1.UNIQUE2], [a1.UNIQUE3], [a1.TEN], [a1.HUNDRED], [a1.THOUSAND], [a1.HUND_CLUST], [a1.HUND_NULL], [a1.CHAR_UNIQUE],
       [a1.CHAR_HUND], [a1.VCHAR_UNIQUE], [a1.VCHAR_HUND], [a1.DATE_UNIQUE], [a1.DATE_HUND], [a1.ALL_NULL], [a1.NUMERIC]), filter(nil), rowset=256
      equal_conds([a1.TEN = VIEW1.a2.TEN]), other_conds([cast(a1.HUNDRED, DECIMAL(10, 0)) >= VIEW1.avg(a2.hundred)])
  2 - output([VIEW1.avg(a2.hundred)], [VIEW1.a2.TEN]), filter(nil), rowset=256
      access([VIEW1.avg(a2.hundred)], [VIEW1.a2.TEN])
  3 - output([cast(cast(T_FUN_SUM(a2.HUNDRED), DECIMAL_INT(64, 32)) / cast(T_FUN_COUNT(a2.HUNDRED), DECIMAL_INT(20, 0)), DECIMAL(14, 4))], [a2.TEN]), filter(nil), rowset=256
      group([a2.TEN]), agg_func([T_FUN_SUM(a2.HUNDRED)], [T_FUN_COUNT(a2.HUNDRED)])
  4 - output([a2.TEN], [a2.HUNDRED]), filter(nil), rowset=256
      access([a2.__pk_increment], [a2.TEN], [a2.HUNDRED]), partitions(p0)
      is_index_back=true, is_global_index=false, 
      range_key([a2.UNIQUE1], [a2.shadow_pk_0]), range(0,MAX ; MAX,MAX), 
      range_cond([a2.UNIQUE1 > cast(0, DECIMAL_INT(10, 0))])
  5 - output([a1.__pk_increment], [a1.THOUSAND], [a1.UNIQUE1], [a1.UNIQUE2], [a1.UNIQUE3], [a1.TEN], [a1.HUNDRED], [a1.HUND_CLUST], [a1.HUND_NULL], [a1.CHAR_UNIQUE],
       [a1.CHAR_HUND], [a1.VCHAR_UNIQUE], [a1.VCHAR_HUND], [a1.DATE_UNIQUE], [a1.DATE_HUND], [a1.ALL_NULL], [a1.NUMERIC]), filter(nil), rowset=256
      access([a1.__pk_increment], [a1.THOUSAND], [a1.UNIQUE1], [a1.UNIQUE2], [a1.UNIQUE3], [a1.TEN], [a1.HUNDRED], [a1.HUND_CLUST], [a1.HUND_NULL], [a1.CHAR_UNIQUE],
       [a1.CHAR_HUND], [a1.VCHAR_UNIQUE], [a1.VCHAR_HUND], [a1.DATE_UNIQUE], [a1.DATE_HUND], [a1.ALL_NULL], [a1.NUMERIC]), partitions(p0)
      is_index_back=false, is_global_index=false, 
      range_key([a1.__pk_increment]), range(MIN ; MAX)always true
update t2_100 a1 set a1.thousand = a1.unique1 where a1.hundred >= (select avg(a2.hundred) from t2_100 a2 where a1.ten = a2.ten and a2.unique1 > 0);
select/*no explain*/sum(thousand), stddev(thousand) from t2_100;
+---------------+-------------------+
| sum(thousand) | stddev(thousand)  |
+---------------+-------------------+
|          4950 | 28.86607004772212 |
+---------------+-------------------+
rollback;
EXPLAIN delete from t2_100 a1 where a1.hundred >= (select avg(a2.hundred) from t2_100 a2 where a1.ten = a2.ten and a2.unique1 > 0);
Query Plan
======================================================================
|ID|OPERATOR                |NAME              |EST.ROWS|EST.TIME(us)|
----------------------------------------------------------------------
|0 |DELETE                  |                  |10      |370         |
|1 |└─HASH JOIN             |                  |10      |313         |
|2 |  ├─SUBPLAN SCAN        |VIEW1             |10      |274         |
|3 |  │ └─HASH GROUP BY     |                  |10      |274         |
|4 |  │   └─TABLE RANGE SCAN|a2(T2_100_UNIQUE1)|99      |260         |
|5 |  └─TABLE FULL SCAN     |a1                |100     |26          |
======================================================================
Outputs & filters:
-------------------------------------
  0 - output(nil), filter(nil)
      table_columns([{a1: ({t2_100: (a1.__pk_increment, a1.UNIQUE1, a1.UNIQUE2, a1.UNIQUE3, a1.TEN, a1.HUNDRED, a1.THOUSAND, a1.HUND_CLUST, a1.HUND_NULL,
       a1.CHAR_UNIQUE, a1.CHAR_HUND, a1.VCHAR_UNIQUE, a1.VCHAR_HUND, a1.DATE_UNIQUE, a1.DATE_HUND, a1.ALL_NULL, a1.NUMERIC)})}])
  1 - output([a1.__pk_increment], [a1.UNIQUE1], [a1.UNIQUE2], [a1.UNIQUE3], [a1.TEN], [a1.HUNDRED], [a1.THOUSAND], [a1.HUND_CLUST], [a1.HUND_NULL], [a1.CHAR_UNIQUE],
       [a1.CHAR_HUND], [a1.VCHAR_UNIQUE], [a1.VCHAR_HUND], [a1.DATE_UNIQUE], [a1.DATE_HUND], [a1.ALL_NULL], [a1.NUMERIC]), filter(nil), rowset=256
      equal_conds([a1.TEN = VIEW1.a2.TEN]), other_conds([cast(a1.HUNDRED, DECIMAL(10, 0)) >= VIEW1.avg(a2.hundred)])
  2 - output([VIEW1.avg(a2.hundred)], [VIEW1.a2.TEN]), filter(nil), rowset=256
      access([VIEW1.avg(a2.hundred)], [VIEW1.a2.TEN])
  3 - output([cast(cast(T_FUN_SUM(a2.HUNDRED), DECIMAL_INT(64, 32)) / cast(T_FUN_COUNT(a2.HUNDRED), DECIMAL_INT(20, 0)), DECIMAL(14, 4))], [a2.TEN]), filter(nil), rowset=256
      group([a2.TEN]), agg_func([T_FUN_SUM(a2.HUNDRED)], [T_FUN_COUNT(a2.HUNDRED)])
  4 - output([a2.TEN], [a2.HUNDRED]), filter(nil), rowset=256
      access([a2.__pk_increment], [a2.TEN], [a2.HUNDRED]), partitions(p0)
      is_index_back=true, is_global_index=false, 
      range_key([a2.UNIQUE1], [a2.shadow_pk_0]), range(0,MAX ; MAX,MAX), 
      range_cond([a2.UNIQUE1 > cast(0, DECIMAL_INT(10, 0))])
  5 - output([a1.__pk_increment], [a1.UNIQUE1], [a1.UNIQUE2], [a1.UNIQUE3], [a1.TEN], [a1.HUNDRED], [a1.THOUSAND], [a1.HUND_CLUST], [a1.HUND_NULL], [a1.CHAR_UNIQUE],
       [a1.CHAR_HUND], [a1.VCHAR_UNIQUE], [a1.VCHAR_HUND], [a1.DATE_UNIQUE], [a1.DATE_HUND], [a1.ALL_NULL], [a1.NUMERIC]), filter(nil), rowset=256
      access([a1.__pk_increment], [a1.UNIQUE1], [a1.UNIQUE2], [a1.UNIQUE3], [a1.TEN], [a1.HUNDRED], [a1.THOUSAND], [a1.HUND_CLUST], [a1.HUND_NULL], [a1.CHAR_UNIQUE],
       [a1.CHAR_HUND], [a1.VCHAR_UNIQUE], [a1.VCHAR_HUND], [a1.DATE_UNIQUE], [a1.DATE_HUND], [a1.ALL_NULL], [a1.NUMERIC]), partitions(p0)
      is_index_back=false, is_global_index=false, 
      range_key([a1.__pk_increment]), range(MIN ; MAX)always true
delete from t2_100 a1 where a1.hundred >= (select avg(a2.hundred) from t2_100 a2 where a1.ten = a2.ten and a2.unique1 > 0);
select/*no explain*/count(*), stddev(thousand) from t2_100;
+----------+--------------------+
| count(*) | stddev(thousand)   |
+----------+--------------------+
|       50 | 14.430869689661812 |
+----------+--------------------+
rollback;
EXPLAIN insert into tmp select avg(a1.thousand) from t2_100 a1 where a1.hundred >= (select avg(a2.hundred) from t2_100 a2 where a1.ten = a2.ten and a2.unique1 > 0);
Query Plan
==========================================================================
|ID|OPERATOR                    |NAME              |EST.ROWS|EST.TIME(us)|
--------------------------------------------------------------------------
|0 |INSERT                      |                  |1       |309         |
|1 |└─SUBPLAN SCAN              |ANONYMOUS_VIEW1   |1       |296         |
|2 |  └─SCALAR GROUP BY         |                  |1       |296         |
|3 |    └─HASH JOIN             |                  |10      |295         |
|4 |      ├─SUBPLAN SCAN        |VIEW1             |10      |274         |
|5 |      │ └─HASH GROUP BY     |                  |10      |274         |
|6 |      │   └─TABLE RANGE SCAN|a2(T2_100_UNIQUE1)|99      |260         |
|7 |      └─TABLE FULL SCAN     |a1                |100     |8           |
==========================================================================
Outputs & filters:
-------------------------------------
  0 - output(nil), filter(nil)
      columns([{tmp: ({tmp: (tmp.__pk_increment, tmp.c1)})}]), partitions(p0), 
      column_values([T_HIDDEN_PK], [column_conv(INT,PS:(11,0),NULL,cast(ANONYMOUS_VIEW1.avg(a1.thousand), INT(-1, 0)))])
  1 - output([ANONYMOUS_VIEW1.avg(a1.thousand)]), filter(nil), rowset=256
      access([ANONYMOUS_VIEW1.avg(a1.thousand)])
  2 - output([cast(cast(T_FUN_SUM(a1.THOUSAND), DECIMAL_INT(64, 32)) / cast(T_FUN_COUNT(a1.THOUSAND), DECIMAL_INT(20, 0)), DECIMAL(14, 4))]), filter(nil), rowset=256
      group(nil), agg_func([T_FUN_SUM(a1.THOUSAND)], [T_FUN_COUNT(a1.THOUSAND)])
  3 - output([a1.THOUSAND]), filter(nil), rowset=256
      equal_conds([a1.TEN = VIEW1.a2.TEN]), other_conds([cast(a1.HUNDRED, DECIMAL(10, 0)) >= VIEW1.avg(a2.hundred)])
  4 - output([VIEW1.avg(a2.hundred)], [VIEW1.a2.TEN]), filter(nil), rowset=256
      access([VIEW1.avg(a2.hundred)], [VIEW1.a2.TEN])
  5 - output([cast(cast(T_FUN_SUM(a2.HUNDRED), DECIMAL_INT(64, 32)) / cast(T_FUN_COUNT(a2.HUNDRED), DECIMAL_INT(20, 0)), DECIMAL(14, 4))], [a2.TEN]), filter(nil), rowset=256
      group([a2.TEN]), agg_func([T_FUN_SUM(a2.HUNDRED)], [T_FUN_COUNT(a2.HUNDRED)])
  6 - output([a2.TEN], [a2.HUNDRED]), filter(nil), rowset=256
      access([a2.__pk_increment], [a2.TEN], [a2.HUNDRED]), partitions(p0)
      is_index_back=true, is_global_index=false, 
      range_key([a2.UNIQUE1], [a2.shadow_pk_0]), range(0,MAX ; MAX,MAX), 
      range_cond([a2.UNIQUE1 > cast(0, DECIMAL_INT(10, 0))])
  7 - output([a1.TEN], [a1.HUNDRED], [a1.THOUSAND]), filter(nil), rowset=256
      access([a1.TEN], [a1.HUNDRED], [a1.THOUSAND]), partitions(p0)
      is_index_back=false, is_global_index=false, 
      range_key([a1.__pk_increment]), range(MIN ; MAX)always true
insert into tmp select avg(a1.thousand) from t2_100 a1 where a1.hundred >= (select avg(a2.hundred) from t2_100 a2 where a1.ten = a2.ten and a2.unique1 > 0);
select/*no explain*/* from tmp;
+------+
| c1   |
+------+
|   75 |
+------+
rollback;

EXPLAIN select avg(a1.thousand) from t2_100 a1 where a1.unique1 > 0 and a1.hundred >= (select avg(a2.hundred) from t2_100 a2 where a1.ten = a2.ten and a2.unique1 > 0);
Query Plan
======================================================================
|ID|OPERATOR                |NAME              |EST.ROWS|EST.TIME(us)|
----------------------------------------------------------------------
|0 |SCALAR GROUP BY         |                  |1       |449         |
|1 |└─SUBPLAN SCAN          |VIEW1             |5       |449         |
|2 |  └─WINDOW FUNCTION     |                  |99      |447         |
|3 |    └─PARTITION SORT    |                  |99      |302         |
|4 |      └─TABLE RANGE SCAN|a2(T2_100_UNIQUE1)|99      |279         |
======================================================================
Outputs & filters:
-------------------------------------
  0 - output([cast(cast(T_FUN_SUM(VIEW1.a2.THOUSAND), DECIMAL_INT(64, 32)) / cast(T_FUN_COUNT(VIEW1.a2.THOUSAND), DECIMAL_INT(20, 0)), DECIMAL(14, 4))]), filter(nil), rowset=256
      group(nil), agg_func([T_FUN_SUM(VIEW1.a2.THOUSAND)], [T_FUN_COUNT(VIEW1.a2.THOUSAND)])
  1 - output([VIEW1.a2.THOUSAND]), filter([cast(VIEW1.a2.HUNDRED, DECIMAL(10, 0)) >= VIEW1.avg(a2.hundred)]), rowset=256
      access([VIEW1.avg(a2.hundred)], [VIEW1.a2.HUNDRED], [VIEW1.a2.THOUSAND])
  2 - output([cast(cast(T_FUN_SUM(a2.HUNDRED), DECIMAL_INT(64, 32)) / cast(T_FUN_COUNT(a2.HUNDRED), DECIMAL_INT(20, 0)), DECIMAL(14, 4))], [a2.HUNDRED],
       [a2.THOUSAND]), filter(nil), rowset=256
      win_expr(T_FUN_SUM(a2.HUNDRED)), partition_by([a2.TEN]), order_by(nil), window_type(RANGE), upper(UNBOUNDED PRECEDING), lower(UNBOUNDED FOLLOWING)
      win_expr(T_FUN_COUNT(a2.HUNDRED)), partition_by([a2.TEN]), order_by(nil), window_type(RANGE), upper(UNBOUNDED PRECEDING), lower(UNBOUNDED FOLLOWING)
  3 - output([a2.HUNDRED], [a2.TEN], [a2.THOUSAND]), filter(nil), rowset=256
      sort_keys([HASH(a2.TEN), ASC], [a2.TEN, ASC])
  4 - output([a2.TEN], [a2.HUNDRED], [a2.THOUSAND]), filter([a2.TEN IS NOT NULL]), rowset=256
      access([a2.__pk_increment], [a2.TEN], [a2.HUNDRED], [a2.THOUSAND]), partitions(p0)
      is_index_back=true, is_global_index=false, filter_before_indexback[false], 
      range_key([a2.UNIQUE1], [a2.shadow_pk_0]), range(0,MAX ; MAX,MAX), 
      range_cond([a2.UNIQUE1 > cast(0, DECIMAL_INT(10, 0))])
select avg(a1.thousand) from t2_100 a1 where a1.unique1 > 0 and a1.hundred >= (select avg(a2.hundred) from t2_100 a2 where a1.ten = a2.ten and a2.unique1 > 0);
+------------------+
| avg(a1.thousand) |
+------------------+
|          74.5000 |
+------------------+
EXPLAIN select /*+no_unnest(@qb1)*/ avg(a1.thousand) from t2_100 a1 where a1.unique1 > 0 and a1.hundred >= (select /*+qb_name(qb1)*/avg(a2.hundred) from t2_100 a2 where a1.ten = a2.ten and a2.unique1 > 0);
Query Plan
====================================================================
|ID|OPERATOR              |NAME              |EST.ROWS|EST.TIME(us)|
--------------------------------------------------------------------
|0 |SCALAR GROUP BY       |                  |1       |4923        |
|1 |└─SUBPLAN FILTER      |                  |33      |4922        |
|2 |  ├─TABLE RANGE SCAN  |a1(T2_100_UNIQUE1)|99      |269         |
|3 |  └─SCALAR GROUP BY   |                  |1       |47          |
|4 |    └─TABLE RANGE SCAN|a2(T2_100_TEN)    |10      |47          |
====================================================================
Outputs & filters:
-------------------------------------
  0 - output([cast(cast(T_FUN_SUM(a1.THOUSAND), DECIMAL_INT(64, 32)) / cast(T_FUN_COUNT(a1.THOUSAND), DECIMAL_INT(20, 0)), DECIMAL(14, 4))]), filter(nil), rowset=256
      group(nil), agg_func([T_FUN_SUM(a1.THOUSAND)], [T_FUN_COUNT(a1.THOUSAND)])
  1 - output([a1.THOUSAND]), filter([cast(a1.HUNDRED, DECIMAL(10, 0)) >= subquery(1)]), rowset=256
      exec_params_([a1.TEN(:0)]), onetime_exprs_(nil), init_plan_idxs_(nil), use_batch=false
  2 - output([a1.TEN], [a1.HUNDRED], [a1.THOUSAND]), filter(nil), rowset=256
      access([a1.__pk_increment], [a1.TEN], [a1.HUNDRED], [a1.THOUSAND]), partitions(p0)
      is_index_back=true, is_global_index=false, 
      range_key([a1.UNIQUE1], [a1.shadow_pk_0]), range(0,MAX ; MAX,MAX), 
      range_cond([a1.UNIQUE1 > cast(0, DECIMAL_INT(10, 0))])
  3 - output([cast(cast(T_FUN_SUM(a2.HUNDRED), DECIMAL_INT(64, 32)) / cast(T_FUN_COUNT(a2.HUNDRED), DECIMAL_INT(20, 0)), DECIMAL(14, 4))]), filter(nil), rowset=256
      group(nil), agg_func([T_FUN_SUM(a2.HUNDRED)], [T_FUN_COUNT(a2.HUNDRED)])
  4 - output([a2.HUNDRED]), filter([a2.UNIQUE1 > cast(0, DECIMAL_INT(10, 0))]), rowset=256
      access([a2.__pk_increment], [a2.UNIQUE1], [a2.HUNDRED]), partitions(p0)
      is_index_back=true, is_global_index=false, filter_before_indexback[false], 
      range_key([a2.TEN], [a2.__pk_increment]), range(MIN,MIN ; MAX,MAX)always true, 
      range_cond([:0 = a2.TEN])
select /*+no_unnest(@qb1)*/ avg(a1.thousand) from t2_100 a1 where a1.unique1 > 0 and a1.hundred >= (select /*+qb_name(qb1)*/avg(a2.hundred) from t2_100 a2 where a1.ten = a2.ten and a2.unique1 > 0);
+------------------+
| avg(a1.thousand) |
+------------------+
|          74.5000 |
+------------------+

EXPLAIN update t2_100 a1 set a1.thousand = a1.unique1 where a1.unique1 > 0 and a1.hundred >= (select avg(a2.hundred) from t2_100 a2 where a1.ten = a2.ten and a2.unique1 > 0);
Query Plan
======================================================================
|ID|OPERATOR                |NAME              |EST.ROWS|EST.TIME(us)|
----------------------------------------------------------------------
|0 |UPDATE                  |                  |5       |675         |
|1 |└─SUBPLAN SCAN          |VIEW1             |5       |614         |
|2 |  └─WINDOW FUNCTION     |                  |99      |612         |
|3 |    └─PARTITION SORT    |                  |99      |426         |
|4 |      └─TABLE RANGE SCAN|a2(T2_100_UNIQUE1)|99      |362         |
======================================================================
Outputs & filters:
-------------------------------------
  0 - output(nil), filter(nil)
      table_columns([{VIEW1: ({t2_100: (VIEW1.a2.__pk_increment, VIEW1.a2.UNIQUE1, VIEW1.a2.UNIQUE2, VIEW1.a2.UNIQUE3, VIEW1.a2.TEN, VIEW1.a2.HUNDRED, VIEW1.a2.THOUSAND,
       VIEW1.a2.HUND_CLUST, VIEW1.a2.HUND_NULL, VIEW1.a2.CHAR_UNIQUE, VIEW1.a2.CHAR_HUND, VIEW1.a2.VCHAR_UNIQUE, VIEW1.a2.VCHAR_HUND, VIEW1.a2.DATE_UNIQUE, VIEW1.a2.DATE_HUND,
       VIEW1.a2.ALL_NULL, VIEW1.a2.NUMERIC)})}]),
      update([VIEW1.a2.THOUSAND=column_conv(DECIMAL_INT,PS:(10,0),NULL,VIEW1.a2.UNIQUE1)])
  1 - output([VIEW1.a2.TEN], [VIEW1.a2.__pk_increment], [VIEW1.a2.THOUSAND], [VIEW1.a2.UNIQUE1], [VIEW1.a2.UNIQUE2], [VIEW1.a2.UNIQUE3], [VIEW1.a2.HUNDRED],
       [VIEW1.a2.HUND_CLUST], [VIEW1.a2.HUND_NULL], [VIEW1.a2.CHAR_UNIQUE], [VIEW1.a2.CHAR_HUND], [VIEW1.a2.VCHAR_UNIQUE], [VIEW1.a2.VCHAR_HUND], [VIEW1.a2.DATE_UNIQUE],
       [VIEW1.a2.DATE_HUND], [VIEW1.a2.ALL_NULL], [VIEW1.a2.NUMERIC]), filter([cast(VIEW1.a2.HUNDRED, DECIMAL(10, 0)) >= VIEW1.avg(a2.hundred)]), rowset=256
      access([VIEW1.avg(a2.hundred)], [VIEW1.a2.TEN], [VIEW1.a2.__pk_increment], [VIEW1.a2.THOUSAND], [VIEW1.a2.UNIQUE1], [VIEW1.a2.UNIQUE2], [VIEW1.a2.UNIQUE3],
       [VIEW1.a2.HUNDRED], [VIEW1.a2.HUND_CLUST], [VIEW1.a2.HUND_NULL], [VIEW1.a2.CHAR_UNIQUE], [VIEW1.a2.CHAR_HUND], [VIEW1.a2.VCHAR_UNIQUE], [VIEW1.a2.VCHAR_HUND],
       [VIEW1.a2.DATE_UNIQUE], [VIEW1.a2.DATE_HUND], [VIEW1.a2.ALL_NULL], [VIEW1.a2.NUMERIC])
  2 - output([cast(cast(T_FUN_SUM(a2.HUNDRED), DECIMAL_INT(64, 32)) / cast(T_FUN_COUNT(a2.HUNDRED), DECIMAL_INT(20, 0)), DECIMAL(14, 4))], [a2.TEN], [a2.__pk_increment],
       [a2.THOUSAND], [a2.UNIQUE1], [a2.UNIQUE2], [a2.UNIQUE3], [a2.HUNDRED], [a2.HUND_CLUST], [a2.HUND_NULL], [a2.CHAR_UNIQUE], [a2.CHAR_HUND], [a2.VCHAR_UNIQUE],
       [a2.VCHAR_HUND], [a2.DATE_UNIQUE], [a2.DATE_HUND], [a2.ALL_NULL], [a2.NUMERIC]), filter(nil), rowset=256
      win_expr(T_FUN_SUM(a2.HUNDRED)), partition_by([a2.TEN]), order_by(nil), window_type(RANGE), upper(UNBOUNDED PRECEDING), lower(UNBOUNDED FOLLOWING)
      win_expr(T_FUN_COUNT(a2.HUNDRED)), partition_by([a2.TEN]), order_by(nil), window_type(RANGE), upper(UNBOUNDED PRECEDING), lower(UNBOUNDED FOLLOWING)
  3 - output([a2.HUNDRED], [a2.TEN], [a2.__pk_increment], [a2.THOUSAND], [a2.UNIQUE1], [a2.UNIQUE2], [a2.UNIQUE3], [a2.HUND_CLUST], [a2.HUND_NULL], [a2.CHAR_UNIQUE],
       [a2.CHAR_HUND], [a2.VCHAR_UNIQUE], [a2.VCHAR_HUND], [a2.DATE_UNIQUE], [a2.DATE_HUND], [a2.ALL_NULL], [a2.NUMERIC]), filter(nil), rowset=256
      sort_keys([HASH(a2.TEN), ASC], [a2.TEN, ASC])
  4 - output([a2.__pk_increment], [a2.TEN], [a2.UNIQUE1], [a2.HUNDRED], [a2.THOUSAND], [a2.UNIQUE2], [a2.UNIQUE3], [a2.HUND_CLUST], [a2.HUND_NULL], [a2.CHAR_UNIQUE],
       [a2.CHAR_HUND], [a2.VCHAR_UNIQUE], [a2.VCHAR_HUND], [a2.DATE_UNIQUE], [a2.DATE_HUND], [a2.ALL_NULL], [a2.NUMERIC]), filter([a2.TEN IS NOT NULL]), rowset=256
      access([a2.__pk_increment], [a2.TEN], [a2.UNIQUE1], [a2.HUNDRED], [a2.THOUSAND], [a2.UNIQUE2], [a2.UNIQUE3], [a2.HUND_CLUST], [a2.HUND_NULL], [a2.CHAR_UNIQUE],
       [a2.CHAR_HUND], [a2.VCHAR_UNIQUE], [a2.VCHAR_HUND], [a2.DATE_UNIQUE], [a2.DATE_HUND], [a2.ALL_NULL], [a2.NUMERIC]), partitions(p0)
      is_index_back=true, is_global_index=false, filter_before_indexback[false], 
      range_key([a2.UNIQUE1], [a2.shadow_pk_0]), range(0,MAX ; MAX,MAX), 
      range_cond([a2.UNIQUE1 > cast(0, DECIMAL_INT(10, 0))])
update t2_100 a1 set a1.thousand = a1.unique1 where a1.unique1 > 0 and a1.hundred >= (select avg(a2.hundred) from t2_100 a2 where a1.ten = a2.ten and a2.unique1 > 0);
select/*no explain*/sum(thousand), stddev(thousand) from t2_100;
+---------------+-------------------+
| sum(thousand) | stddev(thousand)  |
+---------------+-------------------+
|          4950 | 28.86607004772212 |
+---------------+-------------------+
rollback;
EXPLAIN delete from t2_100 a1 where a1.unique1 > 0 and a1.hundred >= (select avg(a2.hundred) from t2_100 a2 where a1.ten = a2.ten and a2.unique1 > 0);
Query Plan
======================================================================
|ID|OPERATOR                |NAME              |EST.ROWS|EST.TIME(us)|
----------------------------------------------------------------------
|0 |DELETE                  |                  |5       |646         |
|1 |└─SUBPLAN SCAN          |VIEW1             |5       |614         |
|2 |  └─WINDOW FUNCTION     |                  |99      |612         |
|3 |    └─PARTITION SORT    |                  |99      |426         |
|4 |      └─TABLE RANGE SCAN|a2(T2_100_UNIQUE1)|99      |362         |
======================================================================
Outputs & filters:
-------------------------------------
  0 - output(nil), filter(nil)
      table_columns([{VIEW1: ({t2_100: (VIEW1.a2.__pk_increment, VIEW1.a2.UNIQUE1, VIEW1.a2.UNIQUE2, VIEW1.a2.UNIQUE3, VIEW1.a2.TEN, VIEW1.a2.HUNDRED, VIEW1.a2.THOUSAND,
       VIEW1.a2.HUND_CLUST, VIEW1.a2.HUND_NULL, VIEW1.a2.CHAR_UNIQUE, VIEW1.a2.CHAR_HUND, VIEW1.a2.VCHAR_UNIQUE, VIEW1.a2.VCHAR_HUND, VIEW1.a2.DATE_UNIQUE, VIEW1.a2.DATE_HUND,
       VIEW1.a2.ALL_NULL, VIEW1.a2.NUMERIC)})}])
  1 - output([VIEW1.a2.TEN], [VIEW1.a2.__pk_increment], [VIEW1.a2.UNIQUE1], [VIEW1.a2.UNIQUE2], [VIEW1.a2.UNIQUE3], [VIEW1.a2.HUNDRED], [VIEW1.a2.THOUSAND],
       [VIEW1.a2.HUND_CLUST], [VIEW1.a2.HUND_NULL], [VIEW1.a2.CHAR_UNIQUE], [VIEW1.a2.CHAR_HUND], [VIEW1.a2.VCHAR_UNIQUE], [VIEW1.a2.VCHAR_HUND], [VIEW1.a2.DATE_UNIQUE],
       [VIEW1.a2.DATE_HUND], [VIEW1.a2.ALL_NULL], [VIEW1.a2.NUMERIC]), filter([cast(VIEW1.a2.HUNDRED, DECIMAL(10, 0)) >= VIEW1.avg(a2.hundred)]), rowset=256
      access([VIEW1.avg(a2.hundred)], [VIEW1.a2.TEN], [VIEW1.a2.__pk_increment], [VIEW1.a2.UNIQUE1], [VIEW1.a2.UNIQUE2], [VIEW1.a2.UNIQUE3], [VIEW1.a2.HUNDRED],
       [VIEW1.a2.THOUSAND], [VIEW1.a2.HUND_CLUST], [VIEW1.a2.HUND_NULL], [VIEW1.a2.CHAR_UNIQUE], [VIEW1.a2.CHAR_HUND], [VIEW1.a2.VCHAR_UNIQUE], [VIEW1.a2.VCHAR_HUND],
       [VIEW1.a2.DATE_UNIQUE], [VIEW1.a2.DATE_HUND], [VIEW1.a2.ALL_NULL], [VIEW1.a2.NUMERIC])
  2 - output([cast(cast(T_FUN_SUM(a2.HUNDRED), DECIMAL_INT(64, 32)) / cast(T_FUN_COUNT(a2.HUNDRED), DECIMAL_INT(20, 0)), DECIMAL(14, 4))], [a2.TEN], [a2.__pk_increment],
       [a2.UNIQUE1], [a2.UNIQUE2], [a2.UNIQUE3], [a2.HUNDRED], [a2.THOUSAND], [a2.HUND_CLUST], [a2.HUND_NULL], [a2.CHAR_UNIQUE], [a2.CHAR_HUND], [a2.VCHAR_UNIQUE],
       [a2.VCHAR_HUND], [a2.DATE_UNIQUE], [a2.DATE_HUND], [a2.ALL_NULL], [a2.NUMERIC]), filter(nil), rowset=256
      win_expr(T_FUN_SUM(a2.HUNDRED)), partition_by([a2.TEN]), order_by(nil), window_type(RANGE), upper(UNBOUNDED PRECEDING), lower(UNBOUNDED FOLLOWING)
      win_expr(T_FUN_COUNT(a2.HUNDRED)), partition_by([a2.TEN]), order_by(nil), window_type(RANGE), upper(UNBOUNDED PRECEDING), lower(UNBOUNDED FOLLOWING)
  3 - output([a2.HUNDRED], [a2.TEN], [a2.__pk_increment], [a2.UNIQUE1], [a2.UNIQUE2], [a2.UNIQUE3], [a2.THOUSAND], [a2.HUND_CLUST], [a2.HUND_NULL], [a2.CHAR_UNIQUE],
       [a2.CHAR_HUND], [a2.VCHAR_UNIQUE], [a2.VCHAR_HUND], [a2.DATE_UNIQUE], [a2.DATE_HUND], [a2.ALL_NULL], [a2.NUMERIC]), filter(nil), rowset=256
      sort_keys([HASH(a2.TEN), ASC], [a2.TEN, ASC])
  4 - output([a2.__pk_increment], [a2.TEN], [a2.UNIQUE1], [a2.HUNDRED], [a2.UNIQUE2], [a2.UNIQUE3], [a2.THOUSAND], [a2.HUND_CLUST], [a2.HUND_NULL], [a2.CHAR_UNIQUE],
       [a2.CHAR_HUND], [a2.VCHAR_UNIQUE], [a2.VCHAR_HUND], [a2.DATE_UNIQUE], [a2.DATE_HUND], [a2.ALL_NULL], [a2.NUMERIC]), filter([a2.TEN IS NOT NULL]), rowset=256
      access([a2.__pk_increment], [a2.TEN], [a2.UNIQUE1], [a2.HUNDRED], [a2.UNIQUE2], [a2.UNIQUE3], [a2.THOUSAND], [a2.HUND_CLUST], [a2.HUND_NULL], [a2.CHAR_UNIQUE],
       [a2.CHAR_HUND], [a2.VCHAR_UNIQUE], [a2.VCHAR_HUND], [a2.DATE_UNIQUE], [a2.DATE_HUND], [a2.ALL_NULL], [a2.NUMERIC]), partitions(p0)
      is_index_back=true, is_global_index=false, filter_before_indexback[false], 
      range_key([a2.UNIQUE1], [a2.shadow_pk_0]), range(0,MAX ; MAX,MAX), 
      range_cond([a2.UNIQUE1 > cast(0, DECIMAL_INT(10, 0))])
delete from t2_100 a1 where a1.unique1 > 0 and a1.hundred >= (select avg(a2.hundred) from t2_100 a2 where a1.ten = a2.ten and a2.unique1 > 0);
select/*no explain*/count(*), stddev(thousand) from t2_100;
+----------+--------------------+
| count(*) | stddev(thousand)   |
+----------+--------------------+
|       50 | 14.430869689661812 |
+----------+--------------------+
rollback;
EXPLAIN insert into tmp select avg(a1.thousand) from t2_100 a1 where a1.unique1 > 0 and a1.hundred >= (select avg(a2.hundred) from t2_100 a2 where a1.ten = a2.ten and a2.unique1 > 0);
Query Plan
==========================================================================
|ID|OPERATOR                    |NAME              |EST.ROWS|EST.TIME(us)|
--------------------------------------------------------------------------
|0 |INSERT                      |                  |1       |462         |
|1 |└─SUBPLAN SCAN              |ANONYMOUS_VIEW1   |1       |449         |
|2 |  └─SCALAR GROUP BY         |                  |1       |449         |
|3 |    └─SUBPLAN SCAN          |VIEW1             |5       |449         |
|4 |      └─WINDOW FUNCTION     |                  |99      |447         |
|5 |        └─PARTITION SORT    |                  |99      |302         |
|6 |          └─TABLE RANGE SCAN|a2(T2_100_UNIQUE1)|99      |279         |
==========================================================================
Outputs & filters:
-------------------------------------
  0 - output(nil), filter(nil)
      columns([{tmp: ({tmp: (tmp.__pk_increment, tmp.c1)})}]), partitions(p0), 
      column_values([T_HIDDEN_PK], [column_conv(INT,PS:(11,0),NULL,cast(ANONYMOUS_VIEW1.avg(a1.thousand), INT(-1, 0)))])
  1 - output([ANONYMOUS_VIEW1.avg(a1.thousand)]), filter(nil), rowset=256
      access([ANONYMOUS_VIEW1.avg(a1.thousand)])
  2 - output([cast(cast(T_FUN_SUM(VIEW1.a2.THOUSAND), DECIMAL_INT(64, 32)) / cast(T_FUN_COUNT(VIEW1.a2.THOUSAND), DECIMAL_INT(20, 0)), DECIMAL(14, 4))]), filter(nil), rowset=256
      group(nil), agg_func([T_FUN_SUM(VIEW1.a2.THOUSAND)], [T_FUN_COUNT(VIEW1.a2.THOUSAND)])
  3 - output([VIEW1.a2.THOUSAND]), filter([cast(VIEW1.a2.HUNDRED, DECIMAL(10, 0)) >= VIEW1.avg(a2.hundred)]), rowset=256
      access([VIEW1.avg(a2.hundred)], [VIEW1.a2.HUNDRED], [VIEW1.a2.THOUSAND])
  4 - output([cast(cast(T_FUN_SUM(a2.HUNDRED), DECIMAL_INT(64, 32)) / cast(T_FUN_COUNT(a2.HUNDRED), DECIMAL_INT(20, 0)), DECIMAL(14, 4))], [a2.HUNDRED],
       [a2.THOUSAND]), filter(nil), rowset=256
      win_expr(T_FUN_SUM(a2.HUNDRED)), partition_by([a2.TEN]), order_by(nil), window_type(RANGE), upper(UNBOUNDED PRECEDING), lower(UNBOUNDED FOLLOWING)
      win_expr(T_FUN_COUNT(a2.HUNDRED)), partition_by([a2.TEN]), order_by(nil), window_type(RANGE), upper(UNBOUNDED PRECEDING), lower(UNBOUNDED FOLLOWING)
  5 - output([a2.HUNDRED], [a2.TEN], [a2.THOUSAND]), filter(nil), rowset=256
      sort_keys([HASH(a2.TEN), ASC], [a2.TEN, ASC])
  6 - output([a2.TEN], [a2.HUNDRED], [a2.THOUSAND]), filter([a2.TEN IS NOT NULL]), rowset=256
      access([a2.__pk_increment], [a2.TEN], [a2.HUNDRED], [a2.THOUSAND]), partitions(p0)
      is_index_back=true, is_global_index=false, filter_before_indexback[false], 
      range_key([a2.UNIQUE1], [a2.shadow_pk_0]), range(0,MAX ; MAX,MAX), 
      range_cond([a2.UNIQUE1 > cast(0, DECIMAL_INT(10, 0))])
insert into tmp select avg(a1.thousand) from t2_100 a1 where a1.unique1 > 0 and a1.hundred >= (select avg(a2.hundred) from t2_100 a2 where a1.ten = a2.ten and a2.unique1 > 0);
select/*no explain*/* from tmp;
+------+
| c1   |
+------+
|   75 |
+------+
rollback;

EXPLAIN select avg(a1.thousand) from t2_100 a1 where a1.unique1 > 0 and a1.hundred >= (select avg(a2.hundred) from t2_100 a2 where a1.ten = a2.ten and a2.unique1 > -1);
Query Plan
======================================================================
|ID|OPERATOR                |NAME              |EST.ROWS|EST.TIME(us)|
----------------------------------------------------------------------
|0 |SCALAR GROUP BY         |                  |1       |559         |
|1 |└─HASH JOIN             |                  |10      |559         |
|2 |  ├─SUBPLAN SCAN        |VIEW1             |10      |277         |
|3 |  │ └─HASH GROUP BY     |                  |10      |277         |
|4 |  │   └─TABLE RANGE SCAN|a2(T2_100_UNIQUE1)|100     |263         |
|5 |  └─TABLE RANGE SCAN    |a1(T2_100_UNIQUE1)|99      |269         |
======================================================================
Outputs & filters:
-------------------------------------
  0 - output([cast(cast(T_FUN_SUM(a1.THOUSAND), DECIMAL_INT(64, 32)) / cast(T_FUN_COUNT(a1.THOUSAND), DECIMAL_INT(20, 0)), DECIMAL(14, 4))]), filter(nil), rowset=256
      group(nil), agg_func([T_FUN_SUM(a1.THOUSAND)], [T_FUN_COUNT(a1.THOUSAND)])
  1 - output([a1.THOUSAND]), filter(nil), rowset=256
      equal_conds([a1.TEN = VIEW1.a2.TEN]), other_conds([cast(a1.HUNDRED, DECIMAL(10, 0)) >= VIEW1.avg(a2.hundred)])
  2 - output([VIEW1.avg(a2.hundred)], [VIEW1.a2.TEN]), filter(nil), rowset=256
      access([VIEW1.avg(a2.hundred)], [VIEW1.a2.TEN])
  3 - output([cast(cast(T_FUN_SUM(a2.HUNDRED), DECIMAL_INT(64, 32)) / cast(T_FUN_COUNT(a2.HUNDRED), DECIMAL_INT(20, 0)), DECIMAL(14, 4))], [a2.TEN]), filter(nil), rowset=256
      group([a2.TEN]), agg_func([T_FUN_SUM(a2.HUNDRED)], [T_FUN_COUNT(a2.HUNDRED)])
  4 - output([a2.TEN], [a2.HUNDRED]), filter(nil), rowset=256
      access([a2.__pk_increment], [a2.TEN], [a2.HUNDRED]), partitions(p0)
      is_index_back=true, is_global_index=false, 
      range_key([a2.UNIQUE1], [a2.shadow_pk_0]), range(-1,MAX ; MAX,MAX), 
      range_cond([a2.UNIQUE1 > cast(-1, DECIMAL_INT(10, 0))])
  5 - output([a1.TEN], [a1.HUNDRED], [a1.THOUSAND]), filter(nil), rowset=256
      access([a1.__pk_increment], [a1.TEN], [a1.HUNDRED], [a1.THOUSAND]), partitions(p0)
      is_index_back=true, is_global_index=false, 
      range_key([a1.UNIQUE1], [a1.shadow_pk_0]), range(0,MAX ; MAX,MAX), 
      range_cond([a1.UNIQUE1 > cast(0, DECIMAL_INT(10, 0))])
select avg(a1.thousand) from t2_100 a1 where a1.unique1 > 0 and a1.hundred >= (select avg(a2.hundred) from t2_100 a2 where a1.ten = a2.ten and a2.unique1 > -1);
+------------------+
| avg(a1.thousand) |
+------------------+
|          74.5000 |
+------------------+
EXPLAIN select /*+no_unnest(@qb1)*/ avg(a1.thousand) from t2_100 a1 where a1.unique1 > 0 and a1.hundred >= (select /*+qb_name(qb1)*/avg(a2.hundred) from t2_100 a2 where a1.ten = a2.ten and a2.unique1 > -1);
Query Plan
====================================================================
|ID|OPERATOR              |NAME              |EST.ROWS|EST.TIME(us)|
--------------------------------------------------------------------
|0 |SCALAR GROUP BY       |                  |1       |4923        |
|1 |└─SUBPLAN FILTER      |                  |33      |4922        |
|2 |  ├─TABLE RANGE SCAN  |a1(T2_100_UNIQUE1)|99      |269         |
|3 |  └─SCALAR GROUP BY   |                  |1       |47          |
|4 |    └─TABLE RANGE SCAN|a2(T2_100_TEN)    |10      |47          |
====================================================================
Outputs & filters:
-------------------------------------
  0 - output([cast(cast(T_FUN_SUM(a1.THOUSAND), DECIMAL_INT(64, 32)) / cast(T_FUN_COUNT(a1.THOUSAND), DECIMAL_INT(20, 0)), DECIMAL(14, 4))]), filter(nil), rowset=256
      group(nil), agg_func([T_FUN_SUM(a1.THOUSAND)], [T_FUN_COUNT(a1.THOUSAND)])
  1 - output([a1.THOUSAND]), filter([cast(a1.HUNDRED, DECIMAL(10, 0)) >= subquery(1)]), rowset=256
      exec_params_([a1.TEN(:0)]), onetime_exprs_(nil), init_plan_idxs_(nil), use_batch=false
  2 - output([a1.TEN], [a1.HUNDRED], [a1.THOUSAND]), filter(nil), rowset=256
      access([a1.__pk_increment], [a1.TEN], [a1.HUNDRED], [a1.THOUSAND]), partitions(p0)
      is_index_back=true, is_global_index=false, 
      range_key([a1.UNIQUE1], [a1.shadow_pk_0]), range(0,MAX ; MAX,MAX), 
      range_cond([a1.UNIQUE1 > cast(0, DECIMAL_INT(10, 0))])
  3 - output([cast(cast(T_FUN_SUM(a2.HUNDRED), DECIMAL_INT(64, 32)) / cast(T_FUN_COUNT(a2.HUNDRED), DECIMAL_INT(20, 0)), DECIMAL(14, 4))]), filter(nil), rowset=256
      group(nil), agg_func([T_FUN_SUM(a2.HUNDRED)], [T_FUN_COUNT(a2.HUNDRED)])
  4 - output([a2.HUNDRED]), filter([a2.UNIQUE1 > cast(-1, DECIMAL_INT(10, 0))]), rowset=256
      access([a2.__pk_increment], [a2.UNIQUE1], [a2.HUNDRED]), partitions(p0)
      is_index_back=true, is_global_index=false, filter_before_indexback[false], 
      range_key([a2.TEN], [a2.__pk_increment]), range(MIN,MIN ; MAX,MAX)always true, 
      range_cond([:0 = a2.TEN])
select /*+no_unnest(@qb1)*/ avg(a1.thousand) from t2_100 a1 where a1.unique1 > 0 and a1.hundred >= (select /*+qb_name(qb1)*/avg(a2.hundred) from t2_100 a2 where a1.ten = a2.ten and a2.unique1 > -1);
+------------------+
| avg(a1.thousand) |
+------------------+
|          74.5000 |
+------------------+

EXPLAIN update t2_100 a1 set a1.thousand = a1.unique1 where a1.unique1 > 0 and a1.hundred >= (select avg(a2.hundred) from t2_100 a2 where a1.ten = a2.ten and a2.unique1 > -1);
Query Plan
======================================================================
|ID|OPERATOR                |NAME              |EST.ROWS|EST.TIME(us)|
----------------------------------------------------------------------
|0 |UPDATE                  |                  |10      |742         |
|1 |└─HASH JOIN             |                  |10      |642         |
|2 |  ├─SUBPLAN SCAN        |VIEW1             |10      |277         |
|3 |  │ └─HASH GROUP BY     |                  |10      |277         |
|4 |  │   └─TABLE RANGE SCAN|a2(T2_100_UNIQUE1)|100     |263         |
|5 |  └─TABLE RANGE SCAN    |a1(T2_100_UNIQUE1)|99      |352         |
======================================================================
Outputs & filters:
-------------------------------------
  0 - output(nil), filter(nil)
      table_columns([{a1: ({t2_100: (a1.__pk_increment, a1.UNIQUE1, a1.UNIQUE2, a1.UNIQUE3, a1.TEN, a1.HUNDRED, a1.THOUSAND, a1.HUND_CLUST, a1.HUND_NULL,
       a1.CHAR_UNIQUE, a1.CHAR_HUND, a1.VCHAR_UNIQUE, a1.VCHAR_HUND, a1.DATE_UNIQUE, a1.DATE_HUND, a1.ALL_NULL, a1.NUMERIC)})}]),
      update([a1.THOUSAND=column_conv(DECIMAL_INT,PS:(10,0),NULL,a1.UNIQUE1)])
  1 - output([a1.__pk_increment], [a1.UNIQUE1], [a1.UNIQUE2], [a1.UNIQUE3], [a1.TEN], [a1.HUNDRED], [a1.THOUSAND], [a1.HUND_CLUST], [a1.HUND_NULL], [a1.CHAR_UNIQUE],
       [a1.CHAR_HUND], [a1.VCHAR_UNIQUE], [a1.VCHAR_HUND], [a1.DATE_UNIQUE], [a1.DATE_HUND], [a1.ALL_NULL], [a1.NUMERIC]), filter(nil), rowset=256
      equal_conds([a1.TEN = VIEW1.a2.TEN]), other_conds([cast(a1.HUNDRED, DECIMAL(10, 0)) >= VIEW1.avg(a2.hundred)])
  2 - output([VIEW1.avg(a2.hundred)], [VIEW1.a2.TEN]), filter(nil), rowset=256
      access([VIEW1.avg(a2.hundred)], [VIEW1.a2.TEN])
  3 - output([cast(cast(T_FUN_SUM(a2.HUNDRED), DECIMAL_INT(64, 32)) / cast(T_FUN_COUNT(a2.HUNDRED), DECIMAL_INT(20, 0)), DECIMAL(14, 4))], [a2.TEN]), filter(nil), rowset=256
      group([a2.TEN]), agg_func([T_FUN_SUM(a2.HUNDRED)], [T_FUN_COUNT(a2.HUNDRED)])
  4 - output([a2.TEN], [a2.HUNDRED]), filter(nil), rowset=256
      access([a2.__pk_increment], [a2.TEN], [a2.HUNDRED]), partitions(p0)
      is_index_back=true, is_global_index=false, 
      range_key([a2.UNIQUE1], [a2.shadow_pk_0]), range(-1,MAX ; MAX,MAX), 
      range_cond([a2.UNIQUE1 > cast(-1, DECIMAL_INT(10, 0))])
  5 - output([a1.__pk_increment], [a1.THOUSAND], [a1.UNIQUE1], [a1.UNIQUE2], [a1.UNIQUE3], [a1.TEN], [a1.HUNDRED], [a1.HUND_CLUST], [a1.HUND_NULL], [a1.CHAR_UNIQUE],
       [a1.CHAR_HUND], [a1.VCHAR_UNIQUE], [a1.VCHAR_HUND], [a1.DATE_UNIQUE], [a1.DATE_HUND], [a1.ALL_NULL], [a1.NUMERIC]), filter(nil), rowset=256
      access([a1.__pk_increment], [a1.THOUSAND], [a1.UNIQUE1], [a1.UNIQUE2], [a1.UNIQUE3], [a1.TEN], [a1.HUNDRED], [a1.HUND_CLUST], [a1.HUND_NULL], [a1.CHAR_UNIQUE],
       [a1.CHAR_HUND], [a1.VCHAR_UNIQUE], [a1.VCHAR_HUND], [a1.DATE_UNIQUE], [a1.DATE_HUND], [a1.ALL_NULL], [a1.NUMERIC]), partitions(p0)
      is_index_back=true, is_global_index=false, 
      range_key([a1.UNIQUE1], [a1.shadow_pk_0]), range(0,MAX ; MAX,MAX), 
      range_cond([a1.UNIQUE1 > cast(0, DECIMAL_INT(10, 0))])
update t2_100 a1 set a1.thousand = a1.unique1 where a1.unique1 > 0 and a1.hundred >= (select avg(a2.hundred) from t2_100 a2 where a1.ten = a2.ten and a2.unique1 > -1);
select/*no explain*/sum(thousand), stddev(thousand) from t2_100;
+---------------+-------------------+
| sum(thousand) | stddev(thousand)  |
+---------------+-------------------+
|          4950 | 28.86607004772212 |
+---------------+-------------------+
rollback;
EXPLAIN delete from t2_100 a1 where a1.unique1 > 0 and a1.hundred >= (select avg(a2.hundred) from t2_100 a2 where a1.ten = a2.ten and a2.unique1 > -1);
Query Plan
======================================================================
|ID|OPERATOR                |NAME              |EST.ROWS|EST.TIME(us)|
----------------------------------------------------------------------
|0 |DELETE                  |                  |10      |699         |
|1 |└─HASH JOIN             |                  |10      |642         |
|2 |  ├─SUBPLAN SCAN        |VIEW1             |10      |277         |
|3 |  │ └─HASH GROUP BY     |                  |10      |277         |
|4 |  │   └─TABLE RANGE SCAN|a2(T2_100_UNIQUE1)|100     |263         |
|5 |  └─TABLE RANGE SCAN    |a1(T2_100_UNIQUE1)|99      |352         |
======================================================================
Outputs & filters:
-------------------------------------
  0 - output(nil), filter(nil)
      table_columns([{a1: ({t2_100: (a1.__pk_increment, a1.UNIQUE1, a1.UNIQUE2, a1.UNIQUE3, a1.TEN, a1.HUNDRED, a1.THOUSAND, a1.HUND_CLUST, a1.HUND_NULL,
       a1.CHAR_UNIQUE, a1.CHAR_HUND, a1.VCHAR_UNIQUE, a1.VCHAR_HUND, a1.DATE_UNIQUE, a1.DATE_HUND, a1.ALL_NULL, a1.NUMERIC)})}])
  1 - output([a1.__pk_increment], [a1.UNIQUE1], [a1.UNIQUE2], [a1.UNIQUE3], [a1.TEN], [a1.HUNDRED], [a1.THOUSAND], [a1.HUND_CLUST], [a1.HUND_NULL], [a1.CHAR_UNIQUE],
       [a1.CHAR_HUND], [a1.VCHAR_UNIQUE], [a1.VCHAR_HUND], [a1.DATE_UNIQUE], [a1.DATE_HUND], [a1.ALL_NULL], [a1.NUMERIC]), filter(nil), rowset=256
      equal_conds([a1.TEN = VIEW1.a2.TEN]), other_conds([cast(a1.HUNDRED, DECIMAL(10, 0)) >= VIEW1.avg(a2.hundred)])
  2 - output([VIEW1.avg(a2.hundred)], [VIEW1.a2.TEN]), filter(nil), rowset=256
      access([VIEW1.avg(a2.hundred)], [VIEW1.a2.TEN])
  3 - output([cast(cast(T_FUN_SUM(a2.HUNDRED), DECIMAL_INT(64, 32)) / cast(T_FUN_COUNT(a2.HUNDRED), DECIMAL_INT(20, 0)), DECIMAL(14, 4))], [a2.TEN]), filter(nil), rowset=256
      group([a2.TEN]), agg_func([T_FUN_SUM(a2.HUNDRED)], [T_FUN_COUNT(a2.HUNDRED)])
  4 - output([a2.TEN], [a2.HUNDRED]), filter(nil), rowset=256
      access([a2.__pk_increment], [a2.TEN], [a2.HUNDRED]), partitions(p0)
      is_index_back=true, is_global_index=false, 
      range_key([a2.UNIQUE1], [a2.shadow_pk_0]), range(-1,MAX ; MAX,MAX), 
      range_cond([a2.UNIQUE1 > cast(-1, DECIMAL_INT(10, 0))])
  5 - output([a1.__pk_increment], [a1.UNIQUE1], [a1.UNIQUE2], [a1.UNIQUE3], [a1.TEN], [a1.HUNDRED], [a1.THOUSAND], [a1.HUND_CLUST], [a1.HUND_NULL], [a1.CHAR_UNIQUE],
       [a1.CHAR_HUND], [a1.VCHAR_UNIQUE], [a1.VCHAR_HUND], [a1.DATE_UNIQUE], [a1.DATE_HUND], [a1.ALL_NULL], [a1.NUMERIC]), filter(nil), rowset=256
      access([a1.__pk_increment], [a1.UNIQUE1], [a1.UNIQUE2], [a1.UNIQUE3], [a1.TEN], [a1.HUNDRED], [a1.THOUSAND], [a1.HUND_CLUST], [a1.HUND_NULL], [a1.CHAR_UNIQUE],
       [a1.CHAR_HUND], [a1.VCHAR_UNIQUE], [a1.VCHAR_HUND], [a1.DATE_UNIQUE], [a1.DATE_HUND], [a1.ALL_NULL], [a1.NUMERIC]), partitions(p0)
      is_index_back=true, is_global_index=false, 
      range_key([a1.UNIQUE1], [a1.shadow_pk_0]), range(0,MAX ; MAX,MAX), 
      range_cond([a1.UNIQUE1 > cast(0, DECIMAL_INT(10, 0))])
delete from t2_100 a1 where a1.unique1 > 0 and a1.hundred >= (select avg(a2.hundred) from t2_100 a2 where a1.ten = a2.ten and a2.unique1 > -1);
select/*no explain*/count(*), stddev(thousand) from t2_100;
+----------+--------------------+
| count(*) | stddev(thousand)   |
+----------+--------------------+
|       50 | 14.430869689661812 |
+----------+--------------------+
rollback;
EXPLAIN insert into tmp select avg(a1.thousand) from t2_100 a1 where a1.unique1 > 0 and a1.hundred >= (select avg(a2.hundred) from t2_100 a2 where a1.ten = a2.ten and a2.unique1 > -1);
Query Plan
==========================================================================
|ID|OPERATOR                    |NAME              |EST.ROWS|EST.TIME(us)|
--------------------------------------------------------------------------
|0 |INSERT                      |                  |1       |572         |
|1 |└─SUBPLAN SCAN              |ANONYMOUS_VIEW1   |1       |559         |
|2 |  └─SCALAR GROUP BY         |                  |1       |559         |
|3 |    └─HASH JOIN             |                  |10      |559         |
|4 |      ├─SUBPLAN SCAN        |VIEW1             |10      |277         |
|5 |      │ └─HASH GROUP BY     |                  |10      |277         |
|6 |      │   └─TABLE RANGE SCAN|a2(T2_100_UNIQUE1)|100     |263         |
|7 |      └─TABLE RANGE SCAN    |a1(T2_100_UNIQUE1)|99      |269         |
==========================================================================
Outputs & filters:
-------------------------------------
  0 - output(nil), filter(nil)
      columns([{tmp: ({tmp: (tmp.__pk_increment, tmp.c1)})}]), partitions(p0), 
      column_values([T_HIDDEN_PK], [column_conv(INT,PS:(11,0),NULL,cast(ANONYMOUS_VIEW1.avg(a1.thousand), INT(-1, 0)))])
  1 - output([ANONYMOUS_VIEW1.avg(a1.thousand)]), filter(nil), rowset=256
      access([ANONYMOUS_VIEW1.avg(a1.thousand)])
  2 - output([cast(cast(T_FUN_SUM(a1.THOUSAND), DECIMAL_INT(64, 32)) / cast(T_FUN_COUNT(a1.THOUSAND), DECIMAL_INT(20, 0)), DECIMAL(14, 4))]), filter(nil), rowset=256
      group(nil), agg_func([T_FUN_SUM(a1.THOUSAND)], [T_FUN_COUNT(a1.THOUSAND)])
  3 - output([a1.THOUSAND]), filter(nil), rowset=256
      equal_conds([a1.TEN = VIEW1.a2.TEN]), other_conds([cast(a1.HUNDRED, DECIMAL(10, 0)) >= VIEW1.avg(a2.hundred)])
  4 - output([VIEW1.avg(a2.hundred)], [VIEW1.a2.TEN]), filter(nil), rowset=256
      access([VIEW1.avg(a2.hundred)], [VIEW1.a2.TEN])
  5 - output([cast(cast(T_FUN_SUM(a2.HUNDRED), DECIMAL_INT(64, 32)) / cast(T_FUN_COUNT(a2.HUNDRED), DECIMAL_INT(20, 0)), DECIMAL(14, 4))], [a2.TEN]), filter(nil), rowset=256
      group([a2.TEN]), agg_func([T_FUN_SUM(a2.HUNDRED)], [T_FUN_COUNT(a2.HUNDRED)])
  6 - output([a2.TEN], [a2.HUNDRED]), filter(nil), rowset=256
      access([a2.__pk_increment], [a2.TEN], [a2.HUNDRED]), partitions(p0)
      is_index_back=true, is_global_index=false, 
      range_key([a2.UNIQUE1], [a2.shadow_pk_0]), range(-1,MAX ; MAX,MAX), 
      range_cond([a2.UNIQUE1 > cast(-1, DECIMAL_INT(10, 0))])
  7 - output([a1.TEN], [a1.HUNDRED], [a1.THOUSAND]), filter(nil), rowset=256
      access([a1.__pk_increment], [a1.TEN], [a1.HUNDRED], [a1.THOUSAND]), partitions(p0)
      is_index_back=true, is_global_index=false, 
      range_key([a1.UNIQUE1], [a1.shadow_pk_0]), range(0,MAX ; MAX,MAX), 
      range_cond([a1.UNIQUE1 > cast(0, DECIMAL_INT(10, 0))])
insert into tmp select avg(a1.thousand) from t2_100 a1 where a1.unique1 > 0 and a1.hundred >= (select avg(a2.hundred) from t2_100 a2 where a1.ten = a2.ten and a2.unique1 > -1);
select/*no explain*/* from tmp;
+------+
| c1   |
+------+
|   75 |
+------+
rollback;

EXPLAIN select avg(a1.thousand) from t2_100 a1 where a1.unique1 > 0 + 0 and a1.hundred >= (select avg(a2.hundred) from t2_100 a2 where a1.ten = a2.ten and a2.unique1 > 0 + 0);
Query Plan
======================================================================
|ID|OPERATOR                |NAME              |EST.ROWS|EST.TIME(us)|
----------------------------------------------------------------------
|0 |SCALAR GROUP BY         |                  |1       |449         |
|1 |└─SUBPLAN SCAN          |VIEW1             |5       |449         |
|2 |  └─WINDOW FUNCTION     |                  |99      |447         |
|3 |    └─PARTITION SORT    |                  |99      |302         |
|4 |      └─TABLE RANGE SCAN|a2(T2_100_UNIQUE1)|99      |279         |
======================================================================
Outputs & filters:
-------------------------------------
  0 - output([cast(cast(T_FUN_SUM(VIEW1.a2.THOUSAND), DECIMAL_INT(64, 32)) / cast(T_FUN_COUNT(VIEW1.a2.THOUSAND), DECIMAL_INT(20, 0)), DECIMAL(14, 4))]), filter(nil), rowset=256
      group(nil), agg_func([T_FUN_SUM(VIEW1.a2.THOUSAND)], [T_FUN_COUNT(VIEW1.a2.THOUSAND)])
  1 - output([VIEW1.a2.THOUSAND]), filter([cast(VIEW1.a2.HUNDRED, DECIMAL(10, 0)) >= VIEW1.avg(a2.hundred)]), rowset=256
      access([VIEW1.avg(a2.hundred)], [VIEW1.a2.HUNDRED], [VIEW1.a2.THOUSAND])
  2 - output([cast(cast(T_FUN_SUM(a2.HUNDRED), DECIMAL_INT(64, 32)) / cast(T_FUN_COUNT(a2.HUNDRED), DECIMAL_INT(20, 0)), DECIMAL(14, 4))], [a2.HUNDRED],
       [a2.THOUSAND]), filter(nil), rowset=256
      win_expr(T_FUN_SUM(a2.HUNDRED)), partition_by([a2.TEN]), order_by(nil), window_type(RANGE), upper(UNBOUNDED PRECEDING), lower(UNBOUNDED FOLLOWING)
      win_expr(T_FUN_COUNT(a2.HUNDRED)), partition_by([a2.TEN]), order_by(nil), window_type(RANGE), upper(UNBOUNDED PRECEDING), lower(UNBOUNDED FOLLOWING)
  3 - output([a2.HUNDRED], [a2.TEN], [a2.THOUSAND]), filter(nil), rowset=256
      sort_keys([HASH(a2.TEN), ASC], [a2.TEN, ASC])
  4 - output([a2.TEN], [a2.HUNDRED], [a2.THOUSAND]), filter([a2.TEN IS NOT NULL]), rowset=256
      access([a2.__pk_increment], [a2.TEN], [a2.HUNDRED], [a2.THOUSAND]), partitions(p0)
      is_index_back=true, is_global_index=false, filter_before_indexback[false], 
      range_key([a2.UNIQUE1], [a2.shadow_pk_0]), range(0,MAX ; MAX,MAX), 
      range_cond([a2.UNIQUE1 > cast(0 + 0, DECIMAL_INT(10, 0))])
select avg(a1.thousand) from t2_100 a1 where a1.unique1 > 0 + 0 and a1.hundred >= (select avg(a2.hundred) from t2_100 a2 where a1.ten = a2.ten and a2.unique1 > 0 + 0);
+------------------+
| avg(a1.thousand) |
+------------------+
|          74.5000 |
+------------------+
EXPLAIN select /*+no_unnest(@qb1)*/ avg(a1.thousand) from t2_100 a1 where a1.unique1 > 0 + 0 and a1.hundred >= (select /*+qb_name(qb1)*/avg(a2.hundred) from t2_100 a2 where a1.ten = a2.ten and a2.unique1 > 0 + 0);
Query Plan
====================================================================
|ID|OPERATOR              |NAME              |EST.ROWS|EST.TIME(us)|
--------------------------------------------------------------------
|0 |SCALAR GROUP BY       |                  |1       |4923        |
|1 |└─SUBPLAN FILTER      |                  |33      |4922        |
|2 |  ├─TABLE RANGE SCAN  |a1(T2_100_UNIQUE1)|99      |269         |
|3 |  └─SCALAR GROUP BY   |                  |1       |47          |
|4 |    └─TABLE RANGE SCAN|a2(T2_100_TEN)    |10      |47          |
====================================================================
Outputs & filters:
-------------------------------------
  0 - output([cast(cast(T_FUN_SUM(a1.THOUSAND), DECIMAL_INT(64, 32)) / cast(T_FUN_COUNT(a1.THOUSAND), DECIMAL_INT(20, 0)), DECIMAL(14, 4))]), filter(nil), rowset=256
      group(nil), agg_func([T_FUN_SUM(a1.THOUSAND)], [T_FUN_COUNT(a1.THOUSAND)])
  1 - output([a1.THOUSAND]), filter([cast(a1.HUNDRED, DECIMAL(10, 0)) >= subquery(1)]), rowset=256
      exec_params_([a1.TEN(:0)]), onetime_exprs_(nil), init_plan_idxs_(nil), use_batch=false
  2 - output([a1.TEN], [a1.HUNDRED], [a1.THOUSAND]), filter(nil), rowset=256
      access([a1.__pk_increment], [a1.TEN], [a1.HUNDRED], [a1.THOUSAND]), partitions(p0)
      is_index_back=true, is_global_index=false, 
      range_key([a1.UNIQUE1], [a1.shadow_pk_0]), range(0,MAX ; MAX,MAX), 
      range_cond([a1.UNIQUE1 > cast(0 + 0, DECIMAL_INT(10, 0))])
  3 - output([cast(cast(T_FUN_SUM(a2.HUNDRED), DECIMAL_INT(64, 32)) / cast(T_FUN_COUNT(a2.HUNDRED), DECIMAL_INT(20, 0)), DECIMAL(14, 4))]), filter(nil), rowset=256
      group(nil), agg_func([T_FUN_SUM(a2.HUNDRED)], [T_FUN_COUNT(a2.HUNDRED)])
  4 - output([a2.HUNDRED]), filter([a2.UNIQUE1 > cast(0 + 0, DECIMAL_INT(10, 0))]), rowset=256
      access([a2.__pk_increment], [a2.UNIQUE1], [a2.HUNDRED]), partitions(p0)
      is_index_back=true, is_global_index=false, filter_before_indexback[false], 
      range_key([a2.TEN], [a2.__pk_increment]), range(MIN,MIN ; MAX,MAX)always true, 
      range_cond([:0 = a2.TEN])
select /*+no_unnest(@qb1)*/ avg(a1.thousand) from t2_100 a1 where a1.unique1 > 0 + 0 and a1.hundred >= (select /*+qb_name(qb1)*/avg(a2.hundred) from t2_100 a2 where a1.ten = a2.ten and a2.unique1 > 0 + 0);
+------------------+
| avg(a1.thousand) |
+------------------+
|          74.5000 |
+------------------+

EXPLAIN update t2_100 a1 set a1.thousand = a1.unique1 where a1.unique1 > 0 + 0 and a1.hundred >= (select avg(a2.hundred) from t2_100 a2 where a1.ten = a2.ten and a2.unique1 > 0 + 0);
Query Plan
======================================================================
|ID|OPERATOR                |NAME              |EST.ROWS|EST.TIME(us)|
----------------------------------------------------------------------
|0 |UPDATE                  |                  |5       |675         |
|1 |└─SUBPLAN SCAN          |VIEW1             |5       |614         |
|2 |  └─WINDOW FUNCTION     |                  |99      |612         |
|3 |    └─PARTITION SORT    |                  |99      |426         |
|4 |      └─TABLE RANGE SCAN|a2(T2_100_UNIQUE1)|99      |362         |
======================================================================
Outputs & filters:
-------------------------------------
  0 - output(nil), filter(nil)
      table_columns([{VIEW1: ({t2_100: (VIEW1.a2.__pk_increment, VIEW1.a2.UNIQUE1, VIEW1.a2.UNIQUE2, VIEW1.a2.UNIQUE3, VIEW1.a2.TEN, VIEW1.a2.HUNDRED, VIEW1.a2.THOUSAND,
       VIEW1.a2.HUND_CLUST, VIEW1.a2.HUND_NULL, VIEW1.a2.CHAR_UNIQUE, VIEW1.a2.CHAR_HUND, VIEW1.a2.VCHAR_UNIQUE, VIEW1.a2.VCHAR_HUND, VIEW1.a2.DATE_UNIQUE, VIEW1.a2.DATE_HUND,
       VIEW1.a2.ALL_NULL, VIEW1.a2.NUMERIC)})}]),
      update([VIEW1.a2.THOUSAND=column_conv(DECIMAL_INT,PS:(10,0),NULL,VIEW1.a2.UNIQUE1)])
  1 - output([VIEW1.a2.TEN], [VIEW1.a2.__pk_increment], [VIEW1.a2.THOUSAND], [VIEW1.a2.UNIQUE1], [VIEW1.a2.UNIQUE2], [VIEW1.a2.UNIQUE3], [VIEW1.a2.HUNDRED],
       [VIEW1.a2.HUND_CLUST], [VIEW1.a2.HUND_NULL], [VIEW1.a2.CHAR_UNIQUE], [VIEW1.a2.CHAR_HUND], [VIEW1.a2.VCHAR_UNIQUE], [VIEW1.a2.VCHAR_HUND], [VIEW1.a2.DATE_UNIQUE],
       [VIEW1.a2.DATE_HUND], [VIEW1.a2.ALL_NULL], [VIEW1.a2.NUMERIC]), filter([cast(VIEW1.a2.HUNDRED, DECIMAL(10, 0)) >= VIEW1.avg(a2.hundred)]), rowset=256
      access([VIEW1.avg(a2.hundred)], [VIEW1.a2.TEN], [VIEW1.a2.__pk_increment], [VIEW1.a2.THOUSAND], [VIEW1.a2.UNIQUE1], [VIEW1.a2.UNIQUE2], [VIEW1.a2.UNIQUE3],
       [VIEW1.a2.HUNDRED], [VIEW1.a2.HUND_CLUST], [VIEW1.a2.HUND_NULL], [VIEW1.a2.CHAR_UNIQUE], [VIEW1.a2.CHAR_HUND], [VIEW1.a2.VCHAR_UNIQUE], [VIEW1.a2.VCHAR_HUND],
       [VIEW1.a2.DATE_UNIQUE], [VIEW1.a2.DATE_HUND], [VIEW1.a2.ALL_NULL], [VIEW1.a2.NUMERIC])
  2 - output([cast(cast(T_FUN_SUM(a2.HUNDRED), DECIMAL_INT(64, 32)) / cast(T_FUN_COUNT(a2.HUNDRED), DECIMAL_INT(20, 0)), DECIMAL(14, 4))], [a2.TEN], [a2.__pk_increment],
       [a2.THOUSAND], [a2.UNIQUE1], [a2.UNIQUE2], [a2.UNIQUE3], [a2.HUNDRED], [a2.HUND_CLUST], [a2.HUND_NULL], [a2.CHAR_UNIQUE], [a2.CHAR_HUND], [a2.VCHAR_UNIQUE],
       [a2.VCHAR_HUND], [a2.DATE_UNIQUE], [a2.DATE_HUND], [a2.ALL_NULL], [a2.NUMERIC]), filter(nil), rowset=256
      win_expr(T_FUN_SUM(a2.HUNDRED)), partition_by([a2.TEN]), order_by(nil), window_type(RANGE), upper(UNBOUNDED PRECEDING), lower(UNBOUNDED FOLLOWING)
      win_expr(T_FUN_COUNT(a2.HUNDRED)), partition_by([a2.TEN]), order_by(nil), window_type(RANGE), upper(UNBOUNDED PRECEDING), lower(UNBOUNDED FOLLOWING)
  3 - output([a2.HUNDRED], [a2.TEN], [a2.__pk_increment], [a2.THOUSAND], [a2.UNIQUE1], [a2.UNIQUE2], [a2.UNIQUE3], [a2.HUND_CLUST], [a2.HUND_NULL], [a2.CHAR_UNIQUE],
       [a2.CHAR_HUND], [a2.VCHAR_UNIQUE], [a2.VCHAR_HUND], [a2.DATE_UNIQUE], [a2.DATE_HUND], [a2.ALL_NULL], [a2.NUMERIC]), filter(nil), rowset=256
      sort_keys([HASH(a2.TEN), ASC], [a2.TEN, ASC])
  4 - output([a2.__pk_increment], [a2.TEN], [a2.UNIQUE1], [a2.HUNDRED], [a2.THOUSAND], [a2.UNIQUE2], [a2.UNIQUE3], [a2.HUND_CLUST], [a2.HUND_NULL], [a2.CHAR_UNIQUE],
       [a2.CHAR_HUND], [a2.VCHAR_UNIQUE], [a2.VCHAR_HUND], [a2.DATE_UNIQUE], [a2.DATE_HUND], [a2.ALL_NULL], [a2.NUMERIC]), filter([a2.TEN IS NOT NULL]), rowset=256
      access([a2.__pk_increment], [a2.TEN], [a2.UNIQUE1], [a2.HUNDRED], [a2.THOUSAND], [a2.UNIQUE2], [a2.UNIQUE3], [a2.HUND_CLUST], [a2.HUND_NULL], [a2.CHAR_UNIQUE],
       [a2.CHAR_HUND], [a2.VCHAR_UNIQUE], [a2.VCHAR_HUND], [a2.DATE_UNIQUE], [a2.DATE_HUND], [a2.ALL_NULL], [a2.NUMERIC]), partitions(p0)
      is_index_back=true, is_global_index=false, filter_before_indexback[false], 
      range_key([a2.UNIQUE1], [a2.shadow_pk_0]), range(0,MAX ; MAX,MAX), 
      range_cond([a2.UNIQUE1 > cast(0 + 0, DECIMAL_INT(10, 0))])
update t2_100 a1 set a1.thousand = a1.unique1 where a1.unique1 > 0 + 0 and a1.hundred >= (select avg(a2.hundred) from t2_100 a2 where a1.ten = a2.ten and a2.unique1 > 0 + 0);
select/*no explain*/sum(thousand), stddev(thousand) from t2_100;
+---------------+-------------------+
| sum(thousand) | stddev(thousand)  |
+---------------+-------------------+
|          4950 | 28.86607004772212 |
+---------------+-------------------+
rollback;
EXPLAIN delete from t2_100 a1 where a1.unique1 > 0 + 0 and a1.hundred >= (select avg(a2.hundred) from t2_100 a2 where a1.ten = a2.ten and a2.unique1 > 0 + 0);
Query Plan
======================================================================
|ID|OPERATOR                |NAME              |EST.ROWS|EST.TIME(us)|
----------------------------------------------------------------------
|0 |DELETE                  |                  |5       |646         |
|1 |└─SUBPLAN SCAN          |VIEW1             |5       |614         |
|2 |  └─WINDOW FUNCTION     |                  |99      |612         |
|3 |    └─PARTITION SORT    |                  |99      |426         |
|4 |      └─TABLE RANGE SCAN|a2(T2_100_UNIQUE1)|99      |362         |
======================================================================
Outputs & filters:
-------------------------------------
  0 - output(nil), filter(nil)
      table_columns([{VIEW1: ({t2_100: (VIEW1.a2.__pk_increment, VIEW1.a2.UNIQUE1, VIEW1.a2.UNIQUE2, VIEW1.a2.UNIQUE3, VIEW1.a2.TEN, VIEW1.a2.HUNDRED, VIEW1.a2.THOUSAND,
       VIEW1.a2.HUND_CLUST, VIEW1.a2.HUND_NULL, VIEW1.a2.CHAR_UNIQUE, VIEW1.a2.CHAR_HUND, VIEW1.a2.VCHAR_UNIQUE, VIEW1.a2.VCHAR_HUND, VIEW1.a2.DATE_UNIQUE, VIEW1.a2.DATE_HUND,
       VIEW1.a2.ALL_NULL, VIEW1.a2.NUMERIC)})}])
  1 - output([VIEW1.a2.TEN], [VIEW1.a2.__pk_increment], [VIEW1.a2.UNIQUE1], [VIEW1.a2.UNIQUE2], [VIEW1.a2.UNIQUE3], [VIEW1.a2.HUNDRED], [VIEW1.a2.THOUSAND],
       [VIEW1.a2.HUND_CLUST], [VIEW1.a2.HUND_NULL], [VIEW1.a2.CHAR_UNIQUE], [VIEW1.a2.CHAR_HUND], [VIEW1.a2.VCHAR_UNIQUE], [VIEW1.a2.VCHAR_HUND], [VIEW1.a2.DATE_UNIQUE],
       [VIEW1.a2.DATE_HUND], [VIEW1.a2.ALL_NULL], [VIEW1.a2.NUMERIC]), filter([cast(VIEW1.a2.HUNDRED, DECIMAL(10, 0)) >= VIEW1.avg(a2.hundred)]), rowset=256
      access([VIEW1.avg(a2.hundred)], [VIEW1.a2.TEN], [VIEW1.a2.__pk_increment], [VIEW1.a2.UNIQUE1], [VIEW1.a2.UNIQUE2], [VIEW1.a2.UNIQUE3], [VIEW1.a2.HUNDRED],
       [VIEW1.a2.THOUSAND], [VIEW1.a2.HUND_CLUST], [VIEW1.a2.HUND_NULL], [VIEW1.a2.CHAR_UNIQUE], [VIEW1.a2.CHAR_HUND], [VIEW1.a2.VCHAR_UNIQUE], [VIEW1.a2.VCHAR_HUND],
       [VIEW1.a2.DATE_UNIQUE], [VIEW1.a2.DATE_HUND], [VIEW1.a2.ALL_NULL], [VIEW1.a2.NUMERIC])
  2 - output([cast(cast(T_FUN_SUM(a2.HUNDRED), DECIMAL_INT(64, 32)) / cast(T_FUN_COUNT(a2.HUNDRED), DECIMAL_INT(20, 0)), DECIMAL(14, 4))], [a2.TEN], [a2.__pk_increment],
       [a2.UNIQUE1], [a2.UNIQUE2], [a2.UNIQUE3], [a2.HUNDRED], [a2.THOUSAND], [a2.HUND_CLUST], [a2.HUND_NULL], [a2.CHAR_UNIQUE], [a2.CHAR_HUND], [a2.VCHAR_UNIQUE],
       [a2.VCHAR_HUND], [a2.DATE_UNIQUE], [a2.DATE_HUND], [a2.ALL_NULL], [a2.NUMERIC]), filter(nil), rowset=256
      win_expr(T_FUN_SUM(a2.HUNDRED)), partition_by([a2.TEN]), order_by(nil), window_type(RANGE), upper(UNBOUNDED PRECEDING), lower(UNBOUNDED FOLLOWING)
      win_expr(T_FUN_COUNT(a2.HUNDRED)), partition_by([a2.TEN]), order_by(nil), window_type(RANGE), upper(UNBOUNDED PRECEDING), lower(UNBOUNDED FOLLOWING)
  3 - output([a2.HUNDRED], [a2.TEN], [a2.__pk_increment], [a2.UNIQUE1], [a2.UNIQUE2], [a2.UNIQUE3], [a2.THOUSAND], [a2.HUND_CLUST], [a2.HUND_NULL], [a2.CHAR_UNIQUE],
       [a2.CHAR_HUND], [a2.VCHAR_UNIQUE], [a2.VCHAR_HUND], [a2.DATE_UNIQUE], [a2.DATE_HUND], [a2.ALL_NULL], [a2.NUMERIC]), filter(nil), rowset=256
      sort_keys([HASH(a2.TEN), ASC], [a2.TEN, ASC])
  4 - output([a2.__pk_increment], [a2.TEN], [a2.UNIQUE1], [a2.HUNDRED], [a2.UNIQUE2], [a2.UNIQUE3], [a2.THOUSAND], [a2.HUND_CLUST], [a2.HUND_NULL], [a2.CHAR_UNIQUE],
       [a2.CHAR_HUND], [a2.VCHAR_UNIQUE], [a2.VCHAR_HUND], [a2.DATE_UNIQUE], [a2.DATE_HUND], [a2.ALL_NULL], [a2.NUMERIC]), filter([a2.TEN IS NOT NULL]), rowset=256
      access([a2.__pk_increment], [a2.TEN], [a2.UNIQUE1], [a2.HUNDRED], [a2.UNIQUE2], [a2.UNIQUE3], [a2.THOUSAND], [a2.HUND_CLUST], [a2.HUND_NULL], [a2.CHAR_UNIQUE],
       [a2.CHAR_HUND], [a2.VCHAR_UNIQUE], [a2.VCHAR_HUND], [a2.DATE_UNIQUE], [a2.DATE_HUND], [a2.ALL_NULL], [a2.NUMERIC]), partitions(p0)
      is_index_back=true, is_global_index=false, filter_before_indexback[false], 
      range_key([a2.UNIQUE1], [a2.shadow_pk_0]), range(0,MAX ; MAX,MAX), 
      range_cond([a2.UNIQUE1 > cast(0 + 0, DECIMAL_INT(10, 0))])
delete from t2_100 a1 where a1.unique1 > 0 + 0 and a1.hundred >= (select avg(a2.hundred) from t2_100 a2 where a1.ten = a2.ten and a2.unique1 > 0 + 0);
select/*no explain*/count(*), stddev(thousand) from t2_100;
+----------+--------------------+
| count(*) | stddev(thousand)   |
+----------+--------------------+
|       50 | 14.430869689661812 |
+----------+--------------------+
rollback;
EXPLAIN insert into tmp select avg(a1.thousand) from t2_100 a1 where a1.unique1 > 0 + 0 and a1.hundred >= (select avg(a2.hundred) from t2_100 a2 where a1.ten = a2.ten and a2.unique1 > 0 + 0);
Query Plan
==========================================================================
|ID|OPERATOR                    |NAME              |EST.ROWS|EST.TIME(us)|
--------------------------------------------------------------------------
|0 |INSERT                      |                  |1       |462         |
|1 |└─SUBPLAN SCAN              |ANONYMOUS_VIEW1   |1       |449         |
|2 |  └─SCALAR GROUP BY         |                  |1       |449         |
|3 |    └─SUBPLAN SCAN          |VIEW1             |5       |449         |
|4 |      └─WINDOW FUNCTION     |                  |99      |447         |
|5 |        └─PARTITION SORT    |                  |99      |302         |
|6 |          └─TABLE RANGE SCAN|a2(T2_100_UNIQUE1)|99      |279         |
==========================================================================
Outputs & filters:
-------------------------------------
  0 - output(nil), filter(nil)
      columns([{tmp: ({tmp: (tmp.__pk_increment, tmp.c1)})}]), partitions(p0), 
      column_values([T_HIDDEN_PK], [column_conv(INT,PS:(11,0),NULL,cast(ANONYMOUS_VIEW1.avg(a1.thousand), INT(-1, 0)))])
  1 - output([ANONYMOUS_VIEW1.avg(a1.thousand)]), filter(nil), rowset=256
      access([ANONYMOUS_VIEW1.avg(a1.thousand)])
  2 - output([cast(cast(T_FUN_SUM(VIEW1.a2.THOUSAND), DECIMAL_INT(64, 32)) / cast(T_FUN_COUNT(VIEW1.a2.THOUSAND), DECIMAL_INT(20, 0)), DECIMAL(14, 4))]), filter(nil), rowset=256
      group(nil), agg_func([T_FUN_SUM(VIEW1.a2.THOUSAND)], [T_FUN_COUNT(VIEW1.a2.THOUSAND)])
  3 - output([VIEW1.a2.THOUSAND]), filter([cast(VIEW1.a2.HUNDRED, DECIMAL(10, 0)) >= VIEW1.avg(a2.hundred)]), rowset=256
      access([VIEW1.avg(a2.hundred)], [VIEW1.a2.HUNDRED], [VIEW1.a2.THOUSAND])
  4 - output([cast(cast(T_FUN_SUM(a2.HUNDRED), DECIMAL_INT(64, 32)) / cast(T_FUN_COUNT(a2.HUNDRED), DECIMAL_INT(20, 0)), DECIMAL(14, 4))], [a2.HUNDRED],
       [a2.THOUSAND]), filter(nil), rowset=256
      win_expr(T_FUN_SUM(a2.HUNDRED)), partition_by([a2.TEN]), order_by(nil), window_type(RANGE), upper(UNBOUNDED PRECEDING), lower(UNBOUNDED FOLLOWING)
      win_expr(T_FUN_COUNT(a2.HUNDRED)), partition_by([a2.TEN]), order_by(nil), window_type(RANGE), upper(UNBOUNDED PRECEDING), lower(UNBOUNDED FOLLOWING)
  5 - output([a2.HUNDRED], [a2.TEN], [a2.THOUSAND]), filter(nil), rowset=256
      sort_keys([HASH(a2.TEN), ASC], [a2.TEN, ASC])
  6 - output([a2.TEN], [a2.HUNDRED], [a2.THOUSAND]), filter([a2.TEN IS NOT NULL]), rowset=256
      access([a2.__pk_increment], [a2.TEN], [a2.HUNDRED], [a2.THOUSAND]), partitions(p0)
      is_index_back=true, is_global_index=false, filter_before_indexback[false], 
      range_key([a2.UNIQUE1], [a2.shadow_pk_0]), range(0,MAX ; MAX,MAX), 
      range_cond([a2.UNIQUE1 > cast(0 + 0, DECIMAL_INT(10, 0))])
insert into tmp select avg(a1.thousand) from t2_100 a1 where a1.unique1 > 0 + 0 and a1.hundred >= (select avg(a2.hundred) from t2_100 a2 where a1.ten = a2.ten and a2.unique1 > 0 + 0);
select/*no explain*/* from tmp;
+------+
| c1   |
+------+
|   75 |
+------+
rollback;

EXPLAIN select avg(a1.thousand) from t2_100 a1 where a1.hundred >= (select avg(a2.hundred) from t2_100 a2 where a1.ten > a2.ten);
Query Plan
==================================================================
|ID|OPERATOR                |NAME          |EST.ROWS|EST.TIME(us)|
------------------------------------------------------------------
|0 |SCALAR GROUP BY         |              |1       |10382       |
|1 |└─SUBPLAN SCAN          |VIEW1         |5       |10381       |
|2 |  └─MERGE GROUP BY      |              |5       |10381       |
|3 |    └─NESTED-LOOP JOIN  |              |5000    |10156       |
|4 |      ├─TABLE FULL SCAN |a1            |100     |10          |
|5 |      └─TABLE RANGE SCAN|a2(T2_100_TEN)|34      |100         |
==================================================================
Outputs & filters:
-------------------------------------
  0 - output([cast(cast(T_FUN_SUM(VIEW1.a1.THOUSAND), DECIMAL_INT(64, 32)) / cast(T_FUN_COUNT(VIEW1.a1.THOUSAND), DECIMAL_INT(20, 0)), DECIMAL(14, 4))]), filter(nil), rowset=256
      group(nil), agg_func([T_FUN_SUM(VIEW1.a1.THOUSAND)], [T_FUN_COUNT(VIEW1.a1.THOUSAND)])
  1 - output([VIEW1.a1.THOUSAND]), filter(nil), rowset=256
      access([VIEW1.a1.THOUSAND])
  2 - output([a1.THOUSAND]), filter([cast(a1.HUNDRED, DECIMAL(10, 0)) >= cast(cast(T_FUN_SUM(a2.HUNDRED), DECIMAL_INT(64, 32)) / cast(T_FUN_COUNT(a2.HUNDRED),
       DECIMAL_INT(20, 0)), DECIMAL(14, 4))]), rowset=256
      group([a1.__pk_increment]), agg_func([T_FUN_SUM(a2.HUNDRED)], [T_FUN_COUNT(a2.HUNDRED)])
  3 - output([a1.__pk_increment], [a2.HUNDRED], [a1.THOUSAND], [a1.HUNDRED]), filter(nil), rowset=256
      conds(nil), nl_params_([a1.TEN(:0)]), use_batch=true
  4 - output([a1.__pk_increment], [a1.TEN], [a1.HUNDRED], [a1.THOUSAND]), filter(nil), rowset=256
      access([a1.__pk_increment], [a1.TEN], [a1.HUNDRED], [a1.THOUSAND]), partitions(p0)
      is_index_back=false, is_global_index=false, 
      range_key([a1.__pk_increment]), range(MIN ; MAX)always true
  5 - output([a2.HUNDRED]), filter(nil), rowset=256
      access([GROUP_ID], [a2.__pk_increment], [a2.HUNDRED]), partitions(p0)
      is_index_back=true, is_global_index=false, 
      range_key([a2.TEN], [a2.__pk_increment]), range(MIN ; MAX), 
      range_cond([:0 > a2.TEN])
select avg(a1.thousand) from t2_100 a1 where a1.hundred >= (select avg(a2.hundred) from t2_100 a2 where a1.ten > a2.ten);
+------------------+
| avg(a1.thousand) |
+------------------+
|          74.4348 |
+------------------+
EXPLAIN select /*+no_unnest(@qb1)*/ avg(a1.thousand) from t2_100 a1 where a1.hundred >= (select /*+qb_name(qb1)*/avg(a2.hundred) from t2_100 a2 where a1.ten > a2.ten);
Query Plan
================================================================
|ID|OPERATOR              |NAME          |EST.ROWS|EST.TIME(us)|
----------------------------------------------------------------
|0 |SCALAR GROUP BY       |              |1       |10367       |
|1 |└─SUBPLAN FILTER      |              |34      |10366       |
|2 |  ├─TABLE FULL SCAN   |a1            |100     |8           |
|3 |  └─SCALAR GROUP BY   |              |1       |104         |
|4 |    └─TABLE RANGE SCAN|a2(T2_100_TEN)|34      |103         |
================================================================
Outputs & filters:
-------------------------------------
  0 - output([cast(cast(T_FUN_SUM(a1.THOUSAND), DECIMAL_INT(64, 32)) / cast(T_FUN_COUNT(a1.THOUSAND), DECIMAL_INT(20, 0)), DECIMAL(14, 4))]), filter(nil), rowset=256
      group(nil), agg_func([T_FUN_SUM(a1.THOUSAND)], [T_FUN_COUNT(a1.THOUSAND)])
  1 - output([a1.THOUSAND]), filter([cast(a1.HUNDRED, DECIMAL(10, 0)) >= subquery(1)]), rowset=256
      exec_params_([a1.TEN(:0)]), onetime_exprs_(nil), init_plan_idxs_(nil), use_batch=false
  2 - output([a1.TEN], [a1.HUNDRED], [a1.THOUSAND]), filter(nil), rowset=256
      access([a1.TEN], [a1.HUNDRED], [a1.THOUSAND]), partitions(p0)
      is_index_back=false, is_global_index=false, 
      range_key([a1.__pk_increment]), range(MIN ; MAX)always true
  3 - output([cast(cast(T_FUN_SUM(a2.HUNDRED), DECIMAL_INT(64, 32)) / cast(T_FUN_COUNT(a2.HUNDRED), DECIMAL_INT(20, 0)), DECIMAL(14, 4))]), filter(nil), rowset=256
      group(nil), agg_func([T_FUN_SUM(a2.HUNDRED)], [T_FUN_COUNT(a2.HUNDRED)])
  4 - output([a2.HUNDRED]), filter(nil), rowset=256
      access([a2.__pk_increment], [a2.HUNDRED]), partitions(p0)
      is_index_back=true, is_global_index=false, 
      range_key([a2.TEN], [a2.__pk_increment]), range(MIN,MIN ; MAX,MAX)always true, 
      range_cond([:0 > a2.TEN])
select /*+no_unnest(@qb1)*/ avg(a1.thousand) from t2_100 a1 where a1.hundred >= (select /*+qb_name(qb1)*/avg(a2.hundred) from t2_100 a2 where a1.ten > a2.ten);
+------------------+
| avg(a1.thousand) |
+------------------+
|          74.4348 |
+------------------+

EXPLAIN update t2_100 a1 set a1.thousand = a1.unique1 where a1.hundred >= (select avg(a2.hundred) from t2_100 a2 where a1.ten > a2.ten);
Query Plan
==================================================================
|ID|OPERATOR                |NAME          |EST.ROWS|EST.TIME(us)|
------------------------------------------------------------------
|0 |UPDATE                  |              |5       |10508       |
|1 |└─SUBPLAN SCAN          |VIEW1         |5       |10447       |
|2 |  └─MERGE GROUP BY      |              |5       |10447       |
|3 |    └─NESTED-LOOP JOIN  |              |5000    |10172       |
|4 |      ├─TABLE FULL SCAN |a1            |100     |26          |
|5 |      └─TABLE RANGE SCAN|a2(T2_100_TEN)|34      |100         |
==================================================================
Outputs & filters:
-------------------------------------
  0 - output(nil), filter(nil)
      table_columns([{VIEW1: ({t2_100: (VIEW1.a1.__pk_increment, VIEW1.a1.UNIQUE1, VIEW1.a1.UNIQUE2, VIEW1.a1.UNIQUE3, VIEW1.a1.TEN, VIEW1.a1.HUNDRED, VIEW1.a1.THOUSAND,
       VIEW1.a1.HUND_CLUST, VIEW1.a1.HUND_NULL, VIEW1.a1.CHAR_UNIQUE, VIEW1.a1.CHAR_HUND, VIEW1.a1.VCHAR_UNIQUE, VIEW1.a1.VCHAR_HUND, VIEW1.a1.DATE_UNIQUE, VIEW1.a1.DATE_HUND,
       VIEW1.a1.ALL_NULL, VIEW1.a1.NUMERIC)})}]),
      update([VIEW1.a1.THOUSAND=column_conv(DECIMAL_INT,PS:(10,0),NULL,VIEW1.a1.UNIQUE1)])
  1 - output([VIEW1.a1.__pk_increment], [VIEW1.a1.UNIQUE1], [VIEW1.a1.UNIQUE2], [VIEW1.a1.UNIQUE3], [VIEW1.a1.TEN], [VIEW1.a1.HUNDRED], [VIEW1.a1.THOUSAND],
       [VIEW1.a1.HUND_CLUST], [VIEW1.a1.HUND_NULL], [VIEW1.a1.CHAR_UNIQUE], [VIEW1.a1.CHAR_HUND], [VIEW1.a1.VCHAR_UNIQUE], [VIEW1.a1.VCHAR_HUND], [VIEW1.a1.DATE_UNIQUE],
       [VIEW1.a1.DATE_HUND], [VIEW1.a1.ALL_NULL], [VIEW1.a1.NUMERIC]), filter(nil), rowset=256
      access([VIEW1.a1.__pk_increment], [VIEW1.a1.UNIQUE1], [VIEW1.a1.UNIQUE2], [VIEW1.a1.UNIQUE3], [VIEW1.a1.TEN], [VIEW1.a1.HUNDRED], [VIEW1.a1.THOUSAND],
       [VIEW1.a1.HUND_CLUST], [VIEW1.a1.HUND_NULL], [VIEW1.a1.CHAR_UNIQUE], [VIEW1.a1.CHAR_HUND], [VIEW1.a1.VCHAR_UNIQUE], [VIEW1.a1.VCHAR_HUND], [VIEW1.a1.DATE_UNIQUE],
       [VIEW1.a1.DATE_HUND], [VIEW1.a1.ALL_NULL], [VIEW1.a1.NUMERIC])
  2 - output([a1.__pk_increment], [a1.UNIQUE1], [a1.UNIQUE2], [a1.UNIQUE3], [a1.TEN], [a1.HUNDRED], [a1.THOUSAND], [a1.HUND_CLUST], [a1.HUND_NULL], [a1.CHAR_UNIQUE],
       [a1.CHAR_HUND], [a1.VCHAR_UNIQUE], [a1.VCHAR_HUND], [a1.DATE_UNIQUE], [a1.DATE_HUND], [a1.ALL_NULL], [a1.NUMERIC]), filter([cast(a1.HUNDRED, DECIMAL(10,
       0)) >= cast(cast(T_FUN_SUM(a2.HUNDRED), DECIMAL_INT(64, 32)) / cast(T_FUN_COUNT(a2.HUNDRED), DECIMAL_INT(20, 0)), DECIMAL(14, 4))]), rowset=256
      group([a1.__pk_increment]), agg_func([T_FUN_SUM(a2.HUNDRED)], [T_FUN_COUNT(a2.HUNDRED)])
  3 - output([a1.__pk_increment], [a2.HUNDRED], [a1.UNIQUE1], [a1.UNIQUE2], [a1.UNIQUE3], [a1.TEN], [a1.HUNDRED], [a1.THOUSAND], [a1.HUND_CLUST], [a1.HUND_NULL],
       [a1.CHAR_UNIQUE], [a1.CHAR_HUND], [a1.VCHAR_UNIQUE], [a1.VCHAR_HUND], [a1.DATE_UNIQUE], [a1.DATE_HUND], [a1.ALL_NULL], [a1.NUMERIC]), filter(nil), rowset=256
      conds(nil), nl_params_([a1.TEN(:0)]), use_batch=true
  4 - output([a1.__pk_increment], [a1.THOUSAND], [a1.UNIQUE1], [a1.UNIQUE2], [a1.UNIQUE3], [a1.TEN], [a1.HUNDRED], [a1.HUND_CLUST], [a1.HUND_NULL], [a1.CHAR_UNIQUE],
       [a1.CHAR_HUND], [a1.VCHAR_UNIQUE], [a1.VCHAR_HUND], [a1.DATE_UNIQUE], [a1.DATE_HUND], [a1.ALL_NULL], [a1.NUMERIC]), filter(nil), rowset=256
      access([a1.__pk_increment], [a1.THOUSAND], [a1.UNIQUE1], [a1.UNIQUE2], [a1.UNIQUE3], [a1.TEN], [a1.HUNDRED], [a1.HUND_CLUST], [a1.HUND_NULL], [a1.CHAR_UNIQUE],
       [a1.CHAR_HUND], [a1.VCHAR_UNIQUE], [a1.VCHAR_HUND], [a1.DATE_UNIQUE], [a1.DATE_HUND], [a1.ALL_NULL], [a1.NUMERIC]), partitions(p0)
      is_index_back=false, is_global_index=false, 
      range_key([a1.__pk_increment]), range(MIN ; MAX)always true
  5 - output([a2.HUNDRED]), filter(nil), rowset=256
      access([GROUP_ID], [a2.__pk_increment], [a2.HUNDRED]), partitions(p0)
      is_index_back=true, is_global_index=false, 
      range_key([a2.TEN], [a2.__pk_increment]), range(MIN ; MAX), 
      range_cond([:0 > a2.TEN])
update t2_100 a1 set a1.thousand = a1.unique1 where a1.hundred >= (select avg(a2.hundred) from t2_100 a2 where a1.ten > a2.ten);
select/*no explain*/sum(thousand), stddev(thousand) from t2_100;
+---------------+-------------------+
| sum(thousand) | stddev(thousand)  |
+---------------+-------------------+
|          4950 | 28.86607004772212 |
+---------------+-------------------+
rollback;
EXPLAIN delete from t2_100 a1 where a1.hundred >= (select avg(a2.hundred) from t2_100 a2 where a1.ten > a2.ten);
Query Plan
==================================================================
|ID|OPERATOR                |NAME          |EST.ROWS|EST.TIME(us)|
------------------------------------------------------------------
|0 |DELETE                  |              |5       |10478       |
|1 |└─SUBPLAN SCAN          |VIEW1         |5       |10447       |
|2 |  └─MERGE GROUP BY      |              |5       |10447       |
|3 |    └─NESTED-LOOP JOIN  |              |5000    |10172       |
|4 |      ├─TABLE FULL SCAN |a1            |100     |26          |
|5 |      └─TABLE RANGE SCAN|a2(T2_100_TEN)|34      |100         |
==================================================================
Outputs & filters:
-------------------------------------
  0 - output(nil), filter(nil)
      table_columns([{VIEW1: ({t2_100: (VIEW1.a1.__pk_increment, VIEW1.a1.UNIQUE1, VIEW1.a1.UNIQUE2, VIEW1.a1.UNIQUE3, VIEW1.a1.TEN, VIEW1.a1.HUNDRED, VIEW1.a1.THOUSAND,
       VIEW1.a1.HUND_CLUST, VIEW1.a1.HUND_NULL, VIEW1.a1.CHAR_UNIQUE, VIEW1.a1.CHAR_HUND, VIEW1.a1.VCHAR_UNIQUE, VIEW1.a1.VCHAR_HUND, VIEW1.a1.DATE_UNIQUE, VIEW1.a1.DATE_HUND,
       VIEW1.a1.ALL_NULL, VIEW1.a1.NUMERIC)})}])
  1 - output([VIEW1.a1.__pk_increment], [VIEW1.a1.UNIQUE1], [VIEW1.a1.UNIQUE2], [VIEW1.a1.UNIQUE3], [VIEW1.a1.TEN], [VIEW1.a1.HUNDRED], [VIEW1.a1.THOUSAND],
       [VIEW1.a1.HUND_CLUST], [VIEW1.a1.HUND_NULL], [VIEW1.a1.CHAR_UNIQUE], [VIEW1.a1.CHAR_HUND], [VIEW1.a1.VCHAR_UNIQUE], [VIEW1.a1.VCHAR_HUND], [VIEW1.a1.DATE_UNIQUE],
       [VIEW1.a1.DATE_HUND], [VIEW1.a1.ALL_NULL], [VIEW1.a1.NUMERIC]), filter(nil), rowset=256
      access([VIEW1.a1.__pk_increment], [VIEW1.a1.UNIQUE1], [VIEW1.a1.UNIQUE2], [VIEW1.a1.UNIQUE3], [VIEW1.a1.TEN], [VIEW1.a1.HUNDRED], [VIEW1.a1.THOUSAND],
       [VIEW1.a1.HUND_CLUST], [VIEW1.a1.HUND_NULL], [VIEW1.a1.CHAR_UNIQUE], [VIEW1.a1.CHAR_HUND], [VIEW1.a1.VCHAR_UNIQUE], [VIEW1.a1.VCHAR_HUND], [VIEW1.a1.DATE_UNIQUE],
       [VIEW1.a1.DATE_HUND], [VIEW1.a1.ALL_NULL], [VIEW1.a1.NUMERIC])
  2 - output([a1.__pk_increment], [a1.UNIQUE1], [a1.UNIQUE2], [a1.UNIQUE3], [a1.TEN], [a1.HUNDRED], [a1.THOUSAND], [a1.HUND_CLUST], [a1.HUND_NULL], [a1.CHAR_UNIQUE],
       [a1.CHAR_HUND], [a1.VCHAR_UNIQUE], [a1.VCHAR_HUND], [a1.DATE_UNIQUE], [a1.DATE_HUND], [a1.ALL_NULL], [a1.NUMERIC]), filter([cast(a1.HUNDRED, DECIMAL(10,
       0)) >= cast(cast(T_FUN_SUM(a2.HUNDRED), DECIMAL_INT(64, 32)) / cast(T_FUN_COUNT(a2.HUNDRED), DECIMAL_INT(20, 0)), DECIMAL(14, 4))]), rowset=256
      group([a1.__pk_increment]), agg_func([T_FUN_SUM(a2.HUNDRED)], [T_FUN_COUNT(a2.HUNDRED)])
  3 - output([a1.__pk_increment], [a2.HUNDRED], [a1.UNIQUE1], [a1.UNIQUE2], [a1.UNIQUE3], [a1.TEN], [a1.HUNDRED], [a1.THOUSAND], [a1.HUND_CLUST], [a1.HUND_NULL],
       [a1.CHAR_UNIQUE], [a1.CHAR_HUND], [a1.VCHAR_UNIQUE], [a1.VCHAR_HUND], [a1.DATE_UNIQUE], [a1.DATE_HUND], [a1.ALL_NULL], [a1.NUMERIC]), filter(nil), rowset=256
      conds(nil), nl_params_([a1.TEN(:0)]), use_batch=true
  4 - output([a1.__pk_increment], [a1.UNIQUE1], [a1.UNIQUE2], [a1.UNIQUE3], [a1.TEN], [a1.HUNDRED], [a1.THOUSAND], [a1.HUND_CLUST], [a1.HUND_NULL], [a1.CHAR_UNIQUE],
       [a1.CHAR_HUND], [a1.VCHAR_UNIQUE], [a1.VCHAR_HUND], [a1.DATE_UNIQUE], [a1.DATE_HUND], [a1.ALL_NULL], [a1.NUMERIC]), filter(nil), rowset=256
      access([a1.__pk_increment], [a1.UNIQUE1], [a1.UNIQUE2], [a1.UNIQUE3], [a1.TEN], [a1.HUNDRED], [a1.THOUSAND], [a1.HUND_CLUST], [a1.HUND_NULL], [a1.CHAR_UNIQUE],
       [a1.CHAR_HUND], [a1.VCHAR_UNIQUE], [a1.VCHAR_HUND], [a1.DATE_UNIQUE], [a1.DATE_HUND], [a1.ALL_NULL], [a1.NUMERIC]), partitions(p0)
      is_index_back=false, is_global_index=false, 
      range_key([a1.__pk_increment]), range(MIN ; MAX)always true
  5 - output([a2.HUNDRED]), filter(nil), rowset=256
      access([GROUP_ID], [a2.__pk_increment], [a2.HUNDRED]), partitions(p0)
      is_index_back=true, is_global_index=false, 
      range_key([a2.TEN], [a2.__pk_increment]), range(MIN ; MAX), 
      range_cond([:0 > a2.TEN])
delete from t2_100 a1 where a1.hundred >= (select avg(a2.hundred) from t2_100 a2 where a1.ten > a2.ten);
select/*no explain*/count(*), stddev(thousand) from t2_100;
+----------+-------------------+
| count(*) | stddev(thousand)  |
+----------+-------------------+
|       54 | 19.43668275422378 |
+----------+-------------------+
rollback;
EXPLAIN insert into tmp select avg(a1.thousand) from t2_100 a1 where a1.hundred >= (select avg(a2.hundred) from t2_100 a2 where a1.ten > a2.ten);
Query Plan
=======================================================================
|ID|OPERATOR                    |NAME           |EST.ROWS|EST.TIME(us)|
-----------------------------------------------------------------------
|0 |INSERT                      |               |1       |10394       |
|1 |└─SUBPLAN SCAN              |ANONYMOUS_VIEW1|1       |10382       |
|2 |  └─SCALAR GROUP BY         |               |1       |10382       |
|3 |    └─SUBPLAN SCAN          |VIEW1          |5       |10381       |
|4 |      └─MERGE GROUP BY      |               |5       |10381       |
|5 |        └─NESTED-LOOP JOIN  |               |5000    |10156       |
|6 |          ├─TABLE FULL SCAN |a1             |100     |10          |
|7 |          └─TABLE RANGE SCAN|a2(T2_100_TEN) |34      |100         |
=======================================================================
Outputs & filters:
-------------------------------------
  0 - output(nil), filter(nil)
      columns([{tmp: ({tmp: (tmp.__pk_increment, tmp.c1)})}]), partitions(p0), 
      column_values([T_HIDDEN_PK], [column_conv(INT,PS:(11,0),NULL,cast(ANONYMOUS_VIEW1.avg(a1.thousand), INT(-1, 0)))])
  1 - output([ANONYMOUS_VIEW1.avg(a1.thousand)]), filter(nil), rowset=256
      access([ANONYMOUS_VIEW1.avg(a1.thousand)])
  2 - output([cast(cast(T_FUN_SUM(VIEW1.a1.THOUSAND), DECIMAL_INT(64, 32)) / cast(T_FUN_COUNT(VIEW1.a1.THOUSAND), DECIMAL_INT(20, 0)), DECIMAL(14, 4))]), filter(nil), rowset=256
      group(nil), agg_func([T_FUN_SUM(VIEW1.a1.THOUSAND)], [T_FUN_COUNT(VIEW1.a1.THOUSAND)])
  3 - output([VIEW1.a1.THOUSAND]), filter(nil), rowset=256
      access([VIEW1.a1.THOUSAND])
  4 - output([a1.THOUSAND]), filter([cast(a1.HUNDRED, DECIMAL(10, 0)) >= cast(cast(T_FUN_SUM(a2.HUNDRED), DECIMAL_INT(64, 32)) / cast(T_FUN_COUNT(a2.HUNDRED),
       DECIMAL_INT(20, 0)), DECIMAL(14, 4))]), rowset=256
      group([a1.__pk_increment]), agg_func([T_FUN_SUM(a2.HUNDRED)], [T_FUN_COUNT(a2.HUNDRED)])
  5 - output([a1.__pk_increment], [a2.HUNDRED], [a1.THOUSAND], [a1.HUNDRED]), filter(nil), rowset=256
      conds(nil), nl_params_([a1.TEN(:0)]), use_batch=true
  6 - output([a1.__pk_increment], [a1.TEN], [a1.HUNDRED], [a1.THOUSAND]), filter(nil), rowset=256
      access([a1.__pk_increment], [a1.TEN], [a1.HUNDRED], [a1.THOUSAND]), partitions(p0)
      is_index_back=false, is_global_index=false, 
      range_key([a1.__pk_increment]), range(MIN ; MAX)always true
  7 - output([a2.HUNDRED]), filter(nil), rowset=256
      access([GROUP_ID], [a2.__pk_increment], [a2.HUNDRED]), partitions(p0)
      is_index_back=true, is_global_index=false, 
      range_key([a2.TEN], [a2.__pk_increment]), range(MIN ; MAX), 
      range_cond([:0 > a2.TEN])
insert into tmp select avg(a1.thousand) from t2_100 a1 where a1.hundred >= (select avg(a2.hundred) from t2_100 a2 where a1.ten > a2.ten);
select/*no explain*/* from tmp;
+------+
| c1   |
+------+
|   74 |
+------+
rollback;

EXPLAIN select avg(a1.thousand) from t2_100 a1 where a1.hundred >= any (select avg(a2.hundred) from t2_100 a2 where a1.unique1 = a2.unique1);
Query Plan
=================================================
|ID|OPERATOR         |NAME|EST.ROWS|EST.TIME(us)|
-------------------------------------------------
|0 |SCALAR GROUP BY  |    |1       |8           |
|1 |└─TABLE FULL SCAN|a1  |34      |7           |
=================================================
Outputs & filters:
-------------------------------------
  0 - output([cast(cast(T_FUN_SUM(T_FUN_SUM(a1.THOUSAND)), DECIMAL_INT(64, 32)) / cast(T_FUN_COUNT_SUM(T_FUN_COUNT(a1.THOUSAND)), DECIMAL_INT(20, 0)), DECIMAL(14,
       4))]), filter(nil), rowset=256
      group(nil), agg_func([T_FUN_SUM(T_FUN_SUM(a1.THOUSAND))], [T_FUN_COUNT_SUM(T_FUN_COUNT(a1.THOUSAND))])
  1 - output([T_FUN_SUM(a1.THOUSAND)], [T_FUN_COUNT(a1.THOUSAND)]), filter([cast(a1.HUNDRED, DECIMAL(10, 0)) >= cast(cast(cast(a1.HUNDRED, DECIMAL_INT(32,
       0)), DECIMAL_INT(64, 32)) / cast(CASE WHEN a1.HUNDRED IS NOT NULL THEN 1 ELSE 0 END, DECIMAL_INT(20, 0)), DECIMAL(14, 4))]), rowset=256
      access([a1.HUNDRED], [a1.THOUSAND]), partitions(p0)
      is_index_back=false, is_global_index=false, filter_before_indexback[false], 
      range_key([a1.__pk_increment]), range(MIN ; MAX)always true, 
      pushdown_aggregation([T_FUN_SUM(a1.THOUSAND)], [T_FUN_COUNT(a1.THOUSAND)])
select avg(a1.thousand) from t2_100 a1 where a1.hundred >= any (select avg(a2.hundred) from t2_100 a2 where a1.unique1 = a2.unique1);
+------------------+
| avg(a1.thousand) |
+------------------+
|          49.5000 |
+------------------+
EXPLAIN select /*+no_unnest(@qb1)*/ avg(a1.thousand) from t2_100 a1 where a1.hundred >= any (select /*+qb_name(qb1)*/avg(a2.hundred) from t2_100 a2 where a1.unique1 = a2.unique1);
Query Plan
=================================================================
|ID|OPERATOR           |NAME              |EST.ROWS|EST.TIME(us)|
-----------------------------------------------------------------
|0 |SCALAR GROUP BY    |                  |1       |2262        |
|1 |└─SUBPLAN FILTER   |                  |34      |2261        |
|2 |  ├─TABLE FULL SCAN|a1                |100     |8           |
|3 |  └─SCALAR GROUP BY|                  |1       |23          |
|4 |    └─TABLE GET    |a2(T2_100_UNIQUE1)|1       |23          |
=================================================================
Outputs & filters:
-------------------------------------
  0 - output([cast(cast(T_FUN_SUM(a1.THOUSAND), DECIMAL_INT(64, 32)) / cast(T_FUN_COUNT(a1.THOUSAND), DECIMAL_INT(20, 0)), DECIMAL(14, 4))]), filter(nil), rowset=256
      group(nil), agg_func([T_FUN_SUM(a1.THOUSAND)], [T_FUN_COUNT(a1.THOUSAND)])
  1 - output([a1.THOUSAND]), filter([cast(a1.HUNDRED, DECIMAL(10, 0)) >= subquery(1)]), rowset=256
      exec_params_([a1.UNIQUE1(:0)]), onetime_exprs_(nil), init_plan_idxs_(nil), use_batch=false
  2 - output([a1.UNIQUE1], [a1.HUNDRED], [a1.THOUSAND]), filter(nil), rowset=256
      access([a1.UNIQUE1], [a1.HUNDRED], [a1.THOUSAND]), partitions(p0)
      is_index_back=false, is_global_index=false, 
      range_key([a1.__pk_increment]), range(MIN ; MAX)always true
  3 - output([cast(cast(T_FUN_SUM(a2.HUNDRED), DECIMAL_INT(64, 32)) / cast(T_FUN_COUNT(a2.HUNDRED), DECIMAL_INT(20, 0)), DECIMAL(14, 4))]), filter(nil), rowset=256
      group(nil), agg_func([T_FUN_SUM(a2.HUNDRED)], [T_FUN_COUNT(a2.HUNDRED)])
  4 - output([a2.HUNDRED]), filter(nil), rowset=256
      access([a2.__pk_increment], [a2.HUNDRED]), partitions(p0)
      is_index_back=true, is_global_index=false, 
      range_key([a2.UNIQUE1], [a2.shadow_pk_0]), range(MIN,MIN ; MAX,MAX)always true, 
      range_cond([:0 = a2.UNIQUE1])
select /*+no_unnest(@qb1)*/ avg(a1.thousand) from t2_100 a1 where a1.hundred >= any (select /*+qb_name(qb1)*/avg(a2.hundred) from t2_100 a2 where a1.unique1 = a2.unique1);
+------------------+
| avg(a1.thousand) |
+------------------+
|          49.5000 |
+------------------+

EXPLAIN update t2_100 a1 set a1.thousand = a1.unique1 where a1.hundred >= any (select avg(a2.hundred) from t2_100 a2 where a1.unique1 = a2.unique1);
Query Plan
=================================================
|ID|OPERATOR         |NAME|EST.ROWS|EST.TIME(us)|
-------------------------------------------------
|0 |UPDATE           |    |34      |290         |
|1 |└─TABLE FULL SCAN|a1  |34      |14          |
=================================================
Outputs & filters:
-------------------------------------
  0 - output(nil), filter(nil)
      table_columns([{a1: ({t2_100: (a1.__pk_increment, a1.UNIQUE1, a1.UNIQUE2, a1.UNIQUE3, a1.TEN, a1.HUNDRED, a1.THOUSAND, a1.HUND_CLUST, a1.HUND_NULL,
       a1.CHAR_UNIQUE, a1.CHAR_HUND, a1.VCHAR_UNIQUE, a1.VCHAR_HUND, a1.DATE_UNIQUE, a1.DATE_HUND, a1.ALL_NULL, a1.NUMERIC)})}]),
      update([a1.THOUSAND=column_conv(DECIMAL_INT,PS:(10,0),NULL,a1.UNIQUE1)])
  1 - output([a1.__pk_increment], [a1.THOUSAND], [a1.UNIQUE1], [a1.UNIQUE2], [a1.UNIQUE3], [a1.TEN], [a1.HUNDRED], [a1.HUND_CLUST], [a1.HUND_NULL], [a1.CHAR_UNIQUE],
       [a1.CHAR_HUND], [a1.VCHAR_UNIQUE], [a1.VCHAR_HUND], [a1.DATE_UNIQUE], [a1.DATE_HUND], [a1.ALL_NULL], [a1.NUMERIC]), filter([cast(a1.HUNDRED, DECIMAL(10,
       0)) >= cast(cast(cast(a1.HUNDRED, DECIMAL_INT(32, 0)), DECIMAL_INT(64, 32)) / cast(CASE WHEN a1.HUNDRED IS NOT NULL THEN 1 ELSE 0 END, DECIMAL_INT(20, 
      0)), DECIMAL(14, 4))]), rowset=256
      access([a1.__pk_increment], [a1.THOUSAND], [a1.UNIQUE1], [a1.UNIQUE2], [a1.UNIQUE3], [a1.TEN], [a1.HUNDRED], [a1.HUND_CLUST], [a1.HUND_NULL], [a1.CHAR_UNIQUE],
       [a1.CHAR_HUND], [a1.VCHAR_UNIQUE], [a1.VCHAR_HUND], [a1.DATE_UNIQUE], [a1.DATE_HUND], [a1.ALL_NULL], [a1.NUMERIC]), partitions(p0)
      is_index_back=false, is_global_index=false, filter_before_indexback[false], 
      range_key([a1.__pk_increment]), range(MIN ; MAX)always true
update t2_100 a1 set a1.thousand = a1.unique1 where a1.hundred >= any (select avg(a2.hundred) from t2_100 a2 where a1.unique1 = a2.unique1);
select/*no explain*/sum(thousand), stddev(thousand) from t2_100;
+---------------+-------------------+
| sum(thousand) | stddev(thousand)  |
+---------------+-------------------+
|          4950 | 28.86607004772212 |
+---------------+-------------------+
rollback;
EXPLAIN delete from t2_100 a1 where a1.hundred >= any (select avg(a2.hundred) from t2_100 a2 where a1.unique1 = a2.unique1);
Query Plan
=================================================
|ID|OPERATOR         |NAME|EST.ROWS|EST.TIME(us)|
-------------------------------------------------
|0 |DELETE           |    |34      |188         |
|1 |└─TABLE FULL SCAN|a1  |34      |14          |
=================================================
Outputs & filters:
-------------------------------------
  0 - output(nil), filter(nil)
      table_columns([{a1: ({t2_100: (a1.__pk_increment, a1.UNIQUE1, a1.UNIQUE2, a1.UNIQUE3, a1.TEN, a1.HUNDRED, a1.THOUSAND, a1.HUND_CLUST, a1.HUND_NULL,
       a1.CHAR_UNIQUE, a1.CHAR_HUND, a1.VCHAR_UNIQUE, a1.VCHAR_HUND, a1.DATE_UNIQUE, a1.DATE_HUND, a1.ALL_NULL, a1.NUMERIC)})}])
  1 - output([a1.__pk_increment], [a1.UNIQUE1], [a1.UNIQUE2], [a1.UNIQUE3], [a1.TEN], [a1.HUNDRED], [a1.THOUSAND], [a1.HUND_CLUST], [a1.HUND_NULL], [a1.CHAR_UNIQUE],
       [a1.CHAR_HUND], [a1.VCHAR_UNIQUE], [a1.VCHAR_HUND], [a1.DATE_UNIQUE], [a1.DATE_HUND], [a1.ALL_NULL], [a1.NUMERIC]), filter([cast(a1.HUNDRED, DECIMAL(10,
       0)) >= cast(cast(cast(a1.HUNDRED, DECIMAL_INT(32, 0)), DECIMAL_INT(64, 32)) / cast(CASE WHEN a1.HUNDRED IS NOT NULL THEN 1 ELSE 0 END, DECIMAL_INT(20, 
      0)), DECIMAL(14, 4))]), rowset=256
      access([a1.__pk_increment], [a1.UNIQUE1], [a1.UNIQUE2], [a1.UNIQUE3], [a1.TEN], [a1.HUNDRED], [a1.THOUSAND], [a1.HUND_CLUST], [a1.HUND_NULL], [a1.CHAR_UNIQUE],
       [a1.CHAR_HUND], [a1.VCHAR_UNIQUE], [a1.VCHAR_HUND], [a1.DATE_UNIQUE], [a1.DATE_HUND], [a1.ALL_NULL], [a1.NUMERIC]), partitions(p0)
      is_index_back=false, is_global_index=false, filter_before_indexback[false], 
      range_key([a1.__pk_increment]), range(MIN ; MAX)always true
delete from t2_100 a1 where a1.hundred >= any (select avg(a2.hundred) from t2_100 a2 where a1.unique1 = a2.unique1);
select/*no explain*/count(*), stddev(thousand) from t2_100;
+----------+------------------+
| count(*) | stddev(thousand) |
+----------+------------------+
|        0 |             NULL |
+----------+------------------+
rollback;
EXPLAIN insert into tmp select avg(a1.thousand) from t2_100 a1 where a1.hundred >= any (select avg(a2.hundred) from t2_100 a2 where a1.unique1 = a2.unique1);
Query Plan
================================================================
|ID|OPERATOR             |NAME           |EST.ROWS|EST.TIME(us)|
----------------------------------------------------------------
|0 |INSERT               |               |1       |21          |
|1 |└─SUBPLAN SCAN       |ANONYMOUS_VIEW1|1       |8           |
|2 |  └─SCALAR GROUP BY  |               |1       |8           |
|3 |    └─TABLE FULL SCAN|a1             |34      |7           |
================================================================
Outputs & filters:
-------------------------------------
  0 - output(nil), filter(nil)
      columns([{tmp: ({tmp: (tmp.__pk_increment, tmp.c1)})}]), partitions(p0), 
      column_values([T_HIDDEN_PK], [column_conv(INT,PS:(11,0),NULL,cast(ANONYMOUS_VIEW1.avg(a1.thousand), INT(-1, 0)))])
  1 - output([ANONYMOUS_VIEW1.avg(a1.thousand)]), filter(nil), rowset=256
      access([ANONYMOUS_VIEW1.avg(a1.thousand)])
  2 - output([cast(cast(T_FUN_SUM(T_FUN_SUM(a1.THOUSAND)), DECIMAL_INT(64, 32)) / cast(T_FUN_COUNT_SUM(T_FUN_COUNT(a1.THOUSAND)), DECIMAL_INT(20, 0)), DECIMAL(14,
       4))]), filter(nil), rowset=256
      group(nil), agg_func([T_FUN_SUM(T_FUN_SUM(a1.THOUSAND))], [T_FUN_COUNT_SUM(T_FUN_COUNT(a1.THOUSAND))])
  3 - output([T_FUN_SUM(a1.THOUSAND)], [T_FUN_COUNT(a1.THOUSAND)]), filter([cast(a1.HUNDRED, DECIMAL(10, 0)) >= cast(cast(cast(a1.HUNDRED, DECIMAL_INT(32,
       0)), DECIMAL_INT(64, 32)) / cast(CASE WHEN a1.HUNDRED IS NOT NULL THEN 1 ELSE 0 END, DECIMAL_INT(20, 0)), DECIMAL(14, 4))]), rowset=256
      access([a1.HUNDRED], [a1.THOUSAND]), partitions(p0)
      is_index_back=false, is_global_index=false, filter_before_indexback[false], 
      range_key([a1.__pk_increment]), range(MIN ; MAX)always true, 
      pushdown_aggregation([T_FUN_SUM(a1.THOUSAND)], [T_FUN_COUNT(a1.THOUSAND)])
insert into tmp select avg(a1.thousand) from t2_100 a1 where a1.hundred >= any (select avg(a2.hundred) from t2_100 a2 where a1.unique1 = a2.unique1);
select/*no explain*/* from tmp;
+------+
| c1   |
+------+
|   50 |
+------+
rollback;

EXPLAIN select avg(a1.thousand) from t2_100 a1 where a1.hundred >= (select avg(a2.hundred) from t2_100 a2 where a1.ten = a2.ten) and exists (select 1 from t1_100 b1 where b1.unique1 = a1.unique1);
Query Plan
==========================================================
|ID|OPERATOR                 |NAME |EST.ROWS|EST.TIME(us)|
----------------------------------------------------------
|0 |SCALAR GROUP BY          |     |1       |59          |
|1 |└─HASH SEMI JOIN         |     |10      |58          |
|2 |  ├─HASH JOIN            |     |10      |43          |
|3 |  │ ├─SUBPLAN SCAN       |VIEW2|10      |20          |
|4 |  │ │ └─HASH GROUP BY    |     |10      |20          |
|5 |  │ │   └─TABLE FULL SCAN|a2   |100     |6           |
|6 |  │ └─TABLE FULL SCAN    |a1   |100     |9           |
|7 |  └─TABLE FULL SCAN      |b1   |100     |4           |
==========================================================
Outputs & filters:
-------------------------------------
  0 - output([cast(cast(T_FUN_SUM(a1.THOUSAND), DECIMAL_INT(64, 32)) / cast(T_FUN_COUNT(a1.THOUSAND), DECIMAL_INT(20, 0)), DECIMAL(14, 4))]), filter(nil), rowset=256
      group(nil), agg_func([T_FUN_SUM(a1.THOUSAND)], [T_FUN_COUNT(a1.THOUSAND)])
  1 - output([a1.THOUSAND]), filter(nil), rowset=256
      equal_conds([b1.UNIQUE1 = a1.UNIQUE1]), other_conds(nil)
  2 - output([a1.THOUSAND], [a1.UNIQUE1]), filter(nil), rowset=256
      equal_conds([a1.TEN = VIEW2.a2.TEN]), other_conds([cast(a1.HUNDRED, DECIMAL(10, 0)) >= VIEW2.avg(a2.hundred)])
  3 - output([VIEW2.avg(a2.hundred)], [VIEW2.a2.TEN]), filter(nil), rowset=256
      access([VIEW2.avg(a2.hundred)], [VIEW2.a2.TEN])
  4 - output([cast(cast(T_FUN_SUM(a2.HUNDRED), DECIMAL_INT(64, 32)) / cast(T_FUN_COUNT(a2.HUNDRED), DECIMAL_INT(20, 0)), DECIMAL(14, 4))], [a2.TEN]), filter(nil), rowset=256
      group([a2.TEN]), agg_func([T_FUN_SUM(a2.HUNDRED)], [T_FUN_COUNT(a2.HUNDRED)])
  5 - output([a2.TEN], [a2.HUNDRED]), filter(nil), rowset=256
      access([a2.TEN], [a2.HUNDRED]), partitions(p0)
      is_index_back=false, is_global_index=false, 
      range_key([a2.__pk_increment]), range(MIN ; MAX)always true
  6 - output([a1.TEN], [a1.HUNDRED], [a1.UNIQUE1], [a1.THOUSAND]), filter(nil), rowset=256
      access([a1.TEN], [a1.HUNDRED], [a1.UNIQUE1], [a1.THOUSAND]), partitions(p0)
      is_index_back=false, is_global_index=false, 
      range_key([a1.__pk_increment]), range(MIN ; MAX)always true
  7 - output([b1.UNIQUE1]), filter(nil), rowset=256
      access([b1.UNIQUE1]), partitions(p0)
      is_index_back=false, is_global_index=false, 
      range_key([b1.__pk_increment]), range(MIN ; MAX)always true
select avg(a1.thousand) from t2_100 a1 where a1.hundred >= (select avg(a2.hundred) from t2_100 a2 where a1.ten = a2.ten) and exists (select 1 from t1_100 b1 where b1.unique1 = a1.unique1);
+------------------+
| avg(a1.thousand) |
+------------------+
|          74.5000 |
+------------------+
EXPLAIN select /*+no_rewrite*/avg(a1.thousand) from t2_100 a1 where a1.hundred >= (select avg(a2.hundred) from t2_100 a2 where a1.ten = a2.ten) and exists (select 1 from t1_100 b1 where b1.unique1 = a1.unique1);
Query Plan
================================================================
|ID|OPERATOR              |NAME          |EST.ROWS|EST.TIME(us)|
----------------------------------------------------------------
|0 |SCALAR GROUP BY       |              |1       |6312        |
|1 |└─SUBPLAN FILTER      |              |24      |6311        |
|2 |  ├─TABLE FULL SCAN   |a1            |100     |9           |
|3 |  ├─SCALAR GROUP BY   |              |1       |46          |
|4 |  │ └─TABLE RANGE SCAN|a2(T2_100_TEN)|10      |45          |
|5 |  └─TABLE FULL SCAN   |b1            |1       |18          |
================================================================
Outputs & filters:
-------------------------------------
  0 - output([cast(cast(T_FUN_SUM(a1.THOUSAND), DECIMAL_INT(64, 32)) / cast(T_FUN_COUNT(a1.THOUSAND), DECIMAL_INT(20, 0)), DECIMAL(14, 4))]), filter(nil), rowset=256
      group(nil), agg_func([T_FUN_SUM(a1.THOUSAND)], [T_FUN_COUNT(a1.THOUSAND)])
  1 - output([a1.THOUSAND]), filter([(T_OP_EXISTS, subquery(2))], [cast(a1.HUNDRED, DECIMAL(10, 0)) >= subquery(1)]), rowset=256
      exec_params_([a1.TEN(:0)], [a1.UNIQUE1(:1)]), onetime_exprs_(nil), init_plan_idxs_(nil), use_batch=false
  2 - output([a1.TEN], [a1.HUNDRED], [a1.UNIQUE1], [a1.THOUSAND]), filter(nil), rowset=256
      access([a1.TEN], [a1.HUNDRED], [a1.UNIQUE1], [a1.THOUSAND]), partitions(p0)
      is_index_back=false, is_global_index=false, 
      range_key([a1.__pk_increment]), range(MIN ; MAX)always true
  3 - output([cast(cast(T_FUN_SUM(a2.HUNDRED), DECIMAL_INT(64, 32)) / cast(T_FUN_COUNT(a2.HUNDRED), DECIMAL_INT(20, 0)), DECIMAL(14, 4))]), filter(nil), rowset=256
      group(nil), agg_func([T_FUN_SUM(a2.HUNDRED)], [T_FUN_COUNT(a2.HUNDRED)])
  4 - output([a2.HUNDRED]), filter(nil), rowset=256
      access([a2.__pk_increment], [a2.HUNDRED]), partitions(p0)
      is_index_back=true, is_global_index=false, 
      range_key([a2.TEN], [a2.__pk_increment]), range(MIN,MIN ; MAX,MAX)always true, 
      range_cond([:0 = a2.TEN])
  5 - output([1]), filter([b1.UNIQUE1 = :1]), rowset=256
      access([b1.UNIQUE1]), partitions(p0)
      is_index_back=false, is_global_index=false, filter_before_indexback[false], 
      range_key([b1.__pk_increment]), range(MIN ; MAX)always true
select /*+no_rewrite*/avg(a1.thousand) from t2_100 a1 where a1.hundred >= (select avg(a2.hundred) from t2_100 a2 where a1.ten = a2.ten) and exists (select 1 from t1_100 b1 where b1.unique1 = a1.unique1);
+------------------+
| avg(a1.thousand) |
+------------------+
|          74.5000 |
+------------------+

EXPLAIN update t2_100 a1 set a1.thousand = a1.unique1 where a1.hundred >= (select avg(a2.hundred) from t2_100 a2 where a1.ten = a2.ten) and exists (select 1 from t1_100 b1 where b1.unique1 = a1.unique1);
Query Plan
==========================================================
|ID|OPERATOR                 |NAME |EST.ROWS|EST.TIME(us)|
----------------------------------------------------------
|0 |UPDATE                   |     |10      |174         |
|1 |└─HASH SEMI JOIN         |     |10      |74          |
|2 |  ├─HASH JOIN            |     |10      |59          |
|3 |  │ ├─SUBPLAN SCAN       |VIEW2|10      |20          |
|4 |  │ │ └─HASH GROUP BY    |     |10      |20          |
|5 |  │ │   └─TABLE FULL SCAN|a2   |100     |6           |
|6 |  │ └─TABLE FULL SCAN    |a1   |100     |26          |
|7 |  └─TABLE FULL SCAN      |b1   |100     |4           |
==========================================================
Outputs & filters:
-------------------------------------
  0 - output(nil), filter(nil)
      table_columns([{a1: ({t2_100: (a1.__pk_increment, a1.UNIQUE1, a1.UNIQUE2, a1.UNIQUE3, a1.TEN, a1.HUNDRED, a1.THOUSAND, a1.HUND_CLUST, a1.HUND_NULL,
       a1.CHAR_UNIQUE, a1.CHAR_HUND, a1.VCHAR_UNIQUE, a1.VCHAR_HUND, a1.DATE_UNIQUE, a1.DATE_HUND, a1.ALL_NULL, a1.NUMERIC)})}]),
      update([a1.THOUSAND=column_conv(DECIMAL_INT,PS:(10,0),NULL,a1.UNIQUE1)])
  1 - output([a1.__pk_increment], [a1.UNIQUE1], [a1.UNIQUE2], [a1.UNIQUE3], [a1.TEN], [a1.HUNDRED], [a1.THOUSAND], [a1.HUND_CLUST], [a1.HUND_NULL], [a1.CHAR_UNIQUE],
       [a1.CHAR_HUND], [a1.VCHAR_UNIQUE], [a1.VCHAR_HUND], [a1.DATE_UNIQUE], [a1.DATE_HUND], [a1.ALL_NULL], [a1.NUMERIC]), filter(nil), rowset=256
      equal_conds([b1.UNIQUE1 = a1.UNIQUE1]), other_conds(nil)
  2 - output([a1.__pk_increment], [a1.UNIQUE1], [a1.UNIQUE2], [a1.UNIQUE3], [a1.TEN], [a1.HUNDRED], [a1.THOUSAND], [a1.HUND_CLUST], [a1.HUND_NULL], [a1.CHAR_UNIQUE],
       [a1.CHAR_HUND], [a1.VCHAR_UNIQUE], [a1.VCHAR_HUND], [a1.DATE_UNIQUE], [a1.DATE_HUND], [a1.ALL_NULL], [a1.NUMERIC]), filter(nil), rowset=256
      equal_conds([a1.TEN = VIEW2.a2.TEN]), other_conds([cast(a1.HUNDRED, DECIMAL(10, 0)) >= VIEW2.avg(a2.hundred)])
  3 - output([VIEW2.avg(a2.hundred)], [VIEW2.a2.TEN]), filter(nil), rowset=256
      access([VIEW2.avg(a2.hundred)], [VIEW2.a2.TEN])
  4 - output([cast(cast(T_FUN_SUM(a2.HUNDRED), DECIMAL_INT(64, 32)) / cast(T_FUN_COUNT(a2.HUNDRED), DECIMAL_INT(20, 0)), DECIMAL(14, 4))], [a2.TEN]), filter(nil), rowset=256
      group([a2.TEN]), agg_func([T_FUN_SUM(a2.HUNDRED)], [T_FUN_COUNT(a2.HUNDRED)])
  5 - output([a2.TEN], [a2.HUNDRED]), filter(nil), rowset=256
      access([a2.TEN], [a2.HUNDRED]), partitions(p0)
      is_index_back=false, is_global_index=false, 
      range_key([a2.__pk_increment]), range(MIN ; MAX)always true
  6 - output([a1.__pk_increment], [a1.THOUSAND], [a1.UNIQUE1], [a1.UNIQUE2], [a1.UNIQUE3], [a1.TEN], [a1.HUNDRED], [a1.HUND_CLUST], [a1.HUND_NULL], [a1.CHAR_UNIQUE],
       [a1.CHAR_HUND], [a1.VCHAR_UNIQUE], [a1.VCHAR_HUND], [a1.DATE_UNIQUE], [a1.DATE_HUND], [a1.ALL_NULL], [a1.NUMERIC]), filter(nil), rowset=256
      access([a1.__pk_increment], [a1.THOUSAND], [a1.UNIQUE1], [a1.UNIQUE2], [a1.UNIQUE3], [a1.TEN], [a1.HUNDRED], [a1.HUND_CLUST], [a1.HUND_NULL], [a1.CHAR_UNIQUE],
       [a1.CHAR_HUND], [a1.VCHAR_UNIQUE], [a1.VCHAR_HUND], [a1.DATE_UNIQUE], [a1.DATE_HUND], [a1.ALL_NULL], [a1.NUMERIC]), partitions(p0)
      is_index_back=false, is_global_index=false, 
      range_key([a1.__pk_increment]), range(MIN ; MAX)always true
  7 - output([b1.UNIQUE1]), filter(nil), rowset=256
      access([b1.UNIQUE1]), partitions(p0)
      is_index_back=false, is_global_index=false, 
      range_key([b1.__pk_increment]), range(MIN ; MAX)always true
update t2_100 a1 set a1.thousand = a1.unique1 where a1.hundred >= (select avg(a2.hundred) from t2_100 a2 where a1.ten = a2.ten) and exists (select 1 from t1_100 b1 where b1.unique1 = a1.unique1);
select/*no explain*/sum(thousand), stddev(thousand) from t2_100;
+---------------+-------------------+
| sum(thousand) | stddev(thousand)  |
+---------------+-------------------+
|          4950 | 28.86607004772212 |
+---------------+-------------------+
rollback;
EXPLAIN delete from t2_100 a1 where a1.hundred >= (select avg(a2.hundred) from t2_100 a2 where a1.ten = a2.ten) and exists (select 1 from t1_100 b1 where b1.unique1 = a1.unique1);
Query Plan
==========================================================
|ID|OPERATOR                 |NAME |EST.ROWS|EST.TIME(us)|
----------------------------------------------------------
|0 |DELETE                   |     |10      |131         |
|1 |└─HASH SEMI JOIN         |     |10      |74          |
|2 |  ├─HASH JOIN            |     |10      |59          |
|3 |  │ ├─SUBPLAN SCAN       |VIEW2|10      |20          |
|4 |  │ │ └─HASH GROUP BY    |     |10      |20          |
|5 |  │ │   └─TABLE FULL SCAN|a2   |100     |6           |
|6 |  │ └─TABLE FULL SCAN    |a1   |100     |26          |
|7 |  └─TABLE FULL SCAN      |b1   |100     |4           |
==========================================================
Outputs & filters:
-------------------------------------
  0 - output(nil), filter(nil)
      table_columns([{a1: ({t2_100: (a1.__pk_increment, a1.UNIQUE1, a1.UNIQUE2, a1.UNIQUE3, a1.TEN, a1.HUNDRED, a1.THOUSAND, a1.HUND_CLUST, a1.HUND_NULL,
       a1.CHAR_UNIQUE, a1.CHAR_HUND, a1.VCHAR_UNIQUE, a1.VCHAR_HUND, a1.DATE_UNIQUE, a1.DATE_HUND, a1.ALL_NULL, a1.NUMERIC)})}])
  1 - output([a1.__pk_increment], [a1.UNIQUE1], [a1.UNIQUE2], [a1.UNIQUE3], [a1.TEN], [a1.HUNDRED], [a1.THOUSAND], [a1.HUND_CLUST], [a1.HUND_NULL], [a1.CHAR_UNIQUE],
       [a1.CHAR_HUND], [a1.VCHAR_UNIQUE], [a1.VCHAR_HUND], [a1.DATE_UNIQUE], [a1.DATE_HUND], [a1.ALL_NULL], [a1.NUMERIC]), filter(nil), rowset=256
      equal_conds([b1.UNIQUE1 = a1.UNIQUE1]), other_conds(nil)
  2 - output([a1.__pk_increment], [a1.UNIQUE1], [a1.UNIQUE2], [a1.UNIQUE3], [a1.TEN], [a1.HUNDRED], [a1.THOUSAND], [a1.HUND_CLUST], [a1.HUND_NULL], [a1.CHAR_UNIQUE],
       [a1.CHAR_HUND], [a1.VCHAR_UNIQUE], [a1.VCHAR_HUND], [a1.DATE_UNIQUE], [a1.DATE_HUND], [a1.ALL_NULL], [a1.NUMERIC]), filter(nil), rowset=256
      equal_conds([a1.TEN = VIEW2.a2.TEN]), other_conds([cast(a1.HUNDRED, DECIMAL(10, 0)) >= VIEW2.avg(a2.hundred)])
  3 - output([VIEW2.avg(a2.hundred)], [VIEW2.a2.TEN]), filter(nil), rowset=256
      access([VIEW2.avg(a2.hundred)], [VIEW2.a2.TEN])
  4 - output([cast(cast(T_FUN_SUM(a2.HUNDRED), DECIMAL_INT(64, 32)) / cast(T_FUN_COUNT(a2.HUNDRED), DECIMAL_INT(20, 0)), DECIMAL(14, 4))], [a2.TEN]), filter(nil), rowset=256
      group([a2.TEN]), agg_func([T_FUN_SUM(a2.HUNDRED)], [T_FUN_COUNT(a2.HUNDRED)])
  5 - output([a2.TEN], [a2.HUNDRED]), filter(nil), rowset=256
      access([a2.TEN], [a2.HUNDRED]), partitions(p0)
      is_index_back=false, is_global_index=false, 
      range_key([a2.__pk_increment]), range(MIN ; MAX)always true
  6 - output([a1.__pk_increment], [a1.UNIQUE1], [a1.UNIQUE2], [a1.UNIQUE3], [a1.TEN], [a1.HUNDRED], [a1.THOUSAND], [a1.HUND_CLUST], [a1.HUND_NULL], [a1.CHAR_UNIQUE],
       [a1.CHAR_HUND], [a1.VCHAR_UNIQUE], [a1.VCHAR_HUND], [a1.DATE_UNIQUE], [a1.DATE_HUND], [a1.ALL_NULL], [a1.NUMERIC]), filter(nil), rowset=256
      access([a1.__pk_increment], [a1.UNIQUE1], [a1.UNIQUE2], [a1.UNIQUE3], [a1.TEN], [a1.HUNDRED], [a1.THOUSAND], [a1.HUND_CLUST], [a1.HUND_NULL], [a1.CHAR_UNIQUE],
       [a1.CHAR_HUND], [a1.VCHAR_UNIQUE], [a1.VCHAR_HUND], [a1.DATE_UNIQUE], [a1.DATE_HUND], [a1.ALL_NULL], [a1.NUMERIC]), partitions(p0)
      is_index_back=false, is_global_index=false, 
      range_key([a1.__pk_increment]), range(MIN ; MAX)always true
  7 - output([b1.UNIQUE1]), filter(nil), rowset=256
      access([b1.UNIQUE1]), partitions(p0)
      is_index_back=false, is_global_index=false, 
      range_key([b1.__pk_increment]), range(MIN ; MAX)always true
delete from t2_100 a1 where a1.hundred >= (select avg(a2.hundred) from t2_100 a2 where a1.ten = a2.ten) and exists (select 1 from t1_100 b1 where b1.unique1 = a1.unique1);
select/*no explain*/count(*), stddev(thousand) from t2_100;
+----------+--------------------+
| count(*) | stddev(thousand)   |
+----------+--------------------+
|       50 | 14.430869689661812 |
+----------+--------------------+
rollback;
EXPLAIN insert into tmp select avg(a1.thousand) from t2_100 a1 where a1.hundred >= (select avg(a2.hundred) from t2_100 a2 where a1.ten = a2.ten) and exists (select 1 from t1_100 b1 where b1.unique1 = a1.unique1);
Query Plan
========================================================================
|ID|OPERATOR                     |NAME           |EST.ROWS|EST.TIME(us)|
------------------------------------------------------------------------
|0 |INSERT                       |               |1       |72          |
|1 |└─SUBPLAN SCAN               |ANONYMOUS_VIEW1|1       |59          |
|2 |  └─SCALAR GROUP BY          |               |1       |59          |
|3 |    └─HASH SEMI JOIN         |               |10      |58          |
|4 |      ├─HASH JOIN            |               |10      |43          |
|5 |      │ ├─SUBPLAN SCAN       |VIEW2          |10      |20          |
|6 |      │ │ └─HASH GROUP BY    |               |10      |20          |
|7 |      │ │   └─TABLE FULL SCAN|a2             |100     |6           |
|8 |      │ └─TABLE FULL SCAN    |a1             |100     |9           |
|9 |      └─TABLE FULL SCAN      |b1             |100     |4           |
========================================================================
Outputs & filters:
-------------------------------------
  0 - output(nil), filter(nil)
      columns([{tmp: ({tmp: (tmp.__pk_increment, tmp.c1)})}]), partitions(p0), 
      column_values([T_HIDDEN_PK], [column_conv(INT,PS:(11,0),NULL,cast(ANONYMOUS_VIEW1.avg(a1.thousand), INT(-1, 0)))])
  1 - output([ANONYMOUS_VIEW1.avg(a1.thousand)]), filter(nil), rowset=256
      access([ANONYMOUS_VIEW1.avg(a1.thousand)])
  2 - output([cast(cast(T_FUN_SUM(a1.THOUSAND), DECIMAL_INT(64, 32)) / cast(T_FUN_COUNT(a1.THOUSAND), DECIMAL_INT(20, 0)), DECIMAL(14, 4))]), filter(nil), rowset=256
      group(nil), agg_func([T_FUN_SUM(a1.THOUSAND)], [T_FUN_COUNT(a1.THOUSAND)])
  3 - output([a1.THOUSAND]), filter(nil), rowset=256
      equal_conds([b1.UNIQUE1 = a1.UNIQUE1]), other_conds(nil)
  4 - output([a1.THOUSAND], [a1.UNIQUE1]), filter(nil), rowset=256
      equal_conds([a1.TEN = VIEW2.a2.TEN]), other_conds([cast(a1.HUNDRED, DECIMAL(10, 0)) >= VIEW2.avg(a2.hundred)])
  5 - output([VIEW2.avg(a2.hundred)], [VIEW2.a2.TEN]), filter(nil), rowset=256
      access([VIEW2.avg(a2.hundred)], [VIEW2.a2.TEN])
  6 - output([cast(cast(T_FUN_SUM(a2.HUNDRED), DECIMAL_INT(64, 32)) / cast(T_FUN_COUNT(a2.HUNDRED), DECIMAL_INT(20, 0)), DECIMAL(14, 4))], [a2.TEN]), filter(nil), rowset=256
      group([a2.TEN]), agg_func([T_FUN_SUM(a2.HUNDRED)], [T_FUN_COUNT(a2.HUNDRED)])
  7 - output([a2.TEN], [a2.HUNDRED]), filter(nil), rowset=256
      access([a2.TEN], [a2.HUNDRED]), partitions(p0)
      is_index_back=false, is_global_index=false, 
      range_key([a2.__pk_increment]), range(MIN ; MAX)always true
  8 - output([a1.TEN], [a1.HUNDRED], [a1.UNIQUE1], [a1.THOUSAND]), filter(nil), rowset=256
      access([a1.TEN], [a1.HUNDRED], [a1.UNIQUE1], [a1.THOUSAND]), partitions(p0)
      is_index_back=false, is_global_index=false, 
      range_key([a1.__pk_increment]), range(MIN ; MAX)always true
  9 - output([b1.UNIQUE1]), filter(nil), rowset=256
      access([b1.UNIQUE1]), partitions(p0)
      is_index_back=false, is_global_index=false, 
      range_key([b1.__pk_increment]), range(MIN ; MAX)always true
insert into tmp select avg(a1.thousand) from t2_100 a1 where a1.hundred >= (select avg(a2.hundred) from t2_100 a2 where a1.ten = a2.ten) and exists (select 1 from t1_100 b1 where b1.unique1 = a1.unique1);
select/*no explain*/* from tmp;
+------+
| c1   |
+------+
|   75 |
+------+
rollback;

EXPLAIN select avg(a1.thousand) from t2_100 a1 where a1.hundred >= (select avg(a2.hundred) from t2_100 a2 where a1.ten = a2.ten and exists (select 1 from t1_100 b1 where b1.unique1 = a2.unique1));
Query Plan
==============================================================
|ID|OPERATOR                     |NAME |EST.ROWS|EST.TIME(us)|
--------------------------------------------------------------
|0 |SCALAR GROUP BY              |     |1       |78          |
|1 |└─HASH JOIN                  |     |10      |78          |
|2 |  ├─SUBPLAN SCAN             |VIEW2|10      |56          |
|3 |  │ └─HASH GROUP BY          |     |10      |56          |
|4 |  │   └─HASH RIGHT SEMI JOIN |     |100     |43          |
|5 |  │     ├─TABLE FULL SCAN    |b1   |100     |4           |
|6 |  │     └─TABLE FULL SCAN    |a2   |100     |8           |
|7 |  └─TABLE FULL SCAN          |a1   |100     |8           |
==============================================================
Outputs & filters:
-------------------------------------
  0 - output([cast(cast(T_FUN_SUM(a1.THOUSAND), DECIMAL_INT(64, 32)) / cast(T_FUN_COUNT(a1.THOUSAND), DECIMAL_INT(20, 0)), DECIMAL(14, 4))]), filter(nil), rowset=256
      group(nil), agg_func([T_FUN_SUM(a1.THOUSAND)], [T_FUN_COUNT(a1.THOUSAND)])
  1 - output([a1.THOUSAND]), filter(nil), rowset=256
      equal_conds([a1.TEN = VIEW2.a2.TEN]), other_conds([cast(a1.HUNDRED, DECIMAL(10, 0)) >= VIEW2.avg(a2.hundred)])
  2 - output([VIEW2.avg(a2.hundred)], [VIEW2.a2.TEN]), filter(nil), rowset=256
      access([VIEW2.avg(a2.hundred)], [VIEW2.a2.TEN])
  3 - output([cast(cast(T_FUN_SUM(a2.HUNDRED), DECIMAL_INT(64, 32)) / cast(T_FUN_COUNT(a2.HUNDRED), DECIMAL_INT(20, 0)), DECIMAL(14, 4))], [a2.TEN]), filter(nil), rowset=256
      group([a2.TEN]), agg_func([T_FUN_SUM(a2.HUNDRED)], [T_FUN_COUNT(a2.HUNDRED)])
  4 - output([a2.TEN], [a2.HUNDRED]), filter(nil), rowset=256
      equal_conds([b1.UNIQUE1 = a2.UNIQUE1]), other_conds(nil)
  5 - output([b1.UNIQUE1]), filter(nil), rowset=256
      access([b1.UNIQUE1]), partitions(p0)
      is_index_back=false, is_global_index=false, 
      range_key([b1.__pk_increment]), range(MIN ; MAX)always true
  6 - output([a2.TEN], [a2.UNIQUE1], [a2.HUNDRED]), filter(nil), rowset=256
      access([a2.TEN], [a2.UNIQUE1], [a2.HUNDRED]), partitions(p0)
      is_index_back=false, is_global_index=false, 
      range_key([a2.__pk_increment]), range(MIN ; MAX)always true
  7 - output([a1.TEN], [a1.HUNDRED], [a1.THOUSAND]), filter(nil), rowset=256
      access([a1.TEN], [a1.HUNDRED], [a1.THOUSAND]), partitions(p0)
      is_index_back=false, is_global_index=false, 
      range_key([a1.__pk_increment]), range(MIN ; MAX)always true
select avg(a1.thousand) from t2_100 a1 where a1.hundred >= (select avg(a2.hundred) from t2_100 a2 where a1.ten = a2.ten and exists (select 1 from t1_100 b1 where b1.unique1 = a2.unique1));
+------------------+
| avg(a1.thousand) |
+------------------+
|          74.5000 |
+------------------+
EXPLAIN select /*+no_unnest(@qb1)*/ avg(a1.thousand) from t2_100 a1 where a1.hundred >= (select /*+qb_name(qb1)*/avg(a2.hundred) from t2_100 a2 where a1.ten = a2.ten and exists (select /*+no_unnest*/1 from t1_100 b1 where b1.unique1 = a2.unique1));
Query Plan
==================================================================
|ID|OPERATOR                |NAME          |EST.ROWS|EST.TIME(us)|
------------------------------------------------------------------
|0 |SCALAR GROUP BY         |              |1       |22515       |
|1 |└─SUBPLAN FILTER        |              |34      |22514       |
|2 |  ├─TABLE FULL SCAN     |a1            |100     |8           |
|3 |  └─SCALAR GROUP BY     |              |1       |226         |
|4 |    └─SUBPLAN FILTER    |              |5       |225         |
|5 |      ├─TABLE RANGE SCAN|a2(T2_100_TEN)|10      |46          |
|6 |      └─TABLE FULL SCAN |b1            |1       |18          |
==================================================================
Outputs & filters:
-------------------------------------
  0 - output([cast(cast(T_FUN_SUM(a1.THOUSAND), DECIMAL_INT(64, 32)) / cast(T_FUN_COUNT(a1.THOUSAND), DECIMAL_INT(20, 0)), DECIMAL(14, 4))]), filter(nil), rowset=256
      group(nil), agg_func([T_FUN_SUM(a1.THOUSAND)], [T_FUN_COUNT(a1.THOUSAND)])
  1 - output([a1.THOUSAND]), filter([cast(a1.HUNDRED, DECIMAL(10, 0)) >= subquery(1)]), rowset=256
      exec_params_([a1.TEN(:0)]), onetime_exprs_(nil), init_plan_idxs_(nil), use_batch=false
  2 - output([a1.TEN], [a1.HUNDRED], [a1.THOUSAND]), filter(nil), rowset=256
      access([a1.TEN], [a1.HUNDRED], [a1.THOUSAND]), partitions(p0)
      is_index_back=false, is_global_index=false, 
      range_key([a1.__pk_increment]), range(MIN ; MAX)always true
  3 - output([cast(cast(T_FUN_SUM(a2.HUNDRED), DECIMAL_INT(64, 32)) / cast(T_FUN_COUNT(a2.HUNDRED), DECIMAL_INT(20, 0)), DECIMAL(14, 4))]), filter(nil), rowset=256
      group(nil), agg_func([T_FUN_SUM(a2.HUNDRED)], [T_FUN_COUNT(a2.HUNDRED)])
  4 - output([a2.HUNDRED]), filter([(T_OP_EXISTS, subquery(1))]), rowset=256
      exec_params_([a2.UNIQUE1(:1)]), onetime_exprs_(nil), init_plan_idxs_(nil), use_batch=false
  5 - output([a2.UNIQUE1], [a2.HUNDRED]), filter(nil), rowset=256
      access([a2.__pk_increment], [a2.UNIQUE1], [a2.HUNDRED]), partitions(p0)
      is_index_back=true, is_global_index=false, 
      range_key([a2.TEN], [a2.__pk_increment]), range(MIN,MIN ; MAX,MAX)always true, 
      range_cond([:0 = a2.TEN])
  6 - output([1]), filter([b1.UNIQUE1 = :1]), rowset=256
      access([b1.UNIQUE1]), partitions(p0)
      limit(1), offset(nil), is_index_back=false, is_global_index=false, filter_before_indexback[false], 
      range_key([b1.__pk_increment]), range(MIN ; MAX)always true
select /*+no_unnest(@qb1)*/ avg(a1.thousand) from t2_100 a1 where a1.hundred >= (select /*+qb_name(qb1)*/avg(a2.hundred) from t2_100 a2 where a1.ten = a2.ten and exists (select /*+no_unnest*/1 from t1_100 b1 where b1.unique1 = a2.unique1));
+------------------+
| avg(a1.thousand) |
+------------------+
|          74.5000 |
+------------------+

EXPLAIN update t2_100 a1 set a1.thousand = a1.unique1 where a1.hundred >= (select avg(a2.hundred) from t2_100 a2 where a1.ten = a2.ten and exists (select 1 from t1_100 b1 where b1.unique1 = a2.unique1));
Query Plan
==============================================================
|ID|OPERATOR                     |NAME |EST.ROWS|EST.TIME(us)|
--------------------------------------------------------------
|0 |UPDATE                       |     |10      |195         |
|1 |└─HASH JOIN                  |     |10      |96          |
|2 |  ├─SUBPLAN SCAN             |VIEW2|10      |56          |
|3 |  │ └─HASH GROUP BY          |     |10      |56          |
|4 |  │   └─HASH RIGHT SEMI JOIN |     |100     |43          |
|5 |  │     ├─TABLE FULL SCAN    |b1   |100     |4           |
|6 |  │     └─TABLE FULL SCAN    |a2   |100     |8           |
|7 |  └─TABLE FULL SCAN          |a1   |100     |26          |
==============================================================
Outputs & filters:
-------------------------------------
  0 - output(nil), filter(nil)
      table_columns([{a1: ({t2_100: (a1.__pk_increment, a1.UNIQUE1, a1.UNIQUE2, a1.UNIQUE3, a1.TEN, a1.HUNDRED, a1.THOUSAND, a1.HUND_CLUST, a1.HUND_NULL,
       a1.CHAR_UNIQUE, a1.CHAR_HUND, a1.VCHAR_UNIQUE, a1.VCHAR_HUND, a1.DATE_UNIQUE, a1.DATE_HUND, a1.ALL_NULL, a1.NUMERIC)})}]),
      update([a1.THOUSAND=column_conv(DECIMAL_INT,PS:(10,0),NULL,a1.UNIQUE1)])
  1 - output([a1.__pk_increment], [a1.UNIQUE1], [a1.UNIQUE2], [a1.UNIQUE3], [a1.TEN], [a1.HUNDRED], [a1.THOUSAND], [a1.HUND_CLUST], [a1.HUND_NULL], [a1.CHAR_UNIQUE],
       [a1.CHAR_HUND], [a1.VCHAR_UNIQUE], [a1.VCHAR_HUND], [a1.DATE_UNIQUE], [a1.DATE_HUND], [a1.ALL_NULL], [a1.NUMERIC]), filter(nil), rowset=256
      equal_conds([a1.TEN = VIEW2.a2.TEN]), other_conds([cast(a1.HUNDRED, DECIMAL(10, 0)) >= VIEW2.avg(a2.hundred)])
  2 - output([VIEW2.avg(a2.hundred)], [VIEW2.a2.TEN]), filter(nil), rowset=256
      access([VIEW2.avg(a2.hundred)], [VIEW2.a2.TEN])
  3 - output([cast(cast(T_FUN_SUM(a2.HUNDRED), DECIMAL_INT(64, 32)) / cast(T_FUN_COUNT(a2.HUNDRED), DECIMAL_INT(20, 0)), DECIMAL(14, 4))], [a2.TEN]), filter(nil), rowset=256
      group([a2.TEN]), agg_func([T_FUN_SUM(a2.HUNDRED)], [T_FUN_COUNT(a2.HUNDRED)])
  4 - output([a2.TEN], [a2.HUNDRED]), filter(nil), rowset=256
      equal_conds([b1.UNIQUE1 = a2.UNIQUE1]), other_conds(nil)
  5 - output([b1.UNIQUE1]), filter(nil), rowset=256
      access([b1.UNIQUE1]), partitions(p0)
      is_index_back=false, is_global_index=false, 
      range_key([b1.__pk_increment]), range(MIN ; MAX)always true
  6 - output([a2.TEN], [a2.UNIQUE1], [a2.HUNDRED]), filter(nil), rowset=256
      access([a2.TEN], [a2.UNIQUE1], [a2.HUNDRED]), partitions(p0)
      is_index_back=false, is_global_index=false, 
      range_key([a2.__pk_increment]), range(MIN ; MAX)always true
  7 - output([a1.__pk_increment], [a1.THOUSAND], [a1.UNIQUE1], [a1.UNIQUE2], [a1.UNIQUE3], [a1.TEN], [a1.HUNDRED], [a1.HUND_CLUST], [a1.HUND_NULL], [a1.CHAR_UNIQUE],
       [a1.CHAR_HUND], [a1.VCHAR_UNIQUE], [a1.VCHAR_HUND], [a1.DATE_UNIQUE], [a1.DATE_HUND], [a1.ALL_NULL], [a1.NUMERIC]), filter(nil), rowset=256
      access([a1.__pk_increment], [a1.THOUSAND], [a1.UNIQUE1], [a1.UNIQUE2], [a1.UNIQUE3], [a1.TEN], [a1.HUNDRED], [a1.HUND_CLUST], [a1.HUND_NULL], [a1.CHAR_UNIQUE],
       [a1.CHAR_HUND], [a1.VCHAR_UNIQUE], [a1.VCHAR_HUND], [a1.DATE_UNIQUE], [a1.DATE_HUND], [a1.ALL_NULL], [a1.NUMERIC]), partitions(p0)
      is_index_back=false, is_global_index=false, 
      range_key([a1.__pk_increment]), range(MIN ; MAX)always true
update t2_100 a1 set a1.thousand = a1.unique1 where a1.hundred >= (select avg(a2.hundred) from t2_100 a2 where a1.ten = a2.ten and exists (select 1 from t1_100 b1 where b1.unique1 = a2.unique1));
select/*no explain*/sum(thousand), stddev(thousand) from t2_100;
+---------------+-------------------+
| sum(thousand) | stddev(thousand)  |
+---------------+-------------------+
|          4950 | 28.86607004772212 |
+---------------+-------------------+
rollback;
EXPLAIN delete from t2_100 a1 where a1.hundred >= (select avg(a2.hundred) from t2_100 a2 where a1.ten = a2.ten and exists (select 1 from t1_100 b1 where b1.unique1 = a2.unique1));
Query Plan
==============================================================
|ID|OPERATOR                     |NAME |EST.ROWS|EST.TIME(us)|
--------------------------------------------------------------
|0 |DELETE                       |     |10      |153         |
|1 |└─HASH JOIN                  |     |10      |96          |
|2 |  ├─SUBPLAN SCAN             |VIEW2|10      |56          |
|3 |  │ └─HASH GROUP BY          |     |10      |56          |
|4 |  │   └─HASH RIGHT SEMI JOIN |     |100     |43          |
|5 |  │     ├─TABLE FULL SCAN    |b1   |100     |4           |
|6 |  │     └─TABLE FULL SCAN    |a2   |100     |8           |
|7 |  └─TABLE FULL SCAN          |a1   |100     |26          |
==============================================================
Outputs & filters:
-------------------------------------
  0 - output(nil), filter(nil)
      table_columns([{a1: ({t2_100: (a1.__pk_increment, a1.UNIQUE1, a1.UNIQUE2, a1.UNIQUE3, a1.TEN, a1.HUNDRED, a1.THOUSAND, a1.HUND_CLUST, a1.HUND_NULL,
       a1.CHAR_UNIQUE, a1.CHAR_HUND, a1.VCHAR_UNIQUE, a1.VCHAR_HUND, a1.DATE_UNIQUE, a1.DATE_HUND, a1.ALL_NULL, a1.NUMERIC)})}])
  1 - output([a1.__pk_increment], [a1.UNIQUE1], [a1.UNIQUE2], [a1.UNIQUE3], [a1.TEN], [a1.HUNDRED], [a1.THOUSAND], [a1.HUND_CLUST], [a1.HUND_NULL], [a1.CHAR_UNIQUE],
       [a1.CHAR_HUND], [a1.VCHAR_UNIQUE], [a1.VCHAR_HUND], [a1.DATE_UNIQUE], [a1.DATE_HUND], [a1.ALL_NULL], [a1.NUMERIC]), filter(nil), rowset=256
      equal_conds([a1.TEN = VIEW2.a2.TEN]), other_conds([cast(a1.HUNDRED, DECIMAL(10, 0)) >= VIEW2.avg(a2.hundred)])
  2 - output([VIEW2.avg(a2.hundred)], [VIEW2.a2.TEN]), filter(nil), rowset=256
      access([VIEW2.avg(a2.hundred)], [VIEW2.a2.TEN])
  3 - output([cast(cast(T_FUN_SUM(a2.HUNDRED), DECIMAL_INT(64, 32)) / cast(T_FUN_COUNT(a2.HUNDRED), DECIMAL_INT(20, 0)), DECIMAL(14, 4))], [a2.TEN]), filter(nil), rowset=256
      group([a2.TEN]), agg_func([T_FUN_SUM(a2.HUNDRED)], [T_FUN_COUNT(a2.HUNDRED)])
  4 - output([a2.TEN], [a2.HUNDRED]), filter(nil), rowset=256
      equal_conds([b1.UNIQUE1 = a2.UNIQUE1]), other_conds(nil)
  5 - output([b1.UNIQUE1]), filter(nil), rowset=256
      access([b1.UNIQUE1]), partitions(p0)
      is_index_back=false, is_global_index=false, 
      range_key([b1.__pk_increment]), range(MIN ; MAX)always true
  6 - output([a2.TEN], [a2.UNIQUE1], [a2.HUNDRED]), filter(nil), rowset=256
      access([a2.TEN], [a2.UNIQUE1], [a2.HUNDRED]), partitions(p0)
      is_index_back=false, is_global_index=false, 
      range_key([a2.__pk_increment]), range(MIN ; MAX)always true
  7 - output([a1.__pk_increment], [a1.UNIQUE1], [a1.UNIQUE2], [a1.UNIQUE3], [a1.TEN], [a1.HUNDRED], [a1.THOUSAND], [a1.HUND_CLUST], [a1.HUND_NULL], [a1.CHAR_UNIQUE],
       [a1.CHAR_HUND], [a1.VCHAR_UNIQUE], [a1.VCHAR_HUND], [a1.DATE_UNIQUE], [a1.DATE_HUND], [a1.ALL_NULL], [a1.NUMERIC]), filter(nil), rowset=256
      access([a1.__pk_increment], [a1.UNIQUE1], [a1.UNIQUE2], [a1.UNIQUE3], [a1.TEN], [a1.HUNDRED], [a1.THOUSAND], [a1.HUND_CLUST], [a1.HUND_NULL], [a1.CHAR_UNIQUE],
       [a1.CHAR_HUND], [a1.VCHAR_UNIQUE], [a1.VCHAR_HUND], [a1.DATE_UNIQUE], [a1.DATE_HUND], [a1.ALL_NULL], [a1.NUMERIC]), partitions(p0)
      is_index_back=false, is_global_index=false, 
      range_key([a1.__pk_increment]), range(MIN ; MAX)always true
delete from t2_100 a1 where a1.hundred >= (select avg(a2.hundred) from t2_100 a2 where a1.ten = a2.ten and exists (select 1 from t1_100 b1 where b1.unique1 = a2.unique1));
select/*no explain*/count(*), stddev(thousand) from t2_100;
+----------+--------------------+
| count(*) | stddev(thousand)   |
+----------+--------------------+
|       50 | 14.430869689661812 |
+----------+--------------------+
rollback;
EXPLAIN insert into tmp select avg(a1.thousand) from t2_100 a1 where a1.hundred >= (select avg(a2.hundred) from t2_100 a2 where a1.ten = a2.ten and exists (select 1 from t1_100 b1 where b1.unique1 = a2.unique1));
Query Plan
============================================================================
|ID|OPERATOR                         |NAME           |EST.ROWS|EST.TIME(us)|
----------------------------------------------------------------------------
|0 |INSERT                           |               |1       |91          |
|1 |└─SUBPLAN SCAN                   |ANONYMOUS_VIEW1|1       |78          |
|2 |  └─SCALAR GROUP BY              |               |1       |78          |
|3 |    └─HASH JOIN                  |               |10      |78          |
|4 |      ├─SUBPLAN SCAN             |VIEW2          |10      |56          |
|5 |      │ └─HASH GROUP BY          |               |10      |56          |
|6 |      │   └─HASH RIGHT SEMI JOIN |               |100     |43          |
|7 |      │     ├─TABLE FULL SCAN    |b1             |100     |4           |
|8 |      │     └─TABLE FULL SCAN    |a2             |100     |8           |
|9 |      └─TABLE FULL SCAN          |a1             |100     |8           |
============================================================================
Outputs & filters:
-------------------------------------
  0 - output(nil), filter(nil)
      columns([{tmp: ({tmp: (tmp.__pk_increment, tmp.c1)})}]), partitions(p0), 
      column_values([T_HIDDEN_PK], [column_conv(INT,PS:(11,0),NULL,cast(ANONYMOUS_VIEW1.avg(a1.thousand), INT(-1, 0)))])
  1 - output([ANONYMOUS_VIEW1.avg(a1.thousand)]), filter(nil), rowset=256
      access([ANONYMOUS_VIEW1.avg(a1.thousand)])
  2 - output([cast(cast(T_FUN_SUM(a1.THOUSAND), DECIMAL_INT(64, 32)) / cast(T_FUN_COUNT(a1.THOUSAND), DECIMAL_INT(20, 0)), DECIMAL(14, 4))]), filter(nil), rowset=256
      group(nil), agg_func([T_FUN_SUM(a1.THOUSAND)], [T_FUN_COUNT(a1.THOUSAND)])
  3 - output([a1.THOUSAND]), filter(nil), rowset=256
      equal_conds([a1.TEN = VIEW2.a2.TEN]), other_conds([cast(a1.HUNDRED, DECIMAL(10, 0)) >= VIEW2.avg(a2.hundred)])
  4 - output([VIEW2.avg(a2.hundred)], [VIEW2.a2.TEN]), filter(nil), rowset=256
      access([VIEW2.avg(a2.hundred)], [VIEW2.a2.TEN])
  5 - output([cast(cast(T_FUN_SUM(a2.HUNDRED), DECIMAL_INT(64, 32)) / cast(T_FUN_COUNT(a2.HUNDRED), DECIMAL_INT(20, 0)), DECIMAL(14, 4))], [a2.TEN]), filter(nil), rowset=256
      group([a2.TEN]), agg_func([T_FUN_SUM(a2.HUNDRED)], [T_FUN_COUNT(a2.HUNDRED)])
  6 - output([a2.TEN], [a2.HUNDRED]), filter(nil), rowset=256
      equal_conds([b1.UNIQUE1 = a2.UNIQUE1]), other_conds(nil)
  7 - output([b1.UNIQUE1]), filter(nil), rowset=256
      access([b1.UNIQUE1]), partitions(p0)
      is_index_back=false, is_global_index=false, 
      range_key([b1.__pk_increment]), range(MIN ; MAX)always true
  8 - output([a2.TEN], [a2.UNIQUE1], [a2.HUNDRED]), filter(nil), rowset=256
      access([a2.TEN], [a2.UNIQUE1], [a2.HUNDRED]), partitions(p0)
      is_index_back=false, is_global_index=false, 
      range_key([a2.__pk_increment]), range(MIN ; MAX)always true
  9 - output([a1.TEN], [a1.HUNDRED], [a1.THOUSAND]), filter(nil), rowset=256
      access([a1.TEN], [a1.HUNDRED], [a1.THOUSAND]), partitions(p0)
      is_index_back=false, is_global_index=false, 
      range_key([a1.__pk_increment]), range(MIN ; MAX)always true
insert into tmp select avg(a1.thousand) from t2_100 a1 where a1.hundred >= (select avg(a2.hundred) from t2_100 a2 where a1.ten = a2.ten and exists (select 1 from t1_100 b1 where b1.unique1 = a2.unique1));
select/*no explain*/* from tmp;
+------+
| c1   |
+------+
|   75 |
+------+
rollback;

EXPLAIN select avg(a1.thousand) from t2_100 a1, t1_100 b1 where a1.unique1 = b1.unique1 and a1.hundred >= (select avg(a2.hundred) from t2_100 a2, t1_100 b2 where a2.unique1 = b2.unique1 and a1.ten = a2.ten and b1.ten = b2.ten);
Query Plan
==========================================================
|ID|OPERATOR                 |NAME |EST.ROWS|EST.TIME(us)|
----------------------------------------------------------
|0 |SCALAR GROUP BY          |     |1       |158         |
|1 |└─HASH JOIN              |     |66      |156         |
|2 |  ├─SUBPLAN SCAN         |VIEW1|66      |77          |
|3 |  │ └─HASH GROUP BY      |     |66      |76          |
|4 |  │   └─HASH JOIN        |     |100     |48          |
|5 |  │     ├─TABLE FULL SCAN|b2   |100     |6           |
|6 |  │     └─TABLE FULL SCAN|a2   |100     |8           |
|7 |  └─HASH JOIN            |     |100     |50          |
|8 |    ├─TABLE FULL SCAN    |b1   |100     |6           |
|9 |    └─TABLE FULL SCAN    |a1   |100     |9           |
==========================================================
Outputs & filters:
-------------------------------------
  0 - output([cast(cast(T_FUN_SUM(a1.THOUSAND), DECIMAL_INT(64, 32)) / cast(T_FUN_COUNT(a1.THOUSAND), DECIMAL_INT(20, 0)), DECIMAL(14, 4))]), filter(nil), rowset=256
      group(nil), agg_func([T_FUN_SUM(a1.THOUSAND)], [T_FUN_COUNT(a1.THOUSAND)])
  1 - output([a1.THOUSAND]), filter(nil), rowset=256
      equal_conds([a1.TEN = VIEW1.a2.TEN], [b1.TEN = VIEW1.b2.TEN]), other_conds([cast(a1.HUNDRED, DECIMAL(10, 0)) >= VIEW1.avg(a2.hundred)])
  2 - output([VIEW1.avg(a2.hundred)], [VIEW1.a2.TEN], [VIEW1.b2.TEN]), filter(nil), rowset=256
      access([VIEW1.avg(a2.hundred)], [VIEW1.a2.TEN], [VIEW1.b2.TEN])
  3 - output([cast(cast(T_FUN_SUM(a2.HUNDRED), DECIMAL_INT(64, 32)) / cast(T_FUN_COUNT(a2.HUNDRED), DECIMAL_INT(20, 0)), DECIMAL(14, 4))], [a2.TEN], [b2.TEN]), filter(nil), rowset=256
      group([a2.TEN], [b2.TEN]), agg_func([T_FUN_SUM(a2.HUNDRED)], [T_FUN_COUNT(a2.HUNDRED)])
  4 - output([a2.TEN], [b2.TEN], [a2.HUNDRED]), filter(nil), rowset=256
      equal_conds([a2.UNIQUE1 = b2.UNIQUE1]), other_conds(nil)
  5 - output([b2.UNIQUE1], [b2.TEN]), filter(nil), rowset=256
      access([b2.UNIQUE1], [b2.TEN]), partitions(p0)
      is_index_back=false, is_global_index=false, 
      range_key([b2.__pk_increment]), range(MIN ; MAX)always true
  6 - output([a2.UNIQUE1], [a2.TEN], [a2.HUNDRED]), filter(nil), rowset=256
      access([a2.UNIQUE1], [a2.TEN], [a2.HUNDRED]), partitions(p0)
      is_index_back=false, is_global_index=false, 
      range_key([a2.__pk_increment]), range(MIN ; MAX)always true
  7 - output([a1.THOUSAND], [b1.TEN], [a1.TEN], [a1.HUNDRED]), filter(nil), rowset=256
      equal_conds([a1.UNIQUE1 = b1.UNIQUE1]), other_conds(nil)
  8 - output([b1.UNIQUE1], [b1.TEN]), filter(nil), rowset=256
      access([b1.UNIQUE1], [b1.TEN]), partitions(p0)
      is_index_back=false, is_global_index=false, 
      range_key([b1.__pk_increment]), range(MIN ; MAX)always true
  9 - output([a1.UNIQUE1], [a1.TEN], [a1.HUNDRED], [a1.THOUSAND]), filter(nil), rowset=256
      access([a1.UNIQUE1], [a1.TEN], [a1.HUNDRED], [a1.THOUSAND]), partitions(p0)
      is_index_back=false, is_global_index=false, 
      range_key([a1.__pk_increment]), range(MIN ; MAX)always true
select avg(a1.thousand) from t2_100 a1, t1_100 b1 where a1.unique1 = b1.unique1 and a1.hundred >= (select avg(a2.hundred) from t2_100 a2, t1_100 b2 where a2.unique1 = b2.unique1 and a1.ten = a2.ten and b1.ten = b2.ten);
+------------------+
| avg(a1.thousand) |
+------------------+
|          74.5000 |
+------------------+
EXPLAIN select /*+no_unnest(@qb1)*/ avg(a1.thousand) from t2_100 a1, t1_100 b1 where a1.unique1 = b1.unique1 and a1.hundred >= (select /*+qb_name(qb1)*/avg(a2.hundred) from t2_100 a2, t1_100 b2 where a2.unique1 = b2.unique1 and a1.ten = a2.ten and b1.ten = b2.ten);
Query Plan
==================================================================
|ID|OPERATOR                |NAME          |EST.ROWS|EST.TIME(us)|
------------------------------------------------------------------
|0 |SCALAR GROUP BY         |              |1       |6790        |
|1 |└─SUBPLAN FILTER        |              |34      |6789        |
|2 |  ├─HASH JOIN           |              |100     |50          |
|3 |  │ ├─TABLE FULL SCAN   |b1            |100     |6           |
|4 |  │ └─TABLE FULL SCAN   |a1            |100     |9           |
|5 |  └─SCALAR GROUP BY     |              |1       |68          |
|6 |    └─HASH JOIN         |              |11      |68          |
|7 |      ├─TABLE FULL SCAN |b2            |10      |18          |
|8 |      └─TABLE RANGE SCAN|a2(T2_100_TEN)|10      |46          |
==================================================================
Outputs & filters:
-------------------------------------
  0 - output([cast(cast(T_FUN_SUM(a1.THOUSAND), DECIMAL_INT(64, 32)) / cast(T_FUN_COUNT(a1.THOUSAND), DECIMAL_INT(20, 0)), DECIMAL(14, 4))]), filter(nil), rowset=256
      group(nil), agg_func([T_FUN_SUM(a1.THOUSAND)], [T_FUN_COUNT(a1.THOUSAND)])
  1 - output([a1.THOUSAND]), filter([cast(a1.HUNDRED, DECIMAL(10, 0)) >= subquery(1)]), rowset=256
      exec_params_([a1.TEN(:0)], [b1.TEN(:1)]), onetime_exprs_(nil), init_plan_idxs_(nil), use_batch=false
  2 - output([a1.THOUSAND], [a1.TEN], [b1.TEN], [a1.HUNDRED]), filter(nil), rowset=256
      equal_conds([a1.UNIQUE1 = b1.UNIQUE1]), other_conds(nil)
  3 - output([b1.UNIQUE1], [b1.TEN]), filter(nil), rowset=256
      access([b1.UNIQUE1], [b1.TEN]), partitions(p0)
      is_index_back=false, is_global_index=false, 
      range_key([b1.__pk_increment]), range(MIN ; MAX)always true
  4 - output([a1.UNIQUE1], [a1.TEN], [a1.HUNDRED], [a1.THOUSAND]), filter(nil), rowset=256
      access([a1.UNIQUE1], [a1.TEN], [a1.HUNDRED], [a1.THOUSAND]), partitions(p0)
      is_index_back=false, is_global_index=false, 
      range_key([a1.__pk_increment]), range(MIN ; MAX)always true
  5 - output([cast(cast(T_FUN_SUM(a2.HUNDRED), DECIMAL_INT(64, 32)) / cast(T_FUN_COUNT(a2.HUNDRED), DECIMAL_INT(20, 0)), DECIMAL(14, 4))]), filter(nil), rowset=256
      group(nil), agg_func([T_FUN_SUM(a2.HUNDRED)], [T_FUN_COUNT(a2.HUNDRED)])
  6 - output([a2.HUNDRED]), filter(nil), rowset=256
      equal_conds([a2.UNIQUE1 = b2.UNIQUE1]), other_conds(nil)
  7 - output([b2.UNIQUE1]), filter([:1 = b2.TEN]), rowset=256
      access([b2.UNIQUE1], [b2.TEN]), partitions(p0)
      is_index_back=false, is_global_index=false, filter_before_indexback[false], 
      range_key([b2.__pk_increment]), range(MIN ; MAX)always true
  8 - output([a2.UNIQUE1], [a2.HUNDRED]), filter(nil), rowset=256
      access([a2.__pk_increment], [a2.UNIQUE1], [a2.HUNDRED]), partitions(p0)
      is_index_back=true, is_global_index=false, 
      range_key([a2.TEN], [a2.__pk_increment]), range(MIN,MIN ; MAX,MAX)always true, 
      range_cond([:0 = a2.TEN])
select /*+no_unnest(@qb1)*/ avg(a1.thousand) from t2_100 a1, t1_100 b1 where a1.unique1 = b1.unique1 and a1.hundred >= (select /*+qb_name(qb1)*/avg(a2.hundred) from t2_100 a2, t1_100 b2 where a2.unique1 = b2.unique1 and a1.ten = a2.ten and b1.ten = b2.ten);
+------------------+
| avg(a1.thousand) |
+------------------+
|          74.5000 |
+------------------+

EXPLAIN update t2_100 a1, t1_100 b1 set a1.thousand = a1.unique1 where a1.unique1 = b1.unique1 and a1.hundred >= (select avg(a2.hundred) from t2_100 a2, t1_100 b2 where a2.unique1 = b2.unique1 and a1.ten = a2.ten and b1.ten = b2.ten);
Query Plan
==========================================================
|ID|OPERATOR                 |NAME |EST.ROWS|EST.TIME(us)|
----------------------------------------------------------
|0 |UPDATE                   |     |5       |404         |
|1 |└─SUBPLAN SCAN           |VIEW1|5       |342         |
|2 |  └─WINDOW FUNCTION      |     |100     |340         |
|3 |    └─PARTITION SORT     |     |100     |145         |
|4 |      └─HASH JOIN        |     |100     |72          |
|5 |        ├─TABLE FULL SCAN|b2   |100     |9           |
|6 |        └─TABLE FULL SCAN|a2   |100     |29          |
==========================================================
Outputs & filters:
-------------------------------------
  0 - output(nil), filter(nil)
      table_columns([{VIEW1: ({t2_100: (VIEW1.a2.__pk_increment, VIEW1.a2.UNIQUE1, VIEW1.a2.UNIQUE2, VIEW1.a2.UNIQUE3, VIEW1.a2.TEN, VIEW1.a2.HUNDRED, VIEW1.a2.THOUSAND,
       VIEW1.a2.HUND_CLUST, VIEW1.a2.HUND_NULL, VIEW1.a2.CHAR_UNIQUE, VIEW1.a2.CHAR_HUND, VIEW1.a2.VCHAR_UNIQUE, VIEW1.a2.VCHAR_HUND, VIEW1.a2.DATE_UNIQUE, VIEW1.a2.DATE_HUND,
       VIEW1.a2.ALL_NULL, VIEW1.a2.NUMERIC)}), hash_distinct}]),
      update([VIEW1.a2.THOUSAND=column_conv(DECIMAL_INT,PS:(10,0),NULL,VIEW1.a2.UNIQUE1)])
  1 - output([VIEW1.a2.TEN], [VIEW1.a2.__pk_increment], [VIEW1.a2.THOUSAND], [VIEW1.a2.UNIQUE1], [VIEW1.a2.UNIQUE2], [VIEW1.a2.UNIQUE3], [VIEW1.a2.HUNDRED],
       [VIEW1.a2.HUND_CLUST], [VIEW1.a2.HUND_NULL], [VIEW1.a2.CHAR_UNIQUE], [VIEW1.a2.CHAR_HUND], [VIEW1.a2.VCHAR_UNIQUE], [VIEW1.a2.VCHAR_HUND], [VIEW1.a2.DATE_UNIQUE],
       [VIEW1.a2.DATE_HUND], [VIEW1.a2.ALL_NULL], [VIEW1.a2.NUMERIC]), filter([cast(VIEW1.a2.HUNDRED, DECIMAL(10, 0)) >= VIEW1.avg(a2.hundred)]), rowset=256
      access([VIEW1.avg(a2.hundred)], [VIEW1.a2.TEN], [VIEW1.a2.__pk_increment], [VIEW1.a2.THOUSAND], [VIEW1.a2.UNIQUE1], [VIEW1.a2.UNIQUE2], [VIEW1.a2.UNIQUE3],
       [VIEW1.a2.HUNDRED], [VIEW1.a2.HUND_CLUST], [VIEW1.a2.HUND_NULL], [VIEW1.a2.CHAR_UNIQUE], [VIEW1.a2.CHAR_HUND], [VIEW1.a2.VCHAR_UNIQUE], [VIEW1.a2.VCHAR_HUND],
       [VIEW1.a2.DATE_UNIQUE], [VIEW1.a2.DATE_HUND], [VIEW1.a2.ALL_NULL], [VIEW1.a2.NUMERIC])
  2 - output([cast(cast(T_FUN_SUM(a2.HUNDRED), DECIMAL_INT(64, 32)) / cast(T_FUN_COUNT(a2.HUNDRED), DECIMAL_INT(20, 0)), DECIMAL(14, 4))], [a2.TEN], [a2.__pk_increment],
       [a2.THOUSAND], [a2.UNIQUE1], [a2.UNIQUE2], [a2.UNIQUE3], [a2.HUNDRED], [a2.HUND_CLUST], [a2.HUND_NULL], [a2.CHAR_UNIQUE], [a2.CHAR_HUND], [a2.VCHAR_UNIQUE],
       [a2.VCHAR_HUND], [a2.DATE_UNIQUE], [a2.DATE_HUND], [a2.ALL_NULL], [a2.NUMERIC]), filter(nil), rowset=256
      win_expr(T_FUN_SUM(a2.HUNDRED)), partition_by([a2.TEN], [b2.TEN]), order_by(nil), window_type(RANGE), upper(UNBOUNDED PRECEDING), lower(UNBOUNDED 
      FOLLOWING)
      win_expr(T_FUN_COUNT(a2.HUNDRED)), partition_by([a2.TEN], [b2.TEN]), order_by(nil), window_type(RANGE), upper(UNBOUNDED PRECEDING), lower(UNBOUNDED 
      FOLLOWING)
  3 - output([a2.HUNDRED], [a2.TEN], [b2.TEN], [a2.__pk_increment], [a2.THOUSAND], [a2.UNIQUE1], [a2.UNIQUE2], [a2.UNIQUE3], [a2.HUND_CLUST], [a2.HUND_NULL],
       [a2.CHAR_UNIQUE], [a2.CHAR_HUND], [a2.VCHAR_UNIQUE], [a2.VCHAR_HUND], [a2.DATE_UNIQUE], [a2.DATE_HUND], [a2.ALL_NULL], [a2.NUMERIC]), filter(nil), rowset=256
      sort_keys([HASH(a2.TEN, b2.TEN), ASC], [a2.TEN, ASC], [b2.TEN, ASC])
  4 - output([a2.HUNDRED], [a2.TEN], [b2.TEN], [a2.__pk_increment], [a2.THOUSAND], [a2.UNIQUE1], [a2.UNIQUE2], [a2.UNIQUE3], [a2.HUND_CLUST], [a2.HUND_NULL],
       [a2.CHAR_UNIQUE], [a2.CHAR_HUND], [a2.VCHAR_UNIQUE], [a2.VCHAR_HUND], [a2.DATE_UNIQUE], [a2.DATE_HUND], [a2.ALL_NULL], [a2.NUMERIC]), filter(nil), rowset=256
      equal_conds([a2.UNIQUE1 = b2.UNIQUE1]), other_conds(nil)
  5 - output([b2.UNIQUE1], [b2.TEN]), filter([b2.TEN IS NOT NULL]), rowset=256
      access([b2.UNIQUE1], [b2.TEN]), partitions(p0)
      is_index_back=false, is_global_index=false, filter_before_indexback[false], 
      range_key([b2.__pk_increment]), range(MIN ; MAX)always true
  6 - output([a2.__pk_increment], [a2.UNIQUE1], [a2.TEN], [a2.HUNDRED], [a2.THOUSAND], [a2.UNIQUE2], [a2.UNIQUE3], [a2.HUND_CLUST], [a2.HUND_NULL], [a2.CHAR_UNIQUE],
       [a2.CHAR_HUND], [a2.VCHAR_UNIQUE], [a2.VCHAR_HUND], [a2.DATE_UNIQUE], [a2.DATE_HUND], [a2.ALL_NULL], [a2.NUMERIC]), filter([a2.TEN IS NOT NULL]), rowset=256
      access([a2.__pk_increment], [a2.UNIQUE1], [a2.TEN], [a2.HUNDRED], [a2.THOUSAND], [a2.UNIQUE2], [a2.UNIQUE3], [a2.HUND_CLUST], [a2.HUND_NULL], [a2.CHAR_UNIQUE],
       [a2.CHAR_HUND], [a2.VCHAR_UNIQUE], [a2.VCHAR_HUND], [a2.DATE_UNIQUE], [a2.DATE_HUND], [a2.ALL_NULL], [a2.NUMERIC]), partitions(p0)
      is_index_back=false, is_global_index=false, filter_before_indexback[false], 
      range_key([a2.__pk_increment]), range(MIN ; MAX)always true
update t2_100 a1, t1_100 b1 set a1.thousand = a1.unique1 where a1.unique1 = b1.unique1 and a1.hundred >= (select avg(a2.hundred) from t2_100 a2, t1_100 b2 where a2.unique1 = b2.unique1 and a1.ten = a2.ten and b1.ten = b2.ten);
select/*no explain*/sum(thousand), stddev(thousand) from t2_100;
+---------------+-------------------+
| sum(thousand) | stddev(thousand)  |
+---------------+-------------------+
|          4950 | 28.86607004772212 |
+---------------+-------------------+
rollback;
EXPLAIN insert into tmp select avg(a1.thousand) from t2_100 a1, t1_100 b1 where a1.unique1 = b1.unique1 and a1.hundred >= (select avg(a2.hundred) from t2_100 a2, t1_100 b2 where a2.unique1 = b2.unique1 and a1.ten = a2.ten and b1.ten = b2.ten);
Query Plan
========================================================================
|ID|OPERATOR                     |NAME           |EST.ROWS|EST.TIME(us)|
------------------------------------------------------------------------
|0 |INSERT                       |               |1       |171         |
|1 |└─SUBPLAN SCAN               |ANONYMOUS_VIEW1|1       |158         |
|2 |  └─SCALAR GROUP BY          |               |1       |158         |
|3 |    └─HASH JOIN              |               |66      |156         |
|4 |      ├─SUBPLAN SCAN         |VIEW1          |66      |77          |
|5 |      │ └─HASH GROUP BY      |               |66      |76          |
|6 |      │   └─HASH JOIN        |               |100     |48          |
|7 |      │     ├─TABLE FULL SCAN|b2             |100     |6           |
|8 |      │     └─TABLE FULL SCAN|a2             |100     |8           |
|9 |      └─HASH JOIN            |               |100     |50          |
|10|        ├─TABLE FULL SCAN    |b1             |100     |6           |
|11|        └─TABLE FULL SCAN    |a1             |100     |9           |
========================================================================
Outputs & filters:
-------------------------------------
  0 - output(nil), filter(nil)
      columns([{tmp: ({tmp: (tmp.__pk_increment, tmp.c1)})}]), partitions(p0), 
      column_values([T_HIDDEN_PK], [column_conv(INT,PS:(11,0),NULL,cast(ANONYMOUS_VIEW1.avg(a1.thousand), INT(-1, 0)))])
  1 - output([ANONYMOUS_VIEW1.avg(a1.thousand)]), filter(nil), rowset=256
      access([ANONYMOUS_VIEW1.avg(a1.thousand)])
  2 - output([cast(cast(T_FUN_SUM(a1.THOUSAND), DECIMAL_INT(64, 32)) / cast(T_FUN_COUNT(a1.THOUSAND), DECIMAL_INT(20, 0)), DECIMAL(14, 4))]), filter(nil), rowset=256
      group(nil), agg_func([T_FUN_SUM(a1.THOUSAND)], [T_FUN_COUNT(a1.THOUSAND)])
  3 - output([a1.THOUSAND]), filter(nil), rowset=256
      equal_conds([a1.TEN = VIEW1.a2.TEN], [b1.TEN = VIEW1.b2.TEN]), other_conds([cast(a1.HUNDRED, DECIMAL(10, 0)) >= VIEW1.avg(a2.hundred)])
  4 - output([VIEW1.avg(a2.hundred)], [VIEW1.a2.TEN], [VIEW1.b2.TEN]), filter(nil), rowset=256
      access([VIEW1.avg(a2.hundred)], [VIEW1.a2.TEN], [VIEW1.b2.TEN])
  5 - output([cast(cast(T_FUN_SUM(a2.HUNDRED), DECIMAL_INT(64, 32)) / cast(T_FUN_COUNT(a2.HUNDRED), DECIMAL_INT(20, 0)), DECIMAL(14, 4))], [a2.TEN], [b2.TEN]), filter(nil), rowset=256
      group([a2.TEN], [b2.TEN]), agg_func([T_FUN_SUM(a2.HUNDRED)], [T_FUN_COUNT(a2.HUNDRED)])
  6 - output([a2.TEN], [b2.TEN], [a2.HUNDRED]), filter(nil), rowset=256
      equal_conds([a2.UNIQUE1 = b2.UNIQUE1]), other_conds(nil)
  7 - output([b2.UNIQUE1], [b2.TEN]), filter(nil), rowset=256
      access([b2.UNIQUE1], [b2.TEN]), partitions(p0)
      is_index_back=false, is_global_index=false, 
      range_key([b2.__pk_increment]), range(MIN ; MAX)always true
  8 - output([a2.UNIQUE1], [a2.TEN], [a2.HUNDRED]), filter(nil), rowset=256
      access([a2.UNIQUE1], [a2.TEN], [a2.HUNDRED]), partitions(p0)
      is_index_back=false, is_global_index=false, 
      range_key([a2.__pk_increment]), range(MIN ; MAX)always true
  9 - output([a1.THOUSAND], [b1.TEN], [a1.TEN], [a1.HUNDRED]), filter(nil), rowset=256
      equal_conds([a1.UNIQUE1 = b1.UNIQUE1]), other_conds(nil)
 10 - output([b1.UNIQUE1], [b1.TEN]), filter(nil), rowset=256
      access([b1.UNIQUE1], [b1.TEN]), partitions(p0)
      is_index_back=false, is_global_index=false, 
      range_key([b1.__pk_increment]), range(MIN ; MAX)always true
 11 - output([a1.UNIQUE1], [a1.TEN], [a1.HUNDRED], [a1.THOUSAND]), filter(nil), rowset=256
      access([a1.UNIQUE1], [a1.TEN], [a1.HUNDRED], [a1.THOUSAND]), partitions(p0)
      is_index_back=false, is_global_index=false, 
      range_key([a1.__pk_increment]), range(MIN ; MAX)always true
insert into tmp select avg(a1.thousand) from t2_100 a1, t1_100 b1 where a1.unique1 = b1.unique1 and a1.hundred >= (select avg(a2.hundred) from t2_100 a2, t1_100 b2 where a2.unique1 = b2.unique1 and a1.ten = a2.ten and b1.ten = b2.ten);
select/*no explain*/* from tmp;
+------+
| c1   |
+------+
|   75 |
+------+
rollback;

EXPLAIN select avg(a1.thousand) from t2_100 a1, t1_100 b1 where a1.unique1 = b1.unique1 and a1.unique2 = b1.unique2 and a1.hundred >= (select avg(a2.hundred) from t2_100 a2, t1_100 b2 where a2.unique1 = b2.unique1 and a1.ten = a2.ten and b1.ten = b2.ten);
Query Plan
==========================================================
|ID|OPERATOR                 |NAME |EST.ROWS|EST.TIME(us)|
----------------------------------------------------------
|0 |SCALAR GROUP BY          |     |1       |168         |
|1 |└─HASH JOIN              |     |66      |166         |
|2 |  ├─SUBPLAN SCAN         |VIEW1|66      |77          |
|3 |  │ └─HASH GROUP BY      |     |66      |76          |
|4 |  │   └─HASH JOIN        |     |100     |48          |
|5 |  │     ├─TABLE FULL SCAN|b2   |100     |6           |
|6 |  │     └─TABLE FULL SCAN|a2   |100     |8           |
|7 |  └─HASH JOIN            |     |100     |60          |
|8 |    ├─TABLE FULL SCAN    |b1   |100     |8           |
|9 |    └─TABLE FULL SCAN    |a1   |100     |11          |
==========================================================
Outputs & filters:
-------------------------------------
  0 - output([cast(cast(T_FUN_SUM(a1.THOUSAND), DECIMAL_INT(64, 32)) / cast(T_FUN_COUNT(a1.THOUSAND), DECIMAL_INT(20, 0)), DECIMAL(14, 4))]), filter(nil), rowset=256
      group(nil), agg_func([T_FUN_SUM(a1.THOUSAND)], [T_FUN_COUNT(a1.THOUSAND)])
  1 - output([a1.THOUSAND]), filter(nil), rowset=256
      equal_conds([a1.TEN = VIEW1.a2.TEN], [b1.TEN = VIEW1.b2.TEN]), other_conds([cast(a1.HUNDRED, DECIMAL(10, 0)) >= VIEW1.avg(a2.hundred)])
  2 - output([VIEW1.avg(a2.hundred)], [VIEW1.a2.TEN], [VIEW1.b2.TEN]), filter(nil), rowset=256
      access([VIEW1.avg(a2.hundred)], [VIEW1.a2.TEN], [VIEW1.b2.TEN])
  3 - output([cast(cast(T_FUN_SUM(a2.HUNDRED), DECIMAL_INT(64, 32)) / cast(T_FUN_COUNT(a2.HUNDRED), DECIMAL_INT(20, 0)), DECIMAL(14, 4))], [a2.TEN], [b2.TEN]), filter(nil), rowset=256
      group([a2.TEN], [b2.TEN]), agg_func([T_FUN_SUM(a2.HUNDRED)], [T_FUN_COUNT(a2.HUNDRED)])
  4 - output([a2.TEN], [b2.TEN], [a2.HUNDRED]), filter(nil), rowset=256
      equal_conds([a2.UNIQUE1 = b2.UNIQUE1]), other_conds(nil)
  5 - output([b2.UNIQUE1], [b2.TEN]), filter(nil), rowset=256
      access([b2.UNIQUE1], [b2.TEN]), partitions(p0)
      is_index_back=false, is_global_index=false, 
      range_key([b2.__pk_increment]), range(MIN ; MAX)always true
  6 - output([a2.UNIQUE1], [a2.TEN], [a2.HUNDRED]), filter(nil), rowset=256
      access([a2.UNIQUE1], [a2.TEN], [a2.HUNDRED]), partitions(p0)
      is_index_back=false, is_global_index=false, 
      range_key([a2.__pk_increment]), range(MIN ; MAX)always true
  7 - output([a1.THOUSAND], [b1.TEN], [a1.TEN], [a1.HUNDRED]), filter(nil), rowset=256
      equal_conds([a1.UNIQUE1 = b1.UNIQUE1], [a1.UNIQUE2 = b1.UNIQUE2]), other_conds(nil)
  8 - output([b1.UNIQUE1], [b1.UNIQUE2], [b1.TEN]), filter(nil), rowset=256
      access([b1.UNIQUE1], [b1.UNIQUE2], [b1.TEN]), partitions(p0)
      is_index_back=false, is_global_index=false, 
      range_key([b1.__pk_increment]), range(MIN ; MAX)always true
  9 - output([a1.UNIQUE1], [a1.UNIQUE2], [a1.TEN], [a1.HUNDRED], [a1.THOUSAND]), filter(nil), rowset=256
      access([a1.UNIQUE1], [a1.UNIQUE2], [a1.TEN], [a1.HUNDRED], [a1.THOUSAND]), partitions(p0)
      is_index_back=false, is_global_index=false, 
      range_key([a1.__pk_increment]), range(MIN ; MAX)always true
select avg(a1.thousand) from t2_100 a1, t1_100 b1 where a1.unique1 = b1.unique1 and a1.unique2 = b1.unique2 and a1.hundred >= (select avg(a2.hundred) from t2_100 a2, t1_100 b2 where a2.unique1 = b2.unique1 and a1.ten = a2.ten and b1.ten = b2.ten);
+------------------+
| avg(a1.thousand) |
+------------------+
|          74.5000 |
+------------------+
EXPLAIN select /*+no_unnest(@qb1)*/ avg(a1.thousand) from t2_100 a1, t1_100 b1 where a1.unique1 = b1.unique1 and a1.unique2 = b1.unique2 and a1.hundred >= (select /*+qb_name(qb1)*/avg(a2.hundred) from t2_100 a2, t1_100 b2 where a2.unique1 = b2.unique1 and a1.ten = a2.ten and b1.ten = b2.ten);
Query Plan
==================================================================
|ID|OPERATOR                |NAME          |EST.ROWS|EST.TIME(us)|
------------------------------------------------------------------
|0 |SCALAR GROUP BY         |              |1       |6801        |
|1 |└─SUBPLAN FILTER        |              |34      |6800        |
|2 |  ├─HASH JOIN           |              |100     |60          |
|3 |  │ ├─TABLE FULL SCAN   |b1            |100     |8           |
|4 |  │ └─TABLE FULL SCAN   |a1            |100     |11          |
|5 |  └─SCALAR GROUP BY     |              |1       |68          |
|6 |    └─HASH JOIN         |              |11      |68          |
|7 |      ├─TABLE FULL SCAN |b2            |10      |18          |
|8 |      └─TABLE RANGE SCAN|a2(T2_100_TEN)|10      |46          |
==================================================================
Outputs & filters:
-------------------------------------
  0 - output([cast(cast(T_FUN_SUM(a1.THOUSAND), DECIMAL_INT(64, 32)) / cast(T_FUN_COUNT(a1.THOUSAND), DECIMAL_INT(20, 0)), DECIMAL(14, 4))]), filter(nil), rowset=256
      group(nil), agg_func([T_FUN_SUM(a1.THOUSAND)], [T_FUN_COUNT(a1.THOUSAND)])
  1 - output([a1.THOUSAND]), filter([cast(a1.HUNDRED, DECIMAL(10, 0)) >= subquery(1)]), rowset=256
      exec_params_([a1.TEN(:0)], [b1.TEN(:1)]), onetime_exprs_(nil), init_plan_idxs_(nil), use_batch=false
  2 - output([a1.THOUSAND], [a1.TEN], [b1.TEN], [a1.HUNDRED]), filter(nil), rowset=256
      equal_conds([a1.UNIQUE1 = b1.UNIQUE1], [a1.UNIQUE2 = b1.UNIQUE2]), other_conds(nil)
  3 - output([b1.UNIQUE1], [b1.UNIQUE2], [b1.TEN]), filter(nil), rowset=256
      access([b1.UNIQUE1], [b1.UNIQUE2], [b1.TEN]), partitions(p0)
      is_index_back=false, is_global_index=false, 
      range_key([b1.__pk_increment]), range(MIN ; MAX)always true
  4 - output([a1.UNIQUE1], [a1.UNIQUE2], [a1.TEN], [a1.HUNDRED], [a1.THOUSAND]), filter(nil), rowset=256
      access([a1.UNIQUE1], [a1.UNIQUE2], [a1.TEN], [a1.HUNDRED], [a1.THOUSAND]), partitions(p0)
      is_index_back=false, is_global_index=false, 
      range_key([a1.__pk_increment]), range(MIN ; MAX)always true
  5 - output([cast(cast(T_FUN_SUM(a2.HUNDRED), DECIMAL_INT(64, 32)) / cast(T_FUN_COUNT(a2.HUNDRED), DECIMAL_INT(20, 0)), DECIMAL(14, 4))]), filter(nil), rowset=256
      group(nil), agg_func([T_FUN_SUM(a2.HUNDRED)], [T_FUN_COUNT(a2.HUNDRED)])
  6 - output([a2.HUNDRED]), filter(nil), rowset=256
      equal_conds([a2.UNIQUE1 = b2.UNIQUE1]), other_conds(nil)
  7 - output([b2.UNIQUE1]), filter([:1 = b2.TEN]), rowset=256
      access([b2.UNIQUE1], [b2.TEN]), partitions(p0)
      is_index_back=false, is_global_index=false, filter_before_indexback[false], 
      range_key([b2.__pk_increment]), range(MIN ; MAX)always true
  8 - output([a2.UNIQUE1], [a2.HUNDRED]), filter(nil), rowset=256
      access([a2.__pk_increment], [a2.UNIQUE1], [a2.HUNDRED]), partitions(p0)
      is_index_back=true, is_global_index=false, 
      range_key([a2.TEN], [a2.__pk_increment]), range(MIN,MIN ; MAX,MAX)always true, 
      range_cond([:0 = a2.TEN])
select /*+no_unnest(@qb1)*/ avg(a1.thousand) from t2_100 a1, t1_100 b1 where a1.unique1 = b1.unique1 and a1.unique2 = b1.unique2 and a1.hundred >= (select /*+qb_name(qb1)*/avg(a2.hundred) from t2_100 a2, t1_100 b2 where a2.unique1 = b2.unique1 and a1.ten = a2.ten and b1.ten = b2.ten);
+------------------+
| avg(a1.thousand) |
+------------------+
|          74.5000 |
+------------------+

EXPLAIN update t2_100 a1, t1_100 b1 set a1.thousand = a1.unique1 where a1.unique1 = b1.unique1 and a1.unique2 = b1.unique2 and a1.hundred >= (select avg(a2.hundred) from t2_100 a2, t1_100 b2 where a2.unique1 = b2.unique1 and a1.ten = a2.ten and b1.ten = b2.ten);
Query Plan
==========================================================
|ID|OPERATOR                 |NAME |EST.ROWS|EST.TIME(us)|
----------------------------------------------------------
|0 |UPDATE                   |     |5       |417         |
|1 |└─SUBPLAN SCAN           |VIEW1|5       |356         |
|2 |  └─WINDOW FUNCTION      |     |100     |354         |
|3 |    └─PARTITION SORT     |     |100     |155         |
|4 |      └─HASH JOIN        |     |100     |78          |
|5 |        ├─TABLE FULL SCAN|b2   |100     |11          |
|6 |        └─TABLE FULL SCAN|a2   |100     |29          |
==========================================================
Outputs & filters:
-------------------------------------
  0 - output(nil), filter(nil)
      table_columns([{VIEW1: ({t2_100: (VIEW1.a2.__pk_increment, VIEW1.a2.UNIQUE1, VIEW1.a2.UNIQUE2, VIEW1.a2.UNIQUE3, VIEW1.a2.TEN, VIEW1.a2.HUNDRED, VIEW1.a2.THOUSAND,
       VIEW1.a2.HUND_CLUST, VIEW1.a2.HUND_NULL, VIEW1.a2.CHAR_UNIQUE, VIEW1.a2.CHAR_HUND, VIEW1.a2.VCHAR_UNIQUE, VIEW1.a2.VCHAR_HUND, VIEW1.a2.DATE_UNIQUE, VIEW1.a2.DATE_HUND,
       VIEW1.a2.ALL_NULL, VIEW1.a2.NUMERIC)}), hash_distinct}]),
      update([VIEW1.a2.THOUSAND=column_conv(DECIMAL_INT,PS:(10,0),NULL,VIEW1.a2.UNIQUE1)])
  1 - output([VIEW1.a2.TEN], [VIEW1.a2.__pk_increment], [VIEW1.a2.THOUSAND], [VIEW1.a2.UNIQUE1], [VIEW1.a2.UNIQUE2], [VIEW1.a2.UNIQUE3], [VIEW1.a2.HUNDRED],
       [VIEW1.a2.HUND_CLUST], [VIEW1.a2.HUND_NULL], [VIEW1.a2.CHAR_UNIQUE], [VIEW1.a2.CHAR_HUND], [VIEW1.a2.VCHAR_UNIQUE], [VIEW1.a2.VCHAR_HUND], [VIEW1.a2.DATE_UNIQUE],
       [VIEW1.a2.DATE_HUND], [VIEW1.a2.ALL_NULL], [VIEW1.a2.NUMERIC]), filter([cast(VIEW1.a2.HUNDRED, DECIMAL(10, 0)) >= VIEW1.avg(a2.hundred)], [VIEW1.a2.UNIQUE2 
      = VIEW1.b2.UNIQUE2]), rowset=256
      access([VIEW1.avg(a2.hundred)], [VIEW1.a2.TEN], [VIEW1.a2.__pk_increment], [VIEW1.a2.THOUSAND], [VIEW1.a2.UNIQUE1], [VIEW1.a2.UNIQUE2], [VIEW1.a2.UNIQUE3],
       [VIEW1.a2.HUNDRED], [VIEW1.a2.HUND_CLUST], [VIEW1.a2.HUND_NULL], [VIEW1.a2.CHAR_UNIQUE], [VIEW1.a2.CHAR_HUND], [VIEW1.a2.VCHAR_UNIQUE], [VIEW1.a2.VCHAR_HUND],
       [VIEW1.a2.DATE_UNIQUE], [VIEW1.a2.DATE_HUND], [VIEW1.a2.ALL_NULL], [VIEW1.a2.NUMERIC], [VIEW1.b2.UNIQUE2])
  2 - output([cast(cast(T_FUN_SUM(a2.HUNDRED), DECIMAL_INT(64, 32)) / cast(T_FUN_COUNT(a2.HUNDRED), DECIMAL_INT(20, 0)), DECIMAL(14, 4))], [a2.TEN], [a2.__pk_increment],
       [a2.THOUSAND], [a2.UNIQUE1], [a2.UNIQUE2], [a2.UNIQUE3], [a2.HUNDRED], [a2.HUND_CLUST], [a2.HUND_NULL], [a2.CHAR_UNIQUE], [a2.CHAR_HUND], [a2.VCHAR_UNIQUE],
       [a2.VCHAR_HUND], [a2.DATE_UNIQUE], [a2.DATE_HUND], [a2.ALL_NULL], [a2.NUMERIC], [b2.UNIQUE2]), filter(nil), rowset=256
      win_expr(T_FUN_SUM(a2.HUNDRED)), partition_by([a2.TEN], [b2.TEN]), order_by(nil), window_type(RANGE), upper(UNBOUNDED PRECEDING), lower(UNBOUNDED 
      FOLLOWING)
      win_expr(T_FUN_COUNT(a2.HUNDRED)), partition_by([a2.TEN], [b2.TEN]), order_by(nil), window_type(RANGE), upper(UNBOUNDED PRECEDING), lower(UNBOUNDED 
      FOLLOWING)
  3 - output([a2.HUNDRED], [a2.TEN], [b2.TEN], [a2.__pk_increment], [a2.THOUSAND], [a2.UNIQUE1], [a2.UNIQUE2], [a2.UNIQUE3], [a2.HUND_CLUST], [a2.HUND_NULL],
       [a2.CHAR_UNIQUE], [a2.CHAR_HUND], [a2.VCHAR_UNIQUE], [a2.VCHAR_HUND], [a2.DATE_UNIQUE], [a2.DATE_HUND], [a2.ALL_NULL], [a2.NUMERIC], [b2.UNIQUE2]), filter(nil), rowset=256
      sort_keys([HASH(a2.TEN, b2.TEN), ASC], [a2.TEN, ASC], [b2.TEN, ASC])
  4 - output([a2.HUNDRED], [a2.TEN], [b2.TEN], [a2.__pk_increment], [a2.THOUSAND], [a2.UNIQUE1], [a2.UNIQUE2], [a2.UNIQUE3], [a2.HUND_CLUST], [a2.HUND_NULL],
       [a2.CHAR_UNIQUE], [a2.CHAR_HUND], [a2.VCHAR_UNIQUE], [a2.VCHAR_HUND], [a2.DATE_UNIQUE], [a2.DATE_HUND], [a2.ALL_NULL], [a2.NUMERIC], [b2.UNIQUE2]), filter(nil), rowset=256
      equal_conds([a2.UNIQUE1 = b2.UNIQUE1]), other_conds(nil)
  5 - output([b2.UNIQUE1], [b2.TEN], [b2.UNIQUE2]), filter([b2.TEN IS NOT NULL]), rowset=256
      access([b2.UNIQUE1], [b2.TEN], [b2.UNIQUE2]), partitions(p0)
      is_index_back=false, is_global_index=false, filter_before_indexback[false], 
      range_key([b2.__pk_increment]), range(MIN ; MAX)always true
  6 - output([a2.__pk_increment], [a2.UNIQUE1], [a2.TEN], [a2.HUNDRED], [a2.THOUSAND], [a2.UNIQUE2], [a2.UNIQUE3], [a2.HUND_CLUST], [a2.HUND_NULL], [a2.CHAR_UNIQUE],
       [a2.CHAR_HUND], [a2.VCHAR_UNIQUE], [a2.VCHAR_HUND], [a2.DATE_UNIQUE], [a2.DATE_HUND], [a2.ALL_NULL], [a2.NUMERIC]), filter([a2.TEN IS NOT NULL]), rowset=256
      access([a2.__pk_increment], [a2.UNIQUE1], [a2.TEN], [a2.HUNDRED], [a2.THOUSAND], [a2.UNIQUE2], [a2.UNIQUE3], [a2.HUND_CLUST], [a2.HUND_NULL], [a2.CHAR_UNIQUE],
       [a2.CHAR_HUND], [a2.VCHAR_UNIQUE], [a2.VCHAR_HUND], [a2.DATE_UNIQUE], [a2.DATE_HUND], [a2.ALL_NULL], [a2.NUMERIC]), partitions(p0)
      is_index_back=false, is_global_index=false, filter_before_indexback[false], 
      range_key([a2.__pk_increment]), range(MIN ; MAX)always true
update t2_100 a1, t1_100 b1 set a1.thousand = a1.unique1 where a1.unique1 = b1.unique1 and a1.unique2 = b1.unique2 and a1.hundred >= (select avg(a2.hundred) from t2_100 a2, t1_100 b2 where a2.unique1 = b2.unique1 and a1.ten = a2.ten and b1.ten = b2.ten);
select/*no explain*/sum(thousand), stddev(thousand) from t2_100;
+---------------+-------------------+
| sum(thousand) | stddev(thousand)  |
+---------------+-------------------+
|          4950 | 28.86607004772212 |
+---------------+-------------------+
rollback;
EXPLAIN insert into tmp select avg(a1.thousand) from t2_100 a1, t1_100 b1 where a1.unique1 = b1.unique1 and a1.unique2 = b1.unique2 and a1.hundred >= (select avg(a2.hundred) from t2_100 a2, t1_100 b2 where a2.unique1 = b2.unique1 and a1.ten = a2.ten and b1.ten = b2.ten);
Query Plan
========================================================================
|ID|OPERATOR                     |NAME           |EST.ROWS|EST.TIME(us)|
------------------------------------------------------------------------
|0 |INSERT                       |               |1       |181         |
|1 |└─SUBPLAN SCAN               |ANONYMOUS_VIEW1|1       |168         |
|2 |  └─SCALAR GROUP BY          |               |1       |168         |
|3 |    └─HASH JOIN              |               |66      |166         |
|4 |      ├─SUBPLAN SCAN         |VIEW1          |66      |77          |
|5 |      │ └─HASH GROUP BY      |               |66      |76          |
|6 |      │   └─HASH JOIN        |               |100     |48          |
|7 |      │     ├─TABLE FULL SCAN|b2             |100     |6           |
|8 |      │     └─TABLE FULL SCAN|a2             |100     |8           |
|9 |      └─HASH JOIN            |               |100     |60          |
|10|        ├─TABLE FULL SCAN    |b1             |100     |8           |
|11|        └─TABLE FULL SCAN    |a1             |100     |11          |
========================================================================
Outputs & filters:
-------------------------------------
  0 - output(nil), filter(nil)
      columns([{tmp: ({tmp: (tmp.__pk_increment, tmp.c1)})}]), partitions(p0), 
      column_values([T_HIDDEN_PK], [column_conv(INT,PS:(11,0),NULL,cast(ANONYMOUS_VIEW1.avg(a1.thousand), INT(-1, 0)))])
  1 - output([ANONYMOUS_VIEW1.avg(a1.thousand)]), filter(nil), rowset=256
      access([ANONYMOUS_VIEW1.avg(a1.thousand)])
  2 - output([cast(cast(T_FUN_SUM(a1.THOUSAND), DECIMAL_INT(64, 32)) / cast(T_FUN_COUNT(a1.THOUSAND), DECIMAL_INT(20, 0)), DECIMAL(14, 4))]), filter(nil), rowset=256
      group(nil), agg_func([T_FUN_SUM(a1.THOUSAND)], [T_FUN_COUNT(a1.THOUSAND)])
  3 - output([a1.THOUSAND]), filter(nil), rowset=256
      equal_conds([a1.TEN = VIEW1.a2.TEN], [b1.TEN = VIEW1.b2.TEN]), other_conds([cast(a1.HUNDRED, DECIMAL(10, 0)) >= VIEW1.avg(a2.hundred)])
  4 - output([VIEW1.avg(a2.hundred)], [VIEW1.a2.TEN], [VIEW1.b2.TEN]), filter(nil), rowset=256
      access([VIEW1.avg(a2.hundred)], [VIEW1.a2.TEN], [VIEW1.b2.TEN])
  5 - output([cast(cast(T_FUN_SUM(a2.HUNDRED), DECIMAL_INT(64, 32)) / cast(T_FUN_COUNT(a2.HUNDRED), DECIMAL_INT(20, 0)), DECIMAL(14, 4))], [a2.TEN], [b2.TEN]), filter(nil), rowset=256
      group([a2.TEN], [b2.TEN]), agg_func([T_FUN_SUM(a2.HUNDRED)], [T_FUN_COUNT(a2.HUNDRED)])
  6 - output([a2.TEN], [b2.TEN], [a2.HUNDRED]), filter(nil), rowset=256
      equal_conds([a2.UNIQUE1 = b2.UNIQUE1]), other_conds(nil)
  7 - output([b2.UNIQUE1], [b2.TEN]), filter(nil), rowset=256
      access([b2.UNIQUE1], [b2.TEN]), partitions(p0)
      is_index_back=false, is_global_index=false, 
      range_key([b2.__pk_increment]), range(MIN ; MAX)always true
  8 - output([a2.UNIQUE1], [a2.TEN], [a2.HUNDRED]), filter(nil), rowset=256
      access([a2.UNIQUE1], [a2.TEN], [a2.HUNDRED]), partitions(p0)
      is_index_back=false, is_global_index=false, 
      range_key([a2.__pk_increment]), range(MIN ; MAX)always true
  9 - output([a1.THOUSAND], [b1.TEN], [a1.TEN], [a1.HUNDRED]), filter(nil), rowset=256
      equal_conds([a1.UNIQUE1 = b1.UNIQUE1], [a1.UNIQUE2 = b1.UNIQUE2]), other_conds(nil)
 10 - output([b1.UNIQUE1], [b1.UNIQUE2], [b1.TEN]), filter(nil), rowset=256
      access([b1.UNIQUE1], [b1.UNIQUE2], [b1.TEN]), partitions(p0)
      is_index_back=false, is_global_index=false, 
      range_key([b1.__pk_increment]), range(MIN ; MAX)always true
 11 - output([a1.UNIQUE1], [a1.UNIQUE2], [a1.TEN], [a1.HUNDRED], [a1.THOUSAND]), filter(nil), rowset=256
      access([a1.UNIQUE1], [a1.UNIQUE2], [a1.TEN], [a1.HUNDRED], [a1.THOUSAND]), partitions(p0)
      is_index_back=false, is_global_index=false, 
      range_key([a1.__pk_increment]), range(MIN ; MAX)always true
insert into tmp select avg(a1.thousand) from t2_100 a1, t1_100 b1 where a1.unique1 = b1.unique1 and a1.unique2 = b1.unique2 and a1.hundred >= (select avg(a2.hundred) from t2_100 a2, t1_100 b2 where a2.unique1 = b2.unique1 and a1.ten = a2.ten and b1.ten = b2.ten);
select/*no explain*/* from tmp;
+------+
| c1   |
+------+
|   75 |
+------+
rollback;

## 外层有未映射的表
EXPLAIN select avg(a1.thousand), avg(b1.thousand) from t2_100 a1, t1_100 b1 where a1.unique1 = b1.unique1 and a1.hundred >= (select avg(a2.hundred) from t2_100 a2 where a2.unique1 = b1.unique1);
Query Plan
===================================================
|ID|OPERATOR           |NAME|EST.ROWS|EST.TIME(us)|
---------------------------------------------------
|0 |SCALAR GROUP BY    |    |1       |58          |
|1 |└─HASH JOIN        |    |100     |51          |
|2 |  ├─TABLE FULL SCAN|b1  |100     |6           |
|3 |  └─TABLE FULL SCAN|a1  |100     |11          |
===================================================
Outputs & filters:
-------------------------------------
  0 - output([cast(cast(T_FUN_SUM(a1.THOUSAND), DECIMAL_INT(64, 32)) / cast(T_FUN_COUNT(a1.THOUSAND), DECIMAL_INT(20, 0)), DECIMAL(14, 4))], [cast(cast(T_FUN_SUM(b1.THOUSAND),
       DECIMAL_INT(64, 32)) / cast(T_FUN_COUNT(b1.THOUSAND), DECIMAL_INT(20, 0)), DECIMAL(14, 4))]), filter(nil), rowset=256
      group(nil), agg_func([T_FUN_SUM(a1.THOUSAND)], [T_FUN_COUNT(a1.THOUSAND)], [T_FUN_SUM(b1.THOUSAND)], [T_FUN_COUNT(b1.THOUSAND)])
  1 - output([a1.THOUSAND], [b1.THOUSAND]), filter(nil), rowset=256
      equal_conds([a1.UNIQUE1 = b1.UNIQUE1]), other_conds(nil)
  2 - output([b1.UNIQUE1], [b1.THOUSAND]), filter(nil), rowset=256
      access([b1.UNIQUE1], [b1.THOUSAND]), partitions(p0)
      is_index_back=false, is_global_index=false, 
      range_key([b1.__pk_increment]), range(MIN ; MAX)always true
  3 - output([a1.UNIQUE1], [a1.THOUSAND]), filter([cast(a1.HUNDRED, DECIMAL(10, 0)) >= cast(cast(cast(a1.HUNDRED, DECIMAL_INT(32, 0)), DECIMAL_INT(64, 32)) 
      / cast(CASE WHEN a1.HUNDRED IS NOT NULL THEN 1 ELSE 0 END, DECIMAL_INT(20, 0)), DECIMAL(14, 4))]), rowset=256
      access([a1.UNIQUE1], [a1.HUNDRED], [a1.THOUSAND]), partitions(p0)
      is_index_back=false, is_global_index=false, filter_before_indexback[false], 
      range_key([a1.__pk_increment]), range(MIN ; MAX)always true
select avg(a1.thousand), avg(b1.thousand) from t2_100 a1, t1_100 b1 where a1.unique1 = b1.unique1 and a1.hundred >= (select avg(a2.hundred) from t2_100 a2 where a2.unique1 = b1.unique1);
+------------------+------------------+
| avg(a1.thousand) | avg(b1.thousand) |
+------------------+------------------+
|          49.5000 |          49.5000 |
+------------------+------------------+
EXPLAIN select /*+no_unnest(@qb1)*/ avg(a1.thousand), avg(b1.thousand) from t2_100 a1, t1_100 b1 where a1.unique1 = b1.unique1 and a1.hundred >= (select /*+qb_name(qb1)*/avg(a2.hundred) from t2_100 a2 where a2.unique1 = b1.unique1);
Query Plan
===================================================================
|ID|OPERATOR             |NAME              |EST.ROWS|EST.TIME(us)|
-------------------------------------------------------------------
|0 |SCALAR GROUP BY      |                  |1       |2304        |
|1 |└─SUBPLAN FILTER     |                  |34      |2301        |
|2 |  ├─HASH JOIN        |                  |100     |48          |
|3 |  │ ├─TABLE FULL SCAN|b1                |100     |6           |
|4 |  │ └─TABLE FULL SCAN|a1                |100     |8           |
|5 |  └─SCALAR GROUP BY  |                  |1       |23          |
|6 |    └─TABLE GET      |a2(T2_100_UNIQUE1)|1       |23          |
===================================================================
Outputs & filters:
-------------------------------------
  0 - output([cast(cast(T_FUN_SUM(a1.THOUSAND), DECIMAL_INT(64, 32)) / cast(T_FUN_COUNT(a1.THOUSAND), DECIMAL_INT(20, 0)), DECIMAL(14, 4))], [cast(cast(T_FUN_SUM(b1.THOUSAND),
       DECIMAL_INT(64, 32)) / cast(T_FUN_COUNT(b1.THOUSAND), DECIMAL_INT(20, 0)), DECIMAL(14, 4))]), filter(nil), rowset=256
      group(nil), agg_func([T_FUN_SUM(a1.THOUSAND)], [T_FUN_COUNT(a1.THOUSAND)], [T_FUN_SUM(b1.THOUSAND)], [T_FUN_COUNT(b1.THOUSAND)])
  1 - output([a1.THOUSAND], [b1.THOUSAND]), filter([cast(a1.HUNDRED, DECIMAL(10, 0)) >= subquery(1)]), rowset=256
      exec_params_([b1.UNIQUE1(:0)]), onetime_exprs_(nil), init_plan_idxs_(nil), use_batch=false
  2 - output([a1.THOUSAND], [b1.THOUSAND], [b1.UNIQUE1], [a1.HUNDRED]), filter(nil), rowset=256
      equal_conds([a1.UNIQUE1 = b1.UNIQUE1]), other_conds(nil)
  3 - output([b1.UNIQUE1], [b1.THOUSAND]), filter(nil), rowset=256
      access([b1.UNIQUE1], [b1.THOUSAND]), partitions(p0)
      is_index_back=false, is_global_index=false, 
      range_key([b1.__pk_increment]), range(MIN ; MAX)always true
  4 - output([a1.UNIQUE1], [a1.HUNDRED], [a1.THOUSAND]), filter(nil), rowset=256
      access([a1.UNIQUE1], [a1.HUNDRED], [a1.THOUSAND]), partitions(p0)
      is_index_back=false, is_global_index=false, 
      range_key([a1.__pk_increment]), range(MIN ; MAX)always true
  5 - output([cast(cast(T_FUN_SUM(a2.HUNDRED), DECIMAL_INT(64, 32)) / cast(T_FUN_COUNT(a2.HUNDRED), DECIMAL_INT(20, 0)), DECIMAL(14, 4))]), filter(nil), rowset=256
      group(nil), agg_func([T_FUN_SUM(a2.HUNDRED)], [T_FUN_COUNT(a2.HUNDRED)])
  6 - output([a2.HUNDRED]), filter(nil), rowset=256
      access([a2.__pk_increment], [a2.HUNDRED]), partitions(p0)
      is_index_back=true, is_global_index=false, 
      range_key([a2.UNIQUE1], [a2.shadow_pk_0]), range(MIN,MIN ; MAX,MAX)always true, 
      range_cond([a2.UNIQUE1 = :0])
select /*+no_unnest(@qb1)*/ avg(a1.thousand), avg(b1.thousand) from t2_100 a1, t1_100 b1 where a1.unique1 = b1.unique1 and a1.hundred >= (select /*+qb_name(qb1)*/avg(a2.hundred) from t2_100 a2 where a2.unique1 = b1.unique1);
+------------------+------------------+
| avg(a1.thousand) | avg(b1.thousand) |
+------------------+------------------+
|          49.5000 |          49.5000 |
+------------------+------------------+

EXPLAIN update t2_100 a1, t1_100 b1 set a1.thousand = a1.unique1 where a1.unique1 = b1.unique1 and a1.hundred >= (select avg(a2.hundred) from t2_100 a2 where a2.unique1 = b1.unique1);
Query Plan
===================================================
|ID|OPERATOR           |NAME|EST.ROWS|EST.TIME(us)|
---------------------------------------------------
|0 |UPDATE             |    |34      |316         |
|1 |└─HASH JOIN        |    |34      |40          |
|2 |  ├─TABLE FULL SCAN|b1  |100     |4           |
|3 |  └─TABLE FULL SCAN|a1  |34      |14          |
===================================================
Outputs & filters:
-------------------------------------
  0 - output(nil), filter(nil)
      table_columns([{a1: ({t2_100: (a1.__pk_increment, a1.UNIQUE1, a1.UNIQUE2, a1.UNIQUE3, a1.TEN, a1.HUNDRED, a1.THOUSAND, a1.HUND_CLUST, a1.HUND_NULL,
       a1.CHAR_UNIQUE, a1.CHAR_HUND, a1.VCHAR_UNIQUE, a1.VCHAR_HUND, a1.DATE_UNIQUE, a1.DATE_HUND, a1.ALL_NULL, a1.NUMERIC)}), hash_distinct}]),
      update([a1.THOUSAND=column_conv(DECIMAL_INT,PS:(10,0),NULL,a1.UNIQUE1)])
  1 - output([a1.__pk_increment], [a1.UNIQUE1], [a1.UNIQUE2], [a1.UNIQUE3], [a1.TEN], [a1.HUNDRED], [a1.THOUSAND], [a1.HUND_CLUST], [a1.HUND_NULL], [a1.CHAR_UNIQUE],
       [a1.CHAR_HUND], [a1.VCHAR_UNIQUE], [a1.VCHAR_HUND], [a1.DATE_UNIQUE], [a1.DATE_HUND], [a1.ALL_NULL], [a1.NUMERIC]), filter(nil), rowset=256
      equal_conds([a1.UNIQUE1 = b1.UNIQUE1]), other_conds(nil)
  2 - output([b1.UNIQUE1]), filter(nil), rowset=256
      access([b1.UNIQUE1]), partitions(p0)
      is_index_back=false, is_global_index=false, 
      range_key([b1.__pk_increment]), range(MIN ; MAX)always true
  3 - output([a1.__pk_increment], [a1.THOUSAND], [a1.UNIQUE1], [a1.UNIQUE2], [a1.UNIQUE3], [a1.TEN], [a1.HUNDRED], [a1.HUND_CLUST], [a1.HUND_NULL], [a1.CHAR_UNIQUE],
       [a1.CHAR_HUND], [a1.VCHAR_UNIQUE], [a1.VCHAR_HUND], [a1.DATE_UNIQUE], [a1.DATE_HUND], [a1.ALL_NULL], [a1.NUMERIC]), filter([cast(a1.HUNDRED, DECIMAL(10,
       0)) >= cast(cast(cast(a1.HUNDRED, DECIMAL_INT(32, 0)), DECIMAL_INT(64, 32)) / cast(CASE WHEN a1.HUNDRED IS NOT NULL THEN 1 ELSE 0 END, DECIMAL_INT(20, 
      0)), DECIMAL(14, 4))]), rowset=256
      access([a1.__pk_increment], [a1.THOUSAND], [a1.UNIQUE1], [a1.UNIQUE2], [a1.UNIQUE3], [a1.TEN], [a1.HUNDRED], [a1.HUND_CLUST], [a1.HUND_NULL], [a1.CHAR_UNIQUE],
       [a1.CHAR_HUND], [a1.VCHAR_UNIQUE], [a1.VCHAR_HUND], [a1.DATE_UNIQUE], [a1.DATE_HUND], [a1.ALL_NULL], [a1.NUMERIC]), partitions(p0)
      is_index_back=false, is_global_index=false, filter_before_indexback[false], 
      range_key([a1.__pk_increment]), range(MIN ; MAX)always true
update t2_100 a1, t1_100 b1 set a1.thousand = a1.unique1 where a1.unique1 = b1.unique1 and a1.hundred >= (select avg(a2.hundred) from t2_100 a2 where a2.unique1 = b1.unique1);
select/*no explain*/sum(thousand), stddev(thousand) from t2_100;
+---------------+-------------------+
| sum(thousand) | stddev(thousand)  |
+---------------+-------------------+
|          4950 | 28.86607004772212 |
+---------------+-------------------+
rollback;
EXPLAIN update t2_100 a1, t1_100 b1 set a1.thousand = (select avg(a2.hundred) from t2_100 a2 where a2.unique1 = b1.unique1) where a1.unique1 = b1.unique1;
Query Plan
=====================================================
|ID|OPERATOR             |NAME|EST.ROWS|EST.TIME(us)|
-----------------------------------------------------
|0 |UPDATE               |    |100     |878         |
|1 |└─HASH JOIN          |    |100     |97          |
|2 |  ├─HASH OUTER JOIN  |    |100     |41          |
|3 |  │ ├─TABLE FULL SCAN|b1  |100     |4           |
|4 |  │ └─TABLE FULL SCAN|a2  |100     |6           |
|5 |  └─TABLE FULL SCAN  |a1  |100     |26          |
=====================================================
Outputs & filters:
-------------------------------------
  0 - output(nil), filter(nil)
      table_columns([{a1: ({t2_100: (a1.__pk_increment, a1.UNIQUE1, a1.UNIQUE2, a1.UNIQUE3, a1.TEN, a1.HUNDRED, a1.THOUSAND, a1.HUND_CLUST, a1.HUND_NULL,
       a1.CHAR_UNIQUE, a1.CHAR_HUND, a1.VCHAR_UNIQUE, a1.VCHAR_HUND, a1.DATE_UNIQUE, a1.DATE_HUND, a1.ALL_NULL, a1.NUMERIC)}), hash_distinct}]),
      update([a1.THOUSAND=column_conv(DECIMAL_INT,PS:(10,0),NULL,cast(cast(cast(cast(a2.HUNDRED, DECIMAL_INT(32, 0)), DECIMAL_INT(64, 32)) / cast(CASE WHEN 
      a2.HUNDRED IS NOT NULL THEN 1 ELSE 0 END, DECIMAL_INT(20, 0)), DECIMAL(14, 4)), DECIMAL_INT(10, 0)))])
  1 - output([a1.__pk_increment], [a1.UNIQUE1], [a1.UNIQUE2], [a1.UNIQUE3], [a1.TEN], [a1.HUNDRED], [a1.THOUSAND], [a1.HUND_CLUST], [a1.HUND_NULL], [a1.CHAR_UNIQUE],
       [a1.CHAR_HUND], [a1.VCHAR_UNIQUE], [a1.VCHAR_HUND], [a1.DATE_UNIQUE], [a1.DATE_HUND], [a1.ALL_NULL], [a1.NUMERIC], [a2.HUNDRED]), filter(nil), rowset=256
      equal_conds([a1.UNIQUE1 = b1.UNIQUE1]), other_conds(nil)
  2 - output([b1.UNIQUE1], [a2.HUNDRED]), filter(nil), rowset=256
      equal_conds([a2.UNIQUE1 = b1.UNIQUE1]), other_conds(nil)
  3 - output([b1.UNIQUE1]), filter(nil), rowset=256
      access([b1.UNIQUE1]), partitions(p0)
      is_index_back=false, is_global_index=false, 
      range_key([b1.__pk_increment]), range(MIN ; MAX)always true
  4 - output([a2.UNIQUE1], [a2.HUNDRED]), filter(nil), rowset=256
      access([a2.UNIQUE1], [a2.HUNDRED]), partitions(p0)
      is_index_back=false, is_global_index=false, 
      range_key([a2.__pk_increment]), range(MIN ; MAX)always true
  5 - output([a1.__pk_increment], [a1.THOUSAND], [a1.UNIQUE1], [a1.UNIQUE2], [a1.UNIQUE3], [a1.TEN], [a1.HUNDRED], [a1.HUND_CLUST], [a1.HUND_NULL], [a1.CHAR_UNIQUE],
       [a1.CHAR_HUND], [a1.VCHAR_UNIQUE], [a1.VCHAR_HUND], [a1.DATE_UNIQUE], [a1.DATE_HUND], [a1.ALL_NULL], [a1.NUMERIC]), filter(nil), rowset=256
      access([a1.__pk_increment], [a1.THOUSAND], [a1.UNIQUE1], [a1.UNIQUE2], [a1.UNIQUE3], [a1.TEN], [a1.HUNDRED], [a1.HUND_CLUST], [a1.HUND_NULL], [a1.CHAR_UNIQUE],
       [a1.CHAR_HUND], [a1.VCHAR_UNIQUE], [a1.VCHAR_HUND], [a1.DATE_UNIQUE], [a1.DATE_HUND], [a1.ALL_NULL], [a1.NUMERIC]), partitions(p0)
      is_index_back=false, is_global_index=false, 
      range_key([a1.__pk_increment]), range(MIN ; MAX)always true
update t2_100 a1, t1_100 b1 set a1.thousand = (select avg(a2.hundred) from t2_100 a2 where a2.unique1 = b1.unique1) where a1.unique1 = b1.unique1;
select/*no explain*/sum(thousand), stddev(thousand) from t2_100;
+---------------+-------------------+
| sum(thousand) | stddev(thousand)  |
+---------------+-------------------+
|          4950 | 28.86607004772212 |
+---------------+-------------------+
rollback;
EXPLAIN insert into tmp select avg(a1.thousand) from t2_100 a1, t1_100 b1 where a1.unique1 = b1.unique1 and a1.hundred >= (select avg(a2.hundred) from t2_100 a2 where a2.unique1 = b1.unique1);
Query Plan
==================================================================
|ID|OPERATOR               |NAME           |EST.ROWS|EST.TIME(us)|
------------------------------------------------------------------
|0 |INSERT                 |               |1       |62          |
|1 |└─SUBPLAN SCAN         |ANONYMOUS_VIEW1|1       |49          |
|2 |  └─SCALAR GROUP BY    |               |1       |49          |
|3 |    └─HASH JOIN        |               |100     |46          |
|4 |      ├─TABLE FULL SCAN|b1             |100     |4           |
|5 |      └─TABLE FULL SCAN|a1             |100     |11          |
==================================================================
Outputs & filters:
-------------------------------------
  0 - output(nil), filter(nil)
      columns([{tmp: ({tmp: (tmp.__pk_increment, tmp.c1)})}]), partitions(p0), 
      column_values([T_HIDDEN_PK], [column_conv(INT,PS:(11,0),NULL,cast(ANONYMOUS_VIEW1.avg(a1.thousand), INT(-1, 0)))])
  1 - output([ANONYMOUS_VIEW1.avg(a1.thousand)]), filter(nil), rowset=256
      access([ANONYMOUS_VIEW1.avg(a1.thousand)])
  2 - output([cast(cast(T_FUN_SUM(a1.THOUSAND), DECIMAL_INT(64, 32)) / cast(T_FUN_COUNT(a1.THOUSAND), DECIMAL_INT(20, 0)), DECIMAL(14, 4))]), filter(nil), rowset=256
      group(nil), agg_func([T_FUN_SUM(a1.THOUSAND)], [T_FUN_COUNT(a1.THOUSAND)])
  3 - output([a1.THOUSAND]), filter(nil), rowset=256
      equal_conds([a1.UNIQUE1 = b1.UNIQUE1]), other_conds(nil)
  4 - output([b1.UNIQUE1]), filter(nil), rowset=256
      access([b1.UNIQUE1]), partitions(p0)
      is_index_back=false, is_global_index=false, 
      range_key([b1.__pk_increment]), range(MIN ; MAX)always true
  5 - output([a1.UNIQUE1], [a1.THOUSAND]), filter([cast(a1.HUNDRED, DECIMAL(10, 0)) >= cast(cast(cast(a1.HUNDRED, DECIMAL_INT(32, 0)), DECIMAL_INT(64, 32)) 
      / cast(CASE WHEN a1.HUNDRED IS NOT NULL THEN 1 ELSE 0 END, DECIMAL_INT(20, 0)), DECIMAL(14, 4))]), rowset=256
      access([a1.UNIQUE1], [a1.HUNDRED], [a1.THOUSAND]), partitions(p0)
      is_index_back=false, is_global_index=false, filter_before_indexback[false], 
      range_key([a1.__pk_increment]), range(MIN ; MAX)always true
insert into tmp select avg(a1.thousand) from t2_100 a1, t1_100 b1 where a1.unique1 = b1.unique1 and a1.hundred >= (select avg(a2.hundred) from t2_100 a2 where a2.unique1 = b1.unique1);
select/*no explain*/* from tmp;
+------+
| c1   |
+------+
|   50 |
+------+
rollback;

EXPLAIN select avg(a1.thousand), avg(b1.thousand) from t2_100 a1, t1_100 b1 where a1.ten = b1.ten and a1.hundred >= (select avg(a2.hundred) from t2_100 a2 where a2.ten = b1.ten);
Query Plan
==========================================================
|ID|OPERATOR                 |NAME |EST.ROWS|EST.TIME(us)|
----------------------------------------------------------
|0 |SCALAR GROUP BY          |     |1       |119         |
|1 |└─HASH JOIN              |     |100     |112         |
|2 |  ├─HASH JOIN            |     |100     |40          |
|3 |  │ ├─SUBPLAN SCAN       |VIEW1|10      |20          |
|4 |  │ │ └─HASH GROUP BY    |     |10      |20          |
|5 |  │ │   └─TABLE FULL SCAN|a2   |100     |6           |
|6 |  │ └─TABLE FULL SCAN    |b1   |100     |6           |
|7 |  └─TABLE FULL SCAN      |a1   |100     |8           |
==========================================================
Outputs & filters:
-------------------------------------
  0 - output([cast(cast(T_FUN_SUM(a1.THOUSAND), DECIMAL_INT(64, 32)) / cast(T_FUN_COUNT(a1.THOUSAND), DECIMAL_INT(20, 0)), DECIMAL(14, 4))], [cast(cast(T_FUN_SUM(b1.THOUSAND),
       DECIMAL_INT(64, 32)) / cast(T_FUN_COUNT(b1.THOUSAND), DECIMAL_INT(20, 0)), DECIMAL(14, 4))]), filter(nil), rowset=256
      group(nil), agg_func([T_FUN_SUM(a1.THOUSAND)], [T_FUN_COUNT(a1.THOUSAND)], [T_FUN_SUM(b1.THOUSAND)], [T_FUN_COUNT(b1.THOUSAND)])
  1 - output([a1.THOUSAND], [b1.THOUSAND]), filter(nil), rowset=256
      equal_conds([a1.TEN = b1.TEN]), other_conds([cast(a1.HUNDRED, DECIMAL(10, 0)) >= VIEW1.avg(a2.hundred)])
  2 - output([b1.THOUSAND], [b1.TEN], [VIEW1.avg(a2.hundred)]), filter(nil), rowset=256
      equal_conds([VIEW1.a2.TEN = b1.TEN]), other_conds(nil)
  3 - output([VIEW1.avg(a2.hundred)], [VIEW1.a2.TEN]), filter(nil), rowset=256
      access([VIEW1.avg(a2.hundred)], [VIEW1.a2.TEN])
  4 - output([cast(cast(T_FUN_SUM(a2.HUNDRED), DECIMAL_INT(64, 32)) / cast(T_FUN_COUNT(a2.HUNDRED), DECIMAL_INT(20, 0)), DECIMAL(14, 4))], [a2.TEN]), filter(nil), rowset=256
      group([a2.TEN]), agg_func([T_FUN_SUM(a2.HUNDRED)], [T_FUN_COUNT(a2.HUNDRED)])
  5 - output([a2.TEN], [a2.HUNDRED]), filter(nil), rowset=256
      access([a2.TEN], [a2.HUNDRED]), partitions(p0)
      is_index_back=false, is_global_index=false, 
      range_key([a2.__pk_increment]), range(MIN ; MAX)always true
  6 - output([b1.TEN], [b1.THOUSAND]), filter(nil), rowset=256
      access([b1.TEN], [b1.THOUSAND]), partitions(p0)
      is_index_back=false, is_global_index=false, 
      range_key([b1.__pk_increment]), range(MIN ; MAX)always true
  7 - output([a1.TEN], [a1.HUNDRED], [a1.THOUSAND]), filter(nil), rowset=256
      access([a1.TEN], [a1.HUNDRED], [a1.THOUSAND]), partitions(p0)
      is_index_back=false, is_global_index=false, 
      range_key([a1.__pk_increment]), range(MIN ; MAX)always true
select avg(a1.thousand), avg(b1.thousand) from t2_100 a1, t1_100 b1 where a1.ten = b1.ten and a1.hundred >= (select avg(a2.hundred) from t2_100 a2 where a2.ten = b1.ten);
+------------------+------------------+
| avg(a1.thousand) | avg(b1.thousand) |
+------------------+------------------+
|          74.5000 |          49.5000 |
+------------------+------------------+
EXPLAIN select /*+no_unnest(@qb1)*/ avg(a1.thousand), avg(b1.thousand) from t2_100 a1, t1_100 b1 where a1.ten = b1.ten and a1.hundred >= (select /*+qb_name(qb1)*/avg(a2.hundred) from t2_100 a2 where a2.ten = b1.ten);
Query Plan
================================================================
|ID|OPERATOR              |NAME          |EST.ROWS|EST.TIME(us)|
----------------------------------------------------------------
|0 |SCALAR GROUP BY       |              |1       |45196       |
|1 |└─SUBPLAN FILTER      |              |334     |45175       |
|2 |  ├─HASH JOIN         |              |1000    |81          |
|3 |  │ ├─TABLE FULL SCAN |b1            |100     |6           |
|4 |  │ └─TABLE FULL SCAN |a1            |100     |8           |
|5 |  └─SCALAR GROUP BY   |              |1       |46          |
|6 |    └─TABLE RANGE SCAN|a2(T2_100_TEN)|10      |45          |
================================================================
Outputs & filters:
-------------------------------------
  0 - output([cast(cast(T_FUN_SUM(a1.THOUSAND), DECIMAL_INT(64, 32)) / cast(T_FUN_COUNT(a1.THOUSAND), DECIMAL_INT(20, 0)), DECIMAL(14, 4))], [cast(cast(T_FUN_SUM(b1.THOUSAND),
       DECIMAL_INT(64, 32)) / cast(T_FUN_COUNT(b1.THOUSAND), DECIMAL_INT(20, 0)), DECIMAL(14, 4))]), filter(nil), rowset=256
      group(nil), agg_func([T_FUN_SUM(a1.THOUSAND)], [T_FUN_COUNT(a1.THOUSAND)], [T_FUN_SUM(b1.THOUSAND)], [T_FUN_COUNT(b1.THOUSAND)])
  1 - output([a1.THOUSAND], [b1.THOUSAND]), filter([cast(a1.HUNDRED, DECIMAL(10, 0)) >= subquery(1)]), rowset=256
      exec_params_([b1.TEN(:0)]), onetime_exprs_(nil), init_plan_idxs_(nil), use_batch=false
  2 - output([a1.THOUSAND], [b1.THOUSAND], [b1.TEN], [a1.HUNDRED]), filter(nil), rowset=256
      equal_conds([a1.TEN = b1.TEN]), other_conds(nil)
  3 - output([b1.TEN], [b1.THOUSAND]), filter(nil), rowset=256
      access([b1.TEN], [b1.THOUSAND]), partitions(p0)
      is_index_back=false, is_global_index=false, 
      range_key([b1.__pk_increment]), range(MIN ; MAX)always true
  4 - output([a1.TEN], [a1.HUNDRED], [a1.THOUSAND]), filter(nil), rowset=256
      access([a1.TEN], [a1.HUNDRED], [a1.THOUSAND]), partitions(p0)
      is_index_back=false, is_global_index=false, 
      range_key([a1.__pk_increment]), range(MIN ; MAX)always true
  5 - output([cast(cast(T_FUN_SUM(a2.HUNDRED), DECIMAL_INT(64, 32)) / cast(T_FUN_COUNT(a2.HUNDRED), DECIMAL_INT(20, 0)), DECIMAL(14, 4))]), filter(nil), rowset=256
      group(nil), agg_func([T_FUN_SUM(a2.HUNDRED)], [T_FUN_COUNT(a2.HUNDRED)])
  6 - output([a2.HUNDRED]), filter(nil), rowset=256
      access([a2.__pk_increment], [a2.HUNDRED]), partitions(p0)
      is_index_back=true, is_global_index=false, 
      range_key([a2.TEN], [a2.__pk_increment]), range(MIN,MIN ; MAX,MAX)always true, 
      range_cond([a2.TEN = :0])
select /*+no_unnest(@qb1)*/ avg(a1.thousand), avg(b1.thousand) from t2_100 a1, t1_100 b1 where a1.ten = b1.ten and a1.hundred >= (select /*+qb_name(qb1)*/avg(a2.hundred) from t2_100 a2 where a2.ten = b1.ten);
+------------------+------------------+
| avg(a1.thousand) | avg(b1.thousand) |
+------------------+------------------+
|          74.5000 |          49.5000 |
+------------------+------------------+

EXPLAIN update t2_100 a1, t1_100 b1 set a1.thousand = a1.unique1 where a1.ten = b1.ten and a1.hundred >= (select avg(a2.hundred) from t2_100 a2 where a2.ten = b1.ten);
Query Plan
==========================================================
|ID|OPERATOR                 |NAME |EST.ROWS|EST.TIME(us)|
----------------------------------------------------------
|0 |UPDATE                   |     |50      |704         |
|1 |└─HASH JOIN              |     |50      |302         |
|2 |  ├─SUBPLAN SCAN         |VIEW1|5       |283         |
|3 |  │ └─WINDOW FUNCTION    |     |100     |282         |
|4 |  │   └─PARTITION SORT   |     |100     |94          |
|5 |  │     └─TABLE FULL SCAN|a2   |100     |29          |
|6 |  └─TABLE FULL SCAN      |b1   |100     |4           |
==========================================================
Outputs & filters:
-------------------------------------
  0 - output(nil), filter(nil)
      table_columns([{VIEW1: ({t2_100: (VIEW1.a2.__pk_increment, VIEW1.a2.UNIQUE1, VIEW1.a2.UNIQUE2, VIEW1.a2.UNIQUE3, VIEW1.a2.TEN, VIEW1.a2.HUNDRED, VIEW1.a2.THOUSAND,
       VIEW1.a2.HUND_CLUST, VIEW1.a2.HUND_NULL, VIEW1.a2.CHAR_UNIQUE, VIEW1.a2.CHAR_HUND, VIEW1.a2.VCHAR_UNIQUE, VIEW1.a2.VCHAR_HUND, VIEW1.a2.DATE_UNIQUE, VIEW1.a2.DATE_HUND,
       VIEW1.a2.ALL_NULL, VIEW1.a2.NUMERIC)}), hash_distinct}]),
      update([VIEW1.a2.THOUSAND=column_conv(DECIMAL_INT,PS:(10,0),NULL,VIEW1.a2.UNIQUE1)])
  1 - output([VIEW1.a2.__pk_increment], [VIEW1.a2.UNIQUE1], [VIEW1.a2.UNIQUE2], [VIEW1.a2.UNIQUE3], [VIEW1.a2.TEN], [VIEW1.a2.HUNDRED], [VIEW1.a2.THOUSAND],
       [VIEW1.a2.HUND_CLUST], [VIEW1.a2.HUND_NULL], [VIEW1.a2.CHAR_UNIQUE], [VIEW1.a2.CHAR_HUND], [VIEW1.a2.VCHAR_UNIQUE], [VIEW1.a2.VCHAR_HUND], [VIEW1.a2.DATE_UNIQUE],
       [VIEW1.a2.DATE_HUND], [VIEW1.a2.ALL_NULL], [VIEW1.a2.NUMERIC]), filter(nil), rowset=256
      equal_conds([VIEW1.a2.TEN = b1.TEN]), other_conds(nil)
  2 - output([VIEW1.a2.TEN], [VIEW1.a2.__pk_increment], [VIEW1.a2.THOUSAND], [VIEW1.a2.UNIQUE1], [VIEW1.a2.UNIQUE2], [VIEW1.a2.UNIQUE3], [VIEW1.a2.HUNDRED],
       [VIEW1.a2.HUND_CLUST], [VIEW1.a2.HUND_NULL], [VIEW1.a2.CHAR_UNIQUE], [VIEW1.a2.CHAR_HUND], [VIEW1.a2.VCHAR_UNIQUE], [VIEW1.a2.VCHAR_HUND], [VIEW1.a2.DATE_UNIQUE],
       [VIEW1.a2.DATE_HUND], [VIEW1.a2.ALL_NULL], [VIEW1.a2.NUMERIC]), filter([cast(VIEW1.a2.HUNDRED, DECIMAL(10, 0)) >= VIEW1.avg(a2.hundred)]), rowset=256
      access([VIEW1.avg(a2.hundred)], [VIEW1.a2.TEN], [VIEW1.a2.__pk_increment], [VIEW1.a2.THOUSAND], [VIEW1.a2.UNIQUE1], [VIEW1.a2.UNIQUE2], [VIEW1.a2.UNIQUE3],
       [VIEW1.a2.HUNDRED], [VIEW1.a2.HUND_CLUST], [VIEW1.a2.HUND_NULL], [VIEW1.a2.CHAR_UNIQUE], [VIEW1.a2.CHAR_HUND], [VIEW1.a2.VCHAR_UNIQUE], [VIEW1.a2.VCHAR_HUND],
       [VIEW1.a2.DATE_UNIQUE], [VIEW1.a2.DATE_HUND], [VIEW1.a2.ALL_NULL], [VIEW1.a2.NUMERIC])
  3 - output([cast(cast(T_FUN_SUM(a2.HUNDRED), DECIMAL_INT(64, 32)) / cast(T_FUN_COUNT(a2.HUNDRED), DECIMAL_INT(20, 0)), DECIMAL(14, 4))], [a2.TEN], [a2.__pk_increment],
       [a2.THOUSAND], [a2.UNIQUE1], [a2.UNIQUE2], [a2.UNIQUE3], [a2.HUNDRED], [a2.HUND_CLUST], [a2.HUND_NULL], [a2.CHAR_UNIQUE], [a2.CHAR_HUND], [a2.VCHAR_UNIQUE],
       [a2.VCHAR_HUND], [a2.DATE_UNIQUE], [a2.DATE_HUND], [a2.ALL_NULL], [a2.NUMERIC]), filter(nil), rowset=256
      win_expr(T_FUN_SUM(a2.HUNDRED)), partition_by([a2.TEN]), order_by(nil), window_type(RANGE), upper(UNBOUNDED PRECEDING), lower(UNBOUNDED FOLLOWING)
      win_expr(T_FUN_COUNT(a2.HUNDRED)), partition_by([a2.TEN]), order_by(nil), window_type(RANGE), upper(UNBOUNDED PRECEDING), lower(UNBOUNDED FOLLOWING)
  4 - output([a2.HUNDRED], [a2.TEN], [a2.__pk_increment], [a2.THOUSAND], [a2.UNIQUE1], [a2.UNIQUE2], [a2.UNIQUE3], [a2.HUND_CLUST], [a2.HUND_NULL], [a2.CHAR_UNIQUE],
       [a2.CHAR_HUND], [a2.VCHAR_UNIQUE], [a2.VCHAR_HUND], [a2.DATE_UNIQUE], [a2.DATE_HUND], [a2.ALL_NULL], [a2.NUMERIC]), filter(nil), rowset=256
      sort_keys([HASH(a2.TEN), ASC], [a2.TEN, ASC])
  5 - output([a2.__pk_increment], [a2.TEN], [a2.HUNDRED], [a2.THOUSAND], [a2.UNIQUE1], [a2.UNIQUE2], [a2.UNIQUE3], [a2.HUND_CLUST], [a2.HUND_NULL], [a2.CHAR_UNIQUE],
       [a2.CHAR_HUND], [a2.VCHAR_UNIQUE], [a2.VCHAR_HUND], [a2.DATE_UNIQUE], [a2.DATE_HUND], [a2.ALL_NULL], [a2.NUMERIC]), filter([a2.TEN IS NOT NULL]), rowset=256
      access([a2.__pk_increment], [a2.TEN], [a2.HUNDRED], [a2.THOUSAND], [a2.UNIQUE1], [a2.UNIQUE2], [a2.UNIQUE3], [a2.HUND_CLUST], [a2.HUND_NULL], [a2.CHAR_UNIQUE],
       [a2.CHAR_HUND], [a2.VCHAR_UNIQUE], [a2.VCHAR_HUND], [a2.DATE_UNIQUE], [a2.DATE_HUND], [a2.ALL_NULL], [a2.NUMERIC]), partitions(p0)
      is_index_back=false, is_global_index=false, filter_before_indexback[false], 
      range_key([a2.__pk_increment]), range(MIN ; MAX)always true
  6 - output([b1.TEN]), filter(nil), rowset=256
      access([b1.TEN]), partitions(p0)
      is_index_back=false, is_global_index=false, 
      range_key([b1.__pk_increment]), range(MIN ; MAX)always true
update t2_100 a1, t1_100 b1 set a1.thousand = a1.unique1 where a1.ten = b1.ten and a1.hundred >= (select avg(a2.hundred) from t2_100 a2 where a2.ten = b1.ten);
select/*no explain*/sum(thousand), stddev(thousand) from t2_100;
+---------------+-------------------+
| sum(thousand) | stddev(thousand)  |
+---------------+-------------------+
|          4950 | 28.86607004772212 |
+---------------+-------------------+
rollback;
EXPLAIN insert into tmp select avg(a1.thousand) from t2_100 a1, t1_100 b1 where a1.ten = b1.ten and a1.hundred >= (select avg(a2.hundred) from t2_100 a2 where a2.ten = b1.ten);
Query Plan
========================================================================
|ID|OPERATOR                     |NAME           |EST.ROWS|EST.TIME(us)|
------------------------------------------------------------------------
|0 |INSERT                       |               |1       |123         |
|1 |└─SUBPLAN SCAN               |ANONYMOUS_VIEW1|1       |110         |
|2 |  └─SCALAR GROUP BY          |               |1       |110         |
|3 |    └─HASH JOIN              |               |100     |107         |
|4 |      ├─HASH JOIN            |               |100     |39          |
|5 |      │ ├─SUBPLAN SCAN       |VIEW1          |10      |20          |
|6 |      │ │ └─HASH GROUP BY    |               |10      |20          |
|7 |      │ │   └─TABLE FULL SCAN|a2             |100     |6           |
|8 |      │ └─TABLE FULL SCAN    |b1             |100     |4           |
|9 |      └─TABLE FULL SCAN      |a1             |100     |8           |
========================================================================
Outputs & filters:
-------------------------------------
  0 - output(nil), filter(nil)
      columns([{tmp: ({tmp: (tmp.__pk_increment, tmp.c1)})}]), partitions(p0), 
      column_values([T_HIDDEN_PK], [column_conv(INT,PS:(11,0),NULL,cast(ANONYMOUS_VIEW1.avg(a1.thousand), INT(-1, 0)))])
  1 - output([ANONYMOUS_VIEW1.avg(a1.thousand)]), filter(nil), rowset=256
      access([ANONYMOUS_VIEW1.avg(a1.thousand)])
  2 - output([cast(cast(T_FUN_SUM(a1.THOUSAND), DECIMAL_INT(64, 32)) / cast(T_FUN_COUNT(a1.THOUSAND), DECIMAL_INT(20, 0)), DECIMAL(14, 4))]), filter(nil), rowset=256
      group(nil), agg_func([T_FUN_SUM(a1.THOUSAND)], [T_FUN_COUNT(a1.THOUSAND)])
  3 - output([a1.THOUSAND]), filter(nil), rowset=256
      equal_conds([a1.TEN = b1.TEN]), other_conds([cast(a1.HUNDRED, DECIMAL(10, 0)) >= VIEW1.avg(a2.hundred)])
  4 - output([b1.TEN], [VIEW1.avg(a2.hundred)]), filter(nil), rowset=256
      equal_conds([VIEW1.a2.TEN = b1.TEN]), other_conds(nil)
  5 - output([VIEW1.avg(a2.hundred)], [VIEW1.a2.TEN]), filter(nil), rowset=256
      access([VIEW1.avg(a2.hundred)], [VIEW1.a2.TEN])
  6 - output([cast(cast(T_FUN_SUM(a2.HUNDRED), DECIMAL_INT(64, 32)) / cast(T_FUN_COUNT(a2.HUNDRED), DECIMAL_INT(20, 0)), DECIMAL(14, 4))], [a2.TEN]), filter(nil), rowset=256
      group([a2.TEN]), agg_func([T_FUN_SUM(a2.HUNDRED)], [T_FUN_COUNT(a2.HUNDRED)])
  7 - output([a2.TEN], [a2.HUNDRED]), filter(nil), rowset=256
      access([a2.TEN], [a2.HUNDRED]), partitions(p0)
      is_index_back=false, is_global_index=false, 
      range_key([a2.__pk_increment]), range(MIN ; MAX)always true
  8 - output([b1.TEN]), filter(nil), rowset=256
      access([b1.TEN]), partitions(p0)
      is_index_back=false, is_global_index=false, 
      range_key([b1.__pk_increment]), range(MIN ; MAX)always true
  9 - output([a1.TEN], [a1.HUNDRED], [a1.THOUSAND]), filter(nil), rowset=256
      access([a1.TEN], [a1.HUNDRED], [a1.THOUSAND]), partitions(p0)
      is_index_back=false, is_global_index=false, 
      range_key([a1.__pk_increment]), range(MIN ; MAX)always true
insert into tmp select avg(a1.thousand) from t2_100 a1, t1_100 b1 where a1.ten = b1.ten and a1.hundred >= (select avg(a2.hundred) from t2_100 a2 where a2.ten = b1.ten);
select/*no explain*/* from tmp;
+------+
| c1   |
+------+
|   75 |
+------+
rollback;

EXPLAIN select avg(a1.thousand), avg(b1.thousand) from t2_100 a1, t1_100 b1 where a1.ten = b1.ten and a1.hundred >= (select avg(a2.hundred) from t2_100 a2 where a2.ten = b1.ten and a1.ten = a2.ten);
Query Plan
==========================================================
|ID|OPERATOR                 |NAME |EST.ROWS|EST.TIME(us)|
----------------------------------------------------------
|0 |SCALAR GROUP BY          |     |1       |119         |
|1 |└─HASH JOIN              |     |100     |112         |
|2 |  ├─HASH JOIN            |     |100     |40          |
|3 |  │ ├─SUBPLAN SCAN       |VIEW1|10      |20          |
|4 |  │ │ └─HASH GROUP BY    |     |10      |20          |
|5 |  │ │   └─TABLE FULL SCAN|a2   |100     |6           |
|6 |  │ └─TABLE FULL SCAN    |b1   |100     |6           |
|7 |  └─TABLE FULL SCAN      |a1   |100     |8           |
==========================================================
Outputs & filters:
-------------------------------------
  0 - output([cast(cast(T_FUN_SUM(a1.THOUSAND), DECIMAL_INT(64, 32)) / cast(T_FUN_COUNT(a1.THOUSAND), DECIMAL_INT(20, 0)), DECIMAL(14, 4))], [cast(cast(T_FUN_SUM(b1.THOUSAND),
       DECIMAL_INT(64, 32)) / cast(T_FUN_COUNT(b1.THOUSAND), DECIMAL_INT(20, 0)), DECIMAL(14, 4))]), filter(nil), rowset=256
      group(nil), agg_func([T_FUN_SUM(a1.THOUSAND)], [T_FUN_COUNT(a1.THOUSAND)], [T_FUN_SUM(b1.THOUSAND)], [T_FUN_COUNT(b1.THOUSAND)])
  1 - output([a1.THOUSAND], [b1.THOUSAND]), filter(nil), rowset=256
      equal_conds([a1.TEN = b1.TEN]), other_conds([cast(a1.HUNDRED, DECIMAL(10, 0)) >= VIEW1.avg(a2.hundred)])
  2 - output([b1.THOUSAND], [b1.TEN], [VIEW1.avg(a2.hundred)]), filter(nil), rowset=256
      equal_conds([VIEW1.a2.TEN = b1.TEN]), other_conds(nil)
  3 - output([VIEW1.avg(a2.hundred)], [VIEW1.a2.TEN]), filter(nil), rowset=256
      access([VIEW1.avg(a2.hundred)], [VIEW1.a2.TEN])
  4 - output([cast(cast(T_FUN_SUM(a2.HUNDRED), DECIMAL_INT(64, 32)) / cast(T_FUN_COUNT(a2.HUNDRED), DECIMAL_INT(20, 0)), DECIMAL(14, 4))], [a2.TEN]), filter(nil), rowset=256
      group([a2.TEN]), agg_func([T_FUN_SUM(a2.HUNDRED)], [T_FUN_COUNT(a2.HUNDRED)])
  5 - output([a2.TEN], [a2.HUNDRED]), filter(nil), rowset=256
      access([a2.TEN], [a2.HUNDRED]), partitions(p0)
      is_index_back=false, is_global_index=false, 
      range_key([a2.__pk_increment]), range(MIN ; MAX)always true
  6 - output([b1.TEN], [b1.THOUSAND]), filter(nil), rowset=256
      access([b1.TEN], [b1.THOUSAND]), partitions(p0)
      is_index_back=false, is_global_index=false, 
      range_key([b1.__pk_increment]), range(MIN ; MAX)always true
  7 - output([a1.TEN], [a1.HUNDRED], [a1.THOUSAND]), filter(nil), rowset=256
      access([a1.TEN], [a1.HUNDRED], [a1.THOUSAND]), partitions(p0)
      is_index_back=false, is_global_index=false, 
      range_key([a1.__pk_increment]), range(MIN ; MAX)always true
select avg(a1.thousand), avg(b1.thousand) from t2_100 a1, t1_100 b1 where a1.ten = b1.ten and a1.hundred >= (select avg(a2.hundred) from t2_100 a2 where a2.ten = b1.ten and a1.ten = a2.ten);
+------------------+------------------+
| avg(a1.thousand) | avg(b1.thousand) |
+------------------+------------------+
|          74.5000 |          49.5000 |
+------------------+------------------+
EXPLAIN select /*+no_unnest(@qb1)*/ avg(a1.thousand), avg(b1.thousand) from t2_100 a1, t1_100 b1 where a1.ten = b1.ten and a1.hundred >= (select /*+qb_name(qb1)*/avg(a2.hundred) from t2_100 a2 where a2.ten = b1.ten and a1.ten = a2.ten);
Query Plan
================================================================
|ID|OPERATOR              |NAME          |EST.ROWS|EST.TIME(us)|
----------------------------------------------------------------
|0 |SCALAR GROUP BY       |              |1       |45196       |
|1 |└─SUBPLAN FILTER      |              |334     |45175       |
|2 |  ├─HASH JOIN         |              |1000    |81          |
|3 |  │ ├─TABLE FULL SCAN |b1            |100     |6           |
|4 |  │ └─TABLE FULL SCAN |a1            |100     |8           |
|5 |  └─SCALAR GROUP BY   |              |1       |46          |
|6 |    └─TABLE RANGE SCAN|a2(T2_100_TEN)|10      |45          |
================================================================
Outputs & filters:
-------------------------------------
  0 - output([cast(cast(T_FUN_SUM(a1.THOUSAND), DECIMAL_INT(64, 32)) / cast(T_FUN_COUNT(a1.THOUSAND), DECIMAL_INT(20, 0)), DECIMAL(14, 4))], [cast(cast(T_FUN_SUM(b1.THOUSAND),
       DECIMAL_INT(64, 32)) / cast(T_FUN_COUNT(b1.THOUSAND), DECIMAL_INT(20, 0)), DECIMAL(14, 4))]), filter(nil), rowset=256
      group(nil), agg_func([T_FUN_SUM(a1.THOUSAND)], [T_FUN_COUNT(a1.THOUSAND)], [T_FUN_SUM(b1.THOUSAND)], [T_FUN_COUNT(b1.THOUSAND)])
  1 - output([a1.THOUSAND], [b1.THOUSAND]), filter([cast(a1.HUNDRED, DECIMAL(10, 0)) >= subquery(1)]), rowset=256
      exec_params_([b1.TEN(:0)], [a1.TEN(:1)]), onetime_exprs_(nil), init_plan_idxs_(nil), use_batch=false
  2 - output([a1.THOUSAND], [b1.THOUSAND], [b1.TEN], [a1.TEN], [a1.HUNDRED]), filter(nil), rowset=256
      equal_conds([a1.TEN = b1.TEN]), other_conds(nil)
  3 - output([b1.TEN], [b1.THOUSAND]), filter(nil), rowset=256
      access([b1.TEN], [b1.THOUSAND]), partitions(p0)
      is_index_back=false, is_global_index=false, 
      range_key([b1.__pk_increment]), range(MIN ; MAX)always true
  4 - output([a1.TEN], [a1.HUNDRED], [a1.THOUSAND]), filter(nil), rowset=256
      access([a1.TEN], [a1.HUNDRED], [a1.THOUSAND]), partitions(p0)
      is_index_back=false, is_global_index=false, 
      range_key([a1.__pk_increment]), range(MIN ; MAX)always true
  5 - output([cast(cast(T_FUN_SUM(a2.HUNDRED), DECIMAL_INT(64, 32)) / cast(T_FUN_COUNT(a2.HUNDRED), DECIMAL_INT(20, 0)), DECIMAL(14, 4))]), filter(nil), rowset=256
      group(nil), agg_func([T_FUN_SUM(a2.HUNDRED)], [T_FUN_COUNT(a2.HUNDRED)])
  6 - output([a2.HUNDRED]), filter(nil), rowset=256
      access([a2.__pk_increment], [a2.HUNDRED]), partitions(p0)
      is_index_back=true, is_global_index=false, 
      range_key([a2.TEN], [a2.__pk_increment]), range(MIN,MIN ; MAX,MAX)always true, 
      range_cond([a2.TEN = :0], [:1 = a2.TEN])
select /*+no_unnest(@qb1)*/ avg(a1.thousand), avg(b1.thousand) from t2_100 a1, t1_100 b1 where a1.ten = b1.ten and a1.hundred >= (select /*+qb_name(qb1)*/avg(a2.hundred) from t2_100 a2 where a2.ten = b1.ten and a1.ten = a2.ten);
+------------------+------------------+
| avg(a1.thousand) | avg(b1.thousand) |
+------------------+------------------+
|          74.5000 |          49.5000 |
+------------------+------------------+

EXPLAIN update t2_100 a1, t1_100 b1 set a1.thousand = a1.unique1 where a1.ten = b1.ten and a1.hundred >= (select avg(a2.hundred) from t2_100 a2 where a2.ten = b1.ten and a1.ten = a2.ten);
Query Plan
==========================================================
|ID|OPERATOR                 |NAME |EST.ROWS|EST.TIME(us)|
----------------------------------------------------------
|0 |UPDATE                   |     |50      |704         |
|1 |└─HASH JOIN              |     |50      |302         |
|2 |  ├─SUBPLAN SCAN         |VIEW1|5       |283         |
|3 |  │ └─WINDOW FUNCTION    |     |100     |282         |
|4 |  │   └─PARTITION SORT   |     |100     |94          |
|5 |  │     └─TABLE FULL SCAN|a2   |100     |29          |
|6 |  └─TABLE FULL SCAN      |b1   |100     |4           |
==========================================================
Outputs & filters:
-------------------------------------
  0 - output(nil), filter(nil)
      table_columns([{VIEW1: ({t2_100: (VIEW1.a2.__pk_increment, VIEW1.a2.UNIQUE1, VIEW1.a2.UNIQUE2, VIEW1.a2.UNIQUE3, VIEW1.a2.TEN, VIEW1.a2.HUNDRED, VIEW1.a2.THOUSAND,
       VIEW1.a2.HUND_CLUST, VIEW1.a2.HUND_NULL, VIEW1.a2.CHAR_UNIQUE, VIEW1.a2.CHAR_HUND, VIEW1.a2.VCHAR_UNIQUE, VIEW1.a2.VCHAR_HUND, VIEW1.a2.DATE_UNIQUE, VIEW1.a2.DATE_HUND,
       VIEW1.a2.ALL_NULL, VIEW1.a2.NUMERIC)}), hash_distinct}]),
      update([VIEW1.a2.THOUSAND=column_conv(DECIMAL_INT,PS:(10,0),NULL,VIEW1.a2.UNIQUE1)])
  1 - output([VIEW1.a2.__pk_increment], [VIEW1.a2.UNIQUE1], [VIEW1.a2.UNIQUE2], [VIEW1.a2.UNIQUE3], [VIEW1.a2.TEN], [VIEW1.a2.HUNDRED], [VIEW1.a2.THOUSAND],
       [VIEW1.a2.HUND_CLUST], [VIEW1.a2.HUND_NULL], [VIEW1.a2.CHAR_UNIQUE], [VIEW1.a2.CHAR_HUND], [VIEW1.a2.VCHAR_UNIQUE], [VIEW1.a2.VCHAR_HUND], [VIEW1.a2.DATE_UNIQUE],
       [VIEW1.a2.DATE_HUND], [VIEW1.a2.ALL_NULL], [VIEW1.a2.NUMERIC]), filter(nil), rowset=256
      equal_conds([VIEW1.a2.TEN = b1.TEN]), other_conds(nil)
  2 - output([VIEW1.a2.TEN], [VIEW1.a2.__pk_increment], [VIEW1.a2.THOUSAND], [VIEW1.a2.UNIQUE1], [VIEW1.a2.UNIQUE2], [VIEW1.a2.UNIQUE3], [VIEW1.a2.HUNDRED],
       [VIEW1.a2.HUND_CLUST], [VIEW1.a2.HUND_NULL], [VIEW1.a2.CHAR_UNIQUE], [VIEW1.a2.CHAR_HUND], [VIEW1.a2.VCHAR_UNIQUE], [VIEW1.a2.VCHAR_HUND], [VIEW1.a2.DATE_UNIQUE],
       [VIEW1.a2.DATE_HUND], [VIEW1.a2.ALL_NULL], [VIEW1.a2.NUMERIC]), filter([cast(VIEW1.a2.HUNDRED, DECIMAL(10, 0)) >= VIEW1.avg(a2.hundred)]), rowset=256
      access([VIEW1.avg(a2.hundred)], [VIEW1.a2.TEN], [VIEW1.a2.__pk_increment], [VIEW1.a2.THOUSAND], [VIEW1.a2.UNIQUE1], [VIEW1.a2.UNIQUE2], [VIEW1.a2.UNIQUE3],
       [VIEW1.a2.HUNDRED], [VIEW1.a2.HUND_CLUST], [VIEW1.a2.HUND_NULL], [VIEW1.a2.CHAR_UNIQUE], [VIEW1.a2.CHAR_HUND], [VIEW1.a2.VCHAR_UNIQUE], [VIEW1.a2.VCHAR_HUND],
       [VIEW1.a2.DATE_UNIQUE], [VIEW1.a2.DATE_HUND], [VIEW1.a2.ALL_NULL], [VIEW1.a2.NUMERIC])
  3 - output([cast(cast(T_FUN_SUM(a2.HUNDRED), DECIMAL_INT(64, 32)) / cast(T_FUN_COUNT(a2.HUNDRED), DECIMAL_INT(20, 0)), DECIMAL(14, 4))], [a2.TEN], [a2.__pk_increment],
       [a2.THOUSAND], [a2.UNIQUE1], [a2.UNIQUE2], [a2.UNIQUE3], [a2.HUNDRED], [a2.HUND_CLUST], [a2.HUND_NULL], [a2.CHAR_UNIQUE], [a2.CHAR_HUND], [a2.VCHAR_UNIQUE],
       [a2.VCHAR_HUND], [a2.DATE_UNIQUE], [a2.DATE_HUND], [a2.ALL_NULL], [a2.NUMERIC]), filter(nil), rowset=256
      win_expr(T_FUN_SUM(a2.HUNDRED)), partition_by([a2.TEN]), order_by(nil), window_type(RANGE), upper(UNBOUNDED PRECEDING), lower(UNBOUNDED FOLLOWING)
      win_expr(T_FUN_COUNT(a2.HUNDRED)), partition_by([a2.TEN]), order_by(nil), window_type(RANGE), upper(UNBOUNDED PRECEDING), lower(UNBOUNDED FOLLOWING)
  4 - output([a2.HUNDRED], [a2.TEN], [a2.__pk_increment], [a2.THOUSAND], [a2.UNIQUE1], [a2.UNIQUE2], [a2.UNIQUE3], [a2.HUND_CLUST], [a2.HUND_NULL], [a2.CHAR_UNIQUE],
       [a2.CHAR_HUND], [a2.VCHAR_UNIQUE], [a2.VCHAR_HUND], [a2.DATE_UNIQUE], [a2.DATE_HUND], [a2.ALL_NULL], [a2.NUMERIC]), filter(nil), rowset=256
      sort_keys([HASH(a2.TEN), ASC], [a2.TEN, ASC])
  5 - output([a2.__pk_increment], [a2.TEN], [a2.HUNDRED], [a2.THOUSAND], [a2.UNIQUE1], [a2.UNIQUE2], [a2.UNIQUE3], [a2.HUND_CLUST], [a2.HUND_NULL], [a2.CHAR_UNIQUE],
       [a2.CHAR_HUND], [a2.VCHAR_UNIQUE], [a2.VCHAR_HUND], [a2.DATE_UNIQUE], [a2.DATE_HUND], [a2.ALL_NULL], [a2.NUMERIC]), filter([a2.TEN IS NOT NULL]), rowset=256
      access([a2.__pk_increment], [a2.TEN], [a2.HUNDRED], [a2.THOUSAND], [a2.UNIQUE1], [a2.UNIQUE2], [a2.UNIQUE3], [a2.HUND_CLUST], [a2.HUND_NULL], [a2.CHAR_UNIQUE],
       [a2.CHAR_HUND], [a2.VCHAR_UNIQUE], [a2.VCHAR_HUND], [a2.DATE_UNIQUE], [a2.DATE_HUND], [a2.ALL_NULL], [a2.NUMERIC]), partitions(p0)
      is_index_back=false, is_global_index=false, filter_before_indexback[false], 
      range_key([a2.__pk_increment]), range(MIN ; MAX)always true
  6 - output([b1.TEN]), filter(nil), rowset=256
      access([b1.TEN]), partitions(p0)
      is_index_back=false, is_global_index=false, 
      range_key([b1.__pk_increment]), range(MIN ; MAX)always true
update t2_100 a1, t1_100 b1 set a1.thousand = a1.unique1 where a1.ten = b1.ten and a1.hundred >= (select avg(a2.hundred) from t2_100 a2 where a2.ten = b1.ten and a1.ten = a2.ten);
select/*no explain*/sum(thousand), stddev(thousand) from t2_100;
+---------------+-------------------+
| sum(thousand) | stddev(thousand)  |
+---------------+-------------------+
|          4950 | 28.86607004772212 |
+---------------+-------------------+
rollback;
EXPLAIN insert into tmp select avg(a1.thousand) from t2_100 a1, t1_100 b1 where a1.ten = b1.ten and a1.hundred >= (select avg(a2.hundred) from t2_100 a2 where a2.ten = b1.ten and a1.ten = a2.ten);
Query Plan
========================================================================
|ID|OPERATOR                     |NAME           |EST.ROWS|EST.TIME(us)|
------------------------------------------------------------------------
|0 |INSERT                       |               |1       |123         |
|1 |└─SUBPLAN SCAN               |ANONYMOUS_VIEW1|1       |110         |
|2 |  └─SCALAR GROUP BY          |               |1       |110         |
|3 |    └─HASH JOIN              |               |100     |107         |
|4 |      ├─HASH JOIN            |               |100     |39          |
|5 |      │ ├─SUBPLAN SCAN       |VIEW1          |10      |20          |
|6 |      │ │ └─HASH GROUP BY    |               |10      |20          |
|7 |      │ │   └─TABLE FULL SCAN|a2             |100     |6           |
|8 |      │ └─TABLE FULL SCAN    |b1             |100     |4           |
|9 |      └─TABLE FULL SCAN      |a1             |100     |8           |
========================================================================
Outputs & filters:
-------------------------------------
  0 - output(nil), filter(nil)
      columns([{tmp: ({tmp: (tmp.__pk_increment, tmp.c1)})}]), partitions(p0), 
      column_values([T_HIDDEN_PK], [column_conv(INT,PS:(11,0),NULL,cast(ANONYMOUS_VIEW1.avg(a1.thousand), INT(-1, 0)))])
  1 - output([ANONYMOUS_VIEW1.avg(a1.thousand)]), filter(nil), rowset=256
      access([ANONYMOUS_VIEW1.avg(a1.thousand)])
  2 - output([cast(cast(T_FUN_SUM(a1.THOUSAND), DECIMAL_INT(64, 32)) / cast(T_FUN_COUNT(a1.THOUSAND), DECIMAL_INT(20, 0)), DECIMAL(14, 4))]), filter(nil), rowset=256
      group(nil), agg_func([T_FUN_SUM(a1.THOUSAND)], [T_FUN_COUNT(a1.THOUSAND)])
  3 - output([a1.THOUSAND]), filter(nil), rowset=256
      equal_conds([a1.TEN = b1.TEN]), other_conds([cast(a1.HUNDRED, DECIMAL(10, 0)) >= VIEW1.avg(a2.hundred)])
  4 - output([b1.TEN], [VIEW1.avg(a2.hundred)]), filter(nil), rowset=256
      equal_conds([VIEW1.a2.TEN = b1.TEN]), other_conds(nil)
  5 - output([VIEW1.avg(a2.hundred)], [VIEW1.a2.TEN]), filter(nil), rowset=256
      access([VIEW1.avg(a2.hundred)], [VIEW1.a2.TEN])
  6 - output([cast(cast(T_FUN_SUM(a2.HUNDRED), DECIMAL_INT(64, 32)) / cast(T_FUN_COUNT(a2.HUNDRED), DECIMAL_INT(20, 0)), DECIMAL(14, 4))], [a2.TEN]), filter(nil), rowset=256
      group([a2.TEN]), agg_func([T_FUN_SUM(a2.HUNDRED)], [T_FUN_COUNT(a2.HUNDRED)])
  7 - output([a2.TEN], [a2.HUNDRED]), filter(nil), rowset=256
      access([a2.TEN], [a2.HUNDRED]), partitions(p0)
      is_index_back=false, is_global_index=false, 
      range_key([a2.__pk_increment]), range(MIN ; MAX)always true
  8 - output([b1.TEN]), filter(nil), rowset=256
      access([b1.TEN]), partitions(p0)
      is_index_back=false, is_global_index=false, 
      range_key([b1.__pk_increment]), range(MIN ; MAX)always true
  9 - output([a1.TEN], [a1.HUNDRED], [a1.THOUSAND]), filter(nil), rowset=256
      access([a1.TEN], [a1.HUNDRED], [a1.THOUSAND]), partitions(p0)
      is_index_back=false, is_global_index=false, 
      range_key([a1.__pk_increment]), range(MIN ; MAX)always true
insert into tmp select avg(a1.thousand) from t2_100 a1, t1_100 b1 where a1.ten = b1.ten and a1.hundred >= (select avg(a2.hundred) from t2_100 a2 where a2.ten = b1.ten and a1.ten = a2.ten);
select/*no explain*/* from tmp;
+------+
| c1   |
+------+
|   75 |
+------+
rollback;

EXPLAIN select avg(a1.thousand), avg(b1.thousand) from t2_100 a1, t1_100 b1 where a1.ten = b1.ten and b1.unique1 > 0 and a1.hundred >= (select avg(a2.hundred) from t2_100 a2 where a2.ten = b1.ten and a1.ten = a2.ten);
Query Plan
==========================================================
|ID|OPERATOR                 |NAME |EST.ROWS|EST.TIME(us)|
----------------------------------------------------------
|0 |SCALAR GROUP BY          |     |1       |123         |
|1 |└─HASH JOIN              |     |100     |117         |
|2 |  ├─HASH JOIN            |     |100     |45          |
|3 |  │ ├─SUBPLAN SCAN       |VIEW1|10      |20          |
|4 |  │ │ └─HASH GROUP BY    |     |10      |20          |
|5 |  │ │   └─TABLE FULL SCAN|a2   |100     |6           |
|6 |  │ └─TABLE FULL SCAN    |b1   |100     |11          |
|7 |  └─TABLE FULL SCAN      |a1   |100     |8           |
==========================================================
Outputs & filters:
-------------------------------------
  0 - output([cast(cast(T_FUN_SUM(a1.THOUSAND), DECIMAL_INT(64, 32)) / cast(T_FUN_COUNT(a1.THOUSAND), DECIMAL_INT(20, 0)), DECIMAL(14, 4))], [cast(cast(T_FUN_SUM(b1.THOUSAND),
       DECIMAL_INT(64, 32)) / cast(T_FUN_COUNT(b1.THOUSAND), DECIMAL_INT(20, 0)), DECIMAL(14, 4))]), filter(nil), rowset=256
      group(nil), agg_func([T_FUN_SUM(a1.THOUSAND)], [T_FUN_COUNT(a1.THOUSAND)], [T_FUN_SUM(b1.THOUSAND)], [T_FUN_COUNT(b1.THOUSAND)])
  1 - output([a1.THOUSAND], [b1.THOUSAND]), filter(nil), rowset=256
      equal_conds([a1.TEN = b1.TEN]), other_conds([cast(a1.HUNDRED, DECIMAL(10, 0)) >= VIEW1.avg(a2.hundred)])
  2 - output([b1.THOUSAND], [b1.TEN], [VIEW1.avg(a2.hundred)]), filter(nil), rowset=256
      equal_conds([VIEW1.a2.TEN = b1.TEN]), other_conds(nil)
  3 - output([VIEW1.avg(a2.hundred)], [VIEW1.a2.TEN]), filter(nil), rowset=256
      access([VIEW1.avg(a2.hundred)], [VIEW1.a2.TEN])
  4 - output([cast(cast(T_FUN_SUM(a2.HUNDRED), DECIMAL_INT(64, 32)) / cast(T_FUN_COUNT(a2.HUNDRED), DECIMAL_INT(20, 0)), DECIMAL(14, 4))], [a2.TEN]), filter(nil), rowset=256
      group([a2.TEN]), agg_func([T_FUN_SUM(a2.HUNDRED)], [T_FUN_COUNT(a2.HUNDRED)])
  5 - output([a2.TEN], [a2.HUNDRED]), filter(nil), rowset=256
      access([a2.TEN], [a2.HUNDRED]), partitions(p0)
      is_index_back=false, is_global_index=false, 
      range_key([a2.__pk_increment]), range(MIN ; MAX)always true
  6 - output([b1.TEN], [b1.THOUSAND]), filter([b1.UNIQUE1 > cast(0, DECIMAL_INT(10, 0))]), rowset=256
      access([b1.TEN], [b1.UNIQUE1], [b1.THOUSAND]), partitions(p0)
      is_index_back=false, is_global_index=false, filter_before_indexback[false], 
      range_key([b1.__pk_increment]), range(MIN ; MAX)always true
  7 - output([a1.TEN], [a1.HUNDRED], [a1.THOUSAND]), filter(nil), rowset=256
      access([a1.TEN], [a1.HUNDRED], [a1.THOUSAND]), partitions(p0)
      is_index_back=false, is_global_index=false, 
      range_key([a1.__pk_increment]), range(MIN ; MAX)always true
select avg(a1.thousand), avg(b1.thousand) from t2_100 a1, t1_100 b1 where a1.ten = b1.ten and b1.unique1 > 0 and a1.hundred >= (select avg(a2.hundred) from t2_100 a2 where a2.ten = b1.ten and a1.ten = a2.ten);
+------------------+------------------+
| avg(a1.thousand) | avg(b1.thousand) |
+------------------+------------------+
|          74.5455 |          50.0000 |
+------------------+------------------+
EXPLAIN select /*+no_unnest(@qb1)*/ avg(a1.thousand), avg(b1.thousand) from t2_100 a1, t1_100 b1 where a1.ten = b1.ten and b1.unique1 > 0 and a1.hundred >= (select /*+qb_name(qb1)*/avg(a2.hundred) from t2_100 a2 where a2.ten = b1.ten and a1.ten = a2.ten);
Query Plan
================================================================
|ID|OPERATOR              |NAME          |EST.ROWS|EST.TIME(us)|
----------------------------------------------------------------
|0 |SCALAR GROUP BY       |              |1       |45205       |
|1 |└─SUBPLAN FILTER      |              |334     |45183       |
|2 |  ├─HASH JOIN         |              |1000    |90          |
|3 |  │ ├─TABLE FULL SCAN |a1            |100     |8           |
|4 |  │ └─TABLE FULL SCAN |b1            |100     |11          |
|5 |  └─SCALAR GROUP BY   |              |1       |46          |
|6 |    └─TABLE RANGE SCAN|a2(T2_100_TEN)|10      |45          |
================================================================
Outputs & filters:
-------------------------------------
  0 - output([cast(cast(T_FUN_SUM(a1.THOUSAND), DECIMAL_INT(64, 32)) / cast(T_FUN_COUNT(a1.THOUSAND), DECIMAL_INT(20, 0)), DECIMAL(14, 4))], [cast(cast(T_FUN_SUM(b1.THOUSAND),
       DECIMAL_INT(64, 32)) / cast(T_FUN_COUNT(b1.THOUSAND), DECIMAL_INT(20, 0)), DECIMAL(14, 4))]), filter(nil), rowset=256
      group(nil), agg_func([T_FUN_SUM(a1.THOUSAND)], [T_FUN_COUNT(a1.THOUSAND)], [T_FUN_SUM(b1.THOUSAND)], [T_FUN_COUNT(b1.THOUSAND)])
  1 - output([a1.THOUSAND], [b1.THOUSAND]), filter([cast(a1.HUNDRED, DECIMAL(10, 0)) >= subquery(1)]), rowset=256
      exec_params_([b1.TEN(:0)], [a1.TEN(:1)]), onetime_exprs_(nil), init_plan_idxs_(nil), use_batch=false
  2 - output([a1.THOUSAND], [b1.THOUSAND], [b1.TEN], [a1.TEN], [a1.HUNDRED]), filter(nil), rowset=256
      equal_conds([a1.TEN = b1.TEN]), other_conds(nil)
  3 - output([a1.TEN], [a1.HUNDRED], [a1.THOUSAND]), filter(nil), rowset=256
      access([a1.TEN], [a1.HUNDRED], [a1.THOUSAND]), partitions(p0)
      is_index_back=false, is_global_index=false, 
      range_key([a1.__pk_increment]), range(MIN ; MAX)always true
  4 - output([b1.TEN], [b1.THOUSAND]), filter([b1.UNIQUE1 > cast(0, DECIMAL_INT(10, 0))]), rowset=256
      access([b1.TEN], [b1.UNIQUE1], [b1.THOUSAND]), partitions(p0)
      is_index_back=false, is_global_index=false, filter_before_indexback[false], 
      range_key([b1.__pk_increment]), range(MIN ; MAX)always true
  5 - output([cast(cast(T_FUN_SUM(a2.HUNDRED), DECIMAL_INT(64, 32)) / cast(T_FUN_COUNT(a2.HUNDRED), DECIMAL_INT(20, 0)), DECIMAL(14, 4))]), filter(nil), rowset=256
      group(nil), agg_func([T_FUN_SUM(a2.HUNDRED)], [T_FUN_COUNT(a2.HUNDRED)])
  6 - output([a2.HUNDRED]), filter(nil), rowset=256
      access([a2.__pk_increment], [a2.HUNDRED]), partitions(p0)
      is_index_back=true, is_global_index=false, 
      range_key([a2.TEN], [a2.__pk_increment]), range(MIN,MIN ; MAX,MAX)always true, 
      range_cond([a2.TEN = :0], [:1 = a2.TEN])
select /*+no_unnest(@qb1)*/ avg(a1.thousand), avg(b1.thousand) from t2_100 a1, t1_100 b1 where a1.ten = b1.ten and b1.unique1 > 0 and a1.hundred >= (select /*+qb_name(qb1)*/avg(a2.hundred) from t2_100 a2 where a2.ten = b1.ten and a1.ten = a2.ten);
+------------------+------------------+
| avg(a1.thousand) | avg(b1.thousand) |
+------------------+------------------+
|          74.5455 |          50.0000 |
+------------------+------------------+

EXPLAIN update t2_100 a1, t1_100 b1 set a1.thousand = a1.unique1 where a1.ten = b1.ten and b1.unique1 > 0 and a1.hundred >= (select avg(a2.hundred) from t2_100 a2 where a2.ten = b1.ten and a1.ten = a2.ten);
Query Plan
==========================================================
|ID|OPERATOR                 |NAME |EST.ROWS|EST.TIME(us)|
----------------------------------------------------------
|0 |UPDATE                   |     |50      |709         |
|1 |└─HASH JOIN              |     |50      |307         |
|2 |  ├─SUBPLAN SCAN         |VIEW1|5       |283         |
|3 |  │ └─WINDOW FUNCTION    |     |100     |282         |
|4 |  │   └─PARTITION SORT   |     |100     |94          |
|5 |  │     └─TABLE FULL SCAN|a2   |100     |29          |
|6 |  └─TABLE FULL SCAN      |b1   |100     |9           |
==========================================================
Outputs & filters:
-------------------------------------
  0 - output(nil), filter(nil)
      table_columns([{VIEW1: ({t2_100: (VIEW1.a2.__pk_increment, VIEW1.a2.UNIQUE1, VIEW1.a2.UNIQUE2, VIEW1.a2.UNIQUE3, VIEW1.a2.TEN, VIEW1.a2.HUNDRED, VIEW1.a2.THOUSAND,
       VIEW1.a2.HUND_CLUST, VIEW1.a2.HUND_NULL, VIEW1.a2.CHAR_UNIQUE, VIEW1.a2.CHAR_HUND, VIEW1.a2.VCHAR_UNIQUE, VIEW1.a2.VCHAR_HUND, VIEW1.a2.DATE_UNIQUE, VIEW1.a2.DATE_HUND,
       VIEW1.a2.ALL_NULL, VIEW1.a2.NUMERIC)}), hash_distinct}]),
      update([VIEW1.a2.THOUSAND=column_conv(DECIMAL_INT,PS:(10,0),NULL,VIEW1.a2.UNIQUE1)])
  1 - output([VIEW1.a2.__pk_increment], [VIEW1.a2.UNIQUE1], [VIEW1.a2.UNIQUE2], [VIEW1.a2.UNIQUE3], [VIEW1.a2.TEN], [VIEW1.a2.HUNDRED], [VIEW1.a2.THOUSAND],
       [VIEW1.a2.HUND_CLUST], [VIEW1.a2.HUND_NULL], [VIEW1.a2.CHAR_UNIQUE], [VIEW1.a2.CHAR_HUND], [VIEW1.a2.VCHAR_UNIQUE], [VIEW1.a2.VCHAR_HUND], [VIEW1.a2.DATE_UNIQUE],
       [VIEW1.a2.DATE_HUND], [VIEW1.a2.ALL_NULL], [VIEW1.a2.NUMERIC]), filter(nil), rowset=256
      equal_conds([VIEW1.a2.TEN = b1.TEN]), other_conds(nil)
  2 - output([VIEW1.a2.TEN], [VIEW1.a2.__pk_increment], [VIEW1.a2.THOUSAND], [VIEW1.a2.UNIQUE1], [VIEW1.a2.UNIQUE2], [VIEW1.a2.UNIQUE3], [VIEW1.a2.HUNDRED],
       [VIEW1.a2.HUND_CLUST], [VIEW1.a2.HUND_NULL], [VIEW1.a2.CHAR_UNIQUE], [VIEW1.a2.CHAR_HUND], [VIEW1.a2.VCHAR_UNIQUE], [VIEW1.a2.VCHAR_HUND], [VIEW1.a2.DATE_UNIQUE],
       [VIEW1.a2.DATE_HUND], [VIEW1.a2.ALL_NULL], [VIEW1.a2.NUMERIC]), filter([cast(VIEW1.a2.HUNDRED, DECIMAL(10, 0)) >= VIEW1.avg(a2.hundred)]), rowset=256
      access([VIEW1.avg(a2.hundred)], [VIEW1.a2.TEN], [VIEW1.a2.__pk_increment], [VIEW1.a2.THOUSAND], [VIEW1.a2.UNIQUE1], [VIEW1.a2.UNIQUE2], [VIEW1.a2.UNIQUE3],
       [VIEW1.a2.HUNDRED], [VIEW1.a2.HUND_CLUST], [VIEW1.a2.HUND_NULL], [VIEW1.a2.CHAR_UNIQUE], [VIEW1.a2.CHAR_HUND], [VIEW1.a2.VCHAR_UNIQUE], [VIEW1.a2.VCHAR_HUND],
       [VIEW1.a2.DATE_UNIQUE], [VIEW1.a2.DATE_HUND], [VIEW1.a2.ALL_NULL], [VIEW1.a2.NUMERIC])
  3 - output([cast(cast(T_FUN_SUM(a2.HUNDRED), DECIMAL_INT(64, 32)) / cast(T_FUN_COUNT(a2.HUNDRED), DECIMAL_INT(20, 0)), DECIMAL(14, 4))], [a2.TEN], [a2.__pk_increment],
       [a2.THOUSAND], [a2.UNIQUE1], [a2.UNIQUE2], [a2.UNIQUE3], [a2.HUNDRED], [a2.HUND_CLUST], [a2.HUND_NULL], [a2.CHAR_UNIQUE], [a2.CHAR_HUND], [a2.VCHAR_UNIQUE],
       [a2.VCHAR_HUND], [a2.DATE_UNIQUE], [a2.DATE_HUND], [a2.ALL_NULL], [a2.NUMERIC]), filter(nil), rowset=256
      win_expr(T_FUN_SUM(a2.HUNDRED)), partition_by([a2.TEN]), order_by(nil), window_type(RANGE), upper(UNBOUNDED PRECEDING), lower(UNBOUNDED FOLLOWING)
      win_expr(T_FUN_COUNT(a2.HUNDRED)), partition_by([a2.TEN]), order_by(nil), window_type(RANGE), upper(UNBOUNDED PRECEDING), lower(UNBOUNDED FOLLOWING)
  4 - output([a2.HUNDRED], [a2.TEN], [a2.__pk_increment], [a2.THOUSAND], [a2.UNIQUE1], [a2.UNIQUE2], [a2.UNIQUE3], [a2.HUND_CLUST], [a2.HUND_NULL], [a2.CHAR_UNIQUE],
       [a2.CHAR_HUND], [a2.VCHAR_UNIQUE], [a2.VCHAR_HUND], [a2.DATE_UNIQUE], [a2.DATE_HUND], [a2.ALL_NULL], [a2.NUMERIC]), filter(nil), rowset=256
      sort_keys([HASH(a2.TEN), ASC], [a2.TEN, ASC])
  5 - output([a2.__pk_increment], [a2.TEN], [a2.HUNDRED], [a2.THOUSAND], [a2.UNIQUE1], [a2.UNIQUE2], [a2.UNIQUE3], [a2.HUND_CLUST], [a2.HUND_NULL], [a2.CHAR_UNIQUE],
       [a2.CHAR_HUND], [a2.VCHAR_UNIQUE], [a2.VCHAR_HUND], [a2.DATE_UNIQUE], [a2.DATE_HUND], [a2.ALL_NULL], [a2.NUMERIC]), filter([a2.TEN IS NOT NULL]), rowset=256
      access([a2.__pk_increment], [a2.TEN], [a2.HUNDRED], [a2.THOUSAND], [a2.UNIQUE1], [a2.UNIQUE2], [a2.UNIQUE3], [a2.HUND_CLUST], [a2.HUND_NULL], [a2.CHAR_UNIQUE],
       [a2.CHAR_HUND], [a2.VCHAR_UNIQUE], [a2.VCHAR_HUND], [a2.DATE_UNIQUE], [a2.DATE_HUND], [a2.ALL_NULL], [a2.NUMERIC]), partitions(p0)
      is_index_back=false, is_global_index=false, filter_before_indexback[false], 
      range_key([a2.__pk_increment]), range(MIN ; MAX)always true
  6 - output([b1.TEN]), filter([b1.UNIQUE1 > cast(0, DECIMAL_INT(10, 0))]), rowset=256
      access([b1.TEN], [b1.UNIQUE1]), partitions(p0)
      is_index_back=false, is_global_index=false, filter_before_indexback[false], 
      range_key([b1.__pk_increment]), range(MIN ; MAX)always true
update t2_100 a1, t1_100 b1 set a1.thousand = a1.unique1 where a1.ten = b1.ten and b1.unique1 > 0 and a1.hundred >= (select avg(a2.hundred) from t2_100 a2 where a2.ten = b1.ten and a1.ten = a2.ten);
select/*no explain*/sum(thousand), stddev(thousand) from t2_100;
+---------------+-------------------+
| sum(thousand) | stddev(thousand)  |
+---------------+-------------------+
|          4950 | 28.86607004772212 |
+---------------+-------------------+
rollback;
EXPLAIN insert into tmp select avg(a1.thousand) from t2_100 a1, t1_100 b1 where a1.ten = b1.ten and b1.unique1 > 0 and a1.hundred >= (select avg(a2.hundred) from t2_100 a2 where a2.ten = b1.ten and a1.ten = a2.ten);
Query Plan
========================================================================
|ID|OPERATOR                     |NAME           |EST.ROWS|EST.TIME(us)|
------------------------------------------------------------------------
|0 |INSERT                       |               |1       |128         |
|1 |└─SUBPLAN SCAN               |ANONYMOUS_VIEW1|1       |115         |
|2 |  └─SCALAR GROUP BY          |               |1       |115         |
|3 |    └─HASH JOIN              |               |100     |111         |
|4 |      ├─HASH JOIN            |               |100     |43          |
|5 |      │ ├─SUBPLAN SCAN       |VIEW1          |10      |20          |
|6 |      │ │ └─HASH GROUP BY    |               |10      |20          |
|7 |      │ │   └─TABLE FULL SCAN|a2             |100     |6           |
|8 |      │ └─TABLE FULL SCAN    |b1             |100     |9           |
|9 |      └─TABLE FULL SCAN      |a1             |100     |8           |
========================================================================
Outputs & filters:
-------------------------------------
  0 - output(nil), filter(nil)
      columns([{tmp: ({tmp: (tmp.__pk_increment, tmp.c1)})}]), partitions(p0), 
      column_values([T_HIDDEN_PK], [column_conv(INT,PS:(11,0),NULL,cast(ANONYMOUS_VIEW1.avg(a1.thousand), INT(-1, 0)))])
  1 - output([ANONYMOUS_VIEW1.avg(a1.thousand)]), filter(nil), rowset=256
      access([ANONYMOUS_VIEW1.avg(a1.thousand)])
  2 - output([cast(cast(T_FUN_SUM(a1.THOUSAND), DECIMAL_INT(64, 32)) / cast(T_FUN_COUNT(a1.THOUSAND), DECIMAL_INT(20, 0)), DECIMAL(14, 4))]), filter(nil), rowset=256
      group(nil), agg_func([T_FUN_SUM(a1.THOUSAND)], [T_FUN_COUNT(a1.THOUSAND)])
  3 - output([a1.THOUSAND]), filter(nil), rowset=256
      equal_conds([a1.TEN = b1.TEN]), other_conds([cast(a1.HUNDRED, DECIMAL(10, 0)) >= VIEW1.avg(a2.hundred)])
  4 - output([b1.TEN], [VIEW1.avg(a2.hundred)]), filter(nil), rowset=256
      equal_conds([VIEW1.a2.TEN = b1.TEN]), other_conds(nil)
  5 - output([VIEW1.avg(a2.hundred)], [VIEW1.a2.TEN]), filter(nil), rowset=256
      access([VIEW1.avg(a2.hundred)], [VIEW1.a2.TEN])
  6 - output([cast(cast(T_FUN_SUM(a2.HUNDRED), DECIMAL_INT(64, 32)) / cast(T_FUN_COUNT(a2.HUNDRED), DECIMAL_INT(20, 0)), DECIMAL(14, 4))], [a2.TEN]), filter(nil), rowset=256
      group([a2.TEN]), agg_func([T_FUN_SUM(a2.HUNDRED)], [T_FUN_COUNT(a2.HUNDRED)])
  7 - output([a2.TEN], [a2.HUNDRED]), filter(nil), rowset=256
      access([a2.TEN], [a2.HUNDRED]), partitions(p0)
      is_index_back=false, is_global_index=false, 
      range_key([a2.__pk_increment]), range(MIN ; MAX)always true
  8 - output([b1.TEN]), filter([b1.UNIQUE1 > cast(0, DECIMAL_INT(10, 0))]), rowset=256
      access([b1.TEN], [b1.UNIQUE1]), partitions(p0)
      is_index_back=false, is_global_index=false, filter_before_indexback[false], 
      range_key([b1.__pk_increment]), range(MIN ; MAX)always true
  9 - output([a1.TEN], [a1.HUNDRED], [a1.THOUSAND]), filter(nil), rowset=256
      access([a1.TEN], [a1.HUNDRED], [a1.THOUSAND]), partitions(p0)
      is_index_back=false, is_global_index=false, 
      range_key([a1.__pk_increment]), range(MIN ; MAX)always true
insert into tmp select avg(a1.thousand) from t2_100 a1, t1_100 b1 where a1.ten = b1.ten and b1.unique1 > 0 and a1.hundred >= (select avg(a2.hundred) from t2_100 a2 where a2.ten = b1.ten and a1.ten = a2.ten);
select/*no explain*/* from tmp;
+------+
| c1   |
+------+
|   75 |
+------+
rollback;

EXPLAIN select avg(a1.thousand), avg(b1.thousand) from t2_100 a1, t1_100 b1 where a1.ten = b1.ten and b1.unique1 > 0 and b1.unique1 >= a1.unique1 and a1.hundred >= (select avg(a2.hundred) from t2_100 a2 where a2.ten = b1.ten);
Query Plan
==========================================================
|ID|OPERATOR                 |NAME |EST.ROWS|EST.TIME(us)|
----------------------------------------------------------
|0 |SCALAR GROUP BY          |     |1       |130         |
|1 |└─HASH JOIN              |     |100     |123         |
|2 |  ├─HASH JOIN            |     |100     |45          |
|3 |  │ ├─SUBPLAN SCAN       |VIEW1|10      |20          |
|4 |  │ │ └─HASH GROUP BY    |     |10      |20          |
|5 |  │ │   └─TABLE FULL SCAN|a2   |100     |6           |
|6 |  │ └─TABLE FULL SCAN    |b1   |100     |11          |
|7 |  └─TABLE FULL SCAN      |a1   |100     |9           |
==========================================================
Outputs & filters:
-------------------------------------
  0 - output([cast(cast(T_FUN_SUM(a1.THOUSAND), DECIMAL_INT(64, 32)) / cast(T_FUN_COUNT(a1.THOUSAND), DECIMAL_INT(20, 0)), DECIMAL(14, 4))], [cast(cast(T_FUN_SUM(b1.THOUSAND),
       DECIMAL_INT(64, 32)) / cast(T_FUN_COUNT(b1.THOUSAND), DECIMAL_INT(20, 0)), DECIMAL(14, 4))]), filter(nil), rowset=256
      group(nil), agg_func([T_FUN_SUM(a1.THOUSAND)], [T_FUN_COUNT(a1.THOUSAND)], [T_FUN_SUM(b1.THOUSAND)], [T_FUN_COUNT(b1.THOUSAND)])
  1 - output([a1.THOUSAND], [b1.THOUSAND]), filter(nil), rowset=256
      equal_conds([a1.TEN = b1.TEN]), other_conds([cast(a1.HUNDRED, DECIMAL(10, 0)) >= VIEW1.avg(a2.hundred)], [b1.UNIQUE1 >= a1.UNIQUE1])
  2 - output([b1.THOUSAND], [b1.TEN], [VIEW1.avg(a2.hundred)], [b1.UNIQUE1]), filter(nil), rowset=256
      equal_conds([VIEW1.a2.TEN = b1.TEN]), other_conds(nil)
  3 - output([VIEW1.avg(a2.hundred)], [VIEW1.a2.TEN]), filter(nil), rowset=256
      access([VIEW1.avg(a2.hundred)], [VIEW1.a2.TEN])
  4 - output([cast(cast(T_FUN_SUM(a2.HUNDRED), DECIMAL_INT(64, 32)) / cast(T_FUN_COUNT(a2.HUNDRED), DECIMAL_INT(20, 0)), DECIMAL(14, 4))], [a2.TEN]), filter(nil), rowset=256
      group([a2.TEN]), agg_func([T_FUN_SUM(a2.HUNDRED)], [T_FUN_COUNT(a2.HUNDRED)])
  5 - output([a2.TEN], [a2.HUNDRED]), filter(nil), rowset=256
      access([a2.TEN], [a2.HUNDRED]), partitions(p0)
      is_index_back=false, is_global_index=false, 
      range_key([a2.__pk_increment]), range(MIN ; MAX)always true
  6 - output([b1.TEN], [b1.UNIQUE1], [b1.THOUSAND]), filter([b1.UNIQUE1 > cast(0, DECIMAL_INT(10, 0))]), rowset=256
      access([b1.TEN], [b1.UNIQUE1], [b1.THOUSAND]), partitions(p0)
      is_index_back=false, is_global_index=false, filter_before_indexback[false], 
      range_key([b1.__pk_increment]), range(MIN ; MAX)always true
  7 - output([a1.TEN], [a1.UNIQUE1], [a1.HUNDRED], [a1.THOUSAND]), filter(nil), rowset=256
      access([a1.TEN], [a1.UNIQUE1], [a1.HUNDRED], [a1.THOUSAND]), partitions(p0)
      is_index_back=false, is_global_index=false, 
      range_key([a1.__pk_increment]), range(MIN ; MAX)always true
select avg(a1.thousand), avg(b1.thousand) from t2_100 a1, t1_100 b1 where a1.ten = b1.ten and b1.unique1 > 0 and b1.unique1 >= a1.unique1 and a1.hundred >= (select avg(a2.hundred) from t2_100 a2 where a2.ten = b1.ten);
+------------------+------------------+
| avg(a1.thousand) | avg(b1.thousand) |
+------------------+------------------+
|          67.8333 |          81.1667 |
+------------------+------------------+
EXPLAIN select /*+no_unnest(@qb1)*/ avg(a1.thousand), avg(b1.thousand) from t2_100 a1, t1_100 b1 where a1.ten = b1.ten and b1.unique1 > 0 and b1.unique1 >= a1.unique1 and a1.hundred >= (select /*+qb_name(qb1)*/avg(a2.hundred) from t2_100 a2 where a2.ten = b1.ten);
Query Plan
================================================================
|ID|OPERATOR              |NAME          |EST.ROWS|EST.TIME(us)|
----------------------------------------------------------------
|0 |SCALAR GROUP BY       |              |1       |23104       |
|1 |└─SUBPLAN FILTER      |              |170     |23093       |
|2 |  ├─HASH JOIN         |              |511     |95          |
|3 |  │ ├─TABLE FULL SCAN |b1            |100     |11          |
|4 |  │ └─TABLE FULL SCAN |a1            |100     |9           |
|5 |  └─SCALAR GROUP BY   |              |1       |46          |
|6 |    └─TABLE RANGE SCAN|a2(T2_100_TEN)|10      |45          |
================================================================
Outputs & filters:
-------------------------------------
  0 - output([cast(cast(T_FUN_SUM(a1.THOUSAND), DECIMAL_INT(64, 32)) / cast(T_FUN_COUNT(a1.THOUSAND), DECIMAL_INT(20, 0)), DECIMAL(14, 4))], [cast(cast(T_FUN_SUM(b1.THOUSAND),
       DECIMAL_INT(64, 32)) / cast(T_FUN_COUNT(b1.THOUSAND), DECIMAL_INT(20, 0)), DECIMAL(14, 4))]), filter(nil), rowset=256
      group(nil), agg_func([T_FUN_SUM(a1.THOUSAND)], [T_FUN_COUNT(a1.THOUSAND)], [T_FUN_SUM(b1.THOUSAND)], [T_FUN_COUNT(b1.THOUSAND)])
  1 - output([a1.THOUSAND], [b1.THOUSAND]), filter([cast(a1.HUNDRED, DECIMAL(10, 0)) >= subquery(1)]), rowset=256
      exec_params_([b1.TEN(:0)]), onetime_exprs_(nil), init_plan_idxs_(nil), use_batch=false
  2 - output([a1.THOUSAND], [b1.THOUSAND], [b1.TEN], [a1.HUNDRED]), filter(nil), rowset=256
      equal_conds([a1.TEN = b1.TEN]), other_conds([b1.UNIQUE1 >= a1.UNIQUE1])
  3 - output([b1.TEN], [b1.UNIQUE1], [b1.THOUSAND]), filter([b1.UNIQUE1 > cast(0, DECIMAL_INT(10, 0))]), rowset=256
      access([b1.TEN], [b1.UNIQUE1], [b1.THOUSAND]), partitions(p0)
      is_index_back=false, is_global_index=false, filter_before_indexback[false], 
      range_key([b1.__pk_increment]), range(MIN ; MAX)always true
  4 - output([a1.TEN], [a1.UNIQUE1], [a1.HUNDRED], [a1.THOUSAND]), filter(nil), rowset=256
      access([a1.TEN], [a1.UNIQUE1], [a1.HUNDRED], [a1.THOUSAND]), partitions(p0)
      is_index_back=false, is_global_index=false, 
      range_key([a1.__pk_increment]), range(MIN ; MAX)always true
  5 - output([cast(cast(T_FUN_SUM(a2.HUNDRED), DECIMAL_INT(64, 32)) / cast(T_FUN_COUNT(a2.HUNDRED), DECIMAL_INT(20, 0)), DECIMAL(14, 4))]), filter(nil), rowset=256
      group(nil), agg_func([T_FUN_SUM(a2.HUNDRED)], [T_FUN_COUNT(a2.HUNDRED)])
  6 - output([a2.HUNDRED]), filter(nil), rowset=256
      access([a2.__pk_increment], [a2.HUNDRED]), partitions(p0)
      is_index_back=true, is_global_index=false, 
      range_key([a2.TEN], [a2.__pk_increment]), range(MIN,MIN ; MAX,MAX)always true, 
      range_cond([a2.TEN = :0])
select /*+no_unnest(@qb1)*/ avg(a1.thousand), avg(b1.thousand) from t2_100 a1, t1_100 b1 where a1.ten = b1.ten and b1.unique1 > 0 and b1.unique1 >= a1.unique1 and a1.hundred >= (select /*+qb_name(qb1)*/avg(a2.hundred) from t2_100 a2 where a2.ten = b1.ten);
+------------------+------------------+
| avg(a1.thousand) | avg(b1.thousand) |
+------------------+------------------+
|          67.8333 |          81.1667 |
+------------------+------------------+

EXPLAIN update t2_100 a1, t1_100 b1 set a1.thousand = a1.unique1 where a1.ten = b1.ten and b1.unique1 > 0 and b1.unique1 >= a1.unique1 and a1.hundred >= (select avg(a2.hundred) from t2_100 a2 where a2.ten = b1.ten);
Query Plan
==========================================================
|ID|OPERATOR                 |NAME |EST.ROWS|EST.TIME(us)|
----------------------------------------------------------
|0 |UPDATE                   |     |26      |524         |
|1 |└─HASH JOIN              |     |26      |307         |
|2 |  ├─SUBPLAN SCAN         |VIEW1|5       |283         |
|3 |  │ └─WINDOW FUNCTION    |     |100     |282         |
|4 |  │   └─PARTITION SORT   |     |100     |94          |
|5 |  │     └─TABLE FULL SCAN|a2   |100     |29          |
|6 |  └─TABLE FULL SCAN      |b1   |100     |9           |
==========================================================
Outputs & filters:
-------------------------------------
  0 - output(nil), filter(nil)
      table_columns([{VIEW1: ({t2_100: (VIEW1.a2.__pk_increment, VIEW1.a2.UNIQUE1, VIEW1.a2.UNIQUE2, VIEW1.a2.UNIQUE3, VIEW1.a2.TEN, VIEW1.a2.HUNDRED, VIEW1.a2.THOUSAND,
       VIEW1.a2.HUND_CLUST, VIEW1.a2.HUND_NULL, VIEW1.a2.CHAR_UNIQUE, VIEW1.a2.CHAR_HUND, VIEW1.a2.VCHAR_UNIQUE, VIEW1.a2.VCHAR_HUND, VIEW1.a2.DATE_UNIQUE, VIEW1.a2.DATE_HUND,
       VIEW1.a2.ALL_NULL, VIEW1.a2.NUMERIC)}), hash_distinct}]),
      update([VIEW1.a2.THOUSAND=column_conv(DECIMAL_INT,PS:(10,0),NULL,VIEW1.a2.UNIQUE1)])
  1 - output([VIEW1.a2.__pk_increment], [VIEW1.a2.UNIQUE1], [VIEW1.a2.UNIQUE2], [VIEW1.a2.UNIQUE3], [VIEW1.a2.TEN], [VIEW1.a2.HUNDRED], [VIEW1.a2.THOUSAND],
       [VIEW1.a2.HUND_CLUST], [VIEW1.a2.HUND_NULL], [VIEW1.a2.CHAR_UNIQUE], [VIEW1.a2.CHAR_HUND], [VIEW1.a2.VCHAR_UNIQUE], [VIEW1.a2.VCHAR_HUND], [VIEW1.a2.DATE_UNIQUE],
       [VIEW1.a2.DATE_HUND], [VIEW1.a2.ALL_NULL], [VIEW1.a2.NUMERIC]), filter(nil), rowset=256
      equal_conds([VIEW1.a2.TEN = b1.TEN]), other_conds([b1.UNIQUE1 >= VIEW1.a2.UNIQUE1])
  2 - output([VIEW1.a2.TEN], [VIEW1.a2.__pk_increment], [VIEW1.a2.THOUSAND], [VIEW1.a2.UNIQUE1], [VIEW1.a2.UNIQUE2], [VIEW1.a2.UNIQUE3], [VIEW1.a2.HUNDRED],
       [VIEW1.a2.HUND_CLUST], [VIEW1.a2.HUND_NULL], [VIEW1.a2.CHAR_UNIQUE], [VIEW1.a2.CHAR_HUND], [VIEW1.a2.VCHAR_UNIQUE], [VIEW1.a2.VCHAR_HUND], [VIEW1.a2.DATE_UNIQUE],
       [VIEW1.a2.DATE_HUND], [VIEW1.a2.ALL_NULL], [VIEW1.a2.NUMERIC]), filter([cast(VIEW1.a2.HUNDRED, DECIMAL(10, 0)) >= VIEW1.avg(a2.hundred)]), rowset=256
      access([VIEW1.avg(a2.hundred)], [VIEW1.a2.TEN], [VIEW1.a2.__pk_increment], [VIEW1.a2.THOUSAND], [VIEW1.a2.UNIQUE1], [VIEW1.a2.UNIQUE2], [VIEW1.a2.UNIQUE3],
       [VIEW1.a2.HUNDRED], [VIEW1.a2.HUND_CLUST], [VIEW1.a2.HUND_NULL], [VIEW1.a2.CHAR_UNIQUE], [VIEW1.a2.CHAR_HUND], [VIEW1.a2.VCHAR_UNIQUE], [VIEW1.a2.VCHAR_HUND],
       [VIEW1.a2.DATE_UNIQUE], [VIEW1.a2.DATE_HUND], [VIEW1.a2.ALL_NULL], [VIEW1.a2.NUMERIC])
  3 - output([cast(cast(T_FUN_SUM(a2.HUNDRED), DECIMAL_INT(64, 32)) / cast(T_FUN_COUNT(a2.HUNDRED), DECIMAL_INT(20, 0)), DECIMAL(14, 4))], [a2.TEN], [a2.__pk_increment],
       [a2.THOUSAND], [a2.UNIQUE1], [a2.UNIQUE2], [a2.UNIQUE3], [a2.HUNDRED], [a2.HUND_CLUST], [a2.HUND_NULL], [a2.CHAR_UNIQUE], [a2.CHAR_HUND], [a2.VCHAR_UNIQUE],
       [a2.VCHAR_HUND], [a2.DATE_UNIQUE], [a2.DATE_HUND], [a2.ALL_NULL], [a2.NUMERIC]), filter(nil), rowset=256
      win_expr(T_FUN_SUM(a2.HUNDRED)), partition_by([a2.TEN]), order_by(nil), window_type(RANGE), upper(UNBOUNDED PRECEDING), lower(UNBOUNDED FOLLOWING)
      win_expr(T_FUN_COUNT(a2.HUNDRED)), partition_by([a2.TEN]), order_by(nil), window_type(RANGE), upper(UNBOUNDED PRECEDING), lower(UNBOUNDED FOLLOWING)
  4 - output([a2.HUNDRED], [a2.TEN], [a2.__pk_increment], [a2.THOUSAND], [a2.UNIQUE1], [a2.UNIQUE2], [a2.UNIQUE3], [a2.HUND_CLUST], [a2.HUND_NULL], [a2.CHAR_UNIQUE],
       [a2.CHAR_HUND], [a2.VCHAR_UNIQUE], [a2.VCHAR_HUND], [a2.DATE_UNIQUE], [a2.DATE_HUND], [a2.ALL_NULL], [a2.NUMERIC]), filter(nil), rowset=256
      sort_keys([HASH(a2.TEN), ASC], [a2.TEN, ASC])
  5 - output([a2.__pk_increment], [a2.TEN], [a2.HUNDRED], [a2.THOUSAND], [a2.UNIQUE1], [a2.UNIQUE2], [a2.UNIQUE3], [a2.HUND_CLUST], [a2.HUND_NULL], [a2.CHAR_UNIQUE],
       [a2.CHAR_HUND], [a2.VCHAR_UNIQUE], [a2.VCHAR_HUND], [a2.DATE_UNIQUE], [a2.DATE_HUND], [a2.ALL_NULL], [a2.NUMERIC]), filter([a2.TEN IS NOT NULL]), rowset=256
      access([a2.__pk_increment], [a2.TEN], [a2.HUNDRED], [a2.THOUSAND], [a2.UNIQUE1], [a2.UNIQUE2], [a2.UNIQUE3], [a2.HUND_CLUST], [a2.HUND_NULL], [a2.CHAR_UNIQUE],
       [a2.CHAR_HUND], [a2.VCHAR_UNIQUE], [a2.VCHAR_HUND], [a2.DATE_UNIQUE], [a2.DATE_HUND], [a2.ALL_NULL], [a2.NUMERIC]), partitions(p0)
      is_index_back=false, is_global_index=false, filter_before_indexback[false], 
      range_key([a2.__pk_increment]), range(MIN ; MAX)always true
  6 - output([b1.TEN], [b1.UNIQUE1]), filter([b1.UNIQUE1 > cast(0, DECIMAL_INT(10, 0))]), rowset=256
      access([b1.TEN], [b1.UNIQUE1]), partitions(p0)
      is_index_back=false, is_global_index=false, filter_before_indexback[false], 
      range_key([b1.__pk_increment]), range(MIN ; MAX)always true
update t2_100 a1, t1_100 b1 set a1.thousand = a1.unique1 where a1.ten = b1.ten and b1.unique1 > 0 and b1.unique1 >= a1.unique1 and a1.hundred >= (select avg(a2.hundred) from t2_100 a2 where a2.ten = b1.ten);
select/*no explain*/sum(thousand), stddev(thousand) from t2_100;
+---------------+-------------------+
| sum(thousand) | stddev(thousand)  |
+---------------+-------------------+
|          4950 | 28.86607004772212 |
+---------------+-------------------+
rollback;
EXPLAIN insert into tmp select avg(a1.thousand) from t2_100 a1, t1_100 b1 where a1.ten = b1.ten and b1.unique1 > 0 and b1.unique1 >= a1.unique1 and a1.hundred >= (select avg(a2.hundred) from t2_100 a2 where a2.ten = b1.ten);
Query Plan
========================================================================
|ID|OPERATOR                     |NAME           |EST.ROWS|EST.TIME(us)|
------------------------------------------------------------------------
|0 |INSERT                       |               |1       |134         |
|1 |└─SUBPLAN SCAN               |ANONYMOUS_VIEW1|1       |121         |
|2 |  └─SCALAR GROUP BY          |               |1       |121         |
|3 |    └─HASH JOIN              |               |100     |118         |
|4 |      ├─HASH JOIN            |               |100     |43          |
|5 |      │ ├─SUBPLAN SCAN       |VIEW1          |10      |20          |
|6 |      │ │ └─HASH GROUP BY    |               |10      |20          |
|7 |      │ │   └─TABLE FULL SCAN|a2             |100     |6           |
|8 |      │ └─TABLE FULL SCAN    |b1             |100     |9           |
|9 |      └─TABLE FULL SCAN      |a1             |100     |9           |
========================================================================
Outputs & filters:
-------------------------------------
  0 - output(nil), filter(nil)
      columns([{tmp: ({tmp: (tmp.__pk_increment, tmp.c1)})}]), partitions(p0), 
      column_values([T_HIDDEN_PK], [column_conv(INT,PS:(11,0),NULL,cast(ANONYMOUS_VIEW1.avg(a1.thousand), INT(-1, 0)))])
  1 - output([ANONYMOUS_VIEW1.avg(a1.thousand)]), filter(nil), rowset=256
      access([ANONYMOUS_VIEW1.avg(a1.thousand)])
  2 - output([cast(cast(T_FUN_SUM(a1.THOUSAND), DECIMAL_INT(64, 32)) / cast(T_FUN_COUNT(a1.THOUSAND), DECIMAL_INT(20, 0)), DECIMAL(14, 4))]), filter(nil), rowset=256
      group(nil), agg_func([T_FUN_SUM(a1.THOUSAND)], [T_FUN_COUNT(a1.THOUSAND)])
  3 - output([a1.THOUSAND]), filter(nil), rowset=256
      equal_conds([a1.TEN = b1.TEN]), other_conds([cast(a1.HUNDRED, DECIMAL(10, 0)) >= VIEW1.avg(a2.hundred)], [b1.UNIQUE1 >= a1.UNIQUE1])
  4 - output([b1.TEN], [VIEW1.avg(a2.hundred)], [b1.UNIQUE1]), filter(nil), rowset=256
      equal_conds([VIEW1.a2.TEN = b1.TEN]), other_conds(nil)
  5 - output([VIEW1.avg(a2.hundred)], [VIEW1.a2.TEN]), filter(nil), rowset=256
      access([VIEW1.avg(a2.hundred)], [VIEW1.a2.TEN])
  6 - output([cast(cast(T_FUN_SUM(a2.HUNDRED), DECIMAL_INT(64, 32)) / cast(T_FUN_COUNT(a2.HUNDRED), DECIMAL_INT(20, 0)), DECIMAL(14, 4))], [a2.TEN]), filter(nil), rowset=256
      group([a2.TEN]), agg_func([T_FUN_SUM(a2.HUNDRED)], [T_FUN_COUNT(a2.HUNDRED)])
  7 - output([a2.TEN], [a2.HUNDRED]), filter(nil), rowset=256
      access([a2.TEN], [a2.HUNDRED]), partitions(p0)
      is_index_back=false, is_global_index=false, 
      range_key([a2.__pk_increment]), range(MIN ; MAX)always true
  8 - output([b1.TEN], [b1.UNIQUE1]), filter([b1.UNIQUE1 > cast(0, DECIMAL_INT(10, 0))]), rowset=256
      access([b1.TEN], [b1.UNIQUE1]), partitions(p0)
      is_index_back=false, is_global_index=false, filter_before_indexback[false], 
      range_key([b1.__pk_increment]), range(MIN ; MAX)always true
  9 - output([a1.TEN], [a1.UNIQUE1], [a1.HUNDRED], [a1.THOUSAND]), filter(nil), rowset=256
      access([a1.TEN], [a1.UNIQUE1], [a1.HUNDRED], [a1.THOUSAND]), partitions(p0)
      is_index_back=false, is_global_index=false, 
      range_key([a1.__pk_increment]), range(MIN ; MAX)always true
insert into tmp select avg(a1.thousand) from t2_100 a1, t1_100 b1 where a1.ten = b1.ten and b1.unique1 > 0 and b1.unique1 >= a1.unique1 and a1.hundred >= (select avg(a2.hundred) from t2_100 a2 where a2.ten = b1.ten);
select/*no explain*/* from tmp;
+------+
| c1   |
+------+
|   68 |
+------+
rollback;

EXPLAIN select avg(a1.thousand), avg(b1.thousand) from t2_100 a1, (select * from t1_100 order by unique1 limit 10) b1 where a1.ten = b1.ten and b1.unique1 > 0 and a1.hundred >= (select avg(a2.hundred) from t2_100 a2 where a2.ten = b1.ten);
Query Plan
===========================================================
|ID|OPERATOR                 |NAME  |EST.ROWS|EST.TIME(us)|
-----------------------------------------------------------
|0 |SCALAR GROUP BY          |      |1       |63          |
|1 |└─HASH JOIN              |      |16      |62          |
|2 |  ├─HASH JOIN            |      |16      |37          |
|3 |  │ ├─SUBPLAN SCAN       |VIEW1 |10      |20          |
|4 |  │ │ └─HASH GROUP BY    |      |10      |20          |
|5 |  │ │   └─TABLE FULL SCAN|a2    |100     |6           |
|6 |  │ └─SUBPLAN SCAN       |b1    |10      |14          |
|7 |  │   └─TOP-N SORT       |      |10      |14          |
|8 |  │     └─TABLE FULL SCAN|t1_100|100     |8           |
|9 |  └─TABLE FULL SCAN      |a1    |100     |8           |
===========================================================
Outputs & filters:
-------------------------------------
  0 - output([cast(cast(T_FUN_SUM(a1.THOUSAND), DECIMAL_INT(64, 32)) / cast(T_FUN_COUNT(a1.THOUSAND), DECIMAL_INT(20, 0)), DECIMAL(14, 4))], [cast(cast(T_FUN_SUM(b1.THOUSAND),
       DECIMAL_INT(64, 32)) / cast(T_FUN_COUNT(b1.THOUSAND), DECIMAL_INT(20, 0)), DECIMAL(14, 4))]), filter(nil), rowset=256
      group(nil), agg_func([T_FUN_SUM(a1.THOUSAND)], [T_FUN_COUNT(a1.THOUSAND)], [T_FUN_SUM(b1.THOUSAND)], [T_FUN_COUNT(b1.THOUSAND)])
  1 - output([a1.THOUSAND], [b1.THOUSAND]), filter(nil), rowset=256
      equal_conds([a1.TEN = b1.TEN]), other_conds([cast(a1.HUNDRED, DECIMAL(10, 0)) >= VIEW1.avg(a2.hundred)])
  2 - output([b1.THOUSAND], [b1.TEN], [VIEW1.avg(a2.hundred)]), filter(nil), rowset=256
      equal_conds([VIEW1.a2.TEN = b1.TEN]), other_conds(nil)
  3 - output([VIEW1.avg(a2.hundred)], [VIEW1.a2.TEN]), filter(nil), rowset=256
      access([VIEW1.avg(a2.hundred)], [VIEW1.a2.TEN])
  4 - output([cast(cast(T_FUN_SUM(a2.HUNDRED), DECIMAL_INT(64, 32)) / cast(T_FUN_COUNT(a2.HUNDRED), DECIMAL_INT(20, 0)), DECIMAL(14, 4))], [a2.TEN]), filter(nil), rowset=256
      group([a2.TEN]), agg_func([T_FUN_SUM(a2.HUNDRED)], [T_FUN_COUNT(a2.HUNDRED)])
  5 - output([a2.TEN], [a2.HUNDRED]), filter(nil), rowset=256
      access([a2.TEN], [a2.HUNDRED]), partitions(p0)
      is_index_back=false, is_global_index=false, 
      range_key([a2.__pk_increment]), range(MIN ; MAX)always true
  6 - output([b1.TEN], [b1.THOUSAND]), filter([b1.UNIQUE1 > cast(0, DECIMAL_INT(10, 0))]), rowset=256
      access([b1.UNIQUE1], [b1.TEN], [b1.THOUSAND])
  7 - output([t1_100.UNIQUE1], [t1_100.TEN], [t1_100.THOUSAND]), filter(nil), rowset=256
      sort_keys([t1_100.UNIQUE1, ASC]), topn(10)
  8 - output([t1_100.UNIQUE1], [t1_100.TEN], [t1_100.THOUSAND]), filter(nil), rowset=256
      access([t1_100.UNIQUE1], [t1_100.TEN], [t1_100.THOUSAND]), partitions(p0)
      is_index_back=false, is_global_index=false, 
      range_key([t1_100.__pk_increment]), range(MIN ; MAX)always true
  9 - output([a1.TEN], [a1.HUNDRED], [a1.THOUSAND]), filter(nil), rowset=256
      access([a1.TEN], [a1.HUNDRED], [a1.THOUSAND]), partitions(p0)
      is_index_back=false, is_global_index=false, 
      range_key([a1.__pk_increment]), range(MIN ; MAX)always true
select avg(a1.thousand), avg(b1.thousand) from t2_100 a1, (select * from t1_100 order by unique1 limit 10) b1 where a1.ten = b1.ten and b1.unique1 > 0 and a1.hundred >= (select avg(a2.hundred) from t2_100 a2 where a2.ten = b1.ten);
+------------------+------------------+
| avg(a1.thousand) | avg(b1.thousand) |
+------------------+------------------+
|          75.0000 |           5.0000 |
+------------------+------------------+
EXPLAIN select /*+no_unnest(@qb1)*/ avg(a1.thousand), avg(b1.thousand) from t2_100 a1, (select /*+qb_name(qb1)*/* from t1_100 order by unique1 limit 10) b1 where a1.ten = b1.ten and b1.unique1 > 0 and a1.hundred >= (select /*+no_unnest*/avg(a2.hundred) from t2_100 a2 where a2.ten = b1.ten);
Query Plan
===================================================================
|ID|OPERATOR                 |NAME          |EST.ROWS|EST.TIME(us)|
-------------------------------------------------------------------
|0 |SCALAR GROUP BY          |              |1       |4548        |
|1 |└─SUBPLAN FILTER         |              |34      |4546        |
|2 |  ├─HASH JOIN            |              |100     |36          |
|3 |  │ ├─SUBPLAN SCAN       |b1            |10      |14          |
|4 |  │ │ └─TOP-N SORT       |              |10      |14          |
|5 |  │ │   └─TABLE FULL SCAN|t1_100        |100     |8           |
|6 |  │ └─TABLE FULL SCAN    |a1            |100     |8           |
|7 |  └─SCALAR GROUP BY      |              |1       |46          |
|8 |    └─TABLE RANGE SCAN   |a2(T2_100_TEN)|10      |45          |
===================================================================
Outputs & filters:
-------------------------------------
  0 - output([cast(cast(T_FUN_SUM(a1.THOUSAND), DECIMAL_INT(64, 32)) / cast(T_FUN_COUNT(a1.THOUSAND), DECIMAL_INT(20, 0)), DECIMAL(14, 4))], [cast(cast(T_FUN_SUM(b1.THOUSAND),
       DECIMAL_INT(64, 32)) / cast(T_FUN_COUNT(b1.THOUSAND), DECIMAL_INT(20, 0)), DECIMAL(14, 4))]), filter(nil), rowset=256
      group(nil), agg_func([T_FUN_SUM(a1.THOUSAND)], [T_FUN_COUNT(a1.THOUSAND)], [T_FUN_SUM(b1.THOUSAND)], [T_FUN_COUNT(b1.THOUSAND)])
  1 - output([a1.THOUSAND], [b1.THOUSAND]), filter([cast(a1.HUNDRED, DECIMAL(10, 0)) >= subquery(1)]), rowset=256
      exec_params_([b1.TEN(:0)]), onetime_exprs_(nil), init_plan_idxs_(nil), use_batch=false
  2 - output([a1.THOUSAND], [b1.THOUSAND], [b1.TEN], [a1.HUNDRED]), filter(nil), rowset=256
      equal_conds([a1.TEN = b1.TEN]), other_conds(nil)
  3 - output([b1.TEN], [b1.THOUSAND]), filter([b1.UNIQUE1 > cast(0, DECIMAL_INT(10, 0))]), rowset=256
      access([b1.UNIQUE1], [b1.TEN], [b1.THOUSAND])
  4 - output([t1_100.UNIQUE1], [t1_100.TEN], [t1_100.THOUSAND]), filter(nil), rowset=256
      sort_keys([t1_100.UNIQUE1, ASC]), topn(10)
  5 - output([t1_100.UNIQUE1], [t1_100.TEN], [t1_100.THOUSAND]), filter(nil), rowset=256
      access([t1_100.UNIQUE1], [t1_100.TEN], [t1_100.THOUSAND]), partitions(p0)
      is_index_back=false, is_global_index=false, 
      range_key([t1_100.__pk_increment]), range(MIN ; MAX)always true
  6 - output([a1.TEN], [a1.HUNDRED], [a1.THOUSAND]), filter(nil), rowset=256
      access([a1.TEN], [a1.HUNDRED], [a1.THOUSAND]), partitions(p0)
      is_index_back=false, is_global_index=false, 
      range_key([a1.__pk_increment]), range(MIN ; MAX)always true
  7 - output([cast(cast(T_FUN_SUM(a2.HUNDRED), DECIMAL_INT(64, 32)) / cast(T_FUN_COUNT(a2.HUNDRED), DECIMAL_INT(20, 0)), DECIMAL(14, 4))]), filter(nil), rowset=256
      group(nil), agg_func([T_FUN_SUM(a2.HUNDRED)], [T_FUN_COUNT(a2.HUNDRED)])
  8 - output([a2.HUNDRED]), filter(nil), rowset=256
      access([a2.__pk_increment], [a2.HUNDRED]), partitions(p0)
      is_index_back=true, is_global_index=false, 
      range_key([a2.TEN], [a2.__pk_increment]), range(MIN,MIN ; MAX,MAX)always true, 
      range_cond([a2.TEN = :0])
select /*+no_unnest(@qb1)*/ avg(a1.thousand), avg(b1.thousand) from t2_100 a1, (select /*+qb_name(qb1)*/* from t1_100 order by unique1 limit 10) b1 where a1.ten = b1.ten and b1.unique1 > 0 and a1.hundred >= (select /*+no_unnest*/avg(a2.hundred) from t2_100 a2 where a2.ten = b1.ten);
+------------------+------------------+
| avg(a1.thousand) | avg(b1.thousand) |
+------------------+------------------+
|          75.0000 |           5.0000 |
+------------------+------------------+

EXPLAIN update t2_100 a1, (select * from t1_100 order by unique1 limit 10) b1 set a1.thousand = a1.unique1 where a1.ten = b1.ten and b1.unique1 > 0 and a1.hundred >= (select avg(a2.hundred) from t2_100 a2 where a2.ten = b1.ten);
Query Plan
===========================================================
|ID|OPERATOR                 |NAME  |EST.ROWS|EST.TIME(us)|
-----------------------------------------------------------
|0 |UPDATE                   |      |16      |217         |
|1 |└─HASH JOIN              |      |16      |77          |
|2 |  ├─HASH JOIN            |      |16      |35          |
|3 |  │ ├─SUBPLAN SCAN       |b1    |10      |12          |
|4 |  │ │ └─TOP-N SORT       |      |10      |12          |
|5 |  │ │   └─TABLE FULL SCAN|t1_100|100     |6           |
|6 |  │ └─SUBPLAN SCAN       |VIEW1 |10      |20          |
|7 |  │   └─HASH GROUP BY    |      |10      |20          |
|8 |  │     └─TABLE FULL SCAN|a2    |100     |6           |
|9 |  └─TABLE FULL SCAN      |a1    |100     |26          |
===========================================================
Outputs & filters:
-------------------------------------
  0 - output(nil), filter(nil)
      table_columns([{a1: ({t2_100: (a1.__pk_increment, a1.UNIQUE1, a1.UNIQUE2, a1.UNIQUE3, a1.TEN, a1.HUNDRED, a1.THOUSAND, a1.HUND_CLUST, a1.HUND_NULL,
       a1.CHAR_UNIQUE, a1.CHAR_HUND, a1.VCHAR_UNIQUE, a1.VCHAR_HUND, a1.DATE_UNIQUE, a1.DATE_HUND, a1.ALL_NULL, a1.NUMERIC)}), hash_distinct}]),
      update([a1.THOUSAND=column_conv(DECIMAL_INT,PS:(10,0),NULL,a1.UNIQUE1)])
  1 - output([a1.__pk_increment], [a1.UNIQUE1], [a1.UNIQUE2], [a1.UNIQUE3], [a1.TEN], [a1.HUNDRED], [a1.THOUSAND], [a1.HUND_CLUST], [a1.HUND_NULL], [a1.CHAR_UNIQUE],
       [a1.CHAR_HUND], [a1.VCHAR_UNIQUE], [a1.VCHAR_HUND], [a1.DATE_UNIQUE], [a1.DATE_HUND], [a1.ALL_NULL], [a1.NUMERIC]), filter(nil), rowset=256
      equal_conds([a1.TEN = b1.TEN]), other_conds([cast(a1.HUNDRED, DECIMAL(10, 0)) >= VIEW1.avg(a2.hundred)])
  2 - output([b1.TEN], [VIEW1.avg(a2.hundred)]), filter(nil), rowset=256
      equal_conds([VIEW1.a2.TEN = b1.TEN]), other_conds(nil)
  3 - output([b1.TEN]), filter([b1.UNIQUE1 > cast(0, DECIMAL_INT(10, 0))]), rowset=256
      access([b1.UNIQUE1], [b1.TEN])
  4 - output([t1_100.UNIQUE1], [t1_100.TEN]), filter(nil), rowset=256
      sort_keys([t1_100.UNIQUE1, ASC]), topn(10)
  5 - output([t1_100.UNIQUE1], [t1_100.TEN]), filter(nil), rowset=256
      access([t1_100.UNIQUE1], [t1_100.TEN]), partitions(p0)
      is_index_back=false, is_global_index=false, 
      range_key([t1_100.__pk_increment]), range(MIN ; MAX)always true
  6 - output([VIEW1.avg(a2.hundred)], [VIEW1.a2.TEN]), filter(nil), rowset=256
      access([VIEW1.avg(a2.hundred)], [VIEW1.a2.TEN])
  7 - output([cast(cast(T_FUN_SUM(a2.HUNDRED), DECIMAL_INT(64, 32)) / cast(T_FUN_COUNT(a2.HUNDRED), DECIMAL_INT(20, 0)), DECIMAL(14, 4))], [a2.TEN]), filter(nil), rowset=256
      group([a2.TEN]), agg_func([T_FUN_SUM(a2.HUNDRED)], [T_FUN_COUNT(a2.HUNDRED)])
  8 - output([a2.TEN], [a2.HUNDRED]), filter(nil), rowset=256
      access([a2.TEN], [a2.HUNDRED]), partitions(p0)
      is_index_back=false, is_global_index=false, 
      range_key([a2.__pk_increment]), range(MIN ; MAX)always true
  9 - output([a1.__pk_increment], [a1.THOUSAND], [a1.UNIQUE1], [a1.UNIQUE2], [a1.UNIQUE3], [a1.TEN], [a1.HUNDRED], [a1.HUND_CLUST], [a1.HUND_NULL], [a1.CHAR_UNIQUE],
       [a1.CHAR_HUND], [a1.VCHAR_UNIQUE], [a1.VCHAR_HUND], [a1.DATE_UNIQUE], [a1.DATE_HUND], [a1.ALL_NULL], [a1.NUMERIC]), filter(nil), rowset=256
      access([a1.__pk_increment], [a1.THOUSAND], [a1.UNIQUE1], [a1.UNIQUE2], [a1.UNIQUE3], [a1.TEN], [a1.HUNDRED], [a1.HUND_CLUST], [a1.HUND_NULL], [a1.CHAR_UNIQUE],
       [a1.CHAR_HUND], [a1.VCHAR_UNIQUE], [a1.VCHAR_HUND], [a1.DATE_UNIQUE], [a1.DATE_HUND], [a1.ALL_NULL], [a1.NUMERIC]), partitions(p0)
      is_index_back=false, is_global_index=false, 
      range_key([a1.__pk_increment]), range(MIN ; MAX)always true
update t2_100 a1, (select * from t1_100 order by unique1 limit 10) b1 set a1.thousand = a1.unique1 where a1.ten = b1.ten and b1.unique1 > 0 and a1.hundred >= (select avg(a2.hundred) from t2_100 a2 where a2.ten = b1.ten);
select/*no explain*/sum(thousand), stddev(thousand) from t2_100;
+---------------+-------------------+
| sum(thousand) | stddev(thousand)  |
+---------------+-------------------+
|          4950 | 28.86607004772212 |
+---------------+-------------------+
rollback;
EXPLAIN insert into tmp select avg(a1.thousand) from t2_100 a1, (select * from t1_100 order by unique1 limit 10) b1 where a1.ten = b1.ten and b1.unique1 > 0 and a1.hundred >= (select avg(a2.hundred) from t2_100 a2 where a2.ten = b1.ten);
Query Plan
========================================================================
|ID|OPERATOR                     |NAME           |EST.ROWS|EST.TIME(us)|
------------------------------------------------------------------------
|0 |INSERT                       |               |1       |72          |
|1 |└─SUBPLAN SCAN               |ANONYMOUS_VIEW1|1       |59          |
|2 |  └─SCALAR GROUP BY          |               |1       |59          |
|3 |    └─HASH JOIN              |               |16      |59          |
|4 |      ├─HASH JOIN            |               |16      |35          |
|5 |      │ ├─SUBPLAN SCAN       |b1             |10      |12          |
|6 |      │ │ └─TOP-N SORT       |               |10      |12          |
|7 |      │ │   └─TABLE FULL SCAN|t1_100         |100     |6           |
|8 |      │ └─SUBPLAN SCAN       |VIEW1          |10      |20          |
|9 |      │   └─HASH GROUP BY    |               |10      |20          |
|10|      │     └─TABLE FULL SCAN|a2             |100     |6           |
|11|      └─TABLE FULL SCAN      |a1             |100     |8           |
========================================================================
Outputs & filters:
-------------------------------------
  0 - output(nil), filter(nil)
      columns([{tmp: ({tmp: (tmp.__pk_increment, tmp.c1)})}]), partitions(p0), 
      column_values([T_HIDDEN_PK], [column_conv(INT,PS:(11,0),NULL,cast(ANONYMOUS_VIEW1.avg(a1.thousand), INT(-1, 0)))])
  1 - output([ANONYMOUS_VIEW1.avg(a1.thousand)]), filter(nil), rowset=256
      access([ANONYMOUS_VIEW1.avg(a1.thousand)])
  2 - output([cast(cast(T_FUN_SUM(a1.THOUSAND), DECIMAL_INT(64, 32)) / cast(T_FUN_COUNT(a1.THOUSAND), DECIMAL_INT(20, 0)), DECIMAL(14, 4))]), filter(nil), rowset=256
      group(nil), agg_func([T_FUN_SUM(a1.THOUSAND)], [T_FUN_COUNT(a1.THOUSAND)])
  3 - output([a1.THOUSAND]), filter(nil), rowset=256
      equal_conds([a1.TEN = b1.TEN]), other_conds([cast(a1.HUNDRED, DECIMAL(10, 0)) >= VIEW1.avg(a2.hundred)])
  4 - output([b1.TEN], [VIEW1.avg(a2.hundred)]), filter(nil), rowset=256
      equal_conds([VIEW1.a2.TEN = b1.TEN]), other_conds(nil)
  5 - output([b1.TEN]), filter([b1.UNIQUE1 > cast(0, DECIMAL_INT(10, 0))]), rowset=256
      access([b1.UNIQUE1], [b1.TEN])
  6 - output([t1_100.UNIQUE1], [t1_100.TEN]), filter(nil), rowset=256
      sort_keys([t1_100.UNIQUE1, ASC]), topn(10)
  7 - output([t1_100.UNIQUE1], [t1_100.TEN]), filter(nil), rowset=256
      access([t1_100.UNIQUE1], [t1_100.TEN]), partitions(p0)
      is_index_back=false, is_global_index=false, 
      range_key([t1_100.__pk_increment]), range(MIN ; MAX)always true
  8 - output([VIEW1.avg(a2.hundred)], [VIEW1.a2.TEN]), filter(nil), rowset=256
      access([VIEW1.avg(a2.hundred)], [VIEW1.a2.TEN])
  9 - output([cast(cast(T_FUN_SUM(a2.HUNDRED), DECIMAL_INT(64, 32)) / cast(T_FUN_COUNT(a2.HUNDRED), DECIMAL_INT(20, 0)), DECIMAL(14, 4))], [a2.TEN]), filter(nil), rowset=256
      group([a2.TEN]), agg_func([T_FUN_SUM(a2.HUNDRED)], [T_FUN_COUNT(a2.HUNDRED)])
 10 - output([a2.TEN], [a2.HUNDRED]), filter(nil), rowset=256
      access([a2.TEN], [a2.HUNDRED]), partitions(p0)
      is_index_back=false, is_global_index=false, 
      range_key([a2.__pk_increment]), range(MIN ; MAX)always true
 11 - output([a1.TEN], [a1.HUNDRED], [a1.THOUSAND]), filter(nil), rowset=256
      access([a1.TEN], [a1.HUNDRED], [a1.THOUSAND]), partitions(p0)
      is_index_back=false, is_global_index=false, 
      range_key([a1.__pk_increment]), range(MIN ; MAX)always true
insert into tmp select avg(a1.thousand) from t2_100 a1, (select * from t1_100 order by unique1 limit 10) b1 where a1.ten = b1.ten and b1.unique1 > 0 and a1.hundred >= (select avg(a2.hundred) from t2_100 a2 where a2.ten = b1.ten);
select/*no explain*/* from tmp;
+------+
| c1   |
+------+
|   75 |
+------+
rollback;

EXPLAIN select avg(a1.thousand), avg(b1.thousand) from t2_100 a1, t1_100 b1 where a1.ten = b1.ten and a1.hundred >= (select avg(a2.hundred) from t2_100 a2 where a2.ten = b1.ten) and exists (select 1 from t2_1 c1 where c1.unique1 = b1.unique1);
Query Plan
=====================================================================
|ID|OPERATOR                 |NAME            |EST.ROWS|EST.TIME(us)|
---------------------------------------------------------------------
|0 |SCALAR GROUP BY          |                |1       |56          |
|1 |└─HASH JOIN              |                |1       |56          |
|2 |  ├─HASH JOIN            |                |1       |39          |
|3 |  │ ├─HASH JOIN          |                |1       |19          |
|4 |  │ │ ├─TABLE FULL SCAN  |c1(T2_1_UNIQUE1)|1       |3           |
|5 |  │ │ └─TABLE FULL SCAN  |b1              |100     |8           |
|6 |  │ └─SUBPLAN SCAN       |VIEW2           |10      |20          |
|7 |  │   └─HASH GROUP BY    |                |10      |20          |
|8 |  │     └─TABLE FULL SCAN|a2              |100     |6           |
|9 |  └─TABLE FULL SCAN      |a1              |100     |8           |
=====================================================================
Outputs & filters:
-------------------------------------
  0 - output([cast(cast(T_FUN_SUM(a1.THOUSAND), DECIMAL_INT(64, 32)) / cast(T_FUN_COUNT(a1.THOUSAND), DECIMAL_INT(20, 0)), DECIMAL(14, 4))], [cast(cast(T_FUN_SUM(b1.THOUSAND),
       DECIMAL_INT(64, 32)) / cast(T_FUN_COUNT(b1.THOUSAND), DECIMAL_INT(20, 0)), DECIMAL(14, 4))]), filter(nil), rowset=256
      group(nil), agg_func([T_FUN_SUM(a1.THOUSAND)], [T_FUN_COUNT(a1.THOUSAND)], [T_FUN_SUM(b1.THOUSAND)], [T_FUN_COUNT(b1.THOUSAND)])
  1 - output([a1.THOUSAND], [b1.THOUSAND]), filter(nil), rowset=256
      equal_conds([a1.TEN = b1.TEN]), other_conds([cast(a1.HUNDRED, DECIMAL(10, 0)) >= VIEW2.avg(a2.hundred)])
  2 - output([b1.THOUSAND], [b1.TEN], [VIEW2.avg(a2.hundred)]), filter(nil), rowset=256
      equal_conds([VIEW2.a2.TEN = b1.TEN]), other_conds(nil)
  3 - output([b1.THOUSAND], [b1.TEN]), filter(nil), rowset=256
      equal_conds([c1.UNIQUE1 = b1.UNIQUE1]), other_conds(nil)
  4 - output([c1.UNIQUE1]), filter(nil), rowset=256
      access([c1.UNIQUE1]), partitions(p0)
      is_index_back=false, is_global_index=false, 
      range_key([c1.UNIQUE1], [c1.shadow_pk_0]), range(MIN,MIN ; MAX,MAX)always true
  5 - output([b1.TEN], [b1.UNIQUE1], [b1.THOUSAND]), filter(nil), rowset=256
      access([b1.TEN], [b1.UNIQUE1], [b1.THOUSAND]), partitions(p0)
      is_index_back=false, is_global_index=false, 
      range_key([b1.__pk_increment]), range(MIN ; MAX)always true
  6 - output([VIEW2.avg(a2.hundred)], [VIEW2.a2.TEN]), filter(nil), rowset=256
      access([VIEW2.avg(a2.hundred)], [VIEW2.a2.TEN])
  7 - output([cast(cast(T_FUN_SUM(a2.HUNDRED), DECIMAL_INT(64, 32)) / cast(T_FUN_COUNT(a2.HUNDRED), DECIMAL_INT(20, 0)), DECIMAL(14, 4))], [a2.TEN]), filter(nil), rowset=256
      group([a2.TEN]), agg_func([T_FUN_SUM(a2.HUNDRED)], [T_FUN_COUNT(a2.HUNDRED)])
  8 - output([a2.TEN], [a2.HUNDRED]), filter(nil), rowset=256
      access([a2.TEN], [a2.HUNDRED]), partitions(p0)
      is_index_back=false, is_global_index=false, 
      range_key([a2.__pk_increment]), range(MIN ; MAX)always true
  9 - output([a1.TEN], [a1.HUNDRED], [a1.THOUSAND]), filter(nil), rowset=256
      access([a1.TEN], [a1.HUNDRED], [a1.THOUSAND]), partitions(p0)
      is_index_back=false, is_global_index=false, 
      range_key([a1.__pk_increment]), range(MIN ; MAX)always true
select avg(a1.thousand), avg(b1.thousand) from t2_100 a1, t1_100 b1 where a1.ten = b1.ten and a1.hundred >= (select avg(a2.hundred) from t2_100 a2 where a2.ten = b1.ten) and exists (select 1 from t2_1 c1 where c1.unique1 = b1.unique1);
+------------------+------------------+
| avg(a1.thousand) | avg(b1.thousand) |
+------------------+------------------+
|             NULL |             NULL |
+------------------+------------------+
EXPLAIN select avg(a1.thousand), avg(b1.thousand) from t2_100 a1, t1_100 b1 where a1.ten = b1.ten and a1.hundred >= (select /*+no_unnest*/avg(a2.hundred) from t2_100 a2 where a2.ten = b1.ten) and exists (select /*+no_unnest*/1 from t2_1 c1 where c1.unique1 = b1.unique1);
Query Plan
==================================================================
|ID|OPERATOR              |NAME            |EST.ROWS|EST.TIME(us)|
------------------------------------------------------------------
|0 |SCALAR GROUP BY       |                |1       |63118       |
|1 |└─SUBPLAN FILTER      |                |236     |63103       |
|2 |  ├─HASH JOIN         |                |1000    |87          |
|3 |  │ ├─TABLE FULL SCAN |a1              |100     |8           |
|4 |  │ └─TABLE FULL SCAN |b1              |100     |8           |
|5 |  ├─SCALAR GROUP BY   |                |1       |46          |
|6 |  │ └─TABLE RANGE SCAN|a2(T2_100_TEN)  |10      |45          |
|7 |  └─TABLE GET         |c1(T2_1_UNIQUE1)|1       |18          |
==================================================================
Outputs & filters:
-------------------------------------
  0 - output([cast(cast(T_FUN_SUM(a1.THOUSAND), DECIMAL_INT(64, 32)) / cast(T_FUN_COUNT(a1.THOUSAND), DECIMAL_INT(20, 0)), DECIMAL(14, 4))], [cast(cast(T_FUN_SUM(b1.THOUSAND),
       DECIMAL_INT(64, 32)) / cast(T_FUN_COUNT(b1.THOUSAND), DECIMAL_INT(20, 0)), DECIMAL(14, 4))]), filter(nil), rowset=256
      group(nil), agg_func([T_FUN_SUM(a1.THOUSAND)], [T_FUN_COUNT(a1.THOUSAND)], [T_FUN_SUM(b1.THOUSAND)], [T_FUN_COUNT(b1.THOUSAND)])
  1 - output([a1.THOUSAND], [b1.THOUSAND]), filter([(T_OP_EXISTS, subquery(2))], [cast(a1.HUNDRED, DECIMAL(10, 0)) >= subquery(1)]), rowset=256
      exec_params_([b1.TEN(:0)], [b1.UNIQUE1(:1)]), onetime_exprs_(nil), init_plan_idxs_(nil), use_batch=false
  2 - output([a1.THOUSAND], [b1.THOUSAND], [b1.TEN], [b1.UNIQUE1], [a1.HUNDRED]), filter(nil), rowset=256
      equal_conds([a1.TEN = b1.TEN]), other_conds(nil)
  3 - output([a1.TEN], [a1.HUNDRED], [a1.THOUSAND]), filter(nil), rowset=256
      access([a1.TEN], [a1.HUNDRED], [a1.THOUSAND]), partitions(p0)
      is_index_back=false, is_global_index=false, 
      range_key([a1.__pk_increment]), range(MIN ; MAX)always true
  4 - output([b1.TEN], [b1.UNIQUE1], [b1.THOUSAND]), filter(nil), rowset=256
      access([b1.TEN], [b1.UNIQUE1], [b1.THOUSAND]), partitions(p0)
      is_index_back=false, is_global_index=false, 
      range_key([b1.__pk_increment]), range(MIN ; MAX)always true
  5 - output([cast(cast(T_FUN_SUM(a2.HUNDRED), DECIMAL_INT(64, 32)) / cast(T_FUN_COUNT(a2.HUNDRED), DECIMAL_INT(20, 0)), DECIMAL(14, 4))]), filter(nil), rowset=256
      group(nil), agg_func([T_FUN_SUM(a2.HUNDRED)], [T_FUN_COUNT(a2.HUNDRED)])
  6 - output([a2.HUNDRED]), filter(nil), rowset=256
      access([a2.__pk_increment], [a2.HUNDRED]), partitions(p0)
      is_index_back=true, is_global_index=false, 
      range_key([a2.TEN], [a2.__pk_increment]), range(MIN,MIN ; MAX,MAX)always true, 
      range_cond([a2.TEN = :0])
  7 - output([1]), filter(nil), rowset=256
      access(nil), partitions(p0)
      limit(1), offset(nil), is_index_back=false, is_global_index=false, 
      range_key([c1.UNIQUE1], [c1.shadow_pk_0]), range(MIN,MIN ; MAX,MAX)always true, 
      range_cond([c1.UNIQUE1 = :1])
select avg(a1.thousand), avg(b1.thousand) from t2_100 a1, t1_100 b1 where a1.ten = b1.ten and a1.hundred >= (select /*+no_unnest*/avg(a2.hundred) from t2_100 a2 where a2.ten = b1.ten) and exists (select /*+no_unnest*/1 from t2_1 c1 where c1.unique1 = b1.unique1);
+------------------+------------------+
| avg(a1.thousand) | avg(b1.thousand) |
+------------------+------------------+
|             NULL |             NULL |
+------------------+------------------+

EXPLAIN update t2_100 a1, t1_100 b1 set a1.thousand = a1.unique1 where a1.ten = b1.ten and a1.hundred >= (select avg(a2.hundred) from t2_100 a2 where a2.ten = b1.ten) and exists (select 1 from t2_1 c1 where c1.unique1 = b1.unique1);
Query Plan
================================================================================
|ID|OPERATOR                            |NAME            |EST.ROWS|EST.TIME(us)|
--------------------------------------------------------------------------------
|0 |DISTRIBUTED UPDATE                  |                |1       |118         |
|1 |└─NESTED-LOOP JOIN                  |                |1       |90          |
|2 |  ├─HASH JOIN                       |                |1       |18          |
|3 |  │ ├─TABLE FULL SCAN               |c1(T2_1_UNIQUE1)|1       |3           |
|4 |  │ └─TABLE FULL SCAN               |b1              |100     |6           |
|5 |  └─SUBPLAN SCAN                    |VIEW2           |1       |73          |
|6 |    └─WINDOW FUNCTION               |                |10      |72          |
|7 |      └─DISTRIBUTED TABLE RANGE SCAN|a2(T2_100_TEN)  |10      |54          |
================================================================================
Outputs & filters:
-------------------------------------
  0 - output(nil), filter(nil)
      table_columns([{VIEW2: ({t2_100: (VIEW2.a2.__pk_increment, VIEW2.a2.UNIQUE1, VIEW2.a2.UNIQUE2, VIEW2.a2.UNIQUE3, VIEW2.a2.TEN, VIEW2.a2.HUNDRED, VIEW2.a2.THOUSAND,
       VIEW2.a2.HUND_CLUST, VIEW2.a2.HUND_NULL, VIEW2.a2.CHAR_UNIQUE, VIEW2.a2.CHAR_HUND, VIEW2.a2.VCHAR_UNIQUE, VIEW2.a2.VCHAR_HUND, VIEW2.a2.DATE_UNIQUE, VIEW2.a2.DATE_HUND,
       VIEW2.a2.ALL_NULL, VIEW2.a2.NUMERIC)}), hash_distinct}]),
      update([VIEW2.a2.THOUSAND=column_conv(DECIMAL_INT,PS:(10,0),NULL,VIEW2.a2.UNIQUE1)])
  1 - output([VIEW2.a2.__pk_increment], [VIEW2.a2.UNIQUE1], [VIEW2.a2.UNIQUE2], [VIEW2.a2.UNIQUE3], [VIEW2.a2.TEN], [VIEW2.a2.HUNDRED], [VIEW2.a2.THOUSAND],
       [VIEW2.a2.HUND_CLUST], [VIEW2.a2.HUND_NULL], [VIEW2.a2.CHAR_UNIQUE], [VIEW2.a2.CHAR_HUND], [VIEW2.a2.VCHAR_UNIQUE], [VIEW2.a2.VCHAR_HUND], [VIEW2.a2.DATE_UNIQUE],
       [VIEW2.a2.DATE_HUND], [VIEW2.a2.ALL_NULL], [VIEW2.a2.NUMERIC]), filter(nil), rowset=256
      conds(nil), nl_params_([b1.TEN(:0)]), use_batch=true
  2 - output([b1.TEN]), filter(nil), rowset=256
      equal_conds([c1.UNIQUE1 = b1.UNIQUE1]), other_conds(nil)
  3 - output([c1.UNIQUE1]), filter(nil), rowset=256
      access([c1.UNIQUE1]), partitions(p0)
      is_index_back=false, is_global_index=false, 
      range_key([c1.UNIQUE1], [c1.shadow_pk_0]), range(MIN,MIN ; MAX,MAX)always true
  4 - output([b1.TEN], [b1.UNIQUE1]), filter(nil), rowset=256
      access([b1.TEN], [b1.UNIQUE1]), partitions(p0)
      is_index_back=false, is_global_index=false, 
      range_key([b1.__pk_increment]), range(MIN ; MAX)always true
  5 - output([VIEW2.a2.TEN], [VIEW2.a2.__pk_increment], [VIEW2.a2.THOUSAND], [VIEW2.a2.UNIQUE1], [VIEW2.a2.UNIQUE2], [VIEW2.a2.UNIQUE3], [VIEW2.a2.HUNDRED],
       [VIEW2.a2.HUND_CLUST], [VIEW2.a2.HUND_NULL], [VIEW2.a2.CHAR_UNIQUE], [VIEW2.a2.CHAR_HUND], [VIEW2.a2.VCHAR_UNIQUE], [VIEW2.a2.VCHAR_HUND], [VIEW2.a2.DATE_UNIQUE],
       [VIEW2.a2.DATE_HUND], [VIEW2.a2.ALL_NULL], [VIEW2.a2.NUMERIC]), filter([cast(VIEW2.a2.HUNDRED, DECIMAL(10, 0)) >= VIEW2.avg(a2.hundred)]), rowset=256
      access([VIEW2.avg(a2.hundred)], [VIEW2.a2.TEN], [VIEW2.a2.__pk_increment], [VIEW2.a2.THOUSAND], [VIEW2.a2.UNIQUE1], [VIEW2.a2.UNIQUE2], [VIEW2.a2.UNIQUE3],
       [VIEW2.a2.HUNDRED], [VIEW2.a2.HUND_CLUST], [VIEW2.a2.HUND_NULL], [VIEW2.a2.CHAR_UNIQUE], [VIEW2.a2.CHAR_HUND], [VIEW2.a2.VCHAR_UNIQUE], [VIEW2.a2.VCHAR_HUND],
       [VIEW2.a2.DATE_UNIQUE], [VIEW2.a2.DATE_HUND], [VIEW2.a2.ALL_NULL], [VIEW2.a2.NUMERIC])
  6 - output([cast(cast(T_FUN_SUM(a2.HUNDRED), DECIMAL_INT(64, 32)) / cast(T_FUN_COUNT(a2.HUNDRED), DECIMAL_INT(20, 0)), DECIMAL(14, 4))], [a2.TEN], [a2.__pk_increment],
       [a2.THOUSAND], [a2.UNIQUE1], [a2.UNIQUE2], [a2.UNIQUE3], [a2.HUNDRED], [a2.HUND_CLUST], [a2.HUND_NULL], [a2.CHAR_UNIQUE], [a2.CHAR_HUND], [a2.VCHAR_UNIQUE],
       [a2.VCHAR_HUND], [a2.DATE_UNIQUE], [a2.DATE_HUND], [a2.ALL_NULL], [a2.NUMERIC]), filter(nil), rowset=256
      win_expr(T_FUN_SUM(a2.HUNDRED)), partition_by(nil), order_by(nil), window_type(RANGE), upper(UNBOUNDED PRECEDING), lower(UNBOUNDED FOLLOWING)
      win_expr(T_FUN_COUNT(a2.HUNDRED)), partition_by(nil), order_by(nil), window_type(RANGE), upper(UNBOUNDED PRECEDING), lower(UNBOUNDED FOLLOWING)
  7 - output([a2.__pk_increment], [a2.TEN], [a2.HUNDRED], [a2.THOUSAND], [a2.UNIQUE1], [a2.UNIQUE2], [a2.UNIQUE3], [a2.HUND_CLUST], [a2.HUND_NULL], [a2.CHAR_UNIQUE],
       [a2.CHAR_HUND], [a2.VCHAR_UNIQUE], [a2.VCHAR_HUND], [a2.DATE_UNIQUE], [a2.DATE_HUND], [a2.ALL_NULL], [a2.NUMERIC]), filter([a2.TEN IS NOT NULL]), rowset=256
      access([GROUP_ID], [a2.__pk_increment], [a2.TEN], [a2.HUNDRED], [a2.THOUSAND], [a2.UNIQUE1], [a2.UNIQUE2], [a2.UNIQUE3], [a2.HUND_CLUST], [a2.HUND_NULL],
       [a2.CHAR_UNIQUE], [a2.CHAR_HUND], [a2.VCHAR_UNIQUE], [a2.VCHAR_HUND], [a2.DATE_UNIQUE], [a2.DATE_HUND], [a2.ALL_NULL], [a2.NUMERIC]), partitions(p0)
      is_index_back=true, is_global_index=false, filter_before_indexback[true], 
      range_key([a2.TEN], [a2.__pk_increment]), range(MIN,MIN ; MAX,MAX)always true, 
      range_cond([a2.TEN = :0])
update t2_100 a1, t1_100 b1 set a1.thousand = a1.unique1 where a1.ten = b1.ten and a1.hundred >= (select avg(a2.hundred) from t2_100 a2 where a2.ten = b1.ten) and exists (select 1 from t2_1 c1 where c1.unique1 = b1.unique1);
select/*no explain*/sum(thousand), stddev(thousand) from t2_100;
+---------------+-------------------+
| sum(thousand) | stddev(thousand)  |
+---------------+-------------------+
|          4950 | 28.86607004772212 |
+---------------+-------------------+
rollback;
EXPLAIN insert into tmp select avg(a1.thousand) from t2_100 a1, t1_100 b1 where a1.ten = b1.ten and a1.hundred >= (select avg(a2.hundred) from t2_100 a2 where a2.ten = b1.ten) and exists (select 1 from t2_1 c1 where c1.unique1 = b1.unique1);
Query Plan
=========================================================================
|ID|OPERATOR                     |NAME            |EST.ROWS|EST.TIME(us)|
-------------------------------------------------------------------------
|0 |INSERT                       |                |1       |68          |
|1 |└─SUBPLAN SCAN               |ANONYMOUS_VIEW1 |1       |55          |
|2 |  └─SCALAR GROUP BY          |                |1       |55          |
|3 |    └─HASH JOIN              |                |1       |55          |
|4 |      ├─HASH JOIN            |                |1       |38          |
|5 |      │ ├─HASH JOIN          |                |1       |18          |
|6 |      │ │ ├─TABLE FULL SCAN  |c1(T2_1_UNIQUE1)|1       |3           |
|7 |      │ │ └─TABLE FULL SCAN  |b1              |100     |6           |
|8 |      │ └─SUBPLAN SCAN       |VIEW2           |10      |20          |
|9 |      │   └─HASH GROUP BY    |                |10      |20          |
|10|      │     └─TABLE FULL SCAN|a2              |100     |6           |
|11|      └─TABLE FULL SCAN      |a1              |100     |8           |
=========================================================================
Outputs & filters:
-------------------------------------
  0 - output(nil), filter(nil)
      columns([{tmp: ({tmp: (tmp.__pk_increment, tmp.c1)})}]), partitions(p0), 
      column_values([T_HIDDEN_PK], [column_conv(INT,PS:(11,0),NULL,cast(ANONYMOUS_VIEW1.avg(a1.thousand), INT(-1, 0)))])
  1 - output([ANONYMOUS_VIEW1.avg(a1.thousand)]), filter(nil), rowset=256
      access([ANONYMOUS_VIEW1.avg(a1.thousand)])
  2 - output([cast(cast(T_FUN_SUM(a1.THOUSAND), DECIMAL_INT(64, 32)) / cast(T_FUN_COUNT(a1.THOUSAND), DECIMAL_INT(20, 0)), DECIMAL(14, 4))]), filter(nil), rowset=256
      group(nil), agg_func([T_FUN_SUM(a1.THOUSAND)], [T_FUN_COUNT(a1.THOUSAND)])
  3 - output([a1.THOUSAND]), filter(nil), rowset=256
      equal_conds([a1.TEN = b1.TEN]), other_conds([cast(a1.HUNDRED, DECIMAL(10, 0)) >= VIEW2.avg(a2.hundred)])
  4 - output([b1.TEN], [VIEW2.avg(a2.hundred)]), filter(nil), rowset=256
      equal_conds([VIEW2.a2.TEN = b1.TEN]), other_conds(nil)
  5 - output([b1.TEN]), filter(nil), rowset=256
      equal_conds([c1.UNIQUE1 = b1.UNIQUE1]), other_conds(nil)
  6 - output([c1.UNIQUE1]), filter(nil), rowset=256
      access([c1.UNIQUE1]), partitions(p0)
      is_index_back=false, is_global_index=false, 
      range_key([c1.UNIQUE1], [c1.shadow_pk_0]), range(MIN,MIN ; MAX,MAX)always true
  7 - output([b1.TEN], [b1.UNIQUE1]), filter(nil), rowset=256
      access([b1.TEN], [b1.UNIQUE1]), partitions(p0)
      is_index_back=false, is_global_index=false, 
      range_key([b1.__pk_increment]), range(MIN ; MAX)always true
  8 - output([VIEW2.avg(a2.hundred)], [VIEW2.a2.TEN]), filter(nil), rowset=256
      access([VIEW2.avg(a2.hundred)], [VIEW2.a2.TEN])
  9 - output([cast(cast(T_FUN_SUM(a2.HUNDRED), DECIMAL_INT(64, 32)) / cast(T_FUN_COUNT(a2.HUNDRED), DECIMAL_INT(20, 0)), DECIMAL(14, 4))], [a2.TEN]), filter(nil), rowset=256
      group([a2.TEN]), agg_func([T_FUN_SUM(a2.HUNDRED)], [T_FUN_COUNT(a2.HUNDRED)])
 10 - output([a2.TEN], [a2.HUNDRED]), filter(nil), rowset=256
      access([a2.TEN], [a2.HUNDRED]), partitions(p0)
      is_index_back=false, is_global_index=false, 
      range_key([a2.__pk_increment]), range(MIN ; MAX)always true
 11 - output([a1.TEN], [a1.HUNDRED], [a1.THOUSAND]), filter(nil), rowset=256
      access([a1.TEN], [a1.HUNDRED], [a1.THOUSAND]), partitions(p0)
      is_index_back=false, is_global_index=false, 
      range_key([a1.__pk_increment]), range(MIN ; MAX)always true
insert into tmp select avg(a1.thousand) from t2_100 a1, t1_100 b1 where a1.ten = b1.ten and a1.hundred >= (select avg(a2.hundred) from t2_100 a2 where a2.ten = b1.ten) and exists (select 1 from t2_1 c1 where c1.unique1 = b1.unique1);
select/*no explain*/* from tmp;
+------+
| c1   |
+------+
| NULL |
+------+
rollback;

EXPLAIN select avg(a1.thousand), avg(b1.thousand), avg(c1.thousand) from t2_100 a1, t1_100 b1 left join t2_1 c1 on b1.unique1 = c1.unique1 where a1.ten = b1.ten and a1.hundred >= (select avg(a2.hundred) from t2_100 a2 where a2.ten = b1.ten);
Query Plan
============================================================
|ID|OPERATOR                   |NAME |EST.ROWS|EST.TIME(us)|
------------------------------------------------------------
|0 |SCALAR GROUP BY            |     |1       |135         |
|1 |└─HASH RIGHT OUTER JOIN    |     |100     |126         |
|2 |  ├─TABLE FULL SCAN        |c1   |1       |3           |
|3 |  └─HASH JOIN              |     |100     |114         |
|4 |    ├─TABLE FULL SCAN      |a1   |100     |8           |
|5 |    └─HASH JOIN            |     |100     |42          |
|6 |      ├─SUBPLAN SCAN       |VIEW1|10      |20          |
|7 |      │ └─HASH GROUP BY    |     |10      |20          |
|8 |      │   └─TABLE FULL SCAN|a2   |100     |6           |
|9 |      └─TABLE FULL SCAN    |b1   |100     |8           |
============================================================
Outputs & filters:
-------------------------------------
  0 - output([cast(cast(T_FUN_SUM(a1.THOUSAND), DECIMAL_INT(64, 32)) / cast(T_FUN_COUNT(a1.THOUSAND), DECIMAL_INT(20, 0)), DECIMAL(14, 4))], [cast(cast(T_FUN_SUM(b1.THOUSAND),
       DECIMAL_INT(64, 32)) / cast(T_FUN_COUNT(b1.THOUSAND), DECIMAL_INT(20, 0)), DECIMAL(14, 4))], [cast(cast(T_FUN_SUM(c1.THOUSAND), DECIMAL_INT(64, 32)) / 
      cast(T_FUN_COUNT(c1.THOUSAND), DECIMAL_INT(20, 0)), DECIMAL(14, 4))]), filter(nil), rowset=256
      group(nil), agg_func([T_FUN_SUM(a1.THOUSAND)], [T_FUN_COUNT(a1.THOUSAND)], [T_FUN_SUM(b1.THOUSAND)], [T_FUN_COUNT(b1.THOUSAND)], [T_FUN_SUM(c1.THOUSAND)],
       [T_FUN_COUNT(c1.THOUSAND)])
  1 - output([a1.THOUSAND], [b1.THOUSAND], [c1.THOUSAND]), filter(nil), rowset=256
      equal_conds([b1.UNIQUE1 = c1.UNIQUE1]), other_conds(nil)
  2 - output([c1.UNIQUE1], [c1.THOUSAND]), filter(nil), rowset=256
      access([c1.UNIQUE1], [c1.THOUSAND]), partitions(p0)
      is_index_back=false, is_global_index=false, 
      range_key([c1.__pk_increment]), range(MIN ; MAX)always true
  3 - output([a1.THOUSAND], [b1.THOUSAND], [b1.UNIQUE1]), filter(nil), rowset=256
      equal_conds([a1.TEN = b1.TEN]), other_conds([cast(a1.HUNDRED, DECIMAL(10, 0)) >= VIEW1.avg(a2.hundred)])
  4 - output([a1.TEN], [a1.HUNDRED], [a1.THOUSAND]), filter(nil), rowset=256
      access([a1.TEN], [a1.HUNDRED], [a1.THOUSAND]), partitions(p0)
      is_index_back=false, is_global_index=false, 
      range_key([a1.__pk_increment]), range(MIN ; MAX)always true
  5 - output([b1.THOUSAND], [b1.TEN], [VIEW1.avg(a2.hundred)], [b1.UNIQUE1]), filter(nil), rowset=256
      equal_conds([VIEW1.a2.TEN = b1.TEN]), other_conds(nil)
  6 - output([VIEW1.avg(a2.hundred)], [VIEW1.a2.TEN]), filter(nil), rowset=256
      access([VIEW1.avg(a2.hundred)], [VIEW1.a2.TEN])
  7 - output([cast(cast(T_FUN_SUM(a2.HUNDRED), DECIMAL_INT(64, 32)) / cast(T_FUN_COUNT(a2.HUNDRED), DECIMAL_INT(20, 0)), DECIMAL(14, 4))], [a2.TEN]), filter(nil), rowset=256
      group([a2.TEN]), agg_func([T_FUN_SUM(a2.HUNDRED)], [T_FUN_COUNT(a2.HUNDRED)])
  8 - output([a2.TEN], [a2.HUNDRED]), filter(nil), rowset=256
      access([a2.TEN], [a2.HUNDRED]), partitions(p0)
      is_index_back=false, is_global_index=false, 
      range_key([a2.__pk_increment]), range(MIN ; MAX)always true
  9 - output([b1.UNIQUE1], [b1.TEN], [b1.THOUSAND]), filter(nil), rowset=256
      access([b1.UNIQUE1], [b1.TEN], [b1.THOUSAND]), partitions(p0)
      is_index_back=false, is_global_index=false, 
      range_key([b1.__pk_increment]), range(MIN ; MAX)always true
select avg(a1.thousand), avg(b1.thousand), avg(c1.thousand) from t2_100 a1, t1_100 b1 left join t2_1 c1 on b1.unique1 = c1.unique1 where a1.ten = b1.ten and a1.hundred >= (select avg(a2.hundred) from t2_100 a2 where a2.ten = b1.ten);
+------------------+------------------+------------------+
| avg(a1.thousand) | avg(b1.thousand) | avg(c1.thousand) |
+------------------+------------------+------------------+
|          74.5000 |          49.5000 |             NULL |
+------------------+------------------+------------------+
EXPLAIN select /*+no_unnest(@qb1)*/ avg(a1.thousand), avg(b1.thousand), avg(c1.thousand) from t2_100 a1, t1_100 b1 left join t2_1 c1 on b1.unique1 = c1.unique1 where a1.ten = b1.ten and a1.hundred >= (select /*+qb_name(qb1)*/avg(a2.hundred) from t2_100 a2 where a2.ten = b1.ten);
Query Plan
======================================================================
|ID|OPERATOR                    |NAME          |EST.ROWS|EST.TIME(us)|
----------------------------------------------------------------------
|0 |SCALAR GROUP BY             |              |1       |45224       |
|1 |└─SUBPLAN FILTER            |              |334     |45192       |
|2 |  ├─HASH JOIN               |              |1000    |98          |
|3 |  │ ├─HASH RIGHT OUTER JOIN |              |100     |19          |
|4 |  │ │ ├─TABLE FULL SCAN     |c1            |1       |3           |
|5 |  │ │ └─TABLE FULL SCAN     |b1            |100     |8           |
|6 |  │ └─TABLE FULL SCAN       |a1            |100     |8           |
|7 |  └─SCALAR GROUP BY         |              |1       |46          |
|8 |    └─TABLE RANGE SCAN      |a2(T2_100_TEN)|10      |45          |
======================================================================
Outputs & filters:
-------------------------------------
  0 - output([cast(cast(T_FUN_SUM(a1.THOUSAND), DECIMAL_INT(64, 32)) / cast(T_FUN_COUNT(a1.THOUSAND), DECIMAL_INT(20, 0)), DECIMAL(14, 4))], [cast(cast(T_FUN_SUM(b1.THOUSAND),
       DECIMAL_INT(64, 32)) / cast(T_FUN_COUNT(b1.THOUSAND), DECIMAL_INT(20, 0)), DECIMAL(14, 4))], [cast(cast(T_FUN_SUM(c1.THOUSAND), DECIMAL_INT(64, 32)) / 
      cast(T_FUN_COUNT(c1.THOUSAND), DECIMAL_INT(20, 0)), DECIMAL(14, 4))]), filter(nil), rowset=256
      group(nil), agg_func([T_FUN_SUM(a1.THOUSAND)], [T_FUN_COUNT(a1.THOUSAND)], [T_FUN_SUM(b1.THOUSAND)], [T_FUN_COUNT(b1.THOUSAND)], [T_FUN_SUM(c1.THOUSAND)],
       [T_FUN_COUNT(c1.THOUSAND)])
  1 - output([a1.THOUSAND], [b1.THOUSAND], [c1.THOUSAND]), filter([cast(a1.HUNDRED, DECIMAL(10, 0)) >= subquery(1)]), rowset=256
      exec_params_([b1.TEN(:0)]), onetime_exprs_(nil), init_plan_idxs_(nil), use_batch=false
  2 - output([a1.THOUSAND], [b1.THOUSAND], [c1.THOUSAND], [b1.TEN], [a1.HUNDRED]), filter(nil), rowset=256
      equal_conds([a1.TEN = b1.TEN]), other_conds(nil)
  3 - output([b1.THOUSAND], [c1.THOUSAND], [b1.TEN]), filter(nil), rowset=256
      equal_conds([b1.UNIQUE1 = c1.UNIQUE1]), other_conds(nil)
  4 - output([c1.UNIQUE1], [c1.THOUSAND]), filter(nil), rowset=256
      access([c1.UNIQUE1], [c1.THOUSAND]), partitions(p0)
      is_index_back=false, is_global_index=false, 
      range_key([c1.__pk_increment]), range(MIN ; MAX)always true
  5 - output([b1.UNIQUE1], [b1.TEN], [b1.THOUSAND]), filter(nil), rowset=256
      access([b1.UNIQUE1], [b1.TEN], [b1.THOUSAND]), partitions(p0)
      is_index_back=false, is_global_index=false, 
      range_key([b1.__pk_increment]), range(MIN ; MAX)always true
  6 - output([a1.TEN], [a1.HUNDRED], [a1.THOUSAND]), filter(nil), rowset=256
      access([a1.TEN], [a1.HUNDRED], [a1.THOUSAND]), partitions(p0)
      is_index_back=false, is_global_index=false, 
      range_key([a1.__pk_increment]), range(MIN ; MAX)always true
  7 - output([cast(cast(T_FUN_SUM(a2.HUNDRED), DECIMAL_INT(64, 32)) / cast(T_FUN_COUNT(a2.HUNDRED), DECIMAL_INT(20, 0)), DECIMAL(14, 4))]), filter(nil), rowset=256
      group(nil), agg_func([T_FUN_SUM(a2.HUNDRED)], [T_FUN_COUNT(a2.HUNDRED)])
  8 - output([a2.HUNDRED]), filter(nil), rowset=256
      access([a2.__pk_increment], [a2.HUNDRED]), partitions(p0)
      is_index_back=true, is_global_index=false, 
      range_key([a2.TEN], [a2.__pk_increment]), range(MIN,MIN ; MAX,MAX)always true, 
      range_cond([a2.TEN = :0])
select /*+no_unnest(@qb1)*/ avg(a1.thousand), avg(b1.thousand), avg(c1.thousand) from t2_100 a1, t1_100 b1 left join t2_1 c1 on b1.unique1 = c1.unique1 where a1.ten = b1.ten and a1.hundred >= (select /*+qb_name(qb1)*/avg(a2.hundred) from t2_100 a2 where a2.ten = b1.ten);
+------------------+------------------+------------------+
| avg(a1.thousand) | avg(b1.thousand) | avg(c1.thousand) |
+------------------+------------------+------------------+
|          74.5000 |          49.5000 |             NULL |
+------------------+------------------+------------------+

EXPLAIN update t2_100 a1, t1_100 b1 left join t2_1 c1 on b1.unique1 = c1.unique1 set a1.thousand = a1.unique1 where a1.ten = b1.ten and a1.hundred >= (select avg(a2.hundred) from t2_100 a2 where a2.ten = b1.ten);
Query Plan
==========================================================
|ID|OPERATOR                 |NAME |EST.ROWS|EST.TIME(us)|
----------------------------------------------------------
|0 |UPDATE                   |     |50      |704         |
|1 |└─HASH JOIN              |     |50      |302         |
|2 |  ├─SUBPLAN SCAN         |VIEW1|5       |283         |
|3 |  │ └─WINDOW FUNCTION    |     |100     |282         |
|4 |  │   └─PARTITION SORT   |     |100     |94          |
|5 |  │     └─TABLE FULL SCAN|a2   |100     |29          |
|6 |  └─TABLE FULL SCAN      |b1   |100     |4           |
==========================================================
Outputs & filters:
-------------------------------------
  0 - output(nil), filter(nil)
      table_columns([{VIEW1: ({t2_100: (VIEW1.a2.__pk_increment, VIEW1.a2.UNIQUE1, VIEW1.a2.UNIQUE2, VIEW1.a2.UNIQUE3, VIEW1.a2.TEN, VIEW1.a2.HUNDRED, VIEW1.a2.THOUSAND,
       VIEW1.a2.HUND_CLUST, VIEW1.a2.HUND_NULL, VIEW1.a2.CHAR_UNIQUE, VIEW1.a2.CHAR_HUND, VIEW1.a2.VCHAR_UNIQUE, VIEW1.a2.VCHAR_HUND, VIEW1.a2.DATE_UNIQUE, VIEW1.a2.DATE_HUND,
       VIEW1.a2.ALL_NULL, VIEW1.a2.NUMERIC)}), hash_distinct}]),
      update([VIEW1.a2.THOUSAND=column_conv(DECIMAL_INT,PS:(10,0),NULL,VIEW1.a2.UNIQUE1)])
  1 - output([VIEW1.a2.__pk_increment], [VIEW1.a2.UNIQUE1], [VIEW1.a2.UNIQUE2], [VIEW1.a2.UNIQUE3], [VIEW1.a2.TEN], [VIEW1.a2.HUNDRED], [VIEW1.a2.THOUSAND],
       [VIEW1.a2.HUND_CLUST], [VIEW1.a2.HUND_NULL], [VIEW1.a2.CHAR_UNIQUE], [VIEW1.a2.CHAR_HUND], [VIEW1.a2.VCHAR_UNIQUE], [VIEW1.a2.VCHAR_HUND], [VIEW1.a2.DATE_UNIQUE],
       [VIEW1.a2.DATE_HUND], [VIEW1.a2.ALL_NULL], [VIEW1.a2.NUMERIC]), filter(nil), rowset=256
      equal_conds([VIEW1.a2.TEN = b1.TEN]), other_conds(nil)
  2 - output([VIEW1.a2.TEN], [VIEW1.a2.__pk_increment], [VIEW1.a2.THOUSAND], [VIEW1.a2.UNIQUE1], [VIEW1.a2.UNIQUE2], [VIEW1.a2.UNIQUE3], [VIEW1.a2.HUNDRED],
       [VIEW1.a2.HUND_CLUST], [VIEW1.a2.HUND_NULL], [VIEW1.a2.CHAR_UNIQUE], [VIEW1.a2.CHAR_HUND], [VIEW1.a2.VCHAR_UNIQUE], [VIEW1.a2.VCHAR_HUND], [VIEW1.a2.DATE_UNIQUE],
       [VIEW1.a2.DATE_HUND], [VIEW1.a2.ALL_NULL], [VIEW1.a2.NUMERIC]), filter([cast(VIEW1.a2.HUNDRED, DECIMAL(10, 0)) >= VIEW1.avg(a2.hundred)]), rowset=256
      access([VIEW1.avg(a2.hundred)], [VIEW1.a2.TEN], [VIEW1.a2.__pk_increment], [VIEW1.a2.THOUSAND], [VIEW1.a2.UNIQUE1], [VIEW1.a2.UNIQUE2], [VIEW1.a2.UNIQUE3],
       [VIEW1.a2.HUNDRED], [VIEW1.a2.HUND_CLUST], [VIEW1.a2.HUND_NULL], [VIEW1.a2.CHAR_UNIQUE], [VIEW1.a2.CHAR_HUND], [VIEW1.a2.VCHAR_UNIQUE], [VIEW1.a2.VCHAR_HUND],
       [VIEW1.a2.DATE_UNIQUE], [VIEW1.a2.DATE_HUND], [VIEW1.a2.ALL_NULL], [VIEW1.a2.NUMERIC])
  3 - output([cast(cast(T_FUN_SUM(a2.HUNDRED), DECIMAL_INT(64, 32)) / cast(T_FUN_COUNT(a2.HUNDRED), DECIMAL_INT(20, 0)), DECIMAL(14, 4))], [a2.TEN], [a2.__pk_increment],
       [a2.THOUSAND], [a2.UNIQUE1], [a2.UNIQUE2], [a2.UNIQUE3], [a2.HUNDRED], [a2.HUND_CLUST], [a2.HUND_NULL], [a2.CHAR_UNIQUE], [a2.CHAR_HUND], [a2.VCHAR_UNIQUE],
       [a2.VCHAR_HUND], [a2.DATE_UNIQUE], [a2.DATE_HUND], [a2.ALL_NULL], [a2.NUMERIC]), filter(nil), rowset=256
      win_expr(T_FUN_SUM(a2.HUNDRED)), partition_by([a2.TEN]), order_by(nil), window_type(RANGE), upper(UNBOUNDED PRECEDING), lower(UNBOUNDED FOLLOWING)
      win_expr(T_FUN_COUNT(a2.HUNDRED)), partition_by([a2.TEN]), order_by(nil), window_type(RANGE), upper(UNBOUNDED PRECEDING), lower(UNBOUNDED FOLLOWING)
  4 - output([a2.HUNDRED], [a2.TEN], [a2.__pk_increment], [a2.THOUSAND], [a2.UNIQUE1], [a2.UNIQUE2], [a2.UNIQUE3], [a2.HUND_CLUST], [a2.HUND_NULL], [a2.CHAR_UNIQUE],
       [a2.CHAR_HUND], [a2.VCHAR_UNIQUE], [a2.VCHAR_HUND], [a2.DATE_UNIQUE], [a2.DATE_HUND], [a2.ALL_NULL], [a2.NUMERIC]), filter(nil), rowset=256
      sort_keys([HASH(a2.TEN), ASC], [a2.TEN, ASC])
  5 - output([a2.__pk_increment], [a2.TEN], [a2.HUNDRED], [a2.THOUSAND], [a2.UNIQUE1], [a2.UNIQUE2], [a2.UNIQUE3], [a2.HUND_CLUST], [a2.HUND_NULL], [a2.CHAR_UNIQUE],
       [a2.CHAR_HUND], [a2.VCHAR_UNIQUE], [a2.VCHAR_HUND], [a2.DATE_UNIQUE], [a2.DATE_HUND], [a2.ALL_NULL], [a2.NUMERIC]), filter([a2.TEN IS NOT NULL]), rowset=256
      access([a2.__pk_increment], [a2.TEN], [a2.HUNDRED], [a2.THOUSAND], [a2.UNIQUE1], [a2.UNIQUE2], [a2.UNIQUE3], [a2.HUND_CLUST], [a2.HUND_NULL], [a2.CHAR_UNIQUE],
       [a2.CHAR_HUND], [a2.VCHAR_UNIQUE], [a2.VCHAR_HUND], [a2.DATE_UNIQUE], [a2.DATE_HUND], [a2.ALL_NULL], [a2.NUMERIC]), partitions(p0)
      is_index_back=false, is_global_index=false, filter_before_indexback[false], 
      range_key([a2.__pk_increment]), range(MIN ; MAX)always true
  6 - output([b1.TEN]), filter(nil), rowset=256
      access([b1.TEN]), partitions(p0)
      is_index_back=false, is_global_index=false, 
      range_key([b1.__pk_increment]), range(MIN ; MAX)always true
update t2_100 a1, t1_100 b1 left join t2_1 c1 on b1.unique1 = c1.unique1 set a1.thousand = a1.unique1 where a1.ten = b1.ten and a1.hundred >= (select avg(a2.hundred) from t2_100 a2 where a2.ten = b1.ten);
select/*no explain*/sum(thousand), stddev(thousand) from t2_100;
+---------------+-------------------+
| sum(thousand) | stddev(thousand)  |
+---------------+-------------------+
|          4950 | 28.86607004772212 |
+---------------+-------------------+
rollback;
EXPLAIN insert into tmp select avg(a1.thousand) from t2_100 a1, t1_100 b1 left join t2_1 c1 on b1.unique1 = c1.unique1 where a1.ten = b1.ten and a1.hundred >= (select avg(a2.hundred) from t2_100 a2 where a2.ten = b1.ten);
Query Plan
========================================================================
|ID|OPERATOR                     |NAME           |EST.ROWS|EST.TIME(us)|
------------------------------------------------------------------------
|0 |INSERT                       |               |1       |123         |
|1 |└─SUBPLAN SCAN               |ANONYMOUS_VIEW1|1       |110         |
|2 |  └─SCALAR GROUP BY          |               |1       |110         |
|3 |    └─HASH JOIN              |               |100     |107         |
|4 |      ├─HASH JOIN            |               |100     |39          |
|5 |      │ ├─SUBPLAN SCAN       |VIEW1          |10      |20          |
|6 |      │ │ └─HASH GROUP BY    |               |10      |20          |
|7 |      │ │   └─TABLE FULL SCAN|a2             |100     |6           |
|8 |      │ └─TABLE FULL SCAN    |b1             |100     |4           |
|9 |      └─TABLE FULL SCAN      |a1             |100     |8           |
========================================================================
Outputs & filters:
-------------------------------------
  0 - output(nil), filter(nil)
      columns([{tmp: ({tmp: (tmp.__pk_increment, tmp.c1)})}]), partitions(p0), 
      column_values([T_HIDDEN_PK], [column_conv(INT,PS:(11,0),NULL,cast(ANONYMOUS_VIEW1.avg(a1.thousand), INT(-1, 0)))])
  1 - output([ANONYMOUS_VIEW1.avg(a1.thousand)]), filter(nil), rowset=256
      access([ANONYMOUS_VIEW1.avg(a1.thousand)])
  2 - output([cast(cast(T_FUN_SUM(a1.THOUSAND), DECIMAL_INT(64, 32)) / cast(T_FUN_COUNT(a1.THOUSAND), DECIMAL_INT(20, 0)), DECIMAL(14, 4))]), filter(nil), rowset=256
      group(nil), agg_func([T_FUN_SUM(a1.THOUSAND)], [T_FUN_COUNT(a1.THOUSAND)])
  3 - output([a1.THOUSAND]), filter(nil), rowset=256
      equal_conds([a1.TEN = b1.TEN]), other_conds([cast(a1.HUNDRED, DECIMAL(10, 0)) >= VIEW1.avg(a2.hundred)])
  4 - output([b1.TEN], [VIEW1.avg(a2.hundred)]), filter(nil), rowset=256
      equal_conds([VIEW1.a2.TEN = b1.TEN]), other_conds(nil)
  5 - output([VIEW1.avg(a2.hundred)], [VIEW1.a2.TEN]), filter(nil), rowset=256
      access([VIEW1.avg(a2.hundred)], [VIEW1.a2.TEN])
  6 - output([cast(cast(T_FUN_SUM(a2.HUNDRED), DECIMAL_INT(64, 32)) / cast(T_FUN_COUNT(a2.HUNDRED), DECIMAL_INT(20, 0)), DECIMAL(14, 4))], [a2.TEN]), filter(nil), rowset=256
      group([a2.TEN]), agg_func([T_FUN_SUM(a2.HUNDRED)], [T_FUN_COUNT(a2.HUNDRED)])
  7 - output([a2.TEN], [a2.HUNDRED]), filter(nil), rowset=256
      access([a2.TEN], [a2.HUNDRED]), partitions(p0)
      is_index_back=false, is_global_index=false, 
      range_key([a2.__pk_increment]), range(MIN ; MAX)always true
  8 - output([b1.TEN]), filter(nil), rowset=256
      access([b1.TEN]), partitions(p0)
      is_index_back=false, is_global_index=false, 
      range_key([b1.__pk_increment]), range(MIN ; MAX)always true
  9 - output([a1.TEN], [a1.HUNDRED], [a1.THOUSAND]), filter(nil), rowset=256
      access([a1.TEN], [a1.HUNDRED], [a1.THOUSAND]), partitions(p0)
      is_index_back=false, is_global_index=false, 
      range_key([a1.__pk_increment]), range(MIN ; MAX)always true
insert into tmp select avg(a1.thousand) from t2_100 a1, t1_100 b1 left join t2_1 c1 on b1.unique1 = c1.unique1 where a1.ten = b1.ten and a1.hundred >= (select avg(a2.hundred) from t2_100 a2 where a2.ten = b1.ten);
select/*no explain*/* from tmp;
+------+
| c1   |
+------+
|   75 |
+------+
rollback;

set autocommit = 1;
drop table tmp;

## test hint
EXPLAIN select avg(a1.thousand), avg(b1.thousand) from t2_100 a1, t1_100 b1 where a1.unique1 = b1.unique1 and a1.hundred >= (select /*+use_merge(a1 b1)*/ avg(a2.hundred) from t2_100 a2 where a2.unique1 = b1.unique1);
Query Plan
===================================================
|ID|OPERATOR           |NAME|EST.ROWS|EST.TIME(us)|
---------------------------------------------------
|0 |SCALAR GROUP BY    |    |1       |58          |
|1 |└─HASH JOIN        |    |100     |51          |
|2 |  ├─TABLE FULL SCAN|b1  |100     |6           |
|3 |  └─TABLE FULL SCAN|a2  |100     |11          |
===================================================
Outputs & filters:
-------------------------------------
  0 - output([cast(cast(T_FUN_SUM(a2.THOUSAND), DECIMAL_INT(64, 32)) / cast(T_FUN_COUNT(a2.THOUSAND), DECIMAL_INT(20, 0)), DECIMAL(14, 4))], [cast(cast(T_FUN_SUM(b1.THOUSAND),
       DECIMAL_INT(64, 32)) / cast(T_FUN_COUNT(b1.THOUSAND), DECIMAL_INT(20, 0)), DECIMAL(14, 4))]), filter(nil), rowset=256
      group(nil), agg_func([T_FUN_SUM(a2.THOUSAND)], [T_FUN_COUNT(a2.THOUSAND)], [T_FUN_SUM(b1.THOUSAND)], [T_FUN_COUNT(b1.THOUSAND)])
  1 - output([a2.THOUSAND], [b1.THOUSAND]), filter(nil), rowset=256
      equal_conds([a2.UNIQUE1 = b1.UNIQUE1]), other_conds(nil)
  2 - output([b1.UNIQUE1], [b1.THOUSAND]), filter(nil), rowset=256
      access([b1.UNIQUE1], [b1.THOUSAND]), partitions(p0)
      is_index_back=false, is_global_index=false, 
      range_key([b1.__pk_increment]), range(MIN ; MAX)always true
  3 - output([a2.UNIQUE1], [a2.THOUSAND]), filter([cast(a2.HUNDRED, DECIMAL(10, 0)) >= cast(cast(cast(a2.HUNDRED, DECIMAL_INT(32, 0)), DECIMAL_INT(64, 32)) 
      / cast(CASE WHEN a2.HUNDRED IS NOT NULL THEN 1 ELSE 0 END, DECIMAL_INT(20, 0)), DECIMAL(14, 4))]), rowset=256
      access([a2.UNIQUE1], [a2.HUNDRED], [a2.THOUSAND]), partitions(p0)
      is_index_back=false, is_global_index=false, filter_before_indexback[false], 
      range_key([a2.__pk_increment]), range(MIN ; MAX)always true
select avg(a1.thousand), avg(b1.thousand) from t2_100 a1, t1_100 b1 where a1.unique1 = b1.unique1 and a1.hundred >= (select /*+use_merge(a1 b1)*/ avg(a2.hundred) from t2_100 a2 where a2.unique1 = b1.unique1);
+------------------+------------------+
| avg(a1.thousand) | avg(b1.thousand) |
+------------------+------------------+
|          49.5000 |          49.5000 |
+------------------+------------------+
EXPLAIN select /*+no_unnest(@qb1)*/ avg(a1.thousand), avg(b1.thousand) from t2_100 a1, t1_100 b1 where a1.unique1 = b1.unique1 and a1.hundred >= (select /*+qb_name(qb1) use_merge(a1 b1)*/ avg(a2.hundred) from t2_100 a2 where a2.unique1 = b1.unique1);
Query Plan
===================================================================
|ID|OPERATOR             |NAME              |EST.ROWS|EST.TIME(us)|
-------------------------------------------------------------------
|0 |SCALAR GROUP BY      |                  |1       |2304        |
|1 |└─SUBPLAN FILTER     |                  |34      |2301        |
|2 |  ├─HASH JOIN        |                  |100     |48          |
|3 |  │ ├─TABLE FULL SCAN|b1                |100     |6           |
|4 |  │ └─TABLE FULL SCAN|a1                |100     |8           |
|5 |  └─SCALAR GROUP BY  |                  |1       |23          |
|6 |    └─TABLE GET      |a2(T2_100_UNIQUE1)|1       |23          |
===================================================================
Outputs & filters:
-------------------------------------
  0 - output([cast(cast(T_FUN_SUM(a1.THOUSAND), DECIMAL_INT(64, 32)) / cast(T_FUN_COUNT(a1.THOUSAND), DECIMAL_INT(20, 0)), DECIMAL(14, 4))], [cast(cast(T_FUN_SUM(b1.THOUSAND),
       DECIMAL_INT(64, 32)) / cast(T_FUN_COUNT(b1.THOUSAND), DECIMAL_INT(20, 0)), DECIMAL(14, 4))]), filter(nil), rowset=256
      group(nil), agg_func([T_FUN_SUM(a1.THOUSAND)], [T_FUN_COUNT(a1.THOUSAND)], [T_FUN_SUM(b1.THOUSAND)], [T_FUN_COUNT(b1.THOUSAND)])
  1 - output([a1.THOUSAND], [b1.THOUSAND]), filter([cast(a1.HUNDRED, DECIMAL(10, 0)) >= subquery(1)]), rowset=256
      exec_params_([b1.UNIQUE1(:0)]), onetime_exprs_(nil), init_plan_idxs_(nil), use_batch=false
  2 - output([a1.THOUSAND], [b1.THOUSAND], [b1.UNIQUE1], [a1.HUNDRED]), filter(nil), rowset=256
      equal_conds([a1.UNIQUE1 = b1.UNIQUE1]), other_conds(nil)
  3 - output([b1.UNIQUE1], [b1.THOUSAND]), filter(nil), rowset=256
      access([b1.UNIQUE1], [b1.THOUSAND]), partitions(p0)
      is_index_back=false, is_global_index=false, 
      range_key([b1.__pk_increment]), range(MIN ; MAX)always true
  4 - output([a1.UNIQUE1], [a1.HUNDRED], [a1.THOUSAND]), filter(nil), rowset=256
      access([a1.UNIQUE1], [a1.HUNDRED], [a1.THOUSAND]), partitions(p0)
      is_index_back=false, is_global_index=false, 
      range_key([a1.__pk_increment]), range(MIN ; MAX)always true
  5 - output([cast(cast(T_FUN_SUM(a2.HUNDRED), DECIMAL_INT(64, 32)) / cast(T_FUN_COUNT(a2.HUNDRED), DECIMAL_INT(20, 0)), DECIMAL(14, 4))]), filter(nil), rowset=256
      group(nil), agg_func([T_FUN_SUM(a2.HUNDRED)], [T_FUN_COUNT(a2.HUNDRED)])
  6 - output([a2.HUNDRED]), filter(nil), rowset=256
      access([a2.__pk_increment], [a2.HUNDRED]), partitions(p0)
      is_index_back=true, is_global_index=false, 
      range_key([a2.UNIQUE1], [a2.shadow_pk_0]), range(MIN,MIN ; MAX,MAX)always true, 
      range_cond([a2.UNIQUE1 = :0])
select /*+no_unnest(@qb1)*/ avg(a1.thousand), avg(b1.thousand) from t2_100 a1, t1_100 b1 where a1.unique1 = b1.unique1 and a1.hundred >= (select /*+qb_name(qb1) use_merge(a1 b1)*/ avg(a2.hundred) from t2_100 a2 where a2.unique1 = b1.unique1);
+------------------+------------------+
| avg(a1.thousand) | avg(b1.thousand) |
+------------------+------------------+
|          49.5000 |          49.5000 |
+------------------+------------------+

EXPLAIN select /*+use_merge(a1 a2)*/ avg(a1.thousand), avg(b1.thousand) from t2_100 a1, t1_100 b1 where a1.unique1 = b1.unique1 and a1.hundred >= (select avg(a2.hundred) from t2_100 a2 where a2.unique1 = b1.unique1);
Query Plan
===================================================
|ID|OPERATOR           |NAME|EST.ROWS|EST.TIME(us)|
---------------------------------------------------
|0 |SCALAR GROUP BY    |    |1       |62          |
|1 |└─HASH JOIN        |    |100     |55          |
|2 |  ├─TABLE FULL SCAN|a1  |100     |11          |
|3 |  └─TABLE FULL SCAN|b1  |100     |6           |
===================================================
Outputs & filters:
-------------------------------------
  0 - output([cast(cast(T_FUN_SUM(a1.THOUSAND), DECIMAL_INT(64, 32)) / cast(T_FUN_COUNT(a1.THOUSAND), DECIMAL_INT(20, 0)), DECIMAL(14, 4))], [cast(cast(T_FUN_SUM(b1.THOUSAND),
       DECIMAL_INT(64, 32)) / cast(T_FUN_COUNT(b1.THOUSAND), DECIMAL_INT(20, 0)), DECIMAL(14, 4))]), filter(nil), rowset=256
      group(nil), agg_func([T_FUN_SUM(a1.THOUSAND)], [T_FUN_COUNT(a1.THOUSAND)], [T_FUN_SUM(b1.THOUSAND)], [T_FUN_COUNT(b1.THOUSAND)])
  1 - output([a1.THOUSAND], [b1.THOUSAND]), filter(nil), rowset=256
      equal_conds([a1.UNIQUE1 = b1.UNIQUE1]), other_conds(nil)
  2 - output([a1.UNIQUE1], [a1.THOUSAND]), filter([cast(a1.HUNDRED, DECIMAL(10, 0)) >= cast(cast(cast(a1.HUNDRED, DECIMAL_INT(32, 0)), DECIMAL_INT(64, 32)) 
      / cast(CASE WHEN a1.HUNDRED IS NOT NULL THEN 1 ELSE 0 END, DECIMAL_INT(20, 0)), DECIMAL(14, 4))]), rowset=256
      access([a1.UNIQUE1], [a1.HUNDRED], [a1.THOUSAND]), partitions(p0)
      is_index_back=false, is_global_index=false, filter_before_indexback[false], 
      range_key([a1.__pk_increment]), range(MIN ; MAX)always true
  3 - output([b1.UNIQUE1], [b1.THOUSAND]), filter(nil), rowset=256
      access([b1.UNIQUE1], [b1.THOUSAND]), partitions(p0)
      is_index_back=false, is_global_index=false, 
      range_key([b1.__pk_increment]), range(MIN ; MAX)always true
select /*+use_merge(a1 a2)*/ avg(a1.thousand), avg(b1.thousand) from t2_100 a1, t1_100 b1 where a1.unique1 = b1.unique1 and a1.hundred >= (select avg(a2.hundred) from t2_100 a2 where a2.unique1 = b1.unique1);
+------------------+------------------+
| avg(a1.thousand) | avg(b1.thousand) |
+------------------+------------------+
|          49.5000 |          49.5000 |
+------------------+------------------+
EXPLAIN select /*+no_unnest(@qb1), use_merge(a1 a2)*/ avg(a1.thousand), avg(b1.thousand) from t2_100 a1, t1_100 b1 where a1.unique1 = b1.unique1 and a1.hundred >= (select /*+qb_name(qb1)*/avg(a2.hundred) from t2_100 a2 where a2.unique1 = b1.unique1);
Query Plan
===================================================================
|ID|OPERATOR             |NAME              |EST.ROWS|EST.TIME(us)|
-------------------------------------------------------------------
|0 |SCALAR GROUP BY      |                  |1       |2308        |
|1 |└─SUBPLAN FILTER     |                  |34      |2305        |
|2 |  ├─HASH JOIN        |                  |100     |52          |
|3 |  │ ├─TABLE FULL SCAN|a1                |100     |8           |
|4 |  │ └─TABLE FULL SCAN|b1                |100     |6           |
|5 |  └─SCALAR GROUP BY  |                  |1       |23          |
|6 |    └─TABLE GET      |a2(T2_100_UNIQUE1)|1       |23          |
===================================================================
Outputs & filters:
-------------------------------------
  0 - output([cast(cast(T_FUN_SUM(a1.THOUSAND), DECIMAL_INT(64, 32)) / cast(T_FUN_COUNT(a1.THOUSAND), DECIMAL_INT(20, 0)), DECIMAL(14, 4))], [cast(cast(T_FUN_SUM(b1.THOUSAND),
       DECIMAL_INT(64, 32)) / cast(T_FUN_COUNT(b1.THOUSAND), DECIMAL_INT(20, 0)), DECIMAL(14, 4))]), filter(nil), rowset=256
      group(nil), agg_func([T_FUN_SUM(a1.THOUSAND)], [T_FUN_COUNT(a1.THOUSAND)], [T_FUN_SUM(b1.THOUSAND)], [T_FUN_COUNT(b1.THOUSAND)])
  1 - output([a1.THOUSAND], [b1.THOUSAND]), filter([cast(a1.HUNDRED, DECIMAL(10, 0)) >= subquery(1)]), rowset=256
      exec_params_([b1.UNIQUE1(:0)]), onetime_exprs_(nil), init_plan_idxs_(nil), use_batch=false
  2 - output([a1.THOUSAND], [b1.THOUSAND], [b1.UNIQUE1], [a1.HUNDRED]), filter(nil), rowset=256
      equal_conds([a1.UNIQUE1 = b1.UNIQUE1]), other_conds(nil)
  3 - output([a1.UNIQUE1], [a1.HUNDRED], [a1.THOUSAND]), filter(nil), rowset=256
      access([a1.UNIQUE1], [a1.HUNDRED], [a1.THOUSAND]), partitions(p0)
      is_index_back=false, is_global_index=false, 
      range_key([a1.__pk_increment]), range(MIN ; MAX)always true
  4 - output([b1.UNIQUE1], [b1.THOUSAND]), filter(nil), rowset=256
      access([b1.UNIQUE1], [b1.THOUSAND]), partitions(p0)
      is_index_back=false, is_global_index=false, 
      range_key([b1.__pk_increment]), range(MIN ; MAX)always true
  5 - output([cast(cast(T_FUN_SUM(a2.HUNDRED), DECIMAL_INT(64, 32)) / cast(T_FUN_COUNT(a2.HUNDRED), DECIMAL_INT(20, 0)), DECIMAL(14, 4))]), filter(nil), rowset=256
      group(nil), agg_func([T_FUN_SUM(a2.HUNDRED)], [T_FUN_COUNT(a2.HUNDRED)])
  6 - output([a2.HUNDRED]), filter(nil), rowset=256
      access([a2.__pk_increment], [a2.HUNDRED]), partitions(p0)
      is_index_back=true, is_global_index=false, 
      range_key([a2.UNIQUE1], [a2.shadow_pk_0]), range(MIN,MIN ; MAX,MAX)always true, 
      range_cond([a2.UNIQUE1 = :0])
select /*+no_unnest(@qb1), use_merge(a1 a2)*/ avg(a1.thousand), avg(b1.thousand) from t2_100 a1, t1_100 b1 where a1.unique1 = b1.unique1 and a1.hundred >= (select /*+qb_name(qb1)*/avg(a2.hundred) from t2_100 a2 where a2.unique1 = b1.unique1);
+------------------+------------------+
| avg(a1.thousand) | avg(b1.thousand) |
+------------------+------------------+
|          49.5000 |          49.5000 |
+------------------+------------------+

EXPLAIN select /*+use_merge(a1 b1)*/ avg(a1.thousand), avg(b1.thousand) from t2_100 a1, t1_100 b1 where a1.unique1 = b1.unique1 and a1.hundred >= (select avg(a2.hundred) from t2_100 a2 where a2.unique1 = b1.unique1);
Query Plan
===================================================
|ID|OPERATOR           |NAME|EST.ROWS|EST.TIME(us)|
---------------------------------------------------
|0 |SCALAR GROUP BY    |    |1       |58          |
|1 |└─HASH JOIN        |    |100     |51          |
|2 |  ├─TABLE FULL SCAN|b1  |100     |6           |
|3 |  └─TABLE FULL SCAN|a2  |100     |11          |
===================================================
Outputs & filters:
-------------------------------------
  0 - output([cast(cast(T_FUN_SUM(a2.THOUSAND), DECIMAL_INT(64, 32)) / cast(T_FUN_COUNT(a2.THOUSAND), DECIMAL_INT(20, 0)), DECIMAL(14, 4))], [cast(cast(T_FUN_SUM(b1.THOUSAND),
       DECIMAL_INT(64, 32)) / cast(T_FUN_COUNT(b1.THOUSAND), DECIMAL_INT(20, 0)), DECIMAL(14, 4))]), filter(nil), rowset=256
      group(nil), agg_func([T_FUN_SUM(a2.THOUSAND)], [T_FUN_COUNT(a2.THOUSAND)], [T_FUN_SUM(b1.THOUSAND)], [T_FUN_COUNT(b1.THOUSAND)])
  1 - output([a2.THOUSAND], [b1.THOUSAND]), filter(nil), rowset=256
      equal_conds([a2.UNIQUE1 = b1.UNIQUE1]), other_conds(nil)
  2 - output([b1.UNIQUE1], [b1.THOUSAND]), filter(nil), rowset=256
      access([b1.UNIQUE1], [b1.THOUSAND]), partitions(p0)
      is_index_back=false, is_global_index=false, 
      range_key([b1.__pk_increment]), range(MIN ; MAX)always true
  3 - output([a2.UNIQUE1], [a2.THOUSAND]), filter([cast(a2.HUNDRED, DECIMAL(10, 0)) >= cast(cast(cast(a2.HUNDRED, DECIMAL_INT(32, 0)), DECIMAL_INT(64, 32)) 
      / cast(CASE WHEN a2.HUNDRED IS NOT NULL THEN 1 ELSE 0 END, DECIMAL_INT(20, 0)), DECIMAL(14, 4))]), rowset=256
      access([a2.UNIQUE1], [a2.HUNDRED], [a2.THOUSAND]), partitions(p0)
      is_index_back=false, is_global_index=false, filter_before_indexback[false], 
      range_key([a2.__pk_increment]), range(MIN ; MAX)always true
select /*+use_merge(a1 b1)*/ avg(a1.thousand), avg(b1.thousand) from t2_100 a1, t1_100 b1 where a1.unique1 = b1.unique1 and a1.hundred >= (select avg(a2.hundred) from t2_100 a2 where a2.unique1 = b1.unique1);
+------------------+------------------+
| avg(a1.thousand) | avg(b1.thousand) |
+------------------+------------------+
|          49.5000 |          49.5000 |
+------------------+------------------+
EXPLAIN select /*+no_unnest(@qb1), use_merge(a1 b1)*/ avg(a1.thousand), avg(b1.thousand) from t2_100 a1, t1_100 b1 where a1.unique1 = b1.unique1 and a1.hundred >= (select /*+qb_name(qb1)*/avg(a2.hundred) from t2_100 a2 where a2.unique1 = b1.unique1);
Query Plan
=====================================================================
|ID|OPERATOR               |NAME              |EST.ROWS|EST.TIME(us)|
---------------------------------------------------------------------
|0 |SCALAR GROUP BY        |                  |1       |2324        |
|1 |└─SUBPLAN FILTER       |                  |34      |2322        |
|2 |  ├─MERGE JOIN         |                  |100     |69          |
|3 |  │ ├─SORT             |                  |100     |26          |
|4 |  │ │ └─TABLE FULL SCAN|b1                |100     |6           |
|5 |  │ └─SORT             |                  |100     |31          |
|6 |  │   └─TABLE FULL SCAN|a1                |100     |8           |
|7 |  └─SCALAR GROUP BY    |                  |1       |23          |
|8 |    └─TABLE GET        |a2(T2_100_UNIQUE1)|1       |23          |
=====================================================================
Outputs & filters:
-------------------------------------
  0 - output([cast(cast(T_FUN_SUM(a1.THOUSAND), DECIMAL_INT(64, 32)) / cast(T_FUN_COUNT(a1.THOUSAND), DECIMAL_INT(20, 0)), DECIMAL(14, 4))], [cast(cast(T_FUN_SUM(b1.THOUSAND),
       DECIMAL_INT(64, 32)) / cast(T_FUN_COUNT(b1.THOUSAND), DECIMAL_INT(20, 0)), DECIMAL(14, 4))]), filter(nil), rowset=256
      group(nil), agg_func([T_FUN_SUM(a1.THOUSAND)], [T_FUN_COUNT(a1.THOUSAND)], [T_FUN_SUM(b1.THOUSAND)], [T_FUN_COUNT(b1.THOUSAND)])
  1 - output([a1.THOUSAND], [b1.THOUSAND]), filter([cast(a1.HUNDRED, DECIMAL(10, 0)) >= subquery(1)]), rowset=256
      exec_params_([b1.UNIQUE1(:0)]), onetime_exprs_(nil), init_plan_idxs_(nil), use_batch=false
  2 - output([a1.THOUSAND], [b1.THOUSAND], [b1.UNIQUE1], [a1.HUNDRED]), filter(nil), rowset=256
      equal_conds([a1.UNIQUE1 = b1.UNIQUE1]), other_conds(nil)
      merge_directions([ASC])
  3 - output([b1.THOUSAND], [b1.UNIQUE1]), filter(nil), rowset=256
      sort_keys([b1.UNIQUE1, ASC])
  4 - output([b1.UNIQUE1], [b1.THOUSAND]), filter(nil), rowset=256
      access([b1.UNIQUE1], [b1.THOUSAND]), partitions(p0)
      is_index_back=false, is_global_index=false, 
      range_key([b1.__pk_increment]), range(MIN ; MAX)always true
  5 - output([a1.THOUSAND], [a1.UNIQUE1], [a1.HUNDRED]), filter(nil), rowset=256
      sort_keys([a1.UNIQUE1, ASC])
  6 - output([a1.UNIQUE1], [a1.HUNDRED], [a1.THOUSAND]), filter(nil), rowset=256
      access([a1.UNIQUE1], [a1.HUNDRED], [a1.THOUSAND]), partitions(p0)
      is_index_back=false, is_global_index=false, 
      range_key([a1.__pk_increment]), range(MIN ; MAX)always true
  7 - output([cast(cast(T_FUN_SUM(a2.HUNDRED), DECIMAL_INT(64, 32)) / cast(T_FUN_COUNT(a2.HUNDRED), DECIMAL_INT(20, 0)), DECIMAL(14, 4))]), filter(nil), rowset=256
      group(nil), agg_func([T_FUN_SUM(a2.HUNDRED)], [T_FUN_COUNT(a2.HUNDRED)])
  8 - output([a2.HUNDRED]), filter(nil), rowset=256
      access([a2.__pk_increment], [a2.HUNDRED]), partitions(p0)
      is_index_back=true, is_global_index=false, 
      range_key([a2.UNIQUE1], [a2.shadow_pk_0]), range(MIN,MIN ; MAX,MAX)always true, 
      range_cond([a2.UNIQUE1 = :0])
select /*+no_unnest(@qb1), use_merge(a1 b1)*/ avg(a1.thousand), avg(b1.thousand) from t2_100 a1, t1_100 b1 where a1.unique1 = b1.unique1 and a1.hundred >= (select /*+qb_name(qb1)*/avg(a2.hundred) from t2_100 a2 where a2.unique1 = b1.unique1);
+------------------+------------------+
| avg(a1.thousand) | avg(b1.thousand) |
+------------------+------------------+
|          49.5000 |          49.5000 |
+------------------+------------------+

## 内层有未映射的表
EXPLAIN select avg(a1.thousand) from t2_100 a1 where a1.hundred >= (select avg(a2.hundred) from t2_100 a2, t1_100 b1 where a1.ten = a2.ten and a2.unique1 = b1.unique1);
Query Plan
==========================================================
|ID|OPERATOR                 |NAME |EST.ROWS|EST.TIME(us)|
----------------------------------------------------------
|0 |SCALAR GROUP BY          |     |1       |78          |
|1 |└─HASH JOIN              |     |10      |78          |
|2 |  ├─SUBPLAN SCAN         |VIEW1|10      |56          |
|3 |  │ └─HASH GROUP BY      |     |10      |56          |
|4 |  │   └─HASH JOIN        |     |100     |43          |
|5 |  │     ├─TABLE FULL SCAN|b1   |100     |4           |
|6 |  │     └─TABLE FULL SCAN|a2   |100     |8           |
|7 |  └─TABLE FULL SCAN      |a1   |100     |8           |
==========================================================
Outputs & filters:
-------------------------------------
  0 - output([cast(cast(T_FUN_SUM(a1.THOUSAND), DECIMAL_INT(64, 32)) / cast(T_FUN_COUNT(a1.THOUSAND), DECIMAL_INT(20, 0)), DECIMAL(14, 4))]), filter(nil), rowset=256
      group(nil), agg_func([T_FUN_SUM(a1.THOUSAND)], [T_FUN_COUNT(a1.THOUSAND)])
  1 - output([a1.THOUSAND]), filter(nil), rowset=256
      equal_conds([a1.TEN = VIEW1.a2.TEN]), other_conds([cast(a1.HUNDRED, DECIMAL(10, 0)) >= VIEW1.avg(a2.hundred)])
  2 - output([VIEW1.avg(a2.hundred)], [VIEW1.a2.TEN]), filter(nil), rowset=256
      access([VIEW1.avg(a2.hundred)], [VIEW1.a2.TEN])
  3 - output([cast(cast(T_FUN_SUM(a2.HUNDRED), DECIMAL_INT(64, 32)) / cast(T_FUN_COUNT(a2.HUNDRED), DECIMAL_INT(20, 0)), DECIMAL(14, 4))], [a2.TEN]), filter(nil), rowset=256
      group([a2.TEN]), agg_func([T_FUN_SUM(a2.HUNDRED)], [T_FUN_COUNT(a2.HUNDRED)])
  4 - output([a2.TEN], [a2.HUNDRED]), filter(nil), rowset=256
      equal_conds([a2.UNIQUE1 = b1.UNIQUE1]), other_conds(nil)
  5 - output([b1.UNIQUE1]), filter(nil), rowset=256
      access([b1.UNIQUE1]), partitions(p0)
      is_index_back=false, is_global_index=false, 
      range_key([b1.__pk_increment]), range(MIN ; MAX)always true
  6 - output([a2.TEN], [a2.UNIQUE1], [a2.HUNDRED]), filter(nil), rowset=256
      access([a2.TEN], [a2.UNIQUE1], [a2.HUNDRED]), partitions(p0)
      is_index_back=false, is_global_index=false, 
      range_key([a2.__pk_increment]), range(MIN ; MAX)always true
  7 - output([a1.TEN], [a1.HUNDRED], [a1.THOUSAND]), filter(nil), rowset=256
      access([a1.TEN], [a1.HUNDRED], [a1.THOUSAND]), partitions(p0)
      is_index_back=false, is_global_index=false, 
      range_key([a1.__pk_increment]), range(MIN ; MAX)always true
select avg(a1.thousand) from t2_100 a1 where a1.hundred >= (select avg(a2.hundred) from t2_100 a2, t1_100 b1 where a1.ten = a2.ten and a2.unique1 = b1.unique1);
+------------------+
| avg(a1.thousand) |
+------------------+
|          74.5000 |
+------------------+
EXPLAIN select /*+no_unnest(@qb1)*/ avg(a1.thousand) from t2_100 a1 where a1.hundred >= (select /*+qb_name(qb1)*/avg(a2.hundred) from t2_100 a2, t1_100 b1 where a1.ten = a2.ten and a2.unique1 = b1.unique1);
Query Plan
==================================================================
|ID|OPERATOR                |NAME          |EST.ROWS|EST.TIME(us)|
------------------------------------------------------------------
|0 |SCALAR GROUP BY         |              |1       |7609        |
|1 |└─SUBPLAN FILTER        |              |34      |7608        |
|2 |  ├─TABLE FULL SCAN     |a1            |100     |8           |
|3 |  └─SCALAR GROUP BY     |              |1       |76          |
|4 |    └─HASH JOIN         |              |10      |76          |
|5 |      ├─TABLE RANGE SCAN|a2(T2_100_TEN)|10      |46          |
|6 |      └─TABLE FULL SCAN |b1            |100     |18          |
==================================================================
Outputs & filters:
-------------------------------------
  0 - output([cast(cast(T_FUN_SUM(a1.THOUSAND), DECIMAL_INT(64, 32)) / cast(T_FUN_COUNT(a1.THOUSAND), DECIMAL_INT(20, 0)), DECIMAL(14, 4))]), filter(nil), rowset=256
      group(nil), agg_func([T_FUN_SUM(a1.THOUSAND)], [T_FUN_COUNT(a1.THOUSAND)])
  1 - output([a1.THOUSAND]), filter([cast(a1.HUNDRED, DECIMAL(10, 0)) >= subquery(1)]), rowset=256
      exec_params_([a1.TEN(:0)]), onetime_exprs_(nil), init_plan_idxs_(nil), use_batch=false
  2 - output([a1.TEN], [a1.HUNDRED], [a1.THOUSAND]), filter(nil), rowset=256
      access([a1.TEN], [a1.HUNDRED], [a1.THOUSAND]), partitions(p0)
      is_index_back=false, is_global_index=false, 
      range_key([a1.__pk_increment]), range(MIN ; MAX)always true
  3 - output([cast(cast(T_FUN_SUM(a2.HUNDRED), DECIMAL_INT(64, 32)) / cast(T_FUN_COUNT(a2.HUNDRED), DECIMAL_INT(20, 0)), DECIMAL(14, 4))]), filter(nil), rowset=256
      group(nil), agg_func([T_FUN_SUM(a2.HUNDRED)], [T_FUN_COUNT(a2.HUNDRED)])
  4 - output([a2.HUNDRED]), filter(nil), rowset=256
      equal_conds([a2.UNIQUE1 = b1.UNIQUE1]), other_conds(nil)
  5 - output([a2.UNIQUE1], [a2.HUNDRED]), filter(nil), rowset=256
      access([a2.__pk_increment], [a2.UNIQUE1], [a2.HUNDRED]), partitions(p0)
      is_index_back=true, is_global_index=false, 
      range_key([a2.TEN], [a2.__pk_increment]), range(MIN,MIN ; MAX,MAX)always true, 
      range_cond([:0 = a2.TEN])
  6 - output([b1.UNIQUE1]), filter(nil), rowset=256
      access([b1.UNIQUE1]), partitions(p0)
      is_index_back=false, is_global_index=false, 
      range_key([b1.__pk_increment]), range(MIN ; MAX)always true
select /*+no_unnest(@qb1)*/ avg(a1.thousand) from t2_100 a1 where a1.hundred >= (select /*+qb_name(qb1)*/avg(a2.hundred) from t2_100 a2, t1_100 b1 where a1.ten = a2.ten and a2.unique1 = b1.unique1);
+------------------+
| avg(a1.thousand) |
+------------------+
|          74.5000 |
+------------------+

## 特殊位置的聚合子查询
EXPLAIN select avg(a1.thousand) from t2_100 a1 group by a1.ten having max(a1.hundred) >= (select avg(a2.hundred) from t2_100 a2 where a2.ten = a1.ten);
Query Plan
=================================================
|ID|OPERATOR         |NAME|EST.ROWS|EST.TIME(us)|
-------------------------------------------------
|0 |HASH GROUP BY    |    |1       |29          |
|1 |└─TABLE FULL SCAN|a1  |100     |11          |
=================================================
Outputs & filters:
-------------------------------------
  0 - output([cast(cast(T_FUN_SUM(a1.THOUSAND), DECIMAL_INT(64, 32)) / cast(T_FUN_COUNT(a1.THOUSAND), DECIMAL_INT(20, 0)), DECIMAL(14, 4))]), filter([cast(T_FUN_MAX(a1.HUNDRED),
       DECIMAL(10, 0)) >= cast(cast(T_FUN_SUM(a1.HUNDRED), DECIMAL_INT(64, 32)) / cast(T_FUN_COUNT(a1.HUNDRED), DECIMAL_INT(20, 0)), DECIMAL(14, 4))]), rowset=256
      group([a1.TEN]), agg_func([T_FUN_MAX(a1.HUNDRED)], [T_FUN_SUM(a1.THOUSAND)], [T_FUN_COUNT(a1.THOUSAND)], [T_FUN_SUM(a1.HUNDRED)], [T_FUN_COUNT(a1.HUNDRED)])
  1 - output([a1.THOUSAND], [a1.TEN], [a1.HUNDRED]), filter([a1.TEN IS NOT NULL]), rowset=256
      access([a1.THOUSAND], [a1.TEN], [a1.HUNDRED]), partitions(p0)
      is_index_back=false, is_global_index=false, filter_before_indexback[false], 
      range_key([a1.__pk_increment]), range(MIN ; MAX)always true
select avg(a1.thousand) from t2_100 a1 group by a1.ten having max(a1.hundred) >= (select avg(a2.hundred) from t2_100 a2 where a2.ten = a1.ten);
+------------------+
| avg(a1.thousand) |
+------------------+
|          45.0000 |
|          46.0000 |
|          47.0000 |
|          48.0000 |
|          49.0000 |
|          50.0000 |
|          51.0000 |
|          52.0000 |
|          53.0000 |
|          54.0000 |
+------------------+
EXPLAIN select /*+no_unnest(@qb1)*/ avg(a1.thousand) from t2_100 a1 group by a1.ten having max(a1.hundred) >= (select /*+qb_name(qb1)*/avg(a2.hundred) from t2_100 a2 where a2.ten = a1.ten);
Query Plan
==============================================================
|ID|OPERATOR            |NAME          |EST.ROWS|EST.TIME(us)|
--------------------------------------------------------------
|0 |SUBPLAN FILTER      |              |1       |474         |
|1 |├─HASH GROUP BY     |              |10      |23          |
|2 |│ └─TABLE FULL SCAN |a1            |100     |8           |
|3 |└─SCALAR GROUP BY   |              |1       |46          |
|4 |  └─TABLE RANGE SCAN|a2(T2_100_TEN)|10      |45          |
==============================================================
Outputs & filters:
-------------------------------------
  0 - output([cast(cast(T_FUN_SUM(a1.THOUSAND), DECIMAL_INT(64, 32)) / cast(T_FUN_COUNT(a1.THOUSAND), DECIMAL_INT(20, 0)), DECIMAL(14, 4))]), filter([cast(T_FUN_MAX(a1.HUNDRED),
       DECIMAL(10, 0)) >= subquery(1)]), rowset=256
      exec_params_([a1.TEN(:0)]), onetime_exprs_(nil), init_plan_idxs_(nil), use_batch=false
  1 - output([a1.TEN], [T_FUN_MAX(a1.HUNDRED)], [T_FUN_SUM(a1.THOUSAND)], [T_FUN_COUNT(a1.THOUSAND)]), filter(nil), rowset=256
      group([a1.TEN]), agg_func([T_FUN_MAX(a1.HUNDRED)], [T_FUN_SUM(a1.THOUSAND)], [T_FUN_COUNT(a1.THOUSAND)])
  2 - output([a1.THOUSAND], [a1.TEN], [a1.HUNDRED]), filter(nil), rowset=256
      access([a1.THOUSAND], [a1.TEN], [a1.HUNDRED]), partitions(p0)
      is_index_back=false, is_global_index=false, 
      range_key([a1.__pk_increment]), range(MIN ; MAX)always true
  3 - output([cast(cast(T_FUN_SUM(a2.HUNDRED), DECIMAL_INT(64, 32)) / cast(T_FUN_COUNT(a2.HUNDRED), DECIMAL_INT(20, 0)), DECIMAL(14, 4))]), filter(nil), rowset=256
      group(nil), agg_func([T_FUN_SUM(a2.HUNDRED)], [T_FUN_COUNT(a2.HUNDRED)])
  4 - output([a2.HUNDRED]), filter(nil), rowset=256
      access([a2.__pk_increment], [a2.HUNDRED]), partitions(p0)
      is_index_back=true, is_global_index=false, 
      range_key([a2.TEN], [a2.__pk_increment]), range(MIN,MIN ; MAX,MAX)always true, 
      range_cond([a2.TEN = :0])
select /*+no_unnest(@qb1)*/ avg(a1.thousand) from t2_100 a1 group by a1.ten having max(a1.hundred) >= (select /*+qb_name(qb1)*/avg(a2.hundred) from t2_100 a2 where a2.ten = a1.ten);
+------------------+
| avg(a1.thousand) |
+------------------+
|          45.0000 |
|          46.0000 |
|          47.0000 |
|          48.0000 |
|          49.0000 |
|          50.0000 |
|          51.0000 |
|          52.0000 |
|          53.0000 |
|          54.0000 |
+------------------+

EXPLAIN select (select avg(a2.hundred) from t2_100 a2 where a2.unique1 = b1.unique1) v1, b1.thousand from t2_100 a1, t1_100 b1 where a1.unique1 = b1.unique1;
Query Plan
===================================================================
|ID|OPERATOR             |NAME              |EST.ROWS|EST.TIME(us)|
-------------------------------------------------------------------
|0 |SUBPLAN FILTER       |                  |100     |2291        |
|1 |├─MERGE JOIN         |                  |100     |38          |
|2 |│ ├─TABLE FULL SCAN  |a1(T2_100_UNIQUE1)|100     |4           |
|3 |│ └─SORT             |                  |100     |26          |
|4 |│   └─TABLE FULL SCAN|b1                |100     |6           |
|5 |└─SCALAR GROUP BY    |                  |1       |23          |
|6 |  └─TABLE GET        |a2(T2_100_UNIQUE1)|1       |23          |
===================================================================
Outputs & filters:
-------------------------------------
  0 - output([subquery(1)], [b1.THOUSAND]), filter(nil), rowset=256
      exec_params_([b1.UNIQUE1(:0)]), onetime_exprs_(nil), init_plan_idxs_(nil), use_batch=false
  1 - output([b1.UNIQUE1], [b1.THOUSAND]), filter(nil), rowset=256
      equal_conds([a1.UNIQUE1 = b1.UNIQUE1]), other_conds(nil)
      merge_directions([ASC])
  2 - output([a1.UNIQUE1]), filter(nil), rowset=256
      access([a1.UNIQUE1]), partitions(p0)
      is_index_back=false, is_global_index=false, 
      range_key([a1.UNIQUE1], [a1.shadow_pk_0]), range(MIN,MIN ; MAX,MAX)always true
  3 - output([b1.UNIQUE1], [b1.THOUSAND]), filter(nil), rowset=256
      sort_keys([b1.UNIQUE1, ASC])
  4 - output([b1.UNIQUE1], [b1.THOUSAND]), filter(nil), rowset=256
      access([b1.UNIQUE1], [b1.THOUSAND]), partitions(p0)
      is_index_back=false, is_global_index=false, 
      range_key([b1.__pk_increment]), range(MIN ; MAX)always true
  5 - output([cast(cast(T_FUN_SUM(a2.HUNDRED), DECIMAL_INT(64, 32)) / cast(T_FUN_COUNT(a2.HUNDRED), DECIMAL_INT(20, 0)), DECIMAL(14, 4))]), filter(nil), rowset=256
      group(nil), agg_func([T_FUN_SUM(a2.HUNDRED)], [T_FUN_COUNT(a2.HUNDRED)])
  6 - output([a2.HUNDRED]), filter(nil), rowset=256
      access([a2.__pk_increment], [a2.HUNDRED]), partitions(p0)
      is_index_back=true, is_global_index=false, 
      range_key([a2.UNIQUE1], [a2.shadow_pk_0]), range(MIN,MIN ; MAX,MAX)always true, 
      range_cond([a2.UNIQUE1 = :0])
select (select avg(a2.hundred) from t2_100 a2 where a2.unique1 = b1.unique1) v1, b1.thousand from t2_100 a1, t1_100 b1 where a1.unique1 = b1.unique1;
+---------+----------+
| v1      | thousand |
+---------+----------+
|  0.0000 |        0 |
|  1.0000 |        1 |
|  2.0000 |        2 |
|  3.0000 |        3 |
|  4.0000 |        4 |
|  5.0000 |        5 |
|  6.0000 |        6 |
|  7.0000 |        7 |
|  8.0000 |        8 |
|  9.0000 |        9 |
| 10.0000 |       10 |
| 11.0000 |       11 |
| 12.0000 |       12 |
| 13.0000 |       13 |
| 14.0000 |       14 |
| 15.0000 |       15 |
| 16.0000 |       16 |
| 17.0000 |       17 |
| 18.0000 |       18 |
| 19.0000 |       19 |
| 20.0000 |       20 |
| 21.0000 |       21 |
| 22.0000 |       22 |
| 23.0000 |       23 |
| 24.0000 |       24 |
| 25.0000 |       25 |
| 26.0000 |       26 |
| 27.0000 |       27 |
| 28.0000 |       28 |
| 29.0000 |       29 |
| 30.0000 |       30 |
| 31.0000 |       31 |
| 32.0000 |       32 |
| 33.0000 |       33 |
| 34.0000 |       34 |
| 35.0000 |       35 |
| 36.0000 |       36 |
| 37.0000 |       37 |
| 38.0000 |       38 |
| 39.0000 |       39 |
| 40.0000 |       40 |
| 41.0000 |       41 |
| 42.0000 |       42 |
| 43.0000 |       43 |
| 44.0000 |       44 |
| 45.0000 |       45 |
| 46.0000 |       46 |
| 47.0000 |       47 |
| 48.0000 |       48 |
| 49.0000 |       49 |
| 50.0000 |       50 |
| 51.0000 |       51 |
| 52.0000 |       52 |
| 53.0000 |       53 |
| 54.0000 |       54 |
| 55.0000 |       55 |
| 56.0000 |       56 |
| 57.0000 |       57 |
| 58.0000 |       58 |
| 59.0000 |       59 |
| 60.0000 |       60 |
| 61.0000 |       61 |
| 62.0000 |       62 |
| 63.0000 |       63 |
| 64.0000 |       64 |
| 65.0000 |       65 |
| 66.0000 |       66 |
| 67.0000 |       67 |
| 68.0000 |       68 |
| 69.0000 |       69 |
| 70.0000 |       70 |
| 71.0000 |       71 |
| 72.0000 |       72 |
| 73.0000 |       73 |
| 74.0000 |       74 |
| 75.0000 |       75 |
| 76.0000 |       76 |
| 77.0000 |       77 |
| 78.0000 |       78 |
| 79.0000 |       79 |
| 80.0000 |       80 |
| 81.0000 |       81 |
| 82.0000 |       82 |
| 83.0000 |       83 |
| 84.0000 |       84 |
| 85.0000 |       85 |
| 86.0000 |       86 |
| 87.0000 |       87 |
| 88.0000 |       88 |
| 89.0000 |       89 |
| 90.0000 |       90 |
| 91.0000 |       91 |
| 92.0000 |       92 |
| 93.0000 |       93 |
| 94.0000 |       94 |
| 95.0000 |       95 |
| 96.0000 |       96 |
| 97.0000 |       97 |
| 98.0000 |       98 |
| 99.0000 |       99 |
+---------+----------+
EXPLAIN select /*+no_unnest(@qb1)*/ (select /*+qb_name(qb1)*/avg(a2.hundred) from t2_100 a2 where a2.unique1 = b1.unique1) v1, b1.thousand from t2_100 a1, t1_100 b1 where a1.unique1 = b1.unique1;
Query Plan
===================================================================
|ID|OPERATOR             |NAME              |EST.ROWS|EST.TIME(us)|
-------------------------------------------------------------------
|0 |SUBPLAN FILTER       |                  |100     |2291        |
|1 |├─MERGE JOIN         |                  |100     |38          |
|2 |│ ├─TABLE FULL SCAN  |a1(T2_100_UNIQUE1)|100     |4           |
|3 |│ └─SORT             |                  |100     |26          |
|4 |│   └─TABLE FULL SCAN|b1                |100     |6           |
|5 |└─SCALAR GROUP BY    |                  |1       |23          |
|6 |  └─TABLE GET        |a2(T2_100_UNIQUE1)|1       |23          |
===================================================================
Outputs & filters:
-------------------------------------
  0 - output([subquery(1)], [b1.THOUSAND]), filter(nil), rowset=256
      exec_params_([b1.UNIQUE1(:0)]), onetime_exprs_(nil), init_plan_idxs_(nil), use_batch=false
  1 - output([b1.UNIQUE1], [b1.THOUSAND]), filter(nil), rowset=256
      equal_conds([a1.UNIQUE1 = b1.UNIQUE1]), other_conds(nil)
      merge_directions([ASC])
  2 - output([a1.UNIQUE1]), filter(nil), rowset=256
      access([a1.UNIQUE1]), partitions(p0)
      is_index_back=false, is_global_index=false, 
      range_key([a1.UNIQUE1], [a1.shadow_pk_0]), range(MIN,MIN ; MAX,MAX)always true
  3 - output([b1.UNIQUE1], [b1.THOUSAND]), filter(nil), rowset=256
      sort_keys([b1.UNIQUE1, ASC])
  4 - output([b1.UNIQUE1], [b1.THOUSAND]), filter(nil), rowset=256
      access([b1.UNIQUE1], [b1.THOUSAND]), partitions(p0)
      is_index_back=false, is_global_index=false, 
      range_key([b1.__pk_increment]), range(MIN ; MAX)always true
  5 - output([cast(cast(T_FUN_SUM(a2.HUNDRED), DECIMAL_INT(64, 32)) / cast(T_FUN_COUNT(a2.HUNDRED), DECIMAL_INT(20, 0)), DECIMAL(14, 4))]), filter(nil), rowset=256
      group(nil), agg_func([T_FUN_SUM(a2.HUNDRED)], [T_FUN_COUNT(a2.HUNDRED)])
  6 - output([a2.HUNDRED]), filter(nil), rowset=256
      access([a2.__pk_increment], [a2.HUNDRED]), partitions(p0)
      is_index_back=true, is_global_index=false, 
      range_key([a2.UNIQUE1], [a2.shadow_pk_0]), range(MIN,MIN ; MAX,MAX)always true, 
      range_cond([a2.UNIQUE1 = :0])
select /*+no_unnest(@qb1)*/ (select /*+qb_name(qb1)*/avg(a2.hundred) from t2_100 a2 where a2.unique1 = b1.unique1) v1, b1.thousand from t2_100 a1, t1_100 b1 where a1.unique1 = b1.unique1;
+---------+----------+
| v1      | thousand |
+---------+----------+
|  0.0000 |        0 |
|  1.0000 |        1 |
|  2.0000 |        2 |
|  3.0000 |        3 |
|  4.0000 |        4 |
|  5.0000 |        5 |
|  6.0000 |        6 |
|  7.0000 |        7 |
|  8.0000 |        8 |
|  9.0000 |        9 |
| 10.0000 |       10 |
| 11.0000 |       11 |
| 12.0000 |       12 |
| 13.0000 |       13 |
| 14.0000 |       14 |
| 15.0000 |       15 |
| 16.0000 |       16 |
| 17.0000 |       17 |
| 18.0000 |       18 |
| 19.0000 |       19 |
| 20.0000 |       20 |
| 21.0000 |       21 |
| 22.0000 |       22 |
| 23.0000 |       23 |
| 24.0000 |       24 |
| 25.0000 |       25 |
| 26.0000 |       26 |
| 27.0000 |       27 |
| 28.0000 |       28 |
| 29.0000 |       29 |
| 30.0000 |       30 |
| 31.0000 |       31 |
| 32.0000 |       32 |
| 33.0000 |       33 |
| 34.0000 |       34 |
| 35.0000 |       35 |
| 36.0000 |       36 |
| 37.0000 |       37 |
| 38.0000 |       38 |
| 39.0000 |       39 |
| 40.0000 |       40 |
| 41.0000 |       41 |
| 42.0000 |       42 |
| 43.0000 |       43 |
| 44.0000 |       44 |
| 45.0000 |       45 |
| 46.0000 |       46 |
| 47.0000 |       47 |
| 48.0000 |       48 |
| 49.0000 |       49 |
| 50.0000 |       50 |
| 51.0000 |       51 |
| 52.0000 |       52 |
| 53.0000 |       53 |
| 54.0000 |       54 |
| 55.0000 |       55 |
| 56.0000 |       56 |
| 57.0000 |       57 |
| 58.0000 |       58 |
| 59.0000 |       59 |
| 60.0000 |       60 |
| 61.0000 |       61 |
| 62.0000 |       62 |
| 63.0000 |       63 |
| 64.0000 |       64 |
| 65.0000 |       65 |
| 66.0000 |       66 |
| 67.0000 |       67 |
| 68.0000 |       68 |
| 69.0000 |       69 |
| 70.0000 |       70 |
| 71.0000 |       71 |
| 72.0000 |       72 |
| 73.0000 |       73 |
| 74.0000 |       74 |
| 75.0000 |       75 |
| 76.0000 |       76 |
| 77.0000 |       77 |
| 78.0000 |       78 |
| 79.0000 |       79 |
| 80.0000 |       80 |
| 81.0000 |       81 |
| 82.0000 |       82 |
| 83.0000 |       83 |
| 84.0000 |       84 |
| 85.0000 |       85 |
| 86.0000 |       86 |
| 87.0000 |       87 |
| 88.0000 |       88 |
| 89.0000 |       89 |
| 90.0000 |       90 |
| 91.0000 |       91 |
| 92.0000 |       92 |
| 93.0000 |       93 |
| 94.0000 |       94 |
| 95.0000 |       95 |
| 96.0000 |       96 |
| 97.0000 |       97 |
| 98.0000 |       98 |
| 99.0000 |       99 |
+---------+----------+

EXPLAIN select sum((select sum(t2.hundred) from t2_100 t2)) from t2_100 t1;
Query Plan
==============================================================================
|ID|OPERATOR                     |NAME                 |EST.ROWS|EST.TIME(us)|
------------------------------------------------------------------------------
|0 |SCALAR GROUP BY              |                     |1       |14          |
|1 |└─NESTED-LOOP JOIN CARTESIAN |                     |100     |12          |
|2 |  ├─SUBPLAN SCAN             |VIEW1                |1       |6           |
|3 |  │ └─SCALAR GROUP BY        |                     |1       |6           |
|4 |  │   └─TABLE FULL SCAN      |t2                   |100     |4           |
|5 |  └─TABLE FULL SCAN          |t1(T2_100_VCHAR_HUND)|100     |3           |
==============================================================================
Outputs & filters:
-------------------------------------
  0 - output([T_FUN_SUM(VIEW1.sum(t2.hundred))]), filter(nil), rowset=256
      group(nil), agg_func([T_FUN_SUM(VIEW1.sum(t2.hundred))])
  1 - output([VIEW1.sum(t2.hundred)]), filter(nil), rowset=256
      conds(nil), nl_params_(nil), use_batch=false
  2 - output([VIEW1.sum(t2.hundred)]), filter(nil), rowset=256
      access([VIEW1.sum(t2.hundred)])
  3 - output([T_FUN_SUM(T_FUN_SUM(t2.HUNDRED))]), filter(nil), rowset=256
      group(nil), agg_func([T_FUN_SUM(T_FUN_SUM(t2.HUNDRED))])
  4 - output([T_FUN_SUM(t2.HUNDRED)]), filter(nil), rowset=256
      access([t2.HUNDRED]), partitions(p0)
      is_index_back=false, is_global_index=false, 
      range_key([t2.__pk_increment]), range(MIN ; MAX)always true, 
      pushdown_aggregation([T_FUN_SUM(t2.HUNDRED)])
  5 - output(nil), filter(nil), rowset=256
      access(nil), partitions(p0)
      is_index_back=false, is_global_index=false, 
      range_key([t1.VCHAR_HUND], [t1.__pk_increment]), range(MIN,MIN ; MAX,MAX)always true
select sum((select sum(t2.hundred) from t2_100 t2)) from t2_100 t1;
+----------------------------------------------+
| sum((select sum(t2.hundred) from t2_100 t2)) |
+----------------------------------------------+
|                                       495000 |
+----------------------------------------------+
EXPLAIN select /*+no_unnest(@qb1)*/ sum((select /*+qb_name(qb1)*/sum(t2.hundred) from t2_100 t2)) from t2_100 t1;
Query Plan
======================================================================
|ID|OPERATOR             |NAME                 |EST.ROWS|EST.TIME(us)|
----------------------------------------------------------------------
|0 |SCALAR GROUP BY      |                     |1       |11          |
|1 |└─SUBPLAN FILTER     |                     |100     |9           |
|2 |  ├─TABLE FULL SCAN  |t1(T2_100_VCHAR_HUND)|100     |3           |
|3 |  └─SCALAR GROUP BY  |                     |1       |6           |
|4 |    └─TABLE FULL SCAN|t2(T2_100_HUNDRED)   |100     |4           |
======================================================================
Outputs & filters:
-------------------------------------
  0 - output([T_FUN_SUM(:0)]), filter(nil), rowset=256
      group(nil), agg_func([T_FUN_SUM(:0)])
  1 - output([:0]), filter(nil), rowset=256
      exec_params_(nil), onetime_exprs_([subquery(1)(:0)]), init_plan_idxs_(nil), use_batch=false
  2 - output(nil), filter(nil), rowset=256
      access(nil), partitions(p0)
      is_index_back=false, is_global_index=false, 
      range_key([t1.VCHAR_HUND], [t1.__pk_increment]), range(MIN,MIN ; MAX,MAX)always true
  3 - output([T_FUN_SUM(T_FUN_SUM(t2.HUNDRED))]), filter(nil), rowset=256
      group(nil), agg_func([T_FUN_SUM(T_FUN_SUM(t2.HUNDRED))])
  4 - output([T_FUN_SUM(t2.HUNDRED)]), filter(nil), rowset=256
      access([t2.HUNDRED]), partitions(p0)
      is_index_back=false, is_global_index=false, 
      range_key([t2.HUNDRED], [t2.__pk_increment]), range(MIN,MIN ; MAX,MAX)always true, 
      pushdown_aggregation([T_FUN_SUM(t2.HUNDRED)])
select /*+no_unnest(@qb1)*/ sum((select /*+qb_name(qb1)*/sum(t2.hundred) from t2_100 t2)) from t2_100 t1;
+---------------------------------------------------------------+
| sum((select /*+qb_name(qb1)*/sum(t2.hundred) from t2_100 t2)) |
+---------------------------------------------------------------+
|                                                        495000 |
+---------------------------------------------------------------+

EXPLAIN select sum((select sum(t2.hundred) from t2_100 t2)) from t2_100 t1 group by t1.ten;
Query Plan
=====================================================================
|ID|OPERATOR                   |NAME          |EST.ROWS|EST.TIME(us)|
---------------------------------------------------------------------
|0 |NESTED-LOOP JOIN CARTESIAN |              |10      |14          |
|1 |├─SUBPLAN SCAN             |VIEW1         |1       |6           |
|2 |│ └─SCALAR GROUP BY        |              |1       |6           |
|3 |│   └─TABLE FULL SCAN      |t2            |100     |4           |
|4 |└─SUBPLAN SCAN             |VIEW2         |10      |8           |
|5 |  └─MERGE GROUP BY         |              |10      |8           |
|6 |    └─TABLE FULL SCAN      |t1(T2_100_TEN)|100     |4           |
=====================================================================
Outputs & filters:
-------------------------------------
  0 - output([cast(cast(cast(VIEW2.T_FUN_COUNT(*), DECIMAL_INT(20, 0)) * cast(VIEW1.sum(t2.hundred), DECIMAL_INT(54, 0)), DECIMAL_INT(81, 0)), DECIMAL_INT(54,
       0))]), filter(nil), rowset=256
      conds(nil), nl_params_(nil), use_batch=false
  1 - output([VIEW1.sum(t2.hundred)]), filter(nil), rowset=256
      access([VIEW1.sum(t2.hundred)])
  2 - output([T_FUN_SUM(T_FUN_SUM(t2.HUNDRED))]), filter(nil), rowset=256
      group(nil), agg_func([T_FUN_SUM(T_FUN_SUM(t2.HUNDRED))])
  3 - output([T_FUN_SUM(t2.HUNDRED)]), filter(nil), rowset=256
      access([t2.HUNDRED]), partitions(p0)
      is_index_back=false, is_global_index=false, 
      range_key([t2.__pk_increment]), range(MIN ; MAX)always true, 
      pushdown_aggregation([T_FUN_SUM(t2.HUNDRED)])
  4 - output([VIEW2.T_FUN_COUNT(*)]), filter(nil), rowset=256
      access([VIEW2.T_FUN_COUNT(*)])
  5 - output([T_FUN_COUNT(*)]), filter(nil), rowset=256
      group([t1.TEN]), agg_func([T_FUN_COUNT(*)])
  6 - output([t1.TEN]), filter(nil), rowset=256
      access([t1.TEN]), partitions(p0)
      is_index_back=false, is_global_index=false, 
      range_key([t1.TEN], [t1.__pk_increment]), range(MIN,MIN ; MAX,MAX)always true
select sum((select sum(t2.hundred) from t2_100 t2)) from t2_100 t1 group by t1.ten;
+----------------------------------------------+
| sum((select sum(t2.hundred) from t2_100 t2)) |
+----------------------------------------------+
|                                        49500 |
|                                        49500 |
|                                        49500 |
|                                        49500 |
|                                        49500 |
|                                        49500 |
|                                        49500 |
|                                        49500 |
|                                        49500 |
|                                        49500 |
+----------------------------------------------+
EXPLAIN select /*+no_unnest(@qb1)*/ sum((select /*+qb_name(qb1)*/sum(t2.hundred) from t2_100 t2)) from t2_100 t1 group by t1.ten;
Query Plan
===================================================================
|ID|OPERATOR             |NAME              |EST.ROWS|EST.TIME(us)|
-------------------------------------------------------------------
|0 |MERGE GROUP BY       |                  |10      |14          |
|1 |└─SUBPLAN FILTER     |                  |100     |11          |
|2 |  ├─TABLE FULL SCAN  |t1(T2_100_TEN)    |100     |4           |
|3 |  └─SCALAR GROUP BY  |                  |1       |6           |
|4 |    └─TABLE FULL SCAN|t2(T2_100_HUNDRED)|100     |4           |
===================================================================
Outputs & filters:
-------------------------------------
  0 - output([T_FUN_SUM(:0)]), filter(nil), rowset=256
      group([t1.TEN]), agg_func([T_FUN_SUM(:0)])
  1 - output([t1.TEN], [:0]), filter(nil), rowset=256
      exec_params_(nil), onetime_exprs_([subquery(1)(:0)]), init_plan_idxs_(nil), use_batch=false
  2 - output([t1.TEN]), filter(nil), rowset=256
      access([t1.TEN]), partitions(p0)
      is_index_back=false, is_global_index=false, 
      range_key([t1.TEN], [t1.__pk_increment]), range(MIN,MIN ; MAX,MAX)always true
  3 - output([T_FUN_SUM(T_FUN_SUM(t2.HUNDRED))]), filter(nil), rowset=256
      group(nil), agg_func([T_FUN_SUM(T_FUN_SUM(t2.HUNDRED))])
  4 - output([T_FUN_SUM(t2.HUNDRED)]), filter(nil), rowset=256
      access([t2.HUNDRED]), partitions(p0)
      is_index_back=false, is_global_index=false, 
      range_key([t2.HUNDRED], [t2.__pk_increment]), range(MIN,MIN ; MAX,MAX)always true, 
      pushdown_aggregation([T_FUN_SUM(t2.HUNDRED)])
select /*+no_unnest(@qb1)*/ sum((select /*+qb_name(qb1)*/sum(t2.hundred) from t2_100 t2)) from t2_100 t1 group by t1.ten;
+---------------------------------------------------------------+
| sum((select /*+qb_name(qb1)*/sum(t2.hundred) from t2_100 t2)) |
+---------------------------------------------------------------+
|                                                         49500 |
|                                                         49500 |
|                                                         49500 |
|                                                         49500 |
|                                                         49500 |
|                                                         49500 |
|                                                         49500 |
|                                                         49500 |
|                                                         49500 |
|                                                         49500 |
+---------------------------------------------------------------+

EXPLAIN select sum((select sum(t2.hundred) from t2_100 t2 where t2.ten = t1.ten)) from t2_100 t1;
Query Plan
================================================================
|ID|OPERATOR              |NAME          |EST.ROWS|EST.TIME(us)|
----------------------------------------------------------------
|0 |SCALAR GROUP BY       |              |1       |4500        |
|1 |└─SUBPLAN FILTER      |              |100     |4498        |
|2 |  ├─TABLE FULL SCAN   |t1(T2_100_TEN)|100     |4           |
|3 |  └─SCALAR GROUP BY   |              |1       |45          |
|4 |    └─TABLE RANGE SCAN|t2(T2_100_TEN)|10      |45          |
================================================================
Outputs & filters:
-------------------------------------
  0 - output([T_FUN_SUM(subquery(1))]), filter(nil), rowset=256
      group(nil), agg_func([T_FUN_SUM(subquery(1))])
  1 - output([subquery(1)]), filter(nil), rowset=256
      exec_params_([t1.TEN(:0)]), onetime_exprs_(nil), init_plan_idxs_(nil), use_batch=false
  2 - output([t1.TEN]), filter(nil), rowset=256
      access([t1.TEN]), partitions(p0)
      is_index_back=false, is_global_index=false, 
      range_key([t1.TEN], [t1.__pk_increment]), range(MIN,MIN ; MAX,MAX)always true
  3 - output([T_FUN_SUM(t2.HUNDRED)]), filter(nil), rowset=256
      group(nil), agg_func([T_FUN_SUM(t2.HUNDRED)])
  4 - output([t2.HUNDRED]), filter(nil), rowset=256
      access([t2.__pk_increment], [t2.HUNDRED]), partitions(p0)
      is_index_back=true, is_global_index=false, 
      range_key([t2.TEN], [t2.__pk_increment]), range(MIN,MIN ; MAX,MAX)always true, 
      range_cond([t2.TEN = :0])
select sum((select sum(t2.hundred) from t2_100 t2 where t2.ten = t1.ten)) from t2_100 t1;
+--------------------------------------------------------------------+
| sum((select sum(t2.hundred) from t2_100 t2 where t2.ten = t1.ten)) |
+--------------------------------------------------------------------+
|                                                              49500 |
+--------------------------------------------------------------------+
EXPLAIN select /*+no_unnest(@qb1)*/ sum((select /*+qb_name(qb1)*/sum(t2.hundred) from t2_100 t2 where t2.ten = t1.ten)) from t2_100 t1;
Query Plan
================================================================
|ID|OPERATOR              |NAME          |EST.ROWS|EST.TIME(us)|
----------------------------------------------------------------
|0 |SCALAR GROUP BY       |              |1       |4500        |
|1 |└─SUBPLAN FILTER      |              |100     |4498        |
|2 |  ├─TABLE FULL SCAN   |t1(T2_100_TEN)|100     |4           |
|3 |  └─SCALAR GROUP BY   |              |1       |45          |
|4 |    └─TABLE RANGE SCAN|t2(T2_100_TEN)|10      |45          |
================================================================
Outputs & filters:
-------------------------------------
  0 - output([T_FUN_SUM(subquery(1))]), filter(nil), rowset=256
      group(nil), agg_func([T_FUN_SUM(subquery(1))])
  1 - output([subquery(1)]), filter(nil), rowset=256
      exec_params_([t1.TEN(:0)]), onetime_exprs_(nil), init_plan_idxs_(nil), use_batch=false
  2 - output([t1.TEN]), filter(nil), rowset=256
      access([t1.TEN]), partitions(p0)
      is_index_back=false, is_global_index=false, 
      range_key([t1.TEN], [t1.__pk_increment]), range(MIN,MIN ; MAX,MAX)always true
  3 - output([T_FUN_SUM(t2.HUNDRED)]), filter(nil), rowset=256
      group(nil), agg_func([T_FUN_SUM(t2.HUNDRED)])
  4 - output([t2.HUNDRED]), filter(nil), rowset=256
      access([t2.__pk_increment], [t2.HUNDRED]), partitions(p0)
      is_index_back=true, is_global_index=false, 
      range_key([t2.TEN], [t2.__pk_increment]), range(MIN,MIN ; MAX,MAX)always true, 
      range_cond([t2.TEN = :0])
select /*+no_unnest(@qb1)*/ sum((select /*+qb_name(qb1)*/sum(t2.hundred) from t2_100 t2 where t2.ten = t1.ten)) from t2_100 t1;
+-------------------------------------------------------------------------------------+
| sum((select /*+qb_name(qb1)*/sum(t2.hundred) from t2_100 t2 where t2.ten = t1.ten)) |
+-------------------------------------------------------------------------------------+
|                                                                               49500 |
+-------------------------------------------------------------------------------------+

EXPLAIN select sum((select sum(t2.hundred) from t2_100 t2 where t2.ten = t1.ten)) from t2_100 t1 group by t1.ten;
Query Plan
================================================================
|ID|OPERATOR              |NAME          |EST.ROWS|EST.TIME(us)|
----------------------------------------------------------------
|0 |MERGE GROUP BY        |              |10      |4501        |
|1 |└─SUBPLAN FILTER      |              |100     |4498        |
|2 |  ├─TABLE FULL SCAN   |t1(T2_100_TEN)|100     |4           |
|3 |  └─SCALAR GROUP BY   |              |1       |45          |
|4 |    └─TABLE RANGE SCAN|t2(T2_100_TEN)|10      |45          |
================================================================
Outputs & filters:
-------------------------------------
  0 - output([T_FUN_SUM(subquery(1))]), filter(nil), rowset=256
      group([t1.TEN]), agg_func([T_FUN_SUM(subquery(1))])
  1 - output([t1.TEN], [subquery(1)]), filter(nil), rowset=256
      exec_params_([t1.TEN(:0)]), onetime_exprs_(nil), init_plan_idxs_(nil), use_batch=false
  2 - output([t1.TEN]), filter(nil), rowset=256
      access([t1.TEN]), partitions(p0)
      is_index_back=false, is_global_index=false, 
      range_key([t1.TEN], [t1.__pk_increment]), range(MIN,MIN ; MAX,MAX)always true
  3 - output([T_FUN_SUM(t2.HUNDRED)]), filter(nil), rowset=256
      group(nil), agg_func([T_FUN_SUM(t2.HUNDRED)])
  4 - output([t2.HUNDRED]), filter(nil), rowset=256
      access([t2.__pk_increment], [t2.HUNDRED]), partitions(p0)
      is_index_back=true, is_global_index=false, 
      range_key([t2.TEN], [t2.__pk_increment]), range(MIN,MIN ; MAX,MAX)always true, 
      range_cond([t2.TEN = :0])
select sum((select sum(t2.hundred) from t2_100 t2 where t2.ten = t1.ten)) from t2_100 t1 group by t1.ten;
+--------------------------------------------------------------------+
| sum((select sum(t2.hundred) from t2_100 t2 where t2.ten = t1.ten)) |
+--------------------------------------------------------------------+
|                                                               4500 |
|                                                               4600 |
|                                                               4700 |
|                                                               4800 |
|                                                               4900 |
|                                                               5000 |
|                                                               5100 |
|                                                               5200 |
|                                                               5300 |
|                                                               5400 |
+--------------------------------------------------------------------+
EXPLAIN select /*+no_unnest(@qb1)*/ sum((select /*+qb_name(qb1)*/sum(t2.hundred) from t2_100 t2 where t2.ten = t1.ten)) from t2_100 t1 group by t1.ten;
Query Plan
================================================================
|ID|OPERATOR              |NAME          |EST.ROWS|EST.TIME(us)|
----------------------------------------------------------------
|0 |MERGE GROUP BY        |              |10      |4501        |
|1 |└─SUBPLAN FILTER      |              |100     |4498        |
|2 |  ├─TABLE FULL SCAN   |t1(T2_100_TEN)|100     |4           |
|3 |  └─SCALAR GROUP BY   |              |1       |45          |
|4 |    └─TABLE RANGE SCAN|t2(T2_100_TEN)|10      |45          |
================================================================
Outputs & filters:
-------------------------------------
  0 - output([T_FUN_SUM(subquery(1))]), filter(nil), rowset=256
      group([t1.TEN]), agg_func([T_FUN_SUM(subquery(1))])
  1 - output([t1.TEN], [subquery(1)]), filter(nil), rowset=256
      exec_params_([t1.TEN(:0)]), onetime_exprs_(nil), init_plan_idxs_(nil), use_batch=false
  2 - output([t1.TEN]), filter(nil), rowset=256
      access([t1.TEN]), partitions(p0)
      is_index_back=false, is_global_index=false, 
      range_key([t1.TEN], [t1.__pk_increment]), range(MIN,MIN ; MAX,MAX)always true
  3 - output([T_FUN_SUM(t2.HUNDRED)]), filter(nil), rowset=256
      group(nil), agg_func([T_FUN_SUM(t2.HUNDRED)])
  4 - output([t2.HUNDRED]), filter(nil), rowset=256
      access([t2.__pk_increment], [t2.HUNDRED]), partitions(p0)
      is_index_back=true, is_global_index=false, 
      range_key([t2.TEN], [t2.__pk_increment]), range(MIN,MIN ; MAX,MAX)always true, 
      range_cond([t2.TEN = :0])
select /*+no_unnest(@qb1)*/ sum((select /*+qb_name(qb1)*/sum(t2.hundred) from t2_100 t2 where t2.ten = t1.ten)) from t2_100 t1 group by t1.ten;
+-------------------------------------------------------------------------------------+
| sum((select /*+qb_name(qb1)*/sum(t2.hundred) from t2_100 t2 where t2.ten = t1.ten)) |
+-------------------------------------------------------------------------------------+
|                                                                                4500 |
|                                                                                4600 |
|                                                                                4700 |
|                                                                                4800 |
|                                                                                4900 |
|                                                                                5000 |
|                                                                                5100 |
|                                                                                5200 |
|                                                                                5300 |
|                                                                                5400 |
+-------------------------------------------------------------------------------------+

## bug: 
EXPLAIN select 1 from t1_100 t1, t2_100 t2 where t1.ten > any (select s2.unique2 + 1 from t2_100 s2 where s2.thousand >= (select count(unique1) from t2_100 r2));
Query Plan
============================================================================
|ID|OPERATOR                   |NAME                 |EST.ROWS|EST.TIME(us)|
----------------------------------------------------------------------------
|0 |NESTED-LOOP JOIN CARTESIAN |                     |500     |115         |
|1 |├─NESTED-LOOP SEMI JOIN    |                     |5       |100         |
|2 |│ ├─TABLE FULL SCAN        |t1                   |100     |4           |
|3 |│ └─MATERIAL               |                     |5       |87          |
|4 |│   └─SUBPLAN SCAN         |VIEW1                |5       |87          |
|5 |│     └─SUBPLAN SCAN       |VIEW2                |5       |87          |
|6 |│       └─WINDOW FUNCTION  |                     |100     |85          |
|7 |│         └─TABLE FULL SCAN|r2                   |100     |8           |
|8 |└─MATERIAL                 |                     |100     |3           |
|9 |  └─TABLE FULL SCAN        |t2(T2_100_VCHAR_HUND)|100     |3           |
============================================================================
Outputs & filters:
-------------------------------------
  0 - output([1]), filter(nil), rowset=256
      conds(nil), nl_params_(nil), use_batch=false
  1 - output(nil), filter(nil), rowset=256
      conds([t1.TEN > VIEW1.s2.unique2 + 1]), nl_params_(nil), use_batch=false
  2 - output([t1.TEN]), filter(nil), rowset=256
      access([t1.TEN]), partitions(p0)
      is_index_back=false, is_global_index=false, 
      range_key([t1.__pk_increment]), range(MIN ; MAX)always true
  3 - output([VIEW1.s2.unique2 + 1]), filter(nil), rowset=256
  4 - output([VIEW1.s2.unique2 + 1]), filter(nil), rowset=256
      access([VIEW1.s2.unique2 + 1])
  5 - output([VIEW2.r2.UNIQUE2 + cast(1, DECIMAL_INT(11, 0))]), filter([VIEW2.r2.THOUSAND >= cast(VIEW2.count(unique1), DECIMAL_INT(10, 0))]), rowset=256
      access([VIEW2.count(unique1)], [VIEW2.r2.THOUSAND], [VIEW2.r2.UNIQUE2])
  6 - output([T_FUN_COUNT(r2.UNIQUE1)], [r2.THOUSAND], [r2.UNIQUE2]), filter(nil), rowset=256
      win_expr(T_FUN_COUNT(r2.UNIQUE1)), partition_by(nil), order_by(nil), window_type(RANGE), upper(UNBOUNDED PRECEDING), lower(UNBOUNDED FOLLOWING)
  7 - output([r2.UNIQUE1], [r2.THOUSAND], [r2.UNIQUE2]), filter(nil), rowset=256
      access([r2.UNIQUE1], [r2.THOUSAND], [r2.UNIQUE2]), partitions(p0)
      is_index_back=false, is_global_index=false, 
      range_key([r2.__pk_increment]), range(MIN ; MAX)always true
  8 - output(nil), filter(nil), rowset=256
  9 - output(nil), filter(nil), rowset=256
      access(nil), partitions(p0)
      is_index_back=false, is_global_index=false, 
      range_key([t2.VCHAR_HUND], [t2.__pk_increment]), range(MIN,MIN ; MAX,MAX)always true
select 1 from t1_100 t1, t2_100 t2 where t1.ten > any (select s2.unique2 + 1 from t2_100 s2 where s2.thousand >= (select count(unique1) from t2_100 r2));
+---+
| 1 |
+---+
+---+
EXPLAIN select /*+no_rewrite*/ 1 from t1_100 t1, t2_100 t2 where t1.ten > any (select s2.unique2 + 1 from t2_100 s2 where s2.thousand >= (select count(unique1) from t2_100 r2));
Query Plan
==============================================================================
|ID|OPERATOR                     |NAME                 |EST.ROWS|EST.TIME(us)|
------------------------------------------------------------------------------
|0 |SUBPLAN FILTER               |                     |5000    |511         |
|1 |├─NESTED-LOOP JOIN CARTESIAN |                     |10000   |258         |
|2 |│ ├─TABLE FULL SCAN          |t1                   |100     |4           |
|3 |│ └─MATERIAL                 |                     |100     |3           |
|4 |│   └─TABLE FULL SCAN        |t2(T2_100_VCHAR_HUND)|100     |3           |
|5 |└─SUBPLAN SCAN               |VIEW1                |5       |87          |
|6 |  └─WINDOW FUNCTION          |                     |100     |85          |
|7 |    └─TABLE FULL SCAN        |r2                   |100     |8           |
==============================================================================
Outputs & filters:
-------------------------------------
  0 - output([1]), filter([t1.TEN > ANY(subquery(1))]), rowset=256
      exec_params_(nil), onetime_exprs_(nil), init_plan_idxs_([1]), use_batch=false
  1 - output([t1.TEN]), filter(nil), rowset=256
      conds(nil), nl_params_(nil), use_batch=false
  2 - output([t1.TEN]), filter(nil), rowset=256
      access([t1.TEN]), partitions(p0)
      is_index_back=false, is_global_index=false, 
      range_key([t1.__pk_increment]), range(MIN ; MAX)always true
  3 - output(nil), filter(nil), rowset=256
  4 - output(nil), filter(nil), rowset=256
      access(nil), partitions(p0)
      is_index_back=false, is_global_index=false, 
      range_key([t2.VCHAR_HUND], [t2.__pk_increment]), range(MIN,MIN ; MAX,MAX)always true
  5 - output([VIEW1.r2.UNIQUE2 + cast(1, DECIMAL_INT(11, 0))]), filter([VIEW1.r2.THOUSAND >= cast(VIEW1.count(unique1), DECIMAL_INT(10, 0))]), rowset=256
      access([VIEW1.count(unique1)], [VIEW1.r2.THOUSAND], [VIEW1.r2.UNIQUE2])
  6 - output([T_FUN_COUNT(r2.UNIQUE1)], [r2.THOUSAND], [r2.UNIQUE2]), filter(nil), rowset=256
      win_expr(T_FUN_COUNT(r2.UNIQUE1)), partition_by(nil), order_by(nil), window_type(RANGE), upper(UNBOUNDED PRECEDING), lower(UNBOUNDED FOLLOWING)
  7 - output([r2.UNIQUE1], [r2.THOUSAND], [r2.UNIQUE2]), filter(nil), rowset=256
      access([r2.UNIQUE1], [r2.THOUSAND], [r2.UNIQUE2]), partitions(p0)
      is_index_back=false, is_global_index=false, 
      range_key([r2.__pk_increment]), range(MIN ; MAX)always true
select /*+no_rewrite*/ 1 from t1_100 t1, t2_100 t2 where t1.ten > any (select s2.unique2 + 1 from t2_100 s2 where s2.thousand >= (select count(unique1) from t2_100 r2));
+---+
| 1 |
+---+
+---+

## 测试约束抽取
alter system flush plan cache global;

select/*equal_param_constraint*/ a1.thousand from t2_100 a1 where a1.unique1 > 0 and a1.hundred >= (select /*+unnest*/ avg(a2.hundred) from t2_100 a2 where a1.ten = a2.ten and a2.unique1 > 0);
+----------+
| thousand |
+----------+
|       50 |
|       51 |
|       52 |
|       53 |
|       54 |
|       55 |
|       56 |
|       57 |
|       58 |
|       59 |
|       60 |
|       61 |
|       62 |
|       63 |
|       64 |
|       65 |
|       66 |
|       67 |
|       68 |
|       69 |
|       70 |
|       71 |
|       72 |
|       73 |
|       74 |
|       75 |
|       76 |
|       77 |
|       78 |
|       79 |
|       80 |
|       81 |
|       82 |
|       83 |
|       84 |
|       85 |
|       86 |
|       87 |
|       88 |
|       89 |
|       90 |
|       91 |
|       92 |
|       93 |
|       94 |
|       95 |
|       96 |
|       97 |
|       98 |
|       99 |
+----------+

select/*equal_param_constraint*/ a1.thousand from t2_100 a1 where a1.unique1 > 1 and a1.hundred >= (select /*+unnest*/ avg(a2.hundred) from t2_100 a2 where a1.ten = a2.ten and a2.unique1 > 1);
+----------+
| thousand |
+----------+
|       50 |
|       51 |
|       52 |
|       53 |
|       54 |
|       55 |
|       56 |
|       57 |
|       58 |
|       59 |
|       60 |
|       61 |
|       62 |
|       63 |
|       64 |
|       65 |
|       66 |
|       67 |
|       68 |
|       69 |
|       70 |
|       71 |
|       72 |
|       73 |
|       74 |
|       75 |
|       76 |
|       77 |
|       78 |
|       79 |
|       80 |
|       81 |
|       82 |
|       83 |
|       84 |
|       85 |
|       86 |
|       87 |
|       88 |
|       89 |
|       90 |
|       91 |
|       92 |
|       93 |
|       94 |
|       95 |
|       96 |
|       97 |
|       98 |
|       99 |
+----------+

select/*equal_param_constraint*/ a1.thousand from t2_100 a1 where a1.unique1 > 2 and a1.hundred >= (select /*+unnest*/ avg(a2.hundred) from t2_100 a2 where a1.ten = a2.ten and a2.unique1 > 2);
+----------+
| thousand |
+----------+
|       50 |
|       51 |
|       52 |
|       53 |
|       54 |
|       55 |
|       56 |
|       57 |
|       58 |
|       59 |
|       60 |
|       61 |
|       62 |
|       63 |
|       64 |
|       65 |
|       66 |
|       67 |
|       68 |
|       69 |
|       70 |
|       71 |
|       72 |
|       73 |
|       74 |
|       75 |
|       76 |
|       77 |
|       78 |
|       79 |
|       80 |
|       81 |
|       82 |
|       83 |
|       84 |
|       85 |
|       86 |
|       87 |
|       88 |
|       89 |
|       90 |
|       91 |
|       92 |
|       93 |
|       94 |
|       95 |
|       96 |
|       97 |
|       98 |
|       99 |
+----------+

select/*equal_param_constraint*/ a1.thousand from t2_100 a1 where a1.unique1 > 0 and a1.hundred >= (select /*+unnest*/ avg(a2.hundred) from t2_100 a2 where a1.ten = a2.ten and a2.unique1 > 0);
+----------+
| thousand |
+----------+
|       50 |
|       51 |
|       52 |
|       53 |
|       54 |
|       55 |
|       56 |
|       57 |
|       58 |
|       59 |
|       60 |
|       61 |
|       62 |
|       63 |
|       64 |
|       65 |
|       66 |
|       67 |
|       68 |
|       69 |
|       70 |
|       71 |
|       72 |
|       73 |
|       74 |
|       75 |
|       76 |
|       77 |
|       78 |
|       79 |
|       80 |
|       81 |
|       82 |
|       83 |
|       84 |
|       85 |
|       86 |
|       87 |
|       88 |
|       89 |
|       90 |
|       91 |
|       92 |
|       93 |
|       94 |
|       95 |
|       96 |
|       97 |
|       98 |
|       99 |
+----------+

select/*count_plan*/ hit_count from oceanbase.GV$OB_PLAN_CACHE_PLAN_STAT where query_sql like '%equal_param_constraint%' and query_sql not like '%oceanbase%';
+-----------+
| hit_count |
+-----------+
|         3 |
+-----------+

select/**/ a1.thousand from t2_100 a1 where a1.unique1 > 1 and a1.hundred >= (select /*+unnest*/ avg(a2.hundred) from t2_100 a2 where a1.ten = a2.ten and a2.unique1 > 2);
+----------+
| thousand |
+----------+
|       50 |
|       51 |
|       52 |
|       53 |
|       54 |
|       55 |
|       56 |
|       57 |
|       58 |
|       59 |
|       60 |
|       61 |
|       62 |
|       63 |
|       64 |
|       65 |
|       66 |
|       67 |
|       68 |
|       69 |
|       70 |
|       71 |
|       72 |
|       73 |
|       74 |
|       75 |
|       76 |
|       77 |
|       78 |
|       79 |
|       80 |
|       81 |
|       82 |
|       83 |
|       84 |
|       85 |
|       86 |
|       87 |
|       88 |
|       89 |
|       90 |
|       91 |
|       92 |
|       93 |
|       94 |
|       95 |
|       96 |
|       97 |
|       98 |
|       99 |
+----------+

select/**/ a1.thousand from t2_100 a1 where a1.unique1 > 1 and a1.hundred >= (select /*+unnest*/ avg(a2.hundred) from t2_100 a2 where a1.ten = a2.ten and a2.unique1 > 5);
+----------+
| thousand |
+----------+
|       50 |
|       51 |
|       52 |
|       53 |
|       54 |
|       55 |
|       56 |
|       57 |
|       58 |
|       59 |
|       60 |
|       61 |
|       62 |
|       63 |
|       64 |
|       65 |
|       66 |
|       67 |
|       68 |
|       69 |
|       70 |
|       71 |
|       72 |
|       73 |
|       74 |
|       75 |
|       76 |
|       77 |
|       78 |
|       79 |
|       80 |
|       81 |
|       82 |
|       83 |
|       84 |
|       85 |
|       86 |
|       87 |
|       88 |
|       89 |
|       90 |
|       91 |
|       92 |
|       93 |
|       94 |
|       95 |
|       96 |
|       97 |
|       98 |
|       99 |
+----------+

select/**/ a1.thousand from t2_100 a1 where a1.unique1 > 2 and a1.hundred >= (select /*+unnest*/ avg(a2.hundred) from t2_100 a2 where a1.ten = a2.ten and a2.unique1 > 5);
+----------+
| thousand |
+----------+
|       50 |
|       51 |
|       52 |
|       53 |
|       54 |
|       55 |
|       56 |
|       57 |
|       58 |
|       59 |
|       60 |
|       61 |
|       62 |
|       63 |
|       64 |
|       65 |
|       66 |
|       67 |
|       68 |
|       69 |
|       70 |
|       71 |
|       72 |
|       73 |
|       74 |
|       75 |
|       76 |
|       77 |
|       78 |
|       79 |
|       80 |
|       81 |
|       82 |
|       83 |
|       84 |
|       85 |
|       86 |
|       87 |
|       88 |
|       89 |
|       90 |
|       91 |
|       92 |
|       93 |
|       94 |
|       95 |
|       96 |
|       97 |
|       98 |
|       99 |
+----------+

select/*count_plan*/ hit_count from oceanbase.GV$OB_PLAN_CACHE_PLAN_STAT where query_sql like '%equal_param_constraint%' and query_sql not like '%oceanbase%';
+-----------+
| hit_count |
+-----------+
|         3 |
+-----------+

## rqg cases
DROP TABLE IF EXISTS B, C, CC;
CREATE TABLE B (
    col_int int,
    pk int,
    col_varchar_10_key varchar(10),
    col_varchar_20_key varchar(20),
    col_int_key int,
    col_varchar_10 varchar(10),
    col_varchar_key varchar (1),
    col_varchar varchar (1),
    col_varchar_20 varchar(20),
    /*Indices*/
    primary key (pk) ,
    key idx5(pk, col_varchar_10_key ),
    key idx7(pk, col_varchar_20_key ),
    key idx1(pk, col_int_key ),
    key idx3(pk, col_varchar_key )) ;
CREATE TABLE C (
    col_int int,
    col_varchar varchar (1),
    col_varchar_20_key varchar(20),
    col_varchar_20 varchar(20),
    col_varchar_key varchar (1),
    col_varchar_10 varchar(10),
    col_int_key int,
    pk int,
    col_varchar_10_key varchar(10),
    /*Indices*/
    key idx7(pk, col_varchar_20_key ),
    key idx3(pk, col_varchar_key ),
    key idx1(pk, col_int_key ),
    primary key (pk) ,
    key idx5(pk, col_varchar_10_key )) ;
CREATE TABLE CC (
    col_int_key int,
    col_varchar_10 varchar(10),
    col_int int,
    pk int,
    col_varchar_key varchar (1),
    col_varchar_10_key varchar(10),
    col_varchar_20_key varchar(20),
    col_varchar_20 varchar(20),
    col_varchar varchar (1),
    /*Indices*/
    key idx1(pk, col_int_key ),
    primary key (pk) ,
    key idx3(pk, col_varchar_key ),
    key idx5(pk, col_varchar_10_key ),
    key idx7(pk, col_varchar_20_key )) ;
Query Plan
==================================================
|ID|OPERATOR          |NAME|EST.ROWS|EST.TIME(us)|
--------------------------------------------------
|0 |DISTRIBUTED INSERT|    |1       |13          |
|1 |└─EXPRESSION      |    |1       |1           |
==================================================
Outputs & filters:
-------------------------------------
  0 - output(nil), filter(nil)
      columns([{b: ({b: (b.pk, b.col_int, b.col_varchar_10_key, b.col_varchar_20_key, b.col_int_key, b.col_varchar_10, b.col_varchar_key, b.col_varchar,
       b.col_varchar_20)})}]), 
      column_values([column_conv(INT,PS:(11,0),NOT NULL,__values.pk)], [column_conv(INT,PS:(11,0),NULL,__values.col_int)], [column_conv(VARCHAR,utf8mb4_general_ci,
      length:10,NULL,__values.col_varchar_10_key)], [column_conv(VARCHAR,utf8mb4_general_ci,length:20,NULL,__values.col_varchar_20_key)], [column_conv(INT,PS:(11,
      0),NULL,__values.col_int_key)], [column_conv(VARCHAR,utf8mb4_general_ci,length:10,NULL,__values.col_varchar_10)], [column_conv(VARCHAR,utf8mb4_general_ci,
      length:1,NULL,__values.col_varchar_key)], [column_conv(VARCHAR,utf8mb4_general_ci,length:1,NULL,__values.col_varchar)], [column_conv(VARCHAR,utf8mb4_general_ci,
      length:20,NULL,__values.col_varchar_20)])
  1 - output([__values.col_int], [__values.pk], [__values.col_varchar_10_key], [__values.col_varchar_20_key], [__values.col_int_key], [__values.col_varchar_10],
       [__values.col_varchar_key], [__values.col_varchar], [__values.col_varchar_20]), filter(nil)
      values({4, 1, 'b', 'h', 9, 'n', 'i', 'i', 'x'})
Query Plan
==================================================
|ID|OPERATOR          |NAME|EST.ROWS|EST.TIME(us)|
--------------------------------------------------
|0 |DISTRIBUTED INSERT|    |2       |20          |
|1 |└─EXPRESSION      |    |2       |1           |
==================================================
Outputs & filters:
-------------------------------------
  0 - output(nil), filter(nil)
      columns([{c: ({c: (c.pk, c.col_int, c.col_varchar, c.col_varchar_20_key, c.col_varchar_20, c.col_varchar_key, c.col_varchar_10, c.col_int_key, c.col_varchar_10_key)})}]),
       
      column_values([column_conv(INT,PS:(11,0),NOT NULL,__values.pk)], [column_conv(INT,PS:(11,0),NULL,__values.col_int)], [column_conv(VARCHAR,utf8mb4_general_ci,
      length:1,NULL,__values.col_varchar)], [column_conv(VARCHAR,utf8mb4_general_ci,length:20,NULL,__values.col_varchar_20_key)], [column_conv(VARCHAR,utf8mb4_general_ci,
      length:20,NULL,__values.col_varchar_20)], [column_conv(VARCHAR,utf8mb4_general_ci,length:1,NULL,__values.col_varchar_key)], [column_conv(VARCHAR,utf8mb4_general_ci,
      length:10,NULL,__values.col_varchar_10)], [column_conv(INT,PS:(11,0),NULL,__values.col_int_key)], [column_conv(VARCHAR,utf8mb4_general_ci,length:10,NULL,
      __values.col_varchar_10_key)])
  1 - output([__values.col_int], [__values.col_varchar], [__values.col_varchar_20_key], [__values.col_varchar_20], [__values.col_varchar_key], [__values.col_varchar_10],
       [__values.col_int_key], [__values.pk], [__values.col_varchar_10_key]), filter(nil)
      values({7, 'n', 'n', NULL, 'h', 'r', NULL, 1, 'b'}, {NULL, NULL, 'a', NULL, 'g', 't', 7, 2, NULL})
Query Plan
==================================================
|ID|OPERATOR          |NAME|EST.ROWS|EST.TIME(us)|
--------------------------------------------------
|0 |DISTRIBUTED INSERT|    |29      |191         |
|1 |└─EXPRESSION      |    |29      |1           |
==================================================
Outputs & filters:
-------------------------------------
  0 - output(nil), filter(nil)
      columns([{cc: ({cc: (cc.pk, cc.col_int_key, cc.col_varchar_10, cc.col_int, cc.col_varchar_key, cc.col_varchar_10_key, cc.col_varchar_20_key, cc.col_varchar_20,
       cc.col_varchar)})}]), 
      column_values([column_conv(INT,PS:(11,0),NOT NULL,__values.pk)], [column_conv(INT,PS:(11,0),NULL,__values.col_int_key)], [column_conv(VARCHAR,utf8mb4_general_ci,
      length:10,NULL,__values.col_varchar_10)], [column_conv(INT,PS:(11,0),NULL,__values.col_int)], [column_conv(VARCHAR,utf8mb4_general_ci,length:1,NULL,__values.col_varchar_key)],
       [column_conv(VARCHAR,utf8mb4_general_ci,length:10,NULL,__values.col_varchar_10_key)], [column_conv(VARCHAR,utf8mb4_general_ci,length:20,NULL,__values.col_varchar_20_key)],
       [column_conv(VARCHAR,utf8mb4_general_ci,length:20,NULL,__values.col_varchar_20)], [column_conv(VARCHAR,utf8mb4_general_ci,length:1,NULL,__values.col_varchar)])
  1 - output([__values.col_int_key], [__values.col_varchar_10], [__values.col_int], [__values.pk], [__values.col_varchar_key], [__values.col_varchar_10_key],
       [__values.col_varchar_20_key], [__values.col_varchar_20], [__values.col_varchar]), filter(nil)
      values({5, 'f', 7, 1, 't', 'v', 'r', 'k', 't'}, {NULL, 's', NULL, 2, 'y', 't', NULL, NULL, 'q'}, {5, 'i', 7, 3, 't', 'm', 'l', 'i', NULL}, {NULL, 
      'p', NULL, 4, 'l', NULL, NULL, NULL, 'r'}, {NULL, 'i', 6, 5, 'b', NULL, NULL, 'j', 'y'}, {1, 'p', 3, 6, NULL, 'h', 'o', 'i', NULL}, {6, 'n', 7, 7, 'u', 
      'y', 'l', 'f', 'q'}, {5, 'x', 3, 8, 'g', 'r', 'y', 'l', 'f'}, {7, NULL, 4, 9, NULL, 'o', 'r', NULL, 'j'}, {1, NULL, 6, 10, 'v', NULL, 'j', 'u', 'w'}, {3,
       'f', NULL, 11, 'q', 'h', NULL, 'p', 't'}, {NULL, 'q', 3, 12, 'f', 'x', 'l', 't', 'b'}, {5, 's', 8, 13, 'n', NULL, 'u', NULL, NULL}, {7, 'n', 5, 14, 'y',
       'i', 'j', 'u', 'q'}, {8, 'b', NULL, 15, NULL, 'l', 'j', 'd', 'c'}, {8, NULL, 1, 16, 'n', 'b', 'c', 'l', 'y'}, {9, 's', NULL, 17, 'c', 'k', 'u', 'e', 'u'},
       {9, 'd', 5, 18, 'x', 'v', 'c', 'd', 'l'}, {NULL, 'f', 7, 19, 'e', 'i', 'i', NULL, 'v'}, {7, 'd', 5, 20, 'u', 'm', 'z', 'z', 'y'}, {0, 'a', NULL, 21, NULL,
       'r', NULL, 'n', NULL}, {6, 'q', 0, 22, NULL, 'd', 'k', 'o', 'd'}, {8, 'w', 4, 23, 'k', 'c', 'k', 's', 'j'}, {4, 'v', NULL, 24, 'l', 'f', 'g', 'n', 'i'},
       {8, 'b', 7, 25, NULL, 'w', 'h', 'f', 'v'}, {2, 'l', 4, 26, 'j', 'h', 's', 'c', 'e'}, {8, 'x', 7, 27, NULL, 't', 'b', 'h', 'a'}, {3, 'l', 4, 28, 'i', 'f',
       'o', 'o', 'a'}, {NULL, 'h', NULL, 29, 'k', NULL, NULL, NULL, 'n'})
EXPLAIN SELECT    table2 . col_varchar_key AS field1 FROM ( CC AS table1 INNER JOIN ( ( CC AS table2 INNER JOIN B AS table3 ON (table3 . `col_int_key` = table2 . `col_int_key`  ) ) ) ON (table3 . `col_int_key` = table2 . `col_int_key`  ) ) WHERE (   EXISTS ( SELECT   SUBQUERY1_t1 . `col_varchar_20_key` AS SUBQUERY1_field1 FROM C AS SUBQUERY1_t1 WHERE SUBQUERY1_t1 . `pk` != table1 . `col_int` ) ) AND  table1 . `col_varchar` <> SOME ( SELECT   SUBQUERY2_t2 . `col_varchar_20_key` AS SUBQUERY2_field1 FROM ( C AS SUBQUERY2_t1 LEFT OUTER JOIN B AS SUBQUERY2_t2 ON (SUBQUERY2_t2 . `col_varchar_key` = SUBQUERY2_t1 . `col_varchar_10_key`  ) ) WHERE  SUBQUERY2_t2 . `col_int` >= ( SELECT   COUNT(  CHILD_SUBQUERY1_t1 . `pk` ) AS CHILD_SUBQUERY1_field1 FROM B AS CHILD_SUBQUERY1_t1  ) GROUP BY SUBQUERY2_field1 )  GROUP BY field1  ORDER BY 1, field1 ;
Query Plan
=======================================================================================
|ID|OPERATOR                                 |NAME              |EST.ROWS|EST.TIME(us)|
---------------------------------------------------------------------------------------
|0 |MERGE DISTINCT                           |                  |3       |20          |
|1 |└─SORT                                   |                  |4       |20          |
|2 |  └─NESTED-LOOP JOIN CARTESIAN           |                  |4       |19          |
|3 |    ├─HASH JOIN                          |                  |3       |8           |
|4 |    │ ├─TABLE FULL SCAN                  |table3(idx1)      |1       |3           |
|5 |    │ └─TABLE FULL SCAN                  |table2            |29      |3           |
|6 |    └─MATERIAL                           |                  |2       |11          |
|7 |      └─NESTED-LOOP JOIN                 |                  |2       |11          |
|8 |        ├─TABLE FULL SCAN                |SUBQUERY1_t1(idx7)|2       |3           |
|9 |        └─MATERIAL                       |                  |2       |9           |
|10|          └─NESTED-LOOP JOIN             |                  |2       |9           |
|11|            ├─TABLE FULL SCAN            |table1            |29      |3           |
|12|            └─MATERIAL                   |                  |1       |6           |
|13|              └─SUBPLAN SCAN             |VIEW2             |1       |6           |
|14|                └─HASH DISTINCT          |                  |1       |6           |
|15|                  └─HASH JOIN            |                  |1       |6           |
|16|                    ├─SUBPLAN SCAN       |VIEW3             |1       |3           |
|17|                    │ └─WINDOW FUNCTION  |                  |1       |3           |
|18|                    │   └─TABLE FULL SCAN|CHILD_SUBQUERY1_t1|1       |3           |
|19|                    └─TABLE FULL SCAN    |SUBQUERY2_t1(idx5)|2       |3           |
=======================================================================================
Outputs & filters:
-------------------------------------
  0 - output([table2.col_varchar_key]), filter(nil), rowset=256
      distinct([table2.col_varchar_key])
  1 - output([table2.col_varchar_key]), filter(nil), rowset=256
      sort_keys([table2.col_varchar_key, ASC])
  2 - output([table2.col_varchar_key]), filter(nil), rowset=256
      conds(nil), nl_params_(nil), use_batch=false
  3 - output([table2.col_varchar_key]), filter(nil), rowset=256
      equal_conds([table3.col_int_key = table2.col_int_key]), other_conds(nil)
  4 - output([table3.col_int_key]), filter(nil), rowset=256
      access([table3.col_int_key]), partitions(p0)
      is_index_back=false, is_global_index=false, 
      range_key([table3.pk], [table3.col_int_key]), range(MIN,MIN ; MAX,MAX)always true
  5 - output([table2.col_int_key], [table2.col_varchar_key]), filter(nil), rowset=256
      access([table2.col_int_key], [table2.col_varchar_key]), partitions(p0)
      is_index_back=false, is_global_index=false, 
      range_key([table2.pk]), range(MIN ; MAX)always true
  6 - output(nil), filter(nil), rowset=256
  7 - output(nil), filter(nil), rowset=256
      conds([SUBQUERY1_t1.pk != table1.col_int]), nl_params_(nil), use_batch=false
  8 - output([SUBQUERY1_t1.pk]), filter(nil), rowset=256
      access([SUBQUERY1_t1.pk]), partitions(p0)
      is_index_back=false, is_global_index=false, 
      range_key([SUBQUERY1_t1.pk], [SUBQUERY1_t1.col_varchar_20_key]), range(MIN,MIN ; MAX,MAX)always true
  9 - output([table1.col_int]), filter(nil), rowset=256
 10 - output([table1.col_int]), filter(nil), rowset=256
      conds([table1.col_varchar != VIEW2.SUBQUERY2_field1]), nl_params_(nil), use_batch=false
 11 - output([table1.col_int], [table1.col_varchar]), filter(nil), rowset=256
      access([table1.col_int], [table1.col_varchar]), partitions(p0)
      is_index_back=false, is_global_index=false, 
      range_key([table1.pk]), range(MIN ; MAX)always true
 12 - output([VIEW2.SUBQUERY2_field1]), filter(nil), rowset=256
 13 - output([VIEW2.SUBQUERY2_field1]), filter(nil), rowset=256
      access([VIEW2.SUBQUERY2_field1])
 14 - output([VIEW3.CHILD_SUBQUERY1_t1.col_varchar_20_key]), filter(nil), rowset=256
      distinct([VIEW3.CHILD_SUBQUERY1_t1.col_varchar_20_key])
 15 - output([VIEW3.CHILD_SUBQUERY1_t1.col_varchar_20_key]), filter(nil), rowset=256
      equal_conds([VIEW3.CHILD_SUBQUERY1_t1.col_varchar_key = SUBQUERY2_t1.col_varchar_10_key]), other_conds(nil)
 16 - output([VIEW3.CHILD_SUBQUERY1_t1.col_varchar_key], [VIEW3.CHILD_SUBQUERY1_t1.col_varchar_20_key]), filter([VIEW3.CHILD_SUBQUERY1_t1.col_int >= VIEW3.CHILD_SUBQUERY1_field1]), rowset=256
      access([VIEW3.CHILD_SUBQUERY1_field1], [VIEW3.CHILD_SUBQUERY1_t1.col_varchar_key], [VIEW3.CHILD_SUBQUERY1_t1.col_int], [VIEW3.CHILD_SUBQUERY1_t1.col_varchar_20_key])
 17 - output([T_FUN_COUNT(CHILD_SUBQUERY1_t1.pk)], [CHILD_SUBQUERY1_t1.col_varchar_key], [CHILD_SUBQUERY1_t1.col_int], [CHILD_SUBQUERY1_t1.col_varchar_20_key]), filter(nil), rowset=256
      win_expr(T_FUN_COUNT(CHILD_SUBQUERY1_t1.pk)), partition_by(nil), order_by(nil), window_type(RANGE), upper(UNBOUNDED PRECEDING), lower(UNBOUNDED FOLLOWING)
 18 - output([CHILD_SUBQUERY1_t1.pk], [CHILD_SUBQUERY1_t1.col_varchar_key], [CHILD_SUBQUERY1_t1.col_int], [CHILD_SUBQUERY1_t1.col_varchar_20_key]), filter(nil), rowset=256
      access([CHILD_SUBQUERY1_t1.pk], [CHILD_SUBQUERY1_t1.col_varchar_key], [CHILD_SUBQUERY1_t1.col_int], [CHILD_SUBQUERY1_t1.col_varchar_20_key]), partitions(p0)
      is_index_back=false, is_global_index=false, 
      range_key([CHILD_SUBQUERY1_t1.pk]), range(MIN ; MAX)always true
 19 - output([SUBQUERY2_t1.col_varchar_10_key]), filter(nil), rowset=256
      access([SUBQUERY2_t1.col_varchar_10_key]), partitions(p0)
      is_index_back=false, is_global_index=false, 
      range_key([SUBQUERY2_t1.pk], [SUBQUERY2_t1.col_varchar_10_key]), range(MIN,MIN ; MAX,MAX)always true
SELECT    table2 . col_varchar_key AS field1 FROM ( CC AS table1 INNER JOIN ( ( CC AS table2 INNER JOIN B AS table3 ON (table3 . `col_int_key` = table2 . `col_int_key`  ) ) ) ON (table3 . `col_int_key` = table2 . `col_int_key`  ) ) WHERE (   EXISTS ( SELECT   SUBQUERY1_t1 . `col_varchar_20_key` AS SUBQUERY1_field1 FROM C AS SUBQUERY1_t1 WHERE SUBQUERY1_t1 . `pk` != table1 . `col_int` ) ) AND  table1 . `col_varchar` <> SOME ( SELECT   SUBQUERY2_t2 . `col_varchar_20_key` AS SUBQUERY2_field1 FROM ( C AS SUBQUERY2_t1 LEFT OUTER JOIN B AS SUBQUERY2_t2 ON (SUBQUERY2_t2 . `col_varchar_key` = SUBQUERY2_t1 . `col_varchar_10_key`  ) ) WHERE  SUBQUERY2_t2 . `col_int` >= ( SELECT   COUNT(  CHILD_SUBQUERY1_t1 . `pk` ) AS CHILD_SUBQUERY1_field1 FROM B AS CHILD_SUBQUERY1_t1  ) GROUP BY SUBQUERY2_field1 )  GROUP BY field1  ORDER BY 1, field1 ;
+--------+
| field1 |
+--------+
+--------+
EXPLAIN SELECT /*+no_rewrite*/ table2 . col_varchar_key AS field1 FROM ( CC AS table1 INNER JOIN ( ( CC AS table2 INNER JOIN B AS table3 ON (table3 . `col_int_key` = table2 . `col_int_key`  ) ) ) ON (table3 . `col_int_key` = table2 . `col_int_key`  ) ) WHERE (   EXISTS ( SELECT   SUBQUERY1_t1 . `col_varchar_20_key` AS SUBQUERY1_field1 FROM C AS SUBQUERY1_t1 WHERE SUBQUERY1_t1 . `pk` != table1 . `col_int` ) ) AND  table1 . `col_varchar` <> SOME ( SELECT   SUBQUERY2_t2 . `col_varchar_20_key` AS SUBQUERY2_field1 FROM ( C AS SUBQUERY2_t1 LEFT OUTER JOIN B AS SUBQUERY2_t2 ON (SUBQUERY2_t2 . `col_varchar_key` = SUBQUERY2_t1 . `col_varchar_10_key`  ) ) WHERE  SUBQUERY2_t2 . `col_int` >= ( SELECT   COUNT(  CHILD_SUBQUERY1_t1 . `pk` ) AS CHILD_SUBQUERY1_field1 FROM B AS CHILD_SUBQUERY1_t1  ) GROUP BY SUBQUERY2_field1 )  GROUP BY field1  ORDER BY 1, field1 ;
Query Plan
===============================================================================
|ID|OPERATOR                         |NAME              |EST.ROWS|EST.TIME(us)|
-------------------------------------------------------------------------------
|0 |SORT                             |                  |3       |1217        |
|1 |└─HASH GROUP BY                  |                  |3       |1217        |
|2 |  └─SUBPLAN FILTER               |                  |24      |1214        |
|3 |    ├─NESTED-LOOP JOIN CARTESIAN |                  |67      |13          |
|4 |    │ ├─TABLE FULL SCAN          |table1            |29      |3           |
|5 |    │ └─MATERIAL                 |                  |3       |8           |
|6 |    │   └─HASH JOIN              |                  |3       |8           |
|7 |    │     ├─TABLE FULL SCAN      |table3(idx1)      |1       |3           |
|8 |    │     └─TABLE FULL SCAN      |table2            |29      |3           |
|9 |    ├─TABLE RANGE SCAN           |SUBQUERY1_t1(idx7)|1       |18          |
|10|    └─HASH DISTINCT              |                  |1       |6           |
|11|      └─HASH JOIN                |                  |1       |6           |
|12|        ├─SUBPLAN SCAN           |VIEW1             |1       |3           |
|13|        │ └─WINDOW FUNCTION      |                  |1       |3           |
|14|        │   └─TABLE FULL SCAN    |CHILD_SUBQUERY1_t1|1       |3           |
|15|        └─TABLE FULL SCAN        |SUBQUERY2_t1(idx5)|2       |3           |
===============================================================================
Outputs & filters:
-------------------------------------
  0 - output([table2.col_varchar_key]), filter(nil), rowset=256
      sort_keys([table2.col_varchar_key, ASC])
  1 - output([table2.col_varchar_key]), filter(nil), rowset=256
      group([table2.col_varchar_key]), agg_func(nil)
  2 - output([table2.col_varchar_key]), filter([(T_OP_EXISTS, subquery(1))], [table1.col_varchar != ANY(subquery(2))]), rowset=256
      exec_params_([table1.col_int(:0)]), onetime_exprs_(nil), init_plan_idxs_([2]), use_batch=false
  3 - output([table2.col_varchar_key], [table1.col_int], [table1.col_varchar]), filter(nil), rowset=256
      conds(nil), nl_params_(nil), use_batch=false
  4 - output([table1.col_int], [table1.col_varchar]), filter(nil), rowset=256
      access([table1.col_int], [table1.col_varchar]), partitions(p0)
      is_index_back=false, is_global_index=false, 
      range_key([table1.pk]), range(MIN ; MAX)always true
  5 - output([table2.col_varchar_key]), filter(nil), rowset=256
  6 - output([table2.col_varchar_key]), filter(nil), rowset=256
      equal_conds([table3.col_int_key = table2.col_int_key]), other_conds(nil)
  7 - output([table3.col_int_key]), filter(nil), rowset=256
      access([table3.col_int_key]), partitions(p0)
      is_index_back=false, is_global_index=false, 
      range_key([table3.pk], [table3.col_int_key]), range(MIN,MIN ; MAX,MAX)always true
  8 - output([table2.col_int_key], [table2.col_varchar_key]), filter(nil), rowset=256
      access([table2.col_int_key], [table2.col_varchar_key]), partitions(p0)
      is_index_back=false, is_global_index=false, 
      range_key([table2.pk]), range(MIN ; MAX)always true
  9 - output([SUBQUERY1_t1.col_varchar_20_key]), filter(nil), rowset=256
      access([SUBQUERY1_t1.col_varchar_20_key]), partitions(p0)
      is_index_back=false, is_global_index=false, 
      range_key([SUBQUERY1_t1.pk], [SUBQUERY1_t1.col_varchar_20_key]), range(MIN,MIN ; MAX,MAX)always true, 
      range_cond([SUBQUERY1_t1.pk != :0])
 10 - output([VIEW1.CHILD_SUBQUERY1_t1.col_varchar_20_key]), filter(nil), rowset=256
      distinct([VIEW1.CHILD_SUBQUERY1_t1.col_varchar_20_key])
 11 - output([VIEW1.CHILD_SUBQUERY1_t1.col_varchar_20_key]), filter(nil), rowset=256
      equal_conds([VIEW1.CHILD_SUBQUERY1_t1.col_varchar_key = SUBQUERY2_t1.col_varchar_10_key]), other_conds(nil)
 12 - output([VIEW1.CHILD_SUBQUERY1_t1.col_varchar_key], [VIEW1.CHILD_SUBQUERY1_t1.col_varchar_20_key]), filter([VIEW1.CHILD_SUBQUERY1_t1.col_int >= VIEW1.CHILD_SUBQUERY1_field1]), rowset=256
      access([VIEW1.CHILD_SUBQUERY1_field1], [VIEW1.CHILD_SUBQUERY1_t1.col_varchar_key], [VIEW1.CHILD_SUBQUERY1_t1.col_int], [VIEW1.CHILD_SUBQUERY1_t1.col_varchar_20_key])
 13 - output([T_FUN_COUNT(CHILD_SUBQUERY1_t1.pk)], [CHILD_SUBQUERY1_t1.col_varchar_key], [CHILD_SUBQUERY1_t1.col_int], [CHILD_SUBQUERY1_t1.col_varchar_20_key]), filter(nil), rowset=256
      win_expr(T_FUN_COUNT(CHILD_SUBQUERY1_t1.pk)), partition_by(nil), order_by(nil), window_type(RANGE), upper(UNBOUNDED PRECEDING), lower(UNBOUNDED FOLLOWING)
 14 - output([CHILD_SUBQUERY1_t1.pk], [CHILD_SUBQUERY1_t1.col_varchar_key], [CHILD_SUBQUERY1_t1.col_int], [CHILD_SUBQUERY1_t1.col_varchar_20_key]), filter(nil), rowset=256
      access([CHILD_SUBQUERY1_t1.pk], [CHILD_SUBQUERY1_t1.col_varchar_key], [CHILD_SUBQUERY1_t1.col_int], [CHILD_SUBQUERY1_t1.col_varchar_20_key]), partitions(p0)
      is_index_back=false, is_global_index=false, 
      range_key([CHILD_SUBQUERY1_t1.pk]), range(MIN ; MAX)always true
 15 - output([SUBQUERY2_t1.col_varchar_10_key]), filter(nil), rowset=256
      access([SUBQUERY2_t1.col_varchar_10_key]), partitions(p0)
      is_index_back=false, is_global_index=false, 
      range_key([SUBQUERY2_t1.pk], [SUBQUERY2_t1.col_varchar_10_key]), range(MIN,MIN ; MAX,MAX)always true
SELECT /*+no_rewrite*/ table2 . col_varchar_key AS field1 FROM ( CC AS table1 INNER JOIN ( ( CC AS table2 INNER JOIN B AS table3 ON (table3 . `col_int_key` = table2 . `col_int_key`  ) ) ) ON (table3 . `col_int_key` = table2 . `col_int_key`  ) ) WHERE (   EXISTS ( SELECT   SUBQUERY1_t1 . `col_varchar_20_key` AS SUBQUERY1_field1 FROM C AS SUBQUERY1_t1 WHERE SUBQUERY1_t1 . `pk` != table1 . `col_int` ) ) AND  table1 . `col_varchar` <> SOME ( SELECT   SUBQUERY2_t2 . `col_varchar_20_key` AS SUBQUERY2_field1 FROM ( C AS SUBQUERY2_t1 LEFT OUTER JOIN B AS SUBQUERY2_t2 ON (SUBQUERY2_t2 . `col_varchar_key` = SUBQUERY2_t1 . `col_varchar_10_key`  ) ) WHERE  SUBQUERY2_t2 . `col_int` >= ( SELECT   COUNT(  CHILD_SUBQUERY1_t1 . `pk` ) AS CHILD_SUBQUERY1_field1 FROM B AS CHILD_SUBQUERY1_t1  ) GROUP BY SUBQUERY2_field1 )  GROUP BY field1  ORDER BY 1, field1 ;
+--------+
| field1 |
+--------+
+--------+

EXPLAIN SELECT 1 FROM cc AS table1, b as table3 WHERE table1 . `col_varchar` <> some (SELECT SUBQUERY2_t2 . `col_varchar_20_key` FROM b AS SUBQUERY2_t2 WHERE SUBQUERY2_t2 . `col_int` >= (SELECT Count(`pk`) FROM b)) ;
Query Plan
===================================================================
|ID|OPERATOR                   |NAME        |EST.ROWS|EST.TIME(us)|
-------------------------------------------------------------------
|0 |NESTED-LOOP JOIN CARTESIAN |            |24      |9           |
|1 |├─NESTED-LOOP SEMI JOIN    |            |24      |6           |
|2 |│ ├─TABLE FULL SCAN        |table1      |29      |3           |
|3 |│ └─MATERIAL               |            |1       |3           |
|4 |│   └─SUBPLAN SCAN         |VIEW1       |1       |3           |
|5 |│     └─SUBPLAN SCAN       |VIEW2       |1       |3           |
|6 |│       └─WINDOW FUNCTION  |            |1       |3           |
|7 |│         └─TABLE FULL SCAN|b           |1       |3           |
|8 |└─MATERIAL                 |            |1       |3           |
|9 |  └─TABLE FULL SCAN        |table3(idx5)|1       |3           |
===================================================================
Outputs & filters:
-------------------------------------
  0 - output([1]), filter(nil), rowset=256
      conds(nil), nl_params_(nil), use_batch=false
  1 - output(nil), filter(nil), rowset=256
      conds([table1.col_varchar != VIEW1.col_varchar_20_key]), nl_params_(nil), use_batch=false
  2 - output([table1.col_varchar]), filter(nil), rowset=256
      access([table1.col_varchar]), partitions(p0)
      is_index_back=false, is_global_index=false, 
      range_key([table1.pk]), range(MIN ; MAX)always true
  3 - output([VIEW1.col_varchar_20_key]), filter(nil), rowset=256
  4 - output([VIEW1.col_varchar_20_key]), filter(nil), rowset=256
      access([VIEW1.col_varchar_20_key])
  5 - output([VIEW2.b.col_varchar_20_key]), filter([VIEW2.b.col_int >= VIEW2.Count(`pk`)]), rowset=256
      access([VIEW2.Count(`pk`)], [VIEW2.b.col_int], [VIEW2.b.col_varchar_20_key])
  6 - output([T_FUN_COUNT(b.pk)], [b.col_int], [b.col_varchar_20_key]), filter(nil), rowset=256
      win_expr(T_FUN_COUNT(b.pk)), partition_by(nil), order_by(nil), window_type(RANGE), upper(UNBOUNDED PRECEDING), lower(UNBOUNDED FOLLOWING)
  7 - output([b.pk], [b.col_int], [b.col_varchar_20_key]), filter(nil), rowset=256
      access([b.pk], [b.col_int], [b.col_varchar_20_key]), partitions(p0)
      is_index_back=false, is_global_index=false, 
      range_key([b.pk]), range(MIN ; MAX)always true
  8 - output(nil), filter(nil), rowset=256
  9 - output(nil), filter(nil), rowset=256
      access(nil), partitions(p0)
      is_index_back=false, is_global_index=false, 
      range_key([table3.pk], [table3.col_varchar_10_key]), range(MIN,MIN ; MAX,MAX)always true
SELECT 1 FROM cc AS table1, b as table3 WHERE table1 . `col_varchar` <> some (SELECT SUBQUERY2_t2 . `col_varchar_20_key` FROM b AS SUBQUERY2_t2 WHERE SUBQUERY2_t2 . `col_int` >= (SELECT Count(`pk`) FROM b)) ;
+---+
| 1 |
+---+
| 1 |
| 1 |
| 1 |
| 1 |
| 1 |
| 1 |
| 1 |
| 1 |
| 1 |
| 1 |
| 1 |
| 1 |
| 1 |
| 1 |
| 1 |
| 1 |
| 1 |
| 1 |
| 1 |
| 1 |
| 1 |
| 1 |
| 1 |
| 1 |
| 1 |
+---+
EXPLAIN SELECT /*+no_rewrite*/ 1 FROM cc AS table1, b as table3 WHERE table1 . `col_varchar` <> some (SELECT SUBQUERY2_t2 . `col_varchar_20_key` FROM b AS SUBQUERY2_t2 WHERE SUBQUERY2_t2 . `col_int` >= (SELECT Count(`pk`) FROM b)) ;
Query Plan
=====================================================================
|ID|OPERATOR                     |NAME        |EST.ROWS|EST.TIME(us)|
---------------------------------------------------------------------
|0 |SUBPLAN FILTER               |            |15      |9           |
|1 |├─NESTED-LOOP JOIN CARTESIAN |            |29      |6           |
|2 |│ ├─TABLE FULL SCAN          |table1      |29      |3           |
|3 |│ └─MATERIAL                 |            |1       |3           |
|4 |│   └─TABLE FULL SCAN        |table3(idx5)|1       |3           |
|5 |└─SUBPLAN SCAN               |VIEW1       |1       |3           |
|6 |  └─WINDOW FUNCTION          |            |1       |3           |
|7 |    └─TABLE FULL SCAN        |b           |1       |3           |
=====================================================================
Outputs & filters:
-------------------------------------
  0 - output([1]), filter([table1.col_varchar != ANY(subquery(1))]), rowset=256
      exec_params_(nil), onetime_exprs_(nil), init_plan_idxs_([1]), use_batch=false
  1 - output([table1.col_varchar]), filter(nil), rowset=256
      conds(nil), nl_params_(nil), use_batch=false
  2 - output([table1.col_varchar]), filter(nil), rowset=256
      access([table1.col_varchar]), partitions(p0)
      is_index_back=false, is_global_index=false, 
      range_key([table1.pk]), range(MIN ; MAX)always true
  3 - output(nil), filter(nil), rowset=256
  4 - output(nil), filter(nil), rowset=256
      access(nil), partitions(p0)
      is_index_back=false, is_global_index=false, 
      range_key([table3.pk], [table3.col_varchar_10_key]), range(MIN,MIN ; MAX,MAX)always true
  5 - output([VIEW1.b.col_varchar_20_key]), filter([VIEW1.b.col_int >= VIEW1.Count(`pk`)]), rowset=256
      access([VIEW1.Count(`pk`)], [VIEW1.b.col_int], [VIEW1.b.col_varchar_20_key])
  6 - output([T_FUN_COUNT(b.pk)], [b.col_int], [b.col_varchar_20_key]), filter(nil), rowset=256
      win_expr(T_FUN_COUNT(b.pk)), partition_by(nil), order_by(nil), window_type(RANGE), upper(UNBOUNDED PRECEDING), lower(UNBOUNDED FOLLOWING)
  7 - output([b.pk], [b.col_int], [b.col_varchar_20_key]), filter(nil), rowset=256
      access([b.pk], [b.col_int], [b.col_varchar_20_key]), partitions(p0)
      is_index_back=false, is_global_index=false, 
      range_key([b.pk]), range(MIN ; MAX)always true
SELECT /*+no_rewrite*/ 1 FROM cc AS table1, b as table3 WHERE table1 . `col_varchar` <> some (SELECT SUBQUERY2_t2 . `col_varchar_20_key` FROM b AS SUBQUERY2_t2 WHERE SUBQUERY2_t2 . `col_int` >= (SELECT Count(`pk`) FROM b)) ;
+---+
| 1 |
+---+
| 1 |
| 1 |
| 1 |
| 1 |
| 1 |
| 1 |
| 1 |
| 1 |
| 1 |
| 1 |
| 1 |
| 1 |
| 1 |
| 1 |
| 1 |
| 1 |
| 1 |
| 1 |
| 1 |
| 1 |
| 1 |
| 1 |
| 1 |
| 1 |
| 1 |
+---+
DROP TABLE B, C, CC;

drop table if exists bmsql_oorder;
create table bmsql_oorder (
o_w_id       INTEGER      NOT NULL,
o_d_id       INTEGER      NOT NULL,
o_id         INTEGER      NOT NULL,
o_c_id       INTEGER,
o_carrier_id INTEGER,
o_ol_cnt     DECIMAL(2,0),
o_all_local  DECIMAL(1,0),
o_entry_d    TIMESTAMP,
PRIMARY KEY (o_w_id, o_d_id, o_id)
) compression="lz4_1.0"  partition by hash(o_w_id) partitions 2;
create index oo_hash_partition_1 on bmsql_oorder(o_w_id, o_d_id, o_c_id, o_id) global partition by hash(o_w_id) partitions 3;
create index oo_hash_partition_2 on bmsql_oorder(o_w_id, o_d_id, o_ol_cnt) global partition by hash(o_w_id) partitions 3;

EXPLAIN SELECT o_id, o_entry_d, o_carrier_id FROM bmsql_oorder WHERE o_w_id = 402 AND o_d_id = 1 AND o_c_id = 79 AND o_id = ( SELECT max(o_id) FROM bmsql_oorder WHERE o_w_id = 402 AND o_d_id = 1 AND o_c_id = 79 );
Query Plan
=============================================================================================
|ID|OPERATOR                |NAME                                     |EST.ROWS|EST.TIME(us)|
---------------------------------------------------------------------------------------------
|0 |NESTED-LOOP JOIN        |                                         |1       |19          |
|1 |├─SUBPLAN SCAN          |VIEW1                                    |1       |3           |
|2 |│ └─SCALAR GROUP BY     |                                         |1       |3           |
|3 |│   └─SUBPLAN SCAN      |VIEW2                                    |1       |3           |
|4 |│     └─TABLE RANGE SCAN|bmsql_oorder(oo_hash_partition_1,Reverse)|1       |3           |
|5 |└─TABLE GET             |bmsql_oorder                             |1       |16          |
=============================================================================================
Outputs & filters:
-------------------------------------
  0 - output([bmsql_oorder.o_id], [bmsql_oorder.o_entry_d], [bmsql_oorder.o_carrier_id]), filter(nil), rowset=16
      conds(nil), nl_params_([VIEW1.max(o_id)(:0)]), use_batch=true
  1 - output([VIEW1.max(o_id)]), filter(nil), rowset=16
      access([VIEW1.max(o_id)])
  2 - output([T_FUN_MAX(VIEW2.bmsql_oorder.o_id)]), filter(nil), rowset=16
      group(nil), agg_func([T_FUN_MAX(VIEW2.bmsql_oorder.o_id)])
  3 - output([VIEW2.bmsql_oorder.o_id]), filter(nil), rowset=16
      access([VIEW2.bmsql_oorder.o_id])
  4 - output([bmsql_oorder.o_id]), filter(nil), rowset=16
      access([bmsql_oorder.o_id]), partitions(p0)
      limit(1), offset(nil), is_index_back=false, is_global_index=true, 
      range_key([bmsql_oorder.o_w_id], [bmsql_oorder.o_d_id], [bmsql_oorder.o_c_id], [bmsql_oorder.o_id]), range(402,1,79,MIN ; 402,1,79,MAX), 
      range_cond([bmsql_oorder.o_w_id = 402], [bmsql_oorder.o_d_id = 1], [bmsql_oorder.o_c_id = 79])
  5 - output([bmsql_oorder.o_id], [bmsql_oorder.o_entry_d], [bmsql_oorder.o_carrier_id]), filter([bmsql_oorder.o_c_id = 79]), rowset=16
      access([GROUP_ID], [bmsql_oorder.o_id], [bmsql_oorder.o_c_id], [bmsql_oorder.o_entry_d], [bmsql_oorder.o_carrier_id]), partitions(p0)
      is_index_back=false, is_global_index=false, filter_before_indexback[false], 
      range_key([bmsql_oorder.o_w_id], [bmsql_oorder.o_d_id], [bmsql_oorder.o_id]), range(MIN ; MAX), 
      range_cond([bmsql_oorder.o_w_id = 402], [bmsql_oorder.o_d_id = 1], [bmsql_oorder.o_id = :0])
SELECT o_id, o_entry_d, o_carrier_id FROM bmsql_oorder WHERE o_w_id = 402 AND o_d_id = 1 AND o_c_id = 79 AND o_id = ( SELECT max(o_id) FROM bmsql_oorder WHERE o_w_id = 402 AND o_d_id = 1 AND o_c_id = 79 );
+------+-----------+--------------+
| o_id | o_entry_d | o_carrier_id |
+------+-----------+--------------+
+------+-----------+--------------+

drop table if exists `bb`,`cc`;
CREATE TABLE `bb` (
  `col_varchar` varchar(1) DEFAULT NULL,
  `pk` int(11) NOT NULL,
  `col_varchar_20` varchar(20) DEFAULT NULL,
  `col_varchar_10` varchar(10) DEFAULT NULL,
  `col_int` int(11) DEFAULT NULL,
  `col_int_key` int(11) DEFAULT NULL,
  `col_varchar_10_key` varchar(10) DEFAULT NULL,
  `col_varchar_key` varchar(1) DEFAULT NULL,
  `col_varchar_20_key` varchar(20) DEFAULT NULL,
  PRIMARY KEY (`pk`),
  KEY `idx1` (`pk`, `col_int_key`) BLOCK_SIZE 16384,
  KEY `idx5` (`pk`, `col_varchar_10_key`) BLOCK_SIZE 16384,
  KEY `idx3` (`pk`, `col_varchar_key`) BLOCK_SIZE 16384,
  KEY `idx7` (`pk`, `col_varchar_20_key`) BLOCK_SIZE 16384
) ;
CREATE TABLE `cc` (
  `col_int` int(11) DEFAULT NULL,
  `col_varchar_10_key` varchar(10) DEFAULT NULL,
  `col_varchar_20` varchar(20) DEFAULT NULL,
  `col_varchar_20_key` varchar(20) DEFAULT NULL,
  `col_varchar_key` varchar(1) DEFAULT NULL,
  `col_varchar` varchar(1) DEFAULT NULL,
  `pk` int(11) NOT NULL,
  `col_varchar_10` varchar(10) DEFAULT NULL,
  `col_int_key` int(11) DEFAULT NULL,
  PRIMARY KEY (`pk`),
  KEY `idx5` (`pk`, `col_varchar_10_key`) BLOCK_SIZE 16384,
  KEY `idx7` (`pk`, `col_varchar_20_key`) BLOCK_SIZE 16384,
  KEY `idx3` (`pk`, `col_varchar_key`) BLOCK_SIZE 16384,
  KEY `idx1` (`pk`, `col_int_key`) BLOCK_SIZE 16384
) ;
EXPLAIN SELECT table1 . `col_varchar_key` AS field1,
       table1 . col_varchar_key AS field2
FROM (CC AS table1 INNER JOIN BB AS table2 ON (table2 . `col_int` = table1 . `col_int_key`))
WHERE ((SELECT DISTINCT COUNT(SUBQUERY1_t1 . `col_varchar_20_key`) AS SUBQUERY1_field1 FROM BB AS SUBQUERY1_t1) IS NULL)
  OR (table1 . `col_varchar_10_key` >= table2 . `col_varchar_10_key`
      OR table1 . `col_varchar` IS NULL)
ORDER BY field1, field2;
Query Plan
===========================================================================
|ID|OPERATOR                     |NAME              |EST.ROWS|EST.TIME(us)|
---------------------------------------------------------------------------
|0 |SORT                         |                  |28      |26          |
|1 |└─NESTED-LOOP JOIN CARTESIAN |                  |28      |20          |
|2 |  ├─SUBPLAN SCAN             |VIEW1             |1       |3           |
|3 |  │ └─SCALAR GROUP BY        |                  |1       |3           |
|4 |  │   └─TABLE FULL SCAN      |SUBQUERY1_t1(idx7)|28      |3           |
|5 |  └─HASH JOIN                |                  |28      |16          |
|6 |    ├─TABLE FULL SCAN        |table2            |28      |3           |
|7 |    └─TABLE FULL SCAN        |table1            |29      |3           |
===========================================================================
Outputs & filters:
-------------------------------------
  0 - output([table1.col_varchar_key], [table1.col_varchar_key]), filter(nil), rowset=256
      sort_keys([table1.col_varchar_key, ASC])
  1 - output([table1.col_varchar_key]), filter(nil), rowset=256
      conds(nil), nl_params_(nil), use_batch=false
  2 - output(nil), filter(nil), rowset=256
      access(nil)
  3 - output([T_FUN_COUNT_SUM(T_FUN_COUNT(SUBQUERY1_t1.col_varchar_20_key))]), filter(nil), rowset=256
      group(nil), agg_func([T_FUN_COUNT_SUM(T_FUN_COUNT(SUBQUERY1_t1.col_varchar_20_key))])
  4 - output([T_FUN_COUNT(SUBQUERY1_t1.col_varchar_20_key)]), filter(nil), rowset=256
      access([SUBQUERY1_t1.col_varchar_20_key]), partitions(p0)
      is_index_back=false, is_global_index=false, 
      range_key([SUBQUERY1_t1.pk], [SUBQUERY1_t1.col_varchar_20_key]), range(MIN,MIN ; MAX,MAX)always true, 
      pushdown_aggregation([T_FUN_COUNT(SUBQUERY1_t1.col_varchar_20_key)])
  5 - output([table1.col_varchar_key]), filter(nil), rowset=256
      equal_conds([table2.col_int = table1.col_int_key]), other_conds([table1.col_varchar_10_key >= table2.col_varchar_10_key OR table1.col_varchar IS NULL])
  6 - output([table2.col_int], [table2.col_varchar_10_key]), filter(nil), rowset=256
      access([table2.col_int], [table2.col_varchar_10_key]), partitions(p0)
      is_index_back=false, is_global_index=false, 
      range_key([table2.pk]), range(MIN ; MAX)always true
  7 - output([table1.col_int_key], [table1.col_varchar_10_key], [table1.col_varchar], [table1.col_varchar_key]), filter(nil), rowset=256
      access([table1.col_int_key], [table1.col_varchar_10_key], [table1.col_varchar], [table1.col_varchar_key]), partitions(p0)
      is_index_back=false, is_global_index=false, 
      range_key([table1.pk]), range(MIN ; MAX)always true
SELECT table1 . `col_varchar_key` AS field1,
       table1 . col_varchar_key AS field2
FROM (CC AS table1 INNER JOIN BB AS table2 ON (table2 . `col_int` = table1 . `col_int_key`))
WHERE ((SELECT DISTINCT COUNT(SUBQUERY1_t1 . `col_varchar_20_key`) AS SUBQUERY1_field1 FROM BB AS SUBQUERY1_t1) IS NULL)
  OR (table1 . `col_varchar_10_key` >= table2 . `col_varchar_10_key`
      OR table1 . `col_varchar` IS NULL)
ORDER BY field1, field2;
+--------+--------+
| field1 | field2 |
+--------+--------+
| NULL   | NULL   |
| NULL   | NULL   |
| NULL   | NULL   |
| NULL   | NULL   |
| NULL   | NULL   |
| NULL   | NULL   |
| b      | b      |
| b      | b      |
| b      | b      |
| c      | c      |
| c      | c      |
| h      | h      |
| h      | h      |
| h      | h      |
| p      | p      |
| r      | r      |
| t      | t      |
| w      | w      |
| w      | w      |
| y      | y      |
| y      | y      |
| y      | y      |
+--------+--------+

EXPLAIN SELECT /*+no_rewrite*/ table1 . `col_varchar_key` AS field1,
       table1 . col_varchar_key AS field2
FROM (CC AS table1 INNER JOIN BB AS table2 ON (table2 . `col_int` = table1 . `col_int_key`))
WHERE ((SELECT DISTINCT COUNT(SUBQUERY1_t1 . `col_varchar_20_key`) AS SUBQUERY1_field1 FROM BB AS SUBQUERY1_t1) IS NULL)
  OR (table1 . `col_varchar_10_key` >= table2 . `col_varchar_10_key`
      OR table1 . `col_varchar` IS NULL)
ORDER BY field1, field2;
Query Plan
===================================================================
|ID|OPERATOR             |NAME              |EST.ROWS|EST.TIME(us)|
-------------------------------------------------------------------
|0 |SORT                 |                  |36      |28          |
|1 |└─SUBPLAN FILTER     |                  |36      |19          |
|2 |  ├─HASH JOIN        |                  |36      |16          |
|3 |  │ ├─TABLE FULL SCAN|table2            |28      |3           |
|4 |  │ └─TABLE FULL SCAN|table1            |29      |3           |
|5 |  └─SCALAR GROUP BY  |                  |1       |3           |
|6 |    └─TABLE FULL SCAN|SUBQUERY1_t1(idx7)|28      |3           |
===================================================================
Outputs & filters:
-------------------------------------
  0 - output([table1.col_varchar_key], [table1.col_varchar_key]), filter(nil), rowset=256
      sort_keys([table1.col_varchar_key, ASC])
  1 - output([table1.col_varchar_key]), filter(nil), rowset=256
      exec_params_(nil), onetime_exprs_([subquery(1)(:0)]), init_plan_idxs_(nil), use_batch=false
  2 - output([table1.col_varchar_key]), filter(nil), rowset=256
      equal_conds([table2.col_int = table1.col_int_key]), other_conds([(T_OP_OR, :0 IS NULL, table1.col_varchar_10_key >= table2.col_varchar_10_key, table1.col_varchar 
      IS NULL)])
  3 - output([table2.col_int], [table2.col_varchar_10_key]), filter(nil), rowset=256
      access([table2.col_int], [table2.col_varchar_10_key]), partitions(p0)
      is_index_back=false, is_global_index=false, 
      range_key([table2.pk]), range(MIN ; MAX)always true
  4 - output([table1.col_int_key], [table1.col_varchar_10_key], [table1.col_varchar], [table1.col_varchar_key]), filter(nil), rowset=256
      access([table1.col_int_key], [table1.col_varchar_10_key], [table1.col_varchar], [table1.col_varchar_key]), partitions(p0)
      is_index_back=false, is_global_index=false, 
      range_key([table1.pk]), range(MIN ; MAX)always true
  5 - output([T_FUN_COUNT_SUM(T_FUN_COUNT(SUBQUERY1_t1.col_varchar_20_key))]), filter(nil), rowset=256
      group(nil), agg_func([T_FUN_COUNT_SUM(T_FUN_COUNT(SUBQUERY1_t1.col_varchar_20_key))])
  6 - output([T_FUN_COUNT(SUBQUERY1_t1.col_varchar_20_key)]), filter(nil), rowset=256
      access([SUBQUERY1_t1.col_varchar_20_key]), partitions(p0)
      is_index_back=false, is_global_index=false, 
      range_key([SUBQUERY1_t1.pk], [SUBQUERY1_t1.col_varchar_20_key]), range(MIN,MIN ; MAX,MAX)always true, 
      pushdown_aggregation([T_FUN_COUNT(SUBQUERY1_t1.col_varchar_20_key)])
SELECT /*+no_rewrite*/ table1 . `col_varchar_key` AS field1,
       table1 . col_varchar_key AS field2
FROM (CC AS table1 INNER JOIN BB AS table2 ON (table2 . `col_int` = table1 . `col_int_key`))
WHERE ((SELECT DISTINCT COUNT(SUBQUERY1_t1 . `col_varchar_20_key`) AS SUBQUERY1_field1 FROM BB AS SUBQUERY1_t1) IS NULL)
  OR (table1 . `col_varchar_10_key` >= table2 . `col_varchar_10_key`
      OR table1 . `col_varchar` IS NULL)
ORDER BY field1, field2;
+--------+--------+
| field1 | field2 |
+--------+--------+
| NULL   | NULL   |
| NULL   | NULL   |
| NULL   | NULL   |
| NULL   | NULL   |
| NULL   | NULL   |
| NULL   | NULL   |
| b      | b      |
| b      | b      |
| b      | b      |
| c      | c      |
| c      | c      |
| h      | h      |
| h      | h      |
| h      | h      |
| p      | p      |
| r      | r      |
| t      | t      |
| w      | w      |
| w      | w      |
| y      | y      |
| y      | y      |
| y      | y      |
+--------+--------+

drop table if exists `b`,`c`,`d`;
CREATE TABLE `b` (
  `col_varchar_20_key` varchar(20) DEFAULT NULL,
  `col_varchar_20` varchar(20) DEFAULT NULL,
  `col_varchar_10` varchar(10) DEFAULT NULL,
  `pk` int(11) NOT NULL,
  `col_varchar_key` varchar(1) DEFAULT NULL,
  `col_int` int(11) DEFAULT NULL,
  `col_varchar` varchar(1) DEFAULT NULL,
  `col_varchar_10_key` varchar(10) DEFAULT NULL,
  `col_int_key` int(11) DEFAULT NULL,
  PRIMARY KEY (`pk`),
  KEY `idx7` (`pk`, `col_varchar_20_key`) ,
  KEY `idx3` (`pk`, `col_varchar_key`) ,
  KEY `idx5` (`pk`, `col_varchar_10_key`) ,
  KEY `idx1` (`pk`, `col_int_key`) 
) ;
CREATE TABLE `c` (
  `col_varchar_10_key` varchar(10) DEFAULT NULL,
  `col_varchar_key` varchar(1) DEFAULT NULL,
  `col_int_key` int(11) DEFAULT NULL,
  `col_int` int(11) DEFAULT NULL,
  `pk` int(11) NOT NULL,
  `col_varchar_10` varchar(10) DEFAULT NULL,
  `col_varchar_20` varchar(20) DEFAULT NULL,
  `col_varchar` varchar(1) DEFAULT NULL,
  `col_varchar_20_key` varchar(20) DEFAULT NULL,
  PRIMARY KEY (`pk`),
  KEY `idx5` (`pk`, `col_varchar_10_key`) ,
  KEY `idx3` (`pk`, `col_varchar_key`) ,
  KEY `idx1` (`pk`, `col_int_key`) ,
  KEY `idx7` (`pk`, `col_varchar_20_key`) 
) ;
CREATE TABLE `d` (
  `col_varchar_20` varchar(20) DEFAULT NULL,
  `col_varchar` varchar(1) DEFAULT NULL,
  `col_varchar_key` varchar(1) DEFAULT NULL,
  `pk` int(11) NOT NULL,
  `col_varchar_10` varchar(10) DEFAULT NULL,
  `col_int` int(11) DEFAULT NULL,
  `col_varchar_20_key` varchar(20) DEFAULT NULL,
  `col_int_key` int(11) DEFAULT NULL,
  `col_varchar_10_key` varchar(10) DEFAULT NULL,
  PRIMARY KEY (`pk`),
  KEY `idx3` (`pk`, `col_varchar_key`) ,
  KEY `idx7` (`pk`, `col_varchar_20_key`) ,
  KEY `idx1` (`pk`, `col_int_key`) ,
  KEY `idx5` (`pk`, `col_varchar_10_key`) 
) ;
EXPLAIN SELECT table1 . col_varchar_key AS field1,
       table1 . col_int_key AS field2
FROM (B AS table1
      LEFT  JOIN ((
                     (SELECT SUBQUERY1_t2 . *
                      FROM (D AS SUBQUERY1_t1
                            INNER JOIN C AS SUBQUERY1_t2 ON (SUBQUERY1_t2 . `pk` = SUBQUERY1_t1 . `pk`))) AS table2
                   LEFT  JOIN
                     (SELECT SUBQUERY2_t1 . *
                      FROM (C AS SUBQUERY2_t1
                            LEFT  JOIN (B AS SUBQUERY2_t2
                                        INNER JOIN C AS SUBQUERY2_t3 ON (SUBQUERY2_t3 . `col_varchar_10` = SUBQUERY2_t2 . `col_varchar_key`
                                                                         AND SUBQUERY2_t3 . `pk` <=
                                                                           (SELECT MAX(CHILD_SUBQUERY1_t1 . `col_int_key`) AS CHILD_SUBQUERY1_field1
                                                                            FROM B AS CHILD_SUBQUERY1_t1))) ON (SUBQUERY2_t3 . `col_int` = SUBQUERY2_t2 . `col_int_key`))) AS table3 ON (table3 . `col_int` = table2 . `pk`))) ON (table3 . `col_int_key` = table2 . `col_int_key`))
WHERE (table3 . `col_varchar_20` IN
         (SELECT 'f'
          UNION SELECT 'h'))
  AND table1 . `col_varchar_key` = table2 . `col_varchar_key`
HAVING field2 < 126
ORDER BY field1,
         field2;
Query Plan
===================================================================================================
|ID|OPERATOR                                       |NAME                    |EST.ROWS|EST.TIME(us)|
---------------------------------------------------------------------------------------------------
|0 |SORT                                           |                        |1       |21          |
|1 |└─SUBPLAN FILTER                               |                        |1       |21          |
|2 |  ├─HASH JOIN                                  |                        |1       |19          |
|3 |  │ ├─HASH JOIN                                |                        |1       |18          |
|4 |  │ │ ├─MERGE JOIN                             |                        |1       |15          |
|5 |  │ │ │ ├─MERGE JOIN                           |                        |1       |10          |
|6 |  │ │ │ │ ├─TABLE FULL SCAN                    |SUBQUERY1_t2            |2       |3           |
|7 |  │ │ │ │ └─SORT                               |                        |2       |8           |
|8 |  │ │ │ │   └─NESTED-LOOP OUTER JOIN CARTESIAN |                        |2       |8           |
|9 |  │ │ │ │     ├─TABLE FULL SCAN                |SUBQUERY2_t1            |2       |3           |
|10|  │ │ │ │     └─MATERIAL                       |                        |1       |5           |
|11|  │ │ │ │       └─HASH JOIN                    |                        |1       |5           |
|12|  │ │ │ │         ├─TABLE FULL SCAN            |SUBQUERY2_t2            |1       |3           |
|13|  │ │ │ │         └─TABLE RANGE SCAN           |SUBQUERY2_t3            |1       |3           |
|14|  │ │ │ └─TABLE FULL SCAN                      |SUBQUERY1_t1(idx3)      |100     |5           |
|15|  │ │ └─TABLE FULL SCAN                        |table1                  |1       |3           |
|16|  │ └─SUBPLAN SCAN                             |VIEW2                   |2       |1           |
|17|  │   └─HASH DISTINCT                          |                        |2       |1           |
|18|  │     └─VALUES TABLE ACCESS                  |VALUES_TABLE1           |2       |1           |
|19|  └─SCALAR GROUP BY                            |                        |1       |3           |
|20|    └─TABLE FULL SCAN                          |CHILD_SUBQUERY1_t1(idx1)|1       |3           |
===================================================================================================
Outputs & filters:
-------------------------------------
  0 - output([table1.col_varchar_key], [table1.col_int_key]), filter(nil), rowset=256
      sort_keys([table1.col_varchar_key, ASC], [table1.col_int_key, ASC])
  1 - output([table1.col_varchar_key], [table1.col_int_key]), filter(nil), rowset=256
      exec_params_(nil), onetime_exprs_([subquery(1)(:0)]), init_plan_idxs_(nil), use_batch=false
  2 - output([table1.col_varchar_key], [table1.col_int_key]), filter(nil), rowset=256
      equal_conds([SUBQUERY2_t1.col_varchar_20 = VIEW2.f]), other_conds(nil)
  3 - output([table1.col_varchar_key], [table1.col_int_key], [SUBQUERY2_t1.col_varchar_20]), filter(nil), rowset=256
      equal_conds([table1.col_varchar_key = SUBQUERY1_t2.col_varchar_key]), other_conds(nil)
  4 - output([SUBQUERY1_t2.col_varchar_key], [SUBQUERY2_t1.col_varchar_20]), filter(nil), rowset=256
      equal_conds([SUBQUERY1_t2.pk = SUBQUERY1_t1.pk]), other_conds(nil)
      merge_directions([ASC])
  5 - output([SUBQUERY1_t2.pk], [SUBQUERY1_t2.col_varchar_key], [SUBQUERY2_t1.col_varchar_20]), filter(nil), rowset=256
      equal_conds([SUBQUERY2_t1.col_int = SUBQUERY1_t2.pk], [SUBQUERY2_t1.col_int_key = SUBQUERY1_t2.col_int_key]), other_conds(nil)
      merge_directions([ASC], [ASC])
  6 - output([SUBQUERY1_t2.pk], [SUBQUERY1_t2.col_varchar_key], [SUBQUERY1_t2.col_int_key]), filter(nil), rowset=256
      access([SUBQUERY1_t2.pk], [SUBQUERY1_t2.col_varchar_key], [SUBQUERY1_t2.col_int_key]), partitions(p0)
      is_index_back=false, is_global_index=false, 
      range_key([SUBQUERY1_t2.pk]), range(MIN ; MAX)always true
  7 - output([SUBQUERY2_t1.col_int], [SUBQUERY2_t1.col_int_key], [SUBQUERY2_t1.col_varchar_20]), filter(nil), rowset=256
      sort_keys([SUBQUERY2_t1.col_int, ASC], [SUBQUERY2_t1.col_int_key, ASC])
  8 - output([SUBQUERY2_t1.col_int], [SUBQUERY2_t1.col_int_key], [SUBQUERY2_t1.col_varchar_20]), filter(nil), rowset=256
      conds(nil), nl_params_(nil), use_batch=false
  9 - output([SUBQUERY2_t1.col_int_key], [SUBQUERY2_t1.col_int], [SUBQUERY2_t1.col_varchar_20]), filter(nil), rowset=256
      access([SUBQUERY2_t1.col_int_key], [SUBQUERY2_t1.col_int], [SUBQUERY2_t1.col_varchar_20]), partitions(p0)
      is_index_back=false, is_global_index=false, 
      range_key([SUBQUERY2_t1.pk]), range(MIN ; MAX)always true
 10 - output(nil), filter(nil), rowset=256
 11 - output(nil), filter(nil), rowset=256
      equal_conds([SUBQUERY2_t3.col_int = SUBQUERY2_t2.col_int_key], [SUBQUERY2_t3.col_varchar_10 = SUBQUERY2_t2.col_varchar_key]), other_conds(nil)
 12 - output([SUBQUERY2_t2.col_varchar_key], [SUBQUERY2_t2.col_int_key]), filter(nil), rowset=256
      access([SUBQUERY2_t2.col_varchar_key], [SUBQUERY2_t2.col_int_key]), partitions(p0)
      is_index_back=false, is_global_index=false, 
      range_key([SUBQUERY2_t2.pk]), range(MIN ; MAX)always true
 13 - output([SUBQUERY2_t3.col_varchar_10], [SUBQUERY2_t3.col_int]), filter(nil), rowset=256
      access([SUBQUERY2_t3.col_varchar_10], [SUBQUERY2_t3.col_int]), partitions(p0)
      is_index_back=false, is_global_index=false, 
      range_key([SUBQUERY2_t3.pk]), range(MIN ; MAX)always true, 
      range_cond([SUBQUERY2_t3.pk <= :0])
 14 - output([SUBQUERY1_t1.pk]), filter(nil), rowset=256
      access([SUBQUERY1_t1.pk]), partitions(p0)
      is_index_back=false, is_global_index=false, 
      range_key([SUBQUERY1_t1.pk], [SUBQUERY1_t1.col_varchar_key]), range(MIN,MIN ; MAX,MAX)always true
 15 - output([table1.col_varchar_key], [table1.col_int_key]), filter([table1.col_int_key < 126]), rowset=256
      access([table1.col_varchar_key], [table1.col_int_key]), partitions(p0)
      is_index_back=false, is_global_index=false, filter_before_indexback[false], 
      range_key([table1.pk]), range(MIN ; MAX)always true
 16 - output([VIEW2.f]), filter(nil), rowset=256
      access([VIEW2.f])
 17 - output([VALUES_TABLE1.column_0]), filter(nil), rowset=256
      distinct([VALUES_TABLE1.column_0])
 18 - output([VALUES_TABLE1.column_0]), filter(nil)
      access([VALUES_TABLE1.column_0])
 19 - output([T_FUN_MAX(T_FUN_MAX(CHILD_SUBQUERY1_t1.col_int_key))]), filter(nil), rowset=256
      group(nil), agg_func([T_FUN_MAX(T_FUN_MAX(CHILD_SUBQUERY1_t1.col_int_key))])
 20 - output([T_FUN_MAX(CHILD_SUBQUERY1_t1.col_int_key)]), filter(nil), rowset=256
      access([CHILD_SUBQUERY1_t1.col_int_key]), partitions(p0)
      is_index_back=false, is_global_index=false, 
      range_key([CHILD_SUBQUERY1_t1.pk], [CHILD_SUBQUERY1_t1.col_int_key]), range(MIN,MIN ; MAX,MAX)always true, 
      pushdown_aggregation([T_FUN_MAX(CHILD_SUBQUERY1_t1.col_int_key)])
SELECT table1 . col_varchar_key AS field1,
       table1 . col_int_key AS field2
FROM (B AS table1
      LEFT  JOIN ((
                     (SELECT SUBQUERY1_t2 . *
                      FROM (D AS SUBQUERY1_t1
                            INNER JOIN C AS SUBQUERY1_t2 ON (SUBQUERY1_t2 . `pk` = SUBQUERY1_t1 . `pk`))) AS table2
                   LEFT  JOIN
                     (SELECT SUBQUERY2_t1 . *
                      FROM (C AS SUBQUERY2_t1
                            LEFT  JOIN (B AS SUBQUERY2_t2
                                        INNER JOIN C AS SUBQUERY2_t3 ON (SUBQUERY2_t3 . `col_varchar_10` = SUBQUERY2_t2 . `col_varchar_key`
                                                                         AND SUBQUERY2_t3 . `pk` <=
                                                                           (SELECT MAX(CHILD_SUBQUERY1_t1 . `col_int_key`) AS CHILD_SUBQUERY1_field1
                                                                            FROM B AS CHILD_SUBQUERY1_t1))) ON (SUBQUERY2_t3 . `col_int` = SUBQUERY2_t2 . `col_int_key`))) AS table3 ON (table3 . `col_int` = table2 . `pk`))) ON (table3 . `col_int_key` = table2 . `col_int_key`))
WHERE (table3 . `col_varchar_20` IN
         (SELECT 'f'
          UNION SELECT 'h'))
  AND table1 . `col_varchar_key` = table2 . `col_varchar_key`
HAVING field2 < 126
ORDER BY field1,
         field2;
+--------+--------+
| field1 | field2 |
+--------+--------+
+--------+--------+
EXPLAIN SELECT /*+no_rewrite*/ table1 . col_varchar_key AS field1,
       table1 . col_int_key AS field2
FROM (B AS table1
      LEFT  JOIN ((
                     (SELECT SUBQUERY1_t2 . *
                      FROM (D AS SUBQUERY1_t1
                            INNER JOIN C AS SUBQUERY1_t2 ON (SUBQUERY1_t2 . `pk` = SUBQUERY1_t1 . `pk`))) AS table2
                   LEFT  JOIN
                     (SELECT SUBQUERY2_t1 . *
                      FROM (C AS SUBQUERY2_t1
                            LEFT  JOIN (B AS SUBQUERY2_t2
                                        INNER JOIN C AS SUBQUERY2_t3 ON (SUBQUERY2_t3 . `col_varchar_10` = SUBQUERY2_t2 . `col_varchar_key`
                                                                         AND SUBQUERY2_t3 . `pk` <=
                                                                           (SELECT MAX(CHILD_SUBQUERY1_t1 . `col_int_key`) AS CHILD_SUBQUERY1_field1
                                                                            FROM B AS CHILD_SUBQUERY1_t1))) ON (SUBQUERY2_t3 . `col_int` = SUBQUERY2_t2 . `col_int_key`))) AS table3 ON (table3 . `col_int` = table2 . `pk`))) ON (table3 . `col_int_key` = table2 . `col_int_key`))
WHERE (table3 . `col_varchar_20` IN
         (SELECT 'f'
          UNION SELECT 'h'))
  AND table1 . `col_varchar_key` = table2 . `col_varchar_key`
HAVING field2 < 126
ORDER BY field1,
         field2;
Query Plan
=====================================================================================================
|ID|OPERATOR                                         |NAME                    |EST.ROWS|EST.TIME(us)|
-----------------------------------------------------------------------------------------------------
|0 |SORT                                             |                        |1       |21          |
|1 |└─SUBPLAN FILTER                                 |                        |1       |21          |
|2 |  ├─NESTED-LOOP OUTER JOIN                       |                        |2       |20          |
|3 |  │ ├─TABLE FULL SCAN                            |table1                  |1       |3           |
|4 |  │ └─MATERIAL                                   |                        |2       |18          |
|5 |  │   └─MERGE OUTER JOIN                         |                        |2       |18          |
|6 |  │     ├─SUBPLAN SCAN                           |table2                  |2       |8           |
|7 |  │     │ └─MERGE JOIN                           |                        |2       |8           |
|8 |  │     │   ├─TABLE FULL SCAN                    |SUBQUERY1_t2            |2       |3           |
|9 |  │     │   └─TABLE FULL SCAN                    |SUBQUERY1_t1(idx3)      |100     |5           |
|10|  │     └─SORT                                   |                        |2       |10          |
|11|  │       └─SUBPLAN SCAN                         |table3                  |2       |10          |
|12|  │         └─SUBPLAN FILTER                     |                        |2       |10          |
|13|  │           ├─NESTED-LOOP OUTER JOIN CARTESIAN |                        |2       |8           |
|14|  │           │ ├─TABLE FULL SCAN                |SUBQUERY2_t1            |2       |3           |
|15|  │           │ └─MATERIAL                       |                        |1       |5           |
|16|  │           │   └─HASH JOIN                    |                        |1       |5           |
|17|  │           │     ├─TABLE FULL SCAN            |SUBQUERY2_t2            |1       |3           |
|18|  │           │     └─TABLE RANGE SCAN           |SUBQUERY2_t3            |1       |3           |
|19|  │           └─SCALAR GROUP BY                  |                        |1       |3           |
|20|  │             └─TABLE FULL SCAN                |CHILD_SUBQUERY1_t1(idx1)|1       |3           |
|21|  └─HASH DISTINCT                                |                        |2       |1           |
|22|    └─VALUES TABLE ACCESS                        |VALUES_TABLE1           |2       |1           |
=====================================================================================================
Outputs & filters:
-------------------------------------
  0 - output([table1.col_varchar_key], [table1.col_int_key]), filter(nil), rowset=256
      sort_keys([table1.col_varchar_key, ASC], [table1.col_int_key, ASC])
  1 - output([table1.col_varchar_key], [table1.col_int_key]), filter([table3.col_varchar_20 = ANY(subquery(1))]), rowset=256
      exec_params_(nil), onetime_exprs_(nil), init_plan_idxs_([1]), use_batch=false
  2 - output([table1.col_varchar_key], [table1.col_int_key], [table3.col_varchar_20]), filter([table1.col_varchar_key = table2.col_varchar_key]), rowset=256
      conds(nil), nl_params_(nil), use_batch=false
  3 - output([table1.col_varchar_key], [table1.col_int_key]), filter([table1.col_int_key < 126]), rowset=256
      access([table1.col_varchar_key], [table1.col_int_key]), partitions(p0)
      is_index_back=false, is_global_index=false, filter_before_indexback[false], 
      range_key([table1.pk]), range(MIN ; MAX)always true
  4 - output([table2.col_varchar_key], [table3.col_varchar_20]), filter(nil), rowset=256
  5 - output([table2.col_varchar_key], [table3.col_varchar_20]), filter([table3.col_int_key = table2.col_int_key]), rowset=256
      equal_conds([table3.col_int = table2.pk]), other_conds(nil)
      merge_directions([ASC])
  6 - output([table2.col_varchar_key], [table2.col_int_key], [table2.pk]), filter(nil), rowset=256
      access([table2.col_varchar_key], [table2.col_int_key], [table2.pk])
  7 - output([SUBQUERY1_t2.col_varchar_key], [SUBQUERY1_t2.col_int_key], [SUBQUERY1_t2.pk]), filter(nil), rowset=256
      equal_conds([SUBQUERY1_t2.pk = SUBQUERY1_t1.pk]), other_conds(nil)
      merge_directions([ASC])
  8 - output([SUBQUERY1_t2.pk], [SUBQUERY1_t2.col_varchar_key], [SUBQUERY1_t2.col_int_key]), filter(nil), rowset=256
      access([SUBQUERY1_t2.pk], [SUBQUERY1_t2.col_varchar_key], [SUBQUERY1_t2.col_int_key]), partitions(p0)
      is_index_back=false, is_global_index=false, 
      range_key([SUBQUERY1_t2.pk]), range(MIN ; MAX)always true
  9 - output([SUBQUERY1_t1.pk]), filter(nil), rowset=256
      access([SUBQUERY1_t1.pk]), partitions(p0)
      is_index_back=false, is_global_index=false, 
      range_key([SUBQUERY1_t1.pk], [SUBQUERY1_t1.col_varchar_key]), range(MIN,MIN ; MAX,MAX)always true
 10 - output([table3.col_int], [table3.col_int_key], [table3.col_varchar_20]), filter(nil), rowset=256
      sort_keys([table3.col_int, ASC])
 11 - output([table3.col_int_key], [table3.col_int], [table3.col_varchar_20]), filter(nil), rowset=256
      access([table3.col_int_key], [table3.col_int], [table3.col_varchar_20])
 12 - output([SUBQUERY2_t1.col_int_key], [SUBQUERY2_t1.col_int], [SUBQUERY2_t1.col_varchar_20]), filter(nil), rowset=256
      exec_params_(nil), onetime_exprs_([subquery(1)(:0)]), init_plan_idxs_(nil), use_batch=false
 13 - output([SUBQUERY2_t1.col_int_key], [SUBQUERY2_t1.col_int], [SUBQUERY2_t1.col_varchar_20]), filter(nil), rowset=256
      conds(nil), nl_params_(nil), use_batch=false
 14 - output([SUBQUERY2_t1.col_int_key], [SUBQUERY2_t1.col_int], [SUBQUERY2_t1.col_varchar_20]), filter(nil), rowset=256
      access([SUBQUERY2_t1.col_int_key], [SUBQUERY2_t1.col_int], [SUBQUERY2_t1.col_varchar_20]), partitions(p0)
      is_index_back=false, is_global_index=false, 
      range_key([SUBQUERY2_t1.pk]), range(MIN ; MAX)always true
 15 - output(nil), filter(nil), rowset=256
 16 - output(nil), filter(nil), rowset=256
      equal_conds([SUBQUERY2_t3.col_int = SUBQUERY2_t2.col_int_key], [SUBQUERY2_t3.col_varchar_10 = SUBQUERY2_t2.col_varchar_key]), other_conds(nil)
 17 - output([SUBQUERY2_t2.col_varchar_key], [SUBQUERY2_t2.col_int_key]), filter(nil), rowset=256
      access([SUBQUERY2_t2.col_varchar_key], [SUBQUERY2_t2.col_int_key]), partitions(p0)
      is_index_back=false, is_global_index=false, 
      range_key([SUBQUERY2_t2.pk]), range(MIN ; MAX)always true
 18 - output([SUBQUERY2_t3.col_varchar_10], [SUBQUERY2_t3.col_int]), filter(nil), rowset=256
      access([SUBQUERY2_t3.col_varchar_10], [SUBQUERY2_t3.col_int]), partitions(p0)
      is_index_back=false, is_global_index=false, 
      range_key([SUBQUERY2_t3.pk]), range(MIN ; MAX)always true, 
      range_cond([SUBQUERY2_t3.pk <= :0])
 19 - output([T_FUN_MAX(T_FUN_MAX(CHILD_SUBQUERY1_t1.col_int_key))]), filter(nil), rowset=256
      group(nil), agg_func([T_FUN_MAX(T_FUN_MAX(CHILD_SUBQUERY1_t1.col_int_key))])
 20 - output([T_FUN_MAX(CHILD_SUBQUERY1_t1.col_int_key)]), filter(nil), rowset=256
      access([CHILD_SUBQUERY1_t1.col_int_key]), partitions(p0)
      is_index_back=false, is_global_index=false, 
      range_key([CHILD_SUBQUERY1_t1.pk], [CHILD_SUBQUERY1_t1.col_int_key]), range(MIN,MIN ; MAX,MAX)always true, 
      pushdown_aggregation([T_FUN_MAX(CHILD_SUBQUERY1_t1.col_int_key)])
 21 - output([VALUES_TABLE1.column_0]), filter(nil), rowset=256
      distinct([VALUES_TABLE1.column_0])
 22 - output([VALUES_TABLE1.column_0]), filter(nil)
      access([VALUES_TABLE1.column_0])
SELECT /*+no_rewrite*/ table1 . col_varchar_key AS field1,
       table1 . col_int_key AS field2
FROM (B AS table1
      LEFT  JOIN ((
                     (SELECT SUBQUERY1_t2 . *
                      FROM (D AS SUBQUERY1_t1
                            INNER JOIN C AS SUBQUERY1_t2 ON (SUBQUERY1_t2 . `pk` = SUBQUERY1_t1 . `pk`))) AS table2
                   LEFT  JOIN
                     (SELECT SUBQUERY2_t1 . *
                      FROM (C AS SUBQUERY2_t1
                            LEFT  JOIN (B AS SUBQUERY2_t2
                                        INNER JOIN C AS SUBQUERY2_t3 ON (SUBQUERY2_t3 . `col_varchar_10` = SUBQUERY2_t2 . `col_varchar_key`
                                                                         AND SUBQUERY2_t3 . `pk` <=
                                                                           (SELECT MAX(CHILD_SUBQUERY1_t1 . `col_int_key`) AS CHILD_SUBQUERY1_field1
                                                                            FROM B AS CHILD_SUBQUERY1_t1))) ON (SUBQUERY2_t3 . `col_int` = SUBQUERY2_t2 . `col_int_key`))) AS table3 ON (table3 . `col_int` = table2 . `pk`))) ON (table3 . `col_int_key` = table2 . `col_int_key`))
WHERE (table3 . `col_varchar_20` IN
         (SELECT 'f'
          UNION SELECT 'h'))
  AND table1 . `col_varchar_key` = table2 . `col_varchar_key`
HAVING field2 < 126
ORDER BY field1,
         field2;
+--------+--------+
| field1 | field2 |
+--------+--------+
+--------+--------+

## bugs: 
drop table if exists t;
create table t (c1 int, c2 int);
EXPLAIN select * from t where t.c1 >= (select /*+unnest*/ min(c1) from t v where v.c2 = t.c2);
Query Plan
======================================================
|ID|OPERATOR             |NAME |EST.ROWS|EST.TIME(us)|
------------------------------------------------------
|0 |SUBPLAN SCAN         |VIEW1|1       |5           |
|1 |└─WINDOW FUNCTION    |     |3       |5           |
|2 |  └─SORT             |     |3       |3           |
|3 |    └─TABLE FULL SCAN|v    |3       |3           |
======================================================
Outputs & filters:
-------------------------------------
  0 - output([VIEW1.v.c1], [VIEW1.v.c2]), filter([VIEW1.v.c1 >= VIEW1.min(c1)]), rowset=16
      access([VIEW1.min(c1)], [VIEW1.v.c2], [VIEW1.v.c1])
  1 - output([T_FUN_MIN(v.c1)], [v.c2], [v.c1]), filter(nil), rowset=16
      win_expr(T_FUN_MIN(v.c1)), partition_by([v.c2]), order_by(nil), window_type(RANGE), upper(UNBOUNDED PRECEDING), lower(UNBOUNDED FOLLOWING)
  2 - output([v.c2], [v.c1]), filter(nil), rowset=16
      sort_keys([v.c2, ASC])
  3 - output([v.c2], [v.c1]), filter([v.c2 IS NOT NULL]), rowset=16
      access([v.c2], [v.c1]), partitions(p0)
      is_index_back=false, is_global_index=false, filter_before_indexback[false], 
      range_key([v.__pk_increment]), range(MIN ; MAX)always true
select * from t where t.c1 >= (select /*+unnest*/ min(c1) from t v where v.c2 = t.c2);
+------+------+
| c1   | c2   |
+------+------+
+------+------+
EXPLAIN select /*+no_rewrite*/ * from t where t.c1 >= (select min(c1) from t v where v.c2 = t.c2);
Query Plan
===================================================
|ID|OPERATOR           |NAME|EST.ROWS|EST.TIME(us)|
---------------------------------------------------
|0 |SUBPLAN FILTER     |    |1       |57          |
|1 |├─TABLE FULL SCAN  |t   |3       |3           |
|2 |└─SCALAR GROUP BY  |    |1       |18          |
|3 |  └─TABLE FULL SCAN|v   |1       |18          |
===================================================
Outputs & filters:
-------------------------------------
  0 - output([t.c1], [t.c2]), filter([t.c1 >= subquery(1)]), rowset=16
      exec_params_([t.c2(:0)]), onetime_exprs_(nil), init_plan_idxs_(nil), use_batch=false
  1 - output([t.c2], [t.c1]), filter(nil), rowset=16
      access([t.c2], [t.c1]), partitions(p0)
      is_index_back=false, is_global_index=false, 
      range_key([t.__pk_increment]), range(MIN ; MAX)always true
  2 - output([T_FUN_MIN(T_FUN_MIN(v.c1))]), filter(nil), rowset=16
      group(nil), agg_func([T_FUN_MIN(T_FUN_MIN(v.c1))])
  3 - output([T_FUN_MIN(v.c1)]), filter([v.c2 = :0]), rowset=16
      access([v.c2], [v.c1]), partitions(p0)
      is_index_back=false, is_global_index=false, filter_before_indexback[false], 
      range_key([v.__pk_increment]), range(MIN ; MAX)always true, 
      pushdown_aggregation([T_FUN_MIN(v.c1)])
select /*+no_rewrite*/ * from t where t.c1 >= (select min(c1) from t v where v.c2 = t.c2);
+------+------+
| c1   | c2   |
+------+------+
+------+------+

EXPLAIN select c1, c2, (select /*+unnest*/ count(c1) from t v where v.c2 = t.c2) from t;
Query Plan
======================================================
|ID|OPERATOR             |NAME |EST.ROWS|EST.TIME(us)|
------------------------------------------------------
|0 |HASH OUTER JOIN      |     |3       |7           |
|1 |├─TABLE FULL SCAN    |t    |3       |3           |
|2 |└─SUBPLAN SCAN       |VIEW1|3       |4           |
|3 |  └─HASH GROUP BY    |     |3       |4           |
|4 |    └─TABLE FULL SCAN|v    |3       |3           |
======================================================
Outputs & filters:
-------------------------------------
  0 - output([t.c1], [t.c2], [CASE WHEN VIEW1.v.c2 IS NOT NULL THEN VIEW1.count(c1) ELSE 0 END]), filter(nil), rowset=16
      equal_conds([VIEW1.v.c2 = t.c2]), other_conds(nil)
  1 - output([t.c1], [t.c2]), filter(nil), rowset=16
      access([t.c1], [t.c2]), partitions(p0)
      is_index_back=false, is_global_index=false, 
      range_key([t.__pk_increment]), range(MIN ; MAX)always true
  2 - output([VIEW1.count(c1)], [VIEW1.v.c2]), filter(nil), rowset=16
      access([VIEW1.count(c1)], [VIEW1.v.c2])
  3 - output([T_FUN_COUNT(v.c1)], [v.c2]), filter(nil), rowset=16
      group([v.c2]), agg_func([T_FUN_COUNT(v.c1)])
  4 - output([v.c2], [v.c1]), filter(nil), rowset=16
      access([v.c2], [v.c1]), partitions(p0)
      is_index_back=false, is_global_index=false, 
      range_key([v.__pk_increment]), range(MIN ; MAX)always true
select c1, c2, (select /*+unnest*/ count(c1) from t v where v.c2 = t.c2) from t;
+------+------+-----------------------------------------------------------+
| c1   | c2   | (select /*+unnest*/ count(c1) from t v where v.c2 = t.c2) |
+------+------+-----------------------------------------------------------+
| NULL |    3 |                                                         0 |
|    2 | NULL |                                                         0 |
|    1 | NULL |                                                         0 |
+------+------+-----------------------------------------------------------+
EXPLAIN select /*+no_rewrite*/ c1, c2, (select count(c1) from t v where v.c2 = t.c2) from t;
Query Plan
===================================================
|ID|OPERATOR           |NAME|EST.ROWS|EST.TIME(us)|
---------------------------------------------------
|0 |SUBPLAN FILTER     |    |3       |57          |
|1 |├─TABLE FULL SCAN  |t   |3       |3           |
|2 |└─SCALAR GROUP BY  |    |1       |18          |
|3 |  └─TABLE FULL SCAN|v   |1       |18          |
===================================================
Outputs & filters:
-------------------------------------
  0 - output([t.c1], [t.c2], [subquery(1)]), filter(nil), rowset=16
      exec_params_([t.c2(:0)]), onetime_exprs_(nil), init_plan_idxs_(nil), use_batch=false
  1 - output([t.c1], [t.c2]), filter(nil), rowset=16
      access([t.c1], [t.c2]), partitions(p0)
      is_index_back=false, is_global_index=false, 
      range_key([t.__pk_increment]), range(MIN ; MAX)always true
  2 - output([T_FUN_COUNT_SUM(T_FUN_COUNT(v.c1))]), filter(nil), rowset=16
      group(nil), agg_func([T_FUN_COUNT_SUM(T_FUN_COUNT(v.c1))])
  3 - output([T_FUN_COUNT(v.c1)]), filter([v.c2 = :0]), rowset=16
      access([v.c2], [v.c1]), partitions(p0)
      is_index_back=false, is_global_index=false, filter_before_indexback[false], 
      range_key([v.__pk_increment]), range(MIN ; MAX)always true, 
      pushdown_aggregation([T_FUN_COUNT(v.c1)])
select /*+no_rewrite*/ c1, c2, (select count(c1) from t v where v.c2 = t.c2) from t;
+------+------+-----------------------------------------------+
| c1   | c2   | (select count(c1) from t v where v.c2 = t.c2) |
+------+------+-----------------------------------------------+
|    1 | NULL |                                             0 |
|    2 | NULL |                                             0 |
| NULL |    3 |                                             0 |
+------+------+-----------------------------------------------+

EXPLAIN select c1, c2, (select /*+unnest*/ count(1) from t v where v.c2 = t.c2) from t;
Query Plan
======================================================
|ID|OPERATOR             |NAME |EST.ROWS|EST.TIME(us)|
------------------------------------------------------
|0 |HASH OUTER JOIN      |     |3       |7           |
|1 |├─TABLE FULL SCAN    |t    |3       |3           |
|2 |└─SUBPLAN SCAN       |VIEW1|3       |3           |
|3 |  └─HASH GROUP BY    |     |3       |3           |
|4 |    └─TABLE FULL SCAN|v    |3       |3           |
======================================================
Outputs & filters:
-------------------------------------
  0 - output([t.c1], [t.c2], [CASE WHEN VIEW1.v.c2 IS NOT NULL THEN VIEW1.count(1) ELSE 0 END]), filter(nil), rowset=16
      equal_conds([VIEW1.v.c2 = t.c2]), other_conds(nil)
  1 - output([t.c1], [t.c2]), filter(nil), rowset=16
      access([t.c1], [t.c2]), partitions(p0)
      is_index_back=false, is_global_index=false, 
      range_key([t.__pk_increment]), range(MIN ; MAX)always true
  2 - output([VIEW1.count(1)], [VIEW1.v.c2]), filter(nil), rowset=16
      access([VIEW1.count(1)], [VIEW1.v.c2])
  3 - output([T_FUN_COUNT(*)], [v.c2]), filter(nil), rowset=16
      group([v.c2]), agg_func([T_FUN_COUNT(*)])
  4 - output([v.c2]), filter(nil), rowset=16
      access([v.c2]), partitions(p0)
      is_index_back=false, is_global_index=false, 
      range_key([v.__pk_increment]), range(MIN ; MAX)always true
select c1, c2, (select /*+unnest*/ count(1) from t v where v.c2 = t.c2) from t;
+------+------+----------------------------------------------------------+
| c1   | c2   | (select /*+unnest*/ count(1) from t v where v.c2 = t.c2) |
+------+------+----------------------------------------------------------+
| NULL |    3 |                                                        1 |
|    2 | NULL |                                                        0 |
|    1 | NULL |                                                        0 |
+------+------+----------------------------------------------------------+
EXPLAIN select /*+no_rewrite*/ c1, c2, (select count(1) from t v where v.c2 = t.c2) from t;
Query Plan
===================================================
|ID|OPERATOR           |NAME|EST.ROWS|EST.TIME(us)|
---------------------------------------------------
|0 |SUBPLAN FILTER     |    |3       |57          |
|1 |├─TABLE FULL SCAN  |t   |3       |3           |
|2 |└─SCALAR GROUP BY  |    |1       |18          |
|3 |  └─TABLE FULL SCAN|v   |1       |18          |
===================================================
Outputs & filters:
-------------------------------------
  0 - output([t.c1], [t.c2], [subquery(1)]), filter(nil), rowset=16
      exec_params_([t.c2(:0)]), onetime_exprs_(nil), init_plan_idxs_(nil), use_batch=false
  1 - output([t.c1], [t.c2]), filter(nil), rowset=16
      access([t.c1], [t.c2]), partitions(p0)
      is_index_back=false, is_global_index=false, 
      range_key([t.__pk_increment]), range(MIN ; MAX)always true
  2 - output([T_FUN_COUNT_SUM(T_FUN_COUNT(*))]), filter(nil), rowset=16
      group(nil), agg_func([T_FUN_COUNT_SUM(T_FUN_COUNT(*))])
  3 - output([T_FUN_COUNT(*)]), filter([v.c2 = :0]), rowset=16
      access([v.c2]), partitions(p0)
      is_index_back=false, is_global_index=false, filter_before_indexback[false], 
      range_key([v.__pk_increment]), range(MIN ; MAX)always true, 
      pushdown_aggregation([T_FUN_COUNT(*)])
select /*+no_rewrite*/ c1, c2, (select count(1) from t v where v.c2 = t.c2) from t;
+------+------+----------------------------------------------+
| c1   | c2   | (select count(1) from t v where v.c2 = t.c2) |
+------+------+----------------------------------------------+
|    1 | NULL |                                            0 |
|    2 | NULL |                                            0 |
| NULL |    3 |                                            1 |
+------+------+----------------------------------------------+

EXPLAIN select c1, c2, (select /*+unnest*/ count(*) from t v where v.c2 = t.c2) from t;
Query Plan
======================================================
|ID|OPERATOR             |NAME |EST.ROWS|EST.TIME(us)|
------------------------------------------------------
|0 |HASH OUTER JOIN      |     |3       |7           |
|1 |├─TABLE FULL SCAN    |t    |3       |3           |
|2 |└─SUBPLAN SCAN       |VIEW1|3       |3           |
|3 |  └─HASH GROUP BY    |     |3       |3           |
|4 |    └─TABLE FULL SCAN|v    |3       |3           |
======================================================
Outputs & filters:
-------------------------------------
  0 - output([t.c1], [t.c2], [CASE WHEN VIEW1.v.c2 IS NOT NULL THEN VIEW1.count(*) ELSE 0 END]), filter(nil), rowset=16
      equal_conds([VIEW1.v.c2 = t.c2]), other_conds(nil)
  1 - output([t.c1], [t.c2]), filter(nil), rowset=16
      access([t.c1], [t.c2]), partitions(p0)
      is_index_back=false, is_global_index=false, 
      range_key([t.__pk_increment]), range(MIN ; MAX)always true
  2 - output([VIEW1.count(*)], [VIEW1.v.c2]), filter(nil), rowset=16
      access([VIEW1.count(*)], [VIEW1.v.c2])
  3 - output([T_FUN_COUNT(*)], [v.c2]), filter(nil), rowset=16
      group([v.c2]), agg_func([T_FUN_COUNT(*)])
  4 - output([v.c2]), filter(nil), rowset=16
      access([v.c2]), partitions(p0)
      is_index_back=false, is_global_index=false, 
      range_key([v.__pk_increment]), range(MIN ; MAX)always true
select c1, c2, (select /*+unnest*/ count(*) from t v where v.c2 = t.c2) from t;
+------+------+----------------------------------------------------------+
| c1   | c2   | (select /*+unnest*/ count(*) from t v where v.c2 = t.c2) |
+------+------+----------------------------------------------------------+
| NULL |    3 |                                                        1 |
|    2 | NULL |                                                        0 |
|    1 | NULL |                                                        0 |
+------+------+----------------------------------------------------------+
EXPLAIN select /*+no_rewrite*/ c1, c2, (select count(*) from t v where v.c2 = t.c2) from t;
Query Plan
===================================================
|ID|OPERATOR           |NAME|EST.ROWS|EST.TIME(us)|
---------------------------------------------------
|0 |SUBPLAN FILTER     |    |3       |57          |
|1 |├─TABLE FULL SCAN  |t   |3       |3           |
|2 |└─SCALAR GROUP BY  |    |1       |18          |
|3 |  └─TABLE FULL SCAN|v   |1       |18          |
===================================================
Outputs & filters:
-------------------------------------
  0 - output([t.c1], [t.c2], [subquery(1)]), filter(nil), rowset=16
      exec_params_([t.c2(:0)]), onetime_exprs_(nil), init_plan_idxs_(nil), use_batch=false
  1 - output([t.c1], [t.c2]), filter(nil), rowset=16
      access([t.c1], [t.c2]), partitions(p0)
      is_index_back=false, is_global_index=false, 
      range_key([t.__pk_increment]), range(MIN ; MAX)always true
  2 - output([T_FUN_COUNT_SUM(T_FUN_COUNT(*))]), filter(nil), rowset=16
      group(nil), agg_func([T_FUN_COUNT_SUM(T_FUN_COUNT(*))])
  3 - output([T_FUN_COUNT(*)]), filter([v.c2 = :0]), rowset=16
      access([v.c2]), partitions(p0)
      is_index_back=false, is_global_index=false, filter_before_indexback[false], 
      range_key([v.__pk_increment]), range(MIN ; MAX)always true, 
      pushdown_aggregation([T_FUN_COUNT(*)])
select /*+no_rewrite*/ c1, c2, (select count(*) from t v where v.c2 = t.c2) from t;
+------+------+----------------------------------------------+
| c1   | c2   | (select count(*) from t v where v.c2 = t.c2) |
+------+------+----------------------------------------------+
|    1 | NULL |                                            0 |
|    2 | NULL |                                            0 |
| NULL |    3 |                                            1 |
+------+------+----------------------------------------------+

EXPLAIN SELECT
(SELECT /*+unnest*/ SUM(SUBQUERY1_t1 . `col_int_key`) AS SUBQUERY1_field1
 FROM CC AS SUBQUERY1_t1
 WHERE SUBQUERY1_t1 . `col_int` = table1 . `col_int` ) AS field6,
  table1 . `pk` AS field13
  FROM CC AS table1;
Query Plan
=============================================================
|ID|OPERATOR             |NAME        |EST.ROWS|EST.TIME(us)|
-------------------------------------------------------------
|0 |HASH OUTER JOIN      |            |29      |25          |
|1 |├─TABLE FULL SCAN    |table1      |29      |4           |
|2 |└─SUBPLAN SCAN       |VIEW1       |29      |12          |
|3 |  └─HASH GROUP BY    |            |29      |12          |
|4 |    └─TABLE FULL SCAN|SUBQUERY1_t1|29      |4           |
=============================================================
Outputs & filters:
-------------------------------------
  0 - output([VIEW1.SUBQUERY1_field1], [table1.pk]), filter(nil), rowset=256
      equal_conds([VIEW1.SUBQUERY1_t1.col_int = table1.col_int]), other_conds(nil)
  1 - output([table1.pk], [table1.col_int]), filter(nil), rowset=256
      access([table1.pk], [table1.col_int]), partitions(p0)
      is_index_back=false, is_global_index=false, 
      range_key([table1.pk]), range(MIN ; MAX)always true
  2 - output([VIEW1.SUBQUERY1_field1], [VIEW1.SUBQUERY1_t1.col_int]), filter(nil), rowset=256
      access([VIEW1.SUBQUERY1_field1], [VIEW1.SUBQUERY1_t1.col_int])
  3 - output([T_FUN_SUM(SUBQUERY1_t1.col_int_key)], [SUBQUERY1_t1.col_int]), filter(nil), rowset=256
      group([SUBQUERY1_t1.col_int]), agg_func([T_FUN_SUM(SUBQUERY1_t1.col_int_key)])
  4 - output([SUBQUERY1_t1.col_int], [SUBQUERY1_t1.col_int_key]), filter(nil), rowset=256
      access([SUBQUERY1_t1.col_int], [SUBQUERY1_t1.col_int_key]), partitions(p0)
      is_index_back=false, is_global_index=false, 
      range_key([SUBQUERY1_t1.pk]), range(MIN ; MAX)always true
SELECT
(SELECT /*+unnest*/ SUM(SUBQUERY1_t1 . `col_int_key`) AS SUBQUERY1_field1
 FROM CC AS SUBQUERY1_t1
 WHERE SUBQUERY1_t1 . `col_int` = table1 . `col_int` ) AS field6,
  table1 . `pk` AS field13
  FROM CC AS table1;
+--------+---------+
| field6 | field13 |
+--------+---------+
|      1 |       6 |
|      3 |      13 |
|      3 |      14 |
|      3 |      17 |
|      3 |      18 |
|      5 |      11 |
|      5 |      22 |
|      5 |      25 |
|      6 |      26 |
|      7 |      21 |
|     11 |       1 |
|     11 |       8 |
|     16 |       2 |
|     16 |       5 |
|     16 |       9 |
|     16 |      12 |
|     16 |      19 |
|     16 |      20 |
|     16 |      24 |
|     16 |      28 |
|   NULL |       3 |
|   NULL |       4 |
|   NULL |       7 |
|   NULL |      10 |
|   NULL |      15 |
|   NULL |      16 |
|   NULL |      23 |
|   NULL |      27 |
|   NULL |      29 |
+--------+---------+

EXPLAIN SELECT /*+no_rewrite*/
(SELECT  SUM(SUBQUERY1_t1 . `col_int_key`) AS SUBQUERY1_field1
 FROM CC AS SUBQUERY1_t1
 WHERE SUBQUERY1_t1 . `col_int` = table1 . `col_int` ) AS field6,
  table1 . `pk` AS field13
  FROM CC AS table1;
Query Plan
===========================================================
|ID|OPERATOR           |NAME        |EST.ROWS|EST.TIME(us)|
-----------------------------------------------------------
|0 |SUBPLAN FILTER     |            |29      |524         |
|1 |├─TABLE FULL SCAN  |table1      |29      |4           |
|2 |└─SCALAR GROUP BY  |            |1       |18          |
|3 |  └─TABLE FULL SCAN|SUBQUERY1_t1|1       |18          |
===========================================================
Outputs & filters:
-------------------------------------
  0 - output([subquery(1)], [table1.pk]), filter(nil), rowset=256
      exec_params_([table1.col_int(:0)]), onetime_exprs_(nil), init_plan_idxs_(nil), use_batch=false
  1 - output([table1.pk], [table1.col_int]), filter(nil), rowset=256
      access([table1.pk], [table1.col_int]), partitions(p0)
      is_index_back=false, is_global_index=false, 
      range_key([table1.pk]), range(MIN ; MAX)always true
  2 - output([T_FUN_SUM(T_FUN_SUM(SUBQUERY1_t1.col_int_key))]), filter(nil), rowset=256
      group(nil), agg_func([T_FUN_SUM(T_FUN_SUM(SUBQUERY1_t1.col_int_key))])
  3 - output([T_FUN_SUM(SUBQUERY1_t1.col_int_key)]), filter([SUBQUERY1_t1.col_int = :0]), rowset=256
      access([SUBQUERY1_t1.col_int], [SUBQUERY1_t1.col_int_key]), partitions(p0)
      is_index_back=false, is_global_index=false, filter_before_indexback[false], 
      range_key([SUBQUERY1_t1.pk]), range(MIN ; MAX)always true, 
      pushdown_aggregation([T_FUN_SUM(SUBQUERY1_t1.col_int_key)])
SELECT /*+no_rewrite*/
(SELECT  SUM(SUBQUERY1_t1 . `col_int_key`) AS SUBQUERY1_field1
 FROM CC AS SUBQUERY1_t1
 WHERE SUBQUERY1_t1 . `col_int` = table1 . `col_int` ) AS field6,
  table1 . `pk` AS field13
  FROM CC AS table1;
+--------+---------+
| field6 | field13 |
+--------+---------+
|      1 |       6 |
|      3 |      13 |
|      3 |      14 |
|      3 |      17 |
|      3 |      18 |
|      5 |      11 |
|      5 |      22 |
|      5 |      25 |
|      6 |      26 |
|      7 |      21 |
|     11 |       1 |
|     11 |       8 |
|     16 |       2 |
|     16 |       5 |
|     16 |       9 |
|     16 |      12 |
|     16 |      19 |
|     16 |      20 |
|     16 |      24 |
|     16 |      28 |
|   NULL |       3 |
|   NULL |       4 |
|   NULL |       7 |
|   NULL |      10 |
|   NULL |      15 |
|   NULL |      16 |
|   NULL |      23 |
|   NULL |      27 |
|   NULL |      29 |
+--------+---------+

drop table bmsql_oorder;
drop table t;
##bugs:
DROP TABLE IF EXISTS `c`, `bb`, `cc`;
CREATE TABLE `c` (
  `col_int` int(11) DEFAULT NULL,
  `col_varchar_10_key` varchar(10) DEFAULT NULL,
  `col_varchar_10` varchar(10) DEFAULT NULL,
  `col_int_key` int(11) DEFAULT NULL,
  `col_varchar_20_key` varchar(20) DEFAULT NULL,
  `col_varchar_20` varchar(20) DEFAULT NULL,
  `col_varchar_key` varchar(1) DEFAULT NULL,
  `pk` int(11) NOT NULL,
  `col_varchar` varchar(1) DEFAULT NULL,
  PRIMARY KEY (`pk`),
  KEY `idx5` (`pk`, `col_varchar_10_key`) BLOCK_SIZE 16384 GLOBAL,
  KEY `idx1` (`pk`, `col_int_key`) BLOCK_SIZE 16384 GLOBAL,
  KEY `idx7` (`pk`, `col_varchar_20_key`) BLOCK_SIZE 16384 GLOBAL,
  KEY `idx3` (`pk`, `col_varchar_key`) BLOCK_SIZE 16384 GLOBAL
) ;
CREATE TABLE `bb` (
  `col_int_key` int(11) DEFAULT NULL,
  `col_int` int(11) DEFAULT NULL,
  `col_varchar_10` varchar(10) DEFAULT NULL,
  `col_varchar_20_key` varchar(20) DEFAULT NULL,
  `col_varchar_key` varchar(1) DEFAULT NULL,
  `col_varchar_20` varchar(20) DEFAULT NULL,
  `pk` int(11) NOT NULL,
  `col_varchar` varchar(1) DEFAULT NULL,
  `col_varchar_10_key` varchar(10) DEFAULT NULL,
  PRIMARY KEY (`pk`),
  KEY `idx1` (`pk`, `col_int_key`) BLOCK_SIZE 16384 GLOBAL,
  KEY `idx7` (`pk`, `col_varchar_20_key`) BLOCK_SIZE 16384 GLOBAL,
  KEY `idx3` (`pk`, `col_varchar_key`) BLOCK_SIZE 16384 GLOBAL,
  KEY `idx5` (`pk`, `col_varchar_10_key`) BLOCK_SIZE 16384 GLOBAL
) ;
CREATE TABLE `cc` (
  `col_varchar` varchar(1) DEFAULT NULL,
  `col_varchar_10_key` varchar(10) DEFAULT NULL,
  `col_int` int(11) DEFAULT NULL,
  `pk` int(11) NOT NULL,
  `col_varchar_key` varchar(1) DEFAULT NULL,
  `col_varchar_20` varchar(20) DEFAULT NULL,
  `col_varchar_20_key` varchar(20) DEFAULT NULL,
  `col_varchar_10` varchar(10) DEFAULT NULL,
  `col_int_key` int(11) DEFAULT NULL,
  PRIMARY KEY (`pk`),
  KEY `idx5` (`pk`, `col_varchar_10_key`) BLOCK_SIZE 16384 GLOBAL,
  KEY `idx3` (`pk`, `col_varchar_key`) BLOCK_SIZE 16384 GLOBAL,
  KEY `idx7` (`pk`, `col_varchar_20_key`) BLOCK_SIZE 16384 GLOBAL,
  KEY `idx1` (`pk`, `col_int_key`) BLOCK_SIZE 16384 GLOBAL
) ;

EXPLAIN SELECT SUM(table1 . `col_varchar_20`) AS field1,
       table1 . `col_int_key` AS field2,
  (SELECT COUNT(DISTINCT SUBQUERY1_t1 . `pk`) AS SUBQUERY1_field1
   FROM (BB AS SUBQUERY1_t1
         INNER JOIN (C AS SUBQUERY1_t2
                     LEFT  JOIN CC AS SUBQUERY1_t3 ON (SUBQUERY1_t3 . `col_varchar_key` = SUBQUERY1_t2 . `col_varchar_20_key`)) ON (SUBQUERY1_t3 . `col_varchar_20_key` = SUBQUERY1_t2 . `col_varchar_key`))
   WHERE SUBQUERY1_t3 . `col_varchar_10` > table1 . `col_varchar_10`
     OR SUBQUERY1_t1 . `col_int_key` <> table1 . `col_int` ) AS field3,
       SUM(table1 . `pk`) AS field4
FROM (
        (SELECT SUBQUERY2_t1 . *
         FROM CC AS SUBQUERY2_t1
         WHERE SUBQUERY2_t1 . `col_varchar_20_key` < SUBQUERY2_t1 . `col_varchar_10` ) AS table1
      RIGHT  JOIN ((C AS table2
                    INNER JOIN
                      (SELECT SUBQUERY3_t1 . *
                       FROM (CC AS SUBQUERY3_t1
                             LEFT  JOIN C AS SUBQUERY3_t2 ON (SUBQUERY3_t2 . `col_int` = SUBQUERY3_t1 . `pk`))) AS table3 ON (table3 . `col_int_key` = table2 . `pk`))) ON (table3 . `col_int_key` = table2 . `col_int_key`))
WHERE (table1 . `col_varchar_key` <
         (SELECT MIN(DISTINCT SUBQUERY4_t1 . `col_varchar`) AS SUBQUERY4_field1
          FROM CC AS SUBQUERY4_t1))
  AND table1 . `col_varchar_key` = table1 . `col_varchar_key`
  OR table1 . `col_varchar_key` < table3 . `col_varchar_10_key`
GROUP BY field2,
         field3
HAVING (field1 != 8
        AND field3 <> 'a')
ORDER BY field1,
         field2,
         field3,
         field4;
Query Plan
===============================================================================
|ID|OPERATOR                         |NAME              |EST.ROWS|EST.TIME(us)|
-------------------------------------------------------------------------------
|0 |SORT                             |                  |1       |834         |
|1 |└─HASH GROUP BY                  |                  |1       |834         |
|2 |  └─SUBPLAN FILTER               |                  |12      |831         |
|3 |    ├─NESTED-LOOP JOIN           |                  |12      |45          |
|4 |    │ ├─SUBPLAN SCAN             |VIEW2             |10      |33          |
|5 |    │ │ └─WINDOW FUNCTION        |                  |29      |32          |
|6 |    │ │   └─TABLE FULL SCAN      |SUBQUERY4_t1      |29      |5           |
|7 |    │ └─MATERIAL                 |                  |3       |12          |
|8 |    │   └─HASH RIGHT OUTER JOIN  |                  |3       |12          |
|9 |    │     ├─TABLE FULL SCAN      |SUBQUERY3_t2      |2       |3           |
|10|    │     └─HASH JOIN            |                  |3       |9           |
|11|    │       ├─TABLE FULL SCAN    |table2            |1       |3           |
|12|    │       └─TABLE FULL SCAN    |SUBQUERY3_t1      |29      |4           |
|13|    └─SCALAR GROUP BY            |                  |1       |70          |
|14|      └─SUBPLAN SCAN             |VIEW1             |21      |70          |
|15|        └─MERGE DISTINCT         |                  |21      |70          |
|16|          └─NESTED-LOOP JOIN     |                  |27      |70          |
|17|            ├─TABLE FULL SCAN    |SUBQUERY1_t1(idx1)|28      |18          |
|18|            └─MATERIAL           |                  |2       |51          |
|19|              └─HASH JOIN        |                  |2       |51          |
|20|                ├─TABLE FULL SCAN|SUBQUERY1_t2      |2       |18          |
|21|                └─TABLE FULL SCAN|SUBQUERY1_t3      |29      |18          |
===============================================================================
Outputs & filters:
-------------------------------------
  0 - output([T_FUN_SUM(cast(VIEW2.SUBQUERY4_t1.col_varchar_20, DOUBLE(-1, -1)))], [VIEW2.SUBQUERY4_t1.col_int_key], [subquery(1)], [T_FUN_SUM(VIEW2.SUBQUERY4_t1.pk)]), filter(nil), rowset=256
      sort_keys([T_FUN_SUM(cast(VIEW2.SUBQUERY4_t1.col_varchar_20, DOUBLE(-1, -1))), ASC], [VIEW2.SUBQUERY4_t1.col_int_key, ASC], [subquery(1), ASC], [T_FUN_SUM(VIEW2.SUBQUERY4_t1.pk),
       ASC])
  1 - output([T_FUN_SUM(cast(VIEW2.SUBQUERY4_t1.col_varchar_20, DOUBLE(-1, -1)))], [VIEW2.SUBQUERY4_t1.col_int_key], [subquery(1)], [T_FUN_SUM(VIEW2.SUBQUERY4_t1.pk)]), filter([cast(subquery(1),
       DECIMAL(20, 0)) != cast('a', DECIMAL(1, -1))], [T_FUN_SUM(cast(VIEW2.SUBQUERY4_t1.col_varchar_20, DOUBLE(-1, -1))) != cast(8, DOUBLE(-1, -1))]), rowset=256
      group([VIEW2.SUBQUERY4_t1.col_int_key], [subquery(1)]), agg_func([T_FUN_SUM(cast(VIEW2.SUBQUERY4_t1.col_varchar_20, DOUBLE(-1, -1)))], [T_FUN_SUM(VIEW2.SUBQUERY4_t1.pk)])
  2 - output([VIEW2.SUBQUERY4_t1.col_int_key], [subquery(1)], [VIEW2.SUBQUERY4_t1.pk], [VIEW2.SUBQUERY4_t1.col_varchar_20]), filter(nil), rowset=256
      exec_params_([VIEW2.SUBQUERY4_t1.col_varchar_10(:0)], [VIEW2.SUBQUERY4_t1.col_int(:1)]), onetime_exprs_(nil), init_plan_idxs_(nil), use_batch=false
  3 - output([VIEW2.SUBQUERY4_t1.col_int_key], [VIEW2.SUBQUERY4_t1.col_varchar_10], [VIEW2.SUBQUERY4_t1.col_int], [VIEW2.SUBQUERY4_t1.pk], [VIEW2.SUBQUERY4_t1.col_varchar_20]), filter(nil), rowset=256
      conds([VIEW2.SUBQUERY4_t1.col_varchar_key < VIEW2.SUBQUERY4_field1 AND VIEW2.SUBQUERY4_t1.col_varchar_key = VIEW2.SUBQUERY4_t1.col_varchar_key OR 
      VIEW2.SUBQUERY4_t1.col_varchar_key < SUBQUERY3_t1.col_varchar_10_key]), nl_params_(nil), use_batch=false
  4 - output([VIEW2.SUBQUERY4_field1], [VIEW2.SUBQUERY4_t1.pk], [VIEW2.SUBQUERY4_t1.col_varchar_10], [VIEW2.SUBQUERY4_t1.col_int], [VIEW2.SUBQUERY4_t1.col_varchar_key],
       [VIEW2.SUBQUERY4_t1.col_varchar_20], [VIEW2.SUBQUERY4_t1.col_int_key]), filter([VIEW2.SUBQUERY4_t1.col_varchar_20_key < VIEW2.SUBQUERY4_t1.col_varchar_10]), rowset=256
      access([VIEW2.SUBQUERY4_field1], [VIEW2.SUBQUERY4_t1.pk], [VIEW2.SUBQUERY4_t1.col_varchar_20_key], [VIEW2.SUBQUERY4_t1.col_varchar_10], [VIEW2.SUBQUERY4_t1.col_int],
       [VIEW2.SUBQUERY4_t1.col_varchar_key], [VIEW2.SUBQUERY4_t1.col_varchar_20], [VIEW2.SUBQUERY4_t1.col_int_key])
  5 - output([T_FUN_MIN(SUBQUERY4_t1.col_varchar)], [SUBQUERY4_t1.pk], [SUBQUERY4_t1.col_varchar_20_key], [SUBQUERY4_t1.col_varchar_10], [SUBQUERY4_t1.col_int],
       [SUBQUERY4_t1.col_varchar_key], [SUBQUERY4_t1.col_varchar_20], [SUBQUERY4_t1.col_int_key]), filter(nil), rowset=256
      win_expr(T_FUN_MIN(SUBQUERY4_t1.col_varchar)), partition_by(nil), order_by(nil), window_type(RANGE), upper(UNBOUNDED PRECEDING), lower(UNBOUNDED FOLLOWING)
  6 - output([SUBQUERY4_t1.pk], [SUBQUERY4_t1.col_varchar], [SUBQUERY4_t1.col_varchar_20_key], [SUBQUERY4_t1.col_varchar_10], [SUBQUERY4_t1.col_int], [SUBQUERY4_t1.col_varchar_key],
       [SUBQUERY4_t1.col_varchar_20], [SUBQUERY4_t1.col_int_key]), filter(nil), rowset=256
      access([SUBQUERY4_t1.pk], [SUBQUERY4_t1.col_varchar], [SUBQUERY4_t1.col_varchar_20_key], [SUBQUERY4_t1.col_varchar_10], [SUBQUERY4_t1.col_int], [SUBQUERY4_t1.col_varchar_key],
       [SUBQUERY4_t1.col_varchar_20], [SUBQUERY4_t1.col_int_key]), partitions(p0)
      is_index_back=false, is_global_index=false, 
      range_key([SUBQUERY4_t1.pk]), range(MIN ; MAX)always true
  7 - output([SUBQUERY3_t1.col_varchar_10_key]), filter(nil), rowset=256
  8 - output([SUBQUERY3_t1.col_varchar_10_key]), filter(nil), rowset=256
      equal_conds([SUBQUERY3_t2.col_int = SUBQUERY3_t1.pk]), other_conds(nil)
  9 - output([SUBQUERY3_t2.col_int]), filter(nil), rowset=256
      access([SUBQUERY3_t2.col_int]), partitions(p0)
      is_index_back=false, is_global_index=false, 
      range_key([SUBQUERY3_t2.pk]), range(MIN ; MAX)always true
 10 - output([SUBQUERY3_t1.pk], [SUBQUERY3_t1.col_varchar_10_key]), filter(nil), rowset=256
      equal_conds([SUBQUERY3_t1.col_int_key = table2.col_int_key]), other_conds(nil)
 11 - output([table2.col_int_key]), filter([table2.col_int_key = table2.pk]), rowset=256
      access([table2.pk], [table2.col_int_key]), partitions(p0)
      is_index_back=false, is_global_index=false, filter_before_indexback[false], 
      range_key([table2.pk]), range(MIN ; MAX)always true
 12 - output([SUBQUERY3_t1.pk], [SUBQUERY3_t1.col_varchar_10_key], [SUBQUERY3_t1.col_int_key]), filter(nil), rowset=256
      access([SUBQUERY3_t1.pk], [SUBQUERY3_t1.col_varchar_10_key], [SUBQUERY3_t1.col_int_key]), partitions(p0)
      is_index_back=false, is_global_index=false, 
      range_key([SUBQUERY3_t1.pk]), range(MIN ; MAX)always true
 13 - output([T_FUN_COUNT(VIEW1.SUBQUERY1_t1.pk)]), filter(nil), rowset=256
      group(nil), agg_func([T_FUN_COUNT(VIEW1.SUBQUERY1_t1.pk)])
 14 - output([VIEW1.SUBQUERY1_t1.pk]), filter(nil), rowset=256
      access([VIEW1.SUBQUERY1_t1.pk])
 15 - output([SUBQUERY1_t1.pk]), filter(nil), rowset=256
      distinct([SUBQUERY1_t1.pk])
 16 - output([SUBQUERY1_t1.pk]), filter(nil), rowset=256
      conds([SUBQUERY1_t3.col_varchar_10 > :0 OR SUBQUERY1_t1.col_int_key != :1]), nl_params_(nil), use_batch=false
 17 - output([SUBQUERY1_t1.pk], [SUBQUERY1_t1.col_int_key]), filter(nil), rowset=256
      access([SUBQUERY1_t1.pk], [SUBQUERY1_t1.col_int_key]), partitions(p0)
      is_index_back=false, is_global_index=false, 
      range_key([SUBQUERY1_t1.pk], [SUBQUERY1_t1.col_int_key]), range(MIN,MIN ; MAX,MAX)always true
 18 - output([SUBQUERY1_t3.col_varchar_10]), filter(nil), rowset=256
 19 - output([SUBQUERY1_t3.col_varchar_10]), filter(nil), rowset=256
      equal_conds([SUBQUERY1_t3.col_varchar_20_key = SUBQUERY1_t2.col_varchar_key], [SUBQUERY1_t3.col_varchar_key = SUBQUERY1_t2.col_varchar_20_key]), other_conds(nil)
 20 - output([SUBQUERY1_t2.col_varchar_20_key], [SUBQUERY1_t2.col_varchar_key]), filter(nil), rowset=256
      access([SUBQUERY1_t2.col_varchar_20_key], [SUBQUERY1_t2.col_varchar_key]), partitions(p0)
      is_index_back=false, is_global_index=false, 
      range_key([SUBQUERY1_t2.pk]), range(MIN ; MAX)always true
 21 - output([SUBQUERY1_t3.col_varchar_key], [SUBQUERY1_t3.col_varchar_20_key], [SUBQUERY1_t3.col_varchar_10]), filter(nil), rowset=256
      access([SUBQUERY1_t3.col_varchar_key], [SUBQUERY1_t3.col_varchar_20_key], [SUBQUERY1_t3.col_varchar_10]), partitions(p0)
      is_index_back=false, is_global_index=false, 
      range_key([SUBQUERY1_t3.pk]), range(MIN ; MAX)always true
SELECT SUM(table1 . `col_varchar_20`) AS field1,
       table1 . `col_int_key` AS field2,
  (SELECT COUNT(DISTINCT SUBQUERY1_t1 . `pk`) AS SUBQUERY1_field1
   FROM (BB AS SUBQUERY1_t1
         INNER JOIN (C AS SUBQUERY1_t2
                     LEFT  JOIN CC AS SUBQUERY1_t3 ON (SUBQUERY1_t3 . `col_varchar_key` = SUBQUERY1_t2 . `col_varchar_20_key`)) ON (SUBQUERY1_t3 . `col_varchar_20_key` = SUBQUERY1_t2 . `col_varchar_key`))
   WHERE SUBQUERY1_t3 . `col_varchar_10` > table1 . `col_varchar_10`
     OR SUBQUERY1_t1 . `col_int_key` <> table1 . `col_int` ) AS field3,
       SUM(table1 . `pk`) AS field4
FROM (
        (SELECT SUBQUERY2_t1 . *
         FROM CC AS SUBQUERY2_t1
         WHERE SUBQUERY2_t1 . `col_varchar_20_key` < SUBQUERY2_t1 . `col_varchar_10` ) AS table1
      RIGHT  JOIN ((C AS table2
                    INNER JOIN
                      (SELECT SUBQUERY3_t1 . *
                       FROM (CC AS SUBQUERY3_t1
                             LEFT  JOIN C AS SUBQUERY3_t2 ON (SUBQUERY3_t2 . `col_int` = SUBQUERY3_t1 . `pk`))) AS table3 ON (table3 . `col_int_key` = table2 . `pk`))) ON (table3 . `col_int_key` = table2 . `col_int_key`))
WHERE (table1 . `col_varchar_key` <
         (SELECT MIN(DISTINCT SUBQUERY4_t1 . `col_varchar`) AS SUBQUERY4_field1
          FROM CC AS SUBQUERY4_t1))
  AND table1 . `col_varchar_key` = table1 . `col_varchar_key`
  OR table1 . `col_varchar_key` < table3 . `col_varchar_10_key`
GROUP BY field2,
         field3
HAVING (field1 != 8
        AND field3 <> 'a')
ORDER BY field1,
         field2,
         field3,
         field4;
+--------+--------+--------+--------+
| field1 | field2 | field3 | field4 |
+--------+--------+--------+--------+
+--------+--------+--------+--------+
Warnings:
Warning	1292	Truncated incorrect DECIMAL value: 'a'
Warning	1292	Truncated incorrect DECIMAL value: 'a'
Warning	1292	Truncated incorrect DECIMAL value: 'a'
Warning	1292	Truncated incorrect DECIMAL value: 'a'
Warning	1292	Truncated incorrect DECIMAL value: 'a'
Warning	1292	Truncated incorrect DECIMAL value: 'a'

EXPLAIN SELECT /*+no_rewrite*/ SUM(table1 . `col_varchar_20`) AS field1,
       table1 . `col_int_key` AS field2,
  (SELECT COUNT(DISTINCT SUBQUERY1_t1 . `pk`) AS SUBQUERY1_field1
   FROM (BB AS SUBQUERY1_t1
         INNER JOIN (C AS SUBQUERY1_t2
                     LEFT  JOIN CC AS SUBQUERY1_t3 ON (SUBQUERY1_t3 . `col_varchar_key` = SUBQUERY1_t2 . `col_varchar_20_key`)) ON (SUBQUERY1_t3 . `col_varchar_20_key` = SUBQUERY1_t2 . `col_varchar_key`))
   WHERE SUBQUERY1_t3 . `col_varchar_10` > table1 . `col_varchar_10`
     OR SUBQUERY1_t1 . `col_int_key` <> table1 . `col_int` ) AS field3,
       SUM(table1 . `pk`) AS field4
FROM (
        (SELECT SUBQUERY2_t1 . *
         FROM CC AS SUBQUERY2_t1
         WHERE SUBQUERY2_t1 . `col_varchar_20_key` < SUBQUERY2_t1 . `col_varchar_10` ) AS table1
      RIGHT  JOIN ((C AS table2
                    INNER JOIN
                      (SELECT SUBQUERY3_t1 . *
                       FROM (CC AS SUBQUERY3_t1
                             LEFT  JOIN C AS SUBQUERY3_t2 ON (SUBQUERY3_t2 . `col_int` = SUBQUERY3_t1 . `pk`))) AS table3 ON (table3 . `col_int_key` = table2 . `pk`))) ON (table3 . `col_int_key` = table2 . `col_int_key`))
WHERE (table1 . `col_varchar_key` <
         (SELECT MIN(DISTINCT SUBQUERY4_t1 . `col_varchar`) AS SUBQUERY4_field1
          FROM CC AS SUBQUERY4_t1))
  AND table1 . `col_varchar_key` = table1 . `col_varchar_key`
  OR table1 . `col_varchar_key` < table3 . `col_varchar_10_key`
GROUP BY field2,
         field3
HAVING (field1 != 8
        AND field3 <> 'a')
ORDER BY field1,
         field2,
         field3,
         field4;
Query Plan
===================================================================================
|ID|OPERATOR                             |NAME              |EST.ROWS|EST.TIME(us)|
-----------------------------------------------------------------------------------
|0 |SORT                                 |                  |1       |520         |
|1 |└─HASH GROUP BY                      |                  |1       |520         |
|2 |  └─SUBPLAN FILTER                   |                  |8       |517         |
|3 |    ├─SUBPLAN FILTER                 |                  |8       |22          |
|4 |    │ ├─NESTED-LOOP OUTER JOIN       |                  |8       |19          |
|5 |    │ │ ├─HASH JOIN                  |                  |7       |12          |
|6 |    │ │ │ ├─TABLE FULL SCAN          |table2(idx1)      |2       |3           |
|7 |    │ │ │ └─SUBPLAN SCAN             |table3            |29      |7           |
|8 |    │ │ │   └─MERGE RIGHT OUTER JOIN |                  |29      |7           |
|9 |    │ │ │     ├─SORT                 |                  |2       |3           |
|10|    │ │ │     │ └─TABLE FULL SCAN    |SUBQUERY3_t2      |2       |3           |
|11|    │ │ │     └─TABLE FULL SCAN      |SUBQUERY3_t1      |29      |4           |
|12|    │ │ └─MATERIAL                   |                  |10      |7           |
|13|    │ │   └─SUBPLAN SCAN             |table1            |10      |5           |
|14|    │ │     └─TABLE FULL SCAN        |SUBQUERY2_t1      |10      |5           |
|15|    │ └─SCALAR GROUP BY              |                  |1       |3           |
|16|    │   └─TABLE FULL SCAN            |SUBQUERY4_t1      |29      |3           |
|17|    └─SCALAR GROUP BY                |                  |1       |70          |
|18|      └─SUBPLAN SCAN                 |VIEW1             |21      |70          |
|19|        └─MERGE DISTINCT             |                  |21      |70          |
|20|          └─NESTED-LOOP JOIN         |                  |27      |70          |
|21|            ├─TABLE FULL SCAN        |SUBQUERY1_t1(idx1)|28      |18          |
|22|            └─MATERIAL               |                  |2       |51          |
|23|              └─HASH JOIN            |                  |2       |51          |
|24|                ├─TABLE FULL SCAN    |SUBQUERY1_t2      |2       |18          |
|25|                └─TABLE FULL SCAN    |SUBQUERY1_t3      |29      |18          |
===================================================================================
Outputs & filters:
-------------------------------------
  0 - output([T_FUN_SUM(cast(table1.col_varchar_20, DOUBLE(-1, -1)))], [table1.col_int_key], [subquery(1)], [T_FUN_SUM(table1.pk)]), filter(nil), rowset=256
      sort_keys([T_FUN_SUM(cast(table1.col_varchar_20, DOUBLE(-1, -1))), ASC], [table1.col_int_key, ASC], [subquery(1), ASC], [T_FUN_SUM(table1.pk), ASC])
  1 - output([T_FUN_SUM(cast(table1.col_varchar_20, DOUBLE(-1, -1)))], [table1.col_int_key], [subquery(1)], [T_FUN_SUM(table1.pk)]), filter([cast(subquery(1),
       DECIMAL(20, 0)) != cast('a', DECIMAL(1, -1))], [T_FUN_SUM(cast(table1.col_varchar_20, DOUBLE(-1, -1))) != cast(8, DOUBLE(-1, -1))]), rowset=256
      group([table1.col_int_key], [subquery(1)]), agg_func([T_FUN_SUM(cast(table1.col_varchar_20, DOUBLE(-1, -1)))], [T_FUN_SUM(table1.pk)])
  2 - output([table1.col_int_key], [subquery(1)], [table1.pk], [table1.col_varchar_20]), filter(nil), rowset=256
      exec_params_([table1.col_varchar_10(:0)], [table1.col_int(:1)]), onetime_exprs_(nil), init_plan_idxs_(nil), use_batch=false
  3 - output([table1.col_int_key], [table1.col_varchar_10], [table1.col_int], [table1.pk], [table1.col_varchar_20]), filter(nil), rowset=256
      exec_params_(nil), onetime_exprs_([subquery(1)(:2)]), init_plan_idxs_(nil), use_batch=false
  4 - output([table1.col_int_key], [table1.col_varchar_10], [table1.col_int], [table1.pk], [table1.col_varchar_20]), filter([table1.col_varchar_key < :2 
      AND table1.col_varchar_key = table1.col_varchar_key OR table1.col_varchar_key < table3.col_varchar_10_key]), rowset=256
      conds([table3.col_int_key = table2.col_int_key]), nl_params_(nil), use_batch=false
  5 - output([table3.col_int_key], [table2.col_int_key], [table3.col_varchar_10_key]), filter(nil), rowset=256
      equal_conds([table3.col_int_key = table2.pk]), other_conds(nil)
  6 - output([table2.pk], [table2.col_int_key]), filter(nil), rowset=256
      access([table2.pk], [table2.col_int_key]), partitions(p0)
      is_index_back=false, is_global_index=false, 
      range_key([table2.pk], [table2.col_int_key]), range(MIN,MIN ; MAX,MAX)always true
  7 - output([table3.col_varchar_10_key], [table3.col_int_key]), filter(nil), rowset=256
      access([table3.col_varchar_10_key], [table3.col_int_key])
  8 - output([SUBQUERY3_t1.col_varchar_10_key], [SUBQUERY3_t1.col_int_key]), filter(nil), rowset=256
      equal_conds([SUBQUERY3_t2.col_int = SUBQUERY3_t1.pk]), other_conds(nil)
      merge_directions([ASC])
  9 - output([SUBQUERY3_t2.col_int]), filter(nil), rowset=256
      sort_keys([SUBQUERY3_t2.col_int, ASC])
 10 - output([SUBQUERY3_t2.col_int]), filter(nil), rowset=256
      access([SUBQUERY3_t2.col_int]), partitions(p0)
      is_index_back=false, is_global_index=false, 
      range_key([SUBQUERY3_t2.pk]), range(MIN ; MAX)always true
 11 - output([SUBQUERY3_t1.pk], [SUBQUERY3_t1.col_varchar_10_key], [SUBQUERY3_t1.col_int_key]), filter(nil), rowset=256
      access([SUBQUERY3_t1.pk], [SUBQUERY3_t1.col_varchar_10_key], [SUBQUERY3_t1.col_int_key]), partitions(p0)
      is_index_back=false, is_global_index=false, 
      range_key([SUBQUERY3_t1.pk]), range(MIN ; MAX)always true
 12 - output([table1.col_int_key], [table1.col_varchar_10], [table1.col_int], [table1.pk], [table1.col_varchar_key], [table1.col_varchar_20]), filter(nil), rowset=256
 13 - output([table1.col_int], [table1.pk], [table1.col_varchar_key], [table1.col_varchar_20], [table1.col_varchar_10], [table1.col_int_key]), filter(nil), rowset=256
      access([table1.col_int], [table1.pk], [table1.col_varchar_key], [table1.col_varchar_20], [table1.col_varchar_10], [table1.col_int_key])
 14 - output([SUBQUERY2_t1.col_int], [SUBQUERY2_t1.pk], [SUBQUERY2_t1.col_varchar_key], [SUBQUERY2_t1.col_varchar_20], [SUBQUERY2_t1.col_varchar_10], [SUBQUERY2_t1.col_int_key]), filter([SUBQUERY2_t1.c
      ol_varchar_20_key < SUBQUERY2_t1.col_varchar_10]), rowset=256
      access([SUBQUERY2_t1.pk], [SUBQUERY2_t1.col_varchar_20_key], [SUBQUERY2_t1.col_varchar_10], [SUBQUERY2_t1.col_int], [SUBQUERY2_t1.col_varchar_key],
       [SUBQUERY2_t1.col_varchar_20], [SUBQUERY2_t1.col_int_key]), partitions(p0)
      is_index_back=false, is_global_index=false, filter_before_indexback[false], 
      range_key([SUBQUERY2_t1.pk]), range(MIN ; MAX)always true
 15 - output([T_FUN_MIN(T_FUN_MIN(SUBQUERY4_t1.col_varchar))]), filter(nil), rowset=256
      group(nil), agg_func([T_FUN_MIN(T_FUN_MIN(SUBQUERY4_t1.col_varchar))])
 16 - output([T_FUN_MIN(SUBQUERY4_t1.col_varchar)]), filter(nil), rowset=256
      access([SUBQUERY4_t1.col_varchar]), partitions(p0)
      is_index_back=false, is_global_index=false, 
      range_key([SUBQUERY4_t1.pk]), range(MIN ; MAX)always true, 
      pushdown_aggregation([T_FUN_MIN(SUBQUERY4_t1.col_varchar)])
 17 - output([T_FUN_COUNT(VIEW1.SUBQUERY1_t1.pk)]), filter(nil), rowset=256
      group(nil), agg_func([T_FUN_COUNT(VIEW1.SUBQUERY1_t1.pk)])
 18 - output([VIEW1.SUBQUERY1_t1.pk]), filter(nil), rowset=256
      access([VIEW1.SUBQUERY1_t1.pk])
 19 - output([SUBQUERY1_t1.pk]), filter(nil), rowset=256
      distinct([SUBQUERY1_t1.pk])
 20 - output([SUBQUERY1_t1.pk]), filter(nil), rowset=256
      conds([SUBQUERY1_t3.col_varchar_10 > :0 OR SUBQUERY1_t1.col_int_key != :1]), nl_params_(nil), use_batch=false
 21 - output([SUBQUERY1_t1.pk], [SUBQUERY1_t1.col_int_key]), filter(nil), rowset=256
      access([SUBQUERY1_t1.pk], [SUBQUERY1_t1.col_int_key]), partitions(p0)
      is_index_back=false, is_global_index=false, 
      range_key([SUBQUERY1_t1.pk], [SUBQUERY1_t1.col_int_key]), range(MIN,MIN ; MAX,MAX)always true
 22 - output([SUBQUERY1_t3.col_varchar_10]), filter(nil), rowset=256
 23 - output([SUBQUERY1_t3.col_varchar_10]), filter(nil), rowset=256
      equal_conds([SUBQUERY1_t3.col_varchar_20_key = SUBQUERY1_t2.col_varchar_key], [SUBQUERY1_t3.col_varchar_key = SUBQUERY1_t2.col_varchar_20_key]), other_conds(nil)
 24 - output([SUBQUERY1_t2.col_varchar_20_key], [SUBQUERY1_t2.col_varchar_key]), filter(nil), rowset=256
      access([SUBQUERY1_t2.col_varchar_20_key], [SUBQUERY1_t2.col_varchar_key]), partitions(p0)
      is_index_back=false, is_global_index=false, 
      range_key([SUBQUERY1_t2.pk]), range(MIN ; MAX)always true
 25 - output([SUBQUERY1_t3.col_varchar_key], [SUBQUERY1_t3.col_varchar_20_key], [SUBQUERY1_t3.col_varchar_10]), filter(nil), rowset=256
      access([SUBQUERY1_t3.col_varchar_key], [SUBQUERY1_t3.col_varchar_20_key], [SUBQUERY1_t3.col_varchar_10]), partitions(p0)
      is_index_back=false, is_global_index=false, 
      range_key([SUBQUERY1_t3.pk]), range(MIN ; MAX)always true
SELECT /*+no_rewrite*/ SUM(table1 . `col_varchar_20`) AS field1,
       table1 . `col_int_key` AS field2,
  (SELECT COUNT(DISTINCT SUBQUERY1_t1 . `pk`) AS SUBQUERY1_field1
   FROM (BB AS SUBQUERY1_t1
         INNER JOIN (C AS SUBQUERY1_t2
                     LEFT  JOIN CC AS SUBQUERY1_t3 ON (SUBQUERY1_t3 . `col_varchar_key` = SUBQUERY1_t2 . `col_varchar_20_key`)) ON (SUBQUERY1_t3 . `col_varchar_20_key` = SUBQUERY1_t2 . `col_varchar_key`))
   WHERE SUBQUERY1_t3 . `col_varchar_10` > table1 . `col_varchar_10`
     OR SUBQUERY1_t1 . `col_int_key` <> table1 . `col_int` ) AS field3,
       SUM(table1 . `pk`) AS field4
FROM (
        (SELECT SUBQUERY2_t1 . *
         FROM CC AS SUBQUERY2_t1
         WHERE SUBQUERY2_t1 . `col_varchar_20_key` < SUBQUERY2_t1 . `col_varchar_10` ) AS table1
      RIGHT  JOIN ((C AS table2
                    INNER JOIN
                      (SELECT SUBQUERY3_t1 . *
                       FROM (CC AS SUBQUERY3_t1
                             LEFT  JOIN C AS SUBQUERY3_t2 ON (SUBQUERY3_t2 . `col_int` = SUBQUERY3_t1 . `pk`))) AS table3 ON (table3 . `col_int_key` = table2 . `pk`))) ON (table3 . `col_int_key` = table2 . `col_int_key`))
WHERE (table1 . `col_varchar_key` <
         (SELECT MIN(DISTINCT SUBQUERY4_t1 . `col_varchar`) AS SUBQUERY4_field1
          FROM CC AS SUBQUERY4_t1))
  AND table1 . `col_varchar_key` = table1 . `col_varchar_key`
  OR table1 . `col_varchar_key` < table3 . `col_varchar_10_key`
GROUP BY field2,
         field3
HAVING (field1 != 8
        AND field3 <> 'a')
ORDER BY field1,
         field2,
         field3,
         field4;
+--------+--------+--------+--------+
| field1 | field2 | field3 | field4 |
+--------+--------+--------+--------+
+--------+--------+--------+--------+

##简化case：
SELECT (SELECT 1 FROM   cc 
        UNION ALL 
        SELECT 1 FROM   bb
        WHERE  bb . `col_int_key` <> table1 . `col_int`) AS 
       field3 
FROM   cc AS table1 
WHERE  `col_varchar_key` < (SELECT /*no_unnest*/ Min(cc . `col_varchar`)  FROM   cc);
ERROR 21000: Subquery returns more than 1 row

SELECT /*+no_rewrite*/(SELECT 1 FROM   cc 
        UNION ALL 
        SELECT 1 FROM   bb
        WHERE  bb . `col_int_key` <> table1 . `col_int`) AS 
       field3 
FROM   cc AS table1 
WHERE  `col_varchar_key` < (SELECT /*no_unnest*/ Min(cc . `col_varchar`)  FROM   cc);
ERROR 21000: Subquery returns more than 1 row

drop table `c`, `bb`, `cc`;

DROP TABLE IF EXISTS `z0case_list`;
create table z0case_list (id int not null, z0_test0 varchar(100),z0_test1 varchar(100)) partition by hash(id) partitions 5;

EXPLAIN UPDATE z0case_list partition(p1) SET id=9 WHERE id > (select min(id) from z0case_list partition(p1));
Query Plan
============================================================
|ID|OPERATOR             |NAME       |EST.ROWS|EST.TIME(us)|
------------------------------------------------------------
|0 |DISTRIBUTED UPDATE   |           |1       |31          |
|1 |└─SUBPLAN SCAN       |VIEW1      |1       |6           |
|2 |  └─WINDOW FUNCTION  |           |3       |6           |
|3 |    └─TABLE FULL SCAN|z0case_list|3       |3           |
============================================================
Outputs & filters:
-------------------------------------
  0 - output(nil), filter(nil)
      table_columns([{VIEW1: ({z0case_list: (VIEW1.z0case_list.__pk_increment, VIEW1.z0case_list.id, VIEW1.z0case_list.z0_test0, VIEW1.z0case_list.z0_test1)}),
       hash_distinct}]),
      update([VIEW1.z0case_list.id=column_conv(INT,PS:(11,0),NOT NULL,9)], [VIEW1.z0case_list.__pk_increment=T_HIDDEN_PK])
  1 - output([VIEW1.z0case_list.__pk_increment], [VIEW1.z0case_list.id], [VIEW1.z0case_list.z0_test0], [VIEW1.z0case_list.z0_test1]), filter([VIEW1.z0case_list.id 
      > VIEW1.min(id)]), rowset=16
      access([VIEW1.min(id)], [VIEW1.z0case_list.__pk_increment], [VIEW1.z0case_list.id], [VIEW1.z0case_list.z0_test0], [VIEW1.z0case_list.z0_test1])
  2 - output([T_FUN_MIN(z0case_list.id)], [z0case_list.__pk_increment], [z0case_list.id], [z0case_list.z0_test0], [z0case_list.z0_test1]), filter(nil), rowset=16
      win_expr(T_FUN_MIN(z0case_list.id)), partition_by(nil), order_by(nil), window_type(RANGE), upper(UNBOUNDED PRECEDING), lower(UNBOUNDED FOLLOWING)
  3 - output([z0case_list.__pk_increment], [z0case_list.id], [z0case_list.z0_test0], [z0case_list.z0_test1]), filter(nil), rowset=16
      access([z0case_list.__pk_increment], [z0case_list.id], [z0case_list.z0_test0], [z0case_list.z0_test1]), partitions(p1)
      is_index_back=false, is_global_index=false, 
      range_key([z0case_list.__pk_increment]), range(MIN ; MAX)always true
UPDATE z0case_list partition(p1) SET id=9 WHERE id > (select min(id) from z0case_list partition(p1));
EXPLAIN UPDATE /*+no_rewrite*/ z0case_list partition(p1) SET id=9 WHERE id > (select min(id) from z0case_list partition(p1));
Query Plan
============================================================
|ID|OPERATOR             |NAME       |EST.ROWS|EST.TIME(us)|
------------------------------------------------------------
|0 |DISTRIBUTED UPDATE   |           |1       |37          |
|1 |└─SUBPLAN FILTER     |           |1       |5           |
|2 |  ├─TABLE FULL SCAN  |z0case_list|1       |3           |
|3 |  └─SCALAR GROUP BY  |           |1       |3           |
|4 |    └─TABLE FULL SCAN|z0case_list|3       |3           |
============================================================
Outputs & filters:
-------------------------------------
  0 - output(nil), filter(nil)
      table_columns([{z0case_list: ({z0case_list: (z0case_list.__pk_increment, z0case_list.id, z0case_list.z0_test0, z0case_list.z0_test1)})}]),
      update([z0case_list.id=column_conv(INT,PS:(11,0),NOT NULL,9)], [z0case_list.__pk_increment=T_HIDDEN_PK])
  1 - output([z0case_list.__pk_increment], [z0case_list.id], [z0case_list.z0_test0], [z0case_list.z0_test1]), filter(nil), rowset=16
      exec_params_(nil), onetime_exprs_([subquery(1)(:0)]), init_plan_idxs_(nil), use_batch=false
  2 - output([z0case_list.__pk_increment], [z0case_list.id], [z0case_list.z0_test0], [z0case_list.z0_test1]), filter([z0case_list.id > :0]), rowset=16
      access([z0case_list.__pk_increment], [z0case_list.id], [z0case_list.z0_test0], [z0case_list.z0_test1]), partitions(p1)
      is_index_back=false, is_global_index=false, filter_before_indexback[false], 
      range_key([z0case_list.__pk_increment]), range(MIN ; MAX)always true
  3 - output([T_FUN_MIN(T_FUN_MIN(z0case_list.id))]), filter(nil), rowset=16
      group(nil), agg_func([T_FUN_MIN(T_FUN_MIN(z0case_list.id))])
  4 - output([T_FUN_MIN(z0case_list.id)]), filter(nil), rowset=16
      access([z0case_list.id]), partitions(p1)
      is_index_back=false, is_global_index=false, 
      range_key([z0case_list.__pk_increment]), range(MIN ; MAX)always true, 
      pushdown_aggregation([T_FUN_MIN(z0case_list.id)])
UPDATE /*+no_rewrite*/ z0case_list partition(p1) SET id=9 WHERE id > (select min(id) from z0case_list partition(p1));

DROP TABLE IF EXISTS `z0case_list`;
## bug:
drop table if exists t1;
create table t1(c1 int, c2 int) partition by hash(c1) partitions 5;

EXPLAIN select * from t1 partition(p1) WHERE c1 = (select /*+unnest*/ max(c1) from t1 partition(p1));
Query Plan
====================================================
|ID|OPERATOR           |NAME |EST.ROWS|EST.TIME(us)|
----------------------------------------------------
|0 |SUBPLAN SCAN       |VIEW1|1       |3           |
|1 |└─WINDOW FUNCTION  |     |1       |3           |
|2 |  └─TABLE FULL SCAN|t1   |1       |3           |
====================================================
Outputs & filters:
-------------------------------------
  0 - output([VIEW1.t1.c1], [VIEW1.t1.c2]), filter([VIEW1.t1.c1 = VIEW1.max(c1)]), rowset=16
      access([VIEW1.max(c1)], [VIEW1.t1.c1], [VIEW1.t1.c2])
  1 - output([T_FUN_MAX(t1.c1)], [t1.c1], [t1.c2]), filter(nil), rowset=16
      win_expr(T_FUN_MAX(t1.c1)), partition_by(nil), order_by(nil), window_type(RANGE), upper(UNBOUNDED PRECEDING), lower(UNBOUNDED FOLLOWING)
  2 - output([t1.c1], [t1.c2]), filter(nil), rowset=16
      access([t1.c1], [t1.c2]), partitions(p1)
      is_index_back=false, is_global_index=false, 
      range_key([t1.__pk_increment]), range(MIN ; MAX)always true
select * from t1 partition(p1) WHERE c1 = (select /*+unnest*/ max(c1) from t1 partition(p1));
+------+------+
| c1   | c2   |
+------+------+
|    1 |    1 |
+------+------+

drop table t1;

CREATE TABLE t1 (c1 NUMBER(1) NOT NULL, c2 VARCHAR(38) NOT NULL, PRIMARY KEY (c2));
CREATE TABLE t2 (c2 VARCHAR(38), c1 VARCHAR(20), c3 VARCHAR(105) NOT NULL, PRIMARY KEY (c3));
EXPLAIN SELECT 1 FROM t1, t2 B, (SELECT max(C.c1) AS aggr, C.c2 FROM t2 C GROUP BY C.c2) VIEW1 WHERE (B.c1 = VIEW1.aggr) AND (t1.c1 = (SELECT 1 FROM t2 D WHERE (D.c2 = B.c2))) AND (t1.c2 = B.c2) AND (t1.c2 = VIEW1.c2);
Query Plan
==========================================================
|ID|OPERATOR                 |NAME |EST.ROWS|EST.TIME(us)|
----------------------------------------------------------
|0 |SUBPLAN SCAN             |VIEW1|1       |24          |
|1 |└─WINDOW FUNCTION        |     |1       |24          |
|2 |  └─SUBPLAN FILTER       |     |1       |23          |
|3 |    ├─MERGE JOIN         |     |1       |5           |
|4 |    │ ├─TABLE FULL SCAN  |t1   |1       |3           |
|5 |    │ └─SORT             |     |1       |3           |
|6 |    │   └─TABLE FULL SCAN|C    |1       |3           |
|7 |    └─TABLE FULL SCAN    |D    |1       |18          |
==========================================================
Outputs & filters:
-------------------------------------
  0 - output([1]), filter([VIEW1.C.c1 = VIEW1.aggr]), rowset=16
      access([VIEW1.aggr], [VIEW1.C.c1])
  1 - output([T_FUN_MAX(C.c1)], [C.c1]), filter(nil), rowset=16
      win_expr(T_FUN_MAX(C.c1)), partition_by([C.c2]), order_by(nil), window_type(RANGE), upper(UNBOUNDED PRECEDING), lower(UNBOUNDED FOLLOWING)
  2 - output([C.c1], [C.c2]), filter([cast(subquery(1), DECIMAL_INT(1, 0)) = t1.c1]), rowset=16
      exec_params_([C.c2(:0)]), onetime_exprs_(nil), init_plan_idxs_(nil), use_batch=false
  3 - output([C.c1], [C.c2], [t1.c1]), filter(nil), rowset=16
      equal_conds([C.c2 = t1.c2]), other_conds(nil)
      merge_directions([ASC])
  4 - output([t1.c2], [t1.c1]), filter(nil), rowset=16
      access([t1.c2], [t1.c1]), partitions(p0)
      is_index_back=false, is_global_index=false, 
      range_key([t1.c2]), range(MIN ; MAX)always true
  5 - output([C.c1], [C.c2]), filter(nil), rowset=16
      sort_keys([C.c2, ASC])
  6 - output([C.c1], [C.c2]), filter([C.c2 IS NOT NULL]), rowset=16
      access([C.c1], [C.c2]), partitions(p0)
      is_index_back=false, is_global_index=false, filter_before_indexback[false], 
      range_key([C.c3]), range(MIN ; MAX)always true
  7 - output([1]), filter([D.c2 = :0]), rowset=16
      access([D.c2]), partitions(p0)
      is_index_back=false, is_global_index=false, filter_before_indexback[false], 
      range_key([D.c3]), range(MIN ; MAX)always true
SELECT 1 FROM t1, t2 B, (SELECT max(C.c1) AS aggr, C.c2 FROM t2 C GROUP BY C.c2) VIEW1 WHERE (B.c1 = VIEW1.aggr) AND (t1.c1 = (SELECT 1 FROM t2 D WHERE (D.c2 = B.c2))) AND (t1.c2 = B.c2) AND (t1.c2 = VIEW1.c2);
+---+
| 1 |
+---+
+---+

drop table if exists t1;
Warnings:
Note	1051	Unknown table 'oceanbase.t1'
create table t1(c1 int, c2 int, c3 int);
explain outline
SELECT
    /*+opt_param('inlist_rewrite_threshold', 1)*/
    (
        SELECT
            MAX(t1_0.c1)
        FROM
            t1 AS t1_0
    ) AS c1
FROM
    (
        SELECT
            t1_0.c1,
            (
                SELECT
                    MIN(t1_0.c2)
                FROM
                    t1 AS t1_0
            ) AS c2,
            t1_0.c3
        FROM
            t1 AS t1_0
    ) AS t1_0
WHERE
    t1_0.c1 = 1
    OR t1_0.c3 in (2);
Query Plan
========================================================================
|ID|OPERATOR                       |NAME         |EST.ROWS|EST.TIME(us)|
------------------------------------------------------------------------
|0 |TEMP TABLE TRANSFORMATION      |             |2       |13          |
|1 |├─TEMP TABLE INSERT            |TEMP1        |0       |4           |
|2 |│ └─SCALAR GROUP BY            |             |1       |4           |
|3 |│   └─TABLE FULL SCAN          |t1_0         |1       |4           |
|4 |└─UNION ALL                    |             |2       |10          |
|5 |  ├─NESTED-LOOP JOIN CARTESIAN |             |1       |5           |
|6 |  │ ├─SUBPLAN SCAN             |VIEW3        |1       |5           |
|7 |  │ │ └─WINDOW FUNCTION        |             |1       |5           |
|8 |  │ │   └─TABLE FULL SCAN      |t1_0         |1       |4           |
|9 |  │ └─MATERIAL                 |             |1       |1           |
|10|  │   └─TEMP TABLE ACCESS      |VIEW8(TEMP1) |1       |1           |
|11|  └─NESTED-LOOP JOIN CARTESIAN |             |1       |5           |
|12|    ├─HASH JOIN                |             |1       |5           |
|13|    │ ├─SUBPLAN SCAN           |VIEW6        |1       |1           |
|14|    │ │ └─HASH DISTINCT        |             |1       |1           |
|15|    │ │   └─VALUES TABLE ACCESS|VALUES_TABLE1|1       |1           |
|16|    │ └─TABLE FULL SCAN        |t1_0         |1       |4           |
|17|    └─MATERIAL                 |             |1       |1           |
|18|      └─TEMP TABLE ACCESS      |VIEW9(TEMP1) |1       |1           |
========================================================================
Outputs & filters:
-------------------------------------
  0 - output([UNION([1])]), filter(nil), rowset=16
  1 - output(nil), filter(nil), rowset=16
  2 - output([T_FUN_MIN(T_FUN_MIN(t1_0.c2))], [T_FUN_MAX(T_FUN_MAX(t1_0.c1))]), filter(nil), rowset=16
      group(nil), agg_func([T_FUN_MIN(T_FUN_MIN(t1_0.c2))], [T_FUN_MAX(T_FUN_MAX(t1_0.c1))])
  3 - output([T_FUN_MIN(t1_0.c2)], [T_FUN_MAX(t1_0.c1)]), filter(nil), rowset=16
      access([t1_0.c2], [t1_0.c1]), partitions(p0)
      is_index_back=false, is_global_index=false, 
      range_key([t1_0.__pk_increment]), range(MIN ; MAX)always true
  4 - output([UNION([1])]), filter(nil), rowset=16
  5 - output([VIEW3.MAX(t1_0.c1)]), filter(nil), rowset=16
      conds(nil), nl_params_(nil), use_batch=false
  6 - output([VIEW3.MAX(t1_0.c1)]), filter([VIEW3.t1_0.c1 = 1]), rowset=16
      access([VIEW3.MAX(t1_0.c1)], [VIEW3.t1_0.c1])
  7 - output([T_FUN_MAX(t1_0.c1)], [t1_0.c1]), filter(nil), rowset=16
      win_expr(T_FUN_MAX(t1_0.c1)), partition_by(nil), order_by(nil), window_type(RANGE), upper(UNBOUNDED PRECEDING), lower(UNBOUNDED FOLLOWING)
  8 - output([t1_0.c1]), filter(nil), rowset=16
      access([t1_0.c1]), partitions(p0)
      is_index_back=false, is_global_index=false, 
      range_key([t1_0.__pk_increment]), range(MIN ; MAX)always true
  9 - output(nil), filter(nil), rowset=16
 10 - output(nil), filter(nil), rowset=16
      access(nil)
 11 - output([VIEW9.T_FUN_MAX(t1_0.c1)]), filter(nil), rowset=16
      conds(nil), nl_params_(nil), use_batch=false
 12 - output(nil), filter(nil), rowset=16
      equal_conds([t1_0.c3 = VIEW6.column_0]), other_conds(nil)
 13 - output([VIEW6.column_0]), filter(nil), rowset=16
      access([VIEW6.column_0])
 14 - output([VALUES_TABLE1.column_0]), filter(nil), rowset=16
      distinct([VALUES_TABLE1.column_0])
 15 - output([VALUES_TABLE1.column_0]), filter(nil)
      access([VALUES_TABLE1.column_0])
 16 - output([t1_0.c3]), filter([lnnvl(cast(t1_0.c1 = 1, TINYINT(-1, 0)))]), rowset=16
      access([t1_0.c1], [t1_0.c3]), partitions(p0)
      is_index_back=false, is_global_index=false, filter_before_indexback[false], 
      range_key([t1_0.__pk_increment]), range(MIN ; MAX)always true
 17 - output([VIEW9.T_FUN_MAX(t1_0.c1)]), filter(nil), rowset=16
 18 - output([VIEW9.T_FUN_MAX(t1_0.c1)]), filter(nil), rowset=16
      access([VIEW9.T_FUN_MAX(t1_0.c1)])
Outline Data: 
-------------------------------------
  /*+
      BEGIN_OUTLINE_DATA
      FULL(@"SEL$889305A5" "t1_0"@"SEL$889305A5")
      LEADING(@"SEL$F8D8B179" ("VIEW3"@"SEL$DEEDFFE7" "VIEW8"@"SEL$F362CB79_3"))
      USE_NL(@"SEL$F8D8B179" "VIEW8"@"SEL$F362CB79_3")
      USE_NL_MATERIALIZATION(@"SEL$F8D8B179" "VIEW8"@"SEL$F362CB79_3")
      PQ_DISTRIBUTE_WINDOW(@"SEL$1680706D"  (0) NONE)
      FULL(@"SEL$1680706D" "t1_0"@"SEL$8FDFF170_2")
      LEADING(@"SEL$58E999B8" (("VIEW6"@"SEL$D51D1651" "t1_0"@"SEL$DE41DCE6_3") "VIEW9"@"SEL$8FDFF170_3"))
      USE_NL(@"SEL$58E999B8" "VIEW9"@"SEL$8FDFF170_3")
      USE_NL_MATERIALIZATION(@"SEL$58E999B8" "VIEW9"@"SEL$8FDFF170_3")
      USE_HASH(@"SEL$58E999B8" "t1_0"@"SEL$DE41DCE6_3")
      USE_HASH_DISTINCT(@"SEL$FBB0D0E6_3")
      FULL(@"SEL$58E999B8" "t1_0"@"SEL$DE41DCE6_3")
      USE_CONCAT(@"SEL$1" 't1_0.c1 = ? OR t1_0.c3 = ANY(SQ(SEL$4))')
      PRED_DEDUCE(@"SEL$8556E4CE_1")
      PRED_DEDUCE(@"SEL$DE41DCE6_2")
      PRED_DEDUCE(@"SEL$8556E4CE_2")
      PRED_DEDUCE(@"SEL$DE41DCE6_3")
      AGGR_FIRST_UNNEST(@"SEL$F362CB79_3")
      AGGR_FIRST_UNNEST(@"SEL$8FDFF170_2")
      AGGR_FIRST_UNNEST(@"SEL$F362CB79_4")
      AGGR_FIRST_UNNEST(@"SEL$8FDFF170_3")
      PROJECT_PRUNE(@"SEL$A5030645")
      PROJECT_PRUNE(@"SEL$567C89FD")
      UNNEST(@"SEL$FBB0D0E6_3")
      MERGE(@"SEL$EBC43C41" > "SEL$E459B516")
      MERGE(@"SEL$A9D313F2" > "SEL$7810EDAB")
      WIN_MAGIC(@"SEL$39F3D6C9" "VIEW3"@"SEL$DEEDFFE7" "t1_0"@"SEL$DE41DCE6_2")
      WIN_MAGIC(@"SEL$4FB0F337" "VIEW5"@"SEL$A253FC8D" "VIEW4"@"SEL$8A106C2D")
      MATERIALIZE(@"SET$8556E4CE" ("SEL$F362CB79_3", "SEL$8FDFF170_3"))
      PROJECT_PRUNE(@"SEL$8FDFF170_2")
      PROJECT_PRUNE(@"SEL$F362CB79_3")
      PROJECT_PRUNE(@"SEL$8FDFF170_3")
      MERGE(@"SEL$8BEBFC4C" < "SEL$BE7FF608")
      SEMI_TO_INNER(@"SEL$BE7FF609" "VIEW6")
      MERGE(@"SEL$1C206101" > "SEL$5197E157")
      MERGE(@"SEL$31646382" > "SEL$725BBE9C")
      OPTIMIZER_FEATURES_ENABLE('')
      OPT_PARAM('INLIST_REWRITE_THRESHOLD' 1)
      END_OUTLINE_DATA
  */

drop table t1;
create table t1(c1 int, c2 int);
explain select * from
  (select min(t1.c1) from t1) view1,
  (select min(t1.c2) from t1) view2;
Query Plan
=====================================================================
|ID|OPERATOR                     |NAME        |EST.ROWS|EST.TIME(us)|
---------------------------------------------------------------------
|0 |TEMP TABLE TRANSFORMATION    |            |1       |5           |
|1 |├─TEMP TABLE INSERT          |TEMP1       |0       |4           |
|2 |│ └─SCALAR GROUP BY          |            |1       |4           |
|3 |│   └─TABLE FULL SCAN        |t1          |1       |4           |
|4 |└─NESTED-LOOP JOIN CARTESIAN |            |1       |1           |
|5 |  ├─TEMP TABLE ACCESS        |VIEW1(TEMP1)|1       |1           |
|6 |  └─TEMP TABLE ACCESS        |VIEW2(TEMP1)|1       |1           |
=====================================================================
Outputs & filters:
-------------------------------------
  0 - output([VIEW1.T_FUN_MIN(t1.c1)], [VIEW2.T_FUN_MIN(t1.c2)]), filter(nil), rowset=16
  1 - output(nil), filter(nil), rowset=16
  2 - output([T_FUN_MIN(T_FUN_MIN(t1.c1))], [T_FUN_MIN(T_FUN_MIN(t1.c2))]), filter(nil), rowset=16
      group(nil), agg_func([T_FUN_MIN(T_FUN_MIN(t1.c1))], [T_FUN_MIN(T_FUN_MIN(t1.c2))])
  3 - output([T_FUN_MIN(t1.c1)], [T_FUN_MIN(t1.c2)]), filter(nil), rowset=16
      access([t1.c1], [t1.c2]), partitions(p0)
      is_index_back=false, is_global_index=false, 
      range_key([t1.__pk_increment]), range(MIN ; MAX)always true
  4 - output([VIEW1.T_FUN_MIN(t1.c1)], [VIEW2.T_FUN_MIN(t1.c2)]), filter(nil), rowset=16
      conds(nil), nl_params_(nil), use_batch=false
  5 - output([VIEW1.T_FUN_MIN(t1.c1)]), filter(nil), rowset=16
      access([VIEW1.T_FUN_MIN(t1.c1)])
  6 - output([VIEW2.T_FUN_MIN(t1.c2)]), filter(nil), rowset=16
      access([VIEW2.T_FUN_MIN(t1.c2)])

drop table t1;
drop table t2;
