result_format: 4
explain_protocol: 2
DROP DATABASE IF EXISTS DB_ANY_ALL;
CREATE DATABASE DB_ANY_ALL;
USE DB_ANY_ALL;

drop table if exists t1, t2, is_t1;
create table t1(c1 int not null, c2 int, key idx_c1(c2));
create table t2(c1 int not null, c2 int, key idx_c2(c1));
create table is_t1(c1 int);

insert/*trace*/ into t1 values(1,2),(2,3),(3,3), (4,3),(4,4),(6,5),(6,5),(10,20);
insert/*trace*/ into t2 values(1,2),(2,3),(3,3), (4,3),(4,4),(6,5),(6,5),(10,20);

set autocommit = 0;



# case 1
****** val > ANY(SELECT col_item ...)  <==> val > ANY(SELECT MIN(col_item) ...);

EXPLAIN select c1 from t1 where c1 >ANY(select c1 from t2);
Query Plan
============================================================
|ID|OPERATOR              |NAME      |EST.ROWS|EST.TIME(us)|
------------------------------------------------------------
|0 |NESTED-LOOP SEMI JOIN |          |1       |152         |
|1 |├─TABLE FULL SCAN     |t1        |8       |3           |
|2 |└─TABLE RANGE SCAN    |t2(idx_c2)|1       |18          |
============================================================
Outputs & filters:
-------------------------------------
  0 - output([t1.c1]), filter(nil), rowset=16
      conds(nil), nl_params_([t1.c1(:0)]), use_batch=false
  1 - output([t1.c1]), filter(nil), rowset=16
      access([t1.c1]), partitions(p0)
      is_index_back=false, is_global_index=false, 
      range_key([t1.__pk_increment]), range(MIN ; MAX)always true
  2 - output(nil), filter(nil), rowset=16
      access(nil), partitions(p0)
      is_index_back=false, is_global_index=false, 
      range_key([t2.c1], [t2.__pk_increment]), range(MIN ; MAX), 
      range_cond([:0 > t2.c1])
select c1 from t1 where c1 >ANY(select c1 from t2);
+----+
| c1 |
+----+
|  2 |
|  3 |
|  4 |
|  4 |
|  6 |
|  6 |
| 10 |
+----+
EXPLAIN select /*+no_rewrite*/c1 from t1 where c1 >ANY(select c1 from t2);
Query Plan
=======================================================
|ID|OPERATOR         |NAME      |EST.ROWS|EST.TIME(us)|
-------------------------------------------------------
|0 |SUBPLAN FILTER   |          |4       |6           |
|1 |├─TABLE FULL SCAN|t1        |8       |3           |
|2 |└─TABLE FULL SCAN|t2(idx_c2)|8       |3           |
=======================================================
Outputs & filters:
-------------------------------------
  0 - output([t1.c1]), filter([t1.c1 > ANY(subquery(1))]), rowset=16
      exec_params_(nil), onetime_exprs_(nil), init_plan_idxs_([1]), use_batch=false
  1 - output([t1.c1]), filter(nil), rowset=16
      access([t1.c1]), partitions(p0)
      is_index_back=false, is_global_index=false, 
      range_key([t1.__pk_increment]), range(MIN ; MAX)always true
  2 - output([t2.c1]), filter(nil), rowset=16
      access([t2.c1]), partitions(p0)
      is_index_back=false, is_global_index=false, 
      range_key([t2.c1], [t2.__pk_increment]), range(MIN,MIN ; MAX,MAX)always true
select /*+no_rewrite*/c1 from t1 where c1 >ANY(select c1 from t2);
+----+
| c1 |
+----+
|  2 |
|  3 |
|  4 |
|  4 |
|  6 |
|  6 |
| 10 |
+----+
EXPLAIN update t1 set c1 = c2 + 1 where c1 >ANY(select c1 from t2);
Query Plan
==============================================================
|ID|OPERATOR                |NAME      |EST.ROWS|EST.TIME(us)|
--------------------------------------------------------------
|0 |UPDATE                  |          |1       |180         |
|1 |└─NESTED-LOOP SEMI JOIN |          |1       |153         |
|2 |  ├─TABLE FULL SCAN     |t1        |8       |3           |
|3 |  └─TABLE RANGE SCAN    |t2(idx_c2)|1       |18          |
==============================================================
Outputs & filters:
-------------------------------------
  0 - output(nil), filter(nil)
      table_columns([{t1: ({t1: (t1.__pk_increment, t1.c1, t1.c2)})}]),
      update([t1.c1=column_conv(INT,PS:(11,0),NOT NULL,cast(t1.c2 + 1, INT(-1, 0)))])
  1 - output([t1.__pk_increment], [t1.c1], [t1.c2]), filter(nil), rowset=16
      conds(nil), nl_params_([t1.c1(:0)]), use_batch=false
  2 - output([t1.__pk_increment], [t1.c1], [t1.c2]), filter(nil), rowset=16
      access([t1.__pk_increment], [t1.c1], [t1.c2]), partitions(p0)
      is_index_back=false, is_global_index=false, 
      range_key([t1.__pk_increment]), range(MIN ; MAX)always true
  3 - output(nil), filter(nil), rowset=16
      access(nil), partitions(p0)
      is_index_back=false, is_global_index=false, 
      range_key([t2.c1], [t2.__pk_increment]), range(MIN ; MAX), 
      range_cond([:0 > t2.c1])
update t1 set c1 = c2 + 1 where c1 >ANY(select c1 from t2);
select/**/ * from t1;
+----+------+
| c1 | c2   |
+----+------+
|  1 |    2 |
|  4 |    3 |
|  4 |    3 |
|  4 |    3 |
|  5 |    4 |
|  6 |    5 |
|  6 |    5 |
| 21 |   20 |
+----+------+
rollback;
EXPLAIN update /*+no_rewrite*/t1 set c1 = c2 + 1 where c1 >ANY(select c1 from t2);
Query Plan
=========================================================
|ID|OPERATOR           |NAME      |EST.ROWS|EST.TIME(us)|
---------------------------------------------------------
|0 |UPDATE             |          |4       |60          |
|1 |└─SUBPLAN FILTER   |          |4       |6           |
|2 |  ├─TABLE FULL SCAN|t1        |8       |3           |
|3 |  └─TABLE FULL SCAN|t2(idx_c2)|8       |3           |
=========================================================
Outputs & filters:
-------------------------------------
  0 - output(nil), filter(nil)
      table_columns([{t1: ({t1: (t1.__pk_increment, t1.c1, t1.c2)})}]),
      update([t1.c1=column_conv(INT,PS:(11,0),NOT NULL,cast(t1.c2 + 1, INT(-1, 0)))])
  1 - output([t1.__pk_increment], [t1.c1], [t1.c2]), filter([t1.c1 > ANY(subquery(1))]), rowset=16
      exec_params_(nil), onetime_exprs_(nil), init_plan_idxs_([1]), use_batch=false
  2 - output([t1.__pk_increment], [t1.c1], [t1.c2]), filter(nil), rowset=16
      access([t1.__pk_increment], [t1.c1], [t1.c2]), partitions(p0)
      is_index_back=false, is_global_index=false, 
      range_key([t1.__pk_increment]), range(MIN ; MAX)always true
  3 - output([t2.c1]), filter(nil), rowset=16
      access([t2.c1]), partitions(p0)
      is_index_back=false, is_global_index=false, 
      range_key([t2.c1], [t2.__pk_increment]), range(MIN,MIN ; MAX,MAX)always true
update /*+no_rewrite*/t1 set c1 = c2 + 1 where c1 >ANY(select c1 from t2);
select/**/ * from t1;
+----+------+
| c1 | c2   |
+----+------+
|  1 |    2 |
|  4 |    3 |
|  4 |    3 |
|  4 |    3 |
|  5 |    4 |
|  6 |    5 |
|  6 |    5 |
| 21 |   20 |
+----+------+
rollback;
EXPLAIN delete from t1 where c1 >ANY(select c1 from t2);
Query Plan
==============================================================
|ID|OPERATOR                |NAME      |EST.ROWS|EST.TIME(us)|
--------------------------------------------------------------
|0 |DELETE                  |          |1       |161         |
|1 |└─NESTED-LOOP SEMI JOIN |          |1       |153         |
|2 |  ├─TABLE FULL SCAN     |t1        |8       |3           |
|3 |  └─TABLE RANGE SCAN    |t2(idx_c2)|1       |18          |
==============================================================
Outputs & filters:
-------------------------------------
  0 - output(nil), filter(nil)
      table_columns([{t1: ({t1: (t1.__pk_increment, t1.c1, t1.c2)})}])
  1 - output([t1.__pk_increment], [t1.c1], [t1.c2]), filter(nil), rowset=16
      conds(nil), nl_params_([t1.c1(:0)]), use_batch=false
  2 - output([t1.__pk_increment], [t1.c1], [t1.c2]), filter(nil), rowset=16
      access([t1.__pk_increment], [t1.c1], [t1.c2]), partitions(p0)
      is_index_back=false, is_global_index=false, 
      range_key([t1.__pk_increment]), range(MIN ; MAX)always true
  3 - output(nil), filter(nil), rowset=16
      access(nil), partitions(p0)
      is_index_back=false, is_global_index=false, 
      range_key([t2.c1], [t2.__pk_increment]), range(MIN ; MAX), 
      range_cond([:0 > t2.c1])
delete from t1 where c1 >ANY(select c1 from t2);
select/**/ * from t1;
+----+------+
| c1 | c2   |
+----+------+
|  1 |    2 |
+----+------+
rollback;
EXPLAIN delete /*+no_rewrite*/from t1 where c1 >ANY(select c1 from t2);
Query Plan
=========================================================
|ID|OPERATOR           |NAME      |EST.ROWS|EST.TIME(us)|
---------------------------------------------------------
|0 |DELETE             |          |4       |33          |
|1 |└─SUBPLAN FILTER   |          |4       |6           |
|2 |  ├─TABLE FULL SCAN|t1        |8       |3           |
|3 |  └─TABLE FULL SCAN|t2(idx_c2)|8       |3           |
=========================================================
Outputs & filters:
-------------------------------------
  0 - output(nil), filter(nil)
      table_columns([{t1: ({t1: (t1.__pk_increment, t1.c1, t1.c2)})}])
  1 - output([t1.__pk_increment], [t1.c1], [t1.c2]), filter([t1.c1 > ANY(subquery(1))]), rowset=16
      exec_params_(nil), onetime_exprs_(nil), init_plan_idxs_([1]), use_batch=false
  2 - output([t1.__pk_increment], [t1.c1], [t1.c2]), filter(nil), rowset=16
      access([t1.__pk_increment], [t1.c1], [t1.c2]), partitions(p0)
      is_index_back=false, is_global_index=false, 
      range_key([t1.__pk_increment]), range(MIN ; MAX)always true
  3 - output([t2.c1]), filter(nil), rowset=16
      access([t2.c1]), partitions(p0)
      is_index_back=false, is_global_index=false, 
      range_key([t2.c1], [t2.__pk_increment]), range(MIN,MIN ; MAX,MAX)always true
delete /*+no_rewrite*/from t1 where c1 >ANY(select c1 from t2);
select/**/ * from t1;
+----+------+
| c1 | c2   |
+----+------+
|  1 |    2 |
+----+------+
rollback;
EXPLAIN insert into is_t1 select c1 from t1 where c1 >ANY(select c1 from t2);
Query Plan
=====================================================================
|ID|OPERATOR                  |NAME           |EST.ROWS|EST.TIME(us)|
---------------------------------------------------------------------
|0 |INSERT                    |               |1       |161         |
|1 |└─SUBPLAN SCAN            |ANONYMOUS_VIEW1|1       |152         |
|2 |  └─NESTED-LOOP SEMI JOIN |               |1       |152         |
|3 |    ├─TABLE FULL SCAN     |t1             |8       |3           |
|4 |    └─TABLE RANGE SCAN    |t2(idx_c2)     |1       |18          |
=====================================================================
Outputs & filters:
-------------------------------------
  0 - output(nil), filter(nil)
      columns([{is_t1: ({is_t1: (is_t1.__pk_increment, is_t1.c1)})}]), partitions(p0), 
      column_values([T_HIDDEN_PK], [column_conv(INT,PS:(11,0),NULL,ANONYMOUS_VIEW1.c1)])
  1 - output([ANONYMOUS_VIEW1.c1]), filter(nil), rowset=16
      access([ANONYMOUS_VIEW1.c1])
  2 - output([t1.c1]), filter(nil), rowset=16
      conds(nil), nl_params_([t1.c1(:0)]), use_batch=false
  3 - output([t1.c1]), filter(nil), rowset=16
      access([t1.c1]), partitions(p0)
      is_index_back=false, is_global_index=false, 
      range_key([t1.__pk_increment]), range(MIN ; MAX)always true
  4 - output(nil), filter(nil), rowset=16
      access(nil), partitions(p0)
      is_index_back=false, is_global_index=false, 
      range_key([t2.c1], [t2.__pk_increment]), range(MIN ; MAX), 
      range_cond([:0 > t2.c1])
insert into is_t1 select c1 from t1 where c1 >ANY(select c1 from t2);
select/**/ * from t1;
+----+------+
| c1 | c2   |
+----+------+
|  1 |    2 |
|  2 |    3 |
|  3 |    3 |
|  4 |    3 |
|  4 |    4 |
|  6 |    5 |
|  6 |    5 |
| 10 |   20 |
+----+------+
rollback;
EXPLAIN insert into is_t1 select /*+NO_REWRITE*/c1 from t1 where c1 >ANY(select c1 from t2);
Query Plan
================================================================
|ID|OPERATOR             |NAME           |EST.ROWS|EST.TIME(us)|
----------------------------------------------------------------
|0 |INSERT               |               |4       |38          |
|1 |└─SUBPLAN SCAN       |ANONYMOUS_VIEW1|4       |6           |
|2 |  └─SUBPLAN FILTER   |               |4       |6           |
|3 |    ├─TABLE FULL SCAN|t1             |8       |3           |
|4 |    └─TABLE FULL SCAN|t2(idx_c2)     |8       |3           |
================================================================
Outputs & filters:
-------------------------------------
  0 - output(nil), filter(nil)
      columns([{is_t1: ({is_t1: (is_t1.__pk_increment, is_t1.c1)})}]), partitions(p0), 
      column_values([T_HIDDEN_PK], [column_conv(INT,PS:(11,0),NULL,ANONYMOUS_VIEW1.c1)])
  1 - output([ANONYMOUS_VIEW1.c1]), filter(nil), rowset=16
      access([ANONYMOUS_VIEW1.c1])
  2 - output([t1.c1]), filter([t1.c1 > ANY(subquery(1))]), rowset=16
      exec_params_(nil), onetime_exprs_(nil), init_plan_idxs_([1]), use_batch=false
  3 - output([t1.c1]), filter(nil), rowset=16
      access([t1.c1]), partitions(p0)
      is_index_back=false, is_global_index=false, 
      range_key([t1.__pk_increment]), range(MIN ; MAX)always true
  4 - output([t2.c1]), filter(nil), rowset=16
      access([t2.c1]), partitions(p0)
      is_index_back=false, is_global_index=false, 
      range_key([t2.c1], [t2.__pk_increment]), range(MIN,MIN ; MAX,MAX)always true
insert into is_t1 select /*+NO_REWRITE*/c1 from t1 where c1 >ANY(select c1 from t2);
select/**/ * from t1;
+----+------+
| c1 | c2   |
+----+------+
|  1 |    2 |
|  2 |    3 |
|  3 |    3 |
|  4 |    3 |
|  4 |    4 |
|  6 |    5 |
|  6 |    5 |
| 10 |   20 |
+----+------+
rollback;




# case 2
****** val < ANY(SELECT col_item ...)  <==> val < ANY(SELECT MAX(col_item) ...);

EXPLAIN select c1 from t1 where c1 < ANY(select c1 from t2);
Query Plan
============================================================
|ID|OPERATOR              |NAME      |EST.ROWS|EST.TIME(us)|
------------------------------------------------------------
|0 |NESTED-LOOP SEMI JOIN |          |1       |152         |
|1 |├─TABLE FULL SCAN     |t1        |8       |3           |
|2 |└─TABLE RANGE SCAN    |t2(idx_c2)|1       |18          |
============================================================
Outputs & filters:
-------------------------------------
  0 - output([t1.c1]), filter(nil), rowset=16
      conds(nil), nl_params_([t1.c1(:0)]), use_batch=false
  1 - output([t1.c1]), filter(nil), rowset=16
      access([t1.c1]), partitions(p0)
      is_index_back=false, is_global_index=false, 
      range_key([t1.__pk_increment]), range(MIN ; MAX)always true
  2 - output(nil), filter(nil), rowset=16
      access(nil), partitions(p0)
      is_index_back=false, is_global_index=false, 
      range_key([t2.c1], [t2.__pk_increment]), range(MIN ; MAX), 
      range_cond([:0 < t2.c1])
select c1 from t1 where c1 < ANY(select c1 from t2);
+----+
| c1 |
+----+
|  1 |
|  2 |
|  3 |
|  4 |
|  4 |
|  6 |
|  6 |
+----+
EXPLAIN select /*+no_rewrite*/c1 from t1 where c1 < ANY(select c1 from t2);
Query Plan
=======================================================
|ID|OPERATOR         |NAME      |EST.ROWS|EST.TIME(us)|
-------------------------------------------------------
|0 |SUBPLAN FILTER   |          |4       |6           |
|1 |├─TABLE FULL SCAN|t1        |8       |3           |
|2 |└─TABLE FULL SCAN|t2(idx_c2)|8       |3           |
=======================================================
Outputs & filters:
-------------------------------------
  0 - output([t1.c1]), filter([t1.c1 < ANY(subquery(1))]), rowset=16
      exec_params_(nil), onetime_exprs_(nil), init_plan_idxs_([1]), use_batch=false
  1 - output([t1.c1]), filter(nil), rowset=16
      access([t1.c1]), partitions(p0)
      is_index_back=false, is_global_index=false, 
      range_key([t1.__pk_increment]), range(MIN ; MAX)always true
  2 - output([t2.c1]), filter(nil), rowset=16
      access([t2.c1]), partitions(p0)
      is_index_back=false, is_global_index=false, 
      range_key([t2.c1], [t2.__pk_increment]), range(MIN,MIN ; MAX,MAX)always true
select /*+no_rewrite*/c1 from t1 where c1 < ANY(select c1 from t2);
+----+
| c1 |
+----+
|  1 |
|  2 |
|  3 |
|  4 |
|  4 |
|  6 |
|  6 |
+----+
EXPLAIN update t1 set c1 = c2 + 1 where c1 < ANY(select c1 from t2);
Query Plan
==============================================================
|ID|OPERATOR                |NAME      |EST.ROWS|EST.TIME(us)|
--------------------------------------------------------------
|0 |UPDATE                  |          |1       |180         |
|1 |└─NESTED-LOOP SEMI JOIN |          |1       |153         |
|2 |  ├─TABLE FULL SCAN     |t1        |8       |3           |
|3 |  └─TABLE RANGE SCAN    |t2(idx_c2)|1       |18          |
==============================================================
Outputs & filters:
-------------------------------------
  0 - output(nil), filter(nil)
      table_columns([{t1: ({t1: (t1.__pk_increment, t1.c1, t1.c2)})}]),
      update([t1.c1=column_conv(INT,PS:(11,0),NOT NULL,cast(t1.c2 + 1, INT(-1, 0)))])
  1 - output([t1.__pk_increment], [t1.c1], [t1.c2]), filter(nil), rowset=16
      conds(nil), nl_params_([t1.c1(:0)]), use_batch=false
  2 - output([t1.__pk_increment], [t1.c1], [t1.c2]), filter(nil), rowset=16
      access([t1.__pk_increment], [t1.c1], [t1.c2]), partitions(p0)
      is_index_back=false, is_global_index=false, 
      range_key([t1.__pk_increment]), range(MIN ; MAX)always true
  3 - output(nil), filter(nil), rowset=16
      access(nil), partitions(p0)
      is_index_back=false, is_global_index=false, 
      range_key([t2.c1], [t2.__pk_increment]), range(MIN ; MAX), 
      range_cond([:0 < t2.c1])
update t1 set c1 = c2 + 1 where c1 < ANY(select c1 from t2);
select/**/ * from t1;
+----+------+
| c1 | c2   |
+----+------+
|  3 |    2 |
|  4 |    3 |
|  4 |    3 |
|  4 |    3 |
|  5 |    4 |
|  6 |    5 |
|  6 |    5 |
| 10 |   20 |
+----+------+
rollback;
EXPLAIN update /*+no_rewrite*/t1 set c1 = c2 + 1 where c1 < ANY(select c1 from t2);
Query Plan
=========================================================
|ID|OPERATOR           |NAME      |EST.ROWS|EST.TIME(us)|
---------------------------------------------------------
|0 |UPDATE             |          |4       |60          |
|1 |└─SUBPLAN FILTER   |          |4       |6           |
|2 |  ├─TABLE FULL SCAN|t1        |8       |3           |
|3 |  └─TABLE FULL SCAN|t2(idx_c2)|8       |3           |
=========================================================
Outputs & filters:
-------------------------------------
  0 - output(nil), filter(nil)
      table_columns([{t1: ({t1: (t1.__pk_increment, t1.c1, t1.c2)})}]),
      update([t1.c1=column_conv(INT,PS:(11,0),NOT NULL,cast(t1.c2 + 1, INT(-1, 0)))])
  1 - output([t1.__pk_increment], [t1.c1], [t1.c2]), filter([t1.c1 < ANY(subquery(1))]), rowset=16
      exec_params_(nil), onetime_exprs_(nil), init_plan_idxs_([1]), use_batch=false
  2 - output([t1.__pk_increment], [t1.c1], [t1.c2]), filter(nil), rowset=16
      access([t1.__pk_increment], [t1.c1], [t1.c2]), partitions(p0)
      is_index_back=false, is_global_index=false, 
      range_key([t1.__pk_increment]), range(MIN ; MAX)always true
  3 - output([t2.c1]), filter(nil), rowset=16
      access([t2.c1]), partitions(p0)
      is_index_back=false, is_global_index=false, 
      range_key([t2.c1], [t2.__pk_increment]), range(MIN,MIN ; MAX,MAX)always true
update /*+no_rewrite*/t1 set c1 = c2 + 1 where c1 < ANY(select c1 from t2);
select/**/ * from t1;
+----+------+
| c1 | c2   |
+----+------+
|  3 |    2 |
|  4 |    3 |
|  4 |    3 |
|  4 |    3 |
|  5 |    4 |
|  6 |    5 |
|  6 |    5 |
| 10 |   20 |
+----+------+
rollback;
EXPLAIN delete from t1 where c1 < ANY(select c1 from t2);
Query Plan
==============================================================
|ID|OPERATOR                |NAME      |EST.ROWS|EST.TIME(us)|
--------------------------------------------------------------
|0 |DELETE                  |          |1       |161         |
|1 |└─NESTED-LOOP SEMI JOIN |          |1       |153         |
|2 |  ├─TABLE FULL SCAN     |t1        |8       |3           |
|3 |  └─TABLE RANGE SCAN    |t2(idx_c2)|1       |18          |
==============================================================
Outputs & filters:
-------------------------------------
  0 - output(nil), filter(nil)
      table_columns([{t1: ({t1: (t1.__pk_increment, t1.c1, t1.c2)})}])
  1 - output([t1.__pk_increment], [t1.c1], [t1.c2]), filter(nil), rowset=16
      conds(nil), nl_params_([t1.c1(:0)]), use_batch=false
  2 - output([t1.__pk_increment], [t1.c1], [t1.c2]), filter(nil), rowset=16
      access([t1.__pk_increment], [t1.c1], [t1.c2]), partitions(p0)
      is_index_back=false, is_global_index=false, 
      range_key([t1.__pk_increment]), range(MIN ; MAX)always true
  3 - output(nil), filter(nil), rowset=16
      access(nil), partitions(p0)
      is_index_back=false, is_global_index=false, 
      range_key([t2.c1], [t2.__pk_increment]), range(MIN ; MAX), 
      range_cond([:0 < t2.c1])
delete from t1 where c1 < ANY(select c1 from t2);
select/**/ * from t1;
+----+------+
| c1 | c2   |
+----+------+
| 10 |   20 |
+----+------+
rollback;
EXPLAIN delete /*+no_rewrite*/from t1 where c1 < ANY(select c1 from t2);
Query Plan
=========================================================
|ID|OPERATOR           |NAME      |EST.ROWS|EST.TIME(us)|
---------------------------------------------------------
|0 |DELETE             |          |4       |33          |
|1 |└─SUBPLAN FILTER   |          |4       |6           |
|2 |  ├─TABLE FULL SCAN|t1        |8       |3           |
|3 |  └─TABLE FULL SCAN|t2(idx_c2)|8       |3           |
=========================================================
Outputs & filters:
-------------------------------------
  0 - output(nil), filter(nil)
      table_columns([{t1: ({t1: (t1.__pk_increment, t1.c1, t1.c2)})}])
  1 - output([t1.__pk_increment], [t1.c1], [t1.c2]), filter([t1.c1 < ANY(subquery(1))]), rowset=16
      exec_params_(nil), onetime_exprs_(nil), init_plan_idxs_([1]), use_batch=false
  2 - output([t1.__pk_increment], [t1.c1], [t1.c2]), filter(nil), rowset=16
      access([t1.__pk_increment], [t1.c1], [t1.c2]), partitions(p0)
      is_index_back=false, is_global_index=false, 
      range_key([t1.__pk_increment]), range(MIN ; MAX)always true
  3 - output([t2.c1]), filter(nil), rowset=16
      access([t2.c1]), partitions(p0)
      is_index_back=false, is_global_index=false, 
      range_key([t2.c1], [t2.__pk_increment]), range(MIN,MIN ; MAX,MAX)always true
delete /*+no_rewrite*/from t1 where c1 < ANY(select c1 from t2);
select/**/ * from t1;
+----+------+
| c1 | c2   |
+----+------+
| 10 |   20 |
+----+------+
rollback;
EXPLAIN insert into is_t1 select c1 from t1 where c1 < ANY(select c1 from t2);
Query Plan
=====================================================================
|ID|OPERATOR                  |NAME           |EST.ROWS|EST.TIME(us)|
---------------------------------------------------------------------
|0 |INSERT                    |               |1       |161         |
|1 |└─SUBPLAN SCAN            |ANONYMOUS_VIEW1|1       |152         |
|2 |  └─NESTED-LOOP SEMI JOIN |               |1       |152         |
|3 |    ├─TABLE FULL SCAN     |t1             |8       |3           |
|4 |    └─TABLE RANGE SCAN    |t2(idx_c2)     |1       |18          |
=====================================================================
Outputs & filters:
-------------------------------------
  0 - output(nil), filter(nil)
      columns([{is_t1: ({is_t1: (is_t1.__pk_increment, is_t1.c1)})}]), partitions(p0), 
      column_values([T_HIDDEN_PK], [column_conv(INT,PS:(11,0),NULL,ANONYMOUS_VIEW1.c1)])
  1 - output([ANONYMOUS_VIEW1.c1]), filter(nil), rowset=16
      access([ANONYMOUS_VIEW1.c1])
  2 - output([t1.c1]), filter(nil), rowset=16
      conds(nil), nl_params_([t1.c1(:0)]), use_batch=false
  3 - output([t1.c1]), filter(nil), rowset=16
      access([t1.c1]), partitions(p0)
      is_index_back=false, is_global_index=false, 
      range_key([t1.__pk_increment]), range(MIN ; MAX)always true
  4 - output(nil), filter(nil), rowset=16
      access(nil), partitions(p0)
      is_index_back=false, is_global_index=false, 
      range_key([t2.c1], [t2.__pk_increment]), range(MIN ; MAX), 
      range_cond([:0 < t2.c1])
insert into is_t1 select c1 from t1 where c1 < ANY(select c1 from t2);
select/**/ * from is_t1;
+------+
| c1   |
+------+
|    1 |
|    2 |
|    3 |
|    4 |
|    4 |
|    6 |
|    6 |
+------+
rollback;
EXPLAIN insert into is_t1 select /*+NO_REWRITE*/c1 from t1 where c1 < ANY(select c1 from t2);
Query Plan
================================================================
|ID|OPERATOR             |NAME           |EST.ROWS|EST.TIME(us)|
----------------------------------------------------------------
|0 |INSERT               |               |4       |38          |
|1 |└─SUBPLAN SCAN       |ANONYMOUS_VIEW1|4       |6           |
|2 |  └─SUBPLAN FILTER   |               |4       |6           |
|3 |    ├─TABLE FULL SCAN|t1             |8       |3           |
|4 |    └─TABLE FULL SCAN|t2(idx_c2)     |8       |3           |
================================================================
Outputs & filters:
-------------------------------------
  0 - output(nil), filter(nil)
      columns([{is_t1: ({is_t1: (is_t1.__pk_increment, is_t1.c1)})}]), partitions(p0), 
      column_values([T_HIDDEN_PK], [column_conv(INT,PS:(11,0),NULL,ANONYMOUS_VIEW1.c1)])
  1 - output([ANONYMOUS_VIEW1.c1]), filter(nil), rowset=16
      access([ANONYMOUS_VIEW1.c1])
  2 - output([t1.c1]), filter([t1.c1 < ANY(subquery(1))]), rowset=16
      exec_params_(nil), onetime_exprs_(nil), init_plan_idxs_([1]), use_batch=false
  3 - output([t1.c1]), filter(nil), rowset=16
      access([t1.c1]), partitions(p0)
      is_index_back=false, is_global_index=false, 
      range_key([t1.__pk_increment]), range(MIN ; MAX)always true
  4 - output([t2.c1]), filter(nil), rowset=16
      access([t2.c1]), partitions(p0)
      is_index_back=false, is_global_index=false, 
      range_key([t2.c1], [t2.__pk_increment]), range(MIN,MIN ; MAX,MAX)always true
insert into is_t1 select /*+NO_REWRITE*/c1 from t1 where c1 < ANY(select c1 from t2);
select/**/ * from is_t1;
+------+
| c1   |
+------+
|    1 |
|    2 |
|    3 |
|    4 |
|    4 |
|    6 |
|    6 |
+------+
rollback;



# case 3
****** val > ALL(SELECT col_item ...)  <==> val > ALL(SELECT MAX(col_item) ...);

EXPLAIN select c1 from t1 where c1 > ALL(select c1 from t2);
Query Plan
============================================================
|ID|OPERATOR              |NAME      |EST.ROWS|EST.TIME(us)|
------------------------------------------------------------
|0 |NESTED-LOOP ANTI JOIN |          |8       |152         |
|1 |├─TABLE FULL SCAN     |t1        |8       |3           |
|2 |└─TABLE RANGE SCAN    |t2(idx_c2)|1       |18          |
============================================================
Outputs & filters:
-------------------------------------
  0 - output([t1.c1]), filter(nil), rowset=16
      conds(nil), nl_params_([t1.c1(:0)]), use_batch=false
  1 - output([t1.c1]), filter(nil), rowset=16
      access([t1.c1]), partitions(p0)
      is_index_back=false, is_global_index=false, 
      range_key([t1.__pk_increment]), range(MIN ; MAX)always true
  2 - output(nil), filter(nil), rowset=16
      access(nil), partitions(p0)
      is_index_back=false, is_global_index=false, 
      range_key([t2.c1], [t2.__pk_increment]), range(MIN ; MAX), 
      range_cond([:0 <= t2.c1])
select c1 from t1 where c1 > ALL(select c1 from t2);
+----+
| c1 |
+----+
+----+
EXPLAIN select /*+no_rewrite*/c1 from t1 where c1 > ALL(select c1 from t2);
Query Plan
=======================================================
|ID|OPERATOR         |NAME      |EST.ROWS|EST.TIME(us)|
-------------------------------------------------------
|0 |SUBPLAN FILTER   |          |4       |6           |
|1 |├─TABLE FULL SCAN|t1        |8       |3           |
|2 |└─TABLE FULL SCAN|t2(idx_c2)|8       |3           |
=======================================================
Outputs & filters:
-------------------------------------
  0 - output([t1.c1]), filter([t1.c1 > ALL(subquery(1))]), rowset=16
      exec_params_(nil), onetime_exprs_(nil), init_plan_idxs_([1]), use_batch=false
  1 - output([t1.c1]), filter(nil), rowset=16
      access([t1.c1]), partitions(p0)
      is_index_back=false, is_global_index=false, 
      range_key([t1.__pk_increment]), range(MIN ; MAX)always true
  2 - output([t2.c1]), filter(nil), rowset=16
      access([t2.c1]), partitions(p0)
      is_index_back=false, is_global_index=false, 
      range_key([t2.c1], [t2.__pk_increment]), range(MIN,MIN ; MAX,MAX)always true
select /*+no_rewrite*/c1 from t1 where c1 > ALL(select c1 from t2);
+----+
| c1 |
+----+
+----+
EXPLAIN update t1 set c1 = c2 + 1 where c1 > ALL(select c1 from t2);
Query Plan
==============================================================
|ID|OPERATOR                |NAME      |EST.ROWS|EST.TIME(us)|
--------------------------------------------------------------
|0 |UPDATE                  |          |8       |234         |
|1 |└─NESTED-LOOP ANTI JOIN |          |8       |153         |
|2 |  ├─TABLE FULL SCAN     |t1        |8       |3           |
|3 |  └─TABLE RANGE SCAN    |t2(idx_c2)|1       |18          |
==============================================================
Outputs & filters:
-------------------------------------
  0 - output(nil), filter(nil)
      table_columns([{t1: ({t1: (t1.__pk_increment, t1.c1, t1.c2)})}]),
      update([t1.c1=column_conv(INT,PS:(11,0),NOT NULL,cast(t1.c2 + 1, INT(-1, 0)))])
  1 - output([t1.__pk_increment], [t1.c1], [t1.c2]), filter(nil), rowset=16
      conds(nil), nl_params_([t1.c1(:0)]), use_batch=false
  2 - output([t1.__pk_increment], [t1.c1], [t1.c2]), filter(nil), rowset=16
      access([t1.__pk_increment], [t1.c1], [t1.c2]), partitions(p0)
      is_index_back=false, is_global_index=false, 
      range_key([t1.__pk_increment]), range(MIN ; MAX)always true
  3 - output(nil), filter(nil), rowset=16
      access(nil), partitions(p0)
      is_index_back=false, is_global_index=false, 
      range_key([t2.c1], [t2.__pk_increment]), range(MIN ; MAX), 
      range_cond([:0 <= t2.c1])
update t1 set c1 = c2 + 1 where c1 > ALL(select c1 from t2);
select/**/ * from t1;
+----+------+
| c1 | c2   |
+----+------+
|  1 |    2 |
|  2 |    3 |
|  3 |    3 |
|  4 |    3 |
|  4 |    4 |
|  6 |    5 |
|  6 |    5 |
| 10 |   20 |
+----+------+
rollback;
EXPLAIN update /*+no_rewrite*/t1 set c1 = c2 + 1 where c1 > ALL(select c1 from t2);
Query Plan
=========================================================
|ID|OPERATOR           |NAME      |EST.ROWS|EST.TIME(us)|
---------------------------------------------------------
|0 |UPDATE             |          |4       |60          |
|1 |└─SUBPLAN FILTER   |          |4       |6           |
|2 |  ├─TABLE FULL SCAN|t1        |8       |3           |
|3 |  └─TABLE FULL SCAN|t2(idx_c2)|8       |3           |
=========================================================
Outputs & filters:
-------------------------------------
  0 - output(nil), filter(nil)
      table_columns([{t1: ({t1: (t1.__pk_increment, t1.c1, t1.c2)})}]),
      update([t1.c1=column_conv(INT,PS:(11,0),NOT NULL,cast(t1.c2 + 1, INT(-1, 0)))])
  1 - output([t1.__pk_increment], [t1.c1], [t1.c2]), filter([t1.c1 > ALL(subquery(1))]), rowset=16
      exec_params_(nil), onetime_exprs_(nil), init_plan_idxs_([1]), use_batch=false
  2 - output([t1.__pk_increment], [t1.c1], [t1.c2]), filter(nil), rowset=16
      access([t1.__pk_increment], [t1.c1], [t1.c2]), partitions(p0)
      is_index_back=false, is_global_index=false, 
      range_key([t1.__pk_increment]), range(MIN ; MAX)always true
  3 - output([t2.c1]), filter(nil), rowset=16
      access([t2.c1]), partitions(p0)
      is_index_back=false, is_global_index=false, 
      range_key([t2.c1], [t2.__pk_increment]), range(MIN,MIN ; MAX,MAX)always true
update /*+no_rewrite*/t1 set c1 = c2 + 1 where c1 > ALL(select c1 from t2);
select/**/ * from t1;
+----+------+
| c1 | c2   |
+----+------+
|  1 |    2 |
|  2 |    3 |
|  3 |    3 |
|  4 |    3 |
|  4 |    4 |
|  6 |    5 |
|  6 |    5 |
| 10 |   20 |
+----+------+
rollback;
EXPLAIN delete from t1 where c1 > ALL(select c1 from t2);
Query Plan
==============================================================
|ID|OPERATOR                |NAME      |EST.ROWS|EST.TIME(us)|
--------------------------------------------------------------
|0 |DELETE                  |          |8       |198         |
|1 |└─NESTED-LOOP ANTI JOIN |          |8       |153         |
|2 |  ├─TABLE FULL SCAN     |t1        |8       |3           |
|3 |  └─TABLE RANGE SCAN    |t2(idx_c2)|1       |18          |
==============================================================
Outputs & filters:
-------------------------------------
  0 - output(nil), filter(nil)
      table_columns([{t1: ({t1: (t1.__pk_increment, t1.c1, t1.c2)})}])
  1 - output([t1.__pk_increment], [t1.c1], [t1.c2]), filter(nil), rowset=16
      conds(nil), nl_params_([t1.c1(:0)]), use_batch=false
  2 - output([t1.__pk_increment], [t1.c1], [t1.c2]), filter(nil), rowset=16
      access([t1.__pk_increment], [t1.c1], [t1.c2]), partitions(p0)
      is_index_back=false, is_global_index=false, 
      range_key([t1.__pk_increment]), range(MIN ; MAX)always true
  3 - output(nil), filter(nil), rowset=16
      access(nil), partitions(p0)
      is_index_back=false, is_global_index=false, 
      range_key([t2.c1], [t2.__pk_increment]), range(MIN ; MAX), 
      range_cond([:0 <= t2.c1])
delete from t1 where c1 > ALL(select c1 from t2);
select/**/ * from t1;
+----+------+
| c1 | c2   |
+----+------+
|  1 |    2 |
|  2 |    3 |
|  3 |    3 |
|  4 |    3 |
|  4 |    4 |
|  6 |    5 |
|  6 |    5 |
| 10 |   20 |
+----+------+
rollback;
EXPLAIN delete /*+no_rewrite*/from t1 where c1 > ALL(select c1 from t2);
Query Plan
=========================================================
|ID|OPERATOR           |NAME      |EST.ROWS|EST.TIME(us)|
---------------------------------------------------------
|0 |DELETE             |          |4       |33          |
|1 |└─SUBPLAN FILTER   |          |4       |6           |
|2 |  ├─TABLE FULL SCAN|t1        |8       |3           |
|3 |  └─TABLE FULL SCAN|t2(idx_c2)|8       |3           |
=========================================================
Outputs & filters:
-------------------------------------
  0 - output(nil), filter(nil)
      table_columns([{t1: ({t1: (t1.__pk_increment, t1.c1, t1.c2)})}])
  1 - output([t1.__pk_increment], [t1.c1], [t1.c2]), filter([t1.c1 > ALL(subquery(1))]), rowset=16
      exec_params_(nil), onetime_exprs_(nil), init_plan_idxs_([1]), use_batch=false
  2 - output([t1.__pk_increment], [t1.c1], [t1.c2]), filter(nil), rowset=16
      access([t1.__pk_increment], [t1.c1], [t1.c2]), partitions(p0)
      is_index_back=false, is_global_index=false, 
      range_key([t1.__pk_increment]), range(MIN ; MAX)always true
  3 - output([t2.c1]), filter(nil), rowset=16
      access([t2.c1]), partitions(p0)
      is_index_back=false, is_global_index=false, 
      range_key([t2.c1], [t2.__pk_increment]), range(MIN,MIN ; MAX,MAX)always true
delete /*+no_rewrite*/from t1 where c1 > ALL(select c1 from t2);
select/**/ * from t1;
+----+------+
| c1 | c2   |
+----+------+
|  1 |    2 |
|  2 |    3 |
|  3 |    3 |
|  4 |    3 |
|  4 |    4 |
|  6 |    5 |
|  6 |    5 |
| 10 |   20 |
+----+------+
rollback;
EXPLAIN insert into is_t1  select c1 from t1 where c1 > ALL(select c1 from t2);
Query Plan
=====================================================================
|ID|OPERATOR                  |NAME           |EST.ROWS|EST.TIME(us)|
---------------------------------------------------------------------
|0 |INSERT                    |               |8       |207         |
|1 |└─SUBPLAN SCAN            |ANONYMOUS_VIEW1|8       |153         |
|2 |  └─NESTED-LOOP ANTI JOIN |               |8       |152         |
|3 |    ├─TABLE FULL SCAN     |t1             |8       |3           |
|4 |    └─TABLE RANGE SCAN    |t2(idx_c2)     |1       |18          |
=====================================================================
Outputs & filters:
-------------------------------------
  0 - output(nil), filter(nil)
      columns([{is_t1: ({is_t1: (is_t1.__pk_increment, is_t1.c1)})}]), partitions(p0), 
      column_values([T_HIDDEN_PK], [column_conv(INT,PS:(11,0),NULL,ANONYMOUS_VIEW1.c1)])
  1 - output([ANONYMOUS_VIEW1.c1]), filter(nil), rowset=16
      access([ANONYMOUS_VIEW1.c1])
  2 - output([t1.c1]), filter(nil), rowset=16
      conds(nil), nl_params_([t1.c1(:0)]), use_batch=false
  3 - output([t1.c1]), filter(nil), rowset=16
      access([t1.c1]), partitions(p0)
      is_index_back=false, is_global_index=false, 
      range_key([t1.__pk_increment]), range(MIN ; MAX)always true
  4 - output(nil), filter(nil), rowset=16
      access(nil), partitions(p0)
      is_index_back=false, is_global_index=false, 
      range_key([t2.c1], [t2.__pk_increment]), range(MIN ; MAX), 
      range_cond([:0 <= t2.c1])
insert into is_t1  select c1 from t1 where c1 > ALL(select c1 from t2);
select/**/ * from is_t1;
+------+
| c1   |
+------+
+------+
rollback;
EXPLAIN insert into is_t1  select /*+NO_REWRITE*/c1 from t1 where c1 > ALL(select c1 from t2);
Query Plan
================================================================
|ID|OPERATOR             |NAME           |EST.ROWS|EST.TIME(us)|
----------------------------------------------------------------
|0 |INSERT               |               |4       |38          |
|1 |└─SUBPLAN SCAN       |ANONYMOUS_VIEW1|4       |6           |
|2 |  └─SUBPLAN FILTER   |               |4       |6           |
|3 |    ├─TABLE FULL SCAN|t1             |8       |3           |
|4 |    └─TABLE FULL SCAN|t2(idx_c2)     |8       |3           |
================================================================
Outputs & filters:
-------------------------------------
  0 - output(nil), filter(nil)
      columns([{is_t1: ({is_t1: (is_t1.__pk_increment, is_t1.c1)})}]), partitions(p0), 
      column_values([T_HIDDEN_PK], [column_conv(INT,PS:(11,0),NULL,ANONYMOUS_VIEW1.c1)])
  1 - output([ANONYMOUS_VIEW1.c1]), filter(nil), rowset=16
      access([ANONYMOUS_VIEW1.c1])
  2 - output([t1.c1]), filter([t1.c1 > ALL(subquery(1))]), rowset=16
      exec_params_(nil), onetime_exprs_(nil), init_plan_idxs_([1]), use_batch=false
  3 - output([t1.c1]), filter(nil), rowset=16
      access([t1.c1]), partitions(p0)
      is_index_back=false, is_global_index=false, 
      range_key([t1.__pk_increment]), range(MIN ; MAX)always true
  4 - output([t2.c1]), filter(nil), rowset=16
      access([t2.c1]), partitions(p0)
      is_index_back=false, is_global_index=false, 
      range_key([t2.c1], [t2.__pk_increment]), range(MIN,MIN ; MAX,MAX)always true
insert into is_t1  select /*+NO_REWRITE*/c1 from t1 where c1 > ALL(select c1 from t2);
select/**/ * from is_t1;
+------+
| c1   |
+------+
+------+
rollback;



# case 4

****** val < ALL(SELECT col_item ...)  <==> val < ALL(SELECT MIN(col_item) ...);
EXPLAIN select c1 from t1 where c1 < ALL(select c1 from t2);
Query Plan
============================================================
|ID|OPERATOR              |NAME      |EST.ROWS|EST.TIME(us)|
------------------------------------------------------------
|0 |NESTED-LOOP ANTI JOIN |          |8       |152         |
|1 |├─TABLE FULL SCAN     |t1        |8       |3           |
|2 |└─TABLE RANGE SCAN    |t2(idx_c2)|1       |18          |
============================================================
Outputs & filters:
-------------------------------------
  0 - output([t1.c1]), filter(nil), rowset=16
      conds(nil), nl_params_([t1.c1(:0)]), use_batch=false
  1 - output([t1.c1]), filter(nil), rowset=16
      access([t1.c1]), partitions(p0)
      is_index_back=false, is_global_index=false, 
      range_key([t1.__pk_increment]), range(MIN ; MAX)always true
  2 - output(nil), filter(nil), rowset=16
      access(nil), partitions(p0)
      is_index_back=false, is_global_index=false, 
      range_key([t2.c1], [t2.__pk_increment]), range(MIN ; MAX), 
      range_cond([:0 >= t2.c1])
select c1 from t1 where c1 < ALL(select c1 from t2);
+----+
| c1 |
+----+
+----+
EXPLAIN select /*+no_rewrite*/c1 from t1 where c1 < ALL(select c1 from t2);
Query Plan
=======================================================
|ID|OPERATOR         |NAME      |EST.ROWS|EST.TIME(us)|
-------------------------------------------------------
|0 |SUBPLAN FILTER   |          |4       |6           |
|1 |├─TABLE FULL SCAN|t1        |8       |3           |
|2 |└─TABLE FULL SCAN|t2(idx_c2)|8       |3           |
=======================================================
Outputs & filters:
-------------------------------------
  0 - output([t1.c1]), filter([t1.c1 < ALL(subquery(1))]), rowset=16
      exec_params_(nil), onetime_exprs_(nil), init_plan_idxs_([1]), use_batch=false
  1 - output([t1.c1]), filter(nil), rowset=16
      access([t1.c1]), partitions(p0)
      is_index_back=false, is_global_index=false, 
      range_key([t1.__pk_increment]), range(MIN ; MAX)always true
  2 - output([t2.c1]), filter(nil), rowset=16
      access([t2.c1]), partitions(p0)
      is_index_back=false, is_global_index=false, 
      range_key([t2.c1], [t2.__pk_increment]), range(MIN,MIN ; MAX,MAX)always true
select /*+no_rewrite*/c1 from t1 where c1 < ALL(select c1 from t2);
+----+
| c1 |
+----+
+----+
EXPLAIN update t1 set c1 = c2 + 1 where c1 < ALL(select c1 from t2);
Query Plan
==============================================================
|ID|OPERATOR                |NAME      |EST.ROWS|EST.TIME(us)|
--------------------------------------------------------------
|0 |UPDATE                  |          |8       |234         |
|1 |└─NESTED-LOOP ANTI JOIN |          |8       |153         |
|2 |  ├─TABLE FULL SCAN     |t1        |8       |3           |
|3 |  └─TABLE RANGE SCAN    |t2(idx_c2)|1       |18          |
==============================================================
Outputs & filters:
-------------------------------------
  0 - output(nil), filter(nil)
      table_columns([{t1: ({t1: (t1.__pk_increment, t1.c1, t1.c2)})}]),
      update([t1.c1=column_conv(INT,PS:(11,0),NOT NULL,cast(t1.c2 + 1, INT(-1, 0)))])
  1 - output([t1.__pk_increment], [t1.c1], [t1.c2]), filter(nil), rowset=16
      conds(nil), nl_params_([t1.c1(:0)]), use_batch=false
  2 - output([t1.__pk_increment], [t1.c1], [t1.c2]), filter(nil), rowset=16
      access([t1.__pk_increment], [t1.c1], [t1.c2]), partitions(p0)
      is_index_back=false, is_global_index=false, 
      range_key([t1.__pk_increment]), range(MIN ; MAX)always true
  3 - output(nil), filter(nil), rowset=16
      access(nil), partitions(p0)
      is_index_back=false, is_global_index=false, 
      range_key([t2.c1], [t2.__pk_increment]), range(MIN ; MAX), 
      range_cond([:0 >= t2.c1])
update t1 set c1 = c2 + 1 where c1 < ALL(select c1 from t2);
select/**/ * from t1;
+----+------+
| c1 | c2   |
+----+------+
|  1 |    2 |
|  2 |    3 |
|  3 |    3 |
|  4 |    3 |
|  4 |    4 |
|  6 |    5 |
|  6 |    5 |
| 10 |   20 |
+----+------+
rollback;
EXPLAIN update /*+no_rewrite*/t1 set c1 = c2 + 1 where c1 < ALL(select c1 from t2);
Query Plan
=========================================================
|ID|OPERATOR           |NAME      |EST.ROWS|EST.TIME(us)|
---------------------------------------------------------
|0 |UPDATE             |          |4       |60          |
|1 |└─SUBPLAN FILTER   |          |4       |6           |
|2 |  ├─TABLE FULL SCAN|t1        |8       |3           |
|3 |  └─TABLE FULL SCAN|t2(idx_c2)|8       |3           |
=========================================================
Outputs & filters:
-------------------------------------
  0 - output(nil), filter(nil)
      table_columns([{t1: ({t1: (t1.__pk_increment, t1.c1, t1.c2)})}]),
      update([t1.c1=column_conv(INT,PS:(11,0),NOT NULL,cast(t1.c2 + 1, INT(-1, 0)))])
  1 - output([t1.__pk_increment], [t1.c1], [t1.c2]), filter([t1.c1 < ALL(subquery(1))]), rowset=16
      exec_params_(nil), onetime_exprs_(nil), init_plan_idxs_([1]), use_batch=false
  2 - output([t1.__pk_increment], [t1.c1], [t1.c2]), filter(nil), rowset=16
      access([t1.__pk_increment], [t1.c1], [t1.c2]), partitions(p0)
      is_index_back=false, is_global_index=false, 
      range_key([t1.__pk_increment]), range(MIN ; MAX)always true
  3 - output([t2.c1]), filter(nil), rowset=16
      access([t2.c1]), partitions(p0)
      is_index_back=false, is_global_index=false, 
      range_key([t2.c1], [t2.__pk_increment]), range(MIN,MIN ; MAX,MAX)always true
update /*+no_rewrite*/t1 set c1 = c2 + 1 where c1 < ALL(select c1 from t2);
select/**/ * from t1;
+----+------+
| c1 | c2   |
+----+------+
|  1 |    2 |
|  2 |    3 |
|  3 |    3 |
|  4 |    3 |
|  4 |    4 |
|  6 |    5 |
|  6 |    5 |
| 10 |   20 |
+----+------+
rollback;
EXPLAIN delete from t1 where c1 < ALL(select c1 from t2);
Query Plan
==============================================================
|ID|OPERATOR                |NAME      |EST.ROWS|EST.TIME(us)|
--------------------------------------------------------------
|0 |DELETE                  |          |8       |198         |
|1 |└─NESTED-LOOP ANTI JOIN |          |8       |153         |
|2 |  ├─TABLE FULL SCAN     |t1        |8       |3           |
|3 |  └─TABLE RANGE SCAN    |t2(idx_c2)|1       |18          |
==============================================================
Outputs & filters:
-------------------------------------
  0 - output(nil), filter(nil)
      table_columns([{t1: ({t1: (t1.__pk_increment, t1.c1, t1.c2)})}])
  1 - output([t1.__pk_increment], [t1.c1], [t1.c2]), filter(nil), rowset=16
      conds(nil), nl_params_([t1.c1(:0)]), use_batch=false
  2 - output([t1.__pk_increment], [t1.c1], [t1.c2]), filter(nil), rowset=16
      access([t1.__pk_increment], [t1.c1], [t1.c2]), partitions(p0)
      is_index_back=false, is_global_index=false, 
      range_key([t1.__pk_increment]), range(MIN ; MAX)always true
  3 - output(nil), filter(nil), rowset=16
      access(nil), partitions(p0)
      is_index_back=false, is_global_index=false, 
      range_key([t2.c1], [t2.__pk_increment]), range(MIN ; MAX), 
      range_cond([:0 >= t2.c1])
delete from t1 where c1 < ALL(select c1 from t2);
select/**/ * from t1;
+----+------+
| c1 | c2   |
+----+------+
|  1 |    2 |
|  2 |    3 |
|  3 |    3 |
|  4 |    3 |
|  4 |    4 |
|  6 |    5 |
|  6 |    5 |
| 10 |   20 |
+----+------+
rollback;
EXPLAIN delete /*+no_rewrite*/from t1 where c1 < ALL(select c1 from t2);
Query Plan
=========================================================
|ID|OPERATOR           |NAME      |EST.ROWS|EST.TIME(us)|
---------------------------------------------------------
|0 |DELETE             |          |4       |33          |
|1 |└─SUBPLAN FILTER   |          |4       |6           |
|2 |  ├─TABLE FULL SCAN|t1        |8       |3           |
|3 |  └─TABLE FULL SCAN|t2(idx_c2)|8       |3           |
=========================================================
Outputs & filters:
-------------------------------------
  0 - output(nil), filter(nil)
      table_columns([{t1: ({t1: (t1.__pk_increment, t1.c1, t1.c2)})}])
  1 - output([t1.__pk_increment], [t1.c1], [t1.c2]), filter([t1.c1 < ALL(subquery(1))]), rowset=16
      exec_params_(nil), onetime_exprs_(nil), init_plan_idxs_([1]), use_batch=false
  2 - output([t1.__pk_increment], [t1.c1], [t1.c2]), filter(nil), rowset=16
      access([t1.__pk_increment], [t1.c1], [t1.c2]), partitions(p0)
      is_index_back=false, is_global_index=false, 
      range_key([t1.__pk_increment]), range(MIN ; MAX)always true
  3 - output([t2.c1]), filter(nil), rowset=16
      access([t2.c1]), partitions(p0)
      is_index_back=false, is_global_index=false, 
      range_key([t2.c1], [t2.__pk_increment]), range(MIN,MIN ; MAX,MAX)always true
delete /*+no_rewrite*/from t1 where c1 < ALL(select c1 from t2);
select/**/ * from t1;
+----+------+
| c1 | c2   |
+----+------+
|  1 |    2 |
|  2 |    3 |
|  3 |    3 |
|  4 |    3 |
|  4 |    4 |
|  6 |    5 |
|  6 |    5 |
| 10 |   20 |
+----+------+
rollback;
EXPLAIN insert into is_t1 select c1 from t1 where c1 < ALL(select c1 from t2);
Query Plan
=====================================================================
|ID|OPERATOR                  |NAME           |EST.ROWS|EST.TIME(us)|
---------------------------------------------------------------------
|0 |INSERT                    |               |8       |207         |
|1 |└─SUBPLAN SCAN            |ANONYMOUS_VIEW1|8       |153         |
|2 |  └─NESTED-LOOP ANTI JOIN |               |8       |152         |
|3 |    ├─TABLE FULL SCAN     |t1             |8       |3           |
|4 |    └─TABLE RANGE SCAN    |t2(idx_c2)     |1       |18          |
=====================================================================
Outputs & filters:
-------------------------------------
  0 - output(nil), filter(nil)
      columns([{is_t1: ({is_t1: (is_t1.__pk_increment, is_t1.c1)})}]), partitions(p0), 
      column_values([T_HIDDEN_PK], [column_conv(INT,PS:(11,0),NULL,ANONYMOUS_VIEW1.c1)])
  1 - output([ANONYMOUS_VIEW1.c1]), filter(nil), rowset=16
      access([ANONYMOUS_VIEW1.c1])
  2 - output([t1.c1]), filter(nil), rowset=16
      conds(nil), nl_params_([t1.c1(:0)]), use_batch=false
  3 - output([t1.c1]), filter(nil), rowset=16
      access([t1.c1]), partitions(p0)
      is_index_back=false, is_global_index=false, 
      range_key([t1.__pk_increment]), range(MIN ; MAX)always true
  4 - output(nil), filter(nil), rowset=16
      access(nil), partitions(p0)
      is_index_back=false, is_global_index=false, 
      range_key([t2.c1], [t2.__pk_increment]), range(MIN ; MAX), 
      range_cond([:0 >= t2.c1])
insert into is_t1 select c1 from t1 where c1 < ALL(select c1 from t2);
select/**/ * from is_t1;
+------+
| c1   |
+------+
+------+
rollback;
EXPLAIN insert into is_t1 select /*+NO_REWRITE*/c1 from t1 where c1 < ALL(select c1 from t2);
Query Plan
================================================================
|ID|OPERATOR             |NAME           |EST.ROWS|EST.TIME(us)|
----------------------------------------------------------------
|0 |INSERT               |               |4       |38          |
|1 |└─SUBPLAN SCAN       |ANONYMOUS_VIEW1|4       |6           |
|2 |  └─SUBPLAN FILTER   |               |4       |6           |
|3 |    ├─TABLE FULL SCAN|t1             |8       |3           |
|4 |    └─TABLE FULL SCAN|t2(idx_c2)     |8       |3           |
================================================================
Outputs & filters:
-------------------------------------
  0 - output(nil), filter(nil)
      columns([{is_t1: ({is_t1: (is_t1.__pk_increment, is_t1.c1)})}]), partitions(p0), 
      column_values([T_HIDDEN_PK], [column_conv(INT,PS:(11,0),NULL,ANONYMOUS_VIEW1.c1)])
  1 - output([ANONYMOUS_VIEW1.c1]), filter(nil), rowset=16
      access([ANONYMOUS_VIEW1.c1])
  2 - output([t1.c1]), filter([t1.c1 < ALL(subquery(1))]), rowset=16
      exec_params_(nil), onetime_exprs_(nil), init_plan_idxs_([1]), use_batch=false
  3 - output([t1.c1]), filter(nil), rowset=16
      access([t1.c1]), partitions(p0)
      is_index_back=false, is_global_index=false, 
      range_key([t1.__pk_increment]), range(MIN ; MAX)always true
  4 - output([t2.c1]), filter(nil), rowset=16
      access([t2.c1]), partitions(p0)
      is_index_back=false, is_global_index=false, 
      range_key([t2.c1], [t2.__pk_increment]), range(MIN,MIN ; MAX,MAX)always true
insert into is_t1 select /*+NO_REWRITE*/c1 from t1 where c1 < ALL(select c1 from t2);
select/**/ * from is_t1;
+------+
| c1   |
+------+
+------+
rollback;

set autocommit = 1;

drop table if exists t1, t2, t3, t4, t5, t6, t7;
drop table if exists is_c1, is_c3;
create table t1(a int primary key, b int, c int);
create table is_c3(a int , b int, c int);
create table is_c1(a int);
create table t2(a int primary key, b int, c int);
create table t3(c1 int primary key, c2 int);
create table t4(c1 int primary key, c2 int, c3 varchar(32));
create table t5(c1 int primary key, c2 int, c3 varchar(32));
create table t6(c1 int , c2 int , c3 int, c4 int,
 index idx_t6 (c2, c3) local
);
create table t7(c1 int, c2 int, c3 int, c4 int,
 primary key (c1, c2, c3)
);

Query Plan
==================================================
|ID|OPERATOR          |NAME|EST.ROWS|EST.TIME(us)|
--------------------------------------------------
|0 |DISTRIBUTED INSERT|    |8       |58          |
|1 |└─EXPRESSION      |    |8       |1           |
==================================================
Outputs & filters:
-------------------------------------
  0 - output(nil), filter(nil)
      columns([{t1: ({t1: (t1.a, t1.b, t1.c)})}]), 
      column_values([column_conv(INT,PS:(11,0),NOT NULL,__values.a)], [column_conv(INT,PS:(11,0),NULL,__values.b)], [column_conv(INT,PS:(11,0),NULL,__values.c)])
  1 - output([__values.a], [__values.b], [__values.c]), filter(nil)
      values({1, 1, 0}, {2, 2, 1}, {3, 3, 0}, {4, 4, 1}, {5, 5, 0}, {6, 6, 1}, {7, 7, 0}, {8, 8, 1})
Query Plan
==================================================
|ID|OPERATOR          |NAME|EST.ROWS|EST.TIME(us)|
--------------------------------------------------
|0 |DISTRIBUTED INSERT|    |8       |58          |
|1 |└─EXPRESSION      |    |8       |1           |
==================================================
Outputs & filters:
-------------------------------------
  0 - output(nil), filter(nil)
      columns([{t2: ({t2: (t2.a, t2.b, t2.c)})}]), 
      column_values([column_conv(INT,PS:(11,0),NOT NULL,__values.a)], [column_conv(INT,PS:(11,0),NULL,__values.b)], [column_conv(INT,PS:(11,0),NULL,__values.c)])
  1 - output([__values.a], [__values.b], [__values.c]), filter(nil)
      values({1, 1, 0}, {2, 2, 1}, {3, 3, 0}, {4, 4, 1}, {5, 5, 0}, {6, 6, 1}, {7, 7, 0}, {8, 8, 1})
Query Plan
==================================================
|ID|OPERATOR          |NAME|EST.ROWS|EST.TIME(us)|
--------------------------------------------------
|0 |DISTRIBUTED INSERT|    |1       |13          |
|1 |└─EXPRESSION      |    |1       |1           |
==================================================
Outputs & filters:
-------------------------------------
  0 - output(nil), filter(nil)
      columns([{t3: ({t3: (t3.c1, t3.c2)})}]), 
      column_values([column_conv(INT,PS:(11,0),NOT NULL,__values.c1)], [column_conv(INT,PS:(11,0),NULL,__values.c2)])
  1 - output([__values.c1], [__values.c2]), filter(nil)
      values({1, 1})
Query Plan
==================================================
|ID|OPERATOR          |NAME|EST.ROWS|EST.TIME(us)|
--------------------------------------------------
|0 |DISTRIBUTED INSERT|    |1       |13          |
|1 |└─EXPRESSION      |    |1       |1           |
==================================================
Outputs & filters:
-------------------------------------
  0 - output(nil), filter(nil)
      columns([{t3: ({t3: (t3.c1, t3.c2)})}]), 
      column_values([column_conv(INT,PS:(11,0),NOT NULL,__values.c1)], [column_conv(INT,PS:(11,0),NULL,__values.c2)])
  1 - output([__values.c1], [__values.c2]), filter(nil)
      values({2, 5})
Query Plan
==================================================
|ID|OPERATOR          |NAME|EST.ROWS|EST.TIME(us)|
--------------------------------------------------
|0 |DISTRIBUTED INSERT|    |1       |13          |
|1 |└─EXPRESSION      |    |1       |1           |
==================================================
Outputs & filters:
-------------------------------------
  0 - output(nil), filter(nil)
      columns([{t3: ({t3: (t3.c1, t3.c2)})}]), 
      column_values([column_conv(INT,PS:(11,0),NOT NULL,__values.c1)], [column_conv(INT,PS:(11,0),NULL,__values.c2)])
  1 - output([__values.c1], [__values.c2]), filter(nil)
      values({3, 2})
Query Plan
==================================================
|ID|OPERATOR          |NAME|EST.ROWS|EST.TIME(us)|
--------------------------------------------------
|0 |DISTRIBUTED INSERT|    |1       |13          |
|1 |└─EXPRESSION      |    |1       |1           |
==================================================
Outputs & filters:
-------------------------------------
  0 - output(nil), filter(nil)
      columns([{t3: ({t3: (t3.c1, t3.c2)})}]), 
      column_values([column_conv(INT,PS:(11,0),NOT NULL,__values.c1)], [column_conv(INT,PS:(11,0),NULL,__values.c2)])
  1 - output([__values.c1], [__values.c2]), filter(nil)
      values({4, 6})
Query Plan
==================================================
|ID|OPERATOR          |NAME|EST.ROWS|EST.TIME(us)|
--------------------------------------------------
|0 |DISTRIBUTED INSERT|    |1       |13          |
|1 |└─EXPRESSION      |    |1       |1           |
==================================================
Outputs & filters:
-------------------------------------
  0 - output(nil), filter(nil)
      columns([{t3: ({t3: (t3.c1, t3.c2)})}]), 
      column_values([column_conv(INT,PS:(11,0),NOT NULL,__values.c1)], [column_conv(INT,PS:(11,0),NULL,__values.c2)])
  1 - output([__values.c1], [__values.c2]), filter(nil)
      values({5, 4})
Query Plan
==================================================
|ID|OPERATOR          |NAME|EST.ROWS|EST.TIME(us)|
--------------------------------------------------
|0 |DISTRIBUTED INSERT|    |1       |13          |
|1 |└─EXPRESSION      |    |1       |1           |
==================================================
Outputs & filters:
-------------------------------------
  0 - output(nil), filter(nil)
      columns([{t3: ({t3: (t3.c1, t3.c2)})}]), 
      column_values([column_conv(INT,PS:(11,0),NOT NULL,__values.c1)], [column_conv(INT,PS:(11,0),NULL,__values.c2)])
  1 - output([__values.c1], [__values.c2]), filter(nil)
      values({6, 7})
Query Plan
==================================================
|ID|OPERATOR          |NAME|EST.ROWS|EST.TIME(us)|
--------------------------------------------------
|0 |DISTRIBUTED INSERT|    |1       |13          |
|1 |└─EXPRESSION      |    |1       |1           |
==================================================
Outputs & filters:
-------------------------------------
  0 - output(nil), filter(nil)
      columns([{t4: ({t4: (t4.c1, t4.c2, t4.c3)})}]), 
      column_values([column_conv(INT,PS:(11,0),NOT NULL,__values.c1)], [column_conv(INT,PS:(11,0),NULL,__values.c2)], [column_conv(VARCHAR,utf8mb4_general_ci,
      length:32,NULL,__values.c3)])
  1 - output([__values.c1], [__values.c2], [__values.c3]), filter(nil)
      values({1, 1, 'o'})
Query Plan
==================================================
|ID|OPERATOR          |NAME|EST.ROWS|EST.TIME(us)|
--------------------------------------------------
|0 |DISTRIBUTED INSERT|    |1       |13          |
|1 |└─EXPRESSION      |    |1       |1           |
==================================================
Outputs & filters:
-------------------------------------
  0 - output(nil), filter(nil)
      columns([{t4: ({t4: (t4.c1, t4.c2, t4.c3)})}]), 
      column_values([column_conv(INT,PS:(11,0),NOT NULL,__values.c1)], [column_conv(INT,PS:(11,0),NULL,__values.c2)], [column_conv(VARCHAR,utf8mb4_general_ci,
      length:32,NULL,__values.c3)])
  1 - output([__values.c1], [__values.c2], [__values.c3]), filter(nil)
      values({2, 5, 'c'})
Query Plan
==================================================
|ID|OPERATOR          |NAME|EST.ROWS|EST.TIME(us)|
--------------------------------------------------
|0 |DISTRIBUTED INSERT|    |1       |13          |
|1 |└─EXPRESSION      |    |1       |1           |
==================================================
Outputs & filters:
-------------------------------------
  0 - output(nil), filter(nil)
      columns([{t4: ({t4: (t4.c1, t4.c2, t4.c3)})}]), 
      column_values([column_conv(INT,PS:(11,0),NOT NULL,__values.c1)], [column_conv(INT,PS:(11,0),NULL,__values.c2)], [column_conv(VARCHAR,utf8mb4_general_ci,
      length:32,NULL,__values.c3)])
  1 - output([__values.c1], [__values.c2], [__values.c3]), filter(nil)
      values({3, 5, 'b'})
Query Plan
==================================================
|ID|OPERATOR          |NAME|EST.ROWS|EST.TIME(us)|
--------------------------------------------------
|0 |DISTRIBUTED INSERT|    |1       |13          |
|1 |└─EXPRESSION      |    |1       |1           |
==================================================
Outputs & filters:
-------------------------------------
  0 - output(nil), filter(nil)
      columns([{t4: ({t4: (t4.c1, t4.c2, t4.c3)})}]), 
      column_values([column_conv(INT,PS:(11,0),NOT NULL,__values.c1)], [column_conv(INT,PS:(11,0),NULL,__values.c2)], [column_conv(VARCHAR,utf8mb4_general_ci,
      length:32,NULL,__values.c3)])
  1 - output([__values.c1], [__values.c2], [__values.c3]), filter(nil)
      values({4, 6, 'o'})
Query Plan
==================================================
|ID|OPERATOR          |NAME|EST.ROWS|EST.TIME(us)|
--------------------------------------------------
|0 |DISTRIBUTED INSERT|    |1       |13          |
|1 |└─EXPRESSION      |    |1       |1           |
==================================================
Outputs & filters:
-------------------------------------
  0 - output(nil), filter(nil)
      columns([{t4: ({t4: (t4.c1, t4.c2, t4.c3)})}]), 
      column_values([column_conv(INT,PS:(11,0),NOT NULL,__values.c1)], [column_conv(INT,PS:(11,0),NULL,__values.c2)], [column_conv(VARCHAR,utf8mb4_general_ci,
      length:32,NULL,__values.c3)])
  1 - output([__values.c1], [__values.c2], [__values.c3]), filter(nil)
      values({5, 7, 'd'})
Query Plan
==================================================
|ID|OPERATOR          |NAME|EST.ROWS|EST.TIME(us)|
--------------------------------------------------
|0 |DISTRIBUTED INSERT|    |1       |13          |
|1 |└─EXPRESSION      |    |1       |1           |
==================================================
Outputs & filters:
-------------------------------------
  0 - output(nil), filter(nil)
      columns([{t4: ({t4: (t4.c1, t4.c2, t4.c3)})}]), 
      column_values([column_conv(INT,PS:(11,0),NOT NULL,__values.c1)], [column_conv(INT,PS:(11,0),NULL,__values.c2)], [column_conv(VARCHAR,utf8mb4_general_ci,
      length:32,NULL,__values.c3)])
  1 - output([__values.c1], [__values.c2], [__values.c3]), filter(nil)
      values({6, 8, 'c'})
Query Plan
==================================================
|ID|OPERATOR          |NAME|EST.ROWS|EST.TIME(us)|
--------------------------------------------------
|0 |DISTRIBUTED INSERT|    |1       |13          |
|1 |└─EXPRESSION      |    |1       |1           |
==================================================
Outputs & filters:
-------------------------------------
  0 - output(nil), filter(nil)
      columns([{t5: ({t5: (t5.c1, t5.c2, t5.c3)})}]), 
      column_values([column_conv(INT,PS:(11,0),NOT NULL,__values.c1)], [column_conv(INT,PS:(11,0),NULL,__values.c2)], [column_conv(VARCHAR,utf8mb4_general_ci,
      length:32,NULL,__values.c3)])
  1 - output([__values.c1], [__values.c2], [__values.c3]), filter(nil)
      values({1, 2, '3'})
Query Plan
==================================================
|ID|OPERATOR          |NAME|EST.ROWS|EST.TIME(us)|
--------------------------------------------------
|0 |DISTRIBUTED INSERT|    |1       |13          |
|1 |└─EXPRESSION      |    |1       |1           |
==================================================
Outputs & filters:
-------------------------------------
  0 - output(nil), filter(nil)
      columns([{t5: ({t5: (t5.c1, t5.c2, t5.c3)})}]), 
      column_values([column_conv(INT,PS:(11,0),NOT NULL,__values.c1)], [column_conv(INT,PS:(11,0),NULL,__values.c2)], [column_conv(VARCHAR,utf8mb4_general_ci,
      length:32,NULL,__values.c3)])
  1 - output([__values.c1], [__values.c2], [__values.c3]), filter(nil)
      values({2, 5, '4'})
Query Plan
==================================================
|ID|OPERATOR          |NAME|EST.ROWS|EST.TIME(us)|
--------------------------------------------------
|0 |DISTRIBUTED INSERT|    |1       |13          |
|1 |└─EXPRESSION      |    |1       |1           |
==================================================
Outputs & filters:
-------------------------------------
  0 - output(nil), filter(nil)
      columns([{t5: ({t5: (t5.c1, t5.c2, t5.c3)})}]), 
      column_values([column_conv(INT,PS:(11,0),NOT NULL,__values.c1)], [column_conv(INT,PS:(11,0),NULL,__values.c2)], [column_conv(VARCHAR,utf8mb4_general_ci,
      length:32,NULL,__values.c3)])
  1 - output([__values.c1], [__values.c2], [__values.c3]), filter(nil)
      values({3, 6, '1'})
Query Plan
==================================================
|ID|OPERATOR          |NAME|EST.ROWS|EST.TIME(us)|
--------------------------------------------------
|0 |DISTRIBUTED INSERT|    |1       |13          |
|1 |└─EXPRESSION      |    |1       |1           |
==================================================
Outputs & filters:
-------------------------------------
  0 - output(nil), filter(nil)
      columns([{t5: ({t5: (t5.c1, t5.c2, t5.c3)})}]), 
      column_values([column_conv(INT,PS:(11,0),NOT NULL,__values.c1)], [column_conv(INT,PS:(11,0),NULL,__values.c2)], [column_conv(VARCHAR,utf8mb4_general_ci,
      length:32,NULL,__values.c3)])
  1 - output([__values.c1], [__values.c2], [__values.c3]), filter(nil)
      values({4, 5, '1'})
Query Plan
==================================================
|ID|OPERATOR          |NAME|EST.ROWS|EST.TIME(us)|
--------------------------------------------------
|0 |DISTRIBUTED INSERT|    |1       |13          |
|1 |└─EXPRESSION      |    |1       |1           |
==================================================
Outputs & filters:
-------------------------------------
  0 - output(nil), filter(nil)
      columns([{t5: ({t5: (t5.c1, t5.c2, t5.c3)})}]), 
      column_values([column_conv(INT,PS:(11,0),NOT NULL,__values.c1)], [column_conv(INT,PS:(11,0),NULL,__values.c2)], [column_conv(VARCHAR,utf8mb4_general_ci,
      length:32,NULL,__values.c3)])
  1 - output([__values.c1], [__values.c2], [__values.c3]), filter(nil)
      values({5, 5, '5'})
Query Plan
==================================================
|ID|OPERATOR          |NAME|EST.ROWS|EST.TIME(us)|
--------------------------------------------------
|0 |DISTRIBUTED INSERT|    |1       |13          |
|1 |└─EXPRESSION      |    |1       |1           |
==================================================
Outputs & filters:
-------------------------------------
  0 - output(nil), filter(nil)
      columns([{t5: ({t5: (t5.c1, t5.c2, t5.c3)})}]), 
      column_values([column_conv(INT,PS:(11,0),NOT NULL,__values.c1)], [column_conv(INT,PS:(11,0),NULL,__values.c2)], [column_conv(VARCHAR,utf8mb4_general_ci,
      length:32,NULL,__values.c3)])
  1 - output([__values.c1], [__values.c2], [__values.c3]), filter(nil)
      values({6, 5, 'c'})
Query Plan
==================================================
|ID|OPERATOR          |NAME|EST.ROWS|EST.TIME(us)|
--------------------------------------------------
|0 |DISTRIBUTED INSERT|    |1       |13          |
|1 |└─EXPRESSION      |    |1       |1           |
==================================================
Outputs & filters:
-------------------------------------
  0 - output(nil), filter(nil)
      columns([{t6: ({t6: (t6.__pk_increment, t6.c1, t6.c2, t6.c3, t6.c4)})}]), 
      column_values([T_HIDDEN_PK], [column_conv(INT,PS:(11,0),NULL,__values.c1)], [column_conv(INT,PS:(11,0),NULL,__values.c2)], [column_conv(INT,PS:(11,
      0),NULL,__values.c3)], [column_conv(INT,PS:(11,0),NULL,__values.c4)])
  1 - output([__values.c1], [__values.c2], [__values.c3], [__values.c4]), filter(nil)
      values({3, 2, 1, 1})
Query Plan
==================================================
|ID|OPERATOR          |NAME|EST.ROWS|EST.TIME(us)|
--------------------------------------------------
|0 |DISTRIBUTED INSERT|    |1       |13          |
|1 |└─EXPRESSION      |    |1       |1           |
==================================================
Outputs & filters:
-------------------------------------
  0 - output(nil), filter(nil)
      columns([{t6: ({t6: (t6.__pk_increment, t6.c1, t6.c2, t6.c3, t6.c4)})}]), 
      column_values([T_HIDDEN_PK], [column_conv(INT,PS:(11,0),NULL,__values.c1)], [column_conv(INT,PS:(11,0),NULL,__values.c2)], [column_conv(INT,PS:(11,
      0),NULL,__values.c3)], [column_conv(INT,PS:(11,0),NULL,__values.c4)])
  1 - output([__values.c1], [__values.c2], [__values.c3], [__values.c4]), filter(nil)
      values({4, 5, 2, 5})
Query Plan
==================================================
|ID|OPERATOR          |NAME|EST.ROWS|EST.TIME(us)|
--------------------------------------------------
|0 |DISTRIBUTED INSERT|    |1       |13          |
|1 |└─EXPRESSION      |    |1       |1           |
==================================================
Outputs & filters:
-------------------------------------
  0 - output(nil), filter(nil)
      columns([{t6: ({t6: (t6.__pk_increment, t6.c1, t6.c2, t6.c3, t6.c4)})}]), 
      column_values([T_HIDDEN_PK], [column_conv(INT,PS:(11,0),NULL,__values.c1)], [column_conv(INT,PS:(11,0),NULL,__values.c2)], [column_conv(INT,PS:(11,
      0),NULL,__values.c3)], [column_conv(INT,PS:(11,0),NULL,__values.c4)])
  1 - output([__values.c1], [__values.c2], [__values.c3], [__values.c4]), filter(nil)
      values({1, 6, 3, 5})
Query Plan
==================================================
|ID|OPERATOR          |NAME|EST.ROWS|EST.TIME(us)|
--------------------------------------------------
|0 |DISTRIBUTED INSERT|    |1       |13          |
|1 |└─EXPRESSION      |    |1       |1           |
==================================================
Outputs & filters:
-------------------------------------
  0 - output(nil), filter(nil)
      columns([{t6: ({t6: (t6.__pk_increment, t6.c1, t6.c2, t6.c3, t6.c4)})}]), 
      column_values([T_HIDDEN_PK], [column_conv(INT,PS:(11,0),NULL,__values.c1)], [column_conv(INT,PS:(11,0),NULL,__values.c2)], [column_conv(INT,PS:(11,
      0),NULL,__values.c3)], [column_conv(INT,PS:(11,0),NULL,__values.c4)])
  1 - output([__values.c1], [__values.c2], [__values.c3], [__values.c4]), filter(nil)
      values({1, 5, 4, 6})
Query Plan
==================================================
|ID|OPERATOR          |NAME|EST.ROWS|EST.TIME(us)|
--------------------------------------------------
|0 |DISTRIBUTED INSERT|    |1       |13          |
|1 |└─EXPRESSION      |    |1       |1           |
==================================================
Outputs & filters:
-------------------------------------
  0 - output(nil), filter(nil)
      columns([{t6: ({t6: (t6.__pk_increment, t6.c1, t6.c2, t6.c3, t6.c4)})}]), 
      column_values([T_HIDDEN_PK], [column_conv(INT,PS:(11,0),NULL,__values.c1)], [column_conv(INT,PS:(11,0),NULL,__values.c2)], [column_conv(INT,PS:(11,
      0),NULL,__values.c3)], [column_conv(INT,PS:(11,0),NULL,__values.c4)])
  1 - output([__values.c1], [__values.c2], [__values.c3], [__values.c4]), filter(nil)
      values({5, 5, 5, 7})
Query Plan
==================================================
|ID|OPERATOR          |NAME|EST.ROWS|EST.TIME(us)|
--------------------------------------------------
|0 |DISTRIBUTED INSERT|    |1       |13          |
|1 |└─EXPRESSION      |    |1       |1           |
==================================================
Outputs & filters:
-------------------------------------
  0 - output(nil), filter(nil)
      columns([{t6: ({t6: (t6.__pk_increment, t6.c1, t6.c2, t6.c3, t6.c4)})}]), 
      column_values([T_HIDDEN_PK], [column_conv(INT,PS:(11,0),NULL,__values.c1)], [column_conv(INT,PS:(11,0),NULL,__values.c2)], [column_conv(INT,PS:(11,
      0),NULL,__values.c3)], [column_conv(INT,PS:(11,0),NULL,__values.c4)])
  1 - output([__values.c1], [__values.c2], [__values.c3], [__values.c4]), filter(nil)
      values({1, 7, 6, 8})
Query Plan
==================================================
|ID|OPERATOR          |NAME|EST.ROWS|EST.TIME(us)|
--------------------------------------------------
|0 |DISTRIBUTED INSERT|    |1       |13          |
|1 |└─EXPRESSION      |    |1       |1           |
==================================================
Outputs & filters:
-------------------------------------
  0 - output(nil), filter(nil)
      columns([{t7: ({t7: (t7.c1, t7.c2, t7.c3, t7.c4)})}]), 
      column_values([column_conv(INT,PS:(11,0),NOT NULL,__values.c1)], [column_conv(INT,PS:(11,0),NOT NULL,__values.c2)], [column_conv(INT,PS:(11,0),NOT 
      NULL,__values.c3)], [column_conv(INT,PS:(11,0),NULL,__values.c4)])
  1 - output([__values.c1], [__values.c2], [__values.c3], [__values.c4]), filter(nil)
      values({3, 2, 1, 1})
Query Plan
==================================================
|ID|OPERATOR          |NAME|EST.ROWS|EST.TIME(us)|
--------------------------------------------------
|0 |DISTRIBUTED INSERT|    |1       |13          |
|1 |└─EXPRESSION      |    |1       |1           |
==================================================
Outputs & filters:
-------------------------------------
  0 - output(nil), filter(nil)
      columns([{t7: ({t7: (t7.c1, t7.c2, t7.c3, t7.c4)})}]), 
      column_values([column_conv(INT,PS:(11,0),NOT NULL,__values.c1)], [column_conv(INT,PS:(11,0),NOT NULL,__values.c2)], [column_conv(INT,PS:(11,0),NOT 
      NULL,__values.c3)], [column_conv(INT,PS:(11,0),NULL,__values.c4)])
  1 - output([__values.c1], [__values.c2], [__values.c3], [__values.c4]), filter(nil)
      values({4, 5, 2, 5})
Query Plan
==================================================
|ID|OPERATOR          |NAME|EST.ROWS|EST.TIME(us)|
--------------------------------------------------
|0 |DISTRIBUTED INSERT|    |1       |13          |
|1 |└─EXPRESSION      |    |1       |1           |
==================================================
Outputs & filters:
-------------------------------------
  0 - output(nil), filter(nil)
      columns([{t7: ({t7: (t7.c1, t7.c2, t7.c3, t7.c4)})}]), 
      column_values([column_conv(INT,PS:(11,0),NOT NULL,__values.c1)], [column_conv(INT,PS:(11,0),NOT NULL,__values.c2)], [column_conv(INT,PS:(11,0),NOT 
      NULL,__values.c3)], [column_conv(INT,PS:(11,0),NULL,__values.c4)])
  1 - output([__values.c1], [__values.c2], [__values.c3], [__values.c4]), filter(nil)
      values({1, 6, 3, 5})
Query Plan
==================================================
|ID|OPERATOR          |NAME|EST.ROWS|EST.TIME(us)|
--------------------------------------------------
|0 |DISTRIBUTED INSERT|    |1       |13          |
|1 |└─EXPRESSION      |    |1       |1           |
==================================================
Outputs & filters:
-------------------------------------
  0 - output(nil), filter(nil)
      columns([{t7: ({t7: (t7.c1, t7.c2, t7.c3, t7.c4)})}]), 
      column_values([column_conv(INT,PS:(11,0),NOT NULL,__values.c1)], [column_conv(INT,PS:(11,0),NOT NULL,__values.c2)], [column_conv(INT,PS:(11,0),NOT 
      NULL,__values.c3)], [column_conv(INT,PS:(11,0),NULL,__values.c4)])
  1 - output([__values.c1], [__values.c2], [__values.c3], [__values.c4]), filter(nil)
      values({1, 5, 4, 6})
Query Plan
==================================================
|ID|OPERATOR          |NAME|EST.ROWS|EST.TIME(us)|
--------------------------------------------------
|0 |DISTRIBUTED INSERT|    |1       |13          |
|1 |└─EXPRESSION      |    |1       |1           |
==================================================
Outputs & filters:
-------------------------------------
  0 - output(nil), filter(nil)
      columns([{t7: ({t7: (t7.c1, t7.c2, t7.c3, t7.c4)})}]), 
      column_values([column_conv(INT,PS:(11,0),NOT NULL,__values.c1)], [column_conv(INT,PS:(11,0),NOT NULL,__values.c2)], [column_conv(INT,PS:(11,0),NOT 
      NULL,__values.c3)], [column_conv(INT,PS:(11,0),NULL,__values.c4)])
  1 - output([__values.c1], [__values.c2], [__values.c3], [__values.c4]), filter(nil)
      values({5, 5, 5, 7})
Query Plan
==================================================
|ID|OPERATOR          |NAME|EST.ROWS|EST.TIME(us)|
--------------------------------------------------
|0 |DISTRIBUTED INSERT|    |1       |13          |
|1 |└─EXPRESSION      |    |1       |1           |
==================================================
Outputs & filters:
-------------------------------------
  0 - output(nil), filter(nil)
      columns([{t7: ({t7: (t7.c1, t7.c2, t7.c3, t7.c4)})}]), 
      column_values([column_conv(INT,PS:(11,0),NOT NULL,__values.c1)], [column_conv(INT,PS:(11,0),NOT NULL,__values.c2)], [column_conv(INT,PS:(11,0),NOT 
      NULL,__values.c3)], [column_conv(INT,PS:(11,0),NULL,__values.c4)])
  1 - output([__values.c1], [__values.c2], [__values.c3], [__values.c4]), filter(nil)
      values({1, 7, 6, 8})
alter system minor freeze;
analyze table t1 compute statistics for all columns size auto;
analyze table is_c3 compute statistics for all columns size auto;
analyze table is_c1 compute statistics for all columns size auto;
analyze table t2 compute statistics for all columns size auto;
analyze table t3 compute statistics for all columns size auto;
analyze table t4 compute statistics for all columns size auto;
analyze table t5 compute statistics for all columns size auto;
analyze table t6 compute statistics for all columns size auto;
analyze table t7 compute statistics for all columns size auto;

explain_protocol: 2
result_format: 2
## 单表，单列 any/all 子查询添加 min/max 聚合函数
set autocommit = 0;


# case 5
EXPLAIN select c1 from t3 where c1 > any (select c1 from t4);
Query Plan
========================================================
|ID|OPERATOR               |NAME |EST.ROWS|EST.TIME(us)|
--------------------------------------------------------
|0 |NESTED-LOOP JOIN       |     |1       |19          |
|1 |├─SUBPLAN SCAN         |VIEW2|1       |3           |
|2 |│ └─SCALAR GROUP BY    |     |1       |3           |
|3 |│   └─SUBPLAN SCAN     |VIEW3|1       |3           |
|4 |│     └─TABLE FULL SCAN|t4   |1       |3           |
|5 |└─TABLE RANGE SCAN     |t3   |2       |16          |
========================================================
Outputs & filters:
-------------------------------------
  0 - output([t3.c1]), filter(nil), rowset=16
      conds(nil), nl_params_([VIEW2.T_FUN_MIN(VIEW1.c1)(:0)]), use_batch=true
  1 - output([VIEW2.T_FUN_MIN(VIEW1.c1)]), filter(nil), rowset=16
      access([VIEW2.T_FUN_MIN(VIEW1.c1)])
  2 - output([T_FUN_MIN(VIEW3.t4.c1)]), filter(nil), rowset=16
      group(nil), agg_func([T_FUN_MIN(VIEW3.t4.c1)])
  3 - output([VIEW3.t4.c1]), filter(nil), rowset=16
      access([VIEW3.t4.c1])
  4 - output([t4.c1]), filter(nil), rowset=16
      access([t4.c1]), partitions(p0)
      limit(1), offset(nil), is_index_back=false, is_global_index=false, 
      range_key([t4.c1]), range(MIN ; MAX)always true
  5 - output([t3.c1]), filter(nil), rowset=16
      access([GROUP_ID], [t3.c1]), partitions(p0)
      is_index_back=false, is_global_index=false, 
      range_key([t3.c1]), range(MIN ; MAX), 
      range_cond([t3.c1 > :0])
select c1 from t3 where c1 > any (select c1 from t4);
c1
2
3
4
5
6
EXPLAIN select /*+NO_REWRITE*/c1 from t3 where c1 > any (select c1 from t4);
Query Plan
=================================================
|ID|OPERATOR         |NAME|EST.ROWS|EST.TIME(us)|
-------------------------------------------------
|0 |SUBPLAN FILTER   |    |3       |5           |
|1 |├─TABLE FULL SCAN|t3  |6       |3           |
|2 |└─TABLE FULL SCAN|t4  |6       |3           |
=================================================
Outputs & filters:
-------------------------------------
  0 - output([t3.c1]), filter([t3.c1 > ANY(subquery(1))]), rowset=16
      exec_params_(nil), onetime_exprs_(nil), init_plan_idxs_([1]), use_batch=false
  1 - output([t3.c1]), filter(nil), rowset=16
      access([t3.c1]), partitions(p0)
      is_index_back=false, is_global_index=false, 
      range_key([t3.c1]), range(MIN ; MAX)always true
  2 - output([t4.c1]), filter(nil), rowset=16
      access([t4.c1]), partitions(p0)
      is_index_back=false, is_global_index=false, 
      range_key([t4.c1]), range(MIN ; MAX)always true
select /*+NO_REWRITE*/c1 from t3 where c1 > any (select c1 from t4);
c1
2
3
4
5
6
EXPLAIN update t3 set c2 = c2 + 1  where c1 > any (select c1 from t4);
Query Plan
==========================================================
|ID|OPERATOR                 |NAME |EST.ROWS|EST.TIME(us)|
----------------------------------------------------------
|0 |UPDATE                   |     |1       |50          |
|1 |└─NESTED-LOOP JOIN       |     |1       |19          |
|2 |  ├─SUBPLAN SCAN         |VIEW2|1       |3           |
|3 |  │ └─SCALAR GROUP BY    |     |1       |3           |
|4 |  │   └─SUBPLAN SCAN     |VIEW3|1       |3           |
|5 |  │     └─TABLE FULL SCAN|t4   |1       |3           |
|6 |  └─TABLE RANGE SCAN     |t3   |2       |16          |
==========================================================
Outputs & filters:
-------------------------------------
  0 - output(nil), filter(nil)
      table_columns([{t3: ({t3: (t3.c1, t3.c2)}), hash_distinct}]),
      update([t3.c2=column_conv(INT,PS:(11,0),NULL,cast(t3.c2 + 1, INT(-1, 0)))])
  1 - output([t3.c1], [t3.c2]), filter(nil), rowset=16
      conds(nil), nl_params_([VIEW2.T_FUN_MIN(VIEW1.c1)(:0)]), use_batch=true
  2 - output([VIEW2.T_FUN_MIN(VIEW1.c1)]), filter(nil), rowset=16
      access([VIEW2.T_FUN_MIN(VIEW1.c1)])
  3 - output([T_FUN_MIN(VIEW3.t4.c1)]), filter(nil), rowset=16
      group(nil), agg_func([T_FUN_MIN(VIEW3.t4.c1)])
  4 - output([VIEW3.t4.c1]), filter(nil), rowset=16
      access([VIEW3.t4.c1])
  5 - output([t4.c1]), filter(nil), rowset=16
      access([t4.c1]), partitions(p0)
      limit(1), offset(nil), is_index_back=false, is_global_index=false, 
      range_key([t4.c1]), range(MIN ; MAX)always true
  6 - output([t3.c1], [t3.c2]), filter(nil), rowset=16
      access([GROUP_ID], [t3.c1], [t3.c2]), partitions(p0)
      is_index_back=false, is_global_index=false, 
      range_key([t3.c1]), range(MIN ; MAX), 
      range_cond([t3.c1 > :0])
update t3 set c2 = c2 + 1  where c1 > any (select c1 from t4);
select/**/ * from t3;
c1	c2
1	1
2	6
3	3
4	7
5	5
6	8
rollback;
EXPLAIN update /*+NO_REWRITE*/t3 set c2 = c2 + 1  where c1 > any (select c1 from t4);
Query Plan
===================================================
|ID|OPERATOR           |NAME|EST.ROWS|EST.TIME(us)|
---------------------------------------------------
|0 |UPDATE             |    |3       |52          |
|1 |└─SUBPLAN FILTER   |    |3       |6           |
|2 |  ├─TABLE FULL SCAN|t3  |6       |3           |
|3 |  └─TABLE FULL SCAN|t4  |6       |3           |
===================================================
Outputs & filters:
-------------------------------------
  0 - output(nil), filter(nil)
      table_columns([{t3: ({t3: (t3.c1, t3.c2)})}]),
      update([t3.c2=column_conv(INT,PS:(11,0),NULL,cast(t3.c2 + 1, INT(-1, 0)))])
  1 - output([t3.c1], [t3.c2]), filter([t3.c1 > ANY(subquery(1))]), rowset=16
      exec_params_(nil), onetime_exprs_(nil), init_plan_idxs_([1]), use_batch=false
  2 - output([t3.c1], [t3.c2]), filter(nil), rowset=16
      access([t3.c1], [t3.c2]), partitions(p0)
      is_index_back=false, is_global_index=false, 
      range_key([t3.c1]), range(MIN ; MAX)always true
  3 - output([t4.c1]), filter(nil), rowset=16
      access([t4.c1]), partitions(p0)
      is_index_back=false, is_global_index=false, 
      range_key([t4.c1]), range(MIN ; MAX)always true
update /*+NO_REWRITE*/t3 set c2 = c2 + 1  where c1 > any (select c1 from t4);
select/**/ * from t3;
c1	c2
1	1
2	6
3	3
4	7
5	5
6	8
rollback;
EXPLAIN delete from t3  where c1 > any (select c1 from t4);
Query Plan
==========================================================
|ID|OPERATOR                 |NAME |EST.ROWS|EST.TIME(us)|
----------------------------------------------------------
|0 |DELETE                   |     |1       |30          |
|1 |└─NESTED-LOOP JOIN       |     |1       |19          |
|2 |  ├─SUBPLAN SCAN         |VIEW2|1       |3           |
|3 |  │ └─SCALAR GROUP BY    |     |1       |3           |
|4 |  │   └─SUBPLAN SCAN     |VIEW3|1       |3           |
|5 |  │     └─TABLE FULL SCAN|t4   |1       |3           |
|6 |  └─TABLE RANGE SCAN     |t3   |2       |16          |
==========================================================
Outputs & filters:
-------------------------------------
  0 - output(nil), filter(nil)
      table_columns([{t3: ({t3: (t3.c1, t3.c2)}), hash_distinct}])
  1 - output([t3.c1], [t3.c2]), filter(nil), rowset=16
      conds(nil), nl_params_([VIEW2.T_FUN_MIN(VIEW1.c1)(:0)]), use_batch=true
  2 - output([VIEW2.T_FUN_MIN(VIEW1.c1)]), filter(nil), rowset=16
      access([VIEW2.T_FUN_MIN(VIEW1.c1)])
  3 - output([T_FUN_MIN(VIEW3.t4.c1)]), filter(nil), rowset=16
      group(nil), agg_func([T_FUN_MIN(VIEW3.t4.c1)])
  4 - output([VIEW3.t4.c1]), filter(nil), rowset=16
      access([VIEW3.t4.c1])
  5 - output([t4.c1]), filter(nil), rowset=16
      access([t4.c1]), partitions(p0)
      limit(1), offset(nil), is_index_back=false, is_global_index=false, 
      range_key([t4.c1]), range(MIN ; MAX)always true
  6 - output([t3.c1], [t3.c2]), filter(nil), rowset=16
      access([GROUP_ID], [t3.c1], [t3.c2]), partitions(p0)
      is_index_back=false, is_global_index=false, 
      range_key([t3.c1]), range(MIN ; MAX), 
      range_cond([t3.c1 > :0])
delete from t3  where c1 > any (select c1 from t4);
select/**/ * from t3;
c1	c2
1	1
rollback;
EXPLAIN delete /*+NO_REWRITE*/from t3  where c1 > any (select c1 from t4);
Query Plan
===================================================
|ID|OPERATOR           |NAME|EST.ROWS|EST.TIME(us)|
---------------------------------------------------
|0 |DELETE             |    |3       |27          |
|1 |└─SUBPLAN FILTER   |    |3       |6           |
|2 |  ├─TABLE FULL SCAN|t3  |6       |3           |
|3 |  └─TABLE FULL SCAN|t4  |6       |3           |
===================================================
Outputs & filters:
-------------------------------------
  0 - output(nil), filter(nil)
      table_columns([{t3: ({t3: (t3.c1, t3.c2)})}])
  1 - output([t3.c1], [t3.c2]), filter([t3.c1 > ANY(subquery(1))]), rowset=16
      exec_params_(nil), onetime_exprs_(nil), init_plan_idxs_([1]), use_batch=false
  2 - output([t3.c1], [t3.c2]), filter(nil), rowset=16
      access([t3.c1], [t3.c2]), partitions(p0)
      is_index_back=false, is_global_index=false, 
      range_key([t3.c1]), range(MIN ; MAX)always true
  3 - output([t4.c1]), filter(nil), rowset=16
      access([t4.c1]), partitions(p0)
      is_index_back=false, is_global_index=false, 
      range_key([t4.c1]), range(MIN ; MAX)always true
delete /*+NO_REWRITE*/from t3  where c1 > any (select c1 from t4);
select/**/ * from t3;
c1	c2
1	1
rollback;
EXPLAIN insert into is_c1 select c1 from t3 where c1 > any (select c1 from t4);
Query Plan
======================================================================
|ID|OPERATOR                   |NAME           |EST.ROWS|EST.TIME(us)|
----------------------------------------------------------------------
|0 |INSERT                     |               |1       |32          |
|1 |└─SUBPLAN SCAN             |ANONYMOUS_VIEW1|1       |19          |
|2 |  └─NESTED-LOOP JOIN       |               |1       |19          |
|3 |    ├─SUBPLAN SCAN         |VIEW2          |1       |3           |
|4 |    │ └─SCALAR GROUP BY    |               |1       |3           |
|5 |    │   └─SUBPLAN SCAN     |VIEW3          |1       |3           |
|6 |    │     └─TABLE FULL SCAN|t4             |1       |3           |
|7 |    └─TABLE RANGE SCAN     |t3             |2       |16          |
======================================================================
Outputs & filters:
-------------------------------------
  0 - output(nil), filter(nil)
      columns([{is_c1: ({is_c1: (is_c1.__pk_increment, is_c1.a)})}]), partitions(p0), 
      column_values([T_HIDDEN_PK], [column_conv(INT,PS:(11,0),NULL,ANONYMOUS_VIEW1.c1)])
  1 - output([ANONYMOUS_VIEW1.c1]), filter(nil), rowset=16
      access([ANONYMOUS_VIEW1.c1])
  2 - output([t3.c1]), filter(nil), rowset=16
      conds(nil), nl_params_([VIEW2.T_FUN_MIN(VIEW1.c1)(:0)]), use_batch=true
  3 - output([VIEW2.T_FUN_MIN(VIEW1.c1)]), filter(nil), rowset=16
      access([VIEW2.T_FUN_MIN(VIEW1.c1)])
  4 - output([T_FUN_MIN(VIEW3.t4.c1)]), filter(nil), rowset=16
      group(nil), agg_func([T_FUN_MIN(VIEW3.t4.c1)])
  5 - output([VIEW3.t4.c1]), filter(nil), rowset=16
      access([VIEW3.t4.c1])
  6 - output([t4.c1]), filter(nil), rowset=16
      access([t4.c1]), partitions(p0)
      limit(1), offset(nil), is_index_back=false, is_global_index=false, 
      range_key([t4.c1]), range(MIN ; MAX)always true
  7 - output([t3.c1]), filter(nil), rowset=16
      access([GROUP_ID], [t3.c1]), partitions(p0)
      is_index_back=false, is_global_index=false, 
      range_key([t3.c1]), range(MIN ; MAX), 
      range_cond([t3.c1 > :0])
insert into is_c1 select c1 from t3 where c1 > any (select c1 from t4);
select/**/ * from is_c1;
a
2
3
4
5
6
rollback;
EXPLAIN insert into is_c1 select /*+NO_REWRITE*/c1 from t3 where c1 > any (select c1 from t4);
Query Plan
================================================================
|ID|OPERATOR             |NAME           |EST.ROWS|EST.TIME(us)|
----------------------------------------------------------------
|0 |INSERT               |               |3       |31          |
|1 |└─SUBPLAN SCAN       |ANONYMOUS_VIEW1|3       |5           |
|2 |  └─SUBPLAN FILTER   |               |3       |5           |
|3 |    ├─TABLE FULL SCAN|t3             |6       |3           |
|4 |    └─TABLE FULL SCAN|t4             |6       |3           |
================================================================
Outputs & filters:
-------------------------------------
  0 - output(nil), filter(nil)
      columns([{is_c1: ({is_c1: (is_c1.__pk_increment, is_c1.a)})}]), partitions(p0), 
      column_values([T_HIDDEN_PK], [column_conv(INT,PS:(11,0),NULL,ANONYMOUS_VIEW1.c1)])
  1 - output([ANONYMOUS_VIEW1.c1]), filter(nil), rowset=16
      access([ANONYMOUS_VIEW1.c1])
  2 - output([t3.c1]), filter([t3.c1 > ANY(subquery(1))]), rowset=16
      exec_params_(nil), onetime_exprs_(nil), init_plan_idxs_([1]), use_batch=false
  3 - output([t3.c1]), filter(nil), rowset=16
      access([t3.c1]), partitions(p0)
      is_index_back=false, is_global_index=false, 
      range_key([t3.c1]), range(MIN ; MAX)always true
  4 - output([t4.c1]), filter(nil), rowset=16
      access([t4.c1]), partitions(p0)
      is_index_back=false, is_global_index=false, 
      range_key([t4.c1]), range(MIN ; MAX)always true
insert into is_c1 select /*+NO_REWRITE*/c1 from t3 where c1 > any (select c1 from t4);
select/**/ * from is_c1;
a
2
3
4
5
6
rollback;


# case 6
EXPLAIN select c1 from t3 where c1 < some (select c1 from t4);
Query Plan
==============================================================
|ID|OPERATOR               |NAME       |EST.ROWS|EST.TIME(us)|
--------------------------------------------------------------
|0 |NESTED-LOOP JOIN       |           |1       |19          |
|1 |├─SUBPLAN SCAN         |VIEW2      |1       |3           |
|2 |│ └─SCALAR GROUP BY    |           |1       |3           |
|3 |│   └─SUBPLAN SCAN     |VIEW3      |1       |3           |
|4 |│     └─TABLE FULL SCAN|t4(Reverse)|1       |3           |
|5 |└─TABLE RANGE SCAN     |t3         |2       |16          |
==============================================================
Outputs & filters:
-------------------------------------
  0 - output([t3.c1]), filter(nil), rowset=16
      conds(nil), nl_params_([VIEW2.T_FUN_MAX(VIEW1.c1)(:0)]), use_batch=true
  1 - output([VIEW2.T_FUN_MAX(VIEW1.c1)]), filter(nil), rowset=16
      access([VIEW2.T_FUN_MAX(VIEW1.c1)])
  2 - output([T_FUN_MAX(VIEW3.t4.c1)]), filter(nil), rowset=16
      group(nil), agg_func([T_FUN_MAX(VIEW3.t4.c1)])
  3 - output([VIEW3.t4.c1]), filter(nil), rowset=16
      access([VIEW3.t4.c1])
  4 - output([t4.c1]), filter(nil), rowset=16
      access([t4.c1]), partitions(p0)
      limit(1), offset(nil), is_index_back=false, is_global_index=false, 
      range_key([t4.c1]), range(MIN ; MAX)always true
  5 - output([t3.c1]), filter(nil), rowset=16
      access([GROUP_ID], [t3.c1]), partitions(p0)
      is_index_back=false, is_global_index=false, 
      range_key([t3.c1]), range(MIN ; MAX), 
      range_cond([t3.c1 < :0])
select c1 from t3 where c1 < some (select c1 from t4);
c1
1
2
3
4
5
EXPLAIN select /*+NO_REWRITE*/c1 from t3 where c1 < some (select c1 from t4);
Query Plan
=================================================
|ID|OPERATOR         |NAME|EST.ROWS|EST.TIME(us)|
-------------------------------------------------
|0 |SUBPLAN FILTER   |    |3       |5           |
|1 |├─TABLE FULL SCAN|t3  |6       |3           |
|2 |└─TABLE FULL SCAN|t4  |6       |3           |
=================================================
Outputs & filters:
-------------------------------------
  0 - output([t3.c1]), filter([t3.c1 < ANY(subquery(1))]), rowset=16
      exec_params_(nil), onetime_exprs_(nil), init_plan_idxs_([1]), use_batch=false
  1 - output([t3.c1]), filter(nil), rowset=16
      access([t3.c1]), partitions(p0)
      is_index_back=false, is_global_index=false, 
      range_key([t3.c1]), range(MIN ; MAX)always true
  2 - output([t4.c1]), filter(nil), rowset=16
      access([t4.c1]), partitions(p0)
      is_index_back=false, is_global_index=false, 
      range_key([t4.c1]), range(MIN ; MAX)always true
select /*+NO_REWRITE*/c1 from t3 where c1 < some (select c1 from t4);
c1
1
2
3
4
5
EXPLAIN update t3 set c2 = c2 + 1  where c1 < some (select c1 from t4);
Query Plan
================================================================
|ID|OPERATOR                 |NAME       |EST.ROWS|EST.TIME(us)|
----------------------------------------------------------------
|0 |UPDATE                   |           |1       |50          |
|1 |└─NESTED-LOOP JOIN       |           |1       |19          |
|2 |  ├─SUBPLAN SCAN         |VIEW2      |1       |3           |
|3 |  │ └─SCALAR GROUP BY    |           |1       |3           |
|4 |  │   └─SUBPLAN SCAN     |VIEW3      |1       |3           |
|5 |  │     └─TABLE FULL SCAN|t4(Reverse)|1       |3           |
|6 |  └─TABLE RANGE SCAN     |t3         |2       |16          |
================================================================
Outputs & filters:
-------------------------------------
  0 - output(nil), filter(nil)
      table_columns([{t3: ({t3: (t3.c1, t3.c2)}), hash_distinct}]),
      update([t3.c2=column_conv(INT,PS:(11,0),NULL,cast(t3.c2 + 1, INT(-1, 0)))])
  1 - output([t3.c1], [t3.c2]), filter(nil), rowset=16
      conds(nil), nl_params_([VIEW2.T_FUN_MAX(VIEW1.c1)(:0)]), use_batch=true
  2 - output([VIEW2.T_FUN_MAX(VIEW1.c1)]), filter(nil), rowset=16
      access([VIEW2.T_FUN_MAX(VIEW1.c1)])
  3 - output([T_FUN_MAX(VIEW3.t4.c1)]), filter(nil), rowset=16
      group(nil), agg_func([T_FUN_MAX(VIEW3.t4.c1)])
  4 - output([VIEW3.t4.c1]), filter(nil), rowset=16
      access([VIEW3.t4.c1])
  5 - output([t4.c1]), filter(nil), rowset=16
      access([t4.c1]), partitions(p0)
      limit(1), offset(nil), is_index_back=false, is_global_index=false, 
      range_key([t4.c1]), range(MIN ; MAX)always true
  6 - output([t3.c1], [t3.c2]), filter(nil), rowset=16
      access([GROUP_ID], [t3.c1], [t3.c2]), partitions(p0)
      is_index_back=false, is_global_index=false, 
      range_key([t3.c1]), range(MIN ; MAX), 
      range_cond([t3.c1 < :0])
update t3 set c2 = c2 + 1  where c1 < some (select c1 from t4);
select/**/ * from t3;
c1	c2
1	2
2	6
3	3
4	7
5	5
6	7
rollback;
EXPLAIN update /*+NO_REWRITE*/t3 set c2 = c2 + 1  where c1 < some (select c1 from t4);
Query Plan
===================================================
|ID|OPERATOR           |NAME|EST.ROWS|EST.TIME(us)|
---------------------------------------------------
|0 |UPDATE             |    |3       |52          |
|1 |└─SUBPLAN FILTER   |    |3       |6           |
|2 |  ├─TABLE FULL SCAN|t3  |6       |3           |
|3 |  └─TABLE FULL SCAN|t4  |6       |3           |
===================================================
Outputs & filters:
-------------------------------------
  0 - output(nil), filter(nil)
      table_columns([{t3: ({t3: (t3.c1, t3.c2)})}]),
      update([t3.c2=column_conv(INT,PS:(11,0),NULL,cast(t3.c2 + 1, INT(-1, 0)))])
  1 - output([t3.c1], [t3.c2]), filter([t3.c1 < ANY(subquery(1))]), rowset=16
      exec_params_(nil), onetime_exprs_(nil), init_plan_idxs_([1]), use_batch=false
  2 - output([t3.c1], [t3.c2]), filter(nil), rowset=16
      access([t3.c1], [t3.c2]), partitions(p0)
      is_index_back=false, is_global_index=false, 
      range_key([t3.c1]), range(MIN ; MAX)always true
  3 - output([t4.c1]), filter(nil), rowset=16
      access([t4.c1]), partitions(p0)
      is_index_back=false, is_global_index=false, 
      range_key([t4.c1]), range(MIN ; MAX)always true
update /*+NO_REWRITE*/t3 set c2 = c2 + 1  where c1 < some (select c1 from t4);
select/**/ * from t3;
c1	c2
1	2
2	6
3	3
4	7
5	5
6	7
rollback;
EXPLAIN delete from t3  where c1 < some (select c1 from t4);
Query Plan
================================================================
|ID|OPERATOR                 |NAME       |EST.ROWS|EST.TIME(us)|
----------------------------------------------------------------
|0 |DELETE                   |           |1       |30          |
|1 |└─NESTED-LOOP JOIN       |           |1       |19          |
|2 |  ├─SUBPLAN SCAN         |VIEW2      |1       |3           |
|3 |  │ └─SCALAR GROUP BY    |           |1       |3           |
|4 |  │   └─SUBPLAN SCAN     |VIEW3      |1       |3           |
|5 |  │     └─TABLE FULL SCAN|t4(Reverse)|1       |3           |
|6 |  └─TABLE RANGE SCAN     |t3         |2       |16          |
================================================================
Outputs & filters:
-------------------------------------
  0 - output(nil), filter(nil)
      table_columns([{t3: ({t3: (t3.c1, t3.c2)}), hash_distinct}])
  1 - output([t3.c1], [t3.c2]), filter(nil), rowset=16
      conds(nil), nl_params_([VIEW2.T_FUN_MAX(VIEW1.c1)(:0)]), use_batch=true
  2 - output([VIEW2.T_FUN_MAX(VIEW1.c1)]), filter(nil), rowset=16
      access([VIEW2.T_FUN_MAX(VIEW1.c1)])
  3 - output([T_FUN_MAX(VIEW3.t4.c1)]), filter(nil), rowset=16
      group(nil), agg_func([T_FUN_MAX(VIEW3.t4.c1)])
  4 - output([VIEW3.t4.c1]), filter(nil), rowset=16
      access([VIEW3.t4.c1])
  5 - output([t4.c1]), filter(nil), rowset=16
      access([t4.c1]), partitions(p0)
      limit(1), offset(nil), is_index_back=false, is_global_index=false, 
      range_key([t4.c1]), range(MIN ; MAX)always true
  6 - output([t3.c1], [t3.c2]), filter(nil), rowset=16
      access([GROUP_ID], [t3.c1], [t3.c2]), partitions(p0)
      is_index_back=false, is_global_index=false, 
      range_key([t3.c1]), range(MIN ; MAX), 
      range_cond([t3.c1 < :0])
delete from t3  where c1 < some (select c1 from t4);
select/**/ * from t3;
c1	c2
6	7
rollback;
EXPLAIN delete /*+NO_REWRITE*/from t3  where c1 < some (select c1 from t4);
Query Plan
===================================================
|ID|OPERATOR           |NAME|EST.ROWS|EST.TIME(us)|
---------------------------------------------------
|0 |DELETE             |    |3       |27          |
|1 |└─SUBPLAN FILTER   |    |3       |6           |
|2 |  ├─TABLE FULL SCAN|t3  |6       |3           |
|3 |  └─TABLE FULL SCAN|t4  |6       |3           |
===================================================
Outputs & filters:
-------------------------------------
  0 - output(nil), filter(nil)
      table_columns([{t3: ({t3: (t3.c1, t3.c2)})}])
  1 - output([t3.c1], [t3.c2]), filter([t3.c1 < ANY(subquery(1))]), rowset=16
      exec_params_(nil), onetime_exprs_(nil), init_plan_idxs_([1]), use_batch=false
  2 - output([t3.c1], [t3.c2]), filter(nil), rowset=16
      access([t3.c1], [t3.c2]), partitions(p0)
      is_index_back=false, is_global_index=false, 
      range_key([t3.c1]), range(MIN ; MAX)always true
  3 - output([t4.c1]), filter(nil), rowset=16
      access([t4.c1]), partitions(p0)
      is_index_back=false, is_global_index=false, 
      range_key([t4.c1]), range(MIN ; MAX)always true
delete /*+NO_REWRITE*/from t3  where c1 < some (select c1 from t4);
select/**/ * from t3;
c1	c2
6	7
rollback;
EXPLAIN insert into is_c1 select c1 from t3 where c1 < some (select c1 from t4);
Query Plan
======================================================================
|ID|OPERATOR                   |NAME           |EST.ROWS|EST.TIME(us)|
----------------------------------------------------------------------
|0 |INSERT                     |               |1       |32          |
|1 |└─SUBPLAN SCAN             |ANONYMOUS_VIEW1|1       |19          |
|2 |  └─NESTED-LOOP JOIN       |               |1       |19          |
|3 |    ├─SUBPLAN SCAN         |VIEW2          |1       |3           |
|4 |    │ └─SCALAR GROUP BY    |               |1       |3           |
|5 |    │   └─SUBPLAN SCAN     |VIEW3          |1       |3           |
|6 |    │     └─TABLE FULL SCAN|t4(Reverse)    |1       |3           |
|7 |    └─TABLE RANGE SCAN     |t3             |2       |16          |
======================================================================
Outputs & filters:
-------------------------------------
  0 - output(nil), filter(nil)
      columns([{is_c1: ({is_c1: (is_c1.__pk_increment, is_c1.a)})}]), partitions(p0), 
      column_values([T_HIDDEN_PK], [column_conv(INT,PS:(11,0),NULL,ANONYMOUS_VIEW1.c1)])
  1 - output([ANONYMOUS_VIEW1.c1]), filter(nil), rowset=16
      access([ANONYMOUS_VIEW1.c1])
  2 - output([t3.c1]), filter(nil), rowset=16
      conds(nil), nl_params_([VIEW2.T_FUN_MAX(VIEW1.c1)(:0)]), use_batch=true
  3 - output([VIEW2.T_FUN_MAX(VIEW1.c1)]), filter(nil), rowset=16
      access([VIEW2.T_FUN_MAX(VIEW1.c1)])
  4 - output([T_FUN_MAX(VIEW3.t4.c1)]), filter(nil), rowset=16
      group(nil), agg_func([T_FUN_MAX(VIEW3.t4.c1)])
  5 - output([VIEW3.t4.c1]), filter(nil), rowset=16
      access([VIEW3.t4.c1])
  6 - output([t4.c1]), filter(nil), rowset=16
      access([t4.c1]), partitions(p0)
      limit(1), offset(nil), is_index_back=false, is_global_index=false, 
      range_key([t4.c1]), range(MIN ; MAX)always true
  7 - output([t3.c1]), filter(nil), rowset=16
      access([GROUP_ID], [t3.c1]), partitions(p0)
      is_index_back=false, is_global_index=false, 
      range_key([t3.c1]), range(MIN ; MAX), 
      range_cond([t3.c1 < :0])
insert into is_c1 select c1 from t3 where c1 < some (select c1 from t4);
select/**/ * from is_c1;
a
1
2
3
4
5
rollback;
EXPLAIN insert into is_c1 select /*+NO_REWRITE*/c1 from t3 where c1 < some (select c1 from t4);
Query Plan
================================================================
|ID|OPERATOR             |NAME           |EST.ROWS|EST.TIME(us)|
----------------------------------------------------------------
|0 |INSERT               |               |3       |31          |
|1 |└─SUBPLAN SCAN       |ANONYMOUS_VIEW1|3       |5           |
|2 |  └─SUBPLAN FILTER   |               |3       |5           |
|3 |    ├─TABLE FULL SCAN|t3             |6       |3           |
|4 |    └─TABLE FULL SCAN|t4             |6       |3           |
================================================================
Outputs & filters:
-------------------------------------
  0 - output(nil), filter(nil)
      columns([{is_c1: ({is_c1: (is_c1.__pk_increment, is_c1.a)})}]), partitions(p0), 
      column_values([T_HIDDEN_PK], [column_conv(INT,PS:(11,0),NULL,ANONYMOUS_VIEW1.c1)])
  1 - output([ANONYMOUS_VIEW1.c1]), filter(nil), rowset=16
      access([ANONYMOUS_VIEW1.c1])
  2 - output([t3.c1]), filter([t3.c1 < ANY(subquery(1))]), rowset=16
      exec_params_(nil), onetime_exprs_(nil), init_plan_idxs_([1]), use_batch=false
  3 - output([t3.c1]), filter(nil), rowset=16
      access([t3.c1]), partitions(p0)
      is_index_back=false, is_global_index=false, 
      range_key([t3.c1]), range(MIN ; MAX)always true
  4 - output([t4.c1]), filter(nil), rowset=16
      access([t4.c1]), partitions(p0)
      is_index_back=false, is_global_index=false, 
      range_key([t4.c1]), range(MIN ; MAX)always true
insert into is_c1 select /*+NO_REWRITE*/c1 from t3 where c1 < some (select c1 from t4);
select/**/ * from is_c1;
a
1
2
3
4
5
rollback;


# case 7
EXPLAIN select c1 from t3 where c1 > all (select c1 from t4);
Query Plan
======================================================
|ID|OPERATOR              |NAME|EST.ROWS|EST.TIME(us)|
------------------------------------------------------
|0 |NESTED-LOOP ANTI JOIN |    |0       |115         |
|1 |├─TABLE FULL SCAN     |t3  |6       |3           |
|2 |└─TABLE RANGE SCAN    |t4  |1       |18          |
======================================================
Outputs & filters:
-------------------------------------
  0 - output([t3.c1]), filter(nil), rowset=16
      conds(nil), nl_params_([t3.c1(:0)]), use_batch=false
  1 - output([t3.c1]), filter(nil), rowset=16
      access([t3.c1]), partitions(p0)
      is_index_back=false, is_global_index=false, 
      range_key([t3.c1]), range(MIN ; MAX)always true
  2 - output(nil), filter(nil), rowset=16
      access(nil), partitions(p0)
      is_index_back=false, is_global_index=false, 
      range_key([t4.c1]), range(MIN ; MAX), 
      range_cond([:0 <= t4.c1])
select c1 from t3 where c1 > all (select c1 from t4);
c1
EXPLAIN select /*+NO_REWRITE*/c1 from t3 where c1 > all (select c1 from t4);
Query Plan
=================================================
|ID|OPERATOR         |NAME|EST.ROWS|EST.TIME(us)|
-------------------------------------------------
|0 |SUBPLAN FILTER   |    |3       |5           |
|1 |├─TABLE FULL SCAN|t3  |6       |3           |
|2 |└─TABLE FULL SCAN|t4  |6       |3           |
=================================================
Outputs & filters:
-------------------------------------
  0 - output([t3.c1]), filter([t3.c1 > ALL(subquery(1))]), rowset=16
      exec_params_(nil), onetime_exprs_(nil), init_plan_idxs_([1]), use_batch=false
  1 - output([t3.c1]), filter(nil), rowset=16
      access([t3.c1]), partitions(p0)
      is_index_back=false, is_global_index=false, 
      range_key([t3.c1]), range(MIN ; MAX)always true
  2 - output([t4.c1]), filter(nil), rowset=16
      access([t4.c1]), partitions(p0)
      is_index_back=false, is_global_index=false, 
      range_key([t4.c1]), range(MIN ; MAX)always true
select /*+NO_REWRITE*/c1 from t3 where c1 > all (select c1 from t4);
c1
EXPLAIN update t3 set c2 = c2 + 1  where c1 > all (select c1 from t4);
Query Plan
========================================================
|ID|OPERATOR                |NAME|EST.ROWS|EST.TIME(us)|
--------------------------------------------------------
|0 |UPDATE                  |    |0       |139         |
|1 |└─NESTED-LOOP ANTI JOIN |    |0       |115         |
|2 |  ├─TABLE FULL SCAN     |t3  |6       |3           |
|3 |  └─TABLE RANGE SCAN    |t4  |1       |18          |
========================================================
Outputs & filters:
-------------------------------------
  0 - output(nil), filter(nil)
      table_columns([{t3: ({t3: (t3.c1, t3.c2)})}]),
      update([t3.c2=column_conv(INT,PS:(11,0),NULL,cast(t3.c2 + 1, INT(-1, 0)))])
  1 - output([t3.c1], [t3.c2]), filter(nil), rowset=16
      conds(nil), nl_params_([t3.c1(:0)]), use_batch=false
  2 - output([t3.c1], [t3.c2]), filter(nil), rowset=16
      access([t3.c1], [t3.c2]), partitions(p0)
      is_index_back=false, is_global_index=false, 
      range_key([t3.c1]), range(MIN ; MAX)always true
  3 - output(nil), filter(nil), rowset=16
      access(nil), partitions(p0)
      is_index_back=false, is_global_index=false, 
      range_key([t4.c1]), range(MIN ; MAX), 
      range_cond([:0 <= t4.c1])
update t3 set c2 = c2 + 1  where c1 > all (select c1 from t4);
select/**/ * from t3;
c1	c2
1	1
2	5
3	2
4	6
5	4
6	7
rollback;
EXPLAIN update /*+NO_REWRITE*/t3 set c2 = c2 + 1  where c1 > all (select c1 from t4);
Query Plan
===================================================
|ID|OPERATOR           |NAME|EST.ROWS|EST.TIME(us)|
---------------------------------------------------
|0 |UPDATE             |    |3       |52          |
|1 |└─SUBPLAN FILTER   |    |3       |6           |
|2 |  ├─TABLE FULL SCAN|t3  |6       |3           |
|3 |  └─TABLE FULL SCAN|t4  |6       |3           |
===================================================
Outputs & filters:
-------------------------------------
  0 - output(nil), filter(nil)
      table_columns([{t3: ({t3: (t3.c1, t3.c2)})}]),
      update([t3.c2=column_conv(INT,PS:(11,0),NULL,cast(t3.c2 + 1, INT(-1, 0)))])
  1 - output([t3.c1], [t3.c2]), filter([t3.c1 > ALL(subquery(1))]), rowset=16
      exec_params_(nil), onetime_exprs_(nil), init_plan_idxs_([1]), use_batch=false
  2 - output([t3.c1], [t3.c2]), filter(nil), rowset=16
      access([t3.c1], [t3.c2]), partitions(p0)
      is_index_back=false, is_global_index=false, 
      range_key([t3.c1]), range(MIN ; MAX)always true
  3 - output([t4.c1]), filter(nil), rowset=16
      access([t4.c1]), partitions(p0)
      is_index_back=false, is_global_index=false, 
      range_key([t4.c1]), range(MIN ; MAX)always true
update /*+NO_REWRITE*/t3 set c2 = c2 + 1  where c1 > all (select c1 from t4);
select/**/ * from t3;
c1	c2
1	1
2	5
3	2
4	6
5	4
6	7
rollback;
EXPLAIN delete from t3  where c1 > all (select c1 from t4);
Query Plan
========================================================
|ID|OPERATOR                |NAME|EST.ROWS|EST.TIME(us)|
--------------------------------------------------------
|0 |DELETE                  |    |0       |122         |
|1 |└─NESTED-LOOP ANTI JOIN |    |0       |115         |
|2 |  ├─TABLE FULL SCAN     |t3  |6       |3           |
|3 |  └─TABLE RANGE SCAN    |t4  |1       |18          |
========================================================
Outputs & filters:
-------------------------------------
  0 - output(nil), filter(nil)
      table_columns([{t3: ({t3: (t3.c1, t3.c2)})}])
  1 - output([t3.c1], [t3.c2]), filter(nil), rowset=16
      conds(nil), nl_params_([t3.c1(:0)]), use_batch=false
  2 - output([t3.c1], [t3.c2]), filter(nil), rowset=16
      access([t3.c1], [t3.c2]), partitions(p0)
      is_index_back=false, is_global_index=false, 
      range_key([t3.c1]), range(MIN ; MAX)always true
  3 - output(nil), filter(nil), rowset=16
      access(nil), partitions(p0)
      is_index_back=false, is_global_index=false, 
      range_key([t4.c1]), range(MIN ; MAX), 
      range_cond([:0 <= t4.c1])
delete from t3  where c1 > all (select c1 from t4);
select/**/ * from t3;
c1	c2
1	1
2	5
3	2
4	6
5	4
6	7
rollback;
EXPLAIN delete /*+NO_REWRITE*/from t3  where c1 > all (select c1 from t4);
Query Plan
===================================================
|ID|OPERATOR           |NAME|EST.ROWS|EST.TIME(us)|
---------------------------------------------------
|0 |DELETE             |    |3       |27          |
|1 |└─SUBPLAN FILTER   |    |3       |6           |
|2 |  ├─TABLE FULL SCAN|t3  |6       |3           |
|3 |  └─TABLE FULL SCAN|t4  |6       |3           |
===================================================
Outputs & filters:
-------------------------------------
  0 - output(nil), filter(nil)
      table_columns([{t3: ({t3: (t3.c1, t3.c2)})}])
  1 - output([t3.c1], [t3.c2]), filter([t3.c1 > ALL(subquery(1))]), rowset=16
      exec_params_(nil), onetime_exprs_(nil), init_plan_idxs_([1]), use_batch=false
  2 - output([t3.c1], [t3.c2]), filter(nil), rowset=16
      access([t3.c1], [t3.c2]), partitions(p0)
      is_index_back=false, is_global_index=false, 
      range_key([t3.c1]), range(MIN ; MAX)always true
  3 - output([t4.c1]), filter(nil), rowset=16
      access([t4.c1]), partitions(p0)
      is_index_back=false, is_global_index=false, 
      range_key([t4.c1]), range(MIN ; MAX)always true
delete /*+NO_REWRITE*/from t3  where c1 > all (select c1 from t4);
select/**/ * from t3;
c1	c2
1	1
2	5
3	2
4	6
5	4
6	7
rollback;
EXPLAIN insert into is_c1 select c1 from t3 where c1 > all (select c1 from t4);
Query Plan
=====================================================================
|ID|OPERATOR                  |NAME           |EST.ROWS|EST.TIME(us)|
---------------------------------------------------------------------
|0 |INSERT                    |               |0       |121         |
|1 |└─SUBPLAN SCAN            |ANONYMOUS_VIEW1|0       |115         |
|2 |  └─NESTED-LOOP ANTI JOIN |               |0       |115         |
|3 |    ├─TABLE FULL SCAN     |t3             |6       |3           |
|4 |    └─TABLE RANGE SCAN    |t4             |1       |18          |
=====================================================================
Outputs & filters:
-------------------------------------
  0 - output(nil), filter(nil)
      columns([{is_c1: ({is_c1: (is_c1.__pk_increment, is_c1.a)})}]), partitions(p0), 
      column_values([T_HIDDEN_PK], [column_conv(INT,PS:(11,0),NULL,ANONYMOUS_VIEW1.c1)])
  1 - output([ANONYMOUS_VIEW1.c1]), filter(nil), rowset=16
      access([ANONYMOUS_VIEW1.c1])
  2 - output([t3.c1]), filter(nil), rowset=16
      conds(nil), nl_params_([t3.c1(:0)]), use_batch=false
  3 - output([t3.c1]), filter(nil), rowset=16
      access([t3.c1]), partitions(p0)
      is_index_back=false, is_global_index=false, 
      range_key([t3.c1]), range(MIN ; MAX)always true
  4 - output(nil), filter(nil), rowset=16
      access(nil), partitions(p0)
      is_index_back=false, is_global_index=false, 
      range_key([t4.c1]), range(MIN ; MAX), 
      range_cond([:0 <= t4.c1])
insert into is_c1 select c1 from t3 where c1 > all (select c1 from t4);
select/**/ * from is_c1;
a
rollback;
EXPLAIN insert into is_c1 select /*+NO_REWRITE*/c1 from t3 where c1 > all (select c1 from t4);
Query Plan
================================================================
|ID|OPERATOR             |NAME           |EST.ROWS|EST.TIME(us)|
----------------------------------------------------------------
|0 |INSERT               |               |3       |31          |
|1 |└─SUBPLAN SCAN       |ANONYMOUS_VIEW1|3       |5           |
|2 |  └─SUBPLAN FILTER   |               |3       |5           |
|3 |    ├─TABLE FULL SCAN|t3             |6       |3           |
|4 |    └─TABLE FULL SCAN|t4             |6       |3           |
================================================================
Outputs & filters:
-------------------------------------
  0 - output(nil), filter(nil)
      columns([{is_c1: ({is_c1: (is_c1.__pk_increment, is_c1.a)})}]), partitions(p0), 
      column_values([T_HIDDEN_PK], [column_conv(INT,PS:(11,0),NULL,ANONYMOUS_VIEW1.c1)])
  1 - output([ANONYMOUS_VIEW1.c1]), filter(nil), rowset=16
      access([ANONYMOUS_VIEW1.c1])
  2 - output([t3.c1]), filter([t3.c1 > ALL(subquery(1))]), rowset=16
      exec_params_(nil), onetime_exprs_(nil), init_plan_idxs_([1]), use_batch=false
  3 - output([t3.c1]), filter(nil), rowset=16
      access([t3.c1]), partitions(p0)
      is_index_back=false, is_global_index=false, 
      range_key([t3.c1]), range(MIN ; MAX)always true
  4 - output([t4.c1]), filter(nil), rowset=16
      access([t4.c1]), partitions(p0)
      is_index_back=false, is_global_index=false, 
      range_key([t4.c1]), range(MIN ; MAX)always true
insert into is_c1 select /*+NO_REWRITE*/c1 from t3 where c1 > all (select c1 from t4);
select/**/ * from is_c1;
a
rollback;


# case 8
EXPLAIN select c1 from t3 where c1 < all (select c1 from t4);
Query Plan
======================================================
|ID|OPERATOR              |NAME|EST.ROWS|EST.TIME(us)|
------------------------------------------------------
|0 |NESTED-LOOP ANTI JOIN |    |0       |115         |
|1 |├─TABLE FULL SCAN     |t3  |6       |3           |
|2 |└─TABLE RANGE SCAN    |t4  |1       |18          |
======================================================
Outputs & filters:
-------------------------------------
  0 - output([t3.c1]), filter(nil), rowset=16
      conds(nil), nl_params_([t3.c1(:0)]), use_batch=false
  1 - output([t3.c1]), filter(nil), rowset=16
      access([t3.c1]), partitions(p0)
      is_index_back=false, is_global_index=false, 
      range_key([t3.c1]), range(MIN ; MAX)always true
  2 - output(nil), filter(nil), rowset=16
      access(nil), partitions(p0)
      is_index_back=false, is_global_index=false, 
      range_key([t4.c1]), range(MIN ; MAX), 
      range_cond([:0 >= t4.c1])
select c1 from t3 where c1 < all (select c1 from t4);
c1
EXPLAIN select /*+NO_REWRITE*/c1 from t3 where c1 < all (select c1 from t4);
Query Plan
=================================================
|ID|OPERATOR         |NAME|EST.ROWS|EST.TIME(us)|
-------------------------------------------------
|0 |SUBPLAN FILTER   |    |3       |5           |
|1 |├─TABLE FULL SCAN|t3  |6       |3           |
|2 |└─TABLE FULL SCAN|t4  |6       |3           |
=================================================
Outputs & filters:
-------------------------------------
  0 - output([t3.c1]), filter([t3.c1 < ALL(subquery(1))]), rowset=16
      exec_params_(nil), onetime_exprs_(nil), init_plan_idxs_([1]), use_batch=false
  1 - output([t3.c1]), filter(nil), rowset=16
      access([t3.c1]), partitions(p0)
      is_index_back=false, is_global_index=false, 
      range_key([t3.c1]), range(MIN ; MAX)always true
  2 - output([t4.c1]), filter(nil), rowset=16
      access([t4.c1]), partitions(p0)
      is_index_back=false, is_global_index=false, 
      range_key([t4.c1]), range(MIN ; MAX)always true
select /*+NO_REWRITE*/c1 from t3 where c1 < all (select c1 from t4);
c1
EXPLAIN update t3 set c2 = c2 + 1  where c1 < all (select c1 from t4);
Query Plan
========================================================
|ID|OPERATOR                |NAME|EST.ROWS|EST.TIME(us)|
--------------------------------------------------------
|0 |UPDATE                  |    |0       |139         |
|1 |└─NESTED-LOOP ANTI JOIN |    |0       |115         |
|2 |  ├─TABLE FULL SCAN     |t3  |6       |3           |
|3 |  └─TABLE RANGE SCAN    |t4  |1       |18          |
========================================================
Outputs & filters:
-------------------------------------
  0 - output(nil), filter(nil)
      table_columns([{t3: ({t3: (t3.c1, t3.c2)})}]),
      update([t3.c2=column_conv(INT,PS:(11,0),NULL,cast(t3.c2 + 1, INT(-1, 0)))])
  1 - output([t3.c1], [t3.c2]), filter(nil), rowset=16
      conds(nil), nl_params_([t3.c1(:0)]), use_batch=false
  2 - output([t3.c1], [t3.c2]), filter(nil), rowset=16
      access([t3.c1], [t3.c2]), partitions(p0)
      is_index_back=false, is_global_index=false, 
      range_key([t3.c1]), range(MIN ; MAX)always true
  3 - output(nil), filter(nil), rowset=16
      access(nil), partitions(p0)
      is_index_back=false, is_global_index=false, 
      range_key([t4.c1]), range(MIN ; MAX), 
      range_cond([:0 >= t4.c1])
update t3 set c2 = c2 + 1  where c1 < all (select c1 from t4);
select/**/ * from t3;
c1	c2
1	1
2	5
3	2
4	6
5	4
6	7
rollback;
EXPLAIN update /*+NO_REWRITE*/t3 set c2 = c2 + 1  where c1 < all (select c1 from t4);
Query Plan
===================================================
|ID|OPERATOR           |NAME|EST.ROWS|EST.TIME(us)|
---------------------------------------------------
|0 |UPDATE             |    |3       |52          |
|1 |└─SUBPLAN FILTER   |    |3       |6           |
|2 |  ├─TABLE FULL SCAN|t3  |6       |3           |
|3 |  └─TABLE FULL SCAN|t4  |6       |3           |
===================================================
Outputs & filters:
-------------------------------------
  0 - output(nil), filter(nil)
      table_columns([{t3: ({t3: (t3.c1, t3.c2)})}]),
      update([t3.c2=column_conv(INT,PS:(11,0),NULL,cast(t3.c2 + 1, INT(-1, 0)))])
  1 - output([t3.c1], [t3.c2]), filter([t3.c1 < ALL(subquery(1))]), rowset=16
      exec_params_(nil), onetime_exprs_(nil), init_plan_idxs_([1]), use_batch=false
  2 - output([t3.c1], [t3.c2]), filter(nil), rowset=16
      access([t3.c1], [t3.c2]), partitions(p0)
      is_index_back=false, is_global_index=false, 
      range_key([t3.c1]), range(MIN ; MAX)always true
  3 - output([t4.c1]), filter(nil), rowset=16
      access([t4.c1]), partitions(p0)
      is_index_back=false, is_global_index=false, 
      range_key([t4.c1]), range(MIN ; MAX)always true
update /*+NO_REWRITE*/t3 set c2 = c2 + 1  where c1 < all (select c1 from t4);
select/**/ * from t3;
c1	c2
1	1
2	5
3	2
4	6
5	4
6	7
rollback;
EXPLAIN delete from t3  where c1 < all (select c1 from t4);
Query Plan
========================================================
|ID|OPERATOR                |NAME|EST.ROWS|EST.TIME(us)|
--------------------------------------------------------
|0 |DELETE                  |    |0       |122         |
|1 |└─NESTED-LOOP ANTI JOIN |    |0       |115         |
|2 |  ├─TABLE FULL SCAN     |t3  |6       |3           |
|3 |  └─TABLE RANGE SCAN    |t4  |1       |18          |
========================================================
Outputs & filters:
-------------------------------------
  0 - output(nil), filter(nil)
      table_columns([{t3: ({t3: (t3.c1, t3.c2)})}])
  1 - output([t3.c1], [t3.c2]), filter(nil), rowset=16
      conds(nil), nl_params_([t3.c1(:0)]), use_batch=false
  2 - output([t3.c1], [t3.c2]), filter(nil), rowset=16
      access([t3.c1], [t3.c2]), partitions(p0)
      is_index_back=false, is_global_index=false, 
      range_key([t3.c1]), range(MIN ; MAX)always true
  3 - output(nil), filter(nil), rowset=16
      access(nil), partitions(p0)
      is_index_back=false, is_global_index=false, 
      range_key([t4.c1]), range(MIN ; MAX), 
      range_cond([:0 >= t4.c1])
delete from t3  where c1 < all (select c1 from t4);
select/**/ * from t3;
c1	c2
1	1
2	5
3	2
4	6
5	4
6	7
rollback;
EXPLAIN delete /*+NO_REWRITE*/from t3  where c1 < all (select c1 from t4);
Query Plan
===================================================
|ID|OPERATOR           |NAME|EST.ROWS|EST.TIME(us)|
---------------------------------------------------
|0 |DELETE             |    |3       |27          |
|1 |└─SUBPLAN FILTER   |    |3       |6           |
|2 |  ├─TABLE FULL SCAN|t3  |6       |3           |
|3 |  └─TABLE FULL SCAN|t4  |6       |3           |
===================================================
Outputs & filters:
-------------------------------------
  0 - output(nil), filter(nil)
      table_columns([{t3: ({t3: (t3.c1, t3.c2)})}])
  1 - output([t3.c1], [t3.c2]), filter([t3.c1 < ALL(subquery(1))]), rowset=16
      exec_params_(nil), onetime_exprs_(nil), init_plan_idxs_([1]), use_batch=false
  2 - output([t3.c1], [t3.c2]), filter(nil), rowset=16
      access([t3.c1], [t3.c2]), partitions(p0)
      is_index_back=false, is_global_index=false, 
      range_key([t3.c1]), range(MIN ; MAX)always true
  3 - output([t4.c1]), filter(nil), rowset=16
      access([t4.c1]), partitions(p0)
      is_index_back=false, is_global_index=false, 
      range_key([t4.c1]), range(MIN ; MAX)always true
delete /*+NO_REWRITE*/from t3  where c1 < all (select c1 from t4);
select/**/ * from t3;
c1	c2
1	1
2	5
3	2
4	6
5	4
6	7
rollback;
EXPLAIN insert into is_c1 select c1 from t3 where c1 < all (select c1 from t4);
Query Plan
=====================================================================
|ID|OPERATOR                  |NAME           |EST.ROWS|EST.TIME(us)|
---------------------------------------------------------------------
|0 |INSERT                    |               |0       |121         |
|1 |└─SUBPLAN SCAN            |ANONYMOUS_VIEW1|0       |115         |
|2 |  └─NESTED-LOOP ANTI JOIN |               |0       |115         |
|3 |    ├─TABLE FULL SCAN     |t3             |6       |3           |
|4 |    └─TABLE RANGE SCAN    |t4             |1       |18          |
=====================================================================
Outputs & filters:
-------------------------------------
  0 - output(nil), filter(nil)
      columns([{is_c1: ({is_c1: (is_c1.__pk_increment, is_c1.a)})}]), partitions(p0), 
      column_values([T_HIDDEN_PK], [column_conv(INT,PS:(11,0),NULL,ANONYMOUS_VIEW1.c1)])
  1 - output([ANONYMOUS_VIEW1.c1]), filter(nil), rowset=16
      access([ANONYMOUS_VIEW1.c1])
  2 - output([t3.c1]), filter(nil), rowset=16
      conds(nil), nl_params_([t3.c1(:0)]), use_batch=false
  3 - output([t3.c1]), filter(nil), rowset=16
      access([t3.c1]), partitions(p0)
      is_index_back=false, is_global_index=false, 
      range_key([t3.c1]), range(MIN ; MAX)always true
  4 - output(nil), filter(nil), rowset=16
      access(nil), partitions(p0)
      is_index_back=false, is_global_index=false, 
      range_key([t4.c1]), range(MIN ; MAX), 
      range_cond([:0 >= t4.c1])
insert into is_c1 select c1 from t3 where c1 < all (select c1 from t4);
select/**/ * from is_c1;
a
rollback;
EXPLAIN insert into is_c1 select /*+NO_REWRITE*/c1 from t3 where c1 < all (select c1 from t4);
Query Plan
================================================================
|ID|OPERATOR             |NAME           |EST.ROWS|EST.TIME(us)|
----------------------------------------------------------------
|0 |INSERT               |               |3       |31          |
|1 |└─SUBPLAN SCAN       |ANONYMOUS_VIEW1|3       |5           |
|2 |  └─SUBPLAN FILTER   |               |3       |5           |
|3 |    ├─TABLE FULL SCAN|t3             |6       |3           |
|4 |    └─TABLE FULL SCAN|t4             |6       |3           |
================================================================
Outputs & filters:
-------------------------------------
  0 - output(nil), filter(nil)
      columns([{is_c1: ({is_c1: (is_c1.__pk_increment, is_c1.a)})}]), partitions(p0), 
      column_values([T_HIDDEN_PK], [column_conv(INT,PS:(11,0),NULL,ANONYMOUS_VIEW1.c1)])
  1 - output([ANONYMOUS_VIEW1.c1]), filter(nil), rowset=16
      access([ANONYMOUS_VIEW1.c1])
  2 - output([t3.c1]), filter([t3.c1 < ALL(subquery(1))]), rowset=16
      exec_params_(nil), onetime_exprs_(nil), init_plan_idxs_([1]), use_batch=false
  3 - output([t3.c1]), filter(nil), rowset=16
      access([t3.c1]), partitions(p0)
      is_index_back=false, is_global_index=false, 
      range_key([t3.c1]), range(MIN ; MAX)always true
  4 - output([t4.c1]), filter(nil), rowset=16
      access([t4.c1]), partitions(p0)
      is_index_back=false, is_global_index=false, 
      range_key([t4.c1]), range(MIN ; MAX)always true
insert into is_c1 select /*+NO_REWRITE*/c1 from t3 where c1 < all (select c1 from t4);
select/**/ * from is_c1;
a
rollback;


# case 9
EXPLAIN select c1 from t3 where c1 in (select /*+ NO_REWRITE */c1 from t4 where c2 >= some(select /*+ NO_REWRITE */c1 from t5 where t3.c2=t5.c1));
Query Plan
==================================================
|ID|OPERATOR          |NAME|EST.ROWS|EST.TIME(us)|
--------------------------------------------------
|0 |SUBPLAN FILTER    |    |3       |218         |
|1 |├─TABLE FULL SCAN |t3  |6       |3           |
|2 |└─LIMIT           |    |1       |36          |
|3 |  └─SUBPLAN FILTER|    |1       |36          |
|4 |    ├─TABLE GET   |t4  |1       |18          |
|5 |    └─TABLE GET   |t5  |1       |18          |
==================================================
Outputs & filters:
-------------------------------------
  0 - output([t3.c1]), filter([(T_OP_EXISTS, subquery(1))]), rowset=16
      exec_params_([t3.c2(:0)], [t3.c1(:1)]), onetime_exprs_(nil), init_plan_idxs_(nil), use_batch=false
  1 - output([t3.c1], [t3.c2]), filter(nil), rowset=16
      access([t3.c1], [t3.c2]), partitions(p0)
      is_index_back=false, is_global_index=false, 
      range_key([t3.c1]), range(MIN ; MAX)always true
  2 - output([1]), filter(nil), rowset=16
      limit(1), offset(nil)
  3 - output(nil), filter([t4.c2 >= ANY(subquery(1))]), rowset=16
      exec_params_(nil), onetime_exprs_(nil), init_plan_idxs_([1]), use_batch=false
  4 - output([t4.c2]), filter(nil), rowset=16
      access([t4.c2]), partitions(p0)
      is_index_back=false, is_global_index=false, 
      range_key([t4.c1]), range(MIN ; MAX)always true, 
      range_cond([t4.c1 = :1])
  5 - output([t5.c1]), filter(nil), rowset=16
      access([t5.c1]), partitions(p0)
      is_index_back=false, is_global_index=false, 
      range_key([t5.c1]), range(MIN ; MAX)always true, 
      range_cond([:0 = t5.c1])
select c1 from t3 where c1 in (select /*+ NO_REWRITE */c1 from t4 where c2 >= some(select /*+ NO_REWRITE */c1 from t5 where t3.c2=t5.c1));
c1
1
2
3
4
5
EXPLAIN select /*+NO_REWRITE*/c1 from t3 where c1 in (select c1 from t4 where c2 >= some(select c1 from t5 where t3.c2=t5.c1));
Query Plan
=============================================================
|ID|OPERATOR                     |NAME|EST.ROWS|EST.TIME(us)|
-------------------------------------------------------------
|0 |SUBPLAN FILTER               |    |3       |223         |
|1 |├─TABLE FULL SCAN            |t3  |6       |3           |
|2 |└─NESTED-LOOP JOIN CARTESIAN |    |2       |37          |
|3 |  ├─TABLE GET                |t5  |1       |18          |
|4 |  └─TABLE FULL SCAN          |t4  |2       |18          |
=============================================================
Outputs & filters:
-------------------------------------
  0 - output([t3.c1]), filter([t3.c1 = ANY(subquery(1))]), rowset=16
      exec_params_([t3.c2(:0)]), onetime_exprs_(nil), init_plan_idxs_(nil), use_batch=false
  1 - output([t3.c1], [t3.c2]), filter(nil), rowset=16
      access([t3.c1], [t3.c2]), partitions(p0)
      is_index_back=false, is_global_index=false, 
      range_key([t3.c1]), range(MIN ; MAX)always true
  2 - output([t4.c1]), filter(nil), rowset=16
      conds(nil), nl_params_(nil), use_batch=false
  3 - output(nil), filter(nil), rowset=16
      access(nil), partitions(p0)
      is_index_back=false, is_global_index=false, 
      range_key([t5.c1]), range(MIN ; MAX)always true, 
      range_cond([:0 = t5.c1])
  4 - output([t4.c1]), filter([t4.c2 >= :0]), rowset=16
      access([t4.c1], [t4.c2]), partitions(p0)
      is_index_back=false, is_global_index=false, filter_before_indexback[false], 
      range_key([t4.c1]), range(MIN ; MAX)always true
select /*+NO_REWRITE*/c1 from t3 where c1 in (select c1 from t4 where c2 >= some(select c1 from t5 where t3.c2=t5.c1));
c1
1
2
3
4
5
EXPLAIN update t3 set c2 = c2 + 1  where c1 < all (select c1 from t4);
Query Plan
========================================================
|ID|OPERATOR                |NAME|EST.ROWS|EST.TIME(us)|
--------------------------------------------------------
|0 |UPDATE                  |    |0       |139         |
|1 |└─NESTED-LOOP ANTI JOIN |    |0       |115         |
|2 |  ├─TABLE FULL SCAN     |t3  |6       |3           |
|3 |  └─TABLE RANGE SCAN    |t4  |1       |18          |
========================================================
Outputs & filters:
-------------------------------------
  0 - output(nil), filter(nil)
      table_columns([{t3: ({t3: (t3.c1, t3.c2)})}]),
      update([t3.c2=column_conv(INT,PS:(11,0),NULL,cast(t3.c2 + 1, INT(-1, 0)))])
  1 - output([t3.c1], [t3.c2]), filter(nil), rowset=16
      conds(nil), nl_params_([t3.c1(:0)]), use_batch=false
  2 - output([t3.c1], [t3.c2]), filter(nil), rowset=16
      access([t3.c1], [t3.c2]), partitions(p0)
      is_index_back=false, is_global_index=false, 
      range_key([t3.c1]), range(MIN ; MAX)always true
  3 - output(nil), filter(nil), rowset=16
      access(nil), partitions(p0)
      is_index_back=false, is_global_index=false, 
      range_key([t4.c1]), range(MIN ; MAX), 
      range_cond([:0 >= t4.c1])
update t3 set c2 = c2 + 1  where c1 < all (select c1 from t4);
select/**/ * from t3;
c1	c2
1	1
2	5
3	2
4	6
5	4
6	7
rollback;
EXPLAIN update /*+NO_REWRITE*/t3 set c2 = c2 + 1  where c1 < all (select c1 from t4);
Query Plan
===================================================
|ID|OPERATOR           |NAME|EST.ROWS|EST.TIME(us)|
---------------------------------------------------
|0 |UPDATE             |    |3       |52          |
|1 |└─SUBPLAN FILTER   |    |3       |6           |
|2 |  ├─TABLE FULL SCAN|t3  |6       |3           |
|3 |  └─TABLE FULL SCAN|t4  |6       |3           |
===================================================
Outputs & filters:
-------------------------------------
  0 - output(nil), filter(nil)
      table_columns([{t3: ({t3: (t3.c1, t3.c2)})}]),
      update([t3.c2=column_conv(INT,PS:(11,0),NULL,cast(t3.c2 + 1, INT(-1, 0)))])
  1 - output([t3.c1], [t3.c2]), filter([t3.c1 < ALL(subquery(1))]), rowset=16
      exec_params_(nil), onetime_exprs_(nil), init_plan_idxs_([1]), use_batch=false
  2 - output([t3.c1], [t3.c2]), filter(nil), rowset=16
      access([t3.c1], [t3.c2]), partitions(p0)
      is_index_back=false, is_global_index=false, 
      range_key([t3.c1]), range(MIN ; MAX)always true
  3 - output([t4.c1]), filter(nil), rowset=16
      access([t4.c1]), partitions(p0)
      is_index_back=false, is_global_index=false, 
      range_key([t4.c1]), range(MIN ; MAX)always true
update /*+NO_REWRITE*/t3 set c2 = c2 + 1  where c1 < all (select c1 from t4);
select/**/ * from t3;
c1	c2
1	1
2	5
3	2
4	6
5	4
6	7
rollback;
EXPLAIN delete from t3  where c1 < all (select c1 from t4);
Query Plan
========================================================
|ID|OPERATOR                |NAME|EST.ROWS|EST.TIME(us)|
--------------------------------------------------------
|0 |DELETE                  |    |0       |122         |
|1 |└─NESTED-LOOP ANTI JOIN |    |0       |115         |
|2 |  ├─TABLE FULL SCAN     |t3  |6       |3           |
|3 |  └─TABLE RANGE SCAN    |t4  |1       |18          |
========================================================
Outputs & filters:
-------------------------------------
  0 - output(nil), filter(nil)
      table_columns([{t3: ({t3: (t3.c1, t3.c2)})}])
  1 - output([t3.c1], [t3.c2]), filter(nil), rowset=16
      conds(nil), nl_params_([t3.c1(:0)]), use_batch=false
  2 - output([t3.c1], [t3.c2]), filter(nil), rowset=16
      access([t3.c1], [t3.c2]), partitions(p0)
      is_index_back=false, is_global_index=false, 
      range_key([t3.c1]), range(MIN ; MAX)always true
  3 - output(nil), filter(nil), rowset=16
      access(nil), partitions(p0)
      is_index_back=false, is_global_index=false, 
      range_key([t4.c1]), range(MIN ; MAX), 
      range_cond([:0 >= t4.c1])
delete from t3  where c1 < all (select c1 from t4);
select/**/ * from t3;
c1	c2
1	1
2	5
3	2
4	6
5	4
6	7
rollback;
EXPLAIN delete /*+NO_REWRITE*/from t3  where c1 < all (select c1 from t4);
Query Plan
===================================================
|ID|OPERATOR           |NAME|EST.ROWS|EST.TIME(us)|
---------------------------------------------------
|0 |DELETE             |    |3       |27          |
|1 |└─SUBPLAN FILTER   |    |3       |6           |
|2 |  ├─TABLE FULL SCAN|t3  |6       |3           |
|3 |  └─TABLE FULL SCAN|t4  |6       |3           |
===================================================
Outputs & filters:
-------------------------------------
  0 - output(nil), filter(nil)
      table_columns([{t3: ({t3: (t3.c1, t3.c2)})}])
  1 - output([t3.c1], [t3.c2]), filter([t3.c1 < ALL(subquery(1))]), rowset=16
      exec_params_(nil), onetime_exprs_(nil), init_plan_idxs_([1]), use_batch=false
  2 - output([t3.c1], [t3.c2]), filter(nil), rowset=16
      access([t3.c1], [t3.c2]), partitions(p0)
      is_index_back=false, is_global_index=false, 
      range_key([t3.c1]), range(MIN ; MAX)always true
  3 - output([t4.c1]), filter(nil), rowset=16
      access([t4.c1]), partitions(p0)
      is_index_back=false, is_global_index=false, 
      range_key([t4.c1]), range(MIN ; MAX)always true
delete /*+NO_REWRITE*/from t3  where c1 < all (select c1 from t4);
select/**/ * from t3;
c1	c2
1	1
2	5
3	2
4	6
5	4
6	7
rollback;
EXPLAIN insert into is_c1 select c1 from t3 where c1 < all (select c1 from t4);
Query Plan
=====================================================================
|ID|OPERATOR                  |NAME           |EST.ROWS|EST.TIME(us)|
---------------------------------------------------------------------
|0 |INSERT                    |               |0       |121         |
|1 |└─SUBPLAN SCAN            |ANONYMOUS_VIEW1|0       |115         |
|2 |  └─NESTED-LOOP ANTI JOIN |               |0       |115         |
|3 |    ├─TABLE FULL SCAN     |t3             |6       |3           |
|4 |    └─TABLE RANGE SCAN    |t4             |1       |18          |
=====================================================================
Outputs & filters:
-------------------------------------
  0 - output(nil), filter(nil)
      columns([{is_c1: ({is_c1: (is_c1.__pk_increment, is_c1.a)})}]), partitions(p0), 
      column_values([T_HIDDEN_PK], [column_conv(INT,PS:(11,0),NULL,ANONYMOUS_VIEW1.c1)])
  1 - output([ANONYMOUS_VIEW1.c1]), filter(nil), rowset=16
      access([ANONYMOUS_VIEW1.c1])
  2 - output([t3.c1]), filter(nil), rowset=16
      conds(nil), nl_params_([t3.c1(:0)]), use_batch=false
  3 - output([t3.c1]), filter(nil), rowset=16
      access([t3.c1]), partitions(p0)
      is_index_back=false, is_global_index=false, 
      range_key([t3.c1]), range(MIN ; MAX)always true
  4 - output(nil), filter(nil), rowset=16
      access(nil), partitions(p0)
      is_index_back=false, is_global_index=false, 
      range_key([t4.c1]), range(MIN ; MAX), 
      range_cond([:0 >= t4.c1])
insert into is_c1 select c1 from t3 where c1 < all (select c1 from t4);
select/**/ * from is_c1;
a
rollback;
EXPLAIN insert into is_c1 select /*+NO_REWRITE*/c1 from t3 where c1 < all (select c1 from t4);
Query Plan
================================================================
|ID|OPERATOR             |NAME           |EST.ROWS|EST.TIME(us)|
----------------------------------------------------------------
|0 |INSERT               |               |3       |31          |
|1 |└─SUBPLAN SCAN       |ANONYMOUS_VIEW1|3       |5           |
|2 |  └─SUBPLAN FILTER   |               |3       |5           |
|3 |    ├─TABLE FULL SCAN|t3             |6       |3           |
|4 |    └─TABLE FULL SCAN|t4             |6       |3           |
================================================================
Outputs & filters:
-------------------------------------
  0 - output(nil), filter(nil)
      columns([{is_c1: ({is_c1: (is_c1.__pk_increment, is_c1.a)})}]), partitions(p0), 
      column_values([T_HIDDEN_PK], [column_conv(INT,PS:(11,0),NULL,ANONYMOUS_VIEW1.c1)])
  1 - output([ANONYMOUS_VIEW1.c1]), filter(nil), rowset=16
      access([ANONYMOUS_VIEW1.c1])
  2 - output([t3.c1]), filter([t3.c1 < ALL(subquery(1))]), rowset=16
      exec_params_(nil), onetime_exprs_(nil), init_plan_idxs_([1]), use_batch=false
  3 - output([t3.c1]), filter(nil), rowset=16
      access([t3.c1]), partitions(p0)
      is_index_back=false, is_global_index=false, 
      range_key([t3.c1]), range(MIN ; MAX)always true
  4 - output([t4.c1]), filter(nil), rowset=16
      access([t4.c1]), partitions(p0)
      is_index_back=false, is_global_index=false, 
      range_key([t4.c1]), range(MIN ; MAX)always true
insert into is_c1 select /*+NO_REWRITE*/c1 from t3 where c1 < all (select c1 from t4);
select/**/ * from is_c1;
a
rollback;


# case 10
EXPLAIN select c1 from t3 where c1 > any (select /*+ NO_REWRITE */c1 from t4 where c2 >= some(select /*+ NO_REWRITE */c1 from t5 where t3.c2=t5.c1));
Query Plan
=====================================================
|ID|OPERATOR             |NAME|EST.ROWS|EST.TIME(us)|
-----------------------------------------------------
|0 |SUBPLAN FILTER       |    |2       |219         |
|1 |├─TABLE FULL SCAN    |t3  |6       |3           |
|2 |└─SCALAR GROUP BY    |    |1       |36          |
|3 |  └─SUBPLAN FILTER   |    |3       |36          |
|4 |    ├─TABLE FULL SCAN|t4  |6       |18          |
|5 |    └─TABLE GET      |t5  |1       |18          |
=====================================================
Outputs & filters:
-------------------------------------
  0 - output([t3.c1]), filter([t3.c1 > subquery(1)]), rowset=16
      exec_params_([t3.c2(:0)]), onetime_exprs_(nil), init_plan_idxs_(nil), use_batch=false
  1 - output([t3.c1], [t3.c2]), filter(nil), rowset=16
      access([t3.c1], [t3.c2]), partitions(p0)
      is_index_back=false, is_global_index=false, 
      range_key([t3.c1]), range(MIN ; MAX)always true
  2 - output([T_FUN_MIN(t4.c1)]), filter(nil), rowset=16
      group(nil), agg_func([T_FUN_MIN(t4.c1)])
  3 - output([t4.c1]), filter([t4.c2 >= ANY(subquery(1))]), rowset=16
      exec_params_(nil), onetime_exprs_(nil), init_plan_idxs_([1]), use_batch=false
  4 - output([t4.c1], [t4.c2]), filter(nil), rowset=16
      access([t4.c1], [t4.c2]), partitions(p0)
      is_index_back=false, is_global_index=false, 
      range_key([t4.c1]), range(MIN ; MAX)always true
  5 - output([t5.c1]), filter(nil), rowset=16
      access([t5.c1]), partitions(p0)
      is_index_back=false, is_global_index=false, 
      range_key([t5.c1]), range(MIN ; MAX)always true, 
      range_cond([:0 = t5.c1])
select c1 from t3 where c1 > any (select /*+ NO_REWRITE */c1 from t4 where c2 >= some(select /*+ NO_REWRITE */c1 from t5 where t3.c2=t5.c1));
c1
3
5
EXPLAIN select /*+NO_REWRITE*/c1 from t3 where c1 > any (select c1 from t4 where c2 >= some(select c1 from t5 where t3.c2=t5.c1));
Query Plan
=============================================================
|ID|OPERATOR                     |NAME|EST.ROWS|EST.TIME(us)|
-------------------------------------------------------------
|0 |SUBPLAN FILTER               |    |3       |223         |
|1 |├─TABLE FULL SCAN            |t3  |6       |3           |
|2 |└─NESTED-LOOP JOIN CARTESIAN |    |2       |37          |
|3 |  ├─TABLE GET                |t5  |1       |18          |
|4 |  └─TABLE FULL SCAN          |t4  |2       |18          |
=============================================================
Outputs & filters:
-------------------------------------
  0 - output([t3.c1]), filter([t3.c1 > ANY(subquery(1))]), rowset=16
      exec_params_([t3.c2(:0)]), onetime_exprs_(nil), init_plan_idxs_(nil), use_batch=false
  1 - output([t3.c1], [t3.c2]), filter(nil), rowset=16
      access([t3.c1], [t3.c2]), partitions(p0)
      is_index_back=false, is_global_index=false, 
      range_key([t3.c1]), range(MIN ; MAX)always true
  2 - output([t4.c1]), filter(nil), rowset=16
      conds(nil), nl_params_(nil), use_batch=false
  3 - output(nil), filter(nil), rowset=16
      access(nil), partitions(p0)
      is_index_back=false, is_global_index=false, 
      range_key([t5.c1]), range(MIN ; MAX)always true, 
      range_cond([:0 = t5.c1])
  4 - output([t4.c1]), filter([t4.c2 >= :0]), rowset=16
      access([t4.c1], [t4.c2]), partitions(p0)
      is_index_back=false, is_global_index=false, filter_before_indexback[false], 
      range_key([t4.c1]), range(MIN ; MAX)always true
select /*+NO_REWRITE*/c1 from t3 where c1 > any (select c1 from t4 where c2 >= some(select c1 from t5 where t3.c2=t5.c1));
c1
3
5
EXPLAIN update t3 set c2 = c2 + 1  where c1 < all (select c1 from t4);
Query Plan
========================================================
|ID|OPERATOR                |NAME|EST.ROWS|EST.TIME(us)|
--------------------------------------------------------
|0 |UPDATE                  |    |0       |139         |
|1 |└─NESTED-LOOP ANTI JOIN |    |0       |115         |
|2 |  ├─TABLE FULL SCAN     |t3  |6       |3           |
|3 |  └─TABLE RANGE SCAN    |t4  |1       |18          |
========================================================
Outputs & filters:
-------------------------------------
  0 - output(nil), filter(nil)
      table_columns([{t3: ({t3: (t3.c1, t3.c2)})}]),
      update([t3.c2=column_conv(INT,PS:(11,0),NULL,cast(t3.c2 + 1, INT(-1, 0)))])
  1 - output([t3.c1], [t3.c2]), filter(nil), rowset=16
      conds(nil), nl_params_([t3.c1(:0)]), use_batch=false
  2 - output([t3.c1], [t3.c2]), filter(nil), rowset=16
      access([t3.c1], [t3.c2]), partitions(p0)
      is_index_back=false, is_global_index=false, 
      range_key([t3.c1]), range(MIN ; MAX)always true
  3 - output(nil), filter(nil), rowset=16
      access(nil), partitions(p0)
      is_index_back=false, is_global_index=false, 
      range_key([t4.c1]), range(MIN ; MAX), 
      range_cond([:0 >= t4.c1])
update t3 set c2 = c2 + 1  where c1 < all (select c1 from t4);
select/**/ * from t3;
c1	c2
1	1
2	5
3	2
4	6
5	4
6	7
rollback;
EXPLAIN update /*+NO_REWRITE*/t3 set c2 = c2 + 1  where c1 < all (select c1 from t4);
Query Plan
===================================================
|ID|OPERATOR           |NAME|EST.ROWS|EST.TIME(us)|
---------------------------------------------------
|0 |UPDATE             |    |3       |52          |
|1 |└─SUBPLAN FILTER   |    |3       |6           |
|2 |  ├─TABLE FULL SCAN|t3  |6       |3           |
|3 |  └─TABLE FULL SCAN|t4  |6       |3           |
===================================================
Outputs & filters:
-------------------------------------
  0 - output(nil), filter(nil)
      table_columns([{t3: ({t3: (t3.c1, t3.c2)})}]),
      update([t3.c2=column_conv(INT,PS:(11,0),NULL,cast(t3.c2 + 1, INT(-1, 0)))])
  1 - output([t3.c1], [t3.c2]), filter([t3.c1 < ALL(subquery(1))]), rowset=16
      exec_params_(nil), onetime_exprs_(nil), init_plan_idxs_([1]), use_batch=false
  2 - output([t3.c1], [t3.c2]), filter(nil), rowset=16
      access([t3.c1], [t3.c2]), partitions(p0)
      is_index_back=false, is_global_index=false, 
      range_key([t3.c1]), range(MIN ; MAX)always true
  3 - output([t4.c1]), filter(nil), rowset=16
      access([t4.c1]), partitions(p0)
      is_index_back=false, is_global_index=false, 
      range_key([t4.c1]), range(MIN ; MAX)always true
update /*+NO_REWRITE*/t3 set c2 = c2 + 1  where c1 < all (select c1 from t4);
select/**/ * from t3;
c1	c2
1	1
2	5
3	2
4	6
5	4
6	7
rollback;
EXPLAIN delete from t3  where c1 < all (select c1 from t4);
Query Plan
========================================================
|ID|OPERATOR                |NAME|EST.ROWS|EST.TIME(us)|
--------------------------------------------------------
|0 |DELETE                  |    |0       |122         |
|1 |└─NESTED-LOOP ANTI JOIN |    |0       |115         |
|2 |  ├─TABLE FULL SCAN     |t3  |6       |3           |
|3 |  └─TABLE RANGE SCAN    |t4  |1       |18          |
========================================================
Outputs & filters:
-------------------------------------
  0 - output(nil), filter(nil)
      table_columns([{t3: ({t3: (t3.c1, t3.c2)})}])
  1 - output([t3.c1], [t3.c2]), filter(nil), rowset=16
      conds(nil), nl_params_([t3.c1(:0)]), use_batch=false
  2 - output([t3.c1], [t3.c2]), filter(nil), rowset=16
      access([t3.c1], [t3.c2]), partitions(p0)
      is_index_back=false, is_global_index=false, 
      range_key([t3.c1]), range(MIN ; MAX)always true
  3 - output(nil), filter(nil), rowset=16
      access(nil), partitions(p0)
      is_index_back=false, is_global_index=false, 
      range_key([t4.c1]), range(MIN ; MAX), 
      range_cond([:0 >= t4.c1])
delete from t3  where c1 < all (select c1 from t4);
select/**/ * from t3;
c1	c2
1	1
2	5
3	2
4	6
5	4
6	7
rollback;
EXPLAIN delete /*+NO_REWRITE*/from t3  where c1 < all (select c1 from t4);
Query Plan
===================================================
|ID|OPERATOR           |NAME|EST.ROWS|EST.TIME(us)|
---------------------------------------------------
|0 |DELETE             |    |3       |27          |
|1 |└─SUBPLAN FILTER   |    |3       |6           |
|2 |  ├─TABLE FULL SCAN|t3  |6       |3           |
|3 |  └─TABLE FULL SCAN|t4  |6       |3           |
===================================================
Outputs & filters:
-------------------------------------
  0 - output(nil), filter(nil)
      table_columns([{t3: ({t3: (t3.c1, t3.c2)})}])
  1 - output([t3.c1], [t3.c2]), filter([t3.c1 < ALL(subquery(1))]), rowset=16
      exec_params_(nil), onetime_exprs_(nil), init_plan_idxs_([1]), use_batch=false
  2 - output([t3.c1], [t3.c2]), filter(nil), rowset=16
      access([t3.c1], [t3.c2]), partitions(p0)
      is_index_back=false, is_global_index=false, 
      range_key([t3.c1]), range(MIN ; MAX)always true
  3 - output([t4.c1]), filter(nil), rowset=16
      access([t4.c1]), partitions(p0)
      is_index_back=false, is_global_index=false, 
      range_key([t4.c1]), range(MIN ; MAX)always true
delete /*+NO_REWRITE*/from t3  where c1 < all (select c1 from t4);
select/**/ * from t3;
c1	c2
1	1
2	5
3	2
4	6
5	4
6	7
rollback;
EXPLAIN insert into is_c1 select c1 from t3 where c1 < all (select c1 from t4);
Query Plan
=====================================================================
|ID|OPERATOR                  |NAME           |EST.ROWS|EST.TIME(us)|
---------------------------------------------------------------------
|0 |INSERT                    |               |0       |121         |
|1 |└─SUBPLAN SCAN            |ANONYMOUS_VIEW1|0       |115         |
|2 |  └─NESTED-LOOP ANTI JOIN |               |0       |115         |
|3 |    ├─TABLE FULL SCAN     |t3             |6       |3           |
|4 |    └─TABLE RANGE SCAN    |t4             |1       |18          |
=====================================================================
Outputs & filters:
-------------------------------------
  0 - output(nil), filter(nil)
      columns([{is_c1: ({is_c1: (is_c1.__pk_increment, is_c1.a)})}]), partitions(p0), 
      column_values([T_HIDDEN_PK], [column_conv(INT,PS:(11,0),NULL,ANONYMOUS_VIEW1.c1)])
  1 - output([ANONYMOUS_VIEW1.c1]), filter(nil), rowset=16
      access([ANONYMOUS_VIEW1.c1])
  2 - output([t3.c1]), filter(nil), rowset=16
      conds(nil), nl_params_([t3.c1(:0)]), use_batch=false
  3 - output([t3.c1]), filter(nil), rowset=16
      access([t3.c1]), partitions(p0)
      is_index_back=false, is_global_index=false, 
      range_key([t3.c1]), range(MIN ; MAX)always true
  4 - output(nil), filter(nil), rowset=16
      access(nil), partitions(p0)
      is_index_back=false, is_global_index=false, 
      range_key([t4.c1]), range(MIN ; MAX), 
      range_cond([:0 >= t4.c1])
insert into is_c1 select c1 from t3 where c1 < all (select c1 from t4);
select/**/ * from is_c1;
a
rollback;
EXPLAIN insert into is_c1 select /*+NO_REWRITE*/c1 from t3 where c1 < all (select c1 from t4);
Query Plan
================================================================
|ID|OPERATOR             |NAME           |EST.ROWS|EST.TIME(us)|
----------------------------------------------------------------
|0 |INSERT               |               |3       |31          |
|1 |└─SUBPLAN SCAN       |ANONYMOUS_VIEW1|3       |5           |
|2 |  └─SUBPLAN FILTER   |               |3       |5           |
|3 |    ├─TABLE FULL SCAN|t3             |6       |3           |
|4 |    └─TABLE FULL SCAN|t4             |6       |3           |
================================================================
Outputs & filters:
-------------------------------------
  0 - output(nil), filter(nil)
      columns([{is_c1: ({is_c1: (is_c1.__pk_increment, is_c1.a)})}]), partitions(p0), 
      column_values([T_HIDDEN_PK], [column_conv(INT,PS:(11,0),NULL,ANONYMOUS_VIEW1.c1)])
  1 - output([ANONYMOUS_VIEW1.c1]), filter(nil), rowset=16
      access([ANONYMOUS_VIEW1.c1])
  2 - output([t3.c1]), filter([t3.c1 < ALL(subquery(1))]), rowset=16
      exec_params_(nil), onetime_exprs_(nil), init_plan_idxs_([1]), use_batch=false
  3 - output([t3.c1]), filter(nil), rowset=16
      access([t3.c1]), partitions(p0)
      is_index_back=false, is_global_index=false, 
      range_key([t3.c1]), range(MIN ; MAX)always true
  4 - output([t4.c1]), filter(nil), rowset=16
      access([t4.c1]), partitions(p0)
      is_index_back=false, is_global_index=false, 
      range_key([t4.c1]), range(MIN ; MAX)always true
insert into is_c1 select /*+NO_REWRITE*/c1 from t3 where c1 < all (select c1 from t4);
select/**/ * from is_c1;
a
rollback;


# case 11
EXPLAIN select c1 from t3 group by c1 > any (select c1 from t4);
Query Plan
==============================================================
|ID|OPERATOR                     |NAME |EST.ROWS|EST.TIME(us)|
--------------------------------------------------------------
|0 |HASH GROUP BY                |     |6       |8           |
|1 |└─NESTED-LOOP JOIN CARTESIAN |     |6       |6           |
|2 |  ├─SUBPLAN SCAN             |VIEW1|1       |3           |
|3 |  │ └─SCALAR GROUP BY        |     |1       |3           |
|4 |  │   └─SUBPLAN SCAN         |VIEW2|1       |3           |
|5 |  │     └─TABLE FULL SCAN    |t4   |1       |3           |
|6 |  └─TABLE FULL SCAN          |t3   |6       |3           |
==============================================================
Outputs & filters:
-------------------------------------
  0 - output([t3.c1]), filter(nil), rowset=16
      group([t3.c1 > VIEW1.c1]), agg_func(nil)
  1 - output([t3.c1], [VIEW1.c1]), filter(nil), rowset=16
      conds(nil), nl_params_(nil), use_batch=false
  2 - output([VIEW1.c1]), filter(nil), rowset=16
      access([VIEW1.c1])
  3 - output([T_FUN_MIN(VIEW2.t4.c1)]), filter(nil), rowset=16
      group(nil), agg_func([T_FUN_MIN(VIEW2.t4.c1)])
  4 - output([VIEW2.t4.c1]), filter(nil), rowset=16
      access([VIEW2.t4.c1])
  5 - output([t4.c1]), filter(nil), rowset=16
      access([t4.c1]), partitions(p0)
      limit(1), offset(nil), is_index_back=false, is_global_index=false, 
      range_key([t4.c1]), range(MIN ; MAX)always true
  6 - output([t3.c1]), filter(nil), rowset=16
      access([t3.c1]), partitions(p0)
      is_index_back=false, is_global_index=false, 
      range_key([t3.c1]), range(MIN ; MAX)always true
select c1 from t3 group by c1 > any (select c1 from t4);
c1
1
2
EXPLAIN select /*+NO_REWRITE*/c1 from t3 group by c1 > any (select c1 from t4);
Query Plan
===================================================
|ID|OPERATOR           |NAME|EST.ROWS|EST.TIME(us)|
---------------------------------------------------
|0 |HASH GROUP BY      |    |6       |7           |
|1 |└─SUBPLAN FILTER   |    |6       |5           |
|2 |  ├─TABLE FULL SCAN|t3  |6       |3           |
|3 |  └─TABLE FULL SCAN|t4  |6       |3           |
===================================================
Outputs & filters:
-------------------------------------
  0 - output([t3.c1]), filter(nil), rowset=16
      group([t3.c1 > ANY(subquery(1))]), agg_func(nil)
  1 - output([t3.c1 > ANY(subquery(1))], [t3.c1]), filter(nil), rowset=16
      exec_params_(nil), onetime_exprs_(nil), init_plan_idxs_([1]), use_batch=false
  2 - output([t3.c1]), filter(nil), rowset=16
      access([t3.c1]), partitions(p0)
      is_index_back=false, is_global_index=false, 
      range_key([t3.c1]), range(MIN ; MAX)always true
  3 - output([t4.c1]), filter(nil), rowset=16
      access([t4.c1]), partitions(p0)
      is_index_back=false, is_global_index=false, 
      range_key([t4.c1]), range(MIN ; MAX)always true
select /*+NO_REWRITE*/c1 from t3 group by c1 > any (select c1 from t4);
c1
1
2
EXPLAIN insert into is_c1 select c1 from t3 group by c1 > any (select c1 from t4);
Query Plan
============================================================================
|ID|OPERATOR                         |NAME           |EST.ROWS|EST.TIME(us)|
----------------------------------------------------------------------------
|0 |INSERT                           |               |6       |52          |
|1 |└─SUBPLAN SCAN                   |ANONYMOUS_VIEW1|6       |8           |
|2 |  └─HASH GROUP BY                |               |6       |8           |
|3 |    └─NESTED-LOOP JOIN CARTESIAN |               |6       |6           |
|4 |      ├─SUBPLAN SCAN             |VIEW1          |1       |3           |
|5 |      │ └─SCALAR GROUP BY        |               |1       |3           |
|6 |      │   └─SUBPLAN SCAN         |VIEW2          |1       |3           |
|7 |      │     └─TABLE FULL SCAN    |t4             |1       |3           |
|8 |      └─TABLE FULL SCAN          |t3             |6       |3           |
============================================================================
Outputs & filters:
-------------------------------------
  0 - output(nil), filter(nil)
      columns([{is_c1: ({is_c1: (is_c1.__pk_increment, is_c1.a)})}]), partitions(p0), 
      column_values([T_HIDDEN_PK], [column_conv(INT,PS:(11,0),NULL,ANONYMOUS_VIEW1.c1)])
  1 - output([ANONYMOUS_VIEW1.c1]), filter(nil), rowset=16
      access([ANONYMOUS_VIEW1.c1])
  2 - output([t3.c1]), filter(nil), rowset=16
      group([t3.c1 > VIEW1.c1]), agg_func(nil)
  3 - output([t3.c1], [VIEW1.c1]), filter(nil), rowset=16
      conds(nil), nl_params_(nil), use_batch=false
  4 - output([VIEW1.c1]), filter(nil), rowset=16
      access([VIEW1.c1])
  5 - output([T_FUN_MIN(VIEW2.t4.c1)]), filter(nil), rowset=16
      group(nil), agg_func([T_FUN_MIN(VIEW2.t4.c1)])
  6 - output([VIEW2.t4.c1]), filter(nil), rowset=16
      access([VIEW2.t4.c1])
  7 - output([t4.c1]), filter(nil), rowset=16
      access([t4.c1]), partitions(p0)
      limit(1), offset(nil), is_index_back=false, is_global_index=false, 
      range_key([t4.c1]), range(MIN ; MAX)always true
  8 - output([t3.c1]), filter(nil), rowset=16
      access([t3.c1]), partitions(p0)
      is_index_back=false, is_global_index=false, 
      range_key([t3.c1]), range(MIN ; MAX)always true
insert into is_c1 select c1 from t3 group by c1 > any (select c1 from t4);
select/**/ * from is_c1;
a
1
2
rollback;
EXPLAIN insert into is_c1 select /*+NO_REWRITE*/c1 from t3 group by c1 > any (select c1 from t4);
Query Plan
==================================================================
|ID|OPERATOR               |NAME           |EST.ROWS|EST.TIME(us)|
------------------------------------------------------------------
|0 |INSERT                 |               |6       |52          |
|1 |└─SUBPLAN SCAN         |ANONYMOUS_VIEW1|6       |7           |
|2 |  └─HASH GROUP BY      |               |6       |7           |
|3 |    └─SUBPLAN FILTER   |               |6       |5           |
|4 |      ├─TABLE FULL SCAN|t3             |6       |3           |
|5 |      └─TABLE FULL SCAN|t4             |6       |3           |
==================================================================
Outputs & filters:
-------------------------------------
  0 - output(nil), filter(nil)
      columns([{is_c1: ({is_c1: (is_c1.__pk_increment, is_c1.a)})}]), partitions(p0), 
      column_values([T_HIDDEN_PK], [column_conv(INT,PS:(11,0),NULL,ANONYMOUS_VIEW1.c1)])
  1 - output([ANONYMOUS_VIEW1.c1]), filter(nil), rowset=16
      access([ANONYMOUS_VIEW1.c1])
  2 - output([t3.c1]), filter(nil), rowset=16
      group([t3.c1 > ANY(subquery(1))]), agg_func(nil)
  3 - output([t3.c1 > ANY(subquery(1))], [t3.c1]), filter(nil), rowset=16
      exec_params_(nil), onetime_exprs_(nil), init_plan_idxs_([1]), use_batch=false
  4 - output([t3.c1]), filter(nil), rowset=16
      access([t3.c1]), partitions(p0)
      is_index_back=false, is_global_index=false, 
      range_key([t3.c1]), range(MIN ; MAX)always true
  5 - output([t4.c1]), filter(nil), rowset=16
      access([t4.c1]), partitions(p0)
      is_index_back=false, is_global_index=false, 
      range_key([t4.c1]), range(MIN ; MAX)always true
insert into is_c1 select /*+NO_REWRITE*/c1 from t3 group by c1 > any (select c1 from t4);
select/**/ * from is_c1;
a
1
2
rollback;


# case 12
EXPLAIN select c1 from t3 having c1 < any (select c1 from t4);
Query Plan
==============================================================
|ID|OPERATOR               |NAME       |EST.ROWS|EST.TIME(us)|
--------------------------------------------------------------
|0 |NESTED-LOOP JOIN       |           |1       |19          |
|1 |├─SUBPLAN SCAN         |VIEW2      |1       |3           |
|2 |│ └─SCALAR GROUP BY    |           |1       |3           |
|3 |│   └─SUBPLAN SCAN     |VIEW3      |1       |3           |
|4 |│     └─TABLE FULL SCAN|t4(Reverse)|1       |3           |
|5 |└─TABLE RANGE SCAN     |t3         |2       |16          |
==============================================================
Outputs & filters:
-------------------------------------
  0 - output([t3.c1]), filter(nil), rowset=16
      conds(nil), nl_params_([VIEW2.T_FUN_MAX(VIEW1.c1)(:0)]), use_batch=true
  1 - output([VIEW2.T_FUN_MAX(VIEW1.c1)]), filter(nil), rowset=16
      access([VIEW2.T_FUN_MAX(VIEW1.c1)])
  2 - output([T_FUN_MAX(VIEW3.t4.c1)]), filter(nil), rowset=16
      group(nil), agg_func([T_FUN_MAX(VIEW3.t4.c1)])
  3 - output([VIEW3.t4.c1]), filter(nil), rowset=16
      access([VIEW3.t4.c1])
  4 - output([t4.c1]), filter(nil), rowset=16
      access([t4.c1]), partitions(p0)
      limit(1), offset(nil), is_index_back=false, is_global_index=false, 
      range_key([t4.c1]), range(MIN ; MAX)always true
  5 - output([t3.c1]), filter(nil), rowset=16
      access([GROUP_ID], [t3.c1]), partitions(p0)
      is_index_back=false, is_global_index=false, 
      range_key([t3.c1]), range(MIN ; MAX), 
      range_cond([t3.c1 < :0])
select c1 from t3 having c1 < any (select c1 from t4);
c1
1
2
3
4
5
EXPLAIN select /*+NO_REWRITE*/c1 from t3 having c1 < any (select c1 from t4);
Query Plan
=================================================
|ID|OPERATOR         |NAME|EST.ROWS|EST.TIME(us)|
-------------------------------------------------
|0 |SUBPLAN FILTER   |    |3       |5           |
|1 |├─TABLE FULL SCAN|t3  |6       |3           |
|2 |└─TABLE FULL SCAN|t4  |6       |3           |
=================================================
Outputs & filters:
-------------------------------------
  0 - output([t3.c1]), filter([t3.c1 < ANY(subquery(1))]), rowset=16
      exec_params_(nil), onetime_exprs_(nil), init_plan_idxs_([1]), use_batch=false
  1 - output([t3.c1]), filter(nil), rowset=16
      access([t3.c1]), partitions(p0)
      is_index_back=false, is_global_index=false, 
      range_key([t3.c1]), range(MIN ; MAX)always true
  2 - output([t4.c1]), filter(nil), rowset=16
      access([t4.c1]), partitions(p0)
      is_index_back=false, is_global_index=false, 
      range_key([t4.c1]), range(MIN ; MAX)always true
select /*+NO_REWRITE*/c1 from t3 having c1 < any (select c1 from t4);
c1
1
2
3
4
5
EXPLAIN insert into is_c1 select c1 from t3 having c1 < any (select c1 from t4);
Query Plan
======================================================================
|ID|OPERATOR                   |NAME           |EST.ROWS|EST.TIME(us)|
----------------------------------------------------------------------
|0 |INSERT                     |               |1       |32          |
|1 |└─SUBPLAN SCAN             |ANONYMOUS_VIEW1|1       |19          |
|2 |  └─NESTED-LOOP JOIN       |               |1       |19          |
|3 |    ├─SUBPLAN SCAN         |VIEW2          |1       |3           |
|4 |    │ └─SCALAR GROUP BY    |               |1       |3           |
|5 |    │   └─SUBPLAN SCAN     |VIEW3          |1       |3           |
|6 |    │     └─TABLE FULL SCAN|t4(Reverse)    |1       |3           |
|7 |    └─TABLE RANGE SCAN     |t3             |2       |16          |
======================================================================
Outputs & filters:
-------------------------------------
  0 - output(nil), filter(nil)
      columns([{is_c1: ({is_c1: (is_c1.__pk_increment, is_c1.a)})}]), partitions(p0), 
      column_values([T_HIDDEN_PK], [column_conv(INT,PS:(11,0),NULL,ANONYMOUS_VIEW1.c1)])
  1 - output([ANONYMOUS_VIEW1.c1]), filter(nil), rowset=16
      access([ANONYMOUS_VIEW1.c1])
  2 - output([t3.c1]), filter(nil), rowset=16
      conds(nil), nl_params_([VIEW2.T_FUN_MAX(VIEW1.c1)(:0)]), use_batch=true
  3 - output([VIEW2.T_FUN_MAX(VIEW1.c1)]), filter(nil), rowset=16
      access([VIEW2.T_FUN_MAX(VIEW1.c1)])
  4 - output([T_FUN_MAX(VIEW3.t4.c1)]), filter(nil), rowset=16
      group(nil), agg_func([T_FUN_MAX(VIEW3.t4.c1)])
  5 - output([VIEW3.t4.c1]), filter(nil), rowset=16
      access([VIEW3.t4.c1])
  6 - output([t4.c1]), filter(nil), rowset=16
      access([t4.c1]), partitions(p0)
      limit(1), offset(nil), is_index_back=false, is_global_index=false, 
      range_key([t4.c1]), range(MIN ; MAX)always true
  7 - output([t3.c1]), filter(nil), rowset=16
      access([GROUP_ID], [t3.c1]), partitions(p0)
      is_index_back=false, is_global_index=false, 
      range_key([t3.c1]), range(MIN ; MAX), 
      range_cond([t3.c1 < :0])
insert into is_c1 select c1 from t3 having c1 < any (select c1 from t4);
select/**/ * from is_c1;
a
1
2
3
4
5
rollback;
EXPLAIN insert into is_c1 select /*+NO_REWRITE*/c1 from t3 having c1 < any (select c1 from t4);
Query Plan
================================================================
|ID|OPERATOR             |NAME           |EST.ROWS|EST.TIME(us)|
----------------------------------------------------------------
|0 |INSERT               |               |3       |31          |
|1 |└─SUBPLAN SCAN       |ANONYMOUS_VIEW1|3       |5           |
|2 |  └─SUBPLAN FILTER   |               |3       |5           |
|3 |    ├─TABLE FULL SCAN|t3             |6       |3           |
|4 |    └─TABLE FULL SCAN|t4             |6       |3           |
================================================================
Outputs & filters:
-------------------------------------
  0 - output(nil), filter(nil)
      columns([{is_c1: ({is_c1: (is_c1.__pk_increment, is_c1.a)})}]), partitions(p0), 
      column_values([T_HIDDEN_PK], [column_conv(INT,PS:(11,0),NULL,ANONYMOUS_VIEW1.c1)])
  1 - output([ANONYMOUS_VIEW1.c1]), filter(nil), rowset=16
      access([ANONYMOUS_VIEW1.c1])
  2 - output([t3.c1]), filter([t3.c1 < ANY(subquery(1))]), rowset=16
      exec_params_(nil), onetime_exprs_(nil), init_plan_idxs_([1]), use_batch=false
  3 - output([t3.c1]), filter(nil), rowset=16
      access([t3.c1]), partitions(p0)
      is_index_back=false, is_global_index=false, 
      range_key([t3.c1]), range(MIN ; MAX)always true
  4 - output([t4.c1]), filter(nil), rowset=16
      access([t4.c1]), partitions(p0)
      is_index_back=false, is_global_index=false, 
      range_key([t4.c1]), range(MIN ; MAX)always true
insert into is_c1 select /*+NO_REWRITE*/c1 from t3 having c1 < any (select c1 from t4);
select/**/ * from is_c1;
a
1
2
3
4
5
rollback;


# case 13
EXPLAIN select c1 from t3 order by c1 > all (select c1 from t4);
Query Plan
==============================================================
|ID|OPERATOR               |NAME       |EST.ROWS|EST.TIME(us)|
--------------------------------------------------------------
|0 |SORT                   |           |6       |5           |
|1 |└─SUBPLAN FILTER       |           |6       |5           |
|2 |  ├─TABLE FULL SCAN    |t3         |6       |3           |
|3 |  └─SCALAR GROUP BY    |           |1       |3           |
|4 |    └─SUBPLAN SCAN     |VIEW1      |1       |3           |
|5 |      └─TABLE FULL SCAN|t4(Reverse)|1       |3           |
==============================================================
Outputs & filters:
-------------------------------------
  0 - output([t3.c1]), filter(nil), rowset=16
      sort_keys([t3.c1 > ALL(subquery(1)), ASC])
  1 - output([t3.c1 > ALL(subquery(1))], [t3.c1]), filter(nil), rowset=16
      exec_params_(nil), onetime_exprs_(nil), init_plan_idxs_([1]), use_batch=false
  2 - output([t3.c1]), filter(nil), rowset=16
      access([t3.c1]), partitions(p0)
      is_index_back=false, is_global_index=false, 
      range_key([t3.c1]), range(MIN ; MAX)always true
  3 - output([T_FUN_MAX(VIEW1.t4.c1)]), filter([T_FUN_MAX(VIEW1.t4.c1) IS NOT NULL]), rowset=16
      group(nil), agg_func([T_FUN_MAX(VIEW1.t4.c1)])
  4 - output([VIEW1.t4.c1]), filter(nil), rowset=16
      access([VIEW1.t4.c1])
  5 - output([t4.c1]), filter(nil), rowset=16
      access([t4.c1]), partitions(p0)
      limit(1), offset(nil), is_index_back=false, is_global_index=false, 
      range_key([t4.c1]), range(MIN ; MAX)always true
select c1 from t3 order by c1 > all (select c1 from t4);
c1
1
2
3
4
5
6
EXPLAIN select /*+NO_REWRITE*/c1 from t3 order by c1 > all (select c1 from t4);
Query Plan
===================================================
|ID|OPERATOR           |NAME|EST.ROWS|EST.TIME(us)|
---------------------------------------------------
|0 |SORT               |    |6       |6           |
|1 |└─SUBPLAN FILTER   |    |6       |5           |
|2 |  ├─TABLE FULL SCAN|t3  |6       |3           |
|3 |  └─TABLE FULL SCAN|t4  |6       |3           |
===================================================
Outputs & filters:
-------------------------------------
  0 - output([t3.c1]), filter(nil), rowset=16
      sort_keys([t3.c1 > ALL(subquery(1)), ASC])
  1 - output([t3.c1 > ALL(subquery(1))], [t3.c1]), filter(nil), rowset=16
      exec_params_(nil), onetime_exprs_(nil), init_plan_idxs_([1]), use_batch=false
  2 - output([t3.c1]), filter(nil), rowset=16
      access([t3.c1]), partitions(p0)
      is_index_back=false, is_global_index=false, 
      range_key([t3.c1]), range(MIN ; MAX)always true
  3 - output([t4.c1]), filter(nil), rowset=16
      access([t4.c1]), partitions(p0)
      is_index_back=false, is_global_index=false, 
      range_key([t4.c1]), range(MIN ; MAX)always true
select /*+NO_REWRITE*/c1 from t3 order by c1 > all (select c1 from t4);
c1
1
2
3
4
5
6
EXPLAIN update t3 set c2 = c2 + 1  order by c1 > all (select c1 from t4);
Query Plan
================================================================
|ID|OPERATOR                 |NAME       |EST.ROWS|EST.TIME(us)|
----------------------------------------------------------------
|0 |UPDATE                   |           |6       |75          |
|1 |└─SORT                   |           |6       |6           |
|2 |  └─SUBPLAN FILTER       |           |6       |5           |
|3 |    ├─TABLE FULL SCAN    |t3         |6       |3           |
|4 |    └─SCALAR GROUP BY    |           |1       |3           |
|5 |      └─SUBPLAN SCAN     |VIEW1      |1       |3           |
|6 |        └─TABLE FULL SCAN|t4(Reverse)|1       |3           |
================================================================
Outputs & filters:
-------------------------------------
  0 - output(nil), filter(nil)
      table_columns([{t3: ({t3: (t3.c1, t3.c2)})}]),
      update([t3.c2=column_conv(INT,PS:(11,0),NULL,cast(t3.c2 + 1, INT(-1, 0)))])
  1 - output([t3.c1], [t3.c2]), filter(nil), rowset=16
      sort_keys([t3.c1 > ALL(subquery(1)), ASC])
  2 - output([t3.c1], [t3.c2], [t3.c1 > ALL(subquery(1))]), filter(nil), rowset=16
      exec_params_(nil), onetime_exprs_(nil), init_plan_idxs_([1]), use_batch=false
  3 - output([t3.c1], [t3.c2]), filter(nil), rowset=16
      access([t3.c1], [t3.c2]), partitions(p0)
      is_index_back=false, is_global_index=false, 
      range_key([t3.c1]), range(MIN ; MAX)always true
  4 - output([T_FUN_MAX(VIEW1.t4.c1)]), filter([T_FUN_MAX(VIEW1.t4.c1) IS NOT NULL]), rowset=16
      group(nil), agg_func([T_FUN_MAX(VIEW1.t4.c1)])
  5 - output([VIEW1.t4.c1]), filter(nil), rowset=16
      access([VIEW1.t4.c1])
  6 - output([t4.c1]), filter(nil), rowset=16
      access([t4.c1]), partitions(p0)
      limit(1), offset(nil), is_index_back=false, is_global_index=false, 
      range_key([t4.c1]), range(MIN ; MAX)always true
update t3 set c2 = c2 + 1  order by c1 > all (select c1 from t4);
select/**/ * from t3;
c1	c2
1	2
2	6
3	3
4	7
5	5
6	8
rollback;
EXPLAIN update /*+NO_REWRITE*/t3 set c2 = c2 + 1  order by c1 > all (select c1 from t4);
Query Plan
=====================================================
|ID|OPERATOR             |NAME|EST.ROWS|EST.TIME(us)|
-----------------------------------------------------
|0 |UPDATE               |    |6       |76          |
|1 |└─SORT               |    |6       |6           |
|2 |  └─SUBPLAN FILTER   |    |6       |6           |
|3 |    ├─TABLE FULL SCAN|t3  |6       |3           |
|4 |    └─TABLE FULL SCAN|t4  |6       |3           |
=====================================================
Outputs & filters:
-------------------------------------
  0 - output(nil), filter(nil)
      table_columns([{t3: ({t3: (t3.c1, t3.c2)})}]),
      update([t3.c2=column_conv(INT,PS:(11,0),NULL,cast(t3.c2 + 1, INT(-1, 0)))])
  1 - output([t3.c1], [t3.c2]), filter(nil), rowset=16
      sort_keys([t3.c1 > ALL(subquery(1)), ASC])
  2 - output([t3.c1], [t3.c2], [t3.c1 > ALL(subquery(1))]), filter(nil), rowset=16
      exec_params_(nil), onetime_exprs_(nil), init_plan_idxs_([1]), use_batch=false
  3 - output([t3.c1], [t3.c2]), filter(nil), rowset=16
      access([t3.c1], [t3.c2]), partitions(p0)
      is_index_back=false, is_global_index=false, 
      range_key([t3.c1]), range(MIN ; MAX)always true
  4 - output([t4.c1]), filter(nil), rowset=16
      access([t4.c1]), partitions(p0)
      is_index_back=false, is_global_index=false, 
      range_key([t4.c1]), range(MIN ; MAX)always true
update /*+NO_REWRITE*/t3 set c2 = c2 + 1  order by c1 > all (select c1 from t4);
select/**/ * from t3;
c1	c2
1	2
2	6
3	3
4	7
5	5
6	8
rollback;
EXPLAIN delete from t3  order by c1 > all (select c1 from t4);
Query Plan
================================================================
|ID|OPERATOR                 |NAME       |EST.ROWS|EST.TIME(us)|
----------------------------------------------------------------
|0 |DELETE                   |           |6       |42          |
|1 |└─SORT                   |           |6       |6           |
|2 |  └─SUBPLAN FILTER       |           |6       |5           |
|3 |    ├─TABLE FULL SCAN    |t3         |6       |3           |
|4 |    └─SCALAR GROUP BY    |           |1       |3           |
|5 |      └─SUBPLAN SCAN     |VIEW1      |1       |3           |
|6 |        └─TABLE FULL SCAN|t4(Reverse)|1       |3           |
================================================================
Outputs & filters:
-------------------------------------
  0 - output(nil), filter(nil)
      table_columns([{t3: ({t3: (t3.c1, t3.c2)})}])
  1 - output([t3.c1], [t3.c2]), filter(nil), rowset=16
      sort_keys([t3.c1 > ALL(subquery(1)), ASC])
  2 - output([t3.c1], [t3.c2], [t3.c1 > ALL(subquery(1))]), filter(nil), rowset=16
      exec_params_(nil), onetime_exprs_(nil), init_plan_idxs_([1]), use_batch=false
  3 - output([t3.c1], [t3.c2]), filter(nil), rowset=16
      access([t3.c1], [t3.c2]), partitions(p0)
      is_index_back=false, is_global_index=false, 
      range_key([t3.c1]), range(MIN ; MAX)always true
  4 - output([T_FUN_MAX(VIEW1.t4.c1)]), filter([T_FUN_MAX(VIEW1.t4.c1) IS NOT NULL]), rowset=16
      group(nil), agg_func([T_FUN_MAX(VIEW1.t4.c1)])
  5 - output([VIEW1.t4.c1]), filter(nil), rowset=16
      access([VIEW1.t4.c1])
  6 - output([t4.c1]), filter(nil), rowset=16
      access([t4.c1]), partitions(p0)
      limit(1), offset(nil), is_index_back=false, is_global_index=false, 
      range_key([t4.c1]), range(MIN ; MAX)always true
delete from t3  order by c1 > all (select c1 from t4);
select/**/ * from t3;
c1	c2
rollback;
EXPLAIN delete /*+NO_REWRITE*/from t3  order by c1 > all (select c1 from t4);
Query Plan
=====================================================
|ID|OPERATOR             |NAME|EST.ROWS|EST.TIME(us)|
-----------------------------------------------------
|0 |DELETE               |    |6       |43          |
|1 |└─SORT               |    |6       |6           |
|2 |  └─SUBPLAN FILTER   |    |6       |6           |
|3 |    ├─TABLE FULL SCAN|t3  |6       |3           |
|4 |    └─TABLE FULL SCAN|t4  |6       |3           |
=====================================================
Outputs & filters:
-------------------------------------
  0 - output(nil), filter(nil)
      table_columns([{t3: ({t3: (t3.c1, t3.c2)})}])
  1 - output([t3.c1], [t3.c2]), filter(nil), rowset=16
      sort_keys([t3.c1 > ALL(subquery(1)), ASC])
  2 - output([t3.c1], [t3.c2], [t3.c1 > ALL(subquery(1))]), filter(nil), rowset=16
      exec_params_(nil), onetime_exprs_(nil), init_plan_idxs_([1]), use_batch=false
  3 - output([t3.c1], [t3.c2]), filter(nil), rowset=16
      access([t3.c1], [t3.c2]), partitions(p0)
      is_index_back=false, is_global_index=false, 
      range_key([t3.c1]), range(MIN ; MAX)always true
  4 - output([t4.c1]), filter(nil), rowset=16
      access([t4.c1]), partitions(p0)
      is_index_back=false, is_global_index=false, 
      range_key([t4.c1]), range(MIN ; MAX)always true
delete /*+NO_REWRITE*/from t3  order by c1 > all (select c1 from t4);
select/**/ * from t3;
c1	c2
rollback;
EXPLAIN insert into is_c1 select c1 from t3 order by c1 > all (select c1 from t4);
Query Plan
======================================================================
|ID|OPERATOR                   |NAME           |EST.ROWS|EST.TIME(us)|
----------------------------------------------------------------------
|0 |INSERT                     |               |6       |50          |
|1 |└─SUBPLAN SCAN             |ANONYMOUS_VIEW1|6       |5           |
|2 |  └─SORT                   |               |6       |5           |
|3 |    └─SUBPLAN FILTER       |               |6       |5           |
|4 |      ├─TABLE FULL SCAN    |t3             |6       |3           |
|5 |      └─SCALAR GROUP BY    |               |1       |3           |
|6 |        └─SUBPLAN SCAN     |VIEW1          |1       |3           |
|7 |          └─TABLE FULL SCAN|t4(Reverse)    |1       |3           |
======================================================================
Outputs & filters:
-------------------------------------
  0 - output(nil), filter(nil)
      columns([{is_c1: ({is_c1: (is_c1.__pk_increment, is_c1.a)})}]), partitions(p0), 
      column_values([T_HIDDEN_PK], [column_conv(INT,PS:(11,0),NULL,ANONYMOUS_VIEW1.c1)])
  1 - output([ANONYMOUS_VIEW1.c1]), filter(nil), rowset=16
      access([ANONYMOUS_VIEW1.c1])
  2 - output([t3.c1]), filter(nil), rowset=16
      sort_keys([t3.c1 > ALL(subquery(1)), ASC])
  3 - output([t3.c1 > ALL(subquery(1))], [t3.c1]), filter(nil), rowset=16
      exec_params_(nil), onetime_exprs_(nil), init_plan_idxs_([1]), use_batch=false
  4 - output([t3.c1]), filter(nil), rowset=16
      access([t3.c1]), partitions(p0)
      is_index_back=false, is_global_index=false, 
      range_key([t3.c1]), range(MIN ; MAX)always true
  5 - output([T_FUN_MAX(VIEW1.t4.c1)]), filter([T_FUN_MAX(VIEW1.t4.c1) IS NOT NULL]), rowset=16
      group(nil), agg_func([T_FUN_MAX(VIEW1.t4.c1)])
  6 - output([VIEW1.t4.c1]), filter(nil), rowset=16
      access([VIEW1.t4.c1])
  7 - output([t4.c1]), filter(nil), rowset=16
      access([t4.c1]), partitions(p0)
      limit(1), offset(nil), is_index_back=false, is_global_index=false, 
      range_key([t4.c1]), range(MIN ; MAX)always true
insert into is_c1 select c1 from t3 order by c1 > all (select c1 from t4);
select/**/ * from is_c1;
a
1
2
3
4
5
6
rollback;
EXPLAIN insert into is_c1 select /*+NO_REWRITE*/c1 from t3 order by c1 > all (select c1 from t4);
Query Plan
==================================================================
|ID|OPERATOR               |NAME           |EST.ROWS|EST.TIME(us)|
------------------------------------------------------------------
|0 |INSERT                 |               |6       |50          |
|1 |└─SUBPLAN SCAN         |ANONYMOUS_VIEW1|6       |6           |
|2 |  └─SORT               |               |6       |6           |
|3 |    └─SUBPLAN FILTER   |               |6       |5           |
|4 |      ├─TABLE FULL SCAN|t3             |6       |3           |
|5 |      └─TABLE FULL SCAN|t4             |6       |3           |
==================================================================
Outputs & filters:
-------------------------------------
  0 - output(nil), filter(nil)
      columns([{is_c1: ({is_c1: (is_c1.__pk_increment, is_c1.a)})}]), partitions(p0), 
      column_values([T_HIDDEN_PK], [column_conv(INT,PS:(11,0),NULL,ANONYMOUS_VIEW1.c1)])
  1 - output([ANONYMOUS_VIEW1.c1]), filter(nil), rowset=16
      access([ANONYMOUS_VIEW1.c1])
  2 - output([t3.c1]), filter(nil), rowset=16
      sort_keys([t3.c1 > ALL(subquery(1)), ASC])
  3 - output([t3.c1 > ALL(subquery(1))], [t3.c1]), filter(nil), rowset=16
      exec_params_(nil), onetime_exprs_(nil), init_plan_idxs_([1]), use_batch=false
  4 - output([t3.c1]), filter(nil), rowset=16
      access([t3.c1]), partitions(p0)
      is_index_back=false, is_global_index=false, 
      range_key([t3.c1]), range(MIN ; MAX)always true
  5 - output([t4.c1]), filter(nil), rowset=16
      access([t4.c1]), partitions(p0)
      is_index_back=false, is_global_index=false, 
      range_key([t4.c1]), range(MIN ; MAX)always true
insert into is_c1 select /*+NO_REWRITE*/c1 from t3 order by c1 > all (select c1 from t4);
select/**/ * from is_c1;
a
1
2
3
4
5
6
rollback;


# case 14
EXPLAIN select c1 from t3 order by c1 < all (select c1 from t4);
Query Plan
========================================================
|ID|OPERATOR               |NAME |EST.ROWS|EST.TIME(us)|
--------------------------------------------------------
|0 |SORT                   |     |6       |5           |
|1 |└─SUBPLAN FILTER       |     |6       |5           |
|2 |  ├─TABLE FULL SCAN    |t3   |6       |3           |
|3 |  └─SCALAR GROUP BY    |     |1       |3           |
|4 |    └─SUBPLAN SCAN     |VIEW1|1       |3           |
|5 |      └─TABLE FULL SCAN|t4   |1       |3           |
========================================================
Outputs & filters:
-------------------------------------
  0 - output([t3.c1]), filter(nil), rowset=16
      sort_keys([t3.c1 < ALL(subquery(1)), ASC])
  1 - output([t3.c1 < ALL(subquery(1))], [t3.c1]), filter(nil), rowset=16
      exec_params_(nil), onetime_exprs_(nil), init_plan_idxs_([1]), use_batch=false
  2 - output([t3.c1]), filter(nil), rowset=16
      access([t3.c1]), partitions(p0)
      is_index_back=false, is_global_index=false, 
      range_key([t3.c1]), range(MIN ; MAX)always true
  3 - output([T_FUN_MIN(VIEW1.t4.c1)]), filter([T_FUN_MIN(VIEW1.t4.c1) IS NOT NULL]), rowset=16
      group(nil), agg_func([T_FUN_MIN(VIEW1.t4.c1)])
  4 - output([VIEW1.t4.c1]), filter(nil), rowset=16
      access([VIEW1.t4.c1])
  5 - output([t4.c1]), filter(nil), rowset=16
      access([t4.c1]), partitions(p0)
      limit(1), offset(nil), is_index_back=false, is_global_index=false, 
      range_key([t4.c1]), range(MIN ; MAX)always true
select c1 from t3 order by c1 < all (select c1 from t4);
c1
1
2
3
4
5
6
EXPLAIN select /*+NO_REWRITE*/c1 from t3 order by c1 < all (select c1 from t4);
Query Plan
===================================================
|ID|OPERATOR           |NAME|EST.ROWS|EST.TIME(us)|
---------------------------------------------------
|0 |SORT               |    |6       |6           |
|1 |└─SUBPLAN FILTER   |    |6       |5           |
|2 |  ├─TABLE FULL SCAN|t3  |6       |3           |
|3 |  └─TABLE FULL SCAN|t4  |6       |3           |
===================================================
Outputs & filters:
-------------------------------------
  0 - output([t3.c1]), filter(nil), rowset=16
      sort_keys([t3.c1 < ALL(subquery(1)), ASC])
  1 - output([t3.c1 < ALL(subquery(1))], [t3.c1]), filter(nil), rowset=16
      exec_params_(nil), onetime_exprs_(nil), init_plan_idxs_([1]), use_batch=false
  2 - output([t3.c1]), filter(nil), rowset=16
      access([t3.c1]), partitions(p0)
      is_index_back=false, is_global_index=false, 
      range_key([t3.c1]), range(MIN ; MAX)always true
  3 - output([t4.c1]), filter(nil), rowset=16
      access([t4.c1]), partitions(p0)
      is_index_back=false, is_global_index=false, 
      range_key([t4.c1]), range(MIN ; MAX)always true
select /*+NO_REWRITE*/c1 from t3 order by c1 < all (select c1 from t4);
c1
1
2
3
4
5
6
EXPLAIN update t3 set c2 = c2 + 1  order by c1 < all (select c1 from t4);
Query Plan
==========================================================
|ID|OPERATOR                 |NAME |EST.ROWS|EST.TIME(us)|
----------------------------------------------------------
|0 |UPDATE                   |     |6       |75          |
|1 |└─SORT                   |     |6       |6           |
|2 |  └─SUBPLAN FILTER       |     |6       |5           |
|3 |    ├─TABLE FULL SCAN    |t3   |6       |3           |
|4 |    └─SCALAR GROUP BY    |     |1       |3           |
|5 |      └─SUBPLAN SCAN     |VIEW1|1       |3           |
|6 |        └─TABLE FULL SCAN|t4   |1       |3           |
==========================================================
Outputs & filters:
-------------------------------------
  0 - output(nil), filter(nil)
      table_columns([{t3: ({t3: (t3.c1, t3.c2)})}]),
      update([t3.c2=column_conv(INT,PS:(11,0),NULL,cast(t3.c2 + 1, INT(-1, 0)))])
  1 - output([t3.c1], [t3.c2]), filter(nil), rowset=16
      sort_keys([t3.c1 < ALL(subquery(1)), ASC])
  2 - output([t3.c1], [t3.c2], [t3.c1 < ALL(subquery(1))]), filter(nil), rowset=16
      exec_params_(nil), onetime_exprs_(nil), init_plan_idxs_([1]), use_batch=false
  3 - output([t3.c1], [t3.c2]), filter(nil), rowset=16
      access([t3.c1], [t3.c2]), partitions(p0)
      is_index_back=false, is_global_index=false, 
      range_key([t3.c1]), range(MIN ; MAX)always true
  4 - output([T_FUN_MIN(VIEW1.t4.c1)]), filter([T_FUN_MIN(VIEW1.t4.c1) IS NOT NULL]), rowset=16
      group(nil), agg_func([T_FUN_MIN(VIEW1.t4.c1)])
  5 - output([VIEW1.t4.c1]), filter(nil), rowset=16
      access([VIEW1.t4.c1])
  6 - output([t4.c1]), filter(nil), rowset=16
      access([t4.c1]), partitions(p0)
      limit(1), offset(nil), is_index_back=false, is_global_index=false, 
      range_key([t4.c1]), range(MIN ; MAX)always true
update t3 set c2 = c2 + 1  order by c1 < all (select c1 from t4);
select/**/ * from t3;
c1	c2
1	2
2	6
3	3
4	7
5	5
6	8
rollback;
EXPLAIN update /*+NO_REWRITE*/t3 set c2 = c2 + 1  order by c1 < all (select c1 from t4);
Query Plan
=====================================================
|ID|OPERATOR             |NAME|EST.ROWS|EST.TIME(us)|
-----------------------------------------------------
|0 |UPDATE               |    |6       |76          |
|1 |└─SORT               |    |6       |6           |
|2 |  └─SUBPLAN FILTER   |    |6       |6           |
|3 |    ├─TABLE FULL SCAN|t3  |6       |3           |
|4 |    └─TABLE FULL SCAN|t4  |6       |3           |
=====================================================
Outputs & filters:
-------------------------------------
  0 - output(nil), filter(nil)
      table_columns([{t3: ({t3: (t3.c1, t3.c2)})}]),
      update([t3.c2=column_conv(INT,PS:(11,0),NULL,cast(t3.c2 + 1, INT(-1, 0)))])
  1 - output([t3.c1], [t3.c2]), filter(nil), rowset=16
      sort_keys([t3.c1 < ALL(subquery(1)), ASC])
  2 - output([t3.c1], [t3.c2], [t3.c1 < ALL(subquery(1))]), filter(nil), rowset=16
      exec_params_(nil), onetime_exprs_(nil), init_plan_idxs_([1]), use_batch=false
  3 - output([t3.c1], [t3.c2]), filter(nil), rowset=16
      access([t3.c1], [t3.c2]), partitions(p0)
      is_index_back=false, is_global_index=false, 
      range_key([t3.c1]), range(MIN ; MAX)always true
  4 - output([t4.c1]), filter(nil), rowset=16
      access([t4.c1]), partitions(p0)
      is_index_back=false, is_global_index=false, 
      range_key([t4.c1]), range(MIN ; MAX)always true
update /*+NO_REWRITE*/t3 set c2 = c2 + 1  order by c1 < all (select c1 from t4);
select/**/ * from t3;
c1	c2
1	2
2	6
3	3
4	7
5	5
6	8
rollback;
EXPLAIN delete from t3  order by c1 < all (select c1 from t4);
Query Plan
==========================================================
|ID|OPERATOR                 |NAME |EST.ROWS|EST.TIME(us)|
----------------------------------------------------------
|0 |DELETE                   |     |6       |42          |
|1 |└─SORT                   |     |6       |6           |
|2 |  └─SUBPLAN FILTER       |     |6       |5           |
|3 |    ├─TABLE FULL SCAN    |t3   |6       |3           |
|4 |    └─SCALAR GROUP BY    |     |1       |3           |
|5 |      └─SUBPLAN SCAN     |VIEW1|1       |3           |
|6 |        └─TABLE FULL SCAN|t4   |1       |3           |
==========================================================
Outputs & filters:
-------------------------------------
  0 - output(nil), filter(nil)
      table_columns([{t3: ({t3: (t3.c1, t3.c2)})}])
  1 - output([t3.c1], [t3.c2]), filter(nil), rowset=16
      sort_keys([t3.c1 < ALL(subquery(1)), ASC])
  2 - output([t3.c1], [t3.c2], [t3.c1 < ALL(subquery(1))]), filter(nil), rowset=16
      exec_params_(nil), onetime_exprs_(nil), init_plan_idxs_([1]), use_batch=false
  3 - output([t3.c1], [t3.c2]), filter(nil), rowset=16
      access([t3.c1], [t3.c2]), partitions(p0)
      is_index_back=false, is_global_index=false, 
      range_key([t3.c1]), range(MIN ; MAX)always true
  4 - output([T_FUN_MIN(VIEW1.t4.c1)]), filter([T_FUN_MIN(VIEW1.t4.c1) IS NOT NULL]), rowset=16
      group(nil), agg_func([T_FUN_MIN(VIEW1.t4.c1)])
  5 - output([VIEW1.t4.c1]), filter(nil), rowset=16
      access([VIEW1.t4.c1])
  6 - output([t4.c1]), filter(nil), rowset=16
      access([t4.c1]), partitions(p0)
      limit(1), offset(nil), is_index_back=false, is_global_index=false, 
      range_key([t4.c1]), range(MIN ; MAX)always true
delete from t3  order by c1 < all (select c1 from t4);
select/**/ * from t3;
c1	c2
rollback;
EXPLAIN delete /*+NO_REWRITE*/from t3  order by c1 < all (select c1 from t4);
Query Plan
=====================================================
|ID|OPERATOR             |NAME|EST.ROWS|EST.TIME(us)|
-----------------------------------------------------
|0 |DELETE               |    |6       |43          |
|1 |└─SORT               |    |6       |6           |
|2 |  └─SUBPLAN FILTER   |    |6       |6           |
|3 |    ├─TABLE FULL SCAN|t3  |6       |3           |
|4 |    └─TABLE FULL SCAN|t4  |6       |3           |
=====================================================
Outputs & filters:
-------------------------------------
  0 - output(nil), filter(nil)
      table_columns([{t3: ({t3: (t3.c1, t3.c2)})}])
  1 - output([t3.c1], [t3.c2]), filter(nil), rowset=16
      sort_keys([t3.c1 < ALL(subquery(1)), ASC])
  2 - output([t3.c1], [t3.c2], [t3.c1 < ALL(subquery(1))]), filter(nil), rowset=16
      exec_params_(nil), onetime_exprs_(nil), init_plan_idxs_([1]), use_batch=false
  3 - output([t3.c1], [t3.c2]), filter(nil), rowset=16
      access([t3.c1], [t3.c2]), partitions(p0)
      is_index_back=false, is_global_index=false, 
      range_key([t3.c1]), range(MIN ; MAX)always true
  4 - output([t4.c1]), filter(nil), rowset=16
      access([t4.c1]), partitions(p0)
      is_index_back=false, is_global_index=false, 
      range_key([t4.c1]), range(MIN ; MAX)always true
delete /*+NO_REWRITE*/from t3  order by c1 < all (select c1 from t4);
select/**/ * from t3;
c1	c2
rollback;
EXPLAIN insert into is_c1 select c1 from t3 order by c1 < all (select c1 from t4);
Query Plan
======================================================================
|ID|OPERATOR                   |NAME           |EST.ROWS|EST.TIME(us)|
----------------------------------------------------------------------
|0 |INSERT                     |               |6       |50          |
|1 |└─SUBPLAN SCAN             |ANONYMOUS_VIEW1|6       |5           |
|2 |  └─SORT                   |               |6       |5           |
|3 |    └─SUBPLAN FILTER       |               |6       |5           |
|4 |      ├─TABLE FULL SCAN    |t3             |6       |3           |
|5 |      └─SCALAR GROUP BY    |               |1       |3           |
|6 |        └─SUBPLAN SCAN     |VIEW1          |1       |3           |
|7 |          └─TABLE FULL SCAN|t4             |1       |3           |
======================================================================
Outputs & filters:
-------------------------------------
  0 - output(nil), filter(nil)
      columns([{is_c1: ({is_c1: (is_c1.__pk_increment, is_c1.a)})}]), partitions(p0), 
      column_values([T_HIDDEN_PK], [column_conv(INT,PS:(11,0),NULL,ANONYMOUS_VIEW1.c1)])
  1 - output([ANONYMOUS_VIEW1.c1]), filter(nil), rowset=16
      access([ANONYMOUS_VIEW1.c1])
  2 - output([t3.c1]), filter(nil), rowset=16
      sort_keys([t3.c1 < ALL(subquery(1)), ASC])
  3 - output([t3.c1 < ALL(subquery(1))], [t3.c1]), filter(nil), rowset=16
      exec_params_(nil), onetime_exprs_(nil), init_plan_idxs_([1]), use_batch=false
  4 - output([t3.c1]), filter(nil), rowset=16
      access([t3.c1]), partitions(p0)
      is_index_back=false, is_global_index=false, 
      range_key([t3.c1]), range(MIN ; MAX)always true
  5 - output([T_FUN_MIN(VIEW1.t4.c1)]), filter([T_FUN_MIN(VIEW1.t4.c1) IS NOT NULL]), rowset=16
      group(nil), agg_func([T_FUN_MIN(VIEW1.t4.c1)])
  6 - output([VIEW1.t4.c1]), filter(nil), rowset=16
      access([VIEW1.t4.c1])
  7 - output([t4.c1]), filter(nil), rowset=16
      access([t4.c1]), partitions(p0)
      limit(1), offset(nil), is_index_back=false, is_global_index=false, 
      range_key([t4.c1]), range(MIN ; MAX)always true
insert into is_c1 select c1 from t3 order by c1 < all (select c1 from t4);
select/**/ * from is_c1;
a
1
2
3
4
5
6
rollback;
EXPLAIN insert into is_c1 select /*+NO_REWRITE*/c1 from t3 order by c1 < all (select c1 from t4);
Query Plan
==================================================================
|ID|OPERATOR               |NAME           |EST.ROWS|EST.TIME(us)|
------------------------------------------------------------------
|0 |INSERT                 |               |6       |50          |
|1 |└─SUBPLAN SCAN         |ANONYMOUS_VIEW1|6       |6           |
|2 |  └─SORT               |               |6       |6           |
|3 |    └─SUBPLAN FILTER   |               |6       |5           |
|4 |      ├─TABLE FULL SCAN|t3             |6       |3           |
|5 |      └─TABLE FULL SCAN|t4             |6       |3           |
==================================================================
Outputs & filters:
-------------------------------------
  0 - output(nil), filter(nil)
      columns([{is_c1: ({is_c1: (is_c1.__pk_increment, is_c1.a)})}]), partitions(p0), 
      column_values([T_HIDDEN_PK], [column_conv(INT,PS:(11,0),NULL,ANONYMOUS_VIEW1.c1)])
  1 - output([ANONYMOUS_VIEW1.c1]), filter(nil), rowset=16
      access([ANONYMOUS_VIEW1.c1])
  2 - output([t3.c1]), filter(nil), rowset=16
      sort_keys([t3.c1 < ALL(subquery(1)), ASC])
  3 - output([t3.c1 < ALL(subquery(1))], [t3.c1]), filter(nil), rowset=16
      exec_params_(nil), onetime_exprs_(nil), init_plan_idxs_([1]), use_batch=false
  4 - output([t3.c1]), filter(nil), rowset=16
      access([t3.c1]), partitions(p0)
      is_index_back=false, is_global_index=false, 
      range_key([t3.c1]), range(MIN ; MAX)always true
  5 - output([t4.c1]), filter(nil), rowset=16
      access([t4.c1]), partitions(p0)
      is_index_back=false, is_global_index=false, 
      range_key([t4.c1]), range(MIN ; MAX)always true
insert into is_c1 select /*+NO_REWRITE*/c1 from t3 order by c1 < all (select c1 from t4);
select/**/ * from is_c1;
a
1
2
3
4
5
6
rollback;


# case 15
EXPLAIN select c1 from t3 where c1 > any (select c1 from t4 having c1 > 1);
Query Plan
=========================================================
|ID|OPERATOR                |NAME |EST.ROWS|EST.TIME(us)|
---------------------------------------------------------
|0 |NESTED-LOOP JOIN        |     |1       |19          |
|1 |├─SUBPLAN SCAN          |VIEW2|1       |3           |
|2 |│ └─SCALAR GROUP BY     |     |1       |3           |
|3 |│   └─SUBPLAN SCAN      |VIEW3|1       |3           |
|4 |│     └─TABLE RANGE SCAN|t4   |1       |3           |
|5 |└─TABLE RANGE SCAN      |t3   |2       |16          |
=========================================================
Outputs & filters:
-------------------------------------
  0 - output([t3.c1]), filter(nil), rowset=16
      conds(nil), nl_params_([VIEW2.T_FUN_MIN(VIEW1.c1)(:0)]), use_batch=true
  1 - output([VIEW2.T_FUN_MIN(VIEW1.c1)]), filter(nil), rowset=16
      access([VIEW2.T_FUN_MIN(VIEW1.c1)])
  2 - output([T_FUN_MIN(VIEW3.t4.c1)]), filter(nil), rowset=16
      group(nil), agg_func([T_FUN_MIN(VIEW3.t4.c1)])
  3 - output([VIEW3.t4.c1]), filter(nil), rowset=16
      access([VIEW3.t4.c1])
  4 - output([t4.c1]), filter(nil), rowset=16
      access([t4.c1]), partitions(p0)
      limit(1), offset(nil), is_index_back=false, is_global_index=false, 
      range_key([t4.c1]), range(1 ; MAX), 
      range_cond([t4.c1 > 1])
  5 - output([t3.c1]), filter(nil), rowset=16
      access([GROUP_ID], [t3.c1]), partitions(p0)
      is_index_back=false, is_global_index=false, 
      range_key([t3.c1]), range(MIN ; MAX), 
      range_cond([t3.c1 > :0])
select c1 from t3 where c1 > any (select c1 from t4 having c1 > 1);
c1
3
4
5
6
EXPLAIN select /*+NO_REWRITE*/c1 from t3 where c1 > any (select c1 from t4 having c1 > 1);
Query Plan
==================================================
|ID|OPERATOR          |NAME|EST.ROWS|EST.TIME(us)|
--------------------------------------------------
|0 |SUBPLAN FILTER    |    |3       |5           |
|1 |├─TABLE FULL SCAN |t3  |6       |3           |
|2 |└─TABLE RANGE SCAN|t4  |5       |3           |
==================================================
Outputs & filters:
-------------------------------------
  0 - output([t3.c1]), filter([t3.c1 > ANY(subquery(1))]), rowset=16
      exec_params_(nil), onetime_exprs_(nil), init_plan_idxs_([1]), use_batch=false
  1 - output([t3.c1]), filter(nil), rowset=16
      access([t3.c1]), partitions(p0)
      is_index_back=false, is_global_index=false, 
      range_key([t3.c1]), range(MIN ; MAX)always true
  2 - output([t4.c1]), filter(nil), rowset=16
      access([t4.c1]), partitions(p0)
      is_index_back=false, is_global_index=false, 
      range_key([t4.c1]), range(1 ; MAX), 
      range_cond([t4.c1 > 1])
select /*+NO_REWRITE*/c1 from t3 where c1 > any (select c1 from t4 having c1 > 1);
c1
3
4
5
6
EXPLAIN update t3 set c2 = c2 + 1  where c1 > any (select c1 from t4 having c1 > 1);
Query Plan
===========================================================
|ID|OPERATOR                  |NAME |EST.ROWS|EST.TIME(us)|
-----------------------------------------------------------
|0 |UPDATE                    |     |1       |50          |
|1 |└─NESTED-LOOP JOIN        |     |1       |19          |
|2 |  ├─SUBPLAN SCAN          |VIEW2|1       |3           |
|3 |  │ └─SCALAR GROUP BY     |     |1       |3           |
|4 |  │   └─SUBPLAN SCAN      |VIEW3|1       |3           |
|5 |  │     └─TABLE RANGE SCAN|t4   |1       |3           |
|6 |  └─TABLE RANGE SCAN      |t3   |2       |16          |
===========================================================
Outputs & filters:
-------------------------------------
  0 - output(nil), filter(nil)
      table_columns([{t3: ({t3: (t3.c1, t3.c2)}), hash_distinct}]),
      update([t3.c2=column_conv(INT,PS:(11,0),NULL,cast(t3.c2 + 1, INT(-1, 0)))])
  1 - output([t3.c1], [t3.c2]), filter(nil), rowset=16
      conds(nil), nl_params_([VIEW2.T_FUN_MIN(VIEW1.c1)(:0)]), use_batch=true
  2 - output([VIEW2.T_FUN_MIN(VIEW1.c1)]), filter(nil), rowset=16
      access([VIEW2.T_FUN_MIN(VIEW1.c1)])
  3 - output([T_FUN_MIN(VIEW3.t4.c1)]), filter(nil), rowset=16
      group(nil), agg_func([T_FUN_MIN(VIEW3.t4.c1)])
  4 - output([VIEW3.t4.c1]), filter(nil), rowset=16
      access([VIEW3.t4.c1])
  5 - output([t4.c1]), filter(nil), rowset=16
      access([t4.c1]), partitions(p0)
      limit(1), offset(nil), is_index_back=false, is_global_index=false, 
      range_key([t4.c1]), range(1 ; MAX), 
      range_cond([t4.c1 > 1])
  6 - output([t3.c1], [t3.c2]), filter(nil), rowset=16
      access([GROUP_ID], [t3.c1], [t3.c2]), partitions(p0)
      is_index_back=false, is_global_index=false, 
      range_key([t3.c1]), range(MIN ; MAX), 
      range_cond([t3.c1 > :0])
update t3 set c2 = c2 + 1  where c1 > any (select c1 from t4 having c1 > 1);
select/**/ * from t3;
c1	c2
1	1
2	5
3	3
4	7
5	5
6	8
rollback;
EXPLAIN update /*+NO_REWRITE*/t3 set c2 = c2 + 1  where c1 > any (select c1 from t4 having c1 > 1);
Query Plan
====================================================
|ID|OPERATOR            |NAME|EST.ROWS|EST.TIME(us)|
----------------------------------------------------
|0 |UPDATE              |    |3       |52          |
|1 |└─SUBPLAN FILTER    |    |3       |5           |
|2 |  ├─TABLE FULL SCAN |t3  |6       |3           |
|3 |  └─TABLE RANGE SCAN|t4  |5       |3           |
====================================================
Outputs & filters:
-------------------------------------
  0 - output(nil), filter(nil)
      table_columns([{t3: ({t3: (t3.c1, t3.c2)})}]),
      update([t3.c2=column_conv(INT,PS:(11,0),NULL,cast(t3.c2 + 1, INT(-1, 0)))])
  1 - output([t3.c1], [t3.c2]), filter([t3.c1 > ANY(subquery(1))]), rowset=16
      exec_params_(nil), onetime_exprs_(nil), init_plan_idxs_([1]), use_batch=false
  2 - output([t3.c1], [t3.c2]), filter(nil), rowset=16
      access([t3.c1], [t3.c2]), partitions(p0)
      is_index_back=false, is_global_index=false, 
      range_key([t3.c1]), range(MIN ; MAX)always true
  3 - output([t4.c1]), filter(nil), rowset=16
      access([t4.c1]), partitions(p0)
      is_index_back=false, is_global_index=false, 
      range_key([t4.c1]), range(1 ; MAX), 
      range_cond([t4.c1 > 1])
update /*+NO_REWRITE*/t3 set c2 = c2 + 1  where c1 > any (select c1 from t4 having c1 > 1);
select/**/ * from t3;
c1	c2
1	1
2	5
3	3
4	7
5	5
6	8
rollback;
EXPLAIN delete from t3  where c1 > any (select c1 from t4 having c1 > 1);
Query Plan
===========================================================
|ID|OPERATOR                  |NAME |EST.ROWS|EST.TIME(us)|
-----------------------------------------------------------
|0 |DELETE                    |     |1       |30          |
|1 |└─NESTED-LOOP JOIN        |     |1       |19          |
|2 |  ├─SUBPLAN SCAN          |VIEW2|1       |3           |
|3 |  │ └─SCALAR GROUP BY     |     |1       |3           |
|4 |  │   └─SUBPLAN SCAN      |VIEW3|1       |3           |
|5 |  │     └─TABLE RANGE SCAN|t4   |1       |3           |
|6 |  └─TABLE RANGE SCAN      |t3   |2       |16          |
===========================================================
Outputs & filters:
-------------------------------------
  0 - output(nil), filter(nil)
      table_columns([{t3: ({t3: (t3.c1, t3.c2)}), hash_distinct}])
  1 - output([t3.c1], [t3.c2]), filter(nil), rowset=16
      conds(nil), nl_params_([VIEW2.T_FUN_MIN(VIEW1.c1)(:0)]), use_batch=true
  2 - output([VIEW2.T_FUN_MIN(VIEW1.c1)]), filter(nil), rowset=16
      access([VIEW2.T_FUN_MIN(VIEW1.c1)])
  3 - output([T_FUN_MIN(VIEW3.t4.c1)]), filter(nil), rowset=16
      group(nil), agg_func([T_FUN_MIN(VIEW3.t4.c1)])
  4 - output([VIEW3.t4.c1]), filter(nil), rowset=16
      access([VIEW3.t4.c1])
  5 - output([t4.c1]), filter(nil), rowset=16
      access([t4.c1]), partitions(p0)
      limit(1), offset(nil), is_index_back=false, is_global_index=false, 
      range_key([t4.c1]), range(1 ; MAX), 
      range_cond([t4.c1 > 1])
  6 - output([t3.c1], [t3.c2]), filter(nil), rowset=16
      access([GROUP_ID], [t3.c1], [t3.c2]), partitions(p0)
      is_index_back=false, is_global_index=false, 
      range_key([t3.c1]), range(MIN ; MAX), 
      range_cond([t3.c1 > :0])
delete from t3  where c1 > any (select c1 from t4 having c1 > 1);
select/**/ * from t3;
c1	c2
1	1
2	5
rollback;
EXPLAIN delete /*+NO_REWRITE*/from t3  where c1 > any (select c1 from t4 having c1 > 1);
Query Plan
====================================================
|ID|OPERATOR            |NAME|EST.ROWS|EST.TIME(us)|
----------------------------------------------------
|0 |DELETE              |    |3       |27          |
|1 |└─SUBPLAN FILTER    |    |3       |5           |
|2 |  ├─TABLE FULL SCAN |t3  |6       |3           |
|3 |  └─TABLE RANGE SCAN|t4  |5       |3           |
====================================================
Outputs & filters:
-------------------------------------
  0 - output(nil), filter(nil)
      table_columns([{t3: ({t3: (t3.c1, t3.c2)})}])
  1 - output([t3.c1], [t3.c2]), filter([t3.c1 > ANY(subquery(1))]), rowset=16
      exec_params_(nil), onetime_exprs_(nil), init_plan_idxs_([1]), use_batch=false
  2 - output([t3.c1], [t3.c2]), filter(nil), rowset=16
      access([t3.c1], [t3.c2]), partitions(p0)
      is_index_back=false, is_global_index=false, 
      range_key([t3.c1]), range(MIN ; MAX)always true
  3 - output([t4.c1]), filter(nil), rowset=16
      access([t4.c1]), partitions(p0)
      is_index_back=false, is_global_index=false, 
      range_key([t4.c1]), range(1 ; MAX), 
      range_cond([t4.c1 > 1])
delete /*+NO_REWRITE*/from t3  where c1 > any (select c1 from t4 having c1 > 1);
select/**/ * from t3;
c1	c2
1	1
2	5
rollback;
EXPLAIN insert into is_c1 select c1 from t3 where c1 > any (select c1 from t4 having c1 > 1);
Query Plan
=======================================================================
|ID|OPERATOR                    |NAME           |EST.ROWS|EST.TIME(us)|
-----------------------------------------------------------------------
|0 |INSERT                      |               |1       |32          |
|1 |└─SUBPLAN SCAN              |ANONYMOUS_VIEW1|1       |19          |
|2 |  └─NESTED-LOOP JOIN        |               |1       |19          |
|3 |    ├─SUBPLAN SCAN          |VIEW2          |1       |3           |
|4 |    │ └─SCALAR GROUP BY     |               |1       |3           |
|5 |    │   └─SUBPLAN SCAN      |VIEW3          |1       |3           |
|6 |    │     └─TABLE RANGE SCAN|t4             |1       |3           |
|7 |    └─TABLE RANGE SCAN      |t3             |2       |16          |
=======================================================================
Outputs & filters:
-------------------------------------
  0 - output(nil), filter(nil)
      columns([{is_c1: ({is_c1: (is_c1.__pk_increment, is_c1.a)})}]), partitions(p0), 
      column_values([T_HIDDEN_PK], [column_conv(INT,PS:(11,0),NULL,ANONYMOUS_VIEW1.c1)])
  1 - output([ANONYMOUS_VIEW1.c1]), filter(nil), rowset=16
      access([ANONYMOUS_VIEW1.c1])
  2 - output([t3.c1]), filter(nil), rowset=16
      conds(nil), nl_params_([VIEW2.T_FUN_MIN(VIEW1.c1)(:0)]), use_batch=true
  3 - output([VIEW2.T_FUN_MIN(VIEW1.c1)]), filter(nil), rowset=16
      access([VIEW2.T_FUN_MIN(VIEW1.c1)])
  4 - output([T_FUN_MIN(VIEW3.t4.c1)]), filter(nil), rowset=16
      group(nil), agg_func([T_FUN_MIN(VIEW3.t4.c1)])
  5 - output([VIEW3.t4.c1]), filter(nil), rowset=16
      access([VIEW3.t4.c1])
  6 - output([t4.c1]), filter(nil), rowset=16
      access([t4.c1]), partitions(p0)
      limit(1), offset(nil), is_index_back=false, is_global_index=false, 
      range_key([t4.c1]), range(1 ; MAX), 
      range_cond([t4.c1 > 1])
  7 - output([t3.c1]), filter(nil), rowset=16
      access([GROUP_ID], [t3.c1]), partitions(p0)
      is_index_back=false, is_global_index=false, 
      range_key([t3.c1]), range(MIN ; MAX), 
      range_cond([t3.c1 > :0])
insert into is_c1 select c1 from t3 where c1 > any (select c1 from t4 having c1 > 1);
select/**/ * from is_c1;
a
3
4
5
6
rollback;
EXPLAIN insert into is_c1 select /*+NO_REWRITE*/c1 from t3 where c1 > any (select c1 from t4 having c1 > 1);
Query Plan
=================================================================
|ID|OPERATOR              |NAME           |EST.ROWS|EST.TIME(us)|
-----------------------------------------------------------------
|0 |INSERT                |               |3       |31          |
|1 |└─SUBPLAN SCAN        |ANONYMOUS_VIEW1|3       |5           |
|2 |  └─SUBPLAN FILTER    |               |3       |5           |
|3 |    ├─TABLE FULL SCAN |t3             |6       |3           |
|4 |    └─TABLE RANGE SCAN|t4             |5       |3           |
=================================================================
Outputs & filters:
-------------------------------------
  0 - output(nil), filter(nil)
      columns([{is_c1: ({is_c1: (is_c1.__pk_increment, is_c1.a)})}]), partitions(p0), 
      column_values([T_HIDDEN_PK], [column_conv(INT,PS:(11,0),NULL,ANONYMOUS_VIEW1.c1)])
  1 - output([ANONYMOUS_VIEW1.c1]), filter(nil), rowset=16
      access([ANONYMOUS_VIEW1.c1])
  2 - output([t3.c1]), filter([t3.c1 > ANY(subquery(1))]), rowset=16
      exec_params_(nil), onetime_exprs_(nil), init_plan_idxs_([1]), use_batch=false
  3 - output([t3.c1]), filter(nil), rowset=16
      access([t3.c1]), partitions(p0)
      is_index_back=false, is_global_index=false, 
      range_key([t3.c1]), range(MIN ; MAX)always true
  4 - output([t4.c1]), filter(nil), rowset=16
      access([t4.c1]), partitions(p0)
      is_index_back=false, is_global_index=false, 
      range_key([t4.c1]), range(1 ; MAX), 
      range_cond([t4.c1 > 1])
insert into is_c1 select /*+NO_REWRITE*/c1 from t3 where c1 > any (select c1 from t4 having c1 > 1);
select/**/ * from is_c1;
a
3
4
5
6
rollback;


# case 16
EXPLAIN select c1 from t3 where c1 + 1 > any (select c1 from t4);
Query Plan
======================================================
|ID|OPERATOR              |NAME|EST.ROWS|EST.TIME(us)|
------------------------------------------------------
|0 |NESTED-LOOP SEMI JOIN |    |6       |115         |
|1 |├─TABLE FULL SCAN     |t3  |6       |3           |
|2 |└─TABLE RANGE SCAN    |t4  |1       |18          |
======================================================
Outputs & filters:
-------------------------------------
  0 - output([t3.c1]), filter(nil), rowset=16
      conds(nil), nl_params_([t3.c1(:0)]), use_batch=false
  1 - output([t3.c1]), filter(nil), rowset=16
      access([t3.c1]), partitions(p0)
      is_index_back=false, is_global_index=false, 
      range_key([t3.c1]), range(MIN ; MAX)always true
  2 - output(nil), filter(nil), rowset=16
      access(nil), partitions(p0)
      is_index_back=false, is_global_index=false, 
      range_key([t4.c1]), range(MIN ; MAX), 
      range_cond([:0 + 1 > t4.c1])
select c1 from t3 where c1 + 1 > any (select c1 from t4);
c1
1
2
3
4
5
6
EXPLAIN select /*+NO_REWRITE*/c1 from t3 where c1 + 1 > any (select c1 from t4);
Query Plan
=================================================
|ID|OPERATOR         |NAME|EST.ROWS|EST.TIME(us)|
-------------------------------------------------
|0 |SUBPLAN FILTER   |    |3       |5           |
|1 |├─TABLE FULL SCAN|t3  |6       |3           |
|2 |└─TABLE FULL SCAN|t4  |6       |3           |
=================================================
Outputs & filters:
-------------------------------------
  0 - output([t3.c1]), filter([t3.c1 + 1 > ANY(subquery(1))]), rowset=16
      exec_params_(nil), onetime_exprs_(nil), init_plan_idxs_([1]), use_batch=false
  1 - output([t3.c1]), filter(nil), rowset=16
      access([t3.c1]), partitions(p0)
      is_index_back=false, is_global_index=false, 
      range_key([t3.c1]), range(MIN ; MAX)always true
  2 - output([t4.c1]), filter(nil), rowset=16
      access([t4.c1]), partitions(p0)
      is_index_back=false, is_global_index=false, 
      range_key([t4.c1]), range(MIN ; MAX)always true
select /*+NO_REWRITE*/c1 from t3 where c1 + 1 > any (select c1 from t4);
c1
1
2
3
4
5
6
EXPLAIN update t3 set c2 = c2 + 1  where c1 + 1 > any (select c1 from t4);
Query Plan
========================================================
|ID|OPERATOR                |NAME|EST.ROWS|EST.TIME(us)|
--------------------------------------------------------
|0 |UPDATE                  |    |6       |185         |
|1 |└─NESTED-LOOP SEMI JOIN |    |6       |115         |
|2 |  ├─TABLE FULL SCAN     |t3  |6       |3           |
|3 |  └─TABLE RANGE SCAN    |t4  |1       |18          |
========================================================
Outputs & filters:
-------------------------------------
  0 - output(nil), filter(nil)
      table_columns([{t3: ({t3: (t3.c1, t3.c2)})}]),
      update([t3.c2=column_conv(INT,PS:(11,0),NULL,cast(t3.c2 + 1, INT(-1, 0)))])
  1 - output([t3.c1], [t3.c2]), filter(nil), rowset=16
      conds(nil), nl_params_([t3.c1(:0)]), use_batch=false
  2 - output([t3.c1], [t3.c2]), filter(nil), rowset=16
      access([t3.c1], [t3.c2]), partitions(p0)
      is_index_back=false, is_global_index=false, 
      range_key([t3.c1]), range(MIN ; MAX)always true
  3 - output(nil), filter(nil), rowset=16
      access(nil), partitions(p0)
      is_index_back=false, is_global_index=false, 
      range_key([t4.c1]), range(MIN ; MAX), 
      range_cond([:0 + 1 > t4.c1])
update t3 set c2 = c2 + 1  where c1 + 1 > any (select c1 from t4);
select/**/ * from t3;
c1	c2
1	2
2	6
3	3
4	7
5	5
6	8
rollback;
EXPLAIN update /*+NO_REWRITE*/t3 set c2 = c2 + 1  where c1 + 1 > any (select c1 from t4);
Query Plan
===================================================
|ID|OPERATOR           |NAME|EST.ROWS|EST.TIME(us)|
---------------------------------------------------
|0 |UPDATE             |    |3       |52          |
|1 |└─SUBPLAN FILTER   |    |3       |6           |
|2 |  ├─TABLE FULL SCAN|t3  |6       |3           |
|3 |  └─TABLE FULL SCAN|t4  |6       |3           |
===================================================
Outputs & filters:
-------------------------------------
  0 - output(nil), filter(nil)
      table_columns([{t3: ({t3: (t3.c1, t3.c2)})}]),
      update([t3.c2=column_conv(INT,PS:(11,0),NULL,cast(t3.c2 + 1, INT(-1, 0)))])
  1 - output([t3.c1], [t3.c2]), filter([t3.c1 + 1 > ANY(subquery(1))]), rowset=16
      exec_params_(nil), onetime_exprs_(nil), init_plan_idxs_([1]), use_batch=false
  2 - output([t3.c1], [t3.c2]), filter(nil), rowset=16
      access([t3.c1], [t3.c2]), partitions(p0)
      is_index_back=false, is_global_index=false, 
      range_key([t3.c1]), range(MIN ; MAX)always true
  3 - output([t4.c1]), filter(nil), rowset=16
      access([t4.c1]), partitions(p0)
      is_index_back=false, is_global_index=false, 
      range_key([t4.c1]), range(MIN ; MAX)always true
update /*+NO_REWRITE*/t3 set c2 = c2 + 1  where c1 + 1 > any (select c1 from t4);
select/**/ * from t3;
c1	c2
1	2
2	6
3	3
4	7
5	5
6	8
rollback;
EXPLAIN delete from t3  where c1 + 1 > any (select c1 from t4);
Query Plan
========================================================
|ID|OPERATOR                |NAME|EST.ROWS|EST.TIME(us)|
--------------------------------------------------------
|0 |DELETE                  |    |6       |152         |
|1 |└─NESTED-LOOP SEMI JOIN |    |6       |115         |
|2 |  ├─TABLE FULL SCAN     |t3  |6       |3           |
|3 |  └─TABLE RANGE SCAN    |t4  |1       |18          |
========================================================
Outputs & filters:
-------------------------------------
  0 - output(nil), filter(nil)
      table_columns([{t3: ({t3: (t3.c1, t3.c2)})}])
  1 - output([t3.c1], [t3.c2]), filter(nil), rowset=16
      conds(nil), nl_params_([t3.c1(:0)]), use_batch=false
  2 - output([t3.c1], [t3.c2]), filter(nil), rowset=16
      access([t3.c1], [t3.c2]), partitions(p0)
      is_index_back=false, is_global_index=false, 
      range_key([t3.c1]), range(MIN ; MAX)always true
  3 - output(nil), filter(nil), rowset=16
      access(nil), partitions(p0)
      is_index_back=false, is_global_index=false, 
      range_key([t4.c1]), range(MIN ; MAX), 
      range_cond([:0 + 1 > t4.c1])
delete from t3  where c1 + 1 > any (select c1 from t4);
select/**/ * from t3;
c1	c2
rollback;
EXPLAIN delete /*+NO_REWRITE*/from t3  where c1 + 1 > any (select c1 from t4);
Query Plan
===================================================
|ID|OPERATOR           |NAME|EST.ROWS|EST.TIME(us)|
---------------------------------------------------
|0 |DELETE             |    |3       |27          |
|1 |└─SUBPLAN FILTER   |    |3       |6           |
|2 |  ├─TABLE FULL SCAN|t3  |6       |3           |
|3 |  └─TABLE FULL SCAN|t4  |6       |3           |
===================================================
Outputs & filters:
-------------------------------------
  0 - output(nil), filter(nil)
      table_columns([{t3: ({t3: (t3.c1, t3.c2)})}])
  1 - output([t3.c1], [t3.c2]), filter([t3.c1 + 1 > ANY(subquery(1))]), rowset=16
      exec_params_(nil), onetime_exprs_(nil), init_plan_idxs_([1]), use_batch=false
  2 - output([t3.c1], [t3.c2]), filter(nil), rowset=16
      access([t3.c1], [t3.c2]), partitions(p0)
      is_index_back=false, is_global_index=false, 
      range_key([t3.c1]), range(MIN ; MAX)always true
  3 - output([t4.c1]), filter(nil), rowset=16
      access([t4.c1]), partitions(p0)
      is_index_back=false, is_global_index=false, 
      range_key([t4.c1]), range(MIN ; MAX)always true
delete /*+NO_REWRITE*/from t3  where c1 + 1 > any (select c1 from t4);
select/**/ * from t3;
c1	c2
rollback;
EXPLAIN insert into is_c1 select c1 from t3 where c1 + 1 > any (select c1 from t4);
Query Plan
=====================================================================
|ID|OPERATOR                  |NAME           |EST.ROWS|EST.TIME(us)|
---------------------------------------------------------------------
|0 |INSERT                    |               |6       |160         |
|1 |└─SUBPLAN SCAN            |ANONYMOUS_VIEW1|6       |115         |
|2 |  └─NESTED-LOOP SEMI JOIN |               |6       |115         |
|3 |    ├─TABLE FULL SCAN     |t3             |6       |3           |
|4 |    └─TABLE RANGE SCAN    |t4             |1       |18          |
=====================================================================
Outputs & filters:
-------------------------------------
  0 - output(nil), filter(nil)
      columns([{is_c1: ({is_c1: (is_c1.__pk_increment, is_c1.a)})}]), partitions(p0), 
      column_values([T_HIDDEN_PK], [column_conv(INT,PS:(11,0),NULL,ANONYMOUS_VIEW1.c1)])
  1 - output([ANONYMOUS_VIEW1.c1]), filter(nil), rowset=16
      access([ANONYMOUS_VIEW1.c1])
  2 - output([t3.c1]), filter(nil), rowset=16
      conds(nil), nl_params_([t3.c1(:0)]), use_batch=false
  3 - output([t3.c1]), filter(nil), rowset=16
      access([t3.c1]), partitions(p0)
      is_index_back=false, is_global_index=false, 
      range_key([t3.c1]), range(MIN ; MAX)always true
  4 - output(nil), filter(nil), rowset=16
      access(nil), partitions(p0)
      is_index_back=false, is_global_index=false, 
      range_key([t4.c1]), range(MIN ; MAX), 
      range_cond([:0 + 1 > t4.c1])
insert into is_c1 select c1 from t3 where c1 + 1 > any (select c1 from t4);
select/**/ * from is_c1;
a
1
2
3
4
5
6
rollback;
EXPLAIN insert into is_c1 select /*+NO_REWRITE*/c1 from t3 where c1 + 1 > any (select c1 from t4);
Query Plan
================================================================
|ID|OPERATOR             |NAME           |EST.ROWS|EST.TIME(us)|
----------------------------------------------------------------
|0 |INSERT               |               |3       |31          |
|1 |└─SUBPLAN SCAN       |ANONYMOUS_VIEW1|3       |5           |
|2 |  └─SUBPLAN FILTER   |               |3       |5           |
|3 |    ├─TABLE FULL SCAN|t3             |6       |3           |
|4 |    └─TABLE FULL SCAN|t4             |6       |3           |
================================================================
Outputs & filters:
-------------------------------------
  0 - output(nil), filter(nil)
      columns([{is_c1: ({is_c1: (is_c1.__pk_increment, is_c1.a)})}]), partitions(p0), 
      column_values([T_HIDDEN_PK], [column_conv(INT,PS:(11,0),NULL,ANONYMOUS_VIEW1.c1)])
  1 - output([ANONYMOUS_VIEW1.c1]), filter(nil), rowset=16
      access([ANONYMOUS_VIEW1.c1])
  2 - output([t3.c1]), filter([t3.c1 + 1 > ANY(subquery(1))]), rowset=16
      exec_params_(nil), onetime_exprs_(nil), init_plan_idxs_([1]), use_batch=false
  3 - output([t3.c1]), filter(nil), rowset=16
      access([t3.c1]), partitions(p0)
      is_index_back=false, is_global_index=false, 
      range_key([t3.c1]), range(MIN ; MAX)always true
  4 - output([t4.c1]), filter(nil), rowset=16
      access([t4.c1]), partitions(p0)
      is_index_back=false, is_global_index=false, 
      range_key([t4.c1]), range(MIN ; MAX)always true
insert into is_c1 select /*+NO_REWRITE*/c1 from t3 where c1 + 1 > any (select c1 from t4);
select/**/ * from is_c1;
a
1
2
3
4
5
6
rollback;


# case 17
EXPLAIN select c1 from t3 where abs(c1) < some (select c1 from t4);
Query Plan
======================================================
|ID|OPERATOR              |NAME|EST.ROWS|EST.TIME(us)|
------------------------------------------------------
|0 |NESTED-LOOP SEMI JOIN |    |2       |115         |
|1 |├─TABLE FULL SCAN     |t3  |6       |3           |
|2 |└─TABLE RANGE SCAN    |t4  |1       |18          |
======================================================
Outputs & filters:
-------------------------------------
  0 - output([t3.c1]), filter(nil), rowset=16
      conds(nil), nl_params_([t3.c1(:0)]), use_batch=false
  1 - output([t3.c1]), filter(nil), rowset=16
      access([t3.c1]), partitions(p0)
      is_index_back=false, is_global_index=false, 
      range_key([t3.c1]), range(MIN ; MAX)always true
  2 - output(nil), filter(nil), rowset=16
      access(nil), partitions(p0)
      is_index_back=false, is_global_index=false, 
      range_key([t4.c1]), range(MIN ; MAX), 
      range_cond([abs(cast(:0, BIGINT(-1, 0))) < t4.c1])
select c1 from t3 where abs(c1) < some (select c1 from t4);
c1
1
2
3
4
5
EXPLAIN select /*+NO_REWRITE*/c1 from t3 where abs(c1) < some (select c1 from t4);
Query Plan
=================================================
|ID|OPERATOR         |NAME|EST.ROWS|EST.TIME(us)|
-------------------------------------------------
|0 |SUBPLAN FILTER   |    |3       |5           |
|1 |├─TABLE FULL SCAN|t3  |6       |3           |
|2 |└─TABLE FULL SCAN|t4  |6       |3           |
=================================================
Outputs & filters:
-------------------------------------
  0 - output([t3.c1]), filter([abs(cast(t3.c1, BIGINT(-1, 0))) < ANY(subquery(1))]), rowset=16
      exec_params_(nil), onetime_exprs_(nil), init_plan_idxs_([1]), use_batch=false
  1 - output([t3.c1]), filter(nil), rowset=16
      access([t3.c1]), partitions(p0)
      is_index_back=false, is_global_index=false, 
      range_key([t3.c1]), range(MIN ; MAX)always true
  2 - output([t4.c1]), filter(nil), rowset=16
      access([t4.c1]), partitions(p0)
      is_index_back=false, is_global_index=false, 
      range_key([t4.c1]), range(MIN ; MAX)always true
select /*+NO_REWRITE*/c1 from t3 where abs(c1) < some (select c1 from t4);
c1
1
2
3
4
5
EXPLAIN update t3 set c2 = c2 + 1  where abs(c1) < some (select c1 from t4);
Query Plan
========================================================
|ID|OPERATOR                |NAME|EST.ROWS|EST.TIME(us)|
--------------------------------------------------------
|0 |UPDATE                  |    |2       |154         |
|1 |└─NESTED-LOOP SEMI JOIN |    |2       |115         |
|2 |  ├─TABLE FULL SCAN     |t3  |6       |3           |
|3 |  └─TABLE RANGE SCAN    |t4  |1       |18          |
========================================================
Outputs & filters:
-------------------------------------
  0 - output(nil), filter(nil)
      table_columns([{t3: ({t3: (t3.c1, t3.c2)})}]),
      update([t3.c2=column_conv(INT,PS:(11,0),NULL,cast(t3.c2 + 1, INT(-1, 0)))])
  1 - output([t3.c1], [t3.c2]), filter(nil), rowset=16
      conds(nil), nl_params_([t3.c1(:0)]), use_batch=false
  2 - output([t3.c1], [t3.c2]), filter(nil), rowset=16
      access([t3.c1], [t3.c2]), partitions(p0)
      is_index_back=false, is_global_index=false, 
      range_key([t3.c1]), range(MIN ; MAX)always true
  3 - output(nil), filter(nil), rowset=16
      access(nil), partitions(p0)
      is_index_back=false, is_global_index=false, 
      range_key([t4.c1]), range(MIN ; MAX), 
      range_cond([abs(cast(:0, BIGINT(-1, 0))) < t4.c1])
update t3 set c2 = c2 + 1  where abs(c1) < some (select c1 from t4);
select/**/ * from t3;
c1	c2
1	2
2	6
3	3
4	7
5	5
6	7
rollback;
EXPLAIN update /*+NO_REWRITE*/t3 set c2 = c2 + 1  where abs(c1) < some (select c1 from t4);
Query Plan
===================================================
|ID|OPERATOR           |NAME|EST.ROWS|EST.TIME(us)|
---------------------------------------------------
|0 |UPDATE             |    |3       |52          |
|1 |└─SUBPLAN FILTER   |    |3       |6           |
|2 |  ├─TABLE FULL SCAN|t3  |6       |3           |
|3 |  └─TABLE FULL SCAN|t4  |6       |3           |
===================================================
Outputs & filters:
-------------------------------------
  0 - output(nil), filter(nil)
      table_columns([{t3: ({t3: (t3.c1, t3.c2)})}]),
      update([t3.c2=column_conv(INT,PS:(11,0),NULL,cast(t3.c2 + 1, INT(-1, 0)))])
  1 - output([t3.c1], [t3.c2]), filter([abs(cast(t3.c1, BIGINT(-1, 0))) < ANY(subquery(1))]), rowset=16
      exec_params_(nil), onetime_exprs_(nil), init_plan_idxs_([1]), use_batch=false
  2 - output([t3.c1], [t3.c2]), filter(nil), rowset=16
      access([t3.c1], [t3.c2]), partitions(p0)
      is_index_back=false, is_global_index=false, 
      range_key([t3.c1]), range(MIN ; MAX)always true
  3 - output([t4.c1]), filter(nil), rowset=16
      access([t4.c1]), partitions(p0)
      is_index_back=false, is_global_index=false, 
      range_key([t4.c1]), range(MIN ; MAX)always true
update /*+NO_REWRITE*/t3 set c2 = c2 + 1  where abs(c1) < some (select c1 from t4);
select/**/ * from t3;
c1	c2
1	2
2	6
3	3
4	7
5	5
6	7
rollback;
EXPLAIN delete from t3  where abs(c1) < some (select c1 from t4);
Query Plan
========================================================
|ID|OPERATOR                |NAME|EST.ROWS|EST.TIME(us)|
--------------------------------------------------------
|0 |DELETE                  |    |2       |132         |
|1 |└─NESTED-LOOP SEMI JOIN |    |2       |115         |
|2 |  ├─TABLE FULL SCAN     |t3  |6       |3           |
|3 |  └─TABLE RANGE SCAN    |t4  |1       |18          |
========================================================
Outputs & filters:
-------------------------------------
  0 - output(nil), filter(nil)
      table_columns([{t3: ({t3: (t3.c1, t3.c2)})}])
  1 - output([t3.c1], [t3.c2]), filter(nil), rowset=16
      conds(nil), nl_params_([t3.c1(:0)]), use_batch=false
  2 - output([t3.c1], [t3.c2]), filter(nil), rowset=16
      access([t3.c1], [t3.c2]), partitions(p0)
      is_index_back=false, is_global_index=false, 
      range_key([t3.c1]), range(MIN ; MAX)always true
  3 - output(nil), filter(nil), rowset=16
      access(nil), partitions(p0)
      is_index_back=false, is_global_index=false, 
      range_key([t4.c1]), range(MIN ; MAX), 
      range_cond([abs(cast(:0, BIGINT(-1, 0))) < t4.c1])
delete from t3  where abs(c1) < some (select c1 from t4);
select/**/ * from t3;
c1	c2
6	7
rollback;
EXPLAIN delete /*+NO_REWRITE*/from t3  where abs(c1) < some (select c1 from t4);
Query Plan
===================================================
|ID|OPERATOR           |NAME|EST.ROWS|EST.TIME(us)|
---------------------------------------------------
|0 |DELETE             |    |3       |27          |
|1 |└─SUBPLAN FILTER   |    |3       |6           |
|2 |  ├─TABLE FULL SCAN|t3  |6       |3           |
|3 |  └─TABLE FULL SCAN|t4  |6       |3           |
===================================================
Outputs & filters:
-------------------------------------
  0 - output(nil), filter(nil)
      table_columns([{t3: ({t3: (t3.c1, t3.c2)})}])
  1 - output([t3.c1], [t3.c2]), filter([abs(cast(t3.c1, BIGINT(-1, 0))) < ANY(subquery(1))]), rowset=16
      exec_params_(nil), onetime_exprs_(nil), init_plan_idxs_([1]), use_batch=false
  2 - output([t3.c1], [t3.c2]), filter(nil), rowset=16
      access([t3.c1], [t3.c2]), partitions(p0)
      is_index_back=false, is_global_index=false, 
      range_key([t3.c1]), range(MIN ; MAX)always true
  3 - output([t4.c1]), filter(nil), rowset=16
      access([t4.c1]), partitions(p0)
      is_index_back=false, is_global_index=false, 
      range_key([t4.c1]), range(MIN ; MAX)always true
delete /*+NO_REWRITE*/from t3  where abs(c1) < some (select c1 from t4);
select/**/ * from t3;
c1	c2
6	7
rollback;
EXPLAIN insert into is_c1 select c1 from t3 where abs(c1) < some (select c1 from t4);
Query Plan
=====================================================================
|ID|OPERATOR                  |NAME           |EST.ROWS|EST.TIME(us)|
---------------------------------------------------------------------
|0 |INSERT                    |               |2       |134         |
|1 |└─SUBPLAN SCAN            |ANONYMOUS_VIEW1|2       |115         |
|2 |  └─NESTED-LOOP SEMI JOIN |               |2       |115         |
|3 |    ├─TABLE FULL SCAN     |t3             |6       |3           |
|4 |    └─TABLE RANGE SCAN    |t4             |1       |18          |
=====================================================================
Outputs & filters:
-------------------------------------
  0 - output(nil), filter(nil)
      columns([{is_c1: ({is_c1: (is_c1.__pk_increment, is_c1.a)})}]), partitions(p0), 
      column_values([T_HIDDEN_PK], [column_conv(INT,PS:(11,0),NULL,ANONYMOUS_VIEW1.c1)])
  1 - output([ANONYMOUS_VIEW1.c1]), filter(nil), rowset=16
      access([ANONYMOUS_VIEW1.c1])
  2 - output([t3.c1]), filter(nil), rowset=16
      conds(nil), nl_params_([t3.c1(:0)]), use_batch=false
  3 - output([t3.c1]), filter(nil), rowset=16
      access([t3.c1]), partitions(p0)
      is_index_back=false, is_global_index=false, 
      range_key([t3.c1]), range(MIN ; MAX)always true
  4 - output(nil), filter(nil), rowset=16
      access(nil), partitions(p0)
      is_index_back=false, is_global_index=false, 
      range_key([t4.c1]), range(MIN ; MAX), 
      range_cond([abs(cast(:0, BIGINT(-1, 0))) < t4.c1])
insert into is_c1 select c1 from t3 where abs(c1) < some (select c1 from t4);
select/**/ * from is_c1;
a
1
2
3
4
5
rollback;
EXPLAIN insert into is_c1 select /*+NO_REWRITE*/c1 from t3 where abs(c1) < some (select c1 from t4);
Query Plan
================================================================
|ID|OPERATOR             |NAME           |EST.ROWS|EST.TIME(us)|
----------------------------------------------------------------
|0 |INSERT               |               |3       |31          |
|1 |└─SUBPLAN SCAN       |ANONYMOUS_VIEW1|3       |5           |
|2 |  └─SUBPLAN FILTER   |               |3       |5           |
|3 |    ├─TABLE FULL SCAN|t3             |6       |3           |
|4 |    └─TABLE FULL SCAN|t4             |6       |3           |
================================================================
Outputs & filters:
-------------------------------------
  0 - output(nil), filter(nil)
      columns([{is_c1: ({is_c1: (is_c1.__pk_increment, is_c1.a)})}]), partitions(p0), 
      column_values([T_HIDDEN_PK], [column_conv(INT,PS:(11,0),NULL,ANONYMOUS_VIEW1.c1)])
  1 - output([ANONYMOUS_VIEW1.c1]), filter(nil), rowset=16
      access([ANONYMOUS_VIEW1.c1])
  2 - output([t3.c1]), filter([abs(cast(t3.c1, BIGINT(-1, 0))) < ANY(subquery(1))]), rowset=16
      exec_params_(nil), onetime_exprs_(nil), init_plan_idxs_([1]), use_batch=false
  3 - output([t3.c1]), filter(nil), rowset=16
      access([t3.c1]), partitions(p0)
      is_index_back=false, is_global_index=false, 
      range_key([t3.c1]), range(MIN ; MAX)always true
  4 - output([t4.c1]), filter(nil), rowset=16
      access([t4.c1]), partitions(p0)
      is_index_back=false, is_global_index=false, 
      range_key([t4.c1]), range(MIN ; MAX)always true
insert into is_c1 select /*+NO_REWRITE*/c1 from t3 where abs(c1) < some (select c1 from t4);
select/**/ * from is_c1;
a
1
2
3
4
5
rollback;


# case 18
EXPLAIN select c1 from t3 where c1 + (1 < any (select c1 from t4));
Query Plan
==============================================================
|ID|OPERATOR               |NAME       |EST.ROWS|EST.TIME(us)|
--------------------------------------------------------------
|0 |NESTED-LOOP JOIN       |           |3       |6           |
|1 |├─SUBPLAN SCAN         |VIEW1      |1       |3           |
|2 |│ └─SCALAR GROUP BY    |           |1       |3           |
|3 |│   └─SUBPLAN SCAN     |VIEW2      |1       |3           |
|4 |│     └─TABLE FULL SCAN|t4(Reverse)|1       |3           |
|5 |└─TABLE FULL SCAN      |t3         |6       |3           |
==============================================================
Outputs & filters:
-------------------------------------
  0 - output([t3.c1]), filter(nil), rowset=16
      conds([t3.c1 + 1 < VIEW1.c1]), nl_params_(nil), use_batch=false
  1 - output([VIEW1.c1]), filter(nil), rowset=16
      access([VIEW1.c1])
  2 - output([T_FUN_MAX(VIEW2.t4.c1)]), filter(nil), rowset=16
      group(nil), agg_func([T_FUN_MAX(VIEW2.t4.c1)])
  3 - output([VIEW2.t4.c1]), filter(nil), rowset=16
      access([VIEW2.t4.c1])
  4 - output([t4.c1]), filter(nil), rowset=16
      access([t4.c1]), partitions(p0)
      limit(1), offset(nil), is_index_back=false, is_global_index=false, 
      range_key([t4.c1]), range(MIN ; MAX)always true
  5 - output([t3.c1]), filter(nil), rowset=16
      access([t3.c1]), partitions(p0)
      is_index_back=false, is_global_index=false, 
      range_key([t3.c1]), range(MIN ; MAX)always true
select c1 from t3 where c1 + (1 < any (select c1 from t4));
c1
1
2
3
4
5
6
EXPLAIN select /*+NO_REWRITE*/c1 from t3 where c1 + (1 < any (select c1 from t4));
Query Plan
=================================================
|ID|OPERATOR         |NAME|EST.ROWS|EST.TIME(us)|
-------------------------------------------------
|0 |SUBPLAN FILTER   |    |3       |5           |
|1 |├─TABLE FULL SCAN|t3  |3       |3           |
|2 |└─TABLE FULL SCAN|t4  |6       |3           |
=================================================
Outputs & filters:
-------------------------------------
  0 - output([t3.c1]), filter(nil), rowset=16
      exec_params_(nil), onetime_exprs_([1 < ANY(subquery(1))(:0)]), init_plan_idxs_(nil), use_batch=false
  1 - output([t3.c1]), filter([t3.c1 + :0]), rowset=16
      access([t3.c1]), partitions(p0)
      is_index_back=false, is_global_index=false, filter_before_indexback[false], 
      range_key([t3.c1]), range(MIN ; MAX)always true
  2 - output([t4.c1]), filter(nil), rowset=16
      access([t4.c1]), partitions(p0)
      is_index_back=false, is_global_index=false, 
      range_key([t4.c1]), range(MIN ; MAX)always true
select /*+NO_REWRITE*/c1 from t3 where c1 + (1 < any (select c1 from t4));
c1
1
2
3
4
5
6
EXPLAIN update t3 set c2 = c2 + 1  where c1 + (1 < any (select c1 from t4));
Query Plan
================================================================
|ID|OPERATOR                 |NAME       |EST.ROWS|EST.TIME(us)|
----------------------------------------------------------------
|0 |UPDATE                   |           |3       |53          |
|1 |└─NESTED-LOOP JOIN       |           |3       |6           |
|2 |  ├─SUBPLAN SCAN         |VIEW1      |1       |3           |
|3 |  │ └─SCALAR GROUP BY    |           |1       |3           |
|4 |  │   └─SUBPLAN SCAN     |VIEW2      |1       |3           |
|5 |  │     └─TABLE FULL SCAN|t4(Reverse)|1       |3           |
|6 |  └─TABLE FULL SCAN      |t3         |6       |3           |
================================================================
Outputs & filters:
-------------------------------------
  0 - output(nil), filter(nil)
      table_columns([{t3: ({t3: (t3.c1, t3.c2)}), hash_distinct}]),
      update([t3.c2=column_conv(INT,PS:(11,0),NULL,cast(t3.c2 + 1, INT(-1, 0)))])
  1 - output([t3.c1], [t3.c2]), filter(nil), rowset=16
      conds([t3.c1 + 1 < VIEW1.c1]), nl_params_(nil), use_batch=false
  2 - output([VIEW1.c1]), filter(nil), rowset=16
      access([VIEW1.c1])
  3 - output([T_FUN_MAX(VIEW2.t4.c1)]), filter(nil), rowset=16
      group(nil), agg_func([T_FUN_MAX(VIEW2.t4.c1)])
  4 - output([VIEW2.t4.c1]), filter(nil), rowset=16
      access([VIEW2.t4.c1])
  5 - output([t4.c1]), filter(nil), rowset=16
      access([t4.c1]), partitions(p0)
      limit(1), offset(nil), is_index_back=false, is_global_index=false, 
      range_key([t4.c1]), range(MIN ; MAX)always true
  6 - output([t3.c1], [t3.c2]), filter(nil), rowset=16
      access([t3.c1], [t3.c2]), partitions(p0)
      is_index_back=false, is_global_index=false, 
      range_key([t3.c1]), range(MIN ; MAX)always true
update t3 set c2 = c2 + 1  where c1 + (1 < any (select c1 from t4));
select/**/ * from t3;
c1	c2
1	2
2	6
3	3
4	7
5	5
6	8
rollback;
EXPLAIN update /*+NO_REWRITE*/t3 set c2 = c2 + 1  where c1 + (1 < any (select c1 from t4));
Query Plan
===================================================
|ID|OPERATOR           |NAME|EST.ROWS|EST.TIME(us)|
---------------------------------------------------
|0 |UPDATE             |    |3       |52          |
|1 |└─SUBPLAN FILTER   |    |3       |5           |
|2 |  ├─TABLE FULL SCAN|t3  |3       |3           |
|3 |  └─TABLE FULL SCAN|t4  |6       |3           |
===================================================
Outputs & filters:
-------------------------------------
  0 - output(nil), filter(nil)
      table_columns([{t3: ({t3: (t3.c1, t3.c2)})}]),
      update([t3.c2=column_conv(INT,PS:(11,0),NULL,cast(t3.c2 + 1, INT(-1, 0)))])
  1 - output([t3.c1], [t3.c2]), filter(nil), rowset=16
      exec_params_(nil), onetime_exprs_([1 < ANY(subquery(1))(:0)]), init_plan_idxs_(nil), use_batch=false
  2 - output([t3.c1], [t3.c2]), filter([t3.c1 + :0]), rowset=16
      access([t3.c1], [t3.c2]), partitions(p0)
      is_index_back=false, is_global_index=false, filter_before_indexback[false], 
      range_key([t3.c1]), range(MIN ; MAX)always true
  3 - output([t4.c1]), filter(nil), rowset=16
      access([t4.c1]), partitions(p0)
      is_index_back=false, is_global_index=false, 
      range_key([t4.c1]), range(MIN ; MAX)always true
update /*+NO_REWRITE*/t3 set c2 = c2 + 1  where c1 + (1 < any (select c1 from t4));
select/**/ * from t3;
c1	c2
1	2
2	6
3	3
4	7
5	5
6	8
rollback;
EXPLAIN delete from t3  where c1 + (1 < any (select c1 from t4));
Query Plan
================================================================
|ID|OPERATOR                 |NAME       |EST.ROWS|EST.TIME(us)|
----------------------------------------------------------------
|0 |DELETE                   |           |3       |28          |
|1 |└─NESTED-LOOP JOIN       |           |3       |6           |
|2 |  ├─SUBPLAN SCAN         |VIEW1      |1       |3           |
|3 |  │ └─SCALAR GROUP BY    |           |1       |3           |
|4 |  │   └─SUBPLAN SCAN     |VIEW2      |1       |3           |
|5 |  │     └─TABLE FULL SCAN|t4(Reverse)|1       |3           |
|6 |  └─TABLE FULL SCAN      |t3         |6       |3           |
================================================================
Outputs & filters:
-------------------------------------
  0 - output(nil), filter(nil)
      table_columns([{t3: ({t3: (t3.c1, t3.c2)}), hash_distinct}])
  1 - output([t3.c1], [t3.c2]), filter(nil), rowset=16
      conds([t3.c1 + 1 < VIEW1.c1]), nl_params_(nil), use_batch=false
  2 - output([VIEW1.c1]), filter(nil), rowset=16
      access([VIEW1.c1])
  3 - output([T_FUN_MAX(VIEW2.t4.c1)]), filter(nil), rowset=16
      group(nil), agg_func([T_FUN_MAX(VIEW2.t4.c1)])
  4 - output([VIEW2.t4.c1]), filter(nil), rowset=16
      access([VIEW2.t4.c1])
  5 - output([t4.c1]), filter(nil), rowset=16
      access([t4.c1]), partitions(p0)
      limit(1), offset(nil), is_index_back=false, is_global_index=false, 
      range_key([t4.c1]), range(MIN ; MAX)always true
  6 - output([t3.c1], [t3.c2]), filter(nil), rowset=16
      access([t3.c1], [t3.c2]), partitions(p0)
      is_index_back=false, is_global_index=false, 
      range_key([t3.c1]), range(MIN ; MAX)always true
delete from t3  where c1 + (1 < any (select c1 from t4));
select/**/ * from t3;
c1	c2
rollback;
EXPLAIN delete /*+NO_REWRITE*/from t3  where c1 + (1 < any (select c1 from t4));
Query Plan
===================================================
|ID|OPERATOR           |NAME|EST.ROWS|EST.TIME(us)|
---------------------------------------------------
|0 |DELETE             |    |3       |27          |
|1 |└─SUBPLAN FILTER   |    |3       |5           |
|2 |  ├─TABLE FULL SCAN|t3  |3       |3           |
|3 |  └─TABLE FULL SCAN|t4  |6       |3           |
===================================================
Outputs & filters:
-------------------------------------
  0 - output(nil), filter(nil)
      table_columns([{t3: ({t3: (t3.c1, t3.c2)})}])
  1 - output([t3.c1], [t3.c2]), filter(nil), rowset=16
      exec_params_(nil), onetime_exprs_([1 < ANY(subquery(1))(:0)]), init_plan_idxs_(nil), use_batch=false
  2 - output([t3.c1], [t3.c2]), filter([t3.c1 + :0]), rowset=16
      access([t3.c1], [t3.c2]), partitions(p0)
      is_index_back=false, is_global_index=false, filter_before_indexback[false], 
      range_key([t3.c1]), range(MIN ; MAX)always true
  3 - output([t4.c1]), filter(nil), rowset=16
      access([t4.c1]), partitions(p0)
      is_index_back=false, is_global_index=false, 
      range_key([t4.c1]), range(MIN ; MAX)always true
delete /*+NO_REWRITE*/from t3  where c1 + (1 < any (select c1 from t4));
select/**/ * from t3;
c1	c2
rollback;
EXPLAIN insert into is_c1 select c1 from t3 where c1 + (1 < any (select c1 from t4));
Query Plan
======================================================================
|ID|OPERATOR                   |NAME           |EST.ROWS|EST.TIME(us)|
----------------------------------------------------------------------
|0 |INSERT                     |               |3       |31          |
|1 |└─SUBPLAN SCAN             |ANONYMOUS_VIEW1|3       |6           |
|2 |  └─NESTED-LOOP JOIN       |               |3       |6           |
|3 |    ├─SUBPLAN SCAN         |VIEW1          |1       |3           |
|4 |    │ └─SCALAR GROUP BY    |               |1       |3           |
|5 |    │   └─SUBPLAN SCAN     |VIEW2          |1       |3           |
|6 |    │     └─TABLE FULL SCAN|t4(Reverse)    |1       |3           |
|7 |    └─TABLE FULL SCAN      |t3             |6       |3           |
======================================================================
Outputs & filters:
-------------------------------------
  0 - output(nil), filter(nil)
      columns([{is_c1: ({is_c1: (is_c1.__pk_increment, is_c1.a)})}]), partitions(p0), 
      column_values([T_HIDDEN_PK], [column_conv(INT,PS:(11,0),NULL,ANONYMOUS_VIEW1.c1)])
  1 - output([ANONYMOUS_VIEW1.c1]), filter(nil), rowset=16
      access([ANONYMOUS_VIEW1.c1])
  2 - output([t3.c1]), filter(nil), rowset=16
      conds([t3.c1 + 1 < VIEW1.c1]), nl_params_(nil), use_batch=false
  3 - output([VIEW1.c1]), filter(nil), rowset=16
      access([VIEW1.c1])
  4 - output([T_FUN_MAX(VIEW2.t4.c1)]), filter(nil), rowset=16
      group(nil), agg_func([T_FUN_MAX(VIEW2.t4.c1)])
  5 - output([VIEW2.t4.c1]), filter(nil), rowset=16
      access([VIEW2.t4.c1])
  6 - output([t4.c1]), filter(nil), rowset=16
      access([t4.c1]), partitions(p0)
      limit(1), offset(nil), is_index_back=false, is_global_index=false, 
      range_key([t4.c1]), range(MIN ; MAX)always true
  7 - output([t3.c1]), filter(nil), rowset=16
      access([t3.c1]), partitions(p0)
      is_index_back=false, is_global_index=false, 
      range_key([t3.c1]), range(MIN ; MAX)always true
insert into is_c1 select c1 from t3 where c1 + (1 < any (select c1 from t4));
select/**/ * from is_c1;
a
1
2
3
4
5
6
rollback;
EXPLAIN insert into is_c1 select /*+NO_REWRITE*/c1 from t3 where c1 + (1 < any (select c1 from t4));
Query Plan
================================================================
|ID|OPERATOR             |NAME           |EST.ROWS|EST.TIME(us)|
----------------------------------------------------------------
|0 |INSERT               |               |3       |31          |
|1 |└─SUBPLAN SCAN       |ANONYMOUS_VIEW1|3       |5           |
|2 |  └─SUBPLAN FILTER   |               |3       |5           |
|3 |    ├─TABLE FULL SCAN|t3             |3       |3           |
|4 |    └─TABLE FULL SCAN|t4             |6       |3           |
================================================================
Outputs & filters:
-------------------------------------
  0 - output(nil), filter(nil)
      columns([{is_c1: ({is_c1: (is_c1.__pk_increment, is_c1.a)})}]), partitions(p0), 
      column_values([T_HIDDEN_PK], [column_conv(INT,PS:(11,0),NULL,ANONYMOUS_VIEW1.c1)])
  1 - output([ANONYMOUS_VIEW1.c1]), filter(nil), rowset=16
      access([ANONYMOUS_VIEW1.c1])
  2 - output([t3.c1]), filter(nil), rowset=16
      exec_params_(nil), onetime_exprs_([1 < ANY(subquery(1))(:0)]), init_plan_idxs_(nil), use_batch=false
  3 - output([t3.c1]), filter([t3.c1 + :0]), rowset=16
      access([t3.c1]), partitions(p0)
      is_index_back=false, is_global_index=false, filter_before_indexback[false], 
      range_key([t3.c1]), range(MIN ; MAX)always true
  4 - output([t4.c1]), filter(nil), rowset=16
      access([t4.c1]), partitions(p0)
      is_index_back=false, is_global_index=false, 
      range_key([t4.c1]), range(MIN ; MAX)always true
insert into is_c1 select /*+NO_REWRITE*/c1 from t3 where c1 + (1 < any (select c1 from t4));
select/**/ * from is_c1;
a
1
2
3
4
5
6
rollback;


# case 19
EXPLAIN select c1 from t3 where c1 < any (select c3 from t6 where c2 = 1);
Query Plan
======================================================================
|ID|OPERATOR                |NAME              |EST.ROWS|EST.TIME(us)|
----------------------------------------------------------------------
|0 |NESTED-LOOP JOIN        |                  |1       |19          |
|1 |├─SUBPLAN SCAN          |VIEW2             |1       |3           |
|2 |│ └─SCALAR GROUP BY     |                  |1       |3           |
|3 |│   └─SUBPLAN SCAN      |VIEW3             |1       |3           |
|4 |│     └─TABLE RANGE SCAN|t6(idx_t6,Reverse)|1       |3           |
|5 |└─TABLE RANGE SCAN      |t3                |2       |16          |
======================================================================
Outputs & filters:
-------------------------------------
  0 - output([t3.c1]), filter(nil), rowset=16
      conds(nil), nl_params_([VIEW2.T_FUN_MAX(VIEW1.c3)(:0)]), use_batch=true
  1 - output([VIEW2.T_FUN_MAX(VIEW1.c3)]), filter(nil), rowset=16
      access([VIEW2.T_FUN_MAX(VIEW1.c3)])
  2 - output([T_FUN_MAX(VIEW3.t6.c3)]), filter(nil), rowset=16
      group(nil), agg_func([T_FUN_MAX(VIEW3.t6.c3)])
  3 - output([VIEW3.t6.c3]), filter(nil), rowset=16
      access([VIEW3.t6.c3])
  4 - output([t6.c3]), filter([t6.c3 IS NOT NULL]), rowset=16
      access([t6.c3]), partitions(p0)
      limit(1), offset(nil), is_index_back=false, is_global_index=false, filter_before_indexback[false], 
      range_key([t6.c2], [t6.c3], [t6.__pk_increment]), range(1,MIN,MIN ; 1,MAX,MAX), 
      range_cond([t6.c2 = 1])
  5 - output([t3.c1]), filter(nil), rowset=16
      access([GROUP_ID], [t3.c1]), partitions(p0)
      is_index_back=false, is_global_index=false, 
      range_key([t3.c1]), range(MIN ; MAX), 
      range_cond([t3.c1 < :0])
select c1 from t3 where c1 < any (select c3 from t6 where c2 = 1);
c1
EXPLAIN select /*+NO_REWRITE*/c1 from t3 where c1 < any (select c3 from t6 where c2 = 1);
Query Plan
========================================================
|ID|OPERATOR          |NAME      |EST.ROWS|EST.TIME(us)|
--------------------------------------------------------
|0 |SUBPLAN FILTER    |          |3       |5           |
|1 |├─TABLE FULL SCAN |t3        |6       |3           |
|2 |└─TABLE RANGE SCAN|t6(idx_t6)|1       |3           |
========================================================
Outputs & filters:
-------------------------------------
  0 - output([t3.c1]), filter([t3.c1 < ANY(subquery(1))]), rowset=16
      exec_params_(nil), onetime_exprs_(nil), init_plan_idxs_([1]), use_batch=false
  1 - output([t3.c1]), filter(nil), rowset=16
      access([t3.c1]), partitions(p0)
      is_index_back=false, is_global_index=false, 
      range_key([t3.c1]), range(MIN ; MAX)always true
  2 - output([t6.c3]), filter(nil), rowset=16
      access([t6.c3]), partitions(p0)
      is_index_back=false, is_global_index=false, 
      range_key([t6.c2], [t6.c3], [t6.__pk_increment]), range(1,MIN,MIN ; 1,MAX,MAX), 
      range_cond([t6.c2 = 1])
select /*+NO_REWRITE*/c1 from t3 where c1 < any (select c3 from t6 where c2 = 1);
c1
EXPLAIN update t3 set c2 = c2 + 1  where c1 < any (select c3 from t6 where c2 = 1);
Query Plan
========================================================================
|ID|OPERATOR                  |NAME              |EST.ROWS|EST.TIME(us)|
------------------------------------------------------------------------
|0 |UPDATE                    |                  |1       |50          |
|1 |└─NESTED-LOOP JOIN        |                  |1       |19          |
|2 |  ├─SUBPLAN SCAN          |VIEW2             |1       |3           |
|3 |  │ └─SCALAR GROUP BY     |                  |1       |3           |
|4 |  │   └─SUBPLAN SCAN      |VIEW3             |1       |3           |
|5 |  │     └─TABLE RANGE SCAN|t6(idx_t6,Reverse)|1       |3           |
|6 |  └─TABLE RANGE SCAN      |t3                |2       |16          |
========================================================================
Outputs & filters:
-------------------------------------
  0 - output(nil), filter(nil)
      table_columns([{t3: ({t3: (t3.c1, t3.c2)}), hash_distinct}]),
      update([t3.c2=column_conv(INT,PS:(11,0),NULL,cast(t3.c2 + 1, INT(-1, 0)))])
  1 - output([t3.c1], [t3.c2]), filter(nil), rowset=16
      conds(nil), nl_params_([VIEW2.T_FUN_MAX(VIEW1.c3)(:0)]), use_batch=true
  2 - output([VIEW2.T_FUN_MAX(VIEW1.c3)]), filter(nil), rowset=16
      access([VIEW2.T_FUN_MAX(VIEW1.c3)])
  3 - output([T_FUN_MAX(VIEW3.t6.c3)]), filter(nil), rowset=16
      group(nil), agg_func([T_FUN_MAX(VIEW3.t6.c3)])
  4 - output([VIEW3.t6.c3]), filter(nil), rowset=16
      access([VIEW3.t6.c3])
  5 - output([t6.c3]), filter([t6.c3 IS NOT NULL]), rowset=16
      access([t6.c3]), partitions(p0)
      limit(1), offset(nil), is_index_back=false, is_global_index=false, filter_before_indexback[false], 
      range_key([t6.c2], [t6.c3], [t6.__pk_increment]), range(1,MIN,MIN ; 1,MAX,MAX), 
      range_cond([t6.c2 = 1])
  6 - output([t3.c1], [t3.c2]), filter(nil), rowset=16
      access([GROUP_ID], [t3.c1], [t3.c2]), partitions(p0)
      is_index_back=false, is_global_index=false, 
      range_key([t3.c1]), range(MIN ; MAX), 
      range_cond([t3.c1 < :0])
update t3 set c2 = c2 + 1  where c1 < any (select c3 from t6 where c2 = 1);
select/**/ * from t3;
c1	c2
1	1
2	5
3	2
4	6
5	4
6	7
rollback;
EXPLAIN update /*+NO_REWRITE*/t3 set c2 = c2 + 1  where c1 < any (select c3 from t6 where c2 = 1);
Query Plan
==========================================================
|ID|OPERATOR            |NAME      |EST.ROWS|EST.TIME(us)|
----------------------------------------------------------
|0 |UPDATE              |          |3       |52          |
|1 |└─SUBPLAN FILTER    |          |3       |5           |
|2 |  ├─TABLE FULL SCAN |t3        |6       |3           |
|3 |  └─TABLE RANGE SCAN|t6(idx_t6)|1       |3           |
==========================================================
Outputs & filters:
-------------------------------------
  0 - output(nil), filter(nil)
      table_columns([{t3: ({t3: (t3.c1, t3.c2)})}]),
      update([t3.c2=column_conv(INT,PS:(11,0),NULL,cast(t3.c2 + 1, INT(-1, 0)))])
  1 - output([t3.c1], [t3.c2]), filter([t3.c1 < ANY(subquery(1))]), rowset=16
      exec_params_(nil), onetime_exprs_(nil), init_plan_idxs_([1]), use_batch=false
  2 - output([t3.c1], [t3.c2]), filter(nil), rowset=16
      access([t3.c1], [t3.c2]), partitions(p0)
      is_index_back=false, is_global_index=false, 
      range_key([t3.c1]), range(MIN ; MAX)always true
  3 - output([t6.c3]), filter(nil), rowset=16
      access([t6.c3]), partitions(p0)
      is_index_back=false, is_global_index=false, 
      range_key([t6.c2], [t6.c3], [t6.__pk_increment]), range(1,MIN,MIN ; 1,MAX,MAX), 
      range_cond([t6.c2 = 1])
update /*+NO_REWRITE*/t3 set c2 = c2 + 1  where c1 < any (select c3 from t6 where c2 = 1);
select/**/ * from t3;
c1	c2
1	1
2	5
3	2
4	6
5	4
6	7
rollback;
EXPLAIN delete from t3  where c1 < any (select c3 from t6 where c2 = 1);
Query Plan
========================================================================
|ID|OPERATOR                  |NAME              |EST.ROWS|EST.TIME(us)|
------------------------------------------------------------------------
|0 |DELETE                    |                  |1       |30          |
|1 |└─NESTED-LOOP JOIN        |                  |1       |19          |
|2 |  ├─SUBPLAN SCAN          |VIEW2             |1       |3           |
|3 |  │ └─SCALAR GROUP BY     |                  |1       |3           |
|4 |  │   └─SUBPLAN SCAN      |VIEW3             |1       |3           |
|5 |  │     └─TABLE RANGE SCAN|t6(idx_t6,Reverse)|1       |3           |
|6 |  └─TABLE RANGE SCAN      |t3                |2       |16          |
========================================================================
Outputs & filters:
-------------------------------------
  0 - output(nil), filter(nil)
      table_columns([{t3: ({t3: (t3.c1, t3.c2)}), hash_distinct}])
  1 - output([t3.c1], [t3.c2]), filter(nil), rowset=16
      conds(nil), nl_params_([VIEW2.T_FUN_MAX(VIEW1.c3)(:0)]), use_batch=true
  2 - output([VIEW2.T_FUN_MAX(VIEW1.c3)]), filter(nil), rowset=16
      access([VIEW2.T_FUN_MAX(VIEW1.c3)])
  3 - output([T_FUN_MAX(VIEW3.t6.c3)]), filter(nil), rowset=16
      group(nil), agg_func([T_FUN_MAX(VIEW3.t6.c3)])
  4 - output([VIEW3.t6.c3]), filter(nil), rowset=16
      access([VIEW3.t6.c3])
  5 - output([t6.c3]), filter([t6.c3 IS NOT NULL]), rowset=16
      access([t6.c3]), partitions(p0)
      limit(1), offset(nil), is_index_back=false, is_global_index=false, filter_before_indexback[false], 
      range_key([t6.c2], [t6.c3], [t6.__pk_increment]), range(1,MIN,MIN ; 1,MAX,MAX), 
      range_cond([t6.c2 = 1])
  6 - output([t3.c1], [t3.c2]), filter(nil), rowset=16
      access([GROUP_ID], [t3.c1], [t3.c2]), partitions(p0)
      is_index_back=false, is_global_index=false, 
      range_key([t3.c1]), range(MIN ; MAX), 
      range_cond([t3.c1 < :0])
delete from t3  where c1 < any (select c3 from t6 where c2 = 1);
select/**/ * from t3;
c1	c2
1	1
2	5
3	2
4	6
5	4
6	7
rollback;
EXPLAIN delete /*+NO_REWRITE*/from t3  where c1 < any (select c3 from t6 where c2 = 1);
Query Plan
==========================================================
|ID|OPERATOR            |NAME      |EST.ROWS|EST.TIME(us)|
----------------------------------------------------------
|0 |DELETE              |          |3       |27          |
|1 |└─SUBPLAN FILTER    |          |3       |5           |
|2 |  ├─TABLE FULL SCAN |t3        |6       |3           |
|3 |  └─TABLE RANGE SCAN|t6(idx_t6)|1       |3           |
==========================================================
Outputs & filters:
-------------------------------------
  0 - output(nil), filter(nil)
      table_columns([{t3: ({t3: (t3.c1, t3.c2)})}])
  1 - output([t3.c1], [t3.c2]), filter([t3.c1 < ANY(subquery(1))]), rowset=16
      exec_params_(nil), onetime_exprs_(nil), init_plan_idxs_([1]), use_batch=false
  2 - output([t3.c1], [t3.c2]), filter(nil), rowset=16
      access([t3.c1], [t3.c2]), partitions(p0)
      is_index_back=false, is_global_index=false, 
      range_key([t3.c1]), range(MIN ; MAX)always true
  3 - output([t6.c3]), filter(nil), rowset=16
      access([t6.c3]), partitions(p0)
      is_index_back=false, is_global_index=false, 
      range_key([t6.c2], [t6.c3], [t6.__pk_increment]), range(1,MIN,MIN ; 1,MAX,MAX), 
      range_cond([t6.c2 = 1])
delete /*+NO_REWRITE*/from t3  where c1 < any (select c3 from t6 where c2 = 1);
select/**/ * from t3;
c1	c2
1	1
2	5
3	2
4	6
5	4
6	7
rollback;
EXPLAIN insert into is_c1 select c1 from t3 where c1 < any (select c3 from t6 where c2 = 1);
Query Plan
==========================================================================
|ID|OPERATOR                    |NAME              |EST.ROWS|EST.TIME(us)|
--------------------------------------------------------------------------
|0 |INSERT                      |                  |1       |32          |
|1 |└─SUBPLAN SCAN              |ANONYMOUS_VIEW1   |1       |19          |
|2 |  └─NESTED-LOOP JOIN        |                  |1       |19          |
|3 |    ├─SUBPLAN SCAN          |VIEW2             |1       |3           |
|4 |    │ └─SCALAR GROUP BY     |                  |1       |3           |
|5 |    │   └─SUBPLAN SCAN      |VIEW3             |1       |3           |
|6 |    │     └─TABLE RANGE SCAN|t6(idx_t6,Reverse)|1       |3           |
|7 |    └─TABLE RANGE SCAN      |t3                |2       |16          |
==========================================================================
Outputs & filters:
-------------------------------------
  0 - output(nil), filter(nil)
      columns([{is_c1: ({is_c1: (is_c1.__pk_increment, is_c1.a)})}]), partitions(p0), 
      column_values([T_HIDDEN_PK], [column_conv(INT,PS:(11,0),NULL,ANONYMOUS_VIEW1.c1)])
  1 - output([ANONYMOUS_VIEW1.c1]), filter(nil), rowset=16
      access([ANONYMOUS_VIEW1.c1])
  2 - output([t3.c1]), filter(nil), rowset=16
      conds(nil), nl_params_([VIEW2.T_FUN_MAX(VIEW1.c3)(:0)]), use_batch=true
  3 - output([VIEW2.T_FUN_MAX(VIEW1.c3)]), filter(nil), rowset=16
      access([VIEW2.T_FUN_MAX(VIEW1.c3)])
  4 - output([T_FUN_MAX(VIEW3.t6.c3)]), filter(nil), rowset=16
      group(nil), agg_func([T_FUN_MAX(VIEW3.t6.c3)])
  5 - output([VIEW3.t6.c3]), filter(nil), rowset=16
      access([VIEW3.t6.c3])
  6 - output([t6.c3]), filter([t6.c3 IS NOT NULL]), rowset=16
      access([t6.c3]), partitions(p0)
      limit(1), offset(nil), is_index_back=false, is_global_index=false, filter_before_indexback[false], 
      range_key([t6.c2], [t6.c3], [t6.__pk_increment]), range(1,MIN,MIN ; 1,MAX,MAX), 
      range_cond([t6.c2 = 1])
  7 - output([t3.c1]), filter(nil), rowset=16
      access([GROUP_ID], [t3.c1]), partitions(p0)
      is_index_back=false, is_global_index=false, 
      range_key([t3.c1]), range(MIN ; MAX), 
      range_cond([t3.c1 < :0])
insert into is_c1 select c1 from t3 where c1 < any (select c3 from t6 where c2 = 1);
select/**/ * from is_c1;
a
rollback;
EXPLAIN insert into is_c1 select /*+NO_REWRITE*/c1 from t3 where c1 < any (select c3 from t6 where c2 = 1);
Query Plan
=================================================================
|ID|OPERATOR              |NAME           |EST.ROWS|EST.TIME(us)|
-----------------------------------------------------------------
|0 |INSERT                |               |3       |31          |
|1 |└─SUBPLAN SCAN        |ANONYMOUS_VIEW1|3       |5           |
|2 |  └─SUBPLAN FILTER    |               |3       |5           |
|3 |    ├─TABLE FULL SCAN |t3             |6       |3           |
|4 |    └─TABLE RANGE SCAN|t6(idx_t6)     |1       |3           |
=================================================================
Outputs & filters:
-------------------------------------
  0 - output(nil), filter(nil)
      columns([{is_c1: ({is_c1: (is_c1.__pk_increment, is_c1.a)})}]), partitions(p0), 
      column_values([T_HIDDEN_PK], [column_conv(INT,PS:(11,0),NULL,ANONYMOUS_VIEW1.c1)])
  1 - output([ANONYMOUS_VIEW1.c1]), filter(nil), rowset=16
      access([ANONYMOUS_VIEW1.c1])
  2 - output([t3.c1]), filter([t3.c1 < ANY(subquery(1))]), rowset=16
      exec_params_(nil), onetime_exprs_(nil), init_plan_idxs_([1]), use_batch=false
  3 - output([t3.c1]), filter(nil), rowset=16
      access([t3.c1]), partitions(p0)
      is_index_back=false, is_global_index=false, 
      range_key([t3.c1]), range(MIN ; MAX)always true
  4 - output([t6.c3]), filter(nil), rowset=16
      access([t6.c3]), partitions(p0)
      is_index_back=false, is_global_index=false, 
      range_key([t6.c2], [t6.c3], [t6.__pk_increment]), range(1,MIN,MIN ; 1,MAX,MAX), 
      range_cond([t6.c2 = 1])
insert into is_c1 select /*+NO_REWRITE*/c1 from t3 where c1 < any (select c3 from t6 where c2 = 1);
select/**/ * from is_c1;
a
rollback;


# case 20
EXPLAIN select c1 from t3 where c1 < any (select c2 from t7 where c1 = 1);
Query Plan
===============================================================
|ID|OPERATOR                |NAME       |EST.ROWS|EST.TIME(us)|
---------------------------------------------------------------
|0 |NESTED-LOOP JOIN        |           |1       |19          |
|1 |├─SUBPLAN SCAN          |VIEW2      |1       |3           |
|2 |│ └─SCALAR GROUP BY     |           |1       |3           |
|3 |│   └─SUBPLAN SCAN      |VIEW3      |1       |3           |
|4 |│     └─TABLE RANGE SCAN|t7(Reverse)|1       |3           |
|5 |└─TABLE RANGE SCAN      |t3         |2       |16          |
===============================================================
Outputs & filters:
-------------------------------------
  0 - output([t3.c1]), filter(nil), rowset=16
      conds(nil), nl_params_([VIEW2.T_FUN_MAX(VIEW1.c2)(:0)]), use_batch=true
  1 - output([VIEW2.T_FUN_MAX(VIEW1.c2)]), filter(nil), rowset=16
      access([VIEW2.T_FUN_MAX(VIEW1.c2)])
  2 - output([T_FUN_MAX(VIEW3.t7.c2)]), filter(nil), rowset=16
      group(nil), agg_func([T_FUN_MAX(VIEW3.t7.c2)])
  3 - output([VIEW3.t7.c2]), filter(nil), rowset=16
      access([VIEW3.t7.c2])
  4 - output([t7.c2]), filter(nil), rowset=16
      access([t7.c2]), partitions(p0)
      limit(1), offset(nil), is_index_back=false, is_global_index=false, 
      range_key([t7.c1], [t7.c2], [t7.c3]), range(1,MIN,MIN ; 1,MAX,MAX), 
      range_cond([t7.c1 = 1])
  5 - output([t3.c1]), filter(nil), rowset=16
      access([GROUP_ID], [t3.c1]), partitions(p0)
      is_index_back=false, is_global_index=false, 
      range_key([t3.c1]), range(MIN ; MAX), 
      range_cond([t3.c1 < :0])
select c1 from t3 where c1 < any (select c2 from t7 where c1 = 1);
c1
1
2
3
4
5
6
EXPLAIN select /*+NO_REWRITE*/c1 from t3 where c1 < any (select c2 from t7 where c1 = 1);
Query Plan
==================================================
|ID|OPERATOR          |NAME|EST.ROWS|EST.TIME(us)|
--------------------------------------------------
|0 |SUBPLAN FILTER    |    |3       |5           |
|1 |├─TABLE FULL SCAN |t3  |6       |3           |
|2 |└─TABLE RANGE SCAN|t7  |3       |3           |
==================================================
Outputs & filters:
-------------------------------------
  0 - output([t3.c1]), filter([t3.c1 < ANY(subquery(1))]), rowset=16
      exec_params_(nil), onetime_exprs_(nil), init_plan_idxs_([1]), use_batch=false
  1 - output([t3.c1]), filter(nil), rowset=16
      access([t3.c1]), partitions(p0)
      is_index_back=false, is_global_index=false, 
      range_key([t3.c1]), range(MIN ; MAX)always true
  2 - output([t7.c2]), filter(nil), rowset=16
      access([t7.c2]), partitions(p0)
      is_index_back=false, is_global_index=false, 
      range_key([t7.c1], [t7.c2], [t7.c3]), range(1,MIN,MIN ; 1,MAX,MAX), 
      range_cond([t7.c1 = 1])
select /*+NO_REWRITE*/c1 from t3 where c1 < any (select c2 from t7 where c1 = 1);
c1
1
2
3
4
5
6
EXPLAIN update t3 set c2 = c2 + 1  where c1 < any (select c2 from t7 where c1 = 1);
Query Plan
=================================================================
|ID|OPERATOR                  |NAME       |EST.ROWS|EST.TIME(us)|
-----------------------------------------------------------------
|0 |UPDATE                    |           |1       |50          |
|1 |└─NESTED-LOOP JOIN        |           |1       |19          |
|2 |  ├─SUBPLAN SCAN          |VIEW2      |1       |3           |
|3 |  │ └─SCALAR GROUP BY     |           |1       |3           |
|4 |  │   └─SUBPLAN SCAN      |VIEW3      |1       |3           |
|5 |  │     └─TABLE RANGE SCAN|t7(Reverse)|1       |3           |
|6 |  └─TABLE RANGE SCAN      |t3         |2       |16          |
=================================================================
Outputs & filters:
-------------------------------------
  0 - output(nil), filter(nil)
      table_columns([{t3: ({t3: (t3.c1, t3.c2)}), hash_distinct}]),
      update([t3.c2=column_conv(INT,PS:(11,0),NULL,cast(t3.c2 + 1, INT(-1, 0)))])
  1 - output([t3.c1], [t3.c2]), filter(nil), rowset=16
      conds(nil), nl_params_([VIEW2.T_FUN_MAX(VIEW1.c2)(:0)]), use_batch=true
  2 - output([VIEW2.T_FUN_MAX(VIEW1.c2)]), filter(nil), rowset=16
      access([VIEW2.T_FUN_MAX(VIEW1.c2)])
  3 - output([T_FUN_MAX(VIEW3.t7.c2)]), filter(nil), rowset=16
      group(nil), agg_func([T_FUN_MAX(VIEW3.t7.c2)])
  4 - output([VIEW3.t7.c2]), filter(nil), rowset=16
      access([VIEW3.t7.c2])
  5 - output([t7.c2]), filter(nil), rowset=16
      access([t7.c2]), partitions(p0)
      limit(1), offset(nil), is_index_back=false, is_global_index=false, 
      range_key([t7.c1], [t7.c2], [t7.c3]), range(1,MIN,MIN ; 1,MAX,MAX), 
      range_cond([t7.c1 = 1])
  6 - output([t3.c1], [t3.c2]), filter(nil), rowset=16
      access([GROUP_ID], [t3.c1], [t3.c2]), partitions(p0)
      is_index_back=false, is_global_index=false, 
      range_key([t3.c1]), range(MIN ; MAX), 
      range_cond([t3.c1 < :0])
update t3 set c2 = c2 + 1  where c1 < any (select c2 from t7 where c1 = 1);
select/**/ * from t3;
c1	c2
1	2
2	6
3	3
4	7
5	5
6	8
rollback;
EXPLAIN update /*+NO_REWRITE*/t3 set c2 = c2 + 1  where c1 < any (select c2 from t7 where c1 = 1);
Query Plan
====================================================
|ID|OPERATOR            |NAME|EST.ROWS|EST.TIME(us)|
----------------------------------------------------
|0 |UPDATE              |    |3       |52          |
|1 |└─SUBPLAN FILTER    |    |3       |5           |
|2 |  ├─TABLE FULL SCAN |t3  |6       |3           |
|3 |  └─TABLE RANGE SCAN|t7  |3       |3           |
====================================================
Outputs & filters:
-------------------------------------
  0 - output(nil), filter(nil)
      table_columns([{t3: ({t3: (t3.c1, t3.c2)})}]),
      update([t3.c2=column_conv(INT,PS:(11,0),NULL,cast(t3.c2 + 1, INT(-1, 0)))])
  1 - output([t3.c1], [t3.c2]), filter([t3.c1 < ANY(subquery(1))]), rowset=16
      exec_params_(nil), onetime_exprs_(nil), init_plan_idxs_([1]), use_batch=false
  2 - output([t3.c1], [t3.c2]), filter(nil), rowset=16
      access([t3.c1], [t3.c2]), partitions(p0)
      is_index_back=false, is_global_index=false, 
      range_key([t3.c1]), range(MIN ; MAX)always true
  3 - output([t7.c2]), filter(nil), rowset=16
      access([t7.c2]), partitions(p0)
      is_index_back=false, is_global_index=false, 
      range_key([t7.c1], [t7.c2], [t7.c3]), range(1,MIN,MIN ; 1,MAX,MAX), 
      range_cond([t7.c1 = 1])
update /*+NO_REWRITE*/t3 set c2 = c2 + 1  where c1 < any (select c2 from t7 where c1 = 1);
select/**/ * from t3;
c1	c2
1	2
2	6
3	3
4	7
5	5
6	8
rollback;
EXPLAIN delete from t3  where c1 < any (select c2 from t7 where c1 = 1);
Query Plan
=================================================================
|ID|OPERATOR                  |NAME       |EST.ROWS|EST.TIME(us)|
-----------------------------------------------------------------
|0 |DELETE                    |           |1       |30          |
|1 |└─NESTED-LOOP JOIN        |           |1       |19          |
|2 |  ├─SUBPLAN SCAN          |VIEW2      |1       |3           |
|3 |  │ └─SCALAR GROUP BY     |           |1       |3           |
|4 |  │   └─SUBPLAN SCAN      |VIEW3      |1       |3           |
|5 |  │     └─TABLE RANGE SCAN|t7(Reverse)|1       |3           |
|6 |  └─TABLE RANGE SCAN      |t3         |2       |16          |
=================================================================
Outputs & filters:
-------------------------------------
  0 - output(nil), filter(nil)
      table_columns([{t3: ({t3: (t3.c1, t3.c2)}), hash_distinct}])
  1 - output([t3.c1], [t3.c2]), filter(nil), rowset=16
      conds(nil), nl_params_([VIEW2.T_FUN_MAX(VIEW1.c2)(:0)]), use_batch=true
  2 - output([VIEW2.T_FUN_MAX(VIEW1.c2)]), filter(nil), rowset=16
      access([VIEW2.T_FUN_MAX(VIEW1.c2)])
  3 - output([T_FUN_MAX(VIEW3.t7.c2)]), filter(nil), rowset=16
      group(nil), agg_func([T_FUN_MAX(VIEW3.t7.c2)])
  4 - output([VIEW3.t7.c2]), filter(nil), rowset=16
      access([VIEW3.t7.c2])
  5 - output([t7.c2]), filter(nil), rowset=16
      access([t7.c2]), partitions(p0)
      limit(1), offset(nil), is_index_back=false, is_global_index=false, 
      range_key([t7.c1], [t7.c2], [t7.c3]), range(1,MIN,MIN ; 1,MAX,MAX), 
      range_cond([t7.c1 = 1])
  6 - output([t3.c1], [t3.c2]), filter(nil), rowset=16
      access([GROUP_ID], [t3.c1], [t3.c2]), partitions(p0)
      is_index_back=false, is_global_index=false, 
      range_key([t3.c1]), range(MIN ; MAX), 
      range_cond([t3.c1 < :0])
delete from t3  where c1 < any (select c2 from t7 where c1 = 1);
select/**/ * from t3;
c1	c2
rollback;
EXPLAIN delete /*+NO_REWRITE*/from t3  where c1 < any (select c2 from t7 where c1 = 1);
Query Plan
====================================================
|ID|OPERATOR            |NAME|EST.ROWS|EST.TIME(us)|
----------------------------------------------------
|0 |DELETE              |    |3       |27          |
|1 |└─SUBPLAN FILTER    |    |3       |5           |
|2 |  ├─TABLE FULL SCAN |t3  |6       |3           |
|3 |  └─TABLE RANGE SCAN|t7  |3       |3           |
====================================================
Outputs & filters:
-------------------------------------
  0 - output(nil), filter(nil)
      table_columns([{t3: ({t3: (t3.c1, t3.c2)})}])
  1 - output([t3.c1], [t3.c2]), filter([t3.c1 < ANY(subquery(1))]), rowset=16
      exec_params_(nil), onetime_exprs_(nil), init_plan_idxs_([1]), use_batch=false
  2 - output([t3.c1], [t3.c2]), filter(nil), rowset=16
      access([t3.c1], [t3.c2]), partitions(p0)
      is_index_back=false, is_global_index=false, 
      range_key([t3.c1]), range(MIN ; MAX)always true
  3 - output([t7.c2]), filter(nil), rowset=16
      access([t7.c2]), partitions(p0)
      is_index_back=false, is_global_index=false, 
      range_key([t7.c1], [t7.c2], [t7.c3]), range(1,MIN,MIN ; 1,MAX,MAX), 
      range_cond([t7.c1 = 1])
delete /*+NO_REWRITE*/from t3  where c1 < any (select c2 from t7 where c1 = 1);
select/**/ * from t3;
c1	c2
rollback;
EXPLAIN insert into is_c1 select c1 from t3 where c1 < any (select c2 from t7 where c1 = 1);
Query Plan
=======================================================================
|ID|OPERATOR                    |NAME           |EST.ROWS|EST.TIME(us)|
-----------------------------------------------------------------------
|0 |INSERT                      |               |1       |32          |
|1 |└─SUBPLAN SCAN              |ANONYMOUS_VIEW1|1       |19          |
|2 |  └─NESTED-LOOP JOIN        |               |1       |19          |
|3 |    ├─SUBPLAN SCAN          |VIEW2          |1       |3           |
|4 |    │ └─SCALAR GROUP BY     |               |1       |3           |
|5 |    │   └─SUBPLAN SCAN      |VIEW3          |1       |3           |
|6 |    │     └─TABLE RANGE SCAN|t7(Reverse)    |1       |3           |
|7 |    └─TABLE RANGE SCAN      |t3             |2       |16          |
=======================================================================
Outputs & filters:
-------------------------------------
  0 - output(nil), filter(nil)
      columns([{is_c1: ({is_c1: (is_c1.__pk_increment, is_c1.a)})}]), partitions(p0), 
      column_values([T_HIDDEN_PK], [column_conv(INT,PS:(11,0),NULL,ANONYMOUS_VIEW1.c1)])
  1 - output([ANONYMOUS_VIEW1.c1]), filter(nil), rowset=16
      access([ANONYMOUS_VIEW1.c1])
  2 - output([t3.c1]), filter(nil), rowset=16
      conds(nil), nl_params_([VIEW2.T_FUN_MAX(VIEW1.c2)(:0)]), use_batch=true
  3 - output([VIEW2.T_FUN_MAX(VIEW1.c2)]), filter(nil), rowset=16
      access([VIEW2.T_FUN_MAX(VIEW1.c2)])
  4 - output([T_FUN_MAX(VIEW3.t7.c2)]), filter(nil), rowset=16
      group(nil), agg_func([T_FUN_MAX(VIEW3.t7.c2)])
  5 - output([VIEW3.t7.c2]), filter(nil), rowset=16
      access([VIEW3.t7.c2])
  6 - output([t7.c2]), filter(nil), rowset=16
      access([t7.c2]), partitions(p0)
      limit(1), offset(nil), is_index_back=false, is_global_index=false, 
      range_key([t7.c1], [t7.c2], [t7.c3]), range(1,MIN,MIN ; 1,MAX,MAX), 
      range_cond([t7.c1 = 1])
  7 - output([t3.c1]), filter(nil), rowset=16
      access([GROUP_ID], [t3.c1]), partitions(p0)
      is_index_back=false, is_global_index=false, 
      range_key([t3.c1]), range(MIN ; MAX), 
      range_cond([t3.c1 < :0])
insert into is_c1 select c1 from t3 where c1 < any (select c2 from t7 where c1 = 1);
select/**/ * from is_c1;
a
1
2
3
4
5
6
rollback;
EXPLAIN insert into is_c1 select /*+NO_REWRITE*/c1 from t3 where c1 < any (select c2 from t7 where c1 = 1);
Query Plan
=================================================================
|ID|OPERATOR              |NAME           |EST.ROWS|EST.TIME(us)|
-----------------------------------------------------------------
|0 |INSERT                |               |3       |31          |
|1 |└─SUBPLAN SCAN        |ANONYMOUS_VIEW1|3       |5           |
|2 |  └─SUBPLAN FILTER    |               |3       |5           |
|3 |    ├─TABLE FULL SCAN |t3             |6       |3           |
|4 |    └─TABLE RANGE SCAN|t7             |3       |3           |
=================================================================
Outputs & filters:
-------------------------------------
  0 - output(nil), filter(nil)
      columns([{is_c1: ({is_c1: (is_c1.__pk_increment, is_c1.a)})}]), partitions(p0), 
      column_values([T_HIDDEN_PK], [column_conv(INT,PS:(11,0),NULL,ANONYMOUS_VIEW1.c1)])
  1 - output([ANONYMOUS_VIEW1.c1]), filter(nil), rowset=16
      access([ANONYMOUS_VIEW1.c1])
  2 - output([t3.c1]), filter([t3.c1 < ANY(subquery(1))]), rowset=16
      exec_params_(nil), onetime_exprs_(nil), init_plan_idxs_([1]), use_batch=false
  3 - output([t3.c1]), filter(nil), rowset=16
      access([t3.c1]), partitions(p0)
      is_index_back=false, is_global_index=false, 
      range_key([t3.c1]), range(MIN ; MAX)always true
  4 - output([t7.c2]), filter(nil), rowset=16
      access([t7.c2]), partitions(p0)
      is_index_back=false, is_global_index=false, 
      range_key([t7.c1], [t7.c2], [t7.c3]), range(1,MIN,MIN ; 1,MAX,MAX), 
      range_cond([t7.c1 = 1])
insert into is_c1 select /*+NO_REWRITE*/c1 from t3 where c1 < any (select c2 from t7 where c1 = 1);
select/**/ * from is_c1;
a
1
2
3
4
5
6
rollback;


# case 21
EXPLAIN select c1 from t3 where c1 < any (select c2 from t6);
Query Plan
=====================================================================
|ID|OPERATOR               |NAME              |EST.ROWS|EST.TIME(us)|
---------------------------------------------------------------------
|0 |NESTED-LOOP JOIN       |                  |1       |19          |
|1 |├─SUBPLAN SCAN         |VIEW2             |1       |3           |
|2 |│ └─SCALAR GROUP BY    |                  |1       |3           |
|3 |│   └─SUBPLAN SCAN     |VIEW3             |1       |3           |
|4 |│     └─TABLE FULL SCAN|t6(idx_t6,Reverse)|1       |3           |
|5 |└─TABLE RANGE SCAN     |t3                |2       |16          |
=====================================================================
Outputs & filters:
-------------------------------------
  0 - output([t3.c1]), filter(nil), rowset=16
      conds(nil), nl_params_([VIEW2.T_FUN_MAX(VIEW1.c2)(:0)]), use_batch=true
  1 - output([VIEW2.T_FUN_MAX(VIEW1.c2)]), filter(nil), rowset=16
      access([VIEW2.T_FUN_MAX(VIEW1.c2)])
  2 - output([T_FUN_MAX(VIEW3.t6.c2)]), filter(nil), rowset=16
      group(nil), agg_func([T_FUN_MAX(VIEW3.t6.c2)])
  3 - output([VIEW3.t6.c2]), filter(nil), rowset=16
      access([VIEW3.t6.c2])
  4 - output([t6.c2]), filter([t6.c2 IS NOT NULL]), rowset=16
      access([t6.c2]), partitions(p0)
      limit(1), offset(nil), is_index_back=false, is_global_index=false, filter_before_indexback[false], 
      range_key([t6.c2], [t6.c3], [t6.__pk_increment]), range(MIN,MIN,MIN ; MAX,MAX,MAX)always true
  5 - output([t3.c1]), filter(nil), rowset=16
      access([GROUP_ID], [t3.c1]), partitions(p0)
      is_index_back=false, is_global_index=false, 
      range_key([t3.c1]), range(MIN ; MAX), 
      range_cond([t3.c1 < :0])
select c1 from t3 where c1 < any (select c2 from t6);
c1
1
2
3
4
5
6
EXPLAIN select /*+NO_REWRITE*/c1 from t3 where c1 < any (select c2 from t6);
Query Plan
=======================================================
|ID|OPERATOR         |NAME      |EST.ROWS|EST.TIME(us)|
-------------------------------------------------------
|0 |SUBPLAN FILTER   |          |3       |5           |
|1 |├─TABLE FULL SCAN|t3        |6       |3           |
|2 |└─TABLE FULL SCAN|t6(idx_t6)|6       |3           |
=======================================================
Outputs & filters:
-------------------------------------
  0 - output([t3.c1]), filter([t3.c1 < ANY(subquery(1))]), rowset=16
      exec_params_(nil), onetime_exprs_(nil), init_plan_idxs_([1]), use_batch=false
  1 - output([t3.c1]), filter(nil), rowset=16
      access([t3.c1]), partitions(p0)
      is_index_back=false, is_global_index=false, 
      range_key([t3.c1]), range(MIN ; MAX)always true
  2 - output([t6.c2]), filter(nil), rowset=16
      access([t6.c2]), partitions(p0)
      is_index_back=false, is_global_index=false, 
      range_key([t6.c2], [t6.c3], [t6.__pk_increment]), range(MIN,MIN,MIN ; MAX,MAX,MAX)always true
select /*+NO_REWRITE*/c1 from t3 where c1 < any (select c2 from t6);
c1
1
2
3
4
5
6
EXPLAIN update t3 set c2 = c2 + 1  where c1 < any (select c2 from t6);
Query Plan
=======================================================================
|ID|OPERATOR                 |NAME              |EST.ROWS|EST.TIME(us)|
-----------------------------------------------------------------------
|0 |UPDATE                   |                  |1       |51          |
|1 |└─NESTED-LOOP JOIN       |                  |1       |19          |
|2 |  ├─SUBPLAN SCAN         |VIEW2             |1       |3           |
|3 |  │ └─SCALAR GROUP BY    |                  |1       |3           |
|4 |  │   └─SUBPLAN SCAN     |VIEW3             |1       |3           |
|5 |  │     └─TABLE FULL SCAN|t6(idx_t6,Reverse)|1       |3           |
|6 |  └─TABLE RANGE SCAN     |t3                |2       |16          |
=======================================================================
Outputs & filters:
-------------------------------------
  0 - output(nil), filter(nil)
      table_columns([{t3: ({t3: (t3.c1, t3.c2)}), hash_distinct}]),
      update([t3.c2=column_conv(INT,PS:(11,0),NULL,cast(t3.c2 + 1, INT(-1, 0)))])
  1 - output([t3.c1], [t3.c2]), filter(nil), rowset=16
      conds(nil), nl_params_([VIEW2.T_FUN_MAX(VIEW1.c2)(:0)]), use_batch=true
  2 - output([VIEW2.T_FUN_MAX(VIEW1.c2)]), filter(nil), rowset=16
      access([VIEW2.T_FUN_MAX(VIEW1.c2)])
  3 - output([T_FUN_MAX(VIEW3.t6.c2)]), filter(nil), rowset=16
      group(nil), agg_func([T_FUN_MAX(VIEW3.t6.c2)])
  4 - output([VIEW3.t6.c2]), filter(nil), rowset=16
      access([VIEW3.t6.c2])
  5 - output([t6.c2]), filter([t6.c2 IS NOT NULL]), rowset=16
      access([t6.c2]), partitions(p0)
      limit(1), offset(nil), is_index_back=false, is_global_index=false, filter_before_indexback[false], 
      range_key([t6.c2], [t6.c3], [t6.__pk_increment]), range(MIN,MIN,MIN ; MAX,MAX,MAX)always true
  6 - output([t3.c1], [t3.c2]), filter(nil), rowset=16
      access([GROUP_ID], [t3.c1], [t3.c2]), partitions(p0)
      is_index_back=false, is_global_index=false, 
      range_key([t3.c1]), range(MIN ; MAX), 
      range_cond([t3.c1 < :0])
update t3 set c2 = c2 + 1  where c1 < any (select c2 from t6);
select/**/ * from t3;
c1	c2
1	2
2	6
3	3
4	7
5	5
6	8
rollback;
EXPLAIN update /*+NO_REWRITE*/t3 set c2 = c2 + 1  where c1 < any (select c2 from t6);
Query Plan
=========================================================
|ID|OPERATOR           |NAME      |EST.ROWS|EST.TIME(us)|
---------------------------------------------------------
|0 |UPDATE             |          |3       |52          |
|1 |└─SUBPLAN FILTER   |          |3       |6           |
|2 |  ├─TABLE FULL SCAN|t3        |6       |3           |
|3 |  └─TABLE FULL SCAN|t6(idx_t6)|6       |3           |
=========================================================
Outputs & filters:
-------------------------------------
  0 - output(nil), filter(nil)
      table_columns([{t3: ({t3: (t3.c1, t3.c2)})}]),
      update([t3.c2=column_conv(INT,PS:(11,0),NULL,cast(t3.c2 + 1, INT(-1, 0)))])
  1 - output([t3.c1], [t3.c2]), filter([t3.c1 < ANY(subquery(1))]), rowset=16
      exec_params_(nil), onetime_exprs_(nil), init_plan_idxs_([1]), use_batch=false
  2 - output([t3.c1], [t3.c2]), filter(nil), rowset=16
      access([t3.c1], [t3.c2]), partitions(p0)
      is_index_back=false, is_global_index=false, 
      range_key([t3.c1]), range(MIN ; MAX)always true
  3 - output([t6.c2]), filter(nil), rowset=16
      access([t6.c2]), partitions(p0)
      is_index_back=false, is_global_index=false, 
      range_key([t6.c2], [t6.c3], [t6.__pk_increment]), range(MIN,MIN,MIN ; MAX,MAX,MAX)always true
update /*+NO_REWRITE*/t3 set c2 = c2 + 1  where c1 < any (select c2 from t6);
select/**/ * from t3;
c1	c2
1	2
2	6
3	3
4	7
5	5
6	8
rollback;
EXPLAIN delete from t3  where c1 < any (select c2 from t6);
Query Plan
=======================================================================
|ID|OPERATOR                 |NAME              |EST.ROWS|EST.TIME(us)|
-----------------------------------------------------------------------
|0 |DELETE                   |                  |1       |31          |
|1 |└─NESTED-LOOP JOIN       |                  |1       |19          |
|2 |  ├─SUBPLAN SCAN         |VIEW2             |1       |3           |
|3 |  │ └─SCALAR GROUP BY    |                  |1       |3           |
|4 |  │   └─SUBPLAN SCAN     |VIEW3             |1       |3           |
|5 |  │     └─TABLE FULL SCAN|t6(idx_t6,Reverse)|1       |3           |
|6 |  └─TABLE RANGE SCAN     |t3                |2       |16          |
=======================================================================
Outputs & filters:
-------------------------------------
  0 - output(nil), filter(nil)
      table_columns([{t3: ({t3: (t3.c1, t3.c2)}), hash_distinct}])
  1 - output([t3.c1], [t3.c2]), filter(nil), rowset=16
      conds(nil), nl_params_([VIEW2.T_FUN_MAX(VIEW1.c2)(:0)]), use_batch=true
  2 - output([VIEW2.T_FUN_MAX(VIEW1.c2)]), filter(nil), rowset=16
      access([VIEW2.T_FUN_MAX(VIEW1.c2)])
  3 - output([T_FUN_MAX(VIEW3.t6.c2)]), filter(nil), rowset=16
      group(nil), agg_func([T_FUN_MAX(VIEW3.t6.c2)])
  4 - output([VIEW3.t6.c2]), filter(nil), rowset=16
      access([VIEW3.t6.c2])
  5 - output([t6.c2]), filter([t6.c2 IS NOT NULL]), rowset=16
      access([t6.c2]), partitions(p0)
      limit(1), offset(nil), is_index_back=false, is_global_index=false, filter_before_indexback[false], 
      range_key([t6.c2], [t6.c3], [t6.__pk_increment]), range(MIN,MIN,MIN ; MAX,MAX,MAX)always true
  6 - output([t3.c1], [t3.c2]), filter(nil), rowset=16
      access([GROUP_ID], [t3.c1], [t3.c2]), partitions(p0)
      is_index_back=false, is_global_index=false, 
      range_key([t3.c1]), range(MIN ; MAX), 
      range_cond([t3.c1 < :0])
delete from t3  where c1 < any (select c2 from t6);
select/**/ * from t3;
c1	c2
rollback;
EXPLAIN delete /*+NO_REWRITE*/from t3  where c1 < any (select c2 from t6);
Query Plan
=========================================================
|ID|OPERATOR           |NAME      |EST.ROWS|EST.TIME(us)|
---------------------------------------------------------
|0 |DELETE             |          |3       |27          |
|1 |└─SUBPLAN FILTER   |          |3       |6           |
|2 |  ├─TABLE FULL SCAN|t3        |6       |3           |
|3 |  └─TABLE FULL SCAN|t6(idx_t6)|6       |3           |
=========================================================
Outputs & filters:
-------------------------------------
  0 - output(nil), filter(nil)
      table_columns([{t3: ({t3: (t3.c1, t3.c2)})}])
  1 - output([t3.c1], [t3.c2]), filter([t3.c1 < ANY(subquery(1))]), rowset=16
      exec_params_(nil), onetime_exprs_(nil), init_plan_idxs_([1]), use_batch=false
  2 - output([t3.c1], [t3.c2]), filter(nil), rowset=16
      access([t3.c1], [t3.c2]), partitions(p0)
      is_index_back=false, is_global_index=false, 
      range_key([t3.c1]), range(MIN ; MAX)always true
  3 - output([t6.c2]), filter(nil), rowset=16
      access([t6.c2]), partitions(p0)
      is_index_back=false, is_global_index=false, 
      range_key([t6.c2], [t6.c3], [t6.__pk_increment]), range(MIN,MIN,MIN ; MAX,MAX,MAX)always true
delete /*+NO_REWRITE*/from t3  where c1 < any (select c2 from t6);
select/**/ * from t3;
c1	c2
rollback;
EXPLAIN insert into is_c1 select c1 from t3 where c1 < any (select c2 from t6);
Query Plan
=========================================================================
|ID|OPERATOR                   |NAME              |EST.ROWS|EST.TIME(us)|
-------------------------------------------------------------------------
|0 |INSERT                     |                  |1       |32          |
|1 |└─SUBPLAN SCAN             |ANONYMOUS_VIEW1   |1       |19          |
|2 |  └─NESTED-LOOP JOIN       |                  |1       |19          |
|3 |    ├─SUBPLAN SCAN         |VIEW2             |1       |3           |
|4 |    │ └─SCALAR GROUP BY    |                  |1       |3           |
|5 |    │   └─SUBPLAN SCAN     |VIEW3             |1       |3           |
|6 |    │     └─TABLE FULL SCAN|t6(idx_t6,Reverse)|1       |3           |
|7 |    └─TABLE RANGE SCAN     |t3                |2       |16          |
=========================================================================
Outputs & filters:
-------------------------------------
  0 - output(nil), filter(nil)
      columns([{is_c1: ({is_c1: (is_c1.__pk_increment, is_c1.a)})}]), partitions(p0), 
      column_values([T_HIDDEN_PK], [column_conv(INT,PS:(11,0),NULL,ANONYMOUS_VIEW1.c1)])
  1 - output([ANONYMOUS_VIEW1.c1]), filter(nil), rowset=16
      access([ANONYMOUS_VIEW1.c1])
  2 - output([t3.c1]), filter(nil), rowset=16
      conds(nil), nl_params_([VIEW2.T_FUN_MAX(VIEW1.c2)(:0)]), use_batch=true
  3 - output([VIEW2.T_FUN_MAX(VIEW1.c2)]), filter(nil), rowset=16
      access([VIEW2.T_FUN_MAX(VIEW1.c2)])
  4 - output([T_FUN_MAX(VIEW3.t6.c2)]), filter(nil), rowset=16
      group(nil), agg_func([T_FUN_MAX(VIEW3.t6.c2)])
  5 - output([VIEW3.t6.c2]), filter(nil), rowset=16
      access([VIEW3.t6.c2])
  6 - output([t6.c2]), filter([t6.c2 IS NOT NULL]), rowset=16
      access([t6.c2]), partitions(p0)
      limit(1), offset(nil), is_index_back=false, is_global_index=false, filter_before_indexback[false], 
      range_key([t6.c2], [t6.c3], [t6.__pk_increment]), range(MIN,MIN,MIN ; MAX,MAX,MAX)always true
  7 - output([t3.c1]), filter(nil), rowset=16
      access([GROUP_ID], [t3.c1]), partitions(p0)
      is_index_back=false, is_global_index=false, 
      range_key([t3.c1]), range(MIN ; MAX), 
      range_cond([t3.c1 < :0])
insert into is_c1 select c1 from t3 where c1 < any (select c2 from t6);
select/**/ * from is_c1;
a
1
2
3
4
5
6
rollback;
EXPLAIN insert into is_c1 select /*+NO_REWRITE*/c1 from t3 where c1 < any (select c2 from t6);
Query Plan
================================================================
|ID|OPERATOR             |NAME           |EST.ROWS|EST.TIME(us)|
----------------------------------------------------------------
|0 |INSERT               |               |3       |31          |
|1 |└─SUBPLAN SCAN       |ANONYMOUS_VIEW1|3       |5           |
|2 |  └─SUBPLAN FILTER   |               |3       |5           |
|3 |    ├─TABLE FULL SCAN|t3             |6       |3           |
|4 |    └─TABLE FULL SCAN|t6(idx_t6)     |6       |3           |
================================================================
Outputs & filters:
-------------------------------------
  0 - output(nil), filter(nil)
      columns([{is_c1: ({is_c1: (is_c1.__pk_increment, is_c1.a)})}]), partitions(p0), 
      column_values([T_HIDDEN_PK], [column_conv(INT,PS:(11,0),NULL,ANONYMOUS_VIEW1.c1)])
  1 - output([ANONYMOUS_VIEW1.c1]), filter(nil), rowset=16
      access([ANONYMOUS_VIEW1.c1])
  2 - output([t3.c1]), filter([t3.c1 < ANY(subquery(1))]), rowset=16
      exec_params_(nil), onetime_exprs_(nil), init_plan_idxs_([1]), use_batch=false
  3 - output([t3.c1]), filter(nil), rowset=16
      access([t3.c1]), partitions(p0)
      is_index_back=false, is_global_index=false, 
      range_key([t3.c1]), range(MIN ; MAX)always true
  4 - output([t6.c2]), filter(nil), rowset=16
      access([t6.c2]), partitions(p0)
      is_index_back=false, is_global_index=false, 
      range_key([t6.c2], [t6.c3], [t6.__pk_increment]), range(MIN,MIN,MIN ; MAX,MAX,MAX)always true
insert into is_c1 select /*+NO_REWRITE*/c1 from t3 where c1 < any (select c2 from t6);
select/**/ * from is_c1;
a
1
2
3
4
5
6
rollback;


# case 22
EXPLAIN select c1 from t3 where c1 > all (select c2 from t6);
Query Plan
============================================================
|ID|OPERATOR              |NAME      |EST.ROWS|EST.TIME(us)|
------------------------------------------------------------
|0 |NESTED-LOOP ANTI JOIN |          |0       |115         |
|1 |├─TABLE FULL SCAN     |t3        |6       |3           |
|2 |└─TABLE RANGE SCAN    |t6(idx_t6)|1       |18          |
============================================================
Outputs & filters:
-------------------------------------
  0 - output([t3.c1]), filter(nil), rowset=16
      conds(nil), nl_params_([t3.c1(:0)]), use_batch=false
  1 - output([t3.c1]), filter(nil), rowset=16
      access([t3.c1]), partitions(p0)
      is_index_back=false, is_global_index=false, 
      range_key([t3.c1]), range(MIN ; MAX)always true
  2 - output(nil), filter(nil), rowset=16
      access(nil), partitions(p0)
      is_index_back=false, is_global_index=false, 
      range_key([t6.c2], [t6.c3], [t6.__pk_increment]), range(MIN ; MAX), 
      range_cond([:0 <= t6.c2 OR t6.c2 IS NULL])
select c1 from t3 where c1 > all (select c2 from t6);
c1
EXPLAIN select /*+NO_REWRITE*/c1 from t3 where c1 > all (select c2 from t6);
Query Plan
=======================================================
|ID|OPERATOR         |NAME      |EST.ROWS|EST.TIME(us)|
-------------------------------------------------------
|0 |SUBPLAN FILTER   |          |3       |5           |
|1 |├─TABLE FULL SCAN|t3        |6       |3           |
|2 |└─TABLE FULL SCAN|t6(idx_t6)|6       |3           |
=======================================================
Outputs & filters:
-------------------------------------
  0 - output([t3.c1]), filter([t3.c1 > ALL(subquery(1))]), rowset=16
      exec_params_(nil), onetime_exprs_(nil), init_plan_idxs_([1]), use_batch=false
  1 - output([t3.c1]), filter(nil), rowset=16
      access([t3.c1]), partitions(p0)
      is_index_back=false, is_global_index=false, 
      range_key([t3.c1]), range(MIN ; MAX)always true
  2 - output([t6.c2]), filter(nil), rowset=16
      access([t6.c2]), partitions(p0)
      is_index_back=false, is_global_index=false, 
      range_key([t6.c2], [t6.c3], [t6.__pk_increment]), range(MIN,MIN,MIN ; MAX,MAX,MAX)always true
select /*+NO_REWRITE*/c1 from t3 where c1 > all (select c2 from t6);
c1
EXPLAIN update t3 set c2 = c2 + 1  where c1 > all (select c2 from t6);
Query Plan
==============================================================
|ID|OPERATOR                |NAME      |EST.ROWS|EST.TIME(us)|
--------------------------------------------------------------
|0 |UPDATE                  |          |0       |139         |
|1 |└─NESTED-LOOP ANTI JOIN |          |0       |115         |
|2 |  ├─TABLE FULL SCAN     |t3        |6       |3           |
|3 |  └─TABLE RANGE SCAN    |t6(idx_t6)|1       |18          |
==============================================================
Outputs & filters:
-------------------------------------
  0 - output(nil), filter(nil)
      table_columns([{t3: ({t3: (t3.c1, t3.c2)})}]),
      update([t3.c2=column_conv(INT,PS:(11,0),NULL,cast(t3.c2 + 1, INT(-1, 0)))])
  1 - output([t3.c1], [t3.c2]), filter(nil), rowset=16
      conds(nil), nl_params_([t3.c1(:0)]), use_batch=false
  2 - output([t3.c1], [t3.c2]), filter(nil), rowset=16
      access([t3.c1], [t3.c2]), partitions(p0)
      is_index_back=false, is_global_index=false, 
      range_key([t3.c1]), range(MIN ; MAX)always true
  3 - output(nil), filter(nil), rowset=16
      access(nil), partitions(p0)
      is_index_back=false, is_global_index=false, 
      range_key([t6.c2], [t6.c3], [t6.__pk_increment]), range(MIN ; MAX), 
      range_cond([:0 <= t6.c2 OR t6.c2 IS NULL])
update t3 set c2 = c2 + 1  where c1 > all (select c2 from t6);
select/**/ * from t3;
c1	c2
1	1
2	5
3	2
4	6
5	4
6	7
rollback;
EXPLAIN update /*+NO_REWRITE*/t3 set c2 = c2 + 1  where c1 > all (select c2 from t6);
Query Plan
=========================================================
|ID|OPERATOR           |NAME      |EST.ROWS|EST.TIME(us)|
---------------------------------------------------------
|0 |UPDATE             |          |3       |52          |
|1 |└─SUBPLAN FILTER   |          |3       |6           |
|2 |  ├─TABLE FULL SCAN|t3        |6       |3           |
|3 |  └─TABLE FULL SCAN|t6(idx_t6)|6       |3           |
=========================================================
Outputs & filters:
-------------------------------------
  0 - output(nil), filter(nil)
      table_columns([{t3: ({t3: (t3.c1, t3.c2)})}]),
      update([t3.c2=column_conv(INT,PS:(11,0),NULL,cast(t3.c2 + 1, INT(-1, 0)))])
  1 - output([t3.c1], [t3.c2]), filter([t3.c1 > ALL(subquery(1))]), rowset=16
      exec_params_(nil), onetime_exprs_(nil), init_plan_idxs_([1]), use_batch=false
  2 - output([t3.c1], [t3.c2]), filter(nil), rowset=16
      access([t3.c1], [t3.c2]), partitions(p0)
      is_index_back=false, is_global_index=false, 
      range_key([t3.c1]), range(MIN ; MAX)always true
  3 - output([t6.c2]), filter(nil), rowset=16
      access([t6.c2]), partitions(p0)
      is_index_back=false, is_global_index=false, 
      range_key([t6.c2], [t6.c3], [t6.__pk_increment]), range(MIN,MIN,MIN ; MAX,MAX,MAX)always true
update /*+NO_REWRITE*/t3 set c2 = c2 + 1  where c1 > all (select c2 from t6);
select/**/ * from t3;
c1	c2
1	1
2	5
3	2
4	6
5	4
6	7
rollback;
EXPLAIN delete from t3  where c1 > all (select c2 from t6);
Query Plan
==============================================================
|ID|OPERATOR                |NAME      |EST.ROWS|EST.TIME(us)|
--------------------------------------------------------------
|0 |DELETE                  |          |0       |122         |
|1 |└─NESTED-LOOP ANTI JOIN |          |0       |115         |
|2 |  ├─TABLE FULL SCAN     |t3        |6       |3           |
|3 |  └─TABLE RANGE SCAN    |t6(idx_t6)|1       |18          |
==============================================================
Outputs & filters:
-------------------------------------
  0 - output(nil), filter(nil)
      table_columns([{t3: ({t3: (t3.c1, t3.c2)})}])
  1 - output([t3.c1], [t3.c2]), filter(nil), rowset=16
      conds(nil), nl_params_([t3.c1(:0)]), use_batch=false
  2 - output([t3.c1], [t3.c2]), filter(nil), rowset=16
      access([t3.c1], [t3.c2]), partitions(p0)
      is_index_back=false, is_global_index=false, 
      range_key([t3.c1]), range(MIN ; MAX)always true
  3 - output(nil), filter(nil), rowset=16
      access(nil), partitions(p0)
      is_index_back=false, is_global_index=false, 
      range_key([t6.c2], [t6.c3], [t6.__pk_increment]), range(MIN ; MAX), 
      range_cond([:0 <= t6.c2 OR t6.c2 IS NULL])
delete from t3  where c1 > all (select c2 from t6);
select/**/ * from t3;
c1	c2
1	1
2	5
3	2
4	6
5	4
6	7
rollback;
EXPLAIN delete /*+NO_REWRITE*/from t3  where c1 > all (select c2 from t6);
Query Plan
=========================================================
|ID|OPERATOR           |NAME      |EST.ROWS|EST.TIME(us)|
---------------------------------------------------------
|0 |DELETE             |          |3       |27          |
|1 |└─SUBPLAN FILTER   |          |3       |6           |
|2 |  ├─TABLE FULL SCAN|t3        |6       |3           |
|3 |  └─TABLE FULL SCAN|t6(idx_t6)|6       |3           |
=========================================================
Outputs & filters:
-------------------------------------
  0 - output(nil), filter(nil)
      table_columns([{t3: ({t3: (t3.c1, t3.c2)})}])
  1 - output([t3.c1], [t3.c2]), filter([t3.c1 > ALL(subquery(1))]), rowset=16
      exec_params_(nil), onetime_exprs_(nil), init_plan_idxs_([1]), use_batch=false
  2 - output([t3.c1], [t3.c2]), filter(nil), rowset=16
      access([t3.c1], [t3.c2]), partitions(p0)
      is_index_back=false, is_global_index=false, 
      range_key([t3.c1]), range(MIN ; MAX)always true
  3 - output([t6.c2]), filter(nil), rowset=16
      access([t6.c2]), partitions(p0)
      is_index_back=false, is_global_index=false, 
      range_key([t6.c2], [t6.c3], [t6.__pk_increment]), range(MIN,MIN,MIN ; MAX,MAX,MAX)always true
delete /*+NO_REWRITE*/from t3  where c1 > all (select c2 from t6);
select/**/ * from t3;
c1	c2
1	1
2	5
3	2
4	6
5	4
6	7
rollback;
EXPLAIN insert into is_c1 select c1 from t3 where c1 > all (select c2 from t6);
Query Plan
=====================================================================
|ID|OPERATOR                  |NAME           |EST.ROWS|EST.TIME(us)|
---------------------------------------------------------------------
|0 |INSERT                    |               |0       |121         |
|1 |└─SUBPLAN SCAN            |ANONYMOUS_VIEW1|0       |115         |
|2 |  └─NESTED-LOOP ANTI JOIN |               |0       |115         |
|3 |    ├─TABLE FULL SCAN     |t3             |6       |3           |
|4 |    └─TABLE RANGE SCAN    |t6(idx_t6)     |1       |18          |
=====================================================================
Outputs & filters:
-------------------------------------
  0 - output(nil), filter(nil)
      columns([{is_c1: ({is_c1: (is_c1.__pk_increment, is_c1.a)})}]), partitions(p0), 
      column_values([T_HIDDEN_PK], [column_conv(INT,PS:(11,0),NULL,ANONYMOUS_VIEW1.c1)])
  1 - output([ANONYMOUS_VIEW1.c1]), filter(nil), rowset=16
      access([ANONYMOUS_VIEW1.c1])
  2 - output([t3.c1]), filter(nil), rowset=16
      conds(nil), nl_params_([t3.c1(:0)]), use_batch=false
  3 - output([t3.c1]), filter(nil), rowset=16
      access([t3.c1]), partitions(p0)
      is_index_back=false, is_global_index=false, 
      range_key([t3.c1]), range(MIN ; MAX)always true
  4 - output(nil), filter(nil), rowset=16
      access(nil), partitions(p0)
      is_index_back=false, is_global_index=false, 
      range_key([t6.c2], [t6.c3], [t6.__pk_increment]), range(MIN ; MAX), 
      range_cond([:0 <= t6.c2 OR t6.c2 IS NULL])
insert into is_c1 select c1 from t3 where c1 > all (select c2 from t6);
select/**/ * from is_c1;
a
rollback;
EXPLAIN insert into is_c1 select /*+NO_REWRITE*/c1 from t3 where c1 > all (select c2 from t6);
Query Plan
================================================================
|ID|OPERATOR             |NAME           |EST.ROWS|EST.TIME(us)|
----------------------------------------------------------------
|0 |INSERT               |               |3       |31          |
|1 |└─SUBPLAN SCAN       |ANONYMOUS_VIEW1|3       |5           |
|2 |  └─SUBPLAN FILTER   |               |3       |5           |
|3 |    ├─TABLE FULL SCAN|t3             |6       |3           |
|4 |    └─TABLE FULL SCAN|t6(idx_t6)     |6       |3           |
================================================================
Outputs & filters:
-------------------------------------
  0 - output(nil), filter(nil)
      columns([{is_c1: ({is_c1: (is_c1.__pk_increment, is_c1.a)})}]), partitions(p0), 
      column_values([T_HIDDEN_PK], [column_conv(INT,PS:(11,0),NULL,ANONYMOUS_VIEW1.c1)])
  1 - output([ANONYMOUS_VIEW1.c1]), filter(nil), rowset=16
      access([ANONYMOUS_VIEW1.c1])
  2 - output([t3.c1]), filter([t3.c1 > ALL(subquery(1))]), rowset=16
      exec_params_(nil), onetime_exprs_(nil), init_plan_idxs_([1]), use_batch=false
  3 - output([t3.c1]), filter(nil), rowset=16
      access([t3.c1]), partitions(p0)
      is_index_back=false, is_global_index=false, 
      range_key([t3.c1]), range(MIN ; MAX)always true
  4 - output([t6.c2]), filter(nil), rowset=16
      access([t6.c2]), partitions(p0)
      is_index_back=false, is_global_index=false, 
      range_key([t6.c2], [t6.c3], [t6.__pk_increment]), range(MIN,MIN,MIN ; MAX,MAX,MAX)always true
insert into is_c1 select /*+NO_REWRITE*/c1 from t3 where c1 > all (select c2 from t6);
select/**/ * from is_c1;
a
rollback;


# case 23
EXPLAIN select c1 from t3 where c1 > any (select c1 + 1 from t4);
Query Plan
======================================================
|ID|OPERATOR              |NAME|EST.ROWS|EST.TIME(us)|
------------------------------------------------------
|0 |NESTED-LOOP SEMI JOIN |    |5       |6           |
|1 |├─TABLE FULL SCAN     |t3  |6       |3           |
|2 |└─MATERIAL            |    |6       |3           |
|3 |  └─TABLE FULL SCAN   |t4  |6       |3           |
======================================================
Outputs & filters:
-------------------------------------
  0 - output([t3.c1]), filter(nil), rowset=16
      conds([t3.c1 > t4.c1 + 1]), nl_params_(nil), use_batch=false
  1 - output([t3.c1]), filter(nil), rowset=16
      access([t3.c1]), partitions(p0)
      is_index_back=false, is_global_index=false, 
      range_key([t3.c1]), range(MIN ; MAX)always true
  2 - output([t4.c1]), filter(nil), rowset=16
  3 - output([t4.c1]), filter(nil), rowset=16
      access([t4.c1]), partitions(p0)
      is_index_back=false, is_global_index=false, 
      range_key([t4.c1]), range(MIN ; MAX)always true
select c1 from t3 where c1 > any (select c1 + 1 from t4);
c1
3
4
5
6
EXPLAIN select /*+NO_REWRITE*/c1 from t3 where c1 > any (select c1 + 1 from t4);
Query Plan
=================================================
|ID|OPERATOR         |NAME|EST.ROWS|EST.TIME(us)|
-------------------------------------------------
|0 |SUBPLAN FILTER   |    |3       |5           |
|1 |├─TABLE FULL SCAN|t3  |6       |3           |
|2 |└─TABLE FULL SCAN|t4  |6       |3           |
=================================================
Outputs & filters:
-------------------------------------
  0 - output([t3.c1]), filter([t3.c1 > ANY(subquery(1))]), rowset=16
      exec_params_(nil), onetime_exprs_(nil), init_plan_idxs_([1]), use_batch=false
  1 - output([t3.c1]), filter(nil), rowset=16
      access([t3.c1]), partitions(p0)
      is_index_back=false, is_global_index=false, 
      range_key([t3.c1]), range(MIN ; MAX)always true
  2 - output([t4.c1 + 1]), filter(nil), rowset=16
      access([t4.c1]), partitions(p0)
      is_index_back=false, is_global_index=false, 
      range_key([t4.c1]), range(MIN ; MAX)always true
select /*+NO_REWRITE*/c1 from t3 where c1 > any (select c1 + 1 from t4);
c1
3
4
5
6
EXPLAIN update t3 set c2 = c2 + 1  where c1 > any (select c1 + 1 from t4);
Query Plan
========================================================
|ID|OPERATOR               |NAME |EST.ROWS|EST.TIME(us)|
--------------------------------------------------------
|0 |UPDATE                 |     |1       |51          |
|1 |└─NESTED-LOOP JOIN     |     |1       |19          |
|2 |  ├─SUBPLAN SCAN       |VIEW2|1       |3           |
|3 |  │ └─SCALAR GROUP BY  |     |1       |3           |
|4 |  │   └─TABLE FULL SCAN|t4   |6       |3           |
|5 |  └─TABLE RANGE SCAN   |t3   |2       |16          |
========================================================
Outputs & filters:
-------------------------------------
  0 - output(nil), filter(nil)
      table_columns([{t3: ({t3: (t3.c1, t3.c2)}), hash_distinct}]),
      update([t3.c2=column_conv(INT,PS:(11,0),NULL,cast(t3.c2 + 1, INT(-1, 0)))])
  1 - output([t3.c1], [t3.c2]), filter(nil), rowset=16
      conds(nil), nl_params_([VIEW2.T_FUN_MIN(VIEW1.c1 + 1)(:0)]), use_batch=true
  2 - output([VIEW2.T_FUN_MIN(VIEW1.c1 + 1)]), filter(nil), rowset=16
      access([VIEW2.T_FUN_MIN(VIEW1.c1 + 1)])
  3 - output([T_FUN_MIN(t4.c1 + 1)]), filter(nil), rowset=16
      group(nil), agg_func([T_FUN_MIN(t4.c1 + 1)])
  4 - output([t4.c1]), filter(nil), rowset=16
      access([t4.c1]), partitions(p0)
      is_index_back=false, is_global_index=false, 
      range_key([t4.c1]), range(MIN ; MAX)always true
  5 - output([t3.c1], [t3.c2]), filter(nil), rowset=16
      access([GROUP_ID], [t3.c1], [t3.c2]), partitions(p0)
      is_index_back=false, is_global_index=false, 
      range_key([t3.c1]), range(MIN ; MAX), 
      range_cond([t3.c1 > :0])
update t3 set c2 = c2 + 1  where c1 > any (select c1 + 1 from t4);
select/**/ * from t3;
c1	c2
1	1
2	5
3	3
4	7
5	5
6	8
rollback;
EXPLAIN update /*+NO_REWRITE*/t3 set c2 = c2 + 1  where c1 > any (select c1 + 1 from t4);
Query Plan
===================================================
|ID|OPERATOR           |NAME|EST.ROWS|EST.TIME(us)|
---------------------------------------------------
|0 |UPDATE             |    |3       |52          |
|1 |└─SUBPLAN FILTER   |    |3       |6           |
|2 |  ├─TABLE FULL SCAN|t3  |6       |3           |
|3 |  └─TABLE FULL SCAN|t4  |6       |3           |
===================================================
Outputs & filters:
-------------------------------------
  0 - output(nil), filter(nil)
      table_columns([{t3: ({t3: (t3.c1, t3.c2)})}]),
      update([t3.c2=column_conv(INT,PS:(11,0),NULL,cast(t3.c2 + 1, INT(-1, 0)))])
  1 - output([t3.c1], [t3.c2]), filter([t3.c1 > ANY(subquery(1))]), rowset=16
      exec_params_(nil), onetime_exprs_(nil), init_plan_idxs_([1]), use_batch=false
  2 - output([t3.c1], [t3.c2]), filter(nil), rowset=16
      access([t3.c1], [t3.c2]), partitions(p0)
      is_index_back=false, is_global_index=false, 
      range_key([t3.c1]), range(MIN ; MAX)always true
  3 - output([t4.c1 + 1]), filter(nil), rowset=16
      access([t4.c1]), partitions(p0)
      is_index_back=false, is_global_index=false, 
      range_key([t4.c1]), range(MIN ; MAX)always true
update /*+NO_REWRITE*/t3 set c2 = c2 + 1  where c1 > any (select c1 + 1 from t4);
select/**/ * from t3;
c1	c2
1	1
2	5
3	3
4	7
5	5
6	8
rollback;
EXPLAIN delete from t3  where c1 > any (select c1 + 1 from t4);
Query Plan
========================================================
|ID|OPERATOR               |NAME |EST.ROWS|EST.TIME(us)|
--------------------------------------------------------
|0 |DELETE                 |     |1       |31          |
|1 |└─NESTED-LOOP JOIN     |     |1       |19          |
|2 |  ├─SUBPLAN SCAN       |VIEW2|1       |3           |
|3 |  │ └─SCALAR GROUP BY  |     |1       |3           |
|4 |  │   └─TABLE FULL SCAN|t4   |6       |3           |
|5 |  └─TABLE RANGE SCAN   |t3   |2       |16          |
========================================================
Outputs & filters:
-------------------------------------
  0 - output(nil), filter(nil)
      table_columns([{t3: ({t3: (t3.c1, t3.c2)}), hash_distinct}])
  1 - output([t3.c1], [t3.c2]), filter(nil), rowset=16
      conds(nil), nl_params_([VIEW2.T_FUN_MIN(VIEW1.c1 + 1)(:0)]), use_batch=true
  2 - output([VIEW2.T_FUN_MIN(VIEW1.c1 + 1)]), filter(nil), rowset=16
      access([VIEW2.T_FUN_MIN(VIEW1.c1 + 1)])
  3 - output([T_FUN_MIN(t4.c1 + 1)]), filter(nil), rowset=16
      group(nil), agg_func([T_FUN_MIN(t4.c1 + 1)])
  4 - output([t4.c1]), filter(nil), rowset=16
      access([t4.c1]), partitions(p0)
      is_index_back=false, is_global_index=false, 
      range_key([t4.c1]), range(MIN ; MAX)always true
  5 - output([t3.c1], [t3.c2]), filter(nil), rowset=16
      access([GROUP_ID], [t3.c1], [t3.c2]), partitions(p0)
      is_index_back=false, is_global_index=false, 
      range_key([t3.c1]), range(MIN ; MAX), 
      range_cond([t3.c1 > :0])
delete from t3  where c1 > any (select c1 + 1 from t4);
select/**/ * from t3;
c1	c2
1	1
2	5
rollback;
EXPLAIN delete /*+NO_REWRITE*/from t3  where c1 > any (select c1 + 1 from t4);
Query Plan
===================================================
|ID|OPERATOR           |NAME|EST.ROWS|EST.TIME(us)|
---------------------------------------------------
|0 |DELETE             |    |3       |27          |
|1 |└─SUBPLAN FILTER   |    |3       |6           |
|2 |  ├─TABLE FULL SCAN|t3  |6       |3           |
|3 |  └─TABLE FULL SCAN|t4  |6       |3           |
===================================================
Outputs & filters:
-------------------------------------
  0 - output(nil), filter(nil)
      table_columns([{t3: ({t3: (t3.c1, t3.c2)})}])
  1 - output([t3.c1], [t3.c2]), filter([t3.c1 > ANY(subquery(1))]), rowset=16
      exec_params_(nil), onetime_exprs_(nil), init_plan_idxs_([1]), use_batch=false
  2 - output([t3.c1], [t3.c2]), filter(nil), rowset=16
      access([t3.c1], [t3.c2]), partitions(p0)
      is_index_back=false, is_global_index=false, 
      range_key([t3.c1]), range(MIN ; MAX)always true
  3 - output([t4.c1 + 1]), filter(nil), rowset=16
      access([t4.c1]), partitions(p0)
      is_index_back=false, is_global_index=false, 
      range_key([t4.c1]), range(MIN ; MAX)always true
delete /*+NO_REWRITE*/from t3  where c1 > any (select c1 + 1 from t4);
select/**/ * from t3;
c1	c2
1	1
2	5
rollback;
EXPLAIN insert into is_c1 select c1 from t3 where c1 > any (select c1 + 1 from t4);
Query Plan
=====================================================================
|ID|OPERATOR                  |NAME           |EST.ROWS|EST.TIME(us)|
---------------------------------------------------------------------
|0 |INSERT                    |               |5       |43          |
|1 |└─SUBPLAN SCAN            |ANONYMOUS_VIEW1|5       |6           |
|2 |  └─NESTED-LOOP SEMI JOIN |               |5       |6           |
|3 |    ├─TABLE FULL SCAN     |t3             |6       |3           |
|4 |    └─MATERIAL            |               |6       |3           |
|5 |      └─TABLE FULL SCAN   |t4             |6       |3           |
=====================================================================
Outputs & filters:
-------------------------------------
  0 - output(nil), filter(nil)
      columns([{is_c1: ({is_c1: (is_c1.__pk_increment, is_c1.a)})}]), partitions(p0), 
      column_values([T_HIDDEN_PK], [column_conv(INT,PS:(11,0),NULL,ANONYMOUS_VIEW1.c1)])
  1 - output([ANONYMOUS_VIEW1.c1]), filter(nil), rowset=16
      access([ANONYMOUS_VIEW1.c1])
  2 - output([t3.c1]), filter(nil), rowset=16
      conds([t3.c1 > t4.c1 + 1]), nl_params_(nil), use_batch=false
  3 - output([t3.c1]), filter(nil), rowset=16
      access([t3.c1]), partitions(p0)
      is_index_back=false, is_global_index=false, 
      range_key([t3.c1]), range(MIN ; MAX)always true
  4 - output([t4.c1]), filter(nil), rowset=16
  5 - output([t4.c1]), filter(nil), rowset=16
      access([t4.c1]), partitions(p0)
      is_index_back=false, is_global_index=false, 
      range_key([t4.c1]), range(MIN ; MAX)always true
insert into is_c1 select c1 from t3 where c1 > any (select c1 + 1 from t4);
select/**/ * from is_c1;
a
3
4
5
6
rollback;
EXPLAIN insert into is_c1 select /*+NO_REWRITE*/c1 from t3 where c1 > any (select c1 + 1 from t4);
Query Plan
================================================================
|ID|OPERATOR             |NAME           |EST.ROWS|EST.TIME(us)|
----------------------------------------------------------------
|0 |INSERT               |               |3       |31          |
|1 |└─SUBPLAN SCAN       |ANONYMOUS_VIEW1|3       |5           |
|2 |  └─SUBPLAN FILTER   |               |3       |5           |
|3 |    ├─TABLE FULL SCAN|t3             |6       |3           |
|4 |    └─TABLE FULL SCAN|t4             |6       |3           |
================================================================
Outputs & filters:
-------------------------------------
  0 - output(nil), filter(nil)
      columns([{is_c1: ({is_c1: (is_c1.__pk_increment, is_c1.a)})}]), partitions(p0), 
      column_values([T_HIDDEN_PK], [column_conv(INT,PS:(11,0),NULL,ANONYMOUS_VIEW1.c1)])
  1 - output([ANONYMOUS_VIEW1.c1]), filter(nil), rowset=16
      access([ANONYMOUS_VIEW1.c1])
  2 - output([t3.c1]), filter([t3.c1 > ANY(subquery(1))]), rowset=16
      exec_params_(nil), onetime_exprs_(nil), init_plan_idxs_([1]), use_batch=false
  3 - output([t3.c1]), filter(nil), rowset=16
      access([t3.c1]), partitions(p0)
      is_index_back=false, is_global_index=false, 
      range_key([t3.c1]), range(MIN ; MAX)always true
  4 - output([t4.c1 + 1]), filter(nil), rowset=16
      access([t4.c1]), partitions(p0)
      is_index_back=false, is_global_index=false, 
      range_key([t4.c1]), range(MIN ; MAX)always true
insert into is_c1 select /*+NO_REWRITE*/c1 from t3 where c1 > any (select c1 + 1 from t4);
select/**/ * from is_c1;
a
3
4
5
6
rollback;


# case 24
EXPLAIN select c1 from t3 where c1 > any (select max(c1) from t4 group by c1);
Query Plan
========================================================
|ID|OPERATOR               |NAME |EST.ROWS|EST.TIME(us)|
--------------------------------------------------------
|0 |NESTED-LOOP JOIN       |     |1       |19          |
|1 |├─SUBPLAN SCAN         |VIEW2|1       |3           |
|2 |│ └─SCALAR GROUP BY    |     |1       |3           |
|3 |│   └─SUBPLAN SCAN     |VIEW3|1       |3           |
|4 |│     └─TABLE FULL SCAN|t4   |1       |3           |
|5 |└─TABLE RANGE SCAN     |t3   |2       |16          |
========================================================
Outputs & filters:
-------------------------------------
  0 - output([t3.c1]), filter(nil), rowset=16
      conds(nil), nl_params_([VIEW2.T_FUN_MIN(VIEW1.max(c1))(:0)]), use_batch=true
  1 - output([VIEW2.T_FUN_MIN(VIEW1.max(c1))]), filter(nil), rowset=16
      access([VIEW2.T_FUN_MIN(VIEW1.max(c1))])
  2 - output([T_FUN_MIN(VIEW3.t4.c1)]), filter(nil), rowset=16
      group(nil), agg_func([T_FUN_MIN(VIEW3.t4.c1)])
  3 - output([VIEW3.t4.c1]), filter(nil), rowset=16
      access([VIEW3.t4.c1])
  4 - output([t4.c1]), filter(nil), rowset=16
      access([t4.c1]), partitions(p0)
      limit(1), offset(nil), is_index_back=false, is_global_index=false, 
      range_key([t4.c1]), range(MIN ; MAX)always true
  5 - output([t3.c1]), filter(nil), rowset=16
      access([GROUP_ID], [t3.c1]), partitions(p0)
      is_index_back=false, is_global_index=false, 
      range_key([t3.c1]), range(MIN ; MAX), 
      range_cond([t3.c1 > :0])
select c1 from t3 where c1 > any (select max(c1) from t4 group by c1);
c1
2
3
4
5
6
EXPLAIN select /*+NO_REWRITE*/c1 from t3 where c1 > any (select max(c1) from t4 group by c1);
Query Plan
=================================================
|ID|OPERATOR         |NAME|EST.ROWS|EST.TIME(us)|
-------------------------------------------------
|0 |SUBPLAN FILTER   |    |3       |5           |
|1 |├─TABLE FULL SCAN|t3  |6       |3           |
|2 |└─TABLE FULL SCAN|t4  |6       |3           |
=================================================
Outputs & filters:
-------------------------------------
  0 - output([t3.c1]), filter([t3.c1 > ANY(subquery(1))]), rowset=16
      exec_params_(nil), onetime_exprs_(nil), init_plan_idxs_([1]), use_batch=false
  1 - output([t3.c1]), filter(nil), rowset=16
      access([t3.c1]), partitions(p0)
      is_index_back=false, is_global_index=false, 
      range_key([t3.c1]), range(MIN ; MAX)always true
  2 - output([t4.c1]), filter(nil), rowset=16
      access([t4.c1]), partitions(p0)
      is_index_back=false, is_global_index=false, 
      range_key([t4.c1]), range(MIN ; MAX)always true
select /*+NO_REWRITE*/c1 from t3 where c1 > any (select max(c1) from t4 group by c1);
c1
2
3
4
5
6
EXPLAIN update t3 set c2 = c2 + 1  where c1 > any (select max(c1) from t4 group by c1);
Query Plan
==========================================================
|ID|OPERATOR                 |NAME |EST.ROWS|EST.TIME(us)|
----------------------------------------------------------
|0 |UPDATE                   |     |1       |50          |
|1 |└─NESTED-LOOP JOIN       |     |1       |19          |
|2 |  ├─SUBPLAN SCAN         |VIEW2|1       |3           |
|3 |  │ └─SCALAR GROUP BY    |     |1       |3           |
|4 |  │   └─SUBPLAN SCAN     |VIEW3|1       |3           |
|5 |  │     └─TABLE FULL SCAN|t4   |1       |3           |
|6 |  └─TABLE RANGE SCAN     |t3   |2       |16          |
==========================================================
Outputs & filters:
-------------------------------------
  0 - output(nil), filter(nil)
      table_columns([{t3: ({t3: (t3.c1, t3.c2)}), hash_distinct}]),
      update([t3.c2=column_conv(INT,PS:(11,0),NULL,cast(t3.c2 + 1, INT(-1, 0)))])
  1 - output([t3.c1], [t3.c2]), filter(nil), rowset=16
      conds(nil), nl_params_([VIEW2.T_FUN_MIN(VIEW1.max(c1))(:0)]), use_batch=true
  2 - output([VIEW2.T_FUN_MIN(VIEW1.max(c1))]), filter(nil), rowset=16
      access([VIEW2.T_FUN_MIN(VIEW1.max(c1))])
  3 - output([T_FUN_MIN(VIEW3.t4.c1)]), filter(nil), rowset=16
      group(nil), agg_func([T_FUN_MIN(VIEW3.t4.c1)])
  4 - output([VIEW3.t4.c1]), filter(nil), rowset=16
      access([VIEW3.t4.c1])
  5 - output([t4.c1]), filter(nil), rowset=16
      access([t4.c1]), partitions(p0)
      limit(1), offset(nil), is_index_back=false, is_global_index=false, 
      range_key([t4.c1]), range(MIN ; MAX)always true
  6 - output([t3.c1], [t3.c2]), filter(nil), rowset=16
      access([GROUP_ID], [t3.c1], [t3.c2]), partitions(p0)
      is_index_back=false, is_global_index=false, 
      range_key([t3.c1]), range(MIN ; MAX), 
      range_cond([t3.c1 > :0])
update t3 set c2 = c2 + 1  where c1 > any (select max(c1) from t4 group by c1);
select/**/ * from t3;
c1	c2
1	1
2	6
3	3
4	7
5	5
6	8
rollback;
EXPLAIN update /*+NO_REWRITE*/t3 set c2 = c2 + 1  where c1 > any (select max(c1) from t4 group by c1);
Query Plan
===================================================
|ID|OPERATOR           |NAME|EST.ROWS|EST.TIME(us)|
---------------------------------------------------
|0 |UPDATE             |    |3       |52          |
|1 |└─SUBPLAN FILTER   |    |3       |6           |
|2 |  ├─TABLE FULL SCAN|t3  |6       |3           |
|3 |  └─TABLE FULL SCAN|t4  |6       |3           |
===================================================
Outputs & filters:
-------------------------------------
  0 - output(nil), filter(nil)
      table_columns([{t3: ({t3: (t3.c1, t3.c2)})}]),
      update([t3.c2=column_conv(INT,PS:(11,0),NULL,cast(t3.c2 + 1, INT(-1, 0)))])
  1 - output([t3.c1], [t3.c2]), filter([t3.c1 > ANY(subquery(1))]), rowset=16
      exec_params_(nil), onetime_exprs_(nil), init_plan_idxs_([1]), use_batch=false
  2 - output([t3.c1], [t3.c2]), filter(nil), rowset=16
      access([t3.c1], [t3.c2]), partitions(p0)
      is_index_back=false, is_global_index=false, 
      range_key([t3.c1]), range(MIN ; MAX)always true
  3 - output([t4.c1]), filter(nil), rowset=16
      access([t4.c1]), partitions(p0)
      is_index_back=false, is_global_index=false, 
      range_key([t4.c1]), range(MIN ; MAX)always true
update /*+NO_REWRITE*/t3 set c2 = c2 + 1  where c1 > any (select max(c1) from t4 group by c1);
select/**/ * from t3;
c1	c2
1	1
2	6
3	3
4	7
5	5
6	8
rollback;
EXPLAIN delete from t3  where c1 > any (select max(c1) from t4 group by c1);
Query Plan
==========================================================
|ID|OPERATOR                 |NAME |EST.ROWS|EST.TIME(us)|
----------------------------------------------------------
|0 |DELETE                   |     |1       |30          |
|1 |└─NESTED-LOOP JOIN       |     |1       |19          |
|2 |  ├─SUBPLAN SCAN         |VIEW2|1       |3           |
|3 |  │ └─SCALAR GROUP BY    |     |1       |3           |
|4 |  │   └─SUBPLAN SCAN     |VIEW3|1       |3           |
|5 |  │     └─TABLE FULL SCAN|t4   |1       |3           |
|6 |  └─TABLE RANGE SCAN     |t3   |2       |16          |
==========================================================
Outputs & filters:
-------------------------------------
  0 - output(nil), filter(nil)
      table_columns([{t3: ({t3: (t3.c1, t3.c2)}), hash_distinct}])
  1 - output([t3.c1], [t3.c2]), filter(nil), rowset=16
      conds(nil), nl_params_([VIEW2.T_FUN_MIN(VIEW1.max(c1))(:0)]), use_batch=true
  2 - output([VIEW2.T_FUN_MIN(VIEW1.max(c1))]), filter(nil), rowset=16
      access([VIEW2.T_FUN_MIN(VIEW1.max(c1))])
  3 - output([T_FUN_MIN(VIEW3.t4.c1)]), filter(nil), rowset=16
      group(nil), agg_func([T_FUN_MIN(VIEW3.t4.c1)])
  4 - output([VIEW3.t4.c1]), filter(nil), rowset=16
      access([VIEW3.t4.c1])
  5 - output([t4.c1]), filter(nil), rowset=16
      access([t4.c1]), partitions(p0)
      limit(1), offset(nil), is_index_back=false, is_global_index=false, 
      range_key([t4.c1]), range(MIN ; MAX)always true
  6 - output([t3.c1], [t3.c2]), filter(nil), rowset=16
      access([GROUP_ID], [t3.c1], [t3.c2]), partitions(p0)
      is_index_back=false, is_global_index=false, 
      range_key([t3.c1]), range(MIN ; MAX), 
      range_cond([t3.c1 > :0])
delete from t3  where c1 > any (select max(c1) from t4 group by c1);
select/**/ * from t3;
c1	c2
1	1
rollback;
EXPLAIN delete /*+NO_REWRITE*/from t3  where c1 > any (select max(c1) from t4 group by c1);
Query Plan
===================================================
|ID|OPERATOR           |NAME|EST.ROWS|EST.TIME(us)|
---------------------------------------------------
|0 |DELETE             |    |3       |27          |
|1 |└─SUBPLAN FILTER   |    |3       |6           |
|2 |  ├─TABLE FULL SCAN|t3  |6       |3           |
|3 |  └─TABLE FULL SCAN|t4  |6       |3           |
===================================================
Outputs & filters:
-------------------------------------
  0 - output(nil), filter(nil)
      table_columns([{t3: ({t3: (t3.c1, t3.c2)})}])
  1 - output([t3.c1], [t3.c2]), filter([t3.c1 > ANY(subquery(1))]), rowset=16
      exec_params_(nil), onetime_exprs_(nil), init_plan_idxs_([1]), use_batch=false
  2 - output([t3.c1], [t3.c2]), filter(nil), rowset=16
      access([t3.c1], [t3.c2]), partitions(p0)
      is_index_back=false, is_global_index=false, 
      range_key([t3.c1]), range(MIN ; MAX)always true
  3 - output([t4.c1]), filter(nil), rowset=16
      access([t4.c1]), partitions(p0)
      is_index_back=false, is_global_index=false, 
      range_key([t4.c1]), range(MIN ; MAX)always true
delete /*+NO_REWRITE*/from t3  where c1 > any (select max(c1) from t4 group by c1);
select/**/ * from t3;
c1	c2
1	1
rollback;
EXPLAIN insert into is_c1 select c1 from t3 where c1 > any (select max(c1) from t4 group by c1);
Query Plan
======================================================================
|ID|OPERATOR                   |NAME           |EST.ROWS|EST.TIME(us)|
----------------------------------------------------------------------
|0 |INSERT                     |               |1       |32          |
|1 |└─SUBPLAN SCAN             |ANONYMOUS_VIEW1|1       |19          |
|2 |  └─NESTED-LOOP JOIN       |               |1       |19          |
|3 |    ├─SUBPLAN SCAN         |VIEW2          |1       |3           |
|4 |    │ └─SCALAR GROUP BY    |               |1       |3           |
|5 |    │   └─SUBPLAN SCAN     |VIEW3          |1       |3           |
|6 |    │     └─TABLE FULL SCAN|t4             |1       |3           |
|7 |    └─TABLE RANGE SCAN     |t3             |2       |16          |
======================================================================
Outputs & filters:
-------------------------------------
  0 - output(nil), filter(nil)
      columns([{is_c1: ({is_c1: (is_c1.__pk_increment, is_c1.a)})}]), partitions(p0), 
      column_values([T_HIDDEN_PK], [column_conv(INT,PS:(11,0),NULL,ANONYMOUS_VIEW1.c1)])
  1 - output([ANONYMOUS_VIEW1.c1]), filter(nil), rowset=16
      access([ANONYMOUS_VIEW1.c1])
  2 - output([t3.c1]), filter(nil), rowset=16
      conds(nil), nl_params_([VIEW2.T_FUN_MIN(VIEW1.max(c1))(:0)]), use_batch=true
  3 - output([VIEW2.T_FUN_MIN(VIEW1.max(c1))]), filter(nil), rowset=16
      access([VIEW2.T_FUN_MIN(VIEW1.max(c1))])
  4 - output([T_FUN_MIN(VIEW3.t4.c1)]), filter(nil), rowset=16
      group(nil), agg_func([T_FUN_MIN(VIEW3.t4.c1)])
  5 - output([VIEW3.t4.c1]), filter(nil), rowset=16
      access([VIEW3.t4.c1])
  6 - output([t4.c1]), filter(nil), rowset=16
      access([t4.c1]), partitions(p0)
      limit(1), offset(nil), is_index_back=false, is_global_index=false, 
      range_key([t4.c1]), range(MIN ; MAX)always true
  7 - output([t3.c1]), filter(nil), rowset=16
      access([GROUP_ID], [t3.c1]), partitions(p0)
      is_index_back=false, is_global_index=false, 
      range_key([t3.c1]), range(MIN ; MAX), 
      range_cond([t3.c1 > :0])
insert into is_c1 select c1 from t3 where c1 > any (select max(c1) from t4 group by c1);
select/**/ * from is_c1;
a
2
3
4
5
6
rollback;
EXPLAIN insert into is_c1 select /*+NO_REWRITE*/c1 from t3 where c1 > any (select max(c1) from t4 group by c1);
Query Plan
================================================================
|ID|OPERATOR             |NAME           |EST.ROWS|EST.TIME(us)|
----------------------------------------------------------------
|0 |INSERT               |               |3       |31          |
|1 |└─SUBPLAN SCAN       |ANONYMOUS_VIEW1|3       |5           |
|2 |  └─SUBPLAN FILTER   |               |3       |5           |
|3 |    ├─TABLE FULL SCAN|t3             |6       |3           |
|4 |    └─TABLE FULL SCAN|t4             |6       |3           |
================================================================
Outputs & filters:
-------------------------------------
  0 - output(nil), filter(nil)
      columns([{is_c1: ({is_c1: (is_c1.__pk_increment, is_c1.a)})}]), partitions(p0), 
      column_values([T_HIDDEN_PK], [column_conv(INT,PS:(11,0),NULL,ANONYMOUS_VIEW1.c1)])
  1 - output([ANONYMOUS_VIEW1.c1]), filter(nil), rowset=16
      access([ANONYMOUS_VIEW1.c1])
  2 - output([t3.c1]), filter([t3.c1 > ANY(subquery(1))]), rowset=16
      exec_params_(nil), onetime_exprs_(nil), init_plan_idxs_([1]), use_batch=false
  3 - output([t3.c1]), filter(nil), rowset=16
      access([t3.c1]), partitions(p0)
      is_index_back=false, is_global_index=false, 
      range_key([t3.c1]), range(MIN ; MAX)always true
  4 - output([t4.c1]), filter(nil), rowset=16
      access([t4.c1]), partitions(p0)
      is_index_back=false, is_global_index=false, 
      range_key([t4.c1]), range(MIN ; MAX)always true
insert into is_c1 select /*+NO_REWRITE*/c1 from t3 where c1 > any (select max(c1) from t4 group by c1);
select/**/ * from is_c1;
a
2
3
4
5
6
rollback;


# case 25
EXPLAIN select c1 from t3 where c1 > any (select c1 from t4 union select c1 from t4);
Query Plan
==============================================================
|ID|OPERATOR                     |NAME |EST.ROWS|EST.TIME(us)|
--------------------------------------------------------------
|0 |NESTED-LOOP JOIN             |     |1       |21          |
|1 |├─SUBPLAN SCAN               |VIEW2|1       |5           |
|2 |│ └─SCALAR GROUP BY          |     |1       |5           |
|3 |│   └─SUBPLAN SCAN           |VIEW1|2       |5           |
|4 |│     └─MERGE UNION DISTINCT |     |2       |5           |
|5 |│       ├─SCALAR GROUP BY    |     |1       |3           |
|6 |│       │ └─SUBPLAN SCAN     |VIEW3|1       |3           |
|7 |│       │   └─TABLE FULL SCAN|t4   |1       |3           |
|8 |│       └─SCALAR GROUP BY    |     |1       |3           |
|9 |│         └─SUBPLAN SCAN     |VIEW4|1       |3           |
|10|│           └─TABLE FULL SCAN|t4   |1       |3           |
|11|└─TABLE RANGE SCAN           |t3   |2       |16          |
==============================================================
Outputs & filters:
-------------------------------------
  0 - output([t3.c1]), filter(nil), rowset=16
      conds(nil), nl_params_([VIEW2.T_FUN_MIN(VIEW1.c1)(:0)]), use_batch=true
  1 - output([VIEW2.T_FUN_MIN(VIEW1.c1)]), filter(nil), rowset=16
      access([VIEW2.T_FUN_MIN(VIEW1.c1)])
  2 - output([T_FUN_MIN(VIEW1.T_FUN_MIN(t4.c1))]), filter(nil), rowset=16
      group(nil), agg_func([T_FUN_MIN(VIEW1.T_FUN_MIN(t4.c1))])
  3 - output([VIEW1.T_FUN_MIN(t4.c1)]), filter(nil), rowset=16
      access([VIEW1.T_FUN_MIN(t4.c1)])
  4 - output([UNION([1])]), filter(nil), rowset=16
  5 - output([T_FUN_MIN(VIEW3.t4.c1)]), filter(nil), rowset=16
      group(nil), agg_func([T_FUN_MIN(VIEW3.t4.c1)])
  6 - output([VIEW3.t4.c1]), filter(nil), rowset=16
      access([VIEW3.t4.c1])
  7 - output([t4.c1]), filter(nil), rowset=16
      access([t4.c1]), partitions(p0)
      limit(1), offset(nil), is_index_back=false, is_global_index=false, 
      range_key([t4.c1]), range(MIN ; MAX)always true
  8 - output([T_FUN_MIN(VIEW4.t4.c1)]), filter(nil), rowset=16
      group(nil), agg_func([T_FUN_MIN(VIEW4.t4.c1)])
  9 - output([VIEW4.t4.c1]), filter(nil), rowset=16
      access([VIEW4.t4.c1])
 10 - output([t4.c1]), filter(nil), rowset=16
      access([t4.c1]), partitions(p0)
      limit(1), offset(nil), is_index_back=false, is_global_index=false, 
      range_key([t4.c1]), range(MIN ; MAX)always true
 11 - output([t3.c1]), filter(nil), rowset=16
      access([GROUP_ID], [t3.c1]), partitions(p0)
      is_index_back=false, is_global_index=false, 
      range_key([t3.c1]), range(MIN ; MAX), 
      range_cond([t3.c1 > :0])
select c1 from t3 where c1 > any (select c1 from t4 union select c1 from t4);
c1
2
3
4
5
6
EXPLAIN select /*+NO_REWRITE*/c1 from t3 where c1 > any (select c1 from t4 union select c1 from t4);
Query Plan
======================================================
|ID|OPERATOR              |NAME|EST.ROWS|EST.TIME(us)|
------------------------------------------------------
|0 |SUBPLAN FILTER        |    |3       |9           |
|1 |├─TABLE FULL SCAN     |t3  |6       |3           |
|2 |└─MERGE UNION DISTINCT|    |12      |6           |
|3 |  ├─TABLE FULL SCAN   |t4  |6       |3           |
|4 |  └─TABLE FULL SCAN   |t4  |6       |3           |
======================================================
Outputs & filters:
-------------------------------------
  0 - output([t3.c1]), filter([t3.c1 > ANY(subquery(1))]), rowset=16
      exec_params_(nil), onetime_exprs_(nil), init_plan_idxs_([1]), use_batch=false
  1 - output([t3.c1]), filter(nil), rowset=16
      access([t3.c1]), partitions(p0)
      is_index_back=false, is_global_index=false, 
      range_key([t3.c1]), range(MIN ; MAX)always true
  2 - output([UNION([1])]), filter(nil), rowset=16
  3 - output([t4.c1]), filter(nil), rowset=16
      access([t4.c1]), partitions(p0)
      is_index_back=false, is_global_index=false, 
      range_key([t4.c1]), range(MIN ; MAX)always true
  4 - output([t4.c1]), filter(nil), rowset=16
      access([t4.c1]), partitions(p0)
      is_index_back=false, is_global_index=false, 
      range_key([t4.c1]), range(MIN ; MAX)always true
select /*+NO_REWRITE*/c1 from t3 where c1 > any (select c1 from t4 union select c1 from t4);
c1
2
3
4
5
6
EXPLAIN update t3 set c2 = c2 + 1  where c1 > any (select c1 from t4 union select c1 from t4);
Query Plan
================================================================
|ID|OPERATOR                       |NAME |EST.ROWS|EST.TIME(us)|
----------------------------------------------------------------
|0 |UPDATE                         |     |1       |53          |
|1 |└─NESTED-LOOP JOIN             |     |1       |21          |
|2 |  ├─SUBPLAN SCAN               |VIEW2|1       |5           |
|3 |  │ └─SCALAR GROUP BY          |     |1       |5           |
|4 |  │   └─SUBPLAN SCAN           |VIEW1|2       |5           |
|5 |  │     └─MERGE UNION DISTINCT |     |2       |5           |
|6 |  │       ├─SCALAR GROUP BY    |     |1       |3           |
|7 |  │       │ └─SUBPLAN SCAN     |VIEW3|1       |3           |
|8 |  │       │   └─TABLE FULL SCAN|t4   |1       |3           |
|9 |  │       └─SCALAR GROUP BY    |     |1       |3           |
|10|  │         └─SUBPLAN SCAN     |VIEW4|1       |3           |
|11|  │           └─TABLE FULL SCAN|t4   |1       |3           |
|12|  └─TABLE RANGE SCAN           |t3   |2       |16          |
================================================================
Outputs & filters:
-------------------------------------
  0 - output(nil), filter(nil)
      table_columns([{t3: ({t3: (t3.c1, t3.c2)}), hash_distinct}]),
      update([t3.c2=column_conv(INT,PS:(11,0),NULL,cast(t3.c2 + 1, INT(-1, 0)))])
  1 - output([t3.c1], [t3.c2]), filter(nil), rowset=16
      conds(nil), nl_params_([VIEW2.T_FUN_MIN(VIEW1.c1)(:0)]), use_batch=true
  2 - output([VIEW2.T_FUN_MIN(VIEW1.c1)]), filter(nil), rowset=16
      access([VIEW2.T_FUN_MIN(VIEW1.c1)])
  3 - output([T_FUN_MIN(VIEW1.T_FUN_MIN(t4.c1))]), filter(nil), rowset=16
      group(nil), agg_func([T_FUN_MIN(VIEW1.T_FUN_MIN(t4.c1))])
  4 - output([VIEW1.T_FUN_MIN(t4.c1)]), filter(nil), rowset=16
      access([VIEW1.T_FUN_MIN(t4.c1)])
  5 - output([UNION([1])]), filter(nil), rowset=16
  6 - output([T_FUN_MIN(VIEW3.t4.c1)]), filter(nil), rowset=16
      group(nil), agg_func([T_FUN_MIN(VIEW3.t4.c1)])
  7 - output([VIEW3.t4.c1]), filter(nil), rowset=16
      access([VIEW3.t4.c1])
  8 - output([t4.c1]), filter(nil), rowset=16
      access([t4.c1]), partitions(p0)
      limit(1), offset(nil), is_index_back=false, is_global_index=false, 
      range_key([t4.c1]), range(MIN ; MAX)always true
  9 - output([T_FUN_MIN(VIEW4.t4.c1)]), filter(nil), rowset=16
      group(nil), agg_func([T_FUN_MIN(VIEW4.t4.c1)])
 10 - output([VIEW4.t4.c1]), filter(nil), rowset=16
      access([VIEW4.t4.c1])
 11 - output([t4.c1]), filter(nil), rowset=16
      access([t4.c1]), partitions(p0)
      limit(1), offset(nil), is_index_back=false, is_global_index=false, 
      range_key([t4.c1]), range(MIN ; MAX)always true
 12 - output([t3.c1], [t3.c2]), filter(nil), rowset=16
      access([GROUP_ID], [t3.c1], [t3.c2]), partitions(p0)
      is_index_back=false, is_global_index=false, 
      range_key([t3.c1]), range(MIN ; MAX), 
      range_cond([t3.c1 > :0])
update t3 set c2 = c2 + 1  where c1 > any (select c1 from t4 union select c1 from t4);
select/**/ * from t3;
c1	c2
1	1
2	6
3	3
4	7
5	5
6	8
rollback;
EXPLAIN update /*+NO_REWRITE*/t3 set c2 = c2 + 1  where c1 > any (select c1 from t4 union select c1 from t4);
Query Plan
========================================================
|ID|OPERATOR                |NAME|EST.ROWS|EST.TIME(us)|
--------------------------------------------------------
|0 |UPDATE                  |    |3       |55          |
|1 |└─SUBPLAN FILTER        |    |3       |9           |
|2 |  ├─TABLE FULL SCAN     |t3  |6       |3           |
|3 |  └─MERGE UNION DISTINCT|    |12      |6           |
|4 |    ├─TABLE FULL SCAN   |t4  |6       |3           |
|5 |    └─TABLE FULL SCAN   |t4  |6       |3           |
========================================================
Outputs & filters:
-------------------------------------
  0 - output(nil), filter(nil)
      table_columns([{t3: ({t3: (t3.c1, t3.c2)})}]),
      update([t3.c2=column_conv(INT,PS:(11,0),NULL,cast(t3.c2 + 1, INT(-1, 0)))])
  1 - output([t3.c1], [t3.c2]), filter([t3.c1 > ANY(subquery(1))]), rowset=16
      exec_params_(nil), onetime_exprs_(nil), init_plan_idxs_([1]), use_batch=false
  2 - output([t3.c1], [t3.c2]), filter(nil), rowset=16
      access([t3.c1], [t3.c2]), partitions(p0)
      is_index_back=false, is_global_index=false, 
      range_key([t3.c1]), range(MIN ; MAX)always true
  3 - output([UNION([1])]), filter(nil), rowset=16
  4 - output([t4.c1]), filter(nil), rowset=16
      access([t4.c1]), partitions(p0)
      is_index_back=false, is_global_index=false, 
      range_key([t4.c1]), range(MIN ; MAX)always true
  5 - output([t4.c1]), filter(nil), rowset=16
      access([t4.c1]), partitions(p0)
      is_index_back=false, is_global_index=false, 
      range_key([t4.c1]), range(MIN ; MAX)always true
update /*+NO_REWRITE*/t3 set c2 = c2 + 1  where c1 > any (select c1 from t4 union select c1 from t4);
select/**/ * from t3;
c1	c2
1	1
2	6
3	3
4	7
5	5
6	8
rollback;
EXPLAIN delete from t3  where c1 > any (select c1 from t4 union select c1 from t4);
Query Plan
================================================================
|ID|OPERATOR                       |NAME |EST.ROWS|EST.TIME(us)|
----------------------------------------------------------------
|0 |DELETE                         |     |1       |33          |
|1 |└─NESTED-LOOP JOIN             |     |1       |21          |
|2 |  ├─SUBPLAN SCAN               |VIEW2|1       |5           |
|3 |  │ └─SCALAR GROUP BY          |     |1       |5           |
|4 |  │   └─SUBPLAN SCAN           |VIEW1|2       |5           |
|5 |  │     └─MERGE UNION DISTINCT |     |2       |5           |
|6 |  │       ├─SCALAR GROUP BY    |     |1       |3           |
|7 |  │       │ └─SUBPLAN SCAN     |VIEW3|1       |3           |
|8 |  │       │   └─TABLE FULL SCAN|t4   |1       |3           |
|9 |  │       └─SCALAR GROUP BY    |     |1       |3           |
|10|  │         └─SUBPLAN SCAN     |VIEW4|1       |3           |
|11|  │           └─TABLE FULL SCAN|t4   |1       |3           |
|12|  └─TABLE RANGE SCAN           |t3   |2       |16          |
================================================================
Outputs & filters:
-------------------------------------
  0 - output(nil), filter(nil)
      table_columns([{t3: ({t3: (t3.c1, t3.c2)}), hash_distinct}])
  1 - output([t3.c1], [t3.c2]), filter(nil), rowset=16
      conds(nil), nl_params_([VIEW2.T_FUN_MIN(VIEW1.c1)(:0)]), use_batch=true
  2 - output([VIEW2.T_FUN_MIN(VIEW1.c1)]), filter(nil), rowset=16
      access([VIEW2.T_FUN_MIN(VIEW1.c1)])
  3 - output([T_FUN_MIN(VIEW1.T_FUN_MIN(t4.c1))]), filter(nil), rowset=16
      group(nil), agg_func([T_FUN_MIN(VIEW1.T_FUN_MIN(t4.c1))])
  4 - output([VIEW1.T_FUN_MIN(t4.c1)]), filter(nil), rowset=16
      access([VIEW1.T_FUN_MIN(t4.c1)])
  5 - output([UNION([1])]), filter(nil), rowset=16
  6 - output([T_FUN_MIN(VIEW3.t4.c1)]), filter(nil), rowset=16
      group(nil), agg_func([T_FUN_MIN(VIEW3.t4.c1)])
  7 - output([VIEW3.t4.c1]), filter(nil), rowset=16
      access([VIEW3.t4.c1])
  8 - output([t4.c1]), filter(nil), rowset=16
      access([t4.c1]), partitions(p0)
      limit(1), offset(nil), is_index_back=false, is_global_index=false, 
      range_key([t4.c1]), range(MIN ; MAX)always true
  9 - output([T_FUN_MIN(VIEW4.t4.c1)]), filter(nil), rowset=16
      group(nil), agg_func([T_FUN_MIN(VIEW4.t4.c1)])
 10 - output([VIEW4.t4.c1]), filter(nil), rowset=16
      access([VIEW4.t4.c1])
 11 - output([t4.c1]), filter(nil), rowset=16
      access([t4.c1]), partitions(p0)
      limit(1), offset(nil), is_index_back=false, is_global_index=false, 
      range_key([t4.c1]), range(MIN ; MAX)always true
 12 - output([t3.c1], [t3.c2]), filter(nil), rowset=16
      access([GROUP_ID], [t3.c1], [t3.c2]), partitions(p0)
      is_index_back=false, is_global_index=false, 
      range_key([t3.c1]), range(MIN ; MAX), 
      range_cond([t3.c1 > :0])
delete from t3  where c1 > any (select c1 from t4 union select c1 from t4);
select/**/ * from t3;
c1	c2
1	1
rollback;
EXPLAIN delete /*+NO_REWRITE*/from t3  where c1 > any (select c1 from t4 union select c1 from t4);
Query Plan
========================================================
|ID|OPERATOR                |NAME|EST.ROWS|EST.TIME(us)|
--------------------------------------------------------
|0 |DELETE                  |    |3       |30          |
|1 |└─SUBPLAN FILTER        |    |3       |9           |
|2 |  ├─TABLE FULL SCAN     |t3  |6       |3           |
|3 |  └─MERGE UNION DISTINCT|    |12      |6           |
|4 |    ├─TABLE FULL SCAN   |t4  |6       |3           |
|5 |    └─TABLE FULL SCAN   |t4  |6       |3           |
========================================================
Outputs & filters:
-------------------------------------
  0 - output(nil), filter(nil)
      table_columns([{t3: ({t3: (t3.c1, t3.c2)})}])
  1 - output([t3.c1], [t3.c2]), filter([t3.c1 > ANY(subquery(1))]), rowset=16
      exec_params_(nil), onetime_exprs_(nil), init_plan_idxs_([1]), use_batch=false
  2 - output([t3.c1], [t3.c2]), filter(nil), rowset=16
      access([t3.c1], [t3.c2]), partitions(p0)
      is_index_back=false, is_global_index=false, 
      range_key([t3.c1]), range(MIN ; MAX)always true
  3 - output([UNION([1])]), filter(nil), rowset=16
  4 - output([t4.c1]), filter(nil), rowset=16
      access([t4.c1]), partitions(p0)
      is_index_back=false, is_global_index=false, 
      range_key([t4.c1]), range(MIN ; MAX)always true
  5 - output([t4.c1]), filter(nil), rowset=16
      access([t4.c1]), partitions(p0)
      is_index_back=false, is_global_index=false, 
      range_key([t4.c1]), range(MIN ; MAX)always true
delete /*+NO_REWRITE*/from t3  where c1 > any (select c1 from t4 union select c1 from t4);
select/**/ * from t3;
c1	c2
1	1
rollback;
EXPLAIN insert into is_c1 select c1 from t3 where c1 > any (select c1 from t4 union select c1 from t4);
Query Plan
============================================================================
|ID|OPERATOR                         |NAME           |EST.ROWS|EST.TIME(us)|
----------------------------------------------------------------------------
|0 |INSERT                           |               |1       |34          |
|1 |└─SUBPLAN SCAN                   |ANONYMOUS_VIEW1|1       |21          |
|2 |  └─NESTED-LOOP JOIN             |               |1       |21          |
|3 |    ├─SUBPLAN SCAN               |VIEW2          |1       |5           |
|4 |    │ └─SCALAR GROUP BY          |               |1       |5           |
|5 |    │   └─SUBPLAN SCAN           |VIEW1          |2       |5           |
|6 |    │     └─MERGE UNION DISTINCT |               |2       |5           |
|7 |    │       ├─SCALAR GROUP BY    |               |1       |3           |
|8 |    │       │ └─SUBPLAN SCAN     |VIEW3          |1       |3           |
|9 |    │       │   └─TABLE FULL SCAN|t4             |1       |3           |
|10|    │       └─SCALAR GROUP BY    |               |1       |3           |
|11|    │         └─SUBPLAN SCAN     |VIEW4          |1       |3           |
|12|    │           └─TABLE FULL SCAN|t4             |1       |3           |
|13|    └─TABLE RANGE SCAN           |t3             |2       |16          |
============================================================================
Outputs & filters:
-------------------------------------
  0 - output(nil), filter(nil)
      columns([{is_c1: ({is_c1: (is_c1.__pk_increment, is_c1.a)})}]), partitions(p0), 
      column_values([T_HIDDEN_PK], [column_conv(INT,PS:(11,0),NULL,ANONYMOUS_VIEW1.c1)])
  1 - output([ANONYMOUS_VIEW1.c1]), filter(nil), rowset=16
      access([ANONYMOUS_VIEW1.c1])
  2 - output([t3.c1]), filter(nil), rowset=16
      conds(nil), nl_params_([VIEW2.T_FUN_MIN(VIEW1.c1)(:0)]), use_batch=true
  3 - output([VIEW2.T_FUN_MIN(VIEW1.c1)]), filter(nil), rowset=16
      access([VIEW2.T_FUN_MIN(VIEW1.c1)])
  4 - output([T_FUN_MIN(VIEW1.T_FUN_MIN(t4.c1))]), filter(nil), rowset=16
      group(nil), agg_func([T_FUN_MIN(VIEW1.T_FUN_MIN(t4.c1))])
  5 - output([VIEW1.T_FUN_MIN(t4.c1)]), filter(nil), rowset=16
      access([VIEW1.T_FUN_MIN(t4.c1)])
  6 - output([UNION([1])]), filter(nil), rowset=16
  7 - output([T_FUN_MIN(VIEW3.t4.c1)]), filter(nil), rowset=16
      group(nil), agg_func([T_FUN_MIN(VIEW3.t4.c1)])
  8 - output([VIEW3.t4.c1]), filter(nil), rowset=16
      access([VIEW3.t4.c1])
  9 - output([t4.c1]), filter(nil), rowset=16
      access([t4.c1]), partitions(p0)
      limit(1), offset(nil), is_index_back=false, is_global_index=false, 
      range_key([t4.c1]), range(MIN ; MAX)always true
 10 - output([T_FUN_MIN(VIEW4.t4.c1)]), filter(nil), rowset=16
      group(nil), agg_func([T_FUN_MIN(VIEW4.t4.c1)])
 11 - output([VIEW4.t4.c1]), filter(nil), rowset=16
      access([VIEW4.t4.c1])
 12 - output([t4.c1]), filter(nil), rowset=16
      access([t4.c1]), partitions(p0)
      limit(1), offset(nil), is_index_back=false, is_global_index=false, 
      range_key([t4.c1]), range(MIN ; MAX)always true
 13 - output([t3.c1]), filter(nil), rowset=16
      access([GROUP_ID], [t3.c1]), partitions(p0)
      is_index_back=false, is_global_index=false, 
      range_key([t3.c1]), range(MIN ; MAX), 
      range_cond([t3.c1 > :0])
insert into is_c1 select c1 from t3 where c1 > any (select c1 from t4 union select c1 from t4);
select/**/ * from is_c1;
a
2
3
4
5
6
rollback;
EXPLAIN insert into is_c1 select /*+NO_REWRITE*/c1 from t3 where c1 > any (select c1 from t4 union select c1 from t4);
Query Plan
=====================================================================
|ID|OPERATOR                  |NAME           |EST.ROWS|EST.TIME(us)|
---------------------------------------------------------------------
|0 |INSERT                    |               |3       |34          |
|1 |└─SUBPLAN SCAN            |ANONYMOUS_VIEW1|3       |9           |
|2 |  └─SUBPLAN FILTER        |               |3       |9           |
|3 |    ├─TABLE FULL SCAN     |t3             |6       |3           |
|4 |    └─MERGE UNION DISTINCT|               |12      |6           |
|5 |      ├─TABLE FULL SCAN   |t4             |6       |3           |
|6 |      └─TABLE FULL SCAN   |t4             |6       |3           |
=====================================================================
Outputs & filters:
-------------------------------------
  0 - output(nil), filter(nil)
      columns([{is_c1: ({is_c1: (is_c1.__pk_increment, is_c1.a)})}]), partitions(p0), 
      column_values([T_HIDDEN_PK], [column_conv(INT,PS:(11,0),NULL,ANONYMOUS_VIEW1.c1)])
  1 - output([ANONYMOUS_VIEW1.c1]), filter(nil), rowset=16
      access([ANONYMOUS_VIEW1.c1])
  2 - output([t3.c1]), filter([t3.c1 > ANY(subquery(1))]), rowset=16
      exec_params_(nil), onetime_exprs_(nil), init_plan_idxs_([1]), use_batch=false
  3 - output([t3.c1]), filter(nil), rowset=16
      access([t3.c1]), partitions(p0)
      is_index_back=false, is_global_index=false, 
      range_key([t3.c1]), range(MIN ; MAX)always true
  4 - output([UNION([1])]), filter(nil), rowset=16
  5 - output([t4.c1]), filter(nil), rowset=16
      access([t4.c1]), partitions(p0)
      is_index_back=false, is_global_index=false, 
      range_key([t4.c1]), range(MIN ; MAX)always true
  6 - output([t4.c1]), filter(nil), rowset=16
      access([t4.c1]), partitions(p0)
      is_index_back=false, is_global_index=false, 
      range_key([t4.c1]), range(MIN ; MAX)always true
insert into is_c1 select /*+NO_REWRITE*/c1 from t3 where c1 > any (select c1 from t4 union select c1 from t4);
select/**/ * from is_c1;
a
2
3
4
5
6
rollback;


# case 26
EXPLAIN select c1 from t3 where c1 > any (select c1 from t4 order by c2 limit 2);
Query Plan
========================================================
|ID|OPERATOR               |NAME |EST.ROWS|EST.TIME(us)|
--------------------------------------------------------
|0 |NESTED-LOOP SEMI JOIN  |     |6       |6           |
|1 |├─TABLE FULL SCAN      |t3   |6       |3           |
|2 |└─MATERIAL             |     |2       |3           |
|3 |  └─SUBPLAN SCAN       |VIEW1|2       |3           |
|4 |    └─TOP-N SORT       |     |2       |3           |
|5 |      └─TABLE FULL SCAN|t4   |6       |3           |
========================================================
Outputs & filters:
-------------------------------------
  0 - output([t3.c1]), filter(nil), rowset=16
      conds([t3.c1 > VIEW1.c1]), nl_params_(nil), use_batch=false
  1 - output([t3.c1]), filter(nil), rowset=16
      access([t3.c1]), partitions(p0)
      is_index_back=false, is_global_index=false, 
      range_key([t3.c1]), range(MIN ; MAX)always true
  2 - output([VIEW1.c1]), filter(nil), rowset=16
  3 - output([VIEW1.c1]), filter(nil), rowset=16
      access([VIEW1.c1])
  4 - output([t4.c1]), filter(nil), rowset=16
      sort_keys([t4.c2, ASC]), topn(2)
  5 - output([t4.c1], [t4.c2]), filter(nil), rowset=16
      access([t4.c1], [t4.c2]), partitions(p0)
      is_index_back=false, is_global_index=false, 
      range_key([t4.c1]), range(MIN ; MAX)always true
select c1 from t3 where c1 > any (select c1 from t4 order by c2 limit 2);
c1
2
3
4
5
6
EXPLAIN select /*+NO_REWRITE*/c1 from t3 where c1 > any (select c1 from t4 order by c2 limit 2);
Query Plan
===================================================
|ID|OPERATOR           |NAME|EST.ROWS|EST.TIME(us)|
---------------------------------------------------
|0 |SUBPLAN FILTER     |    |3       |6           |
|1 |├─TABLE FULL SCAN  |t3  |6       |3           |
|2 |└─TOP-N SORT       |    |2       |3           |
|3 |  └─TABLE FULL SCAN|t4  |6       |3           |
===================================================
Outputs & filters:
-------------------------------------
  0 - output([t3.c1]), filter([t3.c1 > ANY(subquery(1))]), rowset=16
      exec_params_(nil), onetime_exprs_(nil), init_plan_idxs_([1]), use_batch=false
  1 - output([t3.c1]), filter(nil), rowset=16
      access([t3.c1]), partitions(p0)
      is_index_back=false, is_global_index=false, 
      range_key([t3.c1]), range(MIN ; MAX)always true
  2 - output([t4.c1]), filter(nil), rowset=16
      sort_keys([t4.c2, ASC]), topn(2)
  3 - output([t4.c1], [t4.c2]), filter(nil), rowset=16
      access([t4.c1], [t4.c2]), partitions(p0)
      is_index_back=false, is_global_index=false, 
      range_key([t4.c1]), range(MIN ; MAX)always true
select /*+NO_REWRITE*/c1 from t3 where c1 > any (select c1 from t4 order by c2 limit 2);
c1
2
3
4
5
6
EXPLAIN update t3 set c2 = c2 + 1  where c1 > any (select c1 from t4 order by c2 limit 2);
Query Plan
============================================================
|ID|OPERATOR                   |NAME |EST.ROWS|EST.TIME(us)|
------------------------------------------------------------
|0 |UPDATE                     |     |1       |51          |
|1 |└─NESTED-LOOP JOIN         |     |1       |19          |
|2 |  ├─SUBPLAN SCAN           |VIEW2|1       |3           |
|3 |  │ └─SCALAR GROUP BY      |     |1       |3           |
|4 |  │   └─SUBPLAN SCAN       |VIEW1|2       |3           |
|5 |  │     └─TOP-N SORT       |     |2       |3           |
|6 |  │       └─TABLE FULL SCAN|t4   |6       |3           |
|7 |  └─TABLE RANGE SCAN       |t3   |2       |16          |
============================================================
Outputs & filters:
-------------------------------------
  0 - output(nil), filter(nil)
      table_columns([{t3: ({t3: (t3.c1, t3.c2)}), hash_distinct}]),
      update([t3.c2=column_conv(INT,PS:(11,0),NULL,cast(t3.c2 + 1, INT(-1, 0)))])
  1 - output([t3.c1], [t3.c2]), filter(nil), rowset=16
      conds(nil), nl_params_([VIEW2.T_FUN_MIN(VIEW1.c1)(:0)]), use_batch=true
  2 - output([VIEW2.T_FUN_MIN(VIEW1.c1)]), filter(nil), rowset=16
      access([VIEW2.T_FUN_MIN(VIEW1.c1)])
  3 - output([T_FUN_MIN(VIEW1.c1)]), filter(nil), rowset=16
      group(nil), agg_func([T_FUN_MIN(VIEW1.c1)])
  4 - output([VIEW1.c1]), filter(nil), rowset=16
      access([VIEW1.c1])
  5 - output([t4.c1]), filter(nil), rowset=16
      sort_keys([t4.c2, ASC]), topn(2)
  6 - output([t4.c1], [t4.c2]), filter(nil), rowset=16
      access([t4.c1], [t4.c2]), partitions(p0)
      is_index_back=false, is_global_index=false, 
      range_key([t4.c1]), range(MIN ; MAX)always true
  7 - output([t3.c1], [t3.c2]), filter(nil), rowset=16
      access([GROUP_ID], [t3.c1], [t3.c2]), partitions(p0)
      is_index_back=false, is_global_index=false, 
      range_key([t3.c1]), range(MIN ; MAX), 
      range_cond([t3.c1 > :0])
update t3 set c2 = c2 + 1  where c1 > any (select c1 from t4 order by c2 limit 2);
select/**/ * from t3;
c1	c2
1	1
2	6
3	3
4	7
5	5
6	8
rollback;
EXPLAIN update /*+NO_REWRITE*/t3 set c2 = c2 + 1  where c1 > any (select c1 from t4 order by c2 limit 2);
Query Plan
=====================================================
|ID|OPERATOR             |NAME|EST.ROWS|EST.TIME(us)|
-----------------------------------------------------
|0 |UPDATE               |    |3       |52          |
|1 |└─SUBPLAN FILTER     |    |3       |6           |
|2 |  ├─TABLE FULL SCAN  |t3  |6       |3           |
|3 |  └─TOP-N SORT       |    |2       |3           |
|4 |    └─TABLE FULL SCAN|t4  |6       |3           |
=====================================================
Outputs & filters:
-------------------------------------
  0 - output(nil), filter(nil)
      table_columns([{t3: ({t3: (t3.c1, t3.c2)})}]),
      update([t3.c2=column_conv(INT,PS:(11,0),NULL,cast(t3.c2 + 1, INT(-1, 0)))])
  1 - output([t3.c1], [t3.c2]), filter([t3.c1 > ANY(subquery(1))]), rowset=16
      exec_params_(nil), onetime_exprs_(nil), init_plan_idxs_([1]), use_batch=false
  2 - output([t3.c1], [t3.c2]), filter(nil), rowset=16
      access([t3.c1], [t3.c2]), partitions(p0)
      is_index_back=false, is_global_index=false, 
      range_key([t3.c1]), range(MIN ; MAX)always true
  3 - output([t4.c1]), filter(nil), rowset=16
      sort_keys([t4.c2, ASC]), topn(2)
  4 - output([t4.c1], [t4.c2]), filter(nil), rowset=16
      access([t4.c1], [t4.c2]), partitions(p0)
      is_index_back=false, is_global_index=false, 
      range_key([t4.c1]), range(MIN ; MAX)always true
update /*+NO_REWRITE*/t3 set c2 = c2 + 1  where c1 > any (select c1 from t4 order by c2 limit 2);
select/**/ * from t3;
c1	c2
1	1
2	6
3	3
4	7
5	5
6	8
rollback;
EXPLAIN delete from t3  where c1 > any (select c1 from t4 order by c2 limit 2);
Query Plan
============================================================
|ID|OPERATOR                   |NAME |EST.ROWS|EST.TIME(us)|
------------------------------------------------------------
|0 |DELETE                     |     |1       |31          |
|1 |└─NESTED-LOOP JOIN         |     |1       |19          |
|2 |  ├─SUBPLAN SCAN           |VIEW2|1       |3           |
|3 |  │ └─SCALAR GROUP BY      |     |1       |3           |
|4 |  │   └─SUBPLAN SCAN       |VIEW1|2       |3           |
|5 |  │     └─TOP-N SORT       |     |2       |3           |
|6 |  │       └─TABLE FULL SCAN|t4   |6       |3           |
|7 |  └─TABLE RANGE SCAN       |t3   |2       |16          |
============================================================
Outputs & filters:
-------------------------------------
  0 - output(nil), filter(nil)
      table_columns([{t3: ({t3: (t3.c1, t3.c2)}), hash_distinct}])
  1 - output([t3.c1], [t3.c2]), filter(nil), rowset=16
      conds(nil), nl_params_([VIEW2.T_FUN_MIN(VIEW1.c1)(:0)]), use_batch=true
  2 - output([VIEW2.T_FUN_MIN(VIEW1.c1)]), filter(nil), rowset=16
      access([VIEW2.T_FUN_MIN(VIEW1.c1)])
  3 - output([T_FUN_MIN(VIEW1.c1)]), filter(nil), rowset=16
      group(nil), agg_func([T_FUN_MIN(VIEW1.c1)])
  4 - output([VIEW1.c1]), filter(nil), rowset=16
      access([VIEW1.c1])
  5 - output([t4.c1]), filter(nil), rowset=16
      sort_keys([t4.c2, ASC]), topn(2)
  6 - output([t4.c1], [t4.c2]), filter(nil), rowset=16
      access([t4.c1], [t4.c2]), partitions(p0)
      is_index_back=false, is_global_index=false, 
      range_key([t4.c1]), range(MIN ; MAX)always true
  7 - output([t3.c1], [t3.c2]), filter(nil), rowset=16
      access([GROUP_ID], [t3.c1], [t3.c2]), partitions(p0)
      is_index_back=false, is_global_index=false, 
      range_key([t3.c1]), range(MIN ; MAX), 
      range_cond([t3.c1 > :0])
delete from t3  where c1 > any (select c1 from t4 order by c2 limit 2);
select/**/ * from t3;
c1	c2
1	1
rollback;
EXPLAIN delete /*+NO_REWRITE*/from t3  where c1 > any (select c1 from t4 order by c2 limit 2);
Query Plan
=====================================================
|ID|OPERATOR             |NAME|EST.ROWS|EST.TIME(us)|
-----------------------------------------------------
|0 |DELETE               |    |3       |27          |
|1 |└─SUBPLAN FILTER     |    |3       |6           |
|2 |  ├─TABLE FULL SCAN  |t3  |6       |3           |
|3 |  └─TOP-N SORT       |    |2       |3           |
|4 |    └─TABLE FULL SCAN|t4  |6       |3           |
=====================================================
Outputs & filters:
-------------------------------------
  0 - output(nil), filter(nil)
      table_columns([{t3: ({t3: (t3.c1, t3.c2)})}])
  1 - output([t3.c1], [t3.c2]), filter([t3.c1 > ANY(subquery(1))]), rowset=16
      exec_params_(nil), onetime_exprs_(nil), init_plan_idxs_([1]), use_batch=false
  2 - output([t3.c1], [t3.c2]), filter(nil), rowset=16
      access([t3.c1], [t3.c2]), partitions(p0)
      is_index_back=false, is_global_index=false, 
      range_key([t3.c1]), range(MIN ; MAX)always true
  3 - output([t4.c1]), filter(nil), rowset=16
      sort_keys([t4.c2, ASC]), topn(2)
  4 - output([t4.c1], [t4.c2]), filter(nil), rowset=16
      access([t4.c1], [t4.c2]), partitions(p0)
      is_index_back=false, is_global_index=false, 
      range_key([t4.c1]), range(MIN ; MAX)always true
delete /*+NO_REWRITE*/from t3  where c1 > any (select c1 from t4 order by c2 limit 2);
select/**/ * from t3;
c1	c2
1	1
rollback;
EXPLAIN insert into is_c1 select c1 from t3 where c1 > any (select c1 from t4 order by c2 limit 2);
Query Plan
======================================================================
|ID|OPERATOR                   |NAME           |EST.ROWS|EST.TIME(us)|
----------------------------------------------------------------------
|0 |INSERT                     |               |6       |50          |
|1 |└─SUBPLAN SCAN             |ANONYMOUS_VIEW1|6       |6           |
|2 |  └─NESTED-LOOP SEMI JOIN  |               |6       |6           |
|3 |    ├─TABLE FULL SCAN      |t3             |6       |3           |
|4 |    └─MATERIAL             |               |2       |3           |
|5 |      └─SUBPLAN SCAN       |VIEW1          |2       |3           |
|6 |        └─TOP-N SORT       |               |2       |3           |
|7 |          └─TABLE FULL SCAN|t4             |6       |3           |
======================================================================
Outputs & filters:
-------------------------------------
  0 - output(nil), filter(nil)
      columns([{is_c1: ({is_c1: (is_c1.__pk_increment, is_c1.a)})}]), partitions(p0), 
      column_values([T_HIDDEN_PK], [column_conv(INT,PS:(11,0),NULL,ANONYMOUS_VIEW1.c1)])
  1 - output([ANONYMOUS_VIEW1.c1]), filter(nil), rowset=16
      access([ANONYMOUS_VIEW1.c1])
  2 - output([t3.c1]), filter(nil), rowset=16
      conds([t3.c1 > VIEW1.c1]), nl_params_(nil), use_batch=false
  3 - output([t3.c1]), filter(nil), rowset=16
      access([t3.c1]), partitions(p0)
      is_index_back=false, is_global_index=false, 
      range_key([t3.c1]), range(MIN ; MAX)always true
  4 - output([VIEW1.c1]), filter(nil), rowset=16
  5 - output([VIEW1.c1]), filter(nil), rowset=16
      access([VIEW1.c1])
  6 - output([t4.c1]), filter(nil), rowset=16
      sort_keys([t4.c2, ASC]), topn(2)
  7 - output([t4.c1], [t4.c2]), filter(nil), rowset=16
      access([t4.c1], [t4.c2]), partitions(p0)
      is_index_back=false, is_global_index=false, 
      range_key([t4.c1]), range(MIN ; MAX)always true
insert into is_c1 select c1 from t3 where c1 > any (select c1 from t4 order by c2 limit 2);
select/**/ * from is_c1;
a
2
3
4
5
6
rollback;
EXPLAIN insert into is_c1 select /*+NO_REWRITE*/c1 from t3 where c1 > any (select c1 from t4 order by c2 limit 2);
Query Plan
==================================================================
|ID|OPERATOR               |NAME           |EST.ROWS|EST.TIME(us)|
------------------------------------------------------------------
|0 |INSERT                 |               |3       |31          |
|1 |└─SUBPLAN SCAN         |ANONYMOUS_VIEW1|3       |6           |
|2 |  └─SUBPLAN FILTER     |               |3       |6           |
|3 |    ├─TABLE FULL SCAN  |t3             |6       |3           |
|4 |    └─TOP-N SORT       |               |2       |3           |
|5 |      └─TABLE FULL SCAN|t4             |6       |3           |
==================================================================
Outputs & filters:
-------------------------------------
  0 - output(nil), filter(nil)
      columns([{is_c1: ({is_c1: (is_c1.__pk_increment, is_c1.a)})}]), partitions(p0), 
      column_values([T_HIDDEN_PK], [column_conv(INT,PS:(11,0),NULL,ANONYMOUS_VIEW1.c1)])
  1 - output([ANONYMOUS_VIEW1.c1]), filter(nil), rowset=16
      access([ANONYMOUS_VIEW1.c1])
  2 - output([t3.c1]), filter([t3.c1 > ANY(subquery(1))]), rowset=16
      exec_params_(nil), onetime_exprs_(nil), init_plan_idxs_([1]), use_batch=false
  3 - output([t3.c1]), filter(nil), rowset=16
      access([t3.c1]), partitions(p0)
      is_index_back=false, is_global_index=false, 
      range_key([t3.c1]), range(MIN ; MAX)always true
  4 - output([t4.c1]), filter(nil), rowset=16
      sort_keys([t4.c2, ASC]), topn(2)
  5 - output([t4.c1], [t4.c2]), filter(nil), rowset=16
      access([t4.c1], [t4.c2]), partitions(p0)
      is_index_back=false, is_global_index=false, 
      range_key([t4.c1]), range(MIN ; MAX)always true
insert into is_c1 select /*+NO_REWRITE*/c1 from t3 where c1 > any (select c1 from t4 order by c2 limit 2);
select/**/ * from is_c1;
a
2
3
4
5
6
rollback;


# case 27
EXPLAIN select  c1 from t3 where c1 > any (select t4.c1 from t4, t5 where t4.c1 = t5.c1);
Query Plan
========================================================
|ID|OPERATOR               |NAME |EST.ROWS|EST.TIME(us)|
--------------------------------------------------------
|0 |NESTED-LOOP JOIN       |     |1       |22          |
|1 |├─SUBPLAN SCAN         |VIEW2|1       |6           |
|2 |│ └─SCALAR GROUP BY    |     |1       |6           |
|3 |│   └─MERGE JOIN       |     |6       |5           |
|4 |│     ├─TABLE FULL SCAN|t4   |6       |3           |
|5 |│     └─TABLE FULL SCAN|t5   |6       |3           |
|6 |└─TABLE RANGE SCAN     |t3   |2       |16          |
========================================================
Outputs & filters:
-------------------------------------
  0 - output([t3.c1]), filter(nil), rowset=16
      conds(nil), nl_params_([VIEW2.T_FUN_MIN(VIEW1.c1)(:0)]), use_batch=true
  1 - output([VIEW2.T_FUN_MIN(VIEW1.c1)]), filter(nil), rowset=16
      access([VIEW2.T_FUN_MIN(VIEW1.c1)])
  2 - output([T_FUN_MIN(t4.c1)]), filter(nil), rowset=16
      group(nil), agg_func([T_FUN_MIN(t4.c1)])
  3 - output([t4.c1]), filter(nil), rowset=16
      equal_conds([t4.c1 = t5.c1]), other_conds(nil)
      merge_directions([ASC])
  4 - output([t4.c1]), filter(nil), rowset=16
      access([t4.c1]), partitions(p0)
      is_index_back=false, is_global_index=false, 
      range_key([t4.c1]), range(MIN ; MAX)always true
  5 - output([t5.c1]), filter(nil), rowset=16
      access([t5.c1]), partitions(p0)
      is_index_back=false, is_global_index=false, 
      range_key([t5.c1]), range(MIN ; MAX)always true
  6 - output([t3.c1]), filter(nil), rowset=16
      access([GROUP_ID], [t3.c1]), partitions(p0)
      is_index_back=false, is_global_index=false, 
      range_key([t3.c1]), range(MIN ; MAX), 
      range_cond([t3.c1 > :0])
select  c1 from t3 where c1 > any (select t4.c1 from t4, t5 where t4.c1 = t5.c1);
c1
2
3
4
5
6
EXPLAIN select /*+NO_REWRITE*/c1 from t3 where c1 > any (select t4.c1 from t4, t5 where t4.c1 = t5.c1);
Query Plan
===================================================
|ID|OPERATOR           |NAME|EST.ROWS|EST.TIME(us)|
---------------------------------------------------
|0 |SUBPLAN FILTER     |    |3       |8           |
|1 |├─TABLE FULL SCAN  |t3  |6       |3           |
|2 |└─MERGE JOIN       |    |6       |5           |
|3 |  ├─TABLE FULL SCAN|t4  |6       |3           |
|4 |  └─TABLE FULL SCAN|t5  |6       |3           |
===================================================
Outputs & filters:
-------------------------------------
  0 - output([t3.c1]), filter([t3.c1 > ANY(subquery(1))]), rowset=16
      exec_params_(nil), onetime_exprs_(nil), init_plan_idxs_([1]), use_batch=false
  1 - output([t3.c1]), filter(nil), rowset=16
      access([t3.c1]), partitions(p0)
      is_index_back=false, is_global_index=false, 
      range_key([t3.c1]), range(MIN ; MAX)always true
  2 - output([t4.c1]), filter(nil), rowset=16
      equal_conds([t4.c1 = t5.c1]), other_conds(nil)
      merge_directions([ASC])
  3 - output([t4.c1]), filter(nil), rowset=16
      access([t4.c1]), partitions(p0)
      is_index_back=false, is_global_index=false, 
      range_key([t4.c1]), range(MIN ; MAX)always true
  4 - output([t5.c1]), filter(nil), rowset=16
      access([t5.c1]), partitions(p0)
      is_index_back=false, is_global_index=false, 
      range_key([t5.c1]), range(MIN ; MAX)always true
select /*+NO_REWRITE*/c1 from t3 where c1 > any (select t4.c1 from t4, t5 where t4.c1 = t5.c1);
c1
2
3
4
5
6
EXPLAIN update t3 set c2 = c2 + 1  where c1 > any (select t4.c1 from t4, t5 where t4.c1 = t5.c1);
Query Plan
==========================================================
|ID|OPERATOR                 |NAME |EST.ROWS|EST.TIME(us)|
----------------------------------------------------------
|0 |UPDATE                   |     |1       |53          |
|1 |└─NESTED-LOOP JOIN       |     |1       |22          |
|2 |  ├─SUBPLAN SCAN         |VIEW2|1       |6           |
|3 |  │ └─SCALAR GROUP BY    |     |1       |6           |
|4 |  │   └─MERGE JOIN       |     |6       |5           |
|5 |  │     ├─TABLE FULL SCAN|t4   |6       |3           |
|6 |  │     └─TABLE FULL SCAN|t5   |6       |3           |
|7 |  └─TABLE RANGE SCAN     |t3   |2       |16          |
==========================================================
Outputs & filters:
-------------------------------------
  0 - output(nil), filter(nil)
      table_columns([{t3: ({t3: (t3.c1, t3.c2)}), hash_distinct}]),
      update([t3.c2=column_conv(INT,PS:(11,0),NULL,cast(t3.c2 + 1, INT(-1, 0)))])
  1 - output([t3.c1], [t3.c2]), filter(nil), rowset=16
      conds(nil), nl_params_([VIEW2.T_FUN_MIN(VIEW1.c1)(:0)]), use_batch=true
  2 - output([VIEW2.T_FUN_MIN(VIEW1.c1)]), filter(nil), rowset=16
      access([VIEW2.T_FUN_MIN(VIEW1.c1)])
  3 - output([T_FUN_MIN(t4.c1)]), filter(nil), rowset=16
      group(nil), agg_func([T_FUN_MIN(t4.c1)])
  4 - output([t4.c1]), filter(nil), rowset=16
      equal_conds([t4.c1 = t5.c1]), other_conds(nil)
      merge_directions([ASC])
  5 - output([t4.c1]), filter(nil), rowset=16
      access([t4.c1]), partitions(p0)
      is_index_back=false, is_global_index=false, 
      range_key([t4.c1]), range(MIN ; MAX)always true
  6 - output([t5.c1]), filter(nil), rowset=16
      access([t5.c1]), partitions(p0)
      is_index_back=false, is_global_index=false, 
      range_key([t5.c1]), range(MIN ; MAX)always true
  7 - output([t3.c1], [t3.c2]), filter(nil), rowset=16
      access([GROUP_ID], [t3.c1], [t3.c2]), partitions(p0)
      is_index_back=false, is_global_index=false, 
      range_key([t3.c1]), range(MIN ; MAX), 
      range_cond([t3.c1 > :0])
update t3 set c2 = c2 + 1  where c1 > any (select t4.c1 from t4, t5 where t4.c1 = t5.c1);
select/**/ * from t3;
c1	c2
1	1
2	6
3	3
4	7
5	5
6	8
rollback;
EXPLAIN update /*+NO_REWRITE*/t3 set c2 = c2 + 1  where c1 > any (select t4.c1 from t4, t5 where t4.c1 = t5.c1);
Query Plan
=====================================================
|ID|OPERATOR             |NAME|EST.ROWS|EST.TIME(us)|
-----------------------------------------------------
|0 |UPDATE               |    |3       |55          |
|1 |└─SUBPLAN FILTER     |    |3       |8           |
|2 |  ├─TABLE FULL SCAN  |t3  |6       |3           |
|3 |  └─MERGE JOIN       |    |6       |5           |
|4 |    ├─TABLE FULL SCAN|t4  |6       |3           |
|5 |    └─TABLE FULL SCAN|t5  |6       |3           |
=====================================================
Outputs & filters:
-------------------------------------
  0 - output(nil), filter(nil)
      table_columns([{t3: ({t3: (t3.c1, t3.c2)})}]),
      update([t3.c2=column_conv(INT,PS:(11,0),NULL,cast(t3.c2 + 1, INT(-1, 0)))])
  1 - output([t3.c1], [t3.c2]), filter([t3.c1 > ANY(subquery(1))]), rowset=16
      exec_params_(nil), onetime_exprs_(nil), init_plan_idxs_([1]), use_batch=false
  2 - output([t3.c1], [t3.c2]), filter(nil), rowset=16
      access([t3.c1], [t3.c2]), partitions(p0)
      is_index_back=false, is_global_index=false, 
      range_key([t3.c1]), range(MIN ; MAX)always true
  3 - output([t4.c1]), filter(nil), rowset=16
      equal_conds([t4.c1 = t5.c1]), other_conds(nil)
      merge_directions([ASC])
  4 - output([t4.c1]), filter(nil), rowset=16
      access([t4.c1]), partitions(p0)
      is_index_back=false, is_global_index=false, 
      range_key([t4.c1]), range(MIN ; MAX)always true
  5 - output([t5.c1]), filter(nil), rowset=16
      access([t5.c1]), partitions(p0)
      is_index_back=false, is_global_index=false, 
      range_key([t5.c1]), range(MIN ; MAX)always true
update /*+NO_REWRITE*/t3 set c2 = c2 + 1  where c1 > any (select t4.c1 from t4, t5 where t4.c1 = t5.c1);
select/**/ * from t3;
c1	c2
1	1
2	6
3	3
4	7
5	5
6	8
rollback;
EXPLAIN delete from t3  where c1 > any (select t4.c1 from t4, t5 where t4.c1 = t5.c1);
Query Plan
==========================================================
|ID|OPERATOR                 |NAME |EST.ROWS|EST.TIME(us)|
----------------------------------------------------------
|0 |DELETE                   |     |1       |33          |
|1 |└─NESTED-LOOP JOIN       |     |1       |22          |
|2 |  ├─SUBPLAN SCAN         |VIEW2|1       |6           |
|3 |  │ └─SCALAR GROUP BY    |     |1       |6           |
|4 |  │   └─MERGE JOIN       |     |6       |5           |
|5 |  │     ├─TABLE FULL SCAN|t4   |6       |3           |
|6 |  │     └─TABLE FULL SCAN|t5   |6       |3           |
|7 |  └─TABLE RANGE SCAN     |t3   |2       |16          |
==========================================================
Outputs & filters:
-------------------------------------
  0 - output(nil), filter(nil)
      table_columns([{t3: ({t3: (t3.c1, t3.c2)}), hash_distinct}])
  1 - output([t3.c1], [t3.c2]), filter(nil), rowset=16
      conds(nil), nl_params_([VIEW2.T_FUN_MIN(VIEW1.c1)(:0)]), use_batch=true
  2 - output([VIEW2.T_FUN_MIN(VIEW1.c1)]), filter(nil), rowset=16
      access([VIEW2.T_FUN_MIN(VIEW1.c1)])
  3 - output([T_FUN_MIN(t4.c1)]), filter(nil), rowset=16
      group(nil), agg_func([T_FUN_MIN(t4.c1)])
  4 - output([t4.c1]), filter(nil), rowset=16
      equal_conds([t4.c1 = t5.c1]), other_conds(nil)
      merge_directions([ASC])
  5 - output([t4.c1]), filter(nil), rowset=16
      access([t4.c1]), partitions(p0)
      is_index_back=false, is_global_index=false, 
      range_key([t4.c1]), range(MIN ; MAX)always true
  6 - output([t5.c1]), filter(nil), rowset=16
      access([t5.c1]), partitions(p0)
      is_index_back=false, is_global_index=false, 
      range_key([t5.c1]), range(MIN ; MAX)always true
  7 - output([t3.c1], [t3.c2]), filter(nil), rowset=16
      access([GROUP_ID], [t3.c1], [t3.c2]), partitions(p0)
      is_index_back=false, is_global_index=false, 
      range_key([t3.c1]), range(MIN ; MAX), 
      range_cond([t3.c1 > :0])
delete from t3  where c1 > any (select t4.c1 from t4, t5 where t4.c1 = t5.c1);
select/**/ * from t3;
c1	c2
1	1
rollback;
EXPLAIN delete /*+NO_REWRITE*/from t3  where c1 > any (select t4.c1 from t4, t5 where t4.c1 = t5.c1);
Query Plan
=====================================================
|ID|OPERATOR             |NAME|EST.ROWS|EST.TIME(us)|
-----------------------------------------------------
|0 |DELETE               |    |3       |30          |
|1 |└─SUBPLAN FILTER     |    |3       |8           |
|2 |  ├─TABLE FULL SCAN  |t3  |6       |3           |
|3 |  └─MERGE JOIN       |    |6       |5           |
|4 |    ├─TABLE FULL SCAN|t4  |6       |3           |
|5 |    └─TABLE FULL SCAN|t5  |6       |3           |
=====================================================
Outputs & filters:
-------------------------------------
  0 - output(nil), filter(nil)
      table_columns([{t3: ({t3: (t3.c1, t3.c2)})}])
  1 - output([t3.c1], [t3.c2]), filter([t3.c1 > ANY(subquery(1))]), rowset=16
      exec_params_(nil), onetime_exprs_(nil), init_plan_idxs_([1]), use_batch=false
  2 - output([t3.c1], [t3.c2]), filter(nil), rowset=16
      access([t3.c1], [t3.c2]), partitions(p0)
      is_index_back=false, is_global_index=false, 
      range_key([t3.c1]), range(MIN ; MAX)always true
  3 - output([t4.c1]), filter(nil), rowset=16
      equal_conds([t4.c1 = t5.c1]), other_conds(nil)
      merge_directions([ASC])
  4 - output([t4.c1]), filter(nil), rowset=16
      access([t4.c1]), partitions(p0)
      is_index_back=false, is_global_index=false, 
      range_key([t4.c1]), range(MIN ; MAX)always true
  5 - output([t5.c1]), filter(nil), rowset=16
      access([t5.c1]), partitions(p0)
      is_index_back=false, is_global_index=false, 
      range_key([t5.c1]), range(MIN ; MAX)always true
delete /*+NO_REWRITE*/from t3  where c1 > any (select t4.c1 from t4, t5 where t4.c1 = t5.c1);
select/**/ * from t3;
c1	c2
1	1
rollback;
EXPLAIN insert into is_c1 select c1 from t3 where c1 > any (select t4.c1 from t4, t5 where t4.c1 = t5.c1);
Query Plan
======================================================================
|ID|OPERATOR                   |NAME           |EST.ROWS|EST.TIME(us)|
----------------------------------------------------------------------
|0 |INSERT                     |               |1       |35          |
|1 |└─SUBPLAN SCAN             |ANONYMOUS_VIEW1|1       |22          |
|2 |  └─NESTED-LOOP JOIN       |               |1       |22          |
|3 |    ├─SUBPLAN SCAN         |VIEW2          |1       |6           |
|4 |    │ └─SCALAR GROUP BY    |               |1       |6           |
|5 |    │   └─MERGE JOIN       |               |6       |5           |
|6 |    │     ├─TABLE FULL SCAN|t4             |6       |3           |
|7 |    │     └─TABLE FULL SCAN|t5             |6       |3           |
|8 |    └─TABLE RANGE SCAN     |t3             |2       |16          |
======================================================================
Outputs & filters:
-------------------------------------
  0 - output(nil), filter(nil)
      columns([{is_c1: ({is_c1: (is_c1.__pk_increment, is_c1.a)})}]), partitions(p0), 
      column_values([T_HIDDEN_PK], [column_conv(INT,PS:(11,0),NULL,ANONYMOUS_VIEW1.c1)])
  1 - output([ANONYMOUS_VIEW1.c1]), filter(nil), rowset=16
      access([ANONYMOUS_VIEW1.c1])
  2 - output([t3.c1]), filter(nil), rowset=16
      conds(nil), nl_params_([VIEW2.T_FUN_MIN(VIEW1.c1)(:0)]), use_batch=true
  3 - output([VIEW2.T_FUN_MIN(VIEW1.c1)]), filter(nil), rowset=16
      access([VIEW2.T_FUN_MIN(VIEW1.c1)])
  4 - output([T_FUN_MIN(t4.c1)]), filter(nil), rowset=16
      group(nil), agg_func([T_FUN_MIN(t4.c1)])
  5 - output([t4.c1]), filter(nil), rowset=16
      equal_conds([t4.c1 = t5.c1]), other_conds(nil)
      merge_directions([ASC])
  6 - output([t4.c1]), filter(nil), rowset=16
      access([t4.c1]), partitions(p0)
      is_index_back=false, is_global_index=false, 
      range_key([t4.c1]), range(MIN ; MAX)always true
  7 - output([t5.c1]), filter(nil), rowset=16
      access([t5.c1]), partitions(p0)
      is_index_back=false, is_global_index=false, 
      range_key([t5.c1]), range(MIN ; MAX)always true
  8 - output([t3.c1]), filter(nil), rowset=16
      access([GROUP_ID], [t3.c1]), partitions(p0)
      is_index_back=false, is_global_index=false, 
      range_key([t3.c1]), range(MIN ; MAX), 
      range_cond([t3.c1 > :0])
insert into is_c1 select c1 from t3 where c1 > any (select t4.c1 from t4, t5 where t4.c1 = t5.c1);
select/**/ * from is_c1;
a
2
3
4
5
6
rollback;
EXPLAIN insert into is_c1 select /*+NO_REWRITE*/c1 from t3 where c1 > any (select t4.c1 from t4, t5 where t4.c1 = t5.c1);
Query Plan
==================================================================
|ID|OPERATOR               |NAME           |EST.ROWS|EST.TIME(us)|
------------------------------------------------------------------
|0 |INSERT                 |               |3       |34          |
|1 |└─SUBPLAN SCAN         |ANONYMOUS_VIEW1|3       |8           |
|2 |  └─SUBPLAN FILTER     |               |3       |8           |
|3 |    ├─TABLE FULL SCAN  |t3             |6       |3           |
|4 |    └─MERGE JOIN       |               |6       |5           |
|5 |      ├─TABLE FULL SCAN|t4             |6       |3           |
|6 |      └─TABLE FULL SCAN|t5             |6       |3           |
==================================================================
Outputs & filters:
-------------------------------------
  0 - output(nil), filter(nil)
      columns([{is_c1: ({is_c1: (is_c1.__pk_increment, is_c1.a)})}]), partitions(p0), 
      column_values([T_HIDDEN_PK], [column_conv(INT,PS:(11,0),NULL,ANONYMOUS_VIEW1.c1)])
  1 - output([ANONYMOUS_VIEW1.c1]), filter(nil), rowset=16
      access([ANONYMOUS_VIEW1.c1])
  2 - output([t3.c1]), filter([t3.c1 > ANY(subquery(1))]), rowset=16
      exec_params_(nil), onetime_exprs_(nil), init_plan_idxs_([1]), use_batch=false
  3 - output([t3.c1]), filter(nil), rowset=16
      access([t3.c1]), partitions(p0)
      is_index_back=false, is_global_index=false, 
      range_key([t3.c1]), range(MIN ; MAX)always true
  4 - output([t4.c1]), filter(nil), rowset=16
      equal_conds([t4.c1 = t5.c1]), other_conds(nil)
      merge_directions([ASC])
  5 - output([t4.c1]), filter(nil), rowset=16
      access([t4.c1]), partitions(p0)
      is_index_back=false, is_global_index=false, 
      range_key([t4.c1]), range(MIN ; MAX)always true
  6 - output([t5.c1]), filter(nil), rowset=16
      access([t5.c1]), partitions(p0)
      is_index_back=false, is_global_index=false, 
      range_key([t5.c1]), range(MIN ; MAX)always true
insert into is_c1 select /*+NO_REWRITE*/c1 from t3 where c1 > any (select t4.c1 from t4, t5 where t4.c1 = t5.c1);
select/**/ * from is_c1;
a
2
3
4
5
6
rollback;


# case 28
## 表达式子查询，包含 any/all
EXPLAIN select * from t1 where t1.b > any (select 1 * 1) and t1.c < any (select 20 * 1);
Query Plan
===============================================
|ID|OPERATOR       |NAME|EST.ROWS|EST.TIME(us)|
-----------------------------------------------
|0 |TABLE FULL SCAN|t1  |8       |4           |
===============================================
Outputs & filters:
-------------------------------------
  0 - output([t1.a], [t1.b], [t1.c]), filter([t1.b > 1 * 1], [t1.c < 20 * 1]), rowset=16
      access([t1.a], [t1.b], [t1.c]), partitions(p0)
      is_index_back=false, is_global_index=false, filter_before_indexback[false,false], 
      range_key([t1.a]), range(MIN ; MAX)always true
select * from t1 where t1.b > any (select 1 * 1) and t1.c < any (select 20 * 1);
a	b	c
2	2	1
3	3	0
4	4	1
5	5	0
6	6	1
7	7	0
8	8	1
EXPLAIN select /*+NO_REWRITE*/* from t1 where t1.b > any (select 1 * 1) and t1.c < any (select 20 * 1);
Query Plan
=================================================
|ID|OPERATOR         |NAME|EST.ROWS|EST.TIME(us)|
-------------------------------------------------
|0 |SUBPLAN FILTER   |    |3       |3           |
|1 |├─TABLE FULL SCAN|t1  |8       |3           |
|2 |├─EXPRESSION     |    |1       |1           |
|3 |└─EXPRESSION     |    |1       |1           |
=================================================
Outputs & filters:
-------------------------------------
  0 - output([t1.a], [t1.b], [t1.c]), filter([t1.b > ANY(subquery(1))], [t1.c < ANY(subquery(2))]), rowset=16
      exec_params_(nil), onetime_exprs_(nil), init_plan_idxs_([1], [2]), use_batch=false
  1 - output([t1.a], [t1.b], [t1.c]), filter(nil), rowset=16
      access([t1.a], [t1.b], [t1.c]), partitions(p0)
      is_index_back=false, is_global_index=false, 
      range_key([t1.a]), range(MIN ; MAX)always true
  2 - output([1 * 1]), filter(nil)
      values({1 * 1})
  3 - output([20 * 1]), filter(nil)
      values({20 * 1})
select /*+NO_REWRITE*/* from t1 where t1.b > any (select 1 * 1) and t1.c < any (select 20 * 1);
a	b	c
2	2	1
3	3	0
4	4	1
5	5	0
6	6	1
7	7	0
8	8	1
EXPLAIN update t1 set b = b + 1 where t1.b > any (select 1 * 1) and t1.c < any (select 20 * 1);
Query Plan
=================================================
|ID|OPERATOR         |NAME|EST.ROWS|EST.TIME(us)|
-------------------------------------------------
|0 |UPDATE           |    |8       |88          |
|1 |└─TABLE FULL SCAN|t1  |8       |4           |
=================================================
Outputs & filters:
-------------------------------------
  0 - output(nil), filter(nil)
      table_columns([{t1: ({t1: (t1.a, t1.b, t1.c)})}]),
      update([t1.b=column_conv(INT,PS:(11,0),NULL,cast(t1.b + 1, INT(-1, 0)))])
  1 - output([t1.a], [t1.b], [t1.c]), filter([t1.b > 1 * 1], [t1.c < 20 * 1]), rowset=16
      access([t1.a], [t1.b], [t1.c]), partitions(p0)
      is_index_back=false, is_global_index=false, filter_before_indexback[false,false], 
      range_key([t1.a]), range(MIN ; MAX)always true
update t1 set b = b + 1 where t1.b > any (select 1 * 1) and t1.c < any (select 20 * 1);
select/**/ * from t1;
a	b	c
1	1	0
2	3	1
3	4	0
4	5	1
5	6	0
6	7	1
7	8	0
8	9	1
rollback;
update/*+NO_REWRITE*/ t1 set b = b + 1 where t1.b > any (select 1 * 1) and t1.c < any (select 20 * 1);
select/**/ * from t1;
a	b	c
1	1	0
2	3	1
3	4	0
4	5	1
5	6	0
6	7	1
7	8	0
8	9	1
rollback;
EXPLAIN delete from t1 where t1.b > any (select 1 * 1) and t1.c < any (select 20 * 1);
Query Plan
=================================================
|ID|OPERATOR         |NAME|EST.ROWS|EST.TIME(us)|
-------------------------------------------------
|0 |DELETE           |    |8       |50          |
|1 |└─TABLE FULL SCAN|t1  |8       |4           |
=================================================
Outputs & filters:
-------------------------------------
  0 - output(nil), filter(nil)
      table_columns([{t1: ({t1: (t1.a, t1.b, t1.c)})}])
  1 - output([t1.a], [t1.b], [t1.c]), filter([t1.b > 1 * 1], [t1.c < 20 * 1]), rowset=16
      access([t1.a], [t1.b], [t1.c]), partitions(p0)
      is_index_back=false, is_global_index=false, filter_before_indexback[false,false], 
      range_key([t1.a]), range(MIN ; MAX)always true
delete from t1 where t1.b > any (select 1 * 1) and t1.c < any (select 20 * 1);
select/**/ * from t1;
a	b	c
1	1	0
rollback;
delete/*+NO_REWRITE*/ from t1 where t1.b > any (select 1 * 1) and t1.c < any (select 20 * 1);
select/**/ * from t1;
a	b	c
1	1	0
rollback;
EXPLAIN insert into is_c3 select * from t1 where t1.b > any (select 1 * 1) and t1.c < any (select 20 * 1);
Query Plan
==============================================================
|ID|OPERATOR           |NAME           |EST.ROWS|EST.TIME(us)|
--------------------------------------------------------------
|0 |INSERT             |               |8       |61          |
|1 |└─SUBPLAN SCAN     |ANONYMOUS_VIEW1|8       |4           |
|2 |  └─TABLE FULL SCAN|t1             |8       |4           |
==============================================================
Outputs & filters:
-------------------------------------
  0 - output(nil), filter(nil)
      columns([{is_c3: ({is_c3: (is_c3.__pk_increment, is_c3.a, is_c3.b, is_c3.c)})}]), partitions(p0), 
      column_values([T_HIDDEN_PK], [column_conv(INT,PS:(11,0),NULL,ANONYMOUS_VIEW1.a)], [column_conv(INT,PS:(11,0),NULL,ANONYMOUS_VIEW1.b)], [column_conv(INT,
      PS:(11,0),NULL,ANONYMOUS_VIEW1.c)])
  1 - output([ANONYMOUS_VIEW1.a], [ANONYMOUS_VIEW1.b], [ANONYMOUS_VIEW1.c]), filter(nil), rowset=16
      access([ANONYMOUS_VIEW1.a], [ANONYMOUS_VIEW1.b], [ANONYMOUS_VIEW1.c])
  2 - output([t1.a], [t1.b], [t1.c]), filter([t1.b > 1 * 1], [t1.c < 20 * 1]), rowset=16
      access([t1.a], [t1.b], [t1.c]), partitions(p0)
      is_index_back=false, is_global_index=false, filter_before_indexback[false,false], 
      range_key([t1.a]), range(MIN ; MAX)always true
insert into is_c3 select * from t1 where t1.b > any (select 1 * 1) and t1.c < any (select 20 * 1);
select/**/ * from is_c3;
a	b	c
2	2	1
3	3	0
4	4	1
5	5	0
6	6	1
7	7	0
8	8	1
rollback;
EXPLAIN insert into is_c3 select /*+NO_REWRITE*/* from t1 where t1.b > any (select 1 * 1) and t1.c < any (select 20 * 1);
Query Plan
================================================================
|ID|OPERATOR             |NAME           |EST.ROWS|EST.TIME(us)|
----------------------------------------------------------------
|0 |INSERT               |               |3       |28          |
|1 |└─SUBPLAN SCAN       |ANONYMOUS_VIEW1|3       |3           |
|2 |  └─SUBPLAN FILTER   |               |3       |3           |
|3 |    ├─TABLE FULL SCAN|t1             |8       |3           |
|4 |    ├─EXPRESSION     |               |1       |1           |
|5 |    └─EXPRESSION     |               |1       |1           |
================================================================
Outputs & filters:
-------------------------------------
  0 - output(nil), filter(nil)
      columns([{is_c3: ({is_c3: (is_c3.__pk_increment, is_c3.a, is_c3.b, is_c3.c)})}]), partitions(p0), 
      column_values([T_HIDDEN_PK], [column_conv(INT,PS:(11,0),NULL,ANONYMOUS_VIEW1.a)], [column_conv(INT,PS:(11,0),NULL,ANONYMOUS_VIEW1.b)], [column_conv(INT,
      PS:(11,0),NULL,ANONYMOUS_VIEW1.c)])
  1 - output([ANONYMOUS_VIEW1.a], [ANONYMOUS_VIEW1.b], [ANONYMOUS_VIEW1.c]), filter(nil), rowset=16
      access([ANONYMOUS_VIEW1.a], [ANONYMOUS_VIEW1.b], [ANONYMOUS_VIEW1.c])
  2 - output([t1.a], [t1.b], [t1.c]), filter([t1.b > ANY(subquery(1))], [t1.c < ANY(subquery(2))]), rowset=16
      exec_params_(nil), onetime_exprs_(nil), init_plan_idxs_([1], [2]), use_batch=false
  3 - output([t1.a], [t1.b], [t1.c]), filter(nil), rowset=16
      access([t1.a], [t1.b], [t1.c]), partitions(p0)
      is_index_back=false, is_global_index=false, 
      range_key([t1.a]), range(MIN ; MAX)always true
  4 - output([1 * 1]), filter(nil)
      values({1 * 1})
  5 - output([20 * 1]), filter(nil)
      values({20 * 1})
insert into is_c3 select /*+NO_REWRITE*/* from t1 where t1.b > any (select 1 * 1) and t1.c < any (select 20 * 1);
select/**/ * from is_c3;
a	b	c
2	2	1
3	3	0
4	4	1
5	5	0
6	6	1
7	7	0
8	8	1
rollback;


# case 29
EXPLAIN select * from t1 where t1.b > all (select 1 * 1) and t1.c < all (select 20 * 1);
Query Plan
===============================================
|ID|OPERATOR       |NAME|EST.ROWS|EST.TIME(us)|
-----------------------------------------------
|0 |TABLE FULL SCAN|t1  |8       |4           |
===============================================
Outputs & filters:
-------------------------------------
  0 - output([t1.a], [t1.b], [t1.c]), filter([t1.b > 1 * 1], [t1.c < 20 * 1]), rowset=16
      access([t1.a], [t1.b], [t1.c]), partitions(p0)
      is_index_back=false, is_global_index=false, filter_before_indexback[false,false], 
      range_key([t1.a]), range(MIN ; MAX)always true
select * from t1 where t1.b > all (select 1 * 1) and t1.c < all (select 20 * 1);
a	b	c
2	2	1
3	3	0
4	4	1
5	5	0
6	6	1
7	7	0
8	8	1
EXPLAIN select /*+NO_REWRITE*/* from t1 where t1.b > all (select 1 * 1) and t1.c < all (select 20 * 1);
Query Plan
=================================================
|ID|OPERATOR         |NAME|EST.ROWS|EST.TIME(us)|
-------------------------------------------------
|0 |SUBPLAN FILTER   |    |3       |3           |
|1 |├─TABLE FULL SCAN|t1  |8       |3           |
|2 |├─EXPRESSION     |    |1       |1           |
|3 |└─EXPRESSION     |    |1       |1           |
=================================================
Outputs & filters:
-------------------------------------
  0 - output([t1.a], [t1.b], [t1.c]), filter([t1.b > ALL(subquery(1))], [t1.c < ALL(subquery(2))]), rowset=16
      exec_params_(nil), onetime_exprs_(nil), init_plan_idxs_([1], [2]), use_batch=false
  1 - output([t1.a], [t1.b], [t1.c]), filter(nil), rowset=16
      access([t1.a], [t1.b], [t1.c]), partitions(p0)
      is_index_back=false, is_global_index=false, 
      range_key([t1.a]), range(MIN ; MAX)always true
  2 - output([1 * 1]), filter(nil)
      values({1 * 1})
  3 - output([20 * 1]), filter(nil)
      values({20 * 1})
select /*+NO_REWRITE*/* from t1 where t1.b > all (select 1 * 1) and t1.c < all (select 20 * 1);
a	b	c
2	2	1
3	3	0
4	4	1
5	5	0
6	6	1
7	7	0
8	8	1
EXPLAIN update t1 set b = b + 1 where t1.b > all (select 1 * 1) and t1.c < all (select 20 * 1);
Query Plan
=================================================
|ID|OPERATOR         |NAME|EST.ROWS|EST.TIME(us)|
-------------------------------------------------
|0 |UPDATE           |    |8       |88          |
|1 |└─TABLE FULL SCAN|t1  |8       |4           |
=================================================
Outputs & filters:
-------------------------------------
  0 - output(nil), filter(nil)
      table_columns([{t1: ({t1: (t1.a, t1.b, t1.c)})}]),
      update([t1.b=column_conv(INT,PS:(11,0),NULL,cast(t1.b + 1, INT(-1, 0)))])
  1 - output([t1.a], [t1.b], [t1.c]), filter([t1.b > 1 * 1], [t1.c < 20 * 1]), rowset=16
      access([t1.a], [t1.b], [t1.c]), partitions(p0)
      is_index_back=false, is_global_index=false, filter_before_indexback[false,false], 
      range_key([t1.a]), range(MIN ; MAX)always true
update t1 set b = b + 1 where t1.b > all (select 1 * 1) and t1.c < all (select 20 * 1);
select/**/ * from t1;
a	b	c
1	1	0
2	3	1
3	4	0
4	5	1
5	6	0
6	7	1
7	8	0
8	9	1
rollback;
EXPLAIN update /*+NO_REWRITE*/t1 set b = b + 1 where t1.b > all (select 1 * 1) and t1.c < all (select 20 * 1);
Query Plan
===================================================
|ID|OPERATOR           |NAME|EST.ROWS|EST.TIME(us)|
---------------------------------------------------
|0 |UPDATE             |    |3       |49          |
|1 |└─SUBPLAN FILTER   |    |3       |3           |
|2 |  ├─TABLE FULL SCAN|t1  |8       |3           |
|3 |  ├─EXPRESSION     |    |1       |1           |
|4 |  └─EXPRESSION     |    |1       |1           |
===================================================
Outputs & filters:
-------------------------------------
  0 - output(nil), filter(nil)
      table_columns([{t1: ({t1: (t1.a, t1.b, t1.c)})}]),
      update([t1.b=column_conv(INT,PS:(11,0),NULL,cast(t1.b + 1, INT(-1, 0)))])
  1 - output([t1.a], [t1.b], [t1.c]), filter([t1.b > ALL(subquery(1))], [t1.c < ALL(subquery(2))]), rowset=16
      exec_params_(nil), onetime_exprs_(nil), init_plan_idxs_([1], [2]), use_batch=false
  2 - output([t1.a], [t1.b], [t1.c]), filter(nil), rowset=16
      access([t1.a], [t1.b], [t1.c]), partitions(p0)
      is_index_back=false, is_global_index=false, 
      range_key([t1.a]), range(MIN ; MAX)always true
  3 - output([1 * 1]), filter(nil)
      values({1 * 1})
  4 - output([20 * 1]), filter(nil)
      values({20 * 1})
update /*+NO_REWRITE*/t1 set b = b + 1 where t1.b > all (select 1 * 1) and t1.c < all (select 20 * 1);
select/**/ * from t1;
a	b	c
1	1	0
2	3	1
3	4	0
4	5	1
5	6	0
6	7	1
7	8	0
8	9	1
rollback;
EXPLAIN delete from t1 where t1.b > all (select 1 * 1) and t1.c < all (select 20 * 1);
Query Plan
=================================================
|ID|OPERATOR         |NAME|EST.ROWS|EST.TIME(us)|
-------------------------------------------------
|0 |DELETE           |    |8       |50          |
|1 |└─TABLE FULL SCAN|t1  |8       |4           |
=================================================
Outputs & filters:
-------------------------------------
  0 - output(nil), filter(nil)
      table_columns([{t1: ({t1: (t1.a, t1.b, t1.c)})}])
  1 - output([t1.a], [t1.b], [t1.c]), filter([t1.b > 1 * 1], [t1.c < 20 * 1]), rowset=16
      access([t1.a], [t1.b], [t1.c]), partitions(p0)
      is_index_back=false, is_global_index=false, filter_before_indexback[false,false], 
      range_key([t1.a]), range(MIN ; MAX)always true
delete from t1 where t1.b > all (select 1 * 1) and t1.c < all (select 20 * 1);
select/**/ * from t1;
a	b	c
1	1	0
rollback;
EXPLAIN delete /*+NO_REWRITE*/from t1 where t1.b > all (select 1 * 1) and t1.c < all (select 20 * 1);
Query Plan
===================================================
|ID|OPERATOR           |NAME|EST.ROWS|EST.TIME(us)|
---------------------------------------------------
|0 |DELETE             |    |3       |24          |
|1 |└─SUBPLAN FILTER   |    |3       |3           |
|2 |  ├─TABLE FULL SCAN|t1  |8       |3           |
|3 |  ├─EXPRESSION     |    |1       |1           |
|4 |  └─EXPRESSION     |    |1       |1           |
===================================================
Outputs & filters:
-------------------------------------
  0 - output(nil), filter(nil)
      table_columns([{t1: ({t1: (t1.a, t1.b, t1.c)})}])
  1 - output([t1.a], [t1.b], [t1.c]), filter([t1.b > ALL(subquery(1))], [t1.c < ALL(subquery(2))]), rowset=16
      exec_params_(nil), onetime_exprs_(nil), init_plan_idxs_([1], [2]), use_batch=false
  2 - output([t1.a], [t1.b], [t1.c]), filter(nil), rowset=16
      access([t1.a], [t1.b], [t1.c]), partitions(p0)
      is_index_back=false, is_global_index=false, 
      range_key([t1.a]), range(MIN ; MAX)always true
  3 - output([1 * 1]), filter(nil)
      values({1 * 1})
  4 - output([20 * 1]), filter(nil)
      values({20 * 1})
delete /*+NO_REWRITE*/from t1 where t1.b > all (select 1 * 1) and t1.c < all (select 20 * 1);
select/**/ * from t1;
a	b	c
1	1	0
rollback;
EXPLAIN insert into is_c3 select * from t1 where t1.b > all (select 1 * 1) and t1.c < all (select 20 * 1);
Query Plan
==============================================================
|ID|OPERATOR           |NAME           |EST.ROWS|EST.TIME(us)|
--------------------------------------------------------------
|0 |INSERT             |               |8       |61          |
|1 |└─SUBPLAN SCAN     |ANONYMOUS_VIEW1|8       |4           |
|2 |  └─TABLE FULL SCAN|t1             |8       |4           |
==============================================================
Outputs & filters:
-------------------------------------
  0 - output(nil), filter(nil)
      columns([{is_c3: ({is_c3: (is_c3.__pk_increment, is_c3.a, is_c3.b, is_c3.c)})}]), partitions(p0), 
      column_values([T_HIDDEN_PK], [column_conv(INT,PS:(11,0),NULL,ANONYMOUS_VIEW1.a)], [column_conv(INT,PS:(11,0),NULL,ANONYMOUS_VIEW1.b)], [column_conv(INT,
      PS:(11,0),NULL,ANONYMOUS_VIEW1.c)])
  1 - output([ANONYMOUS_VIEW1.a], [ANONYMOUS_VIEW1.b], [ANONYMOUS_VIEW1.c]), filter(nil), rowset=16
      access([ANONYMOUS_VIEW1.a], [ANONYMOUS_VIEW1.b], [ANONYMOUS_VIEW1.c])
  2 - output([t1.a], [t1.b], [t1.c]), filter([t1.b > 1 * 1], [t1.c < 20 * 1]), rowset=16
      access([t1.a], [t1.b], [t1.c]), partitions(p0)
      is_index_back=false, is_global_index=false, filter_before_indexback[false,false], 
      range_key([t1.a]), range(MIN ; MAX)always true
insert into is_c3 select * from t1 where t1.b > all (select 1 * 1) and t1.c < all (select 20 * 1);
select/**/ * from is_c3;
a	b	c
2	2	1
3	3	0
4	4	1
5	5	0
6	6	1
7	7	0
8	8	1
rollback;
EXPLAIN insert into is_c3 select /*+NO_REWRITE*/* from t1 where t1.b > all (select 1 * 1) and t1.c < all (select 20 * 1);
Query Plan
================================================================
|ID|OPERATOR             |NAME           |EST.ROWS|EST.TIME(us)|
----------------------------------------------------------------
|0 |INSERT               |               |3       |28          |
|1 |└─SUBPLAN SCAN       |ANONYMOUS_VIEW1|3       |3           |
|2 |  └─SUBPLAN FILTER   |               |3       |3           |
|3 |    ├─TABLE FULL SCAN|t1             |8       |3           |
|4 |    ├─EXPRESSION     |               |1       |1           |
|5 |    └─EXPRESSION     |               |1       |1           |
================================================================
Outputs & filters:
-------------------------------------
  0 - output(nil), filter(nil)
      columns([{is_c3: ({is_c3: (is_c3.__pk_increment, is_c3.a, is_c3.b, is_c3.c)})}]), partitions(p0), 
      column_values([T_HIDDEN_PK], [column_conv(INT,PS:(11,0),NULL,ANONYMOUS_VIEW1.a)], [column_conv(INT,PS:(11,0),NULL,ANONYMOUS_VIEW1.b)], [column_conv(INT,
      PS:(11,0),NULL,ANONYMOUS_VIEW1.c)])
  1 - output([ANONYMOUS_VIEW1.a], [ANONYMOUS_VIEW1.b], [ANONYMOUS_VIEW1.c]), filter(nil), rowset=16
      access([ANONYMOUS_VIEW1.a], [ANONYMOUS_VIEW1.b], [ANONYMOUS_VIEW1.c])
  2 - output([t1.a], [t1.b], [t1.c]), filter([t1.b > ALL(subquery(1))], [t1.c < ALL(subquery(2))]), rowset=16
      exec_params_(nil), onetime_exprs_(nil), init_plan_idxs_([1], [2]), use_batch=false
  3 - output([t1.a], [t1.b], [t1.c]), filter(nil), rowset=16
      access([t1.a], [t1.b], [t1.c]), partitions(p0)
      is_index_back=false, is_global_index=false, 
      range_key([t1.a]), range(MIN ; MAX)always true
  4 - output([1 * 1]), filter(nil)
      values({1 * 1})
  5 - output([20 * 1]), filter(nil)
      values({20 * 1})
insert into is_c3 select /*+NO_REWRITE*/* from t1 where t1.b > all (select 1 * 1) and t1.c < all (select 20 * 1);
select/**/ * from is_c3;
a	b	c
2	2	1
3	3	0
4	4	1
5	5	0
6	6	1
7	7	0
8	8	1
rollback;


# case 30
EXPLAIN select /*+NO_REWRITE*/ 1 > any (select 1), (select 2 > any (select 4)) from dual;
Query Plan
==============================================
|ID|OPERATOR      |NAME|EST.ROWS|EST.TIME(us)|
----------------------------------------------
|0 |SUBPLAN FILTER|    |1       |1           |
|1 |├─EXPRESSION  |    |1       |1           |
|2 |├─EXPRESSION  |    |1       |1           |
|3 |└─EXPRESSION  |    |1       |1           |
==============================================
Outputs & filters:
-------------------------------------
  0 - output([:0], [:1]), filter(nil), rowset=16
      exec_params_(nil), onetime_exprs_([1 > ANY(subquery(1))(:0)], [subquery(2)(:1)]), init_plan_idxs_(nil), use_batch=false
  1 - output([1]), filter(nil)
      values({1})
  2 - output([1]), filter(nil)
      values({1})
  3 - output([2 > 4]), filter(nil)
      values({2 > 4})
select /*+NO_REWRITE*/ 1 > any (select 1), (select 2 > any (select 4)) from dual;
1 > any (select 1)	(select 2 > any (select 4))
0	0
EXPLAIN select 1 > any (select 1), (select 2 > any (select 4)) from dual;
Query Plan
==========================================
|ID|OPERATOR  |NAME|EST.ROWS|EST.TIME(us)|
------------------------------------------
|0 |EXPRESSION|    |1       |1           |
==========================================
Outputs & filters:
-------------------------------------
  0 - output([1 > 1], [2 > 4]), filter(nil)
      values({1 > 1, 2 > 4})
select 1 > any (select 1), (select 2 > any (select 4)) from dual;
1 > any (select 1)	(select 2 > any (select 4))
0	0


# case 31
EXPLAIN select /*+NO_REWRITE*/ 1 > all (select 1), (select 2 > all (select 4)) from dual;
Query Plan
==============================================
|ID|OPERATOR      |NAME|EST.ROWS|EST.TIME(us)|
----------------------------------------------
|0 |SUBPLAN FILTER|    |1       |1           |
|1 |├─EXPRESSION  |    |1       |1           |
|2 |├─EXPRESSION  |    |1       |1           |
|3 |└─EXPRESSION  |    |1       |1           |
==============================================
Outputs & filters:
-------------------------------------
  0 - output([:0], [:1]), filter(nil), rowset=16
      exec_params_(nil), onetime_exprs_([1 > ALL(subquery(1))(:0)], [subquery(2)(:1)]), init_plan_idxs_(nil), use_batch=false
  1 - output([1]), filter(nil)
      values({1})
  2 - output([1]), filter(nil)
      values({1})
  3 - output([2 > 4]), filter(nil)
      values({2 > 4})
select /*+NO_REWRITE*/ 1 > all (select 1), (select 2 > all (select 4)) from dual;
1 > all (select 1)	(select 2 > all (select 4))
0	0
EXPLAIN select 1 > all (select 1), (select 2 > all (select 4)) from dual;
Query Plan
==========================================
|ID|OPERATOR  |NAME|EST.ROWS|EST.TIME(us)|
------------------------------------------
|0 |EXPRESSION|    |1       |1           |
==========================================
Outputs & filters:
-------------------------------------
  0 - output([1 > 1], [2 > 4]), filter(nil)
      values({1 > 1, 2 > 4})
select 1 > all (select 1), (select 2 > all (select 4)) from dual;
1 > all (select 1)	(select 2 > all (select 4))
0	0


# case 32
EXPLAIN select * from t1 order by 1 + (select 1 > any (select 0));
Query Plan
===============================================
|ID|OPERATOR       |NAME|EST.ROWS|EST.TIME(us)|
-----------------------------------------------
|0 |TABLE FULL SCAN|t1  |8       |3           |
===============================================
Outputs & filters:
-------------------------------------
  0 - output([t1.a], [t1.b], [t1.c]), filter(nil), rowset=16
      access([t1.a], [t1.b], [t1.c]), partitions(p0)
      is_index_back=false, is_global_index=false, 
      range_key([t1.a]), range(MIN ; MAX)always true
select * from t1 order by 1 + (select 1 > any (select 0));
a	b	c
1	1	0
2	2	1
3	3	0
4	4	1
5	5	0
6	6	1
7	7	0
8	8	1
EXPLAIN select /*+NO_REWRITE*/* from t1 order by 1 + (select 1 > any (select 0));
Query Plan
=================================================
|ID|OPERATOR         |NAME|EST.ROWS|EST.TIME(us)|
-------------------------------------------------
|0 |SUBPLAN FILTER   |    |8       |3           |
|1 |├─TABLE FULL SCAN|t1  |8       |3           |
|2 |└─EXPRESSION     |    |1       |1           |
=================================================
Outputs & filters:
-------------------------------------
  0 - output([t1.a], [t1.b], [t1.c]), filter(nil), rowset=16
      exec_params_(nil), onetime_exprs_([subquery(1)(:0)]), init_plan_idxs_(nil), use_batch=false
  1 - output([t1.a], [t1.b], [t1.c]), filter(nil), rowset=16
      access([t1.a], [t1.b], [t1.c]), partitions(p0)
      is_index_back=false, is_global_index=false, 
      range_key([t1.a]), range(MIN ; MAX)always true
  2 - output([1 > 0]), filter(nil)
      values({1 > 0})
select /*+NO_REWRITE*/* from t1 order by 1 + (select 1 > any (select 0));
a	b	c
1	1	0
2	2	1
3	3	0
4	4	1
5	5	0
6	6	1
7	7	0
8	8	1
EXPLAIN update t1 set b = b + 1 order by 1 + (select 1 > any (select 0));
Query Plan
=================================================
|ID|OPERATOR         |NAME|EST.ROWS|EST.TIME(us)|
-------------------------------------------------
|0 |UPDATE           |    |8       |88          |
|1 |└─TABLE FULL SCAN|t1  |8       |3           |
=================================================
Outputs & filters:
-------------------------------------
  0 - output(nil), filter(nil)
      table_columns([{t1: ({t1: (t1.a, t1.b, t1.c)})}]),
      update([t1.b=column_conv(INT,PS:(11,0),NULL,cast(t1.b + 1, INT(-1, 0)))])
  1 - output([t1.a], [t1.b], [t1.c]), filter(nil), rowset=16
      access([t1.a], [t1.b], [t1.c]), partitions(p0)
      is_index_back=false, is_global_index=false, 
      range_key([t1.a]), range(MIN ; MAX)always true
update t1 set b = b + 1 order by 1 + (select 1 > any (select 0));
select/**/ * from t1;
a	b	c
1	2	0
2	3	1
3	4	0
4	5	1
5	6	0
6	7	1
7	8	0
8	9	1
rollback;
EXPLAIN update /*+NO_REWRITE*/t1 set b = b + 1 order by 1 + (select 1 > any (select 0));
Query Plan
===================================================
|ID|OPERATOR           |NAME|EST.ROWS|EST.TIME(us)|
---------------------------------------------------
|0 |UPDATE             |    |8       |88          |
|1 |└─SUBPLAN FILTER   |    |8       |3           |
|2 |  ├─TABLE FULL SCAN|t1  |8       |3           |
|3 |  └─EXPRESSION     |    |1       |1           |
===================================================
Outputs & filters:
-------------------------------------
  0 - output(nil), filter(nil)
      table_columns([{t1: ({t1: (t1.a, t1.b, t1.c)})}]),
      update([t1.b=column_conv(INT,PS:(11,0),NULL,cast(t1.b + 1, INT(-1, 0)))])
  1 - output([t1.a], [t1.b], [t1.c]), filter(nil), rowset=16
      exec_params_(nil), onetime_exprs_([subquery(1)(:0)]), init_plan_idxs_(nil), use_batch=false
  2 - output([t1.a], [t1.b], [t1.c]), filter(nil), rowset=16
      access([t1.a], [t1.b], [t1.c]), partitions(p0)
      is_index_back=false, is_global_index=false, 
      range_key([t1.a]), range(MIN ; MAX)always true
  3 - output([1 > 0]), filter(nil)
      values({1 > 0})
update /*+NO_REWRITE*/t1 set b = b + 1 order by 1 + (select 1 > any (select 0));
select/**/ * from t1;
a	b	c
1	2	0
2	3	1
3	4	0
4	5	1
5	6	0
6	7	1
7	8	0
8	9	1
rollback;
EXPLAIN delete from t1 order by 1 + (select 1 > any (select 0));
Query Plan
=================================================
|ID|OPERATOR         |NAME|EST.ROWS|EST.TIME(us)|
-------------------------------------------------
|0 |DELETE           |    |8       |50          |
|1 |└─TABLE FULL SCAN|t1  |8       |3           |
=================================================
Outputs & filters:
-------------------------------------
  0 - output(nil), filter(nil)
      table_columns([{t1: ({t1: (t1.a, t1.b, t1.c)})}])
  1 - output([t1.a], [t1.b], [t1.c]), filter(nil), rowset=16
      access([t1.a], [t1.b], [t1.c]), partitions(p0)
      is_index_back=false, is_global_index=false, 
      range_key([t1.a]), range(MIN ; MAX)always true
delete from t1 order by 1 + (select 1 > any (select 0));
select/**/ * from t1;
a	b	c
rollback;
EXPLAIN delete /*+NO_REWRITE*/from t1 order by 1 + (select 1 > any (select 0));
Query Plan
===================================================
|ID|OPERATOR           |NAME|EST.ROWS|EST.TIME(us)|
---------------------------------------------------
|0 |DELETE             |    |8       |50          |
|1 |└─SUBPLAN FILTER   |    |8       |3           |
|2 |  ├─TABLE FULL SCAN|t1  |8       |3           |
|3 |  └─EXPRESSION     |    |1       |1           |
===================================================
Outputs & filters:
-------------------------------------
  0 - output(nil), filter(nil)
      table_columns([{t1: ({t1: (t1.a, t1.b, t1.c)})}])
  1 - output([t1.a], [t1.b], [t1.c]), filter(nil), rowset=16
      exec_params_(nil), onetime_exprs_([subquery(1)(:0)]), init_plan_idxs_(nil), use_batch=false
  2 - output([t1.a], [t1.b], [t1.c]), filter(nil), rowset=16
      access([t1.a], [t1.b], [t1.c]), partitions(p0)
      is_index_back=false, is_global_index=false, 
      range_key([t1.a]), range(MIN ; MAX)always true
  3 - output([1 > 0]), filter(nil)
      values({1 > 0})
delete /*+NO_REWRITE*/from t1 order by 1 + (select 1 > any (select 0));
select/**/ * from t1;
a	b	c
rollback;
EXPLAIN insert into is_c3 select * from t1 order by 1 + (select 1 > any (select 0));
Query Plan
==============================================================
|ID|OPERATOR           |NAME           |EST.ROWS|EST.TIME(us)|
--------------------------------------------------------------
|0 |INSERT             |               |8       |60          |
|1 |└─SUBPLAN SCAN     |ANONYMOUS_VIEW1|8       |3           |
|2 |  └─TABLE FULL SCAN|t1             |8       |3           |
==============================================================
Outputs & filters:
-------------------------------------
  0 - output(nil), filter(nil)
      columns([{is_c3: ({is_c3: (is_c3.__pk_increment, is_c3.a, is_c3.b, is_c3.c)})}]), partitions(p0), 
      column_values([T_HIDDEN_PK], [column_conv(INT,PS:(11,0),NULL,ANONYMOUS_VIEW1.a)], [column_conv(INT,PS:(11,0),NULL,ANONYMOUS_VIEW1.b)], [column_conv(INT,
      PS:(11,0),NULL,ANONYMOUS_VIEW1.c)])
  1 - output([ANONYMOUS_VIEW1.a], [ANONYMOUS_VIEW1.b], [ANONYMOUS_VIEW1.c]), filter(nil), rowset=16
      access([ANONYMOUS_VIEW1.a], [ANONYMOUS_VIEW1.b], [ANONYMOUS_VIEW1.c])
  2 - output([t1.a], [t1.b], [t1.c]), filter(nil), rowset=16
      access([t1.a], [t1.b], [t1.c]), partitions(p0)
      is_index_back=false, is_global_index=false, 
      range_key([t1.a]), range(MIN ; MAX)always true
insert into is_c3 select * from t1 order by 1 + (select 1 > any (select 0));
select/**/ * from is_c3;
a	b	c
1	1	0
2	2	1
3	3	0
4	4	1
5	5	0
6	6	1
7	7	0
8	8	1
rollback;
EXPLAIN insert into is_c3 select /*+NO_REWRITE*/* from t1 order by 1 + (select 1 > any (select 0));
Query Plan
================================================================
|ID|OPERATOR             |NAME           |EST.ROWS|EST.TIME(us)|
----------------------------------------------------------------
|0 |INSERT               |               |8       |60          |
|1 |└─SUBPLAN SCAN       |ANONYMOUS_VIEW1|8       |3           |
|2 |  └─SUBPLAN FILTER   |               |8       |3           |
|3 |    ├─TABLE FULL SCAN|t1             |8       |3           |
|4 |    └─EXPRESSION     |               |1       |1           |
================================================================
Outputs & filters:
-------------------------------------
  0 - output(nil), filter(nil)
      columns([{is_c3: ({is_c3: (is_c3.__pk_increment, is_c3.a, is_c3.b, is_c3.c)})}]), partitions(p0), 
      column_values([T_HIDDEN_PK], [column_conv(INT,PS:(11,0),NULL,ANONYMOUS_VIEW1.a)], [column_conv(INT,PS:(11,0),NULL,ANONYMOUS_VIEW1.b)], [column_conv(INT,
      PS:(11,0),NULL,ANONYMOUS_VIEW1.c)])
  1 - output([ANONYMOUS_VIEW1.a], [ANONYMOUS_VIEW1.b], [ANONYMOUS_VIEW1.c]), filter(nil), rowset=16
      access([ANONYMOUS_VIEW1.a], [ANONYMOUS_VIEW1.b], [ANONYMOUS_VIEW1.c])
  2 - output([t1.a], [t1.b], [t1.c]), filter(nil), rowset=16
      exec_params_(nil), onetime_exprs_([subquery(1)(:0)]), init_plan_idxs_(nil), use_batch=false
  3 - output([t1.a], [t1.b], [t1.c]), filter(nil), rowset=16
      access([t1.a], [t1.b], [t1.c]), partitions(p0)
      is_index_back=false, is_global_index=false, 
      range_key([t1.a]), range(MIN ; MAX)always true
  4 - output([1 > 0]), filter(nil)
      values({1 > 0})
insert into is_c3 select /*+NO_REWRITE*/* from t1 order by 1 + (select 1 > any (select 0));
select/**/ * from is_c3;
a	b	c
1	1	0
2	2	1
3	3	0
4	4	1
5	5	0
6	6	1
7	7	0
8	8	1
rollback;


# case 33
EXPLAIN select * from t1 order by 1 + (select 1 > all (select 0));
Query Plan
===============================================
|ID|OPERATOR       |NAME|EST.ROWS|EST.TIME(us)|
-----------------------------------------------
|0 |TABLE FULL SCAN|t1  |8       |3           |
===============================================
Outputs & filters:
-------------------------------------
  0 - output([t1.a], [t1.b], [t1.c]), filter(nil), rowset=16
      access([t1.a], [t1.b], [t1.c]), partitions(p0)
      is_index_back=false, is_global_index=false, 
      range_key([t1.a]), range(MIN ; MAX)always true
select * from t1 order by 1 + (select 1 > all (select 0));
a	b	c
1	1	0
2	2	1
3	3	0
4	4	1
5	5	0
6	6	1
7	7	0
8	8	1
EXPLAIN select /*+NO_REWRITE*/* from t1 order by 1 + (select 1 > all (select 0));
Query Plan
=================================================
|ID|OPERATOR         |NAME|EST.ROWS|EST.TIME(us)|
-------------------------------------------------
|0 |SUBPLAN FILTER   |    |8       |3           |
|1 |├─TABLE FULL SCAN|t1  |8       |3           |
|2 |└─EXPRESSION     |    |1       |1           |
=================================================
Outputs & filters:
-------------------------------------
  0 - output([t1.a], [t1.b], [t1.c]), filter(nil), rowset=16
      exec_params_(nil), onetime_exprs_([subquery(1)(:0)]), init_plan_idxs_(nil), use_batch=false
  1 - output([t1.a], [t1.b], [t1.c]), filter(nil), rowset=16
      access([t1.a], [t1.b], [t1.c]), partitions(p0)
      is_index_back=false, is_global_index=false, 
      range_key([t1.a]), range(MIN ; MAX)always true
  2 - output([1 > 0]), filter(nil)
      values({1 > 0})
select /*+NO_REWRITE*/* from t1 order by 1 + (select 1 > all (select 0));
a	b	c
1	1	0
2	2	1
3	3	0
4	4	1
5	5	0
6	6	1
7	7	0
8	8	1
EXPLAIN update t1 set b = b + 1 order by 1 + (select 1 > all (select 0));
Query Plan
=================================================
|ID|OPERATOR         |NAME|EST.ROWS|EST.TIME(us)|
-------------------------------------------------
|0 |UPDATE           |    |8       |88          |
|1 |└─TABLE FULL SCAN|t1  |8       |3           |
=================================================
Outputs & filters:
-------------------------------------
  0 - output(nil), filter(nil)
      table_columns([{t1: ({t1: (t1.a, t1.b, t1.c)})}]),
      update([t1.b=column_conv(INT,PS:(11,0),NULL,cast(t1.b + 1, INT(-1, 0)))])
  1 - output([t1.a], [t1.b], [t1.c]), filter(nil), rowset=16
      access([t1.a], [t1.b], [t1.c]), partitions(p0)
      is_index_back=false, is_global_index=false, 
      range_key([t1.a]), range(MIN ; MAX)always true
update t1 set b = b + 1 order by 1 + (select 1 > all (select 0));
select/**/ * from t1;
a	b	c
1	2	0
2	3	1
3	4	0
4	5	1
5	6	0
6	7	1
7	8	0
8	9	1
rollback;
EXPLAIN update /*+NO_REWRITE*/ t1 set b = b + 1 order by 1 + (select 1 > all (select 0));
Query Plan
===================================================
|ID|OPERATOR           |NAME|EST.ROWS|EST.TIME(us)|
---------------------------------------------------
|0 |UPDATE             |    |8       |88          |
|1 |└─SUBPLAN FILTER   |    |8       |3           |
|2 |  ├─TABLE FULL SCAN|t1  |8       |3           |
|3 |  └─EXPRESSION     |    |1       |1           |
===================================================
Outputs & filters:
-------------------------------------
  0 - output(nil), filter(nil)
      table_columns([{t1: ({t1: (t1.a, t1.b, t1.c)})}]),
      update([t1.b=column_conv(INT,PS:(11,0),NULL,cast(t1.b + 1, INT(-1, 0)))])
  1 - output([t1.a], [t1.b], [t1.c]), filter(nil), rowset=16
      exec_params_(nil), onetime_exprs_([subquery(1)(:0)]), init_plan_idxs_(nil), use_batch=false
  2 - output([t1.a], [t1.b], [t1.c]), filter(nil), rowset=16
      access([t1.a], [t1.b], [t1.c]), partitions(p0)
      is_index_back=false, is_global_index=false, 
      range_key([t1.a]), range(MIN ; MAX)always true
  3 - output([1 > 0]), filter(nil)
      values({1 > 0})
update /*+NO_REWRITE*/ t1 set b = b + 1 order by 1 + (select 1 > all (select 0));
select/**/ * from t1;
a	b	c
1	2	0
2	3	1
3	4	0
4	5	1
5	6	0
6	7	1
7	8	0
8	9	1
rollback;
EXPLAIN delete from t1 order by 1 + (select 1 > all (select 0));
Query Plan
=================================================
|ID|OPERATOR         |NAME|EST.ROWS|EST.TIME(us)|
-------------------------------------------------
|0 |DELETE           |    |8       |50          |
|1 |└─TABLE FULL SCAN|t1  |8       |3           |
=================================================
Outputs & filters:
-------------------------------------
  0 - output(nil), filter(nil)
      table_columns([{t1: ({t1: (t1.a, t1.b, t1.c)})}])
  1 - output([t1.a], [t1.b], [t1.c]), filter(nil), rowset=16
      access([t1.a], [t1.b], [t1.c]), partitions(p0)
      is_index_back=false, is_global_index=false, 
      range_key([t1.a]), range(MIN ; MAX)always true
delete from t1 order by 1 + (select 1 > all (select 0));
select/**/ * from t1;
a	b	c
rollback;
delete/*+NO_REWRITE*/ from t1 order by 1 + (select 1 > all (select 0));
select/**/ * from t1;
a	b	c
rollback;
EXPLAIN insert into is_c3 select * from t1 order by 1 + (select 1 > all (select 0));
Query Plan
==============================================================
|ID|OPERATOR           |NAME           |EST.ROWS|EST.TIME(us)|
--------------------------------------------------------------
|0 |INSERT             |               |8       |60          |
|1 |└─SUBPLAN SCAN     |ANONYMOUS_VIEW1|8       |3           |
|2 |  └─TABLE FULL SCAN|t1             |8       |3           |
==============================================================
Outputs & filters:
-------------------------------------
  0 - output(nil), filter(nil)
      columns([{is_c3: ({is_c3: (is_c3.__pk_increment, is_c3.a, is_c3.b, is_c3.c)})}]), partitions(p0), 
      column_values([T_HIDDEN_PK], [column_conv(INT,PS:(11,0),NULL,ANONYMOUS_VIEW1.a)], [column_conv(INT,PS:(11,0),NULL,ANONYMOUS_VIEW1.b)], [column_conv(INT,
      PS:(11,0),NULL,ANONYMOUS_VIEW1.c)])
  1 - output([ANONYMOUS_VIEW1.a], [ANONYMOUS_VIEW1.b], [ANONYMOUS_VIEW1.c]), filter(nil), rowset=16
      access([ANONYMOUS_VIEW1.a], [ANONYMOUS_VIEW1.b], [ANONYMOUS_VIEW1.c])
  2 - output([t1.a], [t1.b], [t1.c]), filter(nil), rowset=16
      access([t1.a], [t1.b], [t1.c]), partitions(p0)
      is_index_back=false, is_global_index=false, 
      range_key([t1.a]), range(MIN ; MAX)always true
insert into is_c3 select * from t1 order by 1 + (select 1 > all (select 0));
select/**/ * from is_c3;
a	b	c
1	1	0
2	2	1
3	3	0
4	4	1
5	5	0
6	6	1
7	7	0
8	8	1
rollback;
EXPLAIN insert into is_c3 select /*+NO_REWRITE*/* from t1 order by 1 + (select 1 > all (select 0));
Query Plan
================================================================
|ID|OPERATOR             |NAME           |EST.ROWS|EST.TIME(us)|
----------------------------------------------------------------
|0 |INSERT               |               |8       |60          |
|1 |└─SUBPLAN SCAN       |ANONYMOUS_VIEW1|8       |3           |
|2 |  └─SUBPLAN FILTER   |               |8       |3           |
|3 |    ├─TABLE FULL SCAN|t1             |8       |3           |
|4 |    └─EXPRESSION     |               |1       |1           |
================================================================
Outputs & filters:
-------------------------------------
  0 - output(nil), filter(nil)
      columns([{is_c3: ({is_c3: (is_c3.__pk_increment, is_c3.a, is_c3.b, is_c3.c)})}]), partitions(p0), 
      column_values([T_HIDDEN_PK], [column_conv(INT,PS:(11,0),NULL,ANONYMOUS_VIEW1.a)], [column_conv(INT,PS:(11,0),NULL,ANONYMOUS_VIEW1.b)], [column_conv(INT,
      PS:(11,0),NULL,ANONYMOUS_VIEW1.c)])
  1 - output([ANONYMOUS_VIEW1.a], [ANONYMOUS_VIEW1.b], [ANONYMOUS_VIEW1.c]), filter(nil), rowset=16
      access([ANONYMOUS_VIEW1.a], [ANONYMOUS_VIEW1.b], [ANONYMOUS_VIEW1.c])
  2 - output([t1.a], [t1.b], [t1.c]), filter(nil), rowset=16
      exec_params_(nil), onetime_exprs_([subquery(1)(:0)]), init_plan_idxs_(nil), use_batch=false
  3 - output([t1.a], [t1.b], [t1.c]), filter(nil), rowset=16
      access([t1.a], [t1.b], [t1.c]), partitions(p0)
      is_index_back=false, is_global_index=false, 
      range_key([t1.a]), range(MIN ; MAX)always true
  4 - output([1 > 0]), filter(nil)
      values({1 > 0})
insert into is_c3 select /*+NO_REWRITE*/* from t1 order by 1 + (select 1 > all (select 0));
select/**/ * from is_c3;
a	b	c
1	1	0
2	2	1
3	3	0
4	4	1
5	5	0
6	6	1
7	7	0
8	8	1
rollback;


# case 34
EXPLAIN select /*+NO_REWRITE*/ count(*) from t1 group by 1 + (select 1 > any (select 0));
Query Plan
===================================================
|ID|OPERATOR           |NAME|EST.ROWS|EST.TIME(us)|
---------------------------------------------------
|0 |MERGE GROUP BY     |    |1       |3           |
|1 |└─SUBPLAN FILTER   |    |8       |3           |
|2 |  ├─TABLE FULL SCAN|t1  |8       |3           |
|3 |  └─EXPRESSION     |    |1       |1           |
===================================================
Outputs & filters:
-------------------------------------
  0 - output([T_FUN_COUNT(*)]), filter(nil), rowset=16
      group(nil), agg_func([T_FUN_COUNT(*)])
  1 - output(nil), filter(nil), rowset=16
      exec_params_(nil), onetime_exprs_([subquery(1)(:0)]), init_plan_idxs_(nil), use_batch=false
  2 - output(nil), filter(nil), rowset=16
      access(nil), partitions(p0)
      is_index_back=false, is_global_index=false, 
      range_key([t1.a]), range(MIN ; MAX)always true
  3 - output([1 > 0]), filter(nil)
      values({1 > 0})
select /*+NO_REWRITE*/ count(*) from t1 group by 1 + (select 1 > any (select 0));
count(*)
8
EXPLAIN select count(*) from t1 group by 1 + (select 1 > any (select 0));
Query Plan
=================================================
|ID|OPERATOR         |NAME|EST.ROWS|EST.TIME(us)|
-------------------------------------------------
|0 |MERGE GROUP BY   |    |1       |3           |
|1 |└─TABLE FULL SCAN|t1  |8       |3           |
=================================================
Outputs & filters:
-------------------------------------
  0 - output([T_FUN_COUNT(*)]), filter(nil), rowset=16
      group(nil), agg_func([T_FUN_COUNT(*)])
  1 - output(nil), filter(nil), rowset=16
      access(nil), partitions(p0)
      is_index_back=false, is_global_index=false, 
      range_key([t1.a]), range(MIN ; MAX)always true
select count(*) from t1 group by 1 + (select 1 > any (select 0));
count(*)
8


# case 35
EXPLAIN select /*+NO_REWRITE*/ count(*) from t1 group by 1 + (select 1 > all (select 0));
Query Plan
===================================================
|ID|OPERATOR           |NAME|EST.ROWS|EST.TIME(us)|
---------------------------------------------------
|0 |MERGE GROUP BY     |    |1       |3           |
|1 |└─SUBPLAN FILTER   |    |8       |3           |
|2 |  ├─TABLE FULL SCAN|t1  |8       |3           |
|3 |  └─EXPRESSION     |    |1       |1           |
===================================================
Outputs & filters:
-------------------------------------
  0 - output([T_FUN_COUNT(*)]), filter(nil), rowset=16
      group(nil), agg_func([T_FUN_COUNT(*)])
  1 - output(nil), filter(nil), rowset=16
      exec_params_(nil), onetime_exprs_([subquery(1)(:0)]), init_plan_idxs_(nil), use_batch=false
  2 - output(nil), filter(nil), rowset=16
      access(nil), partitions(p0)
      is_index_back=false, is_global_index=false, 
      range_key([t1.a]), range(MIN ; MAX)always true
  3 - output([1 > 0]), filter(nil)
      values({1 > 0})
select /*+NO_REWRITE*/ count(*) from t1 group by 1 + (select 1 > all (select 0));
count(*)
8
EXPLAIN select count(*) from t1 group by 1 + (select 1 > all (select 0));
Query Plan
=================================================
|ID|OPERATOR         |NAME|EST.ROWS|EST.TIME(us)|
-------------------------------------------------
|0 |MERGE GROUP BY   |    |1       |3           |
|1 |└─TABLE FULL SCAN|t1  |8       |3           |
=================================================
Outputs & filters:
-------------------------------------
  0 - output([T_FUN_COUNT(*)]), filter(nil), rowset=16
      group(nil), agg_func([T_FUN_COUNT(*)])
  1 - output(nil), filter(nil), rowset=16
      access(nil), partitions(p0)
      is_index_back=false, is_global_index=false, 
      range_key([t1.a]), range(MIN ; MAX)always true
select count(*) from t1 group by 1 + (select 1 > all (select 0));
count(*)
8


# case 36
EXPLAIN select /*+NO_REWRITE*/ count(*) as num from t1 group by t1.c having num > any (select 2) and num < any (select 2 * 5);
Query Plan
===================================================
|ID|OPERATOR           |NAME|EST.ROWS|EST.TIME(us)|
---------------------------------------------------
|0 |SUBPLAN FILTER     |    |1       |4           |
|1 |├─HASH GROUP BY    |    |2       |4           |
|2 |│ └─TABLE FULL SCAN|t1  |8       |3           |
|3 |├─EXPRESSION       |    |1       |1           |
|4 |└─EXPRESSION       |    |1       |1           |
===================================================
Outputs & filters:
-------------------------------------
  0 - output([T_FUN_COUNT(*)]), filter([T_FUN_COUNT(*) > ANY(subquery(1))], [T_FUN_COUNT(*) < ANY(subquery(2))]), rowset=16
      exec_params_(nil), onetime_exprs_(nil), init_plan_idxs_([1], [2]), use_batch=false
  1 - output([T_FUN_COUNT(*)]), filter(nil), rowset=16
      group([t1.c]), agg_func([T_FUN_COUNT(*)])
  2 - output([t1.c]), filter(nil), rowset=16
      access([t1.c]), partitions(p0)
      is_index_back=false, is_global_index=false, 
      range_key([t1.a]), range(MIN ; MAX)always true
  3 - output([2]), filter(nil)
      values({2})
  4 - output([2 * 5]), filter(nil)
      values({2 * 5})
select /*+NO_REWRITE*/ count(*) as num from t1 group by t1.c having num > any (select 2) and num < any (select 2 * 5);
num
4
4
EXPLAIN select count(*) as num from t1 group by t1.c having num > any (select 2) and num < any (select 2 * 5);
Query Plan
=================================================
|ID|OPERATOR         |NAME|EST.ROWS|EST.TIME(us)|
-------------------------------------------------
|0 |HASH GROUP BY    |    |1       |4           |
|1 |└─TABLE FULL SCAN|t1  |8       |3           |
=================================================
Outputs & filters:
-------------------------------------
  0 - output([T_FUN_COUNT(*)]), filter([T_FUN_COUNT(*) > 2], [T_FUN_COUNT(*) < 2 * 5]), rowset=16
      group([t1.c]), agg_func([T_FUN_COUNT(*)])
  1 - output([t1.c]), filter(nil), rowset=16
      access([t1.c]), partitions(p0)
      is_index_back=false, is_global_index=false, 
      range_key([t1.a]), range(MIN ; MAX)always true
select count(*) as num from t1 group by t1.c having num > any (select 2) and num < any (select 2 * 5);
num
4
4


# case 37
EXPLAIN select /*+NO_REWRITE*/ count(*) as num from t1 group by t1.c having num > all (select 2) and num < all (select 2 * 5);
Query Plan
===================================================
|ID|OPERATOR           |NAME|EST.ROWS|EST.TIME(us)|
---------------------------------------------------
|0 |SUBPLAN FILTER     |    |1       |4           |
|1 |├─HASH GROUP BY    |    |2       |4           |
|2 |│ └─TABLE FULL SCAN|t1  |8       |3           |
|3 |├─EXPRESSION       |    |1       |1           |
|4 |└─EXPRESSION       |    |1       |1           |
===================================================
Outputs & filters:
-------------------------------------
  0 - output([T_FUN_COUNT(*)]), filter([T_FUN_COUNT(*) > ALL(subquery(1))], [T_FUN_COUNT(*) < ALL(subquery(2))]), rowset=16
      exec_params_(nil), onetime_exprs_(nil), init_plan_idxs_([1], [2]), use_batch=false
  1 - output([T_FUN_COUNT(*)]), filter(nil), rowset=16
      group([t1.c]), agg_func([T_FUN_COUNT(*)])
  2 - output([t1.c]), filter(nil), rowset=16
      access([t1.c]), partitions(p0)
      is_index_back=false, is_global_index=false, 
      range_key([t1.a]), range(MIN ; MAX)always true
  3 - output([2]), filter(nil)
      values({2})
  4 - output([2 * 5]), filter(nil)
      values({2 * 5})
select /*+NO_REWRITE*/ count(*) as num from t1 group by t1.c having num > all (select 2) and num < all (select 2 * 5);
num
4
4
EXPLAIN select count(*) as num from t1 group by t1.c having num > all (select 2) and num < all (select 2 * 5);
Query Plan
=================================================
|ID|OPERATOR         |NAME|EST.ROWS|EST.TIME(us)|
-------------------------------------------------
|0 |HASH GROUP BY    |    |1       |4           |
|1 |└─TABLE FULL SCAN|t1  |8       |3           |
=================================================
Outputs & filters:
-------------------------------------
  0 - output([T_FUN_COUNT(*)]), filter([T_FUN_COUNT(*) > 2], [T_FUN_COUNT(*) < 2 * 5]), rowset=16
      group([t1.c]), agg_func([T_FUN_COUNT(*)])
  1 - output([t1.c]), filter(nil), rowset=16
      access([t1.c]), partitions(p0)
      is_index_back=false, is_global_index=false, 
      range_key([t1.a]), range(MIN ; MAX)always true
select count(*) as num from t1 group by t1.c having num > all (select 2) and num < all (select 2 * 5);
num
4
4


# case 38
## 表达式子查询，any 空集, all 空集
EXPLAIN select * from t1 where t1.b > any (select 1 * 1 from dual where 1 > 5);
Query Plan
===============================================
|ID|OPERATOR       |NAME|EST.ROWS|EST.TIME(us)|
-----------------------------------------------
|0 |TABLE FULL SCAN|t1  |0       |3           |
===============================================
Outputs & filters:
-------------------------------------
  0 - output([t1.a], [t1.b], [t1.c]), filter(nil), startup_filter([0]), rowset=16
      access([t1.a], [t1.b], [t1.c]), partitions(p0)
      is_index_back=false, is_global_index=false, 
      range_key([t1.a]), range(MIN ; MAX)always true
select * from t1 where t1.b > any (select 1 * 1 from dual where 1 > 5);
a	b	c
EXPLAIN select /*+NO_REWRITE*/* from t1 where t1.b > any (select 1 * 1 from dual where 1 > 5);
Query Plan
=================================================
|ID|OPERATOR         |NAME|EST.ROWS|EST.TIME(us)|
-------------------------------------------------
|0 |SUBPLAN FILTER   |    |4       |3           |
|1 |├─TABLE FULL SCAN|t1  |8       |3           |
|2 |└─EXPRESSION     |    |1       |1           |
=================================================
Outputs & filters:
-------------------------------------
  0 - output([t1.a], [t1.b], [t1.c]), filter([t1.b > ANY(subquery(1))]), rowset=16
      exec_params_(nil), onetime_exprs_(nil), init_plan_idxs_([1]), use_batch=false
  1 - output([t1.a], [t1.b], [t1.c]), filter(nil), rowset=16
      access([t1.a], [t1.b], [t1.c]), partitions(p0)
      is_index_back=false, is_global_index=false, 
      range_key([t1.a]), range(MIN ; MAX)always true
  2 - output([1 * 1]), filter([0])
      values({1 * 1})
select /*+NO_REWRITE*/* from t1 where t1.b > any (select 1 * 1 from dual where 1 > 5);
a	b	c
EXPLAIN update t1 set b = b + 1 where t1.b > any (select 1 * 1 from dual where 1 > 5);
Query Plan
=================================================
|ID|OPERATOR         |NAME|EST.ROWS|EST.TIME(us)|
-------------------------------------------------
|0 |UPDATE           |    |0       |27          |
|1 |└─TABLE FULL SCAN|t1  |0       |3           |
=================================================
Outputs & filters:
-------------------------------------
  0 - output(nil), filter(nil)
      table_columns([{t1: ({t1: (t1.a, t1.b, t1.c)})}]),
      update([t1.b=column_conv(INT,PS:(11,0),NULL,cast(t1.b + 1, INT(-1, 0)))])
  1 - output([t1.a], [t1.b], [t1.c]), filter(nil), startup_filter([0]), rowset=16
      access([t1.a], [t1.b], [t1.c]), partitions(p0)
      is_index_back=false, is_global_index=false, 
      range_key([t1.a]), range(MIN ; MAX)always true
update t1 set b = b + 1 where t1.b > any (select 1 * 1 from dual where 1 > 5);
select/**/ * from t1;
a	b	c
1	1	0
2	2	1
3	3	0
4	4	1
5	5	0
6	6	1
7	7	0
8	8	1
rollback;
EXPLAIN update /*+NO_REWRITE*/t1 set b = b + 1 where t1.b > any (select 1 * 1 from dual where 1 > 5);
Query Plan
===================================================
|ID|OPERATOR           |NAME|EST.ROWS|EST.TIME(us)|
---------------------------------------------------
|0 |UPDATE             |    |4       |57          |
|1 |└─SUBPLAN FILTER   |    |4       |3           |
|2 |  ├─TABLE FULL SCAN|t1  |8       |3           |
|3 |  └─EXPRESSION     |    |1       |1           |
===================================================
Outputs & filters:
-------------------------------------
  0 - output(nil), filter(nil)
      table_columns([{t1: ({t1: (t1.a, t1.b, t1.c)})}]),
      update([t1.b=column_conv(INT,PS:(11,0),NULL,cast(t1.b + 1, INT(-1, 0)))])
  1 - output([t1.a], [t1.b], [t1.c]), filter([t1.b > ANY(subquery(1))]), rowset=16
      exec_params_(nil), onetime_exprs_(nil), init_plan_idxs_([1]), use_batch=false
  2 - output([t1.a], [t1.b], [t1.c]), filter(nil), rowset=16
      access([t1.a], [t1.b], [t1.c]), partitions(p0)
      is_index_back=false, is_global_index=false, 
      range_key([t1.a]), range(MIN ; MAX)always true
  3 - output([1 * 1]), filter([0])
      values({1 * 1})
update /*+NO_REWRITE*/t1 set b = b + 1 where t1.b > any (select 1 * 1 from dual where 1 > 5);
select/**/ * from t1;
a	b	c
1	1	0
2	2	1
3	3	0
4	4	1
5	5	0
6	6	1
7	7	0
8	8	1
rollback;
EXPLAIN delete from t1 where t1.b > any (select 1 * 1 from dual where 1 > 5);
Query Plan
=================================================
|ID|OPERATOR         |NAME|EST.ROWS|EST.TIME(us)|
-------------------------------------------------
|0 |DELETE           |    |0       |9           |
|1 |└─TABLE FULL SCAN|t1  |0       |3           |
=================================================
Outputs & filters:
-------------------------------------
  0 - output(nil), filter(nil)
      table_columns([{t1: ({t1: (t1.a, t1.b, t1.c)})}])
  1 - output([t1.a], [t1.b], [t1.c]), filter(nil), startup_filter([0]), rowset=16
      access([t1.a], [t1.b], [t1.c]), partitions(p0)
      is_index_back=false, is_global_index=false, 
      range_key([t1.a]), range(MIN ; MAX)always true
delete from t1 where t1.b > any (select 1 * 1 from dual where 1 > 5);
select/**/ * from t1;
a	b	c
1	1	0
2	2	1
3	3	0
4	4	1
5	5	0
6	6	1
7	7	0
8	8	1
rollback;
EXPLAIN delete /*+NO_REWRITE*/from t1 where t1.b > any (select 1 * 1 from dual where 1 > 5);
Query Plan
===================================================
|ID|OPERATOR           |NAME|EST.ROWS|EST.TIME(us)|
---------------------------------------------------
|0 |DELETE             |    |4       |30          |
|1 |└─SUBPLAN FILTER   |    |4       |3           |
|2 |  ├─TABLE FULL SCAN|t1  |8       |3           |
|3 |  └─EXPRESSION     |    |1       |1           |
===================================================
Outputs & filters:
-------------------------------------
  0 - output(nil), filter(nil)
      table_columns([{t1: ({t1: (t1.a, t1.b, t1.c)})}])
  1 - output([t1.a], [t1.b], [t1.c]), filter([t1.b > ANY(subquery(1))]), rowset=16
      exec_params_(nil), onetime_exprs_(nil), init_plan_idxs_([1]), use_batch=false
  2 - output([t1.a], [t1.b], [t1.c]), filter(nil), rowset=16
      access([t1.a], [t1.b], [t1.c]), partitions(p0)
      is_index_back=false, is_global_index=false, 
      range_key([t1.a]), range(MIN ; MAX)always true
  3 - output([1 * 1]), filter([0])
      values({1 * 1})
delete /*+NO_REWRITE*/from t1 where t1.b > any (select 1 * 1 from dual where 1 > 5);
select/**/ * from t1;
a	b	c
1	1	0
2	2	1
3	3	0
4	4	1
5	5	0
6	6	1
7	7	0
8	8	1
rollback;
EXPLAIN insert into is_c3 select * from t1 where t1.b > any (select 1 * 1 from dual where 1 > 5);
Query Plan
==============================================================
|ID|OPERATOR           |NAME           |EST.ROWS|EST.TIME(us)|
--------------------------------------------------------------
|0 |INSERT             |               |0       |9           |
|1 |└─SUBPLAN SCAN     |ANONYMOUS_VIEW1|0       |3           |
|2 |  └─TABLE FULL SCAN|t1             |0       |3           |
==============================================================
Outputs & filters:
-------------------------------------
  0 - output(nil), filter(nil)
      columns([{is_c3: ({is_c3: (is_c3.__pk_increment, is_c3.a, is_c3.b, is_c3.c)})}]), partitions(p0), 
      column_values([T_HIDDEN_PK], [column_conv(INT,PS:(11,0),NULL,ANONYMOUS_VIEW1.a)], [column_conv(INT,PS:(11,0),NULL,ANONYMOUS_VIEW1.b)], [column_conv(INT,
      PS:(11,0),NULL,ANONYMOUS_VIEW1.c)])
  1 - output([ANONYMOUS_VIEW1.a], [ANONYMOUS_VIEW1.b], [ANONYMOUS_VIEW1.c]), filter(nil), startup_filter([0]), rowset=16
      access([ANONYMOUS_VIEW1.a], [ANONYMOUS_VIEW1.b], [ANONYMOUS_VIEW1.c])
  2 - output([t1.a], [t1.b], [t1.c]), filter(nil), rowset=16
      access([t1.a], [t1.b], [t1.c]), partitions(p0)
      is_index_back=false, is_global_index=false, 
      range_key([t1.a]), range(MIN ; MAX)always true
insert into is_c3 select * from t1 where t1.b > any (select 1 * 1 from dual where 1 > 5);
select/**/ * from is_c3;
a	b	c
rollback;
EXPLAIN insert into is_c3 select /*+NO_REWRITE*/* from t1 where t1.b > any (select 1 * 1 from dual where 1 > 5);
Query Plan
================================================================
|ID|OPERATOR             |NAME           |EST.ROWS|EST.TIME(us)|
----------------------------------------------------------------
|0 |INSERT               |               |4       |35          |
|1 |└─SUBPLAN SCAN       |ANONYMOUS_VIEW1|4       |3           |
|2 |  └─SUBPLAN FILTER   |               |4       |3           |
|3 |    ├─TABLE FULL SCAN|t1             |8       |3           |
|4 |    └─EXPRESSION     |               |1       |1           |
================================================================
Outputs & filters:
-------------------------------------
  0 - output(nil), filter(nil)
      columns([{is_c3: ({is_c3: (is_c3.__pk_increment, is_c3.a, is_c3.b, is_c3.c)})}]), partitions(p0), 
      column_values([T_HIDDEN_PK], [column_conv(INT,PS:(11,0),NULL,ANONYMOUS_VIEW1.a)], [column_conv(INT,PS:(11,0),NULL,ANONYMOUS_VIEW1.b)], [column_conv(INT,
      PS:(11,0),NULL,ANONYMOUS_VIEW1.c)])
  1 - output([ANONYMOUS_VIEW1.a], [ANONYMOUS_VIEW1.b], [ANONYMOUS_VIEW1.c]), filter(nil), rowset=16
      access([ANONYMOUS_VIEW1.a], [ANONYMOUS_VIEW1.b], [ANONYMOUS_VIEW1.c])
  2 - output([t1.a], [t1.b], [t1.c]), filter([t1.b > ANY(subquery(1))]), rowset=16
      exec_params_(nil), onetime_exprs_(nil), init_plan_idxs_([1]), use_batch=false
  3 - output([t1.a], [t1.b], [t1.c]), filter(nil), rowset=16
      access([t1.a], [t1.b], [t1.c]), partitions(p0)
      is_index_back=false, is_global_index=false, 
      range_key([t1.a]), range(MIN ; MAX)always true
  4 - output([1 * 1]), filter([0])
      values({1 * 1})
insert into is_c3 select /*+NO_REWRITE*/* from t1 where t1.b > any (select 1 * 1 from dual where 1 > 5);
select/**/ * from is_c3;
a	b	c
rollback;


# case 39
EXPLAIN select * from t1 where t1.b > any (select 1 * 1 from dual limit 0);
Query Plan
===============================================
|ID|OPERATOR       |NAME|EST.ROWS|EST.TIME(us)|
-----------------------------------------------
|0 |TABLE FULL SCAN|t1  |0       |3           |
===============================================
Outputs & filters:
-------------------------------------
  0 - output([t1.a], [t1.b], [t1.c]), filter(nil), startup_filter([0]), rowset=16
      access([t1.a], [t1.b], [t1.c]), partitions(p0)
      is_index_back=false, is_global_index=false, 
      range_key([t1.a]), range(MIN ; MAX)always true
select * from t1 where t1.b > any (select 1 * 1 from dual limit 0);
a	b	c
EXPLAIN select /*+NO_REWRITE*/* from t1 where t1.b > any (select 1 * 1 from dual limit 0);
Query Plan
=================================================
|ID|OPERATOR         |NAME|EST.ROWS|EST.TIME(us)|
-------------------------------------------------
|0 |SUBPLAN FILTER   |    |4       |3           |
|1 |├─TABLE FULL SCAN|t1  |8       |3           |
|2 |└─LIMIT          |    |0       |1           |
|3 |  └─EXPRESSION   |    |1       |1           |
=================================================
Outputs & filters:
-------------------------------------
  0 - output([t1.a], [t1.b], [t1.c]), filter([t1.b > ANY(subquery(1))]), rowset=16
      exec_params_(nil), onetime_exprs_(nil), init_plan_idxs_([1]), use_batch=false
  1 - output([t1.a], [t1.b], [t1.c]), filter(nil), rowset=16
      access([t1.a], [t1.b], [t1.c]), partitions(p0)
      is_index_back=false, is_global_index=false, 
      range_key([t1.a]), range(MIN ; MAX)always true
  2 - output([1 * 1]), filter(nil), startup_filter([0]), rowset=16
      limit(0), offset(nil)
  3 - output([1]), filter(nil)
      values({1})
select /*+NO_REWRITE*/* from t1 where t1.b > any (select 1 * 1 from dual limit 0);
a	b	c
EXPLAIN update t1 set b = b + 1 where t1.b > any (select 1 * 1 from dual limit 0);
Query Plan
=================================================
|ID|OPERATOR         |NAME|EST.ROWS|EST.TIME(us)|
-------------------------------------------------
|0 |UPDATE           |    |0       |27          |
|1 |└─TABLE FULL SCAN|t1  |0       |3           |
=================================================
Outputs & filters:
-------------------------------------
  0 - output(nil), filter(nil)
      table_columns([{t1: ({t1: (t1.a, t1.b, t1.c)})}]),
      update([t1.b=column_conv(INT,PS:(11,0),NULL,cast(t1.b + 1, INT(-1, 0)))])
  1 - output([t1.a], [t1.b], [t1.c]), filter(nil), startup_filter([0]), rowset=16
      access([t1.a], [t1.b], [t1.c]), partitions(p0)
      is_index_back=false, is_global_index=false, 
      range_key([t1.a]), range(MIN ; MAX)always true
update t1 set b = b + 1 where t1.b > any (select 1 * 1 from dual limit 0);
select/**/ * from t1;
a	b	c
1	1	0
2	2	1
3	3	0
4	4	1
5	5	0
6	6	1
7	7	0
8	8	1
rollback;
EXPLAIN update /*+NO_REWRITE*/t1 set b = b + 1 where t1.b > any (select 1 * 1 from dual limit 0);
Query Plan
===================================================
|ID|OPERATOR           |NAME|EST.ROWS|EST.TIME(us)|
---------------------------------------------------
|0 |UPDATE             |    |4       |57          |
|1 |└─SUBPLAN FILTER   |    |4       |3           |
|2 |  ├─TABLE FULL SCAN|t1  |8       |3           |
|3 |  └─LIMIT          |    |0       |1           |
|4 |    └─EXPRESSION   |    |1       |1           |
===================================================
Outputs & filters:
-------------------------------------
  0 - output(nil), filter(nil)
      table_columns([{t1: ({t1: (t1.a, t1.b, t1.c)})}]),
      update([t1.b=column_conv(INT,PS:(11,0),NULL,cast(t1.b + 1, INT(-1, 0)))])
  1 - output([t1.a], [t1.b], [t1.c]), filter([t1.b > ANY(subquery(1))]), rowset=16
      exec_params_(nil), onetime_exprs_(nil), init_plan_idxs_([1]), use_batch=false
  2 - output([t1.a], [t1.b], [t1.c]), filter(nil), rowset=16
      access([t1.a], [t1.b], [t1.c]), partitions(p0)
      is_index_back=false, is_global_index=false, 
      range_key([t1.a]), range(MIN ; MAX)always true
  3 - output([1 * 1]), filter(nil), startup_filter([0]), rowset=16
      limit(0), offset(nil)
  4 - output([1]), filter(nil)
      values({1})
update /*+NO_REWRITE*/t1 set b = b + 1 where t1.b > any (select 1 * 1 from dual limit 0);
select/**/ * from t1;
a	b	c
1	1	0
2	2	1
3	3	0
4	4	1
5	5	0
6	6	1
7	7	0
8	8	1
rollback;
EXPLAIN delete from t1 where t1.b > any (select 1 * 1 from dual limit 0);
Query Plan
=================================================
|ID|OPERATOR         |NAME|EST.ROWS|EST.TIME(us)|
-------------------------------------------------
|0 |DELETE           |    |0       |9           |
|1 |└─TABLE FULL SCAN|t1  |0       |3           |
=================================================
Outputs & filters:
-------------------------------------
  0 - output(nil), filter(nil)
      table_columns([{t1: ({t1: (t1.a, t1.b, t1.c)})}])
  1 - output([t1.a], [t1.b], [t1.c]), filter(nil), startup_filter([0]), rowset=16
      access([t1.a], [t1.b], [t1.c]), partitions(p0)
      is_index_back=false, is_global_index=false, 
      range_key([t1.a]), range(MIN ; MAX)always true
delete from t1 where t1.b > any (select 1 * 1 from dual limit 0);
select/**/ * from t1;
a	b	c
1	1	0
2	2	1
3	3	0
4	4	1
5	5	0
6	6	1
7	7	0
8	8	1
rollback;
EXPLAIN delete /*+NO_REWRITE*/from t1 where t1.b > any (select 1 * 1 from dual limit 0);
Query Plan
===================================================
|ID|OPERATOR           |NAME|EST.ROWS|EST.TIME(us)|
---------------------------------------------------
|0 |DELETE             |    |4       |30          |
|1 |└─SUBPLAN FILTER   |    |4       |3           |
|2 |  ├─TABLE FULL SCAN|t1  |8       |3           |
|3 |  └─LIMIT          |    |0       |1           |
|4 |    └─EXPRESSION   |    |1       |1           |
===================================================
Outputs & filters:
-------------------------------------
  0 - output(nil), filter(nil)
      table_columns([{t1: ({t1: (t1.a, t1.b, t1.c)})}])
  1 - output([t1.a], [t1.b], [t1.c]), filter([t1.b > ANY(subquery(1))]), rowset=16
      exec_params_(nil), onetime_exprs_(nil), init_plan_idxs_([1]), use_batch=false
  2 - output([t1.a], [t1.b], [t1.c]), filter(nil), rowset=16
      access([t1.a], [t1.b], [t1.c]), partitions(p0)
      is_index_back=false, is_global_index=false, 
      range_key([t1.a]), range(MIN ; MAX)always true
  3 - output([1 * 1]), filter(nil), startup_filter([0]), rowset=16
      limit(0), offset(nil)
  4 - output([1]), filter(nil)
      values({1})
delete /*+NO_REWRITE*/from t1 where t1.b > any (select 1 * 1 from dual limit 0);
select/**/ * from t3;
c1	c2
1	1
2	5
3	2
4	6
5	4
6	7
rollback;
EXPLAIN insert into is_c3 select * from t1 where t1.b > any (select 1 * 1 from dual limit 0);
Query Plan
==============================================================
|ID|OPERATOR           |NAME           |EST.ROWS|EST.TIME(us)|
--------------------------------------------------------------
|0 |INSERT             |               |0       |9           |
|1 |└─SUBPLAN SCAN     |ANONYMOUS_VIEW1|0       |3           |
|2 |  └─TABLE FULL SCAN|t1             |0       |3           |
==============================================================
Outputs & filters:
-------------------------------------
  0 - output(nil), filter(nil)
      columns([{is_c3: ({is_c3: (is_c3.__pk_increment, is_c3.a, is_c3.b, is_c3.c)})}]), partitions(p0), 
      column_values([T_HIDDEN_PK], [column_conv(INT,PS:(11,0),NULL,ANONYMOUS_VIEW1.a)], [column_conv(INT,PS:(11,0),NULL,ANONYMOUS_VIEW1.b)], [column_conv(INT,
      PS:(11,0),NULL,ANONYMOUS_VIEW1.c)])
  1 - output([ANONYMOUS_VIEW1.a], [ANONYMOUS_VIEW1.b], [ANONYMOUS_VIEW1.c]), filter(nil), startup_filter([0]), rowset=16
      access([ANONYMOUS_VIEW1.a], [ANONYMOUS_VIEW1.b], [ANONYMOUS_VIEW1.c])
  2 - output([t1.a], [t1.b], [t1.c]), filter(nil), rowset=16
      access([t1.a], [t1.b], [t1.c]), partitions(p0)
      is_index_back=false, is_global_index=false, 
      range_key([t1.a]), range(MIN ; MAX)always true
insert into is_c3 select * from t1 where t1.b > any (select 1 * 1 from dual limit 0);
select/**/ * from is_c3;
a	b	c
rollback;
EXPLAIN insert into is_c3 select /*+NO_REWRITE*/* from t1 where t1.b > any (select 1 * 1 from dual limit 0);
Query Plan
================================================================
|ID|OPERATOR             |NAME           |EST.ROWS|EST.TIME(us)|
----------------------------------------------------------------
|0 |INSERT               |               |4       |35          |
|1 |└─SUBPLAN SCAN       |ANONYMOUS_VIEW1|4       |3           |
|2 |  └─SUBPLAN FILTER   |               |4       |3           |
|3 |    ├─TABLE FULL SCAN|t1             |8       |3           |
|4 |    └─LIMIT          |               |0       |1           |
|5 |      └─EXPRESSION   |               |1       |1           |
================================================================
Outputs & filters:
-------------------------------------
  0 - output(nil), filter(nil)
      columns([{is_c3: ({is_c3: (is_c3.__pk_increment, is_c3.a, is_c3.b, is_c3.c)})}]), partitions(p0), 
      column_values([T_HIDDEN_PK], [column_conv(INT,PS:(11,0),NULL,ANONYMOUS_VIEW1.a)], [column_conv(INT,PS:(11,0),NULL,ANONYMOUS_VIEW1.b)], [column_conv(INT,
      PS:(11,0),NULL,ANONYMOUS_VIEW1.c)])
  1 - output([ANONYMOUS_VIEW1.a], [ANONYMOUS_VIEW1.b], [ANONYMOUS_VIEW1.c]), filter(nil), rowset=16
      access([ANONYMOUS_VIEW1.a], [ANONYMOUS_VIEW1.b], [ANONYMOUS_VIEW1.c])
  2 - output([t1.a], [t1.b], [t1.c]), filter([t1.b > ANY(subquery(1))]), rowset=16
      exec_params_(nil), onetime_exprs_(nil), init_plan_idxs_([1]), use_batch=false
  3 - output([t1.a], [t1.b], [t1.c]), filter(nil), rowset=16
      access([t1.a], [t1.b], [t1.c]), partitions(p0)
      is_index_back=false, is_global_index=false, 
      range_key([t1.a]), range(MIN ; MAX)always true
  4 - output([1 * 1]), filter(nil), startup_filter([0]), rowset=16
      limit(0), offset(nil)
  5 - output([1]), filter(nil)
      values({1})
insert into is_c3 select /*+NO_REWRITE*/* from t1 where t1.b > any (select 1 * 1 from dual limit 0);
select/**/ * from is_c3;
a	b	c
rollback;


# case 40
EXPLAIN select * from t1 where t1.b > all (select 1 * 1 from dual where 1 > 5);
Query Plan
===============================================
|ID|OPERATOR       |NAME|EST.ROWS|EST.TIME(us)|
-----------------------------------------------
|0 |TABLE FULL SCAN|t1  |8       |3           |
===============================================
Outputs & filters:
-------------------------------------
  0 - output([t1.a], [t1.b], [t1.c]), filter(nil), rowset=16
      access([t1.a], [t1.b], [t1.c]), partitions(p0)
      is_index_back=false, is_global_index=false, 
      range_key([t1.a]), range(MIN ; MAX)always true
select * from t1 where t1.b > all (select 1 * 1 from dual where 1 > 5);
a	b	c
1	1	0
2	2	1
3	3	0
4	4	1
5	5	0
6	6	1
7	7	0
8	8	1
EXPLAIN select /*+NO_REWRITE*/* from t1 where t1.b > all (select 1 * 1 from dual where 1 > 5);
Query Plan
=================================================
|ID|OPERATOR         |NAME|EST.ROWS|EST.TIME(us)|
-------------------------------------------------
|0 |SUBPLAN FILTER   |    |4       |3           |
|1 |├─TABLE FULL SCAN|t1  |8       |3           |
|2 |└─EXPRESSION     |    |1       |1           |
=================================================
Outputs & filters:
-------------------------------------
  0 - output([t1.a], [t1.b], [t1.c]), filter([t1.b > ALL(subquery(1))]), rowset=16
      exec_params_(nil), onetime_exprs_(nil), init_plan_idxs_([1]), use_batch=false
  1 - output([t1.a], [t1.b], [t1.c]), filter(nil), rowset=16
      access([t1.a], [t1.b], [t1.c]), partitions(p0)
      is_index_back=false, is_global_index=false, 
      range_key([t1.a]), range(MIN ; MAX)always true
  2 - output([1 * 1]), filter([0])
      values({1 * 1})
select /*+NO_REWRITE*/* from t1 where t1.b > all (select 1 * 1 from dual where 1 > 5);
a	b	c
1	1	0
2	2	1
3	3	0
4	4	1
5	5	0
6	6	1
7	7	0
8	8	1
EXPLAIN update t1 set b = b + 1 where t1.b > all (select 1 * 1 from dual where 1 > 5);
Query Plan
=================================================
|ID|OPERATOR         |NAME|EST.ROWS|EST.TIME(us)|
-------------------------------------------------
|0 |UPDATE           |    |8       |88          |
|1 |└─TABLE FULL SCAN|t1  |8       |3           |
=================================================
Outputs & filters:
-------------------------------------
  0 - output(nil), filter(nil)
      table_columns([{t1: ({t1: (t1.a, t1.b, t1.c)})}]),
      update([t1.b=column_conv(INT,PS:(11,0),NULL,cast(t1.b + 1, INT(-1, 0)))])
  1 - output([t1.a], [t1.b], [t1.c]), filter(nil), rowset=16
      access([t1.a], [t1.b], [t1.c]), partitions(p0)
      is_index_back=false, is_global_index=false, 
      range_key([t1.a]), range(MIN ; MAX)always true
update t1 set b = b + 1 where t1.b > all (select 1 * 1 from dual where 1 > 5);
select/**/ * from t1;
a	b	c
1	2	0
2	3	1
3	4	0
4	5	1
5	6	0
6	7	1
7	8	0
8	9	1
rollback;
EXPLAIN update /*+NO_REWRITE*/t1 set b = b + 1 where t1.b > all (select 1 * 1 from dual where 1 > 5);
Query Plan
===================================================
|ID|OPERATOR           |NAME|EST.ROWS|EST.TIME(us)|
---------------------------------------------------
|0 |UPDATE             |    |4       |57          |
|1 |└─SUBPLAN FILTER   |    |4       |3           |
|2 |  ├─TABLE FULL SCAN|t1  |8       |3           |
|3 |  └─EXPRESSION     |    |1       |1           |
===================================================
Outputs & filters:
-------------------------------------
  0 - output(nil), filter(nil)
      table_columns([{t1: ({t1: (t1.a, t1.b, t1.c)})}]),
      update([t1.b=column_conv(INT,PS:(11,0),NULL,cast(t1.b + 1, INT(-1, 0)))])
  1 - output([t1.a], [t1.b], [t1.c]), filter([t1.b > ALL(subquery(1))]), rowset=16
      exec_params_(nil), onetime_exprs_(nil), init_plan_idxs_([1]), use_batch=false
  2 - output([t1.a], [t1.b], [t1.c]), filter(nil), rowset=16
      access([t1.a], [t1.b], [t1.c]), partitions(p0)
      is_index_back=false, is_global_index=false, 
      range_key([t1.a]), range(MIN ; MAX)always true
  3 - output([1 * 1]), filter([0])
      values({1 * 1})
update /*+NO_REWRITE*/t1 set b = b + 1 where t1.b > all (select 1 * 1 from dual where 1 > 5);
select/**/ * from t1;
a	b	c
1	2	0
2	3	1
3	4	0
4	5	1
5	6	0
6	7	1
7	8	0
8	9	1
rollback;
EXPLAIN delete from t1 where t1.b > all (select 1 * 1 from dual where 1 > 5);
Query Plan
=================================================
|ID|OPERATOR         |NAME|EST.ROWS|EST.TIME(us)|
-------------------------------------------------
|0 |DELETE           |    |8       |50          |
|1 |└─TABLE FULL SCAN|t1  |8       |3           |
=================================================
Outputs & filters:
-------------------------------------
  0 - output(nil), filter(nil)
      table_columns([{t1: ({t1: (t1.a, t1.b, t1.c)})}])
  1 - output([t1.a], [t1.b], [t1.c]), filter(nil), rowset=16
      access([t1.a], [t1.b], [t1.c]), partitions(p0)
      is_index_back=false, is_global_index=false, 
      range_key([t1.a]), range(MIN ; MAX)always true
delete from t1 where t1.b > all (select 1 * 1 from dual where 1 > 5);
select/**/ * from t1;
a	b	c
rollback;
EXPLAIN delete /*+NO_REWRITE*/from t1 where t1.b > all (select 1 * 1 from dual where 1 > 5);
Query Plan
===================================================
|ID|OPERATOR           |NAME|EST.ROWS|EST.TIME(us)|
---------------------------------------------------
|0 |DELETE             |    |4       |30          |
|1 |└─SUBPLAN FILTER   |    |4       |3           |
|2 |  ├─TABLE FULL SCAN|t1  |8       |3           |
|3 |  └─EXPRESSION     |    |1       |1           |
===================================================
Outputs & filters:
-------------------------------------
  0 - output(nil), filter(nil)
      table_columns([{t1: ({t1: (t1.a, t1.b, t1.c)})}])
  1 - output([t1.a], [t1.b], [t1.c]), filter([t1.b > ALL(subquery(1))]), rowset=16
      exec_params_(nil), onetime_exprs_(nil), init_plan_idxs_([1]), use_batch=false
  2 - output([t1.a], [t1.b], [t1.c]), filter(nil), rowset=16
      access([t1.a], [t1.b], [t1.c]), partitions(p0)
      is_index_back=false, is_global_index=false, 
      range_key([t1.a]), range(MIN ; MAX)always true
  3 - output([1 * 1]), filter([0])
      values({1 * 1})
delete /*+NO_REWRITE*/from t1 where t1.b > all (select 1 * 1 from dual where 1 > 5);
select/**/ * from t1;
a	b	c
rollback;
EXPLAIN insert into is_c3 select * from t1 where t1.b > all (select 1 * 1 from dual where 1 > 5);
Query Plan
==============================================================
|ID|OPERATOR           |NAME           |EST.ROWS|EST.TIME(us)|
--------------------------------------------------------------
|0 |INSERT             |               |8       |60          |
|1 |└─SUBPLAN SCAN     |ANONYMOUS_VIEW1|8       |3           |
|2 |  └─TABLE FULL SCAN|t1             |8       |3           |
==============================================================
Outputs & filters:
-------------------------------------
  0 - output(nil), filter(nil)
      columns([{is_c3: ({is_c3: (is_c3.__pk_increment, is_c3.a, is_c3.b, is_c3.c)})}]), partitions(p0), 
      column_values([T_HIDDEN_PK], [column_conv(INT,PS:(11,0),NULL,ANONYMOUS_VIEW1.a)], [column_conv(INT,PS:(11,0),NULL,ANONYMOUS_VIEW1.b)], [column_conv(INT,
      PS:(11,0),NULL,ANONYMOUS_VIEW1.c)])
  1 - output([ANONYMOUS_VIEW1.a], [ANONYMOUS_VIEW1.b], [ANONYMOUS_VIEW1.c]), filter(nil), rowset=16
      access([ANONYMOUS_VIEW1.a], [ANONYMOUS_VIEW1.b], [ANONYMOUS_VIEW1.c])
  2 - output([t1.a], [t1.b], [t1.c]), filter(nil), rowset=16
      access([t1.a], [t1.b], [t1.c]), partitions(p0)
      is_index_back=false, is_global_index=false, 
      range_key([t1.a]), range(MIN ; MAX)always true
insert into is_c3 select * from t1 where t1.b > all (select 1 * 1 from dual where 1 > 5);
select/**/ * from is_c3;
a	b	c
1	1	0
2	2	1
3	3	0
4	4	1
5	5	0
6	6	1
7	7	0
8	8	1
rollback;
EXPLAIN insert into is_c3 select /*+NO_REWRITE*/* from t1 where t1.b > all (select 1 * 1 from dual where 1 > 5);
Query Plan
================================================================
|ID|OPERATOR             |NAME           |EST.ROWS|EST.TIME(us)|
----------------------------------------------------------------
|0 |INSERT               |               |4       |35          |
|1 |└─SUBPLAN SCAN       |ANONYMOUS_VIEW1|4       |3           |
|2 |  └─SUBPLAN FILTER   |               |4       |3           |
|3 |    ├─TABLE FULL SCAN|t1             |8       |3           |
|4 |    └─EXPRESSION     |               |1       |1           |
================================================================
Outputs & filters:
-------------------------------------
  0 - output(nil), filter(nil)
      columns([{is_c3: ({is_c3: (is_c3.__pk_increment, is_c3.a, is_c3.b, is_c3.c)})}]), partitions(p0), 
      column_values([T_HIDDEN_PK], [column_conv(INT,PS:(11,0),NULL,ANONYMOUS_VIEW1.a)], [column_conv(INT,PS:(11,0),NULL,ANONYMOUS_VIEW1.b)], [column_conv(INT,
      PS:(11,0),NULL,ANONYMOUS_VIEW1.c)])
  1 - output([ANONYMOUS_VIEW1.a], [ANONYMOUS_VIEW1.b], [ANONYMOUS_VIEW1.c]), filter(nil), rowset=16
      access([ANONYMOUS_VIEW1.a], [ANONYMOUS_VIEW1.b], [ANONYMOUS_VIEW1.c])
  2 - output([t1.a], [t1.b], [t1.c]), filter([t1.b > ALL(subquery(1))]), rowset=16
      exec_params_(nil), onetime_exprs_(nil), init_plan_idxs_([1]), use_batch=false
  3 - output([t1.a], [t1.b], [t1.c]), filter(nil), rowset=16
      access([t1.a], [t1.b], [t1.c]), partitions(p0)
      is_index_back=false, is_global_index=false, 
      range_key([t1.a]), range(MIN ; MAX)always true
  4 - output([1 * 1]), filter([0])
      values({1 * 1})
insert into is_c3 select /*+NO_REWRITE*/* from t1 where t1.b > all (select 1 * 1 from dual where 1 > 5);
select/**/ * from is_c3;
a	b	c
1	1	0
2	2	1
3	3	0
4	4	1
5	5	0
6	6	1
7	7	0
8	8	1
rollback;


# case 41
EXPLAIN select * from t1 where t1.b > all (select 1 * 1 from dual limit 0);
Query Plan
===============================================
|ID|OPERATOR       |NAME|EST.ROWS|EST.TIME(us)|
-----------------------------------------------
|0 |TABLE FULL SCAN|t1  |8       |3           |
===============================================
Outputs & filters:
-------------------------------------
  0 - output([t1.a], [t1.b], [t1.c]), filter(nil), rowset=16
      access([t1.a], [t1.b], [t1.c]), partitions(p0)
      is_index_back=false, is_global_index=false, 
      range_key([t1.a]), range(MIN ; MAX)always true
select * from t1 where t1.b > all (select 1 * 1 from dual limit 0);
a	b	c
1	1	0
2	2	1
3	3	0
4	4	1
5	5	0
6	6	1
7	7	0
8	8	1
EXPLAIN select /*+NO_REWRITE*/* from t1 where t1.b > all (select 1 * 1 from dual limit 0);
Query Plan
=================================================
|ID|OPERATOR         |NAME|EST.ROWS|EST.TIME(us)|
-------------------------------------------------
|0 |SUBPLAN FILTER   |    |4       |3           |
|1 |├─TABLE FULL SCAN|t1  |8       |3           |
|2 |└─LIMIT          |    |0       |1           |
|3 |  └─EXPRESSION   |    |1       |1           |
=================================================
Outputs & filters:
-------------------------------------
  0 - output([t1.a], [t1.b], [t1.c]), filter([t1.b > ALL(subquery(1))]), rowset=16
      exec_params_(nil), onetime_exprs_(nil), init_plan_idxs_([1]), use_batch=false
  1 - output([t1.a], [t1.b], [t1.c]), filter(nil), rowset=16
      access([t1.a], [t1.b], [t1.c]), partitions(p0)
      is_index_back=false, is_global_index=false, 
      range_key([t1.a]), range(MIN ; MAX)always true
  2 - output([1 * 1]), filter(nil), startup_filter([0]), rowset=16
      limit(0), offset(nil)
  3 - output([1]), filter(nil)
      values({1})
select /*+NO_REWRITE*/* from t1 where t1.b > all (select 1 * 1 from dual limit 0);
a	b	c
1	1	0
2	2	1
3	3	0
4	4	1
5	5	0
6	6	1
7	7	0
8	8	1
EXPLAIN update t1 set b = b + 1 where t1.b > all (select 1 * 1 from dual limit 0);
Query Plan
=================================================
|ID|OPERATOR         |NAME|EST.ROWS|EST.TIME(us)|
-------------------------------------------------
|0 |UPDATE           |    |8       |88          |
|1 |└─TABLE FULL SCAN|t1  |8       |3           |
=================================================
Outputs & filters:
-------------------------------------
  0 - output(nil), filter(nil)
      table_columns([{t1: ({t1: (t1.a, t1.b, t1.c)})}]),
      update([t1.b=column_conv(INT,PS:(11,0),NULL,cast(t1.b + 1, INT(-1, 0)))])
  1 - output([t1.a], [t1.b], [t1.c]), filter(nil), rowset=16
      access([t1.a], [t1.b], [t1.c]), partitions(p0)
      is_index_back=false, is_global_index=false, 
      range_key([t1.a]), range(MIN ; MAX)always true
update t1 set b = b + 1 where t1.b > all (select 1 * 1 from dual limit 0);
select/**/ * from t1;
a	b	c
1	2	0
2	3	1
3	4	0
4	5	1
5	6	0
6	7	1
7	8	0
8	9	1
rollback;
EXPLAIN update /*+NO_REWRITE*/t1 set b = b + 1 where t1.b > all (select 1 * 1 from dual limit 0);
Query Plan
===================================================
|ID|OPERATOR           |NAME|EST.ROWS|EST.TIME(us)|
---------------------------------------------------
|0 |UPDATE             |    |4       |57          |
|1 |└─SUBPLAN FILTER   |    |4       |3           |
|2 |  ├─TABLE FULL SCAN|t1  |8       |3           |
|3 |  └─LIMIT          |    |0       |1           |
|4 |    └─EXPRESSION   |    |1       |1           |
===================================================
Outputs & filters:
-------------------------------------
  0 - output(nil), filter(nil)
      table_columns([{t1: ({t1: (t1.a, t1.b, t1.c)})}]),
      update([t1.b=column_conv(INT,PS:(11,0),NULL,cast(t1.b + 1, INT(-1, 0)))])
  1 - output([t1.a], [t1.b], [t1.c]), filter([t1.b > ALL(subquery(1))]), rowset=16
      exec_params_(nil), onetime_exprs_(nil), init_plan_idxs_([1]), use_batch=false
  2 - output([t1.a], [t1.b], [t1.c]), filter(nil), rowset=16
      access([t1.a], [t1.b], [t1.c]), partitions(p0)
      is_index_back=false, is_global_index=false, 
      range_key([t1.a]), range(MIN ; MAX)always true
  3 - output([1 * 1]), filter(nil), startup_filter([0]), rowset=16
      limit(0), offset(nil)
  4 - output([1]), filter(nil)
      values({1})
update /*+NO_REWRITE*/t1 set b = b + 1 where t1.b > all (select 1 * 1 from dual limit 0);
select/**/ * from t1;
a	b	c
1	2	0
2	3	1
3	4	0
4	5	1
5	6	0
6	7	1
7	8	0
8	9	1
rollback;
EXPLAIN delete from t1 where t1.b > all (select 1 * 1 from dual limit 0);
Query Plan
=================================================
|ID|OPERATOR         |NAME|EST.ROWS|EST.TIME(us)|
-------------------------------------------------
|0 |DELETE           |    |8       |50          |
|1 |└─TABLE FULL SCAN|t1  |8       |3           |
=================================================
Outputs & filters:
-------------------------------------
  0 - output(nil), filter(nil)
      table_columns([{t1: ({t1: (t1.a, t1.b, t1.c)})}])
  1 - output([t1.a], [t1.b], [t1.c]), filter(nil), rowset=16
      access([t1.a], [t1.b], [t1.c]), partitions(p0)
      is_index_back=false, is_global_index=false, 
      range_key([t1.a]), range(MIN ; MAX)always true
delete from t1 where t1.b > all (select 1 * 1 from dual limit 0);
select/**/ * from t1;
a	b	c
rollback;
EXPLAIN delete /*+NO_REWRITE*/from t1 where t1.b > all (select 1 * 1 from dual limit 0);
Query Plan
===================================================
|ID|OPERATOR           |NAME|EST.ROWS|EST.TIME(us)|
---------------------------------------------------
|0 |DELETE             |    |4       |30          |
|1 |└─SUBPLAN FILTER   |    |4       |3           |
|2 |  ├─TABLE FULL SCAN|t1  |8       |3           |
|3 |  └─LIMIT          |    |0       |1           |
|4 |    └─EXPRESSION   |    |1       |1           |
===================================================
Outputs & filters:
-------------------------------------
  0 - output(nil), filter(nil)
      table_columns([{t1: ({t1: (t1.a, t1.b, t1.c)})}])
  1 - output([t1.a], [t1.b], [t1.c]), filter([t1.b > ALL(subquery(1))]), rowset=16
      exec_params_(nil), onetime_exprs_(nil), init_plan_idxs_([1]), use_batch=false
  2 - output([t1.a], [t1.b], [t1.c]), filter(nil), rowset=16
      access([t1.a], [t1.b], [t1.c]), partitions(p0)
      is_index_back=false, is_global_index=false, 
      range_key([t1.a]), range(MIN ; MAX)always true
  3 - output([1 * 1]), filter(nil), startup_filter([0]), rowset=16
      limit(0), offset(nil)
  4 - output([1]), filter(nil)
      values({1})
delete /*+NO_REWRITE*/from t1 where t1.b > all (select 1 * 1 from dual limit 0);
select/**/ * from t1;
a	b	c
rollback;
EXPLAIN insert into is_c3 select * from t1 where t1.b > all (select 1 * 1 from dual limit 0);
Query Plan
==============================================================
|ID|OPERATOR           |NAME           |EST.ROWS|EST.TIME(us)|
--------------------------------------------------------------
|0 |INSERT             |               |8       |60          |
|1 |└─SUBPLAN SCAN     |ANONYMOUS_VIEW1|8       |3           |
|2 |  └─TABLE FULL SCAN|t1             |8       |3           |
==============================================================
Outputs & filters:
-------------------------------------
  0 - output(nil), filter(nil)
      columns([{is_c3: ({is_c3: (is_c3.__pk_increment, is_c3.a, is_c3.b, is_c3.c)})}]), partitions(p0), 
      column_values([T_HIDDEN_PK], [column_conv(INT,PS:(11,0),NULL,ANONYMOUS_VIEW1.a)], [column_conv(INT,PS:(11,0),NULL,ANONYMOUS_VIEW1.b)], [column_conv(INT,
      PS:(11,0),NULL,ANONYMOUS_VIEW1.c)])
  1 - output([ANONYMOUS_VIEW1.a], [ANONYMOUS_VIEW1.b], [ANONYMOUS_VIEW1.c]), filter(nil), rowset=16
      access([ANONYMOUS_VIEW1.a], [ANONYMOUS_VIEW1.b], [ANONYMOUS_VIEW1.c])
  2 - output([t1.a], [t1.b], [t1.c]), filter(nil), rowset=16
      access([t1.a], [t1.b], [t1.c]), partitions(p0)
      is_index_back=false, is_global_index=false, 
      range_key([t1.a]), range(MIN ; MAX)always true
insert into is_c3 select * from t1 where t1.b > all (select 1 * 1 from dual limit 0);
select/**/ * from is_c3;
a	b	c
1	1	0
2	2	1
3	3	0
4	4	1
5	5	0
6	6	1
7	7	0
8	8	1
rollback;
EXPLAIN insert into is_c3 select /*+NO_REWRITE*/* from t1 where t1.b > all (select 1 * 1 from dual limit 0);
Query Plan
================================================================
|ID|OPERATOR             |NAME           |EST.ROWS|EST.TIME(us)|
----------------------------------------------------------------
|0 |INSERT               |               |4       |35          |
|1 |└─SUBPLAN SCAN       |ANONYMOUS_VIEW1|4       |3           |
|2 |  └─SUBPLAN FILTER   |               |4       |3           |
|3 |    ├─TABLE FULL SCAN|t1             |8       |3           |
|4 |    └─LIMIT          |               |0       |1           |
|5 |      └─EXPRESSION   |               |1       |1           |
================================================================
Outputs & filters:
-------------------------------------
  0 - output(nil), filter(nil)
      columns([{is_c3: ({is_c3: (is_c3.__pk_increment, is_c3.a, is_c3.b, is_c3.c)})}]), partitions(p0), 
      column_values([T_HIDDEN_PK], [column_conv(INT,PS:(11,0),NULL,ANONYMOUS_VIEW1.a)], [column_conv(INT,PS:(11,0),NULL,ANONYMOUS_VIEW1.b)], [column_conv(INT,
      PS:(11,0),NULL,ANONYMOUS_VIEW1.c)])
  1 - output([ANONYMOUS_VIEW1.a], [ANONYMOUS_VIEW1.b], [ANONYMOUS_VIEW1.c]), filter(nil), rowset=16
      access([ANONYMOUS_VIEW1.a], [ANONYMOUS_VIEW1.b], [ANONYMOUS_VIEW1.c])
  2 - output([t1.a], [t1.b], [t1.c]), filter([t1.b > ALL(subquery(1))]), rowset=16
      exec_params_(nil), onetime_exprs_(nil), init_plan_idxs_([1]), use_batch=false
  3 - output([t1.a], [t1.b], [t1.c]), filter(nil), rowset=16
      access([t1.a], [t1.b], [t1.c]), partitions(p0)
      is_index_back=false, is_global_index=false, 
      range_key([t1.a]), range(MIN ; MAX)always true
  4 - output([1 * 1]), filter(nil), startup_filter([0]), rowset=16
      limit(0), offset(nil)
  5 - output([1]), filter(nil)
      values({1})
insert into is_c3 select /*+NO_REWRITE*/* from t1 where t1.b > all (select 1 * 1 from dual limit 0);
select/**/ * from is_c3;
a	b	c
1	1	0
2	2	1
3	3	0
4	4	1
5	5	0
6	6	1
7	7	0
8	8	1
rollback;


# case 42
## 表达式子查询，any/all 不可删除的情景
EXPLAIN select * from t1 where t1.b > any (select row_number() over ());
Query Plan
===============================================
|ID|OPERATOR       |NAME|EST.ROWS|EST.TIME(us)|
-----------------------------------------------
|0 |TABLE FULL SCAN|t1  |8       |3           |
===============================================
Outputs & filters:
-------------------------------------
  0 - output([t1.a], [t1.b], [t1.c]), filter([t1.b > cast(1, BIGINT UNSIGNED(20, 0))]), rowset=16
      access([t1.a], [t1.b], [t1.c]), partitions(p0)
      is_index_back=false, is_global_index=false, filter_before_indexback[false], 
      range_key([t1.a]), range(MIN ; MAX)always true
select * from t1 where t1.b > any (select row_number() over ());
a	b	c
2	2	1
3	3	0
4	4	1
5	5	0
6	6	1
7	7	0
8	8	1
EXPLAIN select /*+NO_REWRITE*/* from t1 where t1.b > any (select row_number() over ());
Query Plan
=================================================
|ID|OPERATOR         |NAME|EST.ROWS|EST.TIME(us)|
-------------------------------------------------
|0 |SUBPLAN FILTER   |    |4       |3           |
|1 |├─TABLE FULL SCAN|t1  |8       |3           |
|2 |└─EXPRESSION     |    |1       |1           |
=================================================
Outputs & filters:
-------------------------------------
  0 - output([t1.a], [t1.b], [t1.c]), filter([t1.b > ANY(subquery(1))]), rowset=16
      exec_params_(nil), onetime_exprs_(nil), init_plan_idxs_([1]), use_batch=false
  1 - output([t1.a], [t1.b], [t1.c]), filter(nil), rowset=16
      access([t1.a], [t1.b], [t1.c]), partitions(p0)
      is_index_back=false, is_global_index=false, 
      range_key([t1.a]), range(MIN ; MAX)always true
  2 - output([cast(1, BIGINT UNSIGNED(20, 0))]), filter(nil)
      values({cast(1, BIGINT UNSIGNED(20, 0))})
select /*+NO_REWRITE*/* from t1 where t1.b > any (select row_number() over ());
a	b	c
2	2	1
3	3	0
4	4	1
5	5	0
6	6	1
7	7	0
8	8	1
EXPLAIN update t1 set b = b + 1 where t1.b > any (select row_number() over ());
Query Plan
=================================================
|ID|OPERATOR         |NAME|EST.ROWS|EST.TIME(us)|
-------------------------------------------------
|0 |UPDATE           |    |8       |88          |
|1 |└─TABLE FULL SCAN|t1  |8       |3           |
=================================================
Outputs & filters:
-------------------------------------
  0 - output(nil), filter(nil)
      table_columns([{t1: ({t1: (t1.a, t1.b, t1.c)})}]),
      update([t1.b=column_conv(INT,PS:(11,0),NULL,cast(t1.b + 1, INT(-1, 0)))])
  1 - output([t1.a], [t1.b], [t1.c]), filter([t1.b > cast(1, BIGINT UNSIGNED(20, 0))]), rowset=16
      access([t1.a], [t1.b], [t1.c]), partitions(p0)
      is_index_back=false, is_global_index=false, filter_before_indexback[false], 
      range_key([t1.a]), range(MIN ; MAX)always true
update t1 set b = b + 1 where t1.b > any (select row_number() over ());
select/**/ * from t1;
a	b	c
1	1	0
2	3	1
3	4	0
4	5	1
5	6	0
6	7	1
7	8	0
8	9	1
rollback;
EXPLAIN update /*+NO_REWRITE*/t1 set b = b + 1 where t1.b > any (select row_number() over ());
Query Plan
===================================================
|ID|OPERATOR           |NAME|EST.ROWS|EST.TIME(us)|
---------------------------------------------------
|0 |UPDATE             |    |4       |57          |
|1 |└─SUBPLAN FILTER   |    |4       |3           |
|2 |  ├─TABLE FULL SCAN|t1  |8       |3           |
|3 |  └─EXPRESSION     |    |1       |1           |
===================================================
Outputs & filters:
-------------------------------------
  0 - output(nil), filter(nil)
      table_columns([{t1: ({t1: (t1.a, t1.b, t1.c)})}]),
      update([t1.b=column_conv(INT,PS:(11,0),NULL,cast(t1.b + 1, INT(-1, 0)))])
  1 - output([t1.a], [t1.b], [t1.c]), filter([t1.b > ANY(subquery(1))]), rowset=16
      exec_params_(nil), onetime_exprs_(nil), init_plan_idxs_([1]), use_batch=false
  2 - output([t1.a], [t1.b], [t1.c]), filter(nil), rowset=16
      access([t1.a], [t1.b], [t1.c]), partitions(p0)
      is_index_back=false, is_global_index=false, 
      range_key([t1.a]), range(MIN ; MAX)always true
  3 - output([cast(1, BIGINT UNSIGNED(20, 0))]), filter(nil)
      values({cast(1, BIGINT UNSIGNED(20, 0))})
update /*+NO_REWRITE*/t1 set b = b + 1 where t1.b > any (select row_number() over ());
select/**/ * from t1;
a	b	c
1	1	0
2	3	1
3	4	0
4	5	1
5	6	0
6	7	1
7	8	0
8	9	1
rollback;
EXPLAIN delete from t1 where t1.b > any (select row_number() over ());
Query Plan
=================================================
|ID|OPERATOR         |NAME|EST.ROWS|EST.TIME(us)|
-------------------------------------------------
|0 |DELETE           |    |8       |50          |
|1 |└─TABLE FULL SCAN|t1  |8       |3           |
=================================================
Outputs & filters:
-------------------------------------
  0 - output(nil), filter(nil)
      table_columns([{t1: ({t1: (t1.a, t1.b, t1.c)})}])
  1 - output([t1.a], [t1.b], [t1.c]), filter([t1.b > cast(1, BIGINT UNSIGNED(20, 0))]), rowset=16
      access([t1.a], [t1.b], [t1.c]), partitions(p0)
      is_index_back=false, is_global_index=false, filter_before_indexback[false], 
      range_key([t1.a]), range(MIN ; MAX)always true
delete from t1 where t1.b > any (select row_number() over ());
select/**/ * from t1;
a	b	c
1	1	0
rollback;
EXPLAIN delete /*+NO_REWRITE*/from t1 where t1.b > any (select row_number() over ());
Query Plan
===================================================
|ID|OPERATOR           |NAME|EST.ROWS|EST.TIME(us)|
---------------------------------------------------
|0 |DELETE             |    |4       |30          |
|1 |└─SUBPLAN FILTER   |    |4       |3           |
|2 |  ├─TABLE FULL SCAN|t1  |8       |3           |
|3 |  └─EXPRESSION     |    |1       |1           |
===================================================
Outputs & filters:
-------------------------------------
  0 - output(nil), filter(nil)
      table_columns([{t1: ({t1: (t1.a, t1.b, t1.c)})}])
  1 - output([t1.a], [t1.b], [t1.c]), filter([t1.b > ANY(subquery(1))]), rowset=16
      exec_params_(nil), onetime_exprs_(nil), init_plan_idxs_([1]), use_batch=false
  2 - output([t1.a], [t1.b], [t1.c]), filter(nil), rowset=16
      access([t1.a], [t1.b], [t1.c]), partitions(p0)
      is_index_back=false, is_global_index=false, 
      range_key([t1.a]), range(MIN ; MAX)always true
  3 - output([cast(1, BIGINT UNSIGNED(20, 0))]), filter(nil)
      values({cast(1, BIGINT UNSIGNED(20, 0))})
delete /*+NO_REWRITE*/from t1 where t1.b > any (select row_number() over ());
select/**/ * from t1;
a	b	c
1	1	0
rollback;
EXPLAIN insert into is_c3 select * from t1 where t1.b > any (select row_number() over ());
Query Plan
==============================================================
|ID|OPERATOR           |NAME           |EST.ROWS|EST.TIME(us)|
--------------------------------------------------------------
|0 |INSERT             |               |8       |61          |
|1 |└─SUBPLAN SCAN     |ANONYMOUS_VIEW1|8       |3           |
|2 |  └─TABLE FULL SCAN|t1             |8       |3           |
==============================================================
Outputs & filters:
-------------------------------------
  0 - output(nil), filter(nil)
      columns([{is_c3: ({is_c3: (is_c3.__pk_increment, is_c3.a, is_c3.b, is_c3.c)})}]), partitions(p0), 
      column_values([T_HIDDEN_PK], [column_conv(INT,PS:(11,0),NULL,ANONYMOUS_VIEW1.a)], [column_conv(INT,PS:(11,0),NULL,ANONYMOUS_VIEW1.b)], [column_conv(INT,
      PS:(11,0),NULL,ANONYMOUS_VIEW1.c)])
  1 - output([ANONYMOUS_VIEW1.a], [ANONYMOUS_VIEW1.b], [ANONYMOUS_VIEW1.c]), filter(nil), rowset=16
      access([ANONYMOUS_VIEW1.a], [ANONYMOUS_VIEW1.b], [ANONYMOUS_VIEW1.c])
  2 - output([t1.a], [t1.b], [t1.c]), filter([t1.b > cast(1, BIGINT UNSIGNED(20, 0))]), rowset=16
      access([t1.a], [t1.b], [t1.c]), partitions(p0)
      is_index_back=false, is_global_index=false, filter_before_indexback[false], 
      range_key([t1.a]), range(MIN ; MAX)always true
insert into is_c3 select * from t1 where t1.b > any (select row_number() over ());
select/**/ * from is_c3;
a	b	c
2	2	1
3	3	0
4	4	1
5	5	0
6	6	1
7	7	0
8	8	1
rollback;
EXPLAIN insert into is_c3 select /*+NO_REWRITE*/* from t1 where t1.b > any (select row_number() over ());
Query Plan
================================================================
|ID|OPERATOR             |NAME           |EST.ROWS|EST.TIME(us)|
----------------------------------------------------------------
|0 |INSERT               |               |4       |35          |
|1 |└─SUBPLAN SCAN       |ANONYMOUS_VIEW1|4       |3           |
|2 |  └─SUBPLAN FILTER   |               |4       |3           |
|3 |    ├─TABLE FULL SCAN|t1             |8       |3           |
|4 |    └─EXPRESSION     |               |1       |1           |
================================================================
Outputs & filters:
-------------------------------------
  0 - output(nil), filter(nil)
      columns([{is_c3: ({is_c3: (is_c3.__pk_increment, is_c3.a, is_c3.b, is_c3.c)})}]), partitions(p0), 
      column_values([T_HIDDEN_PK], [column_conv(INT,PS:(11,0),NULL,ANONYMOUS_VIEW1.a)], [column_conv(INT,PS:(11,0),NULL,ANONYMOUS_VIEW1.b)], [column_conv(INT,
      PS:(11,0),NULL,ANONYMOUS_VIEW1.c)])
  1 - output([ANONYMOUS_VIEW1.a], [ANONYMOUS_VIEW1.b], [ANONYMOUS_VIEW1.c]), filter(nil), rowset=16
      access([ANONYMOUS_VIEW1.a], [ANONYMOUS_VIEW1.b], [ANONYMOUS_VIEW1.c])
  2 - output([t1.a], [t1.b], [t1.c]), filter([t1.b > ANY(subquery(1))]), rowset=16
      exec_params_(nil), onetime_exprs_(nil), init_plan_idxs_([1]), use_batch=false
  3 - output([t1.a], [t1.b], [t1.c]), filter(nil), rowset=16
      access([t1.a], [t1.b], [t1.c]), partitions(p0)
      is_index_back=false, is_global_index=false, 
      range_key([t1.a]), range(MIN ; MAX)always true
  4 - output([cast(1, BIGINT UNSIGNED(20, 0))]), filter(nil)
      values({cast(1, BIGINT UNSIGNED(20, 0))})
insert into is_c3 select /*+NO_REWRITE*/* from t1 where t1.b > any (select row_number() over ());
select/**/ * from is_c3;
a	b	c
2	2	1
3	3	0
4	4	1
5	5	0
6	6	1
7	7	0
8	8	1
rollback;


# case 43
EXPLAIN select * from t1 where t1.b > any (select 1 union select 2);
Query Plan
====================================================================
|ID|OPERATOR                   |NAME         |EST.ROWS|EST.TIME(us)|
--------------------------------------------------------------------
|0 |NESTED-LOOP SEMI JOIN      |             |1       |4           |
|1 |├─TABLE FULL SCAN          |t1           |8       |3           |
|2 |└─MATERIAL                 |             |2       |1           |
|3 |  └─SUBPLAN SCAN           |VIEW2        |2       |1           |
|4 |    └─HASH DISTINCT        |             |2       |1           |
|5 |      └─VALUES TABLE ACCESS|VALUES_TABLE1|2       |1           |
====================================================================
Outputs & filters:
-------------------------------------
  0 - output([t1.a], [t1.b], [t1.c]), filter(nil), rowset=16
      conds([t1.b > VIEW2.1]), nl_params_(nil), use_batch=false
  1 - output([t1.a], [t1.b], [t1.c]), filter(nil), rowset=16
      access([t1.a], [t1.b], [t1.c]), partitions(p0)
      is_index_back=false, is_global_index=false, 
      range_key([t1.a]), range(MIN ; MAX)always true
  2 - output([VIEW2.1]), filter(nil), rowset=16
  3 - output([VIEW2.1]), filter(nil), rowset=16
      access([VIEW2.1])
  4 - output([VALUES_TABLE1.column_0]), filter(nil), rowset=16
      distinct([VALUES_TABLE1.column_0])
  5 - output([VALUES_TABLE1.column_0]), filter(nil)
      access([VALUES_TABLE1.column_0])
select * from t1 where t1.b > any (select 1 union select 2);
a	b	c
2	2	1
3	3	0
4	4	1
5	5	0
6	6	1
7	7	0
8	8	1
EXPLAIN select /*+NO_REWRITE*/* from t1 where t1.b > any (select 1 union select 2);
Query Plan
================================================================
|ID|OPERATOR               |NAME         |EST.ROWS|EST.TIME(us)|
----------------------------------------------------------------
|0 |SUBPLAN FILTER         |             |4       |4           |
|1 |├─TABLE FULL SCAN      |t1           |8       |3           |
|2 |└─HASH DISTINCT        |             |2       |1           |
|3 |  └─VALUES TABLE ACCESS|VALUES_TABLE1|2       |1           |
================================================================
Outputs & filters:
-------------------------------------
  0 - output([t1.a], [t1.b], [t1.c]), filter([t1.b > ANY(subquery(1))]), rowset=16
      exec_params_(nil), onetime_exprs_(nil), init_plan_idxs_([1]), use_batch=false
  1 - output([t1.a], [t1.b], [t1.c]), filter(nil), rowset=16
      access([t1.a], [t1.b], [t1.c]), partitions(p0)
      is_index_back=false, is_global_index=false, 
      range_key([t1.a]), range(MIN ; MAX)always true
  2 - output([VALUES_TABLE1.column_0]), filter(nil), rowset=16
      distinct([VALUES_TABLE1.column_0])
  3 - output([VALUES_TABLE1.column_0]), filter(nil)
      access([VALUES_TABLE1.column_0])
select /*+NO_REWRITE*/* from t1 where t1.b > any (select 1 union select 2);
a	b	c
2	2	1
3	3	0
4	4	1
5	5	0
6	6	1
7	7	0
8	8	1
EXPLAIN update t1 set b = b + 1 where t1.b > any (select 1 union select 2);
Query Plan
======================================================================
|ID|OPERATOR                     |NAME         |EST.ROWS|EST.TIME(us)|
----------------------------------------------------------------------
|0 |UPDATE                       |             |1       |31          |
|1 |└─NESTED-LOOP SEMI JOIN      |             |1       |4           |
|2 |  ├─TABLE FULL SCAN          |t1           |8       |3           |
|3 |  └─MATERIAL                 |             |2       |1           |
|4 |    └─SUBPLAN SCAN           |VIEW2        |2       |1           |
|5 |      └─HASH DISTINCT        |             |2       |1           |
|6 |        └─VALUES TABLE ACCESS|VALUES_TABLE1|2       |1           |
======================================================================
Outputs & filters:
-------------------------------------
  0 - output(nil), filter(nil)
      table_columns([{t1: ({t1: (t1.a, t1.b, t1.c)})}]),
      update([t1.b=column_conv(INT,PS:(11,0),NULL,cast(t1.b + 1, INT(-1, 0)))])
  1 - output([t1.a], [t1.b], [t1.c]), filter(nil), rowset=16
      conds([t1.b > VIEW2.1]), nl_params_(nil), use_batch=false
  2 - output([t1.a], [t1.b], [t1.c]), filter(nil), rowset=16
      access([t1.a], [t1.b], [t1.c]), partitions(p0)
      is_index_back=false, is_global_index=false, 
      range_key([t1.a]), range(MIN ; MAX)always true
  3 - output([VIEW2.1]), filter(nil), rowset=16
  4 - output([VIEW2.1]), filter(nil), rowset=16
      access([VIEW2.1])
  5 - output([VALUES_TABLE1.column_0]), filter(nil), rowset=16
      distinct([VALUES_TABLE1.column_0])
  6 - output([VALUES_TABLE1.column_0]), filter(nil)
      access([VALUES_TABLE1.column_0])
update t1 set b = b + 1 where t1.b > any (select 1 union select 2);
select/**/ * from t1;
a	b	c
1	1	0
2	3	1
3	4	0
4	5	1
5	6	0
6	7	1
7	8	0
8	9	1
rollback;
EXPLAIN update /*+NO_REWRITE*/t1 set b = b + 1 where t1.b > any (select 1 union select 2);
Query Plan
==================================================================
|ID|OPERATOR                 |NAME         |EST.ROWS|EST.TIME(us)|
------------------------------------------------------------------
|0 |UPDATE                   |             |4       |58          |
|1 |└─SUBPLAN FILTER         |             |4       |4           |
|2 |  ├─TABLE FULL SCAN      |t1           |8       |3           |
|3 |  └─HASH DISTINCT        |             |2       |1           |
|4 |    └─VALUES TABLE ACCESS|VALUES_TABLE1|2       |1           |
==================================================================
Outputs & filters:
-------------------------------------
  0 - output(nil), filter(nil)
      table_columns([{t1: ({t1: (t1.a, t1.b, t1.c)})}]),
      update([t1.b=column_conv(INT,PS:(11,0),NULL,cast(t1.b + 1, INT(-1, 0)))])
  1 - output([t1.a], [t1.b], [t1.c]), filter([t1.b > ANY(subquery(1))]), rowset=16
      exec_params_(nil), onetime_exprs_(nil), init_plan_idxs_([1]), use_batch=false
  2 - output([t1.a], [t1.b], [t1.c]), filter(nil), rowset=16
      access([t1.a], [t1.b], [t1.c]), partitions(p0)
      is_index_back=false, is_global_index=false, 
      range_key([t1.a]), range(MIN ; MAX)always true
  3 - output([VALUES_TABLE1.column_0]), filter(nil), rowset=16
      distinct([VALUES_TABLE1.column_0])
  4 - output([VALUES_TABLE1.column_0]), filter(nil)
      access([VALUES_TABLE1.column_0])
update /*+NO_REWRITE*/t1 set b = b + 1 where t1.b > any (select 1 union select 2);
select/**/ * from t1;
a	b	c
1	1	0
2	3	1
3	4	0
4	5	1
5	6	0
6	7	1
7	8	0
8	9	1
rollback;
EXPLAIN delete from t1 where t1.b > any (select 1 union select 2);
Query Plan
======================================================================
|ID|OPERATOR                     |NAME         |EST.ROWS|EST.TIME(us)|
----------------------------------------------------------------------
|0 |DELETE                       |             |1       |13          |
|1 |└─NESTED-LOOP SEMI JOIN      |             |1       |4           |
|2 |  ├─TABLE FULL SCAN          |t1           |8       |3           |
|3 |  └─MATERIAL                 |             |2       |1           |
|4 |    └─SUBPLAN SCAN           |VIEW2        |2       |1           |
|5 |      └─HASH DISTINCT        |             |2       |1           |
|6 |        └─VALUES TABLE ACCESS|VALUES_TABLE1|2       |1           |
======================================================================
Outputs & filters:
-------------------------------------
  0 - output(nil), filter(nil)
      table_columns([{t1: ({t1: (t1.a, t1.b, t1.c)})}])
  1 - output([t1.a], [t1.b], [t1.c]), filter(nil), rowset=16
      conds([t1.b > VIEW2.1]), nl_params_(nil), use_batch=false
  2 - output([t1.a], [t1.b], [t1.c]), filter(nil), rowset=16
      access([t1.a], [t1.b], [t1.c]), partitions(p0)
      is_index_back=false, is_global_index=false, 
      range_key([t1.a]), range(MIN ; MAX)always true
  3 - output([VIEW2.1]), filter(nil), rowset=16
  4 - output([VIEW2.1]), filter(nil), rowset=16
      access([VIEW2.1])
  5 - output([VALUES_TABLE1.column_0]), filter(nil), rowset=16
      distinct([VALUES_TABLE1.column_0])
  6 - output([VALUES_TABLE1.column_0]), filter(nil)
      access([VALUES_TABLE1.column_0])
delete from t1 where t1.b > any (select 1 union select 2);
select/**/ * from t1;
a	b	c
1	1	0
rollback;
EXPLAIN delete /*+NO_REWRITE*/from t1 where t1.b > any (select 1 union select 2);
Query Plan
==================================================================
|ID|OPERATOR                 |NAME         |EST.ROWS|EST.TIME(us)|
------------------------------------------------------------------
|0 |DELETE                   |             |4       |30          |
|1 |└─SUBPLAN FILTER         |             |4       |4           |
|2 |  ├─TABLE FULL SCAN      |t1           |8       |3           |
|3 |  └─HASH DISTINCT        |             |2       |1           |
|4 |    └─VALUES TABLE ACCESS|VALUES_TABLE1|2       |1           |
==================================================================
Outputs & filters:
-------------------------------------
  0 - output(nil), filter(nil)
      table_columns([{t1: ({t1: (t1.a, t1.b, t1.c)})}])
  1 - output([t1.a], [t1.b], [t1.c]), filter([t1.b > ANY(subquery(1))]), rowset=16
      exec_params_(nil), onetime_exprs_(nil), init_plan_idxs_([1]), use_batch=false
  2 - output([t1.a], [t1.b], [t1.c]), filter(nil), rowset=16
      access([t1.a], [t1.b], [t1.c]), partitions(p0)
      is_index_back=false, is_global_index=false, 
      range_key([t1.a]), range(MIN ; MAX)always true
  3 - output([VALUES_TABLE1.column_0]), filter(nil), rowset=16
      distinct([VALUES_TABLE1.column_0])
  4 - output([VALUES_TABLE1.column_0]), filter(nil)
      access([VALUES_TABLE1.column_0])
delete /*+NO_REWRITE*/from t1 where t1.b > any (select 1 union select 2);
select/**/ * from t1;
a	b	c
1	1	0
rollback;
EXPLAIN insert into is_c3 select * from t1 where t1.b > any (select 1 union select 2);
Query Plan
==========================================================================
|ID|OPERATOR                       |NAME           |EST.ROWS|EST.TIME(us)|
--------------------------------------------------------------------------
|0 |INSERT                         |               |1       |13          |
|1 |└─SUBPLAN SCAN                 |ANONYMOUS_VIEW1|1       |4           |
|2 |  └─NESTED-LOOP SEMI JOIN      |               |1       |4           |
|3 |    ├─TABLE FULL SCAN          |t1             |8       |3           |
|4 |    └─MATERIAL                 |               |2       |1           |
|5 |      └─SUBPLAN SCAN           |VIEW2          |2       |1           |
|6 |        └─HASH DISTINCT        |               |2       |1           |
|7 |          └─VALUES TABLE ACCESS|VALUES_TABLE1  |2       |1           |
==========================================================================
Outputs & filters:
-------------------------------------
  0 - output(nil), filter(nil)
      columns([{is_c3: ({is_c3: (is_c3.__pk_increment, is_c3.a, is_c3.b, is_c3.c)})}]), partitions(p0), 
      column_values([T_HIDDEN_PK], [column_conv(INT,PS:(11,0),NULL,ANONYMOUS_VIEW1.a)], [column_conv(INT,PS:(11,0),NULL,ANONYMOUS_VIEW1.b)], [column_conv(INT,
      PS:(11,0),NULL,ANONYMOUS_VIEW1.c)])
  1 - output([ANONYMOUS_VIEW1.a], [ANONYMOUS_VIEW1.b], [ANONYMOUS_VIEW1.c]), filter(nil), rowset=16
      access([ANONYMOUS_VIEW1.a], [ANONYMOUS_VIEW1.b], [ANONYMOUS_VIEW1.c])
  2 - output([t1.a], [t1.b], [t1.c]), filter(nil), rowset=16
      conds([t1.b > VIEW2.1]), nl_params_(nil), use_batch=false
  3 - output([t1.a], [t1.b], [t1.c]), filter(nil), rowset=16
      access([t1.a], [t1.b], [t1.c]), partitions(p0)
      is_index_back=false, is_global_index=false, 
      range_key([t1.a]), range(MIN ; MAX)always true
  4 - output([VIEW2.1]), filter(nil), rowset=16
  5 - output([VIEW2.1]), filter(nil), rowset=16
      access([VIEW2.1])
  6 - output([VALUES_TABLE1.column_0]), filter(nil), rowset=16
      distinct([VALUES_TABLE1.column_0])
  7 - output([VALUES_TABLE1.column_0]), filter(nil)
      access([VALUES_TABLE1.column_0])
insert into is_c3 select * from t1 where t1.b > any (select 1 union select 2);
select/**/ * from is_c3;
a	b	c
2	2	1
3	3	0
4	4	1
5	5	0
6	6	1
7	7	0
8	8	1
rollback;
EXPLAIN insert into is_c3 select /*+NO_REWRITE*/* from t1 where t1.b > any (select 1 union select 2);
Query Plan
======================================================================
|ID|OPERATOR                   |NAME           |EST.ROWS|EST.TIME(us)|
----------------------------------------------------------------------
|0 |INSERT                     |               |4       |36          |
|1 |└─SUBPLAN SCAN             |ANONYMOUS_VIEW1|4       |4           |
|2 |  └─SUBPLAN FILTER         |               |4       |4           |
|3 |    ├─TABLE FULL SCAN      |t1             |8       |3           |
|4 |    └─HASH DISTINCT        |               |2       |1           |
|5 |      └─VALUES TABLE ACCESS|VALUES_TABLE1  |2       |1           |
======================================================================
Outputs & filters:
-------------------------------------
  0 - output(nil), filter(nil)
      columns([{is_c3: ({is_c3: (is_c3.__pk_increment, is_c3.a, is_c3.b, is_c3.c)})}]), partitions(p0), 
      column_values([T_HIDDEN_PK], [column_conv(INT,PS:(11,0),NULL,ANONYMOUS_VIEW1.a)], [column_conv(INT,PS:(11,0),NULL,ANONYMOUS_VIEW1.b)], [column_conv(INT,
      PS:(11,0),NULL,ANONYMOUS_VIEW1.c)])
  1 - output([ANONYMOUS_VIEW1.a], [ANONYMOUS_VIEW1.b], [ANONYMOUS_VIEW1.c]), filter(nil), rowset=16
      access([ANONYMOUS_VIEW1.a], [ANONYMOUS_VIEW1.b], [ANONYMOUS_VIEW1.c])
  2 - output([t1.a], [t1.b], [t1.c]), filter([t1.b > ANY(subquery(1))]), rowset=16
      exec_params_(nil), onetime_exprs_(nil), init_plan_idxs_([1]), use_batch=false
  3 - output([t1.a], [t1.b], [t1.c]), filter(nil), rowset=16
      access([t1.a], [t1.b], [t1.c]), partitions(p0)
      is_index_back=false, is_global_index=false, 
      range_key([t1.a]), range(MIN ; MAX)always true
  4 - output([VALUES_TABLE1.column_0]), filter(nil), rowset=16
      distinct([VALUES_TABLE1.column_0])
  5 - output([VALUES_TABLE1.column_0]), filter(nil)
      access([VALUES_TABLE1.column_0])
insert into is_c3 select /*+NO_REWRITE*/* from t1 where t1.b > any (select 1 union select 2);
select/**/ * from is_c3;
a	b	c
2	2	1
3	3	0
4	4	1
5	5	0
6	6	1
7	7	0
8	8	1
rollback;


# case 44
EXPLAIN select  * from t1 where t1.b > any (select 1 from t2);
Query Plan
============================================================
|ID|OPERATOR                   |NAME |EST.ROWS|EST.TIME(us)|
------------------------------------------------------------
|0 |NESTED-LOOP JOIN CARTESIAN |     |8       |6           |
|1 |├─TABLE FULL SCAN          |t1   |8       |3           |
|2 |└─MATERIAL                 |     |1       |3           |
|3 |  └─SUBPLAN SCAN           |VIEW1|1       |3           |
|4 |    └─TABLE FULL SCAN      |t2   |1       |3           |
============================================================
Outputs & filters:
-------------------------------------
  0 - output([t1.a], [t1.b], [t1.c]), filter(nil), rowset=16
      conds(nil), nl_params_(nil), use_batch=false
  1 - output([t1.a], [t1.b], [t1.c]), filter([t1.b > 1]), rowset=16
      access([t1.a], [t1.b], [t1.c]), partitions(p0)
      is_index_back=false, is_global_index=false, filter_before_indexback[false], 
      range_key([t1.a]), range(MIN ; MAX)always true
  2 - output(nil), filter(nil), rowset=16
  3 - output(nil), filter(nil), rowset=16
      access(nil)
  4 - output([1]), filter(nil), rowset=16
      access(nil), partitions(p0)
      limit(1), offset(nil), is_index_back=false, is_global_index=false, 
      range_key([t2.a]), range(MIN ; MAX)always true
select  * from t1 where t1.b > any (select 1 from t2);
a	b	c
2	2	1
3	3	0
4	4	1
5	5	0
6	6	1
7	7	0
8	8	1
EXPLAIN select /*+NO_REWRITE*/* from t1 where t1.b > any (select 1 from t2);
Query Plan
=================================================
|ID|OPERATOR         |NAME|EST.ROWS|EST.TIME(us)|
-------------------------------------------------
|0 |SUBPLAN FILTER   |    |4       |6           |
|1 |├─TABLE FULL SCAN|t1  |8       |3           |
|2 |└─TABLE FULL SCAN|t2  |8       |3           |
=================================================
Outputs & filters:
-------------------------------------
  0 - output([t1.a], [t1.b], [t1.c]), filter([t1.b > ANY(subquery(1))]), rowset=16
      exec_params_(nil), onetime_exprs_(nil), init_plan_idxs_([1]), use_batch=false
  1 - output([t1.a], [t1.b], [t1.c]), filter(nil), rowset=16
      access([t1.a], [t1.b], [t1.c]), partitions(p0)
      is_index_back=false, is_global_index=false, 
      range_key([t1.a]), range(MIN ; MAX)always true
  2 - output([1]), filter(nil), rowset=16
      access(nil), partitions(p0)
      is_index_back=false, is_global_index=false, 
      range_key([t2.a]), range(MIN ; MAX)always true
select /*+NO_REWRITE*/* from t1 where t1.b > any (select 1 from t2);
a	b	c
2	2	1
3	3	0
4	4	1
5	5	0
6	6	1
7	7	0
8	8	1
EXPLAIN update t1 set b = b + 1 where t1.b > any (select 1 from t2);
Query Plan
==============================================================
|ID|OPERATOR                     |NAME |EST.ROWS|EST.TIME(us)|
--------------------------------------------------------------
|0 |UPDATE                       |     |8       |90          |
|1 |└─NESTED-LOOP JOIN CARTESIAN |     |8       |6           |
|2 |  ├─TABLE FULL SCAN          |t1   |8       |3           |
|3 |  └─MATERIAL                 |     |1       |3           |
|4 |    └─SUBPLAN SCAN           |VIEW1|1       |3           |
|5 |      └─TABLE FULL SCAN      |t2   |1       |3           |
==============================================================
Outputs & filters:
-------------------------------------
  0 - output(nil), filter(nil)
      table_columns([{t1: ({t1: (t1.a, t1.b, t1.c)}), hash_distinct}]),
      update([t1.b=column_conv(INT,PS:(11,0),NULL,cast(t1.b + 1, INT(-1, 0)))])
  1 - output([t1.a], [t1.b], [t1.c]), filter(nil), rowset=16
      conds(nil), nl_params_(nil), use_batch=false
  2 - output([t1.a], [t1.b], [t1.c]), filter([t1.b > 1]), rowset=16
      access([t1.a], [t1.b], [t1.c]), partitions(p0)
      is_index_back=false, is_global_index=false, filter_before_indexback[false], 
      range_key([t1.a]), range(MIN ; MAX)always true
  3 - output(nil), filter(nil), rowset=16
  4 - output(nil), filter(nil), rowset=16
      access(nil)
  5 - output([1]), filter(nil), rowset=16
      access(nil), partitions(p0)
      limit(1), offset(nil), is_index_back=false, is_global_index=false, 
      range_key([t2.a]), range(MIN ; MAX)always true
update t1 set b = b + 1 where t1.b > any (select 1 from t2);
select/**/ * from t1;
a	b	c
1	1	0
2	3	1
3	4	0
4	5	1
5	6	0
6	7	1
7	8	0
8	9	1
rollback;
EXPLAIN update /*+NO_REWRITE*/t1 set b = b + 1 where t1.b > any (select 1 from t2);
Query Plan
===================================================
|ID|OPERATOR           |NAME|EST.ROWS|EST.TIME(us)|
---------------------------------------------------
|0 |UPDATE             |    |4       |60          |
|1 |└─SUBPLAN FILTER   |    |4       |6           |
|2 |  ├─TABLE FULL SCAN|t1  |8       |3           |
|3 |  └─TABLE FULL SCAN|t2  |8       |3           |
===================================================
Outputs & filters:
-------------------------------------
  0 - output(nil), filter(nil)
      table_columns([{t1: ({t1: (t1.a, t1.b, t1.c)})}]),
      update([t1.b=column_conv(INT,PS:(11,0),NULL,cast(t1.b + 1, INT(-1, 0)))])
  1 - output([t1.a], [t1.b], [t1.c]), filter([t1.b > ANY(subquery(1))]), rowset=16
      exec_params_(nil), onetime_exprs_(nil), init_plan_idxs_([1]), use_batch=false
  2 - output([t1.a], [t1.b], [t1.c]), filter(nil), rowset=16
      access([t1.a], [t1.b], [t1.c]), partitions(p0)
      is_index_back=false, is_global_index=false, 
      range_key([t1.a]), range(MIN ; MAX)always true
  3 - output([1]), filter(nil), rowset=16
      access(nil), partitions(p0)
      is_index_back=false, is_global_index=false, 
      range_key([t2.a]), range(MIN ; MAX)always true
update /*+NO_REWRITE*/t1 set b = b + 1 where t1.b > any (select 1 from t2);
select/**/ * from t1;
a	b	c
1	1	0
2	3	1
3	4	0
4	5	1
5	6	0
6	7	1
7	8	0
8	9	1
rollback;
EXPLAIN delete from t1 where t1.b > any (select 1 from t2);
Query Plan
==============================================================
|ID|OPERATOR                     |NAME |EST.ROWS|EST.TIME(us)|
--------------------------------------------------------------
|0 |DELETE                       |     |8       |53          |
|1 |└─NESTED-LOOP JOIN CARTESIAN |     |8       |6           |
|2 |  ├─TABLE FULL SCAN          |t1   |8       |3           |
|3 |  └─MATERIAL                 |     |1       |3           |
|4 |    └─SUBPLAN SCAN           |VIEW1|1       |3           |
|5 |      └─TABLE FULL SCAN      |t2   |1       |3           |
==============================================================
Outputs & filters:
-------------------------------------
  0 - output(nil), filter(nil)
      table_columns([{t1: ({t1: (t1.a, t1.b, t1.c)}), hash_distinct}])
  1 - output([t1.a], [t1.b], [t1.c]), filter(nil), rowset=16
      conds(nil), nl_params_(nil), use_batch=false
  2 - output([t1.a], [t1.b], [t1.c]), filter([t1.b > 1]), rowset=16
      access([t1.a], [t1.b], [t1.c]), partitions(p0)
      is_index_back=false, is_global_index=false, filter_before_indexback[false], 
      range_key([t1.a]), range(MIN ; MAX)always true
  3 - output(nil), filter(nil), rowset=16
  4 - output(nil), filter(nil), rowset=16
      access(nil)
  5 - output([1]), filter(nil), rowset=16
      access(nil), partitions(p0)
      limit(1), offset(nil), is_index_back=false, is_global_index=false, 
      range_key([t2.a]), range(MIN ; MAX)always true
delete from t1 where t1.b > any (select 1 from t2);
select/**/ * from t1;
a	b	c
1	1	0
rollback;
EXPLAIN delete /*+NO_REWRITE*/from t1 where t1.b > any (select 1 from t2);
Query Plan
===================================================
|ID|OPERATOR           |NAME|EST.ROWS|EST.TIME(us)|
---------------------------------------------------
|0 |DELETE             |    |4       |32          |
|1 |└─SUBPLAN FILTER   |    |4       |6           |
|2 |  ├─TABLE FULL SCAN|t1  |8       |3           |
|3 |  └─TABLE FULL SCAN|t2  |8       |3           |
===================================================
Outputs & filters:
-------------------------------------
  0 - output(nil), filter(nil)
      table_columns([{t1: ({t1: (t1.a, t1.b, t1.c)})}])
  1 - output([t1.a], [t1.b], [t1.c]), filter([t1.b > ANY(subquery(1))]), rowset=16
      exec_params_(nil), onetime_exprs_(nil), init_plan_idxs_([1]), use_batch=false
  2 - output([t1.a], [t1.b], [t1.c]), filter(nil), rowset=16
      access([t1.a], [t1.b], [t1.c]), partitions(p0)
      is_index_back=false, is_global_index=false, 
      range_key([t1.a]), range(MIN ; MAX)always true
  3 - output([1]), filter(nil), rowset=16
      access(nil), partitions(p0)
      is_index_back=false, is_global_index=false, 
      range_key([t2.a]), range(MIN ; MAX)always true
delete /*+NO_REWRITE*/from t1 where t1.b > any (select 1 from t2);
select/**/ * from t1;
a	b	c
1	1	0
rollback;
EXPLAIN insert into is_c3 select * from t1 where t1.b > any (select 1 from t2);
Query Plan
==========================================================================
|ID|OPERATOR                       |NAME           |EST.ROWS|EST.TIME(us)|
--------------------------------------------------------------------------
|0 |INSERT                         |               |8       |63          |
|1 |└─SUBPLAN SCAN                 |ANONYMOUS_VIEW1|8       |6           |
|2 |  └─NESTED-LOOP JOIN CARTESIAN |               |8       |6           |
|3 |    ├─TABLE FULL SCAN          |t1             |8       |3           |
|4 |    └─MATERIAL                 |               |1       |3           |
|5 |      └─SUBPLAN SCAN           |VIEW1          |1       |3           |
|6 |        └─TABLE FULL SCAN      |t2             |1       |3           |
==========================================================================
Outputs & filters:
-------------------------------------
  0 - output(nil), filter(nil)
      columns([{is_c3: ({is_c3: (is_c3.__pk_increment, is_c3.a, is_c3.b, is_c3.c)})}]), partitions(p0), 
      column_values([T_HIDDEN_PK], [column_conv(INT,PS:(11,0),NULL,ANONYMOUS_VIEW1.a)], [column_conv(INT,PS:(11,0),NULL,ANONYMOUS_VIEW1.b)], [column_conv(INT,
      PS:(11,0),NULL,ANONYMOUS_VIEW1.c)])
  1 - output([ANONYMOUS_VIEW1.a], [ANONYMOUS_VIEW1.b], [ANONYMOUS_VIEW1.c]), filter(nil), rowset=16
      access([ANONYMOUS_VIEW1.a], [ANONYMOUS_VIEW1.b], [ANONYMOUS_VIEW1.c])
  2 - output([t1.a], [t1.b], [t1.c]), filter(nil), rowset=16
      conds(nil), nl_params_(nil), use_batch=false
  3 - output([t1.a], [t1.b], [t1.c]), filter([t1.b > 1]), rowset=16
      access([t1.a], [t1.b], [t1.c]), partitions(p0)
      is_index_back=false, is_global_index=false, filter_before_indexback[false], 
      range_key([t1.a]), range(MIN ; MAX)always true
  4 - output(nil), filter(nil), rowset=16
  5 - output(nil), filter(nil), rowset=16
      access(nil)
  6 - output([1]), filter(nil), rowset=16
      access(nil), partitions(p0)
      limit(1), offset(nil), is_index_back=false, is_global_index=false, 
      range_key([t2.a]), range(MIN ; MAX)always true
insert into is_c3 select * from t1 where t1.b > any (select 1 from t2);
select/**/ * from is_c3;
a	b	c
2	2	1
3	3	0
4	4	1
5	5	0
6	6	1
7	7	0
8	8	1
rollback;
EXPLAIN insert into is_c3 select /*+NO_REWRITE*/* from t1 where t1.b > any (select 1 from t2);
Query Plan
================================================================
|ID|OPERATOR             |NAME           |EST.ROWS|EST.TIME(us)|
----------------------------------------------------------------
|0 |INSERT               |               |4       |37          |
|1 |└─SUBPLAN SCAN       |ANONYMOUS_VIEW1|4       |6           |
|2 |  └─SUBPLAN FILTER   |               |4       |6           |
|3 |    ├─TABLE FULL SCAN|t1             |8       |3           |
|4 |    └─TABLE FULL SCAN|t2             |8       |3           |
================================================================
Outputs & filters:
-------------------------------------
  0 - output(nil), filter(nil)
      columns([{is_c3: ({is_c3: (is_c3.__pk_increment, is_c3.a, is_c3.b, is_c3.c)})}]), partitions(p0), 
      column_values([T_HIDDEN_PK], [column_conv(INT,PS:(11,0),NULL,ANONYMOUS_VIEW1.a)], [column_conv(INT,PS:(11,0),NULL,ANONYMOUS_VIEW1.b)], [column_conv(INT,
      PS:(11,0),NULL,ANONYMOUS_VIEW1.c)])
  1 - output([ANONYMOUS_VIEW1.a], [ANONYMOUS_VIEW1.b], [ANONYMOUS_VIEW1.c]), filter(nil), rowset=16
      access([ANONYMOUS_VIEW1.a], [ANONYMOUS_VIEW1.b], [ANONYMOUS_VIEW1.c])
  2 - output([t1.a], [t1.b], [t1.c]), filter([t1.b > ANY(subquery(1))]), rowset=16
      exec_params_(nil), onetime_exprs_(nil), init_plan_idxs_([1]), use_batch=false
  3 - output([t1.a], [t1.b], [t1.c]), filter(nil), rowset=16
      access([t1.a], [t1.b], [t1.c]), partitions(p0)
      is_index_back=false, is_global_index=false, 
      range_key([t1.a]), range(MIN ; MAX)always true
  4 - output([1]), filter(nil), rowset=16
      access(nil), partitions(p0)
      is_index_back=false, is_global_index=false, 
      range_key([t2.a]), range(MIN ; MAX)always true
insert into is_c3 select /*+NO_REWRITE*/* from t1 where t1.b > any (select 1 from t2);
select/**/ * from is_c3;
a	b	c
2	2	1
3	3	0
4	4	1
5	5	0
6	6	1
7	7	0
8	8	1
rollback;


# case 45
## aggr 子查询，包含 any/all
EXPLAIN select * from t1 where t1.b > any (select max(1));
Query Plan
====================================================
|ID|OPERATOR           |NAME |EST.ROWS|EST.TIME(us)|
----------------------------------------------------
|0 |NESTED-LOOP JOIN   |     |1       |4           |
|1 |├─SUBPLAN SCAN     |VIEW1|1       |1           |
|2 |│ └─SCALAR GROUP BY|     |1       |1           |
|3 |│   └─EXPRESSION   |     |1       |1           |
|4 |└─TABLE FULL SCAN  |t1   |8       |3           |
====================================================
Outputs & filters:
-------------------------------------
  0 - output([t1.a], [t1.b], [t1.c]), filter(nil), rowset=16
      conds([t1.b > VIEW1.max(1)]), nl_params_(nil), use_batch=false
  1 - output([VIEW1.max(1)]), filter(nil), rowset=16
      access([VIEW1.max(1)])
  2 - output([T_FUN_MAX(1)]), filter(nil), rowset=16
      group(nil), agg_func([T_FUN_MAX(1)])
  3 - output([1]), filter(nil)
      values({1})
  4 - output([t1.a], [t1.b], [t1.c]), filter(nil), rowset=16
      access([t1.a], [t1.b], [t1.c]), partitions(p0)
      is_index_back=false, is_global_index=false, 
      range_key([t1.a]), range(MIN ; MAX)always true
select * from t1 where t1.b > any (select max(1));
a	b	c
2	2	1
3	3	0
4	4	1
5	5	0
6	6	1
7	7	0
8	8	1
EXPLAIN select /*+NO_REWRITE*/* from t1 where t1.b > any (select max(1));
Query Plan
=================================================
|ID|OPERATOR         |NAME|EST.ROWS|EST.TIME(us)|
-------------------------------------------------
|0 |SUBPLAN FILTER   |    |4       |3           |
|1 |├─TABLE FULL SCAN|t1  |8       |3           |
|2 |└─SCALAR GROUP BY|    |1       |1           |
|3 |  └─EXPRESSION   |    |1       |1           |
=================================================
Outputs & filters:
-------------------------------------
  0 - output([t1.a], [t1.b], [t1.c]), filter([t1.b > ANY(subquery(1))]), rowset=16
      exec_params_(nil), onetime_exprs_(nil), init_plan_idxs_([1]), use_batch=false
  1 - output([t1.a], [t1.b], [t1.c]), filter(nil), rowset=16
      access([t1.a], [t1.b], [t1.c]), partitions(p0)
      is_index_back=false, is_global_index=false, 
      range_key([t1.a]), range(MIN ; MAX)always true
  2 - output([T_FUN_MAX(1)]), filter(nil), rowset=16
      group(nil), agg_func([T_FUN_MAX(1)])
  3 - output([1]), filter(nil)
      values({1})
select /*+NO_REWRITE*/* from t1 where t1.b > any (select max(1));
a	b	c
2	2	1
3	3	0
4	4	1
5	5	0
6	6	1
7	7	0
8	8	1
EXPLAIN update t1 set b = b + 1 where t1.b > any (select max(1));
Query Plan
======================================================
|ID|OPERATOR             |NAME |EST.ROWS|EST.TIME(us)|
------------------------------------------------------
|0 |UPDATE               |     |1       |36          |
|1 |└─NESTED-LOOP JOIN   |     |1       |4           |
|2 |  ├─SUBPLAN SCAN     |VIEW1|1       |1           |
|3 |  │ └─SCALAR GROUP BY|     |1       |1           |
|4 |  │   └─EXPRESSION   |     |1       |1           |
|5 |  └─TABLE FULL SCAN  |t1   |8       |3           |
======================================================
Outputs & filters:
-------------------------------------
  0 - output(nil), filter(nil)
      table_columns([{t1: ({t1: (t1.a, t1.b, t1.c)}), hash_distinct}]),
      update([t1.b=column_conv(INT,PS:(11,0),NULL,cast(t1.b + 1, INT(-1, 0)))])
  1 - output([t1.a], [t1.b], [t1.c]), filter(nil), rowset=16
      conds([t1.b > VIEW1.max(1)]), nl_params_(nil), use_batch=false
  2 - output([VIEW1.max(1)]), filter(nil), rowset=16
      access([VIEW1.max(1)])
  3 - output([T_FUN_MAX(1)]), filter(nil), rowset=16
      group(nil), agg_func([T_FUN_MAX(1)])
  4 - output([1]), filter(nil)
      values({1})
  5 - output([t1.a], [t1.b], [t1.c]), filter(nil), rowset=16
      access([t1.a], [t1.b], [t1.c]), partitions(p0)
      is_index_back=false, is_global_index=false, 
      range_key([t1.a]), range(MIN ; MAX)always true
update t1 set b = b + 1 where t1.b > any (select max(1));
select/**/ * from t1;
a	b	c
1	1	0
2	3	1
3	4	0
4	5	1
5	6	0
6	7	1
7	8	0
8	9	1
rollback;
EXPLAIN update /*+NO_REWRITE*/t1 set b = b + 1 where t1.b > any (select max(1));
Query Plan
===================================================
|ID|OPERATOR           |NAME|EST.ROWS|EST.TIME(us)|
---------------------------------------------------
|0 |UPDATE             |    |4       |57          |
|1 |└─SUBPLAN FILTER   |    |4       |3           |
|2 |  ├─TABLE FULL SCAN|t1  |8       |3           |
|3 |  └─SCALAR GROUP BY|    |1       |1           |
|4 |    └─EXPRESSION   |    |1       |1           |
===================================================
Outputs & filters:
-------------------------------------
  0 - output(nil), filter(nil)
      table_columns([{t1: ({t1: (t1.a, t1.b, t1.c)})}]),
      update([t1.b=column_conv(INT,PS:(11,0),NULL,cast(t1.b + 1, INT(-1, 0)))])
  1 - output([t1.a], [t1.b], [t1.c]), filter([t1.b > ANY(subquery(1))]), rowset=16
      exec_params_(nil), onetime_exprs_(nil), init_plan_idxs_([1]), use_batch=false
  2 - output([t1.a], [t1.b], [t1.c]), filter(nil), rowset=16
      access([t1.a], [t1.b], [t1.c]), partitions(p0)
      is_index_back=false, is_global_index=false, 
      range_key([t1.a]), range(MIN ; MAX)always true
  3 - output([T_FUN_MAX(1)]), filter(nil), rowset=16
      group(nil), agg_func([T_FUN_MAX(1)])
  4 - output([1]), filter(nil)
      values({1})
update /*+NO_REWRITE*/t1 set b = b + 1 where t1.b > any (select max(1));
select/**/ * from t1;
a	b	c
1	1	0
2	3	1
3	4	0
4	5	1
5	6	0
6	7	1
7	8	0
8	9	1
rollback;
EXPLAIN delete from t1 where t1.b > any (select max(1));
Query Plan
======================================================
|ID|OPERATOR             |NAME |EST.ROWS|EST.TIME(us)|
------------------------------------------------------
|0 |DELETE               |     |1       |16          |
|1 |└─NESTED-LOOP JOIN   |     |1       |4           |
|2 |  ├─SUBPLAN SCAN     |VIEW1|1       |1           |
|3 |  │ └─SCALAR GROUP BY|     |1       |1           |
|4 |  │   └─EXPRESSION   |     |1       |1           |
|5 |  └─TABLE FULL SCAN  |t1   |8       |3           |
======================================================
Outputs & filters:
-------------------------------------
  0 - output(nil), filter(nil)
      table_columns([{t1: ({t1: (t1.a, t1.b, t1.c)}), hash_distinct}])
  1 - output([t1.a], [t1.b], [t1.c]), filter(nil), rowset=16
      conds([t1.b > VIEW1.max(1)]), nl_params_(nil), use_batch=false
  2 - output([VIEW1.max(1)]), filter(nil), rowset=16
      access([VIEW1.max(1)])
  3 - output([T_FUN_MAX(1)]), filter(nil), rowset=16
      group(nil), agg_func([T_FUN_MAX(1)])
  4 - output([1]), filter(nil)
      values({1})
  5 - output([t1.a], [t1.b], [t1.c]), filter(nil), rowset=16
      access([t1.a], [t1.b], [t1.c]), partitions(p0)
      is_index_back=false, is_global_index=false, 
      range_key([t1.a]), range(MIN ; MAX)always true
delete from t1 where t1.b > any (select max(1));
select/**/ * from t1;
a	b	c
1	1	0
rollback;
EXPLAIN delete /*+NO_REWRITE*/from t1 where t1.b > any (select max(1));
Query Plan
===================================================
|ID|OPERATOR           |NAME|EST.ROWS|EST.TIME(us)|
---------------------------------------------------
|0 |DELETE             |    |4       |30          |
|1 |└─SUBPLAN FILTER   |    |4       |3           |
|2 |  ├─TABLE FULL SCAN|t1  |8       |3           |
|3 |  └─SCALAR GROUP BY|    |1       |1           |
|4 |    └─EXPRESSION   |    |1       |1           |
===================================================
Outputs & filters:
-------------------------------------
  0 - output(nil), filter(nil)
      table_columns([{t1: ({t1: (t1.a, t1.b, t1.c)})}])
  1 - output([t1.a], [t1.b], [t1.c]), filter([t1.b > ANY(subquery(1))]), rowset=16
      exec_params_(nil), onetime_exprs_(nil), init_plan_idxs_([1]), use_batch=false
  2 - output([t1.a], [t1.b], [t1.c]), filter(nil), rowset=16
      access([t1.a], [t1.b], [t1.c]), partitions(p0)
      is_index_back=false, is_global_index=false, 
      range_key([t1.a]), range(MIN ; MAX)always true
  3 - output([T_FUN_MAX(1)]), filter(nil), rowset=16
      group(nil), agg_func([T_FUN_MAX(1)])
  4 - output([1]), filter(nil)
      values({1})
delete /*+NO_REWRITE*/from t1 where t1.b > any (select max(1));
select/**/ * from t1;
a	b	c
1	1	0
rollback;
EXPLAIN insert into is_c3 select * from t1 where t1.b > any (select max(1));
Query Plan
==================================================================
|ID|OPERATOR               |NAME           |EST.ROWS|EST.TIME(us)|
------------------------------------------------------------------
|0 |INSERT                 |               |1       |17          |
|1 |└─SUBPLAN SCAN         |ANONYMOUS_VIEW1|1       |4           |
|2 |  └─NESTED-LOOP JOIN   |               |1       |4           |
|3 |    ├─SUBPLAN SCAN     |VIEW1          |1       |1           |
|4 |    │ └─SCALAR GROUP BY|               |1       |1           |
|5 |    │   └─EXPRESSION   |               |1       |1           |
|6 |    └─TABLE FULL SCAN  |t1             |8       |3           |
==================================================================
Outputs & filters:
-------------------------------------
  0 - output(nil), filter(nil)
      columns([{is_c3: ({is_c3: (is_c3.__pk_increment, is_c3.a, is_c3.b, is_c3.c)})}]), partitions(p0), 
      column_values([T_HIDDEN_PK], [column_conv(INT,PS:(11,0),NULL,ANONYMOUS_VIEW1.a)], [column_conv(INT,PS:(11,0),NULL,ANONYMOUS_VIEW1.b)], [column_conv(INT,
      PS:(11,0),NULL,ANONYMOUS_VIEW1.c)])
  1 - output([ANONYMOUS_VIEW1.a], [ANONYMOUS_VIEW1.b], [ANONYMOUS_VIEW1.c]), filter(nil), rowset=16
      access([ANONYMOUS_VIEW1.a], [ANONYMOUS_VIEW1.b], [ANONYMOUS_VIEW1.c])
  2 - output([t1.a], [t1.b], [t1.c]), filter(nil), rowset=16
      conds([t1.b > VIEW1.max(1)]), nl_params_(nil), use_batch=false
  3 - output([VIEW1.max(1)]), filter(nil), rowset=16
      access([VIEW1.max(1)])
  4 - output([T_FUN_MAX(1)]), filter(nil), rowset=16
      group(nil), agg_func([T_FUN_MAX(1)])
  5 - output([1]), filter(nil)
      values({1})
  6 - output([t1.a], [t1.b], [t1.c]), filter(nil), rowset=16
      access([t1.a], [t1.b], [t1.c]), partitions(p0)
      is_index_back=false, is_global_index=false, 
      range_key([t1.a]), range(MIN ; MAX)always true
insert into is_c3 select * from t1 where t1.b > any (select max(1));
select/**/ * from is_c3;
a	b	c
2	2	1
3	3	0
4	4	1
5	5	0
6	6	1
7	7	0
8	8	1
rollback;
EXPLAIN insert into is_c3 select /*+NO_REWRITE*/* from t1 where t1.b > any (select max(1));
Query Plan
================================================================
|ID|OPERATOR             |NAME           |EST.ROWS|EST.TIME(us)|
----------------------------------------------------------------
|0 |INSERT               |               |4       |35          |
|1 |└─SUBPLAN SCAN       |ANONYMOUS_VIEW1|4       |3           |
|2 |  └─SUBPLAN FILTER   |               |4       |3           |
|3 |    ├─TABLE FULL SCAN|t1             |8       |3           |
|4 |    └─SCALAR GROUP BY|               |1       |1           |
|5 |      └─EXPRESSION   |               |1       |1           |
================================================================
Outputs & filters:
-------------------------------------
  0 - output(nil), filter(nil)
      columns([{is_c3: ({is_c3: (is_c3.__pk_increment, is_c3.a, is_c3.b, is_c3.c)})}]), partitions(p0), 
      column_values([T_HIDDEN_PK], [column_conv(INT,PS:(11,0),NULL,ANONYMOUS_VIEW1.a)], [column_conv(INT,PS:(11,0),NULL,ANONYMOUS_VIEW1.b)], [column_conv(INT,
      PS:(11,0),NULL,ANONYMOUS_VIEW1.c)])
  1 - output([ANONYMOUS_VIEW1.a], [ANONYMOUS_VIEW1.b], [ANONYMOUS_VIEW1.c]), filter(nil), rowset=16
      access([ANONYMOUS_VIEW1.a], [ANONYMOUS_VIEW1.b], [ANONYMOUS_VIEW1.c])
  2 - output([t1.a], [t1.b], [t1.c]), filter([t1.b > ANY(subquery(1))]), rowset=16
      exec_params_(nil), onetime_exprs_(nil), init_plan_idxs_([1]), use_batch=false
  3 - output([t1.a], [t1.b], [t1.c]), filter(nil), rowset=16
      access([t1.a], [t1.b], [t1.c]), partitions(p0)
      is_index_back=false, is_global_index=false, 
      range_key([t1.a]), range(MIN ; MAX)always true
  4 - output([T_FUN_MAX(1)]), filter(nil), rowset=16
      group(nil), agg_func([T_FUN_MAX(1)])
  5 - output([1]), filter(nil)
      values({1})
insert into is_c3 select /*+NO_REWRITE*/* from t1 where t1.b > any (select max(1));
select/**/ * from is_c3;
a	b	c
2	2	1
3	3	0
4	4	1
5	5	0
6	6	1
7	7	0
8	8	1
rollback;


# case 46
EXPLAIN select * from t1 where t1.b > all (select max(1));
Query Plan
====================================================
|ID|OPERATOR           |NAME |EST.ROWS|EST.TIME(us)|
----------------------------------------------------
|0 |NESTED-LOOP JOIN   |     |1       |4           |
|1 |├─SUBPLAN SCAN     |VIEW1|1       |1           |
|2 |│ └─SCALAR GROUP BY|     |1       |1           |
|3 |│   └─EXPRESSION   |     |1       |1           |
|4 |└─TABLE FULL SCAN  |t1   |8       |3           |
====================================================
Outputs & filters:
-------------------------------------
  0 - output([t1.a], [t1.b], [t1.c]), filter(nil), rowset=16
      conds([t1.b > VIEW1.max(1)]), nl_params_(nil), use_batch=false
  1 - output([VIEW1.max(1)]), filter(nil), rowset=16
      access([VIEW1.max(1)])
  2 - output([T_FUN_MAX(1)]), filter(nil), rowset=16
      group(nil), agg_func([T_FUN_MAX(1)])
  3 - output([1]), filter(nil)
      values({1})
  4 - output([t1.a], [t1.b], [t1.c]), filter(nil), rowset=16
      access([t1.a], [t1.b], [t1.c]), partitions(p0)
      is_index_back=false, is_global_index=false, 
      range_key([t1.a]), range(MIN ; MAX)always true
select * from t1 where t1.b > all (select max(1));
a	b	c
2	2	1
3	3	0
4	4	1
5	5	0
6	6	1
7	7	0
8	8	1
EXPLAIN select /*+NO_REWRITE*/* from t1 where t1.b > all (select max(1));
Query Plan
=================================================
|ID|OPERATOR         |NAME|EST.ROWS|EST.TIME(us)|
-------------------------------------------------
|0 |SUBPLAN FILTER   |    |4       |3           |
|1 |├─TABLE FULL SCAN|t1  |8       |3           |
|2 |└─SCALAR GROUP BY|    |1       |1           |
|3 |  └─EXPRESSION   |    |1       |1           |
=================================================
Outputs & filters:
-------------------------------------
  0 - output([t1.a], [t1.b], [t1.c]), filter([t1.b > ALL(subquery(1))]), rowset=16
      exec_params_(nil), onetime_exprs_(nil), init_plan_idxs_([1]), use_batch=false
  1 - output([t1.a], [t1.b], [t1.c]), filter(nil), rowset=16
      access([t1.a], [t1.b], [t1.c]), partitions(p0)
      is_index_back=false, is_global_index=false, 
      range_key([t1.a]), range(MIN ; MAX)always true
  2 - output([T_FUN_MAX(1)]), filter(nil), rowset=16
      group(nil), agg_func([T_FUN_MAX(1)])
  3 - output([1]), filter(nil)
      values({1})
select /*+NO_REWRITE*/* from t1 where t1.b > all (select max(1));
a	b	c
2	2	1
3	3	0
4	4	1
5	5	0
6	6	1
7	7	0
8	8	1
EXPLAIN update t1 set b = b + 1 where t1.b > all (select max(1));
Query Plan
======================================================
|ID|OPERATOR             |NAME |EST.ROWS|EST.TIME(us)|
------------------------------------------------------
|0 |UPDATE               |     |1       |36          |
|1 |└─NESTED-LOOP JOIN   |     |1       |4           |
|2 |  ├─SUBPLAN SCAN     |VIEW1|1       |1           |
|3 |  │ └─SCALAR GROUP BY|     |1       |1           |
|4 |  │   └─EXPRESSION   |     |1       |1           |
|5 |  └─TABLE FULL SCAN  |t1   |8       |3           |
======================================================
Outputs & filters:
-------------------------------------
  0 - output(nil), filter(nil)
      table_columns([{t1: ({t1: (t1.a, t1.b, t1.c)}), hash_distinct}]),
      update([t1.b=column_conv(INT,PS:(11,0),NULL,cast(t1.b + 1, INT(-1, 0)))])
  1 - output([t1.a], [t1.b], [t1.c]), filter(nil), rowset=16
      conds([t1.b > VIEW1.max(1)]), nl_params_(nil), use_batch=false
  2 - output([VIEW1.max(1)]), filter(nil), rowset=16
      access([VIEW1.max(1)])
  3 - output([T_FUN_MAX(1)]), filter(nil), rowset=16
      group(nil), agg_func([T_FUN_MAX(1)])
  4 - output([1]), filter(nil)
      values({1})
  5 - output([t1.a], [t1.b], [t1.c]), filter(nil), rowset=16
      access([t1.a], [t1.b], [t1.c]), partitions(p0)
      is_index_back=false, is_global_index=false, 
      range_key([t1.a]), range(MIN ; MAX)always true
update t1 set b = b + 1 where t1.b > all (select max(1));
select/**/ * from t1;
a	b	c
1	1	0
2	3	1
3	4	0
4	5	1
5	6	0
6	7	1
7	8	0
8	9	1
rollback;
EXPLAIN update /*+NO_REWRITE*/t1 set b = b + 1 where t1.b > all (select max(1));
Query Plan
===================================================
|ID|OPERATOR           |NAME|EST.ROWS|EST.TIME(us)|
---------------------------------------------------
|0 |UPDATE             |    |4       |57          |
|1 |└─SUBPLAN FILTER   |    |4       |3           |
|2 |  ├─TABLE FULL SCAN|t1  |8       |3           |
|3 |  └─SCALAR GROUP BY|    |1       |1           |
|4 |    └─EXPRESSION   |    |1       |1           |
===================================================
Outputs & filters:
-------------------------------------
  0 - output(nil), filter(nil)
      table_columns([{t1: ({t1: (t1.a, t1.b, t1.c)})}]),
      update([t1.b=column_conv(INT,PS:(11,0),NULL,cast(t1.b + 1, INT(-1, 0)))])
  1 - output([t1.a], [t1.b], [t1.c]), filter([t1.b > ALL(subquery(1))]), rowset=16
      exec_params_(nil), onetime_exprs_(nil), init_plan_idxs_([1]), use_batch=false
  2 - output([t1.a], [t1.b], [t1.c]), filter(nil), rowset=16
      access([t1.a], [t1.b], [t1.c]), partitions(p0)
      is_index_back=false, is_global_index=false, 
      range_key([t1.a]), range(MIN ; MAX)always true
  3 - output([T_FUN_MAX(1)]), filter(nil), rowset=16
      group(nil), agg_func([T_FUN_MAX(1)])
  4 - output([1]), filter(nil)
      values({1})
update /*+NO_REWRITE*/t1 set b = b + 1 where t1.b > all (select max(1));
select/**/ * from t1;
a	b	c
1	1	0
2	3	1
3	4	0
4	5	1
5	6	0
6	7	1
7	8	0
8	9	1
rollback;
EXPLAIN delete from t1 where t1.b > all (select max(1));
Query Plan
======================================================
|ID|OPERATOR             |NAME |EST.ROWS|EST.TIME(us)|
------------------------------------------------------
|0 |DELETE               |     |1       |16          |
|1 |└─NESTED-LOOP JOIN   |     |1       |4           |
|2 |  ├─SUBPLAN SCAN     |VIEW1|1       |1           |
|3 |  │ └─SCALAR GROUP BY|     |1       |1           |
|4 |  │   └─EXPRESSION   |     |1       |1           |
|5 |  └─TABLE FULL SCAN  |t1   |8       |3           |
======================================================
Outputs & filters:
-------------------------------------
  0 - output(nil), filter(nil)
      table_columns([{t1: ({t1: (t1.a, t1.b, t1.c)}), hash_distinct}])
  1 - output([t1.a], [t1.b], [t1.c]), filter(nil), rowset=16
      conds([t1.b > VIEW1.max(1)]), nl_params_(nil), use_batch=false
  2 - output([VIEW1.max(1)]), filter(nil), rowset=16
      access([VIEW1.max(1)])
  3 - output([T_FUN_MAX(1)]), filter(nil), rowset=16
      group(nil), agg_func([T_FUN_MAX(1)])
  4 - output([1]), filter(nil)
      values({1})
  5 - output([t1.a], [t1.b], [t1.c]), filter(nil), rowset=16
      access([t1.a], [t1.b], [t1.c]), partitions(p0)
      is_index_back=false, is_global_index=false, 
      range_key([t1.a]), range(MIN ; MAX)always true
delete from t1 where t1.b > all (select max(1));
select/**/ * from t1;
a	b	c
1	1	0
rollback;
EXPLAIN delete /*+NO_REWRITE*/from t1 where t1.b > all (select max(1));
Query Plan
===================================================
|ID|OPERATOR           |NAME|EST.ROWS|EST.TIME(us)|
---------------------------------------------------
|0 |DELETE             |    |4       |30          |
|1 |└─SUBPLAN FILTER   |    |4       |3           |
|2 |  ├─TABLE FULL SCAN|t1  |8       |3           |
|3 |  └─SCALAR GROUP BY|    |1       |1           |
|4 |    └─EXPRESSION   |    |1       |1           |
===================================================
Outputs & filters:
-------------------------------------
  0 - output(nil), filter(nil)
      table_columns([{t1: ({t1: (t1.a, t1.b, t1.c)})}])
  1 - output([t1.a], [t1.b], [t1.c]), filter([t1.b > ALL(subquery(1))]), rowset=16
      exec_params_(nil), onetime_exprs_(nil), init_plan_idxs_([1]), use_batch=false
  2 - output([t1.a], [t1.b], [t1.c]), filter(nil), rowset=16
      access([t1.a], [t1.b], [t1.c]), partitions(p0)
      is_index_back=false, is_global_index=false, 
      range_key([t1.a]), range(MIN ; MAX)always true
  3 - output([T_FUN_MAX(1)]), filter(nil), rowset=16
      group(nil), agg_func([T_FUN_MAX(1)])
  4 - output([1]), filter(nil)
      values({1})
delete /*+NO_REWRITE*/from t1 where t1.b > all (select max(1));
select/**/ * from t1;
a	b	c
1	1	0
rollback;
EXPLAIN insert into is_c3 select * from t1 where t1.b > all (select max(1));
Query Plan
==================================================================
|ID|OPERATOR               |NAME           |EST.ROWS|EST.TIME(us)|
------------------------------------------------------------------
|0 |INSERT                 |               |1       |17          |
|1 |└─SUBPLAN SCAN         |ANONYMOUS_VIEW1|1       |4           |
|2 |  └─NESTED-LOOP JOIN   |               |1       |4           |
|3 |    ├─SUBPLAN SCAN     |VIEW1          |1       |1           |
|4 |    │ └─SCALAR GROUP BY|               |1       |1           |
|5 |    │   └─EXPRESSION   |               |1       |1           |
|6 |    └─TABLE FULL SCAN  |t1             |8       |3           |
==================================================================
Outputs & filters:
-------------------------------------
  0 - output(nil), filter(nil)
      columns([{is_c3: ({is_c3: (is_c3.__pk_increment, is_c3.a, is_c3.b, is_c3.c)})}]), partitions(p0), 
      column_values([T_HIDDEN_PK], [column_conv(INT,PS:(11,0),NULL,ANONYMOUS_VIEW1.a)], [column_conv(INT,PS:(11,0),NULL,ANONYMOUS_VIEW1.b)], [column_conv(INT,
      PS:(11,0),NULL,ANONYMOUS_VIEW1.c)])
  1 - output([ANONYMOUS_VIEW1.a], [ANONYMOUS_VIEW1.b], [ANONYMOUS_VIEW1.c]), filter(nil), rowset=16
      access([ANONYMOUS_VIEW1.a], [ANONYMOUS_VIEW1.b], [ANONYMOUS_VIEW1.c])
  2 - output([t1.a], [t1.b], [t1.c]), filter(nil), rowset=16
      conds([t1.b > VIEW1.max(1)]), nl_params_(nil), use_batch=false
  3 - output([VIEW1.max(1)]), filter(nil), rowset=16
      access([VIEW1.max(1)])
  4 - output([T_FUN_MAX(1)]), filter(nil), rowset=16
      group(nil), agg_func([T_FUN_MAX(1)])
  5 - output([1]), filter(nil)
      values({1})
  6 - output([t1.a], [t1.b], [t1.c]), filter(nil), rowset=16
      access([t1.a], [t1.b], [t1.c]), partitions(p0)
      is_index_back=false, is_global_index=false, 
      range_key([t1.a]), range(MIN ; MAX)always true
insert into is_c3 select * from t1 where t1.b > all (select max(1));
select/**/ * from is_c3;
a	b	c
2	2	1
3	3	0
4	4	1
5	5	0
6	6	1
7	7	0
8	8	1
rollback;
EXPLAIN insert into is_c3 select /*+NO_REWRITE*/* from t1 where t1.b > all (select max(1));
Query Plan
================================================================
|ID|OPERATOR             |NAME           |EST.ROWS|EST.TIME(us)|
----------------------------------------------------------------
|0 |INSERT               |               |4       |35          |
|1 |└─SUBPLAN SCAN       |ANONYMOUS_VIEW1|4       |3           |
|2 |  └─SUBPLAN FILTER   |               |4       |3           |
|3 |    ├─TABLE FULL SCAN|t1             |8       |3           |
|4 |    └─SCALAR GROUP BY|               |1       |1           |
|5 |      └─EXPRESSION   |               |1       |1           |
================================================================
Outputs & filters:
-------------------------------------
  0 - output(nil), filter(nil)
      columns([{is_c3: ({is_c3: (is_c3.__pk_increment, is_c3.a, is_c3.b, is_c3.c)})}]), partitions(p0), 
      column_values([T_HIDDEN_PK], [column_conv(INT,PS:(11,0),NULL,ANONYMOUS_VIEW1.a)], [column_conv(INT,PS:(11,0),NULL,ANONYMOUS_VIEW1.b)], [column_conv(INT,
      PS:(11,0),NULL,ANONYMOUS_VIEW1.c)])
  1 - output([ANONYMOUS_VIEW1.a], [ANONYMOUS_VIEW1.b], [ANONYMOUS_VIEW1.c]), filter(nil), rowset=16
      access([ANONYMOUS_VIEW1.a], [ANONYMOUS_VIEW1.b], [ANONYMOUS_VIEW1.c])
  2 - output([t1.a], [t1.b], [t1.c]), filter([t1.b > ALL(subquery(1))]), rowset=16
      exec_params_(nil), onetime_exprs_(nil), init_plan_idxs_([1]), use_batch=false
  3 - output([t1.a], [t1.b], [t1.c]), filter(nil), rowset=16
      access([t1.a], [t1.b], [t1.c]), partitions(p0)
      is_index_back=false, is_global_index=false, 
      range_key([t1.a]), range(MIN ; MAX)always true
  4 - output([T_FUN_MAX(1)]), filter(nil), rowset=16
      group(nil), agg_func([T_FUN_MAX(1)])
  5 - output([1]), filter(nil)
      values({1})
insert into is_c3 select /*+NO_REWRITE*/* from t1 where t1.b > all (select max(1));
select/**/ * from is_c3;
a	b	c
2	2	1
3	3	0
4	4	1
5	5	0
6	6	1
7	7	0
8	8	1
rollback;


# case 47
EXPLAIN select * from t1 where t1.b > any (select count(*) from t2 where t2.a > 20);
Query Plan
=======================================================
|ID|OPERATOR              |NAME |EST.ROWS|EST.TIME(us)|
-------------------------------------------------------
|0 |NESTED-LOOP JOIN      |     |1       |6           |
|1 |├─SUBPLAN SCAN        |VIEW1|1       |3           |
|2 |│ └─SCALAR GROUP BY   |     |1       |3           |
|3 |│   └─TABLE RANGE SCAN|t2   |1       |3           |
|4 |└─TABLE FULL SCAN     |t1   |8       |3           |
=======================================================
Outputs & filters:
-------------------------------------
  0 - output([t1.a], [t1.b], [t1.c]), filter(nil), rowset=16
      conds([t1.b > VIEW1.count(*)]), nl_params_(nil), use_batch=false
  1 - output([VIEW1.count(*)]), filter(nil), rowset=16
      access([VIEW1.count(*)])
  2 - output([T_FUN_COUNT_SUM(T_FUN_COUNT(*))]), filter(nil), rowset=16
      group(nil), agg_func([T_FUN_COUNT_SUM(T_FUN_COUNT(*))])
  3 - output([T_FUN_COUNT(*)]), filter(nil), rowset=16
      access(nil), partitions(p0)
      is_index_back=false, is_global_index=false, 
      range_key([t2.a]), range(20 ; MAX), 
      range_cond([t2.a > 20]), 
      pushdown_aggregation([T_FUN_COUNT(*)])
  4 - output([t1.a], [t1.b], [t1.c]), filter(nil), rowset=16
      access([t1.a], [t1.b], [t1.c]), partitions(p0)
      is_index_back=false, is_global_index=false, 
      range_key([t1.a]), range(MIN ; MAX)always true
select * from t1 where t1.b > any (select count(*) from t2 where t2.a > 20);
a	b	c
1	1	0
2	2	1
3	3	0
4	4	1
5	5	0
6	6	1
7	7	0
8	8	1
EXPLAIN select /*+NO_REWRITE*/* from t1 where t1.b > any (select count(*) from t2 where t2.a > 20);
Query Plan
====================================================
|ID|OPERATOR            |NAME|EST.ROWS|EST.TIME(us)|
----------------------------------------------------
|0 |SUBPLAN FILTER      |    |4       |5           |
|1 |├─TABLE FULL SCAN   |t1  |8       |3           |
|2 |└─SCALAR GROUP BY   |    |1       |3           |
|3 |  └─TABLE RANGE SCAN|t2  |1       |3           |
====================================================
Outputs & filters:
-------------------------------------
  0 - output([t1.a], [t1.b], [t1.c]), filter([t1.b > ANY(subquery(1))]), rowset=16
      exec_params_(nil), onetime_exprs_(nil), init_plan_idxs_([1]), use_batch=false
  1 - output([t1.a], [t1.b], [t1.c]), filter(nil), rowset=16
      access([t1.a], [t1.b], [t1.c]), partitions(p0)
      is_index_back=false, is_global_index=false, 
      range_key([t1.a]), range(MIN ; MAX)always true
  2 - output([T_FUN_COUNT_SUM(T_FUN_COUNT(*))]), filter(nil), rowset=16
      group(nil), agg_func([T_FUN_COUNT_SUM(T_FUN_COUNT(*))])
  3 - output([T_FUN_COUNT(*)]), filter(nil), rowset=16
      access(nil), partitions(p0)
      is_index_back=false, is_global_index=false, 
      range_key([t2.a]), range(20 ; MAX), 
      range_cond([t2.a > 20]), 
      pushdown_aggregation([T_FUN_COUNT(*)])
select /*+NO_REWRITE*/* from t1 where t1.b > any (select count(*) from t2 where t2.a > 20);
a	b	c
1	1	0
2	2	1
3	3	0
4	4	1
5	5	0
6	6	1
7	7	0
8	8	1
EXPLAIN update t1 set b = b + 1 where t1.b > any (select count(*) from t2 where t2.a > 20);
Query Plan
=========================================================
|ID|OPERATOR                |NAME |EST.ROWS|EST.TIME(us)|
---------------------------------------------------------
|0 |UPDATE                  |     |1       |38          |
|1 |└─NESTED-LOOP JOIN      |     |1       |6           |
|2 |  ├─SUBPLAN SCAN        |VIEW1|1       |3           |
|3 |  │ └─SCALAR GROUP BY   |     |1       |3           |
|4 |  │   └─TABLE RANGE SCAN|t2   |1       |3           |
|5 |  └─TABLE FULL SCAN     |t1   |8       |3           |
=========================================================
Outputs & filters:
-------------------------------------
  0 - output(nil), filter(nil)
      table_columns([{t1: ({t1: (t1.a, t1.b, t1.c)}), hash_distinct}]),
      update([t1.b=column_conv(INT,PS:(11,0),NULL,cast(t1.b + 1, INT(-1, 0)))])
  1 - output([t1.a], [t1.b], [t1.c]), filter(nil), rowset=16
      conds([t1.b > VIEW1.count(*)]), nl_params_(nil), use_batch=false
  2 - output([VIEW1.count(*)]), filter(nil), rowset=16
      access([VIEW1.count(*)])
  3 - output([T_FUN_COUNT_SUM(T_FUN_COUNT(*))]), filter(nil), rowset=16
      group(nil), agg_func([T_FUN_COUNT_SUM(T_FUN_COUNT(*))])
  4 - output([T_FUN_COUNT(*)]), filter(nil), rowset=16
      access(nil), partitions(p0)
      is_index_back=false, is_global_index=false, 
      range_key([t2.a]), range(20 ; MAX), 
      range_cond([t2.a > 20]), 
      pushdown_aggregation([T_FUN_COUNT(*)])
  5 - output([t1.a], [t1.b], [t1.c]), filter(nil), rowset=16
      access([t1.a], [t1.b], [t1.c]), partitions(p0)
      is_index_back=false, is_global_index=false, 
      range_key([t1.a]), range(MIN ; MAX)always true
update t1 set b = b + 1 where t1.b > any (select count(*) from t2 where t2.a > 20);
select/**/ * from t1;
a	b	c
1	2	0
2	3	1
3	4	0
4	5	1
5	6	0
6	7	1
7	8	0
8	9	1
rollback;
EXPLAIN update /*+NO_REWRITE*/t1 set b = b + 1 where t1.b > any (select count(*) from t2 where t2.a > 20);
Query Plan
======================================================
|ID|OPERATOR              |NAME|EST.ROWS|EST.TIME(us)|
------------------------------------------------------
|0 |UPDATE                |    |4       |60          |
|1 |└─SUBPLAN FILTER      |    |4       |5           |
|2 |  ├─TABLE FULL SCAN   |t1  |8       |3           |
|3 |  └─SCALAR GROUP BY   |    |1       |3           |
|4 |    └─TABLE RANGE SCAN|t2  |1       |3           |
======================================================
Outputs & filters:
-------------------------------------
  0 - output(nil), filter(nil)
      table_columns([{t1: ({t1: (t1.a, t1.b, t1.c)})}]),
      update([t1.b=column_conv(INT,PS:(11,0),NULL,cast(t1.b + 1, INT(-1, 0)))])
  1 - output([t1.a], [t1.b], [t1.c]), filter([t1.b > ANY(subquery(1))]), rowset=16
      exec_params_(nil), onetime_exprs_(nil), init_plan_idxs_([1]), use_batch=false
  2 - output([t1.a], [t1.b], [t1.c]), filter(nil), rowset=16
      access([t1.a], [t1.b], [t1.c]), partitions(p0)
      is_index_back=false, is_global_index=false, 
      range_key([t1.a]), range(MIN ; MAX)always true
  3 - output([T_FUN_COUNT_SUM(T_FUN_COUNT(*))]), filter(nil), rowset=16
      group(nil), agg_func([T_FUN_COUNT_SUM(T_FUN_COUNT(*))])
  4 - output([T_FUN_COUNT(*)]), filter(nil), rowset=16
      access(nil), partitions(p0)
      is_index_back=false, is_global_index=false, 
      range_key([t2.a]), range(20 ; MAX), 
      range_cond([t2.a > 20]), 
      pushdown_aggregation([T_FUN_COUNT(*)])
update /*+NO_REWRITE*/t1 set b = b + 1 where t1.b > any (select count(*) from t2 where t2.a > 20);
select/**/ * from t1;
a	b	c
1	2	0
2	3	1
3	4	0
4	5	1
5	6	0
6	7	1
7	8	0
8	9	1
rollback;
EXPLAIN delete from t1 where t1.b > any (select count(*) from t2 where t2.a > 20);
Query Plan
=========================================================
|ID|OPERATOR                |NAME |EST.ROWS|EST.TIME(us)|
---------------------------------------------------------
|0 |DELETE                  |     |1       |18          |
|1 |└─NESTED-LOOP JOIN      |     |1       |6           |
|2 |  ├─SUBPLAN SCAN        |VIEW1|1       |3           |
|3 |  │ └─SCALAR GROUP BY   |     |1       |3           |
|4 |  │   └─TABLE RANGE SCAN|t2   |1       |3           |
|5 |  └─TABLE FULL SCAN     |t1   |8       |3           |
=========================================================
Outputs & filters:
-------------------------------------
  0 - output(nil), filter(nil)
      table_columns([{t1: ({t1: (t1.a, t1.b, t1.c)}), hash_distinct}])
  1 - output([t1.a], [t1.b], [t1.c]), filter(nil), rowset=16
      conds([t1.b > VIEW1.count(*)]), nl_params_(nil), use_batch=false
  2 - output([VIEW1.count(*)]), filter(nil), rowset=16
      access([VIEW1.count(*)])
  3 - output([T_FUN_COUNT_SUM(T_FUN_COUNT(*))]), filter(nil), rowset=16
      group(nil), agg_func([T_FUN_COUNT_SUM(T_FUN_COUNT(*))])
  4 - output([T_FUN_COUNT(*)]), filter(nil), rowset=16
      access(nil), partitions(p0)
      is_index_back=false, is_global_index=false, 
      range_key([t2.a]), range(20 ; MAX), 
      range_cond([t2.a > 20]), 
      pushdown_aggregation([T_FUN_COUNT(*)])
  5 - output([t1.a], [t1.b], [t1.c]), filter(nil), rowset=16
      access([t1.a], [t1.b], [t1.c]), partitions(p0)
      is_index_back=false, is_global_index=false, 
      range_key([t1.a]), range(MIN ; MAX)always true
delete from t1 where t1.b > any (select count(*) from t2 where t2.a > 20);
select/**/ * from t1;
a	b	c
rollback;
EXPLAIN delete /*+NO_REWRITE*/from t1 where t1.b > any (select count(*) from t2 where t2.a > 20);
Query Plan
======================================================
|ID|OPERATOR              |NAME|EST.ROWS|EST.TIME(us)|
------------------------------------------------------
|0 |DELETE                |    |4       |32          |
|1 |└─SUBPLAN FILTER      |    |4       |5           |
|2 |  ├─TABLE FULL SCAN   |t1  |8       |3           |
|3 |  └─SCALAR GROUP BY   |    |1       |3           |
|4 |    └─TABLE RANGE SCAN|t2  |1       |3           |
======================================================
Outputs & filters:
-------------------------------------
  0 - output(nil), filter(nil)
      table_columns([{t1: ({t1: (t1.a, t1.b, t1.c)})}])
  1 - output([t1.a], [t1.b], [t1.c]), filter([t1.b > ANY(subquery(1))]), rowset=16
      exec_params_(nil), onetime_exprs_(nil), init_plan_idxs_([1]), use_batch=false
  2 - output([t1.a], [t1.b], [t1.c]), filter(nil), rowset=16
      access([t1.a], [t1.b], [t1.c]), partitions(p0)
      is_index_back=false, is_global_index=false, 
      range_key([t1.a]), range(MIN ; MAX)always true
  3 - output([T_FUN_COUNT_SUM(T_FUN_COUNT(*))]), filter(nil), rowset=16
      group(nil), agg_func([T_FUN_COUNT_SUM(T_FUN_COUNT(*))])
  4 - output([T_FUN_COUNT(*)]), filter(nil), rowset=16
      access(nil), partitions(p0)
      is_index_back=false, is_global_index=false, 
      range_key([t2.a]), range(20 ; MAX), 
      range_cond([t2.a > 20]), 
      pushdown_aggregation([T_FUN_COUNT(*)])
delete /*+NO_REWRITE*/from t1 where t1.b > any (select count(*) from t2 where t2.a > 20);
select/**/ * from t1;
a	b	c
rollback;
EXPLAIN insert into is_c3 select * from t1 where t1.b > any (select count(*) from t2 where t2.a > 20);
Query Plan
=====================================================================
|ID|OPERATOR                  |NAME           |EST.ROWS|EST.TIME(us)|
---------------------------------------------------------------------
|0 |INSERT                    |               |1       |19          |
|1 |└─SUBPLAN SCAN            |ANONYMOUS_VIEW1|1       |6           |
|2 |  └─NESTED-LOOP JOIN      |               |1       |6           |
|3 |    ├─SUBPLAN SCAN        |VIEW1          |1       |3           |
|4 |    │ └─SCALAR GROUP BY   |               |1       |3           |
|5 |    │   └─TABLE RANGE SCAN|t2             |1       |3           |
|6 |    └─TABLE FULL SCAN     |t1             |8       |3           |
=====================================================================
Outputs & filters:
-------------------------------------
  0 - output(nil), filter(nil)
      columns([{is_c3: ({is_c3: (is_c3.__pk_increment, is_c3.a, is_c3.b, is_c3.c)})}]), partitions(p0), 
      column_values([T_HIDDEN_PK], [column_conv(INT,PS:(11,0),NULL,ANONYMOUS_VIEW1.a)], [column_conv(INT,PS:(11,0),NULL,ANONYMOUS_VIEW1.b)], [column_conv(INT,
      PS:(11,0),NULL,ANONYMOUS_VIEW1.c)])
  1 - output([ANONYMOUS_VIEW1.a], [ANONYMOUS_VIEW1.b], [ANONYMOUS_VIEW1.c]), filter(nil), rowset=16
      access([ANONYMOUS_VIEW1.a], [ANONYMOUS_VIEW1.b], [ANONYMOUS_VIEW1.c])
  2 - output([t1.a], [t1.b], [t1.c]), filter(nil), rowset=16
      conds([t1.b > VIEW1.count(*)]), nl_params_(nil), use_batch=false
  3 - output([VIEW1.count(*)]), filter(nil), rowset=16
      access([VIEW1.count(*)])
  4 - output([T_FUN_COUNT_SUM(T_FUN_COUNT(*))]), filter(nil), rowset=16
      group(nil), agg_func([T_FUN_COUNT_SUM(T_FUN_COUNT(*))])
  5 - output([T_FUN_COUNT(*)]), filter(nil), rowset=16
      access(nil), partitions(p0)
      is_index_back=false, is_global_index=false, 
      range_key([t2.a]), range(20 ; MAX), 
      range_cond([t2.a > 20]), 
      pushdown_aggregation([T_FUN_COUNT(*)])
  6 - output([t1.a], [t1.b], [t1.c]), filter(nil), rowset=16
      access([t1.a], [t1.b], [t1.c]), partitions(p0)
      is_index_back=false, is_global_index=false, 
      range_key([t1.a]), range(MIN ; MAX)always true
insert into is_c3 select * from t1 where t1.b > any (select count(*) from t2 where t2.a > 20);
select/**/ * from is_c3;
a	b	c
1	1	0
2	2	1
3	3	0
4	4	1
5	5	0
6	6	1
7	7	0
8	8	1
rollback;
EXPLAIN insert into is_c3 select /*+NO_REWRITE*/* from t1 where t1.b > any (select count(*) from t2 where t2.a > 20);
Query Plan
===================================================================
|ID|OPERATOR                |NAME           |EST.ROWS|EST.TIME(us)|
-------------------------------------------------------------------
|0 |INSERT                  |               |4       |37          |
|1 |└─SUBPLAN SCAN          |ANONYMOUS_VIEW1|4       |5           |
|2 |  └─SUBPLAN FILTER      |               |4       |5           |
|3 |    ├─TABLE FULL SCAN   |t1             |8       |3           |
|4 |    └─SCALAR GROUP BY   |               |1       |3           |
|5 |      └─TABLE RANGE SCAN|t2             |1       |3           |
===================================================================
Outputs & filters:
-------------------------------------
  0 - output(nil), filter(nil)
      columns([{is_c3: ({is_c3: (is_c3.__pk_increment, is_c3.a, is_c3.b, is_c3.c)})}]), partitions(p0), 
      column_values([T_HIDDEN_PK], [column_conv(INT,PS:(11,0),NULL,ANONYMOUS_VIEW1.a)], [column_conv(INT,PS:(11,0),NULL,ANONYMOUS_VIEW1.b)], [column_conv(INT,
      PS:(11,0),NULL,ANONYMOUS_VIEW1.c)])
  1 - output([ANONYMOUS_VIEW1.a], [ANONYMOUS_VIEW1.b], [ANONYMOUS_VIEW1.c]), filter(nil), rowset=16
      access([ANONYMOUS_VIEW1.a], [ANONYMOUS_VIEW1.b], [ANONYMOUS_VIEW1.c])
  2 - output([t1.a], [t1.b], [t1.c]), filter([t1.b > ANY(subquery(1))]), rowset=16
      exec_params_(nil), onetime_exprs_(nil), init_plan_idxs_([1]), use_batch=false
  3 - output([t1.a], [t1.b], [t1.c]), filter(nil), rowset=16
      access([t1.a], [t1.b], [t1.c]), partitions(p0)
      is_index_back=false, is_global_index=false, 
      range_key([t1.a]), range(MIN ; MAX)always true
  4 - output([T_FUN_COUNT_SUM(T_FUN_COUNT(*))]), filter(nil), rowset=16
      group(nil), agg_func([T_FUN_COUNT_SUM(T_FUN_COUNT(*))])
  5 - output([T_FUN_COUNT(*)]), filter(nil), rowset=16
      access(nil), partitions(p0)
      is_index_back=false, is_global_index=false, 
      range_key([t2.a]), range(20 ; MAX), 
      range_cond([t2.a > 20]), 
      pushdown_aggregation([T_FUN_COUNT(*)])
insert into is_c3 select /*+NO_REWRITE*/* from t1 where t1.b > any (select count(*) from t2 where t2.a > 20);
select/**/ * from is_c3;
a	b	c
1	1	0
2	2	1
3	3	0
4	4	1
5	5	0
6	6	1
7	7	0
8	8	1
rollback;


# case 48
EXPLAIN select * from t1 where t1.b > all (select count(*) from t2 where t2.a > 20);
Query Plan
=========================================================
|ID|OPERATOR                |NAME |EST.ROWS|EST.TIME(us)|
---------------------------------------------------------
|0 |NESTED-LOOP ANTI JOIN   |     |8       |6           |
|1 |├─TABLE FULL SCAN       |t1   |8       |3           |
|2 |└─MATERIAL              |     |1       |3           |
|3 |  └─SUBPLAN SCAN        |VIEW1|1       |3           |
|4 |    └─SCALAR GROUP BY   |     |1       |3           |
|5 |      └─TABLE RANGE SCAN|t2   |1       |3           |
=========================================================
Outputs & filters:
-------------------------------------
  0 - output([t1.a], [t1.b], [t1.c]), filter(nil), rowset=16
      conds([t1.b <= VIEW1.count(*) OR t1.b IS NULL]), nl_params_(nil), use_batch=false
  1 - output([t1.a], [t1.b], [t1.c]), filter(nil), rowset=16
      access([t1.a], [t1.b], [t1.c]), partitions(p0)
      is_index_back=false, is_global_index=false, 
      range_key([t1.a]), range(MIN ; MAX)always true
  2 - output([VIEW1.count(*)]), filter(nil), rowset=16
  3 - output([VIEW1.count(*)]), filter(nil), rowset=16
      access([VIEW1.count(*)])
  4 - output([T_FUN_COUNT_SUM(T_FUN_COUNT(*))]), filter(nil), rowset=16
      group(nil), agg_func([T_FUN_COUNT_SUM(T_FUN_COUNT(*))])
  5 - output([T_FUN_COUNT(*)]), filter(nil), rowset=16
      access(nil), partitions(p0)
      is_index_back=false, is_global_index=false, 
      range_key([t2.a]), range(20 ; MAX), 
      range_cond([t2.a > 20]), 
      pushdown_aggregation([T_FUN_COUNT(*)])
select * from t1 where t1.b > all (select count(*) from t2 where t2.a > 20);
a	b	c
1	1	0
2	2	1
3	3	0
4	4	1
5	5	0
6	6	1
7	7	0
8	8	1
EXPLAIN select /*+NO_REWRITE*/* from t1 where t1.b > all (select count(*) from t2 where t2.a > 20);
Query Plan
====================================================
|ID|OPERATOR            |NAME|EST.ROWS|EST.TIME(us)|
----------------------------------------------------
|0 |SUBPLAN FILTER      |    |4       |5           |
|1 |├─TABLE FULL SCAN   |t1  |8       |3           |
|2 |└─SCALAR GROUP BY   |    |1       |3           |
|3 |  └─TABLE RANGE SCAN|t2  |1       |3           |
====================================================
Outputs & filters:
-------------------------------------
  0 - output([t1.a], [t1.b], [t1.c]), filter([t1.b > ALL(subquery(1))]), rowset=16
      exec_params_(nil), onetime_exprs_(nil), init_plan_idxs_([1]), use_batch=false
  1 - output([t1.a], [t1.b], [t1.c]), filter(nil), rowset=16
      access([t1.a], [t1.b], [t1.c]), partitions(p0)
      is_index_back=false, is_global_index=false, 
      range_key([t1.a]), range(MIN ; MAX)always true
  2 - output([T_FUN_COUNT_SUM(T_FUN_COUNT(*))]), filter(nil), rowset=16
      group(nil), agg_func([T_FUN_COUNT_SUM(T_FUN_COUNT(*))])
  3 - output([T_FUN_COUNT(*)]), filter(nil), rowset=16
      access(nil), partitions(p0)
      is_index_back=false, is_global_index=false, 
      range_key([t2.a]), range(20 ; MAX), 
      range_cond([t2.a > 20]), 
      pushdown_aggregation([T_FUN_COUNT(*)])
select /*+NO_REWRITE*/* from t1 where t1.b > all (select count(*) from t2 where t2.a > 20);
a	b	c
1	1	0
2	2	1
3	3	0
4	4	1
5	5	0
6	6	1
7	7	0
8	8	1
EXPLAIN update t1 set b = b + 1 where t1.b > all (select count(*) from t2 where t2.a > 20);
Query Plan
===========================================================
|ID|OPERATOR                  |NAME |EST.ROWS|EST.TIME(us)|
-----------------------------------------------------------
|0 |UPDATE                    |     |8       |87          |
|1 |└─NESTED-LOOP ANTI JOIN   |     |8       |6           |
|2 |  ├─TABLE FULL SCAN       |t1   |8       |3           |
|3 |  └─MATERIAL              |     |1       |3           |
|4 |    └─SUBPLAN SCAN        |VIEW1|1       |3           |
|5 |      └─SCALAR GROUP BY   |     |1       |3           |
|6 |        └─TABLE RANGE SCAN|t2   |1       |3           |
===========================================================
Outputs & filters:
-------------------------------------
  0 - output(nil), filter(nil)
      table_columns([{t1: ({t1: (t1.a, t1.b, t1.c)})}]),
      update([t1.b=column_conv(INT,PS:(11,0),NULL,cast(t1.b + 1, INT(-1, 0)))])
  1 - output([t1.a], [t1.b], [t1.c]), filter(nil), rowset=16
      conds([t1.b <= VIEW1.count(*) OR t1.b IS NULL]), nl_params_(nil), use_batch=false
  2 - output([t1.a], [t1.b], [t1.c]), filter(nil), rowset=16
      access([t1.a], [t1.b], [t1.c]), partitions(p0)
      is_index_back=false, is_global_index=false, 
      range_key([t1.a]), range(MIN ; MAX)always true
  3 - output([VIEW1.count(*)]), filter(nil), rowset=16
  4 - output([VIEW1.count(*)]), filter(nil), rowset=16
      access([VIEW1.count(*)])
  5 - output([T_FUN_COUNT_SUM(T_FUN_COUNT(*))]), filter(nil), rowset=16
      group(nil), agg_func([T_FUN_COUNT_SUM(T_FUN_COUNT(*))])
  6 - output([T_FUN_COUNT(*)]), filter(nil), rowset=16
      access(nil), partitions(p0)
      is_index_back=false, is_global_index=false, 
      range_key([t2.a]), range(20 ; MAX), 
      range_cond([t2.a > 20]), 
      pushdown_aggregation([T_FUN_COUNT(*)])
update t1 set b = b + 1 where t1.b > all (select count(*) from t2 where t2.a > 20);
select/**/ * from t1;
a	b	c
1	2	0
2	3	1
3	4	0
4	5	1
5	6	0
6	7	1
7	8	0
8	9	1
rollback;
EXPLAIN update /*+NO_REWRITE*/t1 set b = b + 1 where t1.b > all (select count(*) from t2 where t2.a > 20);
Query Plan
======================================================
|ID|OPERATOR              |NAME|EST.ROWS|EST.TIME(us)|
------------------------------------------------------
|0 |UPDATE                |    |4       |60          |
|1 |└─SUBPLAN FILTER      |    |4       |5           |
|2 |  ├─TABLE FULL SCAN   |t1  |8       |3           |
|3 |  └─SCALAR GROUP BY   |    |1       |3           |
|4 |    └─TABLE RANGE SCAN|t2  |1       |3           |
======================================================
Outputs & filters:
-------------------------------------
  0 - output(nil), filter(nil)
      table_columns([{t1: ({t1: (t1.a, t1.b, t1.c)})}]),
      update([t1.b=column_conv(INT,PS:(11,0),NULL,cast(t1.b + 1, INT(-1, 0)))])
  1 - output([t1.a], [t1.b], [t1.c]), filter([t1.b > ALL(subquery(1))]), rowset=16
      exec_params_(nil), onetime_exprs_(nil), init_plan_idxs_([1]), use_batch=false
  2 - output([t1.a], [t1.b], [t1.c]), filter(nil), rowset=16
      access([t1.a], [t1.b], [t1.c]), partitions(p0)
      is_index_back=false, is_global_index=false, 
      range_key([t1.a]), range(MIN ; MAX)always true
  3 - output([T_FUN_COUNT_SUM(T_FUN_COUNT(*))]), filter(nil), rowset=16
      group(nil), agg_func([T_FUN_COUNT_SUM(T_FUN_COUNT(*))])
  4 - output([T_FUN_COUNT(*)]), filter(nil), rowset=16
      access(nil), partitions(p0)
      is_index_back=false, is_global_index=false, 
      range_key([t2.a]), range(20 ; MAX), 
      range_cond([t2.a > 20]), 
      pushdown_aggregation([T_FUN_COUNT(*)])
update /*+NO_REWRITE*/t1 set b = b + 1 where t1.b > all (select count(*) from t2 where t2.a > 20);
select/**/ * from t1;
a	b	c
1	2	0
2	3	1
3	4	0
4	5	1
5	6	0
6	7	1
7	8	0
8	9	1
rollback;
EXPLAIN delete from t1 where t1.b > all (select count(*) from t2 where t2.a > 20);
Query Plan
===========================================================
|ID|OPERATOR                  |NAME |EST.ROWS|EST.TIME(us)|
-----------------------------------------------------------
|0 |DELETE                    |     |8       |50          |
|1 |└─NESTED-LOOP ANTI JOIN   |     |8       |6           |
|2 |  ├─TABLE FULL SCAN       |t1   |8       |3           |
|3 |  └─MATERIAL              |     |1       |3           |
|4 |    └─SUBPLAN SCAN        |VIEW1|1       |3           |
|5 |      └─SCALAR GROUP BY   |     |1       |3           |
|6 |        └─TABLE RANGE SCAN|t2   |1       |3           |
===========================================================
Outputs & filters:
-------------------------------------
  0 - output(nil), filter(nil)
      table_columns([{t1: ({t1: (t1.a, t1.b, t1.c)})}])
  1 - output([t1.a], [t1.b], [t1.c]), filter(nil), rowset=16
      conds([t1.b <= VIEW1.count(*) OR t1.b IS NULL]), nl_params_(nil), use_batch=false
  2 - output([t1.a], [t1.b], [t1.c]), filter(nil), rowset=16
      access([t1.a], [t1.b], [t1.c]), partitions(p0)
      is_index_back=false, is_global_index=false, 
      range_key([t1.a]), range(MIN ; MAX)always true
  3 - output([VIEW1.count(*)]), filter(nil), rowset=16
  4 - output([VIEW1.count(*)]), filter(nil), rowset=16
      access([VIEW1.count(*)])
  5 - output([T_FUN_COUNT_SUM(T_FUN_COUNT(*))]), filter(nil), rowset=16
      group(nil), agg_func([T_FUN_COUNT_SUM(T_FUN_COUNT(*))])
  6 - output([T_FUN_COUNT(*)]), filter(nil), rowset=16
      access(nil), partitions(p0)
      is_index_back=false, is_global_index=false, 
      range_key([t2.a]), range(20 ; MAX), 
      range_cond([t2.a > 20]), 
      pushdown_aggregation([T_FUN_COUNT(*)])
delete from t1 where t1.b > all (select count(*) from t2 where t2.a > 20);
select/**/ * from t1;
a	b	c
rollback;
EXPLAIN delete /*+NO_REWRITE*/from t1 where t1.b > all (select count(*) from t2 where t2.a > 20);
Query Plan
======================================================
|ID|OPERATOR              |NAME|EST.ROWS|EST.TIME(us)|
------------------------------------------------------
|0 |DELETE                |    |4       |32          |
|1 |└─SUBPLAN FILTER      |    |4       |5           |
|2 |  ├─TABLE FULL SCAN   |t1  |8       |3           |
|3 |  └─SCALAR GROUP BY   |    |1       |3           |
|4 |    └─TABLE RANGE SCAN|t2  |1       |3           |
======================================================
Outputs & filters:
-------------------------------------
  0 - output(nil), filter(nil)
      table_columns([{t1: ({t1: (t1.a, t1.b, t1.c)})}])
  1 - output([t1.a], [t1.b], [t1.c]), filter([t1.b > ALL(subquery(1))]), rowset=16
      exec_params_(nil), onetime_exprs_(nil), init_plan_idxs_([1]), use_batch=false
  2 - output([t1.a], [t1.b], [t1.c]), filter(nil), rowset=16
      access([t1.a], [t1.b], [t1.c]), partitions(p0)
      is_index_back=false, is_global_index=false, 
      range_key([t1.a]), range(MIN ; MAX)always true
  3 - output([T_FUN_COUNT_SUM(T_FUN_COUNT(*))]), filter(nil), rowset=16
      group(nil), agg_func([T_FUN_COUNT_SUM(T_FUN_COUNT(*))])
  4 - output([T_FUN_COUNT(*)]), filter(nil), rowset=16
      access(nil), partitions(p0)
      is_index_back=false, is_global_index=false, 
      range_key([t2.a]), range(20 ; MAX), 
      range_cond([t2.a > 20]), 
      pushdown_aggregation([T_FUN_COUNT(*)])
delete /*+NO_REWRITE*/from t1 where t1.b > all (select count(*) from t2 where t2.a > 20);
select/**/ * from t1;
a	b	c
rollback;
EXPLAIN insert into is_c3 select * from t1 where t1.b > all (select count(*) from t2 where t2.a > 20);
Query Plan
=======================================================================
|ID|OPERATOR                    |NAME           |EST.ROWS|EST.TIME(us)|
-----------------------------------------------------------------------
|0 |INSERT                      |               |8       |60          |
|1 |└─SUBPLAN SCAN              |ANONYMOUS_VIEW1|8       |6           |
|2 |  └─NESTED-LOOP ANTI JOIN   |               |8       |6           |
|3 |    ├─TABLE FULL SCAN       |t1             |8       |3           |
|4 |    └─MATERIAL              |               |1       |3           |
|5 |      └─SUBPLAN SCAN        |VIEW1          |1       |3           |
|6 |        └─SCALAR GROUP BY   |               |1       |3           |
|7 |          └─TABLE RANGE SCAN|t2             |1       |3           |
=======================================================================
Outputs & filters:
-------------------------------------
  0 - output(nil), filter(nil)
      columns([{is_c3: ({is_c3: (is_c3.__pk_increment, is_c3.a, is_c3.b, is_c3.c)})}]), partitions(p0), 
      column_values([T_HIDDEN_PK], [column_conv(INT,PS:(11,0),NULL,ANONYMOUS_VIEW1.a)], [column_conv(INT,PS:(11,0),NULL,ANONYMOUS_VIEW1.b)], [column_conv(INT,
      PS:(11,0),NULL,ANONYMOUS_VIEW1.c)])
  1 - output([ANONYMOUS_VIEW1.a], [ANONYMOUS_VIEW1.b], [ANONYMOUS_VIEW1.c]), filter(nil), rowset=16
      access([ANONYMOUS_VIEW1.a], [ANONYMOUS_VIEW1.b], [ANONYMOUS_VIEW1.c])
  2 - output([t1.a], [t1.b], [t1.c]), filter(nil), rowset=16
      conds([t1.b <= VIEW1.count(*) OR t1.b IS NULL]), nl_params_(nil), use_batch=false
  3 - output([t1.a], [t1.b], [t1.c]), filter(nil), rowset=16
      access([t1.a], [t1.b], [t1.c]), partitions(p0)
      is_index_back=false, is_global_index=false, 
      range_key([t1.a]), range(MIN ; MAX)always true
  4 - output([VIEW1.count(*)]), filter(nil), rowset=16
  5 - output([VIEW1.count(*)]), filter(nil), rowset=16
      access([VIEW1.count(*)])
  6 - output([T_FUN_COUNT_SUM(T_FUN_COUNT(*))]), filter(nil), rowset=16
      group(nil), agg_func([T_FUN_COUNT_SUM(T_FUN_COUNT(*))])
  7 - output([T_FUN_COUNT(*)]), filter(nil), rowset=16
      access(nil), partitions(p0)
      is_index_back=false, is_global_index=false, 
      range_key([t2.a]), range(20 ; MAX), 
      range_cond([t2.a > 20]), 
      pushdown_aggregation([T_FUN_COUNT(*)])
insert into is_c3 select * from t1 where t1.b > all (select count(*) from t2 where t2.a > 20);
select/**/ * from is_c3;
a	b	c
1	1	0
2	2	1
3	3	0
4	4	1
5	5	0
6	6	1
7	7	0
8	8	1
rollback;
EXPLAIN insert into is_c3 select /*+NO_REWRITE*/* from t1 where t1.b > all (select count(*) from t2 where t2.a > 20);
Query Plan
===================================================================
|ID|OPERATOR                |NAME           |EST.ROWS|EST.TIME(us)|
-------------------------------------------------------------------
|0 |INSERT                  |               |4       |37          |
|1 |└─SUBPLAN SCAN          |ANONYMOUS_VIEW1|4       |5           |
|2 |  └─SUBPLAN FILTER      |               |4       |5           |
|3 |    ├─TABLE FULL SCAN   |t1             |8       |3           |
|4 |    └─SCALAR GROUP BY   |               |1       |3           |
|5 |      └─TABLE RANGE SCAN|t2             |1       |3           |
===================================================================
Outputs & filters:
-------------------------------------
  0 - output(nil), filter(nil)
      columns([{is_c3: ({is_c3: (is_c3.__pk_increment, is_c3.a, is_c3.b, is_c3.c)})}]), partitions(p0), 
      column_values([T_HIDDEN_PK], [column_conv(INT,PS:(11,0),NULL,ANONYMOUS_VIEW1.a)], [column_conv(INT,PS:(11,0),NULL,ANONYMOUS_VIEW1.b)], [column_conv(INT,
      PS:(11,0),NULL,ANONYMOUS_VIEW1.c)])
  1 - output([ANONYMOUS_VIEW1.a], [ANONYMOUS_VIEW1.b], [ANONYMOUS_VIEW1.c]), filter(nil), rowset=16
      access([ANONYMOUS_VIEW1.a], [ANONYMOUS_VIEW1.b], [ANONYMOUS_VIEW1.c])
  2 - output([t1.a], [t1.b], [t1.c]), filter([t1.b > ALL(subquery(1))]), rowset=16
      exec_params_(nil), onetime_exprs_(nil), init_plan_idxs_([1]), use_batch=false
  3 - output([t1.a], [t1.b], [t1.c]), filter(nil), rowset=16
      access([t1.a], [t1.b], [t1.c]), partitions(p0)
      is_index_back=false, is_global_index=false, 
      range_key([t1.a]), range(MIN ; MAX)always true
  4 - output([T_FUN_COUNT_SUM(T_FUN_COUNT(*))]), filter(nil), rowset=16
      group(nil), agg_func([T_FUN_COUNT_SUM(T_FUN_COUNT(*))])
  5 - output([T_FUN_COUNT(*)]), filter(nil), rowset=16
      access(nil), partitions(p0)
      is_index_back=false, is_global_index=false, 
      range_key([t2.a]), range(20 ; MAX), 
      range_cond([t2.a > 20]), 
      pushdown_aggregation([T_FUN_COUNT(*)])
insert into is_c3 select /*+NO_REWRITE*/* from t1 where t1.b > all (select count(*) from t2 where t2.a > 20);
select/**/ * from is_c3;
a	b	c
1	1	0
2	2	1
3	3	0
4	4	1
5	5	0
6	6	1
7	7	0
8	8	1
rollback;


# case 49
EXPLAIN select * from t1 where t1.b > any (select max(t2.a) from t2 where t2.a > 20);
Query Plan
===============================================================
|ID|OPERATOR                |NAME       |EST.ROWS|EST.TIME(us)|
---------------------------------------------------------------
|0 |NESTED-LOOP JOIN        |           |1       |6           |
|1 |├─SUBPLAN SCAN          |VIEW1      |1       |3           |
|2 |│ └─SCALAR GROUP BY     |           |1       |3           |
|3 |│   └─SUBPLAN SCAN      |VIEW2      |1       |3           |
|4 |│     └─TABLE RANGE SCAN|t2(Reverse)|1       |3           |
|5 |└─TABLE FULL SCAN       |t1         |8       |3           |
===============================================================
Outputs & filters:
-------------------------------------
  0 - output([t1.a], [t1.b], [t1.c]), filter(nil), rowset=16
      conds([t1.b > VIEW1.max(t2.a)]), nl_params_(nil), use_batch=false
  1 - output([VIEW1.max(t2.a)]), filter(nil), rowset=16
      access([VIEW1.max(t2.a)])
  2 - output([T_FUN_MAX(VIEW2.t2.a)]), filter(nil), rowset=16
      group(nil), agg_func([T_FUN_MAX(VIEW2.t2.a)])
  3 - output([VIEW2.t2.a]), filter(nil), rowset=16
      access([VIEW2.t2.a])
  4 - output([t2.a]), filter(nil), rowset=16
      access([t2.a]), partitions(p0)
      limit(1), offset(nil), is_index_back=false, is_global_index=false, 
      range_key([t2.a]), range(20 ; MAX), 
      range_cond([t2.a > 20])
  5 - output([t1.a], [t1.b], [t1.c]), filter(nil), rowset=16
      access([t1.a], [t1.b], [t1.c]), partitions(p0)
      is_index_back=false, is_global_index=false, 
      range_key([t1.a]), range(MIN ; MAX)always true
select * from t1 where t1.b > any (select max(t2.a) from t2 where t2.a > 20);
a	b	c
EXPLAIN select /*+NO_REWRITE*/* from t1 where t1.b > any (select max(t2.a) from t2 where t2.a > 20);
Query Plan
=============================================================
|ID|OPERATOR              |NAME       |EST.ROWS|EST.TIME(us)|
-------------------------------------------------------------
|0 |SUBPLAN FILTER        |           |4       |5           |
|1 |├─TABLE FULL SCAN     |t1         |8       |3           |
|2 |└─SCALAR GROUP BY     |           |1       |3           |
|3 |  └─SUBPLAN SCAN      |VIEW1      |1       |3           |
|4 |    └─TABLE RANGE SCAN|t2(Reverse)|1       |3           |
=============================================================
Outputs & filters:
-------------------------------------
  0 - output([t1.a], [t1.b], [t1.c]), filter([t1.b > ANY(subquery(1))]), rowset=16
      exec_params_(nil), onetime_exprs_(nil), init_plan_idxs_([1]), use_batch=false
  1 - output([t1.a], [t1.b], [t1.c]), filter(nil), rowset=16
      access([t1.a], [t1.b], [t1.c]), partitions(p0)
      is_index_back=false, is_global_index=false, 
      range_key([t1.a]), range(MIN ; MAX)always true
  2 - output([T_FUN_MAX(VIEW1.t2.a)]), filter(nil), rowset=16
      group(nil), agg_func([T_FUN_MAX(VIEW1.t2.a)])
  3 - output([VIEW1.t2.a]), filter(nil), rowset=16
      access([VIEW1.t2.a])
  4 - output([t2.a]), filter(nil), rowset=16
      access([t2.a]), partitions(p0)
      limit(1), offset(nil), is_index_back=false, is_global_index=false, 
      range_key([t2.a]), range(20 ; MAX), 
      range_cond([t2.a > 20])
select /*+NO_REWRITE*/* from t1 where t1.b > any (select max(t2.a) from t2 where t2.a > 20);
a	b	c
EXPLAIN update t1 set b = b + 1 where t1.b > any (select max(t2.a) from t2 where t2.a > 20);
Query Plan
=================================================================
|ID|OPERATOR                  |NAME       |EST.ROWS|EST.TIME(us)|
-----------------------------------------------------------------
|0 |UPDATE                    |           |1       |38          |
|1 |└─NESTED-LOOP JOIN        |           |1       |6           |
|2 |  ├─SUBPLAN SCAN          |VIEW1      |1       |3           |
|3 |  │ └─SCALAR GROUP BY     |           |1       |3           |
|4 |  │   └─SUBPLAN SCAN      |VIEW2      |1       |3           |
|5 |  │     └─TABLE RANGE SCAN|t2(Reverse)|1       |3           |
|6 |  └─TABLE FULL SCAN       |t1         |8       |3           |
=================================================================
Outputs & filters:
-------------------------------------
  0 - output(nil), filter(nil)
      table_columns([{t1: ({t1: (t1.a, t1.b, t1.c)}), hash_distinct}]),
      update([t1.b=column_conv(INT,PS:(11,0),NULL,cast(t1.b + 1, INT(-1, 0)))])
  1 - output([t1.a], [t1.b], [t1.c]), filter(nil), rowset=16
      conds([t1.b > VIEW1.max(t2.a)]), nl_params_(nil), use_batch=false
  2 - output([VIEW1.max(t2.a)]), filter(nil), rowset=16
      access([VIEW1.max(t2.a)])
  3 - output([T_FUN_MAX(VIEW2.t2.a)]), filter(nil), rowset=16
      group(nil), agg_func([T_FUN_MAX(VIEW2.t2.a)])
  4 - output([VIEW2.t2.a]), filter(nil), rowset=16
      access([VIEW2.t2.a])
  5 - output([t2.a]), filter(nil), rowset=16
      access([t2.a]), partitions(p0)
      limit(1), offset(nil), is_index_back=false, is_global_index=false, 
      range_key([t2.a]), range(20 ; MAX), 
      range_cond([t2.a > 20])
  6 - output([t1.a], [t1.b], [t1.c]), filter(nil), rowset=16
      access([t1.a], [t1.b], [t1.c]), partitions(p0)
      is_index_back=false, is_global_index=false, 
      range_key([t1.a]), range(MIN ; MAX)always true
update t1 set b = b + 1 where t1.b > any (select max(t2.a) from t2 where t2.a > 20);
select/**/ * from t1;
a	b	c
1	1	0
2	2	1
3	3	0
4	4	1
5	5	0
6	6	1
7	7	0
8	8	1
rollback;
EXPLAIN update /*+NO_REWRITE*/t1 set b = b + 1 where t1.b > any (select max(t2.a) from t2 where t2.a > 20);
Query Plan
===============================================================
|ID|OPERATOR                |NAME       |EST.ROWS|EST.TIME(us)|
---------------------------------------------------------------
|0 |UPDATE                  |           |4       |60          |
|1 |└─SUBPLAN FILTER        |           |4       |5           |
|2 |  ├─TABLE FULL SCAN     |t1         |8       |3           |
|3 |  └─SCALAR GROUP BY     |           |1       |3           |
|4 |    └─SUBPLAN SCAN      |VIEW1      |1       |3           |
|5 |      └─TABLE RANGE SCAN|t2(Reverse)|1       |3           |
===============================================================
Outputs & filters:
-------------------------------------
  0 - output(nil), filter(nil)
      table_columns([{t1: ({t1: (t1.a, t1.b, t1.c)})}]),
      update([t1.b=column_conv(INT,PS:(11,0),NULL,cast(t1.b + 1, INT(-1, 0)))])
  1 - output([t1.a], [t1.b], [t1.c]), filter([t1.b > ANY(subquery(1))]), rowset=16
      exec_params_(nil), onetime_exprs_(nil), init_plan_idxs_([1]), use_batch=false
  2 - output([t1.a], [t1.b], [t1.c]), filter(nil), rowset=16
      access([t1.a], [t1.b], [t1.c]), partitions(p0)
      is_index_back=false, is_global_index=false, 
      range_key([t1.a]), range(MIN ; MAX)always true
  3 - output([T_FUN_MAX(VIEW1.t2.a)]), filter(nil), rowset=16
      group(nil), agg_func([T_FUN_MAX(VIEW1.t2.a)])
  4 - output([VIEW1.t2.a]), filter(nil), rowset=16
      access([VIEW1.t2.a])
  5 - output([t2.a]), filter(nil), rowset=16
      access([t2.a]), partitions(p0)
      limit(1), offset(nil), is_index_back=false, is_global_index=false, 
      range_key([t2.a]), range(20 ; MAX), 
      range_cond([t2.a > 20])
update /*+NO_REWRITE*/t1 set b = b + 1 where t1.b > any (select max(t2.a) from t2 where t2.a > 20);
select/**/ * from t1;
a	b	c
1	1	0
2	2	1
3	3	0
4	4	1
5	5	0
6	6	1
7	7	0
8	8	1
rollback;
EXPLAIN delete from t1 where t1.b > any (select max(t2.a) from t2 where t2.a > 20);
Query Plan
=================================================================
|ID|OPERATOR                  |NAME       |EST.ROWS|EST.TIME(us)|
-----------------------------------------------------------------
|0 |DELETE                    |           |1       |18          |
|1 |└─NESTED-LOOP JOIN        |           |1       |6           |
|2 |  ├─SUBPLAN SCAN          |VIEW1      |1       |3           |
|3 |  │ └─SCALAR GROUP BY     |           |1       |3           |
|4 |  │   └─SUBPLAN SCAN      |VIEW2      |1       |3           |
|5 |  │     └─TABLE RANGE SCAN|t2(Reverse)|1       |3           |
|6 |  └─TABLE FULL SCAN       |t1         |8       |3           |
=================================================================
Outputs & filters:
-------------------------------------
  0 - output(nil), filter(nil)
      table_columns([{t1: ({t1: (t1.a, t1.b, t1.c)}), hash_distinct}])
  1 - output([t1.a], [t1.b], [t1.c]), filter(nil), rowset=16
      conds([t1.b > VIEW1.max(t2.a)]), nl_params_(nil), use_batch=false
  2 - output([VIEW1.max(t2.a)]), filter(nil), rowset=16
      access([VIEW1.max(t2.a)])
  3 - output([T_FUN_MAX(VIEW2.t2.a)]), filter(nil), rowset=16
      group(nil), agg_func([T_FUN_MAX(VIEW2.t2.a)])
  4 - output([VIEW2.t2.a]), filter(nil), rowset=16
      access([VIEW2.t2.a])
  5 - output([t2.a]), filter(nil), rowset=16
      access([t2.a]), partitions(p0)
      limit(1), offset(nil), is_index_back=false, is_global_index=false, 
      range_key([t2.a]), range(20 ; MAX), 
      range_cond([t2.a > 20])
  6 - output([t1.a], [t1.b], [t1.c]), filter(nil), rowset=16
      access([t1.a], [t1.b], [t1.c]), partitions(p0)
      is_index_back=false, is_global_index=false, 
      range_key([t1.a]), range(MIN ; MAX)always true
delete from t1 where t1.b > any (select max(t2.a) from t2 where t2.a > 20);
select/**/ * from t1;
a	b	c
1	1	0
2	2	1
3	3	0
4	4	1
5	5	0
6	6	1
7	7	0
8	8	1
rollback;
EXPLAIN delete /*+NO_REWRITE*/ from t1 where t1.b > any (select max(t2.a) from t2 where t2.a > 20);
Query Plan
===============================================================
|ID|OPERATOR                |NAME       |EST.ROWS|EST.TIME(us)|
---------------------------------------------------------------
|0 |DELETE                  |           |4       |32          |
|1 |└─SUBPLAN FILTER        |           |4       |5           |
|2 |  ├─TABLE FULL SCAN     |t1         |8       |3           |
|3 |  └─SCALAR GROUP BY     |           |1       |3           |
|4 |    └─SUBPLAN SCAN      |VIEW1      |1       |3           |
|5 |      └─TABLE RANGE SCAN|t2(Reverse)|1       |3           |
===============================================================
Outputs & filters:
-------------------------------------
  0 - output(nil), filter(nil)
      table_columns([{t1: ({t1: (t1.a, t1.b, t1.c)})}])
  1 - output([t1.a], [t1.b], [t1.c]), filter([t1.b > ANY(subquery(1))]), rowset=16
      exec_params_(nil), onetime_exprs_(nil), init_plan_idxs_([1]), use_batch=false
  2 - output([t1.a], [t1.b], [t1.c]), filter(nil), rowset=16
      access([t1.a], [t1.b], [t1.c]), partitions(p0)
      is_index_back=false, is_global_index=false, 
      range_key([t1.a]), range(MIN ; MAX)always true
  3 - output([T_FUN_MAX(VIEW1.t2.a)]), filter(nil), rowset=16
      group(nil), agg_func([T_FUN_MAX(VIEW1.t2.a)])
  4 - output([VIEW1.t2.a]), filter(nil), rowset=16
      access([VIEW1.t2.a])
  5 - output([t2.a]), filter(nil), rowset=16
      access([t2.a]), partitions(p0)
      limit(1), offset(nil), is_index_back=false, is_global_index=false, 
      range_key([t2.a]), range(20 ; MAX), 
      range_cond([t2.a > 20])
delete /*+NO_REWRITE*/ from t1 where t1.b > any (select max(t2.a) from t2 where t2.a > 20);
select/**/ * from t1;
a	b	c
1	1	0
2	2	1
3	3	0
4	4	1
5	5	0
6	6	1
7	7	0
8	8	1
rollback;
EXPLAIN insert into is_c3 select * from t1 where t1.b > any (select max(t2.a) from t2 where t2.a > 20);
Query Plan
=======================================================================
|ID|OPERATOR                    |NAME           |EST.ROWS|EST.TIME(us)|
-----------------------------------------------------------------------
|0 |INSERT                      |               |1       |19          |
|1 |└─SUBPLAN SCAN              |ANONYMOUS_VIEW1|1       |6           |
|2 |  └─NESTED-LOOP JOIN        |               |1       |6           |
|3 |    ├─SUBPLAN SCAN          |VIEW1          |1       |3           |
|4 |    │ └─SCALAR GROUP BY     |               |1       |3           |
|5 |    │   └─SUBPLAN SCAN      |VIEW2          |1       |3           |
|6 |    │     └─TABLE RANGE SCAN|t2(Reverse)    |1       |3           |
|7 |    └─TABLE FULL SCAN       |t1             |8       |3           |
=======================================================================
Outputs & filters:
-------------------------------------
  0 - output(nil), filter(nil)
      columns([{is_c3: ({is_c3: (is_c3.__pk_increment, is_c3.a, is_c3.b, is_c3.c)})}]), partitions(p0), 
      column_values([T_HIDDEN_PK], [column_conv(INT,PS:(11,0),NULL,ANONYMOUS_VIEW1.a)], [column_conv(INT,PS:(11,0),NULL,ANONYMOUS_VIEW1.b)], [column_conv(INT,
      PS:(11,0),NULL,ANONYMOUS_VIEW1.c)])
  1 - output([ANONYMOUS_VIEW1.a], [ANONYMOUS_VIEW1.b], [ANONYMOUS_VIEW1.c]), filter(nil), rowset=16
      access([ANONYMOUS_VIEW1.a], [ANONYMOUS_VIEW1.b], [ANONYMOUS_VIEW1.c])
  2 - output([t1.a], [t1.b], [t1.c]), filter(nil), rowset=16
      conds([t1.b > VIEW1.max(t2.a)]), nl_params_(nil), use_batch=false
  3 - output([VIEW1.max(t2.a)]), filter(nil), rowset=16
      access([VIEW1.max(t2.a)])
  4 - output([T_FUN_MAX(VIEW2.t2.a)]), filter(nil), rowset=16
      group(nil), agg_func([T_FUN_MAX(VIEW2.t2.a)])
  5 - output([VIEW2.t2.a]), filter(nil), rowset=16
      access([VIEW2.t2.a])
  6 - output([t2.a]), filter(nil), rowset=16
      access([t2.a]), partitions(p0)
      limit(1), offset(nil), is_index_back=false, is_global_index=false, 
      range_key([t2.a]), range(20 ; MAX), 
      range_cond([t2.a > 20])
  7 - output([t1.a], [t1.b], [t1.c]), filter(nil), rowset=16
      access([t1.a], [t1.b], [t1.c]), partitions(p0)
      is_index_back=false, is_global_index=false, 
      range_key([t1.a]), range(MIN ; MAX)always true
insert into is_c3 select * from t1 where t1.b > any (select max(t2.a) from t2 where t2.a > 20);
select/**/ * from is_c3;
a	b	c
rollback;
EXPLAIN insert into is_c3 select /*+NO_REWRITE*/* from t1 where t1.b > any (select max(t2.a) from t2 where t2.a > 20);
Query Plan
=====================================================================
|ID|OPERATOR                  |NAME           |EST.ROWS|EST.TIME(us)|
---------------------------------------------------------------------
|0 |INSERT                    |               |4       |37          |
|1 |└─SUBPLAN SCAN            |ANONYMOUS_VIEW1|4       |5           |
|2 |  └─SUBPLAN FILTER        |               |4       |5           |
|3 |    ├─TABLE FULL SCAN     |t1             |8       |3           |
|4 |    └─SCALAR GROUP BY     |               |1       |3           |
|5 |      └─SUBPLAN SCAN      |VIEW1          |1       |3           |
|6 |        └─TABLE RANGE SCAN|t2(Reverse)    |1       |3           |
=====================================================================
Outputs & filters:
-------------------------------------
  0 - output(nil), filter(nil)
      columns([{is_c3: ({is_c3: (is_c3.__pk_increment, is_c3.a, is_c3.b, is_c3.c)})}]), partitions(p0), 
      column_values([T_HIDDEN_PK], [column_conv(INT,PS:(11,0),NULL,ANONYMOUS_VIEW1.a)], [column_conv(INT,PS:(11,0),NULL,ANONYMOUS_VIEW1.b)], [column_conv(INT,
      PS:(11,0),NULL,ANONYMOUS_VIEW1.c)])
  1 - output([ANONYMOUS_VIEW1.a], [ANONYMOUS_VIEW1.b], [ANONYMOUS_VIEW1.c]), filter(nil), rowset=16
      access([ANONYMOUS_VIEW1.a], [ANONYMOUS_VIEW1.b], [ANONYMOUS_VIEW1.c])
  2 - output([t1.a], [t1.b], [t1.c]), filter([t1.b > ANY(subquery(1))]), rowset=16
      exec_params_(nil), onetime_exprs_(nil), init_plan_idxs_([1]), use_batch=false
  3 - output([t1.a], [t1.b], [t1.c]), filter(nil), rowset=16
      access([t1.a], [t1.b], [t1.c]), partitions(p0)
      is_index_back=false, is_global_index=false, 
      range_key([t1.a]), range(MIN ; MAX)always true
  4 - output([T_FUN_MAX(VIEW1.t2.a)]), filter(nil), rowset=16
      group(nil), agg_func([T_FUN_MAX(VIEW1.t2.a)])
  5 - output([VIEW1.t2.a]), filter(nil), rowset=16
      access([VIEW1.t2.a])
  6 - output([t2.a]), filter(nil), rowset=16
      access([t2.a]), partitions(p0)
      limit(1), offset(nil), is_index_back=false, is_global_index=false, 
      range_key([t2.a]), range(20 ; MAX), 
      range_cond([t2.a > 20])
insert into is_c3 select /*+NO_REWRITE*/* from t1 where t1.b > any (select max(t2.a) from t2 where t2.a > 20);
select/**/ * from is_c3;
a	b	c
rollback;


# case 50
EXPLAIN select * from t1 where t1.b > all (select max(t2.a) from t2 where t2.a > 20);
Query Plan
=================================================================
|ID|OPERATOR                  |NAME       |EST.ROWS|EST.TIME(us)|
-----------------------------------------------------------------
|0 |NESTED-LOOP ANTI JOIN     |           |8       |6           |
|1 |├─TABLE FULL SCAN         |t1         |8       |3           |
|2 |└─MATERIAL                |           |1       |3           |
|3 |  └─SUBPLAN SCAN          |VIEW1      |1       |3           |
|4 |    └─SCALAR GROUP BY     |           |1       |3           |
|5 |      └─SUBPLAN SCAN      |VIEW2      |1       |3           |
|6 |        └─TABLE RANGE SCAN|t2(Reverse)|1       |3           |
=================================================================
Outputs & filters:
-------------------------------------
  0 - output([t1.a], [t1.b], [t1.c]), filter(nil), rowset=16
      conds([(T_OP_OR, t1.b <= VIEW1.max(t2.a), t1.b IS NULL, VIEW1.max(t2.a) IS NULL)]), nl_params_(nil), use_batch=false
  1 - output([t1.a], [t1.b], [t1.c]), filter(nil), rowset=16
      access([t1.a], [t1.b], [t1.c]), partitions(p0)
      is_index_back=false, is_global_index=false, 
      range_key([t1.a]), range(MIN ; MAX)always true
  2 - output([VIEW1.max(t2.a)]), filter(nil), rowset=16
  3 - output([VIEW1.max(t2.a)]), filter(nil), rowset=16
      access([VIEW1.max(t2.a)])
  4 - output([T_FUN_MAX(VIEW2.t2.a)]), filter(nil), rowset=16
      group(nil), agg_func([T_FUN_MAX(VIEW2.t2.a)])
  5 - output([VIEW2.t2.a]), filter(nil), rowset=16
      access([VIEW2.t2.a])
  6 - output([t2.a]), filter(nil), rowset=16
      access([t2.a]), partitions(p0)
      limit(1), offset(nil), is_index_back=false, is_global_index=false, 
      range_key([t2.a]), range(20 ; MAX), 
      range_cond([t2.a > 20])
select * from t1 where t1.b > all (select max(t2.a) from t2 where t2.a > 20);
a	b	c
EXPLAIN select /*+NO_REWRITE*/* from t1 where t1.b > all (select max(t2.a) from t2 where t2.a > 20);
Query Plan
=============================================================
|ID|OPERATOR              |NAME       |EST.ROWS|EST.TIME(us)|
-------------------------------------------------------------
|0 |SUBPLAN FILTER        |           |4       |5           |
|1 |├─TABLE FULL SCAN     |t1         |8       |3           |
|2 |└─SCALAR GROUP BY     |           |1       |3           |
|3 |  └─SUBPLAN SCAN      |VIEW1      |1       |3           |
|4 |    └─TABLE RANGE SCAN|t2(Reverse)|1       |3           |
=============================================================
Outputs & filters:
-------------------------------------
  0 - output([t1.a], [t1.b], [t1.c]), filter([t1.b > ALL(subquery(1))]), rowset=16
      exec_params_(nil), onetime_exprs_(nil), init_plan_idxs_([1]), use_batch=false
  1 - output([t1.a], [t1.b], [t1.c]), filter(nil), rowset=16
      access([t1.a], [t1.b], [t1.c]), partitions(p0)
      is_index_back=false, is_global_index=false, 
      range_key([t1.a]), range(MIN ; MAX)always true
  2 - output([T_FUN_MAX(VIEW1.t2.a)]), filter(nil), rowset=16
      group(nil), agg_func([T_FUN_MAX(VIEW1.t2.a)])
  3 - output([VIEW1.t2.a]), filter(nil), rowset=16
      access([VIEW1.t2.a])
  4 - output([t2.a]), filter(nil), rowset=16
      access([t2.a]), partitions(p0)
      limit(1), offset(nil), is_index_back=false, is_global_index=false, 
      range_key([t2.a]), range(20 ; MAX), 
      range_cond([t2.a > 20])
select /*+NO_REWRITE*/* from t1 where t1.b > all (select max(t2.a) from t2 where t2.a > 20);
a	b	c
EXPLAIN update t1 set b = b + 1 where t1.b > all (select max(t2.a) from t2 where t2.a > 20);
Query Plan
===================================================================
|ID|OPERATOR                    |NAME       |EST.ROWS|EST.TIME(us)|
-------------------------------------------------------------------
|0 |UPDATE                      |           |8       |87          |
|1 |└─NESTED-LOOP ANTI JOIN     |           |8       |6           |
|2 |  ├─TABLE FULL SCAN         |t1         |8       |3           |
|3 |  └─MATERIAL                |           |1       |3           |
|4 |    └─SUBPLAN SCAN          |VIEW1      |1       |3           |
|5 |      └─SCALAR GROUP BY     |           |1       |3           |
|6 |        └─SUBPLAN SCAN      |VIEW2      |1       |3           |
|7 |          └─TABLE RANGE SCAN|t2(Reverse)|1       |3           |
===================================================================
Outputs & filters:
-------------------------------------
  0 - output(nil), filter(nil)
      table_columns([{t1: ({t1: (t1.a, t1.b, t1.c)})}]),
      update([t1.b=column_conv(INT,PS:(11,0),NULL,cast(t1.b + 1, INT(-1, 0)))])
  1 - output([t1.a], [t1.b], [t1.c]), filter(nil), rowset=16
      conds([(T_OP_OR, t1.b <= VIEW1.max(t2.a), t1.b IS NULL, VIEW1.max(t2.a) IS NULL)]), nl_params_(nil), use_batch=false
  2 - output([t1.a], [t1.b], [t1.c]), filter(nil), rowset=16
      access([t1.a], [t1.b], [t1.c]), partitions(p0)
      is_index_back=false, is_global_index=false, 
      range_key([t1.a]), range(MIN ; MAX)always true
  3 - output([VIEW1.max(t2.a)]), filter(nil), rowset=16
  4 - output([VIEW1.max(t2.a)]), filter(nil), rowset=16
      access([VIEW1.max(t2.a)])
  5 - output([T_FUN_MAX(VIEW2.t2.a)]), filter(nil), rowset=16
      group(nil), agg_func([T_FUN_MAX(VIEW2.t2.a)])
  6 - output([VIEW2.t2.a]), filter(nil), rowset=16
      access([VIEW2.t2.a])
  7 - output([t2.a]), filter(nil), rowset=16
      access([t2.a]), partitions(p0)
      limit(1), offset(nil), is_index_back=false, is_global_index=false, 
      range_key([t2.a]), range(20 ; MAX), 
      range_cond([t2.a > 20])
update t1 set b = b + 1 where t1.b > all (select max(t2.a) from t2 where t2.a > 20);
select/**/ * from t1;
a	b	c
1	1	0
2	2	1
3	3	0
4	4	1
5	5	0
6	6	1
7	7	0
8	8	1
rollback;
EXPLAIN update /*+NO_REWRITE*/t1 set b = b + 1 where t1.b > all (select max(t2.a) from t2 where t2.a > 20);
Query Plan
===============================================================
|ID|OPERATOR                |NAME       |EST.ROWS|EST.TIME(us)|
---------------------------------------------------------------
|0 |UPDATE                  |           |4       |60          |
|1 |└─SUBPLAN FILTER        |           |4       |5           |
|2 |  ├─TABLE FULL SCAN     |t1         |8       |3           |
|3 |  └─SCALAR GROUP BY     |           |1       |3           |
|4 |    └─SUBPLAN SCAN      |VIEW1      |1       |3           |
|5 |      └─TABLE RANGE SCAN|t2(Reverse)|1       |3           |
===============================================================
Outputs & filters:
-------------------------------------
  0 - output(nil), filter(nil)
      table_columns([{t1: ({t1: (t1.a, t1.b, t1.c)})}]),
      update([t1.b=column_conv(INT,PS:(11,0),NULL,cast(t1.b + 1, INT(-1, 0)))])
  1 - output([t1.a], [t1.b], [t1.c]), filter([t1.b > ALL(subquery(1))]), rowset=16
      exec_params_(nil), onetime_exprs_(nil), init_plan_idxs_([1]), use_batch=false
  2 - output([t1.a], [t1.b], [t1.c]), filter(nil), rowset=16
      access([t1.a], [t1.b], [t1.c]), partitions(p0)
      is_index_back=false, is_global_index=false, 
      range_key([t1.a]), range(MIN ; MAX)always true
  3 - output([T_FUN_MAX(VIEW1.t2.a)]), filter(nil), rowset=16
      group(nil), agg_func([T_FUN_MAX(VIEW1.t2.a)])
  4 - output([VIEW1.t2.a]), filter(nil), rowset=16
      access([VIEW1.t2.a])
  5 - output([t2.a]), filter(nil), rowset=16
      access([t2.a]), partitions(p0)
      limit(1), offset(nil), is_index_back=false, is_global_index=false, 
      range_key([t2.a]), range(20 ; MAX), 
      range_cond([t2.a > 20])
update /*+NO_REWRITE*/t1 set b = b + 1 where t1.b > all (select max(t2.a) from t2 where t2.a > 20);
select/**/ * from t1;
a	b	c
1	1	0
2	2	1
3	3	0
4	4	1
5	5	0
6	6	1
7	7	0
8	8	1
rollback;
EXPLAIN delete from t1 where t1.b > all (select max(t2.a) from t2 where t2.a > 20);
Query Plan
===================================================================
|ID|OPERATOR                    |NAME       |EST.ROWS|EST.TIME(us)|
-------------------------------------------------------------------
|0 |DELETE                      |           |8       |50          |
|1 |└─NESTED-LOOP ANTI JOIN     |           |8       |6           |
|2 |  ├─TABLE FULL SCAN         |t1         |8       |3           |
|3 |  └─MATERIAL                |           |1       |3           |
|4 |    └─SUBPLAN SCAN          |VIEW1      |1       |3           |
|5 |      └─SCALAR GROUP BY     |           |1       |3           |
|6 |        └─SUBPLAN SCAN      |VIEW2      |1       |3           |
|7 |          └─TABLE RANGE SCAN|t2(Reverse)|1       |3           |
===================================================================
Outputs & filters:
-------------------------------------
  0 - output(nil), filter(nil)
      table_columns([{t1: ({t1: (t1.a, t1.b, t1.c)})}])
  1 - output([t1.a], [t1.b], [t1.c]), filter(nil), rowset=16
      conds([(T_OP_OR, t1.b <= VIEW1.max(t2.a), t1.b IS NULL, VIEW1.max(t2.a) IS NULL)]), nl_params_(nil), use_batch=false
  2 - output([t1.a], [t1.b], [t1.c]), filter(nil), rowset=16
      access([t1.a], [t1.b], [t1.c]), partitions(p0)
      is_index_back=false, is_global_index=false, 
      range_key([t1.a]), range(MIN ; MAX)always true
  3 - output([VIEW1.max(t2.a)]), filter(nil), rowset=16
  4 - output([VIEW1.max(t2.a)]), filter(nil), rowset=16
      access([VIEW1.max(t2.a)])
  5 - output([T_FUN_MAX(VIEW2.t2.a)]), filter(nil), rowset=16
      group(nil), agg_func([T_FUN_MAX(VIEW2.t2.a)])
  6 - output([VIEW2.t2.a]), filter(nil), rowset=16
      access([VIEW2.t2.a])
  7 - output([t2.a]), filter(nil), rowset=16
      access([t2.a]), partitions(p0)
      limit(1), offset(nil), is_index_back=false, is_global_index=false, 
      range_key([t2.a]), range(20 ; MAX), 
      range_cond([t2.a > 20])
delete from t1 where t1.b > all (select max(t2.a) from t2 where t2.a > 20);
select/**/ * from t1;
a	b	c
1	1	0
2	2	1
3	3	0
4	4	1
5	5	0
6	6	1
7	7	0
8	8	1
rollback;
EXPLAIN delete /*+NO_REWRITE*/from t1 where t1.b > all (select max(t2.a) from t2 where t2.a > 20);
Query Plan
===============================================================
|ID|OPERATOR                |NAME       |EST.ROWS|EST.TIME(us)|
---------------------------------------------------------------
|0 |DELETE                  |           |4       |32          |
|1 |└─SUBPLAN FILTER        |           |4       |5           |
|2 |  ├─TABLE FULL SCAN     |t1         |8       |3           |
|3 |  └─SCALAR GROUP BY     |           |1       |3           |
|4 |    └─SUBPLAN SCAN      |VIEW1      |1       |3           |
|5 |      └─TABLE RANGE SCAN|t2(Reverse)|1       |3           |
===============================================================
Outputs & filters:
-------------------------------------
  0 - output(nil), filter(nil)
      table_columns([{t1: ({t1: (t1.a, t1.b, t1.c)})}])
  1 - output([t1.a], [t1.b], [t1.c]), filter([t1.b > ALL(subquery(1))]), rowset=16
      exec_params_(nil), onetime_exprs_(nil), init_plan_idxs_([1]), use_batch=false
  2 - output([t1.a], [t1.b], [t1.c]), filter(nil), rowset=16
      access([t1.a], [t1.b], [t1.c]), partitions(p0)
      is_index_back=false, is_global_index=false, 
      range_key([t1.a]), range(MIN ; MAX)always true
  3 - output([T_FUN_MAX(VIEW1.t2.a)]), filter(nil), rowset=16
      group(nil), agg_func([T_FUN_MAX(VIEW1.t2.a)])
  4 - output([VIEW1.t2.a]), filter(nil), rowset=16
      access([VIEW1.t2.a])
  5 - output([t2.a]), filter(nil), rowset=16
      access([t2.a]), partitions(p0)
      limit(1), offset(nil), is_index_back=false, is_global_index=false, 
      range_key([t2.a]), range(20 ; MAX), 
      range_cond([t2.a > 20])
delete /*+NO_REWRITE*/from t1 where t1.b > all (select max(t2.a) from t2 where t2.a > 20);
select/**/ * from t1;
a	b	c
1	1	0
2	2	1
3	3	0
4	4	1
5	5	0
6	6	1
7	7	0
8	8	1
rollback;
EXPLAIN insert into is_c3 select * from t1 where t1.b > all (select max(t2.a) from t2 where t2.a > 20);
Query Plan
=========================================================================
|ID|OPERATOR                      |NAME           |EST.ROWS|EST.TIME(us)|
-------------------------------------------------------------------------
|0 |INSERT                        |               |8       |60          |
|1 |└─SUBPLAN SCAN                |ANONYMOUS_VIEW1|8       |6           |
|2 |  └─NESTED-LOOP ANTI JOIN     |               |8       |6           |
|3 |    ├─TABLE FULL SCAN         |t1             |8       |3           |
|4 |    └─MATERIAL                |               |1       |3           |
|5 |      └─SUBPLAN SCAN          |VIEW1          |1       |3           |
|6 |        └─SCALAR GROUP BY     |               |1       |3           |
|7 |          └─SUBPLAN SCAN      |VIEW2          |1       |3           |
|8 |            └─TABLE RANGE SCAN|t2(Reverse)    |1       |3           |
=========================================================================
Outputs & filters:
-------------------------------------
  0 - output(nil), filter(nil)
      columns([{is_c3: ({is_c3: (is_c3.__pk_increment, is_c3.a, is_c3.b, is_c3.c)})}]), partitions(p0), 
      column_values([T_HIDDEN_PK], [column_conv(INT,PS:(11,0),NULL,ANONYMOUS_VIEW1.a)], [column_conv(INT,PS:(11,0),NULL,ANONYMOUS_VIEW1.b)], [column_conv(INT,
      PS:(11,0),NULL,ANONYMOUS_VIEW1.c)])
  1 - output([ANONYMOUS_VIEW1.a], [ANONYMOUS_VIEW1.b], [ANONYMOUS_VIEW1.c]), filter(nil), rowset=16
      access([ANONYMOUS_VIEW1.a], [ANONYMOUS_VIEW1.b], [ANONYMOUS_VIEW1.c])
  2 - output([t1.a], [t1.b], [t1.c]), filter(nil), rowset=16
      conds([(T_OP_OR, t1.b <= VIEW1.max(t2.a), t1.b IS NULL, VIEW1.max(t2.a) IS NULL)]), nl_params_(nil), use_batch=false
  3 - output([t1.a], [t1.b], [t1.c]), filter(nil), rowset=16
      access([t1.a], [t1.b], [t1.c]), partitions(p0)
      is_index_back=false, is_global_index=false, 
      range_key([t1.a]), range(MIN ; MAX)always true
  4 - output([VIEW1.max(t2.a)]), filter(nil), rowset=16
  5 - output([VIEW1.max(t2.a)]), filter(nil), rowset=16
      access([VIEW1.max(t2.a)])
  6 - output([T_FUN_MAX(VIEW2.t2.a)]), filter(nil), rowset=16
      group(nil), agg_func([T_FUN_MAX(VIEW2.t2.a)])
  7 - output([VIEW2.t2.a]), filter(nil), rowset=16
      access([VIEW2.t2.a])
  8 - output([t2.a]), filter(nil), rowset=16
      access([t2.a]), partitions(p0)
      limit(1), offset(nil), is_index_back=false, is_global_index=false, 
      range_key([t2.a]), range(20 ; MAX), 
      range_cond([t2.a > 20])
insert into is_c3 select * from t1 where t1.b > all (select max(t2.a) from t2 where t2.a > 20);
select/**/ * from is_c3;
a	b	c
rollback;
EXPLAIN insert into is_c3 select /*+NO_REWRITE*/* from t1 where t1.b > all (select max(t2.a) from t2 where t2.a > 20);
Query Plan
=====================================================================
|ID|OPERATOR                  |NAME           |EST.ROWS|EST.TIME(us)|
---------------------------------------------------------------------
|0 |INSERT                    |               |4       |37          |
|1 |└─SUBPLAN SCAN            |ANONYMOUS_VIEW1|4       |5           |
|2 |  └─SUBPLAN FILTER        |               |4       |5           |
|3 |    ├─TABLE FULL SCAN     |t1             |8       |3           |
|4 |    └─SCALAR GROUP BY     |               |1       |3           |
|5 |      └─SUBPLAN SCAN      |VIEW1          |1       |3           |
|6 |        └─TABLE RANGE SCAN|t2(Reverse)    |1       |3           |
=====================================================================
Outputs & filters:
-------------------------------------
  0 - output(nil), filter(nil)
      columns([{is_c3: ({is_c3: (is_c3.__pk_increment, is_c3.a, is_c3.b, is_c3.c)})}]), partitions(p0), 
      column_values([T_HIDDEN_PK], [column_conv(INT,PS:(11,0),NULL,ANONYMOUS_VIEW1.a)], [column_conv(INT,PS:(11,0),NULL,ANONYMOUS_VIEW1.b)], [column_conv(INT,
      PS:(11,0),NULL,ANONYMOUS_VIEW1.c)])
  1 - output([ANONYMOUS_VIEW1.a], [ANONYMOUS_VIEW1.b], [ANONYMOUS_VIEW1.c]), filter(nil), rowset=16
      access([ANONYMOUS_VIEW1.a], [ANONYMOUS_VIEW1.b], [ANONYMOUS_VIEW1.c])
  2 - output([t1.a], [t1.b], [t1.c]), filter([t1.b > ALL(subquery(1))]), rowset=16
      exec_params_(nil), onetime_exprs_(nil), init_plan_idxs_([1]), use_batch=false
  3 - output([t1.a], [t1.b], [t1.c]), filter(nil), rowset=16
      access([t1.a], [t1.b], [t1.c]), partitions(p0)
      is_index_back=false, is_global_index=false, 
      range_key([t1.a]), range(MIN ; MAX)always true
  4 - output([T_FUN_MAX(VIEW1.t2.a)]), filter(nil), rowset=16
      group(nil), agg_func([T_FUN_MAX(VIEW1.t2.a)])
  5 - output([VIEW1.t2.a]), filter(nil), rowset=16
      access([VIEW1.t2.a])
  6 - output([t2.a]), filter(nil), rowset=16
      access([t2.a]), partitions(p0)
      limit(1), offset(nil), is_index_back=false, is_global_index=false, 
      range_key([t2.a]), range(20 ; MAX), 
      range_cond([t2.a > 20])
insert into is_c3 select /*+NO_REWRITE*/* from t1 where t1.b > all (select max(t2.a) from t2 where t2.a > 20);
select/**/ * from is_c3;
a	b	c
rollback;


# case 51
EXPLAIN select /*+NO_REWRITE*/ (t1.c > any (select count(*) from t2 where t2.a > 20)) from t1;
Query Plan
====================================================
|ID|OPERATOR            |NAME|EST.ROWS|EST.TIME(us)|
----------------------------------------------------
|0 |SUBPLAN FILTER      |    |8       |5           |
|1 |├─TABLE FULL SCAN   |t1  |8       |3           |
|2 |└─SCALAR GROUP BY   |    |1       |3           |
|3 |  └─TABLE RANGE SCAN|t2  |1       |3           |
====================================================
Outputs & filters:
-------------------------------------
  0 - output([t1.c > ANY(subquery(1))]), filter(nil), rowset=16
      exec_params_(nil), onetime_exprs_(nil), init_plan_idxs_([1]), use_batch=false
  1 - output([t1.c]), filter(nil), rowset=16
      access([t1.c]), partitions(p0)
      is_index_back=false, is_global_index=false, 
      range_key([t1.a]), range(MIN ; MAX)always true
  2 - output([T_FUN_COUNT_SUM(T_FUN_COUNT(*))]), filter(nil), rowset=16
      group(nil), agg_func([T_FUN_COUNT_SUM(T_FUN_COUNT(*))])
  3 - output([T_FUN_COUNT(*)]), filter(nil), rowset=16
      access(nil), partitions(p0)
      is_index_back=false, is_global_index=false, 
      range_key([t2.a]), range(20 ; MAX), 
      range_cond([t2.a > 20]), 
      pushdown_aggregation([T_FUN_COUNT(*)])
select /*+NO_REWRITE*/ (t1.c > any (select count(*) from t2 where t2.a > 20)) from t1;
(t1.c > any (select count(*) from t2 where t2.a > 20))
0
1
0
1
0
1
0
1
EXPLAIN select (t1.c > any (select count(*) from t2 where t2.a > 20)) from t1;
Query Plan
============================================================
|ID|OPERATOR                   |NAME |EST.ROWS|EST.TIME(us)|
------------------------------------------------------------
|0 |NESTED-LOOP JOIN CARTESIAN |     |8       |6           |
|1 |├─SUBPLAN SCAN             |VIEW1|1       |3           |
|2 |│ └─SCALAR GROUP BY        |     |1       |3           |
|3 |│   └─TABLE RANGE SCAN     |t2   |1       |3           |
|4 |└─TABLE FULL SCAN          |t1   |8       |3           |
============================================================
Outputs & filters:
-------------------------------------
  0 - output([t1.c > VIEW1.count(*)]), filter(nil), rowset=16
      conds(nil), nl_params_(nil), use_batch=false
  1 - output([VIEW1.count(*)]), filter(nil), rowset=16
      access([VIEW1.count(*)])
  2 - output([T_FUN_COUNT_SUM(T_FUN_COUNT(*))]), filter(nil), rowset=16
      group(nil), agg_func([T_FUN_COUNT_SUM(T_FUN_COUNT(*))])
  3 - output([T_FUN_COUNT(*)]), filter(nil), rowset=16
      access(nil), partitions(p0)
      is_index_back=false, is_global_index=false, 
      range_key([t2.a]), range(20 ; MAX), 
      range_cond([t2.a > 20]), 
      pushdown_aggregation([T_FUN_COUNT(*)])
  4 - output([t1.c]), filter(nil), rowset=16
      access([t1.c]), partitions(p0)
      is_index_back=false, is_global_index=false, 
      range_key([t1.a]), range(MIN ; MAX)always true
select (t1.c > any (select count(*) from t2 where t2.a > 20)) from t1;
(t1.c > any (select count(*) from t2 where t2.a > 20))
0
1
0
1
0
1
0
1


# case 52
EXPLAIN select /*+NO_REWRITE*/ (t1.c > all (select count(*) from t2 where t2.a > 20)) from t1;
Query Plan
====================================================
|ID|OPERATOR            |NAME|EST.ROWS|EST.TIME(us)|
----------------------------------------------------
|0 |SUBPLAN FILTER      |    |8       |5           |
|1 |├─TABLE FULL SCAN   |t1  |8       |3           |
|2 |└─SCALAR GROUP BY   |    |1       |3           |
|3 |  └─TABLE RANGE SCAN|t2  |1       |3           |
====================================================
Outputs & filters:
-------------------------------------
  0 - output([t1.c > ALL(subquery(1))]), filter(nil), rowset=16
      exec_params_(nil), onetime_exprs_(nil), init_plan_idxs_([1]), use_batch=false
  1 - output([t1.c]), filter(nil), rowset=16
      access([t1.c]), partitions(p0)
      is_index_back=false, is_global_index=false, 
      range_key([t1.a]), range(MIN ; MAX)always true
  2 - output([T_FUN_COUNT_SUM(T_FUN_COUNT(*))]), filter(nil), rowset=16
      group(nil), agg_func([T_FUN_COUNT_SUM(T_FUN_COUNT(*))])
  3 - output([T_FUN_COUNT(*)]), filter(nil), rowset=16
      access(nil), partitions(p0)
      is_index_back=false, is_global_index=false, 
      range_key([t2.a]), range(20 ; MAX), 
      range_cond([t2.a > 20]), 
      pushdown_aggregation([T_FUN_COUNT(*)])
select /*+NO_REWRITE*/ (t1.c > all (select count(*) from t2 where t2.a > 20)) from t1;
(t1.c > all (select count(*) from t2 where t2.a > 20))
0
1
0
1
0
1
0
1
EXPLAIN select (t1.c > all (select count(*) from t2 where t2.a > 20)) from t1;
Query Plan
============================================================
|ID|OPERATOR                   |NAME |EST.ROWS|EST.TIME(us)|
------------------------------------------------------------
|0 |NESTED-LOOP JOIN CARTESIAN |     |8       |6           |
|1 |├─SUBPLAN SCAN             |VIEW1|1       |3           |
|2 |│ └─SCALAR GROUP BY        |     |1       |3           |
|3 |│   └─TABLE RANGE SCAN     |t2   |1       |3           |
|4 |└─TABLE FULL SCAN          |t1   |8       |3           |
============================================================
Outputs & filters:
-------------------------------------
  0 - output([t1.c > VIEW1.count(*)]), filter(nil), rowset=16
      conds(nil), nl_params_(nil), use_batch=false
  1 - output([VIEW1.count(*)]), filter(nil), rowset=16
      access([VIEW1.count(*)])
  2 - output([T_FUN_COUNT_SUM(T_FUN_COUNT(*))]), filter(nil), rowset=16
      group(nil), agg_func([T_FUN_COUNT_SUM(T_FUN_COUNT(*))])
  3 - output([T_FUN_COUNT(*)]), filter(nil), rowset=16
      access(nil), partitions(p0)
      is_index_back=false, is_global_index=false, 
      range_key([t2.a]), range(20 ; MAX), 
      range_cond([t2.a > 20]), 
      pushdown_aggregation([T_FUN_COUNT(*)])
  4 - output([t1.c]), filter(nil), rowset=16
      access([t1.c]), partitions(p0)
      is_index_back=false, is_global_index=false, 
      range_key([t1.a]), range(MIN ; MAX)always true
select (t1.c > all (select count(*) from t2 where t2.a > 20)) from t1;
(t1.c > all (select count(*) from t2 where t2.a > 20))
0
1
0
1
0
1
0
1


# case 53
EXPLAIN select /*+NO_REWRITE*/ (t1.c > any (select max(t2.c) from t2 where t2.a > 20)) from t1;
Query Plan
====================================================
|ID|OPERATOR            |NAME|EST.ROWS|EST.TIME(us)|
----------------------------------------------------
|0 |SUBPLAN FILTER      |    |8       |5           |
|1 |├─TABLE FULL SCAN   |t1  |8       |3           |
|2 |└─SCALAR GROUP BY   |    |1       |3           |
|3 |  └─TABLE RANGE SCAN|t2  |1       |3           |
====================================================
Outputs & filters:
-------------------------------------
  0 - output([t1.c > ANY(subquery(1))]), filter(nil), rowset=16
      exec_params_(nil), onetime_exprs_(nil), init_plan_idxs_([1]), use_batch=false
  1 - output([t1.c]), filter(nil), rowset=16
      access([t1.c]), partitions(p0)
      is_index_back=false, is_global_index=false, 
      range_key([t1.a]), range(MIN ; MAX)always true
  2 - output([T_FUN_MAX(T_FUN_MAX(t2.c))]), filter(nil), rowset=16
      group(nil), agg_func([T_FUN_MAX(T_FUN_MAX(t2.c))])
  3 - output([T_FUN_MAX(t2.c)]), filter(nil), rowset=16
      access([t2.c]), partitions(p0)
      is_index_back=false, is_global_index=false, 
      range_key([t2.a]), range(20 ; MAX), 
      range_cond([t2.a > 20]), 
      pushdown_aggregation([T_FUN_MAX(t2.c)])
select /*+NO_REWRITE*/ (t1.c > any (select max(t2.c) from t2 where t2.a > 20)) from t1;
(t1.c > any (select max(t2.c) from t2 where t2.a > 20))
NULL
NULL
NULL
NULL
NULL
NULL
NULL
NULL
EXPLAIN select (t1.c > any (select max(t2.c) from t2 where t2.a > 20)) from t1;
Query Plan
============================================================
|ID|OPERATOR                   |NAME |EST.ROWS|EST.TIME(us)|
------------------------------------------------------------
|0 |NESTED-LOOP JOIN CARTESIAN |     |8       |6           |
|1 |├─SUBPLAN SCAN             |VIEW1|1       |3           |
|2 |│ └─SCALAR GROUP BY        |     |1       |3           |
|3 |│   └─TABLE RANGE SCAN     |t2   |1       |3           |
|4 |└─TABLE FULL SCAN          |t1   |8       |3           |
============================================================
Outputs & filters:
-------------------------------------
  0 - output([t1.c > VIEW1.max(t2.c)]), filter(nil), rowset=16
      conds(nil), nl_params_(nil), use_batch=false
  1 - output([VIEW1.max(t2.c)]), filter(nil), rowset=16
      access([VIEW1.max(t2.c)])
  2 - output([T_FUN_MAX(T_FUN_MAX(t2.c))]), filter(nil), rowset=16
      group(nil), agg_func([T_FUN_MAX(T_FUN_MAX(t2.c))])
  3 - output([T_FUN_MAX(t2.c)]), filter(nil), rowset=16
      access([t2.c]), partitions(p0)
      is_index_back=false, is_global_index=false, 
      range_key([t2.a]), range(20 ; MAX), 
      range_cond([t2.a > 20]), 
      pushdown_aggregation([T_FUN_MAX(t2.c)])
  4 - output([t1.c]), filter(nil), rowset=16
      access([t1.c]), partitions(p0)
      is_index_back=false, is_global_index=false, 
      range_key([t1.a]), range(MIN ; MAX)always true
select (t1.c > any (select max(t2.c) from t2 where t2.a > 20)) from t1;
(t1.c > any (select max(t2.c) from t2 where t2.a > 20))
NULL
NULL
NULL
NULL
NULL
NULL
NULL
NULL


# case 54
EXPLAIN select /*+NO_REWRITE*/ (t1.c > all (select max(t2.c) from t2 where t2.a > 20)) from t1;
Query Plan
====================================================
|ID|OPERATOR            |NAME|EST.ROWS|EST.TIME(us)|
----------------------------------------------------
|0 |SUBPLAN FILTER      |    |8       |5           |
|1 |├─TABLE FULL SCAN   |t1  |8       |3           |
|2 |└─SCALAR GROUP BY   |    |1       |3           |
|3 |  └─TABLE RANGE SCAN|t2  |1       |3           |
====================================================
Outputs & filters:
-------------------------------------
  0 - output([t1.c > ALL(subquery(1))]), filter(nil), rowset=16
      exec_params_(nil), onetime_exprs_(nil), init_plan_idxs_([1]), use_batch=false
  1 - output([t1.c]), filter(nil), rowset=16
      access([t1.c]), partitions(p0)
      is_index_back=false, is_global_index=false, 
      range_key([t1.a]), range(MIN ; MAX)always true
  2 - output([T_FUN_MAX(T_FUN_MAX(t2.c))]), filter(nil), rowset=16
      group(nil), agg_func([T_FUN_MAX(T_FUN_MAX(t2.c))])
  3 - output([T_FUN_MAX(t2.c)]), filter(nil), rowset=16
      access([t2.c]), partitions(p0)
      is_index_back=false, is_global_index=false, 
      range_key([t2.a]), range(20 ; MAX), 
      range_cond([t2.a > 20]), 
      pushdown_aggregation([T_FUN_MAX(t2.c)])
select /*+NO_REWRITE*/ (t1.c > all (select max(t2.c) from t2 where t2.a > 20)) from t1;
(t1.c > all (select max(t2.c) from t2 where t2.a > 20))
NULL
NULL
NULL
NULL
NULL
NULL
NULL
NULL
EXPLAIN select (t1.c > all (select max(t2.c) from t2 where t2.a > 20)) from t1;
Query Plan
============================================================
|ID|OPERATOR                   |NAME |EST.ROWS|EST.TIME(us)|
------------------------------------------------------------
|0 |NESTED-LOOP JOIN CARTESIAN |     |8       |6           |
|1 |├─SUBPLAN SCAN             |VIEW1|1       |3           |
|2 |│ └─SCALAR GROUP BY        |     |1       |3           |
|3 |│   └─TABLE RANGE SCAN     |t2   |1       |3           |
|4 |└─TABLE FULL SCAN          |t1   |8       |3           |
============================================================
Outputs & filters:
-------------------------------------
  0 - output([t1.c > VIEW1.max(t2.c)]), filter(nil), rowset=16
      conds(nil), nl_params_(nil), use_batch=false
  1 - output([VIEW1.max(t2.c)]), filter(nil), rowset=16
      access([VIEW1.max(t2.c)])
  2 - output([T_FUN_MAX(T_FUN_MAX(t2.c))]), filter(nil), rowset=16
      group(nil), agg_func([T_FUN_MAX(T_FUN_MAX(t2.c))])
  3 - output([T_FUN_MAX(t2.c)]), filter(nil), rowset=16
      access([t2.c]), partitions(p0)
      is_index_back=false, is_global_index=false, 
      range_key([t2.a]), range(20 ; MAX), 
      range_cond([t2.a > 20]), 
      pushdown_aggregation([T_FUN_MAX(t2.c)])
  4 - output([t1.c]), filter(nil), rowset=16
      access([t1.c]), partitions(p0)
      is_index_back=false, is_global_index=false, 
      range_key([t1.a]), range(MIN ; MAX)always true
select (t1.c > all (select max(t2.c) from t2 where t2.a > 20)) from t1;
(t1.c > all (select max(t2.c) from t2 where t2.a > 20))
NULL
NULL
NULL
NULL
NULL
NULL
NULL
NULL


# case 55
EXPLAIN select * from t1 order by (t1.c > any (select count(*) from t2 where t2.a > 20));
Query Plan
======================================================
|ID|OPERATOR              |NAME|EST.ROWS|EST.TIME(us)|
------------------------------------------------------
|0 |SORT                  |    |8       |7           |
|1 |└─SUBPLAN FILTER      |    |8       |5           |
|2 |  ├─TABLE FULL SCAN   |t1  |8       |3           |
|3 |  └─SCALAR GROUP BY   |    |1       |3           |
|4 |    └─TABLE RANGE SCAN|t2  |1       |3           |
======================================================
Outputs & filters:
-------------------------------------
  0 - output([t1.a], [t1.b], [t1.c]), filter(nil), rowset=16
      sort_keys([t1.c > :0, ASC])
  1 - output([t1.c > :0], [t1.a], [t1.b], [t1.c]), filter(nil), rowset=16
      exec_params_(nil), onetime_exprs_([subquery(1)(:0)]), init_plan_idxs_(nil), use_batch=false
  2 - output([t1.a], [t1.b], [t1.c]), filter(nil), rowset=16
      access([t1.a], [t1.b], [t1.c]), partitions(p0)
      is_index_back=false, is_global_index=false, 
      range_key([t1.a]), range(MIN ; MAX)always true
  3 - output([T_FUN_COUNT_SUM(T_FUN_COUNT(*))]), filter(nil), rowset=16
      group(nil), agg_func([T_FUN_COUNT_SUM(T_FUN_COUNT(*))])
  4 - output([T_FUN_COUNT(*)]), filter(nil), rowset=16
      access(nil), partitions(p0)
      is_index_back=false, is_global_index=false, 
      range_key([t2.a]), range(20 ; MAX), 
      range_cond([t2.a > 20]), 
      pushdown_aggregation([T_FUN_COUNT(*)])
select * from t1 order by (t1.c > any (select count(*) from t2 where t2.a > 20));
a	b	c
1	1	0
3	3	0
5	5	0
7	7	0
2	2	1
4	4	1
6	6	1
8	8	1
EXPLAIN select /*+NO_REWRITE*/* from t1 order by (t1.c > any (select count(*) from t2 where t2.a > 20));
Query Plan
======================================================
|ID|OPERATOR              |NAME|EST.ROWS|EST.TIME(us)|
------------------------------------------------------
|0 |SORT                  |    |8       |7           |
|1 |└─SUBPLAN FILTER      |    |8       |5           |
|2 |  ├─TABLE FULL SCAN   |t1  |8       |3           |
|3 |  └─SCALAR GROUP BY   |    |1       |3           |
|4 |    └─TABLE RANGE SCAN|t2  |1       |3           |
======================================================
Outputs & filters:
-------------------------------------
  0 - output([t1.a], [t1.b], [t1.c]), filter(nil), rowset=16
      sort_keys([t1.c > ANY(subquery(1)), ASC])
  1 - output([t1.c > ANY(subquery(1))], [t1.a], [t1.b], [t1.c]), filter(nil), rowset=16
      exec_params_(nil), onetime_exprs_(nil), init_plan_idxs_([1]), use_batch=false
  2 - output([t1.a], [t1.b], [t1.c]), filter(nil), rowset=16
      access([t1.a], [t1.b], [t1.c]), partitions(p0)
      is_index_back=false, is_global_index=false, 
      range_key([t1.a]), range(MIN ; MAX)always true
  3 - output([T_FUN_COUNT_SUM(T_FUN_COUNT(*))]), filter(nil), rowset=16
      group(nil), agg_func([T_FUN_COUNT_SUM(T_FUN_COUNT(*))])
  4 - output([T_FUN_COUNT(*)]), filter(nil), rowset=16
      access(nil), partitions(p0)
      is_index_back=false, is_global_index=false, 
      range_key([t2.a]), range(20 ; MAX), 
      range_cond([t2.a > 20]), 
      pushdown_aggregation([T_FUN_COUNT(*)])
select /*+NO_REWRITE*/* from t1 order by (t1.c > any (select count(*) from t2 where t2.a > 20));
a	b	c
1	1	0
3	3	0
5	5	0
7	7	0
2	2	1
4	4	1
6	6	1
8	8	1
EXPLAIN update t1 set b = b + 1 order by (t1.c > any (select count(*) from t2 where t2.a > 20));
Query Plan
========================================================
|ID|OPERATOR                |NAME|EST.ROWS|EST.TIME(us)|
--------------------------------------------------------
|0 |UPDATE                  |    |8       |91          |
|1 |└─SORT                  |    |8       |7           |
|2 |  └─SUBPLAN FILTER      |    |8       |5           |
|3 |    ├─TABLE FULL SCAN   |t1  |8       |3           |
|4 |    └─SCALAR GROUP BY   |    |1       |3           |
|5 |      └─TABLE RANGE SCAN|t2  |1       |3           |
========================================================
Outputs & filters:
-------------------------------------
  0 - output(nil), filter(nil)
      table_columns([{t1: ({t1: (t1.a, t1.b, t1.c)})}]),
      update([t1.b=column_conv(INT,PS:(11,0),NULL,cast(t1.b + 1, INT(-1, 0)))])
  1 - output([t1.a], [t1.b], [t1.c]), filter(nil), rowset=16
      sort_keys([t1.c > :0, ASC])
  2 - output([t1.a], [t1.b], [t1.c], [t1.c > :0]), filter(nil), rowset=16
      exec_params_(nil), onetime_exprs_([subquery(1)(:0)]), init_plan_idxs_(nil), use_batch=false
  3 - output([t1.a], [t1.b], [t1.c]), filter(nil), rowset=16
      access([t1.a], [t1.b], [t1.c]), partitions(p0)
      is_index_back=false, is_global_index=false, 
      range_key([t1.a]), range(MIN ; MAX)always true
  4 - output([T_FUN_COUNT_SUM(T_FUN_COUNT(*))]), filter(nil), rowset=16
      group(nil), agg_func([T_FUN_COUNT_SUM(T_FUN_COUNT(*))])
  5 - output([T_FUN_COUNT(*)]), filter(nil), rowset=16
      access(nil), partitions(p0)
      is_index_back=false, is_global_index=false, 
      range_key([t2.a]), range(20 ; MAX), 
      range_cond([t2.a > 20]), 
      pushdown_aggregation([T_FUN_COUNT(*)])
update t1 set b = b + 1 order by (t1.c > any (select count(*) from t2 where t2.a > 20));
select/**/ * from t1;
a	b	c
1	2	0
2	3	1
3	4	0
4	5	1
5	6	0
6	7	1
7	8	0
8	9	1
rollback;
EXPLAIN update /*+NO_REWRITE*/t1 set b = b + 1 order by (t1.c > any (select count(*) from t2 where t2.a > 20));
Query Plan
========================================================
|ID|OPERATOR                |NAME|EST.ROWS|EST.TIME(us)|
--------------------------------------------------------
|0 |UPDATE                  |    |8       |91          |
|1 |└─SORT                  |    |8       |7           |
|2 |  └─SUBPLAN FILTER      |    |8       |5           |
|3 |    ├─TABLE FULL SCAN   |t1  |8       |3           |
|4 |    └─SCALAR GROUP BY   |    |1       |3           |
|5 |      └─TABLE RANGE SCAN|t2  |1       |3           |
========================================================
Outputs & filters:
-------------------------------------
  0 - output(nil), filter(nil)
      table_columns([{t1: ({t1: (t1.a, t1.b, t1.c)})}]),
      update([t1.b=column_conv(INT,PS:(11,0),NULL,cast(t1.b + 1, INT(-1, 0)))])
  1 - output([t1.a], [t1.b], [t1.c]), filter(nil), rowset=16
      sort_keys([t1.c > ANY(subquery(1)), ASC])
  2 - output([t1.a], [t1.b], [t1.c], [t1.c > ANY(subquery(1))]), filter(nil), rowset=16
      exec_params_(nil), onetime_exprs_(nil), init_plan_idxs_([1]), use_batch=false
  3 - output([t1.a], [t1.b], [t1.c]), filter(nil), rowset=16
      access([t1.a], [t1.b], [t1.c]), partitions(p0)
      is_index_back=false, is_global_index=false, 
      range_key([t1.a]), range(MIN ; MAX)always true
  4 - output([T_FUN_COUNT_SUM(T_FUN_COUNT(*))]), filter(nil), rowset=16
      group(nil), agg_func([T_FUN_COUNT_SUM(T_FUN_COUNT(*))])
  5 - output([T_FUN_COUNT(*)]), filter(nil), rowset=16
      access(nil), partitions(p0)
      is_index_back=false, is_global_index=false, 
      range_key([t2.a]), range(20 ; MAX), 
      range_cond([t2.a > 20]), 
      pushdown_aggregation([T_FUN_COUNT(*)])
update /*+NO_REWRITE*/t1 set b = b + 1 order by (t1.c > any (select count(*) from t2 where t2.a > 20));
select/**/ * from t1;
a	b	c
1	2	0
2	3	1
3	4	0
4	5	1
5	6	0
6	7	1
7	8	0
8	9	1
rollback;
EXPLAIN delete from t1 order by (t1.c > any (select count(*) from t2 where t2.a > 20));
Query Plan
========================================================
|ID|OPERATOR                |NAME|EST.ROWS|EST.TIME(us)|
--------------------------------------------------------
|0 |DELETE                  |    |8       |53          |
|1 |└─SORT                  |    |8       |7           |
|2 |  └─SUBPLAN FILTER      |    |8       |5           |
|3 |    ├─TABLE FULL SCAN   |t1  |8       |3           |
|4 |    └─SCALAR GROUP BY   |    |1       |3           |
|5 |      └─TABLE RANGE SCAN|t2  |1       |3           |
========================================================
Outputs & filters:
-------------------------------------
  0 - output(nil), filter(nil)
      table_columns([{t1: ({t1: (t1.a, t1.b, t1.c)})}])
  1 - output([t1.a], [t1.b], [t1.c]), filter(nil), rowset=16
      sort_keys([t1.c > :0, ASC])
  2 - output([t1.a], [t1.b], [t1.c], [t1.c > :0]), filter(nil), rowset=16
      exec_params_(nil), onetime_exprs_([subquery(1)(:0)]), init_plan_idxs_(nil), use_batch=false
  3 - output([t1.a], [t1.b], [t1.c]), filter(nil), rowset=16
      access([t1.a], [t1.b], [t1.c]), partitions(p0)
      is_index_back=false, is_global_index=false, 
      range_key([t1.a]), range(MIN ; MAX)always true
  4 - output([T_FUN_COUNT_SUM(T_FUN_COUNT(*))]), filter(nil), rowset=16
      group(nil), agg_func([T_FUN_COUNT_SUM(T_FUN_COUNT(*))])
  5 - output([T_FUN_COUNT(*)]), filter(nil), rowset=16
      access(nil), partitions(p0)
      is_index_back=false, is_global_index=false, 
      range_key([t2.a]), range(20 ; MAX), 
      range_cond([t2.a > 20]), 
      pushdown_aggregation([T_FUN_COUNT(*)])
delete from t1 order by (t1.c > any (select count(*) from t2 where t2.a > 20));
select/**/ * from t1;
a	b	c
rollback;
EXPLAIN delete /*+NO_REWRITE*/from t1 order by (t1.c > any (select count(*) from t2 where t2.a > 20));
Query Plan
========================================================
|ID|OPERATOR                |NAME|EST.ROWS|EST.TIME(us)|
--------------------------------------------------------
|0 |DELETE                  |    |8       |53          |
|1 |└─SORT                  |    |8       |7           |
|2 |  └─SUBPLAN FILTER      |    |8       |5           |
|3 |    ├─TABLE FULL SCAN   |t1  |8       |3           |
|4 |    └─SCALAR GROUP BY   |    |1       |3           |
|5 |      └─TABLE RANGE SCAN|t2  |1       |3           |
========================================================
Outputs & filters:
-------------------------------------
  0 - output(nil), filter(nil)
      table_columns([{t1: ({t1: (t1.a, t1.b, t1.c)})}])
  1 - output([t1.a], [t1.b], [t1.c]), filter(nil), rowset=16
      sort_keys([t1.c > ANY(subquery(1)), ASC])
  2 - output([t1.a], [t1.b], [t1.c], [t1.c > ANY(subquery(1))]), filter(nil), rowset=16
      exec_params_(nil), onetime_exprs_(nil), init_plan_idxs_([1]), use_batch=false
  3 - output([t1.a], [t1.b], [t1.c]), filter(nil), rowset=16
      access([t1.a], [t1.b], [t1.c]), partitions(p0)
      is_index_back=false, is_global_index=false, 
      range_key([t1.a]), range(MIN ; MAX)always true
  4 - output([T_FUN_COUNT_SUM(T_FUN_COUNT(*))]), filter(nil), rowset=16
      group(nil), agg_func([T_FUN_COUNT_SUM(T_FUN_COUNT(*))])
  5 - output([T_FUN_COUNT(*)]), filter(nil), rowset=16
      access(nil), partitions(p0)
      is_index_back=false, is_global_index=false, 
      range_key([t2.a]), range(20 ; MAX), 
      range_cond([t2.a > 20]), 
      pushdown_aggregation([T_FUN_COUNT(*)])
delete /*+NO_REWRITE*/from t1 order by (t1.c > any (select count(*) from t2 where t2.a > 20));
select/**/ * from t1;
a	b	c
rollback;
EXPLAIN insert into is_c3 select * from t1 order by (t1.c > any (select count(*) from t2 where t2.a > 20));
Query Plan
=====================================================================
|ID|OPERATOR                  |NAME           |EST.ROWS|EST.TIME(us)|
---------------------------------------------------------------------
|0 |INSERT                    |               |8       |64          |
|1 |└─SUBPLAN SCAN            |ANONYMOUS_VIEW1|8       |7           |
|2 |  └─SORT                  |               |8       |7           |
|3 |    └─SUBPLAN FILTER      |               |8       |5           |
|4 |      ├─TABLE FULL SCAN   |t1             |8       |3           |
|5 |      └─SCALAR GROUP BY   |               |1       |3           |
|6 |        └─TABLE RANGE SCAN|t2             |1       |3           |
=====================================================================
Outputs & filters:
-------------------------------------
  0 - output(nil), filter(nil)
      columns([{is_c3: ({is_c3: (is_c3.__pk_increment, is_c3.a, is_c3.b, is_c3.c)})}]), partitions(p0), 
      column_values([T_HIDDEN_PK], [column_conv(INT,PS:(11,0),NULL,ANONYMOUS_VIEW1.a)], [column_conv(INT,PS:(11,0),NULL,ANONYMOUS_VIEW1.b)], [column_conv(INT,
      PS:(11,0),NULL,ANONYMOUS_VIEW1.c)])
  1 - output([ANONYMOUS_VIEW1.a], [ANONYMOUS_VIEW1.b], [ANONYMOUS_VIEW1.c]), filter(nil), rowset=16
      access([ANONYMOUS_VIEW1.a], [ANONYMOUS_VIEW1.b], [ANONYMOUS_VIEW1.c])
  2 - output([t1.a], [t1.b], [t1.c]), filter(nil), rowset=16
      sort_keys([t1.c > :0, ASC])
  3 - output([t1.c > :0], [t1.a], [t1.b], [t1.c]), filter(nil), rowset=16
      exec_params_(nil), onetime_exprs_([subquery(1)(:0)]), init_plan_idxs_(nil), use_batch=false
  4 - output([t1.a], [t1.b], [t1.c]), filter(nil), rowset=16
      access([t1.a], [t1.b], [t1.c]), partitions(p0)
      is_index_back=false, is_global_index=false, 
      range_key([t1.a]), range(MIN ; MAX)always true
  5 - output([T_FUN_COUNT_SUM(T_FUN_COUNT(*))]), filter(nil), rowset=16
      group(nil), agg_func([T_FUN_COUNT_SUM(T_FUN_COUNT(*))])
  6 - output([T_FUN_COUNT(*)]), filter(nil), rowset=16
      access(nil), partitions(p0)
      is_index_back=false, is_global_index=false, 
      range_key([t2.a]), range(20 ; MAX), 
      range_cond([t2.a > 20]), 
      pushdown_aggregation([T_FUN_COUNT(*)])
insert into is_c3 select * from t1 order by (t1.c > any (select count(*) from t2 where t2.a > 20));
select/**/ * from is_c3;
a	b	c
1	1	0
3	3	0
5	5	0
7	7	0
2	2	1
4	4	1
6	6	1
8	8	1
rollback;
EXPLAIN insert into is_c3 select /*+NO_REWRITE*/* from t1 order by (t1.c > any (select count(*) from t2 where t2.a > 20));
Query Plan
=====================================================================
|ID|OPERATOR                  |NAME           |EST.ROWS|EST.TIME(us)|
---------------------------------------------------------------------
|0 |INSERT                    |               |8       |64          |
|1 |└─SUBPLAN SCAN            |ANONYMOUS_VIEW1|8       |7           |
|2 |  └─SORT                  |               |8       |7           |
|3 |    └─SUBPLAN FILTER      |               |8       |5           |
|4 |      ├─TABLE FULL SCAN   |t1             |8       |3           |
|5 |      └─SCALAR GROUP BY   |               |1       |3           |
|6 |        └─TABLE RANGE SCAN|t2             |1       |3           |
=====================================================================
Outputs & filters:
-------------------------------------
  0 - output(nil), filter(nil)
      columns([{is_c3: ({is_c3: (is_c3.__pk_increment, is_c3.a, is_c3.b, is_c3.c)})}]), partitions(p0), 
      column_values([T_HIDDEN_PK], [column_conv(INT,PS:(11,0),NULL,ANONYMOUS_VIEW1.a)], [column_conv(INT,PS:(11,0),NULL,ANONYMOUS_VIEW1.b)], [column_conv(INT,
      PS:(11,0),NULL,ANONYMOUS_VIEW1.c)])
  1 - output([ANONYMOUS_VIEW1.a], [ANONYMOUS_VIEW1.b], [ANONYMOUS_VIEW1.c]), filter(nil), rowset=16
      access([ANONYMOUS_VIEW1.a], [ANONYMOUS_VIEW1.b], [ANONYMOUS_VIEW1.c])
  2 - output([t1.a], [t1.b], [t1.c]), filter(nil), rowset=16
      sort_keys([t1.c > ANY(subquery(1)), ASC])
  3 - output([t1.c > ANY(subquery(1))], [t1.a], [t1.b], [t1.c]), filter(nil), rowset=16
      exec_params_(nil), onetime_exprs_(nil), init_plan_idxs_([1]), use_batch=false
  4 - output([t1.a], [t1.b], [t1.c]), filter(nil), rowset=16
      access([t1.a], [t1.b], [t1.c]), partitions(p0)
      is_index_back=false, is_global_index=false, 
      range_key([t1.a]), range(MIN ; MAX)always true
  5 - output([T_FUN_COUNT_SUM(T_FUN_COUNT(*))]), filter(nil), rowset=16
      group(nil), agg_func([T_FUN_COUNT_SUM(T_FUN_COUNT(*))])
  6 - output([T_FUN_COUNT(*)]), filter(nil), rowset=16
      access(nil), partitions(p0)
      is_index_back=false, is_global_index=false, 
      range_key([t2.a]), range(20 ; MAX), 
      range_cond([t2.a > 20]), 
      pushdown_aggregation([T_FUN_COUNT(*)])
insert into is_c3 select /*+NO_REWRITE*/* from t1 order by (t1.c > any (select count(*) from t2 where t2.a > 20));
select/**/ * from is_c3;
a	b	c
1	1	0
3	3	0
5	5	0
7	7	0
2	2	1
4	4	1
6	6	1
8	8	1
rollback;


# case 56
EXPLAIN select * from t1 order by (t1.c > all (select count(*) from t2 where t2.a > 20));
Query Plan
======================================================
|ID|OPERATOR              |NAME|EST.ROWS|EST.TIME(us)|
------------------------------------------------------
|0 |SORT                  |    |8       |7           |
|1 |└─SUBPLAN FILTER      |    |8       |5           |
|2 |  ├─TABLE FULL SCAN   |t1  |8       |3           |
|3 |  └─SCALAR GROUP BY   |    |1       |3           |
|4 |    └─TABLE RANGE SCAN|t2  |1       |3           |
======================================================
Outputs & filters:
-------------------------------------
  0 - output([t1.a], [t1.b], [t1.c]), filter(nil), rowset=16
      sort_keys([t1.c > :0, ASC])
  1 - output([t1.c > :0], [t1.a], [t1.b], [t1.c]), filter(nil), rowset=16
      exec_params_(nil), onetime_exprs_([subquery(1)(:0)]), init_plan_idxs_(nil), use_batch=false
  2 - output([t1.a], [t1.b], [t1.c]), filter(nil), rowset=16
      access([t1.a], [t1.b], [t1.c]), partitions(p0)
      is_index_back=false, is_global_index=false, 
      range_key([t1.a]), range(MIN ; MAX)always true
  3 - output([T_FUN_COUNT_SUM(T_FUN_COUNT(*))]), filter(nil), rowset=16
      group(nil), agg_func([T_FUN_COUNT_SUM(T_FUN_COUNT(*))])
  4 - output([T_FUN_COUNT(*)]), filter(nil), rowset=16
      access(nil), partitions(p0)
      is_index_back=false, is_global_index=false, 
      range_key([t2.a]), range(20 ; MAX), 
      range_cond([t2.a > 20]), 
      pushdown_aggregation([T_FUN_COUNT(*)])
select * from t1 order by (t1.c > all (select count(*) from t2 where t2.a > 20));
a	b	c
1	1	0
3	3	0
5	5	0
7	7	0
2	2	1
4	4	1
6	6	1
8	8	1
EXPLAIN select /*+NO_REWRITE*/* from t1 order by (t1.c > all (select count(*) from t2 where t2.a > 20));
Query Plan
======================================================
|ID|OPERATOR              |NAME|EST.ROWS|EST.TIME(us)|
------------------------------------------------------
|0 |SORT                  |    |8       |7           |
|1 |└─SUBPLAN FILTER      |    |8       |5           |
|2 |  ├─TABLE FULL SCAN   |t1  |8       |3           |
|3 |  └─SCALAR GROUP BY   |    |1       |3           |
|4 |    └─TABLE RANGE SCAN|t2  |1       |3           |
======================================================
Outputs & filters:
-------------------------------------
  0 - output([t1.a], [t1.b], [t1.c]), filter(nil), rowset=16
      sort_keys([t1.c > ALL(subquery(1)), ASC])
  1 - output([t1.c > ALL(subquery(1))], [t1.a], [t1.b], [t1.c]), filter(nil), rowset=16
      exec_params_(nil), onetime_exprs_(nil), init_plan_idxs_([1]), use_batch=false
  2 - output([t1.a], [t1.b], [t1.c]), filter(nil), rowset=16
      access([t1.a], [t1.b], [t1.c]), partitions(p0)
      is_index_back=false, is_global_index=false, 
      range_key([t1.a]), range(MIN ; MAX)always true
  3 - output([T_FUN_COUNT_SUM(T_FUN_COUNT(*))]), filter(nil), rowset=16
      group(nil), agg_func([T_FUN_COUNT_SUM(T_FUN_COUNT(*))])
  4 - output([T_FUN_COUNT(*)]), filter(nil), rowset=16
      access(nil), partitions(p0)
      is_index_back=false, is_global_index=false, 
      range_key([t2.a]), range(20 ; MAX), 
      range_cond([t2.a > 20]), 
      pushdown_aggregation([T_FUN_COUNT(*)])
select /*+NO_REWRITE*/* from t1 order by (t1.c > all (select count(*) from t2 where t2.a > 20));
a	b	c
1	1	0
3	3	0
5	5	0
7	7	0
2	2	1
4	4	1
6	6	1
8	8	1
EXPLAIN update t1 set b = b + 1 order by (t1.c > all (select count(*) from t2 where t2.a > 20));
Query Plan
========================================================
|ID|OPERATOR                |NAME|EST.ROWS|EST.TIME(us)|
--------------------------------------------------------
|0 |UPDATE                  |    |8       |91          |
|1 |└─SORT                  |    |8       |7           |
|2 |  └─SUBPLAN FILTER      |    |8       |5           |
|3 |    ├─TABLE FULL SCAN   |t1  |8       |3           |
|4 |    └─SCALAR GROUP BY   |    |1       |3           |
|5 |      └─TABLE RANGE SCAN|t2  |1       |3           |
========================================================
Outputs & filters:
-------------------------------------
  0 - output(nil), filter(nil)
      table_columns([{t1: ({t1: (t1.a, t1.b, t1.c)})}]),
      update([t1.b=column_conv(INT,PS:(11,0),NULL,cast(t1.b + 1, INT(-1, 0)))])
  1 - output([t1.a], [t1.b], [t1.c]), filter(nil), rowset=16
      sort_keys([t1.c > :0, ASC])
  2 - output([t1.a], [t1.b], [t1.c], [t1.c > :0]), filter(nil), rowset=16
      exec_params_(nil), onetime_exprs_([subquery(1)(:0)]), init_plan_idxs_(nil), use_batch=false
  3 - output([t1.a], [t1.b], [t1.c]), filter(nil), rowset=16
      access([t1.a], [t1.b], [t1.c]), partitions(p0)
      is_index_back=false, is_global_index=false, 
      range_key([t1.a]), range(MIN ; MAX)always true
  4 - output([T_FUN_COUNT_SUM(T_FUN_COUNT(*))]), filter(nil), rowset=16
      group(nil), agg_func([T_FUN_COUNT_SUM(T_FUN_COUNT(*))])
  5 - output([T_FUN_COUNT(*)]), filter(nil), rowset=16
      access(nil), partitions(p0)
      is_index_back=false, is_global_index=false, 
      range_key([t2.a]), range(20 ; MAX), 
      range_cond([t2.a > 20]), 
      pushdown_aggregation([T_FUN_COUNT(*)])
update t1 set b = b + 1 order by (t1.c > all (select count(*) from t2 where t2.a > 20));
select/**/ * from t1;
a	b	c
1	2	0
2	3	1
3	4	0
4	5	1
5	6	0
6	7	1
7	8	0
8	9	1
rollback;
EXPLAIN update /*+NO_REWRITE*/t1 set b = b + 1 order by (t1.c > all (select count(*) from t2 where t2.a > 20));
Query Plan
========================================================
|ID|OPERATOR                |NAME|EST.ROWS|EST.TIME(us)|
--------------------------------------------------------
|0 |UPDATE                  |    |8       |91          |
|1 |└─SORT                  |    |8       |7           |
|2 |  └─SUBPLAN FILTER      |    |8       |5           |
|3 |    ├─TABLE FULL SCAN   |t1  |8       |3           |
|4 |    └─SCALAR GROUP BY   |    |1       |3           |
|5 |      └─TABLE RANGE SCAN|t2  |1       |3           |
========================================================
Outputs & filters:
-------------------------------------
  0 - output(nil), filter(nil)
      table_columns([{t1: ({t1: (t1.a, t1.b, t1.c)})}]),
      update([t1.b=column_conv(INT,PS:(11,0),NULL,cast(t1.b + 1, INT(-1, 0)))])
  1 - output([t1.a], [t1.b], [t1.c]), filter(nil), rowset=16
      sort_keys([t1.c > ALL(subquery(1)), ASC])
  2 - output([t1.a], [t1.b], [t1.c], [t1.c > ALL(subquery(1))]), filter(nil), rowset=16
      exec_params_(nil), onetime_exprs_(nil), init_plan_idxs_([1]), use_batch=false
  3 - output([t1.a], [t1.b], [t1.c]), filter(nil), rowset=16
      access([t1.a], [t1.b], [t1.c]), partitions(p0)
      is_index_back=false, is_global_index=false, 
      range_key([t1.a]), range(MIN ; MAX)always true
  4 - output([T_FUN_COUNT_SUM(T_FUN_COUNT(*))]), filter(nil), rowset=16
      group(nil), agg_func([T_FUN_COUNT_SUM(T_FUN_COUNT(*))])
  5 - output([T_FUN_COUNT(*)]), filter(nil), rowset=16
      access(nil), partitions(p0)
      is_index_back=false, is_global_index=false, 
      range_key([t2.a]), range(20 ; MAX), 
      range_cond([t2.a > 20]), 
      pushdown_aggregation([T_FUN_COUNT(*)])
update /*+NO_REWRITE*/t1 set b = b + 1 order by (t1.c > all (select count(*) from t2 where t2.a > 20));
select/**/ * from t1;
a	b	c
1	2	0
2	3	1
3	4	0
4	5	1
5	6	0
6	7	1
7	8	0
8	9	1
rollback;
EXPLAIN delete from t1 order by (t1.c > all (select count(*) from t2 where t2.a > 20));
Query Plan
========================================================
|ID|OPERATOR                |NAME|EST.ROWS|EST.TIME(us)|
--------------------------------------------------------
|0 |DELETE                  |    |8       |53          |
|1 |└─SORT                  |    |8       |7           |
|2 |  └─SUBPLAN FILTER      |    |8       |5           |
|3 |    ├─TABLE FULL SCAN   |t1  |8       |3           |
|4 |    └─SCALAR GROUP BY   |    |1       |3           |
|5 |      └─TABLE RANGE SCAN|t2  |1       |3           |
========================================================
Outputs & filters:
-------------------------------------
  0 - output(nil), filter(nil)
      table_columns([{t1: ({t1: (t1.a, t1.b, t1.c)})}])
  1 - output([t1.a], [t1.b], [t1.c]), filter(nil), rowset=16
      sort_keys([t1.c > :0, ASC])
  2 - output([t1.a], [t1.b], [t1.c], [t1.c > :0]), filter(nil), rowset=16
      exec_params_(nil), onetime_exprs_([subquery(1)(:0)]), init_plan_idxs_(nil), use_batch=false
  3 - output([t1.a], [t1.b], [t1.c]), filter(nil), rowset=16
      access([t1.a], [t1.b], [t1.c]), partitions(p0)
      is_index_back=false, is_global_index=false, 
      range_key([t1.a]), range(MIN ; MAX)always true
  4 - output([T_FUN_COUNT_SUM(T_FUN_COUNT(*))]), filter(nil), rowset=16
      group(nil), agg_func([T_FUN_COUNT_SUM(T_FUN_COUNT(*))])
  5 - output([T_FUN_COUNT(*)]), filter(nil), rowset=16
      access(nil), partitions(p0)
      is_index_back=false, is_global_index=false, 
      range_key([t2.a]), range(20 ; MAX), 
      range_cond([t2.a > 20]), 
      pushdown_aggregation([T_FUN_COUNT(*)])
delete from t1 order by (t1.c > all (select count(*) from t2 where t2.a > 20));
select/**/ * from t1;
a	b	c
rollback;
EXPLAIN delete /*+NO_REWRITE*/from t1 order by (t1.c > all (select count(*) from t2 where t2.a > 20));
Query Plan
========================================================
|ID|OPERATOR                |NAME|EST.ROWS|EST.TIME(us)|
--------------------------------------------------------
|0 |DELETE                  |    |8       |53          |
|1 |└─SORT                  |    |8       |7           |
|2 |  └─SUBPLAN FILTER      |    |8       |5           |
|3 |    ├─TABLE FULL SCAN   |t1  |8       |3           |
|4 |    └─SCALAR GROUP BY   |    |1       |3           |
|5 |      └─TABLE RANGE SCAN|t2  |1       |3           |
========================================================
Outputs & filters:
-------------------------------------
  0 - output(nil), filter(nil)
      table_columns([{t1: ({t1: (t1.a, t1.b, t1.c)})}])
  1 - output([t1.a], [t1.b], [t1.c]), filter(nil), rowset=16
      sort_keys([t1.c > ALL(subquery(1)), ASC])
  2 - output([t1.a], [t1.b], [t1.c], [t1.c > ALL(subquery(1))]), filter(nil), rowset=16
      exec_params_(nil), onetime_exprs_(nil), init_plan_idxs_([1]), use_batch=false
  3 - output([t1.a], [t1.b], [t1.c]), filter(nil), rowset=16
      access([t1.a], [t1.b], [t1.c]), partitions(p0)
      is_index_back=false, is_global_index=false, 
      range_key([t1.a]), range(MIN ; MAX)always true
  4 - output([T_FUN_COUNT_SUM(T_FUN_COUNT(*))]), filter(nil), rowset=16
      group(nil), agg_func([T_FUN_COUNT_SUM(T_FUN_COUNT(*))])
  5 - output([T_FUN_COUNT(*)]), filter(nil), rowset=16
      access(nil), partitions(p0)
      is_index_back=false, is_global_index=false, 
      range_key([t2.a]), range(20 ; MAX), 
      range_cond([t2.a > 20]), 
      pushdown_aggregation([T_FUN_COUNT(*)])
delete /*+NO_REWRITE*/from t1 order by (t1.c > all (select count(*) from t2 where t2.a > 20));
select/**/ * from t1;
a	b	c
rollback;
EXPLAIN insert into is_c3 select * from t1 order by (t1.c > all (select count(*) from t2 where t2.a > 20));
Query Plan
=====================================================================
|ID|OPERATOR                  |NAME           |EST.ROWS|EST.TIME(us)|
---------------------------------------------------------------------
|0 |INSERT                    |               |8       |64          |
|1 |└─SUBPLAN SCAN            |ANONYMOUS_VIEW1|8       |7           |
|2 |  └─SORT                  |               |8       |7           |
|3 |    └─SUBPLAN FILTER      |               |8       |5           |
|4 |      ├─TABLE FULL SCAN   |t1             |8       |3           |
|5 |      └─SCALAR GROUP BY   |               |1       |3           |
|6 |        └─TABLE RANGE SCAN|t2             |1       |3           |
=====================================================================
Outputs & filters:
-------------------------------------
  0 - output(nil), filter(nil)
      columns([{is_c3: ({is_c3: (is_c3.__pk_increment, is_c3.a, is_c3.b, is_c3.c)})}]), partitions(p0), 
      column_values([T_HIDDEN_PK], [column_conv(INT,PS:(11,0),NULL,ANONYMOUS_VIEW1.a)], [column_conv(INT,PS:(11,0),NULL,ANONYMOUS_VIEW1.b)], [column_conv(INT,
      PS:(11,0),NULL,ANONYMOUS_VIEW1.c)])
  1 - output([ANONYMOUS_VIEW1.a], [ANONYMOUS_VIEW1.b], [ANONYMOUS_VIEW1.c]), filter(nil), rowset=16
      access([ANONYMOUS_VIEW1.a], [ANONYMOUS_VIEW1.b], [ANONYMOUS_VIEW1.c])
  2 - output([t1.a], [t1.b], [t1.c]), filter(nil), rowset=16
      sort_keys([t1.c > :0, ASC])
  3 - output([t1.c > :0], [t1.a], [t1.b], [t1.c]), filter(nil), rowset=16
      exec_params_(nil), onetime_exprs_([subquery(1)(:0)]), init_plan_idxs_(nil), use_batch=false
  4 - output([t1.a], [t1.b], [t1.c]), filter(nil), rowset=16
      access([t1.a], [t1.b], [t1.c]), partitions(p0)
      is_index_back=false, is_global_index=false, 
      range_key([t1.a]), range(MIN ; MAX)always true
  5 - output([T_FUN_COUNT_SUM(T_FUN_COUNT(*))]), filter(nil), rowset=16
      group(nil), agg_func([T_FUN_COUNT_SUM(T_FUN_COUNT(*))])
  6 - output([T_FUN_COUNT(*)]), filter(nil), rowset=16
      access(nil), partitions(p0)
      is_index_back=false, is_global_index=false, 
      range_key([t2.a]), range(20 ; MAX), 
      range_cond([t2.a > 20]), 
      pushdown_aggregation([T_FUN_COUNT(*)])
insert into is_c3 select * from t1 order by (t1.c > all (select count(*) from t2 where t2.a > 20));
select/**/ * from is_c3;
a	b	c
1	1	0
3	3	0
5	5	0
7	7	0
2	2	1
4	4	1
6	6	1
8	8	1
rollback;
EXPLAIN insert into is_c3 select /*+NO_REWRITE*/* from t1 order by (t1.c > all (select count(*) from t2 where t2.a > 20));
Query Plan
=====================================================================
|ID|OPERATOR                  |NAME           |EST.ROWS|EST.TIME(us)|
---------------------------------------------------------------------
|0 |INSERT                    |               |8       |64          |
|1 |└─SUBPLAN SCAN            |ANONYMOUS_VIEW1|8       |7           |
|2 |  └─SORT                  |               |8       |7           |
|3 |    └─SUBPLAN FILTER      |               |8       |5           |
|4 |      ├─TABLE FULL SCAN   |t1             |8       |3           |
|5 |      └─SCALAR GROUP BY   |               |1       |3           |
|6 |        └─TABLE RANGE SCAN|t2             |1       |3           |
=====================================================================
Outputs & filters:
-------------------------------------
  0 - output(nil), filter(nil)
      columns([{is_c3: ({is_c3: (is_c3.__pk_increment, is_c3.a, is_c3.b, is_c3.c)})}]), partitions(p0), 
      column_values([T_HIDDEN_PK], [column_conv(INT,PS:(11,0),NULL,ANONYMOUS_VIEW1.a)], [column_conv(INT,PS:(11,0),NULL,ANONYMOUS_VIEW1.b)], [column_conv(INT,
      PS:(11,0),NULL,ANONYMOUS_VIEW1.c)])
  1 - output([ANONYMOUS_VIEW1.a], [ANONYMOUS_VIEW1.b], [ANONYMOUS_VIEW1.c]), filter(nil), rowset=16
      access([ANONYMOUS_VIEW1.a], [ANONYMOUS_VIEW1.b], [ANONYMOUS_VIEW1.c])
  2 - output([t1.a], [t1.b], [t1.c]), filter(nil), rowset=16
      sort_keys([t1.c > ALL(subquery(1)), ASC])
  3 - output([t1.c > ALL(subquery(1))], [t1.a], [t1.b], [t1.c]), filter(nil), rowset=16
      exec_params_(nil), onetime_exprs_(nil), init_plan_idxs_([1]), use_batch=false
  4 - output([t1.a], [t1.b], [t1.c]), filter(nil), rowset=16
      access([t1.a], [t1.b], [t1.c]), partitions(p0)
      is_index_back=false, is_global_index=false, 
      range_key([t1.a]), range(MIN ; MAX)always true
  5 - output([T_FUN_COUNT_SUM(T_FUN_COUNT(*))]), filter(nil), rowset=16
      group(nil), agg_func([T_FUN_COUNT_SUM(T_FUN_COUNT(*))])
  6 - output([T_FUN_COUNT(*)]), filter(nil), rowset=16
      access(nil), partitions(p0)
      is_index_back=false, is_global_index=false, 
      range_key([t2.a]), range(20 ; MAX), 
      range_cond([t2.a > 20]), 
      pushdown_aggregation([T_FUN_COUNT(*)])
insert into is_c3 select /*+NO_REWRITE*/* from t1 order by (t1.c > all (select count(*) from t2 where t2.a > 20));
select/**/ * from is_c3;
a	b	c
1	1	0
3	3	0
5	5	0
7	7	0
2	2	1
4	4	1
6	6	1
8	8	1
rollback;


# case 57
EXPLAIN select * from t1 order by (t1.c > any (select max(t2.c) from t2 where t2.a > 20));
Query Plan
======================================================
|ID|OPERATOR              |NAME|EST.ROWS|EST.TIME(us)|
------------------------------------------------------
|0 |SORT                  |    |8       |7           |
|1 |└─SUBPLAN FILTER      |    |8       |5           |
|2 |  ├─TABLE FULL SCAN   |t1  |8       |3           |
|3 |  └─SCALAR GROUP BY   |    |1       |3           |
|4 |    └─TABLE RANGE SCAN|t2  |1       |3           |
======================================================
Outputs & filters:
-------------------------------------
  0 - output([t1.a], [t1.b], [t1.c]), filter(nil), rowset=16
      sort_keys([t1.c > :0, ASC])
  1 - output([t1.c > :0], [t1.a], [t1.b], [t1.c]), filter(nil), rowset=16
      exec_params_(nil), onetime_exprs_([subquery(1)(:0)]), init_plan_idxs_(nil), use_batch=false
  2 - output([t1.a], [t1.b], [t1.c]), filter(nil), rowset=16
      access([t1.a], [t1.b], [t1.c]), partitions(p0)
      is_index_back=false, is_global_index=false, 
      range_key([t1.a]), range(MIN ; MAX)always true
  3 - output([T_FUN_MAX(T_FUN_MAX(t2.c))]), filter(nil), rowset=16
      group(nil), agg_func([T_FUN_MAX(T_FUN_MAX(t2.c))])
  4 - output([T_FUN_MAX(t2.c)]), filter(nil), rowset=16
      access([t2.c]), partitions(p0)
      is_index_back=false, is_global_index=false, 
      range_key([t2.a]), range(20 ; MAX), 
      range_cond([t2.a > 20]), 
      pushdown_aggregation([T_FUN_MAX(t2.c)])
select * from t1 order by (t1.c > any (select max(t2.c) from t2 where t2.a > 20));
a	b	c
1	1	0
2	2	1
3	3	0
4	4	1
5	5	0
6	6	1
7	7	0
8	8	1
EXPLAIN select /*+NO_REWRITE*/* from t1 order by (t1.c > any (select max(t2.c) from t2 where t2.a > 20));
Query Plan
======================================================
|ID|OPERATOR              |NAME|EST.ROWS|EST.TIME(us)|
------------------------------------------------------
|0 |SORT                  |    |8       |7           |
|1 |└─SUBPLAN FILTER      |    |8       |5           |
|2 |  ├─TABLE FULL SCAN   |t1  |8       |3           |
|3 |  └─SCALAR GROUP BY   |    |1       |3           |
|4 |    └─TABLE RANGE SCAN|t2  |1       |3           |
======================================================
Outputs & filters:
-------------------------------------
  0 - output([t1.a], [t1.b], [t1.c]), filter(nil), rowset=16
      sort_keys([t1.c > ANY(subquery(1)), ASC])
  1 - output([t1.c > ANY(subquery(1))], [t1.a], [t1.b], [t1.c]), filter(nil), rowset=16
      exec_params_(nil), onetime_exprs_(nil), init_plan_idxs_([1]), use_batch=false
  2 - output([t1.a], [t1.b], [t1.c]), filter(nil), rowset=16
      access([t1.a], [t1.b], [t1.c]), partitions(p0)
      is_index_back=false, is_global_index=false, 
      range_key([t1.a]), range(MIN ; MAX)always true
  3 - output([T_FUN_MAX(T_FUN_MAX(t2.c))]), filter(nil), rowset=16
      group(nil), agg_func([T_FUN_MAX(T_FUN_MAX(t2.c))])
  4 - output([T_FUN_MAX(t2.c)]), filter(nil), rowset=16
      access([t2.c]), partitions(p0)
      is_index_back=false, is_global_index=false, 
      range_key([t2.a]), range(20 ; MAX), 
      range_cond([t2.a > 20]), 
      pushdown_aggregation([T_FUN_MAX(t2.c)])
select /*+NO_REWRITE*/* from t1 order by (t1.c > any (select max(t2.c) from t2 where t2.a > 20));
a	b	c
1	1	0
2	2	1
3	3	0
4	4	1
5	5	0
6	6	1
7	7	0
8	8	1
EXPLAIN update t1 set b = b + 1 order by (t1.c > any (select max(t2.c) from t2 where t2.a > 20));
Query Plan
========================================================
|ID|OPERATOR                |NAME|EST.ROWS|EST.TIME(us)|
--------------------------------------------------------
|0 |UPDATE                  |    |8       |91          |
|1 |└─SORT                  |    |8       |7           |
|2 |  └─SUBPLAN FILTER      |    |8       |5           |
|3 |    ├─TABLE FULL SCAN   |t1  |8       |3           |
|4 |    └─SCALAR GROUP BY   |    |1       |3           |
|5 |      └─TABLE RANGE SCAN|t2  |1       |3           |
========================================================
Outputs & filters:
-------------------------------------
  0 - output(nil), filter(nil)
      table_columns([{t1: ({t1: (t1.a, t1.b, t1.c)})}]),
      update([t1.b=column_conv(INT,PS:(11,0),NULL,cast(t1.b + 1, INT(-1, 0)))])
  1 - output([t1.a], [t1.b], [t1.c]), filter(nil), rowset=16
      sort_keys([t1.c > :0, ASC])
  2 - output([t1.a], [t1.b], [t1.c], [t1.c > :0]), filter(nil), rowset=16
      exec_params_(nil), onetime_exprs_([subquery(1)(:0)]), init_plan_idxs_(nil), use_batch=false
  3 - output([t1.a], [t1.b], [t1.c]), filter(nil), rowset=16
      access([t1.a], [t1.b], [t1.c]), partitions(p0)
      is_index_back=false, is_global_index=false, 
      range_key([t1.a]), range(MIN ; MAX)always true
  4 - output([T_FUN_MAX(T_FUN_MAX(t2.c))]), filter(nil), rowset=16
      group(nil), agg_func([T_FUN_MAX(T_FUN_MAX(t2.c))])
  5 - output([T_FUN_MAX(t2.c)]), filter(nil), rowset=16
      access([t2.c]), partitions(p0)
      is_index_back=false, is_global_index=false, 
      range_key([t2.a]), range(20 ; MAX), 
      range_cond([t2.a > 20]), 
      pushdown_aggregation([T_FUN_MAX(t2.c)])
update t1 set b = b + 1 order by (t1.c > any (select max(t2.c) from t2 where t2.a > 20));
select/**/ * from t1;
a	b	c
1	2	0
2	3	1
3	4	0
4	5	1
5	6	0
6	7	1
7	8	0
8	9	1
rollback;
EXPLAIN update /*+NO_REWRITE*/t1 set b = b + 1 order by (t1.c > any (select max(t2.c) from t2 where t2.a > 20));
Query Plan
========================================================
|ID|OPERATOR                |NAME|EST.ROWS|EST.TIME(us)|
--------------------------------------------------------
|0 |UPDATE                  |    |8       |91          |
|1 |└─SORT                  |    |8       |7           |
|2 |  └─SUBPLAN FILTER      |    |8       |5           |
|3 |    ├─TABLE FULL SCAN   |t1  |8       |3           |
|4 |    └─SCALAR GROUP BY   |    |1       |3           |
|5 |      └─TABLE RANGE SCAN|t2  |1       |3           |
========================================================
Outputs & filters:
-------------------------------------
  0 - output(nil), filter(nil)
      table_columns([{t1: ({t1: (t1.a, t1.b, t1.c)})}]),
      update([t1.b=column_conv(INT,PS:(11,0),NULL,cast(t1.b + 1, INT(-1, 0)))])
  1 - output([t1.a], [t1.b], [t1.c]), filter(nil), rowset=16
      sort_keys([t1.c > ANY(subquery(1)), ASC])
  2 - output([t1.a], [t1.b], [t1.c], [t1.c > ANY(subquery(1))]), filter(nil), rowset=16
      exec_params_(nil), onetime_exprs_(nil), init_plan_idxs_([1]), use_batch=false
  3 - output([t1.a], [t1.b], [t1.c]), filter(nil), rowset=16
      access([t1.a], [t1.b], [t1.c]), partitions(p0)
      is_index_back=false, is_global_index=false, 
      range_key([t1.a]), range(MIN ; MAX)always true
  4 - output([T_FUN_MAX(T_FUN_MAX(t2.c))]), filter(nil), rowset=16
      group(nil), agg_func([T_FUN_MAX(T_FUN_MAX(t2.c))])
  5 - output([T_FUN_MAX(t2.c)]), filter(nil), rowset=16
      access([t2.c]), partitions(p0)
      is_index_back=false, is_global_index=false, 
      range_key([t2.a]), range(20 ; MAX), 
      range_cond([t2.a > 20]), 
      pushdown_aggregation([T_FUN_MAX(t2.c)])
update /*+NO_REWRITE*/t1 set b = b + 1 order by (t1.c > any (select max(t2.c) from t2 where t2.a > 20));
select/**/ * from t1;
a	b	c
1	2	0
2	3	1
3	4	0
4	5	1
5	6	0
6	7	1
7	8	0
8	9	1
rollback;
EXPLAIN delete from t1 order by (t1.c > any (select max(t2.c) from t2 where t2.a > 20));
Query Plan
========================================================
|ID|OPERATOR                |NAME|EST.ROWS|EST.TIME(us)|
--------------------------------------------------------
|0 |DELETE                  |    |8       |53          |
|1 |└─SORT                  |    |8       |7           |
|2 |  └─SUBPLAN FILTER      |    |8       |5           |
|3 |    ├─TABLE FULL SCAN   |t1  |8       |3           |
|4 |    └─SCALAR GROUP BY   |    |1       |3           |
|5 |      └─TABLE RANGE SCAN|t2  |1       |3           |
========================================================
Outputs & filters:
-------------------------------------
  0 - output(nil), filter(nil)
      table_columns([{t1: ({t1: (t1.a, t1.b, t1.c)})}])
  1 - output([t1.a], [t1.b], [t1.c]), filter(nil), rowset=16
      sort_keys([t1.c > :0, ASC])
  2 - output([t1.a], [t1.b], [t1.c], [t1.c > :0]), filter(nil), rowset=16
      exec_params_(nil), onetime_exprs_([subquery(1)(:0)]), init_plan_idxs_(nil), use_batch=false
  3 - output([t1.a], [t1.b], [t1.c]), filter(nil), rowset=16
      access([t1.a], [t1.b], [t1.c]), partitions(p0)
      is_index_back=false, is_global_index=false, 
      range_key([t1.a]), range(MIN ; MAX)always true
  4 - output([T_FUN_MAX(T_FUN_MAX(t2.c))]), filter(nil), rowset=16
      group(nil), agg_func([T_FUN_MAX(T_FUN_MAX(t2.c))])
  5 - output([T_FUN_MAX(t2.c)]), filter(nil), rowset=16
      access([t2.c]), partitions(p0)
      is_index_back=false, is_global_index=false, 
      range_key([t2.a]), range(20 ; MAX), 
      range_cond([t2.a > 20]), 
      pushdown_aggregation([T_FUN_MAX(t2.c)])
delete from t1 order by (t1.c > any (select max(t2.c) from t2 where t2.a > 20));
select/**/ * from t1;
a	b	c
rollback;
EXPLAIN delete /*+NO_REWRITE*/from t1 order by (t1.c > any (select max(t2.c) from t2 where t2.a > 20));
Query Plan
========================================================
|ID|OPERATOR                |NAME|EST.ROWS|EST.TIME(us)|
--------------------------------------------------------
|0 |DELETE                  |    |8       |53          |
|1 |└─SORT                  |    |8       |7           |
|2 |  └─SUBPLAN FILTER      |    |8       |5           |
|3 |    ├─TABLE FULL SCAN   |t1  |8       |3           |
|4 |    └─SCALAR GROUP BY   |    |1       |3           |
|5 |      └─TABLE RANGE SCAN|t2  |1       |3           |
========================================================
Outputs & filters:
-------------------------------------
  0 - output(nil), filter(nil)
      table_columns([{t1: ({t1: (t1.a, t1.b, t1.c)})}])
  1 - output([t1.a], [t1.b], [t1.c]), filter(nil), rowset=16
      sort_keys([t1.c > ANY(subquery(1)), ASC])
  2 - output([t1.a], [t1.b], [t1.c], [t1.c > ANY(subquery(1))]), filter(nil), rowset=16
      exec_params_(nil), onetime_exprs_(nil), init_plan_idxs_([1]), use_batch=false
  3 - output([t1.a], [t1.b], [t1.c]), filter(nil), rowset=16
      access([t1.a], [t1.b], [t1.c]), partitions(p0)
      is_index_back=false, is_global_index=false, 
      range_key([t1.a]), range(MIN ; MAX)always true
  4 - output([T_FUN_MAX(T_FUN_MAX(t2.c))]), filter(nil), rowset=16
      group(nil), agg_func([T_FUN_MAX(T_FUN_MAX(t2.c))])
  5 - output([T_FUN_MAX(t2.c)]), filter(nil), rowset=16
      access([t2.c]), partitions(p0)
      is_index_back=false, is_global_index=false, 
      range_key([t2.a]), range(20 ; MAX), 
      range_cond([t2.a > 20]), 
      pushdown_aggregation([T_FUN_MAX(t2.c)])
delete /*+NO_REWRITE*/from t1 order by (t1.c > any (select max(t2.c) from t2 where t2.a > 20));
select/**/ * from t1;
a	b	c
rollback;
EXPLAIN insert into is_c3 select * from t1 order by (t1.c > any (select max(t2.c) from t2 where t2.a > 20));
Query Plan
=====================================================================
|ID|OPERATOR                  |NAME           |EST.ROWS|EST.TIME(us)|
---------------------------------------------------------------------
|0 |INSERT                    |               |8       |64          |
|1 |└─SUBPLAN SCAN            |ANONYMOUS_VIEW1|8       |7           |
|2 |  └─SORT                  |               |8       |7           |
|3 |    └─SUBPLAN FILTER      |               |8       |5           |
|4 |      ├─TABLE FULL SCAN   |t1             |8       |3           |
|5 |      └─SCALAR GROUP BY   |               |1       |3           |
|6 |        └─TABLE RANGE SCAN|t2             |1       |3           |
=====================================================================
Outputs & filters:
-------------------------------------
  0 - output(nil), filter(nil)
      columns([{is_c3: ({is_c3: (is_c3.__pk_increment, is_c3.a, is_c3.b, is_c3.c)})}]), partitions(p0), 
      column_values([T_HIDDEN_PK], [column_conv(INT,PS:(11,0),NULL,ANONYMOUS_VIEW1.a)], [column_conv(INT,PS:(11,0),NULL,ANONYMOUS_VIEW1.b)], [column_conv(INT,
      PS:(11,0),NULL,ANONYMOUS_VIEW1.c)])
  1 - output([ANONYMOUS_VIEW1.a], [ANONYMOUS_VIEW1.b], [ANONYMOUS_VIEW1.c]), filter(nil), rowset=16
      access([ANONYMOUS_VIEW1.a], [ANONYMOUS_VIEW1.b], [ANONYMOUS_VIEW1.c])
  2 - output([t1.a], [t1.b], [t1.c]), filter(nil), rowset=16
      sort_keys([t1.c > :0, ASC])
  3 - output([t1.c > :0], [t1.a], [t1.b], [t1.c]), filter(nil), rowset=16
      exec_params_(nil), onetime_exprs_([subquery(1)(:0)]), init_plan_idxs_(nil), use_batch=false
  4 - output([t1.a], [t1.b], [t1.c]), filter(nil), rowset=16
      access([t1.a], [t1.b], [t1.c]), partitions(p0)
      is_index_back=false, is_global_index=false, 
      range_key([t1.a]), range(MIN ; MAX)always true
  5 - output([T_FUN_MAX(T_FUN_MAX(t2.c))]), filter(nil), rowset=16
      group(nil), agg_func([T_FUN_MAX(T_FUN_MAX(t2.c))])
  6 - output([T_FUN_MAX(t2.c)]), filter(nil), rowset=16
      access([t2.c]), partitions(p0)
      is_index_back=false, is_global_index=false, 
      range_key([t2.a]), range(20 ; MAX), 
      range_cond([t2.a > 20]), 
      pushdown_aggregation([T_FUN_MAX(t2.c)])
insert into is_c3 select * from t1 order by (t1.c > any (select max(t2.c) from t2 where t2.a > 20));
select/**/ * from is_c3;
a	b	c
1	1	0
2	2	1
3	3	0
4	4	1
5	5	0
6	6	1
7	7	0
8	8	1
rollback;
EXPLAIN insert into is_c3 select /*+NO_REWRITE*/* from t1 order by (t1.c > any (select max(t2.c) from t2 where t2.a > 20));
Query Plan
=====================================================================
|ID|OPERATOR                  |NAME           |EST.ROWS|EST.TIME(us)|
---------------------------------------------------------------------
|0 |INSERT                    |               |8       |64          |
|1 |└─SUBPLAN SCAN            |ANONYMOUS_VIEW1|8       |7           |
|2 |  └─SORT                  |               |8       |7           |
|3 |    └─SUBPLAN FILTER      |               |8       |5           |
|4 |      ├─TABLE FULL SCAN   |t1             |8       |3           |
|5 |      └─SCALAR GROUP BY   |               |1       |3           |
|6 |        └─TABLE RANGE SCAN|t2             |1       |3           |
=====================================================================
Outputs & filters:
-------------------------------------
  0 - output(nil), filter(nil)
      columns([{is_c3: ({is_c3: (is_c3.__pk_increment, is_c3.a, is_c3.b, is_c3.c)})}]), partitions(p0), 
      column_values([T_HIDDEN_PK], [column_conv(INT,PS:(11,0),NULL,ANONYMOUS_VIEW1.a)], [column_conv(INT,PS:(11,0),NULL,ANONYMOUS_VIEW1.b)], [column_conv(INT,
      PS:(11,0),NULL,ANONYMOUS_VIEW1.c)])
  1 - output([ANONYMOUS_VIEW1.a], [ANONYMOUS_VIEW1.b], [ANONYMOUS_VIEW1.c]), filter(nil), rowset=16
      access([ANONYMOUS_VIEW1.a], [ANONYMOUS_VIEW1.b], [ANONYMOUS_VIEW1.c])
  2 - output([t1.a], [t1.b], [t1.c]), filter(nil), rowset=16
      sort_keys([t1.c > ANY(subquery(1)), ASC])
  3 - output([t1.c > ANY(subquery(1))], [t1.a], [t1.b], [t1.c]), filter(nil), rowset=16
      exec_params_(nil), onetime_exprs_(nil), init_plan_idxs_([1]), use_batch=false
  4 - output([t1.a], [t1.b], [t1.c]), filter(nil), rowset=16
      access([t1.a], [t1.b], [t1.c]), partitions(p0)
      is_index_back=false, is_global_index=false, 
      range_key([t1.a]), range(MIN ; MAX)always true
  5 - output([T_FUN_MAX(T_FUN_MAX(t2.c))]), filter(nil), rowset=16
      group(nil), agg_func([T_FUN_MAX(T_FUN_MAX(t2.c))])
  6 - output([T_FUN_MAX(t2.c)]), filter(nil), rowset=16
      access([t2.c]), partitions(p0)
      is_index_back=false, is_global_index=false, 
      range_key([t2.a]), range(20 ; MAX), 
      range_cond([t2.a > 20]), 
      pushdown_aggregation([T_FUN_MAX(t2.c)])
insert into is_c3 select /*+NO_REWRITE*/* from t1 order by (t1.c > any (select max(t2.c) from t2 where t2.a > 20));
select/**/ * from is_c3;
a	b	c
1	1	0
2	2	1
3	3	0
4	4	1
5	5	0
6	6	1
7	7	0
8	8	1
rollback;


# case 58
EXPLAIN select * from t1 order by (t1.c > all (select max(t2.c) from t2 where t2.a > 20));
Query Plan
======================================================
|ID|OPERATOR              |NAME|EST.ROWS|EST.TIME(us)|
------------------------------------------------------
|0 |SORT                  |    |8       |7           |
|1 |└─SUBPLAN FILTER      |    |8       |5           |
|2 |  ├─TABLE FULL SCAN   |t1  |8       |3           |
|3 |  └─SCALAR GROUP BY   |    |1       |3           |
|4 |    └─TABLE RANGE SCAN|t2  |1       |3           |
======================================================
Outputs & filters:
-------------------------------------
  0 - output([t1.a], [t1.b], [t1.c]), filter(nil), rowset=16
      sort_keys([t1.c > :0, ASC])
  1 - output([t1.c > :0], [t1.a], [t1.b], [t1.c]), filter(nil), rowset=16
      exec_params_(nil), onetime_exprs_([subquery(1)(:0)]), init_plan_idxs_(nil), use_batch=false
  2 - output([t1.a], [t1.b], [t1.c]), filter(nil), rowset=16
      access([t1.a], [t1.b], [t1.c]), partitions(p0)
      is_index_back=false, is_global_index=false, 
      range_key([t1.a]), range(MIN ; MAX)always true
  3 - output([T_FUN_MAX(T_FUN_MAX(t2.c))]), filter(nil), rowset=16
      group(nil), agg_func([T_FUN_MAX(T_FUN_MAX(t2.c))])
  4 - output([T_FUN_MAX(t2.c)]), filter(nil), rowset=16
      access([t2.c]), partitions(p0)
      is_index_back=false, is_global_index=false, 
      range_key([t2.a]), range(20 ; MAX), 
      range_cond([t2.a > 20]), 
      pushdown_aggregation([T_FUN_MAX(t2.c)])
select * from t1 order by (t1.c > all (select max(t2.c) from t2 where t2.a > 20));
a	b	c
1	1	0
2	2	1
3	3	0
4	4	1
5	5	0
6	6	1
7	7	0
8	8	1
EXPLAIN select /*+NO_REWRITE*/* from t1 order by (t1.c > all (select max(t2.c) from t2 where t2.a > 20));
Query Plan
======================================================
|ID|OPERATOR              |NAME|EST.ROWS|EST.TIME(us)|
------------------------------------------------------
|0 |SORT                  |    |8       |7           |
|1 |└─SUBPLAN FILTER      |    |8       |5           |
|2 |  ├─TABLE FULL SCAN   |t1  |8       |3           |
|3 |  └─SCALAR GROUP BY   |    |1       |3           |
|4 |    └─TABLE RANGE SCAN|t2  |1       |3           |
======================================================
Outputs & filters:
-------------------------------------
  0 - output([t1.a], [t1.b], [t1.c]), filter(nil), rowset=16
      sort_keys([t1.c > ALL(subquery(1)), ASC])
  1 - output([t1.c > ALL(subquery(1))], [t1.a], [t1.b], [t1.c]), filter(nil), rowset=16
      exec_params_(nil), onetime_exprs_(nil), init_plan_idxs_([1]), use_batch=false
  2 - output([t1.a], [t1.b], [t1.c]), filter(nil), rowset=16
      access([t1.a], [t1.b], [t1.c]), partitions(p0)
      is_index_back=false, is_global_index=false, 
      range_key([t1.a]), range(MIN ; MAX)always true
  3 - output([T_FUN_MAX(T_FUN_MAX(t2.c))]), filter(nil), rowset=16
      group(nil), agg_func([T_FUN_MAX(T_FUN_MAX(t2.c))])
  4 - output([T_FUN_MAX(t2.c)]), filter(nil), rowset=16
      access([t2.c]), partitions(p0)
      is_index_back=false, is_global_index=false, 
      range_key([t2.a]), range(20 ; MAX), 
      range_cond([t2.a > 20]), 
      pushdown_aggregation([T_FUN_MAX(t2.c)])
select /*+NO_REWRITE*/* from t1 order by (t1.c > all (select max(t2.c) from t2 where t2.a > 20));
a	b	c
1	1	0
2	2	1
3	3	0
4	4	1
5	5	0
6	6	1
7	7	0
8	8	1
EXPLAIN update t1 set b = b + 1 order by (t1.c > all (select max(t2.c) from t2 where t2.a > 20));
Query Plan
========================================================
|ID|OPERATOR                |NAME|EST.ROWS|EST.TIME(us)|
--------------------------------------------------------
|0 |UPDATE                  |    |8       |91          |
|1 |└─SORT                  |    |8       |7           |
|2 |  └─SUBPLAN FILTER      |    |8       |5           |
|3 |    ├─TABLE FULL SCAN   |t1  |8       |3           |
|4 |    └─SCALAR GROUP BY   |    |1       |3           |
|5 |      └─TABLE RANGE SCAN|t2  |1       |3           |
========================================================
Outputs & filters:
-------------------------------------
  0 - output(nil), filter(nil)
      table_columns([{t1: ({t1: (t1.a, t1.b, t1.c)})}]),
      update([t1.b=column_conv(INT,PS:(11,0),NULL,cast(t1.b + 1, INT(-1, 0)))])
  1 - output([t1.a], [t1.b], [t1.c]), filter(nil), rowset=16
      sort_keys([t1.c > :0, ASC])
  2 - output([t1.a], [t1.b], [t1.c], [t1.c > :0]), filter(nil), rowset=16
      exec_params_(nil), onetime_exprs_([subquery(1)(:0)]), init_plan_idxs_(nil), use_batch=false
  3 - output([t1.a], [t1.b], [t1.c]), filter(nil), rowset=16
      access([t1.a], [t1.b], [t1.c]), partitions(p0)
      is_index_back=false, is_global_index=false, 
      range_key([t1.a]), range(MIN ; MAX)always true
  4 - output([T_FUN_MAX(T_FUN_MAX(t2.c))]), filter(nil), rowset=16
      group(nil), agg_func([T_FUN_MAX(T_FUN_MAX(t2.c))])
  5 - output([T_FUN_MAX(t2.c)]), filter(nil), rowset=16
      access([t2.c]), partitions(p0)
      is_index_back=false, is_global_index=false, 
      range_key([t2.a]), range(20 ; MAX), 
      range_cond([t2.a > 20]), 
      pushdown_aggregation([T_FUN_MAX(t2.c)])
update t1 set b = b + 1 order by (t1.c > all (select max(t2.c) from t2 where t2.a > 20));
select/**/ * from t1;
a	b	c
1	2	0
2	3	1
3	4	0
4	5	1
5	6	0
6	7	1
7	8	0
8	9	1
rollback;
EXPLAIN update /*+NO_REWRITE*/t1 set b = b + 1 order by (t1.c > all (select max(t2.c) from t2 where t2.a > 20));
Query Plan
========================================================
|ID|OPERATOR                |NAME|EST.ROWS|EST.TIME(us)|
--------------------------------------------------------
|0 |UPDATE                  |    |8       |91          |
|1 |└─SORT                  |    |8       |7           |
|2 |  └─SUBPLAN FILTER      |    |8       |5           |
|3 |    ├─TABLE FULL SCAN   |t1  |8       |3           |
|4 |    └─SCALAR GROUP BY   |    |1       |3           |
|5 |      └─TABLE RANGE SCAN|t2  |1       |3           |
========================================================
Outputs & filters:
-------------------------------------
  0 - output(nil), filter(nil)
      table_columns([{t1: ({t1: (t1.a, t1.b, t1.c)})}]),
      update([t1.b=column_conv(INT,PS:(11,0),NULL,cast(t1.b + 1, INT(-1, 0)))])
  1 - output([t1.a], [t1.b], [t1.c]), filter(nil), rowset=16
      sort_keys([t1.c > ALL(subquery(1)), ASC])
  2 - output([t1.a], [t1.b], [t1.c], [t1.c > ALL(subquery(1))]), filter(nil), rowset=16
      exec_params_(nil), onetime_exprs_(nil), init_plan_idxs_([1]), use_batch=false
  3 - output([t1.a], [t1.b], [t1.c]), filter(nil), rowset=16
      access([t1.a], [t1.b], [t1.c]), partitions(p0)
      is_index_back=false, is_global_index=false, 
      range_key([t1.a]), range(MIN ; MAX)always true
  4 - output([T_FUN_MAX(T_FUN_MAX(t2.c))]), filter(nil), rowset=16
      group(nil), agg_func([T_FUN_MAX(T_FUN_MAX(t2.c))])
  5 - output([T_FUN_MAX(t2.c)]), filter(nil), rowset=16
      access([t2.c]), partitions(p0)
      is_index_back=false, is_global_index=false, 
      range_key([t2.a]), range(20 ; MAX), 
      range_cond([t2.a > 20]), 
      pushdown_aggregation([T_FUN_MAX(t2.c)])
update /*+NO_REWRITE*/t1 set b = b + 1 order by (t1.c > all (select max(t2.c) from t2 where t2.a > 20));
select/**/ * from t1;
a	b	c
1	2	0
2	3	1
3	4	0
4	5	1
5	6	0
6	7	1
7	8	0
8	9	1
rollback;
EXPLAIN delete from t1 order by (t1.c > all (select max(t2.c) from t2 where t2.a > 20));
Query Plan
========================================================
|ID|OPERATOR                |NAME|EST.ROWS|EST.TIME(us)|
--------------------------------------------------------
|0 |DELETE                  |    |8       |53          |
|1 |└─SORT                  |    |8       |7           |
|2 |  └─SUBPLAN FILTER      |    |8       |5           |
|3 |    ├─TABLE FULL SCAN   |t1  |8       |3           |
|4 |    └─SCALAR GROUP BY   |    |1       |3           |
|5 |      └─TABLE RANGE SCAN|t2  |1       |3           |
========================================================
Outputs & filters:
-------------------------------------
  0 - output(nil), filter(nil)
      table_columns([{t1: ({t1: (t1.a, t1.b, t1.c)})}])
  1 - output([t1.a], [t1.b], [t1.c]), filter(nil), rowset=16
      sort_keys([t1.c > :0, ASC])
  2 - output([t1.a], [t1.b], [t1.c], [t1.c > :0]), filter(nil), rowset=16
      exec_params_(nil), onetime_exprs_([subquery(1)(:0)]), init_plan_idxs_(nil), use_batch=false
  3 - output([t1.a], [t1.b], [t1.c]), filter(nil), rowset=16
      access([t1.a], [t1.b], [t1.c]), partitions(p0)
      is_index_back=false, is_global_index=false, 
      range_key([t1.a]), range(MIN ; MAX)always true
  4 - output([T_FUN_MAX(T_FUN_MAX(t2.c))]), filter(nil), rowset=16
      group(nil), agg_func([T_FUN_MAX(T_FUN_MAX(t2.c))])
  5 - output([T_FUN_MAX(t2.c)]), filter(nil), rowset=16
      access([t2.c]), partitions(p0)
      is_index_back=false, is_global_index=false, 
      range_key([t2.a]), range(20 ; MAX), 
      range_cond([t2.a > 20]), 
      pushdown_aggregation([T_FUN_MAX(t2.c)])
delete from t1 order by (t1.c > all (select max(t2.c) from t2 where t2.a > 20));
select/**/ * from t1;
a	b	c
rollback;
EXPLAIN delete /*+NO_REWRITE*/from t1 order by (t1.c > all (select max(t2.c) from t2 where t2.a > 20));
Query Plan
========================================================
|ID|OPERATOR                |NAME|EST.ROWS|EST.TIME(us)|
--------------------------------------------------------
|0 |DELETE                  |    |8       |53          |
|1 |└─SORT                  |    |8       |7           |
|2 |  └─SUBPLAN FILTER      |    |8       |5           |
|3 |    ├─TABLE FULL SCAN   |t1  |8       |3           |
|4 |    └─SCALAR GROUP BY   |    |1       |3           |
|5 |      └─TABLE RANGE SCAN|t2  |1       |3           |
========================================================
Outputs & filters:
-------------------------------------
  0 - output(nil), filter(nil)
      table_columns([{t1: ({t1: (t1.a, t1.b, t1.c)})}])
  1 - output([t1.a], [t1.b], [t1.c]), filter(nil), rowset=16
      sort_keys([t1.c > ALL(subquery(1)), ASC])
  2 - output([t1.a], [t1.b], [t1.c], [t1.c > ALL(subquery(1))]), filter(nil), rowset=16
      exec_params_(nil), onetime_exprs_(nil), init_plan_idxs_([1]), use_batch=false
  3 - output([t1.a], [t1.b], [t1.c]), filter(nil), rowset=16
      access([t1.a], [t1.b], [t1.c]), partitions(p0)
      is_index_back=false, is_global_index=false, 
      range_key([t1.a]), range(MIN ; MAX)always true
  4 - output([T_FUN_MAX(T_FUN_MAX(t2.c))]), filter(nil), rowset=16
      group(nil), agg_func([T_FUN_MAX(T_FUN_MAX(t2.c))])
  5 - output([T_FUN_MAX(t2.c)]), filter(nil), rowset=16
      access([t2.c]), partitions(p0)
      is_index_back=false, is_global_index=false, 
      range_key([t2.a]), range(20 ; MAX), 
      range_cond([t2.a > 20]), 
      pushdown_aggregation([T_FUN_MAX(t2.c)])
delete /*+NO_REWRITE*/from t1 order by (t1.c > all (select max(t2.c) from t2 where t2.a > 20));
select/**/ * from t1;
a	b	c
rollback;
EXPLAIN insert into is_c3 select * from t1 order by (t1.c > all (select max(t2.c) from t2 where t2.a > 20));
Query Plan
=====================================================================
|ID|OPERATOR                  |NAME           |EST.ROWS|EST.TIME(us)|
---------------------------------------------------------------------
|0 |INSERT                    |               |8       |64          |
|1 |└─SUBPLAN SCAN            |ANONYMOUS_VIEW1|8       |7           |
|2 |  └─SORT                  |               |8       |7           |
|3 |    └─SUBPLAN FILTER      |               |8       |5           |
|4 |      ├─TABLE FULL SCAN   |t1             |8       |3           |
|5 |      └─SCALAR GROUP BY   |               |1       |3           |
|6 |        └─TABLE RANGE SCAN|t2             |1       |3           |
=====================================================================
Outputs & filters:
-------------------------------------
  0 - output(nil), filter(nil)
      columns([{is_c3: ({is_c3: (is_c3.__pk_increment, is_c3.a, is_c3.b, is_c3.c)})}]), partitions(p0), 
      column_values([T_HIDDEN_PK], [column_conv(INT,PS:(11,0),NULL,ANONYMOUS_VIEW1.a)], [column_conv(INT,PS:(11,0),NULL,ANONYMOUS_VIEW1.b)], [column_conv(INT,
      PS:(11,0),NULL,ANONYMOUS_VIEW1.c)])
  1 - output([ANONYMOUS_VIEW1.a], [ANONYMOUS_VIEW1.b], [ANONYMOUS_VIEW1.c]), filter(nil), rowset=16
      access([ANONYMOUS_VIEW1.a], [ANONYMOUS_VIEW1.b], [ANONYMOUS_VIEW1.c])
  2 - output([t1.a], [t1.b], [t1.c]), filter(nil), rowset=16
      sort_keys([t1.c > :0, ASC])
  3 - output([t1.c > :0], [t1.a], [t1.b], [t1.c]), filter(nil), rowset=16
      exec_params_(nil), onetime_exprs_([subquery(1)(:0)]), init_plan_idxs_(nil), use_batch=false
  4 - output([t1.a], [t1.b], [t1.c]), filter(nil), rowset=16
      access([t1.a], [t1.b], [t1.c]), partitions(p0)
      is_index_back=false, is_global_index=false, 
      range_key([t1.a]), range(MIN ; MAX)always true
  5 - output([T_FUN_MAX(T_FUN_MAX(t2.c))]), filter(nil), rowset=16
      group(nil), agg_func([T_FUN_MAX(T_FUN_MAX(t2.c))])
  6 - output([T_FUN_MAX(t2.c)]), filter(nil), rowset=16
      access([t2.c]), partitions(p0)
      is_index_back=false, is_global_index=false, 
      range_key([t2.a]), range(20 ; MAX), 
      range_cond([t2.a > 20]), 
      pushdown_aggregation([T_FUN_MAX(t2.c)])
insert into is_c3 select * from t1 order by (t1.c > all (select max(t2.c) from t2 where t2.a > 20));
select/**/ * from is_c3;
a	b	c
1	1	0
2	2	1
3	3	0
4	4	1
5	5	0
6	6	1
7	7	0
8	8	1
rollback;
EXPLAIN insert into is_c3 select /*+NO_REWRITE*/* from t1 order by (t1.c > all (select max(t2.c) from t2 where t2.a > 20));
Query Plan
=====================================================================
|ID|OPERATOR                  |NAME           |EST.ROWS|EST.TIME(us)|
---------------------------------------------------------------------
|0 |INSERT                    |               |8       |64          |
|1 |└─SUBPLAN SCAN            |ANONYMOUS_VIEW1|8       |7           |
|2 |  └─SORT                  |               |8       |7           |
|3 |    └─SUBPLAN FILTER      |               |8       |5           |
|4 |      ├─TABLE FULL SCAN   |t1             |8       |3           |
|5 |      └─SCALAR GROUP BY   |               |1       |3           |
|6 |        └─TABLE RANGE SCAN|t2             |1       |3           |
=====================================================================
Outputs & filters:
-------------------------------------
  0 - output(nil), filter(nil)
      columns([{is_c3: ({is_c3: (is_c3.__pk_increment, is_c3.a, is_c3.b, is_c3.c)})}]), partitions(p0), 
      column_values([T_HIDDEN_PK], [column_conv(INT,PS:(11,0),NULL,ANONYMOUS_VIEW1.a)], [column_conv(INT,PS:(11,0),NULL,ANONYMOUS_VIEW1.b)], [column_conv(INT,
      PS:(11,0),NULL,ANONYMOUS_VIEW1.c)])
  1 - output([ANONYMOUS_VIEW1.a], [ANONYMOUS_VIEW1.b], [ANONYMOUS_VIEW1.c]), filter(nil), rowset=16
      access([ANONYMOUS_VIEW1.a], [ANONYMOUS_VIEW1.b], [ANONYMOUS_VIEW1.c])
  2 - output([t1.a], [t1.b], [t1.c]), filter(nil), rowset=16
      sort_keys([t1.c > ALL(subquery(1)), ASC])
  3 - output([t1.c > ALL(subquery(1))], [t1.a], [t1.b], [t1.c]), filter(nil), rowset=16
      exec_params_(nil), onetime_exprs_(nil), init_plan_idxs_([1]), use_batch=false
  4 - output([t1.a], [t1.b], [t1.c]), filter(nil), rowset=16
      access([t1.a], [t1.b], [t1.c]), partitions(p0)
      is_index_back=false, is_global_index=false, 
      range_key([t1.a]), range(MIN ; MAX)always true
  5 - output([T_FUN_MAX(T_FUN_MAX(t2.c))]), filter(nil), rowset=16
      group(nil), agg_func([T_FUN_MAX(T_FUN_MAX(t2.c))])
  6 - output([T_FUN_MAX(t2.c)]), filter(nil), rowset=16
      access([t2.c]), partitions(p0)
      is_index_back=false, is_global_index=false, 
      range_key([t2.a]), range(20 ; MAX), 
      range_cond([t2.a > 20]), 
      pushdown_aggregation([T_FUN_MAX(t2.c)])
insert into is_c3 select /*+NO_REWRITE*/* from t1 order by (t1.c > all (select max(t2.c) from t2 where t2.a > 20));
select/**/ * from is_c3;
a	b	c
1	1	0
2	2	1
3	3	0
4	4	1
5	5	0
6	6	1
7	7	0
8	8	1
rollback;


# case 59
EXPLAIN select /*+NO_REWRITE*/ count(*) from t1 group by (t1.c > any (select count(*) from t2 where t2.a > 20));
Query Plan
======================================================
|ID|OPERATOR              |NAME|EST.ROWS|EST.TIME(us)|
------------------------------------------------------
|0 |HASH GROUP BY         |    |2       |6           |
|1 |└─SUBPLAN FILTER      |    |8       |5           |
|2 |  ├─TABLE FULL SCAN   |t1  |8       |3           |
|3 |  └─SCALAR GROUP BY   |    |1       |3           |
|4 |    └─TABLE RANGE SCAN|t2  |1       |3           |
======================================================
Outputs & filters:
-------------------------------------
  0 - output([T_FUN_COUNT(*)]), filter(nil), rowset=16
      group([t1.c > ANY(subquery(1))]), agg_func([T_FUN_COUNT(*)])
  1 - output([t1.c > ANY(subquery(1))]), filter(nil), rowset=16
      exec_params_(nil), onetime_exprs_(nil), init_plan_idxs_([1]), use_batch=false
  2 - output([t1.c]), filter(nil), rowset=16
      access([t1.c]), partitions(p0)
      is_index_back=false, is_global_index=false, 
      range_key([t1.a]), range(MIN ; MAX)always true
  3 - output([T_FUN_COUNT_SUM(T_FUN_COUNT(*))]), filter(nil), rowset=16
      group(nil), agg_func([T_FUN_COUNT_SUM(T_FUN_COUNT(*))])
  4 - output([T_FUN_COUNT(*)]), filter(nil), rowset=16
      access(nil), partitions(p0)
      is_index_back=false, is_global_index=false, 
      range_key([t2.a]), range(20 ; MAX), 
      range_cond([t2.a > 20]), 
      pushdown_aggregation([T_FUN_COUNT(*)])
select /*+NO_REWRITE*/ count(*) from t1 group by (t1.c > any (select count(*) from t2 where t2.a > 20));
count(*)
4
4
EXPLAIN select count(*) from t1 group by (t1.c > any (select count(*) from t2 where t2.a > 20));
Query Plan
==============================================================
|ID|OPERATOR                     |NAME |EST.ROWS|EST.TIME(us)|
--------------------------------------------------------------
|0 |HASH GROUP BY                |     |2       |7           |
|1 |└─NESTED-LOOP JOIN CARTESIAN |     |8       |6           |
|2 |  ├─SUBPLAN SCAN             |VIEW1|1       |3           |
|3 |  │ └─SCALAR GROUP BY        |     |1       |3           |
|4 |  │   └─TABLE RANGE SCAN     |t2   |1       |3           |
|5 |  └─TABLE FULL SCAN          |t1   |8       |3           |
==============================================================
Outputs & filters:
-------------------------------------
  0 - output([T_FUN_COUNT(*)]), filter(nil), rowset=16
      group([t1.c > VIEW1.count(*)]), agg_func([T_FUN_COUNT(*)])
  1 - output([VIEW1.count(*)], [t1.c]), filter(nil), rowset=16
      conds(nil), nl_params_(nil), use_batch=false
  2 - output([VIEW1.count(*)]), filter(nil), rowset=16
      access([VIEW1.count(*)])
  3 - output([T_FUN_COUNT_SUM(T_FUN_COUNT(*))]), filter(nil), rowset=16
      group(nil), agg_func([T_FUN_COUNT_SUM(T_FUN_COUNT(*))])
  4 - output([T_FUN_COUNT(*)]), filter(nil), rowset=16
      access(nil), partitions(p0)
      is_index_back=false, is_global_index=false, 
      range_key([t2.a]), range(20 ; MAX), 
      range_cond([t2.a > 20]), 
      pushdown_aggregation([T_FUN_COUNT(*)])
  5 - output([t1.c]), filter(nil), rowset=16
      access([t1.c]), partitions(p0)
      is_index_back=false, is_global_index=false, 
      range_key([t1.a]), range(MIN ; MAX)always true
select count(*) from t1 group by (t1.c > any (select count(*) from t2 where t2.a > 20));
count(*)
4
4


# case 60
EXPLAIN select /*+NO_REWRITE*/ count(*) from t1 group by (t1.c > all (select count(*) from t2 where t2.a > 20));
Query Plan
======================================================
|ID|OPERATOR              |NAME|EST.ROWS|EST.TIME(us)|
------------------------------------------------------
|0 |HASH GROUP BY         |    |2       |6           |
|1 |└─SUBPLAN FILTER      |    |8       |5           |
|2 |  ├─TABLE FULL SCAN   |t1  |8       |3           |
|3 |  └─SCALAR GROUP BY   |    |1       |3           |
|4 |    └─TABLE RANGE SCAN|t2  |1       |3           |
======================================================
Outputs & filters:
-------------------------------------
  0 - output([T_FUN_COUNT(*)]), filter(nil), rowset=16
      group([t1.c > ALL(subquery(1))]), agg_func([T_FUN_COUNT(*)])
  1 - output([t1.c > ALL(subquery(1))]), filter(nil), rowset=16
      exec_params_(nil), onetime_exprs_(nil), init_plan_idxs_([1]), use_batch=false
  2 - output([t1.c]), filter(nil), rowset=16
      access([t1.c]), partitions(p0)
      is_index_back=false, is_global_index=false, 
      range_key([t1.a]), range(MIN ; MAX)always true
  3 - output([T_FUN_COUNT_SUM(T_FUN_COUNT(*))]), filter(nil), rowset=16
      group(nil), agg_func([T_FUN_COUNT_SUM(T_FUN_COUNT(*))])
  4 - output([T_FUN_COUNT(*)]), filter(nil), rowset=16
      access(nil), partitions(p0)
      is_index_back=false, is_global_index=false, 
      range_key([t2.a]), range(20 ; MAX), 
      range_cond([t2.a > 20]), 
      pushdown_aggregation([T_FUN_COUNT(*)])
select /*+NO_REWRITE*/ count(*) from t1 group by (t1.c > all (select count(*) from t2 where t2.a > 20));
count(*)
4
4
EXPLAIN select count(*) from t1 group by (t1.c > all (select count(*) from t2 where t2.a > 20));
Query Plan
==============================================================
|ID|OPERATOR                     |NAME |EST.ROWS|EST.TIME(us)|
--------------------------------------------------------------
|0 |HASH GROUP BY                |     |2       |7           |
|1 |└─NESTED-LOOP JOIN CARTESIAN |     |8       |6           |
|2 |  ├─SUBPLAN SCAN             |VIEW1|1       |3           |
|3 |  │ └─SCALAR GROUP BY        |     |1       |3           |
|4 |  │   └─TABLE RANGE SCAN     |t2   |1       |3           |
|5 |  └─TABLE FULL SCAN          |t1   |8       |3           |
==============================================================
Outputs & filters:
-------------------------------------
  0 - output([T_FUN_COUNT(*)]), filter(nil), rowset=16
      group([t1.c > VIEW1.count(*)]), agg_func([T_FUN_COUNT(*)])
  1 - output([VIEW1.count(*)], [t1.c]), filter(nil), rowset=16
      conds(nil), nl_params_(nil), use_batch=false
  2 - output([VIEW1.count(*)]), filter(nil), rowset=16
      access([VIEW1.count(*)])
  3 - output([T_FUN_COUNT_SUM(T_FUN_COUNT(*))]), filter(nil), rowset=16
      group(nil), agg_func([T_FUN_COUNT_SUM(T_FUN_COUNT(*))])
  4 - output([T_FUN_COUNT(*)]), filter(nil), rowset=16
      access(nil), partitions(p0)
      is_index_back=false, is_global_index=false, 
      range_key([t2.a]), range(20 ; MAX), 
      range_cond([t2.a > 20]), 
      pushdown_aggregation([T_FUN_COUNT(*)])
  5 - output([t1.c]), filter(nil), rowset=16
      access([t1.c]), partitions(p0)
      is_index_back=false, is_global_index=false, 
      range_key([t1.a]), range(MIN ; MAX)always true
select count(*) from t1 group by (t1.c > all (select count(*) from t2 where t2.a > 20));
count(*)
4
4


# case 61
EXPLAIN select /*+NO_REWRITE*/ count(*) from t1 group by (t1.c > any (select max(t2.c) from t2 where t2.a > 20));
Query Plan
======================================================
|ID|OPERATOR              |NAME|EST.ROWS|EST.TIME(us)|
------------------------------------------------------
|0 |HASH GROUP BY         |    |2       |6           |
|1 |└─SUBPLAN FILTER      |    |8       |5           |
|2 |  ├─TABLE FULL SCAN   |t1  |8       |3           |
|3 |  └─SCALAR GROUP BY   |    |1       |3           |
|4 |    └─TABLE RANGE SCAN|t2  |1       |3           |
======================================================
Outputs & filters:
-------------------------------------
  0 - output([T_FUN_COUNT(*)]), filter(nil), rowset=16
      group([t1.c > ANY(subquery(1))]), agg_func([T_FUN_COUNT(*)])
  1 - output([t1.c > ANY(subquery(1))]), filter(nil), rowset=16
      exec_params_(nil), onetime_exprs_(nil), init_plan_idxs_([1]), use_batch=false
  2 - output([t1.c]), filter(nil), rowset=16
      access([t1.c]), partitions(p0)
      is_index_back=false, is_global_index=false, 
      range_key([t1.a]), range(MIN ; MAX)always true
  3 - output([T_FUN_MAX(T_FUN_MAX(t2.c))]), filter(nil), rowset=16
      group(nil), agg_func([T_FUN_MAX(T_FUN_MAX(t2.c))])
  4 - output([T_FUN_MAX(t2.c)]), filter(nil), rowset=16
      access([t2.c]), partitions(p0)
      is_index_back=false, is_global_index=false, 
      range_key([t2.a]), range(20 ; MAX), 
      range_cond([t2.a > 20]), 
      pushdown_aggregation([T_FUN_MAX(t2.c)])
select /*+NO_REWRITE*/ count(*) from t1 group by (t1.c > any (select max(t2.c) from t2 where t2.a > 20));
count(*)
8
EXPLAIN select count(*) from t1 group by (t1.c > any (select max(t2.c) from t2 where t2.a > 20));
Query Plan
==============================================================
|ID|OPERATOR                     |NAME |EST.ROWS|EST.TIME(us)|
--------------------------------------------------------------
|0 |HASH GROUP BY                |     |2       |7           |
|1 |└─NESTED-LOOP JOIN CARTESIAN |     |8       |6           |
|2 |  ├─SUBPLAN SCAN             |VIEW1|1       |3           |
|3 |  │ └─SCALAR GROUP BY        |     |1       |3           |
|4 |  │   └─TABLE RANGE SCAN     |t2   |1       |3           |
|5 |  └─TABLE FULL SCAN          |t1   |8       |3           |
==============================================================
Outputs & filters:
-------------------------------------
  0 - output([T_FUN_COUNT(*)]), filter(nil), rowset=16
      group([t1.c > VIEW1.max(t2.c)]), agg_func([T_FUN_COUNT(*)])
  1 - output([VIEW1.max(t2.c)], [t1.c]), filter(nil), rowset=16
      conds(nil), nl_params_(nil), use_batch=false
  2 - output([VIEW1.max(t2.c)]), filter(nil), rowset=16
      access([VIEW1.max(t2.c)])
  3 - output([T_FUN_MAX(T_FUN_MAX(t2.c))]), filter(nil), rowset=16
      group(nil), agg_func([T_FUN_MAX(T_FUN_MAX(t2.c))])
  4 - output([T_FUN_MAX(t2.c)]), filter(nil), rowset=16
      access([t2.c]), partitions(p0)
      is_index_back=false, is_global_index=false, 
      range_key([t2.a]), range(20 ; MAX), 
      range_cond([t2.a > 20]), 
      pushdown_aggregation([T_FUN_MAX(t2.c)])
  5 - output([t1.c]), filter(nil), rowset=16
      access([t1.c]), partitions(p0)
      is_index_back=false, is_global_index=false, 
      range_key([t1.a]), range(MIN ; MAX)always true
select count(*) from t1 group by (t1.c > any (select max(t2.c) from t2 where t2.a > 20));
count(*)
8


# case 62
EXPLAIN select /*+NO_REWRITE*/ count(*) from t1 group by (t1.c > all (select max(t2.c) from t2 where t2.a > 20));
Query Plan
======================================================
|ID|OPERATOR              |NAME|EST.ROWS|EST.TIME(us)|
------------------------------------------------------
|0 |HASH GROUP BY         |    |2       |6           |
|1 |└─SUBPLAN FILTER      |    |8       |5           |
|2 |  ├─TABLE FULL SCAN   |t1  |8       |3           |
|3 |  └─SCALAR GROUP BY   |    |1       |3           |
|4 |    └─TABLE RANGE SCAN|t2  |1       |3           |
======================================================
Outputs & filters:
-------------------------------------
  0 - output([T_FUN_COUNT(*)]), filter(nil), rowset=16
      group([t1.c > ALL(subquery(1))]), agg_func([T_FUN_COUNT(*)])
  1 - output([t1.c > ALL(subquery(1))]), filter(nil), rowset=16
      exec_params_(nil), onetime_exprs_(nil), init_plan_idxs_([1]), use_batch=false
  2 - output([t1.c]), filter(nil), rowset=16
      access([t1.c]), partitions(p0)
      is_index_back=false, is_global_index=false, 
      range_key([t1.a]), range(MIN ; MAX)always true
  3 - output([T_FUN_MAX(T_FUN_MAX(t2.c))]), filter(nil), rowset=16
      group(nil), agg_func([T_FUN_MAX(T_FUN_MAX(t2.c))])
  4 - output([T_FUN_MAX(t2.c)]), filter(nil), rowset=16
      access([t2.c]), partitions(p0)
      is_index_back=false, is_global_index=false, 
      range_key([t2.a]), range(20 ; MAX), 
      range_cond([t2.a > 20]), 
      pushdown_aggregation([T_FUN_MAX(t2.c)])
select /*+NO_REWRITE*/ count(*) from t1 group by (t1.c > all (select max(t2.c) from t2 where t2.a > 20));
count(*)
8
EXPLAIN select count(*) from t1 group by (t1.c > all (select max(t2.c) from t2 where t2.a > 20));
Query Plan
==============================================================
|ID|OPERATOR                     |NAME |EST.ROWS|EST.TIME(us)|
--------------------------------------------------------------
|0 |HASH GROUP BY                |     |2       |7           |
|1 |└─NESTED-LOOP JOIN CARTESIAN |     |8       |6           |
|2 |  ├─SUBPLAN SCAN             |VIEW1|1       |3           |
|3 |  │ └─SCALAR GROUP BY        |     |1       |3           |
|4 |  │   └─TABLE RANGE SCAN     |t2   |1       |3           |
|5 |  └─TABLE FULL SCAN          |t1   |8       |3           |
==============================================================
Outputs & filters:
-------------------------------------
  0 - output([T_FUN_COUNT(*)]), filter(nil), rowset=16
      group([t1.c > VIEW1.max(t2.c)]), agg_func([T_FUN_COUNT(*)])
  1 - output([VIEW1.max(t2.c)], [t1.c]), filter(nil), rowset=16
      conds(nil), nl_params_(nil), use_batch=false
  2 - output([VIEW1.max(t2.c)]), filter(nil), rowset=16
      access([VIEW1.max(t2.c)])
  3 - output([T_FUN_MAX(T_FUN_MAX(t2.c))]), filter(nil), rowset=16
      group(nil), agg_func([T_FUN_MAX(T_FUN_MAX(t2.c))])
  4 - output([T_FUN_MAX(t2.c)]), filter(nil), rowset=16
      access([t2.c]), partitions(p0)
      is_index_back=false, is_global_index=false, 
      range_key([t2.a]), range(20 ; MAX), 
      range_cond([t2.a > 20]), 
      pushdown_aggregation([T_FUN_MAX(t2.c)])
  5 - output([t1.c]), filter(nil), rowset=16
      access([t1.c]), partitions(p0)
      is_index_back=false, is_global_index=false, 
      range_key([t1.a]), range(MIN ; MAX)always true
select count(*) from t1 group by (t1.c > all (select max(t2.c) from t2 where t2.a > 20));
count(*)
8


# case 63
EXPLAIN select /*+NO_REWRITE*/ max(t1.b) from t1 group by t1.c having max(t1.b) > any (select count(t2.a) from t2 where t2.a > 20);
Query Plan
====================================================
|ID|OPERATOR            |NAME|EST.ROWS|EST.TIME(us)|
----------------------------------------------------
|0 |SUBPLAN FILTER      |    |1       |6           |
|1 |├─HASH GROUP BY     |    |2       |4           |
|2 |│ └─TABLE FULL SCAN |t1  |8       |3           |
|3 |└─SCALAR GROUP BY   |    |1       |3           |
|4 |  └─TABLE RANGE SCAN|t2  |1       |3           |
====================================================
Outputs & filters:
-------------------------------------
  0 - output([T_FUN_MAX(t1.b)]), filter([T_FUN_MAX(t1.b) > ANY(subquery(1))]), rowset=16
      exec_params_(nil), onetime_exprs_(nil), init_plan_idxs_([1]), use_batch=false
  1 - output([T_FUN_MAX(t1.b)]), filter(nil), rowset=16
      group([t1.c]), agg_func([T_FUN_MAX(t1.b)])
  2 - output([t1.b], [t1.c]), filter(nil), rowset=16
      access([t1.b], [t1.c]), partitions(p0)
      is_index_back=false, is_global_index=false, 
      range_key([t1.a]), range(MIN ; MAX)always true
  3 - output([T_FUN_COUNT_SUM(T_FUN_COUNT(t2.a))]), filter(nil), rowset=16
      group(nil), agg_func([T_FUN_COUNT_SUM(T_FUN_COUNT(t2.a))])
  4 - output([T_FUN_COUNT(t2.a)]), filter(nil), rowset=16
      access([t2.a]), partitions(p0)
      is_index_back=false, is_global_index=false, 
      range_key([t2.a]), range(20 ; MAX), 
      range_cond([t2.a > 20]), 
      pushdown_aggregation([T_FUN_COUNT(t2.a)])
select /*+NO_REWRITE*/ max(t1.b) from t1 group by t1.c having max(t1.b) > any (select count(t2.a) from t2 where t2.a > 20);
max(t1.b)
7
8
EXPLAIN select max(t1.b) from t1 group by t1.c having max(t1.b) > any (select count(t2.a) from t2 where t2.a > 20);
Query Plan
=======================================================
|ID|OPERATOR              |NAME |EST.ROWS|EST.TIME(us)|
-------------------------------------------------------
|0 |NESTED-LOOP JOIN      |     |1       |7           |
|1 |├─SUBPLAN SCAN        |VIEW2|1       |3           |
|2 |│ └─SCALAR GROUP BY   |     |1       |3           |
|3 |│   └─TABLE RANGE SCAN|t2   |1       |3           |
|4 |└─SUBPLAN SCAN        |VIEW1|2       |4           |
|5 |  └─HASH GROUP BY     |     |2       |4           |
|6 |    └─TABLE FULL SCAN |t1   |8       |3           |
=======================================================
Outputs & filters:
-------------------------------------
  0 - output([VIEW1.T_FUN_MAX(t1.b)]), filter(nil), rowset=16
      conds([VIEW1.T_FUN_MAX(t1.b) > VIEW2.count(t2.a)]), nl_params_(nil), use_batch=false
  1 - output([VIEW2.count(t2.a)]), filter(nil), rowset=16
      access([VIEW2.count(t2.a)])
  2 - output([T_FUN_COUNT_SUM(T_FUN_COUNT(t2.a))]), filter(nil), rowset=16
      group(nil), agg_func([T_FUN_COUNT_SUM(T_FUN_COUNT(t2.a))])
  3 - output([T_FUN_COUNT(t2.a)]), filter(nil), rowset=16
      access([t2.a]), partitions(p0)
      is_index_back=false, is_global_index=false, 
      range_key([t2.a]), range(20 ; MAX), 
      range_cond([t2.a > 20]), 
      pushdown_aggregation([T_FUN_COUNT(t2.a)])
  4 - output([VIEW1.T_FUN_MAX(t1.b)]), filter(nil), rowset=16
      access([VIEW1.T_FUN_MAX(t1.b)])
  5 - output([T_FUN_MAX(t1.b)]), filter(nil), rowset=16
      group([t1.c]), agg_func([T_FUN_MAX(t1.b)])
  6 - output([t1.b], [t1.c]), filter(nil), rowset=16
      access([t1.b], [t1.c]), partitions(p0)
      is_index_back=false, is_global_index=false, 
      range_key([t1.a]), range(MIN ; MAX)always true
select max(t1.b) from t1 group by t1.c having max(t1.b) > any (select count(t2.a) from t2 where t2.a > 20);
max(t1.b)
7
8


# case 64
EXPLAIN select /*+NO_REWRITE*/ max(t1.b) from t1 group by t1.c having max(t1.b) > all (select count(t2.a) from t2 where t2.a > 20);
Query Plan
====================================================
|ID|OPERATOR            |NAME|EST.ROWS|EST.TIME(us)|
----------------------------------------------------
|0 |SUBPLAN FILTER      |    |1       |6           |
|1 |├─HASH GROUP BY     |    |2       |4           |
|2 |│ └─TABLE FULL SCAN |t1  |8       |3           |
|3 |└─SCALAR GROUP BY   |    |1       |3           |
|4 |  └─TABLE RANGE SCAN|t2  |1       |3           |
====================================================
Outputs & filters:
-------------------------------------
  0 - output([T_FUN_MAX(t1.b)]), filter([T_FUN_MAX(t1.b) > ALL(subquery(1))]), rowset=16
      exec_params_(nil), onetime_exprs_(nil), init_plan_idxs_([1]), use_batch=false
  1 - output([T_FUN_MAX(t1.b)]), filter(nil), rowset=16
      group([t1.c]), agg_func([T_FUN_MAX(t1.b)])
  2 - output([t1.b], [t1.c]), filter(nil), rowset=16
      access([t1.b], [t1.c]), partitions(p0)
      is_index_back=false, is_global_index=false, 
      range_key([t1.a]), range(MIN ; MAX)always true
  3 - output([T_FUN_COUNT_SUM(T_FUN_COUNT(t2.a))]), filter(nil), rowset=16
      group(nil), agg_func([T_FUN_COUNT_SUM(T_FUN_COUNT(t2.a))])
  4 - output([T_FUN_COUNT(t2.a)]), filter(nil), rowset=16
      access([t2.a]), partitions(p0)
      is_index_back=false, is_global_index=false, 
      range_key([t2.a]), range(20 ; MAX), 
      range_cond([t2.a > 20]), 
      pushdown_aggregation([T_FUN_COUNT(t2.a)])
select /*+NO_REWRITE*/ max(t1.b) from t1 group by t1.c having max(t1.b) > all (select count(t2.a) from t2 where t2.a > 20);
max(t1.b)
7
8
EXPLAIN select max(t1.b) from t1 group by t1.c having max(t1.b) > all (select count(t2.a) from t2 where t2.a > 20);
Query Plan
=======================================================
|ID|OPERATOR              |NAME |EST.ROWS|EST.TIME(us)|
-------------------------------------------------------
|0 |NESTED-LOOP JOIN      |     |1       |7           |
|1 |├─SUBPLAN SCAN        |VIEW2|1       |3           |
|2 |│ └─SCALAR GROUP BY   |     |1       |3           |
|3 |│   └─TABLE RANGE SCAN|t2   |1       |3           |
|4 |└─SUBPLAN SCAN        |VIEW1|2       |4           |
|5 |  └─HASH GROUP BY     |     |2       |4           |
|6 |    └─TABLE FULL SCAN |t1   |8       |3           |
=======================================================
Outputs & filters:
-------------------------------------
  0 - output([VIEW1.T_FUN_MAX(t1.b)]), filter(nil), rowset=16
      conds([VIEW1.T_FUN_MAX(t1.b) > VIEW2.count(t2.a)]), nl_params_(nil), use_batch=false
  1 - output([VIEW2.count(t2.a)]), filter(nil), rowset=16
      access([VIEW2.count(t2.a)])
  2 - output([T_FUN_COUNT_SUM(T_FUN_COUNT(t2.a))]), filter(nil), rowset=16
      group(nil), agg_func([T_FUN_COUNT_SUM(T_FUN_COUNT(t2.a))])
  3 - output([T_FUN_COUNT(t2.a)]), filter(nil), rowset=16
      access([t2.a]), partitions(p0)
      is_index_back=false, is_global_index=false, 
      range_key([t2.a]), range(20 ; MAX), 
      range_cond([t2.a > 20]), 
      pushdown_aggregation([T_FUN_COUNT(t2.a)])
  4 - output([VIEW1.T_FUN_MAX(t1.b)]), filter(nil), rowset=16
      access([VIEW1.T_FUN_MAX(t1.b)])
  5 - output([T_FUN_MAX(t1.b)]), filter(nil), rowset=16
      group([t1.c]), agg_func([T_FUN_MAX(t1.b)])
  6 - output([t1.b], [t1.c]), filter(nil), rowset=16
      access([t1.b], [t1.c]), partitions(p0)
      is_index_back=false, is_global_index=false, 
      range_key([t1.a]), range(MIN ; MAX)always true
select max(t1.b) from t1 group by t1.c having max(t1.b) > all (select count(t2.a) from t2 where t2.a > 20);
max(t1.b)
7
8


# case 65
EXPLAIN select /*+NO_REWRITE*/ max(t1.b) from t1 group by t1.c having max(t1.b) > any (select max(t2.a) from t2 where t2.a > 20);
Query Plan
=============================================================
|ID|OPERATOR              |NAME       |EST.ROWS|EST.TIME(us)|
-------------------------------------------------------------
|0 |SUBPLAN FILTER        |           |1       |6           |
|1 |├─HASH GROUP BY       |           |2       |4           |
|2 |│ └─TABLE FULL SCAN   |t1         |8       |3           |
|3 |└─SCALAR GROUP BY     |           |1       |3           |
|4 |  └─SUBPLAN SCAN      |VIEW1      |1       |3           |
|5 |    └─TABLE RANGE SCAN|t2(Reverse)|1       |3           |
=============================================================
Outputs & filters:
-------------------------------------
  0 - output([T_FUN_MAX(t1.b)]), filter([T_FUN_MAX(t1.b) > ANY(subquery(1))]), rowset=16
      exec_params_(nil), onetime_exprs_(nil), init_plan_idxs_([1]), use_batch=false
  1 - output([T_FUN_MAX(t1.b)]), filter(nil), rowset=16
      group([t1.c]), agg_func([T_FUN_MAX(t1.b)])
  2 - output([t1.b], [t1.c]), filter(nil), rowset=16
      access([t1.b], [t1.c]), partitions(p0)
      is_index_back=false, is_global_index=false, 
      range_key([t1.a]), range(MIN ; MAX)always true
  3 - output([T_FUN_MAX(VIEW1.t2.a)]), filter(nil), rowset=16
      group(nil), agg_func([T_FUN_MAX(VIEW1.t2.a)])
  4 - output([VIEW1.t2.a]), filter(nil), rowset=16
      access([VIEW1.t2.a])
  5 - output([t2.a]), filter(nil), rowset=16
      access([t2.a]), partitions(p0)
      limit(1), offset(nil), is_index_back=false, is_global_index=false, 
      range_key([t2.a]), range(20 ; MAX), 
      range_cond([t2.a > 20])
select /*+NO_REWRITE*/ max(t1.b) from t1 group by t1.c having max(t1.b) > any (select max(t2.a) from t2 where t2.a > 20);
max(t1.b)
EXPLAIN select max(t1.b) from t1 group by t1.c having max(t1.b) > any (select max(t2.a) from t2 where t2.a > 20);
Query Plan
===============================================================
|ID|OPERATOR                |NAME       |EST.ROWS|EST.TIME(us)|
---------------------------------------------------------------
|0 |NESTED-LOOP JOIN        |           |1       |7           |
|1 |├─SUBPLAN SCAN          |VIEW2      |1       |3           |
|2 |│ └─SCALAR GROUP BY     |           |1       |3           |
|3 |│   └─SUBPLAN SCAN      |VIEW3      |1       |3           |
|4 |│     └─TABLE RANGE SCAN|t2(Reverse)|1       |3           |
|5 |└─SUBPLAN SCAN          |VIEW1      |2       |4           |
|6 |  └─HASH GROUP BY       |           |2       |4           |
|7 |    └─TABLE FULL SCAN   |t1         |8       |3           |
===============================================================
Outputs & filters:
-------------------------------------
  0 - output([VIEW1.T_FUN_MAX(t1.b)]), filter(nil), rowset=16
      conds([VIEW1.T_FUN_MAX(t1.b) > VIEW2.max(t2.a)]), nl_params_(nil), use_batch=false
  1 - output([VIEW2.max(t2.a)]), filter(nil), rowset=16
      access([VIEW2.max(t2.a)])
  2 - output([T_FUN_MAX(VIEW3.t2.a)]), filter(nil), rowset=16
      group(nil), agg_func([T_FUN_MAX(VIEW3.t2.a)])
  3 - output([VIEW3.t2.a]), filter(nil), rowset=16
      access([VIEW3.t2.a])
  4 - output([t2.a]), filter(nil), rowset=16
      access([t2.a]), partitions(p0)
      limit(1), offset(nil), is_index_back=false, is_global_index=false, 
      range_key([t2.a]), range(20 ; MAX), 
      range_cond([t2.a > 20])
  5 - output([VIEW1.T_FUN_MAX(t1.b)]), filter(nil), rowset=16
      access([VIEW1.T_FUN_MAX(t1.b)])
  6 - output([T_FUN_MAX(t1.b)]), filter(nil), rowset=16
      group([t1.c]), agg_func([T_FUN_MAX(t1.b)])
  7 - output([t1.b], [t1.c]), filter(nil), rowset=16
      access([t1.b], [t1.c]), partitions(p0)
      is_index_back=false, is_global_index=false, 
      range_key([t1.a]), range(MIN ; MAX)always true
select max(t1.b) from t1 group by t1.c having max(t1.b) > any (select max(t2.a) from t2 where t2.a > 20);
max(t1.b)


# case 66
EXPLAIN select /*+NO_REWRITE*/ max(t1.b) from t1 group by t1.c having max(t1.b) > all (select max(t2.a) from t2 where t2.a > 20);
Query Plan
=============================================================
|ID|OPERATOR              |NAME       |EST.ROWS|EST.TIME(us)|
-------------------------------------------------------------
|0 |SUBPLAN FILTER        |           |1       |6           |
|1 |├─HASH GROUP BY       |           |2       |4           |
|2 |│ └─TABLE FULL SCAN   |t1         |8       |3           |
|3 |└─SCALAR GROUP BY     |           |1       |3           |
|4 |  └─SUBPLAN SCAN      |VIEW1      |1       |3           |
|5 |    └─TABLE RANGE SCAN|t2(Reverse)|1       |3           |
=============================================================
Outputs & filters:
-------------------------------------
  0 - output([T_FUN_MAX(t1.b)]), filter([T_FUN_MAX(t1.b) > ALL(subquery(1))]), rowset=16
      exec_params_(nil), onetime_exprs_(nil), init_plan_idxs_([1]), use_batch=false
  1 - output([T_FUN_MAX(t1.b)]), filter(nil), rowset=16
      group([t1.c]), agg_func([T_FUN_MAX(t1.b)])
  2 - output([t1.b], [t1.c]), filter(nil), rowset=16
      access([t1.b], [t1.c]), partitions(p0)
      is_index_back=false, is_global_index=false, 
      range_key([t1.a]), range(MIN ; MAX)always true
  3 - output([T_FUN_MAX(VIEW1.t2.a)]), filter(nil), rowset=16
      group(nil), agg_func([T_FUN_MAX(VIEW1.t2.a)])
  4 - output([VIEW1.t2.a]), filter(nil), rowset=16
      access([VIEW1.t2.a])
  5 - output([t2.a]), filter(nil), rowset=16
      access([t2.a]), partitions(p0)
      limit(1), offset(nil), is_index_back=false, is_global_index=false, 
      range_key([t2.a]), range(20 ; MAX), 
      range_cond([t2.a > 20])
select /*+NO_REWRITE*/ max(t1.b) from t1 group by t1.c having max(t1.b) > all (select max(t2.a) from t2 where t2.a > 20);
max(t1.b)
EXPLAIN select max(t1.b) from t1 group by t1.c having max(t1.b) > all (select max(t2.a) from t2 where t2.a > 20);
Query Plan
===============================================================
|ID|OPERATOR                |NAME       |EST.ROWS|EST.TIME(us)|
---------------------------------------------------------------
|0 |NESTED-LOOP JOIN        |           |1       |7           |
|1 |├─SUBPLAN SCAN          |VIEW2      |1       |3           |
|2 |│ └─SCALAR GROUP BY     |           |1       |3           |
|3 |│   └─SUBPLAN SCAN      |VIEW3      |1       |3           |
|4 |│     └─TABLE RANGE SCAN|t2(Reverse)|1       |3           |
|5 |└─SUBPLAN SCAN          |VIEW1      |2       |4           |
|6 |  └─HASH GROUP BY       |           |2       |4           |
|7 |    └─TABLE FULL SCAN   |t1         |8       |3           |
===============================================================
Outputs & filters:
-------------------------------------
  0 - output([VIEW1.T_FUN_MAX(t1.b)]), filter(nil), rowset=16
      conds([VIEW1.T_FUN_MAX(t1.b) > VIEW2.max(t2.a)]), nl_params_(nil), use_batch=false
  1 - output([VIEW2.max(t2.a)]), filter(nil), rowset=16
      access([VIEW2.max(t2.a)])
  2 - output([T_FUN_MAX(VIEW3.t2.a)]), filter(nil), rowset=16
      group(nil), agg_func([T_FUN_MAX(VIEW3.t2.a)])
  3 - output([VIEW3.t2.a]), filter(nil), rowset=16
      access([VIEW3.t2.a])
  4 - output([t2.a]), filter(nil), rowset=16
      access([t2.a]), partitions(p0)
      limit(1), offset(nil), is_index_back=false, is_global_index=false, 
      range_key([t2.a]), range(20 ; MAX), 
      range_cond([t2.a > 20])
  5 - output([VIEW1.T_FUN_MAX(t1.b)]), filter(nil), rowset=16
      access([VIEW1.T_FUN_MAX(t1.b)])
  6 - output([T_FUN_MAX(t1.b)]), filter(nil), rowset=16
      group([t1.c]), agg_func([T_FUN_MAX(t1.b)])
  7 - output([t1.b], [t1.c]), filter(nil), rowset=16
      access([t1.b], [t1.c]), partitions(p0)
      is_index_back=false, is_global_index=false, 
      range_key([t1.a]), range(MIN ; MAX)always true
select max(t1.b) from t1 group by t1.c having max(t1.b) > all (select max(t2.a) from t2 where t2.a > 20);
max(t1.b)

## aggr 子查询，any 空集, all 空集

# case 67
EXPLAIN select * from t1 where t1.b > any (select count(*) from t2 having count(*) > 1);
Query Plan
======================================================
|ID|OPERATOR             |NAME |EST.ROWS|EST.TIME(us)|
------------------------------------------------------
|0 |NESTED-LOOP JOIN     |     |1       |7           |
|1 |├─SUBPLAN SCAN       |VIEW1|1       |3           |
|2 |│ └─SCALAR GROUP BY  |     |1       |3           |
|3 |│   └─TABLE FULL SCAN|t2   |8       |3           |
|4 |└─TABLE FULL SCAN    |t1   |8       |3           |
======================================================
Outputs & filters:
-------------------------------------
  0 - output([t1.a], [t1.b], [t1.c]), filter(nil), rowset=16
      conds([t1.b > VIEW1.count(*)]), nl_params_(nil), use_batch=false
  1 - output([VIEW1.count(*)]), filter(nil), rowset=16
      access([VIEW1.count(*)])
  2 - output([T_FUN_COUNT_SUM(T_FUN_COUNT(*))]), filter([T_FUN_COUNT_SUM(T_FUN_COUNT(*)) > 1]), rowset=16
      group(nil), agg_func([T_FUN_COUNT_SUM(T_FUN_COUNT(*))])
  3 - output([T_FUN_COUNT(*)]), filter(nil), rowset=16
      access(nil), partitions(p0)
      is_index_back=false, is_global_index=false, 
      range_key([t2.a]), range(MIN ; MAX)always true, 
      pushdown_aggregation([T_FUN_COUNT(*)])
  4 - output([t1.a], [t1.b], [t1.c]), filter([t1.b > 1]), rowset=16
      access([t1.a], [t1.b], [t1.c]), partitions(p0)
      is_index_back=false, is_global_index=false, filter_before_indexback[false], 
      range_key([t1.a]), range(MIN ; MAX)always true
select * from t1 where t1.b > any (select count(*) from t2 having count(*) > 1);
a	b	c
EXPLAIN select /*+NO_REWRITE*/* from t1 where t1.b > any (select count(*) from t2 having count(*) > 1);
Query Plan
===================================================
|ID|OPERATOR           |NAME|EST.ROWS|EST.TIME(us)|
---------------------------------------------------
|0 |SUBPLAN FILTER     |    |4       |5           |
|1 |├─TABLE FULL SCAN  |t1  |8       |3           |
|2 |└─SCALAR GROUP BY  |    |1       |3           |
|3 |  └─TABLE FULL SCAN|t2  |8       |3           |
===================================================
Outputs & filters:
-------------------------------------
  0 - output([t1.a], [t1.b], [t1.c]), filter([t1.b > ANY(subquery(1))]), rowset=16
      exec_params_(nil), onetime_exprs_(nil), init_plan_idxs_([1]), use_batch=false
  1 - output([t1.a], [t1.b], [t1.c]), filter(nil), rowset=16
      access([t1.a], [t1.b], [t1.c]), partitions(p0)
      is_index_back=false, is_global_index=false, 
      range_key([t1.a]), range(MIN ; MAX)always true
  2 - output([T_FUN_COUNT_SUM(T_FUN_COUNT(*))]), filter([T_FUN_COUNT_SUM(T_FUN_COUNT(*)) > 1]), rowset=16
      group(nil), agg_func([T_FUN_COUNT_SUM(T_FUN_COUNT(*))])
  3 - output([T_FUN_COUNT(*)]), filter(nil), rowset=16
      access(nil), partitions(p0)
      is_index_back=false, is_global_index=false, 
      range_key([t2.a]), range(MIN ; MAX)always true, 
      pushdown_aggregation([T_FUN_COUNT(*)])
select /*+NO_REWRITE*/* from t1 where t1.b > any (select count(*) from t2 having count(*) > 1);
a	b	c
EXPLAIN update t1 set b = b + 1 where t1.b > any (select count(*) from t2 having count(*) > 1);
Query Plan
========================================================
|ID|OPERATOR               |NAME |EST.ROWS|EST.TIME(us)|
--------------------------------------------------------
|0 |UPDATE                 |     |1       |31          |
|1 |└─NESTED-LOOP JOIN     |     |1       |7           |
|2 |  ├─SUBPLAN SCAN       |VIEW1|1       |3           |
|3 |  │ └─SCALAR GROUP BY  |     |1       |3           |
|4 |  │   └─TABLE FULL SCAN|t2   |8       |3           |
|5 |  └─TABLE FULL SCAN    |t1   |8       |3           |
========================================================
Outputs & filters:
-------------------------------------
  0 - output(nil), filter(nil)
      table_columns([{t1: ({t1: (t1.a, t1.b, t1.c)}), hash_distinct}]),
      update([t1.b=column_conv(INT,PS:(11,0),NULL,cast(t1.b + 1, INT(-1, 0)))])
  1 - output([t1.a], [t1.b], [t1.c]), filter(nil), rowset=16
      conds([t1.b > VIEW1.count(*)]), nl_params_(nil), use_batch=false
  2 - output([VIEW1.count(*)]), filter(nil), rowset=16
      access([VIEW1.count(*)])
  3 - output([T_FUN_COUNT_SUM(T_FUN_COUNT(*))]), filter([T_FUN_COUNT_SUM(T_FUN_COUNT(*)) > 1]), rowset=16
      group(nil), agg_func([T_FUN_COUNT_SUM(T_FUN_COUNT(*))])
  4 - output([T_FUN_COUNT(*)]), filter(nil), rowset=16
      access(nil), partitions(p0)
      is_index_back=false, is_global_index=false, 
      range_key([t2.a]), range(MIN ; MAX)always true, 
      pushdown_aggregation([T_FUN_COUNT(*)])
  5 - output([t1.a], [t1.b], [t1.c]), filter([t1.b > 1]), rowset=16
      access([t1.a], [t1.b], [t1.c]), partitions(p0)
      is_index_back=false, is_global_index=false, filter_before_indexback[false], 
      range_key([t1.a]), range(MIN ; MAX)always true
update t1 set b = b + 1 where t1.b > any (select count(*) from t2 having count(*) > 1);
select/**/ * from t1;
a	b	c
1	1	0
2	2	1
3	3	0
4	4	1
5	5	0
6	6	1
7	7	0
8	8	1
rollback;
EXPLAIN update /*+NO_REWRITE*/t1 set b = b + 1 where t1.b > any (select count(*) from t2 having count(*) > 1);
Query Plan
=====================================================
|ID|OPERATOR             |NAME|EST.ROWS|EST.TIME(us)|
-----------------------------------------------------
|0 |UPDATE               |    |4       |60          |
|1 |└─SUBPLAN FILTER     |    |4       |5           |
|2 |  ├─TABLE FULL SCAN  |t1  |8       |3           |
|3 |  └─SCALAR GROUP BY  |    |1       |3           |
|4 |    └─TABLE FULL SCAN|t2  |8       |3           |
=====================================================
Outputs & filters:
-------------------------------------
  0 - output(nil), filter(nil)
      table_columns([{t1: ({t1: (t1.a, t1.b, t1.c)})}]),
      update([t1.b=column_conv(INT,PS:(11,0),NULL,cast(t1.b + 1, INT(-1, 0)))])
  1 - output([t1.a], [t1.b], [t1.c]), filter([t1.b > ANY(subquery(1))]), rowset=16
      exec_params_(nil), onetime_exprs_(nil), init_plan_idxs_([1]), use_batch=false
  2 - output([t1.a], [t1.b], [t1.c]), filter(nil), rowset=16
      access([t1.a], [t1.b], [t1.c]), partitions(p0)
      is_index_back=false, is_global_index=false, 
      range_key([t1.a]), range(MIN ; MAX)always true
  3 - output([T_FUN_COUNT_SUM(T_FUN_COUNT(*))]), filter([T_FUN_COUNT_SUM(T_FUN_COUNT(*)) > 1]), rowset=16
      group(nil), agg_func([T_FUN_COUNT_SUM(T_FUN_COUNT(*))])
  4 - output([T_FUN_COUNT(*)]), filter(nil), rowset=16
      access(nil), partitions(p0)
      is_index_back=false, is_global_index=false, 
      range_key([t2.a]), range(MIN ; MAX)always true, 
      pushdown_aggregation([T_FUN_COUNT(*)])
update /*+NO_REWRITE*/t1 set b = b + 1 where t1.b > any (select count(*) from t2 having count(*) > 1);
select/**/ * from t1;
a	b	c
1	1	0
2	2	1
3	3	0
4	4	1
5	5	0
6	6	1
7	7	0
8	8	1
rollback;
EXPLAIN delete from t1 where t1.b > any (select count(*) from t2 having count(*) > 1);
Query Plan
========================================================
|ID|OPERATOR               |NAME |EST.ROWS|EST.TIME(us)|
--------------------------------------------------------
|0 |DELETE                 |     |1       |13          |
|1 |└─NESTED-LOOP JOIN     |     |1       |7           |
|2 |  ├─SUBPLAN SCAN       |VIEW1|1       |3           |
|3 |  │ └─SCALAR GROUP BY  |     |1       |3           |
|4 |  │   └─TABLE FULL SCAN|t2   |8       |3           |
|5 |  └─TABLE FULL SCAN    |t1   |8       |3           |
========================================================
Outputs & filters:
-------------------------------------
  0 - output(nil), filter(nil)
      table_columns([{t1: ({t1: (t1.a, t1.b, t1.c)}), hash_distinct}])
  1 - output([t1.a], [t1.b], [t1.c]), filter(nil), rowset=16
      conds([t1.b > VIEW1.count(*)]), nl_params_(nil), use_batch=false
  2 - output([VIEW1.count(*)]), filter(nil), rowset=16
      access([VIEW1.count(*)])
  3 - output([T_FUN_COUNT_SUM(T_FUN_COUNT(*))]), filter([T_FUN_COUNT_SUM(T_FUN_COUNT(*)) > 1]), rowset=16
      group(nil), agg_func([T_FUN_COUNT_SUM(T_FUN_COUNT(*))])
  4 - output([T_FUN_COUNT(*)]), filter(nil), rowset=16
      access(nil), partitions(p0)
      is_index_back=false, is_global_index=false, 
      range_key([t2.a]), range(MIN ; MAX)always true, 
      pushdown_aggregation([T_FUN_COUNT(*)])
  5 - output([t1.a], [t1.b], [t1.c]), filter([t1.b > 1]), rowset=16
      access([t1.a], [t1.b], [t1.c]), partitions(p0)
      is_index_back=false, is_global_index=false, filter_before_indexback[false], 
      range_key([t1.a]), range(MIN ; MAX)always true
delete from t1 where t1.b > any (select count(*) from t2 having count(*) > 1);
select/**/ * from t1;
a	b	c
1	1	0
2	2	1
3	3	0
4	4	1
5	5	0
6	6	1
7	7	0
8	8	1
rollback;
EXPLAIN delete /*+NO_REWRITE*/ from t1 where t1.b > any (select count(*) from t2 having count(*) > 1);
Query Plan
=====================================================
|ID|OPERATOR             |NAME|EST.ROWS|EST.TIME(us)|
-----------------------------------------------------
|0 |DELETE               |    |4       |32          |
|1 |└─SUBPLAN FILTER     |    |4       |5           |
|2 |  ├─TABLE FULL SCAN  |t1  |8       |3           |
|3 |  └─SCALAR GROUP BY  |    |1       |3           |
|4 |    └─TABLE FULL SCAN|t2  |8       |3           |
=====================================================
Outputs & filters:
-------------------------------------
  0 - output(nil), filter(nil)
      table_columns([{t1: ({t1: (t1.a, t1.b, t1.c)})}])
  1 - output([t1.a], [t1.b], [t1.c]), filter([t1.b > ANY(subquery(1))]), rowset=16
      exec_params_(nil), onetime_exprs_(nil), init_plan_idxs_([1]), use_batch=false
  2 - output([t1.a], [t1.b], [t1.c]), filter(nil), rowset=16
      access([t1.a], [t1.b], [t1.c]), partitions(p0)
      is_index_back=false, is_global_index=false, 
      range_key([t1.a]), range(MIN ; MAX)always true
  3 - output([T_FUN_COUNT_SUM(T_FUN_COUNT(*))]), filter([T_FUN_COUNT_SUM(T_FUN_COUNT(*)) > 1]), rowset=16
      group(nil), agg_func([T_FUN_COUNT_SUM(T_FUN_COUNT(*))])
  4 - output([T_FUN_COUNT(*)]), filter(nil), rowset=16
      access(nil), partitions(p0)
      is_index_back=false, is_global_index=false, 
      range_key([t2.a]), range(MIN ; MAX)always true, 
      pushdown_aggregation([T_FUN_COUNT(*)])
delete /*+NO_REWRITE*/ from t1 where t1.b > any (select count(*) from t2 having count(*) > 1);
select/**/ * from t1;
a	b	c
1	1	0
2	2	1
3	3	0
4	4	1
5	5	0
6	6	1
7	7	0
8	8	1
rollback;
EXPLAIN insert into is_c3 select * from t1 where t1.b > any (select count(*) from t2 having count(*) > 1);
Query Plan
====================================================================
|ID|OPERATOR                 |NAME           |EST.ROWS|EST.TIME(us)|
--------------------------------------------------------------------
|0 |INSERT                   |               |1       |14          |
|1 |└─SUBPLAN SCAN           |ANONYMOUS_VIEW1|1       |7           |
|2 |  └─NESTED-LOOP JOIN     |               |1       |7           |
|3 |    ├─SUBPLAN SCAN       |VIEW1          |1       |3           |
|4 |    │ └─SCALAR GROUP BY  |               |1       |3           |
|5 |    │   └─TABLE FULL SCAN|t2             |8       |3           |
|6 |    └─TABLE FULL SCAN    |t1             |8       |3           |
====================================================================
Outputs & filters:
-------------------------------------
  0 - output(nil), filter(nil)
      columns([{is_c3: ({is_c3: (is_c3.__pk_increment, is_c3.a, is_c3.b, is_c3.c)})}]), partitions(p0), 
      column_values([T_HIDDEN_PK], [column_conv(INT,PS:(11,0),NULL,ANONYMOUS_VIEW1.a)], [column_conv(INT,PS:(11,0),NULL,ANONYMOUS_VIEW1.b)], [column_conv(INT,
      PS:(11,0),NULL,ANONYMOUS_VIEW1.c)])
  1 - output([ANONYMOUS_VIEW1.a], [ANONYMOUS_VIEW1.b], [ANONYMOUS_VIEW1.c]), filter(nil), rowset=16
      access([ANONYMOUS_VIEW1.a], [ANONYMOUS_VIEW1.b], [ANONYMOUS_VIEW1.c])
  2 - output([t1.a], [t1.b], [t1.c]), filter(nil), rowset=16
      conds([t1.b > VIEW1.count(*)]), nl_params_(nil), use_batch=false
  3 - output([VIEW1.count(*)]), filter(nil), rowset=16
      access([VIEW1.count(*)])
  4 - output([T_FUN_COUNT_SUM(T_FUN_COUNT(*))]), filter([T_FUN_COUNT_SUM(T_FUN_COUNT(*)) > 1]), rowset=16
      group(nil), agg_func([T_FUN_COUNT_SUM(T_FUN_COUNT(*))])
  5 - output([T_FUN_COUNT(*)]), filter(nil), rowset=16
      access(nil), partitions(p0)
      is_index_back=false, is_global_index=false, 
      range_key([t2.a]), range(MIN ; MAX)always true, 
      pushdown_aggregation([T_FUN_COUNT(*)])
  6 - output([t1.a], [t1.b], [t1.c]), filter([t1.b > 1]), rowset=16
      access([t1.a], [t1.b], [t1.c]), partitions(p0)
      is_index_back=false, is_global_index=false, filter_before_indexback[false], 
      range_key([t1.a]), range(MIN ; MAX)always true
insert into is_c3 select * from t1 where t1.b > any (select count(*) from t2 having count(*) > 1);
select/**/ * from is_c3;
a	b	c
rollback;
EXPLAIN insert into is_c3 select /*+NO_REWRITE*/* from t1 where t1.b > any (select count(*) from t2 having count(*) > 1);
Query Plan
==================================================================
|ID|OPERATOR               |NAME           |EST.ROWS|EST.TIME(us)|
------------------------------------------------------------------
|0 |INSERT                 |               |4       |37          |
|1 |└─SUBPLAN SCAN         |ANONYMOUS_VIEW1|4       |5           |
|2 |  └─SUBPLAN FILTER     |               |4       |5           |
|3 |    ├─TABLE FULL SCAN  |t1             |8       |3           |
|4 |    └─SCALAR GROUP BY  |               |1       |3           |
|5 |      └─TABLE FULL SCAN|t2             |8       |3           |
==================================================================
Outputs & filters:
-------------------------------------
  0 - output(nil), filter(nil)
      columns([{is_c3: ({is_c3: (is_c3.__pk_increment, is_c3.a, is_c3.b, is_c3.c)})}]), partitions(p0), 
      column_values([T_HIDDEN_PK], [column_conv(INT,PS:(11,0),NULL,ANONYMOUS_VIEW1.a)], [column_conv(INT,PS:(11,0),NULL,ANONYMOUS_VIEW1.b)], [column_conv(INT,
      PS:(11,0),NULL,ANONYMOUS_VIEW1.c)])
  1 - output([ANONYMOUS_VIEW1.a], [ANONYMOUS_VIEW1.b], [ANONYMOUS_VIEW1.c]), filter(nil), rowset=16
      access([ANONYMOUS_VIEW1.a], [ANONYMOUS_VIEW1.b], [ANONYMOUS_VIEW1.c])
  2 - output([t1.a], [t1.b], [t1.c]), filter([t1.b > ANY(subquery(1))]), rowset=16
      exec_params_(nil), onetime_exprs_(nil), init_plan_idxs_([1]), use_batch=false
  3 - output([t1.a], [t1.b], [t1.c]), filter(nil), rowset=16
      access([t1.a], [t1.b], [t1.c]), partitions(p0)
      is_index_back=false, is_global_index=false, 
      range_key([t1.a]), range(MIN ; MAX)always true
  4 - output([T_FUN_COUNT_SUM(T_FUN_COUNT(*))]), filter([T_FUN_COUNT_SUM(T_FUN_COUNT(*)) > 1]), rowset=16
      group(nil), agg_func([T_FUN_COUNT_SUM(T_FUN_COUNT(*))])
  5 - output([T_FUN_COUNT(*)]), filter(nil), rowset=16
      access(nil), partitions(p0)
      is_index_back=false, is_global_index=false, 
      range_key([t2.a]), range(MIN ; MAX)always true, 
      pushdown_aggregation([T_FUN_COUNT(*)])
insert into is_c3 select /*+NO_REWRITE*/* from t1 where t1.b > any (select count(*) from t2 having count(*) > 1);
select/**/ * from is_c3;
a	b	c
rollback;


# case 68
EXPLAIN select * from t1 where t1.b > all (select count(*) from t2 having count(*) > 1);
Query Plan
========================================================
|ID|OPERATOR               |NAME |EST.ROWS|EST.TIME(us)|
--------------------------------------------------------
|0 |NESTED-LOOP ANTI JOIN  |     |8       |6           |
|1 |├─TABLE FULL SCAN      |t1   |8       |3           |
|2 |└─MATERIAL             |     |1       |3           |
|3 |  └─SUBPLAN SCAN       |VIEW1|1       |3           |
|4 |    └─SCALAR GROUP BY  |     |1       |3           |
|5 |      └─TABLE FULL SCAN|t2   |8       |3           |
========================================================
Outputs & filters:
-------------------------------------
  0 - output([t1.a], [t1.b], [t1.c]), filter(nil), rowset=16
      conds([t1.b <= VIEW1.count(*) OR t1.b IS NULL]), nl_params_(nil), use_batch=false
  1 - output([t1.a], [t1.b], [t1.c]), filter(nil), rowset=16
      access([t1.a], [t1.b], [t1.c]), partitions(p0)
      is_index_back=false, is_global_index=false, 
      range_key([t1.a]), range(MIN ; MAX)always true
  2 - output([VIEW1.count(*)]), filter(nil), rowset=16
  3 - output([VIEW1.count(*)]), filter(nil), rowset=16
      access([VIEW1.count(*)])
  4 - output([T_FUN_COUNT_SUM(T_FUN_COUNT(*))]), filter([T_FUN_COUNT_SUM(T_FUN_COUNT(*)) > 1]), rowset=16
      group(nil), agg_func([T_FUN_COUNT_SUM(T_FUN_COUNT(*))])
  5 - output([T_FUN_COUNT(*)]), filter(nil), rowset=16
      access(nil), partitions(p0)
      is_index_back=false, is_global_index=false, 
      range_key([t2.a]), range(MIN ; MAX)always true, 
      pushdown_aggregation([T_FUN_COUNT(*)])
select * from t1 where t1.b > all (select count(*) from t2 having count(*) > 1);
a	b	c
EXPLAIN select /*+NO_REWRITE*/* from t1 where t1.b > all (select count(*) from t2 having count(*) > 1);
Query Plan
===================================================
|ID|OPERATOR           |NAME|EST.ROWS|EST.TIME(us)|
---------------------------------------------------
|0 |SUBPLAN FILTER     |    |4       |5           |
|1 |├─TABLE FULL SCAN  |t1  |8       |3           |
|2 |└─SCALAR GROUP BY  |    |1       |3           |
|3 |  └─TABLE FULL SCAN|t2  |8       |3           |
===================================================
Outputs & filters:
-------------------------------------
  0 - output([t1.a], [t1.b], [t1.c]), filter([t1.b > ALL(subquery(1))]), rowset=16
      exec_params_(nil), onetime_exprs_(nil), init_plan_idxs_([1]), use_batch=false
  1 - output([t1.a], [t1.b], [t1.c]), filter(nil), rowset=16
      access([t1.a], [t1.b], [t1.c]), partitions(p0)
      is_index_back=false, is_global_index=false, 
      range_key([t1.a]), range(MIN ; MAX)always true
  2 - output([T_FUN_COUNT_SUM(T_FUN_COUNT(*))]), filter([T_FUN_COUNT_SUM(T_FUN_COUNT(*)) > 1]), rowset=16
      group(nil), agg_func([T_FUN_COUNT_SUM(T_FUN_COUNT(*))])
  3 - output([T_FUN_COUNT(*)]), filter(nil), rowset=16
      access(nil), partitions(p0)
      is_index_back=false, is_global_index=false, 
      range_key([t2.a]), range(MIN ; MAX)always true, 
      pushdown_aggregation([T_FUN_COUNT(*)])
select /*+NO_REWRITE*/* from t1 where t1.b > all (select count(*) from t2 having count(*) > 1);
a	b	c
EXPLAIN update t1 set b = b + 1 where t1.b > all (select count(*) from t2 having count(*) > 1);
Query Plan
==========================================================
|ID|OPERATOR                 |NAME |EST.ROWS|EST.TIME(us)|
----------------------------------------------------------
|0 |UPDATE                   |     |8       |87          |
|1 |└─NESTED-LOOP ANTI JOIN  |     |8       |6           |
|2 |  ├─TABLE FULL SCAN      |t1   |8       |3           |
|3 |  └─MATERIAL             |     |1       |3           |
|4 |    └─SUBPLAN SCAN       |VIEW1|1       |3           |
|5 |      └─SCALAR GROUP BY  |     |1       |3           |
|6 |        └─TABLE FULL SCAN|t2   |8       |3           |
==========================================================
Outputs & filters:
-------------------------------------
  0 - output(nil), filter(nil)
      table_columns([{t1: ({t1: (t1.a, t1.b, t1.c)})}]),
      update([t1.b=column_conv(INT,PS:(11,0),NULL,cast(t1.b + 1, INT(-1, 0)))])
  1 - output([t1.a], [t1.b], [t1.c]), filter(nil), rowset=16
      conds([t1.b <= VIEW1.count(*) OR t1.b IS NULL]), nl_params_(nil), use_batch=false
  2 - output([t1.a], [t1.b], [t1.c]), filter(nil), rowset=16
      access([t1.a], [t1.b], [t1.c]), partitions(p0)
      is_index_back=false, is_global_index=false, 
      range_key([t1.a]), range(MIN ; MAX)always true
  3 - output([VIEW1.count(*)]), filter(nil), rowset=16
  4 - output([VIEW1.count(*)]), filter(nil), rowset=16
      access([VIEW1.count(*)])
  5 - output([T_FUN_COUNT_SUM(T_FUN_COUNT(*))]), filter([T_FUN_COUNT_SUM(T_FUN_COUNT(*)) > 1]), rowset=16
      group(nil), agg_func([T_FUN_COUNT_SUM(T_FUN_COUNT(*))])
  6 - output([T_FUN_COUNT(*)]), filter(nil), rowset=16
      access(nil), partitions(p0)
      is_index_back=false, is_global_index=false, 
      range_key([t2.a]), range(MIN ; MAX)always true, 
      pushdown_aggregation([T_FUN_COUNT(*)])
update t1 set b = b + 1 where t1.b > all (select count(*) from t2 having count(*) > 1);
select/**/ * from t1;
a	b	c
1	1	0
2	2	1
3	3	0
4	4	1
5	5	0
6	6	1
7	7	0
8	8	1
rollback;
EXPLAIN update /*+NO_REWRITE*/t1 set b = b + 1 where t1.b > all (select count(*) from t2 having count(*) > 1);
Query Plan
=====================================================
|ID|OPERATOR             |NAME|EST.ROWS|EST.TIME(us)|
-----------------------------------------------------
|0 |UPDATE               |    |4       |60          |
|1 |└─SUBPLAN FILTER     |    |4       |5           |
|2 |  ├─TABLE FULL SCAN  |t1  |8       |3           |
|3 |  └─SCALAR GROUP BY  |    |1       |3           |
|4 |    └─TABLE FULL SCAN|t2  |8       |3           |
=====================================================
Outputs & filters:
-------------------------------------
  0 - output(nil), filter(nil)
      table_columns([{t1: ({t1: (t1.a, t1.b, t1.c)})}]),
      update([t1.b=column_conv(INT,PS:(11,0),NULL,cast(t1.b + 1, INT(-1, 0)))])
  1 - output([t1.a], [t1.b], [t1.c]), filter([t1.b > ALL(subquery(1))]), rowset=16
      exec_params_(nil), onetime_exprs_(nil), init_plan_idxs_([1]), use_batch=false
  2 - output([t1.a], [t1.b], [t1.c]), filter(nil), rowset=16
      access([t1.a], [t1.b], [t1.c]), partitions(p0)
      is_index_back=false, is_global_index=false, 
      range_key([t1.a]), range(MIN ; MAX)always true
  3 - output([T_FUN_COUNT_SUM(T_FUN_COUNT(*))]), filter([T_FUN_COUNT_SUM(T_FUN_COUNT(*)) > 1]), rowset=16
      group(nil), agg_func([T_FUN_COUNT_SUM(T_FUN_COUNT(*))])
  4 - output([T_FUN_COUNT(*)]), filter(nil), rowset=16
      access(nil), partitions(p0)
      is_index_back=false, is_global_index=false, 
      range_key([t2.a]), range(MIN ; MAX)always true, 
      pushdown_aggregation([T_FUN_COUNT(*)])
update /*+NO_REWRITE*/t1 set b = b + 1 where t1.b > all (select count(*) from t2 having count(*) > 1);
select/**/ * from t1;
a	b	c
1	1	0
2	2	1
3	3	0
4	4	1
5	5	0
6	6	1
7	7	0
8	8	1
rollback;
EXPLAIN delete from t1 where t1.b > all (select count(*) from t2 having count(*) > 1);
Query Plan
==========================================================
|ID|OPERATOR                 |NAME |EST.ROWS|EST.TIME(us)|
----------------------------------------------------------
|0 |DELETE                   |     |8       |50          |
|1 |└─NESTED-LOOP ANTI JOIN  |     |8       |6           |
|2 |  ├─TABLE FULL SCAN      |t1   |8       |3           |
|3 |  └─MATERIAL             |     |1       |3           |
|4 |    └─SUBPLAN SCAN       |VIEW1|1       |3           |
|5 |      └─SCALAR GROUP BY  |     |1       |3           |
|6 |        └─TABLE FULL SCAN|t2   |8       |3           |
==========================================================
Outputs & filters:
-------------------------------------
  0 - output(nil), filter(nil)
      table_columns([{t1: ({t1: (t1.a, t1.b, t1.c)})}])
  1 - output([t1.a], [t1.b], [t1.c]), filter(nil), rowset=16
      conds([t1.b <= VIEW1.count(*) OR t1.b IS NULL]), nl_params_(nil), use_batch=false
  2 - output([t1.a], [t1.b], [t1.c]), filter(nil), rowset=16
      access([t1.a], [t1.b], [t1.c]), partitions(p0)
      is_index_back=false, is_global_index=false, 
      range_key([t1.a]), range(MIN ; MAX)always true
  3 - output([VIEW1.count(*)]), filter(nil), rowset=16
  4 - output([VIEW1.count(*)]), filter(nil), rowset=16
      access([VIEW1.count(*)])
  5 - output([T_FUN_COUNT_SUM(T_FUN_COUNT(*))]), filter([T_FUN_COUNT_SUM(T_FUN_COUNT(*)) > 1]), rowset=16
      group(nil), agg_func([T_FUN_COUNT_SUM(T_FUN_COUNT(*))])
  6 - output([T_FUN_COUNT(*)]), filter(nil), rowset=16
      access(nil), partitions(p0)
      is_index_back=false, is_global_index=false, 
      range_key([t2.a]), range(MIN ; MAX)always true, 
      pushdown_aggregation([T_FUN_COUNT(*)])
delete from t1 where t1.b > all (select count(*) from t2 having count(*) > 1);
select/**/ * from t1;
a	b	c
1	1	0
2	2	1
3	3	0
4	4	1
5	5	0
6	6	1
7	7	0
8	8	1
rollback;
EXPLAIN delete /*+NO_REWRITE*/from t1 where t1.b > all (select count(*) from t2 having count(*) > 1);
Query Plan
=====================================================
|ID|OPERATOR             |NAME|EST.ROWS|EST.TIME(us)|
-----------------------------------------------------
|0 |DELETE               |    |4       |32          |
|1 |└─SUBPLAN FILTER     |    |4       |5           |
|2 |  ├─TABLE FULL SCAN  |t1  |8       |3           |
|3 |  └─SCALAR GROUP BY  |    |1       |3           |
|4 |    └─TABLE FULL SCAN|t2  |8       |3           |
=====================================================
Outputs & filters:
-------------------------------------
  0 - output(nil), filter(nil)
      table_columns([{t1: ({t1: (t1.a, t1.b, t1.c)})}])
  1 - output([t1.a], [t1.b], [t1.c]), filter([t1.b > ALL(subquery(1))]), rowset=16
      exec_params_(nil), onetime_exprs_(nil), init_plan_idxs_([1]), use_batch=false
  2 - output([t1.a], [t1.b], [t1.c]), filter(nil), rowset=16
      access([t1.a], [t1.b], [t1.c]), partitions(p0)
      is_index_back=false, is_global_index=false, 
      range_key([t1.a]), range(MIN ; MAX)always true
  3 - output([T_FUN_COUNT_SUM(T_FUN_COUNT(*))]), filter([T_FUN_COUNT_SUM(T_FUN_COUNT(*)) > 1]), rowset=16
      group(nil), agg_func([T_FUN_COUNT_SUM(T_FUN_COUNT(*))])
  4 - output([T_FUN_COUNT(*)]), filter(nil), rowset=16
      access(nil), partitions(p0)
      is_index_back=false, is_global_index=false, 
      range_key([t2.a]), range(MIN ; MAX)always true, 
      pushdown_aggregation([T_FUN_COUNT(*)])
delete /*+NO_REWRITE*/from t1 where t1.b > all (select count(*) from t2 having count(*) > 1);
select/**/ * from t1;
a	b	c
1	1	0
2	2	1
3	3	0
4	4	1
5	5	0
6	6	1
7	7	0
8	8	1
rollback;
EXPLAIN insert into is_c3 select * from t1 where t1.b > all (select count(*) from t2 having count(*) > 1);
Query Plan
======================================================================
|ID|OPERATOR                   |NAME           |EST.ROWS|EST.TIME(us)|
----------------------------------------------------------------------
|0 |INSERT                     |               |8       |60          |
|1 |└─SUBPLAN SCAN             |ANONYMOUS_VIEW1|8       |6           |
|2 |  └─NESTED-LOOP ANTI JOIN  |               |8       |6           |
|3 |    ├─TABLE FULL SCAN      |t1             |8       |3           |
|4 |    └─MATERIAL             |               |1       |3           |
|5 |      └─SUBPLAN SCAN       |VIEW1          |1       |3           |
|6 |        └─SCALAR GROUP BY  |               |1       |3           |
|7 |          └─TABLE FULL SCAN|t2             |8       |3           |
======================================================================
Outputs & filters:
-------------------------------------
  0 - output(nil), filter(nil)
      columns([{is_c3: ({is_c3: (is_c3.__pk_increment, is_c3.a, is_c3.b, is_c3.c)})}]), partitions(p0), 
      column_values([T_HIDDEN_PK], [column_conv(INT,PS:(11,0),NULL,ANONYMOUS_VIEW1.a)], [column_conv(INT,PS:(11,0),NULL,ANONYMOUS_VIEW1.b)], [column_conv(INT,
      PS:(11,0),NULL,ANONYMOUS_VIEW1.c)])
  1 - output([ANONYMOUS_VIEW1.a], [ANONYMOUS_VIEW1.b], [ANONYMOUS_VIEW1.c]), filter(nil), rowset=16
      access([ANONYMOUS_VIEW1.a], [ANONYMOUS_VIEW1.b], [ANONYMOUS_VIEW1.c])
  2 - output([t1.a], [t1.b], [t1.c]), filter(nil), rowset=16
      conds([t1.b <= VIEW1.count(*) OR t1.b IS NULL]), nl_params_(nil), use_batch=false
  3 - output([t1.a], [t1.b], [t1.c]), filter(nil), rowset=16
      access([t1.a], [t1.b], [t1.c]), partitions(p0)
      is_index_back=false, is_global_index=false, 
      range_key([t1.a]), range(MIN ; MAX)always true
  4 - output([VIEW1.count(*)]), filter(nil), rowset=16
  5 - output([VIEW1.count(*)]), filter(nil), rowset=16
      access([VIEW1.count(*)])
  6 - output([T_FUN_COUNT_SUM(T_FUN_COUNT(*))]), filter([T_FUN_COUNT_SUM(T_FUN_COUNT(*)) > 1]), rowset=16
      group(nil), agg_func([T_FUN_COUNT_SUM(T_FUN_COUNT(*))])
  7 - output([T_FUN_COUNT(*)]), filter(nil), rowset=16
      access(nil), partitions(p0)
      is_index_back=false, is_global_index=false, 
      range_key([t2.a]), range(MIN ; MAX)always true, 
      pushdown_aggregation([T_FUN_COUNT(*)])
insert into is_c3 select * from t1 where t1.b > all (select count(*) from t2 having count(*) > 1);
select/**/ * from is_c3;
a	b	c
rollback;
EXPLAIN insert into is_c3 select /*+NO_REWRITE*/* from t1 where t1.b > all (select count(*) from t2 having count(*) > 1);
Query Plan
==================================================================
|ID|OPERATOR               |NAME           |EST.ROWS|EST.TIME(us)|
------------------------------------------------------------------
|0 |INSERT                 |               |4       |37          |
|1 |└─SUBPLAN SCAN         |ANONYMOUS_VIEW1|4       |5           |
|2 |  └─SUBPLAN FILTER     |               |4       |5           |
|3 |    ├─TABLE FULL SCAN  |t1             |8       |3           |
|4 |    └─SCALAR GROUP BY  |               |1       |3           |
|5 |      └─TABLE FULL SCAN|t2             |8       |3           |
==================================================================
Outputs & filters:
-------------------------------------
  0 - output(nil), filter(nil)
      columns([{is_c3: ({is_c3: (is_c3.__pk_increment, is_c3.a, is_c3.b, is_c3.c)})}]), partitions(p0), 
      column_values([T_HIDDEN_PK], [column_conv(INT,PS:(11,0),NULL,ANONYMOUS_VIEW1.a)], [column_conv(INT,PS:(11,0),NULL,ANONYMOUS_VIEW1.b)], [column_conv(INT,
      PS:(11,0),NULL,ANONYMOUS_VIEW1.c)])
  1 - output([ANONYMOUS_VIEW1.a], [ANONYMOUS_VIEW1.b], [ANONYMOUS_VIEW1.c]), filter(nil), rowset=16
      access([ANONYMOUS_VIEW1.a], [ANONYMOUS_VIEW1.b], [ANONYMOUS_VIEW1.c])
  2 - output([t1.a], [t1.b], [t1.c]), filter([t1.b > ALL(subquery(1))]), rowset=16
      exec_params_(nil), onetime_exprs_(nil), init_plan_idxs_([1]), use_batch=false
  3 - output([t1.a], [t1.b], [t1.c]), filter(nil), rowset=16
      access([t1.a], [t1.b], [t1.c]), partitions(p0)
      is_index_back=false, is_global_index=false, 
      range_key([t1.a]), range(MIN ; MAX)always true
  4 - output([T_FUN_COUNT_SUM(T_FUN_COUNT(*))]), filter([T_FUN_COUNT_SUM(T_FUN_COUNT(*)) > 1]), rowset=16
      group(nil), agg_func([T_FUN_COUNT_SUM(T_FUN_COUNT(*))])
  5 - output([T_FUN_COUNT(*)]), filter(nil), rowset=16
      access(nil), partitions(p0)
      is_index_back=false, is_global_index=false, 
      range_key([t2.a]), range(MIN ; MAX)always true, 
      pushdown_aggregation([T_FUN_COUNT(*)])
insert into is_c3 select /*+NO_REWRITE*/* from t1 where t1.b > all (select count(*) from t2 having count(*) > 1);
select/**/ * from is_c3;
a	b	c
rollback;


# case 69
EXPLAIN select * from t1 where t1.b in (select count(*) from t2 having count(*) > 1);
Query Plan
======================================================
|ID|OPERATOR             |NAME |EST.ROWS|EST.TIME(us)|
------------------------------------------------------
|0 |HASH JOIN            |     |1       |6           |
|1 |├─SUBPLAN SCAN       |VIEW1|1       |3           |
|2 |│ └─SCALAR GROUP BY  |     |1       |3           |
|3 |│   └─TABLE FULL SCAN|t2   |8       |3           |
|4 |└─TABLE FULL SCAN    |t1   |8       |3           |
======================================================
Outputs & filters:
-------------------------------------
  0 - output([t1.a], [t1.b], [t1.c]), filter(nil), rowset=16
      equal_conds([t1.b = VIEW1.count(*)]), other_conds(nil)
  1 - output([VIEW1.count(*)]), filter(nil), rowset=16
      access([VIEW1.count(*)])
  2 - output([T_FUN_COUNT_SUM(T_FUN_COUNT(*))]), filter([T_FUN_COUNT_SUM(T_FUN_COUNT(*)) > 1]), rowset=16
      group(nil), agg_func([T_FUN_COUNT_SUM(T_FUN_COUNT(*))])
  3 - output([T_FUN_COUNT(*)]), filter(nil), rowset=16
      access(nil), partitions(p0)
      is_index_back=false, is_global_index=false, 
      range_key([t2.a]), range(MIN ; MAX)always true, 
      pushdown_aggregation([T_FUN_COUNT(*)])
  4 - output([t1.a], [t1.b], [t1.c]), filter([t1.b > 1]), rowset=16
      access([t1.a], [t1.b], [t1.c]), partitions(p0)
      is_index_back=false, is_global_index=false, filter_before_indexback[false], 
      range_key([t1.a]), range(MIN ; MAX)always true
select * from t1 where t1.b in (select count(*) from t2 having count(*) > 1);
a	b	c
8	8	1
EXPLAIN select /*+NO_REWRITE*/* from t1 where t1.b in (select count(*) from t2 having count(*) > 1);
Query Plan
===================================================
|ID|OPERATOR           |NAME|EST.ROWS|EST.TIME(us)|
---------------------------------------------------
|0 |SUBPLAN FILTER     |    |4       |5           |
|1 |├─TABLE FULL SCAN  |t1  |8       |3           |
|2 |└─SCALAR GROUP BY  |    |1       |3           |
|3 |  └─TABLE FULL SCAN|t2  |8       |3           |
===================================================
Outputs & filters:
-------------------------------------
  0 - output([t1.a], [t1.b], [t1.c]), filter([t1.b = ANY(subquery(1))]), rowset=16
      exec_params_(nil), onetime_exprs_(nil), init_plan_idxs_([1]), use_batch=false
  1 - output([t1.a], [t1.b], [t1.c]), filter(nil), rowset=16
      access([t1.a], [t1.b], [t1.c]), partitions(p0)
      is_index_back=false, is_global_index=false, 
      range_key([t1.a]), range(MIN ; MAX)always true
  2 - output([T_FUN_COUNT_SUM(T_FUN_COUNT(*))]), filter([T_FUN_COUNT_SUM(T_FUN_COUNT(*)) > 1]), rowset=16
      group(nil), agg_func([T_FUN_COUNT_SUM(T_FUN_COUNT(*))])
  3 - output([T_FUN_COUNT(*)]), filter(nil), rowset=16
      access(nil), partitions(p0)
      is_index_back=false, is_global_index=false, 
      range_key([t2.a]), range(MIN ; MAX)always true, 
      pushdown_aggregation([T_FUN_COUNT(*)])
select /*+NO_REWRITE*/* from t1 where t1.b in (select count(*) from t2 having count(*) > 1);
a	b	c
8	8	1
EXPLAIN update t1 set b = b + 1 where t1.b in (select count(*) from t2 having count(*) > 1);
Query Plan
========================================================
|ID|OPERATOR               |NAME |EST.ROWS|EST.TIME(us)|
--------------------------------------------------------
|0 |UPDATE                 |     |1       |31          |
|1 |└─HASH JOIN            |     |1       |6           |
|2 |  ├─SUBPLAN SCAN       |VIEW1|1       |3           |
|3 |  │ └─SCALAR GROUP BY  |     |1       |3           |
|4 |  │   └─TABLE FULL SCAN|t2   |8       |3           |
|5 |  └─TABLE FULL SCAN    |t1   |8       |3           |
========================================================
Outputs & filters:
-------------------------------------
  0 - output(nil), filter(nil)
      table_columns([{t1: ({t1: (t1.a, t1.b, t1.c)})}]),
      update([t1.b=column_conv(INT,PS:(11,0),NULL,cast(t1.b + 1, INT(-1, 0)))])
  1 - output([t1.a], [t1.b], [t1.c]), filter(nil), rowset=16
      equal_conds([t1.b = VIEW1.count(*)]), other_conds(nil)
  2 - output([VIEW1.count(*)]), filter(nil), rowset=16
      access([VIEW1.count(*)])
  3 - output([T_FUN_COUNT_SUM(T_FUN_COUNT(*))]), filter([T_FUN_COUNT_SUM(T_FUN_COUNT(*)) > 1]), rowset=16
      group(nil), agg_func([T_FUN_COUNT_SUM(T_FUN_COUNT(*))])
  4 - output([T_FUN_COUNT(*)]), filter(nil), rowset=16
      access(nil), partitions(p0)
      is_index_back=false, is_global_index=false, 
      range_key([t2.a]), range(MIN ; MAX)always true, 
      pushdown_aggregation([T_FUN_COUNT(*)])
  5 - output([t1.a], [t1.b], [t1.c]), filter([t1.b > 1]), rowset=16
      access([t1.a], [t1.b], [t1.c]), partitions(p0)
      is_index_back=false, is_global_index=false, filter_before_indexback[false], 
      range_key([t1.a]), range(MIN ; MAX)always true
update t1 set b = b + 1 where t1.b in (select count(*) from t2 having count(*) > 1);
select/**/ * from t1;
a	b	c
1	1	0
2	2	1
3	3	0
4	4	1
5	5	0
6	6	1
7	7	0
8	9	1
rollback;
EXPLAIN update /*+NO_REWRITE*/t1 set b = b + 1 where t1.b in (select count(*) from t2 having count(*) > 1);
Query Plan
=====================================================
|ID|OPERATOR             |NAME|EST.ROWS|EST.TIME(us)|
-----------------------------------------------------
|0 |UPDATE               |    |4       |60          |
|1 |└─SUBPLAN FILTER     |    |4       |5           |
|2 |  ├─TABLE FULL SCAN  |t1  |8       |3           |
|3 |  └─SCALAR GROUP BY  |    |1       |3           |
|4 |    └─TABLE FULL SCAN|t2  |8       |3           |
=====================================================
Outputs & filters:
-------------------------------------
  0 - output(nil), filter(nil)
      table_columns([{t1: ({t1: (t1.a, t1.b, t1.c)})}]),
      update([t1.b=column_conv(INT,PS:(11,0),NULL,cast(t1.b + 1, INT(-1, 0)))])
  1 - output([t1.a], [t1.b], [t1.c]), filter([t1.b = ANY(subquery(1))]), rowset=16
      exec_params_(nil), onetime_exprs_(nil), init_plan_idxs_([1]), use_batch=false
  2 - output([t1.a], [t1.b], [t1.c]), filter(nil), rowset=16
      access([t1.a], [t1.b], [t1.c]), partitions(p0)
      is_index_back=false, is_global_index=false, 
      range_key([t1.a]), range(MIN ; MAX)always true
  3 - output([T_FUN_COUNT_SUM(T_FUN_COUNT(*))]), filter([T_FUN_COUNT_SUM(T_FUN_COUNT(*)) > 1]), rowset=16
      group(nil), agg_func([T_FUN_COUNT_SUM(T_FUN_COUNT(*))])
  4 - output([T_FUN_COUNT(*)]), filter(nil), rowset=16
      access(nil), partitions(p0)
      is_index_back=false, is_global_index=false, 
      range_key([t2.a]), range(MIN ; MAX)always true, 
      pushdown_aggregation([T_FUN_COUNT(*)])
update /*+NO_REWRITE*/t1 set b = b + 1 where t1.b in (select count(*) from t2 having count(*) > 1);
select/**/ * from t1;
a	b	c
1	1	0
2	2	1
3	3	0
4	4	1
5	5	0
6	6	1
7	7	0
8	9	1
rollback;
EXPLAIN delete from t1 where t1.b in (select count(*) from t2 having count(*) > 1);
Query Plan
========================================================
|ID|OPERATOR               |NAME |EST.ROWS|EST.TIME(us)|
--------------------------------------------------------
|0 |DELETE                 |     |1       |13          |
|1 |└─HASH JOIN            |     |1       |6           |
|2 |  ├─SUBPLAN SCAN       |VIEW1|1       |3           |
|3 |  │ └─SCALAR GROUP BY  |     |1       |3           |
|4 |  │   └─TABLE FULL SCAN|t2   |8       |3           |
|5 |  └─TABLE FULL SCAN    |t1   |8       |3           |
========================================================
Outputs & filters:
-------------------------------------
  0 - output(nil), filter(nil)
      table_columns([{t1: ({t1: (t1.a, t1.b, t1.c)})}])
  1 - output([t1.a], [t1.b], [t1.c]), filter(nil), rowset=16
      equal_conds([t1.b = VIEW1.count(*)]), other_conds(nil)
  2 - output([VIEW1.count(*)]), filter(nil), rowset=16
      access([VIEW1.count(*)])
  3 - output([T_FUN_COUNT_SUM(T_FUN_COUNT(*))]), filter([T_FUN_COUNT_SUM(T_FUN_COUNT(*)) > 1]), rowset=16
      group(nil), agg_func([T_FUN_COUNT_SUM(T_FUN_COUNT(*))])
  4 - output([T_FUN_COUNT(*)]), filter(nil), rowset=16
      access(nil), partitions(p0)
      is_index_back=false, is_global_index=false, 
      range_key([t2.a]), range(MIN ; MAX)always true, 
      pushdown_aggregation([T_FUN_COUNT(*)])
  5 - output([t1.a], [t1.b], [t1.c]), filter([t1.b > 1]), rowset=16
      access([t1.a], [t1.b], [t1.c]), partitions(p0)
      is_index_back=false, is_global_index=false, filter_before_indexback[false], 
      range_key([t1.a]), range(MIN ; MAX)always true
delete from t1 where t1.b in (select count(*) from t2 having count(*) > 1);
select/**/ * from t1;
a	b	c
1	1	0
2	2	1
3	3	0
4	4	1
5	5	0
6	6	1
7	7	0
rollback;
EXPLAIN delete /*+NO_REWRITE*/from t1 where t1.b in (select count(*) from t2 having count(*) > 1);
Query Plan
=====================================================
|ID|OPERATOR             |NAME|EST.ROWS|EST.TIME(us)|
-----------------------------------------------------
|0 |DELETE               |    |4       |32          |
|1 |└─SUBPLAN FILTER     |    |4       |5           |
|2 |  ├─TABLE FULL SCAN  |t1  |8       |3           |
|3 |  └─SCALAR GROUP BY  |    |1       |3           |
|4 |    └─TABLE FULL SCAN|t2  |8       |3           |
=====================================================
Outputs & filters:
-------------------------------------
  0 - output(nil), filter(nil)
      table_columns([{t1: ({t1: (t1.a, t1.b, t1.c)})}])
  1 - output([t1.a], [t1.b], [t1.c]), filter([t1.b = ANY(subquery(1))]), rowset=16
      exec_params_(nil), onetime_exprs_(nil), init_plan_idxs_([1]), use_batch=false
  2 - output([t1.a], [t1.b], [t1.c]), filter(nil), rowset=16
      access([t1.a], [t1.b], [t1.c]), partitions(p0)
      is_index_back=false, is_global_index=false, 
      range_key([t1.a]), range(MIN ; MAX)always true
  3 - output([T_FUN_COUNT_SUM(T_FUN_COUNT(*))]), filter([T_FUN_COUNT_SUM(T_FUN_COUNT(*)) > 1]), rowset=16
      group(nil), agg_func([T_FUN_COUNT_SUM(T_FUN_COUNT(*))])
  4 - output([T_FUN_COUNT(*)]), filter(nil), rowset=16
      access(nil), partitions(p0)
      is_index_back=false, is_global_index=false, 
      range_key([t2.a]), range(MIN ; MAX)always true, 
      pushdown_aggregation([T_FUN_COUNT(*)])
delete /*+NO_REWRITE*/from t1 where t1.b in (select count(*) from t2 having count(*) > 1);
select/**/ * from t1;
a	b	c
1	1	0
2	2	1
3	3	0
4	4	1
5	5	0
6	6	1
7	7	0
rollback;
EXPLAIN insert into is_c3 select * from t1 where t1.b in (select count(*) from t2 having count(*) > 1);
Query Plan
====================================================================
|ID|OPERATOR                 |NAME           |EST.ROWS|EST.TIME(us)|
--------------------------------------------------------------------
|0 |INSERT                   |               |1       |13          |
|1 |└─SUBPLAN SCAN           |ANONYMOUS_VIEW1|1       |6           |
|2 |  └─HASH JOIN            |               |1       |6           |
|3 |    ├─SUBPLAN SCAN       |VIEW1          |1       |3           |
|4 |    │ └─SCALAR GROUP BY  |               |1       |3           |
|5 |    │   └─TABLE FULL SCAN|t2             |8       |3           |
|6 |    └─TABLE FULL SCAN    |t1             |8       |3           |
====================================================================
Outputs & filters:
-------------------------------------
  0 - output(nil), filter(nil)
      columns([{is_c3: ({is_c3: (is_c3.__pk_increment, is_c3.a, is_c3.b, is_c3.c)})}]), partitions(p0), 
      column_values([T_HIDDEN_PK], [column_conv(INT,PS:(11,0),NULL,ANONYMOUS_VIEW1.a)], [column_conv(INT,PS:(11,0),NULL,ANONYMOUS_VIEW1.b)], [column_conv(INT,
      PS:(11,0),NULL,ANONYMOUS_VIEW1.c)])
  1 - output([ANONYMOUS_VIEW1.a], [ANONYMOUS_VIEW1.b], [ANONYMOUS_VIEW1.c]), filter(nil), rowset=16
      access([ANONYMOUS_VIEW1.a], [ANONYMOUS_VIEW1.b], [ANONYMOUS_VIEW1.c])
  2 - output([t1.a], [t1.b], [t1.c]), filter(nil), rowset=16
      equal_conds([t1.b = VIEW1.count(*)]), other_conds(nil)
  3 - output([VIEW1.count(*)]), filter(nil), rowset=16
      access([VIEW1.count(*)])
  4 - output([T_FUN_COUNT_SUM(T_FUN_COUNT(*))]), filter([T_FUN_COUNT_SUM(T_FUN_COUNT(*)) > 1]), rowset=16
      group(nil), agg_func([T_FUN_COUNT_SUM(T_FUN_COUNT(*))])
  5 - output([T_FUN_COUNT(*)]), filter(nil), rowset=16
      access(nil), partitions(p0)
      is_index_back=false, is_global_index=false, 
      range_key([t2.a]), range(MIN ; MAX)always true, 
      pushdown_aggregation([T_FUN_COUNT(*)])
  6 - output([t1.a], [t1.b], [t1.c]), filter([t1.b > 1]), rowset=16
      access([t1.a], [t1.b], [t1.c]), partitions(p0)
      is_index_back=false, is_global_index=false, filter_before_indexback[false], 
      range_key([t1.a]), range(MIN ; MAX)always true
insert into is_c3 select * from t1 where t1.b in (select count(*) from t2 having count(*) > 1);
select/**/ * from is_c3;
a	b	c
8	8	1
rollback;
EXPLAIN insert into is_c3 select /*+NO_REWRITE*/* from t1 where t1.b in (select count(*) from t2 having count(*) > 1);
Query Plan
==================================================================
|ID|OPERATOR               |NAME           |EST.ROWS|EST.TIME(us)|
------------------------------------------------------------------
|0 |INSERT                 |               |4       |37          |
|1 |└─SUBPLAN SCAN         |ANONYMOUS_VIEW1|4       |5           |
|2 |  └─SUBPLAN FILTER     |               |4       |5           |
|3 |    ├─TABLE FULL SCAN  |t1             |8       |3           |
|4 |    └─SCALAR GROUP BY  |               |1       |3           |
|5 |      └─TABLE FULL SCAN|t2             |8       |3           |
==================================================================
Outputs & filters:
-------------------------------------
  0 - output(nil), filter(nil)
      columns([{is_c3: ({is_c3: (is_c3.__pk_increment, is_c3.a, is_c3.b, is_c3.c)})}]), partitions(p0), 
      column_values([T_HIDDEN_PK], [column_conv(INT,PS:(11,0),NULL,ANONYMOUS_VIEW1.a)], [column_conv(INT,PS:(11,0),NULL,ANONYMOUS_VIEW1.b)], [column_conv(INT,
      PS:(11,0),NULL,ANONYMOUS_VIEW1.c)])
  1 - output([ANONYMOUS_VIEW1.a], [ANONYMOUS_VIEW1.b], [ANONYMOUS_VIEW1.c]), filter(nil), rowset=16
      access([ANONYMOUS_VIEW1.a], [ANONYMOUS_VIEW1.b], [ANONYMOUS_VIEW1.c])
  2 - output([t1.a], [t1.b], [t1.c]), filter([t1.b = ANY(subquery(1))]), rowset=16
      exec_params_(nil), onetime_exprs_(nil), init_plan_idxs_([1]), use_batch=false
  3 - output([t1.a], [t1.b], [t1.c]), filter(nil), rowset=16
      access([t1.a], [t1.b], [t1.c]), partitions(p0)
      is_index_back=false, is_global_index=false, 
      range_key([t1.a]), range(MIN ; MAX)always true
  4 - output([T_FUN_COUNT_SUM(T_FUN_COUNT(*))]), filter([T_FUN_COUNT_SUM(T_FUN_COUNT(*)) > 1]), rowset=16
      group(nil), agg_func([T_FUN_COUNT_SUM(T_FUN_COUNT(*))])
  5 - output([T_FUN_COUNT(*)]), filter(nil), rowset=16
      access(nil), partitions(p0)
      is_index_back=false, is_global_index=false, 
      range_key([t2.a]), range(MIN ; MAX)always true, 
      pushdown_aggregation([T_FUN_COUNT(*)])
insert into is_c3 select /*+NO_REWRITE*/* from t1 where t1.b in (select count(*) from t2 having count(*) > 1);
select/**/ * from is_c3;
a	b	c
8	8	1
rollback;


# case 70
EXPLAIN select * from t1 where t1.b > any (select count(*) from t2 limit 0);
Query Plan
===============================================
|ID|OPERATOR       |NAME|EST.ROWS|EST.TIME(us)|
-----------------------------------------------
|0 |TABLE FULL SCAN|t1  |0       |3           |
===============================================
Outputs & filters:
-------------------------------------
  0 - output([t1.a], [t1.b], [t1.c]), filter(nil), startup_filter([0]), rowset=16
      access([t1.a], [t1.b], [t1.c]), partitions(p0)
      is_index_back=false, is_global_index=false, 
      range_key([t1.a]), range(MIN ; MAX)always true
select * from t1 where t1.b > any (select count(*) from t2 limit 0);
a	b	c
EXPLAIN select /*+NO_REWRITE*/* from t1 where t1.b > any (select count(*) from t2 limit 0);
Query Plan
=====================================================
|ID|OPERATOR             |NAME|EST.ROWS|EST.TIME(us)|
-----------------------------------------------------
|0 |SUBPLAN FILTER       |    |4       |5           |
|1 |├─TABLE FULL SCAN    |t1  |8       |3           |
|2 |└─LIMIT              |    |0       |3           |
|3 |  └─SCALAR GROUP BY  |    |1       |3           |
|4 |    └─TABLE FULL SCAN|t2  |8       |3           |
=====================================================
Outputs & filters:
-------------------------------------
  0 - output([t1.a], [t1.b], [t1.c]), filter([t1.b > ANY(subquery(1))]), rowset=16
      exec_params_(nil), onetime_exprs_(nil), init_plan_idxs_([1]), use_batch=false
  1 - output([t1.a], [t1.b], [t1.c]), filter(nil), rowset=16
      access([t1.a], [t1.b], [t1.c]), partitions(p0)
      is_index_back=false, is_global_index=false, 
      range_key([t1.a]), range(MIN ; MAX)always true
  2 - output([T_FUN_COUNT_SUM(T_FUN_COUNT(*))]), filter(nil), startup_filter([0]), rowset=16
      limit(0), offset(nil)
  3 - output([T_FUN_COUNT_SUM(T_FUN_COUNT(*))]), filter(nil), rowset=16
      group(nil), agg_func([T_FUN_COUNT_SUM(T_FUN_COUNT(*))])
  4 - output([T_FUN_COUNT(*)]), filter(nil), rowset=16
      access(nil), partitions(p0)
      is_index_back=false, is_global_index=false, 
      range_key([t2.a]), range(MIN ; MAX)always true, 
      pushdown_aggregation([T_FUN_COUNT(*)])
select /*+NO_REWRITE*/* from t1 where t1.b > any (select count(*) from t2 limit 0);
a	b	c
EXPLAIN update t1 set b = b + 1 where t1.b > any (select count(*) from t2 limit 0);
Query Plan
=================================================
|ID|OPERATOR         |NAME|EST.ROWS|EST.TIME(us)|
-------------------------------------------------
|0 |UPDATE           |    |0       |27          |
|1 |└─TABLE FULL SCAN|t1  |0       |3           |
=================================================
Outputs & filters:
-------------------------------------
  0 - output(nil), filter(nil)
      table_columns([{t1: ({t1: (t1.a, t1.b, t1.c)})}]),
      update([t1.b=column_conv(INT,PS:(11,0),NULL,cast(t1.b + 1, INT(-1, 0)))])
  1 - output([t1.a], [t1.b], [t1.c]), filter(nil), startup_filter([0]), rowset=16
      access([t1.a], [t1.b], [t1.c]), partitions(p0)
      is_index_back=false, is_global_index=false, 
      range_key([t1.a]), range(MIN ; MAX)always true
update t1 set b = b + 1 where t1.b > any (select count(*) from t2 limit 0);
select/**/ * from t1;
a	b	c
1	1	0
2	2	1
3	3	0
4	4	1
5	5	0
6	6	1
7	7	0
8	8	1
rollback;
EXPLAIN update /*+NO_REWRITE*/t1 set b = b + 1 where t1.b > any (select count(*) from t2 limit 0);
Query Plan
=======================================================
|ID|OPERATOR               |NAME|EST.ROWS|EST.TIME(us)|
-------------------------------------------------------
|0 |UPDATE                 |    |4       |60          |
|1 |└─SUBPLAN FILTER       |    |4       |5           |
|2 |  ├─TABLE FULL SCAN    |t1  |8       |3           |
|3 |  └─LIMIT              |    |0       |3           |
|4 |    └─SCALAR GROUP BY  |    |1       |3           |
|5 |      └─TABLE FULL SCAN|t2  |8       |3           |
=======================================================
Outputs & filters:
-------------------------------------
  0 - output(nil), filter(nil)
      table_columns([{t1: ({t1: (t1.a, t1.b, t1.c)})}]),
      update([t1.b=column_conv(INT,PS:(11,0),NULL,cast(t1.b + 1, INT(-1, 0)))])
  1 - output([t1.a], [t1.b], [t1.c]), filter([t1.b > ANY(subquery(1))]), rowset=16
      exec_params_(nil), onetime_exprs_(nil), init_plan_idxs_([1]), use_batch=false
  2 - output([t1.a], [t1.b], [t1.c]), filter(nil), rowset=16
      access([t1.a], [t1.b], [t1.c]), partitions(p0)
      is_index_back=false, is_global_index=false, 
      range_key([t1.a]), range(MIN ; MAX)always true
  3 - output([T_FUN_COUNT_SUM(T_FUN_COUNT(*))]), filter(nil), startup_filter([0]), rowset=16
      limit(0), offset(nil)
  4 - output([T_FUN_COUNT_SUM(T_FUN_COUNT(*))]), filter(nil), rowset=16
      group(nil), agg_func([T_FUN_COUNT_SUM(T_FUN_COUNT(*))])
  5 - output([T_FUN_COUNT(*)]), filter(nil), rowset=16
      access(nil), partitions(p0)
      is_index_back=false, is_global_index=false, 
      range_key([t2.a]), range(MIN ; MAX)always true, 
      pushdown_aggregation([T_FUN_COUNT(*)])
update /*+NO_REWRITE*/t1 set b = b + 1 where t1.b > any (select count(*) from t2 limit 0);
select/**/ * from t1;
a	b	c
1	1	0
2	2	1
3	3	0
4	4	1
5	5	0
6	6	1
7	7	0
8	8	1
rollback;
EXPLAIN delete from t1 where t1.b > any (select count(*) from t2 limit 0);
Query Plan
=================================================
|ID|OPERATOR         |NAME|EST.ROWS|EST.TIME(us)|
-------------------------------------------------
|0 |DELETE           |    |0       |9           |
|1 |└─TABLE FULL SCAN|t1  |0       |3           |
=================================================
Outputs & filters:
-------------------------------------
  0 - output(nil), filter(nil)
      table_columns([{t1: ({t1: (t1.a, t1.b, t1.c)})}])
  1 - output([t1.a], [t1.b], [t1.c]), filter(nil), startup_filter([0]), rowset=16
      access([t1.a], [t1.b], [t1.c]), partitions(p0)
      is_index_back=false, is_global_index=false, 
      range_key([t1.a]), range(MIN ; MAX)always true
delete from t1 where t1.b > any (select count(*) from t2 limit 0);
select/**/ * from t1;
a	b	c
1	1	0
2	2	1
3	3	0
4	4	1
5	5	0
6	6	1
7	7	0
8	8	1
rollback;
EXPLAIN delete /*+NO_REWRITE*/from t1 where t1.b > any (select count(*) from t2 limit 0);
Query Plan
=======================================================
|ID|OPERATOR               |NAME|EST.ROWS|EST.TIME(us)|
-------------------------------------------------------
|0 |DELETE                 |    |4       |32          |
|1 |└─SUBPLAN FILTER       |    |4       |5           |
|2 |  ├─TABLE FULL SCAN    |t1  |8       |3           |
|3 |  └─LIMIT              |    |0       |3           |
|4 |    └─SCALAR GROUP BY  |    |1       |3           |
|5 |      └─TABLE FULL SCAN|t2  |8       |3           |
=======================================================
Outputs & filters:
-------------------------------------
  0 - output(nil), filter(nil)
      table_columns([{t1: ({t1: (t1.a, t1.b, t1.c)})}])
  1 - output([t1.a], [t1.b], [t1.c]), filter([t1.b > ANY(subquery(1))]), rowset=16
      exec_params_(nil), onetime_exprs_(nil), init_plan_idxs_([1]), use_batch=false
  2 - output([t1.a], [t1.b], [t1.c]), filter(nil), rowset=16
      access([t1.a], [t1.b], [t1.c]), partitions(p0)
      is_index_back=false, is_global_index=false, 
      range_key([t1.a]), range(MIN ; MAX)always true
  3 - output([T_FUN_COUNT_SUM(T_FUN_COUNT(*))]), filter(nil), startup_filter([0]), rowset=16
      limit(0), offset(nil)
  4 - output([T_FUN_COUNT_SUM(T_FUN_COUNT(*))]), filter(nil), rowset=16
      group(nil), agg_func([T_FUN_COUNT_SUM(T_FUN_COUNT(*))])
  5 - output([T_FUN_COUNT(*)]), filter(nil), rowset=16
      access(nil), partitions(p0)
      is_index_back=false, is_global_index=false, 
      range_key([t2.a]), range(MIN ; MAX)always true, 
      pushdown_aggregation([T_FUN_COUNT(*)])
delete /*+NO_REWRITE*/from t1 where t1.b > any (select count(*) from t2 limit 0);
select/**/ * from t1;
a	b	c
1	1	0
2	2	1
3	3	0
4	4	1
5	5	0
6	6	1
7	7	0
8	8	1
rollback;
EXPLAIN insert into is_c3 select * from t1 where t1.b > any (select count(*) from t2 limit 0);
Query Plan
==============================================================
|ID|OPERATOR           |NAME           |EST.ROWS|EST.TIME(us)|
--------------------------------------------------------------
|0 |INSERT             |               |0       |9           |
|1 |└─SUBPLAN SCAN     |ANONYMOUS_VIEW1|0       |3           |
|2 |  └─TABLE FULL SCAN|t1             |0       |3           |
==============================================================
Outputs & filters:
-------------------------------------
  0 - output(nil), filter(nil)
      columns([{is_c3: ({is_c3: (is_c3.__pk_increment, is_c3.a, is_c3.b, is_c3.c)})}]), partitions(p0), 
      column_values([T_HIDDEN_PK], [column_conv(INT,PS:(11,0),NULL,ANONYMOUS_VIEW1.a)], [column_conv(INT,PS:(11,0),NULL,ANONYMOUS_VIEW1.b)], [column_conv(INT,
      PS:(11,0),NULL,ANONYMOUS_VIEW1.c)])
  1 - output([ANONYMOUS_VIEW1.a], [ANONYMOUS_VIEW1.b], [ANONYMOUS_VIEW1.c]), filter(nil), startup_filter([0]), rowset=16
      access([ANONYMOUS_VIEW1.a], [ANONYMOUS_VIEW1.b], [ANONYMOUS_VIEW1.c])
  2 - output([t1.a], [t1.b], [t1.c]), filter(nil), rowset=16
      access([t1.a], [t1.b], [t1.c]), partitions(p0)
      is_index_back=false, is_global_index=false, 
      range_key([t1.a]), range(MIN ; MAX)always true
insert into is_c3 select * from t1 where t1.b > any (select count(*) from t2 limit 0);
select/**/ * from is_c3;
a	b	c
rollback;
EXPLAIN insert into is_c3 select /*+NO_REWRITE*/* from t1 where t1.b > any (select count(*) from t2 limit 0);
Query Plan
====================================================================
|ID|OPERATOR                 |NAME           |EST.ROWS|EST.TIME(us)|
--------------------------------------------------------------------
|0 |INSERT                   |               |4       |37          |
|1 |└─SUBPLAN SCAN           |ANONYMOUS_VIEW1|4       |5           |
|2 |  └─SUBPLAN FILTER       |               |4       |5           |
|3 |    ├─TABLE FULL SCAN    |t1             |8       |3           |
|4 |    └─LIMIT              |               |0       |3           |
|5 |      └─SCALAR GROUP BY  |               |1       |3           |
|6 |        └─TABLE FULL SCAN|t2             |8       |3           |
====================================================================
Outputs & filters:
-------------------------------------
  0 - output(nil), filter(nil)
      columns([{is_c3: ({is_c3: (is_c3.__pk_increment, is_c3.a, is_c3.b, is_c3.c)})}]), partitions(p0), 
      column_values([T_HIDDEN_PK], [column_conv(INT,PS:(11,0),NULL,ANONYMOUS_VIEW1.a)], [column_conv(INT,PS:(11,0),NULL,ANONYMOUS_VIEW1.b)], [column_conv(INT,
      PS:(11,0),NULL,ANONYMOUS_VIEW1.c)])
  1 - output([ANONYMOUS_VIEW1.a], [ANONYMOUS_VIEW1.b], [ANONYMOUS_VIEW1.c]), filter(nil), rowset=16
      access([ANONYMOUS_VIEW1.a], [ANONYMOUS_VIEW1.b], [ANONYMOUS_VIEW1.c])
  2 - output([t1.a], [t1.b], [t1.c]), filter([t1.b > ANY(subquery(1))]), rowset=16
      exec_params_(nil), onetime_exprs_(nil), init_plan_idxs_([1]), use_batch=false
  3 - output([t1.a], [t1.b], [t1.c]), filter(nil), rowset=16
      access([t1.a], [t1.b], [t1.c]), partitions(p0)
      is_index_back=false, is_global_index=false, 
      range_key([t1.a]), range(MIN ; MAX)always true
  4 - output([T_FUN_COUNT_SUM(T_FUN_COUNT(*))]), filter(nil), startup_filter([0]), rowset=16
      limit(0), offset(nil)
  5 - output([T_FUN_COUNT_SUM(T_FUN_COUNT(*))]), filter(nil), rowset=16
      group(nil), agg_func([T_FUN_COUNT_SUM(T_FUN_COUNT(*))])
  6 - output([T_FUN_COUNT(*)]), filter(nil), rowset=16
      access(nil), partitions(p0)
      is_index_back=false, is_global_index=false, 
      range_key([t2.a]), range(MIN ; MAX)always true, 
      pushdown_aggregation([T_FUN_COUNT(*)])
insert into is_c3 select /*+NO_REWRITE*/* from t1 where t1.b > any (select count(*) from t2 limit 0);
select/**/ * from is_c3;
a	b	c
rollback;


# case 71
EXPLAIN select * from t1 where t1.b > all (select count(*) from t2 limit 0);
Query Plan
===============================================
|ID|OPERATOR       |NAME|EST.ROWS|EST.TIME(us)|
-----------------------------------------------
|0 |TABLE FULL SCAN|t1  |8       |3           |
===============================================
Outputs & filters:
-------------------------------------
  0 - output([t1.a], [t1.b], [t1.c]), filter(nil), rowset=16
      access([t1.a], [t1.b], [t1.c]), partitions(p0)
      is_index_back=false, is_global_index=false, 
      range_key([t1.a]), range(MIN ; MAX)always true
select * from t1 where t1.b > all (select count(*) from t2 limit 0);
a	b	c
1	1	0
2	2	1
3	3	0
4	4	1
5	5	0
6	6	1
7	7	0
8	8	1
EXPLAIN select /*+NO_REWRITE*/* from t1 where t1.b > all (select count(*) from t2 limit 0);
Query Plan
=====================================================
|ID|OPERATOR             |NAME|EST.ROWS|EST.TIME(us)|
-----------------------------------------------------
|0 |SUBPLAN FILTER       |    |4       |5           |
|1 |├─TABLE FULL SCAN    |t1  |8       |3           |
|2 |└─LIMIT              |    |0       |3           |
|3 |  └─SCALAR GROUP BY  |    |1       |3           |
|4 |    └─TABLE FULL SCAN|t2  |8       |3           |
=====================================================
Outputs & filters:
-------------------------------------
  0 - output([t1.a], [t1.b], [t1.c]), filter([t1.b > ALL(subquery(1))]), rowset=16
      exec_params_(nil), onetime_exprs_(nil), init_plan_idxs_([1]), use_batch=false
  1 - output([t1.a], [t1.b], [t1.c]), filter(nil), rowset=16
      access([t1.a], [t1.b], [t1.c]), partitions(p0)
      is_index_back=false, is_global_index=false, 
      range_key([t1.a]), range(MIN ; MAX)always true
  2 - output([T_FUN_COUNT_SUM(T_FUN_COUNT(*))]), filter(nil), startup_filter([0]), rowset=16
      limit(0), offset(nil)
  3 - output([T_FUN_COUNT_SUM(T_FUN_COUNT(*))]), filter(nil), rowset=16
      group(nil), agg_func([T_FUN_COUNT_SUM(T_FUN_COUNT(*))])
  4 - output([T_FUN_COUNT(*)]), filter(nil), rowset=16
      access(nil), partitions(p0)
      is_index_back=false, is_global_index=false, 
      range_key([t2.a]), range(MIN ; MAX)always true, 
      pushdown_aggregation([T_FUN_COUNT(*)])
select /*+NO_REWRITE*/* from t1 where t1.b > all (select count(*) from t2 limit 0);
a	b	c
1	1	0
2	2	1
3	3	0
4	4	1
5	5	0
6	6	1
7	7	0
8	8	1
EXPLAIN update t1 set b = b + 1 where t1.b > all (select count(*) from t2 limit 0);
Query Plan
=================================================
|ID|OPERATOR         |NAME|EST.ROWS|EST.TIME(us)|
-------------------------------------------------
|0 |UPDATE           |    |8       |88          |
|1 |└─TABLE FULL SCAN|t1  |8       |3           |
=================================================
Outputs & filters:
-------------------------------------
  0 - output(nil), filter(nil)
      table_columns([{t1: ({t1: (t1.a, t1.b, t1.c)})}]),
      update([t1.b=column_conv(INT,PS:(11,0),NULL,cast(t1.b + 1, INT(-1, 0)))])
  1 - output([t1.a], [t1.b], [t1.c]), filter(nil), rowset=16
      access([t1.a], [t1.b], [t1.c]), partitions(p0)
      is_index_back=false, is_global_index=false, 
      range_key([t1.a]), range(MIN ; MAX)always true
update t1 set b = b + 1 where t1.b > all (select count(*) from t2 limit 0);
select/**/ * from t1;
a	b	c
1	2	0
2	3	1
3	4	0
4	5	1
5	6	0
6	7	1
7	8	0
8	9	1
rollback;
EXPLAIN update /*+NO_REWRITE*/t1 set b = b + 1 where t1.b > all (select count(*) from t2 limit 0);
Query Plan
=======================================================
|ID|OPERATOR               |NAME|EST.ROWS|EST.TIME(us)|
-------------------------------------------------------
|0 |UPDATE                 |    |4       |60          |
|1 |└─SUBPLAN FILTER       |    |4       |5           |
|2 |  ├─TABLE FULL SCAN    |t1  |8       |3           |
|3 |  └─LIMIT              |    |0       |3           |
|4 |    └─SCALAR GROUP BY  |    |1       |3           |
|5 |      └─TABLE FULL SCAN|t2  |8       |3           |
=======================================================
Outputs & filters:
-------------------------------------
  0 - output(nil), filter(nil)
      table_columns([{t1: ({t1: (t1.a, t1.b, t1.c)})}]),
      update([t1.b=column_conv(INT,PS:(11,0),NULL,cast(t1.b + 1, INT(-1, 0)))])
  1 - output([t1.a], [t1.b], [t1.c]), filter([t1.b > ALL(subquery(1))]), rowset=16
      exec_params_(nil), onetime_exprs_(nil), init_plan_idxs_([1]), use_batch=false
  2 - output([t1.a], [t1.b], [t1.c]), filter(nil), rowset=16
      access([t1.a], [t1.b], [t1.c]), partitions(p0)
      is_index_back=false, is_global_index=false, 
      range_key([t1.a]), range(MIN ; MAX)always true
  3 - output([T_FUN_COUNT_SUM(T_FUN_COUNT(*))]), filter(nil), startup_filter([0]), rowset=16
      limit(0), offset(nil)
  4 - output([T_FUN_COUNT_SUM(T_FUN_COUNT(*))]), filter(nil), rowset=16
      group(nil), agg_func([T_FUN_COUNT_SUM(T_FUN_COUNT(*))])
  5 - output([T_FUN_COUNT(*)]), filter(nil), rowset=16
      access(nil), partitions(p0)
      is_index_back=false, is_global_index=false, 
      range_key([t2.a]), range(MIN ; MAX)always true, 
      pushdown_aggregation([T_FUN_COUNT(*)])
update /*+NO_REWRITE*/t1 set b = b + 1 where t1.b > all (select count(*) from t2 limit 0);
select/**/ * from t1;
a	b	c
1	2	0
2	3	1
3	4	0
4	5	1
5	6	0
6	7	1
7	8	0
8	9	1
rollback;
EXPLAIN delete from t1 where t1.b > all (select count(*) from t2 limit 0);
Query Plan
=================================================
|ID|OPERATOR         |NAME|EST.ROWS|EST.TIME(us)|
-------------------------------------------------
|0 |DELETE           |    |8       |50          |
|1 |└─TABLE FULL SCAN|t1  |8       |3           |
=================================================
Outputs & filters:
-------------------------------------
  0 - output(nil), filter(nil)
      table_columns([{t1: ({t1: (t1.a, t1.b, t1.c)})}])
  1 - output([t1.a], [t1.b], [t1.c]), filter(nil), rowset=16
      access([t1.a], [t1.b], [t1.c]), partitions(p0)
      is_index_back=false, is_global_index=false, 
      range_key([t1.a]), range(MIN ; MAX)always true
delete from t1 where t1.b > all (select count(*) from t2 limit 0);
select/**/ * from t1;
a	b	c
rollback;
EXPLAIN delete /*+NO_REWRITE*/from t1 where t1.b > all (select count(*) from t2 limit 0);
Query Plan
=======================================================
|ID|OPERATOR               |NAME|EST.ROWS|EST.TIME(us)|
-------------------------------------------------------
|0 |DELETE                 |    |4       |32          |
|1 |└─SUBPLAN FILTER       |    |4       |5           |
|2 |  ├─TABLE FULL SCAN    |t1  |8       |3           |
|3 |  └─LIMIT              |    |0       |3           |
|4 |    └─SCALAR GROUP BY  |    |1       |3           |
|5 |      └─TABLE FULL SCAN|t2  |8       |3           |
=======================================================
Outputs & filters:
-------------------------------------
  0 - output(nil), filter(nil)
      table_columns([{t1: ({t1: (t1.a, t1.b, t1.c)})}])
  1 - output([t1.a], [t1.b], [t1.c]), filter([t1.b > ALL(subquery(1))]), rowset=16
      exec_params_(nil), onetime_exprs_(nil), init_plan_idxs_([1]), use_batch=false
  2 - output([t1.a], [t1.b], [t1.c]), filter(nil), rowset=16
      access([t1.a], [t1.b], [t1.c]), partitions(p0)
      is_index_back=false, is_global_index=false, 
      range_key([t1.a]), range(MIN ; MAX)always true
  3 - output([T_FUN_COUNT_SUM(T_FUN_COUNT(*))]), filter(nil), startup_filter([0]), rowset=16
      limit(0), offset(nil)
  4 - output([T_FUN_COUNT_SUM(T_FUN_COUNT(*))]), filter(nil), rowset=16
      group(nil), agg_func([T_FUN_COUNT_SUM(T_FUN_COUNT(*))])
  5 - output([T_FUN_COUNT(*)]), filter(nil), rowset=16
      access(nil), partitions(p0)
      is_index_back=false, is_global_index=false, 
      range_key([t2.a]), range(MIN ; MAX)always true, 
      pushdown_aggregation([T_FUN_COUNT(*)])
delete /*+NO_REWRITE*/from t1 where t1.b > all (select count(*) from t2 limit 0);
select/**/ * from t1;
a	b	c
rollback;
EXPLAIN insert into is_c3 select * from t1 where t1.b > all (select count(*) from t2 limit 0);
Query Plan
==============================================================
|ID|OPERATOR           |NAME           |EST.ROWS|EST.TIME(us)|
--------------------------------------------------------------
|0 |INSERT             |               |8       |60          |
|1 |└─SUBPLAN SCAN     |ANONYMOUS_VIEW1|8       |3           |
|2 |  └─TABLE FULL SCAN|t1             |8       |3           |
==============================================================
Outputs & filters:
-------------------------------------
  0 - output(nil), filter(nil)
      columns([{is_c3: ({is_c3: (is_c3.__pk_increment, is_c3.a, is_c3.b, is_c3.c)})}]), partitions(p0), 
      column_values([T_HIDDEN_PK], [column_conv(INT,PS:(11,0),NULL,ANONYMOUS_VIEW1.a)], [column_conv(INT,PS:(11,0),NULL,ANONYMOUS_VIEW1.b)], [column_conv(INT,
      PS:(11,0),NULL,ANONYMOUS_VIEW1.c)])
  1 - output([ANONYMOUS_VIEW1.a], [ANONYMOUS_VIEW1.b], [ANONYMOUS_VIEW1.c]), filter(nil), rowset=16
      access([ANONYMOUS_VIEW1.a], [ANONYMOUS_VIEW1.b], [ANONYMOUS_VIEW1.c])
  2 - output([t1.a], [t1.b], [t1.c]), filter(nil), rowset=16
      access([t1.a], [t1.b], [t1.c]), partitions(p0)
      is_index_back=false, is_global_index=false, 
      range_key([t1.a]), range(MIN ; MAX)always true
insert into is_c3 select * from t1 where t1.b > all (select count(*) from t2 limit 0);
select/**/ * from is_c3;
a	b	c
1	1	0
2	2	1
3	3	0
4	4	1
5	5	0
6	6	1
7	7	0
8	8	1
rollback;
EXPLAIN insert into is_c3 select /*+NO_REWRITE*/* from t1 where t1.b > all (select count(*) from t2 limit 0);
Query Plan
====================================================================
|ID|OPERATOR                 |NAME           |EST.ROWS|EST.TIME(us)|
--------------------------------------------------------------------
|0 |INSERT                   |               |4       |37          |
|1 |└─SUBPLAN SCAN           |ANONYMOUS_VIEW1|4       |5           |
|2 |  └─SUBPLAN FILTER       |               |4       |5           |
|3 |    ├─TABLE FULL SCAN    |t1             |8       |3           |
|4 |    └─LIMIT              |               |0       |3           |
|5 |      └─SCALAR GROUP BY  |               |1       |3           |
|6 |        └─TABLE FULL SCAN|t2             |8       |3           |
====================================================================
Outputs & filters:
-------------------------------------
  0 - output(nil), filter(nil)
      columns([{is_c3: ({is_c3: (is_c3.__pk_increment, is_c3.a, is_c3.b, is_c3.c)})}]), partitions(p0), 
      column_values([T_HIDDEN_PK], [column_conv(INT,PS:(11,0),NULL,ANONYMOUS_VIEW1.a)], [column_conv(INT,PS:(11,0),NULL,ANONYMOUS_VIEW1.b)], [column_conv(INT,
      PS:(11,0),NULL,ANONYMOUS_VIEW1.c)])
  1 - output([ANONYMOUS_VIEW1.a], [ANONYMOUS_VIEW1.b], [ANONYMOUS_VIEW1.c]), filter(nil), rowset=16
      access([ANONYMOUS_VIEW1.a], [ANONYMOUS_VIEW1.b], [ANONYMOUS_VIEW1.c])
  2 - output([t1.a], [t1.b], [t1.c]), filter([t1.b > ALL(subquery(1))]), rowset=16
      exec_params_(nil), onetime_exprs_(nil), init_plan_idxs_([1]), use_batch=false
  3 - output([t1.a], [t1.b], [t1.c]), filter(nil), rowset=16
      access([t1.a], [t1.b], [t1.c]), partitions(p0)
      is_index_back=false, is_global_index=false, 
      range_key([t1.a]), range(MIN ; MAX)always true
  4 - output([T_FUN_COUNT_SUM(T_FUN_COUNT(*))]), filter(nil), startup_filter([0]), rowset=16
      limit(0), offset(nil)
  5 - output([T_FUN_COUNT_SUM(T_FUN_COUNT(*))]), filter(nil), rowset=16
      group(nil), agg_func([T_FUN_COUNT_SUM(T_FUN_COUNT(*))])
  6 - output([T_FUN_COUNT(*)]), filter(nil), rowset=16
      access(nil), partitions(p0)
      is_index_back=false, is_global_index=false, 
      range_key([t2.a]), range(MIN ; MAX)always true, 
      pushdown_aggregation([T_FUN_COUNT(*)])
insert into is_c3 select /*+NO_REWRITE*/* from t1 where t1.b > all (select count(*) from t2 limit 0);
select/**/ * from is_c3;
a	b	c
1	1	0
2	2	1
3	3	0
4	4	1
5	5	0
6	6	1
7	7	0
8	8	1
rollback;


# case 72
EXPLAIN select * from t1 where t1.b in (select count(*) from t2 limit 0);
Query Plan
===============================================
|ID|OPERATOR       |NAME|EST.ROWS|EST.TIME(us)|
-----------------------------------------------
|0 |TABLE FULL SCAN|t1  |0       |3           |
===============================================
Outputs & filters:
-------------------------------------
  0 - output([t1.a], [t1.b], [t1.c]), filter(nil), startup_filter([0]), rowset=16
      access([t1.a], [t1.b], [t1.c]), partitions(p0)
      is_index_back=false, is_global_index=false, 
      range_key([t1.a]), range(MIN ; MAX)always true
select * from t1 where t1.b in (select count(*) from t2 limit 0);
a	b	c
EXPLAIN select /*+NO_REWRITE*/* from t1 where t1.b in (select count(*) from t2 limit 0);
Query Plan
=====================================================
|ID|OPERATOR             |NAME|EST.ROWS|EST.TIME(us)|
-----------------------------------------------------
|0 |SUBPLAN FILTER       |    |4       |5           |
|1 |├─TABLE FULL SCAN    |t1  |8       |3           |
|2 |└─LIMIT              |    |0       |3           |
|3 |  └─SCALAR GROUP BY  |    |1       |3           |
|4 |    └─TABLE FULL SCAN|t2  |8       |3           |
=====================================================
Outputs & filters:
-------------------------------------
  0 - output([t1.a], [t1.b], [t1.c]), filter([t1.b = ANY(subquery(1))]), rowset=16
      exec_params_(nil), onetime_exprs_(nil), init_plan_idxs_([1]), use_batch=false
  1 - output([t1.a], [t1.b], [t1.c]), filter(nil), rowset=16
      access([t1.a], [t1.b], [t1.c]), partitions(p0)
      is_index_back=false, is_global_index=false, 
      range_key([t1.a]), range(MIN ; MAX)always true
  2 - output([T_FUN_COUNT_SUM(T_FUN_COUNT(*))]), filter(nil), startup_filter([0]), rowset=16
      limit(0), offset(nil)
  3 - output([T_FUN_COUNT_SUM(T_FUN_COUNT(*))]), filter(nil), rowset=16
      group(nil), agg_func([T_FUN_COUNT_SUM(T_FUN_COUNT(*))])
  4 - output([T_FUN_COUNT(*)]), filter(nil), rowset=16
      access(nil), partitions(p0)
      is_index_back=false, is_global_index=false, 
      range_key([t2.a]), range(MIN ; MAX)always true, 
      pushdown_aggregation([T_FUN_COUNT(*)])
select /*+NO_REWRITE*/* from t1 where t1.b in (select count(*) from t2 limit 0);
a	b	c
EXPLAIN update t1 set b = b + 1 where t1.b in (select count(*) from t2 limit 0);
Query Plan
=================================================
|ID|OPERATOR         |NAME|EST.ROWS|EST.TIME(us)|
-------------------------------------------------
|0 |UPDATE           |    |0       |27          |
|1 |└─TABLE FULL SCAN|t1  |0       |3           |
=================================================
Outputs & filters:
-------------------------------------
  0 - output(nil), filter(nil)
      table_columns([{t1: ({t1: (t1.a, t1.b, t1.c)})}]),
      update([t1.b=column_conv(INT,PS:(11,0),NULL,cast(t1.b + 1, INT(-1, 0)))])
  1 - output([t1.a], [t1.b], [t1.c]), filter(nil), startup_filter([0]), rowset=16
      access([t1.a], [t1.b], [t1.c]), partitions(p0)
      is_index_back=false, is_global_index=false, 
      range_key([t1.a]), range(MIN ; MAX)always true
update t1 set b = b + 1 where t1.b in (select count(*) from t2 limit 0);
select/**/ * from t1;
a	b	c
1	1	0
2	2	1
3	3	0
4	4	1
5	5	0
6	6	1
7	7	0
8	8	1
rollback;
EXPLAIN update /*+NO_REWRITE*/t1 set b = b + 1 where t1.b in (select count(*) from t2 limit 0);
Query Plan
=======================================================
|ID|OPERATOR               |NAME|EST.ROWS|EST.TIME(us)|
-------------------------------------------------------
|0 |UPDATE                 |    |4       |60          |
|1 |└─SUBPLAN FILTER       |    |4       |5           |
|2 |  ├─TABLE FULL SCAN    |t1  |8       |3           |
|3 |  └─LIMIT              |    |0       |3           |
|4 |    └─SCALAR GROUP BY  |    |1       |3           |
|5 |      └─TABLE FULL SCAN|t2  |8       |3           |
=======================================================
Outputs & filters:
-------------------------------------
  0 - output(nil), filter(nil)
      table_columns([{t1: ({t1: (t1.a, t1.b, t1.c)})}]),
      update([t1.b=column_conv(INT,PS:(11,0),NULL,cast(t1.b + 1, INT(-1, 0)))])
  1 - output([t1.a], [t1.b], [t1.c]), filter([t1.b = ANY(subquery(1))]), rowset=16
      exec_params_(nil), onetime_exprs_(nil), init_plan_idxs_([1]), use_batch=false
  2 - output([t1.a], [t1.b], [t1.c]), filter(nil), rowset=16
      access([t1.a], [t1.b], [t1.c]), partitions(p0)
      is_index_back=false, is_global_index=false, 
      range_key([t1.a]), range(MIN ; MAX)always true
  3 - output([T_FUN_COUNT_SUM(T_FUN_COUNT(*))]), filter(nil), startup_filter([0]), rowset=16
      limit(0), offset(nil)
  4 - output([T_FUN_COUNT_SUM(T_FUN_COUNT(*))]), filter(nil), rowset=16
      group(nil), agg_func([T_FUN_COUNT_SUM(T_FUN_COUNT(*))])
  5 - output([T_FUN_COUNT(*)]), filter(nil), rowset=16
      access(nil), partitions(p0)
      is_index_back=false, is_global_index=false, 
      range_key([t2.a]), range(MIN ; MAX)always true, 
      pushdown_aggregation([T_FUN_COUNT(*)])
update /*+NO_REWRITE*/t1 set b = b + 1 where t1.b in (select count(*) from t2 limit 0);
select/**/ * from t1;
a	b	c
1	1	0
2	2	1
3	3	0
4	4	1
5	5	0
6	6	1
7	7	0
8	8	1
rollback;
EXPLAIN delete from t1 where t1.b in (select count(*) from t2 limit 0);
Query Plan
=================================================
|ID|OPERATOR         |NAME|EST.ROWS|EST.TIME(us)|
-------------------------------------------------
|0 |DELETE           |    |0       |9           |
|1 |└─TABLE FULL SCAN|t1  |0       |3           |
=================================================
Outputs & filters:
-------------------------------------
  0 - output(nil), filter(nil)
      table_columns([{t1: ({t1: (t1.a, t1.b, t1.c)})}])
  1 - output([t1.a], [t1.b], [t1.c]), filter(nil), startup_filter([0]), rowset=16
      access([t1.a], [t1.b], [t1.c]), partitions(p0)
      is_index_back=false, is_global_index=false, 
      range_key([t1.a]), range(MIN ; MAX)always true
delete from t1 where t1.b in (select count(*) from t2 limit 0);
select/**/ * from t1;
a	b	c
1	1	0
2	2	1
3	3	0
4	4	1
5	5	0
6	6	1
7	7	0
8	8	1
rollback;
EXPLAIN delete /*+NO_REWRITE*/from t1 where t1.b in (select count(*) from t2 limit 0);
Query Plan
=======================================================
|ID|OPERATOR               |NAME|EST.ROWS|EST.TIME(us)|
-------------------------------------------------------
|0 |DELETE                 |    |4       |32          |
|1 |└─SUBPLAN FILTER       |    |4       |5           |
|2 |  ├─TABLE FULL SCAN    |t1  |8       |3           |
|3 |  └─LIMIT              |    |0       |3           |
|4 |    └─SCALAR GROUP BY  |    |1       |3           |
|5 |      └─TABLE FULL SCAN|t2  |8       |3           |
=======================================================
Outputs & filters:
-------------------------------------
  0 - output(nil), filter(nil)
      table_columns([{t1: ({t1: (t1.a, t1.b, t1.c)})}])
  1 - output([t1.a], [t1.b], [t1.c]), filter([t1.b = ANY(subquery(1))]), rowset=16
      exec_params_(nil), onetime_exprs_(nil), init_plan_idxs_([1]), use_batch=false
  2 - output([t1.a], [t1.b], [t1.c]), filter(nil), rowset=16
      access([t1.a], [t1.b], [t1.c]), partitions(p0)
      is_index_back=false, is_global_index=false, 
      range_key([t1.a]), range(MIN ; MAX)always true
  3 - output([T_FUN_COUNT_SUM(T_FUN_COUNT(*))]), filter(nil), startup_filter([0]), rowset=16
      limit(0), offset(nil)
  4 - output([T_FUN_COUNT_SUM(T_FUN_COUNT(*))]), filter(nil), rowset=16
      group(nil), agg_func([T_FUN_COUNT_SUM(T_FUN_COUNT(*))])
  5 - output([T_FUN_COUNT(*)]), filter(nil), rowset=16
      access(nil), partitions(p0)
      is_index_back=false, is_global_index=false, 
      range_key([t2.a]), range(MIN ; MAX)always true, 
      pushdown_aggregation([T_FUN_COUNT(*)])
delete /*+NO_REWRITE*/from t1 where t1.b in (select count(*) from t2 limit 0);
select/**/ * from t1;
a	b	c
1	1	0
2	2	1
3	3	0
4	4	1
5	5	0
6	6	1
7	7	0
8	8	1
rollback;
EXPLAIN insert into is_c3 select * from t1 where t1.b in (select count(*) from t2 limit 0);
Query Plan
==============================================================
|ID|OPERATOR           |NAME           |EST.ROWS|EST.TIME(us)|
--------------------------------------------------------------
|0 |INSERT             |               |0       |9           |
|1 |└─SUBPLAN SCAN     |ANONYMOUS_VIEW1|0       |3           |
|2 |  └─TABLE FULL SCAN|t1             |0       |3           |
==============================================================
Outputs & filters:
-------------------------------------
  0 - output(nil), filter(nil)
      columns([{is_c3: ({is_c3: (is_c3.__pk_increment, is_c3.a, is_c3.b, is_c3.c)})}]), partitions(p0), 
      column_values([T_HIDDEN_PK], [column_conv(INT,PS:(11,0),NULL,ANONYMOUS_VIEW1.a)], [column_conv(INT,PS:(11,0),NULL,ANONYMOUS_VIEW1.b)], [column_conv(INT,
      PS:(11,0),NULL,ANONYMOUS_VIEW1.c)])
  1 - output([ANONYMOUS_VIEW1.a], [ANONYMOUS_VIEW1.b], [ANONYMOUS_VIEW1.c]), filter(nil), startup_filter([0]), rowset=16
      access([ANONYMOUS_VIEW1.a], [ANONYMOUS_VIEW1.b], [ANONYMOUS_VIEW1.c])
  2 - output([t1.a], [t1.b], [t1.c]), filter(nil), rowset=16
      access([t1.a], [t1.b], [t1.c]), partitions(p0)
      is_index_back=false, is_global_index=false, 
      range_key([t1.a]), range(MIN ; MAX)always true
insert into is_c3 select * from t1 where t1.b in (select count(*) from t2 limit 0);
select/**/ * from is_c3;
a	b	c
rollback;
EXPLAIN insert into is_c3 select /*+NO_REWRITE*/* from t1 where t1.b in (select count(*) from t2 limit 0);
Query Plan
====================================================================
|ID|OPERATOR                 |NAME           |EST.ROWS|EST.TIME(us)|
--------------------------------------------------------------------
|0 |INSERT                   |               |4       |37          |
|1 |└─SUBPLAN SCAN           |ANONYMOUS_VIEW1|4       |5           |
|2 |  └─SUBPLAN FILTER       |               |4       |5           |
|3 |    ├─TABLE FULL SCAN    |t1             |8       |3           |
|4 |    └─LIMIT              |               |0       |3           |
|5 |      └─SCALAR GROUP BY  |               |1       |3           |
|6 |        └─TABLE FULL SCAN|t2             |8       |3           |
====================================================================
Outputs & filters:
-------------------------------------
  0 - output(nil), filter(nil)
      columns([{is_c3: ({is_c3: (is_c3.__pk_increment, is_c3.a, is_c3.b, is_c3.c)})}]), partitions(p0), 
      column_values([T_HIDDEN_PK], [column_conv(INT,PS:(11,0),NULL,ANONYMOUS_VIEW1.a)], [column_conv(INT,PS:(11,0),NULL,ANONYMOUS_VIEW1.b)], [column_conv(INT,
      PS:(11,0),NULL,ANONYMOUS_VIEW1.c)])
  1 - output([ANONYMOUS_VIEW1.a], [ANONYMOUS_VIEW1.b], [ANONYMOUS_VIEW1.c]), filter(nil), rowset=16
      access([ANONYMOUS_VIEW1.a], [ANONYMOUS_VIEW1.b], [ANONYMOUS_VIEW1.c])
  2 - output([t1.a], [t1.b], [t1.c]), filter([t1.b = ANY(subquery(1))]), rowset=16
      exec_params_(nil), onetime_exprs_(nil), init_plan_idxs_([1]), use_batch=false
  3 - output([t1.a], [t1.b], [t1.c]), filter(nil), rowset=16
      access([t1.a], [t1.b], [t1.c]), partitions(p0)
      is_index_back=false, is_global_index=false, 
      range_key([t1.a]), range(MIN ; MAX)always true
  4 - output([T_FUN_COUNT_SUM(T_FUN_COUNT(*))]), filter(nil), startup_filter([0]), rowset=16
      limit(0), offset(nil)
  5 - output([T_FUN_COUNT_SUM(T_FUN_COUNT(*))]), filter(nil), rowset=16
      group(nil), agg_func([T_FUN_COUNT_SUM(T_FUN_COUNT(*))])
  6 - output([T_FUN_COUNT(*)]), filter(nil), rowset=16
      access(nil), partitions(p0)
      is_index_back=false, is_global_index=false, 
      range_key([t2.a]), range(MIN ; MAX)always true, 
      pushdown_aggregation([T_FUN_COUNT(*)])
insert into is_c3 select /*+NO_REWRITE*/* from t1 where t1.b in (select count(*) from t2 limit 0);
select/**/ * from is_c3;
a	b	c
rollback;


# case 73
## any/all 不可删除的情景
EXPLAIN select * from t1 where t1.b > any (select count(*) from t2 group by t2.c);
Query Plan
========================================================
|ID|OPERATOR               |NAME |EST.ROWS|EST.TIME(us)|
--------------------------------------------------------
|0 |NESTED-LOOP SEMI JOIN  |     |1       |7           |
|1 |├─TABLE FULL SCAN      |t1   |8       |3           |
|2 |└─MATERIAL             |     |2       |4           |
|3 |  └─SUBPLAN SCAN       |VIEW1|2       |4           |
|4 |    └─HASH GROUP BY    |     |2       |4           |
|5 |      └─TABLE FULL SCAN|t2   |8       |3           |
========================================================
Outputs & filters:
-------------------------------------
  0 - output([t1.a], [t1.b], [t1.c]), filter(nil), rowset=16
      conds([t1.b > VIEW1.count(*)]), nl_params_(nil), use_batch=false
  1 - output([t1.a], [t1.b], [t1.c]), filter(nil), rowset=16
      access([t1.a], [t1.b], [t1.c]), partitions(p0)
      is_index_back=false, is_global_index=false, 
      range_key([t1.a]), range(MIN ; MAX)always true
  2 - output([VIEW1.count(*)]), filter(nil), rowset=16
  3 - output([VIEW1.count(*)]), filter(nil), rowset=16
      access([VIEW1.count(*)])
  4 - output([T_FUN_COUNT(*)]), filter(nil), rowset=16
      group([t2.c]), agg_func([T_FUN_COUNT(*)])
  5 - output([t2.c]), filter(nil), rowset=16
      access([t2.c]), partitions(p0)
      is_index_back=false, is_global_index=false, 
      range_key([t2.a]), range(MIN ; MAX)always true
select * from t1 where t1.b > any (select count(*) from t2 group by t2.c);
a	b	c
5	5	0
6	6	1
7	7	0
8	8	1
EXPLAIN select /*+NO_REWRITE*/* from t1 where t1.b > any (select count(*) from t2 group by t2.c);
Query Plan
===================================================
|ID|OPERATOR           |NAME|EST.ROWS|EST.TIME(us)|
---------------------------------------------------
|0 |SUBPLAN FILTER     |    |4       |7           |
|1 |├─TABLE FULL SCAN  |t1  |8       |3           |
|2 |└─HASH GROUP BY    |    |2       |4           |
|3 |  └─TABLE FULL SCAN|t2  |8       |3           |
===================================================
Outputs & filters:
-------------------------------------
  0 - output([t1.a], [t1.b], [t1.c]), filter([t1.b > ANY(subquery(1))]), rowset=16
      exec_params_(nil), onetime_exprs_(nil), init_plan_idxs_([1]), use_batch=false
  1 - output([t1.a], [t1.b], [t1.c]), filter(nil), rowset=16
      access([t1.a], [t1.b], [t1.c]), partitions(p0)
      is_index_back=false, is_global_index=false, 
      range_key([t1.a]), range(MIN ; MAX)always true
  2 - output([T_FUN_COUNT(*)]), filter(nil), rowset=16
      group([t2.c]), agg_func([T_FUN_COUNT(*)])
  3 - output([t2.c]), filter(nil), rowset=16
      access([t2.c]), partitions(p0)
      is_index_back=false, is_global_index=false, 
      range_key([t2.a]), range(MIN ; MAX)always true
select /*+NO_REWRITE*/* from t1 where t1.b > any (select count(*) from t2 group by t2.c);
a	b	c
5	5	0
6	6	1
7	7	0
8	8	1
EXPLAIN update t1 set b = b + 1 where t1.b > any (select count(*) from t2 group by t2.c);
Query Plan
==========================================================
|ID|OPERATOR                 |NAME |EST.ROWS|EST.TIME(us)|
----------------------------------------------------------
|0 |UPDATE                   |     |1       |34          |
|1 |└─NESTED-LOOP SEMI JOIN  |     |1       |7           |
|2 |  ├─TABLE FULL SCAN      |t1   |8       |3           |
|3 |  └─MATERIAL             |     |2       |4           |
|4 |    └─SUBPLAN SCAN       |VIEW1|2       |4           |
|5 |      └─HASH GROUP BY    |     |2       |4           |
|6 |        └─TABLE FULL SCAN|t2   |8       |3           |
==========================================================
Outputs & filters:
-------------------------------------
  0 - output(nil), filter(nil)
      table_columns([{t1: ({t1: (t1.a, t1.b, t1.c)})}]),
      update([t1.b=column_conv(INT,PS:(11,0),NULL,cast(t1.b + 1, INT(-1, 0)))])
  1 - output([t1.a], [t1.b], [t1.c]), filter(nil), rowset=16
      conds([t1.b > VIEW1.count(*)]), nl_params_(nil), use_batch=false
  2 - output([t1.a], [t1.b], [t1.c]), filter(nil), rowset=16
      access([t1.a], [t1.b], [t1.c]), partitions(p0)
      is_index_back=false, is_global_index=false, 
      range_key([t1.a]), range(MIN ; MAX)always true
  3 - output([VIEW1.count(*)]), filter(nil), rowset=16
  4 - output([VIEW1.count(*)]), filter(nil), rowset=16
      access([VIEW1.count(*)])
  5 - output([T_FUN_COUNT(*)]), filter(nil), rowset=16
      group([t2.c]), agg_func([T_FUN_COUNT(*)])
  6 - output([t2.c]), filter(nil), rowset=16
      access([t2.c]), partitions(p0)
      is_index_back=false, is_global_index=false, 
      range_key([t2.a]), range(MIN ; MAX)always true
update t1 set b = b + 1 where t1.b > any (select count(*) from t2 group by t2.c);
select/**/ * from t1;
a	b	c
1	1	0
2	2	1
3	3	0
4	4	1
5	6	0
6	7	1
7	8	0
8	9	1
rollback;
EXPLAIN update /*+NO_REWRITE*/t1 set b = b + 1 where t1.b > any (select count(*) from t2 group by t2.c);
Query Plan
=====================================================
|ID|OPERATOR             |NAME|EST.ROWS|EST.TIME(us)|
-----------------------------------------------------
|0 |UPDATE               |    |4       |61          |
|1 |└─SUBPLAN FILTER     |    |4       |7           |
|2 |  ├─TABLE FULL SCAN  |t1  |8       |3           |
|3 |  └─HASH GROUP BY    |    |2       |4           |
|4 |    └─TABLE FULL SCAN|t2  |8       |3           |
=====================================================
Outputs & filters:
-------------------------------------
  0 - output(nil), filter(nil)
      table_columns([{t1: ({t1: (t1.a, t1.b, t1.c)})}]),
      update([t1.b=column_conv(INT,PS:(11,0),NULL,cast(t1.b + 1, INT(-1, 0)))])
  1 - output([t1.a], [t1.b], [t1.c]), filter([t1.b > ANY(subquery(1))]), rowset=16
      exec_params_(nil), onetime_exprs_(nil), init_plan_idxs_([1]), use_batch=false
  2 - output([t1.a], [t1.b], [t1.c]), filter(nil), rowset=16
      access([t1.a], [t1.b], [t1.c]), partitions(p0)
      is_index_back=false, is_global_index=false, 
      range_key([t1.a]), range(MIN ; MAX)always true
  3 - output([T_FUN_COUNT(*)]), filter(nil), rowset=16
      group([t2.c]), agg_func([T_FUN_COUNT(*)])
  4 - output([t2.c]), filter(nil), rowset=16
      access([t2.c]), partitions(p0)
      is_index_back=false, is_global_index=false, 
      range_key([t2.a]), range(MIN ; MAX)always true
update /*+NO_REWRITE*/t1 set b = b + 1 where t1.b > any (select count(*) from t2 group by t2.c);
select/**/ * from t1;
a	b	c
1	1	0
2	2	1
3	3	0
4	4	1
5	6	0
6	7	1
7	8	0
8	9	1
rollback;
EXPLAIN delete from t1 where t1.b > any (select count(*) from t2 group by t2.c);
Query Plan
==========================================================
|ID|OPERATOR                 |NAME |EST.ROWS|EST.TIME(us)|
----------------------------------------------------------
|0 |DELETE                   |     |1       |16          |
|1 |└─NESTED-LOOP SEMI JOIN  |     |1       |7           |
|2 |  ├─TABLE FULL SCAN      |t1   |8       |3           |
|3 |  └─MATERIAL             |     |2       |4           |
|4 |    └─SUBPLAN SCAN       |VIEW1|2       |4           |
|5 |      └─HASH GROUP BY    |     |2       |4           |
|6 |        └─TABLE FULL SCAN|t2   |8       |3           |
==========================================================
Outputs & filters:
-------------------------------------
  0 - output(nil), filter(nil)
      table_columns([{t1: ({t1: (t1.a, t1.b, t1.c)})}])
  1 - output([t1.a], [t1.b], [t1.c]), filter(nil), rowset=16
      conds([t1.b > VIEW1.count(*)]), nl_params_(nil), use_batch=false
  2 - output([t1.a], [t1.b], [t1.c]), filter(nil), rowset=16
      access([t1.a], [t1.b], [t1.c]), partitions(p0)
      is_index_back=false, is_global_index=false, 
      range_key([t1.a]), range(MIN ; MAX)always true
  3 - output([VIEW1.count(*)]), filter(nil), rowset=16
  4 - output([VIEW1.count(*)]), filter(nil), rowset=16
      access([VIEW1.count(*)])
  5 - output([T_FUN_COUNT(*)]), filter(nil), rowset=16
      group([t2.c]), agg_func([T_FUN_COUNT(*)])
  6 - output([t2.c]), filter(nil), rowset=16
      access([t2.c]), partitions(p0)
      is_index_back=false, is_global_index=false, 
      range_key([t2.a]), range(MIN ; MAX)always true
delete from t1 where t1.b > any (select count(*) from t2 group by t2.c);
select/**/ * from t1;
a	b	c
1	1	0
2	2	1
3	3	0
4	4	1
rollback;
EXPLAIN delete /*+NO_REWRITE*/from t1 where t1.b > any (select count(*) from t2 group by t2.c);
Query Plan
=====================================================
|ID|OPERATOR             |NAME|EST.ROWS|EST.TIME(us)|
-----------------------------------------------------
|0 |DELETE               |    |4       |33          |
|1 |└─SUBPLAN FILTER     |    |4       |7           |
|2 |  ├─TABLE FULL SCAN  |t1  |8       |3           |
|3 |  └─HASH GROUP BY    |    |2       |4           |
|4 |    └─TABLE FULL SCAN|t2  |8       |3           |
=====================================================
Outputs & filters:
-------------------------------------
  0 - output(nil), filter(nil)
      table_columns([{t1: ({t1: (t1.a, t1.b, t1.c)})}])
  1 - output([t1.a], [t1.b], [t1.c]), filter([t1.b > ANY(subquery(1))]), rowset=16
      exec_params_(nil), onetime_exprs_(nil), init_plan_idxs_([1]), use_batch=false
  2 - output([t1.a], [t1.b], [t1.c]), filter(nil), rowset=16
      access([t1.a], [t1.b], [t1.c]), partitions(p0)
      is_index_back=false, is_global_index=false, 
      range_key([t1.a]), range(MIN ; MAX)always true
  3 - output([T_FUN_COUNT(*)]), filter(nil), rowset=16
      group([t2.c]), agg_func([T_FUN_COUNT(*)])
  4 - output([t2.c]), filter(nil), rowset=16
      access([t2.c]), partitions(p0)
      is_index_back=false, is_global_index=false, 
      range_key([t2.a]), range(MIN ; MAX)always true
delete /*+NO_REWRITE*/from t1 where t1.b > any (select count(*) from t2 group by t2.c);
select/**/ * from t1;
a	b	c
1	1	0
2	2	1
3	3	0
4	4	1
rollback;
EXPLAIN insert into is_c3 select * from t1 where t1.b > any (select count(*) from t2 group by t2.c);
Query Plan
======================================================================
|ID|OPERATOR                   |NAME           |EST.ROWS|EST.TIME(us)|
----------------------------------------------------------------------
|0 |INSERT                     |               |1       |16          |
|1 |└─SUBPLAN SCAN             |ANONYMOUS_VIEW1|1       |7           |
|2 |  └─NESTED-LOOP SEMI JOIN  |               |1       |7           |
|3 |    ├─TABLE FULL SCAN      |t1             |8       |3           |
|4 |    └─MATERIAL             |               |2       |4           |
|5 |      └─SUBPLAN SCAN       |VIEW1          |2       |4           |
|6 |        └─HASH GROUP BY    |               |2       |4           |
|7 |          └─TABLE FULL SCAN|t2             |8       |3           |
======================================================================
Outputs & filters:
-------------------------------------
  0 - output(nil), filter(nil)
      columns([{is_c3: ({is_c3: (is_c3.__pk_increment, is_c3.a, is_c3.b, is_c3.c)})}]), partitions(p0), 
      column_values([T_HIDDEN_PK], [column_conv(INT,PS:(11,0),NULL,ANONYMOUS_VIEW1.a)], [column_conv(INT,PS:(11,0),NULL,ANONYMOUS_VIEW1.b)], [column_conv(INT,
      PS:(11,0),NULL,ANONYMOUS_VIEW1.c)])
  1 - output([ANONYMOUS_VIEW1.a], [ANONYMOUS_VIEW1.b], [ANONYMOUS_VIEW1.c]), filter(nil), rowset=16
      access([ANONYMOUS_VIEW1.a], [ANONYMOUS_VIEW1.b], [ANONYMOUS_VIEW1.c])
  2 - output([t1.a], [t1.b], [t1.c]), filter(nil), rowset=16
      conds([t1.b > VIEW1.count(*)]), nl_params_(nil), use_batch=false
  3 - output([t1.a], [t1.b], [t1.c]), filter(nil), rowset=16
      access([t1.a], [t1.b], [t1.c]), partitions(p0)
      is_index_back=false, is_global_index=false, 
      range_key([t1.a]), range(MIN ; MAX)always true
  4 - output([VIEW1.count(*)]), filter(nil), rowset=16
  5 - output([VIEW1.count(*)]), filter(nil), rowset=16
      access([VIEW1.count(*)])
  6 - output([T_FUN_COUNT(*)]), filter(nil), rowset=16
      group([t2.c]), agg_func([T_FUN_COUNT(*)])
  7 - output([t2.c]), filter(nil), rowset=16
      access([t2.c]), partitions(p0)
      is_index_back=false, is_global_index=false, 
      range_key([t2.a]), range(MIN ; MAX)always true
insert into is_c3 select * from t1 where t1.b > any (select count(*) from t2 group by t2.c);
select/**/ * from is_c3;
a	b	c
5	5	0
6	6	1
7	7	0
8	8	1
rollback;
EXPLAIN insert into is_c3 select /*+NO_REWRITE*/* from t1 where t1.b > any (select count(*) from t2 group by t2.c);
Query Plan
==================================================================
|ID|OPERATOR               |NAME           |EST.ROWS|EST.TIME(us)|
------------------------------------------------------------------
|0 |INSERT                 |               |4       |39          |
|1 |└─SUBPLAN SCAN         |ANONYMOUS_VIEW1|4       |7           |
|2 |  └─SUBPLAN FILTER     |               |4       |7           |
|3 |    ├─TABLE FULL SCAN  |t1             |8       |3           |
|4 |    └─HASH GROUP BY    |               |2       |4           |
|5 |      └─TABLE FULL SCAN|t2             |8       |3           |
==================================================================
Outputs & filters:
-------------------------------------
  0 - output(nil), filter(nil)
      columns([{is_c3: ({is_c3: (is_c3.__pk_increment, is_c3.a, is_c3.b, is_c3.c)})}]), partitions(p0), 
      column_values([T_HIDDEN_PK], [column_conv(INT,PS:(11,0),NULL,ANONYMOUS_VIEW1.a)], [column_conv(INT,PS:(11,0),NULL,ANONYMOUS_VIEW1.b)], [column_conv(INT,
      PS:(11,0),NULL,ANONYMOUS_VIEW1.c)])
  1 - output([ANONYMOUS_VIEW1.a], [ANONYMOUS_VIEW1.b], [ANONYMOUS_VIEW1.c]), filter(nil), rowset=16
      access([ANONYMOUS_VIEW1.a], [ANONYMOUS_VIEW1.b], [ANONYMOUS_VIEW1.c])
  2 - output([t1.a], [t1.b], [t1.c]), filter([t1.b > ANY(subquery(1))]), rowset=16
      exec_params_(nil), onetime_exprs_(nil), init_plan_idxs_([1]), use_batch=false
  3 - output([t1.a], [t1.b], [t1.c]), filter(nil), rowset=16
      access([t1.a], [t1.b], [t1.c]), partitions(p0)
      is_index_back=false, is_global_index=false, 
      range_key([t1.a]), range(MIN ; MAX)always true
  4 - output([T_FUN_COUNT(*)]), filter(nil), rowset=16
      group([t2.c]), agg_func([T_FUN_COUNT(*)])
  5 - output([t2.c]), filter(nil), rowset=16
      access([t2.c]), partitions(p0)
      is_index_back=false, is_global_index=false, 
      range_key([t2.a]), range(MIN ; MAX)always true
insert into is_c3 select /*+NO_REWRITE*/* from t1 where t1.b > any (select count(*) from t2 group by t2.c);
select/**/ * from is_c3;
a	b	c
5	5	0
6	6	1
7	7	0
8	8	1
rollback;


# case 74
EXPLAIN select * from t1 where t1.b > all (select count(*) from t2 group by t2.c);
Query Plan
========================================================
|ID|OPERATOR               |NAME |EST.ROWS|EST.TIME(us)|
--------------------------------------------------------
|0 |NESTED-LOOP ANTI JOIN  |     |8       |7           |
|1 |├─TABLE FULL SCAN      |t1   |8       |3           |
|2 |└─MATERIAL             |     |2       |4           |
|3 |  └─SUBPLAN SCAN       |VIEW1|2       |4           |
|4 |    └─HASH GROUP BY    |     |2       |4           |
|5 |      └─TABLE FULL SCAN|t2   |8       |3           |
========================================================
Outputs & filters:
-------------------------------------
  0 - output([t1.a], [t1.b], [t1.c]), filter(nil), rowset=16
      conds([t1.b <= VIEW1.count(*) OR t1.b IS NULL]), nl_params_(nil), use_batch=false
  1 - output([t1.a], [t1.b], [t1.c]), filter(nil), rowset=16
      access([t1.a], [t1.b], [t1.c]), partitions(p0)
      is_index_back=false, is_global_index=false, 
      range_key([t1.a]), range(MIN ; MAX)always true
  2 - output([VIEW1.count(*)]), filter(nil), rowset=16
  3 - output([VIEW1.count(*)]), filter(nil), rowset=16
      access([VIEW1.count(*)])
  4 - output([T_FUN_COUNT(*)]), filter(nil), rowset=16
      group([t2.c]), agg_func([T_FUN_COUNT(*)])
  5 - output([t2.c]), filter(nil), rowset=16
      access([t2.c]), partitions(p0)
      is_index_back=false, is_global_index=false, 
      range_key([t2.a]), range(MIN ; MAX)always true
select * from t1 where t1.b > all (select count(*) from t2 group by t2.c);
a	b	c
5	5	0
6	6	1
7	7	0
8	8	1
EXPLAIN select /*+NO_REWRITE*/* from t1 where t1.b > all (select count(*) from t2 group by t2.c);
Query Plan
===================================================
|ID|OPERATOR           |NAME|EST.ROWS|EST.TIME(us)|
---------------------------------------------------
|0 |SUBPLAN FILTER     |    |4       |7           |
|1 |├─TABLE FULL SCAN  |t1  |8       |3           |
|2 |└─HASH GROUP BY    |    |2       |4           |
|3 |  └─TABLE FULL SCAN|t2  |8       |3           |
===================================================
Outputs & filters:
-------------------------------------
  0 - output([t1.a], [t1.b], [t1.c]), filter([t1.b > ALL(subquery(1))]), rowset=16
      exec_params_(nil), onetime_exprs_(nil), init_plan_idxs_([1]), use_batch=false
  1 - output([t1.a], [t1.b], [t1.c]), filter(nil), rowset=16
      access([t1.a], [t1.b], [t1.c]), partitions(p0)
      is_index_back=false, is_global_index=false, 
      range_key([t1.a]), range(MIN ; MAX)always true
  2 - output([T_FUN_COUNT(*)]), filter(nil), rowset=16
      group([t2.c]), agg_func([T_FUN_COUNT(*)])
  3 - output([t2.c]), filter(nil), rowset=16
      access([t2.c]), partitions(p0)
      is_index_back=false, is_global_index=false, 
      range_key([t2.a]), range(MIN ; MAX)always true
select /*+NO_REWRITE*/* from t1 where t1.b > all (select count(*) from t2 group by t2.c);
a	b	c
5	5	0
6	6	1
7	7	0
8	8	1
EXPLAIN update t1 set b = b + 1 where t1.b > all (select count(*) from t2 group by t2.c);
Query Plan
==========================================================
|ID|OPERATOR                 |NAME |EST.ROWS|EST.TIME(us)|
----------------------------------------------------------
|0 |UPDATE                   |     |8       |89          |
|1 |└─NESTED-LOOP ANTI JOIN  |     |8       |7           |
|2 |  ├─TABLE FULL SCAN      |t1   |8       |3           |
|3 |  └─MATERIAL             |     |2       |4           |
|4 |    └─SUBPLAN SCAN       |VIEW1|2       |4           |
|5 |      └─HASH GROUP BY    |     |2       |4           |
|6 |        └─TABLE FULL SCAN|t2   |8       |3           |
==========================================================
Outputs & filters:
-------------------------------------
  0 - output(nil), filter(nil)
      table_columns([{t1: ({t1: (t1.a, t1.b, t1.c)})}]),
      update([t1.b=column_conv(INT,PS:(11,0),NULL,cast(t1.b + 1, INT(-1, 0)))])
  1 - output([t1.a], [t1.b], [t1.c]), filter(nil), rowset=16
      conds([t1.b <= VIEW1.count(*) OR t1.b IS NULL]), nl_params_(nil), use_batch=false
  2 - output([t1.a], [t1.b], [t1.c]), filter(nil), rowset=16
      access([t1.a], [t1.b], [t1.c]), partitions(p0)
      is_index_back=false, is_global_index=false, 
      range_key([t1.a]), range(MIN ; MAX)always true
  3 - output([VIEW1.count(*)]), filter(nil), rowset=16
  4 - output([VIEW1.count(*)]), filter(nil), rowset=16
      access([VIEW1.count(*)])
  5 - output([T_FUN_COUNT(*)]), filter(nil), rowset=16
      group([t2.c]), agg_func([T_FUN_COUNT(*)])
  6 - output([t2.c]), filter(nil), rowset=16
      access([t2.c]), partitions(p0)
      is_index_back=false, is_global_index=false, 
      range_key([t2.a]), range(MIN ; MAX)always true
update t1 set b = b + 1 where t1.b > all (select count(*) from t2 group by t2.c);
select/**/ * from t1;
a	b	c
1	1	0
2	2	1
3	3	0
4	4	1
5	6	0
6	7	1
7	8	0
8	9	1
rollback;
EXPLAIN update /*+NO_REWRITE*/t1 set b = b + 1 where t1.b > all (select count(*) from t2 group by t2.c);
Query Plan
=====================================================
|ID|OPERATOR             |NAME|EST.ROWS|EST.TIME(us)|
-----------------------------------------------------
|0 |UPDATE               |    |4       |61          |
|1 |└─SUBPLAN FILTER     |    |4       |7           |
|2 |  ├─TABLE FULL SCAN  |t1  |8       |3           |
|3 |  └─HASH GROUP BY    |    |2       |4           |
|4 |    └─TABLE FULL SCAN|t2  |8       |3           |
=====================================================
Outputs & filters:
-------------------------------------
  0 - output(nil), filter(nil)
      table_columns([{t1: ({t1: (t1.a, t1.b, t1.c)})}]),
      update([t1.b=column_conv(INT,PS:(11,0),NULL,cast(t1.b + 1, INT(-1, 0)))])
  1 - output([t1.a], [t1.b], [t1.c]), filter([t1.b > ALL(subquery(1))]), rowset=16
      exec_params_(nil), onetime_exprs_(nil), init_plan_idxs_([1]), use_batch=false
  2 - output([t1.a], [t1.b], [t1.c]), filter(nil), rowset=16
      access([t1.a], [t1.b], [t1.c]), partitions(p0)
      is_index_back=false, is_global_index=false, 
      range_key([t1.a]), range(MIN ; MAX)always true
  3 - output([T_FUN_COUNT(*)]), filter(nil), rowset=16
      group([t2.c]), agg_func([T_FUN_COUNT(*)])
  4 - output([t2.c]), filter(nil), rowset=16
      access([t2.c]), partitions(p0)
      is_index_back=false, is_global_index=false, 
      range_key([t2.a]), range(MIN ; MAX)always true
update /*+NO_REWRITE*/t1 set b = b + 1 where t1.b > all (select count(*) from t2 group by t2.c);
select/**/ * from t1;
a	b	c
1	1	0
2	2	1
3	3	0
4	4	1
5	6	0
6	7	1
7	8	0
8	9	1
rollback;
EXPLAIN delete from t1 where t1.b > all (select count(*) from t2 group by t2.c);
Query Plan
==========================================================
|ID|OPERATOR                 |NAME |EST.ROWS|EST.TIME(us)|
----------------------------------------------------------
|0 |DELETE                   |     |8       |52          |
|1 |└─NESTED-LOOP ANTI JOIN  |     |8       |7           |
|2 |  ├─TABLE FULL SCAN      |t1   |8       |3           |
|3 |  └─MATERIAL             |     |2       |4           |
|4 |    └─SUBPLAN SCAN       |VIEW1|2       |4           |
|5 |      └─HASH GROUP BY    |     |2       |4           |
|6 |        └─TABLE FULL SCAN|t2   |8       |3           |
==========================================================
Outputs & filters:
-------------------------------------
  0 - output(nil), filter(nil)
      table_columns([{t1: ({t1: (t1.a, t1.b, t1.c)})}])
  1 - output([t1.a], [t1.b], [t1.c]), filter(nil), rowset=16
      conds([t1.b <= VIEW1.count(*) OR t1.b IS NULL]), nl_params_(nil), use_batch=false
  2 - output([t1.a], [t1.b], [t1.c]), filter(nil), rowset=16
      access([t1.a], [t1.b], [t1.c]), partitions(p0)
      is_index_back=false, is_global_index=false, 
      range_key([t1.a]), range(MIN ; MAX)always true
  3 - output([VIEW1.count(*)]), filter(nil), rowset=16
  4 - output([VIEW1.count(*)]), filter(nil), rowset=16
      access([VIEW1.count(*)])
  5 - output([T_FUN_COUNT(*)]), filter(nil), rowset=16
      group([t2.c]), agg_func([T_FUN_COUNT(*)])
  6 - output([t2.c]), filter(nil), rowset=16
      access([t2.c]), partitions(p0)
      is_index_back=false, is_global_index=false, 
      range_key([t2.a]), range(MIN ; MAX)always true
delete from t1 where t1.b > all (select count(*) from t2 group by t2.c);
select/**/ * from t1;
a	b	c
1	1	0
2	2	1
3	3	0
4	4	1
rollback;
EXPLAIN delete /*+NO_REWRITE*/from t1 where t1.b > all (select count(*) from t2 group by t2.c);
Query Plan
=====================================================
|ID|OPERATOR             |NAME|EST.ROWS|EST.TIME(us)|
-----------------------------------------------------
|0 |DELETE               |    |4       |33          |
|1 |└─SUBPLAN FILTER     |    |4       |7           |
|2 |  ├─TABLE FULL SCAN  |t1  |8       |3           |
|3 |  └─HASH GROUP BY    |    |2       |4           |
|4 |    └─TABLE FULL SCAN|t2  |8       |3           |
=====================================================
Outputs & filters:
-------------------------------------
  0 - output(nil), filter(nil)
      table_columns([{t1: ({t1: (t1.a, t1.b, t1.c)})}])
  1 - output([t1.a], [t1.b], [t1.c]), filter([t1.b > ALL(subquery(1))]), rowset=16
      exec_params_(nil), onetime_exprs_(nil), init_plan_idxs_([1]), use_batch=false
  2 - output([t1.a], [t1.b], [t1.c]), filter(nil), rowset=16
      access([t1.a], [t1.b], [t1.c]), partitions(p0)
      is_index_back=false, is_global_index=false, 
      range_key([t1.a]), range(MIN ; MAX)always true
  3 - output([T_FUN_COUNT(*)]), filter(nil), rowset=16
      group([t2.c]), agg_func([T_FUN_COUNT(*)])
  4 - output([t2.c]), filter(nil), rowset=16
      access([t2.c]), partitions(p0)
      is_index_back=false, is_global_index=false, 
      range_key([t2.a]), range(MIN ; MAX)always true
delete /*+NO_REWRITE*/from t1 where t1.b > all (select count(*) from t2 group by t2.c);
select/**/ * from t1;
a	b	c
1	1	0
2	2	1
3	3	0
4	4	1
rollback;
EXPLAIN insert into is_c3 select * from t1 where t1.b > all (select count(*) from t2 group by t2.c);
Query Plan
======================================================================
|ID|OPERATOR                   |NAME           |EST.ROWS|EST.TIME(us)|
----------------------------------------------------------------------
|0 |INSERT                     |               |8       |62          |
|1 |└─SUBPLAN SCAN             |ANONYMOUS_VIEW1|8       |7           |
|2 |  └─NESTED-LOOP ANTI JOIN  |               |8       |7           |
|3 |    ├─TABLE FULL SCAN      |t1             |8       |3           |
|4 |    └─MATERIAL             |               |2       |4           |
|5 |      └─SUBPLAN SCAN       |VIEW1          |2       |4           |
|6 |        └─HASH GROUP BY    |               |2       |4           |
|7 |          └─TABLE FULL SCAN|t2             |8       |3           |
======================================================================
Outputs & filters:
-------------------------------------
  0 - output(nil), filter(nil)
      columns([{is_c3: ({is_c3: (is_c3.__pk_increment, is_c3.a, is_c3.b, is_c3.c)})}]), partitions(p0), 
      column_values([T_HIDDEN_PK], [column_conv(INT,PS:(11,0),NULL,ANONYMOUS_VIEW1.a)], [column_conv(INT,PS:(11,0),NULL,ANONYMOUS_VIEW1.b)], [column_conv(INT,
      PS:(11,0),NULL,ANONYMOUS_VIEW1.c)])
  1 - output([ANONYMOUS_VIEW1.a], [ANONYMOUS_VIEW1.b], [ANONYMOUS_VIEW1.c]), filter(nil), rowset=16
      access([ANONYMOUS_VIEW1.a], [ANONYMOUS_VIEW1.b], [ANONYMOUS_VIEW1.c])
  2 - output([t1.a], [t1.b], [t1.c]), filter(nil), rowset=16
      conds([t1.b <= VIEW1.count(*) OR t1.b IS NULL]), nl_params_(nil), use_batch=false
  3 - output([t1.a], [t1.b], [t1.c]), filter(nil), rowset=16
      access([t1.a], [t1.b], [t1.c]), partitions(p0)
      is_index_back=false, is_global_index=false, 
      range_key([t1.a]), range(MIN ; MAX)always true
  4 - output([VIEW1.count(*)]), filter(nil), rowset=16
  5 - output([VIEW1.count(*)]), filter(nil), rowset=16
      access([VIEW1.count(*)])
  6 - output([T_FUN_COUNT(*)]), filter(nil), rowset=16
      group([t2.c]), agg_func([T_FUN_COUNT(*)])
  7 - output([t2.c]), filter(nil), rowset=16
      access([t2.c]), partitions(p0)
      is_index_back=false, is_global_index=false, 
      range_key([t2.a]), range(MIN ; MAX)always true
insert into is_c3 select * from t1 where t1.b > all (select count(*) from t2 group by t2.c);
select/**/ * from is_c3;
a	b	c
5	5	0
6	6	1
7	7	0
8	8	1
rollback;
EXPLAIN insert into is_c3 select /*+NO_REWRITE*/* from t1 where t1.b > all (select count(*) from t2 group by t2.c);
Query Plan
==================================================================
|ID|OPERATOR               |NAME           |EST.ROWS|EST.TIME(us)|
------------------------------------------------------------------
|0 |INSERT                 |               |4       |39          |
|1 |└─SUBPLAN SCAN         |ANONYMOUS_VIEW1|4       |7           |
|2 |  └─SUBPLAN FILTER     |               |4       |7           |
|3 |    ├─TABLE FULL SCAN  |t1             |8       |3           |
|4 |    └─HASH GROUP BY    |               |2       |4           |
|5 |      └─TABLE FULL SCAN|t2             |8       |3           |
==================================================================
Outputs & filters:
-------------------------------------
  0 - output(nil), filter(nil)
      columns([{is_c3: ({is_c3: (is_c3.__pk_increment, is_c3.a, is_c3.b, is_c3.c)})}]), partitions(p0), 
      column_values([T_HIDDEN_PK], [column_conv(INT,PS:(11,0),NULL,ANONYMOUS_VIEW1.a)], [column_conv(INT,PS:(11,0),NULL,ANONYMOUS_VIEW1.b)], [column_conv(INT,
      PS:(11,0),NULL,ANONYMOUS_VIEW1.c)])
  1 - output([ANONYMOUS_VIEW1.a], [ANONYMOUS_VIEW1.b], [ANONYMOUS_VIEW1.c]), filter(nil), rowset=16
      access([ANONYMOUS_VIEW1.a], [ANONYMOUS_VIEW1.b], [ANONYMOUS_VIEW1.c])
  2 - output([t1.a], [t1.b], [t1.c]), filter([t1.b > ALL(subquery(1))]), rowset=16
      exec_params_(nil), onetime_exprs_(nil), init_plan_idxs_([1]), use_batch=false
  3 - output([t1.a], [t1.b], [t1.c]), filter(nil), rowset=16
      access([t1.a], [t1.b], [t1.c]), partitions(p0)
      is_index_back=false, is_global_index=false, 
      range_key([t1.a]), range(MIN ; MAX)always true
  4 - output([T_FUN_COUNT(*)]), filter(nil), rowset=16
      group([t2.c]), agg_func([T_FUN_COUNT(*)])
  5 - output([t2.c]), filter(nil), rowset=16
      access([t2.c]), partitions(p0)
      is_index_back=false, is_global_index=false, 
      range_key([t2.a]), range(MIN ; MAX)always true
insert into is_c3 select /*+NO_REWRITE*/* from t1 where t1.b > all (select count(*) from t2 group by t2.c);
select/**/ * from is_c3;
a	b	c
5	5	0
6	6	1
7	7	0
8	8	1
rollback;


# case 75
EXPLAIN select * from t1 where t1.b > any (select count(*) from t2 where t2.a < t1.a);
Query Plan
=========================================================
|ID|OPERATOR                 |NAME|EST.ROWS|EST.TIME(us)|
---------------------------------------------------------
|0 |MERGE GROUP BY           |    |1       |135         |
|1 |└─NESTED-LOOP OUTER JOIN |    |32      |132         |
|2 |  ├─TABLE FULL SCAN      |t1  |8       |3           |
|3 |  └─TABLE RANGE SCAN     |t2  |3       |16          |
=========================================================
Outputs & filters:
-------------------------------------
  0 - output([t1.a], [t1.b], [t1.c]), filter([t1.b > T_FUN_COUNT(t2.a)]), rowset=16
      group([t1.a]), agg_func([T_FUN_COUNT(t2.a)])
  1 - output([t1.a], [t1.b], [t1.c], [t2.a]), filter(nil), rowset=16
      conds(nil), nl_params_([t1.a(:0)]), use_batch=true
  2 - output([t1.a], [t1.b], [t1.c]), filter(nil), rowset=16
      access([t1.a], [t1.b], [t1.c]), partitions(p0)
      is_index_back=false, is_global_index=false, 
      range_key([t1.a]), range(MIN ; MAX)always true
  3 - output([t2.a]), filter(nil), rowset=16
      access([GROUP_ID], [t2.a]), partitions(p0)
      is_index_back=false, is_global_index=false, 
      range_key([t2.a]), range(MIN ; MAX), 
      range_cond([t2.a < :0])
select * from t1 where t1.b > any (select count(*) from t2 where t2.a < t1.a);
a	b	c
1	1	0
2	2	1
3	3	0
4	4	1
5	5	0
6	6	1
7	7	0
8	8	1
EXPLAIN select /*+NO_REWRITE*/* from t1 where t1.b > any (select count(*) from t2 where t2.a < t1.a);
Query Plan
====================================================
|ID|OPERATOR            |NAME|EST.ROWS|EST.TIME(us)|
----------------------------------------------------
|0 |SUBPLAN FILTER      |    |4       |147         |
|1 |├─TABLE FULL SCAN   |t1  |8       |3           |
|2 |└─SCALAR GROUP BY   |    |1       |18          |
|3 |  └─TABLE RANGE SCAN|t2  |3       |18          |
====================================================
Outputs & filters:
-------------------------------------
  0 - output([t1.a], [t1.b], [t1.c]), filter([t1.b > ANY(subquery(1))]), rowset=16
      exec_params_([t1.a(:0)]), onetime_exprs_(nil), init_plan_idxs_(nil), use_batch=false
  1 - output([t1.a], [t1.b], [t1.c]), filter(nil), rowset=16
      access([t1.a], [t1.b], [t1.c]), partitions(p0)
      is_index_back=false, is_global_index=false, 
      range_key([t1.a]), range(MIN ; MAX)always true
  2 - output([T_FUN_COUNT_SUM(T_FUN_COUNT(*))]), filter(nil), rowset=16
      group(nil), agg_func([T_FUN_COUNT_SUM(T_FUN_COUNT(*))])
  3 - output([T_FUN_COUNT(*)]), filter(nil), rowset=16
      access(nil), partitions(p0)
      is_index_back=false, is_global_index=false, 
      range_key([t2.a]), range(MIN ; MAX)always true, 
      range_cond([t2.a < :0]), 
      pushdown_aggregation([T_FUN_COUNT(*)])
select /*+NO_REWRITE*/* from t1 where t1.b > any (select count(*) from t2 where t2.a < t1.a);
a	b	c
1	1	0
2	2	1
3	3	0
4	4	1
5	5	0
6	6	1
7	7	0
8	8	1
EXPLAIN update t1 set b = b + 1 where t1.b > any (select count(*) from t2 where t2.a < t1.a);
Query Plan
==============================================================
|ID|OPERATOR                     |NAME |EST.ROWS|EST.TIME(us)|
--------------------------------------------------------------
|0 |UPDATE                       |     |1       |162         |
|1 |└─SUBPLAN SCAN               |VIEW1|1       |135         |
|2 |  └─MERGE GROUP BY           |     |1       |135         |
|3 |    └─NESTED-LOOP OUTER JOIN |     |32      |132         |
|4 |      ├─TABLE FULL SCAN      |t1   |8       |3           |
|5 |      └─TABLE RANGE SCAN     |t2   |3       |16          |
==============================================================
Outputs & filters:
-------------------------------------
  0 - output(nil), filter(nil)
      table_columns([{VIEW1: ({t1: (VIEW1.t1.a, VIEW1.t1.b, VIEW1.t1.c)})}]),
      update([VIEW1.t1.b=column_conv(INT,PS:(11,0),NULL,cast(VIEW1.t1.b + 1, INT(-1, 0)))])
  1 - output([VIEW1.t1.a], [VIEW1.t1.b], [VIEW1.t1.c]), filter(nil), rowset=16
      access([VIEW1.t1.a], [VIEW1.t1.b], [VIEW1.t1.c])
  2 - output([t1.a], [t1.b], [t1.c]), filter([t1.b > T_FUN_COUNT(t2.a)]), rowset=16
      group([t1.a]), agg_func([T_FUN_COUNT(t2.a)])
  3 - output([t1.a], [t1.b], [t1.c], [t2.a]), filter(nil), rowset=16
      conds(nil), nl_params_([t1.a(:0)]), use_batch=true
  4 - output([t1.a], [t1.b], [t1.c]), filter(nil), rowset=16
      access([t1.a], [t1.b], [t1.c]), partitions(p0)
      is_index_back=false, is_global_index=false, 
      range_key([t1.a]), range(MIN ; MAX)always true
  5 - output([t2.a]), filter(nil), rowset=16
      access([GROUP_ID], [t2.a]), partitions(p0)
      is_index_back=false, is_global_index=false, 
      range_key([t2.a]), range(MIN ; MAX), 
      range_cond([t2.a < :0])
update t1 set b = b + 1 where t1.b > any (select count(*) from t2 where t2.a < t1.a);
select/**/ * from t1;
a	b	c
1	2	0
2	3	1
3	4	0
4	5	1
5	6	0
6	7	1
7	8	0
8	9	1
rollback;
EXPLAIN update /*+NO_REWRITE*/t1 set b = b + 1 where t1.b > any (select count(*) from t2 where t2.a < t1.a);
Query Plan
======================================================
|ID|OPERATOR              |NAME|EST.ROWS|EST.TIME(us)|
------------------------------------------------------
|0 |UPDATE                |    |4       |201         |
|1 |└─SUBPLAN FILTER      |    |4       |147         |
|2 |  ├─TABLE FULL SCAN   |t1  |8       |3           |
|3 |  └─SCALAR GROUP BY   |    |1       |18          |
|4 |    └─TABLE RANGE SCAN|t2  |3       |18          |
======================================================
Outputs & filters:
-------------------------------------
  0 - output(nil), filter(nil)
      table_columns([{t1: ({t1: (t1.a, t1.b, t1.c)})}]),
      update([t1.b=column_conv(INT,PS:(11,0),NULL,cast(t1.b + 1, INT(-1, 0)))])
  1 - output([t1.a], [t1.b], [t1.c]), filter([t1.b > ANY(subquery(1))]), rowset=16
      exec_params_([t1.a(:0)]), onetime_exprs_(nil), init_plan_idxs_(nil), use_batch=false
  2 - output([t1.a], [t1.b], [t1.c]), filter(nil), rowset=16
      access([t1.a], [t1.b], [t1.c]), partitions(p0)
      is_index_back=false, is_global_index=false, 
      range_key([t1.a]), range(MIN ; MAX)always true
  3 - output([T_FUN_COUNT_SUM(T_FUN_COUNT(*))]), filter(nil), rowset=16
      group(nil), agg_func([T_FUN_COUNT_SUM(T_FUN_COUNT(*))])
  4 - output([T_FUN_COUNT(*)]), filter(nil), rowset=16
      access(nil), partitions(p0)
      is_index_back=false, is_global_index=false, 
      range_key([t2.a]), range(MIN ; MAX)always true, 
      range_cond([t2.a < :0]), 
      pushdown_aggregation([T_FUN_COUNT(*)])
update /*+NO_REWRITE*/t1 set b = b + 1 where t1.b > any (select count(*) from t2 where t2.a < t1.a);
select/**/ * from t1;
a	b	c
1	2	0
2	3	1
3	4	0
4	5	1
5	6	0
6	7	1
7	8	0
8	9	1
rollback;
EXPLAIN delete from t1 where t1.b > any (select count(*) from t2 where t2.a < t1.a);
Query Plan
==============================================================
|ID|OPERATOR                     |NAME |EST.ROWS|EST.TIME(us)|
--------------------------------------------------------------
|0 |DELETE                       |     |1       |143         |
|1 |└─SUBPLAN SCAN               |VIEW1|1       |135         |
|2 |  └─MERGE GROUP BY           |     |1       |135         |
|3 |    └─NESTED-LOOP OUTER JOIN |     |32      |132         |
|4 |      ├─TABLE FULL SCAN      |t1   |8       |3           |
|5 |      └─TABLE RANGE SCAN     |t2   |3       |16          |
==============================================================
Outputs & filters:
-------------------------------------
  0 - output(nil), filter(nil)
      table_columns([{VIEW1: ({t1: (VIEW1.t1.a, VIEW1.t1.b, VIEW1.t1.c)})}])
  1 - output([VIEW1.t1.a], [VIEW1.t1.b], [VIEW1.t1.c]), filter(nil), rowset=16
      access([VIEW1.t1.a], [VIEW1.t1.b], [VIEW1.t1.c])
  2 - output([t1.a], [t1.b], [t1.c]), filter([t1.b > T_FUN_COUNT(t2.a)]), rowset=16
      group([t1.a]), agg_func([T_FUN_COUNT(t2.a)])
  3 - output([t1.a], [t1.b], [t1.c], [t2.a]), filter(nil), rowset=16
      conds(nil), nl_params_([t1.a(:0)]), use_batch=true
  4 - output([t1.a], [t1.b], [t1.c]), filter(nil), rowset=16
      access([t1.a], [t1.b], [t1.c]), partitions(p0)
      is_index_back=false, is_global_index=false, 
      range_key([t1.a]), range(MIN ; MAX)always true
  5 - output([t2.a]), filter(nil), rowset=16
      access([GROUP_ID], [t2.a]), partitions(p0)
      is_index_back=false, is_global_index=false, 
      range_key([t2.a]), range(MIN ; MAX), 
      range_cond([t2.a < :0])
delete from t1 where t1.b > any (select count(*) from t2 where t2.a < t1.a);
select/**/ * from t1;
a	b	c
rollback;
EXPLAIN delete /*+NO_REWRITE*/from t1 where t1.b > any (select count(*) from t2 where t2.a < t1.a);
Query Plan
======================================================
|ID|OPERATOR              |NAME|EST.ROWS|EST.TIME(us)|
------------------------------------------------------
|0 |DELETE                |    |4       |174         |
|1 |└─SUBPLAN FILTER      |    |4       |147         |
|2 |  ├─TABLE FULL SCAN   |t1  |8       |3           |
|3 |  └─SCALAR GROUP BY   |    |1       |18          |
|4 |    └─TABLE RANGE SCAN|t2  |3       |18          |
======================================================
Outputs & filters:
-------------------------------------
  0 - output(nil), filter(nil)
      table_columns([{t1: ({t1: (t1.a, t1.b, t1.c)})}])
  1 - output([t1.a], [t1.b], [t1.c]), filter([t1.b > ANY(subquery(1))]), rowset=16
      exec_params_([t1.a(:0)]), onetime_exprs_(nil), init_plan_idxs_(nil), use_batch=false
  2 - output([t1.a], [t1.b], [t1.c]), filter(nil), rowset=16
      access([t1.a], [t1.b], [t1.c]), partitions(p0)
      is_index_back=false, is_global_index=false, 
      range_key([t1.a]), range(MIN ; MAX)always true
  3 - output([T_FUN_COUNT_SUM(T_FUN_COUNT(*))]), filter(nil), rowset=16
      group(nil), agg_func([T_FUN_COUNT_SUM(T_FUN_COUNT(*))])
  4 - output([T_FUN_COUNT(*)]), filter(nil), rowset=16
      access(nil), partitions(p0)
      is_index_back=false, is_global_index=false, 
      range_key([t2.a]), range(MIN ; MAX)always true, 
      range_cond([t2.a < :0]), 
      pushdown_aggregation([T_FUN_COUNT(*)])
delete /*+NO_REWRITE*/from t1 where t1.b > any (select count(*) from t2 where t2.a < t1.a);
select/**/ * from t1;
a	b	c
rollback;
EXPLAIN insert into is_c3 select * from t1 where t1.b > any (select count(*) from t2 where t2.a < t1.a);
Query Plan
========================================================================
|ID|OPERATOR                     |NAME           |EST.ROWS|EST.TIME(us)|
------------------------------------------------------------------------
|0 |INSERT                       |               |1       |144         |
|1 |└─SUBPLAN SCAN               |ANONYMOUS_VIEW1|1       |135         |
|2 |  └─MERGE GROUP BY           |               |1       |135         |
|3 |    └─NESTED-LOOP OUTER JOIN |               |32      |132         |
|4 |      ├─TABLE FULL SCAN      |t1             |8       |3           |
|5 |      └─TABLE RANGE SCAN     |t2             |3       |16          |
========================================================================
Outputs & filters:
-------------------------------------
  0 - output(nil), filter(nil)
      columns([{is_c3: ({is_c3: (is_c3.__pk_increment, is_c3.a, is_c3.b, is_c3.c)})}]), partitions(p0), 
      column_values([T_HIDDEN_PK], [column_conv(INT,PS:(11,0),NULL,ANONYMOUS_VIEW1.a)], [column_conv(INT,PS:(11,0),NULL,ANONYMOUS_VIEW1.b)], [column_conv(INT,
      PS:(11,0),NULL,ANONYMOUS_VIEW1.c)])
  1 - output([ANONYMOUS_VIEW1.a], [ANONYMOUS_VIEW1.b], [ANONYMOUS_VIEW1.c]), filter(nil), rowset=16
      access([ANONYMOUS_VIEW1.a], [ANONYMOUS_VIEW1.b], [ANONYMOUS_VIEW1.c])
  2 - output([t1.a], [t1.b], [t1.c]), filter([t1.b > T_FUN_COUNT(t2.a)]), rowset=16
      group([t1.a]), agg_func([T_FUN_COUNT(t2.a)])
  3 - output([t1.a], [t1.b], [t1.c], [t2.a]), filter(nil), rowset=16
      conds(nil), nl_params_([t1.a(:0)]), use_batch=true
  4 - output([t1.a], [t1.b], [t1.c]), filter(nil), rowset=16
      access([t1.a], [t1.b], [t1.c]), partitions(p0)
      is_index_back=false, is_global_index=false, 
      range_key([t1.a]), range(MIN ; MAX)always true
  5 - output([t2.a]), filter(nil), rowset=16
      access([GROUP_ID], [t2.a]), partitions(p0)
      is_index_back=false, is_global_index=false, 
      range_key([t2.a]), range(MIN ; MAX), 
      range_cond([t2.a < :0])
insert into is_c3 select * from t1 where t1.b > any (select count(*) from t2 where t2.a < t1.a);
select/**/ * from is_c3;
a	b	c
1	1	0
2	2	1
3	3	0
4	4	1
5	5	0
6	6	1
7	7	0
8	8	1
rollback;
EXPLAIN insert into is_c3 select /*+NO_REWRITE*/* from t1 where t1.b > any (select count(*) from t2 where t2.a < t1.a);
Query Plan
===================================================================
|ID|OPERATOR                |NAME           |EST.ROWS|EST.TIME(us)|
-------------------------------------------------------------------
|0 |INSERT                  |               |4       |179         |
|1 |└─SUBPLAN SCAN          |ANONYMOUS_VIEW1|4       |147         |
|2 |  └─SUBPLAN FILTER      |               |4       |147         |
|3 |    ├─TABLE FULL SCAN   |t1             |8       |3           |
|4 |    └─SCALAR GROUP BY   |               |1       |18          |
|5 |      └─TABLE RANGE SCAN|t2             |3       |18          |
===================================================================
Outputs & filters:
-------------------------------------
  0 - output(nil), filter(nil)
      columns([{is_c3: ({is_c3: (is_c3.__pk_increment, is_c3.a, is_c3.b, is_c3.c)})}]), partitions(p0), 
      column_values([T_HIDDEN_PK], [column_conv(INT,PS:(11,0),NULL,ANONYMOUS_VIEW1.a)], [column_conv(INT,PS:(11,0),NULL,ANONYMOUS_VIEW1.b)], [column_conv(INT,
      PS:(11,0),NULL,ANONYMOUS_VIEW1.c)])
  1 - output([ANONYMOUS_VIEW1.a], [ANONYMOUS_VIEW1.b], [ANONYMOUS_VIEW1.c]), filter(nil), rowset=16
      access([ANONYMOUS_VIEW1.a], [ANONYMOUS_VIEW1.b], [ANONYMOUS_VIEW1.c])
  2 - output([t1.a], [t1.b], [t1.c]), filter([t1.b > ANY(subquery(1))]), rowset=16
      exec_params_([t1.a(:0)]), onetime_exprs_(nil), init_plan_idxs_(nil), use_batch=false
  3 - output([t1.a], [t1.b], [t1.c]), filter(nil), rowset=16
      access([t1.a], [t1.b], [t1.c]), partitions(p0)
      is_index_back=false, is_global_index=false, 
      range_key([t1.a]), range(MIN ; MAX)always true
  4 - output([T_FUN_COUNT_SUM(T_FUN_COUNT(*))]), filter(nil), rowset=16
      group(nil), agg_func([T_FUN_COUNT_SUM(T_FUN_COUNT(*))])
  5 - output([T_FUN_COUNT(*)]), filter(nil), rowset=16
      access(nil), partitions(p0)
      is_index_back=false, is_global_index=false, 
      range_key([t2.a]), range(MIN ; MAX)always true, 
      range_cond([t2.a < :0]), 
      pushdown_aggregation([T_FUN_COUNT(*)])
insert into is_c3 select /*+NO_REWRITE*/* from t1 where t1.b > any (select count(*) from t2 where t2.a < t1.a);
select/**/ * from is_c3;
a	b	c
1	1	0
2	2	1
3	3	0
4	4	1
5	5	0
6	6	1
7	7	0
8	8	1
rollback;


# case 76
EXPLAIN select * from t1 where t1.b > any (select count(*) from t2 having count(*) < t1.a);
Query Plan
======================================================
|ID|OPERATOR             |NAME |EST.ROWS|EST.TIME(us)|
------------------------------------------------------
|0 |NESTED-LOOP JOIN     |     |1       |19          |
|1 |├─SUBPLAN SCAN       |VIEW2|1       |3           |
|2 |│ └─SCALAR GROUP BY  |     |1       |3           |
|3 |│   └─TABLE FULL SCAN|t2   |8       |3           |
|4 |└─TABLE RANGE SCAN   |t1   |2       |16          |
======================================================
Outputs & filters:
-------------------------------------
  0 - output([t1.a], [t1.b], [t1.c]), filter(nil), rowset=16
      conds(nil), nl_params_([VIEW2.VIEW1.T_FUN_COUNT(*)(:0)], [VIEW2.VIEW1.T_FUN_COUNT(*)(:1)]), use_batch=true
  1 - output([VIEW2.VIEW1.T_FUN_COUNT(*)], [VIEW2.VIEW1.T_FUN_COUNT(*)]), filter(nil), rowset=16
      access([VIEW2.VIEW1.T_FUN_COUNT(*)], [VIEW2.VIEW1.T_FUN_COUNT(*)])
  2 - output([T_FUN_COUNT_SUM(T_FUN_COUNT(*))], [T_FUN_COUNT_SUM(T_FUN_COUNT(*))]), filter(nil), rowset=16
      group(nil), agg_func([T_FUN_COUNT_SUM(T_FUN_COUNT(*))])
  3 - output([T_FUN_COUNT(*)]), filter(nil), rowset=16
      access(nil), partitions(p0)
      is_index_back=false, is_global_index=false, 
      range_key([t2.a]), range(MIN ; MAX)always true, 
      pushdown_aggregation([T_FUN_COUNT(*)])
  4 - output([t1.a], [t1.b], [t1.c]), filter([t1.b > :1]), rowset=16
      access([GROUP_ID], [t1.a], [t1.b], [t1.c]), partitions(p0)
      is_index_back=false, is_global_index=false, filter_before_indexback[false], 
      range_key([t1.a]), range(MIN ; MAX), 
      range_cond([:0 < t1.a])
select * from t1 where t1.b > any (select count(*) from t2 having count(*) < t1.a);
a	b	c
EXPLAIN select /*+NO_REWRITE*/* from t1 where t1.b > any (select count(*) from t2 having count(*) < t1.a);
Query Plan
===================================================
|ID|OPERATOR           |NAME|EST.ROWS|EST.TIME(us)|
---------------------------------------------------
|0 |SUBPLAN FILTER     |    |4       |148         |
|1 |├─TABLE FULL SCAN  |t1  |8       |3           |
|2 |└─SCALAR GROUP BY  |    |1       |19          |
|3 |  └─TABLE FULL SCAN|t2  |8       |18          |
===================================================
Outputs & filters:
-------------------------------------
  0 - output([t1.a], [t1.b], [t1.c]), filter([t1.b > ANY(subquery(1))]), rowset=16
      exec_params_([t1.a(:0)]), onetime_exprs_(nil), init_plan_idxs_(nil), use_batch=false
  1 - output([t1.a], [t1.b], [t1.c]), filter(nil), rowset=16
      access([t1.a], [t1.b], [t1.c]), partitions(p0)
      is_index_back=false, is_global_index=false, 
      range_key([t1.a]), range(MIN ; MAX)always true
  2 - output([T_FUN_COUNT_SUM(T_FUN_COUNT(*))]), filter([T_FUN_COUNT_SUM(T_FUN_COUNT(*)) < :0]), rowset=16
      group(nil), agg_func([T_FUN_COUNT_SUM(T_FUN_COUNT(*))])
  3 - output([T_FUN_COUNT(*)]), filter(nil), rowset=16
      access(nil), partitions(p0)
      is_index_back=false, is_global_index=false, 
      range_key([t2.a]), range(MIN ; MAX)always true, 
      pushdown_aggregation([T_FUN_COUNT(*)])
select /*+NO_REWRITE*/* from t1 where t1.b > any (select count(*) from t2 having count(*) < t1.a);
a	b	c
EXPLAIN update t1 set b = b + 1 where t1.b > any (select count(*) from t2 having count(*) < t1.a);
Query Plan
========================================================
|ID|OPERATOR               |NAME |EST.ROWS|EST.TIME(us)|
--------------------------------------------------------
|0 |UPDATE                 |     |1       |50          |
|1 |└─NESTED-LOOP JOIN     |     |1       |19          |
|2 |  ├─SUBPLAN SCAN       |VIEW2|1       |3           |
|3 |  │ └─SCALAR GROUP BY  |     |1       |3           |
|4 |  │   └─TABLE FULL SCAN|t2   |8       |3           |
|5 |  └─TABLE RANGE SCAN   |t1   |2       |16          |
========================================================
Outputs & filters:
-------------------------------------
  0 - output(nil), filter(nil)
      table_columns([{t1: ({t1: (t1.a, t1.b, t1.c)}), hash_distinct}]),
      update([t1.b=column_conv(INT,PS:(11,0),NULL,cast(t1.b + 1, INT(-1, 0)))])
  1 - output([t1.a], [t1.b], [t1.c]), filter(nil), rowset=16
      conds(nil), nl_params_([VIEW2.VIEW1.T_FUN_COUNT(*)(:0)], [VIEW2.VIEW1.T_FUN_COUNT(*)(:1)]), use_batch=true
  2 - output([VIEW2.VIEW1.T_FUN_COUNT(*)], [VIEW2.VIEW1.T_FUN_COUNT(*)]), filter(nil), rowset=16
      access([VIEW2.VIEW1.T_FUN_COUNT(*)], [VIEW2.VIEW1.T_FUN_COUNT(*)])
  3 - output([T_FUN_COUNT_SUM(T_FUN_COUNT(*))], [T_FUN_COUNT_SUM(T_FUN_COUNT(*))]), filter(nil), rowset=16
      group(nil), agg_func([T_FUN_COUNT_SUM(T_FUN_COUNT(*))])
  4 - output([T_FUN_COUNT(*)]), filter(nil), rowset=16
      access(nil), partitions(p0)
      is_index_back=false, is_global_index=false, 
      range_key([t2.a]), range(MIN ; MAX)always true, 
      pushdown_aggregation([T_FUN_COUNT(*)])
  5 - output([t1.a], [t1.b], [t1.c]), filter([t1.b > :1]), rowset=16
      access([GROUP_ID], [t1.a], [t1.b], [t1.c]), partitions(p0)
      is_index_back=false, is_global_index=false, filter_before_indexback[false], 
      range_key([t1.a]), range(MIN ; MAX), 
      range_cond([:0 < t1.a])
update t1 set b = b + 1 where t1.b > any (select count(*) from t2 having count(*) < t1.a);
select/**/ * from t1;
a	b	c
1	1	0
2	2	1
3	3	0
4	4	1
5	5	0
6	6	1
7	7	0
8	8	1
rollback;
EXPLAIN update /*+NO_REWRITE*/t1 set b = b + 1 where t1.b > any (select count(*) from t2 having count(*) < t1.a);
Query Plan
=====================================================
|ID|OPERATOR             |NAME|EST.ROWS|EST.TIME(us)|
-----------------------------------------------------
|0 |UPDATE               |    |4       |202         |
|1 |└─SUBPLAN FILTER     |    |4       |148         |
|2 |  ├─TABLE FULL SCAN  |t1  |8       |3           |
|3 |  └─SCALAR GROUP BY  |    |1       |19          |
|4 |    └─TABLE FULL SCAN|t2  |8       |18          |
=====================================================
Outputs & filters:
-------------------------------------
  0 - output(nil), filter(nil)
      table_columns([{t1: ({t1: (t1.a, t1.b, t1.c)})}]),
      update([t1.b=column_conv(INT,PS:(11,0),NULL,cast(t1.b + 1, INT(-1, 0)))])
  1 - output([t1.a], [t1.b], [t1.c]), filter([t1.b > ANY(subquery(1))]), rowset=16
      exec_params_([t1.a(:0)]), onetime_exprs_(nil), init_plan_idxs_(nil), use_batch=false
  2 - output([t1.a], [t1.b], [t1.c]), filter(nil), rowset=16
      access([t1.a], [t1.b], [t1.c]), partitions(p0)
      is_index_back=false, is_global_index=false, 
      range_key([t1.a]), range(MIN ; MAX)always true
  3 - output([T_FUN_COUNT_SUM(T_FUN_COUNT(*))]), filter([T_FUN_COUNT_SUM(T_FUN_COUNT(*)) < :0]), rowset=16
      group(nil), agg_func([T_FUN_COUNT_SUM(T_FUN_COUNT(*))])
  4 - output([T_FUN_COUNT(*)]), filter(nil), rowset=16
      access(nil), partitions(p0)
      is_index_back=false, is_global_index=false, 
      range_key([t2.a]), range(MIN ; MAX)always true, 
      pushdown_aggregation([T_FUN_COUNT(*)])
update /*+NO_REWRITE*/t1 set b = b + 1 where t1.b > any (select count(*) from t2 having count(*) < t1.a);
select/**/ * from t1;
a	b	c
1	1	0
2	2	1
3	3	0
4	4	1
5	5	0
6	6	1
7	7	0
8	8	1
rollback;
EXPLAIN delete from t1 where t1.b > any (select count(*) from t2 having count(*) < t1.a);
Query Plan
========================================================
|ID|OPERATOR               |NAME |EST.ROWS|EST.TIME(us)|
--------------------------------------------------------
|0 |DELETE                 |     |1       |30          |
|1 |└─NESTED-LOOP JOIN     |     |1       |19          |
|2 |  ├─SUBPLAN SCAN       |VIEW2|1       |3           |
|3 |  │ └─SCALAR GROUP BY  |     |1       |3           |
|4 |  │   └─TABLE FULL SCAN|t2   |8       |3           |
|5 |  └─TABLE RANGE SCAN   |t1   |2       |16          |
========================================================
Outputs & filters:
-------------------------------------
  0 - output(nil), filter(nil)
      table_columns([{t1: ({t1: (t1.a, t1.b, t1.c)}), hash_distinct}])
  1 - output([t1.a], [t1.b], [t1.c]), filter(nil), rowset=16
      conds(nil), nl_params_([VIEW2.VIEW1.T_FUN_COUNT(*)(:0)], [VIEW2.VIEW1.T_FUN_COUNT(*)(:1)]), use_batch=true
  2 - output([VIEW2.VIEW1.T_FUN_COUNT(*)], [VIEW2.VIEW1.T_FUN_COUNT(*)]), filter(nil), rowset=16
      access([VIEW2.VIEW1.T_FUN_COUNT(*)], [VIEW2.VIEW1.T_FUN_COUNT(*)])
  3 - output([T_FUN_COUNT_SUM(T_FUN_COUNT(*))], [T_FUN_COUNT_SUM(T_FUN_COUNT(*))]), filter(nil), rowset=16
      group(nil), agg_func([T_FUN_COUNT_SUM(T_FUN_COUNT(*))])
  4 - output([T_FUN_COUNT(*)]), filter(nil), rowset=16
      access(nil), partitions(p0)
      is_index_back=false, is_global_index=false, 
      range_key([t2.a]), range(MIN ; MAX)always true, 
      pushdown_aggregation([T_FUN_COUNT(*)])
  5 - output([t1.a], [t1.b], [t1.c]), filter([t1.b > :1]), rowset=16
      access([GROUP_ID], [t1.a], [t1.b], [t1.c]), partitions(p0)
      is_index_back=false, is_global_index=false, filter_before_indexback[false], 
      range_key([t1.a]), range(MIN ; MAX), 
      range_cond([:0 < t1.a])
delete from t1 where t1.b > any (select count(*) from t2 having count(*) < t1.a);
select/**/ * from t1;
a	b	c
1	1	0
2	2	1
3	3	0
4	4	1
5	5	0
6	6	1
7	7	0
8	8	1
rollback;
EXPLAIN delete /*+NO_REWRITE*/from t1 where t1.b > any (select count(*) from t2 having count(*) < t1.a);
Query Plan
=====================================================
|ID|OPERATOR             |NAME|EST.ROWS|EST.TIME(us)|
-----------------------------------------------------
|0 |DELETE               |    |4       |174         |
|1 |└─SUBPLAN FILTER     |    |4       |148         |
|2 |  ├─TABLE FULL SCAN  |t1  |8       |3           |
|3 |  └─SCALAR GROUP BY  |    |1       |19          |
|4 |    └─TABLE FULL SCAN|t2  |8       |18          |
=====================================================
Outputs & filters:
-------------------------------------
  0 - output(nil), filter(nil)
      table_columns([{t1: ({t1: (t1.a, t1.b, t1.c)})}])
  1 - output([t1.a], [t1.b], [t1.c]), filter([t1.b > ANY(subquery(1))]), rowset=16
      exec_params_([t1.a(:0)]), onetime_exprs_(nil), init_plan_idxs_(nil), use_batch=false
  2 - output([t1.a], [t1.b], [t1.c]), filter(nil), rowset=16
      access([t1.a], [t1.b], [t1.c]), partitions(p0)
      is_index_back=false, is_global_index=false, 
      range_key([t1.a]), range(MIN ; MAX)always true
  3 - output([T_FUN_COUNT_SUM(T_FUN_COUNT(*))]), filter([T_FUN_COUNT_SUM(T_FUN_COUNT(*)) < :0]), rowset=16
      group(nil), agg_func([T_FUN_COUNT_SUM(T_FUN_COUNT(*))])
  4 - output([T_FUN_COUNT(*)]), filter(nil), rowset=16
      access(nil), partitions(p0)
      is_index_back=false, is_global_index=false, 
      range_key([t2.a]), range(MIN ; MAX)always true, 
      pushdown_aggregation([T_FUN_COUNT(*)])
delete /*+NO_REWRITE*/from t1 where t1.b > any (select count(*) from t2 having count(*) < t1.a);
select/**/ * from t1;
a	b	c
1	1	0
2	2	1
3	3	0
4	4	1
5	5	0
6	6	1
7	7	0
8	8	1
rollback;
EXPLAIN insert into is_c3 select * from t1 where t1.b > any (select count(*) from t2 having count(*) < t1.a);
Query Plan
====================================================================
|ID|OPERATOR                 |NAME           |EST.ROWS|EST.TIME(us)|
--------------------------------------------------------------------
|0 |INSERT                   |               |1       |32          |
|1 |└─SUBPLAN SCAN           |ANONYMOUS_VIEW1|1       |19          |
|2 |  └─NESTED-LOOP JOIN     |               |1       |19          |
|3 |    ├─SUBPLAN SCAN       |VIEW2          |1       |3           |
|4 |    │ └─SCALAR GROUP BY  |               |1       |3           |
|5 |    │   └─TABLE FULL SCAN|t2             |8       |3           |
|6 |    └─TABLE RANGE SCAN   |t1             |2       |16          |
====================================================================
Outputs & filters:
-------------------------------------
  0 - output(nil), filter(nil)
      columns([{is_c3: ({is_c3: (is_c3.__pk_increment, is_c3.a, is_c3.b, is_c3.c)})}]), partitions(p0), 
      column_values([T_HIDDEN_PK], [column_conv(INT,PS:(11,0),NULL,ANONYMOUS_VIEW1.a)], [column_conv(INT,PS:(11,0),NULL,ANONYMOUS_VIEW1.b)], [column_conv(INT,
      PS:(11,0),NULL,ANONYMOUS_VIEW1.c)])
  1 - output([ANONYMOUS_VIEW1.a], [ANONYMOUS_VIEW1.b], [ANONYMOUS_VIEW1.c]), filter(nil), rowset=16
      access([ANONYMOUS_VIEW1.a], [ANONYMOUS_VIEW1.b], [ANONYMOUS_VIEW1.c])
  2 - output([t1.a], [t1.b], [t1.c]), filter(nil), rowset=16
      conds(nil), nl_params_([VIEW2.VIEW1.T_FUN_COUNT(*)(:0)], [VIEW2.VIEW1.T_FUN_COUNT(*)(:1)]), use_batch=true
  3 - output([VIEW2.VIEW1.T_FUN_COUNT(*)], [VIEW2.VIEW1.T_FUN_COUNT(*)]), filter(nil), rowset=16
      access([VIEW2.VIEW1.T_FUN_COUNT(*)], [VIEW2.VIEW1.T_FUN_COUNT(*)])
  4 - output([T_FUN_COUNT_SUM(T_FUN_COUNT(*))], [T_FUN_COUNT_SUM(T_FUN_COUNT(*))]), filter(nil), rowset=16
      group(nil), agg_func([T_FUN_COUNT_SUM(T_FUN_COUNT(*))])
  5 - output([T_FUN_COUNT(*)]), filter(nil), rowset=16
      access(nil), partitions(p0)
      is_index_back=false, is_global_index=false, 
      range_key([t2.a]), range(MIN ; MAX)always true, 
      pushdown_aggregation([T_FUN_COUNT(*)])
  6 - output([t1.a], [t1.b], [t1.c]), filter([t1.b > :1]), rowset=16
      access([GROUP_ID], [t1.a], [t1.b], [t1.c]), partitions(p0)
      is_index_back=false, is_global_index=false, filter_before_indexback[false], 
      range_key([t1.a]), range(MIN ; MAX), 
      range_cond([:0 < t1.a])
insert into is_c3 select * from t1 where t1.b > any (select count(*) from t2 having count(*) < t1.a);
select/**/ * from is_c3;
a	b	c
rollback;
EXPLAIN insert into is_c3 select /*+NO_REWRITE*/* from t1 where t1.b > any (select count(*) from t2 having count(*) < t1.a);
Query Plan
==================================================================
|ID|OPERATOR               |NAME           |EST.ROWS|EST.TIME(us)|
------------------------------------------------------------------
|0 |INSERT                 |               |4       |180         |
|1 |└─SUBPLAN SCAN         |ANONYMOUS_VIEW1|4       |148         |
|2 |  └─SUBPLAN FILTER     |               |4       |148         |
|3 |    ├─TABLE FULL SCAN  |t1             |8       |3           |
|4 |    └─SCALAR GROUP BY  |               |1       |19          |
|5 |      └─TABLE FULL SCAN|t2             |8       |18          |
==================================================================
Outputs & filters:
-------------------------------------
  0 - output(nil), filter(nil)
      columns([{is_c3: ({is_c3: (is_c3.__pk_increment, is_c3.a, is_c3.b, is_c3.c)})}]), partitions(p0), 
      column_values([T_HIDDEN_PK], [column_conv(INT,PS:(11,0),NULL,ANONYMOUS_VIEW1.a)], [column_conv(INT,PS:(11,0),NULL,ANONYMOUS_VIEW1.b)], [column_conv(INT,
      PS:(11,0),NULL,ANONYMOUS_VIEW1.c)])
  1 - output([ANONYMOUS_VIEW1.a], [ANONYMOUS_VIEW1.b], [ANONYMOUS_VIEW1.c]), filter(nil), rowset=16
      access([ANONYMOUS_VIEW1.a], [ANONYMOUS_VIEW1.b], [ANONYMOUS_VIEW1.c])
  2 - output([t1.a], [t1.b], [t1.c]), filter([t1.b > ANY(subquery(1))]), rowset=16
      exec_params_([t1.a(:0)]), onetime_exprs_(nil), init_plan_idxs_(nil), use_batch=false
  3 - output([t1.a], [t1.b], [t1.c]), filter(nil), rowset=16
      access([t1.a], [t1.b], [t1.c]), partitions(p0)
      is_index_back=false, is_global_index=false, 
      range_key([t1.a]), range(MIN ; MAX)always true
  4 - output([T_FUN_COUNT_SUM(T_FUN_COUNT(*))]), filter([T_FUN_COUNT_SUM(T_FUN_COUNT(*)) < :0]), rowset=16
      group(nil), agg_func([T_FUN_COUNT_SUM(T_FUN_COUNT(*))])
  5 - output([T_FUN_COUNT(*)]), filter(nil), rowset=16
      access(nil), partitions(p0)
      is_index_back=false, is_global_index=false, 
      range_key([t2.a]), range(MIN ; MAX)always true, 
      pushdown_aggregation([T_FUN_COUNT(*)])
insert into is_c3 select /*+NO_REWRITE*/* from t1 where t1.b > any (select count(*) from t2 having count(*) < t1.a);
select/**/ * from is_c3;
a	b	c
rollback;


# case 77
EXPLAIN select * from t1 where t1.b > all (select count(*) from t2 where t2.a < t1.a);
Query Plan
=========================================================
|ID|OPERATOR                 |NAME|EST.ROWS|EST.TIME(us)|
---------------------------------------------------------
|0 |MERGE GROUP BY           |    |1       |135         |
|1 |└─NESTED-LOOP OUTER JOIN |    |32      |132         |
|2 |  ├─TABLE FULL SCAN      |t1  |8       |3           |
|3 |  └─TABLE RANGE SCAN     |t2  |3       |16          |
=========================================================
Outputs & filters:
-------------------------------------
  0 - output([t1.a], [t1.b], [t1.c]), filter([t1.b > T_FUN_COUNT(t2.a)]), rowset=16
      group([t1.a]), agg_func([T_FUN_COUNT(t2.a)])
  1 - output([t1.a], [t1.b], [t1.c], [t2.a]), filter(nil), rowset=16
      conds(nil), nl_params_([t1.a(:0)]), use_batch=true
  2 - output([t1.a], [t1.b], [t1.c]), filter(nil), rowset=16
      access([t1.a], [t1.b], [t1.c]), partitions(p0)
      is_index_back=false, is_global_index=false, 
      range_key([t1.a]), range(MIN ; MAX)always true
  3 - output([t2.a]), filter(nil), rowset=16
      access([GROUP_ID], [t2.a]), partitions(p0)
      is_index_back=false, is_global_index=false, 
      range_key([t2.a]), range(MIN ; MAX), 
      range_cond([t2.a < :0])
select * from t1 where t1.b > all (select count(*) from t2 where t2.a < t1.a);
a	b	c
1	1	0
2	2	1
3	3	0
4	4	1
5	5	0
6	6	1
7	7	0
8	8	1
EXPLAIN select /*+NO_REWRITE*/* from t1 where t1.b > all (select count(*) from t2 where t2.a < t1.a);
Query Plan
====================================================
|ID|OPERATOR            |NAME|EST.ROWS|EST.TIME(us)|
----------------------------------------------------
|0 |SUBPLAN FILTER      |    |4       |147         |
|1 |├─TABLE FULL SCAN   |t1  |8       |3           |
|2 |└─SCALAR GROUP BY   |    |1       |18          |
|3 |  └─TABLE RANGE SCAN|t2  |3       |18          |
====================================================
Outputs & filters:
-------------------------------------
  0 - output([t1.a], [t1.b], [t1.c]), filter([t1.b > ALL(subquery(1))]), rowset=16
      exec_params_([t1.a(:0)]), onetime_exprs_(nil), init_plan_idxs_(nil), use_batch=false
  1 - output([t1.a], [t1.b], [t1.c]), filter(nil), rowset=16
      access([t1.a], [t1.b], [t1.c]), partitions(p0)
      is_index_back=false, is_global_index=false, 
      range_key([t1.a]), range(MIN ; MAX)always true
  2 - output([T_FUN_COUNT_SUM(T_FUN_COUNT(*))]), filter(nil), rowset=16
      group(nil), agg_func([T_FUN_COUNT_SUM(T_FUN_COUNT(*))])
  3 - output([T_FUN_COUNT(*)]), filter(nil), rowset=16
      access(nil), partitions(p0)
      is_index_back=false, is_global_index=false, 
      range_key([t2.a]), range(MIN ; MAX)always true, 
      range_cond([t2.a < :0]), 
      pushdown_aggregation([T_FUN_COUNT(*)])
select /*+NO_REWRITE*/* from t1 where t1.b > all (select count(*) from t2 where t2.a < t1.a);
a	b	c
1	1	0
2	2	1
3	3	0
4	4	1
5	5	0
6	6	1
7	7	0
8	8	1
EXPLAIN update t1 set b = b + 1 where t1.b > all (select count(*) from t2 where t2.a < t1.a);
Query Plan
==============================================================
|ID|OPERATOR                     |NAME |EST.ROWS|EST.TIME(us)|
--------------------------------------------------------------
|0 |UPDATE                       |     |1       |162         |
|1 |└─SUBPLAN SCAN               |VIEW1|1       |135         |
|2 |  └─MERGE GROUP BY           |     |1       |135         |
|3 |    └─NESTED-LOOP OUTER JOIN |     |32      |132         |
|4 |      ├─TABLE FULL SCAN      |t1   |8       |3           |
|5 |      └─TABLE RANGE SCAN     |t2   |3       |16          |
==============================================================
Outputs & filters:
-------------------------------------
  0 - output(nil), filter(nil)
      table_columns([{VIEW1: ({t1: (VIEW1.t1.a, VIEW1.t1.b, VIEW1.t1.c)})}]),
      update([VIEW1.t1.b=column_conv(INT,PS:(11,0),NULL,cast(VIEW1.t1.b + 1, INT(-1, 0)))])
  1 - output([VIEW1.t1.a], [VIEW1.t1.b], [VIEW1.t1.c]), filter(nil), rowset=16
      access([VIEW1.t1.a], [VIEW1.t1.b], [VIEW1.t1.c])
  2 - output([t1.a], [t1.b], [t1.c]), filter([t1.b > T_FUN_COUNT(t2.a)]), rowset=16
      group([t1.a]), agg_func([T_FUN_COUNT(t2.a)])
  3 - output([t1.a], [t1.b], [t1.c], [t2.a]), filter(nil), rowset=16
      conds(nil), nl_params_([t1.a(:0)]), use_batch=true
  4 - output([t1.a], [t1.b], [t1.c]), filter(nil), rowset=16
      access([t1.a], [t1.b], [t1.c]), partitions(p0)
      is_index_back=false, is_global_index=false, 
      range_key([t1.a]), range(MIN ; MAX)always true
  5 - output([t2.a]), filter(nil), rowset=16
      access([GROUP_ID], [t2.a]), partitions(p0)
      is_index_back=false, is_global_index=false, 
      range_key([t2.a]), range(MIN ; MAX), 
      range_cond([t2.a < :0])
update t1 set b = b + 1 where t1.b > all (select count(*) from t2 where t2.a < t1.a);
select/**/ * from t1;
a	b	c
1	2	0
2	3	1
3	4	0
4	5	1
5	6	0
6	7	1
7	8	0
8	9	1
rollback;
update/*+NO_REWRITE*/ t1 set b = b + 1 where t1.b > all (select count(*) from t2 where t2.a < t1.a);
select/**/ * from t1;
a	b	c
1	2	0
2	3	1
3	4	0
4	5	1
5	6	0
6	7	1
7	8	0
8	9	1
rollback;
EXPLAIN delete from t1 where t1.b > all (select count(*) from t2 where t2.a < t1.a);
Query Plan
==============================================================
|ID|OPERATOR                     |NAME |EST.ROWS|EST.TIME(us)|
--------------------------------------------------------------
|0 |DELETE                       |     |1       |143         |
|1 |└─SUBPLAN SCAN               |VIEW1|1       |135         |
|2 |  └─MERGE GROUP BY           |     |1       |135         |
|3 |    └─NESTED-LOOP OUTER JOIN |     |32      |132         |
|4 |      ├─TABLE FULL SCAN      |t1   |8       |3           |
|5 |      └─TABLE RANGE SCAN     |t2   |3       |16          |
==============================================================
Outputs & filters:
-------------------------------------
  0 - output(nil), filter(nil)
      table_columns([{VIEW1: ({t1: (VIEW1.t1.a, VIEW1.t1.b, VIEW1.t1.c)})}])
  1 - output([VIEW1.t1.a], [VIEW1.t1.b], [VIEW1.t1.c]), filter(nil), rowset=16
      access([VIEW1.t1.a], [VIEW1.t1.b], [VIEW1.t1.c])
  2 - output([t1.a], [t1.b], [t1.c]), filter([t1.b > T_FUN_COUNT(t2.a)]), rowset=16
      group([t1.a]), agg_func([T_FUN_COUNT(t2.a)])
  3 - output([t1.a], [t1.b], [t1.c], [t2.a]), filter(nil), rowset=16
      conds(nil), nl_params_([t1.a(:0)]), use_batch=true
  4 - output([t1.a], [t1.b], [t1.c]), filter(nil), rowset=16
      access([t1.a], [t1.b], [t1.c]), partitions(p0)
      is_index_back=false, is_global_index=false, 
      range_key([t1.a]), range(MIN ; MAX)always true
  5 - output([t2.a]), filter(nil), rowset=16
      access([GROUP_ID], [t2.a]), partitions(p0)
      is_index_back=false, is_global_index=false, 
      range_key([t2.a]), range(MIN ; MAX), 
      range_cond([t2.a < :0])
delete from t1 where t1.b > all (select count(*) from t2 where t2.a < t1.a);
select/**/ * from t1;
a	b	c
rollback;
delete/*+NO_REWRITE*/ from t1 where t1.b > all (select count(*) from t2 where t2.a < t1.a);
select/**/ * from t1;
a	b	c
rollback;
EXPLAIN insert into is_c3 select * from t1 where t1.b > all (select count(*) from t2 where t2.a < t1.a);
Query Plan
========================================================================
|ID|OPERATOR                     |NAME           |EST.ROWS|EST.TIME(us)|
------------------------------------------------------------------------
|0 |INSERT                       |               |1       |144         |
|1 |└─SUBPLAN SCAN               |ANONYMOUS_VIEW1|1       |135         |
|2 |  └─MERGE GROUP BY           |               |1       |135         |
|3 |    └─NESTED-LOOP OUTER JOIN |               |32      |132         |
|4 |      ├─TABLE FULL SCAN      |t1             |8       |3           |
|5 |      └─TABLE RANGE SCAN     |t2             |3       |16          |
========================================================================
Outputs & filters:
-------------------------------------
  0 - output(nil), filter(nil)
      columns([{is_c3: ({is_c3: (is_c3.__pk_increment, is_c3.a, is_c3.b, is_c3.c)})}]), partitions(p0), 
      column_values([T_HIDDEN_PK], [column_conv(INT,PS:(11,0),NULL,ANONYMOUS_VIEW1.a)], [column_conv(INT,PS:(11,0),NULL,ANONYMOUS_VIEW1.b)], [column_conv(INT,
      PS:(11,0),NULL,ANONYMOUS_VIEW1.c)])
  1 - output([ANONYMOUS_VIEW1.a], [ANONYMOUS_VIEW1.b], [ANONYMOUS_VIEW1.c]), filter(nil), rowset=16
      access([ANONYMOUS_VIEW1.a], [ANONYMOUS_VIEW1.b], [ANONYMOUS_VIEW1.c])
  2 - output([t1.a], [t1.b], [t1.c]), filter([t1.b > T_FUN_COUNT(t2.a)]), rowset=16
      group([t1.a]), agg_func([T_FUN_COUNT(t2.a)])
  3 - output([t1.a], [t1.b], [t1.c], [t2.a]), filter(nil), rowset=16
      conds(nil), nl_params_([t1.a(:0)]), use_batch=true
  4 - output([t1.a], [t1.b], [t1.c]), filter(nil), rowset=16
      access([t1.a], [t1.b], [t1.c]), partitions(p0)
      is_index_back=false, is_global_index=false, 
      range_key([t1.a]), range(MIN ; MAX)always true
  5 - output([t2.a]), filter(nil), rowset=16
      access([GROUP_ID], [t2.a]), partitions(p0)
      is_index_back=false, is_global_index=false, 
      range_key([t2.a]), range(MIN ; MAX), 
      range_cond([t2.a < :0])
insert into is_c3 select * from t1 where t1.b > all (select count(*) from t2 where t2.a < t1.a);
select/**/ * from is_c3;
a	b	c
1	1	0
2	2	1
3	3	0
4	4	1
5	5	0
6	6	1
7	7	0
8	8	1
rollback;
EXPLAIN insert into is_c3 select /*+NO_REWRITE*/* from t1 where t1.b > all (select count(*) from t2 where t2.a < t1.a);
Query Plan
===================================================================
|ID|OPERATOR                |NAME           |EST.ROWS|EST.TIME(us)|
-------------------------------------------------------------------
|0 |INSERT                  |               |4       |179         |
|1 |└─SUBPLAN SCAN          |ANONYMOUS_VIEW1|4       |147         |
|2 |  └─SUBPLAN FILTER      |               |4       |147         |
|3 |    ├─TABLE FULL SCAN   |t1             |8       |3           |
|4 |    └─SCALAR GROUP BY   |               |1       |18          |
|5 |      └─TABLE RANGE SCAN|t2             |3       |18          |
===================================================================
Outputs & filters:
-------------------------------------
  0 - output(nil), filter(nil)
      columns([{is_c3: ({is_c3: (is_c3.__pk_increment, is_c3.a, is_c3.b, is_c3.c)})}]), partitions(p0), 
      column_values([T_HIDDEN_PK], [column_conv(INT,PS:(11,0),NULL,ANONYMOUS_VIEW1.a)], [column_conv(INT,PS:(11,0),NULL,ANONYMOUS_VIEW1.b)], [column_conv(INT,
      PS:(11,0),NULL,ANONYMOUS_VIEW1.c)])
  1 - output([ANONYMOUS_VIEW1.a], [ANONYMOUS_VIEW1.b], [ANONYMOUS_VIEW1.c]), filter(nil), rowset=16
      access([ANONYMOUS_VIEW1.a], [ANONYMOUS_VIEW1.b], [ANONYMOUS_VIEW1.c])
  2 - output([t1.a], [t1.b], [t1.c]), filter([t1.b > ALL(subquery(1))]), rowset=16
      exec_params_([t1.a(:0)]), onetime_exprs_(nil), init_plan_idxs_(nil), use_batch=false
  3 - output([t1.a], [t1.b], [t1.c]), filter(nil), rowset=16
      access([t1.a], [t1.b], [t1.c]), partitions(p0)
      is_index_back=false, is_global_index=false, 
      range_key([t1.a]), range(MIN ; MAX)always true
  4 - output([T_FUN_COUNT_SUM(T_FUN_COUNT(*))]), filter(nil), rowset=16
      group(nil), agg_func([T_FUN_COUNT_SUM(T_FUN_COUNT(*))])
  5 - output([T_FUN_COUNT(*)]), filter(nil), rowset=16
      access(nil), partitions(p0)
      is_index_back=false, is_global_index=false, 
      range_key([t2.a]), range(MIN ; MAX)always true, 
      range_cond([t2.a < :0]), 
      pushdown_aggregation([T_FUN_COUNT(*)])
insert into is_c3 select /*+NO_REWRITE*/* from t1 where t1.b > all (select count(*) from t2 where t2.a < t1.a);
select/**/ * from is_c3;
a	b	c
1	1	0
2	2	1
3	3	0
4	4	1
5	5	0
6	6	1
7	7	0
8	8	1
rollback;


# case 78
EXPLAIN select * from t1 where t1.b > all (select count(*) from t2 having count(*) < t1.a);
Query Plan
========================================================
|ID|OPERATOR               |NAME |EST.ROWS|EST.TIME(us)|
--------------------------------------------------------
|0 |NESTED-LOOP ANTI JOIN  |     |8       |6           |
|1 |├─TABLE FULL SCAN      |t1   |8       |3           |
|2 |└─MATERIAL             |     |1       |3           |
|3 |  └─SUBPLAN SCAN       |VIEW2|1       |3           |
|4 |    └─SCALAR GROUP BY  |     |1       |3           |
|5 |      └─TABLE FULL SCAN|t2   |8       |3           |
========================================================
Outputs & filters:
-------------------------------------
  0 - output([t1.a], [t1.b], [t1.c]), filter(nil), rowset=16
      conds([VIEW2.VIEW1.T_FUN_COUNT(*) < t1.a], [t1.b <= VIEW2.VIEW1.T_FUN_COUNT(*) OR t1.b IS NULL]), nl_params_(nil), use_batch=false
  1 - output([t1.a], [t1.b], [t1.c]), filter(nil), rowset=16
      access([t1.a], [t1.b], [t1.c]), partitions(p0)
      is_index_back=false, is_global_index=false, 
      range_key([t1.a]), range(MIN ; MAX)always true
  2 - output([VIEW2.VIEW1.T_FUN_COUNT(*)], [VIEW2.VIEW1.T_FUN_COUNT(*)]), filter(nil), rowset=16
  3 - output([VIEW2.VIEW1.T_FUN_COUNT(*)], [VIEW2.VIEW1.T_FUN_COUNT(*)]), filter(nil), rowset=16
      access([VIEW2.VIEW1.T_FUN_COUNT(*)], [VIEW2.VIEW1.T_FUN_COUNT(*)])
  4 - output([T_FUN_COUNT_SUM(T_FUN_COUNT(*))], [T_FUN_COUNT_SUM(T_FUN_COUNT(*))]), filter(nil), rowset=16
      group(nil), agg_func([T_FUN_COUNT_SUM(T_FUN_COUNT(*))])
  5 - output([T_FUN_COUNT(*)]), filter(nil), rowset=16
      access(nil), partitions(p0)
      is_index_back=false, is_global_index=false, 
      range_key([t2.a]), range(MIN ; MAX)always true, 
      pushdown_aggregation([T_FUN_COUNT(*)])
select * from t1 where t1.b > all (select count(*) from t2 having count(*) < t1.a);
a	b	c
1	1	0
2	2	1
3	3	0
4	4	1
5	5	0
6	6	1
7	7	0
8	8	1
EXPLAIN select /*+NO_REWRITE*/* from t1 where t1.b > all (select count(*) from t2 having count(*) < t1.a);
Query Plan
===================================================
|ID|OPERATOR           |NAME|EST.ROWS|EST.TIME(us)|
---------------------------------------------------
|0 |SUBPLAN FILTER     |    |4       |148         |
|1 |├─TABLE FULL SCAN  |t1  |8       |3           |
|2 |└─SCALAR GROUP BY  |    |1       |19          |
|3 |  └─TABLE FULL SCAN|t2  |8       |18          |
===================================================
Outputs & filters:
-------------------------------------
  0 - output([t1.a], [t1.b], [t1.c]), filter([t1.b > ALL(subquery(1))]), rowset=16
      exec_params_([t1.a(:0)]), onetime_exprs_(nil), init_plan_idxs_(nil), use_batch=false
  1 - output([t1.a], [t1.b], [t1.c]), filter(nil), rowset=16
      access([t1.a], [t1.b], [t1.c]), partitions(p0)
      is_index_back=false, is_global_index=false, 
      range_key([t1.a]), range(MIN ; MAX)always true
  2 - output([T_FUN_COUNT_SUM(T_FUN_COUNT(*))]), filter([T_FUN_COUNT_SUM(T_FUN_COUNT(*)) < :0]), rowset=16
      group(nil), agg_func([T_FUN_COUNT_SUM(T_FUN_COUNT(*))])
  3 - output([T_FUN_COUNT(*)]), filter(nil), rowset=16
      access(nil), partitions(p0)
      is_index_back=false, is_global_index=false, 
      range_key([t2.a]), range(MIN ; MAX)always true, 
      pushdown_aggregation([T_FUN_COUNT(*)])
select /*+NO_REWRITE*/* from t1 where t1.b > all (select count(*) from t2 having count(*) < t1.a);
a	b	c
1	1	0
2	2	1
3	3	0
4	4	1
5	5	0
6	6	1
7	7	0
8	8	1
EXPLAIN update t1 set b = b + 1 where t1.b > all (select count(*) from t2 having count(*) < t1.a);
Query Plan
==========================================================
|ID|OPERATOR                 |NAME |EST.ROWS|EST.TIME(us)|
----------------------------------------------------------
|0 |UPDATE                   |     |8       |90          |
|1 |└─NESTED-LOOP ANTI JOIN  |     |8       |6           |
|2 |  ├─TABLE FULL SCAN      |t1   |8       |3           |
|3 |  └─MATERIAL             |     |1       |3           |
|4 |    └─SUBPLAN SCAN       |VIEW2|1       |3           |
|5 |      └─SCALAR GROUP BY  |     |1       |3           |
|6 |        └─TABLE FULL SCAN|t2   |8       |3           |
==========================================================
Outputs & filters:
-------------------------------------
  0 - output(nil), filter(nil)
      table_columns([{t1: ({t1: (t1.a, t1.b, t1.c)})}]),
      update([t1.b=column_conv(INT,PS:(11,0),NULL,cast(t1.b + 1, INT(-1, 0)))])
  1 - output([t1.a], [t1.b], [t1.c]), filter(nil), rowset=16
      conds([VIEW2.VIEW1.T_FUN_COUNT(*) < t1.a], [t1.b <= VIEW2.VIEW1.T_FUN_COUNT(*) OR t1.b IS NULL]), nl_params_(nil), use_batch=false
  2 - output([t1.a], [t1.b], [t1.c]), filter(nil), rowset=16
      access([t1.a], [t1.b], [t1.c]), partitions(p0)
      is_index_back=false, is_global_index=false, 
      range_key([t1.a]), range(MIN ; MAX)always true
  3 - output([VIEW2.VIEW1.T_FUN_COUNT(*)], [VIEW2.VIEW1.T_FUN_COUNT(*)]), filter(nil), rowset=16
  4 - output([VIEW2.VIEW1.T_FUN_COUNT(*)], [VIEW2.VIEW1.T_FUN_COUNT(*)]), filter(nil), rowset=16
      access([VIEW2.VIEW1.T_FUN_COUNT(*)], [VIEW2.VIEW1.T_FUN_COUNT(*)])
  5 - output([T_FUN_COUNT_SUM(T_FUN_COUNT(*))], [T_FUN_COUNT_SUM(T_FUN_COUNT(*))]), filter(nil), rowset=16
      group(nil), agg_func([T_FUN_COUNT_SUM(T_FUN_COUNT(*))])
  6 - output([T_FUN_COUNT(*)]), filter(nil), rowset=16
      access(nil), partitions(p0)
      is_index_back=false, is_global_index=false, 
      range_key([t2.a]), range(MIN ; MAX)always true, 
      pushdown_aggregation([T_FUN_COUNT(*)])
update t1 set b = b + 1 where t1.b > all (select count(*) from t2 having count(*) < t1.a);
select/**/ * from t1;
a	b	c
1	2	0
2	3	1
3	4	0
4	5	1
5	6	0
6	7	1
7	8	0
8	9	1
rollback;
EXPLAIN update /*+NO_REWRITE*/t1 set b = b + 1 where t1.b > all (select count(*) from t2 having count(*) < t1.a);
Query Plan
=====================================================
|ID|OPERATOR             |NAME|EST.ROWS|EST.TIME(us)|
-----------------------------------------------------
|0 |UPDATE               |    |4       |202         |
|1 |└─SUBPLAN FILTER     |    |4       |148         |
|2 |  ├─TABLE FULL SCAN  |t1  |8       |3           |
|3 |  └─SCALAR GROUP BY  |    |1       |19          |
|4 |    └─TABLE FULL SCAN|t2  |8       |18          |
=====================================================
Outputs & filters:
-------------------------------------
  0 - output(nil), filter(nil)
      table_columns([{t1: ({t1: (t1.a, t1.b, t1.c)})}]),
      update([t1.b=column_conv(INT,PS:(11,0),NULL,cast(t1.b + 1, INT(-1, 0)))])
  1 - output([t1.a], [t1.b], [t1.c]), filter([t1.b > ALL(subquery(1))]), rowset=16
      exec_params_([t1.a(:0)]), onetime_exprs_(nil), init_plan_idxs_(nil), use_batch=false
  2 - output([t1.a], [t1.b], [t1.c]), filter(nil), rowset=16
      access([t1.a], [t1.b], [t1.c]), partitions(p0)
      is_index_back=false, is_global_index=false, 
      range_key([t1.a]), range(MIN ; MAX)always true
  3 - output([T_FUN_COUNT_SUM(T_FUN_COUNT(*))]), filter([T_FUN_COUNT_SUM(T_FUN_COUNT(*)) < :0]), rowset=16
      group(nil), agg_func([T_FUN_COUNT_SUM(T_FUN_COUNT(*))])
  4 - output([T_FUN_COUNT(*)]), filter(nil), rowset=16
      access(nil), partitions(p0)
      is_index_back=false, is_global_index=false, 
      range_key([t2.a]), range(MIN ; MAX)always true, 
      pushdown_aggregation([T_FUN_COUNT(*)])
update /*+NO_REWRITE*/t1 set b = b + 1 where t1.b > all (select count(*) from t2 having count(*) < t1.a);
select/**/ * from t1;
a	b	c
1	2	0
2	3	1
3	4	0
4	5	1
5	6	0
6	7	1
7	8	0
8	9	1
rollback;
EXPLAIN delete from t1 where t1.b > all (select count(*) from t2 having count(*) < t1.a);
Query Plan
==========================================================
|ID|OPERATOR                 |NAME |EST.ROWS|EST.TIME(us)|
----------------------------------------------------------
|0 |DELETE                   |     |8       |53          |
|1 |└─NESTED-LOOP ANTI JOIN  |     |8       |6           |
|2 |  ├─TABLE FULL SCAN      |t1   |8       |3           |
|3 |  └─MATERIAL             |     |1       |3           |
|4 |    └─SUBPLAN SCAN       |VIEW2|1       |3           |
|5 |      └─SCALAR GROUP BY  |     |1       |3           |
|6 |        └─TABLE FULL SCAN|t2   |8       |3           |
==========================================================
Outputs & filters:
-------------------------------------
  0 - output(nil), filter(nil)
      table_columns([{t1: ({t1: (t1.a, t1.b, t1.c)})}])
  1 - output([t1.a], [t1.b], [t1.c]), filter(nil), rowset=16
      conds([VIEW2.VIEW1.T_FUN_COUNT(*) < t1.a], [t1.b <= VIEW2.VIEW1.T_FUN_COUNT(*) OR t1.b IS NULL]), nl_params_(nil), use_batch=false
  2 - output([t1.a], [t1.b], [t1.c]), filter(nil), rowset=16
      access([t1.a], [t1.b], [t1.c]), partitions(p0)
      is_index_back=false, is_global_index=false, 
      range_key([t1.a]), range(MIN ; MAX)always true
  3 - output([VIEW2.VIEW1.T_FUN_COUNT(*)], [VIEW2.VIEW1.T_FUN_COUNT(*)]), filter(nil), rowset=16
  4 - output([VIEW2.VIEW1.T_FUN_COUNT(*)], [VIEW2.VIEW1.T_FUN_COUNT(*)]), filter(nil), rowset=16
      access([VIEW2.VIEW1.T_FUN_COUNT(*)], [VIEW2.VIEW1.T_FUN_COUNT(*)])
  5 - output([T_FUN_COUNT_SUM(T_FUN_COUNT(*))], [T_FUN_COUNT_SUM(T_FUN_COUNT(*))]), filter(nil), rowset=16
      group(nil), agg_func([T_FUN_COUNT_SUM(T_FUN_COUNT(*))])
  6 - output([T_FUN_COUNT(*)]), filter(nil), rowset=16
      access(nil), partitions(p0)
      is_index_back=false, is_global_index=false, 
      range_key([t2.a]), range(MIN ; MAX)always true, 
      pushdown_aggregation([T_FUN_COUNT(*)])
delete from t1 where t1.b > all (select count(*) from t2 having count(*) < t1.a);
select/**/ * from t1;
a	b	c
rollback;
EXPLAIN delete /*+NO_REWRITE*/from t1 where t1.b > all (select count(*) from t2 having count(*) < t1.a);
Query Plan
=====================================================
|ID|OPERATOR             |NAME|EST.ROWS|EST.TIME(us)|
-----------------------------------------------------
|0 |DELETE               |    |4       |174         |
|1 |└─SUBPLAN FILTER     |    |4       |148         |
|2 |  ├─TABLE FULL SCAN  |t1  |8       |3           |
|3 |  └─SCALAR GROUP BY  |    |1       |19          |
|4 |    └─TABLE FULL SCAN|t2  |8       |18          |
=====================================================
Outputs & filters:
-------------------------------------
  0 - output(nil), filter(nil)
      table_columns([{t1: ({t1: (t1.a, t1.b, t1.c)})}])
  1 - output([t1.a], [t1.b], [t1.c]), filter([t1.b > ALL(subquery(1))]), rowset=16
      exec_params_([t1.a(:0)]), onetime_exprs_(nil), init_plan_idxs_(nil), use_batch=false
  2 - output([t1.a], [t1.b], [t1.c]), filter(nil), rowset=16
      access([t1.a], [t1.b], [t1.c]), partitions(p0)
      is_index_back=false, is_global_index=false, 
      range_key([t1.a]), range(MIN ; MAX)always true
  3 - output([T_FUN_COUNT_SUM(T_FUN_COUNT(*))]), filter([T_FUN_COUNT_SUM(T_FUN_COUNT(*)) < :0]), rowset=16
      group(nil), agg_func([T_FUN_COUNT_SUM(T_FUN_COUNT(*))])
  4 - output([T_FUN_COUNT(*)]), filter(nil), rowset=16
      access(nil), partitions(p0)
      is_index_back=false, is_global_index=false, 
      range_key([t2.a]), range(MIN ; MAX)always true, 
      pushdown_aggregation([T_FUN_COUNT(*)])
delete /*+NO_REWRITE*/from t1 where t1.b > all (select count(*) from t2 having count(*) < t1.a);
select/**/ * from t1;
a	b	c
rollback;
EXPLAIN insert into is_c3 select * from t1 where t1.b > all (select count(*) from t2 having count(*) < t1.a);
Query Plan
======================================================================
|ID|OPERATOR                   |NAME           |EST.ROWS|EST.TIME(us)|
----------------------------------------------------------------------
|0 |INSERT                     |               |8       |63          |
|1 |└─SUBPLAN SCAN             |ANONYMOUS_VIEW1|8       |6           |
|2 |  └─NESTED-LOOP ANTI JOIN  |               |8       |6           |
|3 |    ├─TABLE FULL SCAN      |t1             |8       |3           |
|4 |    └─MATERIAL             |               |1       |3           |
|5 |      └─SUBPLAN SCAN       |VIEW2          |1       |3           |
|6 |        └─SCALAR GROUP BY  |               |1       |3           |
|7 |          └─TABLE FULL SCAN|t2             |8       |3           |
======================================================================
Outputs & filters:
-------------------------------------
  0 - output(nil), filter(nil)
      columns([{is_c3: ({is_c3: (is_c3.__pk_increment, is_c3.a, is_c3.b, is_c3.c)})}]), partitions(p0), 
      column_values([T_HIDDEN_PK], [column_conv(INT,PS:(11,0),NULL,ANONYMOUS_VIEW1.a)], [column_conv(INT,PS:(11,0),NULL,ANONYMOUS_VIEW1.b)], [column_conv(INT,
      PS:(11,0),NULL,ANONYMOUS_VIEW1.c)])
  1 - output([ANONYMOUS_VIEW1.a], [ANONYMOUS_VIEW1.b], [ANONYMOUS_VIEW1.c]), filter(nil), rowset=16
      access([ANONYMOUS_VIEW1.a], [ANONYMOUS_VIEW1.b], [ANONYMOUS_VIEW1.c])
  2 - output([t1.a], [t1.b], [t1.c]), filter(nil), rowset=16
      conds([VIEW2.VIEW1.T_FUN_COUNT(*) < t1.a], [t1.b <= VIEW2.VIEW1.T_FUN_COUNT(*) OR t1.b IS NULL]), nl_params_(nil), use_batch=false
  3 - output([t1.a], [t1.b], [t1.c]), filter(nil), rowset=16
      access([t1.a], [t1.b], [t1.c]), partitions(p0)
      is_index_back=false, is_global_index=false, 
      range_key([t1.a]), range(MIN ; MAX)always true
  4 - output([VIEW2.VIEW1.T_FUN_COUNT(*)], [VIEW2.VIEW1.T_FUN_COUNT(*)]), filter(nil), rowset=16
  5 - output([VIEW2.VIEW1.T_FUN_COUNT(*)], [VIEW2.VIEW1.T_FUN_COUNT(*)]), filter(nil), rowset=16
      access([VIEW2.VIEW1.T_FUN_COUNT(*)], [VIEW2.VIEW1.T_FUN_COUNT(*)])
  6 - output([T_FUN_COUNT_SUM(T_FUN_COUNT(*))], [T_FUN_COUNT_SUM(T_FUN_COUNT(*))]), filter(nil), rowset=16
      group(nil), agg_func([T_FUN_COUNT_SUM(T_FUN_COUNT(*))])
  7 - output([T_FUN_COUNT(*)]), filter(nil), rowset=16
      access(nil), partitions(p0)
      is_index_back=false, is_global_index=false, 
      range_key([t2.a]), range(MIN ; MAX)always true, 
      pushdown_aggregation([T_FUN_COUNT(*)])
insert into is_c3 select * from t1 where t1.b > all (select count(*) from t2 having count(*) < t1.a);
select/**/ * from is_c3;
a	b	c
1	1	0
2	2	1
3	3	0
4	4	1
5	5	0
6	6	1
7	7	0
8	8	1
rollback;
EXPLAIN insert into is_c3 select /*+NO_REWRITE*/* from t1 where t1.b > all (select count(*) from t2 having count(*) < t1.a);
Query Plan
==================================================================
|ID|OPERATOR               |NAME           |EST.ROWS|EST.TIME(us)|
------------------------------------------------------------------
|0 |INSERT                 |               |4       |180         |
|1 |└─SUBPLAN SCAN         |ANONYMOUS_VIEW1|4       |148         |
|2 |  └─SUBPLAN FILTER     |               |4       |148         |
|3 |    ├─TABLE FULL SCAN  |t1             |8       |3           |
|4 |    └─SCALAR GROUP BY  |               |1       |19          |
|5 |      └─TABLE FULL SCAN|t2             |8       |18          |
==================================================================
Outputs & filters:
-------------------------------------
  0 - output(nil), filter(nil)
      columns([{is_c3: ({is_c3: (is_c3.__pk_increment, is_c3.a, is_c3.b, is_c3.c)})}]), partitions(p0), 
      column_values([T_HIDDEN_PK], [column_conv(INT,PS:(11,0),NULL,ANONYMOUS_VIEW1.a)], [column_conv(INT,PS:(11,0),NULL,ANONYMOUS_VIEW1.b)], [column_conv(INT,
      PS:(11,0),NULL,ANONYMOUS_VIEW1.c)])
  1 - output([ANONYMOUS_VIEW1.a], [ANONYMOUS_VIEW1.b], [ANONYMOUS_VIEW1.c]), filter(nil), rowset=16
      access([ANONYMOUS_VIEW1.a], [ANONYMOUS_VIEW1.b], [ANONYMOUS_VIEW1.c])
  2 - output([t1.a], [t1.b], [t1.c]), filter([t1.b > ALL(subquery(1))]), rowset=16
      exec_params_([t1.a(:0)]), onetime_exprs_(nil), init_plan_idxs_(nil), use_batch=false
  3 - output([t1.a], [t1.b], [t1.c]), filter(nil), rowset=16
      access([t1.a], [t1.b], [t1.c]), partitions(p0)
      is_index_back=false, is_global_index=false, 
      range_key([t1.a]), range(MIN ; MAX)always true
  4 - output([T_FUN_COUNT_SUM(T_FUN_COUNT(*))]), filter([T_FUN_COUNT_SUM(T_FUN_COUNT(*)) < :0]), rowset=16
      group(nil), agg_func([T_FUN_COUNT_SUM(T_FUN_COUNT(*))])
  5 - output([T_FUN_COUNT(*)]), filter(nil), rowset=16
      access(nil), partitions(p0)
      is_index_back=false, is_global_index=false, 
      range_key([t2.a]), range(MIN ; MAX)always true, 
      pushdown_aggregation([T_FUN_COUNT(*)])
insert into is_c3 select /*+NO_REWRITE*/* from t1 where t1.b > all (select count(*) from t2 having count(*) < t1.a);
select/**/ * from is_c3;
a	b	c
1	1	0
2	2	1
3	3	0
4	4	1
5	5	0
6	6	1
7	7	0
8	8	1
rollback;


# case 79
EXPLAIN select * from t1 where t1.b in (select count(*) from t2 where t2.a < t1.a);
Query Plan
=========================================================
|ID|OPERATOR                 |NAME|EST.ROWS|EST.TIME(us)|
---------------------------------------------------------
|0 |MERGE GROUP BY           |    |1       |135         |
|1 |└─NESTED-LOOP OUTER JOIN |    |32      |132         |
|2 |  ├─TABLE FULL SCAN      |t1  |8       |3           |
|3 |  └─TABLE RANGE SCAN     |t2  |3       |16          |
=========================================================
Outputs & filters:
-------------------------------------
  0 - output([t1.a], [t1.b], [t1.c]), filter([t1.b = T_FUN_COUNT(t2.a)]), rowset=16
      group([t1.a]), agg_func([T_FUN_COUNT(t2.a)])
  1 - output([t1.a], [t1.b], [t1.c], [t2.a]), filter(nil), rowset=16
      conds(nil), nl_params_([t1.a(:0)]), use_batch=true
  2 - output([t1.a], [t1.b], [t1.c]), filter(nil), rowset=16
      access([t1.a], [t1.b], [t1.c]), partitions(p0)
      is_index_back=false, is_global_index=false, 
      range_key([t1.a]), range(MIN ; MAX)always true
  3 - output([t2.a]), filter(nil), rowset=16
      access([GROUP_ID], [t2.a]), partitions(p0)
      is_index_back=false, is_global_index=false, 
      range_key([t2.a]), range(MIN ; MAX), 
      range_cond([t2.a < :0])
select * from t1 where t1.b in (select count(*) from t2 where t2.a < t1.a);
a	b	c
EXPLAIN select /*+NO_REWRITE*/* from t1 where t1.b in (select count(*) from t2 where t2.a < t1.a);
Query Plan
====================================================
|ID|OPERATOR            |NAME|EST.ROWS|EST.TIME(us)|
----------------------------------------------------
|0 |SUBPLAN FILTER      |    |4       |147         |
|1 |├─TABLE FULL SCAN   |t1  |8       |3           |
|2 |└─SCALAR GROUP BY   |    |1       |18          |
|3 |  └─TABLE RANGE SCAN|t2  |3       |18          |
====================================================
Outputs & filters:
-------------------------------------
  0 - output([t1.a], [t1.b], [t1.c]), filter([t1.b = ANY(subquery(1))]), rowset=16
      exec_params_([t1.a(:0)]), onetime_exprs_(nil), init_plan_idxs_(nil), use_batch=false
  1 - output([t1.a], [t1.b], [t1.c]), filter(nil), rowset=16
      access([t1.a], [t1.b], [t1.c]), partitions(p0)
      is_index_back=false, is_global_index=false, 
      range_key([t1.a]), range(MIN ; MAX)always true
  2 - output([T_FUN_COUNT_SUM(T_FUN_COUNT(*))]), filter(nil), rowset=16
      group(nil), agg_func([T_FUN_COUNT_SUM(T_FUN_COUNT(*))])
  3 - output([T_FUN_COUNT(*)]), filter(nil), rowset=16
      access(nil), partitions(p0)
      is_index_back=false, is_global_index=false, 
      range_key([t2.a]), range(MIN ; MAX)always true, 
      range_cond([t2.a < :0]), 
      pushdown_aggregation([T_FUN_COUNT(*)])
select /*+NO_REWRITE*/* from t1 where t1.b in (select count(*) from t2 where t2.a < t1.a);
a	b	c
EXPLAIN update t1 set b = b + 1 where t1.b in (select count(*) from t2 where t2.a < t1.a);
Query Plan
==============================================================
|ID|OPERATOR                     |NAME |EST.ROWS|EST.TIME(us)|
--------------------------------------------------------------
|0 |UPDATE                       |     |1       |162         |
|1 |└─SUBPLAN SCAN               |VIEW1|1       |135         |
|2 |  └─MERGE GROUP BY           |     |1       |135         |
|3 |    └─NESTED-LOOP OUTER JOIN |     |32      |132         |
|4 |      ├─TABLE FULL SCAN      |t1   |8       |3           |
|5 |      └─TABLE RANGE SCAN     |t2   |3       |16          |
==============================================================
Outputs & filters:
-------------------------------------
  0 - output(nil), filter(nil)
      table_columns([{VIEW1: ({t1: (VIEW1.t1.a, VIEW1.t1.b, VIEW1.t1.c)})}]),
      update([VIEW1.t1.b=column_conv(INT,PS:(11,0),NULL,cast(VIEW1.t1.b + 1, INT(-1, 0)))])
  1 - output([VIEW1.t1.a], [VIEW1.t1.b], [VIEW1.t1.c]), filter(nil), rowset=16
      access([VIEW1.t1.a], [VIEW1.t1.b], [VIEW1.t1.c])
  2 - output([t1.a], [t1.b], [t1.c]), filter([t1.b = T_FUN_COUNT(t2.a)]), rowset=16
      group([t1.a]), agg_func([T_FUN_COUNT(t2.a)])
  3 - output([t1.a], [t1.b], [t1.c], [t2.a]), filter(nil), rowset=16
      conds(nil), nl_params_([t1.a(:0)]), use_batch=true
  4 - output([t1.a], [t1.b], [t1.c]), filter(nil), rowset=16
      access([t1.a], [t1.b], [t1.c]), partitions(p0)
      is_index_back=false, is_global_index=false, 
      range_key([t1.a]), range(MIN ; MAX)always true
  5 - output([t2.a]), filter(nil), rowset=16
      access([GROUP_ID], [t2.a]), partitions(p0)
      is_index_back=false, is_global_index=false, 
      range_key([t2.a]), range(MIN ; MAX), 
      range_cond([t2.a < :0])
update t1 set b = b + 1 where t1.b in (select count(*) from t2 where t2.a < t1.a);
select/**/ * from t1;
a	b	c
1	1	0
2	2	1
3	3	0
4	4	1
5	5	0
6	6	1
7	7	0
8	8	1
rollback;
EXPLAIN update /*+NO_REWRITE*/t1 set b = b + 1 where t1.b in (select count(*) from t2 where t2.a < t1.a);
Query Plan
======================================================
|ID|OPERATOR              |NAME|EST.ROWS|EST.TIME(us)|
------------------------------------------------------
|0 |UPDATE                |    |4       |201         |
|1 |└─SUBPLAN FILTER      |    |4       |147         |
|2 |  ├─TABLE FULL SCAN   |t1  |8       |3           |
|3 |  └─SCALAR GROUP BY   |    |1       |18          |
|4 |    └─TABLE RANGE SCAN|t2  |3       |18          |
======================================================
Outputs & filters:
-------------------------------------
  0 - output(nil), filter(nil)
      table_columns([{t1: ({t1: (t1.a, t1.b, t1.c)})}]),
      update([t1.b=column_conv(INT,PS:(11,0),NULL,cast(t1.b + 1, INT(-1, 0)))])
  1 - output([t1.a], [t1.b], [t1.c]), filter([t1.b = ANY(subquery(1))]), rowset=16
      exec_params_([t1.a(:0)]), onetime_exprs_(nil), init_plan_idxs_(nil), use_batch=false
  2 - output([t1.a], [t1.b], [t1.c]), filter(nil), rowset=16
      access([t1.a], [t1.b], [t1.c]), partitions(p0)
      is_index_back=false, is_global_index=false, 
      range_key([t1.a]), range(MIN ; MAX)always true
  3 - output([T_FUN_COUNT_SUM(T_FUN_COUNT(*))]), filter(nil), rowset=16
      group(nil), agg_func([T_FUN_COUNT_SUM(T_FUN_COUNT(*))])
  4 - output([T_FUN_COUNT(*)]), filter(nil), rowset=16
      access(nil), partitions(p0)
      is_index_back=false, is_global_index=false, 
      range_key([t2.a]), range(MIN ; MAX)always true, 
      range_cond([t2.a < :0]), 
      pushdown_aggregation([T_FUN_COUNT(*)])
update /*+NO_REWRITE*/t1 set b = b + 1 where t1.b in (select count(*) from t2 where t2.a < t1.a);
select/**/ * from t1;
a	b	c
1	1	0
2	2	1
3	3	0
4	4	1
5	5	0
6	6	1
7	7	0
8	8	1
rollback;
EXPLAIN delete from t1 where t1.b in (select count(*) from t2 where t2.a < t1.a);
Query Plan
==============================================================
|ID|OPERATOR                     |NAME |EST.ROWS|EST.TIME(us)|
--------------------------------------------------------------
|0 |DELETE                       |     |1       |143         |
|1 |└─SUBPLAN SCAN               |VIEW1|1       |135         |
|2 |  └─MERGE GROUP BY           |     |1       |135         |
|3 |    └─NESTED-LOOP OUTER JOIN |     |32      |132         |
|4 |      ├─TABLE FULL SCAN      |t1   |8       |3           |
|5 |      └─TABLE RANGE SCAN     |t2   |3       |16          |
==============================================================
Outputs & filters:
-------------------------------------
  0 - output(nil), filter(nil)
      table_columns([{VIEW1: ({t1: (VIEW1.t1.a, VIEW1.t1.b, VIEW1.t1.c)})}])
  1 - output([VIEW1.t1.a], [VIEW1.t1.b], [VIEW1.t1.c]), filter(nil), rowset=16
      access([VIEW1.t1.a], [VIEW1.t1.b], [VIEW1.t1.c])
  2 - output([t1.a], [t1.b], [t1.c]), filter([t1.b = T_FUN_COUNT(t2.a)]), rowset=16
      group([t1.a]), agg_func([T_FUN_COUNT(t2.a)])
  3 - output([t1.a], [t1.b], [t1.c], [t2.a]), filter(nil), rowset=16
      conds(nil), nl_params_([t1.a(:0)]), use_batch=true
  4 - output([t1.a], [t1.b], [t1.c]), filter(nil), rowset=16
      access([t1.a], [t1.b], [t1.c]), partitions(p0)
      is_index_back=false, is_global_index=false, 
      range_key([t1.a]), range(MIN ; MAX)always true
  5 - output([t2.a]), filter(nil), rowset=16
      access([GROUP_ID], [t2.a]), partitions(p0)
      is_index_back=false, is_global_index=false, 
      range_key([t2.a]), range(MIN ; MAX), 
      range_cond([t2.a < :0])
delete from t1 where t1.b in (select count(*) from t2 where t2.a < t1.a);
select/**/ * from t1;
a	b	c
1	1	0
2	2	1
3	3	0
4	4	1
5	5	0
6	6	1
7	7	0
8	8	1
rollback;
EXPLAIN delete /*+NO_REWRITE*/from t1 where t1.b in (select count(*) from t2 where t2.a < t1.a);
Query Plan
======================================================
|ID|OPERATOR              |NAME|EST.ROWS|EST.TIME(us)|
------------------------------------------------------
|0 |DELETE                |    |4       |174         |
|1 |└─SUBPLAN FILTER      |    |4       |147         |
|2 |  ├─TABLE FULL SCAN   |t1  |8       |3           |
|3 |  └─SCALAR GROUP BY   |    |1       |18          |
|4 |    └─TABLE RANGE SCAN|t2  |3       |18          |
======================================================
Outputs & filters:
-------------------------------------
  0 - output(nil), filter(nil)
      table_columns([{t1: ({t1: (t1.a, t1.b, t1.c)})}])
  1 - output([t1.a], [t1.b], [t1.c]), filter([t1.b = ANY(subquery(1))]), rowset=16
      exec_params_([t1.a(:0)]), onetime_exprs_(nil), init_plan_idxs_(nil), use_batch=false
  2 - output([t1.a], [t1.b], [t1.c]), filter(nil), rowset=16
      access([t1.a], [t1.b], [t1.c]), partitions(p0)
      is_index_back=false, is_global_index=false, 
      range_key([t1.a]), range(MIN ; MAX)always true
  3 - output([T_FUN_COUNT_SUM(T_FUN_COUNT(*))]), filter(nil), rowset=16
      group(nil), agg_func([T_FUN_COUNT_SUM(T_FUN_COUNT(*))])
  4 - output([T_FUN_COUNT(*)]), filter(nil), rowset=16
      access(nil), partitions(p0)
      is_index_back=false, is_global_index=false, 
      range_key([t2.a]), range(MIN ; MAX)always true, 
      range_cond([t2.a < :0]), 
      pushdown_aggregation([T_FUN_COUNT(*)])
delete /*+NO_REWRITE*/from t1 where t1.b in (select count(*) from t2 where t2.a < t1.a);
select/**/ * from t1;
a	b	c
1	1	0
2	2	1
3	3	0
4	4	1
5	5	0
6	6	1
7	7	0
8	8	1
rollback;
EXPLAIN insert into is_c3 select * from t1 where t1.b in (select count(*) from t2 where t2.a < t1.a);
Query Plan
========================================================================
|ID|OPERATOR                     |NAME           |EST.ROWS|EST.TIME(us)|
------------------------------------------------------------------------
|0 |INSERT                       |               |1       |144         |
|1 |└─SUBPLAN SCAN               |ANONYMOUS_VIEW1|1       |135         |
|2 |  └─MERGE GROUP BY           |               |1       |135         |
|3 |    └─NESTED-LOOP OUTER JOIN |               |32      |132         |
|4 |      ├─TABLE FULL SCAN      |t1             |8       |3           |
|5 |      └─TABLE RANGE SCAN     |t2             |3       |16          |
========================================================================
Outputs & filters:
-------------------------------------
  0 - output(nil), filter(nil)
      columns([{is_c3: ({is_c3: (is_c3.__pk_increment, is_c3.a, is_c3.b, is_c3.c)})}]), partitions(p0), 
      column_values([T_HIDDEN_PK], [column_conv(INT,PS:(11,0),NULL,ANONYMOUS_VIEW1.a)], [column_conv(INT,PS:(11,0),NULL,ANONYMOUS_VIEW1.b)], [column_conv(INT,
      PS:(11,0),NULL,ANONYMOUS_VIEW1.c)])
  1 - output([ANONYMOUS_VIEW1.a], [ANONYMOUS_VIEW1.b], [ANONYMOUS_VIEW1.c]), filter(nil), rowset=16
      access([ANONYMOUS_VIEW1.a], [ANONYMOUS_VIEW1.b], [ANONYMOUS_VIEW1.c])
  2 - output([t1.a], [t1.b], [t1.c]), filter([t1.b = T_FUN_COUNT(t2.a)]), rowset=16
      group([t1.a]), agg_func([T_FUN_COUNT(t2.a)])
  3 - output([t1.a], [t1.b], [t1.c], [t2.a]), filter(nil), rowset=16
      conds(nil), nl_params_([t1.a(:0)]), use_batch=true
  4 - output([t1.a], [t1.b], [t1.c]), filter(nil), rowset=16
      access([t1.a], [t1.b], [t1.c]), partitions(p0)
      is_index_back=false, is_global_index=false, 
      range_key([t1.a]), range(MIN ; MAX)always true
  5 - output([t2.a]), filter(nil), rowset=16
      access([GROUP_ID], [t2.a]), partitions(p0)
      is_index_back=false, is_global_index=false, 
      range_key([t2.a]), range(MIN ; MAX), 
      range_cond([t2.a < :0])
insert into is_c3 select * from t1 where t1.b in (select count(*) from t2 where t2.a < t1.a);
select/**/ * from is_c3;
a	b	c
rollback;
EXPLAIN insert into is_c3 select /*+NO_REWRITE*/* from t1 where t1.b in (select count(*) from t2 where t2.a < t1.a);
Query Plan
===================================================================
|ID|OPERATOR                |NAME           |EST.ROWS|EST.TIME(us)|
-------------------------------------------------------------------
|0 |INSERT                  |               |4       |179         |
|1 |└─SUBPLAN SCAN          |ANONYMOUS_VIEW1|4       |147         |
|2 |  └─SUBPLAN FILTER      |               |4       |147         |
|3 |    ├─TABLE FULL SCAN   |t1             |8       |3           |
|4 |    └─SCALAR GROUP BY   |               |1       |18          |
|5 |      └─TABLE RANGE SCAN|t2             |3       |18          |
===================================================================
Outputs & filters:
-------------------------------------
  0 - output(nil), filter(nil)
      columns([{is_c3: ({is_c3: (is_c3.__pk_increment, is_c3.a, is_c3.b, is_c3.c)})}]), partitions(p0), 
      column_values([T_HIDDEN_PK], [column_conv(INT,PS:(11,0),NULL,ANONYMOUS_VIEW1.a)], [column_conv(INT,PS:(11,0),NULL,ANONYMOUS_VIEW1.b)], [column_conv(INT,
      PS:(11,0),NULL,ANONYMOUS_VIEW1.c)])
  1 - output([ANONYMOUS_VIEW1.a], [ANONYMOUS_VIEW1.b], [ANONYMOUS_VIEW1.c]), filter(nil), rowset=16
      access([ANONYMOUS_VIEW1.a], [ANONYMOUS_VIEW1.b], [ANONYMOUS_VIEW1.c])
  2 - output([t1.a], [t1.b], [t1.c]), filter([t1.b = ANY(subquery(1))]), rowset=16
      exec_params_([t1.a(:0)]), onetime_exprs_(nil), init_plan_idxs_(nil), use_batch=false
  3 - output([t1.a], [t1.b], [t1.c]), filter(nil), rowset=16
      access([t1.a], [t1.b], [t1.c]), partitions(p0)
      is_index_back=false, is_global_index=false, 
      range_key([t1.a]), range(MIN ; MAX)always true
  4 - output([T_FUN_COUNT_SUM(T_FUN_COUNT(*))]), filter(nil), rowset=16
      group(nil), agg_func([T_FUN_COUNT_SUM(T_FUN_COUNT(*))])
  5 - output([T_FUN_COUNT(*)]), filter(nil), rowset=16
      access(nil), partitions(p0)
      is_index_back=false, is_global_index=false, 
      range_key([t2.a]), range(MIN ; MAX)always true, 
      range_cond([t2.a < :0]), 
      pushdown_aggregation([T_FUN_COUNT(*)])
insert into is_c3 select /*+NO_REWRITE*/* from t1 where t1.b in (select count(*) from t2 where t2.a < t1.a);
select/**/ * from is_c3;
a	b	c
rollback;


# case 80
EXPLAIN select  * from t1 where t1.b in (select count(*) from t2 having count(*) < t1.a);
Query Plan
======================================================
|ID|OPERATOR             |NAME |EST.ROWS|EST.TIME(us)|
------------------------------------------------------
|0 |HASH JOIN            |     |1       |6           |
|1 |├─SUBPLAN SCAN       |VIEW2|1       |3           |
|2 |│ └─SCALAR GROUP BY  |     |1       |3           |
|3 |│   └─TABLE FULL SCAN|t2   |8       |3           |
|4 |└─TABLE FULL SCAN    |t1   |8       |3           |
======================================================
Outputs & filters:
-------------------------------------
  0 - output([t1.a], [t1.b], [t1.c]), filter(nil), rowset=16
      equal_conds([t1.b = VIEW2.VIEW1.T_FUN_COUNT(*)]), other_conds([VIEW2.VIEW1.T_FUN_COUNT(*) < t1.a])
  1 - output([VIEW2.VIEW1.T_FUN_COUNT(*)], [VIEW2.VIEW1.T_FUN_COUNT(*)]), filter(nil), rowset=16
      access([VIEW2.VIEW1.T_FUN_COUNT(*)], [VIEW2.VIEW1.T_FUN_COUNT(*)])
  2 - output([T_FUN_COUNT_SUM(T_FUN_COUNT(*))], [T_FUN_COUNT_SUM(T_FUN_COUNT(*))]), filter(nil), rowset=16
      group(nil), agg_func([T_FUN_COUNT_SUM(T_FUN_COUNT(*))])
  3 - output([T_FUN_COUNT(*)]), filter(nil), rowset=16
      access(nil), partitions(p0)
      is_index_back=false, is_global_index=false, 
      range_key([t2.a]), range(MIN ; MAX)always true, 
      pushdown_aggregation([T_FUN_COUNT(*)])
  4 - output([t1.a], [t1.b], [t1.c]), filter(nil), rowset=16
      access([t1.a], [t1.b], [t1.c]), partitions(p0)
      is_index_back=false, is_global_index=false, 
      range_key([t1.a]), range(MIN ; MAX)always true
select  * from t1 where t1.b in (select count(*) from t2 having count(*) < t1.a);
a	b	c
EXPLAIN select /*+NO_REWRITE*/* from t1 where t1.b in (select count(*) from t2 having count(*) < t1.a);
Query Plan
===================================================
|ID|OPERATOR           |NAME|EST.ROWS|EST.TIME(us)|
---------------------------------------------------
|0 |SUBPLAN FILTER     |    |4       |148         |
|1 |├─TABLE FULL SCAN  |t1  |8       |3           |
|2 |└─SCALAR GROUP BY  |    |1       |19          |
|3 |  └─TABLE FULL SCAN|t2  |8       |18          |
===================================================
Outputs & filters:
-------------------------------------
  0 - output([t1.a], [t1.b], [t1.c]), filter([t1.b = ANY(subquery(1))]), rowset=16
      exec_params_([t1.a(:0)]), onetime_exprs_(nil), init_plan_idxs_(nil), use_batch=false
  1 - output([t1.a], [t1.b], [t1.c]), filter(nil), rowset=16
      access([t1.a], [t1.b], [t1.c]), partitions(p0)
      is_index_back=false, is_global_index=false, 
      range_key([t1.a]), range(MIN ; MAX)always true
  2 - output([T_FUN_COUNT_SUM(T_FUN_COUNT(*))]), filter([T_FUN_COUNT_SUM(T_FUN_COUNT(*)) < :0]), rowset=16
      group(nil), agg_func([T_FUN_COUNT_SUM(T_FUN_COUNT(*))])
  3 - output([T_FUN_COUNT(*)]), filter(nil), rowset=16
      access(nil), partitions(p0)
      is_index_back=false, is_global_index=false, 
      range_key([t2.a]), range(MIN ; MAX)always true, 
      pushdown_aggregation([T_FUN_COUNT(*)])
select /*+NO_REWRITE*/* from t1 where t1.b in (select count(*) from t2 having count(*) < t1.a);
a	b	c
EXPLAIN update t1 set b = b + 1 where t1.b in (select count(*) from t2 having count(*) < t1.a);
Query Plan
========================================================
|ID|OPERATOR               |NAME |EST.ROWS|EST.TIME(us)|
--------------------------------------------------------
|0 |UPDATE                 |     |1       |38          |
|1 |└─HASH JOIN            |     |1       |6           |
|2 |  ├─SUBPLAN SCAN       |VIEW2|1       |3           |
|3 |  │ └─SCALAR GROUP BY  |     |1       |3           |
|4 |  │   └─TABLE FULL SCAN|t2   |8       |3           |
|5 |  └─TABLE FULL SCAN    |t1   |8       |3           |
========================================================
Outputs & filters:
-------------------------------------
  0 - output(nil), filter(nil)
      table_columns([{t1: ({t1: (t1.a, t1.b, t1.c)}), hash_distinct}]),
      update([t1.b=column_conv(INT,PS:(11,0),NULL,cast(t1.b + 1, INT(-1, 0)))])
  1 - output([t1.a], [t1.b], [t1.c]), filter(nil), rowset=16
      equal_conds([t1.b = VIEW2.VIEW1.T_FUN_COUNT(*)]), other_conds([VIEW2.VIEW1.T_FUN_COUNT(*) < t1.a])
  2 - output([VIEW2.VIEW1.T_FUN_COUNT(*)], [VIEW2.VIEW1.T_FUN_COUNT(*)]), filter(nil), rowset=16
      access([VIEW2.VIEW1.T_FUN_COUNT(*)], [VIEW2.VIEW1.T_FUN_COUNT(*)])
  3 - output([T_FUN_COUNT_SUM(T_FUN_COUNT(*))], [T_FUN_COUNT_SUM(T_FUN_COUNT(*))]), filter(nil), rowset=16
      group(nil), agg_func([T_FUN_COUNT_SUM(T_FUN_COUNT(*))])
  4 - output([T_FUN_COUNT(*)]), filter(nil), rowset=16
      access(nil), partitions(p0)
      is_index_back=false, is_global_index=false, 
      range_key([t2.a]), range(MIN ; MAX)always true, 
      pushdown_aggregation([T_FUN_COUNT(*)])
  5 - output([t1.a], [t1.b], [t1.c]), filter(nil), rowset=16
      access([t1.a], [t1.b], [t1.c]), partitions(p0)
      is_index_back=false, is_global_index=false, 
      range_key([t1.a]), range(MIN ; MAX)always true
update t1 set b = b + 1 where t1.b in (select count(*) from t2 having count(*) < t1.a);
select/**/ * from t1;
a	b	c
1	1	0
2	2	1
3	3	0
4	4	1
5	5	0
6	6	1
7	7	0
8	8	1
rollback;
EXPLAIN update /*+NO_REWRITE*/t1 set b = b + 1 where t1.b in (select count(*) from t2 having count(*) < t1.a);
Query Plan
=====================================================
|ID|OPERATOR             |NAME|EST.ROWS|EST.TIME(us)|
-----------------------------------------------------
|0 |UPDATE               |    |4       |202         |
|1 |└─SUBPLAN FILTER     |    |4       |148         |
|2 |  ├─TABLE FULL SCAN  |t1  |8       |3           |
|3 |  └─SCALAR GROUP BY  |    |1       |19          |
|4 |    └─TABLE FULL SCAN|t2  |8       |18          |
=====================================================
Outputs & filters:
-------------------------------------
  0 - output(nil), filter(nil)
      table_columns([{t1: ({t1: (t1.a, t1.b, t1.c)})}]),
      update([t1.b=column_conv(INT,PS:(11,0),NULL,cast(t1.b + 1, INT(-1, 0)))])
  1 - output([t1.a], [t1.b], [t1.c]), filter([t1.b = ANY(subquery(1))]), rowset=16
      exec_params_([t1.a(:0)]), onetime_exprs_(nil), init_plan_idxs_(nil), use_batch=false
  2 - output([t1.a], [t1.b], [t1.c]), filter(nil), rowset=16
      access([t1.a], [t1.b], [t1.c]), partitions(p0)
      is_index_back=false, is_global_index=false, 
      range_key([t1.a]), range(MIN ; MAX)always true
  3 - output([T_FUN_COUNT_SUM(T_FUN_COUNT(*))]), filter([T_FUN_COUNT_SUM(T_FUN_COUNT(*)) < :0]), rowset=16
      group(nil), agg_func([T_FUN_COUNT_SUM(T_FUN_COUNT(*))])
  4 - output([T_FUN_COUNT(*)]), filter(nil), rowset=16
      access(nil), partitions(p0)
      is_index_back=false, is_global_index=false, 
      range_key([t2.a]), range(MIN ; MAX)always true, 
      pushdown_aggregation([T_FUN_COUNT(*)])
update /*+NO_REWRITE*/t1 set b = b + 1 where t1.b in (select count(*) from t2 having count(*) < t1.a);
select/**/ * from t1;
a	b	c
1	1	0
2	2	1
3	3	0
4	4	1
5	5	0
6	6	1
7	7	0
8	8	1
rollback;
EXPLAIN delete from t1 where t1.b in (select count(*) from t2 having count(*) < t1.a);
Query Plan
========================================================
|ID|OPERATOR               |NAME |EST.ROWS|EST.TIME(us)|
--------------------------------------------------------
|0 |DELETE                 |     |1       |18          |
|1 |└─HASH JOIN            |     |1       |6           |
|2 |  ├─SUBPLAN SCAN       |VIEW2|1       |3           |
|3 |  │ └─SCALAR GROUP BY  |     |1       |3           |
|4 |  │   └─TABLE FULL SCAN|t2   |8       |3           |
|5 |  └─TABLE FULL SCAN    |t1   |8       |3           |
========================================================
Outputs & filters:
-------------------------------------
  0 - output(nil), filter(nil)
      table_columns([{t1: ({t1: (t1.a, t1.b, t1.c)}), hash_distinct}])
  1 - output([t1.a], [t1.b], [t1.c]), filter(nil), rowset=16
      equal_conds([t1.b = VIEW2.VIEW1.T_FUN_COUNT(*)]), other_conds([VIEW2.VIEW1.T_FUN_COUNT(*) < t1.a])
  2 - output([VIEW2.VIEW1.T_FUN_COUNT(*)], [VIEW2.VIEW1.T_FUN_COUNT(*)]), filter(nil), rowset=16
      access([VIEW2.VIEW1.T_FUN_COUNT(*)], [VIEW2.VIEW1.T_FUN_COUNT(*)])
  3 - output([T_FUN_COUNT_SUM(T_FUN_COUNT(*))], [T_FUN_COUNT_SUM(T_FUN_COUNT(*))]), filter(nil), rowset=16
      group(nil), agg_func([T_FUN_COUNT_SUM(T_FUN_COUNT(*))])
  4 - output([T_FUN_COUNT(*)]), filter(nil), rowset=16
      access(nil), partitions(p0)
      is_index_back=false, is_global_index=false, 
      range_key([t2.a]), range(MIN ; MAX)always true, 
      pushdown_aggregation([T_FUN_COUNT(*)])
  5 - output([t1.a], [t1.b], [t1.c]), filter(nil), rowset=16
      access([t1.a], [t1.b], [t1.c]), partitions(p0)
      is_index_back=false, is_global_index=false, 
      range_key([t1.a]), range(MIN ; MAX)always true
delete from t1 where t1.b in (select count(*) from t2 having count(*) < t1.a);
select/**/ * from t1;
a	b	c
1	1	0
2	2	1
3	3	0
4	4	1
5	5	0
6	6	1
7	7	0
8	8	1
rollback;
EXPLAIN delete /*+NO_REWRITE*/from t1 where t1.b in (select count(*) from t2 having count(*) < t1.a);
Query Plan
=====================================================
|ID|OPERATOR             |NAME|EST.ROWS|EST.TIME(us)|
-----------------------------------------------------
|0 |DELETE               |    |4       |174         |
|1 |└─SUBPLAN FILTER     |    |4       |148         |
|2 |  ├─TABLE FULL SCAN  |t1  |8       |3           |
|3 |  └─SCALAR GROUP BY  |    |1       |19          |
|4 |    └─TABLE FULL SCAN|t2  |8       |18          |
=====================================================
Outputs & filters:
-------------------------------------
  0 - output(nil), filter(nil)
      table_columns([{t1: ({t1: (t1.a, t1.b, t1.c)})}])
  1 - output([t1.a], [t1.b], [t1.c]), filter([t1.b = ANY(subquery(1))]), rowset=16
      exec_params_([t1.a(:0)]), onetime_exprs_(nil), init_plan_idxs_(nil), use_batch=false
  2 - output([t1.a], [t1.b], [t1.c]), filter(nil), rowset=16
      access([t1.a], [t1.b], [t1.c]), partitions(p0)
      is_index_back=false, is_global_index=false, 
      range_key([t1.a]), range(MIN ; MAX)always true
  3 - output([T_FUN_COUNT_SUM(T_FUN_COUNT(*))]), filter([T_FUN_COUNT_SUM(T_FUN_COUNT(*)) < :0]), rowset=16
      group(nil), agg_func([T_FUN_COUNT_SUM(T_FUN_COUNT(*))])
  4 - output([T_FUN_COUNT(*)]), filter(nil), rowset=16
      access(nil), partitions(p0)
      is_index_back=false, is_global_index=false, 
      range_key([t2.a]), range(MIN ; MAX)always true, 
      pushdown_aggregation([T_FUN_COUNT(*)])
delete /*+NO_REWRITE*/from t1 where t1.b in (select count(*) from t2 having count(*) < t1.a);
select/**/ * from t1;
a	b	c
1	1	0
2	2	1
3	3	0
4	4	1
5	5	0
6	6	1
7	7	0
8	8	1
rollback;
EXPLAIN insert into is_c3 select * from t1 where t1.b in (select count(*) from t2 having count(*) < t1.a);
Query Plan
====================================================================
|ID|OPERATOR                 |NAME           |EST.ROWS|EST.TIME(us)|
--------------------------------------------------------------------
|0 |INSERT                   |               |1       |19          |
|1 |└─SUBPLAN SCAN           |ANONYMOUS_VIEW1|1       |6           |
|2 |  └─HASH JOIN            |               |1       |6           |
|3 |    ├─SUBPLAN SCAN       |VIEW2          |1       |3           |
|4 |    │ └─SCALAR GROUP BY  |               |1       |3           |
|5 |    │   └─TABLE FULL SCAN|t2             |8       |3           |
|6 |    └─TABLE FULL SCAN    |t1             |8       |3           |
====================================================================
Outputs & filters:
-------------------------------------
  0 - output(nil), filter(nil)
      columns([{is_c3: ({is_c3: (is_c3.__pk_increment, is_c3.a, is_c3.b, is_c3.c)})}]), partitions(p0), 
      column_values([T_HIDDEN_PK], [column_conv(INT,PS:(11,0),NULL,ANONYMOUS_VIEW1.a)], [column_conv(INT,PS:(11,0),NULL,ANONYMOUS_VIEW1.b)], [column_conv(INT,
      PS:(11,0),NULL,ANONYMOUS_VIEW1.c)])
  1 - output([ANONYMOUS_VIEW1.a], [ANONYMOUS_VIEW1.b], [ANONYMOUS_VIEW1.c]), filter(nil), rowset=16
      access([ANONYMOUS_VIEW1.a], [ANONYMOUS_VIEW1.b], [ANONYMOUS_VIEW1.c])
  2 - output([t1.a], [t1.b], [t1.c]), filter(nil), rowset=16
      equal_conds([t1.b = VIEW2.VIEW1.T_FUN_COUNT(*)]), other_conds([VIEW2.VIEW1.T_FUN_COUNT(*) < t1.a])
  3 - output([VIEW2.VIEW1.T_FUN_COUNT(*)], [VIEW2.VIEW1.T_FUN_COUNT(*)]), filter(nil), rowset=16
      access([VIEW2.VIEW1.T_FUN_COUNT(*)], [VIEW2.VIEW1.T_FUN_COUNT(*)])
  4 - output([T_FUN_COUNT_SUM(T_FUN_COUNT(*))], [T_FUN_COUNT_SUM(T_FUN_COUNT(*))]), filter(nil), rowset=16
      group(nil), agg_func([T_FUN_COUNT_SUM(T_FUN_COUNT(*))])
  5 - output([T_FUN_COUNT(*)]), filter(nil), rowset=16
      access(nil), partitions(p0)
      is_index_back=false, is_global_index=false, 
      range_key([t2.a]), range(MIN ; MAX)always true, 
      pushdown_aggregation([T_FUN_COUNT(*)])
  6 - output([t1.a], [t1.b], [t1.c]), filter(nil), rowset=16
      access([t1.a], [t1.b], [t1.c]), partitions(p0)
      is_index_back=false, is_global_index=false, 
      range_key([t1.a]), range(MIN ; MAX)always true
insert into is_c3 select * from t1 where t1.b in (select count(*) from t2 having count(*) < t1.a);
select/**/ * from is_c3;
a	b	c
rollback;
EXPLAIN insert into is_c3 select /*+NO_REWRITE*/* from t1 where t1.b in (select count(*) from t2 having count(*) < t1.a);
Query Plan
==================================================================
|ID|OPERATOR               |NAME           |EST.ROWS|EST.TIME(us)|
------------------------------------------------------------------
|0 |INSERT                 |               |4       |180         |
|1 |└─SUBPLAN SCAN         |ANONYMOUS_VIEW1|4       |148         |
|2 |  └─SUBPLAN FILTER     |               |4       |148         |
|3 |    ├─TABLE FULL SCAN  |t1             |8       |3           |
|4 |    └─SCALAR GROUP BY  |               |1       |19          |
|5 |      └─TABLE FULL SCAN|t2             |8       |18          |
==================================================================
Outputs & filters:
-------------------------------------
  0 - output(nil), filter(nil)
      columns([{is_c3: ({is_c3: (is_c3.__pk_increment, is_c3.a, is_c3.b, is_c3.c)})}]), partitions(p0), 
      column_values([T_HIDDEN_PK], [column_conv(INT,PS:(11,0),NULL,ANONYMOUS_VIEW1.a)], [column_conv(INT,PS:(11,0),NULL,ANONYMOUS_VIEW1.b)], [column_conv(INT,
      PS:(11,0),NULL,ANONYMOUS_VIEW1.c)])
  1 - output([ANONYMOUS_VIEW1.a], [ANONYMOUS_VIEW1.b], [ANONYMOUS_VIEW1.c]), filter(nil), rowset=16
      access([ANONYMOUS_VIEW1.a], [ANONYMOUS_VIEW1.b], [ANONYMOUS_VIEW1.c])
  2 - output([t1.a], [t1.b], [t1.c]), filter([t1.b = ANY(subquery(1))]), rowset=16
      exec_params_([t1.a(:0)]), onetime_exprs_(nil), init_plan_idxs_(nil), use_batch=false
  3 - output([t1.a], [t1.b], [t1.c]), filter(nil), rowset=16
      access([t1.a], [t1.b], [t1.c]), partitions(p0)
      is_index_back=false, is_global_index=false, 
      range_key([t1.a]), range(MIN ; MAX)always true
  4 - output([T_FUN_COUNT_SUM(T_FUN_COUNT(*))]), filter([T_FUN_COUNT_SUM(T_FUN_COUNT(*)) < :0]), rowset=16
      group(nil), agg_func([T_FUN_COUNT_SUM(T_FUN_COUNT(*))])
  5 - output([T_FUN_COUNT(*)]), filter(nil), rowset=16
      access(nil), partitions(p0)
      is_index_back=false, is_global_index=false, 
      range_key([t2.a]), range(MIN ; MAX)always true, 
      pushdown_aggregation([T_FUN_COUNT(*)])
insert into is_c3 select /*+NO_REWRITE*/* from t1 where t1.b in (select count(*) from t2 having count(*) < t1.a);
select/**/ * from is_c3;
a	b	c
rollback;


# case 81
EXPLAIN select * from t1 where t1.b in (select count(*) from t2 where exists (select * from t2 v where v.a = t1.a));
Query Plan
=====================================================
|ID|OPERATOR             |NAME|EST.ROWS|EST.TIME(us)|
-----------------------------------------------------
|0 |SUBPLAN FILTER       |    |8       |291         |
|1 |├─TABLE FULL SCAN    |t1  |8       |3           |
|2 |└─SCALAR GROUP BY    |    |1       |37          |
|3 |  └─SUBPLAN FILTER   |    |8       |36          |
|4 |    ├─TABLE FULL SCAN|t2  |8       |18          |
|5 |    └─TABLE GET      |v   |1       |18          |
=====================================================
Outputs & filters:
-------------------------------------
  0 - output([t1.a], [t1.b], [t1.c]), filter([t1.b = subquery(1)]), rowset=16
      exec_params_([t1.a(:0)]), onetime_exprs_(nil), init_plan_idxs_(nil), use_batch=false
  1 - output([t1.a], [t1.b], [t1.c]), filter(nil), rowset=16
      access([t1.a], [t1.b], [t1.c]), partitions(p0)
      is_index_back=false, is_global_index=false, 
      range_key([t1.a]), range(MIN ; MAX)always true
  2 - output([T_FUN_COUNT(*)]), filter(nil), rowset=16
      group(nil), agg_func([T_FUN_COUNT(*)])
  3 - output(nil), filter(nil), rowset=16
      exec_params_(nil), onetime_exprs_([(T_OP_EXISTS, subquery(1))(:1)]), init_plan_idxs_(nil), use_batch=false
  4 - output(nil), filter(nil), startup_filter([:1]), rowset=16
      access(nil), partitions(p0)
      is_index_back=false, is_global_index=false, 
      range_key([t2.a]), range(MIN ; MAX)always true
  5 - output([1]), filter(nil), rowset=16
      access(nil), partitions(p0)
      limit(1), offset(nil), is_index_back=false, is_global_index=false, 
      range_key([v.a]), range(MIN ; MAX)always true, 
      range_cond([v.a = :0])
select * from t1 where t1.b in (select count(*) from t2 where exists (select * from t2 v where v.a = t1.a));
a	b	c
8	8	1
EXPLAIN select /*+NO_REWRITE*/* from t1 where t1.b in (select count(*) from t2 where exists (select * from t2 v where v.a = t1.a));
Query Plan
=====================================================
|ID|OPERATOR             |NAME|EST.ROWS|EST.TIME(us)|
-----------------------------------------------------
|0 |SUBPLAN FILTER       |    |4       |291         |
|1 |├─TABLE FULL SCAN    |t1  |8       |3           |
|2 |└─SCALAR GROUP BY    |    |1       |37          |
|3 |  └─SUBPLAN FILTER   |    |8       |36          |
|4 |    ├─TABLE FULL SCAN|t2  |8       |18          |
|5 |    └─TABLE GET      |v   |1       |18          |
=====================================================
Outputs & filters:
-------------------------------------
  0 - output([t1.a], [t1.b], [t1.c]), filter([t1.b = ANY(subquery(1))]), rowset=16
      exec_params_([t1.a(:0)]), onetime_exprs_(nil), init_plan_idxs_(nil), use_batch=false
  1 - output([t1.a], [t1.b], [t1.c]), filter(nil), rowset=16
      access([t1.a], [t1.b], [t1.c]), partitions(p0)
      is_index_back=false, is_global_index=false, 
      range_key([t1.a]), range(MIN ; MAX)always true
  2 - output([T_FUN_COUNT(*)]), filter(nil), rowset=16
      group(nil), agg_func([T_FUN_COUNT(*)])
  3 - output(nil), filter(nil), rowset=16
      exec_params_(nil), onetime_exprs_([(T_OP_EXISTS, subquery(1))(:1)]), init_plan_idxs_(nil), use_batch=false
  4 - output(nil), filter(nil), startup_filter([:1]), rowset=16
      access(nil), partitions(p0)
      is_index_back=false, is_global_index=false, 
      range_key([t2.a]), range(MIN ; MAX)always true
  5 - output([1]), filter(nil), rowset=16
      access(nil), partitions(p0)
      limit(1), offset(nil), is_index_back=false, is_global_index=false, 
      range_key([v.a]), range(MIN ; MAX)always true, 
      range_cond([v.a = :0])
select /*+NO_REWRITE*/* from t1 where t1.b in (select count(*) from t2 where exists (select * from t2 v where v.a = t1.a));
a	b	c
8	8	1
EXPLAIN update t1 set b = b + 1 where t1.b in (select count(*) from t2 where exists (select * from t2 v where v.a = t1.a));
Query Plan
=======================================================
|ID|OPERATOR               |NAME|EST.ROWS|EST.TIME(us)|
-------------------------------------------------------
|0 |UPDATE                 |    |8       |376         |
|1 |└─SUBPLAN FILTER       |    |8       |291         |
|2 |  ├─TABLE FULL SCAN    |t1  |8       |3           |
|3 |  └─SCALAR GROUP BY    |    |1       |37          |
|4 |    └─SUBPLAN FILTER   |    |8       |36          |
|5 |      ├─TABLE FULL SCAN|t2  |8       |18          |
|6 |      └─TABLE GET      |v   |1       |18          |
=======================================================
Outputs & filters:
-------------------------------------
  0 - output(nil), filter(nil)
      table_columns([{t1: ({t1: (t1.a, t1.b, t1.c)})}]),
      update([t1.b=column_conv(INT,PS:(11,0),NULL,cast(t1.b + 1, INT(-1, 0)))])
  1 - output([t1.a], [t1.b], [t1.c]), filter([t1.b = subquery(1)]), rowset=16
      exec_params_([t1.a(:0)]), onetime_exprs_(nil), init_plan_idxs_(nil), use_batch=false
  2 - output([t1.a], [t1.b], [t1.c]), filter(nil), rowset=16
      access([t1.a], [t1.b], [t1.c]), partitions(p0)
      is_index_back=false, is_global_index=false, 
      range_key([t1.a]), range(MIN ; MAX)always true
  3 - output([T_FUN_COUNT(*)]), filter(nil), rowset=16
      group(nil), agg_func([T_FUN_COUNT(*)])
  4 - output(nil), filter(nil), rowset=16
      exec_params_(nil), onetime_exprs_([(T_OP_EXISTS, subquery(1))(:1)]), init_plan_idxs_(nil), use_batch=false
  5 - output(nil), filter(nil), startup_filter([:1]), rowset=16
      access(nil), partitions(p0)
      is_index_back=false, is_global_index=false, 
      range_key([t2.a]), range(MIN ; MAX)always true
  6 - output([1]), filter(nil), rowset=16
      access(nil), partitions(p0)
      limit(1), offset(nil), is_index_back=false, is_global_index=false, 
      range_key([v.a]), range(MIN ; MAX)always true, 
      range_cond([v.a = :0])
update t1 set b = b + 1 where t1.b in (select count(*) from t2 where exists (select * from t2 v where v.a = t1.a));
select/**/ * from t1;
a	b	c
1	1	0
2	2	1
3	3	0
4	4	1
5	5	0
6	6	1
7	7	0
8	9	1
rollback;
EXPLAIN update /*+NO_REWRITE*/t1 set b = b + 1 where t1.b in (select count(*) from t2 where exists (select * from t2 v where v.a = t1.a));
Query Plan
=======================================================
|ID|OPERATOR               |NAME|EST.ROWS|EST.TIME(us)|
-------------------------------------------------------
|0 |UPDATE                 |    |4       |345         |
|1 |└─SUBPLAN FILTER       |    |4       |291         |
|2 |  ├─TABLE FULL SCAN    |t1  |8       |3           |
|3 |  └─SCALAR GROUP BY    |    |1       |37          |
|4 |    └─SUBPLAN FILTER   |    |8       |36          |
|5 |      ├─TABLE FULL SCAN|t2  |8       |18          |
|6 |      └─TABLE GET      |v   |1       |18          |
=======================================================
Outputs & filters:
-------------------------------------
  0 - output(nil), filter(nil)
      table_columns([{t1: ({t1: (t1.a, t1.b, t1.c)})}]),
      update([t1.b=column_conv(INT,PS:(11,0),NULL,cast(t1.b + 1, INT(-1, 0)))])
  1 - output([t1.a], [t1.b], [t1.c]), filter([t1.b = ANY(subquery(1))]), rowset=16
      exec_params_([t1.a(:0)]), onetime_exprs_(nil), init_plan_idxs_(nil), use_batch=false
  2 - output([t1.a], [t1.b], [t1.c]), filter(nil), rowset=16
      access([t1.a], [t1.b], [t1.c]), partitions(p0)
      is_index_back=false, is_global_index=false, 
      range_key([t1.a]), range(MIN ; MAX)always true
  3 - output([T_FUN_COUNT(*)]), filter(nil), rowset=16
      group(nil), agg_func([T_FUN_COUNT(*)])
  4 - output(nil), filter(nil), rowset=16
      exec_params_(nil), onetime_exprs_([(T_OP_EXISTS, subquery(1))(:1)]), init_plan_idxs_(nil), use_batch=false
  5 - output(nil), filter(nil), startup_filter([:1]), rowset=16
      access(nil), partitions(p0)
      is_index_back=false, is_global_index=false, 
      range_key([t2.a]), range(MIN ; MAX)always true
  6 - output([1]), filter(nil), rowset=16
      access(nil), partitions(p0)
      limit(1), offset(nil), is_index_back=false, is_global_index=false, 
      range_key([v.a]), range(MIN ; MAX)always true, 
      range_cond([v.a = :0])
update /*+NO_REWRITE*/t1 set b = b + 1 where t1.b in (select count(*) from t2 where exists (select * from t2 v where v.a = t1.a));
select/**/ * from t1;
a	b	c
1	1	0
2	2	1
3	3	0
4	4	1
5	5	0
6	6	1
7	7	0
8	9	1
rollback;
EXPLAIN delete rom t1 where t1.b in (select count(*) from t2 where exists (select * from t2 v where v.a = t1.a));
ERROR 42000: You have an error in your SQL syntax; check the manual that corresponds to your OceanBase version for the right syntax to use near 't1 where t1.b in (select count(*) from t2 where exists (select * from t2 v where' at line 1
delete rom t1 where t1.b in (select count(*) from t2 where exists (select * from t2 v where v.a = t1.a));
ERROR 42000: You have an error in your SQL syntax; check the manual that corresponds to your OceanBase version for the right syntax to use near 't1 where t1.b in (select count(*) from t2 where exists (select * from t2 v where' at line 1
select/**/ * from t1;
a	b	c
1	1	0
2	2	1
3	3	0
4	4	1
5	5	0
6	6	1
7	7	0
8	8	1
rollback;
EXPLAIN delete /*+NO_REWRITE*/from t1 where t1.b in (select count(*) from t2 where exists (select * from t2 v where v.a = t1.a));
Query Plan
=======================================================
|ID|OPERATOR               |NAME|EST.ROWS|EST.TIME(us)|
-------------------------------------------------------
|0 |DELETE                 |    |4       |318         |
|1 |└─SUBPLAN FILTER       |    |4       |291         |
|2 |  ├─TABLE FULL SCAN    |t1  |8       |3           |
|3 |  └─SCALAR GROUP BY    |    |1       |37          |
|4 |    └─SUBPLAN FILTER   |    |8       |36          |
|5 |      ├─TABLE FULL SCAN|t2  |8       |18          |
|6 |      └─TABLE GET      |v   |1       |18          |
=======================================================
Outputs & filters:
-------------------------------------
  0 - output(nil), filter(nil)
      table_columns([{t1: ({t1: (t1.a, t1.b, t1.c)})}])
  1 - output([t1.a], [t1.b], [t1.c]), filter([t1.b = ANY(subquery(1))]), rowset=16
      exec_params_([t1.a(:0)]), onetime_exprs_(nil), init_plan_idxs_(nil), use_batch=false
  2 - output([t1.a], [t1.b], [t1.c]), filter(nil), rowset=16
      access([t1.a], [t1.b], [t1.c]), partitions(p0)
      is_index_back=false, is_global_index=false, 
      range_key([t1.a]), range(MIN ; MAX)always true
  3 - output([T_FUN_COUNT(*)]), filter(nil), rowset=16
      group(nil), agg_func([T_FUN_COUNT(*)])
  4 - output(nil), filter(nil), rowset=16
      exec_params_(nil), onetime_exprs_([(T_OP_EXISTS, subquery(1))(:1)]), init_plan_idxs_(nil), use_batch=false
  5 - output(nil), filter(nil), startup_filter([:1]), rowset=16
      access(nil), partitions(p0)
      is_index_back=false, is_global_index=false, 
      range_key([t2.a]), range(MIN ; MAX)always true
  6 - output([1]), filter(nil), rowset=16
      access(nil), partitions(p0)
      limit(1), offset(nil), is_index_back=false, is_global_index=false, 
      range_key([v.a]), range(MIN ; MAX)always true, 
      range_cond([v.a = :0])
delete /*+NO_REWRITE*/from t1 where t1.b in (select count(*) from t2 where exists (select * from t2 v where v.a = t1.a));
select/**/ * from t1;
a	b	c
1	1	0
2	2	1
3	3	0
4	4	1
5	5	0
6	6	1
7	7	0
rollback;
EXPLAIN insert into is_c3 select * from t1 where t1.b in (select count(*) from t2 where exists (select * from t2 v where v.a = t1.a));
Query Plan
====================================================================
|ID|OPERATOR                 |NAME           |EST.ROWS|EST.TIME(us)|
--------------------------------------------------------------------
|0 |INSERT                   |               |8       |349         |
|1 |└─SUBPLAN SCAN           |ANONYMOUS_VIEW1|8       |291         |
|2 |  └─SUBPLAN FILTER       |               |8       |291         |
|3 |    ├─TABLE FULL SCAN    |t1             |8       |3           |
|4 |    └─SCALAR GROUP BY    |               |1       |37          |
|5 |      └─SUBPLAN FILTER   |               |8       |36          |
|6 |        ├─TABLE FULL SCAN|t2             |8       |18          |
|7 |        └─TABLE GET      |v              |1       |18          |
====================================================================
Outputs & filters:
-------------------------------------
  0 - output(nil), filter(nil)
      columns([{is_c3: ({is_c3: (is_c3.__pk_increment, is_c3.a, is_c3.b, is_c3.c)})}]), partitions(p0), 
      column_values([T_HIDDEN_PK], [column_conv(INT,PS:(11,0),NULL,ANONYMOUS_VIEW1.a)], [column_conv(INT,PS:(11,0),NULL,ANONYMOUS_VIEW1.b)], [column_conv(INT,
      PS:(11,0),NULL,ANONYMOUS_VIEW1.c)])
  1 - output([ANONYMOUS_VIEW1.a], [ANONYMOUS_VIEW1.b], [ANONYMOUS_VIEW1.c]), filter(nil), rowset=16
      access([ANONYMOUS_VIEW1.a], [ANONYMOUS_VIEW1.b], [ANONYMOUS_VIEW1.c])
  2 - output([t1.a], [t1.b], [t1.c]), filter([t1.b = subquery(1)]), rowset=16
      exec_params_([t1.a(:0)]), onetime_exprs_(nil), init_plan_idxs_(nil), use_batch=false
  3 - output([t1.a], [t1.b], [t1.c]), filter(nil), rowset=16
      access([t1.a], [t1.b], [t1.c]), partitions(p0)
      is_index_back=false, is_global_index=false, 
      range_key([t1.a]), range(MIN ; MAX)always true
  4 - output([T_FUN_COUNT(*)]), filter(nil), rowset=16
      group(nil), agg_func([T_FUN_COUNT(*)])
  5 - output(nil), filter(nil), rowset=16
      exec_params_(nil), onetime_exprs_([(T_OP_EXISTS, subquery(1))(:1)]), init_plan_idxs_(nil), use_batch=false
  6 - output(nil), filter(nil), startup_filter([:1]), rowset=16
      access(nil), partitions(p0)
      is_index_back=false, is_global_index=false, 
      range_key([t2.a]), range(MIN ; MAX)always true
  7 - output([1]), filter(nil), rowset=16
      access(nil), partitions(p0)
      limit(1), offset(nil), is_index_back=false, is_global_index=false, 
      range_key([v.a]), range(MIN ; MAX)always true, 
      range_cond([v.a = :0])
insert into is_c3 select * from t1 where t1.b in (select count(*) from t2 where exists (select * from t2 v where v.a = t1.a));
select/**/ * from is_c3;
a	b	c
8	8	1
rollback;
EXPLAIN insert into is_c3 select /*+NO_REWRITE*/* from t1 where t1.b in (select count(*) from t2 where exists (select * from t2 v where v.a = t1.a));
Query Plan
====================================================================
|ID|OPERATOR                 |NAME           |EST.ROWS|EST.TIME(us)|
--------------------------------------------------------------------
|0 |INSERT                   |               |4       |323         |
|1 |└─SUBPLAN SCAN           |ANONYMOUS_VIEW1|4       |291         |
|2 |  └─SUBPLAN FILTER       |               |4       |291         |
|3 |    ├─TABLE FULL SCAN    |t1             |8       |3           |
|4 |    └─SCALAR GROUP BY    |               |1       |37          |
|5 |      └─SUBPLAN FILTER   |               |8       |36          |
|6 |        ├─TABLE FULL SCAN|t2             |8       |18          |
|7 |        └─TABLE GET      |v              |1       |18          |
====================================================================
Outputs & filters:
-------------------------------------
  0 - output(nil), filter(nil)
      columns([{is_c3: ({is_c3: (is_c3.__pk_increment, is_c3.a, is_c3.b, is_c3.c)})}]), partitions(p0), 
      column_values([T_HIDDEN_PK], [column_conv(INT,PS:(11,0),NULL,ANONYMOUS_VIEW1.a)], [column_conv(INT,PS:(11,0),NULL,ANONYMOUS_VIEW1.b)], [column_conv(INT,
      PS:(11,0),NULL,ANONYMOUS_VIEW1.c)])
  1 - output([ANONYMOUS_VIEW1.a], [ANONYMOUS_VIEW1.b], [ANONYMOUS_VIEW1.c]), filter(nil), rowset=16
      access([ANONYMOUS_VIEW1.a], [ANONYMOUS_VIEW1.b], [ANONYMOUS_VIEW1.c])
  2 - output([t1.a], [t1.b], [t1.c]), filter([t1.b = ANY(subquery(1))]), rowset=16
      exec_params_([t1.a(:0)]), onetime_exprs_(nil), init_plan_idxs_(nil), use_batch=false
  3 - output([t1.a], [t1.b], [t1.c]), filter(nil), rowset=16
      access([t1.a], [t1.b], [t1.c]), partitions(p0)
      is_index_back=false, is_global_index=false, 
      range_key([t1.a]), range(MIN ; MAX)always true
  4 - output([T_FUN_COUNT(*)]), filter(nil), rowset=16
      group(nil), agg_func([T_FUN_COUNT(*)])
  5 - output(nil), filter(nil), rowset=16
      exec_params_(nil), onetime_exprs_([(T_OP_EXISTS, subquery(1))(:1)]), init_plan_idxs_(nil), use_batch=false
  6 - output(nil), filter(nil), startup_filter([:1]), rowset=16
      access(nil), partitions(p0)
      is_index_back=false, is_global_index=false, 
      range_key([t2.a]), range(MIN ; MAX)always true
  7 - output([1]), filter(nil), rowset=16
      access(nil), partitions(p0)
      limit(1), offset(nil), is_index_back=false, is_global_index=false, 
      range_key([v.a]), range(MIN ; MAX)always true, 
      range_cond([v.a = :0])
insert into is_c3 select /*+NO_REWRITE*/* from t1 where t1.b in (select count(*) from t2 where exists (select * from t2 v where v.a = t1.a));
select/**/ * from is_c3;
a	b	c
8	8	1
rollback;

set autocommit = 1;
drop table t1, t2, t3, t4, t5, t6, t7, is_c1, is_c3;

USE DB_ANY_ALL;
drop database DB_ANY_ALL;
