ob1=OBI(cluster=2:2:2,proxy_num=0);
ob1.z1.obs0.set extra_config=$extra_conf;
ob1.z2.obs0.set extra_config=$extra_conf;
ob1.z3.obs0.set extra_config=$extra_conf;
ob1.z1.obs1.set extra_config=$extra_conf;
ob1.z2.obs1.set extra_config=$extra_conf;
ob1.z3.obs1.set extra_config=$extra_conf;
===============================================================
====================     bootstrap   ==========================
===============================================================
test case for bootstrap begin
ob1.reboot;
ob1.mysql alter system set enable_rebalance='false';
test case for bootstrap finish
===============================================================
==================     create tenant   ========================
===============================================================
set @@session.ob_query_timeout = 1000000000;
CREATE RESOURCE UNIT if not exists unit_1 MAX_CPU 2, MEMORY_SIZE='2G';
CREATE RESOURCE POOL if not exists pool_1 UNIT = 'unit_1', UNIT_NUM = 1;
CREATE TENANT mysql RESOURCE_POOL_LIST = ('pool_1'), primary_zone='z1', locality='F@z1, F@z2, F@z3' set ob_tcp_invited_nodes='%';
ob1.check_until_timeout select count(*) as cnt from oceanbase.__all_virtual_server_schema_info as a join oceanbase.__all_virtual_server_schema_info as b on a.tenant_id = b.tenant_id  where a.refreshed_schema_version != b.refreshed_schema_version, 0, 60;
ob1.mysql alter system set _transfer_start_trans_timeout = '10s' tenant = 'mysql';
===============================================================
==============     prepare transfer data   ====================
===============================================================
create table if not exists t_part(pk int primary key, c1 longtext) partition by hash(pk) partitions 6;
create index if not exists idx_t_part on t_part(pk);
insert into t_part values (1, 1), (2,2), (3,3), (4,4), (5,5), (6,6), (7,7), (8,8), (9,9), (0,0), (11, 1), (12,2);
create table if not exists t_subpart(c0 int, c1 int, c2 longtext, primary key (c0, c1)) partition by hash(c0) subpartition by hash(c1) subpartitions 3 partitions 2;
create index if not exists idx_t_subpart on t_subpart(c0, c1);
insert into t_subpart (c0, c1) values (1, 1), (2,2), (3,3), (4,4), (5,5), (6,6), (7,7), (8,8), (9,9), (0,0), (11, 1), (12,2);
create table if not exists t_nopart_1(c1 int);
create table if not exists t_nopart_2(c1 int);
create table if not exists t_nopart_3(c1 int);
create table if not exists t_nopart_4(c1 int);
create table if not exists t_nopart_5(c1 int);
create table if not exists t_nopart_6(c1 int);
insert into t_nopart_1 values (0);
insert into t_nopart_2 values (0);
insert into t_nopart_3 values (0);
insert into t_nopart_4 values (0);
insert into t_nopart_5 values (0);
insert into t_nopart_6 values (0);
SELECT TABLE_ID, TABLE_NAME, PARTITION_NAME, SUBPARTITION_NAME, TABLET_ID, LS_ID FROM oceanbase.DBA_OB_TABLE_LOCATIONS WHERE TABLE_ID >= 500000 AND ROLE = 'LEADER';
TABLE_ID	TABLE_NAME	PARTITION_NAME	SUBPARTITION_NAME	TABLET_ID	LS_ID
500002	t_part	p0	NULL	200001	1001
500002	t_part	p1	NULL	200002	1001
500002	t_part	p2	NULL	200003	1001
500002	t_part	p3	NULL	200004	1001
500002	t_part	p4	NULL	200005	1001
500002	t_part	p5	NULL	200006	1001
500003	__AUX_LOB_META_500003_	p0	NULL	1152921504606846977	1001
500003	__AUX_LOB_META_500003_	p1	NULL	1152921504606846978	1001
500003	__AUX_LOB_META_500003_	p2	NULL	1152921504606846979	1001
500003	__AUX_LOB_META_500003_	p3	NULL	1152921504606846980	1001
500003	__AUX_LOB_META_500003_	p4	NULL	1152921504606846981	1001
500003	__AUX_LOB_META_500003_	p5	NULL	1152921504606846982	1001
500004	__AUX_LOB_PIECE_500004_	p0	NULL	1152921504606846983	1001
500004	__AUX_LOB_PIECE_500004_	p1	NULL	1152921504606846984	1001
500004	__AUX_LOB_PIECE_500004_	p2	NULL	1152921504606846985	1001
500004	__AUX_LOB_PIECE_500004_	p3	NULL	1152921504606846986	1001
500004	__AUX_LOB_PIECE_500004_	p4	NULL	1152921504606846987	1001
500004	__AUX_LOB_PIECE_500004_	p5	NULL	1152921504606846988	1001
500029	__idx_500002_idx_t_part	p0	NULL	1152921504606846989	1001
500029	__idx_500002_idx_t_part	p1	NULL	1152921504606846990	1001
500029	__idx_500002_idx_t_part	p2	NULL	1152921504606846991	1001
500029	__idx_500002_idx_t_part	p3	NULL	1152921504606846992	1001
500029	__idx_500002_idx_t_part	p4	NULL	1152921504606846993	1001
500029	__idx_500002_idx_t_part	p5	NULL	1152921504606846994	1001
500030	t_subpart	p0	p0sp0	200007	1001
500030	t_subpart	p0	p0sp1	200008	1001
500030	t_subpart	p0	p0sp2	200009	1001
500030	t_subpart	p1	p1sp0	200010	1001
500030	t_subpart	p1	p1sp1	200011	1001
500030	t_subpart	p1	p1sp2	200012	1001
500031	__AUX_LOB_META_500031_	p0	p0sp0	1152921504606846995	1001
500031	__AUX_LOB_META_500031_	p0	p0sp1	1152921504606846996	1001
500031	__AUX_LOB_META_500031_	p0	p0sp2	1152921504606846997	1001
500031	__AUX_LOB_META_500031_	p1	p1sp0	1152921504606846998	1001
500031	__AUX_LOB_META_500031_	p1	p1sp1	1152921504606846999	1001
500031	__AUX_LOB_META_500031_	p1	p1sp2	1152921504606847000	1001
500032	__AUX_LOB_PIECE_500032_	p0	p0sp0	1152921504606847001	1001
500032	__AUX_LOB_PIECE_500032_	p0	p0sp1	1152921504606847002	1001
500032	__AUX_LOB_PIECE_500032_	p0	p0sp2	1152921504606847003	1001
500032	__AUX_LOB_PIECE_500032_	p1	p1sp0	1152921504606847004	1001
500032	__AUX_LOB_PIECE_500032_	p1	p1sp1	1152921504606847005	1001
500032	__AUX_LOB_PIECE_500032_	p1	p1sp2	1152921504606847006	1001
500065	__idx_500030_idx_t_subpart	p0	p0sp0	1152921504606847007	1001
500065	__idx_500030_idx_t_subpart	p0	p0sp1	1152921504606847008	1001
500065	__idx_500030_idx_t_subpart	p0	p0sp2	1152921504606847009	1001
500065	__idx_500030_idx_t_subpart	p1	p1sp0	1152921504606847010	1001
500065	__idx_500030_idx_t_subpart	p1	p1sp1	1152921504606847011	1001
500065	__idx_500030_idx_t_subpart	p1	p1sp2	1152921504606847012	1001
500066	t_nopart_1	NULL	NULL	200013	1001
500067	t_nopart_2	NULL	NULL	200014	1001
500068	t_nopart_3	NULL	NULL	200015	1001
500069	t_nopart_4	NULL	NULL	200016	1001
500070	t_nopart_5	NULL	NULL	200017	1001
500071	t_nopart_6	NULL	NULL	200018	1001
SELECT LS_ID, STATUS, PRIMARY_ZONE FROM oceanbase.DBA_OB_LS;
LS_ID	STATUS	PRIMARY_ZONE
1	NORMAL	z1;z2,z3
1001	NORMAL	z1;z2,z3
===============================================================
==============  unit num from 1 to 2   ====================
===============================================================
ALTER RESOURCE TENANT mysql UNIT_NUM = 2;
===============================================================
================     verify transfer    =======================
===============================================================
ob1.check_until_timeout select count(*) from oceanbase.__all_virtual_balance_job_history where tenant_id = $mysql_tenant_id, 1, 300;
ob1.check_until_timeout select count(*) from oceanbase.__all_virtual_balance_job where tenant_id = $mysql_tenant_id, 0, 60;
ob1.check_until_timeout select count(*) from oceanbase.CDB_OB_LS where tenant_id = $mysql_tenant_id and status != 'NORMAL', 0, 100;
SELECT LS_ID, STATUS, PRIMARY_ZONE FROM oceanbase.DBA_OB_LS;
LS_ID	STATUS	PRIMARY_ZONE
1	NORMAL	z1;z2,z3
1001	NORMAL	z1;z2,z3
1002	NORMAL	z1;z2,z3
SELECT DISTINCT TABLE_ID, TABLE_NAME, PARTITION_NAME, TABLET_ID, LS_ID FROM oceanbase.DBA_OB_TABLE_LOCATIONS WHERE TABLE_ID >= 500000 ORDER BY TABLE_ID, TABLET_ID;
TABLE_ID	TABLE_NAME	PARTITION_NAME	TABLET_ID	LS_ID
500002	t_part	p0	200001	1001
500002	t_part	p1	200002	1001
500002	t_part	p2	200003	1001
500002	t_part	p3	200004	1002
500002	t_part	p4	200005	1002
500002	t_part	p5	200006	1002
500003	__AUX_LOB_META_500003_	p0	1152921504606846977	1001
500003	__AUX_LOB_META_500003_	p1	1152921504606846978	1001
500003	__AUX_LOB_META_500003_	p2	1152921504606846979	1001
500003	__AUX_LOB_META_500003_	p3	1152921504606846980	1002
500003	__AUX_LOB_META_500003_	p4	1152921504606846981	1002
500003	__AUX_LOB_META_500003_	p5	1152921504606846982	1002
500004	__AUX_LOB_PIECE_500004_	p0	1152921504606846983	1001
500004	__AUX_LOB_PIECE_500004_	p1	1152921504606846984	1001
500004	__AUX_LOB_PIECE_500004_	p2	1152921504606846985	1001
500004	__AUX_LOB_PIECE_500004_	p3	1152921504606846986	1002
500004	__AUX_LOB_PIECE_500004_	p4	1152921504606846987	1002
500004	__AUX_LOB_PIECE_500004_	p5	1152921504606846988	1002
500029	__idx_500002_idx_t_part	p0	1152921504606846989	1001
500029	__idx_500002_idx_t_part	p1	1152921504606846990	1001
500029	__idx_500002_idx_t_part	p2	1152921504606846991	1001
500029	__idx_500002_idx_t_part	p3	1152921504606846992	1002
500029	__idx_500002_idx_t_part	p4	1152921504606846993	1002
500029	__idx_500002_idx_t_part	p5	1152921504606846994	1002
500030	t_subpart	p0	200007	1001
500030	t_subpart	p0	200008	1001
500030	t_subpart	p0	200009	1002
500030	t_subpart	p1	200010	1001
500030	t_subpart	p1	200011	1001
500030	t_subpart	p1	200012	1002
500031	__AUX_LOB_META_500031_	p0	1152921504606846995	1001
500031	__AUX_LOB_META_500031_	p0	1152921504606846996	1001
500031	__AUX_LOB_META_500031_	p0	1152921504606846997	1002
500031	__AUX_LOB_META_500031_	p1	1152921504606846998	1001
500031	__AUX_LOB_META_500031_	p1	1152921504606846999	1001
500031	__AUX_LOB_META_500031_	p1	1152921504606847000	1002
500032	__AUX_LOB_PIECE_500032_	p0	1152921504606847001	1001
500032	__AUX_LOB_PIECE_500032_	p0	1152921504606847002	1001
500032	__AUX_LOB_PIECE_500032_	p0	1152921504606847003	1002
500032	__AUX_LOB_PIECE_500032_	p1	1152921504606847004	1001
500032	__AUX_LOB_PIECE_500032_	p1	1152921504606847005	1001
500032	__AUX_LOB_PIECE_500032_	p1	1152921504606847006	1002
500065	__idx_500030_idx_t_subpart	p0	1152921504606847007	1001
500065	__idx_500030_idx_t_subpart	p0	1152921504606847008	1001
500065	__idx_500030_idx_t_subpart	p0	1152921504606847009	1002
500065	__idx_500030_idx_t_subpart	p1	1152921504606847010	1001
500065	__idx_500030_idx_t_subpart	p1	1152921504606847011	1001
500065	__idx_500030_idx_t_subpart	p1	1152921504606847012	1002
500066	t_nopart_1	NULL	200013	1001
500067	t_nopart_2	NULL	200014	1001
500068	t_nopart_3	NULL	200015	1001
500069	t_nopart_4	NULL	200016	1002
500070	t_nopart_5	NULL	200017	1002
500071	t_nopart_6	NULL	200018	1002
SELECT JOB_TYPE, TARGET_UNIT_NUM, TARGET_PRIMARY_ZONE_NUM, STATUS, COMMENT, BALANCE_STRATEGY_NAME FROM oceanbase.__all_balance_job_history;
JOB_TYPE	TARGET_UNIT_NUM	TARGET_PRIMARY_ZONE_NUM	STATUS	COMMENT	BALANCE_STRATEGY_NAME
LS_BALANCE	2	1	COMPLETED	NULL	LS balance by expand
SELECT task_type, src_ls, dest_ls, part_list, finished_part_list, part_count, finished_part_count, ls_group_id, status, parent_list FROM oceanbase.__all_balance_task_history;
task_type	src_ls	dest_ls	part_list	finished_part_list	part_count	finished_part_count	ls_group_id	status	parent_list
LS_SPLIT	1001	1002	NULL	500002:500008,500002:500009,500002:500010,500030:500037,500030:500040,500069:500069,500070:500070,500071:500071	0	8	1001	COMPLETED	NULL
LS_ALTER	1002	-1	NULL	NULL	0	0	1002	COMPLETED	NULL
SELECT src_ls, dest_ls, part_list, part_count, not_exist_part_list, lock_conflict_part_list, table_lock_tablet_list, tablet_list, tablet_count, status, result, comment FROM oceanbase.__all_transfer_task_history;
src_ls	dest_ls	part_list	part_count	not_exist_part_list	lock_conflict_part_list	table_lock_tablet_list	tablet_list	tablet_count	status	result	comment
1001	1002	500002:500008,500002:500009,500002:500010,500030:500037,500030:500040,500069:500069,500070:500070,500071:500071	8	NULL	NULL	200004,200005,200006,200009,200012	200004:0,200005:0,200006:0,200009:0,200012:0,200016:0,200017:0,200018:0,1152921504606846980:0,1152921504606846981:0,1152921504606846982:0,1152921504606846986:0,1152921504606846987:0,1152921504606846988:0,1152921504606846992:0,1152921504606846993:0,1152921504606846994:0,1152921504606846997:0,1152921504606847000:0,1152921504606847003:0,1152921504606847006:0,1152921504606847009:0,1152921504606847012:0	23	COMPLETED	0	
alter system change tenant mysql;
DELETE FROM oceanbase.__all_balance_job_history;
DELETE FROM oceanbase.__all_balance_task_history;
DELETE FROM oceanbase.__all_transfer_task_history;
alter system change tenant sys;
update test.t_nopart_1 set c1=c1+1;
update test.t_nopart_2 set c1=c1+1;
update test.t_nopart_3 set c1=c1+1;
update test.t_nopart_4 set c1=c1+1;
update test.t_nopart_5 set c1=c1+1;
update test.t_nopart_6 set c1=c1+1;
select t1.c1, t2.c1, t3.c1, t4.c1, t5.c1, t6.c1 from test.t_nopart_1 t1, test.t_nopart_2 t2, test.t_nopart_3 t3, test.t_nopart_4 t4, test.t_nopart_5 t5, test.t_nopart_6 t6;
c1	c1	c1	c1	c1	c1
1	1	1	1	1	1
update test.t_part set pk = pk+100;
update test.t_subpart set c1=c1+100;
select * from test.t_part order by pk;
pk	c1
100	0
101	1
102	2
103	3
104	4
105	5
106	6
107	7
108	8
109	9
111	1
112	2
select * from test.t_subpart order by c0;
c0	c1	c2
0	100	NULL
1	101	NULL
2	102	NULL
3	103	NULL
4	104	NULL
5	105	NULL
6	106	NULL
7	107	NULL
8	108	NULL
9	109	NULL
11	101	NULL
12	102	NULL
===============================================================
=================     restart cluster    ======================
===============================================================
test restart cluster begin
ob1.force_stop;
ob1.nstart;
ob1.check_until_timeout select count(*) as cnt from oceanbase.__all_server where start_service_time <= $stop_tstamp_usec, 0 ,180;
ob1.check_until_timeout select count(*) from oceanbase.__all_server a left join oceanbase.__all_virtual_server_schema_info b on a.svr_ip = b.svr_ip and a.svr_port = b.svr_port where b.svr_ip is null, 0, 120;
ob1.check_until_timeout select count(*) as cnt from oceanbase.__all_virtual_server_schema_info as a join oceanbase.__all_virtual_server_schema_info as b on a.tenant_id = b.tenant_id  where a.refreshed_schema_version != b.refreshed_schema_version or a.refreshed_schema_version % 8 != 0, 0, 180;
ob1.check_until_timeout select count(*) from __all_virtual_memory_info where mod_name like '%OB_MOD_DO_NOT_USE_ME%' and hold != 0, 0, 10;
test restart cluster finish
===============================================================
==============     switch replica leader    ===================
===============================================================
test switch mysql replica leader begin
count(*)
0
ob1.check_until_timeout select count(*) from __all_virtual_ls_meta_table where tenant_id = '$mysql_tenant_id' and svr_ip = '$follower1_svr_ip' and svr_port='$follower1_svr_port' and ls_id = $ls_id and role = 1, 1, 6;
count(*)
1
ob1.check_until_timeout select count(*) from __all_virtual_ls_meta_table where tenant_id = '$mysql_tenant_id' and svr_ip = '$leader_svr_ip' and svr_port='$leader_svr_port' and ls_id = $ls_id and role = 1, 1, 6;
count(*)
1
create table if not exists t_for_switch (c1 int);
ob1.check_until_timeout select count(*) as cnt from oceanbase.__all_virtual_server_schema_info as a join oceanbase.__all_virtual_server_schema_info as b on a.tenant_id = b.tenant_id  where a.refreshed_schema_version != b.refreshed_schema_version, 0, 60;
begin;
insert into t_for_switch values (1);
ob1.check_until_timeout select count(*) from __all_virtual_ls_meta_table where tenant_id = '$mysql_tenant_id' and svr_ip = '$follower1_svr_ip' and svr_port='$follower1_svr_port' and ls_id = $ls_id and role = 1, 1, 6;
count(*)
1
commit;
select * from t_for_switch order by c1 asc;
c1
1
ob1.check_until_timeout select count(*) from __all_virtual_ls_meta_table where tenant_id = '$mysql_tenant_id' and svr_ip = '$leader_svr_ip' and svr_port='$leader_svr_port' and ls_id = $ls_id and role = 1, 1, 6;
count(*)
1
begin;
insert into t_for_switch values (2);
ob1.check_until_timeout select count(*) from __all_virtual_ls_meta_table where tenant_id = '$mysql_tenant_id' and svr_ip = '$follower1_svr_ip' and svr_port='$follower1_svr_port' and ls_id = $ls_id and role = 1, 1, 6;
count(*)
1
insert into t_for_switch values (3);
commit;
select * from t_for_switch order by c1 asc;
c1
1
2
3
ob1.check_until_timeout select count(*) from __all_virtual_ls_meta_table where tenant_id = '$mysql_tenant_id' and svr_ip = '$leader_svr_ip' and svr_port='$leader_svr_port' and ls_id = $ls_id and role = 1, 1, 6;
count(*)
1
set recyclebin = off;
DROP TABLE IF EXISTS t_for_switch;
test switch mysql replica leader finish
update test.t_nopart_1 set c1=c1+1;
update test.t_nopart_2 set c1=c1+1;
update test.t_nopart_3 set c1=c1+1;
update test.t_nopart_4 set c1=c1+1;
update test.t_nopart_5 set c1=c1+1;
update test.t_nopart_6 set c1=c1+1;
select t1.c1, t2.c1, t3.c1, t4.c1, t5.c1, t6.c1 from test.t_nopart_1 t1, test.t_nopart_2 t2, test.t_nopart_3 t3, test.t_nopart_4 t4, test.t_nopart_5 t5, test.t_nopart_6 t6;
c1	c1	c1	c1	c1	c1
2	2	2	2	2	2
update test.t_part set pk = pk+100;
update test.t_subpart set c1=c1+100;
select * from test.t_part order by pk;
pk	c1
200	0
201	1
202	2
203	3
204	4
205	5
206	6
207	7
208	8
209	9
211	1
212	2
select * from test.t_subpart order by c0;
c0	c1	c2
0	200	NULL
1	201	NULL
2	202	NULL
3	203	NULL
4	204	NULL
5	205	NULL
6	206	NULL
7	207	NULL
8	208	NULL
9	209	NULL
11	201	NULL
12	202	NULL
===============================================================
=================   reset mysql tenant    =====================
===============================================================
set recyclebin = off;
DROP TABLE IF EXISTS t_part, t_subpart;
ALTER RESOURCE TENANT mysql UNIT_NUM = 1 DELETE UNIT_GROUP = (1002);
ob1.check_until_timeout select count(*) from oceanbase.__all_virtual_balance_job_history where tenant_id = $mysql_tenant_id, 1, 300;
ob1.check_until_timeout select count(*) from oceanbase.__all_virtual_balance_job where tenant_id = $mysql_tenant_id, 0, 60;
ob1.check_until_timeout select count(*) from oceanbase.CDB_OB_LS where tenant_id = $mysql_tenant_id and status != 'NORMAL', 0, 100;
SELECT LS_ID, STATUS, PRIMARY_ZONE FROM oceanbase.DBA_OB_LS;
LS_ID	STATUS	PRIMARY_ZONE
1	NORMAL	z1;z2,z3
1001	NORMAL	z1;z2,z3
SELECT DISTINCT TABLE_ID, TABLE_NAME, PARTITION_NAME, TABLET_ID, LS_ID FROM oceanbase.DBA_OB_TABLE_LOCATIONS WHERE TABLE_ID >= 500000 ORDER BY TABLE_ID, TABLET_ID;
TABLE_ID	TABLE_NAME	PARTITION_NAME	TABLET_ID	LS_ID
500066	t_nopart_1	NULL	200013	1001
500067	t_nopart_2	NULL	200014	1001
500068	t_nopart_3	NULL	200015	1001
500069	t_nopart_4	NULL	200016	1001
500070	t_nopart_5	NULL	200017	1001
500071	t_nopart_6	NULL	200018	1001
SELECT JOB_TYPE, TARGET_UNIT_NUM, TARGET_PRIMARY_ZONE_NUM, STATUS, COMMENT, BALANCE_STRATEGY_NAME FROM oceanbase.__all_balance_job_history;
JOB_TYPE	TARGET_UNIT_NUM	TARGET_PRIMARY_ZONE_NUM	STATUS	COMMENT	BALANCE_STRATEGY_NAME
LS_BALANCE	1	1	COMPLETED	NULL	LS balance by shrink
SELECT task_type, src_ls, dest_ls, part_list, finished_part_list, part_count, finished_part_count, ls_group_id, status, parent_list FROM oceanbase.__all_balance_task_history;
task_type	src_ls	dest_ls	part_list	finished_part_list	part_count	finished_part_count	ls_group_id	status	parent_list
LS_ALTER	1002	-1	NULL	NULL	0	0	1001	COMPLETED	NULL
LS_MERGE	1002	1001	NULL	500069:500069,500070:500070,500071:500071	0	3	1001	COMPLETED	NULL
SELECT src_ls, dest_ls, part_list, part_count, not_exist_part_list, lock_conflict_part_list, table_lock_tablet_list, tablet_list, tablet_count, status, result, comment FROM oceanbase.__all_transfer_task_history;
src_ls	dest_ls	part_list	part_count	not_exist_part_list	lock_conflict_part_list	table_lock_tablet_list	tablet_list	tablet_count	status	result	comment
1002	1001	500069:500069,500070:500070,500071:500071	3	NULL	NULL	NULL	200016:1,200017:1,200018:1	3	COMPLETED	0	
alter system change tenant mysql;
DELETE FROM oceanbase.__all_balance_job_history;
DELETE FROM oceanbase.__all_balance_task_history;
DELETE FROM oceanbase.__all_transfer_task_history;
alter system change tenant sys;
===============================================================
========   verify transfer offline ddl hidden table   =========
===============================================================
# create user table (primary table)
create table if not exists t_hidden_1(c1 int, c2 int) partition by hash(c1) partitions 2;
# create hidden table with debug_sync
ob1.mysql alter system set debug_sync_timeout = '1000s';
ob1.check_until_timeout select count(*) from gv\$ob_parameters where name = 'debug_sync_timeout' and value != '1000s', 0, 3;
ob1.mysql set ob_global_debug_sync = 'TABLE_REDEFINITION_REPLICA_BUILD wait_for signal_ddl execute 10000';
ob1.mysql set ob_global_debug_sync = 'AFTER_TRANSFER_PROCESS_INIT_TASK_AND_BEFORE_NOTIFY_STORAGE wait_for signal_transfer execute 10000';
alter table t_hidden_1 modify c2 char(10);
ob1.check_until_timeout select count(*) from __all_virtual_table where tenant_id = $mysql_tenant_id and table_name = 't_hidden_1' and association_table_id != -1 , 1, 10;
# primary 1->2
ob1.mysql alter tenant mysql set primary_zone = 'z1,z2';
# verify offline ddl hidden table is treated as lock conflict table in transfer
ob1.check_until_timeout select count(*) from oceanbase.__all_virtual_transfer_task where tenant_id = $mysql_tenant_id and status = 'START', 1, 300;
ob1.check_until_timeout select count(*) from oceanbase.__all_virtual_transfer_task where tenant_id = $mysql_tenant_id and status = 'START' and lock_conflict_part_list like '%$primary_table_id%' and lock_conflict_part_list like '%$hidden_table_id%', 1, 1;
select lock_conflict_part_list from oceanbase.__all_virtual_transfer_task where tenant_id = 1002 and status = 'START';
lock_conflict_part_list
501027:501028,501030:501032
select tenant_id, table_name, partition_name, object_id, ls_id from CDB_OB_TABLE_LOCATIONS where tenant_id = 1002 and table_id in (501027, 501030) order by object_id;
tenant_id	table_name	partition_name	object_id	ls_id
1002	t_hidden_1	p0	501028	1001
1002	t_hidden_1	p0	501028	1001
1002	t_hidden_1	p0	501028	1001
1002	t_hidden_1	p1	501029	1001
1002	t_hidden_1	p1	501029	1001
1002	t_hidden_1	p1	501029	1001
1002	__hidden_501030_501027table_schema	p0	501031	1001
1002	__hidden_501030_501027table_schema	p0	501031	1001
1002	__hidden_501030_501027table_schema	p0	501031	1001
1002	__hidden_501030_501027table_schema	p1	501032	1001
1002	__hidden_501030_501027table_schema	p1	501032	1001
1002	__hidden_501030_501027table_schema	p1	501032	1001
# signal transfer
ob1.mysql set ob_global_debug_sync = 'AFTER_TRANSFER_PROCESS_INIT_TASK_AND_BEFORE_NOTIFY_STORAGE clear';
ob1.mysql set ob_global_debug_sync = 'now signal signal_transfer';
# verify that the transfer task fails when all tables have table locks applied.
ob1.check_until_timeout select count(*) > 0 from oceanbase.__all_virtual_transfer_task_history where tenant_id = $mysql_tenant_id and status = 'FAILED' and lock_conflict_part_list like '%$primary_table_id%' and lock_conflict_part_list like '%$hidden_table_id%' and comment like '%Unable to process task due to all partitions being locked%', 1, 60;
# change the retry interval for failures to 1 second to allow immediate retries and reduce the case's time consumption.
ob1.mysql alter system set _transfer_task_retry_interval = '1s' tenant mysql;
ob1.check_until_timeout select count(*) from gv\$ob_parameters where name = '_transfer_task_retry_interval' and tenant_id = $mysql_tenant_id and value != '1s', 0, 3;
# turn off debug_sync
ob1.mysql set ob_global_debug_sync = 'reset';
ob1.mysql set ob_global_debug_sync = 'now signal signal_ddl';
ob1.mysql alter system set debug_sync_timeout = 0;
# hidden table converts to primary table
ob1.check_until_timeout select count(*) from __all_virtual_table where tenant_id = $mysql_tenant_id and table_name = 't_hidden_1' and association_table_id = -1 and table_id = $new_primary_table_id, 1, 20;
# wait balance job finish
ob1.check_until_timeout select count(*) from __all_virtual_balance_job where tenant_id = $mysql_tenant_id, 0, 100;
ob1.check_until_timeout select count(*) from __all_virtual_balance_task where tenant_id = $mysql_tenant_id, 0, 30;
ob1.check_until_timeout select count(*) from __all_virtual_transfer_task where tenant_id = $mysql_tenant_id, 0, 30;
# change _transfer_task_retry_interval back to its default value.
ob1.mysql alter system set _transfer_task_retry_interval = '1m' tenant mysql;
ob1.check_until_timeout select count(*) from gv\$ob_parameters where name = '_transfer_task_retry_interval' and tenant_id = $mysql_tenant_id and value != '1m', 0, 3;
# verify transfer new_primary_table after offline ddl finished
ob1.check_until_timeout select count(*) from __all_virtual_transfer_task_history where tenant_id = $mysql_tenant_id and part_list like '%$new_primary_table_id%' and not_exist_part_list like '%$primary_table_id%' and lock_conflict_part_list is null, 1, 10;
ob1.check_until_timeout select count(*) from __all_virtual_balance_task_history where tenant_id = $mysql_tenant_id and finished_part_list like '%$new_primary_table_id%', 1, 10;
select tenant_id, table_name, partition_name, object_id, ls_id from CDB_OB_TABLE_LOCATIONS where tenant_id = 1002 and table_id in (501027, 501030, 501030) order by object_id;
tenant_id	table_name	partition_name	object_id	ls_id
1002	t_hidden_1	p0	501031	1001
1002	t_hidden_1	p0	501031	1001
1002	t_hidden_1	p0	501031	1001
1002	t_hidden_1	p1	501032	1003
1002	t_hidden_1	p1	501032	1003
1002	t_hidden_1	p1	501032	1003
# delete data
set recyclebin = off;
DROP TABLE IF EXISTS t_nopart_1, t_nopart_2, t_nopart_3, t_nopart_4, t_nopart_5, t_nopart_6, t_hidden_1;
===============================================================
============ test balance and transfer configs ================
===============================================================
ob1.mysql alter system set _transfer_start_trans_timeout = '60s';
ob1.mysql alter system set debug_sync_timeout = '1000s';
set @@session.ob_query_timeout = 1000000000;
################################################
# 1. test balance related modify tenant commands
alter system set enable_rebalance='false';
ob1.check_until_timeout select count(*) from GV\$OB_PARAMETERS where tenant_id = $mysql_tenant_id and name = 'enable_rebalance' and value != 'false', 0, 5;
ob1.check_until_timeout select count(*) from __all_virtual_tenant_parameter_info where tenant_id = $mysql_tenant_id and name = 'enable_rebalance' and value = 'true', 0, 5;
##
# 1.1 test modify primary_zone
alter tenant mysql primary_zone = 'z1,z2';
alter tenant mysql primary_zone = 'z2,z1';
alter tenant mysql primary_zone = 'z1,z2;z3';
alter tenant mysql primary_zone = 'z2,z1;z3';
alter tenant mysql primary_zone = 'z1';
ERROR HY000: Tenant (1002) Primary Zone with the first priority will be changed from 'z1,z2' to 'z1', but tenant 'enable_rebalance' is disabled, alter tenant not allowed
alter tenant mysql primary_zone = 'z1,z3';
ERROR HY000: Tenant (1002) Primary Zone with the first priority will be changed from 'z1,z2' to 'z1,z3', but tenant 'enable_rebalance' is disabled, alter tenant not allowed
alter tenant mysql primary_zone = 'z1,z2,z3';
ERROR HY000: Tenant (1002) Primary Zone with the first priority will be changed from 'z1,z2' to 'z1,z2,z3', but tenant 'enable_rebalance' is disabled, alter tenant not allowed
alter tenant mysql primary_zone = RANDOM;
ERROR HY000: Tenant (1002) Primary Zone with the first priority will be changed from 'z1,z2' to 'z1,z2,z3', but tenant 'enable_rebalance' is disabled, alter tenant not allowed
alter tenant mysql primary_zone = 'z1,z1,z2';
ERROR HY000: Incorrect arguments to primary zone
##
# 1.2 test modify unit_num
alter resource tenant mysql unit_num = 1;
alter resource tenant mysql unit_num = 2;
ERROR HY000: Tenant (1002) 'enable_rebalance' is disabled, alter tenant unit num not allowed
##
# 1.3 test modify locality
alter tenant mysql locality = 'F@z1,F@z2,F@z3';
alter tenant mysql locality = 'F@z2,F@z3';
ERROR HY000: Tenant (1002) Primary Zone with the first priority will be changed from 'z1,z2' to 'z2', but tenant 'enable_rebalance' is disabled, alter tenant not allowed
alter tenant mysql locality = 'F@z1,F@z3';
ERROR HY000: Tenant (1002) Primary Zone with the first priority will be changed from 'z1,z2' to 'z1', but tenant 'enable_rebalance' is disabled, alter tenant not allowed
alter tenant mysql locality = 'F@z3';
ERROR HY000: violate locality principal not allowed
alter tenant mysql locality = 'F@z1,F@z2';
ob1.check_until_timeout select count(*) = 2 from __all_virtual_log_stat where tenant_id = $mysql_tenant_id and ls_id = 1, 1, 120;
alter system set enable_rebalance='true';
ob1.check_until_timeout select count(*) from GV\$OB_PARAMETERS where tenant_id = $mysql_tenant_id and name = 'enable_rebalance' and value != 'true', 0, 5;
ob1.check_until_timeout select count(*) from __all_virtual_tenant_parameter_info where tenant_id = $mysql_tenant_id and name = 'enable_rebalance' and value = 'false', 0, 5;
alter tenant mysql primary_zone = 'RANDOM';
ob1.check_until_timeout select count(*) from __all_virtual_balance_job where tenant_id = $mysql_tenant_id, 0, 300;
alter system set enable_rebalance='false';
ob1.check_until_timeout select count(*) from GV\$OB_PARAMETERS where tenant_id = $mysql_tenant_id and name = 'enable_rebalance' and value != 'false', 0, 5;
ob1.check_until_timeout select count(*) from __all_virtual_tenant_parameter_info where tenant_id = $mysql_tenant_id and name = 'enable_rebalance' and value = 'true', 0, 5;
ob1.check_until_timeout select count(*) from __all_tenant where tenant_id = $mysql_tenant_id and primary_zone = 'RANDOM' and locality = 'FULL{1}@z1, FULL{1}@z2', 1, 10;
alter tenant mysql locality = 'F@z1,F@z2,F@z3';
ERROR HY000: Tenant (1002) Primary Zone with the first priority will be changed from 'z1,z2' to 'z1,z2,z3', but tenant 'enable_rebalance' is disabled, alter tenant not allowed
alter tenant mysql locality = 'F@z1';
ERROR HY000: violate locality principal not allowed
##
# 1.4 balancer_idle_time can't longer than partition_balance_schedule_interval
alter system set balancer_idle_time = '3h' tenant = 'mysql';
ERROR HY000: Incorrect arguments to balancer_idle_time of tenant 1002, it should not be longer than partition_balance_schedule_interval
alter system set partition_balance_schedule_interval = '1s' tenant = 'mysql';
ERROR HY000: Incorrect arguments to partition_balance_schedule_interval of tenant 1002, it should not be less than balancer_idle_time
alter system set balancer_idle_time = '3h';
ERROR HY000: Incorrect arguments to balancer_idle_time of tenant 1002, it should not be longer than partition_balance_schedule_interval
alter system set partition_balance_schedule_interval = '1s';
ERROR HY000: Incorrect arguments to partition_balance_schedule_interval of tenant 1002, it should not be less than balancer_idle_time
alter system set balancer_idle_time = '10s';
alter system set partition_balance_schedule_interval = '2h';
##
# 1.4 commands are normal when enable rebalance
alter system set enable_rebalance='true';
ob1.check_until_timeout select count(*) from GV\$OB_PARAMETERS where tenant_id = $mysql_tenant_id and name = 'enable_rebalance' and value != 'true', 0, 5;
ob1.check_until_timeout select count(*) from __all_virtual_tenant_parameter_info where tenant_id = $mysql_tenant_id and name = 'enable_rebalance' and value = 'false', 0, 5;
ob1.check_until_timeout select count(*) from gv\$ob_units where tenant_id in ($mysql_tenant_id, $mysql_tenant_id - 1), 6, 300;
alter resource tenant mysql unit_num = 2;
ob1.check_until_timeout select count(*) = 6 from gv\$ob_units where tenant_id = $mysql_tenant_id, 1, 300;
alter resource tenant mysql unit_num = 1;
ob1.check_until_timeout select count(*) = 3 from gv\$ob_units where tenant_id = $mysql_tenant_id, 1, 300;
alter tenant mysql locality = 'F@z1,F@z2,F@z3';
ob1.check_until_timeout select count(*) = 3 from __all_virtual_log_stat where tenant_id = $mysql_tenant_id and ls_id = 1, 1, 120;
alter tenant mysql primary_zone = 'z1,z2,z3';
alter tenant mysql primary_zone = 'z1,z2';
alter tenant mysql primary_zone = RANDOM;
##
# 1.5 alter primary_zone/locality for sys tenant are not affected
alter system set enable_rebalance='false';
ob1.check_until_timeout select count(*) from GV\$OB_PARAMETERS where tenant_id = 1 and name = 'enable_rebalance' and value = 'false', 6, 5;
ob1.check_until_timeout select count(*) from __all_virtual_tenant_parameter_info where tenant_id = 1 and name = 'enable_rebalance' and value = 'true', 0, 5;
alter tenant sys primary_zone = 'z2';
alter tenant sys primary_zone = RANDOM;
alter tenant sys locality = 'F@z1, F@z2';
alter tenant sys locality = 'F@z1, F@z2, F@z3';
##
# 1.5 test _transfer_task_tablet_count_threshold
# 1.5.1 limit 0 < _transfer_task_tablet_count_threshold <= OB_MAX_TRANSFER_BINDING_TABLET_CNT
alter system set _transfer_task_tablet_count_threshold = 518 tenant mysql;
alter system set _transfer_task_tablet_count_threshold = 0 tenant mysql;
ERROR HY000: Invalid config
alter system set _transfer_task_tablet_count_threshold = 519 tenant mysql;
ERROR HY000: Incorrect arguments to _transfer_task_tablet_count_threshold of tenant 1002, it cannot be greater than 518
# 1.5.2 verify that a partition with max aux tables can be transferred
ob1.check_until_timeout select count(*) from CDB_OB_BALANCE_JOBS where tenant_id = $mysql_tenant_id, 0, 100;
alter tenant mysql primary_zone = 'z1';
ob1.check_until_timeout select count(*) from CDB_OB_BALANCE_JOBS where tenant_id = $mysql_tenant_id, 1, 60;
select dest_ls, tablet_count, status, result from oceanbase.DBA_OB_TRANSFER_TASK_HISTORY where part_list like '%501033%' and result = 0;
dest_ls	tablet_count	status	result
1001	131	COMPLETED	0
drop tenants
set recyclebin = off;
drop tenant mysql force;
