ob1=OBI(cluster=1:1:1,proxy_num=0);
ob1.z1.obs0.set extra_config=$extra_conf;
ob1.z2.obs0.set extra_config=$extra_conf;
ob1.z3.obs0.set extra_config=$extra_conf;
===============================================================
====================     bootstrap   ==========================
===============================================================
test case for bootstrap begin
ob1.reboot;
ob1.mysql alter system set enable_rebalance='false';
test case for bootstrap finish
===============================================================
==================     create tenant   ========================
===============================================================
set @@session.ob_query_timeout = 1000000000;
CREATE RESOURCE UNIT if not exists unit_1 MAX_CPU 2, MEMORY_SIZE='2G';
CREATE RESOURCE POOL if not exists pool_1 UNIT = 'unit_1', UNIT_NUM = 1;
CREATE TENANT mysql RESOURCE_POOL_LIST = ('pool_1'), primary_zone='z1', locality='F@z1, F@z2, F@z3' set ob_tcp_invited_nodes='%';
ob1.check_until_timeout select count(*) as cnt from oceanbase.__all_virtual_server_schema_info as a join oceanbase.__all_virtual_server_schema_info as b on a.tenant_id = b.tenant_id  where a.refreshed_schema_version != b.refreshed_schema_version, 0, 60;
ob1.mysql alter system set _transfer_start_trans_timeout = '10s' tenant = 'mysql';
===============================================================
=========  empty cluster primary zone from 1 to 3   ===========
===============================================================
alter tenant mysql set primary_zone = 'RANDOM';
===============================================================
==========   empty cluster verify transfer    =================
===============================================================
ob1.check_until_timeout select count(*) from oceanbase.__all_virtual_balance_job_history where tenant_id = $mysql_tenant_id, 1, 300;
ob1.check_until_timeout select count(*) from oceanbase.__all_virtual_balance_job where tenant_id = $mysql_tenant_id, 0, 60;
ob1.check_until_timeout select count(*) from oceanbase.CDB_OB_LS where tenant_id = $mysql_tenant_id and status != 'NORMAL', 0, 100;
SELECT LS_ID, STATUS, PRIMARY_ZONE FROM oceanbase.DBA_OB_LS;
LS_ID	STATUS	PRIMARY_ZONE
1	NORMAL	z1;z2,z3
1001	NORMAL	z1;z2,z3
1002	NORMAL	z2;z1,z3
1003	NORMAL	z3;z1,z2
SELECT DISTINCT TABLE_ID, TABLE_NAME, PARTITION_NAME, TABLET_ID, LS_ID FROM oceanbase.DBA_OB_TABLE_LOCATIONS WHERE TABLE_ID >= 500000 ORDER BY TABLE_ID, TABLET_ID;
TABLE_ID	TABLE_NAME	PARTITION_NAME	TABLET_ID	LS_ID
SELECT JOB_TYPE, TARGET_UNIT_NUM, TARGET_PRIMARY_ZONE_NUM, STATUS, COMMENT, BALANCE_STRATEGY_NAME FROM oceanbase.__all_balance_job_history;
JOB_TYPE	TARGET_UNIT_NUM	TARGET_PRIMARY_ZONE_NUM	STATUS	COMMENT	BALANCE_STRATEGY_NAME
LS_BALANCE	1	3	COMPLETED	NULL	LS balance by expand
SELECT task_type, src_ls, dest_ls, part_list, finished_part_list, part_count, finished_part_count, ls_group_id, status, parent_list FROM oceanbase.__all_balance_task_history;
task_type	src_ls	dest_ls	part_list	finished_part_list	part_count	finished_part_count	ls_group_id	status	parent_list
LS_SPLIT	1001	1002	NULL	NULL	0	0	1001	COMPLETED	NULL
LS_SPLIT	1001	1003	NULL	NULL	0	0	1001	COMPLETED	NULL
SELECT src_ls, dest_ls, part_list, part_count, not_exist_part_list, lock_conflict_part_list, table_lock_tablet_list, tablet_list, tablet_count, status, result, comment FROM oceanbase.__all_transfer_task_history;
src_ls	dest_ls	part_list	part_count	not_exist_part_list	lock_conflict_part_list	table_lock_tablet_list	tablet_list	tablet_count	status	result	comment
alter system change tenant mysql;
DELETE FROM oceanbase.__all_balance_job_history;
DELETE FROM oceanbase.__all_balance_task_history;
DELETE FROM oceanbase.__all_transfer_task_history;
alter system change tenant sys;
===============================================================
==============     prepare transfer data   ====================
===============================================================
create table if not exists t_part(pk int primary key, c1 longtext) partition by hash(pk) partitions 6;
create index if not exists idx_t_part on t_part(pk);
insert into t_part values (1, 1), (2,2), (3,3), (4,4), (5,5), (6,6), (7,7), (8,8), (9,9), (0,0), (11, 1), (12,2);
create table if not exists t_subpart(c0 int, c1 int, c2 longtext, primary key (c0, c1)) partition by hash(c0) subpartition by hash(c1) subpartitions 3 partitions 2;
create index if not exists idx_t_subpart on t_subpart(c0, c1);
insert into t_subpart (c0, c1) values (1, 1), (2,2), (3,3), (4,4), (5,5), (6,6), (7,7), (8,8), (9,9), (0,0), (11, 1), (12,2);
create table if not exists t_nopart_1(c1 int);
create table if not exists t_nopart_2(c1 int);
create table if not exists t_nopart_3(c1 int);
create table if not exists t_nopart_4(c1 int);
create table if not exists t_nopart_5(c1 int);
create table if not exists t_nopart_6(c1 int);
insert into t_nopart_1 values (0);
insert into t_nopart_2 values (0);
insert into t_nopart_3 values (0);
insert into t_nopart_4 values (0);
insert into t_nopart_5 values (0);
insert into t_nopart_6 values (0);
SELECT TABLE_ID, TABLE_NAME, PARTITION_NAME, SUBPARTITION_NAME, TABLET_ID, LS_ID FROM oceanbase.DBA_OB_TABLE_LOCATIONS WHERE TABLE_ID >= 500000 AND ROLE = 'LEADER';
TABLE_ID	TABLE_NAME	PARTITION_NAME	SUBPARTITION_NAME	TABLET_ID	LS_ID
500002	t_part	p0	NULL	200001	1001
500002	t_part	p1	NULL	200002	1002
500002	t_part	p2	NULL	200003	1003
500002	t_part	p3	NULL	200004	1001
500002	t_part	p4	NULL	200005	1002
500002	t_part	p5	NULL	200006	1003
500003	__AUX_LOB_META_500003_	p0	NULL	1152921504606846977	1001
500003	__AUX_LOB_META_500003_	p1	NULL	1152921504606846978	1002
500003	__AUX_LOB_META_500003_	p2	NULL	1152921504606846979	1003
500003	__AUX_LOB_META_500003_	p3	NULL	1152921504606846980	1001
500003	__AUX_LOB_META_500003_	p4	NULL	1152921504606846981	1002
500003	__AUX_LOB_META_500003_	p5	NULL	1152921504606846982	1003
500004	__AUX_LOB_PIECE_500004_	p0	NULL	1152921504606846983	1001
500004	__AUX_LOB_PIECE_500004_	p1	NULL	1152921504606846984	1002
500004	__AUX_LOB_PIECE_500004_	p2	NULL	1152921504606846985	1003
500004	__AUX_LOB_PIECE_500004_	p3	NULL	1152921504606846986	1001
500004	__AUX_LOB_PIECE_500004_	p4	NULL	1152921504606846987	1002
500004	__AUX_LOB_PIECE_500004_	p5	NULL	1152921504606846988	1003
500029	__idx_500002_idx_t_part	p0	NULL	1152921504606846989	1001
500029	__idx_500002_idx_t_part	p1	NULL	1152921504606846990	1002
500029	__idx_500002_idx_t_part	p2	NULL	1152921504606846991	1003
500029	__idx_500002_idx_t_part	p3	NULL	1152921504606846992	1001
500029	__idx_500002_idx_t_part	p4	NULL	1152921504606846993	1002
500029	__idx_500002_idx_t_part	p5	NULL	1152921504606846994	1003
500030	t_subpart	p0	p0sp0	200007	1002
500030	t_subpart	p0	p0sp1	200008	1003
500030	t_subpart	p0	p0sp2	200009	1001
500030	t_subpart	p1	p1sp0	200010	1003
500030	t_subpart	p1	p1sp1	200011	1001
500030	t_subpart	p1	p1sp2	200012	1002
500031	__AUX_LOB_META_500031_	p0	p0sp0	1152921504606846995	1002
500031	__AUX_LOB_META_500031_	p0	p0sp1	1152921504606846996	1003
500031	__AUX_LOB_META_500031_	p0	p0sp2	1152921504606846997	1001
500031	__AUX_LOB_META_500031_	p1	p1sp0	1152921504606846998	1003
500031	__AUX_LOB_META_500031_	p1	p1sp1	1152921504606846999	1001
500031	__AUX_LOB_META_500031_	p1	p1sp2	1152921504606847000	1002
500032	__AUX_LOB_PIECE_500032_	p0	p0sp0	1152921504606847001	1002
500032	__AUX_LOB_PIECE_500032_	p0	p0sp1	1152921504606847002	1003
500032	__AUX_LOB_PIECE_500032_	p0	p0sp2	1152921504606847003	1001
500032	__AUX_LOB_PIECE_500032_	p1	p1sp0	1152921504606847004	1003
500032	__AUX_LOB_PIECE_500032_	p1	p1sp1	1152921504606847005	1001
500032	__AUX_LOB_PIECE_500032_	p1	p1sp2	1152921504606847006	1002
500065	__idx_500030_idx_t_subpart	p0	p0sp0	1152921504606847007	1002
500065	__idx_500030_idx_t_subpart	p0	p0sp1	1152921504606847008	1003
500065	__idx_500030_idx_t_subpart	p0	p0sp2	1152921504606847009	1001
500065	__idx_500030_idx_t_subpart	p1	p1sp0	1152921504606847010	1003
500065	__idx_500030_idx_t_subpart	p1	p1sp1	1152921504606847011	1001
500065	__idx_500030_idx_t_subpart	p1	p1sp2	1152921504606847012	1002
500066	t_nopart_1	NULL	NULL	200013	1001
500067	t_nopart_2	NULL	NULL	200014	1002
500068	t_nopart_3	NULL	NULL	200015	1003
500069	t_nopart_4	NULL	NULL	200016	1001
500070	t_nopart_5	NULL	NULL	200017	1002
500071	t_nopart_6	NULL	NULL	200018	1003
SELECT LS_ID, STATUS, PRIMARY_ZONE FROM oceanbase.DBA_OB_LS;
LS_ID	STATUS	PRIMARY_ZONE
1	NORMAL	z1;z2,z3
1001	NORMAL	z1;z2,z3
1002	NORMAL	z2;z1,z3
1003	NORMAL	z3;z1,z2
===============================================================
==============  primary zone from 3 to 1   ====================
===============================================================
alter tenant mysql set primary_zone = 'z1';
===============================================================
================     verify transfer    =======================
===============================================================
ob1.check_until_timeout select count(*) from oceanbase.__all_virtual_balance_job_history where tenant_id = $mysql_tenant_id, 1, 300;
ob1.check_until_timeout select count(*) from oceanbase.__all_virtual_balance_job where tenant_id = $mysql_tenant_id, 0, 60;
ob1.check_until_timeout select count(*) from oceanbase.CDB_OB_LS where tenant_id = $mysql_tenant_id and status != 'NORMAL', 0, 100;
SELECT LS_ID, STATUS, PRIMARY_ZONE FROM oceanbase.DBA_OB_LS;
LS_ID	STATUS	PRIMARY_ZONE
1	NORMAL	z1;z2,z3
1001	NORMAL	z1;z2,z3
SELECT DISTINCT TABLE_ID, TABLE_NAME, PARTITION_NAME, TABLET_ID, LS_ID FROM oceanbase.DBA_OB_TABLE_LOCATIONS WHERE TABLE_ID >= 500000 ORDER BY TABLE_ID, TABLET_ID;
TABLE_ID	TABLE_NAME	PARTITION_NAME	TABLET_ID	LS_ID
500002	t_part	p0	200001	1001
500002	t_part	p1	200002	1001
500002	t_part	p2	200003	1001
500002	t_part	p3	200004	1001
500002	t_part	p4	200005	1001
500002	t_part	p5	200006	1001
500003	__AUX_LOB_META_500003_	p0	1152921504606846977	1001
500003	__AUX_LOB_META_500003_	p1	1152921504606846978	1001
500003	__AUX_LOB_META_500003_	p2	1152921504606846979	1001
500003	__AUX_LOB_META_500003_	p3	1152921504606846980	1001
500003	__AUX_LOB_META_500003_	p4	1152921504606846981	1001
500003	__AUX_LOB_META_500003_	p5	1152921504606846982	1001
500004	__AUX_LOB_PIECE_500004_	p0	1152921504606846983	1001
500004	__AUX_LOB_PIECE_500004_	p1	1152921504606846984	1001
500004	__AUX_LOB_PIECE_500004_	p2	1152921504606846985	1001
500004	__AUX_LOB_PIECE_500004_	p3	1152921504606846986	1001
500004	__AUX_LOB_PIECE_500004_	p4	1152921504606846987	1001
500004	__AUX_LOB_PIECE_500004_	p5	1152921504606846988	1001
500029	__idx_500002_idx_t_part	p0	1152921504606846989	1001
500029	__idx_500002_idx_t_part	p1	1152921504606846990	1001
500029	__idx_500002_idx_t_part	p2	1152921504606846991	1001
500029	__idx_500002_idx_t_part	p3	1152921504606846992	1001
500029	__idx_500002_idx_t_part	p4	1152921504606846993	1001
500029	__idx_500002_idx_t_part	p5	1152921504606846994	1001
500030	t_subpart	p0	200007	1001
500030	t_subpart	p0	200008	1001
500030	t_subpart	p0	200009	1001
500030	t_subpart	p1	200010	1001
500030	t_subpart	p1	200011	1001
500030	t_subpart	p1	200012	1001
500031	__AUX_LOB_META_500031_	p0	1152921504606846995	1001
500031	__AUX_LOB_META_500031_	p0	1152921504606846996	1001
500031	__AUX_LOB_META_500031_	p0	1152921504606846997	1001
500031	__AUX_LOB_META_500031_	p1	1152921504606846998	1001
500031	__AUX_LOB_META_500031_	p1	1152921504606846999	1001
500031	__AUX_LOB_META_500031_	p1	1152921504606847000	1001
500032	__AUX_LOB_PIECE_500032_	p0	1152921504606847001	1001
500032	__AUX_LOB_PIECE_500032_	p0	1152921504606847002	1001
500032	__AUX_LOB_PIECE_500032_	p0	1152921504606847003	1001
500032	__AUX_LOB_PIECE_500032_	p1	1152921504606847004	1001
500032	__AUX_LOB_PIECE_500032_	p1	1152921504606847005	1001
500032	__AUX_LOB_PIECE_500032_	p1	1152921504606847006	1001
500065	__idx_500030_idx_t_subpart	p0	1152921504606847007	1001
500065	__idx_500030_idx_t_subpart	p0	1152921504606847008	1001
500065	__idx_500030_idx_t_subpart	p0	1152921504606847009	1001
500065	__idx_500030_idx_t_subpart	p1	1152921504606847010	1001
500065	__idx_500030_idx_t_subpart	p1	1152921504606847011	1001
500065	__idx_500030_idx_t_subpart	p1	1152921504606847012	1001
500066	t_nopart_1	NULL	200013	1001
500067	t_nopart_2	NULL	200014	1001
500068	t_nopart_3	NULL	200015	1001
500069	t_nopart_4	NULL	200016	1001
500070	t_nopart_5	NULL	200017	1001
500071	t_nopart_6	NULL	200018	1001
SELECT JOB_TYPE, TARGET_UNIT_NUM, TARGET_PRIMARY_ZONE_NUM, STATUS, COMMENT, BALANCE_STRATEGY_NAME FROM oceanbase.__all_balance_job_history;
JOB_TYPE	TARGET_UNIT_NUM	TARGET_PRIMARY_ZONE_NUM	STATUS	COMMENT	BALANCE_STRATEGY_NAME
LS_BALANCE	1	1	COMPLETED	NULL	LS balance by shrink
SELECT task_type, src_ls, dest_ls, part_list, finished_part_list, part_count, finished_part_count, ls_group_id, status, parent_list FROM oceanbase.__all_balance_task_history;
task_type	src_ls	dest_ls	part_list	finished_part_list	part_count	finished_part_count	ls_group_id	status	parent_list
LS_MERGE	1002	1001	NULL	500002:500006,500002:500009,500030:500035,500030:500040,500067:500067,500070:500070	0	6	1001	COMPLETED	NULL
LS_MERGE	1003	1001	NULL	500002:500007,500002:500010,500030:500036,500030:500038,500068:500068,500071:500071	0	6	1001	COMPLETED	NULL
SELECT src_ls, dest_ls, part_list, part_count, not_exist_part_list, lock_conflict_part_list, table_lock_tablet_list, tablet_list, tablet_count, status, result, comment FROM oceanbase.__all_transfer_task_history;
src_ls	dest_ls	part_list	part_count	not_exist_part_list	lock_conflict_part_list	table_lock_tablet_list	tablet_list	tablet_count	status	result	comment
1002	1001	500002:500006,500002:500009,500030:500035,500030:500040,500067:500067,500070:500070	6	NULL	NULL	200002,200005,200007,200012	200002:0,200005:0,200007:0,200012:0,200014:0,200017:0,1152921504606846978:0,1152921504606846981:0,1152921504606846984:0,1152921504606846987:0,1152921504606846990:0,1152921504606846993:0,1152921504606846995:0,1152921504606847000:0,1152921504606847001:0,1152921504606847006:0,1152921504606847007:0,1152921504606847012:0	18	COMPLETED	0	
1003	1001	500002:500007,500002:500010,500030:500036,500030:500038,500068:500068,500071:500071	6	NULL	NULL	200003,200006,200008,200010	200003:0,200006:0,200008:0,200010:0,200015:0,200018:0,1152921504606846979:0,1152921504606846982:0,1152921504606846985:0,1152921504606846988:0,1152921504606846991:0,1152921504606846994:0,1152921504606846996:0,1152921504606846998:0,1152921504606847002:0,1152921504606847004:0,1152921504606847008:0,1152921504606847010:0	18	COMPLETED	0	
alter system change tenant mysql;
DELETE FROM oceanbase.__all_balance_job_history;
DELETE FROM oceanbase.__all_balance_task_history;
DELETE FROM oceanbase.__all_transfer_task_history;
alter system change tenant sys;
update test.t_nopart_1 set c1=c1+1;
update test.t_nopart_2 set c1=c1+1;
update test.t_nopart_3 set c1=c1+1;
update test.t_nopart_4 set c1=c1+1;
update test.t_nopart_5 set c1=c1+1;
update test.t_nopart_6 set c1=c1+1;
select t1.c1, t2.c1, t3.c1, t4.c1, t5.c1, t6.c1 from test.t_nopart_1 t1, test.t_nopart_2 t2, test.t_nopart_3 t3, test.t_nopart_4 t4, test.t_nopart_5 t5, test.t_nopart_6 t6;
c1	c1	c1	c1	c1	c1
1	1	1	1	1	1
update test.t_part set pk = pk+100;
update test.t_subpart set c1=c1+100;
select * from test.t_part order by pk;
pk	c1
100	0
101	1
102	2
103	3
104	4
105	5
106	6
107	7
108	8
109	9
111	1
112	2
select * from test.t_subpart order by c0;
c0	c1	c2
0	100	NULL
1	101	NULL
2	102	NULL
3	103	NULL
4	104	NULL
5	105	NULL
6	106	NULL
7	107	NULL
8	108	NULL
9	109	NULL
11	101	NULL
12	102	NULL
===============================================================
=================     restart cluster    ======================
===============================================================
test restart cluster begin
ob1.force_stop;
ob1.nstart;
ob1.check_until_timeout select count(*) as cnt from oceanbase.__all_server where start_service_time <= $stop_tstamp_usec, 0 ,180;
ob1.check_until_timeout select count(*) from oceanbase.__all_server a left join oceanbase.__all_virtual_server_schema_info b on a.svr_ip = b.svr_ip and a.svr_port = b.svr_port where b.svr_ip is null, 0, 120;
ob1.check_until_timeout select count(*) as cnt from oceanbase.__all_virtual_server_schema_info as a join oceanbase.__all_virtual_server_schema_info as b on a.tenant_id = b.tenant_id  where a.refreshed_schema_version != b.refreshed_schema_version or a.refreshed_schema_version % 8 != 0, 0, 180;
ob1.check_until_timeout select count(*) from __all_virtual_memory_info where mod_name like '%OB_MOD_DO_NOT_USE_ME%' and hold != 0, 0, 10;
test restart cluster finish
===============================================================
==============     switch replica leader    ===================
===============================================================
test switch mysql replica leader begin
count(*)
0
ob1.check_until_timeout select count(*) from __all_virtual_ls_meta_table where tenant_id = '$mysql_tenant_id' and svr_ip = '$follower1_svr_ip' and svr_port='$follower1_svr_port' and ls_id = $ls_id and role = 1, 1, 6;
count(*)
1
ob1.check_until_timeout select count(*) from __all_virtual_ls_meta_table where tenant_id = '$mysql_tenant_id' and svr_ip = '$leader_svr_ip' and svr_port='$leader_svr_port' and ls_id = $ls_id and role = 1, 1, 6;
count(*)
1
create table if not exists t_for_switch (c1 int);
ob1.check_until_timeout select count(*) as cnt from oceanbase.__all_virtual_server_schema_info as a join oceanbase.__all_virtual_server_schema_info as b on a.tenant_id = b.tenant_id  where a.refreshed_schema_version != b.refreshed_schema_version, 0, 60;
begin;
insert into t_for_switch values (1);
ob1.check_until_timeout select count(*) from __all_virtual_ls_meta_table where tenant_id = '$mysql_tenant_id' and svr_ip = '$follower1_svr_ip' and svr_port='$follower1_svr_port' and ls_id = $ls_id and role = 1, 1, 6;
count(*)
1
commit;
select * from t_for_switch order by c1 asc;
c1
1
ob1.check_until_timeout select count(*) from __all_virtual_ls_meta_table where tenant_id = '$mysql_tenant_id' and svr_ip = '$leader_svr_ip' and svr_port='$leader_svr_port' and ls_id = $ls_id and role = 1, 1, 6;
count(*)
1
begin;
insert into t_for_switch values (2);
ob1.check_until_timeout select count(*) from __all_virtual_ls_meta_table where tenant_id = '$mysql_tenant_id' and svr_ip = '$follower1_svr_ip' and svr_port='$follower1_svr_port' and ls_id = $ls_id and role = 1, 1, 6;
count(*)
1
insert into t_for_switch values (3);
commit;
select * from t_for_switch order by c1 asc;
c1
1
2
3
ob1.check_until_timeout select count(*) from __all_virtual_ls_meta_table where tenant_id = '$mysql_tenant_id' and svr_ip = '$leader_svr_ip' and svr_port='$leader_svr_port' and ls_id = $ls_id and role = 1, 1, 6;
count(*)
1
set recyclebin = off;
DROP TABLE IF EXISTS t_for_switch;
test switch mysql replica leader finish
update test.t_nopart_1 set c1=c1+1;
update test.t_nopart_2 set c1=c1+1;
update test.t_nopart_3 set c1=c1+1;
update test.t_nopart_4 set c1=c1+1;
update test.t_nopart_5 set c1=c1+1;
update test.t_nopart_6 set c1=c1+1;
select t1.c1, t2.c1, t3.c1, t4.c1, t5.c1, t6.c1 from test.t_nopart_1 t1, test.t_nopart_2 t2, test.t_nopart_3 t3, test.t_nopart_4 t4, test.t_nopart_5 t5, test.t_nopart_6 t6;
c1	c1	c1	c1	c1	c1
2	2	2	2	2	2
update test.t_part set pk = pk+100;
update test.t_subpart set c1=c1+100;
select * from test.t_part order by pk;
pk	c1
200	0
201	1
202	2
203	3
204	4
205	5
206	6
207	7
208	8
209	9
211	1
212	2
select * from test.t_subpart order by c0;
c0	c1	c2
0	200	NULL
1	201	NULL
2	202	NULL
3	203	NULL
4	204	NULL
5	205	NULL
6	206	NULL
7	207	NULL
8	208	NULL
9	209	NULL
11	201	NULL
12	202	NULL
===============================================================
=================   delete tenant data    =====================
===============================================================
set recyclebin = off;
delete from t_nopart_1;
delete from t_nopart_2;
delete from t_nopart_3;
delete from t_nopart_4;
delete from t_nopart_5;
delete from t_nopart_6;
delete from t_part;
delete from t_subpart;
===============================================================
==============     prepare transfer data   ====================
===============================================================
create table if not exists t_part(pk int primary key, c1 longtext) partition by hash(pk) partitions 6;
create index if not exists idx_t_part on t_part(pk);
insert into t_part values (1, 1), (2,2), (3,3), (4,4), (5,5), (6,6), (7,7), (8,8), (9,9), (0,0), (11, 1), (12,2);
create table if not exists t_subpart(c0 int, c1 int, c2 longtext, primary key (c0, c1)) partition by hash(c0) subpartition by hash(c1) subpartitions 3 partitions 2;
create index if not exists idx_t_subpart on t_subpart(c0, c1);
insert into t_subpart (c0, c1) values (1, 1), (2,2), (3,3), (4,4), (5,5), (6,6), (7,7), (8,8), (9,9), (0,0), (11, 1), (12,2);
create table if not exists t_nopart_1(c1 int);
create table if not exists t_nopart_2(c1 int);
create table if not exists t_nopart_3(c1 int);
create table if not exists t_nopart_4(c1 int);
create table if not exists t_nopart_5(c1 int);
create table if not exists t_nopart_6(c1 int);
insert into t_nopart_1 values (0);
insert into t_nopart_2 values (0);
insert into t_nopart_3 values (0);
insert into t_nopart_4 values (0);
insert into t_nopart_5 values (0);
insert into t_nopart_6 values (0);
SELECT TABLE_ID, TABLE_NAME, PARTITION_NAME, SUBPARTITION_NAME, TABLET_ID, LS_ID FROM oceanbase.DBA_OB_TABLE_LOCATIONS WHERE TABLE_ID >= 500000 AND ROLE = 'LEADER';
TABLE_ID	TABLE_NAME	PARTITION_NAME	SUBPARTITION_NAME	TABLET_ID	LS_ID
500002	t_part	p0	NULL	200001	1001
500002	t_part	p1	NULL	200002	1001
500002	t_part	p2	NULL	200003	1001
500002	t_part	p3	NULL	200004	1001
500002	t_part	p4	NULL	200005	1001
500002	t_part	p5	NULL	200006	1001
500003	__AUX_LOB_META_500003_	p0	NULL	1152921504606846977	1001
500003	__AUX_LOB_META_500003_	p1	NULL	1152921504606846978	1001
500003	__AUX_LOB_META_500003_	p2	NULL	1152921504606846979	1001
500003	__AUX_LOB_META_500003_	p3	NULL	1152921504606846980	1001
500003	__AUX_LOB_META_500003_	p4	NULL	1152921504606846981	1001
500003	__AUX_LOB_META_500003_	p5	NULL	1152921504606846982	1001
500004	__AUX_LOB_PIECE_500004_	p0	NULL	1152921504606846983	1001
500004	__AUX_LOB_PIECE_500004_	p1	NULL	1152921504606846984	1001
500004	__AUX_LOB_PIECE_500004_	p2	NULL	1152921504606846985	1001
500004	__AUX_LOB_PIECE_500004_	p3	NULL	1152921504606846986	1001
500004	__AUX_LOB_PIECE_500004_	p4	NULL	1152921504606846987	1001
500004	__AUX_LOB_PIECE_500004_	p5	NULL	1152921504606846988	1001
500029	__idx_500002_idx_t_part	p0	NULL	1152921504606846989	1001
500029	__idx_500002_idx_t_part	p1	NULL	1152921504606846990	1001
500029	__idx_500002_idx_t_part	p2	NULL	1152921504606846991	1001
500029	__idx_500002_idx_t_part	p3	NULL	1152921504606846992	1001
500029	__idx_500002_idx_t_part	p4	NULL	1152921504606846993	1001
500029	__idx_500002_idx_t_part	p5	NULL	1152921504606846994	1001
500030	t_subpart	p0	p0sp0	200007	1001
500030	t_subpart	p0	p0sp1	200008	1001
500030	t_subpart	p0	p0sp2	200009	1001
500030	t_subpart	p1	p1sp0	200010	1001
500030	t_subpart	p1	p1sp1	200011	1001
500030	t_subpart	p1	p1sp2	200012	1001
500031	__AUX_LOB_META_500031_	p0	p0sp0	1152921504606846995	1001
500031	__AUX_LOB_META_500031_	p0	p0sp1	1152921504606846996	1001
500031	__AUX_LOB_META_500031_	p0	p0sp2	1152921504606846997	1001
500031	__AUX_LOB_META_500031_	p1	p1sp0	1152921504606846998	1001
500031	__AUX_LOB_META_500031_	p1	p1sp1	1152921504606846999	1001
500031	__AUX_LOB_META_500031_	p1	p1sp2	1152921504606847000	1001
500032	__AUX_LOB_PIECE_500032_	p0	p0sp0	1152921504606847001	1001
500032	__AUX_LOB_PIECE_500032_	p0	p0sp1	1152921504606847002	1001
500032	__AUX_LOB_PIECE_500032_	p0	p0sp2	1152921504606847003	1001
500032	__AUX_LOB_PIECE_500032_	p1	p1sp0	1152921504606847004	1001
500032	__AUX_LOB_PIECE_500032_	p1	p1sp1	1152921504606847005	1001
500032	__AUX_LOB_PIECE_500032_	p1	p1sp2	1152921504606847006	1001
500065	__idx_500030_idx_t_subpart	p0	p0sp0	1152921504606847007	1001
500065	__idx_500030_idx_t_subpart	p0	p0sp1	1152921504606847008	1001
500065	__idx_500030_idx_t_subpart	p0	p0sp2	1152921504606847009	1001
500065	__idx_500030_idx_t_subpart	p1	p1sp0	1152921504606847010	1001
500065	__idx_500030_idx_t_subpart	p1	p1sp1	1152921504606847011	1001
500065	__idx_500030_idx_t_subpart	p1	p1sp2	1152921504606847012	1001
500066	t_nopart_1	NULL	NULL	200013	1001
500067	t_nopart_2	NULL	NULL	200014	1001
500068	t_nopart_3	NULL	NULL	200015	1001
500069	t_nopart_4	NULL	NULL	200016	1001
500070	t_nopart_5	NULL	NULL	200017	1001
500071	t_nopart_6	NULL	NULL	200018	1001
SELECT LS_ID, STATUS, PRIMARY_ZONE FROM oceanbase.DBA_OB_LS;
LS_ID	STATUS	PRIMARY_ZONE
1	NORMAL	z1;z2,z3
1001	NORMAL	z1;z2,z3
===============================================================
==============  primary zone from 1 to 2   ====================
===============================================================
alter tenant mysql set primary_zone = 'z1,z2';
===============================================================
================     verify transfer    =======================
===============================================================
ob1.check_until_timeout select count(*) from oceanbase.__all_virtual_balance_job_history where tenant_id = $mysql_tenant_id, 1, 300;
ob1.check_until_timeout select count(*) from oceanbase.__all_virtual_balance_job where tenant_id = $mysql_tenant_id, 0, 60;
ob1.check_until_timeout select count(*) from oceanbase.CDB_OB_LS where tenant_id = $mysql_tenant_id and status != 'NORMAL', 0, 100;
SELECT LS_ID, STATUS, PRIMARY_ZONE FROM oceanbase.DBA_OB_LS;
LS_ID	STATUS	PRIMARY_ZONE
1	NORMAL	z1;z2;z3
1001	NORMAL	z1;z2;z3
1004	NORMAL	z2;z1;z3
SELECT DISTINCT TABLE_ID, TABLE_NAME, PARTITION_NAME, TABLET_ID, LS_ID FROM oceanbase.DBA_OB_TABLE_LOCATIONS WHERE TABLE_ID >= 500000 ORDER BY TABLE_ID, TABLET_ID;
TABLE_ID	TABLE_NAME	PARTITION_NAME	TABLET_ID	LS_ID
500002	t_part	p0	200001	1001
500002	t_part	p1	200002	1001
500002	t_part	p2	200003	1001
500002	t_part	p3	200004	1004
500002	t_part	p4	200005	1004
500002	t_part	p5	200006	1004
500003	__AUX_LOB_META_500003_	p0	1152921504606846977	1001
500003	__AUX_LOB_META_500003_	p1	1152921504606846978	1001
500003	__AUX_LOB_META_500003_	p2	1152921504606846979	1001
500003	__AUX_LOB_META_500003_	p3	1152921504606846980	1004
500003	__AUX_LOB_META_500003_	p4	1152921504606846981	1004
500003	__AUX_LOB_META_500003_	p5	1152921504606846982	1004
500004	__AUX_LOB_PIECE_500004_	p0	1152921504606846983	1001
500004	__AUX_LOB_PIECE_500004_	p1	1152921504606846984	1001
500004	__AUX_LOB_PIECE_500004_	p2	1152921504606846985	1001
500004	__AUX_LOB_PIECE_500004_	p3	1152921504606846986	1004
500004	__AUX_LOB_PIECE_500004_	p4	1152921504606846987	1004
500004	__AUX_LOB_PIECE_500004_	p5	1152921504606846988	1004
500029	__idx_500002_idx_t_part	p0	1152921504606846989	1001
500029	__idx_500002_idx_t_part	p1	1152921504606846990	1001
500029	__idx_500002_idx_t_part	p2	1152921504606846991	1001
500029	__idx_500002_idx_t_part	p3	1152921504606846992	1004
500029	__idx_500002_idx_t_part	p4	1152921504606846993	1004
500029	__idx_500002_idx_t_part	p5	1152921504606846994	1004
500030	t_subpart	p0	200007	1001
500030	t_subpart	p0	200008	1001
500030	t_subpart	p0	200009	1004
500030	t_subpart	p1	200010	1001
500030	t_subpart	p1	200011	1001
500030	t_subpart	p1	200012	1004
500031	__AUX_LOB_META_500031_	p0	1152921504606846995	1001
500031	__AUX_LOB_META_500031_	p0	1152921504606846996	1001
500031	__AUX_LOB_META_500031_	p0	1152921504606846997	1004
500031	__AUX_LOB_META_500031_	p1	1152921504606846998	1001
500031	__AUX_LOB_META_500031_	p1	1152921504606846999	1001
500031	__AUX_LOB_META_500031_	p1	1152921504606847000	1004
500032	__AUX_LOB_PIECE_500032_	p0	1152921504606847001	1001
500032	__AUX_LOB_PIECE_500032_	p0	1152921504606847002	1001
500032	__AUX_LOB_PIECE_500032_	p0	1152921504606847003	1004
500032	__AUX_LOB_PIECE_500032_	p1	1152921504606847004	1001
500032	__AUX_LOB_PIECE_500032_	p1	1152921504606847005	1001
500032	__AUX_LOB_PIECE_500032_	p1	1152921504606847006	1004
500065	__idx_500030_idx_t_subpart	p0	1152921504606847007	1001
500065	__idx_500030_idx_t_subpart	p0	1152921504606847008	1001
500065	__idx_500030_idx_t_subpart	p0	1152921504606847009	1004
500065	__idx_500030_idx_t_subpart	p1	1152921504606847010	1001
500065	__idx_500030_idx_t_subpart	p1	1152921504606847011	1001
500065	__idx_500030_idx_t_subpart	p1	1152921504606847012	1004
500066	t_nopart_1	NULL	200013	1001
500067	t_nopart_2	NULL	200014	1001
500068	t_nopart_3	NULL	200015	1001
500069	t_nopart_4	NULL	200016	1004
500070	t_nopart_5	NULL	200017	1004
500071	t_nopart_6	NULL	200018	1004
SELECT JOB_TYPE, TARGET_UNIT_NUM, TARGET_PRIMARY_ZONE_NUM, STATUS, COMMENT, BALANCE_STRATEGY_NAME FROM oceanbase.__all_balance_job_history;
JOB_TYPE	TARGET_UNIT_NUM	TARGET_PRIMARY_ZONE_NUM	STATUS	COMMENT	BALANCE_STRATEGY_NAME
LS_BALANCE	1	2	COMPLETED	NULL	LS balance by expand
SELECT task_type, src_ls, dest_ls, part_list, finished_part_list, part_count, finished_part_count, ls_group_id, status, parent_list FROM oceanbase.__all_balance_task_history;
task_type	src_ls	dest_ls	part_list	finished_part_list	part_count	finished_part_count	ls_group_id	status	parent_list
LS_SPLIT	1001	1004	NULL	500002:500008,500002:500009,500002:500010,500030:500037,500030:500040,500069:500069,500070:500070,500071:500071	0	8	1001	COMPLETED	NULL
SELECT src_ls, dest_ls, part_list, part_count, not_exist_part_list, lock_conflict_part_list, table_lock_tablet_list, tablet_list, tablet_count, status, result, comment FROM oceanbase.__all_transfer_task_history;
src_ls	dest_ls	part_list	part_count	not_exist_part_list	lock_conflict_part_list	table_lock_tablet_list	tablet_list	tablet_count	status	result	comment
1001	1004	500002:500008,500002:500009,500002:500010,500030:500037,500030:500040,500069:500069,500070:500070,500071:500071	8	NULL	NULL	200004,200005,200006,200009,200012	200004:0,200005:1,200006:1,200009:0,200012:1,200016:0,200017:1,200018:1,1152921504606846980:0,1152921504606846981:1,1152921504606846982:1,1152921504606846986:0,1152921504606846987:1,1152921504606846988:1,1152921504606846992:0,1152921504606846993:1,1152921504606846994:1,1152921504606846997:0,1152921504606847000:1,1152921504606847003:0,1152921504606847006:1,1152921504606847009:0,1152921504606847012:1	23	COMPLETED	0	
alter system change tenant mysql;
DELETE FROM oceanbase.__all_balance_job_history;
DELETE FROM oceanbase.__all_balance_task_history;
DELETE FROM oceanbase.__all_transfer_task_history;
alter system change tenant sys;
update test.t_nopart_1 set c1=c1+1;
update test.t_nopart_2 set c1=c1+1;
update test.t_nopart_3 set c1=c1+1;
update test.t_nopart_4 set c1=c1+1;
update test.t_nopart_5 set c1=c1+1;
update test.t_nopart_6 set c1=c1+1;
select t1.c1, t2.c1, t3.c1, t4.c1, t5.c1, t6.c1 from test.t_nopart_1 t1, test.t_nopart_2 t2, test.t_nopart_3 t3, test.t_nopart_4 t4, test.t_nopart_5 t5, test.t_nopart_6 t6;
c1	c1	c1	c1	c1	c1
1	1	1	1	1	1
update test.t_part set pk = pk+100;
update test.t_subpart set c1=c1+100;
select * from test.t_part order by pk;
pk	c1
100	0
101	1
102	2
103	3
104	4
105	5
106	6
107	7
108	8
109	9
111	1
112	2
select * from test.t_subpart order by c0;
c0	c1	c2
0	100	NULL
1	101	NULL
2	102	NULL
3	103	NULL
4	104	NULL
5	105	NULL
6	106	NULL
7	107	NULL
8	108	NULL
9	109	NULL
11	101	NULL
12	102	NULL
===============================================================
=================     restart cluster    ======================
===============================================================
test restart cluster begin
ob1.force_stop;
ob1.nstart;
ob1.check_until_timeout select count(*) as cnt from oceanbase.__all_server where start_service_time <= $stop_tstamp_usec, 0 ,180;
ob1.check_until_timeout select count(*) from oceanbase.__all_server a left join oceanbase.__all_virtual_server_schema_info b on a.svr_ip = b.svr_ip and a.svr_port = b.svr_port where b.svr_ip is null, 0, 120;
ob1.check_until_timeout select count(*) as cnt from oceanbase.__all_virtual_server_schema_info as a join oceanbase.__all_virtual_server_schema_info as b on a.tenant_id = b.tenant_id  where a.refreshed_schema_version != b.refreshed_schema_version or a.refreshed_schema_version % 8 != 0, 0, 180;
ob1.check_until_timeout select count(*) from __all_virtual_memory_info where mod_name like '%OB_MOD_DO_NOT_USE_ME%' and hold != 0, 0, 10;
test restart cluster finish
===============================================================
==============     switch replica leader    ===================
===============================================================
test switch mysql replica leader begin
count(*)
0
ob1.check_until_timeout select count(*) from __all_virtual_ls_meta_table where tenant_id = '$mysql_tenant_id' and svr_ip = '$follower1_svr_ip' and svr_port='$follower1_svr_port' and ls_id = $ls_id and role = 1, 1, 6;
count(*)
1
ob1.check_until_timeout select count(*) from __all_virtual_ls_meta_table where tenant_id = '$mysql_tenant_id' and svr_ip = '$leader_svr_ip' and svr_port='$leader_svr_port' and ls_id = $ls_id and role = 1, 1, 6;
count(*)
1
create table if not exists t_for_switch (c1 int);
ob1.check_until_timeout select count(*) as cnt from oceanbase.__all_virtual_server_schema_info as a join oceanbase.__all_virtual_server_schema_info as b on a.tenant_id = b.tenant_id  where a.refreshed_schema_version != b.refreshed_schema_version, 0, 60;
begin;
insert into t_for_switch values (1);
ob1.check_until_timeout select count(*) from __all_virtual_ls_meta_table where tenant_id = '$mysql_tenant_id' and svr_ip = '$follower1_svr_ip' and svr_port='$follower1_svr_port' and ls_id = $ls_id and role = 1, 1, 6;
count(*)
1
commit;
select * from t_for_switch order by c1 asc;
c1
1
ob1.check_until_timeout select count(*) from __all_virtual_ls_meta_table where tenant_id = '$mysql_tenant_id' and svr_ip = '$leader_svr_ip' and svr_port='$leader_svr_port' and ls_id = $ls_id and role = 1, 1, 6;
count(*)
1
begin;
insert into t_for_switch values (2);
ob1.check_until_timeout select count(*) from __all_virtual_ls_meta_table where tenant_id = '$mysql_tenant_id' and svr_ip = '$follower1_svr_ip' and svr_port='$follower1_svr_port' and ls_id = $ls_id and role = 1, 1, 6;
count(*)
1
insert into t_for_switch values (3);
commit;
select * from t_for_switch order by c1 asc;
c1
1
2
3
ob1.check_until_timeout select count(*) from __all_virtual_ls_meta_table where tenant_id = '$mysql_tenant_id' and svr_ip = '$leader_svr_ip' and svr_port='$leader_svr_port' and ls_id = $ls_id and role = 1, 1, 6;
count(*)
1
set recyclebin = off;
DROP TABLE IF EXISTS t_for_switch;
test switch mysql replica leader finish
update test.t_nopart_1 set c1=c1+1;
update test.t_nopart_2 set c1=c1+1;
update test.t_nopart_3 set c1=c1+1;
update test.t_nopart_4 set c1=c1+1;
update test.t_nopart_5 set c1=c1+1;
update test.t_nopart_6 set c1=c1+1;
select t1.c1, t2.c1, t3.c1, t4.c1, t5.c1, t6.c1 from test.t_nopart_1 t1, test.t_nopart_2 t2, test.t_nopart_3 t3, test.t_nopart_4 t4, test.t_nopart_5 t5, test.t_nopart_6 t6;
c1	c1	c1	c1	c1	c1
2	2	2	2	2	2
update test.t_part set pk = pk+100;
update test.t_subpart set c1=c1+100;
select * from test.t_part order by pk;
pk	c1
200	0
201	1
202	2
203	3
204	4
205	5
206	6
207	7
208	8
209	9
211	1
212	2
select * from test.t_subpart order by c0;
c0	c1	c2
0	200	NULL
1	201	NULL
2	202	NULL
3	203	NULL
4	204	NULL
5	205	NULL
6	206	NULL
7	207	NULL
8	208	NULL
9	209	NULL
11	201	NULL
12	202	NULL
===============================================================
=================   delete tenant data    =====================
===============================================================
set recyclebin = off;
delete from t_nopart_1;
delete from t_nopart_2;
delete from t_nopart_3;
delete from t_nopart_4;
delete from t_nopart_5;
delete from t_nopart_6;
delete from t_part;
delete from t_subpart;
===============================================================
==============     prepare transfer data   ====================
===============================================================
create table if not exists t_part(pk int primary key, c1 longtext) partition by hash(pk) partitions 6;
create index if not exists idx_t_part on t_part(pk);
insert into t_part values (1, 1), (2,2), (3,3), (4,4), (5,5), (6,6), (7,7), (8,8), (9,9), (0,0), (11, 1), (12,2);
create table if not exists t_subpart(c0 int, c1 int, c2 longtext, primary key (c0, c1)) partition by hash(c0) subpartition by hash(c1) subpartitions 3 partitions 2;
create index if not exists idx_t_subpart on t_subpart(c0, c1);
insert into t_subpart (c0, c1) values (1, 1), (2,2), (3,3), (4,4), (5,5), (6,6), (7,7), (8,8), (9,9), (0,0), (11, 1), (12,2);
create table if not exists t_nopart_1(c1 int);
create table if not exists t_nopart_2(c1 int);
create table if not exists t_nopart_3(c1 int);
create table if not exists t_nopart_4(c1 int);
create table if not exists t_nopart_5(c1 int);
create table if not exists t_nopart_6(c1 int);
insert into t_nopart_1 values (0);
insert into t_nopart_2 values (0);
insert into t_nopart_3 values (0);
insert into t_nopart_4 values (0);
insert into t_nopart_5 values (0);
insert into t_nopart_6 values (0);
SELECT TABLE_ID, TABLE_NAME, PARTITION_NAME, SUBPARTITION_NAME, TABLET_ID, LS_ID FROM oceanbase.DBA_OB_TABLE_LOCATIONS WHERE TABLE_ID >= 500000 AND ROLE = 'LEADER';
TABLE_ID	TABLE_NAME	PARTITION_NAME	SUBPARTITION_NAME	TABLET_ID	LS_ID
500002	t_part	p0	NULL	200001	1001
500002	t_part	p1	NULL	200002	1001
500002	t_part	p2	NULL	200003	1001
500002	t_part	p3	NULL	200004	1004
500002	t_part	p4	NULL	200005	1004
500002	t_part	p5	NULL	200006	1004
500003	__AUX_LOB_META_500003_	p0	NULL	1152921504606846977	1001
500003	__AUX_LOB_META_500003_	p1	NULL	1152921504606846978	1001
500003	__AUX_LOB_META_500003_	p2	NULL	1152921504606846979	1001
500003	__AUX_LOB_META_500003_	p3	NULL	1152921504606846980	1004
500003	__AUX_LOB_META_500003_	p4	NULL	1152921504606846981	1004
500003	__AUX_LOB_META_500003_	p5	NULL	1152921504606846982	1004
500004	__AUX_LOB_PIECE_500004_	p0	NULL	1152921504606846983	1001
500004	__AUX_LOB_PIECE_500004_	p1	NULL	1152921504606846984	1001
500004	__AUX_LOB_PIECE_500004_	p2	NULL	1152921504606846985	1001
500004	__AUX_LOB_PIECE_500004_	p3	NULL	1152921504606846986	1004
500004	__AUX_LOB_PIECE_500004_	p4	NULL	1152921504606846987	1004
500004	__AUX_LOB_PIECE_500004_	p5	NULL	1152921504606846988	1004
500029	__idx_500002_idx_t_part	p0	NULL	1152921504606846989	1001
500029	__idx_500002_idx_t_part	p1	NULL	1152921504606846990	1001
500029	__idx_500002_idx_t_part	p2	NULL	1152921504606846991	1001
500029	__idx_500002_idx_t_part	p3	NULL	1152921504606846992	1004
500029	__idx_500002_idx_t_part	p4	NULL	1152921504606846993	1004
500029	__idx_500002_idx_t_part	p5	NULL	1152921504606846994	1004
500030	t_subpart	p0	p0sp0	200007	1001
500030	t_subpart	p0	p0sp1	200008	1001
500030	t_subpart	p0	p0sp2	200009	1004
500030	t_subpart	p1	p1sp0	200010	1001
500030	t_subpart	p1	p1sp1	200011	1001
500030	t_subpart	p1	p1sp2	200012	1004
500031	__AUX_LOB_META_500031_	p0	p0sp0	1152921504606846995	1001
500031	__AUX_LOB_META_500031_	p0	p0sp1	1152921504606846996	1001
500031	__AUX_LOB_META_500031_	p0	p0sp2	1152921504606846997	1004
500031	__AUX_LOB_META_500031_	p1	p1sp0	1152921504606846998	1001
500031	__AUX_LOB_META_500031_	p1	p1sp1	1152921504606846999	1001
500031	__AUX_LOB_META_500031_	p1	p1sp2	1152921504606847000	1004
500032	__AUX_LOB_PIECE_500032_	p0	p0sp0	1152921504606847001	1001
500032	__AUX_LOB_PIECE_500032_	p0	p0sp1	1152921504606847002	1001
500032	__AUX_LOB_PIECE_500032_	p0	p0sp2	1152921504606847003	1004
500032	__AUX_LOB_PIECE_500032_	p1	p1sp0	1152921504606847004	1001
500032	__AUX_LOB_PIECE_500032_	p1	p1sp1	1152921504606847005	1001
500032	__AUX_LOB_PIECE_500032_	p1	p1sp2	1152921504606847006	1004
500065	__idx_500030_idx_t_subpart	p0	p0sp0	1152921504606847007	1001
500065	__idx_500030_idx_t_subpart	p0	p0sp1	1152921504606847008	1001
500065	__idx_500030_idx_t_subpart	p0	p0sp2	1152921504606847009	1004
500065	__idx_500030_idx_t_subpart	p1	p1sp0	1152921504606847010	1001
500065	__idx_500030_idx_t_subpart	p1	p1sp1	1152921504606847011	1001
500065	__idx_500030_idx_t_subpart	p1	p1sp2	1152921504606847012	1004
500066	t_nopart_1	NULL	NULL	200013	1001
500067	t_nopart_2	NULL	NULL	200014	1001
500068	t_nopart_3	NULL	NULL	200015	1001
500069	t_nopart_4	NULL	NULL	200016	1004
500070	t_nopart_5	NULL	NULL	200017	1004
500071	t_nopart_6	NULL	NULL	200018	1004
SELECT LS_ID, STATUS, PRIMARY_ZONE FROM oceanbase.DBA_OB_LS;
LS_ID	STATUS	PRIMARY_ZONE
1	NORMAL	z1;z2;z3
1001	NORMAL	z1;z2;z3
1004	NORMAL	z2;z1;z3
===============================================================
==============  primary zone from 2 to 3   ====================
===============================================================
alter tenant mysql set primary_zone = RANDOM;
===============================================================
================     verify transfer    =======================
===============================================================
ob1.check_until_timeout select count(*) from oceanbase.__all_virtual_balance_job_history where tenant_id = $mysql_tenant_id, 1, 300;
ob1.check_until_timeout select count(*) from oceanbase.__all_virtual_balance_job where tenant_id = $mysql_tenant_id, 0, 60;
ob1.check_until_timeout select count(*) from oceanbase.CDB_OB_LS where tenant_id = $mysql_tenant_id and status != 'NORMAL', 0, 100;
SELECT LS_ID, STATUS, PRIMARY_ZONE FROM oceanbase.DBA_OB_LS;
LS_ID	STATUS	PRIMARY_ZONE
1	NORMAL	z1;z2,z3
1001	NORMAL	z1;z2,z3
1004	NORMAL	z2;z1,z3
1005	NORMAL	z3;z1,z2
SELECT DISTINCT TABLE_ID, TABLE_NAME, PARTITION_NAME, TABLET_ID, LS_ID FROM oceanbase.DBA_OB_TABLE_LOCATIONS WHERE TABLE_ID >= 500000 ORDER BY TABLE_ID, TABLET_ID;
TABLE_ID	TABLE_NAME	PARTITION_NAME	TABLET_ID	LS_ID
500002	t_part	p0	200001	1001
500002	t_part	p1	200002	1001
500002	t_part	p2	200003	1005
500002	t_part	p3	200004	1004
500002	t_part	p4	200005	1004
500002	t_part	p5	200006	1005
500003	__AUX_LOB_META_500003_	p0	1152921504606846977	1001
500003	__AUX_LOB_META_500003_	p1	1152921504606846978	1001
500003	__AUX_LOB_META_500003_	p2	1152921504606846979	1005
500003	__AUX_LOB_META_500003_	p3	1152921504606846980	1004
500003	__AUX_LOB_META_500003_	p4	1152921504606846981	1004
500003	__AUX_LOB_META_500003_	p5	1152921504606846982	1005
500004	__AUX_LOB_PIECE_500004_	p0	1152921504606846983	1001
500004	__AUX_LOB_PIECE_500004_	p1	1152921504606846984	1001
500004	__AUX_LOB_PIECE_500004_	p2	1152921504606846985	1005
500004	__AUX_LOB_PIECE_500004_	p3	1152921504606846986	1004
500004	__AUX_LOB_PIECE_500004_	p4	1152921504606846987	1004
500004	__AUX_LOB_PIECE_500004_	p5	1152921504606846988	1005
500029	__idx_500002_idx_t_part	p0	1152921504606846989	1001
500029	__idx_500002_idx_t_part	p1	1152921504606846990	1001
500029	__idx_500002_idx_t_part	p2	1152921504606846991	1005
500029	__idx_500002_idx_t_part	p3	1152921504606846992	1004
500029	__idx_500002_idx_t_part	p4	1152921504606846993	1004
500029	__idx_500002_idx_t_part	p5	1152921504606846994	1005
500030	t_subpart	p0	200007	1001
500030	t_subpart	p0	200008	1005
500030	t_subpart	p0	200009	1004
500030	t_subpart	p1	200010	1001
500030	t_subpart	p1	200011	1005
500030	t_subpart	p1	200012	1004
500031	__AUX_LOB_META_500031_	p0	1152921504606846995	1001
500031	__AUX_LOB_META_500031_	p0	1152921504606846996	1005
500031	__AUX_LOB_META_500031_	p0	1152921504606846997	1004
500031	__AUX_LOB_META_500031_	p1	1152921504606846998	1001
500031	__AUX_LOB_META_500031_	p1	1152921504606846999	1005
500031	__AUX_LOB_META_500031_	p1	1152921504606847000	1004
500032	__AUX_LOB_PIECE_500032_	p0	1152921504606847001	1001
500032	__AUX_LOB_PIECE_500032_	p0	1152921504606847002	1005
500032	__AUX_LOB_PIECE_500032_	p0	1152921504606847003	1004
500032	__AUX_LOB_PIECE_500032_	p1	1152921504606847004	1001
500032	__AUX_LOB_PIECE_500032_	p1	1152921504606847005	1005
500032	__AUX_LOB_PIECE_500032_	p1	1152921504606847006	1004
500065	__idx_500030_idx_t_subpart	p0	1152921504606847007	1001
500065	__idx_500030_idx_t_subpart	p0	1152921504606847008	1005
500065	__idx_500030_idx_t_subpart	p0	1152921504606847009	1004
500065	__idx_500030_idx_t_subpart	p1	1152921504606847010	1001
500065	__idx_500030_idx_t_subpart	p1	1152921504606847011	1005
500065	__idx_500030_idx_t_subpart	p1	1152921504606847012	1004
500066	t_nopart_1	NULL	200013	1001
500067	t_nopart_2	NULL	200014	1001
500068	t_nopart_3	NULL	200015	1005
500069	t_nopart_4	NULL	200016	1004
500070	t_nopart_5	NULL	200017	1004
500071	t_nopart_6	NULL	200018	1005
SELECT JOB_TYPE, TARGET_UNIT_NUM, TARGET_PRIMARY_ZONE_NUM, STATUS, COMMENT, BALANCE_STRATEGY_NAME FROM oceanbase.__all_balance_job_history;
JOB_TYPE	TARGET_UNIT_NUM	TARGET_PRIMARY_ZONE_NUM	STATUS	COMMENT	BALANCE_STRATEGY_NAME
LS_BALANCE	1	3	COMPLETED	NULL	LS balance by expand
SELECT task_type, src_ls, dest_ls, part_list, finished_part_list, part_count, finished_part_count, ls_group_id, status, parent_list FROM oceanbase.__all_balance_task_history;
task_type	src_ls	dest_ls	part_list	finished_part_list	part_count	finished_part_count	ls_group_id	status	parent_list
LS_SPLIT	1001	1005	NULL	500002:500007,500030:500036,500030:500039,500068:500068	0	4	1001	COMPLETED	NULL
LS_SPLIT	1004	1006	NULL	500002:500010,500071:500071	0	2	1001	COMPLETED	NULL
LS_MERGE	1006	1005	NULL	500002:500010,500071:500071	0	2	1001	COMPLETED	NULL
SELECT src_ls, dest_ls, part_list, part_count, not_exist_part_list, lock_conflict_part_list, table_lock_tablet_list, tablet_list, tablet_count, status, result, comment FROM oceanbase.__all_transfer_task_history;
src_ls	dest_ls	part_list	part_count	not_exist_part_list	lock_conflict_part_list	table_lock_tablet_list	tablet_list	tablet_count	status	result	comment
1001	1005	500002:500007,500030:500036,500030:500039,500068:500068	4	NULL	NULL	200003,200008,200011	200003:1,200008:1,200011:0,200015:1,1152921504606846979:1,1152921504606846985:1,1152921504606846991:1,1152921504606846996:1,1152921504606846999:0,1152921504606847002:1,1152921504606847005:0,1152921504606847008:1,1152921504606847011:0	13	COMPLETED	0	
1004	1006	500002:500010,500071:500071	2	NULL	NULL	200006	200006:2,200018:2,1152921504606846982:2,1152921504606846988:2,1152921504606846994:2	5	COMPLETED	0	
1006	1005	500002:500010,500071:500071	2	NULL	NULL	200006	200006:3,200018:3,1152921504606846982:3,1152921504606846988:3,1152921504606846994:3	5	COMPLETED	0	
alter system change tenant mysql;
DELETE FROM oceanbase.__all_balance_job_history;
DELETE FROM oceanbase.__all_balance_task_history;
DELETE FROM oceanbase.__all_transfer_task_history;
alter system change tenant sys;
update test.t_nopart_1 set c1=c1+1;
update test.t_nopart_2 set c1=c1+1;
update test.t_nopart_3 set c1=c1+1;
update test.t_nopart_4 set c1=c1+1;
update test.t_nopart_5 set c1=c1+1;
update test.t_nopart_6 set c1=c1+1;
select t1.c1, t2.c1, t3.c1, t4.c1, t5.c1, t6.c1 from test.t_nopart_1 t1, test.t_nopart_2 t2, test.t_nopart_3 t3, test.t_nopart_4 t4, test.t_nopart_5 t5, test.t_nopart_6 t6;
c1	c1	c1	c1	c1	c1
1	1	1	1	1	1
update test.t_part set pk = pk+100;
update test.t_subpart set c1=c1+100;
select * from test.t_part order by pk;
pk	c1
100	0
101	1
102	2
103	3
104	4
105	5
106	6
107	7
108	8
109	9
111	1
112	2
select * from test.t_subpart order by c0;
c0	c1	c2
0	100	NULL
1	101	NULL
2	102	NULL
3	103	NULL
4	104	NULL
5	105	NULL
6	106	NULL
7	107	NULL
8	108	NULL
9	109	NULL
11	101	NULL
12	102	NULL
===============================================================
=================     restart cluster    ======================
===============================================================
test restart cluster begin
ob1.force_stop;
ob1.nstart;
ob1.check_until_timeout select count(*) as cnt from oceanbase.__all_server where start_service_time <= $stop_tstamp_usec, 0 ,180;
ob1.check_until_timeout select count(*) from oceanbase.__all_server a left join oceanbase.__all_virtual_server_schema_info b on a.svr_ip = b.svr_ip and a.svr_port = b.svr_port where b.svr_ip is null, 0, 120;
ob1.check_until_timeout select count(*) as cnt from oceanbase.__all_virtual_server_schema_info as a join oceanbase.__all_virtual_server_schema_info as b on a.tenant_id = b.tenant_id  where a.refreshed_schema_version != b.refreshed_schema_version or a.refreshed_schema_version % 8 != 0, 0, 180;
ob1.check_until_timeout select count(*) from __all_virtual_memory_info where mod_name like '%OB_MOD_DO_NOT_USE_ME%' and hold != 0, 0, 10;
test restart cluster finish
===============================================================
==============     switch replica leader    ===================
===============================================================
test switch mysql replica leader begin
count(*)
0
ob1.check_until_timeout select count(*) from __all_virtual_ls_meta_table where tenant_id = '$mysql_tenant_id' and svr_ip = '$follower1_svr_ip' and svr_port='$follower1_svr_port' and ls_id = $ls_id and role = 1, 1, 6;
count(*)
1
ob1.check_until_timeout select count(*) from __all_virtual_ls_meta_table where tenant_id = '$mysql_tenant_id' and svr_ip = '$leader_svr_ip' and svr_port='$leader_svr_port' and ls_id = $ls_id and role = 1, 1, 6;
count(*)
1
create table if not exists t_for_switch (c1 int);
ob1.check_until_timeout select count(*) as cnt from oceanbase.__all_virtual_server_schema_info as a join oceanbase.__all_virtual_server_schema_info as b on a.tenant_id = b.tenant_id  where a.refreshed_schema_version != b.refreshed_schema_version, 0, 60;
begin;
insert into t_for_switch values (1);
ob1.check_until_timeout select count(*) from __all_virtual_ls_meta_table where tenant_id = '$mysql_tenant_id' and svr_ip = '$follower1_svr_ip' and svr_port='$follower1_svr_port' and ls_id = $ls_id and role = 1, 1, 6;
count(*)
1
commit;
select * from t_for_switch order by c1 asc;
c1
1
ob1.check_until_timeout select count(*) from __all_virtual_ls_meta_table where tenant_id = '$mysql_tenant_id' and svr_ip = '$leader_svr_ip' and svr_port='$leader_svr_port' and ls_id = $ls_id and role = 1, 1, 6;
count(*)
1
begin;
insert into t_for_switch values (2);
ob1.check_until_timeout select count(*) from __all_virtual_ls_meta_table where tenant_id = '$mysql_tenant_id' and svr_ip = '$follower1_svr_ip' and svr_port='$follower1_svr_port' and ls_id = $ls_id and role = 1, 1, 6;
count(*)
1
insert into t_for_switch values (3);
commit;
select * from t_for_switch order by c1 asc;
c1
1
2
3
ob1.check_until_timeout select count(*) from __all_virtual_ls_meta_table where tenant_id = '$mysql_tenant_id' and svr_ip = '$leader_svr_ip' and svr_port='$leader_svr_port' and ls_id = $ls_id and role = 1, 1, 6;
count(*)
1
set recyclebin = off;
DROP TABLE IF EXISTS t_for_switch;
test switch mysql replica leader finish
update test.t_nopart_1 set c1=c1+1;
update test.t_nopart_2 set c1=c1+1;
update test.t_nopart_3 set c1=c1+1;
update test.t_nopart_4 set c1=c1+1;
update test.t_nopart_5 set c1=c1+1;
update test.t_nopart_6 set c1=c1+1;
select t1.c1, t2.c1, t3.c1, t4.c1, t5.c1, t6.c1 from test.t_nopart_1 t1, test.t_nopart_2 t2, test.t_nopart_3 t3, test.t_nopart_4 t4, test.t_nopart_5 t5, test.t_nopart_6 t6;
c1	c1	c1	c1	c1	c1
2	2	2	2	2	2
update test.t_part set pk = pk+100;
update test.t_subpart set c1=c1+100;
select * from test.t_part order by pk;
pk	c1
200	0
201	1
202	2
203	3
204	4
205	5
206	6
207	7
208	8
209	9
211	1
212	2
select * from test.t_subpart order by c0;
c0	c1	c2
0	200	NULL
1	201	NULL
2	202	NULL
3	203	NULL
4	204	NULL
5	205	NULL
6	206	NULL
7	207	NULL
8	208	NULL
9	209	NULL
11	201	NULL
12	202	NULL
===============================================================
=================   reuse mysql tenant    =====================
===============================================================
set recyclebin = off;
delete from t_nopart_1;
delete from t_nopart_2;
delete from t_nopart_3;
delete from t_nopart_4;
delete from t_nopart_5;
delete from t_nopart_6;
delete from t_part;
delete from t_subpart;
alter tenant mysql set primary_zone = 'z1';
ob1.check_until_timeout select count(*) from oceanbase.__all_virtual_balance_job_history where tenant_id = $mysql_tenant_id, 1, 300;
ob1.check_until_timeout select count(*) from oceanbase.__all_virtual_balance_job where tenant_id = $mysql_tenant_id, 0, 60;
ob1.check_until_timeout select count(*) from oceanbase.CDB_OB_LS where tenant_id = $mysql_tenant_id and status != 'NORMAL', 0, 100;
SELECT LS_ID, STATUS, PRIMARY_ZONE FROM oceanbase.DBA_OB_LS;
LS_ID	STATUS	PRIMARY_ZONE
1	NORMAL	z1;z2,z3
1001	NORMAL	z1;z2,z3
SELECT DISTINCT TABLE_ID, TABLE_NAME, PARTITION_NAME, TABLET_ID, LS_ID FROM oceanbase.DBA_OB_TABLE_LOCATIONS WHERE TABLE_ID >= 500000 ORDER BY TABLE_ID, TABLET_ID;
TABLE_ID	TABLE_NAME	PARTITION_NAME	TABLET_ID	LS_ID
500002	t_part	p0	200001	1001
500002	t_part	p1	200002	1001
500002	t_part	p2	200003	1001
500002	t_part	p3	200004	1001
500002	t_part	p4	200005	1001
500002	t_part	p5	200006	1001
500003	__AUX_LOB_META_500003_	p0	1152921504606846977	1001
500003	__AUX_LOB_META_500003_	p1	1152921504606846978	1001
500003	__AUX_LOB_META_500003_	p2	1152921504606846979	1001
500003	__AUX_LOB_META_500003_	p3	1152921504606846980	1001
500003	__AUX_LOB_META_500003_	p4	1152921504606846981	1001
500003	__AUX_LOB_META_500003_	p5	1152921504606846982	1001
500004	__AUX_LOB_PIECE_500004_	p0	1152921504606846983	1001
500004	__AUX_LOB_PIECE_500004_	p1	1152921504606846984	1001
500004	__AUX_LOB_PIECE_500004_	p2	1152921504606846985	1001
500004	__AUX_LOB_PIECE_500004_	p3	1152921504606846986	1001
500004	__AUX_LOB_PIECE_500004_	p4	1152921504606846987	1001
500004	__AUX_LOB_PIECE_500004_	p5	1152921504606846988	1001
500029	__idx_500002_idx_t_part	p0	1152921504606846989	1001
500029	__idx_500002_idx_t_part	p1	1152921504606846990	1001
500029	__idx_500002_idx_t_part	p2	1152921504606846991	1001
500029	__idx_500002_idx_t_part	p3	1152921504606846992	1001
500029	__idx_500002_idx_t_part	p4	1152921504606846993	1001
500029	__idx_500002_idx_t_part	p5	1152921504606846994	1001
500030	t_subpart	p0	200007	1001
500030	t_subpart	p0	200008	1001
500030	t_subpart	p0	200009	1001
500030	t_subpart	p1	200010	1001
500030	t_subpart	p1	200011	1001
500030	t_subpart	p1	200012	1001
500031	__AUX_LOB_META_500031_	p0	1152921504606846995	1001
500031	__AUX_LOB_META_500031_	p0	1152921504606846996	1001
500031	__AUX_LOB_META_500031_	p0	1152921504606846997	1001
500031	__AUX_LOB_META_500031_	p1	1152921504606846998	1001
500031	__AUX_LOB_META_500031_	p1	1152921504606846999	1001
500031	__AUX_LOB_META_500031_	p1	1152921504606847000	1001
500032	__AUX_LOB_PIECE_500032_	p0	1152921504606847001	1001
500032	__AUX_LOB_PIECE_500032_	p0	1152921504606847002	1001
500032	__AUX_LOB_PIECE_500032_	p0	1152921504606847003	1001
500032	__AUX_LOB_PIECE_500032_	p1	1152921504606847004	1001
500032	__AUX_LOB_PIECE_500032_	p1	1152921504606847005	1001
500032	__AUX_LOB_PIECE_500032_	p1	1152921504606847006	1001
500065	__idx_500030_idx_t_subpart	p0	1152921504606847007	1001
500065	__idx_500030_idx_t_subpart	p0	1152921504606847008	1001
500065	__idx_500030_idx_t_subpart	p0	1152921504606847009	1001
500065	__idx_500030_idx_t_subpart	p1	1152921504606847010	1001
500065	__idx_500030_idx_t_subpart	p1	1152921504606847011	1001
500065	__idx_500030_idx_t_subpart	p1	1152921504606847012	1001
500066	t_nopart_1	NULL	200013	1001
500067	t_nopart_2	NULL	200014	1001
500068	t_nopart_3	NULL	200015	1001
500069	t_nopart_4	NULL	200016	1001
500070	t_nopart_5	NULL	200017	1001
500071	t_nopart_6	NULL	200018	1001
SELECT JOB_TYPE, TARGET_UNIT_NUM, TARGET_PRIMARY_ZONE_NUM, STATUS, COMMENT, BALANCE_STRATEGY_NAME FROM oceanbase.__all_balance_job_history;
JOB_TYPE	TARGET_UNIT_NUM	TARGET_PRIMARY_ZONE_NUM	STATUS	COMMENT	BALANCE_STRATEGY_NAME
LS_BALANCE	1	1	COMPLETED	NULL	LS balance by shrink
SELECT task_type, src_ls, dest_ls, part_list, finished_part_list, part_count, finished_part_count, ls_group_id, status, parent_list FROM oceanbase.__all_balance_task_history;
task_type	src_ls	dest_ls	part_list	finished_part_list	part_count	finished_part_count	ls_group_id	status	parent_list
LS_MERGE	1004	1001	NULL	500002:500008,500002:500009,500030:500037,500030:500040,500069:500069,500070:500070	0	6	1001	COMPLETED	NULL
LS_MERGE	1005	1001	NULL	500002:500007,500002:500010,500030:500036,500030:500039,500068:500068,500071:500071	0	6	1001	COMPLETED	NULL
SELECT src_ls, dest_ls, part_list, part_count, not_exist_part_list, lock_conflict_part_list, table_lock_tablet_list, tablet_list, tablet_count, status, result, comment FROM oceanbase.__all_transfer_task_history;
src_ls	dest_ls	part_list	part_count	not_exist_part_list	lock_conflict_part_list	table_lock_tablet_list	tablet_list	tablet_count	status	result	comment
1004	1001	500002:500008,500002:500009,500030:500037,500030:500040,500069:500069,500070:500070	6	NULL	NULL	200004,200005,200009,200012	200004:1,200005:2,200009:1,200012:2,200016:1,200017:2,1152921504606846980:1,1152921504606846981:2,1152921504606846986:1,1152921504606846987:2,1152921504606846992:1,1152921504606846993:2,1152921504606846997:1,1152921504606847000:2,1152921504606847003:1,1152921504606847006:2,1152921504606847009:1,1152921504606847012:2	18	COMPLETED	0	
1005	1001	500002:500007,500002:500010,500030:500036,500030:500039,500068:500068,500071:500071	6	NULL	NULL	200003,200006,200008,200011	200003:2,200006:4,200008:2,200011:1,200015:2,200018:4,1152921504606846979:2,1152921504606846982:4,1152921504606846985:2,1152921504606846988:4,1152921504606846991:2,1152921504606846994:4,1152921504606846996:2,1152921504606846999:1,1152921504606847002:2,1152921504606847005:1,1152921504606847008:2,1152921504606847011:1	18	COMPLETED	0	
alter system change tenant mysql;
DELETE FROM oceanbase.__all_balance_job_history;
DELETE FROM oceanbase.__all_balance_task_history;
DELETE FROM oceanbase.__all_transfer_task_history;
alter system change tenant sys;
===============================================================
==============     prepare transfer data   ====================
===============================================================
create table if not exists t_part(pk int primary key, c1 longtext) partition by hash(pk) partitions 6;
create index if not exists idx_t_part on t_part(pk);
insert into t_part values (1, 1), (2,2), (3,3), (4,4), (5,5), (6,6), (7,7), (8,8), (9,9), (0,0), (11, 1), (12,2);
create table if not exists t_subpart(c0 int, c1 int, c2 longtext, primary key (c0, c1)) partition by hash(c0) subpartition by hash(c1) subpartitions 3 partitions 2;
create index if not exists idx_t_subpart on t_subpart(c0, c1);
insert into t_subpart (c0, c1) values (1, 1), (2,2), (3,3), (4,4), (5,5), (6,6), (7,7), (8,8), (9,9), (0,0), (11, 1), (12,2);
create table if not exists t_nopart_1(c1 int);
create table if not exists t_nopart_2(c1 int);
create table if not exists t_nopart_3(c1 int);
create table if not exists t_nopart_4(c1 int);
create table if not exists t_nopart_5(c1 int);
create table if not exists t_nopart_6(c1 int);
insert into t_nopart_1 values (0);
insert into t_nopart_2 values (0);
insert into t_nopart_3 values (0);
insert into t_nopart_4 values (0);
insert into t_nopart_5 values (0);
insert into t_nopart_6 values (0);
SELECT TABLE_ID, TABLE_NAME, PARTITION_NAME, SUBPARTITION_NAME, TABLET_ID, LS_ID FROM oceanbase.DBA_OB_TABLE_LOCATIONS WHERE TABLE_ID >= 500000 AND ROLE = 'LEADER';
TABLE_ID	TABLE_NAME	PARTITION_NAME	SUBPARTITION_NAME	TABLET_ID	LS_ID
500002	t_part	p0	NULL	200001	1001
500002	t_part	p1	NULL	200002	1001
500002	t_part	p2	NULL	200003	1001
500002	t_part	p3	NULL	200004	1001
500002	t_part	p4	NULL	200005	1001
500002	t_part	p5	NULL	200006	1001
500003	__AUX_LOB_META_500003_	p0	NULL	1152921504606846977	1001
500003	__AUX_LOB_META_500003_	p1	NULL	1152921504606846978	1001
500003	__AUX_LOB_META_500003_	p2	NULL	1152921504606846979	1001
500003	__AUX_LOB_META_500003_	p3	NULL	1152921504606846980	1001
500003	__AUX_LOB_META_500003_	p4	NULL	1152921504606846981	1001
500003	__AUX_LOB_META_500003_	p5	NULL	1152921504606846982	1001
500004	__AUX_LOB_PIECE_500004_	p0	NULL	1152921504606846983	1001
500004	__AUX_LOB_PIECE_500004_	p1	NULL	1152921504606846984	1001
500004	__AUX_LOB_PIECE_500004_	p2	NULL	1152921504606846985	1001
500004	__AUX_LOB_PIECE_500004_	p3	NULL	1152921504606846986	1001
500004	__AUX_LOB_PIECE_500004_	p4	NULL	1152921504606846987	1001
500004	__AUX_LOB_PIECE_500004_	p5	NULL	1152921504606846988	1001
500029	__idx_500002_idx_t_part	p0	NULL	1152921504606846989	1001
500029	__idx_500002_idx_t_part	p1	NULL	1152921504606846990	1001
500029	__idx_500002_idx_t_part	p2	NULL	1152921504606846991	1001
500029	__idx_500002_idx_t_part	p3	NULL	1152921504606846992	1001
500029	__idx_500002_idx_t_part	p4	NULL	1152921504606846993	1001
500029	__idx_500002_idx_t_part	p5	NULL	1152921504606846994	1001
500030	t_subpart	p0	p0sp0	200007	1001
500030	t_subpart	p0	p0sp1	200008	1001
500030	t_subpart	p0	p0sp2	200009	1001
500030	t_subpart	p1	p1sp0	200010	1001
500030	t_subpart	p1	p1sp1	200011	1001
500030	t_subpart	p1	p1sp2	200012	1001
500031	__AUX_LOB_META_500031_	p0	p0sp0	1152921504606846995	1001
500031	__AUX_LOB_META_500031_	p0	p0sp1	1152921504606846996	1001
500031	__AUX_LOB_META_500031_	p0	p0sp2	1152921504606846997	1001
500031	__AUX_LOB_META_500031_	p1	p1sp0	1152921504606846998	1001
500031	__AUX_LOB_META_500031_	p1	p1sp1	1152921504606846999	1001
500031	__AUX_LOB_META_500031_	p1	p1sp2	1152921504606847000	1001
500032	__AUX_LOB_PIECE_500032_	p0	p0sp0	1152921504606847001	1001
500032	__AUX_LOB_PIECE_500032_	p0	p0sp1	1152921504606847002	1001
500032	__AUX_LOB_PIECE_500032_	p0	p0sp2	1152921504606847003	1001
500032	__AUX_LOB_PIECE_500032_	p1	p1sp0	1152921504606847004	1001
500032	__AUX_LOB_PIECE_500032_	p1	p1sp1	1152921504606847005	1001
500032	__AUX_LOB_PIECE_500032_	p1	p1sp2	1152921504606847006	1001
500065	__idx_500030_idx_t_subpart	p0	p0sp0	1152921504606847007	1001
500065	__idx_500030_idx_t_subpart	p0	p0sp1	1152921504606847008	1001
500065	__idx_500030_idx_t_subpart	p0	p0sp2	1152921504606847009	1001
500065	__idx_500030_idx_t_subpart	p1	p1sp0	1152921504606847010	1001
500065	__idx_500030_idx_t_subpart	p1	p1sp1	1152921504606847011	1001
500065	__idx_500030_idx_t_subpart	p1	p1sp2	1152921504606847012	1001
500066	t_nopart_1	NULL	NULL	200013	1001
500067	t_nopart_2	NULL	NULL	200014	1001
500068	t_nopart_3	NULL	NULL	200015	1001
500069	t_nopart_4	NULL	NULL	200016	1001
500070	t_nopart_5	NULL	NULL	200017	1001
500071	t_nopart_6	NULL	NULL	200018	1001
SELECT LS_ID, STATUS, PRIMARY_ZONE FROM oceanbase.DBA_OB_LS;
LS_ID	STATUS	PRIMARY_ZONE
1	NORMAL	z1;z2,z3
1001	NORMAL	z1;z2,z3
===============================================================
==============  primary zone from 1 to 3   ====================
===============================================================
alter tenant mysql set primary_zone = RANDOM;
===============================================================
================     verify transfer    =======================
===============================================================
ob1.check_until_timeout select count(*) from oceanbase.__all_virtual_balance_job_history where tenant_id = $mysql_tenant_id, 1, 300;
ob1.check_until_timeout select count(*) from oceanbase.__all_virtual_balance_job where tenant_id = $mysql_tenant_id, 0, 60;
ob1.check_until_timeout select count(*) from oceanbase.CDB_OB_LS where tenant_id = $mysql_tenant_id and status != 'NORMAL', 0, 100;
SELECT LS_ID, STATUS, PRIMARY_ZONE FROM oceanbase.DBA_OB_LS;
LS_ID	STATUS	PRIMARY_ZONE
1	NORMAL	z1;z2,z3
1001	NORMAL	z1;z2,z3
1007	NORMAL	z2;z1,z3
1008	NORMAL	z3;z1,z2
SELECT DISTINCT TABLE_ID, TABLE_NAME, PARTITION_NAME, TABLET_ID, LS_ID FROM oceanbase.DBA_OB_TABLE_LOCATIONS WHERE TABLE_ID >= 500000 ORDER BY TABLE_ID, TABLET_ID;
TABLE_ID	TABLE_NAME	PARTITION_NAME	TABLET_ID	LS_ID
500002	t_part	p0	200001	1001
500002	t_part	p1	200002	1001
500002	t_part	p2	200003	1008
500002	t_part	p3	200004	1008
500002	t_part	p4	200005	1007
500002	t_part	p5	200006	1007
500003	__AUX_LOB_META_500003_	p0	1152921504606846977	1001
500003	__AUX_LOB_META_500003_	p1	1152921504606846978	1001
500003	__AUX_LOB_META_500003_	p2	1152921504606846979	1008
500003	__AUX_LOB_META_500003_	p3	1152921504606846980	1008
500003	__AUX_LOB_META_500003_	p4	1152921504606846981	1007
500003	__AUX_LOB_META_500003_	p5	1152921504606846982	1007
500004	__AUX_LOB_PIECE_500004_	p0	1152921504606846983	1001
500004	__AUX_LOB_PIECE_500004_	p1	1152921504606846984	1001
500004	__AUX_LOB_PIECE_500004_	p2	1152921504606846985	1008
500004	__AUX_LOB_PIECE_500004_	p3	1152921504606846986	1008
500004	__AUX_LOB_PIECE_500004_	p4	1152921504606846987	1007
500004	__AUX_LOB_PIECE_500004_	p5	1152921504606846988	1007
500029	__idx_500002_idx_t_part	p0	1152921504606846989	1001
500029	__idx_500002_idx_t_part	p1	1152921504606846990	1001
500029	__idx_500002_idx_t_part	p2	1152921504606846991	1008
500029	__idx_500002_idx_t_part	p3	1152921504606846992	1008
500029	__idx_500002_idx_t_part	p4	1152921504606846993	1007
500029	__idx_500002_idx_t_part	p5	1152921504606846994	1007
500030	t_subpart	p0	200007	1001
500030	t_subpart	p0	200008	1008
500030	t_subpart	p0	200009	1007
500030	t_subpart	p1	200010	1001
500030	t_subpart	p1	200011	1008
500030	t_subpart	p1	200012	1007
500031	__AUX_LOB_META_500031_	p0	1152921504606846995	1001
500031	__AUX_LOB_META_500031_	p0	1152921504606846996	1008
500031	__AUX_LOB_META_500031_	p0	1152921504606846997	1007
500031	__AUX_LOB_META_500031_	p1	1152921504606846998	1001
500031	__AUX_LOB_META_500031_	p1	1152921504606846999	1008
500031	__AUX_LOB_META_500031_	p1	1152921504606847000	1007
500032	__AUX_LOB_PIECE_500032_	p0	1152921504606847001	1001
500032	__AUX_LOB_PIECE_500032_	p0	1152921504606847002	1008
500032	__AUX_LOB_PIECE_500032_	p0	1152921504606847003	1007
500032	__AUX_LOB_PIECE_500032_	p1	1152921504606847004	1001
500032	__AUX_LOB_PIECE_500032_	p1	1152921504606847005	1008
500032	__AUX_LOB_PIECE_500032_	p1	1152921504606847006	1007
500065	__idx_500030_idx_t_subpart	p0	1152921504606847007	1001
500065	__idx_500030_idx_t_subpart	p0	1152921504606847008	1008
500065	__idx_500030_idx_t_subpart	p0	1152921504606847009	1007
500065	__idx_500030_idx_t_subpart	p1	1152921504606847010	1001
500065	__idx_500030_idx_t_subpart	p1	1152921504606847011	1008
500065	__idx_500030_idx_t_subpart	p1	1152921504606847012	1007
500066	t_nopart_1	NULL	200013	1001
500067	t_nopart_2	NULL	200014	1001
500068	t_nopart_3	NULL	200015	1008
500069	t_nopart_4	NULL	200016	1008
500070	t_nopart_5	NULL	200017	1007
500071	t_nopart_6	NULL	200018	1007
SELECT JOB_TYPE, TARGET_UNIT_NUM, TARGET_PRIMARY_ZONE_NUM, STATUS, COMMENT, BALANCE_STRATEGY_NAME FROM oceanbase.__all_balance_job_history;
JOB_TYPE	TARGET_UNIT_NUM	TARGET_PRIMARY_ZONE_NUM	STATUS	COMMENT	BALANCE_STRATEGY_NAME
LS_BALANCE	1	3	COMPLETED	NULL	LS balance by expand
SELECT task_type, src_ls, dest_ls, part_list, finished_part_list, part_count, finished_part_count, ls_group_id, status, parent_list FROM oceanbase.__all_balance_task_history;
task_type	src_ls	dest_ls	part_list	finished_part_list	part_count	finished_part_count	ls_group_id	status	parent_list
LS_SPLIT	1001	1007	NULL	500002:500009,500002:500010,500030:500037,500030:500040,500070:500070,500071:500071	0	6	1001	COMPLETED	NULL
LS_SPLIT	1001	1008	NULL	500002:500007,500002:500008,500030:500036,500030:500039,500068:500068,500069:500069	0	6	1001	COMPLETED	NULL
SELECT src_ls, dest_ls, part_list, part_count, not_exist_part_list, lock_conflict_part_list, table_lock_tablet_list, tablet_list, tablet_count, status, result, comment FROM oceanbase.__all_transfer_task_history;
src_ls	dest_ls	part_list	part_count	not_exist_part_list	lock_conflict_part_list	table_lock_tablet_list	tablet_list	tablet_count	status	result	comment
1001	1007	500002:500009,500002:500010,500030:500037,500030:500040,500070:500070,500071:500071	6	NULL	NULL	200005,200006,200009,200012	200005:3,200006:5,200009:2,200012:3,200017:3,200018:5,1152921504606846981:3,1152921504606846982:5,1152921504606846987:3,1152921504606846988:5,1152921504606846993:3,1152921504606846994:5,1152921504606846997:2,1152921504606847000:3,1152921504606847003:2,1152921504606847006:3,1152921504606847009:2,1152921504606847012:3	18	COMPLETED	0	
1001	1008	500002:500007,500002:500008,500030:500036,500030:500039,500068:500068,500069:500069	6	NULL	NULL	200003,200004,200008,200011	200003:3,200004:2,200008:3,200011:2,200015:3,200016:2,1152921504606846979:3,1152921504606846980:2,1152921504606846985:3,1152921504606846986:2,1152921504606846991:3,1152921504606846992:2,1152921504606846996:3,1152921504606846999:2,1152921504606847002:3,1152921504606847005:2,1152921504606847008:3,1152921504606847011:2	18	COMPLETED	0	
alter system change tenant mysql;
DELETE FROM oceanbase.__all_balance_job_history;
DELETE FROM oceanbase.__all_balance_task_history;
DELETE FROM oceanbase.__all_transfer_task_history;
alter system change tenant sys;
update test.t_nopart_1 set c1=c1+1;
update test.t_nopart_2 set c1=c1+1;
update test.t_nopart_3 set c1=c1+1;
update test.t_nopart_4 set c1=c1+1;
update test.t_nopart_5 set c1=c1+1;
update test.t_nopart_6 set c1=c1+1;
select t1.c1, t2.c1, t3.c1, t4.c1, t5.c1, t6.c1 from test.t_nopart_1 t1, test.t_nopart_2 t2, test.t_nopart_3 t3, test.t_nopart_4 t4, test.t_nopart_5 t5, test.t_nopart_6 t6;
c1	c1	c1	c1	c1	c1
1	1	1	1	1	1
update test.t_part set pk = pk+100;
update test.t_subpart set c1=c1+100;
select * from test.t_part order by pk;
pk	c1
100	0
101	1
102	2
103	3
104	4
105	5
106	6
107	7
108	8
109	9
111	1
112	2
select * from test.t_subpart order by c0;
c0	c1	c2
0	100	NULL
1	101	NULL
2	102	NULL
3	103	NULL
4	104	NULL
5	105	NULL
6	106	NULL
7	107	NULL
8	108	NULL
9	109	NULL
11	101	NULL
12	102	NULL
===============================================================
=================     restart cluster    ======================
===============================================================
test restart cluster begin
ob1.force_stop;
ob1.nstart;
ob1.check_until_timeout select count(*) as cnt from oceanbase.__all_server where start_service_time <= $stop_tstamp_usec, 0 ,180;
ob1.check_until_timeout select count(*) from oceanbase.__all_server a left join oceanbase.__all_virtual_server_schema_info b on a.svr_ip = b.svr_ip and a.svr_port = b.svr_port where b.svr_ip is null, 0, 120;
ob1.check_until_timeout select count(*) as cnt from oceanbase.__all_virtual_server_schema_info as a join oceanbase.__all_virtual_server_schema_info as b on a.tenant_id = b.tenant_id  where a.refreshed_schema_version != b.refreshed_schema_version or a.refreshed_schema_version % 8 != 0, 0, 180;
ob1.check_until_timeout select count(*) from __all_virtual_memory_info where mod_name like '%OB_MOD_DO_NOT_USE_ME%' and hold != 0, 0, 10;
test restart cluster finish
===============================================================
==============     switch replica leader    ===================
===============================================================
test switch mysql replica leader begin
count(*)
0
ob1.check_until_timeout select count(*) from __all_virtual_ls_meta_table where tenant_id = '$mysql_tenant_id' and svr_ip = '$follower1_svr_ip' and svr_port='$follower1_svr_port' and ls_id = $ls_id and role = 1, 1, 6;
count(*)
1
ob1.check_until_timeout select count(*) from __all_virtual_ls_meta_table where tenant_id = '$mysql_tenant_id' and svr_ip = '$leader_svr_ip' and svr_port='$leader_svr_port' and ls_id = $ls_id and role = 1, 1, 6;
count(*)
1
create table if not exists t_for_switch (c1 int);
ob1.check_until_timeout select count(*) as cnt from oceanbase.__all_virtual_server_schema_info as a join oceanbase.__all_virtual_server_schema_info as b on a.tenant_id = b.tenant_id  where a.refreshed_schema_version != b.refreshed_schema_version, 0, 60;
begin;
insert into t_for_switch values (1);
ob1.check_until_timeout select count(*) from __all_virtual_ls_meta_table where tenant_id = '$mysql_tenant_id' and svr_ip = '$follower1_svr_ip' and svr_port='$follower1_svr_port' and ls_id = $ls_id and role = 1, 1, 6;
count(*)
1
commit;
select * from t_for_switch order by c1 asc;
c1
1
ob1.check_until_timeout select count(*) from __all_virtual_ls_meta_table where tenant_id = '$mysql_tenant_id' and svr_ip = '$leader_svr_ip' and svr_port='$leader_svr_port' and ls_id = $ls_id and role = 1, 1, 6;
count(*)
1
begin;
insert into t_for_switch values (2);
ob1.check_until_timeout select count(*) from __all_virtual_ls_meta_table where tenant_id = '$mysql_tenant_id' and svr_ip = '$follower1_svr_ip' and svr_port='$follower1_svr_port' and ls_id = $ls_id and role = 1, 1, 6;
count(*)
1
insert into t_for_switch values (3);
commit;
select * from t_for_switch order by c1 asc;
c1
1
2
3
ob1.check_until_timeout select count(*) from __all_virtual_ls_meta_table where tenant_id = '$mysql_tenant_id' and svr_ip = '$leader_svr_ip' and svr_port='$leader_svr_port' and ls_id = $ls_id and role = 1, 1, 6;
count(*)
1
set recyclebin = off;
DROP TABLE IF EXISTS t_for_switch;
test switch mysql replica leader finish
update test.t_nopart_1 set c1=c1+1;
update test.t_nopart_2 set c1=c1+1;
update test.t_nopart_3 set c1=c1+1;
update test.t_nopart_4 set c1=c1+1;
update test.t_nopart_5 set c1=c1+1;
update test.t_nopart_6 set c1=c1+1;
select t1.c1, t2.c1, t3.c1, t4.c1, t5.c1, t6.c1 from test.t_nopart_1 t1, test.t_nopart_2 t2, test.t_nopart_3 t3, test.t_nopart_4 t4, test.t_nopart_5 t5, test.t_nopart_6 t6;
c1	c1	c1	c1	c1	c1
2	2	2	2	2	2
update test.t_part set pk = pk+100;
update test.t_subpart set c1=c1+100;
select * from test.t_part order by pk;
pk	c1
200	0
201	1
202	2
203	3
204	4
205	5
206	6
207	7
208	8
209	9
211	1
212	2
select * from test.t_subpart order by c0;
c0	c1	c2
0	200	NULL
1	201	NULL
2	202	NULL
3	203	NULL
4	204	NULL
5	205	NULL
6	206	NULL
7	207	NULL
8	208	NULL
9	209	NULL
11	201	NULL
12	202	NULL
