drop table t1;
drop table t2;
# 必须远程执行发SQL，永远报错-4653, 然后重试发plan，测试发plan的路径
alter system set_tp tp_no = 256, error_code = 4653, frequency = 1;
create table t1(a int, b int, c int, d int);
create table t2(a int, b int, c int, d int);
insert into t1 values (1,1,1,1),(2,2,2,2),(3,3,3,3),(4,4,4,4),(5,5,5,5);
insert into t2 values (2,2,2,2),(3,3,3,3),(4,4,4,4),(5,5,5,5),(6,6,6,6);
explain merge into t1 using t2 on (t1.a = t2.a) when matched then update set t1.b = 1 where exists(select 1 from t2 where t2.b = t1.b);
Query Plan
======================================================
|ID|OPERATOR             |NAME |EST.ROWS|EST.TIME(us)|
------------------------------------------------------
|0 |MERGE                |     |5       |11          |
|1 |└─HASH SEMI JOIN     |     |5       |11          |
|2 |  ├─HASH JOIN        |     |5       |7           |
|3 |  │ ├─TABLE FULL SCAN|T2   |5       |3           |
|4 |  │ └─TABLE FULL SCAN|T1   |5       |3           |
|5 |  └─SUBPLAN SCAN     |VIEW1|5       |3           |
|6 |    └─TABLE FULL SCAN|T2   |5       |3           |
======================================================
Outputs & filters:
-------------------------------------
  0 - output(nil), filter(nil)
      columns([{T1: ({T1: (T1.__pk_increment, T1.A, T1.B, T1.C, T1.D)})}]),
      update([T1.B=column_conv(NUMBER,PS:(-1,0),NULL,1)]), 
      insert_conds(nil), update_conds(nil), delete_conds(nil)
  1 - output([T1.__pk_increment], [T1.A], [T1.B], [T1.C], [T1.D]), filter(nil), rowset=16
      equal_conds([VIEW1.T2.B = T1.B]), other_conds(nil)
  2 - output([T1.__pk_increment], [T1.A], [T1.B], [T1.C], [T1.D]), filter(nil), rowset=16
      equal_conds([T1.A = T2.A]), other_conds(nil)
  3 - output([T2.A]), filter(nil), rowset=16
      access([T2.A]), partitions(p0)
      is_index_back=false, is_global_index=false, 
      range_key([T2.__pk_increment]), range(MIN ; MAX)always true
  4 - output([T1.__pk_increment], [T1.A], [T1.B], [T1.C], [T1.D]), filter([T1.__pk_increment IS NOT NULL]), rowset=16
      access([T1.__pk_increment], [T1.A], [T1.B], [T1.C], [T1.D]), partitions(p0)
      is_index_back=false, is_global_index=false, filter_before_indexback[false], 
      range_key([T1.__pk_increment]), range(MIN ; MAX)always true
  5 - output([VIEW1.T2.B]), filter(nil), rowset=16
      access([VIEW1.T2.B])
  6 - output([T2.B]), filter(nil), rowset=16
      access([T2.B]), partitions(p0)
      is_index_back=false, is_global_index=false, 
      range_key([T2.__pk_increment]), range(MIN ; MAX)always true
merge into t1 using t2 on (t1.a = t2.a) when matched then update set t1.b = 1 where exists(select 1 from t2 where t2.b = t1.b);
select * from t1;
A	B	C	D
1	1	1	1
2	1	2	2
3	1	3	3
4	1	4	4
5	1	5	5
merge into t1 using t2 on (t1.a = t2.a) when not matched then insert (t1.a,t1.b,t1.c,t1.d) values (6,6,6,6) where 15 < (select sum(b) from t2);
select * from t1;
A	B	C	D
1	1	1	1
2	1	2	2
3	1	3	3
4	1	4	4
5	1	5	5
6	6	6	6
merge into t1 using t2 on (t1.a = t2.a) when not matched then insert (t1.a,t1.b,t1.c,t1.d) values (6,6,6,6) where 15 < (select sum(b) from t2);
select * from t1;
A	B	C	D
1	1	1	1
2	1	2	2
3	1	3	3
4	1	4	4
5	1	5	5
6	6	6	6
merge into t1 using t2 on (t1.a = t2.a) when matched then update set t1.b = (select sum(b) from t2) where t1.c = 2;
select * from t1;
A	B	C	D
1	1	1	1
2	20	2	2
3	1	3	3
4	1	4	4
5	1	5	5
6	6	6	6
merge into t1 using t2 on (t1.a = t2.a) when not matched then insert (t1.a,t1.b,t1.c,t1.d) values (6,6,6,(select sum(t2.d) from t2)) where t2.c = 1;
select * from t1;
A	B	C	D
1	1	1	1
2	20	2	2
3	1	3	3
4	1	4	4
5	1	5	5
6	6	6	6
merge into t1 using t2 on (t1.a = t2.a) when matched then update set t1.b = 1 where t1.c = 1 delete where exists(select 1 from t2 where t1.d = t2.d);
select * from t1;
A	B	C	D
1	1	1	1
2	20	2	2
3	1	3	3
4	1	4	4
5	1	5	5
6	6	6	6
merge into t1 using t2 on (t1.a = t2.a) when matched then update set t1.c = (select sum(b) from t2 where t2.b = t1.b) delete where exists(select 1 from t2 where t1.b = t2.b) when not matched then insert (t1.a,t1.b,t1.c,t1.d) values (7,7,7,(select sum(b) from t2));
select * from t1;
A	B	C	D
1	1	1	1
2	20	NULL	2
3	1	NULL	3
4	1	NULL	4
5	1	NULL	5
drop table t1;
drop table t2;
alter system set_tp tp_no = 256, error_code = 0, frequency = 1;
