#Environmental cleaning
drop user hjw@'%';
create user hjw identified by 'hjw';
grant all on *.* to hjw WITH GRANT OPTION;
#update-5     视图约束索引
#update-5-1     视图   说明：视图with check option功能在32x尚未实现
alter system flush plan cache global;
set autocommit = 0;
alter system set ob_enable_batched_multi_statement=true;
#update-5-1     视图
#普通视图
drop table if EXISTS test1;
drop view if EXISTS view_1;
create table test1(h1 int PRIMARY key AUTO_INCREMENT,
h2 char(5),
h3 varchar(100),
h4 FLOAT,
h5 int,
h6 date,
h7 time);
insert into test1(h2,h3,h4,h5,h6,h7) values(
'aaaaa',
'bbbbbbbbbbbbbbbbbbbbbbbbbbbbbbbb',
22222222222.555555555,
65346523,
'2020-10-01',
'00:00:00'),(
'张李王赵罗',
'杀跌设定为hi完全颠覆王府井我i发表我hi的方式的范围',
0.3654,
52344,
'2000-10-01',
'23:59:59'),(
'11111',
'时间都放进去而放弃Joe放进去哦父亲谔谔分降低就劝我放弃',
303.269,
-956,
'1900-10-01',
'00:00:01');
select * from test1 order by h1 asc;
create view view_1 as select * from test1;
select * from test1 order by h1 asc;
select * from view_1 order by h1 asc;
#普通更新
update view_1 set h2='bbbbb'where h2='aaaaa';update view_1 set h2='ccccc'where h2='bbbbb';update view_1 set h2='ddddd'where h2='ccccc';//
select * from test1 order by h1 asc;
select * from view_1 order by h1 asc;
update view_1 set h4=-22222200000 where h4=22222200000;update view_1 set h4=0 where h4=-22222200000;update view_1 set h4=22222200000 where h4=0;//
select * from test1 order by h1 asc;
select * from view_1 order by h1 asc;
update view_1 set h4=-2.05 where h4=22222200000;update view_1 set h4=0.99999 where h4=-2.05;update view_1 set h4=22222200000 where h4=0.99999;//
select * from test1 order by h1 asc;
select * from view_1 order by h1 asc;
update view_1 set h5=21245 where h5=65346523;update view_1 set h5=5-9 where h5=21245;update view_1 set h5=65346523 where h5=5-9;//
select * from test1 order by h1 asc;
select * from view_1 order by h1 asc;
update view_1 set h6='1910-10-01' where h6='1900-10-01';update view_1 set h6='1920-10-01' where h6='1910-10-01';update view_1 set h6='1940-10-01' where h6='1920-10-01';//
select * from test1 order by h1 asc;
select * from view_1 order by h1 asc;
update view_1 set h7='12:00:00' where h7='00:00:00';update view_1 set h7='24:00:00' where h7='12:00:00';//
update view_1 set h7='00:00:02' where h7='24:00:00';//
select * from test1 order by h1 asc;
select * from view_1 order by h1 asc;
drop table if EXISTS test1;
drop view if EXISTS view_1;
#distinct
drop table if EXISTS test1;
drop view if EXISTS view_1;
create table test1(h1 int PRIMARY key AUTO_INCREMENT,
h2 char(5),
h3 varchar(100),
h4 FLOAT,
h5 int,
h6 date,
h7 time);
insert into test1(h2,h3,h4,h5,h6,h7) values(
'aaaaa',
'bbbbbbbbbbbbbbbbbbbbbbbbbbbbbbbb',
22222222222.555555555,
65346523,
'2020-10-01',
'00:00:00'),(
'张李王赵罗',
'杀跌设定为hi完全颠覆王府井我i发表我hi的方式的范围',
0.3654,
52344,
'2000-10-01',
'23:59:59'),(
'11111',
'时间都放进去而放弃Joe放进去哦父亲谔谔分降低就劝我放弃',
303.269,
-956,
'1900-10-01',
'00:00:01');
create view view_1 as select * from test1;
select * from test1 order by h1 asc;
select * from view_1 order by h1 asc;
update view_1 set h2='ddddd'where h2=(select * from (select h2 from test1 where h2='11111')as a);update view_1 set h2='ccccc'where h2=(select * from (select DISTINCT(h2) from test1 where h2='ddddd' LIMIT 1)as a);update view_1 set h2='BBBBB'where h2=(select * from (select DISTINCT(h2) from test1 where h2='张李王赵罗' LIMIT 1)as a);//
select * from test1 order by h1 asc;
select * from view_1 order by h1 asc;
update view_1 set h2=h3 where h3='bbbbbbbbbbbbbbbbbbbbbbbbbbbbbbbb';update view_1 set h2=h3 where h3='杀跌设定为hi完全颠覆王府井我i发表我hi的方式的范围';//
select * from test1 order by h1 asc;
select * from view_1 order by h1 asc;
update view_1 set h4=303.269 where h4=(select * from (select h4 from test1 where h4=0.3654)as a);//
update view_1 set h4=100.25 where h4=(select * from (select DISTINCT(h4) from test1 where h4=303.269 LIMIT 1)as a);update view_1 set h4=1203+0.5 where h4=(select * from (select DISTINCT(h4) from test1 where h4=303.269 LIMIT 1)as a);//
select * from test1 order by h1 asc;
select * from view_1 order by h1 asc;
update view_1 set h5=52344 where h5=(select * from (select h5 from test1 where h5=-956)as a);update view_1 set h5=100 where h5=(select * from (select DISTINCT(h5) from test1 where h5=52344 LIMIT 1)as a);//
update view_1 set h5=1203+0 where h5=(select * from (select DISTINCT(h5) from test1 where h5=65346523 LIMIT 1)as a);//
select * from test1 order by h1 asc;
select * from view_1 order by h1 asc;
update view_1 set h6=52344 where h6=(select * from (select h6 from test1 where h5=-956)as a);update view_1 set h6=100 where h6=(select * from (select DISTINCT(h6) from test1 where h5=52344 LIMIT 1)as a);update view_1 set h6=1203+0 where h6=(select * from (select DISTINCT(h6) from test1 where h5=65346523 LIMIT 1)as a);//
select * from test1 order by h1 asc;
select * from view_1 order by h1 asc;
drop table if EXISTS test1;
drop view if EXISTS view_1;
#like  
drop table if EXISTS test1;
drop view if EXISTS view_1;
create table test1(h1 int PRIMARY key AUTO_INCREMENT,
h2 char(5),
h3 varchar(100),
h4 FLOAT,
h5 int,
h6 date,
h7 time);
insert into test1(h2,h3,h4,h5,h6,h7) values(
'aaaaa',
'bbbbbbbbbbbbbbbbbbbbbbbbbbbbbbbb',
22222222222.555555555,
65346523,
'2020-10-01',
'00:00:00'),(
'张李王赵罗',
'杀跌设定为hi完全颠覆王府井我i发表我hi的方式的范围',
0.3654,
52344,
'2000-10-01',
'23:59:59'),(
'11111',
'时间都放进去而放弃Joe放进去哦父亲谔谔分降低就劝我放弃',
303.269,
-956,
'1900-10-01',
'00:00:01');
create view view_1 as select * from test1;
select * from test1 order by h1 asc;
select * from view_1 order by h1 asc;
update view_1 set h2='啊啊啊皑皑' where h2 LIKE '%王%';update view_1 set h2='一一万亿元' where h2 LIKE '%啊%';//
update view_1 set h2='ccccc' where h2 LIKE '%万%';//
select * from test1 order by h1 asc;
select * from view_1 order by h1 asc;
update view_1 set h3='啊啊啊皑皑' where h2 LIKE '%1%';update view_1 set h3='一一万亿元' where h2 LIKE '%c%';update view_1 set h3='ccccc' where h2 LIKE '%a%';//
select * from test1 order by h1 asc;
select * from view_1 order by h1 asc;
update view_1 set h6='3000-30-12' where h6 LIKE '%2%' LIMIT 1;update view_1 set h6='0003-30-12' where h6 LIKE '%0%' LIMIT 1;//
select * from test1 order by h1 asc;
select * from view_1 order by h1 asc;
update view_1 set h6='3000-11-12' where h6 LIKE '%2%' LIMIT 1;update view_1 set h6='1003-03-12' where h6 LIKE '%0%' LIMIT 1;//
select * from test1 order by h1 asc;
select * from view_1 order by h1 asc;
update view_1 set h7='00:00:02' where h7 LIKE '%0%' LIMIT 1;update view_1 set h7='00:00:03' where h7 LIKE '%0%' LIMIT 1;update view_1 set h7='00:00:04' where h7 LIKE '%0%' LIMIT 1;//
update view_1 set h7='00:00:03' where h7 LIKE '%0%' LIMIT 1;update view_1 set h7='00:00:02' where h7 LIKE '%0%' LIMIT 1;update view_1 set h7='00:00:01' where h7 LIKE '%0%' LIMIT 1;//
select * from test1 order by h1 asc;
select * from view_1 order by h1 asc;
update view_1 set h7='00:00:02'+25 where h7 LIKE '%0%' LIMIT 1;update view_1 set h7='00:00:03'-24 where h7 LIKE '%0%' LIMIT 1;//
update view_1 set h7='00:00:04'+0 where h7 LIKE '%0%' LIMIT 1;update view_1 set h7='00:00:03'-0 where h7 LIKE '%0%' LIMIT 1;//
select * from test1 order by h1 asc;
select * from view_1 order by h1 asc;
drop table if EXISTS test1;
drop view if EXISTS view_1;
#case when
drop table if EXISTS test1;
drop view if EXISTS view_1;
create table test1(h1 int PRIMARY key AUTO_INCREMENT,
h2 char(5),
h3 varchar(100),
h4 FLOAT,
h5 int,
h6 date,
h7 time);
insert into test1(h2,h3,h4,h5,h6,h7) values(
'aaaaa',
'bbbbbbbbbbbbbbbbbbbbbbbbbbbbbbbb',
22222222222.555555555,
65346523,
'2020-10-01',
'00:00:00'),(
'张李王赵罗',
'杀跌设定为hi完全颠覆王府井我i发表我hi的方式的范围',
0.3654,
52344,
'2000-10-01',
'23:59:59'),(
'11111',
'时间都放进去而放弃Joe放进去哦父亲谔谔分降低就劝我放弃',
303.269,
-956,
'1900-10-01',
'00:00:01');
create view view_1 as select * from test1;
select * from test1 order by h1 asc;
select * from view_1 order by h1 asc;
UPDATE 
view_1 SET h3 =
CASE
WHEN h3 = 'ccccc' THEN
'设覅我和我试点范围是符号位是否hi为方便是符号位发表是否三个hi服务hi是为还能是否合并为' 
ELSE h3
END;
UPDATE 
view_1 SET h3 =
CASE
WHEN h3 = '一一万亿元' THEN
'壹壹壹壹壹壹壹壹壹壹壹壹壹壹壹壹壹壹壹壹壹壹壹壹壹壹壹壹壹壹壹壹壹壹壹壹' 
ELSE h3
END;//
UPDATE 
view_1 SET h3 =
CASE
WHEN h3 = '啊啊啊皑皑' THEN
'白雪皑皑白雪皑皑白雪皑白雪皑皑白雪皑皑白雪皑皑皑白雪皑皑白雪皑皑白雪皑皑白雪皑皑白雪皑皑白雪皑皑白雪皑皑白雪皑皑白雪皑皑白雪皑皑白雪皑皑白雪皑皑白雪皑皑白雪皑皑' 
ELSE h3
END;
//
select * from test1 order by h1 asc;
select * from view_1 order by h1 asc;
UPDATE 
view_1 SET h6 =
CASE
WHEN h6 = '1003-03-12' THEN
'10050312' 
ELSE h6
END;//
UPDATE 
view_1 SET h6 =
CASE
WHEN h6 = '2000-10-01' THEN
'20091001' 
ELSE h6
END;
UPDATE 
view_1 SET h6 =
CASE
WHEN h6 = '1900-10-01' THEN
'19901001' 
ELSE h6
END;
//
select * from test1 order by h1 asc;
select * from view_1 order by h1 asc;
UPDATE 
view_1 SET h4 =
CASE
WHEN h5 = 65346523 THEN
h4+h5 
ELSE h4
END;
UPDATE 
view_1 SET h4 =
CASE
WHEN h5 = 52344 THEN
h4+h5 
ELSE h4
END;//
UPDATE 
view_1 SET h4 =
CASE
WHEN h5 = -956 THEN
h4+h5 
ELSE h4
END;
//
select * from test1 order by h1 asc;
select * from view_1 order by h1 asc;
drop table if EXISTS test1;
drop view if EXISTS view_1;
#group by结合聚合
drop table if EXISTS test1;
drop view if EXISTS view_1;
create table test1(h1 int PRIMARY key AUTO_INCREMENT,
h2 char(5),
h3 varchar(100),
h4 FLOAT,
h5 int,
h6 date,
h7 time);
insert into test1(h2,h3,h4,h5,h6,h7) values(
'aaaaa',
'bbbbbbbbbbbbbbbbbbbbbbbbbbbbbbbb',
22222222222.555555555,
65346523,
'2020-10-01',
'00:00:00'),(
'张李王赵罗',
'杀跌设定为hi完全颠覆王府井我i发表我hi的方式的范围',
0.3654,
52344,
'2000-10-01',
'23:59:59'),(
'11111',
'时间都放进去而放弃Joe放进去哦父亲谔谔分降低就劝我放弃',
303.269,
-956,
'1900-10-01',
'00:00:01');
create view view_1 as select * from test1;
select * from test1 order by h1 asc;
select * from view_1 order by h1 asc;
update view_1 set h6='12:12:12' where h6=(select * from(select max(h6)from view_1 group by h1 order by h1 asc LIMIT 1)as a);update view_1 set h4=123456 where h4=(select * from(select max(h4)from view_1 group by h1 order by h1 asc LIMIT 1)as a);update view_1 set h2='莉莉莉莉利' where h2=(select * from(select max(h2)from view_1 group by h1 order by h1 asc LIMIT 1)as a);//
select * from test1 order by h1 asc;
select * from view_1 order by h1 asc;
update view_1 set h6='18:18:18' where h6=(select * from(select min(h6)from view_1 group by h1 order by h1 asc LIMIT 1)as a);update view_1 set h4=789456 where h4=(select * from(select min(h4)from view_1 group by h1 order by h1 asc LIMIT 1)as a);update view_1 set h2='旺旺旺旺旺' where h2=(select * from(select min(h2)from view_1 group by h1 order by h1 asc LIMIT 1)as a);//
select * from test1 order by h1 asc;
select * from view_1 order by h1 asc;
update view_1 set h6='59:59:12' where h6=(select * from(select sum(h6)from view_1 group by h1 order by h1 asc LIMIT 1)as a);update view_1 set h4=232551 where h4=(select * from(select sum(h4)from view_1 group by h1 order by h1 asc LIMIT 1)as a);update view_1 set h2='哈希哈希哈' where h2=(select * from(select sum(h2)from view_1 group by h1 order by h1 asc LIMIT 1)as a);//
select * from test1 order by h1 asc;
select * from view_1 order by h1 asc;
update view_1 set h6='28:28:28' where h6=(select * from(select avg(h6)from view_1 group by h1 order by h1 asc LIMIT 1)as a);update view_1 set h4=12524654 where h4=(select * from(select avg(h4)from view_1 group by h1 order by h1 asc LIMIT 1)as a);update view_1 set h2='👍👍👍👍👍' where h2=(select * from(select avg(h2)from view_1 group by h1 order by h1 asc LIMIT 1)as a);//
select * from test1 order by h1 asc;
select * from view_1 order by h1 asc;
update view_1 set h6='21:21:21' where h6=(select * from(select count(h6)from view_1 group by h1 order by h1 asc LIMIT 1)as a);//
update view_1 set h4=455 where h4=(select * from(select count(h4)from view_1 group by h1 order by h1 asc LIMIT 1)as a);update view_1 set h2='😘😘😘😘😘' where h2=(select * from(select count(h2)from view_1 group by h1 order by h1 asc LIMIT 1)as a);//
select * from test1 order by h1 asc;
select * from view_1 order by h1 asc;
drop table if EXISTS test1;
drop view if EXISTS view_1;
#where
drop table if EXISTS test1;
drop view if EXISTS view_1;
create table test1(h1 int PRIMARY key AUTO_INCREMENT,
h2 char(5),
h3 varchar(100),
h4 FLOAT,
h5 int,
h6 date,
h7 time);
insert into test1(h2,h3,h4,h5,h6,h7) values(
'aaaaa',
'bbbbbbbbbbbbbbbbbbbbbbbbbbbbbbbb',
22222222222.555555555,
65346523,
'2020-10-01',
'00:00:00'),(
'张李王赵罗',
'杀跌设定为hi完全颠覆王府井我i发表我hi的方式的范围',
0.3654,
52344,
'2000-10-01',
'23:59:59'),(
'11111',
'时间都放进去而放弃Joe放进去哦父亲谔谔分降低就劝我放弃',
303.269,
-956,
'1900-10-01',
'00:00:01');
create view view_1 as select * from test1;
select * from test1 order by h1 asc;
select * from view_1 order by h1 asc;
#in,NOT IN
update view_1 set h2='罗莎宝哪' where h2 in('张李王赵罗');update view_1 set h4=-532.5 where h2 in(0.3654);//
update view_1 set h2='2900-10-01' where h2 in('1900-10-01');update view_1 set h2='23:2333:2333' where h2 in('23:00:59');//
select * from test1 order by h1 asc;
select * from view_1 order by h1 asc;
update view_1 set h2='2900-10-01' where h2 in('1900-10-01');update view_1 set h2='23:33:23' where h2 in('23:00:59');//
select * from test1 order by h1 asc;
select * from view_1 order by h1 asc;
update view_1 set h2='罗莎宝哪' where h2 not in('张李王赵罗');update view_1 set h4=-532.5 where h2 not in(0.3654);//
update view_1 set h2='2900-10-01' where h2 not in('1900-10-01');update view_1 set h2='23:2333:2333' where h2 not in('23:00:59');//
select * from test1 order by h1 asc;
select * from view_1 order by h1 asc;
update view_1 set h2='2999-10-01' where h2 not in('1900-10-01');update view_1 set h2='13:33:23' where h2 not in('23:00:59');//
select * from test1 order by h1 asc;
select * from view_1 order by h1 asc;
#all
drop table if EXISTS test1;
drop view if EXISTS view_1;
create table test1(h1 int PRIMARY key AUTO_INCREMENT,
h2 char(5),
h3 varchar(100),
h4 FLOAT,
h5 int,
h6 date,
h7 time);
insert into test1(h2,h3,h4,h5,h6,h7) values(
'aaaaa',
'bbbbbbbbbbbbbbbbbbbbbbbbbbbbbbbb',
22222222222.555555555,
65346523,
'2020-10-01',
'00:00:00'),(
'张李王赵罗',
'杀跌设定为hi完全颠覆王府井我i发表我hi的方式的范围',
0.3654,
52344,
'2000-10-01',
'23:59:59'),(
'11111',
'时间都放进去而放弃Joe放进去哦父亲谔谔分降低就劝我放弃',
303.269,
-956,
'1900-10-01',
'00:00:01');
create view view_1 as select * from test1;
select * from test1 order by h1 asc;
select * from view_1 order by h1 asc;
update view_1 set h2='打个乌龟' where h2=all(SELECT * from (select h2 from view_1 order by h1 asc LIMIT 1 )as a);update view_1 set h2='srgwrg' where h2>all(SELECT * from (select h2 from view_1 order by h1 asc LIMIT 1 )as a);update view_1 set h2='rggwgw' where h2<all(SELECT * from (select h2 from view_1 order by h1 asc LIMIT 1 )as a);//
select * from test1 order by h1 asc;
select * from view_1 order by h1 asc;
update view_1 set h4=50 where h4=all(SELECT * from (select h4 from view_1 order by h1 asc LIMIT 1 )as a);update view_1 set h4=60 where h4>all(SELECT * from (select h4 from view_1 order by h1 asc LIMIT 1 )as a);update view_1 set h4=70 where h4<all(SELECT * from (select h4 from view_1 order by h1 asc LIMIT 1 )as a);//
select * from test1 order by h1 asc;
select * from view_1 order by h1 asc;
update view_1 set h5=50 where h5=all(SELECT * from (select h5 from view_1 order by h1 asc LIMIT 1 )as a);update view_1 set h5=60 where h5>all(SELECT * from (select h5 from view_1 order by h1 asc LIMIT 1 )as a);update view_1 set h5=70 where h5<all(SELECT * from (select h5 from view_1 order by h1 asc LIMIT 1 )as a);//
select * from test1 order by h1 asc;
select * from view_1 order by h1 asc;
update view_1 set h6=20120506 where h6=all(SELECT * from (select h6 from view_1 order by h1 asc LIMIT 1 )as a);//
update view_1 set h6=20190506 where h6>all(SELECT * from (select h6 from view_1 order by h1 asc LIMIT 1 )as a);update view_1 set h7=050603 where h6<all(SELECT * from (select h6 from view_1 order by h1 asc LIMIT 1 )as a);//
select * from test1 order by h1 asc;
select * from view_1 order by h1 asc;
#exists,not exists
drop table if EXISTS test1;
drop view if EXISTS view_1;
create table test1(h1 int PRIMARY key AUTO_INCREMENT,
h2 char(5),
h3 varchar(100),
h4 FLOAT,
h5 int,
h6 date,
h7 time);
insert into test1(h2,h3,h4,h5,h6,h7) values(
'aaaaa',
'bbbbbbbbbbbbbbbbbbbbbbbbbbbbbbbb',
22222222222.555555555,
65346523,
'2020-10-01',
'00:00:00'),(
'张李王赵罗',
'杀跌设定为hi完全颠覆王府井我i发表我hi的方式的范围',
0.3654,
52344,
'2000-10-01',
'23:59:59'),(
'11111',
'时间都放进去而放弃Joe放进去哦父亲谔谔分降低就劝我放弃',
303.269,
-956,
'1900-10-01',
'00:00:01');
create view view_1 as select * from test1;
select * from test1 order by h1 asc;
select * from view_1 order by h1 asc;
update view_1 set h2='打个乌龟' where  exists(SELECT * from (select h2 from view_1 order by h1 asc LIMIT 1 )as a);update view_1 set h2='srgwrg' where not exists(SELECT * from (select h2 from view_1 order by h1 asc LIMIT 1 )as a);//
select * from test1 order by h1 asc;
select * from view_1 order by h1 asc;
update view_1 set h4=50 where exists (SELECT * from (select h4 from view_1 order by h1 asc LIMIT 1 )as a);update view_1 set h4=60 where not exists (SELECT * from (select h4 from view_1 order by h1 asc LIMIT 1 )as a);//
select * from test1 order by h1 asc;
select * from view_1 order by h1 asc;
update view_1 set h5=50 where exists (SELECT * from (select h5 from view_1 order by h1 asc LIMIT 1 )as a);update view_1 set h5=60 where not exists (SELECT * from (select h5 from view_1 order by h1 asc LIMIT 1 )as a);//
select * from test1 order by h1 asc;
select * from view_1 order by h1 asc;
update view_1 set h6=20120506 where exists (SELECT * from (select h6 from view_1 order by h1 asc LIMIT 1 )as a);update view_1 set h6=20190506 where not exists (SELECT * from (select h6 from view_1 order by h1 asc LIMIT 1 )as a);//
select * from test1 order by h1 asc;
select * from view_1 order by h1 asc;
#>,>=,<,<=,<>,!=
drop table if EXISTS test1;
drop view if EXISTS view_1;
create table test1(h1 int PRIMARY key AUTO_INCREMENT,
h2 char(5),
h3 varchar(100),
h4 FLOAT,
h5 int,
h6 date,
h7 time);
insert into test1(h2,h3,h4,h5,h6,h7) values(
'aaaaa',
'bbbbbbbbbbbbbbbbbbbbbbbbbbbbbbbb',
22222222222.555555555,
65346523,
'2020-10-01',
'00:00:00'),(
'张李王赵罗',
'杀跌设定为hi完全颠覆王府井我i发表我hi的方式的范围',
0.3654,
52344,
'2000-10-01',
'23:59:59'),(
'11111',
'时间都放进去而放弃Joe放进去哦父亲谔谔分降低就劝我放弃',
303.269,
-956,
'1900-10-01',
'00:00:01');
create view view_1 as select * from test1;
select * from test1 order by h1 asc;
select * from view_1 order by h1 asc;
update view_1 set h2='打个乌龟' where h2>(SELECT * from (select h2 from view_1 order by h1 asc LIMIT 1 )as a);update view_1 set h2='打个金鱼' where h2>=(SELECT * from (select h2 from view_1 order by h1 asc LIMIT 1 )as a);update view_1 set h2='打个老鳖' where h2<(SELECT * from (select h2 from view_1 order by h1 asc LIMIT 1 )as a);//
update view_1 set h2='打个海鲜' where h2<=(SELECT * from (select h2 from view_1 order by h1 asc LIMIT 1 )as a);update view_1 set h2='打个龙虾' where h2<0>(SELECT * from (select h2 from view_1 order by h1 asc LIMIT 1 )as a);update view_1 set h2='打个螃蟹' where h2!=(SELECT * from (select h2 from view_1 order by h1 asc LIMIT 1 )as a);//
select * from test1 order by h1 asc;
select * from view_1 order by h1 asc;
update view_1 set h4=50 where h4>(SELECT * from (select h4 from view_1 order by h1 asc LIMIT 1 )as a);update view_1 set h4=60 where h4>=(SELECT * from (select h4 from view_1 order by h1 asc LIMIT 1 )as a);update view_1 set h4=60 where h4<(SELECT * from (select h4 from view_1 order by h1 asc LIMIT 1 )as a);//
update view_1 set h4=60 where h4<=(SELECT * from (select h4 from view_1 order by h1 asc LIMIT 1 )as a);update view_1 set h4=60 where h4<50>(SELECT * from (select h4 from view_1 order by h1 asc LIMIT 1 )as a);update view_1 set h4=60 where h4 !=(SELECT * from (select h4 from view_1 order by h1 asc LIMIT 1 )as a);//
select * from test1 order by h1 asc;
select * from view_1 order by h1 asc;
update view_1 set h5=50 where h5>(SELECT * from (select h5 from view_1 order by h1 asc LIMIT 1 )as a);update view_1 set h5=60 where h5>= (SELECT * from (select h5 from view_1 order by h1 asc LIMIT 1 )as a);update view_1 set h5=60 where h5<= (SELECT * from (select h5 from view_1 order by h1 asc LIMIT 1 )as a);//
update view_1 set h5=60 where h5< (SELECT * from (select h5 from view_1 order by h1 asc LIMIT 1 )as a);update view_1 set h5=60 where h5<50> (SELECT * from (select h5 from view_1 order by h1 asc LIMIT 1 )as a);update view_1 set h5=60 where h5!= (SELECT * from (select h5 from view_1 order by h1 asc LIMIT 1 )as a);//
select * from test1 order by h1 asc;
select * from view_1 order by h1 asc;
update view_1 set h6=20120506 where h6>(SELECT * from (select h6 from view_1 order by h1 asc LIMIT 1 )as a);update view_1 set h6=20190506 where h6>= (SELECT * from (select h6 from view_1 order by h1 asc LIMIT 1 )as a);update view_1 set h6=20120506 where h6< (SELECT * from (select h6 from view_1 order by h1 asc LIMIT 1 )as a);//
update view_1 set h6=20190506 where h6<= (SELECT * from (select h6 from view_1 order by h1 asc LIMIT 1 )as a);update view_1 set h6=20120506 where h6<20000101> (SELECT * from (select h6 from view_1 order by h1 asc LIMIT 1 )as a);update view_1 set h6=20190506 where h6 != (SELECT * from (select h6 from view_1 order by h1 asc LIMIT 1 )as a);//
select * from test1 order by h1 asc;
select * from view_1 order by h1 asc;
drop table if EXISTS test1;
drop view if EXISTS view_1;
alter system set ob_enable_batched_multi_statement=false;
alter system set _rowsets_enabled=true;
# Clean up users
drop user hjw@'%' ;
