drop database if exists db1;
create database db1;
use db1;
SET wait_timeout=30000000;
SET ob_trx_timeout = 100000000;
SET ob_query_timeout = 100000000;
#不同数据类型外键。
#int
drop table if exists fk_int2;
Warnings:
Note	1051	Unknown table 'db1.fk_int2'
drop table if exists fk_int;
Warnings:
Note	1051	Unknown table 'db1.fk_int'
create table fk_int(
fk_int_c1 int primary KEY,
fk_int_c2 int unique key
);
create table fk_int2(
fk_int2_c1 int,
fk_int2_c2 int,
foreign key (fk_int2_c1) REFERENCES fk_int(fk_int_c1),
foreign key (fk_int2_c2) REFERENCES fk_int(fk_int_c2)
);
insert into fk_int values(1,1),(3,3),(5,5);
insert into fk_int2 values(3,3);
insert into fk_int2 values(6,6);
ERROR 23000: Cannot add or update a child row: a foreign key constraint fails
update fk_int2 set fk_int2_c1 = 5 where fk_int2_c2 = 3;
update fk_int2 set fk_int2_c1 = 2 where fk_int2_c1 = 5;
ERROR 23000: Cannot add or update a child row: a foreign key constraint fails
update fk_int2 set fk_int2_c2 = 4 where fk_int2_c1 = 5;
ERROR 23000: Cannot add or update a child row: a foreign key constraint fails
delete from fk_int where fk_int_c1 = 5;
ERROR 23000: Cannot delete or update a parent row: a foreign key constraint fails
delete from fk_int where fk_int_c2 = 3;
ERROR 23000: Cannot delete or update a parent row: a foreign key constraint fails
update fk_int set fk_int_c1 = 3 where fk_int_c2 = 5;
ERROR 23000: Duplicate entry '3' for key 'PRIMARY'
update fk_int set fk_int_c2 = 5 where fk_int_c2 = 3;
ERROR 23000: Duplicate entry '5' for key 'fk_int_c2'
delete from fk_int where fk_int_c1 = 5;
ERROR 23000: Cannot delete or update a parent row: a foreign key constraint fails
delete from fk_int where fk_int_c2 = 3;
ERROR 23000: Cannot delete or update a parent row: a foreign key constraint fails
select * from fk_int;
fk_int_c1	fk_int_c2
1	1
3	3
5	5
select * from fk_int2;
fk_int2_c1	fk_int2_c2
5	3
#关闭外键约束检查
set foreign_key_checks	= off;
insert into fk_int2 values(7,7),(3,1);
update fk_int2 set fk_int2_c1 = 100 where fk_int2_c2 = 1;
update fk_int2 set fk_int2_c2 = 100 where fk_int2_c1 = 5;
delete from fk_int where fk_int_c1 = 5;
delete from fk_int where fk_int_c2 = 1;
select * from fk_int;
fk_int_c1	fk_int_c2
3	3
select * from fk_int2;
fk_int2_c1	fk_int2_c2
5	100
7	7
100	1
#float、double、decimal
set foreign_key_checks	= on;
drop table if exists fk_jd;
Warnings:
Note	1051	Unknown table 'db1.fk_jd'
drop table if exists fk_jd2;
Warnings:
Note	1051	Unknown table 'db1.fk_jd2'
create table fk_jd(
c1 float,
c2 float unique key,
c3 double,
c4 double unique key,
c5 decimal(4,2),
c6 decimal(6,3) unique key,
primary key(c1,c3,c5)
);
create table fk_jd2(
a1 float ,
a2 float ,
a3 double ,
a4 double ,
a5 decimal(4,2) ,
a6 decimal(6,3) ,
foreign key (a1) REFERENCES fk_jd(c1),
foreign key (a2) REFERENCES fk_jd(c2),
foreign key (a3) REFERENCES fk_jd(c3),
foreign key (a4) REFERENCES fk_jd(c4),
foreign key (a5) REFERENCES fk_jd(c5),
foreign key (a6) REFERENCES fk_jd(c6)
);
ERROR HY000: Cannot add foreign key constraint
drop table if exists fk_float2;
Warnings:
Note	1051	Unknown table 'db1.fk_float2'
drop table if exists fk_float;
Warnings:
Note	1051	Unknown table 'db1.fk_float'
create table fk_float(
c1 float(10,6) primary key,
c2 float(10,6) unique
);
create table fk_float2(
a1 float(10,6),
a2 float(10,6),
foreign key (a1) REFERENCES fk_float(c1),
foreign key (a2) REFERENCES fk_float(c2)
);
insert into fk_float values(1.123456,-1.11111);
insert into fk_float values (3.3333,-6.6666);
insert into fk_float values (7.777,8.8);
insert into fk_float values (10.0001,null);
insert into fk_float2 values(1.123456,-1.11111);
insert into fk_float2 values (3.3333,-6.6666);
insert into fk_float2 values (7.777,8.8);
insert into fk_float2 values (10.0001,null);
update fk_float set c1 = 20 where c2 = -6.6666;
ERROR 23000: Cannot delete or update a parent row: a foreign key constraint fails
update fk_float2 set a1 = 20 where a1 = 7.777000;
ERROR 23000: Cannot add or update a child row: a foreign key constraint fails
update fk_float2 set a1 = 3.333300 where a2 is null;
update fk_float set c1 = 3.333300 where c2 is null;
ERROR 23000: Duplicate entry '3.3333' for key 'PRIMARY'
update fk_float set c1 = 10.54634 where c2 is null;
delete from fk_float where c1 = 1.123456;
ERROR 23000: Cannot delete or update a parent row: a foreign key constraint fails
delete from fk_float where c2 is null;
delete from fk_float2 where a2 is null;
delete from fk_float2 where a1 = 3.333300;
select * from fk_float;
c1	c2
1.123456	-1.111110
3.333300	-6.666600
7.777000	8.800000
select * from fk_float2;
a1	a2
1.123456	-1.111110
7.777000	8.800000
set foreign_key_checks	= off;
insert into fk_float2 values(10,20);
update fk_float2 set a1 = 12 where a2 = -1.111110;
delete from fk_float where c1 = 1.123456;
select * from fk_float;
c1	c2
3.333300	-6.666600
7.777000	8.800000
select * from fk_float2;
a1	a2
12.000000	-1.111110
7.777000	8.800000
10.000000	20.000000
set foreign_key_checks	= on;
#double
drop table if exists fk_double2;
Warnings:
Note	1051	Unknown table 'db1.fk_double2'
drop table if exists fk_double;
Warnings:
Note	1051	Unknown table 'db1.fk_double'
create table fk_double(
c1 double(10,4) primary key,
c2 double(10,4) unique
);
create table fk_double2(
a1 double(10,4),
a2 double(10,4),
foreign key (a1) REFERENCES fk_double(c1),
foreign key (a2) REFERENCES fk_double(c2)
);
insert into fk_double values(1.123456,-1.11111);
insert into fk_double values (3.3333,-6.6666);
insert into fk_double values (7.777,8.8);
insert into fk_double values (10.0001,null);
insert into fk_double2 values(1.123456,-1.11111);
insert into fk_double2 values (3.3333,-6.6666);
insert into fk_double2 values (7.777,8.8);
insert into fk_double2 values (10.0001,null);
select * from fk_double;
c1	c2
1.1235	-1.1111
3.3333	-6.6666
7.7770	8.8000
10.0001	NULL
select * from fk_double2;
a1	a2
1.1235	-1.1111
3.3333	-6.6666
7.7770	8.8000
10.0001	NULL
update fk_double set c1 = 20 where c2 = -6.6666;
ERROR 23000: Cannot delete or update a parent row: a foreign key constraint fails
update fk_double2 set a1 = 20 where a1 = 7.7770;
ERROR 23000: Cannot add or update a child row: a foreign key constraint fails
update fk_double2 set a1 = 3.3333 where a2 is null;
update fk_double set c1 = 3.3333 where c2 is null;
ERROR 23000: Duplicate entry '3.3333' for key 'PRIMARY'
update fk_double set c1 = 10.54634 where c2 is null;
delete from fk_double where c1 = 1.1235;
ERROR 23000: Cannot delete or update a parent row: a foreign key constraint fails
delete from fk_double where c2 is null;
delete from fk_double2 where a2 is null;
delete from fk_double2 where a1 = 3.3333;
select * from fk_double;
c1	c2
1.1235	-1.1111
3.3333	-6.6666
7.7770	8.8000
select * from fk_double2;
a1	a2
1.1235	-1.1111
7.7770	8.8000
set foreign_key_checks	= off;
insert into fk_double2 values(10,20);
update fk_double2 set a1 = 12 where a2 = -1.1111;
delete from fk_double where c1 = 1.1235;
select * from fk_double;
c1	c2
3.3333	-6.6666
7.7770	8.8000
select * from fk_double2;
a1	a2
12.0000	-1.1111
7.7770	8.8000
10.0000	20.0000
set foreign_key_checks	= on;
#decimal
drop table if exists fk_decimal2;
Warnings:
Note	1051	Unknown table 'db1.fk_decimal2'
drop table if exists fk_decimal;
Warnings:
Note	1051	Unknown table 'db1.fk_decimal'
create table fk_decimal(
c1 float(10,6) primary key,
c2 float(10,6) unique
);
create table fk_decimal2(
a1 float(10,6),
a2 float(10,6),
foreign key (a1) REFERENCES fk_decimal(c1),
foreign key (a2) REFERENCES fk_decimal(c2)
);
insert into fk_decimal values(1.123456,-1.11111);
insert into fk_decimal values (3.3333,-6.6666);
insert into fk_decimal values (7.777,8.8);
insert into fk_decimal values (10.0001,null);
insert into fk_decimal2 values(1.123456,-1.11111);
insert into fk_decimal2 values (3.3333,-6.6666);
insert into fk_decimal2 values (7.777,8.8);
insert into fk_decimal2 values (10.0001,null);
update fk_decimal set c1 = 20 where c2 = -6.6666;
ERROR 23000: Cannot delete or update a parent row: a foreign key constraint fails
update fk_decimal2 set a1 = 20 where a1 = 7.777000;
ERROR 23000: Cannot add or update a child row: a foreign key constraint fails
update fk_decimal2 set a1 = 3.333300 where a2 is null;
update fk_decimal set c1 = 3.333300 where c2 is null;
ERROR 23000: Duplicate entry '3.3333' for key 'PRIMARY'
update fk_decimal set c1 = 10.54634 where c2 is null;
delete from fk_decimal where c1 = 1.123456;
ERROR 23000: Cannot delete or update a parent row: a foreign key constraint fails
delete from fk_decimal where c2 is null;
delete from fk_decimal2 where a2 is null;
delete from fk_decimal2 where a1 = 3.333300;
select * from fk_decimal;
c1	c2
1.123456	-1.111110
3.333300	-6.666600
7.777000	8.800000
select * from fk_decimal2;
a1	a2
1.123456	-1.111110
7.777000	8.800000
set foreign_key_checks	= off;
insert into fk_decimal2 values(10,20);
update fk_decimal2 set a1 = 12 where a2 = -1.111110;
delete from fk_decimal where c1 = 1.123456;
select * from fk_decimal;
c1	c2
3.333300	-6.666600
7.777000	8.800000
select * from fk_decimal2;
a1	a2
12.000000	-1.111110
7.777000	8.800000
10.000000	20.000000
#datetime、year、timestamp、time
set foreign_key_checks	= on;
drop table if exists fk_date2;
Warnings:
Note	1051	Unknown table 'db1.fk_date2'
drop table if exists fk_date;
Warnings:
Note	1051	Unknown table 'db1.fk_date'
create table fk_date(
c1 date not null primary key,
c2 datetime not null unique key,
c3 year not null unique key
);
create table fk_date2(
a1 date not null,
a2 datetime not null,
a3 year not null,
FOREIGN KEY (a1) REFERENCES fk_date(c1),
FOREIGN KEY (a2) REFERENCES fk_date(c2),
FOREIGN KEY (a3) REFERENCES fk_date(c3)
);
insert into fk_date values('2020-02-02','2020-02-02 02:02:02','2020');
insert into fk_date values('2021-06-06','2021-06-06 06:06:06','2021');
insert into fk_date values('2022-09-09','2022-09-09 09:09:09','2022');
insert into fk_date values('2023-12-12','2023-12-12 12:12:12','2023');
insert into fk_date2 values('2020-02-02','2020-02-02 02:02:02','2020');
insert into fk_date2 values('2021-06-06','2021-06-06 06:06:06','2021');
insert into fk_date2 values('2022-09-09','2022-09-09 09:09:09','2022');
select * from fk_date;
c1	c2	c3
2020-02-02	2020-02-02 02:02:02	2020
2021-06-06	2021-06-06 06:06:06	2021
2022-09-09	2022-09-09 09:09:09	2022
2023-12-12	2023-12-12 12:12:12	2023
select * from fk_date2;
a1	a2	a3
2020-02-02	2020-02-02 02:02:02	2020
2021-06-06	2021-06-06 06:06:06	2021
2022-09-09	2022-09-09 09:09:09	2022
insert into fk_date2 values('2024-02-02','2020-02-02 02:02:02','2020');
ERROR 23000: Cannot add or update a child row: a foreign key constraint fails
set foreign_key_checks	= 0;
insert into fk_date2 values('2024-02-02','2020-02-02 02:02:02','2020');
update fk_date2 set a1 = '2024-04-04' where a3 = 2022;
delete from fk_date where c3 = 2022;
select * from fk_date;
c1	c2	c3
2020-02-02	2020-02-02 02:02:02	2020
2021-06-06	2021-06-06 06:06:06	2021
2023-12-12	2023-12-12 12:12:12	2023
select * from fk_date2;
a1	a2	a3
2020-02-02	2020-02-02 02:02:02	2020
2021-06-06	2021-06-06 06:06:06	2021
2024-04-04	2022-09-09 09:09:09	2022
2024-02-02	2020-02-02 02:02:02	2020
set foreign_key_checks	= 1;
update fk_date2 set a1 = '2023-12-12' where a1 = '2024-02-02';
update fk_date2 set a1 = '2024-12-12' where a1 = '2024-04-04';
ERROR 23000: Cannot add or update a child row: a foreign key constraint fails
delete from fk_date2 where a3 = 2020;
select * from fk_date;
c1	c2	c3
2020-02-02	2020-02-02 02:02:02	2020
2021-06-06	2021-06-06 06:06:06	2021
2023-12-12	2023-12-12 12:12:12	2023
select * from fk_date2;
a1	a2	a3
2021-06-06	2021-06-06 06:06:06	2021
2024-04-04	2022-09-09 09:09:09	2022
drop table fk_date2;
drop table fk_date;
#时间日期类型自引用外键。
drop table if exists fk_time_zyy;
Warnings:
Note	1051	Unknown table 'db1.fk_time_zyy'
create table fk_time_zyy(
c1 datetime not null unique key,
c2 year unique key,
c3 timestamp  unique key,
c4 time not null unique key,
c5 datetime,
c6 YEAR,
c7 timestamp,
c8 time,
FOREIGN KEY (c5) REFERENCES fk_time_zyy(c1),
FOREIGN KEY (c6) REFERENCES fk_time_zyy(c2),
FOREIGN KEY (c7) REFERENCES fk_time_zyy(c3),
FOREIGN KEY (c8) REFERENCES fk_time_zyy(c4)
);
insert into fk_time_zyy(c1,c2,c3,c4) values('2021-01-01 01:01:01',2021,'2021-02-02 02:02:02','03:03');
insert into fk_time_zyy values('2022-02-02 02:02:02',2022,'2022-04-04 04:04:04','04:04','2022-02-02 02:02:02',2022,'2022-04-04 04:04:04','04:04');
insert into fk_time_zyy values('2023-03-03 03:03:03',2023,'2023-03-03 03:03:03','06:06','2023-03-03 03:03:03',2023,'2023-03-03 03:03:03','06:06');
#修改null值
update fk_time_zyy set c5 ='2023-03-03 03:03:03' ,c6 =2022 ,c7 ='2022-04-04 04:04:04' ,c8 = '04:04:00' where c4='03:03:00';
#OB执行成功，mysql报错违反外键约束
delete from fk_time_zyy;
set foreign_key_checks	= 0;
insert into fk_time_zyy values('2023-05-01 01:01:01',2028,'2028-02-02 02:02:02','07:03','2030-06-07',2050,'2022-02-28','23:59:59');
update fk_time_zyy set c2 = 2090 where c5 = '2030-06-07';
delete from fk_time_zyy where c6 = 2050;
select * from fk_time_zyy;
c1	c2	c3	c4	c5	c6	c7	c8
drop table fk_time_zyy;
#varchar、char、text
set foreign_key_checks	= 1;
drop table if exists fk_string2;
Warnings:
Note	1051	Unknown table 'db1.fk_string2'
drop table if exists fk_string;
Warnings:
Note	1051	Unknown table 'db1.fk_string'
create table fk_string(
c1 varchar(60),
c2 char(30)
);
CREATE unique INDEX idx_c1 ON fk_string (c1);
CREATE unique INDEX idx_c2 ON fk_string (c2);
create table fk_string2(
a1 varchar(60),
a2 char(30),
FOREIGN KEY (a1) REFERENCES fk_string(c1),
FOREIGN KEY (a2) REFERENCES fk_string(c2)
);
insert into fk_string values(null,null),('##','c6'),('张三','oo9'),('77q','88q');
insert into fk_string2 values('77q',null),('##','c6'),('张三','oo9');
#修改null值
update fk_string2 set a1 = '77q' where a2 is null;
update fk_string2 set a1 = null where a2 ='oo9';
select * from fk_string2;
a1	a2
77q	NULL
##	c6
NULL	oo9
delete from fk_string where c1 is null;
delete from fk_string where c1 ='##';
ERROR 23000: Cannot delete or update a parent row: a foreign key constraint fails
set foreign_key_checks	= 0;
insert into fk_string2 values('ZAQ','王维');
update fk_string set c1 = '66q' where c2 = 'c6';
delete from fk_string where c1 = '77q';
truncate fk_string;
drop table fk_string;
set foreign_key_checks	= 1;
insert into fk_string2 values('CC','DD');
ERROR 23000: Cannot add or update a child row: a foreign key constraint fails
update fk_string2 set a1 = 'WW' where a2 is null;
ERROR 23000: Cannot add or update a child row: a foreign key constraint fails
delete from fk_string2 where a2 is null;
create table fk_string(
c1 varchar(60),
c2 char(30)
);
ERROR HY000: Cannot add foreign key constraint
#OB与mysql报错信息不一致。
create table fk_string(
c1 varchar(60) primary key,
c2 char(30)
);
ERROR HY000: Cannot add foreign key constraint
create table fk_string(
c1 varchar(60) unique key,
c2 char(30) unique key
);
insert into fk_string values('AA','DD');
insert into fk_string2 values('AA','DD');
update fk_string set c1 = '##' where c2 = 'DD';
ERROR 23000: Cannot delete or update a parent row: a foreign key constraint fails
update fk_string2 set a2 = 'DD' where a1 is null;
delete from fk_string where c1 = '##';
delete from fk_string2 where a1 = 'ZAQ';
drop table fk_string2;
drop table fk_string;
drop table if exists fk_text2;
Warnings:
Note	1051	Unknown table 'db1.fk_text2'
drop table if exists fk_text;
Warnings:
Note	1051	Unknown table 'db1.fk_text'
set foreign_key_checks	= 1;
create table fk_text(
c1 text(20)
);
CREATE unique INDEX idx_c1 ON fk_text (c1(20));
#OB与MYSQL报错不一致。
create table fk_text2(
a1 text(20),
FOREIGN KEY (a1) REFERENCES fk_text(c1)
);
ERROR HY000: Cannot add foreign key constraint
#varbinary、binary
set foreign_key_checks	= on;
drop table if exists t2;
Warnings:
Note	1051	Unknown table 'db1.t2'
drop table if exists t1;
Warnings:
Note	1051	Unknown table 'db1.t1'
create table t1(
c1 VARBINARY(30) primary key,
c2 BINARY(30) unique key
);
create table t2(
c1 VARBINARY(29),
c2 BINARY(29),
FOREIGN KEY(c1) REFERENCES t1(c1),
FOREIGN KEY(c2) REFERENCES t1(c2)
);
ERROR HY000: Child column 'c1' data length cannot be less than parent column 'c1' data length
create table t2(
c1 VARBINARY(30),
c2 BINARY(30),
FOREIGN KEY(c1) REFERENCES t1(c1),
FOREIGN KEY(c2) REFERENCES t1(c2)
);
insert into t1 values(1,null),(3,3),(7,7),(9,9),(5,5);
insert into t2 values(1,7),(3,3),(7,7),(5,5);
insert into t2 values(b'11',null);
ERROR 23000: Cannot add or update a child row: a foreign key constraint fails
insert into t2 values(3,null);
set foreign_key_checks	= 0;
insert into t2 values(b'11',null);
delete from t2 where c2 is null;
select * from t1;
c1	c2
1	NULL
3	3                             
5	5                             
7	7                             
9	9                             
select * from t2;
c1	c2
1	7                             
3	3                             
7	7                             
5	5                             
set foreign_key_checks	= 1;
update t1 set c2 = 11 where c1 = 1;
update t1 set c2 = 13 where c1 = 3;
ERROR 23000: Cannot delete or update a parent row: a foreign key constraint fails
set foreign_key_checks	= 0;
update t1 set c2 = 13 where c1 = 3;
delete from t1 where c1 = 1;
select * from t1;
c1	c2
3	13                            
5	5                             
7	7                             
9	9                             
select * from t2;
c1	c2
1	7                             
3	3                             
7	7                             
5	5                             
drop table t2;
drop table t1;
#enum、set
set foreign_key_checks	= on;
drop table if exists t2;
Warnings:
Note	1051	Unknown table 'db1.t2'
drop table if exists t1;
Warnings:
Note	1051	Unknown table 'db1.t1'
create table t1(
c1 enum('小学','初中','高中','大学') unique key,
c2 set('一年级','五年级','初二','高三','大四') unique key
);
create table t2(
c1 enum('小学','初中','高中','大学'),
c2 set('一年级','初二','高三','大四'),
FOREIGN KEY(c1) REFERENCES t1(c1),
FOREIGN KEY(c2) REFERENCES t1(c2)
);
insert into t1 values('小学','一年级'),('初中','初二'),('高中','高三'),('大学','大四');
insert into t1 values(null,'五年级');
insert into t2 values('小学','一年级'),('初中','初二'),('高中','高三'),('大学','大四');
insert into t2 values(null,'五年级');
ERROR 01000: Data truncated for column 'c2' at row 1
select * from t1;
c1	c2
小学	一年级
初中	初二
高中	高三
大学	大四
NULL	五年级
select * from t2;
c1	c2
小学	一年级
初中	初二
高中	高三
大学	大四
update t2 set c1 = '初中' where c2 = '一年级';
update t2 set c1 = '高中' where c2 = '初二';
delete from t1 where c1 = '小学';
ERROR 23000: Cannot delete or update a parent row: a foreign key constraint fails
set foreign_key_checks	= 0;
delete from t1 where c1 = '小学';
set foreign_key_checks	= 1;
update t1 set c1 = '小学' where c1 is null;
select * from t1;
c1	c2
初中	初二
高中	高三
大学	大四
小学	五年级
select * from t2;
c1	c2
初中	一年级
高中	初二
高中	高三
大学	大四
drop table t2;
drop table t1;
#enum 和set 自引用外键列
drop table if exists t1;
Warnings:
Note	1051	Unknown table 'db1.t1'
create table t1 (
c1 enum('1','2','3') primary key,
c2 set('1','2','3'),
foreign key(c2) references t1(c1)
);
ERROR HY000: Cannot add foreign key constraint
drop table if exists t1;
Warnings:
Note	1051	Unknown table 'db1.t1'
create table t1 (
c1 enum('1','2','3') primary key,
c2 enum('1','2','3'),
foreign key(c2) references t1(c1)
);
insert into t1 values(1,1);
insert into t1 values(2,3);
ERROR 23000: Cannot add or update a child row: a foreign key constraint fails
update t1 set c1 = 3 where c2 = 3;
delete from t1 where c1 = 1;
drop table if exists t1;
create table t1 (
c1 set('1','2','3') primary key,
c2 set('1','2','3'),
foreign key(c2) references t1(c1)
);
insert into t1 values(1,1);
insert into t1 values(2,3);
ERROR 23000: Cannot add or update a child row: a foreign key constraint fails
update t1 set c1 = 3 where c2 = 3;
delete from t1 where c1 = 1;
drop table t1;
#bit
set foreign_key_checks	= on;
drop table if exists fk_bit2;
Warnings:
Note	1051	Unknown table 'db1.fk_bit2'
drop table if exists fk_bit;
Warnings:
Note	1051	Unknown table 'db1.fk_bit'
create table fk_bit(
c1 bit(64) primary key,
c2 bit(64) unique key
);
create table fk_bit2(
a1 bit(64) ,
a2 bit(64) ,
foreign key (a1) REFERENCES fk_bit(c1),
foreign key (a2) REFERENCES fk_bit(c2)
);
insert into fk_bit values (1,2);
insert into fk_bit values (3,3);
insert into fk_bit values (5,5);
insert into fk_bit values (7,8);
insert into fk_bit2 values (1,2);
insert into fk_bit2 values (3,3);
select hex(c1),hex(c2) from fk_bit;
hex(c1)	hex(c2)
1	2
3	3
5	5
7	8
select hex(a1),hex(a2) from fk_bit2;
hex(a1)	hex(a2)
1	2
3	3
insert into fk_bit2 values(10,5);
ERROR 23000: Cannot add or update a child row: a foreign key constraint fails
insert into fk_bit2 values(b'1010',5);
ERROR 23000: Cannot add or update a child row: a foreign key constraint fails
insert into fk_bit2 values(b'101',5);
update fk_bit2 set a1 = b'101010' where a1 = 5;
ERROR 23000: Cannot add or update a child row: a foreign key constraint fails
update fk_bit2 set a2 = b'101010' where a2 = 5;
ERROR 23000: Cannot add or update a child row: a foreign key constraint fails
update fk_bit2 set a1 = 7 where a2 = b'101';
delete from fk_bit where c1 = b'1';
ERROR 23000: Cannot delete or update a parent row: a foreign key constraint fails
delete from fk_bit where c1 = 7;
ERROR 23000: Cannot delete or update a parent row: a foreign key constraint fails
delete from fk_bit2 where a1 = b'11';
delete from fk_bit2 where a1 = 1;
select hex(c1),hex(c2) from fk_bit;
hex(c1)	hex(c2)
1	2
3	3
5	5
7	8
select hex(a1),hex(a2) from fk_bit2;
hex(a1)	hex(a2)
7	5
#bit类型外键自引用
drop table if exists fk_bit_zyy;
Warnings:
Note	1051	Unknown table 'db1.fk_bit_zyy'
create table fk_bit_zyy (
c1 bit(64) unique key,
c2 bit(64) ,
c3 bit(64) unique key,
FOREIGN KEY (c3) REFERENCES fk_bit_zyy(c1),
FOREIGN KEY (c2) REFERENCES fk_bit_zyy(c3)
);
insert into fk_bit_zyy values(1,2,3);
ERROR 23000: Cannot add or update a child row: a foreign key constraint fails
insert into fk_bit_zyy values(1,1,1);
insert into fk_bit_zyy values(2,2,2);
insert into fk_bit_zyy values(3,3,3);
select hex(c1),hex(c2),hex(c3) from fk_bit_zyy;
hex(c1)	hex(c2)	hex(c3)
1	1	1
2	2	2
3	3	3
#OB与MYSQL报错信息不一致。
update fk_bit_zyy set c1 = 3 where c2 = 2;
ERROR 23000: Duplicate entry '3' for key 'c1'
#OB执行成功 ，mysql报错。
drop database db1;
