drop database if exists db1;
create database db1;
use db1;
SET wait_timeout=30000000;
SET ob_trx_timeout = 100000000;
SET ob_query_timeout = 100000000;
#PL+dml触发外键
#trigger(after) +dml触发外键
drop table if exists tg_test2;
Warnings:
Note	1051	Unknown table 'db1.tg_test2'
drop table if exists tg_test;
Warnings:
Note	1051	Unknown table 'db1.tg_test'
create table tg_test(
c1 int PRIMARY KEY,
c2 varchar(30) unique
);
create table tg_test2(
c1 int,
c2 varchar(30),
FOREIGN key(c1) REFERENCES tg_test(c1),
FOREIGN key(c2) REFERENCES tg_test(c2)
);
insert into tg_test values(1,'a'),(3,'b'),(5,'c'),(7,null);
insert into tg_test2 values(1,'a'),(3,'b'),(5,'c');
drop TRIGGER if exists tr1;
Warnings:
Note	1360	Trigger does not exist
create trigger tr1
after update on tg_test
for each row 
begin
insert into tg_test2 values(3,'a'),(5,'dd');
end
/
update tg_test set c1 = 9 where c1 = 1;
ERROR 23000: Cannot delete or update a parent row: a foreign key constraint fails
set foreign_key_checks	= 0;
update tg_test set c1 = 9 where c1 = 1;
select * from tg_test;
c1	c2
7	NULL
9	a
3	b
5	c
select * from tg_test2;
c1	c2
1	a
3	b
5	c
3	a
5	dd
set foreign_key_checks	= 1;
drop TRIGGER if exists tr1;
create trigger tr1
after insert on tg_test
for each row 
begin
insert into tg_test2 values(3,'a'),(5,'dd');
end
/
insert into tg_test values(11,'qq');
ERROR 23000: Cannot add or update a child row: a foreign key constraint fails
set foreign_key_checks	= 0;
#OB与MYSQL rows affected不一致。
insert into tg_test values(11,'qq');
select * from tg_test;
c1	c2
7	NULL
9	a
3	b
5	c
11	qq
select * from tg_test2;
c1	c2
1	a
3	b
5	c
3	a
5	dd
3	a
5	dd
set foreign_key_checks	= 1;
drop TRIGGER if exists tr1;
create trigger tr1
after delete on tg_test
for each row 
begin
delete from  tg_test2 where c2 = 'dd';
end
/
delete from tg_test where c1 = 5;
ERROR 23000: Cannot delete or update a parent row: a foreign key constraint fails
#OB与mysql rows affected不一致。
delete from tg_test where c2 is null;
select * from tg_test;
c1	c2
9	a
3	b
5	c
11	qq
select * from tg_test2;
c1	c2
1	a
3	b
5	c
3	a
3	a
set foreign_key_checks	= 0;
delete from tg_test where c1 = 3;
select * from tg_test;
c1	c2
9	a
5	c
11	qq
select * from tg_test2;
c1	c2
1	a
3	b
5	c
3	a
3	a
set foreign_key_checks	= 1;
#trigger(before) +dml触发外键
drop table if exists tg_test2;
drop table if exists tg_test;
create table tg_test(
c1 int PRIMARY KEY,
c2 varchar(30) unique
);
create table tg_test2(
c1 int,
c2 varchar(30),
FOREIGN key(c1) REFERENCES tg_test(c1),
FOREIGN key(c2) REFERENCES tg_test(c2)
);
insert into tg_test values(1,'a'),(3,'b'),(5,'c'),(7,null);
insert into tg_test2 values(1,'a'),(3,'b'),(5,'c');
drop TRIGGER if exists tr1;
Warnings:
Note	1360	Trigger does not exist
create trigger tr1
BEFORE update on tg_test2
for each row 
begin
insert into tg_test values(3,'a'),(5,'dd');
end
/
#OB与MYSQL报错信息不一致。
update tg_test2 set c2 = null where c2 = 'a';
ERROR 23000: Duplicate entry '3' for key 'PRIMARY'
set foreign_key_checks	= 0;
update tg_test2 set c1 = 7 where c1 = 1;
ERROR 23000: Duplicate entry '3' for key 'PRIMARY'
select * from tg_test;
c1	c2
1	a
3	b
5	c
7	NULL
select * from tg_test2;
c1	c2
1	a
3	b
5	c
set foreign_key_checks	= 1;
drop TRIGGER if exists tr1;
create trigger tr1
BEFORE insert on tg_test2
for each row 
begin
update tg_test set c1 = 9 where c2 is null;
end
/
select * from tg_test;
c1	c2
1	a
3	b
5	c
7	NULL
select * from tg_test2;
c1	c2
1	a
3	b
5	c
drop TRIGGER if exists tr1;
create trigger tr1
BEFORE delete on tg_test2
for each row 
begin
delete from tg_test where c2 is null;
end
/
#ob与mysql rows affected不一致。
delete from tg_test2 where c2 = 'b';
select * from tg_test;
c1	c2
1	a
3	b
5	c
select * from tg_test2;
c1	c2
1	a
5	c
drop TRIGGER if exists tr1;
create trigger tr1
BEFORE delete on tg_test2
for each row 
begin
delete from tg_test where c2 = 'a';
end
/
delete from tg_test2 where c2 = 'c';
ERROR 23000: Cannot delete or update a parent row: a foreign key constraint fails
set foreign_key_checks	= 0;
#ob与mysql rows affected不一致。
delete from tg_test2 where c2 = 'c';
select * from tg_test;
c1	c2
3	b
5	c
select * from tg_test2;
c1	c2
1	a
set foreign_key_checks	= 1;
#procedure + dml触发外键
drop table if exists pro_test2;
Warnings:
Note	1051	Unknown table 'db1.pro_test2'
drop table if exists pro_test;
Warnings:
Note	1051	Unknown table 'db1.pro_test'
create table pro_test(
c1 int not null unique key,
c2 varchar(30) primary key
);
create table pro_test2(
c1 int,
c2 varchar(30),
FOREIGN KEY(c1) REFERENCES pro_test(c1),
FOREIGN KEY(c2) REFERENCES pro_test(c2)
);
insert into pro_test values(-30,'SAN'),(50,'WU'),(-70,'Qi'),(90,'Jiu'),(-110,'YiYi');
insert into pro_test2 values(-30,'SAN'),(50,'WU'),(-70,'Qi'),(90,'Jiu');
select * from pro_test;
c1	c2
90	Jiu
-70	Qi
-30	SAN
50	WU
-110	YiYi
select * from pro_test2;
c1	c2
-30	SAN
50	WU
-70	Qi
90	Jiu
drop procedure if exists pro1;
CREATE  PROCEDURE pro1(in i int,j int)
begin
while i <= j DO
insert into pro_test2 values(null,'YiYi');
set i = i + 1;
end WHILE;
end
/
call pro1(1,1);
select * from pro_test2;
c1	c2
-30	SAN
50	WU
-70	Qi
90	Jiu
NULL	YiYi
drop procedure if exists pro1;
create procedure pro1(aa int,bb int)
begin
if aa = bb then
insert into pro_test2 values(-30,'san');
elseif aa > bb then
update pro_test2 set c1 = 110 where c1 is null;
else
delete from pro_test where c1 = 50;
end if;
end
/
call pro1(1,1);
call pro1(2,1);
ERROR 23000: Cannot add or update a child row: a foreign key constraint fails
call pro1(0,1);
ERROR 23000: Cannot delete or update a parent row: a foreign key constraint fails
set foreign_key_checks	= 0;
call pro1(2,1);
call pro1(0,1);
select * from pro_test;
c1	c2
90	Jiu
-70	Qi
-30	SAN
-110	YiYi
select * from pro_test2;
c1	c2
-30	SAN
50	WU
-70	Qi
90	Jiu
110	YiYi
-30	san
#function + dml触发外键
set foreign_key_checks	= 1;
drop function if exists func_test;
create function func_test(aa int,bb int)
RETURNS int
begin
if aa = bb then
insert into pro_test2 values(-30,'san');
elseif aa > bb then
update pro_test2 set c1 = 110 where c1 is null;
else
delete from pro_test where c1 = 50;
end if;
RETURN 1;
end
/
select func_test(1,1);
func_test(1,1)
1
select func_test(2,1);
func_test(2,1)
1
select func_test(1,2);
func_test(1,2)
1
select * from pro_test;
c1	c2
90	Jiu
-70	Qi
-30	SAN
-110	YiYi
select * from pro_test2;
c1	c2
-30	SAN
50	WU
-70	Qi
90	Jiu
110	YiYi
-30	san
-30	san
drop function if exists func_test;
create function func_test(aa int,bb int)
RETURNS int
begin
if aa = bb then
insert into pro_test2 values(30,'san');
elseif aa > bb then
update pro_test2 set c1 = 200 where c1 = -30;
else
delete from pro_test where c1 = 90;
end if;
RETURN 1;
end
/
select func_test(1,1);
ERROR 23000: Cannot add or update a child row: a foreign key constraint fails
select func_test(2,1);
ERROR 23000: Cannot add or update a child row: a foreign key constraint fails
select func_test(1,2);
ERROR 23000: Cannot delete or update a parent row: a foreign key constraint fails
select * from pro_test;
c1	c2
90	Jiu
-70	Qi
-30	SAN
-110	YiYi
select * from pro_test2;
c1	c2
-30	SAN
50	WU
-70	Qi
90	Jiu
110	YiYi
-30	san
-30	san
set foreign_key_checks	= 0;
select func_test(1,1);
func_test(1,1)
1
select func_test(2,1);
func_test(2,1)
1
select func_test(1,2);
func_test(1,2)
1
select * from pro_test;
c1	c2
-70	Qi
-30	SAN
-110	YiYi
select * from pro_test2;
c1	c2
200	SAN
50	WU
-70	Qi
90	Jiu
110	YiYi
200	san
200	san
30	san
drop table pro_test2;
drop table pro_test;
drop function func_test;
drop database db1;
