ob1=OBI(cluster=1,proxy_num=0,init_unit_cpu=0);
ob1.reboot;
ob1.mysql alter system set enable_sys_table_ddl = 'True';
select table_id from oceanbase.__all_virtual_table where tenant_id = 1 and table_name = '__all_virtual_memory_info';
table_id
1099511638813
desc oceanbase.__all_virtual_memory_info;
Field	Type	Null	Key	Default	Extra
tenant_id	bigint(20)	NO	PRI	NULL	
svr_ip	varchar(32)	NO	PRI	NULL	
svr_port	bigint(20)	NO	PRI	NULL	
mod_id	bigint(20)	NO	PRI	NULL	
mod_type	varchar(256)	NO		NULL	
mod_name	varchar(256)	NO		NULL	
zone	varchar(256)	NO		NULL	
hold	bigint(20)	NO		NULL	
used	bigint(20)	NO		NULL	
count	bigint(20)	NO		NULL	
alloc_count	bigint(20)	NO		NULL	
free_count	bigint(20)	NO		NULL	
desc oceanbase.gv$session_event;
Field	Type	Null	Key	Default	Extra
SID	bigint(20)	NO		NULL	
CON_ID	bigint(20)	NO		NULL	
SVR_IP	varchar(32)	NO		NULL	
SVR_PORT	bigint(20)	NO		NULL	
EVENT_ID	bigint(20)	NO		NULL	
EVENT	varchar(64)	NO		NULL	
WAIT_CLASS_ID	bigint(20)	NO		NULL	
WAIT_CLASS#	bigint(20)	NO		NULL	
WAIT_CLASS	varchar(64)	NO		NULL	
TOTAL_WAITS	bigint(20)	NO		NULL	
TOTAL_TIMEOUTS	bigint(20)	NO		NULL	
TIME_WAITED	double	NO		NULL	
MAX_WAIT	double	NO		NULL	
AVERAGE_WAIT	double	NO		NULL	
TIME_WAITED_MICRO	bigint(20)	NO		NULL	
drop view oceanbase.gv$session_event;
delete from oceanbase.__all_column_history where tenant_id = 1 and table_id = 1099511638813 and rowkey_position = 0;
delete from oceanbase.__all_column where tenant_id = 1 and table_id = 1099511638813 and rowkey_position = 0;
ob1.z1.obs0.force_stop;
ob1.z1.obs0.start;
desc oceanbase.__all_virtual_memory_info;
Field	Type	Null	Key	Default	Extra
tenant_id	bigint(20)	NO	PRI	NULL	
svr_ip	varchar(32)	NO	PRI	NULL	
svr_port	bigint(20)	NO	PRI	NULL	
mod_id	bigint(20)	NO	PRI	NULL	
desc oceanbase.gv$session_event;
ERROR 42S02: Table 'oceanbase.gv$session_event' doesn't exist
select * from oceanbase.__all_virtual_upgrade_inspection;
name	info
zone_check	succeed
sys_stat_check	succeed
sys_param_check	succeed
sys_table_schema_check	failed
MIGRATE_SEQUENCE_TABLE	succeed
MIGRATE_META_TABLE	succeed
BUILD_GC_PARTITION	succeed
all_check	failed
alter system upgrade virtual schema;
select * from oceanbase.__all_virtual_upgrade_inspection;
name	info
zone_check	succeed
sys_stat_check	succeed
sys_param_check	succeed
sys_table_schema_check	succeed
MIGRATE_SEQUENCE_TABLE	succeed
MIGRATE_META_TABLE	succeed
BUILD_GC_PARTITION	succeed
all_check	succeed
desc oceanbase.__all_virtual_memory_info;
Field	Type	Null	Key	Default	Extra
tenant_id	bigint(20)	NO	PRI	NULL	
svr_ip	varchar(32)	NO	PRI	NULL	
svr_port	bigint(20)	NO	PRI	NULL	
mod_id	bigint(20)	NO	PRI	NULL	
mod_type	varchar(256)	NO		NULL	
mod_name	varchar(256)	NO		NULL	
zone	varchar(256)	NO		NULL	
hold	bigint(20)	NO		NULL	
used	bigint(20)	NO		NULL	
count	bigint(20)	NO		NULL	
alloc_count	bigint(20)	NO		NULL	
free_count	bigint(20)	NO		NULL	
desc oceanbase.gv$session_event;
Field	Type	Null	Key	Default	Extra
SID	bigint(20)	NO		NULL	
CON_ID	bigint(20)	NO		NULL	
SVR_IP	varchar(32)	NO		NULL	
SVR_PORT	bigint(20)	NO		NULL	
EVENT_ID	bigint(20)	NO		NULL	
EVENT	varchar(64)	NO		NULL	
WAIT_CLASS_ID	bigint(20)	NO		NULL	
WAIT_CLASS#	bigint(20)	NO		NULL	
WAIT_CLASS	varchar(64)	NO		NULL	
TOTAL_WAITS	bigint(20)	NO		NULL	
TOTAL_TIMEOUTS	bigint(20)	NO		NULL	
TIME_WAITED	double	NO		NULL	
MAX_WAIT	double	NO		NULL	
AVERAGE_WAIT	double	NO		NULL	
TIME_WAITED_MICRO	bigint(20)	NO		NULL	
create table __all_virtual_test_table (pk int, value int) table_id = 20000;
desc oceanbase.__all_virtual_test_table;
Field	Type	Null	Key	Default	Extra
pk	int(11)	YES		NULL	
value	int(11)	YES		NULL	
create table test_table (pk int, value int);
desc oceanbase.test_table;
Field	Type	Null	Key	Default	Extra
pk	int(11)	YES		NULL	
value	int(11)	YES		NULL	
alter system upgrade virtual schema;
select * from oceanbase.__all_virtual_upgrade_inspection;
name	info
zone_check	succeed
sys_stat_check	succeed
sys_param_check	succeed
sys_table_schema_check	succeed
MIGRATE_SEQUENCE_TABLE	succeed
MIGRATE_META_TABLE	succeed
BUILD_GC_PARTITION	succeed
all_check	succeed
desc oceanbase.__all_virtual_test_table;
ERROR 42S02: Table 'oceanbase.__all_virtual_test_table' doesn't exist
desc oceanbase.test_table;
Field	Type	Null	Key	Default	Extra
pk	int(11)	YES		NULL	
value	int(11)	YES		NULL	
