purge recyclebin;
#新建本地用户
drop user lcq1 ;
create user 'lcq1' identified by 'lcq';
GRANT all privileges ON *.* TO 'lcq1'@'%' WITH GRANT OPTION;
drop user lcq2 ;
create user 'lcq2' identified by 'lcq';
GRANT all privileges ON *.* TO 'lcq2'@'%' WITH GRANT OPTION;
drop user lcq3 ;
create user 'lcq3' identified by 'lcq';
GRANT all privileges ON *.* TO 'lcq3'@'%' WITH GRANT OPTION;
#新建远端dblink租户、用户
drop user lcq1 ;
create user 'lcq1' identified by 'lcq';
GRANT all privileges ON *.* TO 'lcq1'@'%' WITH GRANT OPTION;
drop user lcq2 ;
create user 'lcq2' identified by 'lcq';
GRANT all privileges ON *.* TO 'lcq2'@'%' WITH GRANT OPTION;
drop user lcq3 ;
create user 'lcq3' identified by 'lcq';
GRANT all privileges ON *.* TO 'lcq3'@'%' WITH GRANT OPTION;
set autocommit = on;
set ob_query_timeout=99900000000;
set ob_trx_timeout = 1000000000;
SET NAMES UTF8;
b
1
month_id
201710
month_id
201710
SELECT 1;
1
1
set autocommit = on;
set ob_query_timeout=99900000000;
set ob_trx_timeout = 1000000000;
SET NAMES UTF8;
b
1
month_id
201710
month_id
201710
SELECT 1;
1
1
set autocommit = on;
set ob_query_timeout=99900000000;
set ob_trx_timeout = 1000000000;
SET NAMES UTF8;
b
1
month_id
201710
month_id
201710
SELECT 1;
1
1
set autocommit = on;
set autocommit = on;
set ob_query_timeout=99900000000;
set ob_trx_timeout = 1000000000;
SET NAMES UTF8;
CREATE OR REPLACE VIEW v_class1 AS SELECT * FROM class150@my_link1;
CREATE OR REPLACE VIEW v_stu1 AS SELECT * FROM stu150@my_link1;
CREATE OR REPLACE VIEW v_class2 AS SELECT * FROM class233@my_link2;
CREATE OR REPLACE VIEW v_stu2 AS SELECT * FROM stu233@my_link2;
CREATE OR REPLACE VIEW syn_class1  AS SELECT * FROM class150@my_link1;
CREATE OR REPLACE VIEW syn_stu1  AS SELECT * FROM stu150@my_link1;
CREATE OR REPLACE VIEW syn_class2  AS SELECT * FROM class233@my_link2;
CREATE OR REPLACE VIEW syn_stu2  AS SELECT * FROM stu233@my_link2;
#mysql_dblink_read-08-03	函数
#mysql_dblink_read-08-03-1、mysql_dblink_read-08-03-2	条件、循环语句（if、while），不带参数的函数
DROP TABLE if exists class3_1;
CREATE TABLE class3_1 AS SELECT * FROM class333 where 1=0;
DROP FUNCTION IF EXISTS p1;//
CREATE FUNCTION p1()
RETURNS INT
DETERMINISTIC
BEGIN
DECLARE done INT DEFAULT FALSE;
DECLARE id INT;
DECLARE name VARCHAR(255);
DECLARE ts TIMESTAMP;
DECLARE cur CURSOR FOR SELECT id,name,create_time FROM class150@my_link1;
DECLARE CONTINUE HANDLER FOR NOT FOUND SET done = TRUE;
OPEN cur;
read_loop: LOOP
FETCH cur INTO id, name, ts;
IF done THEN
LEAVE read_loop;
END IF;
IF id = 102 THEN
INSERT INTO class3_1 VALUES((SELECT max(id)+1 FROM class150@my_link1),'shuxue','yuhang',STR_TO_DATE('25-09-2002 12:01:33.3333','%d-%m-%Y %H:%i:%s.%f'));
INSERT INTO class3_1(name) VALUES((SELECT name FROM v_class2 WHERE id=102));
END IF;
END LOOP;
CLOSE cur;
RETURN 1;
END //
SELECT p1();
p1()
1
SELECT * FROM class3_1 order by 1,2,3,4;
id	name	location	create_time
delete from class3_1;
DROP FUNCTION IF EXISTS p1;//
CREATE FUNCTION p1()
RETURNS INT
DETERMINISTIC
BEGIN
DECLARE done INT DEFAULT FALSE;
DECLARE id INT;
DECLARE name VARCHAR(255);
DECLARE ts TIMESTAMP;
DECLARE cur CURSOR FOR SELECT id,name,create_time FROM v_class1;
DECLARE CONTINUE HANDLER FOR NOT FOUND SET done = TRUE;
OPEN cur;
read_loop: LOOP
FETCH cur INTO id, name, ts;
IF done THEN
LEAVE read_loop;
END IF;
IF id = 102 THEN
INSERT INTO class3_1 VALUES((SELECT max(id)+1 FROM v_class1),'shuxue','yuhang',STR_TO_DATE('25-09-2002 12:01:33.3333','%d-%m-%Y %H:%i:%s.%f'));
INSERT INTO class3_1(name) VALUES((SELECT name FROM v_class2 WHERE id=102));
END IF;
END LOOP;
CLOSE cur;
RETURN 1;
END //
SELECT p1();
p1()
1
SELECT * FROM class3_1 order by 1,2,3,4;
id	name	location	create_time
delete from class3_1;
DROP FUNCTION IF EXISTS my_func;//
CREATE FUNCTION my_func(in1 INT) RETURNS INT
BEGIN
DECLARE cnt INT DEFAULT 0;
DECLARE id INT;
DECLARE name VARCHAR(50);
DECLARE ts TIMESTAMP;
DECLARE cur CURSOR FOR SELECT id, name, create_time FROM class150;
DECLARE CONTINUE HANDLER FOR NOT FOUND SET cnt = -1;
OPEN cur;
read_loop: LOOP
FETCH cur INTO id, name, ts;
IF cnt = -1 THEN
LEAVE read_loop;
END IF;
IF id = in1 THEN
UPDATE class150 SET name = CONCAT(name, '_new') WHERE id = id;
INSERT INTO class150(id, name, create_time) VALUES(id+1, CONCAT(name, '_new'), NOW());
END IF;
END LOOP;
CLOSE cur;
RETURN cnt;
END //
SELECT my_func(10);
my_func(10)
-1
SELECT * FROM class3_1 order by 1,2,3,4;
id	name	location	create_time
delete from class3_1;
#mysql_dblink_read-08-04	触发器
DROP TABLE if exists class3_1;
CREATE TABLE class3_1 AS SELECT * FROM class333 where 1=0;
DROP TABLE if exists stu3_1;
CREATE TABLE stu3_1 AS SELECT * FROM stu333 where 1=0;
DROP TRIGGER if exists test_trig;//
Warnings:
Note	1360	Trigger does not exist
CREATE TRIGGER test_trig
BEFORE INSERT ON stu3_1
FOR EACH ROW
BEGIN
IF 1>0 THEN
INSERT INTO class3_1(id, name, location) VALUES((SELECT MAX(id)+1 FROM class233@my_link2), 'shuxue', 'yuhang');
INSERT INTO class3_1(name) VALUES((SELECT name FROM syn_class1 WHERE id=102));
END IF;
END //
DELETE FROM stu3_1 WHERE id=1001;
INSERT INTO stu3_1 SELECT * FROM stu333 ;
SELECT * FROM class3_1 order by 1,2,3,4;
id	name	location	create_time
NULL	dianzi	NULL	NULL
NULL	dianzi	NULL	NULL
NULL	dianzi	NULL	NULL
NULL	dianzi	NULL	NULL
NULL	dianzi	NULL	NULL
NULL	dianzi	NULL	NULL
NULL	dianzi	NULL	NULL
107	shuxue	yuhang	NULL
107	shuxue	yuhang	NULL
107	shuxue	yuhang	NULL
107	shuxue	yuhang	NULL
107	shuxue	yuhang	NULL
107	shuxue	yuhang	NULL
107	shuxue	yuhang	NULL
SELECT * FROM stu3_1 order by 1,2,3,4,5,6,7;
id	p_id	name	alias	birth	weight	c_id
1001	NULL	zhangsan	zs	1991-09-25	47.5	101
1002	1001	lisi	ls	1992-09-25	57.5	101
1003	1001	wangwu	ww	1993-09-25	67.5	102
1004	1002	zhaoliu	zl	1994-09-25	77.5	102
1005	1002	zhangsi	zs	1995-09-25	87.5	103
1006	1002	liwu	lw	1996-09-25	37.5	103
1007	1003	wangliu	wl	1997-09-25	97.5	103
drop trigger test_trig;
#清理环境
purge recyclebin;
