purge recyclebin;
#新建本地用户
drop user lcq1 ;
create user 'lcq1' identified by 'lcq';
GRANT all privileges ON *.* TO 'lcq1'@'%' WITH GRANT OPTION;
drop user lcq2 ;
create user 'lcq2' identified by 'lcq';
GRANT all privileges ON *.* TO 'lcq2'@'%' WITH GRANT OPTION;
drop user lcq3 ;
create user 'lcq3' identified by 'lcq';
GRANT all privileges ON *.* TO 'lcq3'@'%' WITH GRANT OPTION;
#新建远端dblink租户、用户
drop user lcq1 ;
create user 'lcq1' identified by 'lcq';
GRANT all privileges ON *.* TO 'lcq1'@'%' WITH GRANT OPTION;
drop user lcq2 ;
create user 'lcq2' identified by 'lcq';
GRANT all privileges ON *.* TO 'lcq2'@'%' WITH GRANT OPTION;
drop user lcq3 ;
create user 'lcq3' identified by 'lcq';
GRANT all privileges ON *.* TO 'lcq3'@'%' WITH GRANT OPTION;
set autocommit = on;
set ob_query_timeout=99900000000;
set ob_trx_timeout = 1000000000;
SET NAMES UTF8;
b
1
month_id
201710
month_id
201710
SELECT 1;
1
1
set autocommit = on;
set ob_query_timeout=99900000000;
set ob_trx_timeout = 1000000000;
SET NAMES UTF8;
b
1
month_id
201710
month_id
201710
SELECT 1;
1
1
set autocommit = on;
set ob_query_timeout=99900000000;
set ob_trx_timeout = 1000000000;
SET NAMES UTF8;
b
1
month_id
201710
month_id
201710
SELECT 1;
1
1
set autocommit = on;
set autocommit = on;
set ob_query_timeout=99900000000;
set ob_trx_timeout = 1000000000;
SET NAMES UTF8;
#mysql_dblink_read-06	dml
#mysql_dblink_read-06-1	普通select语句
SELECT s.id,s.name,c.location,c.create_time FROM stu150@my_link1 s, class233@my_link2 c WHERE c.id=s.c_id AND s.id=1004 order by 1,2,3,4;
id	name	location	create_time
1004	zhaoliu	xixi	2008-09-25 12:01:33.33330
SELECT s.id,s.name,c.location,c.create_time FROM stu150@my_link1 s, class233@my_link2 c WHERE s.id=1004 order by 1,2,3,4;
id	name	location	create_time
1004	zhaoliu	binjiang	2005-09-25 12:01:33.33330
1004	zhaoliu	binjiang	2018-09-25 12:01:33.33330
1004	zhaoliu	xiaoshan	2007-10-10 00:00:00.00000
1004	zhaoliu	xixi	2008-09-25 12:01:33.33330
1004	zhaoliu	xixi	2020-09-25 12:01:33.33330
SELECT s.id,s.name,c.location,c.create_time FROM stu233@my_link2 s, class150@my_link1 c WHERE c.id=s.c_id AND s.id=1004 order by 1,2,3,4;
id	name	location	create_time
1004	zhaoliu	xixi	2008-09-25 12:01:33.33330
SELECT s.id,s.name,c.location,c.create_time FROM stu233@my_link2 s, class150@my_link1 c WHERE s.id=1004 order by 1,2,3,4;
id	name	location	create_time
1004	zhaoliu	binjiang	2005-09-25 12:01:33.33330
1004	zhaoliu	binjiang	2018-09-25 12:01:33.33330
1004	zhaoliu	xiaoshan	2007-10-10 00:00:00.00000
1004	zhaoliu	xixi	2008-09-25 12:01:33.33330
1004	zhaoliu	xixi	2020-09-25 12:01:33.33330
#mysql_dblink_read-06-1-3	with as
#本地表+远端表
WITH a AS (SELECT * FROM class150@my_link1),
b AS (SELECT * FROM stu233@my_link2) 
SELECT DISTINCT a.id,a.name,b.id,b.name FROM a JOIN b ON a.id=b.c_id order by 1,2,3,4;
id	name	id	name
101	yinyue	1001	zhangsan
101	yinyue	1002	lisi
102	dianzi	1003	wangwu
102	dianzi	1004	zhaoliu
103	jisuanji	1005	zhangsi
103	jisuanji	1006	liwu
103	jisuanji	1007	wangliu
WITH a AS (SELECT * FROM stu233@my_link2),
b AS (SELECT * FROM class150@my_link1) 
SELECT m.e,m.r FROM (SELECT a.id q,b.id w,a.name e,b.name r FROM a,b) m order by 1,2;
e	r
lisi	baba
lisi	dianzi
lisi	jisuanji
lisi	yinyue
lisi	yishu
liwu	baba
liwu	dianzi
liwu	jisuanji
liwu	yinyue
liwu	yishu
wangliu	baba
wangliu	dianzi
wangliu	jisuanji
wangliu	yinyue
wangliu	yishu
wangwu	baba
wangwu	dianzi
wangwu	jisuanji
wangwu	yinyue
wangwu	yishu
zhangsan	baba
zhangsan	dianzi
zhangsan	jisuanji
zhangsan	yinyue
zhangsan	yishu
zhangsi	baba
zhangsi	dianzi
zhangsi	jisuanji
zhangsi	yinyue
zhangsi	yishu
zhaoliu	baba
zhaoliu	dianzi
zhaoliu	jisuanji
zhaoliu	yinyue
zhaoliu	yishu
WITH a AS (SELECT * FROM class233@my_link2),
b AS (SELECT * FROM stu150@my_link1) 
SELECT count(*) FROM b LEFT JOIN a ON b.c_id=a.id GROUP BY a.id HAVING a.id IN (SELECT id FROM class233@my_link2) order by 1;
count(*)
2
2
3
WITH a AS (SELECT * FROM stu150@my_link1),
b AS (SELECT * FROM class233@my_link2) 
SELECT DISTINCT a.name,b.name FROM a JOIN b ON a.c_id=b.id INTERSECT SELECT m.e,m.r FROM (SELECT a.id q,b.id w,a.name e,b.name r FROM a,b) m order by 1,2;
name	name
lisi	yinyue
liwu	jisuanji
wangliu	jisuanji
wangwu	dianzi
zhangsan	yinyue
zhangsi	jisuanji
zhaoliu	dianzi
WITH a AS (SELECT DISTINCT n.id,m.name FROM stu233@my_link2 m JOIN class333 n ON n.id=m.c_id),
b AS (SELECT t.name FROM (SELECT n.id,m.name FROM stu150@my_link1 m,class150@my_link1 n) t)
SELECT a.id,a.name,b.name FROM a,b WHERE trim(a.name)=trim(b.name) order by 1,2,3;
id	name	name
101	lisi	lisi
101	lisi	lisi
101	lisi	lisi
101	lisi	lisi
101	lisi	lisi
101	zhangsan	zhangsan
101	zhangsan	zhangsan
101	zhangsan	zhangsan
101	zhangsan	zhangsan
101	zhangsan	zhangsan
102	wangwu	wangwu
102	wangwu	wangwu
102	wangwu	wangwu
102	wangwu	wangwu
102	wangwu	wangwu
102	zhaoliu	zhaoliu
102	zhaoliu	zhaoliu
102	zhaoliu	zhaoliu
102	zhaoliu	zhaoliu
102	zhaoliu	zhaoliu
103	liwu	liwu
103	liwu	liwu
103	liwu	liwu
103	liwu	liwu
103	liwu	liwu
103	wangliu	wangliu
103	wangliu	wangliu
103	wangliu	wangliu
103	wangliu	wangliu
103	wangliu	wangliu
103	zhangsi	zhangsi
103	zhangsi	zhangsi
103	zhangsi	zhangsi
103	zhangsi	zhangsi
103	zhangsi	zhangsi
WITH a AS (SELECT count(*) m FROM stu150@my_link1 s LEFT JOIN class333 c ON s.c_id=c.id GROUP BY c.id HAVING c.id IN (SELECT id FROM class233@my_link2)),
b AS (SELECT DISTINCT s.name t,c.name FROM stu150@my_link1 s JOIN class233@my_link2 c ON s.c_id=c.id INTERSECT SELECT m.e,m.r FROM (SELECT s.id q,c.id w,s.name e,c.name r FROM stu150@my_link1 s,class233@my_link2 c) m)
SELECT DISTINCT a.m,b.t FROM a,b order by 1,2;
m	t
2	lisi
2	liwu
2	wangliu
2	wangwu
2	zhangsan
2	zhangsi
2	zhaoliu
3	lisi
3	liwu
3	wangliu
3	wangwu
3	zhangsan
3	zhangsi
3	zhaoliu
WITH a AS (SELECT count(*) m FROM stu150@my_link1 s LEFT JOIN class150@my_link1 c ON s.c_id=c.id GROUP BY c.id HAVING c.id IN (SELECT id FROM class150@my_link1)),
b AS (SELECT DISTINCT s.name t,c.name FROM stu233@my_link2 s JOIN class233@my_link2 c ON s.c_id=c.id INTERSECT SELECT m.e,m.r FROM (SELECT s.id q,c.id w,s.name e,c.name r FROM stu150@my_link1 s,class333 c) m)
SELECT DISTINCT a.m,b.t FROM a,b order by 1,2;
m	t
2	lisi
2	liwu
2	wangliu
2	wangwu
2	zhangsan
2	zhangsi
2	zhaoliu
3	lisi
3	liwu
3	wangliu
3	wangwu
3	zhangsan
3	zhangsi
3	zhaoliu
#远端表+远端表（同一个dblink）
WITH a AS (SELECT * FROM class233@my_link2),
b AS (SELECT * FROM stu150@my_link1) 
SELECT DISTINCT a.id,a.name,b.id,b.name FROM a JOIN b ON a.id=b.c_id order by 1,2,3,4;
id	name	id	name
101	yinyue	1001	zhangsan
101	yinyue	1002	lisi
102	dianzi	1003	wangwu
102	dianzi	1004	zhaoliu
103	jisuanji	1005	zhangsi
103	jisuanji	1006	liwu
103	jisuanji	1007	wangliu
WITH a AS (SELECT * FROM stu150@my_link1),
b AS (SELECT * FROM class233@my_link2) 
SELECT m.e,m.r FROM (SELECT a.id q,b.id w,a.name e,b.name r FROM a,b) m order by 1,2;
e	r
lisi	baba
lisi	dianzi
lisi	jisuanji
lisi	yinyue
lisi	yishu
liwu	baba
liwu	dianzi
liwu	jisuanji
liwu	yinyue
liwu	yishu
wangliu	baba
wangliu	dianzi
wangliu	jisuanji
wangliu	yinyue
wangliu	yishu
wangwu	baba
wangwu	dianzi
wangwu	jisuanji
wangwu	yinyue
wangwu	yishu
zhangsan	baba
zhangsan	dianzi
zhangsan	jisuanji
zhangsan	yinyue
zhangsan	yishu
zhangsi	baba
zhangsi	dianzi
zhangsi	jisuanji
zhangsi	yinyue
zhangsi	yishu
zhaoliu	baba
zhaoliu	dianzi
zhaoliu	jisuanji
zhaoliu	yinyue
zhaoliu	yishu
WITH a AS (SELECT * FROM class233@my_link2),
b AS (SELECT * FROM stu150@my_link1) 
SELECT count(*) FROM b LEFT JOIN a ON b.c_id=a.id GROUP BY a.id HAVING a.id IN (SELECT id FROM class233@my_link1) order by 1;
count(*)
2
2
3
WITH a AS (SELECT * FROM stu150@my_link1),
b AS (SELECT * FROM class233@my_link2) 
SELECT DISTINCT a.name,b.name FROM a JOIN b ON a.c_id=b.id INTERSECT SELECT m.e,m.r FROM (SELECT a.id q,b.id w,a.name e,b.name r FROM a,b) m order by 1,2;
name	name
lisi	yinyue
liwu	jisuanji
wangliu	jisuanji
wangwu	dianzi
zhangsan	yinyue
zhangsi	jisuanji
zhaoliu	dianzi
WITH a AS (SELECT DISTINCT n.id,m.name FROM stu150@my_link1 m JOIN class233@my_link2 n ON n.id=m.c_id),
b AS (SELECT t.name FROM (SELECT n.id,m.name FROM stu150@my_link1 m,class233@my_link2 n) t)
SELECT a.id,a.name,b.name FROM a,b WHERE trim(a.name)=trim(b.name) order by 1,2,3;
id	name	name
101	lisi	lisi
101	lisi	lisi
101	lisi	lisi
101	lisi	lisi
101	lisi	lisi
101	zhangsan	zhangsan
101	zhangsan	zhangsan
101	zhangsan	zhangsan
101	zhangsan	zhangsan
101	zhangsan	zhangsan
102	wangwu	wangwu
102	wangwu	wangwu
102	wangwu	wangwu
102	wangwu	wangwu
102	wangwu	wangwu
102	zhaoliu	zhaoliu
102	zhaoliu	zhaoliu
102	zhaoliu	zhaoliu
102	zhaoliu	zhaoliu
102	zhaoliu	zhaoliu
103	liwu	liwu
103	liwu	liwu
103	liwu	liwu
103	liwu	liwu
103	liwu	liwu
103	wangliu	wangliu
103	wangliu	wangliu
103	wangliu	wangliu
103	wangliu	wangliu
103	wangliu	wangliu
103	zhangsi	zhangsi
103	zhangsi	zhangsi
103	zhangsi	zhangsi
103	zhangsi	zhangsi
103	zhangsi	zhangsi
WITH a AS (SELECT count(*) m FROM stu233@my_link2 s LEFT JOIN class150@my_link1 c ON s.c_id=c.id GROUP BY c.id HAVING c.id IN (SELECT id FROM class150@my_link1)),
b AS (SELECT DISTINCT s.name t,c.name FROM stu150@my_link1 s JOIN class150@my_link1 c ON s.c_id=c.id INTERSECT SELECT m.e,m.r FROM (SELECT s.id q,c.id w,s.name e,c.name r FROM stu233@my_link2 s,class150@my_link1 c) m)
SELECT DISTINCT a.m,b.t FROM a,b order by 1,2;
m	t
2	lisi
2	liwu
2	wangliu
2	wangwu
2	zhangsan
2	zhangsi
2	zhaoliu
3	lisi
3	liwu
3	wangliu
3	wangwu
3	zhangsan
3	zhangsi
3	zhaoliu
#远端表+远端表（不同的dblink）
WITH a AS (SELECT * FROM class150@my_link1),
b AS (SELECT * FROM stu233@my_link2) 
SELECT DISTINCT a.id,a.name,b.id,b.name FROM a JOIN b ON a.id=b.c_id order by 1,2,3,4;
id	name	id	name
101	yinyue	1001	zhangsan
101	yinyue	1002	lisi
102	dianzi	1003	wangwu
102	dianzi	1004	zhaoliu
103	jisuanji	1005	zhangsi
103	jisuanji	1006	liwu
103	jisuanji	1007	wangliu
WITH a AS (SELECT * FROM class233@my_link2),b AS (SELECT * FROM stu150@my_link1)
SELECT DISTINCT a.id,b.name FROM a JOIN b ON a.id=b.c_id WHERE b.name='liwu' order by 1,2;
id	name
103	liwu
WITH a AS (SELECT * FROM stu233@my_link2),
b AS (SELECT * FROM class150@my_link1) 
SELECT m.e,m.r FROM (SELECT a.id q,b.id w,a.name e,b.name r FROM a,b) m order by 1,2;
e	r
lisi	baba
lisi	dianzi
lisi	jisuanji
lisi	yinyue
lisi	yishu
liwu	baba
liwu	dianzi
liwu	jisuanji
liwu	yinyue
liwu	yishu
wangliu	baba
wangliu	dianzi
wangliu	jisuanji
wangliu	yinyue
wangliu	yishu
wangwu	baba
wangwu	dianzi
wangwu	jisuanji
wangwu	yinyue
wangwu	yishu
zhangsan	baba
zhangsan	dianzi
zhangsan	jisuanji
zhangsan	yinyue
zhangsan	yishu
zhangsi	baba
zhangsi	dianzi
zhangsi	jisuanji
zhangsi	yinyue
zhangsi	yishu
zhaoliu	baba
zhaoliu	dianzi
zhaoliu	jisuanji
zhaoliu	yinyue
zhaoliu	yishu
WITH a AS (SELECT * FROM class233@my_link2),
b AS (SELECT * FROM stu150@my_link1) 
SELECT count(*) FROM b LEFT JOIN a ON b.c_id=a.id GROUP BY a.id HAVING a.id IN (SELECT id FROM class150@my_link1) order by 1;
count(*)
2
2
3
WITH a AS (SELECT * FROM stu150@my_link1),
b AS (SELECT * FROM class233@my_link2) 
SELECT DISTINCT a.name,b.name FROM a JOIN b ON a.c_id=b.id INTERSECT SELECT m.e,m.r FROM (SELECT a.id q,b.id w,a.name e,b.name r FROM a,b) m order by 1,2;
name	name
lisi	yinyue
liwu	jisuanji
wangliu	jisuanji
wangwu	dianzi
zhangsan	yinyue
zhangsi	jisuanji
zhaoliu	dianzi
WITH a AS (SELECT DISTINCT n.id,m.name FROM stu233@my_link2 m JOIN class150@my_link1 n ON n.id=m.c_id),
b AS (SELECT t.name FROM (SELECT n.id,m.name FROM stu233@my_link2 m,class150@my_link1 n) t)
SELECT a.id,a.name,b.name FROM a,b WHERE trim(a.name)=trim(b.name) order by 1,2,3;
id	name	name
101	lisi	lisi
101	lisi	lisi
101	lisi	lisi
101	lisi	lisi
101	lisi	lisi
101	zhangsan	zhangsan
101	zhangsan	zhangsan
101	zhangsan	zhangsan
101	zhangsan	zhangsan
101	zhangsan	zhangsan
102	wangwu	wangwu
102	wangwu	wangwu
102	wangwu	wangwu
102	wangwu	wangwu
102	wangwu	wangwu
102	zhaoliu	zhaoliu
102	zhaoliu	zhaoliu
102	zhaoliu	zhaoliu
102	zhaoliu	zhaoliu
102	zhaoliu	zhaoliu
103	liwu	liwu
103	liwu	liwu
103	liwu	liwu
103	liwu	liwu
103	liwu	liwu
103	wangliu	wangliu
103	wangliu	wangliu
103	wangliu	wangliu
103	wangliu	wangliu
103	wangliu	wangliu
103	zhangsi	zhangsi
103	zhangsi	zhangsi
103	zhangsi	zhangsi
103	zhangsi	zhangsi
103	zhangsi	zhangsi
WITH a AS (SELECT count(*) m FROM stu150@my_link1 s LEFT JOIN class233@my_link2 c ON s.c_id=c.id GROUP BY c.id HAVING c.id IN (SELECT id FROM class150@my_link1)),
b AS (SELECT DISTINCT s.name t,c.name FROM stu150@my_link1 s JOIN class233@my_link2 c ON s.c_id=c.id INTERSECT SELECT m.e,m.r FROM (SELECT s.id q,c.id w,s.name e,c.name r FROM stu150@my_link1 s,class233@my_link2 c) m)
SELECT DISTINCT a.m,b.t FROM a,b order by 1,2;
m	t
2	lisi
2	liwu
2	wangliu
2	wangwu
2	zhangsan
2	zhangsi
2	zhaoliu
3	lisi
3	liwu
3	wangliu
3	wangwu
3	zhangsan
3	zhangsi
3	zhaoliu
WITH a AS (SELECT count(*) m FROM stu150@my_link1 s LEFT JOIN class233@my_link2 c ON s.c_id=c.id GROUP BY c.id HAVING c.id IN (SELECT id FROM class333)),
b AS (SELECT DISTINCT s.name t,c.name FROM stu150@my_link1 s JOIN class233@my_link2 c ON s.c_id=c.id INTERSECT SELECT m.e,m.r FROM (SELECT s.id q,c.id w,s.name e,c.name r FROM stu150@my_link1 s,class233@my_link2 c) m)
SELECT DISTINCT a.m,b.t FROM a,b order by 1,2;
m	t
2	lisi
2	liwu
2	wangliu
2	wangwu
2	zhangsan
2	zhangsi
2	zhaoliu
3	lisi
3	liwu
3	wangliu
3	wangwu
3	zhangsan
3	zhangsi
3	zhaoliu
#mysql_dblink_read-06-1-4	case when
SELECT sum(CASE WHEN round(LN(id),5)>0 THEN id-100 ELSE 1 END ) FROM class150@my_link1 WHERE id IN (SELECT DISTINCT c_id FROM stu233@my_link2) order by 1;
sum(CASE WHEN round(LN(id),5)>0 THEN id-100 ELSE 1 END )
6
SELECT sum(round(LN(CASE WHEN  round(LN(id),5)>0 THEN 2 ELSE 1 END),5)/round(LN(c_id),5)) FROM stu150@my_link1 order by 1;
sum(round(LN(CASE WHEN  round(LN(id),5)>0 THEN 2 ELSE 1 END),5)/round(LN(c_id),5))
1.048791619
SELECT sum(round(LN(CASE id WHEN 101 THEN round(LN(id),5) WHEN 102 THEN round(LN(id+100),5) ELSE 10 END),5)/round(LN(id),5)) t1 FROM class233@my_link2 order by 1;
t1
2.178646012
SELECT sum(round(LN(CASE round(LN(id),5) WHEN round(LN(1002),5) THEN 1 ELSE 2 END),5)) FROM stu233@my_link2 order by 1;
sum(round(LN(CASE round(LN(id),5) WHEN round(LN(1002),5) THEN 1 ELSE 2 END),5))
4.15890
SELECT sum(CASE WHEN round(LN(id),5)>0 THEN id-100 ELSE 1 END ) FROM class150@my_link1 UNION SELECT sum(round(LN(CASE WHEN  round(LN(id),5)>0 THEN 2 ELSE 1 END),5)/round(LN(c_id),5)) FROM stu233@my_link2 order by 1;
sum(CASE WHEN round(LN(id),5)>0 THEN id-100 ELSE 1 END )
1.048791619
16.000000000
#mysql_dblink_read-06-2	层级查询
#mysql_dblink_read-06-2-1	select ... from ... where ... start with ... connect by ... order by ...
WITH RECURSIVE subcategories AS (
SELECT id, name, p_id
FROM stu233
WHERE id = 102
UNION ALL
SELECT c.id, c.name, c.p_id
FROM stu233 c
JOIN subcategories s ON s.id = c.p_id
)
SELECT id, name
FROM subcategories
WHERE id != 1002;
id	name
WITH RECURSIVE subcategories AS (
SELECT id, name, p_id
FROM stu233@my_link1
WHERE id = 102
UNION ALL
SELECT c.id, c.name, c.p_id
FROM stu233@my_link2 c
JOIN subcategories s ON s.id = c.id
)
SELECT id, name
FROM subcategories
WHERE id != 1002;
id	name
#mysql_dblink_read-06-3	子查询
select * from (select id + p_id, c_id from stu150@my_link1 t1 where id < 1005) v where c_id > 1 order by c_id,1;
id + p_id	c_id
NULL	101
2003	101
2004	102
2006	102
select /*+ no_rewrite */* from (select id + p_id, c_id from stu150@my_link1 t1 where id < 1005) v where c_id > 1 order by c_id,1;
id + p_id	c_id
NULL	101
2003	101
2004	102
2006	102
#本地表嵌套远端表
SELECT round(LN((SELECT MIN(id) FROM class150@my_link1)),5) FROM dual;
round(LN((SELECT MIN(id) FROM class150@my_link1)),5)
4.61512
SELECT * FROM (SELECT DISTINCT id,name,birth,c_id FROM stu150@my_link1) s, class233@my_link2 c WHERE c.id=s.c_id AND s.id<1005 order by 1,2,3,4,5,6,7,8;
id	name	birth	c_id	id	name	location	create_time
1001	zhangsan	1991-09-25	101	101	yinyue	binjiang	2005-09-25 12:01:33.33330
1002	lisi	1992-09-25	101	101	yinyue	binjiang	2005-09-25 12:01:33.33330
1003	wangwu	1993-09-25	102	102	dianzi	xixi	2008-09-25 12:01:33.33330
1004	zhaoliu	1994-09-25	102	102	dianzi	xixi	2008-09-25 12:01:33.33330
SELECT * FROM stu333 WHERE birth BETWEEN (SELECT MIN(birth) FROM stu150@my_link1) AND (SELECT MAX(birth) FROM stu233@my_link2) order by 1,2,3,4,5,6,7;
id	p_id	name	alias	birth	weight	c_id
1001	NULL	zhangsan	zs	1991-09-25	47.5	101
1002	1001	lisi	ls	1992-09-25	57.5	101
1003	1001	wangwu	ww	1993-09-25	67.5	102
1004	1002	zhaoliu	zl	1994-09-25	77.5	102
1005	1002	zhangsi	zs	1995-09-25	87.5	103
1006	1002	liwu	lw	1996-09-25	37.5	103
1007	1003	wangliu	wl	1997-09-25	97.5	103
SELECT * FROM stu333 WHERE EXISTS(SELECT max(m) FROM (SELECT sum(CASE WHEN round(LN(id),5)>0 THEN id-100 ELSE 1 END ) m FROM class150@my_link1 UNION SELECT sum(round(LN(CASE WHEN  round(LN(id),5)>0 THEN 2 ELSE 1 END),5)/round(LN(c_id),5)) FROM stu233@my_link2)) order by 1,2,3,4,5,6,7;
id	p_id	name	alias	birth	weight	c_id
1001	NULL	zhangsan	zs	1991-09-25	47.5	101
1002	1001	lisi	ls	1992-09-25	57.5	101
1003	1001	wangwu	ww	1993-09-25	67.5	102
1004	1002	zhaoliu	zl	1994-09-25	77.5	102
1005	1002	zhangsi	zs	1995-09-25	87.5	103
1006	1002	liwu	lw	1996-09-25	37.5	103
1007	1003	wangliu	wl	1997-09-25	97.5	103
SELECT c_id||'''' FROM stu333 GROUP BY c_id HAVING c_id IN (SELECT DISTINCT s.c_id FROM stu233@my_link2 s LEFT JOIN class150@my_link1 c ON s.c_id=c.id) order by 1;
c_id||''''
1
1
1
SELECT c_id FROM stu333 GROUP BY c_id HAVING count(c_id) IN (
SELECT DISTINCT m FROM (
WITH a AS (SELECT count(*) m FROM stu150@my_link1 s LEFT JOIN class233@my_link2 c ON s.c_id=c.id GROUP BY c.id HAVING c.id IN (SELECT id FROM class150@my_link1)),
b AS (SELECT DISTINCT s.name t,c.name FROM stu150@my_link1 s JOIN class233@my_link2 c ON s.c_id=c.id INTERSECT SELECT m.e,m.r FROM (SELECT s.id q,c.id w,s.name e,c.name r FROM stu150@my_link1 s,class233@my_link2 c) m)
SELECT DISTINCT a.m,b.t FROM a,b)) order by 1;
c_id
101
102
103
#远端表嵌套本地表
SELECT round(LN((SELECT MIN(id) FROM class333)),5) FROM class150@my_link1 order by 1;
round(LN((SELECT MIN(id) FROM class333)),5)
4.61512
4.61512
4.61512
4.61512
4.61512
SELECT * FROM (SELECT DISTINCT id,name,birth,c_id FROM stu333) s, class233@my_link2 c WHERE c.id=s.c_id AND s.id<1005 order by 1,2,3,4,5,6,7,8;
id	name	birth	c_id	id	name	location	create_time
1001	zhangsan	1991-09-25	101	101	yinyue	binjiang	2005-09-25 12:01:33.33330
1002	lisi	1992-09-25	101	101	yinyue	binjiang	2005-09-25 12:01:33.33330
1003	wangwu	1993-09-25	102	102	dianzi	xixi	2008-09-25 12:01:33.33330
1004	zhaoliu	1994-09-25	102	102	dianzi	xixi	2008-09-25 12:01:33.33330
SELECT * FROM stu150@my_link1 WHERE birth BETWEEN (SELECT MIN(birth) FROM stu333) AND (SELECT MAX(birth) FROM stu333) order by 1,2,3,4,5,6,7;
id	p_id	name	alias	birth	weight	c_id
1001	NULL	zhangsan	zs	1991-09-25	47.5	101
1002	1001	lisi	ls	1992-09-25	57.5	101
1003	1001	wangwu	ww	1993-09-25	67.5	102
1004	1002	zhaoliu	zl	1994-09-25	77.5	102
1005	1002	zhangsi	zs	1995-09-25	87.5	103
1006	1002	liwu	lw	1996-09-25	37.5	103
1007	1003	wangliu	wl	1997-09-25	97.5	103
SELECT * FROM stu233@my_link2 WHERE EXISTS(SELECT max(m) FROM (SELECT sum(CASE WHEN round(LN(id),5)>0 THEN id-100 ELSE 1 END ) m FROM class333 UNION SELECT sum(round(LN(CASE WHEN  round(LN(id),5)>0 THEN 2 ELSE 1 END),5)/round(LN(c_id),5)) FROM stu333)) order by 1,2,3,4,5,6,7;
id	p_id	name	alias	birth	weight	c_id
1001	NULL	zhangsan	zs	1991-09-25	47.5	101
1002	1001	lisi	ls	1992-09-25	57.5	101
1003	1001	wangwu	ww	1993-09-25	67.5	102
1004	1002	zhaoliu	zl	1994-09-25	77.5	102
1005	1002	zhangsi	zs	1995-09-25	87.5	103
1006	1002	liwu	lw	1996-09-25	37.5	103
1007	1003	wangliu	wl	1997-09-25	97.5	103
SELECT c_id||'''' FROM stu233@my_link2 GROUP BY c_id HAVING c_id IN (SELECT DISTINCT s.c_id FROM stu333 s LEFT JOIN class333 c ON s.c_id=c.id) order by 1;
c_id||''''
1
1
1
SELECT c_id FROM stu150@my_link1 GROUP BY c_id HAVING count(c_id) IN (
SELECT DISTINCT m FROM (
WITH a AS (SELECT count(*) m FROM stu333 s LEFT JOIN class333 c ON s.c_id=c.id GROUP BY c.id HAVING c.id IN (SELECT id FROM class333)),
b AS (SELECT DISTINCT s.name t,c.name FROM stu333 s JOIN class333 c ON s.c_id=c.id INTERSECT SELECT m.e,m.r FROM (SELECT s.id q,c.id w,s.name e,c.name r FROM stu333 s,class333 c) m)
SELECT DISTINCT a.m,b.t FROM a,b)) order by 1;
c_id
101
102
103
#远端表嵌套远端表（同一个dblink）
SELECT round(LN((SELECT MIN(id) FROM stu150@my_link1)),5) FROM class150@my_link1 order by 1;
round(LN((SELECT MIN(id) FROM stu150@my_link1)),5)
6.90875
6.90875
6.90875
6.90875
6.90875
SELECT * FROM (SELECT DISTINCT id,name,birth,c_id FROM stu150@my_link1) s, class150@my_link1 c WHERE c.id=s.c_id AND s.id<1005 order by 1,2,3,4,5,6,7,8;
id	name	birth	c_id	id	name	location	create_time
1001	zhangsan	1991-09-25	101	101	yinyue	binjiang	2005-09-25 12:01:33.33330
1002	lisi	1992-09-25	101	101	yinyue	binjiang	2005-09-25 12:01:33.33330
1003	wangwu	1993-09-25	102	102	dianzi	xixi	2008-09-25 12:01:33.33330
1004	zhaoliu	1994-09-25	102	102	dianzi	xixi	2008-09-25 12:01:33.33330
SELECT * FROM stu233@my_link2 WHERE birth BETWEEN (SELECT MIN(birth) FROM stu233@my_link2) AND (SELECT MAX(birth) FROM stu233@my_link2) order by 1,2,3,4,5,6,7;
id	p_id	name	alias	birth	weight	c_id
1001	NULL	zhangsan	zs	1991-09-25	47.5	101
1002	1001	lisi	ls	1992-09-25	57.5	101
1003	1001	wangwu	ww	1993-09-25	67.5	102
1004	1002	zhaoliu	zl	1994-09-25	77.5	102
1005	1002	zhangsi	zs	1995-09-25	87.5	103
1006	1002	liwu	lw	1996-09-25	37.5	103
1007	1003	wangliu	wl	1997-09-25	97.5	103
SELECT * FROM stu233@my_link2 WHERE EXISTS(SELECT max(m) FROM (SELECT sum(CASE WHEN round(LN(id),5)>0 THEN id-100 ELSE 1 END ) m FROM class233@my_link2 UNION SELECT sum(round(LN(CASE WHEN  round(LN(id),5)>0 THEN 2 ELSE 1 END),5)/round(LN(c_id),5)) FROM stu233@my_link2)) order by 1,2,3,4,5,6,7;
id	p_id	name	alias	birth	weight	c_id
1001	NULL	zhangsan	zs	1991-09-25	47.5	101
1002	1001	lisi	ls	1992-09-25	57.5	101
1003	1001	wangwu	ww	1993-09-25	67.5	102
1004	1002	zhaoliu	zl	1994-09-25	77.5	102
1005	1002	zhangsi	zs	1995-09-25	87.5	103
1006	1002	liwu	lw	1996-09-25	37.5	103
1007	1003	wangliu	wl	1997-09-25	97.5	103
SELECT c_id||'''' FROM stu150@my_link1 GROUP BY c_id HAVING c_id IN (SELECT DISTINCT s.c_id FROM stu150@my_link1 s LEFT JOIN class150@my_link1 c ON s.c_id=c.id) order by 1;
c_id||''''
1
1
1
SELECT c_id FROM stu150@my_link1 GROUP BY c_id HAVING count(c_id) IN (
SELECT DISTINCT m FROM (
WITH a AS (SELECT count(*) m FROM stu150@my_link1 s LEFT JOIN class150@my_link1 c ON s.c_id=c.id GROUP BY c.id HAVING c.id IN (SELECT id FROM class150@my_link1)),
b AS (SELECT DISTINCT s.name t,c.name FROM stu150@my_link1 s JOIN class150@my_link1 c ON s.c_id=c.id INTERSECT SELECT m.e,m.r FROM (SELECT s.id q,c.id w,s.name e,c.name r FROM stu150@my_link1 s,class150@my_link1 c) m)
SELECT DISTINCT a.m,b.t FROM a,b)) order by 1;
c_id
101
102
103
#远端表嵌套远端表（不同的dblink）
SELECT round(LN((SELECT MIN(id) FROM class150@my_link1)),5) FROM stu233@my_link2 order by 1;
round(LN((SELECT MIN(id) FROM class150@my_link1)),5)
4.61512
4.61512
4.61512
4.61512
4.61512
4.61512
4.61512
SELECT * FROM (SELECT DISTINCT id,name,birth,c_id FROM stu150@my_link1) s, class233@my_link2 c WHERE c.id=s.c_id AND s.id<1005 order by 1,2,3,4,5,6,7,8;
id	name	birth	c_id	id	name	location	create_time
1001	zhangsan	1991-09-25	101	101	yinyue	binjiang	2005-09-25 12:01:33.33330
1002	lisi	1992-09-25	101	101	yinyue	binjiang	2005-09-25 12:01:33.33330
1003	wangwu	1993-09-25	102	102	dianzi	xixi	2008-09-25 12:01:33.33330
1004	zhaoliu	1994-09-25	102	102	dianzi	xixi	2008-09-25 12:01:33.33330
SELECT * FROM stu150@my_link1 WHERE birth BETWEEN (SELECT MIN(birth) FROM stu233@my_link2) AND (SELECT MAX(birth) FROM stu233@my_link2) order by 1,2,3,4,5,6,7;
id	p_id	name	alias	birth	weight	c_id
1001	NULL	zhangsan	zs	1991-09-25	47.5	101
1002	1001	lisi	ls	1992-09-25	57.5	101
1003	1001	wangwu	ww	1993-09-25	67.5	102
1004	1002	zhaoliu	zl	1994-09-25	77.5	102
1005	1002	zhangsi	zs	1995-09-25	87.5	103
1006	1002	liwu	lw	1996-09-25	37.5	103
1007	1003	wangliu	wl	1997-09-25	97.5	103
SELECT * FROM stu233@my_link2 WHERE EXISTS(SELECT max(m) FROM (SELECT sum(CASE WHEN round(LN(id),5)>0 THEN id-100 ELSE 1 END ) m FROM class150@my_link1 UNION SELECT sum(round(LN(CASE WHEN  round(LN(id),5)>0 THEN 2 ELSE 1 END),5)/round(LN(c_id),5)) FROM stu150@my_link1)) order by 1,2,3,4,5,6,7;
id	p_id	name	alias	birth	weight	c_id
1001	NULL	zhangsan	zs	1991-09-25	47.5	101
1002	1001	lisi	ls	1992-09-25	57.5	101
1003	1001	wangwu	ww	1993-09-25	67.5	102
1004	1002	zhaoliu	zl	1994-09-25	77.5	102
1005	1002	zhangsi	zs	1995-09-25	87.5	103
1006	1002	liwu	lw	1996-09-25	37.5	103
1007	1003	wangliu	wl	1997-09-25	97.5	103
SELECT c_id||'''' FROM stu150@my_link1 GROUP BY c_id HAVING c_id IN (SELECT DISTINCT s.c_id FROM stu233@my_link2 s LEFT JOIN class233@my_link2 c ON s.c_id=c.id) order by 1;
c_id||''''
1
1
1
SELECT c_id FROM stu233@my_link2 GROUP BY c_id HAVING count(c_id) IN (
SELECT DISTINCT m FROM (
WITH a AS (SELECT count(*) m FROM stu150@my_link1 s LEFT JOIN class150@my_link1 c ON s.c_id=c.id GROUP BY c.id HAVING c.id IN (SELECT id FROM class150@my_link1)),
b AS (SELECT DISTINCT s.name t,c.name FROM stu150@my_link1 s JOIN class233@my_link2 c ON s.c_id=c.id INTERSECT SELECT m.e,m.r FROM (SELECT s.id q,c.id w,s.name e,c.name r FROM stu150@my_link1 s,class233@my_link2 c) m)
SELECT DISTINCT a.m,b.t FROM a,b)) order by 1;
c_id
101
102
103
#mysql_dblink_read-06-4	连接查询	
#mysql_dblink_read-06-4-1	[inner] join
SELECT * FROM stu233@my_link2 s INNER JOIN class150@my_link1 c ON s.c_id=c.id WHERE s.id>1004 order by 1,2,3,4,5,6,7,8,9,10,11;
id	p_id	name	alias	birth	weight	c_id	id	name	location	create_time
1005	1002	zhangsi	zs	1995-09-25	87.5	103	103	jisuanji	binjiang	2018-09-25 12:01:33.33330
1006	1002	liwu	lw	1996-09-25	37.5	103	103	jisuanji	binjiang	2018-09-25 12:01:33.33330
1007	1003	wangliu	wl	1997-09-25	97.5	103	103	jisuanji	binjiang	2018-09-25 12:01:33.33330
SELECT * FROM stu233@my_link2 s JOIN class150@my_link1 c ON s.c_id=c.id WHERE s.id<1004 order by 1,2,3,4,5,6,7,8,9,10,11;
id	p_id	name	alias	birth	weight	c_id	id	name	location	create_time
1001	NULL	zhangsan	zs	1991-09-25	47.5	101	101	yinyue	binjiang	2005-09-25 12:01:33.33330
1002	1001	lisi	ls	1992-09-25	57.5	101	101	yinyue	binjiang	2005-09-25 12:01:33.33330
1003	1001	wangwu	ww	1993-09-25	67.5	102	102	dianzi	xixi	2008-09-25 12:01:33.33330
SELECT * FROM (SELECT c_id FROM stu150@my_link1 WHERE id>1001 GROUP BY c_id HAVING c_id>101 ORDER BY c_id) a JOIN (SELECT DISTINCT id,name,location FROM class233@my_link2) b ON a.c_id=b.id order by 1,2,3,4;
c_id	id	name	location
102	102	dianzi	xixi
103	103	jisuanji	binjiang
SELECT * FROM (SELECT c_id FROM stu150@my_link1 WHERE id>1001 GROUP BY c_id HAVING c_id>101 ORDER BY c_id) a JOIN (SELECT DISTINCT id,name,location FROM class150@my_link1) b ON a.c_id=b.id order by 1,2,3,4;
c_id	id	name	location
102	102	dianzi	xixi
103	103	jisuanji	binjiang
SELECT * FROM (SELECT c_id FROM stu233@my_link2 WHERE id>1004 GROUP BY c_id HAVING c_id>101 UNION SELECT c_id FROM stu150@my_link1 WHERE id<1003 GROUP BY c_id HAVING c_id=101 ORDER BY c_id) a 
JOIN (SELECT DISTINCT id,name,location FROM class150@my_link1) b ON  a.c_id=b.id order by 1,2,3,4;
c_id	id	name	location
101	101	yinyue	binjiang
103	103	jisuanji	binjiang
SELECT a.id,a.name,a.alias,b.id,c.id,c.name FROM stu150@my_link1 a JOIN stu233@my_link2 b ON a.id=b.id JOIN class333 c ON a.c_id=c.id order by 1,2,3,4,5,6;
id	name	alias	id	id	name
1001	zhangsan	zs	1001	101	yinyue
1002	lisi	ls	1002	101	yinyue
1003	wangwu	ww	1003	102	dianzi
1004	zhaoliu	zl	1004	102	dianzi
1005	zhangsi	zs	1005	103	jisuanji
1006	liwu	lw	1006	103	jisuanji
1007	wangliu	wl	1007	103	jisuanji
SELECT b.* FROM (SELECT c_id FROM stu233@my_link2 WHERE id>1001 GROUP BY c_id HAVING c_id>101 ORDER BY c_id) a JOIN (SELECT DISTINCT id,name,location FROM class150@my_link1) b ON a.c_id=b.id order by 1,2,3;
id	name	location
102	dianzi	xixi
103	jisuanji	binjiang
SELECT * FROM (SELECT c_id FROM stu233@my_link2 WHERE id>1001 GROUP BY c_id HAVING c_id>101 ORDER BY c_id) a JOIN (SELECT DISTINCT id,name,location FROM class233@my_link2) b ON a.c_id=b.id order by 1,2,3,4;
c_id	id	name	location
102	102	dianzi	xixi
103	103	jisuanji	binjiang
SELECT * FROM stu233@my_link2 s JOIN class150@my_link1 c1 ON s.c_id=c1.id or s.id>105 join class233@my_link2 c2 on c2.id=c1.id and c1.id>102 WHERE s.id>1004 order by 1,2,3,4,5,6,7,8,9,10,11,12,13,14,15;
id	p_id	name	alias	birth	weight	c_id	id	name	location	create_time	id	name	location	create_time
1005	1002	zhangsi	zs	1995-09-25	87.5	103	103	jisuanji	binjiang	2018-09-25 12:01:33.33330	103	jisuanji	binjiang	2018-09-25 12:01:33.33330
1005	1002	zhangsi	zs	1995-09-25	87.5	103	104	yishu	xixi	2020-09-25 12:01:33.33330	104	yishu	xixi	2020-09-25 12:01:33.33330
1005	1002	zhangsi	zs	1995-09-25	87.5	103	106	baba	xiaoshan	2007-10-10 00:00:00.00000	106	baba	xiaoshan	2007-10-10 00:00:00.00000
1006	1002	liwu	lw	1996-09-25	37.5	103	103	jisuanji	binjiang	2018-09-25 12:01:33.33330	103	jisuanji	binjiang	2018-09-25 12:01:33.33330
1006	1002	liwu	lw	1996-09-25	37.5	103	104	yishu	xixi	2020-09-25 12:01:33.33330	104	yishu	xixi	2020-09-25 12:01:33.33330
1006	1002	liwu	lw	1996-09-25	37.5	103	106	baba	xiaoshan	2007-10-10 00:00:00.00000	106	baba	xiaoshan	2007-10-10 00:00:00.00000
1007	1003	wangliu	wl	1997-09-25	97.5	103	103	jisuanji	binjiang	2018-09-25 12:01:33.33330	103	jisuanji	binjiang	2018-09-25 12:01:33.33330
1007	1003	wangliu	wl	1997-09-25	97.5	103	104	yishu	xixi	2020-09-25 12:01:33.33330	104	yishu	xixi	2020-09-25 12:01:33.33330
1007	1003	wangliu	wl	1997-09-25	97.5	103	106	baba	xiaoshan	2007-10-10 00:00:00.00000	106	baba	xiaoshan	2007-10-10 00:00:00.00000
#mysql_dblink_read-06-4-2	left [outer] join
SELECT * FROM stu333 s LEFT OUTER JOIN class150@my_link1 c ON s.c_id=c.id WHERE s.id>1004 order by 1,2,3,4,5,6,7,8,9,10,11;
id	p_id	name	alias	birth	weight	c_id	id	name	location	create_time
1005	1002	zhangsi	zs	1995-09-25	87.5	103	103	jisuanji	binjiang	2018-09-25 12:01:33.33330
1006	1002	liwu	lw	1996-09-25	37.5	103	103	jisuanji	binjiang	2018-09-25 12:01:33.33330
1007	1003	wangliu	wl	1997-09-25	97.5	103	103	jisuanji	binjiang	2018-09-25 12:01:33.33330
SELECT * FROM stu233@my_link2 s LEFT JOIN class233@my_link2 c ON s.c_id=c.id WHERE s.id<1004 order by 1,2,3,4,5,6,7,8,9,10,11;
id	p_id	name	alias	birth	weight	c_id	id	name	location	create_time
1001	NULL	zhangsan	zs	1991-09-25	47.5	101	101	yinyue	binjiang	2005-09-25 12:01:33.33330
1002	1001	lisi	ls	1992-09-25	57.5	101	101	yinyue	binjiang	2005-09-25 12:01:33.33330
1003	1001	wangwu	ww	1993-09-25	67.5	102	102	dianzi	xixi	2008-09-25 12:01:33.33330
SELECT * FROM (SELECT c_id FROM stu150@my_link1 WHERE id>1001 GROUP BY c_id HAVING c_id>101 ORDER BY c_id) a LEFT JOIN (SELECT DISTINCT id,name,location FROM class233@my_link2) b ON a.c_id=b.id order by 1,2,3,4;
c_id	id	name	location
102	102	dianzi	xixi
103	103	jisuanji	binjiang
SELECT * FROM (SELECT c_id FROM stu333 WHERE id>1004 GROUP BY c_id HAVING c_id>101 UNION SELECT c_id FROM stu150@my_link1 WHERE id<1003 GROUP BY c_id HAVING c_id=101 ORDER BY c_id) a 
LEFT JOIN (SELECT DISTINCT id,name,location FROM class150@my_link1) b ON a.c_id=b.id order by 1,2,3,4;
c_id	id	name	location
101	101	yinyue	binjiang
103	103	jisuanji	binjiang
SELECT a.id,a.name,a.alias,b.id,c.id,c.name FROM stu150@my_link1 a LEFT JOIN stu233@my_link2 b ON a.id=b.id LEFT JOIN class233@my_link2 c ON a.c_id=c.id order by 1,2,3,4,5,6;
id	name	alias	id	id	name
1001	zhangsan	zs	1001	101	yinyue
1002	lisi	ls	1002	101	yinyue
1003	wangwu	ww	1003	102	dianzi
1004	zhaoliu	zl	1004	102	dianzi
1005	zhangsi	zs	1005	103	jisuanji
1006	liwu	lw	1006	103	jisuanji
1007	wangliu	wl	1007	103	jisuanji
SELECT a.id,a.name,a.alias,b.id,c.id,c.name FROM stu150@my_link1 a LEFT JOIN stu333 b ON a.id=b.id LEFT JOIN class233@my_link2 c ON a.c_id=c.id order by 1,2,3,4,5,6;
id	name	alias	id	id	name
1001	zhangsan	zs	1001	101	yinyue
1002	lisi	ls	1002	101	yinyue
1003	wangwu	ww	1003	102	dianzi
1004	zhaoliu	zl	1004	102	dianzi
1005	zhangsi	zs	1005	103	jisuanji
1006	liwu	lw	1006	103	jisuanji
1007	wangliu	wl	1007	103	jisuanji
SELECT a.c_id,name,location FROM (SELECT c_id FROM stu333 WHERE id>1004 GROUP BY c_id HAVING c_id>101 UNION SELECT c_id FROM stu150@my_link1 WHERE id<1003 GROUP BY c_id HAVING c_id=101 ORDER BY c_id) a  
LEFT JOIN (SELECT DISTINCT id,name,location FROM class233@my_link2) b ON a.c_id=b.id WHERE id<103 order by 1,2,3;
c_id	name	location
101	yinyue	binjiang
SELECT * FROM stu333 s left JOIN class150@my_link1 c1 ON s.c_id=c1.id or s.id>105 left join class233@my_link2 c2 on c1.id>102 WHERE s.id>1004 order by 1,2,3,4,5,6,7,8,9,10,11,12,13,14,15;
id	p_id	name	alias	birth	weight	c_id	id	name	location	create_time	id	name	location	create_time
1005	1002	zhangsi	zs	1995-09-25	87.5	103	101	yinyue	binjiang	2005-09-25 12:01:33.33330	NULL	NULL	NULL	NULL
1005	1002	zhangsi	zs	1995-09-25	87.5	103	102	dianzi	xixi	2008-09-25 12:01:33.33330	NULL	NULL	NULL	NULL
1005	1002	zhangsi	zs	1995-09-25	87.5	103	103	jisuanji	binjiang	2018-09-25 12:01:33.33330	101	yinyue	binjiang	2005-09-25 12:01:33.33330
1005	1002	zhangsi	zs	1995-09-25	87.5	103	103	jisuanji	binjiang	2018-09-25 12:01:33.33330	102	dianzi	xixi	2008-09-25 12:01:33.33330
1005	1002	zhangsi	zs	1995-09-25	87.5	103	103	jisuanji	binjiang	2018-09-25 12:01:33.33330	103	jisuanji	binjiang	2018-09-25 12:01:33.33330
1005	1002	zhangsi	zs	1995-09-25	87.5	103	103	jisuanji	binjiang	2018-09-25 12:01:33.33330	104	yishu	xixi	2020-09-25 12:01:33.33330
1005	1002	zhangsi	zs	1995-09-25	87.5	103	103	jisuanji	binjiang	2018-09-25 12:01:33.33330	106	baba	xiaoshan	2007-10-10 00:00:00.00000
1005	1002	zhangsi	zs	1995-09-25	87.5	103	104	yishu	xixi	2020-09-25 12:01:33.33330	101	yinyue	binjiang	2005-09-25 12:01:33.33330
1005	1002	zhangsi	zs	1995-09-25	87.5	103	104	yishu	xixi	2020-09-25 12:01:33.33330	102	dianzi	xixi	2008-09-25 12:01:33.33330
1005	1002	zhangsi	zs	1995-09-25	87.5	103	104	yishu	xixi	2020-09-25 12:01:33.33330	103	jisuanji	binjiang	2018-09-25 12:01:33.33330
1005	1002	zhangsi	zs	1995-09-25	87.5	103	104	yishu	xixi	2020-09-25 12:01:33.33330	104	yishu	xixi	2020-09-25 12:01:33.33330
1005	1002	zhangsi	zs	1995-09-25	87.5	103	104	yishu	xixi	2020-09-25 12:01:33.33330	106	baba	xiaoshan	2007-10-10 00:00:00.00000
1005	1002	zhangsi	zs	1995-09-25	87.5	103	106	baba	xiaoshan	2007-10-10 00:00:00.00000	101	yinyue	binjiang	2005-09-25 12:01:33.33330
1005	1002	zhangsi	zs	1995-09-25	87.5	103	106	baba	xiaoshan	2007-10-10 00:00:00.00000	102	dianzi	xixi	2008-09-25 12:01:33.33330
1005	1002	zhangsi	zs	1995-09-25	87.5	103	106	baba	xiaoshan	2007-10-10 00:00:00.00000	103	jisuanji	binjiang	2018-09-25 12:01:33.33330
1005	1002	zhangsi	zs	1995-09-25	87.5	103	106	baba	xiaoshan	2007-10-10 00:00:00.00000	104	yishu	xixi	2020-09-25 12:01:33.33330
1005	1002	zhangsi	zs	1995-09-25	87.5	103	106	baba	xiaoshan	2007-10-10 00:00:00.00000	106	baba	xiaoshan	2007-10-10 00:00:00.00000
1006	1002	liwu	lw	1996-09-25	37.5	103	101	yinyue	binjiang	2005-09-25 12:01:33.33330	NULL	NULL	NULL	NULL
1006	1002	liwu	lw	1996-09-25	37.5	103	102	dianzi	xixi	2008-09-25 12:01:33.33330	NULL	NULL	NULL	NULL
1006	1002	liwu	lw	1996-09-25	37.5	103	103	jisuanji	binjiang	2018-09-25 12:01:33.33330	101	yinyue	binjiang	2005-09-25 12:01:33.33330
1006	1002	liwu	lw	1996-09-25	37.5	103	103	jisuanji	binjiang	2018-09-25 12:01:33.33330	102	dianzi	xixi	2008-09-25 12:01:33.33330
1006	1002	liwu	lw	1996-09-25	37.5	103	103	jisuanji	binjiang	2018-09-25 12:01:33.33330	103	jisuanji	binjiang	2018-09-25 12:01:33.33330
1006	1002	liwu	lw	1996-09-25	37.5	103	103	jisuanji	binjiang	2018-09-25 12:01:33.33330	104	yishu	xixi	2020-09-25 12:01:33.33330
1006	1002	liwu	lw	1996-09-25	37.5	103	103	jisuanji	binjiang	2018-09-25 12:01:33.33330	106	baba	xiaoshan	2007-10-10 00:00:00.00000
1006	1002	liwu	lw	1996-09-25	37.5	103	104	yishu	xixi	2020-09-25 12:01:33.33330	101	yinyue	binjiang	2005-09-25 12:01:33.33330
1006	1002	liwu	lw	1996-09-25	37.5	103	104	yishu	xixi	2020-09-25 12:01:33.33330	102	dianzi	xixi	2008-09-25 12:01:33.33330
1006	1002	liwu	lw	1996-09-25	37.5	103	104	yishu	xixi	2020-09-25 12:01:33.33330	103	jisuanji	binjiang	2018-09-25 12:01:33.33330
1006	1002	liwu	lw	1996-09-25	37.5	103	104	yishu	xixi	2020-09-25 12:01:33.33330	104	yishu	xixi	2020-09-25 12:01:33.33330
1006	1002	liwu	lw	1996-09-25	37.5	103	104	yishu	xixi	2020-09-25 12:01:33.33330	106	baba	xiaoshan	2007-10-10 00:00:00.00000
1006	1002	liwu	lw	1996-09-25	37.5	103	106	baba	xiaoshan	2007-10-10 00:00:00.00000	101	yinyue	binjiang	2005-09-25 12:01:33.33330
1006	1002	liwu	lw	1996-09-25	37.5	103	106	baba	xiaoshan	2007-10-10 00:00:00.00000	102	dianzi	xixi	2008-09-25 12:01:33.33330
1006	1002	liwu	lw	1996-09-25	37.5	103	106	baba	xiaoshan	2007-10-10 00:00:00.00000	103	jisuanji	binjiang	2018-09-25 12:01:33.33330
1006	1002	liwu	lw	1996-09-25	37.5	103	106	baba	xiaoshan	2007-10-10 00:00:00.00000	104	yishu	xixi	2020-09-25 12:01:33.33330
1006	1002	liwu	lw	1996-09-25	37.5	103	106	baba	xiaoshan	2007-10-10 00:00:00.00000	106	baba	xiaoshan	2007-10-10 00:00:00.00000
1007	1003	wangliu	wl	1997-09-25	97.5	103	101	yinyue	binjiang	2005-09-25 12:01:33.33330	NULL	NULL	NULL	NULL
1007	1003	wangliu	wl	1997-09-25	97.5	103	102	dianzi	xixi	2008-09-25 12:01:33.33330	NULL	NULL	NULL	NULL
1007	1003	wangliu	wl	1997-09-25	97.5	103	103	jisuanji	binjiang	2018-09-25 12:01:33.33330	101	yinyue	binjiang	2005-09-25 12:01:33.33330
1007	1003	wangliu	wl	1997-09-25	97.5	103	103	jisuanji	binjiang	2018-09-25 12:01:33.33330	102	dianzi	xixi	2008-09-25 12:01:33.33330
1007	1003	wangliu	wl	1997-09-25	97.5	103	103	jisuanji	binjiang	2018-09-25 12:01:33.33330	103	jisuanji	binjiang	2018-09-25 12:01:33.33330
1007	1003	wangliu	wl	1997-09-25	97.5	103	103	jisuanji	binjiang	2018-09-25 12:01:33.33330	104	yishu	xixi	2020-09-25 12:01:33.33330
1007	1003	wangliu	wl	1997-09-25	97.5	103	103	jisuanji	binjiang	2018-09-25 12:01:33.33330	106	baba	xiaoshan	2007-10-10 00:00:00.00000
1007	1003	wangliu	wl	1997-09-25	97.5	103	104	yishu	xixi	2020-09-25 12:01:33.33330	101	yinyue	binjiang	2005-09-25 12:01:33.33330
1007	1003	wangliu	wl	1997-09-25	97.5	103	104	yishu	xixi	2020-09-25 12:01:33.33330	102	dianzi	xixi	2008-09-25 12:01:33.33330
1007	1003	wangliu	wl	1997-09-25	97.5	103	104	yishu	xixi	2020-09-25 12:01:33.33330	103	jisuanji	binjiang	2018-09-25 12:01:33.33330
1007	1003	wangliu	wl	1997-09-25	97.5	103	104	yishu	xixi	2020-09-25 12:01:33.33330	104	yishu	xixi	2020-09-25 12:01:33.33330
1007	1003	wangliu	wl	1997-09-25	97.5	103	104	yishu	xixi	2020-09-25 12:01:33.33330	106	baba	xiaoshan	2007-10-10 00:00:00.00000
1007	1003	wangliu	wl	1997-09-25	97.5	103	106	baba	xiaoshan	2007-10-10 00:00:00.00000	101	yinyue	binjiang	2005-09-25 12:01:33.33330
1007	1003	wangliu	wl	1997-09-25	97.5	103	106	baba	xiaoshan	2007-10-10 00:00:00.00000	102	dianzi	xixi	2008-09-25 12:01:33.33330
1007	1003	wangliu	wl	1997-09-25	97.5	103	106	baba	xiaoshan	2007-10-10 00:00:00.00000	103	jisuanji	binjiang	2018-09-25 12:01:33.33330
1007	1003	wangliu	wl	1997-09-25	97.5	103	106	baba	xiaoshan	2007-10-10 00:00:00.00000	104	yishu	xixi	2020-09-25 12:01:33.33330
1007	1003	wangliu	wl	1997-09-25	97.5	103	106	baba	xiaoshan	2007-10-10 00:00:00.00000	106	baba	xiaoshan	2007-10-10 00:00:00.00000
#mysql_dblink_read-06-4-3	right [outer] join
SELECT * FROM stu333 s RIGHT OUTER JOIN class233@my_link2 c ON s.c_id=c.id WHERE s.id>1004 order by 1,2,3,4,5,6,7,8,9,10,11;
id	p_id	name	alias	birth	weight	c_id	id	name	location	create_time
1005	1002	zhangsi	zs	1995-09-25	87.5	103	103	jisuanji	binjiang	2018-09-25 12:01:33.33330
1006	1002	liwu	lw	1996-09-25	37.5	103	103	jisuanji	binjiang	2018-09-25 12:01:33.33330
1007	1003	wangliu	wl	1997-09-25	97.5	103	103	jisuanji	binjiang	2018-09-25 12:01:33.33330
SELECT * FROM stu150@my_link1 s RIGHT JOIN class150@my_link1 c ON s.c_id=c.id WHERE s.id<1004 order by 1,2,3,4,5,6,7,8,9,10,11;
id	p_id	name	alias	birth	weight	c_id	id	name	location	create_time
1001	NULL	zhangsan	zs	1991-09-25	47.5	101	101	yinyue	binjiang	2005-09-25 12:01:33.33330
1002	1001	lisi	ls	1992-09-25	57.5	101	101	yinyue	binjiang	2005-09-25 12:01:33.33330
1003	1001	wangwu	ww	1993-09-25	67.5	102	102	dianzi	xixi	2008-09-25 12:01:33.33330
SELECT * FROM stu150@my_link1 s, class233@my_link2 c WHERE s.c_id=c.id AND s.id<1004 order by 1,2,3,4,5,6,7,8,9,10,11;
id	p_id	name	alias	birth	weight	c_id	id	name	location	create_time
1001	NULL	zhangsan	zs	1991-09-25	47.5	101	101	yinyue	binjiang	2005-09-25 12:01:33.33330
1002	1001	lisi	ls	1992-09-25	57.5	101	101	yinyue	binjiang	2005-09-25 12:01:33.33330
1003	1001	wangwu	ww	1993-09-25	67.5	102	102	dianzi	xixi	2008-09-25 12:01:33.33330
SELECT * FROM (SELECT c_id FROM stu233@my_link2 WHERE id>1001 GROUP BY c_id HAVING c_id>101 ORDER BY c_id) a RIGHT JOIN (SELECT DISTINCT id,name,location FROM class150@my_link1) b ON a.c_id=b.id order by 1,2,3,4;
c_id	id	name	location
NULL	101	yinyue	binjiang
NULL	104	yishu	xixi
NULL	106	baba	xiaoshan
102	102	dianzi	xixi
103	103	jisuanji	binjiang
SELECT a.id,a.name,a.alias,b.id,c.id,c.name FROM stu333 a RIGHT JOIN stu150@my_link1 b ON a.id=b.id RIGHT JOIN class150@my_link1 c ON a.c_id=c.id order by 1,2,3,4,5,6;
id	name	alias	id	id	name
NULL	NULL	NULL	NULL	104	yishu
NULL	NULL	NULL	NULL	106	baba
1001	zhangsan	zs	1001	101	yinyue
1002	lisi	ls	1002	101	yinyue
1003	wangwu	ww	1003	102	dianzi
1004	zhaoliu	zl	1004	102	dianzi
1005	zhangsi	zs	1005	103	jisuanji
1006	liwu	lw	1006	103	jisuanji
1007	wangliu	wl	1007	103	jisuanji
SELECT a.id,a.name,a.alias,b.id,c.id,c.name FROM stu233@my_link2 a RIGHT JOIN stu333 b ON a.id=b.id RIGHT JOIN class150@my_link1 c ON a.c_id=c.id order by 1,2,3,4,5,6;
id	name	alias	id	id	name
NULL	NULL	NULL	NULL	104	yishu
NULL	NULL	NULL	NULL	106	baba
1001	zhangsan	zs	1001	101	yinyue
1002	lisi	ls	1002	101	yinyue
1003	wangwu	ww	1003	102	dianzi
1004	zhaoliu	zl	1004	102	dianzi
1005	zhangsi	zs	1005	103	jisuanji
1006	liwu	lw	1006	103	jisuanji
1007	wangliu	wl	1007	103	jisuanji
SELECT * FROM stu333 s right JOIN class150@my_link1 c1 ON s.c_id=103 or s.id>105 right join class233@my_link2 c2 on c1.id>102 WHERE s.id=1004 order by 1,2,3,4,5,6,7,8,9,10,11,12,13,14,15;
id	p_id	name	alias	birth	weight	c_id	id	name	location	create_time	id	name	location	create_time
1004	1002	zhaoliu	zl	1994-09-25	77.5	102	103	jisuanji	binjiang	2018-09-25 12:01:33.33330	101	yinyue	binjiang	2005-09-25 12:01:33.33330
1004	1002	zhaoliu	zl	1994-09-25	77.5	102	103	jisuanji	binjiang	2018-09-25 12:01:33.33330	102	dianzi	xixi	2008-09-25 12:01:33.33330
1004	1002	zhaoliu	zl	1994-09-25	77.5	102	103	jisuanji	binjiang	2018-09-25 12:01:33.33330	103	jisuanji	binjiang	2018-09-25 12:01:33.33330
1004	1002	zhaoliu	zl	1994-09-25	77.5	102	103	jisuanji	binjiang	2018-09-25 12:01:33.33330	104	yishu	xixi	2020-09-25 12:01:33.33330
1004	1002	zhaoliu	zl	1994-09-25	77.5	102	103	jisuanji	binjiang	2018-09-25 12:01:33.33330	106	baba	xiaoshan	2007-10-10 00:00:00.00000
1004	1002	zhaoliu	zl	1994-09-25	77.5	102	104	yishu	xixi	2020-09-25 12:01:33.33330	101	yinyue	binjiang	2005-09-25 12:01:33.33330
1004	1002	zhaoliu	zl	1994-09-25	77.5	102	104	yishu	xixi	2020-09-25 12:01:33.33330	102	dianzi	xixi	2008-09-25 12:01:33.33330
1004	1002	zhaoliu	zl	1994-09-25	77.5	102	104	yishu	xixi	2020-09-25 12:01:33.33330	103	jisuanji	binjiang	2018-09-25 12:01:33.33330
1004	1002	zhaoliu	zl	1994-09-25	77.5	102	104	yishu	xixi	2020-09-25 12:01:33.33330	104	yishu	xixi	2020-09-25 12:01:33.33330
1004	1002	zhaoliu	zl	1994-09-25	77.5	102	104	yishu	xixi	2020-09-25 12:01:33.33330	106	baba	xiaoshan	2007-10-10 00:00:00.00000
1004	1002	zhaoliu	zl	1994-09-25	77.5	102	106	baba	xiaoshan	2007-10-10 00:00:00.00000	101	yinyue	binjiang	2005-09-25 12:01:33.33330
1004	1002	zhaoliu	zl	1994-09-25	77.5	102	106	baba	xiaoshan	2007-10-10 00:00:00.00000	102	dianzi	xixi	2008-09-25 12:01:33.33330
1004	1002	zhaoliu	zl	1994-09-25	77.5	102	106	baba	xiaoshan	2007-10-10 00:00:00.00000	103	jisuanji	binjiang	2018-09-25 12:01:33.33330
1004	1002	zhaoliu	zl	1994-09-25	77.5	102	106	baba	xiaoshan	2007-10-10 00:00:00.00000	104	yishu	xixi	2020-09-25 12:01:33.33330
1004	1002	zhaoliu	zl	1994-09-25	77.5	102	106	baba	xiaoshan	2007-10-10 00:00:00.00000	106	baba	xiaoshan	2007-10-10 00:00:00.00000
#mysql_dblink_read-06-4-4	full [outer] join
SELECT * FROM stu333 s FULL OUTER JOIN class150@my_link1 c ON s.c_id=c.id WHERE s.id>1004 order by 1,2,3,4,5,6,7,8,9,10,11;
id	p_id	name	alias	birth	weight	c_id	id	name	location	create_time
1005	1002	zhangsi	zs	1995-09-25	87.5	103	103	jisuanji	binjiang	2018-09-25 12:01:33.33330
1006	1002	liwu	lw	1996-09-25	37.5	103	103	jisuanji	binjiang	2018-09-25 12:01:33.33330
1007	1003	wangliu	wl	1997-09-25	97.5	103	103	jisuanji	binjiang	2018-09-25 12:01:33.33330
SELECT * FROM stu150@my_link1 s FULL JOIN class150@my_link1 c ON s.c_id=c.id WHERE s.id<1004 order by 1,2,3,4,5,6,7,8,9,10,11;
id	p_id	name	alias	birth	weight	c_id	id	name	location	create_time
1001	NULL	zhangsan	zs	1991-09-25	47.5	101	101	yinyue	binjiang	2005-09-25 12:01:33.33330
1002	1001	lisi	ls	1992-09-25	57.5	101	101	yinyue	binjiang	2005-09-25 12:01:33.33330
1003	1001	wangwu	ww	1993-09-25	67.5	102	102	dianzi	xixi	2008-09-25 12:01:33.33330
SELECT * FROM stu333 s full JOIN class150@my_link1 c1 ON s.c_id=103 and s.id<105 full join class233@my_link2 c2 on c1.id>102 WHERE s.id>1004 order by 1,2,3,4,5,6,7,8,9,10,11,12,13,14,15;
id	p_id	name	alias	birth	weight	c_id	id	name	location	create_time	id	name	location	create_time
1005	1002	zhangsi	zs	1995-09-25	87.5	103	NULL	NULL	NULL	NULL	NULL	NULL	NULL	NULL
1006	1002	liwu	lw	1996-09-25	37.5	103	NULL	NULL	NULL	NULL	NULL	NULL	NULL	NULL
1007	1003	wangliu	wl	1997-09-25	97.5	103	NULL	NULL	NULL	NULL	NULL	NULL	NULL	NULL
#mysql_dblink_read-06-4-5	cross join
SELECT * FROM stu333 s CROSS JOIN class150@my_link1 c WHERE s.c_id=c.id AND s.id<1004 order by 1,2,3,4,5,6,7,8,9,10,11;
id	p_id	name	alias	birth	weight	c_id	id	name	location	create_time
1001	NULL	zhangsan	zs	1991-09-25	47.5	101	101	yinyue	binjiang	2005-09-25 12:01:33.33330
1002	1001	lisi	ls	1992-09-25	57.5	101	101	yinyue	binjiang	2005-09-25 12:01:33.33330
1003	1001	wangwu	ww	1993-09-25	67.5	102	102	dianzi	xixi	2008-09-25 12:01:33.33330
SELECT * FROM (SELECT c_id FROM stu150@my_link1 WHERE id>1001 GROUP BY c_id HAVING c_id>101 ORDER BY c_id) a CROSS JOIN (SELECT DISTINCT id,name,location FROM class150@my_link1) b WHERE a.c_id=b.id order by 1,2,3,4;
c_id	id	name	location
102	102	dianzi	xixi
103	103	jisuanji	binjiang
SELECT * FROM (SELECT c_id FROM stu233@my_link2 WHERE id>1004 GROUP BY c_id HAVING c_id>101 UNION SELECT c_id FROM stu150@my_link1 WHERE id<1003 GROUP BY c_id HAVING c_id=101 ORDER BY c_id) a 
CROSS JOIN (SELECT DISTINCT id,name,location FROM class150@my_link1) b WHERE  a.c_id=b.id order by 1,2,3,4;
c_id	id	name	location
101	101	yinyue	binjiang
103	103	jisuanji	binjiang
SELECT a.id,a.name,a.alias,b.id,c.id,c.name FROM stu333 a CROSS JOIN stu150@my_link1 b CROSS JOIN class233@my_link2 c WHERE a.id=b.id AND a.c_id=c.id order by 1,2,3,4,5,6;
id	name	alias	id	id	name
1001	zhangsan	zs	1001	101	yinyue
1002	lisi	ls	1002	101	yinyue
1003	wangwu	ww	1003	102	dianzi
1004	zhaoliu	zl	1004	102	dianzi
1005	zhangsi	zs	1005	103	jisuanji
1006	liwu	lw	1006	103	jisuanji
1007	wangliu	wl	1007	103	jisuanji
#mysql_dblink_read-06-4-6	natural join
SELECT * FROM stu333 s NATURAL JOIN stu150@my_link1 c WHERE id>1003 order by 1,2,3,4,5,6,7;
id	p_id	name	alias	birth	weight	c_id
1004	1002	zhaoliu	zl	1994-09-25	77.5	102
1005	1002	zhangsi	zs	1995-09-25	87.5	103
1006	1002	liwu	lw	1996-09-25	37.5	103
1007	1003	wangliu	wl	1997-09-25	97.5	103
SELECT * FROM (SELECT c_id FROM stu150@my_link1 WHERE id>1001 GROUP BY c_id HAVING c_id>101 ORDER BY c_id) a NATURAL JOIN (SELECT DISTINCT id,name,location FROM class150@my_link1) b WHERE a.c_id=b.id order by 1,2,3,4;
c_id	id	name	location
102	102	dianzi	xixi
103	103	jisuanji	binjiang
SELECT * FROM (SELECT c_id FROM stu150@my_link1 WHERE id>1004 GROUP BY c_id HAVING c_id>101 UNION SELECT c_id FROM stu233@my_link2 WHERE id<1003 GROUP BY c_id HAVING c_id=101 ORDER BY c_id) a 
NATURAL JOIN (SELECT DISTINCT id,name,c_id FROM stu233@my_link2) b WHERE c_id+900<id order by 1,2,3;
c_id	id	name
101	1002	lisi
103	1005	zhangsi
103	1006	liwu
103	1007	wangliu
SELECT * FROM stu333 NATURAL JOIN stu150@my_link1 b NATURAL JOIN stu233@my_link2 c order by 1,2,3,4,5,6,7;
id	p_id	name	alias	birth	weight	c_id
1002	1001	lisi	ls	1992-09-25	57.5	101
1003	1001	wangwu	ww	1993-09-25	67.5	102
1004	1002	zhaoliu	zl	1994-09-25	77.5	102
1005	1002	zhangsi	zs	1995-09-25	87.5	103
1006	1002	liwu	lw	1996-09-25	37.5	103
1007	1003	wangliu	wl	1997-09-25	97.5	103
#mysql_dblink_read-06-5	集合查询
#mysql_dblink_read-06-5-1	union [all]
SELECT c_id FROM stu150@my_link1 WHERE c_id>102 UNION SELECT c_id FROM stu333 WHERE c_id <102 order by 1;
c_id
101
103
SELECT c_id FROM stu150@my_link1 WHERE c_id>102 UNION ALL SELECT c_id FROM stu150@my_link1 WHERE c_id <102 order by 1;
c_id
101
101
103
103
103
SELECT max(id) a FROM stu150@my_link1 GROUP BY c_id HAVING c_id>102 UNION SELECT c_id FROM stu233@my_link2 WHERE c_id>102 ORDER BY 1 DESC;
a
1007
103
SELECT max(id) a FROM stu333 GROUP BY c_id HAVING c_id>102 UNION SELECT c_id FROM stu150@my_link1 WHERE c_id>102 UNION ALL SELECT c_id FROM stu233@my_link2 WHERE c_id <102 order by 1;
a
101
101
103
1007
SELECT * FROM (SELECT c_id FROM stu333 WHERE id>1001 GROUP BY c_id HAVING c_id>101 ORDER BY c_id) a JOIN (SELECT DISTINCT id,name,location FROM class233@my_link2) b ON a.c_id=b.id
UNION ALL
SELECT * FROM (SELECT c_id FROM stu150@my_link1 WHERE id>1001 GROUP BY c_id HAVING c_id>101 ORDER BY c_id) a RIGHT JOIN (SELECT DISTINCT id,name,location FROM class233@my_link2) b ON a.c_id=b.id order by 1,2,3,4;
c_id	id	name	location
NULL	101	yinyue	binjiang
NULL	104	yishu	xixi
NULL	106	baba	xiaoshan
102	102	dianzi	xixi
102	102	dianzi	xixi
103	103	jisuanji	binjiang
103	103	jisuanji	binjiang
SELECT c_id FROM stu150@my_link1 GROUP BY c_id HAVING count(c_id) IN (
SELECT DISTINCT m FROM (
WITH a AS (SELECT count(*) m FROM stu333 s LEFT JOIN class150@my_link1 c ON s.c_id=c.id GROUP BY c.id HAVING c.id IN (SELECT id FROM class233@my_link2)),
b AS (SELECT DISTINCT s.name t,c.name FROM stu150@my_link1 s JOIN class233@my_link2 c ON s.c_id=c.id INTERSECT SELECT m.e,m.r FROM (SELECT s.id q,c.id w,s.name e,c.name r FROM stu333 s,class333 c) m)
SELECT DISTINCT a.m,b.t FROM a,b))
UNION ALL 
SELECT c_id FROM stu333 GROUP BY c_id HAVING count(c_id) IN (
SELECT DISTINCT m FROM (
WITH a AS (SELECT count(*) m FROM stu150@my_link1 s LEFT JOIN class333 c ON s.c_id=c.id GROUP BY c.id HAVING c.id IN (SELECT id FROM class150@my_link1)),
b AS (SELECT DISTINCT s.name t,c.name FROM stu233@my_link2 s JOIN class233@my_link2 c ON s.c_id=c.id INTERSECT SELECT m.e,m.r FROM (SELECT s.id q,c.id w,s.name e,c.name r FROM stu333 s,class333 c) m)
SELECT DISTINCT a.m,b.t FROM a,b)) order by 1;
c_id
101
101
102
102
103
103
#mysql_dblink_read-06-5-2	minus
SELECT c_id FROM stu333 WHERE c_id>102 MINUS SELECT c_id FROM stu150@my_link1 WHERE c_id <102 order by 1;
c_id
103
SELECT c_id FROM stu150@my_link1 WHERE c_id>102 MINUS SELECT c_id FROM stu233@my_link2 WHERE c_id <102 order by 1;
c_id
103
SELECT max(id) a FROM stu233@my_link2 GROUP BY c_id HAVING c_id>102 MINUS SELECT c_id FROM stu233@my_link2 WHERE c_id>102 ORDER BY 1 DESC;
a
1007
SELECT max(id) a FROM stu333 GROUP BY c_id HAVING c_id>102 MINUS SELECT c_id FROM stu150@my_link1 WHERE c_id>102 MINUS SELECT c_id FROM stu233@my_link2 WHERE c_id <102 order by 1;
a
1007
SELECT * FROM (SELECT c_id FROM stu233@my_link2 WHERE id>1002 GROUP BY c_id HAVING c_id>101 ORDER BY c_id) a RIGHT JOIN (SELECT DISTINCT id,name,location FROM class233@my_link2) b ON a.c_id=b.id
MINUS
SELECT * FROM (SELECT c_id FROM stu150@my_link1 WHERE id>1001 GROUP BY c_id HAVING c_id>101 ORDER BY c_id) a JOIN (SELECT DISTINCT id,name,location FROM class150@my_link1) b ON a.c_id=b.id order by 1,2,3,4;
c_id	id	name	location
NULL	101	yinyue	binjiang
NULL	104	yishu	xixi
NULL	106	baba	xiaoshan
SELECT * FROM (SELECT DISTINCT id,name,birth,c_id FROM stu150@my_link1) s, class233@my_link2 c WHERE c.id=s.c_id AND s.id<1008
MINUS
SELECT * FROM (SELECT DISTINCT id,name,birth,c_id FROM stu233@my_link2) s, class150@my_link1 c WHERE c.id=s.c_id AND s.id<1005 order by 1,2,3,4,5,6,7,8;
id	name	birth	c_id	id	name	location	create_time
1005	zhangsi	1995-09-25	103	103	jisuanji	binjiang	2018-09-25 12:01:33.33330
1006	liwu	1996-09-25	103	103	jisuanji	binjiang	2018-09-25 12:01:33.33330
1007	wangliu	1997-09-25	103	103	jisuanji	binjiang	2018-09-25 12:01:33.33330
#mysql_dblink_read-06-5-3	intersect
SELECT c_id FROM stu233@my_link2 WHERE c_id>102 INTERSECT SELECT c_id+2 FROM stu333 WHERE c_id <102 order by 1;
c_id
103
SELECT c_id FROM stu233@my_link2 WHERE c_id>102 INTERSECT SELECT c_id FROM stu233@my_link2 WHERE c_id <=103 order by 1;
c_id
103
SELECT max(id)-904 FROM stu150@my_link1 GROUP BY c_id HAVING c_id>102 INTERSECT SELECT c_id FROM stu233@my_link2 WHERE c_id>102 ORDER BY 1 DESC;
max(id)-904
103
SELECT max(id)-904 FROM stu333 GROUP BY c_id HAVING c_id>102 INTERSECT SELECT c_id FROM stu233@my_link2 WHERE c_id>102 INTERSECT SELECT c_id FROM stu150@my_link1 WHERE c_id <104 order by 1;
max(id)-904
103
SELECT * FROM (SELECT c_id FROM stu150@my_link1 WHERE id>1001 GROUP BY c_id HAVING c_id>101 ORDER BY c_id) a JOIN (SELECT DISTINCT id,name,location FROM class150@my_link1) b ON a.c_id=b.id
INTERSECT
SELECT * FROM (SELECT c_id FROM stu233@my_link2 WHERE id>1001 GROUP BY c_id HAVING c_id>101 ORDER BY c_id) a RIGHT JOIN (SELECT DISTINCT id,name,location FROM class233@my_link2) b ON a.c_id=b.id order by 1,2,3,4;
c_id	id	name	location
102	102	dianzi	xixi
103	103	jisuanji	binjiang
SELECT * FROM stu333 WHERE birth BETWEEN (SELECT MIN(birth) FROM stu150@my_link1) AND (SELECT MAX(birth) FROM stu233@my_link2)
INTERSECT
SELECT * FROM stu333 WHERE birth BETWEEN (SELECT MIN(birth) FROM stu333) AND (SELECT MIN(birth) FROM stu333) order by 1,2,3,4,5,6,7;
id	p_id	name	alias	birth	weight	c_id
1001	NULL	zhangsan	zs	1991-09-25	47.5	101
SELECT DISTINCT s.name t,c.name FROM stu233@my_link2 s JOIN class233@my_link2 c ON s.c_id=c.id INTERSECT SELECT m.e,m.r FROM (SELECT s.id q,c.id w,s.name e,c.name r FROM stu333 s,class333 c) m order by 1,2;
t	name
lisi	yinyue
liwu	jisuanji
wangliu	jisuanji
wangwu	dianzi
zhangsan	yinyue
zhangsi	jisuanji
zhaoliu	dianzi
#mysql_dblink_read-06-6	insert
DROP TABLE IF EXISTS class333_1;
CREATE TABLE class333_1 AS SELECT * FROM class333 WHERE 1=0;
DROP TABLE IF EXISTS stu333_1;
CREATE TABLE stu333_1 AS SELECT * FROM stu333  WHERE 1=0;
#mysql_dblink_read-06-6-1	insert into 本地表 values(select...)
INSERT INTO class333_1 VALUES((SELECT max(id)+1 FROM class150@my_link1),'shuxue','yuhang',STR_TO_DATE('25-09-2005 12:01:33.3333','%d-%m-%Y %H:%i:%s.%f'));
INSERT INTO class333_1(name) VALUES((SELECT name FROM class233@my_link2 WHERE id=102));
SELECT * FROM class333_1 order by 1,2,3,4;
id	name	location	create_time
NULL	dianzi	NULL	NULL
107	shuxue	yuhang	2005-09-25 12:01:33.33330
DELETE FROM class333_1 WHERE 1=1;
#mysql_dblink_read-06-6-1	insert into 远端表 values(select...)
INSERT INTO class333 VALUES((SELECT max(id)+1 FROM class150@my_link1),'shuxue','yuhang',STR_TO_DATE('25-09-2005 12:01:33.3333','%d-%m-%Y %H:%i:%s.%f'));
SELECT * FROM class333 order by 1,2,3,4;
id	name	location	create_time
101	yinyue	binjiang	2005-09-25 12:01:33.33330
102	dianzi	xixi	2008-09-25 12:01:33.33330
103	jisuanji	binjiang	2018-09-25 12:01:33.33330
104	yishu	xixi	2020-09-25 12:01:33.33330
105	qiqi	yuhang	2005-10-10 00:00:00.00000
107	shuxue	yuhang	2005-09-25 12:01:33.33330
INSERT INTO class333(name) VALUES((SELECT name FROM class233@my_link2 WHERE id=102));
SELECT * FROM class150@my_link1 order by 1,2,3,4;
id	name	location	create_time
101	yinyue	binjiang	2005-09-25 12:01:33.33330
102	dianzi	xixi	2008-09-25 12:01:33.33330
103	jisuanji	binjiang	2018-09-25 12:01:33.33330
104	yishu	xixi	2020-09-25 12:01:33.33330
106	baba	xiaoshan	2007-10-10 00:00:00.00000
DELETE FROM class333_1 WHERE 1=1;
#mysql_dblink_read-06-6-2	insert into 本地表 select...
INSERT INTO class333_1 SELECT DISTINCT * FROM class150@my_link1;
SELECT * FROM class333_1 order by 1,2,3,4;
id	name	location	create_time
101	yinyue	binjiang	2005-09-25 12:01:33.33330
102	dianzi	xixi	2008-09-25 12:01:33.33330
103	jisuanji	binjiang	2018-09-25 12:01:33.33330
104	yishu	xixi	2020-09-25 12:01:33.33330
106	baba	xiaoshan	2007-10-10 00:00:00.00000
DELETE FROM class333_1 WHERE 1=1;
INSERT INTO class333_1(id,name,location) SELECT id,name,location FROM class233@my_link2 WHERE id <103;
SELECT * FROM class333_1 order by 1,2,3,4;
id	name	location	create_time
101	yinyue	binjiang	NULL
102	dianzi	xixi	NULL
DELETE FROM class333_1 WHERE 1=1;
INSERT INTO class333_1(id,name,location)
SELECT b.* FROM (SELECT c_id FROM stu233@my_link2 WHERE id>1001 GROUP BY c_id HAVING c_id>101 ORDER BY c_id) a JOIN (SELECT DISTINCT id,name,location FROM class150@my_link1) b ON a.c_id=b.id
INTERSECT
SELECT b.* FROM (SELECT c_id FROM stu333 WHERE id>1001 GROUP BY c_id HAVING c_id>101 ORDER BY c_id) a RIGHT JOIN (SELECT DISTINCT id,name,location FROM class333) b ON a.c_id=b.id;
SELECT * FROM class333_1 order by 1,2,3,4;
id	name	location	create_time
102	dianzi	xixi	NULL
103	jisuanji	binjiang	NULL
DELETE FROM class333_1 WHERE 1=1;
INSERT INTO stu333_1(name,alias) 
WITH a AS (SELECT * FROM stu150@my_link1),
b AS (SELECT * FROM class150@my_link1) 
SELECT m.e,m.r FROM (SELECT a.id q,b.id w,a.name e,b.name r FROM a,b) m;
SELECT * FROM stu333_1 order by 1,2,3,4,5,6,7;
id	p_id	name	alias	birth	weight	c_id
NULL	NULL	lisi	baba	NULL	NULL	NULL
NULL	NULL	lisi	dianzi	NULL	NULL	NULL
NULL	NULL	lisi	jisuanji	NULL	NULL	NULL
NULL	NULL	lisi	yinyue	NULL	NULL	NULL
NULL	NULL	lisi	yishu	NULL	NULL	NULL
NULL	NULL	liwu	baba	NULL	NULL	NULL
NULL	NULL	liwu	dianzi	NULL	NULL	NULL
NULL	NULL	liwu	jisuanji	NULL	NULL	NULL
NULL	NULL	liwu	yinyue	NULL	NULL	NULL
NULL	NULL	liwu	yishu	NULL	NULL	NULL
NULL	NULL	wangliu	baba	NULL	NULL	NULL
NULL	NULL	wangliu	dianzi	NULL	NULL	NULL
NULL	NULL	wangliu	jisuanji	NULL	NULL	NULL
NULL	NULL	wangliu	yinyue	NULL	NULL	NULL
NULL	NULL	wangliu	yishu	NULL	NULL	NULL
NULL	NULL	wangwu	baba	NULL	NULL	NULL
NULL	NULL	wangwu	dianzi	NULL	NULL	NULL
NULL	NULL	wangwu	jisuanji	NULL	NULL	NULL
NULL	NULL	wangwu	yinyue	NULL	NULL	NULL
NULL	NULL	wangwu	yishu	NULL	NULL	NULL
NULL	NULL	zhangsan	baba	NULL	NULL	NULL
NULL	NULL	zhangsan	dianzi	NULL	NULL	NULL
NULL	NULL	zhangsan	jisuanji	NULL	NULL	NULL
NULL	NULL	zhangsan	yinyue	NULL	NULL	NULL
NULL	NULL	zhangsan	yishu	NULL	NULL	NULL
NULL	NULL	zhangsi	baba	NULL	NULL	NULL
NULL	NULL	zhangsi	dianzi	NULL	NULL	NULL
NULL	NULL	zhangsi	jisuanji	NULL	NULL	NULL
NULL	NULL	zhangsi	yinyue	NULL	NULL	NULL
NULL	NULL	zhangsi	yishu	NULL	NULL	NULL
NULL	NULL	zhaoliu	baba	NULL	NULL	NULL
NULL	NULL	zhaoliu	dianzi	NULL	NULL	NULL
NULL	NULL	zhaoliu	jisuanji	NULL	NULL	NULL
NULL	NULL	zhaoliu	yinyue	NULL	NULL	NULL
NULL	NULL	zhaoliu	yishu	NULL	NULL	NULL
DELETE FROM stu333_1 WHERE 1=1;
#mysql_dblink_read-06-7	update
DROP TABLE stu333_1 ;
DROP TABLE class333_1 ;
CREATE TABLE class333_1 AS SELECT * FROM class333;
CREATE TABLE stu333_1 AS SELECT * FROM stu333;
#mysql_dblink_read-06-7-1	update 本地表 set ...=(select远端表) where ...
UPDATE stu333_1 SET id=(SELECT max(id)+1 FROM stu150@my_link1),name=(SELECT ''''||name||'''' FROM stu233@my_link2 WHERE id=1005)
WHERE id=1001;
SELECT * FROM stu333_1 order by 1,2,3,4,5,6,7;
id	p_id	name	alias	birth	weight	c_id
1002	1001	lisi	ls	1992-09-25	57.5	101
1003	1001	wangwu	ww	1993-09-25	67.5	102
1004	1002	zhaoliu	zl	1994-09-25	77.5	102
1005	1002	zhangsi	zs	1995-09-25	87.5	103
1006	1002	liwu	lw	1996-09-25	37.5	103
1007	1003	wangliu	wl	1997-09-25	97.5	103
1008	NULL	0	zs	1991-09-25	47.5	101
UPDATE stu333_1 SET id=(SELECT (CASE max(id)+1 WHEN 1003 THEN 1009 ELSE 1010 END) FROM stu150@my_link1 WHERE id BETWEEN 1002 AND 1003 GROUP BY c_id HAVING c_id>101)
WHERE id=1002;
SELECT * FROM stu333_1 order by 1,2,3,4,5,6,7;
id	p_id	name	alias	birth	weight	c_id
1003	1001	wangwu	ww	1993-09-25	67.5	102
1004	1002	zhaoliu	zl	1994-09-25	77.5	102
1005	1002	zhangsi	zs	1995-09-25	87.5	103
1006	1002	liwu	lw	1996-09-25	37.5	103
1007	1003	wangliu	wl	1997-09-25	97.5	103
1008	NULL	0	zs	1991-09-25	47.5	101
1010	1001	lisi	ls	1992-09-25	57.5	101
UPDATE stu333_1 SET name=(SELECT * FROM (WITH a AS (SELECT DISTINCT n.id,m.name FROM stu233@my_link2 m JOIN class333 n ON n.id=m.c_id),
b AS (SELECT t.name FROM (SELECT n.id,m.name FROM stu333 m,class150@my_link1 n) t)
SELECT DISTINCT b.name FROM a,b WHERE trim(a.name)=trim(b.name) ORDER BY 1) LIMIT 1)
WHERE id=1004;
SELECT * FROM stu333_1 order by 1,2,3,4,5,6,7;
id	p_id	name	alias	birth	weight	c_id
1003	1001	wangwu	ww	1993-09-25	67.5	102
1004	1002	lisi	zl	1994-09-25	77.5	102
1005	1002	zhangsi	zs	1995-09-25	87.5	103
1006	1002	liwu	lw	1996-09-25	37.5	103
1007	1003	wangliu	wl	1997-09-25	97.5	103
1008	NULL	0	zs	1991-09-25	47.5	101
1010	1001	lisi	ls	1992-09-25	57.5	101
UPDATE stu333_1 SET id=(SELECT min(id) FROM (SELECT c_id FROM stu150@my_link1 WHERE id>1004 GROUP BY c_id HAVING c_id>101 UNION SELECT c_id FROM stu333 WHERE id<1003 GROUP BY c_id HAVING c_id=101 ORDER BY c_id) a 
RIGHT JOIN (SELECT DISTINCT id,name,location FROM class233@my_link2) b ON a.c_id=b.id)
WHERE id=1004;
SELECT * FROM stu333_1 order by 1,2,3,4,5,6,7;
id	p_id	name	alias	birth	weight	c_id
101	1002	lisi	zl	1994-09-25	77.5	102
1003	1001	wangwu	ww	1993-09-25	67.5	102
1005	1002	zhangsi	zs	1995-09-25	87.5	103
1006	1002	liwu	lw	1996-09-25	37.5	103
1007	1003	wangliu	wl	1997-09-25	97.5	103
1008	NULL	0	zs	1991-09-25	47.5	101
1010	1001	lisi	ls	1992-09-25	57.5	101
UPDATE stu333_1 SET id=(SELECT c_id FROM (SELECT DISTINCT id,name,birth,c_id FROM stu150@my_link1) s, class333 c WHERE c.id=s.c_id AND s.id<1008 MINUS
SELECT c_id FROM (SELECT DISTINCT id,name,birth,c_id FROM stu150@my_link1) s, class233@my_link2 c WHERE c.id=s.c_id AND s.id<1005)
WHERE id=1005;
SELECT * FROM stu333_1 order by 1,2,3,4,5,6,7;
id	p_id	name	alias	birth	weight	c_id
101	1002	lisi	zl	1994-09-25	77.5	102
103	1002	zhangsi	zs	1995-09-25	87.5	103
1003	1001	wangwu	ww	1993-09-25	67.5	102
1006	1002	liwu	lw	1996-09-25	37.5	103
1007	1003	wangliu	wl	1997-09-25	97.5	103
1008	NULL	0	zs	1991-09-25	47.5	101
1010	1001	lisi	ls	1992-09-25	57.5	101
#mysql_dblink_read-06-7-2	update 本地表 set ... where (select远端表)
UPDATE class333_1 SET name='user' 
WHERE id=(SELECT (CASE max(id)+1 WHEN 1003 THEN 100 ELSE 101 END) FROM stu150@my_link1 WHERE id BETWEEN 1002 AND 1003 GROUP BY c_id HAVING c_id>101);
SELECT * FROM class333_1 order by 1,2,3,4;
id	name	location	create_time
NULL	dianzi	NULL	NULL
101	user	binjiang	2005-09-25 12:01:33.33330
102	dianzi	xixi	2008-09-25 12:01:33.33330
103	jisuanji	binjiang	2018-09-25 12:01:33.33330
104	yishu	xixi	2020-09-25 12:01:33.33330
105	qiqi	yuhang	2005-10-10 00:00:00.00000
107	shuxue	yuhang	2005-09-25 12:01:33.33330
UPDATE class333_1 SET name='qazxsw' 
WHERE (id,name)=(SELECT t-902,'user' FROM (SELECT max(id)+1 t FROM stu233@my_link2 GROUP BY c_id ORDER BY c_id) LIMIT 1);
SELECT * FROM class333_1 order by 1,2,3,4;
id	name	location	create_time
NULL	dianzi	NULL	NULL
101	qazxsw	binjiang	2005-09-25 12:01:33.33330
102	dianzi	xixi	2008-09-25 12:01:33.33330
103	jisuanji	binjiang	2018-09-25 12:01:33.33330
104	yishu	xixi	2020-09-25 12:01:33.33330
105	qiqi	yuhang	2005-10-10 00:00:00.00000
107	shuxue	yuhang	2005-09-25 12:01:33.33330
UPDATE class333_1 SET location='lalala' 
WHERE name<>(SELECT * FROM (WITH a AS (SELECT DISTINCT n.id,m.name FROM stu233@my_link2 m JOIN class233@my_link2 n ON n.id=m.c_id),
b AS (SELECT t.name FROM (SELECT n.id,m.name FROM stu333 m,class150@my_link1 n) t)
SELECT DISTINCT b.name FROM a,b WHERE trim(a.name)=trim(b.name) order by 1) LIMIT 1);
SELECT * FROM class333_1 order by 1,2,3,4;
id	name	location	create_time
NULL	dianzi	lalala	NULL
101	qazxsw	lalala	2005-09-25 12:01:33.33330
102	dianzi	lalala	2008-09-25 12:01:33.33330
103	jisuanji	lalala	2018-09-25 12:01:33.33330
104	yishu	lalala	2020-09-25 12:01:33.33330
105	qiqi	lalala	2005-10-10 00:00:00.00000
107	shuxue	lalala	2005-09-25 12:01:33.33330
UPDATE class333_1 SET location='binjiang' 
WHERE id<=(SELECT min(id) FROM (SELECT c_id FROM stu150@my_link1 WHERE id>1004 GROUP BY c_id HAVING c_id>101 UNION SELECT c_id FROM stu233@my_link2 WHERE id<1003 GROUP BY c_id HAVING c_id=101 ORDER BY c_id) a 
RIGHT JOIN (SELECT DISTINCT id,name,location FROM class333) b ON a.c_id=b.id);
SELECT * FROM class333_1 order by 1,2,3,4;
id	name	location	create_time
NULL	dianzi	lalala	NULL
101	qazxsw	binjiang	2005-09-25 12:01:33.33330
102	dianzi	lalala	2008-09-25 12:01:33.33330
103	jisuanji	lalala	2018-09-25 12:01:33.33330
104	yishu	lalala	2020-09-25 12:01:33.33330
105	qiqi	lalala	2005-10-10 00:00:00.00000
107	shuxue	lalala	2005-09-25 12:01:33.33330
UPDATE class333_1 SET location='xixi' 
WHERE id<=(SELECT c_id FROM (SELECT DISTINCT id,name,birth,c_id FROM stu150@my_link1) s, class333 c WHERE c.id=s.c_id AND s.id<1008 MINUS
SELECT c_id FROM (SELECT DISTINCT id,name,birth,c_id FROM stu233@my_link2) s, class333 c WHERE c.id=s.c_id AND s.id<1005);
SELECT * FROM class333_1 order by 1,2,3,4;
id	name	location	create_time
NULL	dianzi	lalala	NULL
101	qazxsw	xixi	2005-09-25 12:01:33.33330
102	dianzi	xixi	2008-09-25 12:01:33.33330
103	jisuanji	xixi	2018-09-25 12:01:33.33330
104	yishu	lalala	2020-09-25 12:01:33.33330
105	qiqi	lalala	2005-10-10 00:00:00.00000
107	shuxue	lalala	2005-09-25 12:01:33.33330
#mysql_dblink_read-06-8	delete：delete from 本地表 where (select远端表)
DROP TABLE stu333_1 ;
DROP TABLE class333_1 ;
CREATE TABLE class333_1 AS SELECT * FROM class333;
DELETE FROM class333_1 WHERE id=(SELECT DISTINCT min(id) FROM class150@my_link1 WHERE create_time>STR_TO_DATE('25-09-2005 12:01:33.3333','%d-%m-%Y %H:%i:%s.%f'));
SELECT * FROM class333_1 order by 1,2,3,4;
id	name	location	create_time
NULL	dianzi	NULL	NULL
101	yinyue	binjiang	2005-09-25 12:01:33.33330
103	jisuanji	binjiang	2018-09-25 12:01:33.33330
104	yishu	xixi	2020-09-25 12:01:33.33330
105	qiqi	yuhang	2005-10-10 00:00:00.00000
107	shuxue	yuhang	2005-09-25 12:01:33.33330
DELETE FROM class333_1 WHERE id=(SELECT (CASE max(id)+1 WHEN 1003 THEN 100 ELSE 101 END) FROM stu150@my_link1 WHERE id BETWEEN 1002 AND 1003 GROUP BY c_id HAVING c_id>101);
SELECT * FROM class333_1 order by 1,2,3,4;
id	name	location	create_time
NULL	dianzi	NULL	NULL
103	jisuanji	binjiang	2018-09-25 12:01:33.33330
104	yishu	xixi	2020-09-25 12:01:33.33330
105	qiqi	yuhang	2005-10-10 00:00:00.00000
107	shuxue	yuhang	2005-09-25 12:01:33.33330
DELETE FROM class333_1 WHERE id=(SELECT t-900 FROM (SELECT max(id)+1 t FROM stu233@my_link2 GROUP BY c_id ORDER BY c_id) LIMIT 1);
SELECT * FROM class333_1 order by 1,2,3,4;
id	name	location	create_time
NULL	dianzi	NULL	NULL
104	yishu	xixi	2020-09-25 12:01:33.33330
105	qiqi	yuhang	2005-10-10 00:00:00.00000
107	shuxue	yuhang	2005-09-25 12:01:33.33330
INSERT INTO class333_1 VALUES(101,DEFAULT,'binjiang',STR_TO_DATE('25-09-2005 12:01:33.3333','%d-%m-%Y %H:%i:%s.%f'));
INSERT INTO class333_1 VALUES(102,'dianzi','xixi',STR_TO_DATE('25-09-2005 12:01:33.3333','%d-%m-%Y %H:%i:%s.%f'));
INSERT INTO class333_1 VALUES(103,'jisuanji','binjiang',STR_TO_DATE('25-09-2005 12:01:33.3333','%d-%m-%Y %H:%i:%s.%f'));
DELETE FROM class333_1 WHERE id=(SELECT MIN(id) FROM (WITH a AS (SELECT DISTINCT n.id,m.name FROM stu233@my_link2 m JOIN class333 n ON n.id=m.c_id),
b AS (SELECT t.name FROM (SELECT n.id,m.name FROM stu333 m,class150@my_link1 n) t)
SELECT DISTINCT a.id FROM a,b WHERE trim(a.name)=trim(b.name)));
DELETE FROM class333_1 WHERE id IN 
(SELECT id FROM (SELECT c_id FROM stu333 WHERE id>1004 GROUP BY c_id HAVING c_id>101 
UNION SELECT c_id FROM stu233@my_link2 WHERE id<1003 GROUP BY c_id HAVING c_id=101 ORDER BY c_id) a 
RIGHT JOIN (SELECT DISTINCT id,name,location FROM class333) b ON a.c_id=b.id);
INSERT INTO class333_1 VALUES(101,DEFAULT,'binjiang',STR_TO_DATE('25-09-2005 12:01:33.3333','%d-%m-%Y %H:%i:%s.%f'));
INSERT INTO class333_1 VALUES(102,'dianzi','xixi',STR_TO_DATE('25-09-2005 12:01:33.3333','%d-%m-%Y %H:%i:%s.%f'));
INSERT INTO class333_1 VALUES(103,'jisuanji','binjiang',STR_TO_DATE('25-09-2005 12:01:33.3333','%d-%m-%Y %H:%i:%s.%f'));
INSERT INTO class333_1 VALUES(104,'yishu','xixi',STR_TO_DATE('25-09-2005 12:01:33.3333','%d-%m-%Y %H:%i:%s.%f'));
DELETE FROM class333_1 WHERE id IN
(SELECT id FROM (SELECT c_id FROM stu233@my_link2 WHERE id>1004 GROUP BY c_id HAVING c_id>101 
UNION SELECT c_id FROM stu233@my_link2 WHERE id<1003 GROUP BY c_id HAVING c_id=101 ORDER BY c_id) a 
RIGHT JOIN (SELECT DISTINCT id,name,location FROM class233@my_link2) b ON a.c_id=b.id);
INSERT INTO class333_1 VALUES(101,DEFAULT,'binjiang',STR_TO_DATE('25-09-2005 12:01:33.3333','%d-%m-%Y %H:%i:%s.%f'));
INSERT INTO class333_1 VALUES(102,'dianzi','xixi',STR_TO_DATE('25-09-2005 12:01:33.3333','%d-%m-%Y %H:%i:%s.%f'));
INSERT INTO class333_1 VALUES(103,'jisuanji','binjiang',STR_TO_DATE('25-09-2005 12:01:33.3333','%d-%m-%Y %H:%i:%s.%f'));
INSERT INTO class333_1 VALUES(104,'yishu','xixi',STR_TO_DATE('25-09-2005 12:01:33.3333','%d-%m-%Y %H:%i:%s.%f'));
DELETE FROM class333_1 WHERE id>=(SELECT c_id FROM (SELECT DISTINCT id,name,birth,c_id FROM stu150@my_link1) s, class333 c WHERE c.id=s.c_id AND s.id<1008 MINUS
SELECT c_id FROM (SELECT DISTINCT id,name,birth,c_id FROM stu233@my_link2) s, class333 c WHERE c.id=s.c_id AND s.id<1005);
#mysql_dblink_read-06-10,mysql_dblink_read-06-11 复杂查询+dml补充验证
SELECT e.id,count(e.name) from class150@my_link1 e INNER JOIN class233@my_link2 d on e.id = d.id where e.name = d.name and e.name ='dianzi' group by e.id having count(e.name) >=1 order by e.id;
id	count(e.name)
102	1
SELECT e.id,count(e.name) from stu150@my_link1 e INNER JOIN stu150@my_link2 d on e.id = d.id where e.name = d.name and e.name ='wangwu' group by e.id having count(e.name) >=1 order by e.id;
id	count(e.name)
1003	1
SELECT e.id,count(e.name) from class150@my_link1 e INNER JOIN stu150@my_link2 d on e.id = d.c_id where e.id = d.c_id and e.name ='dianzi' group by e.id having count(e.name) >=1 order by e.id;
id	count(e.name)
102	2
SELECT e.id,count(e.name) from stu150@my_link1 e INNER JOIN class233@my_link2 d on e.c_id = d.id where e.c_id = d.id and e.name ='wangwu' group by e.id having count(e.name) >=1 order by e.id;
id	count(e.name)
1003	1
WITH 
T1 AS (SELECT e.id,count(e.name) from class150@my_link1 e INNER JOIN class233@my_link2 d on e.id = d.id where e.name = d.name and e.name ='dianzi' group by e.id having count(e.name) >=1 order by e.id),
T2 AS (SELECT e.id,count(e.name) from stu150@my_link1 e INNER JOIN stu150@my_link2 d on e.id = d.id where e.name = d.name and e.name ='wangwu' group by e.id having count(e.name) >=1 order by e.id),
T3 AS (SELECT e.id,count(e.name) from class150@my_link1 e INNER JOIN stu150@my_link2 d on e.id = d.c_id where e.id = d.c_id and e.name ='dianzi' group by e.id having count(e.name) >=1 order by e.id),
T4 AS (SELECT e.id,count(e.name) from stu150@my_link1 e INNER JOIN class233@my_link2 d on e.c_id = d.id where e.c_id = d.id and e.name ='wangwu' group by e.id having count(e.name) >=1 order by e.id)
SELECT * FROM T1,T2,T3,T4;
id	count(e.name)	id	count(e.name)	id	count(e.name)	id	count(e.name)
102	1	1003	1	102	2	1003	1
update class150@my_link1 t set t.name = '中文测试xxx' where t.id = '101';
ERROR 0A000: Not supported feature or function
update class233@my_link2 t set t.name = '中文测试xxx' where t.id = '101';
ERROR 0A000: Not supported feature or function
update stu150@my_link1 t set t.name = '中文测试xxx' where t.c_id = '101';
ERROR 0A000: Not supported feature or function
update stu233@my_link2 t set t.name = '中文测试xxx' where t.c_id = '101';
ERROR 0A000: Not supported feature or function
update class150@my_link1 t set t.name = (select e.name from class233@my_link2 e where e.id = '101') where t.id = '101';
ERROR 0A000: Not supported feature or function
update class233@my_link2 t set t.name = (select e.name from class150@my_link1 e where e.id = '101') where t.id = '101';
ERROR 0A000: Not supported feature or function
update stu150@my_link1 t set t.name = (select e.name from class233@my_link2 e where e.id = '101') where t.id = '101';
ERROR 0A000: Not supported feature or function
update stu233@my_link2 t set t.name = (select e.name from class150@my_link1 e where e.id = '101') where t.id = '101';
ERROR 0A000: Not supported feature or function
update class150@my_link1 t set t.name = '中文测试yyy' where t.id in ('a','101');
ERROR 0A000: Not supported feature or function
update class233@my_link2 t set t.name = '中文测试yyy' where t.id in ('a','101');
ERROR 0A000: Not supported feature or function
update stu150@my_link1   t set t.name = '中文测试yyy' where t.id in ('a','101');
ERROR 0A000: Not supported feature or function
update stu233@my_link2   t set t.name = '中文测试yyy' where t.id in ('a','101');
ERROR 0A000: Not supported feature or function
update (select e.id c1old,e.name c2new from class150@my_link1 e where e.id = '101') set c2new = c1old ;
ERROR HY000: The target table ANONYMOUS_VIEW1 of the UPDATE is not updatable
update (select e.id c1old,e.name c2new from class233@my_link2 e where e.id = '101') set c2new = c1old ;
ERROR HY000: The target table ANONYMOUS_VIEW1 of the UPDATE is not updatable
update (select e.id c1old,e.name c2new from stu150@my_link1 e where e.c_id = '101') set c2new = c1old ;
ERROR HY000: The target table ANONYMOUS_VIEW1 of the UPDATE is not updatable
update (select e.id c1old,e.name c2new from stu233@my_link2 e where e.c_id = '101') set c2new = c1old ;
ERROR HY000: The target table ANONYMOUS_VIEW1 of the UPDATE is not updatable
update class150@my_link1 t set (t.id,t.name) = (select e.id,e.name from class233@my_link2 e where e.id = '101') where t.id = '101';
ERROR 42000: You have an error in your SQL syntax; check the manual that corresponds to your OceanBase version for the right syntax to use near '(t.id,t.name) = (select e.id,e.name from class233@my_link2 e where e.id = '101')' at line 1
update class233@my_link2 t set (t.id,t.name) = (select e.id,e.name from class150@my_link1 e where e.id = '101') where t.id = '101';
ERROR 42000: You have an error in your SQL syntax; check the manual that corresponds to your OceanBase version for the right syntax to use near '(t.id,t.name) = (select e.id,e.name from class150@my_link1 e where e.id = '101')' at line 1
update stu150@my_link1 t set (t.id,t.name) = (select e.id,e.name from stu233@my_link2 e where e.c_id = '101') where t.c_id = '101';
ERROR 42000: You have an error in your SQL syntax; check the manual that corresponds to your OceanBase version for the right syntax to use near '(t.id,t.name) = (select e.id,e.name from stu233@my_link2 e where e.c_id = '101')' at line 1
update stu233@my_link2 t set (t.id,t.name) = (select e.id,e.name from stu150@my_link1 e where e.c_id = '101') where t.c_id = '101';
ERROR 42000: You have an error in your SQL syntax; check the manual that corresponds to your OceanBase version for the right syntax to use near '(t.id,t.name) = (select e.id,e.name from stu150@my_link1 e where e.c_id = '101')' at line 1
delete from (select * from class150@my_link1 t where t.id = '101');
ERROR 42000: You have an error in your SQL syntax; check the manual that corresponds to your OceanBase version for the right syntax to use near '(select * from class150@my_link1 t where t.id = '101')' at line 1
delete from (select * from class233@my_link2 t where t.id = '101');
ERROR 42000: You have an error in your SQL syntax; check the manual that corresponds to your OceanBase version for the right syntax to use near '(select * from class233@my_link2 t where t.id = '101')' at line 1
delete from (select * from stu150@my_link1 t where t.id = '101');
ERROR 42000: You have an error in your SQL syntax; check the manual that corresponds to your OceanBase version for the right syntax to use near '(select * from stu150@my_link1 t where t.id = '101')' at line 1
delete from (select * from stu233@my_link2 t where t.id = '101');
ERROR 42000: You have an error in your SQL syntax; check the manual that corresponds to your OceanBase version for the right syntax to use near '(select * from stu233@my_link2 t where t.id = '101')' at line 1
delete from class150@my_link1 t where t.id in (select e.id from class233@my_link2 e where e.name = 'wangwu');
ERROR 0A000: Not supported feature or function
delete from class233@my_link2 t where t.id in (select e.id from class150@my_link1 e where e.name = 'wangwu');
ERROR 0A000: Not supported feature or function
delete from stu150@my_link1 t where t.id in (select e.id from class233@my_link2 e where e.name = 'wangwu');
ERROR 0A000: Not supported feature or function
delete from stu233@my_link2 t where t.id in (select e.id from class233@my_link2 e where e.name = 'wangwu');
ERROR 0A000: Not supported feature or function
#清理环境
purge recyclebin;
