#Environmental cleaning
drop user hjw@'%';
create user hjw identified by 'hjw';
grant all on *.* to hjw WITH GRANT OPTION;
#function-8    约束
#function-9    分区表
#function-10   pl/sql
#function-8    约束=====>primary key
drop table test1;
create table test1(c1 int,c2 bigint,PRIMARY key(c1,c2));
insert into test1 values(is_uuid('6ccd780c-baba-1026-9564-5b8c656024db'),is_uuid('6ccd780cbaba102695645b8c656024db'));
insert into test1 values(is_uuid('{6ccd780c-baba-1026-9564-5b8c656024db}'),is_uuid('1215103214153234564103246122'));
insert into test1 values(is_uuid('{aaaaaaaa-0230-wewq-eqrr-bbbbbbbbbbbb}'),is_uuid('-0120..24512443212421.21324213'));
select * from test1 order by c1 asc;
c1	c2
0	0
1	0
1	1
update test1 set c2=c1,c1=c2;
update test1 set c2=c1,c1=c2 LIMIT 1;
select * from test1 order by c1 asc;
c1	c2
0	0
1	0
1	1
update test1 set c2=is_uuid('6ccd780c-baba-1026-9564-5b8c656024db'),c1=is_uuid('{aaaaaaaa-0230-wewq-eqrr-bbbbbbbbbbbb}') LIMIT 1;
select * from test1 order by c1 asc;
c1	c2
0	1
1	0
1	1
update test1 set c2=is_uuid('6ccd780c-baba-1026-9564-5b8c656024db')+null,c1=is_uuid('{aaaaaaaa-0230-wewq-eqrr-bbbbbbbbbbbb}')+1 LIMIT 1;
update test1 set c2=is_uuid('6ccd780c-baba-1026-9564-5b8c656024db')-2,c1=is_uuid('{aaaaaaaa-0230-wewq-eqrr-bbbbbbbbbbbb}')+1 LIMIT 1;
select * from test1 order by c1 asc;
c1	c2
1	-1
1	0
1	1
delete from test1 where  is_uuid('6ccd780c-baba-1026-9564-5b8c656024db')=is_uuid('6ccd780c-baba-1026-9564-5b8c656024db')LIMIT 1;
select * from test1 order by c1 asc;
c1	c2
1	0
1	1
delete from test1 where is_uuid('6ccd780c-baba-1026-9564-5b8c656024db')=is_uuid('-0120..24512443212421.21324213') LIMIT 1;
select * from test1 order by c1 asc;
c1	c2
1	0
1	1
delete from test1 where is_uuid('-0120..24512443212421.21324213')=is_uuid('-0120..24512443212421.21324213') LIMIT 1;
select * from test1 order by c1 asc;
c1	c2
1	1
drop table test1;
create table test1(c1 int,c2 bigint,PRIMARY key(is_uuid('6ccd780c-baba-1026-9564-5b8c656024db'),is_uuid('6ccd780cbaba102695645b8c656024db'));
create table test1(c1 int,c2 bigint,PRIMARY key(is_uuid('{6ccd780c-baba-1026-9564-5b8c656024db}'),is_uuid('1215103214153234564103246122'));
create table test1(c1 int,c2 bigint,PRIMARY key(is_uuid('{aaaaaaaa-0230-wewq-eqrr-bbbbbbbbbbbb}'),is_uuid('-0120..24512443212421.21324213'));
#function-8    约束=====>foreign key
drop table test2;
drop table test1;
create table test1(c1 int PRIMARY key);
insert into test1 values(1);
insert into test1 values(4);
insert into test1 values(7);
create table test2(c1 int PRIMARY key,c2 int,CONSTRAINT wj FOREIGN KEY (c1) REFERENCES test1(c1));
insert into test2 values(is_uuid('6ccd780c-baba-1026-9564-5b8c656024db'),is_uuid('-0120..24512443212421.21324213'));
select * from test2 order by c1 asc;
c1	c2
1	0
insert into test2 values(is_uuid('-0120..24512443212421.21324213')+is_uuid('6ccd780c-baba-1026-9564-5b8c656024db')
+is_uuid('6ccd780c-baba-1026-9564-5b8c656024db')+is_uuid('6ccd780c-baba-1026-9564-5b8c656024db')
+is_uuid('6ccd780c-baba-1026-9564-5b8c656024db'),is_uuid('-0120..24512443212421.21324213'));
insert into test2 values(is_uuid('-0120..24512443212421.21324213')+is_uuid('6ccd780c-baba-1026-9564-5b8c656024db')
+is_uuid('6ccd780c-baba-1026-9564-5b8c656024db')-is_uuid('6ccd780c-baba-1026-9564-5b8c656024db')
-is_uuid('6ccd780c-baba-1026-9564-5b8c656024db'),is_uuid('-0120..24512443212421.21324213'));
select * from test2 order by c1 asc;
c1	c2
1	0
4	0
update test2 set c1=(is_uuid('6ccd780c-baba-1026-9564-5b8c656024db'))*7 where c1=(is_uuid('6ccd780c-baba-1026-9564-5b8c656024db'))* 4;
select * from test2 order by c1 asc;
c1	c2
1	0
7	0
update test2 set c1=(is_uuid('6ccd780c-baba-1026-9564-5b8c656024db'))*0 where c1=(is_uuid('6ccd780c-baba-1026-9564-5b8c656024db'))* 7;
delete from test2 where c1=(is_uuid('6ccd780c-baba-1026-9564-5b8c656024db'))*7;
select * from test2 order by c1 asc;
c1	c2
1	0
drop table test2;
drop table test1;
#function-8    约束=====>unique
drop table test1;
create table test1(c1 int unique,c2 bigint unique);
insert into test1 values(is_uuid('6ccd780c-baba-1026-9564-5b8c656024db'),is_uuid('6ccd780cbaba102695645b8c656024db'));
insert into test1 values(is_uuid('{aaaaaaaa-0230-wewq-eqrr-bbbbbbbbbbbb}'),is_uuid('-0120..24512443212421.21324213'));
insert into test1 values(is_uuid('{6ccd780c-baba-1026-9564-5b8c656024db}'),is_uuid('1215103214153234564103246122'));
select * from test1 order by c1 asc;
c1	c2
0	0
1	1
update test1 set c2=c1,c1=c2;
update test1 set c2=c1,c1=c2 LIMIT 1;
select * from test1 order by c1 asc;
c1	c2
0	0
1	1
update test1 set c2=is_uuid('6ccd780c-baba-1026-9564-5b8c656024db'),c1=is_uuid('{aaaaaaaa-0230-wewq-eqrr-bbbbbbbbbbbb}') LIMIT 1;
select * from test1 order by c1 asc;
c1	c2
0	0
1	1
update test1 set c2=is_uuid('6ccd780c-baba-1026-9564-5b8c656024db')+null,c1=is_uuid('{aaaaaaaa-0230-wewq-eqrr-bbbbbbbbbbbb}')+1 LIMIT 1;
update test1 set c2=is_uuid('6ccd780c-baba-1026-9564-5b8c656024db')-2,c1=is_uuid('{aaaaaaaa-0230-wewq-eqrr-bbbbbbbbbbbb}')+1 LIMIT 1;
select * from test1 order by c1 asc;
c1	c2
0	0
1	-1
delete from test1 where  is_uuid('6ccd780c-baba-1026-9564-5b8c656024db')=is_uuid('6ccd780c-baba-1026-9564-5b8c656024db')LIMIT 1;
select * from test1 order by c1 asc;
c1	c2
0	0
delete from test1 where is_uuid('6ccd780c-baba-1026-9564-5b8c656024db')=is_uuid('-0120..24512443212421.21324213') LIMIT 1;
select * from test1 order by c1 asc;
c1	c2
0	0
delete from test1 where is_uuid('-0120..24512443212421.21324213')=is_uuid('-0120..24512443212421.21324213') LIMIT 1;
select * from test1 order by c1 asc;
c1	c2
#function-8    约束=====>check
drop table test1;
create table test1(c1 int unique,c2 bigint unique,check(c1=is_uuid('6ccd780c-baba-1026-9564-5b8c656024db') or is_uuid('6ccd780cbaba102695645b8c656024db')));
insert into test1 values(is_uuid('6ccd780c-baba-1026-9564-5b8c656024db'),is_uuid('6ccd780cbaba102695645b8c656024db'));
insert into test1 values(is_uuid('{aaaaaaaa-0230-wewq-eqrr-bbbbbbbbbbbb}'),is_uuid('-0120..24512443212421.21324213'));
insert into test1 values(is_uuid('{6ccd780c-baba-1026-9564-5b8c656024db}'),is_uuid('1215103214153234564103246122'));
select * from test1 order by c1 asc;
c1	c2
0	0
1	1
update test1 set c2=c1,c1=c2;
update test1 set c2=c1,c1=c2 LIMIT 1;
select * from test1 order by c1 asc;
c1	c2
0	0
1	1
update test1 set c2=is_uuid('6ccd780c-baba-1026-9564-5b8c656024db'),c1=is_uuid('{aaaaaaaa-0230-wewq-eqrr-bbbbbbbbbbbb}') LIMIT 1;
select * from test1 order by c1 asc;
c1	c2
0	0
1	1
update test1 set c2=is_uuid('6ccd780c-baba-1026-9564-5b8c656024db')+null,c1=is_uuid('{aaaaaaaa-0230-wewq-eqrr-bbbbbbbbbbbb}')+1 LIMIT 1;
update test1 set c2=is_uuid('6ccd780c-baba-1026-9564-5b8c656024db')-2,c1=is_uuid('{aaaaaaaa-0230-wewq-eqrr-bbbbbbbbbbbb}')+1 LIMIT 1;
select * from test1 order by c1 asc;
c1	c2
0	0
1	-1
update test1 set c1=is_uuid('6ccd780c-baba-1026-9564-5b8c656024db')+null,c1=is_uuid('{aaaaaaaa-0230-wewq-eqrr-bbbbbbbbbbbb}')+1 LIMIT 1;
update test1 set c1=is_uuid('6ccd780c-baba-1026-9564-5b8c656024db')-2,c1=is_uuid('{aaaaaaaa-0230-wewq-eqrr-bbbbbbbbbbbb}')+1 LIMIT 1;
select * from test1 order by c1 asc;
c1	c2
0	0
1	-1
update test1 set c1=is_uuid('6ccd780c-baba-1026-9564-5b8c656024db')-2 LIMIT 1;
select * from test1 order by c1 asc;
c1	c2
-1	-1
0	0
update test1 set c1=is_uuid('6ccd780c-baba-1026-9564-5b8c656024db')-2 where c1=0 LIMIT 1;
select * from test1 order by c1 asc;
c1	c2
-1	-1
0	0
update test1 set c1=is_uuid('6ccd780c-baba-1026-9564-5b8c656024db')+2 where c1=0 LIMIT 1;
select * from test1 order by c1 asc;
c1	c2
-1	-1
3	0
delete from test1 where  is_uuid('6ccd780c-baba-1026-9564-5b8c656024db')=is_uuid('6ccd780c-baba-1026-9564-5b8c656024db')LIMIT 1;
select * from test1 order by c1 asc;
c1	c2
3	0
delete from test1 where is_uuid('6ccd780c-baba-1026-9564-5b8c656024db')=is_uuid('-0120..24512443212421.21324213') LIMIT 1;
select * from test1 order by c1 asc;
c1	c2
3	0
delete from test1 where is_uuid('-0120..24512443212421.21324213')=is_uuid('-0120..24512443212421.21324213') LIMIT 1;
select * from test1 order by c1 asc;
c1	c2
#function-8    约束=====>not null
drop table test1;
create table test1(c1 int not null,c2 bigint not null);
insert into test1 values(is_uuid('6ccd780c-baba-1026-9564-5b8c656024db'),is_uuid('6ccd780cbaba102695645b8c656024db'));
insert into test1 values(is_uuid('{aaaaaaaa-0230-wewq-eqrr-bbbbbbbbbbbb}'),is_uuid('-0120..24512443212421.21324213'));
select * from test1 order by c1 asc;
c1	c2
0	0
1	1
insert into test1 values(is_uuid('null'),is_uuid('null'));
insert into test1 values(is_uuid(null),is_uuid(null));
select * from test1 order by c1 asc;
c1	c2
0	0
0	0
1	1
update test1 set c2=is_uuid(null)+null,c1=is_uuid('{aaaaaaaa-0230-wewq-eqrr-bbbbbbbbbbbb}')+1 LIMIT 1;
update test1 set c1=is_uuid('6ccd780c-baba-1026-9564-5b8c656024db')-2,c1=is_uuid('{aaaaaaaa-0230-wewq-eqrr-bbbbbbbbbbbb}')+1 LIMIT 1;
select * from test1 order by c1 asc;
c1	c2
0	0
0	0
1	1
delete from test1 where c1=is_uuid(null) LIMIT 1;
#function-8    约束=====>default
drop table test1;
create table test1(c1 int default (select is_uuid('6ccd780c-baba-1026-9564-5b8c656024db')),
c2 bigint default (select is_uuid('-0120..24512443212421.21324213')));
create table test1(c1 int default (is_uuid('6ccd780c-baba-1026-9564-5b8c656024db')),
c2 bigint default (is_uuid('-0120..24512443212421.21324213')),c3 FLOAT);
drop table test1;
create table test1(c1 int ,c2 bigint ,c3 FLOAT);
alter table test1 add c4 int not null default '(is_uuid(6ccd780c-baba-1026-9564-5b8c656024db))';
alter table test1 add c4 int not null default is_uuid('6ccd780c-baba-1026-9564-5b8c656024db'));
alter table test1 add c4 int not null default (select is_uuid('6ccd780c-baba-1026-9564-5b8c656024db'));
#function-9    分区表
#function-9    分区表=====>hash
drop table test1;
create table test1(c1 int,c2 bigint)partition  by hash(c1)(PARTITION p1,PARTITION p2);
insert into test1 PARTITION(p2) values(is_uuid('6ccd780c-baba-1026-9564-5b8c656024db'),is_uuid('6ccd780c-baba-1026-9564-5b8c656024db'));
insert into test1 PARTITION(p1) values(is_uuid('-0120..24512443212421.21324213'),is_uuid('-0120..24512443212421.21324213'));
insert into test1 PARTITION(p2) values(is_uuid('6ccd780c-baba-1026-9564-5b8c656024db'),is_uuid('-0120..24512443212421.21324213'));
insert into test1 PARTITION(p1) values(is_uuid(null),is_uuid(null));
select * from test1 PARTITION(p1) order by c1 asc;
c1	c2
NULL	NULL
0	0
select * from test1 PARTITION(p2) order by c1 asc;
c1	c2
1	1
1	0
update test1 PARTITION(p1) set c1=is_uuid('-0120..24512443212421.21324213') where c1=null;
select * from test1 PARTITION(p1) order by c1 asc;
c1	c2
NULL	NULL
0	0
update test1 PARTITION(p1) set c1=is_uuid('6ccd780c-baba-1026-9564-5b8c656024db') where c1=is_uuid('-0120..24512443212421.21324213');
update test1 PARTITION(p2) set c1=is_uuid('-0120..24512443212421.21324213') where c1=0;
select * from test1 PARTITION(p2) order by c1 asc;
c1	c2
1	1
1	0
update test1 PARTITION(p2) set c1=is_uuid('-0120..24512443212421.21324213') where c1=1;
update test1 PARTITION(p2) set is_uuid('6ccd780c-baba-1026-9564-5b8c656024db')=is_uuid('-0120..24512443212421.21324213') where c1=0;
update test1 PARTITION(p2) set is_uuid('-0120..24512443212421.21324213')=is_uuid('-0120..24512443212421.21324213') where c1=0;
delete from test1 PARTITION(p1) where c1= is_uuid(null);
select * from test1 PARTITION(p1) order by c1 asc;
c1	c2
NULL	NULL
0	0
delete from test1 PARTITION(p1) where is_uuid('6ccd780c-baba-1026-9564-5b8c656024db')= is_uuid('-0120..24512443212421.21324213');
delete from test1 PARTITION(p1) where is_uuid('-0120..24512443212421.21324213')= is_uuid('-0120..24512443212421.21324213');
delete from test1 PARTITION(p1) where c1= is_uuid('-0120..24512443212421.21324213');
delete from test1 PARTITION(p2) where c1= is_uuid('6ccd780c-baba-1026-9564-5b8c656024db');
select * from test1 PARTITION(p2) order by c1 asc;
c1	c2
#function-9    分区表=====>key
drop table test1;
create table test1(c1 int,c2 bigint)partition  by KEY(c1)(PARTITION p1,PARTITION p2);
insert into test1 PARTITION(p1) values(is_uuid('6ccd780c-baba-1026-9564-5b8c656024db'),is_uuid('6ccd780c-baba-1026-9564-5b8c656024db'));
insert into test1 PARTITION(p2) values(is_uuid('-0120..24512443212421.21324213'),is_uuid('-0120..24512443212421.21324213'));
insert into test1 PARTITION(p1) values(is_uuid('6ccd780c-baba-1026-9564-5b8c656024db'),is_uuid('-0120..24512443212421.21324213'));
select * from test1 PARTITION(p1) order by c1 asc;
c1	c2
1	1
1	0
select * from test1 PARTITION(p2) order by c1 asc;
c1	c2
0	0
update test1 PARTITION(p1) set c1=is_uuid('-0120..24512443212421.21324213') where c1=null;
select * from test1 PARTITION(p1) order by c1 asc;
c1	c2
1	1
1	0
update test1 PARTITION(p1) set c1=is_uuid('6ccd780c-baba-1026-9564-5b8c656024db') where c1=is_uuid('-0120..24512443212421.21324213');
update test1 PARTITION(p2) set c1=is_uuid('-0120..24512443212421.21324213') where c1=0;
select * from test1 PARTITION(p2) order by c1 asc;
c1	c2
0	0
update test1 PARTITION(p2) set c1=is_uuid('-0120..24512443212421.21324213') where c1=1;
update test1 PARTITION(p2) set is_uuid('6ccd780c-baba-1026-9564-5b8c656024db')=is_uuid('-0120..24512443212421.21324213') where c1=0;
update test1 PARTITION(p2) set is_uuid('-0120..24512443212421.21324213')=is_uuid('-0120..24512443212421.21324213') where c1=0;
delete from test1 PARTITION(p1) where c1= is_uuid(null);
select * from test1 PARTITION(p1) order by c1 asc;
c1	c2
1	1
1	0
delete from test1 PARTITION(p1) where is_uuid('6ccd780c-baba-1026-9564-5b8c656024db')= is_uuid('-0120..24512443212421.21324213');
delete from test1 PARTITION(p1) where is_uuid('-0120..24512443212421.21324213')= is_uuid('-0120..24512443212421.21324213');
delete from test1 PARTITION(p1) where c1= is_uuid('-0120..24512443212421.21324213');
delete from test1 PARTITION(p2) where c1= is_uuid('6ccd780c-baba-1026-9564-5b8c656024db');
select * from test1 PARTITION(p2) order by c1 asc;
c1	c2
0	0
#function-9    分区表=====>list
drop table test1;
create table test1(c1 int,c2 bigint)partition by list(c1)(PARTITION p1 values in(100),PARTITION p2 values in(200));
insert into test1 PARTITION(p1) values(is_uuid('6ccd780c-baba-1026-9564-5b8c656024db')+99,is_uuid('6ccd780c-baba-1026-9564-5b8c656024db'));
insert into test1 PARTITION(p1) values(is_uuid('-0120..24512443212421.21324213')+100,is_uuid('-0120..24512443212421.21324213'));
insert into test1 PARTITION(p2) values(is_uuid('6ccd780c-baba-1026-9564-5b8c656024db')+199,is_uuid('-0120..24512443212421.21324213'));
insert into test1 PARTITION(p2) values(is_uuid('-0120..24512443212421.21324213')+200,is_uuid('6ccd780c-baba-1026-9564-5b8c656024db'));
select * from test1 PARTITION(p1) order by c1 asc;
c1	c2
100	1
100	0
select * from test1 PARTITION(p2) order by c1 asc;
c1	c2
200	0
200	1
update test1 PARTITION(p1) set c1=is_uuid('-0120..24512443212421.21324213') where c1=null;
select * from test1 PARTITION(p1) order by c1 asc;
c1	c2
100	1
100	0
update test1 PARTITION(p1) set c1=is_uuid('6ccd780c-baba-1026-9564-5b8c656024db') where c1=is_uuid('-0120..24512443212421.21324213');
update test1 PARTITION(p2) set c1=is_uuid('-0120..24512443212421.21324213') where c1=0;
select * from test1 PARTITION(p2) order by c1 asc;
c1	c2
200	0
200	1
update test1 PARTITION(p2) set c1=is_uuid('-0120..24512443212421.21324213') where c1=1;
update test1 PARTITION(p1) set c1=is_uuid('-0120..24512443212421.21324213')+100 where c2=0;
update test1 PARTITION(p1) set c1=is_uuid('-0120..24512443212421.21324213')+100 where c2=is_uuid('6ccd780c-baba-1026-9564-5b8c656024db');
update test1 PARTITION(p1) set c1=is_uuid('-0120..24512443212421.21324213')+1 where c2=is_uuid('6ccd780c-baba-1026-9564-5b8c656024db');
update test1 PARTITION(p1) set c1=1+c1-is_uuid('-0120..24512443212421.21324213') where c2=is_uuid('6ccd780c-baba-1026-9564-5b8c656024db');
update test1 PARTITION(p2) set is_uuid('6ccd780c-baba-1026-9564-5b8c656024db')=is_uuid('-0120..24512443212421.21324213') where c1=0;
update test1 PARTITION(p2) set is_uuid('-0120..24512443212421.21324213')=is_uuid('-0120..24512443212421.21324213') where c1=0;
delete from test1 PARTITION(p1) where c1= is_uuid(null);
select * from test1 PARTITION(p1) order by c1 asc;
c1	c2
100	1
100	0
delete from test1 PARTITION(p1) where is_uuid('6ccd780c-baba-1026-9564-5b8c656024db')= is_uuid('-0120..24512443212421.21324213');
delete from test1 PARTITION(p1) where is_uuid('-0120..24512443212421.21324213')= is_uuid('-0120..24512443212421.21324213');
delete from test1 PARTITION(p1) where c1= is_uuid('-0120..24512443212421.21324213');
delete from test1 PARTITION(p2) where c1= is_uuid('6ccd780c-baba-1026-9564-5b8c656024db');
select * from test1 PARTITION(p2) order by c1 asc;
c1	c2
200	0
200	1
select * from test1 PARTITION(p1) order by c1 asc;
c1	c2
delete from test1 PARTITION(p2) where c1= is_uuid('-0120..24512443212421.21324213')+c1-is_uuid('-0120..24512443212421.21324213');
select * from test1 PARTITION(p2) order by c1 asc;
c1	c2
drop table test1;
create table test1(c1 int,c2 bigint)partition by list(c1)(
PARTITION p1 values in(is_uuid('-0120..24512443212421.21324213')),
PARTITION p2 values in(is_uuid('6ccd780c-baba-1026-9564-5b8c656024db')));
#function-9    分区表=====>range
drop table test1;
create table test1(c1 int,c2 bigint)partition by range(c1)(PARTITION p1 values less than(100),PARTITION p2 values less than(200));
insert into test1 PARTITION(p1) values(is_uuid('6ccd780c-baba-1026-9564-5b8c656024db')+90,is_uuid('6ccd780c-baba-1026-9564-5b8c656024db'));
insert into test1 PARTITION(p1) values(is_uuid('-0120..24512443212421.21324213')+98,is_uuid('-0120..24512443212421.21324213'));
insert into test1 PARTITION(p2) values(is_uuid('6ccd780c-baba-1026-9564-5b8c656024db')+150,is_uuid('-0120..24512443212421.21324213'));
insert into test1 PARTITION(p2) values(is_uuid('-0120..24512443212421.21324213')+190,is_uuid('6ccd780c-baba-1026-9564-5b8c656024db'));
select * from test1 PARTITION(p1) order by c1 asc;
c1	c2
91	1
98	0
select * from test1 PARTITION(p2) order by c1 asc;
c1	c2
151	0
190	1
update test1 PARTITION(p1) set c1=is_uuid('-0120..24512443212421.21324213') where c1=null;
select * from test1 PARTITION(p1) order by c1 asc;
c1	c2
91	1
98	0
update test1 PARTITION(p1) set c1=is_uuid('6ccd780c-baba-1026-9564-5b8c656024db') where c1=is_uuid('-0120..24512443212421.21324213');
update test1 PARTITION(p2) set c1=is_uuid('-0120..24512443212421.21324213') where c2=0;
select * from test1 PARTITION(p2) order by c1 asc;
c1	c2
151	0
190	1
update test1 PARTITION(p1) set c1=is_uuid('-0120..24512443212421.21324213') where c2=1;
update test1 PARTITION(p2) set c1=is_uuid('-0120..24512443212421.21324213')+100 where c2=0;
update test1 PARTITION(p1) set c1=is_uuid('-0120..24512443212421.21324213')-100 where c2=is_uuid('6ccd780c-baba-1026-9564-5b8c656024db');
update test1 PARTITION(p1) set c1=is_uuid('-0120..24512443212421.21324213')+1 where c2=is_uuid('6ccd780c-baba-1026-9564-5b8c656024db');
select * from test1 PARTITION(p1) order by c1 asc;
c1	c2
1	1
98	0
select * from test1 PARTITION(p2) order by c1 asc;
c1	c2
100	0
190	1
update test1 PARTITION(p1) set c1=1+c1-is_uuid('-0120..24512443212421.21324213') where c2=is_uuid('6ccd780c-baba-1026-9564-5b8c656024db');
update test1 PARTITION(p2) set is_uuid('6ccd780c-baba-1026-9564-5b8c656024db')=is_uuid('-0120..24512443212421.21324213') where c2=0;
update test1 PARTITION(p2) set is_uuid('-0120..24512443212421.21324213')=is_uuid('-0120..24512443212421.21324213') where c2=0;
delete from test1 PARTITION(p1) where c1= is_uuid(null);
select * from test1 PARTITION(p1) order by c1 asc;
c1	c2
2	1
98	0
delete from test1 PARTITION(p1) where is_uuid('6ccd780c-baba-1026-9564-5b8c656024db')= is_uuid('-0120..24512443212421.21324213');
delete from test1 PARTITION(p1) where is_uuid('-0120..24512443212421.21324213')= is_uuid('-0120..24512443212421.21324213');
delete from test1 PARTITION(p1) where c1= is_uuid('-0120..24512443212421.21324213');
delete from test1 PARTITION(p2) where c1= is_uuid('6ccd780c-baba-1026-9564-5b8c656024db');
select * from test1 PARTITION(p2) order by c1 asc;
c1	c2
100	0
190	1
select * from test1 PARTITION(p1) order by c1 asc;
c1	c2
delete from test1 PARTITION(p2) where c1= is_uuid('-0120..24512443212421.21324213')+c1-is_uuid('-0120..24512443212421.21324213');
select * from test1 PARTITION(p2) order by c1 asc;
c1	c2
drop table test1;
create table test1(c1 int,c2 bigint)partition by range(c1)(
PARTITION p1 values less than(is_uuid('6ccd780c-baba-1026-9564-5b8c656024db')),
PARTITION p2 values less than(is_uuid('-0120..24512443212421.21324213')));
create table test1(c1 int,c2 bigint)partition by range(c1)(
PARTITION p1 values less than((select is_uuid('6ccd780c-baba-1026-9564-5b8c656024db'))),
PARTITION p2 values less than((select is_uuid('-0120..24512443212421.21324213'))));
#function-10   pl/sql
#function-10-1   存储过程=====>while循环
drop table test1;
create table test1(c1 int ,c2 char(20));
drop procedure procedure_1;
create procedure procedure_1()
begin
declare i int default -10;
while i<is_uuid('6ccd780c-baba-1026-9564-5b8c656024db')
do
insert into test1 values(i,'hangzhou');
set i=i+1;
end while;
commit;
end;
/
call procedure_1();
select * from test1 order by c1 asc;
c1	c2
-10	hangzhou
-9	hangzhou
-8	hangzhou
-7	hangzhou
-6	hangzhou
-5	hangzhou
-4	hangzhou
-3	hangzhou
-2	hangzhou
-1	hangzhou
0	hangzhou
drop PROCEDURE procedure_1;
drop table test1;
create table test1(c1 int ,c2 char(20));
create procedure procedure_1()
begin
declare i int default -10;
while i<is_uuid('-0120..24512443212421.21324213')
do
insert into test1 values(i,is_uuid('6ccd780c-baba-1026-9564-5b8c656024db'));
set i=i+1;
end while;
commit;
end;
/
call procedure_1();
select * from test1 order by c1 asc;
c1	c2
-10	1
-9	1
-8	1
-7	1
-6	1
-5	1
-4	1
-3	1
-2	1
-1	1
#function-10-1   存储过程=====> repeat循环
drop table test1;
drop procedure procedure_1;
create table test1(id int);
create procedure procedure_1()
begin
declare i int;
set i = is_uuid('6ccd780c-baba-1026-9564-5b8c656024db');
repeat
insert into test1 values (i);
set i = i + 1;
until i > 10 end repeat;
end;
/
call procedure_1();
SELECT * from test1 order by id asc;
id
1
2
3
4
5
6
7
8
9
10
drop table test1;
create table test1(id int);
drop procedure procedure_1;
create procedure procedure_1()
begin
declare i int;
set i = 1;
repeat
insert into test1 values (is_uuid('6ccd780c-baba-1026-9564-5b8c656024db'));
set i = i + 1;
until i > 10 end repeat;
end;
/
call procedure_1();
SELECT * from test1 order by id asc;
id
1
1
1
1
1
1
1
1
1
1
drop table test1;
create table test1(id int);
drop procedure procedure_1;
create procedure procedure_1()
begin
declare i int;
set i = is_uuid('6ccd780c-baba-1026-9564-5b8c656024db');
repeat
insert into test1 values (is_uuid('-0120..24512443212421.21324213'));
set i = i + 1;
until i > 10 end repeat;
end;
/
call procedure_1();
SELECT * from test1 order by id asc;
id
0
0
0
0
0
0
0
0
0
0
#function-10-1   存储过程=====> loop循环
drop table test1;
drop procedure procedure_1;
create table test1(id int(5));
create procedure procedure_1()
begin
declare i int;
set i = 1;
lp : loop
insert into test1 values (is_uuid('6ccd780c-baba-1026-9564-5b8c656024db')+is_uuid('-0120..24512443212421.21324213'));
set i = i + 1;
if i > 101 then
leave lp;
end if;
end loop;
select * from test1 order by id asc;
end;
/
call procedure_1();
id
1
1
1
1
1
1
1
1
1
1
1
1
1
1
1
1
1
1
1
1
1
1
1
1
1
1
1
1
1
1
1
1
1
1
1
1
1
1
1
1
1
1
1
1
1
1
1
1
1
1
1
1
1
1
1
1
1
1
1
1
1
1
1
1
1
1
1
1
1
1
1
1
1
1
1
1
1
1
1
1
1
1
1
1
1
1
1
1
1
1
1
1
1
1
1
1
1
1
1
1
1
#function-10-1   存储过程=====>if条件
drop table test1;
drop procedure procedure_1;
create procedure procedure_1(aa int,bb int)
begin
if aa = bb then
select is_uuid('6ccd780c-baba-1026-9564-5b8c656024db');
elseif aa > bb then
select is_uuid('-0120..24512443212421.21324213');
else
select is_uuid('6ccd780c-baba-1026-9564-5b8c656024db')*2+is_uuid('-0120..24512443212421.21324213');
end if;
end;
/
call procedure_1(1,3);
is_uuid('6ccd780c-baba-1026-9564-5b8c656024db')*2+is_uuid('-0120..24512443212421.21324213')
2
call procedure_1(2,2);
is_uuid('6ccd780c-baba-1026-9564-5b8c656024db')
1
call procedure_1(3,1);
is_uuid('-0120..24512443212421.21324213')
0
drop procedure procedure_1;
#function-10-2   函数=====>while循环
drop table test1;
create table test1(id int,h1 bigint);
insert into test1 values(1,2);
insert into test1 values(2,3);
select * from test1 order by id asc;
id	h1
1	2
2	3
drop FUNCTION FUNCTION_1;
CREATE FUNCTION FUNCTION_1() RETURNS int
BEGIN
DECLARE v1 decimal(20,1) DEFAULT 1;
WHILE v1<30 DO
UPDATE test1 SET h1=is_uuid('6ccd780c-baba-1026-9564-5b8c656024db')+9;
SET v1=v1+5;
END WHILE;
RETURN v1;
END;
/
select function_1();
function_1()
31
select * from test1 order by id asc;
id	h1
1	10
2	10
#function-10-2   函数=====>repeat循环
drop table test1;
drop FUNCTION FUNCTION_1;
create table test1(id int,h1 bigint);
insert into test1 values(1,2);
insert into test1 values(2,3);
select * from test1 order by id asc;
id	h1
1	2
2	3
CREATE FUNCTION function_1() RETURNS int
begin
declare i int;
set i = 1;
repeat
update test1 set h1=h1+10;
set i = i + is_uuid('6ccd780c-baba-1026-9564-5b8c656024db');
until i > 50 end repeat;
RETURN i;
end;
/
select function_1();
function_1()
51
select * from test1 order by id asc;
id	h1
1	502
2	503
#function-10-2   函数=====>loop循环
drop table test1;
drop FUNCTION FUNCTION_1;
create table test1(id int,h1 bigint);
insert into test1 values(1,2);
insert into test1 values(2,3);
select * from test1 order by id asc;
id	h1
1	2
2	3
CREATE FUNCTION function_1() RETURNS int
BEGIN
DECLARE i int DEFAULT 1;
loop1:LOOP
IF i<10 THEN
UPDATE test1 SET h1=h1+is_uuid('6ccd780c-baba-1026-9564-5b8c656024db')-is_uuid('-0120..24512443212421.21324213');
LEAVE loop1;
END IF;
SET i = i+6;
END LOOP;
RETURN i;
END;
/
select function_1();
function_1()
1
select * from test1 order by id asc;
id	h1
1	3
2	4
drop FUNCTION FUNCTION_1;
drop table test1;
#function-10-3     触发器
drop table test1;
drop table test2;
drop TRIGGER TRIGGER_1;
create table test1(c1 int,c2 bigint);
create table test2(c1 int,c2 bigint,c3 FLOAT);
insert into test1 values(100,99);
insert into test1 values(-30,null);
insert into test1 values(0,100);
insert into test2 values(1,2,3);
select * from test1 order by c1 asc;
c1	c2
-30	NULL
0	100
100	99
select * from test2 order by c1 asc;
c1	c2	c3
1	2	3
CREATE TRIGGER TRIGGER_1 BEFORE INSERT ON test1
FOR EACH ROW
BEGIN
insert into test2 values(is_uuid('6ccd780c-baba-1026-9564-5b8c656024db'),is_uuid('-0120..24512443212421.21324213'),is_uuid('-0120..24512443212421.21324213')*is_uuid('6ccd780c-baba-1026-9564-5b8c656024db')+is_uuid('6ccd780c-baba-1026-9564-5b8c656024db'));
END
/
insert into test1 values(50,50);
select * from test1 order by c1 asc;
c1	c2
-30	NULL
0	100
50	50
100	99
select * from test2 order by c1 asc;
c1	c2	c3
1	2	3
1	0	1
drop TRIGGER TRIGGER_1;
CREATE TRIGGER TRIGGER_1 AFTER update ON test1
FOR EACH ROW
BEGIN
UPDATE test2 set c2=is_uuid('6ccd780c-baba-1026-9564-5b8c656024db'),c3=is_uuid('-0120..24512443212421.21324213') where c1=1;
END
/
UPDATE test1 set c1=20 where c1=0;
select * from test1 order by c1 asc;
c1	c2
-30	NULL
20	100
50	50
100	99
select * from test2 order by c1 asc;
c1	c2	c3
1	1	0
1	1	0
UPDATE test2 set c1=4,c3=5,c2=6 where c1=1 LIMIT 1;
select * from test2 order by c1 asc;
c1	c2	c3
1	1	0
4	6	5
drop TRIGGER TRIGGER_1;
CREATE TRIGGER TRIGGER_1 AFTER DELETE ON test1
FOR EACH ROW
BEGIN
delete from test2 where c1=is_uuid('6ccd780c-baba-1026-9564-5b8c656024db') and c3=is_uuid('-0120..24512443212421.21324213');
END
/
DELETE from test1 where c1=20;
select * from test2 order by c1 asc;
c1	c2	c3
4	6	5
select * from test1 order by c1 asc;
c1	c2
-30	NULL
50	50
100	99
drop TRIGGER TRIGGER_1;
drop table test2;
drop table test1;
# Clean up users
drop user hjw@'%' ;
