#Environmental cleaning
drop user hjw@'%';
create user hjw identified by 'hjw';
grant all on *.* to hjw WITH GRANT OPTION;
#function-5     dml语句
#function-6     视图
#function-7     索引
#function-5-1    insert语句
#function-5-1-1    数值类型
drop table test1;
create table test1(c1 int,c2 bigint,c3 FLOAT);
insert into test1 values(is_uuid(''),is_uuid('6ccd780c-baba-1026-9564-5b8c656024db'),is_uuid('6ccd780cbaba102695645b8c656024db'));
insert into test1 values(is_uuid('{6ccd780c-baba-1026-9564-5b8c656024db}'),
is_uuid('6ccd780c-baba-1026-9564-5b8c6560'),is_uuid('6ccd780c-baba-1026-9564-5b8c656024db'));
select * from test1 order by c1 asc;
c1	c2	c3
0	1	1
1	0	1
insert into test1 values(is_uuid(''),is_uuid('15641234640237415357412564'),is_uuid('2144321063754120369526560'));
insert into test1 values(is_uuid('nulls'),is_uuid('null'),is_uuid('is_uuid()'));
select * from test1 order by c1 asc;
c1	c2	c3
0	1	1
0	0	0
0	0	0
1	0	1
insert into test1 values(is_uuid(is_uuid('acvsfw')),is_uuid(is_uuid('023453202145.21')),is_uuid('is_uuid(-5456437451265.5)'));
select * from test1 order by c1 asc;
c1	c2	c3
0	1	1
0	0	0
0	0	0
0	0	0
1	0	1
insert into test1 values((select is_uuid('acvsfw')),(select is_uuid(uuid())),(select is_uuid('6ccd780c-baba-1026-9564-5b8c656024db')));
insert into test1 values((select is_uuid('15641234640237415357412564')),(select is_uuid(uuid())),(select is_uuid('6ccd780c-baba-1026-9564-5b8c656024db')));
select * from test1 order by c1 asc;
c1	c2	c3
0	1	1
0	0	0
0	0	0
0	0	0
0	1	1
0	1	1
1	0	1
insert into test1 select * from test1 where c1=(select is_uuid('acvsfw'))LIMIT 1;
select * from test1 order by c1 asc;
c1	c2	c3
0	1	1
0	0	0
0	0	0
0	0	0
0	1	1
0	1	1
0	1	1
1	0	1
insert into test1 select * from test1 where c1=(select is_uuid('6ccd780c-baba-1026-9564-5b8c656024db'))LIMIT 1;
select * from test1 order by c1 asc;
c1	c2	c3
0	1	1
0	0	0
0	0	0
0	0	0
0	1	1
0	1	1
0	1	1
1	0	1
1	0	1
insert into test1 select * from test1 where c1=(select is_uuid('6ccd780c-baba-1026-9564-5b8c656024db')) and c2=(select is_uuid('6ccd780c-baba-1026-9564-5b8c656024db')) LIMIT 1 ;
insert into test1 select * from test1 where c1=(select is_uuid('6ccd780c-baba-1026-9564-5b8c656024db')) or c2=(select is_uuid('6ccd780c-baba-1026-9564-5b8c656024db')) LIMIT 1 ;
select * from test1 order by c1 asc;
c1	c2	c3
0	1	1
0	0	0
0	0	0
0	0	0
0	1	1
0	1	1
0	1	1
0	1	1
1	0	1
1	0	1
insert into test1 select * from test1 where c1=(select is_uuid('6ccd780c-baba-1026-9564-5b8c656024db')) + c2=(select is_uuid('6ccd780c-baba-1026-9564-5b8c656024db')) LIMIT 1 ;
select * from test1 order by c1 asc;
c1	c2	c3
0	1	1
0	0	0
0	0	0
0	0	0
0	1	1
0	1	1
0	1	1
0	1	1
1	0	1
1	0	1
1	0	1
insert into test1 select * from test1 where c1=(select is_uuid('6ccd780c-baba-1026-9564-5b8c656024db')) - c2=(select is_uuid('6ccd780c-baba-1026-9564-5b8c656024db')) LIMIT 1 ;
insert into test1 select * from test1 where c1=(select is_uuid('6ccd780c-baba-1026-9564-5b8c656024db')) * c2=(select is_uuid('6ccd780c-baba-1026-9564-5b8c656024db')) LIMIT 1 ;
insert into test1 select * from test1 where c1=(select is_uuid('6ccd780c-baba-1026-9564-5b8c656024db')) / c2=(select is_uuid('6ccd780c-baba-1026-9564-5b8c656024db')) LIMIT 1 ;
insert into test1 select * from test1 where c1=(select is_uuid('6ccd780c-baba-1026-9564-5b8c656024db')) / c2=(select is_uuid('6ccd780c-baba-1026-9564-5b8c656024db')) LIMIT 1 ;
insert into test1 select * from test1 where is_uuid()=(select is_uuid('6ccd780c-baba-1026-9564-5b8c656024db'));
insert into test1 select * from test1 where is_uuid('6ccd780c-baba-1026-9564-5b8c656024db')=(select is_uuid('6ccd780c-baba-1026-9564-5b8c656024db'));
insert into test1 select * from test1 where (select is_uuid(''))=(select is_uuid('6ccd780c-baba-1026-9564-5b8c656024db'));
#function-5-1-2    字符类型
drop table test1;
create table test1(c1 char(20),c2 char(20),c3 char(20));
insert into test1 values(is_uuid(''),is_uuid('6ccd780c-baba-1026-9564-5b8c656024db'),is_uuid('6ccd780cbaba102695645b8c656024db'));
insert into test1 values(is_uuid('{6ccd780c-baba-1026-9564-5b8c656024db}'),
is_uuid('6ccd780c-baba-1026-9564-5b8c6560'),is_uuid('6ccd780c-baba-1026-9564-5b8c656024db'));
select * from test1 order by c1 asc;
c1	c2	c3
0	1	1
1	0	1
insert into test1 values(is_uuid(''),is_uuid('15641234640237415357412564'),is_uuid('2144321063754120369526560'));
insert into test1 values(is_uuid('nulls'),is_uuid('null'),is_uuid('is_uuid()'));
select * from test1 order by c1 asc;
c1	c2	c3
0	1	1
0	0	0
0	0	0
1	0	1
insert into test1 values(is_uuid(is_uuid('acvsfw')),is_uuid(is_uuid('023453202145.21')),is_uuid('is_uuid(-5456437451265.5)'));
select * from test1 order by c1 asc;
c1	c2	c3
0	1	1
0	0	0
0	0	0
0	0	0
1	0	1
insert into test1 values((select is_uuid('acvsfw')),(select is_uuid(uuid())),(select is_uuid('6ccd780c-baba-1026-9564-5b8c656024db')));
insert into test1 values((select is_uuid('15641234640237415357412564')),(select is_uuid(uuid())),(select is_uuid('6ccd780c-baba-1026-9564-5b8c656024db')));
select * from test1 order by c1 asc;
c1	c2	c3
0	1	1
0	0	0
0	0	0
0	0	0
0	1	1
0	1	1
1	0	1
insert into test1 select * from test1 where c1=(select is_uuid('acvsfw'))LIMIT 1;
select * from test1 order by c1 asc;
c1	c2	c3
0	1	1
0	0	0
0	0	0
0	0	0
0	1	1
0	1	1
0	1	1
1	0	1
insert into test1 select * from test1 where c1=(select is_uuid('6ccd780c-baba-1026-9564-5b8c656024db'))LIMIT 1;
select * from test1 order by c1 asc;
c1	c2	c3
0	1	1
0	0	0
0	0	0
0	0	0
0	1	1
0	1	1
0	1	1
1	0	1
1	0	1
insert into test1 select * from test1 where c1=(select is_uuid('6ccd780c-baba-1026-9564-5b8c656024db')) and c2=(select is_uuid('6ccd780c-baba-1026-9564-5b8c656024db')) LIMIT 1 ;
insert into test1 select * from test1 where c1=(select is_uuid('6ccd780c-baba-1026-9564-5b8c656024db')) or c2=(select is_uuid('6ccd780c-baba-1026-9564-5b8c656024db')) LIMIT 1 ;
select * from test1 order by c1 asc;
c1	c2	c3
0	1	1
0	0	0
0	0	0
0	0	0
0	1	1
0	1	1
0	1	1
0	1	1
1	0	1
1	0	1
insert into test1 select * from test1 where c1=(select is_uuid('6ccd780c-baba-1026-9564-5b8c656024db')) + c2=(select is_uuid('6ccd780c-baba-1026-9564-5b8c656024db')) LIMIT 1 ;
select * from test1 order by c1 asc;
c1	c2	c3
0	1	1
0	0	0
0	0	0
0	0	0
0	1	1
0	1	1
0	1	1
0	1	1
1	0	1
1	0	1
1	0	1
insert into test1 select * from test1 where c1=(select is_uuid('6ccd780c-baba-1026-9564-5b8c656024db')) - c2=(select is_uuid('6ccd780c-baba-1026-9564-5b8c656024db')) LIMIT 1 ;
insert into test1 select * from test1 where c1=(select is_uuid('6ccd780c-baba-1026-9564-5b8c656024db')) * c2=(select is_uuid('6ccd780c-baba-1026-9564-5b8c656024db')) LIMIT 1 ;
insert into test1 select * from test1 where c1=(select is_uuid('6ccd780c-baba-1026-9564-5b8c656024db')) / c2=(select is_uuid('6ccd780c-baba-1026-9564-5b8c656024db')) LIMIT 1 ;
insert into test1 select * from test1 where c1=(select is_uuid('6ccd780c-baba-1026-9564-5b8c656024db')) / c2=(select is_uuid('6ccd780c-baba-1026-9564-5b8c656024db')) LIMIT 1 ;
insert into test1 select * from test1 where is_uuid()=(select is_uuid('6ccd780c-baba-1026-9564-5b8c656024db'));
insert into test1 select * from test1 where is_uuid('6ccd780c-baba-1026-9564-5b8c656024db')=(select is_uuid('6ccd780c-baba-1026-9564-5b8c656024db'));
insert into test1 select * from test1 where (select is_uuid(''))=(select is_uuid('6ccd780c-baba-1026-9564-5b8c656024db'));
select * from test1 order by c1 asc;
c1	c2	c3
0	1	1
0	0	0
0	0	0
0	0	0
0	0	0
0	1	1
0	1	1
0	1	1
0	1	1
0	1	1
0	1	1
0	1	1
0	0	0
0	1	1
0	1	1
0	0	0
0	0	0
0	0	0
0	1	1
0	1	1
1	0	1
1	0	1
1	0	1
1	0	1
1	0	1
1	0	1
#function-5-1-3    时间日期类型
drop table test1;
create table test1(c1 date,c2 time,c3 year);
insert into test1 values(is_uuid(''),is_uuid('6ccd780c-baba-1026-9564-5b8c656024db'),is_uuid('6ccd780cbaba102695645b8c656024db'));
insert into test1 values(is_uuid('{6ccd780c-baba-1026-9564-5b8c656024db}'),
is_uuid('6ccd780c-baba-1026-9564-5b8c6560'),is_uuid('6ccd780c-baba-1026-9564-5b8c656024db'));
select * from test1 order by c1 asc;
c1	c2	c3
0000-00-00	00:00:01	2001
insert into test1 values(is_uuid(''),is_uuid('15641234640237415357412564'),is_uuid('2144321063754120369526560'));
insert into test1 values(is_uuid('nulls'),is_uuid('null'),is_uuid('is_uuid()'));
select * from test1 order by c1 asc;
c1	c2	c3
0000-00-00	00:00:01	2001
0000-00-00	00:00:00	0000
0000-00-00	00:00:00	0000
insert into test1 values(is_uuid(is_uuid('acvsfw')),is_uuid(is_uuid('023453202145.21')),is_uuid('is_uuid(-5456437451265.5)'));
select * from test1 order by c1 asc;
c1	c2	c3
0000-00-00	00:00:01	2001
0000-00-00	00:00:00	0000
0000-00-00	00:00:00	0000
0000-00-00	00:00:00	0000
insert into test1 values((select is_uuid('acvsfw')),(select is_uuid(uuid())),(select is_uuid('6ccd780c-baba-1026-9564-5b8c656024db')));
insert into test1 values((select is_uuid('15641234640237415357412564')),(select is_uuid(uuid())),(select is_uuid('6ccd780c-baba-1026-9564-5b8c656024db')));
select * from test1 order by c1 asc;
c1	c2	c3
0000-00-00	00:00:01	2001
0000-00-00	00:00:00	0000
0000-00-00	00:00:00	0000
0000-00-00	00:00:00	0000
0000-00-00	00:00:01	2001
0000-00-00	00:00:01	2001
insert into test1 select * from test1 where c1=(select is_uuid('acvsfw'))LIMIT 1;
select * from test1 order by c1 asc;
c1	c2	c3
0000-00-00	00:00:01	2001
0000-00-00	00:00:00	0000
0000-00-00	00:00:00	0000
0000-00-00	00:00:00	0000
0000-00-00	00:00:01	2001
0000-00-00	00:00:01	2001
0000-00-00	00:00:01	2001
insert into test1 select * from test1 where c1=(select is_uuid('6ccd780c-baba-1026-9564-5b8c656024db'))LIMIT 1;
select * from test1 order by c1 asc;
c1	c2	c3
0000-00-00	00:00:01	2001
0000-00-00	00:00:00	0000
0000-00-00	00:00:00	0000
0000-00-00	00:00:00	0000
0000-00-00	00:00:01	2001
0000-00-00	00:00:01	2001
0000-00-00	00:00:01	2001
0000-00-00	00:00:01	2001
insert into test1 select * from test1 where c1=(select is_uuid('6ccd780c-baba-1026-9564-5b8c656024db')) and c2=(select is_uuid('6ccd780c-baba-1026-9564-5b8c656024db')) LIMIT 1 ;
insert into test1 select * from test1 where c1=(select is_uuid('6ccd780c-baba-1026-9564-5b8c656024db')) or c2=(select is_uuid('6ccd780c-baba-1026-9564-5b8c656024db')) LIMIT 1 ;
select * from test1 order by c1 asc;
c1	c2	c3
0000-00-00	00:00:01	2001
0000-00-00	00:00:00	0000
0000-00-00	00:00:00	0000
0000-00-00	00:00:00	0000
0000-00-00	00:00:01	2001
0000-00-00	00:00:01	2001
0000-00-00	00:00:01	2001
0000-00-00	00:00:01	2001
0000-00-00	00:00:01	2001
0000-00-00	00:00:01	2001
insert into test1 select * from test1 where c1=(select is_uuid('6ccd780c-baba-1026-9564-5b8c656024db')) + c2=(select is_uuid('6ccd780c-baba-1026-9564-5b8c656024db')) LIMIT 1 ;
select * from test1 order by c1 asc;
c1	c2	c3
0000-00-00	00:00:01	2001
0000-00-00	00:00:00	0000
0000-00-00	00:00:00	0000
0000-00-00	00:00:00	0000
0000-00-00	00:00:01	2001
0000-00-00	00:00:01	2001
0000-00-00	00:00:01	2001
0000-00-00	00:00:01	2001
0000-00-00	00:00:01	2001
0000-00-00	00:00:01	2001
0000-00-00	00:00:01	2001
insert into test1 select * from test1 where c1=(select is_uuid('6ccd780c-baba-1026-9564-5b8c656024db')) - c2=(select is_uuid('6ccd780c-baba-1026-9564-5b8c656024db')) LIMIT 1 ;
insert into test1 select * from test1 where c1=(select is_uuid('6ccd780c-baba-1026-9564-5b8c656024db')) * c2=(select is_uuid('6ccd780c-baba-1026-9564-5b8c656024db')) LIMIT 1 ;
insert into test1 select * from test1 where c1=(select is_uuid('6ccd780c-baba-1026-9564-5b8c656024db')) / c2=(select is_uuid('6ccd780c-baba-1026-9564-5b8c656024db')) LIMIT 1 ;
insert into test1 select * from test1 where c1=(select is_uuid('6ccd780c-baba-1026-9564-5b8c656024db')) / c2=(select is_uuid('6ccd780c-baba-1026-9564-5b8c656024db')) LIMIT 1 ;
insert into test1 select * from test1 where is_uuid()=(select is_uuid('6ccd780c-baba-1026-9564-5b8c656024db'));
insert into test1 select * from test1 where is_uuid('6ccd780c-baba-1026-9564-5b8c656024db')=(select is_uuid('6ccd780c-baba-1026-9564-5b8c656024db'));
insert into test1 select * from test1 where (select is_uuid(''))=(select is_uuid('6ccd780c-baba-1026-9564-5b8c656024db'));
#function-5-1-4    json类型
drop table test1;
create table test1(c1 json,c2 json,c3 json);
insert into test1 values(is_uuid(''),is_uuid('6ccd780c-baba-1026-9564-5b8c656024db'),is_uuid('6ccd780cbaba102695645b8c656024db'));
insert into test1 values(is_uuid('{6ccd780c-baba-1026-9564-5b8c656024db}'),
is_uuid('6ccd780c-baba-1026-9564-5b8c6560'),is_uuid('6ccd780c-baba-1026-9564-5b8c656024db'));
select * from test1 order by c1 asc;
c1	c2	c3
insert into test1 select * from test1 where c1=(select is_uuid('acvsfw'))LIMIT 1;
select * from test1 order by c1 asc;
c1	c2	c3
insert into test1 select * from test1 where c1=(select is_uuid('6ccd780c-baba-1026-9564-5b8c656024db'))LIMIT 1;
select * from test1 order by c1 asc;
c1	c2	c3
insert into test1 select * from test1 where c1=(select is_uuid('6ccd780c-baba-1026-9564-5b8c656024db')) and c2=(select is_uuid('6ccd780c-baba-1026-9564-5b8c656024db')) LIMIT 1 ;
insert into test1 select * from test1 where c1=(select is_uuid('6ccd780c-baba-1026-9564-5b8c656024db')) or c2=(select is_uuid('6ccd780c-baba-1026-9564-5b8c656024db')) LIMIT 1 ;
select * from test1 order by c1 asc;
c1	c2	c3
insert into test1 values((select is_uuid('{"a": 1, "b": 2, "c": [3, 4, 5]}')),(select is_uuid('{"a":100}')),(select is_uuid('id', 87, 'name', 'carrot', 100)));
select * from test1 order by c1 asc;
c1	c2	c3
insert into test1 values(('{"a": 1, "b": 2, "c": [3, 4, 5]}'),('{"a":100}'),JSON_ARRAY(1, "abc", NULL, TRUE));
select * from test1 order by c1 asc;
c1	c2	c3
{"a": 1, "b": 2, "c": [3, 4, 5]}	{"a": 100}	[1, "abc", null, true]
insert into test1 select * from test1 where c1=(select is_uuid('6ccd780c-baba-1026-9564-5b8c656024db')) and c2=(select is_uuid('6ccd780c-baba-1026-9564-5b8c656024db')) LIMIT 1 ;
insert into test1 values(is_uuid('{"a": 1, "b": 2, "c": [3, 4, 5]}'),is_uuid('{"a":100}'),is_uuid(JSON_ARRAY(1, "abc", NULL, TRUE)));
insert into test1 values(('{"a": 1, "b": 2, "c": [3, 4, 5]}'),('{"a":100}'),JSON_ARRAY(1, "abc", NULL, TRUE));
insert into test1 values(cast(is_uuid('{"a": 1, "b": 2, "c": [3, 4, 5]}') as json),cast(is_uuid('{"a":100}') as json),cast(is_uuid(JSON_ARRAY(1, "abc", NULL, TRUE))as json));
insert into test1 values(cast(is_uuid('21354120.34123654103') as json),cast(is_uuid('-1013541203451') as json),cast(is_uuid(1567412874+7801535144)as json));
select * from test1 order by c1 asc;
c1	c2	c3
{"a": 1, "b": 2, "c": [3, 4, 5]}	{"a": 100}	[1, "abc", null, true]
{"a": 1, "b": 2, "c": [3, 4, 5]}	{"a": 100}	[1, "abc", null, true]
false	false	false
false	false	false
#function-5-2    select语句
drop table test1;
create table test1(c1 int,c2 bigint,c3 FLOAT);
insert into test1 values(0,0,0);
insert into test1 values(1,1,1);
insert into test1 values(0,0,1);
insert into test1 values(0,1,1);
insert into test1 values(1,0,0);
insert into test1 values(1,1,0);
select * from test1 order by c1 asc;
c1	c2	c3
0	0	0
0	0	1
0	1	1
1	1	1
1	0	0
1	1	0
select * from test1 where c1= is_uuid('6ccd780c-baba-1026-9564-5b8c656024db') LIMIT 1;
c1	c2	c3
1	1	1
select * from test1 where c1= is_uuid('6ccd780c-baba-1026-9564-5b8c656024db')+is_uuid('u海军第三部分我不懂给') LIMIT 1;
c1	c2	c3
1	1	1
select * from test1 where c1= is_uuid('6ccd780c-baba-1026-9564-5b8c656024db')-is_uuid('u海军第三部分我不懂给') LIMIT 1;
c1	c2	c3
1	1	1
select * from test1 where c1= is_uuid('6ccd780c-baba-1026-9564-5b8c656024db')-is_uuid('6ccd780c-baba-1026-9564-5b8c656024db') LIMIT 1;
c1	c2	c3
0	0	0
select * from test1 where c1= is_uuid('6ccd780c-baba-1026-9564-5b8c656024db')*is_uuid('u海军第三部分我不懂给') LIMIT 1;
c1	c2	c3
0	0	0
select * from test1 where c1= is_uuid('6ccd780c-baba-1026-9564-5b8c656024db')/is_uuid('u海军第三部分我不懂给') LIMIT 1;
c1	c2	c3
select * from test1 where c1=is_uuid(is_uuid('6ccd780c-baba-1026-9564-5b8c656024db')+is_uuid('u海军第三部分我不懂给')) LIMIT 1;
c1	c2	c3
0	0	0
select * from test1 where c1=is_uuid(log(is_uuid('6ccd780c-baba-1026-9564-5b8c656024db')+is_uuid('u海军第三部分我不懂给'))) LIMIT 1;
c1	c2	c3
0	0	0
select * from test1 where c1=is_uuid(log(is_uuid('6ccd780c-baba-1026-9564-5b8c656024db-is_uuid(u海军第三部分我不懂给)'))) LIMIT 1;
c1	c2	c3
Warnings:
Warning	3020	Invalid argument for logarithm
select * from test1 where c1= is_uuid('6ccd780c-baba-1026-9564-5b8c656024db') and c2 = is_uuid('6ccd780c-baba-1026-9564-5b8c656024db') LIMIT 1;
c1	c2	c3
1	1	1
select * from test1 where c1= is_uuid('6ccd780c-baba-1026-9564-5b8c656024db') or c2 = is_uuid('-0.5454541545120237354120364210') LIMIT 1;
c1	c2	c3
0	0	0
select * from test1 where c1= is_uuid('6ccd780c-baba-1026-9564-5b8c656024db') and c2 = is_uuid('-0.5454541545120237354120364210') LIMIT 1;
c1	c2	c3
1	0	0
select * from test1 where is_uuid()= is_uuid('6ccd780c-baba-1026-9564-5b8c656024db') LIMIT 1;
select * from test1 where is_uuid('')= is_uuid('6ccd780c-baba-1026-9564-5b8c656024db') LIMIT 1;
c1	c2	c3
select * from test1 where is_uuid('6ccd780c-baba-1026-9564-5b8c656024db')= is_uuid('6ccd780c-baba-1026-9564-5b8c656024db') LIMIT 1;
c1	c2	c3
0	0	0
select * from test1 where is_uuid('6ccd780c-baba-1026-9564-5b8c656024db')= is_uuid('6ccd780c-baba-1026-9564-5b8c656024db')
and c2 = is_uuid('6ccd780c-baba-1026-9564-5b8c656024db') LIMIT 1;
c1	c2	c3
1	1	1
select * from test1 where is_uuid('6ccd780c-baba-1026-9564-5b8c656024db')= is_uuid('6ccd780c-baba-1026-9564-5b8c656024db')
or c2 = is_uuid('-0.5454541545120237354120364210') LIMIT 1;
c1	c2	c3
0	0	0
select * from test1 where is_uuid('6ccd780c-baba-1026-9564-5b8c656024db')= is_uuid('6ccd780c-baba-1026-9564-5b8c656024db')
or c2 = is_uuid('-0.5454541545120237354120364210') and c3 = is_uuid(-0.154561320765415641564)LIMIT 1;
c1	c2	c3
0	0	0
select * from test1 order by is_uuid('6ccd780c-baba-1026-9564-5b8c656024db') asc;
c1	c2	c3
0	0	0
1	1	1
0	0	1
0	1	1
1	0	0
1	1	0
select * from test1 order by is_uuid('6ccd780c-baba-1026-9564-5b8c656024db') desc;
c1	c2	c3
0	0	0
1	1	1
0	0	1
0	1	1
1	0	0
1	1	0
select * from test1 order by is_uuid('u海军第三部分我不懂给') desc;
c1	c2	c3
0	0	0
1	1	1
0	0	1
0	1	1
1	0	0
1	1	0
select * from test1 order by is_uuid('u海军第三部分我不懂给') asc;
c1	c2	c3
0	0	0
1	1	1
0	0	1
0	1	1
1	0	0
1	1	0
select is_uuid('u海军第三部分我不懂给') from test1 order by is_uuid('u海军第三部分我不懂给') asc;
is_uuid('u海军第三部分我不懂给')
0
0
0
0
0
0
select is_uuid('6ccd780c-baba-1026-9564-5b8c656024db') from test1 order by is_uuid('u海军第三部分我不懂给') asc;
is_uuid('6ccd780c-baba-1026-9564-5b8c656024db')
1
1
1
1
1
1
select * from test1 group by is_uuid('6ccd780c-baba-1026-9564-5b8c656024db') HAVING is_uuid('u海军第三部分我不懂给')>-2 order by c1 asc
;
c1	c2	c3
0	0	0
select * from test1 group by is_uuid('6ccd780c-baba-1026-9564-5b8c656024db') HAVING is_uuid('u海军第三部分我不懂给')<2 order by c1 asc;
c1	c2	c3
0	0	0
select * from test1 group by is_uuid('u海军第三部分我不懂给') HAVING is_uuid('u海军第三部分我不懂给')>-2 order by c1 asc;
c1	c2	c3
0	0	0
select * from test1 group by is_uuid('6ccd780c-baba-1026-9564-5b8c656024db') HAVING is_uuid('6ccd780c-baba-1026-9564-5b8c656024db')>-2 order by c1 asc;
c1	c2	c3
0	0	0
select * from test1 group by is_uuid('6ccd780c-baba-1026-9564-5b8c656024db') HAVING is_uuid('6ccd780c-baba-1026-9564-5b8c656024db')>is_uuid('u海军第三部分我不懂给') order by c1 asc;
c1	c2	c3
0	0	0
select * from test1 group by is_uuid('6ccd780c-baba-1026-9564-5b8c656024db') HAVING is_uuid('6ccd780c-baba-1026-9564-5b8c656024db')<is_uuid('u海军第三部分我不懂给') order by c1 asc;
c1	c2	c3
select * from test1 group by is_uuid('6ccd780c-baba-1026-9564-5b8c656024db') HAVING is_uuid('6ccd780c-baba-1026-9564-5b8c656024db')=is_uuid('u海军第三部分我不懂给') order by c1 asc;
c1	c2	c3
select * from test1 group by is_uuid('6ccd780c-baba-1026-9564-5b8c656024db') HAVING is_uuid('u海军第三部分我不懂给')=is_uuid('u海军第三部分我不懂给') order by c1 asc;
c1	c2	c3
0	0	0
select * from test1 group by is_uuid('6ccd780c-baba-1026-9564-5b8c656024db') HAVING is_uuid('u海军第三部分我不懂给')=is_uuid('u海军第三部分我不懂给') order by c1 asc;
c1	c2	c3
0	0	0
select CASE c1  WHEN 1 THEN '男'  WHEN 0 THEN '女'  ELSE '其他' END  from test1;
CASE c1  WHEN 1 THEN '男'  WHEN 0 THEN '女'  ELSE '其他' END
女
男
女
女
男
男
select CASE c1  WHEN is_uuid('6ccd780c-baba-1026-9564-5b8c656024db') THEN '男'  WHEN 0 THEN is_uuid('u海军第三部分我不懂给')  ELSE '其他' END  from test1 order by c1 asc;
CASE c1  WHEN is_uuid('6ccd780c-baba-1026-9564-5b8c656024db') THEN '男'  WHEN 0 THEN is_uuid('u海军第三部分我不懂给')  ELSE '其他' END
0
0
0
男
男
男
select CASE c1  WHEN is_uuid('6ccd780c-baba-1026-9564-5b8c656024db') THEN '男'  WHEN 0 THEN is_uuid('6ccd780c-baba-1026-9564-5b8c656024db')  ELSE '其他' END  from test1 order by c1 asc;
CASE c1  WHEN is_uuid('6ccd780c-baba-1026-9564-5b8c656024db') THEN '男'  WHEN 0 THEN is_uuid('6ccd780c-baba-1026-9564-5b8c656024db')  ELSE '其他' END
1
1
1
男
男
男
select CASE c1  WHEN is_uuid('u海军第三部分我不懂给') THEN '男'  WHEN 0 THEN is_uuid('u海军第三部分我不懂给')  ELSE '其他' END  from test1 order by c1 asc;
CASE c1  WHEN is_uuid('u海军第三部分我不懂给') THEN '男'  WHEN 0 THEN is_uuid('u海军第三部分我不懂给')  ELSE '其他' END
男
男
男
其他
其他
其他
select CASE c1  WHEN is_uuid('6ccd780c-baba-1026-9564-5b8c656024db') THEN is_uuid('u海军第三部分我不懂给')  WHEN is_uuid('u海军第三部分我不懂给') THEN is_uuid('6ccd780c-baba-1026-9564-5b8c656024db')  ELSE '其他' END  from test1 order by c1 asc;
CASE c1  WHEN is_uuid('6ccd780c-baba-1026-9564-5b8c656024db') THEN is_uuid('u海军第三部分我不懂给')  WHEN is_uuid('u海军第三部分我不懂给') THEN is_uuid('6ccd780c-baba-1026-9564-5b8c656024db')  ELSE '其他' END
1
1
1
0
0
0
select CASE is_uuid('6ccd780c-baba-1026-9564-5b8c656024db')  WHEN is_uuid('6ccd780c-baba-1026-9564-5b8c656024db') THEN is_uuid('u海军第三部分我不懂给')  WHEN is_uuid('u海军第三部分我不懂给') THEN is_uuid('6ccd780c-baba-1026-9564-5b8c656024db')  ELSE '其他' END  from test1 order by c1 asc;
CASE is_uuid('6ccd780c-baba-1026-9564-5b8c656024db')  WHEN is_uuid('6ccd780c-baba-1026-9564-5b8c656024db') THEN is_uuid('u海军第三部分我不懂给')  WHEN is_uuid('u海军第三部分我不懂给') THEN is_uuid('6ccd780c-baba-1026-9564-5b8c656024db'
0
0
0
0
0
0
select CASE is_uuid('6ccd780c-baba-1026-9564-5b8c656024db')  WHEN is_uuid('6ccd780c-baba-1026-9564-5b8c656024db') THEN is_uuid('u海军第三部分我不懂给')  WHEN is_uuid('u海军第三部分我不懂给') THEN is_uuid('6ccd780c-baba-1026-9564-5b8c656024db')  ELSE is_uuid('u海军第三部分我不懂给') END  from test1 order by c1 asc;
CASE is_uuid('6ccd780c-baba-1026-9564-5b8c656024db')  WHEN is_uuid('6ccd780c-baba-1026-9564-5b8c656024db') THEN is_uuid('u海军第三部分我不懂给')  WHEN is_uuid('u海军第三部分我不懂给') THEN is_uuid('6ccd780c-baba-1026-9564-5b8c656024db'
0
0
0
0
0
0
select CASE WHEN c1 = is_uuid('6ccd780c-baba-1026-9564-5b8c656024db') THEN '男' WHEN c2 = is_uuid('u海军第三部分我不懂给') THEN '女'  ELSE is_uuid('u海军第三部分我不懂给') END  from test1 order by c1 asc;
CASE WHEN c1 = is_uuid('6ccd780c-baba-1026-9564-5b8c656024db') THEN '男' WHEN c2 = is_uuid('u海军第三部分我不懂给') THEN '女'  ELSE is_uuid('u海军第三部分我不懂给') END
女
女
0
男
男
男
select CASE WHEN c1 = is_uuid('6ccd780c-baba-1026-9564-5b8c656024db') THEN '男' WHEN c2 = is_uuid('u海军第三部分我不懂给') THEN '女'  ELSE is_uuid('null') END  from test1 order by c1 asc;
CASE WHEN c1 = is_uuid('6ccd780c-baba-1026-9564-5b8c656024db') THEN '男' WHEN c2 = is_uuid('u海军第三部分我不懂给') THEN '女'  ELSE is_uuid('null') END
女
女
0
男
男
男
select CASE WHEN is_uuid('6ccd780c-baba-1026-9564-5b8c656024db') = '1' THEN '男' WHEN is_uuid('6ccd780c-baba-1026-9564-5b8c656024db') = '2' THEN '女' ELSE '其他' END from test1 order by c1 asc;
CASE WHEN is_uuid('6ccd780c-baba-1026-9564-5b8c656024db') = '1' THEN '男' WHEN is_uuid('6ccd780c-baba-1026-9564-5b8c656024db') = '2' THEN '女' ELSE '其他' END
男
男
男
男
男
男
select CASE WHEN is_uuid('u海军第三部分我不懂给') = '1' THEN '男' WHEN is_uuid('u海军第三部分我不懂给') = '2' THEN '女' ELSE '其他' END from test1 order by c1 asc;
CASE WHEN is_uuid('u海军第三部分我不懂给') = '1' THEN '男' WHEN is_uuid('u海军第三部分我不懂给') = '2' THEN '女' ELSE '其他' END
其他
其他
其他
其他
其他
其他
select CASE WHEN is_uuid('u海军第三部分我不懂给') = '1' THEN '男' WHEN is_uuid('u海军第三部分我不懂给') = '0' THEN '女' ELSE '其他' END from test1 order by c1 asc;
CASE WHEN is_uuid('u海军第三部分我不懂给') = '1' THEN '男' WHEN is_uuid('u海军第三部分我不懂给') = '0' THEN '女' ELSE '其他' END
女
女
女
女
女
女
select CASE WHEN is_uuid('u海军第三部分我不懂给')+is_uuid('6ccd780c-baba-1026-9564-5b8c656024db') = '1' THEN '男' WHEN is_uuid('u海军第三部分我不懂给') = '0' THEN '女' ELSE '其他' END from test1 order by c1 asc;
CASE WHEN is_uuid('u海军第三部分我不懂给')+is_uuid('6ccd780c-baba-1026-9564-5b8c656024db') = '1' THEN '男' WHEN is_uuid('u海军第三部分我不懂给') = '0' THEN '女' ELSE '其他' END
男
男
男
男
男
男
select CASE WHEN is_uuid('6ccd780c-baba-1026-9564-5b8c656024db')+is_uuid('6ccd780c-baba-1026-9564-5b8c656024db') = '1' THEN '男' WHEN is_uuid('u海军第三部分我不懂给') = '0' THEN '女' ELSE '其他' END from test1 order by c1 asc;
CASE WHEN is_uuid('6ccd780c-baba-1026-9564-5b8c656024db')+is_uuid('6ccd780c-baba-1026-9564-5b8c656024db') = '1' THEN '男' WHEN is_uuid('u海军第三部分我不懂给') = '0' THEN '女' ELSE '其他' END
女
女
女
女
女
女
select * from test1 where EXISTS(select c1 from test1 where c2=is_uuid('6ccd780c-baba-1026-9564-5b8c656024db')) order by c1 asc;
c1	c2	c3
0	0	0
0	0	1
0	1	1
1	1	1
1	0	0
1	1	0
select * from test1 where EXISTS(select c1 from test1 where c2=is_uuid('u海军第三部分我不懂给')) order by c1 asc;
c1	c2	c3
0	0	0
0	0	1
0	1	1
1	1	1
1	0	0
1	1	0
select * from test1 where EXISTS(select is_uuid('6ccd780c-baba-1026-9564-5b8c656024db') from test1 where c2=is_uuid('u海军第三部分我不懂给')) order by c1 asc;
c1	c2	c3
0	0	0
0	0	1
0	1	1
1	1	1
1	0	0
1	1	0
select * from test1 where EXISTS(select is_uuid('u海军第三部分我不懂给') from test1 where c2=is_uuid('6ccd780c-baba-1026-9564-5b8c656024db')) order by c1 asc;
c1	c2	c3
0	0	0
0	0	1
0	1	1
1	1	1
1	0	0
1	1	0
select * from test1 where not EXISTS(select c1 from test1 where c2=is_uuid('6ccd780c-baba-1026-9564-5b8c656024db')) order by c1 asc;
c1	c2	c3
select * from test1 where not EXISTS(select c1 from test1 where c2=is_uuid('u海军第三部分我不懂给')) order by c1 asc;
c1	c2	c3
select * from test1 where not EXISTS(select is_uuid('6ccd780c-baba-1026-9564-5b8c656024db') from test1 where c2=is_uuid('u海军第三部分我不懂给')) order by c1 asc;
c1	c2	c3
select * from test1 where not EXISTS(select is_uuid('u海军第三部分我不懂给') from test1 where c2=is_uuid('6ccd780c-baba-1026-9564-5b8c656024db')) order by c1 asc;
c1	c2	c3
select * from test1 where c1 in(is_uuid('6ccd780c-baba-1026-9564-5b8c656024db'),is_uuid('u海军第三部分我不懂给'),is_uuid('5443125741328765412'),is_uuid('-0.5443125741328765412')) order by c1 asc;
c1	c2	c3
0	0	0
0	0	1
0	1	1
1	1	1
1	0	0
1	1	0
select * from test1 where c1 not in(is_uuid('6ccd780c-baba-1026-9564-5b8c656024db'),is_uuid('u海军第三部分我不懂给'),is_uuid('5443125741328765412'),is_uuid('-0.5443125741328765412')) order by c1 asc;
c1	c2	c3
select * from test1 where c1=any(select c1 from test1 where c2=is_uuid('6ccd780c-baba-1026-9564-5b8c656024db') and c3=is_uuid('-0.5489541324852137') ) order by c1 asc;
c1	c2	c3
1	1	1
1	0	0
1	1	0
select * from test1 where c1>any(select c1 from test1 where c2=is_uuid('6ccd780c-baba-1026-9564-5b8c656024db') and c3=is_uuid('-0.5489541324852137') ) order by c1 asc;
c1	c2	c3
select * from test1 where c1<any(select c1 from test1 where c2=is_uuid('6ccd780c-baba-1026-9564-5b8c656024db') and c3=is_uuid('-0.5489541324852137') ) order by c1 asc;
c1	c2	c3
0	0	0
0	0	1
0	1	1
select * from test1 where c1=all(select c1 from test1 where c2=is_uuid('6ccd780c-baba-1026-9564-5b8c656024db') and c3=is_uuid('-0.5489541324852137') ) order by c1 asc;
c1	c2	c3
1	1	1
1	0	0
1	1	0
select * from test1 where c1>all(select c1 from test1 where c2=is_uuid('6ccd780c-baba-1026-9564-5b8c656024db') and c3=is_uuid('-0.5489541324852137') ) order by c1 asc;
c1	c2	c3
select * from test1 where c1<all(select c1 from test1 where c2=is_uuid('6ccd780c-baba-1026-9564-5b8c656024db') and c3=is_uuid('-0.5489541324852137') ) order by c1 asc;
c1	c2	c3
0	0	0
0	0	1
0	1	1
select * from test1 where c1 like '%(select c1 from test1 where c2=is_uuid(6ccd780c-baba-1026-9564-5b8c656024db) and c3=is_uuid(-0.5489541324852137))%' order by c1 asc;
c1	c2	c3
select * from test1 where c1 like '%is_uuid(6ccd780c-baba-1026-9564-5b8c656024db)%' order by c1 asc;
c1	c2	c3
select * from test1 where c1 like '%is_uuid(u海军第三部分我不懂给)%' order by c1 asc;
c1	c2	c3
select * from test1 where c1 like '%1%' order by c1 asc;
c1	c2	c3
1	1	1
1	0	0
1	1	0
select * from test1 where c1 like '%0%' order by c1 asc;
c1	c2	c3
0	0	0
0	0	1
0	1	1
select * from test1 where c1 like '%is_uuid(0) and is_uuid(6ccd780c-baba-1026-9564-5b8c656024db)%' order by c1 asc;
c1	c2	c3
#function-5-3    update语句
update test1 set c1=is_uuid('6ccd780c-baba-1026-9564-5b8c656024db')+is_uuid('6ccd780c-baba-1026-9564-5b8c656024db') where c1=is_uuid('u海军第三部分我不懂给');
select * from test1 order by c2 asc;
c1	c2	c3
2	0	0
2	0	1
1	0	0
1	1	1
2	1	1
1	1	0
update test1 set c1=is_uuid('6ccd780c-baba-1026-9564-5b8c656024db')-2*(is_uuid('6ccd780c-baba-1026-9564-5b8c656024db')) where c1=is_uuid('u海军第三部分我不懂给');
select * from test1 order by c2 asc;
c1	c2	c3
2	0	0
2	0	1
1	0	0
1	1	1
2	1	1
1	1	0
update test1 set c1=is_uuid('6ccd780c-baba-1026-9564-5b8c656024db'),c2=(is_uuid('6u海军第三部分我不懂给')) where c3=is_uuid('u海军第三部分我不懂给');
select * from test1 order by c2 asc;
c1	c2	c3
1	0	0
2	0	1
1	0	0
1	0	0
1	1	1
2	1	1
update test1 set c1=is_uuid('6ccd780c-baba-1026-9564-5b8c656024db'),c2=(is_uuid('6u海军第三部分我不懂给')) where c3=
(select c3 from test1 where c3=is_uuid('u海军第三部分我不懂给') LIMIT 1);
update test1 set c1=is_uuid('6ccd780c-baba-1026-9564-5b8c656024db'),c2=(is_uuid('6u海军第三部分我不懂给')) where c3=
(select c3 from test1 where c3=is_uuid('6ccd780c-baba-1026-9564-5b8c656024db') LIMIT 1);
#function-5-4    delete语句
delete from test1 where c3=is_uuid('u海军第三部分我不懂给') LIMIT 1;
select * from test1 order by c2 asc;
c1	c2	c3
1	0	1
1	0	1
1	0	1
1	0	0
1	0	0
delete from test1 where c3=is_uuid('6ccd780c-baba-1026-9564-5b8c656024db')  LIMIT 1;
select * from test1 order by c2 asc;
c1	c2	c3
1	0	1
1	0	1
1	0	0
1	0	0
delete from test1 where c3=is_uuid('6ccd780c-baba-1026-9564-5b8c656024db') and c2=is_uuid('6ccd780c-baba-1026-9564-5b8c656024db') and c1=is_uuid('6ccd780c-baba-1026-9564-5b8c656024db') LIMIT 1;
select * from test1 order by c2 asc;
c1	c2	c3
1	0	1
1	0	1
1	0	0
1	0	0
delete from test1 where c3=is_uuid('6ccd780c-baba-1026-9564-5b8c656024db') or c2=is_uuid('6ccd780c-baba-1026-9564-5b8c656024db') and c1=is_uuid('6ccd780c-baba-1026-9564-5b8c656024db') LIMIT 1;
select * from test1 order by c2 asc;
c1	c2	c3
1	0	1
1	0	0
1	0	0
delete from test1 where c3=is_uuid('6ccd780c-baba-1026-9564-5b8c656024db') or c2=is_uuid('6ccd780c-baba-1026-9564-5b8c656024db') or c1=is_uuid('6ccd780c-baba-1026-9564-5b8c656024db') LIMIT 1;
select * from test1 order by c2 asc;
c1	c2	c3
1	0	0
1	0	0
delete from test1 where c3=(select * from (select c3 from test1 where c3= is_uuid('6ccd780c-baba-1026-9564-5b8c656024db') or c2=is_uuid('6ccd780c-baba-1026-9564-5b8c656024db') or c1=is_uuid('6ccd780c-baba-1026-9564-5b8c656024db') LIMIT 1)as a) ;
#function-6     视图
#function-6     视图=====>insert
drop table test1;
drop view view_1;
create table test1(c1 int,c2 bigint,c3 FLOAT);
create view view_1 as select * from test1;
insert into view_1 values(is_uuid(''),is_uuid('6ccd780c-baba-1026-9564-5b8c656024db'),is_uuid('6ccd780cbaba102695645b8c656024db'));
insert into view_1 values(is_uuid('{6ccd780c-baba-1026-9564-5b8c656024db}'),
is_uuid('6ccd780c-baba-1026-9564-5b8c6560'),is_uuid('6ccd780c-baba-1026-9564-5b8c656024db'));
select * from view_1 order by c1 asc;
c1	c2	c3
0	1	1
1	0	1
insert into view_1 values(is_uuid(''),is_uuid('15641234640237415357412564'),is_uuid('2144321063754120369526560'));
insert into view_1 values(is_uuid('nulls'),is_uuid('null'),is_uuid('is_uuid()'));
select * from view_1 order by c1 asc;
c1	c2	c3
0	1	1
0	0	0
0	0	0
1	0	1
insert into view_1 values(is_uuid(is_uuid('acvsfw')),is_uuid(is_uuid('023453202145.21')),is_uuid('is_uuid(-5456437451265.5)'));
select * from view_1 order by c1 asc;
c1	c2	c3
0	1	1
0	0	0
0	0	0
0	0	0
1	0	1
insert into view_1 values((select is_uuid('acvsfw')),(select is_uuid(uuid())),(select is_uuid('6ccd780c-baba-1026-9564-5b8c656024db')));
insert into view_1 values((select is_uuid('15641234640237415357412564')),(select is_uuid(uuid())),(select is_uuid('6ccd780c-baba-1026-9564-5b8c656024db')));
select * from view_1 order by c1 asc;
c1	c2	c3
0	1	1
0	0	0
0	0	0
0	0	0
0	1	1
0	1	1
1	0	1
insert into view_1 select * from view_1 where c1=(select is_uuid('acvsfw'))LIMIT 1;
select * from view_1 order by c1 asc;
c1	c2	c3
0	1	1
0	0	0
0	0	0
0	0	0
0	1	1
0	1	1
0	1	1
1	0	1
insert into view_1 select * from view_1 where c1=(select is_uuid('6ccd780c-baba-1026-9564-5b8c656024db'))LIMIT 1;
select * from view_1 order by c1 asc;
c1	c2	c3
0	1	1
0	0	0
0	0	0
0	0	0
0	1	1
0	1	1
0	1	1
1	0	1
1	0	1
insert into view_1 select * from view_1 where c1=(select is_uuid('6ccd780c-baba-1026-9564-5b8c656024db')) and c2=(select is_uuid('6ccd780c-baba-1026-9564-5b8c656024db')) LIMIT 1 ;
insert into view_1 select * from view_1 where c1=(select is_uuid('6ccd780c-baba-1026-9564-5b8c656024db')) or c2=(select is_uuid('6ccd780c-baba-1026-9564-5b8c656024db')) LIMIT 1 ;
select * from view_1 order by c1 asc;
c1	c2	c3
0	1	1
0	0	0
0	0	0
0	0	0
0	1	1
0	1	1
0	1	1
0	1	1
1	0	1
1	0	1
insert into view_1 select * from view_1 where c1=(select is_uuid('6ccd780c-baba-1026-9564-5b8c656024db')) + c2=(select is_uuid('6ccd780c-baba-1026-9564-5b8c656024db')) LIMIT 1 ;
select * from view_1 order by c1 asc;
c1	c2	c3
0	1	1
0	0	0
0	0	0
0	0	0
0	1	1
0	1	1
0	1	1
0	1	1
1	0	1
1	0	1
1	0	1
insert into view_1 select * from view_1 where c1=(select is_uuid('6ccd780c-baba-1026-9564-5b8c656024db')) - c2=(select is_uuid('6ccd780c-baba-1026-9564-5b8c656024db')) LIMIT 1 ;
insert into view_1 select * from view_1 where c1=(select is_uuid('6ccd780c-baba-1026-9564-5b8c656024db')) * c2=(select is_uuid('6ccd780c-baba-1026-9564-5b8c656024db')) LIMIT 1 ;
insert into view_1 select * from view_1 where c1=(select is_uuid('6ccd780c-baba-1026-9564-5b8c656024db')) / c2=(select is_uuid('6ccd780c-baba-1026-9564-5b8c656024db')) LIMIT 1 ;
insert into view_1 select * from view_1 where c1=(select is_uuid('6ccd780c-baba-1026-9564-5b8c656024db')) / c2=(select is_uuid('6ccd780c-baba-1026-9564-5b8c656024db')) LIMIT 1 ;
insert into view_1 select * from view_1 where is_uuid()=(select is_uuid('6ccd780c-baba-1026-9564-5b8c656024db'));
insert into view_1 select * from view_1 where is_uuid('6ccd780c-baba-1026-9564-5b8c656024db')=(select is_uuid('6ccd780c-baba-1026-9564-5b8c656024db'));
insert into view_1 select * from view_1 where (select is_uuid(''))=(select is_uuid('6ccd780c-baba-1026-9564-5b8c656024db'));
select * from view_1 order by c1 asc;
c1	c2	c3
0	1	1
0	0	0
0	0	0
0	0	0
0	0	0
0	1	1
0	1	1
0	1	1
0	1	1
0	1	1
0	1	1
0	1	1
0	0	0
0	1	1
0	1	1
0	0	0
0	0	0
0	0	0
0	1	1
0	1	1
1	0	1
1	0	1
1	0	1
1	0	1
1	0	1
1	0	1
#function-6     视图=====>select
drop table test1;
drop view view_1;
create table test1(c1 int,c2 bigint,c3 FLOAT);
insert into test1 values(0,0,0);
insert into test1 values(1,1,1);
insert into test1 values(0,0,1);
insert into test1 values(0,1,1);
insert into test1 values(1,0,0);
insert into test1 values(1,1,0);
select * from test1 order by c1 asc;
c1	c2	c3
0	0	0
0	0	1
0	1	1
1	1	1
1	0	0
1	1	0
create view view_1 as select * from test1;
select * from view_1 where c1= is_uuid('6ccd780c-baba-1026-9564-5b8c656024db') LIMIT 1;
c1	c2	c3
1	1	1
select * from view_1 where c1= is_uuid('6ccd780c-baba-1026-9564-5b8c656024db')+is_uuid('u海军第三部分我不懂给') LIMIT 1;
c1	c2	c3
1	1	1
select * from view_1 where c1= is_uuid('6ccd780c-baba-1026-9564-5b8c656024db')-is_uuid('u海军第三部分我不懂给') LIMIT 1;
c1	c2	c3
1	1	1
select * from view_1 where c1= is_uuid('6ccd780c-baba-1026-9564-5b8c656024db')-is_uuid('6ccd780c-baba-1026-9564-5b8c656024db') LIMIT 1;
c1	c2	c3
0	0	0
select * from view_1 where c1= is_uuid('6ccd780c-baba-1026-9564-5b8c656024db')*is_uuid('u海军第三部分我不懂给') LIMIT 1;
c1	c2	c3
0	0	0
select * from view_1 where c1= is_uuid('6ccd780c-baba-1026-9564-5b8c656024db')/is_uuid('u海军第三部分我不懂给') LIMIT 1;
c1	c2	c3
select * from view_1 where c1=is_uuid(is_uuid('6ccd780c-baba-1026-9564-5b8c656024db')+is_uuid('u海军第三部分我不懂给')) LIMIT 1;
c1	c2	c3
0	0	0
select * from view_1 where c1=is_uuid(log(is_uuid('6ccd780c-baba-1026-9564-5b8c656024db')+is_uuid('u海军第三部分我不懂给'))) LIMIT 1;
c1	c2	c3
0	0	0
select * from view_1 where c1=is_uuid(log(is_uuid('6ccd780c-baba-1026-9564-5b8c656024db-is_uuid(u海军第三部分我不懂给)'))) LIMIT 1;
c1	c2	c3
Warnings:
Warning	3020	Invalid argument for logarithm
select * from view_1 where c1= is_uuid('6ccd780c-baba-1026-9564-5b8c656024db') and c2 = is_uuid('6ccd780c-baba-1026-9564-5b8c656024db') LIMIT 1;
c1	c2	c3
1	1	1
select * from view_1 where c1= is_uuid('6ccd780c-baba-1026-9564-5b8c656024db') or c2 = is_uuid('-0.5454541545120237354120364210') LIMIT 1;
c1	c2	c3
0	0	0
select * from view_1 where c1= is_uuid('6ccd780c-baba-1026-9564-5b8c656024db') and c2 = is_uuid('-0.5454541545120237354120364210') LIMIT 1;
c1	c2	c3
1	0	0
select * from view_1 where is_uuid()= is_uuid('6ccd780c-baba-1026-9564-5b8c656024db') LIMIT 1;
select * from view_1 where is_uuid('')= is_uuid('6ccd780c-baba-1026-9564-5b8c656024db') LIMIT 1;
c1	c2	c3
select * from view_1 where is_uuid('6ccd780c-baba-1026-9564-5b8c656024db')= is_uuid('6ccd780c-baba-1026-9564-5b8c656024db') LIMIT 1;
c1	c2	c3
0	0	0
select * from view_1 where is_uuid('6ccd780c-baba-1026-9564-5b8c656024db')= is_uuid('6ccd780c-baba-1026-9564-5b8c656024db')
and c2 = is_uuid('6ccd780c-baba-1026-9564-5b8c656024db') LIMIT 1;
c1	c2	c3
1	1	1
select * from view_1 where is_uuid('6ccd780c-baba-1026-9564-5b8c656024db')= is_uuid('6ccd780c-baba-1026-9564-5b8c656024db')
or c2 = is_uuid('-0.5454541545120237354120364210') LIMIT 1;
c1	c2	c3
0	0	0
select * from view_1 where is_uuid('6ccd780c-baba-1026-9564-5b8c656024db')= is_uuid('6ccd780c-baba-1026-9564-5b8c656024db')
or c2 = is_uuid('-0.5454541545120237354120364210') and c3 = is_uuid(-0.154561320765415641564)LIMIT 1;
c1	c2	c3
0	0	0
select * from view_1 order by is_uuid('6ccd780c-baba-1026-9564-5b8c656024db') asc;
c1	c2	c3
0	0	0
1	1	1
0	0	1
0	1	1
1	0	0
1	1	0
select * from view_1 order by is_uuid('6ccd780c-baba-1026-9564-5b8c656024db') desc;
c1	c2	c3
0	0	0
1	1	1
0	0	1
0	1	1
1	0	0
1	1	0
select * from view_1 order by is_uuid('u海军第三部分我不懂给') desc;
c1	c2	c3
0	0	0
1	1	1
0	0	1
0	1	1
1	0	0
1	1	0
select * from view_1 order by is_uuid('u海军第三部分我不懂给') asc;
c1	c2	c3
0	0	0
1	1	1
0	0	1
0	1	1
1	0	0
1	1	0
select is_uuid('u海军第三部分我不懂给') from view_1 order by is_uuid('u海军第三部分我不懂给') asc;
is_uuid('u海军第三部分我不懂给')
0
0
0
0
0
0
select is_uuid('6ccd780c-baba-1026-9564-5b8c656024db') from view_1 order by is_uuid('u海军第三部分我不懂给') asc;
is_uuid('6ccd780c-baba-1026-9564-5b8c656024db')
1
1
1
1
1
1
select * from view_1 group by is_uuid('6ccd780c-baba-1026-9564-5b8c656024db') HAVING is_uuid('u海军第三部分我不懂给')>-2 order by c1 asc;
c1	c2	c3
0	0	0
select * from view_1 group by is_uuid('6ccd780c-baba-1026-9564-5b8c656024db') HAVING is_uuid('u海军第三部分我不懂给')<2 order by c1 asc;
c1	c2	c3
0	0	0
select * from view_1 group by is_uuid('u海军第三部分我不懂给') HAVING is_uuid('u海军第三部分我不懂给')>-2 order by c1 asc;
c1	c2	c3
0	0	0
select * from view_1 group by is_uuid('6ccd780c-baba-1026-9564-5b8c656024db') HAVING is_uuid('6ccd780c-baba-1026-9564-5b8c656024db')>-2 order by c1 asc;
c1	c2	c3
0	0	0
select * from view_1 group by is_uuid('6ccd780c-baba-1026-9564-5b8c656024db') HAVING is_uuid('6ccd780c-baba-1026-9564-5b8c656024db')>is_uuid('u海军第三部分我不懂给') order by c1 asc;
c1	c2	c3
0	0	0
select * from view_1 group by is_uuid('6ccd780c-baba-1026-9564-5b8c656024db') HAVING is_uuid('6ccd780c-baba-1026-9564-5b8c656024db')<is_uuid('u海军第三部分我不懂给') order by c1 asc;
c1	c2	c3
select * from view_1 group by is_uuid('6ccd780c-baba-1026-9564-5b8c656024db') HAVING is_uuid('6ccd780c-baba-1026-9564-5b8c656024db')=is_uuid('u海军第三部分我不懂给') order by c1 asc;
c1	c2	c3
select * from view_1 group by is_uuid('6ccd780c-baba-1026-9564-5b8c656024db') HAVING is_uuid('u海军第三部分我不懂给')=is_uuid('u海军第三部分我不懂给') order by c1 asc;
c1	c2	c3
0	0	0
select * from view_1 group by is_uuid('6ccd780c-baba-1026-9564-5b8c656024db') HAVING is_uuid('u海军第三部分我不懂给')=is_uuid('u海军第三部分我不懂给') order by c1 asc;
c1	c2	c3
0	0	0
select CASE c1  WHEN 1 THEN '男'  WHEN 0 THEN '女'  ELSE '其他' END  from view_1;
CASE c1  WHEN 1 THEN '男'  WHEN 0 THEN '女'  ELSE '其他' END
女
男
女
女
男
男
select CASE c1  WHEN is_uuid('6ccd780c-baba-1026-9564-5b8c656024db') THEN '男'  WHEN 0 THEN is_uuid('u海军第三部分我不懂给')  ELSE '其他' END  from view_1 order by c1 asc;
CASE c1  WHEN is_uuid('6ccd780c-baba-1026-9564-5b8c656024db') THEN '男'  WHEN 0 THEN is_uuid('u海军第三部分我不懂给')  ELSE '其他' END
0
0
0
男
男
男
select CASE c1  WHEN is_uuid('6ccd780c-baba-1026-9564-5b8c656024db') THEN '男'  WHEN 0 THEN is_uuid('6ccd780c-baba-1026-9564-5b8c656024db')  ELSE '其他' END  from view_1 order by c1 asc;
CASE c1  WHEN is_uuid('6ccd780c-baba-1026-9564-5b8c656024db') THEN '男'  WHEN 0 THEN is_uuid('6ccd780c-baba-1026-9564-5b8c656024db')  ELSE '其他' END
1
1
1
男
男
男
select CASE c1  WHEN is_uuid('u海军第三部分我不懂给') THEN '男'  WHEN 0 THEN is_uuid('u海军第三部分我不懂给')  ELSE '其他' END  from view_1 order by c1 asc;
CASE c1  WHEN is_uuid('u海军第三部分我不懂给') THEN '男'  WHEN 0 THEN is_uuid('u海军第三部分我不懂给')  ELSE '其他' END
男
男
男
其他
其他
其他
select CASE c1  WHEN is_uuid('6ccd780c-baba-1026-9564-5b8c656024db') THEN is_uuid('u海军第三部分我不懂给')  WHEN is_uuid('u海军第三部分我不懂给') THEN is_uuid('6ccd780c-baba-1026-9564-5b8c656024db')  ELSE '其他' END  from view_1 order by c1 asc;
CASE c1  WHEN is_uuid('6ccd780c-baba-1026-9564-5b8c656024db') THEN is_uuid('u海军第三部分我不懂给')  WHEN is_uuid('u海军第三部分我不懂给') THEN is_uuid('6ccd780c-baba-1026-9564-5b8c656024db')  ELSE '其他' END
1
1
1
0
0
0
select CASE is_uuid('6ccd780c-baba-1026-9564-5b8c656024db')  WHEN is_uuid('6ccd780c-baba-1026-9564-5b8c656024db') THEN is_uuid('u海军第三部分我不懂给')  WHEN is_uuid('u海军第三部分我不懂给') THEN is_uuid('6ccd780c-baba-1026-9564-5b8c656024db')  ELSE '其他' END  from view_1 order by c1 asc;
CASE is_uuid('6ccd780c-baba-1026-9564-5b8c656024db')  WHEN is_uuid('6ccd780c-baba-1026-9564-5b8c656024db') THEN is_uuid('u海军第三部分我不懂给')  WHEN is_uuid('u海军第三部分我不懂给') THEN is_uuid('6ccd780c-baba-1026-9564-5b8c656024db'
0
0
0
0
0
0
select CASE is_uuid('6ccd780c-baba-1026-9564-5b8c656024db')  WHEN is_uuid('6ccd780c-baba-1026-9564-5b8c656024db') THEN is_uuid('u海军第三部分我不懂给')  WHEN is_uuid('u海军第三部分我不懂给') THEN is_uuid('6ccd780c-baba-1026-9564-5b8c656024db')  ELSE is_uuid('u海军第三部分我不懂给') END  from view_1 order by c1 asc;
CASE is_uuid('6ccd780c-baba-1026-9564-5b8c656024db')  WHEN is_uuid('6ccd780c-baba-1026-9564-5b8c656024db') THEN is_uuid('u海军第三部分我不懂给')  WHEN is_uuid('u海军第三部分我不懂给') THEN is_uuid('6ccd780c-baba-1026-9564-5b8c656024db'
0
0
0
0
0
0
select CASE WHEN c1 = is_uuid('6ccd780c-baba-1026-9564-5b8c656024db') THEN '男' WHEN c2 = is_uuid('u海军第三部分我不懂给') THEN '女'  ELSE is_uuid('u海军第三部分我不懂给') END  from view_1 order by c1 asc;
CASE WHEN c1 = is_uuid('6ccd780c-baba-1026-9564-5b8c656024db') THEN '男' WHEN c2 = is_uuid('u海军第三部分我不懂给') THEN '女'  ELSE is_uuid('u海军第三部分我不懂给') END
女
女
0
男
男
男
select CASE WHEN c1 = is_uuid('6ccd780c-baba-1026-9564-5b8c656024db') THEN '男' WHEN c2 = is_uuid('u海军第三部分我不懂给') THEN '女'  ELSE is_uuid('null') END  from view_1 order by c1 asc;
CASE WHEN c1 = is_uuid('6ccd780c-baba-1026-9564-5b8c656024db') THEN '男' WHEN c2 = is_uuid('u海军第三部分我不懂给') THEN '女'  ELSE is_uuid('null') END
女
女
0
男
男
男
select CASE WHEN is_uuid('6ccd780c-baba-1026-9564-5b8c656024db') = '1' THEN '男' WHEN is_uuid('6ccd780c-baba-1026-9564-5b8c656024db') = '2' THEN '女' ELSE '其他' END from view_1 order by c1 asc;
CASE WHEN is_uuid('6ccd780c-baba-1026-9564-5b8c656024db') = '1' THEN '男' WHEN is_uuid('6ccd780c-baba-1026-9564-5b8c656024db') = '2' THEN '女' ELSE '其他' END
男
男
男
男
男
男
select CASE WHEN is_uuid('u海军第三部分我不懂给') = '1' THEN '男' WHEN is_uuid('u海军第三部分我不懂给') = '2' THEN '女' ELSE '其他' END from view_1 order by c1 asc;
CASE WHEN is_uuid('u海军第三部分我不懂给') = '1' THEN '男' WHEN is_uuid('u海军第三部分我不懂给') = '2' THEN '女' ELSE '其他' END
其他
其他
其他
其他
其他
其他
select CASE WHEN is_uuid('u海军第三部分我不懂给') = '1' THEN '男' WHEN is_uuid('u海军第三部分我不懂给') = '0' THEN '女' ELSE '其他' END from view_1 order by c1 asc;
CASE WHEN is_uuid('u海军第三部分我不懂给') = '1' THEN '男' WHEN is_uuid('u海军第三部分我不懂给') = '0' THEN '女' ELSE '其他' END
女
女
女
女
女
女
select CASE WHEN is_uuid('u海军第三部分我不懂给')+is_uuid('6ccd780c-baba-1026-9564-5b8c656024db') = '1' THEN '男' WHEN is_uuid('u海军第三部分我不懂给') = '0' THEN '女' ELSE '其他' END from view_1 order by c1 asc;
CASE WHEN is_uuid('u海军第三部分我不懂给')+is_uuid('6ccd780c-baba-1026-9564-5b8c656024db') = '1' THEN '男' WHEN is_uuid('u海军第三部分我不懂给') = '0' THEN '女' ELSE '其他' END
男
男
男
男
男
男
select CASE WHEN is_uuid('6ccd780c-baba-1026-9564-5b8c656024db')+is_uuid('6ccd780c-baba-1026-9564-5b8c656024db') = '1' THEN '男' WHEN is_uuid('u海军第三部分我不懂给') = '0' THEN '女' ELSE '其他' END from view_1 order by c1 asc;
CASE WHEN is_uuid('6ccd780c-baba-1026-9564-5b8c656024db')+is_uuid('6ccd780c-baba-1026-9564-5b8c656024db') = '1' THEN '男' WHEN is_uuid('u海军第三部分我不懂给') = '0' THEN '女' ELSE '其他' END
女
女
女
女
女
女
select * from view_1 where EXISTS(select c1 from view_1 where c2=is_uuid('6ccd780c-baba-1026-9564-5b8c656024db')) order by c1 asc;
c1	c2	c3
0	0	0
0	0	1
0	1	1
1	1	1
1	0	0
1	1	0
select * from view_1 where EXISTS(select c1 from view_1 where c2=is_uuid('u海军第三部分我不懂给')) order by c1 asc;
c1	c2	c3
0	0	0
0	0	1
0	1	1
1	1	1
1	0	0
1	1	0
select * from view_1 where EXISTS(select is_uuid('6ccd780c-baba-1026-9564-5b8c656024db') from view_1 where c2=is_uuid('u海军第三部分我不懂给')) order by c1 asc;
c1	c2	c3
0	0	0
0	0	1
0	1	1
1	1	1
1	0	0
1	1	0
select * from view_1 where EXISTS(select is_uuid('u海军第三部分我不懂给') from view_1 where c2=is_uuid('6ccd780c-baba-1026-9564-5b8c656024db')) order by c1 asc;
c1	c2	c3
0	0	0
0	0	1
0	1	1
1	1	1
1	0	0
1	1	0
select * from view_1 where not EXISTS(select c1 from view_1 where c2=is_uuid('6ccd780c-baba-1026-9564-5b8c656024db')) order by c1 asc;
c1	c2	c3
select * from view_1 where not EXISTS(select c1 from view_1 where c2=is_uuid('u海军第三部分我不懂给')) order by c1 asc;
c1	c2	c3
select * from view_1 where not EXISTS(select is_uuid('6ccd780c-baba-1026-9564-5b8c656024db') from view_1 where c2=is_uuid('u海军第三部分我不懂给')) order by c1 asc;
c1	c2	c3
select * from view_1 where not EXISTS(select is_uuid('u海军第三部分我不懂给') from view_1 where c2=is_uuid('6ccd780c-baba-1026-9564-5b8c656024db')) order by c1 asc;
c1	c2	c3
select * from view_1 where c1 in(is_uuid('6ccd780c-baba-1026-9564-5b8c656024db'),is_uuid('u海军第三部分我不懂给'),is_uuid('5443125741328765412'),is_uuid('-0.5443125741328765412')) order by c1 asc;
c1	c2	c3
0	0	0
0	0	1
0	1	1
1	1	1
1	0	0
1	1	0
select * from view_1 where c1 not in(is_uuid('6ccd780c-baba-1026-9564-5b8c656024db'),is_uuid('u海军第三部分我不懂给'),is_uuid('5443125741328765412'),is_uuid('-0.5443125741328765412')) order by c1 asc;
c1	c2	c3
select * from view_1 where c1=any(select c1 from view_1 where c2=is_uuid('6ccd780c-baba-1026-9564-5b8c656024db') and c3=is_uuid('-0.5489541324852137') ) order by c1 asc;
c1	c2	c3
1	1	1
1	0	0
1	1	0
select * from view_1 where c1>any(select c1 from view_1 where c2=is_uuid('6ccd780c-baba-1026-9564-5b8c656024db') and c3=is_uuid('-0.5489541324852137') ) order by c1 asc;
c1	c2	c3
select * from view_1 where c1<any(select c1 from view_1 where c2=is_uuid('6ccd780c-baba-1026-9564-5b8c656024db') and c3=is_uuid('-0.5489541324852137') ) order by c1 asc;
c1	c2	c3
0	0	0
0	0	1
0	1	1
select * from view_1 where c1=all(select c1 from view_1 where c2=is_uuid('6ccd780c-baba-1026-9564-5b8c656024db') and c3=is_uuid('-0.5489541324852137') ) order by c1 asc;
c1	c2	c3
1	1	1
1	0	0
1	1	0
select * from view_1 where c1>all(select c1 from view_1 where c2=is_uuid('6ccd780c-baba-1026-9564-5b8c656024db') and c3=is_uuid('-0.5489541324852137') ) order by c1 asc;
c1	c2	c3
select * from view_1 where c1<all(select c1 from view_1 where c2=is_uuid('6ccd780c-baba-1026-9564-5b8c656024db') and c3=is_uuid('-0.5489541324852137') ) order by c1 asc;
c1	c2	c3
0	0	0
0	0	1
0	1	1
select * from view_1 where c1 like '%(select c1 from view_1 where c2=is_uuid(6ccd780c-baba-1026-9564-5b8c656024db) and c3=is_uuid(-0.5489541324852137))%' order by c1 asc;
c1	c2	c3
select * from view_1 where c1 like '%is_uuid(6ccd780c-baba-1026-9564-5b8c656024db)%' order by c1 asc;
c1	c2	c3
select * from view_1 where c1 like '%is_uuid(u海军第三部分我不懂给)%' order by c1 asc;
c1	c2	c3
select * from view_1 where c1 like '%1%' order by c1 asc;
c1	c2	c3
1	1	1
1	0	0
1	1	0
select * from view_1 where c1 like '%0%' order by c1 asc;
c1	c2	c3
0	0	0
0	0	1
0	1	1
select * from view_1 where c1 like '%is_uuid(0) and is_uuid(6ccd780c-baba-1026-9564-5b8c656024db)%' order by c1 asc;
c1	c2	c3
#function-6     视图=====>update
update view_1 set c1=is_uuid('6ccd780c-baba-1026-9564-5b8c656024db')+is_uuid('6ccd780c-baba-1026-9564-5b8c656024db') where c1=is_uuid('u海军第三部分我不懂给');
select * from view_1 order by c2 asc;
c1	c2	c3
2	0	0
2	0	1
1	0	0
1	1	1
2	1	1
1	1	0
update view_1 set c1=is_uuid('6ccd780c-baba-1026-9564-5b8c656024db')-2*(is_uuid('6ccd780c-baba-1026-9564-5b8c656024db')) where c1=is_uuid('u海军第三部分我不懂给');
select * from view_1 order by c2 asc;
c1	c2	c3
2	0	0
2	0	1
1	0	0
1	1	1
2	1	1
1	1	0
update view_1 set c1=is_uuid('6ccd780c-baba-1026-9564-5b8c656024db'),c2=(is_uuid('6u海军第三部分我不懂给')) where c3=is_uuid('u海军第三部分我不懂给');
select * from view_1 order by c2 asc;
c1	c2	c3
1	0	0
2	0	1
1	0	0
1	0	0
1	1	1
2	1	1
update view_1 set c1=is_uuid('6ccd780c-baba-1026-9564-5b8c656024db'),c2=(is_uuid('6u海军第三部分我不懂给')) where c3=
(select c3 from view_1 where c3=is_uuid('u海军第三部分我不懂给') LIMIT 1);
update view_1 set c1=is_uuid('6ccd780c-baba-1026-9564-5b8c656024db'),c2=(is_uuid('6u海军第三部分我不懂给')) where c3=
(select c3 from view_1 where c3=is_uuid('6ccd780c-baba-1026-9564-5b8c656024db') LIMIT 1);
#function-6     视图=====>delete
delete from view_1 where c3=is_uuid('u海军第三部分我不懂给') LIMIT 1;
select * from view_1 order by c2 asc;
c1	c2	c3
1	0	1
1	0	1
1	0	1
1	0	0
1	0	0
delete from view_1 where c3=is_uuid('6ccd780c-baba-1026-9564-5b8c656024db')  LIMIT 1;
select * from view_1 order by c2 asc;
c1	c2	c3
1	0	1
1	0	1
1	0	0
1	0	0
delete from view_1 where c3=is_uuid('6ccd780c-baba-1026-9564-5b8c656024db') and c2=is_uuid('6ccd780c-baba-1026-9564-5b8c656024db') and c1=is_uuid('6ccd780c-baba-1026-9564-5b8c656024db') LIMIT 1;
select * from view_1 order by c2 asc;
c1	c2	c3
1	0	1
1	0	1
1	0	0
1	0	0
delete from view_1 where c3=is_uuid('6ccd780c-baba-1026-9564-5b8c656024db') or c2=is_uuid('6ccd780c-baba-1026-9564-5b8c656024db') and c1=is_uuid('6ccd780c-baba-1026-9564-5b8c656024db') LIMIT 1;
select * from view_1 order by c2 asc;
c1	c2	c3
1	0	1
1	0	0
1	0	0
delete from view_1 where c3=is_uuid('6ccd780c-baba-1026-9564-5b8c656024db') or c2=is_uuid('6ccd780c-baba-1026-9564-5b8c656024db') or c1=is_uuid('6ccd780c-baba-1026-9564-5b8c656024db') LIMIT 1;
select * from view_1 order by c2 asc;
c1	c2	c3
1	0	0
1	0	0
delete from view_1 where c3=(select * from (select c3 from view_1 where c3= is_uuid('6ccd780c-baba-1026-9564-5b8c656024db') or c2=is_uuid('6ccd780c-baba-1026-9564-5b8c656024db') or c1=is_uuid('6ccd780c-baba-1026-9564-5b8c656024db') LIMIT 1)as a) ;
select * from view_1 order by c2 asc;
c1	c2	c3
drop view view_1;
drop table test1;
#function-7     索引
#function-7     索引=====>唯一索引
drop table test1;
create table test1(c1 int,c2 bigint default 2);
select * from test1 order by c1 asc;
c1	c2
create UNIQUE index index_1 on test1(c1);
insert into test1(c1) values(is_uuid('6ccd780c-baba-1026-9564-5b8c656024db'));
insert into test1(c1) values(is_uuid('u海军第三部分我不懂给'));
select * from test1 order by c1 asc;
c1	c2
0	2
1	2
insert into test1(c1) values(is_uuid('6ccd780c-baba-1026-9564-5b8c656024db'));
insert into test1(c1) values(is_uuid('u海军第三部分我不懂给'));
insert into test1(c1) values(is_uuid('6ccd780c-baba-1026-9564-5b8c656024db')+is_uuid('6ccd780c-baba-1026-9564-5b8c656024db'));
insert into test1(c1) values(is_uuid('u海军第三部分我不懂给')+5);
select * from test1 order by c1 asc;
c1	c2
0	2
1	2
2	2
5	2
update test1 set c1=is_uuid('6ccd780c-baba-1026-9564-5b8c656024db') where c2=2;
select * from test1 order by c1 asc;
c1	c2
0	2
1	2
2	2
5	2
update test1 set c1=is_uuid('u海军第三部分我不懂给')-4 where c2=2;
update test1 set c1=(select is_uuid('u海军第三部分我不懂给') -4 where c1=2;
DELETE from test1 where c1=is_uuid('u海军第三部分我不懂给')+5;
DELETE from test1 where c1=is_uuid('6ccd780c-baba-1026-9564-5b8c656024db')2-1;
DELETE from test1 where c1=is_uuid('6ccd780c-baba-1026-9564-5b8c656024db')-2;
select * from test1 order by c1 asc;
c1	c2
0	2
1	2
2	2
DELETE from test1 where c1=is_uuid('6ccd780c-baba-1026-9564-5b8c656024db')* 2;
select * from test1 order by c1 asc;
c1	c2
0	2
1	2
DELETE from test1 where c1=is_uuid('6ccd780c-baba-1026-9564-5b8c656024db')/ 2;
select * from test1 order by c1 asc;
c1	c2
0	2
1	2
#function-7     索引=====>普通索引
drop table test1;
create table test1(c1 int,c2 bigint default 2);
select * from test1 order by c1 asc;
c1	c2
create index index_1 on test1(c1);
insert into test1(c1) values(is_uuid('6ccd780c-baba-1026-9564-5b8c656024db'));
insert into test1(c1) values(is_uuid('u海军第三部分我不懂给'));
select * from test1 order by c1 asc;
c1	c2
0	2
1	2
insert into test1(c1) values(is_uuid('6ccd780c-baba-1026-9564-5b8c656024db'));
insert into test1(c1) values(is_uuid('u海军第三部分我不懂给'));
insert into test1(c1) values(is_uuid('6ccd780c-baba-1026-9564-5b8c656024db')+is_uuid('6ccd780c-baba-1026-9564-5b8c656024db'));
insert into test1(c1) values(is_uuid('u海军第三部分我不懂给')+5);
select * from test1 order by c1 asc;
c1	c2
0	2
0	2
1	2
1	2
2	2
5	2
update test1 set c1=is_uuid('6ccd780c-baba-1026-9564-5b8c656024db') where c2=2;
select * from test1 order by c1 asc;
c1	c2
1	2
1	2
1	2
1	2
1	2
1	2
update test1 set c1=is_uuid('u海军第三部分我不懂给')-4 where c2=2;
update test1 set c1=(select is_uuid('u海军第三部分我不懂给') -4 where c1=2;
DELETE from test1 where c1=is_uuid('u海军第三部分我不懂给')+5;
DELETE from test1 where c1=is_uuid('6ccd780c-baba-1026-9564-5b8c656024db')2-1;
DELETE from test1 where c1=is_uuid('6ccd780c-baba-1026-9564-5b8c656024db')-2;
select * from test1 order by c1 asc;
c1	c2
-4	2
-4	2
-4	2
-4	2
-4	2
-4	2
DELETE from test1 where c1=is_uuid('6ccd780c-baba-1026-9564-5b8c656024db')* 2;
select * from test1 order by c1 asc;
c1	c2
-4	2
-4	2
-4	2
-4	2
-4	2
-4	2
DELETE from test1 where c1=is_uuid('6ccd780c-baba-1026-9564-5b8c656024db')/ 2;
select * from test1 order by c1 asc;
c1	c2
-4	2
-4	2
-4	2
-4	2
-4	2
-4	2
#function-7     索引=====>复合索引
drop table test1;
create table test1(c1 int,c2 bigint default 2);
select * from test1 order by c1 asc;
c1	c2
create index index_1 on test1(c1,c2);
insert into test1(c1) values(is_uuid('6ccd780c-baba-1026-9564-5b8c656024db'));
insert into test1(c1) values(is_uuid('u海军第三部分我不懂给'));
select * from test1 order by c1 asc;
c1	c2
0	2
1	2
insert into test1(c1) values(is_uuid('6ccd780c-baba-1026-9564-5b8c656024db'));
insert into test1(c1) values(is_uuid('u海军第三部分我不懂给'));
insert into test1(c1) values(is_uuid('6ccd780c-baba-1026-9564-5b8c656024db')+is_uuid('6ccd780c-baba-1026-9564-5b8c656024db'));
insert into test1(c1) values(is_uuid('u海军第三部分我不懂给')+5);
select * from test1 order by c1 asc;
c1	c2
0	2
0	2
1	2
1	2
2	2
5	2
update test1 set c1=is_uuid('6ccd780c-baba-1026-9564-5b8c656024db') where c2=2;
select * from test1 order by c1 asc;
c1	c2
1	2
1	2
1	2
1	2
1	2
1	2
update test1 set c1=is_uuid('u海军第三部分我不懂给')-4 where c2=2;
update test1 set c1=(select is_uuid('u海军第三部分我不懂给') -4 where c1=2;
DELETE from test1 where c1=is_uuid('u海军第三部分我不懂给')+5;
DELETE from test1 where c1=is_uuid('6ccd780c-baba-1026-9564-5b8c656024db')2-1;
DELETE from test1 where c1=is_uuid('6ccd780c-baba-1026-9564-5b8c656024db')-2;
select * from test1 order by c1 asc;
c1	c2
-4	2
-4	2
-4	2
-4	2
-4	2
-4	2
DELETE from test1 where c1=is_uuid('6ccd780c-baba-1026-9564-5b8c656024db')* 2;
select * from test1 order by c1 asc;
c1	c2
-4	2
-4	2
-4	2
-4	2
-4	2
-4	2
DELETE from test1 where c1=is_uuid('6ccd780c-baba-1026-9564-5b8c656024db')/ 2;
select * from test1 order by c1 asc;
c1	c2
-4	2
-4	2
-4	2
-4	2
-4	2
-4	2
insert into test1 values(is_uuid('u海军第三部分我不懂给'),is_uuid('u海军第三部分我不懂给'));
insert into test1 values(is_uuid('u海军第三部分我不懂给'),is_uuid('6ccd780c-baba-1026-9564-5b8c656024db'));
insert into test1 values(is_uuid('6ccd780c-baba-1026-9564-5b8c656024db'),is_uuid('u海军第三部分我不懂给'));
select * from test1 order by c1 asc;
c1	c2
-4	2
-4	2
-4	2
-4	2
-4	2
-4	2
0	0
0	1
1	0
update test1 set c2=is_uuid('u海军第三部分我不懂给');
select * from test1 order by c1 asc;
c1	c2
-4	0
-4	0
-4	0
-4	0
-4	0
-4	0
0	0
0	0
1	0
update test1 set c2=is_uuid('6ccd780c-baba-1026-9564-5b8c656024db');
select * from test1 order by c1 asc;
c1	c2
-4	1
-4	1
-4	1
-4	1
-4	1
-4	1
0	1
0	1
1	1
update test1 set c1=is_uuid('6ccd780c-baba-1026-9564-5b8c656024db');
select * from test1 order by c1 asc;
c1	c2
1	1
1	1
1	1
1	1
1	1
1	1
1	1
1	1
1	1
drop table test1;
# Clean up users
drop user hjw@'%' ;
