connect(con1, localhost, root,,test);
select effective_tenant();
effective_tenant()
sys
drop database if exists db_1;
drop database if exists db_2;
drop database if exists db_3;
drop database db_1;
ERROR HY000: Can't drop database 'db_1'; database doesn't exist
create database db_1
default character set = utf8
collate = utf8_bin;
show create database db_1;
Database	Create Database
db_1	CREATE DATABASE `db_1` DEFAULT CHARACTER SET = utf8mb4 DEFAULT COLLATE = utf8mb4_bin REPLICA_NUM = NUM
use db_1;
create table t_1(c1 int primary key, c2 char(20), c3 int, index i_1(c1, c2), unique index i_2(c3));
create index i_3 on t_1(c1, c2, c3);
create unique index i_4 on t_1(c3);
insert into t_1 values(1,1,1),(2,2,2);
show create table t_1;
Table	Create Table
t_1	CREATE TABLE `t_1` (
  `c1` int(11) NOT NULL,
  `c2` char(20) COLLATE utf8mb4_bin DEFAULT NULL,
  `c3` int(11) DEFAULT NULL,
  PRIMARY KEY (`c1`),
  UNIQUE KEY `i_2` (`c3`) BLOCK_SIZE 16384 LOCAL,
  UNIQUE KEY `i_4` (`c3`) BLOCK_SIZE 16384 LOCAL,
  KEY `i_1` (`c1`, `c2`) BLOCK_SIZE 16384 LOCAL,
  KEY `i_3` (`c1`, `c2`, `c3`) BLOCK_SIZE 16384 LOCAL
) ORGANIZATION INDEX DEFAULT CHARSET = utf8mb4 COLLATE = utf8mb4_bin COMPRESSION = 'lz4_1.0' REPLICA_NUM = NUM BLOCK_SIZE = SIZE USE_BLOOM_FILTER = FALSE ENABLE_MACRO_BLOCK_BLOOM_FILTER = FALSE TABLET_SIZE = SIZE PCTFREE = 10
create database db_2
default character set = utf8mb4
collate = utf8mb4_bin
replica_num = 1;
show create database db_2;
Database	Create Database
db_2	CREATE DATABASE `db_2` DEFAULT CHARACTER SET = utf8mb4 DEFAULT COLLATE = utf8mb4_bin REPLICA_NUM = NUM
use db_2;
create table t_1(c1 int primary key, c2 char(20), c3 int, index i_1(c1, c2), unique index i_2(c3));
create index i_3 on t_1(c1, c2, c3);
create unique index i_4 on t_1(c3);
insert into t_1 values(1,1,1),(2,2,2),(3,3,3);
show create table t_1;
Table	Create Table
t_1	CREATE TABLE `t_1` (
  `c1` int(11) NOT NULL,
  `c2` char(20) COLLATE utf8mb4_bin DEFAULT NULL,
  `c3` int(11) DEFAULT NULL,
  PRIMARY KEY (`c1`),
  UNIQUE KEY `i_2` (`c3`) BLOCK_SIZE 16384 LOCAL,
  UNIQUE KEY `i_4` (`c3`) BLOCK_SIZE 16384 LOCAL,
  KEY `i_1` (`c1`, `c2`) BLOCK_SIZE 16384 LOCAL,
  KEY `i_3` (`c1`, `c2`, `c3`) BLOCK_SIZE 16384 LOCAL
) ORGANIZATION INDEX DEFAULT CHARSET = utf8mb4 COLLATE = utf8mb4_bin COMPRESSION = 'lz4_1.0' REPLICA_NUM = NUM BLOCK_SIZE = SIZE USE_BLOOM_FILTER = FALSE ENABLE_MACRO_BLOCK_BLOOM_FILTER = FALSE TABLET_SIZE = SIZE PCTFREE = 10
create table t_2(c1 int primary key, c2 char(20), index i_1(c1, c2), unique index i_2(c1));
insert into t_2 values(1,1);
create database db_3;
show create database db_3;
Database	Create Database
db_3	CREATE DATABASE `db_3` DEFAULT CHARACTER SET = utf8mb4 REPLICA_NUM = NUM
select table_name from oceanbase.__all_virtual_table t inner join oceanbase.__all_virtual_database d on t.database_id = d.database_id where (t.table_name like "t_1" or t.table_name like "t_2") and d.in_recyclebin = 0 and d.database_name != '__recyclebin' and t.tenant_id = d.tenant_id;
table_name
t_1
t_1
t_2
use db_1;
drop database if exist db_1;
ERROR 42000: You have an error in your SQL syntax; check the manual that corresponds to your OceanBase version for the right syntax to use near 'exist db_1' at line 1
drop database db_1, db_2;
ERROR 42000: You have an error in your SQL syntax; check the manual that corresponds to your OceanBase version for the right syntax to use near ', db_2' at line 1
drop database db_1 if exists;
ERROR 42000: You have an error in your SQL syntax; check the manual that corresponds to your OceanBase version for the right syntax to use near 'if exists' at line 1
use db_1;
select * from t_1;
c1	c2	c3
1	1	1
2	2	2
select * from t_2;
ERROR 42S02: Table 'db_1.t_2' doesn't exist
drop database db_3;
show create database db_3;
ERROR 42000: Unknown database 'db_3'
select * from db_1.t_1;
c1	c2	c3
1	1	1
2	2	2
select * from db_2.t_1;
c1	c2	c3
1	1	1
2	2	2
3	3	3
select * from db_2.t_2 where db_2.t_2.c1=1;
c1	c2
1	1
delete from  db_2.t_1 where db_2.t_1.c1>2;
select count(*) from db_2.t_1;
count(*)
2
drop table db_1.t_1;
create database test_10 default character set=utf8 default collate= utf8_bin replica_num=1;
drop database test_10;
create database test_9 default character set=utf8 default collate= utf8_bin replica_num=1;
drop database test_9;
create database test_8 default character set=utf8 default collate= utf8_bin replica_num=1;
drop database test_8;
create database test_7 default character set=utf8 default collate= utf8_bin replica_num=1;
drop database test_7;
create database test_6 default character set=utf8 default collate= utf8_bin replica_num=1;
drop database test_6;
create database test_5 default character set=utf8 default collate= utf8_bin replica_num=1;
drop database test_5;
create database test_4 default character set=utf8 default collate= utf8_bin replica_num=1;
drop database test_4;
create database test_3 default character set=utf8 default collate= utf8_bin replica_num=1;
drop database test_3;
create database test_2 default character set=utf8 default collate= utf8_bin replica_num=1;
drop database test_2;
create database test_1 default character set=utf8 default collate= utf8_bin replica_num=1;
drop database test_1;
select table_name from oceanbase.__all_virtual_table t inner join oceanbase.__all_virtual_database d on t.database_id = d.database_id where (t.table_name like "t_1" or t.table_name like "t_2") and d.in_recyclebin = 0 and d.database_name != '__recyclebin' and t.tenant_id = d.tenant_id;
table_name
t_1
t_2
select table_name from oceanbase.__all_virtual_table t inner join oceanbase.__all_virtual_database d on t.database_id = d.database_id where (t.table_name like "t_1" or t.table_name like "t_2") and d.in_recyclebin = 0 and d.database_name != '__recyclebin' and t.tenant_id = d.tenant_id;
table_name
t_1
t_2
