purge recyclebin;
CREATE DATABASE IF NOT EXISTS naaj_test;
USE naaj_test;
SET sql_mode='STRICT_ALL_TABLES,NO_ZERO_IN_DATE,NO_AUTO_VALUE_ON_ZERO';
#普通表中，修改列为自增列，插入、修改值为边界值校验
DROP TABLE IF EXISTS t2;
DROP TABLE IF EXISTS t1;
CREATE TABLE t1(c0 INT(4) DEFAULT 0,
c1 FLOAT NOT NULL DEFAULT 0,
c2 VARCHAR(10) UNIQUE,
c3 YEAR,CHECK(c3>c0));
INSERT INTO t1 VALUES(-1,1.0,'a','2000'),
(-2,1.1,'b','2001'),
(0,1.2,'c','2002'),
(NULL,1.3,'d','2003'),
(NULL,1.4,'e','2004'),
(16,1.5,'f','2005'),
(7,1.6,'g','2006'),
(18,1.7,'h','2007'),
(-90,1.8,'i','2011'),
(NULL,1.9,'j','2012'),
(11,2.0,'k','2011'),
(NULL,2.1,'l','2012');
CREATE INDEX ind1 ON t1(c0,c1);
ALTER TABLE t1 MODIFY c0 INT(5) PRIMARY KEY AUTO_INCREMENT;
ERROR HY000: Check constraint cannot refer to an auto-increment column.
DROP TABLE IF EXISTS t2;
DROP TABLE IF EXISTS t1;
CREATE TABLE t1(c0 INT(4) DEFAULT 0,
c1 FLOAT NOT NULL DEFAULT 0,
c2 VARCHAR(10) UNIQUE,
c3 YEAR);
INSERT INTO t1 VALUES(-1,1.0,'a','2000'),
(-2,1.1,'b','2001'),
(0,1.2,'c','2002'),
(NULL,1.3,'d','2003'),
(NULL,1.4,'e','2004'),
(16,1.5,'f','2005'),
(7,1.6,'g','2006'),
(18,1.7,'h','2007'),
(-90,1.8,'i','2011'),
(NULL,1.9,'j','2012'),
(11,2.0,'k','2011'),
(NULL,2.1,'l','2012');
CREATE INDEX ind1 ON t1(c0,c1);
ALTER TABLE t1 MODIFY c0 INT(5) PRIMARY KEY AUTO_INCREMENT;
SHOW CREATE TABLE t1;
Table	Create Table
t1	CREATE TABLE `t1` (
  `c0` int(5) NOT NULL AUTO_INCREMENT,
  `c1` float NOT NULL DEFAULT '0',
  `c2` varchar(10) DEFAULT NULL,
  `c3` year(4) DEFAULT NULL,
  PRIMARY KEY (`c0`),
  UNIQUE KEY `c2` (`c2`) BLOCK_SIZE 16384 LOCAL,
  KEY `ind1` (`c0`, `c1`) BLOCK_SIZE 16384 LOCAL
) ORGANIZATION INDEX AUTO_INCREMENT = 23 AUTO_INCREMENT_MODE = 'ORDER' DEFAULT CHARSET = utf8mb4 ROW_FORMAT = DYNAMIC COMPRESSION = 'zstd_1.3.8' REPLICA_NUM = 1 BLOCK_SIZE = 16384 USE_BLOOM_FILTER = FALSE ENABLE_MACRO_BLOCK_BLOOM_FILTER = FALSE TABLET_SIZE = 134217728 PCTFREE = 0
INSERT INTO t1 VALUES(2147483648,2.2,'m','2013');
ERROR 22003: Out of range value for column 'c0' at row 1
INSERT INTO t1 VALUES(NULL,2.3,'n','2014');
SELECT * FROM t1 WHERE c2='n';
c0	c1	c2	c3
23	2.3	n	2014
INSERT INTO t1 VALUES(2147483647,2.2,'m','2013'),(NULL,2.3,'o','2014');
ERROR 23000: Duplicate entry '2147483647' for key 'PRIMARY'
SELECT * FROM t1 ORDER BY 1;
c0	c1	c2	c3
-90	1.8	i	2011
-2	1.1	b	2001
-1	1	a	2000
0	1.2	c	2002
1	1.3	d	2003
2	1.4	e	2004
7	1.6	g	2006
11	2	k	2011
16	1.5	f	2005
18	1.7	h	2007
19	1.9	j	2012
20	2.1	l	2012
23	2.3	n	2014
INSERT INTO t1 VALUES(2147483647,2.2,'m','2013');
INSERT INTO t1 VALUES(NULL,2.3,'n','2014');
ERROR 23000: Duplicate entry '2147483647' for key 'PRIMARY'
INSERT INTO t1(c1,c2,c3) VALUES(2.3,'n','2014');
ERROR 23000: Duplicate entry '2147483647' for key 'PRIMARY'
DELETE FROM t1 WHERE c0=2147483647;
SELECT * FROM t1 ORDER BY 1;
c0	c1	c2	c3
-90	1.8	i	2011
-2	1.1	b	2001
-1	1	a	2000
0	1.2	c	2002
1	1.3	d	2003
2	1.4	e	2004
7	1.6	g	2006
11	2	k	2011
16	1.5	f	2005
18	1.7	h	2007
19	1.9	j	2012
20	2.1	l	2012
23	2.3	n	2014
INSERT INTO t1 VALUES(NULL,2.3,'n','2014');
ERROR 23000: Duplicate entry 'n' for key 'c2'
INSERT INTO t1(c1,c2,c3) VALUES(2.3,'n','2014');
ERROR 23000: Duplicate entry 'n' for key 'c2'
INSERT INTO t1 VALUES(-2147483649,2.3,'n','2014');
ERROR 22003: Out of range value for column 'c0' at row 1
INSERT INTO t1 VALUES(-2147483648,2.3,'n','2014'),(NULL,2.4,'o','2015');
ERROR 23000: Duplicate entry 'n' for key 'c2'
SELECT * FROM t1 ORDER BY 1;
c0	c1	c2	c3
-90	1.8	i	2011
-2	1.1	b	2001
-1	1	a	2000
0	1.2	c	2002
1	1.3	d	2003
2	1.4	e	2004
7	1.6	g	2006
11	2	k	2011
16	1.5	f	2005
18	1.7	h	2007
19	1.9	j	2012
20	2.1	l	2012
23	2.3	n	2014
UPDATE t1 SET c0=-2147483649 WHERE c0=0;
ERROR 22003: Out of range value for column 'c0' at row 1
UPDATE t1 SET c0=2147483648 WHERE c0=0;
ERROR 22003: Out of range value for column 'c0' at row 1
DROP TABLE IF EXISTS t2;
DROP TABLE IF EXISTS t1;
CREATE TABLE t1(c0 INT(4) DEFAULT 0,
c1 FLOAT NOT NULL DEFAULT 0,
c2 VARCHAR(10) UNIQUE,
c3 YEAR);
INSERT INTO t1 VALUES(-1,1.0,'a','2000'),
(-2,1.1,'b','2001'),
(0,1.2,'c','2002'),
(NULL,1.3,'d','2003'),
(NULL,1.4,'e','2004'),
(16,1.5,'f','2005'),
(7,1.6,'g','2006'),
(18,1.7,'h','2007'),
(-90,1.8,'i','2011'),
(NULL,1.9,'j','2012'),
(11,2.0,'k','2011'),
(NULL,2.1,'l','2012');
CREATE INDEX ind1 ON t1(c0,c1);
ALTER TABLE t1 MODIFY c0 INT(5) AUTO_INCREMENT;
INSERT INTO t1 VALUES(2147483648,2.2,'m','2013');
ERROR 22003: Out of range value for column 'c0' at row 1
INSERT INTO t1 VALUES(NULL,2.3,'n','2014');
SELECT * FROM t1 WHERE c2='n';
c0	c1	c2	c3
19	2.3	n	2014
INSERT INTO t1 VALUES(2147483647,2.2,'m','2013'),(NULL,2.3,'p','2014');
SELECT * FROM t1 ORDER BY 1,2,3,4;
c0	c1	c2	c3
-90	1.8	i	2011
-2	1.1	b	2001
-1	1	a	2000
0	1.2	c	2002
4	1.3	d	2003
5	1.4	e	2004
7	1.6	g	2006
10	1.9	j	2012
11	2	k	2011
12	2.1	l	2012
16	1.5	f	2005
18	1.7	h	2007
19	2.3	n	2014
2147483647	2.2	m	2013
2147483647	2.3	p	2014
INSERT INTO t1 VALUES(NULL,2.5,'r','2014');
INSERT INTO t1(c1,c2,c3) VALUES(2.6,'s','2016');
SELECT * FROM t1 ORDER BY 1,2,3,4;
c0	c1	c2	c3
-90	1.8	i	2011
-2	1.1	b	2001
-1	1	a	2000
0	1.2	c	2002
4	1.3	d	2003
5	1.4	e	2004
7	1.6	g	2006
10	1.9	j	2012
11	2	k	2011
12	2.1	l	2012
16	1.5	f	2005
18	1.7	h	2007
19	2.3	n	2014
2147483647	2.2	m	2013
2147483647	2.3	p	2014
2147483647	2.5	r	2014
2147483647	2.6	s	2016
DELETE FROM t1 WHERE c0=2147483647;
SELECT * FROM t1 ORDER BY 1,2,3,4;
c0	c1	c2	c3
-90	1.8	i	2011
-2	1.1	b	2001
-1	1	a	2000
0	1.2	c	2002
4	1.3	d	2003
5	1.4	e	2004
7	1.6	g	2006
10	1.9	j	2012
11	2	k	2011
12	2.1	l	2012
16	1.5	f	2005
18	1.7	h	2007
19	2.3	n	2014
INSERT INTO t1 VALUES(NULL,2.7,'t','2017');
INSERT INTO t1(c1,c2,c3) VALUES(2.8,'u','2018');
SELECT * FROM t1 ORDER BY 1,2,3,4;
c0	c1	c2	c3
-90	1.8	i	2011
-2	1.1	b	2001
-1	1	a	2000
0	1.2	c	2002
4	1.3	d	2003
5	1.4	e	2004
7	1.6	g	2006
10	1.9	j	2012
11	2	k	2011
12	2.1	l	2012
16	1.5	f	2005
18	1.7	h	2007
19	2.3	n	2014
2147483647	2.7	t	2017
2147483647	2.8	u	2018
INSERT INTO t1 VALUES(-2147483649,2.3,'v','2019');
ERROR 22003: Out of range value for column 'c0' at row 1
INSERT INTO t1 VALUES(-2147483648,2.9,'w','2024'),(NULL,3.0,'x','2025');
SELECT * FROM t1 ORDER BY 1,2,3,4;
c0	c1	c2	c3
-2147483648	2.9	w	2024
-90	1.8	i	2011
-2	1.1	b	2001
-1	1	a	2000
0	1.2	c	2002
4	1.3	d	2003
5	1.4	e	2004
7	1.6	g	2006
10	1.9	j	2012
11	2	k	2011
12	2.1	l	2012
16	1.5	f	2005
18	1.7	h	2007
19	2.3	n	2014
2147483647	2.7	t	2017
2147483647	2.8	u	2018
2147483647	3	x	2025
UPDATE t1 SET c0=-2147483649 WHERE c0=0;
ERROR 22003: Out of range value for column 'c0' at row 1
UPDATE t1 SET c0=2147483648 WHERE c0=0;
ERROR 22003: Out of range value for column 'c0' at row 1
UPDATE t1 SET c0=2147483647 WHERE c0=0;
SELECT * FROM t1 ORDER BY 1,2,3,4;
c0	c1	c2	c3
-2147483648	2.9	w	2024
-90	1.8	i	2011
-2	1.1	b	2001
-1	1	a	2000
4	1.3	d	2003
5	1.4	e	2004
7	1.6	g	2006
10	1.9	j	2012
11	2	k	2011
12	2.1	l	2012
16	1.5	f	2005
18	1.7	h	2007
19	2.3	n	2014
2147483647	1.2	c	2002
2147483647	2.7	t	2017
2147483647	2.8	u	2018
2147483647	3	x	2025
DROP TABLE IF EXISTS t2;
DROP TABLE IF EXISTS t1;
CREATE TABLE t1(c0 INT(4) DEFAULT 0,
c1 FLOAT NOT NULL DEFAULT 0,
c2 VARCHAR(10) UNIQUE,
c3 YEAR);
INSERT INTO t1 VALUES(-1,1.0,'a','2000'),
(-2,1.1,'b','2001'),
(0,1.2,'c','2002'),
(NULL,1.3,'d','2003'),
(NULL,1.4,'e','2004'),
(16,1.5,'f','2005'),
(7,1.6,'g','2006'),
(18,1.7,'h','2007'),
(-90,1.8,'i','2011'),
(NULL,1.9,'j','2012'),
(11,2.0,'k','2011'),
(NULL,2.1,'l','2012');
CREATE INDEX ind1 ON t1(c0,c1);
ALTER TABLE t1 MODIFY c0 INT(5) UNIQUE AUTO_INCREMENT;
SHOW CREATE TABLE t1;
Table	Create Table
t1	CREATE TABLE `t1` (
  `c0` int(5) NOT NULL AUTO_INCREMENT,
  `c1` float NOT NULL DEFAULT '0',
  `c2` varchar(10) DEFAULT NULL,
  `c3` year(4) DEFAULT NULL,
  UNIQUE KEY `c2` (`c2`) BLOCK_SIZE 16384 LOCAL,
  UNIQUE KEY `c0` (`c0`) BLOCK_SIZE 16384 LOCAL,
  KEY `ind1` (`c0`, `c1`) BLOCK_SIZE 16384 LOCAL
) ORGANIZATION INDEX AUTO_INCREMENT = 19 AUTO_INCREMENT_MODE = 'ORDER' DEFAULT CHARSET = utf8mb4 ROW_FORMAT = DYNAMIC COMPRESSION = 'zstd_1.3.8' REPLICA_NUM = 1 BLOCK_SIZE = 16384 USE_BLOOM_FILTER = FALSE ENABLE_MACRO_BLOCK_BLOOM_FILTER = FALSE TABLET_SIZE = 134217728 PCTFREE = 0
INSERT INTO t1 VALUES(2147483648,2.2,'m','2013');
ERROR 22003: Out of range value for column 'c0' at row 1
INSERT INTO t1 VALUES(NULL,2.3,'n','2014');
SELECT * FROM t1 WHERE c2='n';
c0	c1	c2	c3
19	2.3	n	2014
INSERT INTO t1 VALUES(2147483647,2.2,'m','2013'),(NULL,2.3,'o','2014');
ERROR 23000: Duplicate entry '2147483647' for key 'c0'
SELECT * FROM t1 ORDER BY 1;
c0	c1	c2	c3
-90	1.8	i	2011
-2	1.1	b	2001
-1	1	a	2000
0	1.2	c	2002
4	1.3	d	2003
5	1.4	e	2004
7	1.6	g	2006
10	1.9	j	2012
11	2	k	2011
12	2.1	l	2012
16	1.5	f	2005
18	1.7	h	2007
19	2.3	n	2014
INSERT INTO t1 VALUES(2147483647,2.2,'m','2013');
INSERT INTO t1 VALUES(NULL,2.3,'n','2014');
ERROR 23000: Duplicate entry 'n' for key 'c2'
INSERT INTO t1(c1,c2,c3) VALUES(2.3,'n','2014');
ERROR 23000: Duplicate entry 'n' for key 'c2'
DELETE FROM t1 WHERE c0=2147483647;
SELECT * FROM t1 ORDER BY 1;
c0	c1	c2	c3
-90	1.8	i	2011
-2	1.1	b	2001
-1	1	a	2000
0	1.2	c	2002
4	1.3	d	2003
5	1.4	e	2004
7	1.6	g	2006
10	1.9	j	2012
11	2	k	2011
12	2.1	l	2012
16	1.5	f	2005
18	1.7	h	2007
19	2.3	n	2014
INSERT INTO t1 VALUES(NULL,2.3,'n','2014');
ERROR 23000: Duplicate entry 'n' for key 'c2'
INSERT INTO t1(c1,c2,c3) VALUES(2.3,'n','2014');
ERROR 23000: Duplicate entry 'n' for key 'c2'
INSERT INTO t1 VALUES(-2147483649,2.3,'n','2014');
ERROR 22003: Out of range value for column 'c0' at row 1
INSERT INTO t1 VALUES(-2147483648,2.3,'n','2014'),(NULL,2.4,'o','2015');
ERROR 23000: Duplicate entry 'n' for key 'c2'
SELECT * FROM t1 ORDER BY 1;
c0	c1	c2	c3
-90	1.8	i	2011
-2	1.1	b	2001
-1	1	a	2000
0	1.2	c	2002
4	1.3	d	2003
5	1.4	e	2004
7	1.6	g	2006
10	1.9	j	2012
11	2	k	2011
12	2.1	l	2012
16	1.5	f	2005
18	1.7	h	2007
19	2.3	n	2014
UPDATE t1 SET c0=-2147483649 WHERE c0=0;
ERROR 22003: Out of range value for column 'c0' at row 1
UPDATE t1 SET c0=2147483648 WHERE c0=0;
ERROR 22003: Out of range value for column 'c0' at row 1
UPDATE t1 SET c0=2147483647 WHERE c0=0;
DROP TABLE IF EXISTS t1;
CREATE TABLE t1(c0 INT(4) DEFAULT 0,
c1 FLOAT NOT NULL DEFAULT 0,
c2 VARCHAR(10) UNIQUE,
c3 YEAR) AUTO_INCREMENT=20;
INSERT INTO t1 VALUES(-1,1.0,'a','2000'),
(-2,1.1,'b','2001'),
(0,1.2,'c','2002'),
(NULL,1.3,'d','2003'),
(NULL,1.4,'e','2004'),
(16,1.5,'f','2005'),
(7,1.6,'g','2006'),
(18,1.7,'h','2007'),
(-90,1.8,'i','2011'),
(NULL,1.9,'j','2012'),
(11,2.0,'k','2011'),
(NULL,2.1,'l','2012');
CREATE INDEX ind1 ON t1(c0,c1);
ALTER TABLE t1 MODIFY c0 TINYINT AUTO_INCREMENT;
SHOW CREATE TABLE t1;
Table	Create Table
t1	CREATE TABLE `t1` (
  `c0` tinyint(4) NOT NULL AUTO_INCREMENT,
  `c1` float NOT NULL DEFAULT '0',
  `c2` varchar(10) DEFAULT NULL,
  `c3` year(4) DEFAULT NULL,
  UNIQUE KEY `c2` (`c2`) BLOCK_SIZE 16384 LOCAL,
  KEY `ind1` (`c0`, `c1`) BLOCK_SIZE 16384 LOCAL
) ORGANIZATION INDEX AUTO_INCREMENT = 20 AUTO_INCREMENT_MODE = 'ORDER' DEFAULT CHARSET = utf8mb4 ROW_FORMAT = DYNAMIC COMPRESSION = 'zstd_1.3.8' REPLICA_NUM = 1 BLOCK_SIZE = 16384 USE_BLOOM_FILTER = FALSE ENABLE_MACRO_BLOCK_BLOOM_FILTER = FALSE TABLET_SIZE = 134217728 PCTFREE = 0
SELECT * FROM t1 ORDER BY 1;
c0	c1	c2	c3
-90	1.8	i	2011
-2	1.1	b	2001
-1	1	a	2000
0	1.2	c	2002
4	1.3	d	2003
5	1.4	e	2004
7	1.6	g	2006
10	1.9	j	2012
11	2	k	2011
12	2.1	l	2012
16	1.5	f	2005
18	1.7	h	2007
INSERT INTO t1 VALUES(NULL,3.2,'m','2013'),(NULL,3.4,'n','2014'),(90,3.5,'o','2015'),(NULL,3.7,'p','2015');
SELECT * FROM t1 ORDER BY 1;
c0	c1	c2	c3
-90	1.8	i	2011
-2	1.1	b	2001
-1	1	a	2000
0	1.2	c	2002
4	1.3	d	2003
5	1.4	e	2004
7	1.6	g	2006
10	1.9	j	2012
11	2	k	2011
12	2.1	l	2012
16	1.5	f	2005
18	1.7	h	2007
20	3.2	m	2013
21	3.4	n	2014
90	3.5	o	2015
91	3.7	p	2015
INSERT INTO t1(c1,c2,c3) VALUES(3.8,'q','2016'),(3.9,'r','2017');
SELECT * FROM t1 ORDER BY 1;
c0	c1	c2	c3
-90	1.8	i	2011
-2	1.1	b	2001
-1	1	a	2000
0	1.2	c	2002
4	1.3	d	2003
5	1.4	e	2004
7	1.6	g	2006
10	1.9	j	2012
11	2	k	2011
12	2.1	l	2012
16	1.5	f	2005
18	1.7	h	2007
20	3.2	m	2013
21	3.4	n	2014
90	3.5	o	2015
91	3.7	p	2015
92	3.8	q	2016
93	3.9	r	2017
DROP TABLE IF EXISTS t1;
CREATE TABLE t1(c0 INT(4) DEFAULT 0,
c1 FLOAT NOT NULL DEFAULT 0,
c2 VARCHAR(10) UNIQUE,
c3 YEAR) AUTO_INCREMENT=20;
INSERT INTO t1 VALUES(-1,1.0,'a','2000'),
(-2,1.1,'b','2001'),
(0,1.2,'c','2002'),
(NULL,1.3,'d','2003'),
(NULL,1.4,'e','2004'),
(16,1.5,'f','2005'),
(7,1.6,'g','2006'),
(18,1.7,'h','2007'),
(-90,1.8,'i','2011'),
(NULL,1.9,'j','2012'),
(11,2.0,'k','2011'),
(NULL,2.1,'l','2012');
CREATE INDEX ind1 ON t1(c0,c1);
#分区表中，修改主键且带有分区键列为自增列，插入、修改值为边界值校验
DROP TABLE IF EXISTS t1;
CREATE TABLE t1(c0 FLOAT(5,0),
c1 INT PRIMARY KEY,
c2 VARCHAR(10))
PARTITION BY RANGE(c1)
(PARTITION p1 VALUES LESS THAN(15),
PARTITION p2 VALUES LESS THAN(25),
PARTITION p3 VALUES LESS THAN(35),
PARTITION p4 VALUES LESS THAN(MAXVALUE)
);
INSERT INTO t1 VALUES(1,0,'A'),(2,2,'B'),(3,4,'C'),(4,8,'D'),(5,16,'E'),(6,18,'F'),(7,20,'G');
ALTER TABLE t1 MODIFY c1 INT AUTO_INCREMENT;
SHOW CREATE TABLE t1;
Table	Create Table
t1	CREATE TABLE `t1` (
  `c0` float(5,0) DEFAULT NULL,
  `c1` int(11) NOT NULL AUTO_INCREMENT,
  `c2` varchar(10) DEFAULT NULL,
  PRIMARY KEY (`c1`)
) ORGANIZATION INDEX AUTO_INCREMENT = 21 AUTO_INCREMENT_MODE = 'ORDER' DEFAULT CHARSET = utf8mb4 ROW_FORMAT = DYNAMIC COMPRESSION = 'zstd_1.3.8' REPLICA_NUM = 1 BLOCK_SIZE = 16384 USE_BLOOM_FILTER = FALSE ENABLE_MACRO_BLOCK_BLOOM_FILTER = FALSE TABLET_SIZE = 134217728 PCTFREE = 0
 partition by range(c1)
(partition `p1` values less than (15),
partition `p2` values less than (25),
partition `p3` values less than (35),
partition `p4` values less than (MAXVALUE))
INSERT INTO t1 VALUES(8,2147483647,'A'),(9,NULL,'A');
ERROR 23000: Duplicate entry '2147483647' for key 'PRIMARY'
INSERT INTO t1 VALUES(8,NULL,'A');
SELECT * FROM t1 ORDER BY 1;
c0	c1	c2
1	0	A
2	2	B
3	4	C
4	8	D
5	16	E
6	18	F
7	20	G
8	2147483647	A
INSERT INTO t1(c0,c2) VALUES(9,'B');
ERROR 23000: Duplicate entry '2147483647' for key 'PRIMARY'
SELECT * FROM t1 ORDER BY 1;
c0	c1	c2
1	0	A
2	2	B
3	4	C
4	8	D
5	16	E
6	18	F
7	20	G
8	2147483647	A
#分区表中，修改非分区键列为自增列，插入、修改值为边界值校验
DROP TABLE IF EXISTS t1;
CREATE TABLE t1(c0 FLOAT(5,0),
c1 INT ,
c2 VARCHAR(10))
PARTITION BY RANGE(c1)
(PARTITION p1 VALUES LESS THAN(15),
PARTITION p2 VALUES LESS THAN(25),
PARTITION p3 VALUES LESS THAN(35),
PARTITION p4 VALUES LESS THAN(MAXVALUE)
);
INSERT INTO t1 VALUES(1,0,'A'),(2,2,'B'),(3,4,'C'),(4,8,'D'),(5,16,'E'),(6,18,'F'),(7,20,'G');
ALTER TABLE t1 MODIFY c2 VARCHAR(10) PRIMARY KEY AUTO_INCREMENT;
ERROR 42000: Incorrect column specifier for column 'c2'
ALTER TABLE t1 MODIFY c0 INT(3) PRIMARY KEY AUTO_INCREMENT;
ERROR HY000: A PRIMARY KEY must include all columns in the table's partitioning function
ALTER TABLE t1 MODIFY c0 INT(3) AUTO_INCREMENT,ADD UNIQUE KEY uni_key(c0,c1);
SHOW CREATE TABLE t1;
Table	Create Table
t1	CREATE TABLE `t1` (
  `c0` int(3) NOT NULL AUTO_INCREMENT,
  `c1` int(11) DEFAULT NULL,
  `c2` varchar(10) DEFAULT NULL,
  UNIQUE KEY `uni_key` (`c0`, `c1`) BLOCK_SIZE 16384 LOCAL
) ORGANIZATION INDEX AUTO_INCREMENT = 8 AUTO_INCREMENT_MODE = 'ORDER' DEFAULT CHARSET = utf8mb4 ROW_FORMAT = DYNAMIC COMPRESSION = 'zstd_1.3.8' REPLICA_NUM = 1 BLOCK_SIZE = 16384 USE_BLOOM_FILTER = FALSE ENABLE_MACRO_BLOCK_BLOOM_FILTER = FALSE TABLET_SIZE = 134217728 PCTFREE = 0
 partition by range(c1)
(partition `p1` values less than (15),
partition `p2` values less than (25),
partition `p3` values less than (35),
partition `p4` values less than (MAXVALUE))
#LIST分区，修改分区键为自增列，然后校验边界值
DROP TABLE IF EXISTS t1;
CREATE TABLE t1(c0 FLOAT(5,0),
c1 INT PRIMARY KEY,
c2 VARCHAR(10))
PARTITION BY LIST(c1)
(PARTITION p1 VALUES IN(1,2,3,15),
PARTITION p2 VALUES IN(4,5,6,25),
PARTITION p3 VALUES IN(7,8,9,35,-2147483648,-2147483649),
PARTITION p4 VALUES IN(10,11,12,2147483647,2147483648)
);
INSERT INTO t1 VALUES(1,1,'A'),(2,2,'B'),(3,3,'C'),(4,4,'D'),(5,5,'E'),(6,6,'F'),(7,7,'H'),(8,8,'I');
ALTER TABLE t1 MODIFY c1 INT AUTO_INCREMENT AFTER c2;
SHOW CREATE TABLE t1;
Table	Create Table
t1	CREATE TABLE `t1` (
  `c0` float(5,0) DEFAULT NULL,
  `c2` varchar(10) DEFAULT NULL,
  `c1` int(11) NOT NULL AUTO_INCREMENT,
  PRIMARY KEY (`c1`)
) ORGANIZATION INDEX AUTO_INCREMENT = 9 AUTO_INCREMENT_MODE = 'ORDER' DEFAULT CHARSET = utf8mb4 ROW_FORMAT = DYNAMIC COMPRESSION = 'zstd_1.3.8' REPLICA_NUM = 1 BLOCK_SIZE = 16384 USE_BLOOM_FILTER = FALSE ENABLE_MACRO_BLOCK_BLOOM_FILTER = FALSE TABLET_SIZE = 134217728 PCTFREE = 0
 partition by list(c1)
(partition `p3` values in (-2147483649,-2147483648,7,8,9,35),
partition `p4` values in (10,11,12,2147483647,2147483648),
partition `p1` values in (1,2,3,15),
partition `p2` values in (4,5,6,25))
#此处有问题，问题链接：
INSERT INTO t1 VALUES(10,'J',2147483647),(11,'K',2147483648);
ERROR 22003: Out of range value for column 'c1' at row 2
UPDATE t1 SET c1=2147483648 WHERE c0=1;
ERROR 22003: Out of range value for column 'c1' at row 1
UPDATE t1 SET c1=-2147483649 WHERE c0=1;
ERROR 22003: Out of range value for column 'c1' at row 1
UPDATE t1 SET c1=-2147483648 WHERE c0=1;
SELECT * FROM t1 ORDER BY 1;
c0	c2	c1
1	A	-2147483648
2	B	2
3	C	3
4	D	4
5	E	5
6	F	6
7	H	7
8	I	8
#KEY分区，修改分区键为自增列，然后校验边界值
DROP TABLE IF EXISTS t1;
CREATE TABLE t1(c0 FLOAT(5,0),
c1 INT PRIMARY KEY,
c2 VARCHAR(10))
PARTITION BY KEY(c1)
(PARTITION p1 ,
PARTITION p2 ,
PARTITION p3 ,
PARTITION p4
);
INSERT INTO t1 VALUES(1,1,'A'),(2,2,'B'),(3,3,'C'),(4,4,'D'),(5,5,'E'),(6,6,'F'),(7,7,'H'),(8,8,'I');
ALTER TABLE t1 CHANGE c1 c1 INT ZEROFILL AUTO_INCREMENT COMMENT'修改分区键列为自增列';
SHOW CREATE TABLE t1;
Table	Create Table
t1	CREATE TABLE `t1` (
  `c0` float(5,0) DEFAULT NULL,
  `c1` int(10) unsigned zerofill NOT NULL AUTO_INCREMENT COMMENT '修改分区键列为自增列',
  `c2` varchar(10) DEFAULT NULL,
  PRIMARY KEY (`c1`)
) ORGANIZATION INDEX AUTO_INCREMENT = 9 AUTO_INCREMENT_MODE = 'ORDER' DEFAULT CHARSET = utf8mb4 ROW_FORMAT = DYNAMIC COMPRESSION = 'zstd_1.3.8' REPLICA_NUM = 1 BLOCK_SIZE = 16384 USE_BLOOM_FILTER = FALSE ENABLE_MACRO_BLOCK_BLOOM_FILTER = FALSE TABLET_SIZE = 134217728 PCTFREE = 0
 partition by key(c1)
(partition `p1`,
partition `p2`,
partition `p3`,
partition `p4`)
INSERT INTO t1 VALUES(9,-1,'J');
ERROR 22003: Out of range value for column 'c1' at row 1
INSERT INTO t1 VALUES(9,4294967296,'J');
ERROR 22003: Out of range value for column 'c1' at row 1
INSERT INTO t1 VALUES(9,0,'J'),(10,4294967295,'K');
SELECT * FROM t1 ORDER BY 1;
c0	c1	c2
1	0000000001	A
2	0000000002	B
3	0000000003	C
4	0000000004	D
5	0000000005	E
6	0000000006	F
7	0000000007	H
8	0000000008	I
9	0000000000	J
10	4294967295	K
INSERT INTO t1(c0,c2) VALUES(11,'L'),(12,'M');
ERROR 23000: Duplicate entry '4294967295' for key 'PRIMARY'
INSERT INTO t1 VALUES(11,NULL,'L'),(12,NULL,'M');
ERROR 23000: Duplicate entry '4294967295' for key 'PRIMARY'
SELECT * FROM t1 ORDER BY 1;
c0	c1	c2
1	0000000001	A
2	0000000002	B
3	0000000003	C
4	0000000004	D
5	0000000005	E
6	0000000006	F
7	0000000007	H
8	0000000008	I
9	0000000000	J
10	4294967295	K
#HASH分区，修改分区键为自增列，然后校验边界值
DROP TABLE IF EXISTS t1;
CREATE TABLE t1(c0 FLOAT(5,0),
c1 INT PRIMARY KEY,
c2 VARCHAR(10))
PARTITION BY HASH(c1)
(PARTITION p1 ,
PARTITION p2 ,
PARTITION p3 ,
PARTITION p4
);
INSERT INTO t1 VALUES(1,1,'A'),(2,2,'B'),(3,3,'C'),(4,4,'D'),(5,5,'E'),(6,6,'F'),(7,7,'H'),(8,8,'I');
ALTER TABLE t1 MODIFY c1 TINYINT AUTO_INCREMENT COMMENT'修改分区键列为自增列';
SHOW CREATE TABLE t1;
Table	Create Table
t1	CREATE TABLE `t1` (
  `c0` float(5,0) DEFAULT NULL,
  `c1` tinyint(4) NOT NULL AUTO_INCREMENT COMMENT '修改分区键列为自增列',
  `c2` varchar(10) DEFAULT NULL,
  PRIMARY KEY (`c1`)
) ORGANIZATION INDEX AUTO_INCREMENT = 9 AUTO_INCREMENT_MODE = 'ORDER' DEFAULT CHARSET = utf8mb4 ROW_FORMAT = DYNAMIC COMPRESSION = 'zstd_1.3.8' REPLICA_NUM = 1 BLOCK_SIZE = 16384 USE_BLOOM_FILTER = FALSE ENABLE_MACRO_BLOCK_BLOOM_FILTER = FALSE TABLET_SIZE = 134217728 PCTFREE = 0
 partition by hash(c1)
(partition `p1`,
partition `p2`,
partition `p3`,
partition `p4`)
INSERT INTO t1 VALUES(9,-129,'J');
ERROR 22003: Out of range value for column 'c1' at row 1
INSERT INTO t1 VALUES(9,128,'J');
ERROR 22003: Out of range value for column 'c1' at row 1
#此处报错同上面的原因一致，待修复后执行sql
UPDATE t1 SET c1=-129 WHERE c0=1;
ERROR 22003: Out of range value for column 'c1' at row 1
UPDATE t1 SET c1=128 WHERE c0=1;
ERROR 22003: Out of range value for column 'c1' at row 1
#RANGE_COLUMN分区，修改分区键为自增列，然后校验边界值
DROP TABLE IF EXISTS t1;
CREATE TABLE t1(c0 FLOAT(5,0),
c1 INT(5),
c2 VARCHAR(10),
UNIQUE KEY(c1,c2))
PARTITION BY RANGE COLUMNS(c1,c2)
(PARTITION p1 VALUES LESS THAN(100,'F'),
PARTITION p2 VALUES LESS THAN(200,'L'),
PARTITION p3 VALUES LESS THAN(300,'T'),
PARTITION p4 VALUES LESS THAN(MAXVALUE,MAXVALUE)
);
INSERT INTO t1 VALUES(1,1,'A'),(2,2,'B'),(3,3,'C'),(4,4,'D'),(5,5,'E'),(6,6,'F'),(7,7,'H'),(8,8,'I');
#此处修改报错，为已知问题，待开发修复后执行sql
#复制中，修改普通列为自增列，插入、修改值为边界值校验
DROP TABLE IF EXISTS t1;
CREATE TABLE t1(c0 INT(4) ZEROFILL,
c1 FLOAT ,
c2 VARCHAR(10),
c3 YEAR);
INSERT INTO t1 VALUES(1,1.0,'a','2000'),
(2,1.1,'b','2001'),
(3,1.2,'c','2002'),
(4,1.3,'d','2003'),
(5,1.4,'e','2004'),
(6,1.5,'f','2005'),
(7,1.6,'g','2006'),
(8,1.7,'h','2007'),
(9,1.8,'i','2008'),
(10,1.9,'j','2009'),
(11,2.0,'k','2010'),
(12,2.1,'l','2011');
CREATE INDEX ind_1 ON t1(c1);
CREATE INDEX ind_2 ON t1(c2,c3);
DROP TABLE IF EXISTS t2;
CREATE TABLE t2 AS SELECT * FROM t1;
SELECT * FROM t2 ORDER BY 1;
c0	c1	c2	c3
0001	1	a	2000
0002	1.1	b	2001
0003	1.2	c	2002
0004	1.3	d	2003
0005	1.4	e	2004
0006	1.5	f	2005
0007	1.6	g	2006
0008	1.7	h	2007
0009	1.8	i	2008
0010	1.9	j	2009
0011	2	k	2010
0012	2.1	l	2011
SHOW CREATE TABLE t2;
Table	Create Table
t2	CREATE TABLE `t2` (
  `c0` int(4) unsigned zerofill DEFAULT NULL,
  `c1` float DEFAULT NULL,
  `c2` varchar(10) DEFAULT NULL,
  `c3` year(4) DEFAULT NULL
) ORGANIZATION INDEX DEFAULT CHARSET = utf8mb4 ROW_FORMAT = DYNAMIC COMPRESSION = 'zstd_1.3.8' REPLICA_NUM = 1 BLOCK_SIZE = 16384 USE_BLOOM_FILTER = FALSE ENABLE_MACRO_BLOCK_BLOOM_FILTER = FALSE TABLET_SIZE = 134217728 PCTFREE = 0
ALTER TABLE t2 MODIFY c3 INT PRIMARY KEY AUTO_INCREMENT AFTER c1,MODIFY c2 CHAR(5),MODIFY c1 DOUBLE(5,0);
SHOW CREATE TABLE t2;
Table	Create Table
t2	CREATE TABLE `t2` (
  `c0` int(4) unsigned zerofill DEFAULT NULL,
  `c1` double(5,0) DEFAULT NULL,
  `c3` int(11) NOT NULL AUTO_INCREMENT,
  `c2` char(5) DEFAULT NULL,
  PRIMARY KEY (`c3`)
) ORGANIZATION INDEX AUTO_INCREMENT = 2012 AUTO_INCREMENT_MODE = 'ORDER' DEFAULT CHARSET = utf8mb4 ROW_FORMAT = DYNAMIC COMPRESSION = 'zstd_1.3.8' REPLICA_NUM = 1 BLOCK_SIZE = 16384 USE_BLOOM_FILTER = FALSE ENABLE_MACRO_BLOCK_BLOOM_FILTER = FALSE TABLET_SIZE = 134217728 PCTFREE = 0
SELECT * FROM t2 ORDER BY 1;
c0	c1	c3	c2
0001	1	2000	a
0002	1	2001	b
0003	1	2002	c
0004	1	2003	d
0005	1	2004	e
0006	1	2005	f
0007	2	2006	g
0008	2	2007	h
0009	2	2008	i
0010	2	2009	j
0011	2	2010	k
0012	2	2011	l
INSERT INTO t2(c0,c1,c2,c3) VALUES(13,2.1,'m',NULL),(14,1.0,'n',NULL),(15,3.0,'o',1500),(16,3.1,'p',-3000),(17,3.2,'q',NULL),(18,4.0,'r',NULL);
SELECT * FROM t2 ORDER BY 1;
c0	c1	c3	c2
0001	1	2000	a
0002	1	2001	b
0003	1	2002	c
0004	1	2003	d
0005	1	2004	e
0006	1	2005	f
0007	2	2006	g
0008	2	2007	h
0009	2	2008	i
0010	2	2009	j
0011	2	2010	k
0012	2	2011	l
0013	2	2012	m
0014	1	2013	n
0015	3	1500	o
0016	3	-3000	p
0017	3	2014	q
0018	4	2015	r
INSERT INTO t2(c0,c1,c2,c3) VALUES(19,5.0,'s',2147483647),(20,5.2,'t',NULL);
ERROR 23000: Duplicate entry '2147483647' for key 'PRIMARY'
SELECT * FROM t2 ORDER BY 1;
c0	c1	c3	c2
0001	1	2000	a
0002	1	2001	b
0003	1	2002	c
0004	1	2003	d
0005	1	2004	e
0006	1	2005	f
0007	2	2006	g
0008	2	2007	h
0009	2	2008	i
0010	2	2009	j
0011	2	2010	k
0012	2	2011	l
0013	2	2012	m
0014	1	2013	n
0015	3	1500	o
0016	3	-3000	p
0017	3	2014	q
0018	4	2015	r
INSERT INTO t2(c0,c1,c2) VALUES(21,5.3,'u'),(22,5.4,'v');
ERROR 23000: Duplicate entry '2147483647' for key 'PRIMARY'
SELECT * FROM t2 ORDER BY 1;
c0	c1	c3	c2
0001	1	2000	a
0002	1	2001	b
0003	1	2002	c
0004	1	2003	d
0005	1	2004	e
0006	1	2005	f
0007	2	2006	g
0008	2	2007	h
0009	2	2008	i
0010	2	2009	j
0011	2	2010	k
0012	2	2011	l
0013	2	2012	m
0014	1	2013	n
0015	3	1500	o
0016	3	-3000	p
0017	3	2014	q
0018	4	2015	r
INSERT INTO t2(c0,c1,c2) VALUES(21,5.3,'u');
SELECT * FROM t2 ORDER BY 1;
c0	c1	c3	c2
0001	1	2000	a
0002	1	2001	b
0003	1	2002	c
0004	1	2003	d
0005	1	2004	e
0006	1	2005	f
0007	2	2006	g
0008	2	2007	h
0009	2	2008	i
0010	2	2009	j
0011	2	2010	k
0012	2	2011	l
0013	2	2012	m
0014	1	2013	n
0015	3	1500	o
0016	3	-3000	p
0017	3	2014	q
0018	4	2015	r
0021	5	2147483647	u
INSERT INTO t2(c0,c1,c2) VALUES(22,5.4,'v');
ERROR 23000: Duplicate entry '2147483647' for key 'PRIMARY'
DROP TABLE IF EXISTS t2;
CREATE TABLE t2 LIKE t1;
INSERT INTO t2 SELECT * FROM t1;
SELECT * FROM t2 ORDER BY c0;
c0	c1	c2	c3
0001	1	a	2000
0002	1.1	b	2001
0003	1.2	c	2002
0004	1.3	d	2003
0005	1.4	e	2004
0006	1.5	f	2005
0007	1.6	g	2006
0008	1.7	h	2007
0009	1.8	i	2008
0010	1.9	j	2009
0011	2	k	2010
0012	2.1	l	2011
SHOW CREATE TABLE t2;
Table	Create Table
t2	CREATE TABLE `t2` (
  `c0` int(4) unsigned zerofill DEFAULT NULL,
  `c1` float DEFAULT NULL,
  `c2` varchar(10) DEFAULT NULL,
  `c3` year(4) DEFAULT NULL,
  KEY `ind_1` (`c1`) BLOCK_SIZE 16384 LOCAL,
  KEY `ind_2` (`c2`, `c3`) BLOCK_SIZE 16384 LOCAL
) ORGANIZATION INDEX DEFAULT CHARSET = utf8mb4 ROW_FORMAT = DYNAMIC COMPRESSION = 'zstd_1.3.8' REPLICA_NUM = 1 BLOCK_SIZE = 16384 USE_BLOOM_FILTER = FALSE ENABLE_MACRO_BLOCK_BLOOM_FILTER = FALSE TABLET_SIZE = 134217728 PCTFREE = 0
ALTER TABLE t2 MODIFY c3 INT(4) AUTO_INCREMENT AFTER c1,MODIFY c2 CHAR(5) AFTER c3,MODIFY c1 DOUBLE(5,0) PRIMARY KEY AUTO_INCREMENT;
ERROR 0A000: More than one auto increment column not supported
ALTER TABLE t2 MODIFY c3 INT(4) AUTO_INCREMENT AFTER c1,MODIFY c2 CHAR(5) AFTER c3,MODIFY c1 DOUBLE(5,0);
SHOW CREATE TABLE t2;
Table	Create Table
t2	CREATE TABLE `t2` (
  `c0` int(4) unsigned zerofill DEFAULT NULL,
  `c1` double(5,0) DEFAULT NULL,
  `c3` int(4) NOT NULL AUTO_INCREMENT,
  `c2` char(5) DEFAULT NULL,
  KEY `ind_1` (`c1`) BLOCK_SIZE 16384 LOCAL,
  KEY `ind_2` (`c2`, `c3`) BLOCK_SIZE 16384 LOCAL
) ORGANIZATION INDEX AUTO_INCREMENT = 2012 AUTO_INCREMENT_MODE = 'ORDER' DEFAULT CHARSET = utf8mb4 ROW_FORMAT = DYNAMIC COMPRESSION = 'zstd_1.3.8' REPLICA_NUM = 1 BLOCK_SIZE = 16384 USE_BLOOM_FILTER = FALSE ENABLE_MACRO_BLOCK_BLOOM_FILTER = FALSE TABLET_SIZE = 134217728 PCTFREE = 0
SELECT * FROM t2 ORDER BY 1;
c0	c1	c3	c2
0001	1	2000	a
0002	1	2001	b
0003	1	2002	c
0004	1	2003	d
0005	1	2004	e
0006	1	2005	f
0007	2	2006	g
0008	2	2007	h
0009	2	2008	i
0010	2	2009	j
0011	2	2010	k
0012	2	2011	l
INSERT INTO t2(c0,c1,c2,c3) VALUES(19,5.0,'s',2147483647),(20,5.2,'t',NULL);
SELECT * FROM t2 ORDER BY 1;
c0	c1	c3	c2
0001	1	2000	a
0002	1	2001	b
0003	1	2002	c
0004	1	2003	d
0005	1	2004	e
0006	1	2005	f
0007	2	2006	g
0008	2	2007	h
0009	2	2008	i
0010	2	2009	j
0011	2	2010	k
0012	2	2011	l
0019	5	2147483647	s
0020	5	2147483647	t
INSERT INTO t2(c0,c1,c2) VALUES(21,5.3,'u'),(22,5.4,'v');
SELECT * FROM t2 ORDER BY 1;
c0	c1	c3	c2
0001	1	2000	a
0002	1	2001	b
0003	1	2002	c
0004	1	2003	d
0005	1	2004	e
0006	1	2005	f
0007	2	2006	g
0008	2	2007	h
0009	2	2008	i
0010	2	2009	j
0011	2	2010	k
0012	2	2011	l
0019	5	2147483647	s
0020	5	2147483647	t
0021	5	2147483647	u
0022	5	2147483647	v
INSERT INTO t2(c0,c1,c2,c3) VALUES(23,5.5,'w',2147483648);
ERROR 22003: Out of range value for column 'c3' at row 1
SELECT * FROM t2 ORDER BY 1;
c0	c1	c3	c2
0001	1	2000	a
0002	1	2001	b
0003	1	2002	c
0004	1	2003	d
0005	1	2004	e
0006	1	2005	f
0007	2	2006	g
0008	2	2007	h
0009	2	2008	i
0010	2	2009	j
0011	2	2010	k
0012	2	2011	l
0019	5	2147483647	s
0020	5	2147483647	t
0021	5	2147483647	u
0022	5	2147483647	v
DROP TABLE IF EXISTS t1;
CREATE TABLE t1(c0 INT(4) ZEROFILL,
c1 FLOAT NOT NULL UNIQUE,
c2 VARCHAR(5) DEFAULT 'TEST',
c3 YEAR,
PRIMARY KEY (c0,c3));
INSERT INTO t1 VALUES(1,1.0,'a','2000'),
(2,1.1,'b','2001'),
(3,1.2,'c','2002'),
(4,1.3,'d','2003'),
(5,1.4,'e','2004'),
(6,1.5,'f','2005'),
(7,1.6,'g','2006'),
(8,1.7,'h','2007'),
(9,1.8,'i','2008'),
(10,1.9,'j','2009'),
(11,2.0,'k','2010'),
(12,2.1,'l','2011');
CREATE INDEX ind_1 ON t1(c1);
CREATE INDEX ind_2 ON t1(c2,c3);
DROP TABLE IF EXISTS t2;
CREATE TABLE t2 LIKE t1;
INSERT INTO t2 SELECT * FROM t1;
SELECT * FROM t2 ORDER BY c0;
c0	c1	c2	c3
0001	1	a	2000
0002	1.1	b	2001
0003	1.2	c	2002
0004	1.3	d	2003
0005	1.4	e	2004
0006	1.5	f	2005
0007	1.6	g	2006
0008	1.7	h	2007
0009	1.8	i	2008
0010	1.9	j	2009
0011	2	k	2010
0012	2.1	l	2011
SHOW CREATE TABLE t2;
Table	Create Table
t2	CREATE TABLE `t2` (
  `c0` int(4) unsigned zerofill NOT NULL,
  `c1` float NOT NULL,
  `c2` varchar(5) DEFAULT 'TEST',
  `c3` year(4) NOT NULL,
  PRIMARY KEY (`c0`, `c3`),
  UNIQUE KEY `c1` (`c1`) BLOCK_SIZE 16384 LOCAL,
  KEY `ind_1` (`c1`) BLOCK_SIZE 16384 LOCAL,
  KEY `ind_2` (`c2`, `c3`) BLOCK_SIZE 16384 LOCAL
) ORGANIZATION INDEX DEFAULT CHARSET = utf8mb4 ROW_FORMAT = DYNAMIC COMPRESSION = 'zstd_1.3.8' REPLICA_NUM = 1 BLOCK_SIZE = 16384 USE_BLOOM_FILTER = FALSE ENABLE_MACRO_BLOCK_BLOOM_FILTER = FALSE TABLET_SIZE = 134217728 PCTFREE = 0
ALTER TABLE t2 MODIFY c0 INT AUTO_INCREMENT AFTER c1,MODIFY c3 INT AUTO_INCREMENT FIRST,MODIFY c1 FLOAT(5,0);
ERROR 0A000: More than one auto increment column not supported
ALTER TABLE t2 MODIFY c0 INT AUTO_INCREMENT AFTER c1,MODIFY c3 INT FIRST,MODIFY c1 DOUBLE;
INSERT INTO t2(c0,c1,c2,c3) VALUES(NULL,2.1,'m',10),(NULL,3.0,'n',11),(25,4.0,'o',1500),(-116,5.1,'p',-3000),(NULL,6.2,'q',0),(NULL,7.0,'r',-100);
SELECT * FROM t2 ORDER BY 1;
c3	c1	c0	c2
-3000	5.1	-116	p
-100	7	27	r
0	6.2	26	q
10	2.1	13	m
11	3	14	n
1500	4	25	o
2000	1	1	a
2001	1.100000023841858	2	b
2002	1.2000000476837158	3	c
2003	1.2999999523162842	4	d
2004	1.399999976158142	5	e
2005	1.5	6	f
2006	1.600000023841858	7	g
2007	1.7000000476837158	8	h
2008	1.7999999523162842	9	i
2009	1.899999976158142	10	j
2010	2	11	k
2011	2.0999999046325684	12	l
INSERT INTO t2(c0,c1,c2,c3) VALUES(2147483647,5.0,'s',2022),(NULL,5.2,'t',2022);
ERROR 23000: Duplicate entry '2147483647-2022' for key 'PRIMARY'
SELECT * FROM t2 ORDER BY c0;
c3	c1	c0	c2
-3000	5.1	-116	p
2000	1	1	a
2001	1.100000023841858	2	b
2002	1.2000000476837158	3	c
2003	1.2999999523162842	4	d
2004	1.399999976158142	5	e
2005	1.5	6	f
2006	1.600000023841858	7	g
2007	1.7000000476837158	8	h
2008	1.7999999523162842	9	i
2009	1.899999976158142	10	j
2010	2	11	k
2011	2.0999999046325684	12	l
10	2.1	13	m
11	3	14	n
1500	4	25	o
0	6.2	26	q
-100	7	27	r
INSERT INTO t2(c3,c1,c2) VALUES(2022,5.3,'u'),(2022,5.4,'v');
ERROR 23000: Duplicate entry '2147483647-2022' for key 'PRIMARY'
SELECT * FROM t2 ORDER BY 1;
c3	c1	c0	c2
-3000	5.1	-116	p
-100	7	27	r
0	6.2	26	q
10	2.1	13	m
11	3	14	n
1500	4	25	o
2000	1	1	a
2001	1.100000023841858	2	b
2002	1.2000000476837158	3	c
2003	1.2999999523162842	4	d
2004	1.399999976158142	5	e
2005	1.5	6	f
2006	1.600000023841858	7	g
2007	1.7000000476837158	8	h
2008	1.7999999523162842	9	i
2009	1.899999976158142	10	j
2010	2	11	k
2011	2.0999999046325684	12	l
INSERT INTO t2(c3,c1,c2) VALUES(2022,5.3,'u'),(2023,5.4,'v');
SELECT * FROM t2 ORDER BY 1;
c3	c1	c0	c2
-3000	5.1	-116	p
-100	7	27	r
0	6.2	26	q
10	2.1	13	m
11	3	14	n
1500	4	25	o
2000	1	1	a
2001	1.100000023841858	2	b
2002	1.2000000476837158	3	c
2003	1.2999999523162842	4	d
2004	1.399999976158142	5	e
2005	1.5	6	f
2006	1.600000023841858	7	g
2007	1.7000000476837158	8	h
2008	1.7999999523162842	9	i
2009	1.899999976158142	10	j
2010	2	11	k
2011	2.0999999046325684	12	l
2022	5.3	2147483647	u
2023	5.4	2147483647	v
INSERT INTO t2(c0,c1,c2,c3) VALUES(2147483648,5.4,'v',2023);
ERROR 22003: Out of range value for column 'c0' at row 1
SELECT * FROM t2 ORDER BY 1;
c3	c1	c0	c2
-3000	5.1	-116	p
-100	7	27	r
0	6.2	26	q
10	2.1	13	m
11	3	14	n
1500	4	25	o
2000	1	1	a
2001	1.100000023841858	2	b
2002	1.2000000476837158	3	c
2003	1.2999999523162842	4	d
2004	1.399999976158142	5	e
2005	1.5	6	f
2006	1.600000023841858	7	g
2007	1.7000000476837158	8	h
2008	1.7999999523162842	9	i
2009	1.899999976158142	10	j
2010	2	11	k
2011	2.0999999046325684	12	l
2022	5.3	2147483647	u
2023	5.4	2147483647	v
#普通表中，修改普通列为自增列，然后创建视图，在视图中插入、修改值为边界值校验
DROP TABLE IF EXISTS t2;
DROP TABLE IF EXISTS t1;
CREATE TABLE t1(c0 INT(4),
c1 FLOAT ,
c2 VARCHAR(10),
c3 YEAR);
INSERT INTO t1 VALUES(-1,1.0,'a','2000'),
(-2,1.1,'b','2001'),
(0,1.2,'c','2002'),
(NULL,1.3,'d','2003'),
(NULL,1.4,'e','2004'),
(16,1.5,'f','2005'),
(7,1.6,'g','2006'),
(18,1.7,'h','2007'),
(-90,1.8,'i','2011'),
(NULL,1.9,'j','2012'),
(11,2.0,'k','2011'),
(NULL,2.1,'l','2012');
ALTER TABLE t1 CHANGE c0 c0 INT AUTO_INCREMENT,CHANGE c1 c1 INT,ADD UNIQUE KEY uni_key(c0,c1);
SHOW CREATE TABLE t1;
Table	Create Table
t1	CREATE TABLE `t1` (
  `c0` int(11) NOT NULL AUTO_INCREMENT,
  `c1` int(11) DEFAULT NULL,
  `c2` varchar(10) DEFAULT NULL,
  `c3` year(4) DEFAULT NULL,
  UNIQUE KEY `uni_key` (`c0`, `c1`) BLOCK_SIZE 16384 LOCAL
) ORGANIZATION INDEX AUTO_INCREMENT = 19 AUTO_INCREMENT_MODE = 'ORDER' DEFAULT CHARSET = utf8mb4 ROW_FORMAT = DYNAMIC COMPRESSION = 'zstd_1.3.8' REPLICA_NUM = 1 BLOCK_SIZE = 16384 USE_BLOOM_FILTER = FALSE ENABLE_MACRO_BLOCK_BLOOM_FILTER = FALSE TABLET_SIZE = 134217728 PCTFREE = 0
DROP VIEW IF EXISTS v1;
CREATE VIEW v1 AS SELECT * FROM t1;
DESC v1;
Field	Type	Null	Key	Default	Extra
c0	int(11)	NO		NULL	
c1	int(11)	YES		NULL	
c2	varchar(10)	YES		NULL	
c3	year(4)	YES		NULL	
SELECT * FROM v1 ORDER BY 1;
c0	c1	c2	c3
-90	2	i	2011
-2	1	b	2001
-1	1	a	2000
0	1	c	2002
4	1	d	2003
5	1	e	2004
7	2	g	2006
10	2	j	2012
11	2	k	2011
12	2	l	2012
16	2	f	2005
18	2	h	2007
INSERT INTO v1 VALUES(NULL,3.0,'m','2013'),(NULL,3.0,'m','2013'),(2147483648,3.0,'m','2013');
ERROR 22003: Out of range value for column 'c0' at row 3
SELECT * FROM v1 ORDER BY 1;
c0	c1	c2	c3
-90	2	i	2011
-2	1	b	2001
-1	1	a	2000
0	1	c	2002
4	1	d	2003
5	1	e	2004
7	2	g	2006
10	2	j	2012
11	2	k	2011
12	2	l	2012
16	2	f	2005
18	2	h	2007
INSERT INTO v1 VALUES(NULL,3.0,'m','2013'),(NULL,4.0,'n','2014'),(2147483647,5.0,'o','2015'),(NULL,6.0,'p','2016'),(NULL,7.0,'q','2017');
SELECT * FROM v1 ORDER BY 1,2,3;
c0	c1	c2	c3
-90	2	i	2011
-2	1	b	2001
-1	1	a	2000
0	1	c	2002
4	1	d	2003
5	1	e	2004
7	2	g	2006
10	2	j	2012
11	2	k	2011
12	2	l	2012
16	2	f	2005
18	2	h	2007
22	3	m	2013
23	4	n	2014
2147483647	5	o	2015
2147483647	6	p	2016
2147483647	7	q	2017
SELECT * FROM t1 ORDER BY 1,2,3;
c0	c1	c2	c3
-90	2	i	2011
-2	1	b	2001
-1	1	a	2000
0	1	c	2002
4	1	d	2003
5	1	e	2004
7	2	g	2006
10	2	j	2012
11	2	k	2011
12	2	l	2012
16	2	f	2005
18	2	h	2007
22	3	m	2013
23	4	n	2014
2147483647	5	o	2015
2147483647	6	p	2016
2147483647	7	q	2017
INSERT INTO v1 VALUES(NULL,7.0,'p','2016');
ERROR 23000: Duplicate entry '2147483647-7' for key 'uni_key'
INSERT INTO v1(c1,c2,c3) VALUES(7.0,'q','2017');
ERROR 23000: Duplicate entry '2147483647-7' for key 'uni_key'
UPDATE v1 SET c0=-2147483648 WHERE c3='2015';
INSERT INTO v1(c1,c2,c3) VALUES(8.2,'q','2017'),(9.3,'r','2018');
SELECT * FROM v1 ORDER BY 1,2,3;
c0	c1	c2	c3
-2147483648	5	o	2015
-90	2	i	2011
-2	1	b	2001
-1	1	a	2000
0	1	c	2002
4	1	d	2003
5	1	e	2004
7	2	g	2006
10	2	j	2012
11	2	k	2011
12	2	l	2012
16	2	f	2005
18	2	h	2007
22	3	m	2013
23	4	n	2014
2147483647	6	p	2016
2147483647	7	q	2017
2147483647	8	q	2017
2147483647	9	r	2018
SELECT * FROM t1 ORDER BY 1,2,3;
c0	c1	c2	c3
-2147483648	5	o	2015
-90	2	i	2011
-2	1	b	2001
-1	1	a	2000
0	1	c	2002
4	1	d	2003
5	1	e	2004
7	2	g	2006
10	2	j	2012
11	2	k	2011
12	2	l	2012
16	2	f	2005
18	2	h	2007
22	3	m	2013
23	4	n	2014
2147483647	6	p	2016
2147483647	7	q	2017
2147483647	8	q	2017
2147483647	9	r	2018
UPDATE v1 SET c0=-2147483649 WHERE c3='2018';
ERROR 22003: Out of range value for column 'c0' at row 1
#临时表中，修改普通列为自增列，插入、修改值为边界值校验
DROP VIEW IF EXISTS v1;
DROP TABLE IF EXISTS t2;
DROP TABLE IF EXISTS t1;
#########Empty recycle bin, delete test database, tables, etc##########
purge recyclebin;
