purge recyclebin;
CREATE DATABASE IF NOT EXISTS naaj_test;
USE naaj_test;
SET sql_mode='STRICT_ALL_TABLES,NO_ZERO_IN_DATE,NO_AUTO_VALUE_ON_ZERO';
####################不同数据类型列修改列为自增列/新增列为自增列并执行DML操作##############################
DROP TABLE IF EXISTS t1;
CREATE TABLE t1(c0 INT(5),
c1 FLOAT(5,0) NOT NULL,
c2 DOUBLE(5,0));
INSERT INTO t1 VALUES(0,1.5,1),
(1,2.5,2),
(1,3.5,3),
(NULL,4.5,4),
(3,5.5,5),
(0,6.5,6),
(7,7.5,7),
(NULL,8.5,8),
(9,9.5,9),
(11,10.5,10),
(0,11.5,11),
(12,12.5,12),
(13,13.5,13);
ALTER TABLE t1 MODIFY c0 INT(5) AUTO_INCREMENT;
SHOW CREATE TABLE t1;
Table	Create Table
t1	CREATE TABLE `t1` (
  `c0` int(5) NOT NULL AUTO_INCREMENT,
  `c1` float(5,0) NOT NULL,
  `c2` double(5,0) DEFAULT NULL
) ORGANIZATION INDEX AUTO_INCREMENT = 14 AUTO_INCREMENT_MODE = 'ORDER' DEFAULT CHARSET = utf8mb4 ROW_FORMAT = DYNAMIC COMPRESSION = 'zstd_1.3.8' REPLICA_NUM = 1 BLOCK_SIZE = 16384 USE_BLOOM_FILTER = FALSE ENABLE_MACRO_BLOCK_BLOOM_FILTER = FALSE TABLET_SIZE = 134217728 PCTFREE = 0
SELECT c0 FROM t1 ORDER BY 1;
c0
0
0
0
1
1
3
4
7
8
9
11
12
13
INSERT INTO t1(c1,c2) VALUES(14.5,14);
SELECT c0 FROM t1 ORDER BY 1;
c0
0
0
0
1
1
3
4
7
8
9
11
12
13
14
INSERT INTO t1(c1,c2) VALUES(14.5,14);
SELECT c0 FROM t1 ORDER BY 1;
c0
0
0
0
1
1
3
4
7
8
9
11
12
13
14
15
INSERT INTO t1 VALUES(NULL,14.5,14);
SELECT c0 FROM t1 ORDER BY 1;
c0
0
0
0
1
1
3
4
7
8
9
11
12
13
14
15
16
INSERT INTO t1 VALUES(3,15.5,15);
SELECT c0 FROM t1 ORDER BY 1;
c0
0
0
0
1
1
3
3
4
7
8
9
11
12
13
14
15
16
SET auto_increment_increment=2;
INSERT INTO t1(c1,c2) VALUES(14.5,14);
SELECT c0 FROM t1 ORDER BY 1;
c0
0
0
0
1
1
3
3
4
7
8
9
11
12
13
14
15
16
17
INSERT INTO t1(c1,c2) VALUES(14.5,14);
SELECT c0 FROM t1 ORDER BY 1;
c0
0
0
0
1
1
3
3
4
7
8
9
11
12
13
14
15
16
17
19
SET auto_increment_increment=1;
DROP TABLE IF EXISTS t1;
CREATE TABLE t1(c0 INT(5),
c1 FLOAT(5,0) NOT NULL,
c2 DOUBLE(5,0));
INSERT INTO t1 VALUES(0,1.5,1),
(-1,2.5,2),
(1,3.5,3),
(-2,4.5,4),
(3,5.5,5),
(-6,6.5,6),
(7,7.5,7),
(-8,8.5,8),
(9,9.5,9),
(-10,10.5,10),
(11,11.5,11),
(12,12.5,12),
(-13,13.5,13);
ALTER TABLE t1 CHANGE c0 c0 INT(5) AUTO_INCREMENT;
SHOW CREATE TABLE t1;
Table	Create Table
t1	CREATE TABLE `t1` (
  `c0` int(5) NOT NULL AUTO_INCREMENT,
  `c1` float(5,0) NOT NULL,
  `c2` double(5,0) DEFAULT NULL
) ORGANIZATION INDEX AUTO_INCREMENT = 13 AUTO_INCREMENT_MODE = 'ORDER' DEFAULT CHARSET = utf8mb4 ROW_FORMAT = DYNAMIC COMPRESSION = 'zstd_1.3.8' REPLICA_NUM = 1 BLOCK_SIZE = 16384 USE_BLOOM_FILTER = FALSE ENABLE_MACRO_BLOCK_BLOOM_FILTER = FALSE TABLET_SIZE = 134217728 PCTFREE = 0
SELECT c0 FROM t1 ORDER BY 1;
c0
-13
-10
-8
-6
-2
-1
0
1
3
7
9
11
12
INSERT INTO t1(c1,c2) VALUES(14.5,14);
SELECT c0 FROM t1 ORDER BY 1;
c0
-13
-10
-8
-6
-2
-1
0
1
3
7
9
11
12
13
INSERT INTO t1(c1,c2) VALUES(14.5,14);
SELECT c0 FROM t1 ORDER BY 1;
c0
-13
-10
-8
-6
-2
-1
0
1
3
7
9
11
12
13
14
INSERT INTO t1 VALUES(-11,14.5,14);
SELECT c0 FROM t1 ORDER BY 1;
c0
-13
-11
-10
-8
-6
-2
-1
0
1
3
7
9
11
12
13
14
DELETE FROM t1 WHERE c0>-5;
COMMIT;
SELECT c0 FROM t1 ORDER BY 1;
c0
-13
-11
-10
-8
-6
INSERT INTO t1(c1,c2) VALUES(14.5,14);
SELECT c0 FROM t1 ORDER BY 1;
c0
-13
-11
-10
-8
-6
15
DROP TABLE IF EXISTS t1;
CREATE TABLE t1(c0 INT(5),
c1 FLOAT(5,0) NOT NULL,
c2 DOUBLE(5,0));
INSERT INTO t1 VALUES(-4,1.5,1),(-5,2.5,2),(-11,3.5,3),(-2,4.5,4),(-3,5.5,5),(-6,6.5,6);
ALTER TABLE t1 CHANGE c0 c0 INT(5) AUTO_INCREMENT;
SHOW CREATE TABLE t1;
Table	Create Table
t1	CREATE TABLE `t1` (
  `c0` int(5) NOT NULL AUTO_INCREMENT,
  `c1` float(5,0) NOT NULL,
  `c2` double(5,0) DEFAULT NULL
) ORGANIZATION INDEX AUTO_INCREMENT = 1 AUTO_INCREMENT_MODE = 'ORDER' DEFAULT CHARSET = utf8mb4 ROW_FORMAT = DYNAMIC COMPRESSION = 'zstd_1.3.8' REPLICA_NUM = 1 BLOCK_SIZE = 16384 USE_BLOOM_FILTER = FALSE ENABLE_MACRO_BLOCK_BLOOM_FILTER = FALSE TABLET_SIZE = 134217728 PCTFREE = 0
SELECT c0 FROM t1 ORDER BY 1;
c0
-11
-6
-5
-4
-3
-2
INSERT INTO t1(c1,c2) VALUES(14.5,14);
SELECT c0 FROM t1 ORDER BY 1;
c0
-11
-6
-5
-4
-3
-2
1
DROP TABLE IF EXISTS t1;
CREATE TABLE t1(c0 INT(5),c1 FLOAT NOT NULL);
INSERT INTO t1 VALUES(1,1.5),(2,2.5),(3,3.5),(4,4.5),(5,5.5),(6,6.5);
ALTER TABLE t1 MODIFY c1 FLOAT PRIMARY KEY AUTO_INCREMENT;
SHOW CREATE TABLE t1;
Table	Create Table
t1	CREATE TABLE `t1` (
  `c0` int(5) DEFAULT NULL,
  `c1` float NOT NULL AUTO_INCREMENT,
  PRIMARY KEY (`c1`)
) ORGANIZATION INDEX AUTO_INCREMENT = 7 AUTO_INCREMENT_MODE = 'ORDER' DEFAULT CHARSET = utf8mb4 ROW_FORMAT = DYNAMIC COMPRESSION = 'zstd_1.3.8' REPLICA_NUM = 1 BLOCK_SIZE = 16384 USE_BLOOM_FILTER = FALSE ENABLE_MACRO_BLOCK_BLOOM_FILTER = FALSE TABLET_SIZE = 134217728 PCTFREE = 0
SELECT * FROM t1 ORDER BY 1;
c0	c1
1	1.5
2	2.5
3	3.5
4	4.5
5	5.5
6	6.5
INSERT INTO t1(c0) VALUES(7);
INSERT INTO t1(c0) VALUES(8);
SELECT * FROM t1 ORDER BY 1;
c0	c1
1	1.5
2	2.5
3	3.5
4	4.5
5	5.5
6	6.5
7	7
8	8
DROP TABLE IF EXISTS t1;
CREATE TABLE t1(c0 INT(5),c1 FLOAT(5,0));
INSERT INTO t1 VALUES(1,1.5),(2,2.5),(3,NULL),(4,4.5),(5,NULL),(6,6.5);
ALTER TABLE t1 MODIFY c1 FLOAT PRIMARY KEY AUTO_INCREMENT;
ALTER TABLE t1 MODIFY c1 FLOAT AUTO_INCREMENT;
SHOW CREATE TABLE t1;
Table	Create Table
t1	CREATE TABLE `t1` (
  `c0` int(5) DEFAULT NULL,
  `c1` float NOT NULL AUTO_INCREMENT,
  PRIMARY KEY (`c1`)
) ORGANIZATION INDEX AUTO_INCREMENT = 7 AUTO_INCREMENT_MODE = 'ORDER' DEFAULT CHARSET = utf8mb4 ROW_FORMAT = DYNAMIC COMPRESSION = 'zstd_1.3.8' REPLICA_NUM = 1 BLOCK_SIZE = 16384 USE_BLOOM_FILTER = FALSE ENABLE_MACRO_BLOCK_BLOOM_FILTER = FALSE TABLET_SIZE = 134217728 PCTFREE = 0
SELECT * FROM t1 ORDER BY 1;
c0	c1
1	1
2	2
3	3
4	4
5	5
6	6
INSERT INTO t1(c0) VALUES(7),(8);
SELECT * FROM t1 ORDER BY 1;
c0	c1
1	1
2	2
3	3
4	4
5	5
6	6
7	7
8	8
INSERT INTO t1(c0,c1) VALUES(9,NULL),(10,NULL),(11,15),(12,0),(13,NULL),(14,NULL);
SELECT * FROM t1 ORDER BY 1;
c0	c1
1	1
2	2
3	3
4	4
5	5
6	6
7	7
8	8
9	9
10	10
11	15
12	0
13	16
14	17
INSERT INTO t1(c0) VALUES(15),(16);
SELECT * FROM t1 ORDER BY 1;
c0	c1
1	1
2	2
3	3
4	4
5	5
6	6
7	7
8	8
9	9
10	10
11	15
12	0
13	16
14	17
15	18
16	19
DROP TABLE IF EXISTS t1;
CREATE TABLE t1(c0 INT(5),c1 FLOAT(5,0));
INSERT INTO t1 VALUES(1,NULL),(2,NULL),(3,NULL),(4,NULL),(5,NULL),(6,NULL);
ALTER TABLE t1 MODIFY c1 FLOAT PRIMARY KEY AUTO_INCREMENT;
SELECT * FROM t1 ORDER BY 1;
c0	c1
1	1
2	2
3	3
4	4
5	5
6	6
INSERT INTO t1 VALUES(7,NULL),(8,NULL);
SELECT * FROM t1 ORDER BY 1;
c0	c1
1	1
2	2
3	3
4	4
5	5
6	6
7	8
8	9
INSERT INTO t1 VALUES(9,15),(10,16),(11,0),(12,17);
SELECT * FROM t1 ORDER BY 1;
c0	c1
1	1
2	2
3	3
4	4
5	5
6	6
7	8
8	9
9	15
10	16
11	0
12	17
INSERT INTO t1(c0) VALUES(13),(14);
SELECT * FROM t1 ORDER BY 1;
c0	c1
1	1
2	2
3	3
4	4
5	5
6	6
7	8
8	9
9	15
10	16
11	0
12	17
13	18
14	19
INSERT INTO t1 VALUES(15,NULL),(16,25),(17,NULL),(18,30);
SELECT * FROM t1 ORDER BY 1;
c0	c1
1	1
2	2
3	3
4	4
5	5
6	6
7	8
8	9
9	15
10	16
11	0
12	17
13	18
14	19
15	20
16	25
17	26
18	30
DROP TABLE IF EXISTS t1;
CREATE TABLE t1(c0 INT(5),c1 DOUBLE NOT NULL);
INSERT INTO t1 VALUES(1,1.5),(2,2.5),(3,3.5),(4,4.5),(5,5.5),(6,6.5);
ALTER TABLE t1 MODIFY c1 FLOAT PRIMARY KEY AUTO_INCREMENT;
SHOW CREATE TABLE t1;
Table	Create Table
t1	CREATE TABLE `t1` (
  `c0` int(5) DEFAULT NULL,
  `c1` float NOT NULL AUTO_INCREMENT,
  PRIMARY KEY (`c1`)
) ORGANIZATION INDEX AUTO_INCREMENT = 7 AUTO_INCREMENT_MODE = 'ORDER' DEFAULT CHARSET = utf8mb4 ROW_FORMAT = DYNAMIC COMPRESSION = 'zstd_1.3.8' REPLICA_NUM = 1 BLOCK_SIZE = 16384 USE_BLOOM_FILTER = FALSE ENABLE_MACRO_BLOCK_BLOOM_FILTER = FALSE TABLET_SIZE = 134217728 PCTFREE = 0
SELECT * FROM t1 ORDER BY 1;
c0	c1
1	1.5
2	2.5
3	3.5
4	4.5
5	5.5
6	6.5
INSERT INTO t1(c0) VALUES(7);
INSERT INTO t1(c0) VALUES(8);
SELECT * FROM t1 ORDER BY 1;
c0	c1
1	1.5
2	2.5
3	3.5
4	4.5
5	5.5
6	6.5
7	7
8	8
DROP TABLE IF EXISTS t1;
CREATE TABLE t1(c0 INT(5),c1 DOUBLE(5,0));
INSERT INTO t1 VALUES(1,1.5),(2,2.5),(3,NULL),(4,4.5),(5,NULL),(6,6.5);
ALTER TABLE t1 MODIFY c1 FLOAT PRIMARY KEY AUTO_INCREMENT;
ALTER TABLE t1 MODIFY c1 FLOAT AUTO_INCREMENT;
SHOW CREATE TABLE t1;
Table	Create Table
t1	CREATE TABLE `t1` (
  `c0` int(5) DEFAULT NULL,
  `c1` float NOT NULL AUTO_INCREMENT,
  PRIMARY KEY (`c1`)
) ORGANIZATION INDEX AUTO_INCREMENT = 7 AUTO_INCREMENT_MODE = 'ORDER' DEFAULT CHARSET = utf8mb4 ROW_FORMAT = DYNAMIC COMPRESSION = 'zstd_1.3.8' REPLICA_NUM = 1 BLOCK_SIZE = 16384 USE_BLOOM_FILTER = FALSE ENABLE_MACRO_BLOCK_BLOOM_FILTER = FALSE TABLET_SIZE = 134217728 PCTFREE = 0
SELECT * FROM t1 ORDER BY 1;
c0	c1
1	1
2	2
3	3
4	4
5	5
6	6
INSERT INTO t1(c0) VALUES(7),(8);
SELECT * FROM t1 ORDER BY 1;
c0	c1
1	1
2	2
3	3
4	4
5	5
6	6
7	7
8	8
INSERT INTO t1(c0,c1) VALUES(9,NULL),(10,NULL),(11,15),(12,0),(13,NULL),(14,NULL);
SELECT * FROM t1 ORDER BY 1;
c0	c1
1	1
2	2
3	3
4	4
5	5
6	6
7	7
8	8
9	9
10	10
11	15
12	0
13	16
14	17
INSERT INTO t1(c0) VALUES(15),(16);
SELECT * FROM t1 ORDER BY 1;
c0	c1
1	1
2	2
3	3
4	4
5	5
6	6
7	7
8	8
9	9
10	10
11	15
12	0
13	16
14	17
15	18
16	19
DROP TABLE IF EXISTS t1;
CREATE TABLE t1(c0 INT(5),c1 DOUBLE(5,0));
INSERT INTO t1 VALUES(1,NULL),(2,NULL),(3,NULL),(4,NULL),(5,NULL),(6,NULL);
ALTER TABLE t1 MODIFY c1 FLOAT PRIMARY KEY AUTO_INCREMENT;
SHOW CREATE TABLE t1;
Table	Create Table
t1	CREATE TABLE `t1` (
  `c0` int(5) DEFAULT NULL,
  `c1` float NOT NULL AUTO_INCREMENT,
  PRIMARY KEY (`c1`)
) ORGANIZATION INDEX AUTO_INCREMENT = 8 AUTO_INCREMENT_MODE = 'ORDER' DEFAULT CHARSET = utf8mb4 ROW_FORMAT = DYNAMIC COMPRESSION = 'zstd_1.3.8' REPLICA_NUM = 1 BLOCK_SIZE = 16384 USE_BLOOM_FILTER = FALSE ENABLE_MACRO_BLOCK_BLOOM_FILTER = FALSE TABLET_SIZE = 134217728 PCTFREE = 0
SELECT * FROM t1 ORDER BY 1;
c0	c1
1	1
2	2
3	3
4	4
5	5
6	6
INSERT INTO t1 VALUES(7,NULL),(8,NULL);
SELECT * FROM t1 ORDER BY 1;
c0	c1
1	1
2	2
3	3
4	4
5	5
6	6
7	8
8	9
INSERT INTO t1 VALUES(9,15),(10,16),(11,0),(12,17);
SELECT * FROM t1 ORDER BY 1;
c0	c1
1	1
2	2
3	3
4	4
5	5
6	6
7	8
8	9
9	15
10	16
11	0
12	17
INSERT INTO t1(c0) VALUES(13),(14);
SELECT * FROM t1 ORDER BY 1;
c0	c1
1	1
2	2
3	3
4	4
5	5
6	6
7	8
8	9
9	15
10	16
11	0
12	17
13	18
14	19
INSERT INTO t1 VALUES(15,NULL),(16,25),(17,NULL),(18,30);
SELECT * FROM t1 ORDER BY 1;
c0	c1
1	1
2	2
3	3
4	4
5	5
6	6
7	8
8	9
9	15
10	16
11	0
12	17
13	18
14	19
15	20
16	25
17	26
18	30
DROP TABLE IF EXISTS t1;
CREATE TABLE t1(c0 INT(5),
c1 FLOAT,
c2 DOUBLE);
INSERT INTO t1 VALUES(0,1.5,1.12),
(-1,2.5,2.23),
(5,3.5,3.34),
(NULL,4.5,4.45),
(3,5.15,5.56),
(-6,6.5,6.67),
(7,7.5,7.78),
(NULL,8.5,8.89),
(9,9.5,9.90),
(-10,9.99,10.11),
(11,11.5,11.12),
(12,12.5,12.23),
(-13,13.5,13.34);
ALTER TABLE t1 MODIFY c0 FLOAT AUTO_INCREMENT,MODIFY c1 FLOAT AUTO_INCREMENT,MODIFY c2 DOUBLE AUTO_INCREMENT;
ERROR 0A000: More than one auto increment column not supported
SHOW CREATE TABLE t1;
Table	Create Table
t1	CREATE TABLE `t1` (
  `c0` int(5) DEFAULT NULL,
  `c1` float DEFAULT NULL,
  `c2` double DEFAULT NULL
) ORGANIZATION INDEX DEFAULT CHARSET = utf8mb4 ROW_FORMAT = DYNAMIC COMPRESSION = 'zstd_1.3.8' REPLICA_NUM = 1 BLOCK_SIZE = 16384 USE_BLOOM_FILTER = FALSE ENABLE_MACRO_BLOCK_BLOOM_FILTER = FALSE TABLET_SIZE = 134217728 PCTFREE = 0
SELECT * FROM t1 ORDER BY 1,2;
c0	c1	c2
NULL	4.5	4.45
NULL	8.5	8.89
-13	13.5	13.34
-10	9.99	10.11
-6	6.5	6.67
-1	2.5	2.23
0	1.5	1.12
3	5.15	5.56
5	3.5	3.34
7	7.5	7.78
9	9.5	9.9
11	11.5	11.12
12	12.5	12.23
DROP TABLE IF EXISTS t1;
CREATE TABLE t1(c0 CHAR(5),
c1 VARCHAR(5),
c2 BINARY(5),
c3 VARBINARY(5));
INSERT INTO t1 VALUES(0,1.5,1.12,10),
(-1,2.5,2.23,11),
(5,3.5,3.34,12),
(NULL,4.5,4.45,10),
(3,5.15,5.56,13),
(-6,6.5,6.67,12),
(7,7.5,7.78,11),
(NULL,8.5,8.89,14),
(9,9.5,9.90,14);
SELECT * FROM t1 ORDER BY 1,2,3;
c0	c1	c2	c3
NULL	4.5	4.45 	10
NULL	8.5	8.89 	14
-1	2.5	2.23 	11
-6	6.5	6.67 	12
0	1.5	1.12 	10
3	5.15	5.56 	13
5	3.5	3.34 	12
7	7.5	7.78 	11
9	9.5	9.90 	14
ALTER TABLE t1 MODIFY c0 CHAR(5) PRIMARY KEY AUTO_INCREMENT;
ERROR 42000: Incorrect column specifier for column 'c0'
ALTER TABLE t1 CHANGE c0 c0 CHAR(5) AUTO_INCREMENT;
ERROR 42000: Incorrect column specifier for column 'c0'
ALTER TABLE t1 MODIFY c1 CHAR(5) PRIMARY KEY AUTO_INCREMENT;
ERROR 42000: Incorrect column specifier for column 'c1'
ALTER TABLE t1 CHANGE c1 c1 CHAR(5) AUTO_INCREMENT;
ERROR 42000: Incorrect column specifier for column 'c1'
ALTER TABLE t1 CHANGE c2 c2 CHAR(5) PRIMARY KEY AUTO_INCREMENT;
ERROR 42000: Incorrect column specifier for column 'c2'
ALTER TABLE t1 MODIFY c2 CHAR(5) AUTO_INCREMENT;
ERROR 42000: Incorrect column specifier for column 'c2'
ALTER TABLE t1 MODIFY c3 CHAR(5) PRIMARY KEY AUTO_INCREMENT;
ERROR 42000: Incorrect column specifier for column 'c3'
ALTER TABLE t1 CHANGE c3 c3 CHAR(5) AUTO_INCREMENT;
ERROR 42000: Incorrect column specifier for column 'c3'
SHOW CREATE TABLE t1;
Table	Create Table
t1	CREATE TABLE `t1` (
  `c0` char(5) DEFAULT NULL,
  `c1` varchar(5) DEFAULT NULL,
  `c2` binary(5) DEFAULT NULL,
  `c3` varbinary(5) DEFAULT NULL
) ORGANIZATION INDEX DEFAULT CHARSET = utf8mb4 ROW_FORMAT = DYNAMIC COMPRESSION = 'zstd_1.3.8' REPLICA_NUM = 1 BLOCK_SIZE = 16384 USE_BLOOM_FILTER = FALSE ENABLE_MACRO_BLOCK_BLOOM_FILTER = FALSE TABLET_SIZE = 134217728 PCTFREE = 0
SELECT * FROM t1 ORDER BY 1,2,3;
c0	c1	c2	c3
NULL	4.5	4.45 	10
NULL	8.5	8.89 	14
-1	2.5	2.23 	11
-6	6.5	6.67 	12
0	1.5	1.12 	10
3	5.15	5.56 	13
5	3.5	3.34 	12
7	7.5	7.78 	11
9	9.5	9.90 	14
ALTER TABLE t1 MODIFY c0 INT AUTO_INCREMENT;
SHOW CREATE TABLE t1;
Table	Create Table
t1	CREATE TABLE `t1` (
  `c0` int(11) NOT NULL AUTO_INCREMENT,
  `c1` varchar(5) DEFAULT NULL,
  `c2` binary(5) DEFAULT NULL,
  `c3` varbinary(5) DEFAULT NULL
) ORGANIZATION INDEX AUTO_INCREMENT = 10 AUTO_INCREMENT_MODE = 'ORDER' DEFAULT CHARSET = utf8mb4 ROW_FORMAT = DYNAMIC COMPRESSION = 'zstd_1.3.8' REPLICA_NUM = 1 BLOCK_SIZE = 16384 USE_BLOOM_FILTER = FALSE ENABLE_MACRO_BLOCK_BLOOM_FILTER = FALSE TABLET_SIZE = 134217728 PCTFREE = 0
SELECT c0 FROM t1 ORDER BY 1;
c0
-6
-1
0
3
4
5
7
8
9
INSERT INTO t1(c1,c2,c3) VALUES(10.5,10.90,15),(11.5,11.90,15),(12.5,11.90,16);
SELECT c0,c1 FROM t1 ORDER BY 1;
c0	c1
-6	6.5
-1	2.5
0	1.5
3	5.15
4	4.5
5	3.5
7	7.5
8	8.5
9	9.5
10	10.5
11	11.5
12	12.5
INSERT INTO t1 VALUES(NULL,13.5,10.90,17),(20,14.5,11.90,17),(NULL,15.5,11.90,17),(NULL,16.5,12.90,18);
SELECT c0,c1 FROM t1 ORDER BY 1;
c0	c1
-6	6.5
-1	2.5
0	1.5
3	5.15
4	4.5
5	3.5
7	7.5
8	8.5
9	9.5
10	10.5
11	11.5
12	12.5
13	13.5
20	14.5
21	15.5
22	16.5
SET auto_increment_increment=2;
INSERT INTO t1 VALUES(30,17.5,11.90,19),(NULL,18.5,12.90,19),(40,19.5,13.90,20),(41,17.9,11.90,19),(NULL,20.5,14.90,21),(NULL,21.5,15.90,22);
SELECT c0,c1 FROM t1 ORDER BY 1;
c0	c1
-6	6.5
-1	2.5
0	1.5
3	5.15
4	4.5
5	3.5
7	7.5
8	8.5
9	9.5
10	10.5
11	11.5
12	12.5
13	13.5
20	14.5
21	15.5
22	16.5
30	17.5
31	18.5
40	19.5
41	17.9
43	20.5
45	21.5
ALTER TABLE t1 DROP c0;
DELETE FROM t1;
COMMIT;
INSERT INTO t1 VALUES(1.5,1.12,10),
(2.5,2.23,11),
(3.5,3.34,12),
(4.5,4.45,10),
(5.15,5.56,13),
(6.5,6.67,12),
(7.5,7.78,11),
(8.5,8.89,14),
(9.5,9.90,14);
SELECT * FROM t1 ORDER BY 1,2,3;
c1	c2	c3
1.5	1.12 	10
2.5	2.23 	11
3.5	3.34 	12
4.5	4.45 	10
5.15	5.56 	13
6.5	6.67 	12
7.5	7.78 	11
8.5	8.89 	14
9.5	9.90 	14
SHOW CREATE TABLE t1;
Table	Create Table
t1	CREATE TABLE `t1` (
  `c1` varchar(5) DEFAULT NULL,
  `c2` binary(5) DEFAULT NULL,
  `c3` varbinary(5) DEFAULT NULL
) ORGANIZATION INDEX DEFAULT CHARSET = utf8mb4 ROW_FORMAT = DYNAMIC COMPRESSION = 'zstd_1.3.8' REPLICA_NUM = 1 BLOCK_SIZE = 16384 USE_BLOOM_FILTER = FALSE ENABLE_MACRO_BLOCK_BLOOM_FILTER = FALSE TABLET_SIZE = 134217728 PCTFREE = 0
ALTER TABLE t1 CHANGE c1 c1 FLOAT PRIMARY KEY AUTO_INCREMENT;
SHOW CREATE TABLE t1;
Table	Create Table
t1	CREATE TABLE `t1` (
  `c1` float NOT NULL AUTO_INCREMENT,
  `c2` binary(5) DEFAULT NULL,
  `c3` varbinary(5) DEFAULT NULL,
  PRIMARY KEY (`c1`)
) ORGANIZATION INDEX AUTO_INCREMENT = 11 AUTO_INCREMENT_MODE = 'ORDER' DEFAULT CHARSET = utf8mb4 ROW_FORMAT = DYNAMIC COMPRESSION = 'zstd_1.3.8' REPLICA_NUM = 1 BLOCK_SIZE = 16384 USE_BLOOM_FILTER = FALSE ENABLE_MACRO_BLOCK_BLOOM_FILTER = FALSE TABLET_SIZE = 134217728 PCTFREE = 0
SELECT * FROM t1 ORDER BY 1;
c1	c2	c3
1.5	1.12 	10
2.5	2.23 	11
3.5	3.34 	12
4.5	4.45 	10
5.15	5.56 	13
6.5	6.67 	12
7.5	7.78 	11
8.5	8.89 	14
9.5	9.90 	14
INSERT INTO t1(c2,c3) VALUES(10.90,14),(11.90,14),(12.90,14);
SELECT * FROM t1 ORDER BY 1;
c1	c2	c3
1.5	1.12 	10
2.5	2.23 	11
3.5	3.34 	12
4.5	4.45 	10
5.15	5.56 	13
6.5	6.67 	12
7.5	7.78 	11
8.5	8.89 	14
9.5	9.90 	14
11	10.90	14
13	11.90	14
15	12.90	14
INSERT INTO t1 VALUES(NULL,13.90,15),(NULL,14.90,15),(30,15.90,15),(-3.4,16.90,15),(NULL,17.90,14),(NULL,18.90,15);
SELECT * FROM t1 ORDER BY 1;
c1	c2	c3
-3.4	16.90	15
1.5	1.12 	10
2.5	2.23 	11
3.5	3.34 	12
4.5	4.45 	10
5.15	5.56 	13
6.5	6.67 	12
7.5	7.78 	11
8.5	8.89 	14
9.5	9.90 	14
11	10.90	14
13	11.90	14
15	12.90	14
17	13.90	15
19	14.90	15
30	15.90	15
31	17.90	14
33	18.90	15
SET auto_increment_increment=1;
INSERT INTO t1 VALUES(40,19.90,19),(NULL,20.5,19),(NULL,21.5,20),(50,22.9,19),(-6.6,23.5,21),(NULL,24.5,22);
SELECT * FROM t1 ORDER BY 1;
c1	c2	c3
-6.6	23.5 	21
-3.4	16.90	15
1.5	1.12 	10
2.5	2.23 	11
3.5	3.34 	12
4.5	4.45 	10
5.15	5.56 	13
6.5	6.67 	12
7.5	7.78 	11
8.5	8.89 	14
9.5	9.90 	14
11	10.90	14
13	11.90	14
15	12.90	14
17	13.90	15
19	14.90	15
30	15.90	15
31	17.90	14
33	18.90	15
40	19.90	19
41	20.5 	19
42	21.5 	20
50	22.9 	19
51	24.5 	22
ALTER TABLE t1 DROP c1;
ERROR 0A000: drop rowkey column is not supported
DROP TABLE IF EXISTS t1;
CREATE TABLE t1(c0 BINARY(5),
c1 VARBINARY(5));
INSERT INTO t1 VALUES(1.12,10),
(2.23,0),
(3.34,12),
(4.45,13),
(5.56,NULL),
(6.67,20),
(7.78,16),
(8.89,17),
(9.90,25);
SELECT * FROM t1 ORDER BY 1,2;
c0	c1
1.12 	10
2.23 	0
3.34 	12
4.45 	13
5.56 	NULL
6.67 	20
7.78 	16
8.89 	17
9.90 	25
SHOW CREATE TABLE t1;
Table	Create Table
t1	CREATE TABLE `t1` (
  `c0` binary(5) DEFAULT NULL,
  `c1` varbinary(5) DEFAULT NULL
) ORGANIZATION INDEX DEFAULT CHARSET = utf8mb4 ROW_FORMAT = DYNAMIC COMPRESSION = 'zstd_1.3.8' REPLICA_NUM = 1 BLOCK_SIZE = 16384 USE_BLOOM_FILTER = FALSE ENABLE_MACRO_BLOCK_BLOOM_FILTER = FALSE TABLET_SIZE = 134217728 PCTFREE = 0
ALTER TABLE t1 CHANGE c0 c0 DOUBLE PRIMARY KEY AUTO_INCREMENT;
ERROR 01000: Data truncated for argument
ALTER TABLE t1 CHANGE c0 c0 FLOAT PRIMARY KEY AUTO_INCREMENT;
ERROR 01000: Data truncated for argument
ALTER TABLE t1 CHANGE c0 c0 INT PRIMARY KEY AUTO_INCREMENT;
ERROR 01000: Data truncated for argument
ALTER TABLE t1 CHANGE c1 c1 DOUBLE PRIMARY KEY AUTO_INCREMENT;
SHOW CREATE TABLE t1;
Table	Create Table
t1	CREATE TABLE `t1` (
  `c0` binary(5) DEFAULT NULL,
  `c1` double NOT NULL AUTO_INCREMENT,
  PRIMARY KEY (`c1`)
) ORGANIZATION INDEX AUTO_INCREMENT = 26 AUTO_INCREMENT_MODE = 'ORDER' DEFAULT CHARSET = utf8mb4 ROW_FORMAT = DYNAMIC COMPRESSION = 'zstd_1.3.8' REPLICA_NUM = 1 BLOCK_SIZE = 16384 USE_BLOOM_FILTER = FALSE ENABLE_MACRO_BLOCK_BLOOM_FILTER = FALSE TABLET_SIZE = 134217728 PCTFREE = 0
SELECT * FROM t1 ORDER BY 2;
c0	c1
2.23 	0
1.12 	10
3.34 	12
4.45 	13
5.56 	14
7.78 	16
8.89 	17
6.67 	20
9.90 	25
INSERT INTO t1(c0) VALUES(10.90),(11.90),(12.90);
SELECT * FROM t1 ORDER BY 2;
c0	c1
2.23 	0
1.12 	10
3.34 	12
4.45 	13
5.56 	14
7.78 	16
8.89 	17
6.67 	20
9.90 	25
10.90	26
11.90	27
12.90	28
INSERT INTO t1 VALUES(13.90,NULL),(14.90,NULL),(15.90,-40),(16.90,2),(17.90,NULL),(18.90,NULL);
SELECT * FROM t1 ORDER BY 2;
c0	c1
15.90	-40
2.23 	0
16.90	2
1.12 	10
3.34 	12
4.45 	13
5.56 	14
7.78 	16
8.89 	17
6.67 	20
9.90 	25
10.90	26
11.90	27
12.90	28
13.90	29
14.90	30
17.90	31
18.90	32
SET auto_increment_increment=2;
INSERT INTO t1 VALUES(19.90,40),(20.5,NULL),(21.5,NULL),(22.9,50),(23.5,51),(24.5,NULL);
SELECT * FROM t1 ORDER BY 2;
c0	c1
15.90	-40
2.23 	0
16.90	2
1.12 	10
3.34 	12
4.45 	13
5.56 	14
7.78 	16
8.89 	17
6.67 	20
9.90 	25
10.90	26
11.90	27
12.90	28
13.90	29
14.90	30
17.90	31
18.90	32
19.90	40
20.5 	41
21.5 	43
22.9 	50
23.5 	51
24.5 	53
DROP TABLE IF EXISTS t1;
CREATE TABLE t1(c0 BINARY(10),
c1 VARBINARY(10));
INSERT INTO t1 VALUES(5.12,'% '),
(10.23,0),
('te st','te st'),
(4.45,13),
('$$',NULL),
('',20),
('中文','test'),
(8.89,17),
(9.90,18);
ALTER TABLE t1 CHANGE c0 c0 DOUBLE PRIMARY KEY AUTO_INCREMENT;
ERROR 01000: Data truncated for argument
ALTER TABLE t1 CHANGE c0 c0 FLOAT PRIMARY KEY AUTO_INCREMENT;
ERROR 01000: Data truncated for argument
ALTER TABLE t1 CHANGE c0 c0 INT PRIMARY KEY AUTO_INCREMENT;
ERROR 01000: Data truncated for argument
ALTER TABLE t1 MODIFY c1 DOUBLE PRIMARY KEY AUTO_INCREMENT;
ERROR 01000: Truncated incorrect DOUBLE value
ALTER TABLE t1 MODIFY c1 FLOAT PRIMARY KEY AUTO_INCREMENT;
ERROR 01000: Truncated incorrect DOUBLE value
ALTER TABLE t1 MODIFY c1 INT PRIMARY KEY AUTO_INCREMENT;
ERROR HY000: Incorrect integer value
DROP TABLE IF EXISTS t1;
CREATE TABLE t1(c0 CHAR(10),
c1 VARCHAR(10));
INSERT INTO t1 VALUES(5.12,'% '),
(10.23,0),
('te st','te st'),
(4.45,13),
('$$',NULL),
('',20),
('中文','test'),
(8.89,17),
(9.90,18);
ALTER TABLE t1 CHANGE c0 c0 DOUBLE PRIMARY KEY AUTO_INCREMENT;
ERROR 01000: Truncated incorrect DOUBLE value
ALTER TABLE t1 CHANGE c0 c0 FLOAT PRIMARY KEY AUTO_INCREMENT;
ERROR 01000: Truncated incorrect DOUBLE value
ALTER TABLE t1 CHANGE c0 c0 INT PRIMARY KEY AUTO_INCREMENT;
ERROR HY000: Incorrect integer value
ALTER TABLE t1 MODIFY c1 DOUBLE PRIMARY KEY AUTO_INCREMENT;
ERROR 01000: Truncated incorrect DOUBLE value
ALTER TABLE t1 MODIFY c1 FLOAT PRIMARY KEY AUTO_INCREMENT;
ERROR 01000: Truncated incorrect DOUBLE value
ALTER TABLE t1 MODIFY c1 INT PRIMARY KEY AUTO_INCREMENT;
ERROR HY000: Incorrect integer value
SET auto_increment_increment=1;
DROP TABLE IF EXISTS t1;
CREATE TABLE t1(c0 BIT(20),
c1 BLOB,
c2 TEXT,
c3 SET('1','2','3','4','5','6','7','8','9','0')
);
INSERT INTO t1 VALUES(b'000001',1.5,1.12,0),
(b'000011',2.5,2.23,1),
(b'000111',3.5,3.34,2),
(NULL,NULL,NULL,NULL),
(b'001111',15.15,15.56,6),
(b'011111',16.5,16.67,7),
(b'111111',17.5,17.78,8);
SELECT * FROM t1 ORDER BY 1,2,3,4;
c0	c1	c2	c3
NULL	NULL	NULL	NULL
  	1.5	1.12	
  	2.5	2.23	1
  	3.5	3.34	2
  	15.15	15.56	2,3
  	16.5	16.67	1,2,3
  ?	17.5	17.78	4
ALTER TABLE t1 MODIFY c0 INT PRIMARY KEY AUTO_INCREMENT;
SHOW CREATE TABLE t1;
Table	Create Table
t1	CREATE TABLE `t1` (
  `c0` int(11) NOT NULL AUTO_INCREMENT,
  `c1` blob DEFAULT NULL,
  `c2` text DEFAULT NULL,
  `c3` set('1','2','3','4','5','6','7','8','9','0') DEFAULT NULL,
  PRIMARY KEY (`c0`)
) ORGANIZATION INDEX AUTO_INCREMENT = 64 AUTO_INCREMENT_MODE = 'ORDER' DEFAULT CHARSET = utf8mb4 ROW_FORMAT = DYNAMIC COMPRESSION = 'zstd_1.3.8' REPLICA_NUM = 1 BLOCK_SIZE = 16384 USE_BLOOM_FILTER = FALSE ENABLE_MACRO_BLOCK_BLOOM_FILTER = FALSE TABLET_SIZE = 134217728 PCTFREE = 0
SELECT * FROM t1 ORDER BY 1,2,3,4;
c0	c1	c2	c3
1	1.5	1.12	
3	2.5	2.23	1
7	3.5	3.34	2
8	NULL	NULL	NULL
15	15.15	15.56	2,3
31	16.5	16.67	1,2,3
63	17.5	17.78	4
INSERT INTO t1 VALUES(NULL,18.5,18.78,8),(NULL,19.5,19.78,9);
SELECT * FROM t1 ORDER BY 1,2,3,4;
c0	c1	c2	c3
1	1.5	1.12	
3	2.5	2.23	1
7	3.5	3.34	2
8	NULL	NULL	NULL
15	15.15	15.56	2,3
31	16.5	16.67	1,2,3
63	17.5	17.78	4
64	18.5	18.78	4
65	19.5	19.78	1,4
INSERT INTO t1(c1,c2,c3) VALUES(20.5,20.78,9),(20.5,20.78,0);
SELECT * FROM t1 ORDER BY 1,2,3,4;
c0	c1	c2	c3
1	1.5	1.12	
3	2.5	2.23	1
7	3.5	3.34	2
8	NULL	NULL	NULL
15	15.15	15.56	2,3
31	16.5	16.67	1,2,3
63	17.5	17.78	4
64	18.5	18.78	4
65	19.5	19.78	1,4
66	20.5	20.78	1,4
67	20.5	20.78	
DROP TABLE IF EXISTS t1;
CREATE TABLE t1(c0 BIT(20),
c1 BLOB,
c2 TEXT,
c3 SET('1','2','3','4','5','6','7','8','9','0')
);
INSERT INTO t1 VALUES(b'000001',1.5,1.12,0),
(b'000011',2.5,2.23,1),
(b'000111',3.5,3.34,2),
(NULL,NULL,NULL,NULL),
(b'001111',15.15,15.56,6),
(b'011111',16.5,16.67,7),
(b'111111',17.5,17.78,8);
SELECT * FROM t1 ORDER BY 1,2,3,4;
c0	c1	c2	c3
NULL	NULL	NULL	NULL
  	1.5	1.12	
  	2.5	2.23	1
  	3.5	3.34	2
  	15.15	15.56	2,3
  	16.5	16.67	1,2,3
  ?	17.5	17.78	4
ALTER TABLE t1 MODIFY c1 DOUBLE PRIMARY KEY AUTO_INCREMENT;
SHOW CREATE TABLE t1;
Table	Create Table
t1	CREATE TABLE `t1` (
  `c0` bit(20) DEFAULT NULL,
  `c1` double NOT NULL AUTO_INCREMENT,
  `c2` text DEFAULT NULL,
  `c3` set('1','2','3','4','5','6','7','8','9','0') DEFAULT NULL,
  PRIMARY KEY (`c1`)
) ORGANIZATION INDEX AUTO_INCREMENT = 19 AUTO_INCREMENT_MODE = 'ORDER' DEFAULT CHARSET = utf8mb4 ROW_FORMAT = DYNAMIC COMPRESSION = 'zstd_1.3.8' REPLICA_NUM = 1 BLOCK_SIZE = 16384 USE_BLOOM_FILTER = FALSE ENABLE_MACRO_BLOCK_BLOOM_FILTER = FALSE TABLET_SIZE = 134217728 PCTFREE = 0
SELECT * FROM t1 ORDER BY 1,2,3,4;
c0	c1	c2	c3
NULL	5	NULL	NULL
  	1.5	1.12	
  	2.5	2.23	1
  	3.5	3.34	2
  	15.15	15.56	2,3
  	16.5	16.67	1,2,3
  ?	17.5	17.78	4
INSERT INTO t1 VALUES(b'101111',NULL,18.78,8),(b'110111',NULL,19.78,9);
SELECT * FROM t1 ORDER BY 1,2,3,4;
c0	c1	c2	c3
NULL	5	NULL	NULL
  	1.5	1.12	
  	2.5	2.23	1
  	3.5	3.34	2
  	15.15	15.56	2,3
  	16.5	16.67	1,2,3
  /	19	18.78	4
  7	20	19.78	1,4
  ?	17.5	17.78	4
INSERT INTO t1(c0,c2,c3) VALUES(b'111011',20.78,9),(b'111101',20.78,0);
SELECT * FROM t1 ORDER BY 1,2,3,4;
c0	c1	c2	c3
NULL	5	NULL	NULL
  	1.5	1.12	
  	2.5	2.23	1
  	3.5	3.34	2
  	15.15	15.56	2,3
  	16.5	16.67	1,2,3
  /	19	18.78	4
  7	20	19.78	1,4
  ;	21	20.78	1,4
  =	22	20.78	
  ?	17.5	17.78	4
DROP TABLE IF EXISTS t1;
CREATE TABLE t1(c0 BIT(20),
c1 BLOB,
c2 TEXT,
c3 SET('1','2','3','4','5','6','7','8','9','0')
);
INSERT INTO t1 VALUES(b'000001',1.5,1.12,0),
(b'000011',2.5,2.23,1),
(b'000111',3.5,3.34,2),
(NULL,NULL,NULL,NULL),
(b'001111',15.15,15.56,6),
(b'011111',16.5,16.67,7),
(b'111111',17.5,17.78,8);
SELECT * FROM t1 ORDER BY 1,2,3,4;
c0	c1	c2	c3
NULL	NULL	NULL	NULL
  	1.5	1.12	
  	2.5	2.23	1
  	3.5	3.34	2
  	15.15	15.56	2,3
  	16.5	16.67	1,2,3
  ?	17.5	17.78	4
ALTER TABLE t1 MODIFY c2 FLOAT PRIMARY KEY AUTO_INCREMENT;
SHOW CREATE TABLE t1;
Table	Create Table
t1	CREATE TABLE `t1` (
  `c0` bit(20) DEFAULT NULL,
  `c1` blob DEFAULT NULL,
  `c2` float NOT NULL AUTO_INCREMENT,
  `c3` set('1','2','3','4','5','6','7','8','9','0') DEFAULT NULL,
  PRIMARY KEY (`c2`)
) ORGANIZATION INDEX AUTO_INCREMENT = 19 AUTO_INCREMENT_MODE = 'ORDER' DEFAULT CHARSET = utf8mb4 ROW_FORMAT = DYNAMIC COMPRESSION = 'zstd_1.3.8' REPLICA_NUM = 1 BLOCK_SIZE = 16384 USE_BLOOM_FILTER = FALSE ENABLE_MACRO_BLOCK_BLOOM_FILTER = FALSE TABLET_SIZE = 134217728 PCTFREE = 0
SELECT * FROM t1 ORDER BY 1,2,3,4;
c0	c1	c2	c3
NULL	NULL	4	NULL
  	1.5	1.12	
  	2.5	2.23	1
  	3.5	3.34	2
  	15.15	15.56	2,3
  	16.5	16.67	1,2,3
  ?	17.5	17.78	4
INSERT INTO t1 VALUES(b'101111',18.78,NULL,8),(b'110111',19.78,NULL,9);
SELECT * FROM t1 ORDER BY 1,2,3,4;
c0	c1	c2	c3
NULL	NULL	4	NULL
  	1.5	1.12	
  	2.5	2.23	1
  	3.5	3.34	2
  	15.15	15.56	2,3
  	16.5	16.67	1,2,3
  /	18.78	19	4
  7	19.78	20	1,4
  ?	17.5	17.78	4
INSERT INTO t1(c0,c1,c3) VALUES(b'111011',20.78,9),(b'111101',20.78,0);
SELECT * FROM t1 ORDER BY 1,2,3,4;
c0	c1	c2	c3
NULL	NULL	4	NULL
  	1.5	1.12	
  	2.5	2.23	1
  	3.5	3.34	2
  	15.15	15.56	2,3
  	16.5	16.67	1,2,3
  /	18.78	19	4
  7	19.78	20	1,4
  ;	20.78	21	1,4
  =	20.78	22	
  ?	17.5	17.78	4
DROP TABLE IF EXISTS t1;
CREATE TABLE t1(c0 BIT(20),
c1 BLOB,
c2 TEXT,
c3 SET('1','2','3','4','5','6','7','8','9','0')
);
INSERT INTO t1 VALUES(b'000001',1.5,1.12,0),
(b'000011',2.5,2.23,1),
(b'000111',3.5,3.34,2),
(NULL,NULL,NULL,NULL),
(b'001111',15.15,15.56,6),
(b'011111',16.5,16.67,7),
(b'111111',17.5,17.78,8);
SELECT * FROM t1 ORDER BY 1,2,3,4;
c0	c1	c2	c3
NULL	NULL	NULL	NULL
  	1.5	1.12	
  	2.5	2.23	1
  	3.5	3.34	2
  	15.15	15.56	2,3
  	16.5	16.67	1,2,3
  ?	17.5	17.78	4
ALTER TABLE t1 MODIFY c3 FLOAT PRIMARY KEY AUTO_INCREMENT;
SHOW CREATE TABLE t1;
Table	Create Table
t1	CREATE TABLE `t1` (
  `c0` bit(20) DEFAULT NULL,
  `c1` blob DEFAULT NULL,
  `c2` text DEFAULT NULL,
  `c3` float NOT NULL AUTO_INCREMENT,
  PRIMARY KEY (`c3`)
) ORGANIZATION INDEX AUTO_INCREMENT = 9 AUTO_INCREMENT_MODE = 'ORDER' DEFAULT CHARSET = utf8mb4 ROW_FORMAT = DYNAMIC COMPRESSION = 'zstd_1.3.8' REPLICA_NUM = 1 BLOCK_SIZE = 16384 USE_BLOOM_FILTER = FALSE ENABLE_MACRO_BLOCK_BLOOM_FILTER = FALSE TABLET_SIZE = 134217728 PCTFREE = 0
SELECT * FROM t1 ORDER BY 1,2,3,4;
c0	c1	c2	c3
NULL	NULL	NULL	3
  	1.5	1.12	0
  	2.5	2.23	1
  	3.5	3.34	2
  	15.15	15.56	6
  	16.5	16.67	7
  ?	17.5	17.78	8
INSERT INTO t1 VALUES(b'101111',18.78,18.78,NULL),(b'110111',19.78,19.78,NULL);
SELECT * FROM t1 ORDER BY 1,2,3,4;
c0	c1	c2	c3
NULL	NULL	NULL	3
  	1.5	1.12	0
  	2.5	2.23	1
  	3.5	3.34	2
  	15.15	15.56	6
  	16.5	16.67	7
  /	18.78	18.78	9
  7	19.78	19.78	10
  ?	17.5	17.78	8
INSERT INTO t1(c0,c1,c2) VALUES(b'111011',20.78,20.78),(b'111101',20.78,20.78);
SELECT * FROM t1 ORDER BY 1,2,3,4;
c0	c1	c2	c3
NULL	NULL	NULL	3
  	1.5	1.12	0
  	2.5	2.23	1
  	3.5	3.34	2
  	15.15	15.56	6
  	16.5	16.67	7
  /	18.78	18.78	9
  7	19.78	19.78	10
  ;	20.78	20.78	11
  =	20.78	20.78	12
  ?	17.5	17.78	8
DROP TABLE IF EXISTS t1;
CREATE TABLE t1(c1 BLOB,
c2 TEXT,
c3 SET('A','2','B','4','C','6','D','8','E','0')
);
INSERT INTO t1 VALUES(1.5,1.12,0),
('T EST','T EST','A'),
(3.5,3.34,2),
(NULL,NULL,NULL),
('$$','$$','B'),
(16.5,16.67,7),
(17.5,17.78,8);
ALTER TABLE t1 CHANGE c1 c1 INT PRIMARY KEY AUTO_INCREMENT;
ERROR HY000: Incorrect integer value
ALTER TABLE t1 CHANGE c2 c2 INT PRIMARY KEY AUTO_INCREMENT;
ERROR HY000: Incorrect integer value
ALTER TABLE t1 CHANGE c3 c3 INT AUTO_INCREMENT;
SHOW CREATE TABLE t1;
Table	Create Table
t1	CREATE TABLE `t1` (
  `c1` blob DEFAULT NULL,
  `c2` text DEFAULT NULL,
  `c3` int(11) NOT NULL AUTO_INCREMENT
) ORGANIZATION INDEX AUTO_INCREMENT = 9 AUTO_INCREMENT_MODE = 'ORDER' DEFAULT CHARSET = utf8mb4 ROW_FORMAT = DYNAMIC COMPRESSION = 'zstd_1.3.8' REPLICA_NUM = 1 BLOCK_SIZE = 16384 USE_BLOOM_FILTER = FALSE ENABLE_MACRO_BLOCK_BLOOM_FILTER = FALSE TABLET_SIZE = 134217728 PCTFREE = 0
SELECT c3 FROM t1 ORDER BY 1;
c3
0
1
2
4
4
7
8
INSERT INTO t1 VALUES(7.5,7.78,10),(8.5,8.78,NULL),(9.5,9.78,NULL),(10.5,10.78,20);
SELECT c3 FROM t1 ORDER BY 1;
c3
0
1
2
4
4
7
8
10
11
12
20
INSERT INTO t1(c1,c2) VALUES(11.5,11.78),(12.5,12.78);
SELECT c3 FROM t1 ORDER BY 1;
c3
0
1
2
4
4
7
8
10
11
12
20
21
22
DROP TABLE IF EXISTS t1;
CREATE TABLE t1(c1 TIME,
c2 DATE,
c3 YEAR,
c4 DATETIME,
c5 TIMESTAMP
);
INSERT INTO t1 VALUES('21:21:21','2000-01-01','2000','2000-01-01 21:21:21','2000-01-01 21:21:21.22343'),
('01:01:01','2001-01-01','2001','2001-01-01 01:01:01','2001-01-01 01:01:01.4343'),
('20:20:20','2002-02-01','2002','2002-02-01 21:21:21','2002-02-01 20:20:20.6243'),
('02:02:02','2003-03-01','2003','2003-03-01 01:01:01','2003-03-01 02:02:02.262343'),
('22:22:22','2004-04-01','2004','2004-04-01 21:21:21','2004-04-01 22:22:22.5243'),
('03:03:03','2005-05-01','2005','2005-05-01 01:01:01','2005-05-01 03:03:03.86343'),
('23:23:23','2006-06-01','2006','2006-06-01 21:21:21','2006-06-01 23:23:23.93343');
ALTER TABLE t1 MODIFY c1 BIGINT PRIMARY KEY AUTO_INCREMENT;
SHOW CREATE TABLE t1;
Table	Create Table
t1	CREATE TABLE `t1` (
  `c1` bigint(20) NOT NULL AUTO_INCREMENT,
  `c2` date DEFAULT NULL,
  `c3` year(4) DEFAULT NULL,
  `c4` datetime DEFAULT NULL,
  `c5` timestamp NULL DEFAULT NULL,
  PRIMARY KEY (`c1`)
) ORGANIZATION INDEX AUTO_INCREMENT = 232324 AUTO_INCREMENT_MODE = 'ORDER' DEFAULT CHARSET = utf8mb4 ROW_FORMAT = DYNAMIC COMPRESSION = 'zstd_1.3.8' REPLICA_NUM = 1 BLOCK_SIZE = 16384 USE_BLOOM_FILTER = FALSE ENABLE_MACRO_BLOCK_BLOOM_FILTER = FALSE TABLET_SIZE = 134217728 PCTFREE = 0
SELECT c1 FROM t1 ORDER BY 1;
c1
10101
20202
30303
202020
212121
222222
232323
INSERT INTO t1 VALUES(NULL,'2007-07-01','2007','2007-07-01 22:22:22','2007-07-01 20:20:20.90303'),
(NULL,'2008-08-01','2008','2008-08-01 19:19:19','2008-08-01 19:19:19.19303'),
(35,'2009-09-01','2009','2009-09-01 18:19:19','2009-09-01 18:19:19.19303'),
(36,'2010-10-01','2010','2010-10-01 17:19:19','2010-10-01 17:19:19.19303'),
(NULL,'2011-11-01','2011','2011-11-01 16:19:19','2011-11-01 16:19:19.19303'),
(NULL,'2012-12-01','2012','2012-12-01 15:19:19','2012-12-01 15:19:19.19303');
SELECT c1 FROM t1 ORDER BY 1;
c1
35
36
10101
20202
30303
202020
212121
222222
232323
232324
232325
232326
232327
INSERT INTO t1(c2,c3,c4,c5) VALUES('2013-07-01','2013','2013-01-01 22:22:22','2013-02-01 21:21:20.90303'),
('2013-08-01','2008','2013-02-01 19:19:19','2013-01-01 12:12:19.19303');
SELECT c1 FROM t1 ORDER BY 1;
c1
35
36
10101
20202
30303
202020
212121
222222
232323
232324
232325
232326
232327
232330
232331
DROP TABLE IF EXISTS t1;
CREATE TABLE t1(c1 TIME,
c2 DATE,
c3 YEAR,
c4 DATETIME,
c5 TIMESTAMP
);
INSERT INTO t1 VALUES('21:21:21','2000-01-01','2000','2000-01-01 21:21:21','2000-01-01 21:21:21.22343'),
('01:01:01','2001-01-01','2001','2001-01-01 01:01:01','2001-01-01 01:01:01.4343'),
('20:20:20','2002-02-01','2002','2002-02-01 21:21:21','2002-02-01 20:20:20.6243'),
('02:02:02','2003-03-01','2003','2003-03-01 01:01:01','2003-03-01 02:02:02.262343'),
('22:22:22','2004-04-01','2004','2004-04-01 21:21:21','2004-04-01 22:22:22.5243'),
('03:03:03','2005-05-01','2005','2005-05-01 01:01:01','2005-05-01 03:03:03.86343'),
('23:23:23','2006-06-01','2006','2006-06-01 21:21:21','2006-06-01 23:23:23.93343');
ALTER TABLE t1 MODIFY c2 BIGINT PRIMARY KEY AUTO_INCREMENT;
SHOW CREATE TABLE t1;
Table	Create Table
t1	CREATE TABLE `t1` (
  `c1` time DEFAULT NULL,
  `c2` bigint(20) NOT NULL AUTO_INCREMENT,
  `c3` year(4) DEFAULT NULL,
  `c4` datetime DEFAULT NULL,
  `c5` timestamp NULL DEFAULT NULL,
  PRIMARY KEY (`c2`)
) ORGANIZATION INDEX AUTO_INCREMENT = 20060602 AUTO_INCREMENT_MODE = 'ORDER' DEFAULT CHARSET = utf8mb4 ROW_FORMAT = DYNAMIC COMPRESSION = 'zstd_1.3.8' REPLICA_NUM = 1 BLOCK_SIZE = 16384 USE_BLOOM_FILTER = FALSE ENABLE_MACRO_BLOCK_BLOOM_FILTER = FALSE TABLET_SIZE = 134217728 PCTFREE = 0
SELECT c2 FROM t1 ORDER BY 1;
c2
20000101
20010101
20020201
20030301
20040401
20050501
20060601
INSERT INTO t1 VALUES('22:23:23',NULL,'2007','2007-07-01 22:22:22','2007-07-01 20:20:20.90303'),
('21:23:23',NULL,'2008','2008-08-01 19:19:19','2008-08-01 19:19:19.19303'),
('20:23:23',35,'2009','2009-09-01 18:19:19','2009-09-01 18:19:19.19303'),
('19:23:23',36,'2010','2010-10-01 17:19:19','2010-10-01 17:19:19.19303'),
('18:23:23',NULL,'2011','2011-11-01 16:19:19','2011-11-01 16:19:19.19303'),
('17:23:23',NULL,'2012','2012-12-01 15:19:19','2012-12-01 15:19:19.19303');
SELECT c2 FROM t1 ORDER BY 1;
c2
35
36
20000101
20010101
20020201
20030301
20040401
20050501
20060601
20060602
20060603
20060604
20060605
INSERT INTO t1(c1,c3,c4,c5) VALUES('16:23:23','2013','2013-01-01 22:22:22','2013-02-01 21:21:20.90303'),
('15:23:23','2008','2013-02-01 19:19:19','2013-01-01 12:12:19.19303');
SELECT c2 FROM t1 ORDER BY 1;
c2
35
36
20000101
20010101
20020201
20030301
20040401
20050501
20060601
20060602
20060603
20060604
20060605
20060608
20060609
DROP TABLE IF EXISTS t1;
CREATE TABLE t1(c1 TIME,
c2 DATE,
c3 YEAR,
c4 DATETIME,
c5 TIMESTAMP
);
INSERT INTO t1 VALUES('21:21:21','2000-01-01','2000','2000-01-01 21:21:21','2000-01-01 21:21:21.22343'),
('01:01:01','2001-01-01','2001','2001-01-01 01:01:01','2001-01-01 01:01:01.4343'),
('20:20:20','2002-02-01','2002','2002-02-01 21:21:21','2002-02-01 20:20:20.6243'),
('02:02:02','2003-03-01','2003','2003-03-01 01:01:01','2003-03-01 02:02:02.262343'),
('22:22:22','2004-04-01','2004','2004-04-01 21:21:21','2004-04-01 22:22:22.5243'),
('03:03:03','2005-05-01','2005','2005-05-01 01:01:01','2005-05-01 03:03:03.86343'),
('23:23:23','2006-06-01','2006','2006-06-01 21:21:21','2006-06-01 23:23:23.93343');
ALTER TABLE t1 MODIFY c3 BIGINT PRIMARY KEY AUTO_INCREMENT;
SHOW CREATE TABLE t1;
Table	Create Table
t1	CREATE TABLE `t1` (
  `c1` time DEFAULT NULL,
  `c2` date DEFAULT NULL,
  `c3` bigint(20) NOT NULL AUTO_INCREMENT,
  `c4` datetime DEFAULT NULL,
  `c5` timestamp NULL DEFAULT NULL,
  PRIMARY KEY (`c3`)
) ORGANIZATION INDEX AUTO_INCREMENT = 2007 AUTO_INCREMENT_MODE = 'ORDER' DEFAULT CHARSET = utf8mb4 ROW_FORMAT = DYNAMIC COMPRESSION = 'zstd_1.3.8' REPLICA_NUM = 1 BLOCK_SIZE = 16384 USE_BLOOM_FILTER = FALSE ENABLE_MACRO_BLOCK_BLOOM_FILTER = FALSE TABLET_SIZE = 134217728 PCTFREE = 0
SELECT c3 FROM t1 ORDER BY 1;
c3
2000
2001
2002
2003
2004
2005
2006
INSERT INTO t1 VALUES('22:23:23','2007-07-01',NULL,'2007-07-01 22:22:22','2007-07-01 20:20:20.90303'),
('21:23:23','2008-08-01',NULL,'2008-08-01 19:19:19','2008-08-01 19:19:19.19303'),
('20:23:23','2009-09-01',35,'2009-09-01 18:19:19','2009-09-01 18:19:19.19303'),
('19:23:23','2010-10-01',36,'2010-10-01 17:19:19','2010-10-01 17:19:19.19303'),
('18:23:23','2011-11-01',NULL,'2011-11-01 16:19:19','2011-11-01 16:19:19.19303'),
('17:23:23','2012-12-01',NULL,'2012-12-01 15:19:19','2012-12-01 15:19:19.19303');
SELECT c3 FROM t1 ORDER BY 1;
c3
35
36
2000
2001
2002
2003
2004
2005
2006
2007
2008
2009
2010
INSERT INTO t1(c1,c2,c4,c5) VALUES('16:23:23','2013-01-01','2013-01-01 22:22:22','2013-02-01 21:21:20.90303'),
('15:23:23','2014-02-01','2013-02-01 19:19:19','2013-01-01 12:12:19.19303');
SELECT c3 FROM t1 ORDER BY 1;
c3
35
36
2000
2001
2002
2003
2004
2005
2006
2007
2008
2009
2010
2013
2014
DROP TABLE IF EXISTS t1;
CREATE TABLE t1(c1 TIME,
c2 DATE,
c3 YEAR,
c4 DATETIME,
c5 TIMESTAMP
);
INSERT INTO t1 VALUES('21:21:21','2000-01-01','2000','2000-01-01 21:21:21','2000-01-01 21:21:21.22343'),
('01:01:01','2001-01-01','2001','2001-01-01 01:01:01','2001-01-01 01:01:01.4343'),
('20:20:20','2002-02-01','2002','2002-02-01 21:21:21','2002-02-01 20:20:20.6243'),
('02:02:02','2003-03-01','2003','2003-03-01 01:01:01','2003-03-01 02:02:02.262343'),
('22:22:22','2004-04-01','2004','2004-04-01 21:21:21','2004-04-01 22:22:22.5243'),
('03:03:03','2005-05-01','2005','2005-05-01 01:01:01','2005-05-01 03:03:03.86343'),
('23:23:23','2006-06-01','2006','2006-06-01 21:21:21','2006-06-01 23:23:23.93343');
ALTER TABLE t1 MODIFY c4 BIGINT PRIMARY KEY AUTO_INCREMENT;
SHOW CREATE TABLE t1;
Table	Create Table
t1	CREATE TABLE `t1` (
  `c1` time DEFAULT NULL,
  `c2` date DEFAULT NULL,
  `c3` year(4) DEFAULT NULL,
  `c4` bigint(20) NOT NULL AUTO_INCREMENT,
  `c5` timestamp NULL DEFAULT NULL,
  PRIMARY KEY (`c4`)
) ORGANIZATION INDEX AUTO_INCREMENT = 20060601212122 AUTO_INCREMENT_MODE = 'ORDER' DEFAULT CHARSET = utf8mb4 ROW_FORMAT = DYNAMIC COMPRESSION = 'zstd_1.3.8' REPLICA_NUM = 1 BLOCK_SIZE = 16384 USE_BLOOM_FILTER = FALSE ENABLE_MACRO_BLOCK_BLOOM_FILTER = FALSE TABLET_SIZE = 134217728 PCTFREE = 0
SELECT c4 FROM t1 ORDER BY 1;
c4
20000101212121
20010101010101
20020201212121
20030301010101
20040401212121
20050501010101
20060601212121
INSERT INTO t1 VALUES('22:23:23','2007-07-01','2007',NULL,'2007-07-01 20:20:20.90303'),
('21:23:23','2008-08-01','2008',NULL,'2008-08-01 19:19:19.19303'),
('20:23:23','2009-09-01','2009',35,'2009-09-01 18:19:19.19303'),
('19:23:23','2010-10-01','2010',36,'2010-10-01 17:19:19.19303'),
('18:23:23','2011-11-01','2011',NULL,'2011-11-01 16:19:19.19303'),
('17:23:23','2012-12-01','2012',NULL,'2012-12-01 15:19:19.19303');
SELECT c4 FROM t1 ORDER BY 1;
c4
35
36
20000101212121
20010101010101
20020201212121
20030301010101
20040401212121
20050501010101
20060601212121
20060601212122
20060601212123
20060601212124
20060601212125
INSERT INTO t1(c1,c2,c3,c5) VALUES('16:23:23','2013-01-01','2013','2013-02-01 21:21:20.90303'),
('15:23:23','2014-02-01','2014','2013-01-01 12:12:19.19303');
SELECT c4 FROM t1 ORDER BY 1;
c4
35
36
20000101212121
20010101010101
20020201212121
20030301010101
20040401212121
20050501010101
20060601212121
20060601212122
20060601212123
20060601212124
20060601212125
20060601212128
20060601212129
DROP TABLE IF EXISTS t1;
CREATE TABLE t1(c1 TIME,
c2 DATE,
c3 YEAR,
c4 DATETIME,
c5 TIMESTAMP
);
INSERT INTO t1 VALUES('21:21:21','2000-01-01','2000','2000-01-01 21:21:21','2000-01-01 21:21:21.22343'),
('01:01:01','2001-01-01','2001','2001-01-01 01:01:01','2001-01-01 01:01:01.4343'),
('20:20:20','2002-02-01','2002','2002-02-01 21:21:21','2002-02-01 20:20:20.6243'),
('02:02:02','2003-03-01','2003','2003-03-01 01:01:01','2003-03-01 02:02:02.262343'),
('22:22:22','2004-04-01','2004','2004-04-01 21:21:21','2004-04-01 22:22:22.5243'),
('03:03:03','2005-05-01','2005','2005-05-01 01:01:01','2005-05-01 03:03:03.86343'),
('23:23:23','2006-06-01','2006','2006-06-01 21:21:21','2006-06-01 23:23:23.93343');
ALTER TABLE t1 MODIFY c5 BIGINT PRIMARY KEY AUTO_INCREMENT;
SHOW CREATE TABLE t1;
Table	Create Table
t1	CREATE TABLE `t1` (
  `c1` time DEFAULT NULL,
  `c2` date DEFAULT NULL,
  `c3` year(4) DEFAULT NULL,
  `c4` datetime DEFAULT NULL,
  `c5` bigint(20) NOT NULL AUTO_INCREMENT,
  PRIMARY KEY (`c5`)
) ORGANIZATION INDEX AUTO_INCREMENT = 20060601232325 AUTO_INCREMENT_MODE = 'ORDER' DEFAULT CHARSET = utf8mb4 ROW_FORMAT = DYNAMIC COMPRESSION = 'zstd_1.3.8' REPLICA_NUM = 1 BLOCK_SIZE = 16384 USE_BLOOM_FILTER = FALSE ENABLE_MACRO_BLOCK_BLOOM_FILTER = FALSE TABLET_SIZE = 134217728 PCTFREE = 0
SELECT c5 FROM t1 ORDER BY 1;
c5
20000101212121
20010101010101
20020201202021
20030301020202
20040401222223
20050501030304
20060601232324
INSERT INTO t1 VALUES('22:23:23','2007-07-01','2007','2007-07-01 20:20:20',NULL),
('21:23:23','2008-08-01','2008','2008-08-01 19:19:19',NULL),
('20:23:23','2009-09-01','2009','2009-09-01 18:19:19',35),
('19:23:23','2010-10-01','2010','2010-10-01 17:19:19',36),
('18:23:23','2011-11-01','2011','2011-11-01 16:19:19',NULL),
('17:23:23','2012-12-01','2012','2012-12-01 15:19:19',NULL);
SELECT c5 FROM t1 ORDER BY 1;
c5
35
36
20000101212121
20010101010101
20020201202021
20030301020202
20040401222223
20050501030304
20060601232324
20060601232325
20060601232326
20060601232327
20060601232328
INSERT INTO t1(c1,c2,c3,c4) VALUES('16:23:23','2013-01-01','2013','2013-02-01 21:21:20'),
('15:23:23','2014-02-01','2014','2014-01-01 12:12:19');
SELECT c5 FROM t1 ORDER BY 1;
c5
35
36
20000101212121
20010101010101
20020201202021
20030301020202
20040401222223
20050501030304
20060601232324
20060601232325
20060601232326
20060601232327
20060601232328
20060601232331
20060601232332
DROP TABLE IF EXISTS t1;
CREATE TABLE t1(c0 INT(5),c1 INT(5));
INSERT INTO t1 VALUES(0,0),(2,1), (3,2),(NULL,3),(8,4),(10,5),(17,6),(NULL,7),(19,8),(11,9),(20,10),(22,11),(23,12);
ALTER TABLE t1 MODIFY c0 INT(6) ZEROFILL AUTO_INCREMENT COMMENT '修列属性和列备注、列顺序' AFTER c1;
SHOW CREATE TABLE t1;
Table	Create Table
t1	CREATE TABLE `t1` (
  `c1` int(5) DEFAULT NULL,
  `c0` int(6) unsigned zerofill NOT NULL AUTO_INCREMENT COMMENT '修列属性和列备注、列顺序'
) ORGANIZATION INDEX AUTO_INCREMENT = 24 AUTO_INCREMENT_MODE = 'ORDER' DEFAULT CHARSET = utf8mb4 ROW_FORMAT = DYNAMIC COMPRESSION = 'zstd_1.3.8' REPLICA_NUM = 1 BLOCK_SIZE = 16384 USE_BLOOM_FILTER = FALSE ENABLE_MACRO_BLOCK_BLOOM_FILTER = FALSE TABLET_SIZE = 134217728 PCTFREE = 0
#此处查询结果与MySQL显示不一致，为已知问题，开发在改。
#SELECT c0 FROM t1 ORDER BY 1;
INSERT INTO t1 VALUES(13,NULL),(14,NULL),(15,40),(16,41),(17,NULL),(18,NULL);
INSERT INTO t1(c1) VALUES(19),(20);
DROP TABLE IF EXISTS t1;
CREATE TABLE t1(c0 INT(5),c1 INT(5));
INSERT INTO t1 VALUES(0,0),(2,1), (4,2),(NULL,3),(8,4),(10,5),(17,6),(NULL,7),(19,8),(11,9),(20,10),(22,11),(23,12);
ALTER TABLE t1 MODIFY c0 INT(6) ZEROFILL AUTO_INCREMENT COMMENT '修列属性和列备注、列顺序' AFTER c1;
ALTER TABLE t1 CHANGE c0 m0 INT(6) ZEROFILL AUTO_INCREMENT COMMENT '修列属性和列备注、列顺序';
SHOW CREATE TABLE t1;
Table	Create Table
t1	CREATE TABLE `t1` (
  `c1` int(5) DEFAULT NULL,
  `m0` int(6) unsigned zerofill NOT NULL AUTO_INCREMENT COMMENT '修列属性和列备注、列顺序'
) ORGANIZATION INDEX AUTO_INCREMENT = 24 AUTO_INCREMENT_MODE = 'ORDER' DEFAULT CHARSET = utf8mb4 ROW_FORMAT = DYNAMIC COMPRESSION = 'zstd_1.3.8' REPLICA_NUM = 1 BLOCK_SIZE = 16384 USE_BLOOM_FILTER = FALSE ENABLE_MACRO_BLOCK_BLOOM_FILTER = FALSE TABLET_SIZE = 134217728 PCTFREE = 0
#此处查询结果与MySQL显示不一致，为已知问题，开发在改。
#SELECT m0 FROM t1 ORDER BY 1;
INSERT INTO t1 VALUES(13,NULL),(14,NULL),(15,40),(16,41),(17,NULL),(18,NULL);
INSERT INTO t1(c1) VALUES(19),(20);
SET sql_mode='STRICT_ALL_TABLES,NO_ZERO_IN_DATE';
DROP TABLE IF EXISTS t1;
CREATE TABLE t1(c0 INT(5));
INSERT INTO t1 VALUES(0),(0),(0),(0),(0);
ALTER TABLE t1 MODIFY c0 INT(5) PRIMARY KEY AUTO_INCREMENT;
SHOW CREATE TABLE t1;
Table	Create Table
t1	CREATE TABLE `t1` (
  `c0` int(5) NOT NULL AUTO_INCREMENT,
  PRIMARY KEY (`c0`)
) ORGANIZATION INDEX AUTO_INCREMENT = 8 AUTO_INCREMENT_MODE = 'ORDER' DEFAULT CHARSET = utf8mb4 ROW_FORMAT = DYNAMIC COMPRESSION = 'zstd_1.3.8' REPLICA_NUM = 1 BLOCK_SIZE = 16384 USE_BLOOM_FILTER = FALSE ENABLE_MACRO_BLOCK_BLOOM_FILTER = FALSE TABLET_SIZE = 134217728 PCTFREE = 0
SELECT * FROM t1 ORDER BY 1;
c0
1
2
3
4
5
INSERT INTO t1 VALUES(0),(0),(NULL),(NULL),(0),(0),(-5),(0),(0);
SELECT * FROM t1 ORDER BY 1;
c0
-5
1
2
3
4
5
8
9
10
11
12
13
14
15
#删除自增列后，修改普通列为自增列
DROP TABLE IF EXISTS t1;
CREATE TABLE t1(c0 INT(5) AUTO_INCREMENT,c1 INT(5));
INSERT INTO t1 VALUES(0,0),(2,2), (4,4),(NULL,5),(8,7),(10,8),(13,9),(NULL,11),(19,18),(11,19),(20,20),(22,31),(23,42);
ALTER TABLE t1 DROP c0,MODIFY c1 INT(5) PRIMARY KEY AUTO_INCREMENT,ADD c2 INT FIRST;
SHOW CREATE TABLE t1;
Table	Create Table
t1	CREATE TABLE `t1` (
  `c2` int(11) DEFAULT NULL,
  `c1` int(5) NOT NULL AUTO_INCREMENT,
  PRIMARY KEY (`c1`)
) ORGANIZATION INDEX AUTO_INCREMENT = 43 AUTO_INCREMENT_MODE = 'ORDER' DEFAULT CHARSET = utf8mb4 ROW_FORMAT = DYNAMIC COMPRESSION = 'zstd_1.3.8' REPLICA_NUM = 1 BLOCK_SIZE = 16384 USE_BLOOM_FILTER = FALSE ENABLE_MACRO_BLOCK_BLOOM_FILTER = FALSE TABLET_SIZE = 134217728 PCTFREE = 0
INSERT INTO t1 VALUES(1,NULL),(2,NULL),(3,-100),(4,200),(5,NULL),(6,NULL);
SELECT * FROM t1 ORDER BY 2;
c2	c1
3	-100
NULL	1
NULL	2
NULL	4
NULL	5
NULL	7
NULL	8
NULL	9
NULL	11
NULL	18
NULL	19
NULL	20
NULL	31
NULL	42
1	43
2	44
4	200
5	201
6	202
INSERT INTO t1(c2) VALUES(7),(8),(9);
SELECT * FROM t1 ORDER BY 2;
c2	c1
3	-100
NULL	1
NULL	2
NULL	4
NULL	5
NULL	7
NULL	8
NULL	9
NULL	11
NULL	18
NULL	19
NULL	20
NULL	31
NULL	42
1	43
2	44
4	200
5	201
6	202
7	203
8	204
9	205
DROP TABLE IF EXISTS t2;
DROP TABLE IF EXISTS t1;
#########Empty recycle bin, delete test database, tables, etc##########
purge recyclebin;
